library/src/blas3/Tensile/Logic/hip_lite/hip_Cijk_Alik_Bljk_HBH.yaml
- {MinimumRequiredVersion: 4.6.0}
- hip
- fallback
- [Device 0000]
    SolutionIndex: 0
    SolutionNameMin: Cijk_Alik_Bljk_HBH_MT064x032x08_TT04_02_WG16_16_01
    SolutionIndex: 1
    SolutionNameMin: Cijk_Alik_Bljk_HBH_MT128x032x16_TT08_02_WG16_16_01
    SolutionIndex: 2
    SolutionNameMin: Cijk_Alik_Bljk_HBH_MT064x016x16_TT08_02_WG08_08_01
    SolutionIndex: 3
    SolutionNameMin: Cijk_Alik_Bljk_HBH_MT128x032x16_TT08_02_WG16_16_01
    SolutionIndex: 4
    SolutionNameMin: Cijk_Alik_Bljk_HBH_MT032x128x16_TT02_08_WG16_16_01
    SolutionIndex: 5
    SolutionNameMin: Cijk_Alik_Bljk_HBH_MT064x016x16_TT08_02_WG08_08_01
    SolutionIndex: 6
    SolutionNameMin: Cijk_Alik_Bljk_HBH_MT064x032x08_TT04_02_WG16_16_01
    SolutionIndex: 7
    SolutionNameMin: Cijk_Alik_Bljk_HBH_MT128x032x16_TT08_02_WG16_16_01
    SolutionIndex: 8
    SolutionNameMin: Cijk_Alik_Bljk_HBH_MT064x016x16_TT08_02_WG08_08_01
    SolutionIndex: 9
    SolutionNameMin: Cijk_Alik_Bljk_HBH_MT128x032x16_TT08_02_WG16_16_01
    SolutionIndex: 10
    SolutionNameMin: Cijk_Alik_Bljk_HBH_MT032x128x16_TT02_08_WG16_16_01
    SolutionIndex: 11
    SolutionNameMin: Cijk_Alik_Bljk_HBH_MT064x016x16_TT08_02_WG08_08_01
- - - [128, 128, 2, 65]
    - [0, 129.877]
  - - [128, 1, 2, 64]
    - [5, 0.970645]
  - - [127, 127, 2, 1]
    - [4, 2.76181]
  - - [129, 129, 2, 63]
    - [0, 143.227]
  - - [127, 127, 2, 65]
    - [1, 119.679]
  - - [1, 127, 2, 64]
    - [3, 0.907143]
  - - [1, 128, 2, 64]
    - [5, 0.93945]
  - - [128, 129, 2, 1]
    - [3, 2.53252]
  - - [1, 128, 2, 63]
    - [5, 0.937674]
  - - [127, 1, 2, 63]
    - [3, 0.934696]
  - - [129, 1, 2, 64]
    - [3, 0.739785]
  - - [128, 1, 2, 63]
    - [5, 0.809659]
  - - [1, 129, 2, 65]
    - [5, 0.944283]
  - - [127, 129, 2, 1]
    - [3, 2.7305]
  - - [128, 128, 2, 64]
    - [0, 157.924]
  - - [128, 1, 2, 65]
    - [3, 0.707483]
  - - [1, 129, 2, 64]
    - [3, 0.905263]
  - - [1, 129, 2, 63]
    - [3, 0.953873]
  - - [1, 128, 2, 65]
    - [3, 0.941176]
  - - [129, 129, 2, 65]
    - [0, 126.366]
  - - [128, 128, 2, 1]
    - [3, 2.5442]
  - - [1, 1, 2, 1]
    - [4, 0.000112108]
  - - [129, 1, 2, 65]
    - [3, 0.748661]
  - - [127, 1, 2, 64]
    - [5, 0.94956]
  - - [127, 128, 2, 1]
    - [3, 3.35885]
  - - [129, 127, 2, 1]
    - [3, 2.25041]
  - - [127, 1, 2, 65]
    - [5, 0.964397]
  - - [128, 127, 2, 1]
    - [3, 1.99216]
  - - [127, 127, 2, 64]
    - [1, 104.058]
  - - [1, 127, 2, 65]
    - [5, 0.84928]
  - - [129, 1, 2, 63]
    - [3, 0.738835]
  - - [129, 129, 2, 1]
    - [3, 3.2502]
  - - [129, 129, 2, 64]
    - [0, 145.495]
  - - [127, 127, 2, 63]
    - [2, 88.8223]
  - - [1, 127, 2, 63]
    - [5, 0.847564]
  - - [128, 128, 2, 63]
    - [0, 127.75]
  - - [129, 128, 2, 1]
    - [3, 2.64615]
  - - [128, 128, 2, 65]
    - [6, 129.977]
  - - [128, 1, 2, 64]
    - [11, 1.070645]
  - - [127, 127, 2, 1]
    - [10, 2.86181]
  - - [129, 129, 2, 63]
    - [6, 143.327]
  - - [127, 127, 2, 65]
    - [7, 119.779]
  - - [1, 127, 2, 64]
    - [9, 1.007143]
  - - [1, 128, 2, 64]
    - [11, 1.03945]
  - - [128, 129, 2, 1]
    - [9, 2.63252]
  - - [1, 128, 2, 63]
    - [11, 1.037674]
  - - [127, 1, 2, 63]
    - [9, 1.034696]
  - - [129, 1, 2, 64]
    - [9, 0.839785]
  - - [128, 1, 2, 63]
    - [11, 0.909659]
  - - [1, 129, 2, 65]
    - [11, 1.044283]
  - - [127, 129, 2, 1]
    - [9, 2.8305]
  - - [128, 128, 2, 64]
    - [6, 158.024]
  - - [128, 1, 2, 65]
    - [9, 0.807483]
  - - [1, 129, 2, 64]
    - [9, 1.005263]
  - - [1, 129, 2, 63]
    - [9, 1.053873]
  - - [1, 128, 2, 65]
    - [9, 1.041176]
  - - [129, 129, 2, 65]
    - [6, 126.466]
  - - [128, 128, 2, 1]
    - [9, 2.6442]
  - - [1, 1, 2, 1]
    - [10, 0.100112108]
  - - [129, 1, 2, 65]
    - [9, 0.848661]
  - - [127, 1, 2, 64]
    - [11, 1.04956]
  - - [127, 128, 2, 1]
    - [9, 3.45885]
  - - [129, 127, 2, 1]
    - [9, 2.35041]
  - - [127, 1, 2, 65]
    - [11, 1.064397]
  - - [128, 127, 2, 1]
    - [9, 2.09216]
  - - [127, 127, 2, 64]
    - [7, 104.158]
  - - [1, 127, 2, 65]
    - [11, 0.94928]
  - - [129, 1, 2, 63]
    - [9, 0.838835]
  - - [129, 129, 2, 1]
    - [9, 3.3502]
  - - [129, 129, 2, 64]
    - [6, 145.595]
  - - [127, 127, 2, 63]
    - [8, 88.9223]
  - - [1, 127, 2, 63]
    - [11, 0.947564]
  - - [128, 128, 2, 63]
    - [6, 127.85]
  - - [129, 128, 2, 1]
    - [9, 2.74615]
- null
