library/src/blas3/Tensile/Logic/hip_lite/hip_Cijk_Ailk_Bjlk_BSS_BH.yaml
- {MinimumRequiredVersion: 4.23.0}
- hip
- fallback
- [Device 0000]
    SolutionIndex: 0
    SolutionNameMin: Cijk_Ailk_Bjlk_BSS_BH_MT64x32x8_SE_GSU1_NLCA1_NLCB1_TT4_2_WG16_16_1
    SolutionIndex: 1
    SolutionNameMin: Cijk_Ailk_Bjlk_BSS_BH_MT256x32x16_SE_GSU3_NLCA1_NLCB1_TT16_2_WG16_16_1
    SolutionIndex: 2
    SolutionNameMin: Cijk_Ailk_Bjlk_BSS_BH_MT64x16x16_SE_GSU3_NLCA1_NLCB1_TT8_2_WG8_8_1
    SolutionIndex: 3
    SolutionNameMin: Cijk_Ailk_Bjlk_BSS_BH_MT128x16x16_SE_GSU3_NLCA1_NLCB1_TT16_2_WG8_8_1
    SolutionIndex: 4
    SolutionNameMin: Cijk_Ailk_Bjlk_BSS_BH_MT128x32x16_SE_GSU1_NLCA1_NLCB1_TT8_2_WG16_16_1
    SolutionIndex: 5
    SolutionNameMin: Cijk_Ailk_Bjlk_BSS_BH_MT128x32x16_SE_GSU3_NLCA1_NLCB1_TT8_2_WG16_16_1
    SolutionIndex: 6
    SolutionNameMin: Cijk_Ailk_Bjlk_BSS_BH_MT256x32x16_SE_GSU3_NLCA1_NLCB1_TT16_2_WG16_16_1
    SolutionIndex: 7
    SolutionNameMin: Cijk_Ailk_Bjlk_BSS_BH_MT16x128x16_SE_GSU3_NLCA1_NLCB2_TT2_16_WG8_8_1
- - - [127, 127, 2, 63, 127, 127, 127, 127]
    - [2, 173.0]
  - - [128, 128, 2, 63, 128, 128, 128, 128]
    - [3, 177.0]
  - - [129, 129, 2, 63, 129, 129, 129, 129]
    - [1, 182.0]
  - - [127, 127, 2, 64, 127, 127, 127, 127]
    - [0, 188.0]
  - - [128, 128, 2, 64, 128, 128, 128, 128]
    - [1, 175.0]
  - - [129, 129, 2, 64, 129, 129, 129, 129]
    - [0, 203.0]
  - - [127, 127, 2, 65, 127, 127, 127, 127]
    - [0, 196.0]
  - - [128, 128, 2, 65, 128, 128, 128, 128]
    - [0, 199.0]
  - - [129, 129, 2, 65, 129, 129, 129, 129]
    - [0, 203.0]
  - - [1, 1, 2, 1, 1, 1, 1, 1]
    - [7, 0.00036231883253993763]
  - - [1, 127, 2, 63, 1, 1, 1, 127]
    - [5, 3.0]
  - - [1, 128, 2, 63, 1, 1, 1, 128]
    - [5, 3.0]
  - - [1, 129, 2, 63, 1, 1, 1, 129]
    - [5, 3.0]
  - - [1, 127, 2, 64, 1, 1, 1, 127]
    - [5, 3.0]
  - - [1, 128, 2, 64, 1, 1, 1, 128]
    - [5, 3.0]
  - - [1, 129, 2, 64, 1, 1, 1, 129]
    - [5, 3.0]
  - - [1, 127, 2, 65, 1, 1, 1, 127]
    - [5, 3.0]
  - - [1, 128, 2, 65, 1, 1, 1, 128]
    - [5, 3.0]
  - - [1, 129, 2, 65, 1, 1, 1, 129]
    - [5, 3.0]
  - - [127, 1, 2, 63, 127, 127, 127, 1]
    - [5, 3.0]
  - - [128, 1, 2, 63, 128, 128, 128, 1]
    - [5, 3.0]
  - - [129, 1, 2, 63, 129, 129, 129, 1]
    - [5, 3.0]
  - - [127, 1, 2, 64, 127, 127, 127, 1]
    - [5, 3.0]
  - - [128, 1, 2, 64, 128, 128, 128, 1]
    - [5, 3.0]
  - - [129, 1, 2, 64, 129, 129, 129, 1]
    - [5, 3.0]
  - - [127, 1, 2, 65, 127, 127, 127, 1]
    - [5, 3.0]
  - - [128, 1, 2, 65, 128, 128, 128, 1]
    - [5, 3.0]
  - - [129, 1, 2, 65, 129, 129, 129, 1]
    - [5, 3.0]
  - - [127, 127, 2, 1, 127, 127, 127, 127]
    - [6, 3.0]
  - - [128, 127, 2, 1, 128, 128, 128, 127]
    - [5, 3.0]
  - - [129, 127, 2, 1, 129, 129, 129, 127]
    - [5, 3.0]
  - - [127, 128, 2, 1, 127, 127, 127, 128]
    - [6, 3.0]
  - - [128, 128, 2, 1, 128, 128, 128, 128]
    - [5, 3.0]
  - - [129, 128, 2, 1, 129, 129, 129, 128]
    - [5, 3.0]
  - - [127, 129, 2, 1, 127, 127, 127, 129]
    - [4, 3.0]
  - - [128, 129, 2, 1, 128, 128, 128, 129]
    - [4, 3.0]
  - - [129, 129, 2, 1, 129, 129, 129, 129]
    - [4, 3.0]
- null
