library/src/blas3/Tensile/Logic/asm_full/hip/hip_Cijk_Alik_Bjlk_I8II_BH.yaml
- {MinimumRequiredVersion: 4.27.0}
- hip
- fallback
- [Device 0000]
    SolutionIndex: 0
    SolutionNameMin: Cijk_Alik_Bjlk_I8II_BH_MT32x32x8_SN_GRVW4_LRVW4_PGR1_PLR1_TT4_4_VW4_WG8_8_1
    SolutionIndex: 1
    SolutionNameMin: Cijk_Alik_Bjlk_I8II_BH_MT32x32x8_SN_GRVW4_LRVW4_PGR1_PLR0_TT4_4_VW4_WG8_8_1
    SolutionIndex: 2
    SolutionNameMin: Cijk_Alik_Bjlk_I8II_BH_MT32x32x8_SN_GRVW4_LRVW4_PGR0_PLR1_TT4_4_VW4_WG8_8_1
    SolutionIndex: 3
    SolutionNameMin: Cijk_Alik_Bjlk_I8II_BH_MT32x32x8_SN_GRVW4_LRVW4_PGR0_PLR0_TT4_4_VW4_WG8_8_1
    SolutionIndex: 4
    SolutionNameMin: Cijk_Alik_Bjlk_I8II_BH_MT32x64x8_SN_GRVW4_LRVW4_PGR1_PLR1_TT4_8_VW4_WG8_8_1
    SolutionIndex: 5
    SolutionNameMin: Cijk_Alik_Bjlk_I8II_BH_MT64x32x8_SN_GRVW4_LRVW4_PGR1_PLR0_TT8_4_VW4_WG8_8_1
    SolutionIndex: 6
    SolutionNameMin: Cijk_Alik_Bjlk_I8II_BH_MT32x32x16_SN_GRVW4_LRVW4_PGR0_PLR1_TT4_4_VW4_WG8_8_1
    SolutionIndex: 7
    SolutionNameMin: Cijk_Alik_Bjlk_I8II_BH_MT32x32x16_SN_GRVW4_LRVW4_PGR0_PLR0_TT4_4_VW4_WG8_8_1
    SolutionIndex: 8
    SolutionNameMin: Cijk_Alik_Bjlk_I8II_BH_MT32x64x16_SN_GRVW4_LRVW4_PGR1_PLR1_TT4_8_VW4_WG8_8_1
    SolutionIndex: 9
    SolutionNameMin: Cijk_Alik_Bjlk_I8II_BH_MT32x64x16_SN_GRVW4_LRVW4_PGR1_PLR0_TT4_8_VW4_WG8_8_1
    SolutionIndex: 10
    SolutionNameMin: Cijk_Alik_Bjlk_I8II_BH_MT32x64x16_SN_GRVW4_LRVW4_PGR0_PLR0_TT4_8_VW4_WG8_8_1
    SolutionIndex: 11
    SolutionNameMin: Cijk_Alik_Bjlk_I8II_BH_MT64x64x16_SN_GRVW4_LRVW4_PGR1_PLR1_TT4_4_VW4_WG16_16_1
    SolutionIndex: 12
    SolutionNameMin: Cijk_Alik_Bjlk_I8II_BH_MT32x32x32_SN_GRVW4_LRVW4_PGR0_PLR1_TT4_4_VW4_WG8_8_1
    SolutionIndex: 13
    SolutionNameMin: Cijk_Alik_Bjlk_I8II_BH_MT64x128x32_SN_GRVW4_LRVW4_PGR1_PLR1_TT4_8_VW4_WG16_16_1
    SolutionIndex: 14
    SolutionNameMin: Cijk_Alik_Bjlk_I8II_BH_MT8x8x8_SN_
- - - [32, 32, 1, 32]
    - [2, 8.0]
  - - [32, 32, 1, 64]
    - [2, 14.0]
  - - [32, 32, 1, 128]
    - [1, 20.0]
  - - [32, 32, 1, 256]
    - [1, 29.0]
  - - [32, 32, 1, 512]
    - [12, 37.0]
  - - [32, 32, 1, 1024]
    - [12, 45.0]
  - - [32, 64, 1, 32]
    - [2, 17.0]
  - - [32, 64, 1, 64]
    - [2, 28.0]
  - - [32, 64, 1, 128]
    - [1, 41.0]
  - - [32, 64, 1, 256]
    - [1, 59.0]
  - - [32, 64, 1, 512]
    - [12, 76.0]
  - - [32, 64, 1, 1024]
    - [12, 92.0]
  - - [32, 128, 1, 32]
    - [2, 34.0]
  - - [32, 128, 1, 64]
    - [2, 55.0]
  - - [32, 128, 1, 128]
    - [1, 84.0]
  - - [32, 128, 1, 256]
    - [1, 119.0]
  - - [32, 128, 1, 512]
    - [1, 149.0]
  - - [32, 128, 1, 1024]
    - [12, 180.0]
  - - [32, 256, 1, 32]
    - [3, 68.0]
  - - [32, 256, 1, 64]
    - [2, 111.0]
  - - [32, 256, 1, 128]
    - [1, 170.0]
  - - [32, 256, 1, 256]
    - [1, 239.0]
  - - [32, 256, 1, 512]
    - [12, 305.0]
  - - [32, 256, 1, 1024]
    - [12, 367.0]
  - - [32, 512, 1, 32]
    - [2, 137.0]
  - - [32, 512, 1, 64]
    - [2, 224.0]
  - - [32, 512, 1, 128]
    - [1, 340.0]
  - - [32, 512, 1, 256]
    - [1, 478.0]
  - - [32, 512, 1, 512]
    - [12, 614.0]
  - - [32, 512, 1, 1024]
    - [12, 740.0]
  - - [32, 1024, 1, 32]
    - [2, 273.0]
  - - [32, 1024, 1, 64]
    - [2, 446.0]
  - - [32, 1024, 1, 128]
    - [1, 679.0]
  - - [32, 1024, 1, 256]
    - [1, 949.0]
  - - [32, 1024, 1, 512]
    - [12, 1225.0]
  - - [32, 1024, 1, 1024]
    - [12, 1470.0]
  - - [64, 32, 1, 32]
    - [2, 17.0]
  - - [64, 32, 1, 64]
    - [2, 28.0]
  - - [64, 32, 1, 128]
    - [1, 41.0]
  - - [64, 32, 1, 256]
    - [1, 59.0]
  - - [64, 32, 1, 512]
    - [12, 78.0]
  - - [64, 32, 1, 1024]
    - [12, 94.0]
  - - [64, 64, 1, 32]
    - [2, 34.0]
  - - [64, 64, 1, 64]
    - [2, 55.0]
  - - [64, 64, 1, 128]
    - [1, 84.0]
  - - [64, 64, 1, 256]
    - [1, 119.0]
  - - [64, 64, 1, 512]
    - [12, 157.0]
  - - [64, 64, 1, 1024]
    - [12, 191.0]
  - - [64, 128, 1, 32]
    - [2, 68.0]
  - - [64, 128, 1, 64]
    - [2, 111.0]
  - - [64, 128, 1, 128]
    - [1, 170.0]
  - - [64, 128, 1, 256]
    - [1, 238.0]
  - - [64, 128, 1, 512]
    - [12, 308.0]
  - - [64, 128, 1, 1024]
    - [12, 378.0]
  - - [64, 256, 1, 32]
    - [2, 137.0]
  - - [64, 256, 1, 64]
    - [2, 222.0]
  - - [64, 256, 1, 128]
    - [1, 339.0]
  - - [64, 256, 1, 256]
    - [1, 476.0]
  - - [64, 256, 1, 512]
    - [12, 625.0]
  - - [64, 256, 1, 1024]
    - [12, 765.0]
  - - [64, 512, 1, 32]
    - [2, 273.0]
  - - [64, 512, 1, 64]
    - [2, 444.0]
  - - [64, 512, 1, 128]
    - [1, 679.0]
  - - [64, 512, 1, 256]
    - [1, 949.0]
  - - [64, 512, 1, 512]
    - [12, 1256.0]
  - - [64, 512, 1, 1024]
    - [12, 1527.0]
  - - [64, 1024, 1, 32]
    - [2, 538.0]
  - - [64, 1024, 1, 64]
    - [2, 881.0]
  - - [64, 1024, 1, 128]
    - [1, 1327.0]
  - - [64, 1024, 1, 256]
    - [6, 1785.0]
  - - [64, 1024, 1, 512]
    - [12, 2108.0]
  - - [64, 1024, 1, 1024]
    - [12, 2370.0]
  - - [128, 32, 1, 32]
    - [2, 34.0]
  - - [128, 32, 1, 64]
    - [2, 56.0]
  - - [128, 32, 1, 128]
    - [1, 83.0]
  - - [128, 32, 1, 256]
    - [1, 118.0]
  - - [128, 32, 1, 512]
    - [12, 155.0]
  - - [128, 32, 1, 1024]
    - [12, 193.0]
  - - [128, 64, 1, 32]
    - [2, 68.0]
  - - [128, 64, 1, 64]
    - [2, 112.0]
  - - [128, 64, 1, 128]
    - [1, 170.0]
  - - [128, 64, 1, 256]
    - [1, 239.0]
  - - [128, 64, 1, 512]
    - [12, 312.0]
  - - [128, 64, 1, 1024]
    - [12, 385.0]
  - - [128, 128, 1, 32]
    - [2, 136.0]
  - - [128, 128, 1, 64]
    - [2, 222.0]
  - - [128, 128, 1, 128]
    - [1, 340.0]
  - - [128, 128, 1, 256]
    - [1, 477.0]
  - - [128, 128, 1, 512]
    - [12, 625.0]
  - - [128, 128, 1, 1024]
    - [12, 752.0]
  - - [128, 256, 1, 32]
    - [2, 270.0]
  - - [128, 256, 1, 64]
    - [2, 444.0]
  - - [128, 256, 1, 128]
    - [1, 679.0]
  - - [128, 256, 1, 256]
    - [1, 953.0]
  - - [128, 256, 1, 512]
    - [12, 1239.0]
  - - [128, 256, 1, 1024]
    - [12, 1521.0]
  - - [128, 512, 1, 32]
    - [2, 541.0]
  - - [128, 512, 1, 64]
    - [2, 885.0]
  - - [128, 512, 1, 128]
    - [1, 1336.0]
  - - [128, 512, 1, 256]
    - [6, 1836.0]
  - - [128, 512, 1, 512]
    - [6, 2252.0]
  - - [128, 512, 1, 1024]
    - [12, 2393.0]
  - - [128, 1024, 1, 32]
    - [2, 989.0]
  - - [128, 1024, 1, 64]
    - [2, 1613.0]
  - - [128, 1024, 1, 128]
    - [1, 2317.0]
  - - [128, 1024, 1, 256]
    - [6, 2985.0]
  - - [128, 1024, 1, 512]
    - [6, 3417.0]
  - - [128, 1024, 1, 1024]
    - [6, 3716.0]
  - - [256, 32, 1, 32]
    - [3, 68.0]
  - - [256, 32, 1, 64]
    - [2, 112.0]
  - - [256, 32, 1, 128]
    - [1, 168.0]
  - - [256, 32, 1, 256]
    - [1, 237.0]
  - - [256, 32, 1, 512]
    - [12, 314.0]
  - - [256, 32, 1, 1024]
    - [12, 388.0]
  - - [256, 64, 1, 32]
    - [2, 137.0]
  - - [256, 64, 1, 64]
    - [2, 223.0]
  - - [256, 64, 1, 128]
    - [1, 340.0]
  - - [256, 64, 1, 256]
    - [1, 478.0]
  - - [256, 64, 1, 512]
    - [12, 632.0]
  - - [256, 64, 1, 1024]
    - [12, 773.0]
  - - [256, 128, 1, 32]
    - [2, 272.0]
  - - [256, 128, 1, 64]
    - [2, 444.0]
  - - [256, 128, 1, 128]
    - [1, 677.0]
  - - [256, 128, 1, 256]
    - [1, 951.0]
  - - [256, 128, 1, 512]
    - [12, 1230.0]
  - - [256, 128, 1, 1024]
    - [12, 1505.0]
  - - [256, 256, 1, 32]
    - [2, 527.0]
  - - [256, 256, 1, 64]
    - [3, 859.0]
  - - [256, 256, 1, 128]
    - [1, 1327.0]
  - - [256, 256, 1, 256]
    - [6, 1816.0]
  - - [256, 256, 1, 512]
    - [6, 2237.0]
  - - [256, 256, 1, 1024]
    - [6, 2446.0]
  - - [256, 512, 1, 32]
    - [2, 936.0]
  - - [256, 512, 1, 64]
    - [2, 1559.0]
  - - [256, 512, 1, 128]
    - [1, 2286.0]
  - - [256, 512, 1, 256]
    - [6, 2943.0]
  - - [256, 512, 1, 512]
    - [6, 3481.0]
  - - [256, 512, 1, 1024]
    - [6, 3710.0]
  - - [256, 1024, 1, 32]
    - [2, 1472.0]
  - - [256, 1024, 1, 64]
    - [6, 2317.0]
  - - [256, 1024, 1, 128]
    - [6, 3277.0]
  - - [256, 1024, 1, 256]
    - [6, 3839.0]
  - - [256, 1024, 1, 512]
    - [6, 4213.0]
  - - [256, 1024, 1, 1024]
    - [10, 4487.0]
  - - [512, 32, 1, 32]
    - [2, 137.0]
  - - [512, 32, 1, 64]
    - [2, 226.0]
  - - [512, 32, 1, 128]
    - [1, 336.0]
  - - [512, 32, 1, 256]
    - [1, 473.0]
  - - [512, 32, 1, 512]
    - [12, 628.0]
  - - [512, 32, 1, 1024]
    - [12, 776.0]
  - - [512, 64, 1, 32]
    - [2, 272.0]
  - - [512, 64, 1, 64]
    - [2, 446.0]
  - - [512, 64, 1, 128]
    - [1, 681.0]
  - - [512, 64, 1, 256]
    - [1, 953.0]
  - - [512, 64, 1, 512]
    - [12, 1258.0]
  - - [512, 64, 1, 1024]
    - [12, 1542.0]
  - - [512, 128, 1, 32]
    - [2, 541.0]
  - - [512, 128, 1, 64]
    - [2, 881.0]
  - - [512, 128, 1, 128]
    - [1, 1340.0]
  - - [512, 128, 1, 256]
    - [6, 1820.0]
  - - [512, 128, 1, 512]
    - [6, 2187.0]
  - - [512, 128, 1, 1024]
    - [6, 2376.0]
  - - [512, 256, 1, 32]
    - [2, 1054.0]
  - - [512, 256, 1, 64]
    - [2, 1705.0]
  - - [512, 256, 1, 128]
    - [6, 2356.0]
  - - [512, 256, 1, 256]
    - [6, 3001.0]
  - - [512, 256, 1, 512]
    - [6, 3463.0]
  - - [512, 256, 1, 1024]
    - [6, 3697.0]
  - - [512, 512, 1, 32]
    - [1, 1658.0]
  - - [512, 512, 1, 64]
    - [1, 2527.0]
  - - [512, 512, 1, 128]
    - [6, 3277.0]
  - - [512, 512, 1, 256]
    - [7, 3866.0]
  - - [512, 512, 1, 512]
    - [6, 4239.0]
  - - [512, 512, 1, 1024]
    - [10, 4461.0]
  - - [512, 1024, 1, 32]
    - [2, 2061.0]
  - - [512, 1024, 1, 64]
    - [10, 3067.0]
  - - [512, 1024, 1, 128]
    - [1, 4043.0]
  - - [512, 1024, 1, 256]
    - [9, 4609.0]
  - - [512, 1024, 1, 512]
    - [6, 5065.0]
  - - [512, 1024, 1, 1024]
    - [13, 5292.0]
  - - [1024, 32, 1, 32]
    - [2, 269.0]
  - - [1024, 32, 1, 64]
    - [2, 446.0]
  - - [1024, 32, 1, 128]
    - [1, 672.0]
  - - [1024, 32, 1, 256]
    - [1, 945.0]
  - - [1024, 32, 1, 512]
    - [12, 1243.0]
  - - [1024, 32, 1, 1024]
    - [12, 1517.0]
  - - [1024, 64, 1, 32]
    - [2, 538.0]
  - - [1024, 64, 1, 64]
    - [2, 877.0]
  - - [1024, 64, 1, 128]
    - [1, 1332.0]
  - - [1024, 64, 1, 256]
    - [7, 1816.0]
  - - [1024, 64, 1, 512]
    - [6, 2210.0]
  - - [1024, 64, 1, 1024]
    - [6, 2402.0]
  - - [1024, 128, 1, 32]
    - [2, 1028.0]
  - - [1024, 128, 1, 64]
    - [2, 1651.0]
  - - [1024, 128, 1, 128]
    - [7, 2363.0]
  - - [1024, 128, 1, 256]
    - [7, 2996.0]
  - - [1024, 128, 1, 512]
    - [7, 3431.0]
  - - [1024, 128, 1, 1024]
    - [7, 3667.0]
  - - [1024, 256, 1, 32]
    - [0, 1698.0]
  - - [1024, 256, 1, 64]
    - [0, 2417.0]
  - - [1024, 256, 1, 128]
    - [11, 3178.0]
  - - [1024, 256, 1, 256]
    - [6, 3741.0]
  - - [1024, 256, 1, 512]
    - [9, 4166.0]
  - - [1024, 256, 1, 1024]
    - [9, 4449.0]
  - - [1024, 512, 1, 32]
    - [4, 2124.0]
  - - [1024, 512, 1, 64]
    - [1, 3045.0]
  - - [1024, 512, 1, 128]
    - [5, 3906.0]
  - - [1024, 512, 1, 256]
    - [1, 4606.0]
  - - [1024, 512, 1, 512]
    - [7, 5021.0]
  - - [1024, 512, 1, 1024]
    - [13, 5290.0]
  - - [1024, 1024, 1, 32]
    - [1, 2834.0]
  - - [1024, 1024, 1, 64]
    - [1, 3906.0]
  - - [1024, 1024, 1, 128]
    - [9, 4811.0]
  - - [1024, 1024, 1, 256]
    - [8, 5397.0]
  - - [1024, 1024, 1, 512]
    - [9, 5794.0]
  - - [1024, 1024, 1, 1024]
    - [9, 6007.0]
  - - [1, 1, 1, 1]
    - [14, 0.0006666666608717707]
- null
- null
- DeviceEfficiency
