library/src/blas3/Tensile/Logic/asm_full/hip/hip_Cijk_Alik_Bljk_I8II_BH_GB.yaml
- {MinimumRequiredVersion: 4.27.0}
- hip
- fallback
- [Device 0000]
    SolutionIndex: 0
    SolutionNameMin: Cijk_Alik_Bljk_I8II_BH_GB_MT32x32x8_SN_GRVW4_LRVW4_PGR1_PLR1_TT4_4_VW4_WG8_8_1
    SolutionIndex: 1
    SolutionNameMin: Cijk_Alik_Bljk_I8II_BH_GB_MT32x32x8_SN_GRVW4_LRVW4_PGR1_PLR0_TT4_4_VW4_WG8_8_1
    SolutionIndex: 2
    SolutionNameMin: Cijk_Alik_Bljk_I8II_BH_GB_MT32x32x8_SN_GRVW4_LRVW4_PGR0_PLR1_TT4_4_VW4_WG8_8_1
    SolutionIndex: 3
    SolutionNameMin: Cijk_Alik_Bljk_I8II_BH_GB_MT32x32x8_SN_GRVW4_LRVW4_PGR0_PLR0_TT4_4_VW4_WG8_8_1
    SolutionIndex: 4
    SolutionNameMin: Cijk_Alik_Bljk_I8II_BH_GB_MT32x64x8_SN_GRVW4_LRVW4_PGR1_PLR1_TT4_8_VW4_WG8_8_1
    SolutionIndex: 5
    SolutionNameMin: Cijk_Alik_Bljk_I8II_BH_GB_MT64x32x8_SN_GRVW4_LRVW4_PGR1_PLR0_TT8_4_VW4_WG8_8_1
    SolutionIndex: 6
    SolutionNameMin: Cijk_Alik_Bljk_I8II_BH_GB_MT32x32x16_SN_GRVW4_LRVW4_PGR0_PLR1_TT4_4_VW4_WG8_8_1
    SolutionIndex: 7
    SolutionNameMin: Cijk_Alik_Bljk_I8II_BH_GB_MT32x32x16_SN_GRVW4_LRVW4_PGR0_PLR0_TT4_4_VW4_WG8_8_1
    SolutionIndex: 8
    SolutionNameMin: Cijk_Alik_Bljk_I8II_BH_GB_MT32x64x16_SN_GRVW4_LRVW4_PGR0_PLR1_TT4_8_VW4_WG8_8_1
    SolutionIndex: 9
    SolutionNameMin: Cijk_Alik_Bljk_I8II_BH_GB_MT64x32x16_SN_GRVW4_LRVW4_PGR0_PLR1_TT8_4_VW4_WG8_8_1
    SolutionIndex: 10
    SolutionNameMin: Cijk_Alik_Bljk_I8II_BH_GB_MT64x64x16_SN_GRVW4_LRVW4_PGR1_PLR1_TT4_4_VW4_WG16_16_1
    SolutionIndex: 11
    SolutionNameMin: Cijk_Alik_Bljk_I8II_BH_GB_MT128x64x16_SN_GRVW4_LRVW4_PGR1_PLR1_TT8_4_VW4_WG16_16_1
    SolutionIndex: 12
    SolutionNameMin: Cijk_Alik_Bljk_I8II_BH_GB_MT8x8x8_SN_
- - - [32, 32, 1, 32]
    - [2, 8.0]
  - - [32, 32, 1, 64]
    - [2, 14.0]
  - - [32, 32, 1, 128]
    - [1, 20.0]
  - - [32, 32, 1, 256]
    - [1, 29.0]
  - - [32, 32, 1, 512]
    - [1, 35.0]
  - - [32, 32, 1, 1024]
    - [1, 40.0]
  - - [32, 64, 1, 32]
    - [2, 17.0]
  - - [32, 64, 1, 64]
    - [2, 29.0]
  - - [32, 64, 1, 128]
    - [1, 41.0]
  - - [32, 64, 1, 256]
    - [1, 59.0]
  - - [32, 64, 1, 512]
    - [1, 71.0]
  - - [32, 64, 1, 1024]
    - [1, 82.0]
  - - [32, 128, 1, 32]
    - [2, 35.0]
  - - [32, 128, 1, 64]
    - [2, 58.0]
  - - [32, 128, 1, 128]
    - [1, 83.0]
  - - [32, 128, 1, 256]
    - [1, 117.0]
  - - [32, 128, 1, 512]
    - [1, 144.0]
  - - [32, 128, 1, 1024]
    - [1, 165.0]
  - - [32, 256, 1, 32]
    - [2, 70.0]
  - - [32, 256, 1, 64]
    - [2, 115.0]
  - - [32, 256, 1, 128]
    - [1, 167.0]
  - - [32, 256, 1, 256]
    - [1, 235.0]
  - - [32, 256, 1, 512]
    - [1, 289.0]
  - - [32, 256, 1, 1024]
    - [1, 330.0]
  - - [32, 512, 1, 32]
    - [3, 141.0]
  - - [32, 512, 1, 64]
    - [2, 233.0]
  - - [32, 512, 1, 128]
    - [6, 335.0]
  - - [32, 512, 1, 256]
    - [1, 469.0]
  - - [32, 512, 1, 512]
    - [1, 576.0]
  - - [32, 512, 1, 1024]
    - [1, 659.0]
  - - [32, 1024, 1, 32]
    - [3, 272.0]
  - - [32, 1024, 1, 64]
    - [2, 448.0]
  - - [32, 1024, 1, 128]
    - [1, 666.0]
  - - [32, 1024, 1, 256]
    - [1, 936.0]
  - - [32, 1024, 1, 512]
    - [1, 1149.0]
  - - [32, 1024, 1, 1024]
    - [1, 1308.0]
  - - [64, 32, 1, 32]
    - [2, 17.0]
  - - [64, 32, 1, 64]
    - [2, 28.0]
  - - [64, 32, 1, 128]
    - [1, 41.0]
  - - [64, 32, 1, 256]
    - [1, 58.0]
  - - [64, 32, 1, 512]
    - [1, 72.0]
  - - [64, 32, 1, 1024]
    - [1, 82.0]
  - - [64, 64, 1, 32]
    - [2, 35.0]
  - - [64, 64, 1, 64]
    - [2, 57.0]
  - - [64, 64, 1, 128]
    - [1, 83.0]
  - - [64, 64, 1, 256]
    - [1, 117.0]
  - - [64, 64, 1, 512]
    - [1, 145.0]
  - - [64, 64, 1, 1024]
    - [1, 166.0]
  - - [64, 128, 1, 32]
    - [2, 70.0]
  - - [64, 128, 1, 64]
    - [2, 115.0]
  - - [64, 128, 1, 128]
    - [1, 168.0]
  - - [64, 128, 1, 256]
    - [1, 235.0]
  - - [64, 128, 1, 512]
    - [1, 290.0]
  - - [64, 128, 1, 1024]
    - [1, 333.0]
  - - [64, 256, 1, 32]
    - [3, 141.0]
  - - [64, 256, 1, 64]
    - [2, 232.0]
  - - [64, 256, 1, 128]
    - [6, 334.0]
  - - [64, 256, 1, 256]
    - [1, 469.0]
  - - [64, 256, 1, 512]
    - [1, 579.0]
  - - [64, 256, 1, 1024]
    - [1, 664.0]
  - - [64, 512, 1, 32]
    - [2, 272.0]
  - - [64, 512, 1, 64]
    - [3, 452.0]
  - - [64, 512, 1, 128]
    - [1, 666.0]
  - - [64, 512, 1, 256]
    - [1, 934.0]
  - - [64, 512, 1, 512]
    - [1, 1155.0]
  - - [64, 512, 1, 1024]
    - [1, 1320.0]
  - - [64, 1024, 1, 32]
    - [2, 535.0]
  - - [64, 1024, 1, 64]
    - [3, 881.0]
  - - [64, 1024, 1, 128]
    - [1, 1287.0]
  - - [64, 1024, 1, 256]
    - [1, 1681.0]
  - - [64, 1024, 1, 512]
    - [1, 1965.0]
  - - [64, 1024, 1, 1024]
    - [1, 2089.0]
  - - [128, 32, 1, 32]
    - [2, 34.0]
  - - [128, 32, 1, 64]
    - [2, 57.0]
  - - [128, 32, 1, 128]
    - [1, 82.0]
  - - [128, 32, 1, 256]
    - [1, 117.0]
  - - [128, 32, 1, 512]
    - [1, 145.0]
  - - [128, 32, 1, 1024]
    - [1, 166.0]
  - - [128, 64, 1, 32]
    - [2, 70.0]
  - - [128, 64, 1, 64]
    - [2, 115.0]
  - - [128, 64, 1, 128]
    - [1, 166.0]
  - - [128, 64, 1, 256]
    - [1, 235.0]
  - - [128, 64, 1, 512]
    - [1, 290.0]
  - - [128, 64, 1, 1024]
    - [1, 334.0]
  - - [128, 128, 1, 32]
    - [2, 140.0]
  - - [128, 128, 1, 64]
    - [3, 233.0]
  - - [128, 128, 1, 128]
    - [1, 334.0]
  - - [128, 128, 1, 256]
    - [1, 468.0]
  - - [128, 128, 1, 512]
    - [1, 579.0]
  - - [128, 128, 1, 1024]
    - [1, 665.0]
  - - [128, 256, 1, 32]
    - [2, 270.0]
  - - [128, 256, 1, 64]
    - [2, 452.0]
  - - [128, 256, 1, 128]
    - [1, 666.0]
  - - [128, 256, 1, 256]
    - [1, 938.0]
  - - [128, 256, 1, 512]
    - [1, 1155.0]
  - - [128, 256, 1, 1024]
    - [1, 1321.0]
  - - [128, 512, 1, 32]
    - [2, 538.0]
  - - [128, 512, 1, 64]
    - [3, 881.0]
  - - [128, 512, 1, 128]
    - [1, 1291.0]
  - - [128, 512, 1, 256]
    - [1, 1681.0]
  - - [128, 512, 1, 512]
    - [1, 1971.0]
  - - [128, 512, 1, 1024]
    - [1, 2154.0]
  - - [128, 1024, 1, 32]
    - [2, 980.0]
  - - [128, 1024, 1, 64]
    - [2, 1577.0]
  - - [128, 1024, 1, 128]
    - [1, 2208.0]
  - - [128, 1024, 1, 256]
    - [1, 2719.0]
  - - [128, 1024, 1, 512]
    - [6, 3042.0]
  - - [128, 1024, 1, 1024]
    - [6, 3267.0]
  - - [256, 32, 1, 32]
    - [2, 69.0]
  - - [256, 32, 1, 64]
    - [2, 114.0]
  - - [256, 32, 1, 128]
    - [1, 166.0]
  - - [256, 32, 1, 256]
    - [1, 233.0]
  - - [256, 32, 1, 512]
    - [1, 290.0]
  - - [256, 32, 1, 1024]
    - [1, 332.0]
  - - [256, 64, 1, 32]
    - [3, 140.0]
  - - [256, 64, 1, 64]
    - [2, 231.0]
  - - [256, 64, 1, 128]
    - [6, 334.0]
  - - [256, 64, 1, 256]
    - [1, 469.0]
  - - [256, 64, 1, 512]
    - [1, 580.0]
  - - [256, 64, 1, 1024]
    - [1, 665.0]
  - - [256, 128, 1, 32]
    - [2, 270.0]
  - - [256, 128, 1, 64]
    - [2, 450.0]
  - - [256, 128, 1, 128]
    - [1, 666.0]
  - - [256, 128, 1, 256]
    - [1, 936.0]
  - - [256, 128, 1, 512]
    - [1, 1155.0]
  - - [256, 128, 1, 1024]
    - [1, 1320.0]
  - - [256, 256, 1, 32]
    - [2, 535.0]
  - - [256, 256, 1, 64]
    - [2, 889.0]
  - - [256, 256, 1, 128]
    - [1, 1283.0]
  - - [256, 256, 1, 256]
    - [1, 1691.0]
  - - [256, 256, 1, 512]
    - [1, 1985.0]
  - - [256, 256, 1, 1024]
    - [1, 2163.0]
  - - [256, 512, 1, 32]
    - [2, 962.0]
  - - [256, 512, 1, 64]
    - [3, 1542.0]
  - - [256, 512, 1, 128]
    - [1, 2190.0]
  - - [256, 512, 1, 256]
    - [1, 2755.0]
  - - [256, 512, 1, 512]
    - [6, 3050.0]
  - - [256, 512, 1, 1024]
    - [6, 3290.0]
  - - [256, 1024, 1, 32]
    - [2, 1461.0]
  - - [256, 1024, 1, 64]
    - [3, 2330.0]
  - - [256, 1024, 1, 128]
    - [6, 3095.0]
  - - [256, 1024, 1, 256]
    - [6, 3631.0]
  - - [256, 1024, 1, 512]
    - [6, 3964.0]
  - - [256, 1024, 1, 1024]
    - [6, 4116.0]
  - - [512, 32, 1, 32]
    - [3, 139.0]
  - - [512, 32, 1, 64]
    - [3, 230.0]
  - - [512, 32, 1, 128]
    - [1, 331.0]
  - - [512, 32, 1, 256]
    - [1, 467.0]
  - - [512, 32, 1, 512]
    - [1, 579.0]
  - - [512, 32, 1, 1024]
    - [1, 667.0]
  - - [512, 64, 1, 32]
    - [2, 272.0]
  - - [512, 64, 1, 64]
    - [3, 448.0]
  - - [512, 64, 1, 128]
    - [1, 666.0]
  - - [512, 64, 1, 256]
    - [1, 934.0]
  - - [512, 64, 1, 512]
    - [1, 1160.0]
  - - [512, 64, 1, 1024]
    - [1, 1322.0]
  - - [512, 128, 1, 32]
    - [2, 541.0]
  - - [512, 128, 1, 64]
    - [2, 881.0]
  - - [512, 128, 1, 128]
    - [1, 1291.0]
  - - [512, 128, 1, 256]
    - [1, 1684.0]
  - - [512, 128, 1, 512]
    - [1, 1983.0]
  - - [512, 128, 1, 1024]
    - [1, 2129.0]
  - - [512, 256, 1, 32]
    - [2, 985.0]
  - - [512, 256, 1, 64]
    - [2, 1565.0]
  - - [512, 256, 1, 128]
    - [1, 2208.0]
  - - [512, 256, 1, 256]
    - [1, 2710.0]
  - - [512, 256, 1, 512]
    - [1, 3073.0]
  - - [512, 256, 1, 1024]
    - [6, 3282.0]
  - - [512, 512, 1, 32]
    - [2, 1571.0]
  - - [512, 512, 1, 64]
    - [2, 2383.0]
  - - [512, 512, 1, 128]
    - [6, 3084.0]
  - - [512, 512, 1, 256]
    - [6, 3659.0]
  - - [512, 512, 1, 512]
    - [6, 3938.0]
  - - [512, 512, 1, 1024]
    - [6, 4166.0]
  - - [512, 1024, 1, 32]
    - [3, 2237.0]
  - - [512, 1024, 1, 64]
    - [3, 3190.0]
  - - [512, 1024, 1, 128]
    - [4, 3844.0]
  - - [512, 1024, 1, 256]
    - [7, 4318.0]
  - - [512, 1024, 1, 512]
    - [7, 4825.0]
  - - [512, 1024, 1, 1024]
    - [11, 4864.0]
  - - [1024, 32, 1, 32]
    - [2, 263.0]
  - - [1024, 32, 1, 64]
    - [2, 441.0]
  - - [1024, 32, 1, 128]
    - [1, 655.0]
  - - [1024, 32, 1, 256]
    - [1, 924.0]
  - - [1024, 32, 1, 512]
    - [1, 1151.0]
  - - [1024, 32, 1, 1024]
    - [1, 1328.0]
  - - [1024, 64, 1, 32]
    - [3, 490.0]
  - - [1024, 64, 1, 64]
    - [2, 826.0]
  - - [1024, 64, 1, 128]
    - [1, 1256.0]
  - - [1024, 64, 1, 256]
    - [1, 1645.0]
  - - [1024, 64, 1, 512]
    - [1, 1962.0]
  - - [1024, 64, 1, 1024]
    - [1, 2163.0]
  - - [1024, 128, 1, 32]
    - [3, 936.0]
  - - [1024, 128, 1, 64]
    - [3, 1493.0]
  - - [1024, 128, 1, 128]
    - [0, 2173.0]
  - - [1024, 128, 1, 256]
    - [0, 2710.0]
  - - [1024, 128, 1, 512]
    - [0, 3037.0]
  - - [1024, 128, 1, 1024]
    - [6, 3280.0]
  - - [1024, 256, 1, 32]
    - [3, 1509.0]
  - - [1024, 256, 1, 64]
    - [1, 2280.0]
  - - [1024, 256, 1, 128]
    - [10, 3017.0]
  - - [1024, 256, 1, 256]
    - [10, 3536.0]
  - - [1024, 256, 1, 512]
    - [10, 3888.0]
  - - [1024, 256, 1, 1024]
    - [10, 4100.0]
  - - [1024, 512, 1, 32]
    - [2, 2087.0]
  - - [1024, 512, 1, 64]
    - [0, 3067.0]
  - - [1024, 512, 1, 128]
    - [6, 3762.0]
  - - [1024, 512, 1, 256]
    - [6, 4415.0]
  - - [1024, 512, 1, 512]
    - [6, 4649.0]
  - - [1024, 512, 1, 1024]
    - [6, 4861.0]
  - - [1024, 1024, 1, 32]
    - [1, 2928.0]
  - - [1024, 1024, 1, 64]
    - [1, 4014.0]
  - - [1024, 1024, 1, 128]
    - [5, 4651.0]
  - - [1024, 1024, 1, 256]
    - [9, 5164.0]
  - - [1024, 1024, 1, 512]
    - [9, 5391.0]
  - - [1024, 1024, 1, 1024]
    - [8, 5591.0]
  - - [1, 1, 1, 1]
    - [12, 0.0005263157805990317]
- null
- null
- DeviceEfficiency
