library/src/blas3/Tensile/Logic/asm_full/hip/hip_Cijk_Ailk_Bljk_I8II_BH_GB.yaml
- {MinimumRequiredVersion: 4.27.0}
- hip
- fallback
- [Device 0000]
    SolutionIndex: 0
    SolutionNameMin: Cijk_Ailk_Bljk_I8II_BH_GB_MT32x32x8_SN_GRVW4_LRVW4_PGR1_PLR1_TT4_4_VW4_WG8_8_1
    SolutionIndex: 1
    SolutionNameMin: Cijk_Ailk_Bljk_I8II_BH_GB_MT32x32x8_SN_GRVW4_LRVW4_PGR1_PLR0_TT4_4_VW4_WG8_8_1
    SolutionIndex: 2
    SolutionNameMin: Cijk_Ailk_Bljk_I8II_BH_GB_MT32x32x8_SN_GRVW4_LRVW4_PGR0_PLR1_TT4_4_VW4_WG8_8_1
    SolutionIndex: 3
    SolutionNameMin: Cijk_Ailk_Bljk_I8II_BH_GB_MT32x32x8_SN_GRVW4_LRVW4_PGR0_PLR0_TT4_4_VW4_WG8_8_1
    SolutionIndex: 4
    SolutionNameMin: Cijk_Ailk_Bljk_I8II_BH_GB_MT32x32x16_SN_GRVW4_LRVW4_PGR0_PLR1_TT4_4_VW4_WG8_8_1
    SolutionIndex: 5
    SolutionNameMin: Cijk_Ailk_Bljk_I8II_BH_GB_MT32x32x16_SN_GRVW4_LRVW4_PGR0_PLR0_TT4_4_VW4_WG8_8_1
    SolutionIndex: 6
    SolutionNameMin: Cijk_Ailk_Bljk_I8II_BH_GB_MT64x32x16_SN_GRVW4_LRVW4_PGR1_PLR0_TT8_4_VW4_WG8_8_1
    SolutionIndex: 7
    SolutionNameMin: Cijk_Ailk_Bljk_I8II_BH_GB_MT64x64x16_SN_GRVW4_LRVW4_PGR1_PLR1_TT4_4_VW4_WG16_16_1
    SolutionIndex: 8
    SolutionNameMin: Cijk_Ailk_Bljk_I8II_BH_GB_MT64x64x16_SN_GRVW4_LRVW4_PGR0_PLR1_TT4_4_VW4_WG16_16_1
    SolutionIndex: 9
    SolutionNameMin: Cijk_Ailk_Bljk_I8II_BH_GB_MT32x32x32_SN_GRVW4_LRVW4_PGR0_PLR1_TT4_4_VW4_WG8_8_1
    SolutionIndex: 10
    SolutionNameMin: Cijk_Ailk_Bljk_I8II_BH_GB_MT128x64x32_SN_GRVW4_LRVW4_PGR1_PLR0_TT8_4_VW4_WG16_16_1
    SolutionIndex: 11
    SolutionNameMin: Cijk_Ailk_Bljk_I8II_BH_GB_MT8x8x8_SN_
- - - [32, 32, 1, 32]
    - [8, 9.0]
  - - [32, 32, 1, 64]
    - [2, 14.0]
  - - [32, 32, 1, 128]
    - [1, 21.0]
  - - [32, 32, 1, 256]
    - [1, 29.0]
  - - [32, 32, 1, 512]
    - [9, 38.0]
  - - [32, 32, 1, 1024]
    - [9, 45.0]
  - - [32, 64, 1, 32]
    - [2, 18.0]
  - - [32, 64, 1, 64]
    - [2, 29.0]
  - - [32, 64, 1, 128]
    - [4, 43.0]
  - - [32, 64, 1, 256]
    - [1, 60.0]
  - - [32, 64, 1, 512]
    - [9, 76.0]
  - - [32, 64, 1, 1024]
    - [9, 91.0]
  - - [32, 128, 1, 32]
    - [3, 37.0]
  - - [32, 128, 1, 64]
    - [3, 59.0]
  - - [32, 128, 1, 128]
    - [5, 88.0]
  - - [32, 128, 1, 256]
    - [1, 120.0]
  - - [32, 128, 1, 512]
    - [9, 153.0]
  - - [32, 128, 1, 1024]
    - [9, 182.0]
  - - [32, 256, 1, 32]
    - [3, 74.0]
  - - [32, 256, 1, 64]
    - [3, 118.0]
  - - [32, 256, 1, 128]
    - [5, 176.0]
  - - [32, 256, 1, 256]
    - [5, 242.0]
  - - [32, 256, 1, 512]
    - [9, 308.0]
  - - [32, 256, 1, 1024]
    - [9, 365.0]
  - - [32, 512, 1, 32]
    - [3, 148.0]
  - - [32, 512, 1, 64]
    - [3, 236.0]
  - - [32, 512, 1, 128]
    - [5, 353.0]
  - - [32, 512, 1, 256]
    - [5, 483.0]
  - - [32, 512, 1, 512]
    - [9, 615.0]
  - - [32, 512, 1, 1024]
    - [9, 725.0]
  - - [32, 1024, 1, 32]
    - [3, 295.0]
  - - [32, 1024, 1, 64]
    - [3, 470.0]
  - - [32, 1024, 1, 128]
    - [5, 704.0]
  - - [32, 1024, 1, 256]
    - [5, 964.0]
  - - [32, 1024, 1, 512]
    - [9, 1219.0]
  - - [32, 1024, 1, 1024]
    - [9, 1435.0]
  - - [64, 32, 1, 32]
    - [2, 18.0]
  - - [64, 32, 1, 64]
    - [3, 29.0]
  - - [64, 32, 1, 128]
    - [1, 42.0]
  - - [64, 32, 1, 256]
    - [1, 59.0]
  - - [64, 32, 1, 512]
    - [9, 79.0]
  - - [64, 32, 1, 1024]
    - [9, 93.0]
  - - [64, 64, 1, 32]
    - [3, 37.0]
  - - [64, 64, 1, 64]
    - [2, 58.0]
  - - [64, 64, 1, 128]
    - [5, 87.0]
  - - [64, 64, 1, 256]
    - [1, 120.0]
  - - [64, 64, 1, 512]
    - [9, 158.0]
  - - [64, 64, 1, 1024]
    - [9, 188.0]
  - - [64, 128, 1, 32]
    - [3, 74.0]
  - - [64, 128, 1, 64]
    - [2, 117.0]
  - - [64, 128, 1, 128]
    - [5, 175.0]
  - - [64, 128, 1, 256]
    - [1, 241.0]
  - - [64, 128, 1, 512]
    - [9, 313.0]
  - - [64, 128, 1, 1024]
    - [9, 376.0]
  - - [64, 256, 1, 32]
    - [3, 148.0]
  - - [64, 256, 1, 64]
    - [3, 235.0]
  - - [64, 256, 1, 128]
    - [5, 353.0]
  - - [64, 256, 1, 256]
    - [5, 483.0]
  - - [64, 256, 1, 512]
    - [9, 630.0]
  - - [64, 256, 1, 1024]
    - [9, 752.0]
  - - [64, 512, 1, 32]
    - [3, 295.0]
  - - [64, 512, 1, 64]
    - [2, 466.0]
  - - [64, 512, 1, 128]
    - [5, 699.0]
  - - [64, 512, 1, 256]
    - [5, 960.0]
  - - [64, 512, 1, 512]
    - [9, 1252.0]
  - - [64, 512, 1, 1024]
    - [9, 1470.0]
  - - [64, 1024, 1, 32]
    - [3, 564.0]
  - - [64, 1024, 1, 64]
    - [2, 896.0]
  - - [64, 1024, 1, 128]
    - [5, 1357.0]
  - - [64, 1024, 1, 256]
    - [5, 1868.0]
  - - [64, 1024, 1, 512]
    - [5, 2219.0]
  - - [64, 1024, 1, 1024]
    - [9, 2325.0]
  - - [128, 32, 1, 32]
    - [2, 35.0]
  - - [128, 32, 1, 64]
    - [2, 56.0]
  - - [128, 32, 1, 128]
    - [1, 85.0]
  - - [128, 32, 1, 256]
    - [1, 118.0]
  - - [128, 32, 1, 512]
    - [9, 156.0]
  - - [128, 32, 1, 1024]
    - [9, 189.0]
  - - [128, 64, 1, 32]
    - [3, 73.0]
  - - [128, 64, 1, 64]
    - [3, 116.0]
  - - [128, 64, 1, 128]
    - [1, 174.0]
  - - [128, 64, 1, 256]
    - [1, 241.0]
  - - [128, 64, 1, 512]
    - [9, 309.0]
  - - [128, 64, 1, 1024]
    - [9, 374.0]
  - - [128, 128, 1, 32]
    - [2, 146.0]
  - - [128, 128, 1, 64]
    - [3, 234.0]
  - - [128, 128, 1, 128]
    - [1, 348.0]
  - - [128, 128, 1, 256]
    - [1, 480.0]
  - - [128, 128, 1, 512]
    - [9, 616.0]
  - - [128, 128, 1, 1024]
    - [9, 745.0]
  - - [128, 256, 1, 32]
    - [2, 290.0]
  - - [128, 256, 1, 64]
    - [3, 464.0]
  - - [128, 256, 1, 128]
    - [1, 694.0]
  - - [128, 256, 1, 256]
    - [1, 958.0]
  - - [128, 256, 1, 512]
    - [9, 1226.0]
  - - [128, 256, 1, 1024]
    - [9, 1487.0]
  - - [128, 512, 1, 32]
    - [2, 570.0]
  - - [128, 512, 1, 64]
    - [3, 904.0]
  - - [128, 512, 1, 128]
    - [1, 1340.0]
  - - [128, 512, 1, 256]
    - [5, 1836.0]
  - - [128, 512, 1, 512]
    - [5, 2196.0]
  - - [128, 512, 1, 1024]
    - [5, 2356.0]
  - - [128, 1024, 1, 32]
    - [3, 1033.0]
  - - [128, 1024, 1, 64]
    - [2, 1638.0]
  - - [128, 1024, 1, 128]
    - [1, 2317.0]
  - - [128, 1024, 1, 256]
    - [5, 2933.0]
  - - [128, 1024, 1, 512]
    - [5, 3400.0]
  - - [128, 1024, 1, 1024]
    - [5, 3560.0]
  - - [256, 32, 1, 32]
    - [3, 72.0]
  - - [256, 32, 1, 64]
    - [2, 113.0]
  - - [256, 32, 1, 128]
    - [1, 171.0]
  - - [256, 32, 1, 256]
    - [1, 238.0]
  - - [256, 32, 1, 512]
    - [9, 313.0]
  - - [256, 32, 1, 1024]
    - [9, 380.0]
  - - [256, 64, 1, 32]
    - [3, 147.0]
  - - [256, 64, 1, 64]
    - [2, 231.0]
  - - [256, 64, 1, 128]
    - [1, 348.0]
  - - [256, 64, 1, 256]
    - [1, 481.0]
  - - [256, 64, 1, 512]
    - [9, 630.0]
  - - [256, 64, 1, 1024]
    - [9, 763.0]
  - - [256, 128, 1, 32]
    - [2, 290.0]
  - - [256, 128, 1, 64]
    - [3, 458.0]
  - - [256, 128, 1, 128]
    - [1, 694.0]
  - - [256, 128, 1, 256]
    - [1, 960.0]
  - - [256, 128, 1, 512]
    - [9, 1235.0]
  - - [256, 128, 1, 1024]
    - [9, 1490.0]
  - - [256, 256, 1, 32]
    - [2, 567.0]
  - - [256, 256, 1, 64]
    - [2, 892.0]
  - - [256, 256, 1, 128]
    - [1, 1353.0]
  - - [256, 256, 1, 256]
    - [5, 1844.0]
  - - [256, 256, 1, 512]
    - [5, 2252.0]
  - - [256, 256, 1, 1024]
    - [9, 2330.0]
  - - [256, 512, 1, 32]
    - [3, 966.0]
  - - [256, 512, 1, 64]
    - [1, 1520.0]
  - - [256, 512, 1, 128]
    - [0, 2225.0]
  - - [256, 512, 1, 256]
    - [5, 2844.0]
  - - [256, 512, 1, 512]
    - [5, 3400.0]
  - - [256, 512, 1, 1024]
    - [5, 3591.0]
  - - [256, 1024, 1, 32]
    - [3, 1467.0]
  - - [256, 1024, 1, 64]
    - [4, 2397.0]
  - - [256, 1024, 1, 128]
    - [5, 3239.0]
  - - [256, 1024, 1, 256]
    - [6, 3902.0]
  - - [256, 1024, 1, 512]
    - [6, 4380.0]
  - - [256, 1024, 1, 1024]
    - [6, 4688.0]
  - - [512, 32, 1, 32]
    - [2, 142.0]
  - - [512, 32, 1, 64]
    - [2, 227.0]
  - - [512, 32, 1, 128]
    - [1, 342.0]
  - - [512, 32, 1, 256]
    - [1, 473.0]
  - - [512, 32, 1, 512]
    - [9, 616.0]
  - - [512, 32, 1, 1024]
    - [9, 748.0]
  - - [512, 64, 1, 32]
    - [3, 290.0]
  - - [512, 64, 1, 64]
    - [3, 460.0]
  - - [512, 64, 1, 128]
    - [1, 697.0]
  - - [512, 64, 1, 256]
    - [1, 960.0]
  - - [512, 64, 1, 512]
    - [5, 1204.0]
  - - [512, 64, 1, 1024]
    - [9, 1481.0]
  - - [512, 128, 1, 32]
    - [3, 579.0]
  - - [512, 128, 1, 64]
    - [2, 916.0]
  - - [512, 128, 1, 128]
    - [1, 1375.0]
  - - [512, 128, 1, 256]
    - [1, 1816.0]
  - - [512, 128, 1, 512]
    - [1, 2049.0]
  - - [512, 128, 1, 1024]
    - [9, 2309.0]
  - - [512, 256, 1, 32]
    - [2, 1092.0]
  - - [512, 256, 1, 64]
    - [1, 1651.0]
  - - [512, 256, 1, 128]
    - [1, 2324.0]
  - - [512, 256, 1, 256]
    - [5, 2888.0]
  - - [512, 256, 1, 512]
    - [5, 3352.0]
  - - [512, 256, 1, 1024]
    - [5, 3543.0]
  - - [512, 512, 1, 32]
    - [2, 1658.0]
  - - [512, 512, 1, 64]
    - [1, 2460.0]
  - - [512, 512, 1, 128]
    - [5, 3251.0]
  - - [512, 512, 1, 256]
    - [6, 3879.0]
  - - [512, 512, 1, 512]
    - [6, 4383.0]
  - - [512, 512, 1, 1024]
    - [6, 4685.0]
  - - [512, 1024, 1, 32]
    - [3, 2311.0]
  - - [512, 1024, 1, 64]
    - [5, 3202.0]
  - - [512, 1024, 1, 128]
    - [6, 4122.0]
  - - [512, 1024, 1, 256]
    - [6, 4733.0]
  - - [512, 1024, 1, 512]
    - [10, 5192.0]
  - - [512, 1024, 1, 1024]
    - [10, 5528.0]
  - - [1024, 32, 1, 32]
    - [3, 282.0]
  - - [1024, 32, 1, 64]
    - [3, 452.0]
  - - [1024, 32, 1, 128]
    - [1, 679.0]
  - - [1024, 32, 1, 256]
    - [1, 945.0]
  - - [1024, 32, 1, 512]
    - [9, 1228.0]
  - - [1024, 32, 1, 1024]
    - [9, 1450.0]
  - - [1024, 64, 1, 32]
    - [2, 541.0]
  - - [1024, 64, 1, 64]
    - [3, 863.0]
  - - [1024, 64, 1, 128]
    - [1, 1315.0]
  - - [1024, 64, 1, 256]
    - [1, 1766.0]
  - - [1024, 64, 1, 512]
    - [1, 2039.0]
  - - [1024, 64, 1, 1024]
    - [9, 2280.0]
  - - [1024, 128, 1, 32]
    - [2, 1028.0]
  - - [1024, 128, 1, 64]
    - [2, 1645.0]
  - - [1024, 128, 1, 128]
    - [0, 2330.0]
  - - [1024, 128, 1, 256]
    - [5, 2908.0]
  - - [1024, 128, 1, 512]
    - [5, 3286.0]
  - - [1024, 128, 1, 1024]
    - [5, 3556.0]
  - - [1024, 256, 1, 32]
    - [1, 1638.0]
  - - [1024, 256, 1, 64]
    - [1, 2475.0]
  - - [1024, 256, 1, 128]
    - [7, 3214.0]
  - - [1024, 256, 1, 256]
    - [6, 3826.0]
  - - [1024, 256, 1, 512]
    - [6, 4307.0]
  - - [1024, 256, 1, 1024]
    - [6, 4589.0]
  - - [1024, 512, 1, 32]
    - [1, 2151.0]
  - - [1024, 512, 1, 64]
    - [0, 3148.0]
  - - [1024, 512, 1, 128]
    - [6, 4112.0]
  - - [1024, 512, 1, 256]
    - [6, 4733.0]
  - - [1024, 512, 1, 512]
    - [6, 5071.0]
  - - [1024, 512, 1, 1024]
    - [10, 5441.0]
  - - [1024, 1024, 1, 32]
    - [1, 2949.0]
  - - [1024, 1024, 1, 64]
    - [1, 3952.0]
  - - [1024, 1024, 1, 128]
    - [6, 5008.0]
  - - [1024, 1024, 1, 256]
    - [6, 5548.0]
  - - [1024, 1024, 1, 512]
    - [6, 5864.0]
  - - [1024, 1024, 1, 1024]
    - [6, 6020.0]
  - - [1, 1, 1, 1]
    - [11, 0.0006849314797782209]
- null
- null
- DeviceEfficiency
