library/src/blas3/Tensile/Logic/asm_full/hip/hip_Cijk_Alik_Bljk_I8II_BH.yaml
- {MinimumRequiredVersion: 4.27.0}
- hip
- fallback
- [Device 0000]
    SolutionIndex: 0
    SolutionNameMin: Cijk_Alik_Bljk_I8II_BH_MT32x32x8_SN_GRVW4_LRVW4_PGR1_PLR1_TT4_4_VW4_WG8_8_1
    SolutionIndex: 1
    SolutionNameMin: Cijk_Alik_Bljk_I8II_BH_MT32x32x8_SN_GRVW4_LRVW4_PGR1_PLR0_TT4_4_VW4_WG8_8_1
    SolutionIndex: 2
    SolutionNameMin: Cijk_Alik_Bljk_I8II_BH_MT32x32x8_SN_GRVW4_LRVW4_PGR0_PLR1_TT4_4_VW4_WG8_8_1
    SolutionIndex: 3
    SolutionNameMin: Cijk_Alik_Bljk_I8II_BH_MT32x32x8_SN_GRVW4_LRVW4_PGR0_PLR0_TT4_4_VW4_WG8_8_1
    SolutionIndex: 4
    SolutionNameMin: Cijk_Alik_Bljk_I8II_BH_MT32x64x8_SN_GRVW4_LRVW4_PGR1_PLR1_TT4_8_VW4_WG8_8_1
    SolutionIndex: 5
    SolutionNameMin: Cijk_Alik_Bljk_I8II_BH_MT32x64x8_SN_GRVW4_LRVW4_PGR1_PLR0_TT4_8_VW4_WG8_8_1
    SolutionIndex: 6
    SolutionNameMin: Cijk_Alik_Bljk_I8II_BH_MT64x32x8_SN_GRVW4_LRVW4_PGR1_PLR1_TT8_4_VW4_WG8_8_1
    SolutionIndex: 7
    SolutionNameMin: Cijk_Alik_Bljk_I8II_BH_MT32x32x16_SN_GRVW4_LRVW4_PGR0_PLR1_TT4_4_VW4_WG8_8_1
    SolutionIndex: 8
    SolutionNameMin: Cijk_Alik_Bljk_I8II_BH_MT32x32x16_SN_GRVW4_LRVW4_PGR0_PLR0_TT4_4_VW4_WG8_8_1
    SolutionIndex: 9
    SolutionNameMin: Cijk_Alik_Bljk_I8II_BH_MT32x64x16_SN_GRVW4_LRVW4_PGR0_PLR0_TT4_8_VW4_WG8_8_1
    SolutionIndex: 10
    SolutionNameMin: Cijk_Alik_Bljk_I8II_BH_MT64x32x16_SN_GRVW4_LRVW4_PGR0_PLR1_TT8_4_VW4_WG8_8_1
    SolutionIndex: 11
    SolutionNameMin: Cijk_Alik_Bljk_I8II_BH_MT64x64x16_SN_GRVW4_LRVW4_PGR1_PLR1_TT4_4_VW4_WG16_16_1
    SolutionIndex: 12
    SolutionNameMin: Cijk_Alik_Bljk_I8II_BH_MT64x64x16_SN_GRVW4_LRVW4_PGR0_PLR1_TT4_4_VW4_WG16_16_1
    SolutionIndex: 13
    SolutionNameMin: Cijk_Alik_Bljk_I8II_BH_MT128x64x16_SN_GRVW4_LRVW4_PGR1_PLR1_TT8_4_VW4_WG16_16_1
    SolutionIndex: 14
    SolutionNameMin: Cijk_Alik_Bljk_I8II_BH_MT8x8x8_SN_
- - - [32, 32, 1, 32]
    - [2, 9.0]
  - - [32, 32, 1, 64]
    - [2, 15.0]
  - - [32, 32, 1, 128]
    - [2, 23.0]
  - - [32, 32, 1, 256]
    - [2, 31.0]
  - - [32, 32, 1, 512]
    - [7, 37.0]
  - - [32, 32, 1, 1024]
    - [8, 42.0]
  - - [32, 64, 1, 32]
    - [2, 18.0]
  - - [32, 64, 1, 64]
    - [2, 30.0]
  - - [32, 64, 1, 128]
    - [2, 45.0]
  - - [32, 64, 1, 256]
    - [2, 62.0]
  - - [32, 64, 1, 512]
    - [8, 74.0]
  - - [32, 64, 1, 1024]
    - [1, 84.0]
  - - [32, 128, 1, 32]
    - [2, 36.0]
  - - [32, 128, 1, 64]
    - [2, 61.0]
  - - [32, 128, 1, 128]
    - [2, 92.0]
  - - [32, 128, 1, 256]
    - [2, 124.0]
  - - [32, 128, 1, 512]
    - [8, 148.0]
  - - [32, 128, 1, 1024]
    - [8, 170.0]
  - - [32, 256, 1, 32]
    - [2, 72.0]
  - - [32, 256, 1, 64]
    - [2, 122.0]
  - - [32, 256, 1, 128]
    - [2, 183.0]
  - - [32, 256, 1, 256]
    - [2, 247.0]
  - - [32, 256, 1, 512]
    - [8, 296.0]
  - - [32, 256, 1, 1024]
    - [8, 338.0]
  - - [32, 512, 1, 32]
    - [2, 146.0]
  - - [32, 512, 1, 64]
    - [2, 246.0]
  - - [32, 512, 1, 128]
    - [2, 369.0]
  - - [32, 512, 1, 256]
    - [2, 497.0]
  - - [32, 512, 1, 512]
    - [8, 594.0]
  - - [32, 512, 1, 1024]
    - [8, 679.0]
  - - [32, 1024, 1, 32]
    - [2, 290.0]
  - - [32, 1024, 1, 64]
    - [2, 488.0]
  - - [32, 1024, 1, 128]
    - [2, 733.0]
  - - [32, 1024, 1, 256]
    - [2, 987.0]
  - - [32, 1024, 1, 512]
    - [8, 1181.0]
  - - [32, 1024, 1, 1024]
    - [8, 1349.0]
  - - [64, 32, 1, 32]
    - [2, 18.0]
  - - [64, 32, 1, 64]
    - [2, 30.0]
  - - [64, 32, 1, 128]
    - [2, 45.0]
  - - [64, 32, 1, 256]
    - [2, 62.0]
  - - [64, 32, 1, 512]
    - [8, 74.0]
  - - [64, 32, 1, 1024]
    - [7, 84.0]
  - - [64, 64, 1, 32]
    - [2, 36.0]
  - - [64, 64, 1, 64]
    - [2, 60.0]
  - - [64, 64, 1, 128]
    - [2, 91.0]
  - - [64, 64, 1, 256]
    - [2, 123.0]
  - - [64, 64, 1, 512]
    - [1, 147.0]
  - - [64, 64, 1, 1024]
    - [1, 168.0]
  - - [64, 128, 1, 32]
    - [2, 72.0]
  - - [64, 128, 1, 64]
    - [2, 121.0]
  - - [64, 128, 1, 128]
    - [2, 184.0]
  - - [64, 128, 1, 256]
    - [2, 247.0]
  - - [64, 128, 1, 512]
    - [8, 296.0]
  - - [64, 128, 1, 1024]
    - [8, 339.0]
  - - [64, 256, 1, 32]
    - [2, 146.0]
  - - [64, 256, 1, 64]
    - [2, 246.0]
  - - [64, 256, 1, 128]
    - [2, 368.0]
  - - [64, 256, 1, 256]
    - [2, 497.0]
  - - [64, 256, 1, 512]
    - [8, 593.0]
  - - [64, 256, 1, 1024]
    - [8, 679.0]
  - - [64, 512, 1, 32]
    - [2, 286.0]
  - - [64, 512, 1, 64]
    - [2, 485.0]
  - - [64, 512, 1, 128]
    - [2, 731.0]
  - - [64, 512, 1, 256]
    - [2, 987.0]
  - - [64, 512, 1, 512]
    - [8, 1178.0]
  - - [64, 512, 1, 1024]
    - [8, 1348.0]
  - - [64, 1024, 1, 32]
    - [2, 567.0]
  - - [64, 1024, 1, 64]
    - [2, 958.0]
  - - [64, 1024, 1, 128]
    - [2, 1408.0]
  - - [64, 1024, 1, 256]
    - [1, 1800.0]
  - - [64, 1024, 1, 512]
    - [1, 2071.0]
  - - [64, 1024, 1, 1024]
    - [1, 2208.0]
  - - [128, 32, 1, 32]
    - [2, 35.0]
  - - [128, 32, 1, 64]
    - [2, 60.0]
  - - [128, 32, 1, 128]
    - [2, 91.0]
  - - [128, 32, 1, 256]
    - [2, 123.0]
  - - [128, 32, 1, 512]
    - [8, 148.0]
  - - [128, 32, 1, 1024]
    - [8, 169.0]
  - - [128, 64, 1, 32]
    - [2, 72.0]
  - - [128, 64, 1, 64]
    - [2, 121.0]
  - - [128, 64, 1, 128]
    - [2, 184.0]
  - - [128, 64, 1, 256]
    - [2, 247.0]
  - - [128, 64, 1, 512]
    - [8, 296.0]
  - - [128, 64, 1, 1024]
    - [8, 337.0]
  - - [128, 128, 1, 32]
    - [2, 146.0]
  - - [128, 128, 1, 64]
    - [2, 245.0]
  - - [128, 128, 1, 128]
    - [2, 369.0]
  - - [128, 128, 1, 256]
    - [2, 496.0]
  - - [128, 128, 1, 512]
    - [8, 593.0]
  - - [128, 128, 1, 1024]
    - [8, 680.0]
  - - [128, 256, 1, 32]
    - [2, 290.0]
  - - [128, 256, 1, 64]
    - [2, 488.0]
  - - [128, 256, 1, 128]
    - [2, 736.0]
  - - [128, 256, 1, 256]
    - [2, 987.0]
  - - [128, 256, 1, 512]
    - [8, 1181.0]
  - - [128, 256, 1, 1024]
    - [8, 1354.0]
  - - [128, 512, 1, 32]
    - [2, 570.0]
  - - [128, 512, 1, 64]
    - [2, 962.0]
  - - [128, 512, 1, 128]
    - [3, 1398.0]
  - - [128, 512, 1, 256]
    - [1, 1816.0]
  - - [128, 512, 1, 512]
    - [7, 2087.0]
  - - [128, 512, 1, 1024]
    - [7, 2258.0]
  - - [128, 1024, 1, 32]
    - [2, 1054.0]
  - - [128, 1024, 1, 64]
    - [2, 1664.0]
  - - [128, 1024, 1, 128]
    - [2, 2383.0]
  - - [128, 1024, 1, 256]
    - [2, 2908.0]
  - - [128, 1024, 1, 512]
    - [8, 3196.0]
  - - [128, 1024, 1, 1024]
    - [8, 3427.0]
  - - [256, 32, 1, 32]
    - [2, 71.0]
  - - [256, 32, 1, 64]
    - [2, 121.0]
  - - [256, 32, 1, 128]
    - [2, 181.0]
  - - [256, 32, 1, 256]
    - [2, 246.0]
  - - [256, 32, 1, 512]
    - [8, 296.0]
  - - [256, 32, 1, 1024]
    - [8, 339.0]
  - - [256, 64, 1, 32]
    - [2, 144.0]
  - - [256, 64, 1, 64]
    - [2, 245.0]
  - - [256, 64, 1, 128]
    - [2, 368.0]
  - - [256, 64, 1, 256]
    - [2, 496.0]
  - - [256, 64, 1, 512]
    - [8, 592.0]
  - - [256, 64, 1, 1024]
    - [8, 678.0]
  - - [256, 128, 1, 32]
    - [2, 286.0]
  - - [256, 128, 1, 64]
    - [2, 488.0]
  - - [256, 128, 1, 128]
    - [2, 733.0]
  - - [256, 128, 1, 256]
    - [2, 989.0]
  - - [256, 128, 1, 512]
    - [8, 1181.0]
  - - [256, 128, 1, 1024]
    - [8, 1349.0]
  - - [256, 256, 1, 32]
    - [2, 567.0]
  - - [256, 256, 1, 64]
    - [2, 958.0]
  - - [256, 256, 1, 128]
    - [2, 1398.0]
  - - [256, 256, 1, 256]
    - [1, 1820.0]
  - - [256, 256, 1, 512]
    - [1, 2071.0]
  - - [256, 256, 1, 1024]
    - [7, 2253.0]
  - - [256, 512, 1, 32]
    - [3, 1018.0]
  - - [256, 512, 1, 64]
    - [2, 1678.0]
  - - [256, 512, 1, 128]
    - [2, 2363.0]
  - - [256, 512, 1, 256]
    - [2, 2913.0]
  - - [256, 512, 1, 512]
    - [8, 3205.0]
  - - [256, 512, 1, 1024]
    - [8, 3413.0]
  - - [256, 1024, 1, 32]
    - [2, 1531.0]
  - - [256, 1024, 1, 64]
    - [2, 2504.0]
  - - [256, 1024, 1, 128]
    - [7, 3245.0]
  - - [256, 1024, 1, 256]
    - [7, 3813.0]
  - - [256, 1024, 1, 512]
    - [7, 4065.0]
  - - [256, 1024, 1, 1024]
    - [7, 4261.0]
  - - [512, 32, 1, 32]
    - [2, 143.0]
  - - [512, 32, 1, 64]
    - [2, 244.0]
  - - [512, 32, 1, 128]
    - [2, 365.0]
  - - [512, 32, 1, 256]
    - [2, 495.0]
  - - [512, 32, 1, 512]
    - [8, 592.0]
  - - [512, 32, 1, 1024]
    - [8, 677.0]
  - - [512, 64, 1, 32]
    - [2, 286.0]
  - - [512, 64, 1, 64]
    - [2, 483.0]
  - - [512, 64, 1, 128]
    - [2, 728.0]
  - - [512, 64, 1, 256]
    - [2, 987.0]
  - - [512, 64, 1, 512]
    - [8, 1180.0]
  - - [512, 64, 1, 1024]
    - [8, 1341.0]
  - - [512, 128, 1, 32]
    - [2, 573.0]
  - - [512, 128, 1, 64]
    - [2, 966.0]
  - - [512, 128, 1, 128]
    - [2, 1432.0]
  - - [512, 128, 1, 256]
    - [1, 1812.0]
  - - [512, 128, 1, 512]
    - [7, 2082.0]
  - - [512, 128, 1, 1024]
    - [1, 2227.0]
  - - [512, 256, 1, 32]
    - [2, 1116.0]
  - - [512, 256, 1, 64]
    - [2, 1777.0]
  - - [512, 256, 1, 128]
    - [1, 2363.0]
  - - [512, 256, 1, 256]
    - [2, 2913.0]
  - - [512, 256, 1, 512]
    - [8, 3208.0]
  - - [512, 256, 1, 1024]
    - [7, 3422.0]
  - - [512, 512, 1, 32]
    - [2, 1645.0]
  - - [512, 512, 1, 64]
    - [2, 2527.0]
  - - [512, 512, 1, 128]
    - [7, 3251.0]
  - - [512, 512, 1, 256]
    - [7, 3770.0]
  - - [512, 512, 1, 512]
    - [7, 4087.0]
  - - [512, 512, 1, 1024]
    - [7, 4253.0]
  - - [512, 1024, 1, 32]
    - [1, 2140.0]
  - - [512, 1024, 1, 64]
    - [3, 3124.0]
  - - [512, 1024, 1, 128]
    - [2, 3875.0]
  - - [512, 1024, 1, 256]
    - [2, 4625.0]
  - - [512, 1024, 1, 512]
    - [8, 4800.0]
  - - [512, 1024, 1, 1024]
    - [13, 4990.0]
  - - [1024, 32, 1, 32]
    - [2, 286.0]
  - - [1024, 32, 1, 64]
    - [2, 485.0]
  - - [1024, 32, 1, 128]
    - [2, 728.0]
  - - [1024, 32, 1, 256]
    - [2, 985.0]
  - - [1024, 32, 1, 512]
    - [7, 1170.0]
  - - [1024, 32, 1, 1024]
    - [8, 1342.0]
  - - [1024, 64, 1, 32]
    - [2, 567.0]
  - - [1024, 64, 1, 64]
    - [2, 958.0]
  - - [1024, 64, 1, 128]
    - [2, 1403.0]
  - - [1024, 64, 1, 256]
    - [7, 1789.0]
  - - [1024, 64, 1, 512]
    - [1, 2054.0]
  - - [1024, 64, 1, 1024]
    - [1, 2218.0]
  - - [1024, 128, 1, 32]
    - [3, 1059.0]
  - - [1024, 128, 1, 64]
    - [2, 1705.0]
  - - [1024, 128, 1, 128]
    - [1, 2370.0]
  - - [1024, 128, 1, 256]
    - [2, 2908.0]
  - - [1024, 128, 1, 512]
    - [7, 3233.0]
  - - [1024, 128, 1, 1024]
    - [8, 3367.0]
  - - [1024, 256, 1, 32]
    - [12, 1671.0]
  - - [1024, 256, 1, 64]
    - [1, 2424.0]
  - - [1024, 256, 1, 128]
    - [11, 3113.0]
  - - [1024, 256, 1, 256]
    - [7, 3667.0]
  - - [1024, 256, 1, 512]
    - [11, 4004.0]
  - - [1024, 256, 1, 1024]
    - [11, 4205.0]
  - - [1024, 512, 1, 32]
    - [5, 2162.0]
  - - [1024, 512, 1, 64]
    - [1, 3073.0]
  - - [1024, 512, 1, 128]
    - [1, 3990.0]
  - - [1024, 512, 1, 256]
    - [2, 4489.0]
  - - [1024, 512, 1, 512]
    - [8, 4814.0]
  - - [1024, 512, 1, 1024]
    - [8, 4976.0]
  - - [1024, 1024, 1, 32]
    - [1, 2782.0]
  - - [1024, 1024, 1, 64]
    - [0, 3839.0]
  - - [1024, 1024, 1, 128]
    - [6, 4706.0]
  - - [1024, 1024, 1, 256]
    - [4, 5194.0]
  - - [1024, 1024, 1, 512]
    - [9, 5426.0]
  - - [1024, 1024, 1, 1024]
    - [10, 5635.0]
  - - [1, 1, 1, 1]
    - [14, 0.0006849314797782209]
- null
- null
- DeviceEfficiency
