library/src/blas3/Tensile/Logic/asm_full/hip/hip_Cijk_Ailk_Bljk_I8II_BH.yaml
- {MinimumRequiredVersion: 4.27.0}
- hip
- fallback
- [Device 0000]
    SolutionIndex: 0
    SolutionNameMin: Cijk_Ailk_Bljk_I8II_BH_MT32x32x8_SN_GRVW4_LRVW4_PGR1_PLR1_TT4_4_VW4_WG8_8_1
    SolutionIndex: 1
    SolutionNameMin: Cijk_Ailk_Bljk_I8II_BH_MT32x32x8_SN_GRVW4_LRVW4_PGR1_PLR0_TT4_4_VW4_WG8_8_1
    SolutionIndex: 2
    SolutionNameMin: Cijk_Ailk_Bljk_I8II_BH_MT32x32x8_SN_GRVW4_LRVW4_PGR0_PLR1_TT4_4_VW4_WG8_8_1
    SolutionIndex: 3
    SolutionNameMin: Cijk_Ailk_Bljk_I8II_BH_MT32x32x8_SN_GRVW4_LRVW4_PGR0_PLR0_TT4_4_VW4_WG8_8_1
    SolutionIndex: 4
    SolutionNameMin: Cijk_Ailk_Bljk_I8II_BH_MT32x64x8_SN_GRVW4_LRVW4_PGR1_PLR1_TT4_8_VW4_WG8_8_1
    SolutionIndex: 5
    SolutionNameMin: Cijk_Ailk_Bljk_I8II_BH_MT32x32x16_SN_GRVW4_LRVW4_PGR0_PLR1_TT4_4_VW4_WG8_8_1
    SolutionIndex: 6
    SolutionNameMin: Cijk_Ailk_Bljk_I8II_BH_MT32x32x16_SN_GRVW4_LRVW4_PGR0_PLR0_TT4_4_VW4_WG8_8_1
    SolutionIndex: 7
    SolutionNameMin: Cijk_Ailk_Bljk_I8II_BH_MT64x32x16_SN_GRVW4_LRVW4_PGR1_PLR0_TT8_4_VW4_WG8_8_1
    SolutionIndex: 8
    SolutionNameMin: Cijk_Ailk_Bljk_I8II_BH_MT64x64x16_SN_GRVW4_LRVW4_PGR1_PLR1_TT4_4_VW4_WG16_16_1
    SolutionIndex: 9
    SolutionNameMin: Cijk_Ailk_Bljk_I8II_BH_MT32x32x32_SN_GRVW4_LRVW4_PGR0_PLR1_TT4_4_VW4_WG8_8_1
    SolutionIndex: 10
    SolutionNameMin: Cijk_Ailk_Bljk_I8II_BH_MT8x8x8_SN_
- - - [32, 32, 1, 32]
    - [2, 8.0]
  - - [32, 32, 1, 64]
    - [2, 14.0]
  - - [32, 32, 1, 128]
    - [0, 20.0]
  - - [32, 32, 1, 256]
    - [5, 29.0]
  - - [32, 32, 1, 512]
    - [9, 37.0]
  - - [32, 32, 1, 1024]
    - [9, 45.0]
  - - [32, 64, 1, 32]
    - [2, 17.0]
  - - [32, 64, 1, 64]
    - [2, 28.0]
  - - [32, 64, 1, 128]
    - [2, 41.0]
  - - [32, 64, 1, 256]
    - [5, 59.0]
  - - [32, 64, 1, 512]
    - [9, 75.0]
  - - [32, 64, 1, 1024]
    - [9, 90.0]
  - - [32, 128, 1, 32]
    - [2, 34.0]
  - - [32, 128, 1, 64]
    - [2, 56.0]
  - - [32, 128, 1, 128]
    - [5, 83.0]
  - - [32, 128, 1, 256]
    - [5, 117.0]
  - - [32, 128, 1, 512]
    - [9, 150.0]
  - - [32, 128, 1, 1024]
    - [9, 180.0]
  - - [32, 256, 1, 32]
    - [2, 68.0]
  - - [32, 256, 1, 64]
    - [2, 112.0]
  - - [32, 256, 1, 128]
    - [5, 168.0]
  - - [32, 256, 1, 256]
    - [5, 236.0]
  - - [32, 256, 1, 512]
    - [9, 302.0]
  - - [32, 256, 1, 1024]
    - [9, 362.0]
  - - [32, 512, 1, 32]
    - [2, 136.0]
  - - [32, 512, 1, 64]
    - [2, 225.0]
  - - [32, 512, 1, 128]
    - [5, 336.0]
  - - [32, 512, 1, 256]
    - [5, 472.0]
  - - [32, 512, 1, 512]
    - [9, 604.0]
  - - [32, 512, 1, 1024]
    - [9, 720.0]
  - - [32, 1024, 1, 32]
    - [2, 269.0]
  - - [32, 1024, 1, 64]
    - [2, 448.0]
  - - [32, 1024, 1, 128]
    - [5, 668.0]
  - - [32, 1024, 1, 256]
    - [5, 943.0]
  - - [32, 1024, 1, 512]
    - [9, 1197.0]
  - - [32, 1024, 1, 1024]
    - [9, 1424.0]
  - - [64, 32, 1, 32]
    - [2, 17.0]
  - - [64, 32, 1, 64]
    - [3, 28.0]
  - - [64, 32, 1, 128]
    - [5, 41.0]
  - - [64, 32, 1, 256]
    - [5, 58.0]
  - - [64, 32, 1, 512]
    - [9, 78.0]
  - - [64, 32, 1, 1024]
    - [9, 94.0]
  - - [64, 64, 1, 32]
    - [2, 33.0]
  - - [64, 64, 1, 64]
    - [2, 55.0]
  - - [64, 64, 1, 128]
    - [5, 83.0]
  - - [64, 64, 1, 256]
    - [5, 117.0]
  - - [64, 64, 1, 512]
    - [9, 157.0]
  - - [64, 64, 1, 1024]
    - [9, 189.0]
  - - [64, 128, 1, 32]
    - [3, 68.0]
  - - [64, 128, 1, 64]
    - [2, 111.0]
  - - [64, 128, 1, 128]
    - [5, 167.0]
  - - [64, 128, 1, 256]
    - [5, 236.0]
  - - [64, 128, 1, 512]
    - [9, 309.0]
  - - [64, 128, 1, 1024]
    - [9, 376.0]
  - - [64, 256, 1, 32]
    - [2, 136.0]
  - - [64, 256, 1, 64]
    - [2, 222.0]
  - - [64, 256, 1, 128]
    - [5, 337.0]
  - - [64, 256, 1, 256]
    - [5, 471.0]
  - - [64, 256, 1, 512]
    - [9, 622.0]
  - - [64, 256, 1, 1024]
    - [9, 754.0]
  - - [64, 512, 1, 32]
    - [2, 270.0]
  - - [64, 512, 1, 64]
    - [2, 442.0]
  - - [64, 512, 1, 128]
    - [5, 668.0]
  - - [64, 512, 1, 256]
    - [5, 938.0]
  - - [64, 512, 1, 512]
    - [9, 1239.0]
  - - [64, 512, 1, 1024]
    - [9, 1468.0]
  - - [64, 1024, 1, 32]
    - [2, 532.0]
  - - [64, 1024, 1, 64]
    - [2, 874.0]
  - - [64, 1024, 1, 128]
    - [5, 1315.0]
  - - [64, 1024, 1, 256]
    - [5, 1852.0]
  - - [64, 1024, 1, 512]
    - [5, 2216.0]
  - - [64, 1024, 1, 1024]
    - [9, 2358.0]
  - - [128, 32, 1, 32]
    - [2, 33.0]
  - - [128, 32, 1, 64]
    - [2, 55.0]
  - - [128, 32, 1, 128]
    - [1, 81.0]
  - - [128, 32, 1, 256]
    - [1, 114.0]
  - - [128, 32, 1, 512]
    - [9, 155.0]
  - - [128, 32, 1, 1024]
    - [9, 192.0]
  - - [128, 64, 1, 32]
    - [2, 67.0]
  - - [128, 64, 1, 64]
    - [2, 110.0]
  - - [128, 64, 1, 128]
    - [1, 166.0]
  - - [128, 64, 1, 256]
    - [1, 233.0]
  - - [128, 64, 1, 512]
    - [9, 308.0]
  - - [128, 64, 1, 1024]
    - [9, 379.0]
  - - [128, 128, 1, 32]
    - [2, 135.0]
  - - [128, 128, 1, 64]
    - [2, 222.0]
  - - [128, 128, 1, 128]
    - [1, 332.0]
  - - [128, 128, 1, 256]
    - [6, 466.0]
  - - [128, 128, 1, 512]
    - [9, 616.0]
  - - [128, 128, 1, 1024]
    - [9, 751.0]
  - - [128, 256, 1, 32]
    - [2, 272.0]
  - - [128, 256, 1, 64]
    - [2, 442.0]
  - - [128, 256, 1, 128]
    - [1, 664.0]
  - - [128, 256, 1, 256]
    - [5, 930.0]
  - - [128, 256, 1, 512]
    - [9, 1223.0]
  - - [128, 256, 1, 1024]
    - [9, 1502.0]
  - - [128, 512, 1, 32]
    - [2, 535.0]
  - - [128, 512, 1, 64]
    - [2, 877.0]
  - - [128, 512, 1, 128]
    - [1, 1307.0]
  - - [128, 512, 1, 256]
    - [5, 1828.0]
  - - [128, 512, 1, 512]
    - [5, 2190.0]
  - - [128, 512, 1, 1024]
    - [6, 2411.0]
  - - [128, 1024, 1, 32]
    - [2, 994.0]
  - - [128, 1024, 1, 64]
    - [2, 1607.0]
  - - [128, 1024, 1, 128]
    - [5, 2337.0]
  - - [128, 1024, 1, 256]
    - [5, 3023.0]
  - - [128, 1024, 1, 512]
    - [5, 3456.0]
  - - [128, 1024, 1, 1024]
    - [6, 3661.0]
  - - [256, 32, 1, 32]
    - [2, 67.0]
  - - [256, 32, 1, 64]
    - [2, 110.0]
  - - [256, 32, 1, 128]
    - [1, 164.0]
  - - [256, 32, 1, 256]
    - [1, 231.0]
  - - [256, 32, 1, 512]
    - [9, 314.0]
  - - [256, 32, 1, 1024]
    - [9, 388.0]
  - - [256, 64, 1, 32]
    - [2, 135.0]
  - - [256, 64, 1, 64]
    - [2, 220.0]
  - - [256, 64, 1, 128]
    - [1, 333.0]
  - - [256, 64, 1, 256]
    - [5, 466.0]
  - - [256, 64, 1, 512]
    - [9, 633.0]
  - - [256, 64, 1, 1024]
    - [9, 777.0]
  - - [256, 128, 1, 32]
    - [2, 269.0]
  - - [256, 128, 1, 64]
    - [2, 441.0]
  - - [256, 128, 1, 128]
    - [1, 664.0]
  - - [256, 128, 1, 256]
    - [6, 928.0]
  - - [256, 128, 1, 512]
    - [9, 1230.0]
  - - [256, 128, 1, 1024]
    - [9, 1501.0]
  - - [256, 256, 1, 32]
    - [2, 522.0]
  - - [256, 256, 1, 64]
    - [2, 853.0]
  - - [256, 256, 1, 128]
    - [6, 1303.0]
  - - [256, 256, 1, 256]
    - [5, 1816.0]
  - - [256, 256, 1, 512]
    - [5, 2246.0]
  - - [256, 256, 1, 1024]
    - [9, 2363.0]
  - - [256, 512, 1, 32]
    - [2, 932.0]
  - - [256, 512, 1, 64]
    - [2, 1536.0]
  - - [256, 512, 1, 128]
    - [1, 2261.0]
  - - [256, 512, 1, 256]
    - [5, 2943.0]
  - - [256, 512, 1, 512]
    - [5, 3503.0]
  - - [256, 512, 1, 1024]
    - [6, 3687.0]
  - - [256, 1024, 1, 32]
    - [2, 1403.0]
  - - [256, 1024, 1, 64]
    - [1, 2337.0]
  - - [256, 1024, 1, 128]
    - [5, 3309.0]
  - - [256, 1024, 1, 256]
    - [6, 3866.0]
  - - [256, 1024, 1, 512]
    - [7, 4403.0]
  - - [256, 1024, 1, 1024]
    - [7, 4743.0]
  - - [512, 32, 1, 32]
    - [2, 135.0]
  - - [512, 32, 1, 64]
    - [2, 222.0]
  - - [512, 32, 1, 128]
    - [1, 330.0]
  - - [512, 32, 1, 256]
    - [6, 464.0]
  - - [512, 32, 1, 512]
    - [9, 619.0]
  - - [512, 32, 1, 1024]
    - [9, 763.0]
  - - [512, 64, 1, 32]
    - [2, 269.0]
  - - [512, 64, 1, 64]
    - [2, 441.0]
  - - [512, 64, 1, 128]
    - [1, 666.0]
  - - [512, 64, 1, 256]
    - [5, 932.0]
  - - [512, 64, 1, 512]
    - [5, 1221.0]
  - - [512, 64, 1, 1024]
    - [9, 1516.0]
  - - [512, 128, 1, 32]
    - [2, 532.0]
  - - [512, 128, 1, 64]
    - [2, 877.0]
  - - [512, 128, 1, 128]
    - [5, 1319.0]
  - - [512, 128, 1, 256]
    - [5, 1792.0]
  - - [512, 128, 1, 512]
    - [6, 2124.0]
  - - [512, 128, 1, 1024]
    - [9, 2363.0]
  - - [512, 256, 1, 32]
    - [2, 1049.0]
  - - [512, 256, 1, 64]
    - [2, 1684.0]
  - - [512, 256, 1, 128]
    - [6, 2350.0]
  - - [512, 256, 1, 256]
    - [6, 2959.0]
  - - [512, 256, 1, 512]
    - [6, 3459.0]
  - - [512, 256, 1, 1024]
    - [5, 3712.0]
  - - [512, 512, 1, 32]
    - [5, 1632.0]
  - - [512, 512, 1, 64]
    - [1, 2489.0]
  - - [512, 512, 1, 128]
    - [5, 3309.0]
  - - [512, 512, 1, 256]
    - [5, 3870.0]
  - - [512, 512, 1, 512]
    - [7, 4378.0]
  - - [512, 512, 1, 1024]
    - [7, 4690.0]
  - - [512, 1024, 1, 32]
    - [1, 2036.0]
  - - [512, 1024, 1, 64]
    - [4, 3023.0]
  - - [512, 1024, 1, 128]
    - [7, 4023.0]
  - - [512, 1024, 1, 256]
    - [7, 4780.0]
  - - [512, 1024, 1, 512]
    - [7, 5182.0]
  - - [512, 1024, 1, 1024]
    - [7, 5407.0]
  - - [1024, 32, 1, 32]
    - [2, 269.0]
  - - [1024, 32, 1, 64]
    - [2, 442.0]
  - - [1024, 32, 1, 128]
    - [1, 655.0]
  - - [1024, 32, 1, 256]
    - [6, 926.0]
  - - [1024, 32, 1, 512]
    - [9, 1219.0]
  - - [1024, 32, 1, 1024]
    - [9, 1458.0]
  - - [1024, 64, 1, 32]
    - [2, 532.0]
  - - [1024, 64, 1, 64]
    - [2, 874.0]
  - - [1024, 64, 1, 128]
    - [5, 1307.0]
  - - [1024, 64, 1, 256]
    - [6, 1770.0]
  - - [1024, 64, 1, 512]
    - [5, 2102.0]
  - - [1024, 64, 1, 1024]
    - [5, 2330.0]
  - - [1024, 128, 1, 32]
    - [2, 1038.0]
  - - [1024, 128, 1, 64]
    - [2, 1684.0]
  - - [1024, 128, 1, 128]
    - [5, 2363.0]
  - - [1024, 128, 1, 256]
    - [5, 2964.0]
  - - [1024, 128, 1, 512]
    - [6, 3407.0]
  - - [1024, 128, 1, 1024]
    - [5, 3704.0]
  - - [1024, 256, 1, 32]
    - [0, 1698.0]
  - - [1024, 256, 1, 64]
    - [8, 2446.0]
  - - [1024, 256, 1, 128]
    - [8, 3202.0]
  - - [1024, 256, 1, 256]
    - [7, 3757.0]
  - - [1024, 256, 1, 512]
    - [7, 4327.0]
  - - [1024, 256, 1, 1024]
    - [7, 4628.0]
  - - [1024, 512, 1, 32]
    - [4, 2102.0]
  - - [1024, 512, 1, 64]
    - [1, 2985.0]
  - - [1024, 512, 1, 128]
    - [7, 4033.0]
  - - [1024, 512, 1, 256]
    - [7, 4763.0]
  - - [1024, 512, 1, 512]
    - [7, 5198.0]
  - - [1024, 512, 1, 1024]
    - [7, 5414.0]
  - - [1024, 1024, 1, 32]
    - [1, 2773.0]
  - - [1024, 1024, 1, 64]
    - [1, 3924.0]
  - - [1024, 1024, 1, 128]
    - [7, 4982.0]
  - - [1024, 1024, 1, 256]
    - [7, 5658.0]
  - - [1024, 1024, 1, 512]
    - [7, 6028.0]
  - - [1024, 1024, 1, 1024]
    - [7, 6235.0]
  - - [1, 1, 1, 1]
    - [10, 0.0006849314797782209]
- null
- null
- DeviceEfficiency
