library/src/blas3/Tensile/Logic/hip_full/hip_Cijk_Ailk_Bljk_HB_GB.yaml
- {MinimumRequiredVersion: 4.40.0}
- hip
- fallback
- [Device 0000]
    SolutionIndex: 0
    SolutionNameMin: Cijk_Ailk_Bljk_HB_GB_MT64x64x2_SN_TT8_8
    SolutionIndex: 1
    SolutionNameMin: Cijk_Ailk_Bljk_HB_GB_MT16x48x16_SN_TT2_6
    SolutionIndex: 2
    SolutionNameMin: Cijk_Ailk_Bljk_HB_GB_MT8x8x16_SN_TT1_1
    SolutionIndex: 3
    SolutionNameMin: Cijk_Ailk_Bljk_HB_GB_MT32x64x16_SN_TT4_8
    SolutionIndex: 4
    SolutionNameMin: Cijk_Ailk_Bljk_HB_GB_MT32x64x16_SN_TT4_8
    SolutionIndex: 5
    SolutionNameMin: Cijk_Ailk_Bljk_HB_GB_MT16x32x16_SN_TT2_8
- - - [127, 127, 1, 63, 127, 127, 127, 63]
    - [1, 0.0155563]
  - - [128, 127, 1, 63, 128, 128, 128, 63]
    - [3, 0.015121]
  - - [129, 127, 1, 63, 129, 129, 129, 63]
    - [4, 0.0151427]
  - - [127, 128, 1, 63, 127, 127, 127, 63]
    - [1, 0.0155045]
  - - [128, 128, 1, 63, 128, 128, 128, 63]
    - [1, 0.015505]
  - - [129, 128, 1, 63, 129, 129, 129, 63]
    - [1, 0.0156856]
  - - [127, 129, 1, 63, 127, 127, 127, 63]
    - [1, 0.0154584]
  - - [128, 129, 1, 63, 128, 128, 128, 63]
    - [1, 0.0154799]
  - - [129, 129, 1, 63, 129, 129, 129, 63]
    - [1, 0.0156497]
  - - [127, 127, 2, 63, 127, 127, 127, 63]
    - [1, 0.0175838]
  - - [128, 127, 2, 63, 128, 128, 128, 63]
    - [1, 0.0180481]
  - - [129, 127, 2, 63, 129, 129, 129, 63]
    - [1, 0.0181202]
  - - [127, 128, 2, 63, 127, 127, 127, 63]
    - [0, 0.0176481]
  - - [128, 128, 2, 63, 128, 128, 128, 63]
    - [1, 0.0180065]
  - - [129, 128, 2, 63, 129, 129, 129, 63]
    - [1, 0.0179993]
  - - [127, 129, 2, 63, 127, 127, 127, 63]
    - [1, 0.017848]
  - - [128, 129, 2, 63, 128, 128, 128, 63]
    - [1, 0.018141]
  - - [129, 129, 2, 63, 129, 129, 129, 63]
    - [1, 0.0176643]
  - - [127, 127, 1, 64, 127, 127, 127, 64]
    - [1, 0.0155475]
  - - [128, 127, 1, 64, 128, 128, 128, 64]
    - [4, 0.0152431]
  - - [129, 127, 1, 64, 129, 129, 129, 64]
    - [1, 0.0159126]
  - - [127, 128, 1, 64, 127, 127, 127, 64]
    - [4, 0.0155051]
  - - [128, 128, 1, 64, 128, 128, 128, 64]
    - [1, 0.0159587]
  - - [129, 128, 1, 64, 129, 129, 129, 64]
    - [4, 0.0154307]
  - - [127, 129, 1, 64, 127, 127, 127, 64]
    - [4, 0.0157652]
  - - [128, 129, 1, 64, 128, 128, 128, 64]
    - [1, 0.0161418]
  - - [129, 129, 1, 64, 129, 129, 129, 64]
    - [1, 0.0159005]
  - - [127, 127, 2, 64, 127, 127, 127, 64]
    - [1, 0.0187756]
  - - [128, 127, 2, 64, 128, 128, 128, 64]
    - [1, 0.018314]
  - - [129, 127, 2, 64, 129, 129, 129, 64]
    - [0, 0.0178275]
  - - [127, 128, 2, 64, 127, 127, 127, 64]
    - [1, 0.0180355]
  - - [128, 128, 2, 64, 128, 128, 128, 64]
    - [0, 0.0177894]
  - - [129, 128, 2, 64, 129, 129, 129, 64]
    - [0, 0.0176012]
  - - [127, 129, 2, 64, 127, 127, 127, 64]
    - [1, 0.0183266]
  - - [128, 129, 2, 64, 128, 128, 128, 64]
    - [0, 0.0179325]
  - - [129, 129, 2, 64, 129, 129, 129, 64]
    - [0, 0.0181621]
  - - [1, 1, 1, 1, 1, 1, 1, 1]
    - [2, 7.2659e-08]
  - - [8, 8, 3, 63, 8, 8, 8, 63]
    - [5, 0.000680776]
  - - [40, 8, 3, 63, 40, 40, 40, 63]
    - [5, 0.00207839]
  - - [8, 40, 3, 63, 8, 8, 8, 63]
    - [5, 0.0023395]
  - - [40, 40, 3, 63, 40, 40, 40, 63]
    - [5, 0.00775637]
  - - [8, 8, 3, 64, 8, 8, 8, 64]
    - [5, 0.000733729]
  - - [40, 8, 3, 64, 40, 40, 40, 64]
    - [5, 0.00239366]
  - - [8, 40, 3, 64, 8, 8, 8, 64]
    - [5, 0.00243476]
  - - [40, 40, 3, 64, 40, 40, 40, 64]
    - [5, 0.00774575]
- null
- null
- DeviceEfficiency
