library/src/blas3/Tensile/Logic/hip_full/hip_Cijk_Alik_Bjlk_BSS_BH.yaml
- {MinimumRequiredVersion: 4.23.0}
- hip
- fallback
- [Device 0000]
    SolutionIndex: 0
    SolutionNameMin: Cijk_Alik_Bjlk_BSS_BH_MT32x32x16_SE_TT2_2_WG16_16_1
    SolutionIndex: 1
    SolutionNameMin: Cijk_Alik_Bjlk_BSS_BH_MT128x32x16_SE_TT8_2_WG16_16_1
    SolutionIndex: 2
    SolutionNameMin: Cijk_Alik_Bjlk_BSS_BH_MT32x32x16_SE_TT2_2_WG16_16_1
    SolutionIndex: 3
    SolutionNameMin: Cijk_Alik_Bjlk_BSS_BH_MT16x16x16_SE_TT2_2_WG8_8_1
- - - [127, 127, 2, 63, 127, 127, 63, 127]
    - [0, 184.0]
  - - [128, 128, 2, 63, 128, 128, 63, 128]
    - [0, 186.0]
  - - [129, 129, 2, 63, 129, 129, 63, 129]
    - [0, 193.0]
  - - [127, 127, 2, 64, 127, 127, 64, 127]
    - [0, 180.0]
  - - [128, 128, 2, 64, 128, 128, 64, 128]
    - [0, 189.0]
  - - [129, 129, 2, 64, 129, 129, 64, 129]
    - [0, 199.0]
  - - [127, 127, 2, 65, 127, 127, 65, 127]
    - [0, 206.0]
  - - [128, 128, 2, 65, 128, 128, 65, 128]
    - [0, 196.0]
  - - [129, 129, 2, 65, 129, 129, 65, 129]
    - [0, 199.0]
  - - [1, 1, 2, 1, 1, 1, 1, 1]
    - [3, 0.0003246753313433368]
  - - [1, 127, 2, 63, 1, 1, 63, 127]
    - [1, 1.0]
  - - [1, 128, 2, 63, 1, 1, 63, 128]
    - [1, 1.0]
  - - [1, 129, 2, 63, 1, 1, 63, 129]
    - [2, 2.0]
  - - [1, 127, 2, 64, 1, 1, 64, 127]
    - [1, 1.0]
  - - [1, 128, 2, 64, 1, 1, 64, 128]
    - [2, 2.0]
  - - [1, 129, 2, 64, 1, 1, 64, 129]
    - [3, 2.0]
  - - [1, 127, 2, 65, 1, 1, 65, 127]
    - [1, 1.0]
  - - [1, 128, 2, 65, 1, 1, 65, 128]
    - [2, 2.0]
  - - [1, 129, 2, 65, 1, 1, 65, 129]
    - [2, 2.0]
  - - [127, 1, 2, 63, 127, 127, 63, 1]
    - [3, 2.0]
  - - [128, 1, 2, 63, 128, 128, 63, 1]
    - [3, 2.0]
  - - [129, 1, 2, 63, 129, 129, 63, 1]
    - [3, 2.0]
  - - [127, 1, 2, 64, 127, 127, 64, 1]
    - [2, 2.0]
  - - [128, 1, 2, 64, 128, 128, 64, 1]
    - [2, 2.0]
  - - [129, 1, 2, 64, 129, 129, 64, 1]
    - [2, 2.0]
  - - [127, 1, 2, 65, 127, 127, 65, 1]
    - [2, 2.0]
  - - [128, 1, 2, 65, 128, 128, 65, 1]
    - [2, 2.0]
  - - [129, 1, 2, 65, 129, 129, 65, 1]
    - [3, 2.0]
  - - [127, 127, 2, 1, 127, 127, 1, 127]
    - [2, 5.0]
  - - [128, 127, 2, 1, 128, 128, 1, 127]
    - [2, 6.0]
  - - [129, 127, 2, 1, 129, 129, 1, 127]
    - [2, 4.0]
  - - [127, 128, 2, 1, 127, 127, 1, 128]
    - [2, 5.0]
  - - [128, 128, 2, 1, 128, 128, 1, 128]
    - [2, 5.0]
  - - [129, 128, 2, 1, 129, 129, 1, 128]
    - [2, 5.0]
  - - [127, 129, 2, 1, 127, 127, 1, 129]
    - [2, 5.0]
  - - [128, 129, 2, 1, 128, 128, 1, 129]
    - [2, 5.0]
  - - [129, 129, 2, 1, 129, 129, 1, 129]
    - [2, 5.0]
- null
