library/src/blas3/Tensile/Logic/hip_full/hip_Cijk_Ailk_Bjlk_HB_GB.yaml
- {MinimumRequiredVersion: 4.40.0}
- hip
- fallback
- [Device 0000]
    SolutionIndex: 0
    SolutionNameMin: Cijk_Ailk_Bjlk_HB_GB_MT32x64x16_SN_TT4_8
    SolutionIndex: 1
    SolutionNameMin: Cijk_Ailk_Bjlk_HB_GB_MT32x64x16_SN_TT4_8
    SolutionIndex: 2
    SolutionNameMin: Cijk_Ailk_Bjlk_HB_GB_MT32x64x16_SN_TT4_8
    SolutionIndex: 3
    SolutionNameMin: Cijk_Ailk_Bjlk_HB_GB_MT32x64x16_SN_TT4_8
    SolutionIndex: 4
    SolutionNameMin: Cijk_Ailk_Bjlk_HB_GB_MT32x64x16_SN_TT4_8
    SolutionIndex: 5
    SolutionNameMin: Cijk_Ailk_Bjlk_HB_GB_MT32x64x16_SN_TT4_8
    SolutionIndex: 6
    SolutionNameMin: Cijk_Ailk_Bjlk_HB_GB_MT32x64x16_SN_TT4_8
    SolutionIndex: 7
    SolutionNameMin: Cijk_Ailk_Bjlk_HB_GB_MT32x64x16_SN_TT4_8
    SolutionIndex: 8
    SolutionNameMin: Cijk_Ailk_Bjlk_HB_GB_MT32x64x16_SN_TT4_8
    SolutionIndex: 9
    SolutionNameMin: Cijk_Ailk_Bjlk_HB_GB_MT16x32x16_SN_TT2_8
- - - [63, 63, 1, 63, 63, 63, 63, 63]
    - [5, 0.00749941]
  - - [64, 63, 1, 63, 64, 64, 64, 63]
    - [8, 0.00758362]
  - - [63, 64, 1, 63, 63, 63, 63, 64]
    - [8, 0.00744278]
  - - [64, 64, 1, 63, 64, 64, 64, 64]
    - [6, 0.00762742]
  - - [63, 63, 2, 63, 63, 63, 63, 63]
    - [5, 0.0106665]
  - - [64, 63, 2, 63, 64, 64, 64, 63]
    - [3, 0.0107258]
  - - [63, 64, 2, 63, 63, 63, 63, 64]
    - [1, 0.0107969]
  - - [64, 64, 2, 63, 64, 64, 64, 64]
    - [2, 0.0108965]
  - - [63, 63, 1, 64, 63, 63, 63, 63]
    - [7, 0.00756411]
  - - [64, 63, 1, 64, 64, 64, 64, 63]
    - [6, 0.00772489]
  - - [63, 64, 1, 64, 63, 63, 63, 64]
    - [8, 0.00770747]
  - - [64, 64, 1, 64, 64, 64, 64, 64]
    - [6, 0.00782883]
  - - [63, 63, 2, 64, 63, 63, 63, 63]
    - [5, 0.010789]
  - - [64, 63, 2, 64, 64, 64, 64, 63]
    - [8, 0.0109541]
  - - [63, 64, 2, 64, 63, 63, 63, 64]
    - [0, 0.0109611]
  - - [64, 64, 2, 64, 64, 64, 64, 64]
    - [1, 0.0111398]
  - - [63, 63, 1, 65, 63, 63, 63, 63]
    - [7, 0.00775199]
  - - [64, 63, 1, 65, 64, 64, 64, 63]
    - [7, 0.00783529]
  - - [63, 64, 1, 65, 63, 63, 63, 64]
    - [7, 0.00788058]
  - - [64, 64, 1, 65, 64, 64, 64, 64]
    - [5, 0.00790765]
  - - [63, 63, 2, 65, 63, 63, 63, 63]
    - [8, 0.0109392]
  - - [64, 63, 2, 65, 64, 64, 64, 63]
    - [7, 0.0109022]
  - - [63, 64, 2, 65, 63, 63, 63, 64]
    - [6, 0.0109765]
  - - [64, 64, 2, 65, 64, 64, 64, 64]
    - [4, 0.0112123]
  - - [8, 8, 63, 8, 8, 8, 8, 8]
    - [9, 0.000861017]
  - - [40, 8, 63, 40, 40, 40, 40, 8]
    - [9, 0.00465512]
  - - [72, 8, 63, 72, 72, 72, 72, 8]
    - [9, 0.00621779]
  - - [8, 40, 63, 8, 8, 8, 8, 40]
    - [9, 0.00221844]
  - - [40, 40, 63, 40, 40, 40, 40, 40]
    - [9, 0.0101463]
  - - [72, 40, 63, 72, 72, 72, 72, 40]
    - [9, 0.0158987]
  - - [8, 72, 63, 8, 8, 8, 8, 72]
    - [9, 0.00248921]
  - - [40, 72, 63, 40, 40, 40, 40, 72]
    - [9, 0.012026]
  - - [72, 72, 63, 72, 72, 72, 72, 72]
    - [9, 0.0191236]
  - - [8, 8, 64, 8, 8, 8, 8, 8]
    - [9, 0.00113639]
  - - [40, 8, 64, 40, 40, 40, 40, 8]
    - [9, 0.00485996]
  - - [72, 8, 64, 72, 72, 72, 72, 8]
    - [9, 0.00626147]
  - - [8, 40, 64, 8, 8, 8, 8, 40]
    - [9, 0.00206834]
  - - [40, 40, 64, 40, 40, 40, 40, 40]
    - [9, 0.0104626]
  - - [72, 40, 64, 72, 72, 72, 72, 40]
    - [9, 0.0160468]
  - - [8, 72, 64, 8, 8, 8, 8, 72]
    - [9, 0.00249241]
  - - [40, 72, 64, 40, 40, 40, 40, 72]
    - [9, 0.011966]
  - - [72, 72, 64, 72, 72, 72, 72, 72]
    - [9, 0.0192201]
- null
- null
- DeviceEfficiency
