library/src/blas3/Tensile/Logic/hip_full/hip_Cijk_Ailk_Bljk_CB_GB.yaml
- {MinimumRequiredVersion: 4.40.0}
- hip
- fallback
- [Device 0000]
    SolutionIndex: 0
    SolutionNameMin: Cijk_Ailk_Bljk_CB_GB_MT24x24x8_SN_AMAS0_LRVW1_NLCA3_TT3_3_VW1_VWB1_WG8_8_1
    SolutionIndex: 1
    SolutionNameMin: Cijk_Ailk_Bljk_CB_GB_MT32x32x2_SN_AMAS0_LRVW1_NLCA1_TT4_4_VW1_VWB1_WG8_8_1
    SolutionIndex: 2
    SolutionNameMin: Cijk_Ailk_Bljk_CB_GB_MT64x64x4_SN_AMAS2_LRVW2_NLCA1_TT4_4_VW2_VWB2_WG16_16_1
    SolutionIndex: 3
    SolutionNameMin: Cijk_Ailk_Bljk_CB_GB_MT32x32x2_SN_AMAS2_LRVW2_NLCA1_TT4_4_VW2_VWB2_WG8_8_1
    SolutionIndex: 4
    SolutionNameMin: Cijk_Ailk_Bljk_CB_GB_MT40x40x8_SN_AMAS0_LRVW1_NLCA5_TT5_5_VW1_VWB1_WG8_8_1
- - - [64, 64, 2, 63, 64, 64, 64, 63]
    - [1, 2.03097]
  - - [65, 65, 2, 63, 65, 65, 65, 63]
    - [1, 2.05631]
  - - [64, 64, 2, 64, 64, 64, 64, 64]
    - [0, 2.08857]
  - - [65, 65, 2, 64, 65, 65, 65, 64]
    - [0, 2.11006]
  - - [64, 64, 2, 65, 64, 64, 64, 65]
    - [0, 2.10607]
  - - [65, 65, 2, 65, 65, 65, 65, 65]
    - [0, 2.10925]
  - - [127, 127, 2, 63, 127, 127, 127, 63]
    - [3, 3.49251]
  - - [128, 128, 2, 63, 128, 128, 128, 63]
    - [3, 3.52142]
  - - [129, 129, 2, 63, 129, 129, 129, 63]
    - [4, 3.53273]
  - - [127, 127, 2, 64, 127, 127, 127, 64]
    - [2, 3.55343]
  - - [128, 128, 2, 64, 128, 128, 128, 64]
    - [0, 3.57339]
  - - [129, 129, 2, 64, 129, 129, 129, 64]
    - [4, 3.57933]
  - - [127, 127, 2, 65, 127, 127, 127, 65]
    - [3, 3.5724]
  - - [128, 128, 2, 65, 128, 128, 128, 65]
    - [0, 3.60494]
  - - [129, 129, 2, 65, 129, 129, 129, 65]
    - [4, 3.60603]
- null
- null
- DeviceEfficiency
