library/src/blas3/Tensile/Logic/hip_full/hip_Cijk_Alik_Bljk_HB_GB.yaml
- {MinimumRequiredVersion: 4.40.0}
- hip
- fallback
- [Device 0000]
    SolutionIndex: 0
    SolutionNameMin: Cijk_Alik_Bljk_HB_GB_MT32x32x2_SN_TT4_4
    SolutionIndex: 1
    SolutionNameMin: Cijk_Alik_Bljk_HB_GB_MT32x16x4_SN_TT4_4
    SolutionIndex: 2
    SolutionNameMin: Cijk_Alik_Bljk_HB_GB_MT32x32x4_SN_TT4_4
    SolutionIndex: 3
    SolutionNameMin: Cijk_Alik_Bljk_HB_GB_MT16x48x4_SN_TT2_6
    SolutionIndex: 4
    SolutionNameMin: Cijk_Alik_Bljk_HB_GB_MT32x16x16_SN_TT4_4
    SolutionIndex: 5
    SolutionNameMin: Cijk_Alik_Bljk_HB_GB_MT16x32x16_SN_TT2_8
- - - [63, 63, 1, 63, 63, 63, 63, 63]
    - [3, 0.00893645]
  - - [64, 63, 1, 63, 64, 64, 63, 63]
    - [1, 0.0093112]
  - - [63, 64, 1, 63, 63, 63, 63, 63]
    - [3, 0.00883304]
  - - [64, 64, 1, 63, 64, 64, 63, 63]
    - [1, 0.00918084]
  - - [63, 65, 1, 63, 63, 63, 63, 63]
    - [3, 0.00906676]
  - - [64, 65, 1, 63, 64, 64, 63, 63]
    - [3, 0.00940884]
  - - [63, 63, 2, 63, 63, 63, 63, 63]
    - [1, 0.0125081]
  - - [64, 63, 2, 63, 64, 64, 63, 63]
    - [1, 0.0124226]
  - - [63, 64, 2, 63, 63, 63, 63, 63]
    - [3, 0.0125863]
  - - [64, 64, 2, 63, 64, 64, 63, 63]
    - [3, 0.0126419]
  - - [63, 65, 2, 63, 63, 63, 63, 63]
    - [3, 0.0127745]
  - - [64, 65, 2, 63, 64, 64, 63, 63]
    - [3, 0.0124927]
  - - [63, 63, 3, 63, 63, 63, 63, 63]
    - [2, 0.0139883]
  - - [64, 63, 3, 63, 64, 64, 63, 63]
    - [1, 0.0141518]
  - - [63, 64, 3, 63, 63, 63, 63, 63]
    - [3, 0.0140979]
  - - [64, 64, 3, 63, 64, 64, 63, 63]
    - [1, 0.0143849]
  - - [63, 65, 3, 63, 63, 63, 63, 63]
    - [3, 0.0141913]
  - - [64, 65, 3, 63, 64, 64, 63, 63]
    - [3, 0.013716]
  - - [63, 63, 1, 64, 63, 63, 64, 64]
    - [1, 0.00911665]
  - - [64, 63, 1, 64, 64, 64, 64, 64]
    - [3, 0.00916892]
  - - [63, 64, 1, 64, 63, 63, 64, 64]
    - [1, 0.00938681]
  - - [64, 64, 1, 64, 64, 64, 64, 64]
    - [3, 0.00929242]
  - - [63, 65, 1, 64, 63, 63, 64, 64]
    - [3, 0.00906772]
  - - [64, 65, 1, 64, 64, 64, 64, 64]
    - [1, 0.00902957]
  - - [63, 63, 2, 64, 63, 63, 64, 64]
    - [3, 0.0124234]
  - - [64, 63, 2, 64, 64, 64, 64, 64]
    - [1, 0.0126913]
  - - [63, 64, 2, 64, 63, 63, 64, 64]
    - [1, 0.0128088]
  - - [64, 64, 2, 64, 64, 64, 64, 64]
    - [1, 0.0130508]
  - - [63, 65, 2, 64, 63, 63, 64, 64]
    - [1, 0.0126865]
  - - [64, 65, 2, 64, 64, 64, 64, 64]
    - [2, 0.0125913]
  - - [63, 63, 3, 64, 63, 63, 64, 64]
    - [3, 0.0142224]
  - - [64, 63, 3, 64, 64, 64, 64, 64]
    - [3, 0.01423]
  - - [63, 64, 3, 64, 63, 63, 64, 64]
    - [0, 0.0141129]
  - - [64, 64, 3, 64, 64, 64, 64, 64]
    - [1, 0.0145071]
  - - [63, 65, 3, 64, 63, 63, 64, 64]
    - [1, 0.0140276]
  - - [64, 65, 3, 64, 64, 64, 64, 64]
    - [3, 0.0145304]
  - - [1, 1, 1, 1, 1, 1, 1, 1]
    - [0, 7.9099e-08]
  - - [8, 8, 1, 63, 8, 8, 63, 63]
    - [5, 0.000199041]
  - - [40, 8, 1, 63, 40, 40, 63, 63]
    - [5, 0.00119896]
  - - [8, 40, 1, 63, 8, 8, 63, 63]
    - [4, 0.00119142]
  - - [40, 40, 1, 63, 40, 40, 63, 63]
    - [5, 0.00472154]
  - - [8, 8, 2, 63, 8, 8, 63, 63]
    - [5, 0.000526799]
  - - [40, 8, 2, 63, 40, 40, 63, 63]
    - [5, 0.00203774]
  - - [8, 40, 2, 63, 8, 8, 63, 63]
    - [4, 0.00199526]
  - - [40, 40, 2, 63, 40, 40, 63, 63]
    - [5, 0.00733924]
  - - [8, 8, 3, 63, 8, 8, 63, 63]
    - [5, 0.000729894]
  - - [40, 8, 3, 63, 40, 40, 63, 63]
    - [5, 0.00266826]
  - - [8, 40, 3, 63, 8, 8, 63, 63]
    - [4, 0.00262547]
  - - [40, 40, 3, 63, 40, 40, 63, 63]
    - [5, 0.00870066]
  - - [8, 8, 1, 64, 8, 8, 64, 64]
    - [5, 0.00028779]
  - - [40, 8, 1, 64, 40, 40, 64, 64]
    - [5, 0.00122254]
  - - [8, 40, 1, 64, 8, 8, 64, 64]
    - [4, 0.00120258]
  - - [40, 40, 1, 64, 40, 40, 64, 64]
    - [4, 0.00492456]
  - - [8, 8, 2, 64, 8, 8, 64, 64]
    - [5, 0.000549554]
  - - [40, 8, 2, 64, 40, 40, 64, 64]
    - [5, 0.00209953]
  - - [8, 40, 2, 64, 8, 8, 64, 64]
    - [5, 0.00204944]
  - - [40, 40, 2, 64, 40, 40, 64, 64]
    - [4, 0.00758226]
  - - [8, 8, 3, 64, 8, 8, 64, 64]
    - [5, 0.000746516]
  - - [40, 8, 3, 64, 40, 40, 64, 64]
    - [5, 0.00275355]
  - - [8, 40, 3, 64, 8, 8, 64, 64]
    - [4, 0.00265626]
  - - [40, 40, 3, 64, 40, 40, 64, 64]
    - [5, 0.00912343]
- null
- null
- DeviceEfficiency
