library/src/blas3/Tensile/Logic/hip_full/hip_Cijk_Alik_Bjlk_I8II_BH.yaml
- {MinimumRequiredVersion: 4.40.0}
- hip
- fallback
- [Device 0000]
    SolutionIndex: 0
    SolutionNameMin: Cijk_Alik_Bjlk_I8II_BH_MT32x16x8_SN_GSU1_TT4_2
    SolutionIndex: 1
    SolutionNameMin: Cijk_Alik_Bjlk_I8II_BH_MT32x32x8_SN_GSU1_TT4_4
    SolutionIndex: 2
    SolutionNameMin: Cijk_Alik_Bjlk_I8II_BH_MT16x64x16_SN_GSU1_TT2_8
    SolutionIndex: 3
    SolutionNameMin: Cijk_Alik_Bjlk_I8II_BH_MT64x16x16_SN_GSU1_TT8_2
    SolutionIndex: 4
    SolutionNameMin: Cijk_Alik_Bjlk_I8II_BH_MT16x64x16_SN_GSU1_TT2_8
- - - [127, 127, 2, 63, 127, 127, 63, 127]
    - [2, 137.314]
  - - [128, 128, 2, 63, 128, 128, 63, 128]
    - [1, 184.65]
  - - [129, 129, 2, 63, 129, 129, 63, 129]
    - [1, 183.605]
  - - [127, 127, 2, 64, 127, 127, 64, 127]
    - [0, 194.033]
  - - [128, 128, 2, 64, 128, 128, 64, 128]
    - [0, 199.729]
  - - [129, 129, 2, 64, 129, 129, 64, 129]
    - [0, 200.192]
  - - [127, 127, 2, 65, 127, 127, 65, 127]
    - [0, 195.96]
  - - [128, 128, 2, 65, 128, 128, 65, 128]
    - [0, 199.805]
  - - [129, 129, 2, 65, 129, 129, 65, 129]
    - [0, 203.703]
  - - [1, 1, 2, 1, 1, 1, 1, 1]
    - [4, 0.000186916]
  - - [1, 127, 2, 63, 1, 1, 63, 127]
    - [4, 1.07396]
  - - [1, 128, 2, 63, 1, 1, 63, 128]
    - [3, 1.30692]
  - - [1, 129, 2, 63, 1, 1, 63, 129]
    - [3, 1.32362]
  - - [1, 127, 2, 64, 1, 1, 64, 127]
    - [3, 1.39897]
  - - [1, 128, 2, 64, 1, 1, 64, 128]
    - [3, 1.44991]
  - - [1, 129, 2, 64, 1, 1, 64, 129]
    - [3, 1.44084]
  - - [1, 127, 2, 65, 1, 1, 65, 127]
    - [3, 1.43068]
  - - [1, 128, 2, 65, 1, 1, 65, 128]
    - [3, 1.44696]
  - - [1, 129, 2, 65, 1, 1, 65, 129]
    - [3, 1.45567]
  - - [127, 1, 2, 63, 127, 127, 63, 1]
    - [3, 1.40609]
  - - [128, 1, 2, 63, 128, 128, 63, 1]
    - [4, 1.46618]
  - - [129, 1, 2, 63, 129, 129, 63, 1]
    - [3, 1.41832]
  - - [127, 1, 2, 64, 127, 127, 64, 1]
    - [4, 1.29221]
  - - [128, 1, 2, 64, 128, 128, 64, 1]
    - [4, 1.51985]
  - - [129, 1, 2, 64, 129, 129, 64, 1]
    - [3, 1.44588]
  - - [127, 1, 2, 65, 127, 127, 65, 1]
    - [4, 1.30612]
  - - [128, 1, 2, 65, 128, 128, 65, 1]
    - [4, 1.51548]
  - - [129, 1, 2, 65, 129, 129, 65, 1]
    - [3, 1.44569]
  - - [127, 127, 2, 1, 127, 127, 1, 127]
    - [4, 3.27825]
  - - [128, 127, 2, 1, 128, 128, 1, 127]
    - [4, 3.40797]
  - - [129, 127, 2, 1, 129, 129, 1, 127]
    - [4, 3.42741]
  - - [127, 128, 2, 1, 127, 127, 1, 128]
    - [4, 3.39374]
  - - [128, 128, 2, 1, 128, 128, 1, 128]
    - [4, 3.4348]
  - - [129, 128, 2, 1, 129, 129, 1, 128]
    - [4, 3.45439]
  - - [127, 129, 2, 1, 127, 127, 1, 129]
    - [4, 3.56152]
  - - [128, 129, 2, 1, 128, 128, 1, 129]
    - [4, 3.47621]
  - - [129, 129, 2, 1, 129, 129, 1, 129]
    - [4, 3.59417]
- null
- null
- DeviceEfficiency
