library/src/blas3/Tensile/Logic/asm_full/navi33/navi33_Cijk_Alik_Bljk_HHS_BH.yaml
- {MinimumRequiredVersion: 4.35.0}
- navi33
- gfx1102
- [Device 73f0]
    SolutionIndex: 0
    SolutionNameMin: Cijk_Alik_Bljk_HHS_BH_MT128x128x32_MI16x16x16x1_SN_EPS0_GRVW4_SIA1_SU0_SUS0_SVW2_VW2_WGM1
    SolutionIndex: 1
    SolutionNameMin: Cijk_Alik_Bljk_HHS_BH_MT128x128x32_MI16x16x16x1_SN_EPS0_GRVW4_SIA1_SU0_SUS0_SVW4_VW4_WGM1
    SolutionIndex: 2
    SolutionNameMin: Cijk_Alik_Bljk_HHS_BH_MT128x128x32_MI16x16x16x1_SN_EPS0_GRVW8_SIA1_SU0_SUS0_SVW2_VW2_WGM1
    SolutionIndex: 3
    SolutionNameMin: Cijk_Alik_Bljk_HHS_BH_MT128x128x32_MI16x16x16x1_SN_EPS0_GRVW8_SIA1_SU0_SUS0_SVW4_VW4_WGM1
    SolutionIndex: 4
    SolutionNameMin: Cijk_Alik_Bljk_HHS_BH_MT128x128x32_MI16x16x16x1_SN_EPS1_GRVW4_SIA1_SU0_SUS0_SVW2_VW2_WGM1
    SolutionIndex: 5
    SolutionNameMin: Cijk_Alik_Bljk_HHS_BH_MT128x128x32_MI16x16x16x1_SN_EPS1_GRVW4_SIA1_SU0_SUS0_SVW4_VW4_WGM1
    SolutionIndex: 6
    SolutionNameMin: Cijk_Alik_Bljk_HHS_BH_MT128x128x32_MI16x16x16x1_SN_EPS1_GRVW8_SIA1_SU0_SUS0_SVW2_VW2_WGM1
    SolutionIndex: 7
    SolutionNameMin: Cijk_Alik_Bljk_HHS_BH_MT128x128x32_MI16x16x16x1_SN_EPS1_GRVW8_SIA1_SU0_SUS0_SVW4_VW4_WGM1
    SolutionIndex: 8
    SolutionNameMin: Cijk_Alik_Bljk_HHS_BH_MT128x128x32_MI16x16x16x1_SN_EPS0_GRVW8_SIA3_SU0_SUS0_SVW4_VW4_WGM1
    SolutionIndex: 9
    SolutionNameMin: Cijk_Alik_Bljk_HHS_BH_MT128x128x32_MI16x16x16x1_SN_EPS1_GRVW8_SIA3_SU0_SUS0_SVW2_VW2_WGM1
    SolutionIndex: 10
    SolutionNameMin: Cijk_Alik_Bljk_HHS_BH_MT128x128x32_MI16x16x16x1_SN_EPS0_GRVW4_SIA1_SU32_SUS256_SVW4_VW4_WGM1
    SolutionIndex: 11
    SolutionNameMin: Cijk_Alik_Bljk_HHS_BH_MT128x128x32_MI16x16x16x1_SN_EPS0_GRVW8_SIA1_SU32_SUS256_SVW2_VW2_WGM1
    SolutionIndex: 12
    SolutionNameMin: Cijk_Alik_Bljk_HHS_BH_MT128x128x32_MI16x16x16x1_SN_EPS0_GRVW8_SIA1_SU32_SUS256_SVW4_VW4_WGM1
    SolutionIndex: 13
    SolutionNameMin: Cijk_Alik_Bljk_HHS_BH_MT128x128x32_MI16x16x16x1_SN_EPS1_GRVW4_SIA1_SU32_SUS256_SVW2_VW2_WGM1
    SolutionIndex: 14
    SolutionNameMin: Cijk_Alik_Bljk_HHS_BH_MT128x128x32_MI16x16x16x1_SN_EPS1_GRVW4_SIA1_SU32_SUS256_SVW4_VW4_WGM1
    SolutionIndex: 15
    SolutionNameMin: Cijk_Alik_Bljk_HHS_BH_MT128x128x32_MI16x16x16x1_SN_EPS1_GRVW8_SIA1_SU32_SUS256_SVW2_VW2_WGM1
    SolutionIndex: 16
    SolutionNameMin: Cijk_Alik_Bljk_HHS_BH_MT128x128x32_MI16x16x16x1_SN_EPS1_GRVW8_SIA1_SU32_SUS256_SVW4_VW4_WGM1
    SolutionIndex: 17
    SolutionNameMin: Cijk_Alik_Bljk_HHS_BH_MT128x128x32_MI16x16x16x1_SN_EPS0_GRVW8_SIA3_SU32_SUS256_SVW4_VW4_WGM1
    SolutionIndex: 18
    SolutionNameMin: Cijk_Alik_Bljk_HHS_BH_MT128x128x32_MI16x16x16x1_SN_EPS1_GRVW8_SIA3_SU32_SUS256_SVW2_VW2_WGM1
    SolutionIndex: 19
    SolutionNameMin: Cijk_Alik_Bljk_HHS_BH_MT128x128x32_MI16x16x16x1_SN_EPS0_GRVW4_SIA1_SU0_SUS0_SVW2_VW2_WGM4
    SolutionIndex: 20
    SolutionNameMin: Cijk_Alik_Bljk_HHS_BH_MT128x128x32_MI16x16x16x1_SN_EPS0_GRVW8_SIA1_SU0_SUS0_SVW2_VW2_WGM4
    SolutionIndex: 21
    SolutionNameMin: Cijk_Alik_Bljk_HHS_BH_MT128x128x32_MI16x16x16x1_SN_EPS0_GRVW8_SIA1_SU0_SUS0_SVW4_VW4_WGM4
    SolutionIndex: 22
    SolutionNameMin: Cijk_Alik_Bljk_HHS_BH_MT128x128x32_MI16x16x16x1_SN_EPS1_GRVW4_SIA1_SU0_SUS0_SVW2_VW2_WGM4
    SolutionIndex: 23
    SolutionNameMin: Cijk_Alik_Bljk_HHS_BH_MT128x128x32_MI16x16x16x1_SN_EPS1_GRVW4_SIA1_SU0_SUS0_SVW4_VW4_WGM4
    SolutionIndex: 24
    SolutionNameMin: Cijk_Alik_Bljk_HHS_BH_MT128x128x32_MI16x16x16x1_SN_EPS1_GRVW8_SIA1_SU0_SUS0_SVW2_VW2_WGM4
    SolutionIndex: 25
    SolutionNameMin: Cijk_Alik_Bljk_HHS_BH_MT128x128x32_MI16x16x16x1_SN_EPS1_GRVW8_SIA1_SU0_SUS0_SVW4_VW4_WGM4
    SolutionIndex: 26
    SolutionNameMin: Cijk_Alik_Bljk_HHS_BH_MT128x128x32_MI16x16x16x1_SN_EPS0_GRVW8_SIA3_SU0_SUS0_SVW2_VW2_WGM4
    SolutionIndex: 27
    SolutionNameMin: Cijk_Alik_Bljk_HHS_BH_MT128x128x32_MI16x16x16x1_SN_EPS1_GRVW8_SIA3_SU0_SUS0_SVW2_VW2_WGM4
    SolutionIndex: 28
    SolutionNameMin: Cijk_Alik_Bljk_HHS_BH_MT128x128x32_MI16x16x16x1_SN_EPS0_GRVW4_SIA1_SU32_SUS256_SVW4_VW4_WGM4
    SolutionIndex: 29
    SolutionNameMin: Cijk_Alik_Bljk_HHS_BH_MT128x128x32_MI16x16x16x1_SN_EPS0_GRVW8_SIA1_SU32_SUS256_SVW2_VW2_WGM4
    SolutionIndex: 30
    SolutionNameMin: Cijk_Alik_Bljk_HHS_BH_MT128x128x32_MI16x16x16x1_SN_EPS0_GRVW8_SIA1_SU32_SUS256_SVW4_VW4_WGM4
    SolutionIndex: 31
    SolutionNameMin: Cijk_Alik_Bljk_HHS_BH_MT128x128x32_MI16x16x16x1_SN_EPS1_GRVW4_SIA1_SU32_SUS256_SVW2_VW2_WGM4
    SolutionIndex: 32
    SolutionNameMin: Cijk_Alik_Bljk_HHS_BH_MT128x128x32_MI16x16x16x1_SN_EPS1_GRVW4_SIA1_SU32_SUS256_SVW4_VW4_WGM4
    SolutionIndex: 33
    SolutionNameMin: Cijk_Alik_Bljk_HHS_BH_MT128x128x32_MI16x16x16x1_SN_EPS1_GRVW8_SIA1_SU32_SUS256_SVW2_VW2_WGM4
    SolutionIndex: 34
    SolutionNameMin: Cijk_Alik_Bljk_HHS_BH_MT128x128x32_MI16x16x16x1_SN_EPS1_GRVW8_SIA1_SU32_SUS256_SVW4_VW4_WGM4
    SolutionIndex: 35
    SolutionNameMin: Cijk_Alik_Bljk_HHS_BH_MT128x128x32_MI16x16x16x1_SN_EPS0_GRVW8_SIA3_SU32_SUS256_SVW2_VW2_WGM4
    SolutionIndex: 36
    SolutionNameMin: Cijk_Alik_Bljk_HHS_BH_MT128x128x32_MI16x16x16x1_SN_EPS1_GRVW8_SIA3_SU32_SUS256_SVW2_VW2_WGM4
    SolutionIndex: 37
    SolutionNameMin: Cijk_Alik_Bljk_HHS_BH_MT128x128x32_MI16x16x16x1_SN_EPS0_GRVW4_SIA1_SU0_SUS0_SVW2_VW2_WGM8
    SolutionIndex: 38
    SolutionNameMin: Cijk_Alik_Bljk_HHS_BH_MT128x128x32_MI16x16x16x1_SN_EPS0_GRVW4_SIA1_SU0_SUS0_SVW4_VW4_WGM8
    SolutionIndex: 39
    SolutionNameMin: Cijk_Alik_Bljk_HHS_BH_MT128x128x32_MI16x16x16x1_SN_EPS0_GRVW8_SIA1_SU0_SUS0_SVW2_VW2_WGM8
    SolutionIndex: 40
    SolutionNameMin: Cijk_Alik_Bljk_HHS_BH_MT128x128x32_MI16x16x16x1_SN_EPS0_GRVW8_SIA1_SU0_SUS0_SVW4_VW4_WGM8
    SolutionIndex: 41
    SolutionNameMin: Cijk_Alik_Bljk_HHS_BH_MT128x128x32_MI16x16x16x1_SN_EPS1_GRVW4_SIA1_SU0_SUS0_SVW2_VW2_WGM8
    SolutionIndex: 42
    SolutionNameMin: Cijk_Alik_Bljk_HHS_BH_MT128x128x32_MI16x16x16x1_SN_EPS1_GRVW4_SIA1_SU0_SUS0_SVW4_VW4_WGM8
    SolutionIndex: 43
    SolutionNameMin: Cijk_Alik_Bljk_HHS_BH_MT128x128x32_MI16x16x16x1_SN_EPS1_GRVW8_SIA1_SU0_SUS0_SVW2_VW2_WGM8
    SolutionIndex: 44
    SolutionNameMin: Cijk_Alik_Bljk_HHS_BH_MT128x128x32_MI16x16x16x1_SN_EPS1_GRVW8_SIA1_SU0_SUS0_SVW4_VW4_WGM8
    SolutionIndex: 45
    SolutionNameMin: Cijk_Alik_Bljk_HHS_BH_MT128x128x32_MI16x16x16x1_SN_EPS0_GRVW8_SIA3_SU0_SUS0_SVW2_VW2_WGM8
    SolutionIndex: 46
    SolutionNameMin: Cijk_Alik_Bljk_HHS_BH_MT128x128x32_MI16x16x16x1_SN_EPS1_GRVW8_SIA3_SU0_SUS0_SVW2_VW2_WGM8
    SolutionIndex: 47
    SolutionNameMin: Cijk_Alik_Bljk_HHS_BH_MT128x128x32_MI16x16x16x1_SN_EPS0_GRVW4_SIA1_SU32_SUS256_SVW4_VW4_WGM8
    SolutionIndex: 48
    SolutionNameMin: Cijk_Alik_Bljk_HHS_BH_MT128x128x32_MI16x16x16x1_SN_EPS0_GRVW8_SIA1_SU32_SUS256_SVW2_VW2_WGM8
    SolutionIndex: 49
    SolutionNameMin: Cijk_Alik_Bljk_HHS_BH_MT128x128x32_MI16x16x16x1_SN_EPS0_GRVW8_SIA1_SU32_SUS256_SVW4_VW4_WGM8
    SolutionIndex: 50
    SolutionNameMin: Cijk_Alik_Bljk_HHS_BH_MT128x128x32_MI16x16x16x1_SN_EPS1_GRVW4_SIA1_SU32_SUS256_SVW2_VW2_WGM8
    SolutionIndex: 51
    SolutionNameMin: Cijk_Alik_Bljk_HHS_BH_MT128x128x32_MI16x16x16x1_SN_EPS1_GRVW8_SIA1_SU32_SUS256_SVW2_VW2_WGM8
    SolutionIndex: 52
    SolutionNameMin: Cijk_Alik_Bljk_HHS_BH_MT128x128x32_MI16x16x16x1_SN_EPS1_GRVW8_SIA1_SU32_SUS256_SVW4_VW4_WGM8
    SolutionIndex: 53
    SolutionNameMin: Cijk_Alik_Bljk_HHS_BH_MT128x128x32_MI16x16x16x1_SN_EPS1_GRVW8_SIA3_SU32_SUS256_SVW2_VW2_WGM8
- - - [64, 64, 1, 64, 96, 96, 96, 96]
    - [8, 36.7457]
  - - [64, 64, 1, 128, 96, 96, 160, 160]
    - [20, 68.6421]
  - - [64, 64, 1, 256, 96, 96, 288, 288]
    - [29, 111.931]
  - - [64, 64, 1, 512, 96, 96, 544, 544]
    - [39, 175.083]
  - - [64, 64, 1, 1024, 96, 96, 1056, 1056]
    - [39, 247.116]
  - - [64, 64, 1, 2048, 96, 96, 2080, 2080]
    - [2, 310.505]
  - - [64, 64, 1, 4096, 96, 96, 4128, 4128]
    - [2, 340.267]
  - - [64, 128, 1, 64, 96, 96, 96, 96]
    - [40, 65.5114]
  - - [64, 128, 1, 128, 96, 96, 160, 160]
    - [21, 121.913]
  - - [64, 128, 1, 256, 96, 96, 288, 288]
    - [3, 220.312]
  - - [64, 128, 1, 512, 96, 96, 544, 544]
    - [39, 349.234]
  - - [64, 128, 1, 1024, 96, 96, 1056, 1056]
    - [6, 491.856]
  - - [64, 128, 1, 2048, 96, 96, 2080, 2080]
    - [24, 618.149]
  - - [64, 128, 1, 4096, 96, 96, 4128, 4128]
    - [33, 679.307]
  - - [64, 256, 1, 64, 96, 96, 96, 96]
    - [21, 151.99]
  - - [64, 256, 1, 128, 96, 96, 160, 160]
    - [6, 279.582]
  - - [64, 256, 1, 256, 96, 96, 288, 288]
    - [6, 479.567]
  - - [64, 256, 1, 512, 96, 96, 544, 544]
    - [2, 745.52]
  - - [64, 256, 1, 1024, 96, 96, 1056, 1056]
    - [39, 1027.01]
  - - [64, 256, 1, 2048, 96, 96, 2080, 2080]
    - [39, 1260.26]
  - - [64, 256, 1, 4096, 96, 96, 4128, 4128]
    - [43, 1410.03]
  - - [64, 512, 1, 64, 96, 96, 96, 96]
    - [12, 305.795]
  - - [64, 512, 1, 128, 96, 96, 160, 160]
    - [20, 562.013]
  - - [64, 512, 1, 256, 96, 96, 288, 288]
    - [39, 962.548]
  - - [64, 512, 1, 512, 96, 96, 544, 544]
    - [2, 1496.89]
  - - [64, 512, 1, 1024, 96, 96, 1056, 1056]
    - [2, 2078.96]
  - - [64, 512, 1, 2048, 96, 96, 2080, 2080]
    - [24, 2569.05]
  - - [64, 512, 1, 4096, 96, 96, 4128, 4128]
    - [24, 2891.68]
  - - [64, 1024, 1, 64, 96, 96, 96, 96]
    - [20, 622.3]
  - - [64, 1024, 1, 128, 96, 96, 160, 160]
    - [48, 1147.71]
  - - [64, 1024, 1, 256, 96, 96, 288, 288]
    - [20, 1956.06]
  - - [64, 1024, 1, 512, 96, 96, 544, 544]
    - [31, 3043.76]
  - - [64, 1024, 1, 1024, 96, 96, 1056, 1056]
    - [51, 4295.79]
  - - [64, 1024, 1, 2048, 96, 96, 2080, 2080]
    - [41, 5258.89]
  - - [64, 1024, 1, 4096, 96, 96, 4128, 4128]
    - [11, 5969.6]
  - - [64, 2048, 1, 64, 96, 96, 96, 96]
    - [20, 1227.66]
  - - [64, 2048, 1, 128, 96, 96, 160, 160]
    - [39, 2253.48]
  - - [64, 2048, 1, 256, 96, 96, 288, 288]
    - [37, 3857.27]
  - - [64, 2048, 1, 512, 96, 96, 544, 544]
    - [19, 6011.17]
  - - [64, 2048, 1, 1024, 96, 96, 1056, 1056]
    - [4, 8396.99]
  - - [64, 2048, 1, 2048, 96, 96, 2080, 2080]
    - [51, 10595.4]
  - - [64, 2048, 1, 4096, 96, 96, 4128, 4128]
    - [39, 12061.8]
  - - [64, 4096, 1, 64, 96, 96, 96, 96]
    - [26, 2226.57]
  - - [64, 4096, 1, 128, 96, 96, 160, 160]
    - [27, 3942.02]
  - - [64, 4096, 1, 256, 96, 96, 288, 288]
    - [9, 6505.95]
  - - [64, 4096, 1, 512, 96, 96, 544, 544]
    - [4, 9536.56]
  - - [64, 4096, 1, 1024, 96, 96, 1056, 1056]
    - [33, 12933.5]
  - - [64, 4096, 1, 2048, 96, 96, 2080, 2080]
    - [33, 15681.0]
  - - [64, 4096, 1, 4096, 96, 96, 4128, 4128]
    - [46, 16253.5]
  - - [128, 64, 1, 64, 160, 160, 96, 96]
    - [7, 73.833]
  - - [128, 64, 1, 128, 160, 160, 160, 160]
    - [20, 135.633]
  - - [128, 64, 1, 256, 160, 160, 288, 288]
    - [0, 233.509]
  - - [128, 64, 1, 512, 160, 160, 544, 544]
    - [20, 344.955]
  - - [128, 64, 1, 1024, 160, 160, 1056, 1056]
    - [24, 486.267]
  - - [128, 64, 1, 2048, 160, 160, 2080, 2080]
    - [6, 611.525]
  - - [128, 64, 1, 4096, 160, 160, 4128, 4128]
    - [15, 666.807]
  - - [128, 128, 1, 64, 160, 160, 96, 96]
    - [21, 178.603]
  - - [128, 128, 1, 128, 160, 160, 160, 160]
    - [7, 331.723]
  - - [128, 128, 1, 256, 160, 160, 288, 288]
    - [2, 547.557]
  - - [128, 128, 1, 512, 160, 160, 544, 544]
    - [6, 824.35]
  - - [128, 128, 1, 1024, 160, 160, 1056, 1056]
    - [43, 1096.84]
  - - [128, 128, 1, 2048, 160, 160, 2080, 2080]
    - [51, 1317.2]
  - - [128, 128, 1, 4096, 160, 160, 4128, 4128]
    - [43, 1409.91]
  - - [128, 256, 1, 64, 160, 160, 96, 96]
    - [47, 368.437]
  - - [128, 256, 1, 128, 160, 160, 160, 160]
    - [3, 662.189]
  - - [128, 256, 1, 256, 160, 160, 288, 288]
    - [39, 1096.26]
  - - [128, 256, 1, 512, 160, 160, 544, 544]
    - [43, 1651.95]
  - - [128, 256, 1, 1024, 160, 160, 1056, 1056]
    - [24, 2200.28]
  - - [128, 256, 1, 2048, 160, 160, 2080, 2080]
    - [6, 2639.9]
  - - [128, 256, 1, 4096, 160, 160, 4128, 4128]
    - [6, 2887.08]
  - - [128, 512, 1, 64, 160, 160, 96, 96]
    - [7, 798.611]
  - - [128, 512, 1, 128, 160, 160, 160, 160]
    - [23, 1415.08]
  - - [128, 512, 1, 256, 160, 160, 288, 288]
    - [43, 2341.22]
  - - [128, 512, 1, 512, 160, 160, 544, 544]
    - [20, 3489.44]
  - - [128, 512, 1, 1024, 160, 160, 1056, 1056]
    - [43, 4564.91]
  - - [128, 512, 1, 2048, 160, 160, 2080, 2080]
    - [6, 5405.67]
  - - [128, 512, 1, 4096, 160, 160, 4128, 4128]
    - [33, 5917.36]
  - - [128, 1024, 1, 64, 160, 160, 96, 96]
    - [52, 1583.05]
  - - [128, 1024, 1, 128, 160, 160, 160, 160]
    - [7, 2834.47]
  - - [128, 1024, 1, 256, 160, 160, 288, 288]
    - [29, 4702.13]
  - - [128, 1024, 1, 512, 160, 160, 544, 544]
    - [29, 6981.04]
  - - [128, 1024, 1, 1024, 160, 160, 1056, 1056]
    - [51, 9150.99]
  - - [128, 1024, 1, 2048, 160, 160, 2080, 2080]
    - [20, 10891.2]
  - - [128, 1024, 1, 4096, 160, 160, 4128, 4128]
    - [43, 12325.1]
  - - [128, 2048, 1, 64, 160, 160, 96, 96]
    - [44, 2882.68]
  - - [128, 2048, 1, 128, 160, 160, 160, 160]
    - [40, 5170.97]
  - - [128, 2048, 1, 256, 160, 160, 288, 288]
    - [39, 8593.78]
  - - [128, 2048, 1, 512, 160, 160, 544, 544]
    - [51, 12941.6]
  - - [128, 2048, 1, 1024, 160, 160, 1056, 1056]
    - [20, 17751.3]
  - - [128, 2048, 1, 2048, 160, 160, 2080, 2080]
    - [2, 21555.8]
  - - [128, 2048, 1, 4096, 160, 160, 4128, 4128]
    - [15, 24389.9]
  - - [128, 4096, 1, 64, 160, 160, 96, 96]
    - [9, 4599.63]
  - - [128, 4096, 1, 128, 160, 160, 160, 160]
    - [45, 8503.38]
  - - [128, 4096, 1, 256, 160, 160, 288, 288]
    - [18, 13859.7]
  - - [128, 4096, 1, 512, 160, 160, 544, 544]
    - [29, 20533.5]
  - - [128, 4096, 1, 1024, 160, 160, 1056, 1056]
    - [15, 27450.2]
  - - [128, 4096, 1, 2048, 160, 160, 2080, 2080]
    - [6, 32243.5]
  - - [128, 4096, 1, 4096, 160, 160, 4128, 4128]
    - [46, 32669.2]
  - - [256, 64, 1, 64, 288, 288, 96, 96]
    - [21, 159.99]
  - - [256, 64, 1, 128, 288, 288, 160, 160]
    - [2, 296.543]
  - - [256, 64, 1, 256, 288, 288, 288, 288]
    - [20, 485.675]
  - - [256, 64, 1, 512, 288, 288, 544, 544]
    - [6, 717.832]
  - - [256, 64, 1, 1024, 288, 288, 1056, 1056]
    - [43, 1018.84]
  - - [256, 64, 1, 2048, 288, 288, 2080, 2080]
    - [24, 1259.41]
  - - [256, 64, 1, 4096, 288, 288, 4128, 4128]
    - [6, 1335.98]
  - - [256, 128, 1, 64, 288, 288, 96, 96]
    - [52, 376.508]
  - - [256, 128, 1, 128, 288, 288, 160, 160]
    - [7, 693.847]
  - - [256, 128, 1, 256, 288, 288, 288, 288]
    - [20, 1141.15]
  - - [256, 128, 1, 512, 288, 288, 544, 544]
    - [6, 1696.21]
  - - [256, 128, 1, 1024, 288, 288, 1056, 1056]
    - [6, 2236.21]
  - - [256, 128, 1, 2048, 288, 288, 2080, 2080]
    - [6, 2657.77]
  - - [256, 128, 1, 4096, 288, 288, 4128, 4128]
    - [43, 2900.5]
  - - [256, 256, 1, 64, 288, 288, 96, 96]
    - [16, 795.427]
  - - [256, 256, 1, 128, 288, 288, 160, 160]
    - [5, 1415.8]
  - - [256, 256, 1, 256, 288, 288, 288, 288]
    - [43, 2329.51]
  - - [256, 256, 1, 512, 288, 288, 544, 544]
    - [2, 3449.25]
  - - [256, 256, 1, 1024, 288, 288, 1056, 1056]
    - [33, 4417.96]
  - - [256, 256, 1, 2048, 288, 288, 2080, 2080]
    - [6, 5296.04]
  - - [256, 256, 1, 4096, 288, 288, 4128, 4128]
    - [6, 5854.77]
  - - [256, 512, 1, 64, 288, 288, 96, 96]
    - [21, 1523.81]
  - - [256, 512, 1, 128, 288, 288, 160, 160]
    - [25, 2709.06]
  - - [256, 512, 1, 256, 288, 288, 288, 288]
    - [39, 4698.83]
  - - [256, 512, 1, 512, 288, 288, 544, 544]
    - [24, 6919.13]
  - - [256, 512, 1, 1024, 288, 288, 1056, 1056]
    - [51, 9062.03]
  - - [256, 512, 1, 2048, 288, 288, 2080, 2080]
    - [24, 10725.4]
  - - [256, 512, 1, 4096, 288, 288, 4128, 4128]
    - [6, 11877.7]
  - - [256, 1024, 1, 64, 288, 288, 96, 96]
    - [47, 2951.14]
  - - [256, 1024, 1, 128, 288, 288, 160, 160]
    - [25, 5266.74]
  - - [256, 1024, 1, 256, 288, 288, 288, 288]
    - [20, 8731.31]
  - - [256, 1024, 1, 512, 288, 288, 544, 544]
    - [43, 13153.4]
  - - [256, 1024, 1, 1024, 288, 288, 1056, 1056]
    - [24, 17491.0]
  - - [256, 1024, 1, 2048, 288, 288, 2080, 2080]
    - [15, 21173.3]
  - - [256, 1024, 1, 4096, 288, 288, 4128, 4128]
    - [15, 23730.1]
  - - [256, 2048, 1, 64, 288, 288, 96, 96]
    - [40, 4922.17]
  - - [256, 2048, 1, 128, 288, 288, 160, 160]
    - [42, 8645.79]
  - - [256, 2048, 1, 256, 288, 288, 288, 288]
    - [24, 13915.8]
  - - [256, 2048, 1, 512, 288, 288, 544, 544]
    - [39, 20629.8]
  - - [256, 2048, 1, 1024, 288, 288, 1056, 1056]
    - [0, 27165.4]
  - - [256, 2048, 1, 2048, 288, 288, 2080, 2080]
    - [6, 31676.6]
  - - [256, 2048, 1, 4096, 288, 288, 4128, 4128]
    - [24, 33904.5]
  - - [256, 4096, 1, 64, 288, 288, 96, 96]
    - [17, 8928.77]
  - - [256, 4096, 1, 128, 288, 288, 160, 160]
    - [25, 14966.3]
  - - [256, 4096, 1, 256, 288, 288, 288, 288]
    - [7, 21681.2]
  - - [256, 4096, 1, 512, 288, 288, 544, 544]
    - [6, 28146.7]
  - - [256, 4096, 1, 1024, 288, 288, 1056, 1056]
    - [6, 32918.6]
  - - [256, 4096, 1, 2048, 288, 288, 2080, 2080]
    - [43, 34272.5]
  - - [256, 4096, 1, 4096, 288, 288, 4128, 4128]
    - [53, 34792.5]
  - - [384, 64, 1, 64, 416, 416, 96, 96]
    - [11, 255.667]
  - - [384, 64, 1, 128, 416, 416, 160, 160]
    - [2, 470.847]
  - - [384, 64, 1, 256, 416, 416, 288, 288]
    - [20, 765.847]
  - - [384, 64, 1, 512, 416, 416, 544, 544]
    - [48, 1123.98]
  - - [384, 64, 1, 1024, 416, 416, 1056, 1056]
    - [48, 1548.09]
  - - [384, 64, 1, 2048, 416, 416, 2080, 2080]
    - [15, 1901.1]
  - - [384, 64, 1, 4096, 416, 416, 4128, 4128]
    - [33, 2091.7]
  - - [384, 128, 1, 64, 416, 416, 96, 96]
    - [49, 547.464]
  - - [384, 128, 1, 128, 416, 416, 160, 160]
    - [40, 1046.31]
  - - [384, 128, 1, 256, 416, 416, 288, 288]
    - [3, 1728.42]
  - - [384, 128, 1, 512, 416, 416, 544, 544]
    - [24, 2559.32]
  - - [384, 128, 1, 1024, 416, 416, 1056, 1056]
    - [51, 3348.52]
  - - [384, 128, 1, 2048, 416, 416, 2080, 2080]
    - [24, 4000.6]
  - - [384, 128, 1, 4096, 416, 416, 4128, 4128]
    - [24, 4340.61]
  - - [384, 256, 1, 64, 416, 416, 96, 96]
    - [21, 1145.78]
  - - [384, 256, 1, 128, 416, 416, 160, 160]
    - [44, 2036.72]
  - - [384, 256, 1, 256, 416, 416, 288, 288]
    - [2, 3352.31]
  - - [384, 256, 1, 512, 416, 416, 544, 544]
    - [43, 5011.6]
  - - [384, 256, 1, 1024, 416, 416, 1056, 1056]
    - [6, 6638.73]
  - - [384, 256, 1, 2048, 416, 416, 2080, 2080]
    - [43, 7912.21]
  - - [384, 256, 1, 4096, 416, 416, 4128, 4128]
    - [43, 8765.9]
  - - [384, 512, 1, 64, 416, 416, 96, 96]
    - [21, 2307.94]
  - - [384, 512, 1, 128, 416, 416, 160, 160]
    - [7, 4084.68]
  - - [384, 512, 1, 256, 416, 416, 288, 288]
    - [0, 6471.84]
  - - [384, 512, 1, 512, 416, 416, 544, 544]
    - [6, 9722.14]
  - - [384, 512, 1, 1024, 416, 416, 1056, 1056]
    - [24, 12959.5]
  - - [384, 512, 1, 2048, 416, 416, 2080, 2080]
    - [24, 15626.1]
  - - [384, 512, 1, 4096, 416, 416, 4128, 4128]
    - [43, 17407.9]
  - - [384, 1024, 1, 64, 416, 416, 96, 96]
    - [40, 3699.75]
  - - [384, 1024, 1, 128, 416, 416, 160, 160]
    - [53, 6651.44]
  - - [384, 1024, 1, 256, 416, 416, 288, 288]
    - [4, 10926.2]
  - - [384, 1024, 1, 512, 416, 416, 544, 544]
    - [6, 15931.5]
  - - [384, 1024, 1, 1024, 416, 416, 1056, 1056]
    - [6, 20872.6]
  - - [384, 1024, 1, 2048, 416, 416, 2080, 2080]
    - [9, 24281.0]
  - - [384, 1024, 1, 4096, 416, 416, 4128, 4128]
    - [43, 25732.7]
  - - [384, 2048, 1, 64, 416, 416, 96, 96]
    - [49, 6064.77]
  - - [384, 2048, 1, 128, 416, 416, 160, 160]
    - [33, 11356.4]
  - - [384, 2048, 1, 256, 416, 416, 288, 288]
    - [37, 18214.6]
  - - [384, 2048, 1, 512, 416, 416, 544, 544]
    - [51, 24514.6]
  - - [384, 2048, 1, 1024, 416, 416, 1056, 1056]
    - [43, 29736.9]
  - - [384, 2048, 1, 2048, 416, 416, 2080, 2080]
    - [6, 31446.8]
  - - [384, 2048, 1, 4096, 416, 416, 4128, 4128]
    - [51, 33687.0]
  - - [384, 4096, 1, 64, 416, 416, 96, 96]
    - [52, 10806.6]
  - - [384, 4096, 1, 128, 416, 416, 160, 160]
    - [44, 16615.2]
  - - [384, 4096, 1, 256, 416, 416, 288, 288]
    - [44, 22539.9]
  - - [384, 4096, 1, 512, 416, 416, 544, 544]
    - [44, 27574.2]
  - - [384, 4096, 1, 1024, 416, 416, 1056, 1056]
    - [25, 29728.7]
  - - [384, 4096, 1, 2048, 416, 416, 2080, 2080]
    - [50, 32596.5]
  - - [384, 4096, 1, 4096, 416, 416, 4128, 4128]
    - [51, 32614.7]
  - - [768, 64, 1, 64, 800, 800, 96, 96]
    - [30, 499.877]
  - - [768, 64, 1, 128, 800, 800, 160, 160]
    - [12, 923.313]
  - - [768, 64, 1, 256, 800, 800, 288, 288]
    - [13, 1497.78]
  - - [768, 64, 1, 512, 800, 800, 544, 544]
    - [24, 2229.43]
  - - [768, 64, 1, 1024, 800, 800, 1056, 1056]
    - [6, 3067.31]
  - - [768, 64, 1, 2048, 800, 800, 2080, 2080]
    - [43, 3766.63]
  - - [768, 64, 1, 4096, 800, 800, 4128, 4128]
    - [19, 4000.92]
  - - [768, 128, 1, 64, 800, 800, 96, 96]
    - [38, 1097.98]
  - - [768, 128, 1, 128, 800, 800, 160, 160]
    - [38, 2014.55]
  - - [768, 128, 1, 256, 800, 800, 288, 288]
    - [6, 3333.22]
  - - [768, 128, 1, 512, 800, 800, 544, 544]
    - [33, 5123.86]
  - - [768, 128, 1, 1024, 800, 800, 1056, 1056]
    - [43, 6740.98]
  - - [768, 128, 1, 2048, 800, 800, 2080, 2080]
    - [6, 7982.49]
  - - [768, 128, 1, 4096, 800, 800, 4128, 4128]
    - [6, 8686.1]
  - - [768, 256, 1, 64, 800, 800, 96, 96]
    - [49, 2159.42]
  - - [768, 256, 1, 128, 800, 800, 160, 160]
    - [7, 3877.02]
  - - [768, 256, 1, 256, 800, 800, 288, 288]
    - [43, 6413.31]
  - - [768, 256, 1, 512, 800, 800, 544, 544]
    - [2, 9668.01]
  - - [768, 256, 1, 1024, 800, 800, 1056, 1056]
    - [43, 12891.5]
  - - [768, 256, 1, 2048, 800, 800, 2080, 2080]
    - [22, 15527.9]
  - - [768, 256, 1, 4096, 800, 800, 4128, 4128]
    - [24, 17518.4]
  - - [768, 512, 1, 64, 800, 800, 96, 96]
    - [21, 3868.69]
  - - [768, 512, 1, 128, 800, 800, 160, 160]
    - [39, 6782.33]
  - - [768, 512, 1, 256, 800, 800, 288, 288]
    - [2, 10931.0]
  - - [768, 512, 1, 512, 800, 800, 544, 544]
    - [15, 15464.0]
  - - [768, 512, 1, 1024, 800, 800, 1056, 1056]
    - [4, 20500.6]
  - - [768, 512, 1, 2048, 800, 800, 2080, 2080]
    - [18, 23934.6]
  - - [768, 512, 1, 4096, 800, 800, 4128, 4128]
    - [28, 26178.2]
  - - [768, 1024, 1, 64, 800, 800, 96, 96]
    - [21, 6325.44]
  - - [768, 1024, 1, 128, 800, 800, 160, 160]
    - [22, 11844.1]
  - - [768, 1024, 1, 256, 800, 800, 288, 288]
    - [22, 17949.9]
  - - [768, 1024, 1, 512, 800, 800, 544, 544]
    - [24, 24447.6]
  - - [768, 1024, 1, 1024, 800, 800, 1056, 1056]
    - [6, 28847.5]
  - - [768, 1024, 1, 2048, 800, 800, 2080, 2080]
    - [43, 30748.0]
  - - [768, 1024, 1, 4096, 800, 800, 4128, 4128]
    - [51, 33788.1]
  - - [768, 2048, 1, 64, 800, 800, 96, 96]
    - [40, 11795.5]
  - - [768, 2048, 1, 128, 800, 800, 160, 160]
    - [16, 17724.0]
  - - [768, 2048, 1, 256, 800, 800, 288, 288]
    - [44, 24016.0]
  - - [768, 2048, 1, 512, 800, 800, 544, 544]
    - [43, 29851.6]
  - - [768, 2048, 1, 1024, 800, 800, 1056, 1056]
    - [43, 32529.0]
  - - [768, 2048, 1, 2048, 800, 800, 2080, 2080]
    - [51, 35945.9]
  - - [768, 2048, 1, 4096, 800, 800, 4128, 4128]
    - [51, 37562.2]
  - - [768, 4096, 1, 64, 800, 800, 96, 96]
    - [21, 15401.3]
  - - [768, 4096, 1, 128, 800, 800, 160, 160]
    - [25, 21978.9]
  - - [768, 4096, 1, 256, 800, 800, 288, 288]
    - [44, 28088.8]
  - - [768, 4096, 1, 512, 800, 800, 544, 544]
    - [24, 31423.5]
  - - [768, 4096, 1, 1024, 800, 800, 1056, 1056]
    - [43, 35456.1]
  - - [768, 4096, 1, 2048, 800, 800, 2080, 2080]
    - [51, 37685.0]
  - - [768, 4096, 1, 4096, 800, 800, 4128, 4128]
    - [51, 36951.0]
  - - [1536, 64, 1, 64, 1568, 1568, 96, 96]
    - [3, 1000.39]
  - - [1536, 64, 1, 128, 1568, 1568, 160, 160]
    - [0, 1845.0]
  - - [1536, 64, 1, 256, 1568, 1568, 288, 288]
    - [6, 2970.46]
  - - [1536, 64, 1, 512, 1568, 1568, 544, 544]
    - [43, 4435.67]
  - - [1536, 64, 1, 1024, 1568, 1568, 1056, 1056]
    - [4, 6060.39]
  - - [1536, 64, 1, 2048, 1568, 1568, 2080, 2080]
    - [24, 7662.28]
  - - [1536, 64, 1, 4096, 1568, 1568, 4128, 4128]
    - [24, 8411.21]
  - - [1536, 128, 1, 64, 1568, 1568, 96, 96]
    - [49, 2077.76]
  - - [1536, 128, 1, 128, 1568, 1568, 160, 160]
    - [3, 3829.23]
  - - [1536, 128, 1, 256, 1568, 1568, 288, 288]
    - [25, 6363.82]
  - - [1536, 128, 1, 512, 1568, 1568, 544, 544]
    - [43, 9573.28]
  - - [1536, 128, 1, 1024, 1568, 1568, 1056, 1056]
    - [6, 12858.5]
  - - [1536, 128, 1, 2048, 1568, 1568, 2080, 2080]
    - [43, 15697.3]
  - - [1536, 128, 1, 4096, 1568, 1568, 4128, 4128]
    - [29, 17128.0]
  - - [1536, 256, 1, 64, 1568, 1568, 96, 96]
    - [40, 3840.94]
  - - [1536, 256, 1, 128, 1568, 1568, 160, 160]
    - [49, 6720.72]
  - - [1536, 256, 1, 256, 1568, 1568, 288, 288]
    - [46, 10829.8]
  - - [1536, 256, 1, 512, 1568, 1568, 544, 544]
    - [27, 15680.9]
  - - [1536, 256, 1, 1024, 1568, 1568, 1056, 1056]
    - [18, 20705.1]
  - - [1536, 256, 1, 2048, 1568, 1568, 2080, 2080]
    - [27, 24112.4]
  - - [1536, 256, 1, 4096, 1568, 1568, 4128, 4128]
    - [14, 25905.7]
  - - [1536, 512, 1, 64, 1568, 1568, 96, 96]
    - [21, 6168.85]
  - - [1536, 512, 1, 128, 1568, 1568, 160, 160]
    - [16, 11549.2]
  - - [1536, 512, 1, 256, 1568, 1568, 288, 288]
    - [33, 18740.3]
  - - [1536, 512, 1, 512, 1568, 1568, 544, 544]
    - [24, 24995.5]
  - - [1536, 512, 1, 1024, 1568, 1568, 1056, 1056]
    - [43, 29613.4]
  - - [1536, 512, 1, 2048, 1568, 1568, 2080, 2080]
    - [43, 31179.0]
  - - [1536, 512, 1, 4096, 1568, 1568, 4128, 4128]
    - [51, 33259.6]
  - - [1536, 1024, 1, 64, 1568, 1568, 96, 96]
    - [49, 11812.2]
  - - [1536, 1024, 1, 128, 1568, 1568, 160, 160]
    - [44, 18093.5]
  - - [1536, 1024, 1, 256, 1568, 1568, 288, 288]
    - [44, 24682.9]
  - - [1536, 1024, 1, 512, 1568, 1568, 544, 544]
    - [7, 29987.2]
  - - [1536, 1024, 1, 1024, 1568, 1568, 1056, 1056]
    - [43, 32734.0]
  - - [1536, 1024, 1, 2048, 1568, 1568, 2080, 2080]
    - [51, 35922.7]
  - - [1536, 1024, 1, 4096, 1568, 1568, 4128, 4128]
    - [1, 37829.3]
  - - [1536, 2048, 1, 64, 1568, 1568, 96, 96]
    - [40, 15348.5]
  - - [1536, 2048, 1, 128, 1568, 1568, 160, 160]
    - [44, 22023.3]
  - - [1536, 2048, 1, 256, 1568, 1568, 288, 288]
    - [44, 28212.8]
  - - [1536, 2048, 1, 512, 1568, 1568, 544, 544]
    - [51, 31322.6]
  - - [1536, 2048, 1, 1024, 1568, 1568, 1056, 1056]
    - [51, 35312.3]
  - - [1536, 2048, 1, 2048, 1568, 1568, 2080, 2080]
    - [43, 37702.9]
  - - [1536, 2048, 1, 4096, 1568, 1568, 4128, 4128]
    - [24, 37668.8]
  - - [1536, 4096, 1, 64, 1568, 1568, 96, 96]
    - [40, 17719.3]
  - - [1536, 4096, 1, 128, 1568, 1568, 160, 160]
    - [44, 24513.9]
  - - [1536, 4096, 1, 256, 1568, 1568, 288, 288]
    - [52, 29207.9]
  - - [1536, 4096, 1, 512, 1568, 1568, 544, 544]
    - [43, 33728.3]
  - - [1536, 4096, 1, 1024, 1568, 1568, 1056, 1056]
    - [51, 36909.3]
  - - [1536, 4096, 1, 2048, 1568, 1568, 2080, 2080]
    - [51, 37902.8]
  - - [1536, 4096, 1, 4096, 1568, 1568, 4128, 4128]
    - [24, 37593.2]
  - - [3072, 64, 1, 64, 3104, 3104, 96, 96]
    - [11, 1867.46]
  - - [3072, 64, 1, 128, 3104, 3104, 160, 160]
    - [36, 3002.71]
  - - [3072, 64, 1, 256, 3104, 3104, 288, 288]
    - [9, 4961.21]
  - - [3072, 64, 1, 512, 3104, 3104, 544, 544]
    - [53, 7396.27]
  - - [3072, 64, 1, 1024, 3104, 3104, 1056, 1056]
    - [53, 9896.1]
  - - [3072, 64, 1, 2048, 3104, 3104, 2080, 2080]
    - [27, 11820.8]
  - - [3072, 64, 1, 4096, 3104, 3104, 4128, 4128]
    - [28, 13089.7]
  - - [3072, 128, 1, 64, 3104, 3104, 96, 96]
    - [34, 3649.87]
  - - [3072, 128, 1, 128, 3104, 3104, 160, 160]
    - [30, 6573.29]
  - - [3072, 128, 1, 256, 3104, 3104, 288, 288]
    - [9, 10606.2]
  - - [3072, 128, 1, 512, 3104, 3104, 544, 544]
    - [9, 15256.6]
  - - [3072, 128, 1, 1024, 3104, 3104, 1056, 1056]
    - [27, 20513.2]
  - - [3072, 128, 1, 2048, 3104, 3104, 2080, 2080]
    - [36, 24127.5]
  - - [3072, 128, 1, 4096, 3104, 3104, 4128, 4128]
    - [5, 26725.0]
  - - [3072, 256, 1, 64, 3104, 3104, 96, 96]
    - [35, 6018.37]
  - - [3072, 256, 1, 128, 3104, 3104, 160, 160]
    - [40, 11286.4]
  - - [3072, 256, 1, 256, 3104, 3104, 288, 288]
    - [44, 17635.4]
  - - [3072, 256, 1, 512, 3104, 3104, 544, 544]
    - [25, 22995.6]
  - - [3072, 256, 1, 1024, 3104, 3104, 1056, 1056]
    - [44, 27061.8]
  - - [3072, 256, 1, 2048, 3104, 3104, 2080, 2080]
    - [40, 29256.7]
  - - [3072, 256, 1, 4096, 3104, 3104, 4128, 4128]
    - [30, 30967.9]
  - - [3072, 512, 1, 64, 3104, 3104, 96, 96]
    - [21, 11781.8]
  - - [3072, 512, 1, 128, 3104, 3104, 160, 160]
    - [52, 18002.9]
  - - [3072, 512, 1, 256, 3104, 3104, 288, 288]
    - [25, 24743.6]
  - - [3072, 512, 1, 512, 3104, 3104, 544, 544]
    - [25, 30190.7]
  - - [3072, 512, 1, 1024, 3104, 3104, 1056, 1056]
    - [25, 32462.9]
  - - [3072, 512, 1, 2048, 3104, 3104, 2080, 2080]
    - [10, 35969.2]
  - - [3072, 512, 1, 4096, 3104, 3104, 4128, 4128]
    - [14, 37823.8]
  - - [3072, 1024, 1, 64, 3104, 3104, 96, 96]
    - [40, 14991.9]
  - - [3072, 1024, 1, 128, 3104, 3104, 160, 160]
    - [52, 21712.2]
  - - [3072, 1024, 1, 256, 3104, 3104, 288, 288]
    - [44, 27782.6]
  - - [3072, 1024, 1, 512, 3104, 3104, 544, 544]
    - [25, 31159.7]
  - - [3072, 1024, 1, 1024, 3104, 3104, 1056, 1056]
    - [44, 34853.0]
  - - [3072, 1024, 1, 2048, 3104, 3104, 2080, 2080]
    - [14, 37719.5]
  - - [3072, 1024, 1, 4096, 3104, 3104, 4128, 4128]
    - [14, 36563.5]
  - - [3072, 2048, 1, 64, 3104, 3104, 96, 96]
    - [40, 17801.5]
  - - [3072, 2048, 1, 128, 3104, 3104, 160, 160]
    - [52, 24795.4]
  - - [3072, 2048, 1, 256, 3104, 3104, 288, 288]
    - [44, 29186.2]
  - - [3072, 2048, 1, 512, 3104, 3104, 544, 544]
    - [25, 33497.5]
  - - [3072, 2048, 1, 1024, 3104, 3104, 1056, 1056]
    - [33, 36596.1]
  - - [3072, 2048, 1, 2048, 3104, 3104, 2080, 2080]
    - [14, 37875.8]
  - - [3072, 2048, 1, 4096, 3104, 3104, 4128, 4128]
    - [13, 36978.7]
  - - [3072, 4096, 1, 64, 3104, 3104, 96, 96]
    - [40, 18774.3]
  - - [3072, 4096, 1, 128, 3104, 3104, 160, 160]
    - [52, 25527.6]
  - - [3072, 4096, 1, 256, 3104, 3104, 288, 288]
    - [52, 30859.6]
  - - [3072, 4096, 1, 512, 3104, 3104, 544, 544]
    - [51, 34833.4]
  - - [3072, 4096, 1, 1024, 3104, 3104, 1056, 1056]
    - [51, 36900.4]
  - - [3072, 4096, 1, 2048, 3104, 3104, 2080, 2080]
    - [33, 37626.6]
  - - [3072, 4096, 1, 4096, 3104, 3104, 4128, 4128]
    - [15, 36225.5]
  - - [4096, 64, 1, 64, 4128, 4128, 96, 96]
    - [26, 2086.46]
  - - [4096, 64, 1, 128, 4128, 4128, 160, 160]
    - [46, 3837.85]
  - - [4096, 64, 1, 256, 4128, 4128, 288, 288]
    - [27, 6367.65]
  - - [4096, 64, 1, 512, 4128, 4128, 544, 544]
    - [18, 9467.95]
  - - [4096, 64, 1, 1024, 4128, 4128, 1056, 1056]
    - [36, 12858.6]
  - - [4096, 64, 1, 2048, 4128, 4128, 2080, 2080]
    - [53, 15583.1]
  - - [4096, 64, 1, 4096, 4128, 4128, 4128, 4128]
    - [18, 16485.6]
  - - [4096, 128, 1, 64, 4128, 4128, 96, 96]
    - [52, 5803.26]
  - - [4096, 128, 1, 128, 4128, 4128, 160, 160]
    - [15, 10105.2]
  - - [4096, 128, 1, 256, 4128, 4128, 288, 288]
    - [7, 15846.2]
  - - [4096, 128, 1, 512, 4128, 4128, 544, 544]
    - [15, 22586.0]
  - - [4096, 128, 1, 1024, 4128, 4128, 1056, 1056]
    - [24, 28587.3]
  - - [4096, 128, 1, 2048, 4128, 4128, 2080, 2080]
    - [1, 33047.3]
  - - [4096, 128, 1, 4096, 4128, 4128, 4128, 4128]
    - [36, 33095.7]
  - - [4096, 256, 1, 64, 4128, 4128, 96, 96]
    - [40, 9209.4]
  - - [4096, 256, 1, 128, 4128, 4128, 160, 160]
    - [34, 14999.7]
  - - [4096, 256, 1, 256, 4128, 4128, 288, 288]
    - [34, 21230.3]
  - - [4096, 256, 1, 512, 4128, 4128, 544, 544]
    - [44, 27352.3]
  - - [4096, 256, 1, 1024, 4128, 4128, 1056, 1056]
    - [25, 31965.1]
  - - [4096, 256, 1, 2048, 4128, 4128, 2080, 2080]
    - [1, 34747.8]
  - - [4096, 256, 1, 4096, 4128, 4128, 4128, 4128]
    - [9, 34730.1]
  - - [4096, 512, 1, 64, 4128, 4128, 96, 96]
    - [49, 12811.9]
  - - [4096, 512, 1, 128, 4128, 4128, 160, 160]
    - [52, 19768.4]
  - - [4096, 512, 1, 256, 4128, 4128, 288, 288]
    - [25, 26186.3]
  - - [4096, 512, 1, 512, 4128, 4128, 544, 544]
    - [44, 31344.6]
  - - [4096, 512, 1, 1024, 4128, 4128, 1056, 1056]
    - [25, 33708.2]
  - - [4096, 512, 1, 2048, 4128, 4128, 2080, 2080]
    - [14, 36885.0]
  - - [4096, 512, 1, 4096, 4128, 4128, 4128, 4128]
    - [27, 35926.8]
  - - [4096, 1024, 1, 64, 4128, 4128, 96, 96]
    - [40, 16272.8]
  - - [4096, 1024, 1, 128, 4128, 4128, 160, 160]
    - [44, 22970.7]
  - - [4096, 1024, 1, 256, 4128, 4128, 288, 288]
    - [32, 28494.8]
  - - [4096, 1024, 1, 512, 4128, 4128, 544, 544]
    - [44, 32270.7]
  - - [4096, 1024, 1, 1024, 4128, 4128, 1056, 1056]
    - [43, 35694.7]
  - - [4096, 1024, 1, 2048, 4128, 4128, 2080, 2080]
    - [14, 38373.3]
  - - [4096, 1024, 1, 4096, 4128, 4128, 4128, 4128]
    - [43, 35849.0]
  - - [4096, 2048, 1, 64, 4128, 4128, 96, 96]
    - [40, 18733.1]
  - - [4096, 2048, 1, 128, 4128, 4128, 160, 160]
    - [44, 24530.9]
  - - [4096, 2048, 1, 256, 4128, 4128, 288, 288]
    - [44, 29917.6]
  - - [4096, 2048, 1, 512, 4128, 4128, 544, 544]
    - [43, 34241.9]
  - - [4096, 2048, 1, 1024, 4128, 4128, 1056, 1056]
    - [51, 37115.0]
  - - [4096, 2048, 1, 2048, 4128, 4128, 2080, 2080]
    - [24, 37885.1]
  - - [4096, 2048, 1, 4096, 4128, 4128, 4128, 4128]
    - [27, 36307.3]
  - - [4096, 4096, 1, 64, 4128, 4128, 96, 96]
    - [38, 17609.0]
  - - [4096, 4096, 1, 128, 4128, 4128, 160, 160]
    - [28, 23294.6]
  - - [4096, 4096, 1, 256, 4128, 4128, 288, 288]
    - [25, 30255.6]
  - - [4096, 4096, 1, 512, 4128, 4128, 544, 544]
    - [43, 34915.7]
  - - [4096, 4096, 1, 1024, 4128, 4128, 1056, 1056]
    - [51, 37121.9]
  - - [4096, 4096, 1, 2048, 4128, 4128, 2080, 2080]
    - [33, 38048.4]
  - - [4096, 4096, 1, 4096, 4128, 4128, 4128, 4128]
    - [46, 35769.5]
- null
- null
- DeviceEfficiency
