library/src/blas3/Tensile/Logic/asm_full/navi33/navi33_Cijk_Alik_Bljk_I8II_BH.yaml
- {MinimumRequiredVersion: 4.35.0}
- navi33
- gfx1102
- [Device 73f0]
    SolutionIndex: 0
    SolutionNameMin: Cijk_Alik_Bljk_I8II_BH_MT128x128x32_MI16x16x16x1_SN_1LDSB0_GRVW8_IU1_LPA8_LPB32_PLR0_SIA1_SU0_SUS0_SVW2_VW2_WGM1
    SolutionIndex: 1
    SolutionNameMin: Cijk_Alik_Bljk_I8II_BH_MT128x128x32_MI16x16x16x1_SN_1LDSB0_GRVW8_IU1_LPA32_LPB32_PLR0_SIA1_SU0_SUS0_SVW2_VW2_WGM1
    SolutionIndex: 2
    SolutionNameMin: Cijk_Alik_Bljk_I8II_BH_MT128x128x32_MI16x16x16x1_SN_1LDSB0_GRVW16_IU1_LPA32_LPB32_PLR0_SIA1_SU0_SUS0_SVW2_VW2_WGM1
    SolutionIndex: 3
    SolutionNameMin: Cijk_Alik_Bljk_I8II_BH_MT128x128x32_MI16x16x16x1_SN_1LDSB0_GRVW8_IU1_LPA8_LPB32_PLR1_SIA1_SU0_SUS0_SVW2_VW2_WGM1
    SolutionIndex: 4
    SolutionNameMin: Cijk_Alik_Bljk_I8II_BH_MT128x128x32_MI16x16x16x1_SN_1LDSB0_GRVW8_IU1_LPA32_LPB32_PLR1_SIA1_SU0_SUS0_SVW2_VW2_WGM1
    SolutionIndex: 5
    SolutionNameMin: Cijk_Alik_Bljk_I8II_BH_MT128x128x32_MI16x16x16x1_SN_1LDSB0_GRVW8_IU1_LPA32_LPB32_PLR1_SIA1_SU0_SUS0_SVW4_VW4_WGM1
    SolutionIndex: 6
    SolutionNameMin: Cijk_Alik_Bljk_I8II_BH_MT128x128x32_MI16x16x16x1_SN_1LDSB0_GRVW16_IU1_LPA32_LPB32_PLR1_SIA1_SU0_SUS0_SVW2_VW2_WGM1
    SolutionIndex: 7
    SolutionNameMin: Cijk_Alik_Bljk_I8II_BH_MT128x128x32_MI16x16x16x1_SN_1LDSB0_GRVW16_IU1_LPA32_LPB32_PLR1_SIA1_SU0_SUS0_SVW4_VW4_WGM1
    SolutionIndex: 8
    SolutionNameMin: Cijk_Alik_Bljk_I8II_BH_MT128x128x32_MI16x16x16x1_SN_1LDSB0_GRVW8_IU1_LPA32_LPB32_PLR0_SIA3_SU0_SUS0_SVW2_VW2_WGM1
    SolutionIndex: 9
    SolutionNameMin: Cijk_Alik_Bljk_I8II_BH_MT128x128x32_MI16x16x16x1_SN_1LDSB0_GRVW8_IU1_LPA32_LPB32_PLR0_SIA3_SU0_SUS0_SVW4_VW4_WGM1
    SolutionIndex: 10
    SolutionNameMin: Cijk_Alik_Bljk_I8II_BH_MT128x128x32_MI16x16x16x1_SN_1LDSB0_GRVW16_IU1_LPA32_LPB32_PLR0_SIA3_SU0_SUS0_SVW2_VW2_WGM1
    SolutionIndex: 11
    SolutionNameMin: Cijk_Alik_Bljk_I8II_BH_MT128x128x32_MI16x16x16x1_SN_1LDSB0_GRVW16_IU1_LPA32_LPB32_PLR0_SIA3_SU0_SUS0_SVW4_VW4_WGM1
    SolutionIndex: 12
    SolutionNameMin: Cijk_Alik_Bljk_I8II_BH_MT128x128x32_MI16x16x16x1_SN_1LDSB0_GRVW8_IU1_LPA32_LPB32_PLR1_SIA3_SU0_SUS0_SVW2_VW2_WGM1
    SolutionIndex: 13
    SolutionNameMin: Cijk_Alik_Bljk_I8II_BH_MT128x128x32_MI16x16x16x1_SN_1LDSB0_GRVW16_IU1_LPA32_LPB32_PLR1_SIA3_SU0_SUS0_SVW2_VW2_WGM1
    SolutionIndex: 14
    SolutionNameMin: Cijk_Alik_Bljk_I8II_BH_MT128x128x32_MI16x16x16x1_SN_1LDSB0_GRVW16_IU1_LPA32_LPB32_PLR1_SIA3_SU0_SUS0_SVW4_VW4_WGM1
    SolutionIndex: 15
    SolutionNameMin: Cijk_Alik_Bljk_I8II_BH_MT128x128x32_MI16x16x16x1_SN_1LDSB0_GRVW8_IU1_LPA32_LPB32_PLR0_SIA1_SU32_SUS256_SVW2_VW2_WGM1
    SolutionIndex: 16
    SolutionNameMin: Cijk_Alik_Bljk_I8II_BH_MT128x128x32_MI16x16x16x1_SN_1LDSB0_GRVW8_IU1_LPA32_LPB32_PLR0_SIA1_SU32_SUS256_SVW4_VW4_WGM1
    SolutionIndex: 17
    SolutionNameMin: Cijk_Alik_Bljk_I8II_BH_MT128x128x32_MI16x16x16x1_SN_1LDSB0_GRVW16_IU1_LPA32_LPB32_PLR0_SIA1_SU32_SUS256_SVW2_VW2_WGM1
    SolutionIndex: 18
    SolutionNameMin: Cijk_Alik_Bljk_I8II_BH_MT128x128x32_MI16x16x16x1_SN_1LDSB0_GRVW8_IU1_LPA32_LPB32_PLR1_SIA1_SU32_SUS256_SVW2_VW2_WGM1
    SolutionIndex: 19
    SolutionNameMin: Cijk_Alik_Bljk_I8II_BH_MT128x128x32_MI16x16x16x1_SN_1LDSB0_GRVW8_IU1_LPA32_LPB32_PLR1_SIA1_SU32_SUS256_SVW4_VW4_WGM1
    SolutionIndex: 20
    SolutionNameMin: Cijk_Alik_Bljk_I8II_BH_MT128x128x32_MI16x16x16x1_SN_1LDSB0_GRVW16_IU1_LPA32_LPB32_PLR1_SIA1_SU32_SUS256_SVW2_VW2_WGM1
    SolutionIndex: 21
    SolutionNameMin: Cijk_Alik_Bljk_I8II_BH_MT128x128x32_MI16x16x16x1_SN_1LDSB0_GRVW16_IU1_LPA32_LPB32_PLR1_SIA1_SU32_SUS256_SVW4_VW4_WGM1
    SolutionIndex: 22
    SolutionNameMin: Cijk_Alik_Bljk_I8II_BH_MT128x128x32_MI16x16x16x1_SN_1LDSB0_GRVW16_IU1_LPA32_LPB32_PLR0_SIA3_SU32_SUS256_SVW4_VW4_WGM1
    SolutionIndex: 23
    SolutionNameMin: Cijk_Alik_Bljk_I8II_BH_MT128x128x32_MI16x16x16x1_SN_1LDSB0_GRVW8_IU1_LPA32_LPB32_PLR1_SIA3_SU32_SUS256_SVW2_VW2_WGM1
    SolutionIndex: 24
    SolutionNameMin: Cijk_Alik_Bljk_I8II_BH_MT128x128x32_MI16x16x16x1_SN_1LDSB0_GRVW16_IU1_LPA32_LPB32_PLR1_SIA3_SU32_SUS256_SVW2_VW2_WGM1
    SolutionIndex: 25
    SolutionNameMin: Cijk_Alik_Bljk_I8II_BH_MT128x128x32_MI16x16x16x1_SN_1LDSB0_GRVW16_IU1_LPA32_LPB32_PLR1_SIA3_SU32_SUS256_SVW4_VW4_WGM1
    SolutionIndex: 26
    SolutionNameMin: Cijk_Alik_Bljk_I8II_BH_MT128x128x32_MI16x16x16x1_SN_1LDSB0_GRVW8_IU1_LPA32_LPB32_PLR0_SIA1_SU0_SUS0_SVW2_VW2_WGM4
    SolutionIndex: 27
    SolutionNameMin: Cijk_Alik_Bljk_I8II_BH_MT128x128x32_MI16x16x16x1_SN_1LDSB0_GRVW8_IU1_LPA32_LPB32_PLR1_SIA1_SU0_SUS0_SVW2_VW2_WGM4
    SolutionIndex: 28
    SolutionNameMin: Cijk_Alik_Bljk_I8II_BH_MT128x128x32_MI16x16x16x1_SN_1LDSB0_GRVW8_IU1_LPA32_LPB32_PLR1_SIA1_SU0_SUS0_SVW4_VW4_WGM4
    SolutionIndex: 29
    SolutionNameMin: Cijk_Alik_Bljk_I8II_BH_MT128x128x32_MI16x16x16x1_SN_1LDSB0_GRVW16_IU1_LPA32_LPB32_PLR1_SIA1_SU0_SUS0_SVW2_VW2_WGM4
    SolutionIndex: 30
    SolutionNameMin: Cijk_Alik_Bljk_I8II_BH_MT128x128x32_MI16x16x16x1_SN_1LDSB0_GRVW16_IU1_LPA32_LPB32_PLR1_SIA1_SU0_SUS0_SVW4_VW4_WGM4
    SolutionIndex: 31
    SolutionNameMin: Cijk_Alik_Bljk_I8II_BH_MT128x128x32_MI16x16x16x1_SN_1LDSB0_GRVW8_IU1_LPA32_LPB32_PLR0_SIA3_SU0_SUS0_SVW2_VW2_WGM4
    SolutionIndex: 32
    SolutionNameMin: Cijk_Alik_Bljk_I8II_BH_MT128x128x32_MI16x16x16x1_SN_1LDSB0_GRVW8_IU1_LPA32_LPB32_PLR0_SIA3_SU0_SUS0_SVW4_VW4_WGM4
    SolutionIndex: 33
    SolutionNameMin: Cijk_Alik_Bljk_I8II_BH_MT128x128x32_MI16x16x16x1_SN_1LDSB0_GRVW16_IU1_LPA32_LPB32_PLR0_SIA3_SU0_SUS0_SVW2_VW2_WGM4
    SolutionIndex: 34
    SolutionNameMin: Cijk_Alik_Bljk_I8II_BH_MT128x128x32_MI16x16x16x1_SN_1LDSB0_GRVW16_IU1_LPA32_LPB32_PLR0_SIA3_SU0_SUS0_SVW4_VW4_WGM4
    SolutionIndex: 35
    SolutionNameMin: Cijk_Alik_Bljk_I8II_BH_MT128x128x32_MI16x16x16x1_SN_1LDSB0_GRVW8_IU1_LPA32_LPB32_PLR1_SIA3_SU0_SUS0_SVW2_VW2_WGM4
    SolutionIndex: 36
    SolutionNameMin: Cijk_Alik_Bljk_I8II_BH_MT128x128x32_MI16x16x16x1_SN_1LDSB0_GRVW16_IU1_LPA32_LPB32_PLR1_SIA3_SU0_SUS0_SVW2_VW2_WGM4
    SolutionIndex: 37
    SolutionNameMin: Cijk_Alik_Bljk_I8II_BH_MT128x128x32_MI16x16x16x1_SN_1LDSB0_GRVW16_IU1_LPA32_LPB32_PLR1_SIA3_SU0_SUS0_SVW4_VW4_WGM4
    SolutionIndex: 38
    SolutionNameMin: Cijk_Alik_Bljk_I8II_BH_MT128x128x32_MI16x16x16x1_SN_1LDSB0_GRVW8_IU1_LPA32_LPB32_PLR0_SIA1_SU32_SUS256_SVW2_VW2_WGM4
    SolutionIndex: 39
    SolutionNameMin: Cijk_Alik_Bljk_I8II_BH_MT128x128x32_MI16x16x16x1_SN_1LDSB0_GRVW8_IU1_LPA32_LPB32_PLR0_SIA1_SU32_SUS256_SVW4_VW4_WGM4
    SolutionIndex: 40
    SolutionNameMin: Cijk_Alik_Bljk_I8II_BH_MT128x128x32_MI16x16x16x1_SN_1LDSB0_GRVW8_IU1_LPA32_LPB32_PLR1_SIA1_SU32_SUS256_SVW2_VW2_WGM4
    SolutionIndex: 41
    SolutionNameMin: Cijk_Alik_Bljk_I8II_BH_MT128x128x32_MI16x16x16x1_SN_1LDSB0_GRVW8_IU1_LPA32_LPB32_PLR1_SIA1_SU32_SUS256_SVW4_VW4_WGM4
    SolutionIndex: 42
    SolutionNameMin: Cijk_Alik_Bljk_I8II_BH_MT128x128x32_MI16x16x16x1_SN_1LDSB0_GRVW16_IU1_LPA8_LPB32_PLR1_SIA1_SU32_SUS256_SVW2_VW2_WGM4
    SolutionIndex: 43
    SolutionNameMin: Cijk_Alik_Bljk_I8II_BH_MT128x128x32_MI16x16x16x1_SN_1LDSB0_GRVW16_IU1_LPA32_LPB32_PLR1_SIA1_SU32_SUS256_SVW2_VW2_WGM4
    SolutionIndex: 44
    SolutionNameMin: Cijk_Alik_Bljk_I8II_BH_MT128x128x32_MI16x16x16x1_SN_1LDSB0_GRVW8_IU1_LPA32_LPB32_PLR0_SIA3_SU32_SUS256_SVW4_VW4_WGM4
    SolutionIndex: 45
    SolutionNameMin: Cijk_Alik_Bljk_I8II_BH_MT128x128x32_MI16x16x16x1_SN_1LDSB0_GRVW16_IU1_LPA32_LPB32_PLR0_SIA3_SU32_SUS256_SVW2_VW2_WGM4
    SolutionIndex: 46
    SolutionNameMin: Cijk_Alik_Bljk_I8II_BH_MT128x128x32_MI16x16x16x1_SN_1LDSB0_GRVW16_IU1_LPA32_LPB32_PLR0_SIA3_SU32_SUS256_SVW4_VW4_WGM4
    SolutionIndex: 47
    SolutionNameMin: Cijk_Alik_Bljk_I8II_BH_MT128x128x32_MI16x16x16x1_SN_1LDSB0_GRVW8_IU1_LPA32_LPB32_PLR1_SIA3_SU32_SUS256_SVW2_VW2_WGM4
    SolutionIndex: 48
    SolutionNameMin: Cijk_Alik_Bljk_I8II_BH_MT128x128x32_MI16x16x16x1_SN_1LDSB0_GRVW16_IU1_LPA32_LPB32_PLR1_SIA3_SU32_SUS256_SVW2_VW2_WGM4
    SolutionIndex: 49
    SolutionNameMin: Cijk_Alik_Bljk_I8II_BH_MT128x128x32_MI16x16x16x1_SN_1LDSB0_GRVW16_IU1_LPA32_LPB32_PLR1_SIA3_SU32_SUS256_SVW4_VW4_WGM4
    SolutionIndex: 50
    SolutionNameMin: Cijk_Alik_Bljk_I8II_BH_MT128x128x32_MI16x16x16x1_SN_1LDSB0_GRVW8_IU1_LPA32_LPB32_PLR0_SIA1_SU0_SUS0_SVW2_VW2_WGM8
    SolutionIndex: 51
    SolutionNameMin: Cijk_Alik_Bljk_I8II_BH_MT128x128x32_MI16x16x16x1_SN_1LDSB0_GRVW16_IU1_LPA32_LPB32_PLR0_SIA1_SU0_SUS0_SVW2_VW2_WGM8
    SolutionIndex: 52
    SolutionNameMin: Cijk_Alik_Bljk_I8II_BH_MT128x128x32_MI16x16x16x1_SN_1LDSB0_GRVW8_IU1_LPA32_LPB32_PLR1_SIA1_SU0_SUS0_SVW2_VW2_WGM8
    SolutionIndex: 53
    SolutionNameMin: Cijk_Alik_Bljk_I8II_BH_MT128x128x32_MI16x16x16x1_SN_1LDSB0_GRVW8_IU1_LPA32_LPB32_PLR1_SIA1_SU0_SUS0_SVW4_VW4_WGM8
    SolutionIndex: 54
    SolutionNameMin: Cijk_Alik_Bljk_I8II_BH_MT128x128x32_MI16x16x16x1_SN_1LDSB0_GRVW16_IU1_LPA32_LPB32_PLR1_SIA1_SU0_SUS0_SVW2_VW2_WGM8
    SolutionIndex: 55
    SolutionNameMin: Cijk_Alik_Bljk_I8II_BH_MT128x128x32_MI16x16x16x1_SN_1LDSB0_GRVW16_IU1_LPA32_LPB32_PLR1_SIA1_SU0_SUS0_SVW4_VW4_WGM8
    SolutionIndex: 56
    SolutionNameMin: Cijk_Alik_Bljk_I8II_BH_MT128x128x32_MI16x16x16x1_SN_1LDSB0_GRVW8_IU1_LPA32_LPB32_PLR0_SIA3_SU0_SUS0_SVW2_VW2_WGM8
    SolutionIndex: 57
    SolutionNameMin: Cijk_Alik_Bljk_I8II_BH_MT128x128x32_MI16x16x16x1_SN_1LDSB0_GRVW8_IU1_LPA32_LPB32_PLR0_SIA3_SU0_SUS0_SVW4_VW4_WGM8
    SolutionIndex: 58
    SolutionNameMin: Cijk_Alik_Bljk_I8II_BH_MT128x128x32_MI16x16x16x1_SN_1LDSB0_GRVW16_IU1_LPA32_LPB32_PLR0_SIA3_SU0_SUS0_SVW2_VW2_WGM8
    SolutionIndex: 59
    SolutionNameMin: Cijk_Alik_Bljk_I8II_BH_MT128x128x32_MI16x16x16x1_SN_1LDSB0_GRVW16_IU1_LPA32_LPB32_PLR0_SIA3_SU0_SUS0_SVW4_VW4_WGM8
    SolutionIndex: 60
    SolutionNameMin: Cijk_Alik_Bljk_I8II_BH_MT128x128x32_MI16x16x16x1_SN_1LDSB0_GRVW8_IU1_LPA32_LPB32_PLR1_SIA3_SU0_SUS0_SVW2_VW2_WGM8
    SolutionIndex: 61
    SolutionNameMin: Cijk_Alik_Bljk_I8II_BH_MT128x128x32_MI16x16x16x1_SN_1LDSB0_GRVW8_IU1_LPA32_LPB32_PLR1_SIA3_SU0_SUS0_SVW4_VW4_WGM8
    SolutionIndex: 62
    SolutionNameMin: Cijk_Alik_Bljk_I8II_BH_MT128x128x32_MI16x16x16x1_SN_1LDSB0_GRVW16_IU1_LPA32_LPB32_PLR1_SIA3_SU0_SUS0_SVW2_VW2_WGM8
    SolutionIndex: 63
    SolutionNameMin: Cijk_Alik_Bljk_I8II_BH_MT128x128x32_MI16x16x16x1_SN_1LDSB0_GRVW16_IU1_LPA32_LPB32_PLR1_SIA3_SU0_SUS0_SVW4_VW4_WGM8
    SolutionIndex: 64
    SolutionNameMin: Cijk_Alik_Bljk_I8II_BH_MT128x128x32_MI16x16x16x1_SN_1LDSB0_GRVW8_IU1_LPA32_LPB32_PLR0_SIA1_SU32_SUS256_SVW2_VW2_WGM8
    SolutionIndex: 65
    SolutionNameMin: Cijk_Alik_Bljk_I8II_BH_MT128x128x32_MI16x16x16x1_SN_1LDSB0_GRVW16_IU1_LPA32_LPB32_PLR0_SIA1_SU32_SUS256_SVW2_VW2_WGM8
    SolutionIndex: 66
    SolutionNameMin: Cijk_Alik_Bljk_I8II_BH_MT128x128x32_MI16x16x16x1_SN_1LDSB0_GRVW8_IU1_LPA32_LPB32_PLR1_SIA1_SU32_SUS256_SVW2_VW2_WGM8
    SolutionIndex: 67
    SolutionNameMin: Cijk_Alik_Bljk_I8II_BH_MT128x128x32_MI16x16x16x1_SN_1LDSB0_GRVW8_IU1_LPA32_LPB32_PLR1_SIA1_SU32_SUS256_SVW4_VW4_WGM8
    SolutionIndex: 68
    SolutionNameMin: Cijk_Alik_Bljk_I8II_BH_MT128x128x32_MI16x16x16x1_SN_1LDSB0_GRVW16_IU1_LPA32_LPB32_PLR1_SIA1_SU32_SUS256_SVW2_VW2_WGM8
    SolutionIndex: 69
    SolutionNameMin: Cijk_Alik_Bljk_I8II_BH_MT128x128x32_MI16x16x16x1_SN_1LDSB0_GRVW16_IU1_LPA32_LPB32_PLR1_SIA1_SU32_SUS256_SVW4_VW4_WGM8
    SolutionIndex: 70
    SolutionNameMin: Cijk_Alik_Bljk_I8II_BH_MT128x128x32_MI16x16x16x1_SN_1LDSB1_GRVW16_IU2_LPA32_LPB32_PLR1_SIA2_SU32_SUS256_SVW4_VW4_WGM8
    SolutionIndex: 71
    SolutionNameMin: Cijk_Alik_Bljk_I8II_BH_MT128x128x32_MI16x16x16x1_SN_1LDSB0_GRVW8_IU1_LPA32_LPB32_PLR0_SIA3_SU32_SUS256_SVW2_VW2_WGM8
    SolutionIndex: 72
    SolutionNameMin: Cijk_Alik_Bljk_I8II_BH_MT128x128x32_MI16x16x16x1_SN_1LDSB0_GRVW8_IU1_LPA32_LPB32_PLR0_SIA3_SU32_SUS256_SVW4_VW4_WGM8
    SolutionIndex: 73
    SolutionNameMin: Cijk_Alik_Bljk_I8II_BH_MT128x128x32_MI16x16x16x1_SN_1LDSB0_GRVW16_IU1_LPA32_LPB32_PLR0_SIA3_SU32_SUS256_SVW2_VW2_WGM8
    SolutionIndex: 74
    SolutionNameMin: Cijk_Alik_Bljk_I8II_BH_MT128x128x32_MI16x16x16x1_SN_1LDSB0_GRVW16_IU1_LPA32_LPB32_PLR0_SIA3_SU32_SUS256_SVW4_VW4_WGM8
    SolutionIndex: 75
    SolutionNameMin: Cijk_Alik_Bljk_I8II_BH_MT128x128x32_MI16x16x16x1_SN_1LDSB0_GRVW8_IU1_LPA32_LPB32_PLR1_SIA3_SU32_SUS256_SVW2_VW2_WGM8
    SolutionIndex: 76
    SolutionNameMin: Cijk_Alik_Bljk_I8II_BH_MT128x128x32_MI16x16x16x1_SN_1LDSB0_GRVW16_IU1_LPA32_LPB32_PLR1_SIA3_SU32_SUS256_SVW2_VW2_WGM8
    SolutionIndex: 77
    SolutionNameMin: Cijk_Alik_Bljk_I8II_BH_MT128x128x32_MI16x16x16x1_SN_1LDSB0_GRVW16_IU1_LPA8_LPB32_PLR1_SIA3_SU32_SUS256_SVW4_VW4_WGM8
    SolutionIndex: 78
    SolutionNameMin: Cijk_Alik_Bljk_I8II_BH_MT128x128x32_MI16x16x16x1_SN_1LDSB0_GRVW16_IU1_LPA32_LPB32_PLR1_SIA3_SU32_SUS256_SVW4_VW4_WGM8
- - - [64, 64, 1, 64, 96, 96, 96, 96]
    - [2, 38.5506]
  - - [64, 64, 1, 128, 96, 96, 160, 160]
    - [30, 68.5794]
  - - [64, 64, 1, 256, 96, 96, 288, 288]
    - [5, 118.685]
  - - [64, 64, 1, 512, 96, 96, 544, 544]
    - [55, 191.102]
  - - [64, 64, 1, 1024, 96, 96, 1056, 1056]
    - [24, 266.865]
  - - [64, 64, 1, 2048, 96, 96, 2080, 2080]
    - [28, 339.675]
  - - [64, 64, 1, 4096, 96, 96, 4128, 4128]
    - [14, 395.96]
  - - [64, 128, 1, 64, 96, 96, 96, 96]
    - [21, 68.7323]
  - - [64, 128, 1, 128, 96, 96, 160, 160]
    - [55, 130.794]
  - - [64, 128, 1, 256, 96, 96, 288, 288]
    - [21, 228.722]
  - - [64, 128, 1, 512, 96, 96, 544, 544]
    - [55, 380.85]
  - - [64, 128, 1, 1024, 96, 96, 1056, 1056]
    - [37, 535.74]
  - - [64, 128, 1, 2048, 96, 96, 2080, 2080]
    - [30, 685.317]
  - - [64, 128, 1, 4096, 96, 96, 4128, 4128]
    - [37, 796.167]
  - - [64, 256, 1, 64, 96, 96, 96, 96]
    - [68, 161.892]
  - - [64, 256, 1, 128, 96, 96, 160, 160]
    - [7, 302.054]
  - - [64, 256, 1, 256, 96, 96, 288, 288]
    - [66, 523.176]
  - - [64, 256, 1, 512, 96, 96, 544, 544]
    - [30, 818.804]
  - - [64, 256, 1, 1024, 96, 96, 1056, 1056]
    - [4, 1112.33]
  - - [64, 256, 1, 2048, 96, 96, 2080, 2080]
    - [78, 1401.66]
  - - [64, 256, 1, 4096, 96, 96, 4128, 4128]
    - [63, 1624.99]
  - - [64, 512, 1, 64, 96, 96, 96, 96]
    - [68, 345.665]
  - - [64, 512, 1, 128, 96, 96, 160, 160]
    - [29, 642.313]
  - - [64, 512, 1, 256, 96, 96, 288, 288]
    - [66, 1102.17]
  - - [64, 512, 1, 512, 96, 96, 544, 544]
    - [20, 1707.43]
  - - [64, 512, 1, 1024, 96, 96, 1056, 1056]
    - [24, 2277.35]
  - - [64, 512, 1, 2048, 96, 96, 2080, 2080]
    - [48, 2887.53]
  - - [64, 512, 1, 4096, 96, 96, 4128, 4128]
    - [36, 3258.11]
  - - [64, 1024, 1, 64, 96, 96, 96, 96]
    - [68, 672.056]
  - - [64, 1024, 1, 128, 96, 96, 160, 160]
    - [20, 1313.18]
  - - [64, 1024, 1, 256, 96, 96, 288, 288]
    - [27, 2234.88]
  - - [64, 1024, 1, 512, 96, 96, 544, 544]
    - [68, 3440.08]
  - - [64, 1024, 1, 1024, 96, 96, 1056, 1056]
    - [4, 4682.47]
  - - [64, 1024, 1, 2048, 96, 96, 2080, 2080]
    - [13, 5773.56]
  - - [64, 1024, 1, 4096, 96, 96, 4128, 4128]
    - [13, 6533.51]
  - - [64, 2048, 1, 64, 96, 96, 96, 96]
    - [27, 1302.98]
  - - [64, 2048, 1, 128, 96, 96, 160, 160]
    - [54, 2319.22]
  - - [64, 2048, 1, 256, 96, 96, 288, 288]
    - [43, 3986.52]
  - - [64, 2048, 1, 512, 96, 96, 544, 544]
    - [27, 6463.34]
  - - [64, 2048, 1, 1024, 96, 96, 1056, 1056]
    - [6, 8828.95]
  - - [64, 2048, 1, 2048, 96, 96, 2080, 2080]
    - [40, 11193.2]
  - - [64, 2048, 1, 4096, 96, 96, 4128, 4128]
    - [40, 13014.1]
  - - [64, 4096, 1, 64, 96, 96, 96, 96]
    - [13, 2082.83]
  - - [64, 4096, 1, 128, 96, 96, 160, 160]
    - [62, 3882.72]
  - - [64, 4096, 1, 256, 96, 96, 288, 288]
    - [6, 6471.46]
  - - [64, 4096, 1, 512, 96, 96, 544, 544]
    - [76, 10176.5]
  - - [64, 4096, 1, 1024, 96, 96, 1056, 1056]
    - [23, 14302.8]
  - - [64, 4096, 1, 2048, 96, 96, 2080, 2080]
    - [35, 17831.5]
  - - [64, 4096, 1, 4096, 96, 96, 4128, 4128]
    - [13, 19352.3]
  - - [128, 64, 1, 64, 160, 160, 96, 96]
    - [7, 68.5075]
  - - [128, 64, 1, 128, 160, 160, 160, 160]
    - [55, 135.143]
  - - [128, 64, 1, 256, 160, 160, 288, 288]
    - [7, 237.503]
  - - [128, 64, 1, 512, 160, 160, 544, 544]
    - [30, 368.407]
  - - [128, 64, 1, 1024, 160, 160, 1056, 1056]
    - [78, 530.59]
  - - [128, 64, 1, 2048, 160, 160, 2080, 2080]
    - [14, 686.833]
  - - [128, 64, 1, 4096, 160, 160, 4128, 4128]
    - [13, 797.246]
  - - [128, 128, 1, 64, 160, 160, 96, 96]
    - [7, 199.578]
  - - [128, 128, 1, 128, 160, 160, 160, 160]
    - [69, 364.722]
  - - [128, 128, 1, 256, 160, 160, 288, 288]
    - [55, 620.643]
  - - [128, 128, 1, 512, 160, 160, 544, 544]
    - [5, 938.956]
  - - [128, 128, 1, 1024, 160, 160, 1056, 1056]
    - [25, 1223.72]
  - - [128, 128, 1, 2048, 160, 160, 2080, 2080]
    - [63, 1501.72]
  - - [128, 128, 1, 4096, 160, 160, 4128, 4128]
    - [49, 1674.46]
  - - [128, 256, 1, 64, 160, 160, 96, 96]
    - [41, 393.316]
  - - [128, 256, 1, 128, 160, 160, 160, 160]
    - [55, 772.289]
  - - [128, 256, 1, 256, 160, 160, 288, 288]
    - [30, 1279.92]
  - - [128, 256, 1, 512, 160, 160, 544, 544]
    - [30, 1908.45]
  - - [128, 256, 1, 1024, 160, 160, 1056, 1056]
    - [63, 2447.09]
  - - [128, 256, 1, 2048, 160, 160, 2080, 2080]
    - [37, 3029.07]
  - - [128, 256, 1, 4096, 160, 160, 4128, 4128]
    - [36, 3350.0]
  - - [128, 512, 1, 64, 160, 160, 96, 96]
    - [69, 843.246]
  - - [128, 512, 1, 128, 160, 160, 160, 160]
    - [30, 1536.95]
  - - [128, 512, 1, 256, 160, 160, 288, 288]
    - [4, 2548.96]
  - - [128, 512, 1, 512, 160, 160, 544, 544]
    - [4, 3685.68]
  - - [128, 512, 1, 1024, 160, 160, 1056, 1056]
    - [77, 4908.13]
  - - [128, 512, 1, 2048, 160, 160, 2080, 2080]
    - [25, 6048.58]
  - - [128, 512, 1, 4096, 160, 160, 4128, 4128]
    - [24, 6708.37]
  - - [128, 1024, 1, 64, 160, 160, 96, 96]
    - [30, 1525.77]
  - - [128, 1024, 1, 128, 160, 160, 160, 160]
    - [19, 2786.45]
  - - [128, 1024, 1, 256, 160, 160, 288, 288]
    - [76, 4559.65]
  - - [128, 1024, 1, 512, 160, 160, 544, 544]
    - [21, 7148.4]
  - - [128, 1024, 1, 1024, 160, 160, 1056, 1056]
    - [24, 9529.14]
  - - [128, 1024, 1, 2048, 160, 160, 2080, 2080]
    - [76, 11622.1]
  - - [128, 1024, 1, 4096, 160, 160, 4128, 4128]
    - [14, 13149.3]
  - - [128, 2048, 1, 64, 160, 160, 96, 96]
    - [70, 2594.68]
  - - [128, 2048, 1, 128, 160, 160, 160, 160]
    - [66, 4902.79]
  - - [128, 2048, 1, 256, 160, 160, 288, 288]
    - [18, 8348.95]
  - - [128, 2048, 1, 512, 160, 160, 544, 544]
    - [5, 12993.0]
  - - [128, 2048, 1, 1024, 160, 160, 1056, 1056]
    - [67, 17579.3]
  - - [128, 2048, 1, 2048, 160, 160, 2080, 2080]
    - [40, 22628.9]
  - - [128, 2048, 1, 4096, 160, 160, 4128, 4128]
    - [40, 26191.4]
  - - [128, 4096, 1, 64, 160, 160, 96, 96]
    - [62, 5000.66]
  - - [128, 4096, 1, 128, 160, 160, 160, 160]
    - [1, 8895.69]
  - - [128, 4096, 1, 256, 160, 160, 288, 288]
    - [24, 14269.4]
  - - [128, 4096, 1, 512, 160, 160, 544, 544]
    - [76, 22345.5]
  - - [128, 4096, 1, 1024, 160, 160, 1056, 1056]
    - [35, 31809.0]
  - - [128, 4096, 1, 2048, 160, 160, 2080, 2080]
    - [36, 37614.4]
  - - [128, 4096, 1, 4096, 160, 160, 4128, 4128]
    - [24, 39328.4]
  - - [256, 64, 1, 64, 288, 288, 96, 96]
    - [7, 163.279]
  - - [256, 64, 1, 128, 288, 288, 160, 160]
    - [6, 288.072]
  - - [256, 64, 1, 256, 288, 288, 288, 288]
    - [54, 520.256]
  - - [256, 64, 1, 512, 288, 288, 544, 544]
    - [6, 817.286]
  - - [256, 64, 1, 1024, 288, 288, 1056, 1056]
    - [43, 1104.86]
  - - [256, 64, 1, 2048, 288, 288, 2080, 2080]
    - [25, 1420.35]
  - - [256, 64, 1, 4096, 288, 288, 4128, 4128]
    - [25, 1625.35]
  - - [256, 128, 1, 64, 288, 288, 96, 96]
    - [66, 414.293]
  - - [256, 128, 1, 128, 288, 288, 160, 160]
    - [4, 762.462]
  - - [256, 128, 1, 256, 288, 288, 288, 288]
    - [76, 1241.1]
  - - [256, 128, 1, 512, 288, 288, 544, 544]
    - [6, 1902.18]
  - - [256, 128, 1, 1024, 288, 288, 1056, 1056]
    - [13, 2502.76]
  - - [256, 128, 1, 2048, 288, 288, 2080, 2080]
    - [36, 2975.08]
  - - [256, 128, 1, 4096, 288, 288, 4128, 4128]
    - [13, 3369.51]
  - - [256, 256, 1, 64, 288, 288, 96, 96]
    - [29, 835.19]
  - - [256, 256, 1, 128, 288, 288, 160, 160]
    - [68, 1447.32]
  - - [256, 256, 1, 256, 288, 288, 288, 288]
    - [29, 2425.5]
  - - [256, 256, 1, 512, 288, 288, 544, 544]
    - [68, 3803.49]
  - - [256, 256, 1, 1024, 288, 288, 1056, 1056]
    - [29, 4981.37]
  - - [256, 256, 1, 2048, 288, 288, 2080, 2080]
    - [52, 6034.98]
  - - [256, 256, 1, 4096, 288, 288, 4128, 4128]
    - [48, 6712.74]
  - - [256, 512, 1, 64, 288, 288, 96, 96]
    - [54, 1519.68]
  - - [256, 512, 1, 128, 288, 288, 160, 160]
    - [29, 2781.83]
  - - [256, 512, 1, 256, 288, 288, 288, 288]
    - [40, 4657.1]
  - - [256, 512, 1, 512, 288, 288, 544, 544]
    - [29, 7127.13]
  - - [256, 512, 1, 1024, 288, 288, 1056, 1056]
    - [28, 9430.05]
  - - [256, 512, 1, 2048, 288, 288, 2080, 2080]
    - [29, 11697.6]
  - - [256, 512, 1, 4096, 288, 288, 4128, 4128]
    - [37, 13136.7]
  - - [256, 1024, 1, 64, 288, 288, 96, 96]
    - [54, 2661.78]
  - - [256, 1024, 1, 128, 288, 288, 160, 160]
    - [43, 4934.48]
  - - [256, 1024, 1, 256, 288, 288, 288, 288]
    - [1, 8247.37]
  - - [256, 1024, 1, 512, 288, 288, 544, 544]
    - [5, 12712.4]
  - - [256, 1024, 1, 1024, 288, 288, 1056, 1056]
    - [27, 18102.1]
  - - [256, 1024, 1, 2048, 288, 288, 2080, 2080]
    - [76, 22394.9]
  - - [256, 1024, 1, 4096, 288, 288, 4128, 4128]
    - [68, 25998.0]
  - - [256, 2048, 1, 64, 288, 288, 96, 96]
    - [7, 4817.58]
  - - [256, 2048, 1, 128, 288, 288, 160, 160]
    - [15, 8664.8]
  - - [256, 2048, 1, 256, 288, 288, 288, 288]
    - [76, 14918.1]
  - - [256, 2048, 1, 512, 288, 288, 544, 544]
    - [13, 22453.8]
  - - [256, 2048, 1, 1024, 288, 288, 1056, 1056]
    - [75, 31701.9]
  - - [256, 2048, 1, 2048, 288, 288, 2080, 2080]
    - [13, 37712.2]
  - - [256, 2048, 1, 4096, 288, 288, 4128, 4128]
    - [36, 39075.8]
  - - [256, 4096, 1, 64, 288, 288, 96, 96]
    - [40, 9556.98]
  - - [256, 4096, 1, 128, 288, 288, 160, 160]
    - [15, 16241.3]
  - - [256, 4096, 1, 256, 288, 288, 288, 288]
    - [11, 23107.2]
  - - [256, 4096, 1, 512, 288, 288, 544, 544]
    - [31, 31195.3]
  - - [256, 4096, 1, 1024, 288, 288, 1056, 1056]
    - [63, 36860.4]
  - - [256, 4096, 1, 2048, 288, 288, 2080, 2080]
    - [76, 39337.8]
  - - [256, 4096, 1, 4096, 288, 288, 4128, 4128]
    - [48, 42022.3]
  - - [384, 64, 1, 64, 416, 416, 96, 96]
    - [6, 251.256]
  - - [384, 64, 1, 128, 416, 416, 160, 160]
    - [6, 446.838]
  - - [384, 64, 1, 256, 416, 416, 288, 288]
    - [68, 796.894]
  - - [384, 64, 1, 512, 416, 416, 544, 544]
    - [20, 1252.28]
  - - [384, 64, 1, 1024, 416, 416, 1056, 1056]
    - [5, 1676.72]
  - - [384, 64, 1, 2048, 416, 416, 2080, 2080]
    - [24, 2141.59]
  - - [384, 64, 1, 4096, 416, 416, 4128, 4128]
    - [25, 2446.61]
  - - [384, 128, 1, 64, 416, 416, 96, 96]
    - [53, 630.28]
  - - [384, 128, 1, 128, 416, 416, 160, 160]
    - [21, 1154.18]
  - - [384, 128, 1, 256, 416, 416, 288, 288]
    - [5, 1919.88]
  - - [384, 128, 1, 512, 416, 416, 544, 544]
    - [69, 2759.72]
  - - [384, 128, 1, 1024, 416, 416, 1056, 1056]
    - [63, 3711.23]
  - - [384, 128, 1, 2048, 416, 416, 2080, 2080]
    - [14, 4546.27]
  - - [384, 128, 1, 4096, 416, 416, 4128, 4128]
    - [14, 5029.4]
  - - [384, 256, 1, 64, 416, 416, 96, 96]
    - [30, 1199.51]
  - - [384, 256, 1, 128, 416, 416, 160, 160]
    - [7, 2184.91]
  - - [384, 256, 1, 256, 416, 416, 288, 288]
    - [55, 3522.66]
  - - [384, 256, 1, 512, 416, 416, 544, 544]
    - [76, 5420.18]
  - - [384, 256, 1, 1024, 416, 416, 1056, 1056]
    - [25, 7347.16]
  - - [384, 256, 1, 2048, 416, 416, 2080, 2080]
    - [67, 8923.26]
  - - [384, 256, 1, 4096, 416, 416, 4128, 4128]
    - [63, 9954.85]
  - - [384, 512, 1, 64, 416, 416, 96, 96]
    - [68, 2011.66]
  - - [384, 512, 1, 128, 416, 416, 160, 160]
    - [55, 3736.57]
  - - [384, 512, 1, 256, 416, 416, 288, 288]
    - [69, 6603.47]
  - - [384, 512, 1, 512, 416, 416, 544, 544]
    - [28, 10171.1]
  - - [384, 512, 1, 1024, 416, 416, 1056, 1056]
    - [19, 13639.1]
  - - [384, 512, 1, 2048, 416, 416, 2080, 2080]
    - [37, 17136.4]
  - - [384, 512, 1, 4096, 416, 416, 4128, 4128]
    - [37, 19473.0]
  - - [384, 1024, 1, 64, 416, 416, 96, 96]
    - [42, 3976.92]
  - - [384, 1024, 1, 128, 416, 416, 160, 160]
    - [61, 6604.34]
  - - [384, 1024, 1, 256, 416, 416, 288, 288]
    - [78, 11686.1]
  - - [384, 1024, 1, 512, 416, 416, 544, 544]
    - [63, 18004.6]
  - - [384, 1024, 1, 1024, 416, 416, 1056, 1056]
    - [37, 23721.8]
  - - [384, 1024, 1, 2048, 416, 416, 2080, 2080]
    - [37, 28165.5]
  - - [384, 1024, 1, 4096, 416, 416, 4128, 4128]
    - [63, 29953.8]
  - - [384, 2048, 1, 64, 416, 416, 96, 96]
    - [67, 7821.55]
  - - [384, 2048, 1, 128, 416, 416, 160, 160]
    - [64, 13411.1]
  - - [384, 2048, 1, 256, 416, 416, 288, 288]
    - [72, 20886.7]
  - - [384, 2048, 1, 512, 416, 416, 544, 544]
    - [12, 28102.5]
  - - [384, 2048, 1, 1024, 416, 416, 1056, 1056]
    - [60, 35289.5]
  - - [384, 2048, 1, 2048, 416, 416, 2080, 2080]
    - [35, 37949.5]
  - - [384, 2048, 1, 4096, 416, 416, 4128, 4128]
    - [47, 41000.3]
  - - [384, 4096, 1, 64, 416, 416, 96, 96]
    - [50, 11739.2]
  - - [384, 4096, 1, 128, 416, 416, 160, 160]
    - [64, 19569.1]
  - - [384, 4096, 1, 256, 416, 416, 288, 288]
    - [39, 27020.1]
  - - [384, 4096, 1, 512, 416, 416, 544, 544]
    - [54, 33590.9]
  - - [384, 4096, 1, 1024, 416, 416, 1056, 1056]
    - [30, 36268.6]
  - - [384, 4096, 1, 2048, 416, 416, 2080, 2080]
    - [7, 39724.1]
  - - [384, 4096, 1, 4096, 416, 416, 4128, 4128]
    - [7, 41645.4]
  - - [768, 64, 1, 64, 800, 800, 96, 96]
    - [20, 511.584]
  - - [768, 64, 1, 128, 800, 800, 160, 160]
    - [6, 964.947]
  - - [768, 64, 1, 256, 800, 800, 288, 288]
    - [68, 1653.91]
  - - [768, 64, 1, 512, 800, 800, 544, 544]
    - [5, 2522.39]
  - - [768, 64, 1, 1024, 800, 800, 1056, 1056]
    - [76, 3431.16]
  - - [768, 64, 1, 2048, 800, 800, 2080, 2080]
    - [21, 4281.19]
  - - [768, 64, 1, 4096, 800, 800, 4128, 4128]
    - [76, 4884.68]
  - - [768, 128, 1, 64, 800, 800, 96, 96]
    - [52, 1167.9]
  - - [768, 128, 1, 128, 800, 800, 160, 160]
    - [29, 2157.94]
  - - [768, 128, 1, 256, 800, 800, 288, 288]
    - [76, 3510.37]
  - - [768, 128, 1, 512, 800, 800, 544, 544]
    - [20, 5463.11]
  - - [768, 128, 1, 1024, 800, 800, 1056, 1056]
    - [40, 7291.27]
  - - [768, 128, 1, 2048, 800, 800, 2080, 2080]
    - [78, 8823.54]
  - - [768, 128, 1, 4096, 800, 800, 4128, 4128]
    - [62, 9937.89]
  - - [768, 256, 1, 64, 800, 800, 96, 96]
    - [54, 2087.41]
  - - [768, 256, 1, 128, 800, 800, 160, 160]
    - [27, 3835.68]
  - - [768, 256, 1, 256, 800, 800, 288, 288]
    - [66, 6526.41]
  - - [768, 256, 1, 512, 800, 800, 544, 544]
    - [52, 10080.4]
  - - [768, 256, 1, 1024, 800, 800, 1056, 1056]
    - [66, 13536.4]
  - - [768, 256, 1, 2048, 800, 800, 2080, 2080]
    - [28, 17018.3]
  - - [768, 256, 1, 4096, 800, 800, 4128, 4128]
    - [36, 19391.0]
  - - [768, 512, 1, 64, 800, 800, 96, 96]
    - [0, 3637.21]
  - - [768, 512, 1, 128, 800, 800, 160, 160]
    - [75, 7153.45]
  - - [768, 512, 1, 256, 800, 800, 288, 288]
    - [62, 11398.9]
  - - [768, 512, 1, 512, 800, 800, 544, 544]
    - [24, 17105.1]
  - - [768, 512, 1, 1024, 800, 800, 1056, 1056]
    - [36, 23418.3]
  - - [768, 512, 1, 2048, 800, 800, 2080, 2080]
    - [37, 27902.0]
  - - [768, 512, 1, 4096, 800, 800, 4128, 4128]
    - [62, 29851.1]
  - - [768, 1024, 1, 64, 800, 800, 96, 96]
    - [52, 6690.37]
  - - [768, 1024, 1, 128, 800, 800, 160, 160]
    - [64, 13391.4]
  - - [768, 1024, 1, 256, 800, 800, 288, 288]
    - [71, 20878.0]
  - - [768, 1024, 1, 512, 800, 800, 544, 544]
    - [10, 27938.8]
  - - [768, 1024, 1, 1024, 800, 800, 1056, 1056]
    - [37, 35078.9]
  - - [768, 1024, 1, 2048, 800, 800, 2080, 2080]
    - [36, 37988.9]
  - - [768, 1024, 1, 4096, 800, 800, 4128, 4128]
    - [62, 40917.0]
  - - [768, 2048, 1, 64, 800, 800, 96, 96]
    - [73, 12139.8]
  - - [768, 2048, 1, 128, 800, 800, 160, 160]
    - [51, 20062.4]
  - - [768, 2048, 1, 256, 800, 800, 288, 288]
    - [33, 27213.7]
  - - [768, 2048, 1, 512, 800, 800, 544, 544]
    - [54, 33451.3]
  - - [768, 2048, 1, 1024, 800, 800, 1056, 1056]
    - [35, 36754.4]
  - - [768, 2048, 1, 2048, 800, 800, 2080, 2080]
    - [60, 40713.7]
  - - [768, 2048, 1, 4096, 800, 800, 4128, 4128]
    - [12, 43086.7]
  - - [768, 4096, 1, 64, 800, 800, 96, 96]
    - [73, 17071.7]
  - - [768, 4096, 1, 128, 800, 800, 160, 160]
    - [26, 25695.8]
  - - [768, 4096, 1, 256, 800, 800, 288, 288]
    - [58, 32861.6]
  - - [768, 4096, 1, 512, 800, 800, 544, 544]
    - [32, 36276.7]
  - - [768, 4096, 1, 1024, 800, 800, 1056, 1056]
    - [9, 40014.3]
  - - [768, 4096, 1, 2048, 800, 800, 2080, 2080]
    - [62, 42772.1]
  - - [768, 4096, 1, 4096, 800, 800, 4128, 4128]
    - [75, 43035.5]
  - - [1536, 64, 1, 64, 1568, 1568, 96, 96]
    - [3, 893.549]
  - - [1536, 64, 1, 128, 1568, 1568, 160, 160]
    - [68, 1823.35]
  - - [1536, 64, 1, 256, 1568, 1568, 288, 288]
    - [66, 3156.78]
  - - [1536, 64, 1, 512, 1568, 1568, 544, 544]
    - [4, 4894.17]
  - - [1536, 64, 1, 1024, 1568, 1568, 1056, 1056]
    - [66, 6763.21]
  - - [1536, 64, 1, 2048, 1568, 1568, 2080, 2080]
    - [13, 8453.07]
  - - [1536, 64, 1, 4096, 1568, 1568, 4128, 4128]
    - [13, 9663.84]
  - - [1536, 128, 1, 64, 1568, 1568, 96, 96]
    - [68, 2033.77]
  - - [1536, 128, 1, 128, 1568, 1568, 160, 160]
    - [4, 3649.35]
  - - [1536, 128, 1, 256, 1568, 1568, 288, 288]
    - [66, 6246.97]
  - - [1536, 128, 1, 512, 1568, 1568, 544, 544]
    - [52, 10036.2]
  - - [1536, 128, 1, 1024, 1568, 1568, 1056, 1056]
    - [4, 13651.1]
  - - [1536, 128, 1, 2048, 1568, 1568, 2080, 2080]
    - [48, 16991.8]
  - - [1536, 128, 1, 4096, 1568, 1568, 4128, 4128]
    - [52, 19534.0]
  - - [1536, 256, 1, 64, 1568, 1568, 96, 96]
    - [76, 4064.25]
  - - [1536, 256, 1, 128, 1568, 1568, 160, 160]
    - [48, 6538.3]
  - - [1536, 256, 1, 256, 1568, 1568, 288, 288]
    - [48, 11985.2]
  - - [1536, 256, 1, 512, 1568, 1568, 544, 544]
    - [24, 17247.2]
  - - [1536, 256, 1, 1024, 1568, 1568, 1056, 1056]
    - [48, 23529.1]
  - - [1536, 256, 1, 2048, 1568, 1568, 2080, 2080]
    - [62, 28109.4]
  - - [1536, 256, 1, 4096, 1568, 1568, 4128, 4128]
    - [36, 29912.6]
  - - [1536, 512, 1, 64, 1568, 1568, 96, 96]
    - [27, 8165.42]
  - - [1536, 512, 1, 128, 1568, 1568, 160, 160]
    - [65, 13421.8]
  - - [1536, 512, 1, 256, 1568, 1568, 288, 288]
    - [71, 20221.7]
  - - [1536, 512, 1, 512, 1568, 1568, 544, 544]
    - [36, 28599.6]
  - - [1536, 512, 1, 1024, 1568, 1568, 1056, 1056]
    - [62, 35306.6]
  - - [1536, 512, 1, 2048, 1568, 1568, 2080, 2080]
    - [60, 38042.7]
  - - [1536, 512, 1, 4096, 1568, 1568, 4128, 4128]
    - [36, 40905.5]
  - - [1536, 1024, 1, 64, 1568, 1568, 96, 96]
    - [45, 11680.6]
  - - [1536, 1024, 1, 128, 1568, 1568, 160, 160]
    - [64, 19427.4]
  - - [1536, 1024, 1, 256, 1568, 1568, 288, 288]
    - [73, 27391.4]
  - - [1536, 1024, 1, 512, 1568, 1568, 544, 544]
    - [74, 33371.0]
  - - [1536, 1024, 1, 1024, 1568, 1568, 1056, 1056]
    - [60, 36429.4]
  - - [1536, 1024, 1, 2048, 1568, 1568, 2080, 2080]
    - [35, 40697.3]
  - - [1536, 1024, 1, 4096, 1568, 1568, 4128, 4128]
    - [12, 43090.2]
  - - [1536, 2048, 1, 64, 1568, 1568, 96, 96]
    - [45, 16626.2]
  - - [1536, 2048, 1, 128, 1568, 1568, 160, 160]
    - [51, 25877.5]
  - - [1536, 2048, 1, 256, 1568, 1568, 288, 288]
    - [74, 32844.2]
  - - [1536, 2048, 1, 512, 1568, 1568, 544, 544]
    - [57, 36321.7]
  - - [1536, 2048, 1, 1024, 1568, 1568, 1056, 1056]
    - [44, 40125.9]
  - - [1536, 2048, 1, 2048, 1568, 1568, 2080, 2080]
    - [62, 42773.2]
  - - [1536, 2048, 1, 4096, 1568, 1568, 4128, 4128]
    - [75, 43092.5]
  - - [1536, 4096, 1, 64, 1568, 1568, 96, 96]
    - [73, 21607.4]
  - - [1536, 4096, 1, 128, 1568, 1568, 160, 160]
    - [45, 30644.5]
  - - [1536, 4096, 1, 256, 1568, 1568, 288, 288]
    - [34, 34998.2]
  - - [1536, 4096, 1, 512, 1568, 1568, 544, 544]
    - [32, 39209.6]
  - - [1536, 4096, 1, 1024, 1568, 1568, 1056, 1056]
    - [36, 42262.3]
  - - [1536, 4096, 1, 2048, 1568, 1568, 2080, 2080]
    - [9, 42637.6]
  - - [1536, 4096, 1, 4096, 1568, 1568, 4128, 4128]
    - [29, 43208.6]
  - - [3072, 64, 1, 64, 3104, 3104, 96, 96]
    - [6, 1803.23]
  - - [3072, 64, 1, 128, 3104, 3104, 160, 160]
    - [62, 2871.5]
  - - [3072, 64, 1, 256, 3104, 3104, 288, 288]
    - [36, 5087.1]
  - - [3072, 64, 1, 512, 3104, 3104, 544, 544]
    - [13, 7863.11]
  - - [3072, 64, 1, 1024, 3104, 3104, 1056, 1056]
    - [62, 10897.3]
  - - [3072, 64, 1, 2048, 3104, 3104, 2080, 2080]
    - [62, 13628.0]
  - - [3072, 64, 1, 4096, 3104, 3104, 4128, 4128]
    - [36, 14815.7]
  - - [3072, 128, 1, 64, 3104, 3104, 96, 96]
    - [38, 4018.17]
  - - [3072, 128, 1, 128, 3104, 3104, 160, 160]
    - [36, 6185.55]
  - - [3072, 128, 1, 256, 3104, 3104, 288, 288]
    - [14, 10363.8]
  - - [3072, 128, 1, 512, 3104, 3104, 544, 544]
    - [48, 17710.0]
  - - [3072, 128, 1, 1024, 3104, 3104, 1056, 1056]
    - [62, 23113.1]
  - - [3072, 128, 1, 2048, 3104, 3104, 2080, 2080]
    - [25, 27916.5]
  - - [3072, 128, 1, 4096, 3104, 3104, 4128, 4128]
    - [13, 29818.4]
  - - [3072, 256, 1, 64, 3104, 3104, 96, 96]
    - [34, 7449.92]
  - - [3072, 256, 1, 128, 3104, 3104, 160, 160]
    - [64, 13829.3]
  - - [3072, 256, 1, 256, 3104, 3104, 288, 288]
    - [31, 20772.5]
  - - [3072, 256, 1, 512, 3104, 3104, 544, 544]
    - [37, 27921.3]
  - - [3072, 256, 1, 1024, 3104, 3104, 1056, 1056]
    - [13, 34935.9]
  - - [3072, 256, 1, 2048, 3104, 3104, 2080, 2080]
    - [75, 37956.7]
  - - [3072, 256, 1, 4096, 3104, 3104, 4128, 4128]
    - [62, 40886.8]
  - - [3072, 512, 1, 64, 3104, 3104, 96, 96]
    - [73, 11637.4]
  - - [3072, 512, 1, 128, 3104, 3104, 160, 160]
    - [50, 19974.9]
  - - [3072, 512, 1, 256, 3104, 3104, 288, 288]
    - [34, 27012.8]
  - - [3072, 512, 1, 512, 3104, 3104, 544, 544]
    - [34, 33600.7]
  - - [3072, 512, 1, 1024, 3104, 3104, 1056, 1056]
    - [35, 36905.2]
  - - [3072, 512, 1, 2048, 3104, 3104, 2080, 2080]
    - [61, 40723.0]
  - - [3072, 512, 1, 4096, 3104, 3104, 4128, 4128]
    - [47, 42817.9]
  - - [3072, 1024, 1, 64, 3104, 3104, 96, 96]
    - [45, 16557.8]
  - - [3072, 1024, 1, 128, 3104, 3104, 160, 160]
    - [45, 25375.2]
  - - [3072, 1024, 1, 256, 3104, 3104, 288, 288]
    - [34, 33008.5]
  - - [3072, 1024, 1, 512, 3104, 3104, 544, 544]
    - [32, 36453.3]
  - - [3072, 1024, 1, 1024, 3104, 3104, 1056, 1056]
    - [8, 40048.1]
  - - [3072, 1024, 1, 2048, 3104, 3104, 2080, 2080]
    - [36, 42814.4]
  - - [3072, 1024, 1, 4096, 3104, 3104, 4128, 4128]
    - [75, 43281.0]
  - - [3072, 2048, 1, 64, 3104, 3104, 96, 96]
    - [73, 22138.4]
  - - [3072, 2048, 1, 128, 3104, 3104, 160, 160]
    - [73, 30708.8]
  - - [3072, 2048, 1, 256, 3104, 3104, 288, 288]
    - [46, 35121.0]
  - - [3072, 2048, 1, 512, 3104, 3104, 544, 544]
    - [44, 39435.7]
  - - [3072, 2048, 1, 1024, 3104, 3104, 1056, 1056]
    - [36, 42320.8]
  - - [3072, 2048, 1, 2048, 3104, 3104, 2080, 2080]
    - [69, 42714.1]
  - - [3072, 2048, 1, 4096, 3104, 3104, 4128, 4128]
    - [27, 42866.9]
  - - [3072, 4096, 1, 64, 3104, 3104, 96, 96]
    - [19, 6510.9]
  - - [3072, 4096, 1, 128, 3104, 3104, 160, 160]
    - [16, 13148.5]
  - - [3072, 4096, 1, 256, 3104, 3104, 288, 288]
    - [22, 24930.8]
  - - [3072, 4096, 1, 512, 3104, 3104, 544, 544]
    - [11, 39133.0]
  - - [3072, 4096, 1, 1024, 3104, 3104, 1056, 1056]
    - [33, 41732.5]
  - - [3072, 4096, 1, 2048, 3104, 3104, 2080, 2080]
    - [34, 42575.9]
  - - [3072, 4096, 1, 4096, 3104, 3104, 4128, 4128]
    - [29, 43103.9]
  - - [4096, 64, 1, 64, 4128, 4128, 96, 96]
    - [24, 1910.63]
  - - [4096, 64, 1, 128, 4128, 4128, 160, 160]
    - [76, 3657.97]
  - - [4096, 64, 1, 256, 4128, 4128, 288, 288]
    - [13, 6304.29]
  - - [4096, 64, 1, 512, 4128, 4128, 544, 544]
    - [24, 9697.13]
  - - [4096, 64, 1, 1024, 4128, 4128, 1056, 1056]
    - [24, 13918.0]
  - - [4096, 64, 1, 2048, 4128, 4128, 2080, 2080]
    - [36, 17590.2]
  - - [4096, 64, 1, 4096, 4128, 4128, 4128, 4128]
    - [62, 19365.6]
  - - [4096, 128, 1, 64, 4128, 4128, 96, 96]
    - [4, 5850.82]
  - - [4096, 128, 1, 128, 4128, 4128, 160, 160]
    - [2, 10205.2]
  - - [4096, 128, 1, 256, 4128, 4128, 288, 288]
    - [36, 16625.5]
  - - [4096, 128, 1, 512, 4128, 4128, 544, 544]
    - [13, 24310.4]
  - - [4096, 128, 1, 1024, 4128, 4128, 1056, 1056]
    - [62, 31786.4]
  - - [4096, 128, 1, 2048, 4128, 4128, 2080, 2080]
    - [13, 37607.9]
  - - [4096, 128, 1, 4096, 4128, 4128, 4128, 4128]
    - [36, 39160.5]
  - - [4096, 256, 1, 64, 4128, 4128, 96, 96]
    - [54, 9831.36]
  - - [4096, 256, 1, 128, 4128, 4128, 160, 160]
    - [17, 16168.9]
  - - [4096, 256, 1, 256, 4128, 4128, 288, 288]
    - [33, 23303.7]
  - - [4096, 256, 1, 512, 4128, 4128, 544, 544]
    - [56, 31410.7]
  - - [4096, 256, 1, 1024, 4128, 4128, 1056, 1056]
    - [60, 36991.2]
  - - [4096, 256, 1, 2048, 4128, 4128, 2080, 2080]
    - [37, 39511.5]
  - - [4096, 256, 1, 4096, 4128, 4128, 4128, 4128]
    - [76, 41894.4]
  - - [4096, 512, 1, 64, 4128, 4128, 96, 96]
    - [73, 13413.7]
  - - [4096, 512, 1, 128, 4128, 4128, 160, 160]
    - [64, 22455.7]
  - - [4096, 512, 1, 256, 4128, 4128, 288, 288]
    - [10, 29743.5]
  - - [4096, 512, 1, 512, 4128, 4128, 544, 544]
    - [32, 36082.6]
  - - [4096, 512, 1, 1024, 4128, 4128, 1056, 1056]
    - [71, 38464.0]
  - - [4096, 512, 1, 2048, 4128, 4128, 2080, 2080]
    - [62, 41781.9]
  - - [4096, 512, 1, 4096, 4128, 4128, 4128, 4128]
    - [76, 43408.5]
  - - [4096, 1024, 1, 64, 4128, 4128, 96, 96]
    - [73, 18740.3]
  - - [4096, 1024, 1, 128, 4128, 4128, 160, 160]
    - [73, 27851.8]
  - - [4096, 1024, 1, 256, 4128, 4128, 288, 288]
    - [74, 34575.6]
  - - [4096, 1024, 1, 512, 4128, 4128, 544, 544]
    - [44, 37737.4]
  - - [4096, 1024, 1, 1024, 4128, 4128, 1056, 1056]
    - [36, 41071.9]
  - - [4096, 1024, 1, 2048, 4128, 4128, 2080, 2080]
    - [36, 43425.9]
  - - [4096, 1024, 1, 4096, 4128, 4128, 4128, 4128]
    - [63, 43288.9]
  - - [4096, 2048, 1, 64, 4128, 4128, 96, 96]
    - [58, 22742.0]
  - - [4096, 2048, 1, 128, 4128, 4128, 160, 160]
    - [33, 31786.3]
  - - [4096, 2048, 1, 256, 4128, 4128, 288, 288]
    - [58, 36015.3]
  - - [4096, 2048, 1, 512, 4128, 4128, 544, 544]
    - [59, 39381.7]
  - - [4096, 2048, 1, 1024, 4128, 4128, 1056, 1056]
    - [33, 41619.2]
  - - [4096, 2048, 1, 2048, 4128, 4128, 2080, 2080]
    - [27, 41878.8]
  - - [4096, 2048, 1, 4096, 4128, 4128, 4128, 4128]
    - [32, 43314.6]
  - - [4096, 4096, 1, 64, 4128, 4128, 96, 96]
    - [19, 6780.39]
  - - [4096, 4096, 1, 128, 4128, 4128, 160, 160]
    - [16, 13826.8]
  - - [4096, 4096, 1, 256, 4128, 4128, 288, 288]
    - [11, 26586.0]
  - - [4096, 4096, 1, 512, 4128, 4128, 544, 544]
    - [11, 39749.7]
  - - [4096, 4096, 1, 1024, 4128, 4128, 1056, 1056]
    - [33, 41006.2]
  - - [4096, 4096, 1, 2048, 4128, 4128, 2080, 2080]
    - [31, 42968.4]
  - - [4096, 4096, 1, 4096, 4128, 4128, 4128, 4128]
    - [63, 43313.6]
- null
- null
- DeviceEfficiency
