library/src/blas3/Tensile/Logic/asm_full/navi33/navi33_Cijk_Alik_Bljk_HB.yaml
- {MinimumRequiredVersion: 4.35.0}
- navi33
- gfx1102
- [Device 73f0]
    SolutionIndex: 0
    SolutionNameMin: Cijk_Alik_Bljk_HB_MT128x128x32_MI16x16x16x1_SN_GRVW4_SIA1_SU0_SUS0_SVW2_VW2_WGM1
    SolutionIndex: 1
    SolutionNameMin: Cijk_Alik_Bljk_HB_MT128x128x32_MI16x16x16x1_SN_GRVW4_SIA1_SU0_SUS0_SVW4_VW4_WGM1
    SolutionIndex: 2
    SolutionNameMin: Cijk_Alik_Bljk_HB_MT128x128x32_MI16x16x16x1_SN_GRVW8_SIA1_SU0_SUS0_SVW2_VW2_WGM1
    SolutionIndex: 3
    SolutionNameMin: Cijk_Alik_Bljk_HB_MT128x128x32_MI16x16x16x1_SN_GRVW8_SIA1_SU0_SUS0_SVW4_VW4_WGM1
    SolutionIndex: 4
    SolutionNameMin: Cijk_Alik_Bljk_HB_MT128x128x32_MI16x16x16x1_SN_GRVW4_SIA3_SU0_SUS0_SVW2_VW2_WGM1
    SolutionIndex: 5
    SolutionNameMin: Cijk_Alik_Bljk_HB_MT128x128x32_MI16x16x16x1_SN_GRVW8_SIA3_SU0_SUS0_SVW2_VW2_WGM1
    SolutionIndex: 6
    SolutionNameMin: Cijk_Alik_Bljk_HB_MT128x128x32_MI16x16x16x1_SN_GRVW8_SIA3_SU0_SUS0_SVW4_VW4_WGM1
    SolutionIndex: 7
    SolutionNameMin: Cijk_Alik_Bljk_HB_MT128x128x32_MI16x16x16x1_SN_GRVW4_SIA1_SU32_SUS256_SVW2_VW2_WGM1
    SolutionIndex: 8
    SolutionNameMin: Cijk_Alik_Bljk_HB_MT128x128x32_MI16x16x16x1_SN_GRVW8_SIA1_SU32_SUS256_SVW2_VW2_WGM1
    SolutionIndex: 9
    SolutionNameMin: Cijk_Alik_Bljk_HB_MT128x128x32_MI16x16x16x1_SN_GRVW8_SIA1_SU32_SUS256_SVW4_VW4_WGM1
    SolutionIndex: 10
    SolutionNameMin: Cijk_Alik_Bljk_HB_MT128x128x32_MI16x16x16x1_SN_GRVW8_SIA3_SU32_SUS256_SVW2_VW2_WGM1
    SolutionIndex: 11
    SolutionNameMin: Cijk_Alik_Bljk_HB_MT128x128x32_MI16x16x16x1_SN_GRVW8_SIA3_SU32_SUS256_SVW4_VW4_WGM1
    SolutionIndex: 12
    SolutionNameMin: Cijk_Alik_Bljk_HB_MT128x128x32_MI16x16x16x1_SN_GRVW4_SIA1_SU0_SUS0_SVW2_VW2_WGM4
    SolutionIndex: 13
    SolutionNameMin: Cijk_Alik_Bljk_HB_MT128x128x32_MI16x16x16x1_SN_GRVW4_SIA1_SU0_SUS0_SVW4_VW4_WGM4
    SolutionIndex: 14
    SolutionNameMin: Cijk_Alik_Bljk_HB_MT128x128x32_MI16x16x16x1_SN_GRVW8_SIA1_SU0_SUS0_SVW2_VW2_WGM4
    SolutionIndex: 15
    SolutionNameMin: Cijk_Alik_Bljk_HB_MT128x128x32_MI16x16x16x1_SN_GRVW8_SIA1_SU0_SUS0_SVW4_VW4_WGM4
    SolutionIndex: 16
    SolutionNameMin: Cijk_Alik_Bljk_HB_MT128x128x32_MI16x16x16x1_SN_GRVW8_SIA3_SU0_SUS0_SVW2_VW2_WGM4
    SolutionIndex: 17
    SolutionNameMin: Cijk_Alik_Bljk_HB_MT128x128x32_MI16x16x16x1_SN_GRVW4_SIA1_SU32_SUS256_SVW2_VW2_WGM4
    SolutionIndex: 18
    SolutionNameMin: Cijk_Alik_Bljk_HB_MT128x128x32_MI16x16x16x1_SN_GRVW4_SIA1_SU32_SUS256_SVW4_VW4_WGM4
    SolutionIndex: 19
    SolutionNameMin: Cijk_Alik_Bljk_HB_MT128x128x32_MI16x16x16x1_SN_GRVW8_SIA1_SU32_SUS256_SVW2_VW2_WGM4
    SolutionIndex: 20
    SolutionNameMin: Cijk_Alik_Bljk_HB_MT128x128x32_MI16x16x16x1_SN_GRVW8_SIA1_SU32_SUS256_SVW4_VW4_WGM4
    SolutionIndex: 21
    SolutionNameMin: Cijk_Alik_Bljk_HB_MT128x128x32_MI16x16x16x1_SN_GRVW8_SIA3_SU32_SUS256_SVW2_VW2_WGM4
    SolutionIndex: 22
    SolutionNameMin: Cijk_Alik_Bljk_HB_MT128x128x32_MI16x16x16x1_SN_GRVW8_SIA3_SU32_SUS256_SVW4_VW4_WGM4
    SolutionIndex: 23
    SolutionNameMin: Cijk_Alik_Bljk_HB_MT128x128x32_MI16x16x16x1_SN_GRVW4_SIA1_SU0_SUS0_SVW2_VW2_WGM8
    SolutionIndex: 24
    SolutionNameMin: Cijk_Alik_Bljk_HB_MT128x128x32_MI16x16x16x1_SN_GRVW4_SIA1_SU0_SUS0_SVW4_VW4_WGM8
    SolutionIndex: 25
    SolutionNameMin: Cijk_Alik_Bljk_HB_MT128x128x32_MI16x16x16x1_SN_GRVW8_SIA1_SU0_SUS0_SVW2_VW2_WGM8
    SolutionIndex: 26
    SolutionNameMin: Cijk_Alik_Bljk_HB_MT128x128x32_MI16x16x16x1_SN_GRVW8_SIA1_SU0_SUS0_SVW4_VW4_WGM8
    SolutionIndex: 27
    SolutionNameMin: Cijk_Alik_Bljk_HB_MT128x128x32_MI16x16x16x1_SN_GRVW4_SIA3_SU0_SUS0_SVW2_VW2_WGM8
    SolutionIndex: 28
    SolutionNameMin: Cijk_Alik_Bljk_HB_MT128x128x32_MI16x16x16x1_SN_GRVW4_SIA3_SU0_SUS0_SVW4_VW4_WGM8
    SolutionIndex: 29
    SolutionNameMin: Cijk_Alik_Bljk_HB_MT128x128x32_MI16x16x16x1_SN_GRVW8_SIA3_SU0_SUS0_SVW2_VW2_WGM8
    SolutionIndex: 30
    SolutionNameMin: Cijk_Alik_Bljk_HB_MT128x128x32_MI16x16x16x1_SN_GRVW8_SIA3_SU0_SUS0_SVW4_VW4_WGM8
    SolutionIndex: 31
    SolutionNameMin: Cijk_Alik_Bljk_HB_MT128x128x32_MI16x16x16x1_SN_GRVW4_SIA1_SU32_SUS256_SVW2_VW2_WGM8
    SolutionIndex: 32
    SolutionNameMin: Cijk_Alik_Bljk_HB_MT128x128x32_MI16x16x16x1_SN_GRVW4_SIA1_SU32_SUS256_SVW4_VW4_WGM8
    SolutionIndex: 33
    SolutionNameMin: Cijk_Alik_Bljk_HB_MT128x128x32_MI16x16x16x1_SN_GRVW8_SIA1_SU32_SUS256_SVW2_VW2_WGM8
    SolutionIndex: 34
    SolutionNameMin: Cijk_Alik_Bljk_HB_MT128x128x32_MI16x16x16x1_SN_GRVW8_SIA1_SU32_SUS256_SVW4_VW4_WGM8
    SolutionIndex: 35
    SolutionNameMin: Cijk_Alik_Bljk_HB_MT128x128x32_MI16x16x16x1_SN_GRVW8_SIA3_SU32_SUS256_SVW2_VW2_WGM8
    SolutionIndex: 36
    SolutionNameMin: Cijk_Alik_Bljk_HB_MT128x128x32_MI16x16x16x1_SN_GRVW8_SIA3_SU32_SUS256_SVW4_VW4_WGM8
- - - [64, 64, 1, 64, 96, 96, 96, 96]
    - [9, 37.8602]
  - - [64, 64, 1, 128, 96, 96, 160, 160]
    - [14, 65.8325]
  - - [64, 64, 1, 256, 96, 96, 288, 288]
    - [25, 122.426]
  - - [64, 64, 1, 512, 96, 96, 544, 544]
    - [25, 179.859]
  - - [64, 64, 1, 1024, 96, 96, 1056, 1056]
    - [14, 254.679]
  - - [64, 64, 1, 2048, 96, 96, 2080, 2080]
    - [2, 319.883]
  - - [64, 64, 1, 4096, 96, 96, 4128, 4128]
    - [7, 353.749]
  - - [64, 128, 1, 64, 96, 96, 96, 96]
    - [26, 70.5447]
  - - [64, 128, 1, 128, 96, 96, 160, 160]
    - [15, 131.615]
  - - [64, 128, 1, 256, 96, 96, 288, 288]
    - [15, 227.31]
  - - [64, 128, 1, 512, 96, 96, 544, 544]
    - [25, 358.457]
  - - [64, 128, 1, 1024, 96, 96, 1056, 1056]
    - [14, 504.974]
  - - [64, 128, 1, 2048, 96, 96, 2080, 2080]
    - [14, 633.581]
  - - [64, 128, 1, 4096, 96, 96, 4128, 4128]
    - [19, 689.315]
  - - [64, 256, 1, 64, 96, 96, 96, 96]
    - [15, 152.898]
  - - [64, 256, 1, 128, 96, 96, 160, 160]
    - [15, 284.36]
  - - [64, 256, 1, 256, 96, 96, 288, 288]
    - [2, 485.509]
  - - [64, 256, 1, 512, 96, 96, 544, 544]
    - [25, 761.355]
  - - [64, 256, 1, 1024, 96, 96, 1056, 1056]
    - [0, 1056.9]
  - - [64, 256, 1, 2048, 96, 96, 2080, 2080]
    - [25, 1311.9]
  - - [64, 256, 1, 4096, 96, 96, 4128, 4128]
    - [33, 1456.67]
  - - [64, 512, 1, 64, 96, 96, 96, 96]
    - [15, 340.835]
  - - [64, 512, 1, 128, 96, 96, 160, 160]
    - [33, 624.992]
  - - [64, 512, 1, 256, 96, 96, 288, 288]
    - [25, 1061.85]
  - - [64, 512, 1, 512, 96, 96, 544, 544]
    - [25, 1640.17]
  - - [64, 512, 1, 1024, 96, 96, 1056, 1056]
    - [0, 2225.98]
  - - [64, 512, 1, 2048, 96, 96, 2080, 2080]
    - [33, 2695.79]
  - - [64, 512, 1, 4096, 96, 96, 4128, 4128]
    - [12, 3035.5]
  - - [64, 1024, 1, 64, 96, 96, 96, 96]
    - [33, 669.164]
  - - [64, 1024, 1, 128, 96, 96, 160, 160]
    - [8, 1225.33]
  - - [64, 1024, 1, 256, 96, 96, 288, 288]
    - [14, 2080.26]
  - - [64, 1024, 1, 512, 96, 96, 544, 544]
    - [0, 3221.12]
  - - [64, 1024, 1, 1024, 96, 96, 1056, 1056]
    - [25, 4408.1]
  - - [64, 1024, 1, 2048, 96, 96, 2080, 2080]
    - [23, 5438.1]
  - - [64, 1024, 1, 4096, 96, 96, 4128, 4128]
    - [23, 6197.29]
  - - [64, 2048, 1, 64, 96, 96, 96, 96]
    - [21, 1316.07]
  - - [64, 2048, 1, 128, 96, 96, 160, 160]
    - [25, 2525.18]
  - - [64, 2048, 1, 256, 96, 96, 288, 288]
    - [2, 4270.64]
  - - [64, 2048, 1, 512, 96, 96, 544, 544]
    - [0, 6549.14]
  - - [64, 2048, 1, 1024, 96, 96, 1056, 1056]
    - [23, 8938.31]
  - - [64, 2048, 1, 2048, 96, 96, 2080, 2080]
    - [7, 11133.3]
  - - [64, 2048, 1, 4096, 96, 96, 4128, 4128]
    - [12, 12722.7]
  - - [64, 4096, 1, 64, 96, 96, 96, 96]
    - [35, 2364.99]
  - - [64, 4096, 1, 128, 96, 96, 160, 160]
    - [10, 4212.73]
  - - [64, 4096, 1, 256, 96, 96, 288, 288]
    - [21, 6840.18]
  - - [64, 4096, 1, 512, 96, 96, 544, 544]
    - [35, 10062.8]
  - - [64, 4096, 1, 1024, 96, 96, 1056, 1056]
    - [14, 13495.3]
  - - [64, 4096, 1, 2048, 96, 96, 2080, 2080]
    - [33, 16146.5]
  - - [64, 4096, 1, 4096, 96, 96, 4128, 4128]
    - [35, 16494.5]
  - - [128, 64, 1, 64, 160, 160, 96, 96]
    - [29, 79.4617]
  - - [128, 64, 1, 128, 160, 160, 160, 160]
    - [25, 150.399]
  - - [128, 64, 1, 256, 160, 160, 288, 288]
    - [25, 256.847]
  - - [128, 64, 1, 512, 160, 160, 544, 544]
    - [0, 375.162]
  - - [128, 64, 1, 1024, 160, 160, 1056, 1056]
    - [2, 524.715]
  - - [128, 64, 1, 2048, 160, 160, 2080, 2080]
    - [14, 620.782]
  - - [128, 64, 1, 4096, 160, 160, 4128, 4128]
    - [8, 685.793]
  - - [128, 128, 1, 64, 160, 160, 96, 96]
    - [3, 177.274]
  - - [128, 128, 1, 128, 160, 160, 160, 160]
    - [26, 327.016]
  - - [128, 128, 1, 256, 160, 160, 288, 288]
    - [3, 567.567]
  - - [128, 128, 1, 512, 160, 160, 544, 544]
    - [25, 845.117]
  - - [128, 128, 1, 1024, 160, 160, 1056, 1056]
    - [25, 1118.33]
  - - [128, 128, 1, 2048, 160, 160, 2080, 2080]
    - [25, 1346.16]
  - - [128, 128, 1, 4096, 160, 160, 4128, 4128]
    - [19, 1489.49]
  - - [128, 256, 1, 64, 160, 160, 96, 96]
    - [3, 398.547]
  - - [128, 256, 1, 128, 160, 160, 160, 160]
    - [9, 716.608]
  - - [128, 256, 1, 256, 160, 160, 288, 288]
    - [25, 1176.85]
  - - [128, 256, 1, 512, 160, 160, 544, 544]
    - [14, 1754.02]
  - - [128, 256, 1, 1024, 160, 160, 1056, 1056]
    - [25, 2312.99]
  - - [128, 256, 1, 2048, 160, 160, 2080, 2080]
    - [2, 2742.38]
  - - [128, 256, 1, 4096, 160, 160, 4128, 4128]
    - [33, 2995.33]
  - - [128, 512, 1, 64, 160, 160, 96, 96]
    - [34, 810.024]
  - - [128, 512, 1, 128, 160, 160, 160, 160]
    - [3, 1445.81]
  - - [128, 512, 1, 256, 160, 160, 288, 288]
    - [0, 2378.73]
  - - [128, 512, 1, 512, 160, 160, 544, 544]
    - [7, 3539.12]
  - - [128, 512, 1, 1024, 160, 160, 1056, 1056]
    - [19, 4630.11]
  - - [128, 512, 1, 2048, 160, 160, 2080, 2080]
    - [7, 5484.1]
  - - [128, 512, 1, 4096, 160, 160, 4128, 4128]
    - [8, 6080.64]
  - - [128, 1024, 1, 64, 160, 160, 96, 96]
    - [26, 1534.7]
  - - [128, 1024, 1, 128, 160, 160, 160, 160]
    - [9, 2731.11]
  - - [128, 1024, 1, 256, 160, 160, 288, 288]
    - [2, 4536.22]
  - - [128, 1024, 1, 512, 160, 160, 544, 544]
    - [8, 6866.76]
  - - [128, 1024, 1, 1024, 160, 160, 1056, 1056]
    - [0, 9172.26]
  - - [128, 1024, 1, 2048, 160, 160, 2080, 2080]
    - [31, 11117.7]
  - - [128, 1024, 1, 4096, 160, 160, 4128, 4128]
    - [31, 12540.2]
  - - [128, 2048, 1, 64, 160, 160, 96, 96]
    - [24, 2902.63]
  - - [128, 2048, 1, 128, 160, 160, 160, 160]
    - [18, 5224.11]
  - - [128, 2048, 1, 256, 160, 160, 288, 288]
    - [14, 8735.89]
  - - [128, 2048, 1, 512, 160, 160, 544, 544]
    - [0, 13252.1]
  - - [128, 2048, 1, 1024, 160, 160, 1056, 1056]
    - [0, 18147.3]
  - - [128, 2048, 1, 2048, 160, 160, 2080, 2080]
    - [31, 22495.2]
  - - [128, 2048, 1, 4096, 160, 160, 4128, 4128]
    - [2, 25333.1]
  - - [128, 4096, 1, 64, 160, 160, 96, 96]
    - [35, 4672.02]
  - - [128, 4096, 1, 128, 160, 160, 160, 160]
    - [5, 8332.36]
  - - [128, 4096, 1, 256, 160, 160, 288, 288]
    - [21, 13577.9]
  - - [128, 4096, 1, 512, 160, 160, 544, 544]
    - [2, 20373.1]
  - - [128, 4096, 1, 1024, 160, 160, 1056, 1056]
    - [14, 27107.9]
  - - [128, 4096, 1, 2048, 160, 160, 2080, 2080]
    - [19, 32195.2]
  - - [128, 4096, 1, 4096, 160, 160, 4128, 4128]
    - [21, 33035.2]
  - - [256, 64, 1, 64, 288, 288, 96, 96]
    - [19, 169.098]
  - - [256, 64, 1, 128, 288, 288, 160, 160]
    - [25, 313.008]
  - - [256, 64, 1, 256, 288, 288, 288, 288]
    - [14, 531.395]
  - - [256, 64, 1, 512, 288, 288, 544, 544]
    - [33, 789.221]
  - - [256, 64, 1, 1024, 288, 288, 1056, 1056]
    - [25, 1033.85]
  - - [256, 64, 1, 2048, 288, 288, 2080, 2080]
    - [19, 1289.42]
  - - [256, 64, 1, 4096, 288, 288, 4128, 4128]
    - [25, 1421.59]
  - - [256, 128, 1, 64, 288, 288, 96, 96]
    - [26, 390.749]
  - - [256, 128, 1, 128, 288, 288, 160, 160]
    - [26, 712.953]
  - - [256, 128, 1, 256, 288, 288, 288, 288]
    - [25, 1173.89]
  - - [256, 128, 1, 512, 288, 288, 544, 544]
    - [8, 1742.18]
  - - [256, 128, 1, 1024, 288, 288, 1056, 1056]
    - [19, 2271.95]
  - - [256, 128, 1, 2048, 288, 288, 2080, 2080]
    - [14, 2672.07]
  - - [256, 128, 1, 4096, 288, 288, 4128, 4128]
    - [19, 2958.23]
  - - [256, 256, 1, 64, 288, 288, 96, 96]
    - [20, 772.289]
  - - [256, 256, 1, 128, 288, 288, 160, 160]
    - [9, 1378.12]
  - - [256, 256, 1, 256, 288, 288, 288, 288]
    - [14, 2276.11]
  - - [256, 256, 1, 512, 288, 288, 544, 544]
    - [33, 3401.71]
  - - [256, 256, 1, 1024, 288, 288, 1056, 1056]
    - [25, 4504.56]
  - - [256, 256, 1, 2048, 288, 288, 2080, 2080]
    - [2, 5361.64]
  - - [256, 256, 1, 4096, 288, 288, 4128, 4128]
    - [14, 5954.12]
  - - [256, 512, 1, 64, 288, 288, 96, 96]
    - [26, 1529.37]
  - - [256, 512, 1, 128, 288, 288, 160, 160]
    - [24, 2745.87]
  - - [256, 512, 1, 256, 288, 288, 288, 288]
    - [25, 4544.21]
  - - [256, 512, 1, 512, 288, 288, 544, 544]
    - [25, 6805.48]
  - - [256, 512, 1, 1024, 288, 288, 1056, 1056]
    - [14, 9055.92]
  - - [256, 512, 1, 2048, 288, 288, 2080, 2080]
    - [2, 10734.9]
  - - [256, 512, 1, 4096, 288, 288, 4128, 4128]
    - [8, 12059.7]
  - - [256, 1024, 1, 64, 288, 288, 96, 96]
    - [15, 2965.22]
  - - [256, 1024, 1, 128, 288, 288, 160, 160]
    - [26, 5321.9]
  - - [256, 1024, 1, 256, 288, 288, 288, 288]
    - [25, 8832.47]
  - - [256, 1024, 1, 512, 288, 288, 544, 544]
    - [14, 13335.1]
  - - [256, 1024, 1, 1024, 288, 288, 1056, 1056]
    - [14, 17805.5]
  - - [256, 1024, 1, 2048, 288, 288, 2080, 2080]
    - [7, 21915.8]
  - - [256, 1024, 1, 4096, 288, 288, 4128, 4128]
    - [33, 24428.2]
  - - [256, 2048, 1, 64, 288, 288, 96, 96]
    - [9, 4716.03]
  - - [256, 2048, 1, 128, 288, 288, 160, 160]
    - [20, 8423.35]
  - - [256, 2048, 1, 256, 288, 288, 288, 288]
    - [2, 13619.3]
  - - [256, 2048, 1, 512, 288, 288, 544, 544]
    - [29, 20285.3]
  - - [256, 2048, 1, 1024, 288, 288, 1056, 1056]
    - [2, 27395.6]
  - - [256, 2048, 1, 2048, 288, 288, 2080, 2080]
    - [8, 31892.1]
  - - [256, 2048, 1, 4096, 288, 288, 4128, 4128]
    - [8, 33930.4]
  - - [256, 4096, 1, 64, 288, 288, 96, 96]
    - [22, 8287.09]
  - - [256, 4096, 1, 128, 288, 288, 160, 160]
    - [35, 13450.0]
  - - [256, 4096, 1, 256, 288, 288, 288, 288]
    - [14, 21338.3]
  - - [256, 4096, 1, 512, 288, 288, 544, 544]
    - [14, 27927.2]
  - - [256, 4096, 1, 1024, 288, 288, 1056, 1056]
    - [14, 33082.0]
  - - [256, 4096, 1, 2048, 288, 288, 2080, 2080]
    - [25, 34610.6]
  - - [256, 4096, 1, 4096, 288, 288, 4128, 4128]
    - [35, 34967.4]
  - - [384, 64, 1, 64, 416, 416, 96, 96]
    - [14, 272.689]
  - - [384, 64, 1, 128, 416, 416, 160, 160]
    - [14, 481.221]
  - - [384, 64, 1, 256, 416, 416, 288, 288]
    - [14, 850.772]
  - - [384, 64, 1, 512, 416, 416, 544, 544]
    - [2, 1233.5]
  - - [384, 64, 1, 1024, 416, 416, 1056, 1056]
    - [0, 1625.38]
  - - [384, 64, 1, 2048, 416, 416, 2080, 2080]
    - [8, 1955.69]
  - - [384, 64, 1, 4096, 416, 416, 4128, 4128]
    - [14, 2147.85]
  - - [384, 128, 1, 64, 416, 416, 96, 96]
    - [20, 563.852]
  - - [384, 128, 1, 128, 416, 416, 160, 160]
    - [15, 1030.38]
  - - [384, 128, 1, 256, 416, 416, 288, 288]
    - [2, 1694.9]
  - - [384, 128, 1, 512, 416, 416, 544, 544]
    - [25, 2533.3]
  - - [384, 128, 1, 1024, 416, 416, 1056, 1056]
    - [31, 3404.47]
  - - [384, 128, 1, 2048, 416, 416, 2080, 2080]
    - [2, 4058.52]
  - - [384, 128, 1, 4096, 416, 416, 4128, 4128]
    - [2, 4466.19]
  - - [384, 256, 1, 64, 416, 416, 96, 96]
    - [9, 1224.02]
  - - [384, 256, 1, 128, 416, 416, 160, 160]
    - [26, 2170.23]
  - - [384, 256, 1, 256, 416, 416, 288, 288]
    - [8, 3576.74]
  - - [384, 256, 1, 512, 416, 416, 544, 544]
    - [0, 5238.51]
  - - [384, 256, 1, 1024, 416, 416, 1056, 1056]
    - [2, 6888.61]
  - - [384, 256, 1, 2048, 416, 416, 2080, 2080]
    - [14, 8029.63]
  - - [384, 256, 1, 4096, 416, 416, 4128, 4128]
    - [8, 8893.91]
  - - [384, 512, 1, 64, 416, 416, 96, 96]
    - [6, 2194.44]
  - - [384, 512, 1, 128, 416, 416, 160, 160]
    - [3, 3955.03]
  - - [384, 512, 1, 256, 416, 416, 288, 288]
    - [0, 6587.07]
  - - [384, 512, 1, 512, 416, 416, 544, 544]
    - [25, 9898.06]
  - - [384, 512, 1, 1024, 416, 416, 1056, 1056]
    - [12, 13166.3]
  - - [384, 512, 1, 2048, 416, 416, 2080, 2080]
    - [14, 15893.8]
  - - [384, 512, 1, 4096, 416, 416, 4128, 4128]
    - [8, 17697.1]
  - - [384, 1024, 1, 64, 416, 416, 96, 96]
    - [9, 3731.59]
  - - [384, 1024, 1, 128, 416, 416, 160, 160]
    - [8, 6594.82]
  - - [384, 1024, 1, 256, 416, 416, 288, 288]
    - [14, 10668.0]
  - - [384, 1024, 1, 512, 416, 416, 544, 544]
    - [0, 15673.5]
  - - [384, 1024, 1, 1024, 416, 416, 1056, 1056]
    - [21, 20627.8]
  - - [384, 1024, 1, 2048, 416, 416, 2080, 2080]
    - [16, 24685.3]
  - - [384, 1024, 1, 4096, 416, 416, 4128, 4128]
    - [21, 25930.4]
  - - [384, 2048, 1, 64, 416, 416, 96, 96]
    - [15, 6765.92]
  - - [384, 2048, 1, 128, 416, 416, 160, 160]
    - [20, 12091.7]
  - - [384, 2048, 1, 256, 416, 416, 288, 288]
    - [24, 18677.7]
  - - [384, 2048, 1, 512, 416, 416, 544, 544]
    - [2, 24898.2]
  - - [384, 2048, 1, 1024, 416, 416, 1056, 1056]
    - [25, 29818.4]
  - - [384, 2048, 1, 2048, 416, 416, 2080, 2080]
    - [25, 31668.8]
  - - [384, 2048, 1, 4096, 416, 416, 4128, 4128]
    - [33, 33968.5]
  - - [384, 4096, 1, 64, 416, 416, 96, 96]
    - [36, 10665.7]
  - - [384, 4096, 1, 128, 416, 416, 160, 160]
    - [26, 16547.0]
  - - [384, 4096, 1, 256, 416, 416, 288, 288]
    - [24, 22545.0]
  - - [384, 4096, 1, 512, 416, 416, 544, 544]
    - [23, 28061.4]
  - - [384, 4096, 1, 1024, 416, 416, 1056, 1056]
    - [14, 30385.5]
  - - [384, 4096, 1, 2048, 416, 416, 2080, 2080]
    - [2, 32994.6]
  - - [384, 4096, 1, 4096, 416, 416, 4128, 4128]
    - [25, 32801.1]
  - - [768, 64, 1, 64, 800, 800, 96, 96]
    - [14, 536.814]
  - - [768, 64, 1, 128, 800, 800, 160, 160]
    - [14, 984.428]
  - - [768, 64, 1, 256, 800, 800, 288, 288]
    - [14, 1675.93]
  - - [768, 64, 1, 512, 800, 800, 544, 544]
    - [17, 2488.46]
  - - [768, 64, 1, 1024, 800, 800, 1056, 1056]
    - [33, 3245.11]
  - - [768, 64, 1, 2048, 800, 800, 2080, 2080]
    - [33, 3920.83]
  - - [768, 64, 1, 4096, 800, 800, 4128, 4128]
    - [14, 4339.41]
  - - [768, 128, 1, 64, 800, 800, 96, 96]
    - [1, 1183.28]
  - - [768, 128, 1, 128, 800, 800, 160, 160]
    - [26, 2059.4]
  - - [768, 128, 1, 256, 800, 800, 288, 288]
    - [25, 3388.88]
  - - [768, 128, 1, 512, 800, 800, 544, 544]
    - [2, 5063.55]
  - - [768, 128, 1, 1024, 800, 800, 1056, 1056]
    - [14, 6704.19]
  - - [768, 128, 1, 2048, 800, 800, 2080, 2080]
    - [2, 7986.31]
  - - [768, 128, 1, 4096, 800, 800, 4128, 4128]
    - [2, 8856.15]
  - - [768, 256, 1, 64, 800, 800, 96, 96]
    - [11, 2193.29]
  - - [768, 256, 1, 128, 800, 800, 160, 160]
    - [3, 3941.4]
  - - [768, 256, 1, 256, 800, 800, 288, 288]
    - [0, 6520.51]
  - - [768, 256, 1, 512, 800, 800, 544, 544]
    - [14, 9854.46]
  - - [768, 256, 1, 1024, 800, 800, 1056, 1056]
    - [14, 13130.3]
  - - [768, 256, 1, 2048, 800, 800, 2080, 2080]
    - [14, 15814.5]
  - - [768, 256, 1, 4096, 800, 800, 4128, 4128]
    - [2, 17650.2]
  - - [768, 512, 1, 64, 800, 800, 96, 96]
    - [24, 3741.57]
  - - [768, 512, 1, 128, 800, 800, 160, 160]
    - [12, 6590.5]
  - - [768, 512, 1, 256, 800, 800, 288, 288]
    - [25, 10966.7]
  - - [768, 512, 1, 512, 800, 800, 544, 544]
    - [8, 16063.7]
  - - [768, 512, 1, 1024, 800, 800, 1056, 1056]
    - [10, 20924.7]
  - - [768, 512, 1, 2048, 800, 800, 2080, 2080]
    - [10, 24520.6]
  - - [768, 512, 1, 4096, 800, 800, 4128, 4128]
    - [24, 26012.5]
  - - [768, 1024, 1, 64, 800, 800, 96, 96]
    - [18, 6115.63]
  - - [768, 1024, 1, 128, 800, 800, 160, 160]
    - [18, 11615.9]
  - - [768, 1024, 1, 256, 800, 800, 288, 288]
    - [13, 17879.8]
  - - [768, 1024, 1, 512, 800, 800, 544, 544]
    - [25, 24815.3]
  - - [768, 1024, 1, 1024, 800, 800, 1056, 1056]
    - [25, 28872.4]
  - - [768, 1024, 1, 2048, 800, 800, 2080, 2080]
    - [33, 31021.1]
  - - [768, 1024, 1, 4096, 800, 800, 4128, 4128]
    - [33, 33823.3]
  - - [768, 2048, 1, 64, 800, 800, 96, 96]
    - [24, 11593.2]
  - - [768, 2048, 1, 128, 800, 800, 160, 160]
    - [34, 17838.7]
  - - [768, 2048, 1, 256, 800, 800, 288, 288]
    - [26, 24790.9]
  - - [768, 2048, 1, 512, 800, 800, 544, 544]
    - [2, 30657.3]
  - - [768, 2048, 1, 1024, 800, 800, 1056, 1056]
    - [25, 33062.7]
  - - [768, 2048, 1, 2048, 800, 800, 2080, 2080]
    - [25, 35924.4]
  - - [768, 2048, 1, 4096, 800, 800, 4128, 4128]
    - [33, 37545.9]
  - - [768, 4096, 1, 64, 800, 800, 96, 96]
    - [15, 15421.4]
  - - [768, 4096, 1, 128, 800, 800, 160, 160]
    - [13, 22172.6]
  - - [768, 4096, 1, 256, 800, 800, 288, 288]
    - [26, 28660.7]
  - - [768, 4096, 1, 512, 800, 800, 544, 544]
    - [2, 32062.2]
  - - [768, 4096, 1, 1024, 800, 800, 1056, 1056]
    - [33, 35550.9]
  - - [768, 4096, 1, 2048, 800, 800, 2080, 2080]
    - [33, 37830.3]
  - - [768, 4096, 1, 4096, 800, 800, 4128, 4128]
    - [33, 37068.2]
  - - [1536, 64, 1, 64, 1568, 1568, 96, 96]
    - [8, 1066.17]
  - - [1536, 64, 1, 128, 1568, 1568, 160, 160]
    - [19, 1967.31]
  - - [1536, 64, 1, 256, 1568, 1568, 288, 288]
    - [19, 3327.94]
  - - [1536, 64, 1, 512, 1568, 1568, 544, 544]
    - [2, 5014.61]
  - - [1536, 64, 1, 1024, 1568, 1568, 1056, 1056]
    - [25, 6433.81]
  - - [1536, 64, 1, 2048, 1568, 1568, 2080, 2080]
    - [2, 7917.83]
  - - [1536, 64, 1, 4096, 1568, 1568, 4128, 4128]
    - [17, 8640.82]
  - - [1536, 128, 1, 64, 1568, 1568, 96, 96]
    - [20, 2230.22]
  - - [1536, 128, 1, 128, 1568, 1568, 160, 160]
    - [34, 4043.35]
  - - [1536, 128, 1, 256, 1568, 1568, 288, 288]
    - [14, 6688.59]
  - - [1536, 128, 1, 512, 1568, 1568, 544, 544]
    - [12, 10009.3]
  - - [1536, 128, 1, 1024, 1568, 1568, 1056, 1056]
    - [14, 13293.3]
  - - [1536, 128, 1, 2048, 1568, 1568, 2080, 2080]
    - [14, 16121.6]
  - - [1536, 128, 1, 4096, 1568, 1568, 4128, 4128]
    - [2, 17756.8]
  - - [1536, 256, 1, 64, 1568, 1568, 96, 96]
    - [32, 3849.77]
  - - [1536, 256, 1, 128, 1568, 1568, 160, 160]
    - [25, 6796.06]
  - - [1536, 256, 1, 256, 1568, 1568, 288, 288]
    - [29, 10933.3]
  - - [1536, 256, 1, 512, 1568, 1568, 544, 544]
    - [16, 16056.1]
  - - [1536, 256, 1, 1024, 1568, 1568, 1056, 1056]
    - [29, 20863.9]
  - - [1536, 256, 1, 2048, 1568, 1568, 2080, 2080]
    - [5, 24714.8]
  - - [1536, 256, 1, 4096, 1568, 1568, 4128, 4128]
    - [5, 25907.0]
  - - [1536, 512, 1, 64, 1568, 1568, 96, 96]
    - [18, 5968.43]
  - - [1536, 512, 1, 128, 1568, 1568, 160, 160]
    - [34, 11440.3]
  - - [1536, 512, 1, 256, 1568, 1568, 288, 288]
    - [24, 17580.1]
  - - [1536, 512, 1, 512, 1568, 1568, 544, 544]
    - [18, 24077.8]
  - - [1536, 512, 1, 1024, 1568, 1568, 1056, 1056]
    - [25, 28836.2]
  - - [1536, 512, 1, 2048, 1568, 1568, 2080, 2080]
    - [25, 30972.8]
  - - [1536, 512, 1, 4096, 1568, 1568, 4128, 4128]
    - [2, 33604.2]
  - - [1536, 1024, 1, 64, 1568, 1568, 96, 96]
    - [26, 11567.9]
  - - [1536, 1024, 1, 128, 1568, 1568, 160, 160]
    - [26, 17898.9]
  - - [1536, 1024, 1, 256, 1568, 1568, 288, 288]
    - [26, 24498.3]
  - - [1536, 1024, 1, 512, 1568, 1568, 544, 544]
    - [25, 30336.3]
  - - [1536, 1024, 1, 1024, 1568, 1568, 1056, 1056]
    - [25, 32934.2]
  - - [1536, 1024, 1, 2048, 1568, 1568, 2080, 2080]
    - [25, 35982.9]
  - - [1536, 1024, 1, 4096, 1568, 1568, 4128, 4128]
    - [25, 37712.9]
  - - [1536, 2048, 1, 64, 1568, 1568, 96, 96]
    - [24, 15650.4]
  - - [1536, 2048, 1, 128, 1568, 1568, 160, 160]
    - [1, 22274.3]
  - - [1536, 2048, 1, 256, 1568, 1568, 288, 288]
    - [34, 28297.1]
  - - [1536, 2048, 1, 512, 1568, 1568, 544, 544]
    - [23, 31688.2]
  - - [1536, 2048, 1, 1024, 1568, 1568, 1056, 1056]
    - [33, 35575.6]
  - - [1536, 2048, 1, 2048, 1568, 1568, 2080, 2080]
    - [25, 37895.5]
  - - [1536, 2048, 1, 4096, 1568, 1568, 4128, 4128]
    - [19, 37782.0]
  - - [1536, 4096, 1, 64, 1568, 1568, 96, 96]
    - [32, 18261.7]
  - - [1536, 4096, 1, 128, 1568, 1568, 160, 160]
    - [34, 25219.4]
  - - [1536, 4096, 1, 256, 1568, 1568, 288, 288]
    - [34, 29638.0]
  - - [1536, 4096, 1, 512, 1568, 1568, 544, 544]
    - [25, 34177.5]
  - - [1536, 4096, 1, 1024, 1568, 1568, 1056, 1056]
    - [33, 37186.6]
  - - [1536, 4096, 1, 2048, 1568, 1568, 2080, 2080]
    - [33, 38147.5]
  - - [1536, 4096, 1, 4096, 1568, 1568, 4128, 4128]
    - [19, 38089.6]
  - - [3072, 64, 1, 64, 3104, 3104, 96, 96]
    - [27, 1989.71]
  - - [3072, 64, 1, 128, 3104, 3104, 160, 160]
    - [2, 3580.29]
  - - [3072, 64, 1, 256, 3104, 3104, 288, 288]
    - [0, 5465.5]
  - - [3072, 64, 1, 512, 3104, 3104, 544, 544]
    - [16, 7550.5]
  - - [3072, 64, 1, 1024, 3104, 3104, 1056, 1056]
    - [29, 10205.1]
  - - [3072, 64, 1, 2048, 3104, 3104, 2080, 2080]
    - [21, 12080.8]
  - - [3072, 64, 1, 4096, 3104, 3104, 4128, 4128]
    - [29, 12805.6]
  - - [3072, 128, 1, 64, 3104, 3104, 96, 96]
    - [28, 3579.27]
  - - [3072, 128, 1, 128, 3104, 3104, 160, 160]
    - [5, 6428.87]
  - - [3072, 128, 1, 256, 3104, 3104, 288, 288]
    - [16, 10488.0]
  - - [3072, 128, 1, 512, 3104, 3104, 544, 544]
    - [35, 15480.7]
  - - [3072, 128, 1, 1024, 3104, 3104, 1056, 1056]
    - [29, 20956.3]
  - - [3072, 128, 1, 2048, 3104, 3104, 2080, 2080]
    - [16, 24824.5]
  - - [3072, 128, 1, 4096, 3104, 3104, 4128, 4128]
    - [35, 26187.6]
  - - [3072, 256, 1, 64, 3104, 3104, 96, 96]
    - [13, 6271.09]
  - - [3072, 256, 1, 128, 3104, 3104, 160, 160]
    - [26, 11432.5]
  - - [3072, 256, 1, 256, 3104, 3104, 288, 288]
    - [18, 17802.4]
  - - [3072, 256, 1, 512, 3104, 3104, 544, 544]
    - [25, 22446.9]
  - - [3072, 256, 1, 1024, 3104, 3104, 1056, 1056]
    - [24, 26876.7]
  - - [3072, 256, 1, 2048, 3104, 3104, 2080, 2080]
    - [24, 28742.0]
  - - [3072, 256, 1, 4096, 3104, 3104, 4128, 4128]
    - [13, 30332.9]
  - - [3072, 512, 1, 64, 3104, 3104, 96, 96]
    - [13, 11508.4]
  - - [3072, 512, 1, 128, 3104, 3104, 160, 160]
    - [26, 17822.9]
  - - [3072, 512, 1, 256, 3104, 3104, 288, 288]
    - [34, 24313.4]
  - - [3072, 512, 1, 512, 3104, 3104, 544, 544]
    - [29, 30206.6]
  - - [3072, 512, 1, 1024, 3104, 3104, 1056, 1056]
    - [16, 32411.9]
  - - [3072, 512, 1, 2048, 3104, 3104, 2080, 2080]
    - [14, 35082.0]
  - - [3072, 512, 1, 4096, 3104, 3104, 4128, 4128]
    - [1, 36208.8]
  - - [3072, 1024, 1, 64, 3104, 3104, 96, 96]
    - [26, 15303.1]
  - - [3072, 1024, 1, 128, 3104, 3104, 160, 160]
    - [26, 22145.7]
  - - [3072, 1024, 1, 256, 3104, 3104, 288, 288]
    - [34, 28056.6]
  - - [3072, 1024, 1, 512, 3104, 3104, 544, 544]
    - [25, 31658.9]
  - - [3072, 1024, 1, 1024, 3104, 3104, 1056, 1056]
    - [33, 35095.0]
  - - [3072, 1024, 1, 2048, 3104, 3104, 2080, 2080]
    - [33, 37139.4]
  - - [3072, 1024, 1, 4096, 3104, 3104, 4128, 4128]
    - [2, 36528.9]
  - - [3072, 2048, 1, 64, 3104, 3104, 96, 96]
    - [26, 18370.1]
  - - [3072, 2048, 1, 128, 3104, 3104, 160, 160]
    - [34, 25143.8]
  - - [3072, 2048, 1, 256, 3104, 3104, 288, 288]
    - [26, 29435.9]
  - - [3072, 2048, 1, 512, 3104, 3104, 544, 544]
    - [25, 33958.4]
  - - [3072, 2048, 1, 1024, 3104, 3104, 1056, 1056]
    - [33, 36889.1]
  - - [3072, 2048, 1, 2048, 3104, 3104, 2080, 2080]
    - [33, 37955.9]
  - - [3072, 2048, 1, 4096, 3104, 3104, 4128, 4128]
    - [0, 36818.5]
  - - [3072, 4096, 1, 64, 3104, 3104, 96, 96]
    - [24, 19499.9]
  - - [3072, 4096, 1, 128, 3104, 3104, 160, 160]
    - [26, 26247.8]
  - - [3072, 4096, 1, 256, 3104, 3104, 288, 288]
    - [34, 31503.5]
  - - [3072, 4096, 1, 512, 3104, 3104, 544, 544]
    - [33, 35406.7]
  - - [3072, 4096, 1, 1024, 3104, 3104, 1056, 1056]
    - [33, 37185.2]
  - - [3072, 4096, 1, 2048, 3104, 3104, 2080, 2080]
    - [33, 38019.2]
  - - [3072, 4096, 1, 4096, 3104, 3104, 4128, 4128]
    - [2, 37061.7]
  - - [4096, 64, 1, 64, 4128, 4128, 96, 96]
    - [4, 2542.4]
  - - [4096, 64, 1, 128, 4128, 4128, 160, 160]
    - [29, 4318.47]
  - - [4096, 64, 1, 256, 4128, 4128, 288, 288]
    - [29, 7062.62]
  - - [4096, 64, 1, 512, 4128, 4128, 544, 544]
    - [21, 10302.3]
  - - [4096, 64, 1, 1024, 4128, 4128, 1056, 1056]
    - [14, 13399.7]
  - - [4096, 64, 1, 2048, 4128, 4128, 2080, 2080]
    - [21, 15871.1]
  - - [4096, 64, 1, 4096, 4128, 4128, 4128, 4128]
    - [21, 16690.9]
  - - [4096, 128, 1, 64, 4128, 4128, 96, 96]
    - [9, 5849.8]
  - - [4096, 128, 1, 128, 4128, 4128, 160, 160]
    - [25, 10163.4]
  - - [4096, 128, 1, 256, 4128, 4128, 288, 288]
    - [16, 16085.5]
  - - [4096, 128, 1, 512, 4128, 4128, 544, 544]
    - [25, 22880.6]
  - - [4096, 128, 1, 1024, 4128, 4128, 1056, 1056]
    - [16, 28819.1]
  - - [4096, 128, 1, 2048, 4128, 4128, 2080, 2080]
    - [5, 32859.3]
  - - [4096, 128, 1, 4096, 4128, 4128, 4128, 4128]
    - [10, 33157.1]
  - - [4096, 256, 1, 64, 4128, 4128, 96, 96]
    - [26, 9037.04]
  - - [4096, 256, 1, 128, 4128, 4128, 160, 160]
    - [26, 14737.9]
  - - [4096, 256, 1, 256, 4128, 4128, 288, 288]
    - [14, 21304.5]
  - - [4096, 256, 1, 512, 4128, 4128, 544, 544]
    - [25, 27288.4]
  - - [4096, 256, 1, 1024, 4128, 4128, 1056, 1056]
    - [25, 31908.2]
  - - [4096, 256, 1, 2048, 4128, 4128, 2080, 2080]
    - [16, 33568.6]
  - - [4096, 256, 1, 4096, 4128, 4128, 4128, 4128]
    - [21, 34921.6]
  - - [4096, 512, 1, 64, 4128, 4128, 96, 96]
    - [18, 13443.3]
  - - [4096, 512, 1, 128, 4128, 4128, 160, 160]
    - [34, 20121.1]
  - - [4096, 512, 1, 256, 4128, 4128, 288, 288]
    - [20, 25915.8]
  - - [4096, 512, 1, 512, 4128, 4128, 544, 544]
    - [33, 30881.3]
  - - [4096, 512, 1, 1024, 4128, 4128, 1056, 1056]
    - [33, 33258.8]
  - - [4096, 512, 1, 2048, 4128, 4128, 2080, 2080]
    - [25, 35831.5]
  - - [4096, 512, 1, 4096, 4128, 4128, 4128, 4128]
    - [16, 36485.9]
  - - [4096, 1024, 1, 64, 4128, 4128, 96, 96]
    - [34, 16655.5]
  - - [4096, 1024, 1, 128, 4128, 4128, 160, 160]
    - [26, 23495.5]
  - - [4096, 1024, 1, 256, 4128, 4128, 288, 288]
    - [32, 29021.7]
  - - [4096, 1024, 1, 512, 4128, 4128, 544, 544]
    - [25, 32596.0]
  - - [4096, 1024, 1, 1024, 4128, 4128, 1056, 1056]
    - [33, 35983.6]
  - - [4096, 1024, 1, 2048, 4128, 4128, 2080, 2080]
    - [33, 37809.4]
  - - [4096, 1024, 1, 4096, 4128, 4128, 4128, 4128]
    - [29, 36173.4]
  - - [4096, 2048, 1, 64, 4128, 4128, 96, 96]
    - [32, 19307.1]
  - - [4096, 2048, 1, 128, 4128, 4128, 160, 160]
    - [14, 24275.3]
  - - [4096, 2048, 1, 256, 4128, 4128, 288, 288]
    - [26, 30362.6]
  - - [4096, 2048, 1, 512, 4128, 4128, 544, 544]
    - [33, 34695.6]
  - - [4096, 2048, 1, 1024, 4128, 4128, 1056, 1056]
    - [33, 37399.8]
  - - [4096, 2048, 1, 2048, 4128, 4128, 2080, 2080]
    - [19, 38019.9]
  - - [4096, 2048, 1, 4096, 4128, 4128, 4128, 4128]
    - [29, 36454.0]
  - - [4096, 4096, 1, 64, 4128, 4128, 96, 96]
    - [30, 18500.7]
  - - [4096, 4096, 1, 128, 4128, 4128, 160, 160]
    - [13, 24188.6]
  - - [4096, 4096, 1, 256, 4128, 4128, 288, 288]
    - [14, 30466.2]
  - - [4096, 4096, 1, 512, 4128, 4128, 544, 544]
    - [25, 35442.2]
  - - [4096, 4096, 1, 1024, 4128, 4128, 1056, 1056]
    - [25, 37396.6]
  - - [4096, 4096, 1, 2048, 4128, 4128, 2080, 2080]
    - [14, 38168.5]
  - - [4096, 4096, 1, 4096, 4128, 4128, 4128, 4128]
    - [29, 36101.8]
- null
- null
- DeviceEfficiency
