library/src/blas3/Tensile/Logic/asm_full/navi33/navi33_Cijk_Alik_Bjlk_HB.yaml
- {MinimumRequiredVersion: 4.35.0}
- navi33
- gfx1102
- [Device 73f0]
    SolutionIndex: 0
    SolutionNameMin: Cijk_Alik_Bjlk_HB_MT128x128x16_MI16x16x16x1_SN_1LDSB0_GRVW4_PLR0_SIA1_SU0_SUS0_SVW4_VW4_WGM4
    SolutionIndex: 1
    SolutionNameMin: Cijk_Alik_Bjlk_HB_MT128x128x16_MI16x16x16x1_SN_1LDSB0_GRVW8_PLR0_SIA1_SU0_SUS0_SVW2_VW2_WGM4
    SolutionIndex: 2
    SolutionNameMin: Cijk_Alik_Bjlk_HB_MT128x128x16_MI16x16x16x1_SN_1LDSB0_GRVW8_PLR0_SIA1_SU0_SUS0_SVW4_VW4_WGM4
    SolutionIndex: 3
    SolutionNameMin: Cijk_Alik_Bjlk_HB_MT128x128x16_MI16x16x16x1_SN_1LDSB0_GRVW4_PLR1_SIA1_SU0_SUS0_SVW2_VW2_WGM4
    SolutionIndex: 4
    SolutionNameMin: Cijk_Alik_Bjlk_HB_MT128x128x16_MI16x16x16x1_SN_1LDSB0_GRVW4_PLR1_SIA1_SU0_SUS0_SVW4_VW4_WGM4
    SolutionIndex: 5
    SolutionNameMin: Cijk_Alik_Bjlk_HB_MT128x128x16_MI16x16x16x1_SN_1LDSB0_GRVW8_PLR1_SIA1_SU0_SUS0_SVW2_VW2_WGM4
    SolutionIndex: 6
    SolutionNameMin: Cijk_Alik_Bjlk_HB_MT128x128x16_MI16x16x16x1_SN_1LDSB0_GRVW8_PLR1_SIA1_SU0_SUS0_SVW4_VW4_WGM4
    SolutionIndex: 7
    SolutionNameMin: Cijk_Alik_Bjlk_HB_MT128x128x16_MI16x16x16x1_SN_1LDSB1_GRVW4_PLR1_SIA2_SU0_SUS0_SVW2_VW2_WGM4
    SolutionIndex: 8
    SolutionNameMin: Cijk_Alik_Bjlk_HB_MT128x128x16_MI16x16x16x1_SN_1LDSB1_GRVW4_PLR1_SIA2_SU0_SUS0_SVW4_VW4_WGM4
    SolutionIndex: 9
    SolutionNameMin: Cijk_Alik_Bjlk_HB_MT128x128x16_MI16x16x16x1_SN_1LDSB1_GRVW8_PLR1_SIA2_SU0_SUS0_SVW2_VW2_WGM4
    SolutionIndex: 10
    SolutionNameMin: Cijk_Alik_Bjlk_HB_MT128x128x16_MI16x16x16x1_SN_1LDSB1_GRVW8_PLR1_SIA2_SU0_SUS0_SVW4_VW4_WGM4
    SolutionIndex: 11
    SolutionNameMin: Cijk_Alik_Bjlk_HB_MT128x128x16_MI16x16x16x1_SN_1LDSB0_GRVW8_PLR0_SIA3_SU0_SUS0_SVW2_VW2_WGM4
    SolutionIndex: 12
    SolutionNameMin: Cijk_Alik_Bjlk_HB_MT128x128x16_MI16x16x16x1_SN_1LDSB0_GRVW8_PLR0_SIA3_SU0_SUS0_SVW4_VW4_WGM4
    SolutionIndex: 13
    SolutionNameMin: Cijk_Alik_Bjlk_HB_MT128x128x16_MI16x16x16x1_SN_1LDSB0_GRVW8_PLR1_SIA3_SU0_SUS0_SVW4_VW4_WGM4
    SolutionIndex: 14
    SolutionNameMin: Cijk_Alik_Bjlk_HB_MT128x128x16_MI16x16x16x1_SN_1LDSB0_GRVW4_PLR0_SIA1_SU32_SUS256_SVW2_VW2_WGM4
    SolutionIndex: 15
    SolutionNameMin: Cijk_Alik_Bjlk_HB_MT128x128x16_MI16x16x16x1_SN_1LDSB0_GRVW8_PLR0_SIA1_SU32_SUS256_SVW4_VW4_WGM4
    SolutionIndex: 16
    SolutionNameMin: Cijk_Alik_Bjlk_HB_MT128x128x16_MI16x16x16x1_SN_1LDSB0_GRVW8_PLR1_SIA1_SU32_SUS256_SVW4_VW4_WGM4
    SolutionIndex: 17
    SolutionNameMin: Cijk_Alik_Bjlk_HB_MT128x128x16_MI16x16x16x1_SN_1LDSB1_GRVW4_PLR1_SIA2_SU32_SUS256_SVW2_VW2_WGM4
    SolutionIndex: 18
    SolutionNameMin: Cijk_Alik_Bjlk_HB_MT128x128x16_MI16x16x16x1_SN_1LDSB1_GRVW4_PLR1_SIA2_SU32_SUS256_SVW4_VW4_WGM4
    SolutionIndex: 19
    SolutionNameMin: Cijk_Alik_Bjlk_HB_MT128x128x16_MI16x16x16x1_SN_1LDSB1_GRVW8_PLR1_SIA2_SU32_SUS256_SVW2_VW2_WGM4
    SolutionIndex: 20
    SolutionNameMin: Cijk_Alik_Bjlk_HB_MT128x128x16_MI16x16x16x1_SN_1LDSB1_GRVW8_PLR1_SIA2_SU32_SUS256_SVW4_VW4_WGM4
    SolutionIndex: 21
    SolutionNameMin: Cijk_Alik_Bjlk_HB_MT128x128x16_MI16x16x16x1_SN_1LDSB0_GRVW4_PLR0_SIA1_SU0_SUS0_SVW4_VW4_WGM8
    SolutionIndex: 22
    SolutionNameMin: Cijk_Alik_Bjlk_HB_MT128x128x16_MI16x16x16x1_SN_1LDSB0_GRVW8_PLR0_SIA1_SU0_SUS0_SVW4_VW4_WGM8
    SolutionIndex: 23
    SolutionNameMin: Cijk_Alik_Bjlk_HB_MT128x128x16_MI16x16x16x1_SN_1LDSB0_GRVW4_PLR1_SIA1_SU0_SUS0_SVW4_VW4_WGM8
    SolutionIndex: 24
    SolutionNameMin: Cijk_Alik_Bjlk_HB_MT128x128x16_MI16x16x16x1_SN_1LDSB0_GRVW8_PLR1_SIA1_SU0_SUS0_SVW2_VW2_WGM8
    SolutionIndex: 25
    SolutionNameMin: Cijk_Alik_Bjlk_HB_MT128x128x16_MI16x16x16x1_SN_1LDSB0_GRVW8_PLR1_SIA1_SU0_SUS0_SVW4_VW4_WGM8
    SolutionIndex: 26
    SolutionNameMin: Cijk_Alik_Bjlk_HB_MT128x128x16_MI16x16x16x1_SN_1LDSB1_GRVW4_PLR1_SIA2_SU0_SUS0_SVW4_VW4_WGM8
    SolutionIndex: 27
    SolutionNameMin: Cijk_Alik_Bjlk_HB_MT128x128x16_MI16x16x16x1_SN_1LDSB1_GRVW8_PLR1_SIA2_SU0_SUS0_SVW2_VW2_WGM8
    SolutionIndex: 28
    SolutionNameMin: Cijk_Alik_Bjlk_HB_MT128x128x16_MI16x16x16x1_SN_1LDSB1_GRVW8_PLR1_SIA2_SU0_SUS0_SVW4_VW4_WGM8
    SolutionIndex: 29
    SolutionNameMin: Cijk_Alik_Bjlk_HB_MT128x128x16_MI16x16x16x1_SN_1LDSB0_GRVW8_PLR0_SIA3_SU0_SUS0_SVW2_VW2_WGM8
    SolutionIndex: 30
    SolutionNameMin: Cijk_Alik_Bjlk_HB_MT128x128x16_MI16x16x16x1_SN_1LDSB0_GRVW8_PLR0_SIA3_SU0_SUS0_SVW4_VW4_WGM8
    SolutionIndex: 31
    SolutionNameMin: Cijk_Alik_Bjlk_HB_MT128x128x16_MI16x16x16x1_SN_1LDSB0_GRVW8_PLR1_SIA3_SU0_SUS0_SVW2_VW2_WGM8
    SolutionIndex: 32
    SolutionNameMin: Cijk_Alik_Bjlk_HB_MT128x128x16_MI16x16x16x1_SN_1LDSB0_GRVW8_PLR1_SIA3_SU0_SUS0_SVW4_VW4_WGM8
    SolutionIndex: 33
    SolutionNameMin: Cijk_Alik_Bjlk_HB_MT128x128x16_MI16x16x16x1_SN_1LDSB0_GRVW4_PLR0_SIA1_SU32_SUS256_SVW4_VW4_WGM8
    SolutionIndex: 34
    SolutionNameMin: Cijk_Alik_Bjlk_HB_MT128x128x16_MI16x16x16x1_SN_1LDSB0_GRVW8_PLR0_SIA1_SU32_SUS256_SVW4_VW4_WGM8
    SolutionIndex: 35
    SolutionNameMin: Cijk_Alik_Bjlk_HB_MT128x128x16_MI16x16x16x1_SN_1LDSB0_GRVW4_PLR1_SIA1_SU32_SUS256_SVW4_VW4_WGM8
    SolutionIndex: 36
    SolutionNameMin: Cijk_Alik_Bjlk_HB_MT128x128x16_MI16x16x16x1_SN_1LDSB0_GRVW8_PLR1_SIA1_SU32_SUS256_SVW2_VW2_WGM8
    SolutionIndex: 37
    SolutionNameMin: Cijk_Alik_Bjlk_HB_MT128x128x16_MI16x16x16x1_SN_1LDSB0_GRVW8_PLR1_SIA1_SU32_SUS256_SVW4_VW4_WGM8
    SolutionIndex: 38
    SolutionNameMin: Cijk_Alik_Bjlk_HB_MT128x128x16_MI16x16x16x1_SN_1LDSB1_GRVW4_PLR1_SIA2_SU32_SUS256_SVW2_VW2_WGM8
    SolutionIndex: 39
    SolutionNameMin: Cijk_Alik_Bjlk_HB_MT128x128x16_MI16x16x16x1_SN_1LDSB1_GRVW4_PLR1_SIA2_SU32_SUS256_SVW4_VW4_WGM8
    SolutionIndex: 40
    SolutionNameMin: Cijk_Alik_Bjlk_HB_MT128x128x16_MI16x16x16x1_SN_1LDSB1_GRVW8_PLR1_SIA2_SU32_SUS256_SVW2_VW2_WGM8
    SolutionIndex: 41
    SolutionNameMin: Cijk_Alik_Bjlk_HB_MT128x128x16_MI16x16x16x1_SN_1LDSB1_GRVW8_PLR1_SIA2_SU32_SUS256_SVW4_VW4_WGM8
    SolutionIndex: 42
    SolutionNameMin: Cijk_Alik_Bjlk_HB_MT128x128x16_MI16x16x16x1_SN_1LDSB0_GRVW8_PLR0_SIA3_SU32_SUS256_SVW2_VW2_WGM8
    SolutionIndex: 43
    SolutionNameMin: Cijk_Alik_Bjlk_HB_MT128x128x16_MI16x16x16x1_SN_1LDSB0_GRVW8_PLR0_SIA3_SU32_SUS256_SVW4_VW4_WGM8
    SolutionIndex: 44
    SolutionNameMin: Cijk_Alik_Bjlk_HB_MT128x128x16_MI16x16x16x1_SN_1LDSB0_GRVW8_PLR1_SIA3_SU32_SUS256_SVW2_VW2_WGM8
    SolutionIndex: 45
    SolutionNameMin: Cijk_Alik_Bjlk_HB_MT128x128x16_MI16x16x16x1_SN_1LDSB0_GRVW8_PLR1_SIA3_SU32_SUS256_SVW4_VW4_WGM8
    SolutionIndex: 46
    SolutionNameMin: Cijk_Alik_Bjlk_HB_MT128x128x32_MI16x16x16x1_SN_1LDSB0_GRVW4_PLR0_SIA1_SU0_SUS0_SVW2_VW2_WGM4
    SolutionIndex: 47
    SolutionNameMin: Cijk_Alik_Bjlk_HB_MT128x128x32_MI16x16x16x1_SN_1LDSB0_GRVW8_PLR0_SIA1_SU0_SUS0_SVW2_VW2_WGM4
    SolutionIndex: 48
    SolutionNameMin: Cijk_Alik_Bjlk_HB_MT128x128x32_MI16x16x16x1_SN_1LDSB0_GRVW8_PLR0_SIA3_SU0_SUS0_SVW2_VW2_WGM4
    SolutionIndex: 49
    SolutionNameMin: Cijk_Alik_Bjlk_HB_MT128x128x32_MI16x16x16x1_SN_1LDSB0_GRVW4_PLR0_SIA1_SU32_SUS256_SVW2_VW2_WGM4
    SolutionIndex: 50
    SolutionNameMin: Cijk_Alik_Bjlk_HB_MT128x128x32_MI16x16x16x1_SN_1LDSB0_GRVW8_PLR0_SIA1_SU32_SUS256_SVW2_VW2_WGM4
    SolutionIndex: 51
    SolutionNameMin: Cijk_Alik_Bjlk_HB_MT128x128x32_MI16x16x16x1_SN_1LDSB0_GRVW8_PLR0_SIA3_SU32_SUS256_SVW2_VW2_WGM4
    SolutionIndex: 52
    SolutionNameMin: Cijk_Alik_Bjlk_HB_MT128x128x32_MI16x16x16x1_SN_1LDSB0_GRVW4_PLR0_SIA1_SU0_SUS0_SVW2_VW2_WGM8
    SolutionIndex: 53
    SolutionNameMin: Cijk_Alik_Bjlk_HB_MT128x128x32_MI16x16x16x1_SN_1LDSB0_GRVW8_PLR0_SIA1_SU0_SUS0_SVW2_VW2_WGM8
    SolutionIndex: 54
    SolutionNameMin: Cijk_Alik_Bjlk_HB_MT128x128x32_MI16x16x16x1_SN_1LDSB0_GRVW4_PLR0_SIA1_SU32_SUS256_SVW2_VW2_WGM8
    SolutionIndex: 55
    SolutionNameMin: Cijk_Alik_Bjlk_HB_MT128x128x32_MI16x16x16x1_SN_1LDSB0_GRVW8_PLR0_SIA1_SU32_SUS256_SVW2_VW2_WGM8
    SolutionIndex: 56
    SolutionNameMin: Cijk_Alik_Bjlk_HB_MT128x128x32_MI16x16x16x1_SN_1LDSB0_GRVW8_PLR0_SIA1_SU32_SUS256_SVW4_VW4_WGM8
    SolutionIndex: 57
    SolutionNameMin: Cijk_Alik_Bjlk_HB_MT128x128x32_MI16x16x16x1_SN_1LDSB0_GRVW8_PLR0_SIA3_SU32_SUS256_SVW2_VW2_WGM8
- - - [64, 64, 1, 64, 96, 96, 96, 96]
    - [2, 36.6584]
  - - [64, 64, 1, 128, 96, 96, 160, 160]
    - [15, 66.2482]
  - - [64, 64, 1, 256, 96, 96, 288, 288]
    - [10, 105.216]
  - - [64, 64, 1, 512, 96, 96, 544, 544]
    - [47, 166.441]
  - - [64, 64, 1, 1024, 96, 96, 1056, 1056]
    - [47, 231.129]
  - - [64, 64, 1, 2048, 96, 96, 2080, 2080]
    - [47, 288.994]
  - - [64, 64, 1, 4096, 96, 96, 4128, 4128]
    - [53, 320.819]
  - - [64, 128, 1, 64, 96, 96, 96, 128]
    - [12, 64.6632]
  - - [64, 128, 1, 128, 96, 96, 160, 160]
    - [28, 118.644]
  - - [64, 128, 1, 256, 96, 96, 288, 288]
    - [53, 203.726]
  - - [64, 128, 1, 512, 96, 96, 544, 544]
    - [47, 323.485]
  - - [64, 128, 1, 1024, 96, 96, 1056, 1056]
    - [47, 461.979]
  - - [64, 128, 1, 2048, 96, 96, 2080, 2080]
    - [47, 577.549]
  - - [64, 128, 1, 4096, 96, 96, 4128, 4128]
    - [47, 646.098]
  - - [64, 256, 1, 64, 96, 96, 96, 256]
    - [41, 147.065]
  - - [64, 256, 1, 128, 96, 96, 160, 256]
    - [28, 268.041]
  - - [64, 256, 1, 256, 96, 96, 288, 288]
    - [20, 452.655]
  - - [64, 256, 1, 512, 96, 96, 544, 544]
    - [53, 708.497]
  - - [64, 256, 1, 1024, 96, 96, 1056, 1056]
    - [47, 981.124]
  - - [64, 256, 1, 2048, 96, 96, 2080, 2080]
    - [47, 1204.74]
  - - [64, 256, 1, 4096, 96, 96, 4128, 4128]
    - [53, 1312.13]
  - - [64, 512, 1, 64, 96, 96, 96, 512]
    - [19, 317.318]
  - - [64, 512, 1, 128, 96, 96, 160, 512]
    - [47, 574.326]
  - - [64, 512, 1, 256, 96, 96, 288, 512]
    - [47, 966.875]
  - - [64, 512, 1, 512, 96, 96, 544, 544]
    - [53, 1487.87]
  - - [64, 512, 1, 1024, 96, 96, 1056, 1056]
    - [53, 2018.92]
  - - [64, 512, 1, 2048, 96, 96, 2080, 2080]
    - [47, 2505.66]
  - - [64, 512, 1, 4096, 96, 96, 4128, 4128]
    - [52, 2672.86]
  - - [64, 1024, 1, 64, 96, 96, 96, 1024]
    - [40, 655.975]
  - - [64, 1024, 1, 128, 96, 96, 160, 1024]
    - [55, 1184.0]
  - - [64, 1024, 1, 256, 96, 96, 288, 1024]
    - [55, 1997.77]
  - - [64, 1024, 1, 512, 96, 96, 544, 1024]
    - [53, 3070.23]
  - - [64, 1024, 1, 1024, 96, 96, 1056, 1056]
    - [53, 4166.19]
  - - [64, 1024, 1, 2048, 96, 96, 2080, 2080]
    - [46, 5088.44]
  - - [64, 1024, 1, 4096, 96, 96, 4128, 4128]
    - [49, 5478.84]
  - - [64, 2048, 1, 64, 96, 96, 96, 2048]
    - [38, 1391.61]
  - - [64, 2048, 1, 128, 96, 96, 160, 2048]
    - [17, 2498.1]
  - - [64, 2048, 1, 256, 96, 96, 288, 2048]
    - [55, 4133.34]
  - - [64, 2048, 1, 512, 96, 96, 544, 2048]
    - [53, 6256.67]
  - - [64, 2048, 1, 1024, 96, 96, 1056, 2048]
    - [46, 8287.1]
  - - [64, 2048, 1, 2048, 96, 96, 2080, 2080]
    - [53, 10379.9]
  - - [64, 2048, 1, 4096, 96, 96, 4128, 4128]
    - [54, 10796.2]
  - - [64, 4096, 1, 64, 96, 96, 96, 4096]
    - [7, 2505.18]
  - - [64, 4096, 1, 128, 96, 96, 160, 4096]
    - [17, 4460.26]
  - - [64, 4096, 1, 256, 96, 96, 288, 4096]
    - [38, 7472.32]
  - - [64, 4096, 1, 512, 96, 96, 544, 4096]
    - [27, 11140.2]
  - - [64, 4096, 1, 1024, 96, 96, 1056, 4096]
    - [27, 15017.4]
  - - [64, 4096, 1, 2048, 96, 96, 2080, 4096]
    - [9, 18041.2]
  - - [64, 4096, 1, 4096, 96, 96, 4128, 4128]
    - [53, 14841.4]
  - - [128, 64, 1, 64, 160, 160, 96, 96]
    - [28, 73.44]
  - - [128, 64, 1, 128, 160, 160, 160, 160]
    - [15, 134.969]
  - - [128, 64, 1, 256, 160, 160, 288, 288]
    - [10, 204.58]
  - - [128, 64, 1, 512, 160, 160, 544, 544]
    - [28, 320.031]
  - - [128, 64, 1, 1024, 160, 160, 1056, 1056]
    - [47, 449.913]
  - - [128, 64, 1, 2048, 160, 160, 2080, 2080]
    - [47, 565.651]
  - - [128, 64, 1, 4096, 160, 160, 4128, 4128]
    - [47, 627.139]
  - - [128, 128, 1, 64, 160, 160, 96, 128]
    - [45, 173.605]
  - - [128, 128, 1, 128, 160, 160, 160, 160]
    - [10, 323.535]
  - - [128, 128, 1, 256, 160, 160, 288, 288]
    - [10, 531.867]
  - - [128, 128, 1, 512, 160, 160, 544, 544]
    - [10, 782.228]
  - - [128, 128, 1, 1024, 160, 160, 1056, 1056]
    - [55, 1023.06]
  - - [128, 128, 1, 2048, 160, 160, 2080, 2080]
    - [47, 1219.1]
  - - [128, 128, 1, 4096, 160, 160, 4128, 4128]
    - [53, 1300.54]
  - - [128, 256, 1, 64, 160, 160, 96, 256]
    - [10, 367.728]
  - - [128, 256, 1, 128, 160, 160, 160, 256]
    - [10, 654.133]
  - - [128, 256, 1, 256, 160, 160, 288, 288]
    - [8, 1063.87]
  - - [128, 256, 1, 512, 160, 160, 544, 544]
    - [53, 1571.05]
  - - [128, 256, 1, 1024, 160, 160, 1056, 1056]
    - [47, 2075.75]
  - - [128, 256, 1, 2048, 160, 160, 2080, 2080]
    - [50, 2502.85]
  - - [128, 256, 1, 4096, 160, 160, 4128, 4128]
    - [50, 2630.79]
  - - [128, 512, 1, 64, 160, 160, 96, 512]
    - [28, 799.524]
  - - [128, 512, 1, 128, 160, 160, 160, 512]
    - [28, 1398.11]
  - - [128, 512, 1, 256, 160, 160, 288, 512]
    - [41, 2267.51]
  - - [128, 512, 1, 512, 160, 160, 544, 544]
    - [47, 3304.57]
  - - [128, 512, 1, 1024, 160, 160, 1056, 1056]
    - [53, 4283.19]
  - - [128, 512, 1, 2048, 160, 160, 2080, 2080]
    - [55, 4984.32]
  - - [128, 512, 1, 4096, 160, 160, 4128, 4128]
    - [55, 5312.82]
  - - [128, 1024, 1, 64, 160, 160, 96, 1024]
    - [41, 1612.26]
  - - [128, 1024, 1, 128, 160, 160, 160, 1024]
    - [28, 2817.33]
  - - [128, 1024, 1, 256, 160, 160, 288, 1024]
    - [28, 4377.62]
  - - [128, 1024, 1, 512, 160, 160, 544, 1024]
    - [47, 6467.09]
  - - [128, 1024, 1, 1024, 160, 160, 1056, 1056]
    - [55, 8650.85]
  - - [128, 1024, 1, 2048, 160, 160, 2080, 2080]
    - [50, 10209.4]
  - - [128, 1024, 1, 4096, 160, 160, 4128, 4128]
    - [55, 10739.8]
  - - [128, 2048, 1, 64, 160, 160, 96, 2048]
    - [10, 2976.79]
  - - [128, 2048, 1, 128, 160, 160, 160, 2048]
    - [26, 5254.37]
  - - [128, 2048, 1, 256, 160, 160, 288, 2048]
    - [28, 8608.14]
  - - [128, 2048, 1, 512, 160, 160, 544, 2048]
    - [55, 12586.1]
  - - [128, 2048, 1, 1024, 160, 160, 1056, 2048]
    - [50, 16523.2]
  - - [128, 2048, 1, 2048, 160, 160, 2080, 2080]
    - [53, 20043.7]
  - - [128, 2048, 1, 4096, 160, 160, 4128, 4128]
    - [54, 20504.6]
  - - [128, 4096, 1, 64, 160, 160, 96, 4096]
    - [20, 4916.4]
  - - [128, 4096, 1, 128, 160, 160, 160, 4096]
    - [41, 9095.84]
  - - [128, 4096, 1, 256, 160, 160, 288, 4096]
    - [28, 15075.6]
  - - [128, 4096, 1, 512, 160, 160, 544, 4096]
    - [41, 22510.4]
  - - [128, 4096, 1, 1024, 160, 160, 1056, 4096]
    - [28, 30695.9]
  - - [128, 4096, 1, 2048, 160, 160, 2080, 4096]
    - [9, 36539.3]
  - - [128, 4096, 1, 4096, 160, 160, 4128, 4128]
    - [28, 32997.1]
  - - [256, 64, 1, 64, 288, 288, 96, 96]
    - [20, 170.5]
  - - [256, 64, 1, 128, 288, 288, 160, 160]
    - [9, 311.427]
  - - [256, 64, 1, 256, 288, 288, 288, 288]
    - [10, 493.623]
  - - [256, 64, 1, 512, 288, 288, 544, 544]
    - [47, 717.895]
  - - [256, 64, 1, 1024, 288, 288, 1056, 1056]
    - [47, 977.867]
  - - [256, 64, 1, 2048, 288, 288, 2080, 2080]
    - [54, 1172.13]
  - - [256, 64, 1, 4096, 288, 288, 4128, 4128]
    - [55, 1279.22]
  - - [256, 128, 1, 64, 288, 288, 96, 128]
    - [28, 379.988]
  - - [256, 128, 1, 128, 288, 288, 160, 160]
    - [10, 684.229]
  - - [256, 128, 1, 256, 288, 288, 288, 288]
    - [10, 1111.66]
  - - [256, 128, 1, 512, 288, 288, 544, 544]
    - [10, 1621.93]
  - - [256, 128, 1, 1024, 288, 288, 1056, 1056]
    - [53, 2105.84]
  - - [256, 128, 1, 2048, 288, 288, 2080, 2080]
    - [53, 2496.43]
  - - [256, 128, 1, 4096, 288, 288, 4128, 4128]
    - [50, 2621.85]
  - - [256, 256, 1, 64, 288, 288, 96, 256]
    - [32, 754.643]
  - - [256, 256, 1, 128, 288, 288, 160, 256]
    - [28, 1333.44]
  - - [256, 256, 1, 256, 288, 288, 288, 288]
    - [53, 2253.49]
  - - [256, 256, 1, 512, 288, 288, 544, 544]
    - [55, 3297.43]
  - - [256, 256, 1, 1024, 288, 288, 1056, 1056]
    - [50, 4272.82]
  - - [256, 256, 1, 2048, 288, 288, 2080, 2080]
    - [47, 5041.8]
  - - [256, 256, 1, 4096, 288, 288, 4128, 4128]
    - [47, 5292.29]
  - - [256, 512, 1, 64, 288, 288, 96, 512]
    - [26, 1523.26]
  - - [256, 512, 1, 128, 288, 288, 160, 512]
    - [8, 2693.4]
  - - [256, 512, 1, 256, 288, 288, 288, 512]
    - [28, 4398.86]
  - - [256, 512, 1, 512, 288, 288, 544, 544]
    - [47, 6423.75]
  - - [256, 512, 1, 1024, 288, 288, 1056, 1056]
    - [53, 8414.39]
  - - [256, 512, 1, 2048, 288, 288, 2080, 2080]
    - [53, 9963.46]
  - - [256, 512, 1, 4096, 288, 288, 4128, 4128]
    - [55, 10609.7]
  - - [256, 1024, 1, 64, 288, 288, 96, 1024]
    - [20, 2974.16]
  - - [256, 1024, 1, 128, 288, 288, 160, 1024]
    - [10, 5281.67]
  - - [256, 1024, 1, 256, 288, 288, 288, 1024]
    - [10, 8563.08]
  - - [256, 1024, 1, 512, 288, 288, 544, 1024]
    - [47, 12304.5]
  - - [256, 1024, 1, 1024, 288, 288, 1056, 1056]
    - [47, 16288.6]
  - - [256, 1024, 1, 2048, 288, 288, 2080, 2080]
    - [53, 19631.1]
  - - [256, 1024, 1, 4096, 288, 288, 4128, 4128]
    - [54, 20980.1]
  - - [256, 2048, 1, 64, 288, 288, 96, 2048]
    - [15, 4992.48]
  - - [256, 2048, 1, 128, 288, 288, 160, 2048]
    - [12, 8894.51]
  - - [256, 2048, 1, 256, 288, 288, 288, 2048]
    - [15, 14519.5]
  - - [256, 2048, 1, 512, 288, 288, 544, 2048]
    - [12, 21004.4]
  - - [256, 2048, 1, 1024, 288, 288, 1056, 2048]
    - [13, 27105.2]
  - - [256, 2048, 1, 2048, 288, 288, 2080, 2080]
    - [39, 34704.0]
  - - [256, 2048, 1, 4096, 288, 288, 4128, 4128]
    - [7, 37233.6]
  - - [256, 4096, 1, 64, 288, 288, 96, 4096]
    - [34, 9151.66]
  - - [256, 4096, 1, 128, 288, 288, 160, 4096]
    - [22, 15080.6]
  - - [256, 4096, 1, 256, 288, 288, 288, 4096]
    - [22, 23705.0]
  - - [256, 4096, 1, 512, 288, 288, 544, 4096]
    - [2, 30326.6]
  - - [256, 4096, 1, 1024, 288, 288, 1056, 4096]
    - [0, 34929.8]
  - - [256, 4096, 1, 2048, 288, 288, 2080, 4096]
    - [2, 36372.8]
  - - [256, 4096, 1, 4096, 288, 288, 4128, 4128]
    - [42, 36913.0]
  - - [384, 64, 1, 64, 416, 416, 96, 96]
    - [25, 250.377]
  - - [384, 64, 1, 128, 416, 416, 160, 160]
    - [7, 453.603]
  - - [384, 64, 1, 256, 416, 416, 288, 288]
    - [4, 746.76]
  - - [384, 64, 1, 512, 416, 416, 544, 544]
    - [47, 1100.39]
  - - [384, 64, 1, 1024, 416, 416, 1056, 1056]
    - [53, 1488.22]
  - - [384, 64, 1, 2048, 416, 416, 2080, 2080]
    - [53, 1797.37]
  - - [384, 64, 1, 4096, 416, 416, 4128, 4128]
    - [47, 1925.06]
  - - [384, 128, 1, 64, 416, 416, 96, 128]
    - [26, 544.998]
  - - [384, 128, 1, 128, 416, 416, 160, 160]
    - [10, 992.66]
  - - [384, 128, 1, 256, 416, 416, 288, 288]
    - [28, 1618.38]
  - - [384, 128, 1, 512, 416, 416, 544, 544]
    - [53, 2448.04]
  - - [384, 128, 1, 1024, 416, 416, 1056, 1056]
    - [55, 3157.97]
  - - [384, 128, 1, 2048, 416, 416, 2080, 2080]
    - [47, 3737.13]
  - - [384, 128, 1, 4096, 416, 416, 4128, 4128]
    - [50, 3965.47]
  - - [384, 256, 1, 64, 416, 416, 96, 256]
    - [20, 1203.19]
  - - [384, 256, 1, 128, 416, 416, 160, 256]
    - [10, 2120.83]
  - - [384, 256, 1, 256, 416, 416, 288, 288]
    - [10, 3282.79]
  - - [384, 256, 1, 512, 416, 416, 544, 544]
    - [53, 4840.06]
  - - [384, 256, 1, 1024, 416, 416, 1056, 1056]
    - [53, 6297.75]
  - - [384, 256, 1, 2048, 416, 416, 2080, 2080]
    - [50, 7403.08]
  - - [384, 256, 1, 4096, 416, 416, 4128, 4128]
    - [55, 7934.69]
  - - [384, 512, 1, 64, 416, 416, 96, 512]
    - [41, 2306.25]
  - - [384, 512, 1, 128, 416, 416, 160, 512]
    - [20, 4076.76]
  - - [384, 512, 1, 256, 416, 416, 288, 512]
    - [41, 6625.2]
  - - [384, 512, 1, 512, 416, 416, 544, 544]
    - [53, 9664.32]
  - - [384, 512, 1, 1024, 416, 416, 1056, 1056]
    - [53, 12355.9]
  - - [384, 512, 1, 2048, 416, 416, 2080, 2080]
    - [50, 14727.6]
  - - [384, 512, 1, 4096, 416, 416, 4128, 4128]
    - [50, 15674.8]
  - - [384, 1024, 1, 64, 416, 416, 96, 1024]
    - [34, 3781.49]
  - - [384, 1024, 1, 128, 416, 416, 160, 1024]
    - [34, 6701.06]
  - - [384, 1024, 1, 256, 416, 416, 288, 1024]
    - [39, 11046.2]
  - - [384, 1024, 1, 512, 416, 416, 544, 1024]
    - [41, 17203.0]
  - - [384, 1024, 1, 1024, 416, 416, 1056, 1056]
    - [40, 22367.2]
  - - [384, 1024, 1, 2048, 416, 416, 2080, 2080]
    - [39, 26115.0]
  - - [384, 1024, 1, 4096, 416, 416, 4128, 4128]
    - [39, 28500.4]
  - - [384, 2048, 1, 64, 416, 416, 96, 2048]
    - [34, 6486.04]
  - - [384, 2048, 1, 128, 416, 416, 160, 2048]
    - [56, 11157.5]
  - - [384, 2048, 1, 256, 416, 416, 288, 2048]
    - [22, 18842.0]
  - - [384, 2048, 1, 512, 416, 416, 544, 2048]
    - [43, 26955.0]
  - - [384, 2048, 1, 1024, 416, 416, 1056, 2048]
    - [13, 32923.4]
  - - [384, 2048, 1, 2048, 416, 416, 2080, 2080]
    - [11, 35412.1]
  - - [384, 2048, 1, 4096, 416, 416, 4128, 4128]
    - [30, 38037.8]
  - - [384, 4096, 1, 64, 416, 416, 96, 4096]
    - [23, 12973.7]
  - - [384, 4096, 1, 128, 416, 416, 160, 4096]
    - [25, 20040.5]
  - - [384, 4096, 1, 256, 416, 416, 288, 4096]
    - [2, 27114.7]
  - - [384, 4096, 1, 512, 416, 416, 544, 4096]
    - [22, 32410.6]
  - - [384, 4096, 1, 1024, 416, 416, 1056, 4096]
    - [21, 34530.7]
  - - [384, 4096, 1, 2048, 416, 416, 2080, 4096]
    - [25, 37698.6]
  - - [384, 4096, 1, 4096, 416, 416, 4128, 4128]
    - [1, 37848.7]
  - - [768, 64, 1, 64, 800, 800, 96, 96]
    - [1, 518.071]
  - - [768, 64, 1, 128, 800, 800, 160, 160]
    - [9, 947.937]
  - - [768, 64, 1, 256, 800, 800, 288, 288]
    - [27, 1453.33]
  - - [768, 64, 1, 512, 800, 800, 544, 544]
    - [53, 2206.95]
  - - [768, 64, 1, 1024, 800, 800, 1056, 1056]
    - [53, 2972.93]
  - - [768, 64, 1, 2048, 800, 800, 2080, 2080]
    - [53, 3626.99]
  - - [768, 64, 1, 4096, 800, 800, 4128, 4128]
    - [46, 3875.54]
  - - [768, 128, 1, 64, 800, 800, 96, 128]
    - [20, 1111.37]
  - - [768, 128, 1, 128, 800, 800, 160, 160]
    - [10, 2008.13]
  - - [768, 128, 1, 256, 800, 800, 288, 288]
    - [20, 3269.56]
  - - [768, 128, 1, 512, 800, 800, 544, 544]
    - [53, 4787.11]
  - - [768, 128, 1, 1024, 800, 800, 1056, 1056]
    - [50, 6266.0]
  - - [768, 128, 1, 2048, 800, 800, 2080, 2080]
    - [47, 7419.72]
  - - [768, 128, 1, 4096, 800, 800, 4128, 4128]
    - [50, 7903.38]
  - - [768, 256, 1, 64, 800, 800, 96, 256]
    - [10, 2287.4]
  - - [768, 256, 1, 128, 800, 800, 160, 256]
    - [28, 4036.87]
  - - [768, 256, 1, 256, 800, 800, 288, 288]
    - [8, 6519.66]
  - - [768, 256, 1, 512, 800, 800, 544, 544]
    - [47, 9379.75]
  - - [768, 256, 1, 1024, 800, 800, 1056, 1056]
    - [47, 12341.5]
  - - [768, 256, 1, 2048, 800, 800, 2080, 2080]
    - [53, 14587.3]
  - - [768, 256, 1, 4096, 800, 800, 4128, 4128]
    - [55, 15924.6]
  - - [768, 512, 1, 64, 800, 800, 96, 512]
    - [26, 3966.89]
  - - [768, 512, 1, 128, 800, 800, 160, 512]
    - [16, 7002.18]
  - - [768, 512, 1, 256, 800, 800, 288, 512]
    - [16, 11369.2]
  - - [768, 512, 1, 512, 800, 800, 544, 544]
    - [41, 16722.9]
  - - [768, 512, 1, 1024, 800, 800, 1056, 1056]
    - [18, 21521.9]
  - - [768, 512, 1, 2048, 800, 800, 2080, 2080]
    - [41, 26239.2]
  - - [768, 512, 1, 4096, 800, 800, 4128, 4128]
    - [40, 28634.7]
  - - [768, 1024, 1, 64, 800, 800, 96, 1024]
    - [45, 6681.49]
  - - [768, 1024, 1, 128, 800, 800, 160, 1024]
    - [24, 11541.3]
  - - [768, 1024, 1, 256, 800, 800, 288, 1024]
    - [34, 19459.4]
  - - [768, 1024, 1, 512, 800, 800, 544, 1024]
    - [30, 26103.9]
  - - [768, 1024, 1, 1024, 800, 800, 1056, 1056]
    - [45, 32141.6]
  - - [768, 1024, 1, 2048, 800, 800, 2080, 2080]
    - [13, 34545.5]
  - - [768, 1024, 1, 4096, 800, 800, 4128, 4128]
    - [32, 37948.6]
  - - [768, 2048, 1, 64, 800, 800, 96, 2048]
    - [16, 13085.1]
  - - [768, 2048, 1, 128, 800, 800, 160, 2048]
    - [6, 19831.2]
  - - [768, 2048, 1, 256, 800, 800, 288, 2048]
    - [25, 27256.1]
  - - [768, 2048, 1, 512, 800, 800, 544, 2048]
    - [25, 33344.6]
  - - [768, 2048, 1, 1024, 800, 800, 1056, 2048]
    - [34, 35708.1]
  - - [768, 2048, 1, 2048, 800, 800, 2080, 2080]
    - [0, 38321.0]
  - - [768, 2048, 1, 4096, 800, 800, 4128, 4128]
    - [2, 39535.7]
  - - [768, 4096, 1, 64, 800, 800, 96, 4096]
    - [30, 17710.0]
  - - [768, 4096, 1, 128, 800, 800, 160, 4096]
    - [23, 25159.5]
  - - [768, 4096, 1, 256, 800, 800, 288, 4096]
    - [22, 32405.4]
  - - [768, 4096, 1, 512, 800, 800, 544, 4096]
    - [6, 35575.6]
  - - [768, 4096, 1, 1024, 800, 800, 1056, 4096]
    - [2, 39104.9]
  - - [768, 4096, 1, 2048, 800, 800, 2080, 4096]
    - [6, 41104.4]
  - - [768, 4096, 1, 4096, 800, 800, 4128, 4128]
    - [25, 41108.6]
  - - [1536, 64, 1, 64, 1568, 1568, 96, 96]
    - [1, 1037.85]
  - - [1536, 64, 1, 128, 1568, 1568, 160, 160]
    - [3, 1794.48]
  - - [1536, 64, 1, 256, 1568, 1568, 288, 288]
    - [47, 2883.35]
  - - [1536, 64, 1, 512, 1568, 1568, 544, 544]
    - [53, 4409.26]
  - - [1536, 64, 1, 1024, 1568, 1568, 1056, 1056]
    - [53, 5905.4]
  - - [1536, 64, 1, 2048, 1568, 1568, 2080, 2080]
    - [55, 7219.89]
  - - [1536, 64, 1, 4096, 1568, 1568, 4128, 4128]
    - [53, 7926.88]
  - - [1536, 128, 1, 64, 1568, 1568, 96, 128]
    - [1, 2154.98]
  - - [1536, 128, 1, 128, 1568, 1568, 160, 160]
    - [10, 3805.51]
  - - [1536, 128, 1, 256, 1568, 1568, 288, 288]
    - [10, 6264.83]
  - - [1536, 128, 1, 512, 1568, 1568, 544, 544]
    - [53, 9255.57]
  - - [1536, 128, 1, 1024, 1568, 1568, 1056, 1056]
    - [47, 12215.0]
  - - [1536, 128, 1, 2048, 1568, 1568, 2080, 2080]
    - [46, 14717.9]
  - - [1536, 128, 1, 4096, 1568, 1568, 4128, 4128]
    - [47, 16145.2]
  - - [1536, 256, 1, 64, 1568, 1568, 96, 256]
    - [41, 3954.4]
  - - [1536, 256, 1, 128, 1568, 1568, 160, 256]
    - [20, 7055.18]
  - - [1536, 256, 1, 256, 1568, 1568, 288, 288]
    - [26, 11583.8]
  - - [1536, 256, 1, 512, 1568, 1568, 544, 544]
    - [9, 17219.2]
  - - [1536, 256, 1, 1024, 1568, 1568, 1056, 1056]
    - [10, 22442.0]
  - - [1536, 256, 1, 2048, 1568, 1568, 2080, 2080]
    - [8, 26709.1]
  - - [1536, 256, 1, 4096, 1568, 1568, 4128, 4128]
    - [41, 27642.9]
  - - [1536, 512, 1, 64, 1568, 1568, 96, 512]
    - [6, 6768.65]
  - - [1536, 512, 1, 128, 1568, 1568, 160, 512]
    - [32, 11558.5]
  - - [1536, 512, 1, 256, 1568, 1568, 288, 512]
    - [35, 19234.4]
  - - [1536, 512, 1, 512, 1568, 1568, 544, 544]
    - [12, 25982.7]
  - - [1536, 512, 1, 1024, 1568, 1568, 1056, 1056]
    - [12, 32229.0]
  - - [1536, 512, 1, 2048, 1568, 1568, 2080, 2080]
    - [29, 34549.2]
  - - [1536, 512, 1, 4096, 1568, 1568, 4128, 4128]
    - [32, 38137.3]
  - - [1536, 1024, 1, 64, 1568, 1568, 96, 1024]
    - [34, 12700.4]
  - - [1536, 1024, 1, 128, 1568, 1568, 160, 1024]
    - [25, 19892.0]
  - - [1536, 1024, 1, 256, 1568, 1568, 288, 1024]
    - [25, 27507.4]
  - - [1536, 1024, 1, 512, 1568, 1568, 544, 1024]
    - [22, 33418.0]
  - - [1536, 1024, 1, 1024, 1568, 1568, 1056, 1056]
    - [37, 35893.5]
  - - [1536, 1024, 1, 2048, 1568, 1568, 2080, 2080]
    - [5, 38562.8]
  - - [1536, 1024, 1, 4096, 1568, 1568, 4128, 4128]
    - [2, 40237.7]
  - - [1536, 2048, 1, 64, 1568, 1568, 96, 2048]
    - [32, 18191.6]
  - - [1536, 2048, 1, 128, 1568, 1568, 160, 2048]
    - [22, 25969.3]
  - - [1536, 2048, 1, 256, 1568, 1568, 288, 2048]
    - [25, 32777.4]
  - - [1536, 2048, 1, 512, 1568, 1568, 544, 2048]
    - [22, 35404.3]
  - - [1536, 2048, 1, 1024, 1568, 1568, 1056, 2048]
    - [37, 39146.7]
  - - [1536, 2048, 1, 2048, 1568, 1568, 2080, 2080]
    - [6, 41178.5]
  - - [1536, 2048, 1, 4096, 1568, 1568, 4128, 4128]
    - [2, 41193.0]
  - - [1536, 4096, 1, 64, 1568, 1568, 96, 4096]
    - [30, 22263.3]
  - - [1536, 4096, 1, 128, 1568, 1568, 160, 4096]
    - [34, 30174.9]
  - - [1536, 4096, 1, 256, 1568, 1568, 288, 4096]
    - [25, 34769.9]
  - - [1536, 4096, 1, 512, 1568, 1568, 544, 4096]
    - [25, 38601.2]
  - - [1536, 4096, 1, 1024, 1568, 1568, 1056, 4096]
    - [34, 41378.2]
  - - [1536, 4096, 1, 2048, 1568, 1568, 2080, 4096]
    - [2, 41700.9]
  - - [1536, 4096, 1, 4096, 1568, 1568, 4128, 4128]
    - [1, 42008.5]
  - - [3072, 64, 1, 64, 3104, 3104, 96, 96]
    - [9, 1972.24]
  - - [3072, 64, 1, 128, 3104, 3104, 160, 160]
    - [27, 3181.12]
  - - [3072, 64, 1, 256, 3104, 3104, 288, 288]
    - [19, 5311.49]
  - - [3072, 64, 1, 512, 3104, 3104, 544, 544]
    - [41, 7775.64]
  - - [3072, 64, 1, 1024, 3104, 3104, 1056, 1056]
    - [8, 10743.2]
  - - [3072, 64, 1, 2048, 3104, 3104, 2080, 2080]
    - [8, 12693.6]
  - - [3072, 64, 1, 4096, 3104, 3104, 4128, 4128]
    - [3, 11954.7]
  - - [3072, 128, 1, 64, 3104, 3104, 96, 128]
    - [8, 3746.03]
  - - [3072, 128, 1, 128, 3104, 3104, 160, 160]
    - [4, 6693.06]
  - - [3072, 128, 1, 256, 3104, 3104, 288, 288]
    - [10, 10504.4]
  - - [3072, 128, 1, 512, 3104, 3104, 544, 544]
    - [27, 15992.3]
  - - [3072, 128, 1, 1024, 3104, 3104, 1056, 1056]
    - [7, 21466.8]
  - - [3072, 128, 1, 2048, 3104, 3104, 2080, 2080]
    - [26, 27083.7]
  - - [3072, 128, 1, 4096, 3104, 3104, 4128, 4128]
    - [33, 22653.8]
  - - [3072, 256, 1, 64, 3104, 3104, 96, 256]
    - [15, 6472.69]
  - - [3072, 256, 1, 128, 3104, 3104, 160, 256]
    - [0, 11221.0]
  - - [3072, 256, 1, 256, 3104, 3104, 288, 288]
    - [13, 18726.4]
  - - [3072, 256, 1, 512, 3104, 3104, 544, 544]
    - [32, 25910.8]
  - - [3072, 256, 1, 1024, 3104, 3104, 1056, 1056]
    - [32, 33064.0]
  - - [3072, 256, 1, 2048, 3104, 3104, 2080, 2080]
    - [11, 35196.2]
  - - [3072, 256, 1, 4096, 3104, 3104, 4128, 4128]
    - [30, 37078.1]
  - - [3072, 512, 1, 64, 3104, 3104, 96, 512]
    - [22, 12697.2]
  - - [3072, 512, 1, 128, 3104, 3104, 160, 512]
    - [6, 19957.1]
  - - [3072, 512, 1, 256, 3104, 3104, 288, 512]
    - [2, 27432.4]
  - - [3072, 512, 1, 512, 3104, 3104, 544, 544]
    - [25, 33431.8]
  - - [3072, 512, 1, 1024, 3104, 3104, 1056, 1056]
    - [25, 35728.7]
  - - [3072, 512, 1, 2048, 3104, 3104, 2080, 2080]
    - [6, 38738.6]
  - - [3072, 512, 1, 4096, 3104, 3104, 4128, 4128]
    - [22, 38129.4]
  - - [3072, 1024, 1, 64, 3104, 3104, 96, 1024]
    - [32, 17600.0]
  - - [3072, 1024, 1, 128, 3104, 3104, 160, 1024]
    - [25, 25620.6]
  - - [3072, 1024, 1, 256, 3104, 3104, 288, 1024]
    - [22, 32972.0]
  - - [3072, 1024, 1, 512, 3104, 3104, 544, 1024]
    - [6, 35763.6]
  - - [3072, 1024, 1, 1024, 3104, 3104, 1056, 1056]
    - [34, 39213.0]
  - - [3072, 1024, 1, 2048, 3104, 3104, 2080, 2080]
    - [2, 41225.1]
  - - [3072, 1024, 1, 4096, 3104, 3104, 4128, 4128]
    - [22, 40048.3]
  - - [3072, 2048, 1, 64, 3104, 3104, 96, 2048]
    - [32, 22276.8]
  - - [3072, 2048, 1, 128, 3104, 3104, 160, 2048]
    - [15, 29866.1]
  - - [3072, 2048, 1, 256, 3104, 3104, 288, 2048]
    - [22, 34564.7]
  - - [3072, 2048, 1, 512, 3104, 3104, 544, 2048]
    - [6, 38560.5]
  - - [3072, 2048, 1, 1024, 3104, 3104, 1056, 2048]
    - [37, 41381.6]
  - - [3072, 2048, 1, 2048, 3104, 3104, 2080, 2080]
    - [6, 42072.0]
  - - [3072, 2048, 1, 4096, 3104, 3104, 4128, 4128]
    - [35, 40767.3]
  - - [3072, 4096, 1, 64, 3104, 3104, 96, 4096]
    - [32, 25918.3]
  - - [3072, 4096, 1, 128, 3104, 3104, 160, 4096]
    - [2, 31324.0]
  - - [3072, 4096, 1, 256, 3104, 3104, 288, 4096]
    - [22, 37431.8]
  - - [3072, 4096, 1, 512, 3104, 3104, 544, 4096]
    - [6, 40440.3]
  - - [3072, 4096, 1, 1024, 3104, 3104, 1056, 4096]
    - [34, 41824.2]
  - - [3072, 4096, 1, 2048, 3104, 3104, 2080, 4096]
    - [2, 42125.6]
  - - [3072, 4096, 1, 4096, 3104, 3104, 4128, 4128]
    - [36, 39694.2]
  - - [4096, 64, 1, 64, 4128, 4128, 96, 96]
    - [51, 2225.09]
  - - [4096, 64, 1, 128, 4128, 4128, 160, 160]
    - [48, 4034.46]
  - - [4096, 64, 1, 256, 4128, 4128, 288, 288]
    - [31, 6528.73]
  - - [4096, 64, 1, 512, 4128, 4128, 544, 544]
    - [14, 9786.22]
  - - [4096, 64, 1, 1024, 4128, 4128, 1056, 1056]
    - [1, 13383.6]
  - - [4096, 64, 1, 2048, 4128, 4128, 2080, 2080]
    - [1, 16551.2]
  - - [4096, 64, 1, 4096, 4128, 4128, 4128, 4128]
    - [57, 14478.9]
  - - [4096, 128, 1, 64, 4128, 4128, 96, 128]
    - [44, 5777.28]
  - - [4096, 128, 1, 128, 4128, 4128, 160, 160]
    - [34, 10209.8]
  - - [4096, 128, 1, 256, 4128, 4128, 288, 288]
    - [6, 16418.1]
  - - [4096, 128, 1, 512, 4128, 4128, 544, 544]
    - [22, 23707.1]
  - - [4096, 128, 1, 1024, 4128, 4128, 1056, 1056]
    - [22, 30505.8]
  - - [4096, 128, 1, 2048, 4128, 4128, 2080, 2080]
    - [6, 35357.7]
  - - [4096, 128, 1, 4096, 4128, 4128, 4128, 4128]
    - [57, 29006.0]
  - - [4096, 256, 1, 64, 4128, 4128, 96, 256]
    - [32, 9791.2]
  - - [4096, 256, 1, 128, 4128, 4128, 160, 256]
    - [34, 16029.8]
  - - [4096, 256, 1, 256, 4128, 4128, 288, 288]
    - [21, 23253.2]
  - - [4096, 256, 1, 512, 4128, 4128, 544, 544]
    - [21, 30055.0]
  - - [4096, 256, 1, 1024, 4128, 4128, 1056, 1056]
    - [21, 35151.7]
  - - [4096, 256, 1, 2048, 4128, 4128, 2080, 2080]
    - [23, 36970.2]
  - - [4096, 256, 1, 4096, 4128, 4128, 4128, 4128]
    - [43, 35837.1]
  - - [4096, 512, 1, 64, 4128, 4128, 96, 512]
    - [2, 15224.4]
  - - [4096, 512, 1, 128, 4128, 4128, 160, 512]
    - [15, 22812.6]
  - - [4096, 512, 1, 256, 4128, 4128, 288, 512]
    - [6, 30100.5]
  - - [4096, 512, 1, 512, 4128, 4128, 544, 544]
    - [2, 35160.9]
  - - [4096, 512, 1, 1024, 4128, 4128, 1056, 1056]
    - [2, 37283.4]
  - - [4096, 512, 1, 2048, 4128, 4128, 2080, 2080]
    - [22, 39988.6]
  - - [4096, 512, 1, 4096, 4128, 4128, 4128, 4128]
    - [45, 38778.3]
  - - [4096, 1024, 1, 64, 4128, 4128, 96, 1024]
    - [30, 20231.8]
  - - [4096, 1024, 1, 128, 4128, 4128, 160, 1024]
    - [22, 28039.5]
  - - [4096, 1024, 1, 256, 4128, 4128, 288, 1024]
    - [22, 34507.7]
  - - [4096, 1024, 1, 512, 4128, 4128, 544, 1024]
    - [22, 37051.8]
  - - [4096, 1024, 1, 1024, 4128, 4128, 1056, 1056]
    - [34, 40294.0]
  - - [4096, 1024, 1, 2048, 4128, 4128, 2080, 2080]
    - [2, 41995.2]
  - - [4096, 1024, 1, 4096, 4128, 4128, 4128, 4128]
    - [21, 40689.7]
  - - [4096, 2048, 1, 64, 4128, 4128, 96, 2048]
    - [30, 23944.0]
  - - [4096, 2048, 1, 128, 4128, 4128, 160, 2048]
    - [22, 31228.9]
  - - [4096, 2048, 1, 256, 4128, 4128, 288, 2048]
    - [25, 35623.4]
  - - [4096, 2048, 1, 512, 4128, 4128, 544, 2048]
    - [25, 39644.6]
  - - [4096, 2048, 1, 1024, 4128, 4128, 1056, 2048]
    - [34, 42000.7]
  - - [4096, 2048, 1, 2048, 4128, 4128, 2080, 2080]
    - [6, 42446.6]
  - - [4096, 2048, 1, 4096, 4128, 4128, 4128, 4128]
    - [22, 41119.4]
  - - [4096, 4096, 1, 64, 4128, 4128, 96, 4096]
    - [30, 24087.9]
  - - [4096, 4096, 1, 128, 4128, 4128, 160, 4096]
    - [32, 30360.0]
  - - [4096, 4096, 1, 256, 4128, 4128, 288, 4096]
    - [34, 34619.0]
  - - [4096, 4096, 1, 512, 4128, 4128, 544, 4096]
    - [25, 40413.4]
  - - [4096, 4096, 1, 1024, 4128, 4128, 1056, 4096]
    - [34, 42253.0]
  - - [4096, 4096, 1, 2048, 4128, 4128, 2080, 4096]
    - [6, 42182.1]
  - - [4096, 4096, 1, 4096, 4128, 4128, 4128, 4128]
    - [44, 38552.0]
- null
- null
- DeviceEfficiency
