library/src/blas3/Tensile/Logic/asm_full/navi33/navi33_Cijk_Ailk_Bjlk_BBS_BH.yaml
- {MinimumRequiredVersion: 4.35.0}
- navi33
- gfx1102
- [Device 73f0]
    SolutionIndex: 0
    SolutionNameMin: Cijk_Ailk_Bjlk_BBS_BH_MT128x128x16_MI16x16x16x1_SN_1LDSB0_AMAS3_EPS0_GRVW4_PLR0_SIA1_SVW4_VW4_WGM1
    SolutionIndex: 1
    SolutionNameMin: Cijk_Ailk_Bjlk_BBS_BH_MT128x128x16_MI16x16x16x1_SN_1LDSB0_AMAS3_EPS0_GRVW8_PLR0_SIA1_SVW4_VW4_WGM1
    SolutionIndex: 2
    SolutionNameMin: Cijk_Ailk_Bjlk_BBS_BH_MT128x128x16_MI16x16x16x1_SN_1LDSB0_AMAS3_EPS0_GRVW4_PLR1_SIA1_SVW4_VW4_WGM1
    SolutionIndex: 3
    SolutionNameMin: Cijk_Ailk_Bjlk_BBS_BH_MT128x128x16_MI16x16x16x1_SN_1LDSB0_AMAS3_EPS1_GRVW8_PLR0_SIA1_SVW4_VW4_WGM1
    SolutionIndex: 4
    SolutionNameMin: Cijk_Ailk_Bjlk_BBS_BH_MT128x128x16_MI16x16x16x1_SN_1LDSB0_AMAS3_EPS1_GRVW8_PLR1_SIA1_SVW4_VW4_WGM1
    SolutionIndex: 5
    SolutionNameMin: Cijk_Ailk_Bjlk_BBS_BH_MT128x128x16_MI16x16x16x1_SN_1LDSB1_AMAS0_EPS1_GRVW4_PLR1_SIA2_SVW1_VW1_WGM1
    SolutionIndex: 6
    SolutionNameMin: Cijk_Ailk_Bjlk_BBS_BH_MT128x128x16_MI16x16x16x1_SN_1LDSB1_AMAS3_EPS1_GRVW4_PLR1_SIA2_SVW4_VW4_WGM1
    SolutionIndex: 7
    SolutionNameMin: Cijk_Ailk_Bjlk_BBS_BH_MT128x128x16_MI16x16x16x1_SN_1LDSB1_AMAS0_EPS1_GRVW8_PLR1_SIA2_SVW1_VW1_WGM1
    SolutionIndex: 8
    SolutionNameMin: Cijk_Ailk_Bjlk_BBS_BH_MT128x128x16_MI16x16x16x1_SN_1LDSB1_AMAS3_EPS1_GRVW8_PLR1_SIA2_SVW4_VW4_WGM1
    SolutionIndex: 9
    SolutionNameMin: Cijk_Ailk_Bjlk_BBS_BH_MT128x128x16_MI16x16x16x1_SN_1LDSB0_AMAS3_EPS0_GRVW8_PLR0_SIA1_SVW4_VW4_WGM4
    SolutionIndex: 10
    SolutionNameMin: Cijk_Ailk_Bjlk_BBS_BH_MT128x128x16_MI16x16x16x1_SN_1LDSB0_AMAS3_EPS0_GRVW8_PLR1_SIA1_SVW4_VW4_WGM4
    SolutionIndex: 11
    SolutionNameMin: Cijk_Ailk_Bjlk_BBS_BH_MT128x128x16_MI16x16x16x1_SN_1LDSB0_AMAS3_EPS1_GRVW8_PLR1_SIA1_SVW4_VW4_WGM4
    SolutionIndex: 12
    SolutionNameMin: Cijk_Ailk_Bjlk_BBS_BH_MT128x128x16_MI16x16x16x1_SN_1LDSB1_AMAS0_EPS1_GRVW4_PLR1_SIA2_SVW1_VW1_WGM4
    SolutionIndex: 13
    SolutionNameMin: Cijk_Ailk_Bjlk_BBS_BH_MT128x128x16_MI16x16x16x1_SN_1LDSB1_AMAS3_EPS1_GRVW4_PLR1_SIA2_SVW4_VW4_WGM4
    SolutionIndex: 14
    SolutionNameMin: Cijk_Ailk_Bjlk_BBS_BH_MT128x128x16_MI16x16x16x1_SN_1LDSB1_AMAS0_EPS1_GRVW8_PLR1_SIA2_SVW1_VW1_WGM4
    SolutionIndex: 15
    SolutionNameMin: Cijk_Ailk_Bjlk_BBS_BH_MT128x128x16_MI16x16x16x1_SN_1LDSB1_AMAS3_EPS1_GRVW8_PLR1_SIA2_SVW4_VW4_WGM4
    SolutionIndex: 16
    SolutionNameMin: Cijk_Ailk_Bjlk_BBS_BH_MT128x128x16_MI16x16x16x1_SN_1LDSB0_AMAS3_EPS0_GRVW8_PLR0_SIA1_SVW4_VW4_WGM8
    SolutionIndex: 17
    SolutionNameMin: Cijk_Ailk_Bjlk_BBS_BH_MT128x128x16_MI16x16x16x1_SN_1LDSB0_AMAS3_EPS0_GRVW4_PLR1_SIA1_SVW4_VW4_WGM8
    SolutionIndex: 18
    SolutionNameMin: Cijk_Ailk_Bjlk_BBS_BH_MT128x128x16_MI16x16x16x1_SN_1LDSB0_AMAS3_EPS0_GRVW8_PLR1_SIA1_SVW4_VW4_WGM8
    SolutionIndex: 19
    SolutionNameMin: Cijk_Ailk_Bjlk_BBS_BH_MT128x128x16_MI16x16x16x1_SN_1LDSB0_AMAS3_EPS1_GRVW8_PLR0_SIA1_SVW4_VW4_WGM8
    SolutionIndex: 20
    SolutionNameMin: Cijk_Ailk_Bjlk_BBS_BH_MT128x128x16_MI16x16x16x1_SN_1LDSB0_AMAS3_EPS1_GRVW8_PLR1_SIA1_SVW4_VW4_WGM8
    SolutionIndex: 21
    SolutionNameMin: Cijk_Ailk_Bjlk_BBS_BH_MT128x128x16_MI16x16x16x1_SN_1LDSB1_AMAS0_EPS1_GRVW4_PLR1_SIA2_SVW1_VW1_WGM8
    SolutionIndex: 22
    SolutionNameMin: Cijk_Ailk_Bjlk_BBS_BH_MT128x128x16_MI16x16x16x1_SN_1LDSB1_AMAS3_EPS1_GRVW4_PLR1_SIA2_SVW4_VW4_WGM8
    SolutionIndex: 23
    SolutionNameMin: Cijk_Ailk_Bjlk_BBS_BH_MT128x128x16_MI16x16x16x1_SN_1LDSB1_AMAS0_EPS1_GRVW8_PLR1_SIA2_SVW1_VW1_WGM8
    SolutionIndex: 24
    SolutionNameMin: Cijk_Ailk_Bjlk_BBS_BH_MT128x128x16_MI16x16x16x1_SN_1LDSB1_AMAS3_EPS1_GRVW8_PLR1_SIA2_SVW4_VW4_WGM8
    SolutionIndex: 25
    SolutionNameMin: Cijk_Ailk_Bjlk_BBS_BH_MT128x128x16_MI16x16x16x1_SN_1LDSB0_AMAS3_EPS0_GRVW8_PLR0_SIA3_SVW4_VW4_WGM8
    SolutionIndex: 26
    SolutionNameMin: Cijk_Ailk_Bjlk_BBS_BH_MT128x128x16_MI16x16x16x1_SN_1LDSB1_AMAS3_EPS0_GRVW8_PLR0_SIA3_SVW4_VW4_WGM1
    SolutionIndex: 27
    SolutionNameMin: Cijk_Ailk_Bjlk_BBS_BH_MT128x128x16_MI16x16x16x1_SN_1LDSB1_AMAS0_EPS0_GRVW8_PLR1_SIA3_SVW1_VW1_WGM1
    SolutionIndex: 28
    SolutionNameMin: Cijk_Ailk_Bjlk_BBS_BH_MT128x128x16_MI16x16x16x1_SN_1LDSB1_AMAS3_EPS0_GRVW8_PLR1_SIA3_SVW4_VW4_WGM1
    SolutionIndex: 29
    SolutionNameMin: Cijk_Ailk_Bjlk_BBS_BH_MT128x128x16_MI16x16x16x1_SN_1LDSB1_AMAS3_EPS0_GRVW8_PLR0_SIA3_SVW4_VW4_WGM4
    SolutionIndex: 30
    SolutionNameMin: Cijk_Ailk_Bjlk_BBS_BH_MT128x128x16_MI16x16x16x1_SN_1LDSB1_AMAS3_EPS0_GRVW8_PLR1_SIA3_SVW4_VW4_WGM4
    SolutionIndex: 31
    SolutionNameMin: Cijk_Ailk_Bjlk_BBS_BH_MT128x128x16_MI16x16x16x1_SN_1LDSB1_AMAS3_EPS1_GRVW8_PLR0_SIA3_SVW4_VW4_WGM4
    SolutionIndex: 32
    SolutionNameMin: Cijk_Ailk_Bjlk_BBS_BH_MT128x128x16_MI16x16x16x1_SN_1LDSB1_AMAS3_EPS1_GRVW8_PLR1_SIA3_SVW4_VW4_WGM4
    SolutionIndex: 33
    SolutionNameMin: Cijk_Ailk_Bjlk_BBS_BH_MT128x128x16_MI16x16x16x1_SN_1LDSB1_AMAS3_EPS0_GRVW8_PLR0_SIA3_SVW4_VW4_WGM8
    SolutionIndex: 34
    SolutionNameMin: Cijk_Ailk_Bjlk_BBS_BH_MT128x128x16_MI16x16x16x1_SN_1LDSB1_AMAS3_EPS0_GRVW8_PLR1_SIA3_SVW4_VW4_WGM8
    SolutionIndex: 35
    SolutionNameMin: Cijk_Ailk_Bjlk_BBS_BH_MT128x128x16_MI16x16x16x1_SN_1LDSB1_AMAS3_EPS1_GRVW8_PLR0_SIA3_SVW4_VW4_WGM8
    SolutionIndex: 36
    SolutionNameMin: Cijk_Ailk_Bjlk_BBS_BH_MT128x128x16_MI16x16x16x1_SN_1LDSB1_AMAS3_EPS1_GRVW8_PLR1_SIA3_SVW4_VW4_WGM8
    SolutionIndex: 37
    SolutionNameMin: Cijk_Ailk_Bjlk_BBS_BH_MT128x128x32_MI16x16x16x1_SN_1LDSB0_AMAS3_EPS0_GRVW4_PLR0_SIA1_SVW4_VW4_WGM1
    SolutionIndex: 38
    SolutionNameMin: Cijk_Ailk_Bjlk_BBS_BH_MT128x128x32_MI16x16x16x1_SN_1LDSB0_AMAS0_EPS0_GRVW8_PLR0_SIA1_SVW1_VW1_WGM1
    SolutionIndex: 39
    SolutionNameMin: Cijk_Ailk_Bjlk_BBS_BH_MT128x128x32_MI16x16x16x1_SN_1LDSB0_AMAS3_EPS0_GRVW8_PLR0_SIA1_SVW4_VW4_WGM1
    SolutionIndex: 40
    SolutionNameMin: Cijk_Ailk_Bjlk_BBS_BH_MT128x128x32_MI16x16x16x1_SN_1LDSB0_AMAS3_EPS1_GRVW4_PLR0_SIA1_SVW4_VW4_WGM1
    SolutionIndex: 41
    SolutionNameMin: Cijk_Ailk_Bjlk_BBS_BH_MT128x128x32_MI16x16x16x1_SN_1LDSB0_AMAS0_EPS1_GRVW8_PLR0_SIA1_SVW1_VW1_WGM1
    SolutionIndex: 42
    SolutionNameMin: Cijk_Ailk_Bjlk_BBS_BH_MT128x128x32_MI16x16x16x1_SN_1LDSB0_AMAS3_EPS1_GRVW8_PLR0_SIA1_SVW4_VW4_WGM1
    SolutionIndex: 43
    SolutionNameMin: Cijk_Ailk_Bjlk_BBS_BH_MT128x128x32_MI16x16x16x1_SN_1LDSB0_AMAS3_EPS0_GRVW4_PLR0_SIA1_SVW4_VW4_WGM4
    SolutionIndex: 44
    SolutionNameMin: Cijk_Ailk_Bjlk_BBS_BH_MT128x128x32_MI16x16x16x1_SN_1LDSB0_AMAS0_EPS0_GRVW8_PLR0_SIA1_SVW1_VW1_WGM4
    SolutionIndex: 45
    SolutionNameMin: Cijk_Ailk_Bjlk_BBS_BH_MT128x128x32_MI16x16x16x1_SN_1LDSB0_AMAS3_EPS0_GRVW8_PLR0_SIA1_SVW4_VW4_WGM4
    SolutionIndex: 46
    SolutionNameMin: Cijk_Ailk_Bjlk_BBS_BH_MT128x128x32_MI16x16x16x1_SN_1LDSB0_AMAS3_EPS1_GRVW4_PLR0_SIA1_SVW4_VW4_WGM4
    SolutionIndex: 47
    SolutionNameMin: Cijk_Ailk_Bjlk_BBS_BH_MT128x128x32_MI16x16x16x1_SN_1LDSB0_AMAS0_EPS1_GRVW8_PLR0_SIA1_SVW1_VW1_WGM4
    SolutionIndex: 48
    SolutionNameMin: Cijk_Ailk_Bjlk_BBS_BH_MT128x128x32_MI16x16x16x1_SN_1LDSB0_AMAS3_EPS1_GRVW8_PLR0_SIA1_SVW4_VW4_WGM4
    SolutionIndex: 49
    SolutionNameMin: Cijk_Ailk_Bjlk_BBS_BH_MT128x128x32_MI16x16x16x1_SN_1LDSB0_AMAS0_EPS0_GRVW4_PLR0_SIA1_SVW1_VW1_WGM8
    SolutionIndex: 50
    SolutionNameMin: Cijk_Ailk_Bjlk_BBS_BH_MT128x128x32_MI16x16x16x1_SN_1LDSB0_AMAS3_EPS0_GRVW4_PLR0_SIA1_SVW4_VW4_WGM8
    SolutionIndex: 51
    SolutionNameMin: Cijk_Ailk_Bjlk_BBS_BH_MT128x128x32_MI16x16x16x1_SN_1LDSB0_AMAS0_EPS0_GRVW8_PLR0_SIA1_SVW1_VW1_WGM8
    SolutionIndex: 52
    SolutionNameMin: Cijk_Ailk_Bjlk_BBS_BH_MT128x128x32_MI16x16x16x1_SN_1LDSB0_AMAS3_EPS0_GRVW8_PLR0_SIA1_SVW4_VW4_WGM8
    SolutionIndex: 53
    SolutionNameMin: Cijk_Ailk_Bjlk_BBS_BH_MT128x128x32_MI16x16x16x1_SN_1LDSB0_AMAS0_EPS1_GRVW4_PLR0_SIA1_SVW1_VW1_WGM8
    SolutionIndex: 54
    SolutionNameMin: Cijk_Ailk_Bjlk_BBS_BH_MT128x128x32_MI16x16x16x1_SN_1LDSB0_AMAS3_EPS1_GRVW4_PLR0_SIA1_SVW4_VW4_WGM8
    SolutionIndex: 55
    SolutionNameMin: Cijk_Ailk_Bjlk_BBS_BH_MT128x128x32_MI16x16x16x1_SN_1LDSB0_AMAS3_EPS1_GRVW8_PLR0_SIA1_SVW4_VW4_WGM8
    SolutionIndex: 56
    SolutionNameMin: Cijk_Ailk_Bjlk_BBS_BH_MT128x128x32_MI16x16x16x1_SN_1LDSB1_AMAS3_EPS0_GRVW8_PLR0_SIA3_SVW4_VW4_WGM4
    SolutionIndex: 57
    SolutionNameMin: Cijk_Ailk_Bjlk_BBS_BH_MT128x128x32_MI16x16x16x1_SN_1LDSB1_AMAS3_EPS0_GRVW8_PLR0_SIA3_SVW4_VW4_WGM8
- - - [64, 64, 1, 64, 96, 96, 96, 96]
    - [2, 30.7249]
  - - [64, 64, 1, 128, 96, 96, 160, 160]
    - [26, 51.6133]
  - - [64, 64, 1, 256, 96, 96, 288, 288]
    - [0, 87.5345]
  - - [64, 64, 1, 512, 96, 96, 544, 544]
    - [39, 141.834]
  - - [64, 64, 1, 1024, 96, 96, 1056, 1056]
    - [39, 202.673]
  - - [64, 64, 1, 2048, 96, 96, 2080, 2080]
    - [39, 260.064]
  - - [64, 64, 1, 4096, 96, 96, 4128, 4128]
    - [42, 292.868]
  - - [64, 128, 1, 64, 96, 96, 96, 128]
    - [2, 54.3585]
  - - [64, 128, 1, 128, 96, 96, 160, 160]
    - [27, 99.4288]
  - - [64, 128, 1, 256, 96, 96, 288, 288]
    - [39, 172.975]
  - - [64, 128, 1, 512, 96, 96, 544, 544]
    - [39, 277.622]
  - - [64, 128, 1, 1024, 96, 96, 1056, 1056]
    - [51, 400.909]
  - - [64, 128, 1, 2048, 96, 96, 2080, 2080]
    - [39, 519.435]
  - - [64, 128, 1, 4096, 96, 96, 4128, 4128]
    - [41, 584.949]
  - - [64, 256, 1, 64, 96, 96, 96, 256]
    - [26, 126.107]
  - - [64, 256, 1, 128, 96, 96, 160, 256]
    - [52, 236.646]
  - - [64, 256, 1, 256, 96, 96, 288, 288]
    - [39, 407.61]
  - - [64, 256, 1, 512, 96, 96, 544, 544]
    - [39, 633.485]
  - - [64, 256, 1, 1024, 96, 96, 1056, 1056]
    - [39, 874.407]
  - - [64, 256, 1, 2048, 96, 96, 2080, 2080]
    - [45, 1087.56]
  - - [64, 256, 1, 4096, 96, 96, 4128, 4128]
    - [48, 1204.61]
  - - [64, 512, 1, 64, 96, 96, 96, 512]
    - [9, 272.145]
  - - [64, 512, 1, 128, 96, 96, 160, 512]
    - [37, 495.722]
  - - [64, 512, 1, 256, 96, 96, 288, 512]
    - [45, 844.776]
  - - [64, 512, 1, 512, 96, 96, 544, 544]
    - [39, 1307.76]
  - - [64, 512, 1, 1024, 96, 96, 1056, 1056]
    - [53, 1801.19]
  - - [64, 512, 1, 2048, 96, 96, 2080, 2080]
    - [42, 2232.65]
  - - [64, 512, 1, 4096, 96, 96, 4128, 4128]
    - [41, 2441.21]
  - - [64, 1024, 1, 64, 96, 96, 96, 1024]
    - [39, 567.718]
  - - [64, 1024, 1, 128, 96, 96, 160, 1024]
    - [43, 1078.37]
  - - [64, 1024, 1, 256, 96, 96, 288, 1024]
    - [52, 1809.06]
  - - [64, 1024, 1, 512, 96, 96, 544, 1024]
    - [40, 2774.47]
  - - [64, 1024, 1, 1024, 96, 96, 1056, 1056]
    - [39, 3752.04]
  - - [64, 1024, 1, 2048, 96, 96, 2080, 2080]
    - [43, 4494.46]
  - - [64, 1024, 1, 4096, 96, 96, 4128, 4128]
    - [48, 4962.21]
  - - [64, 2048, 1, 64, 96, 96, 96, 2048]
    - [43, 1198.37]
  - - [64, 2048, 1, 128, 96, 96, 160, 2048]
    - [39, 2173.5]
  - - [64, 2048, 1, 256, 96, 96, 288, 2048]
    - [37, 3615.39]
  - - [64, 2048, 1, 512, 96, 96, 544, 2048]
    - [52, 5323.99]
  - - [64, 2048, 1, 1024, 96, 96, 1056, 2048]
    - [52, 7465.67]
  - - [64, 2048, 1, 2048, 96, 96, 2080, 2080]
    - [44, 9106.61]
  - - [64, 2048, 1, 4096, 96, 96, 4128, 4128]
    - [40, 9173.37]
  - - [64, 4096, 1, 64, 96, 96, 96, 4096]
    - [5, 2062.6]
  - - [64, 4096, 1, 128, 96, 96, 160, 4096]
    - [22, 3754.97]
  - - [64, 4096, 1, 256, 96, 96, 288, 4096]
    - [24, 6284.81]
  - - [64, 4096, 1, 512, 96, 96, 544, 4096]
    - [7, 9496.76]
  - - [64, 4096, 1, 1024, 96, 96, 1056, 4096]
    - [5, 13129.0]
  - - [64, 4096, 1, 2048, 96, 96, 2080, 4096]
    - [23, 15629.4]
  - - [64, 4096, 1, 4096, 96, 96, 4128, 4128]
    - [24, 16788.0]
  - - [128, 64, 1, 64, 160, 160, 128, 96]
    - [2, 62.2892]
  - - [128, 64, 1, 128, 160, 160, 160, 160]
    - [57, 99.7888]
  - - [128, 64, 1, 256, 160, 160, 288, 288]
    - [45, 176.202]
  - - [128, 64, 1, 512, 160, 160, 544, 544]
    - [39, 278.008]
  - - [128, 64, 1, 1024, 160, 160, 1056, 1056]
    - [45, 402.467]
  - - [128, 64, 1, 2048, 160, 160, 2080, 2080]
    - [51, 519.017]
  - - [128, 64, 1, 4096, 160, 160, 4128, 4128]
    - [41, 582.644]
  - - [128, 128, 1, 64, 160, 160, 128, 128]
    - [28, 135.51]
  - - [128, 128, 1, 128, 160, 160, 160, 160]
    - [34, 265.16]
  - - [128, 128, 1, 256, 160, 160, 288, 288]
    - [52, 439.794]
  - - [128, 128, 1, 512, 160, 160, 544, 544]
    - [15, 650.331]
  - - [128, 128, 1, 1024, 160, 160, 1056, 1056]
    - [52, 905.116]
  - - [128, 128, 1, 2048, 160, 160, 2080, 2080]
    - [45, 1111.77]
  - - [128, 128, 1, 4096, 160, 160, 4128, 4128]
    - [39, 1214.05]
  - - [128, 256, 1, 64, 160, 160, 128, 256]
    - [28, 333.305]
  - - [128, 256, 1, 128, 160, 160, 160, 256]
    - [45, 589.502]
  - - [128, 256, 1, 256, 160, 160, 288, 288]
    - [45, 979.297]
  - - [128, 256, 1, 512, 160, 160, 544, 544]
    - [45, 1456.86]
  - - [128, 256, 1, 1024, 160, 160, 1056, 1056]
    - [39, 1914.34]
  - - [128, 256, 1, 2048, 160, 160, 2080, 2080]
    - [52, 2307.1]
  - - [128, 256, 1, 4096, 160, 160, 4128, 4128]
    - [55, 2480.05]
  - - [128, 512, 1, 64, 160, 160, 128, 512]
    - [25, 678.032]
  - - [128, 512, 1, 128, 160, 160, 160, 512]
    - [45, 1202.84]
  - - [128, 512, 1, 256, 160, 160, 288, 512]
    - [45, 1992.32]
  - - [128, 512, 1, 512, 160, 160, 544, 544]
    - [43, 3033.85]
  - - [128, 512, 1, 1024, 160, 160, 1056, 1056]
    - [39, 4018.98]
  - - [128, 512, 1, 2048, 160, 160, 2080, 2080]
    - [46, 4681.47]
  - - [128, 512, 1, 4096, 160, 160, 4128, 4128]
    - [42, 5033.67]
  - - [128, 1024, 1, 64, 160, 160, 128, 1024]
    - [45, 1386.56]
  - - [128, 1024, 1, 128, 160, 160, 160, 1024]
    - [52, 2617.35]
  - - [128, 1024, 1, 256, 160, 160, 288, 1024]
    - [52, 4254.4]
  - - [128, 1024, 1, 512, 160, 160, 544, 1024]
    - [45, 5978.52]
  - - [128, 1024, 1, 1024, 160, 160, 1056, 1056]
    - [42, 8119.64]
  - - [128, 1024, 1, 2048, 160, 160, 2080, 2080]
    - [45, 9423.09]
  - - [128, 1024, 1, 4096, 160, 160, 4128, 4128]
    - [42, 10243.1]
  - - [128, 2048, 1, 64, 160, 160, 128, 2048]
    - [6, 2722.25]
  - - [128, 2048, 1, 128, 160, 160, 160, 2048]
    - [45, 4679.18]
  - - [128, 2048, 1, 256, 160, 160, 288, 2048]
    - [48, 7688.04]
  - - [128, 2048, 1, 512, 160, 160, 544, 2048]
    - [42, 11409.2]
  - - [128, 2048, 1, 1024, 160, 160, 1056, 2048]
    - [39, 15393.7]
  - - [128, 2048, 1, 2048, 160, 160, 2080, 2080]
    - [46, 18850.2]
  - - [128, 2048, 1, 4096, 160, 160, 4128, 4128]
    - [1, 16319.5]
  - - [128, 4096, 1, 64, 160, 160, 128, 4096]
    - [24, 4496.71]
  - - [128, 4096, 1, 128, 160, 160, 160, 4096]
    - [15, 8042.79]
  - - [128, 4096, 1, 256, 160, 160, 288, 4096]
    - [8, 13359.0]
  - - [128, 4096, 1, 512, 160, 160, 544, 4096]
    - [23, 20091.0]
  - - [128, 4096, 1, 1024, 160, 160, 1056, 4096]
    - [24, 27069.6]
  - - [128, 4096, 1, 2048, 160, 160, 2080, 4096]
    - [8, 32463.8]
  - - [128, 4096, 1, 4096, 160, 160, 4128, 4128]
    - [24, 32971.3]
  - - [256, 64, 1, 64, 288, 288, 256, 96]
    - [2, 139.346]
  - - [256, 64, 1, 128, 288, 288, 256, 160]
    - [39, 229.147]
  - - [256, 64, 1, 256, 288, 288, 288, 288]
    - [39, 394.053]
  - - [256, 64, 1, 512, 288, 288, 544, 544]
    - [52, 630.344]
  - - [256, 64, 1, 1024, 288, 288, 1056, 1056]
    - [38, 875.319]
  - - [256, 64, 1, 2048, 288, 288, 2080, 2080]
    - [39, 1085.69]
  - - [256, 64, 1, 4096, 288, 288, 4128, 4128]
    - [42, 1199.89]
  - - [256, 128, 1, 64, 288, 288, 256, 128]
    - [33, 314.274]
  - - [256, 128, 1, 128, 288, 288, 256, 160]
    - [28, 592.249]
  - - [256, 128, 1, 256, 288, 288, 288, 288]
    - [52, 978.492]
  - - [256, 128, 1, 512, 288, 288, 544, 544]
    - [39, 1416.64]
  - - [256, 128, 1, 1024, 288, 288, 1056, 1056]
    - [52, 1946.54]
  - - [256, 128, 1, 2048, 288, 288, 2080, 2080]
    - [52, 2302.19]
  - - [256, 128, 1, 4096, 288, 288, 4128, 4128]
    - [55, 2497.22]
  - - [256, 256, 1, 64, 288, 288, 256, 256]
    - [9, 679.022]
  - - [256, 256, 1, 128, 288, 288, 256, 256]
    - [39, 1206.13]
  - - [256, 256, 1, 256, 288, 288, 288, 288]
    - [45, 1972.63]
  - - [256, 256, 1, 512, 288, 288, 544, 544]
    - [50, 2934.11]
  - - [256, 256, 1, 1024, 288, 288, 1056, 1056]
    - [48, 4008.9]
  - - [256, 256, 1, 2048, 288, 288, 2080, 2080]
    - [48, 4689.49]
  - - [256, 256, 1, 4096, 288, 288, 4128, 4128]
    - [42, 5033.58]
  - - [256, 512, 1, 64, 288, 288, 256, 512]
    - [52, 1464.24]
  - - [256, 512, 1, 128, 288, 288, 256, 512]
    - [45, 2606.37]
  - - [256, 512, 1, 256, 288, 288, 288, 512]
    - [48, 4221.21]
  - - [256, 512, 1, 512, 288, 288, 544, 544]
    - [55, 5979.05]
  - - [256, 512, 1, 1024, 288, 288, 1056, 1056]
    - [48, 7924.53]
  - - [256, 512, 1, 2048, 288, 288, 2080, 2080]
    - [39, 9532.18]
  - - [256, 512, 1, 4096, 288, 288, 4128, 4128]
    - [42, 10030.3]
  - - [256, 1024, 1, 64, 288, 288, 256, 1024]
    - [13, 2770.35]
  - - [256, 1024, 1, 128, 288, 288, 256, 1024]
    - [45, 4902.04]
  - - [256, 1024, 1, 256, 288, 288, 288, 1024]
    - [13, 7787.98]
  - - [256, 1024, 1, 512, 288, 288, 544, 1024]
    - [46, 11479.4]
  - - [256, 1024, 1, 1024, 288, 288, 1056, 1056]
    - [42, 15410.5]
  - - [256, 1024, 1, 2048, 288, 288, 2080, 2080]
    - [55, 18775.0]
  - - [256, 1024, 1, 4096, 288, 288, 4128, 4128]
    - [55, 20118.8]
  - - [256, 2048, 1, 64, 288, 288, 256, 2048]
    - [33, 4644.87]
  - - [256, 2048, 1, 128, 288, 288, 256, 2048]
    - [6, 8300.44]
  - - [256, 2048, 1, 256, 288, 288, 288, 2048]
    - [24, 13617.9]
  - - [256, 2048, 1, 512, 288, 288, 544, 2048]
    - [15, 20187.7]
  - - [256, 2048, 1, 1024, 288, 288, 1056, 2048]
    - [15, 26389.7]
  - - [256, 2048, 1, 2048, 288, 288, 2080, 2080]
    - [7, 31808.0]
  - - [256, 2048, 1, 4096, 288, 288, 4128, 4128]
    - [8, 34198.9]
  - - [256, 4096, 1, 64, 288, 288, 256, 4096]
    - [26, 8185.01]
  - - [256, 4096, 1, 128, 288, 288, 256, 4096]
    - [8, 14367.1]
  - - [256, 4096, 1, 256, 288, 288, 288, 4096]
    - [7, 21442.2]
  - - [256, 4096, 1, 512, 288, 288, 544, 4096]
    - [13, 27799.9]
  - - [256, 4096, 1, 1024, 288, 288, 1056, 4096]
    - [6, 33428.1]
  - - [256, 4096, 1, 2048, 288, 288, 2080, 4096]
    - [6, 36071.0]
  - - [256, 4096, 1, 4096, 288, 288, 4128, 4128]
    - [13, 38653.0]
  - - [384, 64, 1, 64, 416, 416, 384, 96]
    - [2, 215.196]
  - - [384, 64, 1, 128, 416, 416, 384, 160]
    - [45, 358.733]
  - - [384, 64, 1, 256, 416, 416, 384, 288]
    - [45, 610.88]
  - - [384, 64, 1, 512, 416, 416, 544, 544]
    - [49, 945.16]
  - - [384, 64, 1, 1024, 416, 416, 1056, 1056]
    - [39, 1351.04]
  - - [384, 64, 1, 2048, 416, 416, 2080, 2080]
    - [41, 1636.59]
  - - [384, 64, 1, 4096, 416, 416, 4128, 4128]
    - [48, 1809.91]
  - - [384, 128, 1, 64, 416, 416, 384, 128]
    - [18, 486.881]
  - - [384, 128, 1, 128, 416, 416, 384, 160]
    - [52, 876.858]
  - - [384, 128, 1, 256, 416, 416, 384, 288]
    - [39, 1448.81]
  - - [384, 128, 1, 512, 416, 416, 544, 544]
    - [52, 2157.38]
  - - [384, 128, 1, 1024, 416, 416, 1056, 1056]
    - [52, 2900.63]
  - - [384, 128, 1, 2048, 416, 416, 2080, 2080]
    - [42, 3499.39]
  - - [384, 128, 1, 4096, 416, 416, 4128, 4128]
    - [55, 3726.55]
  - - [384, 256, 1, 64, 416, 416, 384, 256]
    - [56, 1086.42]
  - - [384, 256, 1, 128, 416, 416, 384, 256]
    - [39, 1929.01]
  - - [384, 256, 1, 256, 416, 416, 384, 288]
    - [48, 3010.28]
  - - [384, 256, 1, 512, 416, 416, 544, 544]
    - [39, 4460.44]
  - - [384, 256, 1, 1024, 416, 416, 1056, 1056]
    - [39, 5901.59]
  - - [384, 256, 1, 2048, 416, 416, 2080, 2080]
    - [55, 7120.05]
  - - [384, 256, 1, 4096, 416, 416, 4128, 4128]
    - [48, 7472.88]
  - - [384, 512, 1, 64, 416, 416, 384, 512]
    - [55, 2105.93]
  - - [384, 512, 1, 128, 416, 416, 384, 512]
    - [37, 3720.55]
  - - [384, 512, 1, 256, 416, 416, 384, 512]
    - [39, 6111.18]
  - - [384, 512, 1, 512, 416, 416, 544, 544]
    - [55, 8732.11]
  - - [384, 512, 1, 1024, 416, 416, 1056, 1056]
    - [48, 11650.8]
  - - [384, 512, 1, 2048, 416, 416, 2080, 2080]
    - [54, 13892.7]
  - - [384, 512, 1, 4096, 416, 416, 4128, 4128]
    - [46, 14912.5]
  - - [384, 1024, 1, 64, 416, 416, 384, 1024]
    - [15, 3460.19]
  - - [384, 1024, 1, 128, 416, 416, 384, 1024]
    - [29, 6184.79]
  - - [384, 1024, 1, 256, 416, 416, 384, 1024]
    - [24, 10509.8]
  - - [384, 1024, 1, 512, 416, 416, 544, 1024]
    - [24, 15533.3]
  - - [384, 1024, 1, 1024, 416, 416, 1056, 1056]
    - [15, 20049.5]
  - - [384, 1024, 1, 2048, 416, 416, 2080, 2080]
    - [22, 23903.4]
  - - [384, 1024, 1, 4096, 416, 416, 4128, 4128]
    - [15, 25873.3]
  - - [384, 2048, 1, 64, 416, 416, 384, 2048]
    - [33, 5974.08]
  - - [384, 2048, 1, 128, 416, 416, 384, 2048]
    - [24, 11479.4]
  - - [384, 2048, 1, 256, 416, 416, 384, 2048]
    - [15, 17897.3]
  - - [384, 2048, 1, 512, 416, 416, 544, 2048]
    - [8, 24819.9]
  - - [384, 2048, 1, 1024, 416, 416, 1056, 2048]
    - [6, 30470.6]
  - - [384, 2048, 1, 2048, 416, 416, 2080, 2080]
    - [23, 33605.6]
  - - [384, 2048, 1, 4096, 416, 416, 4128, 4128]
    - [6, 36697.9]
  - - [384, 4096, 1, 64, 416, 416, 384, 4096]
    - [33, 10317.0]
  - - [384, 4096, 1, 128, 416, 416, 384, 4096]
    - [19, 16366.7]
  - - [384, 4096, 1, 256, 416, 416, 384, 4096]
    - [52, 23518.1]
  - - [384, 4096, 1, 512, 416, 416, 544, 4096]
    - [55, 29611.2]
  - - [384, 4096, 1, 1024, 416, 416, 1056, 4096]
    - [55, 32562.0]
  - - [384, 4096, 1, 2048, 416, 416, 2080, 4096]
    - [48, 35377.9]
  - - [384, 4096, 1, 4096, 416, 416, 4128, 4128]
    - [42, 36190.9]
  - - [768, 64, 1, 64, 800, 800, 768, 96]
    - [18, 469.512]
  - - [768, 64, 1, 128, 800, 800, 768, 160]
    - [37, 787.022]
  - - [768, 64, 1, 256, 800, 800, 768, 288]
    - [24, 1303.66]
  - - [768, 64, 1, 512, 800, 800, 768, 544]
    - [39, 1976.27]
  - - [768, 64, 1, 1024, 800, 800, 1056, 1056]
    - [48, 2740.63]
  - - [768, 64, 1, 2048, 800, 800, 2080, 2080]
    - [48, 3280.97]
  - - [768, 64, 1, 4096, 800, 800, 4128, 4128]
    - [47, 3603.29]
  - - [768, 128, 1, 64, 800, 800, 768, 128]
    - [9, 970.454]
  - - [768, 128, 1, 128, 800, 800, 768, 160]
    - [43, 1825.46]
  - - [768, 128, 1, 256, 800, 800, 768, 288]
    - [52, 2986.33]
  - - [768, 128, 1, 512, 800, 800, 768, 544]
    - [45, 4419.72]
  - - [768, 128, 1, 1024, 800, 800, 1056, 1056]
    - [48, 5939.9]
  - - [768, 128, 1, 2048, 800, 800, 2080, 2080]
    - [48, 6919.87]
  - - [768, 128, 1, 4096, 800, 800, 4128, 4128]
    - [48, 7420.68]
  - - [768, 256, 1, 64, 800, 800, 768, 256]
    - [29, 2114.06]
  - - [768, 256, 1, 128, 800, 800, 768, 256]
    - [8, 3705.22]
  - - [768, 256, 1, 256, 800, 800, 768, 288]
    - [45, 5881.93]
  - - [768, 256, 1, 512, 800, 800, 768, 544]
    - [45, 8712.44]
  - - [768, 256, 1, 1024, 800, 800, 1056, 1056]
    - [39, 11451.4]
  - - [768, 256, 1, 2048, 800, 800, 2080, 2080]
    - [42, 13812.2]
  - - [768, 256, 1, 4096, 800, 800, 4128, 4128]
    - [55, 14830.2]
  - - [768, 512, 1, 64, 800, 800, 768, 512]
    - [15, 3621.5]
  - - [768, 512, 1, 128, 800, 800, 768, 512]
    - [13, 6408.43]
  - - [768, 512, 1, 256, 800, 800, 768, 512]
    - [8, 10534.0]
  - - [768, 512, 1, 512, 800, 800, 768, 544]
    - [42, 15170.4]
  - - [768, 512, 1, 1024, 800, 800, 1056, 1056]
    - [24, 20003.6]
  - - [768, 512, 1, 2048, 800, 800, 2080, 2080]
    - [24, 24272.4]
  - - [768, 512, 1, 4096, 800, 800, 4128, 4128]
    - [8, 25795.0]
  - - [768, 1024, 1, 64, 800, 800, 768, 1024]
    - [29, 6152.28]
  - - [768, 1024, 1, 128, 800, 800, 768, 1024]
    - [16, 10627.5]
  - - [768, 1024, 1, 256, 800, 800, 768, 1024]
    - [24, 17379.8]
  - - [768, 1024, 1, 512, 800, 800, 768, 1024]
    - [22, 24322.1]
  - - [768, 1024, 1, 1024, 800, 800, 1056, 1056]
    - [22, 30392.4]
  - - [768, 1024, 1, 2048, 800, 800, 2080, 2080]
    - [13, 33606.3]
  - - [768, 1024, 1, 4096, 800, 800, 4128, 4128]
    - [22, 36829.2]
  - - [768, 2048, 1, 64, 800, 800, 768, 2048]
    - [36, 10766.1]
  - - [768, 2048, 1, 128, 800, 800, 768, 2048]
    - [19, 17115.3]
  - - [768, 2048, 1, 256, 800, 800, 768, 2048]
    - [10, 24102.3]
  - - [768, 2048, 1, 512, 800, 800, 768, 2048]
    - [55, 29612.3]
  - - [768, 2048, 1, 1024, 800, 800, 1056, 2048]
    - [55, 33057.9]
  - - [768, 2048, 1, 2048, 800, 800, 2080, 2080]
    - [55, 36158.6]
  - - [768, 2048, 1, 4096, 800, 800, 4128, 4128]
    - [24, 38116.5]
  - - [768, 4096, 1, 64, 800, 800, 768, 4096]
    - [10, 13569.2]
  - - [768, 4096, 1, 128, 800, 800, 768, 4096]
    - [9, 20596.1]
  - - [768, 4096, 1, 256, 800, 800, 768, 4096]
    - [20, 28041.9]
  - - [768, 4096, 1, 512, 800, 800, 768, 4096]
    - [55, 31764.4]
  - - [768, 4096, 1, 1024, 800, 800, 1056, 4096]
    - [55, 35959.2]
  - - [768, 4096, 1, 2048, 800, 800, 2080, 4096]
    - [5, 38610.0]
  - - [768, 4096, 1, 4096, 800, 800, 4128, 4128]
    - [12, 39510.0]
  - - [1536, 64, 1, 64, 1568, 1568, 1536, 96]
    - [17, 946.233]
  - - [1536, 64, 1, 128, 1568, 1568, 1536, 160]
    - [45, 1601.29]
  - - [1536, 64, 1, 256, 1568, 1568, 1536, 288]
    - [24, 2632.96]
  - - [1536, 64, 1, 512, 1568, 1568, 1536, 544]
    - [52, 3934.62]
  - - [1536, 64, 1, 1024, 1568, 1568, 1536, 1056]
    - [48, 5351.02]
  - - [1536, 64, 1, 2048, 1568, 1568, 2080, 2080]
    - [48, 6619.77]
  - - [1536, 64, 1, 4096, 1568, 1568, 4128, 4128]
    - [48, 7303.71]
  - - [1536, 128, 1, 64, 1568, 1568, 1536, 128]
    - [15, 1888.76]
  - - [1536, 128, 1, 128, 1568, 1568, 1536, 160]
    - [52, 3539.99]
  - - [1536, 128, 1, 256, 1568, 1568, 1536, 288]
    - [39, 6041.49]
  - - [1536, 128, 1, 512, 1568, 1568, 1536, 544]
    - [52, 8806.94]
  - - [1536, 128, 1, 1024, 1568, 1568, 1536, 1056]
    - [52, 11234.8]
  - - [1536, 128, 1, 2048, 1568, 1568, 2080, 2080]
    - [48, 13761.7]
  - - [1536, 128, 1, 4096, 1568, 1568, 4128, 4128]
    - [46, 14106.4]
  - - [1536, 256, 1, 64, 1568, 1568, 1536, 256]
    - [29, 3585.9]
  - - [1536, 256, 1, 128, 1568, 1568, 1536, 256]
    - [15, 6423.15]
  - - [1536, 256, 1, 256, 1568, 1568, 1536, 288]
    - [8, 10526.4]
  - - [1536, 256, 1, 512, 1568, 1568, 1536, 544]
    - [24, 15462.9]
  - - [1536, 256, 1, 1024, 1568, 1568, 1536, 1056]
    - [24, 20284.8]
  - - [1536, 256, 1, 2048, 1568, 1568, 2080, 2080]
    - [22, 24015.4]
  - - [1536, 256, 1, 4096, 1568, 1568, 4128, 4128]
    - [15, 26034.8]
  - - [1536, 512, 1, 64, 1568, 1568, 1536, 512]
    - [31, 6139.5]
  - - [1536, 512, 1, 128, 1568, 1568, 1536, 512]
    - [24, 11486.0]
  - - [1536, 512, 1, 256, 1568, 1568, 1536, 512]
    - [24, 17816.5]
  - - [1536, 512, 1, 512, 1568, 1568, 1536, 544]
    - [24, 24818.4]
  - - [1536, 512, 1, 1024, 1568, 1568, 1536, 1056]
    - [15, 30258.8]
  - - [1536, 512, 1, 2048, 1568, 1568, 2080, 2080]
    - [13, 33568.5]
  - - [1536, 512, 1, 4096, 1568, 1568, 4128, 4128]
    - [6, 36809.0]
  - - [1536, 1024, 1, 64, 1568, 1568, 1536, 1024]
    - [33, 10476.0]
  - - [1536, 1024, 1, 128, 1568, 1568, 1536, 1024]
    - [19, 17247.2]
  - - [1536, 1024, 1, 256, 1568, 1568, 1536, 1024]
    - [24, 24158.7]
  - - [1536, 1024, 1, 512, 1568, 1568, 1536, 1024]
    - [48, 29792.0]
  - - [1536, 1024, 1, 1024, 1568, 1568, 1536, 1056]
    - [55, 32800.7]
  - - [1536, 1024, 1, 2048, 1568, 1568, 2080, 2080]
    - [24, 36051.4]
  - - [1536, 1024, 1, 4096, 1568, 1568, 4128, 4128]
    - [24, 37710.7]
  - - [1536, 2048, 1, 64, 1568, 1568, 1536, 2048]
    - [29, 13608.7]
  - - [1536, 2048, 1, 128, 1568, 1568, 1536, 2048]
    - [35, 20714.8]
  - - [1536, 2048, 1, 256, 1568, 1568, 1536, 2048]
    - [4, 27674.7]
  - - [1536, 2048, 1, 512, 1568, 1568, 1536, 2048]
    - [24, 31745.0]
  - - [1536, 2048, 1, 1024, 1568, 1568, 1536, 2048]
    - [55, 36001.8]
  - - [1536, 2048, 1, 2048, 1568, 1568, 2080, 2080]
    - [23, 38558.2]
  - - [1536, 2048, 1, 4096, 1568, 1568, 4128, 4128]
    - [12, 39599.1]
  - - [1536, 4096, 1, 64, 1568, 1568, 1536, 4096]
    - [29, 16167.6]
  - - [1536, 4096, 1, 128, 1568, 1568, 1536, 4096]
    - [55, 23589.1]
  - - [1536, 4096, 1, 256, 1568, 1568, 1536, 4096]
    - [3, 29528.2]
  - - [1536, 4096, 1, 512, 1568, 1568, 1536, 4096]
    - [55, 34534.8]
  - - [1536, 4096, 1, 1024, 1568, 1568, 1536, 4096]
    - [55, 37987.8]
  - - [1536, 4096, 1, 2048, 1568, 1568, 2080, 4096]
    - [55, 39263.6]
  - - [1536, 4096, 1, 4096, 1568, 1568, 4128, 4128]
    - [21, 39568.3]
  - - [3072, 64, 1, 64, 3104, 3104, 3072, 96]
    - [12, 1677.05]
  - - [3072, 64, 1, 128, 3104, 3104, 3072, 160]
    - [6, 2923.55]
  - - [3072, 64, 1, 256, 3104, 3104, 3072, 288]
    - [23, 4878.52]
  - - [3072, 64, 1, 512, 3104, 3104, 3072, 544]
    - [14, 7309.82]
  - - [3072, 64, 1, 1024, 3104, 3104, 3072, 1056]
    - [7, 9832.81]
  - - [3072, 64, 1, 2048, 3104, 3104, 3072, 2080]
    - [13, 11891.0]
  - - [3072, 64, 1, 4096, 3104, 3104, 4128, 4128]
    - [5, 12772.5]
  - - [3072, 128, 1, 64, 3104, 3104, 3072, 128]
    - [24, 3723.32]
  - - [3072, 128, 1, 128, 3104, 3104, 3072, 160]
    - [22, 6671.77]
  - - [3072, 128, 1, 256, 3104, 3104, 3072, 288]
    - [24, 10899.0]
  - - [3072, 128, 1, 512, 3104, 3104, 3072, 544]
    - [15, 15927.7]
  - - [3072, 128, 1, 1024, 3104, 3104, 3072, 1056]
    - [8, 20958.4]
  - - [3072, 128, 1, 2048, 3104, 3104, 3072, 2080]
    - [8, 24666.3]
  - - [3072, 128, 1, 4096, 3104, 3104, 4128, 4128]
    - [24, 26183.3]
  - - [3072, 256, 1, 64, 3104, 3104, 3072, 256]
    - [32, 7056.17]
  - - [3072, 256, 1, 128, 3104, 3104, 3072, 256]
    - [15, 11948.2]
  - - [3072, 256, 1, 256, 3104, 3104, 3072, 288]
    - [15, 18416.3]
  - - [3072, 256, 1, 512, 3104, 3104, 3072, 544]
    - [24, 25338.5]
  - - [3072, 256, 1, 1024, 3104, 3104, 3072, 1056]
    - [15, 31568.3]
  - - [3072, 256, 1, 2048, 3104, 3104, 3072, 2080]
    - [22, 33824.4]
  - - [3072, 256, 1, 4096, 3104, 3104, 4128, 4128]
    - [6, 37041.4]
  - - [3072, 512, 1, 64, 3104, 3104, 3072, 512]
    - [34, 10352.1]
  - - [3072, 512, 1, 128, 3104, 3104, 3072, 512]
    - [9, 16704.9]
  - - [3072, 512, 1, 256, 3104, 3104, 3072, 512]
    - [15, 23610.5]
  - - [3072, 512, 1, 512, 3104, 3104, 3072, 544]
    - [20, 30053.3]
  - - [3072, 512, 1, 1024, 3104, 3104, 3072, 1056]
    - [6, 32774.0]
  - - [3072, 512, 1, 2048, 3104, 3104, 3072, 2080]
    - [15, 36148.1]
  - - [3072, 512, 1, 4096, 3104, 3104, 4128, 4128]
    - [24, 37999.9]
  - - [3072, 1024, 1, 64, 3104, 3104, 3072, 1024]
    - [19, 13599.5]
  - - [3072, 1024, 1, 128, 3104, 3104, 3072, 1024]
    - [18, 20720.1]
  - - [3072, 1024, 1, 256, 3104, 3104, 3072, 1024]
    - [19, 27637.7]
  - - [3072, 1024, 1, 512, 3104, 3104, 3072, 1024]
    - [55, 32050.1]
  - - [3072, 1024, 1, 1024, 3104, 3104, 3072, 1056]
    - [55, 36124.6]
  - - [3072, 1024, 1, 2048, 3104, 3104, 3072, 2080]
    - [23, 38669.3]
  - - [3072, 1024, 1, 4096, 3104, 3104, 4128, 4128]
    - [12, 39553.2]
  - - [3072, 2048, 1, 64, 3104, 3104, 3072, 2048]
    - [35, 16164.3]
  - - [3072, 2048, 1, 128, 3104, 3104, 3072, 2048]
    - [11, 23552.5]
  - - [3072, 2048, 1, 256, 3104, 3104, 3072, 2048]
    - [19, 29435.9]
  - - [3072, 2048, 1, 512, 3104, 3104, 3072, 2048]
    - [55, 34564.0]
  - - [3072, 2048, 1, 1024, 3104, 3104, 3072, 2048]
    - [55, 37989.5]
  - - [3072, 2048, 1, 2048, 3104, 3104, 3072, 2080]
    - [55, 39266.9]
  - - [3072, 2048, 1, 4096, 3104, 3104, 4128, 4128]
    - [12, 39794.0]
  - - [3072, 4096, 1, 64, 3104, 3104, 3072, 4096]
    - [30, 17077.5]
  - - [3072, 4096, 1, 128, 3104, 3104, 3072, 4096]
    - [20, 24680.7]
  - - [3072, 4096, 1, 256, 3104, 3104, 3072, 4096]
    - [20, 31525.4]
  - - [3072, 4096, 1, 512, 3104, 3104, 3072, 4096]
    - [55, 36130.5]
  - - [3072, 4096, 1, 1024, 3104, 3104, 3072, 4096]
    - [55, 38439.8]
  - - [3072, 4096, 1, 2048, 3104, 3104, 3072, 4096]
    - [55, 38969.9]
  - - [3072, 4096, 1, 4096, 3104, 3104, 4128, 4128]
    - [24, 39162.7]
  - - [4096, 64, 1, 64, 4128, 4128, 4096, 96]
    - [7, 1825.59]
  - - [4096, 64, 1, 128, 4128, 4128, 4096, 160]
    - [12, 3877.78]
  - - [4096, 64, 1, 256, 4128, 4128, 4096, 288]
    - [7, 6455.27]
  - - [4096, 64, 1, 512, 4128, 4128, 4096, 544]
    - [12, 9703.46]
  - - [4096, 64, 1, 1024, 4128, 4128, 4096, 1056]
    - [5, 13158.6]
  - - [4096, 64, 1, 2048, 4128, 4128, 4096, 2080]
    - [7, 15595.8]
  - - [4096, 64, 1, 4096, 4128, 4128, 4128, 4128]
    - [5, 16933.6]
  - - [4096, 128, 1, 64, 4128, 4128, 4096, 128]
    - [26, 5161.43]
  - - [4096, 128, 1, 128, 4128, 4128, 4096, 160]
    - [32, 9529.84]
  - - [4096, 128, 1, 256, 4128, 4128, 4096, 288]
    - [8, 15379.7]
  - - [4096, 128, 1, 512, 4128, 4128, 4096, 544]
    - [8, 22033.7]
  - - [4096, 128, 1, 1024, 4128, 4128, 4096, 1056]
    - [15, 27741.0]
  - - [4096, 128, 1, 2048, 4128, 4128, 4096, 2080]
    - [24, 32030.1]
  - - [4096, 128, 1, 4096, 4128, 4128, 4128, 4128]
    - [8, 33942.7]
  - - [4096, 256, 1, 64, 4128, 4128, 4096, 256]
    - [29, 8763.26]
  - - [4096, 256, 1, 128, 4128, 4128, 4096, 256]
    - [15, 14527.3]
  - - [4096, 256, 1, 256, 4128, 4128, 4096, 288]
    - [15, 21554.2]
  - - [4096, 256, 1, 512, 4128, 4128, 4096, 544]
    - [24, 27741.0]
  - - [4096, 256, 1, 1024, 4128, 4128, 4096, 1056]
    - [13, 33455.2]
  - - [4096, 256, 1, 2048, 4128, 4128, 4096, 2080]
    - [13, 36019.6]
  - - [4096, 256, 1, 4096, 4128, 4128, 4128, 4128]
    - [13, 38550.0]
  - - [4096, 512, 1, 64, 4128, 4128, 4096, 512]
    - [30, 11749.8]
  - - [4096, 512, 1, 128, 4128, 4128, 4096, 512]
    - [30, 18454.3]
  - - [4096, 512, 1, 256, 4128, 4128, 4096, 512]
    - [20, 25520.3]
  - - [4096, 512, 1, 512, 4128, 4128, 4096, 544]
    - [24, 31776.9]
  - - [4096, 512, 1, 1024, 4128, 4128, 4096, 1056]
    - [24, 34586.7]
  - - [4096, 512, 1, 2048, 4128, 4128, 4096, 2080]
    - [6, 37775.6]
  - - [4096, 512, 1, 4096, 4128, 4128, 4128, 4128]
    - [13, 39494.7]
  - - [4096, 1024, 1, 64, 4128, 4128, 4096, 1024]
    - [33, 14779.3]
  - - [4096, 1024, 1, 128, 4128, 4128, 4096, 1024]
    - [19, 22062.7]
  - - [4096, 1024, 1, 256, 4128, 4128, 4096, 1024]
    - [19, 28909.1]
  - - [4096, 1024, 1, 512, 4128, 4128, 4096, 1024]
    - [55, 33080.5]
  - - [4096, 1024, 1, 1024, 4128, 4128, 4096, 1056]
    - [55, 36944.1]
  - - [4096, 1024, 1, 2048, 4128, 4128, 4096, 2080]
    - [55, 39054.4]
  - - [4096, 1024, 1, 4096, 4128, 4128, 4128, 4128]
    - [22, 39165.9]
  - - [4096, 2048, 1, 64, 4128, 4128, 4096, 2048]
    - [33, 16976.7]
  - - [4096, 2048, 1, 128, 4128, 4128, 4096, 2048]
    - [20, 23385.0]
  - - [4096, 2048, 1, 256, 4128, 4128, 4096, 2048]
    - [11, 30381.9]
  - - [4096, 2048, 1, 512, 4128, 4128, 4096, 2048]
    - [55, 35334.5]
  - - [4096, 2048, 1, 1024, 4128, 4128, 4096, 2048]
    - [55, 38517.3]
  - - [4096, 2048, 1, 2048, 4128, 4128, 4096, 2080]
    - [48, 39106.9]
  - - [4096, 2048, 1, 4096, 4128, 4128, 4128, 4128]
    - [21, 40079.5]
  - - [4096, 4096, 1, 64, 4128, 4128, 4096, 4096]
    - [33, 17567.5]
  - - [4096, 4096, 1, 128, 4128, 4128, 4096, 4096]
    - [20, 25017.0]
  - - [4096, 4096, 1, 256, 4128, 4128, 4096, 4096]
    - [19, 31303.8]
  - - [4096, 4096, 1, 512, 4128, 4128, 4096, 4096]
    - [55, 36382.3]
  - - [4096, 4096, 1, 1024, 4128, 4128, 4096, 4096]
    - [55, 38332.7]
  - - [4096, 4096, 1, 2048, 4128, 4128, 4096, 4096]
    - [21, 39483.2]
  - - [4096, 4096, 1, 4096, 4128, 4128, 4128, 4128]
    - [24, 39187.2]
- null
- null
- DeviceEfficiency
