library/src/blas3/Tensile/Logic/asm_full/navi33/navi33_Cijk_Ailk_Bjlk_I8II_BH_GB.yaml
- {MinimumRequiredVersion: 4.35.0}
- navi33
- gfx1102
- [Device 73f0]
    SolutionIndex: 0
    SolutionNameMin: Cijk_Ailk_Bjlk_I8II_BH_MT128x128x16_MI16x16x16x1_SN_1LDSB0_GRVW8_PLR0_SIA1_SU0_SUS0_SVW2_VW2_WGM1
    SolutionIndex: 1
    SolutionNameMin: Cijk_Ailk_Bjlk_I8II_BH_MT128x128x16_MI16x16x16x1_SN_1LDSB0_GRVW8_PLR0_SIA1_SU0_SUS0_SVW4_VW4_WGM1
    SolutionIndex: 2
    SolutionNameMin: Cijk_Ailk_Bjlk_I8II_BH_MT128x128x16_MI16x16x16x1_SN_1LDSB0_GRVW16_PLR0_SIA1_SU0_SUS0_SVW2_VW2_WGM1
    SolutionIndex: 3
    SolutionNameMin: Cijk_Ailk_Bjlk_I8II_BH_MT128x128x16_MI16x16x16x1_SN_1LDSB0_GRVW16_PLR0_SIA1_SU0_SUS0_SVW4_VW4_WGM1
    SolutionIndex: 4
    SolutionNameMin: Cijk_Ailk_Bjlk_I8II_BH_MT128x128x16_MI16x16x16x1_SN_1LDSB0_GRVW8_PLR1_SIA1_SU0_SUS0_SVW2_VW2_WGM1
    SolutionIndex: 5
    SolutionNameMin: Cijk_Ailk_Bjlk_I8II_BH_MT128x128x16_MI16x16x16x1_SN_1LDSB0_GRVW16_PLR1_SIA1_SU0_SUS0_SVW4_VW4_WGM1
    SolutionIndex: 6
    SolutionNameMin: Cijk_Ailk_Bjlk_I8II_BH_MT128x128x16_MI16x16x16x1_SN_1LDSB1_GRVW8_PLR1_SIA2_SU0_SUS0_SVW2_VW2_WGM1
    SolutionIndex: 7
    SolutionNameMin: Cijk_Ailk_Bjlk_I8II_BH_MT128x128x16_MI16x16x16x1_SN_1LDSB1_GRVW8_PLR1_SIA2_SU0_SUS0_SVW4_VW4_WGM1
    SolutionIndex: 8
    SolutionNameMin: Cijk_Ailk_Bjlk_I8II_BH_MT128x128x16_MI16x16x16x1_SN_1LDSB1_GRVW16_PLR1_SIA2_SU0_SUS0_SVW2_VW2_WGM1
    SolutionIndex: 9
    SolutionNameMin: Cijk_Ailk_Bjlk_I8II_BH_MT128x128x16_MI16x16x16x1_SN_1LDSB1_GRVW16_PLR1_SIA2_SU0_SUS0_SVW4_VW4_WGM1
    SolutionIndex: 10
    SolutionNameMin: Cijk_Ailk_Bjlk_I8II_BH_MT128x128x16_MI16x16x16x1_SN_1LDSB0_GRVW16_PLR0_SIA3_SU0_SUS0_SVW2_VW2_WGM1
    SolutionIndex: 11
    SolutionNameMin: Cijk_Ailk_Bjlk_I8II_BH_MT128x128x16_MI16x16x16x1_SN_1LDSB0_GRVW8_PLR1_SIA3_SU0_SUS0_SVW2_VW2_WGM1
    SolutionIndex: 12
    SolutionNameMin: Cijk_Ailk_Bjlk_I8II_BH_MT128x128x16_MI16x16x16x1_SN_1LDSB0_GRVW16_PLR1_SIA3_SU0_SUS0_SVW4_VW4_WGM1
    SolutionIndex: 13
    SolutionNameMin: Cijk_Ailk_Bjlk_I8II_BH_MT128x128x16_MI16x16x16x1_SN_1LDSB0_GRVW8_PLR0_SIA1_SU32_SUS256_SVW2_VW2_WGM1
    SolutionIndex: 14
    SolutionNameMin: Cijk_Ailk_Bjlk_I8II_BH_MT128x128x16_MI16x16x16x1_SN_1LDSB0_GRVW8_PLR1_SIA1_SU32_SUS256_SVW2_VW2_WGM1
    SolutionIndex: 15
    SolutionNameMin: Cijk_Ailk_Bjlk_I8II_BH_MT128x128x16_MI16x16x16x1_SN_1LDSB1_GRVW8_PLR1_SIA2_SU32_SUS256_SVW2_VW2_WGM1
    SolutionIndex: 16
    SolutionNameMin: Cijk_Ailk_Bjlk_I8II_BH_MT128x128x16_MI16x16x16x1_SN_1LDSB1_GRVW8_PLR1_SIA2_SU32_SUS256_SVW4_VW4_WGM1
    SolutionIndex: 17
    SolutionNameMin: Cijk_Ailk_Bjlk_I8II_BH_MT128x128x16_MI16x16x16x1_SN_1LDSB1_GRVW16_PLR1_SIA2_SU32_SUS256_SVW2_VW2_WGM1
    SolutionIndex: 18
    SolutionNameMin: Cijk_Ailk_Bjlk_I8II_BH_MT128x128x16_MI16x16x16x1_SN_1LDSB1_GRVW16_PLR1_SIA2_SU32_SUS256_SVW4_VW4_WGM1
    SolutionIndex: 19
    SolutionNameMin: Cijk_Ailk_Bjlk_I8II_BH_MT128x128x16_MI16x16x16x1_SN_1LDSB0_GRVW16_PLR0_SIA3_SU32_SUS256_SVW2_VW2_WGM1
    SolutionIndex: 20
    SolutionNameMin: Cijk_Ailk_Bjlk_I8II_BH_MT128x128x16_MI16x16x16x1_SN_1LDSB0_GRVW8_PLR0_SIA1_SU0_SUS0_SVW2_VW2_WGM4
    SolutionIndex: 21
    SolutionNameMin: Cijk_Ailk_Bjlk_I8II_BH_MT128x128x16_MI16x16x16x1_SN_1LDSB0_GRVW16_PLR0_SIA1_SU0_SUS0_SVW2_VW2_WGM4
    SolutionIndex: 22
    SolutionNameMin: Cijk_Ailk_Bjlk_I8II_BH_MT128x128x16_MI16x16x16x1_SN_1LDSB0_GRVW8_PLR1_SIA1_SU0_SUS0_SVW2_VW2_WGM4
    SolutionIndex: 23
    SolutionNameMin: Cijk_Ailk_Bjlk_I8II_BH_MT128x128x16_MI16x16x16x1_SN_1LDSB0_GRVW16_PLR1_SIA1_SU0_SUS0_SVW2_VW2_WGM4
    SolutionIndex: 24
    SolutionNameMin: Cijk_Ailk_Bjlk_I8II_BH_MT128x128x16_MI16x16x16x1_SN_1LDSB1_GRVW8_PLR1_SIA2_SU0_SUS0_SVW2_VW2_WGM4
    SolutionIndex: 25
    SolutionNameMin: Cijk_Ailk_Bjlk_I8II_BH_MT128x128x16_MI16x16x16x1_SN_1LDSB1_GRVW8_PLR1_SIA2_SU0_SUS0_SVW4_VW4_WGM4
    SolutionIndex: 26
    SolutionNameMin: Cijk_Ailk_Bjlk_I8II_BH_MT128x128x16_MI16x16x16x1_SN_1LDSB1_GRVW16_PLR1_SIA2_SU0_SUS0_SVW2_VW2_WGM4
    SolutionIndex: 27
    SolutionNameMin: Cijk_Ailk_Bjlk_I8II_BH_MT128x128x16_MI16x16x16x1_SN_1LDSB1_GRVW16_PLR1_SIA2_SU0_SUS0_SVW4_VW4_WGM4
    SolutionIndex: 28
    SolutionNameMin: Cijk_Ailk_Bjlk_I8II_BH_MT128x128x16_MI16x16x16x1_SN_1LDSB0_GRVW16_PLR1_SIA3_SU0_SUS0_SVW2_VW2_WGM4
    SolutionIndex: 29
    SolutionNameMin: Cijk_Ailk_Bjlk_I8II_BH_MT128x128x16_MI16x16x16x1_SN_1LDSB0_GRVW16_PLR1_SIA3_SU0_SUS0_SVW4_VW4_WGM4
    SolutionIndex: 30
    SolutionNameMin: Cijk_Ailk_Bjlk_I8II_BH_MT128x128x16_MI16x16x16x1_SN_1LDSB1_GRVW8_PLR1_SIA2_SU32_SUS256_SVW4_VW4_WGM4
    SolutionIndex: 31
    SolutionNameMin: Cijk_Ailk_Bjlk_I8II_BH_MT128x128x16_MI16x16x16x1_SN_1LDSB1_GRVW16_PLR1_SIA2_SU32_SUS256_SVW2_VW2_WGM4
    SolutionIndex: 32
    SolutionNameMin: Cijk_Ailk_Bjlk_I8II_BH_MT128x128x16_MI16x16x16x1_SN_1LDSB1_GRVW16_PLR1_SIA2_SU32_SUS256_SVW4_VW4_WGM4
    SolutionIndex: 33
    SolutionNameMin: Cijk_Ailk_Bjlk_I8II_BH_MT128x128x16_MI16x16x16x1_SN_1LDSB0_GRVW8_PLR0_SIA1_SU0_SUS0_SVW4_VW4_WGM8
    SolutionIndex: 34
    SolutionNameMin: Cijk_Ailk_Bjlk_I8II_BH_MT128x128x16_MI16x16x16x1_SN_1LDSB0_GRVW16_PLR0_SIA1_SU0_SUS0_SVW2_VW2_WGM8
    SolutionIndex: 35
    SolutionNameMin: Cijk_Ailk_Bjlk_I8II_BH_MT128x128x16_MI16x16x16x1_SN_1LDSB0_GRVW16_PLR1_SIA1_SU0_SUS0_SVW2_VW2_WGM8
    SolutionIndex: 36
    SolutionNameMin: Cijk_Ailk_Bjlk_I8II_BH_MT128x128x16_MI16x16x16x1_SN_1LDSB0_GRVW16_PLR1_SIA1_SU0_SUS0_SVW4_VW4_WGM8
    SolutionIndex: 37
    SolutionNameMin: Cijk_Ailk_Bjlk_I8II_BH_MT128x128x16_MI16x16x16x1_SN_1LDSB1_GRVW8_PLR1_SIA2_SU0_SUS0_SVW2_VW2_WGM8
    SolutionIndex: 38
    SolutionNameMin: Cijk_Ailk_Bjlk_I8II_BH_MT128x128x16_MI16x16x16x1_SN_1LDSB1_GRVW8_PLR1_SIA2_SU0_SUS0_SVW4_VW4_WGM8
    SolutionIndex: 39
    SolutionNameMin: Cijk_Ailk_Bjlk_I8II_BH_MT128x128x16_MI16x16x16x1_SN_1LDSB1_GRVW16_PLR1_SIA2_SU0_SUS0_SVW2_VW2_WGM8
    SolutionIndex: 40
    SolutionNameMin: Cijk_Ailk_Bjlk_I8II_BH_MT128x128x16_MI16x16x16x1_SN_1LDSB1_GRVW16_PLR1_SIA2_SU0_SUS0_SVW4_VW4_WGM8
    SolutionIndex: 41
    SolutionNameMin: Cijk_Ailk_Bjlk_I8II_BH_MT128x128x16_MI16x16x16x1_SN_1LDSB0_GRVW16_PLR0_SIA3_SU0_SUS0_SVW2_VW2_WGM8
    SolutionIndex: 42
    SolutionNameMin: Cijk_Ailk_Bjlk_I8II_BH_MT128x128x16_MI16x16x16x1_SN_1LDSB0_GRVW16_PLR1_SIA3_SU0_SUS0_SVW2_VW2_WGM8
    SolutionIndex: 43
    SolutionNameMin: Cijk_Ailk_Bjlk_I8II_BH_MT128x128x16_MI16x16x16x1_SN_1LDSB0_GRVW8_PLR0_SIA1_SU32_SUS256_SVW2_VW2_WGM8
    SolutionIndex: 44
    SolutionNameMin: Cijk_Ailk_Bjlk_I8II_BH_MT128x128x16_MI16x16x16x1_SN_1LDSB0_GRVW8_PLR1_SIA1_SU32_SUS256_SVW4_VW4_WGM8
    SolutionIndex: 45
    SolutionNameMin: Cijk_Ailk_Bjlk_I8II_BH_MT128x128x16_MI16x16x16x1_SN_1LDSB1_GRVW8_PLR1_SIA2_SU32_SUS256_SVW2_VW2_WGM8
    SolutionIndex: 46
    SolutionNameMin: Cijk_Ailk_Bjlk_I8II_BH_MT128x128x16_MI16x16x16x1_SN_1LDSB1_GRVW16_PLR1_SIA2_SU32_SUS256_SVW2_VW2_WGM8
    SolutionIndex: 47
    SolutionNameMin: Cijk_Ailk_Bjlk_I8II_BH_MT128x128x16_MI16x16x16x1_SN_1LDSB1_GRVW16_PLR1_SIA2_SU32_SUS256_SVW4_VW4_WGM8
    SolutionIndex: 48
    SolutionNameMin: Cijk_Ailk_Bjlk_I8II_BH_MT128x128x32_MI16x16x16x1_SN_1LDSB0_GRVW8_PLR0_SIA1_SU0_SUS0_SVW2_VW2_WGM1
    SolutionIndex: 49
    SolutionNameMin: Cijk_Ailk_Bjlk_I8II_BH_MT128x128x32_MI16x16x16x1_SN_1LDSB0_GRVW8_PLR0_SIA1_SU0_SUS0_SVW4_VW4_WGM1
    SolutionIndex: 50
    SolutionNameMin: Cijk_Ailk_Bjlk_I8II_BH_MT128x128x32_MI16x16x16x1_SN_1LDSB0_GRVW16_PLR0_SIA1_SU0_SUS0_SVW2_VW2_WGM1
    SolutionIndex: 51
    SolutionNameMin: Cijk_Ailk_Bjlk_I8II_BH_MT128x128x32_MI16x16x16x1_SN_1LDSB0_GRVW16_PLR0_SIA1_SU0_SUS0_SVW4_VW4_WGM1
    SolutionIndex: 52
    SolutionNameMin: Cijk_Ailk_Bjlk_I8II_BH_MT128x128x32_MI16x16x16x1_SN_1LDSB0_GRVW8_PLR0_SIA3_SU0_SUS0_SVW4_VW4_WGM1
    SolutionIndex: 53
    SolutionNameMin: Cijk_Ailk_Bjlk_I8II_BH_MT128x128x32_MI16x16x16x1_SN_1LDSB0_GRVW16_PLR0_SIA3_SU0_SUS0_SVW4_VW4_WGM1
    SolutionIndex: 54
    SolutionNameMin: Cijk_Ailk_Bjlk_I8II_BH_MT128x128x32_MI16x16x16x1_SN_1LDSB0_GRVW8_PLR0_SIA1_SU32_SUS256_SVW2_VW2_WGM1
    SolutionIndex: 55
    SolutionNameMin: Cijk_Ailk_Bjlk_I8II_BH_MT128x128x32_MI16x16x16x1_SN_1LDSB0_GRVW8_PLR0_SIA1_SU32_SUS256_SVW4_VW4_WGM1
    SolutionIndex: 56
    SolutionNameMin: Cijk_Ailk_Bjlk_I8II_BH_MT128x128x32_MI16x16x16x1_SN_1LDSB0_GRVW16_PLR0_SIA1_SU32_SUS256_SVW4_VW4_WGM1
    SolutionIndex: 57
    SolutionNameMin: Cijk_Ailk_Bjlk_I8II_BH_MT128x128x32_MI16x16x16x1_SN_1LDSB0_GRVW8_PLR0_SIA3_SU32_SUS256_SVW2_VW2_WGM1
    SolutionIndex: 58
    SolutionNameMin: Cijk_Ailk_Bjlk_I8II_BH_MT128x128x32_MI16x16x16x1_SN_1LDSB0_GRVW16_PLR0_SIA3_SU32_SUS256_SVW4_VW4_WGM1
    SolutionIndex: 59
    SolutionNameMin: Cijk_Ailk_Bjlk_I8II_BH_MT128x128x32_MI16x16x16x1_SN_1LDSB0_GRVW8_PLR0_SIA1_SU0_SUS0_SVW2_VW2_WGM4
    SolutionIndex: 60
    SolutionNameMin: Cijk_Ailk_Bjlk_I8II_BH_MT128x128x32_MI16x16x16x1_SN_1LDSB0_GRVW8_PLR0_SIA1_SU0_SUS0_SVW4_VW4_WGM4
    SolutionIndex: 61
    SolutionNameMin: Cijk_Ailk_Bjlk_I8II_BH_MT128x128x32_MI16x16x16x1_SN_1LDSB0_GRVW16_PLR0_SIA1_SU0_SUS0_SVW2_VW2_WGM4
    SolutionIndex: 62
    SolutionNameMin: Cijk_Ailk_Bjlk_I8II_BH_MT128x128x32_MI16x16x16x1_SN_1LDSB0_GRVW16_PLR0_SIA1_SU0_SUS0_SVW4_VW4_WGM4
    SolutionIndex: 63
    SolutionNameMin: Cijk_Ailk_Bjlk_I8II_BH_MT128x128x32_MI16x16x16x1_SN_1LDSB0_GRVW8_PLR0_SIA3_SU0_SUS0_SVW2_VW2_WGM4
    SolutionIndex: 64
    SolutionNameMin: Cijk_Ailk_Bjlk_I8II_BH_MT128x128x32_MI16x16x16x1_SN_1LDSB0_GRVW16_PLR0_SIA3_SU0_SUS0_SVW2_VW2_WGM4
    SolutionIndex: 65
    SolutionNameMin: Cijk_Ailk_Bjlk_I8II_BH_MT128x128x32_MI16x16x16x1_SN_1LDSB0_GRVW16_PLR0_SIA3_SU0_SUS0_SVW4_VW4_WGM4
    SolutionIndex: 66
    SolutionNameMin: Cijk_Ailk_Bjlk_I8II_BH_MT128x128x32_MI16x16x16x1_SN_1LDSB0_GRVW8_PLR0_SIA1_SU32_SUS256_SVW2_VW2_WGM4
    SolutionIndex: 67
    SolutionNameMin: Cijk_Ailk_Bjlk_I8II_BH_MT128x128x32_MI16x16x16x1_SN_1LDSB0_GRVW8_PLR0_SIA1_SU32_SUS256_SVW4_VW4_WGM4
    SolutionIndex: 68
    SolutionNameMin: Cijk_Ailk_Bjlk_I8II_BH_MT128x128x32_MI16x16x16x1_SN_1LDSB0_GRVW16_PLR0_SIA1_SU32_SUS256_SVW2_VW2_WGM4
    SolutionIndex: 69
    SolutionNameMin: Cijk_Ailk_Bjlk_I8II_BH_MT128x128x32_MI16x16x16x1_SN_1LDSB0_GRVW16_PLR0_SIA1_SU32_SUS256_SVW4_VW4_WGM4
    SolutionIndex: 70
    SolutionNameMin: Cijk_Ailk_Bjlk_I8II_BH_MT128x128x32_MI16x16x16x1_SN_1LDSB0_GRVW16_PLR0_SIA3_SU32_SUS256_SVW2_VW2_WGM4
    SolutionIndex: 71
    SolutionNameMin: Cijk_Ailk_Bjlk_I8II_BH_MT128x128x32_MI16x16x16x1_SN_1LDSB0_GRVW8_PLR0_SIA1_SU0_SUS0_SVW2_VW2_WGM8
    SolutionIndex: 72
    SolutionNameMin: Cijk_Ailk_Bjlk_I8II_BH_MT128x128x32_MI16x16x16x1_SN_1LDSB0_GRVW8_PLR0_SIA1_SU0_SUS0_SVW4_VW4_WGM8
    SolutionIndex: 73
    SolutionNameMin: Cijk_Ailk_Bjlk_I8II_BH_MT128x128x32_MI16x16x16x1_SN_1LDSB0_GRVW16_PLR0_SIA1_SU0_SUS0_SVW2_VW2_WGM8
    SolutionIndex: 74
    SolutionNameMin: Cijk_Ailk_Bjlk_I8II_BH_MT128x128x32_MI16x16x16x1_SN_1LDSB0_GRVW16_PLR0_SIA1_SU0_SUS0_SVW4_VW4_WGM8
    SolutionIndex: 75
    SolutionNameMin: Cijk_Ailk_Bjlk_I8II_BH_MT128x128x32_MI16x16x16x1_SN_1LDSB0_GRVW16_PLR0_SIA3_SU0_SUS0_SVW2_VW2_WGM8
    SolutionIndex: 76
    SolutionNameMin: Cijk_Ailk_Bjlk_I8II_BH_MT128x128x32_MI16x16x16x1_SN_1LDSB0_GRVW16_PLR0_SIA3_SU0_SUS0_SVW4_VW4_WGM8
    SolutionIndex: 77
    SolutionNameMin: Cijk_Ailk_Bjlk_I8II_BH_MT128x128x32_MI16x16x16x1_SN_1LDSB0_GRVW8_PLR0_SIA1_SU32_SUS256_SVW2_VW2_WGM8
    SolutionIndex: 78
    SolutionNameMin: Cijk_Ailk_Bjlk_I8II_BH_MT128x128x32_MI16x16x16x1_SN_1LDSB0_GRVW8_PLR0_SIA1_SU32_SUS256_SVW4_VW4_WGM8
    SolutionIndex: 79
    SolutionNameMin: Cijk_Ailk_Bjlk_I8II_BH_MT128x128x32_MI16x16x16x1_SN_1LDSB0_GRVW16_PLR0_SIA1_SU32_SUS256_SVW2_VW2_WGM8
    SolutionIndex: 80
    SolutionNameMin: Cijk_Ailk_Bjlk_I8II_BH_MT128x128x32_MI16x16x16x1_SN_1LDSB0_GRVW16_PLR0_SIA1_SU32_SUS256_SVW4_VW4_WGM8
    SolutionIndex: 81
    SolutionNameMin: Cijk_Ailk_Bjlk_I8II_BH_MT128x128x32_MI16x16x16x1_SN_1LDSB0_GRVW16_PLR0_SIA3_SU32_SUS256_SVW2_VW2_WGM8
- - - [64, 64, 1, 64, 96, 96, 96, 96]
    - [3, 34.2627]
  - - [64, 64, 1, 128, 96, 96, 160, 160]
    - [33, 56.9632]
  - - [64, 64, 1, 256, 96, 96, 288, 288]
    - [38, 96.8661]
  - - [64, 64, 1, 512, 96, 96, 544, 544]
    - [66, 147.604]
  - - [64, 64, 1, 1024, 96, 96, 1056, 1056]
    - [49, 210.685]
  - - [64, 64, 1, 2048, 96, 96, 2080, 2080]
    - [77, 263.884]
  - - [64, 64, 1, 4096, 96, 96, 4128, 4128]
    - [60, 294.901]
  - - [64, 128, 1, 64, 96, 96, 96, 128]
    - [5, 60.4576]
  - - [64, 128, 1, 128, 96, 96, 160, 160]
    - [19, 110.121]
  - - [64, 128, 1, 256, 96, 96, 288, 288]
    - [38, 187.765]
  - - [64, 128, 1, 512, 96, 96, 544, 544]
    - [51, 290.083]
  - - [64, 128, 1, 1024, 96, 96, 1056, 1056]
    - [67, 413.477]
  - - [64, 128, 1, 2048, 96, 96, 2080, 2080]
    - [55, 526.708]
  - - [64, 128, 1, 4096, 96, 96, 4128, 4128]
    - [72, 588.406]
  - - [64, 256, 1, 64, 96, 96, 96, 256]
    - [4, 140.053]
  - - [64, 256, 1, 128, 96, 96, 160, 256]
    - [45, 251.668]
  - - [64, 256, 1, 256, 96, 96, 288, 288]
    - [6, 421.92]
  - - [64, 256, 1, 512, 96, 96, 544, 544]
    - [49, 653.981]
  - - [64, 256, 1, 1024, 96, 96, 1056, 1056]
    - [49, 900.114]
  - - [64, 256, 1, 2048, 96, 96, 2080, 2080]
    - [78, 1115.8]
  - - [64, 256, 1, 4096, 96, 96, 4128, 4128]
    - [67, 1218.28]
  - - [64, 512, 1, 64, 96, 96, 96, 512]
    - [24, 303.671]
  - - [64, 512, 1, 128, 96, 96, 160, 512]
    - [45, 541.69]
  - - [64, 512, 1, 256, 96, 96, 288, 512]
    - [48, 907.465]
  - - [64, 512, 1, 512, 96, 96, 544, 544]
    - [48, 1426.15]
  - - [64, 512, 1, 1024, 96, 96, 1056, 1056]
    - [77, 1907.15]
  - - [64, 512, 1, 2048, 96, 96, 2080, 2080]
    - [78, 2284.64]
  - - [64, 512, 1, 4096, 96, 96, 4128, 4128]
    - [77, 2480.46]
  - - [64, 1024, 1, 64, 96, 96, 96, 1024]
    - [57, 659.378]
  - - [64, 1024, 1, 128, 96, 96, 160, 1024]
    - [50, 1177.85]
  - - [64, 1024, 1, 256, 96, 96, 288, 1024]
    - [48, 1952.89]
  - - [64, 1024, 1, 512, 96, 96, 544, 1024]
    - [77, 2927.71]
  - - [64, 1024, 1, 1024, 96, 96, 1056, 1056]
    - [68, 3873.32]
  - - [64, 1024, 1, 2048, 96, 96, 2080, 2080]
    - [77, 4632.03]
  - - [64, 1024, 1, 4096, 96, 96, 4128, 4128]
    - [48, 4951.87]
  - - [64, 2048, 1, 64, 96, 96, 96, 2048]
    - [48, 1203.36]
  - - [64, 2048, 1, 128, 96, 96, 160, 2048]
    - [73, 2170.68]
  - - [64, 2048, 1, 256, 96, 96, 288, 2048]
    - [61, 3646.03]
  - - [64, 2048, 1, 512, 96, 96, 544, 2048]
    - [68, 5522.91]
  - - [64, 2048, 1, 1024, 96, 96, 1056, 2048]
    - [77, 7434.25]
  - - [64, 2048, 1, 2048, 96, 96, 2080, 2080]
    - [48, 9040.37]
  - - [64, 2048, 1, 4096, 96, 96, 4128, 4128]
    - [77, 9846.33]
  - - [64, 4096, 1, 64, 96, 96, 96, 4096]
    - [24, 2065.4]
  - - [64, 4096, 1, 128, 96, 96, 160, 4096]
    - [6, 3749.1]
  - - [64, 4096, 1, 256, 96, 96, 288, 4096]
    - [6, 6298.94]
  - - [64, 4096, 1, 512, 96, 96, 544, 4096]
    - [6, 9532.51]
  - - [64, 4096, 1, 1024, 96, 96, 1056, 4096]
    - [37, 12900.6]
  - - [64, 4096, 1, 2048, 96, 96, 2080, 4096]
    - [24, 15701.2]
  - - [64, 4096, 1, 4096, 96, 96, 4128, 4128]
    - [54, 17171.6]
  - - [128, 64, 1, 64, 160, 160, 128, 96]
    - [29, 62.2448]
  - - [128, 64, 1, 128, 160, 160, 160, 160]
    - [4, 113.176]
  - - [128, 64, 1, 256, 160, 160, 288, 288]
    - [38, 187.413]
  - - [128, 64, 1, 512, 160, 160, 544, 544]
    - [9, 289.783]
  - - [128, 64, 1, 1024, 160, 160, 1056, 1056]
    - [49, 413.313]
  - - [128, 64, 1, 2048, 160, 160, 2080, 2080]
    - [67, 525.372]
  - - [128, 64, 1, 4096, 160, 160, 4128, 4128]
    - [67, 588.355]
  - - [128, 128, 1, 64, 160, 160, 128, 128]
    - [12, 160.751]
  - - [128, 128, 1, 128, 160, 160, 160, 160]
    - [29, 290.464]
  - - [128, 128, 1, 256, 160, 160, 288, 288]
    - [27, 472.971]
  - - [128, 128, 1, 512, 160, 160, 544, 544]
    - [40, 689.684]
  - - [128, 128, 1, 1024, 160, 160, 1056, 1056]
    - [62, 947.705]
  - - [128, 128, 1, 2048, 160, 160, 2080, 2080]
    - [49, 1132.03]
  - - [128, 128, 1, 4096, 160, 160, 4128, 4128]
    - [67, 1226.23]
  - - [128, 256, 1, 64, 160, 160, 128, 256]
    - [41, 373.624]
  - - [128, 256, 1, 128, 160, 160, 160, 256]
    - [7, 653.93]
  - - [128, 256, 1, 256, 160, 160, 288, 288]
    - [12, 1044.79]
  - - [128, 256, 1, 512, 160, 160, 544, 544]
    - [67, 1531.47]
  - - [128, 256, 1, 1024, 160, 160, 1056, 1056]
    - [49, 1961.56]
  - - [128, 256, 1, 2048, 160, 160, 2080, 2080]
    - [67, 2342.21]
  - - [128, 256, 1, 4096, 160, 160, 4128, 4128]
    - [78, 2514.9]
  - - [128, 512, 1, 64, 160, 160, 128, 512]
    - [29, 771.867]
  - - [128, 512, 1, 128, 160, 160, 160, 512]
    - [79, 1348.43]
  - - [128, 512, 1, 256, 160, 160, 288, 512]
    - [0, 2110.61]
  - - [128, 512, 1, 512, 160, 160, 544, 544]
    - [78, 3077.83]
  - - [128, 512, 1, 1024, 160, 160, 1056, 1056]
    - [49, 4005.55]
  - - [128, 512, 1, 2048, 160, 160, 2080, 2080]
    - [78, 4763.89]
  - - [128, 512, 1, 4096, 160, 160, 4128, 4128]
    - [48, 5050.15]
  - - [128, 1024, 1, 64, 160, 160, 128, 1024]
    - [76, 1458.63]
  - - [128, 1024, 1, 128, 160, 160, 160, 1024]
    - [51, 2561.41]
  - - [128, 1024, 1, 256, 160, 160, 288, 1024]
    - [78, 4183.32]
  - - [128, 1024, 1, 512, 160, 160, 544, 1024]
    - [49, 6150.57]
  - - [128, 1024, 1, 1024, 160, 160, 1056, 1056]
    - [78, 7856.81]
  - - [128, 1024, 1, 2048, 160, 160, 2080, 2080]
    - [72, 9498.45]
  - - [128, 1024, 1, 4096, 160, 160, 4128, 4128]
    - [67, 10006.9]
  - - [128, 2048, 1, 64, 160, 160, 128, 2048]
    - [55, 2468.69]
  - - [128, 2048, 1, 128, 160, 160, 160, 2048]
    - [62, 4447.24]
  - - [128, 2048, 1, 256, 160, 160, 288, 2048]
    - [69, 7475.67]
  - - [128, 2048, 1, 512, 160, 160, 544, 2048]
    - [49, 11541.6]
  - - [128, 2048, 1, 1024, 160, 160, 1056, 2048]
    - [78, 15324.3]
  - - [128, 2048, 1, 2048, 160, 160, 2080, 2080]
    - [67, 18241.7]
  - - [128, 2048, 1, 4096, 160, 160, 4128, 4128]
    - [49, 19964.0]
  - - [128, 4096, 1, 64, 160, 160, 128, 4096]
    - [36, 4927.95]
  - - [128, 4096, 1, 128, 160, 160, 160, 4096]
    - [18, 7467.35]
  - - [128, 4096, 1, 256, 160, 160, 288, 4096]
    - [48, 14361.0]
  - - [128, 4096, 1, 512, 160, 160, 544, 4096]
    - [78, 22727.6]
  - - [128, 4096, 1, 1024, 160, 160, 1056, 4096]
    - [72, 29735.3]
  - - [128, 4096, 1, 2048, 160, 160, 2080, 4096]
    - [60, 34877.6]
  - - [128, 4096, 1, 4096, 160, 160, 4128, 4128]
    - [72, 35003.8]
  - - [256, 64, 1, 64, 288, 288, 256, 96]
    - [20, 155.322]
  - - [256, 64, 1, 128, 288, 288, 256, 160]
    - [38, 260.225]
  - - [256, 64, 1, 256, 288, 288, 288, 288]
    - [78, 432.313]
  - - [256, 64, 1, 512, 288, 288, 544, 544]
    - [55, 649.223]
  - - [256, 64, 1, 1024, 288, 288, 1056, 1056]
    - [79, 902.196]
  - - [256, 64, 1, 2048, 288, 288, 2080, 2080]
    - [48, 1119.19]
  - - [256, 64, 1, 4096, 288, 288, 4128, 4128]
    - [48, 1206.43]
  - - [256, 128, 1, 64, 288, 288, 256, 128]
    - [42, 354.069]
  - - [256, 128, 1, 128, 288, 288, 256, 160]
    - [10, 621.931]
  - - [256, 128, 1, 256, 288, 288, 288, 288]
    - [74, 1039.48]
  - - [256, 128, 1, 512, 288, 288, 544, 544]
    - [61, 1520.78]
  - - [256, 128, 1, 1024, 288, 288, 1056, 1056]
    - [49, 1985.35]
  - - [256, 128, 1, 2048, 288, 288, 2080, 2080]
    - [60, 2329.93]
  - - [256, 128, 1, 4096, 288, 288, 4128, 4128]
    - [77, 2491.88]
  - - [256, 256, 1, 64, 288, 288, 256, 256]
    - [22, 770.87]
  - - [256, 256, 1, 128, 288, 288, 256, 256]
    - [23, 1347.57]
  - - [256, 256, 1, 256, 288, 288, 288, 288]
    - [61, 2169.0]
  - - [256, 256, 1, 512, 288, 288, 544, 544]
    - [77, 3158.07]
  - - [256, 256, 1, 1024, 288, 288, 1056, 1056]
    - [66, 4069.42]
  - - [256, 256, 1, 2048, 288, 288, 2080, 2080]
    - [60, 4735.82]
  - - [256, 256, 1, 4096, 288, 288, 4128, 4128]
    - [48, 5039.53]
  - - [256, 512, 1, 64, 288, 288, 256, 512]
    - [64, 1438.62]
  - - [256, 512, 1, 128, 288, 288, 256, 512]
    - [73, 2554.0]
  - - [256, 512, 1, 256, 288, 288, 288, 512]
    - [73, 4167.23]
  - - [256, 512, 1, 512, 288, 288, 544, 544]
    - [59, 6116.93]
  - - [256, 512, 1, 1024, 288, 288, 1056, 1056]
    - [60, 7836.62]
  - - [256, 512, 1, 2048, 288, 288, 2080, 2080]
    - [66, 9469.97]
  - - [256, 512, 1, 4096, 288, 288, 4128, 4128]
    - [60, 9954.22]
  - - [256, 1024, 1, 64, 288, 288, 256, 1024]
    - [61, 2458.56]
  - - [256, 1024, 1, 128, 288, 288, 256, 1024]
    - [61, 4421.46]
  - - [256, 1024, 1, 256, 288, 288, 288, 1024]
    - [61, 7397.36]
  - - [256, 1024, 1, 512, 288, 288, 544, 1024]
    - [60, 11170.8]
  - - [256, 1024, 1, 1024, 288, 288, 1056, 1056]
    - [78, 15163.3]
  - - [256, 1024, 1, 2048, 288, 288, 2080, 2080]
    - [50, 18143.1]
  - - [256, 1024, 1, 4096, 288, 288, 4128, 4128]
    - [77, 19584.5]
  - - [256, 2048, 1, 64, 288, 288, 256, 2048]
    - [63, 4585.19]
  - - [256, 2048, 1, 128, 288, 288, 256, 2048]
    - [80, 7421.08]
  - - [256, 2048, 1, 256, 288, 288, 288, 2048]
    - [61, 14439.8]
  - - [256, 2048, 1, 512, 288, 288, 544, 2048]
    - [48, 21096.8]
  - - [256, 2048, 1, 1024, 288, 288, 1056, 2048]
    - [71, 27582.8]
  - - [256, 2048, 1, 2048, 288, 288, 2080, 2080]
    - [48, 33168.9]
  - - [256, 2048, 1, 4096, 288, 288, 4128, 4128]
    - [59, 35456.9]
  - - [256, 4096, 1, 64, 288, 288, 256, 4096]
    - [79, 9041.88]
  - - [256, 4096, 1, 128, 288, 288, 256, 4096]
    - [50, 14906.5]
  - - [256, 4096, 1, 256, 288, 288, 288, 4096]
    - [73, 21718.1]
  - - [256, 4096, 1, 512, 288, 288, 544, 4096]
    - [26, 27834.5]
  - - [256, 4096, 1, 1024, 288, 288, 1056, 4096]
    - [9, 33051.5]
  - - [256, 4096, 1, 2048, 288, 288, 2080, 4096]
    - [8, 35593.3]
  - - [256, 4096, 1, 4096, 288, 288, 4128, 4128]
    - [26, 38502.0]
  - - [384, 64, 1, 64, 416, 416, 384, 96]
    - [13, 242.951]
  - - [384, 64, 1, 128, 416, 416, 384, 160]
    - [14, 415.555]
  - - [384, 64, 1, 256, 416, 416, 384, 288]
    - [49, 654.542]
  - - [384, 64, 1, 512, 416, 416, 544, 544]
    - [54, 1028.44]
  - - [384, 64, 1, 1024, 416, 416, 1056, 1056]
    - [66, 1391.84]
  - - [384, 64, 1, 2048, 416, 416, 2080, 2080]
    - [55, 1679.07]
  - - [384, 64, 1, 4096, 416, 416, 4128, 4128]
    - [48, 1821.93]
  - - [384, 128, 1, 64, 416, 416, 384, 128]
    - [18, 571.327]
  - - [384, 128, 1, 128, 416, 416, 384, 160]
    - [27, 993.601]
  - - [384, 128, 1, 256, 416, 416, 384, 288]
    - [51, 1605.78]
  - - [384, 128, 1, 512, 416, 416, 544, 544]
    - [49, 2332.11]
  - - [384, 128, 1, 1024, 416, 416, 1056, 1056]
    - [78, 2963.82]
  - - [384, 128, 1, 2048, 416, 416, 2080, 2080]
    - [59, 3521.92]
  - - [384, 128, 1, 4096, 416, 416, 4128, 4128]
    - [59, 3760.87]
  - - [384, 256, 1, 64, 416, 416, 384, 256]
    - [74, 1121.87]
  - - [384, 256, 1, 128, 416, 416, 384, 256]
    - [2, 1932.27]
  - - [384, 256, 1, 256, 416, 416, 384, 288]
    - [55, 3073.5]
  - - [384, 256, 1, 512, 416, 416, 544, 544]
    - [67, 4538.47]
  - - [384, 256, 1, 1024, 416, 416, 1056, 1056]
    - [49, 5935.69]
  - - [384, 256, 1, 2048, 416, 416, 2080, 2080]
    - [71, 7048.27]
  - - [384, 256, 1, 4096, 416, 416, 4128, 4128]
    - [60, 7494.44]
  - - [384, 512, 1, 64, 416, 416, 384, 512]
    - [61, 2006.84]
  - - [384, 512, 1, 128, 416, 416, 384, 512]
    - [49, 3571.65]
  - - [384, 512, 1, 256, 416, 416, 384, 512]
    - [55, 5917.19]
  - - [384, 512, 1, 512, 416, 416, 544, 544]
    - [49, 8599.29]
  - - [384, 512, 1, 1024, 416, 416, 1056, 1056]
    - [77, 11625.3]
  - - [384, 512, 1, 2048, 416, 416, 2080, 2080]
    - [60, 13929.3]
  - - [384, 512, 1, 4096, 416, 416, 4128, 4128]
    - [72, 14765.4]
  - - [384, 1024, 1, 64, 416, 416, 384, 1024]
    - [11, 3747.14]
  - - [384, 1024, 1, 128, 416, 416, 384, 1024]
    - [73, 6217.64]
  - - [384, 1024, 1, 256, 416, 416, 384, 1024]
    - [79, 11614.5]
  - - [384, 1024, 1, 512, 416, 416, 544, 1024]
    - [44, 16918.2]
  - - [384, 1024, 1, 1024, 416, 416, 1056, 1056]
    - [33, 21694.7]
  - - [384, 1024, 1, 2048, 416, 416, 2080, 2080]
    - [48, 25704.9]
  - - [384, 1024, 1, 4096, 416, 416, 4128, 4128]
    - [59, 27010.1]
  - - [384, 2048, 1, 64, 416, 416, 384, 2048]
    - [73, 7976.52]
  - - [384, 2048, 1, 128, 416, 416, 384, 2048]
    - [24, 12928.8]
  - - [384, 2048, 1, 256, 416, 416, 384, 2048]
    - [38, 19393.8]
  - - [384, 2048, 1, 512, 416, 416, 544, 2048]
    - [37, 26301.7]
  - - [384, 2048, 1, 1024, 416, 416, 1056, 2048]
    - [38, 32067.3]
  - - [384, 2048, 1, 2048, 416, 416, 2080, 2080]
    - [40, 34583.3]
  - - [384, 2048, 1, 4096, 416, 416, 4128, 4128]
    - [8, 37104.1]
  - - [384, 4096, 1, 64, 416, 416, 384, 4096]
    - [81, 12179.5]
  - - [384, 4096, 1, 128, 416, 416, 384, 4096]
    - [40, 18852.6]
  - - [384, 4096, 1, 256, 416, 416, 384, 4096]
    - [73, 25306.6]
  - - [384, 4096, 1, 512, 416, 416, 544, 4096]
    - [60, 30666.7]
  - - [384, 4096, 1, 1024, 416, 416, 1056, 4096]
    - [50, 33311.6]
  - - [384, 4096, 1, 2048, 416, 416, 2080, 4096]
    - [48, 35958.0]
  - - [384, 4096, 1, 4096, 416, 416, 4128, 4128]
    - [68, 36635.3]
  - - [768, 64, 1, 64, 800, 800, 768, 96]
    - [13, 505.176]
  - - [768, 64, 1, 128, 800, 800, 768, 160]
    - [14, 863.499]
  - - [768, 64, 1, 256, 800, 800, 768, 288]
    - [48, 1380.46]
  - - [768, 64, 1, 512, 800, 800, 768, 544]
    - [48, 2091.06]
  - - [768, 64, 1, 1024, 800, 800, 1056, 1056]
    - [78, 2849.71]
  - - [768, 64, 1, 2048, 800, 800, 2080, 2080]
    - [60, 3433.27]
  - - [768, 64, 1, 4096, 800, 800, 4128, 4128]
    - [59, 3661.69]
  - - [768, 128, 1, 64, 800, 800, 768, 128]
    - [62, 1110.39]
  - - [768, 128, 1, 128, 800, 800, 768, 160]
    - [56, 1951.44]
  - - [768, 128, 1, 256, 800, 800, 768, 288]
    - [62, 3175.1]
  - - [768, 128, 1, 512, 800, 800, 768, 544]
    - [72, 4628.2]
  - - [768, 128, 1, 1024, 800, 800, 1056, 1056]
    - [49, 6002.59]
  - - [768, 128, 1, 2048, 800, 800, 2080, 2080]
    - [72, 7020.5]
  - - [768, 128, 1, 4096, 800, 800, 4128, 4128]
    - [72, 7485.8]
  - - [768, 256, 1, 64, 800, 800, 768, 256]
    - [73, 2001.42]
  - - [768, 256, 1, 128, 800, 800, 768, 256]
    - [51, 3542.99]
  - - [768, 256, 1, 256, 800, 800, 768, 288]
    - [56, 5872.32]
  - - [768, 256, 1, 512, 800, 800, 768, 544]
    - [50, 8530.79]
  - - [768, 256, 1, 1024, 800, 800, 1056, 1056]
    - [48, 11401.4]
  - - [768, 256, 1, 2048, 800, 800, 2080, 2080]
    - [48, 13724.2]
  - - [768, 256, 1, 4096, 800, 800, 4128, 4128]
    - [55, 15041.8]
  - - [768, 512, 1, 64, 800, 800, 768, 512]
    - [2, 3748.82]
  - - [768, 512, 1, 128, 800, 800, 768, 512]
    - [39, 6111.92]
  - - [768, 512, 1, 256, 800, 800, 768, 512]
    - [24, 10137.3]
  - - [768, 512, 1, 512, 800, 800, 768, 544]
    - [54, 15728.6]
  - - [768, 512, 1, 1024, 800, 800, 1056, 1056]
    - [22, 20967.2]
  - - [768, 512, 1, 2048, 800, 800, 2080, 2080]
    - [49, 25606.8]
  - - [768, 512, 1, 4096, 800, 800, 4128, 4128]
    - [49, 26324.1]
  - - [768, 1024, 1, 64, 800, 800, 768, 1024]
    - [77, 7600.7]
  - - [768, 1024, 1, 128, 800, 800, 768, 1024]
    - [39, 12523.4]
  - - [768, 1024, 1, 256, 800, 800, 768, 1024]
    - [24, 19886.1]
  - - [768, 1024, 1, 512, 800, 800, 768, 1024]
    - [24, 26775.8]
  - - [768, 1024, 1, 1024, 800, 800, 1056, 1056]
    - [17, 32280.7]
  - - [768, 1024, 1, 2048, 800, 800, 2080, 2080]
    - [39, 34310.8]
  - - [768, 1024, 1, 4096, 800, 800, 4128, 4128]
    - [26, 37191.5]
  - - [768, 2048, 1, 64, 800, 800, 768, 2048]
    - [77, 11795.6]
  - - [768, 2048, 1, 128, 800, 800, 768, 2048]
    - [73, 19079.5]
  - - [768, 2048, 1, 256, 800, 800, 768, 2048]
    - [73, 25839.3]
  - - [768, 2048, 1, 512, 800, 800, 768, 2048]
    - [59, 31127.8]
  - - [768, 2048, 1, 1024, 800, 800, 1056, 2048]
    - [2, 33297.1]
  - - [768, 2048, 1, 2048, 800, 800, 2080, 2080]
    - [71, 36502.0]
  - - [768, 2048, 1, 4096, 800, 800, 4128, 4128]
    - [71, 38152.0]
  - - [768, 4096, 1, 64, 800, 800, 768, 4096]
    - [81, 16746.5]
  - - [768, 4096, 1, 128, 800, 800, 768, 4096]
    - [61, 24034.8]
  - - [768, 4096, 1, 256, 800, 800, 768, 4096]
    - [71, 30200.9]
  - - [768, 4096, 1, 512, 800, 800, 768, 4096]
    - [26, 33339.1]
  - - [768, 4096, 1, 1024, 800, 800, 1056, 4096]
    - [26, 36892.0]
  - - [768, 4096, 1, 2048, 800, 800, 2080, 4096]
    - [26, 38878.4]
  - - [768, 4096, 1, 4096, 800, 800, 4128, 4128]
    - [40, 39582.1]
  - - [1536, 64, 1, 64, 1568, 1568, 1536, 96]
    - [2, 947.081]
  - - [1536, 64, 1, 128, 1568, 1568, 1536, 160]
    - [50, 1670.37]
  - - [1536, 64, 1, 256, 1568, 1568, 1536, 288]
    - [54, 2804.93]
  - - [1536, 64, 1, 512, 1568, 1568, 1536, 544]
    - [59, 4234.18]
  - - [1536, 64, 1, 1024, 1568, 1568, 1536, 1056]
    - [77, 5631.51]
  - - [1536, 64, 1, 2048, 1568, 1568, 2080, 2080]
    - [71, 6717.16]
  - - [1536, 64, 1, 4096, 1568, 1568, 4128, 4128]
    - [77, 7358.7]
  - - [1536, 128, 1, 64, 1568, 1568, 1536, 128]
    - [9, 1962.09]
  - - [1536, 128, 1, 128, 1568, 1568, 1536, 160]
    - [10, 3492.83]
  - - [1536, 128, 1, 256, 1568, 1568, 1536, 288]
    - [61, 5653.97]
  - - [1536, 128, 1, 512, 1568, 1568, 1536, 544]
    - [78, 8494.09]
  - - [1536, 128, 1, 1024, 1568, 1568, 1536, 1056]
    - [48, 11357.7]
  - - [1536, 128, 1, 2048, 1568, 1568, 2080, 2080]
    - [78, 13691.0]
  - - [1536, 128, 1, 4096, 1568, 1568, 4128, 4128]
    - [78, 14899.9]
  - - [1536, 256, 1, 64, 1568, 1568, 1536, 256]
    - [2, 3742.69]
  - - [1536, 256, 1, 128, 1568, 1568, 1536, 256]
    - [26, 6331.82]
  - - [1536, 256, 1, 256, 1568, 1568, 1536, 288]
    - [39, 10391.6]
  - - [1536, 256, 1, 512, 1568, 1568, 1536, 544]
    - [28, 16107.4]
  - - [1536, 256, 1, 1024, 1568, 1568, 1536, 1056]
    - [48, 21539.2]
  - - [1536, 256, 1, 2048, 1568, 1568, 2080, 2080]
    - [26, 24863.6]
  - - [1536, 256, 1, 4096, 1568, 1568, 4128, 4128]
    - [31, 26156.5]
  - - [1536, 512, 1, 64, 1568, 1568, 1536, 512]
    - [73, 8018.46]
  - - [1536, 512, 1, 128, 1568, 1568, 1536, 512]
    - [61, 13105.5]
  - - [1536, 512, 1, 256, 1568, 1568, 1536, 512]
    - [24, 19872.4]
  - - [1536, 512, 1, 512, 1568, 1568, 1536, 544]
    - [37, 26899.2]
  - - [1536, 512, 1, 1024, 1568, 1568, 1536, 1056]
    - [8, 31927.5]
  - - [1536, 512, 1, 2048, 1568, 1568, 2080, 2080]
    - [37, 34203.6]
  - - [1536, 512, 1, 4096, 1568, 1568, 4128, 4128]
    - [8, 37215.5]
  - - [1536, 1024, 1, 64, 1568, 1568, 1536, 1024]
    - [79, 11781.8]
  - - [1536, 1024, 1, 128, 1568, 1568, 1536, 1024]
    - [79, 19117.6]
  - - [1536, 1024, 1, 256, 1568, 1568, 1536, 1024]
    - [46, 25847.6]
  - - [1536, 1024, 1, 512, 1568, 1568, 1536, 1024]
    - [21, 30898.5]
  - - [1536, 1024, 1, 1024, 1568, 1568, 1536, 1056]
    - [34, 33435.4]
  - - [1536, 1024, 1, 2048, 1568, 1568, 2080, 2080]
    - [71, 36434.3]
  - - [1536, 1024, 1, 4096, 1568, 1568, 4128, 4128]
    - [71, 38210.3]
  - - [1536, 2048, 1, 64, 1568, 1568, 1536, 2048]
    - [75, 16816.5]
  - - [1536, 2048, 1, 128, 1568, 1568, 1536, 2048]
    - [59, 24024.7]
  - - [1536, 2048, 1, 256, 1568, 1568, 1536, 2048]
    - [61, 30174.8]
  - - [1536, 2048, 1, 512, 1568, 1568, 1536, 2048]
    - [73, 33507.0]
  - - [1536, 2048, 1, 1024, 1568, 1568, 1536, 2048]
    - [27, 36943.2]
  - - [1536, 2048, 1, 2048, 1568, 1568, 2080, 2080]
    - [27, 38954.3]
  - - [1536, 2048, 1, 4096, 1568, 1568, 4128, 4128]
    - [9, 39796.6]
  - - [1536, 4096, 1, 64, 1568, 1568, 1536, 4096]
    - [75, 21348.5]
  - - [1536, 4096, 1, 128, 1568, 1568, 1536, 4096]
    - [73, 28464.1]
  - - [1536, 4096, 1, 256, 1568, 1568, 1536, 4096]
    - [46, 32408.7]
  - - [1536, 4096, 1, 512, 1568, 1568, 1536, 4096]
    - [39, 36787.1]
  - - [1536, 4096, 1, 1024, 1568, 1568, 1536, 4096]
    - [26, 39067.0]
  - - [1536, 4096, 1, 2048, 1568, 1568, 2080, 4096]
    - [71, 39153.4]
  - - [1536, 4096, 1, 4096, 1568, 1568, 4128, 4128]
    - [8, 39715.5]
  - - [3072, 64, 1, 64, 3104, 3104, 3072, 96]
    - [4, 1768.51]
  - - [3072, 64, 1, 128, 3104, 3104, 3072, 160]
    - [45, 3140.23]
  - - [3072, 64, 1, 256, 3104, 3104, 3072, 288]
    - [24, 5187.77]
  - - [3072, 64, 1, 512, 3104, 3104, 3072, 544]
    - [6, 7705.4]
  - - [3072, 64, 1, 1024, 3104, 3104, 3072, 1056]
    - [37, 10029.2]
  - - [3072, 64, 1, 2048, 3104, 3104, 3072, 2080]
    - [26, 11978.4]
  - - [3072, 64, 1, 4096, 3104, 3104, 4128, 4128]
    - [17, 12881.2]
  - - [3072, 128, 1, 64, 3104, 3104, 3072, 128]
    - [30, 3765.65]
  - - [3072, 128, 1, 128, 3104, 3104, 3072, 160]
    - [18, 6083.11]
  - - [3072, 128, 1, 256, 3104, 3104, 3072, 288]
    - [27, 9996.38]
  - - [3072, 128, 1, 512, 3104, 3104, 3072, 544]
    - [46, 16366.7]
  - - [3072, 128, 1, 1024, 3104, 3104, 3072, 1056]
    - [8, 21266.2]
  - - [3072, 128, 1, 2048, 3104, 3104, 3072, 2080]
    - [8, 24924.4]
  - - [3072, 128, 1, 4096, 3104, 3104, 4128, 4128]
    - [32, 26196.5]
  - - [3072, 256, 1, 64, 3104, 3104, 3072, 256]
    - [61, 7920.04]
  - - [3072, 256, 1, 128, 3104, 3104, 3072, 256]
    - [39, 13041.0]
  - - [3072, 256, 1, 256, 3104, 3104, 3072, 288]
    - [25, 19850.8]
  - - [3072, 256, 1, 512, 3104, 3104, 3072, 544]
    - [38, 26351.6]
  - - [3072, 256, 1, 1024, 3104, 3104, 3072, 1056]
    - [16, 31923.7]
  - - [3072, 256, 1, 2048, 3104, 3104, 3072, 2080]
    - [37, 34469.3]
  - - [3072, 256, 1, 4096, 3104, 3104, 4128, 4128]
    - [8, 37234.0]
  - - [3072, 512, 1, 64, 3104, 3104, 3072, 512]
    - [64, 12213.5]
  - - [3072, 512, 1, 128, 3104, 3104, 3072, 512]
    - [68, 19081.3]
  - - [3072, 512, 1, 256, 3104, 3104, 3072, 512]
    - [15, 25816.1]
  - - [3072, 512, 1, 512, 3104, 3104, 3072, 544]
    - [61, 30738.1]
  - - [3072, 512, 1, 1024, 3104, 3104, 3072, 1056]
    - [79, 33456.2]
  - - [3072, 512, 1, 2048, 3104, 3104, 3072, 2080]
    - [60, 36115.7]
  - - [3072, 512, 1, 4096, 3104, 3104, 4128, 4128]
    - [59, 37885.0]
  - - [3072, 1024, 1, 64, 3104, 3104, 3072, 1024]
    - [64, 16731.2]
  - - [3072, 1024, 1, 128, 3104, 3104, 3072, 1024]
    - [71, 24119.7]
  - - [3072, 1024, 1, 256, 3104, 3104, 3072, 1024]
    - [79, 30248.5]
  - - [3072, 1024, 1, 512, 3104, 3104, 3072, 1024]
    - [47, 33607.0]
  - - [3072, 1024, 1, 1024, 3104, 3104, 3072, 1056]
    - [8, 36806.5]
  - - [3072, 1024, 1, 2048, 3104, 3104, 3072, 2080]
    - [8, 38860.1]
  - - [3072, 1024, 1, 4096, 3104, 3104, 4128, 4128]
    - [9, 39798.1]
  - - [3072, 2048, 1, 64, 3104, 3104, 3072, 2048]
    - [75, 21318.0]
  - - [3072, 2048, 1, 128, 3104, 3104, 3072, 2048]
    - [77, 28415.9]
  - - [3072, 2048, 1, 256, 3104, 3104, 3072, 2048]
    - [39, 32521.9]
  - - [3072, 2048, 1, 512, 3104, 3104, 3072, 2048]
    - [26, 36773.7]
  - - [3072, 2048, 1, 1024, 3104, 3104, 3072, 2048]
    - [40, 39002.4]
  - - [3072, 2048, 1, 2048, 3104, 3104, 3072, 2080]
    - [60, 39209.6]
  - - [3072, 2048, 1, 4096, 3104, 3104, 4128, 4128]
    - [26, 39950.9]
  - - [3072, 4096, 1, 64, 3104, 3104, 3072, 4096]
    - [53, 6862.26]
  - - [3072, 4096, 1, 128, 3104, 3104, 3072, 4096]
    - [53, 12876.3]
  - - [3072, 4096, 1, 256, 3104, 3104, 3072, 4096]
    - [53, 23076.2]
  - - [3072, 4096, 1, 512, 3104, 3104, 3072, 4096]
    - [40, 34836.5]
  - - [3072, 4096, 1, 1024, 3104, 3104, 3072, 4096]
    - [25, 38469.0]
  - - [3072, 4096, 1, 2048, 3104, 3104, 3072, 4096]
    - [39, 40068.0]
  - - [3072, 4096, 1, 4096, 3104, 3104, 4128, 4128]
    - [26, 40246.6]
  - - [4096, 64, 1, 64, 4128, 4128, 4096, 96]
    - [43, 2248.66]
  - - [4096, 64, 1, 128, 4128, 4128, 4096, 160]
    - [0, 4086.52]
  - - [4096, 64, 1, 256, 4128, 4128, 4096, 288]
    - [77, 6752.09]
  - - [4096, 64, 1, 512, 4128, 4128, 4096, 544]
    - [77, 10108.3]
  - - [4096, 64, 1, 1024, 4128, 4128, 4096, 1056]
    - [6, 13353.0]
  - - [4096, 64, 1, 2048, 4128, 4128, 4096, 2080]
    - [6, 15962.6]
  - - [4096, 64, 1, 4096, 4128, 4128, 4128, 4128]
    - [45, 16985.0]
  - - [4096, 128, 1, 64, 4128, 4128, 4096, 128]
    - [35, 5693.95]
  - - [4096, 128, 1, 128, 4128, 4128, 4096, 160]
    - [1, 8636.95]
  - - [4096, 128, 1, 256, 4128, 4128, 4096, 288]
    - [26, 14180.4]
  - - [4096, 128, 1, 512, 4128, 4128, 4096, 544]
    - [61, 21198.4]
  - - [4096, 128, 1, 1024, 4128, 4128, 4096, 1056]
    - [47, 28723.5]
  - - [4096, 128, 1, 2048, 4128, 4128, 4096, 2080]
    - [8, 33544.0]
  - - [4096, 128, 1, 4096, 4128, 4128, 4128, 4128]
    - [8, 34958.8]
  - - [4096, 256, 1, 64, 4128, 4128, 4096, 256]
    - [77, 9707.63]
  - - [4096, 256, 1, 128, 4128, 4128, 4096, 256]
    - [50, 15822.0]
  - - [4096, 256, 1, 256, 4128, 4128, 4096, 288]
    - [61, 22295.3]
  - - [4096, 256, 1, 512, 4128, 4128, 4096, 544]
    - [25, 28417.9]
  - - [4096, 256, 1, 1024, 4128, 4128, 4096, 1056]
    - [8, 33036.2]
  - - [4096, 256, 1, 2048, 4128, 4128, 4096, 2080]
    - [26, 35523.8]
  - - [4096, 256, 1, 4096, 4128, 4128, 4128, 4128]
    - [9, 38749.7]
  - - [4096, 512, 1, 64, 4128, 4128, 4096, 512]
    - [70, 13761.7]
  - - [4096, 512, 1, 128, 4128, 4128, 4096, 512]
    - [50, 20922.5]
  - - [4096, 512, 1, 256, 4128, 4128, 4096, 512]
    - [61, 27401.2]
  - - [4096, 512, 1, 512, 4128, 4128, 4096, 544]
    - [59, 32510.1]
  - - [4096, 512, 1, 1024, 4128, 4128, 4096, 1056]
    - [39, 35154.5]
  - - [4096, 512, 1, 2048, 4128, 4128, 4096, 2080]
    - [8, 37819.2]
  - - [4096, 512, 1, 4096, 4128, 4128, 4128, 4128]
    - [27, 39756.8]
  - - [4096, 1024, 1, 64, 4128, 4128, 4096, 1024]
    - [75, 18664.7]
  - - [4096, 1024, 1, 128, 4128, 4128, 4096, 1024]
    - [71, 26076.9]
  - - [4096, 1024, 1, 256, 4128, 4128, 4096, 1024]
    - [73, 31845.8]
  - - [4096, 1024, 1, 512, 4128, 4128, 4096, 1024]
    - [46, 35125.2]
  - - [4096, 1024, 1, 1024, 4128, 4128, 4096, 1056]
    - [8, 37834.5]
  - - [4096, 1024, 1, 2048, 4128, 4128, 4096, 2080]
    - [39, 39550.7]
  - - [4096, 1024, 1, 4096, 4128, 4128, 4128, 4128]
    - [26, 40028.1]
  - - [4096, 2048, 1, 64, 4128, 4128, 4096, 2048]
    - [76, 22394.8]
  - - [4096, 2048, 1, 128, 4128, 4128, 4096, 2048]
    - [73, 29770.8]
  - - [4096, 2048, 1, 256, 4128, 4128, 4096, 2048]
    - [46, 33621.7]
  - - [4096, 2048, 1, 512, 4128, 4128, 4096, 2048]
    - [46, 37010.3]
  - - [4096, 2048, 1, 1024, 4128, 4128, 4096, 2048]
    - [47, 38908.1]
  - - [4096, 2048, 1, 2048, 4128, 4128, 4096, 2080]
    - [26, 39496.0]
  - - [4096, 2048, 1, 4096, 4128, 4128, 4128, 4128]
    - [8, 39951.5]
  - - [4096, 4096, 1, 64, 4128, 4128, 4096, 4096]
    - [58, 7088.68]
  - - [4096, 4096, 1, 128, 4128, 4128, 4096, 4096]
    - [52, 13399.6]
  - - [4096, 4096, 1, 256, 4128, 4128, 4096, 4096]
    - [65, 24382.5]
  - - [4096, 4096, 1, 512, 4128, 4128, 4096, 4096]
    - [38, 36186.0]
  - - [4096, 4096, 1, 1024, 4128, 4128, 4096, 4096]
    - [40, 38939.5]
  - - [4096, 4096, 1, 2048, 4128, 4128, 4096, 4096]
    - [46, 39122.0]
  - - [4096, 4096, 1, 4096, 4128, 4128, 4128, 4128]
    - [26, 40501.1]
- null
- null
- DeviceEfficiency
