library/src/blas3/Tensile/Logic/asm_full/navi33/navi33_Cijk_Ailk_Bljk_BBS_BH.yaml
- {MinimumRequiredVersion: 4.35.0}
- navi33
- gfx1102
- [Device 73f0]
    SolutionIndex: 0
    SolutionNameMin: Cijk_Ailk_Bljk_BBS_BH_MT128x128x16_MI16x16x16x1_SN_1LDSB0_GRVW4_PLR0_SIA1_SVW4_VW4_WGM1
    SolutionIndex: 1
    SolutionNameMin: Cijk_Ailk_Bljk_BBS_BH_MT128x128x16_MI16x16x16x1_SN_1LDSB0_GRVW8_PLR0_SIA1_SVW2_VW2_WGM1
    SolutionIndex: 2
    SolutionNameMin: Cijk_Ailk_Bljk_BBS_BH_MT128x128x16_MI16x16x16x1_SN_1LDSB0_GRVW8_PLR0_SIA1_SVW4_VW4_WGM1
    SolutionIndex: 3
    SolutionNameMin: Cijk_Ailk_Bljk_BBS_BH_MT128x128x16_MI16x16x16x1_SN_1LDSB0_GRVW4_PLR1_SIA1_SVW4_VW4_WGM1
    SolutionIndex: 4
    SolutionNameMin: Cijk_Ailk_Bljk_BBS_BH_MT128x128x16_MI16x16x16x1_SN_1LDSB0_GRVW8_PLR1_SIA1_SVW2_VW2_WGM1
    SolutionIndex: 5
    SolutionNameMin: Cijk_Ailk_Bljk_BBS_BH_MT128x128x16_MI16x16x16x1_SN_1LDSB0_GRVW8_PLR1_SIA1_SVW4_VW4_WGM1
    SolutionIndex: 6
    SolutionNameMin: Cijk_Ailk_Bljk_BBS_BH_MT128x128x16_MI16x16x16x1_SN_1LDSB1_GRVW4_PLR1_SIA2_SVW2_VW2_WGM1
    SolutionIndex: 7
    SolutionNameMin: Cijk_Ailk_Bljk_BBS_BH_MT128x128x16_MI16x16x16x1_SN_1LDSB1_GRVW4_PLR1_SIA2_SVW4_VW4_WGM1
    SolutionIndex: 8
    SolutionNameMin: Cijk_Ailk_Bljk_BBS_BH_MT128x128x16_MI16x16x16x1_SN_1LDSB1_GRVW8_PLR1_SIA2_SVW2_VW2_WGM1
    SolutionIndex: 9
    SolutionNameMin: Cijk_Ailk_Bljk_BBS_BH_MT128x128x16_MI16x16x16x1_SN_1LDSB1_GRVW8_PLR1_SIA2_SVW4_VW4_WGM1
    SolutionIndex: 10
    SolutionNameMin: Cijk_Ailk_Bljk_BBS_BH_MT128x128x16_MI16x16x16x1_SN_1LDSB0_GRVW8_PLR0_SIA3_SVW2_VW2_WGM1
    SolutionIndex: 11
    SolutionNameMin: Cijk_Ailk_Bljk_BBS_BH_MT128x128x16_MI16x16x16x1_SN_1LDSB0_GRVW8_PLR0_SIA3_SVW4_VW4_WGM1
    SolutionIndex: 12
    SolutionNameMin: Cijk_Ailk_Bljk_BBS_BH_MT128x128x16_MI16x16x16x1_SN_1LDSB0_GRVW8_PLR1_SIA3_SVW4_VW4_WGM1
    SolutionIndex: 13
    SolutionNameMin: Cijk_Ailk_Bljk_BBS_BH_MT128x128x16_MI16x16x16x1_SN_1LDSB0_GRVW8_PLR0_SIA1_SVW2_VW2_WGM4
    SolutionIndex: 14
    SolutionNameMin: Cijk_Ailk_Bljk_BBS_BH_MT128x128x16_MI16x16x16x1_SN_1LDSB0_GRVW8_PLR0_SIA1_SVW4_VW4_WGM4
    SolutionIndex: 15
    SolutionNameMin: Cijk_Ailk_Bljk_BBS_BH_MT128x128x16_MI16x16x16x1_SN_1LDSB0_GRVW4_PLR1_SIA1_SVW2_VW2_WGM4
    SolutionIndex: 16
    SolutionNameMin: Cijk_Ailk_Bljk_BBS_BH_MT128x128x16_MI16x16x16x1_SN_1LDSB0_GRVW4_PLR1_SIA1_SVW4_VW4_WGM4
    SolutionIndex: 17
    SolutionNameMin: Cijk_Ailk_Bljk_BBS_BH_MT128x128x16_MI16x16x16x1_SN_1LDSB0_GRVW8_PLR1_SIA1_SVW2_VW2_WGM4
    SolutionIndex: 18
    SolutionNameMin: Cijk_Ailk_Bljk_BBS_BH_MT128x128x16_MI16x16x16x1_SN_1LDSB0_GRVW8_PLR1_SIA1_SVW4_VW4_WGM4
    SolutionIndex: 19
    SolutionNameMin: Cijk_Ailk_Bljk_BBS_BH_MT128x128x16_MI16x16x16x1_SN_1LDSB1_GRVW4_PLR1_SIA2_SVW2_VW2_WGM4
    SolutionIndex: 20
    SolutionNameMin: Cijk_Ailk_Bljk_BBS_BH_MT128x128x16_MI16x16x16x1_SN_1LDSB1_GRVW4_PLR1_SIA2_SVW4_VW4_WGM4
    SolutionIndex: 21
    SolutionNameMin: Cijk_Ailk_Bljk_BBS_BH_MT128x128x16_MI16x16x16x1_SN_1LDSB1_GRVW8_PLR1_SIA2_SVW2_VW2_WGM4
    SolutionIndex: 22
    SolutionNameMin: Cijk_Ailk_Bljk_BBS_BH_MT128x128x16_MI16x16x16x1_SN_1LDSB1_GRVW8_PLR1_SIA2_SVW4_VW4_WGM4
    SolutionIndex: 23
    SolutionNameMin: Cijk_Ailk_Bljk_BBS_BH_MT128x128x16_MI16x16x16x1_SN_1LDSB0_GRVW8_PLR0_SIA3_SVW2_VW2_WGM4
    SolutionIndex: 24
    SolutionNameMin: Cijk_Ailk_Bljk_BBS_BH_MT128x128x16_MI16x16x16x1_SN_1LDSB0_GRVW8_PLR0_SIA3_SVW4_VW4_WGM4
    SolutionIndex: 25
    SolutionNameMin: Cijk_Ailk_Bljk_BBS_BH_MT128x128x16_MI16x16x16x1_SN_1LDSB0_GRVW8_PLR1_SIA3_SVW2_VW2_WGM4
    SolutionIndex: 26
    SolutionNameMin: Cijk_Ailk_Bljk_BBS_BH_MT128x128x16_MI16x16x16x1_SN_1LDSB0_GRVW8_PLR1_SIA3_SVW4_VW4_WGM4
    SolutionIndex: 27
    SolutionNameMin: Cijk_Ailk_Bljk_BBS_BH_MT128x128x16_MI16x16x16x1_SN_1LDSB0_GRVW4_PLR0_SIA1_SVW4_VW4_WGM8
    SolutionIndex: 28
    SolutionNameMin: Cijk_Ailk_Bljk_BBS_BH_MT128x128x16_MI16x16x16x1_SN_1LDSB0_GRVW8_PLR0_SIA1_SVW4_VW4_WGM8
    SolutionIndex: 29
    SolutionNameMin: Cijk_Ailk_Bljk_BBS_BH_MT128x128x16_MI16x16x16x1_SN_1LDSB0_GRVW4_PLR1_SIA1_SVW4_VW4_WGM8
    SolutionIndex: 30
    SolutionNameMin: Cijk_Ailk_Bljk_BBS_BH_MT128x128x16_MI16x16x16x1_SN_1LDSB0_GRVW8_PLR1_SIA1_SVW2_VW2_WGM8
    SolutionIndex: 31
    SolutionNameMin: Cijk_Ailk_Bljk_BBS_BH_MT128x128x16_MI16x16x16x1_SN_1LDSB0_GRVW8_PLR1_SIA1_SVW4_VW4_WGM8
    SolutionIndex: 32
    SolutionNameMin: Cijk_Ailk_Bljk_BBS_BH_MT128x128x16_MI16x16x16x1_SN_1LDSB1_GRVW4_PLR1_SIA2_SVW2_VW2_WGM8
    SolutionIndex: 33
    SolutionNameMin: Cijk_Ailk_Bljk_BBS_BH_MT128x128x16_MI16x16x16x1_SN_1LDSB1_GRVW8_PLR1_SIA2_SVW2_VW2_WGM8
    SolutionIndex: 34
    SolutionNameMin: Cijk_Ailk_Bljk_BBS_BH_MT128x128x16_MI16x16x16x1_SN_1LDSB1_GRVW8_PLR1_SIA2_SVW4_VW4_WGM8
    SolutionIndex: 35
    SolutionNameMin: Cijk_Ailk_Bljk_BBS_BH_MT128x128x16_MI16x16x16x1_SN_1LDSB0_GRVW8_PLR0_SIA3_SVW2_VW2_WGM8
    SolutionIndex: 36
    SolutionNameMin: Cijk_Ailk_Bljk_BBS_BH_MT128x128x16_MI16x16x16x1_SN_1LDSB0_GRVW8_PLR1_SIA3_SVW2_VW2_WGM8
    SolutionIndex: 37
    SolutionNameMin: Cijk_Ailk_Bljk_BBS_BH_MT128x128x16_MI16x16x16x1_SN_1LDSB0_GRVW8_PLR1_SIA3_SVW4_VW4_WGM8
    SolutionIndex: 38
    SolutionNameMin: Cijk_Ailk_Bljk_BBS_BH_MT128x128x32_MI16x16x16x1_SN_1LDSB0_GRVW4_PLR0_SIA1_SVW2_VW2_WGM1
    SolutionIndex: 39
    SolutionNameMin: Cijk_Ailk_Bljk_BBS_BH_MT128x128x32_MI16x16x16x1_SN_1LDSB0_GRVW4_PLR0_SIA1_SVW4_VW4_WGM1
    SolutionIndex: 40
    SolutionNameMin: Cijk_Ailk_Bljk_BBS_BH_MT128x128x32_MI16x16x16x1_SN_1LDSB0_GRVW8_PLR0_SIA1_SVW2_VW2_WGM1
    SolutionIndex: 41
    SolutionNameMin: Cijk_Ailk_Bljk_BBS_BH_MT128x128x32_MI16x16x16x1_SN_1LDSB0_GRVW8_PLR0_SIA1_SVW4_VW4_WGM1
    SolutionIndex: 42
    SolutionNameMin: Cijk_Ailk_Bljk_BBS_BH_MT128x128x32_MI16x16x16x1_SN_1LDSB0_GRVW4_PLR0_SIA1_SVW4_VW4_WGM4
    SolutionIndex: 43
    SolutionNameMin: Cijk_Ailk_Bljk_BBS_BH_MT128x128x32_MI16x16x16x1_SN_1LDSB0_GRVW8_PLR0_SIA1_SVW2_VW2_WGM4
    SolutionIndex: 44
    SolutionNameMin: Cijk_Ailk_Bljk_BBS_BH_MT128x128x32_MI16x16x16x1_SN_1LDSB0_GRVW8_PLR0_SIA1_SVW4_VW4_WGM4
    SolutionIndex: 45
    SolutionNameMin: Cijk_Ailk_Bljk_BBS_BH_MT128x128x32_MI16x16x16x1_SN_1LDSB0_GRVW8_PLR0_SIA3_SVW2_VW2_WGM4
    SolutionIndex: 46
    SolutionNameMin: Cijk_Ailk_Bljk_BBS_BH_MT128x128x32_MI16x16x16x1_SN_1LDSB0_GRVW4_PLR0_SIA1_SVW2_VW2_WGM8
    SolutionIndex: 47
    SolutionNameMin: Cijk_Ailk_Bljk_BBS_BH_MT128x128x32_MI16x16x16x1_SN_1LDSB0_GRVW4_PLR0_SIA1_SVW4_VW4_WGM8
    SolutionIndex: 48
    SolutionNameMin: Cijk_Ailk_Bljk_BBS_BH_MT128x128x32_MI16x16x16x1_SN_1LDSB0_GRVW8_PLR0_SIA1_SVW2_VW2_WGM8
    SolutionIndex: 49
    SolutionNameMin: Cijk_Ailk_Bljk_BBS_BH_MT128x128x32_MI16x16x16x1_SN_1LDSB0_GRVW8_PLR0_SIA1_SVW4_VW4_WGM8
- - - [64, 64, 1, 64, 96, 96, 96, 96]
    - [2, 31.5455]
  - - [64, 64, 1, 128, 96, 96, 160, 160]
    - [18, 58.1573]
  - - [64, 64, 1, 256, 96, 96, 288, 288]
    - [2, 92.6138]
  - - [64, 64, 1, 512, 96, 96, 544, 544]
    - [41, 148.408]
  - - [64, 64, 1, 1024, 96, 96, 1056, 1056]
    - [49, 214.872]
  - - [64, 64, 1, 2048, 96, 96, 2080, 2080]
    - [41, 275.406]
  - - [64, 64, 1, 4096, 96, 96, 4128, 4128]
    - [41, 308.15]
  - - [64, 128, 1, 64, 96, 96, 96, 96]
    - [5, 55.8823]
  - - [64, 128, 1, 128, 96, 96, 160, 160]
    - [31, 103.635]
  - - [64, 128, 1, 256, 96, 96, 288, 288]
    - [22, 179.998]
  - - [64, 128, 1, 512, 96, 96, 544, 544]
    - [41, 290.042]
  - - [64, 128, 1, 1024, 96, 96, 1056, 1056]
    - [41, 422.579]
  - - [64, 128, 1, 2048, 96, 96, 2080, 2080]
    - [41, 545.885]
  - - [64, 128, 1, 4096, 96, 96, 4128, 4128]
    - [41, 615.982]
  - - [64, 256, 1, 64, 96, 96, 96, 96]
    - [5, 128.96]
  - - [64, 256, 1, 128, 96, 96, 160, 160]
    - [21, 235.053]
  - - [64, 256, 1, 256, 96, 96, 288, 288]
    - [22, 405.128]
  - - [64, 256, 1, 512, 96, 96, 544, 544]
    - [41, 646.222]
  - - [64, 256, 1, 1024, 96, 96, 1056, 1056]
    - [44, 910.517]
  - - [64, 256, 1, 2048, 96, 96, 2080, 2080]
    - [49, 1146.1]
  - - [64, 256, 1, 4096, 96, 96, 4128, 4128]
    - [44, 1274.98]
  - - [64, 512, 1, 64, 96, 96, 96, 96]
    - [31, 288.268]
  - - [64, 512, 1, 128, 96, 96, 160, 160]
    - [34, 526.46]
  - - [64, 512, 1, 256, 96, 96, 288, 288]
    - [44, 896.506]
  - - [64, 512, 1, 512, 96, 96, 544, 544]
    - [41, 1400.79]
  - - [64, 512, 1, 1024, 96, 96, 1056, 1056]
    - [39, 1890.07]
  - - [64, 512, 1, 2048, 96, 96, 2080, 2080]
    - [44, 2351.15]
  - - [64, 512, 1, 4096, 96, 96, 4128, 4128]
    - [44, 2575.12]
  - - [64, 1024, 1, 64, 96, 96, 96, 96]
    - [34, 571.429]
  - - [64, 1024, 1, 128, 96, 96, 160, 160]
    - [41, 1047.92]
  - - [64, 1024, 1, 256, 96, 96, 288, 288]
    - [39, 1793.01]
  - - [64, 1024, 1, 512, 96, 96, 544, 544]
    - [41, 2791.32]
  - - [64, 1024, 1, 1024, 96, 96, 1056, 1056]
    - [42, 3852.4]
  - - [64, 1024, 1, 2048, 96, 96, 2080, 2080]
    - [39, 4840.68]
  - - [64, 1024, 1, 4096, 96, 96, 4128, 4128]
    - [41, 5274.3]
  - - [64, 2048, 1, 64, 96, 96, 96, 96]
    - [9, 1141.0]
  - - [64, 2048, 1, 128, 96, 96, 160, 160]
    - [41, 2085.94]
  - - [64, 2048, 1, 256, 96, 96, 288, 288]
    - [44, 3573.04]
  - - [64, 2048, 1, 512, 96, 96, 544, 544]
    - [41, 5542.98]
  - - [64, 2048, 1, 1024, 96, 96, 1056, 1056]
    - [44, 7771.73]
  - - [64, 2048, 1, 2048, 96, 96, 2080, 2080]
    - [49, 9778.7]
  - - [64, 2048, 1, 4096, 96, 96, 4128, 4128]
    - [46, 10868.9]
  - - [64, 4096, 1, 64, 96, 96, 96, 96]
    - [34, 2055.78]
  - - [64, 4096, 1, 128, 96, 96, 160, 160]
    - [33, 3798.32]
  - - [64, 4096, 1, 256, 96, 96, 288, 288]
    - [33, 6475.81]
  - - [64, 4096, 1, 512, 96, 96, 544, 544]
    - [33, 10103.7]
  - - [64, 4096, 1, 1024, 96, 96, 1056, 1056]
    - [7, 14055.7]
  - - [64, 4096, 1, 2048, 96, 96, 2080, 2080]
    - [33, 17325.1]
  - - [64, 4096, 1, 4096, 96, 96, 4128, 4128]
    - [34, 18171.0]
  - - [128, 64, 1, 64, 160, 160, 128, 96]
    - [5, 63.5655]
  - - [128, 64, 1, 128, 160, 160, 160, 160]
    - [5, 118.698]
  - - [128, 64, 1, 256, 160, 160, 288, 288]
    - [2, 188.677]
  - - [128, 64, 1, 512, 160, 160, 544, 544]
    - [49, 297.025]
  - - [128, 64, 1, 1024, 160, 160, 1056, 1056]
    - [43, 425.537]
  - - [128, 64, 1, 2048, 160, 160, 2080, 2080]
    - [49, 549.424]
  - - [128, 64, 1, 4096, 160, 160, 4128, 4128]
    - [41, 614.55]
  - - [128, 128, 1, 64, 160, 160, 128, 96]
    - [9, 138.958]
  - - [128, 128, 1, 128, 160, 160, 160, 160]
    - [9, 263.793]
  - - [128, 128, 1, 256, 160, 160, 288, 288]
    - [9, 450.129]
  - - [128, 128, 1, 512, 160, 160, 544, 544]
    - [49, 686.129]
  - - [128, 128, 1, 1024, 160, 160, 1056, 1056]
    - [41, 945.993]
  - - [128, 128, 1, 2048, 160, 160, 2080, 2080]
    - [48, 1168.41]
  - - [128, 128, 1, 4096, 160, 160, 4128, 4128]
    - [49, 1286.4]
  - - [128, 256, 1, 64, 160, 160, 128, 96]
    - [22, 340.501]
  - - [128, 256, 1, 128, 160, 160, 160, 160]
    - [9, 610.791]
  - - [128, 256, 1, 256, 160, 160, 288, 288]
    - [9, 1016.19]
  - - [128, 256, 1, 512, 160, 160, 544, 544]
    - [41, 1489.98]
  - - [128, 256, 1, 1024, 160, 160, 1056, 1056]
    - [49, 2000.02]
  - - [128, 256, 1, 2048, 160, 160, 2080, 2080]
    - [43, 2422.62]
  - - [128, 256, 1, 4096, 160, 160, 4128, 4128]
    - [49, 2606.32]
  - - [128, 512, 1, 64, 160, 160, 128, 96]
    - [28, 726.035]
  - - [128, 512, 1, 128, 160, 160, 160, 160]
    - [9, 1289.36]
  - - [128, 512, 1, 256, 160, 160, 288, 288]
    - [44, 2142.41]
  - - [128, 512, 1, 512, 160, 160, 544, 544]
    - [44, 3157.77]
  - - [128, 512, 1, 1024, 160, 160, 1056, 1056]
    - [41, 4194.3]
  - - [128, 512, 1, 2048, 160, 160, 2080, 2080]
    - [39, 5001.78]
  - - [128, 512, 1, 4096, 160, 160, 4128, 4128]
    - [49, 5274.29]
  - - [128, 1024, 1, 64, 160, 160, 128, 96]
    - [44, 1468.59]
  - - [128, 1024, 1, 128, 160, 160, 160, 160]
    - [42, 2612.86]
  - - [128, 1024, 1, 256, 160, 160, 288, 288]
    - [41, 4346.43]
  - - [128, 1024, 1, 512, 160, 160, 544, 544]
    - [47, 6454.02]
  - - [128, 1024, 1, 1024, 160, 160, 1056, 1056]
    - [41, 8498.02]
  - - [128, 1024, 1, 2048, 160, 160, 2080, 2080]
    - [49, 10038.3]
  - - [128, 1024, 1, 4096, 160, 160, 4128, 4128]
    - [40, 10967.3]
  - - [128, 2048, 1, 64, 160, 160, 128, 96]
    - [44, 2697.74]
  - - [128, 2048, 1, 128, 160, 160, 160, 160]
    - [41, 4830.74]
  - - [128, 2048, 1, 256, 160, 160, 288, 288]
    - [44, 8108.85]
  - - [128, 2048, 1, 512, 160, 160, 544, 544]
    - [47, 12237.2]
  - - [128, 2048, 1, 1024, 160, 160, 1056, 1056]
    - [41, 16675.1]
  - - [128, 2048, 1, 2048, 160, 160, 2080, 2080]
    - [41, 20214.3]
  - - [128, 2048, 1, 4096, 160, 160, 4128, 4128]
    - [38, 19144.9]
  - - [128, 4096, 1, 64, 160, 160, 128, 96]
    - [45, 4424.36]
  - - [128, 4096, 1, 128, 160, 160, 160, 160]
    - [32, 8058.22]
  - - [128, 4096, 1, 256, 160, 160, 288, 288]
    - [21, 13687.3]
  - - [128, 4096, 1, 512, 160, 160, 544, 544]
    - [33, 21218.5]
  - - [128, 4096, 1, 1024, 160, 160, 1056, 1056]
    - [9, 29324.4]
  - - [128, 4096, 1, 2048, 160, 160, 2080, 2080]
    - [33, 36226.1]
  - - [128, 4096, 1, 4096, 160, 160, 4128, 4128]
    - [22, 34507.1]
  - - [256, 64, 1, 64, 288, 288, 256, 96]
    - [14, 141.604]
  - - [256, 64, 1, 128, 288, 288, 256, 160]
    - [5, 263.394]
  - - [256, 64, 1, 256, 288, 288, 288, 288]
    - [1, 421.537]
  - - [256, 64, 1, 512, 288, 288, 544, 544]
    - [41, 643.445]
  - - [256, 64, 1, 1024, 288, 288, 1056, 1056]
    - [41, 904.968]
  - - [256, 64, 1, 2048, 288, 288, 2080, 2080]
    - [44, 1138.48]
  - - [256, 64, 1, 4096, 288, 288, 4128, 4128]
    - [41, 1262.65]
  - - [256, 128, 1, 64, 288, 288, 256, 96]
    - [9, 322.589]
  - - [256, 128, 1, 128, 288, 288, 256, 160]
    - [22, 613.023]
  - - [256, 128, 1, 256, 288, 288, 288, 288]
    - [41, 1013.61]
  - - [256, 128, 1, 512, 288, 288, 544, 544]
    - [8, 1491.04]
  - - [256, 128, 1, 1024, 288, 288, 1056, 1056]
    - [48, 1980.55]
  - - [256, 128, 1, 2048, 288, 288, 2080, 2080]
    - [44, 2414.42]
  - - [256, 128, 1, 4096, 288, 288, 4128, 4128]
    - [49, 2587.13]
  - - [256, 256, 1, 64, 288, 288, 256, 96]
    - [28, 687.929]
  - - [256, 256, 1, 128, 288, 288, 256, 160]
    - [9, 1236.71]
  - - [256, 256, 1, 256, 288, 288, 288, 288]
    - [41, 2041.52]
  - - [256, 256, 1, 512, 288, 288, 544, 544]
    - [44, 3068.25]
  - - [256, 256, 1, 1024, 288, 288, 1056, 1056]
    - [49, 4176.55]
  - - [256, 256, 1, 2048, 288, 288, 2080, 2080]
    - [49, 4988.02]
  - - [256, 256, 1, 4096, 288, 288, 4128, 4128]
    - [44, 5248.0]
  - - [256, 512, 1, 64, 288, 288, 256, 96]
    - [22, 1408.43]
  - - [256, 512, 1, 128, 288, 288, 256, 160]
    - [41, 2521.37]
  - - [256, 512, 1, 256, 288, 288, 288, 288]
    - [44, 4170.32]
  - - [256, 512, 1, 512, 288, 288, 544, 544]
    - [49, 6216.09]
  - - [256, 512, 1, 1024, 288, 288, 1056, 1056]
    - [44, 8264.64]
  - - [256, 512, 1, 2048, 288, 288, 2080, 2080]
    - [49, 9917.08]
  - - [256, 512, 1, 4096, 288, 288, 4128, 4128]
    - [49, 10609.7]
  - - [256, 1024, 1, 64, 288, 288, 256, 96]
    - [49, 2777.22]
  - - [256, 1024, 1, 128, 288, 288, 256, 160]
    - [49, 4954.88]
  - - [256, 1024, 1, 256, 288, 288, 288, 288]
    - [49, 8125.54]
  - - [256, 1024, 1, 512, 288, 288, 544, 544]
    - [44, 12225.0]
  - - [256, 1024, 1, 1024, 288, 288, 1056, 1056]
    - [41, 16373.0]
  - - [256, 1024, 1, 2048, 288, 288, 2080, 2080]
    - [49, 19692.3]
  - - [256, 1024, 1, 4096, 288, 288, 4128, 4128]
    - [48, 21657.6]
  - - [256, 2048, 1, 64, 288, 288, 256, 96]
    - [33, 4637.79]
  - - [256, 2048, 1, 128, 288, 288, 256, 160]
    - [21, 8376.04]
  - - [256, 2048, 1, 256, 288, 288, 288, 288]
    - [21, 13583.4]
  - - [256, 2048, 1, 512, 288, 288, 544, 544]
    - [21, 20875.3]
  - - [256, 2048, 1, 1024, 288, 288, 1056, 1056]
    - [9, 28780.5]
  - - [256, 2048, 1, 2048, 288, 288, 2080, 2080]
    - [33, 35400.8]
  - - [256, 2048, 1, 4096, 288, 288, 4128, 4128]
    - [21, 38470.2]
  - - [256, 4096, 1, 64, 288, 288, 256, 96]
    - [49, 7849.91]
  - - [256, 4096, 1, 128, 288, 288, 256, 160]
    - [3, 14079.3]
  - - [256, 4096, 1, 256, 288, 288, 288, 288]
    - [23, 20854.2]
  - - [256, 4096, 1, 512, 288, 288, 544, 544]
    - [27, 27932.9]
  - - [256, 4096, 1, 1024, 288, 288, 1056, 1056]
    - [18, 33924.4]
  - - [256, 4096, 1, 2048, 288, 288, 2080, 2080]
    - [28, 36534.2]
  - - [256, 4096, 1, 4096, 288, 288, 4128, 4128]
    - [26, 36580.9]
  - - [384, 64, 1, 64, 416, 416, 384, 96]
    - [5, 218.271]
  - - [384, 64, 1, 128, 416, 416, 384, 160]
    - [22, 404.231]
  - - [384, 64, 1, 256, 416, 416, 384, 288]
    - [5, 657.346]
  - - [384, 64, 1, 512, 416, 416, 544, 544]
    - [38, 983.424]
  - - [384, 64, 1, 1024, 416, 416, 1056, 1056]
    - [43, 1377.14]
  - - [384, 64, 1, 2048, 416, 416, 2080, 2080]
    - [44, 1729.85]
  - - [384, 64, 1, 4096, 416, 416, 4128, 4128]
    - [44, 1904.52]
  - - [384, 128, 1, 64, 416, 416, 384, 96]
    - [5, 496.172]
  - - [384, 128, 1, 128, 416, 416, 384, 160]
    - [9, 943.954]
  - - [384, 128, 1, 256, 416, 416, 384, 288]
    - [9, 1554.6]
  - - [384, 128, 1, 512, 416, 416, 544, 544]
    - [41, 2252.18]
  - - [384, 128, 1, 1024, 416, 416, 1056, 1056]
    - [44, 3023.83]
  - - [384, 128, 1, 2048, 416, 416, 2080, 2080]
    - [41, 3653.97]
  - - [384, 128, 1, 4096, 416, 416, 4128, 4128]
    - [49, 3913.43]
  - - [384, 256, 1, 64, 416, 416, 384, 96]
    - [9, 1050.15]
  - - [384, 256, 1, 128, 416, 416, 384, 160]
    - [44, 1875.25]
  - - [384, 256, 1, 256, 416, 416, 384, 288]
    - [47, 3101.14]
  - - [384, 256, 1, 512, 416, 416, 544, 544]
    - [44, 4620.97]
  - - [384, 256, 1, 1024, 416, 416, 1056, 1056]
    - [49, 6264.82]
  - - [384, 256, 1, 2048, 416, 416, 2080, 2080]
    - [41, 7468.99]
  - - [384, 256, 1, 4096, 416, 416, 4128, 4128]
    - [41, 7863.55]
  - - [384, 512, 1, 64, 416, 416, 384, 96]
    - [49, 2025.57]
  - - [384, 512, 1, 128, 416, 416, 384, 160]
    - [22, 3645.09]
  - - [384, 512, 1, 256, 416, 416, 384, 288]
    - [41, 6053.11]
  - - [384, 512, 1, 512, 416, 416, 544, 544]
    - [39, 9035.39]
  - - [384, 512, 1, 1024, 416, 416, 1056, 1056]
    - [41, 12173.6]
  - - [384, 512, 1, 2048, 416, 416, 2080, 2080]
    - [40, 14626.0]
  - - [384, 512, 1, 4096, 416, 416, 4128, 4128]
    - [41, 15811.7]
  - - [384, 1024, 1, 64, 416, 416, 384, 96]
    - [21, 3646.69]
  - - [384, 1024, 1, 128, 416, 416, 384, 160]
    - [33, 6572.41]
  - - [384, 1024, 1, 256, 416, 416, 384, 288]
    - [21, 10867.2]
  - - [384, 1024, 1, 512, 416, 416, 544, 544]
    - [33, 16249.1]
  - - [384, 1024, 1, 1024, 416, 416, 1056, 1056]
    - [8, 21993.3]
  - - [384, 1024, 1, 2048, 416, 416, 2080, 2080]
    - [21, 26658.7]
  - - [384, 1024, 1, 4096, 416, 416, 4128, 4128]
    - [33, 29005.9]
  - - [384, 2048, 1, 64, 416, 416, 384, 96]
    - [12, 6183.99]
  - - [384, 2048, 1, 128, 416, 416, 384, 160]
    - [28, 10738.6]
  - - [384, 2048, 1, 256, 416, 416, 384, 288]
    - [2, 18176.8]
  - - [384, 2048, 1, 512, 416, 416, 544, 544]
    - [1, 25557.1]
  - - [384, 2048, 1, 1024, 416, 416, 1056, 1056]
    - [4, 30740.4]
  - - [384, 2048, 1, 2048, 416, 416, 2080, 2080]
    - [24, 32902.6]
  - - [384, 2048, 1, 4096, 416, 416, 4128, 4128]
    - [35, 35810.1]
  - - [384, 4096, 1, 64, 416, 416, 384, 96]
    - [28, 10343.5]
  - - [384, 4096, 1, 128, 416, 416, 384, 160]
    - [31, 16763.2]
  - - [384, 4096, 1, 256, 416, 416, 384, 288]
    - [27, 23679.9]
  - - [384, 4096, 1, 512, 416, 416, 544, 544]
    - [31, 30242.8]
  - - [384, 4096, 1, 1024, 416, 416, 1056, 1056]
    - [28, 34131.8]
  - - [384, 4096, 1, 2048, 416, 416, 2080, 2080]
    - [2, 37668.5]
  - - [384, 4096, 1, 4096, 416, 416, 4128, 4128]
    - [28, 37185.0]
  - - [768, 64, 1, 64, 800, 800, 768, 96]
    - [2, 456.432]
  - - [768, 64, 1, 128, 800, 800, 768, 160]
    - [44, 815.695]
  - - [768, 64, 1, 256, 800, 800, 768, 288]
    - [22, 1358.85]
  - - [768, 64, 1, 512, 800, 800, 768, 544]
    - [41, 2109.63]
  - - [768, 64, 1, 1024, 800, 800, 1056, 1056]
    - [49, 2877.73]
  - - [768, 64, 1, 2048, 800, 800, 2080, 2080]
    - [44, 3511.47]
  - - [768, 64, 1, 4096, 800, 800, 4128, 4128]
    - [41, 3828.74]
  - - [768, 128, 1, 64, 800, 800, 768, 96]
    - [7, 1033.08]
  - - [768, 128, 1, 128, 800, 800, 768, 160]
    - [7, 1967.92]
  - - [768, 128, 1, 256, 800, 800, 768, 288]
    - [41, 3228.87]
  - - [768, 128, 1, 512, 800, 800, 768, 544]
    - [41, 4624.37]
  - - [768, 128, 1, 1024, 800, 800, 1056, 1056]
    - [47, 6076.87]
  - - [768, 128, 1, 2048, 800, 800, 2080, 2080]
    - [44, 7326.56]
  - - [768, 128, 1, 4096, 800, 800, 4128, 4128]
    - [49, 7814.26]
  - - [768, 256, 1, 64, 800, 800, 768, 96]
    - [22, 2032.12]
  - - [768, 256, 1, 128, 800, 800, 768, 160]
    - [49, 3641.94]
  - - [768, 256, 1, 256, 800, 800, 768, 288]
    - [49, 6055.28]
  - - [768, 256, 1, 512, 800, 800, 768, 544]
    - [41, 9016.78]
  - - [768, 256, 1, 1024, 800, 800, 1056, 1056]
    - [41, 12240.2]
  - - [768, 256, 1, 2048, 800, 800, 2080, 2080]
    - [41, 14694.3]
  - - [768, 256, 1, 4096, 800, 800, 4128, 4128]
    - [41, 15627.0]
  - - [768, 512, 1, 64, 800, 800, 768, 96]
    - [21, 3648.28]
  - - [768, 512, 1, 128, 800, 800, 768, 160]
    - [8, 6605.18]
  - - [768, 512, 1, 256, 800, 800, 768, 288]
    - [6, 10909.6]
  - - [768, 512, 1, 512, 800, 800, 768, 544]
    - [8, 16386.7]
  - - [768, 512, 1, 1024, 800, 800, 1056, 1056]
    - [33, 21931.0]
  - - [768, 512, 1, 2048, 800, 800, 2080, 2080]
    - [8, 26898.2]
  - - [768, 512, 1, 4096, 800, 800, 4128, 4128]
    - [33, 29091.3]
  - - [768, 1024, 1, 64, 800, 800, 768, 96]
    - [3, 6200.01]
  - - [768, 1024, 1, 128, 800, 800, 768, 160]
    - [5, 10852.0]
  - - [768, 1024, 1, 256, 800, 800, 768, 288]
    - [2, 18448.3]
  - - [768, 1024, 1, 512, 800, 800, 768, 544]
    - [5, 25720.4]
  - - [768, 1024, 1, 1024, 800, 800, 1056, 1056]
    - [31, 30377.5]
  - - [768, 1024, 1, 2048, 800, 800, 2080, 2080]
    - [10, 32716.7]
  - - [768, 1024, 1, 4096, 800, 800, 4128, 4128]
    - [11, 35693.8]
  - - [768, 2048, 1, 64, 800, 800, 768, 96]
    - [14, 10831.0]
  - - [768, 2048, 1, 128, 800, 800, 768, 160]
    - [14, 17308.0]
  - - [768, 2048, 1, 256, 800, 800, 768, 288]
    - [18, 24651.2]
  - - [768, 2048, 1, 512, 800, 800, 768, 544]
    - [2, 31447.4]
  - - [768, 2048, 1, 1024, 800, 800, 1056, 1056]
    - [31, 34654.7]
  - - [768, 2048, 1, 2048, 800, 800, 2080, 2080]
    - [18, 38424.7]
  - - [768, 2048, 1, 4096, 800, 800, 4128, 4128]
    - [28, 40266.6]
  - - [768, 4096, 1, 64, 800, 800, 768, 96]
    - [28, 13611.4]
  - - [768, 4096, 1, 128, 800, 800, 768, 160]
    - [18, 20825.1]
  - - [768, 4096, 1, 256, 800, 800, 768, 288]
    - [5, 28104.5]
  - - [768, 4096, 1, 512, 800, 800, 768, 544]
    - [28, 33066.7]
  - - [768, 4096, 1, 1024, 800, 800, 1056, 1056]
    - [2, 37666.3]
  - - [768, 4096, 1, 2048, 800, 800, 2080, 2080]
    - [18, 40570.6]
  - - [768, 4096, 1, 4096, 800, 800, 4128, 4128]
    - [14, 40231.5]
  - - [1536, 64, 1, 64, 1568, 1568, 1536, 96]
    - [2, 966.578]
  - - [1536, 64, 1, 128, 1568, 1568, 1536, 160]
    - [0, 1768.5]
  - - [1536, 64, 1, 256, 1568, 1568, 1536, 288]
    - [20, 2846.17]
  - - [1536, 64, 1, 512, 1568, 1568, 1536, 544]
    - [44, 4206.92]
  - - [1536, 64, 1, 1024, 1568, 1568, 1536, 1056]
    - [49, 5748.9]
  - - [1536, 64, 1, 2048, 1568, 1568, 2080, 2080]
    - [49, 7017.79]
  - - [1536, 64, 1, 4096, 1568, 1568, 4128, 4128]
    - [49, 7271.78]
  - - [1536, 128, 1, 64, 1568, 1568, 1536, 96]
    - [7, 1920.18]
  - - [1536, 128, 1, 128, 1568, 1568, 1536, 160]
    - [9, 3648.81]
  - - [1536, 128, 1, 256, 1568, 1568, 1536, 288]
    - [49, 6017.65]
  - - [1536, 128, 1, 512, 1568, 1568, 1536, 544]
    - [49, 9205.61]
  - - [1536, 128, 1, 1024, 1568, 1568, 1536, 1056]
    - [44, 12195.0]
  - - [1536, 128, 1, 2048, 1568, 1568, 2080, 2080]
    - [49, 14671.3]
  - - [1536, 128, 1, 4096, 1568, 1568, 4128, 4128]
    - [44, 13850.9]
  - - [1536, 256, 1, 64, 1568, 1568, 1536, 96]
    - [21, 3677.6]
  - - [1536, 256, 1, 128, 1568, 1568, 1536, 160]
    - [21, 6618.23]
  - - [1536, 256, 1, 256, 1568, 1568, 1536, 288]
    - [33, 11015.9]
  - - [1536, 256, 1, 512, 1568, 1568, 1536, 544]
    - [8, 16499.4]
  - - [1536, 256, 1, 1024, 1568, 1568, 1536, 1056]
    - [9, 22029.4]
  - - [1536, 256, 1, 2048, 1568, 1568, 2080, 2080]
    - [8, 26694.9]
  - - [1536, 256, 1, 4096, 1568, 1568, 4128, 4128]
    - [9, 28943.4]
  - - [1536, 512, 1, 64, 1568, 1568, 1536, 96]
    - [24, 5967.0]
  - - [1536, 512, 1, 128, 1568, 1568, 1536, 160]
    - [5, 10440.1]
  - - [1536, 512, 1, 256, 1568, 1568, 1536, 288]
    - [5, 17975.6]
  - - [1536, 512, 1, 512, 1568, 1568, 1536, 544]
    - [1, 25368.8]
  - - [1536, 512, 1, 1024, 1568, 1568, 1536, 1056]
    - [30, 30814.5]
  - - [1536, 512, 1, 2048, 1568, 1568, 2080, 2080]
    - [10, 32993.5]
  - - [1536, 512, 1, 4096, 1568, 1568, 4128, 4128]
    - [26, 35643.3]
  - - [1536, 1024, 1, 64, 1568, 1568, 1536, 96]
    - [30, 10536.2]
  - - [1536, 1024, 1, 128, 1568, 1568, 1536, 160]
    - [30, 16841.8]
  - - [1536, 1024, 1, 256, 1568, 1568, 1536, 288]
    - [28, 24297.2]
  - - [1536, 1024, 1, 512, 1568, 1568, 1536, 544]
    - [18, 31188.0]
  - - [1536, 1024, 1, 1024, 1568, 1568, 1536, 1056]
    - [28, 34977.6]
  - - [1536, 1024, 1, 2048, 1568, 1568, 2080, 2080]
    - [16, 38439.9]
  - - [1536, 1024, 1, 4096, 1568, 1568, 4128, 4128]
    - [17, 39310.3]
  - - [1536, 2048, 1, 64, 1568, 1568, 1536, 96]
    - [31, 13682.7]
  - - [1536, 2048, 1, 128, 1568, 1568, 1536, 160]
    - [28, 20853.1]
  - - [1536, 2048, 1, 256, 1568, 1568, 1536, 288]
    - [14, 28171.3]
  - - [1536, 2048, 1, 512, 1568, 1568, 1536, 544]
    - [14, 33011.1]
  - - [1536, 2048, 1, 1024, 1568, 1568, 1536, 1056]
    - [31, 37838.4]
  - - [1536, 2048, 1, 2048, 1568, 1568, 2080, 2080]
    - [14, 40624.1]
  - - [1536, 2048, 1, 4096, 1568, 1568, 4128, 4128]
    - [13, 40569.6]
  - - [1536, 4096, 1, 64, 1568, 1568, 1536, 96]
    - [31, 16107.4]
  - - [1536, 4096, 1, 128, 1568, 1568, 1536, 160]
    - [28, 23625.0]
  - - [1536, 4096, 1, 256, 1568, 1568, 1536, 288]
    - [14, 29528.1]
  - - [1536, 4096, 1, 512, 1568, 1568, 1536, 544]
    - [13, 35602.3]
  - - [1536, 4096, 1, 1024, 1568, 1568, 1536, 1056]
    - [28, 39645.1]
  - - [1536, 4096, 1, 2048, 1568, 1568, 2080, 2080]
    - [28, 41199.1]
  - - [1536, 4096, 1, 4096, 1568, 1568, 4128, 4128]
    - [18, 40470.4]
  - - [3072, 64, 1, 64, 3104, 3104, 3072, 96]
    - [19, 1581.17]
  - - [3072, 64, 1, 128, 3104, 3104, 3072, 160]
    - [21, 3002.72]
  - - [3072, 64, 1, 256, 3104, 3104, 3072, 288]
    - [21, 5094.8]
  - - [3072, 64, 1, 512, 3104, 3104, 3072, 544]
    - [9, 7754.66]
  - - [3072, 64, 1, 1024, 3104, 3104, 3072, 1056]
    - [33, 10734.0]
  - - [3072, 64, 1, 2048, 3104, 3104, 3072, 2080]
    - [8, 13216.0]
  - - [3072, 64, 1, 4096, 3104, 3104, 4128, 4128]
    - [21, 14478.2]
  - - [3072, 128, 1, 64, 3104, 3104, 3072, 96]
    - [8, 4118.79]
  - - [3072, 128, 1, 128, 3104, 3104, 3072, 160]
    - [21, 6933.67]
  - - [3072, 128, 1, 256, 3104, 3104, 3072, 288]
    - [8, 11427.3]
  - - [3072, 128, 1, 512, 3104, 3104, 3072, 544]
    - [21, 17050.0]
  - - [3072, 128, 1, 1024, 3104, 3104, 3072, 1056]
    - [33, 23033.8]
  - - [3072, 128, 1, 2048, 3104, 3104, 3072, 2080]
    - [8, 27546.0]
  - - [3072, 128, 1, 4096, 3104, 3104, 4128, 4128]
    - [8, 29441.2]
  - - [3072, 256, 1, 64, 3104, 3104, 3072, 96]
    - [22, 7468.71]
  - - [3072, 256, 1, 128, 3104, 3104, 3072, 160]
    - [31, 12682.8]
  - - [3072, 256, 1, 256, 3104, 3104, 3072, 288]
    - [5, 19388.2]
  - - [3072, 256, 1, 512, 3104, 3104, 3072, 544]
    - [5, 25789.6]
  - - [3072, 256, 1, 1024, 3104, 3104, 3072, 1056]
    - [30, 30932.9]
  - - [3072, 256, 1, 2048, 3104, 3104, 3072, 2080]
    - [37, 32913.3]
  - - [3072, 256, 1, 4096, 3104, 3104, 4128, 4128]
    - [10, 36545.9]
  - - [3072, 512, 1, 64, 3104, 3104, 3072, 96]
    - [30, 10490.1]
  - - [3072, 512, 1, 128, 3104, 3104, 3072, 160]
    - [14, 16913.9]
  - - [3072, 512, 1, 256, 3104, 3104, 3072, 288]
    - [28, 24281.1]
  - - [3072, 512, 1, 512, 3104, 3104, 3072, 544]
    - [18, 31168.7]
  - - [3072, 512, 1, 1024, 3104, 3104, 3072, 1056]
    - [14, 34598.1]
  - - [3072, 512, 1, 2048, 3104, 3104, 3072, 2080]
    - [16, 38508.8]
  - - [3072, 512, 1, 4096, 3104, 3104, 4128, 4128]
    - [2, 37806.2]
  - - [3072, 1024, 1, 64, 3104, 3104, 3072, 96]
    - [28, 13658.5]
  - - [3072, 1024, 1, 128, 3104, 3104, 3072, 160]
    - [31, 20927.9]
  - - [3072, 1024, 1, 256, 3104, 3104, 3072, 288]
    - [31, 28140.8]
  - - [3072, 1024, 1, 512, 3104, 3104, 3072, 544]
    - [14, 32921.4]
  - - [3072, 1024, 1, 1024, 3104, 3104, 3072, 1056]
    - [31, 37670.7]
  - - [3072, 1024, 1, 2048, 3104, 3104, 3072, 2080]
    - [13, 40662.0]
  - - [3072, 1024, 1, 4096, 3104, 3104, 4128, 4128]
    - [28, 39736.3]
  - - [3072, 2048, 1, 64, 3104, 3104, 3072, 96]
    - [31, 16083.6]
  - - [3072, 2048, 1, 128, 3104, 3104, 3072, 160]
    - [18, 23636.1]
  - - [3072, 2048, 1, 256, 3104, 3104, 3072, 288]
    - [2, 29682.1]
  - - [3072, 2048, 1, 512, 3104, 3104, 3072, 544]
    - [17, 35629.9]
  - - [3072, 2048, 1, 1024, 3104, 3104, 3072, 1056]
    - [14, 39631.9]
  - - [3072, 2048, 1, 2048, 3104, 3104, 3072, 2080]
    - [14, 41348.8]
  - - [3072, 2048, 1, 4096, 3104, 3104, 4128, 4128]
    - [31, 40294.3]
  - - [3072, 4096, 1, 64, 3104, 3104, 3072, 96]
    - [31, 16959.2]
  - - [3072, 4096, 1, 128, 3104, 3104, 3072, 160]
    - [31, 24553.1]
  - - [3072, 4096, 1, 256, 3104, 3104, 3072, 288]
    - [5, 31740.6]
  - - [3072, 4096, 1, 512, 3104, 3104, 3072, 544]
    - [17, 37183.5]
  - - [3072, 4096, 1, 1024, 3104, 3104, 3072, 1056]
    - [31, 39984.0]
  - - [3072, 4096, 1, 2048, 3104, 3104, 3072, 2080]
    - [14, 41333.5]
  - - [3072, 4096, 1, 4096, 3104, 3104, 4128, 4128]
    - [23, 38372.4]
  - - [4096, 64, 1, 64, 4128, 4128, 4096, 96]
    - [21, 2211.02]
  - - [4096, 64, 1, 128, 4128, 4128, 4096, 160]
    - [32, 4254.94]
  - - [4096, 64, 1, 256, 4128, 4128, 4096, 288]
    - [19, 7136.96]
  - - [4096, 64, 1, 512, 4128, 4128, 4096, 544]
    - [21, 10914.7]
  - - [4096, 64, 1, 1024, 4128, 4128, 4096, 1056]
    - [21, 14685.5]
  - - [4096, 64, 1, 2048, 4128, 4128, 4096, 2080]
    - [8, 17868.9]
  - - [4096, 64, 1, 4096, 4128, 4128, 4128, 4128]
    - [9, 18919.9]
  - - [4096, 128, 1, 64, 4128, 4128, 4096, 96]
    - [19, 5265.92]
  - - [4096, 128, 1, 128, 4128, 4128, 4096, 160]
    - [21, 9489.38]
  - - [4096, 128, 1, 256, 4128, 4128, 4096, 288]
    - [33, 15606.7]
  - - [4096, 128, 1, 512, 4128, 4128, 4096, 544]
    - [33, 23017.9]
  - - [4096, 128, 1, 1024, 4128, 4128, 4096, 1056]
    - [22, 30352.3]
  - - [4096, 128, 1, 2048, 4128, 4128, 4096, 2080]
    - [8, 36329.1]
  - - [4096, 128, 1, 4096, 4128, 4128, 4128, 4128]
    - [21, 37923.3]
  - - [4096, 256, 1, 64, 4128, 4128, 4096, 96]
    - [33, 8889.77]
  - - [4096, 256, 1, 128, 4128, 4128, 4096, 160]
    - [18, 14731.4]
  - - [4096, 256, 1, 256, 4128, 4128, 4096, 288]
    - [28, 21226.9]
  - - [4096, 256, 1, 512, 4128, 4128, 4096, 544]
    - [14, 28508.4]
  - - [4096, 256, 1, 1024, 4128, 4128, 4096, 1056]
    - [28, 34183.6]
  - - [4096, 256, 1, 2048, 4128, 4128, 4096, 2080]
    - [29, 36300.2]
  - - [4096, 256, 1, 4096, 4128, 4128, 4128, 4128]
    - [11, 37577.9]
  - - [4096, 512, 1, 64, 4128, 4128, 4096, 96]
    - [36, 11821.2]
  - - [4096, 512, 1, 128, 4128, 4128, 4096, 160]
    - [31, 18642.6]
  - - [4096, 512, 1, 256, 4128, 4128, 4096, 288]
    - [31, 25960.9]
  - - [4096, 512, 1, 512, 4128, 4128, 4096, 544]
    - [18, 32563.3]
  - - [4096, 512, 1, 1024, 4128, 4128, 4096, 1056]
    - [31, 35803.3]
  - - [4096, 512, 1, 2048, 4128, 4128, 4096, 2080]
    - [31, 39464.9]
  - - [4096, 512, 1, 4096, 4128, 4128, 4128, 4128]
    - [25, 39013.4]
  - - [4096, 1024, 1, 64, 4128, 4128, 4096, 96]
    - [30, 14741.9]
  - - [4096, 1024, 1, 128, 4128, 4128, 4096, 160]
    - [28, 22210.4]
  - - [4096, 1024, 1, 256, 4128, 4128, 4096, 288]
    - [14, 29142.9]
  - - [4096, 1024, 1, 512, 4128, 4128, 4096, 544]
    - [18, 34197.8]
  - - [4096, 1024, 1, 1024, 4128, 4128, 4096, 1056]
    - [18, 38624.5]
  - - [4096, 1024, 1, 2048, 4128, 4128, 4096, 2080]
    - [18, 41330.2]
  - - [4096, 1024, 1, 4096, 4128, 4128, 4128, 4128]
    - [30, 40005.7]
  - - [4096, 2048, 1, 64, 4128, 4128, 4096, 96]
    - [14, 16793.0]
  - - [4096, 2048, 1, 128, 4128, 4128, 4096, 160]
    - [14, 23383.9]
  - - [4096, 2048, 1, 256, 4128, 4128, 4096, 288]
    - [2, 30709.5]
  - - [4096, 2048, 1, 512, 4128, 4128, 4096, 544]
    - [13, 36397.4]
  - - [4096, 2048, 1, 1024, 4128, 4128, 4096, 1056]
    - [28, 40230.9]
  - - [4096, 2048, 1, 2048, 4128, 4128, 4096, 2080]
    - [13, 41088.7]
  - - [4096, 2048, 1, 4096, 4128, 4128, 4128, 4128]
    - [28, 40108.3]
  - - [4096, 4096, 1, 64, 4128, 4128, 4096, 96]
    - [34, 17263.3]
  - - [4096, 4096, 1, 128, 4128, 4128, 4096, 160]
    - [14, 24821.2]
  - - [4096, 4096, 1, 256, 4128, 4128, 4096, 288]
    - [5, 31872.9]
  - - [4096, 4096, 1, 512, 4128, 4128, 4096, 544]
    - [17, 37287.4]
  - - [4096, 4096, 1, 1024, 4128, 4128, 4096, 1056]
    - [13, 39593.2]
  - - [4096, 4096, 1, 2048, 4128, 4128, 4096, 2080]
    - [15, 41369.1]
  - - [4096, 4096, 1, 4096, 4128, 4128, 4128, 4128]
    - [17, 36883.9]
- null
- null
- DeviceEfficiency
