library/src/blas3/Tensile/Logic/asm_full/navi33/navi33_Cijk_Alik_Bljk_BBS_BH.yaml
- {MinimumRequiredVersion: 4.35.0}
- navi33
- gfx1102
- [Device 73f0]
    SolutionIndex: 0
    SolutionNameMin: Cijk_Alik_Bljk_BBS_BH_MT128x128x32_MI16x16x16x1_SN_GRVW4_SIA1_SU0_SUS0_SVW2_VW2_WGM1
    SolutionIndex: 1
    SolutionNameMin: Cijk_Alik_Bljk_BBS_BH_MT128x128x32_MI16x16x16x1_SN_GRVW4_SIA1_SU0_SUS0_SVW4_VW4_WGM1
    SolutionIndex: 2
    SolutionNameMin: Cijk_Alik_Bljk_BBS_BH_MT128x128x32_MI16x16x16x1_SN_GRVW8_SIA1_SU0_SUS0_SVW2_VW2_WGM1
    SolutionIndex: 3
    SolutionNameMin: Cijk_Alik_Bljk_BBS_BH_MT128x128x32_MI16x16x16x1_SN_GRVW8_SIA1_SU0_SUS0_SVW4_VW4_WGM1
    SolutionIndex: 4
    SolutionNameMin: Cijk_Alik_Bljk_BBS_BH_MT128x128x32_MI16x16x16x1_SN_GRVW8_SIA3_SU0_SUS0_SVW2_VW2_WGM1
    SolutionIndex: 5
    SolutionNameMin: Cijk_Alik_Bljk_BBS_BH_MT128x128x32_MI16x16x16x1_SN_GRVW4_SIA1_SU32_SUS256_SVW2_VW2_WGM1
    SolutionIndex: 6
    SolutionNameMin: Cijk_Alik_Bljk_BBS_BH_MT128x128x32_MI16x16x16x1_SN_GRVW4_SIA1_SU32_SUS256_SVW4_VW4_WGM1
    SolutionIndex: 7
    SolutionNameMin: Cijk_Alik_Bljk_BBS_BH_MT128x128x32_MI16x16x16x1_SN_GRVW8_SIA1_SU32_SUS256_SVW2_VW2_WGM1
    SolutionIndex: 8
    SolutionNameMin: Cijk_Alik_Bljk_BBS_BH_MT128x128x32_MI16x16x16x1_SN_GRVW8_SIA3_SU32_SUS256_SVW2_VW2_WGM1
    SolutionIndex: 9
    SolutionNameMin: Cijk_Alik_Bljk_BBS_BH_MT128x128x32_MI16x16x16x1_SN_GRVW4_SIA1_SU0_SUS0_SVW2_VW2_WGM4
    SolutionIndex: 10
    SolutionNameMin: Cijk_Alik_Bljk_BBS_BH_MT128x128x32_MI16x16x16x1_SN_GRVW4_SIA1_SU0_SUS0_SVW4_VW4_WGM4
    SolutionIndex: 11
    SolutionNameMin: Cijk_Alik_Bljk_BBS_BH_MT128x128x32_MI16x16x16x1_SN_GRVW8_SIA1_SU0_SUS0_SVW2_VW2_WGM4
    SolutionIndex: 12
    SolutionNameMin: Cijk_Alik_Bljk_BBS_BH_MT128x128x32_MI16x16x16x1_SN_GRVW8_SIA1_SU0_SUS0_SVW4_VW4_WGM4
    SolutionIndex: 13
    SolutionNameMin: Cijk_Alik_Bljk_BBS_BH_MT128x128x32_MI16x16x16x1_SN_GRVW8_SIA3_SU0_SUS0_SVW2_VW2_WGM4
    SolutionIndex: 14
    SolutionNameMin: Cijk_Alik_Bljk_BBS_BH_MT128x128x32_MI16x16x16x1_SN_GRVW4_SIA1_SU32_SUS256_SVW2_VW2_WGM4
    SolutionIndex: 15
    SolutionNameMin: Cijk_Alik_Bljk_BBS_BH_MT128x128x32_MI16x16x16x1_SN_GRVW4_SIA1_SU32_SUS256_SVW4_VW4_WGM4
    SolutionIndex: 16
    SolutionNameMin: Cijk_Alik_Bljk_BBS_BH_MT128x128x32_MI16x16x16x1_SN_GRVW8_SIA1_SU32_SUS256_SVW2_VW2_WGM4
    SolutionIndex: 17
    SolutionNameMin: Cijk_Alik_Bljk_BBS_BH_MT128x128x32_MI16x16x16x1_SN_GRVW8_SIA1_SU32_SUS256_SVW4_VW4_WGM4
    SolutionIndex: 18
    SolutionNameMin: Cijk_Alik_Bljk_BBS_BH_MT128x128x32_MI16x16x16x1_SN_GRVW8_SIA3_SU32_SUS256_SVW2_VW2_WGM4
    SolutionIndex: 19
    SolutionNameMin: Cijk_Alik_Bljk_BBS_BH_MT128x128x32_MI16x16x16x1_SN_GRVW8_SIA3_SU32_SUS256_SVW4_VW4_WGM4
    SolutionIndex: 20
    SolutionNameMin: Cijk_Alik_Bljk_BBS_BH_MT128x128x32_MI16x16x16x1_SN_GRVW4_SIA1_SU0_SUS0_SVW2_VW2_WGM8
    SolutionIndex: 21
    SolutionNameMin: Cijk_Alik_Bljk_BBS_BH_MT128x128x32_MI16x16x16x1_SN_GRVW4_SIA1_SU0_SUS0_SVW4_VW4_WGM8
    SolutionIndex: 22
    SolutionNameMin: Cijk_Alik_Bljk_BBS_BH_MT128x128x32_MI16x16x16x1_SN_GRVW8_SIA1_SU0_SUS0_SVW2_VW2_WGM8
    SolutionIndex: 23
    SolutionNameMin: Cijk_Alik_Bljk_BBS_BH_MT128x128x32_MI16x16x16x1_SN_GRVW8_SIA1_SU0_SUS0_SVW4_VW4_WGM8
    SolutionIndex: 24
    SolutionNameMin: Cijk_Alik_Bljk_BBS_BH_MT128x128x32_MI16x16x16x1_SN_GRVW4_SIA3_SU0_SUS0_SVW2_VW2_WGM8
    SolutionIndex: 25
    SolutionNameMin: Cijk_Alik_Bljk_BBS_BH_MT128x128x32_MI16x16x16x1_SN_GRVW8_SIA3_SU0_SUS0_SVW2_VW2_WGM8
    SolutionIndex: 26
    SolutionNameMin: Cijk_Alik_Bljk_BBS_BH_MT128x128x32_MI16x16x16x1_SN_GRVW4_SIA1_SU32_SUS256_SVW2_VW2_WGM8
    SolutionIndex: 27
    SolutionNameMin: Cijk_Alik_Bljk_BBS_BH_MT128x128x32_MI16x16x16x1_SN_GRVW4_SIA1_SU32_SUS256_SVW4_VW4_WGM8
    SolutionIndex: 28
    SolutionNameMin: Cijk_Alik_Bljk_BBS_BH_MT128x128x32_MI16x16x16x1_SN_GRVW8_SIA1_SU32_SUS256_SVW2_VW2_WGM8
    SolutionIndex: 29
    SolutionNameMin: Cijk_Alik_Bljk_BBS_BH_MT128x128x32_MI16x16x16x1_SN_GRVW8_SIA1_SU32_SUS256_SVW4_VW4_WGM8
    SolutionIndex: 30
    SolutionNameMin: Cijk_Alik_Bljk_BBS_BH_MT128x128x32_MI16x16x16x1_SN_GRVW8_SIA3_SU32_SUS256_SVW2_VW2_WGM8
- - - [64, 64, 1, 64, 96, 96, 96, 96]
    - [3, 32.605]
  - - [64, 64, 1, 128, 96, 96, 160, 160]
    - [23, 61.5651]
  - - [64, 64, 1, 256, 96, 96, 288, 288]
    - [11, 107.249]
  - - [64, 64, 1, 512, 96, 96, 544, 544]
    - [12, 161.942]
  - - [64, 64, 1, 1024, 96, 96, 1056, 1056]
    - [23, 232.397]
  - - [64, 64, 1, 2048, 96, 96, 2080, 2080]
    - [2, 296.25]
  - - [64, 64, 1, 4096, 96, 96, 4128, 4128]
    - [11, 333.861]
  - - [64, 128, 1, 64, 96, 96, 96, 96]
    - [12, 60.4855]
  - - [64, 128, 1, 128, 96, 96, 160, 160]
    - [23, 113.765]
  - - [64, 128, 1, 256, 96, 96, 288, 288]
    - [11, 199.482]
  - - [64, 128, 1, 512, 96, 96, 544, 544]
    - [11, 314.321]
  - - [64, 128, 1, 1024, 96, 96, 1056, 1056]
    - [22, 456.548]
  - - [64, 128, 1, 2048, 96, 96, 2080, 2080]
    - [11, 587.335]
  - - [64, 128, 1, 4096, 96, 96, 4128, 4128]
    - [26, 658.123]
  - - [64, 256, 1, 64, 96, 96, 96, 96]
    - [10, 132.765]
  - - [64, 256, 1, 128, 96, 96, 160, 160]
    - [23, 247.188]
  - - [64, 256, 1, 256, 96, 96, 288, 288]
    - [3, 429.524]
  - - [64, 256, 1, 512, 96, 96, 544, 544]
    - [20, 685.848]
  - - [64, 256, 1, 1024, 96, 96, 1056, 1056]
    - [9, 969.333]
  - - [64, 256, 1, 2048, 96, 96, 2080, 2080]
    - [2, 1229.55]
  - - [64, 256, 1, 4096, 96, 96, 4128, 4128]
    - [11, 1331.68]
  - - [64, 512, 1, 64, 96, 96, 96, 96]
    - [12, 297.131]
  - - [64, 512, 1, 128, 96, 96, 160, 160]
    - [20, 547.202]
  - - [64, 512, 1, 256, 96, 96, 288, 288]
    - [20, 939.897]
  - - [64, 512, 1, 512, 96, 96, 544, 544]
    - [29, 1478.43]
  - - [64, 512, 1, 1024, 96, 96, 1056, 1056]
    - [20, 2050.63]
  - - [64, 512, 1, 2048, 96, 96, 2080, 2080]
    - [7, 2550.6]
  - - [64, 512, 1, 4096, 96, 96, 4128, 4128]
    - [9, 2824.33]
  - - [64, 1024, 1, 64, 96, 96, 96, 96]
    - [9, 609.637]
  - - [64, 1024, 1, 128, 96, 96, 160, 160]
    - [20, 1124.93]
  - - [64, 1024, 1, 256, 96, 96, 288, 288]
    - [5, 1866.0]
  - - [64, 1024, 1, 512, 96, 96, 544, 544]
    - [20, 2949.32]
  - - [64, 1024, 1, 1024, 96, 96, 1056, 1056]
    - [5, 4099.75]
  - - [64, 1024, 1, 2048, 96, 96, 2080, 2080]
    - [5, 5132.02]
  - - [64, 1024, 1, 4096, 96, 96, 4128, 4128]
    - [2, 5855.53]
  - - [64, 2048, 1, 64, 96, 96, 96, 96]
    - [10, 1154.98]
  - - [64, 2048, 1, 128, 96, 96, 160, 160]
    - [20, 2129.36]
  - - [64, 2048, 1, 256, 96, 96, 288, 288]
    - [12, 3665.55]
  - - [64, 2048, 1, 512, 96, 96, 544, 544]
    - [5, 5800.25]
  - - [64, 2048, 1, 1024, 96, 96, 1056, 1056]
    - [9, 8203.52]
  - - [64, 2048, 1, 2048, 96, 96, 2080, 2080]
    - [5, 10521.5]
  - - [64, 2048, 1, 4096, 96, 96, 4128, 4128]
    - [20, 12185.0]
  - - [64, 4096, 1, 64, 96, 96, 96, 96]
    - [8, 2075.36]
  - - [64, 4096, 1, 128, 96, 96, 160, 160]
    - [4, 3737.82]
  - - [64, 4096, 1, 256, 96, 96, 288, 288]
    - [8, 6204.58]
  - - [64, 4096, 1, 512, 96, 96, 544, 544]
    - [22, 9318.73]
  - - [64, 4096, 1, 1024, 96, 96, 1056, 1056]
    - [7, 12865.3]
  - - [64, 4096, 1, 2048, 96, 96, 2080, 2080]
    - [2, 15730.2]
  - - [64, 4096, 1, 4096, 96, 96, 4128, 4128]
    - [8, 16167.9]
  - - [128, 64, 1, 64, 160, 160, 96, 96]
    - [23, 69.1126]
  - - [128, 64, 1, 128, 160, 160, 160, 160]
    - [23, 131.039]
  - - [128, 64, 1, 256, 160, 160, 288, 288]
    - [10, 224.775]
  - - [128, 64, 1, 512, 160, 160, 544, 544]
    - [12, 340.143]
  - - [128, 64, 1, 1024, 160, 160, 1056, 1056]
    - [22, 462.105]
  - - [128, 64, 1, 2048, 160, 160, 2080, 2080]
    - [7, 590.934]
  - - [128, 64, 1, 4096, 160, 160, 4128, 4128]
    - [7, 657.35]
  - - [128, 128, 1, 64, 160, 160, 96, 96]
    - [29, 144.771]
  - - [128, 128, 1, 128, 160, 160, 160, 160]
    - [12, 292.817]
  - - [128, 128, 1, 256, 160, 160, 288, 288]
    - [7, 494.845]
  - - [128, 128, 1, 512, 160, 160, 544, 544]
    - [7, 761.562]
  - - [128, 128, 1, 1024, 160, 160, 1056, 1056]
    - [2, 1041.42]
  - - [128, 128, 1, 2048, 160, 160, 2080, 2080]
    - [22, 1277.92]
  - - [128, 128, 1, 4096, 160, 160, 4128, 4128]
    - [11, 1372.37]
  - - [128, 256, 1, 64, 160, 160, 96, 96]
    - [12, 335.221]
  - - [128, 256, 1, 128, 160, 160, 160, 160]
    - [12, 633.485]
  - - [128, 256, 1, 256, 160, 160, 288, 288]
    - [23, 1061.85]
  - - [128, 256, 1, 512, 160, 160, 544, 544]
    - [22, 1614.75]
  - - [128, 256, 1, 1024, 160, 160, 1056, 1056]
    - [14, 2150.92]
  - - [128, 256, 1, 2048, 160, 160, 2080, 2080]
    - [28, 2624.31]
  - - [128, 256, 1, 4096, 160, 160, 4128, 4128]
    - [2, 2868.7]
  - - [128, 512, 1, 64, 160, 160, 96, 96]
    - [10, 698.236]
  - - [128, 512, 1, 128, 160, 160, 160, 160]
    - [12, 1264.68]
  - - [128, 512, 1, 256, 160, 160, 288, 288]
    - [11, 2119.41]
  - - [128, 512, 1, 512, 160, 160, 544, 544]
    - [2, 3233.85]
  - - [128, 512, 1, 1024, 160, 160, 1056, 1056]
    - [2, 4346.43]
  - - [128, 512, 1, 2048, 160, 160, 2080, 2080]
    - [2, 5289.16]
  - - [128, 512, 1, 4096, 160, 160, 4128, 4128]
    - [28, 5909.29]
  - - [128, 1024, 1, 64, 160, 160, 96, 96]
    - [10, 1407.01]
  - - [128, 1024, 1, 128, 160, 160, 160, 160]
    - [12, 2551.66]
  - - [128, 1024, 1, 256, 160, 160, 288, 288]
    - [17, 4451.37]
  - - [128, 1024, 1, 512, 160, 160, 544, 544]
    - [16, 6727.71]
  - - [128, 1024, 1, 1024, 160, 160, 1056, 1056]
    - [22, 8930.58]
  - - [128, 1024, 1, 2048, 160, 160, 2080, 2080]
    - [2, 10861.7]
  - - [128, 1024, 1, 4096, 160, 160, 4128, 4128]
    - [11, 12324.6]
  - - [128, 2048, 1, 64, 160, 160, 96, 96]
    - [15, 2711.69]
  - - [128, 2048, 1, 128, 160, 160, 160, 160]
    - [3, 4708.73]
  - - [128, 2048, 1, 256, 160, 160, 288, 288]
    - [7, 7969.23]
  - - [128, 2048, 1, 512, 160, 160, 544, 544]
    - [9, 12252.8]
  - - [128, 2048, 1, 1024, 160, 160, 1056, 1056]
    - [2, 16982.1]
  - - [128, 2048, 1, 2048, 160, 160, 2080, 2080]
    - [5, 21355.2]
  - - [128, 2048, 1, 4096, 160, 160, 4128, 4128]
    - [26, 24447.7]
  - - [128, 4096, 1, 64, 160, 160, 96, 96]
    - [18, 4321.24]
  - - [128, 4096, 1, 128, 160, 160, 160, 160]
    - [30, 7756.46]
  - - [128, 4096, 1, 256, 160, 160, 288, 288]
    - [25, 12868.4]
  - - [128, 4096, 1, 512, 160, 160, 544, 544]
    - [2, 19392.8]
  - - [128, 4096, 1, 1024, 160, 160, 1056, 1056]
    - [2, 26589.6]
  - - [128, 4096, 1, 2048, 160, 160, 2080, 2080]
    - [7, 31724.3]
  - - [128, 4096, 1, 4096, 160, 160, 4128, 4128]
    - [8, 32440.3]
  - - [256, 64, 1, 64, 288, 288, 96, 96]
    - [12, 146.102]
  - - [256, 64, 1, 128, 288, 288, 160, 160]
    - [9, 273.458]
  - - [256, 64, 1, 256, 288, 288, 288, 288]
    - [7, 470.583]
  - - [256, 64, 1, 512, 288, 288, 544, 544]
    - [26, 740.978]
  - - [256, 64, 1, 1024, 288, 288, 1056, 1056]
    - [28, 971.408]
  - - [256, 64, 1, 2048, 288, 288, 2080, 2080]
    - [28, 1224.61]
  - - [256, 64, 1, 4096, 288, 288, 4128, 4128]
    - [2, 1327.1]
  - - [256, 128, 1, 64, 288, 288, 96, 96]
    - [12, 331.512]
  - - [256, 128, 1, 128, 288, 288, 160, 160]
    - [1, 631.102]
  - - [256, 128, 1, 256, 288, 288, 288, 288]
    - [3, 1016.55]
  - - [256, 128, 1, 512, 288, 288, 544, 544]
    - [7, 1560.53]
  - - [256, 128, 1, 1024, 288, 288, 1056, 1056]
    - [22, 2116.6]
  - - [256, 128, 1, 2048, 288, 288, 2080, 2080]
    - [7, 2578.83]
  - - [256, 128, 1, 4096, 288, 288, 4128, 4128]
    - [7, 2809.84]
  - - [256, 256, 1, 64, 288, 288, 96, 96]
    - [12, 698.12]
  - - [256, 256, 1, 128, 288, 288, 160, 160]
    - [6, 1256.34]
  - - [256, 256, 1, 256, 288, 288, 288, 288]
    - [7, 2103.73]
  - - [256, 256, 1, 512, 288, 288, 544, 544]
    - [11, 3194.75]
  - - [256, 256, 1, 1024, 288, 288, 1056, 1056]
    - [2, 4311.25]
  - - [256, 256, 1, 2048, 288, 288, 2080, 2080]
    - [2, 5203.24]
  - - [256, 256, 1, 4096, 288, 288, 4128, 4128]
    - [2, 5754.24]
  - - [256, 512, 1, 64, 288, 288, 96, 96]
    - [23, 1416.03]
  - - [256, 512, 1, 128, 288, 288, 160, 160]
    - [12, 2546.63]
  - - [256, 512, 1, 256, 288, 288, 288, 288]
    - [2, 4239.35]
  - - [256, 512, 1, 512, 288, 288, 544, 544]
    - [22, 6454.02]
  - - [256, 512, 1, 1024, 288, 288, 1056, 1056]
    - [7, 8655.84]
  - - [256, 512, 1, 2048, 288, 288, 2080, 2080]
    - [2, 10428.3]
  - - [256, 512, 1, 4096, 288, 288, 4128, 4128]
    - [28, 11588.0]
  - - [256, 1024, 1, 64, 288, 288, 96, 96]
    - [23, 2638.34]
  - - [256, 1024, 1, 128, 288, 288, 160, 160]
    - [21, 4975.45]
  - - [256, 1024, 1, 256, 288, 288, 288, 288]
    - [22, 8344.8]
  - - [256, 1024, 1, 512, 288, 288, 544, 544]
    - [22, 12664.4]
  - - [256, 1024, 1, 1024, 288, 288, 1056, 1056]
    - [7, 16999.3]
  - - [256, 1024, 1, 2048, 288, 288, 2080, 2080]
    - [22, 21029.8]
  - - [256, 1024, 1, 4096, 288, 288, 4128, 4128]
    - [28, 23312.3]
  - - [256, 2048, 1, 64, 288, 288, 96, 96]
    - [26, 4375.9]
  - - [256, 2048, 1, 128, 288, 288, 160, 160]
    - [11, 7866.47]
  - - [256, 2048, 1, 256, 288, 288, 288, 288]
    - [2, 13016.9]
  - - [256, 2048, 1, 512, 288, 288, 544, 544]
    - [11, 19505.5]
  - - [256, 2048, 1, 1024, 288, 288, 1056, 1056]
    - [11, 26431.2]
  - - [256, 2048, 1, 2048, 288, 288, 2080, 2080]
    - [2, 31527.8]
  - - [256, 2048, 1, 4096, 288, 288, 4128, 4128]
    - [28, 33907.8]
  - - [256, 4096, 1, 64, 288, 288, 96, 96]
    - [12, 8261.59]
  - - [256, 4096, 1, 128, 288, 288, 160, 160]
    - [11, 13575.2]
  - - [256, 4096, 1, 256, 288, 288, 288, 288]
    - [3, 20254.7]
  - - [256, 4096, 1, 512, 288, 288, 544, 544]
    - [2, 26952.7]
  - - [256, 4096, 1, 1024, 288, 288, 1056, 1056]
    - [11, 32097.0]
  - - [256, 4096, 1, 2048, 288, 288, 2080, 2080]
    - [2, 34026.0]
  - - [256, 4096, 1, 4096, 288, 288, 4128, 4128]
    - [8, 34426.4]
  - - [384, 64, 1, 64, 416, 416, 96, 96]
    - [12, 224.984]
  - - [384, 64, 1, 128, 416, 416, 160, 160]
    - [12, 419.766]
  - - [384, 64, 1, 256, 416, 416, 288, 288]
    - [7, 749.784]
  - - [384, 64, 1, 512, 416, 416, 544, 544]
    - [14, 1117.59]
  - - [384, 64, 1, 1024, 416, 416, 1056, 1056]
    - [20, 1487.87]
  - - [384, 64, 1, 2048, 416, 416, 2080, 2080]
    - [28, 1844.93]
  - - [384, 64, 1, 4096, 416, 416, 4128, 4128]
    - [11, 1994.4]
  - - [384, 128, 1, 64, 416, 416, 96, 96]
    - [23, 507.785]
  - - [384, 128, 1, 128, 416, 416, 160, 160]
    - [21, 972.852]
  - - [384, 128, 1, 256, 416, 416, 288, 288]
    - [11, 1618.38]
  - - [384, 128, 1, 512, 416, 416, 544, 544]
    - [11, 2438.79]
  - - [384, 128, 1, 1024, 416, 416, 1056, 1056]
    - [11, 3266.8]
  - - [384, 128, 1, 2048, 416, 416, 2080, 2080]
    - [28, 3916.71]
  - - [384, 128, 1, 4096, 416, 416, 4128, 4128]
    - [2, 4290.85]
  - - [384, 256, 1, 64, 416, 416, 96, 96]
    - [10, 1059.17]
  - - [384, 256, 1, 128, 416, 416, 160, 160]
    - [17, 1905.06]
  - - [384, 256, 1, 256, 416, 416, 288, 288]
    - [29, 3160.34]
  - - [384, 256, 1, 512, 416, 416, 544, 544]
    - [11, 4812.28]
  - - [384, 256, 1, 1024, 416, 416, 1056, 1056]
    - [11, 6441.63]
  - - [384, 256, 1, 2048, 416, 416, 2080, 2080]
    - [2, 7810.93]
  - - [384, 256, 1, 4096, 416, 416, 4128, 4128]
    - [2, 8601.67]
  - - [384, 512, 1, 64, 416, 416, 96, 96]
    - [29, 2043.34]
  - - [384, 512, 1, 128, 416, 416, 160, 160]
    - [29, 3842.7]
  - - [384, 512, 1, 256, 416, 416, 288, 288]
    - [2, 6398.63]
  - - [384, 512, 1, 512, 416, 416, 544, 544]
    - [11, 9694.08]
  - - [384, 512, 1, 1024, 416, 416, 1056, 1056]
    - [0, 12924.6]
  - - [384, 512, 1, 2048, 416, 416, 2080, 2080]
    - [2, 15635.8]
  - - [384, 512, 1, 4096, 416, 416, 4128, 4128]
    - [22, 16866.8]
  - - [384, 1024, 1, 64, 416, 416, 96, 96]
    - [22, 3565.57]
  - - [384, 1024, 1, 128, 416, 416, 160, 160]
    - [28, 6357.41]
  - - [384, 1024, 1, 256, 416, 416, 288, 288]
    - [11, 10421.7]
  - - [384, 1024, 1, 512, 416, 416, 544, 544]
    - [0, 15282.1]
  - - [384, 1024, 1, 1024, 416, 416, 1056, 1056]
    - [2, 20423.7]
  - - [384, 1024, 1, 2048, 416, 416, 2080, 2080]
    - [16, 23986.0]
  - - [384, 1024, 1, 4096, 416, 416, 4128, 4128]
    - [22, 25670.0]
  - - [384, 2048, 1, 64, 416, 416, 96, 96]
    - [27, 5651.43]
  - - [384, 2048, 1, 128, 416, 416, 160, 160]
    - [21, 10570.5]
  - - [384, 2048, 1, 256, 416, 416, 288, 288]
    - [23, 17270.9]
  - - [384, 2048, 1, 512, 416, 416, 544, 544]
    - [0, 23414.2]
  - - [384, 2048, 1, 1024, 416, 416, 1056, 1056]
    - [22, 28715.8]
  - - [384, 2048, 1, 2048, 416, 416, 2080, 2080]
    - [2, 30728.1]
  - - [384, 2048, 1, 4096, 416, 416, 4128, 4128]
    - [22, 33564.9]
  - - [384, 4096, 1, 64, 416, 416, 96, 96]
    - [23, 9321.54]
  - - [384, 4096, 1, 128, 416, 416, 160, 160]
    - [23, 14657.9]
  - - [384, 4096, 1, 256, 416, 416, 288, 288]
    - [3, 20453.8]
  - - [384, 4096, 1, 512, 416, 416, 544, 544]
    - [23, 25958.3]
  - - [384, 4096, 1, 1024, 416, 416, 1056, 1056]
    - [22, 28841.3]
  - - [384, 4096, 1, 2048, 416, 416, 2080, 2080]
    - [11, 31910.1]
  - - [384, 4096, 1, 4096, 416, 416, 4128, 4128]
    - [22, 32506.7]
  - - [768, 64, 1, 64, 800, 800, 96, 96]
    - [3, 488.847]
  - - [768, 64, 1, 128, 800, 800, 160, 160]
    - [14, 902.389]
  - - [768, 64, 1, 256, 800, 800, 288, 288]
    - [7, 1538.82]
  - - [768, 64, 1, 512, 800, 800, 544, 544]
    - [9, 2232.6]
  - - [768, 64, 1, 1024, 800, 800, 1056, 1056]
    - [22, 2967.66]
  - - [768, 64, 1, 2048, 800, 800, 2080, 2080]
    - [22, 3708.08]
  - - [768, 64, 1, 4096, 800, 800, 4128, 4128]
    - [9, 3979.81]
  - - [768, 128, 1, 64, 800, 800, 96, 96]
    - [29, 992.97]
  - - [768, 128, 1, 128, 800, 800, 160, 160]
    - [10, 1889.89]
  - - [768, 128, 1, 256, 800, 800, 288, 288]
    - [0, 3151.64]
  - - [768, 128, 1, 512, 800, 800, 544, 544]
    - [22, 4777.57]
  - - [768, 128, 1, 1024, 800, 800, 1056, 1056]
    - [2, 6421.49]
  - - [768, 128, 1, 2048, 800, 800, 2080, 2080]
    - [22, 7729.65]
  - - [768, 128, 1, 4096, 800, 800, 4128, 4128]
    - [2, 8118.82]
  - - [768, 256, 1, 64, 800, 800, 96, 96]
    - [23, 2130.53]
  - - [768, 256, 1, 128, 800, 800, 160, 160]
    - [15, 3825.17]
  - - [768, 256, 1, 256, 800, 800, 288, 288]
    - [2, 6370.29]
  - - [768, 256, 1, 512, 800, 800, 544, 544]
    - [2, 9640.21]
  - - [768, 256, 1, 1024, 800, 800, 1056, 1056]
    - [2, 12865.9]
  - - [768, 256, 1, 2048, 800, 800, 2080, 2080]
    - [11, 15514.7]
  - - [768, 256, 1, 4096, 800, 800, 4128, 4128]
    - [16, 16705.9]
  - - [768, 512, 1, 64, 800, 800, 96, 96]
    - [16, 3582.83]
  - - [768, 512, 1, 128, 800, 800, 160, 160]
    - [22, 6368.68]
  - - [768, 512, 1, 256, 800, 800, 288, 288]
    - [2, 10405.6]
  - - [768, 512, 1, 512, 800, 800, 544, 544]
    - [2, 15381.4]
  - - [768, 512, 1, 1024, 800, 800, 1056, 1056]
    - [2, 20583.4]
  - - [768, 512, 1, 2048, 800, 800, 2080, 2080]
    - [8, 24014.6]
  - - [768, 512, 1, 4096, 800, 800, 4128, 4128]
    - [8, 25511.4]
  - - [768, 1024, 1, 64, 800, 800, 96, 96]
    - [10, 5691.05]
  - - [768, 1024, 1, 128, 800, 800, 160, 160]
    - [10, 10631.9]
  - - [768, 1024, 1, 256, 800, 800, 288, 288]
    - [3, 16513.0]
  - - [768, 1024, 1, 512, 800, 800, 544, 544]
    - [20, 22687.2]
  - - [768, 1024, 1, 1024, 800, 800, 1056, 1056]
    - [9, 27700.4]
  - - [768, 1024, 1, 2048, 800, 800, 2080, 2080]
    - [28, 30531.8]
  - - [768, 1024, 1, 4096, 800, 800, 4128, 4128]
    - [22, 33538.3]
  - - [768, 2048, 1, 64, 800, 800, 96, 96]
    - [28, 10093.6]
  - - [768, 2048, 1, 128, 800, 800, 160, 160]
    - [16, 16134.5]
  - - [768, 2048, 1, 256, 800, 800, 288, 288]
    - [23, 22714.1]
  - - [768, 2048, 1, 512, 800, 800, 544, 544]
    - [2, 28840.3]
  - - [768, 2048, 1, 1024, 800, 800, 1056, 1056]
    - [22, 31995.9]
  - - [768, 2048, 1, 2048, 800, 800, 2080, 2080]
    - [22, 35301.5]
  - - [768, 2048, 1, 4096, 800, 800, 4128, 4128]
    - [22, 37370.5]
  - - [768, 4096, 1, 64, 800, 800, 96, 96]
    - [12, 12722.1]
  - - [768, 4096, 1, 128, 800, 800, 160, 160]
    - [2, 19122.0]
  - - [768, 4096, 1, 256, 800, 800, 288, 288]
    - [23, 25389.5]
  - - [768, 4096, 1, 512, 800, 800, 544, 544]
    - [2, 29809.0]
  - - [768, 4096, 1, 1024, 800, 800, 1056, 1056]
    - [28, 34232.7]
  - - [768, 4096, 1, 2048, 800, 800, 2080, 2080]
    - [28, 37178.1]
  - - [768, 4096, 1, 4096, 800, 800, 4128, 4128]
    - [28, 36702.3]
  - - [1536, 64, 1, 64, 1568, 1568, 96, 96]
    - [2, 927.67]
  - - [1536, 64, 1, 128, 1568, 1568, 160, 160]
    - [9, 1734.14]
  - - [1536, 64, 1, 256, 1568, 1568, 288, 288]
    - [0, 2950.96]
  - - [1536, 64, 1, 512, 1568, 1568, 544, 544]
    - [9, 4341.56]
  - - [1536, 64, 1, 1024, 1568, 1568, 1056, 1056]
    - [2, 5924.16]
  - - [1536, 64, 1, 2048, 1568, 1568, 2080, 2080]
    - [2, 7453.77]
  - - [1536, 64, 1, 4096, 1568, 1568, 4128, 4128]
    - [22, 8251.09]
  - - [1536, 128, 1, 64, 1568, 1568, 96, 96]
    - [19, 1893.59]
  - - [1536, 128, 1, 128, 1568, 1568, 160, 160]
    - [10, 3619.94]
  - - [1536, 128, 1, 256, 1568, 1568, 288, 288]
    - [22, 6060.4]
  - - [1536, 128, 1, 512, 1568, 1568, 544, 544]
    - [11, 9258.08]
  - - [1536, 128, 1, 1024, 1568, 1568, 1056, 1056]
    - [22, 12492.3]
  - - [1536, 128, 1, 2048, 1568, 1568, 2080, 2080]
    - [11, 15425.5]
  - - [1536, 128, 1, 4096, 1568, 1568, 4128, 4128]
    - [11, 17053.3]
  - - [1536, 256, 1, 64, 1568, 1568, 96, 96]
    - [24, 3418.81]
  - - [1536, 256, 1, 128, 1568, 1568, 160, 160]
    - [22, 6120.84]
  - - [1536, 256, 1, 256, 1568, 1568, 288, 288]
    - [22, 10016.2]
  - - [1536, 256, 1, 512, 1568, 1568, 544, 544]
    - [13, 14862.4]
  - - [1536, 256, 1, 1024, 1568, 1568, 1056, 1056]
    - [25, 19838.0]
  - - [1536, 256, 1, 2048, 1568, 1568, 2080, 2080]
    - [25, 24074.2]
  - - [1536, 256, 1, 4096, 1568, 1568, 4128, 4128]
    - [4, 25641.8]
  - - [1536, 512, 1, 64, 1568, 1568, 96, 96]
    - [29, 5762.73]
  - - [1536, 512, 1, 128, 1568, 1568, 160, 160]
    - [2, 10113.9]
  - - [1536, 512, 1, 256, 1568, 1568, 288, 288]
    - [23, 17705.3]
  - - [1536, 512, 1, 512, 1568, 1568, 544, 544]
    - [2, 23522.2]
  - - [1536, 512, 1, 1024, 1568, 1568, 1056, 1056]
    - [11, 28515.5]
  - - [1536, 512, 1, 2048, 1568, 1568, 2080, 2080]
    - [22, 30715.2]
  - - [1536, 512, 1, 4096, 1568, 1568, 4128, 4128]
    - [2, 33101.7]
  - - [1536, 1024, 1, 64, 1568, 1568, 96, 96]
    - [26, 9838.09]
  - - [1536, 1024, 1, 128, 1568, 1568, 160, 160]
    - [28, 15797.8]
  - - [1536, 1024, 1, 256, 1568, 1568, 288, 288]
    - [23, 22503.4]
  - - [1536, 1024, 1, 512, 1568, 1568, 544, 544]
    - [20, 28510.5]
  - - [1536, 1024, 1, 1024, 1568, 1568, 1056, 1056]
    - [22, 32034.1]
  - - [1536, 1024, 1, 2048, 1568, 1568, 2080, 2080]
    - [22, 35425.7]
  - - [1536, 1024, 1, 4096, 1568, 1568, 4128, 4128]
    - [22, 37301.5]
  - - [1536, 2048, 1, 64, 1568, 1568, 96, 96]
    - [23, 12454.5]
  - - [1536, 2048, 1, 128, 1568, 1568, 160, 160]
    - [23, 19030.8]
  - - [1536, 2048, 1, 256, 1568, 1568, 288, 288]
    - [29, 25477.1]
  - - [1536, 2048, 1, 512, 1568, 1568, 544, 544]
    - [20, 30053.8]
  - - [1536, 2048, 1, 1024, 1568, 1568, 1056, 1056]
    - [28, 34385.4]
  - - [1536, 2048, 1, 2048, 1568, 1568, 2080, 2080]
    - [28, 37109.2]
  - - [1536, 2048, 1, 4096, 1568, 1568, 4128, 4128]
    - [11, 37440.0]
  - - [1536, 4096, 1, 64, 1568, 1568, 96, 96]
    - [12, 14424.3]
  - - [1536, 4096, 1, 128, 1568, 1568, 160, 160]
    - [3, 19898.3]
  - - [1536, 4096, 1, 256, 1568, 1568, 288, 288]
    - [23, 26513.5]
  - - [1536, 4096, 1, 512, 1568, 1568, 544, 544]
    - [22, 32001.3]
  - - [1536, 4096, 1, 1024, 1568, 1568, 1056, 1056]
    - [28, 35774.7]
  - - [1536, 4096, 1, 2048, 1568, 1568, 2080, 2080]
    - [28, 37333.3]
  - - [1536, 4096, 1, 4096, 1568, 1568, 4128, 4128]
    - [14, 37436.3]
  - - [3072, 64, 1, 64, 3104, 3104, 96, 96]
    - [25, 1746.17]
  - - [3072, 64, 1, 128, 3104, 3104, 160, 160]
    - [14, 3297.84]
  - - [3072, 64, 1, 256, 3104, 3104, 288, 288]
    - [13, 4905.14]
  - - [3072, 64, 1, 512, 3104, 3104, 544, 544]
    - [4, 7327.36]
  - - [3072, 64, 1, 1024, 3104, 3104, 1056, 1056]
    - [25, 9869.43]
  - - [3072, 64, 1, 2048, 3104, 3104, 2080, 2080]
    - [4, 11835.8]
  - - [3072, 64, 1, 4096, 3104, 3104, 4128, 4128]
    - [8, 12559.4]
  - - [3072, 128, 1, 64, 3104, 3104, 96, 96]
    - [11, 3175.1]
  - - [3072, 128, 1, 128, 3104, 3104, 160, 160]
    - [8, 6196.19]
  - - [3072, 128, 1, 256, 3104, 3104, 288, 288]
    - [25, 10195.8]
  - - [3072, 128, 1, 512, 3104, 3104, 544, 544]
    - [25, 15087.4]
  - - [3072, 128, 1, 1024, 3104, 3104, 1056, 1056]
    - [25, 20395.8]
  - - [3072, 128, 1, 2048, 3104, 3104, 2080, 2080]
    - [25, 24136.3]
  - - [3072, 128, 1, 4096, 3104, 3104, 4128, 4128]
    - [4, 25545.4]
  - - [3072, 256, 1, 64, 3104, 3104, 96, 96]
    - [13, 5372.15]
  - - [3072, 256, 1, 128, 3104, 3104, 160, 160]
    - [21, 9947.95]
  - - [3072, 256, 1, 256, 3104, 3104, 288, 288]
    - [29, 16228.1]
  - - [3072, 256, 1, 512, 3104, 3104, 544, 544]
    - [10, 21933.4]
  - - [3072, 256, 1, 1024, 3104, 3104, 1056, 1056]
    - [12, 26465.1]
  - - [3072, 256, 1, 2048, 3104, 3104, 2080, 2080]
    - [12, 28809.3]
  - - [3072, 256, 1, 4096, 3104, 3104, 4128, 4128]
    - [15, 30508.6]
  - - [3072, 512, 1, 64, 3104, 3104, 96, 96]
    - [14, 9767.45]
  - - [3072, 512, 1, 128, 3104, 3104, 160, 160]
    - [11, 15716.3]
  - - [3072, 512, 1, 256, 3104, 3104, 288, 288]
    - [12, 22378.3]
  - - [3072, 512, 1, 512, 3104, 3104, 544, 544]
    - [17, 28223.7]
  - - [3072, 512, 1, 1024, 3104, 3104, 1056, 1056]
    - [23, 31268.6]
  - - [3072, 512, 1, 2048, 3104, 3104, 2080, 2080]
    - [23, 34506.6]
  - - [3072, 512, 1, 4096, 3104, 3104, 4128, 4128]
    - [11, 35980.9]
  - - [3072, 1024, 1, 64, 3104, 3104, 96, 96]
    - [28, 12415.3]
  - - [3072, 1024, 1, 128, 3104, 3104, 160, 160]
    - [22, 18968.9]
  - - [3072, 1024, 1, 256, 3104, 3104, 288, 288]
    - [17, 25147.7]
  - - [3072, 1024, 1, 512, 3104, 3104, 544, 544]
    - [17, 29451.5]
  - - [3072, 1024, 1, 1024, 3104, 3104, 1056, 1056]
    - [22, 33769.0]
  - - [3072, 1024, 1, 2048, 3104, 3104, 2080, 2080]
    - [11, 36427.6]
  - - [3072, 1024, 1, 4096, 3104, 3104, 4128, 4128]
    - [2, 36175.5]
  - - [3072, 2048, 1, 64, 3104, 3104, 96, 96]
    - [21, 14349.7]
  - - [3072, 2048, 1, 128, 3104, 3104, 160, 160]
    - [17, 19868.9]
  - - [3072, 2048, 1, 256, 3104, 3104, 288, 288]
    - [21, 26205.0]
  - - [3072, 2048, 1, 512, 3104, 3104, 544, 544]
    - [20, 31647.7]
  - - [3072, 2048, 1, 1024, 3104, 3104, 1056, 1056]
    - [28, 35441.9]
  - - [3072, 2048, 1, 2048, 3104, 3104, 2080, 2080]
    - [28, 37186.9]
  - - [3072, 2048, 1, 4096, 3104, 3104, 4128, 4128]
    - [2, 36606.5]
  - - [3072, 4096, 1, 64, 3104, 3104, 96, 96]
    - [23, 15083.2]
  - - [3072, 4096, 1, 128, 3104, 3104, 160, 160]
    - [23, 21854.5]
  - - [3072, 4096, 1, 256, 3104, 3104, 288, 288]
    - [23, 27887.5]
  - - [3072, 4096, 1, 512, 3104, 3104, 544, 544]
    - [28, 32940.6]
  - - [3072, 4096, 1, 1024, 3104, 3104, 1056, 1056]
    - [28, 35740.6]
  - - [3072, 4096, 1, 2048, 3104, 3104, 2080, 2080]
    - [16, 36999.3]
  - - [3072, 4096, 1, 4096, 3104, 3104, 4128, 4128]
    - [13, 35682.4]
  - - [4096, 64, 1, 64, 4128, 4128, 96, 96]
    - [25, 1794.16]
  - - [4096, 64, 1, 128, 4128, 4128, 160, 160]
    - [13, 3624.36]
  - - [4096, 64, 1, 256, 4128, 4128, 288, 288]
    - [8, 6047.48]
  - - [4096, 64, 1, 512, 4128, 4128, 544, 544]
    - [18, 9277.51]
  - - [4096, 64, 1, 1024, 4128, 4128, 1056, 1056]
    - [8, 12762.0]
  - - [4096, 64, 1, 2048, 4128, 4128, 2080, 2080]
    - [13, 15591.3]
  - - [4096, 64, 1, 4096, 4128, 4128, 4128, 4128]
    - [18, 16424.1]
  - - [4096, 128, 1, 64, 4128, 4128, 96, 96]
    - [22, 5059.46]
  - - [4096, 128, 1, 128, 4128, 4128, 160, 160]
    - [11, 9081.04]
  - - [4096, 128, 1, 256, 4128, 4128, 288, 288]
    - [4, 14506.9]
  - - [4096, 128, 1, 512, 4128, 4128, 544, 544]
    - [28, 21203.4]
  - - [4096, 128, 1, 1024, 4128, 4128, 1056, 1056]
    - [20, 27458.6]
  - - [4096, 128, 1, 2048, 4128, 4128, 2080, 2080]
    - [11, 31860.8]
  - - [4096, 128, 1, 4096, 4128, 4128, 4128, 4128]
    - [25, 32544.0]
  - - [4096, 256, 1, 64, 4128, 4128, 96, 96]
    - [12, 7860.94]
  - - [4096, 256, 1, 128, 4128, 4128, 160, 160]
    - [29, 13104.6]
  - - [4096, 256, 1, 256, 4128, 4128, 288, 288]
    - [28, 19780.1]
  - - [4096, 256, 1, 512, 4128, 4128, 544, 544]
    - [23, 26154.4]
  - - [4096, 256, 1, 1024, 4128, 4128, 1056, 1056]
    - [23, 30932.9]
  - - [4096, 256, 1, 2048, 4128, 4128, 2080, 2080]
    - [22, 33237.6]
  - - [4096, 256, 1, 4096, 4128, 4128, 4128, 4128]
    - [4, 34493.3]
  - - [4096, 512, 1, 64, 4128, 4128, 96, 96]
    - [11, 10777.1]
  - - [4096, 512, 1, 128, 4128, 4128, 160, 160]
    - [9, 17045.7]
  - - [4096, 512, 1, 256, 4128, 4128, 288, 288]
    - [29, 23636.1]
  - - [4096, 512, 1, 512, 4128, 4128, 544, 544]
    - [12, 28937.1]
  - - [4096, 512, 1, 1024, 4128, 4128, 1056, 1056]
    - [12, 32215.5]
  - - [4096, 512, 1, 2048, 4128, 4128, 2080, 2080]
    - [28, 35312.6]
  - - [4096, 512, 1, 4096, 4128, 4128, 4128, 4128]
    - [25, 35733.6]
  - - [4096, 1024, 1, 64, 4128, 4128, 96, 96]
    - [27, 13237.8]
  - - [4096, 1024, 1, 128, 4128, 4128, 160, 160]
    - [29, 19938.0]
  - - [4096, 1024, 1, 256, 4128, 4128, 288, 288]
    - [23, 24864.9]
  - - [4096, 1024, 1, 512, 4128, 4128, 544, 544]
    - [20, 30627.6]
  - - [4096, 1024, 1, 1024, 4128, 4128, 1056, 1056]
    - [16, 34561.3]
  - - [4096, 1024, 1, 2048, 4128, 4128, 2080, 2080]
    - [28, 37052.7]
  - - [4096, 1024, 1, 4096, 4128, 4128, 4128, 4128]
    - [22, 35549.9]
  - - [4096, 2048, 1, 64, 4128, 4128, 96, 96]
    - [23, 15046.8]
  - - [4096, 2048, 1, 128, 4128, 4128, 160, 160]
    - [23, 20856.2]
  - - [4096, 2048, 1, 256, 4128, 4128, 288, 288]
    - [23, 27016.4]
  - - [4096, 2048, 1, 512, 4128, 4128, 544, 544]
    - [22, 32297.4]
  - - [4096, 2048, 1, 1024, 4128, 4128, 1056, 1056]
    - [28, 35954.1]
  - - [4096, 2048, 1, 2048, 4128, 4128, 2080, 2080]
    - [11, 37291.7]
  - - [4096, 2048, 1, 4096, 4128, 4128, 4128, 4128]
    - [30, 35673.4]
  - - [4096, 4096, 1, 64, 4128, 4128, 96, 96]
    - [23, 15017.8]
  - - [4096, 4096, 1, 128, 4128, 4128, 160, 160]
    - [16, 21305.2]
  - - [4096, 4096, 1, 256, 4128, 4128, 288, 288]
    - [11, 27487.1]
  - - [4096, 4096, 1, 512, 4128, 4128, 544, 544]
    - [28, 33021.3]
  - - [4096, 4096, 1, 1024, 4128, 4128, 1056, 1056]
    - [28, 35981.0]
  - - [4096, 4096, 1, 2048, 4128, 4128, 2080, 2080]
    - [11, 37429.5]
  - - [4096, 4096, 1, 4096, 4128, 4128, 4128, 4128]
    - [25, 35235.8]
- null
- null
- DeviceEfficiency
