library/src/blas3/Tensile/Logic/asm_full/navi33/navi33_Cijk_Ailk_Bjlk_HHS_BH.yaml
- {MinimumRequiredVersion: 4.35.0}
- navi33
- gfx1102
- [Device 73f0]
    SolutionIndex: 0
    SolutionNameMin: Cijk_Ailk_Bjlk_HHS_BH_MT128x128x16_MI16x16x16x1_SN_1LDSB0_AMAS3_GRVW8_PLR0_SIA1_SVW4_VW4_WGM2
    SolutionIndex: 1
    SolutionNameMin: Cijk_Ailk_Bjlk_HHS_BH_MT128x128x16_MI16x16x16x1_SN_1LDSB0_AMAS3_GRVW8_PLR1_SIA1_SVW4_VW4_WGM2
    SolutionIndex: 2
    SolutionNameMin: Cijk_Ailk_Bjlk_HHS_BH_MT128x128x16_MI16x16x16x1_SN_1LDSB1_AMAS0_GRVW4_PLR1_SIA2_SVW1_VW1_WGM2
    SolutionIndex: 3
    SolutionNameMin: Cijk_Ailk_Bjlk_HHS_BH_MT128x128x16_MI16x16x16x1_SN_1LDSB1_AMAS3_GRVW4_PLR1_SIA2_SVW4_VW4_WGM2
    SolutionIndex: 4
    SolutionNameMin: Cijk_Ailk_Bjlk_HHS_BH_MT128x128x16_MI16x16x16x1_SN_1LDSB1_AMAS0_GRVW8_PLR1_SIA2_SVW1_VW1_WGM2
    SolutionIndex: 5
    SolutionNameMin: Cijk_Ailk_Bjlk_HHS_BH_MT128x128x16_MI16x16x16x1_SN_1LDSB1_AMAS3_GRVW8_PLR1_SIA2_SVW4_VW4_WGM2
    SolutionIndex: 6
    SolutionNameMin: Cijk_Ailk_Bjlk_HHS_BH_MT128x128x16_MI16x16x16x1_SN_1LDSB0_AMAS3_GRVW8_PLR0_SIA1_SVW4_VW4_WGM4
    SolutionIndex: 7
    SolutionNameMin: Cijk_Ailk_Bjlk_HHS_BH_MT128x128x16_MI16x16x16x1_SN_1LDSB0_AMAS3_GRVW8_PLR1_SIA1_SVW4_VW4_WGM4
    SolutionIndex: 8
    SolutionNameMin: Cijk_Ailk_Bjlk_HHS_BH_MT128x128x16_MI16x16x16x1_SN_1LDSB1_AMAS0_GRVW4_PLR1_SIA2_SVW1_VW1_WGM4
    SolutionIndex: 9
    SolutionNameMin: Cijk_Ailk_Bjlk_HHS_BH_MT128x128x16_MI16x16x16x1_SN_1LDSB1_AMAS3_GRVW4_PLR1_SIA2_SVW4_VW4_WGM4
    SolutionIndex: 10
    SolutionNameMin: Cijk_Ailk_Bjlk_HHS_BH_MT128x128x16_MI16x16x16x1_SN_1LDSB1_AMAS0_GRVW8_PLR1_SIA2_SVW1_VW1_WGM4
    SolutionIndex: 11
    SolutionNameMin: Cijk_Ailk_Bjlk_HHS_BH_MT128x128x16_MI16x16x16x1_SN_1LDSB1_AMAS3_GRVW8_PLR1_SIA2_SVW4_VW4_WGM4
    SolutionIndex: 12
    SolutionNameMin: Cijk_Ailk_Bjlk_HHS_BH_MT128x128x16_MI16x16x16x1_SN_1LDSB0_AMAS3_GRVW8_PLR0_SIA3_SVW4_VW4_WGM4
    SolutionIndex: 13
    SolutionNameMin: Cijk_Ailk_Bjlk_HHS_BH_MT128x128x16_MI16x16x16x1_SN_1LDSB0_AMAS3_GRVW8_PLR1_SIA3_SVW4_VW4_WGM4
    SolutionIndex: 14
    SolutionNameMin: Cijk_Ailk_Bjlk_HHS_BH_MT128x128x16_MI16x16x16x1_SN_1LDSB0_AMAS3_GRVW4_PLR0_SIA1_SVW4_VW4_WGM8
    SolutionIndex: 15
    SolutionNameMin: Cijk_Ailk_Bjlk_HHS_BH_MT128x128x16_MI16x16x16x1_SN_1LDSB0_AMAS3_GRVW8_PLR0_SIA1_SVW4_VW4_WGM8
    SolutionIndex: 16
    SolutionNameMin: Cijk_Ailk_Bjlk_HHS_BH_MT128x128x16_MI16x16x16x1_SN_1LDSB0_AMAS3_GRVW8_PLR1_SIA1_SVW4_VW4_WGM8
    SolutionIndex: 17
    SolutionNameMin: Cijk_Ailk_Bjlk_HHS_BH_MT128x128x16_MI16x16x16x1_SN_1LDSB1_AMAS3_GRVW4_PLR1_SIA2_SVW4_VW4_WGM8
    SolutionIndex: 18
    SolutionNameMin: Cijk_Ailk_Bjlk_HHS_BH_MT128x128x16_MI16x16x16x1_SN_1LDSB1_AMAS0_GRVW8_PLR1_SIA2_SVW1_VW1_WGM8
    SolutionIndex: 19
    SolutionNameMin: Cijk_Ailk_Bjlk_HHS_BH_MT128x128x16_MI16x16x16x1_SN_1LDSB1_AMAS3_GRVW8_PLR1_SIA2_SVW4_VW4_WGM8
    SolutionIndex: 20
    SolutionNameMin: Cijk_Ailk_Bjlk_HHS_BH_MT128x128x16_MI16x16x16x1_SN_1LDSB0_AMAS3_GRVW8_PLR0_SIA3_SVW4_VW4_WGM8
    SolutionIndex: 21
    SolutionNameMin: Cijk_Ailk_Bjlk_HHS_BH_MT128x128x16_MI16x16x16x1_SN_1LDSB0_AMAS3_GRVW8_PLR1_SIA3_SVW4_VW4_WGM8
    SolutionIndex: 22
    SolutionNameMin: Cijk_Ailk_Bjlk_HHS_BH_MT128x128x32_MI16x16x16x1_SN_1LDSB0_AMAS3_GRVW4_PLR0_SIA1_SVW4_VW4_WGM2
    SolutionIndex: 23
    SolutionNameMin: Cijk_Ailk_Bjlk_HHS_BH_MT128x128x32_MI16x16x16x1_SN_1LDSB0_AMAS0_GRVW8_PLR0_SIA1_SVW1_VW1_WGM2
    SolutionIndex: 24
    SolutionNameMin: Cijk_Ailk_Bjlk_HHS_BH_MT128x128x32_MI16x16x16x1_SN_1LDSB0_AMAS3_GRVW8_PLR0_SIA1_SVW4_VW4_WGM2
    SolutionIndex: 25
    SolutionNameMin: Cijk_Ailk_Bjlk_HHS_BH_MT128x128x32_MI16x16x16x1_SN_1LDSB0_AMAS3_GRVW4_PLR0_SIA1_SVW4_VW4_WGM4
    SolutionIndex: 26
    SolutionNameMin: Cijk_Ailk_Bjlk_HHS_BH_MT128x128x32_MI16x16x16x1_SN_1LDSB0_AMAS0_GRVW8_PLR0_SIA1_SVW1_VW1_WGM4
    SolutionIndex: 27
    SolutionNameMin: Cijk_Ailk_Bjlk_HHS_BH_MT128x128x32_MI16x16x16x1_SN_1LDSB0_AMAS3_GRVW8_PLR0_SIA1_SVW4_VW4_WGM4
    SolutionIndex: 28
    SolutionNameMin: Cijk_Ailk_Bjlk_HHS_BH_MT128x128x32_MI16x16x16x1_SN_1LDSB0_AMAS0_GRVW8_PLR0_SIA1_SVW1_VW1_WGM8
    SolutionIndex: 29
    SolutionNameMin: Cijk_Ailk_Bjlk_HHS_BH_MT128x128x32_MI16x16x16x1_SN_1LDSB0_AMAS3_GRVW8_PLR0_SIA1_SVW4_VW4_WGM8
- - - [64, 64, 1, 64, 96, 96, 96, 96]
    - [0, 33.3475]
  - - [64, 64, 1, 128, 96, 96, 160, 160]
    - [1, 60.2562]
  - - [64, 64, 1, 256, 96, 96, 288, 288]
    - [19, 94.8167]
  - - [64, 64, 1, 512, 96, 96, 544, 544]
    - [28, 147.086]
  - - [64, 64, 1, 1024, 96, 96, 1056, 1056]
    - [23, 210.168]
  - - [64, 64, 1, 2048, 96, 96, 2080, 2080]
    - [27, 261.581]
  - - [64, 64, 1, 4096, 96, 96, 4128, 4128]
    - [26, 295.415]
  - - [64, 128, 1, 64, 96, 96, 96, 128]
    - [1, 61.3707]
  - - [64, 128, 1, 128, 96, 96, 160, 160]
    - [1, 111.397]
  - - [64, 128, 1, 256, 96, 96, 288, 288]
    - [19, 189.736]
  - - [64, 128, 1, 512, 96, 96, 544, 544]
    - [27, 295.728]
  - - [64, 128, 1, 1024, 96, 96, 1056, 1056]
    - [24, 414.929]
  - - [64, 128, 1, 2048, 96, 96, 2080, 2080]
    - [23, 525.933]
  - - [64, 128, 1, 4096, 96, 96, 4128, 4128]
    - [27, 585.808]
  - - [64, 256, 1, 64, 96, 96, 96, 256]
    - [1, 134.45]
  - - [64, 256, 1, 128, 96, 96, 160, 256]
    - [18, 242.98]
  - - [64, 256, 1, 256, 96, 96, 288, 288]
    - [24, 410.563]
  - - [64, 256, 1, 512, 96, 96, 544, 544]
    - [27, 635.406]
  - - [64, 256, 1, 1024, 96, 96, 1056, 1056]
    - [27, 891.082]
  - - [64, 256, 1, 2048, 96, 96, 2080, 2080]
    - [24, 1097.41]
  - - [64, 256, 1, 4096, 96, 96, 4128, 4128]
    - [29, 1205.26]
  - - [64, 512, 1, 64, 96, 96, 96, 512]
    - [15, 302.359]
  - - [64, 512, 1, 128, 96, 96, 160, 512]
    - [24, 542.04]
  - - [64, 512, 1, 256, 96, 96, 288, 512]
    - [24, 912.8]
  - - [64, 512, 1, 512, 96, 96, 544, 544]
    - [24, 1372.82]
  - - [64, 512, 1, 1024, 96, 96, 1056, 1056]
    - [29, 1876.75]
  - - [64, 512, 1, 2048, 96, 96, 2080, 2080]
    - [29, 2242.72]
  - - [64, 512, 1, 4096, 96, 96, 4128, 4128]
    - [29, 2438.11]
  - - [64, 1024, 1, 64, 96, 96, 96, 1024]
    - [19, 629.397]
  - - [64, 1024, 1, 128, 96, 96, 160, 1024]
    - [27, 1132.07]
  - - [64, 1024, 1, 256, 96, 96, 288, 1024]
    - [29, 1885.08]
  - - [64, 1024, 1, 512, 96, 96, 544, 1024]
    - [24, 2826.35]
  - - [64, 1024, 1, 1024, 96, 96, 1056, 1056]
    - [24, 3808.89]
  - - [64, 1024, 1, 2048, 96, 96, 2080, 2080]
    - [29, 4513.64]
  - - [64, 1024, 1, 4096, 96, 96, 4128, 4128]
    - [29, 4923.25]
  - - [64, 2048, 1, 64, 96, 96, 96, 2048]
    - [19, 1215.39]
  - - [64, 2048, 1, 128, 96, 96, 160, 2048]
    - [25, 2175.47]
  - - [64, 2048, 1, 256, 96, 96, 288, 2048]
    - [26, 3627.9]
  - - [64, 2048, 1, 512, 96, 96, 544, 2048]
    - [26, 5468.9]
  - - [64, 2048, 1, 1024, 96, 96, 1056, 2048]
    - [28, 7433.39]
  - - [64, 2048, 1, 2048, 96, 96, 2080, 2080]
    - [28, 9170.99]
  - - [64, 2048, 1, 4096, 96, 96, 4128, 4128]
    - [3, 8846.25]
  - - [64, 4096, 1, 64, 96, 96, 96, 4096]
    - [2, 2195.68]
  - - [64, 4096, 1, 128, 96, 96, 160, 4096]
    - [5, 3933.22]
  - - [64, 4096, 1, 256, 96, 96, 288, 4096]
    - [11, 6499.63]
  - - [64, 4096, 1, 512, 96, 96, 544, 4096]
    - [18, 9777.63]
  - - [64, 4096, 1, 1024, 96, 96, 1056, 4096]
    - [8, 13251.5]
  - - [64, 4096, 1, 2048, 96, 96, 2080, 4096]
    - [18, 15685.1]
  - - [64, 4096, 1, 4096, 96, 96, 4128, 4128]
    - [5, 16704.3]
  - - [128, 64, 1, 64, 160, 160, 128, 96]
    - [16, 67.2941]
  - - [128, 64, 1, 128, 160, 160, 160, 160]
    - [7, 124.401]
  - - [128, 64, 1, 256, 160, 160, 288, 288]
    - [0, 196.068]
  - - [128, 64, 1, 512, 160, 160, 544, 544]
    - [19, 286.868]
  - - [128, 64, 1, 1024, 160, 160, 1056, 1056]
    - [29, 413.007]
  - - [128, 64, 1, 2048, 160, 160, 2080, 2080]
    - [27, 530.017]
  - - [128, 64, 1, 4096, 160, 160, 4128, 4128]
    - [24, 585.059]
  - - [128, 128, 1, 64, 160, 160, 128, 128]
    - [15, 152.034]
  - - [128, 128, 1, 128, 160, 160, 160, 160]
    - [19, 277.18]
  - - [128, 128, 1, 256, 160, 160, 288, 288]
    - [19, 456.05]
  - - [128, 128, 1, 512, 160, 160, 544, 544]
    - [5, 674.052]
  - - [128, 128, 1, 1024, 160, 160, 1056, 1056]
    - [27, 924.666]
  - - [128, 128, 1, 2048, 160, 160, 2080, 2080]
    - [24, 1123.72]
  - - [128, 128, 1, 4096, 160, 160, 4128, 4128]
    - [29, 1216.84]
  - - [128, 256, 1, 64, 160, 160, 128, 256]
    - [1, 343.736]
  - - [128, 256, 1, 128, 160, 160, 160, 256]
    - [11, 604.539]
  - - [128, 256, 1, 256, 160, 160, 288, 288]
    - [29, 981.35]
  - - [128, 256, 1, 512, 160, 160, 544, 544]
    - [29, 1454.71]
  - - [128, 256, 1, 1024, 160, 160, 1056, 1056]
    - [27, 1948.45]
  - - [128, 256, 1, 2048, 160, 160, 2080, 2080]
    - [29, 2327.01]
  - - [128, 256, 1, 4096, 160, 160, 4128, 4128]
    - [24, 2473.28]
  - - [128, 512, 1, 64, 160, 160, 128, 512]
    - [3, 722.9]
  - - [128, 512, 1, 128, 160, 160, 160, 512]
    - [19, 1272.74]
  - - [128, 512, 1, 256, 160, 160, 288, 512]
    - [29, 2066.92]
  - - [128, 512, 1, 512, 160, 160, 544, 544]
    - [22, 3012.59]
  - - [128, 512, 1, 1024, 160, 160, 1056, 1056]
    - [24, 3988.87]
  - - [128, 512, 1, 2048, 160, 160, 2080, 2080]
    - [27, 4769.28]
  - - [128, 512, 1, 4096, 160, 160, 4128, 4128]
    - [29, 4977.46]
  - - [128, 1024, 1, 64, 160, 160, 128, 1024]
    - [11, 1472.71]
  - - [128, 1024, 1, 128, 160, 160, 160, 1024]
    - [24, 2582.68]
  - - [128, 1024, 1, 256, 160, 160, 288, 1024]
    - [29, 4210.08]
  - - [128, 1024, 1, 512, 160, 160, 544, 1024]
    - [24, 6137.6]
  - - [128, 1024, 1, 1024, 160, 160, 1056, 1056]
    - [24, 8046.12]
  - - [128, 1024, 1, 2048, 160, 160, 2080, 2080]
    - [24, 9449.25]
  - - [128, 1024, 1, 4096, 160, 160, 4128, 4128]
    - [29, 10159.3]
  - - [128, 2048, 1, 64, 160, 160, 128, 2048]
    - [19, 2906.64]
  - - [128, 2048, 1, 128, 160, 160, 160, 2048]
    - [19, 5100.23]
  - - [128, 2048, 1, 256, 160, 160, 288, 2048]
    - [27, 8268.71]
  - - [128, 2048, 1, 512, 160, 160, 544, 2048]
    - [29, 11997.6]
  - - [128, 2048, 1, 1024, 160, 160, 1056, 2048]
    - [27, 15820.9]
  - - [128, 2048, 1, 2048, 160, 160, 2080, 2080]
    - [27, 18992.7]
  - - [128, 2048, 1, 4096, 160, 160, 4128, 4128]
    - [11, 18019.1]
  - - [128, 4096, 1, 64, 160, 160, 128, 4096]
    - [19, 4825.2]
  - - [128, 4096, 1, 128, 160, 160, 160, 4096]
    - [19, 8484.03]
  - - [128, 4096, 1, 256, 160, 160, 288, 4096]
    - [11, 13846.8]
  - - [128, 4096, 1, 512, 160, 160, 544, 4096]
    - [5, 20582.3]
  - - [128, 4096, 1, 1024, 160, 160, 1056, 4096]
    - [5, 27091.3]
  - - [128, 4096, 1, 2048, 160, 160, 2080, 4096]
    - [17, 32514.8]
  - - [128, 4096, 1, 4096, 160, 160, 4128, 4128]
    - [5, 33128.8]
  - - [256, 64, 1, 64, 288, 288, 256, 96]
    - [0, 148.04]
  - - [256, 64, 1, 128, 288, 288, 256, 160]
    - [16, 271.933]
  - - [256, 64, 1, 256, 288, 288, 288, 288]
    - [0, 428.383]
  - - [256, 64, 1, 512, 288, 288, 544, 544]
    - [24, 635.018]
  - - [256, 64, 1, 1024, 288, 288, 1056, 1056]
    - [29, 886.553]
  - - [256, 64, 1, 2048, 288, 288, 2080, 2080]
    - [28, 1096.72]
  - - [256, 64, 1, 4096, 288, 288, 4128, 4128]
    - [27, 1208.16]
  - - [256, 128, 1, 64, 288, 288, 256, 128]
    - [12, 348.246]
  - - [256, 128, 1, 128, 288, 288, 256, 160]
    - [11, 634.342]
  - - [256, 128, 1, 256, 288, 288, 288, 288]
    - [11, 982.96]
  - - [256, 128, 1, 512, 288, 288, 544, 544]
    - [29, 1448.43]
  - - [256, 128, 1, 1024, 288, 288, 1056, 1056]
    - [24, 1926.75]
  - - [256, 128, 1, 2048, 288, 288, 2080, 2080]
    - [27, 2324.75]
  - - [256, 128, 1, 4096, 288, 288, 4128, 4128]
    - [29, 2466.64]
  - - [256, 256, 1, 64, 288, 288, 256, 256]
    - [19, 722.903]
  - - [256, 256, 1, 128, 288, 288, 256, 256]
    - [9, 1261.63]
  - - [256, 256, 1, 256, 288, 288, 288, 288]
    - [24, 2152.84]
  - - [256, 256, 1, 512, 288, 288, 544, 544]
    - [27, 3097.41]
  - - [256, 256, 1, 1024, 288, 288, 1056, 1056]
    - [27, 4004.08]
  - - [256, 256, 1, 2048, 288, 288, 2080, 2080]
    - [27, 4718.31]
  - - [256, 256, 1, 4096, 288, 288, 4128, 4128]
    - [29, 4981.15]
  - - [256, 512, 1, 64, 288, 288, 256, 512]
    - [11, 1478.42]
  - - [256, 512, 1, 128, 288, 288, 256, 512]
    - [19, 2574.75]
  - - [256, 512, 1, 256, 288, 288, 288, 512]
    - [27, 4185.91]
  - - [256, 512, 1, 512, 288, 288, 544, 544]
    - [29, 6097.44]
  - - [256, 512, 1, 1024, 288, 288, 1056, 1056]
    - [29, 8020.15]
  - - [256, 512, 1, 2048, 288, 288, 2080, 2080]
    - [29, 9391.05]
  - - [256, 512, 1, 4096, 288, 288, 4128, 4128]
    - [29, 10014.5]
  - - [256, 1024, 1, 64, 288, 288, 256, 1024]
    - [19, 2914.71]
  - - [256, 1024, 1, 128, 288, 288, 256, 1024]
    - [19, 5103.34]
  - - [256, 1024, 1, 256, 288, 288, 288, 1024]
    - [29, 7932.44]
  - - [256, 1024, 1, 512, 288, 288, 544, 1024]
    - [24, 12016.9]
  - - [256, 1024, 1, 1024, 288, 288, 1056, 1056]
    - [29, 15848.0]
  - - [256, 1024, 1, 2048, 288, 288, 2080, 2080]
    - [29, 18661.3]
  - - [256, 1024, 1, 4096, 288, 288, 4128, 4128]
    - [27, 18776.9]
  - - [256, 2048, 1, 64, 288, 288, 256, 2048]
    - [5, 4737.29]
  - - [256, 2048, 1, 128, 288, 288, 256, 2048]
    - [19, 8492.59]
  - - [256, 2048, 1, 256, 288, 288, 288, 2048]
    - [9, 14290.6]
  - - [256, 2048, 1, 512, 288, 288, 544, 2048]
    - [11, 20837.9]
  - - [256, 2048, 1, 1024, 288, 288, 1056, 2048]
    - [5, 27317.4]
  - - [256, 2048, 1, 2048, 288, 288, 2080, 2080]
    - [5, 32149.7]
  - - [256, 2048, 1, 4096, 288, 288, 4128, 4128]
    - [3, 33865.9]
  - - [256, 4096, 1, 64, 288, 288, 256, 4096]
    - [15, 8499.07]
  - - [256, 4096, 1, 128, 288, 288, 256, 4096]
    - [24, 14293.6]
  - - [256, 4096, 1, 256, 288, 288, 288, 4096]
    - [19, 22544.2]
  - - [256, 4096, 1, 512, 288, 288, 544, 4096]
    - [17, 29125.4]
  - - [256, 4096, 1, 1024, 288, 288, 1056, 4096]
    - [17, 34461.0]
  - - [256, 4096, 1, 2048, 288, 288, 2080, 4096]
    - [3, 36147.9]
  - - [256, 4096, 1, 4096, 288, 288, 4128, 4128]
    - [3, 38170.8]
  - - [384, 64, 1, 64, 416, 416, 384, 96]
    - [1, 240.426]
  - - [384, 64, 1, 128, 416, 416, 384, 160]
    - [15, 435.935]
  - - [384, 64, 1, 256, 416, 416, 384, 288]
    - [10, 679.862]
  - - [384, 64, 1, 512, 416, 416, 544, 544]
    - [27, 998.719]
  - - [384, 64, 1, 1024, 416, 416, 1056, 1056]
    - [24, 1368.37]
  - - [384, 64, 1, 2048, 416, 416, 2080, 2080]
    - [24, 1659.57]
  - - [384, 64, 1, 4096, 416, 416, 4128, 4128]
    - [26, 1798.48]
  - - [384, 128, 1, 64, 416, 416, 384, 128]
    - [19, 538.652]
  - - [384, 128, 1, 128, 416, 416, 384, 160]
    - [11, 980.589]
  - - [384, 128, 1, 256, 416, 416, 384, 288]
    - [29, 1562.69]
  - - [384, 128, 1, 512, 416, 416, 544, 544]
    - [29, 2290.29]
  - - [384, 128, 1, 1024, 416, 416, 1056, 1056]
    - [25, 2974.84]
  - - [384, 128, 1, 2048, 416, 416, 2080, 2080]
    - [24, 3473.77]
  - - [384, 128, 1, 4096, 416, 416, 4128, 4128]
    - [27, 3719.3]
  - - [384, 256, 1, 64, 416, 416, 384, 256]
    - [19, 1157.36]
  - - [384, 256, 1, 128, 416, 416, 384, 256]
    - [3, 2009.08]
  - - [384, 256, 1, 256, 416, 416, 384, 288]
    - [24, 3112.63]
  - - [384, 256, 1, 512, 416, 416, 544, 544]
    - [29, 4552.4]
  - - [384, 256, 1, 1024, 416, 416, 1056, 1056]
    - [24, 5973.69]
  - - [384, 256, 1, 2048, 416, 416, 2080, 2080]
    - [29, 7023.88]
  - - [384, 256, 1, 4096, 416, 416, 4128, 4128]
    - [29, 7430.08]
  - - [384, 512, 1, 64, 416, 416, 384, 512]
    - [11, 2239.34]
  - - [384, 512, 1, 128, 416, 416, 384, 512]
    - [5, 3895.61]
  - - [384, 512, 1, 256, 416, 416, 384, 512]
    - [27, 6304.02]
  - - [384, 512, 1, 512, 416, 416, 544, 544]
    - [24, 9187.06]
  - - [384, 512, 1, 1024, 416, 416, 1056, 1056]
    - [27, 11949.5]
  - - [384, 512, 1, 2048, 416, 416, 2080, 2080]
    - [24, 13987.7]
  - - [384, 512, 1, 4096, 416, 416, 4128, 4128]
    - [24, 14798.4]
  - - [384, 1024, 1, 64, 416, 416, 384, 1024]
    - [9, 3709.02]
  - - [384, 1024, 1, 128, 416, 416, 384, 1024]
    - [5, 6579.24]
  - - [384, 1024, 1, 256, 416, 416, 384, 1024]
    - [9, 10616.2]
  - - [384, 1024, 1, 512, 416, 416, 544, 1024]
    - [3, 15411.9]
  - - [384, 1024, 1, 1024, 416, 416, 1056, 1056]
    - [5, 20280.6]
  - - [384, 1024, 1, 2048, 416, 416, 2080, 2080]
    - [3, 23975.9]
  - - [384, 1024, 1, 4096, 416, 416, 4128, 4128]
    - [19, 25768.0]
  - - [384, 2048, 1, 64, 416, 416, 384, 2048]
    - [19, 6402.68]
  - - [384, 2048, 1, 128, 416, 416, 384, 2048]
    - [19, 10935.7]
  - - [384, 2048, 1, 256, 416, 416, 384, 2048]
    - [11, 18285.7]
  - - [384, 2048, 1, 512, 416, 416, 544, 2048]
    - [19, 25383.0]
  - - [384, 2048, 1, 1024, 416, 416, 1056, 2048]
    - [19, 31209.6]
  - - [384, 2048, 1, 2048, 416, 416, 2080, 2080]
    - [11, 33705.2]
  - - [384, 2048, 1, 4096, 416, 416, 4128, 4128]
    - [19, 36970.6]
  - - [384, 4096, 1, 64, 416, 416, 384, 4096]
    - [15, 12407.6]
  - - [384, 4096, 1, 128, 416, 416, 384, 4096]
    - [6, 18847.1]
  - - [384, 4096, 1, 256, 416, 416, 384, 4096]
    - [24, 25508.5]
  - - [384, 4096, 1, 512, 416, 416, 544, 4096]
    - [29, 31019.7]
  - - [384, 4096, 1, 1024, 416, 416, 1056, 4096]
    - [29, 32931.3]
  - - [384, 4096, 1, 2048, 416, 416, 2080, 4096]
    - [27, 35585.6]
  - - [384, 4096, 1, 4096, 416, 416, 4128, 4128]
    - [29, 36275.9]
  - - [768, 64, 1, 64, 800, 800, 768, 96]
    - [6, 500.191]
  - - [768, 64, 1, 128, 800, 800, 768, 160]
    - [7, 904.588]
  - - [768, 64, 1, 256, 800, 800, 768, 288]
    - [9, 1407.95]
  - - [768, 64, 1, 512, 800, 800, 768, 544]
    - [29, 2078.95]
  - - [768, 64, 1, 1024, 800, 800, 1056, 1056]
    - [24, 2727.69]
  - - [768, 64, 1, 2048, 800, 800, 2080, 2080]
    - [23, 3304.43]
  - - [768, 64, 1, 4096, 800, 800, 4128, 4128]
    - [24, 3579.76]
  - - [768, 128, 1, 64, 800, 800, 768, 128]
    - [19, 1064.72]
  - - [768, 128, 1, 128, 800, 800, 768, 160]
    - [11, 1926.64]
  - - [768, 128, 1, 256, 800, 800, 768, 288]
    - [24, 3102.28]
  - - [768, 128, 1, 512, 800, 800, 768, 544]
    - [24, 4544.59]
  - - [768, 128, 1, 1024, 800, 800, 1056, 1056]
    - [24, 5996.12]
  - - [768, 128, 1, 2048, 800, 800, 2080, 2080]
    - [24, 7004.09]
  - - [768, 128, 1, 4096, 800, 800, 4128, 4128]
    - [29, 7321.33]
  - - [768, 256, 1, 64, 800, 800, 768, 256]
    - [19, 2131.25]
  - - [768, 256, 1, 128, 800, 800, 768, 256]
    - [19, 3751.61]
  - - [768, 256, 1, 256, 800, 800, 768, 288]
    - [29, 6078.68]
  - - [768, 256, 1, 512, 800, 800, 768, 544]
    - [24, 9161.14]
  - - [768, 256, 1, 1024, 800, 800, 1056, 1056]
    - [27, 11783.8]
  - - [768, 256, 1, 2048, 800, 800, 2080, 2080]
    - [29, 13862.5]
  - - [768, 256, 1, 4096, 800, 800, 4128, 4128]
    - [27, 14794.9]
  - - [768, 512, 1, 64, 800, 800, 768, 512]
    - [3, 3885.4]
  - - [768, 512, 1, 128, 800, 800, 768, 512]
    - [5, 6835.71]
  - - [768, 512, 1, 256, 800, 800, 768, 512]
    - [5, 11035.2]
  - - [768, 512, 1, 512, 800, 800, 768, 544]
    - [19, 15944.0]
  - - [768, 512, 1, 1024, 800, 800, 1056, 1056]
    - [11, 20272.4]
  - - [768, 512, 1, 2048, 800, 800, 2080, 2080]
    - [19, 24107.3]
  - - [768, 512, 1, 4096, 800, 800, 4128, 4128]
    - [5, 25649.4]
  - - [768, 1024, 1, 64, 800, 800, 768, 1024]
    - [15, 6407.57]
  - - [768, 1024, 1, 128, 800, 800, 768, 1024]
    - [7, 10938.0]
  - - [768, 1024, 1, 256, 800, 800, 768, 1024]
    - [9, 18267.5]
  - - [768, 1024, 1, 512, 800, 800, 768, 1024]
    - [17, 25837.5]
  - - [768, 1024, 1, 1024, 800, 800, 1056, 1056]
    - [19, 31605.2]
  - - [768, 1024, 1, 2048, 800, 800, 2080, 2080]
    - [5, 33986.9]
  - - [768, 1024, 1, 4096, 800, 800, 4128, 4128]
    - [11, 36786.5]
  - - [768, 2048, 1, 64, 800, 800, 768, 2048]
    - [16, 12255.0]
  - - [768, 2048, 1, 128, 800, 800, 768, 2048]
    - [16, 18944.8]
  - - [768, 2048, 1, 256, 800, 800, 768, 2048]
    - [19, 26147.8]
  - - [768, 2048, 1, 512, 800, 800, 768, 2048]
    - [5, 31502.6]
  - - [768, 2048, 1, 1024, 800, 800, 1056, 2048]
    - [29, 33500.5]
  - - [768, 2048, 1, 2048, 800, 800, 2080, 2080]
    - [29, 36337.9]
  - - [768, 2048, 1, 4096, 800, 800, 4128, 4128]
    - [29, 37489.7]
  - - [768, 4096, 1, 64, 800, 800, 768, 4096]
    - [21, 16901.1]
  - - [768, 4096, 1, 128, 800, 800, 768, 4096]
    - [16, 24224.0]
  - - [768, 4096, 1, 256, 800, 800, 768, 4096]
    - [16, 30558.3]
  - - [768, 4096, 1, 512, 800, 800, 768, 4096]
    - [29, 33524.2]
  - - [768, 4096, 1, 1024, 800, 800, 1056, 4096]
    - [29, 36968.0]
  - - [768, 4096, 1, 2048, 800, 800, 2080, 4096]
    - [29, 38855.1]
  - - [768, 4096, 1, 4096, 800, 800, 4128, 4128]
    - [3, 39145.7]
  - - [1536, 64, 1, 64, 1568, 1568, 1536, 96]
    - [5, 959.499]
  - - [1536, 64, 1, 128, 1568, 1568, 1536, 160]
    - [1, 1739.4]
  - - [1536, 64, 1, 256, 1568, 1568, 1536, 288]
    - [9, 2761.83]
  - - [1536, 64, 1, 512, 1568, 1568, 1536, 544]
    - [25, 4153.09]
  - - [1536, 64, 1, 1024, 1568, 1568, 1536, 1056]
    - [24, 5531.84]
  - - [1536, 64, 1, 2048, 1568, 1568, 2080, 2080]
    - [28, 6735.99]
  - - [1536, 64, 1, 4096, 1568, 1568, 4128, 4128]
    - [27, 6695.34]
  - - [1536, 128, 1, 64, 1568, 1568, 1536, 128]
    - [19, 2156.07]
  - - [1536, 128, 1, 128, 1568, 1568, 1536, 160]
    - [11, 3877.6]
  - - [1536, 128, 1, 256, 1568, 1568, 1536, 288]
    - [11, 6205.34]
  - - [1536, 128, 1, 512, 1568, 1568, 1536, 544]
    - [24, 9034.54]
  - - [1536, 128, 1, 1024, 1568, 1568, 1536, 1056]
    - [24, 11692.1]
  - - [1536, 128, 1, 2048, 1568, 1568, 2080, 2080]
    - [24, 13805.5]
  - - [1536, 128, 1, 4096, 1568, 1568, 4128, 4128]
    - [23, 12360.0]
  - - [1536, 256, 1, 64, 1568, 1568, 1536, 256]
    - [29, 3770.15]
  - - [1536, 256, 1, 128, 1568, 1568, 1536, 256]
    - [3, 6807.05]
  - - [1536, 256, 1, 256, 1568, 1568, 1536, 288]
    - [5, 10966.6]
  - - [1536, 256, 1, 512, 1568, 1568, 1536, 544]
    - [19, 15902.4]
  - - [1536, 256, 1, 1024, 1568, 1568, 1536, 1056]
    - [5, 20509.9]
  - - [1536, 256, 1, 2048, 1568, 1568, 2080, 2080]
    - [5, 24440.1]
  - - [1536, 256, 1, 4096, 1568, 1568, 4128, 4128]
    - [5, 25719.9]
  - - [1536, 512, 1, 64, 1568, 1568, 1536, 512]
    - [29, 6648.81]
  - - [1536, 512, 1, 128, 1568, 1568, 1536, 512]
    - [19, 12339.1]
  - - [1536, 512, 1, 256, 1568, 1568, 1536, 512]
    - [5, 18775.1]
  - - [1536, 512, 1, 512, 1568, 1568, 1536, 544]
    - [5, 25721.9]
  - - [1536, 512, 1, 1024, 1568, 1568, 1536, 1056]
    - [17, 31457.1]
  - - [1536, 512, 1, 2048, 1568, 1568, 2080, 2080]
    - [5, 33933.2]
  - - [1536, 512, 1, 4096, 1568, 1568, 4128, 4128]
    - [9, 36789.4]
  - - [1536, 1024, 1, 64, 1568, 1568, 1536, 1024]
    - [16, 12281.9]
  - - [1536, 1024, 1, 128, 1568, 1568, 1536, 1024]
    - [16, 19119.2]
  - - [1536, 1024, 1, 256, 1568, 1568, 1536, 1024]
    - [16, 25930.7]
  - - [1536, 1024, 1, 512, 1568, 1568, 1536, 1024]
    - [29, 31323.7]
  - - [1536, 1024, 1, 1024, 1568, 1568, 1536, 1056]
    - [29, 33901.0]
  - - [1536, 1024, 1, 2048, 1568, 1568, 2080, 2080]
    - [27, 36396.2]
  - - [1536, 1024, 1, 4096, 1568, 1568, 4128, 4128]
    - [27, 37584.2]
  - - [1536, 2048, 1, 64, 1568, 1568, 1536, 2048]
    - [15, 16976.6]
  - - [1536, 2048, 1, 128, 1568, 1568, 1536, 2048]
    - [15, 24325.0]
  - - [1536, 2048, 1, 256, 1568, 1568, 1536, 2048]
    - [29, 30859.2]
  - - [1536, 2048, 1, 512, 1568, 1568, 1536, 2048]
    - [29, 33834.1]
  - - [1536, 2048, 1, 1024, 1568, 1568, 1536, 2048]
    - [29, 37161.2]
  - - [1536, 2048, 1, 2048, 1568, 1568, 2080, 2080]
    - [27, 38910.3]
  - - [1536, 2048, 1, 4096, 1568, 1568, 4128, 4128]
    - [17, 39133.9]
  - - [1536, 4096, 1, 64, 1568, 1568, 1536, 4096]
    - [21, 21167.6]
  - - [1536, 4096, 1, 128, 1568, 1568, 1536, 4096]
    - [16, 28283.0]
  - - [1536, 4096, 1, 256, 1568, 1568, 1536, 4096]
    - [16, 32543.4]
  - - [1536, 4096, 1, 512, 1568, 1568, 1536, 4096]
    - [29, 36737.0]
  - - [1536, 4096, 1, 1024, 1568, 1568, 1536, 4096]
    - [29, 39192.2]
  - - [1536, 4096, 1, 2048, 1568, 1568, 2080, 4096]
    - [29, 39767.9]
  - - [1536, 4096, 1, 4096, 1568, 1568, 4128, 4128]
    - [22, 39218.6]
  - - [3072, 64, 1, 64, 3104, 3104, 3072, 96]
    - [18, 1860.54]
  - - [3072, 64, 1, 128, 3104, 3104, 3072, 160]
    - [10, 3224.71]
  - - [3072, 64, 1, 256, 3104, 3104, 3072, 288]
    - [10, 5030.61]
  - - [3072, 64, 1, 512, 3104, 3104, 3072, 544]
    - [10, 7427.89]
  - - [3072, 64, 1, 1024, 3104, 3104, 3072, 1056]
    - [2, 9882.95]
  - - [3072, 64, 1, 2048, 3104, 3104, 3072, 2080]
    - [4, 11801.7]
  - - [3072, 64, 1, 4096, 3104, 3104, 4128, 4128]
    - [2, 12723.2]
  - - [3072, 128, 1, 64, 3104, 3104, 3072, 128]
    - [5, 4342.66]
  - - [3072, 128, 1, 128, 3104, 3104, 3072, 160]
    - [19, 7119.02]
  - - [3072, 128, 1, 256, 3104, 3104, 3072, 288]
    - [5, 11401.4]
  - - [3072, 128, 1, 512, 3104, 3104, 3072, 544]
    - [5, 16782.7]
  - - [3072, 128, 1, 1024, 3104, 3104, 3072, 1056]
    - [5, 21243.6]
  - - [3072, 128, 1, 2048, 3104, 3104, 3072, 2080]
    - [5, 24716.9]
  - - [3072, 128, 1, 4096, 3104, 3104, 4128, 4128]
    - [11, 25831.7]
  - - [3072, 256, 1, 64, 3104, 3104, 3072, 256]
    - [5, 7827.6]
  - - [3072, 256, 1, 128, 3104, 3104, 3072, 256]
    - [11, 12872.5]
  - - [3072, 256, 1, 256, 3104, 3104, 3072, 288]
    - [9, 19403.0]
  - - [3072, 256, 1, 512, 3104, 3104, 3072, 544]
    - [9, 26224.5]
  - - [3072, 256, 1, 1024, 3104, 3104, 3072, 1056]
    - [5, 31837.7]
  - - [3072, 256, 1, 2048, 3104, 3104, 3072, 2080]
    - [19, 34350.1]
  - - [3072, 256, 1, 4096, 3104, 3104, 4128, 4128]
    - [5, 37051.4]
  - - [3072, 512, 1, 64, 3104, 3104, 3072, 512]
    - [15, 12697.1]
  - - [3072, 512, 1, 128, 3104, 3104, 3072, 512]
    - [14, 19472.4]
  - - [3072, 512, 1, 256, 3104, 3104, 3072, 512]
    - [15, 26275.9]
  - - [3072, 512, 1, 512, 3104, 3104, 3072, 544]
    - [9, 31548.3]
  - - [3072, 512, 1, 1024, 3104, 3104, 3072, 1056]
    - [29, 33573.8]
  - - [3072, 512, 1, 2048, 3104, 3104, 3072, 2080]
    - [29, 36265.5]
  - - [3072, 512, 1, 4096, 3104, 3104, 4128, 4128]
    - [10, 36745.4]
  - - [3072, 1024, 1, 64, 3104, 3104, 3072, 1024]
    - [20, 16943.8]
  - - [3072, 1024, 1, 128, 3104, 3104, 3072, 1024]
    - [15, 24218.2]
  - - [3072, 1024, 1, 256, 3104, 3104, 3072, 1024]
    - [16, 30664.2]
  - - [3072, 1024, 1, 512, 3104, 3104, 3072, 1024]
    - [29, 33449.0]
  - - [3072, 1024, 1, 1024, 3104, 3104, 3072, 1056]
    - [29, 37220.0]
  - - [3072, 1024, 1, 2048, 3104, 3104, 3072, 2080]
    - [29, 38894.3]
  - - [3072, 1024, 1, 4096, 3104, 3104, 4128, 4128]
    - [9, 39112.3]
  - - [3072, 2048, 1, 64, 3104, 3104, 3072, 2048]
    - [21, 21172.1]
  - - [3072, 2048, 1, 128, 3104, 3104, 3072, 2048]
    - [16, 28450.9]
  - - [3072, 2048, 1, 256, 3104, 3104, 3072, 2048]
    - [29, 32295.4]
  - - [3072, 2048, 1, 512, 3104, 3104, 3072, 2048]
    - [29, 36761.3]
  - - [3072, 2048, 1, 1024, 3104, 3104, 3072, 2048]
    - [29, 39147.5]
  - - [3072, 2048, 1, 2048, 3104, 3104, 3072, 2080]
    - [29, 39866.8]
  - - [3072, 2048, 1, 4096, 3104, 3104, 4128, 4128]
    - [19, 39321.9]
  - - [3072, 4096, 1, 64, 3104, 3104, 3072, 4096]
    - [12, 24300.0]
  - - [3072, 4096, 1, 128, 3104, 3104, 3072, 4096]
    - [15, 29880.3]
  - - [3072, 4096, 1, 256, 3104, 3104, 3072, 4096]
    - [15, 35099.8]
  - - [3072, 4096, 1, 512, 3104, 3104, 3072, 4096]
    - [29, 38357.6]
  - - [3072, 4096, 1, 1024, 3104, 3104, 3072, 4096]
    - [29, 39665.7]
  - - [3072, 4096, 1, 2048, 3104, 3104, 3072, 4096]
    - [27, 39551.4]
  - - [3072, 4096, 1, 4096, 3104, 3104, 4128, 4128]
    - [29, 39057.0]
  - - [4096, 64, 1, 64, 4128, 4128, 4096, 96]
    - [18, 1941.12]
  - - [4096, 64, 1, 128, 4128, 4128, 4096, 160]
    - [18, 3898.94]
  - - [4096, 64, 1, 256, 4128, 4128, 4096, 288]
    - [8, 6458.35]
  - - [4096, 64, 1, 512, 4128, 4128, 4096, 544]
    - [2, 9728.69]
  - - [4096, 64, 1, 1024, 4128, 4128, 4096, 1056]
    - [8, 13058.7]
  - - [4096, 64, 1, 2048, 4128, 4128, 4096, 2080]
    - [10, 15758.3]
  - - [4096, 64, 1, 4096, 4128, 4128, 4128, 4128]
    - [8, 16838.4]
  - - [4096, 128, 1, 64, 4128, 4128, 4096, 128]
    - [19, 5578.46]
  - - [4096, 128, 1, 128, 4128, 4128, 4096, 160]
    - [5, 10244.0]
  - - [4096, 128, 1, 256, 4128, 4128, 4096, 288]
    - [19, 16097.0]
  - - [4096, 128, 1, 512, 4128, 4128, 4096, 544]
    - [5, 22698.7]
  - - [4096, 128, 1, 1024, 4128, 4128, 4096, 1056]
    - [11, 28528.0]
  - - [4096, 128, 1, 2048, 4128, 4128, 4096, 2080]
    - [5, 32699.0]
  - - [4096, 128, 1, 4096, 4128, 4128, 4128, 4128]
    - [17, 33836.6]
  - - [4096, 256, 1, 64, 4128, 4128, 4096, 256]
    - [16, 10047.7]
  - - [4096, 256, 1, 128, 4128, 4128, 4096, 256]
    - [19, 16085.4]
  - - [4096, 256, 1, 256, 4128, 4128, 4096, 288]
    - [9, 22574.6]
  - - [4096, 256, 1, 512, 4128, 4128, 4096, 544]
    - [5, 29203.0]
  - - [4096, 256, 1, 1024, 4128, 4128, 4096, 1056]
    - [17, 34067.4]
  - - [4096, 256, 1, 2048, 4128, 4128, 4096, 2080]
    - [9, 35986.2]
  - - [4096, 256, 1, 4096, 4128, 4128, 4128, 4128]
    - [17, 38270.9]
  - - [4096, 512, 1, 64, 4128, 4128, 4096, 512]
    - [16, 14686.2]
  - - [4096, 512, 1, 128, 4128, 4128, 4096, 512]
    - [7, 21709.2]
  - - [4096, 512, 1, 256, 4128, 4128, 4096, 512]
    - [19, 28392.2]
  - - [4096, 512, 1, 512, 4128, 4128, 4096, 544]
    - [19, 33614.1]
  - - [4096, 512, 1, 1024, 4128, 4128, 4096, 1056]
    - [19, 35320.3]
  - - [4096, 512, 1, 2048, 4128, 4128, 4096, 2080]
    - [9, 37922.5]
  - - [4096, 512, 1, 4096, 4128, 4128, 4128, 4128]
    - [17, 39119.3]
  - - [4096, 1024, 1, 64, 4128, 4128, 4096, 1024]
    - [13, 18758.5]
  - - [4096, 1024, 1, 128, 4128, 4128, 4096, 1024]
    - [16, 26225.8]
  - - [4096, 1024, 1, 256, 4128, 4128, 4096, 1024]
    - [16, 32201.8]
  - - [4096, 1024, 1, 512, 4128, 4128, 4096, 1024]
    - [29, 35193.0]
  - - [4096, 1024, 1, 1024, 4128, 4128, 4096, 1056]
    - [29, 38060.3]
  - - [4096, 1024, 1, 2048, 4128, 4128, 4096, 2080]
    - [29, 39637.9]
  - - [4096, 1024, 1, 4096, 4128, 4128, 4128, 4128]
    - [18, 39003.6]
  - - [4096, 2048, 1, 64, 4128, 4128, 4096, 2048]
    - [21, 22616.4]
  - - [4096, 2048, 1, 128, 4128, 4128, 4096, 2048]
    - [16, 29748.3]
  - - [4096, 2048, 1, 256, 4128, 4128, 4096, 2048]
    - [29, 33752.1]
  - - [4096, 2048, 1, 512, 4128, 4128, 4096, 2048]
    - [29, 37550.1]
  - - [4096, 2048, 1, 1024, 4128, 4128, 4096, 2048]
    - [29, 39729.6]
  - - [4096, 2048, 1, 2048, 4128, 4128, 4096, 2080]
    - [27, 40134.6]
  - - [4096, 2048, 1, 4096, 4128, 4128, 4128, 4128]
    - [29, 39859.9]
  - - [4096, 4096, 1, 64, 4128, 4128, 4096, 4096]
    - [21, 23473.8]
  - - [4096, 4096, 1, 128, 4128, 4128, 4096, 4096]
    - [19, 30001.5]
  - - [4096, 4096, 1, 256, 4128, 4128, 4096, 4096]
    - [29, 34046.1]
  - - [4096, 4096, 1, 512, 4128, 4128, 4096, 4096]
    - [29, 38624.9]
  - - [4096, 4096, 1, 1024, 4128, 4128, 4096, 4096]
    - [16, 39558.4]
  - - [4096, 4096, 1, 2048, 4128, 4128, 4096, 4096]
    - [27, 39854.3]
  - - [4096, 4096, 1, 4096, 4128, 4128, 4128, 4128]
    - [18, 38537.4]
- null
- null
- DeviceEfficiency
