library/src/blas3/Tensile/Logic/asm_full/navi33/navi33_Cijk_Ailk_Bljk_HHS_BH_GB.yaml
- {MinimumRequiredVersion: 4.35.0}
- navi33
- gfx1102
- [Device 73f0]
    SolutionIndex: 0
    SolutionNameMin: Cijk_Ailk_Bljk_HHS_BH_MT128x128x16_MI16x16x16x1_SN_1LDSB0_EPS0_GRVW4_PLR1_SIA1_SU0_SUS0_SVW2_VW2_WGM1
    SolutionIndex: 1
    SolutionNameMin: Cijk_Ailk_Bljk_HHS_BH_MT128x128x16_MI16x16x16x1_SN_1LDSB0_EPS0_GRVW8_PLR1_SIA1_SU0_SUS0_SVW4_VW4_WGM1
    SolutionIndex: 2
    SolutionNameMin: Cijk_Ailk_Bljk_HHS_BH_MT128x128x16_MI16x16x16x1_SN_1LDSB0_EPS1_GRVW8_PLR0_SIA1_SU0_SUS0_SVW4_VW4_WGM1
    SolutionIndex: 3
    SolutionNameMin: Cijk_Ailk_Bljk_HHS_BH_MT128x128x16_MI16x16x16x1_SN_1LDSB0_EPS1_GRVW8_PLR1_SIA1_SU0_SUS0_SVW4_VW4_WGM1
    SolutionIndex: 4
    SolutionNameMin: Cijk_Ailk_Bljk_HHS_BH_MT128x128x16_MI16x16x16x1_SN_1LDSB1_EPS1_GRVW4_PLR1_SIA2_SU0_SUS0_SVW2_VW2_WGM1
    SolutionIndex: 5
    SolutionNameMin: Cijk_Ailk_Bljk_HHS_BH_MT128x128x16_MI16x16x16x1_SN_1LDSB1_EPS1_GRVW4_PLR1_SIA2_SU0_SUS0_SVW4_VW4_WGM1
    SolutionIndex: 6
    SolutionNameMin: Cijk_Ailk_Bljk_HHS_BH_MT128x128x16_MI16x16x16x1_SN_1LDSB1_EPS1_GRVW8_PLR1_SIA2_SU0_SUS0_SVW2_VW2_WGM1
    SolutionIndex: 7
    SolutionNameMin: Cijk_Ailk_Bljk_HHS_BH_MT128x128x16_MI16x16x16x1_SN_1LDSB1_EPS1_GRVW8_PLR1_SIA2_SU0_SUS0_SVW4_VW4_WGM1
    SolutionIndex: 8
    SolutionNameMin: Cijk_Ailk_Bljk_HHS_BH_MT128x128x16_MI16x16x16x1_SN_1LDSB0_EPS1_GRVW8_PLR0_SIA3_SU0_SUS0_SVW4_VW4_WGM1
    SolutionIndex: 9
    SolutionNameMin: Cijk_Ailk_Bljk_HHS_BH_MT128x128x16_MI16x16x16x1_SN_1LDSB1_EPS1_GRVW8_PLR1_SIA2_SU32_SUS256_SVW4_VW4_WGM1
    SolutionIndex: 10
    SolutionNameMin: Cijk_Ailk_Bljk_HHS_BH_MT128x128x16_MI16x16x16x1_SN_1LDSB0_EPS0_GRVW8_PLR0_SIA1_SU0_SUS0_SVW4_VW4_WGM4
    SolutionIndex: 11
    SolutionNameMin: Cijk_Ailk_Bljk_HHS_BH_MT128x128x16_MI16x16x16x1_SN_1LDSB0_EPS0_GRVW8_PLR1_SIA1_SU0_SUS0_SVW4_VW4_WGM4
    SolutionIndex: 12
    SolutionNameMin: Cijk_Ailk_Bljk_HHS_BH_MT128x128x16_MI16x16x16x1_SN_1LDSB0_EPS1_GRVW8_PLR0_SIA1_SU0_SUS0_SVW4_VW4_WGM4
    SolutionIndex: 13
    SolutionNameMin: Cijk_Ailk_Bljk_HHS_BH_MT128x128x16_MI16x16x16x1_SN_1LDSB0_EPS1_GRVW8_PLR1_SIA1_SU0_SUS0_SVW4_VW4_WGM4
    SolutionIndex: 14
    SolutionNameMin: Cijk_Ailk_Bljk_HHS_BH_MT128x128x16_MI16x16x16x1_SN_1LDSB1_EPS1_GRVW4_PLR1_SIA2_SU0_SUS0_SVW2_VW2_WGM4
    SolutionIndex: 15
    SolutionNameMin: Cijk_Ailk_Bljk_HHS_BH_MT128x128x16_MI16x16x16x1_SN_1LDSB1_EPS1_GRVW4_PLR1_SIA2_SU0_SUS0_SVW4_VW4_WGM4
    SolutionIndex: 16
    SolutionNameMin: Cijk_Ailk_Bljk_HHS_BH_MT128x128x16_MI16x16x16x1_SN_1LDSB1_EPS1_GRVW8_PLR1_SIA2_SU0_SUS0_SVW2_VW2_WGM4
    SolutionIndex: 17
    SolutionNameMin: Cijk_Ailk_Bljk_HHS_BH_MT128x128x16_MI16x16x16x1_SN_1LDSB1_EPS1_GRVW8_PLR1_SIA2_SU0_SUS0_SVW4_VW4_WGM4
    SolutionIndex: 18
    SolutionNameMin: Cijk_Ailk_Bljk_HHS_BH_MT128x128x16_MI16x16x16x1_SN_1LDSB0_EPS0_GRVW4_PLR0_SIA1_SU32_SUS256_SVW4_VW4_WGM4
    SolutionIndex: 19
    SolutionNameMin: Cijk_Ailk_Bljk_HHS_BH_MT128x128x16_MI16x16x16x1_SN_1LDSB0_EPS1_GRVW8_PLR1_SIA1_SU32_SUS256_SVW4_VW4_WGM4
    SolutionIndex: 20
    SolutionNameMin: Cijk_Ailk_Bljk_HHS_BH_MT128x128x16_MI16x16x16x1_SN_1LDSB1_EPS1_GRVW8_PLR1_SIA2_SU32_SUS256_SVW2_VW2_WGM4
    SolutionIndex: 21
    SolutionNameMin: Cijk_Ailk_Bljk_HHS_BH_MT128x128x16_MI16x16x16x1_SN_1LDSB1_EPS1_GRVW8_PLR1_SIA2_SU32_SUS256_SVW4_VW4_WGM4
    SolutionIndex: 22
    SolutionNameMin: Cijk_Ailk_Bljk_HHS_BH_MT128x128x16_MI16x16x16x1_SN_1LDSB0_EPS0_GRVW8_PLR0_SIA1_SU0_SUS0_SVW4_VW4_WGM8
    SolutionIndex: 23
    SolutionNameMin: Cijk_Ailk_Bljk_HHS_BH_MT128x128x16_MI16x16x16x1_SN_1LDSB0_EPS0_GRVW8_PLR1_SIA1_SU0_SUS0_SVW4_VW4_WGM8
    SolutionIndex: 24
    SolutionNameMin: Cijk_Ailk_Bljk_HHS_BH_MT128x128x16_MI16x16x16x1_SN_1LDSB0_EPS1_GRVW4_PLR1_SIA1_SU0_SUS0_SVW4_VW4_WGM8
    SolutionIndex: 25
    SolutionNameMin: Cijk_Ailk_Bljk_HHS_BH_MT128x128x16_MI16x16x16x1_SN_1LDSB0_EPS1_GRVW8_PLR1_SIA1_SU0_SUS0_SVW4_VW4_WGM8
    SolutionIndex: 26
    SolutionNameMin: Cijk_Ailk_Bljk_HHS_BH_MT128x128x16_MI16x16x16x1_SN_1LDSB1_EPS1_GRVW8_PLR1_SIA2_SU0_SUS0_SVW2_VW2_WGM8
    SolutionIndex: 27
    SolutionNameMin: Cijk_Ailk_Bljk_HHS_BH_MT128x128x16_MI16x16x16x1_SN_1LDSB1_EPS1_GRVW8_PLR1_SIA2_SU0_SUS0_SVW4_VW4_WGM8
    SolutionIndex: 28
    SolutionNameMin: Cijk_Ailk_Bljk_HHS_BH_MT128x128x16_MI16x16x16x1_SN_1LDSB0_EPS0_GRVW8_PLR0_SIA3_SU0_SUS0_SVW4_VW4_WGM8
    SolutionIndex: 29
    SolutionNameMin: Cijk_Ailk_Bljk_HHS_BH_MT128x128x16_MI16x16x16x1_SN_1LDSB0_EPS0_GRVW4_PLR1_SIA3_SU0_SUS0_SVW2_VW2_WGM8
    SolutionIndex: 30
    SolutionNameMin: Cijk_Ailk_Bljk_HHS_BH_MT128x128x16_MI16x16x16x1_SN_1LDSB0_EPS1_GRVW4_PLR1_SIA1_SU32_SUS256_SVW4_VW4_WGM8
    SolutionIndex: 31
    SolutionNameMin: Cijk_Ailk_Bljk_HHS_BH_MT128x128x16_MI16x16x16x1_SN_1LDSB0_EPS1_GRVW8_PLR1_SIA1_SU32_SUS256_SVW4_VW4_WGM8
    SolutionIndex: 32
    SolutionNameMin: Cijk_Ailk_Bljk_HHS_BH_MT128x128x16_MI16x16x16x1_SN_1LDSB1_EPS1_GRVW8_PLR1_SIA2_SU32_SUS256_SVW2_VW2_WGM8
    SolutionIndex: 33
    SolutionNameMin: Cijk_Ailk_Bljk_HHS_BH_MT128x128x16_MI16x16x16x1_SN_1LDSB1_EPS1_GRVW8_PLR1_SIA2_SU32_SUS256_SVW4_VW4_WGM8
    SolutionIndex: 34
    SolutionNameMin: Cijk_Ailk_Bljk_HHS_BH_MT128x128x16_MI16x16x16x1_SN_1LDSB1_EPS0_GRVW8_PLR1_SIA3_SU0_SUS0_SVW4_VW4_WGM1
    SolutionIndex: 35
    SolutionNameMin: Cijk_Ailk_Bljk_HHS_BH_MT128x128x16_MI16x16x16x1_SN_1LDSB1_EPS1_GRVW4_PLR0_SIA3_SU0_SUS0_SVW4_VW4_WGM1
    SolutionIndex: 36
    SolutionNameMin: Cijk_Ailk_Bljk_HHS_BH_MT128x128x16_MI16x16x16x1_SN_1LDSB1_EPS1_GRVW8_PLR0_SIA3_SU0_SUS0_SVW4_VW4_WGM1
    SolutionIndex: 37
    SolutionNameMin: Cijk_Ailk_Bljk_HHS_BH_MT128x128x16_MI16x16x16x1_SN_1LDSB1_EPS1_GRVW8_PLR1_SIA3_SU0_SUS0_SVW4_VW4_WGM1
    SolutionIndex: 38
    SolutionNameMin: Cijk_Ailk_Bljk_HHS_BH_MT128x128x16_MI16x16x16x1_SN_1LDSB1_EPS1_GRVW4_PLR0_SIA3_SU32_SUS256_SVW4_VW4_WGM1
    SolutionIndex: 39
    SolutionNameMin: Cijk_Ailk_Bljk_HHS_BH_MT128x128x16_MI16x16x16x1_SN_1LDSB1_EPS0_GRVW4_PLR0_SIA3_SU0_SUS0_SVW4_VW4_WGM4
    SolutionIndex: 40
    SolutionNameMin: Cijk_Ailk_Bljk_HHS_BH_MT128x128x16_MI16x16x16x1_SN_1LDSB1_EPS0_GRVW8_PLR0_SIA3_SU0_SUS0_SVW4_VW4_WGM4
    SolutionIndex: 41
    SolutionNameMin: Cijk_Ailk_Bljk_HHS_BH_MT128x128x16_MI16x16x16x1_SN_1LDSB1_EPS0_GRVW4_PLR1_SIA3_SU0_SUS0_SVW4_VW4_WGM4
    SolutionIndex: 42
    SolutionNameMin: Cijk_Ailk_Bljk_HHS_BH_MT128x128x16_MI16x16x16x1_SN_1LDSB1_EPS0_GRVW8_PLR1_SIA3_SU0_SUS0_SVW4_VW4_WGM4
    SolutionIndex: 43
    SolutionNameMin: Cijk_Ailk_Bljk_HHS_BH_MT128x128x16_MI16x16x16x1_SN_1LDSB1_EPS1_GRVW4_PLR0_SIA3_SU0_SUS0_SVW4_VW4_WGM4
    SolutionIndex: 44
    SolutionNameMin: Cijk_Ailk_Bljk_HHS_BH_MT128x128x16_MI16x16x16x1_SN_1LDSB1_EPS1_GRVW8_PLR0_SIA3_SU0_SUS0_SVW2_VW2_WGM4
    SolutionIndex: 45
    SolutionNameMin: Cijk_Ailk_Bljk_HHS_BH_MT128x128x16_MI16x16x16x1_SN_1LDSB1_EPS1_GRVW8_PLR0_SIA3_SU0_SUS0_SVW4_VW4_WGM4
    SolutionIndex: 46
    SolutionNameMin: Cijk_Ailk_Bljk_HHS_BH_MT128x128x16_MI16x16x16x1_SN_1LDSB1_EPS1_GRVW4_PLR1_SIA3_SU0_SUS0_SVW4_VW4_WGM4
    SolutionIndex: 47
    SolutionNameMin: Cijk_Ailk_Bljk_HHS_BH_MT128x128x16_MI16x16x16x1_SN_1LDSB1_EPS1_GRVW8_PLR1_SIA3_SU0_SUS0_SVW4_VW4_WGM4
    SolutionIndex: 48
    SolutionNameMin: Cijk_Ailk_Bljk_HHS_BH_MT128x128x16_MI16x16x16x1_SN_1LDSB1_EPS0_GRVW8_PLR0_SIA3_SU32_SUS256_SVW4_VW4_WGM4
    SolutionIndex: 49
    SolutionNameMin: Cijk_Ailk_Bljk_HHS_BH_MT128x128x16_MI16x16x16x1_SN_1LDSB1_EPS0_GRVW8_PLR1_SIA3_SU32_SUS256_SVW4_VW4_WGM4
    SolutionIndex: 50
    SolutionNameMin: Cijk_Ailk_Bljk_HHS_BH_MT128x128x16_MI16x16x16x1_SN_1LDSB1_EPS1_GRVW4_PLR0_SIA3_SU32_SUS256_SVW4_VW4_WGM4
    SolutionIndex: 51
    SolutionNameMin: Cijk_Ailk_Bljk_HHS_BH_MT128x128x16_MI16x16x16x1_SN_1LDSB1_EPS1_GRVW8_PLR0_SIA3_SU32_SUS256_SVW4_VW4_WGM4
    SolutionIndex: 52
    SolutionNameMin: Cijk_Ailk_Bljk_HHS_BH_MT128x128x16_MI16x16x16x1_SN_1LDSB1_EPS1_GRVW8_PLR1_SIA3_SU32_SUS256_SVW4_VW4_WGM4
    SolutionIndex: 53
    SolutionNameMin: Cijk_Ailk_Bljk_HHS_BH_MT128x128x16_MI16x16x16x1_SN_1LDSB1_EPS0_GRVW4_PLR0_SIA3_SU0_SUS0_SVW4_VW4_WGM8
    SolutionIndex: 54
    SolutionNameMin: Cijk_Ailk_Bljk_HHS_BH_MT128x128x16_MI16x16x16x1_SN_1LDSB1_EPS0_GRVW8_PLR0_SIA3_SU0_SUS0_SVW4_VW4_WGM8
    SolutionIndex: 55
    SolutionNameMin: Cijk_Ailk_Bljk_HHS_BH_MT128x128x16_MI16x16x16x1_SN_1LDSB1_EPS0_GRVW4_PLR1_SIA3_SU0_SUS0_SVW4_VW4_WGM8
    SolutionIndex: 56
    SolutionNameMin: Cijk_Ailk_Bljk_HHS_BH_MT128x128x16_MI16x16x16x1_SN_1LDSB1_EPS0_GRVW8_PLR1_SIA3_SU0_SUS0_SVW4_VW4_WGM8
    SolutionIndex: 57
    SolutionNameMin: Cijk_Ailk_Bljk_HHS_BH_MT128x128x16_MI16x16x16x1_SN_1LDSB1_EPS1_GRVW4_PLR0_SIA3_SU0_SUS0_SVW4_VW4_WGM8
    SolutionIndex: 58
    SolutionNameMin: Cijk_Ailk_Bljk_HHS_BH_MT128x128x16_MI16x16x16x1_SN_1LDSB1_EPS1_GRVW8_PLR0_SIA3_SU0_SUS0_SVW4_VW4_WGM8
    SolutionIndex: 59
    SolutionNameMin: Cijk_Ailk_Bljk_HHS_BH_MT128x128x16_MI16x16x16x1_SN_1LDSB1_EPS1_GRVW4_PLR1_SIA3_SU0_SUS0_SVW4_VW4_WGM8
    SolutionIndex: 60
    SolutionNameMin: Cijk_Ailk_Bljk_HHS_BH_MT128x128x16_MI16x16x16x1_SN_1LDSB1_EPS1_GRVW8_PLR1_SIA3_SU0_SUS0_SVW4_VW4_WGM8
    SolutionIndex: 61
    SolutionNameMin: Cijk_Ailk_Bljk_HHS_BH_MT128x128x16_MI16x16x16x1_SN_1LDSB1_EPS0_GRVW8_PLR0_SIA3_SU32_SUS256_SVW4_VW4_WGM8
    SolutionIndex: 62
    SolutionNameMin: Cijk_Ailk_Bljk_HHS_BH_MT128x128x16_MI16x16x16x1_SN_1LDSB1_EPS0_GRVW8_PLR1_SIA3_SU32_SUS256_SVW4_VW4_WGM8
    SolutionIndex: 63
    SolutionNameMin: Cijk_Ailk_Bljk_HHS_BH_MT128x128x16_MI16x16x16x1_SN_1LDSB1_EPS1_GRVW8_PLR0_SIA3_SU32_SUS256_SVW4_VW4_WGM8
    SolutionIndex: 64
    SolutionNameMin: Cijk_Ailk_Bljk_HHS_BH_MT128x128x16_MI16x16x16x1_SN_1LDSB1_EPS1_GRVW8_PLR1_SIA3_SU32_SUS256_SVW2_VW2_WGM8
    SolutionIndex: 65
    SolutionNameMin: Cijk_Ailk_Bljk_HHS_BH_MT128x128x16_MI16x16x16x1_SN_1LDSB1_EPS1_GRVW8_PLR1_SIA3_SU32_SUS256_SVW4_VW4_WGM8
    SolutionIndex: 66
    SolutionNameMin: Cijk_Ailk_Bljk_HHS_BH_MT128x128x32_MI16x16x16x1_SN_1LDSB0_EPS0_GRVW4_PLR0_SIA1_SU0_SUS0_SVW4_VW4_WGM1
    SolutionIndex: 67
    SolutionNameMin: Cijk_Ailk_Bljk_HHS_BH_MT128x128x32_MI16x16x16x1_SN_1LDSB0_EPS0_GRVW8_PLR0_SIA1_SU0_SUS0_SVW2_VW2_WGM1
    SolutionIndex: 68
    SolutionNameMin: Cijk_Ailk_Bljk_HHS_BH_MT128x128x32_MI16x16x16x1_SN_1LDSB0_EPS0_GRVW8_PLR0_SIA1_SU0_SUS0_SVW4_VW4_WGM1
    SolutionIndex: 69
    SolutionNameMin: Cijk_Ailk_Bljk_HHS_BH_MT128x128x32_MI16x16x16x1_SN_1LDSB0_EPS1_GRVW4_PLR0_SIA1_SU0_SUS0_SVW4_VW4_WGM1
    SolutionIndex: 70
    SolutionNameMin: Cijk_Ailk_Bljk_HHS_BH_MT128x128x32_MI16x16x16x1_SN_1LDSB0_EPS1_GRVW8_PLR0_SIA1_SU0_SUS0_SVW2_VW2_WGM1
    SolutionIndex: 71
    SolutionNameMin: Cijk_Ailk_Bljk_HHS_BH_MT128x128x32_MI16x16x16x1_SN_1LDSB0_EPS1_GRVW8_PLR0_SIA1_SU0_SUS0_SVW4_VW4_WGM1
    SolutionIndex: 72
    SolutionNameMin: Cijk_Ailk_Bljk_HHS_BH_MT128x128x32_MI16x16x16x1_SN_1LDSB0_EPS0_GRVW4_PLR0_SIA1_SU32_SUS256_SVW4_VW4_WGM1
    SolutionIndex: 73
    SolutionNameMin: Cijk_Ailk_Bljk_HHS_BH_MT128x128x32_MI16x16x16x1_SN_1LDSB0_EPS0_GRVW8_PLR0_SIA1_SU32_SUS256_SVW2_VW2_WGM1
    SolutionIndex: 74
    SolutionNameMin: Cijk_Ailk_Bljk_HHS_BH_MT128x128x32_MI16x16x16x1_SN_1LDSB0_EPS0_GRVW8_PLR0_SIA1_SU32_SUS256_SVW4_VW4_WGM1
    SolutionIndex: 75
    SolutionNameMin: Cijk_Ailk_Bljk_HHS_BH_MT128x128x32_MI16x16x16x1_SN_1LDSB0_EPS1_GRVW8_PLR0_SIA1_SU32_SUS256_SVW2_VW2_WGM1
    SolutionIndex: 76
    SolutionNameMin: Cijk_Ailk_Bljk_HHS_BH_MT128x128x32_MI16x16x16x1_SN_1LDSB0_EPS1_GRVW8_PLR0_SIA1_SU32_SUS256_SVW4_VW4_WGM1
    SolutionIndex: 77
    SolutionNameMin: Cijk_Ailk_Bljk_HHS_BH_MT128x128x32_MI16x16x16x1_SN_1LDSB0_EPS0_GRVW4_PLR0_SIA1_SU0_SUS0_SVW4_VW4_WGM4
    SolutionIndex: 78
    SolutionNameMin: Cijk_Ailk_Bljk_HHS_BH_MT128x128x32_MI16x16x16x1_SN_1LDSB0_EPS0_GRVW8_PLR0_SIA1_SU0_SUS0_SVW4_VW4_WGM4
    SolutionIndex: 79
    SolutionNameMin: Cijk_Ailk_Bljk_HHS_BH_MT128x128x32_MI16x16x16x1_SN_1LDSB0_EPS1_GRVW8_PLR0_SIA1_SU0_SUS0_SVW4_VW4_WGM4
    SolutionIndex: 80
    SolutionNameMin: Cijk_Ailk_Bljk_HHS_BH_MT128x128x32_MI16x16x16x1_SN_1LDSB0_EPS0_GRVW8_PLR0_SIA1_SU32_SUS256_SVW4_VW4_WGM4
    SolutionIndex: 81
    SolutionNameMin: Cijk_Ailk_Bljk_HHS_BH_MT128x128x32_MI16x16x16x1_SN_1LDSB0_EPS1_GRVW8_PLR0_SIA1_SU32_SUS256_SVW2_VW2_WGM4
    SolutionIndex: 82
    SolutionNameMin: Cijk_Ailk_Bljk_HHS_BH_MT128x128x32_MI16x16x16x1_SN_1LDSB0_EPS1_GRVW8_PLR0_SIA1_SU32_SUS256_SVW4_VW4_WGM4
    SolutionIndex: 83
    SolutionNameMin: Cijk_Ailk_Bljk_HHS_BH_MT128x128x32_MI16x16x16x1_SN_1LDSB0_EPS0_GRVW8_PLR0_SIA1_SU0_SUS0_SVW4_VW4_WGM8
    SolutionIndex: 84
    SolutionNameMin: Cijk_Ailk_Bljk_HHS_BH_MT128x128x32_MI16x16x16x1_SN_1LDSB0_EPS1_GRVW8_PLR0_SIA1_SU0_SUS0_SVW2_VW2_WGM8
    SolutionIndex: 85
    SolutionNameMin: Cijk_Ailk_Bljk_HHS_BH_MT128x128x32_MI16x16x16x1_SN_1LDSB0_EPS1_GRVW8_PLR0_SIA1_SU0_SUS0_SVW4_VW4_WGM8
    SolutionIndex: 86
    SolutionNameMin: Cijk_Ailk_Bljk_HHS_BH_MT128x128x32_MI16x16x16x1_SN_1LDSB0_EPS0_GRVW4_PLR0_SIA1_SU32_SUS256_SVW4_VW4_WGM8
    SolutionIndex: 87
    SolutionNameMin: Cijk_Ailk_Bljk_HHS_BH_MT128x128x32_MI16x16x16x1_SN_1LDSB0_EPS0_GRVW8_PLR0_SIA1_SU32_SUS256_SVW4_VW4_WGM8
    SolutionIndex: 88
    SolutionNameMin: Cijk_Ailk_Bljk_HHS_BH_MT128x128x32_MI16x16x16x1_SN_1LDSB0_EPS1_GRVW4_PLR0_SIA1_SU32_SUS256_SVW4_VW4_WGM8
    SolutionIndex: 89
    SolutionNameMin: Cijk_Ailk_Bljk_HHS_BH_MT128x128x32_MI16x16x16x1_SN_1LDSB0_EPS1_GRVW8_PLR0_SIA1_SU32_SUS256_SVW2_VW2_WGM8
    SolutionIndex: 90
    SolutionNameMin: Cijk_Ailk_Bljk_HHS_BH_MT128x128x32_MI16x16x16x1_SN_1LDSB0_EPS1_GRVW8_PLR0_SIA1_SU32_SUS256_SVW4_VW4_WGM8
    SolutionIndex: 91
    SolutionNameMin: Cijk_Ailk_Bljk_HHS_BH_MT128x128x32_MI16x16x16x1_SN_1LDSB1_EPS1_GRVW8_PLR0_SIA3_SU0_SUS0_SVW4_VW4_WGM1
    SolutionIndex: 92
    SolutionNameMin: Cijk_Ailk_Bljk_HHS_BH_MT128x128x32_MI16x16x16x1_SN_1LDSB1_EPS0_GRVW4_PLR0_SIA3_SU32_SUS256_SVW4_VW4_WGM1
    SolutionIndex: 93
    SolutionNameMin: Cijk_Ailk_Bljk_HHS_BH_MT128x128x32_MI16x16x16x1_SN_1LDSB1_EPS0_GRVW8_PLR0_SIA3_SU32_SUS256_SVW4_VW4_WGM1
    SolutionIndex: 94
    SolutionNameMin: Cijk_Ailk_Bljk_HHS_BH_MT128x128x32_MI16x16x16x1_SN_1LDSB1_EPS0_GRVW8_PLR0_SIA3_SU0_SUS0_SVW4_VW4_WGM4
    SolutionIndex: 95
    SolutionNameMin: Cijk_Ailk_Bljk_HHS_BH_MT128x128x32_MI16x16x16x1_SN_1LDSB1_EPS0_GRVW8_PLR0_SIA3_SU32_SUS256_SVW4_VW4_WGM4
    SolutionIndex: 96
    SolutionNameMin: Cijk_Ailk_Bljk_HHS_BH_MT128x128x32_MI16x16x16x1_SN_1LDSB1_EPS0_GRVW8_PLR0_SIA3_SU0_SUS0_SVW4_VW4_WGM8
    SolutionIndex: 97
    SolutionNameMin: Cijk_Ailk_Bljk_HHS_BH_MT128x128x32_MI16x16x16x1_SN_1LDSB1_EPS1_GRVW8_PLR0_SIA3_SU0_SUS0_SVW4_VW4_WGM8
    SolutionIndex: 98
    SolutionNameMin: Cijk_Ailk_Bljk_HHS_BH_MT128x128x32_MI16x16x16x1_SN_1LDSB1_EPS0_GRVW8_PLR0_SIA3_SU32_SUS256_SVW4_VW4_WGM8
    SolutionIndex: 99
    SolutionNameMin: Cijk_Ailk_Bljk_HHS_BH_MT128x128x32_MI16x16x16x1_SN_1LDSB1_EPS1_GRVW8_PLR0_SIA3_SU32_SUS256_SVW4_VW4_WGM8
- - - [64, 64, 1, 64, 96, 96, 96, 96]
    - [2, 35.3438]
  - - [64, 64, 1, 128, 96, 96, 160, 160]
    - [10, 59.4905]
  - - [64, 64, 1, 256, 96, 96, 288, 288]
    - [80, 99.0533]
  - - [64, 64, 1, 512, 96, 96, 544, 544]
    - [83, 158.228]
  - - [64, 64, 1, 1024, 96, 96, 1056, 1056]
    - [67, 223.232]
  - - [64, 64, 1, 2048, 96, 96, 2080, 2080]
    - [80, 280.387]
  - - [64, 64, 1, 4096, 96, 96, 4128, 4128]
    - [75, 312.98]
  - - [64, 128, 1, 64, 96, 96, 96, 96]
    - [23, 65.4054]
  - - [64, 128, 1, 128, 96, 96, 160, 160]
    - [23, 114.737]
  - - [64, 128, 1, 256, 96, 96, 288, 288]
    - [83, 198.051]
  - - [64, 128, 1, 512, 96, 96, 544, 544]
    - [67, 314.417]
  - - [64, 128, 1, 1024, 96, 96, 1056, 1056]
    - [80, 444.948]
  - - [64, 128, 1, 2048, 96, 96, 2080, 2080]
    - [68, 561.694]
  - - [64, 128, 1, 4096, 96, 96, 4128, 4128]
    - [79, 624.758]
  - - [64, 256, 1, 64, 96, 96, 96, 96]
    - [19, 148.776]
  - - [64, 256, 1, 128, 96, 96, 160, 160]
    - [87, 266.036]
  - - [64, 256, 1, 256, 96, 96, 288, 288]
    - [83, 453.832]
  - - [64, 256, 1, 512, 96, 96, 544, 544]
    - [80, 677.703]
  - - [64, 256, 1, 1024, 96, 96, 1056, 1056]
    - [87, 942.385]
  - - [64, 256, 1, 2048, 96, 96, 2080, 2080]
    - [79, 1182.04]
  - - [64, 256, 1, 4096, 96, 96, 4128, 4128]
    - [79, 1286.9]
  - - [64, 512, 1, 64, 96, 96, 96, 96]
    - [34, 298.019]
  - - [64, 512, 1, 128, 96, 96, 160, 160]
    - [68, 543.307]
  - - [64, 512, 1, 256, 96, 96, 288, 288]
    - [83, 954.23]
  - - [64, 512, 1, 512, 96, 96, 544, 544]
    - [5, 1422.41]
  - - [64, 512, 1, 1024, 96, 96, 1056, 1056]
    - [79, 1943.39]
  - - [64, 512, 1, 2048, 96, 96, 2080, 2080]
    - [90, 2382.8]
  - - [64, 512, 1, 4096, 96, 96, 4128, 4128]
    - [84, 2578.09]
  - - [64, 1024, 1, 64, 96, 96, 96, 96]
    - [83, 640.841]
  - - [64, 1024, 1, 128, 96, 96, 160, 160]
    - [78, 1160.25]
  - - [64, 1024, 1, 256, 96, 96, 288, 288]
    - [66, 1944.06]
  - - [64, 1024, 1, 512, 96, 96, 544, 544]
    - [86, 2955.31]
  - - [64, 1024, 1, 1024, 96, 96, 1056, 1056]
    - [76, 3905.1]
  - - [64, 1024, 1, 2048, 96, 96, 2080, 2080]
    - [75, 4816.38]
  - - [64, 1024, 1, 4096, 96, 96, 4128, 4128]
    - [71, 5189.58]
  - - [64, 2048, 1, 64, 96, 96, 96, 96]
    - [83, 1203.02]
  - - [64, 2048, 1, 128, 96, 96, 160, 160]
    - [77, 2285.42]
  - - [64, 2048, 1, 256, 96, 96, 288, 288]
    - [83, 3851.97]
  - - [64, 2048, 1, 512, 96, 96, 544, 544]
    - [79, 5670.86]
  - - [64, 2048, 1, 1024, 96, 96, 1056, 1056]
    - [85, 7965.46]
  - - [64, 2048, 1, 2048, 96, 96, 2080, 2080]
    - [79, 9678.61]
  - - [64, 2048, 1, 4096, 96, 96, 4128, 4128]
    - [89, 10660.7]
  - - [64, 4096, 1, 64, 96, 96, 96, 96]
    - [6, 2186.53]
  - - [64, 4096, 1, 128, 96, 96, 160, 160]
    - [6, 3834.38]
  - - [64, 4096, 1, 256, 96, 96, 288, 288]
    - [6, 6552.34]
  - - [64, 4096, 1, 512, 96, 96, 544, 544]
    - [16, 10422.3]
  - - [64, 4096, 1, 1024, 96, 96, 1056, 1056]
    - [33, 14322.0]
  - - [64, 4096, 1, 2048, 96, 96, 2080, 2080]
    - [27, 17879.7]
  - - [64, 4096, 1, 4096, 96, 96, 4128, 4128]
    - [14, 18480.7]
  - - [128, 64, 1, 64, 160, 160, 128, 96]
    - [1, 73.5639]
  - - [128, 64, 1, 128, 160, 160, 160, 160]
    - [11, 118.873]
  - - [128, 64, 1, 256, 160, 160, 288, 288]
    - [87, 204.143]
  - - [128, 64, 1, 512, 160, 160, 544, 544]
    - [9, 317.438]
  - - [128, 64, 1, 1024, 160, 160, 1056, 1056]
    - [68, 445.517]
  - - [128, 64, 1, 2048, 160, 160, 2080, 2080]
    - [73, 559.988]
  - - [128, 64, 1, 4096, 160, 160, 4128, 4128]
    - [75, 622.903]
  - - [128, 128, 1, 64, 160, 160, 128, 96]
    - [42, 170.751]
  - - [128, 128, 1, 128, 160, 160, 160, 160]
    - [34, 296.46]
  - - [128, 128, 1, 256, 160, 160, 288, 288]
    - [27, 511.19]
  - - [128, 128, 1, 512, 160, 160, 544, 544]
    - [68, 761.289]
  - - [128, 128, 1, 1024, 160, 160, 1056, 1056]
    - [27, 999.126]
  - - [128, 128, 1, 2048, 160, 160, 2080, 2080]
    - [79, 1217.24]
  - - [128, 128, 1, 4096, 160, 160, 4128, 4128]
    - [75, 1299.3]
  - - [128, 256, 1, 64, 160, 160, 128, 96]
    - [10, 375.363]
  - - [128, 256, 1, 128, 160, 160, 160, 160]
    - [27, 662.924]
  - - [128, 256, 1, 256, 160, 160, 288, 288]
    - [66, 1085.77]
  - - [128, 256, 1, 512, 160, 160, 544, 544]
    - [7, 1584.11]
  - - [128, 256, 1, 1024, 160, 160, 1056, 1056]
    - [79, 2060.71]
  - - [128, 256, 1, 2048, 160, 160, 2080, 2080]
    - [76, 2473.52]
  - - [128, 256, 1, 4096, 160, 160, 4128, 4128]
    - [67, 2668.41]
  - - [128, 512, 1, 64, 160, 160, 128, 96]
    - [8, 778.312]
  - - [128, 512, 1, 128, 160, 160, 160, 160]
    - [68, 1381.52]
  - - [128, 512, 1, 256, 160, 160, 288, 288]
    - [68, 2269.96]
  - - [128, 512, 1, 512, 160, 160, 544, 544]
    - [7, 3219.89]
  - - [128, 512, 1, 1024, 160, 160, 1056, 1056]
    - [74, 4286.2]
  - - [128, 512, 1, 2048, 160, 160, 2080, 2080]
    - [80, 4974.72]
  - - [128, 512, 1, 4096, 160, 160, 4128, 4128]
    - [85, 5294.81]
  - - [128, 1024, 1, 64, 160, 160, 128, 96]
    - [22, 1567.38]
  - - [128, 1024, 1, 128, 160, 160, 160, 160]
    - [68, 2786.46]
  - - [128, 1024, 1, 256, 160, 160, 288, 288]
    - [68, 4570.23]
  - - [128, 1024, 1, 512, 160, 160, 544, 544]
    - [76, 6603.95]
  - - [128, 1024, 1, 1024, 160, 160, 1056, 1056]
    - [76, 8363.02]
  - - [128, 1024, 1, 2048, 160, 160, 2080, 2080]
    - [71, 10050.8]
  - - [128, 1024, 1, 4096, 160, 160, 4128, 4128]
    - [70, 10578.1]
  - - [128, 2048, 1, 64, 160, 160, 128, 96]
    - [27, 2719.17]
  - - [128, 2048, 1, 128, 160, 160, 160, 160]
    - [87, 5084.79]
  - - [128, 2048, 1, 256, 160, 160, 288, 288]
    - [80, 8438.18]
  - - [128, 2048, 1, 512, 160, 160, 544, 544]
    - [79, 12438.0]
  - - [128, 2048, 1, 1024, 160, 160, 1056, 1056]
    - [90, 16673.1]
  - - [128, 2048, 1, 2048, 160, 160, 2080, 2080]
    - [76, 20115.1]
  - - [128, 2048, 1, 4096, 160, 160, 4128, 4128]
    - [90, 21675.2]
  - - [128, 4096, 1, 64, 160, 160, 128, 96]
    - [97, 4774.41]
  - - [128, 4096, 1, 128, 160, 160, 160, 160]
    - [6, 8442.51]
  - - [128, 4096, 1, 256, 160, 160, 288, 288]
    - [17, 13930.3]
  - - [128, 4096, 1, 512, 160, 160, 544, 544]
    - [27, 21452.6]
  - - [128, 4096, 1, 1024, 160, 160, 1056, 1056]
    - [21, 30345.4]
  - - [128, 4096, 1, 2048, 160, 160, 2080, 2080]
    - [27, 36544.4]
  - - [128, 4096, 1, 4096, 160, 160, 4128, 4128]
    - [27, 34812.1]
  - - [256, 64, 1, 64, 288, 288, 256, 96]
    - [10, 162.848]
  - - [256, 64, 1, 128, 288, 288, 256, 160]
    - [78, 267.019]
  - - [256, 64, 1, 256, 288, 288, 288, 288]
    - [78, 453.195]
  - - [256, 64, 1, 512, 288, 288, 544, 544]
    - [78, 695.518]
  - - [256, 64, 1, 1024, 288, 288, 1056, 1056]
    - [83, 937.436]
  - - [256, 64, 1, 2048, 288, 288, 2080, 2080]
    - [68, 1166.63]
  - - [256, 64, 1, 4096, 288, 288, 4128, 4128]
    - [76, 1265.4]
  - - [256, 128, 1, 64, 288, 288, 256, 96]
    - [56, 367.214]
  - - [256, 128, 1, 128, 288, 288, 256, 160]
    - [78, 666.506]
  - - [256, 128, 1, 256, 288, 288, 288, 288]
    - [27, 1088.16]
  - - [256, 128, 1, 512, 288, 288, 544, 544]
    - [83, 1545.01]
  - - [256, 128, 1, 1024, 288, 288, 1056, 1056]
    - [85, 2095.06]
  - - [256, 128, 1, 2048, 288, 288, 2080, 2080]
    - [88, 2436.52]
  - - [256, 128, 1, 4096, 288, 288, 4128, 4128]
    - [85, 2614.71]
  - - [256, 256, 1, 64, 288, 288, 256, 96]
    - [27, 781.794]
  - - [256, 256, 1, 128, 288, 288, 256, 160]
    - [87, 1389.08]
  - - [256, 256, 1, 256, 288, 288, 288, 288]
    - [7, 2230.43]
  - - [256, 256, 1, 512, 288, 288, 544, 544]
    - [83, 3285.14]
  - - [256, 256, 1, 1024, 288, 288, 1056, 1056]
    - [85, 4186.2]
  - - [256, 256, 1, 2048, 288, 288, 2080, 2080]
    - [79, 5019.76]
  - - [256, 256, 1, 4096, 288, 288, 4128, 4128]
    - [79, 5269.76]
  - - [256, 512, 1, 64, 288, 288, 256, 96]
    - [99, 1557.49]
  - - [256, 512, 1, 128, 288, 288, 256, 160]
    - [68, 2791.09]
  - - [256, 512, 1, 256, 288, 288, 288, 288]
    - [78, 4560.9]
  - - [256, 512, 1, 512, 288, 288, 544, 544]
    - [7, 6477.72]
  - - [256, 512, 1, 1024, 288, 288, 1056, 1056]
    - [85, 8405.43]
  - - [256, 512, 1, 2048, 288, 288, 2080, 2080]
    - [82, 9929.21]
  - - [256, 512, 1, 4096, 288, 288, 4128, 4128]
    - [90, 10515.4]
  - - [256, 1024, 1, 64, 288, 288, 256, 96]
    - [68, 2916.77]
  - - [256, 1024, 1, 128, 288, 288, 256, 160]
    - [83, 5190.17]
  - - [256, 1024, 1, 256, 288, 288, 288, 288]
    - [7, 8400.16]
  - - [256, 1024, 1, 512, 288, 288, 544, 544]
    - [77, 12208.3]
  - - [256, 1024, 1, 1024, 288, 288, 1056, 1056]
    - [71, 16455.4]
  - - [256, 1024, 1, 2048, 288, 288, 2080, 2080]
    - [87, 19471.7]
  - - [256, 1024, 1, 4096, 288, 288, 4128, 4128]
    - [85, 21216.1]
  - - [256, 2048, 1, 64, 288, 288, 256, 96]
    - [56, 4964.43]
  - - [256, 2048, 1, 128, 288, 288, 256, 160]
    - [17, 8974.2]
  - - [256, 2048, 1, 256, 288, 288, 288, 288]
    - [27, 14845.5]
  - - [256, 2048, 1, 512, 288, 288, 544, 544]
    - [17, 22319.5]
  - - [256, 2048, 1, 1024, 288, 288, 1056, 1056]
    - [17, 29610.7]
  - - [256, 2048, 1, 2048, 288, 288, 2080, 2080]
    - [17, 36750.7]
  - - [256, 2048, 1, 4096, 288, 288, 4128, 4128]
    - [26, 39371.0]
  - - [256, 4096, 1, 64, 288, 288, 256, 96]
    - [92, 8456.26]
  - - [256, 4096, 1, 128, 288, 288, 256, 160]
    - [18, 14592.1]
  - - [256, 4096, 1, 256, 288, 288, 288, 288]
    - [36, 23638.3]
  - - [256, 4096, 1, 512, 288, 288, 544, 544]
    - [58, 31683.3]
  - - [256, 4096, 1, 1024, 288, 288, 1056, 1056]
    - [47, 36785.9]
  - - [256, 4096, 1, 2048, 288, 288, 2080, 2080]
    - [62, 39229.3]
  - - [256, 4096, 1, 4096, 288, 288, 4128, 4128]
    - [65, 38514.8]
  - - [384, 64, 1, 64, 416, 416, 384, 96]
    - [11, 238.639]
  - - [384, 64, 1, 128, 416, 416, 384, 160]
    - [27, 412.285]
  - - [384, 64, 1, 256, 416, 416, 384, 288]
    - [83, 674.691]
  - - [384, 64, 1, 512, 416, 416, 544, 544]
    - [78, 1060.24]
  - - [384, 64, 1, 1024, 416, 416, 1056, 1056]
    - [85, 1426.07]
  - - [384, 64, 1, 2048, 416, 416, 2080, 2080]
    - [79, 1773.06]
  - - [384, 64, 1, 4096, 416, 416, 4128, 4128]
    - [71, 1903.95]
  - - [384, 128, 1, 64, 416, 416, 384, 96]
    - [27, 560.139]
  - - [384, 128, 1, 128, 416, 416, 384, 160]
    - [27, 1016.89]
  - - [384, 128, 1, 256, 416, 416, 384, 288]
    - [72, 1655.87]
  - - [384, 128, 1, 512, 416, 416, 544, 544]
    - [68, 2424.46]
  - - [384, 128, 1, 1024, 416, 416, 1056, 1056]
    - [87, 3153.62]
  - - [384, 128, 1, 2048, 416, 416, 2080, 2080]
    - [84, 3688.8]
  - - [384, 128, 1, 4096, 416, 416, 4128, 4128]
    - [82, 3913.14]
  - - [384, 256, 1, 64, 416, 416, 384, 96]
    - [17, 1193.15]
  - - [384, 256, 1, 128, 416, 416, 384, 160]
    - [5, 2066.5]
  - - [384, 256, 1, 256, 416, 416, 384, 288]
    - [68, 3279.37]
  - - [384, 256, 1, 512, 416, 416, 544, 544]
    - [83, 4937.88]
  - - [384, 256, 1, 1024, 416, 416, 1056, 1056]
    - [71, 6428.48]
  - - [384, 256, 1, 2048, 416, 416, 2080, 2080]
    - [84, 7479.0]
  - - [384, 256, 1, 4096, 416, 416, 4128, 4128]
    - [71, 7907.75]
  - - [384, 512, 1, 64, 416, 416, 384, 96]
    - [21, 2154.99]
  - - [384, 512, 1, 128, 416, 416, 384, 160]
    - [74, 3838.01]
  - - [384, 512, 1, 256, 416, 416, 384, 288]
    - [78, 6580.2]
  - - [384, 512, 1, 512, 416, 416, 544, 544]
    - [71, 9646.74]
  - - [384, 512, 1, 1024, 416, 416, 1056, 1056]
    - [69, 12321.9]
  - - [384, 512, 1, 2048, 416, 416, 2080, 2080]
    - [69, 14693.3]
  - - [384, 512, 1, 4096, 416, 416, 4128, 4128]
    - [81, 15659.0]
  - - [384, 1024, 1, 64, 416, 416, 384, 96]
    - [80, 3818.22]
  - - [384, 1024, 1, 128, 416, 416, 384, 160]
    - [5, 7041.39]
  - - [384, 1024, 1, 256, 416, 416, 384, 288]
    - [7, 11616.0]
  - - [384, 1024, 1, 512, 416, 416, 544, 544]
    - [6, 16951.0]
  - - [384, 1024, 1, 1024, 416, 416, 1056, 1056]
    - [7, 23068.1]
  - - [384, 1024, 1, 2048, 416, 416, 2080, 2080]
    - [16, 27417.6]
  - - [384, 1024, 1, 4096, 416, 416, 4128, 4128]
    - [7, 29648.4]
  - - [384, 2048, 1, 64, 416, 416, 384, 96]
    - [37, 6673.54]
  - - [384, 2048, 1, 128, 416, 416, 384, 160]
    - [96, 12415.3]
  - - [384, 2048, 1, 256, 416, 416, 384, 288]
    - [57, 21413.3]
  - - [384, 2048, 1, 512, 416, 416, 544, 544]
    - [53, 28504.6]
  - - [384, 2048, 1, 1024, 416, 416, 1056, 1056]
    - [59, 35455.8]
  - - [384, 2048, 1, 2048, 416, 416, 2080, 2080]
    - [57, 38689.8]
  - - [384, 2048, 1, 4096, 416, 416, 4128, 4128]
    - [50, 40022.8]
  - - [384, 4096, 1, 64, 416, 416, 384, 96]
    - [22, 11686.1]
  - - [384, 4096, 1, 128, 416, 416, 384, 160]
    - [30, 19168.6]
  - - [384, 4096, 1, 256, 416, 416, 384, 288]
    - [12, 26745.6]
  - - [384, 4096, 1, 512, 416, 416, 544, 544]
    - [13, 32553.6]
  - - [384, 4096, 1, 1024, 416, 416, 1056, 1056]
    - [3, 35289.7]
  - - [384, 4096, 1, 2048, 416, 416, 2080, 2080]
    - [2, 38532.5]
  - - [384, 4096, 1, 4096, 416, 416, 4128, 4128]
    - [25, 37187.9]
  - - [768, 64, 1, 64, 800, 800, 768, 96]
    - [1, 489.153]
  - - [768, 64, 1, 128, 800, 800, 768, 160]
    - [68, 827.282]
  - - [768, 64, 1, 256, 800, 800, 768, 288]
    - [78, 1393.92]
  - - [768, 64, 1, 512, 800, 800, 768, 544]
    - [68, 2180.94]
  - - [768, 64, 1, 1024, 800, 800, 1056, 1056]
    - [7, 2891.14]
  - - [768, 64, 1, 2048, 800, 800, 2080, 2080]
    - [85, 3566.85]
  - - [768, 64, 1, 4096, 800, 800, 4128, 4128]
    - [71, 3823.73]
  - - [768, 128, 1, 64, 800, 800, 768, 96]
    - [27, 1092.08]
  - - [768, 128, 1, 128, 800, 800, 768, 160]
    - [93, 2065.83]
  - - [768, 128, 1, 256, 800, 800, 768, 288]
    - [68, 3411.4]
  - - [768, 128, 1, 512, 800, 800, 768, 544]
    - [79, 4928.21]
  - - [768, 128, 1, 1024, 800, 800, 1056, 1056]
    - [85, 6244.26]
  - - [768, 128, 1, 2048, 800, 800, 2080, 2080]
    - [76, 7352.01]
  - - [768, 128, 1, 4096, 800, 800, 4128, 4128]
    - [76, 7789.5]
  - - [768, 256, 1, 64, 800, 800, 768, 96]
    - [42, 2291.98]
  - - [768, 256, 1, 128, 800, 800, 768, 160]
    - [27, 4029.77]
  - - [768, 256, 1, 256, 800, 800, 768, 288]
    - [79, 6560.43]
  - - [768, 256, 1, 512, 800, 800, 768, 544]
    - [7, 9468.0]
  - - [768, 256, 1, 1024, 800, 800, 1056, 1056]
    - [79, 12546.1]
  - - [768, 256, 1, 2048, 800, 800, 2080, 2080]
    - [76, 14596.3]
  - - [768, 256, 1, 4096, 800, 800, 4128, 4128]
    - [84, 15715.5]
  - - [768, 512, 1, 64, 800, 800, 768, 96]
    - [7, 3751.05]
  - - [768, 512, 1, 128, 800, 800, 768, 160]
    - [32, 6741.47]
  - - [768, 512, 1, 256, 800, 800, 768, 288]
    - [17, 11218.5]
  - - [768, 512, 1, 512, 800, 800, 768, 544]
    - [27, 17317.0]
  - - [768, 512, 1, 1024, 800, 800, 1056, 1056]
    - [27, 22698.8]
  - - [768, 512, 1, 2048, 800, 800, 2080, 2080]
    - [27, 27706.3]
  - - [768, 512, 1, 4096, 800, 800, 4128, 4128]
    - [27, 29548.3]
  - - [768, 1024, 1, 64, 800, 800, 768, 96]
    - [29, 7174.89]
  - - [768, 1024, 1, 128, 800, 800, 768, 160]
    - [95, 12006.6]
  - - [768, 1024, 1, 256, 800, 800, 768, 288]
    - [96, 19163.1]
  - - [768, 1024, 1, 512, 800, 800, 768, 544]
    - [39, 29144.0]
  - - [768, 1024, 1, 1024, 800, 800, 1056, 1056]
    - [55, 35034.8]
  - - [768, 1024, 1, 2048, 800, 800, 2080, 2080]
    - [35, 37956.8]
  - - [768, 1024, 1, 4096, 800, 800, 4128, 4128]
    - [38, 40750.9]
  - - [768, 2048, 1, 64, 800, 800, 768, 96]
    - [25, 12988.8]
  - - [768, 2048, 1, 128, 800, 800, 768, 160]
    - [11, 19550.2]
  - - [768, 2048, 1, 256, 800, 800, 768, 288]
    - [65, 27524.4]
  - - [768, 2048, 1, 512, 800, 800, 768, 544]
    - [2, 33781.1]
  - - [768, 2048, 1, 1024, 800, 800, 1056, 1056]
    - [37, 36378.4]
  - - [768, 2048, 1, 2048, 800, 800, 2080, 2080]
    - [56, 40192.6]
  - - [768, 2048, 1, 4096, 800, 800, 4128, 4128]
    - [58, 41995.9]
  - - [768, 4096, 1, 64, 800, 800, 768, 96]
    - [60, 17393.3]
  - - [768, 4096, 1, 128, 800, 800, 768, 160]
    - [63, 25542.6]
  - - [768, 4096, 1, 256, 800, 800, 768, 288]
    - [40, 32287.2]
  - - [768, 4096, 1, 512, 800, 800, 768, 544]
    - [58, 35993.8]
  - - [768, 4096, 1, 1024, 800, 800, 1056, 1056]
    - [45, 40278.5]
  - - [768, 4096, 1, 2048, 800, 800, 2080, 2080]
    - [42, 42644.7]
  - - [768, 4096, 1, 4096, 800, 800, 4128, 4128]
    - [60, 42741.3]
  - - [1536, 64, 1, 64, 1568, 1568, 1536, 96]
    - [9, 983.809]
  - - [1536, 64, 1, 128, 1568, 1568, 1536, 160]
    - [27, 1747.87]
  - - [1536, 64, 1, 256, 1568, 1568, 1536, 288]
    - [9, 2885.34]
  - - [1536, 64, 1, 512, 1568, 1568, 1536, 544]
    - [85, 4350.19]
  - - [1536, 64, 1, 1024, 1568, 1568, 1536, 1056]
    - [79, 5848.11]
  - - [1536, 64, 1, 2048, 1568, 1568, 2080, 2080]
    - [70, 7060.63]
  - - [1536, 64, 1, 4096, 1568, 1568, 4128, 4128]
    - [82, 7795.5]
  - - [1536, 128, 1, 64, 1568, 1568, 1536, 96]
    - [27, 2216.08]
  - - [1536, 128, 1, 128, 1568, 1568, 1536, 160]
    - [17, 4002.85]
  - - [1536, 128, 1, 256, 1568, 1568, 1536, 288]
    - [68, 6505.32]
  - - [1536, 128, 1, 512, 1568, 1568, 1536, 544]
    - [79, 9543.38]
  - - [1536, 128, 1, 1024, 1568, 1568, 1536, 1056]
    - [7, 12204.6]
  - - [1536, 128, 1, 2048, 1568, 1568, 2080, 2080]
    - [71, 14911.4]
  - - [1536, 128, 1, 4096, 1568, 1568, 4128, 4128]
    - [82, 15818.6]
  - - [1536, 256, 1, 64, 1568, 1568, 1536, 96]
    - [17, 3796.32]
  - - [1536, 256, 1, 128, 1568, 1568, 1536, 160]
    - [33, 7098.96]
  - - [1536, 256, 1, 256, 1568, 1568, 1536, 288]
    - [27, 11779.0]
  - - [1536, 256, 1, 512, 1568, 1568, 1536, 544]
    - [27, 16995.3]
  - - [1536, 256, 1, 1024, 1568, 1568, 1536, 1056]
    - [27, 22810.6]
  - - [1536, 256, 1, 2048, 1568, 1568, 2080, 2080]
    - [7, 27881.7]
  - - [1536, 256, 1, 4096, 1568, 1568, 4128, 4128]
    - [6, 29707.4]
  - - [1536, 512, 1, 64, 1568, 1568, 1536, 96]
    - [94, 6461.89]
  - - [1536, 512, 1, 128, 1568, 1568, 1536, 160]
    - [98, 12026.7]
  - - [1536, 512, 1, 256, 1568, 1568, 1536, 288]
    - [43, 19672.3]
  - - [1536, 512, 1, 512, 1568, 1568, 1536, 544]
    - [43, 28391.8]
  - - [1536, 512, 1, 1024, 1568, 1568, 1536, 1056]
    - [46, 35477.6]
  - - [1536, 512, 1, 2048, 1568, 1568, 2080, 2080]
    - [43, 37564.4]
  - - [1536, 512, 1, 4096, 1568, 1568, 4128, 4128]
    - [50, 39385.5]
  - - [1536, 1024, 1, 64, 1568, 1568, 1536, 96]
    - [24, 12490.8]
  - - [1536, 1024, 1, 128, 1568, 1568, 1536, 160]
    - [31, 19632.0]
  - - [1536, 1024, 1, 256, 1568, 1568, 1536, 288]
    - [47, 27721.4]
  - - [1536, 1024, 1, 512, 1568, 1568, 1536, 544]
    - [60, 33755.6]
  - - [1536, 1024, 1, 1024, 1568, 1568, 1536, 1056]
    - [56, 36597.3]
  - - [1536, 1024, 1, 2048, 1568, 1568, 2080, 2080]
    - [42, 40184.9]
  - - [1536, 1024, 1, 4096, 1568, 1568, 4128, 4128]
    - [45, 42014.7]
  - - [1536, 2048, 1, 64, 1568, 1568, 1536, 96]
    - [96, 17813.4]
  - - [1536, 2048, 1, 128, 1568, 1568, 1536, 160]
    - [62, 25087.4]
  - - [1536, 2048, 1, 256, 1568, 1568, 1536, 288]
    - [65, 32311.8]
  - - [1536, 2048, 1, 512, 1568, 1568, 1536, 544]
    - [45, 36053.4]
  - - [1536, 2048, 1, 1024, 1568, 1568, 1536, 1056]
    - [37, 40237.1]
  - - [1536, 2048, 1, 2048, 1568, 1568, 2080, 2080]
    - [56, 42683.6]
  - - [1536, 2048, 1, 4096, 1568, 1568, 4128, 4128]
    - [58, 43264.3]
  - - [1536, 4096, 1, 64, 1568, 1568, 1536, 96]
    - [51, 21697.0]
  - - [1536, 4096, 1, 128, 1568, 1568, 1536, 160]
    - [65, 29651.5]
  - - [1536, 4096, 1, 256, 1568, 1568, 1536, 288]
    - [62, 34229.7]
  - - [1536, 4096, 1, 512, 1568, 1568, 1536, 544]
    - [40, 38868.4]
  - - [1536, 4096, 1, 1024, 1568, 1568, 1536, 1056]
    - [60, 41956.9]
  - - [1536, 4096, 1, 2048, 1568, 1568, 2080, 2080]
    - [54, 43003.1]
  - - [1536, 4096, 1, 4096, 1568, 1568, 4128, 4128]
    - [37, 43321.6]
  - - [3072, 64, 1, 64, 3104, 3104, 3072, 96]
    - [0, 1783.29]
  - - [3072, 64, 1, 128, 3104, 3104, 3072, 160]
    - [64, 3207.06]
  - - [3072, 64, 1, 256, 3104, 3104, 3072, 288]
    - [26, 5506.73]
  - - [3072, 64, 1, 512, 3104, 3104, 3072, 544]
    - [32, 8069.19]
  - - [3072, 64, 1, 1024, 3104, 3104, 3072, 1056]
    - [4, 11091.7]
  - - [3072, 64, 1, 2048, 3104, 3104, 3072, 2080]
    - [4, 13544.6]
  - - [3072, 64, 1, 4096, 3104, 3104, 4128, 4128]
    - [6, 14702.6]
  - - [3072, 128, 1, 64, 3104, 3104, 3072, 96]
    - [32, 4081.39]
  - - [3072, 128, 1, 128, 3104, 3104, 3072, 160]
    - [26, 7329.47]
  - - [3072, 128, 1, 256, 3104, 3104, 3072, 288]
    - [7, 12504.8]
  - - [3072, 128, 1, 512, 3104, 3104, 3072, 544]
    - [26, 17778.7]
  - - [3072, 128, 1, 1024, 3104, 3104, 3072, 1056]
    - [26, 23416.8]
  - - [3072, 128, 1, 2048, 3104, 3104, 3072, 2080]
    - [7, 28229.6]
  - - [3072, 128, 1, 4096, 3104, 3104, 4128, 4128]
    - [16, 29952.6]
  - - [3072, 256, 1, 64, 3104, 3104, 3072, 96]
    - [11, 8056.9]
  - - [3072, 256, 1, 128, 3104, 3104, 3072, 160]
    - [59, 13443.3]
  - - [3072, 256, 1, 256, 3104, 3104, 3072, 288]
    - [41, 21435.9]
  - - [3072, 256, 1, 512, 3104, 3104, 3072, 544]
    - [53, 28453.9]
  - - [3072, 256, 1, 1024, 3104, 3104, 3072, 1056]
    - [57, 35023.9]
  - - [3072, 256, 1, 2048, 3104, 3104, 3072, 2080]
    - [46, 38268.6]
  - - [3072, 256, 1, 4096, 3104, 3104, 4128, 4128]
    - [28, 37941.3]
  - - [3072, 512, 1, 64, 3104, 3104, 3072, 96]
    - [23, 12455.2]
  - - [3072, 512, 1, 128, 3104, 3104, 3072, 160]
    - [13, 19616.7]
  - - [3072, 512, 1, 256, 3104, 3104, 3072, 288]
    - [45, 27865.2]
  - - [3072, 512, 1, 512, 3104, 3104, 3072, 544]
    - [47, 33788.1]
  - - [3072, 512, 1, 1024, 3104, 3104, 3072, 1056]
    - [42, 36544.1]
  - - [3072, 512, 1, 2048, 3104, 3104, 3072, 2080]
    - [42, 40250.1]
  - - [3072, 512, 1, 4096, 3104, 3104, 4128, 4128]
    - [47, 41325.5]
  - - [3072, 1024, 1, 64, 3104, 3104, 3072, 96]
    - [47, 17316.9]
  - - [3072, 1024, 1, 128, 3104, 3104, 3072, 160]
    - [65, 25113.9]
  - - [3072, 1024, 1, 256, 3104, 3104, 3072, 288]
    - [52, 32737.3]
  - - [3072, 1024, 1, 512, 3104, 3104, 3072, 544]
    - [56, 36306.1]
  - - [3072, 1024, 1, 1024, 3104, 3104, 3072, 1056]
    - [56, 40172.9]
  - - [3072, 1024, 1, 2048, 3104, 3104, 3072, 2080]
    - [37, 42758.9]
  - - [3072, 1024, 1, 4096, 3104, 3104, 4128, 4128]
    - [45, 43195.4]
  - - [3072, 2048, 1, 64, 3104, 3104, 3072, 96]
    - [62, 21694.6]
  - - [3072, 2048, 1, 128, 3104, 3104, 3072, 160]
    - [62, 29738.0]
  - - [3072, 2048, 1, 256, 3104, 3104, 3072, 288]
    - [61, 34272.7]
  - - [3072, 2048, 1, 512, 3104, 3104, 3072, 544]
    - [48, 38863.2]
  - - [3072, 2048, 1, 1024, 3104, 3104, 3072, 1056]
    - [47, 41971.9]
  - - [3072, 2048, 1, 2048, 3104, 3104, 3072, 2080]
    - [42, 43036.4]
  - - [3072, 2048, 1, 4096, 3104, 3104, 4128, 4128]
    - [37, 42925.6]
  - - [3072, 4096, 1, 64, 3104, 3104, 3072, 96]
    - [51, 25010.2]
  - - [3072, 4096, 1, 128, 3104, 3104, 3072, 160]
    - [49, 30886.0]
  - - [3072, 4096, 1, 256, 3104, 3104, 3072, 288]
    - [48, 36642.7]
  - - [3072, 4096, 1, 512, 3104, 3104, 3072, 544]
    - [49, 40414.3]
  - - [3072, 4096, 1, 1024, 3104, 3104, 3072, 1056]
    - [45, 42176.5]
  - - [3072, 4096, 1, 2048, 3104, 3104, 3072, 2080]
    - [42, 43321.3]
  - - [3072, 4096, 1, 4096, 3104, 3104, 4128, 4128]
    - [44, 41457.0]
  - - [4096, 64, 1, 64, 4128, 4128, 4096, 96]
    - [4, 2489.94]
  - - [4096, 64, 1, 128, 4128, 4128, 4096, 160]
    - [32, 4083.03]
  - - [4096, 64, 1, 256, 4128, 4128, 4096, 288]
    - [16, 6885.06]
  - - [4096, 64, 1, 512, 4128, 4128, 4096, 544]
    - [26, 10896.0]
  - - [4096, 64, 1, 1024, 4128, 4128, 4096, 1056]
    - [16, 14619.1]
  - - [4096, 64, 1, 2048, 4128, 4128, 4096, 2080]
    - [6, 18105.7]
  - - [4096, 64, 1, 4096, 4128, 4128, 4128, 4128]
    - [20, 19414.2]
  - - [4096, 128, 1, 64, 4128, 4128, 4096, 96]
    - [10, 5634.67]
  - - [4096, 128, 1, 128, 4128, 4128, 4096, 160]
    - [9, 10540.1]
  - - [4096, 128, 1, 256, 4128, 4128, 4096, 288]
    - [17, 17084.7]
  - - [4096, 128, 1, 512, 4128, 4128, 4096, 544]
    - [7, 24790.8]
  - - [4096, 128, 1, 1024, 4128, 4128, 4096, 1056]
    - [17, 31513.9]
  - - [4096, 128, 1, 2048, 4128, 4128, 4096, 2080]
    - [15, 37249.0]
  - - [4096, 128, 1, 4096, 4128, 4128, 4128, 4128]
    - [21, 38655.1]
  - - [4096, 256, 1, 64, 4128, 4128, 4096, 96]
    - [48, 10338.8]
  - - [4096, 256, 1, 128, 4128, 4128, 4096, 160]
    - [40, 16927.4]
  - - [4096, 256, 1, 256, 4128, 4128, 4096, 288]
    - [60, 24593.2]
  - - [4096, 256, 1, 512, 4128, 4128, 4096, 544]
    - [58, 31291.6]
  - - [4096, 256, 1, 1024, 4128, 4128, 4096, 1056]
    - [60, 37382.6]
  - - [4096, 256, 1, 2048, 4128, 4128, 4096, 2080]
    - [40, 39381.7]
  - - [4096, 256, 1, 4096, 4128, 4128, 4128, 4128]
    - [34, 41215.3]
  - - [4096, 512, 1, 64, 4128, 4128, 4096, 96]
    - [54, 14514.7]
  - - [4096, 512, 1, 128, 4128, 4128, 4096, 160]
    - [61, 22022.8]
  - - [4096, 512, 1, 256, 4128, 4128, 4096, 288]
    - [40, 30156.2]
  - - [4096, 512, 1, 512, 4128, 4128, 4096, 544]
    - [42, 35698.5]
  - - [4096, 512, 1, 1024, 4128, 4128, 4096, 1056]
    - [60, 38757.6]
  - - [4096, 512, 1, 2048, 4128, 4128, 4096, 2080]
    - [40, 41716.1]
  - - [4096, 512, 1, 4096, 4128, 4128, 4128, 4128]
    - [46, 42775.1]
  - - [4096, 1024, 1, 64, 4128, 4128, 4096, 96]
    - [61, 19273.1]
  - - [4096, 1024, 1, 128, 4128, 4128, 4096, 160]
    - [65, 27091.4]
  - - [4096, 1024, 1, 256, 4128, 4128, 4096, 288]
    - [61, 33915.8]
  - - [4096, 1024, 1, 512, 4128, 4128, 4096, 544]
    - [62, 37419.7]
  - - [4096, 1024, 1, 1024, 4128, 4128, 4096, 1056]
    - [54, 41089.5]
  - - [4096, 1024, 1, 2048, 4128, 4128, 4096, 2080]
    - [60, 43202.6]
  - - [4096, 1024, 1, 4096, 4128, 4128, 4128, 4128]
    - [58, 42751.4]
  - - [4096, 2048, 1, 64, 4128, 4128, 4096, 96]
    - [61, 23254.2]
  - - [4096, 2048, 1, 128, 4128, 4128, 4096, 160]
    - [56, 30652.9]
  - - [4096, 2048, 1, 256, 4128, 4128, 4096, 288]
    - [62, 35241.6]
  - - [4096, 2048, 1, 512, 4128, 4128, 4096, 544]
    - [58, 39681.5]
  - - [4096, 2048, 1, 1024, 4128, 4128, 4096, 1056]
    - [58, 42476.9]
  - - [4096, 2048, 1, 2048, 4128, 4128, 4096, 2080]
    - [42, 42935.5]
  - - [4096, 2048, 1, 4096, 4128, 4128, 4128, 4128]
    - [61, 42847.9]
  - - [4096, 4096, 1, 64, 4128, 4128, 4096, 96]
    - [58, 23153.0]
  - - [4096, 4096, 1, 128, 4128, 4128, 4096, 160]
    - [60, 30122.8]
  - - [4096, 4096, 1, 256, 4128, 4128, 4096, 288]
    - [91, 35267.4]
  - - [4096, 4096, 1, 512, 4128, 4128, 4096, 544]
    - [47, 40597.4]
  - - [4096, 4096, 1, 1024, 4128, 4128, 4096, 1056]
    - [47, 41985.1]
  - - [4096, 4096, 1, 2048, 4128, 4128, 4096, 2080]
    - [40, 43431.8]
  - - [4096, 4096, 1, 4096, 4128, 4128, 4128, 4128]
    - [99, 40503.4]
- null
- null
- DeviceEfficiency
