library/src/blas3/Tensile/Logic/asm_full/navi33/navi33_Cijk_Ailk_Bljk_HB.yaml
- {MinimumRequiredVersion: 4.35.0}
- navi33
- gfx1102
- [Device 73f0]
    SolutionIndex: 0
    SolutionNameMin: Cijk_Ailk_Bljk_HB_MT128x128x16_MI16x16x16x1_SN_1LDSB0_GRVW4_PLR0_SIA1_SU0_SUS0_SVW4_VW4_WGM1
    SolutionIndex: 1
    SolutionNameMin: Cijk_Ailk_Bljk_HB_MT128x128x16_MI16x16x16x1_SN_1LDSB0_GRVW8_PLR0_SIA1_SU0_SUS0_SVW2_VW2_WGM1
    SolutionIndex: 2
    SolutionNameMin: Cijk_Ailk_Bljk_HB_MT128x128x16_MI16x16x16x1_SN_1LDSB0_GRVW8_PLR0_SIA1_SU0_SUS0_SVW4_VW4_WGM1
    SolutionIndex: 3
    SolutionNameMin: Cijk_Ailk_Bljk_HB_MT128x128x16_MI16x16x16x1_SN_1LDSB0_GRVW4_PLR1_SIA1_SU0_SUS0_SVW2_VW2_WGM1
    SolutionIndex: 4
    SolutionNameMin: Cijk_Ailk_Bljk_HB_MT128x128x16_MI16x16x16x1_SN_1LDSB0_GRVW4_PLR1_SIA1_SU0_SUS0_SVW4_VW4_WGM1
    SolutionIndex: 5
    SolutionNameMin: Cijk_Ailk_Bljk_HB_MT128x128x16_MI16x16x16x1_SN_1LDSB0_GRVW8_PLR1_SIA1_SU0_SUS0_SVW2_VW2_WGM1
    SolutionIndex: 6
    SolutionNameMin: Cijk_Ailk_Bljk_HB_MT128x128x16_MI16x16x16x1_SN_1LDSB0_GRVW8_PLR1_SIA1_SU0_SUS0_SVW4_VW4_WGM1
    SolutionIndex: 7
    SolutionNameMin: Cijk_Ailk_Bljk_HB_MT128x128x16_MI16x16x16x1_SN_1LDSB1_GRVW4_PLR1_SIA2_SU0_SUS0_SVW2_VW2_WGM1
    SolutionIndex: 8
    SolutionNameMin: Cijk_Ailk_Bljk_HB_MT128x128x16_MI16x16x16x1_SN_1LDSB1_GRVW4_PLR1_SIA2_SU0_SUS0_SVW4_VW4_WGM1
    SolutionIndex: 9
    SolutionNameMin: Cijk_Ailk_Bljk_HB_MT128x128x16_MI16x16x16x1_SN_1LDSB1_GRVW8_PLR1_SIA2_SU0_SUS0_SVW2_VW2_WGM1
    SolutionIndex: 10
    SolutionNameMin: Cijk_Ailk_Bljk_HB_MT128x128x16_MI16x16x16x1_SN_1LDSB1_GRVW8_PLR1_SIA2_SU0_SUS0_SVW4_VW4_WGM1
    SolutionIndex: 11
    SolutionNameMin: Cijk_Ailk_Bljk_HB_MT128x128x16_MI16x16x16x1_SN_1LDSB0_GRVW8_PLR0_SIA3_SU0_SUS0_SVW2_VW2_WGM1
    SolutionIndex: 12
    SolutionNameMin: Cijk_Ailk_Bljk_HB_MT128x128x16_MI16x16x16x1_SN_1LDSB0_GRVW4_PLR0_SIA1_SU32_SUS256_SVW4_VW4_WGM1
    SolutionIndex: 13
    SolutionNameMin: Cijk_Ailk_Bljk_HB_MT128x128x16_MI16x16x16x1_SN_1LDSB0_GRVW8_PLR0_SIA1_SU32_SUS256_SVW2_VW2_WGM1
    SolutionIndex: 14
    SolutionNameMin: Cijk_Ailk_Bljk_HB_MT128x128x16_MI16x16x16x1_SN_1LDSB0_GRVW8_PLR0_SIA1_SU32_SUS256_SVW4_VW4_WGM1
    SolutionIndex: 15
    SolutionNameMin: Cijk_Ailk_Bljk_HB_MT128x128x16_MI16x16x16x1_SN_1LDSB0_GRVW4_PLR1_SIA1_SU32_SUS256_SVW4_VW4_WGM1
    SolutionIndex: 16
    SolutionNameMin: Cijk_Ailk_Bljk_HB_MT128x128x16_MI16x16x16x1_SN_1LDSB0_GRVW8_PLR1_SIA1_SU32_SUS256_SVW2_VW2_WGM1
    SolutionIndex: 17
    SolutionNameMin: Cijk_Ailk_Bljk_HB_MT128x128x16_MI16x16x16x1_SN_1LDSB0_GRVW8_PLR1_SIA1_SU32_SUS256_SVW4_VW4_WGM1
    SolutionIndex: 18
    SolutionNameMin: Cijk_Ailk_Bljk_HB_MT128x128x16_MI16x16x16x1_SN_1LDSB1_GRVW4_PLR1_SIA2_SU32_SUS256_SVW4_VW4_WGM1
    SolutionIndex: 19
    SolutionNameMin: Cijk_Ailk_Bljk_HB_MT128x128x16_MI16x16x16x1_SN_1LDSB1_GRVW8_PLR1_SIA2_SU32_SUS256_SVW4_VW4_WGM1
    SolutionIndex: 20
    SolutionNameMin: Cijk_Ailk_Bljk_HB_MT128x128x16_MI16x16x16x1_SN_1LDSB0_GRVW8_PLR1_SIA3_SU32_SUS256_SVW4_VW4_WGM1
    SolutionIndex: 21
    SolutionNameMin: Cijk_Ailk_Bljk_HB_MT128x128x16_MI16x16x16x1_SN_1LDSB0_GRVW4_PLR0_SIA1_SU0_SUS0_SVW2_VW2_WGM4
    SolutionIndex: 22
    SolutionNameMin: Cijk_Ailk_Bljk_HB_MT128x128x16_MI16x16x16x1_SN_1LDSB0_GRVW4_PLR0_SIA1_SU0_SUS0_SVW4_VW4_WGM4
    SolutionIndex: 23
    SolutionNameMin: Cijk_Ailk_Bljk_HB_MT128x128x16_MI16x16x16x1_SN_1LDSB0_GRVW8_PLR0_SIA1_SU0_SUS0_SVW4_VW4_WGM4
    SolutionIndex: 24
    SolutionNameMin: Cijk_Ailk_Bljk_HB_MT128x128x16_MI16x16x16x1_SN_1LDSB0_GRVW4_PLR1_SIA1_SU0_SUS0_SVW4_VW4_WGM4
    SolutionIndex: 25
    SolutionNameMin: Cijk_Ailk_Bljk_HB_MT128x128x16_MI16x16x16x1_SN_1LDSB0_GRVW8_PLR1_SIA1_SU0_SUS0_SVW4_VW4_WGM4
    SolutionIndex: 26
    SolutionNameMin: Cijk_Ailk_Bljk_HB_MT128x128x16_MI16x16x16x1_SN_1LDSB1_GRVW4_PLR1_SIA2_SU0_SUS0_SVW2_VW2_WGM4
    SolutionIndex: 27
    SolutionNameMin: Cijk_Ailk_Bljk_HB_MT128x128x16_MI16x16x16x1_SN_1LDSB1_GRVW4_PLR1_SIA2_SU0_SUS0_SVW4_VW4_WGM4
    SolutionIndex: 28
    SolutionNameMin: Cijk_Ailk_Bljk_HB_MT128x128x16_MI16x16x16x1_SN_1LDSB1_GRVW8_PLR1_SIA2_SU0_SUS0_SVW2_VW2_WGM4
    SolutionIndex: 29
    SolutionNameMin: Cijk_Ailk_Bljk_HB_MT128x128x16_MI16x16x16x1_SN_1LDSB1_GRVW8_PLR1_SIA2_SU0_SUS0_SVW4_VW4_WGM4
    SolutionIndex: 30
    SolutionNameMin: Cijk_Ailk_Bljk_HB_MT128x128x16_MI16x16x16x1_SN_1LDSB0_GRVW8_PLR0_SIA3_SU0_SUS0_SVW4_VW4_WGM4
    SolutionIndex: 31
    SolutionNameMin: Cijk_Ailk_Bljk_HB_MT128x128x16_MI16x16x16x1_SN_1LDSB0_GRVW8_PLR1_SIA3_SU0_SUS0_SVW4_VW4_WGM4
    SolutionIndex: 32
    SolutionNameMin: Cijk_Ailk_Bljk_HB_MT128x128x16_MI16x16x16x1_SN_1LDSB0_GRVW4_PLR0_SIA1_SU32_SUS256_SVW4_VW4_WGM4
    SolutionIndex: 33
    SolutionNameMin: Cijk_Ailk_Bljk_HB_MT128x128x16_MI16x16x16x1_SN_1LDSB0_GRVW8_PLR0_SIA1_SU32_SUS256_SVW2_VW2_WGM4
    SolutionIndex: 34
    SolutionNameMin: Cijk_Ailk_Bljk_HB_MT128x128x16_MI16x16x16x1_SN_1LDSB0_GRVW8_PLR0_SIA1_SU32_SUS256_SVW4_VW4_WGM4
    SolutionIndex: 35
    SolutionNameMin: Cijk_Ailk_Bljk_HB_MT128x128x16_MI16x16x16x1_SN_1LDSB0_GRVW8_PLR1_SIA1_SU32_SUS256_SVW4_VW4_WGM4
    SolutionIndex: 36
    SolutionNameMin: Cijk_Ailk_Bljk_HB_MT128x128x16_MI16x16x16x1_SN_1LDSB1_GRVW4_PLR1_SIA2_SU32_SUS256_SVW2_VW2_WGM4
    SolutionIndex: 37
    SolutionNameMin: Cijk_Ailk_Bljk_HB_MT128x128x16_MI16x16x16x1_SN_1LDSB1_GRVW4_PLR1_SIA2_SU32_SUS256_SVW4_VW4_WGM4
    SolutionIndex: 38
    SolutionNameMin: Cijk_Ailk_Bljk_HB_MT128x128x16_MI16x16x16x1_SN_1LDSB1_GRVW8_PLR1_SIA2_SU32_SUS256_SVW2_VW2_WGM4
    SolutionIndex: 39
    SolutionNameMin: Cijk_Ailk_Bljk_HB_MT128x128x16_MI16x16x16x1_SN_1LDSB1_GRVW8_PLR1_SIA2_SU32_SUS256_SVW4_VW4_WGM4
    SolutionIndex: 40
    SolutionNameMin: Cijk_Ailk_Bljk_HB_MT128x128x16_MI16x16x16x1_SN_1LDSB0_GRVW4_PLR0_SIA3_SU32_SUS256_SVW2_VW2_WGM4
    SolutionIndex: 41
    SolutionNameMin: Cijk_Ailk_Bljk_HB_MT128x128x16_MI16x16x16x1_SN_1LDSB0_GRVW8_PLR0_SIA3_SU32_SUS256_SVW4_VW4_WGM4
    SolutionIndex: 42
    SolutionNameMin: Cijk_Ailk_Bljk_HB_MT128x128x16_MI16x16x16x1_SN_1LDSB0_GRVW8_PLR1_SIA3_SU32_SUS256_SVW4_VW4_WGM4
    SolutionIndex: 43
    SolutionNameMin: Cijk_Ailk_Bljk_HB_MT128x128x16_MI16x16x16x1_SN_1LDSB0_GRVW8_PLR0_SIA1_SU0_SUS0_SVW2_VW2_WGM8
    SolutionIndex: 44
    SolutionNameMin: Cijk_Ailk_Bljk_HB_MT128x128x16_MI16x16x16x1_SN_1LDSB0_GRVW8_PLR0_SIA1_SU0_SUS0_SVW4_VW4_WGM8
    SolutionIndex: 45
    SolutionNameMin: Cijk_Ailk_Bljk_HB_MT128x128x16_MI16x16x16x1_SN_1LDSB0_GRVW8_PLR1_SIA1_SU0_SUS0_SVW4_VW4_WGM8
    SolutionIndex: 46
    SolutionNameMin: Cijk_Ailk_Bljk_HB_MT128x128x16_MI16x16x16x1_SN_1LDSB1_GRVW4_PLR1_SIA2_SU0_SUS0_SVW2_VW2_WGM8
    SolutionIndex: 47
    SolutionNameMin: Cijk_Ailk_Bljk_HB_MT128x128x16_MI16x16x16x1_SN_1LDSB1_GRVW4_PLR1_SIA2_SU0_SUS0_SVW4_VW4_WGM8
    SolutionIndex: 48
    SolutionNameMin: Cijk_Ailk_Bljk_HB_MT128x128x16_MI16x16x16x1_SN_1LDSB1_GRVW8_PLR1_SIA2_SU0_SUS0_SVW2_VW2_WGM8
    SolutionIndex: 49
    SolutionNameMin: Cijk_Ailk_Bljk_HB_MT128x128x16_MI16x16x16x1_SN_1LDSB1_GRVW8_PLR1_SIA2_SU0_SUS0_SVW4_VW4_WGM8
    SolutionIndex: 50
    SolutionNameMin: Cijk_Ailk_Bljk_HB_MT128x128x16_MI16x16x16x1_SN_1LDSB0_GRVW8_PLR0_SIA3_SU0_SUS0_SVW4_VW4_WGM8
    SolutionIndex: 51
    SolutionNameMin: Cijk_Ailk_Bljk_HB_MT128x128x16_MI16x16x16x1_SN_1LDSB0_GRVW8_PLR1_SIA3_SU0_SUS0_SVW4_VW4_WGM8
    SolutionIndex: 52
    SolutionNameMin: Cijk_Ailk_Bljk_HB_MT128x128x16_MI16x16x16x1_SN_1LDSB0_GRVW4_PLR0_SIA1_SU32_SUS256_SVW4_VW4_WGM8
    SolutionIndex: 53
    SolutionNameMin: Cijk_Ailk_Bljk_HB_MT128x128x16_MI16x16x16x1_SN_1LDSB0_GRVW8_PLR0_SIA1_SU32_SUS256_SVW4_VW4_WGM8
    SolutionIndex: 54
    SolutionNameMin: Cijk_Ailk_Bljk_HB_MT128x128x16_MI16x16x16x1_SN_1LDSB0_GRVW8_PLR1_SIA1_SU32_SUS256_SVW4_VW4_WGM8
    SolutionIndex: 55
    SolutionNameMin: Cijk_Ailk_Bljk_HB_MT128x128x16_MI16x16x16x1_SN_1LDSB1_GRVW4_PLR1_SIA2_SU32_SUS256_SVW4_VW4_WGM8
    SolutionIndex: 56
    SolutionNameMin: Cijk_Ailk_Bljk_HB_MT128x128x16_MI16x16x16x1_SN_1LDSB1_GRVW8_PLR1_SIA2_SU32_SUS256_SVW2_VW2_WGM8
    SolutionIndex: 57
    SolutionNameMin: Cijk_Ailk_Bljk_HB_MT128x128x16_MI16x16x16x1_SN_1LDSB1_GRVW8_PLR1_SIA2_SU32_SUS256_SVW4_VW4_WGM8
    SolutionIndex: 58
    SolutionNameMin: Cijk_Ailk_Bljk_HB_MT128x128x16_MI16x16x16x1_SN_1LDSB0_GRVW8_PLR1_SIA3_SU32_SUS256_SVW2_VW2_WGM8
    SolutionIndex: 59
    SolutionNameMin: Cijk_Ailk_Bljk_HB_MT128x128x16_MI16x16x16x1_SN_1LDSB0_GRVW8_PLR1_SIA3_SU32_SUS256_SVW4_VW4_WGM8
    SolutionIndex: 60
    SolutionNameMin: Cijk_Ailk_Bljk_HB_MT128x128x32_MI16x16x16x1_SN_1LDSB0_GRVW4_PLR0_SIA1_SU0_SUS0_SVW2_VW2_WGM1
    SolutionIndex: 61
    SolutionNameMin: Cijk_Ailk_Bljk_HB_MT128x128x32_MI16x16x16x1_SN_1LDSB0_GRVW4_PLR0_SIA1_SU0_SUS0_SVW4_VW4_WGM1
    SolutionIndex: 62
    SolutionNameMin: Cijk_Ailk_Bljk_HB_MT128x128x32_MI16x16x16x1_SN_1LDSB0_GRVW8_PLR0_SIA1_SU0_SUS0_SVW2_VW2_WGM1
    SolutionIndex: 63
    SolutionNameMin: Cijk_Ailk_Bljk_HB_MT128x128x32_MI16x16x16x1_SN_1LDSB0_GRVW8_PLR0_SIA1_SU0_SUS0_SVW4_VW4_WGM1
    SolutionIndex: 64
    SolutionNameMin: Cijk_Ailk_Bljk_HB_MT128x128x32_MI16x16x16x1_SN_1LDSB0_GRVW4_PLR0_SIA1_SU32_SUS256_SVW2_VW2_WGM1
    SolutionIndex: 65
    SolutionNameMin: Cijk_Ailk_Bljk_HB_MT128x128x32_MI16x16x16x1_SN_1LDSB0_GRVW4_PLR0_SIA1_SU32_SUS256_SVW4_VW4_WGM1
    SolutionIndex: 66
    SolutionNameMin: Cijk_Ailk_Bljk_HB_MT128x128x32_MI16x16x16x1_SN_1LDSB0_GRVW8_PLR0_SIA1_SU32_SUS256_SVW2_VW2_WGM1
    SolutionIndex: 67
    SolutionNameMin: Cijk_Ailk_Bljk_HB_MT128x128x32_MI16x16x16x1_SN_1LDSB0_GRVW8_PLR0_SIA1_SU32_SUS256_SVW4_VW4_WGM1
    SolutionIndex: 68
    SolutionNameMin: Cijk_Ailk_Bljk_HB_MT128x128x32_MI16x16x16x1_SN_1LDSB0_GRVW8_PLR0_SIA3_SU32_SUS256_SVW4_VW4_WGM1
    SolutionIndex: 69
    SolutionNameMin: Cijk_Ailk_Bljk_HB_MT128x128x32_MI16x16x16x1_SN_1LDSB0_GRVW4_PLR0_SIA1_SU0_SUS0_SVW4_VW4_WGM4
    SolutionIndex: 70
    SolutionNameMin: Cijk_Ailk_Bljk_HB_MT128x128x32_MI16x16x16x1_SN_1LDSB0_GRVW8_PLR0_SIA1_SU0_SUS0_SVW2_VW2_WGM4
    SolutionIndex: 71
    SolutionNameMin: Cijk_Ailk_Bljk_HB_MT128x128x32_MI16x16x16x1_SN_1LDSB0_GRVW8_PLR0_SIA1_SU0_SUS0_SVW4_VW4_WGM4
    SolutionIndex: 72
    SolutionNameMin: Cijk_Ailk_Bljk_HB_MT128x128x32_MI16x16x16x1_SN_1LDSB0_GRVW8_PLR0_SIA3_SU0_SUS0_SVW2_VW2_WGM4
    SolutionIndex: 73
    SolutionNameMin: Cijk_Ailk_Bljk_HB_MT128x128x32_MI16x16x16x1_SN_1LDSB0_GRVW4_PLR0_SIA1_SU32_SUS256_SVW4_VW4_WGM4
    SolutionIndex: 74
    SolutionNameMin: Cijk_Ailk_Bljk_HB_MT128x128x32_MI16x16x16x1_SN_1LDSB0_GRVW8_PLR0_SIA1_SU32_SUS256_SVW4_VW4_WGM4
    SolutionIndex: 75
    SolutionNameMin: Cijk_Ailk_Bljk_HB_MT128x128x32_MI16x16x16x1_SN_1LDSB0_GRVW4_PLR0_SIA1_SU0_SUS0_SVW4_VW4_WGM8
    SolutionIndex: 76
    SolutionNameMin: Cijk_Ailk_Bljk_HB_MT128x128x32_MI16x16x16x1_SN_1LDSB0_GRVW8_PLR0_SIA1_SU0_SUS0_SVW2_VW2_WGM8
    SolutionIndex: 77
    SolutionNameMin: Cijk_Ailk_Bljk_HB_MT128x128x32_MI16x16x16x1_SN_1LDSB0_GRVW8_PLR0_SIA1_SU0_SUS0_SVW4_VW4_WGM8
    SolutionIndex: 78
    SolutionNameMin: Cijk_Ailk_Bljk_HB_MT128x128x32_MI16x16x16x1_SN_1LDSB0_GRVW8_PLR0_SIA3_SU0_SUS0_SVW4_VW4_WGM8
    SolutionIndex: 79
    SolutionNameMin: Cijk_Ailk_Bljk_HB_MT128x128x32_MI16x16x16x1_SN_1LDSB0_GRVW4_PLR0_SIA1_SU32_SUS256_SVW4_VW4_WGM8
    SolutionIndex: 80
    SolutionNameMin: Cijk_Ailk_Bljk_HB_MT128x128x32_MI16x16x16x1_SN_1LDSB0_GRVW8_PLR0_SIA1_SU32_SUS256_SVW4_VW4_WGM8
- - - [64, 64, 1, 64, 96, 96, 96, 96]
    - [2, 36.787]
  - - [64, 64, 1, 128, 96, 96, 160, 160]
    - [29, 61.6809]
  - - [64, 64, 1, 256, 96, 96, 288, 288]
    - [71, 105.778]
  - - [64, 64, 1, 512, 96, 96, 544, 544]
    - [71, 165.352]
  - - [64, 64, 1, 1024, 96, 96, 1056, 1056]
    - [71, 228.523]
  - - [64, 64, 1, 2048, 96, 96, 2080, 2080]
    - [77, 285.911]
  - - [64, 64, 1, 4096, 96, 96, 4128, 4128]
    - [71, 316.438]
  - - [64, 128, 1, 64, 96, 96, 96, 96]
    - [35, 64.9677]
  - - [64, 128, 1, 128, 96, 96, 160, 160]
    - [29, 119.048]
  - - [64, 128, 1, 256, 96, 96, 288, 288]
    - [29, 204.52]
  - - [64, 128, 1, 512, 96, 96, 544, 544]
    - [77, 324.085]
  - - [64, 128, 1, 1024, 96, 96, 1056, 1056]
    - [71, 455.878]
  - - [64, 128, 1, 2048, 96, 96, 2080, 2080]
    - [71, 574.032]
  - - [64, 128, 1, 4096, 96, 96, 4128, 4128]
    - [80, 633.976]
  - - [64, 256, 1, 64, 96, 96, 96, 96]
    - [29, 154.361]
  - - [64, 256, 1, 128, 96, 96, 160, 160]
    - [29, 280.48]
  - - [64, 256, 1, 256, 96, 96, 288, 288]
    - [77, 483.549]
  - - [64, 256, 1, 512, 96, 96, 544, 544]
    - [71, 727.546]
  - - [64, 256, 1, 1024, 96, 96, 1056, 1056]
    - [71, 992.327]
  - - [64, 256, 1, 2048, 96, 96, 2080, 2080]
    - [61, 1191.18]
  - - [64, 256, 1, 4096, 96, 96, 4128, 4128]
    - [77, 1301.8]
  - - [64, 512, 1, 64, 96, 96, 96, 96]
    - [71, 331.568]
  - - [64, 512, 1, 128, 96, 96, 160, 160]
    - [77, 597.056]
  - - [64, 512, 1, 256, 96, 96, 288, 288]
    - [74, 1002.7]
  - - [64, 512, 1, 512, 96, 96, 544, 544]
    - [71, 1479.99]
  - - [64, 512, 1, 1024, 96, 96, 1056, 1056]
    - [77, 2015.04]
  - - [64, 512, 1, 2048, 96, 96, 2080, 2080]
    - [77, 2450.3]
  - - [64, 512, 1, 4096, 96, 96, 4128, 4128]
    - [74, 2626.16]
  - - [64, 1024, 1, 64, 96, 96, 96, 96]
    - [48, 682.001]
  - - [64, 1024, 1, 128, 96, 96, 160, 160]
    - [77, 1233.08]
  - - [64, 1024, 1, 256, 96, 96, 288, 288]
    - [80, 2064.63]
  - - [64, 1024, 1, 512, 96, 96, 544, 544]
    - [79, 3019.93]
  - - [64, 1024, 1, 1024, 96, 96, 1056, 1056]
    - [64, 4102.27]
  - - [64, 1024, 1, 2048, 96, 96, 2080, 2080]
    - [80, 5002.53]
  - - [64, 1024, 1, 4096, 96, 96, 4128, 4128]
    - [62, 5363.78]
  - - [64, 2048, 1, 64, 96, 96, 96, 96]
    - [70, 1281.5]
  - - [64, 2048, 1, 128, 96, 96, 160, 160]
    - [66, 2328.88]
  - - [64, 2048, 1, 256, 96, 96, 288, 288]
    - [76, 3924.04]
  - - [64, 2048, 1, 512, 96, 96, 544, 544]
    - [60, 6173.2]
  - - [64, 2048, 1, 1024, 96, 96, 1056, 1056]
    - [60, 8336.5]
  - - [64, 2048, 1, 2048, 96, 96, 2080, 2080]
    - [79, 10165.3]
  - - [64, 2048, 1, 4096, 96, 96, 4128, 4128]
    - [67, 11151.6]
  - - [64, 4096, 1, 64, 96, 96, 96, 96]
    - [11, 2210.15]
  - - [64, 4096, 1, 128, 96, 96, 160, 160]
    - [72, 3995.05]
  - - [64, 4096, 1, 256, 96, 96, 288, 288]
    - [58, 6519.22]
  - - [64, 4096, 1, 512, 96, 96, 544, 544]
    - [13, 9791.93]
  - - [64, 4096, 1, 1024, 96, 96, 1056, 1056]
    - [15, 13509.6]
  - - [64, 4096, 1, 2048, 96, 96, 2080, 2080]
    - [12, 16861.5]
  - - [64, 4096, 1, 4096, 96, 96, 4128, 4128]
    - [68, 14846.1]
  - - [128, 64, 1, 64, 160, 160, 128, 96]
    - [6, 73.7603]
  - - [128, 64, 1, 128, 160, 160, 160, 160]
    - [2, 128.691]
  - - [128, 64, 1, 256, 160, 160, 288, 288]
    - [8, 204.421]
  - - [128, 64, 1, 512, 160, 160, 544, 544]
    - [77, 322.341]
  - - [128, 64, 1, 1024, 160, 160, 1056, 1056]
    - [80, 451.364]
  - - [128, 64, 1, 2048, 160, 160, 2080, 2080]
    - [74, 575.667]
  - - [128, 64, 1, 4096, 160, 160, 4128, 4128]
    - [71, 630.285]
  - - [128, 128, 1, 64, 160, 160, 128, 96]
    - [34, 167.772]
  - - [128, 128, 1, 128, 160, 160, 160, 160]
    - [19, 306.154]
  - - [128, 128, 1, 256, 160, 160, 288, 288]
    - [49, 506.314]
  - - [128, 128, 1, 512, 160, 160, 544, 544]
    - [71, 781.355]
  - - [128, 128, 1, 1024, 160, 160, 1056, 1056]
    - [71, 1036.01]
  - - [128, 128, 1, 2048, 160, 160, 2080, 2080]
    - [80, 1222.96]
  - - [128, 128, 1, 4096, 160, 160, 4128, 4128]
    - [71, 1305.11]
  - - [128, 256, 1, 64, 160, 160, 128, 96]
    - [44, 386.287]
  - - [128, 256, 1, 128, 160, 160, 160, 160]
    - [10, 679.13]
  - - [128, 256, 1, 256, 160, 160, 288, 288]
    - [49, 1111.22]
  - - [128, 256, 1, 512, 160, 160, 544, 544]
    - [63, 1634.73]
  - - [128, 256, 1, 1024, 160, 160, 1056, 1056]
    - [67, 2098.2]
  - - [128, 256, 1, 2048, 160, 160, 2080, 2080]
    - [67, 2503.6]
  - - [128, 256, 1, 4096, 160, 160, 4128, 4128]
    - [77, 2658.73]
  - - [128, 512, 1, 64, 160, 160, 128, 96]
    - [67, 798.767]
  - - [128, 512, 1, 128, 160, 160, 160, 160]
    - [10, 1399.97]
  - - [128, 512, 1, 256, 160, 160, 288, 288]
    - [77, 2307.73]
  - - [128, 512, 1, 512, 160, 160, 544, 544]
    - [80, 3356.46]
  - - [128, 512, 1, 1024, 160, 160, 1056, 1056]
    - [63, 4361.97]
  - - [128, 512, 1, 2048, 160, 160, 2080, 2080]
    - [74, 5071.52]
  - - [128, 512, 1, 4096, 160, 160, 4128, 4128]
    - [62, 5336.48]
  - - [128, 1024, 1, 64, 160, 160, 128, 96]
    - [71, 1512.29]
  - - [128, 1024, 1, 128, 160, 160, 160, 160]
    - [77, 2705.57]
  - - [128, 1024, 1, 256, 160, 160, 288, 288]
    - [77, 4459.08]
  - - [128, 1024, 1, 512, 160, 160, 544, 544]
    - [69, 6578.67]
  - - [128, 1024, 1, 1024, 160, 160, 1056, 1056]
    - [65, 8665.37]
  - - [128, 1024, 1, 2048, 160, 160, 2080, 2080]
    - [65, 10514.5]
  - - [128, 1024, 1, 4096, 160, 160, 4128, 4128]
    - [80, 11038.3]
  - - [128, 2048, 1, 64, 160, 160, 128, 96]
    - [63, 2750.36]
  - - [128, 2048, 1, 128, 160, 160, 160, 160]
    - [74, 4932.32]
  - - [128, 2048, 1, 256, 160, 160, 288, 288]
    - [77, 8253.46]
  - - [128, 2048, 1, 512, 160, 160, 544, 544]
    - [73, 12729.3]
  - - [128, 2048, 1, 1024, 160, 160, 1056, 1056]
    - [65, 17271.6]
  - - [128, 2048, 1, 2048, 160, 160, 2080, 2080]
    - [67, 20606.1]
  - - [128, 2048, 1, 4096, 160, 160, 4128, 4128]
    - [64, 18206.4]
  - - [128, 4096, 1, 64, 160, 160, 128, 96]
    - [78, 4783.92]
  - - [128, 4096, 1, 128, 160, 160, 160, 160]
    - [68, 8345.84]
  - - [128, 4096, 1, 256, 160, 160, 288, 288]
    - [80, 13684.5]
  - - [128, 4096, 1, 512, 160, 160, 544, 544]
    - [53, 20285.4]
  - - [128, 4096, 1, 1024, 160, 160, 1056, 1056]
    - [24, 27543.2]
  - - [128, 4096, 1, 2048, 160, 160, 2080, 2080]
    - [32, 34444.6]
  - - [128, 4096, 1, 4096, 160, 160, 4128, 4128]
    - [68, 29748.9]
  - - [256, 64, 1, 64, 288, 288, 256, 96]
    - [44, 163.457]
  - - [256, 64, 1, 128, 288, 288, 256, 160]
    - [14, 283.9]
  - - [256, 64, 1, 256, 288, 288, 288, 288]
    - [77, 455.46]
  - - [256, 64, 1, 512, 288, 288, 544, 544]
    - [77, 721.789]
  - - [256, 64, 1, 1024, 288, 288, 1056, 1056]
    - [76, 977.866]
  - - [256, 64, 1, 2048, 288, 288, 2080, 2080]
    - [71, 1197.13]
  - - [256, 64, 1, 4096, 288, 288, 4128, 4128]
    - [77, 1282.91]
  - - [256, 128, 1, 64, 288, 288, 256, 96]
    - [45, 377.253]
  - - [256, 128, 1, 128, 288, 288, 256, 160]
    - [10, 682.006]
  - - [256, 128, 1, 256, 288, 288, 288, 288]
    - [77, 1113.73]
  - - [256, 128, 1, 512, 288, 288, 544, 544]
    - [71, 1630.44]
  - - [256, 128, 1, 1024, 288, 288, 1056, 1056]
    - [63, 2126.53]
  - - [256, 128, 1, 2048, 288, 288, 2080, 2080]
    - [67, 2480.46]
  - - [256, 128, 1, 4096, 288, 288, 4128, 4128]
    - [74, 2627.34]
  - - [256, 256, 1, 64, 288, 288, 256, 96]
    - [49, 802.891]
  - - [256, 256, 1, 128, 288, 288, 256, 160]
    - [29, 1400.9]
  - - [256, 256, 1, 256, 288, 288, 288, 288]
    - [71, 2296.68]
  - - [256, 256, 1, 512, 288, 288, 544, 544]
    - [71, 3342.76]
  - - [256, 256, 1, 1024, 288, 288, 1056, 1056]
    - [77, 4234.53]
  - - [256, 256, 1, 2048, 288, 288, 2080, 2080]
    - [77, 5028.58]
  - - [256, 256, 1, 4096, 288, 288, 4128, 4128]
    - [71, 5335.53]
  - - [256, 512, 1, 64, 288, 288, 256, 96]
    - [71, 1605.78]
  - - [256, 512, 1, 128, 288, 288, 256, 160]
    - [63, 2827.3]
  - - [256, 512, 1, 256, 288, 288, 288, 288]
    - [63, 4428.47]
  - - [256, 512, 1, 512, 288, 288, 544, 544]
    - [77, 6535.73]
  - - [256, 512, 1, 1024, 288, 288, 1056, 1056]
    - [77, 8538.59]
  - - [256, 512, 1, 2048, 288, 288, 2080, 2080]
    - [74, 10038.7]
  - - [256, 512, 1, 4096, 288, 288, 4128, 4128]
    - [63, 10651.8]
  - - [256, 1024, 1, 64, 288, 288, 256, 96]
    - [77, 2963.65]
  - - [256, 1024, 1, 128, 288, 288, 256, 160]
    - [80, 5261.79]
  - - [256, 1024, 1, 256, 288, 288, 288, 288]
    - [71, 8682.74]
  - - [256, 1024, 1, 512, 288, 288, 544, 544]
    - [61, 12774.2]
  - - [256, 1024, 1, 1024, 288, 288, 1056, 1056]
    - [77, 16608.0]
  - - [256, 1024, 1, 2048, 288, 288, 2080, 2080]
    - [65, 20356.1]
  - - [256, 1024, 1, 4096, 288, 288, 4128, 4128]
    - [66, 21677.3]
  - - [256, 2048, 1, 64, 288, 288, 256, 96]
    - [30, 4790.75]
  - - [256, 2048, 1, 128, 288, 288, 256, 160]
    - [45, 8530.43]
  - - [256, 2048, 1, 256, 288, 288, 288, 288]
    - [10, 14281.5]
  - - [256, 2048, 1, 512, 288, 288, 544, 544]
    - [28, 21160.0]
  - - [256, 2048, 1, 1024, 288, 288, 1056, 1056]
    - [22, 28420.9]
  - - [256, 2048, 1, 2048, 288, 288, 2080, 2080]
    - [8, 35298.5]
  - - [256, 2048, 1, 4096, 288, 288, 4128, 4128]
    - [77, 31999.0]
  - - [256, 4096, 1, 64, 288, 288, 256, 96]
    - [71, 9346.64]
  - - [256, 4096, 1, 128, 288, 288, 256, 160]
    - [24, 15319.9]
  - - [256, 4096, 1, 256, 288, 288, 288, 288]
    - [45, 24103.1]
  - - [256, 4096, 1, 512, 288, 288, 544, 544]
    - [45, 30483.3]
  - - [256, 4096, 1, 1024, 288, 288, 1056, 1056]
    - [24, 36005.1]
  - - [256, 4096, 1, 2048, 288, 288, 2080, 2080]
    - [44, 38255.1]
  - - [256, 4096, 1, 4096, 288, 288, 4128, 4128]
    - [41, 37032.3]
  - - [384, 64, 1, 64, 416, 416, 384, 96]
    - [44, 250.457]
  - - [384, 64, 1, 128, 416, 416, 384, 160]
    - [29, 416.267]
  - - [384, 64, 1, 256, 416, 416, 384, 288]
    - [71, 701.702]
  - - [384, 64, 1, 512, 416, 416, 544, 544]
    - [76, 1074.55]
  - - [384, 64, 1, 1024, 416, 416, 1056, 1056]
    - [70, 1463.55]
  - - [384, 64, 1, 2048, 416, 416, 2080, 2080]
    - [70, 1812.19]
  - - [384, 64, 1, 4096, 416, 416, 4128, 4128]
    - [71, 1934.61]
  - - [384, 128, 1, 64, 416, 416, 384, 96]
    - [39, 548.516]
  - - [384, 128, 1, 128, 416, 416, 384, 160]
    - [77, 1038.19]
  - - [384, 128, 1, 256, 416, 416, 384, 288]
    - [77, 1701.77]
  - - [384, 128, 1, 512, 416, 416, 544, 544]
    - [71, 2468.45]
  - - [384, 128, 1, 1024, 416, 416, 1056, 1056]
    - [63, 3202.58]
  - - [384, 128, 1, 2048, 416, 416, 2080, 2080]
    - [62, 3768.05]
  - - [384, 128, 1, 4096, 416, 416, 4128, 4128]
    - [70, 3949.37]
  - - [384, 256, 1, 64, 416, 416, 384, 96]
    - [63, 1146.19]
  - - [384, 256, 1, 128, 416, 416, 384, 160]
    - [29, 2032.45]
  - - [384, 256, 1, 256, 416, 416, 384, 288]
    - [63, 3489.93]
  - - [384, 256, 1, 512, 416, 416, 544, 544]
    - [71, 5045.79]
  - - [384, 256, 1, 1024, 416, 416, 1056, 1056]
    - [77, 6521.33]
  - - [384, 256, 1, 2048, 416, 416, 2080, 2080]
    - [77, 7541.18]
  - - [384, 256, 1, 4096, 416, 416, 4128, 4128]
    - [76, 8141.82]
  - - [384, 512, 1, 64, 416, 416, 384, 96]
    - [77, 2310.49]
  - - [384, 512, 1, 128, 416, 416, 384, 160]
    - [74, 4098.02]
  - - [384, 512, 1, 256, 416, 416, 384, 288]
    - [61, 6701.08]
  - - [384, 512, 1, 512, 416, 416, 544, 544]
    - [29, 9589.72]
  - - [384, 512, 1, 1024, 416, 416, 1056, 1056]
    - [63, 12523.4]
  - - [384, 512, 1, 2048, 416, 416, 2080, 2080]
    - [63, 15113.5]
  - - [384, 512, 1, 4096, 416, 416, 4128, 4128]
    - [74, 15963.1]
  - - [384, 1024, 1, 64, 416, 416, 384, 96]
    - [17, 3942.63]
  - - [384, 1024, 1, 128, 416, 416, 384, 160]
    - [6, 6739.64]
  - - [384, 1024, 1, 256, 416, 416, 384, 288]
    - [2, 11123.0]
  - - [384, 1024, 1, 512, 416, 416, 544, 544]
    - [5, 16711.8]
  - - [384, 1024, 1, 1024, 416, 416, 1056, 1056]
    - [36, 21789.8]
  - - [384, 1024, 1, 2048, 416, 416, 2080, 2080]
    - [6, 25744.3]
  - - [384, 1024, 1, 4096, 416, 416, 4128, 4128]
    - [55, 28410.4]
  - - [384, 2048, 1, 64, 416, 416, 384, 96]
    - [59, 7146.34]
  - - [384, 2048, 1, 128, 416, 416, 384, 160]
    - [33, 12191.3]
  - - [384, 2048, 1, 256, 416, 416, 384, 288]
    - [45, 18925.3]
  - - [384, 2048, 1, 512, 416, 416, 544, 544]
    - [59, 26637.6]
  - - [384, 2048, 1, 1024, 416, 416, 1056, 1056]
    - [45, 31853.0]
  - - [384, 2048, 1, 2048, 416, 416, 2080, 2080]
    - [51, 33147.1]
  - - [384, 2048, 1, 4096, 416, 416, 4128, 4128]
    - [50, 36142.8]
  - - [384, 4096, 1, 64, 416, 416, 384, 96]
    - [15, 12686.0]
  - - [384, 4096, 1, 128, 416, 416, 384, 160]
    - [32, 20040.5]
  - - [384, 4096, 1, 256, 416, 416, 384, 288]
    - [6, 27488.7]
  - - [384, 4096, 1, 512, 416, 416, 544, 544]
    - [44, 33494.5]
  - - [384, 4096, 1, 1024, 416, 416, 1056, 1056]
    - [0, 36072.0]
  - - [384, 4096, 1, 2048, 416, 416, 2080, 2080]
    - [45, 38920.6]
  - - [384, 4096, 1, 4096, 416, 416, 4128, 4128]
    - [53, 37168.5]
  - - [768, 64, 1, 64, 800, 800, 768, 96]
    - [4, 519.187]
  - - [768, 64, 1, 128, 800, 800, 768, 160]
    - [1, 905.115]
  - - [768, 64, 1, 256, 800, 800, 768, 288]
    - [62, 1460.59]
  - - [768, 64, 1, 512, 800, 800, 768, 544]
    - [71, 2215.5]
  - - [768, 64, 1, 1024, 800, 800, 1056, 1056]
    - [71, 2979.09]
  - - [768, 64, 1, 2048, 800, 800, 2080, 2080]
    - [71, 3611.11]
  - - [768, 64, 1, 4096, 800, 800, 4128, 4128]
    - [77, 3905.31]
  - - [768, 128, 1, 64, 800, 800, 768, 96]
    - [57, 1119.08]
  - - [768, 128, 1, 128, 800, 800, 768, 160]
    - [10, 2030.48]
  - - [768, 128, 1, 256, 800, 800, 768, 288]
    - [77, 3460.17]
  - - [768, 128, 1, 512, 800, 800, 768, 544]
    - [77, 5031.16]
  - - [768, 128, 1, 1024, 800, 800, 1056, 1056]
    - [63, 6476.03]
  - - [768, 128, 1, 2048, 800, 800, 2080, 2080]
    - [77, 7572.38]
  - - [768, 128, 1, 4096, 800, 800, 4128, 4128]
    - [64, 7588.36]
  - - [768, 256, 1, 64, 800, 800, 768, 96]
    - [77, 2205.98]
  - - [768, 256, 1, 128, 800, 800, 768, 160]
    - [71, 3886.63]
  - - [768, 256, 1, 256, 800, 800, 768, 288]
    - [77, 6449.47]
  - - [768, 256, 1, 512, 800, 800, 768, 544]
    - [71, 9565.14]
  - - [768, 256, 1, 1024, 800, 800, 1056, 1056]
    - [77, 12743.8]
  - - [768, 256, 1, 2048, 800, 800, 2080, 2080]
    - [77, 15041.2]
  - - [768, 256, 1, 4096, 800, 800, 4128, 4128]
    - [67, 15194.5]
  - - [768, 512, 1, 64, 800, 800, 768, 96]
    - [14, 3786.61]
  - - [768, 512, 1, 128, 800, 800, 768, 160]
    - [71, 6866.55]
  - - [768, 512, 1, 256, 800, 800, 768, 288]
    - [0, 11513.6]
  - - [768, 512, 1, 512, 800, 800, 768, 544]
    - [4, 16846.0]
  - - [768, 512, 1, 1024, 800, 800, 1056, 1056]
    - [3, 21862.0]
  - - [768, 512, 1, 2048, 800, 800, 2080, 2080]
    - [0, 25894.1]
  - - [768, 512, 1, 4096, 800, 800, 4128, 4128]
    - [36, 27419.8]
  - - [768, 1024, 1, 64, 800, 800, 768, 96]
    - [34, 6767.74]
  - - [768, 1024, 1, 128, 800, 800, 768, 160]
    - [5, 11532.1]
  - - [768, 1024, 1, 256, 800, 800, 768, 288]
    - [25, 18934.1]
  - - [768, 1024, 1, 512, 800, 800, 768, 544]
    - [25, 25710.6]
  - - [768, 1024, 1, 1024, 800, 800, 1056, 1056]
    - [45, 30780.4]
  - - [768, 1024, 1, 2048, 800, 800, 2080, 2080]
    - [42, 33085.8]
  - - [768, 1024, 1, 4096, 800, 800, 4128, 4128]
    - [41, 35682.8]
  - - [768, 2048, 1, 64, 800, 800, 768, 96]
    - [22, 13259.1]
  - - [768, 2048, 1, 128, 800, 800, 768, 160]
    - [23, 20695.6]
  - - [768, 2048, 1, 256, 800, 800, 768, 288]
    - [44, 27503.7]
  - - [768, 2048, 1, 512, 800, 800, 768, 544]
    - [25, 34032.3]
  - - [768, 2048, 1, 1024, 800, 800, 1056, 1056]
    - [25, 36592.4]
  - - [768, 2048, 1, 2048, 800, 800, 2080, 2080]
    - [2, 39840.6]
  - - [768, 2048, 1, 4096, 800, 800, 4128, 4128]
    - [25, 40606.7]
  - - [768, 4096, 1, 64, 800, 800, 768, 96]
    - [44, 18355.8]
  - - [768, 4096, 1, 128, 800, 800, 768, 160]
    - [44, 26355.1]
  - - [768, 4096, 1, 256, 800, 800, 768, 288]
    - [6, 33211.3]
  - - [768, 4096, 1, 512, 800, 800, 768, 544]
    - [2, 36022.8]
  - - [768, 4096, 1, 1024, 800, 800, 1056, 1056]
    - [6, 39866.7]
  - - [768, 4096, 1, 2048, 800, 800, 2080, 2080]
    - [23, 42018.9]
  - - [768, 4096, 1, 4096, 800, 800, 4128, 4128]
    - [22, 40810.0]
  - - [1536, 64, 1, 64, 1568, 1568, 1536, 96]
    - [5, 1044.92]
  - - [1536, 64, 1, 128, 1568, 1568, 1536, 160]
    - [9, 1758.37]
  - - [1536, 64, 1, 256, 1568, 1568, 1536, 288]
    - [48, 2922.18]
  - - [1536, 64, 1, 512, 1568, 1568, 1536, 544]
    - [70, 4416.61]
  - - [1536, 64, 1, 1024, 1568, 1568, 1536, 1056]
    - [76, 5931.5]
  - - [1536, 64, 1, 2048, 1568, 1568, 2080, 2080]
    - [63, 7239.89]
  - - [1536, 64, 1, 4096, 1568, 1568, 4128, 4128]
    - [64, 7182.67]
  - - [1536, 128, 1, 64, 1568, 1568, 1536, 96]
    - [10, 2125.85]
  - - [1536, 128, 1, 128, 1568, 1568, 1536, 160]
    - [39, 3885.41]
  - - [1536, 128, 1, 256, 1568, 1568, 1536, 288]
    - [49, 6359.84]
  - - [1536, 128, 1, 512, 1568, 1568, 1536, 544]
    - [63, 9418.37]
  - - [1536, 128, 1, 1024, 1568, 1568, 1536, 1056]
    - [77, 12395.5]
  - - [1536, 128, 1, 2048, 1568, 1568, 2080, 2080]
    - [63, 15041.8]
  - - [1536, 128, 1, 4096, 1568, 1568, 4128, 4128]
    - [60, 15514.4]
  - - [1536, 256, 1, 64, 1568, 1568, 1536, 96]
    - [53, 3786.64]
  - - [1536, 256, 1, 128, 1568, 1568, 1536, 160]
    - [45, 6720.74]
  - - [1536, 256, 1, 256, 1568, 1568, 1536, 288]
    - [0, 10987.0]
  - - [1536, 256, 1, 512, 1568, 1568, 1536, 544]
    - [6, 16204.7]
  - - [1536, 256, 1, 1024, 1568, 1568, 1536, 1056]
    - [2, 21645.7]
  - - [1536, 256, 1, 2048, 1568, 1568, 2080, 2080]
    - [6, 26488.6]
  - - [1536, 256, 1, 4096, 1568, 1568, 4128, 4128]
    - [18, 24964.2]
  - - [1536, 512, 1, 64, 1568, 1568, 1536, 96]
    - [34, 6832.04]
  - - [1536, 512, 1, 128, 1568, 1568, 1536, 160]
    - [59, 11611.9]
  - - [1536, 512, 1, 256, 1568, 1568, 1536, 288]
    - [13, 19552.0]
  - - [1536, 512, 1, 512, 1568, 1568, 1536, 544]
    - [16, 26478.2]
  - - [1536, 512, 1, 1024, 1568, 1568, 1536, 1056]
    - [6, 31531.2]
  - - [1536, 512, 1, 2048, 1568, 1568, 2080, 2080]
    - [6, 33267.5]
  - - [1536, 512, 1, 4096, 1568, 1568, 4128, 4128]
    - [51, 36010.3]
  - - [1536, 1024, 1, 64, 1568, 1568, 1536, 96]
    - [52, 13257.4]
  - - [1536, 1024, 1, 128, 1568, 1568, 1536, 160]
    - [54, 20778.9]
  - - [1536, 1024, 1, 256, 1568, 1568, 1536, 288]
    - [45, 28500.4]
  - - [1536, 1024, 1, 512, 1568, 1568, 1536, 544]
    - [44, 34005.0]
  - - [1536, 1024, 1, 1024, 1568, 1568, 1536, 1056]
    - [25, 36553.3]
  - - [1536, 1024, 1, 2048, 1568, 1568, 2080, 2080]
    - [23, 40005.3]
  - - [1536, 1024, 1, 4096, 1568, 1568, 4128, 4128]
    - [25, 40401.7]
  - - [1536, 2048, 1, 64, 1568, 1568, 1536, 96]
    - [45, 17843.4]
  - - [1536, 2048, 1, 128, 1568, 1568, 1536, 160]
    - [25, 25753.4]
  - - [1536, 2048, 1, 256, 1568, 1568, 1536, 288]
    - [23, 32806.7]
  - - [1536, 2048, 1, 512, 1568, 1568, 1536, 544]
    - [23, 36010.7]
  - - [1536, 2048, 1, 1024, 1568, 1568, 1536, 1056]
    - [23, 39857.8]
  - - [1536, 2048, 1, 2048, 1568, 1568, 2080, 2080]
    - [25, 41968.8]
  - - [1536, 2048, 1, 4096, 1568, 1568, 4128, 4128]
    - [6, 41102.7]
  - - [1536, 4096, 1, 64, 1568, 1568, 1536, 96]
    - [50, 22328.7]
  - - [1536, 4096, 1, 128, 1568, 1568, 1536, 160]
    - [54, 30248.6]
  - - [1536, 4096, 1, 256, 1568, 1568, 1536, 288]
    - [23, 34817.3]
  - - [1536, 4096, 1, 512, 1568, 1568, 1536, 544]
    - [44, 39279.0]
  - - [1536, 4096, 1, 1024, 1568, 1568, 1536, 1056]
    - [25, 41810.0]
  - - [1536, 4096, 1, 2048, 1568, 1568, 2080, 2080]
    - [44, 42416.8]
  - - [1536, 4096, 1, 4096, 1568, 1568, 4128, 4128]
    - [25, 41505.7]
  - - [3072, 64, 1, 64, 3104, 3104, 3072, 96]
    - [40, 2025.58]
  - - [3072, 64, 1, 128, 3104, 3104, 3072, 160]
    - [7, 3677.08]
  - - [3072, 64, 1, 256, 3104, 3104, 3072, 288]
    - [46, 5695.56]
  - - [3072, 64, 1, 512, 3104, 3104, 3072, 544]
    - [46, 8489.8]
  - - [3072, 64, 1, 1024, 3104, 3104, 3072, 1056]
    - [7, 11028.6]
  - - [3072, 64, 1, 2048, 3104, 3104, 3072, 2080]
    - [7, 13281.9]
  - - [3072, 64, 1, 4096, 3104, 3104, 4128, 4128]
    - [37, 13892.0]
  - - [3072, 128, 1, 64, 3104, 3104, 3072, 96]
    - [25, 4517.31]
  - - [3072, 128, 1, 128, 3104, 3104, 3072, 160]
    - [75, 7468.71]
  - - [3072, 128, 1, 256, 3104, 3104, 3072, 288]
    - [27, 12489.2]
  - - [3072, 128, 1, 512, 3104, 3104, 3072, 544]
    - [47, 18088.7]
  - - [3072, 128, 1, 1024, 3104, 3104, 3072, 1056]
    - [8, 23391.1]
  - - [3072, 128, 1, 2048, 3104, 3104, 3072, 2080]
    - [27, 27574.3]
  - - [3072, 128, 1, 4096, 3104, 3104, 4128, 4128]
    - [56, 24550.9]
  - - [3072, 256, 1, 64, 3104, 3104, 3072, 96]
    - [23, 8080.21]
  - - [3072, 256, 1, 128, 3104, 3104, 3072, 160]
    - [59, 14051.3]
  - - [3072, 256, 1, 256, 3104, 3104, 3072, 288]
    - [14, 20655.2]
  - - [3072, 256, 1, 512, 3104, 3104, 3072, 544]
    - [23, 27078.2]
  - - [3072, 256, 1, 1024, 3104, 3104, 3072, 1056]
    - [44, 31407.0]
  - - [3072, 256, 1, 2048, 3104, 3104, 3072, 2080]
    - [51, 33095.3]
  - - [3072, 256, 1, 4096, 3104, 3104, 4128, 4128]
    - [20, 36830.0]
  - - [3072, 512, 1, 64, 3104, 3104, 3072, 96]
    - [34, 12782.6]
  - - [3072, 512, 1, 128, 3104, 3104, 3072, 160]
    - [45, 20817.6]
  - - [3072, 512, 1, 256, 3104, 3104, 3072, 288]
    - [45, 28371.8]
  - - [3072, 512, 1, 512, 3104, 3104, 3072, 544]
    - [25, 34249.4]
  - - [3072, 512, 1, 1024, 3104, 3104, 3072, 1056]
    - [44, 36287.4]
  - - [3072, 512, 1, 2048, 3104, 3104, 3072, 2080]
    - [44, 39622.0]
  - - [3072, 512, 1, 4096, 3104, 3104, 4128, 4128]
    - [0, 38846.3]
  - - [3072, 1024, 1, 64, 3104, 3104, 3072, 96]
    - [51, 18282.5]
  - - [3072, 1024, 1, 128, 3104, 3104, 3072, 160]
    - [44, 26310.4]
  - - [3072, 1024, 1, 256, 3104, 3104, 3072, 288]
    - [25, 33269.0]
  - - [3072, 1024, 1, 512, 3104, 3104, 3072, 544]
    - [45, 35983.3]
  - - [3072, 1024, 1, 1024, 3104, 3104, 3072, 1056]
    - [23, 39745.2]
  - - [3072, 1024, 1, 2048, 3104, 3104, 3072, 2080]
    - [25, 41865.1]
  - - [3072, 1024, 1, 4096, 3104, 3104, 4128, 4128]
    - [59, 40445.5]
  - - [3072, 2048, 1, 64, 3104, 3104, 3072, 96]
    - [51, 22383.3]
  - - [3072, 2048, 1, 128, 3104, 3104, 3072, 160]
    - [25, 30054.4]
  - - [3072, 2048, 1, 256, 3104, 3104, 3072, 288]
    - [23, 34728.7]
  - - [3072, 2048, 1, 512, 3104, 3104, 3072, 544]
    - [45, 39256.0]
  - - [3072, 2048, 1, 1024, 3104, 3104, 3072, 1056]
    - [44, 41769.3]
  - - [3072, 2048, 1, 2048, 3104, 3104, 3072, 2080]
    - [45, 42628.2]
  - - [3072, 2048, 1, 4096, 3104, 3104, 4128, 4128]
    - [24, 41025.3]
  - - [3072, 4096, 1, 64, 3104, 3104, 3072, 96]
    - [50, 25967.6]
  - - [3072, 4096, 1, 128, 3104, 3104, 3072, 160]
    - [44, 31698.8]
  - - [3072, 4096, 1, 256, 3104, 3104, 3072, 288]
    - [25, 37702.1]
  - - [3072, 4096, 1, 512, 3104, 3104, 3072, 544]
    - [23, 40959.6]
  - - [3072, 4096, 1, 1024, 3104, 3104, 3072, 1056]
    - [54, 42079.5]
  - - [3072, 4096, 1, 2048, 3104, 3104, 3072, 2080]
    - [44, 42717.8]
  - - [3072, 4096, 1, 4096, 3104, 3104, 4128, 4128]
    - [21, 40209.8]
  - - [4096, 64, 1, 64, 4128, 4128, 4096, 96]
    - [9, 2530.88]
  - - [4096, 64, 1, 128, 4128, 4128, 4096, 160]
    - [38, 4329.6]
  - - [4096, 64, 1, 256, 4128, 4128, 4096, 288]
    - [48, 7176.65]
  - - [4096, 64, 1, 512, 4128, 4128, 4096, 544]
    - [26, 10639.5]
  - - [4096, 64, 1, 1024, 4128, 4128, 4096, 1056]
    - [57, 14002.9]
  - - [4096, 64, 1, 2048, 4128, 4128, 4096, 2080]
    - [7, 17752.5]
  - - [4096, 64, 1, 4096, 4128, 4128, 4128, 4128]
    - [57, 17227.3]
  - - [4096, 128, 1, 64, 4128, 4128, 4096, 96]
    - [44, 6028.46]
  - - [4096, 128, 1, 128, 4128, 4128, 4096, 160]
    - [6, 10596.7]
  - - [4096, 128, 1, 256, 4128, 4128, 4096, 288]
    - [17, 17060.9]
  - - [4096, 128, 1, 512, 4128, 4128, 4096, 544]
    - [6, 24385.5]
  - - [4096, 128, 1, 1024, 4128, 4128, 4096, 1056]
    - [27, 30782.2]
  - - [4096, 128, 1, 2048, 4128, 4128, 4096, 2080]
    - [7, 35920.8]
  - - [4096, 128, 1, 4096, 4128, 4128, 4128, 4128]
    - [48, 33528.8]
  - - [4096, 256, 1, 64, 4128, 4128, 4096, 96]
    - [45, 9961.24]
  - - [4096, 256, 1, 128, 4128, 4128, 4096, 160]
    - [30, 16153.3]
  - - [4096, 256, 1, 256, 4128, 4128, 4096, 288]
    - [44, 23540.8]
  - - [4096, 256, 1, 512, 4128, 4128, 4096, 544]
    - [53, 30528.4]
  - - [4096, 256, 1, 1024, 4128, 4128, 4096, 1056]
    - [45, 36224.9]
  - - [4096, 256, 1, 2048, 4128, 4128, 4096, 2080]
    - [25, 37845.9]
  - - [4096, 256, 1, 4096, 4128, 4128, 4128, 4128]
    - [20, 38296.0]
  - - [4096, 512, 1, 64, 4128, 4128, 4096, 96]
    - [34, 14835.6]
  - - [4096, 512, 1, 128, 4128, 4128, 4096, 160]
    - [44, 22448.3]
  - - [4096, 512, 1, 256, 4128, 4128, 4096, 288]
    - [23, 29799.7]
  - - [4096, 512, 1, 512, 4128, 4128, 4096, 544]
    - [53, 35931.6]
  - - [4096, 512, 1, 1024, 4128, 4128, 4096, 1056]
    - [23, 37623.1]
  - - [4096, 512, 1, 2048, 4128, 4128, 4096, 2080]
    - [25, 40661.7]
  - - [4096, 512, 1, 4096, 4128, 4128, 4128, 4128]
    - [59, 39759.2]
  - - [4096, 1024, 1, 64, 4128, 4128, 4096, 96]
    - [50, 20171.0]
  - - [4096, 1024, 1, 128, 4128, 4128, 4096, 160]
    - [45, 28238.6]
  - - [4096, 1024, 1, 256, 4128, 4128, 4096, 288]
    - [44, 34688.3]
  - - [4096, 1024, 1, 512, 4128, 4128, 4096, 544]
    - [25, 37404.8]
  - - [4096, 1024, 1, 1024, 4128, 4128, 4096, 1056]
    - [23, 40765.5]
  - - [4096, 1024, 1, 2048, 4128, 4128, 4096, 2080]
    - [45, 42570.8]
  - - [4096, 1024, 1, 4096, 4128, 4128, 4128, 4128]
    - [43, 41104.1]
  - - [4096, 2048, 1, 64, 4128, 4128, 4096, 96]
    - [31, 23998.5]
  - - [4096, 2048, 1, 128, 4128, 4128, 4096, 160]
    - [34, 31414.4]
  - - [4096, 2048, 1, 256, 4128, 4128, 4096, 288]
    - [25, 36192.6]
  - - [4096, 2048, 1, 512, 4128, 4128, 4096, 544]
    - [45, 39979.6]
  - - [4096, 2048, 1, 1024, 4128, 4128, 4096, 1056]
    - [44, 42379.5]
  - - [4096, 2048, 1, 2048, 4128, 4128, 4096, 2080]
    - [25, 42863.8]
  - - [4096, 2048, 1, 4096, 4128, 4128, 4128, 4128]
    - [21, 41070.2]
  - - [4096, 4096, 1, 64, 4128, 4128, 4096, 96]
    - [45, 23824.4]
  - - [4096, 4096, 1, 128, 4128, 4128, 4096, 160]
    - [53, 30552.7]
  - - [4096, 4096, 1, 256, 4128, 4128, 4096, 288]
    - [14, 35533.5]
  - - [4096, 4096, 1, 512, 4128, 4128, 4096, 544]
    - [25, 40993.9]
  - - [4096, 4096, 1, 1024, 4128, 4128, 4096, 1056]
    - [25, 42468.8]
  - - [4096, 4096, 1, 2048, 4128, 4128, 4096, 2080]
    - [25, 42915.8]
  - - [4096, 4096, 1, 4096, 4128, 4128, 4128, 4128]
    - [30, 37918.4]
- null
- null
- DeviceEfficiency
