library/src/blas3/Tensile/Logic/asm_full/navi33/navi33_Cijk_Alik_Bjlk_HHS_BH.yaml
- {MinimumRequiredVersion: 4.35.0}
- navi33
- gfx1102
- [Device 73f0]
    SolutionIndex: 0
    SolutionNameMin: Cijk_Alik_Bjlk_HHS_BH_MT128x128x16_MI16x16x16x1_SN_1LDSB0_EPS0_GRVW4_PLR0_SIA1_SVW4_VW4_WGM4
    SolutionIndex: 1
    SolutionNameMin: Cijk_Alik_Bjlk_HHS_BH_MT128x128x16_MI16x16x16x1_SN_1LDSB0_EPS0_GRVW8_PLR0_SIA1_SVW2_VW2_WGM4
    SolutionIndex: 2
    SolutionNameMin: Cijk_Alik_Bjlk_HHS_BH_MT128x128x16_MI16x16x16x1_SN_1LDSB0_EPS0_GRVW8_PLR0_SIA1_SVW4_VW4_WGM4
    SolutionIndex: 3
    SolutionNameMin: Cijk_Alik_Bjlk_HHS_BH_MT128x128x16_MI16x16x16x1_SN_1LDSB0_EPS1_GRVW4_PLR0_SIA1_SVW4_VW4_WGM4
    SolutionIndex: 4
    SolutionNameMin: Cijk_Alik_Bjlk_HHS_BH_MT128x128x16_MI16x16x16x1_SN_1LDSB0_EPS1_GRVW8_PLR0_SIA1_SVW4_VW4_WGM4
    SolutionIndex: 5
    SolutionNameMin: Cijk_Alik_Bjlk_HHS_BH_MT128x128x16_MI16x16x16x1_SN_1LDSB0_EPS1_GRVW8_PLR1_SIA1_SVW4_VW4_WGM4
    SolutionIndex: 6
    SolutionNameMin: Cijk_Alik_Bjlk_HHS_BH_MT128x128x16_MI16x16x16x1_SN_1LDSB1_EPS1_GRVW4_PLR1_SIA2_SVW2_VW2_WGM4
    SolutionIndex: 7
    SolutionNameMin: Cijk_Alik_Bjlk_HHS_BH_MT128x128x16_MI16x16x16x1_SN_1LDSB1_EPS1_GRVW4_PLR1_SIA2_SVW4_VW4_WGM4
    SolutionIndex: 8
    SolutionNameMin: Cijk_Alik_Bjlk_HHS_BH_MT128x128x16_MI16x16x16x1_SN_1LDSB1_EPS1_GRVW8_PLR1_SIA2_SVW2_VW2_WGM4
    SolutionIndex: 9
    SolutionNameMin: Cijk_Alik_Bjlk_HHS_BH_MT128x128x16_MI16x16x16x1_SN_1LDSB1_EPS1_GRVW8_PLR1_SIA2_SVW4_VW4_WGM4
    SolutionIndex: 10
    SolutionNameMin: Cijk_Alik_Bjlk_HHS_BH_MT128x128x16_MI16x16x16x1_SN_1LDSB0_EPS0_GRVW8_PLR0_SIA3_SVW4_VW4_WGM4
    SolutionIndex: 11
    SolutionNameMin: Cijk_Alik_Bjlk_HHS_BH_MT128x128x16_MI16x16x16x1_SN_1LDSB0_EPS0_GRVW8_PLR1_SIA3_SVW4_VW4_WGM4
    SolutionIndex: 12
    SolutionNameMin: Cijk_Alik_Bjlk_HHS_BH_MT128x128x16_MI16x16x16x1_SN_1LDSB0_EPS0_GRVW8_PLR1_SIA1_SVW4_VW4_WGM8
    SolutionIndex: 13
    SolutionNameMin: Cijk_Alik_Bjlk_HHS_BH_MT128x128x16_MI16x16x16x1_SN_1LDSB0_EPS1_GRVW8_PLR0_SIA1_SVW4_VW4_WGM8
    SolutionIndex: 14
    SolutionNameMin: Cijk_Alik_Bjlk_HHS_BH_MT128x128x16_MI16x16x16x1_SN_1LDSB0_EPS1_GRVW8_PLR1_SIA1_SVW4_VW4_WGM8
    SolutionIndex: 15
    SolutionNameMin: Cijk_Alik_Bjlk_HHS_BH_MT128x128x16_MI16x16x16x1_SN_1LDSB1_EPS1_GRVW4_PLR1_SIA2_SVW2_VW2_WGM8
    SolutionIndex: 16
    SolutionNameMin: Cijk_Alik_Bjlk_HHS_BH_MT128x128x16_MI16x16x16x1_SN_1LDSB1_EPS1_GRVW4_PLR1_SIA2_SVW4_VW4_WGM8
    SolutionIndex: 17
    SolutionNameMin: Cijk_Alik_Bjlk_HHS_BH_MT128x128x16_MI16x16x16x1_SN_1LDSB1_EPS1_GRVW8_PLR1_SIA2_SVW2_VW2_WGM8
    SolutionIndex: 18
    SolutionNameMin: Cijk_Alik_Bjlk_HHS_BH_MT128x128x16_MI16x16x16x1_SN_1LDSB1_EPS1_GRVW8_PLR1_SIA2_SVW4_VW4_WGM8
    SolutionIndex: 19
    SolutionNameMin: Cijk_Alik_Bjlk_HHS_BH_MT128x128x16_MI16x16x16x1_SN_1LDSB0_EPS0_GRVW8_PLR0_SIA3_SVW4_VW4_WGM8
    SolutionIndex: 20
    SolutionNameMin: Cijk_Alik_Bjlk_HHS_BH_MT128x128x16_MI16x16x16x1_SN_1LDSB1_EPS0_GRVW4_PLR0_SIA3_SVW4_VW4_WGM4
    SolutionIndex: 21
    SolutionNameMin: Cijk_Alik_Bjlk_HHS_BH_MT128x128x16_MI16x16x16x1_SN_1LDSB1_EPS0_GRVW8_PLR0_SIA3_SVW4_VW4_WGM4
    SolutionIndex: 22
    SolutionNameMin: Cijk_Alik_Bjlk_HHS_BH_MT128x128x16_MI16x16x16x1_SN_1LDSB1_EPS0_GRVW4_PLR1_SIA3_SVW2_VW2_WGM4
    SolutionIndex: 23
    SolutionNameMin: Cijk_Alik_Bjlk_HHS_BH_MT128x128x16_MI16x16x16x1_SN_1LDSB1_EPS0_GRVW4_PLR1_SIA3_SVW4_VW4_WGM4
    SolutionIndex: 24
    SolutionNameMin: Cijk_Alik_Bjlk_HHS_BH_MT128x128x16_MI16x16x16x1_SN_1LDSB1_EPS0_GRVW8_PLR1_SIA3_SVW2_VW2_WGM4
    SolutionIndex: 25
    SolutionNameMin: Cijk_Alik_Bjlk_HHS_BH_MT128x128x16_MI16x16x16x1_SN_1LDSB1_EPS0_GRVW8_PLR1_SIA3_SVW4_VW4_WGM4
    SolutionIndex: 26
    SolutionNameMin: Cijk_Alik_Bjlk_HHS_BH_MT128x128x16_MI16x16x16x1_SN_1LDSB1_EPS1_GRVW4_PLR0_SIA3_SVW4_VW4_WGM4
    SolutionIndex: 27
    SolutionNameMin: Cijk_Alik_Bjlk_HHS_BH_MT128x128x16_MI16x16x16x1_SN_1LDSB1_EPS1_GRVW8_PLR0_SIA3_SVW2_VW2_WGM4
    SolutionIndex: 28
    SolutionNameMin: Cijk_Alik_Bjlk_HHS_BH_MT128x128x16_MI16x16x16x1_SN_1LDSB1_EPS1_GRVW8_PLR0_SIA3_SVW4_VW4_WGM4
    SolutionIndex: 29
    SolutionNameMin: Cijk_Alik_Bjlk_HHS_BH_MT128x128x16_MI16x16x16x1_SN_1LDSB1_EPS1_GRVW4_PLR1_SIA3_SVW2_VW2_WGM4
    SolutionIndex: 30
    SolutionNameMin: Cijk_Alik_Bjlk_HHS_BH_MT128x128x16_MI16x16x16x1_SN_1LDSB1_EPS1_GRVW4_PLR1_SIA3_SVW4_VW4_WGM4
    SolutionIndex: 31
    SolutionNameMin: Cijk_Alik_Bjlk_HHS_BH_MT128x128x16_MI16x16x16x1_SN_1LDSB1_EPS1_GRVW8_PLR1_SIA3_SVW2_VW2_WGM4
    SolutionIndex: 32
    SolutionNameMin: Cijk_Alik_Bjlk_HHS_BH_MT128x128x16_MI16x16x16x1_SN_1LDSB1_EPS1_GRVW8_PLR1_SIA3_SVW4_VW4_WGM4
    SolutionIndex: 33
    SolutionNameMin: Cijk_Alik_Bjlk_HHS_BH_MT128x128x16_MI16x16x16x1_SN_1LDSB1_EPS0_GRVW8_PLR0_SIA3_SVW2_VW2_WGM8
    SolutionIndex: 34
    SolutionNameMin: Cijk_Alik_Bjlk_HHS_BH_MT128x128x16_MI16x16x16x1_SN_1LDSB1_EPS0_GRVW8_PLR0_SIA3_SVW4_VW4_WGM8
    SolutionIndex: 35
    SolutionNameMin: Cijk_Alik_Bjlk_HHS_BH_MT128x128x16_MI16x16x16x1_SN_1LDSB1_EPS0_GRVW4_PLR1_SIA3_SVW4_VW4_WGM8
    SolutionIndex: 36
    SolutionNameMin: Cijk_Alik_Bjlk_HHS_BH_MT128x128x16_MI16x16x16x1_SN_1LDSB1_EPS0_GRVW8_PLR1_SIA3_SVW2_VW2_WGM8
    SolutionIndex: 37
    SolutionNameMin: Cijk_Alik_Bjlk_HHS_BH_MT128x128x16_MI16x16x16x1_SN_1LDSB1_EPS0_GRVW8_PLR1_SIA3_SVW4_VW4_WGM8
    SolutionIndex: 38
    SolutionNameMin: Cijk_Alik_Bjlk_HHS_BH_MT128x128x16_MI16x16x16x1_SN_1LDSB1_EPS1_GRVW4_PLR0_SIA3_SVW2_VW2_WGM8
    SolutionIndex: 39
    SolutionNameMin: Cijk_Alik_Bjlk_HHS_BH_MT128x128x16_MI16x16x16x1_SN_1LDSB1_EPS1_GRVW4_PLR0_SIA3_SVW4_VW4_WGM8
    SolutionIndex: 40
    SolutionNameMin: Cijk_Alik_Bjlk_HHS_BH_MT128x128x16_MI16x16x16x1_SN_1LDSB1_EPS1_GRVW8_PLR0_SIA3_SVW2_VW2_WGM8
    SolutionIndex: 41
    SolutionNameMin: Cijk_Alik_Bjlk_HHS_BH_MT128x128x16_MI16x16x16x1_SN_1LDSB1_EPS1_GRVW8_PLR0_SIA3_SVW4_VW4_WGM8
    SolutionIndex: 42
    SolutionNameMin: Cijk_Alik_Bjlk_HHS_BH_MT128x128x16_MI16x16x16x1_SN_1LDSB1_EPS1_GRVW4_PLR1_SIA3_SVW2_VW2_WGM8
    SolutionIndex: 43
    SolutionNameMin: Cijk_Alik_Bjlk_HHS_BH_MT128x128x16_MI16x16x16x1_SN_1LDSB1_EPS1_GRVW4_PLR1_SIA3_SVW4_VW4_WGM8
    SolutionIndex: 44
    SolutionNameMin: Cijk_Alik_Bjlk_HHS_BH_MT128x128x16_MI16x16x16x1_SN_1LDSB1_EPS1_GRVW8_PLR1_SIA3_SVW4_VW4_WGM8
    SolutionIndex: 45
    SolutionNameMin: Cijk_Alik_Bjlk_HHS_BH_MT128x128x32_MI16x16x16x1_SN_1LDSB0_EPS0_GRVW4_PLR0_SIA1_SVW2_VW2_WGM4
    SolutionIndex: 46
    SolutionNameMin: Cijk_Alik_Bjlk_HHS_BH_MT128x128x32_MI16x16x16x1_SN_1LDSB0_EPS0_GRVW8_PLR0_SIA1_SVW2_VW2_WGM4
    SolutionIndex: 47
    SolutionNameMin: Cijk_Alik_Bjlk_HHS_BH_MT128x128x32_MI16x16x16x1_SN_1LDSB0_EPS0_GRVW8_PLR0_SIA1_SVW4_VW4_WGM4
    SolutionIndex: 48
    SolutionNameMin: Cijk_Alik_Bjlk_HHS_BH_MT128x128x32_MI16x16x16x1_SN_1LDSB0_EPS1_GRVW4_PLR0_SIA1_SVW2_VW2_WGM4
    SolutionIndex: 49
    SolutionNameMin: Cijk_Alik_Bjlk_HHS_BH_MT128x128x32_MI16x16x16x1_SN_1LDSB0_EPS1_GRVW8_PLR0_SIA1_SVW2_VW2_WGM4
    SolutionIndex: 50
    SolutionNameMin: Cijk_Alik_Bjlk_HHS_BH_MT128x128x32_MI16x16x16x1_SN_1LDSB0_EPS0_GRVW4_PLR0_SIA1_SVW2_VW2_WGM8
    SolutionIndex: 51
    SolutionNameMin: Cijk_Alik_Bjlk_HHS_BH_MT128x128x32_MI16x16x16x1_SN_1LDSB0_EPS0_GRVW8_PLR0_SIA1_SVW2_VW2_WGM8
    SolutionIndex: 52
    SolutionNameMin: Cijk_Alik_Bjlk_HHS_BH_MT128x128x32_MI16x16x16x1_SN_1LDSB0_EPS0_GRVW8_PLR0_SIA1_SVW4_VW4_WGM8
    SolutionIndex: 53
    SolutionNameMin: Cijk_Alik_Bjlk_HHS_BH_MT128x128x32_MI16x16x16x1_SN_1LDSB0_EPS1_GRVW4_PLR0_SIA1_SVW2_VW2_WGM8
    SolutionIndex: 54
    SolutionNameMin: Cijk_Alik_Bjlk_HHS_BH_MT128x128x32_MI16x16x16x1_SN_1LDSB0_EPS1_GRVW8_PLR0_SIA1_SVW2_VW2_WGM8
    SolutionIndex: 55
    SolutionNameMin: Cijk_Alik_Bjlk_HHS_BH_MT128x128x32_MI16x16x16x1_SN_1LDSB0_EPS1_GRVW8_PLR0_SIA1_SVW4_VW4_WGM8
    SolutionIndex: 56
    SolutionNameMin: Cijk_Alik_Bjlk_HHS_BH_MT128x128x32_MI16x16x16x1_SN_1LDSB1_EPS0_GRVW8_PLR0_SIA3_SVW2_VW2_WGM4
    SolutionIndex: 57
    SolutionNameMin: Cijk_Alik_Bjlk_HHS_BH_MT128x128x32_MI16x16x16x1_SN_1LDSB1_EPS1_GRVW4_PLR0_SIA3_SVW2_VW2_WGM4
    SolutionIndex: 58
    SolutionNameMin: Cijk_Alik_Bjlk_HHS_BH_MT128x128x32_MI16x16x16x1_SN_1LDSB1_EPS1_GRVW8_PLR0_SIA3_SVW2_VW2_WGM4
    SolutionIndex: 59
    SolutionNameMin: Cijk_Alik_Bjlk_HHS_BH_MT128x128x32_MI16x16x16x1_SN_1LDSB1_EPS0_GRVW8_PLR0_SIA3_SVW2_VW2_WGM8
    SolutionIndex: 60
    SolutionNameMin: Cijk_Alik_Bjlk_HHS_BH_MT128x128x32_MI16x16x16x1_SN_1LDSB1_EPS1_GRVW8_PLR0_SIA3_SVW2_VW2_WGM8
- - - [64, 64, 1, 64, 96, 96, 96, 96]
    - [4, 35.3724]
  - - [64, 64, 1, 128, 96, 96, 160, 160]
    - [19, 59.1948]
  - - [64, 64, 1, 256, 96, 96, 288, 288]
    - [46, 102.141]
  - - [64, 64, 1, 512, 96, 96, 544, 544]
    - [9, 158.587]
  - - [64, 64, 1, 1024, 96, 96, 1056, 1056]
    - [49, 223.864]
  - - [64, 64, 1, 2048, 96, 96, 2080, 2080]
    - [54, 281.195]
  - - [64, 64, 1, 4096, 96, 96, 4128, 4128]
    - [46, 309.224]
  - - [64, 128, 1, 64, 96, 96, 96, 128]
    - [2, 63.0231]
  - - [64, 128, 1, 128, 96, 96, 160, 160]
    - [19, 114.237]
  - - [64, 128, 1, 256, 96, 96, 288, 288]
    - [46, 197.807]
  - - [64, 128, 1, 512, 96, 96, 544, 544]
    - [51, 312.682]
  - - [64, 128, 1, 1024, 96, 96, 1056, 1056]
    - [54, 440.624]
  - - [64, 128, 1, 2048, 96, 96, 2080, 2080]
    - [49, 557.161]
  - - [64, 128, 1, 4096, 96, 96, 4128, 4128]
    - [54, 619.337]
  - - [64, 256, 1, 64, 96, 96, 96, 256]
    - [9, 140.09]
  - - [64, 256, 1, 128, 96, 96, 160, 256]
    - [46, 254.695]
  - - [64, 256, 1, 256, 96, 96, 288, 288]
    - [18, 434.285]
  - - [64, 256, 1, 512, 96, 96, 544, 544]
    - [45, 697.773]
  - - [64, 256, 1, 1024, 96, 96, 1056, 1056]
    - [46, 946.208]
  - - [64, 256, 1, 2048, 96, 96, 2080, 2080]
    - [49, 1151.45]
  - - [64, 256, 1, 4096, 96, 96, 4128, 4128]
    - [54, 1270.91]
  - - [64, 512, 1, 64, 96, 96, 96, 512]
    - [47, 299.166]
  - - [64, 512, 1, 128, 96, 96, 160, 512]
    - [11, 568.105]
  - - [64, 512, 1, 256, 96, 96, 288, 512]
    - [46, 952.169]
  - - [64, 512, 1, 512, 96, 96, 544, 544]
    - [46, 1458.89]
  - - [64, 512, 1, 1024, 96, 96, 1056, 1056]
    - [54, 1940.35]
  - - [64, 512, 1, 2048, 96, 96, 2080, 2080]
    - [46, 2353.13]
  - - [64, 512, 1, 4096, 96, 96, 4128, 4128]
    - [54, 2564.69]
  - - [64, 1024, 1, 64, 96, 96, 96, 1024]
    - [46, 617.445]
  - - [64, 1024, 1, 128, 96, 96, 160, 1024]
    - [9, 1113.58]
  - - [64, 1024, 1, 256, 96, 96, 288, 1024]
    - [46, 1884.66]
  - - [64, 1024, 1, 512, 96, 96, 544, 1024]
    - [50, 2876.02]
  - - [64, 1024, 1, 1024, 96, 96, 1056, 1056]
    - [49, 3952.46]
  - - [64, 1024, 1, 2048, 96, 96, 2080, 2080]
    - [48, 4816.71]
  - - [64, 1024, 1, 4096, 96, 96, 4128, 4128]
    - [46, 5224.21]
  - - [64, 2048, 1, 64, 96, 96, 96, 2048]
    - [18, 1235.8]
  - - [64, 2048, 1, 128, 96, 96, 160, 2048]
    - [18, 2225.69]
  - - [64, 2048, 1, 256, 96, 96, 288, 2048]
    - [53, 3744.09]
  - - [64, 2048, 1, 512, 96, 96, 544, 2048]
    - [53, 5785.25]
  - - [64, 2048, 1, 1024, 96, 96, 1056, 2048]
    - [53, 7990.58]
  - - [64, 2048, 1, 2048, 96, 96, 2080, 2080]
    - [54, 10169.9]
  - - [64, 2048, 1, 4096, 96, 96, 4128, 4128]
    - [48, 10509.8]
  - - [64, 4096, 1, 64, 96, 96, 96, 4096]
    - [8, 2249.57]
  - - [64, 4096, 1, 128, 96, 96, 160, 4096]
    - [8, 4087.02]
  - - [64, 4096, 1, 256, 96, 96, 288, 4096]
    - [18, 6900.65]
  - - [64, 4096, 1, 512, 96, 96, 544, 4096]
    - [6, 10499.7]
  - - [64, 4096, 1, 1024, 96, 96, 1056, 4096]
    - [16, 14324.2]
  - - [64, 4096, 1, 2048, 96, 96, 2080, 4096]
    - [9, 17619.1]
  - - [64, 4096, 1, 4096, 96, 96, 4128, 4128]
    - [53, 14861.1]
  - - [128, 64, 1, 64, 160, 160, 96, 96]
    - [44, 73.5843]
  - - [128, 64, 1, 128, 160, 160, 160, 160]
    - [2, 127.751]
  - - [128, 64, 1, 256, 160, 160, 288, 288]
    - [18, 203.173]
  - - [128, 64, 1, 512, 160, 160, 544, 544]
    - [7, 315.884]
  - - [128, 64, 1, 1024, 160, 160, 1056, 1056]
    - [51, 440.186]
  - - [128, 64, 1, 2048, 160, 160, 2080, 2080]
    - [54, 553.247]
  - - [128, 64, 1, 4096, 160, 160, 4128, 4128]
    - [54, 619.863]
  - - [128, 128, 1, 64, 160, 160, 96, 128]
    - [37, 169.207]
  - - [128, 128, 1, 128, 160, 160, 160, 160]
    - [37, 295.041]
  - - [128, 128, 1, 256, 160, 160, 288, 288]
    - [18, 487.993]
  - - [128, 128, 1, 512, 160, 160, 544, 544]
    - [9, 734.361]
  - - [128, 128, 1, 1024, 160, 160, 1056, 1056]
    - [51, 978.208]
  - - [128, 128, 1, 2048, 160, 160, 2080, 2080]
    - [51, 1184.71]
  - - [128, 128, 1, 4096, 160, 160, 4128, 4128]
    - [46, 1277.36]
  - - [128, 256, 1, 64, 160, 160, 96, 256]
    - [34, 356.962]
  - - [128, 256, 1, 128, 160, 160, 160, 256]
    - [16, 627.61]
  - - [128, 256, 1, 256, 160, 160, 288, 288]
    - [9, 1035.25]
  - - [128, 256, 1, 512, 160, 160, 544, 544]
    - [18, 1535.81]
  - - [128, 256, 1, 1024, 160, 160, 1056, 1056]
    - [49, 2030.77]
  - - [128, 256, 1, 2048, 160, 160, 2080, 2080]
    - [49, 2461.81]
  - - [128, 256, 1, 4096, 160, 160, 4128, 4128]
    - [49, 2584.59]
  - - [128, 512, 1, 64, 160, 160, 96, 512]
    - [11, 739.867]
  - - [128, 512, 1, 128, 160, 160, 160, 512]
    - [18, 1309.9]
  - - [128, 512, 1, 256, 160, 160, 288, 512]
    - [9, 2145.15]
  - - [128, 512, 1, 512, 160, 160, 544, 544]
    - [46, 3157.48]
  - - [128, 512, 1, 1024, 160, 160, 1056, 1056]
    - [56, 4113.59]
  - - [128, 512, 1, 2048, 160, 160, 2080, 2080]
    - [51, 4952.51]
  - - [128, 512, 1, 4096, 160, 160, 4128, 4128]
    - [54, 5203.55]
  - - [128, 1024, 1, 64, 160, 160, 96, 1024]
    - [18, 1494.76]
  - - [128, 1024, 1, 128, 160, 160, 160, 1024]
    - [16, 2639.17]
  - - [128, 1024, 1, 256, 160, 160, 288, 1024]
    - [18, 4302.97]
  - - [128, 1024, 1, 512, 160, 160, 544, 1024]
    - [59, 6406.57]
  - - [128, 1024, 1, 1024, 160, 160, 1056, 1056]
    - [46, 8431.3]
  - - [128, 1024, 1, 2048, 160, 160, 2080, 2080]
    - [46, 9816.64]
  - - [128, 1024, 1, 4096, 160, 160, 4128, 4128]
    - [46, 10526.7]
  - - [128, 2048, 1, 64, 160, 160, 96, 2048]
    - [18, 2796.67]
  - - [128, 2048, 1, 128, 160, 160, 160, 2048]
    - [18, 4985.8]
  - - [128, 2048, 1, 256, 160, 160, 288, 2048]
    - [18, 8513.11]
  - - [128, 2048, 1, 512, 160, 160, 544, 2048]
    - [46, 12392.0]
  - - [128, 2048, 1, 1024, 160, 160, 1056, 2048]
    - [51, 16474.5]
  - - [128, 2048, 1, 2048, 160, 160, 2080, 2080]
    - [48, 19672.1]
  - - [128, 2048, 1, 4096, 160, 160, 4128, 4128]
    - [53, 20650.1]
  - - [128, 4096, 1, 64, 160, 160, 96, 4096]
    - [15, 5112.67]
  - - [128, 4096, 1, 128, 160, 160, 160, 4096]
    - [18, 9081.04]
  - - [128, 4096, 1, 256, 160, 160, 288, 4096]
    - [8, 14966.3]
  - - [128, 4096, 1, 512, 160, 160, 544, 4096]
    - [8, 22407.0]
  - - [128, 4096, 1, 1024, 160, 160, 1056, 4096]
    - [15, 29438.6]
  - - [128, 4096, 1, 2048, 160, 160, 2080, 4096]
    - [17, 35692.6]
  - - [128, 4096, 1, 4096, 160, 160, 4128, 4128]
    - [18, 33090.7]
  - - [256, 64, 1, 64, 288, 288, 96, 96]
    - [55, 158.803]
  - - [256, 64, 1, 128, 288, 288, 160, 160]
    - [18, 280.894]
  - - [256, 64, 1, 256, 288, 288, 288, 288]
    - [9, 447.346]
  - - [256, 64, 1, 512, 288, 288, 544, 544]
    - [50, 687.704]
  - - [256, 64, 1, 1024, 288, 288, 1056, 1056]
    - [54, 927.328]
  - - [256, 64, 1, 2048, 288, 288, 2080, 2080]
    - [54, 1154.54]
  - - [256, 64, 1, 4096, 288, 288, 4128, 4128]
    - [54, 1250.8]
  - - [256, 128, 1, 64, 288, 288, 96, 128]
    - [11, 345.779]
  - - [256, 128, 1, 128, 288, 288, 160, 160]
    - [9, 629.397]
  - - [256, 128, 1, 256, 288, 288, 288, 288]
    - [9, 1039.09]
  - - [256, 128, 1, 512, 288, 288, 544, 544]
    - [51, 1534.55]
  - - [256, 128, 1, 1024, 288, 288, 1056, 1056]
    - [51, 2066.04]
  - - [256, 128, 1, 2048, 288, 288, 2080, 2080]
    - [54, 2430.25]
  - - [256, 128, 1, 4096, 288, 288, 4128, 4128]
    - [49, 2579.62]
  - - [256, 256, 1, 64, 288, 288, 96, 256]
    - [34, 741.174]
  - - [256, 256, 1, 128, 288, 288, 160, 256]
    - [9, 1316.89]
  - - [256, 256, 1, 256, 288, 288, 288, 288]
    - [9, 2130.98]
  - - [256, 256, 1, 512, 288, 288, 544, 544]
    - [51, 3239.47]
  - - [256, 256, 1, 1024, 288, 288, 1056, 1056]
    - [46, 4199.03]
  - - [256, 256, 1, 2048, 288, 288, 2080, 2080]
    - [51, 4865.96]
  - - [256, 256, 1, 4096, 288, 288, 4128, 4128]
    - [54, 5175.46]
  - - [256, 512, 1, 64, 288, 288, 96, 512]
    - [41, 1496.9]
  - - [256, 512, 1, 128, 288, 288, 160, 512]
    - [52, 2752.62]
  - - [256, 512, 1, 256, 288, 288, 288, 512]
    - [18, 4514.86]
  - - [256, 512, 1, 512, 288, 288, 544, 544]
    - [54, 6514.79]
  - - [256, 512, 1, 1024, 288, 288, 1056, 1056]
    - [18, 8293.24]
  - - [256, 512, 1, 2048, 288, 288, 2080, 2080]
    - [49, 9786.57]
  - - [256, 512, 1, 4096, 288, 288, 4128, 4128]
    - [49, 10362.7]
  - - [256, 1024, 1, 64, 288, 288, 96, 1024]
    - [18, 2958.96]
  - - [256, 1024, 1, 128, 288, 288, 160, 1024]
    - [18, 5225.73]
  - - [256, 1024, 1, 256, 288, 288, 288, 1024]
    - [18, 8489.45]
  - - [256, 1024, 1, 512, 288, 288, 544, 1024]
    - [18, 12370.3]
  - - [256, 1024, 1, 1024, 288, 288, 1056, 1056]
    - [18, 15773.6]
  - - [256, 1024, 1, 2048, 288, 288, 2080, 2080]
    - [54, 19280.0]
  - - [256, 1024, 1, 4096, 288, 288, 4128, 4128]
    - [54, 20919.2]
  - - [256, 2048, 1, 64, 288, 288, 96, 2048]
    - [7, 5002.9]
  - - [256, 2048, 1, 128, 288, 288, 160, 2048]
    - [10, 8749.55]
  - - [256, 2048, 1, 256, 288, 288, 288, 2048]
    - [16, 14328.8]
  - - [256, 2048, 1, 512, 288, 288, 544, 2048]
    - [16, 21569.7]
  - - [256, 2048, 1, 1024, 288, 288, 1056, 2048]
    - [16, 29184.2]
  - - [256, 2048, 1, 2048, 288, 288, 2080, 2080]
    - [7, 34958.2]
  - - [256, 2048, 1, 4096, 288, 288, 4128, 4128]
    - [16, 36146.9]
  - - [256, 4096, 1, 64, 288, 288, 96, 4096]
    - [14, 8672.66]
  - - [256, 4096, 1, 128, 288, 288, 160, 4096]
    - [56, 15418.5]
  - - [256, 4096, 1, 256, 288, 288, 288, 4096]
    - [34, 23770.1]
  - - [256, 4096, 1, 512, 288, 288, 544, 4096]
    - [32, 31115.7]
  - - [256, 4096, 1, 1024, 288, 288, 1056, 4096]
    - [41, 37117.8]
  - - [256, 4096, 1, 2048, 288, 288, 2080, 4096]
    - [28, 39090.7]
  - - [256, 4096, 1, 4096, 288, 288, 4128, 4128]
    - [32, 40480.0]
  - - [384, 64, 1, 64, 416, 416, 96, 96]
    - [7, 235.847]
  - - [384, 64, 1, 128, 416, 416, 160, 160]
    - [18, 416.82]
  - - [384, 64, 1, 256, 416, 416, 288, 288]
    - [51, 667.743]
  - - [384, 64, 1, 512, 416, 416, 544, 544]
    - [46, 1032.23]
  - - [384, 64, 1, 1024, 416, 416, 1056, 1056]
    - [51, 1436.41]
  - - [384, 64, 1, 2048, 416, 416, 2080, 2080]
    - [54, 1731.58]
  - - [384, 64, 1, 4096, 416, 416, 4128, 4128]
    - [49, 1889.15]
  - - [384, 128, 1, 64, 416, 416, 96, 128]
    - [34, 528.96]
  - - [384, 128, 1, 128, 416, 416, 160, 160]
    - [9, 963.175]
  - - [384, 128, 1, 256, 416, 416, 288, 288]
    - [46, 1629.07]
  - - [384, 128, 1, 512, 416, 416, 544, 544]
    - [54, 2392.42]
  - - [384, 128, 1, 1024, 416, 416, 1056, 1056]
    - [54, 3126.97]
  - - [384, 128, 1, 2048, 416, 416, 2080, 2080]
    - [49, 3645.11]
  - - [384, 128, 1, 4096, 416, 416, 4128, 4128]
    - [49, 3860.23]
  - - [384, 256, 1, 64, 416, 416, 96, 256]
    - [21, 1173.13]
  - - [384, 256, 1, 128, 416, 416, 160, 256]
    - [18, 2074.33]
  - - [384, 256, 1, 256, 416, 416, 288, 288]
    - [7, 3346.53]
  - - [384, 256, 1, 512, 416, 416, 544, 544]
    - [51, 4865.31]
  - - [384, 256, 1, 1024, 416, 416, 1056, 1056]
    - [54, 6195.06]
  - - [384, 256, 1, 2048, 416, 416, 2080, 2080]
    - [51, 7306.1]
  - - [384, 256, 1, 4096, 416, 416, 4128, 4128]
    - [54, 7816.39]
  - - [384, 512, 1, 64, 416, 416, 96, 512]
    - [7, 2269.24]
  - - [384, 512, 1, 128, 416, 416, 160, 512]
    - [18, 4000.31]
  - - [384, 512, 1, 256, 416, 416, 288, 512]
    - [9, 6496.92]
  - - [384, 512, 1, 512, 416, 416, 544, 544]
    - [46, 9208.13]
  - - [384, 512, 1, 1024, 416, 416, 1056, 1056]
    - [49, 12101.9]
  - - [384, 512, 1, 2048, 416, 416, 2080, 2080]
    - [54, 14474.6]
  - - [384, 512, 1, 4096, 416, 416, 4128, 4128]
    - [54, 15549.2]
  - - [384, 1024, 1, 64, 416, 416, 96, 1024]
    - [12, 3905.92]
  - - [384, 1024, 1, 128, 416, 416, 160, 1024]
    - [32, 6686.81]
  - - [384, 1024, 1, 256, 416, 416, 288, 1024]
    - [17, 11179.9]
  - - [384, 1024, 1, 512, 416, 416, 544, 1024]
    - [16, 16662.0]
  - - [384, 1024, 1, 1024, 416, 416, 1056, 1056]
    - [18, 22290.4]
  - - [384, 1024, 1, 2048, 416, 416, 2080, 2080]
    - [17, 26651.7]
  - - [384, 1024, 1, 4096, 416, 416, 4128, 4128]
    - [18, 28790.8]
  - - [384, 2048, 1, 64, 416, 416, 96, 2048]
    - [34, 6469.36]
  - - [384, 2048, 1, 128, 416, 416, 160, 2048]
    - [35, 12217.9]
  - - [384, 2048, 1, 256, 416, 416, 288, 2048]
    - [37, 18670.8]
  - - [384, 2048, 1, 512, 416, 416, 544, 2048]
    - [20, 27522.4]
  - - [384, 2048, 1, 1024, 416, 416, 1056, 2048]
    - [22, 34049.6]
  - - [384, 2048, 1, 2048, 416, 416, 2080, 2080]
    - [26, 36463.1]
  - - [384, 2048, 1, 4096, 416, 416, 4128, 4128]
    - [39, 36406.3]
  - - [384, 4096, 1, 64, 416, 416, 96, 4096]
    - [16, 12657.3]
  - - [384, 4096, 1, 128, 416, 416, 160, 4096]
    - [3, 19315.6]
  - - [384, 4096, 1, 256, 416, 416, 288, 4096]
    - [14, 26391.4]
  - - [384, 4096, 1, 512, 416, 416, 544, 4096]
    - [4, 31297.2]
  - - [384, 4096, 1, 1024, 416, 416, 1056, 4096]
    - [14, 33942.0]
  - - [384, 4096, 1, 2048, 416, 416, 2080, 4096]
    - [13, 36838.9]
  - - [384, 4096, 1, 4096, 416, 416, 4128, 4128]
    - [5, 37450.5]
  - - [768, 64, 1, 64, 800, 800, 96, 96]
    - [16, 485.752]
  - - [768, 64, 1, 128, 800, 800, 160, 160]
    - [9, 820.161]
  - - [768, 64, 1, 256, 800, 800, 288, 288]
    - [9, 1376.23]
  - - [768, 64, 1, 512, 800, 800, 544, 544]
    - [46, 2110.52]
  - - [768, 64, 1, 1024, 800, 800, 1056, 1056]
    - [54, 2862.03]
  - - [768, 64, 1, 2048, 800, 800, 2080, 2080]
    - [49, 3506.33]
  - - [768, 64, 1, 4096, 800, 800, 4128, 4128]
    - [49, 3781.92]
  - - [768, 128, 1, 64, 800, 800, 96, 128]
    - [18, 1078.23]
  - - [768, 128, 1, 128, 800, 800, 160, 160]
    - [18, 1967.0]
  - - [768, 128, 1, 256, 800, 800, 288, 288]
    - [7, 3195.66]
  - - [768, 128, 1, 512, 800, 800, 544, 544]
    - [58, 4725.98]
  - - [768, 128, 1, 1024, 800, 800, 1056, 1056]
    - [49, 6249.28]
  - - [768, 128, 1, 2048, 800, 800, 2080, 2080]
    - [54, 7295.51]
  - - [768, 128, 1, 4096, 800, 800, 4128, 4128]
    - [49, 7735.16]
  - - [768, 256, 1, 64, 800, 800, 96, 256]
    - [18, 2141.41]
  - - [768, 256, 1, 128, 800, 800, 160, 256]
    - [9, 3815.89]
  - - [768, 256, 1, 256, 800, 800, 288, 288]
    - [18, 6442.04]
  - - [768, 256, 1, 512, 800, 800, 544, 544]
    - [18, 9399.0]
  - - [768, 256, 1, 1024, 800, 800, 1056, 1056]
    - [9, 12125.2]
  - - [768, 256, 1, 2048, 800, 800, 2080, 2080]
    - [54, 14413.4]
  - - [768, 256, 1, 4096, 800, 800, 4128, 4128]
    - [54, 15420.0]
  - - [768, 512, 1, 64, 800, 800, 96, 512]
    - [37, 3905.31]
  - - [768, 512, 1, 128, 800, 800, 160, 512]
    - [34, 6931.78]
  - - [768, 512, 1, 256, 800, 800, 288, 512]
    - [18, 11536.0]
  - - [768, 512, 1, 512, 800, 800, 544, 544]
    - [17, 16956.7]
  - - [768, 512, 1, 1024, 800, 800, 1056, 1056]
    - [6, 21543.8]
  - - [768, 512, 1, 2048, 800, 800, 2080, 2080]
    - [18, 26583.1]
  - - [768, 512, 1, 4096, 800, 800, 4128, 4128]
    - [18, 28557.0]
  - - [768, 1024, 1, 64, 800, 800, 96, 1024]
    - [34, 6702.84]
  - - [768, 1024, 1, 128, 800, 800, 160, 1024]
    - [34, 11594.5]
  - - [768, 1024, 1, 256, 800, 800, 288, 1024]
    - [23, 19451.8]
  - - [768, 1024, 1, 512, 800, 800, 544, 1024]
    - [30, 26711.8]
  - - [768, 1024, 1, 1024, 800, 800, 1056, 1056]
    - [38, 32086.5]
  - - [768, 1024, 1, 2048, 800, 800, 2080, 2080]
    - [26, 35618.1]
  - - [768, 1024, 1, 4096, 800, 800, 4128, 4128]
    - [30, 39787.9]
  - - [768, 2048, 1, 64, 800, 800, 96, 2048]
    - [14, 12965.4]
  - - [768, 2048, 1, 128, 800, 800, 160, 2048]
    - [44, 20042.6]
  - - [768, 2048, 1, 256, 800, 800, 288, 2048]
    - [32, 27501.8]
  - - [768, 2048, 1, 512, 800, 800, 544, 2048]
    - [28, 33332.3]
  - - [768, 2048, 1, 1024, 800, 800, 1056, 2048]
    - [44, 36359.4]
  - - [768, 2048, 1, 2048, 800, 800, 2080, 2080]
    - [21, 40073.0]
  - - [768, 2048, 1, 4096, 800, 800, 4128, 4128]
    - [44, 41485.0]
  - - [768, 4096, 1, 64, 800, 800, 96, 4096]
    - [34, 17333.4]
  - - [768, 4096, 1, 128, 800, 800, 160, 4096]
    - [34, 25453.9]
  - - [768, 4096, 1, 256, 800, 800, 288, 4096]
    - [21, 32512.7]
  - - [768, 4096, 1, 512, 800, 800, 544, 4096]
    - [34, 35809.7]
  - - [768, 4096, 1, 1024, 800, 800, 1056, 4096]
    - [44, 40149.9]
  - - [768, 4096, 1, 2048, 800, 800, 2080, 4096]
    - [41, 42542.7]
  - - [768, 4096, 1, 4096, 800, 800, 4128, 4128]
    - [34, 42891.8]
  - - [1536, 64, 1, 64, 1568, 1568, 96, 96]
    - [0, 975.272]
  - - [1536, 64, 1, 128, 1568, 1568, 160, 160]
    - [7, 1632.24]
  - - [1536, 64, 1, 256, 1568, 1568, 288, 288]
    - [54, 2743.77]
  - - [1536, 64, 1, 512, 1568, 1568, 544, 544]
    - [54, 4194.31]
  - - [1536, 64, 1, 1024, 1568, 1568, 1056, 1056]
    - [59, 5595.21]
  - - [1536, 64, 1, 2048, 1568, 1568, 2080, 2080]
    - [54, 7021.23]
  - - [1536, 64, 1, 4096, 1568, 1568, 4128, 4128]
    - [48, 7699.95]
  - - [1536, 128, 1, 64, 1568, 1568, 96, 128]
    - [12, 2143.61]
  - - [1536, 128, 1, 128, 1568, 1568, 160, 160]
    - [9, 3924.82]
  - - [1536, 128, 1, 256, 1568, 1568, 288, 288]
    - [18, 6387.27]
  - - [1536, 128, 1, 512, 1568, 1568, 544, 544]
    - [9, 9313.78]
  - - [1536, 128, 1, 1024, 1568, 1568, 1056, 1056]
    - [54, 11926.9]
  - - [1536, 128, 1, 2048, 1568, 1568, 2080, 2080]
    - [46, 14667.0]
  - - [1536, 128, 1, 4096, 1568, 1568, 4128, 4128]
    - [46, 15682.7]
  - - [1536, 256, 1, 64, 1568, 1568, 96, 256]
    - [18, 3721.1]
  - - [1536, 256, 1, 128, 1568, 1568, 160, 256]
    - [6, 6660.29]
  - - [1536, 256, 1, 256, 1568, 1568, 288, 288]
    - [16, 11092.4]
  - - [1536, 256, 1, 512, 1568, 1568, 544, 544]
    - [15, 16444.3]
  - - [1536, 256, 1, 1024, 1568, 1568, 1056, 1056]
    - [44, 21416.6]
  - - [1536, 256, 1, 2048, 1568, 1568, 2080, 2080]
    - [44, 25685.2]
  - - [1536, 256, 1, 4096, 1568, 1568, 4128, 4128]
    - [28, 27191.2]
  - - [1536, 512, 1, 64, 1568, 1568, 96, 512]
    - [44, 6457.74]
  - - [1536, 512, 1, 128, 1568, 1568, 160, 512]
    - [58, 12238.7]
  - - [1536, 512, 1, 256, 1568, 1568, 288, 512]
    - [26, 19137.5]
  - - [1536, 512, 1, 512, 1568, 1568, 544, 544]
    - [43, 27369.1]
  - - [1536, 512, 1, 1024, 1568, 1568, 1056, 1056]
    - [38, 33599.3]
  - - [1536, 512, 1, 2048, 1568, 1568, 2080, 2080]
    - [30, 36802.3]
  - - [1536, 512, 1, 4096, 1568, 1568, 4128, 4128]
    - [29, 40257.3]
  - - [1536, 1024, 1, 64, 1568, 1568, 96, 1024]
    - [13, 12478.4]
  - - [1536, 1024, 1, 128, 1568, 1568, 160, 1024]
    - [41, 19616.7]
  - - [1536, 1024, 1, 256, 1568, 1568, 288, 1024]
    - [28, 27098.3]
  - - [1536, 1024, 1, 512, 1568, 1568, 544, 1024]
    - [44, 34226.2]
  - - [1536, 1024, 1, 1024, 1568, 1568, 1056, 1056]
    - [21, 36458.2]
  - - [1536, 1024, 1, 2048, 1568, 1568, 2080, 2080]
    - [41, 40071.5]
  - - [1536, 1024, 1, 4096, 1568, 1568, 4128, 4128]
    - [28, 41980.3]
  - - [1536, 2048, 1, 64, 1568, 1568, 96, 2048]
    - [44, 17843.4]
  - - [1536, 2048, 1, 128, 1568, 1568, 160, 2048]
    - [44, 25563.7]
  - - [1536, 2048, 1, 256, 1568, 1568, 288, 2048]
    - [41, 32223.9]
  - - [1536, 2048, 1, 512, 1568, 1568, 544, 2048]
    - [41, 36222.1]
  - - [1536, 2048, 1, 1024, 1568, 1568, 1056, 2048]
    - [41, 40045.6]
  - - [1536, 2048, 1, 2048, 1568, 1568, 2080, 2080]
    - [41, 42563.0]
  - - [1536, 2048, 1, 4096, 1568, 1568, 4128, 4128]
    - [44, 43059.2]
  - - [1536, 4096, 1, 64, 1568, 1568, 96, 4096]
    - [41, 21679.5]
  - - [1536, 4096, 1, 128, 1568, 1568, 160, 4096]
    - [34, 29599.3]
  - - [1536, 4096, 1, 256, 1568, 1568, 288, 4096]
    - [34, 33815.1]
  - - [1536, 4096, 1, 512, 1568, 1568, 544, 4096]
    - [44, 38645.2]
  - - [1536, 4096, 1, 1024, 1568, 1568, 1056, 4096]
    - [41, 41823.0]
  - - [1536, 4096, 1, 2048, 1568, 1568, 2080, 4096]
    - [44, 42770.2]
  - - [1536, 4096, 1, 4096, 1568, 1568, 4128, 4128]
    - [36, 43247.3]
  - - [3072, 64, 1, 64, 3104, 3104, 96, 96]
    - [15, 1879.73]
  - - [3072, 64, 1, 128, 3104, 3104, 160, 160]
    - [31, 3021.83]
  - - [3072, 64, 1, 256, 3104, 3104, 288, 288]
    - [15, 5104.11]
  - - [3072, 64, 1, 512, 3104, 3104, 544, 544]
    - [8, 7937.49]
  - - [3072, 64, 1, 1024, 3104, 3104, 1056, 1056]
    - [15, 10948.2]
  - - [3072, 64, 1, 2048, 3104, 3104, 2080, 2080]
    - [7, 12625.9]
  - - [3072, 64, 1, 4096, 3104, 3104, 4128, 4128]
    - [9, 12220.3]
  - - [3072, 128, 1, 64, 3104, 3104, 96, 128]
    - [44, 3658.89]
  - - [3072, 128, 1, 128, 3104, 3104, 160, 160]
    - [16, 6709.1]
  - - [3072, 128, 1, 256, 3104, 3104, 288, 288]
    - [15, 10666.9]
  - - [3072, 128, 1, 512, 3104, 3104, 544, 544]
    - [16, 16065.0]
  - - [3072, 128, 1, 1024, 3104, 3104, 1056, 1056]
    - [6, 21593.5]
  - - [3072, 128, 1, 2048, 3104, 3104, 2080, 2080]
    - [44, 25465.9]
  - - [3072, 128, 1, 4096, 3104, 3104, 4128, 4128]
    - [27, 22539.3]
  - - [3072, 256, 1, 64, 3104, 3104, 96, 256]
    - [24, 6864.65]
  - - [3072, 256, 1, 128, 3104, 3104, 160, 256]
    - [60, 11658.9]
  - - [3072, 256, 1, 256, 3104, 3104, 288, 288]
    - [41, 18509.4]
  - - [3072, 256, 1, 512, 3104, 3104, 544, 544]
    - [38, 26204.2]
  - - [3072, 256, 1, 1024, 3104, 3104, 1056, 1056]
    - [26, 34467.8]
  - - [3072, 256, 1, 2048, 3104, 3104, 2080, 2080]
    - [42, 37075.9]
  - - [3072, 256, 1, 4096, 3104, 3104, 4128, 4128]
    - [42, 35658.3]
  - - [3072, 512, 1, 64, 3104, 3104, 96, 512]
    - [4, 12361.9]
  - - [3072, 512, 1, 128, 3104, 3104, 160, 512]
    - [5, 19468.8]
  - - [3072, 512, 1, 256, 3104, 3104, 288, 512]
    - [28, 27140.3]
  - - [3072, 512, 1, 512, 3104, 3104, 544, 544]
    - [37, 33603.5]
  - - [3072, 512, 1, 1024, 3104, 3104, 1056, 1056]
    - [44, 36666.5]
  - - [3072, 512, 1, 2048, 3104, 3104, 2080, 2080]
    - [44, 39971.6]
  - - [3072, 512, 1, 4096, 3104, 3104, 4128, 4128]
    - [32, 40473.6]
  - - [3072, 1024, 1, 64, 3104, 3104, 96, 1024]
    - [34, 17348.3]
  - - [3072, 1024, 1, 128, 3104, 3104, 160, 1024]
    - [34, 25067.2]
  - - [3072, 1024, 1, 256, 3104, 3104, 288, 1024]
    - [44, 32251.0]
  - - [3072, 1024, 1, 512, 3104, 3104, 544, 1024]
    - [37, 35884.7]
  - - [3072, 1024, 1, 1024, 3104, 3104, 1056, 1056]
    - [44, 40045.1]
  - - [3072, 1024, 1, 2048, 3104, 3104, 2080, 2080]
    - [44, 42618.2]
  - - [3072, 1024, 1, 4096, 3104, 3104, 4128, 4128]
    - [44, 42768.5]
  - - [3072, 2048, 1, 64, 3104, 3104, 96, 2048]
    - [44, 21665.5]
  - - [3072, 2048, 1, 128, 3104, 3104, 160, 2048]
    - [37, 29264.8]
  - - [3072, 2048, 1, 256, 3104, 3104, 288, 2048]
    - [34, 34128.2]
  - - [3072, 2048, 1, 512, 3104, 3104, 544, 2048]
    - [41, 38685.1]
  - - [3072, 2048, 1, 1024, 3104, 3104, 1056, 2048]
    - [44, 41801.3]
  - - [3072, 2048, 1, 2048, 3104, 3104, 2080, 2080]
    - [44, 42907.2]
  - - [3072, 2048, 1, 4096, 3104, 3104, 4128, 4128]
    - [41, 42739.0]
  - - [3072, 4096, 1, 64, 3104, 3104, 96, 4096]
    - [34, 24917.5]
  - - [3072, 4096, 1, 128, 3104, 3104, 160, 4096]
    - [41, 30784.5]
  - - [3072, 4096, 1, 256, 3104, 3104, 288, 4096]
    - [41, 36354.5]
  - - [3072, 4096, 1, 512, 3104, 3104, 544, 4096]
    - [41, 40252.5]
  - - [3072, 4096, 1, 1024, 3104, 3104, 1056, 4096]
    - [37, 41771.8]
  - - [3072, 4096, 1, 2048, 3104, 3104, 2080, 4096]
    - [40, 42839.0]
  - - [3072, 4096, 1, 4096, 3104, 3104, 4128, 4128]
    - [44, 41231.2]
  - - [4096, 64, 1, 64, 4128, 4128, 96, 96]
    - [1, 2395.03]
  - - [4096, 64, 1, 128, 4128, 4128, 160, 160]
    - [24, 4100.52]
  - - [4096, 64, 1, 256, 4128, 4128, 288, 288]
    - [33, 6805.48]
  - - [4096, 64, 1, 512, 4128, 4128, 544, 544]
    - [33, 10446.6]
  - - [4096, 64, 1, 1024, 4128, 4128, 1056, 1056]
    - [27, 13849.0]
  - - [4096, 64, 1, 2048, 4128, 4128, 2080, 2080]
    - [40, 16299.5]
  - - [4096, 64, 1, 4096, 4128, 4128, 4128, 4128]
    - [57, 14729.2]
  - - [4096, 128, 1, 64, 4128, 4128, 96, 128]
    - [37, 5800.27]
  - - [4096, 128, 1, 128, 4128, 4128, 160, 160]
    - [25, 10186.6]
  - - [4096, 128, 1, 256, 4128, 4128, 288, 288]
    - [34, 16292.6]
  - - [4096, 128, 1, 512, 4128, 4128, 544, 544]
    - [37, 22693.0]
  - - [4096, 128, 1, 1024, 4128, 4128, 1056, 1056]
    - [37, 29239.8]
  - - [4096, 128, 1, 2048, 4128, 4128, 2080, 2080]
    - [25, 34083.8]
  - - [4096, 128, 1, 4096, 4128, 4128, 4128, 4128]
    - [59, 28949.3]
  - - [4096, 256, 1, 64, 4128, 4128, 96, 256]
    - [37, 9727.33]
  - - [4096, 256, 1, 128, 4128, 4128, 160, 256]
    - [41, 16118.4]
  - - [4096, 256, 1, 256, 4128, 4128, 288, 288]
    - [34, 23625.8]
  - - [4096, 256, 1, 512, 4128, 4128, 544, 544]
    - [37, 30986.4]
  - - [4096, 256, 1, 1024, 4128, 4128, 1056, 1056]
    - [28, 37067.8]
  - - [4096, 256, 1, 2048, 4128, 4128, 2080, 2080]
    - [32, 38750.7]
  - - [4096, 256, 1, 4096, 4128, 4128, 4128, 4128]
    - [28, 37900.3]
  - - [4096, 512, 1, 64, 4128, 4128, 96, 512]
    - [41, 14441.3]
  - - [4096, 512, 1, 128, 4128, 4128, 160, 512]
    - [44, 21972.3]
  - - [4096, 512, 1, 256, 4128, 4128, 288, 512]
    - [34, 29578.1]
  - - [4096, 512, 1, 512, 4128, 4128, 544, 544]
    - [28, 36156.6]
  - - [4096, 512, 1, 1024, 4128, 4128, 1056, 1056]
    - [41, 38337.7]
  - - [4096, 512, 1, 2048, 4128, 4128, 2080, 2080]
    - [41, 41676.9]
  - - [4096, 512, 1, 4096, 4128, 4128, 4128, 4128]
    - [28, 41748.0]
  - - [4096, 1024, 1, 64, 4128, 4128, 96, 1024]
    - [34, 19134.4]
  - - [4096, 1024, 1, 128, 4128, 4128, 160, 1024]
    - [41, 27035.5]
  - - [4096, 1024, 1, 256, 4128, 4128, 288, 1024]
    - [37, 33723.1]
  - - [4096, 1024, 1, 512, 4128, 4128, 544, 1024]
    - [41, 37471.4]
  - - [4096, 1024, 1, 1024, 4128, 4128, 1056, 1056]
    - [41, 40968.1]
  - - [4096, 1024, 1, 2048, 4128, 4128, 2080, 2080]
    - [28, 43023.1]
  - - [4096, 1024, 1, 4096, 4128, 4128, 4128, 4128]
    - [34, 42660.1]
  - - [4096, 2048, 1, 64, 4128, 4128, 96, 2048]
    - [34, 23126.1]
  - - [4096, 2048, 1, 128, 4128, 4128, 160, 2048]
    - [44, 30466.0]
  - - [4096, 2048, 1, 256, 4128, 4128, 288, 2048]
    - [41, 35304.8]
  - - [4096, 2048, 1, 512, 4128, 4128, 544, 2048]
    - [44, 39559.8]
  - - [4096, 2048, 1, 1024, 4128, 4128, 1056, 2048]
    - [41, 42293.5]
  - - [4096, 2048, 1, 2048, 4128, 4128, 2080, 2080]
    - [44, 42711.1]
  - - [4096, 2048, 1, 4096, 4128, 4128, 4128, 4128]
    - [44, 43141.1]
  - - [4096, 4096, 1, 64, 4128, 4128, 96, 4096]
    - [44, 23646.6]
  - - [4096, 4096, 1, 128, 4128, 4128, 160, 4096]
    - [37, 30074.7]
  - - [4096, 4096, 1, 256, 4128, 4128, 288, 4096]
    - [13, 34815.7]
  - - [4096, 4096, 1, 512, 4128, 4128, 544, 4096]
    - [13, 39747.8]
  - - [4096, 4096, 1, 1024, 4128, 4128, 1056, 4096]
    - [44, 41444.8]
  - - [4096, 4096, 1, 2048, 4128, 4128, 2080, 4096]
    - [37, 42986.9]
  - - [4096, 4096, 1, 4096, 4128, 4128, 4128, 4128]
    - [60, 40108.5]
- null
- null
- DeviceEfficiency
