library/src/blas3/Tensile/Logic/asm_full/navi33/navi33_Cijk_Ailk_Bljk_I8II_BH.yaml
- {MinimumRequiredVersion: 4.35.0}
- navi33
- gfx1102
- [Device 73f0]
    SolutionIndex: 0
    SolutionNameMin: Cijk_Ailk_Bljk_I8II_BH_MT128x128x16_MI16x16x16x1_SN_1LDSB0_GRVW8_IU1_LPB32_PLR0_SIA1_SU0_SUS0_SVW2_VW2_WGM1
    SolutionIndex: 1
    SolutionNameMin: Cijk_Ailk_Bljk_I8II_BH_MT128x128x16_MI16x16x16x1_SN_1LDSB0_GRVW8_IU1_LPB32_PLR0_SIA1_SU0_SUS0_SVW4_VW4_WGM1
    SolutionIndex: 2
    SolutionNameMin: Cijk_Ailk_Bljk_I8II_BH_MT128x128x16_MI16x16x16x1_SN_1LDSB0_GRVW16_IU1_LPB32_PLR0_SIA1_SU0_SUS0_SVW2_VW2_WGM1
    SolutionIndex: 3
    SolutionNameMin: Cijk_Ailk_Bljk_I8II_BH_MT128x128x16_MI16x16x16x1_SN_1LDSB0_GRVW8_IU1_LPB32_PLR1_SIA1_SU0_SUS0_SVW2_VW2_WGM1
    SolutionIndex: 4
    SolutionNameMin: Cijk_Ailk_Bljk_I8II_BH_MT128x128x16_MI16x16x16x1_SN_1LDSB0_GRVW8_IU1_LPB32_PLR1_SIA1_SU0_SUS0_SVW4_VW4_WGM1
    SolutionIndex: 5
    SolutionNameMin: Cijk_Ailk_Bljk_I8II_BH_MT128x128x16_MI16x16x16x1_SN_1LDSB0_GRVW16_IU1_LPB32_PLR1_SIA1_SU0_SUS0_SVW2_VW2_WGM1
    SolutionIndex: 6
    SolutionNameMin: Cijk_Ailk_Bljk_I8II_BH_MT128x128x16_MI16x16x16x1_SN_1LDSB0_GRVW16_IU1_LPB32_PLR1_SIA1_SU0_SUS0_SVW4_VW4_WGM1
    SolutionIndex: 7
    SolutionNameMin: Cijk_Ailk_Bljk_I8II_BH_MT128x128x16_MI16x16x16x1_SN_1LDSB1_GRVW8_IU1_LPB32_PLR1_SIA2_SU0_SUS0_SVW2_VW2_WGM1
    SolutionIndex: 8
    SolutionNameMin: Cijk_Ailk_Bljk_I8II_BH_MT128x128x16_MI16x16x16x1_SN_1LDSB1_GRVW8_IU1_LPB32_PLR1_SIA2_SU0_SUS0_SVW4_VW4_WGM1
    SolutionIndex: 9
    SolutionNameMin: Cijk_Ailk_Bljk_I8II_BH_MT128x128x16_MI16x16x16x1_SN_1LDSB1_GRVW16_IU1_LPB32_PLR1_SIA2_SU0_SUS0_SVW2_VW2_WGM1
    SolutionIndex: 10
    SolutionNameMin: Cijk_Ailk_Bljk_I8II_BH_MT128x128x16_MI16x16x16x1_SN_1LDSB1_GRVW16_IU1_LPB32_PLR1_SIA2_SU0_SUS0_SVW4_VW4_WGM1
    SolutionIndex: 11
    SolutionNameMin: Cijk_Ailk_Bljk_I8II_BH_MT128x128x16_MI16x16x16x1_SN_1LDSB0_GRVW16_IU1_LPB32_PLR0_SIA3_SU0_SUS0_SVW2_VW2_WGM1
    SolutionIndex: 12
    SolutionNameMin: Cijk_Ailk_Bljk_I8II_BH_MT128x128x16_MI16x16x16x1_SN_1LDSB0_GRVW8_IU1_LPB8_PLR1_SIA3_SU0_SUS0_SVW4_VW4_WGM1
    SolutionIndex: 13
    SolutionNameMin: Cijk_Ailk_Bljk_I8II_BH_MT128x128x16_MI16x16x16x1_SN_1LDSB0_GRVW16_IU1_LPB32_PLR1_SIA3_SU0_SUS0_SVW4_VW4_WGM1
    SolutionIndex: 14
    SolutionNameMin: Cijk_Ailk_Bljk_I8II_BH_MT128x128x16_MI16x16x16x1_SN_1LDSB0_GRVW8_IU1_LPB32_PLR1_SIA1_SU32_SUS256_SVW2_VW2_WGM1
    SolutionIndex: 15
    SolutionNameMin: Cijk_Ailk_Bljk_I8II_BH_MT128x128x16_MI16x16x16x1_SN_1LDSB1_GRVW8_IU1_LPB32_PLR1_SIA2_SU32_SUS256_SVW2_VW2_WGM1
    SolutionIndex: 16
    SolutionNameMin: Cijk_Ailk_Bljk_I8II_BH_MT128x128x16_MI16x16x16x1_SN_1LDSB1_GRVW8_IU1_LPB32_PLR1_SIA2_SU32_SUS256_SVW4_VW4_WGM1
    SolutionIndex: 17
    SolutionNameMin: Cijk_Ailk_Bljk_I8II_BH_MT128x128x16_MI16x16x16x1_SN_1LDSB1_GRVW16_IU1_LPB32_PLR1_SIA2_SU32_SUS256_SVW2_VW2_WGM1
    SolutionIndex: 18
    SolutionNameMin: Cijk_Ailk_Bljk_I8II_BH_MT128x128x16_MI16x16x16x1_SN_1LDSB1_GRVW16_IU1_LPB32_PLR1_SIA2_SU32_SUS256_SVW4_VW4_WGM1
    SolutionIndex: 19
    SolutionNameMin: Cijk_Ailk_Bljk_I8II_BH_MT128x128x16_MI16x16x16x1_SN_1LDSB0_GRVW16_IU1_LPB32_PLR0_SIA3_SU32_SUS256_SVW2_VW2_WGM1
    SolutionIndex: 20
    SolutionNameMin: Cijk_Ailk_Bljk_I8II_BH_MT128x128x16_MI16x16x16x1_SN_1LDSB0_GRVW16_IU1_LPB32_PLR0_SIA3_SU32_SUS256_SVW4_VW4_WGM1
    SolutionIndex: 21
    SolutionNameMin: Cijk_Ailk_Bljk_I8II_BH_MT128x128x16_MI16x16x16x1_SN_1LDSB0_GRVW16_IU1_LPB32_PLR1_SIA3_SU32_SUS256_SVW2_VW2_WGM1
    SolutionIndex: 22
    SolutionNameMin: Cijk_Ailk_Bljk_I8II_BH_MT128x128x16_MI16x16x16x1_SN_1LDSB0_GRVW16_IU1_LPB32_PLR0_SIA1_SU0_SUS0_SVW2_VW2_WGM4
    SolutionIndex: 23
    SolutionNameMin: Cijk_Ailk_Bljk_I8II_BH_MT128x128x16_MI16x16x16x1_SN_1LDSB0_GRVW8_IU1_LPB32_PLR1_SIA1_SU0_SUS0_SVW4_VW4_WGM4
    SolutionIndex: 24
    SolutionNameMin: Cijk_Ailk_Bljk_I8II_BH_MT128x128x16_MI16x16x16x1_SN_1LDSB0_GRVW16_IU1_LPB32_PLR1_SIA1_SU0_SUS0_SVW2_VW2_WGM4
    SolutionIndex: 25
    SolutionNameMin: Cijk_Ailk_Bljk_I8II_BH_MT128x128x16_MI16x16x16x1_SN_1LDSB0_GRVW16_IU1_LPB32_PLR1_SIA1_SU0_SUS0_SVW4_VW4_WGM4
    SolutionIndex: 26
    SolutionNameMin: Cijk_Ailk_Bljk_I8II_BH_MT128x128x16_MI16x16x16x1_SN_1LDSB1_GRVW8_IU1_LPB32_PLR1_SIA2_SU0_SUS0_SVW2_VW2_WGM4
    SolutionIndex: 27
    SolutionNameMin: Cijk_Ailk_Bljk_I8II_BH_MT128x128x16_MI16x16x16x1_SN_1LDSB1_GRVW8_IU1_LPB32_PLR1_SIA2_SU0_SUS0_SVW4_VW4_WGM4
    SolutionIndex: 28
    SolutionNameMin: Cijk_Ailk_Bljk_I8II_BH_MT128x128x16_MI16x16x16x1_SN_1LDSB1_GRVW16_IU1_LPB32_PLR1_SIA2_SU0_SUS0_SVW2_VW2_WGM4
    SolutionIndex: 29
    SolutionNameMin: Cijk_Ailk_Bljk_I8II_BH_MT128x128x16_MI16x16x16x1_SN_1LDSB1_GRVW16_IU1_LPB32_PLR1_SIA2_SU0_SUS0_SVW4_VW4_WGM4
    SolutionIndex: 30
    SolutionNameMin: Cijk_Ailk_Bljk_I8II_BH_MT128x128x16_MI16x16x16x1_SN_1LDSB0_GRVW16_IU1_LPB32_PLR1_SIA3_SU0_SUS0_SVW2_VW2_WGM4
    SolutionIndex: 31
    SolutionNameMin: Cijk_Ailk_Bljk_I8II_BH_MT128x128x16_MI16x16x16x1_SN_1LDSB0_GRVW16_IU1_LPB32_PLR1_SIA3_SU0_SUS0_SVW4_VW4_WGM4
    SolutionIndex: 32
    SolutionNameMin: Cijk_Ailk_Bljk_I8II_BH_MT128x128x16_MI16x16x16x1_SN_1LDSB0_GRVW8_IU1_LPB32_PLR0_SIA1_SU32_SUS256_SVW2_VW2_WGM4
    SolutionIndex: 33
    SolutionNameMin: Cijk_Ailk_Bljk_I8II_BH_MT128x128x16_MI16x16x16x1_SN_1LDSB1_GRVW8_IU1_LPB32_PLR1_SIA2_SU32_SUS256_SVW2_VW2_WGM4
    SolutionIndex: 34
    SolutionNameMin: Cijk_Ailk_Bljk_I8II_BH_MT128x128x16_MI16x16x16x1_SN_1LDSB0_GRVW8_IU1_LPB8_PLR0_SIA3_SU32_SUS256_SVW2_VW2_WGM4
    SolutionIndex: 35
    SolutionNameMin: Cijk_Ailk_Bljk_I8II_BH_MT128x128x16_MI16x16x16x1_SN_1LDSB0_GRVW16_IU1_LPB32_PLR0_SIA3_SU32_SUS256_SVW2_VW2_WGM4
    SolutionIndex: 36
    SolutionNameMin: Cijk_Ailk_Bljk_I8II_BH_MT128x128x16_MI16x16x16x1_SN_1LDSB0_GRVW16_IU1_LPB32_PLR1_SIA3_SU32_SUS256_SVW2_VW2_WGM4
    SolutionIndex: 37
    SolutionNameMin: Cijk_Ailk_Bljk_I8II_BH_MT128x128x16_MI16x16x16x1_SN_1LDSB0_GRVW16_IU1_LPB32_PLR1_SIA3_SU32_SUS256_SVW4_VW4_WGM4
    SolutionIndex: 38
    SolutionNameMin: Cijk_Ailk_Bljk_I8II_BH_MT128x128x16_MI16x16x16x1_SN_1LDSB0_GRVW16_IU1_LPB32_PLR0_SIA1_SU0_SUS0_SVW2_VW2_WGM8
    SolutionIndex: 39
    SolutionNameMin: Cijk_Ailk_Bljk_I8II_BH_MT128x128x16_MI16x16x16x1_SN_1LDSB0_GRVW16_IU1_LPB32_PLR1_SIA1_SU0_SUS0_SVW4_VW4_WGM8
    SolutionIndex: 40
    SolutionNameMin: Cijk_Ailk_Bljk_I8II_BH_MT128x128x16_MI16x16x16x1_SN_1LDSB1_GRVW8_IU1_LPB32_PLR1_SIA2_SU0_SUS0_SVW2_VW2_WGM8
    SolutionIndex: 41
    SolutionNameMin: Cijk_Ailk_Bljk_I8II_BH_MT128x128x16_MI16x16x16x1_SN_1LDSB1_GRVW16_IU1_LPB32_PLR1_SIA2_SU0_SUS0_SVW2_VW2_WGM8
    SolutionIndex: 42
    SolutionNameMin: Cijk_Ailk_Bljk_I8II_BH_MT128x128x16_MI16x16x16x1_SN_1LDSB1_GRVW16_IU1_LPB32_PLR1_SIA2_SU0_SUS0_SVW4_VW4_WGM8
    SolutionIndex: 43
    SolutionNameMin: Cijk_Ailk_Bljk_I8II_BH_MT128x128x16_MI16x16x16x1_SN_1LDSB0_GRVW16_IU1_LPB32_PLR1_SIA3_SU0_SUS0_SVW2_VW2_WGM8
    SolutionIndex: 44
    SolutionNameMin: Cijk_Ailk_Bljk_I8II_BH_MT128x128x16_MI16x16x16x1_SN_1LDSB0_GRVW16_IU1_LPB32_PLR0_SIA1_SU32_SUS256_SVW2_VW2_WGM8
    SolutionIndex: 45
    SolutionNameMin: Cijk_Ailk_Bljk_I8II_BH_MT128x128x16_MI16x16x16x1_SN_1LDSB0_GRVW8_IU1_LPB32_PLR1_SIA1_SU32_SUS256_SVW2_VW2_WGM8
    SolutionIndex: 46
    SolutionNameMin: Cijk_Ailk_Bljk_I8II_BH_MT128x128x16_MI16x16x16x1_SN_1LDSB0_GRVW16_IU1_LPB32_PLR1_SIA1_SU32_SUS256_SVW2_VW2_WGM8
    SolutionIndex: 47
    SolutionNameMin: Cijk_Ailk_Bljk_I8II_BH_MT128x128x16_MI16x16x16x1_SN_1LDSB1_GRVW8_IU1_LPB32_PLR1_SIA2_SU32_SUS256_SVW2_VW2_WGM8
    SolutionIndex: 48
    SolutionNameMin: Cijk_Ailk_Bljk_I8II_BH_MT128x128x16_MI16x16x16x1_SN_1LDSB1_GRVW16_IU1_LPB32_PLR1_SIA2_SU32_SUS256_SVW2_VW2_WGM8
    SolutionIndex: 49
    SolutionNameMin: Cijk_Ailk_Bljk_I8II_BH_MT128x128x16_MI16x16x16x1_SN_1LDSB0_GRVW16_IU1_LPB8_PLR0_SIA3_SU32_SUS256_SVW2_VW2_WGM8
    SolutionIndex: 50
    SolutionNameMin: Cijk_Ailk_Bljk_I8II_BH_MT128x128x16_MI16x16x16x1_SN_1LDSB0_GRVW16_IU1_LPB32_PLR0_SIA3_SU32_SUS256_SVW2_VW2_WGM8
    SolutionIndex: 51
    SolutionNameMin: Cijk_Ailk_Bljk_I8II_BH_MT128x128x16_MI16x16x16x1_SN_1LDSB0_GRVW16_IU1_LPB32_PLR0_SIA3_SU32_SUS256_SVW4_VW4_WGM8
    SolutionIndex: 52
    SolutionNameMin: Cijk_Ailk_Bljk_I8II_BH_MT128x128x16_MI16x16x16x1_SN_1LDSB0_GRVW16_IU1_LPB32_PLR1_SIA3_SU32_SUS256_SVW2_VW2_WGM8
    SolutionIndex: 53
    SolutionNameMin: Cijk_Ailk_Bljk_I8II_BH_MT128x128x16_MI16x16x16x1_SN_1LDSB0_GRVW16_IU1_LPB32_PLR1_SIA3_SU32_SUS256_SVW4_VW4_WGM8
    SolutionIndex: 54
    SolutionNameMin: Cijk_Ailk_Bljk_I8II_BH_MT128x128x32_MI16x16x16x1_SN_1LDSB0_GRVW8_IU1_LPB8_PLR0_SIA1_SU0_SUS0_SVW2_VW2_WGM1
    SolutionIndex: 55
    SolutionNameMin: Cijk_Ailk_Bljk_I8II_BH_MT128x128x32_MI16x16x16x1_SN_1LDSB0_GRVW8_IU1_LPB32_PLR0_SIA1_SU0_SUS0_SVW4_VW4_WGM1
    SolutionIndex: 56
    SolutionNameMin: Cijk_Ailk_Bljk_I8II_BH_MT128x128x32_MI16x16x16x1_SN_1LDSB0_GRVW16_IU1_LPB32_PLR1_SIA1_SU0_SUS0_SVW2_VW2_WGM1
    SolutionIndex: 57
    SolutionNameMin: Cijk_Ailk_Bljk_I8II_BH_MT128x128x32_MI16x16x16x1_SN_1LDSB0_GRVW16_IU1_LPB32_PLR1_SIA1_SU0_SUS0_SVW4_VW4_WGM1
    SolutionIndex: 58
    SolutionNameMin: Cijk_Ailk_Bljk_I8II_BH_MT128x128x32_MI16x16x16x1_SN_1LDSB1_GRVW16_IU2_LPB8_PLR1_SIA2_SU0_SUS0_SVW4_VW4_WGM1
    SolutionIndex: 59
    SolutionNameMin: Cijk_Ailk_Bljk_I8II_BH_MT128x128x32_MI16x16x16x1_SN_1LDSB0_GRVW16_IU1_LPB32_PLR0_SIA3_SU0_SUS0_SVW2_VW2_WGM1
    SolutionIndex: 60
    SolutionNameMin: Cijk_Ailk_Bljk_I8II_BH_MT128x128x32_MI16x16x16x1_SN_1LDSB0_GRVW16_IU1_LPB32_PLR1_SIA3_SU0_SUS0_SVW2_VW2_WGM1
    SolutionIndex: 61
    SolutionNameMin: Cijk_Ailk_Bljk_I8II_BH_MT128x128x32_MI16x16x16x1_SN_1LDSB0_GRVW16_IU1_LPB32_PLR1_SIA3_SU0_SUS0_SVW4_VW4_WGM1
    SolutionIndex: 62
    SolutionNameMin: Cijk_Ailk_Bljk_I8II_BH_MT128x128x32_MI16x16x16x1_SN_1LDSB0_GRVW16_IU1_LPB32_PLR1_SIA1_SU32_SUS256_SVW2_VW2_WGM1
    SolutionIndex: 63
    SolutionNameMin: Cijk_Ailk_Bljk_I8II_BH_MT128x128x32_MI16x16x16x1_SN_1LDSB0_GRVW16_IU1_LPB32_PLR1_SIA1_SU32_SUS256_SVW4_VW4_WGM1
    SolutionIndex: 64
    SolutionNameMin: Cijk_Ailk_Bljk_I8II_BH_MT128x128x32_MI16x16x16x1_SN_1LDSB1_GRVW16_IU2_LPB8_PLR1_SIA2_SU32_SUS256_SVW4_VW4_WGM1
    SolutionIndex: 65
    SolutionNameMin: Cijk_Ailk_Bljk_I8II_BH_MT128x128x32_MI16x16x16x1_SN_1LDSB0_GRVW16_IU1_LPB32_PLR0_SIA3_SU32_SUS256_SVW4_VW4_WGM1
    SolutionIndex: 66
    SolutionNameMin: Cijk_Ailk_Bljk_I8II_BH_MT128x128x32_MI16x16x16x1_SN_1LDSB0_GRVW16_IU1_LPB32_PLR1_SIA3_SU32_SUS256_SVW2_VW2_WGM1
    SolutionIndex: 67
    SolutionNameMin: Cijk_Ailk_Bljk_I8II_BH_MT128x128x32_MI16x16x16x1_SN_1LDSB0_GRVW8_IU1_LPB32_PLR0_SIA1_SU0_SUS0_SVW2_VW2_WGM4
    SolutionIndex: 68
    SolutionNameMin: Cijk_Ailk_Bljk_I8II_BH_MT128x128x32_MI16x16x16x1_SN_1LDSB0_GRVW16_IU1_LPB32_PLR0_SIA1_SU0_SUS0_SVW2_VW2_WGM4
    SolutionIndex: 69
    SolutionNameMin: Cijk_Ailk_Bljk_I8II_BH_MT128x128x32_MI16x16x16x1_SN_1LDSB0_GRVW16_IU1_LPB32_PLR1_SIA1_SU0_SUS0_SVW2_VW2_WGM4
    SolutionIndex: 70
    SolutionNameMin: Cijk_Ailk_Bljk_I8II_BH_MT128x128x32_MI16x16x16x1_SN_1LDSB0_GRVW16_IU1_LPB32_PLR1_SIA1_SU0_SUS0_SVW4_VW4_WGM4
    SolutionIndex: 71
    SolutionNameMin: Cijk_Ailk_Bljk_I8II_BH_MT128x128x32_MI16x16x16x1_SN_1LDSB1_GRVW16_IU2_LPB32_PLR1_SIA2_SU0_SUS0_SVW2_VW2_WGM4
    SolutionIndex: 72
    SolutionNameMin: Cijk_Ailk_Bljk_I8II_BH_MT128x128x32_MI16x16x16x1_SN_1LDSB0_GRVW16_IU1_LPB32_PLR0_SIA3_SU0_SUS0_SVW2_VW2_WGM4
    SolutionIndex: 73
    SolutionNameMin: Cijk_Ailk_Bljk_I8II_BH_MT128x128x32_MI16x16x16x1_SN_1LDSB0_GRVW16_IU1_LPB8_PLR0_SIA3_SU0_SUS0_SVW4_VW4_WGM4
    SolutionIndex: 74
    SolutionNameMin: Cijk_Ailk_Bljk_I8II_BH_MT128x128x32_MI16x16x16x1_SN_1LDSB0_GRVW16_IU1_LPB32_PLR0_SIA3_SU0_SUS0_SVW4_VW4_WGM4
    SolutionIndex: 75
    SolutionNameMin: Cijk_Ailk_Bljk_I8II_BH_MT128x128x32_MI16x16x16x1_SN_1LDSB0_GRVW16_IU1_LPB32_PLR1_SIA3_SU0_SUS0_SVW2_VW2_WGM4
    SolutionIndex: 76
    SolutionNameMin: Cijk_Ailk_Bljk_I8II_BH_MT128x128x32_MI16x16x16x1_SN_1LDSB0_GRVW16_IU1_LPB32_PLR1_SIA3_SU0_SUS0_SVW4_VW4_WGM4
    SolutionIndex: 77
    SolutionNameMin: Cijk_Ailk_Bljk_I8II_BH_MT128x128x32_MI16x16x16x1_SN_1LDSB0_GRVW8_IU1_LPB32_PLR0_SIA1_SU32_SUS256_SVW2_VW2_WGM4
    SolutionIndex: 78
    SolutionNameMin: Cijk_Ailk_Bljk_I8II_BH_MT128x128x32_MI16x16x16x1_SN_1LDSB0_GRVW16_IU1_LPB32_PLR0_SIA1_SU32_SUS256_SVW2_VW2_WGM4
    SolutionIndex: 79
    SolutionNameMin: Cijk_Ailk_Bljk_I8II_BH_MT128x128x32_MI16x16x16x1_SN_1LDSB0_GRVW16_IU1_LPB32_PLR1_SIA1_SU32_SUS256_SVW2_VW2_WGM4
    SolutionIndex: 80
    SolutionNameMin: Cijk_Ailk_Bljk_I8II_BH_MT128x128x32_MI16x16x16x1_SN_1LDSB0_GRVW16_IU1_LPB32_PLR1_SIA1_SU32_SUS256_SVW4_VW4_WGM4
    SolutionIndex: 81
    SolutionNameMin: Cijk_Ailk_Bljk_I8II_BH_MT128x128x32_MI16x16x16x1_SN_1LDSB0_GRVW16_IU1_LPB32_PLR0_SIA3_SU32_SUS256_SVW4_VW4_WGM4
    SolutionIndex: 82
    SolutionNameMin: Cijk_Ailk_Bljk_I8II_BH_MT128x128x32_MI16x16x16x1_SN_1LDSB0_GRVW16_IU1_LPB32_PLR1_SIA3_SU32_SUS256_SVW2_VW2_WGM4
    SolutionIndex: 83
    SolutionNameMin: Cijk_Ailk_Bljk_I8II_BH_MT128x128x32_MI16x16x16x1_SN_1LDSB0_GRVW16_IU1_LPB32_PLR1_SIA3_SU32_SUS256_SVW4_VW4_WGM4
    SolutionIndex: 84
    SolutionNameMin: Cijk_Ailk_Bljk_I8II_BH_MT128x128x32_MI16x16x16x1_SN_1LDSB0_GRVW8_IU1_LPB32_PLR0_SIA1_SU0_SUS0_SVW2_VW2_WGM8
    SolutionIndex: 85
    SolutionNameMin: Cijk_Ailk_Bljk_I8II_BH_MT128x128x32_MI16x16x16x1_SN_1LDSB0_GRVW16_IU1_LPB32_PLR0_SIA1_SU0_SUS0_SVW2_VW2_WGM8
    SolutionIndex: 86
    SolutionNameMin: Cijk_Ailk_Bljk_I8II_BH_MT128x128x32_MI16x16x16x1_SN_1LDSB0_GRVW16_IU1_LPB32_PLR1_SIA1_SU0_SUS0_SVW2_VW2_WGM8
    SolutionIndex: 87
    SolutionNameMin: Cijk_Ailk_Bljk_I8II_BH_MT128x128x32_MI16x16x16x1_SN_1LDSB0_GRVW16_IU1_LPB32_PLR1_SIA1_SU0_SUS0_SVW4_VW4_WGM8
    SolutionIndex: 88
    SolutionNameMin: Cijk_Ailk_Bljk_I8II_BH_MT128x128x32_MI16x16x16x1_SN_1LDSB1_GRVW16_IU2_LPB32_PLR1_SIA2_SU0_SUS0_SVW4_VW4_WGM8
    SolutionIndex: 89
    SolutionNameMin: Cijk_Ailk_Bljk_I8II_BH_MT128x128x32_MI16x16x16x1_SN_1LDSB0_GRVW16_IU1_LPB32_PLR0_SIA3_SU0_SUS0_SVW2_VW2_WGM8
    SolutionIndex: 90
    SolutionNameMin: Cijk_Ailk_Bljk_I8II_BH_MT128x128x32_MI16x16x16x1_SN_1LDSB0_GRVW16_IU1_LPB32_PLR0_SIA3_SU0_SUS0_SVW4_VW4_WGM8
    SolutionIndex: 91
    SolutionNameMin: Cijk_Ailk_Bljk_I8II_BH_MT128x128x32_MI16x16x16x1_SN_1LDSB0_GRVW16_IU1_LPB32_PLR1_SIA3_SU0_SUS0_SVW2_VW2_WGM8
    SolutionIndex: 92
    SolutionNameMin: Cijk_Ailk_Bljk_I8II_BH_MT128x128x32_MI16x16x16x1_SN_1LDSB0_GRVW8_IU1_LPB32_PLR0_SIA1_SU32_SUS256_SVW2_VW2_WGM8
    SolutionIndex: 93
    SolutionNameMin: Cijk_Ailk_Bljk_I8II_BH_MT128x128x32_MI16x16x16x1_SN_1LDSB0_GRVW16_IU1_LPB32_PLR0_SIA1_SU32_SUS256_SVW2_VW2_WGM8
    SolutionIndex: 94
    SolutionNameMin: Cijk_Ailk_Bljk_I8II_BH_MT128x128x32_MI16x16x16x1_SN_1LDSB0_GRVW16_IU1_LPB32_PLR0_SIA1_SU32_SUS256_SVW4_VW4_WGM8
    SolutionIndex: 95
    SolutionNameMin: Cijk_Ailk_Bljk_I8II_BH_MT128x128x32_MI16x16x16x1_SN_1LDSB0_GRVW16_IU1_LPB32_PLR1_SIA1_SU32_SUS256_SVW2_VW2_WGM8
    SolutionIndex: 96
    SolutionNameMin: Cijk_Ailk_Bljk_I8II_BH_MT128x128x32_MI16x16x16x1_SN_1LDSB0_GRVW16_IU1_LPB32_PLR1_SIA1_SU32_SUS256_SVW4_VW4_WGM8
    SolutionIndex: 97
    SolutionNameMin: Cijk_Ailk_Bljk_I8II_BH_MT128x128x32_MI16x16x16x1_SN_1LDSB1_GRVW16_IU2_LPB32_PLR1_SIA2_SU32_SUS256_SVW2_VW2_WGM8
    SolutionIndex: 98
    SolutionNameMin: Cijk_Ailk_Bljk_I8II_BH_MT128x128x32_MI16x16x16x1_SN_1LDSB0_GRVW16_IU1_LPB32_PLR0_SIA3_SU32_SUS256_SVW2_VW2_WGM8
    SolutionIndex: 99
    SolutionNameMin: Cijk_Ailk_Bljk_I8II_BH_MT128x128x32_MI16x16x16x1_SN_1LDSB0_GRVW16_IU1_LPB32_PLR1_SIA3_SU32_SUS256_SVW2_VW2_WGM8
    SolutionIndex: 100
    SolutionNameMin: Cijk_Ailk_Bljk_I8II_BH_MT128x128x32_MI16x16x16x1_SN_1LDSB0_GRVW16_IU1_LPB32_PLR1_SIA3_SU32_SUS256_SVW4_VW4_WGM8
- - - [64, 64, 1, 64, 96, 96, 96, 96]
    - [1, 36.4646]
  - - [64, 64, 1, 128, 96, 96, 160, 160]
    - [18, 61.6157]
  - - [64, 64, 1, 256, 96, 96, 288, 288]
    - [16, 106.357]
  - - [64, 64, 1, 512, 96, 96, 544, 544]
    - [57, 165.953]
  - - [64, 64, 1, 1024, 96, 96, 1056, 1056]
    - [56, 234.804]
  - - [64, 64, 1, 2048, 96, 96, 2080, 2080]
    - [57, 302.751]
  - - [64, 64, 1, 4096, 96, 96, 4128, 4128]
    - [69, 342.009]
  - - [64, 128, 1, 64, 96, 96, 96, 96]
    - [27, 66.9845]
  - - [64, 128, 1, 128, 96, 96, 160, 160]
    - [16, 122.971]
  - - [64, 128, 1, 256, 96, 96, 288, 288]
    - [50, 212.456]
  - - [64, 128, 1, 512, 96, 96, 544, 544]
    - [10, 333.729]
  - - [64, 128, 1, 1024, 96, 96, 1056, 1056]
    - [56, 475.114]
  - - [64, 128, 1, 2048, 96, 96, 2080, 2080]
    - [56, 603.736]
  - - [64, 128, 1, 4096, 96, 96, 4128, 4128]
    - [56, 678.073]
  - - [64, 256, 1, 64, 96, 96, 96, 96]
    - [30, 152.987]
  - - [64, 256, 1, 128, 96, 96, 160, 160]
    - [9, 279.807]
  - - [64, 256, 1, 256, 96, 96, 288, 288]
    - [56, 462.133]
  - - [64, 256, 1, 512, 96, 96, 544, 544]
    - [56, 729.254]
  - - [64, 256, 1, 1024, 96, 96, 1056, 1056]
    - [57, 1005.11]
  - - [64, 256, 1, 2048, 96, 96, 2080, 2080]
    - [69, 1263.73]
  - - [64, 256, 1, 4096, 96, 96, 4128, 4128]
    - [87, 1426.73]
  - - [64, 512, 1, 64, 96, 96, 96, 96]
    - [86, 327.937]
  - - [64, 512, 1, 128, 96, 96, 160, 160]
    - [56, 598.93]
  - - [64, 512, 1, 256, 96, 96, 288, 288]
    - [69, 1017.66]
  - - [64, 512, 1, 512, 96, 96, 544, 544]
    - [56, 1569.43]
  - - [64, 512, 1, 1024, 96, 96, 1056, 1056]
    - [95, 2130.17]
  - - [64, 512, 1, 2048, 96, 96, 2080, 2080]
    - [69, 2585.39]
  - - [64, 512, 1, 4096, 96, 96, 4128, 4128]
    - [56, 2898.37]
  - - [64, 1024, 1, 64, 96, 96, 96, 96]
    - [69, 678.363]
  - - [64, 1024, 1, 128, 96, 96, 160, 160]
    - [79, 1226.4]
  - - [64, 1024, 1, 256, 96, 96, 288, 288]
    - [15, 2020.87]
  - - [64, 1024, 1, 512, 96, 96, 544, 544]
    - [79, 3073.6]
  - - [64, 1024, 1, 1024, 96, 96, 1056, 1056]
    - [79, 4307.93]
  - - [64, 1024, 1, 2048, 96, 96, 2080, 2080]
    - [56, 5174.17]
  - - [64, 1024, 1, 4096, 96, 96, 4128, 4128]
    - [69, 5820.88]
  - - [64, 2048, 1, 64, 96, 96, 96, 96]
    - [95, 1267.74]
  - - [64, 2048, 1, 128, 96, 96, 160, 160]
    - [86, 2280.75]
  - - [64, 2048, 1, 256, 96, 96, 288, 288]
    - [79, 3761.3]
  - - [64, 2048, 1, 512, 96, 96, 544, 544]
    - [95, 5872.85]
  - - [64, 2048, 1, 1024, 96, 96, 1056, 1056]
    - [69, 8268.72]
  - - [64, 2048, 1, 2048, 96, 96, 2080, 2080]
    - [62, 10099.5]
  - - [64, 2048, 1, 4096, 96, 96, 4128, 4128]
    - [69, 11490.8]
  - - [64, 4096, 1, 64, 96, 96, 96, 96]
    - [32, 2119.67]
  - - [64, 4096, 1, 128, 96, 96, 160, 160]
    - [2, 3783.77]
  - - [64, 4096, 1, 256, 96, 96, 288, 288]
    - [33, 6294.81]
  - - [64, 4096, 1, 512, 96, 96, 544, 544]
    - [47, 9922.23]
  - - [64, 4096, 1, 1024, 96, 96, 1056, 1056]
    - [21, 13753.9]
  - - [64, 4096, 1, 2048, 96, 96, 2080, 2080]
    - [50, 17211.9]
  - - [64, 4096, 1, 4096, 96, 96, 4128, 4128]
    - [21, 18627.1]
  - - [128, 64, 1, 64, 160, 160, 128, 96]
    - [4, 64.0156]
  - - [128, 64, 1, 128, 160, 160, 160, 160]
    - [27, 122.943]
  - - [128, 64, 1, 256, 160, 160, 288, 288]
    - [27, 212.37]
  - - [128, 64, 1, 512, 160, 160, 544, 544]
    - [79, 326.837]
  - - [128, 64, 1, 1024, 160, 160, 1056, 1056]
    - [57, 482.27]
  - - [128, 64, 1, 2048, 160, 160, 2080, 2080]
    - [63, 600.667]
  - - [128, 64, 1, 4096, 160, 160, 4128, 4128]
    - [96, 681.212]
  - - [128, 128, 1, 64, 160, 160, 128, 96]
    - [25, 182.742]
  - - [128, 128, 1, 128, 160, 160, 160, 160]
    - [31, 334.154]
  - - [128, 128, 1, 256, 160, 160, 288, 288]
    - [96, 534.715]
  - - [128, 128, 1, 512, 160, 160, 544, 544]
    - [87, 821.929]
  - - [128, 128, 1, 1024, 160, 160, 1056, 1056]
    - [63, 1099.14]
  - - [128, 128, 1, 2048, 160, 160, 2080, 2080]
    - [87, 1311.03]
  - - [128, 128, 1, 4096, 160, 160, 4128, 4128]
    - [63, 1468.5]
  - - [128, 256, 1, 64, 160, 160, 128, 96]
    - [31, 395.316]
  - - [128, 256, 1, 128, 160, 160, 160, 160]
    - [29, 697.076]
  - - [128, 256, 1, 256, 160, 160, 288, 288]
    - [87, 1106.39]
  - - [128, 256, 1, 512, 160, 160, 544, 544]
    - [56, 1663.09]
  - - [128, 256, 1, 1024, 160, 160, 1056, 1056]
    - [96, 2274.88]
  - - [128, 256, 1, 2048, 160, 160, 2080, 2080]
    - [87, 2670.79]
  - - [128, 256, 1, 4096, 160, 160, 4128, 4128]
    - [96, 2961.36]
  - - [128, 512, 1, 64, 160, 160, 128, 96]
    - [57, 807.529]
  - - [128, 512, 1, 128, 160, 160, 160, 160]
    - [87, 1425.43]
  - - [128, 512, 1, 256, 160, 160, 288, 288]
    - [10, 2310.91]
  - - [128, 512, 1, 512, 160, 160, 544, 544]
    - [69, 3390.72]
  - - [128, 512, 1, 1024, 160, 160, 1056, 1056]
    - [87, 4593.04]
  - - [128, 512, 1, 2048, 160, 160, 2080, 2080]
    - [57, 5393.53]
  - - [128, 512, 1, 4096, 160, 160, 4128, 4128]
    - [69, 5953.86]
  - - [128, 1024, 1, 64, 160, 160, 128, 96]
    - [86, 1467.31]
  - - [128, 1024, 1, 128, 160, 160, 160, 160]
    - [80, 2616.13]
  - - [128, 1024, 1, 256, 160, 160, 288, 288]
    - [57, 4378.2]
  - - [128, 1024, 1, 512, 160, 160, 544, 544]
    - [70, 6425.61]
  - - [128, 1024, 1, 1024, 160, 160, 1056, 1056]
    - [70, 8702.45]
  - - [128, 1024, 1, 2048, 160, 160, 2080, 2080]
    - [87, 10634.9]
  - - [128, 1024, 1, 4096, 160, 160, 4128, 4128]
    - [57, 11760.6]
  - - [128, 2048, 1, 64, 160, 160, 128, 96]
    - [56, 2577.15]
  - - [128, 2048, 1, 128, 160, 160, 160, 160]
    - [73, 4849.64]
  - - [128, 2048, 1, 256, 160, 160, 288, 288]
    - [69, 7956.94]
  - - [128, 2048, 1, 512, 160, 160, 544, 544]
    - [70, 12220.5]
  - - [128, 2048, 1, 1024, 160, 160, 1056, 1056]
    - [96, 16674.0]
  - - [128, 2048, 1, 2048, 160, 160, 2080, 2080]
    - [96, 20479.6]
  - - [128, 2048, 1, 4096, 160, 160, 4128, 4128]
    - [95, 23351.4]
  - - [128, 4096, 1, 64, 160, 160, 128, 96]
    - [56, 4976.19]
  - - [128, 4096, 1, 128, 160, 160, 160, 160]
    - [54, 9346.64]
  - - [128, 4096, 1, 256, 160, 160, 288, 288]
    - [19, 14421.2]
  - - [128, 4096, 1, 512, 160, 160, 544, 544]
    - [97, 22911.9]
  - - [128, 4096, 1, 1024, 160, 160, 1056, 1056]
    - [52, 30915.1]
  - - [128, 4096, 1, 2048, 160, 160, 2080, 2080]
    - [2, 36468.6]
  - - [128, 4096, 1, 4096, 160, 160, 4128, 4128]
    - [2, 38064.5]
  - - [256, 64, 1, 64, 288, 288, 256, 96]
    - [2, 162.823]
  - - [256, 64, 1, 128, 288, 288, 256, 160]
    - [15, 268.419]
  - - [256, 64, 1, 256, 288, 288, 288, 288]
    - [56, 460.356]
  - - [256, 64, 1, 512, 288, 288, 544, 544]
    - [56, 746.185]
  - - [256, 64, 1, 1024, 288, 288, 1056, 1056]
    - [56, 1014.71]
  - - [256, 64, 1, 2048, 288, 288, 2080, 2080]
    - [96, 1275.69]
  - - [256, 64, 1, 4096, 288, 288, 4128, 4128]
    - [69, 1422.28]
  - - [256, 128, 1, 64, 288, 288, 256, 96]
    - [43, 391.698]
  - - [256, 128, 1, 128, 288, 288, 256, 160]
    - [31, 694.306]
  - - [256, 128, 1, 256, 288, 288, 288, 288]
    - [56, 1155.94]
  - - [256, 128, 1, 512, 288, 288, 544, 544]
    - [56, 1719.68]
  - - [256, 128, 1, 1024, 288, 288, 1056, 1056]
    - [69, 2227.02]
  - - [256, 128, 1, 2048, 288, 288, 2080, 2080]
    - [79, 2702.74]
  - - [256, 128, 1, 4096, 288, 288, 4128, 4128]
    - [95, 2980.24]
  - - [256, 256, 1, 64, 288, 288, 256, 96]
    - [96, 754.782]
  - - [256, 256, 1, 128, 288, 288, 256, 160]
    - [69, 1347.57]
  - - [256, 256, 1, 256, 288, 288, 288, 288]
    - [69, 2257.73]
  - - [256, 256, 1, 512, 288, 288, 544, 544]
    - [86, 3482.93]
  - - [256, 256, 1, 1024, 288, 288, 1056, 1056]
    - [69, 4517.6]
  - - [256, 256, 1, 2048, 288, 288, 2080, 2080]
    - [96, 5444.5]
  - - [256, 256, 1, 4096, 288, 288, 4128, 4128]
    - [86, 6009.98]
  - - [256, 512, 1, 64, 288, 288, 256, 96]
    - [28, 1443.08]
  - - [256, 512, 1, 128, 288, 288, 256, 160]
    - [95, 2505.93]
  - - [256, 512, 1, 256, 288, 288, 288, 288]
    - [87, 4221.21]
  - - [256, 512, 1, 512, 288, 288, 544, 544]
    - [87, 6617.58]
  - - [256, 512, 1, 1024, 288, 288, 1056, 1056]
    - [56, 8807.54]
  - - [256, 512, 1, 2048, 288, 288, 2080, 2080]
    - [96, 10603.8]
  - - [256, 512, 1, 4096, 288, 288, 4128, 4128]
    - [80, 11754.9]
  - - [256, 1024, 1, 64, 288, 288, 256, 96]
    - [11, 2571.61]
  - - [256, 1024, 1, 128, 288, 288, 256, 160]
    - [12, 4605.96]
  - - [256, 1024, 1, 256, 288, 288, 288, 288]
    - [69, 7776.23]
  - - [256, 1024, 1, 512, 288, 288, 544, 544]
    - [69, 12336.2]
  - - [256, 1024, 1, 1024, 288, 288, 1056, 1056]
    - [70, 16512.0]
  - - [256, 1024, 1, 2048, 288, 288, 2080, 2080]
    - [86, 20510.8]
  - - [256, 1024, 1, 4096, 288, 288, 4128, 4128]
    - [95, 23165.5]
  - - [256, 2048, 1, 64, 288, 288, 256, 96]
    - [95, 4740.67]
  - - [256, 2048, 1, 128, 288, 288, 256, 160]
    - [35, 8823.15]
  - - [256, 2048, 1, 256, 288, 288, 288, 288]
    - [24, 14671.9]
  - - [256, 2048, 1, 512, 288, 288, 544, 544]
    - [38, 22021.0]
  - - [256, 2048, 1, 1024, 288, 288, 1056, 1056]
    - [88, 29947.7]
  - - [256, 2048, 1, 2048, 288, 288, 2080, 2080]
    - [44, 36415.3]
  - - [256, 2048, 1, 4096, 288, 288, 4128, 4128]
    - [2, 38295.3]
  - - [256, 4096, 1, 64, 288, 288, 256, 96]
    - [86, 9478.65]
  - - [256, 4096, 1, 128, 288, 288, 256, 160]
    - [89, 15957.4]
  - - [256, 4096, 1, 256, 288, 288, 288, 288]
    - [19, 22608.9]
  - - [256, 4096, 1, 512, 288, 288, 544, 544]
    - [76, 29594.4]
  - - [256, 4096, 1, 1024, 288, 288, 1056, 1056]
    - [61, 35018.7]
  - - [256, 4096, 1, 2048, 288, 288, 2080, 2080]
    - [91, 37462.2]
  - - [256, 4096, 1, 4096, 288, 288, 4128, 4128]
    - [99, 40120.4]
  - - [384, 64, 1, 64, 416, 416, 384, 96]
    - [14, 251.017]
  - - [384, 64, 1, 128, 416, 416, 384, 160]
    - [26, 431.394]
  - - [384, 64, 1, 256, 416, 416, 384, 288]
    - [98, 720.836]
  - - [384, 64, 1, 512, 416, 416, 544, 544]
    - [56, 1145.88]
  - - [384, 64, 1, 1024, 416, 416, 1056, 1056]
    - [56, 1550.19]
  - - [384, 64, 1, 2048, 416, 416, 2080, 2080]
    - [56, 1936.95]
  - - [384, 64, 1, 4096, 416, 416, 4128, 4128]
    - [56, 2150.38]
  - - [384, 128, 1, 64, 416, 416, 384, 96]
    - [87, 596.689]
  - - [384, 128, 1, 128, 416, 416, 384, 160]
    - [87, 1058.64]
  - - [384, 128, 1, 256, 416, 416, 384, 288]
    - [13, 1729.85]
  - - [384, 128, 1, 512, 416, 416, 544, 544]
    - [69, 2614.63]
  - - [384, 128, 1, 1024, 416, 416, 1056, 1056]
    - [87, 3348.52]
  - - [384, 128, 1, 2048, 416, 416, 2080, 2080]
    - [62, 4071.32]
  - - [384, 128, 1, 4096, 416, 416, 4128, 4128]
    - [69, 4475.92]
  - - [384, 256, 1, 64, 416, 416, 384, 96]
    - [57, 1101.83]
  - - [384, 256, 1, 128, 416, 416, 384, 160]
    - [70, 2065.83]
  - - [384, 256, 1, 256, 416, 416, 384, 288]
    - [56, 3419.27]
  - - [384, 256, 1, 512, 416, 416, 544, 544]
    - [70, 5109.31]
  - - [384, 256, 1, 1024, 416, 416, 1056, 1056]
    - [86, 6658.08]
  - - [384, 256, 1, 2048, 416, 416, 2080, 2080]
    - [87, 8087.04]
  - - [384, 256, 1, 4096, 416, 416, 4128, 4128]
    - [87, 8924.45]
  - - [384, 512, 1, 64, 416, 416, 384, 96]
    - [70, 1954.78]
  - - [384, 512, 1, 128, 416, 416, 384, 160]
    - [63, 3559.52]
  - - [384, 512, 1, 256, 416, 416, 384, 288]
    - [63, 6024.14]
  - - [384, 512, 1, 512, 416, 416, 544, 544]
    - [57, 9550.6]
  - - [384, 512, 1, 1024, 416, 416, 1056, 1056]
    - [70, 12682.8]
  - - [384, 512, 1, 2048, 416, 416, 2080, 2080]
    - [80, 15623.1]
  - - [384, 512, 1, 4096, 416, 416, 4128, 4128]
    - [79, 17438.4]
  - - [384, 1024, 1, 64, 416, 416, 384, 96]
    - [96, 4041.42]
  - - [384, 1024, 1, 128, 416, 416, 384, 160]
    - [42, 7122.09]
  - - [384, 1024, 1, 256, 416, 416, 384, 288]
    - [53, 11299.1]
  - - [384, 1024, 1, 512, 416, 416, 544, 544]
    - [23, 17297.6]
  - - [384, 1024, 1, 1024, 416, 416, 1056, 1056]
    - [5, 22698.8]
  - - [384, 1024, 1, 2048, 416, 416, 2080, 2080]
    - [53, 27014.7]
  - - [384, 1024, 1, 4096, 416, 416, 4128, 4128]
    - [51, 28693.8]
  - - [384, 2048, 1, 64, 416, 416, 384, 96]
    - [87, 7737.38]
  - - [384, 2048, 1, 128, 416, 416, 384, 160]
    - [89, 13477.5]
  - - [384, 2048, 1, 256, 416, 416, 384, 288]
    - [52, 20140.8]
  - - [384, 2048, 1, 512, 416, 416, 544, 544]
    - [76, 27226.6]
  - - [384, 2048, 1, 1024, 416, 416, 1056, 1056]
    - [75, 34287.3]
  - - [384, 2048, 1, 2048, 416, 416, 2080, 2080]
    - [75, 36698.3]
  - - [384, 2048, 1, 4096, 416, 416, 4128, 4128]
    - [66, 39379.8]
  - - [384, 4096, 1, 64, 416, 416, 384, 96]
    - [94, 12294.0]
  - - [384, 4096, 1, 128, 416, 416, 384, 160]
    - [92, 19603.4]
  - - [384, 4096, 1, 256, 416, 416, 384, 288]
    - [67, 26502.6]
  - - [384, 4096, 1, 512, 416, 416, 544, 544]
    - [3, 32352.0]
  - - [384, 4096, 1, 1024, 416, 416, 1056, 1056]
    - [24, 35150.1]
  - - [384, 4096, 1, 2048, 416, 416, 2080, 2080]
    - [5, 38319.7]
  - - [384, 4096, 1, 4096, 416, 416, 4128, 4128]
    - [0, 39902.5]
  - - [768, 64, 1, 64, 800, 800, 768, 96]
    - [3, 521.336]
  - - [768, 64, 1, 128, 800, 800, 768, 160]
    - [69, 911.937]
  - - [768, 64, 1, 256, 800, 800, 768, 288]
    - [95, 1548.48]
  - - [768, 64, 1, 512, 800, 800, 768, 544]
    - [69, 2366.99]
  - - [768, 64, 1, 1024, 800, 800, 1056, 1056]
    - [95, 3198.91]
  - - [768, 64, 1, 2048, 800, 800, 2080, 2080]
    - [86, 3854.62]
  - - [768, 64, 1, 4096, 800, 800, 4128, 4128]
    - [95, 4325.24]
  - - [768, 128, 1, 64, 800, 800, 768, 96]
    - [56, 1136.87]
  - - [768, 128, 1, 128, 800, 800, 768, 160]
    - [70, 2036.41]
  - - [768, 128, 1, 256, 800, 800, 768, 288]
    - [17, 3333.67]
  - - [768, 128, 1, 512, 800, 800, 768, 544]
    - [56, 4946.6]
  - - [768, 128, 1, 1024, 800, 800, 1056, 1056]
    - [87, 6696.17]
  - - [768, 128, 1, 2048, 800, 800, 2080, 2080]
    - [87, 7940.01]
  - - [768, 128, 1, 4096, 800, 800, 4128, 4128]
    - [70, 8809.26]
  - - [768, 256, 1, 64, 800, 800, 768, 96]
    - [57, 1955.69]
  - - [768, 256, 1, 128, 800, 800, 768, 160]
    - [56, 3699.22]
  - - [768, 256, 1, 256, 800, 800, 768, 288]
    - [40, 6082.41]
  - - [768, 256, 1, 512, 800, 800, 768, 544]
    - [62, 9286.28]
  - - [768, 256, 1, 1024, 800, 800, 1056, 1056]
    - [87, 12858.6]
  - - [768, 256, 1, 2048, 800, 800, 2080, 2080]
    - [62, 15355.6]
  - - [768, 256, 1, 4096, 800, 800, 4128, 4128]
    - [62, 17321.8]
  - - [768, 512, 1, 64, 800, 800, 768, 96]
    - [69, 3629.35]
  - - [768, 512, 1, 128, 800, 800, 768, 160]
    - [41, 7139.24]
  - - [768, 512, 1, 256, 800, 800, 768, 288]
    - [8, 10793.8]
  - - [768, 512, 1, 512, 800, 800, 768, 544]
    - [71, 16843.2]
  - - [768, 512, 1, 1024, 800, 800, 1056, 1056]
    - [46, 22742.4]
  - - [768, 512, 1, 2048, 800, 800, 2080, 2080]
    - [2, 26940.6]
  - - [768, 512, 1, 4096, 800, 800, 4128, 4128]
    - [24, 28935.1]
  - - [768, 1024, 1, 64, 800, 800, 768, 96]
    - [86, 8121.94]
  - - [768, 1024, 1, 128, 800, 800, 768, 160]
    - [89, 13502.8]
  - - [768, 1024, 1, 256, 800, 800, 768, 288]
    - [91, 20195.3]
  - - [768, 1024, 1, 512, 800, 800, 768, 544]
    - [91, 27929.1]
  - - [768, 1024, 1, 1024, 800, 800, 1056, 1056]
    - [91, 33825.1]
  - - [768, 1024, 1, 2048, 800, 800, 2080, 2080]
    - [91, 36410.4]
  - - [768, 1024, 1, 4096, 800, 800, 4128, 4128]
    - [91, 39323.6]
  - - [768, 2048, 1, 64, 800, 800, 768, 96]
    - [84, 12286.5]
  - - [768, 2048, 1, 128, 800, 800, 768, 160]
    - [35, 19217.9]
  - - [768, 2048, 1, 256, 800, 800, 768, 288]
    - [50, 25969.3]
  - - [768, 2048, 1, 512, 800, 800, 768, 544]
    - [75, 33185.3]
  - - [768, 2048, 1, 1024, 800, 800, 1056, 1056]
    - [75, 35955.2]
  - - [768, 2048, 1, 2048, 800, 800, 2080, 2080]
    - [75, 39112.5]
  - - [768, 2048, 1, 4096, 800, 800, 4128, 4128]
    - [75, 41087.1]
  - - [768, 4096, 1, 64, 800, 800, 768, 96]
    - [90, 17225.1]
  - - [768, 4096, 1, 128, 800, 800, 768, 160]
    - [93, 24667.9]
  - - [768, 4096, 1, 256, 800, 800, 768, 288]
    - [93, 31551.0]
  - - [768, 4096, 1, 512, 800, 800, 768, 544]
    - [91, 35398.1]
  - - [768, 4096, 1, 1024, 800, 800, 1056, 1056]
    - [91, 38977.7]
  - - [768, 4096, 1, 2048, 800, 800, 2080, 2080]
    - [75, 41188.8]
  - - [768, 4096, 1, 4096, 800, 800, 4128, 4128]
    - [75, 41797.4]
  - - [1536, 64, 1, 64, 1568, 1568, 1536, 96]
    - [3, 962.585]
  - - [1536, 64, 1, 128, 1568, 1568, 1536, 160]
    - [95, 1767.76]
  - - [1536, 64, 1, 256, 1568, 1568, 1536, 288]
    - [79, 3030.94]
  - - [1536, 64, 1, 512, 1568, 1568, 1536, 544]
    - [56, 4549.96]
  - - [1536, 64, 1, 1024, 1568, 1568, 1536, 1056]
    - [79, 6253.55]
  - - [1536, 64, 1, 2048, 1568, 1568, 2080, 2080]
    - [86, 7565.26]
  - - [1536, 64, 1, 4096, 1568, 1568, 4128, 4128]
    - [80, 8153.03]
  - - [1536, 128, 1, 64, 1568, 1568, 1536, 96]
    - [30, 1928.43]
  - - [1536, 128, 1, 128, 1568, 1568, 1536, 160]
    - [62, 3691.63]
  - - [1536, 128, 1, 256, 1568, 1568, 1536, 288]
    - [62, 6226.1]
  - - [1536, 128, 1, 512, 1568, 1568, 1536, 544]
    - [86, 9224.16]
  - - [1536, 128, 1, 1024, 1568, 1568, 1536, 1056]
    - [69, 12645.3]
  - - [1536, 128, 1, 2048, 1568, 1568, 2080, 2080]
    - [96, 15299.0]
  - - [1536, 128, 1, 4096, 1568, 1568, 4128, 4128]
    - [70, 17380.5]
  - - [1536, 256, 1, 64, 1568, 1568, 1536, 96]
    - [48, 3743.81]
  - - [1536, 256, 1, 128, 1568, 1568, 1536, 160]
    - [34, 6733.33]
  - - [1536, 256, 1, 256, 1568, 1568, 1536, 288]
    - [71, 11227.2]
  - - [1536, 256, 1, 512, 1568, 1568, 1536, 544]
    - [44, 16777.3]
  - - [1536, 256, 1, 1024, 1568, 1568, 1536, 1056]
    - [88, 22415.7]
  - - [1536, 256, 1, 2048, 1568, 1568, 2080, 2080]
    - [3, 27039.1]
  - - [1536, 256, 1, 4096, 1568, 1568, 4128, 4128]
    - [22, 28858.4]
  - - [1536, 512, 1, 64, 1568, 1568, 1536, 96]
    - [95, 8089.34]
  - - [1536, 512, 1, 128, 1568, 1568, 1536, 160]
    - [72, 13493.8]
  - - [1536, 512, 1, 256, 1568, 1568, 1536, 288]
    - [82, 19548.2]
  - - [1536, 512, 1, 512, 1568, 1568, 1536, 544]
    - [91, 28024.4]
  - - [1536, 512, 1, 1024, 1568, 1568, 1536, 1056]
    - [75, 33843.5]
  - - [1536, 512, 1, 2048, 1568, 1568, 2080, 2080]
    - [91, 36464.0]
  - - [1536, 512, 1, 4096, 1568, 1568, 4128, 4128]
    - [60, 39425.1]
  - - [1536, 1024, 1, 64, 1568, 1568, 1536, 96]
    - [78, 12372.6]
  - - [1536, 1024, 1, 128, 1568, 1568, 1536, 160]
    - [36, 19315.7]
  - - [1536, 1024, 1, 256, 1568, 1568, 1536, 288]
    - [36, 26011.2]
  - - [1536, 1024, 1, 512, 1568, 1568, 1536, 544]
    - [75, 33351.6]
  - - [1536, 1024, 1, 1024, 1568, 1568, 1536, 1056]
    - [75, 36068.0]
  - - [1536, 1024, 1, 2048, 1568, 1568, 2080, 2080]
    - [75, 39152.5]
  - - [1536, 1024, 1, 4096, 1568, 1568, 4128, 4128]
    - [75, 41098.1]
  - - [1536, 2048, 1, 64, 1568, 1568, 1536, 96]
    - [78, 16872.9]
  - - [1536, 2048, 1, 128, 1568, 1568, 1536, 160]
    - [78, 24683.0]
  - - [1536, 2048, 1, 256, 1568, 1568, 1536, 288]
    - [93, 31600.6]
  - - [1536, 2048, 1, 512, 1568, 1568, 1536, 544]
    - [75, 35412.1]
  - - [1536, 2048, 1, 1024, 1568, 1568, 1536, 1056]
    - [75, 39036.7]
  - - [1536, 2048, 1, 2048, 1568, 1568, 2080, 2080]
    - [75, 41217.2]
  - - [1536, 2048, 1, 4096, 1568, 1568, 4128, 4128]
    - [75, 41741.7]
  - - [1536, 4096, 1, 64, 1568, 1568, 1536, 96]
    - [98, 21902.4]
  - - [1536, 4096, 1, 128, 1568, 1568, 1536, 160]
    - [36, 29299.9]
  - - [1536, 4096, 1, 256, 1568, 1568, 1536, 288]
    - [36, 33728.7]
  - - [1536, 4096, 1, 512, 1568, 1568, 1536, 544]
    - [75, 38410.1]
  - - [1536, 4096, 1, 1024, 1568, 1568, 1536, 1056]
    - [75, 40913.8]
  - - [1536, 4096, 1, 2048, 1568, 1568, 2080, 2080]
    - [75, 41475.7]
  - - [1536, 4096, 1, 4096, 1568, 1568, 4128, 4128]
    - [61, 41726.0]
  - - [3072, 64, 1, 64, 3104, 3104, 3072, 96]
    - [48, 1550.39]
  - - [3072, 64, 1, 128, 3104, 3104, 3072, 160]
    - [33, 3030.93]
  - - [3072, 64, 1, 256, 3104, 3104, 3072, 288]
    - [26, 5128.05]
  - - [3072, 64, 1, 512, 3104, 3104, 3072, 544]
    - [21, 7643.38]
  - - [3072, 64, 1, 1024, 3104, 3104, 3072, 1056]
    - [50, 10644.3]
  - - [3072, 64, 1, 2048, 3104, 3104, 3072, 2080]
    - [9, 12953.7]
  - - [3072, 64, 1, 4096, 3104, 3104, 4128, 4128]
    - [21, 14306.7]
  - - [3072, 128, 1, 64, 3104, 3104, 3072, 96]
    - [55, 3807.81]
  - - [3072, 128, 1, 128, 3104, 3104, 3072, 160]
    - [9, 6232.25]
  - - [3072, 128, 1, 256, 3104, 3104, 3072, 288]
    - [52, 10402.4]
  - - [3072, 128, 1, 512, 3104, 3104, 3072, 544]
    - [37, 17426.3]
  - - [3072, 128, 1, 1024, 3104, 3104, 3072, 1056]
    - [6, 22940.6]
  - - [3072, 128, 1, 2048, 3104, 3104, 3072, 2080]
    - [39, 27226.6]
  - - [3072, 128, 1, 4096, 3104, 3104, 4128, 4128]
    - [45, 28950.2]
  - - [3072, 256, 1, 64, 3104, 3104, 3072, 96]
    - [86, 7738.57]
  - - [3072, 256, 1, 128, 3104, 3104, 3072, 160]
    - [77, 13586.6]
  - - [3072, 256, 1, 256, 3104, 3104, 3072, 288]
    - [35, 20181.1]
  - - [3072, 256, 1, 512, 3104, 3104, 3072, 544]
    - [100, 27539.4]
  - - [3072, 256, 1, 1024, 3104, 3104, 3072, 1056]
    - [76, 34329.7]
  - - [3072, 256, 1, 2048, 3104, 3104, 3072, 2080]
    - [60, 36726.7]
  - - [3072, 256, 1, 4096, 3104, 3104, 4128, 4128]
    - [82, 39650.8]
  - - [3072, 512, 1, 64, 3104, 3104, 3072, 96]
    - [77, 11863.7]
  - - [3072, 512, 1, 128, 3104, 3104, 3072, 160]
    - [77, 18996.7]
  - - [3072, 512, 1, 256, 3104, 3104, 3072, 288]
    - [50, 26614.7]
  - - [3072, 512, 1, 512, 3104, 3104, 3072, 544]
    - [76, 32837.5]
  - - [3072, 512, 1, 1024, 3104, 3104, 3072, 1056]
    - [75, 35822.5]
  - - [3072, 512, 1, 2048, 3104, 3104, 3072, 2080]
    - [60, 39309.2]
  - - [3072, 512, 1, 4096, 3104, 3104, 4128, 4128]
    - [91, 40947.9]
  - - [3072, 1024, 1, 64, 3104, 3104, 3072, 96]
    - [74, 17251.6]
  - - [3072, 1024, 1, 128, 3104, 3104, 3072, 160]
    - [93, 25246.3]
  - - [3072, 1024, 1, 256, 3104, 3104, 3072, 288]
    - [20, 31507.8]
  - - [3072, 1024, 1, 512, 3104, 3104, 3072, 544]
    - [75, 35200.1]
  - - [3072, 1024, 1, 1024, 3104, 3104, 3072, 1056]
    - [75, 39209.7]
  - - [3072, 1024, 1, 2048, 3104, 3104, 3072, 2080]
    - [75, 41255.5]
  - - [3072, 1024, 1, 4096, 3104, 3104, 4128, 4128]
    - [60, 41762.8]
  - - [3072, 2048, 1, 64, 3104, 3104, 3072, 96]
    - [81, 21704.1]
  - - [3072, 2048, 1, 128, 3104, 3104, 3072, 160]
    - [85, 29683.3]
  - - [3072, 2048, 1, 256, 3104, 3104, 3072, 288]
    - [82, 33793.9]
  - - [3072, 2048, 1, 512, 3104, 3104, 3072, 544]
    - [99, 38315.6]
  - - [3072, 2048, 1, 1024, 3104, 3104, 3072, 1056]
    - [75, 40925.8]
  - - [3072, 2048, 1, 2048, 3104, 3104, 3072, 2080]
    - [60, 41684.5]
  - - [3072, 2048, 1, 4096, 3104, 3104, 4128, 4128]
    - [75, 41418.4]
  - - [3072, 4096, 1, 64, 3104, 3104, 3072, 96]
    - [64, 6641.44]
  - - [3072, 4096, 1, 128, 3104, 3104, 3072, 160]
    - [65, 12983.6]
  - - [3072, 4096, 1, 256, 3104, 3104, 3072, 288]
    - [65, 25239.4]
  - - [3072, 4096, 1, 512, 3104, 3104, 3072, 544]
    - [63, 38579.9]
  - - [3072, 4096, 1, 1024, 3104, 3104, 3072, 1056]
    - [67, 40575.1]
  - - [3072, 4096, 1, 2048, 3104, 3104, 3072, 2080]
    - [75, 41624.3]
  - - [3072, 4096, 1, 4096, 3104, 3104, 4128, 4128]
    - [76, 41686.9]
  - - [4096, 64, 1, 64, 4128, 4128, 4096, 96]
    - [9, 2286.04]
  - - [4096, 64, 1, 128, 4128, 4128, 4096, 160]
    - [7, 4202.71]
  - - [4096, 64, 1, 256, 4128, 4128, 4096, 288]
    - [33, 7061.14]
  - - [4096, 64, 1, 512, 4128, 4128, 4096, 544]
    - [47, 11003.3]
  - - [4096, 64, 1, 1024, 4128, 4128, 4096, 1056]
    - [14, 14683.8]
  - - [4096, 64, 1, 2048, 4128, 4128, 4096, 2080]
    - [3, 17541.4]
  - - [4096, 64, 1, 4096, 4128, 4128, 4128, 4128]
    - [2, 18721.0]
  - - [4096, 128, 1, 64, 4128, 4128, 4096, 96]
    - [15, 4943.93]
  - - [4096, 128, 1, 128, 4128, 4128, 4096, 160]
    - [49, 9607.64]
  - - [4096, 128, 1, 256, 4128, 4128, 4096, 288]
    - [35, 14687.9]
  - - [4096, 128, 1, 512, 4128, 4128, 4096, 544]
    - [97, 22601.3]
  - - [4096, 128, 1, 1024, 4128, 4128, 4096, 1056]
    - [5, 30625.9]
  - - [4096, 128, 1, 2048, 4128, 4128, 4096, 2080]
    - [3, 36577.9]
  - - [4096, 128, 1, 4096, 4128, 4128, 4128, 4128]
    - [2, 38162.6]
  - - [4096, 256, 1, 64, 4128, 4128, 4096, 96]
    - [69, 9396.37]
  - - [4096, 256, 1, 128, 4128, 4128, 4096, 160]
    - [72, 16176.7]
  - - [4096, 256, 1, 256, 4128, 4128, 4096, 288]
    - [35, 22869.0]
  - - [4096, 256, 1, 512, 4128, 4128, 4096, 544]
    - [66, 30585.8]
  - - [4096, 256, 1, 1024, 4128, 4128, 4096, 1056]
    - [91, 35786.7]
  - - [4096, 256, 1, 2048, 4128, 4128, 4096, 2080]
    - [75, 37887.2]
  - - [4096, 256, 1, 4096, 4128, 4128, 4128, 4128]
    - [99, 40129.4]
  - - [4096, 512, 1, 64, 4128, 4128, 4096, 96]
    - [52, 14114.8]
  - - [4096, 512, 1, 128, 4128, 4128, 4096, 160]
    - [59, 21877.4]
  - - [4096, 512, 1, 256, 4128, 4128, 4096, 288]
    - [83, 28425.4]
  - - [4096, 512, 1, 512, 4128, 4128, 4096, 544]
    - [60, 35024.4]
  - - [4096, 512, 1, 1024, 4128, 4128, 4096, 1056]
    - [91, 37284.7]
  - - [4096, 512, 1, 2048, 4128, 4128, 4096, 2080]
    - [75, 40275.0]
  - - [4096, 512, 1, 4096, 4128, 4128, 4128, 4128]
    - [60, 41785.8]
  - - [4096, 1024, 1, 64, 4128, 4128, 4096, 96]
    - [35, 18693.3]
  - - [4096, 1024, 1, 128, 4128, 4128, 4096, 160]
    - [85, 26867.8]
  - - [4096, 1024, 1, 256, 4128, 4128, 4096, 288]
    - [35, 33306.7]
  - - [4096, 1024, 1, 512, 4128, 4128, 4096, 544]
    - [60, 36590.3]
  - - [4096, 1024, 1, 1024, 4128, 4128, 4096, 1056]
    - [60, 39935.4]
  - - [4096, 1024, 1, 2048, 4128, 4128, 4096, 2080]
    - [75, 41775.6]
  - - [4096, 1024, 1, 4096, 4128, 4128, 4128, 4128]
    - [35, 41003.6]
  - - [4096, 2048, 1, 64, 4128, 4128, 4096, 96]
    - [90, 22677.7]
  - - [4096, 2048, 1, 128, 4128, 4128, 4096, 160]
    - [68, 30743.4]
  - - [4096, 2048, 1, 256, 4128, 4128, 4096, 288]
    - [50, 34783.9]
  - - [4096, 2048, 1, 512, 4128, 4128, 4096, 544]
    - [52, 38051.7]
  - - [4096, 2048, 1, 1024, 4128, 4128, 4096, 1056]
    - [56, 40550.6]
  - - [4096, 2048, 1, 2048, 4128, 4128, 4096, 2080]
    - [61, 41121.9]
  - - [4096, 2048, 1, 4096, 4128, 4128, 4128, 4128]
    - [76, 42286.6]
  - - [4096, 4096, 1, 64, 4128, 4128, 4096, 96]
    - [58, 6883.54]
  - - [4096, 4096, 1, 128, 4128, 4128, 4096, 160]
    - [58, 13780.3]
  - - [4096, 4096, 1, 256, 4128, 4128, 4096, 288]
    - [65, 26062.2]
  - - [4096, 4096, 1, 512, 4128, 4128, 4096, 544]
    - [63, 39162.5]
  - - [4096, 4096, 1, 1024, 4128, 4128, 4096, 1056]
    - [3, 40101.9]
  - - [4096, 4096, 1, 2048, 4128, 4128, 4096, 2080]
    - [76, 41557.7]
  - - [4096, 4096, 1, 4096, 4128, 4128, 4128, 4128]
    - [76, 41818.3]
- null
- null
- DeviceEfficiency
