library/src/blas3/Tensile/Logic/asm_full/navi33/navi33_Cijk_Alik_Bjlk_I8II_BH_GB.yaml
- {MinimumRequiredVersion: 4.35.0}
- navi33
- gfx1102
- [Device 73f0]
    SolutionIndex: 0
    SolutionNameMin: Cijk_Alik_Bjlk_I8II_BH_MT128x128x16_MI16x16x16x1_SN_1LDSB0_GRVW8_IU1_LPA32_PLR0_SIA1_SU0_SUS0_SVW2_VW2_WGM1
    SolutionIndex: 1
    SolutionNameMin: Cijk_Alik_Bjlk_I8II_BH_MT128x128x16_MI16x16x16x1_SN_1LDSB0_GRVW8_IU1_LPA32_PLR1_SIA1_SU0_SUS0_SVW2_VW2_WGM1
    SolutionIndex: 2
    SolutionNameMin: Cijk_Alik_Bjlk_I8II_BH_MT128x128x16_MI16x16x16x1_SN_1LDSB0_GRVW8_IU1_LPA32_PLR1_SIA1_SU0_SUS0_SVW4_VW4_WGM1
    SolutionIndex: 3
    SolutionNameMin: Cijk_Alik_Bjlk_I8II_BH_MT128x128x16_MI16x16x16x1_SN_1LDSB0_GRVW16_IU1_LPA32_PLR1_SIA1_SU0_SUS0_SVW2_VW2_WGM1
    SolutionIndex: 4
    SolutionNameMin: Cijk_Alik_Bjlk_I8II_BH_MT128x128x16_MI16x16x16x1_SN_1LDSB1_GRVW8_IU1_LPA32_PLR1_SIA2_SU0_SUS0_SVW2_VW2_WGM1
    SolutionIndex: 5
    SolutionNameMin: Cijk_Alik_Bjlk_I8II_BH_MT128x128x16_MI16x16x16x1_SN_1LDSB1_GRVW8_IU1_LPA32_PLR1_SIA2_SU0_SUS0_SVW4_VW4_WGM1
    SolutionIndex: 6
    SolutionNameMin: Cijk_Alik_Bjlk_I8II_BH_MT128x128x16_MI16x16x16x1_SN_1LDSB1_GRVW16_IU1_LPA32_PLR1_SIA2_SU0_SUS0_SVW2_VW2_WGM1
    SolutionIndex: 7
    SolutionNameMin: Cijk_Alik_Bjlk_I8II_BH_MT128x128x16_MI16x16x16x1_SN_1LDSB1_GRVW16_IU1_LPA32_PLR1_SIA2_SU0_SUS0_SVW4_VW4_WGM1
    SolutionIndex: 8
    SolutionNameMin: Cijk_Alik_Bjlk_I8II_BH_MT128x128x16_MI16x16x16x1_SN_1LDSB0_GRVW16_IU1_LPA32_PLR1_SIA3_SU0_SUS0_SVW4_VW4_WGM1
    SolutionIndex: 9
    SolutionNameMin: Cijk_Alik_Bjlk_I8II_BH_MT128x128x16_MI16x16x16x1_SN_1LDSB1_GRVW8_IU1_LPA32_PLR1_SIA2_SU32_SUS256_SVW2_VW2_WGM1
    SolutionIndex: 10
    SolutionNameMin: Cijk_Alik_Bjlk_I8II_BH_MT128x128x16_MI16x16x16x1_SN_1LDSB1_GRVW16_IU1_LPA32_PLR1_SIA2_SU32_SUS256_SVW2_VW2_WGM1
    SolutionIndex: 11
    SolutionNameMin: Cijk_Alik_Bjlk_I8II_BH_MT128x128x16_MI16x16x16x1_SN_1LDSB0_GRVW16_IU1_LPA32_PLR0_SIA3_SU32_SUS256_SVW2_VW2_WGM1
    SolutionIndex: 12
    SolutionNameMin: Cijk_Alik_Bjlk_I8II_BH_MT128x128x16_MI16x16x16x1_SN_1LDSB0_GRVW16_IU1_LPA32_PLR1_SIA3_SU32_SUS256_SVW2_VW2_WGM1
    SolutionIndex: 13
    SolutionNameMin: Cijk_Alik_Bjlk_I8II_BH_MT128x128x16_MI16x16x16x1_SN_1LDSB0_GRVW16_IU1_LPA32_PLR0_SIA1_SU0_SUS0_SVW2_VW2_WGM4
    SolutionIndex: 14
    SolutionNameMin: Cijk_Alik_Bjlk_I8II_BH_MT128x128x16_MI16x16x16x1_SN_1LDSB1_GRVW8_IU1_LPA32_PLR1_SIA2_SU0_SUS0_SVW2_VW2_WGM4
    SolutionIndex: 15
    SolutionNameMin: Cijk_Alik_Bjlk_I8II_BH_MT128x128x16_MI16x16x16x1_SN_1LDSB1_GRVW16_IU1_LPA32_PLR1_SIA2_SU0_SUS0_SVW2_VW2_WGM4
    SolutionIndex: 16
    SolutionNameMin: Cijk_Alik_Bjlk_I8II_BH_MT128x128x16_MI16x16x16x1_SN_1LDSB1_GRVW16_IU1_LPA32_PLR1_SIA2_SU0_SUS0_SVW4_VW4_WGM4
    SolutionIndex: 17
    SolutionNameMin: Cijk_Alik_Bjlk_I8II_BH_MT128x128x16_MI16x16x16x1_SN_1LDSB0_GRVW16_IU1_LPA32_PLR0_SIA3_SU0_SUS0_SVW4_VW4_WGM4
    SolutionIndex: 18
    SolutionNameMin: Cijk_Alik_Bjlk_I8II_BH_MT128x128x16_MI16x16x16x1_SN_1LDSB0_GRVW16_IU1_LPA32_PLR1_SIA3_SU0_SUS0_SVW2_VW2_WGM4
    SolutionIndex: 19
    SolutionNameMin: Cijk_Alik_Bjlk_I8II_BH_MT128x128x16_MI16x16x16x1_SN_1LDSB0_GRVW8_IU1_LPA8_PLR1_SIA1_SU32_SUS256_SVW4_VW4_WGM4
    SolutionIndex: 20
    SolutionNameMin: Cijk_Alik_Bjlk_I8II_BH_MT128x128x16_MI16x16x16x1_SN_1LDSB1_GRVW8_IU1_LPA32_PLR1_SIA2_SU32_SUS256_SVW2_VW2_WGM4
    SolutionIndex: 21
    SolutionNameMin: Cijk_Alik_Bjlk_I8II_BH_MT128x128x16_MI16x16x16x1_SN_1LDSB1_GRVW8_IU1_LPA32_PLR1_SIA2_SU32_SUS256_SVW4_VW4_WGM4
    SolutionIndex: 22
    SolutionNameMin: Cijk_Alik_Bjlk_I8II_BH_MT128x128x16_MI16x16x16x1_SN_1LDSB0_GRVW16_IU1_LPA32_PLR0_SIA3_SU32_SUS256_SVW2_VW2_WGM4
    SolutionIndex: 23
    SolutionNameMin: Cijk_Alik_Bjlk_I8II_BH_MT128x128x16_MI16x16x16x1_SN_1LDSB0_GRVW16_IU1_LPA32_PLR0_SIA1_SU0_SUS0_SVW2_VW2_WGM8
    SolutionIndex: 24
    SolutionNameMin: Cijk_Alik_Bjlk_I8II_BH_MT128x128x16_MI16x16x16x1_SN_1LDSB0_GRVW16_IU1_LPA32_PLR1_SIA1_SU0_SUS0_SVW2_VW2_WGM8
    SolutionIndex: 25
    SolutionNameMin: Cijk_Alik_Bjlk_I8II_BH_MT128x128x16_MI16x16x16x1_SN_1LDSB1_GRVW8_IU1_LPA32_PLR1_SIA2_SU0_SUS0_SVW2_VW2_WGM8
    SolutionIndex: 26
    SolutionNameMin: Cijk_Alik_Bjlk_I8II_BH_MT128x128x16_MI16x16x16x1_SN_1LDSB1_GRVW8_IU1_LPA32_PLR1_SIA2_SU0_SUS0_SVW4_VW4_WGM8
    SolutionIndex: 27
    SolutionNameMin: Cijk_Alik_Bjlk_I8II_BH_MT128x128x16_MI16x16x16x1_SN_1LDSB1_GRVW16_IU1_LPA32_PLR1_SIA2_SU0_SUS0_SVW2_VW2_WGM8
    SolutionIndex: 28
    SolutionNameMin: Cijk_Alik_Bjlk_I8II_BH_MT128x128x16_MI16x16x16x1_SN_1LDSB1_GRVW16_IU1_LPA32_PLR1_SIA2_SU0_SUS0_SVW4_VW4_WGM8
    SolutionIndex: 29
    SolutionNameMin: Cijk_Alik_Bjlk_I8II_BH_MT128x128x16_MI16x16x16x1_SN_1LDSB0_GRVW16_IU1_LPA32_PLR1_SIA3_SU0_SUS0_SVW2_VW2_WGM8
    SolutionIndex: 30
    SolutionNameMin: Cijk_Alik_Bjlk_I8II_BH_MT128x128x16_MI16x16x16x1_SN_1LDSB0_GRVW8_IU1_LPA8_PLR0_SIA1_SU32_SUS256_SVW4_VW4_WGM8
    SolutionIndex: 31
    SolutionNameMin: Cijk_Alik_Bjlk_I8II_BH_MT128x128x16_MI16x16x16x1_SN_1LDSB1_GRVW8_IU1_LPA32_PLR1_SIA2_SU32_SUS256_SVW2_VW2_WGM8
    SolutionIndex: 32
    SolutionNameMin: Cijk_Alik_Bjlk_I8II_BH_MT128x128x16_MI16x16x16x1_SN_1LDSB1_GRVW8_IU1_LPA32_PLR1_SIA2_SU32_SUS256_SVW4_VW4_WGM8
    SolutionIndex: 33
    SolutionNameMin: Cijk_Alik_Bjlk_I8II_BH_MT128x128x16_MI16x16x16x1_SN_1LDSB1_GRVW16_IU1_LPA32_PLR1_SIA2_SU32_SUS256_SVW2_VW2_WGM8
    SolutionIndex: 34
    SolutionNameMin: Cijk_Alik_Bjlk_I8II_BH_MT128x128x16_MI16x16x16x1_SN_1LDSB1_GRVW16_IU1_LPA32_PLR1_SIA2_SU32_SUS256_SVW4_VW4_WGM8
    SolutionIndex: 35
    SolutionNameMin: Cijk_Alik_Bjlk_I8II_BH_MT128x128x16_MI16x16x16x1_SN_1LDSB0_GRVW16_IU1_LPA32_PLR1_SIA3_SU32_SUS256_SVW2_VW2_WGM8
    SolutionIndex: 36
    SolutionNameMin: Cijk_Alik_Bjlk_I8II_BH_MT128x128x32_MI16x16x16x1_SN_1LDSB0_GRVW8_IU1_LPA32_PLR0_SIA1_SU0_SUS0_SVW2_VW2_WGM1
    SolutionIndex: 37
    SolutionNameMin: Cijk_Alik_Bjlk_I8II_BH_MT128x128x32_MI16x16x16x1_SN_1LDSB0_GRVW8_IU1_LPA32_PLR0_SIA1_SU0_SUS0_SVW4_VW4_WGM1
    SolutionIndex: 38
    SolutionNameMin: Cijk_Alik_Bjlk_I8II_BH_MT128x128x32_MI16x16x16x1_SN_1LDSB0_GRVW16_IU1_LPA32_PLR0_SIA1_SU0_SUS0_SVW2_VW2_WGM1
    SolutionIndex: 39
    SolutionNameMin: Cijk_Alik_Bjlk_I8II_BH_MT128x128x32_MI16x16x16x1_SN_1LDSB0_GRVW16_IU1_LPA32_PLR0_SIA1_SU0_SUS0_SVW4_VW4_WGM1
    SolutionIndex: 40
    SolutionNameMin: Cijk_Alik_Bjlk_I8II_BH_MT128x128x32_MI16x16x16x1_SN_1LDSB0_GRVW16_IU1_LPA32_PLR1_SIA1_SU0_SUS0_SVW2_VW2_WGM1
    SolutionIndex: 41
    SolutionNameMin: Cijk_Alik_Bjlk_I8II_BH_MT128x128x32_MI16x16x16x1_SN_1LDSB0_GRVW16_IU1_LPA32_PLR1_SIA1_SU0_SUS0_SVW4_VW4_WGM1
    SolutionIndex: 42
    SolutionNameMin: Cijk_Alik_Bjlk_I8II_BH_MT128x128x32_MI16x16x16x1_SN_1LDSB1_GRVW16_IU2_LPA32_PLR1_SIA2_SU0_SUS0_SVW2_VW2_WGM1
    SolutionIndex: 43
    SolutionNameMin: Cijk_Alik_Bjlk_I8II_BH_MT128x128x32_MI16x16x16x1_SN_1LDSB1_GRVW16_IU2_LPA32_PLR1_SIA2_SU0_SUS0_SVW4_VW4_WGM1
    SolutionIndex: 44
    SolutionNameMin: Cijk_Alik_Bjlk_I8II_BH_MT128x128x32_MI16x16x16x1_SN_1LDSB0_GRVW16_IU1_LPA32_PLR0_SIA3_SU0_SUS0_SVW2_VW2_WGM1
    SolutionIndex: 45
    SolutionNameMin: Cijk_Alik_Bjlk_I8II_BH_MT128x128x32_MI16x16x16x1_SN_1LDSB0_GRVW16_IU1_LPA32_PLR0_SIA3_SU0_SUS0_SVW4_VW4_WGM1
    SolutionIndex: 46
    SolutionNameMin: Cijk_Alik_Bjlk_I8II_BH_MT128x128x32_MI16x16x16x1_SN_1LDSB0_GRVW16_IU1_LPA32_PLR1_SIA3_SU0_SUS0_SVW2_VW2_WGM1
    SolutionIndex: 47
    SolutionNameMin: Cijk_Alik_Bjlk_I8II_BH_MT128x128x32_MI16x16x16x1_SN_1LDSB0_GRVW16_IU1_LPA32_PLR1_SIA3_SU0_SUS0_SVW4_VW4_WGM1
    SolutionIndex: 48
    SolutionNameMin: Cijk_Alik_Bjlk_I8II_BH_MT128x128x32_MI16x16x16x1_SN_1LDSB0_GRVW8_IU1_LPA32_PLR0_SIA1_SU32_SUS256_SVW2_VW2_WGM1
    SolutionIndex: 49
    SolutionNameMin: Cijk_Alik_Bjlk_I8II_BH_MT128x128x32_MI16x16x16x1_SN_1LDSB0_GRVW8_IU1_LPA32_PLR0_SIA1_SU32_SUS256_SVW4_VW4_WGM1
    SolutionIndex: 50
    SolutionNameMin: Cijk_Alik_Bjlk_I8II_BH_MT128x128x32_MI16x16x16x1_SN_1LDSB0_GRVW16_IU1_LPA32_PLR1_SIA1_SU32_SUS256_SVW2_VW2_WGM1
    SolutionIndex: 51
    SolutionNameMin: Cijk_Alik_Bjlk_I8II_BH_MT128x128x32_MI16x16x16x1_SN_1LDSB0_GRVW16_IU1_LPA32_PLR1_SIA1_SU32_SUS256_SVW4_VW4_WGM1
    SolutionIndex: 52
    SolutionNameMin: Cijk_Alik_Bjlk_I8II_BH_MT128x128x32_MI16x16x16x1_SN_1LDSB1_GRVW16_IU2_LPA32_PLR1_SIA2_SU32_SUS256_SVW2_VW2_WGM1
    SolutionIndex: 53
    SolutionNameMin: Cijk_Alik_Bjlk_I8II_BH_MT128x128x32_MI16x16x16x1_SN_1LDSB1_GRVW16_IU2_LPA8_PLR1_SIA2_SU32_SUS256_SVW4_VW4_WGM1
    SolutionIndex: 54
    SolutionNameMin: Cijk_Alik_Bjlk_I8II_BH_MT128x128x32_MI16x16x16x1_SN_1LDSB0_GRVW16_IU1_LPA32_PLR0_SIA3_SU32_SUS256_SVW4_VW4_WGM1
    SolutionIndex: 55
    SolutionNameMin: Cijk_Alik_Bjlk_I8II_BH_MT128x128x32_MI16x16x16x1_SN_1LDSB0_GRVW16_IU1_LPA32_PLR1_SIA3_SU32_SUS256_SVW2_VW2_WGM1
    SolutionIndex: 56
    SolutionNameMin: Cijk_Alik_Bjlk_I8II_BH_MT128x128x32_MI16x16x16x1_SN_1LDSB0_GRVW8_IU1_LPA32_PLR0_SIA1_SU0_SUS0_SVW4_VW4_WGM4
    SolutionIndex: 57
    SolutionNameMin: Cijk_Alik_Bjlk_I8II_BH_MT128x128x32_MI16x16x16x1_SN_1LDSB0_GRVW16_IU1_LPA32_PLR0_SIA1_SU0_SUS0_SVW2_VW2_WGM4
    SolutionIndex: 58
    SolutionNameMin: Cijk_Alik_Bjlk_I8II_BH_MT128x128x32_MI16x16x16x1_SN_1LDSB0_GRVW16_IU1_LPA32_PLR1_SIA1_SU0_SUS0_SVW2_VW2_WGM4
    SolutionIndex: 59
    SolutionNameMin: Cijk_Alik_Bjlk_I8II_BH_MT128x128x32_MI16x16x16x1_SN_1LDSB0_GRVW16_IU1_LPA32_PLR1_SIA1_SU0_SUS0_SVW4_VW4_WGM4
    SolutionIndex: 60
    SolutionNameMin: Cijk_Alik_Bjlk_I8II_BH_MT128x128x32_MI16x16x16x1_SN_1LDSB1_GRVW16_IU2_LPA32_PLR1_SIA2_SU0_SUS0_SVW2_VW2_WGM4
    SolutionIndex: 61
    SolutionNameMin: Cijk_Alik_Bjlk_I8II_BH_MT128x128x32_MI16x16x16x1_SN_1LDSB0_GRVW16_IU1_LPA32_PLR0_SIA3_SU0_SUS0_SVW2_VW2_WGM4
    SolutionIndex: 62
    SolutionNameMin: Cijk_Alik_Bjlk_I8II_BH_MT128x128x32_MI16x16x16x1_SN_1LDSB0_GRVW16_IU1_LPA32_PLR0_SIA3_SU0_SUS0_SVW4_VW4_WGM4
    SolutionIndex: 63
    SolutionNameMin: Cijk_Alik_Bjlk_I8II_BH_MT128x128x32_MI16x16x16x1_SN_1LDSB0_GRVW16_IU1_LPA32_PLR1_SIA3_SU0_SUS0_SVW2_VW2_WGM4
    SolutionIndex: 64
    SolutionNameMin: Cijk_Alik_Bjlk_I8II_BH_MT128x128x32_MI16x16x16x1_SN_1LDSB0_GRVW16_IU1_LPA32_PLR1_SIA3_SU0_SUS0_SVW4_VW4_WGM4
    SolutionIndex: 65
    SolutionNameMin: Cijk_Alik_Bjlk_I8II_BH_MT128x128x32_MI16x16x16x1_SN_1LDSB0_GRVW8_IU1_LPA32_PLR0_SIA1_SU32_SUS256_SVW2_VW2_WGM4
    SolutionIndex: 66
    SolutionNameMin: Cijk_Alik_Bjlk_I8II_BH_MT128x128x32_MI16x16x16x1_SN_1LDSB0_GRVW8_IU1_LPA32_PLR0_SIA1_SU32_SUS256_SVW4_VW4_WGM4
    SolutionIndex: 67
    SolutionNameMin: Cijk_Alik_Bjlk_I8II_BH_MT128x128x32_MI16x16x16x1_SN_1LDSB0_GRVW16_IU1_LPA32_PLR0_SIA1_SU32_SUS256_SVW2_VW2_WGM4
    SolutionIndex: 68
    SolutionNameMin: Cijk_Alik_Bjlk_I8II_BH_MT128x128x32_MI16x16x16x1_SN_1LDSB0_GRVW16_IU1_LPA32_PLR1_SIA1_SU32_SUS256_SVW2_VW2_WGM4
    SolutionIndex: 69
    SolutionNameMin: Cijk_Alik_Bjlk_I8II_BH_MT128x128x32_MI16x16x16x1_SN_1LDSB0_GRVW16_IU1_LPA32_PLR1_SIA1_SU32_SUS256_SVW4_VW4_WGM4
    SolutionIndex: 70
    SolutionNameMin: Cijk_Alik_Bjlk_I8II_BH_MT128x128x32_MI16x16x16x1_SN_1LDSB1_GRVW16_IU2_LPA32_PLR1_SIA2_SU32_SUS256_SVW2_VW2_WGM4
    SolutionIndex: 71
    SolutionNameMin: Cijk_Alik_Bjlk_I8II_BH_MT128x128x32_MI16x16x16x1_SN_1LDSB0_GRVW16_IU1_LPA32_PLR0_SIA3_SU32_SUS256_SVW4_VW4_WGM4
    SolutionIndex: 72
    SolutionNameMin: Cijk_Alik_Bjlk_I8II_BH_MT128x128x32_MI16x16x16x1_SN_1LDSB0_GRVW16_IU1_LPA32_PLR1_SIA3_SU32_SUS256_SVW2_VW2_WGM4
    SolutionIndex: 73
    SolutionNameMin: Cijk_Alik_Bjlk_I8II_BH_MT128x128x32_MI16x16x16x1_SN_1LDSB0_GRVW8_IU1_LPA32_PLR0_SIA1_SU0_SUS0_SVW2_VW2_WGM8
    SolutionIndex: 74
    SolutionNameMin: Cijk_Alik_Bjlk_I8II_BH_MT128x128x32_MI16x16x16x1_SN_1LDSB0_GRVW8_IU1_LPA32_PLR0_SIA1_SU0_SUS0_SVW4_VW4_WGM8
    SolutionIndex: 75
    SolutionNameMin: Cijk_Alik_Bjlk_I8II_BH_MT128x128x32_MI16x16x16x1_SN_1LDSB0_GRVW16_IU1_LPA32_PLR0_SIA1_SU0_SUS0_SVW2_VW2_WGM8
    SolutionIndex: 76
    SolutionNameMin: Cijk_Alik_Bjlk_I8II_BH_MT128x128x32_MI16x16x16x1_SN_1LDSB0_GRVW16_IU1_LPA32_PLR1_SIA1_SU0_SUS0_SVW2_VW2_WGM8
    SolutionIndex: 77
    SolutionNameMin: Cijk_Alik_Bjlk_I8II_BH_MT128x128x32_MI16x16x16x1_SN_1LDSB0_GRVW16_IU1_LPA32_PLR1_SIA1_SU0_SUS0_SVW4_VW4_WGM8
    SolutionIndex: 78
    SolutionNameMin: Cijk_Alik_Bjlk_I8II_BH_MT128x128x32_MI16x16x16x1_SN_1LDSB1_GRVW16_IU2_LPA32_PLR1_SIA2_SU0_SUS0_SVW2_VW2_WGM8
    SolutionIndex: 79
    SolutionNameMin: Cijk_Alik_Bjlk_I8II_BH_MT128x128x32_MI16x16x16x1_SN_1LDSB1_GRVW16_IU2_LPA32_PLR1_SIA2_SU0_SUS0_SVW4_VW4_WGM8
    SolutionIndex: 80
    SolutionNameMin: Cijk_Alik_Bjlk_I8II_BH_MT128x128x32_MI16x16x16x1_SN_1LDSB0_GRVW16_IU1_LPA32_PLR0_SIA3_SU0_SUS0_SVW4_VW4_WGM8
    SolutionIndex: 81
    SolutionNameMin: Cijk_Alik_Bjlk_I8II_BH_MT128x128x32_MI16x16x16x1_SN_1LDSB0_GRVW16_IU1_LPA32_PLR1_SIA3_SU0_SUS0_SVW2_VW2_WGM8
    SolutionIndex: 82
    SolutionNameMin: Cijk_Alik_Bjlk_I8II_BH_MT128x128x32_MI16x16x16x1_SN_1LDSB0_GRVW16_IU1_LPA32_PLR1_SIA3_SU0_SUS0_SVW4_VW4_WGM8
    SolutionIndex: 83
    SolutionNameMin: Cijk_Alik_Bjlk_I8II_BH_MT128x128x32_MI16x16x16x1_SN_1LDSB0_GRVW8_IU1_LPA32_PLR0_SIA1_SU32_SUS256_SVW2_VW2_WGM8
    SolutionIndex: 84
    SolutionNameMin: Cijk_Alik_Bjlk_I8II_BH_MT128x128x32_MI16x16x16x1_SN_1LDSB0_GRVW8_IU1_LPA32_PLR0_SIA1_SU32_SUS256_SVW4_VW4_WGM8
    SolutionIndex: 85
    SolutionNameMin: Cijk_Alik_Bjlk_I8II_BH_MT128x128x32_MI16x16x16x1_SN_1LDSB0_GRVW16_IU1_LPA32_PLR0_SIA1_SU32_SUS256_SVW2_VW2_WGM8
    SolutionIndex: 86
    SolutionNameMin: Cijk_Alik_Bjlk_I8II_BH_MT128x128x32_MI16x16x16x1_SN_1LDSB0_GRVW16_IU1_LPA32_PLR0_SIA1_SU32_SUS256_SVW4_VW4_WGM8
    SolutionIndex: 87
    SolutionNameMin: Cijk_Alik_Bjlk_I8II_BH_MT128x128x32_MI16x16x16x1_SN_1LDSB0_GRVW16_IU1_LPA32_PLR1_SIA1_SU32_SUS256_SVW2_VW2_WGM8
    SolutionIndex: 88
    SolutionNameMin: Cijk_Alik_Bjlk_I8II_BH_MT128x128x32_MI16x16x16x1_SN_1LDSB0_GRVW16_IU1_LPA32_PLR1_SIA1_SU32_SUS256_SVW4_VW4_WGM8
    SolutionIndex: 89
    SolutionNameMin: Cijk_Alik_Bjlk_I8II_BH_MT128x128x32_MI16x16x16x1_SN_1LDSB1_GRVW16_IU2_LPA32_PLR1_SIA2_SU32_SUS256_SVW2_VW2_WGM8
    SolutionIndex: 90
    SolutionNameMin: Cijk_Alik_Bjlk_I8II_BH_MT128x128x32_MI16x16x16x1_SN_1LDSB1_GRVW16_IU2_LPA32_PLR1_SIA2_SU32_SUS256_SVW4_VW4_WGM8
    SolutionIndex: 91
    SolutionNameMin: Cijk_Alik_Bjlk_I8II_BH_MT128x128x32_MI16x16x16x1_SN_1LDSB0_GRVW16_IU1_LPA32_PLR0_SIA3_SU32_SUS256_SVW2_VW2_WGM8
    SolutionIndex: 92
    SolutionNameMin: Cijk_Alik_Bjlk_I8II_BH_MT128x128x32_MI16x16x16x1_SN_1LDSB0_GRVW16_IU1_LPA32_PLR0_SIA3_SU32_SUS256_SVW4_VW4_WGM8
    SolutionIndex: 93
    SolutionNameMin: Cijk_Alik_Bjlk_I8II_BH_MT128x128x32_MI16x16x16x1_SN_1LDSB0_GRVW16_IU1_LPA32_PLR1_SIA3_SU32_SUS256_SVW2_VW2_WGM8
    SolutionIndex: 94
    SolutionNameMin: Cijk_Alik_Bjlk_I8II_BH_MT128x128x32_MI16x16x16x1_SN_1LDSB0_GRVW16_IU1_LPA32_PLR1_SIA3_SU32_SUS256_SVW4_VW4_WGM8
- - - [64, 64, 1, 64, 96, 96, 96, 96]
    - [2, 36.4343]
  - - [64, 64, 1, 128, 96, 96, 160, 160]
    - [7, 61.0845]
  - - [64, 64, 1, 256, 96, 96, 288, 288]
    - [84, 105.068]
  - - [64, 64, 1, 512, 96, 96, 544, 544]
    - [39, 168.473]
  - - [64, 64, 1, 1024, 96, 96, 1056, 1056]
    - [39, 233.458]
  - - [64, 64, 1, 2048, 96, 96, 2080, 2080]
    - [56, 295.885]
  - - [64, 64, 1, 4096, 96, 96, 4128, 4128]
    - [84, 327.309]
  - - [64, 128, 1, 64, 96, 96, 96, 128]
    - [16, 64.251]
  - - [64, 128, 1, 128, 96, 96, 160, 160]
    - [16, 117.95]
  - - [64, 128, 1, 256, 96, 96, 288, 288]
    - [39, 204.6]
  - - [64, 128, 1, 512, 96, 96, 544, 544]
    - [39, 335.303]
  - - [64, 128, 1, 1024, 96, 96, 1056, 1056]
    - [38, 472.811]
  - - [64, 128, 1, 2048, 96, 96, 2080, 2080]
    - [49, 595.254]
  - - [64, 128, 1, 4096, 96, 96, 4128, 4128]
    - [65, 673.054]
  - - [64, 256, 1, 64, 96, 96, 96, 256]
    - [23, 152.078]
  - - [64, 256, 1, 128, 96, 96, 160, 256]
    - [39, 278.581]
  - - [64, 256, 1, 256, 96, 96, 288, 288]
    - [38, 457.943]
  - - [64, 256, 1, 512, 96, 96, 544, 544]
    - [66, 713.865]
  - - [64, 256, 1, 1024, 96, 96, 1056, 1056]
    - [48, 993.322]
  - - [64, 256, 1, 2048, 96, 96, 2080, 2080]
    - [85, 1234.03]
  - - [64, 256, 1, 4096, 96, 96, 4128, 4128]
    - [36, 1328.6]
  - - [64, 512, 1, 64, 96, 96, 96, 512]
    - [18, 332.409]
  - - [64, 512, 1, 128, 96, 96, 160, 512]
    - [38, 601.852]
  - - [64, 512, 1, 256, 96, 96, 288, 512]
    - [83, 1013.61]
  - - [64, 512, 1, 512, 96, 96, 544, 544]
    - [36, 1501.45]
  - - [64, 512, 1, 1024, 96, 96, 1056, 1056]
    - [65, 2095.58]
  - - [64, 512, 1, 2048, 96, 96, 2080, 2080]
    - [36, 2525.27]
  - - [64, 512, 1, 4096, 96, 96, 4128, 4128]
    - [36, 2673.82]
  - - [64, 1024, 1, 64, 96, 96, 96, 1024]
    - [9, 677.377]
  - - [64, 1024, 1, 128, 96, 96, 160, 1024]
    - [38, 1240.92]
  - - [64, 1024, 1, 256, 96, 96, 288, 1024]
    - [36, 2085.68]
  - - [64, 1024, 1, 512, 96, 96, 544, 1024]
    - [83, 3155.39]
  - - [64, 1024, 1, 1024, 96, 96, 1056, 1056]
    - [73, 4164.9]
  - - [64, 1024, 1, 2048, 96, 96, 2080, 2080]
    - [83, 5128.3]
  - - [64, 1024, 1, 4096, 96, 96, 4128, 4128]
    - [73, 5361.96]
  - - [64, 2048, 1, 64, 96, 96, 96, 2048]
    - [73, 1288.37]
  - - [64, 2048, 1, 128, 96, 96, 160, 2048]
    - [40, 2315.38]
  - - [64, 2048, 1, 256, 96, 96, 288, 2048]
    - [73, 3955.96]
  - - [64, 2048, 1, 512, 96, 96, 544, 2048]
    - [36, 6077.05]
  - - [64, 2048, 1, 1024, 96, 96, 1056, 2048]
    - [73, 8239.27]
  - - [64, 2048, 1, 2048, 96, 96, 2080, 2080]
    - [36, 10096.1]
  - - [64, 2048, 1, 4096, 96, 96, 4128, 4128]
    - [65, 11119.3]
  - - [64, 4096, 1, 64, 96, 96, 96, 4096]
    - [27, 2196.84]
  - - [64, 4096, 1, 128, 96, 96, 160, 4096]
    - [25, 3963.43]
  - - [64, 4096, 1, 256, 96, 96, 288, 4096]
    - [9, 6707.53]
  - - [64, 4096, 1, 512, 96, 96, 544, 4096]
    - [20, 9958.28]
  - - [64, 4096, 1, 1024, 96, 96, 1056, 4096]
    - [31, 13923.7]
  - - [64, 4096, 1, 2048, 96, 96, 2080, 4096]
    - [15, 16947.8]
  - - [64, 4096, 1, 4096, 96, 96, 4128, 4128]
    - [6, 18577.2]
  - - [128, 64, 1, 64, 160, 160, 96, 96]
    - [45, 65.8986]
  - - [128, 64, 1, 128, 160, 160, 160, 160]
    - [6, 122.084]
  - - [128, 64, 1, 256, 160, 160, 288, 288]
    - [6, 203.924]
  - - [128, 64, 1, 512, 160, 160, 544, 544]
    - [87, 323.71]
  - - [128, 64, 1, 1024, 160, 160, 1056, 1056]
    - [41, 466.786]
  - - [128, 64, 1, 2048, 160, 160, 2080, 2080]
    - [40, 585.368]
  - - [128, 64, 1, 4096, 160, 160, 4128, 4128]
    - [58, 666.477]
  - - [128, 128, 1, 64, 160, 160, 96, 128]
    - [28, 181.857]
  - - [128, 128, 1, 128, 160, 160, 160, 160]
    - [8, 315.456]
  - - [128, 128, 1, 256, 160, 160, 288, 288]
    - [39, 517.304]
  - - [128, 128, 1, 512, 160, 160, 544, 544]
    - [77, 802.816]
  - - [128, 128, 1, 1024, 160, 160, 1056, 1056]
    - [59, 1046.42]
  - - [128, 128, 1, 2048, 160, 160, 2080, 2080]
    - [76, 1282.07]
  - - [128, 128, 1, 4096, 160, 160, 4128, 4128]
    - [51, 1338.97]
  - - [128, 256, 1, 64, 160, 160, 96, 256]
    - [39, 392.138]
  - - [128, 256, 1, 128, 160, 160, 160, 256]
    - [39, 691.901]
  - - [128, 256, 1, 256, 160, 160, 288, 288]
    - [85, 1136.05]
  - - [128, 256, 1, 512, 160, 160, 544, 544]
    - [69, 1683.28]
  - - [128, 256, 1, 1024, 160, 160, 1056, 1056]
    - [88, 2160.48]
  - - [128, 256, 1, 2048, 160, 160, 2080, 2080]
    - [69, 2618.27]
  - - [128, 256, 1, 4096, 160, 160, 4128, 4128]
    - [51, 2759.92]
  - - [128, 512, 1, 64, 160, 160, 96, 512]
    - [39, 799.376]
  - - [128, 512, 1, 128, 160, 160, 160, 512]
    - [38, 1419.4]
  - - [128, 512, 1, 256, 160, 160, 288, 512]
    - [58, 2233.09]
  - - [128, 512, 1, 512, 160, 160, 544, 544]
    - [51, 3434.44]
  - - [128, 512, 1, 1024, 160, 160, 1056, 1056]
    - [51, 4356.59]
  - - [128, 512, 1, 2048, 160, 160, 2080, 2080]
    - [59, 5244.93]
  - - [128, 512, 1, 4096, 160, 160, 4128, 4128]
    - [58, 5382.06]
  - - [128, 1024, 1, 64, 160, 160, 96, 1024]
    - [39, 1395.54]
  - - [128, 1024, 1, 128, 160, 160, 160, 1024]
    - [74, 2626.36]
  - - [128, 1024, 1, 256, 160, 160, 288, 1024]
    - [58, 4353.2]
  - - [128, 1024, 1, 512, 160, 160, 544, 1024]
    - [41, 6514.17]
  - - [128, 1024, 1, 1024, 160, 160, 1056, 1056]
    - [88, 8419.13]
  - - [128, 1024, 1, 2048, 160, 160, 2080, 2080]
    - [58, 10179.2]
  - - [128, 1024, 1, 4096, 160, 160, 4128, 4128]
    - [59, 11117.0]
  - - [128, 2048, 1, 64, 160, 160, 96, 2048]
    - [39, 2496.98]
  - - [128, 2048, 1, 128, 160, 160, 160, 2048]
    - [57, 4718.67]
  - - [128, 2048, 1, 256, 160, 160, 288, 2048]
    - [39, 7982.5]
  - - [128, 2048, 1, 512, 160, 160, 544, 2048]
    - [41, 11752.9]
  - - [128, 2048, 1, 1024, 160, 160, 1056, 2048]
    - [88, 16233.4]
  - - [128, 2048, 1, 2048, 160, 160, 2080, 2080]
    - [36, 19544.6]
  - - [128, 2048, 1, 4096, 160, 160, 4128, 4128]
    - [59, 21654.6]
  - - [128, 4096, 1, 64, 160, 160, 96, 4096]
    - [38, 5001.44]
  - - [128, 4096, 1, 128, 160, 160, 160, 4096]
    - [27, 8921.68]
  - - [128, 4096, 1, 256, 160, 160, 288, 4096]
    - [79, 15829.4]
  - - [128, 4096, 1, 512, 160, 160, 544, 4096]
    - [24, 23407.3]
  - - [128, 4096, 1, 1024, 160, 160, 1056, 4096]
    - [21, 31119.4]
  - - [128, 4096, 1, 2048, 160, 160, 2080, 4096]
    - [79, 35971.3]
  - - [128, 4096, 1, 4096, 160, 160, 4128, 4128]
    - [5, 37787.9]
  - - [256, 64, 1, 64, 288, 288, 96, 96]
    - [1, 155.115]
  - - [256, 64, 1, 128, 288, 288, 160, 160]
    - [37, 276.305]
  - - [256, 64, 1, 256, 288, 288, 288, 288]
    - [36, 470.69]
  - - [256, 64, 1, 512, 288, 288, 544, 544]
    - [87, 736.618]
  - - [256, 64, 1, 1024, 288, 288, 1056, 1056]
    - [76, 1003.78]
  - - [256, 64, 1, 2048, 288, 288, 2080, 2080]
    - [58, 1221.32]
  - - [256, 64, 1, 4096, 288, 288, 4128, 4128]
    - [41, 1317.31]
  - - [256, 128, 1, 64, 288, 288, 96, 128]
    - [38, 388.006]
  - - [256, 128, 1, 128, 288, 288, 160, 160]
    - [27, 685.68]
  - - [256, 128, 1, 256, 288, 288, 288, 288]
    - [76, 1130.84]
  - - [256, 128, 1, 512, 288, 288, 544, 544]
    - [51, 1695.7]
  - - [256, 128, 1, 1024, 288, 288, 1056, 1056]
    - [88, 2208.55]
  - - [256, 128, 1, 2048, 288, 288, 2080, 2080]
    - [58, 2580.72]
  - - [256, 128, 1, 4096, 288, 288, 4128, 4128]
    - [87, 2733.01]
  - - [256, 256, 1, 64, 288, 288, 96, 256]
    - [58, 791.83]
  - - [256, 256, 1, 128, 288, 288, 160, 256]
    - [6, 1378.57]
  - - [256, 256, 1, 256, 288, 288, 288, 288]
    - [41, 2204.05]
  - - [256, 256, 1, 512, 288, 288, 544, 544]
    - [50, 3314.35]
  - - [256, 256, 1, 1024, 288, 288, 1056, 1056]
    - [50, 4472.43]
  - - [256, 256, 1, 2048, 288, 288, 2080, 2080]
    - [69, 5192.58]
  - - [256, 256, 1, 4096, 288, 288, 4128, 4128]
    - [68, 5359.49]
  - - [256, 512, 1, 64, 288, 288, 96, 512]
    - [17, 1435.18]
  - - [256, 512, 1, 128, 288, 288, 160, 512]
    - [67, 2498.84]
  - - [256, 512, 1, 256, 288, 288, 288, 512]
    - [77, 4343.62]
  - - [256, 512, 1, 512, 288, 288, 544, 544]
    - [50, 6528.73]
  - - [256, 512, 1, 1024, 288, 288, 1056, 1056]
    - [87, 8487.27]
  - - [256, 512, 1, 2048, 288, 288, 2080, 2080]
    - [69, 10229.6]
  - - [256, 512, 1, 4096, 288, 288, 4128, 4128]
    - [40, 11111.4]
  - - [256, 1024, 1, 64, 288, 288, 96, 1024]
    - [57, 2614.09]
  - - [256, 1024, 1, 128, 288, 288, 160, 1024]
    - [44, 4717.36]
  - - [256, 1024, 1, 256, 288, 288, 288, 1024]
    - [58, 7728.76]
  - - [256, 1024, 1, 512, 288, 288, 544, 1024]
    - [50, 12248.4]
  - - [256, 1024, 1, 1024, 288, 288, 1056, 1056]
    - [69, 16189.3]
  - - [256, 1024, 1, 2048, 288, 288, 2080, 2080]
    - [58, 19777.2]
  - - [256, 1024, 1, 4096, 288, 288, 4128, 4128]
    - [40, 21984.4]
  - - [256, 2048, 1, 64, 288, 288, 96, 2048]
    - [60, 5004.41]
  - - [256, 2048, 1, 128, 288, 288, 160, 2048]
    - [15, 8882.71]
  - - [256, 2048, 1, 256, 288, 288, 288, 2048]
    - [6, 14686.3]
  - - [256, 2048, 1, 512, 288, 288, 544, 2048]
    - [21, 23356.5]
  - - [256, 2048, 1, 1024, 288, 288, 1056, 2048]
    - [78, 30780.4]
  - - [256, 2048, 1, 2048, 288, 288, 2080, 2080]
    - [6, 35913.5]
  - - [256, 2048, 1, 4096, 288, 288, 4128, 4128]
    - [31, 37662.0]
  - - [256, 4096, 1, 64, 288, 288, 96, 4096]
    - [50, 9097.04]
  - - [256, 4096, 1, 128, 288, 288, 160, 4096]
    - [85, 15353.2]
  - - [256, 4096, 1, 256, 288, 288, 288, 4096]
    - [63, 22876.8]
  - - [256, 4096, 1, 512, 288, 288, 544, 4096]
    - [81, 30093.7]
  - - [256, 4096, 1, 1024, 288, 288, 1056, 4096]
    - [55, 35581.5]
  - - [256, 4096, 1, 2048, 288, 288, 2080, 4096]
    - [63, 37636.2]
  - - [256, 4096, 1, 4096, 288, 288, 4128, 4128]
    - [93, 40145.2]
  - - [384, 64, 1, 64, 416, 416, 96, 96]
    - [0, 237.557]
  - - [384, 64, 1, 128, 416, 416, 160, 160]
    - [67, 427.525]
  - - [384, 64, 1, 256, 416, 416, 288, 288]
    - [68, 727.59]
  - - [384, 64, 1, 512, 416, 416, 544, 544]
    - [68, 1096.26]
  - - [384, 64, 1, 1024, 416, 416, 1056, 1056]
    - [87, 1486.9]
  - - [384, 64, 1, 2048, 416, 416, 2080, 2080]
    - [76, 1850.63]
  - - [384, 64, 1, 4096, 416, 416, 4128, 4128]
    - [59, 1979.19]
  - - [384, 128, 1, 64, 416, 416, 96, 128]
    - [41, 594.993]
  - - [384, 128, 1, 128, 416, 416, 160, 160]
    - [39, 1042.32]
  - - [384, 128, 1, 256, 416, 416, 288, 288]
    - [6, 1692.39]
  - - [384, 128, 1, 512, 416, 416, 544, 544]
    - [51, 2483.31]
  - - [384, 128, 1, 1024, 416, 416, 1056, 1056]
    - [88, 3348.08]
  - - [384, 128, 1, 2048, 416, 416, 2080, 2080]
    - [76, 3905.62]
  - - [384, 128, 1, 4096, 416, 416, 4128, 4128]
    - [40, 4033.15]
  - - [384, 256, 1, 64, 416, 416, 96, 256]
    - [76, 1156.52]
  - - [384, 256, 1, 128, 416, 416, 160, 256]
    - [39, 2067.52]
  - - [384, 256, 1, 256, 416, 416, 288, 288]
    - [41, 3255.18]
  - - [384, 256, 1, 512, 416, 416, 544, 544]
    - [51, 4899.89]
  - - [384, 256, 1, 1024, 416, 416, 1056, 1056]
    - [50, 6593.95]
  - - [384, 256, 1, 2048, 416, 416, 2080, 2080]
    - [88, 7707.46]
  - - [384, 256, 1, 4096, 416, 416, 4128, 4128]
    - [88, 8029.62]
  - - [384, 512, 1, 64, 416, 416, 96, 512]
    - [86, 2072.28]
  - - [384, 512, 1, 128, 416, 416, 160, 512]
    - [85, 3562.05]
  - - [384, 512, 1, 256, 416, 416, 288, 512]
    - [51, 6016.21]
  - - [384, 512, 1, 512, 416, 416, 544, 544]
    - [88, 9195.51]
  - - [384, 512, 1, 1024, 416, 416, 1056, 1056]
    - [51, 12683.6]
  - - [384, 512, 1, 2048, 416, 416, 2080, 2080]
    - [87, 15155.6]
  - - [384, 512, 1, 4096, 416, 416, 4128, 4128]
    - [88, 16740.3]
  - - [384, 1024, 1, 64, 416, 416, 96, 1024]
    - [30, 3623.07]
  - - [384, 1024, 1, 128, 416, 416, 160, 1024]
    - [28, 6477.69]
  - - [384, 1024, 1, 256, 416, 416, 288, 1024]
    - [90, 11132.9]
  - - [384, 1024, 1, 512, 416, 416, 544, 1024]
    - [32, 17228.0]
  - - [384, 1024, 1, 1024, 416, 416, 1056, 1056]
    - [26, 22142.1]
  - - [384, 1024, 1, 2048, 416, 416, 2080, 2080]
    - [34, 26662.3]
  - - [384, 1024, 1, 4096, 416, 416, 4128, 4128]
    - [90, 28382.4]
  - - [384, 2048, 1, 64, 416, 416, 96, 2048]
    - [77, 8056.93]
  - - [384, 2048, 1, 128, 416, 416, 160, 2048]
    - [75, 13508.3]
  - - [384, 2048, 1, 256, 416, 416, 288, 2048]
    - [81, 19806.0]
  - - [384, 2048, 1, 512, 416, 416, 544, 2048]
    - [81, 28038.0]
  - - [384, 2048, 1, 1024, 416, 416, 1056, 2048]
    - [81, 33376.4]
  - - [384, 2048, 1, 2048, 416, 416, 2080, 2080]
    - [93, 36319.3]
  - - [384, 2048, 1, 4096, 416, 416, 4128, 4128]
    - [93, 38891.5]
  - - [384, 4096, 1, 64, 416, 416, 96, 4096]
    - [74, 11956.7]
  - - [384, 4096, 1, 128, 416, 416, 160, 4096]
    - [73, 19519.7]
  - - [384, 4096, 1, 256, 416, 416, 288, 4096]
    - [85, 26332.7]
  - - [384, 4096, 1, 512, 416, 416, 544, 4096]
    - [13, 31788.8]
  - - [384, 4096, 1, 1024, 416, 416, 1056, 4096]
    - [74, 34219.6]
  - - [384, 4096, 1, 2048, 416, 416, 2080, 4096]
    - [73, 37183.3]
  - - [384, 4096, 1, 4096, 416, 416, 4128, 4128]
    - [41, 38906.3]
  - - [768, 64, 1, 64, 800, 800, 96, 96]
    - [3, 518.842]
  - - [768, 64, 1, 128, 800, 800, 160, 160]
    - [36, 858.785]
  - - [768, 64, 1, 256, 800, 800, 288, 288]
    - [36, 1516.56]
  - - [768, 64, 1, 512, 800, 800, 544, 544]
    - [76, 2285.93]
  - - [768, 64, 1, 1024, 800, 800, 1056, 1056]
    - [59, 3034.95]
  - - [768, 64, 1, 2048, 800, 800, 2080, 2080]
    - [40, 3732.01]
  - - [768, 64, 1, 4096, 800, 800, 4128, 4128]
    - [58, 3974.32]
  - - [768, 128, 1, 64, 800, 800, 96, 128]
    - [76, 1141.62]
  - - [768, 128, 1, 128, 800, 800, 160, 160]
    - [38, 2028.19]
  - - [768, 128, 1, 256, 800, 800, 288, 288]
    - [38, 3342.07]
  - - [768, 128, 1, 512, 800, 800, 544, 544]
    - [50, 4851.24]
  - - [768, 128, 1, 1024, 800, 800, 1056, 1056]
    - [77, 6556.16]
  - - [768, 128, 1, 2048, 800, 800, 2080, 2080]
    - [59, 7680.13]
  - - [768, 128, 1, 4096, 800, 800, 4128, 4128]
    - [41, 7994.71]
  - - [768, 256, 1, 64, 800, 800, 96, 256]
    - [85, 2034.42]
  - - [768, 256, 1, 128, 800, 800, 160, 256]
    - [40, 3648.81]
  - - [768, 256, 1, 256, 800, 800, 288, 288]
    - [50, 5934.64]
  - - [768, 256, 1, 512, 800, 800, 544, 544]
    - [50, 9104.88]
  - - [768, 256, 1, 1024, 800, 800, 1056, 1056]
    - [50, 12528.1]
  - - [768, 256, 1, 2048, 800, 800, 2080, 2080]
    - [76, 14913.6]
  - - [768, 256, 1, 4096, 800, 800, 4128, 4128]
    - [76, 16691.3]
  - - [768, 512, 1, 64, 800, 800, 96, 512]
    - [19, 3772.42]
  - - [768, 512, 1, 128, 800, 800, 160, 512]
    - [85, 6467.7]
  - - [768, 512, 1, 256, 800, 800, 288, 512]
    - [20, 10793.8]
  - - [768, 512, 1, 512, 800, 800, 544, 544]
    - [70, 17176.6]
  - - [768, 512, 1, 1024, 800, 800, 1056, 1056]
    - [15, 22504.6]
  - - [768, 512, 1, 2048, 800, 800, 2080, 2080]
    - [31, 27179.7]
  - - [768, 512, 1, 4096, 800, 800, 4128, 4128]
    - [31, 28915.4]
  - - [768, 1024, 1, 64, 800, 800, 96, 1024]
    - [84, 8033.78]
  - - [768, 1024, 1, 128, 800, 800, 160, 1024]
    - [29, 13200.0]
  - - [768, 1024, 1, 256, 800, 800, 288, 1024]
    - [81, 19763.1]
  - - [768, 1024, 1, 512, 800, 800, 544, 1024]
    - [82, 27977.6]
  - - [768, 1024, 1, 1024, 800, 800, 1056, 1056]
    - [93, 33266.1]
  - - [768, 1024, 1, 2048, 800, 800, 2080, 2080]
    - [93, 35939.2]
  - - [768, 1024, 1, 4096, 800, 800, 4128, 4128]
    - [93, 39032.4]
  - - [768, 2048, 1, 64, 800, 800, 96, 2048]
    - [73, 12340.7]
  - - [768, 2048, 1, 128, 800, 800, 160, 2048]
    - [13, 19012.8]
  - - [768, 2048, 1, 256, 800, 800, 288, 2048]
    - [94, 26329.3]
  - - [768, 2048, 1, 512, 800, 800, 544, 2048]
    - [81, 32810.8]
  - - [768, 2048, 1, 1024, 800, 800, 1056, 2048]
    - [93, 35496.4]
  - - [768, 2048, 1, 2048, 800, 800, 2080, 2080]
    - [46, 38748.8]
  - - [768, 2048, 1, 4096, 800, 800, 4128, 4128]
    - [94, 40602.6]
  - - [768, 4096, 1, 64, 800, 800, 96, 4096]
    - [92, 16915.4]
  - - [768, 4096, 1, 128, 800, 800, 160, 4096]
    - [83, 24720.8]
  - - [768, 4096, 1, 256, 800, 800, 288, 4096]
    - [63, 31396.0]
  - - [768, 4096, 1, 512, 800, 800, 544, 4096]
    - [46, 35174.7]
  - - [768, 4096, 1, 1024, 800, 800, 1056, 4096]
    - [63, 39080.7]
  - - [768, 4096, 1, 2048, 800, 800, 2080, 4096]
    - [81, 41196.1]
  - - [768, 4096, 1, 4096, 800, 800, 4128, 4128]
    - [93, 41732.1]
  - - [1536, 64, 1, 64, 1568, 1568, 96, 96]
    - [0, 961.555]
  - - [1536, 64, 1, 128, 1568, 1568, 160, 160]
    - [85, 1732.47]
  - - [1536, 64, 1, 256, 1568, 1568, 288, 288]
    - [87, 2935.82]
  - - [1536, 64, 1, 512, 1568, 1568, 544, 544]
    - [68, 4522.97]
  - - [1536, 64, 1, 1024, 1568, 1568, 1056, 1056]
    - [58, 6027.74]
  - - [1536, 64, 1, 2048, 1568, 1568, 2080, 2080]
    - [58, 7438.1]
  - - [1536, 64, 1, 4096, 1568, 1568, 4128, 4128]
    - [50, 7991.38]
  - - [1536, 128, 1, 64, 1568, 1568, 96, 128]
    - [41, 1995.39]
  - - [1536, 128, 1, 128, 1568, 1568, 160, 160]
    - [38, 3640.9]
  - - [1536, 128, 1, 256, 1568, 1568, 288, 288]
    - [87, 6077.99]
  - - [1536, 128, 1, 512, 1568, 1568, 544, 544]
    - [50, 9274.33]
  - - [1536, 128, 1, 1024, 1568, 1568, 1056, 1056]
    - [58, 12202.4]
  - - [1536, 128, 1, 2048, 1568, 1568, 2080, 2080]
    - [41, 14979.7]
  - - [1536, 128, 1, 4096, 1568, 1568, 4128, 4128]
    - [41, 16861.9]
  - - [1536, 256, 1, 64, 1568, 1568, 96, 256]
    - [36, 3744.36]
  - - [1536, 256, 1, 128, 1568, 1568, 160, 256]
    - [60, 6428.89]
  - - [1536, 256, 1, 256, 1568, 1568, 288, 288]
    - [89, 11314.4]
  - - [1536, 256, 1, 512, 1568, 1568, 544, 544]
    - [32, 16829.1]
  - - [1536, 256, 1, 1024, 1568, 1568, 1056, 1056]
    - [42, 22465.7]
  - - [1536, 256, 1, 2048, 1568, 1568, 2080, 2080]
    - [4, 26640.2]
  - - [1536, 256, 1, 4096, 1568, 1568, 4128, 4128]
    - [52, 28402.9]
  - - [1536, 512, 1, 64, 1568, 1568, 96, 512]
    - [87, 7699.5]
  - - [1536, 512, 1, 128, 1568, 1568, 160, 512]
    - [75, 12940.4]
  - - [1536, 512, 1, 256, 1568, 1568, 288, 512]
    - [72, 20375.1]
  - - [1536, 512, 1, 512, 1568, 1568, 544, 544]
    - [93, 27291.2]
  - - [1536, 512, 1, 1024, 1568, 1568, 1056, 1056]
    - [63, 33830.8]
  - - [1536, 512, 1, 2048, 1568, 1568, 2080, 2080]
    - [63, 36211.5]
  - - [1536, 512, 1, 4096, 1568, 1568, 4128, 4128]
    - [93, 38960.7]
  - - [1536, 1024, 1, 64, 1568, 1568, 96, 1024]
    - [83, 11834.4]
  - - [1536, 1024, 1, 128, 1568, 1568, 160, 1024]
    - [57, 19533.0]
  - - [1536, 1024, 1, 256, 1568, 1568, 288, 1024]
    - [22, 25987.7]
  - - [1536, 1024, 1, 512, 1568, 1568, 544, 1024]
    - [81, 33271.7]
  - - [1536, 1024, 1, 1024, 1568, 1568, 1056, 1056]
    - [63, 35717.6]
  - - [1536, 1024, 1, 2048, 1568, 1568, 2080, 2080]
    - [63, 38785.7]
  - - [1536, 1024, 1, 4096, 1568, 1568, 4128, 4128]
    - [94, 40624.1]
  - - [1536, 2048, 1, 64, 1568, 1568, 96, 2048]
    - [92, 17182.4]
  - - [1536, 2048, 1, 128, 1568, 1568, 160, 2048]
    - [75, 25107.8]
  - - [1536, 2048, 1, 256, 1568, 1568, 288, 2048]
    - [63, 31219.5]
  - - [1536, 2048, 1, 512, 1568, 1568, 544, 2048]
    - [81, 35398.9]
  - - [1536, 2048, 1, 1024, 1568, 1568, 1056, 2048]
    - [81, 39111.6]
  - - [1536, 2048, 1, 2048, 1568, 1568, 2080, 2080]
    - [81, 41169.6]
  - - [1536, 2048, 1, 4096, 1568, 1568, 4128, 4128]
    - [93, 41751.3]
  - - [1536, 4096, 1, 64, 1568, 1568, 96, 4096]
    - [91, 22034.3]
  - - [1536, 4096, 1, 128, 1568, 1568, 160, 4096]
    - [85, 29172.5]
  - - [1536, 4096, 1, 256, 1568, 1568, 288, 4096]
    - [93, 33740.7]
  - - [1536, 4096, 1, 512, 1568, 1568, 544, 4096]
    - [93, 38246.9]
  - - [1536, 4096, 1, 1024, 1568, 1568, 1056, 4096]
    - [63, 40816.9]
  - - [1536, 4096, 1, 2048, 1568, 1568, 2080, 4096]
    - [94, 41277.3]
  - - [1536, 4096, 1, 4096, 1568, 1568, 4128, 4128]
    - [46, 41750.4]
  - - [3072, 64, 1, 64, 3104, 3104, 96, 96]
    - [35, 1578.0]
  - - [3072, 64, 1, 128, 3104, 3104, 160, 160]
    - [4, 2931.37]
  - - [3072, 64, 1, 256, 3104, 3104, 288, 288]
    - [4, 4832.16]
  - - [3072, 64, 1, 512, 3104, 3104, 544, 544]
    - [27, 7409.34]
  - - [3072, 64, 1, 1024, 3104, 3104, 1056, 1056]
    - [11, 10308.1]
  - - [3072, 64, 1, 2048, 3104, 3104, 2080, 2080]
    - [78, 12814.4]
  - - [3072, 64, 1, 4096, 3104, 3104, 4128, 4128]
    - [42, 13927.1]
  - - [3072, 128, 1, 64, 3104, 3104, 96, 128]
    - [36, 3979.43]
  - - [3072, 128, 1, 128, 3104, 3104, 160, 160]
    - [43, 6292.26]
  - - [3072, 128, 1, 256, 3104, 3104, 288, 288]
    - [31, 11131.6]
  - - [3072, 128, 1, 512, 3104, 3104, 544, 544]
    - [6, 16619.3]
  - - [3072, 128, 1, 1024, 3104, 3104, 1056, 1056]
    - [60, 22457.0]
  - - [3072, 128, 1, 2048, 3104, 3104, 2080, 2080]
    - [4, 26709.1]
  - - [3072, 128, 1, 4096, 3104, 3104, 4128, 4128]
    - [4, 28908.6]
  - - [3072, 256, 1, 64, 3104, 3104, 96, 256]
    - [58, 7641.06]
  - - [3072, 256, 1, 128, 3104, 3104, 160, 256]
    - [61, 13427.1]
  - - [3072, 256, 1, 256, 3104, 3104, 288, 288]
    - [63, 20288.9]
  - - [3072, 256, 1, 512, 3104, 3104, 544, 544]
    - [64, 27274.5]
  - - [3072, 256, 1, 1024, 3104, 3104, 1056, 1056]
    - [63, 33859.2]
  - - [3072, 256, 1, 2048, 3104, 3104, 2080, 2080]
    - [47, 36139.2]
  - - [3072, 256, 1, 4096, 3104, 3104, 4128, 4128]
    - [72, 38961.1]
  - - [3072, 512, 1, 64, 3104, 3104, 96, 512]
    - [65, 11867.9]
  - - [3072, 512, 1, 128, 3104, 3104, 160, 512]
    - [83, 19514.1]
  - - [3072, 512, 1, 256, 3104, 3104, 288, 512]
    - [63, 25869.2]
  - - [3072, 512, 1, 512, 3104, 3104, 544, 544]
    - [63, 33237.3]
  - - [3072, 512, 1, 1024, 3104, 3104, 1056, 1056]
    - [63, 35725.5]
  - - [3072, 512, 1, 2048, 3104, 3104, 2080, 2080]
    - [64, 38951.2]
  - - [3072, 512, 1, 4096, 3104, 3104, 4128, 4128]
    - [72, 40659.2]
  - - [3072, 1024, 1, 64, 3104, 3104, 96, 1024]
    - [80, 17518.9]
  - - [3072, 1024, 1, 128, 3104, 3104, 160, 1024]
    - [57, 24552.1]
  - - [3072, 1024, 1, 256, 3104, 3104, 288, 1024]
    - [81, 31895.9]
  - - [3072, 1024, 1, 512, 3104, 3104, 544, 1024]
    - [81, 35489.4]
  - - [3072, 1024, 1, 1024, 3104, 3104, 1056, 1056]
    - [81, 39129.6]
  - - [3072, 1024, 1, 2048, 3104, 3104, 2080, 2080]
    - [81, 41200.3]
  - - [3072, 1024, 1, 4096, 3104, 3104, 4128, 4128]
    - [93, 41732.1]
  - - [3072, 2048, 1, 64, 3104, 3104, 96, 2048]
    - [80, 21727.5]
  - - [3072, 2048, 1, 128, 3104, 3104, 160, 2048]
    - [75, 29237.1]
  - - [3072, 2048, 1, 256, 3104, 3104, 288, 2048]
    - [93, 33840.7]
  - - [3072, 2048, 1, 512, 3104, 3104, 544, 2048]
    - [81, 38302.4]
  - - [3072, 2048, 1, 1024, 3104, 3104, 1056, 2048]
    - [63, 40853.4]
  - - [3072, 2048, 1, 2048, 3104, 3104, 2080, 2080]
    - [81, 41506.4]
  - - [3072, 2048, 1, 4096, 3104, 3104, 4128, 4128]
    - [63, 41389.9]
  - - [3072, 4096, 1, 64, 3104, 3104, 96, 4096]
    - [45, 6763.2]
  - - [3072, 4096, 1, 128, 3104, 3104, 160, 4096]
    - [53, 12835.5]
  - - [3072, 4096, 1, 256, 3104, 3104, 288, 4096]
    - [45, 23148.5]
  - - [3072, 4096, 1, 512, 3104, 3104, 544, 4096]
    - [92, 35655.0]
  - - [3072, 4096, 1, 1024, 3104, 3104, 1056, 4096]
    - [93, 39466.7]
  - - [3072, 4096, 1, 2048, 3104, 3104, 2080, 4096]
    - [64, 41295.0]
  - - [3072, 4096, 1, 4096, 3104, 3104, 4128, 4128]
    - [81, 41849.2]
  - - [4096, 64, 1, 64, 4128, 4128, 96, 96]
    - [78, 1791.1]
  - - [4096, 64, 1, 128, 4128, 4128, 160, 160]
    - [10, 3576.09]
  - - [4096, 64, 1, 256, 4128, 4128, 288, 288]
    - [14, 5959.42]
  - - [4096, 64, 1, 512, 4128, 4128, 544, 544]
    - [14, 9558.99]
  - - [4096, 64, 1, 1024, 4128, 4128, 1056, 1056]
    - [33, 13081.7]
  - - [4096, 64, 1, 2048, 4128, 4128, 2080, 2080]
    - [12, 16531.3]
  - - [4096, 64, 1, 4096, 4128, 4128, 4128, 4128]
    - [11, 18058.3]
  - - [4096, 128, 1, 64, 4128, 4128, 96, 128]
    - [68, 5773.3]
  - - [4096, 128, 1, 128, 4128, 4128, 160, 160]
    - [42, 10035.7]
  - - [4096, 128, 1, 256, 4128, 4128, 288, 288]
    - [12, 16141.6]
  - - [4096, 128, 1, 512, 4128, 4128, 544, 544]
    - [24, 23615.3]
  - - [4096, 128, 1, 1024, 4128, 4128, 1056, 1056]
    - [3, 30533.6]
  - - [4096, 128, 1, 2048, 4128, 4128, 2080, 2080]
    - [42, 35860.8]
  - - [4096, 128, 1, 4096, 4128, 4128, 4128, 4128]
    - [0, 37730.8]
  - - [4096, 256, 1, 64, 4128, 4128, 96, 256]
    - [68, 9804.11]
  - - [4096, 256, 1, 128, 4128, 4128, 160, 256]
    - [62, 15429.1]
  - - [4096, 256, 1, 256, 4128, 4128, 288, 288]
    - [93, 22639.5]
  - - [4096, 256, 1, 512, 4128, 4128, 544, 544]
    - [63, 30681.9]
  - - [4096, 256, 1, 1024, 4128, 4128, 1056, 1056]
    - [81, 35673.7]
  - - [4096, 256, 1, 2048, 4128, 4128, 2080, 2080]
    - [63, 37833.2]
  - - [4096, 256, 1, 4096, 4128, 4128, 4128, 4128]
    - [46, 40145.6]
  - - [4096, 512, 1, 64, 4128, 4128, 96, 512]
    - [71, 13770.2]
  - - [4096, 512, 1, 128, 4128, 4128, 160, 512]
    - [75, 21377.4]
  - - [4096, 512, 1, 256, 4128, 4128, 288, 512]
    - [63, 28915.4]
  - - [4096, 512, 1, 512, 4128, 4128, 544, 544]
    - [81, 35019.8]
  - - [4096, 512, 1, 1024, 4128, 4128, 1056, 1056]
    - [63, 37461.6]
  - - [4096, 512, 1, 2048, 4128, 4128, 2080, 2080]
    - [81, 40218.5]
  - - [4096, 512, 1, 4096, 4128, 4128, 4128, 4128]
    - [93, 41715.8]
  - - [4096, 1024, 1, 64, 4128, 4128, 96, 1024]
    - [80, 18825.8]
  - - [4096, 1024, 1, 128, 4128, 4128, 160, 1024]
    - [75, 27206.8]
  - - [4096, 1024, 1, 256, 4128, 4128, 288, 1024]
    - [81, 33398.9]
  - - [4096, 1024, 1, 512, 4128, 4128, 544, 1024]
    - [63, 36738.7]
  - - [4096, 1024, 1, 1024, 4128, 4128, 1056, 1056]
    - [81, 39857.6]
  - - [4096, 1024, 1, 2048, 4128, 4128, 2080, 2080]
    - [81, 41701.6]
  - - [4096, 1024, 1, 4096, 4128, 4128, 4128, 4128]
    - [63, 41326.1]
  - - [4096, 2048, 1, 64, 4128, 4128, 96, 2048]
    - [91, 23035.8]
  - - [4096, 2048, 1, 128, 4128, 4128, 160, 2048]
    - [85, 30768.9]
  - - [4096, 2048, 1, 256, 4128, 4128, 288, 2048]
    - [35, 34131.5]
  - - [4096, 2048, 1, 512, 4128, 4128, 544, 2048]
    - [88, 37340.4]
  - - [4096, 2048, 1, 1024, 4128, 4128, 1056, 2048]
    - [94, 39941.3]
  - - [4096, 2048, 1, 2048, 4128, 4128, 2080, 2080]
    - [93, 40407.9]
  - - [4096, 2048, 1, 4096, 4128, 4128, 4128, 4128]
    - [81, 41869.1]
  - - [4096, 4096, 1, 64, 4128, 4128, 96, 4096]
    - [45, 7040.61]
  - - [4096, 4096, 1, 128, 4128, 4128, 160, 4096]
    - [53, 13693.6]
  - - [4096, 4096, 1, 256, 4128, 4128, 288, 4096]
    - [71, 24216.1]
  - - [4096, 4096, 1, 512, 4128, 4128, 544, 4096]
    - [54, 36638.2]
  - - [4096, 4096, 1, 1024, 4128, 4128, 1056, 4096]
    - [64, 38693.3]
  - - [4096, 4096, 1, 2048, 4128, 4128, 2080, 4096]
    - [81, 41280.4]
  - - [4096, 4096, 1, 4096, 4128, 4128, 4128, 4128]
    - [93, 41825.4]
- null
- null
- DeviceEfficiency
