library/src/blas3/Tensile/Logic/asm_full/navi33/navi33_Cijk_Alik_Bjlk_BBS_BH_GB.yaml
- {MinimumRequiredVersion: 4.35.0}
- navi33
- gfx1102
- [Device 73f0]
    SolutionIndex: 0
    SolutionNameMin: Cijk_Alik_Bjlk_BBS_BH_MT128x128x16_MI16x16x16x1_SN_1LDSB0_GRVW4_PLR0_SIA1_SU0_SUS0_SVW4_VW4_WGM1
    SolutionIndex: 1
    SolutionNameMin: Cijk_Alik_Bjlk_BBS_BH_MT128x128x16_MI16x16x16x1_SN_1LDSB0_GRVW8_PLR0_SIA1_SU0_SUS0_SVW2_VW2_WGM1
    SolutionIndex: 2
    SolutionNameMin: Cijk_Alik_Bjlk_BBS_BH_MT128x128x16_MI16x16x16x1_SN_1LDSB0_GRVW8_PLR0_SIA1_SU0_SUS0_SVW4_VW4_WGM1
    SolutionIndex: 3
    SolutionNameMin: Cijk_Alik_Bjlk_BBS_BH_MT128x128x16_MI16x16x16x1_SN_1LDSB0_GRVW8_PLR1_SIA1_SU0_SUS0_SVW4_VW4_WGM1
    SolutionIndex: 4
    SolutionNameMin: Cijk_Alik_Bjlk_BBS_BH_MT128x128x16_MI16x16x16x1_SN_1LDSB1_GRVW4_PLR1_SIA2_SU0_SUS0_SVW2_VW2_WGM1
    SolutionIndex: 5
    SolutionNameMin: Cijk_Alik_Bjlk_BBS_BH_MT128x128x16_MI16x16x16x1_SN_1LDSB1_GRVW4_PLR1_SIA2_SU0_SUS0_SVW4_VW4_WGM1
    SolutionIndex: 6
    SolutionNameMin: Cijk_Alik_Bjlk_BBS_BH_MT128x128x16_MI16x16x16x1_SN_1LDSB1_GRVW8_PLR1_SIA2_SU0_SUS0_SVW2_VW2_WGM1
    SolutionIndex: 7
    SolutionNameMin: Cijk_Alik_Bjlk_BBS_BH_MT128x128x16_MI16x16x16x1_SN_1LDSB1_GRVW8_PLR1_SIA2_SU0_SUS0_SVW4_VW4_WGM1
    SolutionIndex: 8
    SolutionNameMin: Cijk_Alik_Bjlk_BBS_BH_MT128x128x16_MI16x16x16x1_SN_1LDSB0_GRVW8_PLR0_SIA3_SU0_SUS0_SVW4_VW4_WGM1
    SolutionIndex: 9
    SolutionNameMin: Cijk_Alik_Bjlk_BBS_BH_MT128x128x16_MI16x16x16x1_SN_1LDSB0_GRVW8_PLR1_SIA3_SU0_SUS0_SVW2_VW2_WGM1
    SolutionIndex: 10
    SolutionNameMin: Cijk_Alik_Bjlk_BBS_BH_MT128x128x16_MI16x16x16x1_SN_1LDSB0_GRVW8_PLR1_SIA3_SU0_SUS0_SVW4_VW4_WGM1
    SolutionIndex: 11
    SolutionNameMin: Cijk_Alik_Bjlk_BBS_BH_MT128x128x16_MI16x16x16x1_SN_1LDSB1_GRVW4_PLR1_SIA2_SU32_SUS256_SVW2_VW2_WGM1
    SolutionIndex: 12
    SolutionNameMin: Cijk_Alik_Bjlk_BBS_BH_MT128x128x16_MI16x16x16x1_SN_1LDSB1_GRVW8_PLR1_SIA2_SU32_SUS256_SVW2_VW2_WGM1
    SolutionIndex: 13
    SolutionNameMin: Cijk_Alik_Bjlk_BBS_BH_MT128x128x16_MI16x16x16x1_SN_1LDSB1_GRVW8_PLR1_SIA2_SU32_SUS256_SVW4_VW4_WGM1
    SolutionIndex: 14
    SolutionNameMin: Cijk_Alik_Bjlk_BBS_BH_MT128x128x16_MI16x16x16x1_SN_1LDSB0_GRVW8_PLR1_SIA3_SU32_SUS256_SVW4_VW4_WGM1
    SolutionIndex: 15
    SolutionNameMin: Cijk_Alik_Bjlk_BBS_BH_MT128x128x16_MI16x16x16x1_SN_1LDSB0_GRVW8_PLR0_SIA1_SU0_SUS0_SVW2_VW2_WGM4
    SolutionIndex: 16
    SolutionNameMin: Cijk_Alik_Bjlk_BBS_BH_MT128x128x16_MI16x16x16x1_SN_1LDSB0_GRVW8_PLR0_SIA1_SU0_SUS0_SVW4_VW4_WGM4
    SolutionIndex: 17
    SolutionNameMin: Cijk_Alik_Bjlk_BBS_BH_MT128x128x16_MI16x16x16x1_SN_1LDSB0_GRVW8_PLR1_SIA1_SU0_SUS0_SVW2_VW2_WGM4
    SolutionIndex: 18
    SolutionNameMin: Cijk_Alik_Bjlk_BBS_BH_MT128x128x16_MI16x16x16x1_SN_1LDSB0_GRVW8_PLR1_SIA1_SU0_SUS0_SVW4_VW4_WGM4
    SolutionIndex: 19
    SolutionNameMin: Cijk_Alik_Bjlk_BBS_BH_MT128x128x16_MI16x16x16x1_SN_1LDSB1_GRVW4_PLR1_SIA2_SU0_SUS0_SVW2_VW2_WGM4
    SolutionIndex: 20
    SolutionNameMin: Cijk_Alik_Bjlk_BBS_BH_MT128x128x16_MI16x16x16x1_SN_1LDSB1_GRVW4_PLR1_SIA2_SU0_SUS0_SVW4_VW4_WGM4
    SolutionIndex: 21
    SolutionNameMin: Cijk_Alik_Bjlk_BBS_BH_MT128x128x16_MI16x16x16x1_SN_1LDSB1_GRVW8_PLR1_SIA2_SU0_SUS0_SVW2_VW2_WGM4
    SolutionIndex: 22
    SolutionNameMin: Cijk_Alik_Bjlk_BBS_BH_MT128x128x16_MI16x16x16x1_SN_1LDSB1_GRVW8_PLR1_SIA2_SU0_SUS0_SVW4_VW4_WGM4
    SolutionIndex: 23
    SolutionNameMin: Cijk_Alik_Bjlk_BBS_BH_MT128x128x16_MI16x16x16x1_SN_1LDSB0_GRVW8_PLR0_SIA3_SU0_SUS0_SVW2_VW2_WGM4
    SolutionIndex: 24
    SolutionNameMin: Cijk_Alik_Bjlk_BBS_BH_MT128x128x16_MI16x16x16x1_SN_1LDSB0_GRVW8_PLR0_SIA3_SU0_SUS0_SVW4_VW4_WGM4
    SolutionIndex: 25
    SolutionNameMin: Cijk_Alik_Bjlk_BBS_BH_MT128x128x16_MI16x16x16x1_SN_1LDSB0_GRVW8_PLR1_SIA3_SU0_SUS0_SVW2_VW2_WGM4
    SolutionIndex: 26
    SolutionNameMin: Cijk_Alik_Bjlk_BBS_BH_MT128x128x16_MI16x16x16x1_SN_1LDSB0_GRVW8_PLR1_SIA3_SU0_SUS0_SVW4_VW4_WGM4
    SolutionIndex: 27
    SolutionNameMin: Cijk_Alik_Bjlk_BBS_BH_MT128x128x16_MI16x16x16x1_SN_1LDSB0_GRVW8_PLR0_SIA1_SU32_SUS256_SVW4_VW4_WGM4
    SolutionIndex: 28
    SolutionNameMin: Cijk_Alik_Bjlk_BBS_BH_MT128x128x16_MI16x16x16x1_SN_1LDSB0_GRVW4_PLR1_SIA1_SU32_SUS256_SVW2_VW2_WGM4
    SolutionIndex: 29
    SolutionNameMin: Cijk_Alik_Bjlk_BBS_BH_MT128x128x16_MI16x16x16x1_SN_1LDSB0_GRVW4_PLR1_SIA1_SU32_SUS256_SVW4_VW4_WGM4
    SolutionIndex: 30
    SolutionNameMin: Cijk_Alik_Bjlk_BBS_BH_MT128x128x16_MI16x16x16x1_SN_1LDSB0_GRVW8_PLR1_SIA1_SU32_SUS256_SVW4_VW4_WGM4
    SolutionIndex: 31
    SolutionNameMin: Cijk_Alik_Bjlk_BBS_BH_MT128x128x16_MI16x16x16x1_SN_1LDSB1_GRVW4_PLR1_SIA2_SU32_SUS256_SVW2_VW2_WGM4
    SolutionIndex: 32
    SolutionNameMin: Cijk_Alik_Bjlk_BBS_BH_MT128x128x16_MI16x16x16x1_SN_1LDSB1_GRVW4_PLR1_SIA2_SU32_SUS256_SVW4_VW4_WGM4
    SolutionIndex: 33
    SolutionNameMin: Cijk_Alik_Bjlk_BBS_BH_MT128x128x16_MI16x16x16x1_SN_1LDSB1_GRVW8_PLR1_SIA2_SU32_SUS256_SVW2_VW2_WGM4
    SolutionIndex: 34
    SolutionNameMin: Cijk_Alik_Bjlk_BBS_BH_MT128x128x16_MI16x16x16x1_SN_1LDSB1_GRVW8_PLR1_SIA2_SU32_SUS256_SVW4_VW4_WGM4
    SolutionIndex: 35
    SolutionNameMin: Cijk_Alik_Bjlk_BBS_BH_MT128x128x16_MI16x16x16x1_SN_1LDSB0_GRVW8_PLR1_SIA3_SU32_SUS256_SVW2_VW2_WGM4
    SolutionIndex: 36
    SolutionNameMin: Cijk_Alik_Bjlk_BBS_BH_MT128x128x16_MI16x16x16x1_SN_1LDSB0_GRVW4_PLR0_SIA1_SU0_SUS0_SVW2_VW2_WGM8
    SolutionIndex: 37
    SolutionNameMin: Cijk_Alik_Bjlk_BBS_BH_MT128x128x16_MI16x16x16x1_SN_1LDSB0_GRVW4_PLR0_SIA1_SU0_SUS0_SVW4_VW4_WGM8
    SolutionIndex: 38
    SolutionNameMin: Cijk_Alik_Bjlk_BBS_BH_MT128x128x16_MI16x16x16x1_SN_1LDSB0_GRVW8_PLR0_SIA1_SU0_SUS0_SVW2_VW2_WGM8
    SolutionIndex: 39
    SolutionNameMin: Cijk_Alik_Bjlk_BBS_BH_MT128x128x16_MI16x16x16x1_SN_1LDSB0_GRVW8_PLR0_SIA1_SU0_SUS0_SVW4_VW4_WGM8
    SolutionIndex: 40
    SolutionNameMin: Cijk_Alik_Bjlk_BBS_BH_MT128x128x16_MI16x16x16x1_SN_1LDSB0_GRVW4_PLR1_SIA1_SU0_SUS0_SVW4_VW4_WGM8
    SolutionIndex: 41
    SolutionNameMin: Cijk_Alik_Bjlk_BBS_BH_MT128x128x16_MI16x16x16x1_SN_1LDSB0_GRVW8_PLR1_SIA1_SU0_SUS0_SVW2_VW2_WGM8
    SolutionIndex: 42
    SolutionNameMin: Cijk_Alik_Bjlk_BBS_BH_MT128x128x16_MI16x16x16x1_SN_1LDSB0_GRVW8_PLR1_SIA1_SU0_SUS0_SVW4_VW4_WGM8
    SolutionIndex: 43
    SolutionNameMin: Cijk_Alik_Bjlk_BBS_BH_MT128x128x16_MI16x16x16x1_SN_1LDSB1_GRVW4_PLR1_SIA2_SU0_SUS0_SVW2_VW2_WGM8
    SolutionIndex: 44
    SolutionNameMin: Cijk_Alik_Bjlk_BBS_BH_MT128x128x16_MI16x16x16x1_SN_1LDSB1_GRVW4_PLR1_SIA2_SU0_SUS0_SVW4_VW4_WGM8
    SolutionIndex: 45
    SolutionNameMin: Cijk_Alik_Bjlk_BBS_BH_MT128x128x16_MI16x16x16x1_SN_1LDSB1_GRVW8_PLR1_SIA2_SU0_SUS0_SVW2_VW2_WGM8
    SolutionIndex: 46
    SolutionNameMin: Cijk_Alik_Bjlk_BBS_BH_MT128x128x16_MI16x16x16x1_SN_1LDSB1_GRVW8_PLR1_SIA2_SU0_SUS0_SVW4_VW4_WGM8
    SolutionIndex: 47
    SolutionNameMin: Cijk_Alik_Bjlk_BBS_BH_MT128x128x16_MI16x16x16x1_SN_1LDSB0_GRVW8_PLR0_SIA3_SU0_SUS0_SVW2_VW2_WGM8
    SolutionIndex: 48
    SolutionNameMin: Cijk_Alik_Bjlk_BBS_BH_MT128x128x16_MI16x16x16x1_SN_1LDSB0_GRVW8_PLR1_SIA3_SU0_SUS0_SVW2_VW2_WGM8
    SolutionIndex: 49
    SolutionNameMin: Cijk_Alik_Bjlk_BBS_BH_MT128x128x16_MI16x16x16x1_SN_1LDSB0_GRVW8_PLR1_SIA3_SU0_SUS0_SVW4_VW4_WGM8
    SolutionIndex: 50
    SolutionNameMin: Cijk_Alik_Bjlk_BBS_BH_MT128x128x16_MI16x16x16x1_SN_1LDSB0_GRVW4_PLR0_SIA1_SU32_SUS256_SVW4_VW4_WGM8
    SolutionIndex: 51
    SolutionNameMin: Cijk_Alik_Bjlk_BBS_BH_MT128x128x16_MI16x16x16x1_SN_1LDSB0_GRVW8_PLR0_SIA1_SU32_SUS256_SVW4_VW4_WGM8
    SolutionIndex: 52
    SolutionNameMin: Cijk_Alik_Bjlk_BBS_BH_MT128x128x16_MI16x16x16x1_SN_1LDSB0_GRVW4_PLR1_SIA1_SU32_SUS256_SVW2_VW2_WGM8
    SolutionIndex: 53
    SolutionNameMin: Cijk_Alik_Bjlk_BBS_BH_MT128x128x16_MI16x16x16x1_SN_1LDSB0_GRVW8_PLR1_SIA1_SU32_SUS256_SVW2_VW2_WGM8
    SolutionIndex: 54
    SolutionNameMin: Cijk_Alik_Bjlk_BBS_BH_MT128x128x16_MI16x16x16x1_SN_1LDSB0_GRVW8_PLR1_SIA1_SU32_SUS256_SVW4_VW4_WGM8
    SolutionIndex: 55
    SolutionNameMin: Cijk_Alik_Bjlk_BBS_BH_MT128x128x16_MI16x16x16x1_SN_1LDSB1_GRVW4_PLR1_SIA2_SU32_SUS256_SVW2_VW2_WGM8
    SolutionIndex: 56
    SolutionNameMin: Cijk_Alik_Bjlk_BBS_BH_MT128x128x16_MI16x16x16x1_SN_1LDSB1_GRVW4_PLR1_SIA2_SU32_SUS256_SVW4_VW4_WGM8
    SolutionIndex: 57
    SolutionNameMin: Cijk_Alik_Bjlk_BBS_BH_MT128x128x16_MI16x16x16x1_SN_1LDSB1_GRVW8_PLR1_SIA2_SU32_SUS256_SVW2_VW2_WGM8
    SolutionIndex: 58
    SolutionNameMin: Cijk_Alik_Bjlk_BBS_BH_MT128x128x16_MI16x16x16x1_SN_1LDSB1_GRVW8_PLR1_SIA2_SU32_SUS256_SVW4_VW4_WGM8
    SolutionIndex: 59
    SolutionNameMin: Cijk_Alik_Bjlk_BBS_BH_MT128x128x16_MI16x16x16x1_SN_1LDSB0_GRVW8_PLR0_SIA3_SU32_SUS256_SVW2_VW2_WGM8
    SolutionIndex: 60
    SolutionNameMin: Cijk_Alik_Bjlk_BBS_BH_MT128x128x16_MI16x16x16x1_SN_1LDSB0_GRVW8_PLR0_SIA3_SU32_SUS256_SVW4_VW4_WGM8
    SolutionIndex: 61
    SolutionNameMin: Cijk_Alik_Bjlk_BBS_BH_MT128x128x16_MI16x16x16x1_SN_1LDSB0_GRVW8_PLR1_SIA3_SU32_SUS256_SVW2_VW2_WGM8
    SolutionIndex: 62
    SolutionNameMin: Cijk_Alik_Bjlk_BBS_BH_MT128x128x16_MI16x16x16x1_SN_1LDSB0_GRVW8_PLR1_SIA3_SU32_SUS256_SVW4_VW4_WGM8
    SolutionIndex: 63
    SolutionNameMin: Cijk_Alik_Bjlk_BBS_BH_MT128x128x32_MI16x16x16x1_SN_1LDSB0_GRVW4_PLR0_SIA1_SU0_SUS0_SVW2_VW2_WGM1
    SolutionIndex: 64
    SolutionNameMin: Cijk_Alik_Bjlk_BBS_BH_MT128x128x32_MI16x16x16x1_SN_1LDSB0_GRVW8_PLR0_SIA1_SU0_SUS0_SVW2_VW2_WGM1
    SolutionIndex: 65
    SolutionNameMin: Cijk_Alik_Bjlk_BBS_BH_MT128x128x32_MI16x16x16x1_SN_1LDSB0_GRVW4_PLR0_SIA1_SU32_SUS256_SVW2_VW2_WGM1
    SolutionIndex: 66
    SolutionNameMin: Cijk_Alik_Bjlk_BBS_BH_MT128x128x32_MI16x16x16x1_SN_1LDSB0_GRVW8_PLR0_SIA1_SU32_SUS256_SVW2_VW2_WGM1
    SolutionIndex: 67
    SolutionNameMin: Cijk_Alik_Bjlk_BBS_BH_MT128x128x32_MI16x16x16x1_SN_1LDSB0_GRVW8_PLR0_SIA3_SU32_SUS256_SVW2_VW2_WGM1
    SolutionIndex: 68
    SolutionNameMin: Cijk_Alik_Bjlk_BBS_BH_MT128x128x32_MI16x16x16x1_SN_1LDSB0_GRVW4_PLR0_SIA1_SU0_SUS0_SVW2_VW2_WGM4
    SolutionIndex: 69
    SolutionNameMin: Cijk_Alik_Bjlk_BBS_BH_MT128x128x32_MI16x16x16x1_SN_1LDSB0_GRVW8_PLR0_SIA1_SU0_SUS0_SVW2_VW2_WGM4
    SolutionIndex: 70
    SolutionNameMin: Cijk_Alik_Bjlk_BBS_BH_MT128x128x32_MI16x16x16x1_SN_1LDSB0_GRVW4_PLR0_SIA1_SU32_SUS256_SVW2_VW2_WGM4
    SolutionIndex: 71
    SolutionNameMin: Cijk_Alik_Bjlk_BBS_BH_MT128x128x32_MI16x16x16x1_SN_1LDSB0_GRVW8_PLR0_SIA1_SU32_SUS256_SVW2_VW2_WGM4
    SolutionIndex: 72
    SolutionNameMin: Cijk_Alik_Bjlk_BBS_BH_MT128x128x32_MI16x16x16x1_SN_1LDSB0_GRVW8_PLR0_SIA3_SU32_SUS256_SVW2_VW2_WGM4
    SolutionIndex: 73
    SolutionNameMin: Cijk_Alik_Bjlk_BBS_BH_MT128x128x32_MI16x16x16x1_SN_1LDSB0_GRVW4_PLR0_SIA1_SU0_SUS0_SVW2_VW2_WGM8
    SolutionIndex: 74
    SolutionNameMin: Cijk_Alik_Bjlk_BBS_BH_MT128x128x32_MI16x16x16x1_SN_1LDSB0_GRVW8_PLR0_SIA1_SU0_SUS0_SVW2_VW2_WGM8
    SolutionIndex: 75
    SolutionNameMin: Cijk_Alik_Bjlk_BBS_BH_MT128x128x32_MI16x16x16x1_SN_1LDSB0_GRVW8_PLR0_SIA3_SU0_SUS0_SVW2_VW2_WGM8
    SolutionIndex: 76
    SolutionNameMin: Cijk_Alik_Bjlk_BBS_BH_MT128x128x32_MI16x16x16x1_SN_1LDSB0_GRVW4_PLR0_SIA1_SU32_SUS256_SVW2_VW2_WGM8
    SolutionIndex: 77
    SolutionNameMin: Cijk_Alik_Bjlk_BBS_BH_MT128x128x32_MI16x16x16x1_SN_1LDSB0_GRVW8_PLR0_SIA1_SU32_SUS256_SVW2_VW2_WGM8
- - - [64, 64, 1, 64, 96, 96, 96, 96]
    - [6, 31.3419]
  - - [64, 64, 1, 128, 96, 96, 160, 160]
    - [13, 53.7456]
  - - [64, 64, 1, 256, 96, 96, 288, 288]
    - [7, 93.4143]
  - - [64, 64, 1, 512, 96, 96, 544, 544]
    - [69, 146.041]
  - - [64, 64, 1, 1024, 96, 96, 1056, 1056]
    - [64, 210.643]
  - - [64, 64, 1, 2048, 96, 96, 2080, 2080]
    - [69, 274.093]
  - - [64, 64, 1, 4096, 96, 96, 4128, 4128]
    - [69, 305.224]
  - - [64, 128, 1, 64, 96, 96, 96, 128]
    - [2, 56.1757]
  - - [64, 128, 1, 128, 96, 96, 160, 160]
    - [13, 103.758]
  - - [64, 128, 1, 256, 96, 96, 288, 288]
    - [13, 181.713]
  - - [64, 128, 1, 512, 96, 96, 544, 544]
    - [69, 299.529]
  - - [64, 128, 1, 1024, 96, 96, 1056, 1056]
    - [64, 427.011]
  - - [64, 128, 1, 2048, 96, 96, 2080, 2080]
    - [69, 542.794]
  - - [64, 128, 1, 4096, 96, 96, 4128, 4128]
    - [77, 612.274]
  - - [64, 256, 1, 64, 96, 96, 96, 256]
    - [49, 134.519]
  - - [64, 256, 1, 128, 96, 96, 160, 256]
    - [6, 246.173]
  - - [64, 256, 1, 256, 96, 96, 288, 288]
    - [69, 422.09]
  - - [64, 256, 1, 512, 96, 96, 544, 544]
    - [69, 666.45]
  - - [64, 256, 1, 1024, 96, 96, 1056, 1056]
    - [77, 932.586]
  - - [64, 256, 1, 2048, 96, 96, 2080, 2080]
    - [73, 1148.38]
  - - [64, 256, 1, 4096, 96, 96, 4128, 4128]
    - [64, 1273.73]
  - - [64, 512, 1, 64, 96, 96, 96, 512]
    - [46, 278.58]
  - - [64, 512, 1, 128, 96, 96, 160, 512]
    - [6, 510.504]
  - - [64, 512, 1, 256, 96, 96, 288, 512]
    - [20, 870.007]
  - - [64, 512, 1, 512, 96, 96, 544, 544]
    - [77, 1369.79]
  - - [64, 512, 1, 1024, 96, 96, 1056, 1056]
    - [65, 1930.19]
  - - [64, 512, 1, 2048, 96, 96, 2080, 2080]
    - [73, 2450.93]
  - - [64, 512, 1, 4096, 96, 96, 4128, 4128]
    - [71, 2638.29]
  - - [64, 1024, 1, 64, 96, 96, 96, 1024]
    - [22, 579.724]
  - - [64, 1024, 1, 128, 96, 96, 160, 1024]
    - [77, 1053.98]
  - - [64, 1024, 1, 256, 96, 96, 288, 1024]
    - [77, 1859.59]
  - - [64, 1024, 1, 512, 96, 96, 544, 1024]
    - [69, 2902.88]
  - - [64, 1024, 1, 1024, 96, 96, 1056, 1056]
    - [69, 4025.49]
  - - [64, 1024, 1, 2048, 96, 96, 2080, 2080]
    - [69, 4916.23]
  - - [64, 1024, 1, 4096, 96, 96, 4128, 4128]
    - [76, 5422.94]
  - - [64, 2048, 1, 64, 96, 96, 96, 2048]
    - [46, 1229.65]
  - - [64, 2048, 1, 128, 96, 96, 160, 2048]
    - [21, 2227.16]
  - - [64, 2048, 1, 256, 96, 96, 288, 2048]
    - [20, 3710.96]
  - - [64, 2048, 1, 512, 96, 96, 544, 2048]
    - [68, 5620.51]
  - - [64, 2048, 1, 1024, 96, 96, 1056, 2048]
    - [64, 7861.41]
  - - [64, 2048, 1, 2048, 96, 96, 2080, 2080]
    - [66, 9902.09]
  - - [64, 2048, 1, 4096, 96, 96, 4128, 4128]
    - [73, 9588.87]
  - - [64, 4096, 1, 64, 96, 96, 96, 4096]
    - [58, 2126.93]
  - - [64, 4096, 1, 128, 96, 96, 160, 4096]
    - [21, 3867.96]
  - - [64, 4096, 1, 256, 96, 96, 288, 4096]
    - [46, 6570.3]
  - - [64, 4096, 1, 512, 96, 96, 544, 4096]
    - [5, 10059.1]
  - - [64, 4096, 1, 1024, 96, 96, 1056, 4096]
    - [56, 14007.3]
  - - [64, 4096, 1, 2048, 96, 96, 2080, 4096]
    - [21, 17248.3]
  - - [64, 4096, 1, 4096, 96, 96, 4128, 4128]
    - [77, 14709.2]
  - - [128, 64, 1, 64, 160, 160, 96, 96]
    - [10, 66.475]
  - - [128, 64, 1, 128, 160, 160, 160, 160]
    - [13, 116.405]
  - - [128, 64, 1, 256, 160, 160, 288, 288]
    - [6, 186.812]
  - - [128, 64, 1, 512, 160, 160, 544, 544]
    - [6, 292.246]
  - - [128, 64, 1, 1024, 160, 160, 1056, 1056]
    - [64, 418.656]
  - - [128, 64, 1, 2048, 160, 160, 2080, 2080]
    - [66, 539.218]
  - - [128, 64, 1, 4096, 160, 160, 4128, 4128]
    - [66, 607.452]
  - - [128, 128, 1, 64, 160, 160, 96, 128]
    - [3, 139.847]
  - - [128, 128, 1, 128, 160, 160, 160, 160]
    - [46, 265.867]
  - - [128, 128, 1, 256, 160, 160, 288, 288]
    - [46, 450.662]
  - - [128, 128, 1, 512, 160, 160, 544, 544]
    - [7, 688.155]
  - - [128, 128, 1, 1024, 160, 160, 1056, 1056]
    - [69, 958.698]
  - - [128, 128, 1, 2048, 160, 160, 2080, 2080]
    - [69, 1167.31]
  - - [128, 128, 1, 4096, 160, 160, 4128, 4128]
    - [66, 1261.47]
  - - [128, 256, 1, 64, 160, 160, 96, 256]
    - [8, 325.746]
  - - [128, 256, 1, 128, 160, 160, 160, 256]
    - [46, 588.426]
  - - [128, 256, 1, 256, 160, 160, 288, 288]
    - [13, 1019.4]
  - - [128, 256, 1, 512, 160, 160, 544, 544]
    - [46, 1515.01]
  - - [128, 256, 1, 1024, 160, 160, 1056, 1056]
    - [13, 1995.98]
  - - [128, 256, 1, 2048, 160, 160, 2080, 2080]
    - [64, 2391.45]
  - - [128, 256, 1, 4096, 160, 160, 4128, 4128]
    - [74, 2590.03]
  - - [128, 512, 1, 64, 160, 160, 96, 512]
    - [22, 728.81]
  - - [128, 512, 1, 128, 160, 160, 160, 512]
    - [22, 1304.4]
  - - [128, 512, 1, 256, 160, 160, 288, 512]
    - [22, 2133.42]
  - - [128, 512, 1, 512, 160, 160, 544, 544]
    - [74, 3046.25]
  - - [128, 512, 1, 1024, 160, 160, 1056, 1056]
    - [74, 4068.44]
  - - [128, 512, 1, 2048, 160, 160, 2080, 2080]
    - [71, 4851.89]
  - - [128, 512, 1, 4096, 160, 160, 4128, 4128]
    - [76, 5304.0]
  - - [128, 1024, 1, 64, 160, 160, 96, 1024]
    - [22, 1411.51]
  - - [128, 1024, 1, 128, 160, 160, 160, 1024]
    - [13, 2529.74]
  - - [128, 1024, 1, 256, 160, 160, 288, 1024]
    - [22, 4143.03]
  - - [128, 1024, 1, 512, 160, 160, 544, 1024]
    - [77, 6194.28]
  - - [128, 1024, 1, 1024, 160, 160, 1056, 1056]
    - [77, 8205.52]
  - - [128, 1024, 1, 2048, 160, 160, 2080, 2080]
    - [71, 9977.9]
  - - [128, 1024, 1, 4096, 160, 160, 4128, 4128]
    - [77, 10612.6]
  - - [128, 2048, 1, 64, 160, 160, 96, 2048]
    - [13, 2663.9]
  - - [128, 2048, 1, 128, 160, 160, 160, 2048]
    - [58, 4954.15]
  - - [128, 2048, 1, 256, 160, 160, 288, 2048]
    - [13, 8181.04]
  - - [128, 2048, 1, 512, 160, 160, 544, 2048]
    - [69, 12073.2]
  - - [128, 2048, 1, 1024, 160, 160, 1056, 2048]
    - [70, 16273.8]
  - - [128, 2048, 1, 2048, 160, 160, 2080, 2080]
    - [66, 19675.0]
  - - [128, 2048, 1, 4096, 160, 160, 4128, 4128]
    - [63, 21060.4]
  - - [128, 4096, 1, 64, 160, 160, 96, 4096]
    - [58, 4735.98]
  - - [128, 4096, 1, 128, 160, 160, 160, 4096]
    - [6, 8661.44]
  - - [128, 4096, 1, 256, 160, 160, 288, 4096]
    - [55, 14341.1]
  - - [128, 4096, 1, 512, 160, 160, 544, 4096]
    - [6, 21721.6]
  - - [128, 4096, 1, 1024, 160, 160, 1056, 4096]
    - [33, 28980.9]
  - - [128, 4096, 1, 2048, 160, 160, 2080, 4096]
    - [45, 35093.1]
  - - [128, 4096, 1, 4096, 160, 160, 4128, 4128]
    - [45, 33039.3]
  - - [256, 64, 1, 64, 288, 288, 96, 96]
    - [2, 142.141]
  - - [256, 64, 1, 128, 288, 288, 160, 160]
    - [21, 250.736]
  - - [256, 64, 1, 256, 288, 288, 288, 288]
    - [6, 408.125]
  - - [256, 64, 1, 512, 288, 288, 544, 544]
    - [66, 643.002]
  - - [256, 64, 1, 1024, 288, 288, 1056, 1056]
    - [66, 917.088]
  - - [256, 64, 1, 2048, 288, 288, 2080, 2080]
    - [66, 1139.83]
  - - [256, 64, 1, 4096, 288, 288, 4128, 4128]
    - [64, 1242.11]
  - - [256, 128, 1, 64, 288, 288, 96, 128]
    - [46, 308.77]
  - - [256, 128, 1, 128, 288, 288, 160, 160]
    - [22, 587.191]
  - - [256, 128, 1, 256, 288, 288, 288, 288]
    - [46, 1020.52]
  - - [256, 128, 1, 512, 288, 288, 544, 544]
    - [22, 1517.48]
  - - [256, 128, 1, 1024, 288, 288, 1056, 1056]
    - [46, 2000.74]
  - - [256, 128, 1, 2048, 288, 288, 2080, 2080]
    - [74, 2370.92]
  - - [256, 128, 1, 4096, 288, 288, 4128, 4128]
    - [66, 2572.11]
  - - [256, 256, 1, 64, 288, 288, 96, 256]
    - [58, 725.784]
  - - [256, 256, 1, 128, 288, 288, 160, 256]
    - [22, 1304.6]
  - - [256, 256, 1, 256, 288, 288, 288, 288]
    - [13, 2125.58]
  - - [256, 256, 1, 512, 288, 288, 544, 544]
    - [69, 3035.5]
  - - [256, 256, 1, 1024, 288, 288, 1056, 1056]
    - [69, 4017.29]
  - - [256, 256, 1, 2048, 288, 288, 2080, 2080]
    - [63, 4810.84]
  - - [256, 256, 1, 4096, 288, 288, 4128, 4128]
    - [64, 5195.3]
  - - [256, 512, 1, 64, 288, 288, 96, 512]
    - [46, 1486.55]
  - - [256, 512, 1, 128, 288, 288, 160, 512]
    - [44, 2648.78]
  - - [256, 512, 1, 256, 288, 288, 288, 512]
    - [46, 4331.84]
  - - [256, 512, 1, 512, 288, 288, 544, 544]
    - [66, 6314.94]
  - - [256, 512, 1, 1024, 288, 288, 1056, 1056]
    - [74, 8129.97]
  - - [256, 512, 1, 2048, 288, 288, 2080, 2080]
    - [64, 9840.73]
  - - [256, 512, 1, 4096, 288, 288, 4128, 4128]
    - [63, 10545.1]
  - - [256, 1024, 1, 64, 288, 288, 96, 1024]
    - [58, 2796.69]
  - - [256, 1024, 1, 128, 288, 288, 160, 1024]
    - [46, 4976.93]
  - - [256, 1024, 1, 256, 288, 288, 288, 1024]
    - [7, 8191.0]
  - - [256, 1024, 1, 512, 288, 288, 544, 1024]
    - [13, 12053.7]
  - - [256, 1024, 1, 1024, 288, 288, 1056, 1056]
    - [74, 16096.1]
  - - [256, 1024, 1, 2048, 288, 288, 2080, 2080]
    - [76, 19227.5]
  - - [256, 1024, 1, 4096, 288, 288, 4128, 4128]
    - [66, 20928.2]
  - - [256, 2048, 1, 64, 288, 288, 96, 2048]
    - [59, 4436.07]
  - - [256, 2048, 1, 128, 288, 288, 160, 2048]
    - [20, 8234.22]
  - - [256, 2048, 1, 256, 288, 288, 288, 2048]
    - [12, 14061.6]
  - - [256, 2048, 1, 512, 288, 288, 544, 2048]
    - [12, 21365.4]
  - - [256, 2048, 1, 1024, 288, 288, 1056, 2048]
    - [11, 27006.9]
  - - [256, 2048, 1, 2048, 288, 288, 2080, 2080]
    - [12, 34570.0]
  - - [256, 2048, 1, 4096, 288, 288, 4128, 4128]
    - [31, 37368.4]
  - - [256, 4096, 1, 64, 288, 288, 96, 4096]
    - [32, 7932.49]
  - - [256, 4096, 1, 128, 288, 288, 160, 4096]
    - [38, 14082.2]
  - - [256, 4096, 1, 256, 288, 288, 288, 4096]
    - [16, 21178.4]
  - - [256, 4096, 1, 512, 288, 288, 544, 4096]
    - [18, 27895.2]
  - - [256, 4096, 1, 1024, 288, 288, 1056, 4096]
    - [38, 33316.0]
  - - [256, 4096, 1, 2048, 288, 288, 2080, 4096]
    - [3, 35361.2]
  - - [256, 4096, 1, 4096, 288, 288, 4128, 4128]
    - [35, 36518.4]
  - - [384, 64, 1, 64, 416, 416, 96, 96]
    - [42, 228.084]
  - - [384, 64, 1, 128, 416, 416, 160, 160]
    - [6, 402.27]
  - - [384, 64, 1, 256, 416, 416, 288, 288]
    - [46, 650.82]
  - - [384, 64, 1, 512, 416, 416, 544, 544]
    - [69, 1008.89]
  - - [384, 64, 1, 1024, 416, 416, 1056, 1056]
    - [22, 1379.02]
  - - [384, 64, 1, 2048, 416, 416, 2080, 2080]
    - [69, 1707.55]
  - - [384, 64, 1, 4096, 416, 416, 4128, 4128]
    - [66, 1885.58]
  - - [384, 128, 1, 64, 416, 416, 96, 128]
    - [34, 496.798]
  - - [384, 128, 1, 128, 416, 416, 160, 160]
    - [46, 947.227]
  - - [384, 128, 1, 256, 416, 416, 288, 288]
    - [7, 1500.65]
  - - [384, 128, 1, 512, 416, 416, 544, 544]
    - [69, 2297.2]
  - - [384, 128, 1, 1024, 416, 416, 1056, 1056]
    - [66, 3037.33]
  - - [384, 128, 1, 2048, 416, 416, 2080, 2080]
    - [22, 3580.67]
  - - [384, 128, 1, 4096, 416, 416, 4128, 4128]
    - [63, 3860.61]
  - - [384, 256, 1, 64, 416, 416, 96, 256]
    - [22, 1047.01]
  - - [384, 256, 1, 128, 416, 416, 160, 256]
    - [22, 1884.52]
  - - [384, 256, 1, 256, 416, 416, 288, 288]
    - [34, 3214.44]
  - - [384, 256, 1, 512, 416, 416, 544, 544]
    - [46, 4711.82]
  - - [384, 256, 1, 1024, 416, 416, 1056, 1056]
    - [63, 6166.97]
  - - [384, 256, 1, 2048, 416, 416, 2080, 2080]
    - [66, 7336.17]
  - - [384, 256, 1, 4096, 416, 416, 4128, 4128]
    - [66, 7785.41]
  - - [384, 512, 1, 64, 416, 416, 96, 512]
    - [46, 2042.35]
  - - [384, 512, 1, 128, 416, 416, 160, 512]
    - [7, 3652.51]
  - - [384, 512, 1, 256, 416, 416, 288, 512]
    - [22, 6018.37]
  - - [384, 512, 1, 512, 416, 416, 544, 544]
    - [69, 9206.45]
  - - [384, 512, 1, 1024, 416, 416, 1056, 1056]
    - [64, 12175.1]
  - - [384, 512, 1, 2048, 416, 416, 2080, 2080]
    - [74, 14334.9]
  - - [384, 512, 1, 4096, 416, 416, 4128, 4128]
    - [66, 15369.6]
  - - [384, 1024, 1, 64, 416, 416, 96, 1024]
    - [45, 3663.68]
  - - [384, 1024, 1, 128, 416, 416, 160, 1024]
    - [22, 6545.93]
  - - [384, 1024, 1, 256, 416, 416, 288, 1024]
    - [57, 10981.1]
  - - [384, 1024, 1, 512, 416, 416, 544, 1024]
    - [20, 16102.3]
  - - [384, 1024, 1, 1024, 416, 416, 1056, 1056]
    - [22, 21679.5]
  - - [384, 1024, 1, 2048, 416, 416, 2080, 2080]
    - [57, 26211.0]
  - - [384, 1024, 1, 4096, 416, 416, 4128, 4128]
    - [22, 28380.4]
  - - [384, 2048, 1, 64, 416, 416, 96, 2048]
    - [49, 6213.02]
  - - [384, 2048, 1, 128, 416, 416, 160, 2048]
    - [39, 10702.0]
  - - [384, 2048, 1, 256, 416, 416, 288, 2048]
    - [39, 18051.4]
  - - [384, 2048, 1, 512, 416, 416, 544, 2048]
    - [49, 24073.5]
  - - [384, 2048, 1, 1024, 416, 416, 1056, 2048]
    - [62, 30606.0]
  - - [384, 2048, 1, 2048, 416, 416, 2080, 2080]
    - [26, 34036.7]
  - - [384, 2048, 1, 4096, 416, 416, 4128, 4128]
    - [48, 37099.4]
  - - [384, 4096, 1, 64, 416, 416, 96, 4096]
    - [51, 10422.8]
  - - [384, 4096, 1, 128, 416, 416, 160, 4096]
    - [42, 16622.1]
  - - [384, 4096, 1, 256, 416, 416, 288, 4096]
    - [42, 23483.8]
  - - [384, 4096, 1, 512, 416, 416, 544, 4096]
    - [51, 30116.2]
  - - [384, 4096, 1, 1024, 416, 416, 1056, 4096]
    - [2, 33413.8]
  - - [384, 4096, 1, 2048, 416, 416, 2080, 4096]
    - [2, 36691.6]
  - - [384, 4096, 1, 4096, 416, 416, 4128, 4128]
    - [16, 37313.6]
  - - [768, 64, 1, 64, 800, 800, 96, 96]
    - [39, 454.782]
  - - [768, 64, 1, 128, 800, 800, 160, 160]
    - [6, 810.128]
  - - [768, 64, 1, 256, 800, 800, 288, 288]
    - [46, 1319.24]
  - - [768, 64, 1, 512, 800, 800, 544, 544]
    - [66, 2038.54]
  - - [768, 64, 1, 1024, 800, 800, 1056, 1056]
    - [71, 2794.96]
  - - [768, 64, 1, 2048, 800, 800, 2080, 2080]
    - [77, 3451.87]
  - - [768, 64, 1, 4096, 800, 800, 4128, 4128]
    - [66, 3760.23]
  - - [768, 128, 1, 64, 800, 800, 96, 128]
    - [22, 1034.44]
  - - [768, 128, 1, 128, 800, 800, 160, 160]
    - [46, 1958.73]
  - - [768, 128, 1, 256, 800, 800, 288, 288]
    - [58, 3195.66]
  - - [768, 128, 1, 512, 800, 800, 544, 544]
    - [46, 4692.49]
  - - [768, 128, 1, 1024, 800, 800, 1056, 1056]
    - [77, 6136.14]
  - - [768, 128, 1, 2048, 800, 800, 2080, 2080]
    - [63, 7270.21]
  - - [768, 128, 1, 4096, 800, 800, 4128, 4128]
    - [64, 7702.75]
  - - [768, 256, 1, 64, 800, 800, 96, 256]
    - [56, 2101.71]
  - - [768, 256, 1, 128, 800, 800, 160, 256]
    - [46, 3774.12]
  - - [768, 256, 1, 256, 800, 800, 288, 288]
    - [13, 6218.43]
  - - [768, 256, 1, 512, 800, 800, 544, 544]
    - [74, 9186.28]
  - - [768, 256, 1, 1024, 800, 800, 1056, 1056]
    - [69, 12130.3]
  - - [768, 256, 1, 2048, 800, 800, 2080, 2080]
    - [71, 14302.3]
  - - [768, 256, 1, 4096, 800, 800, 4128, 4128]
    - [77, 15585.0]
  - - [768, 512, 1, 64, 800, 800, 96, 512]
    - [38, 3626.2]
  - - [768, 512, 1, 128, 800, 800, 160, 512]
    - [31, 6595.68]
  - - [768, 512, 1, 256, 800, 800, 288, 512]
    - [19, 10682.7]
  - - [768, 512, 1, 512, 800, 800, 544, 544]
    - [20, 15968.2]
  - - [768, 512, 1, 1024, 800, 800, 1056, 1056]
    - [21, 21041.7]
  - - [768, 512, 1, 2048, 800, 800, 2080, 2080]
    - [58, 26153.1]
  - - [768, 512, 1, 4096, 800, 800, 4128, 4128]
    - [33, 28365.9]
  - - [768, 1024, 1, 64, 800, 800, 96, 1024]
    - [51, 5971.27]
  - - [768, 1024, 1, 128, 800, 800, 160, 1024]
    - [39, 10776.5]
  - - [768, 1024, 1, 256, 800, 800, 288, 1024]
    - [54, 18203.2]
  - - [768, 1024, 1, 512, 800, 800, 544, 1024]
    - [60, 24603.0]
  - - [768, 1024, 1, 1024, 800, 800, 1056, 1056]
    - [62, 31483.1]
  - - [768, 1024, 1, 2048, 800, 800, 2080, 2080]
    - [59, 34001.4]
  - - [768, 1024, 1, 4096, 800, 800, 4128, 4128]
    - [59, 37627.6]
  - - [768, 2048, 1, 64, 800, 800, 96, 2048]
    - [15, 10474.8]
  - - [768, 2048, 1, 128, 800, 800, 160, 2048]
    - [30, 16803.8]
  - - [768, 2048, 1, 256, 800, 800, 288, 2048]
    - [27, 24098.0]
  - - [768, 2048, 1, 512, 800, 800, 544, 2048]
    - [39, 31332.4]
  - - [768, 2048, 1, 1024, 800, 800, 1056, 2048]
    - [18, 34262.5]
  - - [768, 2048, 1, 2048, 800, 800, 2080, 2080]
    - [3, 37580.7]
  - - [768, 2048, 1, 4096, 800, 800, 4128, 4128]
    - [18, 39058.2]
  - - [768, 4096, 1, 64, 800, 800, 96, 4096]
    - [47, 13920.1]
  - - [768, 4096, 1, 128, 800, 800, 160, 4096]
    - [16, 21061.5]
  - - [768, 4096, 1, 256, 800, 800, 288, 4096]
    - [51, 28053.6]
  - - [768, 4096, 1, 512, 800, 800, 544, 4096]
    - [40, 32705.5]
  - - [768, 4096, 1, 1024, 800, 800, 1056, 4096]
    - [16, 37264.6]
  - - [768, 4096, 1, 2048, 800, 800, 2080, 4096]
    - [18, 39923.5]
  - - [768, 4096, 1, 4096, 800, 800, 4128, 4128]
    - [41, 40574.3]
  - - [1536, 64, 1, 64, 1568, 1568, 96, 96]
    - [46, 963.47]
  - - [1536, 64, 1, 128, 1568, 1568, 160, 160]
    - [22, 1623.18]
  - - [1536, 64, 1, 256, 1568, 1568, 288, 288]
    - [58, 2724.16]
  - - [1536, 64, 1, 512, 1568, 1568, 544, 544]
    - [5, 4143.21]
  - - [1536, 64, 1, 1024, 1568, 1568, 1056, 1056]
    - [69, 5591.48]
  - - [1536, 64, 1, 2048, 1568, 1568, 2080, 2080]
    - [69, 6922.48]
  - - [1536, 64, 1, 4096, 1568, 1568, 4128, 4128]
    - [64, 7706.44]
  - - [1536, 128, 1, 64, 1568, 1568, 96, 128]
    - [42, 1887.63]
  - - [1536, 128, 1, 128, 1568, 1568, 160, 160]
    - [22, 3597.17]
  - - [1536, 128, 1, 256, 1568, 1568, 288, 288]
    - [22, 5963.48]
  - - [1536, 128, 1, 512, 1568, 1568, 544, 544]
    - [46, 8840.97]
  - - [1536, 128, 1, 1024, 1568, 1568, 1056, 1056]
    - [64, 11817.7]
  - - [1536, 128, 1, 2048, 1568, 1568, 2080, 2080]
    - [74, 14597.9]
  - - [1536, 128, 1, 4096, 1568, 1568, 4128, 4128]
    - [64, 15648.9]
  - - [1536, 256, 1, 64, 1568, 1568, 96, 256]
    - [55, 3489.92]
  - - [1536, 256, 1, 128, 1568, 1568, 160, 256]
    - [45, 6316.72]
  - - [1536, 256, 1, 256, 1568, 1568, 288, 288]
    - [33, 10590.6]
  - - [1536, 256, 1, 512, 1568, 1568, 544, 544]
    - [45, 16378.7]
  - - [1536, 256, 1, 1024, 1568, 1568, 1056, 1056]
    - [46, 21949.0]
  - - [1536, 256, 1, 2048, 1568, 1568, 2080, 2080]
    - [45, 26374.1]
  - - [1536, 256, 1, 4096, 1568, 1568, 4128, 4128]
    - [43, 28173.3]
  - - [1536, 512, 1, 64, 1568, 1568, 96, 512]
    - [24, 6168.85]
  - - [1536, 512, 1, 128, 1568, 1568, 160, 512]
    - [24, 10743.1]
  - - [1536, 512, 1, 256, 1568, 1568, 288, 512]
    - [42, 17652.5]
  - - [1536, 512, 1, 512, 1568, 1568, 544, 544]
    - [28, 24610.6]
  - - [1536, 512, 1, 1024, 1568, 1568, 1056, 1056]
    - [24, 31603.0]
  - - [1536, 512, 1, 2048, 1568, 1568, 2080, 2080]
    - [24, 34763.2]
  - - [1536, 512, 1, 4096, 1568, 1568, 4128, 4128]
    - [47, 37426.5]
  - - [1536, 1024, 1, 64, 1568, 1568, 96, 1024]
    - [38, 10887.3]
  - - [1536, 1024, 1, 128, 1568, 1568, 160, 1024]
    - [39, 16999.6]
  - - [1536, 1024, 1, 256, 1568, 1568, 288, 1024]
    - [41, 24244.5]
  - - [1536, 1024, 1, 512, 1568, 1568, 544, 1024]
    - [39, 31010.3]
  - - [1536, 1024, 1, 1024, 1568, 1568, 1056, 1056]
    - [39, 34354.6]
  - - [1536, 1024, 1, 2048, 1568, 1568, 2080, 2080]
    - [18, 37523.8]
  - - [1536, 1024, 1, 4096, 1568, 1568, 4128, 4128]
    - [18, 39432.3]
  - - [1536, 2048, 1, 64, 1568, 1568, 96, 2048]
    - [47, 13686.4]
  - - [1536, 2048, 1, 128, 1568, 1568, 160, 2048]
    - [42, 20792.8]
  - - [1536, 2048, 1, 256, 1568, 1568, 288, 2048]
    - [54, 28334.9]
  - - [1536, 2048, 1, 512, 1568, 1568, 544, 2048]
    - [16, 32858.9]
  - - [1536, 2048, 1, 1024, 1568, 1568, 1056, 2048]
    - [54, 37154.2]
  - - [1536, 2048, 1, 2048, 1568, 1568, 2080, 2080]
    - [18, 39958.7]
  - - [1536, 2048, 1, 4096, 1568, 1568, 4128, 4128]
    - [18, 40498.2]
  - - [1536, 4096, 1, 64, 1568, 1568, 96, 4096]
    - [54, 16087.5]
  - - [1536, 4096, 1, 128, 1568, 1568, 160, 4096]
    - [39, 23586.3]
  - - [1536, 4096, 1, 256, 1568, 1568, 288, 4096]
    - [39, 29628.1]
  - - [1536, 4096, 1, 512, 1568, 1568, 544, 4096]
    - [39, 35542.2]
  - - [1536, 4096, 1, 1024, 1568, 1568, 1056, 4096]
    - [54, 39207.7]
  - - [1536, 4096, 1, 2048, 1568, 1568, 2080, 4096]
    - [16, 40647.0]
  - - [1536, 4096, 1, 4096, 1568, 1568, 4128, 4128]
    - [17, 41058.2]
  - - [3072, 64, 1, 64, 3104, 3104, 96, 96]
    - [19, 1678.62]
  - - [3072, 64, 1, 128, 3104, 3104, 160, 160]
    - [55, 2911.7]
  - - [3072, 64, 1, 256, 3104, 3104, 288, 288]
    - [57, 5019.12]
  - - [3072, 64, 1, 512, 3104, 3104, 544, 544]
    - [19, 7567.53]
  - - [3072, 64, 1, 1024, 3104, 3104, 1056, 1056]
    - [6, 10735.7]
  - - [3072, 64, 1, 2048, 3104, 3104, 2080, 2080]
    - [4, 12655.7]
  - - [3072, 64, 1, 4096, 3104, 3104, 4128, 4128]
    - [75, 10298.3]
  - - [3072, 128, 1, 64, 3104, 3104, 96, 128]
    - [55, 3220.61]
  - - [3072, 128, 1, 128, 3104, 3104, 160, 160]
    - [19, 6127.56]
  - - [3072, 128, 1, 256, 3104, 3104, 288, 288]
    - [33, 10076.4]
  - - [3072, 128, 1, 512, 3104, 3104, 544, 544]
    - [19, 14908.7]
  - - [3072, 128, 1, 1024, 3104, 3104, 1056, 1056]
    - [20, 21530.0]
  - - [3072, 128, 1, 2048, 3104, 3104, 2080, 2080]
    - [44, 26064.2]
  - - [3072, 128, 1, 4096, 3104, 3104, 4128, 4128]
    - [71, 21717.2]
  - - [3072, 256, 1, 64, 3104, 3104, 96, 256]
    - [24, 5793.24]
  - - [3072, 256, 1, 128, 3104, 3104, 160, 256]
    - [60, 11558.5]
  - - [3072, 256, 1, 256, 3104, 3104, 288, 288]
    - [49, 19328.6]
  - - [3072, 256, 1, 512, 3104, 3104, 544, 544]
    - [26, 26360.3]
  - - [3072, 256, 1, 1024, 3104, 3104, 1056, 1056]
    - [47, 31997.2]
  - - [3072, 256, 1, 2048, 3104, 3104, 2080, 2080]
    - [23, 34932.9]
  - - [3072, 256, 1, 4096, 3104, 3104, 4128, 4128]
    - [9, 36577.8]
  - - [3072, 512, 1, 64, 3104, 3104, 96, 512]
    - [38, 9776.01]
  - - [3072, 512, 1, 128, 3104, 3104, 160, 512]
    - [27, 17366.3]
  - - [3072, 512, 1, 256, 3104, 3104, 288, 512]
    - [39, 24780.2]
  - - [3072, 512, 1, 512, 3104, 3104, 544, 544]
    - [51, 31003.2]
  - - [3072, 512, 1, 1024, 3104, 3104, 1056, 1056]
    - [18, 34266.9]
  - - [3072, 512, 1, 2048, 3104, 3104, 2080, 2080]
    - [16, 37733.5]
  - - [3072, 512, 1, 4096, 3104, 3104, 4128, 4128]
    - [2, 38526.8]
  - - [3072, 1024, 1, 64, 3104, 3104, 96, 1024]
    - [39, 13986.8]
  - - [3072, 1024, 1, 128, 3104, 3104, 160, 1024]
    - [42, 21180.0]
  - - [3072, 1024, 1, 256, 3104, 3104, 288, 1024]
    - [51, 28100.6]
  - - [3072, 1024, 1, 512, 3104, 3104, 544, 1024]
    - [18, 33081.0]
  - - [3072, 1024, 1, 1024, 3104, 3104, 1056, 1056]
    - [18, 37274.5]
  - - [3072, 1024, 1, 2048, 3104, 3104, 2080, 2080]
    - [16, 39924.7]
  - - [3072, 1024, 1, 4096, 3104, 3104, 4128, 4128]
    - [0, 39642.0]
  - - [3072, 2048, 1, 64, 3104, 3104, 96, 2048]
    - [39, 16096.5]
  - - [3072, 2048, 1, 128, 3104, 3104, 160, 2048]
    - [39, 23578.0]
  - - [3072, 2048, 1, 256, 3104, 3104, 288, 2048]
    - [16, 29621.6]
  - - [3072, 2048, 1, 512, 3104, 3104, 544, 2048]
    - [42, 35377.9]
  - - [3072, 2048, 1, 1024, 3104, 3104, 1056, 2048]
    - [18, 39180.5]
  - - [3072, 2048, 1, 2048, 3104, 3104, 2080, 2080]
    - [18, 40769.0]
  - - [3072, 2048, 1, 4096, 3104, 3104, 4128, 4128]
    - [52, 40033.8]
  - - [3072, 4096, 1, 64, 3104, 3104, 96, 4096]
    - [39, 16953.1]
  - - [3072, 4096, 1, 128, 3104, 3104, 160, 4096]
    - [51, 24535.6]
  - - [3072, 4096, 1, 256, 3104, 3104, 288, 4096]
    - [54, 31692.5]
  - - [3072, 4096, 1, 512, 3104, 3104, 544, 4096]
    - [39, 36868.0]
  - - [3072, 4096, 1, 1024, 3104, 3104, 1056, 4096]
    - [51, 39602.3]
  - - [3072, 4096, 1, 2048, 3104, 3104, 2080, 4096]
    - [53, 40759.8]
  - - [3072, 4096, 1, 4096, 3104, 3104, 4128, 4128]
    - [59, 38496.4]
  - - [4096, 64, 1, 64, 4128, 4128, 96, 96]
    - [38, 1810.23]
  - - [4096, 64, 1, 128, 4128, 4128, 160, 160]
    - [12, 3632.24]
  - - [4096, 64, 1, 256, 4128, 4128, 288, 288]
    - [1, 5986.52]
  - - [4096, 64, 1, 512, 4128, 4128, 544, 544]
    - [50, 9024.89]
  - - [4096, 64, 1, 1024, 4128, 4128, 1056, 1056]
    - [18, 12521.5]
  - - [4096, 64, 1, 2048, 4128, 4128, 2080, 2080]
    - [1, 15810.3]
  - - [4096, 64, 1, 4096, 4128, 4128, 4128, 4128]
    - [67, 14132.5]
  - - [4096, 128, 1, 64, 4128, 4128, 96, 128]
    - [39, 5069.41]
  - - [4096, 128, 1, 128, 4128, 4128, 160, 160]
    - [61, 8922.89]
  - - [4096, 128, 1, 256, 4128, 4128, 288, 288]
    - [30, 14676.7]
  - - [4096, 128, 1, 512, 4128, 4128, 544, 544]
    - [16, 21728.7]
  - - [4096, 128, 1, 1024, 4128, 4128, 1056, 1056]
    - [39, 29012.2]
  - - [4096, 128, 1, 2048, 4128, 4128, 2080, 2080]
    - [2, 34178.2]
  - - [4096, 128, 1, 4096, 4128, 4128, 4128, 4128]
    - [72, 28705.1]
  - - [4096, 256, 1, 64, 4128, 4128, 96, 256]
    - [36, 8789.66]
  - - [4096, 256, 1, 128, 4128, 4128, 160, 256]
    - [50, 14625.4]
  - - [4096, 256, 1, 256, 4128, 4128, 288, 288]
    - [37, 21662.0]
  - - [4096, 256, 1, 512, 4128, 4128, 544, 544]
    - [29, 28523.6]
  - - [4096, 256, 1, 1024, 4128, 4128, 1056, 1056]
    - [2, 33504.2]
  - - [4096, 256, 1, 2048, 4128, 4128, 2080, 2080]
    - [18, 35874.5]
  - - [4096, 256, 1, 4096, 4128, 4128, 4128, 4128]
    - [14, 36589.4]
  - - [4096, 512, 1, 64, 4128, 4128, 96, 512]
    - [25, 11798.3]
  - - [4096, 512, 1, 128, 4128, 4128, 160, 512]
    - [16, 18593.6]
  - - [4096, 512, 1, 256, 4128, 4128, 288, 512]
    - [39, 25839.7]
  - - [4096, 512, 1, 512, 4128, 4128, 544, 544]
    - [16, 32826.1]
  - - [4096, 512, 1, 1024, 4128, 4128, 1056, 1056]
    - [39, 35634.0]
  - - [4096, 512, 1, 2048, 4128, 4128, 2080, 2080]
    - [18, 38853.7]
  - - [4096, 512, 1, 4096, 4128, 4128, 4128, 4128]
    - [61, 38321.1]
  - - [4096, 1024, 1, 64, 4128, 4128, 96, 1024]
    - [42, 14780.9]
  - - [4096, 1024, 1, 128, 4128, 4128, 160, 1024]
    - [16, 22119.9]
  - - [4096, 1024, 1, 256, 4128, 4128, 288, 1024]
    - [39, 28047.5]
  - - [4096, 1024, 1, 512, 4128, 4128, 544, 1024]
    - [42, 34050.3]
  - - [4096, 1024, 1, 1024, 4128, 4128, 1056, 1056]
    - [16, 38228.2]
  - - [4096, 1024, 1, 2048, 4128, 4128, 2080, 2080]
    - [18, 40709.9]
  - - [4096, 1024, 1, 4096, 4128, 4128, 4128, 4128]
    - [42, 39644.9]
  - - [4096, 2048, 1, 64, 4128, 4128, 96, 2048]
    - [42, 16864.2]
  - - [4096, 2048, 1, 128, 4128, 4128, 160, 2048]
    - [39, 23391.0]
  - - [4096, 2048, 1, 256, 4128, 4128, 288, 2048]
    - [51, 30651.7]
  - - [4096, 2048, 1, 512, 4128, 4128, 544, 2048]
    - [39, 36170.6]
  - - [4096, 2048, 1, 1024, 4128, 4128, 1056, 2048]
    - [16, 39707.2]
  - - [4096, 2048, 1, 2048, 4128, 4128, 2080, 2080]
    - [18, 40750.7]
  - - [4096, 2048, 1, 4096, 4128, 4128, 4128, 4128]
    - [38, 40255.2]
  - - [4096, 4096, 1, 64, 4128, 4128, 96, 4096]
    - [46, 17374.8]
  - - [4096, 4096, 1, 128, 4128, 4128, 160, 4096]
    - [42, 24761.4]
  - - [4096, 4096, 1, 256, 4128, 4128, 288, 4096]
    - [39, 31607.4]
  - - [4096, 4096, 1, 512, 4128, 4128, 544, 4096]
    - [39, 37076.6]
  - - [4096, 4096, 1, 1024, 4128, 4128, 1056, 4096]
    - [51, 39402.8]
  - - [4096, 4096, 1, 2048, 4128, 4128, 2080, 4096]
    - [18, 41023.1]
  - - [4096, 4096, 1, 4096, 4128, 4128, 4128, 4128]
    - [59, 37774.0]
- null
- null
- DeviceEfficiency
