library/src/blas3/Tensile/Logic/asm_full/navi31/navi31_Cijk_Alik_Bljk_BBS_BH_GB.yaml
- {MinimumRequiredVersion: 4.35.0}
- navi31
- gfx1100
- [Device 73bf]
    SolutionIndex: 0
    SolutionNameMin: Cijk_Alik_Bljk_BBS_BH_MT32x32x16_MI16x16x16x1_SN_1LDSB0_AMAS0_GRVW8_IU1_SIA1_SU0_SUS0_SVW1_TT1_16_VW1_WGM4
    SolutionIndex: 1
    SolutionNameMin: Cijk_Alik_Bljk_BBS_BH_MT32x32x16_MI16x16x16x1_SN_1LDSB1_AMAS0_GRVW4_IU1_SIA2_SU0_SUS0_SVW1_TT1_16_VW1_WGM4
    SolutionIndex: 2
    SolutionNameMin: Cijk_Alik_Bljk_BBS_BH_MT32x32x16_MI16x16x16x1_SN_1LDSB0_AMAS0_GRVW8_IU1_SIA3_SU32_SUS128_SVW1_TT1_16_VW1_WGM4
    SolutionIndex: 3
    SolutionNameMin: Cijk_Alik_Bljk_BBS_BH_MT32x32x16_MI16x16x16x1_SN_1LDSB0_AMAS0_GRVW4_IU1_SIA1_SU0_SUS0_SVW1_TT1_16_VW1_WGM8
    SolutionIndex: 4
    SolutionNameMin: Cijk_Alik_Bljk_BBS_BH_MT32x32x16_MI16x16x16x1_SN_1LDSB0_AMAS0_GRVW8_IU1_SIA1_SU0_SUS0_SVW1_TT1_16_VW1_WGM8
    SolutionIndex: 5
    SolutionNameMin: Cijk_Alik_Bljk_BBS_BH_MT32x32x16_MI16x16x16x1_SN_1LDSB1_AMAS0_GRVW4_IU1_SIA2_SU0_SUS0_SVW1_TT1_16_VW1_WGM8
    SolutionIndex: 6
    SolutionNameMin: Cijk_Alik_Bljk_BBS_BH_MT32x32x16_MI16x16x16x1_SN_1LDSB0_AMAS0_GRVW8_IU1_SIA3_SU0_SUS0_SVW1_TT1_16_VW1_WGM8
    SolutionIndex: 7
    SolutionNameMin: Cijk_Alik_Bljk_BBS_BH_MT64x64x16_MI16x16x16x1_SN_1LDSB0_AMAS0_GRVW4_IU1_SIA1_SU0_SUS0_SVW1_TT2_32_VW1_WGM4
    SolutionIndex: 8
    SolutionNameMin: Cijk_Alik_Bljk_BBS_BH_MT64x64x16_MI16x16x16x1_SN_1LDSB0_AMAS0_GRVW8_IU1_SIA1_SU0_SUS0_SVW1_TT2_32_VW1_WGM4
    SolutionIndex: 9
    SolutionNameMin: Cijk_Alik_Bljk_BBS_BH_MT64x64x16_MI16x16x16x1_SN_1LDSB0_AMAS3_GRVW8_IU1_SIA1_SU0_SUS0_SVW2_TT2_32_VW2_WGM4
    SolutionIndex: 10
    SolutionNameMin: Cijk_Alik_Bljk_BBS_BH_MT64x64x16_MI16x16x16x1_SN_1LDSB1_AMAS0_GRVW8_IU1_SIA2_SU0_SUS0_SVW1_TT2_32_VW1_WGM4
    SolutionIndex: 11
    SolutionNameMin: Cijk_Alik_Bljk_BBS_BH_MT64x64x16_MI16x16x16x1_SN_1LDSB1_AMAS3_GRVW8_IU1_SIA2_SU0_SUS0_SVW2_TT2_32_VW2_WGM4
    SolutionIndex: 12
    SolutionNameMin: Cijk_Alik_Bljk_BBS_BH_MT64x64x16_MI16x16x16x1_SN_1LDSB0_AMAS0_GRVW4_IU1_SIA3_SU0_SUS0_SVW1_TT2_32_VW1_WGM4
    SolutionIndex: 13
    SolutionNameMin: Cijk_Alik_Bljk_BBS_BH_MT64x64x16_MI16x16x16x1_SN_1LDSB0_AMAS0_GRVW8_IU1_SIA3_SU0_SUS0_SVW1_TT2_32_VW1_WGM4
    SolutionIndex: 14
    SolutionNameMin: Cijk_Alik_Bljk_BBS_BH_MT64x64x16_MI16x16x16x1_SN_1LDSB0_AMAS3_GRVW8_IU1_SIA3_SU0_SUS0_SVW2_TT2_32_VW2_WGM4
    SolutionIndex: 15
    SolutionNameMin: Cijk_Alik_Bljk_BBS_BH_MT64x64x16_MI16x16x16x1_SN_1LDSB0_AMAS0_GRVW8_IU1_SIA1_SU32_SUS128_SVW1_TT2_32_VW1_WGM4
    SolutionIndex: 16
    SolutionNameMin: Cijk_Alik_Bljk_BBS_BH_MT64x64x16_MI16x16x16x1_SN_1LDSB1_AMAS0_GRVW4_IU1_SIA2_SU32_SUS128_SVW1_TT2_32_VW1_WGM4
    SolutionIndex: 17
    SolutionNameMin: Cijk_Alik_Bljk_BBS_BH_MT64x64x16_MI16x16x16x1_SN_1LDSB1_AMAS3_GRVW4_IU1_SIA2_SU32_SUS128_SVW2_TT2_32_VW2_WGM4
    SolutionIndex: 18
    SolutionNameMin: Cijk_Alik_Bljk_BBS_BH_MT64x64x16_MI16x16x16x1_SN_1LDSB1_AMAS3_GRVW8_IU1_SIA2_SU32_SUS128_SVW2_TT2_32_VW2_WGM4
    SolutionIndex: 19
    SolutionNameMin: Cijk_Alik_Bljk_BBS_BH_MT64x64x16_MI16x16x16x1_SN_1LDSB1_AMAS3_GRVW4_IU1_SIA2_SU32_SUS256_SVW2_TT2_32_VW2_WGM4
    SolutionIndex: 20
    SolutionNameMin: Cijk_Alik_Bljk_BBS_BH_MT64x64x16_MI16x16x16x1_SN_1LDSB1_AMAS3_GRVW8_IU1_SIA2_SU32_SUS256_SVW2_TT2_32_VW2_WGM4
    SolutionIndex: 21
    SolutionNameMin: Cijk_Alik_Bljk_BBS_BH_MT64x64x16_MI16x16x16x1_SN_1LDSB0_AMAS3_GRVW8_IU1_SIA3_SU32_SUS256_SVW2_TT2_32_VW2_WGM4
    SolutionIndex: 22
    SolutionNameMin: Cijk_Alik_Bljk_BBS_BH_MT64x64x16_MI16x16x16x1_SN_1LDSB0_AMAS3_GRVW8_IU1_SIA1_SU0_SUS0_SVW2_TT2_32_VW2_WGM8
    SolutionIndex: 23
    SolutionNameMin: Cijk_Alik_Bljk_BBS_BH_MT64x64x16_MI16x16x16x1_SN_1LDSB1_AMAS3_GRVW4_IU1_SIA2_SU0_SUS0_SVW2_TT2_32_VW2_WGM8
    SolutionIndex: 24
    SolutionNameMin: Cijk_Alik_Bljk_BBS_BH_MT64x64x16_MI16x16x16x1_SN_1LDSB1_AMAS0_GRVW8_IU1_SIA2_SU0_SUS0_SVW1_TT2_32_VW1_WGM8
    SolutionIndex: 25
    SolutionNameMin: Cijk_Alik_Bljk_BBS_BH_MT64x64x16_MI16x16x16x1_SN_1LDSB1_AMAS3_GRVW8_IU1_SIA2_SU0_SUS0_SVW2_TT2_32_VW2_WGM8
    SolutionIndex: 26
    SolutionNameMin: Cijk_Alik_Bljk_BBS_BH_MT64x64x16_MI16x16x16x1_SN_1LDSB0_AMAS3_GRVW8_IU1_SIA3_SU0_SUS0_SVW2_TT2_32_VW2_WGM8
    SolutionIndex: 27
    SolutionNameMin: Cijk_Alik_Bljk_BBS_BH_MT64x64x16_MI16x16x16x1_SN_1LDSB0_AMAS3_GRVW4_IU1_SIA1_SU32_SUS128_SVW2_TT2_32_VW2_WGM8
    SolutionIndex: 28
    SolutionNameMin: Cijk_Alik_Bljk_BBS_BH_MT64x64x16_MI16x16x16x1_SN_1LDSB1_AMAS3_GRVW8_IU1_SIA2_SU32_SUS128_SVW2_TT2_32_VW2_WGM8
    SolutionIndex: 29
    SolutionNameMin: Cijk_Alik_Bljk_BBS_BH_MT64x64x16_MI16x16x16x1_SN_1LDSB1_AMAS3_GRVW2_IU1_SIA2_SU32_SUS256_SVW2_TT2_32_VW2_WGM8
    SolutionIndex: 30
    SolutionNameMin: Cijk_Alik_Bljk_BBS_BH_MT128x128x16_MI16x16x16x1_SN_1LDSB0_AMAS3_GRVW2_IU1_SIA1_SU0_SUS0_SVW2_TT4_64_VW2_WGM4
    SolutionIndex: 31
    SolutionNameMin: Cijk_Alik_Bljk_BBS_BH_MT128x128x16_MI16x16x16x1_SN_1LDSB0_AMAS3_GRVW2_IU1_SIA1_SU0_SUS0_SVW4_TT4_64_VW4_WGM4
    SolutionIndex: 32
    SolutionNameMin: Cijk_Alik_Bljk_BBS_BH_MT128x128x16_MI16x16x16x1_SN_1LDSB0_AMAS0_GRVW4_IU1_SIA1_SU0_SUS0_SVW1_TT4_64_VW1_WGM4
    SolutionIndex: 33
    SolutionNameMin: Cijk_Alik_Bljk_BBS_BH_MT128x128x16_MI16x16x16x1_SN_1LDSB0_AMAS3_GRVW4_IU1_SIA1_SU0_SUS0_SVW2_TT4_64_VW2_WGM4
    SolutionIndex: 34
    SolutionNameMin: Cijk_Alik_Bljk_BBS_BH_MT128x128x16_MI16x16x16x1_SN_1LDSB0_AMAS3_GRVW4_IU1_SIA1_SU0_SUS0_SVW4_TT4_64_VW4_WGM4
    SolutionIndex: 35
    SolutionNameMin: Cijk_Alik_Bljk_BBS_BH_MT128x128x16_MI16x16x16x1_SN_1LDSB0_AMAS3_GRVW8_IU1_SIA1_SU0_SUS0_SVW2_TT4_64_VW2_WGM4
    SolutionIndex: 36
    SolutionNameMin: Cijk_Alik_Bljk_BBS_BH_MT128x128x16_MI16x16x16x1_SN_1LDSB0_AMAS3_GRVW8_IU1_SIA1_SU0_SUS0_SVW4_TT4_64_VW4_WGM4
    SolutionIndex: 37
    SolutionNameMin: Cijk_Alik_Bljk_BBS_BH_MT128x128x16_MI16x16x16x1_SN_1LDSB1_AMAS3_GRVW4_IU1_SIA2_SU0_SUS0_SVW4_TT4_64_VW4_WGM4
    SolutionIndex: 38
    SolutionNameMin: Cijk_Alik_Bljk_BBS_BH_MT128x128x16_MI16x16x16x1_SN_1LDSB1_AMAS3_GRVW8_IU1_SIA2_SU0_SUS0_SVW2_TT4_64_VW2_WGM4
    SolutionIndex: 39
    SolutionNameMin: Cijk_Alik_Bljk_BBS_BH_MT128x128x16_MI16x16x16x1_SN_1LDSB1_AMAS3_GRVW8_IU1_SIA2_SU0_SUS0_SVW4_TT4_64_VW4_WGM4
    SolutionIndex: 40
    SolutionNameMin: Cijk_Alik_Bljk_BBS_BH_MT128x128x16_MI16x16x16x1_SN_1LDSB0_AMAS0_GRVW2_IU1_SIA3_SU0_SUS0_SVW1_TT4_64_VW1_WGM4
    SolutionIndex: 41
    SolutionNameMin: Cijk_Alik_Bljk_BBS_BH_MT128x128x16_MI16x16x16x1_SN_1LDSB0_AMAS3_GRVW2_IU1_SIA3_SU0_SUS0_SVW2_TT4_64_VW2_WGM4
    SolutionIndex: 42
    SolutionNameMin: Cijk_Alik_Bljk_BBS_BH_MT128x128x16_MI16x16x16x1_SN_1LDSB0_AMAS3_GRVW2_IU1_SIA3_SU0_SUS0_SVW4_TT4_64_VW4_WGM4
    SolutionIndex: 43
    SolutionNameMin: Cijk_Alik_Bljk_BBS_BH_MT128x128x16_MI16x16x16x1_SN_1LDSB0_AMAS3_GRVW4_IU1_SIA3_SU0_SUS0_SVW2_TT4_64_VW2_WGM4
    SolutionIndex: 44
    SolutionNameMin: Cijk_Alik_Bljk_BBS_BH_MT128x128x16_MI16x16x16x1_SN_1LDSB0_AMAS3_GRVW4_IU1_SIA3_SU0_SUS0_SVW4_TT4_64_VW4_WGM4
    SolutionIndex: 45
    SolutionNameMin: Cijk_Alik_Bljk_BBS_BH_MT128x128x16_MI16x16x16x1_SN_1LDSB0_AMAS3_GRVW8_IU1_SIA3_SU0_SUS0_SVW2_TT4_64_VW2_WGM4
    SolutionIndex: 46
    SolutionNameMin: Cijk_Alik_Bljk_BBS_BH_MT128x128x16_MI16x16x16x1_SN_1LDSB0_AMAS3_GRVW8_IU1_SIA3_SU0_SUS0_SVW4_TT4_64_VW4_WGM4
    SolutionIndex: 47
    SolutionNameMin: Cijk_Alik_Bljk_BBS_BH_MT128x128x16_MI16x16x16x1_SN_1LDSB0_AMAS3_GRVW2_IU1_SIA1_SU32_SUS128_SVW2_TT4_64_VW2_WGM4
    SolutionIndex: 48
    SolutionNameMin: Cijk_Alik_Bljk_BBS_BH_MT128x128x16_MI16x16x16x1_SN_1LDSB0_AMAS3_GRVW4_IU1_SIA1_SU32_SUS128_SVW2_TT4_64_VW2_WGM4
    SolutionIndex: 49
    SolutionNameMin: Cijk_Alik_Bljk_BBS_BH_MT128x128x16_MI16x16x16x1_SN_1LDSB0_AMAS3_GRVW4_IU1_SIA3_SU32_SUS128_SVW4_TT4_64_VW4_WGM4
    SolutionIndex: 50
    SolutionNameMin: Cijk_Alik_Bljk_BBS_BH_MT128x128x16_MI16x16x16x1_SN_1LDSB0_AMAS3_GRVW8_IU1_SIA3_SU32_SUS128_SVW2_TT4_64_VW2_WGM4
    SolutionIndex: 51
    SolutionNameMin: Cijk_Alik_Bljk_BBS_BH_MT128x128x16_MI16x16x16x1_SN_1LDSB0_AMAS3_GRVW8_IU1_SIA3_SU32_SUS128_SVW4_TT4_64_VW4_WGM4
    SolutionIndex: 52
    SolutionNameMin: Cijk_Alik_Bljk_BBS_BH_MT128x128x16_MI16x16x16x1_SN_1LDSB0_AMAS3_GRVW2_IU1_SIA1_SU32_SUS256_SVW4_TT4_64_VW4_WGM4
    SolutionIndex: 53
    SolutionNameMin: Cijk_Alik_Bljk_BBS_BH_MT128x128x16_MI16x16x16x1_SN_1LDSB0_AMAS3_GRVW4_IU1_SIA1_SU32_SUS256_SVW2_TT4_64_VW2_WGM4
    SolutionIndex: 54
    SolutionNameMin: Cijk_Alik_Bljk_BBS_BH_MT128x128x16_MI16x16x16x1_SN_1LDSB0_AMAS3_GRVW4_IU1_SIA1_SU32_SUS256_SVW4_TT4_64_VW4_WGM4
    SolutionIndex: 55
    SolutionNameMin: Cijk_Alik_Bljk_BBS_BH_MT128x128x16_MI16x16x16x1_SN_1LDSB0_AMAS3_GRVW8_IU1_SIA1_SU32_SUS256_SVW2_TT4_64_VW2_WGM4
    SolutionIndex: 56
    SolutionNameMin: Cijk_Alik_Bljk_BBS_BH_MT128x128x16_MI16x16x16x1_SN_1LDSB0_AMAS3_GRVW8_IU1_SIA1_SU32_SUS256_SVW4_TT4_64_VW4_WGM4
    SolutionIndex: 57
    SolutionNameMin: Cijk_Alik_Bljk_BBS_BH_MT128x128x16_MI16x16x16x1_SN_1LDSB0_AMAS3_GRVW8_IU1_SIA3_SU32_SUS256_SVW2_TT4_64_VW2_WGM4
    SolutionIndex: 58
    SolutionNameMin: Cijk_Alik_Bljk_BBS_BH_MT128x128x16_MI16x16x16x1_SN_1LDSB0_AMAS3_GRVW8_IU1_SIA3_SU32_SUS256_SVW4_TT4_64_VW4_WGM4
    SolutionIndex: 59
    SolutionNameMin: Cijk_Alik_Bljk_BBS_BH_MT128x128x16_MI16x16x16x1_SN_1LDSB0_AMAS0_GRVW2_IU1_SIA1_SU0_SUS0_SVW1_TT4_64_VW1_WGM8
    SolutionIndex: 60
    SolutionNameMin: Cijk_Alik_Bljk_BBS_BH_MT128x128x16_MI16x16x16x1_SN_1LDSB0_AMAS3_GRVW2_IU1_SIA1_SU0_SUS0_SVW4_TT4_64_VW4_WGM8
    SolutionIndex: 61
    SolutionNameMin: Cijk_Alik_Bljk_BBS_BH_MT128x128x16_MI16x16x16x1_SN_1LDSB0_AMAS3_GRVW4_IU1_SIA1_SU0_SUS0_SVW2_TT4_64_VW2_WGM8
    SolutionIndex: 62
    SolutionNameMin: Cijk_Alik_Bljk_BBS_BH_MT128x128x16_MI16x16x16x1_SN_1LDSB0_AMAS0_GRVW8_IU1_SIA1_SU0_SUS0_SVW1_TT4_64_VW1_WGM8
    SolutionIndex: 63
    SolutionNameMin: Cijk_Alik_Bljk_BBS_BH_MT128x128x16_MI16x16x16x1_SN_1LDSB0_AMAS3_GRVW8_IU1_SIA1_SU0_SUS0_SVW2_TT4_64_VW2_WGM8
    SolutionIndex: 64
    SolutionNameMin: Cijk_Alik_Bljk_BBS_BH_MT128x128x16_MI16x16x16x1_SN_1LDSB0_AMAS3_GRVW8_IU1_SIA1_SU0_SUS0_SVW4_TT4_64_VW4_WGM8
    SolutionIndex: 65
    SolutionNameMin: Cijk_Alik_Bljk_BBS_BH_MT128x128x16_MI16x16x16x1_SN_1LDSB1_AMAS3_GRVW4_IU1_SIA2_SU0_SUS0_SVW2_TT4_64_VW2_WGM8
    SolutionIndex: 66
    SolutionNameMin: Cijk_Alik_Bljk_BBS_BH_MT128x128x16_MI16x16x16x1_SN_1LDSB1_AMAS3_GRVW8_IU1_SIA2_SU0_SUS0_SVW2_TT4_64_VW2_WGM8
    SolutionIndex: 67
    SolutionNameMin: Cijk_Alik_Bljk_BBS_BH_MT128x128x16_MI16x16x16x1_SN_1LDSB1_AMAS3_GRVW8_IU1_SIA2_SU0_SUS0_SVW4_TT4_64_VW4_WGM8
    SolutionIndex: 68
    SolutionNameMin: Cijk_Alik_Bljk_BBS_BH_MT128x128x16_MI16x16x16x1_SN_1LDSB0_AMAS3_GRVW2_IU1_SIA3_SU0_SUS0_SVW2_TT4_64_VW2_WGM8
    SolutionIndex: 69
    SolutionNameMin: Cijk_Alik_Bljk_BBS_BH_MT128x128x16_MI16x16x16x1_SN_1LDSB0_AMAS0_GRVW4_IU1_SIA3_SU0_SUS0_SVW1_TT4_64_VW1_WGM8
    SolutionIndex: 70
    SolutionNameMin: Cijk_Alik_Bljk_BBS_BH_MT128x128x16_MI16x16x16x1_SN_1LDSB0_AMAS3_GRVW4_IU1_SIA3_SU0_SUS0_SVW2_TT4_64_VW2_WGM8
    SolutionIndex: 71
    SolutionNameMin: Cijk_Alik_Bljk_BBS_BH_MT128x128x16_MI16x16x16x1_SN_1LDSB0_AMAS3_GRVW4_IU1_SIA3_SU0_SUS0_SVW4_TT4_64_VW4_WGM8
    SolutionIndex: 72
    SolutionNameMin: Cijk_Alik_Bljk_BBS_BH_MT128x128x16_MI16x16x16x1_SN_1LDSB0_AMAS3_GRVW8_IU1_SIA3_SU0_SUS0_SVW2_TT4_64_VW2_WGM8
    SolutionIndex: 73
    SolutionNameMin: Cijk_Alik_Bljk_BBS_BH_MT128x128x16_MI16x16x16x1_SN_1LDSB0_AMAS3_GRVW8_IU1_SIA3_SU0_SUS0_SVW4_TT4_64_VW4_WGM8
    SolutionIndex: 74
    SolutionNameMin: Cijk_Alik_Bljk_BBS_BH_MT128x128x16_MI16x16x16x1_SN_1LDSB0_AMAS3_GRVW4_IU1_SIA1_SU32_SUS128_SVW2_TT4_64_VW2_WGM8
    SolutionIndex: 75
    SolutionNameMin: Cijk_Alik_Bljk_BBS_BH_MT128x128x16_MI16x16x16x1_SN_1LDSB0_AMAS3_GRVW8_IU1_SIA1_SU32_SUS128_SVW2_TT4_64_VW2_WGM8
    SolutionIndex: 76
    SolutionNameMin: Cijk_Alik_Bljk_BBS_BH_MT128x128x16_MI16x16x16x1_SN_1LDSB0_AMAS3_GRVW8_IU1_SIA1_SU32_SUS128_SVW4_TT4_64_VW4_WGM8
    SolutionIndex: 77
    SolutionNameMin: Cijk_Alik_Bljk_BBS_BH_MT128x128x16_MI16x16x16x1_SN_1LDSB0_AMAS3_GRVW4_IU1_SIA3_SU32_SUS128_SVW2_TT4_64_VW2_WGM8
    SolutionIndex: 78
    SolutionNameMin: Cijk_Alik_Bljk_BBS_BH_MT128x128x16_MI16x16x16x1_SN_1LDSB0_AMAS3_GRVW4_IU1_SIA3_SU32_SUS128_SVW4_TT4_64_VW4_WGM8
    SolutionIndex: 79
    SolutionNameMin: Cijk_Alik_Bljk_BBS_BH_MT128x128x16_MI16x16x16x1_SN_1LDSB0_AMAS0_GRVW8_IU1_SIA3_SU32_SUS128_SVW1_TT4_64_VW1_WGM8
    SolutionIndex: 80
    SolutionNameMin: Cijk_Alik_Bljk_BBS_BH_MT128x128x16_MI16x16x16x1_SN_1LDSB0_AMAS3_GRVW8_IU1_SIA3_SU32_SUS128_SVW2_TT4_64_VW2_WGM8
    SolutionIndex: 81
    SolutionNameMin: Cijk_Alik_Bljk_BBS_BH_MT128x128x16_MI16x16x16x1_SN_1LDSB0_AMAS3_GRVW8_IU1_SIA3_SU32_SUS128_SVW4_TT4_64_VW4_WGM8
    SolutionIndex: 82
    SolutionNameMin: Cijk_Alik_Bljk_BBS_BH_MT128x128x16_MI16x16x16x1_SN_1LDSB1_AMAS3_GRVW2_IU1_SIA2_SU32_SUS256_SVW4_TT4_64_VW4_WGM8
    SolutionIndex: 83
    SolutionNameMin: Cijk_Alik_Bljk_BBS_BH_MT128x128x16_MI16x16x16x1_SN_1LDSB1_AMAS3_GRVW4_IU1_SIA2_SU32_SUS256_SVW4_TT4_64_VW4_WGM8
    SolutionIndex: 84
    SolutionNameMin: Cijk_Alik_Bljk_BBS_BH_MT128x128x16_MI16x16x16x1_SN_1LDSB1_AMAS3_GRVW8_IU1_SIA2_SU32_SUS256_SVW4_TT4_64_VW4_WGM8
    SolutionIndex: 85
    SolutionNameMin: Cijk_Alik_Bljk_BBS_BH_MT128x128x16_MI16x16x16x1_SN_1LDSB0_AMAS0_GRVW8_IU1_SIA3_SU32_SUS256_SVW1_TT4_64_VW1_WGM8
    SolutionIndex: 86
    SolutionNameMin: Cijk_Alik_Bljk_BBS_BH_MT128x128x16_MI16x16x16x1_SN_1LDSB0_AMAS3_GRVW8_IU1_SIA3_SU32_SUS256_SVW2_TT4_64_VW2_WGM8
    SolutionIndex: 87
    SolutionNameMin: Cijk_Alik_Bljk_BBS_BH_MT128x128x16_MI16x16x16x1_SN_1LDSB0_AMAS3_GRVW8_IU1_SIA3_SU32_SUS256_SVW4_TT4_64_VW4_WGM8
    SolutionIndex: 88
    SolutionNameMin: Cijk_Alik_Bljk_BBS_BH_MT32x32x32_MI16x16x16x1_SN_1LDSB0_AMAS0_GRVW2_IU1_SIA1_SU0_SUS0_SVW1_TT1_16_VW1_WGM4
    SolutionIndex: 89
    SolutionNameMin: Cijk_Alik_Bljk_BBS_BH_MT32x32x32_MI16x16x16x1_SN_1LDSB0_AMAS0_GRVW4_IU1_SIA1_SU0_SUS0_SVW1_TT1_16_VW1_WGM4
    SolutionIndex: 90
    SolutionNameMin: Cijk_Alik_Bljk_BBS_BH_MT32x32x32_MI16x16x16x1_SN_1LDSB0_AMAS0_GRVW8_IU1_SIA1_SU0_SUS0_SVW1_TT1_16_VW1_WGM4
    SolutionIndex: 91
    SolutionNameMin: Cijk_Alik_Bljk_BBS_BH_MT32x32x32_MI16x16x16x1_SN_1LDSB1_AMAS0_GRVW2_IU2_SIA2_SU0_SUS0_SVW1_TT1_16_VW1_WGM4
    SolutionIndex: 92
    SolutionNameMin: Cijk_Alik_Bljk_BBS_BH_MT32x32x32_MI16x16x16x1_SN_1LDSB1_AMAS0_GRVW4_IU2_SIA2_SU0_SUS0_SVW1_TT1_16_VW1_WGM4
    SolutionIndex: 93
    SolutionNameMin: Cijk_Alik_Bljk_BBS_BH_MT32x32x32_MI16x16x16x1_SN_1LDSB1_AMAS0_GRVW8_IU2_SIA2_SU0_SUS0_SVW1_TT1_16_VW1_WGM4
    SolutionIndex: 94
    SolutionNameMin: Cijk_Alik_Bljk_BBS_BH_MT32x32x32_MI16x16x16x1_SN_1LDSB0_AMAS0_GRVW4_IU1_SIA3_SU0_SUS0_SVW1_TT1_16_VW1_WGM4
    SolutionIndex: 95
    SolutionNameMin: Cijk_Alik_Bljk_BBS_BH_MT32x32x32_MI16x16x16x1_SN_1LDSB0_AMAS0_GRVW4_IU1_SIA1_SU32_SUS128_SVW1_TT1_16_VW1_WGM4
    SolutionIndex: 96
    SolutionNameMin: Cijk_Alik_Bljk_BBS_BH_MT32x32x32_MI16x16x16x1_SN_1LDSB1_AMAS0_GRVW2_IU2_SIA2_SU32_SUS128_SVW1_TT1_16_VW1_WGM4
    SolutionIndex: 97
    SolutionNameMin: Cijk_Alik_Bljk_BBS_BH_MT32x32x32_MI16x16x16x1_SN_1LDSB1_AMAS0_GRVW4_IU2_SIA2_SU32_SUS128_SVW1_TT1_16_VW1_WGM4
    SolutionIndex: 98
    SolutionNameMin: Cijk_Alik_Bljk_BBS_BH_MT32x32x32_MI16x16x16x1_SN_1LDSB1_AMAS0_GRVW8_IU2_SIA2_SU32_SUS128_SVW1_TT1_16_VW1_WGM4
    SolutionIndex: 99
    SolutionNameMin: Cijk_Alik_Bljk_BBS_BH_MT32x32x32_MI16x16x16x1_SN_1LDSB0_AMAS0_GRVW8_IU1_SIA1_SU32_SUS256_SVW1_TT1_16_VW1_WGM4
    SolutionIndex: 100
    SolutionNameMin: Cijk_Alik_Bljk_BBS_BH_MT32x32x32_MI16x16x16x1_SN_1LDSB1_AMAS0_GRVW2_IU2_SIA2_SU32_SUS256_SVW1_TT1_16_VW1_WGM4
    SolutionIndex: 101
    SolutionNameMin: Cijk_Alik_Bljk_BBS_BH_MT32x32x32_MI16x16x16x1_SN_1LDSB1_AMAS0_GRVW4_IU2_SIA2_SU32_SUS256_SVW1_TT1_16_VW1_WGM4
    SolutionIndex: 102
    SolutionNameMin: Cijk_Alik_Bljk_BBS_BH_MT32x32x32_MI16x16x16x1_SN_1LDSB1_AMAS0_GRVW8_IU2_SIA2_SU32_SUS256_SVW1_TT1_16_VW1_WGM4
    SolutionIndex: 103
    SolutionNameMin: Cijk_Alik_Bljk_BBS_BH_MT32x32x32_MI16x16x16x1_SN_1LDSB0_AMAS0_GRVW8_IU1_SIA3_SU32_SUS256_SVW1_TT1_16_VW1_WGM4
    SolutionIndex: 104
    SolutionNameMin: Cijk_Alik_Bljk_BBS_BH_MT32x32x32_MI16x16x16x1_SN_1LDSB1_AMAS0_GRVW2_IU2_SIA2_SU0_SUS0_SVW1_TT1_16_VW1_WGM8
    SolutionIndex: 105
    SolutionNameMin: Cijk_Alik_Bljk_BBS_BH_MT32x32x32_MI16x16x16x1_SN_1LDSB1_AMAS0_GRVW4_IU2_SIA2_SU0_SUS0_SVW1_TT1_16_VW1_WGM8
    SolutionIndex: 106
    SolutionNameMin: Cijk_Alik_Bljk_BBS_BH_MT32x32x32_MI16x16x16x1_SN_1LDSB1_AMAS0_GRVW8_IU2_SIA2_SU0_SUS0_SVW1_TT1_16_VW1_WGM8
    SolutionIndex: 107
    SolutionNameMin: Cijk_Alik_Bljk_BBS_BH_MT32x32x32_MI16x16x16x1_SN_1LDSB0_AMAS0_GRVW8_IU1_SIA3_SU0_SUS0_SVW1_TT1_16_VW1_WGM8
    SolutionIndex: 108
    SolutionNameMin: Cijk_Alik_Bljk_BBS_BH_MT32x32x32_MI16x16x16x1_SN_1LDSB0_AMAS0_GRVW8_IU1_SIA1_SU32_SUS128_SVW1_TT1_16_VW1_WGM8
    SolutionIndex: 109
    SolutionNameMin: Cijk_Alik_Bljk_BBS_BH_MT32x32x32_MI16x16x16x1_SN_1LDSB1_AMAS0_GRVW2_IU2_SIA2_SU32_SUS128_SVW1_TT1_16_VW1_WGM8
    SolutionIndex: 110
    SolutionNameMin: Cijk_Alik_Bljk_BBS_BH_MT32x32x32_MI16x16x16x1_SN_1LDSB1_AMAS0_GRVW4_IU2_SIA2_SU32_SUS128_SVW1_TT1_16_VW1_WGM8
    SolutionIndex: 111
    SolutionNameMin: Cijk_Alik_Bljk_BBS_BH_MT32x32x32_MI16x16x16x1_SN_1LDSB1_AMAS0_GRVW8_IU2_SIA2_SU32_SUS128_SVW1_TT1_16_VW1_WGM8
    SolutionIndex: 112
    SolutionNameMin: Cijk_Alik_Bljk_BBS_BH_MT32x32x32_MI16x16x16x1_SN_1LDSB1_AMAS0_GRVW2_IU2_SIA2_SU32_SUS256_SVW1_TT1_16_VW1_WGM8
    SolutionIndex: 113
    SolutionNameMin: Cijk_Alik_Bljk_BBS_BH_MT32x32x32_MI16x16x16x1_SN_1LDSB1_AMAS0_GRVW4_IU2_SIA2_SU32_SUS256_SVW1_TT1_16_VW1_WGM8
    SolutionIndex: 114
    SolutionNameMin: Cijk_Alik_Bljk_BBS_BH_MT32x32x32_MI16x16x16x1_SN_1LDSB1_AMAS0_GRVW8_IU2_SIA2_SU32_SUS256_SVW1_TT1_16_VW1_WGM8
    SolutionIndex: 115
    SolutionNameMin: Cijk_Alik_Bljk_BBS_BH_MT64x64x32_MI16x16x16x1_SN_1LDSB0_AMAS3_GRVW4_IU1_SIA1_SU0_SUS0_SVW2_TT2_32_VW2_WGM4
    SolutionIndex: 116
    SolutionNameMin: Cijk_Alik_Bljk_BBS_BH_MT64x64x32_MI16x16x16x1_SN_1LDSB0_AMAS0_GRVW8_IU1_SIA1_SU0_SUS0_SVW1_TT2_32_VW1_WGM4
    SolutionIndex: 117
    SolutionNameMin: Cijk_Alik_Bljk_BBS_BH_MT64x64x32_MI16x16x16x1_SN_1LDSB0_AMAS3_GRVW8_IU1_SIA1_SU0_SUS0_SVW2_TT2_32_VW2_WGM4
    SolutionIndex: 118
    SolutionNameMin: Cijk_Alik_Bljk_BBS_BH_MT64x64x32_MI16x16x16x1_SN_1LDSB1_AMAS0_GRVW4_IU2_SIA2_SU0_SUS0_SVW1_TT2_32_VW1_WGM4
    SolutionIndex: 119
    SolutionNameMin: Cijk_Alik_Bljk_BBS_BH_MT64x64x32_MI16x16x16x1_SN_1LDSB1_AMAS3_GRVW4_IU2_SIA2_SU0_SUS0_SVW2_TT2_32_VW2_WGM4
    SolutionIndex: 120
    SolutionNameMin: Cijk_Alik_Bljk_BBS_BH_MT64x64x32_MI16x16x16x1_SN_1LDSB1_AMAS0_GRVW8_IU2_SIA2_SU0_SUS0_SVW1_TT2_32_VW1_WGM4
    SolutionIndex: 121
    SolutionNameMin: Cijk_Alik_Bljk_BBS_BH_MT64x64x32_MI16x16x16x1_SN_1LDSB1_AMAS3_GRVW8_IU2_SIA2_SU0_SUS0_SVW2_TT2_32_VW2_WGM4
    SolutionIndex: 122
    SolutionNameMin: Cijk_Alik_Bljk_BBS_BH_MT64x64x32_MI16x16x16x1_SN_1LDSB0_AMAS0_GRVW8_IU1_SIA3_SU0_SUS0_SVW1_TT2_32_VW1_WGM4
    SolutionIndex: 123
    SolutionNameMin: Cijk_Alik_Bljk_BBS_BH_MT64x64x32_MI16x16x16x1_SN_1LDSB0_AMAS3_GRVW8_IU1_SIA1_SU32_SUS128_SVW2_TT2_32_VW2_WGM4
    SolutionIndex: 124
    SolutionNameMin: Cijk_Alik_Bljk_BBS_BH_MT64x64x32_MI16x16x16x1_SN_1LDSB1_AMAS3_GRVW4_IU2_SIA2_SU32_SUS128_SVW2_TT2_32_VW2_WGM4
    SolutionIndex: 125
    SolutionNameMin: Cijk_Alik_Bljk_BBS_BH_MT64x64x32_MI16x16x16x1_SN_1LDSB1_AMAS3_GRVW8_IU2_SIA2_SU32_SUS128_SVW2_TT2_32_VW2_WGM4
    SolutionIndex: 126
    SolutionNameMin: Cijk_Alik_Bljk_BBS_BH_MT64x64x32_MI16x16x16x1_SN_1LDSB0_AMAS3_GRVW8_IU1_SIA3_SU32_SUS128_SVW2_TT2_32_VW2_WGM4
    SolutionIndex: 127
    SolutionNameMin: Cijk_Alik_Bljk_BBS_BH_MT64x64x32_MI16x16x16x1_SN_1LDSB0_AMAS0_GRVW8_IU1_SIA1_SU32_SUS256_SVW1_TT2_32_VW1_WGM4
    SolutionIndex: 128
    SolutionNameMin: Cijk_Alik_Bljk_BBS_BH_MT64x64x32_MI16x16x16x1_SN_1LDSB0_AMAS3_GRVW8_IU1_SIA1_SU32_SUS256_SVW2_TT2_32_VW2_WGM4
    SolutionIndex: 129
    SolutionNameMin: Cijk_Alik_Bljk_BBS_BH_MT64x64x32_MI16x16x16x1_SN_1LDSB1_AMAS0_GRVW4_IU2_SIA2_SU32_SUS256_SVW1_TT2_32_VW1_WGM4
    SolutionIndex: 130
    SolutionNameMin: Cijk_Alik_Bljk_BBS_BH_MT64x64x32_MI16x16x16x1_SN_1LDSB1_AMAS3_GRVW4_IU2_SIA2_SU32_SUS256_SVW2_TT2_32_VW2_WGM4
    SolutionIndex: 131
    SolutionNameMin: Cijk_Alik_Bljk_BBS_BH_MT64x64x32_MI16x16x16x1_SN_1LDSB1_AMAS0_GRVW8_IU2_SIA2_SU32_SUS256_SVW1_TT2_32_VW1_WGM4
    SolutionIndex: 132
    SolutionNameMin: Cijk_Alik_Bljk_BBS_BH_MT64x64x32_MI16x16x16x1_SN_1LDSB1_AMAS3_GRVW8_IU2_SIA2_SU32_SUS256_SVW2_TT2_32_VW2_WGM4
    SolutionIndex: 133
    SolutionNameMin: Cijk_Alik_Bljk_BBS_BH_MT64x64x32_MI16x16x16x1_SN_1LDSB0_AMAS0_GRVW8_IU1_SIA3_SU32_SUS256_SVW1_TT2_32_VW1_WGM4
    SolutionIndex: 134
    SolutionNameMin: Cijk_Alik_Bljk_BBS_BH_MT64x64x32_MI16x16x16x1_SN_1LDSB0_AMAS3_GRVW8_IU1_SIA3_SU32_SUS256_SVW2_TT2_32_VW2_WGM4
    SolutionIndex: 135
    SolutionNameMin: Cijk_Alik_Bljk_BBS_BH_MT64x64x32_MI16x16x16x1_SN_1LDSB1_AMAS0_GRVW2_IU2_SIA2_SU0_SUS0_SVW1_TT2_32_VW1_WGM8
    SolutionIndex: 136
    SolutionNameMin: Cijk_Alik_Bljk_BBS_BH_MT64x64x32_MI16x16x16x1_SN_1LDSB1_AMAS3_GRVW4_IU2_SIA2_SU0_SUS0_SVW2_TT2_32_VW2_WGM8
    SolutionIndex: 137
    SolutionNameMin: Cijk_Alik_Bljk_BBS_BH_MT64x64x32_MI16x16x16x1_SN_1LDSB1_AMAS0_GRVW8_IU2_SIA2_SU0_SUS0_SVW1_TT2_32_VW1_WGM8
    SolutionIndex: 138
    SolutionNameMin: Cijk_Alik_Bljk_BBS_BH_MT64x64x32_MI16x16x16x1_SN_1LDSB1_AMAS3_GRVW8_IU2_SIA2_SU0_SUS0_SVW2_TT2_32_VW2_WGM8
    SolutionIndex: 139
    SolutionNameMin: Cijk_Alik_Bljk_BBS_BH_MT64x64x32_MI16x16x16x1_SN_1LDSB0_AMAS3_GRVW8_IU1_SIA1_SU32_SUS128_SVW2_TT2_32_VW2_WGM8
    SolutionIndex: 140
    SolutionNameMin: Cijk_Alik_Bljk_BBS_BH_MT64x64x32_MI16x16x16x1_SN_1LDSB1_AMAS3_GRVW4_IU2_SIA2_SU32_SUS128_SVW2_TT2_32_VW2_WGM8
    SolutionIndex: 141
    SolutionNameMin: Cijk_Alik_Bljk_BBS_BH_MT64x64x32_MI16x16x16x1_SN_1LDSB1_AMAS3_GRVW8_IU2_SIA2_SU32_SUS128_SVW2_TT2_32_VW2_WGM8
    SolutionIndex: 142
    SolutionNameMin: Cijk_Alik_Bljk_BBS_BH_MT64x64x32_MI16x16x16x1_SN_1LDSB0_AMAS3_GRVW8_IU1_SIA1_SU32_SUS256_SVW2_TT2_32_VW2_WGM8
    SolutionIndex: 143
    SolutionNameMin: Cijk_Alik_Bljk_BBS_BH_MT64x64x32_MI16x16x16x1_SN_1LDSB1_AMAS3_GRVW4_IU2_SIA2_SU32_SUS256_SVW2_TT2_32_VW2_WGM8
    SolutionIndex: 144
    SolutionNameMin: Cijk_Alik_Bljk_BBS_BH_MT64x64x32_MI16x16x16x1_SN_1LDSB1_AMAS0_GRVW8_IU2_SIA2_SU32_SUS256_SVW1_TT2_32_VW1_WGM8
    SolutionIndex: 145
    SolutionNameMin: Cijk_Alik_Bljk_BBS_BH_MT64x64x32_MI16x16x16x1_SN_1LDSB1_AMAS3_GRVW8_IU2_SIA2_SU32_SUS256_SVW2_TT2_32_VW2_WGM8
- - - [64, 64, 1, 64, 96, 96, 96, 96]
    - [90, 0.041]
  - - [64, 64, 1, 128, 96, 96, 160, 160]
    - [93, 0.083]
  - - [64, 64, 1, 256, 96, 96, 288, 288]
    - [92, 0.154]
  - - [64, 64, 1, 512, 96, 96, 544, 544]
    - [105, 0.274]
  - - [64, 64, 1, 1024, 96, 96, 1056, 1056]
    - [92, 0.443]
  - - [64, 64, 1, 2048, 96, 96, 2080, 2080]
    - [92, 0.643]
  - - [64, 64, 1, 4096, 96, 96, 4128, 4128]
    - [92, 0.826]
  - - [64, 64, 1, 8192, 96, 96, 8224, 8224]
    - [92, 0.958]
  - - [64, 128, 1, 64, 96, 96, 96, 96]
    - [4, 0.087]
  - - [64, 128, 1, 128, 96, 96, 160, 160]
    - [110, 0.168]
  - - [64, 128, 1, 256, 96, 96, 288, 288]
    - [92, 0.315]
  - - [64, 128, 1, 512, 96, 96, 544, 544]
    - [105, 0.557]
  - - [64, 128, 1, 1024, 96, 96, 1056, 1056]
    - [113, 0.898]
  - - [64, 128, 1, 2048, 96, 96, 2080, 2080]
    - [101, 1.246]
  - - [64, 128, 1, 4096, 96, 96, 4128, 4128]
    - [92, 1.663]
  - - [64, 128, 1, 8192, 96, 96, 8224, 8224]
    - [105, 1.929]
  - - [64, 256, 1, 64, 96, 96, 96, 96]
    - [107, 0.177]
  - - [64, 256, 1, 128, 96, 96, 160, 160]
    - [91, 0.341]
  - - [64, 256, 1, 256, 96, 96, 288, 288]
    - [93, 0.639]
  - - [64, 256, 1, 512, 96, 96, 544, 544]
    - [101, 1.121]
  - - [64, 256, 1, 1024, 96, 96, 1056, 1056]
    - [102, 1.806]
  - - [64, 256, 1, 2048, 96, 96, 2080, 2080]
    - [113, 2.596]
  - - [64, 256, 1, 4096, 96, 96, 4128, 4128]
    - [97, 3.32]
  - - [64, 256, 1, 8192, 96, 96, 8224, 8224]
    - [111, 3.85]
  - - [64, 512, 1, 64, 96, 96, 96, 96]
    - [99, 0.355]
  - - [64, 512, 1, 128, 96, 96, 160, 160]
    - [112, 0.681]
  - - [64, 512, 1, 256, 96, 96, 288, 288]
    - [109, 1.284]
  - - [64, 512, 1, 512, 96, 96, 544, 544]
    - [112, 2.241]
  - - [64, 512, 1, 1024, 96, 96, 1056, 1056]
    - [100, 3.636]
  - - [64, 512, 1, 2048, 96, 96, 2080, 2080]
    - [100, 5.197]
  - - [64, 512, 1, 4096, 96, 96, 4128, 4128]
    - [110, 6.631]
  - - [64, 512, 1, 8192, 96, 96, 8224, 8224]
    - [105, 7.653]
  - - [64, 1024, 1, 64, 96, 96, 96, 96]
    - [106, 0.701]
  - - [64, 1024, 1, 128, 96, 96, 160, 160]
    - [97, 1.356]
  - - [64, 1024, 1, 256, 96, 96, 288, 288]
    - [110, 2.527]
  - - [64, 1024, 1, 512, 96, 96, 544, 544]
    - [97, 4.439]
  - - [64, 1024, 1, 1024, 96, 96, 1056, 1056]
    - [101, 7.18]
  - - [64, 1024, 1, 2048, 96, 96, 2080, 2080]
    - [113, 10.342]
  - - [64, 1024, 1, 4096, 96, 96, 4128, 4128]
    - [105, 13.19]
  - - [64, 1024, 1, 8192, 96, 96, 8224, 8224]
    - [114, 15.191]
  - - [64, 2048, 1, 64, 96, 96, 96, 96]
    - [105, 1.378]
  - - [64, 2048, 1, 128, 96, 96, 160, 160]
    - [101, 2.642]
  - - [64, 2048, 1, 256, 96, 96, 288, 288]
    - [93, 4.925]
  - - [64, 2048, 1, 512, 96, 96, 544, 544]
    - [106, 8.542]
  - - [64, 2048, 1, 1024, 96, 96, 1056, 1056]
    - [98, 13.508]
  - - [64, 2048, 1, 2048, 96, 96, 2080, 2080]
    - [111, 19.05]
  - - [64, 2048, 1, 4096, 96, 96, 4128, 4128]
    - [106, 24.002]
  - - [64, 2048, 1, 8192, 96, 96, 8224, 8224]
    - [98, 27.051]
  - - [64, 4096, 1, 64, 96, 96, 96, 96]
    - [114, 2.624]
  - - [64, 4096, 1, 128, 96, 96, 160, 160]
    - [132, 4.98]
  - - [64, 4096, 1, 256, 96, 96, 288, 288]
    - [140, 8.969]
  - - [64, 4096, 1, 512, 96, 96, 544, 544]
    - [119, 15.052]
  - - [64, 4096, 1, 1024, 96, 96, 1056, 1056]
    - [136, 22.571]
  - - [64, 4096, 1, 2048, 96, 96, 2080, 2080]
    - [141, 30.376]
  - - [64, 4096, 1, 4096, 96, 96, 4128, 4128]
    - [129, 35.423]
  - - [64, 4096, 1, 8192, 96, 96, 8224, 8224]
    - [125, 40.502]
  - - [64, 8192, 1, 64, 96, 96, 96, 96]
    - [11, 4.933]
  - - [64, 8192, 1, 128, 96, 96, 160, 160]
    - [131, 9.15]
  - - [64, 8192, 1, 256, 96, 96, 288, 288]
    - [139, 16.01]
  - - [64, 8192, 1, 512, 96, 96, 544, 544]
    - [20, 25.714]
  - - [64, 8192, 1, 1024, 96, 96, 1056, 1056]
    - [17, 36.774]
  - - [64, 8192, 1, 2048, 96, 96, 2080, 2080]
    - [28, 47.215]
  - - [64, 8192, 1, 4096, 96, 96, 4128, 4128]
    - [123, 55.513]
  - - [64, 8192, 1, 8192, 96, 96, 8224, 8224]
    - [125, 28.064]
  - - [128, 64, 1, 64, 160, 160, 96, 96]
    - [6, 0.089]
  - - [128, 64, 1, 128, 160, 160, 160, 160]
    - [111, 0.168]
  - - [128, 64, 1, 256, 160, 160, 288, 288]
    - [110, 0.316]
  - - [128, 64, 1, 512, 160, 160, 544, 544]
    - [98, 0.555]
  - - [128, 64, 1, 1024, 160, 160, 1056, 1056]
    - [104, 0.901]
  - - [128, 64, 1, 2048, 160, 160, 2080, 2080]
    - [110, 1.301]
  - - [128, 64, 1, 4096, 160, 160, 4128, 4128]
    - [113, 1.67]
  - - [128, 64, 1, 8192, 160, 160, 8224, 8224]
    - [96, 1.932]
  - - [128, 128, 1, 64, 160, 160, 96, 96]
    - [114, 0.177]
  - - [128, 128, 1, 128, 160, 160, 160, 160]
    - [92, 0.34]
  - - [128, 128, 1, 256, 160, 160, 288, 288]
    - [93, 0.638]
  - - [128, 128, 1, 512, 160, 160, 544, 544]
    - [106, 1.123]
  - - [128, 128, 1, 1024, 160, 160, 1056, 1056]
    - [105, 1.82]
  - - [128, 128, 1, 2048, 160, 160, 2080, 2080]
    - [105, 2.627]
  - - [128, 128, 1, 4096, 160, 160, 4128, 4128]
    - [113, 3.366]
  - - [128, 128, 1, 8192, 160, 160, 8224, 8224]
    - [97, 3.908]
  - - [128, 256, 1, 64, 160, 160, 96, 96]
    - [92, 0.356]
  - - [128, 256, 1, 128, 160, 160, 160, 160]
    - [106, 0.685]
  - - [128, 256, 1, 256, 160, 160, 288, 288]
    - [101, 1.284]
  - - [128, 256, 1, 512, 160, 160, 544, 544]
    - [101, 2.253]
  - - [128, 256, 1, 1024, 160, 160, 1056, 1056]
    - [93, 3.616]
  - - [128, 256, 1, 2048, 160, 160, 2080, 2080]
    - [113, 5.247]
  - - [128, 256, 1, 4096, 160, 160, 4128, 4128]
    - [113, 6.727]
  - - [128, 256, 1, 8192, 160, 160, 8224, 8224]
    - [91, 7.677]
  - - [128, 512, 1, 64, 160, 160, 96, 96]
    - [106, 0.712]
  - - [128, 512, 1, 128, 160, 160, 160, 160]
    - [101, 1.355]
  - - [128, 512, 1, 256, 160, 160, 288, 288]
    - [98, 2.556]
  - - [128, 512, 1, 512, 160, 160, 544, 544]
    - [102, 4.469]
  - - [128, 512, 1, 1024, 160, 160, 1056, 1056]
    - [102, 7.223]
  - - [128, 512, 1, 2048, 160, 160, 2080, 2080]
    - [101, 10.397]
  - - [128, 512, 1, 4096, 160, 160, 4128, 4128]
    - [92, 13.296]
  - - [128, 512, 1, 8192, 160, 160, 8224, 8224]
    - [92, 15.348]
  - - [128, 1024, 1, 64, 160, 160, 96, 96]
    - [113, 1.38]
  - - [128, 1024, 1, 128, 160, 160, 160, 160]
    - [95, 2.631]
  - - [128, 1024, 1, 256, 160, 160, 288, 288]
    - [106, 4.897]
  - - [128, 1024, 1, 512, 160, 160, 544, 544]
    - [98, 8.533]
  - - [128, 1024, 1, 1024, 160, 160, 1056, 1056]
    - [111, 13.478]
  - - [128, 1024, 1, 2048, 160, 160, 2080, 2080]
    - [106, 19.104]
  - - [128, 1024, 1, 4096, 160, 160, 4128, 4128]
    - [106, 24.346]
  - - [128, 1024, 1, 8192, 160, 160, 8224, 8224]
    - [106, 27.209]
  - - [128, 2048, 1, 64, 160, 160, 96, 96]
    - [101, 2.63]
  - - [128, 2048, 1, 128, 160, 160, 160, 160]
    - [119, 4.968]
  - - [128, 2048, 1, 256, 160, 160, 288, 288]
    - [132, 8.938]
  - - [128, 2048, 1, 512, 160, 160, 544, 544]
    - [119, 15.041]
  - - [128, 2048, 1, 1024, 160, 160, 1056, 1056]
    - [137, 22.61]
  - - [128, 2048, 1, 2048, 160, 160, 2080, 2080]
    - [138, 30.439]
  - - [128, 2048, 1, 4096, 160, 160, 4128, 4128]
    - [125, 35.418]
  - - [128, 2048, 1, 8192, 160, 160, 8224, 8224]
    - [121, 40.587]
  - - [128, 4096, 1, 64, 160, 160, 96, 96]
    - [135, 4.973]
  - - [128, 4096, 1, 128, 160, 160, 160, 160]
    - [11, 9.243]
  - - [128, 4096, 1, 256, 160, 160, 288, 288]
    - [115, 16.233]
  - - [128, 4096, 1, 512, 160, 160, 544, 544]
    - [24, 25.904]
  - - [128, 4096, 1, 1024, 160, 160, 1056, 1056]
    - [18, 36.798]
  - - [128, 4096, 1, 2048, 160, 160, 2080, 2080]
    - [142, 47.146]
  - - [128, 4096, 1, 4096, 160, 160, 4128, 4128]
    - [139, 55.276]
  - - [128, 4096, 1, 8192, 160, 160, 8224, 8224]
    - [142, 61.013]
  - - [128, 8192, 1, 64, 160, 160, 96, 96]
    - [121, 8.322]
  - - [128, 8192, 1, 128, 160, 160, 160, 160]
    - [20, 14.892]
  - - [128, 8192, 1, 256, 160, 160, 288, 288]
    - [138, 22.286]
  - - [128, 8192, 1, 512, 160, 160, 544, 544]
    - [121, 32.522]
  - - [128, 8192, 1, 1024, 160, 160, 1056, 1056]
    - [121, 43.983]
  - - [128, 8192, 1, 2048, 160, 160, 2080, 2080]
    - [13, 52.269]
  - - [128, 8192, 1, 4096, 160, 160, 4128, 4128]
    - [14, 56.846]
  - - [128, 8192, 1, 8192, 160, 160, 8224, 8224]
    - [141, 50.183]
  - - [256, 64, 1, 64, 288, 288, 96, 96]
    - [3, 0.18]
  - - [256, 64, 1, 128, 288, 288, 160, 160]
    - [2, 0.332]
  - - [256, 64, 1, 256, 288, 288, 288, 288]
    - [92, 0.639]
  - - [256, 64, 1, 512, 288, 288, 544, 544]
    - [106, 1.119]
  - - [256, 64, 1, 1024, 288, 288, 1056, 1056]
    - [113, 1.803]
  - - [256, 64, 1, 2048, 288, 288, 2080, 2080]
    - [92, 2.586]
  - - [256, 64, 1, 4096, 288, 288, 4128, 4128]
    - [97, 3.311]
  - - [256, 64, 1, 8192, 288, 288, 8224, 8224]
    - [105, 3.839]
  - - [256, 128, 1, 64, 288, 288, 96, 96]
    - [93, 0.356]
  - - [256, 128, 1, 128, 288, 288, 160, 160]
    - [97, 0.688]
  - - [256, 128, 1, 256, 288, 288, 288, 288]
    - [98, 1.279]
  - - [256, 128, 1, 512, 288, 288, 544, 544]
    - [92, 2.252]
  - - [256, 128, 1, 1024, 288, 288, 1056, 1056]
    - [92, 3.628]
  - - [256, 128, 1, 2048, 288, 288, 2080, 2080]
    - [105, 5.221]
  - - [256, 128, 1, 4096, 288, 288, 4128, 4128]
    - [97, 6.69]
  - - [256, 128, 1, 8192, 288, 288, 8224, 8224]
    - [97, 7.735]
  - - [256, 256, 1, 64, 288, 288, 96, 96]
    - [103, 0.706]
  - - [256, 256, 1, 128, 288, 288, 160, 160]
    - [106, 1.355]
  - - [256, 256, 1, 256, 288, 288, 288, 288]
    - [101, 2.556]
  - - [256, 256, 1, 512, 288, 288, 544, 544]
    - [92, 4.454]
  - - [256, 256, 1, 1024, 288, 288, 1056, 1056]
    - [113, 7.243]
  - - [256, 256, 1, 2048, 288, 288, 2080, 2080]
    - [114, 10.333]
  - - [256, 256, 1, 4096, 288, 288, 4128, 4128]
    - [92, 13.265]
  - - [256, 256, 1, 8192, 288, 288, 8224, 8224]
    - [92, 15.398]
  - - [256, 512, 1, 64, 288, 288, 96, 96]
    - [113, 1.393]
  - - [256, 512, 1, 128, 288, 288, 160, 160]
    - [111, 2.653]
  - - [256, 512, 1, 256, 288, 288, 288, 288]
    - [106, 4.917]
  - - [256, 512, 1, 512, 288, 288, 544, 544]
    - [106, 8.584]
  - - [256, 512, 1, 1024, 288, 288, 1056, 1056]
    - [106, 13.571]
  - - [256, 512, 1, 2048, 288, 288, 2080, 2080]
    - [93, 19.248]
  - - [256, 512, 1, 4096, 288, 288, 4128, 4128]
    - [93, 24.211]
  - - [256, 512, 1, 8192, 288, 288, 8224, 8224]
    - [111, 27.003]
  - - [256, 1024, 1, 64, 288, 288, 96, 96]
    - [5, 2.597]
  - - [256, 1024, 1, 128, 288, 288, 160, 160]
    - [145, 4.948]
  - - [256, 1024, 1, 256, 288, 288, 288, 288]
    - [121, 8.967]
  - - [256, 1024, 1, 512, 288, 288, 544, 544]
    - [141, 15.06]
  - - [256, 1024, 1, 1024, 288, 288, 1056, 1056]
    - [138, 22.687]
  - - [256, 1024, 1, 2048, 288, 288, 2080, 2080]
    - [137, 30.45]
  - - [256, 1024, 1, 4096, 288, 288, 4128, 4128]
    - [137, 35.566]
  - - [256, 1024, 1, 8192, 288, 288, 8224, 8224]
    - [125, 40.583]
  - - [256, 2048, 1, 64, 288, 288, 96, 96]
    - [15, 4.996]
  - - [256, 2048, 1, 128, 288, 288, 160, 160]
    - [10, 9.257]
  - - [256, 2048, 1, 256, 288, 288, 288, 288]
    - [117, 16.337]
  - - [256, 2048, 1, 512, 288, 288, 544, 544]
    - [127, 26.318]
  - - [256, 2048, 1, 1024, 288, 288, 1056, 1056]
    - [128, 38.356]
  - - [256, 2048, 1, 2048, 288, 288, 2080, 2080]
    - [116, 49.304]
  - - [256, 2048, 1, 4096, 288, 288, 4128, 4128]
    - [117, 56.698]
  - - [256, 2048, 1, 8192, 288, 288, 8224, 8224]
    - [123, 63.478]
  - - [256, 4096, 1, 64, 288, 288, 96, 96]
    - [23, 8.306]
  - - [256, 4096, 1, 128, 288, 288, 160, 160]
    - [29, 14.86]
  - - [256, 4096, 1, 256, 288, 288, 288, 288]
    - [121, 22.36]
  - - [256, 4096, 1, 512, 288, 288, 544, 544]
    - [121, 32.29]
  - - [256, 4096, 1, 1024, 288, 288, 1056, 1056]
    - [132, 43.874]
  - - [256, 4096, 1, 2048, 288, 288, 2080, 2080]
    - [14, 52.212]
  - - [256, 4096, 1, 4096, 288, 288, 4128, 4128]
    - [14, 56.907]
  - - [256, 4096, 1, 8192, 288, 288, 8224, 8224]
    - [12, 59.03]
  - - [256, 8192, 1, 64, 288, 288, 96, 96]
    - [11, 13.432]
  - - [256, 8192, 1, 128, 288, 288, 160, 160]
    - [73, 22.595]
  - - [256, 8192, 1, 256, 288, 288, 288, 288]
    - [81, 35.206]
  - - [256, 8192, 1, 512, 288, 288, 544, 544]
    - [79, 49.048]
  - - [256, 8192, 1, 1024, 288, 288, 1056, 1056]
    - [78, 59.859]
  - - [256, 8192, 1, 2048, 288, 288, 2080, 2080]
    - [85, 68.722]
  - - [256, 8192, 1, 4096, 288, 288, 4128, 4128]
    - [50, 71.908]
  - - [256, 8192, 1, 8192, 288, 288, 8224, 8224]
    - [46, 71.576]
  - - [384, 64, 1, 64, 416, 416, 96, 96]
    - [1, 0.271]
  - - [384, 64, 1, 128, 416, 416, 160, 160]
    - [5, 0.5]
  - - [384, 64, 1, 256, 416, 416, 288, 288]
    - [114, 0.949]
  - - [384, 64, 1, 512, 416, 416, 544, 544]
    - [106, 1.67]
  - - [384, 64, 1, 1024, 416, 416, 1056, 1056]
    - [97, 2.718]
  - - [384, 64, 1, 2048, 416, 416, 2080, 2080]
    - [97, 3.902]
  - - [384, 64, 1, 4096, 416, 416, 4128, 4128]
    - [110, 4.983]
  - - [384, 64, 1, 8192, 416, 416, 8224, 8224]
    - [111, 5.743]
  - - [384, 128, 1, 64, 416, 416, 96, 96]
    - [105, 0.532]
  - - [384, 128, 1, 128, 416, 416, 160, 160]
    - [111, 1.025]
  - - [384, 128, 1, 256, 416, 416, 288, 288]
    - [102, 1.916]
  - - [384, 128, 1, 512, 416, 416, 544, 544]
    - [111, 3.375]
  - - [384, 128, 1, 1024, 416, 416, 1056, 1056]
    - [98, 5.422]
  - - [384, 128, 1, 2048, 416, 416, 2080, 2080]
    - [97, 7.782]
  - - [384, 128, 1, 4096, 416, 416, 4128, 4128]
    - [113, 9.967]
  - - [384, 128, 1, 8192, 416, 416, 8224, 8224]
    - [97, 11.464]
  - - [384, 256, 1, 64, 416, 416, 96, 96]
    - [114, 1.058]
  - - [384, 256, 1, 128, 416, 416, 160, 160]
    - [104, 2.03]
  - - [384, 256, 1, 256, 416, 416, 288, 288]
    - [97, 3.778]
  - - [384, 256, 1, 512, 416, 416, 544, 544]
    - [92, 6.664]
  - - [384, 256, 1, 1024, 416, 416, 1056, 1056]
    - [113, 10.748]
  - - [384, 256, 1, 2048, 416, 416, 2080, 2080]
    - [92, 15.36]
  - - [384, 256, 1, 4096, 416, 416, 4128, 4128]
    - [97, 19.652]
  - - [384, 256, 1, 8192, 416, 416, 8224, 8224]
    - [106, 22.777]
  - - [384, 512, 1, 64, 416, 416, 96, 96]
    - [108, 2.025]
  - - [384, 512, 1, 128, 416, 416, 160, 160]
    - [114, 3.864]
  - - [384, 512, 1, 256, 416, 416, 288, 288]
    - [93, 7.12]
  - - [384, 512, 1, 512, 416, 416, 544, 544]
    - [92, 11.935]
  - - [384, 512, 1, 1024, 416, 416, 1056, 1056]
    - [102, 18.332]
  - - [384, 512, 1, 2048, 416, 416, 2080, 2080]
    - [111, 25.058]
  - - [384, 512, 1, 4096, 416, 416, 4128, 4128]
    - [93, 30.493]
  - - [384, 512, 1, 8192, 416, 416, 8224, 8224]
    - [98, 33.95]
  - - [384, 1024, 1, 64, 416, 416, 96, 96]
    - [27, 3.898]
  - - [384, 1024, 1, 128, 416, 416, 160, 160]
    - [121, 7.391]
  - - [384, 1024, 1, 256, 416, 416, 288, 288]
    - [121, 13.275]
  - - [384, 1024, 1, 512, 416, 416, 544, 544]
    - [121, 22.286]
  - - [384, 1024, 1, 1024, 416, 416, 1056, 1056]
    - [140, 33.372]
  - - [384, 1024, 1, 2048, 416, 416, 2080, 2080]
    - [138, 44.707]
  - - [384, 1024, 1, 4096, 416, 416, 4128, 4128]
    - [143, 52.605]
  - - [384, 1024, 1, 8192, 416, 416, 8224, 8224]
    - [129, 59.528]
  - - [384, 2048, 1, 64, 416, 416, 96, 96]
    - [11, 6.969]
  - - [384, 2048, 1, 128, 416, 416, 160, 160]
    - [19, 12.764]
  - - [384, 2048, 1, 256, 416, 416, 288, 288]
    - [121, 21.368]
  - - [384, 2048, 1, 512, 416, 416, 544, 544]
    - [26, 32.328]
  - - [384, 2048, 1, 1024, 416, 416, 1056, 1056]
    - [13, 43.56]
  - - [384, 2048, 1, 2048, 416, 416, 2080, 2080]
    - [116, 54.706]
  - - [384, 2048, 1, 4096, 416, 416, 4128, 4128]
    - [9, 64.508]
  - - [384, 2048, 1, 8192, 416, 416, 8224, 8224]
    - [9, 68.686]
  - - [384, 4096, 1, 64, 416, 416, 96, 96]
    - [121, 11.104]
  - - [384, 4096, 1, 128, 416, 416, 160, 160]
    - [57, 19.548]
  - - [384, 4096, 1, 256, 416, 416, 288, 288]
    - [45, 31.658]
  - - [384, 4096, 1, 512, 416, 416, 544, 544]
    - [45, 46.716]
  - - [384, 4096, 1, 1024, 416, 416, 1056, 1056]
    - [36, 61.485]
  - - [384, 4096, 1, 2048, 416, 416, 2080, 2080]
    - [45, 69.613]
  - - [384, 4096, 1, 4096, 416, 416, 4128, 4128]
    - [46, 73.802]
  - - [384, 4096, 1, 8192, 416, 416, 8224, 8224]
    - [80, 78.983]
  - - [384, 8192, 1, 64, 416, 416, 96, 96]
    - [51, 17.686]
  - - [384, 8192, 1, 128, 416, 416, 160, 160]
    - [65, 29.388]
  - - [384, 8192, 1, 256, 416, 416, 288, 288]
    - [65, 42.657]
  - - [384, 8192, 1, 512, 416, 416, 544, 544]
    - [44, 56.147]
  - - [384, 8192, 1, 1024, 416, 416, 1056, 1056]
    - [44, 65.372]
  - - [384, 8192, 1, 2048, 416, 416, 2080, 2080]
    - [71, 75.737]
  - - [384, 8192, 1, 4096, 416, 416, 4128, 4128]
    - [71, 82.544]
  - - [384, 8192, 1, 8192, 416, 416, 8224, 8224]
    - [49, 70.016]
  - - [768, 64, 1, 64, 800, 800, 96, 96]
    - [0, 0.534]
  - - [768, 64, 1, 128, 800, 800, 160, 160]
    - [104, 1.025]
  - - [768, 64, 1, 256, 800, 800, 288, 288]
    - [105, 1.922]
  - - [768, 64, 1, 512, 800, 800, 544, 544]
    - [113, 3.368]
  - - [768, 64, 1, 1024, 800, 800, 1056, 1056]
    - [110, 5.413]
  - - [768, 64, 1, 2048, 800, 800, 2080, 2080]
    - [113, 7.769]
  - - [768, 64, 1, 4096, 800, 800, 4128, 4128]
    - [105, 9.896]
  - - [768, 64, 1, 8192, 800, 800, 8224, 8224]
    - [92, 11.439]
  - - [768, 128, 1, 64, 800, 800, 96, 96]
    - [111, 1.058]
  - - [768, 128, 1, 128, 800, 800, 160, 160]
    - [102, 2.012]
  - - [768, 128, 1, 256, 800, 800, 288, 288]
    - [106, 3.779]
  - - [768, 128, 1, 512, 800, 800, 544, 544]
    - [113, 6.637]
  - - [768, 128, 1, 1024, 800, 800, 1056, 1056]
    - [92, 10.689]
  - - [768, 128, 1, 2048, 800, 800, 2080, 2080]
    - [93, 15.289]
  - - [768, 128, 1, 4096, 800, 800, 4128, 4128]
    - [92, 19.527]
  - - [768, 128, 1, 8192, 800, 800, 8224, 8224]
    - [93, 22.452]
  - - [768, 256, 1, 64, 800, 800, 96, 96]
    - [98, 2.029]
  - - [768, 256, 1, 128, 800, 800, 160, 160]
    - [94, 3.848]
  - - [768, 256, 1, 256, 800, 800, 288, 288]
    - [104, 7.002]
  - - [768, 256, 1, 512, 800, 800, 544, 544]
    - [102, 11.973]
  - - [768, 256, 1, 1024, 800, 800, 1056, 1056]
    - [106, 18.455]
  - - [768, 256, 1, 2048, 800, 800, 2080, 2080]
    - [106, 25.163]
  - - [768, 256, 1, 4096, 800, 800, 4128, 4128]
    - [93, 30.356]
  - - [768, 256, 1, 8192, 800, 800, 8224, 8224]
    - [106, 34.147]
  - - [768, 512, 1, 64, 800, 800, 96, 96]
    - [124, 3.911]
  - - [768, 512, 1, 128, 800, 800, 160, 160]
    - [145, 7.374]
  - - [768, 512, 1, 256, 800, 800, 288, 288]
    - [25, 13.006]
  - - [768, 512, 1, 512, 800, 800, 544, 544]
    - [130, 22.314]
  - - [768, 512, 1, 1024, 800, 800, 1056, 1056]
    - [136, 33.487]
  - - [768, 512, 1, 2048, 800, 800, 2080, 2080]
    - [121, 44.926]
  - - [768, 512, 1, 4096, 800, 800, 4128, 4128]
    - [144, 53.744]
  - - [768, 512, 1, 8192, 800, 800, 8224, 8224]
    - [136, 60.017]
  - - [768, 1024, 1, 64, 800, 800, 96, 96]
    - [16, 7.028]
  - - [768, 1024, 1, 128, 800, 800, 160, 160]
    - [138, 12.863]
  - - [768, 1024, 1, 256, 800, 800, 288, 288]
    - [137, 21.952]
  - - [768, 1024, 1, 512, 800, 800, 544, 544]
    - [126, 32.944]
  - - [768, 1024, 1, 1024, 800, 800, 1056, 1056]
    - [134, 44.934]
  - - [768, 1024, 1, 2048, 800, 800, 2080, 2080]
    - [26, 54.558]
  - - [768, 1024, 1, 4096, 800, 800, 4128, 4128]
    - [9, 64.93]
  - - [768, 1024, 1, 8192, 800, 800, 8224, 8224]
    - [22, 69.112]
  - - [768, 2048, 1, 64, 800, 800, 96, 96]
    - [55, 11.021]
  - - [768, 2048, 1, 128, 800, 800, 160, 160]
    - [57, 19.567]
  - - [768, 2048, 1, 256, 800, 800, 288, 288]
    - [45, 31.769]
  - - [768, 2048, 1, 512, 800, 800, 544, 544]
    - [46, 46.66]
  - - [768, 2048, 1, 1024, 800, 800, 1056, 1056]
    - [64, 62.129]
  - - [768, 2048, 1, 2048, 800, 800, 2080, 2080]
    - [72, 69.663]
  - - [768, 2048, 1, 4096, 800, 800, 4128, 4128]
    - [45, 73.634]
  - - [768, 2048, 1, 8192, 800, 800, 8224, 8224]
    - [72, 78.891]
  - - [768, 4096, 1, 64, 800, 800, 96, 96]
    - [45, 18.544]
  - - [768, 4096, 1, 128, 800, 800, 160, 160]
    - [39, 29.422]
  - - [768, 4096, 1, 256, 800, 800, 288, 288]
    - [37, 42.693]
  - - [768, 4096, 1, 512, 800, 800, 544, 544]
    - [43, 56.119]
  - - [768, 4096, 1, 1024, 800, 800, 1056, 1056]
    - [44, 69.987]
  - - [768, 4096, 1, 2048, 800, 800, 2080, 2080]
    - [70, 75.858]
  - - [768, 4096, 1, 4096, 800, 800, 4128, 4128]
    - [40, 83.015]
  - - [768, 4096, 1, 8192, 800, 800, 8224, 8224]
    - [77, 77.395]
  - - [768, 8192, 1, 64, 800, 800, 96, 96]
    - [48, 25.652]
  - - [768, 8192, 1, 128, 800, 800, 160, 160]
    - [38, 37.778]
  - - [768, 8192, 1, 256, 800, 800, 288, 288]
    - [44, 50.96]
  - - [768, 8192, 1, 512, 800, 800, 544, 544]
    - [43, 63.979]
  - - [768, 8192, 1, 1024, 800, 800, 1056, 1056]
    - [44, 68.793]
  - - [768, 8192, 1, 2048, 800, 800, 2080, 2080]
    - [43, 76.475]
  - - [768, 8192, 1, 4096, 800, 800, 4128, 4128]
    - [44, 74.567]
  - - [768, 8192, 1, 8192, 800, 800, 8224, 8224]
    - [49, 58.616]
  - - [1536, 64, 1, 64, 1568, 1568, 96, 96]
    - [102, 1.006]
  - - [1536, 64, 1, 128, 1568, 1568, 160, 160]
    - [105, 2.032]
  - - [1536, 64, 1, 256, 1568, 1568, 288, 288]
    - [98, 3.745]
  - - [1536, 64, 1, 512, 1568, 1568, 544, 544]
    - [88, 6.238]
  - - [1536, 64, 1, 1024, 1568, 1568, 1056, 1056]
    - [97, 10.637]
  - - [1536, 64, 1, 2048, 1568, 1568, 2080, 2080]
    - [97, 15.21]
  - - [1536, 64, 1, 4096, 1568, 1568, 4128, 4128]
    - [110, 19.458]
  - - [1536, 64, 1, 8192, 1568, 1568, 8224, 8224]
    - [91, 22.123]
  - - [1536, 128, 1, 64, 1568, 1568, 96, 96]
    - [92, 2.043]
  - - [1536, 128, 1, 128, 1568, 1568, 160, 160]
    - [93, 3.889]
  - - [1536, 128, 1, 256, 1568, 1568, 288, 288]
    - [92, 7.071]
  - - [1536, 128, 1, 512, 1568, 1568, 544, 544]
    - [111, 11.95]
  - - [1536, 128, 1, 1024, 1568, 1568, 1056, 1056]
    - [93, 18.382]
  - - [1536, 128, 1, 2048, 1568, 1568, 2080, 2080]
    - [106, 25.053]
  - - [1536, 128, 1, 4096, 1568, 1568, 4128, 4128]
    - [98, 30.136]
  - - [1536, 128, 1, 8192, 1568, 1568, 8224, 8224]
    - [106, 34.233]
  - - [1536, 256, 1, 64, 1568, 1568, 96, 96]
    - [130, 3.915]
  - - [1536, 256, 1, 128, 1568, 1568, 160, 160]
    - [145, 7.452]
  - - [1536, 256, 1, 256, 1568, 1568, 288, 288]
    - [141, 13.277]
  - - [1536, 256, 1, 512, 1568, 1568, 544, 544]
    - [136, 22.393]
  - - [1536, 256, 1, 1024, 1568, 1568, 1056, 1056]
    - [132, 33.469]
  - - [1536, 256, 1, 2048, 1568, 1568, 2080, 2080]
    - [121, 44.779]
  - - [1536, 256, 1, 4096, 1568, 1568, 4128, 4128]
    - [138, 53.034]
  - - [1536, 256, 1, 8192, 1568, 1568, 8224, 8224]
    - [121, 59.372]
  - - [1536, 512, 1, 64, 1568, 1568, 96, 96]
    - [25, 7.014]
  - - [1536, 512, 1, 128, 1568, 1568, 160, 160]
    - [121, 12.842]
  - - [1536, 512, 1, 256, 1568, 1568, 288, 288]
    - [121, 21.987]
  - - [1536, 512, 1, 512, 1568, 1568, 544, 544]
    - [133, 32.705]
  - - [1536, 512, 1, 1024, 1568, 1568, 1056, 1056]
    - [26, 44.581]
  - - [1536, 512, 1, 2048, 1568, 1568, 2080, 2080]
    - [122, 54.326]
  - - [1536, 512, 1, 4096, 1568, 1568, 4128, 4128]
    - [9, 64.5]
  - - [1536, 512, 1, 8192, 1568, 1568, 8224, 8224]
    - [8, 69.109]
  - - [1536, 1024, 1, 64, 1568, 1568, 96, 96]
    - [47, 10.963]
  - - [1536, 1024, 1, 128, 1568, 1568, 160, 160]
    - [72, 19.479]
  - - [1536, 1024, 1, 256, 1568, 1568, 288, 288]
    - [86, 31.662]
  - - [1536, 1024, 1, 512, 1568, 1568, 544, 544]
    - [72, 46.664]
  - - [1536, 1024, 1, 1024, 1568, 1568, 1056, 1056]
    - [64, 61.406]
  - - [1536, 1024, 1, 2048, 1568, 1568, 2080, 2080]
    - [45, 69.266]
  - - [1536, 1024, 1, 4096, 1568, 1568, 4128, 4128]
    - [52, 73.98]
  - - [1536, 1024, 1, 8192, 1568, 1568, 8224, 8224]
    - [46, 78.726]
  - - [1536, 2048, 1, 64, 1568, 1568, 96, 96]
    - [86, 18.569]
  - - [1536, 2048, 1, 128, 1568, 1568, 160, 160]
    - [82, 29.289]
  - - [1536, 2048, 1, 256, 1568, 1568, 288, 288]
    - [67, 42.592]
  - - [1536, 2048, 1, 512, 1568, 1568, 544, 544]
    - [68, 56.684]
  - - [1536, 2048, 1, 1024, 1568, 1568, 1056, 1056]
    - [70, 70.04]
  - - [1536, 2048, 1, 2048, 1568, 1568, 2080, 2080]
    - [68, 77.083]
  - - [1536, 2048, 1, 4096, 1568, 1568, 4128, 4128]
    - [41, 83.562]
  - - [1536, 2048, 1, 8192, 1568, 1568, 8224, 8224]
    - [42, 76.434]
  - - [1536, 4096, 1, 64, 1568, 1568, 96, 96]
    - [57, 25.728]
  - - [1536, 4096, 1, 128, 1568, 1568, 160, 160]
    - [38, 38.081]
  - - [1536, 4096, 1, 256, 1568, 1568, 288, 288]
    - [44, 50.983]
  - - [1536, 4096, 1, 512, 1568, 1568, 544, 544]
    - [44, 65.567]
  - - [1536, 4096, 1, 1024, 1568, 1568, 1056, 1056]
    - [44, 71.37]
  - - [1536, 4096, 1, 2048, 1568, 1568, 2080, 2080]
    - [43, 81.121]
  - - [1536, 4096, 1, 4096, 1568, 1568, 4128, 4128]
    - [43, 79.303]
  - - [1536, 4096, 1, 8192, 1568, 1568, 8224, 8224]
    - [71, 67.844]
  - - [1536, 8192, 1, 64, 1568, 1568, 96, 96]
    - [33, 31.703]
  - - [1536, 8192, 1, 128, 1568, 1568, 160, 160]
    - [38, 44.826]
  - - [1536, 8192, 1, 256, 1568, 1568, 288, 288]
    - [36, 59.645]
  - - [1536, 8192, 1, 512, 1568, 1568, 544, 544]
    - [35, 68.175]
  - - [1536, 8192, 1, 1024, 1568, 1568, 1056, 1056]
    - [35, 71.01]
  - - [1536, 8192, 1, 2048, 1568, 1568, 2080, 2080]
    - [60, 65.283]
  - - [1536, 8192, 1, 4096, 1568, 1568, 4128, 4128]
    - [70, 62.973]
  - - [1536, 8192, 1, 8192, 1568, 1568, 8224, 8224]
    - [33, 63.56]
  - - [3072, 64, 1, 64, 3104, 3104, 96, 96]
    - [102, 1.935]
  - - [3072, 64, 1, 128, 3104, 3104, 160, 160]
    - [113, 3.861]
  - - [3072, 64, 1, 256, 3104, 3104, 288, 288]
    - [102, 7.014]
  - - [3072, 64, 1, 512, 3104, 3104, 544, 544]
    - [106, 11.921]
  - - [3072, 64, 1, 1024, 3104, 3104, 1056, 1056]
    - [102, 18.292]
  - - [3072, 64, 1, 2048, 3104, 3104, 2080, 2080]
    - [114, 25.08]
  - - [3072, 64, 1, 4096, 3104, 3104, 4128, 4128]
    - [106, 30.566]
  - - [3072, 64, 1, 8192, 3104, 3104, 8224, 8224]
    - [98, 33.959]
  - - [3072, 128, 1, 64, 3104, 3104, 96, 96]
    - [136, 3.887]
  - - [3072, 128, 1, 128, 3104, 3104, 160, 160]
    - [132, 7.372]
  - - [3072, 128, 1, 256, 3104, 3104, 288, 288]
    - [138, 13.348]
  - - [3072, 128, 1, 512, 3104, 3104, 544, 544]
    - [121, 22.341]
  - - [3072, 128, 1, 1024, 3104, 3104, 1056, 1056]
    - [145, 33.416]
  - - [3072, 128, 1, 2048, 3104, 3104, 2080, 2080]
    - [138, 44.958]
  - - [3072, 128, 1, 4096, 3104, 3104, 4128, 4128]
    - [137, 52.804]
  - - [3072, 128, 1, 8192, 3104, 3104, 8224, 8224]
    - [138, 59.841]
  - - [3072, 256, 1, 64, 3104, 3104, 96, 96]
    - [19, 7.02]
  - - [3072, 256, 1, 128, 3104, 3104, 160, 160]
    - [138, 12.823]
  - - [3072, 256, 1, 256, 3104, 3104, 288, 288]
    - [138, 21.778]
  - - [3072, 256, 1, 512, 3104, 3104, 544, 544]
    - [21, 32.633]
  - - [3072, 256, 1, 1024, 3104, 3104, 1056, 1056]
    - [14, 44.306]
  - - [3072, 256, 1, 2048, 3104, 3104, 2080, 2080]
    - [116, 53.343]
  - - [3072, 256, 1, 4096, 3104, 3104, 4128, 4128]
    - [116, 64.573]
  - - [3072, 256, 1, 8192, 3104, 3104, 8224, 8224]
    - [7, 68.299]
  - - [3072, 512, 1, 64, 3104, 3104, 96, 96]
    - [45, 11.034]
  - - [3072, 512, 1, 128, 3104, 3104, 160, 160]
    - [57, 19.383]
  - - [3072, 512, 1, 256, 3104, 3104, 288, 288]
    - [45, 31.938]
  - - [3072, 512, 1, 512, 3104, 3104, 544, 544]
    - [45, 46.518]
  - - [3072, 512, 1, 1024, 3104, 3104, 1056, 1056]
    - [36, 61.703]
  - - [3072, 512, 1, 2048, 3104, 3104, 2080, 2080]
    - [46, 69.992]
  - - [3072, 512, 1, 4096, 3104, 3104, 4128, 4128]
    - [45, 73.744]
  - - [3072, 512, 1, 8192, 3104, 3104, 8224, 8224]
    - [50, 77.537]
  - - [3072, 1024, 1, 64, 3104, 3104, 96, 96]
    - [58, 17.602]
  - - [3072, 1024, 1, 128, 3104, 3104, 160, 160]
    - [39, 29.224]
  - - [3072, 1024, 1, 256, 3104, 3104, 288, 288]
    - [37, 42.61]
  - - [3072, 1024, 1, 512, 3104, 3104, 544, 544]
    - [42, 56.962]
  - - [3072, 1024, 1, 1024, 3104, 3104, 1056, 1056]
    - [43, 70.238]
  - - [3072, 1024, 1, 2048, 3104, 3104, 2080, 2080]
    - [42, 76.972]
  - - [3072, 1024, 1, 4096, 3104, 3104, 4128, 4128]
    - [71, 83.377]
  - - [3072, 1024, 1, 8192, 3104, 3104, 8224, 8224]
    - [44, 71.408]
  - - [3072, 2048, 1, 64, 3104, 3104, 96, 96]
    - [54, 25.723]
  - - [3072, 2048, 1, 128, 3104, 3104, 160, 160]
    - [38, 37.986]
  - - [3072, 2048, 1, 256, 3104, 3104, 288, 288]
    - [44, 51.026]
  - - [3072, 2048, 1, 512, 3104, 3104, 544, 544]
    - [44, 65.531]
  - - [3072, 2048, 1, 1024, 3104, 3104, 1056, 1056]
    - [44, 70.932]
  - - [3072, 2048, 1, 2048, 3104, 3104, 2080, 2080]
    - [44, 79.051]
  - - [3072, 2048, 1, 4096, 3104, 3104, 4128, 4128]
    - [44, 70.058]
  - - [3072, 2048, 1, 8192, 3104, 3104, 8224, 8224]
    - [46, 64.312]
  - - [3072, 4096, 1, 64, 3104, 3104, 96, 96]
    - [31, 31.866]
  - - [3072, 4096, 1, 128, 3104, 3104, 160, 160]
    - [38, 45.109]
  - - [3072, 4096, 1, 256, 3104, 3104, 288, 288]
    - [34, 59.481]
  - - [3072, 4096, 1, 512, 3104, 3104, 544, 544]
    - [35, 66.81]
  - - [3072, 4096, 1, 1024, 3104, 3104, 1056, 1056]
    - [74, 71.496]
  - - [3072, 4096, 1, 2048, 3104, 3104, 2080, 2080]
    - [59, 65.339]
  - - [3072, 4096, 1, 4096, 3104, 3104, 4128, 4128]
    - [63, 66.39]
  - - [3072, 4096, 1, 8192, 3104, 3104, 8224, 8224]
    - [36, 65.431]
  - - [3072, 8192, 1, 64, 3104, 3104, 96, 96]
    - [33, 36.217]
  - - [3072, 8192, 1, 128, 3104, 3104, 160, 160]
    - [36, 48.118]
  - - [3072, 8192, 1, 256, 3104, 3104, 288, 288]
    - [76, 62.874]
  - - [3072, 8192, 1, 512, 3104, 3104, 544, 544]
    - [35, 72.394]
  - - [3072, 8192, 1, 1024, 3104, 3104, 1056, 1056]
    - [32, 61.924]
  - - [3072, 8192, 1, 2048, 3104, 3104, 2080, 2080]
    - [43, 64.26]
  - - [3072, 8192, 1, 4096, 3104, 3104, 4128, 4128]
    - [44, 65.827]
  - - [3072, 8192, 1, 8192, 3104, 3104, 8224, 8224]
    - [36, 67.115]
  - - [6144, 64, 1, 64, 6176, 6176, 96, 96]
    - [89, 3.663]
  - - [6144, 64, 1, 128, 6176, 6176, 160, 160]
    - [130, 7.298]
  - - [6144, 64, 1, 256, 6176, 6176, 288, 288]
    - [143, 13.291]
  - - [6144, 64, 1, 512, 6176, 6176, 544, 544]
    - [138, 22.142]
  - - [6144, 64, 1, 1024, 6176, 6176, 1056, 1056]
    - [121, 33.35]
  - - [6144, 64, 1, 2048, 6176, 6176, 2080, 2080]
    - [120, 44.486]
  - - [6144, 64, 1, 4096, 6176, 6176, 4128, 4128]
    - [121, 52.229]
  - - [6144, 64, 1, 8192, 6176, 6176, 8224, 8224]
    - [118, 48.366]
  - - [6144, 128, 1, 64, 6176, 6176, 96, 96]
    - [11, 6.639]
  - - [6144, 128, 1, 128, 6176, 6176, 160, 160]
    - [137, 12.769]
  - - [6144, 128, 1, 256, 6176, 6176, 288, 288]
    - [145, 21.47]
  - - [6144, 128, 1, 512, 6176, 6176, 544, 544]
    - [14, 32.411]
  - - [6144, 128, 1, 1024, 6176, 6176, 1056, 1056]
    - [14, 43.959]
  - - [6144, 128, 1, 2048, 6176, 6176, 2080, 2080]
    - [116, 55.095]
  - - [6144, 128, 1, 4096, 6176, 6176, 4128, 4128]
    - [117, 64.846]
  - - [6144, 128, 1, 8192, 6176, 6176, 8224, 8224]
    - [119, 67.41]
  - - [6144, 256, 1, 64, 6176, 6176, 96, 96]
    - [140, 11.482]
  - - [6144, 256, 1, 128, 6176, 6176, 160, 160]
    - [87, 20.123]
  - - [6144, 256, 1, 256, 6176, 6176, 288, 288]
    - [73, 32.578]
  - - [6144, 256, 1, 512, 6176, 6176, 544, 544]
    - [46, 47.202]
  - - [6144, 256, 1, 1024, 6176, 6176, 1056, 1056]
    - [34, 60.711]
  - - [6144, 256, 1, 2048, 6176, 6176, 2080, 2080]
    - [73, 68.55]
  - - [6144, 256, 1, 4096, 6176, 6176, 4128, 4128]
    - [73, 73.68]
  - - [6144, 256, 1, 8192, 6176, 6176, 8224, 8224]
    - [45, 67.225]
  - - [6144, 512, 1, 64, 6176, 6176, 96, 96]
    - [50, 18.048]
  - - [6144, 512, 1, 128, 6176, 6176, 160, 160]
    - [84, 28.827]
  - - [6144, 512, 1, 256, 6176, 6176, 288, 288]
    - [83, 41.898]
  - - [6144, 512, 1, 512, 6176, 6176, 544, 544]
    - [72, 55.707]
  - - [6144, 512, 1, 1024, 6176, 6176, 1056, 1056]
    - [71, 66.218]
  - - [6144, 512, 1, 2048, 6176, 6176, 2080, 2080]
    - [70, 75.635]
  - - [6144, 512, 1, 4096, 6176, 6176, 4128, 4128]
    - [43, 81.029]
  - - [6144, 512, 1, 8192, 6176, 6176, 8224, 8224]
    - [73, 66.302]
  - - [6144, 1024, 1, 64, 6176, 6176, 96, 96]
    - [86, 25.078]
  - - [6144, 1024, 1, 128, 6176, 6176, 160, 160]
    - [66, 37.375]
  - - [6144, 1024, 1, 256, 6176, 6176, 288, 288]
    - [71, 50.576]
  - - [6144, 1024, 1, 512, 6176, 6176, 544, 544]
    - [35, 64.313]
  - - [6144, 1024, 1, 1024, 6176, 6176, 1056, 1056]
    - [44, 68.423]
  - - [6144, 1024, 1, 2048, 6176, 6176, 2080, 2080]
    - [70, 75.111]
  - - [6144, 1024, 1, 4096, 6176, 6176, 4128, 4128]
    - [30, 68.676]
  - - [6144, 1024, 1, 8192, 6176, 6176, 8224, 8224]
    - [43, 61.23]
  - - [6144, 2048, 1, 64, 6176, 6176, 96, 96]
    - [75, 31.503]
  - - [6144, 2048, 1, 128, 6176, 6176, 160, 160]
    - [34, 44.296]
  - - [6144, 2048, 1, 256, 6176, 6176, 288, 288]
    - [35, 59.068]
  - - [6144, 2048, 1, 512, 6176, 6176, 544, 544]
    - [35, 66.188]
  - - [6144, 2048, 1, 1024, 6176, 6176, 1056, 1056]
    - [75, 71.517]
  - - [6144, 2048, 1, 2048, 6176, 6176, 2080, 2080]
    - [76, 66.504]
  - - [6144, 2048, 1, 4096, 6176, 6176, 4128, 4128]
    - [63, 66.769]
  - - [6144, 2048, 1, 8192, 6176, 6176, 8224, 8224]
    - [63, 62.208]
  - - [6144, 4096, 1, 64, 6176, 6176, 96, 96]
    - [76, 36.01]
  - - [6144, 4096, 1, 128, 6176, 6176, 160, 160]
    - [60, 47.962]
  - - [6144, 4096, 1, 256, 6176, 6176, 288, 288]
    - [56, 62.541]
  - - [6144, 4096, 1, 512, 6176, 6176, 544, 544]
    - [61, 68.71]
  - - [6144, 4096, 1, 1024, 6176, 6176, 1056, 1056]
    - [71, 61.741]
  - - [6144, 4096, 1, 2048, 6176, 6176, 2080, 2080]
    - [69, 66.453]
  - - [6144, 4096, 1, 4096, 6176, 6176, 4128, 4128]
    - [44, 66.462]
  - - [6144, 4096, 1, 8192, 6176, 6176, 8224, 8224]
    - [71, 64.762]
  - - [6144, 8192, 1, 64, 6176, 6176, 96, 96]
    - [38, 37.25]
  - - [6144, 8192, 1, 128, 6176, 6176, 160, 160]
    - [36, 52.184]
  - - [6144, 8192, 1, 256, 6176, 6176, 288, 288]
    - [53, 62.774]
  - - [6144, 8192, 1, 512, 6176, 6176, 544, 544]
    - [62, 55.603]
  - - [6144, 8192, 1, 1024, 6176, 6176, 1056, 1056]
    - [61, 59.134]
  - - [6144, 8192, 1, 2048, 6176, 6176, 2080, 2080]
    - [70, 64.483]
  - - [6144, 8192, 1, 4096, 6176, 6176, 4128, 4128]
    - [36, 66.962]
  - - [6144, 8192, 1, 8192, 6176, 6176, 8224, 8224]
    - [70, 65.386]
- null
- null
- DeviceEfficiency
