library/src/blas3/Tensile/Logic/asm_full/navi31/navi31_Cijk_Ailk_Bjlk_HHS_BH.yaml
- {MinimumRequiredVersion: 4.35.0}
- navi31
- gfx1100
- [Device 73bf]
    SolutionIndex: 0
    SolutionNameMin: Cijk_Ailk_Bjlk_HHS_BH_MT32x32x16_MI16x16x16x1_SN_1LDSB1_AMAS0_GRVW2_IU1_NLCA1_NLCB1_SIA2_SU0_SUS0_SVW1_TT1_16_VW1_WGM4
    SolutionIndex: 1
    SolutionNameMin: Cijk_Ailk_Bjlk_HHS_BH_MT32x32x16_MI16x16x16x1_SN_1LDSB1_AMAS0_GRVW4_IU1_NLCA1_NLCB1_SIA2_SU0_SUS0_SVW1_TT1_16_VW1_WGM4
    SolutionIndex: 2
    SolutionNameMin: Cijk_Ailk_Bjlk_HHS_BH_MT32x32x16_MI16x16x16x1_SN_1LDSB1_AMAS0_GRVW8_IU1_NLCA1_NLCB1_SIA2_SU0_SUS0_SVW1_TT1_16_VW1_WGM4
    SolutionIndex: 3
    SolutionNameMin: Cijk_Ailk_Bjlk_HHS_BH_MT32x32x16_MI16x16x16x1_SN_1LDSB1_AMAS0_GRVW2_IU1_NLCA1_NLCB1_SIA2_SU0_SUS0_SVW1_TT1_16_VW1_WGM8
    SolutionIndex: 4
    SolutionNameMin: Cijk_Ailk_Bjlk_HHS_BH_MT32x32x16_MI16x16x16x1_SN_1LDSB1_AMAS0_GRVW8_IU1_NLCA1_NLCB1_SIA2_SU32_SUS256_SVW1_TT1_16_VW1_WGM8
    SolutionIndex: 5
    SolutionNameMin: Cijk_Ailk_Bjlk_HHS_BH_MT64x64x16_MI16x16x16x1_SN_1LDSB0_AMAS3_GRVW8_IU1_NLCA1_NLCB1_SIA1_SU0_SUS0_SVW2_TT2_32_VW2_WGM4
    SolutionIndex: 6
    SolutionNameMin: Cijk_Ailk_Bjlk_HHS_BH_MT64x64x16_MI16x16x16x1_SN_1LDSB1_AMAS3_GRVW2_IU1_NLCA1_NLCB1_SIA2_SU0_SUS0_SVW2_TT2_32_VW2_WGM4
    SolutionIndex: 7
    SolutionNameMin: Cijk_Ailk_Bjlk_HHS_BH_MT64x64x16_MI16x16x16x1_SN_1LDSB1_AMAS3_GRVW8_IU1_NLCA1_NLCB1_SIA2_SU0_SUS0_SVW2_TT2_32_VW2_WGM4
    SolutionIndex: 8
    SolutionNameMin: Cijk_Ailk_Bjlk_HHS_BH_MT64x64x16_MI16x16x16x1_SN_1LDSB0_AMAS3_GRVW8_IU1_NLCA1_NLCB1_SIA1_SU32_SUS128_SVW2_TT2_32_VW2_WGM4
    SolutionIndex: 9
    SolutionNameMin: Cijk_Ailk_Bjlk_HHS_BH_MT64x64x16_MI16x16x16x1_SN_1LDSB1_AMAS3_GRVW4_IU1_NLCA1_NLCB1_SIA2_SU32_SUS128_SVW2_TT2_32_VW2_WGM4
    SolutionIndex: 10
    SolutionNameMin: Cijk_Ailk_Bjlk_HHS_BH_MT64x64x16_MI16x16x16x1_SN_1LDSB1_AMAS3_GRVW8_IU1_NLCA1_NLCB1_SIA2_SU32_SUS256_SVW2_TT2_32_VW2_WGM4
    SolutionIndex: 11
    SolutionNameMin: Cijk_Ailk_Bjlk_HHS_BH_MT64x64x16_MI16x16x16x1_SN_1LDSB0_AMAS3_GRVW4_IU1_NLCA1_NLCB1_SIA1_SU0_SUS0_SVW2_TT2_32_VW2_WGM8
    SolutionIndex: 12
    SolutionNameMin: Cijk_Ailk_Bjlk_HHS_BH_MT64x64x16_MI16x16x16x1_SN_1LDSB0_AMAS3_GRVW8_IU1_NLCA1_NLCB1_SIA1_SU0_SUS0_SVW2_TT2_32_VW2_WGM8
    SolutionIndex: 13
    SolutionNameMin: Cijk_Ailk_Bjlk_HHS_BH_MT64x64x16_MI16x16x16x1_SN_1LDSB1_AMAS3_GRVW8_IU1_NLCA1_NLCB1_SIA2_SU0_SUS0_SVW2_TT2_32_VW2_WGM8
    SolutionIndex: 14
    SolutionNameMin: Cijk_Ailk_Bjlk_HHS_BH_MT64x64x16_MI16x16x16x1_SN_1LDSB0_AMAS3_GRVW4_IU1_NLCA1_NLCB1_SIA1_SU32_SUS128_SVW2_TT2_32_VW2_WGM8
    SolutionIndex: 15
    SolutionNameMin: Cijk_Ailk_Bjlk_HHS_BH_MT64x64x16_MI16x16x16x1_SN_1LDSB0_AMAS3_GRVW8_IU1_NLCA1_NLCB1_SIA1_SU32_SUS128_SVW2_TT2_32_VW2_WGM8
    SolutionIndex: 16
    SolutionNameMin: Cijk_Ailk_Bjlk_HHS_BH_MT64x64x16_MI16x16x16x1_SN_1LDSB1_AMAS3_GRVW8_IU1_NLCA1_NLCB1_SIA2_SU32_SUS128_SVW2_TT2_32_VW2_WGM8
    SolutionIndex: 17
    SolutionNameMin: Cijk_Ailk_Bjlk_HHS_BH_MT128x128x16_MI16x16x16x1_SN_1LDSB0_AMAS3_GRVW2_IU1_NLCA2_NLCB2_SIA1_SU0_SUS0_SVW4_TT4_64_VW4_WGM4
    SolutionIndex: 18
    SolutionNameMin: Cijk_Ailk_Bjlk_HHS_BH_MT128x128x16_MI16x16x16x1_SN_1LDSB0_AMAS0_GRVW4_IU1_NLCA1_NLCB1_SIA1_SU0_SUS0_SVW1_TT4_64_VW1_WGM4
    SolutionIndex: 19
    SolutionNameMin: Cijk_Ailk_Bjlk_HHS_BH_MT128x128x16_MI16x16x16x1_SN_1LDSB0_AMAS3_GRVW4_IU1_NLCA1_NLCB1_SIA1_SU0_SUS0_SVW2_TT4_64_VW2_WGM4
    SolutionIndex: 20
    SolutionNameMin: Cijk_Ailk_Bjlk_HHS_BH_MT128x128x16_MI16x16x16x1_SN_1LDSB0_AMAS3_GRVW4_IU1_NLCA1_NLCB1_SIA1_SU0_SUS0_SVW4_TT4_64_VW4_WGM4
    SolutionIndex: 21
    SolutionNameMin: Cijk_Ailk_Bjlk_HHS_BH_MT128x128x16_MI16x16x16x1_SN_1LDSB0_AMAS0_GRVW8_IU1_NLCA1_NLCB1_SIA1_SU0_SUS0_SVW1_TT4_64_VW1_WGM4
    SolutionIndex: 22
    SolutionNameMin: Cijk_Ailk_Bjlk_HHS_BH_MT128x128x16_MI16x16x16x1_SN_1LDSB0_AMAS3_GRVW8_IU1_NLCA1_NLCB1_SIA1_SU0_SUS0_SVW2_TT4_64_VW2_WGM4
    SolutionIndex: 23
    SolutionNameMin: Cijk_Ailk_Bjlk_HHS_BH_MT128x128x16_MI16x16x16x1_SN_1LDSB0_AMAS3_GRVW8_IU1_NLCA1_NLCB1_SIA1_SU0_SUS0_SVW4_TT4_64_VW4_WGM4
    SolutionIndex: 24
    SolutionNameMin: Cijk_Ailk_Bjlk_HHS_BH_MT128x128x16_MI16x16x16x1_SN_1LDSB1_AMAS3_GRVW2_IU1_NLCA2_NLCB2_SIA2_SU0_SUS0_SVW4_TT4_64_VW4_WGM4
    SolutionIndex: 25
    SolutionNameMin: Cijk_Ailk_Bjlk_HHS_BH_MT128x128x16_MI16x16x16x1_SN_1LDSB1_AMAS0_GRVW4_IU1_NLCA1_NLCB1_SIA2_SU0_SUS0_SVW1_TT4_64_VW1_WGM4
    SolutionIndex: 26
    SolutionNameMin: Cijk_Ailk_Bjlk_HHS_BH_MT128x128x16_MI16x16x16x1_SN_1LDSB1_AMAS3_GRVW4_IU1_NLCA1_NLCB1_SIA2_SU0_SUS0_SVW2_TT4_64_VW2_WGM4
    SolutionIndex: 27
    SolutionNameMin: Cijk_Ailk_Bjlk_HHS_BH_MT128x128x16_MI16x16x16x1_SN_1LDSB1_AMAS3_GRVW4_IU1_NLCA1_NLCB1_SIA2_SU0_SUS0_SVW4_TT4_64_VW4_WGM4
    SolutionIndex: 28
    SolutionNameMin: Cijk_Ailk_Bjlk_HHS_BH_MT128x128x16_MI16x16x16x1_SN_1LDSB0_AMAS3_GRVW8_IU1_NLCA1_NLCB1_SIA3_SU0_SUS0_SVW2_TT4_64_VW2_WGM4
    SolutionIndex: 29
    SolutionNameMin: Cijk_Ailk_Bjlk_HHS_BH_MT128x128x16_MI16x16x16x1_SN_1LDSB0_AMAS3_GRVW8_IU1_NLCA1_NLCB1_SIA3_SU0_SUS0_SVW4_TT4_64_VW4_WGM4
    SolutionIndex: 30
    SolutionNameMin: Cijk_Ailk_Bjlk_HHS_BH_MT128x128x16_MI16x16x16x1_SN_1LDSB0_AMAS3_GRVW4_IU1_NLCA1_NLCB1_SIA1_SU32_SUS128_SVW4_TT4_64_VW4_WGM4
    SolutionIndex: 31
    SolutionNameMin: Cijk_Ailk_Bjlk_HHS_BH_MT128x128x16_MI16x16x16x1_SN_1LDSB0_AMAS3_GRVW8_IU1_NLCA1_NLCB1_SIA1_SU32_SUS128_SVW4_TT4_64_VW4_WGM4
    SolutionIndex: 32
    SolutionNameMin: Cijk_Ailk_Bjlk_HHS_BH_MT128x128x16_MI16x16x16x1_SN_1LDSB1_AMAS3_GRVW4_IU1_NLCA1_NLCB1_SIA2_SU32_SUS128_SVW4_TT4_64_VW4_WGM4
    SolutionIndex: 33
    SolutionNameMin: Cijk_Ailk_Bjlk_HHS_BH_MT128x128x16_MI16x16x16x1_SN_1LDSB1_AMAS0_GRVW8_IU1_NLCA1_NLCB1_SIA2_SU32_SUS128_SVW1_TT4_64_VW1_WGM4
    SolutionIndex: 34
    SolutionNameMin: Cijk_Ailk_Bjlk_HHS_BH_MT128x128x16_MI16x16x16x1_SN_1LDSB1_AMAS3_GRVW8_IU1_NLCA1_NLCB1_SIA2_SU32_SUS128_SVW4_TT4_64_VW4_WGM4
    SolutionIndex: 35
    SolutionNameMin: Cijk_Ailk_Bjlk_HHS_BH_MT128x128x16_MI16x16x16x1_SN_1LDSB0_AMAS3_GRVW2_IU1_NLCA2_NLCB2_SIA1_SU32_SUS256_SVW4_TT4_64_VW4_WGM4
    SolutionIndex: 36
    SolutionNameMin: Cijk_Ailk_Bjlk_HHS_BH_MT128x128x16_MI16x16x16x1_SN_1LDSB0_AMAS0_GRVW4_IU1_NLCA1_NLCB1_SIA1_SU32_SUS256_SVW1_TT4_64_VW1_WGM4
    SolutionIndex: 37
    SolutionNameMin: Cijk_Ailk_Bjlk_HHS_BH_MT128x128x16_MI16x16x16x1_SN_1LDSB0_AMAS3_GRVW4_IU1_NLCA1_NLCB1_SIA1_SU32_SUS256_SVW2_TT4_64_VW2_WGM4
    SolutionIndex: 38
    SolutionNameMin: Cijk_Ailk_Bjlk_HHS_BH_MT128x128x16_MI16x16x16x1_SN_1LDSB0_AMAS3_GRVW4_IU1_NLCA1_NLCB1_SIA1_SU32_SUS256_SVW4_TT4_64_VW4_WGM4
    SolutionIndex: 39
    SolutionNameMin: Cijk_Ailk_Bjlk_HHS_BH_MT128x128x16_MI16x16x16x1_SN_1LDSB0_AMAS0_GRVW8_IU1_NLCA1_NLCB1_SIA1_SU32_SUS256_SVW1_TT4_64_VW1_WGM4
    SolutionIndex: 40
    SolutionNameMin: Cijk_Ailk_Bjlk_HHS_BH_MT128x128x16_MI16x16x16x1_SN_1LDSB0_AMAS3_GRVW8_IU1_NLCA1_NLCB1_SIA1_SU32_SUS256_SVW4_TT4_64_VW4_WGM4
    SolutionIndex: 41
    SolutionNameMin: Cijk_Ailk_Bjlk_HHS_BH_MT128x128x16_MI16x16x16x1_SN_1LDSB1_AMAS3_GRVW4_IU1_NLCA1_NLCB1_SIA2_SU32_SUS256_SVW2_TT4_64_VW2_WGM4
    SolutionIndex: 42
    SolutionNameMin: Cijk_Ailk_Bjlk_HHS_BH_MT128x128x16_MI16x16x16x1_SN_1LDSB1_AMAS3_GRVW4_IU1_NLCA1_NLCB1_SIA2_SU32_SUS256_SVW4_TT4_64_VW4_WGM4
    SolutionIndex: 43
    SolutionNameMin: Cijk_Ailk_Bjlk_HHS_BH_MT128x128x16_MI16x16x16x1_SN_1LDSB1_AMAS0_GRVW8_IU1_NLCA1_NLCB1_SIA2_SU32_SUS256_SVW1_TT4_64_VW1_WGM4
    SolutionIndex: 44
    SolutionNameMin: Cijk_Ailk_Bjlk_HHS_BH_MT128x128x16_MI16x16x16x1_SN_1LDSB1_AMAS3_GRVW8_IU1_NLCA1_NLCB1_SIA2_SU32_SUS256_SVW4_TT4_64_VW4_WGM4
    SolutionIndex: 45
    SolutionNameMin: Cijk_Ailk_Bjlk_HHS_BH_MT128x128x16_MI16x16x16x1_SN_1LDSB0_AMAS3_GRVW8_IU1_NLCA1_NLCB1_SIA3_SU32_SUS256_SVW4_TT4_64_VW4_WGM4
    SolutionIndex: 46
    SolutionNameMin: Cijk_Ailk_Bjlk_HHS_BH_MT128x128x16_MI16x16x16x1_SN_1LDSB0_AMAS3_GRVW2_IU1_NLCA2_NLCB2_SIA1_SU0_SUS0_SVW2_TT4_64_VW2_WGM8
    SolutionIndex: 47
    SolutionNameMin: Cijk_Ailk_Bjlk_HHS_BH_MT128x128x16_MI16x16x16x1_SN_1LDSB0_AMAS3_GRVW2_IU1_NLCA2_NLCB2_SIA1_SU0_SUS0_SVW4_TT4_64_VW4_WGM8
    SolutionIndex: 48
    SolutionNameMin: Cijk_Ailk_Bjlk_HHS_BH_MT128x128x16_MI16x16x16x1_SN_1LDSB0_AMAS0_GRVW4_IU1_NLCA1_NLCB1_SIA1_SU0_SUS0_SVW1_TT4_64_VW1_WGM8
    SolutionIndex: 49
    SolutionNameMin: Cijk_Ailk_Bjlk_HHS_BH_MT128x128x16_MI16x16x16x1_SN_1LDSB0_AMAS3_GRVW4_IU1_NLCA1_NLCB1_SIA1_SU0_SUS0_SVW2_TT4_64_VW2_WGM8
    SolutionIndex: 50
    SolutionNameMin: Cijk_Ailk_Bjlk_HHS_BH_MT128x128x16_MI16x16x16x1_SN_1LDSB0_AMAS3_GRVW4_IU1_NLCA1_NLCB1_SIA1_SU0_SUS0_SVW4_TT4_64_VW4_WGM8
    SolutionIndex: 51
    SolutionNameMin: Cijk_Ailk_Bjlk_HHS_BH_MT128x128x16_MI16x16x16x1_SN_1LDSB0_AMAS0_GRVW8_IU1_NLCA1_NLCB1_SIA1_SU0_SUS0_SVW1_TT4_64_VW1_WGM8
    SolutionIndex: 52
    SolutionNameMin: Cijk_Ailk_Bjlk_HHS_BH_MT128x128x16_MI16x16x16x1_SN_1LDSB0_AMAS3_GRVW8_IU1_NLCA1_NLCB1_SIA1_SU0_SUS0_SVW2_TT4_64_VW2_WGM8
    SolutionIndex: 53
    SolutionNameMin: Cijk_Ailk_Bjlk_HHS_BH_MT128x128x16_MI16x16x16x1_SN_1LDSB0_AMAS3_GRVW8_IU1_NLCA1_NLCB1_SIA1_SU0_SUS0_SVW4_TT4_64_VW4_WGM8
    SolutionIndex: 54
    SolutionNameMin: Cijk_Ailk_Bjlk_HHS_BH_MT128x128x16_MI16x16x16x1_SN_1LDSB1_AMAS0_GRVW4_IU1_NLCA1_NLCB1_SIA2_SU0_SUS0_SVW1_TT4_64_VW1_WGM8
    SolutionIndex: 55
    SolutionNameMin: Cijk_Ailk_Bjlk_HHS_BH_MT128x128x16_MI16x16x16x1_SN_1LDSB1_AMAS3_GRVW4_IU1_NLCA1_NLCB1_SIA2_SU0_SUS0_SVW2_TT4_64_VW2_WGM8
    SolutionIndex: 56
    SolutionNameMin: Cijk_Ailk_Bjlk_HHS_BH_MT128x128x16_MI16x16x16x1_SN_1LDSB1_AMAS3_GRVW4_IU1_NLCA1_NLCB1_SIA2_SU0_SUS0_SVW4_TT4_64_VW4_WGM8
    SolutionIndex: 57
    SolutionNameMin: Cijk_Ailk_Bjlk_HHS_BH_MT128x128x16_MI16x16x16x1_SN_1LDSB0_AMAS3_GRVW8_IU1_NLCA1_NLCB1_SIA3_SU0_SUS0_SVW4_TT4_64_VW4_WGM8
    SolutionIndex: 58
    SolutionNameMin: Cijk_Ailk_Bjlk_HHS_BH_MT128x128x16_MI16x16x16x1_SN_1LDSB0_AMAS0_GRVW4_IU1_NLCA1_NLCB1_SIA1_SU32_SUS128_SVW1_TT4_64_VW1_WGM8
    SolutionIndex: 59
    SolutionNameMin: Cijk_Ailk_Bjlk_HHS_BH_MT128x128x16_MI16x16x16x1_SN_1LDSB0_AMAS3_GRVW4_IU1_NLCA1_NLCB1_SIA1_SU32_SUS128_SVW2_TT4_64_VW2_WGM8
    SolutionIndex: 60
    SolutionNameMin: Cijk_Ailk_Bjlk_HHS_BH_MT128x128x16_MI16x16x16x1_SN_1LDSB0_AMAS3_GRVW4_IU1_NLCA1_NLCB1_SIA1_SU32_SUS128_SVW4_TT4_64_VW4_WGM8
    SolutionIndex: 61
    SolutionNameMin: Cijk_Ailk_Bjlk_HHS_BH_MT128x128x16_MI16x16x16x1_SN_1LDSB0_AMAS3_GRVW8_IU1_NLCA1_NLCB1_SIA1_SU32_SUS128_SVW4_TT4_64_VW4_WGM8
    SolutionIndex: 62
    SolutionNameMin: Cijk_Ailk_Bjlk_HHS_BH_MT128x128x16_MI16x16x16x1_SN_1LDSB1_AMAS3_GRVW4_IU1_NLCA1_NLCB1_SIA2_SU32_SUS128_SVW2_TT4_64_VW2_WGM8
    SolutionIndex: 63
    SolutionNameMin: Cijk_Ailk_Bjlk_HHS_BH_MT128x128x16_MI16x16x16x1_SN_1LDSB1_AMAS3_GRVW4_IU1_NLCA1_NLCB1_SIA2_SU32_SUS128_SVW4_TT4_64_VW4_WGM8
    SolutionIndex: 64
    SolutionNameMin: Cijk_Ailk_Bjlk_HHS_BH_MT128x128x16_MI16x16x16x1_SN_1LDSB1_AMAS0_GRVW8_IU1_NLCA1_NLCB1_SIA2_SU32_SUS128_SVW1_TT4_64_VW1_WGM8
    SolutionIndex: 65
    SolutionNameMin: Cijk_Ailk_Bjlk_HHS_BH_MT128x128x16_MI16x16x16x1_SN_1LDSB1_AMAS3_GRVW8_IU1_NLCA1_NLCB1_SIA2_SU32_SUS128_SVW4_TT4_64_VW4_WGM8
    SolutionIndex: 66
    SolutionNameMin: Cijk_Ailk_Bjlk_HHS_BH_MT128x128x16_MI16x16x16x1_SN_1LDSB0_AMAS0_GRVW4_IU1_NLCA1_NLCB1_SIA1_SU32_SUS256_SVW1_TT4_64_VW1_WGM8
    SolutionIndex: 67
    SolutionNameMin: Cijk_Ailk_Bjlk_HHS_BH_MT128x128x16_MI16x16x16x1_SN_1LDSB0_AMAS3_GRVW4_IU1_NLCA1_NLCB1_SIA1_SU32_SUS256_SVW4_TT4_64_VW4_WGM8
    SolutionIndex: 68
    SolutionNameMin: Cijk_Ailk_Bjlk_HHS_BH_MT128x128x16_MI16x16x16x1_SN_1LDSB0_AMAS0_GRVW8_IU1_NLCA1_NLCB1_SIA1_SU32_SUS256_SVW1_TT4_64_VW1_WGM8
    SolutionIndex: 69
    SolutionNameMin: Cijk_Ailk_Bjlk_HHS_BH_MT128x128x16_MI16x16x16x1_SN_1LDSB0_AMAS3_GRVW8_IU1_NLCA1_NLCB1_SIA1_SU32_SUS256_SVW4_TT4_64_VW4_WGM8
    SolutionIndex: 70
    SolutionNameMin: Cijk_Ailk_Bjlk_HHS_BH_MT128x128x16_MI16x16x16x1_SN_1LDSB1_AMAS3_GRVW4_IU1_NLCA1_NLCB1_SIA2_SU32_SUS256_SVW2_TT4_64_VW2_WGM8
    SolutionIndex: 71
    SolutionNameMin: Cijk_Ailk_Bjlk_HHS_BH_MT128x128x16_MI16x16x16x1_SN_1LDSB1_AMAS3_GRVW4_IU1_NLCA1_NLCB1_SIA2_SU32_SUS256_SVW4_TT4_64_VW4_WGM8
    SolutionIndex: 72
    SolutionNameMin: Cijk_Ailk_Bjlk_HHS_BH_MT32x32x32_MI16x16x16x1_SN_1LDSB0_AMAS0_GRVW8_IU1_NLCA1_NLCB1_SIA1_SU0_SUS0_SVW1_TT1_16_VW1_WGM4
    SolutionIndex: 73
    SolutionNameMin: Cijk_Ailk_Bjlk_HHS_BH_MT32x32x32_MI16x16x16x1_SN_1LDSB1_AMAS0_GRVW2_IU2_NLCA1_NLCB1_SIA2_SU0_SUS0_SVW1_TT1_16_VW1_WGM4
    SolutionIndex: 74
    SolutionNameMin: Cijk_Ailk_Bjlk_HHS_BH_MT32x32x32_MI16x16x16x1_SN_1LDSB1_AMAS0_GRVW4_IU2_NLCA1_NLCB1_SIA2_SU0_SUS0_SVW1_TT1_16_VW1_WGM4
    SolutionIndex: 75
    SolutionNameMin: Cijk_Ailk_Bjlk_HHS_BH_MT32x32x32_MI16x16x16x1_SN_1LDSB1_AMAS0_GRVW8_IU2_NLCA1_NLCB1_SIA2_SU0_SUS0_SVW1_TT1_16_VW1_WGM4
    SolutionIndex: 76
    SolutionNameMin: Cijk_Ailk_Bjlk_HHS_BH_MT32x32x32_MI16x16x16x1_SN_1LDSB0_AMAS0_GRVW8_IU1_NLCA1_NLCB1_SIA1_SU32_SUS128_SVW1_TT1_16_VW1_WGM4
    SolutionIndex: 77
    SolutionNameMin: Cijk_Ailk_Bjlk_HHS_BH_MT32x32x32_MI16x16x16x1_SN_1LDSB1_AMAS0_GRVW2_IU2_NLCA1_NLCB1_SIA2_SU32_SUS128_SVW1_TT1_16_VW1_WGM4
    SolutionIndex: 78
    SolutionNameMin: Cijk_Ailk_Bjlk_HHS_BH_MT32x32x32_MI16x16x16x1_SN_1LDSB1_AMAS0_GRVW4_IU2_NLCA1_NLCB1_SIA2_SU32_SUS128_SVW1_TT1_16_VW1_WGM4
    SolutionIndex: 79
    SolutionNameMin: Cijk_Ailk_Bjlk_HHS_BH_MT32x32x32_MI16x16x16x1_SN_1LDSB1_AMAS0_GRVW8_IU2_NLCA1_NLCB1_SIA2_SU32_SUS128_SVW1_TT1_16_VW1_WGM4
    SolutionIndex: 80
    SolutionNameMin: Cijk_Ailk_Bjlk_HHS_BH_MT32x32x32_MI16x16x16x1_SN_1LDSB0_AMAS0_GRVW4_IU1_NLCA1_NLCB1_SIA1_SU32_SUS256_SVW1_TT1_16_VW1_WGM4
    SolutionIndex: 81
    SolutionNameMin: Cijk_Ailk_Bjlk_HHS_BH_MT32x32x32_MI16x16x16x1_SN_1LDSB0_AMAS0_GRVW8_IU1_NLCA1_NLCB1_SIA1_SU32_SUS256_SVW1_TT1_16_VW1_WGM4
    SolutionIndex: 82
    SolutionNameMin: Cijk_Ailk_Bjlk_HHS_BH_MT32x32x32_MI16x16x16x1_SN_1LDSB1_AMAS0_GRVW2_IU2_NLCA1_NLCB1_SIA2_SU32_SUS256_SVW1_TT1_16_VW1_WGM4
    SolutionIndex: 83
    SolutionNameMin: Cijk_Ailk_Bjlk_HHS_BH_MT32x32x32_MI16x16x16x1_SN_1LDSB1_AMAS0_GRVW4_IU2_NLCA1_NLCB1_SIA2_SU32_SUS256_SVW1_TT1_16_VW1_WGM4
    SolutionIndex: 84
    SolutionNameMin: Cijk_Ailk_Bjlk_HHS_BH_MT32x32x32_MI16x16x16x1_SN_1LDSB1_AMAS0_GRVW8_IU2_NLCA1_NLCB1_SIA2_SU32_SUS256_SVW1_TT1_16_VW1_WGM4
    SolutionIndex: 85
    SolutionNameMin: Cijk_Ailk_Bjlk_HHS_BH_MT32x32x32_MI16x16x16x1_SN_1LDSB0_AMAS0_GRVW8_IU1_NLCA1_NLCB1_SIA3_SU32_SUS256_SVW1_TT1_16_VW1_WGM4
    SolutionIndex: 86
    SolutionNameMin: Cijk_Ailk_Bjlk_HHS_BH_MT32x32x32_MI16x16x16x1_SN_1LDSB0_AMAS0_GRVW8_IU1_NLCA1_NLCB1_SIA1_SU0_SUS0_SVW1_TT1_16_VW1_WGM8
    SolutionIndex: 87
    SolutionNameMin: Cijk_Ailk_Bjlk_HHS_BH_MT32x32x32_MI16x16x16x1_SN_1LDSB1_AMAS0_GRVW2_IU2_NLCA1_NLCB1_SIA2_SU0_SUS0_SVW1_TT1_16_VW1_WGM8
    SolutionIndex: 88
    SolutionNameMin: Cijk_Ailk_Bjlk_HHS_BH_MT32x32x32_MI16x16x16x1_SN_1LDSB1_AMAS0_GRVW4_IU2_NLCA1_NLCB1_SIA2_SU0_SUS0_SVW1_TT1_16_VW1_WGM8
    SolutionIndex: 89
    SolutionNameMin: Cijk_Ailk_Bjlk_HHS_BH_MT32x32x32_MI16x16x16x1_SN_1LDSB1_AMAS0_GRVW8_IU2_NLCA1_NLCB1_SIA2_SU0_SUS0_SVW1_TT1_16_VW1_WGM8
    SolutionIndex: 90
    SolutionNameMin: Cijk_Ailk_Bjlk_HHS_BH_MT32x32x32_MI16x16x16x1_SN_1LDSB0_AMAS0_GRVW4_IU1_NLCA1_NLCB1_SIA1_SU32_SUS128_SVW1_TT1_16_VW1_WGM8
    SolutionIndex: 91
    SolutionNameMin: Cijk_Ailk_Bjlk_HHS_BH_MT32x32x32_MI16x16x16x1_SN_1LDSB0_AMAS0_GRVW8_IU1_NLCA1_NLCB1_SIA1_SU32_SUS128_SVW1_TT1_16_VW1_WGM8
    SolutionIndex: 92
    SolutionNameMin: Cijk_Ailk_Bjlk_HHS_BH_MT32x32x32_MI16x16x16x1_SN_1LDSB1_AMAS0_GRVW2_IU2_NLCA1_NLCB1_SIA2_SU32_SUS128_SVW1_TT1_16_VW1_WGM8
    SolutionIndex: 93
    SolutionNameMin: Cijk_Ailk_Bjlk_HHS_BH_MT32x32x32_MI16x16x16x1_SN_1LDSB1_AMAS0_GRVW4_IU2_NLCA1_NLCB1_SIA2_SU32_SUS128_SVW1_TT1_16_VW1_WGM8
    SolutionIndex: 94
    SolutionNameMin: Cijk_Ailk_Bjlk_HHS_BH_MT32x32x32_MI16x16x16x1_SN_1LDSB1_AMAS0_GRVW8_IU2_NLCA1_NLCB1_SIA2_SU32_SUS128_SVW1_TT1_16_VW1_WGM8
    SolutionIndex: 95
    SolutionNameMin: Cijk_Ailk_Bjlk_HHS_BH_MT32x32x32_MI16x16x16x1_SN_1LDSB0_AMAS0_GRVW4_IU1_NLCA1_NLCB1_SIA1_SU32_SUS256_SVW1_TT1_16_VW1_WGM8
    SolutionIndex: 96
    SolutionNameMin: Cijk_Ailk_Bjlk_HHS_BH_MT32x32x32_MI16x16x16x1_SN_1LDSB1_AMAS0_GRVW4_IU2_NLCA1_NLCB1_SIA2_SU32_SUS256_SVW1_TT1_16_VW1_WGM8
    SolutionIndex: 97
    SolutionNameMin: Cijk_Ailk_Bjlk_HHS_BH_MT32x32x32_MI16x16x16x1_SN_1LDSB1_AMAS0_GRVW8_IU2_NLCA1_NLCB1_SIA2_SU32_SUS256_SVW1_TT1_16_VW1_WGM8
    SolutionIndex: 98
    SolutionNameMin: Cijk_Ailk_Bjlk_HHS_BH_MT32x32x32_MI16x16x16x1_SN_1LDSB0_AMAS0_GRVW8_IU1_NLCA1_NLCB1_SIA3_SU32_SUS256_SVW1_TT1_16_VW1_WGM8
    SolutionIndex: 99
    SolutionNameMin: Cijk_Ailk_Bjlk_HHS_BH_MT64x64x32_MI16x16x16x1_SN_1LDSB0_AMAS0_GRVW4_IU1_NLCA1_NLCB1_SIA1_SU0_SUS0_SVW1_TT2_32_VW1_WGM4
    SolutionIndex: 100
    SolutionNameMin: Cijk_Ailk_Bjlk_HHS_BH_MT64x64x32_MI16x16x16x1_SN_1LDSB0_AMAS3_GRVW4_IU1_NLCA1_NLCB1_SIA1_SU0_SUS0_SVW2_TT2_32_VW2_WGM4
    SolutionIndex: 101
    SolutionNameMin: Cijk_Ailk_Bjlk_HHS_BH_MT64x64x32_MI16x16x16x1_SN_1LDSB0_AMAS3_GRVW8_IU1_NLCA1_NLCB1_SIA1_SU0_SUS0_SVW2_TT2_32_VW2_WGM4
    SolutionIndex: 102
    SolutionNameMin: Cijk_Ailk_Bjlk_HHS_BH_MT64x64x32_MI16x16x16x1_SN_1LDSB1_AMAS0_GRVW4_IU2_NLCA1_NLCB1_SIA2_SU0_SUS0_SVW1_TT2_32_VW1_WGM4
    SolutionIndex: 103
    SolutionNameMin: Cijk_Ailk_Bjlk_HHS_BH_MT64x64x32_MI16x16x16x1_SN_1LDSB1_AMAS3_GRVW4_IU2_NLCA1_NLCB1_SIA2_SU0_SUS0_SVW2_TT2_32_VW2_WGM4
    SolutionIndex: 104
    SolutionNameMin: Cijk_Ailk_Bjlk_HHS_BH_MT64x64x32_MI16x16x16x1_SN_1LDSB1_AMAS0_GRVW8_IU2_NLCA1_NLCB1_SIA2_SU0_SUS0_SVW1_TT2_32_VW1_WGM4
    SolutionIndex: 105
    SolutionNameMin: Cijk_Ailk_Bjlk_HHS_BH_MT64x64x32_MI16x16x16x1_SN_1LDSB1_AMAS3_GRVW8_IU2_NLCA1_NLCB1_SIA2_SU0_SUS0_SVW2_TT2_32_VW2_WGM4
    SolutionIndex: 106
    SolutionNameMin: Cijk_Ailk_Bjlk_HHS_BH_MT64x64x32_MI16x16x16x1_SN_1LDSB0_AMAS0_GRVW4_IU1_NLCA1_NLCB1_SIA3_SU0_SUS0_SVW1_TT2_32_VW1_WGM4
    SolutionIndex: 107
    SolutionNameMin: Cijk_Ailk_Bjlk_HHS_BH_MT64x64x32_MI16x16x16x1_SN_1LDSB0_AMAS3_GRVW4_IU1_NLCA1_NLCB1_SIA3_SU0_SUS0_SVW2_TT2_32_VW2_WGM4
    SolutionIndex: 108
    SolutionNameMin: Cijk_Ailk_Bjlk_HHS_BH_MT64x64x32_MI16x16x16x1_SN_1LDSB0_AMAS0_GRVW8_IU1_NLCA1_NLCB1_SIA3_SU0_SUS0_SVW1_TT2_32_VW1_WGM4
    SolutionIndex: 109
    SolutionNameMin: Cijk_Ailk_Bjlk_HHS_BH_MT64x64x32_MI16x16x16x1_SN_1LDSB0_AMAS3_GRVW8_IU1_NLCA1_NLCB1_SIA3_SU0_SUS0_SVW2_TT2_32_VW2_WGM4
    SolutionIndex: 110
    SolutionNameMin: Cijk_Ailk_Bjlk_HHS_BH_MT64x64x32_MI16x16x16x1_SN_1LDSB0_AMAS3_GRVW8_IU1_NLCA1_NLCB1_SIA1_SU32_SUS128_SVW2_TT2_32_VW2_WGM4
    SolutionIndex: 111
    SolutionNameMin: Cijk_Ailk_Bjlk_HHS_BH_MT64x64x32_MI16x16x16x1_SN_1LDSB1_AMAS0_GRVW4_IU2_NLCA1_NLCB1_SIA2_SU32_SUS128_SVW1_TT2_32_VW1_WGM4
    SolutionIndex: 112
    SolutionNameMin: Cijk_Ailk_Bjlk_HHS_BH_MT64x64x32_MI16x16x16x1_SN_1LDSB1_AMAS3_GRVW4_IU2_NLCA1_NLCB1_SIA2_SU32_SUS128_SVW2_TT2_32_VW2_WGM4
    SolutionIndex: 113
    SolutionNameMin: Cijk_Ailk_Bjlk_HHS_BH_MT64x64x32_MI16x16x16x1_SN_1LDSB1_AMAS3_GRVW8_IU2_NLCA1_NLCB1_SIA2_SU32_SUS128_SVW2_TT2_32_VW2_WGM4
    SolutionIndex: 114
    SolutionNameMin: Cijk_Ailk_Bjlk_HHS_BH_MT64x64x32_MI16x16x16x1_SN_1LDSB0_AMAS3_GRVW8_IU1_NLCA1_NLCB1_SIA3_SU32_SUS128_SVW2_TT2_32_VW2_WGM4
    SolutionIndex: 115
    SolutionNameMin: Cijk_Ailk_Bjlk_HHS_BH_MT64x64x32_MI16x16x16x1_SN_1LDSB0_AMAS3_GRVW8_IU1_NLCA1_NLCB1_SIA1_SU32_SUS256_SVW2_TT2_32_VW2_WGM4
    SolutionIndex: 116
    SolutionNameMin: Cijk_Ailk_Bjlk_HHS_BH_MT64x64x32_MI16x16x16x1_SN_1LDSB1_AMAS0_GRVW4_IU2_NLCA1_NLCB1_SIA2_SU32_SUS256_SVW1_TT2_32_VW1_WGM4
    SolutionIndex: 117
    SolutionNameMin: Cijk_Ailk_Bjlk_HHS_BH_MT64x64x32_MI16x16x16x1_SN_1LDSB1_AMAS3_GRVW4_IU2_NLCA1_NLCB1_SIA2_SU32_SUS256_SVW2_TT2_32_VW2_WGM4
    SolutionIndex: 118
    SolutionNameMin: Cijk_Ailk_Bjlk_HHS_BH_MT64x64x32_MI16x16x16x1_SN_1LDSB1_AMAS3_GRVW8_IU2_NLCA1_NLCB1_SIA2_SU32_SUS256_SVW2_TT2_32_VW2_WGM4
    SolutionIndex: 119
    SolutionNameMin: Cijk_Ailk_Bjlk_HHS_BH_MT64x64x32_MI16x16x16x1_SN_1LDSB0_AMAS3_GRVW8_IU1_NLCA1_NLCB1_SIA3_SU32_SUS256_SVW2_TT2_32_VW2_WGM4
    SolutionIndex: 120
    SolutionNameMin: Cijk_Ailk_Bjlk_HHS_BH_MT64x64x32_MI16x16x16x1_SN_1LDSB0_AMAS0_GRVW8_IU1_NLCA1_NLCB1_SIA1_SU0_SUS0_SVW1_TT2_32_VW1_WGM8
    SolutionIndex: 121
    SolutionNameMin: Cijk_Ailk_Bjlk_HHS_BH_MT64x64x32_MI16x16x16x1_SN_1LDSB0_AMAS3_GRVW8_IU1_NLCA1_NLCB1_SIA1_SU0_SUS0_SVW2_TT2_32_VW2_WGM8
    SolutionIndex: 122
    SolutionNameMin: Cijk_Ailk_Bjlk_HHS_BH_MT64x64x32_MI16x16x16x1_SN_1LDSB1_AMAS0_GRVW4_IU2_NLCA1_NLCB1_SIA2_SU0_SUS0_SVW1_TT2_32_VW1_WGM8
    SolutionIndex: 123
    SolutionNameMin: Cijk_Ailk_Bjlk_HHS_BH_MT64x64x32_MI16x16x16x1_SN_1LDSB1_AMAS3_GRVW4_IU2_NLCA1_NLCB1_SIA2_SU0_SUS0_SVW2_TT2_32_VW2_WGM8
    SolutionIndex: 124
    SolutionNameMin: Cijk_Ailk_Bjlk_HHS_BH_MT64x64x32_MI16x16x16x1_SN_1LDSB1_AMAS3_GRVW8_IU2_NLCA1_NLCB1_SIA2_SU0_SUS0_SVW2_TT2_32_VW2_WGM8
    SolutionIndex: 125
    SolutionNameMin: Cijk_Ailk_Bjlk_HHS_BH_MT64x64x32_MI16x16x16x1_SN_1LDSB0_AMAS3_GRVW4_IU1_NLCA1_NLCB1_SIA3_SU0_SUS0_SVW2_TT2_32_VW2_WGM8
    SolutionIndex: 126
    SolutionNameMin: Cijk_Ailk_Bjlk_HHS_BH_MT64x64x32_MI16x16x16x1_SN_1LDSB0_AMAS3_GRVW8_IU1_NLCA1_NLCB1_SIA3_SU0_SUS0_SVW2_TT2_32_VW2_WGM8
    SolutionIndex: 127
    SolutionNameMin: Cijk_Ailk_Bjlk_HHS_BH_MT64x64x32_MI16x16x16x1_SN_1LDSB0_AMAS0_GRVW4_IU1_NLCA1_NLCB1_SIA1_SU32_SUS128_SVW1_TT2_32_VW1_WGM8
    SolutionIndex: 128
    SolutionNameMin: Cijk_Ailk_Bjlk_HHS_BH_MT64x64x32_MI16x16x16x1_SN_1LDSB0_AMAS3_GRVW8_IU1_NLCA1_NLCB1_SIA1_SU32_SUS128_SVW2_TT2_32_VW2_WGM8
    SolutionIndex: 129
    SolutionNameMin: Cijk_Ailk_Bjlk_HHS_BH_MT64x64x32_MI16x16x16x1_SN_1LDSB1_AMAS0_GRVW4_IU2_NLCA1_NLCB1_SIA2_SU32_SUS128_SVW1_TT2_32_VW1_WGM8
    SolutionIndex: 130
    SolutionNameMin: Cijk_Ailk_Bjlk_HHS_BH_MT64x64x32_MI16x16x16x1_SN_1LDSB1_AMAS3_GRVW4_IU2_NLCA1_NLCB1_SIA2_SU32_SUS128_SVW2_TT2_32_VW2_WGM8
    SolutionIndex: 131
    SolutionNameMin: Cijk_Ailk_Bjlk_HHS_BH_MT64x64x32_MI16x16x16x1_SN_1LDSB1_AMAS0_GRVW8_IU2_NLCA1_NLCB1_SIA2_SU32_SUS128_SVW1_TT2_32_VW1_WGM8
    SolutionIndex: 132
    SolutionNameMin: Cijk_Ailk_Bjlk_HHS_BH_MT64x64x32_MI16x16x16x1_SN_1LDSB1_AMAS3_GRVW8_IU2_NLCA1_NLCB1_SIA2_SU32_SUS128_SVW2_TT2_32_VW2_WGM8
    SolutionIndex: 133
    SolutionNameMin: Cijk_Ailk_Bjlk_HHS_BH_MT64x64x32_MI16x16x16x1_SN_1LDSB0_AMAS3_GRVW8_IU1_NLCA1_NLCB1_SIA3_SU32_SUS128_SVW2_TT2_32_VW2_WGM8
    SolutionIndex: 134
    SolutionNameMin: Cijk_Ailk_Bjlk_HHS_BH_MT64x64x32_MI16x16x16x1_SN_1LDSB0_AMAS3_GRVW8_IU1_NLCA1_NLCB1_SIA1_SU32_SUS256_SVW2_TT2_32_VW2_WGM8
    SolutionIndex: 135
    SolutionNameMin: Cijk_Ailk_Bjlk_HHS_BH_MT64x64x32_MI16x16x16x1_SN_1LDSB1_AMAS3_GRVW4_IU2_NLCA1_NLCB1_SIA2_SU32_SUS256_SVW2_TT2_32_VW2_WGM8
    SolutionIndex: 136
    SolutionNameMin: Cijk_Ailk_Bjlk_HHS_BH_MT64x64x32_MI16x16x16x1_SN_1LDSB1_AMAS3_GRVW8_IU2_NLCA1_NLCB1_SIA2_SU32_SUS256_SVW2_TT2_32_VW2_WGM8
    SolutionIndex: 137
    SolutionNameMin: Cijk_Ailk_Bjlk_HHS_BH_MT64x64x32_MI16x16x16x1_SN_1LDSB0_AMAS3_GRVW4_IU1_NLCA1_NLCB1_SIA3_SU32_SUS256_SVW2_TT2_32_VW2_WGM8
    SolutionIndex: 138
    SolutionNameMin: Cijk_Ailk_Bjlk_HHS_BH_MT64x64x32_MI16x16x16x1_SN_1LDSB0_AMAS3_GRVW8_IU1_NLCA1_NLCB1_SIA3_SU32_SUS256_SVW2_TT2_32_VW2_WGM8
- - - [64, 64, 1, 64, 96, 96, 96, 96]
    - [0, 0.041]
  - - [64, 64, 1, 128, 96, 96, 160, 160]
    - [75, 0.08]
  - - [64, 64, 1, 256, 96, 96, 288, 288]
    - [89, 0.151]
  - - [64, 64, 1, 512, 96, 96, 544, 544]
    - [75, 0.264]
  - - [64, 64, 1, 1024, 96, 96, 1056, 1056]
    - [82, 0.331]
  - - [64, 64, 1, 2048, 96, 96, 2080, 2080]
    - [74, 0.621]
  - - [64, 64, 1, 4096, 96, 96, 4128, 4128]
    - [88, 0.802]
  - - [64, 64, 1, 8192, 96, 96, 8224, 8224]
    - [79, 0.933]
  - - [64, 128, 1, 64, 96, 96, 96, 128]
    - [1, 0.084]
  - - [64, 128, 1, 128, 96, 96, 160, 160]
    - [128, 0.132]
  - - [64, 128, 1, 256, 96, 96, 288, 288]
    - [75, 0.306]
  - - [64, 128, 1, 512, 96, 96, 544, 544]
    - [89, 0.545]
  - - [64, 128, 1, 1024, 96, 96, 1056, 1056]
    - [97, 0.876]
  - - [64, 128, 1, 2048, 96, 96, 2080, 2080]
    - [74, 1.263]
  - - [64, 128, 1, 4096, 96, 96, 4128, 4128]
    - [87, 1.622]
  - - [64, 128, 1, 8192, 96, 96, 8224, 8224]
    - [82, 1.864]
  - - [64, 256, 1, 64, 96, 96, 96, 256]
    - [79, 0.173]
  - - [64, 256, 1, 128, 96, 96, 160, 256]
    - [97, 0.331]
  - - [64, 256, 1, 256, 96, 96, 288, 288]
    - [93, 0.622]
  - - [64, 256, 1, 512, 96, 96, 544, 544]
    - [89, 1.107]
  - - [64, 256, 1, 1024, 96, 96, 1056, 1056]
    - [93, 1.772]
  - - [64, 256, 1, 2048, 96, 96, 2080, 2080]
    - [88, 2.542]
  - - [64, 256, 1, 4096, 96, 96, 4128, 4128]
    - [93, 3.253]
  - - [64, 256, 1, 8192, 96, 96, 8224, 8224]
    - [88, 3.743]
  - - [64, 512, 1, 64, 96, 96, 96, 512]
    - [75, 0.35]
  - - [64, 512, 1, 128, 96, 96, 160, 512]
    - [94, 0.68]
  - - [64, 512, 1, 256, 96, 96, 288, 512]
    - [93, 1.245]
  - - [64, 512, 1, 512, 96, 96, 544, 544]
    - [97, 2.195]
  - - [64, 512, 1, 1024, 96, 96, 1056, 1056]
    - [73, 3.562]
  - - [64, 512, 1, 2048, 96, 96, 2080, 2080]
    - [92, 5.093]
  - - [64, 512, 1, 4096, 96, 96, 4128, 4128]
    - [88, 6.516]
  - - [64, 512, 1, 8192, 96, 96, 8224, 8224]
    - [77, 7.507]
  - - [64, 1024, 1, 64, 96, 96, 96, 1024]
    - [89, 0.694]
  - - [64, 1024, 1, 128, 96, 96, 160, 1024]
    - [91, 1.312]
  - - [64, 1024, 1, 256, 96, 96, 288, 1024]
    - [79, 2.386]
  - - [64, 1024, 1, 512, 96, 96, 544, 1024]
    - [79, 4.028]
  - - [64, 1024, 1, 1024, 96, 96, 1056, 1056]
    - [88, 6.185]
  - - [64, 1024, 1, 2048, 96, 96, 2080, 2080]
    - [88, 8.383]
  - - [64, 1024, 1, 4096, 96, 96, 4128, 4128]
    - [93, 10.162]
  - - [64, 1024, 1, 8192, 96, 96, 8224, 8224]
    - [74, 11.282]
  - - [64, 2048, 1, 64, 96, 96, 96, 2048]
    - [76, 1.36]
  - - [64, 2048, 1, 128, 96, 96, 160, 2048]
    - [88, 2.514]
  - - [64, 2048, 1, 256, 96, 96, 288, 2048]
    - [97, 4.39]
  - - [64, 2048, 1, 512, 96, 96, 544, 2048]
    - [113, 7.125]
  - - [64, 2048, 1, 1024, 96, 96, 1056, 2048]
    - [105, 10.305]
  - - [64, 2048, 1, 2048, 96, 96, 2080, 2080]
    - [124, 13.22]
  - - [64, 2048, 1, 4096, 96, 96, 4128, 4128]
    - [113, 15.366]
  - - [64, 2048, 1, 8192, 96, 96, 8224, 8224]
    - [105, 16.696]
  - - [64, 4096, 1, 64, 96, 96, 96, 4096]
    - [5, 2.56]
  - - [64, 4096, 1, 128, 96, 96, 160, 4096]
    - [126, 4.659]
  - - [64, 4096, 1, 256, 96, 96, 288, 4096]
    - [105, 7.987]
  - - [64, 4096, 1, 512, 96, 96, 544, 4096]
    - [118, 12.365]
  - - [64, 4096, 1, 1024, 96, 96, 1056, 4096]
    - [136, 16.991]
  - - [64, 4096, 1, 2048, 96, 96, 2080, 4096]
    - [130, 20.959]
  - - [64, 4096, 1, 4096, 96, 96, 4128, 4128]
    - [102, 23.384]
  - - [64, 4096, 1, 8192, 96, 96, 8224, 8224]
    - [124, 22.7]
  - - [64, 8192, 1, 64, 96, 96, 96, 8192]
    - [118, 4.907]
  - - [64, 8192, 1, 128, 96, 96, 160, 8192]
    - [118, 8.739]
  - - [64, 8192, 1, 256, 96, 96, 288, 8192]
    - [113, 14.057]
  - - [64, 8192, 1, 512, 96, 96, 544, 8192]
    - [105, 20.513]
  - - [64, 8192, 1, 1024, 96, 96, 1056, 8192]
    - [112, 26.492]
  - - [64, 8192, 1, 2048, 96, 96, 2080, 8192]
    - [102, 30.919]
  - - [64, 8192, 1, 4096, 96, 96, 4128, 8192]
    - [102, 33.772]
  - - [64, 8192, 1, 8192, 96, 96, 8224, 8224]
    - [117, 34.345]
  - - [128, 64, 1, 64, 160, 160, 128, 96]
    - [2, 0.086]
  - - [128, 64, 1, 128, 160, 160, 160, 160]
    - [79, 0.164]
  - - [128, 64, 1, 256, 160, 160, 288, 288]
    - [79, 0.309]
  - - [128, 64, 1, 512, 160, 160, 544, 544]
    - [79, 0.541]
  - - [128, 64, 1, 1024, 160, 160, 1056, 1056]
    - [74, 0.882]
  - - [128, 64, 1, 2048, 160, 160, 2080, 2080]
    - [73, 1.27]
  - - [128, 64, 1, 4096, 160, 160, 4128, 4128]
    - [78, 1.629]
  - - [128, 64, 1, 8192, 160, 160, 8224, 8224]
    - [78, 1.893]
  - - [128, 128, 1, 64, 160, 160, 128, 128]
    - [89, 0.174]
  - - [128, 128, 1, 128, 160, 160, 160, 160]
    - [94, 0.334]
  - - [128, 128, 1, 256, 160, 160, 288, 288]
    - [78, 0.627]
  - - [128, 128, 1, 512, 160, 160, 544, 544]
    - [79, 1.104]
  - - [128, 128, 1, 1024, 160, 160, 1056, 1056]
    - [89, 1.513]
  - - [128, 128, 1, 2048, 160, 160, 2080, 2080]
    - [87, 2.55]
  - - [128, 128, 1, 4096, 160, 160, 4128, 4128]
    - [77, 3.272]
  - - [128, 128, 1, 8192, 160, 160, 8224, 8224]
    - [74, 3.811]
  - - [128, 256, 1, 64, 160, 160, 128, 256]
    - [75, 0.352]
  - - [128, 256, 1, 128, 160, 160, 160, 256]
    - [93, 0.67]
  - - [128, 256, 1, 256, 160, 160, 288, 288]
    - [73, 1.26]
  - - [128, 256, 1, 512, 160, 160, 544, 544]
    - [83, 2.216]
  - - [128, 256, 1, 1024, 160, 160, 1056, 1056]
    - [83, 3.576]
  - - [128, 256, 1, 2048, 160, 160, 2080, 2080]
    - [88, 5.108]
  - - [128, 256, 1, 4096, 160, 160, 4128, 4128]
    - [93, 6.516]
  - - [128, 256, 1, 8192, 160, 160, 8224, 8224]
    - [88, 7.435]
  - - [128, 512, 1, 64, 160, 160, 128, 512]
    - [72, 0.69]
  - - [128, 512, 1, 128, 160, 160, 160, 512]
    - [90, 1.306]
  - - [128, 512, 1, 256, 160, 160, 288, 512]
    - [75, 2.376]
  - - [128, 512, 1, 512, 160, 160, 544, 544]
    - [74, 4.032]
  - - [128, 512, 1, 1024, 160, 160, 1056, 1056]
    - [83, 6.124]
  - - [128, 512, 1, 2048, 160, 160, 2080, 2080]
    - [74, 8.345]
  - - [128, 512, 1, 4096, 160, 160, 4128, 4128]
    - [74, 10.146]
  - - [128, 512, 1, 8192, 160, 160, 8224, 8224]
    - [74, 11.203]
  - - [128, 1024, 1, 64, 160, 160, 128, 1024]
    - [86, 1.344]
  - - [128, 1024, 1, 128, 160, 160, 160, 1024]
    - [81, 2.523]
  - - [128, 1024, 1, 256, 160, 160, 288, 1024]
    - [97, 4.415]
  - - [128, 1024, 1, 512, 160, 160, 544, 1024]
    - [124, 7.094]
  - - [128, 1024, 1, 1024, 160, 160, 1056, 1056]
    - [105, 10.285]
  - - [128, 1024, 1, 2048, 160, 160, 2080, 2080]
    - [136, 13.187]
  - - [128, 1024, 1, 4096, 160, 160, 4128, 4128]
    - [130, 15.072]
  - - [128, 1024, 1, 8192, 160, 160, 8224, 8224]
    - [105, 16.738]
  - - [128, 2048, 1, 64, 160, 160, 128, 2048]
    - [10, 2.57]
  - - [128, 2048, 1, 128, 160, 160, 160, 2048]
    - [6, 4.652]
  - - [128, 2048, 1, 256, 160, 160, 288, 2048]
    - [124, 7.964]
  - - [128, 2048, 1, 512, 160, 160, 544, 2048]
    - [124, 12.44]
  - - [128, 2048, 1, 1024, 160, 160, 1056, 2048]
    - [103, 17.036]
  - - [128, 2048, 1, 2048, 160, 160, 2080, 2080]
    - [123, 21.088]
  - - [128, 2048, 1, 4096, 160, 160, 4128, 4128]
    - [129, 23.409]
  - - [128, 2048, 1, 8192, 160, 160, 8224, 8224]
    - [103, 24.557]
  - - [128, 4096, 1, 64, 160, 160, 128, 4096]
    - [109, 4.928]
  - - [128, 4096, 1, 128, 160, 160, 160, 4096]
    - [109, 8.728]
  - - [128, 4096, 1, 256, 160, 160, 288, 4096]
    - [124, 14.204]
  - - [128, 4096, 1, 512, 160, 160, 544, 4096]
    - [124, 20.528]
  - - [128, 4096, 1, 1024, 160, 160, 1056, 4096]
    - [123, 26.675]
  - - [128, 4096, 1, 2048, 160, 160, 2080, 4096]
    - [116, 31.147]
  - - [128, 4096, 1, 4096, 160, 160, 4128, 4128]
    - [113, 34.053]
  - - [128, 4096, 1, 8192, 160, 160, 8224, 8224]
    - [131, 33.47]
  - - [128, 8192, 1, 64, 160, 160, 128, 8192]
    - [114, 8.475]
  - - [128, 8192, 1, 128, 160, 160, 160, 8192]
    - [32, 14.544]
  - - [128, 8192, 1, 256, 160, 160, 288, 8192]
    - [56, 22.831]
  - - [128, 8192, 1, 512, 160, 160, 544, 8192]
    - [56, 32.041]
  - - [128, 8192, 1, 1024, 160, 160, 1056, 8192]
    - [44, 39.625]
  - - [128, 8192, 1, 2048, 160, 160, 2080, 8192]
    - [32, 44.914]
  - - [128, 8192, 1, 4096, 160, 160, 4128, 8192]
    - [62, 46.933]
  - - [128, 8192, 1, 8192, 160, 160, 8224, 8224]
    - [41, 48.208]
  - - [256, 64, 1, 64, 288, 288, 256, 96]
    - [3, 0.175]
  - - [256, 64, 1, 128, 288, 288, 256, 160]
    - [74, 0.332]
  - - [256, 64, 1, 256, 288, 288, 288, 288]
    - [75, 0.626]
  - - [256, 64, 1, 512, 288, 288, 544, 544]
    - [94, 1.105]
  - - [256, 64, 1, 1024, 288, 288, 1056, 1056]
    - [89, 1.782]
  - - [256, 64, 1, 2048, 288, 288, 2080, 2080]
    - [93, 2.56]
  - - [256, 64, 1, 4096, 288, 288, 4128, 4128]
    - [78, 3.271]
  - - [256, 64, 1, 8192, 288, 288, 8224, 8224]
    - [77, 3.8]
  - - [256, 128, 1, 64, 288, 288, 256, 128]
    - [74, 0.352]
  - - [256, 128, 1, 128, 288, 288, 256, 160]
    - [89, 0.681]
  - - [256, 128, 1, 256, 288, 288, 288, 288]
    - [83, 1.258]
  - - [256, 128, 1, 512, 288, 288, 544, 544]
    - [74, 2.208]
  - - [256, 128, 1, 1024, 288, 288, 1056, 1056]
    - [77, 2.919]
  - - [256, 128, 1, 2048, 288, 288, 2080, 2080]
    - [75, 4.939]
  - - [256, 128, 1, 4096, 288, 288, 4128, 4128]
    - [83, 6.563]
  - - [256, 128, 1, 8192, 288, 288, 8224, 8224]
    - [88, 7.605]
  - - [256, 256, 1, 64, 288, 288, 256, 256]
    - [75, 0.695]
  - - [256, 256, 1, 128, 288, 288, 256, 256]
    - [89, 1.311]
  - - [256, 256, 1, 256, 288, 288, 288, 288]
    - [75, 2.397]
  - - [256, 256, 1, 512, 288, 288, 544, 544]
    - [89, 4.052]
  - - [256, 256, 1, 1024, 288, 288, 1056, 1056]
    - [88, 6.182]
  - - [256, 256, 1, 2048, 288, 288, 2080, 2080]
    - [88, 8.325]
  - - [256, 256, 1, 4096, 288, 288, 4128, 4128]
    - [74, 10.099]
  - - [256, 256, 1, 8192, 288, 288, 8224, 8224]
    - [88, 11.185]
  - - [256, 512, 1, 64, 288, 288, 256, 512]
    - [85, 1.345]
  - - [256, 512, 1, 128, 288, 288, 256, 512]
    - [86, 2.524]
  - - [256, 512, 1, 256, 288, 288, 288, 512]
    - [95, 4.41]
  - - [256, 512, 1, 512, 288, 288, 544, 544]
    - [105, 7.106]
  - - [256, 512, 1, 1024, 288, 288, 1056, 1056]
    - [105, 10.255]
  - - [256, 512, 1, 2048, 288, 288, 2080, 2080]
    - [132, 13.171]
  - - [256, 512, 1, 4096, 288, 288, 4128, 4128]
    - [104, 15.215]
  - - [256, 512, 1, 8192, 288, 288, 8224, 8224]
    - [105, 16.682]
  - - [256, 1024, 1, 64, 288, 288, 256, 1024]
    - [16, 2.573]
  - - [256, 1024, 1, 128, 288, 288, 256, 1024]
    - [101, 4.701]
  - - [256, 1024, 1, 256, 288, 288, 288, 1024]
    - [15, 7.953]
  - - [256, 1024, 1, 512, 288, 288, 544, 1024]
    - [121, 12.407]
  - - [256, 1024, 1, 1024, 288, 288, 1056, 1056]
    - [124, 17.01]
  - - [256, 1024, 1, 2048, 288, 288, 2080, 2080]
    - [130, 20.959]
  - - [256, 1024, 1, 4096, 288, 288, 4128, 4128]
    - [123, 23.25]
  - - [256, 1024, 1, 8192, 288, 288, 8224, 8224]
    - [135, 24.522]
  - - [256, 2048, 1, 64, 288, 288, 256, 2048]
    - [7, 4.919]
  - - [256, 2048, 1, 128, 288, 288, 256, 2048]
    - [126, 8.701]
  - - [256, 2048, 1, 256, 288, 288, 288, 2048]
    - [121, 14.157]
  - - [256, 2048, 1, 512, 288, 288, 544, 2048]
    - [122, 20.366]
  - - [256, 2048, 1, 1024, 288, 288, 1056, 2048]
    - [103, 26.681]
  - - [256, 2048, 1, 2048, 288, 288, 2080, 2080]
    - [99, 31.012]
  - - [256, 2048, 1, 4096, 288, 288, 4128, 4128]
    - [101, 34.3]
  - - [256, 2048, 1, 8192, 288, 288, 8224, 8224]
    - [120, 34.862]
  - - [256, 4096, 1, 64, 288, 288, 256, 4096]
    - [56, 8.434]
  - - [256, 4096, 1, 128, 288, 288, 256, 4096]
    - [8, 13.92]
  - - [256, 4096, 1, 256, 288, 288, 288, 4096]
    - [56, 22.881]
  - - [256, 4096, 1, 512, 288, 288, 544, 4096]
    - [27, 32.02]
  - - [256, 4096, 1, 1024, 288, 288, 1056, 4096]
    - [56, 39.222]
  - - [256, 4096, 1, 2048, 288, 288, 2080, 4096]
    - [42, 44.693]
  - - [256, 4096, 1, 4096, 288, 288, 4128, 4128]
    - [32, 47.064]
  - - [256, 4096, 1, 8192, 288, 288, 8224, 8224]
    - [67, 38.002]
  - - [256, 8192, 1, 64, 288, 288, 256, 8192]
    - [50, 14.306]
  - - [256, 8192, 1, 128, 288, 288, 256, 8192]
    - [61, 23.502]
  - - [256, 8192, 1, 256, 288, 288, 288, 8192]
    - [24, 35.284]
  - - [256, 8192, 1, 512, 288, 288, 544, 8192]
    - [34, 47.536]
  - - [256, 8192, 1, 1024, 288, 288, 1056, 8192]
    - [63, 56.109]
  - - [256, 8192, 1, 2048, 288, 288, 2080, 8192]
    - [56, 57.247]
  - - [256, 8192, 1, 4096, 288, 288, 4128, 8192]
    - [43, 61.122]
  - - [256, 8192, 1, 8192, 288, 288, 8224, 8224]
    - [71, 61.93]
  - - [384, 64, 1, 64, 416, 416, 384, 96]
    - [1, 0.265]
  - - [384, 64, 1, 128, 416, 416, 384, 160]
    - [74, 0.507]
  - - [384, 64, 1, 256, 416, 416, 384, 288]
    - [83, 0.949]
  - - [384, 64, 1, 512, 416, 416, 544, 544]
    - [83, 1.656]
  - - [384, 64, 1, 1024, 416, 416, 1056, 1056]
    - [96, 2.68]
  - - [384, 64, 1, 2048, 416, 416, 2080, 2080]
    - [93, 3.85]
  - - [384, 64, 1, 4096, 416, 416, 4128, 4128]
    - [83, 4.914]
  - - [384, 64, 1, 8192, 416, 416, 8224, 8224]
    - [77, 5.65]
  - - [384, 128, 1, 64, 416, 416, 384, 128]
    - [84, 0.53]
  - - [384, 128, 1, 128, 416, 416, 384, 160]
    - [89, 1.015]
  - - [384, 128, 1, 256, 416, 416, 384, 288]
    - [94, 1.889]
  - - [384, 128, 1, 512, 416, 416, 544, 544]
    - [89, 3.324]
  - - [384, 128, 1, 1024, 416, 416, 1056, 1056]
    - [94, 5.363]
  - - [384, 128, 1, 2048, 416, 416, 2080, 2080]
    - [88, 7.688]
  - - [384, 128, 1, 4096, 416, 416, 4128, 4128]
    - [96, 9.772]
  - - [384, 128, 1, 8192, 416, 416, 8224, 8224]
    - [74, 11.373]
  - - [384, 256, 1, 64, 416, 416, 384, 256]
    - [79, 1.038]
  - - [384, 256, 1, 128, 416, 416, 384, 256]
    - [75, 1.928]
  - - [384, 256, 1, 256, 416, 416, 384, 288]
    - [96, 3.527]
  - - [384, 256, 1, 512, 416, 416, 544, 544]
    - [75, 6.004]
  - - [384, 256, 1, 1024, 416, 416, 1056, 1056]
    - [94, 9.11]
  - - [384, 256, 1, 2048, 416, 416, 2080, 2080]
    - [88, 12.392]
  - - [384, 256, 1, 4096, 416, 416, 4128, 4128]
    - [97, 14.945]
  - - [384, 256, 1, 8192, 416, 416, 8224, 8224]
    - [78, 16.677]
  - - [384, 512, 1, 64, 416, 416, 384, 512]
    - [123, 1.993]
  - - [384, 512, 1, 128, 416, 416, 384, 512]
    - [124, 3.746]
  - - [384, 512, 1, 256, 416, 416, 384, 512]
    - [103, 6.583]
  - - [384, 512, 1, 512, 416, 416, 544, 544]
    - [105, 10.596]
  - - [384, 512, 1, 1024, 416, 416, 1056, 1056]
    - [103, 15.308]
  - - [384, 512, 1, 2048, 416, 416, 2080, 2080]
    - [132, 19.66]
  - - [384, 512, 1, 4096, 416, 416, 4128, 4128]
    - [123, 22.773]
  - - [384, 512, 1, 8192, 416, 416, 8224, 8224]
    - [105, 24.696]
  - - [384, 1024, 1, 64, 416, 416, 384, 1024]
    - [105, 3.855]
  - - [384, 1024, 1, 128, 416, 416, 384, 1024]
    - [14, 7.02]
  - - [384, 1024, 1, 256, 416, 416, 384, 1024]
    - [101, 11.978]
  - - [384, 1024, 1, 512, 416, 416, 544, 1024]
    - [105, 18.452]
  - - [384, 1024, 1, 1024, 416, 416, 1056, 1056]
    - [123, 25.315]
  - - [384, 1024, 1, 2048, 416, 416, 2080, 2080]
    - [113, 31.14]
  - - [384, 1024, 1, 4096, 416, 416, 4128, 4128]
    - [103, 34.781]
  - - [384, 1024, 1, 8192, 416, 416, 8224, 8224]
    - [102, 36.447]
  - - [384, 2048, 1, 64, 416, 416, 384, 2048]
    - [114, 6.98]
  - - [384, 2048, 1, 128, 416, 416, 384, 2048]
    - [133, 12.017]
  - - [384, 2048, 1, 256, 416, 416, 384, 2048]
    - [126, 18.98]
  - - [384, 2048, 1, 512, 416, 416, 544, 2048]
    - [133, 26.645]
  - - [384, 2048, 1, 1024, 416, 416, 1056, 2048]
    - [121, 33.063]
  - - [384, 2048, 1, 2048, 416, 416, 2080, 2080]
    - [121, 37.385]
  - - [384, 2048, 1, 4096, 416, 416, 4128, 4128]
    - [108, 38.897]
  - - [384, 2048, 1, 8192, 416, 416, 8224, 8224]
    - [128, 40.669]
  - - [384, 4096, 1, 64, 416, 416, 384, 4096]
    - [55, 11.776]
  - - [384, 4096, 1, 128, 416, 416, 384, 4096]
    - [71, 20.566]
  - - [384, 4096, 1, 256, 416, 416, 384, 4096]
    - [56, 32.85]
  - - [384, 4096, 1, 512, 416, 416, 544, 4096]
    - [42, 46.198]
  - - [384, 4096, 1, 1024, 416, 416, 1056, 4096]
    - [32, 58.33]
  - - [384, 4096, 1, 2048, 416, 416, 2080, 4096]
    - [62, 65.413]
  - - [384, 4096, 1, 4096, 416, 416, 4128, 4128]
    - [63, 68.605]
  - - [384, 4096, 1, 8192, 416, 416, 8224, 8224]
    - [33, 49.719]
  - - [384, 8192, 1, 64, 416, 416, 384, 8192]
    - [23, 20.304]
  - - [384, 8192, 1, 128, 416, 416, 384, 8192]
    - [53, 32.553]
  - - [384, 8192, 1, 256, 416, 416, 384, 8192]
    - [56, 47.357]
  - - [384, 8192, 1, 512, 416, 416, 544, 8192]
    - [56, 61.493]
  - - [384, 8192, 1, 1024, 416, 416, 1056, 8192]
    - [55, 71.334]
  - - [384, 8192, 1, 2048, 416, 416, 2080, 8192]
    - [70, 73.622]
  - - [384, 8192, 1, 4096, 416, 416, 4128, 8192]
    - [27, 78.251]
  - - [384, 8192, 1, 8192, 416, 416, 8224, 8224]
    - [65, 64.241]
  - - [768, 64, 1, 64, 800, 800, 768, 96]
    - [4, 0.509]
  - - [768, 64, 1, 128, 800, 800, 768, 160]
    - [74, 1.017]
  - - [768, 64, 1, 256, 800, 800, 768, 288]
    - [96, 1.89]
  - - [768, 64, 1, 512, 800, 800, 768, 544]
    - [73, 3.318]
  - - [768, 64, 1, 1024, 800, 800, 1056, 1056]
    - [88, 5.335]
  - - [768, 64, 1, 2048, 800, 800, 2080, 2080]
    - [74, 7.681]
  - - [768, 64, 1, 4096, 800, 800, 4128, 4128]
    - [88, 9.755]
  - - [768, 64, 1, 8192, 800, 800, 8224, 8224]
    - [88, 11.136]
  - - [768, 128, 1, 64, 800, 800, 768, 128]
    - [94, 1.034]
  - - [768, 128, 1, 128, 800, 800, 768, 160]
    - [80, 1.954]
  - - [768, 128, 1, 256, 800, 800, 768, 288]
    - [89, 3.572]
  - - [768, 128, 1, 512, 800, 800, 768, 544]
    - [89, 6.013]
  - - [768, 128, 1, 1024, 800, 800, 1056, 1056]
    - [89, 9.184]
  - - [768, 128, 1, 2048, 800, 800, 2080, 2080]
    - [88, 12.442]
  - - [768, 128, 1, 4096, 800, 800, 4128, 4128]
    - [78, 14.739]
  - - [768, 128, 1, 8192, 800, 800, 8224, 8224]
    - [74, 16.73]
  - - [768, 256, 1, 64, 800, 800, 768, 256]
    - [13, 2.011]
  - - [768, 256, 1, 128, 800, 800, 768, 256]
    - [123, 3.739]
  - - [768, 256, 1, 256, 800, 800, 768, 288]
    - [136, 6.571]
  - - [768, 256, 1, 512, 800, 800, 768, 544]
    - [103, 10.653]
  - - [768, 256, 1, 1024, 800, 800, 1056, 1056]
    - [113, 15.379]
  - - [768, 256, 1, 2048, 800, 800, 2080, 2080]
    - [104, 19.689]
  - - [768, 256, 1, 4096, 800, 800, 4128, 4128]
    - [132, 22.629]
  - - [768, 256, 1, 8192, 800, 800, 8224, 8224]
    - [123, 24.726]
  - - [768, 512, 1, 64, 800, 800, 768, 512]
    - [12, 3.87]
  - - [768, 512, 1, 128, 800, 800, 768, 512]
    - [115, 7.002]
  - - [768, 512, 1, 256, 800, 800, 768, 512]
    - [134, 11.928]
  - - [768, 512, 1, 512, 800, 800, 768, 544]
    - [124, 18.358]
  - - [768, 512, 1, 1024, 800, 800, 1056, 1056]
    - [105, 25.31]
  - - [768, 512, 1, 2048, 800, 800, 2080, 2080]
    - [124, 31.137]
  - - [768, 512, 1, 4096, 800, 800, 4128, 4128]
    - [116, 34.538]
  - - [768, 512, 1, 8192, 800, 800, 8224, 8224]
    - [111, 36.256]
  - - [768, 1024, 1, 64, 800, 800, 768, 1024]
    - [128, 6.955]
  - - [768, 1024, 1, 128, 800, 800, 768, 1024]
    - [109, 12.156]
  - - [768, 1024, 1, 256, 800, 800, 768, 1024]
    - [138, 18.977]
  - - [768, 1024, 1, 512, 800, 800, 768, 1024]
    - [121, 26.538]
  - - [768, 1024, 1, 1024, 800, 800, 1056, 1056]
    - [69, 33.1]
  - - [768, 1024, 1, 2048, 800, 800, 2080, 2080]
    - [50, 37.681]
  - - [768, 1024, 1, 4096, 800, 800, 4128, 4128]
    - [50, 39.39]
  - - [768, 1024, 1, 8192, 800, 800, 8224, 8224]
    - [47, 41.334]
  - - [768, 2048, 1, 64, 800, 800, 768, 2048]
    - [27, 11.77]
  - - [768, 2048, 1, 128, 800, 800, 768, 2048]
    - [32, 20.406]
  - - [768, 2048, 1, 256, 800, 800, 768, 2048]
    - [71, 32.671]
  - - [768, 2048, 1, 512, 800, 800, 768, 2048]
    - [71, 46.076]
  - - [768, 2048, 1, 1024, 800, 800, 1056, 2048]
    - [71, 58.232]
  - - [768, 2048, 1, 2048, 800, 800, 2080, 2080]
    - [42, 65.504]
  - - [768, 2048, 1, 4096, 800, 800, 4128, 4128]
    - [71, 69.0]
  - - [768, 2048, 1, 8192, 800, 800, 8224, 8224]
    - [54, 71.76]
  - - [768, 4096, 1, 64, 800, 800, 768, 4096]
    - [67, 18.878]
  - - [768, 4096, 1, 128, 800, 800, 768, 4096]
    - [40, 32.465]
  - - [768, 4096, 1, 256, 800, 800, 768, 4096]
    - [56, 47.202]
  - - [768, 4096, 1, 512, 800, 800, 768, 4096]
    - [56, 61.265]
  - - [768, 4096, 1, 1024, 800, 800, 1056, 4096]
    - [32, 71.027]
  - - [768, 4096, 1, 2048, 800, 800, 2080, 4096]
    - [71, 73.485]
  - - [768, 4096, 1, 4096, 800, 800, 4128, 4128]
    - [33, 77.547]
  - - [768, 4096, 1, 8192, 800, 800, 8224, 8224]
    - [26, 64.717]
  - - [768, 8192, 1, 64, 800, 800, 768, 8192]
    - [69, 29.147]
  - - [768, 8192, 1, 128, 800, 800, 768, 8192]
    - [20, 43.417]
  - - [768, 8192, 1, 256, 800, 800, 768, 8192]
    - [23, 58.526]
  - - [768, 8192, 1, 512, 800, 800, 768, 8192]
    - [53, 68.699]
  - - [768, 8192, 1, 1024, 800, 800, 1056, 8192]
    - [23, 72.459]
  - - [768, 8192, 1, 2048, 800, 800, 2080, 8192]
    - [61, 73.759]
  - - [768, 8192, 1, 4096, 800, 800, 4128, 8192]
    - [23, 62.812]
  - - [768, 8192, 1, 8192, 800, 800, 8224, 8224]
    - [53, 58.761]
  - - [1536, 64, 1, 64, 1568, 1568, 1536, 96]
    - [86, 0.986]
  - - [1536, 64, 1, 128, 1568, 1568, 1536, 160]
    - [76, 1.928]
  - - [1536, 64, 1, 256, 1568, 1568, 1536, 288]
    - [84, 3.552]
  - - [1536, 64, 1, 512, 1568, 1568, 1536, 544]
    - [88, 6.03]
  - - [1536, 64, 1, 1024, 1568, 1568, 1536, 1056]
    - [88, 9.211]
  - - [1536, 64, 1, 2048, 1568, 1568, 2080, 2080]
    - [88, 12.424]
  - - [1536, 64, 1, 4096, 1568, 1568, 4128, 4128]
    - [75, 15.052]
  - - [1536, 64, 1, 8192, 1568, 1568, 8224, 8224]
    - [74, 16.715]
  - - [1536, 128, 1, 64, 1568, 1568, 1536, 128]
    - [134, 2.022]
  - - [1536, 128, 1, 128, 1568, 1568, 1536, 160]
    - [105, 3.749]
  - - [1536, 128, 1, 256, 1568, 1568, 1536, 288]
    - [105, 6.616]
  - - [1536, 128, 1, 512, 1568, 1568, 1536, 544]
    - [105, 10.729]
  - - [1536, 128, 1, 1024, 1568, 1568, 1536, 1056]
    - [124, 15.426]
  - - [1536, 128, 1, 2048, 1568, 1568, 2080, 2080]
    - [124, 19.762]
  - - [1536, 128, 1, 4096, 1568, 1568, 4128, 4128]
    - [124, 22.883]
  - - [1536, 128, 1, 8192, 1568, 1568, 8224, 8224]
    - [113, 24.767]
  - - [1536, 256, 1, 64, 1568, 1568, 1536, 256]
    - [137, 3.852]
  - - [1536, 256, 1, 128, 1568, 1568, 1536, 256]
    - [119, 7.025]
  - - [1536, 256, 1, 256, 1568, 1568, 1536, 288]
    - [124, 11.901]
  - - [1536, 256, 1, 512, 1568, 1568, 1536, 544]
    - [105, 18.45]
  - - [1536, 256, 1, 1024, 1568, 1568, 1536, 1056]
    - [123, 25.35]
  - - [1536, 256, 1, 2048, 1568, 1568, 2080, 2080]
    - [130, 31.195]
  - - [1536, 256, 1, 4096, 1568, 1568, 4128, 4128]
    - [116, 34.481]
  - - [1536, 256, 1, 8192, 1568, 1568, 8224, 8224]
    - [111, 36.207]
  - - [1536, 512, 1, 64, 1568, 1568, 1536, 512]
    - [7, 6.971]
  - - [1536, 512, 1, 128, 1568, 1568, 1536, 512]
    - [126, 12.03]
  - - [1536, 512, 1, 256, 1568, 1568, 1536, 512]
    - [126, 18.972]
  - - [1536, 512, 1, 512, 1568, 1568, 1536, 544]
    - [126, 26.454]
  - - [1536, 512, 1, 1024, 1568, 1568, 1536, 1056]
    - [100, 33.203]
  - - [1536, 512, 1, 2048, 1568, 1568, 2080, 2080]
    - [106, 37.318]
  - - [1536, 512, 1, 4096, 1568, 1568, 4128, 4128]
    - [121, 38.563]
  - - [1536, 512, 1, 8192, 1568, 1568, 8224, 8224]
    - [127, 40.746]
  - - [1536, 1024, 1, 64, 1568, 1568, 1536, 1024]
    - [61, 11.671]
  - - [1536, 1024, 1, 128, 1568, 1568, 1536, 1024]
    - [20, 20.386]
  - - [1536, 1024, 1, 256, 1568, 1568, 1536, 1024]
    - [20, 32.386]
  - - [1536, 1024, 1, 512, 1568, 1568, 1536, 1024]
    - [17, 46.22]
  - - [1536, 1024, 1, 1024, 1568, 1568, 1536, 1056]
    - [20, 57.998]
  - - [1536, 1024, 1, 2048, 1568, 1568, 2080, 2080]
    - [56, 65.474]
  - - [1536, 1024, 1, 4096, 1568, 1568, 4128, 4128]
    - [26, 68.806]
  - - [1536, 1024, 1, 8192, 1568, 1568, 8224, 8224]
    - [27, 72.18]
  - - [1536, 2048, 1, 64, 1568, 1568, 1536, 2048]
    - [61, 20.439]
  - - [1536, 2048, 1, 128, 1568, 1568, 1536, 2048]
    - [20, 32.216]
  - - [1536, 2048, 1, 256, 1568, 1568, 1536, 2048]
    - [27, 47.153]
  - - [1536, 2048, 1, 512, 1568, 1568, 1536, 2048]
    - [27, 61.662]
  - - [1536, 2048, 1, 1024, 1568, 1568, 1536, 2048]
    - [56, 71.08]
  - - [1536, 2048, 1, 2048, 1568, 1568, 2080, 2080]
    - [41, 73.018]
  - - [1536, 2048, 1, 4096, 1568, 1568, 4128, 4128]
    - [43, 76.343]
  - - [1536, 2048, 1, 8192, 1568, 1568, 8224, 8224]
    - [70, 70.956]
  - - [1536, 4096, 1, 64, 1568, 1568, 1536, 4096]
    - [40, 29.529]
  - - [1536, 4096, 1, 128, 1568, 1568, 1536, 4096]
    - [23, 43.313]
  - - [1536, 4096, 1, 256, 1568, 1568, 1536, 4096]
    - [23, 57.795]
  - - [1536, 4096, 1, 512, 1568, 1568, 1536, 4096]
    - [23, 68.373]
  - - [1536, 4096, 1, 1024, 1568, 1568, 1536, 4096]
    - [23, 72.502]
  - - [1536, 4096, 1, 2048, 1568, 1568, 2080, 4096]
    - [52, 76.987]
  - - [1536, 4096, 1, 4096, 1568, 1568, 4128, 4128]
    - [17, 68.596]
  - - [1536, 4096, 1, 8192, 1568, 1568, 8224, 8224]
    - [19, 62.516]
  - - [1536, 8192, 1, 64, 1568, 1568, 1536, 8192]
    - [29, 39.381]
  - - [1536, 8192, 1, 128, 1568, 1568, 1536, 8192]
    - [53, 54.067]
  - - [1536, 8192, 1, 256, 1568, 1568, 1536, 8192]
    - [23, 67.44]
  - - [1536, 8192, 1, 512, 1568, 1568, 1536, 8192]
    - [23, 72.566]
  - - [1536, 8192, 1, 1024, 1568, 1568, 1536, 8192]
    - [18, 75.547]
  - - [1536, 8192, 1, 2048, 1568, 1568, 2080, 8192]
    - [51, 67.181]
  - - [1536, 8192, 1, 4096, 1568, 1568, 4128, 8192]
    - [22, 64.662]
  - - [1536, 8192, 1, 8192, 1568, 1568, 8224, 8224]
    - [19, 64.572]
  - - [3072, 64, 1, 64, 3104, 3104, 3072, 96]
    - [98, 1.888]
  - - [3072, 64, 1, 128, 3104, 3104, 3072, 160]
    - [13, 3.706]
  - - [3072, 64, 1, 256, 3104, 3104, 3072, 288]
    - [136, 6.582]
  - - [3072, 64, 1, 512, 3104, 3104, 3072, 544]
    - [105, 10.706]
  - - [3072, 64, 1, 1024, 3104, 3104, 3072, 1056]
    - [123, 15.377]
  - - [3072, 64, 1, 2048, 3104, 3104, 3072, 2080]
    - [124, 19.758]
  - - [3072, 64, 1, 4096, 3104, 3104, 4128, 4128]
    - [113, 22.877]
  - - [3072, 64, 1, 8192, 3104, 3104, 8224, 8224]
    - [118, 24.833]
  - - [3072, 128, 1, 64, 3104, 3104, 3072, 128]
    - [110, 3.855]
  - - [3072, 128, 1, 128, 3104, 3104, 3072, 160]
    - [109, 7.033]
  - - [3072, 128, 1, 256, 3104, 3104, 3072, 288]
    - [124, 11.898]
  - - [3072, 128, 1, 512, 3104, 3104, 3072, 544]
    - [124, 18.369]
  - - [3072, 128, 1, 1024, 3104, 3104, 3072, 1056]
    - [118, 25.31]
  - - [3072, 128, 1, 2048, 3104, 3104, 3072, 2080]
    - [103, 31.188]
  - - [3072, 128, 1, 4096, 3104, 3104, 4128, 4128]
    - [124, 34.685]
  - - [3072, 128, 1, 8192, 3104, 3104, 8224, 8224]
    - [103, 36.227]
  - - [3072, 256, 1, 64, 3104, 3104, 3072, 256]
    - [13, 6.966]
  - - [3072, 256, 1, 128, 3104, 3104, 3072, 256]
    - [101, 11.998]
  - - [3072, 256, 1, 256, 3104, 3104, 3072, 288]
    - [109, 18.892]
  - - [3072, 256, 1, 512, 3104, 3104, 3072, 544]
    - [109, 26.333]
  - - [3072, 256, 1, 1024, 3104, 3104, 3072, 1056]
    - [99, 32.731]
  - - [3072, 256, 1, 2048, 3104, 3104, 3072, 2080]
    - [138, 37.127]
  - - [3072, 256, 1, 4096, 3104, 3104, 4128, 4128]
    - [133, 38.299]
  - - [3072, 256, 1, 8192, 3104, 3104, 8224, 8224]
    - [114, 40.56]
  - - [3072, 512, 1, 64, 3104, 3104, 3072, 512]
    - [53, 11.616]
  - - [3072, 512, 1, 128, 3104, 3104, 3072, 512]
    - [26, 20.207]
  - - [3072, 512, 1, 256, 3104, 3104, 3072, 512]
    - [41, 32.377]
  - - [3072, 512, 1, 512, 3104, 3104, 3072, 544]
    - [41, 45.979]
  - - [3072, 512, 1, 1024, 3104, 3104, 3072, 1056]
    - [26, 57.885]
  - - [3072, 512, 1, 2048, 3104, 3104, 3072, 2080]
    - [55, 65.353]
  - - [3072, 512, 1, 4096, 3104, 3104, 4128, 4128]
    - [55, 68.796]
  - - [3072, 512, 1, 8192, 3104, 3104, 8224, 8224]
    - [28, 66.694]
  - - [3072, 1024, 1, 64, 3104, 3104, 3072, 1024]
    - [23, 20.334]
  - - [3072, 1024, 1, 128, 3104, 3104, 3072, 1024]
    - [31, 32.735]
  - - [3072, 1024, 1, 256, 3104, 3104, 3072, 1024]
    - [27, 47.189]
  - - [3072, 1024, 1, 512, 3104, 3104, 3072, 1024]
    - [27, 61.25]
  - - [3072, 1024, 1, 1024, 3104, 3104, 3072, 1056]
    - [71, 70.945]
  - - [3072, 1024, 1, 2048, 3104, 3104, 3072, 2080]
    - [56, 72.953]
  - - [3072, 1024, 1, 4096, 3104, 3104, 4128, 4128]
    - [64, 77.479]
  - - [3072, 1024, 1, 8192, 3104, 3104, 8224, 8224]
    - [71, 68.788]
  - - [3072, 2048, 1, 64, 3104, 3104, 3072, 2048]
    - [38, 29.755]
  - - [3072, 2048, 1, 128, 3104, 3104, 3072, 2048]
    - [60, 43.12]
  - - [3072, 2048, 1, 256, 3104, 3104, 3072, 2048]
    - [31, 57.848]
  - - [3072, 2048, 1, 512, 3104, 3104, 3072, 2048]
    - [23, 67.758]
  - - [3072, 2048, 1, 1024, 3104, 3104, 3072, 2048]
    - [53, 72.081]
  - - [3072, 2048, 1, 2048, 3104, 3104, 3072, 2080]
    - [47, 75.33]
  - - [3072, 2048, 1, 4096, 3104, 3104, 4128, 4128]
    - [23, 67.825]
  - - [3072, 2048, 1, 8192, 3104, 3104, 8224, 8224]
    - [49, 62.859]
  - - [3072, 4096, 1, 64, 3104, 3104, 3072, 4096]
    - [45, 39.532]
  - - [3072, 4096, 1, 128, 3104, 3104, 3072, 4096]
    - [69, 54.341]
  - - [3072, 4096, 1, 256, 3104, 3104, 3072, 4096]
    - [23, 67.537]
  - - [3072, 4096, 1, 512, 3104, 3104, 3072, 4096]
    - [23, 72.855]
  - - [3072, 4096, 1, 1024, 3104, 3104, 3072, 4096]
    - [39, 76.027]
  - - [3072, 4096, 1, 2048, 3104, 3104, 3072, 4096]
    - [46, 67.446]
  - - [3072, 4096, 1, 4096, 3104, 3104, 4128, 4128]
    - [19, 67.87]
  - - [3072, 4096, 1, 8192, 3104, 3104, 8224, 8224]
    - [23, 65.213]
  - - [3072, 8192, 1, 64, 3104, 3104, 3072, 8192]
    - [40, 47.872]
  - - [3072, 8192, 1, 128, 3104, 3104, 3072, 8192]
    - [23, 62.799]
  - - [3072, 8192, 1, 256, 3104, 3104, 3072, 8192]
    - [53, 70.939]
  - - [3072, 8192, 1, 512, 3104, 3104, 3072, 8192]
    - [61, 77.433]
  - - [3072, 8192, 1, 1024, 3104, 3104, 3072, 8192]
    - [22, 67.193]
  - - [3072, 8192, 1, 2048, 3104, 3104, 3072, 8192]
    - [58, 67.749]
  - - [3072, 8192, 1, 4096, 3104, 3104, 4128, 8192]
    - [31, 66.32]
  - - [3072, 8192, 1, 8192, 3104, 3104, 8224, 8224]
    - [21, 65.532]
  - - [6144, 64, 1, 64, 6176, 6176, 6144, 96]
    - [11, 3.602]
  - - [6144, 64, 1, 128, 6176, 6176, 6144, 160]
    - [9, 6.932]
  - - [6144, 64, 1, 256, 6176, 6176, 6144, 288]
    - [132, 11.881]
  - - [6144, 64, 1, 512, 6176, 6176, 6144, 544]
    - [132, 18.35]
  - - [6144, 64, 1, 1024, 6176, 6176, 6144, 1056]
    - [123, 25.361]
  - - [6144, 64, 1, 2048, 6176, 6176, 6144, 2080]
    - [117, 31.191]
  - - [6144, 64, 1, 4096, 6176, 6176, 6144, 4128]
    - [103, 34.728]
  - - [6144, 64, 1, 8192, 6176, 6176, 8224, 8224]
    - [102, 36.845]
  - - [6144, 128, 1, 64, 6176, 6176, 6144, 128]
    - [118, 6.728]
  - - [6144, 128, 1, 128, 6176, 6176, 6144, 160]
    - [133, 11.928]
  - - [6144, 128, 1, 256, 6176, 6176, 6144, 288]
    - [107, 18.807]
  - - [6144, 128, 1, 512, 6176, 6176, 6144, 544]
    - [109, 26.142]
  - - [6144, 128, 1, 1024, 6176, 6176, 6144, 1056]
    - [109, 32.754]
  - - [6144, 128, 1, 2048, 6176, 6176, 6144, 2080]
    - [125, 36.569]
  - - [6144, 128, 1, 4096, 6176, 6176, 6144, 4128]
    - [105, 38.252]
  - - [6144, 128, 1, 8192, 6176, 6176, 8224, 8224]
    - [122, 40.927]
  - - [6144, 256, 1, 64, 6176, 6176, 6144, 256]
    - [53, 12.088]
  - - [6144, 256, 1, 128, 6176, 6176, 6144, 256]
    - [32, 21.303]
  - - [6144, 256, 1, 256, 6176, 6176, 6144, 288]
    - [27, 33.558]
  - - [6144, 256, 1, 512, 6176, 6176, 6144, 544]
    - [27, 47.008]
  - - [6144, 256, 1, 1024, 6176, 6176, 6144, 1056]
    - [27, 58.806]
  - - [6144, 256, 1, 2048, 6176, 6176, 6144, 2080]
    - [55, 65.412]
  - - [6144, 256, 1, 4096, 6176, 6176, 6144, 4128]
    - [26, 69.075]
  - - [6144, 256, 1, 8192, 6176, 6176, 8224, 8224]
    - [27, 64.016]
  - - [6144, 512, 1, 64, 6176, 6176, 6144, 512]
    - [40, 20.104]
  - - [6144, 512, 1, 128, 6176, 6176, 6144, 512]
    - [31, 32.503]
  - - [6144, 512, 1, 256, 6176, 6176, 6144, 512]
    - [27, 46.669]
  - - [6144, 512, 1, 512, 6176, 6176, 6144, 544]
    - [26, 61.101]
  - - [6144, 512, 1, 1024, 6176, 6176, 6144, 1056]
    - [71, 71.205]
  - - [6144, 512, 1, 2048, 6176, 6176, 6144, 2080]
    - [63, 73.517]
  - - [6144, 512, 1, 4096, 6176, 6176, 6144, 4128]
    - [33, 77.977]
  - - [6144, 512, 1, 8192, 6176, 6176, 8224, 8224]
    - [25, 66.182]
  - - [6144, 1024, 1, 64, 6176, 6176, 6144, 1024]
    - [57, 29.016]
  - - [6144, 1024, 1, 128, 6176, 6176, 6144, 1024]
    - [20, 43.955]
  - - [6144, 1024, 1, 256, 6176, 6176, 6144, 1024]
    - [53, 58.31]
  - - [6144, 1024, 1, 512, 6176, 6176, 6144, 1024]
    - [53, 68.655]
  - - [6144, 1024, 1, 1024, 6176, 6176, 6144, 1056]
    - [53, 72.227]
  - - [6144, 1024, 1, 2048, 6176, 6176, 6144, 2080]
    - [66, 74.935]
  - - [6144, 1024, 1, 4096, 6176, 6176, 6144, 4128]
    - [20, 68.569]
  - - [6144, 1024, 1, 8192, 6176, 6176, 8224, 8224]
    - [61, 62.337]
  - - [6144, 2048, 1, 64, 6176, 6176, 6144, 2048]
    - [29, 39.474]
  - - [6144, 2048, 1, 128, 6176, 6176, 6144, 2048]
    - [53, 54.576]
  - - [6144, 2048, 1, 256, 6176, 6176, 6144, 2048]
    - [23, 67.698]
  - - [6144, 2048, 1, 512, 6176, 6176, 6144, 2048]
    - [53, 73.354]
  - - [6144, 2048, 1, 1024, 6176, 6176, 6144, 2048]
    - [36, 76.896]
  - - [6144, 2048, 1, 2048, 6176, 6176, 6144, 2080]
    - [49, 68.272]
  - - [6144, 2048, 1, 4096, 6176, 6176, 6144, 4128]
    - [48, 67.703]
  - - [6144, 2048, 1, 8192, 6176, 6176, 8224, 8224]
    - [48, 63.452]
  - - [6144, 4096, 1, 64, 6176, 6176, 6144, 4096]
    - [69, 47.815]
  - - [6144, 4096, 1, 128, 6176, 6176, 6144, 4096]
    - [23, 62.316]
  - - [6144, 4096, 1, 256, 6176, 6176, 6144, 4096]
    - [53, 70.626]
  - - [6144, 4096, 1, 512, 6176, 6176, 6144, 4096]
    - [61, 77.578]
  - - [6144, 4096, 1, 1024, 6176, 6176, 6144, 4096]
    - [30, 68.21]
  - - [6144, 4096, 1, 2048, 6176, 6176, 6144, 4096]
    - [23, 68.205]
  - - [6144, 4096, 1, 4096, 6176, 6176, 6144, 4128]
    - [23, 66.907]
  - - [6144, 4096, 1, 8192, 6176, 6176, 8224, 8224]
    - [53, 65.068]
  - - [6144, 8192, 1, 64, 6176, 6176, 6144, 8192]
    - [57, 50.287]
  - - [6144, 8192, 1, 128, 6176, 6176, 6144, 8192]
    - [23, 63.464]
  - - [6144, 8192, 1, 256, 6176, 6176, 6144, 8192]
    - [37, 70.716]
  - - [6144, 8192, 1, 512, 6176, 6176, 6144, 8192]
    - [35, 61.802]
  - - [6144, 8192, 1, 1024, 6176, 6176, 6144, 8192]
    - [59, 63.366]
  - - [6144, 8192, 1, 2048, 6176, 6176, 6144, 8192]
    - [61, 66.163]
  - - [6144, 8192, 1, 4096, 6176, 6176, 6144, 8192]
    - [23, 65.741]
  - - [6144, 8192, 1, 8192, 6176, 6176, 8224, 8224]
    - [68, 64.855]
- null
- null
- DeviceEfficiency
