library/src/blas3/Tensile/Logic/asm_full/navi31/navi31_Cijk_Ailk_Bljk_HB.yaml
- {MinimumRequiredVersion: 4.35.0}
- navi31
- gfx1100
- [Device 73bf]
    SolutionIndex: 0
    SolutionNameMin: Cijk_Ailk_Bljk_HB_MT32x32x16_MI16x16x16x1_SN_1LDSB1_AMAS0_GRVW4_IU1_NLCA1_SIA2_SU0_SUS0_SVW1_TT1_16_VW1_WGM4
    SolutionIndex: 1
    SolutionNameMin: Cijk_Ailk_Bljk_HB_MT32x32x16_MI16x16x16x1_SN_1LDSB1_AMAS0_GRVW8_IU1_NLCA1_SIA2_SU0_SUS0_SVW1_TT1_16_VW1_WGM4
    SolutionIndex: 2
    SolutionNameMin: Cijk_Ailk_Bljk_HB_MT32x32x16_MI16x16x16x1_SN_1LDSB1_AMAS0_GRVW8_IU1_NLCA1_SIA2_SU32_SUS128_SVW1_TT1_16_VW1_WGM4
    SolutionIndex: 3
    SolutionNameMin: Cijk_Ailk_Bljk_HB_MT32x32x16_MI16x16x16x1_SN_1LDSB0_AMAS0_GRVW4_IU1_NLCA1_SIA1_SU32_SUS256_SVW1_TT1_16_VW1_WGM4
    SolutionIndex: 4
    SolutionNameMin: Cijk_Ailk_Bljk_HB_MT32x32x16_MI16x16x16x1_SN_1LDSB1_AMAS0_GRVW2_IU1_NLCA1_SIA2_SU0_SUS0_SVW1_TT1_16_VW1_WGM8
    SolutionIndex: 5
    SolutionNameMin: Cijk_Ailk_Bljk_HB_MT64x64x16_MI16x16x16x1_SN_1LDSB0_AMAS0_GRVW4_IU1_NLCA1_SIA1_SU0_SUS0_SVW1_TT2_32_VW1_WGM4
    SolutionIndex: 6
    SolutionNameMin: Cijk_Ailk_Bljk_HB_MT64x64x16_MI16x16x16x1_SN_1LDSB0_AMAS3_GRVW4_IU1_NLCA1_SIA1_SU0_SUS0_SVW2_TT2_32_VW2_WGM4
    SolutionIndex: 7
    SolutionNameMin: Cijk_Ailk_Bljk_HB_MT64x64x16_MI16x16x16x1_SN_1LDSB1_AMAS3_GRVW2_IU1_NLCA1_SIA2_SU0_SUS0_SVW2_TT2_32_VW2_WGM4
    SolutionIndex: 8
    SolutionNameMin: Cijk_Ailk_Bljk_HB_MT64x64x16_MI16x16x16x1_SN_1LDSB1_AMAS3_GRVW4_IU1_NLCA1_SIA2_SU0_SUS0_SVW2_TT2_32_VW2_WGM4
    SolutionIndex: 9
    SolutionNameMin: Cijk_Ailk_Bljk_HB_MT64x64x16_MI16x16x16x1_SN_1LDSB1_AMAS3_GRVW8_IU1_NLCA1_SIA2_SU0_SUS0_SVW2_TT2_32_VW2_WGM4
    SolutionIndex: 10
    SolutionNameMin: Cijk_Ailk_Bljk_HB_MT64x64x16_MI16x16x16x1_SN_1LDSB1_AMAS3_GRVW4_IU1_NLCA1_SIA2_SU32_SUS128_SVW2_TT2_32_VW2_WGM4
    SolutionIndex: 11
    SolutionNameMin: Cijk_Ailk_Bljk_HB_MT64x64x16_MI16x16x16x1_SN_1LDSB1_AMAS3_GRVW8_IU1_NLCA1_SIA2_SU32_SUS128_SVW2_TT2_32_VW2_WGM4
    SolutionIndex: 12
    SolutionNameMin: Cijk_Ailk_Bljk_HB_MT64x64x16_MI16x16x16x1_SN_1LDSB1_AMAS3_GRVW8_IU1_NLCA1_SIA2_SU32_SUS256_SVW2_TT2_32_VW2_WGM4
    SolutionIndex: 13
    SolutionNameMin: Cijk_Ailk_Bljk_HB_MT64x64x16_MI16x16x16x1_SN_1LDSB0_AMAS0_GRVW4_IU1_NLCA1_SIA1_SU0_SUS0_SVW1_TT2_32_VW1_WGM8
    SolutionIndex: 14
    SolutionNameMin: Cijk_Ailk_Bljk_HB_MT64x64x16_MI16x16x16x1_SN_1LDSB0_AMAS3_GRVW8_IU1_NLCA1_SIA1_SU0_SUS0_SVW2_TT2_32_VW2_WGM8
    SolutionIndex: 15
    SolutionNameMin: Cijk_Ailk_Bljk_HB_MT64x64x16_MI16x16x16x1_SN_1LDSB1_AMAS3_GRVW4_IU1_NLCA1_SIA2_SU0_SUS0_SVW2_TT2_32_VW2_WGM8
    SolutionIndex: 16
    SolutionNameMin: Cijk_Ailk_Bljk_HB_MT64x64x16_MI16x16x16x1_SN_1LDSB1_AMAS3_GRVW8_IU1_NLCA1_SIA2_SU0_SUS0_SVW2_TT2_32_VW2_WGM8
    SolutionIndex: 17
    SolutionNameMin: Cijk_Ailk_Bljk_HB_MT64x64x16_MI16x16x16x1_SN_1LDSB1_AMAS3_GRVW4_IU1_NLCA1_SIA2_SU32_SUS128_SVW2_TT2_32_VW2_WGM8
    SolutionIndex: 18
    SolutionNameMin: Cijk_Ailk_Bljk_HB_MT64x64x16_MI16x16x16x1_SN_1LDSB1_AMAS3_GRVW8_IU1_NLCA1_SIA2_SU32_SUS128_SVW2_TT2_32_VW2_WGM8
    SolutionIndex: 19
    SolutionNameMin: Cijk_Ailk_Bljk_HB_MT64x64x16_MI16x16x16x1_SN_1LDSB1_AMAS3_GRVW8_IU1_NLCA1_SIA2_SU32_SUS256_SVW2_TT2_32_VW2_WGM8
    SolutionIndex: 20
    SolutionNameMin: Cijk_Ailk_Bljk_HB_MT128x128x16_MI16x16x16x1_SN_1LDSB0_AMAS0_GRVW2_IU1_NLCA2_SIA1_SU0_SUS0_SVW1_TT4_64_VW1_WGM4
    SolutionIndex: 21
    SolutionNameMin: Cijk_Ailk_Bljk_HB_MT128x128x16_MI16x16x16x1_SN_1LDSB0_AMAS3_GRVW2_IU1_NLCA2_SIA1_SU0_SUS0_SVW2_TT4_64_VW2_WGM4
    SolutionIndex: 22
    SolutionNameMin: Cijk_Ailk_Bljk_HB_MT128x128x16_MI16x16x16x1_SN_1LDSB0_AMAS0_GRVW4_IU1_NLCA1_SIA1_SU0_SUS0_SVW1_TT4_64_VW1_WGM4
    SolutionIndex: 23
    SolutionNameMin: Cijk_Ailk_Bljk_HB_MT128x128x16_MI16x16x16x1_SN_1LDSB0_AMAS3_GRVW4_IU1_NLCA1_SIA1_SU0_SUS0_SVW2_TT4_64_VW2_WGM4
    SolutionIndex: 24
    SolutionNameMin: Cijk_Ailk_Bljk_HB_MT128x128x16_MI16x16x16x1_SN_1LDSB0_AMAS0_GRVW8_IU1_NLCA1_SIA1_SU0_SUS0_SVW1_TT4_64_VW1_WGM4
    SolutionIndex: 25
    SolutionNameMin: Cijk_Ailk_Bljk_HB_MT128x128x16_MI16x16x16x1_SN_1LDSB0_AMAS3_GRVW8_IU1_NLCA1_SIA1_SU0_SUS0_SVW2_TT4_64_VW2_WGM4
    SolutionIndex: 26
    SolutionNameMin: Cijk_Ailk_Bljk_HB_MT128x128x16_MI16x16x16x1_SN_1LDSB0_AMAS0_GRVW2_IU1_NLCA2_SIA3_SU0_SUS0_SVW1_TT4_64_VW1_WGM4
    SolutionIndex: 27
    SolutionNameMin: Cijk_Ailk_Bljk_HB_MT128x128x16_MI16x16x16x1_SN_1LDSB0_AMAS3_GRVW4_IU1_NLCA1_SIA3_SU0_SUS0_SVW2_TT4_64_VW2_WGM4
    SolutionIndex: 28
    SolutionNameMin: Cijk_Ailk_Bljk_HB_MT128x128x16_MI16x16x16x1_SN_1LDSB0_AMAS0_GRVW8_IU1_NLCA1_SIA3_SU0_SUS0_SVW1_TT4_64_VW1_WGM4
    SolutionIndex: 29
    SolutionNameMin: Cijk_Ailk_Bljk_HB_MT128x128x16_MI16x16x16x1_SN_1LDSB0_AMAS3_GRVW8_IU1_NLCA1_SIA3_SU0_SUS0_SVW2_TT4_64_VW2_WGM4
    SolutionIndex: 30
    SolutionNameMin: Cijk_Ailk_Bljk_HB_MT128x128x16_MI16x16x16x1_SN_1LDSB0_AMAS0_GRVW2_IU1_NLCA2_SIA1_SU32_SUS128_SVW1_TT4_64_VW1_WGM4
    SolutionIndex: 31
    SolutionNameMin: Cijk_Ailk_Bljk_HB_MT128x128x16_MI16x16x16x1_SN_1LDSB0_AMAS3_GRVW2_IU1_NLCA2_SIA1_SU32_SUS128_SVW2_TT4_64_VW2_WGM4
    SolutionIndex: 32
    SolutionNameMin: Cijk_Ailk_Bljk_HB_MT128x128x16_MI16x16x16x1_SN_1LDSB0_AMAS3_GRVW4_IU1_NLCA1_SIA1_SU32_SUS128_SVW2_TT4_64_VW2_WGM4
    SolutionIndex: 33
    SolutionNameMin: Cijk_Ailk_Bljk_HB_MT128x128x16_MI16x16x16x1_SN_1LDSB0_AMAS3_GRVW8_IU1_NLCA1_SIA1_SU32_SUS128_SVW2_TT4_64_VW2_WGM4
    SolutionIndex: 34
    SolutionNameMin: Cijk_Ailk_Bljk_HB_MT128x128x16_MI16x16x16x1_SN_1LDSB0_AMAS0_GRVW8_IU1_NLCA1_SIA3_SU32_SUS128_SVW1_TT4_64_VW1_WGM4
    SolutionIndex: 35
    SolutionNameMin: Cijk_Ailk_Bljk_HB_MT128x128x16_MI16x16x16x1_SN_1LDSB0_AMAS3_GRVW8_IU1_NLCA1_SIA3_SU32_SUS128_SVW2_TT4_64_VW2_WGM4
    SolutionIndex: 36
    SolutionNameMin: Cijk_Ailk_Bljk_HB_MT128x128x16_MI16x16x16x1_SN_1LDSB0_AMAS0_GRVW2_IU1_NLCA2_SIA1_SU32_SUS256_SVW1_TT4_64_VW1_WGM4
    SolutionIndex: 37
    SolutionNameMin: Cijk_Ailk_Bljk_HB_MT128x128x16_MI16x16x16x1_SN_1LDSB0_AMAS3_GRVW2_IU1_NLCA2_SIA1_SU32_SUS256_SVW2_TT4_64_VW2_WGM4
    SolutionIndex: 38
    SolutionNameMin: Cijk_Ailk_Bljk_HB_MT128x128x16_MI16x16x16x1_SN_1LDSB0_AMAS3_GRVW4_IU1_NLCA1_SIA1_SU32_SUS256_SVW2_TT4_64_VW2_WGM4
    SolutionIndex: 39
    SolutionNameMin: Cijk_Ailk_Bljk_HB_MT128x128x16_MI16x16x16x1_SN_1LDSB0_AMAS3_GRVW8_IU1_NLCA1_SIA1_SU32_SUS256_SVW2_TT4_64_VW2_WGM4
    SolutionIndex: 40
    SolutionNameMin: Cijk_Ailk_Bljk_HB_MT128x128x16_MI16x16x16x1_SN_1LDSB1_AMAS3_GRVW8_IU1_NLCA1_SIA2_SU32_SUS256_SVW2_TT4_64_VW2_WGM4
    SolutionIndex: 41
    SolutionNameMin: Cijk_Ailk_Bljk_HB_MT128x128x16_MI16x16x16x1_SN_1LDSB0_AMAS0_GRVW8_IU1_NLCA1_SIA3_SU32_SUS256_SVW1_TT4_64_VW1_WGM4
    SolutionIndex: 42
    SolutionNameMin: Cijk_Ailk_Bljk_HB_MT128x128x16_MI16x16x16x1_SN_1LDSB0_AMAS3_GRVW8_IU1_NLCA1_SIA3_SU32_SUS256_SVW2_TT4_64_VW2_WGM4
    SolutionIndex: 43
    SolutionNameMin: Cijk_Ailk_Bljk_HB_MT128x128x16_MI16x16x16x1_SN_1LDSB0_AMAS3_GRVW2_IU1_NLCA2_SIA1_SU0_SUS0_SVW2_TT4_64_VW2_WGM8
    SolutionIndex: 44
    SolutionNameMin: Cijk_Ailk_Bljk_HB_MT128x128x16_MI16x16x16x1_SN_1LDSB0_AMAS0_GRVW4_IU1_NLCA1_SIA1_SU0_SUS0_SVW1_TT4_64_VW1_WGM8
    SolutionIndex: 45
    SolutionNameMin: Cijk_Ailk_Bljk_HB_MT128x128x16_MI16x16x16x1_SN_1LDSB0_AMAS3_GRVW4_IU1_NLCA1_SIA1_SU0_SUS0_SVW2_TT4_64_VW2_WGM8
    SolutionIndex: 46
    SolutionNameMin: Cijk_Ailk_Bljk_HB_MT128x128x16_MI16x16x16x1_SN_1LDSB0_AMAS0_GRVW8_IU1_NLCA1_SIA1_SU0_SUS0_SVW1_TT4_64_VW1_WGM8
    SolutionIndex: 47
    SolutionNameMin: Cijk_Ailk_Bljk_HB_MT128x128x16_MI16x16x16x1_SN_1LDSB0_AMAS3_GRVW8_IU1_NLCA1_SIA1_SU0_SUS0_SVW2_TT4_64_VW2_WGM8
    SolutionIndex: 48
    SolutionNameMin: Cijk_Ailk_Bljk_HB_MT128x128x16_MI16x16x16x1_SN_1LDSB0_AMAS0_GRVW8_IU1_NLCA1_SIA3_SU0_SUS0_SVW1_TT4_64_VW1_WGM8
    SolutionIndex: 49
    SolutionNameMin: Cijk_Ailk_Bljk_HB_MT128x128x16_MI16x16x16x1_SN_1LDSB0_AMAS3_GRVW8_IU1_NLCA1_SIA3_SU0_SUS0_SVW2_TT4_64_VW2_WGM8
    SolutionIndex: 50
    SolutionNameMin: Cijk_Ailk_Bljk_HB_MT128x128x16_MI16x16x16x1_SN_1LDSB0_AMAS0_GRVW2_IU1_NLCA2_SIA1_SU32_SUS128_SVW1_TT4_64_VW1_WGM8
    SolutionIndex: 51
    SolutionNameMin: Cijk_Ailk_Bljk_HB_MT128x128x16_MI16x16x16x1_SN_1LDSB0_AMAS3_GRVW2_IU1_NLCA2_SIA1_SU32_SUS128_SVW2_TT4_64_VW2_WGM8
    SolutionIndex: 52
    SolutionNameMin: Cijk_Ailk_Bljk_HB_MT128x128x16_MI16x16x16x1_SN_1LDSB0_AMAS0_GRVW4_IU1_NLCA1_SIA1_SU32_SUS128_SVW1_TT4_64_VW1_WGM8
    SolutionIndex: 53
    SolutionNameMin: Cijk_Ailk_Bljk_HB_MT128x128x16_MI16x16x16x1_SN_1LDSB0_AMAS3_GRVW4_IU1_NLCA1_SIA1_SU32_SUS128_SVW2_TT4_64_VW2_WGM8
    SolutionIndex: 54
    SolutionNameMin: Cijk_Ailk_Bljk_HB_MT128x128x16_MI16x16x16x1_SN_1LDSB0_AMAS0_GRVW8_IU1_NLCA1_SIA1_SU32_SUS128_SVW1_TT4_64_VW1_WGM8
    SolutionIndex: 55
    SolutionNameMin: Cijk_Ailk_Bljk_HB_MT128x128x16_MI16x16x16x1_SN_1LDSB0_AMAS3_GRVW8_IU1_NLCA1_SIA1_SU32_SUS128_SVW2_TT4_64_VW2_WGM8
    SolutionIndex: 56
    SolutionNameMin: Cijk_Ailk_Bljk_HB_MT128x128x16_MI16x16x16x1_SN_1LDSB0_AMAS3_GRVW8_IU1_NLCA1_SIA3_SU32_SUS128_SVW2_TT4_64_VW2_WGM8
    SolutionIndex: 57
    SolutionNameMin: Cijk_Ailk_Bljk_HB_MT128x128x16_MI16x16x16x1_SN_1LDSB0_AMAS3_GRVW2_IU1_NLCA2_SIA1_SU32_SUS256_SVW2_TT4_64_VW2_WGM8
    SolutionIndex: 58
    SolutionNameMin: Cijk_Ailk_Bljk_HB_MT128x128x16_MI16x16x16x1_SN_1LDSB0_AMAS0_GRVW4_IU1_NLCA1_SIA1_SU32_SUS256_SVW1_TT4_64_VW1_WGM8
    SolutionIndex: 59
    SolutionNameMin: Cijk_Ailk_Bljk_HB_MT128x128x16_MI16x16x16x1_SN_1LDSB0_AMAS3_GRVW4_IU1_NLCA1_SIA1_SU32_SUS256_SVW2_TT4_64_VW2_WGM8
    SolutionIndex: 60
    SolutionNameMin: Cijk_Ailk_Bljk_HB_MT128x128x16_MI16x16x16x1_SN_1LDSB0_AMAS0_GRVW8_IU1_NLCA1_SIA1_SU32_SUS256_SVW1_TT4_64_VW1_WGM8
    SolutionIndex: 61
    SolutionNameMin: Cijk_Ailk_Bljk_HB_MT128x128x16_MI16x16x16x1_SN_1LDSB0_AMAS3_GRVW8_IU1_NLCA1_SIA1_SU32_SUS256_SVW2_TT4_64_VW2_WGM8
    SolutionIndex: 62
    SolutionNameMin: Cijk_Ailk_Bljk_HB_MT128x128x16_MI16x16x16x1_SN_1LDSB1_AMAS3_GRVW4_IU1_NLCA1_SIA2_SU32_SUS256_SVW2_TT4_64_VW2_WGM8
    SolutionIndex: 63
    SolutionNameMin: Cijk_Ailk_Bljk_HB_MT128x128x16_MI16x16x16x1_SN_1LDSB0_AMAS0_GRVW8_IU1_NLCA1_SIA3_SU32_SUS256_SVW1_TT4_64_VW1_WGM8
    SolutionIndex: 64
    SolutionNameMin: Cijk_Ailk_Bljk_HB_MT32x32x32_MI16x16x16x1_SN_1LDSB0_AMAS0_GRVW2_IU1_NLCA1_SIA1_SU0_SUS0_SVW1_TT1_16_VW1_WGM4
    SolutionIndex: 65
    SolutionNameMin: Cijk_Ailk_Bljk_HB_MT32x32x32_MI16x16x16x1_SN_1LDSB0_AMAS0_GRVW4_IU1_NLCA1_SIA1_SU0_SUS0_SVW1_TT1_16_VW1_WGM4
    SolutionIndex: 66
    SolutionNameMin: Cijk_Ailk_Bljk_HB_MT32x32x32_MI16x16x16x1_SN_1LDSB0_AMAS0_GRVW8_IU1_NLCA1_SIA1_SU0_SUS0_SVW1_TT1_16_VW1_WGM4
    SolutionIndex: 67
    SolutionNameMin: Cijk_Ailk_Bljk_HB_MT32x32x32_MI16x16x16x1_SN_1LDSB1_AMAS0_GRVW2_IU2_NLCA1_SIA2_SU0_SUS0_SVW1_TT1_16_VW1_WGM4
    SolutionIndex: 68
    SolutionNameMin: Cijk_Ailk_Bljk_HB_MT32x32x32_MI16x16x16x1_SN_1LDSB1_AMAS0_GRVW4_IU2_NLCA1_SIA2_SU0_SUS0_SVW1_TT1_16_VW1_WGM4
    SolutionIndex: 69
    SolutionNameMin: Cijk_Ailk_Bljk_HB_MT32x32x32_MI16x16x16x1_SN_1LDSB1_AMAS0_GRVW8_IU2_NLCA1_SIA2_SU0_SUS0_SVW1_TT1_16_VW1_WGM4
    SolutionIndex: 70
    SolutionNameMin: Cijk_Ailk_Bljk_HB_MT32x32x32_MI16x16x16x1_SN_1LDSB0_AMAS0_GRVW8_IU1_NLCA1_SIA3_SU0_SUS0_SVW1_TT1_16_VW1_WGM4
    SolutionIndex: 71
    SolutionNameMin: Cijk_Ailk_Bljk_HB_MT32x32x32_MI16x16x16x1_SN_1LDSB0_AMAS0_GRVW8_IU1_NLCA1_SIA1_SU32_SUS128_SVW1_TT1_16_VW1_WGM4
    SolutionIndex: 72
    SolutionNameMin: Cijk_Ailk_Bljk_HB_MT32x32x32_MI16x16x16x1_SN_1LDSB1_AMAS0_GRVW2_IU2_NLCA1_SIA2_SU32_SUS128_SVW1_TT1_16_VW1_WGM4
    SolutionIndex: 73
    SolutionNameMin: Cijk_Ailk_Bljk_HB_MT32x32x32_MI16x16x16x1_SN_1LDSB1_AMAS0_GRVW4_IU2_NLCA1_SIA2_SU32_SUS128_SVW1_TT1_16_VW1_WGM4
    SolutionIndex: 74
    SolutionNameMin: Cijk_Ailk_Bljk_HB_MT32x32x32_MI16x16x16x1_SN_1LDSB1_AMAS0_GRVW8_IU2_NLCA1_SIA2_SU32_SUS128_SVW1_TT1_16_VW1_WGM4
    SolutionIndex: 75
    SolutionNameMin: Cijk_Ailk_Bljk_HB_MT32x32x32_MI16x16x16x1_SN_1LDSB0_AMAS0_GRVW8_IU1_NLCA1_SIA3_SU32_SUS128_SVW1_TT1_16_VW1_WGM4
    SolutionIndex: 76
    SolutionNameMin: Cijk_Ailk_Bljk_HB_MT32x32x32_MI16x16x16x1_SN_1LDSB0_AMAS0_GRVW4_IU1_NLCA1_SIA1_SU32_SUS256_SVW1_TT1_16_VW1_WGM4
    SolutionIndex: 77
    SolutionNameMin: Cijk_Ailk_Bljk_HB_MT32x32x32_MI16x16x16x1_SN_1LDSB0_AMAS0_GRVW8_IU1_NLCA1_SIA1_SU32_SUS256_SVW1_TT1_16_VW1_WGM4
    SolutionIndex: 78
    SolutionNameMin: Cijk_Ailk_Bljk_HB_MT32x32x32_MI16x16x16x1_SN_1LDSB1_AMAS0_GRVW2_IU2_NLCA1_SIA2_SU32_SUS256_SVW1_TT1_16_VW1_WGM4
    SolutionIndex: 79
    SolutionNameMin: Cijk_Ailk_Bljk_HB_MT32x32x32_MI16x16x16x1_SN_1LDSB1_AMAS0_GRVW4_IU2_NLCA1_SIA2_SU32_SUS256_SVW1_TT1_16_VW1_WGM4
    SolutionIndex: 80
    SolutionNameMin: Cijk_Ailk_Bljk_HB_MT32x32x32_MI16x16x16x1_SN_1LDSB1_AMAS0_GRVW8_IU2_NLCA1_SIA2_SU32_SUS256_SVW1_TT1_16_VW1_WGM4
    SolutionIndex: 81
    SolutionNameMin: Cijk_Ailk_Bljk_HB_MT32x32x32_MI16x16x16x1_SN_1LDSB0_AMAS0_GRVW2_IU1_NLCA1_SIA1_SU0_SUS0_SVW1_TT1_16_VW1_WGM8
    SolutionIndex: 82
    SolutionNameMin: Cijk_Ailk_Bljk_HB_MT32x32x32_MI16x16x16x1_SN_1LDSB0_AMAS0_GRVW4_IU1_NLCA1_SIA1_SU0_SUS0_SVW1_TT1_16_VW1_WGM8
    SolutionIndex: 83
    SolutionNameMin: Cijk_Ailk_Bljk_HB_MT32x32x32_MI16x16x16x1_SN_1LDSB0_AMAS0_GRVW8_IU1_NLCA1_SIA1_SU0_SUS0_SVW1_TT1_16_VW1_WGM8
    SolutionIndex: 84
    SolutionNameMin: Cijk_Ailk_Bljk_HB_MT32x32x32_MI16x16x16x1_SN_1LDSB1_AMAS0_GRVW2_IU2_NLCA1_SIA2_SU0_SUS0_SVW1_TT1_16_VW1_WGM8
    SolutionIndex: 85
    SolutionNameMin: Cijk_Ailk_Bljk_HB_MT32x32x32_MI16x16x16x1_SN_1LDSB1_AMAS0_GRVW4_IU2_NLCA1_SIA2_SU0_SUS0_SVW1_TT1_16_VW1_WGM8
    SolutionIndex: 86
    SolutionNameMin: Cijk_Ailk_Bljk_HB_MT32x32x32_MI16x16x16x1_SN_1LDSB1_AMAS0_GRVW8_IU2_NLCA1_SIA2_SU0_SUS0_SVW1_TT1_16_VW1_WGM8
    SolutionIndex: 87
    SolutionNameMin: Cijk_Ailk_Bljk_HB_MT32x32x32_MI16x16x16x1_SN_1LDSB0_AMAS0_GRVW8_IU1_NLCA1_SIA3_SU0_SUS0_SVW1_TT1_16_VW1_WGM8
    SolutionIndex: 88
    SolutionNameMin: Cijk_Ailk_Bljk_HB_MT32x32x32_MI16x16x16x1_SN_1LDSB0_AMAS0_GRVW2_IU1_NLCA1_SIA1_SU32_SUS128_SVW1_TT1_16_VW1_WGM8
    SolutionIndex: 89
    SolutionNameMin: Cijk_Ailk_Bljk_HB_MT32x32x32_MI16x16x16x1_SN_1LDSB0_AMAS0_GRVW8_IU1_NLCA1_SIA1_SU32_SUS128_SVW1_TT1_16_VW1_WGM8
    SolutionIndex: 90
    SolutionNameMin: Cijk_Ailk_Bljk_HB_MT32x32x32_MI16x16x16x1_SN_1LDSB1_AMAS0_GRVW2_IU2_NLCA1_SIA2_SU32_SUS128_SVW1_TT1_16_VW1_WGM8
    SolutionIndex: 91
    SolutionNameMin: Cijk_Ailk_Bljk_HB_MT32x32x32_MI16x16x16x1_SN_1LDSB1_AMAS0_GRVW4_IU2_NLCA1_SIA2_SU32_SUS128_SVW1_TT1_16_VW1_WGM8
    SolutionIndex: 92
    SolutionNameMin: Cijk_Ailk_Bljk_HB_MT32x32x32_MI16x16x16x1_SN_1LDSB1_AMAS0_GRVW8_IU2_NLCA1_SIA2_SU32_SUS128_SVW1_TT1_16_VW1_WGM8
    SolutionIndex: 93
    SolutionNameMin: Cijk_Ailk_Bljk_HB_MT32x32x32_MI16x16x16x1_SN_1LDSB0_AMAS0_GRVW4_IU1_NLCA1_SIA3_SU32_SUS128_SVW1_TT1_16_VW1_WGM8
    SolutionIndex: 94
    SolutionNameMin: Cijk_Ailk_Bljk_HB_MT32x32x32_MI16x16x16x1_SN_1LDSB1_AMAS0_GRVW2_IU2_NLCA1_SIA2_SU32_SUS256_SVW1_TT1_16_VW1_WGM8
    SolutionIndex: 95
    SolutionNameMin: Cijk_Ailk_Bljk_HB_MT32x32x32_MI16x16x16x1_SN_1LDSB1_AMAS0_GRVW4_IU2_NLCA1_SIA2_SU32_SUS256_SVW1_TT1_16_VW1_WGM8
    SolutionIndex: 96
    SolutionNameMin: Cijk_Ailk_Bljk_HB_MT32x32x32_MI16x16x16x1_SN_1LDSB1_AMAS0_GRVW8_IU2_NLCA1_SIA2_SU32_SUS256_SVW1_TT1_16_VW1_WGM8
    SolutionIndex: 97
    SolutionNameMin: Cijk_Ailk_Bljk_HB_MT32x32x32_MI16x16x16x1_SN_1LDSB0_AMAS0_GRVW8_IU1_NLCA1_SIA3_SU32_SUS256_SVW1_TT1_16_VW1_WGM8
    SolutionIndex: 98
    SolutionNameMin: Cijk_Ailk_Bljk_HB_MT64x64x32_MI16x16x16x1_SN_1LDSB0_AMAS0_GRVW4_IU1_NLCA1_SIA1_SU0_SUS0_SVW1_TT2_32_VW1_WGM4
    SolutionIndex: 99
    SolutionNameMin: Cijk_Ailk_Bljk_HB_MT64x64x32_MI16x16x16x1_SN_1LDSB0_AMAS3_GRVW4_IU1_NLCA1_SIA1_SU0_SUS0_SVW2_TT2_32_VW2_WGM4
    SolutionIndex: 100
    SolutionNameMin: Cijk_Ailk_Bljk_HB_MT64x64x32_MI16x16x16x1_SN_1LDSB0_AMAS0_GRVW8_IU1_NLCA1_SIA1_SU0_SUS0_SVW1_TT2_32_VW1_WGM4
    SolutionIndex: 101
    SolutionNameMin: Cijk_Ailk_Bljk_HB_MT64x64x32_MI16x16x16x1_SN_1LDSB0_AMAS3_GRVW8_IU1_NLCA1_SIA1_SU0_SUS0_SVW2_TT2_32_VW2_WGM4
    SolutionIndex: 102
    SolutionNameMin: Cijk_Ailk_Bljk_HB_MT64x64x32_MI16x16x16x1_SN_1LDSB1_AMAS3_GRVW4_IU2_NLCA1_SIA2_SU0_SUS0_SVW2_TT2_32_VW2_WGM4
    SolutionIndex: 103
    SolutionNameMin: Cijk_Ailk_Bljk_HB_MT64x64x32_MI16x16x16x1_SN_1LDSB1_AMAS0_GRVW8_IU2_NLCA1_SIA2_SU0_SUS0_SVW1_TT2_32_VW1_WGM4
    SolutionIndex: 104
    SolutionNameMin: Cijk_Ailk_Bljk_HB_MT64x64x32_MI16x16x16x1_SN_1LDSB1_AMAS3_GRVW8_IU2_NLCA1_SIA2_SU0_SUS0_SVW2_TT2_32_VW2_WGM4
    SolutionIndex: 105
    SolutionNameMin: Cijk_Ailk_Bljk_HB_MT64x64x32_MI16x16x16x1_SN_1LDSB0_AMAS3_GRVW8_IU1_NLCA1_SIA3_SU0_SUS0_SVW2_TT2_32_VW2_WGM4
    SolutionIndex: 106
    SolutionNameMin: Cijk_Ailk_Bljk_HB_MT64x64x32_MI16x16x16x1_SN_1LDSB0_AMAS0_GRVW4_IU1_NLCA1_SIA1_SU32_SUS128_SVW1_TT2_32_VW1_WGM4
    SolutionIndex: 107
    SolutionNameMin: Cijk_Ailk_Bljk_HB_MT64x64x32_MI16x16x16x1_SN_1LDSB0_AMAS0_GRVW8_IU1_NLCA1_SIA1_SU32_SUS128_SVW1_TT2_32_VW1_WGM4
    SolutionIndex: 108
    SolutionNameMin: Cijk_Ailk_Bljk_HB_MT64x64x32_MI16x16x16x1_SN_1LDSB0_AMAS3_GRVW8_IU1_NLCA1_SIA1_SU32_SUS128_SVW2_TT2_32_VW2_WGM4
    SolutionIndex: 109
    SolutionNameMin: Cijk_Ailk_Bljk_HB_MT64x64x32_MI16x16x16x1_SN_1LDSB1_AMAS0_GRVW4_IU2_NLCA1_SIA2_SU32_SUS128_SVW1_TT2_32_VW1_WGM4
    SolutionIndex: 110
    SolutionNameMin: Cijk_Ailk_Bljk_HB_MT64x64x32_MI16x16x16x1_SN_1LDSB1_AMAS3_GRVW4_IU2_NLCA1_SIA2_SU32_SUS128_SVW2_TT2_32_VW2_WGM4
    SolutionIndex: 111
    SolutionNameMin: Cijk_Ailk_Bljk_HB_MT64x64x32_MI16x16x16x1_SN_1LDSB1_AMAS0_GRVW8_IU2_NLCA1_SIA2_SU32_SUS128_SVW1_TT2_32_VW1_WGM4
    SolutionIndex: 112
    SolutionNameMin: Cijk_Ailk_Bljk_HB_MT64x64x32_MI16x16x16x1_SN_1LDSB1_AMAS3_GRVW8_IU2_NLCA1_SIA2_SU32_SUS128_SVW2_TT2_32_VW2_WGM4
    SolutionIndex: 113
    SolutionNameMin: Cijk_Ailk_Bljk_HB_MT64x64x32_MI16x16x16x1_SN_1LDSB0_AMAS3_GRVW8_IU1_NLCA1_SIA3_SU32_SUS128_SVW2_TT2_32_VW2_WGM4
    SolutionIndex: 114
    SolutionNameMin: Cijk_Ailk_Bljk_HB_MT64x64x32_MI16x16x16x1_SN_1LDSB1_AMAS0_GRVW4_IU2_NLCA1_SIA2_SU32_SUS256_SVW1_TT2_32_VW1_WGM4
    SolutionIndex: 115
    SolutionNameMin: Cijk_Ailk_Bljk_HB_MT64x64x32_MI16x16x16x1_SN_1LDSB1_AMAS3_GRVW4_IU2_NLCA1_SIA2_SU32_SUS256_SVW2_TT2_32_VW2_WGM4
    SolutionIndex: 116
    SolutionNameMin: Cijk_Ailk_Bljk_HB_MT64x64x32_MI16x16x16x1_SN_1LDSB1_AMAS0_GRVW8_IU2_NLCA1_SIA2_SU32_SUS256_SVW1_TT2_32_VW1_WGM4
    SolutionIndex: 117
    SolutionNameMin: Cijk_Ailk_Bljk_HB_MT64x64x32_MI16x16x16x1_SN_1LDSB1_AMAS3_GRVW8_IU2_NLCA1_SIA2_SU32_SUS256_SVW2_TT2_32_VW2_WGM4
    SolutionIndex: 118
    SolutionNameMin: Cijk_Ailk_Bljk_HB_MT64x64x32_MI16x16x16x1_SN_1LDSB0_AMAS0_GRVW8_IU1_NLCA1_SIA3_SU32_SUS256_SVW1_TT2_32_VW1_WGM4
    SolutionIndex: 119
    SolutionNameMin: Cijk_Ailk_Bljk_HB_MT64x64x32_MI16x16x16x1_SN_1LDSB0_AMAS3_GRVW8_IU1_NLCA1_SIA3_SU32_SUS256_SVW2_TT2_32_VW2_WGM4
    SolutionIndex: 120
    SolutionNameMin: Cijk_Ailk_Bljk_HB_MT64x64x32_MI16x16x16x1_SN_1LDSB0_AMAS0_GRVW4_IU1_NLCA1_SIA1_SU0_SUS0_SVW1_TT2_32_VW1_WGM8
    SolutionIndex: 121
    SolutionNameMin: Cijk_Ailk_Bljk_HB_MT64x64x32_MI16x16x16x1_SN_1LDSB0_AMAS3_GRVW4_IU1_NLCA1_SIA1_SU0_SUS0_SVW2_TT2_32_VW2_WGM8
    SolutionIndex: 122
    SolutionNameMin: Cijk_Ailk_Bljk_HB_MT64x64x32_MI16x16x16x1_SN_1LDSB0_AMAS0_GRVW8_IU1_NLCA1_SIA1_SU0_SUS0_SVW1_TT2_32_VW1_WGM8
    SolutionIndex: 123
    SolutionNameMin: Cijk_Ailk_Bljk_HB_MT64x64x32_MI16x16x16x1_SN_1LDSB0_AMAS3_GRVW8_IU1_NLCA1_SIA1_SU0_SUS0_SVW2_TT2_32_VW2_WGM8
    SolutionIndex: 124
    SolutionNameMin: Cijk_Ailk_Bljk_HB_MT64x64x32_MI16x16x16x1_SN_1LDSB1_AMAS0_GRVW4_IU2_NLCA1_SIA2_SU0_SUS0_SVW1_TT2_32_VW1_WGM8
    SolutionIndex: 125
    SolutionNameMin: Cijk_Ailk_Bljk_HB_MT64x64x32_MI16x16x16x1_SN_1LDSB1_AMAS3_GRVW4_IU2_NLCA1_SIA2_SU0_SUS0_SVW2_TT2_32_VW2_WGM8
    SolutionIndex: 126
    SolutionNameMin: Cijk_Ailk_Bljk_HB_MT64x64x32_MI16x16x16x1_SN_1LDSB1_AMAS0_GRVW8_IU2_NLCA1_SIA2_SU0_SUS0_SVW1_TT2_32_VW1_WGM8
    SolutionIndex: 127
    SolutionNameMin: Cijk_Ailk_Bljk_HB_MT64x64x32_MI16x16x16x1_SN_1LDSB1_AMAS3_GRVW8_IU2_NLCA1_SIA2_SU0_SUS0_SVW2_TT2_32_VW2_WGM8
    SolutionIndex: 128
    SolutionNameMin: Cijk_Ailk_Bljk_HB_MT64x64x32_MI16x16x16x1_SN_1LDSB0_AMAS0_GRVW4_IU1_NLCA1_SIA3_SU0_SUS0_SVW1_TT2_32_VW1_WGM8
    SolutionIndex: 129
    SolutionNameMin: Cijk_Ailk_Bljk_HB_MT64x64x32_MI16x16x16x1_SN_1LDSB0_AMAS3_GRVW4_IU1_NLCA1_SIA3_SU0_SUS0_SVW2_TT2_32_VW2_WGM8
    SolutionIndex: 130
    SolutionNameMin: Cijk_Ailk_Bljk_HB_MT64x64x32_MI16x16x16x1_SN_1LDSB0_AMAS0_GRVW8_IU1_NLCA1_SIA3_SU0_SUS0_SVW1_TT2_32_VW1_WGM8
    SolutionIndex: 131
    SolutionNameMin: Cijk_Ailk_Bljk_HB_MT64x64x32_MI16x16x16x1_SN_1LDSB0_AMAS3_GRVW8_IU1_NLCA1_SIA3_SU0_SUS0_SVW2_TT2_32_VW2_WGM8
    SolutionIndex: 132
    SolutionNameMin: Cijk_Ailk_Bljk_HB_MT64x64x32_MI16x16x16x1_SN_1LDSB0_AMAS3_GRVW4_IU1_NLCA1_SIA1_SU32_SUS128_SVW2_TT2_32_VW2_WGM8
    SolutionIndex: 133
    SolutionNameMin: Cijk_Ailk_Bljk_HB_MT64x64x32_MI16x16x16x1_SN_1LDSB0_AMAS0_GRVW8_IU1_NLCA1_SIA1_SU32_SUS128_SVW1_TT2_32_VW1_WGM8
    SolutionIndex: 134
    SolutionNameMin: Cijk_Ailk_Bljk_HB_MT64x64x32_MI16x16x16x1_SN_1LDSB0_AMAS3_GRVW8_IU1_NLCA1_SIA1_SU32_SUS128_SVW2_TT2_32_VW2_WGM8
    SolutionIndex: 135
    SolutionNameMin: Cijk_Ailk_Bljk_HB_MT64x64x32_MI16x16x16x1_SN_1LDSB1_AMAS0_GRVW4_IU2_NLCA1_SIA2_SU32_SUS128_SVW1_TT2_32_VW1_WGM8
    SolutionIndex: 136
    SolutionNameMin: Cijk_Ailk_Bljk_HB_MT64x64x32_MI16x16x16x1_SN_1LDSB1_AMAS0_GRVW8_IU2_NLCA1_SIA2_SU32_SUS128_SVW1_TT2_32_VW1_WGM8
    SolutionIndex: 137
    SolutionNameMin: Cijk_Ailk_Bljk_HB_MT64x64x32_MI16x16x16x1_SN_1LDSB1_AMAS3_GRVW8_IU2_NLCA1_SIA2_SU32_SUS128_SVW2_TT2_32_VW2_WGM8
    SolutionIndex: 138
    SolutionNameMin: Cijk_Ailk_Bljk_HB_MT64x64x32_MI16x16x16x1_SN_1LDSB0_AMAS3_GRVW8_IU1_NLCA1_SIA3_SU32_SUS128_SVW2_TT2_32_VW2_WGM8
    SolutionIndex: 139
    SolutionNameMin: Cijk_Ailk_Bljk_HB_MT64x64x32_MI16x16x16x1_SN_1LDSB0_AMAS0_GRVW4_IU1_NLCA1_SIA1_SU32_SUS256_SVW1_TT2_32_VW1_WGM8
    SolutionIndex: 140
    SolutionNameMin: Cijk_Ailk_Bljk_HB_MT64x64x32_MI16x16x16x1_SN_1LDSB0_AMAS3_GRVW4_IU1_NLCA1_SIA1_SU32_SUS256_SVW2_TT2_32_VW2_WGM8
    SolutionIndex: 141
    SolutionNameMin: Cijk_Ailk_Bljk_HB_MT64x64x32_MI16x16x16x1_SN_1LDSB0_AMAS0_GRVW8_IU1_NLCA1_SIA1_SU32_SUS256_SVW1_TT2_32_VW1_WGM8
    SolutionIndex: 142
    SolutionNameMin: Cijk_Ailk_Bljk_HB_MT64x64x32_MI16x16x16x1_SN_1LDSB0_AMAS3_GRVW8_IU1_NLCA1_SIA1_SU32_SUS256_SVW2_TT2_32_VW2_WGM8
    SolutionIndex: 143
    SolutionNameMin: Cijk_Ailk_Bljk_HB_MT64x64x32_MI16x16x16x1_SN_1LDSB1_AMAS0_GRVW8_IU2_NLCA1_SIA2_SU32_SUS256_SVW1_TT2_32_VW1_WGM8
    SolutionIndex: 144
    SolutionNameMin: Cijk_Ailk_Bljk_HB_MT64x64x32_MI16x16x16x1_SN_1LDSB1_AMAS3_GRVW8_IU2_NLCA1_SIA2_SU32_SUS256_SVW2_TT2_32_VW2_WGM8
    SolutionIndex: 145
    SolutionNameMin: Cijk_Ailk_Bljk_HB_MT64x64x32_MI16x16x16x1_SN_1LDSB0_AMAS0_GRVW8_IU1_NLCA1_SIA3_SU32_SUS256_SVW1_TT2_32_VW1_WGM8
    SolutionIndex: 146
    SolutionNameMin: Cijk_Ailk_Bljk_HB_MT64x64x32_MI16x16x16x1_SN_1LDSB0_AMAS3_GRVW8_IU1_NLCA1_SIA3_SU32_SUS256_SVW2_TT2_32_VW2_WGM8
- - - [64, 64, 1, 64, 96, 96, 96, 96]
    - [0, 0.041]
  - - [64, 64, 1, 128, 96, 96, 160, 160]
    - [0, 0.078]
  - - [64, 64, 1, 256, 96, 96, 288, 288]
    - [86, 0.151]
  - - [64, 64, 1, 512, 96, 96, 544, 544]
    - [96, 0.269]
  - - [64, 64, 1, 1024, 96, 96, 1056, 1056]
    - [85, 0.438]
  - - [64, 64, 1, 2048, 96, 96, 2080, 2080]
    - [91, 0.633]
  - - [64, 64, 1, 4096, 96, 96, 4128, 4128]
    - [95, 0.814]
  - - [64, 64, 1, 8192, 96, 96, 8224, 8224]
    - [69, 0.932]
  - - [64, 128, 1, 64, 96, 96, 96, 96]
    - [69, 0.087]
  - - [64, 128, 1, 128, 96, 96, 160, 160]
    - [86, 0.168]
  - - [64, 128, 1, 256, 96, 96, 288, 288]
    - [68, 0.315]
  - - [64, 128, 1, 512, 96, 96, 544, 544]
    - [80, 0.552]
  - - [64, 128, 1, 1024, 96, 96, 1056, 1056]
    - [73, 0.891]
  - - [64, 128, 1, 2048, 96, 96, 2080, 2080]
    - [79, 1.279]
  - - [64, 128, 1, 4096, 96, 96, 4128, 4128]
    - [73, 1.64]
  - - [64, 128, 1, 8192, 96, 96, 8224, 8224]
    - [90, 1.914]
  - - [64, 256, 1, 64, 96, 96, 96, 96]
    - [92, 0.177]
  - - [64, 256, 1, 128, 96, 96, 160, 160]
    - [73, 0.339]
  - - [64, 256, 1, 256, 96, 96, 288, 288]
    - [79, 0.633]
  - - [64, 256, 1, 512, 96, 96, 544, 544]
    - [74, 1.111]
  - - [64, 256, 1, 1024, 96, 96, 1056, 1056]
    - [79, 1.798]
  - - [64, 256, 1, 2048, 96, 96, 2080, 2080]
    - [85, 2.573]
  - - [64, 256, 1, 4096, 96, 96, 4128, 4128]
    - [91, 3.289]
  - - [64, 256, 1, 8192, 96, 96, 8224, 8224]
    - [84, 3.799]
  - - [64, 512, 1, 64, 96, 96, 96, 96]
    - [3, 0.345]
  - - [64, 512, 1, 128, 96, 96, 160, 160]
    - [67, 0.471]
  - - [64, 512, 1, 256, 96, 96, 288, 288]
    - [86, 1.272]
  - - [64, 512, 1, 512, 96, 96, 544, 544]
    - [92, 2.238]
  - - [64, 512, 1, 1024, 96, 96, 1056, 1056]
    - [96, 3.593]
  - - [64, 512, 1, 2048, 96, 96, 2080, 2080]
    - [86, 5.145]
  - - [64, 512, 1, 4096, 96, 96, 4128, 4128]
    - [90, 6.574]
  - - [64, 512, 1, 8192, 96, 96, 8224, 8224]
    - [95, 7.642]
  - - [64, 1024, 1, 64, 96, 96, 96, 96]
    - [85, 0.703]
  - - [64, 1024, 1, 128, 96, 96, 160, 160]
    - [84, 1.339]
  - - [64, 1024, 1, 256, 96, 96, 288, 288]
    - [95, 2.474]
  - - [64, 1024, 1, 512, 96, 96, 544, 544]
    - [73, 4.279]
  - - [64, 1024, 1, 1024, 96, 96, 1056, 1056]
    - [67, 6.821]
  - - [64, 1024, 1, 2048, 96, 96, 2080, 2080]
    - [85, 9.59]
  - - [64, 1024, 1, 4096, 96, 96, 4128, 4128]
    - [72, 12.002]
  - - [64, 1024, 1, 8192, 96, 96, 8224, 8224]
    - [94, 13.542]
  - - [64, 2048, 1, 64, 96, 96, 96, 96]
    - [93, 1.386]
  - - [64, 2048, 1, 128, 96, 96, 160, 160]
    - [68, 2.606]
  - - [64, 2048, 1, 256, 96, 96, 288, 288]
    - [65, 4.698]
  - - [64, 2048, 1, 512, 96, 96, 544, 544]
    - [82, 7.925]
  - - [64, 2048, 1, 1024, 96, 96, 1056, 1056]
    - [66, 11.96]
  - - [64, 2048, 1, 2048, 96, 96, 2080, 2080]
    - [83, 16.159]
  - - [64, 2048, 1, 4096, 96, 96, 4128, 4128]
    - [81, 18.791]
  - - [64, 2048, 1, 8192, 96, 96, 8224, 8224]
    - [83, 21.629]
  - - [64, 4096, 1, 64, 96, 96, 96, 96]
    - [15, 2.628]
  - - [64, 4096, 1, 128, 96, 96, 160, 160]
    - [12, 4.869]
  - - [64, 4096, 1, 256, 96, 96, 288, 288]
    - [133, 8.533]
  - - [64, 4096, 1, 512, 96, 96, 544, 544]
    - [106, 13.726]
  - - [64, 4096, 1, 1024, 96, 96, 1056, 1056]
    - [141, 19.877]
  - - [64, 4096, 1, 2048, 96, 96, 2080, 2080]
    - [141, 25.639]
  - - [64, 4096, 1, 4096, 96, 96, 4128, 4128]
    - [123, 29.575]
  - - [64, 4096, 1, 8192, 96, 96, 8224, 8224]
    - [123, 32.647]
  - - [64, 8192, 1, 64, 96, 96, 96, 96]
    - [129, 4.981]
  - - [64, 8192, 1, 128, 96, 96, 160, 160]
    - [126, 9.079]
  - - [64, 8192, 1, 256, 96, 96, 288, 288]
    - [127, 15.204]
  - - [64, 8192, 1, 512, 96, 96, 544, 544]
    - [136, 23.095]
  - - [64, 8192, 1, 1024, 96, 96, 1056, 1056]
    - [124, 31.006]
  - - [64, 8192, 1, 2048, 96, 96, 2080, 2080]
    - [143, 37.035]
  - - [64, 8192, 1, 4096, 96, 96, 4128, 4128]
    - [135, 41.645]
  - - [64, 8192, 1, 8192, 96, 96, 8224, 8224]
    - [104, 28.307]
  - - [128, 64, 1, 64, 160, 160, 128, 96]
    - [2, 0.087]
  - - [128, 64, 1, 128, 160, 160, 160, 160]
    - [92, 0.168]
  - - [128, 64, 1, 256, 160, 160, 288, 288]
    - [92, 0.313]
  - - [128, 64, 1, 512, 160, 160, 544, 544]
    - [92, 0.553]
  - - [128, 64, 1, 1024, 160, 160, 1056, 1056]
    - [85, 0.894]
  - - [128, 64, 1, 2048, 160, 160, 2080, 2080]
    - [68, 1.283]
  - - [128, 64, 1, 4096, 160, 160, 4128, 4128]
    - [73, 1.642]
  - - [128, 64, 1, 8192, 160, 160, 8224, 8224]
    - [68, 1.899]
  - - [128, 128, 1, 64, 160, 160, 128, 96]
    - [83, 0.176]
  - - [128, 128, 1, 128, 160, 160, 160, 160]
    - [85, 0.339]
  - - [128, 128, 1, 256, 160, 160, 288, 288]
    - [80, 0.633]
  - - [128, 128, 1, 512, 160, 160, 544, 544]
    - [73, 1.109]
  - - [128, 128, 1, 1024, 160, 160, 1056, 1056]
    - [94, 1.791]
  - - [128, 128, 1, 2048, 160, 160, 2080, 2080]
    - [73, 2.577]
  - - [128, 128, 1, 4096, 160, 160, 4128, 4128]
    - [85, 3.289]
  - - [128, 128, 1, 8192, 160, 160, 8224, 8224]
    - [79, 3.803]
  - - [128, 256, 1, 64, 160, 160, 128, 96]
    - [83, 0.351]
  - - [128, 256, 1, 128, 160, 160, 160, 160]
    - [92, 0.687]
  - - [128, 256, 1, 256, 160, 160, 288, 288]
    - [91, 1.274]
  - - [128, 256, 1, 512, 160, 160, 544, 544]
    - [79, 2.236]
  - - [128, 256, 1, 1024, 160, 160, 1056, 1056]
    - [78, 3.6]
  - - [128, 256, 1, 2048, 160, 160, 2080, 2080]
    - [78, 5.166]
  - - [128, 256, 1, 4096, 160, 160, 4128, 4128]
    - [84, 6.589]
  - - [128, 256, 1, 8192, 160, 160, 8224, 8224]
    - [68, 7.619]
  - - [128, 512, 1, 64, 160, 160, 128, 96]
    - [74, 0.703]
  - - [128, 512, 1, 128, 160, 160, 160, 160]
    - [96, 1.341]
  - - [128, 512, 1, 256, 160, 160, 288, 288]
    - [91, 2.497]
  - - [128, 512, 1, 512, 160, 160, 544, 544]
    - [85, 4.318]
  - - [128, 512, 1, 1024, 160, 160, 1056, 1056]
    - [85, 6.816]
  - - [128, 512, 1, 2048, 160, 160, 2080, 2080]
    - [67, 9.574]
  - - [128, 512, 1, 4096, 160, 160, 4128, 4128]
    - [95, 11.97]
  - - [128, 512, 1, 8192, 160, 160, 8224, 8224]
    - [85, 13.562]
  - - [128, 1024, 1, 64, 160, 160, 128, 96]
    - [70, 1.389]
  - - [128, 1024, 1, 128, 160, 160, 160, 160]
    - [71, 2.605]
  - - [128, 1024, 1, 256, 160, 160, 288, 288]
    - [89, 4.697]
  - - [128, 1024, 1, 512, 160, 160, 544, 544]
    - [65, 7.888]
  - - [128, 1024, 1, 1024, 160, 160, 1056, 1056]
    - [136, 11.173]
  - - [128, 1024, 1, 2048, 160, 160, 2080, 2080]
    - [66, 16.203]
  - - [128, 1024, 1, 4096, 160, 160, 4128, 4128]
    - [64, 19.262]
  - - [128, 1024, 1, 8192, 160, 160, 8224, 8224]
    - [66, 21.732]
  - - [128, 2048, 1, 64, 160, 160, 128, 96]
    - [103, 2.662]
  - - [128, 2048, 1, 128, 160, 160, 160, 160]
    - [139, 4.894]
  - - [128, 2048, 1, 256, 160, 160, 288, 288]
    - [120, 8.662]
  - - [128, 2048, 1, 512, 160, 160, 544, 544]
    - [120, 13.999]
  - - [128, 2048, 1, 1024, 160, 160, 1056, 1056]
    - [108, 19.835]
  - - [128, 2048, 1, 2048, 160, 160, 2080, 2080]
    - [121, 25.972]
  - - [128, 2048, 1, 4096, 160, 160, 4128, 4128]
    - [123, 29.92]
  - - [128, 2048, 1, 8192, 160, 160, 8224, 8224]
    - [122, 33.132]
  - - [128, 4096, 1, 64, 160, 160, 128, 96]
    - [19, 5.038]
  - - [128, 4096, 1, 128, 160, 160, 160, 160]
    - [16, 9.148]
  - - [128, 4096, 1, 256, 160, 160, 288, 288]
    - [127, 15.349]
  - - [128, 4096, 1, 512, 160, 160, 544, 544]
    - [118, 23.104]
  - - [128, 4096, 1, 1024, 160, 160, 1056, 1056]
    - [111, 31.121]
  - - [128, 4096, 1, 2048, 160, 160, 2080, 2080]
    - [5, 37.519]
  - - [128, 4096, 1, 4096, 160, 160, 4128, 4128]
    - [13, 42.097]
  - - [128, 4096, 1, 8192, 160, 160, 8224, 8224]
    - [6, 43.041]
  - - [128, 8192, 1, 64, 160, 160, 128, 96]
    - [18, 8.714]
  - - [128, 8192, 1, 128, 160, 160, 160, 160]
    - [111, 15.087]
  - - [128, 8192, 1, 256, 160, 160, 288, 288]
    - [141, 23.558]
  - - [128, 8192, 1, 512, 160, 160, 544, 544]
    - [20, 33.699]
  - - [128, 8192, 1, 1024, 160, 160, 1056, 1056]
    - [20, 43.348]
  - - [128, 8192, 1, 2048, 160, 160, 2080, 2080]
    - [36, 50.36]
  - - [128, 8192, 1, 4096, 160, 160, 4128, 4128]
    - [31, 52.616]
  - - [128, 8192, 1, 8192, 160, 160, 8224, 8224]
    - [110, 46.599]
  - - [256, 64, 1, 64, 288, 288, 256, 96]
    - [4, 0.176]
  - - [256, 64, 1, 128, 288, 288, 256, 160]
    - [73, 0.341]
  - - [256, 64, 1, 256, 288, 288, 288, 288]
    - [96, 0.638]
  - - [256, 64, 1, 512, 288, 288, 544, 544]
    - [69, 1.121]
  - - [256, 64, 1, 1024, 288, 288, 1056, 1056]
    - [68, 1.794]
  - - [256, 64, 1, 2048, 288, 288, 2080, 2080]
    - [91, 2.579]
  - - [256, 64, 1, 4096, 288, 288, 4128, 4128]
    - [85, 3.302]
  - - [256, 64, 1, 8192, 288, 288, 8224, 8224]
    - [85, 3.821]
  - - [256, 128, 1, 64, 288, 288, 256, 96]
    - [66, 0.357]
  - - [256, 128, 1, 128, 288, 288, 256, 160]
    - [74, 0.689]
  - - [256, 128, 1, 256, 288, 288, 288, 288]
    - [85, 1.276]
  - - [256, 128, 1, 512, 288, 288, 544, 544]
    - [94, 2.238]
  - - [256, 128, 1, 1024, 288, 288, 1056, 1056]
    - [91, 3.615]
  - - [256, 128, 1, 2048, 288, 288, 2080, 2080]
    - [85, 5.176]
  - - [256, 128, 1, 4096, 288, 288, 4128, 4128]
    - [91, 6.639]
  - - [256, 128, 1, 8192, 288, 288, 8224, 8224]
    - [68, 7.675]
  - - [256, 256, 1, 64, 288, 288, 256, 96]
    - [68, 0.704]
  - - [256, 256, 1, 128, 288, 288, 256, 160]
    - [85, 1.341]
  - - [256, 256, 1, 256, 288, 288, 288, 288]
    - [96, 2.492]
  - - [256, 256, 1, 512, 288, 288, 544, 544]
    - [95, 4.297]
  - - [256, 256, 1, 1024, 288, 288, 1056, 1056]
    - [85, 6.832]
  - - [256, 256, 1, 2048, 288, 288, 2080, 2080]
    - [67, 9.569]
  - - [256, 256, 1, 4096, 288, 288, 4128, 4128]
    - [85, 12.002]
  - - [256, 256, 1, 8192, 288, 288, 8224, 8224]
    - [73, 13.519]
  - - [256, 512, 1, 64, 288, 288, 256, 96]
    - [75, 1.369]
  - - [256, 512, 1, 128, 288, 288, 256, 160]
    - [80, 2.611]
  - - [256, 512, 1, 256, 288, 288, 288, 288]
    - [74, 4.689]
  - - [256, 512, 1, 512, 288, 288, 544, 544]
    - [76, 7.873]
  - - [256, 512, 1, 1024, 288, 288, 1056, 1056]
    - [77, 11.844]
  - - [256, 512, 1, 2048, 288, 288, 2080, 2080]
    - [83, 15.94]
  - - [256, 512, 1, 4096, 288, 288, 4128, 4128]
    - [88, 18.621]
  - - [256, 512, 1, 8192, 288, 288, 8224, 8224]
    - [82, 21.214]
  - - [256, 1024, 1, 64, 288, 288, 256, 96]
    - [8, 2.639]
  - - [256, 1024, 1, 128, 288, 288, 256, 160]
    - [108, 4.92]
  - - [256, 1024, 1, 256, 288, 288, 288, 288]
    - [99, 8.727]
  - - [256, 1024, 1, 512, 288, 288, 544, 544]
    - [99, 14.043]
  - - [256, 1024, 1, 1024, 288, 288, 1056, 1056]
    - [98, 20.453]
  - - [256, 1024, 1, 2048, 288, 288, 2080, 2080]
    - [98, 26.134]
  - - [256, 1024, 1, 4096, 288, 288, 4128, 4128]
    - [101, 29.575]
  - - [256, 1024, 1, 8192, 288, 288, 8224, 8224]
    - [101, 33.348]
  - - [256, 2048, 1, 64, 288, 288, 256, 96]
    - [134, 5.063]
  - - [256, 2048, 1, 128, 288, 288, 256, 160]
    - [105, 9.146]
  - - [256, 2048, 1, 256, 288, 288, 288, 288]
    - [14, 15.349]
  - - [256, 2048, 1, 512, 288, 288, 544, 544]
    - [145, 23.355]
  - - [256, 2048, 1, 1024, 288, 288, 1056, 1056]
    - [5, 30.983]
  - - [256, 2048, 1, 2048, 288, 288, 2080, 2080]
    - [109, 36.752]
  - - [256, 2048, 1, 4096, 288, 288, 4128, 4128]
    - [100, 41.545]
  - - [256, 2048, 1, 8192, 288, 288, 8224, 8224]
    - [122, 43.283]
  - - [256, 4096, 1, 64, 288, 288, 256, 96]
    - [18, 8.736]
  - - [256, 4096, 1, 128, 288, 288, 256, 160]
    - [103, 14.887]
  - - [256, 4096, 1, 256, 288, 288, 288, 288]
    - [61, 23.482]
  - - [256, 4096, 1, 512, 288, 288, 544, 544]
    - [38, 34.037]
  - - [256, 4096, 1, 1024, 288, 288, 1056, 1056]
    - [53, 43.497]
  - - [256, 4096, 1, 2048, 288, 288, 2080, 2080]
    - [58, 50.477]
  - - [256, 4096, 1, 4096, 288, 288, 4128, 4128]
    - [20, 53.145]
  - - [256, 4096, 1, 8192, 288, 288, 8224, 8224]
    - [20, 55.078]
  - - [256, 8192, 1, 64, 288, 288, 256, 96]
    - [8, 14.62]
  - - [256, 8192, 1, 128, 288, 288, 256, 160]
    - [25, 24.05]
  - - [256, 8192, 1, 256, 288, 288, 288, 288]
    - [47, 36.586]
  - - [256, 8192, 1, 512, 288, 288, 544, 544]
    - [23, 48.503]
  - - [256, 8192, 1, 1024, 288, 288, 1056, 1056]
    - [21, 57.251]
  - - [256, 8192, 1, 2048, 288, 288, 2080, 2080]
    - [55, 57.896]
  - - [256, 8192, 1, 4096, 288, 288, 4128, 4128]
    - [26, 63.589]
  - - [256, 8192, 1, 8192, 288, 288, 8224, 8224]
    - [63, 61.24]
  - - [384, 64, 1, 64, 416, 416, 384, 96]
    - [1, 0.266]
  - - [384, 64, 1, 128, 416, 416, 384, 160]
    - [86, 0.513]
  - - [384, 64, 1, 256, 416, 416, 384, 288]
    - [80, 0.967]
  - - [384, 64, 1, 512, 416, 416, 544, 544]
    - [96, 1.679]
  - - [384, 64, 1, 1024, 416, 416, 1056, 1056]
    - [72, 2.702]
  - - [384, 64, 1, 2048, 416, 416, 2080, 2080]
    - [73, 3.882]
  - - [384, 64, 1, 4096, 416, 416, 4128, 4128]
    - [95, 4.94]
  - - [384, 64, 1, 8192, 416, 416, 8224, 8224]
    - [73, 5.73]
  - - [384, 128, 1, 64, 416, 416, 384, 96]
    - [82, 0.536]
  - - [384, 128, 1, 128, 416, 416, 384, 160]
    - [90, 1.02]
  - - [384, 128, 1, 256, 416, 416, 384, 288]
    - [95, 1.925]
  - - [384, 128, 1, 512, 416, 416, 544, 544]
    - [95, 3.391]
  - - [384, 128, 1, 1024, 416, 416, 1056, 1056]
    - [68, 5.43]
  - - [384, 128, 1, 2048, 416, 416, 2080, 2080]
    - [73, 7.796]
  - - [384, 128, 1, 4096, 416, 416, 4128, 4128]
    - [95, 9.96]
  - - [384, 128, 1, 8192, 416, 416, 8224, 8224]
    - [95, 11.437]
  - - [384, 256, 1, 64, 416, 416, 384, 96]
    - [92, 1.06]
  - - [384, 256, 1, 128, 416, 416, 384, 160]
    - [91, 2.003]
  - - [384, 256, 1, 256, 416, 416, 384, 288]
    - [79, 3.72]
  - - [384, 256, 1, 512, 416, 416, 544, 544]
    - [85, 6.431]
  - - [384, 256, 1, 1024, 416, 416, 1056, 1056]
    - [84, 10.144]
  - - [384, 256, 1, 2048, 416, 416, 2080, 2080]
    - [67, 14.3]
  - - [384, 256, 1, 4096, 416, 416, 4128, 4128]
    - [68, 17.855]
  - - [384, 256, 1, 8192, 416, 416, 8224, 8224]
    - [84, 20.151]
  - - [384, 512, 1, 64, 416, 416, 384, 96]
    - [125, 2.025]
  - - [384, 512, 1, 128, 416, 416, 384, 160]
    - [104, 3.821]
  - - [384, 512, 1, 256, 416, 416, 384, 288]
    - [114, 6.789]
  - - [384, 512, 1, 512, 416, 416, 544, 544]
    - [104, 9.207]
  - - [384, 512, 1, 1024, 416, 416, 1056, 1056]
    - [103, 16.695]
  - - [384, 512, 1, 2048, 416, 416, 2080, 2080]
    - [104, 21.999]
  - - [384, 512, 1, 4096, 416, 416, 4128, 4128]
    - [127, 25.556]
  - - [384, 512, 1, 8192, 416, 416, 8224, 8224]
    - [104, 28.627]
  - - [384, 1024, 1, 64, 416, 416, 384, 96]
    - [10, 3.902]
  - - [384, 1024, 1, 128, 416, 416, 384, 160]
    - [108, 7.297]
  - - [384, 1024, 1, 256, 416, 416, 384, 288]
    - [140, 12.852]
  - - [384, 1024, 1, 512, 416, 416, 544, 544]
    - [101, 20.671]
  - - [384, 1024, 1, 1024, 416, 416, 1056, 1056]
    - [120, 30.19]
  - - [384, 1024, 1, 2048, 416, 416, 2080, 2080]
    - [99, 38.937]
  - - [384, 1024, 1, 4096, 416, 416, 4128, 4128]
    - [99, 43.802]
  - - [384, 1024, 1, 8192, 416, 416, 8224, 8224]
    - [98, 49.37]
  - - [384, 2048, 1, 64, 416, 416, 384, 96]
    - [9, 7.2]
  - - [384, 2048, 1, 128, 416, 416, 384, 160]
    - [119, 12.707]
  - - [384, 2048, 1, 256, 416, 416, 384, 288]
    - [105, 20.661]
  - - [384, 2048, 1, 512, 416, 416, 544, 544]
    - [141, 30.183]
  - - [384, 2048, 1, 1024, 416, 416, 1056, 1056]
    - [100, 38.91]
  - - [384, 2048, 1, 2048, 416, 416, 2080, 2080]
    - [128, 45.228]
  - - [384, 2048, 1, 4096, 416, 416, 4128, 4128]
    - [122, 49.524]
  - - [384, 2048, 1, 8192, 416, 416, 8224, 8224]
    - [105, 50.255]
  - - [384, 4096, 1, 64, 416, 416, 384, 96]
    - [40, 11.975]
  - - [384, 4096, 1, 128, 416, 416, 384, 160]
    - [23, 21.139]
  - - [384, 4096, 1, 256, 416, 416, 384, 288]
    - [23, 34.505]
  - - [384, 4096, 1, 512, 416, 416, 544, 544]
    - [23, 50.512]
  - - [384, 4096, 1, 1024, 416, 416, 1056, 1056]
    - [23, 64.917]
  - - [384, 4096, 1, 2048, 416, 416, 2080, 2080]
    - [43, 74.886]
  - - [384, 4096, 1, 4096, 416, 416, 4128, 4128]
    - [23, 78.998]
  - - [384, 4096, 1, 8192, 416, 416, 8224, 8224]
    - [21, 81.196]
  - - [384, 8192, 1, 64, 416, 416, 384, 96]
    - [57, 19.15]
  - - [384, 8192, 1, 128, 416, 416, 384, 160]
    - [29, 33.947]
  - - [384, 8192, 1, 256, 416, 416, 384, 288]
    - [29, 48.66]
  - - [384, 8192, 1, 512, 416, 416, 544, 544]
    - [45, 62.802]
  - - [384, 8192, 1, 1024, 416, 416, 1056, 1056]
    - [35, 73.427]
  - - [384, 8192, 1, 2048, 416, 416, 2080, 2080]
    - [35, 76.685]
  - - [384, 8192, 1, 4096, 416, 416, 4128, 4128]
    - [34, 82.186]
  - - [384, 8192, 1, 8192, 416, 416, 8224, 8224]
    - [28, 64.908]
  - - [768, 64, 1, 64, 800, 800, 768, 96]
    - [92, 0.508]
  - - [768, 64, 1, 128, 800, 800, 768, 160]
    - [92, 1.031]
  - - [768, 64, 1, 256, 800, 800, 768, 288]
    - [96, 1.927]
  - - [768, 64, 1, 512, 800, 800, 768, 544]
    - [96, 3.366]
  - - [768, 64, 1, 1024, 800, 800, 1056, 1056]
    - [85, 5.372]
  - - [768, 64, 1, 2048, 800, 800, 2080, 2080]
    - [68, 7.676]
  - - [768, 64, 1, 4096, 800, 800, 4128, 4128]
    - [68, 9.774]
  - - [768, 64, 1, 8192, 800, 800, 8224, 8224]
    - [90, 11.322]
  - - [768, 128, 1, 64, 800, 800, 768, 96]
    - [97, 1.053]
  - - [768, 128, 1, 128, 800, 800, 768, 160]
    - [86, 2.02]
  - - [768, 128, 1, 256, 800, 800, 768, 288]
    - [96, 3.689]
  - - [768, 128, 1, 512, 800, 800, 768, 544]
    - [79, 6.418]
  - - [768, 128, 1, 1024, 800, 800, 1056, 1056]
    - [85, 10.165]
  - - [768, 128, 1, 2048, 800, 800, 2080, 2080]
    - [67, 14.194]
  - - [768, 128, 1, 4096, 800, 800, 4128, 4128]
    - [67, 17.879]
  - - [768, 128, 1, 8192, 800, 800, 8224, 8224]
    - [67, 20.073]
  - - [768, 256, 1, 64, 800, 800, 768, 96]
    - [132, 2.059]
  - - [768, 256, 1, 128, 800, 800, 768, 160]
    - [121, 3.802]
  - - [768, 256, 1, 256, 800, 800, 768, 288]
    - [137, 6.864]
  - - [768, 256, 1, 512, 800, 800, 768, 544]
    - [117, 11.303]
  - - [768, 256, 1, 1024, 800, 800, 1056, 1056]
    - [103, 16.732]
  - - [768, 256, 1, 2048, 800, 800, 2080, 2080]
    - [102, 21.998]
  - - [768, 256, 1, 4096, 800, 800, 4128, 4128]
    - [112, 25.992]
  - - [768, 256, 1, 8192, 800, 800, 8224, 8224]
    - [103, 28.789]
  - - [768, 512, 1, 64, 800, 800, 768, 96]
    - [15, 3.923]
  - - [768, 512, 1, 128, 800, 800, 768, 160]
    - [108, 7.322]
  - - [768, 512, 1, 256, 800, 800, 768, 288]
    - [108, 12.847]
  - - [768, 512, 1, 512, 800, 800, 768, 544]
    - [101, 20.907]
  - - [768, 512, 1, 1024, 800, 800, 1056, 1056]
    - [99, 30.241]
  - - [768, 512, 1, 2048, 800, 800, 2080, 2080]
    - [98, 38.937]
  - - [768, 512, 1, 4096, 800, 800, 4128, 4128]
    - [99, 45.389]
  - - [768, 512, 1, 8192, 800, 800, 8224, 8224]
    - [100, 49.534]
  - - [768, 1024, 1, 64, 800, 800, 768, 96]
    - [138, 7.203]
  - - [768, 1024, 1, 128, 800, 800, 768, 160]
    - [105, 12.743]
  - - [768, 1024, 1, 256, 800, 800, 768, 288]
    - [14, 20.725]
  - - [768, 1024, 1, 512, 800, 800, 768, 544]
    - [123, 30.003]
  - - [768, 1024, 1, 1024, 800, 800, 1056, 1056]
    - [142, 38.979]
  - - [768, 1024, 1, 2048, 800, 800, 2080, 2080]
    - [99, 45.127]
  - - [768, 1024, 1, 4096, 800, 800, 4128, 4128]
    - [130, 49.427]
  - - [768, 1024, 1, 8192, 800, 800, 8224, 8224]
    - [138, 50.652]
  - - [768, 2048, 1, 64, 800, 800, 768, 96]
    - [33, 11.937]
  - - [768, 2048, 1, 128, 800, 800, 768, 160]
    - [25, 21.04]
  - - [768, 2048, 1, 256, 800, 800, 768, 288]
    - [25, 34.053]
  - - [768, 2048, 1, 512, 800, 800, 768, 544]
    - [25, 50.171]
  - - [768, 2048, 1, 1024, 800, 800, 1056, 1056]
    - [25, 65.317]
  - - [768, 2048, 1, 2048, 800, 800, 2080, 2080]
    - [45, 75.461]
  - - [768, 2048, 1, 4096, 800, 800, 4128, 4128]
    - [25, 79.228]
  - - [768, 2048, 1, 8192, 800, 800, 8224, 8224]
    - [52, 84.839]
  - - [768, 4096, 1, 64, 800, 800, 768, 96]
    - [32, 19.226]
  - - [768, 4096, 1, 128, 800, 800, 768, 160]
    - [32, 33.523]
  - - [768, 4096, 1, 256, 800, 800, 768, 288]
    - [39, 48.891]
  - - [768, 4096, 1, 512, 800, 800, 768, 544]
    - [25, 63.603]
  - - [768, 4096, 1, 1024, 800, 800, 1056, 1056]
    - [23, 74.659]
  - - [768, 4096, 1, 2048, 800, 800, 2080, 2080]
    - [24, 77.588]
  - - [768, 4096, 1, 4096, 800, 800, 4128, 4128]
    - [33, 80.342]
  - - [768, 4096, 1, 8192, 800, 800, 8224, 8224]
    - [41, 63.996]
  - - [768, 8192, 1, 64, 800, 800, 768, 96]
    - [33, 29.221]
  - - [768, 8192, 1, 128, 800, 800, 768, 160]
    - [39, 44.035]
  - - [768, 8192, 1, 256, 800, 800, 768, 288]
    - [25, 59.751]
  - - [768, 8192, 1, 512, 800, 800, 768, 544]
    - [23, 72.671]
  - - [768, 8192, 1, 1024, 800, 800, 1056, 1056]
    - [47, 77.132]
  - - [768, 8192, 1, 2048, 800, 800, 2080, 2080]
    - [30, 79.309]
  - - [768, 8192, 1, 4096, 800, 800, 4128, 4128]
    - [46, 67.409]
  - - [768, 8192, 1, 8192, 800, 800, 8224, 8224]
    - [54, 64.76]
  - - [1536, 64, 1, 64, 1568, 1568, 1536, 96]
    - [92, 1.007]
  - - [1536, 64, 1, 128, 1568, 1568, 1536, 160]
    - [96, 2.003]
  - - [1536, 64, 1, 256, 1568, 1568, 1536, 288]
    - [96, 3.71]
  - - [1536, 64, 1, 512, 1568, 1568, 1536, 544]
    - [85, 6.454]
  - - [1536, 64, 1, 1024, 1568, 1568, 1536, 1056]
    - [85, 10.115]
  - - [1536, 64, 1, 2048, 1568, 1568, 2080, 2080]
    - [67, 14.245]
  - - [1536, 64, 1, 4096, 1568, 1568, 4128, 4128]
    - [85, 17.82]
  - - [1536, 64, 1, 8192, 1568, 1568, 8224, 8224]
    - [90, 20.206]
  - - [1536, 128, 1, 64, 1568, 1568, 1536, 96]
    - [121, 2.033]
  - - [1536, 128, 1, 128, 1568, 1568, 1536, 160]
    - [144, 3.836]
  - - [1536, 128, 1, 256, 1568, 1568, 1536, 288]
    - [104, 6.869]
  - - [1536, 128, 1, 512, 1568, 1568, 1536, 544]
    - [144, 11.299]
  - - [1536, 128, 1, 1024, 1568, 1568, 1536, 1056]
    - [104, 16.804]
  - - [1536, 128, 1, 2048, 1568, 1568, 2080, 2080]
    - [127, 22.064]
  - - [1536, 128, 1, 4096, 1568, 1568, 4128, 4128]
    - [103, 25.643]
  - - [1536, 128, 1, 8192, 1568, 1568, 8224, 8224]
    - [103, 28.68]
  - - [1536, 256, 1, 64, 1568, 1568, 1536, 96]
    - [115, 3.929]
  - - [1536, 256, 1, 128, 1568, 1568, 1536, 160]
    - [11, 7.287]
  - - [1536, 256, 1, 256, 1568, 1568, 1536, 288]
    - [99, 12.884]
  - - [1536, 256, 1, 512, 1568, 1568, 1536, 544]
    - [99, 20.838]
  - - [1536, 256, 1, 1024, 1568, 1568, 1536, 1056]
    - [99, 30.082]
  - - [1536, 256, 1, 2048, 1568, 1568, 2080, 2080]
    - [99, 38.745]
  - - [1536, 256, 1, 4096, 1568, 1568, 4128, 4128]
    - [100, 44.86]
  - - [1536, 256, 1, 8192, 1568, 1568, 8224, 8224]
    - [120, 49.301]
  - - [1536, 512, 1, 64, 1568, 1568, 1536, 96]
    - [119, 7.153]
  - - [1536, 512, 1, 128, 1568, 1568, 1536, 160]
    - [105, 12.728]
  - - [1536, 512, 1, 256, 1568, 1568, 1536, 288]
    - [119, 20.637]
  - - [1536, 512, 1, 512, 1568, 1568, 1536, 544]
    - [101, 29.978]
  - - [1536, 512, 1, 1024, 1568, 1568, 1536, 1056]
    - [99, 39.261]
  - - [1536, 512, 1, 2048, 1568, 1568, 2080, 2080]
    - [101, 44.457]
  - - [1536, 512, 1, 4096, 1568, 1568, 4128, 4128]
    - [105, 49.271]
  - - [1536, 512, 1, 8192, 1568, 1568, 8224, 8224]
    - [107, 50.108]
  - - [1536, 1024, 1, 64, 1568, 1568, 1536, 96]
    - [25, 11.851]
  - - [1536, 1024, 1, 128, 1568, 1568, 1536, 160]
    - [47, 20.821]
  - - [1536, 1024, 1, 256, 1568, 1568, 1536, 288]
    - [25, 34.039]
  - - [1536, 1024, 1, 512, 1568, 1568, 1536, 544]
    - [39, 50.161]
  - - [1536, 1024, 1, 1024, 1568, 1568, 1536, 1056]
    - [25, 64.145]
  - - [1536, 1024, 1, 2048, 1568, 1568, 2080, 2080]
    - [43, 75.764]
  - - [1536, 1024, 1, 4096, 1568, 1568, 4128, 4128]
    - [43, 79.922]
  - - [1536, 1024, 1, 8192, 1568, 1568, 8224, 8224]
    - [31, 83.265]
  - - [1536, 2048, 1, 64, 1568, 1568, 1536, 96]
    - [117, 19.273]
  - - [1536, 2048, 1, 128, 1568, 1568, 1536, 160]
    - [49, 33.879]
  - - [1536, 2048, 1, 256, 1568, 1568, 1536, 288]
    - [59, 49.389]
  - - [1536, 2048, 1, 512, 1568, 1568, 1536, 544]
    - [25, 63.885]
  - - [1536, 2048, 1, 1024, 1568, 1568, 1536, 1056]
    - [25, 74.645]
  - - [1536, 2048, 1, 2048, 1568, 1568, 2080, 2080]
    - [25, 76.814]
  - - [1536, 2048, 1, 4096, 1568, 1568, 4128, 4128]
    - [56, 82.014]
  - - [1536, 2048, 1, 8192, 1568, 1568, 8224, 8224]
    - [53, 74.728]
  - - [1536, 4096, 1, 64, 1568, 1568, 1536, 96]
    - [25, 29.647]
  - - [1536, 4096, 1, 128, 1568, 1568, 1536, 160]
    - [39, 44.51]
  - - [1536, 4096, 1, 256, 1568, 1568, 1536, 288]
    - [23, 60.218]
  - - [1536, 4096, 1, 512, 1568, 1568, 1536, 544]
    - [25, 73.294]
  - - [1536, 4096, 1, 1024, 1568, 1568, 1536, 1056]
    - [25, 77.375]
  - - [1536, 4096, 1, 2048, 1568, 1568, 2080, 2080]
    - [43, 82.078]
  - - [1536, 4096, 1, 4096, 1568, 1568, 4128, 4128]
    - [23, 72.528]
  - - [1536, 4096, 1, 8192, 1568, 1568, 8224, 8224]
    - [52, 66.469]
  - - [1536, 8192, 1, 64, 1568, 1568, 1536, 96]
    - [39, 39.905]
  - - [1536, 8192, 1, 128, 1568, 1568, 1536, 160]
    - [39, 56.811]
  - - [1536, 8192, 1, 256, 1568, 1568, 1536, 288]
    - [23, 71.158]
  - - [1536, 8192, 1, 512, 1568, 1568, 1536, 544]
    - [23, 77.661]
  - - [1536, 8192, 1, 1024, 1568, 1568, 1536, 1056]
    - [20, 82.791]
  - - [1536, 8192, 1, 2048, 1568, 1568, 2080, 2080]
    - [47, 73.671]
  - - [1536, 8192, 1, 4096, 1568, 1568, 4128, 4128]
    - [52, 68.336]
  - - [1536, 8192, 1, 8192, 1568, 1568, 8224, 8224]
    - [46, 68.381]
  - - [3072, 64, 1, 64, 3104, 3104, 3072, 96]
    - [87, 1.946]
  - - [3072, 64, 1, 128, 3104, 3104, 3072, 160]
    - [117, 3.824]
  - - [3072, 64, 1, 256, 3104, 3104, 3072, 288]
    - [19, 6.608]
  - - [3072, 64, 1, 512, 3104, 3104, 3072, 544]
    - [144, 11.311]
  - - [3072, 64, 1, 1024, 3104, 3104, 3072, 1056]
    - [104, 16.777]
  - - [3072, 64, 1, 2048, 3104, 3104, 3072, 2080]
    - [104, 22.19]
  - - [3072, 64, 1, 4096, 3104, 3104, 4128, 4128]
    - [143, 25.608]
  - - [3072, 64, 1, 8192, 3104, 3104, 8224, 8224]
    - [104, 28.635]
  - - [3072, 128, 1, 64, 3104, 3104, 3072, 96]
    - [11, 3.945]
  - - [3072, 128, 1, 128, 3104, 3104, 3072, 160]
    - [99, 7.31]
  - - [3072, 128, 1, 256, 3104, 3104, 3072, 288]
    - [123, 12.839]
  - - [3072, 128, 1, 512, 3104, 3104, 3072, 544]
    - [121, 20.691]
  - - [3072, 128, 1, 1024, 3104, 3104, 3072, 1056]
    - [101, 29.717]
  - - [3072, 128, 1, 2048, 3104, 3104, 3072, 2080]
    - [123, 38.09]
  - - [3072, 128, 1, 4096, 3104, 3104, 4128, 4128]
    - [101, 44.297]
  - - [3072, 128, 1, 8192, 3104, 3104, 8224, 8224]
    - [122, 48.041]
  - - [3072, 256, 1, 64, 3104, 3104, 3072, 96]
    - [16, 7.223]
  - - [3072, 256, 1, 128, 3104, 3104, 3072, 160]
    - [9, 12.674]
  - - [3072, 256, 1, 256, 3104, 3104, 3072, 288]
    - [131, 20.596]
  - - [3072, 256, 1, 512, 3104, 3104, 3072, 544]
    - [116, 29.879]
  - - [3072, 256, 1, 1024, 3104, 3104, 3072, 1056]
    - [100, 38.692]
  - - [3072, 256, 1, 2048, 3104, 3104, 3072, 2080]
    - [119, 44.478]
  - - [3072, 256, 1, 4096, 3104, 3104, 4128, 4128]
    - [113, 49.289]
  - - [3072, 256, 1, 8192, 3104, 3104, 8224, 8224]
    - [130, 50.08]
  - - [3072, 512, 1, 64, 3104, 3104, 3072, 96]
    - [23, 11.805]
  - - [3072, 512, 1, 128, 3104, 3104, 3072, 160]
    - [25, 20.749]
  - - [3072, 512, 1, 256, 3104, 3104, 3072, 288]
    - [23, 33.847]
  - - [3072, 512, 1, 512, 3104, 3104, 3072, 544]
    - [25, 49.75]
  - - [3072, 512, 1, 1024, 3104, 3104, 3072, 1056]
    - [47, 63.567]
  - - [3072, 512, 1, 2048, 3104, 3104, 3072, 2080]
    - [23, 73.273]
  - - [3072, 512, 1, 4096, 3104, 3104, 4128, 4128]
    - [23, 79.127]
  - - [3072, 512, 1, 8192, 3104, 3104, 8224, 8224]
    - [22, 82.961]
  - - [3072, 1024, 1, 64, 3104, 3104, 3072, 96]
    - [127, 19.383]
  - - [3072, 1024, 1, 128, 3104, 3104, 3072, 160]
    - [33, 33.734]
  - - [3072, 1024, 1, 256, 3104, 3104, 3072, 288]
    - [33, 49.284]
  - - [3072, 1024, 1, 512, 3104, 3104, 3072, 544]
    - [61, 63.427]
  - - [3072, 1024, 1, 1024, 3104, 3104, 3072, 1056]
    - [29, 74.361]
  - - [3072, 1024, 1, 2048, 3104, 3104, 3072, 2080]
    - [49, 76.641]
  - - [3072, 1024, 1, 4096, 3104, 3104, 4128, 4128]
    - [55, 80.763]
  - - [3072, 1024, 1, 8192, 3104, 3104, 8224, 8224]
    - [22, 75.23]
  - - [3072, 2048, 1, 64, 3104, 3104, 3072, 96]
    - [33, 29.801]
  - - [3072, 2048, 1, 128, 3104, 3104, 3072, 160]
    - [23, 44.109]
  - - [3072, 2048, 1, 256, 3104, 3104, 3072, 288]
    - [23, 60.825]
  - - [3072, 2048, 1, 512, 3104, 3104, 3072, 544]
    - [39, 72.574]
  - - [3072, 2048, 1, 1024, 3104, 3104, 3072, 1056]
    - [25, 76.947]
  - - [3072, 2048, 1, 2048, 3104, 3104, 3072, 2080]
    - [39, 81.977]
  - - [3072, 2048, 1, 4096, 3104, 3104, 4128, 4128]
    - [43, 73.605]
  - - [3072, 2048, 1, 8192, 3104, 3104, 8224, 8224]
    - [24, 67.929]
  - - [3072, 4096, 1, 64, 3104, 3104, 3072, 96]
    - [35, 40.223]
  - - [3072, 4096, 1, 128, 3104, 3104, 3072, 160]
    - [38, 56.687]
  - - [3072, 4096, 1, 256, 3104, 3104, 3072, 288]
    - [47, 70.659]
  - - [3072, 4096, 1, 512, 3104, 3104, 3072, 544]
    - [39, 77.272]
  - - [3072, 4096, 1, 1024, 3104, 3104, 3072, 1056]
    - [51, 82.798]
  - - [3072, 4096, 1, 2048, 3104, 3104, 3072, 2080]
    - [55, 71.357]
  - - [3072, 4096, 1, 4096, 3104, 3104, 4128, 4128]
    - [46, 74.499]
  - - [3072, 4096, 1, 8192, 3104, 3104, 8224, 8224]
    - [24, 69.313]
  - - [3072, 8192, 1, 64, 3104, 3104, 3072, 96]
    - [39, 49.527]
  - - [3072, 8192, 1, 128, 3104, 3104, 3072, 160]
    - [25, 65.412]
  - - [3072, 8192, 1, 256, 3104, 3104, 3072, 288]
    - [47, 74.671]
  - - [3072, 8192, 1, 512, 3104, 3104, 3072, 544]
    - [24, 80.856]
  - - [3072, 8192, 1, 1024, 3104, 3104, 3072, 1056]
    - [23, 74.718]
  - - [3072, 8192, 1, 2048, 3104, 3104, 3072, 2080]
    - [24, 72.567]
  - - [3072, 8192, 1, 4096, 3104, 3104, 4128, 4128]
    - [44, 69.889]
  - - [3072, 8192, 1, 8192, 3104, 3104, 8224, 8224]
    - [24, 69.834]
  - - [6144, 64, 1, 64, 6176, 6176, 6144, 96]
    - [9, 3.729]
  - - [6144, 64, 1, 128, 6176, 6176, 6144, 160]
    - [7, 7.285]
  - - [6144, 64, 1, 256, 6176, 6176, 6144, 288]
    - [101, 12.811]
  - - [6144, 64, 1, 512, 6176, 6176, 6144, 544]
    - [142, 20.603]
  - - [6144, 64, 1, 1024, 6176, 6176, 6144, 1056]
    - [123, 29.696]
  - - [6144, 64, 1, 2048, 6176, 6176, 6144, 2080]
    - [100, 37.909]
  - - [6144, 64, 1, 4096, 6176, 6176, 6144, 4128]
    - [100, 43.028]
  - - [6144, 64, 1, 8192, 6176, 6176, 8224, 8224]
    - [103, 45.127]
  - - [6144, 128, 1, 64, 6176, 6176, 6144, 96]
    - [17, 7.154]
  - - [6144, 128, 1, 128, 6176, 6176, 6144, 160]
    - [146, 12.733]
  - - [6144, 128, 1, 256, 6176, 6176, 6144, 288]
    - [144, 20.749]
  - - [6144, 128, 1, 512, 6176, 6176, 6144, 544]
    - [127, 30.007]
  - - [6144, 128, 1, 1024, 6176, 6176, 6144, 1056]
    - [104, 38.823]
  - - [6144, 128, 1, 2048, 6176, 6176, 6144, 2080]
    - [125, 44.287]
  - - [6144, 128, 1, 4096, 6176, 6176, 6144, 4128]
    - [104, 49.168]
  - - [6144, 128, 1, 8192, 6176, 6176, 8224, 8224]
    - [126, 50.803]
  - - [6144, 256, 1, 64, 6176, 6176, 6144, 96]
    - [12, 12.4]
  - - [6144, 256, 1, 128, 6176, 6176, 6144, 160]
    - [23, 22.06]
  - - [6144, 256, 1, 256, 6176, 6176, 6144, 288]
    - [59, 35.214]
  - - [6144, 256, 1, 512, 6176, 6176, 6144, 544]
    - [47, 50.211]
  - - [6144, 256, 1, 1024, 6176, 6176, 6144, 1056]
    - [25, 63.579]
  - - [6144, 256, 1, 2048, 6176, 6176, 6144, 2080]
    - [45, 72.143]
  - - [6144, 256, 1, 4096, 6176, 6176, 6144, 4128]
    - [45, 75.753]
  - - [6144, 256, 1, 8192, 6176, 6176, 8224, 8224]
    - [62, 68.888]
  - - [6144, 512, 1, 64, 6176, 6176, 6144, 96]
    - [38, 20.526]
  - - [6144, 512, 1, 128, 6176, 6176, 6144, 160]
    - [49, 33.707]
  - - [6144, 512, 1, 256, 6176, 6176, 6144, 288]
    - [29, 48.66]
  - - [6144, 512, 1, 512, 6176, 6176, 6144, 544]
    - [29, 63.117]
  - - [6144, 512, 1, 1024, 6176, 6176, 6144, 1056]
    - [49, 74.505]
  - - [6144, 512, 1, 2048, 6176, 6176, 6144, 2080]
    - [29, 76.922]
  - - [6144, 512, 1, 4096, 6176, 6176, 6144, 4128]
    - [29, 81.61]
  - - [6144, 512, 1, 8192, 6176, 6176, 8224, 8224]
    - [48, 69.77]
  - - [6144, 1024, 1, 64, 6176, 6176, 6144, 96]
    - [27, 29.588]
  - - [6144, 1024, 1, 128, 6176, 6176, 6144, 160]
    - [23, 44.337]
  - - [6144, 1024, 1, 256, 6176, 6176, 6144, 288]
    - [23, 60.686]
  - - [6144, 1024, 1, 512, 6176, 6176, 6144, 544]
    - [47, 72.791]
  - - [6144, 1024, 1, 1024, 6176, 6176, 6144, 1056]
    - [47, 77.411]
  - - [6144, 1024, 1, 2048, 6176, 6176, 6144, 2080]
    - [31, 81.043]
  - - [6144, 1024, 1, 4096, 6176, 6176, 6144, 4128]
    - [54, 73.339]
  - - [6144, 1024, 1, 8192, 6176, 6176, 8224, 8224]
    - [54, 64.674]
  - - [6144, 2048, 1, 64, 6176, 6176, 6144, 96]
    - [25, 39.981]
  - - [6144, 2048, 1, 128, 6176, 6176, 6144, 160]
    - [47, 56.228]
  - - [6144, 2048, 1, 256, 6176, 6176, 6144, 288]
    - [25, 70.793]
  - - [6144, 2048, 1, 512, 6176, 6176, 6144, 544]
    - [55, 77.412]
  - - [6144, 2048, 1, 1024, 6176, 6176, 6144, 1056]
    - [33, 83.524]
  - - [6144, 2048, 1, 2048, 6176, 6176, 6144, 2080]
    - [58, 73.37]
  - - [6144, 2048, 1, 4096, 6176, 6176, 6144, 4128]
    - [24, 73.34]
  - - [6144, 2048, 1, 8192, 6176, 6176, 8224, 8224]
    - [52, 66.663]
  - - [6144, 4096, 1, 64, 6176, 6176, 6144, 96]
    - [42, 49.273]
  - - [6144, 4096, 1, 128, 6176, 6176, 6144, 160]
    - [29, 65.095]
  - - [6144, 4096, 1, 256, 6176, 6176, 6144, 288]
    - [25, 74.611]
  - - [6144, 4096, 1, 512, 6176, 6176, 6144, 544]
    - [35, 80.242]
  - - [6144, 4096, 1, 1024, 6176, 6176, 6144, 1056]
    - [60, 70.631]
  - - [6144, 4096, 1, 2048, 6176, 6176, 6144, 2080]
    - [50, 72.287]
  - - [6144, 4096, 1, 4096, 6176, 6176, 6144, 4128]
    - [25, 71.064]
  - - [6144, 4096, 1, 8192, 6176, 6176, 8224, 8224]
    - [55, 68.661]
  - - [6144, 8192, 1, 64, 6176, 6176, 6144, 96]
    - [27, 49.558]
  - - [6144, 8192, 1, 128, 6176, 6176, 6144, 160]
    - [29, 66.279]
  - - [6144, 8192, 1, 256, 6176, 6176, 6144, 288]
    - [37, 76.207]
  - - [6144, 8192, 1, 512, 6176, 6176, 6144, 544]
    - [38, 68.505]
  - - [6144, 8192, 1, 1024, 6176, 6176, 6144, 1056]
    - [53, 67.609]
  - - [6144, 8192, 1, 2048, 6176, 6176, 6144, 2080]
    - [46, 70.493]
  - - [6144, 8192, 1, 4096, 6176, 6176, 6144, 4128]
    - [61, 70.491]
  - - [6144, 8192, 1, 8192, 6176, 6176, 8224, 8224]
    - [46, 68.747]
- null
- null
- DeviceEfficiency
