library/src/blas3/Tensile/Logic/asm_full/navi31/navi31_Cijk_Alik_Bjlk_I8II_BH_GB.yaml
- {MinimumRequiredVersion: 4.35.0}
- navi31
- gfx1100
- [Device 73bf]
    SolutionIndex: 0
    SolutionNameMin: Cijk_Alik_Bjlk_I8II_BH_MT32x32x16_MI16x16x16x1_SN_1LDSB1_AMAS0_GRVW16_IU1_SIA2_SU0_SUS0_SVW1_TT1_16_VW1_WGM4
    SolutionIndex: 1
    SolutionNameMin: Cijk_Alik_Bjlk_I8II_BH_MT32x32x16_MI16x16x16x1_SN_1LDSB1_AMAS0_GRVW16_IU1_SIA2_SU32_SUS128_SVW1_TT1_16_VW1_WGM4
    SolutionIndex: 2
    SolutionNameMin: Cijk_Alik_Bjlk_I8II_BH_MT32x32x16_MI16x16x16x1_SN_1LDSB1_AMAS0_GRVW8_IU1_SIA2_SU32_SUS256_SVW1_TT1_16_VW1_WGM4
    SolutionIndex: 3
    SolutionNameMin: Cijk_Alik_Bjlk_I8II_BH_MT32x32x16_MI16x16x16x1_SN_1LDSB1_AMAS0_GRVW4_IU1_SIA2_SU0_SUS0_SVW1_TT1_16_VW1_WGM8
    SolutionIndex: 4
    SolutionNameMin: Cijk_Alik_Bjlk_I8II_BH_MT64x64x16_MI16x16x16x1_SN_1LDSB0_AMAS3_GRVW8_IU1_SIA1_SU0_SUS0_SVW2_TT2_32_VW2_WGM4
    SolutionIndex: 5
    SolutionNameMin: Cijk_Alik_Bjlk_I8II_BH_MT64x64x16_MI16x16x16x1_SN_1LDSB1_AMAS0_GRVW8_IU1_SIA2_SU0_SUS0_SVW1_TT2_32_VW1_WGM4
    SolutionIndex: 6
    SolutionNameMin: Cijk_Alik_Bjlk_I8II_BH_MT64x64x16_MI16x16x16x1_SN_1LDSB1_AMAS3_GRVW8_IU1_SIA2_SU0_SUS0_SVW2_TT2_32_VW2_WGM4
    SolutionIndex: 7
    SolutionNameMin: Cijk_Alik_Bjlk_I8II_BH_MT64x64x16_MI16x16x16x1_SN_1LDSB1_AMAS3_GRVW16_IU1_SIA2_SU0_SUS0_SVW2_TT2_32_VW2_WGM4
    SolutionIndex: 8
    SolutionNameMin: Cijk_Alik_Bjlk_I8II_BH_MT64x64x16_MI16x16x16x1_SN_1LDSB0_AMAS0_GRVW8_IU1_SIA3_SU0_SUS0_SVW1_TT2_32_VW1_WGM4
    SolutionIndex: 9
    SolutionNameMin: Cijk_Alik_Bjlk_I8II_BH_MT64x64x16_MI16x16x16x1_SN_1LDSB0_AMAS3_GRVW8_IU1_SIA3_SU0_SUS0_SVW2_TT2_32_VW2_WGM4
    SolutionIndex: 10
    SolutionNameMin: Cijk_Alik_Bjlk_I8II_BH_MT64x64x16_MI16x16x16x1_SN_1LDSB1_AMAS3_GRVW8_IU1_SIA2_SU32_SUS128_SVW2_TT2_32_VW2_WGM4
    SolutionIndex: 11
    SolutionNameMin: Cijk_Alik_Bjlk_I8II_BH_MT64x64x16_MI16x16x16x1_SN_1LDSB1_AMAS0_GRVW16_IU1_SIA2_SU32_SUS128_SVW1_TT2_32_VW1_WGM4
    SolutionIndex: 12
    SolutionNameMin: Cijk_Alik_Bjlk_I8II_BH_MT64x64x16_MI16x16x16x1_SN_1LDSB0_AMAS0_GRVW8_IU1_SIA3_SU32_SUS128_SVW1_TT2_32_VW1_WGM4
    SolutionIndex: 13
    SolutionNameMin: Cijk_Alik_Bjlk_I8II_BH_MT64x64x16_MI16x16x16x1_SN_1LDSB0_AMAS3_GRVW16_IU1_SIA3_SU32_SUS128_SVW2_TT2_32_VW2_WGM4
    SolutionIndex: 14
    SolutionNameMin: Cijk_Alik_Bjlk_I8II_BH_MT64x64x16_MI16x16x16x1_SN_1LDSB1_AMAS3_GRVW8_IU1_SIA2_SU32_SUS256_SVW2_TT2_32_VW2_WGM4
    SolutionIndex: 15
    SolutionNameMin: Cijk_Alik_Bjlk_I8II_BH_MT64x64x16_MI16x16x16x1_SN_1LDSB1_AMAS3_GRVW16_IU1_SIA2_SU32_SUS256_SVW2_TT2_32_VW2_WGM4
    SolutionIndex: 16
    SolutionNameMin: Cijk_Alik_Bjlk_I8II_BH_MT64x64x16_MI16x16x16x1_SN_1LDSB0_AMAS0_GRVW4_IU1_SIA3_SU32_SUS256_SVW1_TT2_32_VW1_WGM4
    SolutionIndex: 17
    SolutionNameMin: Cijk_Alik_Bjlk_I8II_BH_MT64x64x16_MI16x16x16x1_SN_1LDSB1_AMAS0_GRVW16_IU1_SIA2_SU0_SUS0_SVW1_TT2_32_VW1_WGM8
    SolutionIndex: 18
    SolutionNameMin: Cijk_Alik_Bjlk_I8II_BH_MT64x64x16_MI16x16x16x1_SN_1LDSB0_AMAS3_GRVW4_IU1_SIA3_SU0_SUS0_SVW2_TT2_32_VW2_WGM8
    SolutionIndex: 19
    SolutionNameMin: Cijk_Alik_Bjlk_I8II_BH_MT64x64x16_MI16x16x16x1_SN_1LDSB0_AMAS3_GRVW8_IU1_SIA3_SU0_SUS0_SVW2_TT2_32_VW2_WGM8
    SolutionIndex: 20
    SolutionNameMin: Cijk_Alik_Bjlk_I8II_BH_MT64x64x16_MI16x16x16x1_SN_1LDSB1_AMAS3_GRVW16_IU1_SIA2_SU32_SUS128_SVW2_TT2_32_VW2_WGM8
    SolutionIndex: 21
    SolutionNameMin: Cijk_Alik_Bjlk_I8II_BH_MT64x64x16_MI16x16x16x1_SN_1LDSB0_AMAS3_GRVW8_IU1_SIA3_SU32_SUS128_SVW2_TT2_32_VW2_WGM8
    SolutionIndex: 22
    SolutionNameMin: Cijk_Alik_Bjlk_I8II_BH_MT64x64x16_MI16x16x16x1_SN_1LDSB1_AMAS3_GRVW16_IU1_SIA2_SU32_SUS256_SVW2_TT2_32_VW2_WGM8
    SolutionIndex: 23
    SolutionNameMin: Cijk_Alik_Bjlk_I8II_BH_MT128x128x16_MI16x16x16x1_SN_1LDSB0_AMAS0_GRVW4_IU1_SIA1_SU0_SUS0_SVW1_TT4_64_VW1_WGM4
    SolutionIndex: 24
    SolutionNameMin: Cijk_Alik_Bjlk_I8II_BH_MT128x128x16_MI16x16x16x1_SN_1LDSB0_AMAS0_GRVW8_IU1_SIA1_SU0_SUS0_SVW1_TT4_64_VW1_WGM4
    SolutionIndex: 25
    SolutionNameMin: Cijk_Alik_Bjlk_I8II_BH_MT128x128x16_MI16x16x16x1_SN_1LDSB0_AMAS3_GRVW8_IU1_SIA1_SU0_SUS0_SVW2_TT4_64_VW2_WGM4
    SolutionIndex: 26
    SolutionNameMin: Cijk_Alik_Bjlk_I8II_BH_MT128x128x16_MI16x16x16x1_SN_1LDSB0_AMAS3_GRVW8_IU1_SIA1_SU0_SUS0_SVW4_TT4_64_VW4_WGM4
    SolutionIndex: 27
    SolutionNameMin: Cijk_Alik_Bjlk_I8II_BH_MT128x128x16_MI16x16x16x1_SN_1LDSB0_AMAS0_GRVW16_IU1_SIA1_SU0_SUS0_SVW1_TT4_64_VW1_WGM4
    SolutionIndex: 28
    SolutionNameMin: Cijk_Alik_Bjlk_I8II_BH_MT128x128x16_MI16x16x16x1_SN_1LDSB0_AMAS3_GRVW16_IU1_SIA1_SU0_SUS0_SVW2_TT4_64_VW2_WGM4
    SolutionIndex: 29
    SolutionNameMin: Cijk_Alik_Bjlk_I8II_BH_MT128x128x16_MI16x16x16x1_SN_1LDSB0_AMAS3_GRVW16_IU1_SIA1_SU0_SUS0_SVW4_TT4_64_VW4_WGM4
    SolutionIndex: 30
    SolutionNameMin: Cijk_Alik_Bjlk_I8II_BH_MT128x128x16_MI16x16x16x1_SN_1LDSB1_AMAS0_GRVW4_IU1_SIA2_SU0_SUS0_SVW1_TT4_64_VW1_WGM4
    SolutionIndex: 31
    SolutionNameMin: Cijk_Alik_Bjlk_I8II_BH_MT128x128x16_MI16x16x16x1_SN_1LDSB1_AMAS3_GRVW4_IU1_SIA2_SU0_SUS0_SVW2_TT4_64_VW2_WGM4
    SolutionIndex: 32
    SolutionNameMin: Cijk_Alik_Bjlk_I8II_BH_MT128x128x16_MI16x16x16x1_SN_1LDSB1_AMAS3_GRVW16_IU1_SIA2_SU0_SUS0_SVW4_TT4_64_VW4_WGM4
    SolutionIndex: 33
    SolutionNameMin: Cijk_Alik_Bjlk_I8II_BH_MT128x128x16_MI16x16x16x1_SN_1LDSB0_AMAS3_GRVW4_IU1_SIA3_SU0_SUS0_SVW4_TT4_64_VW4_WGM4
    SolutionIndex: 34
    SolutionNameMin: Cijk_Alik_Bjlk_I8II_BH_MT128x128x16_MI16x16x16x1_SN_1LDSB0_AMAS3_GRVW8_IU1_SIA3_SU0_SUS0_SVW4_TT4_64_VW4_WGM4
    SolutionIndex: 35
    SolutionNameMin: Cijk_Alik_Bjlk_I8II_BH_MT128x128x16_MI16x16x16x1_SN_1LDSB0_AMAS3_GRVW16_IU1_SIA3_SU0_SUS0_SVW4_TT4_64_VW4_WGM4
    SolutionIndex: 36
    SolutionNameMin: Cijk_Alik_Bjlk_I8II_BH_MT128x128x16_MI16x16x16x1_SN_1LDSB0_AMAS3_GRVW4_IU1_SIA1_SU32_SUS128_SVW2_TT4_64_VW2_WGM4
    SolutionIndex: 37
    SolutionNameMin: Cijk_Alik_Bjlk_I8II_BH_MT128x128x16_MI16x16x16x1_SN_1LDSB0_AMAS3_GRVW4_IU1_SIA1_SU32_SUS128_SVW4_TT4_64_VW4_WGM4
    SolutionIndex: 38
    SolutionNameMin: Cijk_Alik_Bjlk_I8II_BH_MT128x128x16_MI16x16x16x1_SN_1LDSB0_AMAS0_GRVW16_IU1_SIA1_SU32_SUS128_SVW1_TT4_64_VW1_WGM4
    SolutionIndex: 39
    SolutionNameMin: Cijk_Alik_Bjlk_I8II_BH_MT128x128x16_MI16x16x16x1_SN_1LDSB0_AMAS3_GRVW16_IU1_SIA1_SU32_SUS128_SVW2_TT4_64_VW2_WGM4
    SolutionIndex: 40
    SolutionNameMin: Cijk_Alik_Bjlk_I8II_BH_MT128x128x16_MI16x16x16x1_SN_1LDSB0_AMAS3_GRVW16_IU1_SIA1_SU32_SUS128_SVW4_TT4_64_VW4_WGM4
    SolutionIndex: 41
    SolutionNameMin: Cijk_Alik_Bjlk_I8II_BH_MT128x128x16_MI16x16x16x1_SN_1LDSB0_AMAS0_GRVW4_IU1_SIA3_SU32_SUS128_SVW1_TT4_64_VW1_WGM4
    SolutionIndex: 42
    SolutionNameMin: Cijk_Alik_Bjlk_I8II_BH_MT128x128x16_MI16x16x16x1_SN_1LDSB0_AMAS3_GRVW4_IU1_SIA3_SU32_SUS128_SVW4_TT4_64_VW4_WGM4
    SolutionIndex: 43
    SolutionNameMin: Cijk_Alik_Bjlk_I8II_BH_MT128x128x16_MI16x16x16x1_SN_1LDSB0_AMAS0_GRVW4_IU1_SIA1_SU32_SUS256_SVW1_TT4_64_VW1_WGM4
    SolutionIndex: 44
    SolutionNameMin: Cijk_Alik_Bjlk_I8II_BH_MT128x128x16_MI16x16x16x1_SN_1LDSB0_AMAS3_GRVW4_IU1_SIA1_SU32_SUS256_SVW4_TT4_64_VW4_WGM4
    SolutionIndex: 45
    SolutionNameMin: Cijk_Alik_Bjlk_I8II_BH_MT128x128x16_MI16x16x16x1_SN_1LDSB0_AMAS0_GRVW16_IU1_SIA1_SU32_SUS256_SVW1_TT4_64_VW1_WGM4
    SolutionIndex: 46
    SolutionNameMin: Cijk_Alik_Bjlk_I8II_BH_MT128x128x16_MI16x16x16x1_SN_1LDSB0_AMAS3_GRVW16_IU1_SIA1_SU32_SUS256_SVW2_TT4_64_VW2_WGM4
    SolutionIndex: 47
    SolutionNameMin: Cijk_Alik_Bjlk_I8II_BH_MT128x128x16_MI16x16x16x1_SN_1LDSB0_AMAS3_GRVW16_IU1_SIA1_SU32_SUS256_SVW4_TT4_64_VW4_WGM4
    SolutionIndex: 48
    SolutionNameMin: Cijk_Alik_Bjlk_I8II_BH_MT128x128x16_MI16x16x16x1_SN_1LDSB1_AMAS3_GRVW8_IU1_SIA2_SU32_SUS256_SVW4_TT4_64_VW4_WGM4
    SolutionIndex: 49
    SolutionNameMin: Cijk_Alik_Bjlk_I8II_BH_MT128x128x16_MI16x16x16x1_SN_1LDSB1_AMAS3_GRVW16_IU1_SIA2_SU32_SUS256_SVW4_TT4_64_VW4_WGM4
    SolutionIndex: 50
    SolutionNameMin: Cijk_Alik_Bjlk_I8II_BH_MT128x128x16_MI16x16x16x1_SN_1LDSB0_AMAS3_GRVW8_IU1_SIA3_SU32_SUS256_SVW2_TT4_64_VW2_WGM4
    SolutionIndex: 51
    SolutionNameMin: Cijk_Alik_Bjlk_I8II_BH_MT128x128x16_MI16x16x16x1_SN_1LDSB0_AMAS3_GRVW8_IU1_SIA3_SU32_SUS256_SVW4_TT4_64_VW4_WGM4
    SolutionIndex: 52
    SolutionNameMin: Cijk_Alik_Bjlk_I8II_BH_MT128x128x16_MI16x16x16x1_SN_1LDSB0_AMAS0_GRVW16_IU1_SIA3_SU32_SUS256_SVW1_TT4_64_VW1_WGM4
    SolutionIndex: 53
    SolutionNameMin: Cijk_Alik_Bjlk_I8II_BH_MT128x128x16_MI16x16x16x1_SN_1LDSB0_AMAS0_GRVW4_IU1_SIA1_SU0_SUS0_SVW1_TT4_64_VW1_WGM8
    SolutionIndex: 54
    SolutionNameMin: Cijk_Alik_Bjlk_I8II_BH_MT128x128x16_MI16x16x16x1_SN_1LDSB0_AMAS0_GRVW8_IU1_SIA1_SU0_SUS0_SVW1_TT4_64_VW1_WGM8
    SolutionIndex: 55
    SolutionNameMin: Cijk_Alik_Bjlk_I8II_BH_MT128x128x16_MI16x16x16x1_SN_1LDSB0_AMAS3_GRVW8_IU1_SIA1_SU0_SUS0_SVW4_TT4_64_VW4_WGM8
    SolutionIndex: 56
    SolutionNameMin: Cijk_Alik_Bjlk_I8II_BH_MT128x128x16_MI16x16x16x1_SN_1LDSB0_AMAS0_GRVW16_IU1_SIA1_SU0_SUS0_SVW1_TT4_64_VW1_WGM8
    SolutionIndex: 57
    SolutionNameMin: Cijk_Alik_Bjlk_I8II_BH_MT128x128x16_MI16x16x16x1_SN_1LDSB0_AMAS3_GRVW16_IU1_SIA1_SU0_SUS0_SVW2_TT4_64_VW2_WGM8
    SolutionIndex: 58
    SolutionNameMin: Cijk_Alik_Bjlk_I8II_BH_MT128x128x16_MI16x16x16x1_SN_1LDSB1_AMAS3_GRVW16_IU1_SIA2_SU0_SUS0_SVW4_TT4_64_VW4_WGM8
    SolutionIndex: 59
    SolutionNameMin: Cijk_Alik_Bjlk_I8II_BH_MT128x128x16_MI16x16x16x1_SN_1LDSB0_AMAS3_GRVW4_IU1_SIA3_SU0_SUS0_SVW2_TT4_64_VW2_WGM8
    SolutionIndex: 60
    SolutionNameMin: Cijk_Alik_Bjlk_I8II_BH_MT128x128x16_MI16x16x16x1_SN_1LDSB0_AMAS0_GRVW8_IU1_SIA3_SU0_SUS0_SVW1_TT4_64_VW1_WGM8
    SolutionIndex: 61
    SolutionNameMin: Cijk_Alik_Bjlk_I8II_BH_MT128x128x16_MI16x16x16x1_SN_1LDSB0_AMAS3_GRVW16_IU1_SIA3_SU0_SUS0_SVW4_TT4_64_VW4_WGM8
    SolutionIndex: 62
    SolutionNameMin: Cijk_Alik_Bjlk_I8II_BH_MT128x128x16_MI16x16x16x1_SN_1LDSB0_AMAS3_GRVW4_IU1_SIA1_SU32_SUS128_SVW2_TT4_64_VW2_WGM8
    SolutionIndex: 63
    SolutionNameMin: Cijk_Alik_Bjlk_I8II_BH_MT128x128x16_MI16x16x16x1_SN_1LDSB0_AMAS3_GRVW4_IU1_SIA1_SU32_SUS128_SVW4_TT4_64_VW4_WGM8
    SolutionIndex: 64
    SolutionNameMin: Cijk_Alik_Bjlk_I8II_BH_MT128x128x16_MI16x16x16x1_SN_1LDSB0_AMAS3_GRVW16_IU1_SIA1_SU32_SUS128_SVW2_TT4_64_VW2_WGM8
    SolutionIndex: 65
    SolutionNameMin: Cijk_Alik_Bjlk_I8II_BH_MT128x128x16_MI16x16x16x1_SN_1LDSB1_AMAS3_GRVW8_IU1_SIA2_SU32_SUS128_SVW2_TT4_64_VW2_WGM8
    SolutionIndex: 66
    SolutionNameMin: Cijk_Alik_Bjlk_I8II_BH_MT128x128x16_MI16x16x16x1_SN_1LDSB0_AMAS3_GRVW8_IU1_SIA1_SU32_SUS256_SVW2_TT4_64_VW2_WGM8
    SolutionIndex: 67
    SolutionNameMin: Cijk_Alik_Bjlk_I8II_BH_MT128x128x16_MI16x16x16x1_SN_1LDSB0_AMAS0_GRVW16_IU1_SIA1_SU32_SUS256_SVW1_TT4_64_VW1_WGM8
    SolutionIndex: 68
    SolutionNameMin: Cijk_Alik_Bjlk_I8II_BH_MT32x32x32_MI16x16x16x1_SN_1LDSB1_AMAS0_GRVW4_IU2_SIA2_SU0_SUS0_SVW1_TT1_16_VW1_WGM4
    SolutionIndex: 69
    SolutionNameMin: Cijk_Alik_Bjlk_I8II_BH_MT32x32x32_MI16x16x16x1_SN_1LDSB1_AMAS0_GRVW8_IU2_SIA2_SU0_SUS0_SVW1_TT1_16_VW1_WGM4
    SolutionIndex: 70
    SolutionNameMin: Cijk_Alik_Bjlk_I8II_BH_MT32x32x32_MI16x16x16x1_SN_1LDSB1_AMAS0_GRVW16_IU2_SIA2_SU0_SUS0_SVW1_TT1_16_VW1_WGM4
    SolutionIndex: 71
    SolutionNameMin: Cijk_Alik_Bjlk_I8II_BH_MT32x32x32_MI16x16x16x1_SN_1LDSB0_AMAS0_GRVW4_IU1_SIA3_SU0_SUS0_SVW1_TT1_16_VW1_WGM4
    SolutionIndex: 72
    SolutionNameMin: Cijk_Alik_Bjlk_I8II_BH_MT32x32x32_MI16x16x16x1_SN_1LDSB0_AMAS0_GRVW8_IU1_SIA3_SU0_SUS0_SVW1_TT1_16_VW1_WGM4
    SolutionIndex: 73
    SolutionNameMin: Cijk_Alik_Bjlk_I8II_BH_MT32x32x32_MI16x16x16x1_SN_1LDSB1_AMAS0_GRVW4_IU2_SIA2_SU32_SUS128_SVW1_TT1_16_VW1_WGM4
    SolutionIndex: 74
    SolutionNameMin: Cijk_Alik_Bjlk_I8II_BH_MT32x32x32_MI16x16x16x1_SN_1LDSB1_AMAS0_GRVW8_IU2_SIA2_SU32_SUS128_SVW1_TT1_16_VW1_WGM4
    SolutionIndex: 75
    SolutionNameMin: Cijk_Alik_Bjlk_I8II_BH_MT32x32x32_MI16x16x16x1_SN_1LDSB1_AMAS0_GRVW16_IU2_SIA2_SU32_SUS128_SVW1_TT1_16_VW1_WGM4
    SolutionIndex: 76
    SolutionNameMin: Cijk_Alik_Bjlk_I8II_BH_MT32x32x32_MI16x16x16x1_SN_1LDSB1_AMAS0_GRVW4_IU2_SIA2_SU32_SUS256_SVW1_TT1_16_VW1_WGM4
    SolutionIndex: 77
    SolutionNameMin: Cijk_Alik_Bjlk_I8II_BH_MT32x32x32_MI16x16x16x1_SN_1LDSB1_AMAS0_GRVW8_IU2_SIA2_SU32_SUS256_SVW1_TT1_16_VW1_WGM4
    SolutionIndex: 78
    SolutionNameMin: Cijk_Alik_Bjlk_I8II_BH_MT32x32x32_MI16x16x16x1_SN_1LDSB1_AMAS0_GRVW16_IU2_SIA2_SU32_SUS256_SVW1_TT1_16_VW1_WGM4
    SolutionIndex: 79
    SolutionNameMin: Cijk_Alik_Bjlk_I8II_BH_MT32x32x32_MI16x16x16x1_SN_1LDSB1_AMAS0_GRVW4_IU2_SIA2_SU0_SUS0_SVW1_TT1_16_VW1_WGM8
    SolutionIndex: 80
    SolutionNameMin: Cijk_Alik_Bjlk_I8II_BH_MT32x32x32_MI16x16x16x1_SN_1LDSB1_AMAS0_GRVW8_IU2_SIA2_SU0_SUS0_SVW1_TT1_16_VW1_WGM8
    SolutionIndex: 81
    SolutionNameMin: Cijk_Alik_Bjlk_I8II_BH_MT32x32x32_MI16x16x16x1_SN_1LDSB1_AMAS0_GRVW16_IU2_SIA2_SU0_SUS0_SVW1_TT1_16_VW1_WGM8
    SolutionIndex: 82
    SolutionNameMin: Cijk_Alik_Bjlk_I8II_BH_MT32x32x32_MI16x16x16x1_SN_1LDSB0_AMAS0_GRVW16_IU1_SIA3_SU0_SUS0_SVW1_TT1_16_VW1_WGM8
    SolutionIndex: 83
    SolutionNameMin: Cijk_Alik_Bjlk_I8II_BH_MT32x32x32_MI16x16x16x1_SN_1LDSB1_AMAS0_GRVW4_IU2_SIA2_SU32_SUS128_SVW1_TT1_16_VW1_WGM8
    SolutionIndex: 84
    SolutionNameMin: Cijk_Alik_Bjlk_I8II_BH_MT32x32x32_MI16x16x16x1_SN_1LDSB1_AMAS0_GRVW8_IU2_SIA2_SU32_SUS128_SVW1_TT1_16_VW1_WGM8
    SolutionIndex: 85
    SolutionNameMin: Cijk_Alik_Bjlk_I8II_BH_MT32x32x32_MI16x16x16x1_SN_1LDSB1_AMAS0_GRVW16_IU2_SIA2_SU32_SUS128_SVW1_TT1_16_VW1_WGM8
    SolutionIndex: 86
    SolutionNameMin: Cijk_Alik_Bjlk_I8II_BH_MT32x32x32_MI16x16x16x1_SN_1LDSB0_AMAS0_GRVW4_IU1_SIA3_SU32_SUS128_SVW1_TT1_16_VW1_WGM8
    SolutionIndex: 87
    SolutionNameMin: Cijk_Alik_Bjlk_I8II_BH_MT32x32x32_MI16x16x16x1_SN_1LDSB0_AMAS0_GRVW8_IU1_SIA3_SU32_SUS128_SVW1_TT1_16_VW1_WGM8
    SolutionIndex: 88
    SolutionNameMin: Cijk_Alik_Bjlk_I8II_BH_MT32x32x32_MI16x16x16x1_SN_1LDSB1_AMAS0_GRVW4_IU2_SIA2_SU32_SUS256_SVW1_TT1_16_VW1_WGM8
    SolutionIndex: 89
    SolutionNameMin: Cijk_Alik_Bjlk_I8II_BH_MT32x32x32_MI16x16x16x1_SN_1LDSB1_AMAS0_GRVW8_IU2_SIA2_SU32_SUS256_SVW1_TT1_16_VW1_WGM8
    SolutionIndex: 90
    SolutionNameMin: Cijk_Alik_Bjlk_I8II_BH_MT32x32x32_MI16x16x16x1_SN_1LDSB1_AMAS0_GRVW16_IU2_SIA2_SU32_SUS256_SVW1_TT1_16_VW1_WGM8
    SolutionIndex: 91
    SolutionNameMin: Cijk_Alik_Bjlk_I8II_BH_MT64x64x32_MI16x16x16x1_SN_1LDSB0_AMAS0_GRVW8_IU1_SIA1_SU0_SUS0_SVW1_TT2_32_VW1_WGM4
    SolutionIndex: 92
    SolutionNameMin: Cijk_Alik_Bjlk_I8II_BH_MT64x64x32_MI16x16x16x1_SN_1LDSB0_AMAS3_GRVW8_IU1_SIA1_SU0_SUS0_SVW2_TT2_32_VW2_WGM4
    SolutionIndex: 93
    SolutionNameMin: Cijk_Alik_Bjlk_I8II_BH_MT64x64x32_MI16x16x16x1_SN_1LDSB0_AMAS0_GRVW16_IU1_SIA1_SU0_SUS0_SVW1_TT2_32_VW1_WGM4
    SolutionIndex: 94
    SolutionNameMin: Cijk_Alik_Bjlk_I8II_BH_MT64x64x32_MI16x16x16x1_SN_1LDSB0_AMAS3_GRVW16_IU1_SIA1_SU0_SUS0_SVW2_TT2_32_VW2_WGM4
    SolutionIndex: 95
    SolutionNameMin: Cijk_Alik_Bjlk_I8II_BH_MT64x64x32_MI16x16x16x1_SN_1LDSB1_AMAS0_GRVW8_IU2_SIA2_SU0_SUS0_SVW1_TT2_32_VW1_WGM4
    SolutionIndex: 96
    SolutionNameMin: Cijk_Alik_Bjlk_I8II_BH_MT64x64x32_MI16x16x16x1_SN_1LDSB1_AMAS3_GRVW8_IU2_SIA2_SU0_SUS0_SVW2_TT2_32_VW2_WGM4
    SolutionIndex: 97
    SolutionNameMin: Cijk_Alik_Bjlk_I8II_BH_MT64x64x32_MI16x16x16x1_SN_1LDSB1_AMAS0_GRVW16_IU2_SIA2_SU0_SUS0_SVW1_TT2_32_VW1_WGM4
    SolutionIndex: 98
    SolutionNameMin: Cijk_Alik_Bjlk_I8II_BH_MT64x64x32_MI16x16x16x1_SN_1LDSB1_AMAS3_GRVW16_IU2_SIA2_SU0_SUS0_SVW2_TT2_32_VW2_WGM4
    SolutionIndex: 99
    SolutionNameMin: Cijk_Alik_Bjlk_I8II_BH_MT64x64x32_MI16x16x16x1_SN_1LDSB0_AMAS3_GRVW4_IU1_SIA3_SU0_SUS0_SVW2_TT2_32_VW2_WGM4
    SolutionIndex: 100
    SolutionNameMin: Cijk_Alik_Bjlk_I8II_BH_MT64x64x32_MI16x16x16x1_SN_1LDSB0_AMAS3_GRVW16_IU1_SIA3_SU0_SUS0_SVW2_TT2_32_VW2_WGM4
    SolutionIndex: 101
    SolutionNameMin: Cijk_Alik_Bjlk_I8II_BH_MT64x64x32_MI16x16x16x1_SN_1LDSB0_AMAS3_GRVW8_IU1_SIA1_SU32_SUS128_SVW2_TT2_32_VW2_WGM4
    SolutionIndex: 102
    SolutionNameMin: Cijk_Alik_Bjlk_I8II_BH_MT64x64x32_MI16x16x16x1_SN_1LDSB0_AMAS0_GRVW16_IU1_SIA1_SU32_SUS128_SVW1_TT2_32_VW1_WGM4
    SolutionIndex: 103
    SolutionNameMin: Cijk_Alik_Bjlk_I8II_BH_MT64x64x32_MI16x16x16x1_SN_1LDSB1_AMAS3_GRVW8_IU2_SIA2_SU32_SUS128_SVW2_TT2_32_VW2_WGM4
    SolutionIndex: 104
    SolutionNameMin: Cijk_Alik_Bjlk_I8II_BH_MT64x64x32_MI16x16x16x1_SN_1LDSB1_AMAS0_GRVW16_IU2_SIA2_SU32_SUS128_SVW1_TT2_32_VW1_WGM4
    SolutionIndex: 105
    SolutionNameMin: Cijk_Alik_Bjlk_I8II_BH_MT64x64x32_MI16x16x16x1_SN_1LDSB1_AMAS3_GRVW16_IU2_SIA2_SU32_SUS128_SVW2_TT2_32_VW2_WGM4
    SolutionIndex: 106
    SolutionNameMin: Cijk_Alik_Bjlk_I8II_BH_MT64x64x32_MI16x16x16x1_SN_1LDSB0_AMAS0_GRVW8_IU1_SIA1_SU32_SUS256_SVW1_TT2_32_VW1_WGM4
    SolutionIndex: 107
    SolutionNameMin: Cijk_Alik_Bjlk_I8II_BH_MT64x64x32_MI16x16x16x1_SN_1LDSB0_AMAS3_GRVW8_IU1_SIA1_SU32_SUS256_SVW2_TT2_32_VW2_WGM4
    SolutionIndex: 108
    SolutionNameMin: Cijk_Alik_Bjlk_I8II_BH_MT64x64x32_MI16x16x16x1_SN_1LDSB0_AMAS3_GRVW16_IU1_SIA1_SU32_SUS256_SVW2_TT2_32_VW2_WGM4
    SolutionIndex: 109
    SolutionNameMin: Cijk_Alik_Bjlk_I8II_BH_MT64x64x32_MI16x16x16x1_SN_1LDSB1_AMAS0_GRVW8_IU2_SIA2_SU32_SUS256_SVW1_TT2_32_VW1_WGM4
    SolutionIndex: 110
    SolutionNameMin: Cijk_Alik_Bjlk_I8II_BH_MT64x64x32_MI16x16x16x1_SN_1LDSB1_AMAS3_GRVW8_IU2_SIA2_SU32_SUS256_SVW2_TT2_32_VW2_WGM4
    SolutionIndex: 111
    SolutionNameMin: Cijk_Alik_Bjlk_I8II_BH_MT64x64x32_MI16x16x16x1_SN_1LDSB1_AMAS0_GRVW16_IU2_SIA2_SU32_SUS256_SVW1_TT2_32_VW1_WGM4
    SolutionIndex: 112
    SolutionNameMin: Cijk_Alik_Bjlk_I8II_BH_MT64x64x32_MI16x16x16x1_SN_1LDSB1_AMAS3_GRVW16_IU2_SIA2_SU32_SUS256_SVW2_TT2_32_VW2_WGM4
    SolutionIndex: 113
    SolutionNameMin: Cijk_Alik_Bjlk_I8II_BH_MT64x64x32_MI16x16x16x1_SN_1LDSB0_AMAS0_GRVW8_IU1_SIA1_SU0_SUS0_SVW1_TT2_32_VW1_WGM8
    SolutionIndex: 114
    SolutionNameMin: Cijk_Alik_Bjlk_I8II_BH_MT64x64x32_MI16x16x16x1_SN_1LDSB0_AMAS3_GRVW8_IU1_SIA1_SU0_SUS0_SVW2_TT2_32_VW2_WGM8
    SolutionIndex: 115
    SolutionNameMin: Cijk_Alik_Bjlk_I8II_BH_MT64x64x32_MI16x16x16x1_SN_1LDSB0_AMAS0_GRVW16_IU1_SIA1_SU0_SUS0_SVW1_TT2_32_VW1_WGM8
    SolutionIndex: 116
    SolutionNameMin: Cijk_Alik_Bjlk_I8II_BH_MT64x64x32_MI16x16x16x1_SN_1LDSB0_AMAS3_GRVW16_IU1_SIA1_SU0_SUS0_SVW2_TT2_32_VW2_WGM8
    SolutionIndex: 117
    SolutionNameMin: Cijk_Alik_Bjlk_I8II_BH_MT64x64x32_MI16x16x16x1_SN_1LDSB1_AMAS0_GRVW4_IU2_SIA2_SU0_SUS0_SVW1_TT2_32_VW1_WGM8
    SolutionIndex: 118
    SolutionNameMin: Cijk_Alik_Bjlk_I8II_BH_MT64x64x32_MI16x16x16x1_SN_1LDSB1_AMAS0_GRVW8_IU2_SIA2_SU0_SUS0_SVW1_TT2_32_VW1_WGM8
    SolutionIndex: 119
    SolutionNameMin: Cijk_Alik_Bjlk_I8II_BH_MT64x64x32_MI16x16x16x1_SN_1LDSB1_AMAS3_GRVW8_IU2_SIA2_SU0_SUS0_SVW2_TT2_32_VW2_WGM8
    SolutionIndex: 120
    SolutionNameMin: Cijk_Alik_Bjlk_I8II_BH_MT64x64x32_MI16x16x16x1_SN_1LDSB1_AMAS0_GRVW16_IU2_SIA2_SU0_SUS0_SVW1_TT2_32_VW1_WGM8
    SolutionIndex: 121
    SolutionNameMin: Cijk_Alik_Bjlk_I8II_BH_MT64x64x32_MI16x16x16x1_SN_1LDSB1_AMAS3_GRVW16_IU2_SIA2_SU0_SUS0_SVW2_TT2_32_VW2_WGM8
    SolutionIndex: 122
    SolutionNameMin: Cijk_Alik_Bjlk_I8II_BH_MT64x64x32_MI16x16x16x1_SN_1LDSB0_AMAS3_GRVW8_IU1_SIA1_SU32_SUS128_SVW2_TT2_32_VW2_WGM8
    SolutionIndex: 123
    SolutionNameMin: Cijk_Alik_Bjlk_I8II_BH_MT64x64x32_MI16x16x16x1_SN_1LDSB0_AMAS0_GRVW16_IU1_SIA1_SU32_SUS128_SVW1_TT2_32_VW1_WGM8
    SolutionIndex: 124
    SolutionNameMin: Cijk_Alik_Bjlk_I8II_BH_MT64x64x32_MI16x16x16x1_SN_1LDSB0_AMAS3_GRVW16_IU1_SIA1_SU32_SUS128_SVW2_TT2_32_VW2_WGM8
    SolutionIndex: 125
    SolutionNameMin: Cijk_Alik_Bjlk_I8II_BH_MT64x64x32_MI16x16x16x1_SN_1LDSB1_AMAS0_GRVW8_IU2_SIA2_SU32_SUS128_SVW1_TT2_32_VW1_WGM8
    SolutionIndex: 126
    SolutionNameMin: Cijk_Alik_Bjlk_I8II_BH_MT64x64x32_MI16x16x16x1_SN_1LDSB1_AMAS3_GRVW8_IU2_SIA2_SU32_SUS128_SVW2_TT2_32_VW2_WGM8
    SolutionIndex: 127
    SolutionNameMin: Cijk_Alik_Bjlk_I8II_BH_MT64x64x32_MI16x16x16x1_SN_1LDSB1_AMAS0_GRVW16_IU2_SIA2_SU32_SUS128_SVW1_TT2_32_VW1_WGM8
    SolutionIndex: 128
    SolutionNameMin: Cijk_Alik_Bjlk_I8II_BH_MT64x64x32_MI16x16x16x1_SN_1LDSB1_AMAS3_GRVW16_IU2_SIA2_SU32_SUS128_SVW2_TT2_32_VW2_WGM8
    SolutionIndex: 129
    SolutionNameMin: Cijk_Alik_Bjlk_I8II_BH_MT64x64x32_MI16x16x16x1_SN_1LDSB0_AMAS3_GRVW16_IU1_SIA1_SU32_SUS256_SVW2_TT2_32_VW2_WGM8
    SolutionIndex: 130
    SolutionNameMin: Cijk_Alik_Bjlk_I8II_BH_MT64x64x32_MI16x16x16x1_SN_1LDSB1_AMAS0_GRVW8_IU2_SIA2_SU32_SUS256_SVW1_TT2_32_VW1_WGM8
    SolutionIndex: 131
    SolutionNameMin: Cijk_Alik_Bjlk_I8II_BH_MT64x64x32_MI16x16x16x1_SN_1LDSB1_AMAS3_GRVW8_IU2_SIA2_SU32_SUS256_SVW2_TT2_32_VW2_WGM8
    SolutionIndex: 132
    SolutionNameMin: Cijk_Alik_Bjlk_I8II_BH_MT64x64x32_MI16x16x16x1_SN_1LDSB1_AMAS0_GRVW16_IU2_SIA2_SU32_SUS256_SVW1_TT2_32_VW1_WGM8
    SolutionIndex: 133
    SolutionNameMin: Cijk_Alik_Bjlk_I8II_BH_MT64x64x32_MI16x16x16x1_SN_1LDSB1_AMAS3_GRVW16_IU2_SIA2_SU32_SUS256_SVW2_TT2_32_VW2_WGM8
    SolutionIndex: 134
    SolutionNameMin: Cijk_Alik_Bjlk_I8II_BH_MT128x128x32_MI16x16x16x1_SN_1LDSB0_AMAS0_GRVW16_IU1_SIA1_SU0_SUS0_SVW1_TT4_64_VW1_WGM4
    SolutionIndex: 135
    SolutionNameMin: Cijk_Alik_Bjlk_I8II_BH_MT128x128x32_MI16x16x16x1_SN_1LDSB0_AMAS3_GRVW16_IU1_SIA1_SU0_SUS0_SVW2_TT4_64_VW2_WGM4
    SolutionIndex: 136
    SolutionNameMin: Cijk_Alik_Bjlk_I8II_BH_MT128x128x32_MI16x16x16x1_SN_1LDSB0_AMAS3_GRVW16_IU1_SIA1_SU0_SUS0_SVW4_TT4_64_VW4_WGM4
    SolutionIndex: 137
    SolutionNameMin: Cijk_Alik_Bjlk_I8II_BH_MT128x128x32_MI16x16x16x1_SN_1LDSB0_AMAS0_GRVW16_IU1_SIA3_SU0_SUS0_SVW1_TT4_64_VW1_WGM4
    SolutionIndex: 138
    SolutionNameMin: Cijk_Alik_Bjlk_I8II_BH_MT128x128x32_MI16x16x16x1_SN_1LDSB0_AMAS3_GRVW16_IU1_SIA3_SU0_SUS0_SVW2_TT4_64_VW2_WGM4
    SolutionIndex: 139
    SolutionNameMin: Cijk_Alik_Bjlk_I8II_BH_MT128x128x32_MI16x16x16x1_SN_1LDSB0_AMAS3_GRVW16_IU1_SIA3_SU0_SUS0_SVW4_TT4_64_VW4_WGM4
    SolutionIndex: 140
    SolutionNameMin: Cijk_Alik_Bjlk_I8II_BH_MT128x128x32_MI16x16x16x1_SN_1LDSB0_AMAS0_GRVW16_IU1_SIA1_SU32_SUS128_SVW1_TT4_64_VW1_WGM4
    SolutionIndex: 141
    SolutionNameMin: Cijk_Alik_Bjlk_I8II_BH_MT128x128x32_MI16x16x16x1_SN_1LDSB0_AMAS3_GRVW16_IU1_SIA1_SU32_SUS128_SVW2_TT4_64_VW2_WGM4
    SolutionIndex: 142
    SolutionNameMin: Cijk_Alik_Bjlk_I8II_BH_MT128x128x32_MI16x16x16x1_SN_1LDSB0_AMAS3_GRVW16_IU1_SIA1_SU32_SUS128_SVW4_TT4_64_VW4_WGM4
    SolutionIndex: 143
    SolutionNameMin: Cijk_Alik_Bjlk_I8II_BH_MT128x128x32_MI16x16x16x1_SN_1LDSB1_AMAS3_GRVW16_IU2_SIA2_SU32_SUS128_SVW4_TT4_64_VW4_WGM4
    SolutionIndex: 144
    SolutionNameMin: Cijk_Alik_Bjlk_I8II_BH_MT128x128x32_MI16x16x16x1_SN_1LDSB0_AMAS0_GRVW16_IU1_SIA3_SU32_SUS128_SVW1_TT4_64_VW1_WGM4
    SolutionIndex: 145
    SolutionNameMin: Cijk_Alik_Bjlk_I8II_BH_MT128x128x32_MI16x16x16x1_SN_1LDSB0_AMAS3_GRVW16_IU1_SIA3_SU32_SUS128_SVW4_TT4_64_VW4_WGM4
    SolutionIndex: 146
    SolutionNameMin: Cijk_Alik_Bjlk_I8II_BH_MT128x128x32_MI16x16x16x1_SN_1LDSB0_AMAS0_GRVW16_IU1_SIA1_SU32_SUS256_SVW1_TT4_64_VW1_WGM4
    SolutionIndex: 147
    SolutionNameMin: Cijk_Alik_Bjlk_I8II_BH_MT128x128x32_MI16x16x16x1_SN_1LDSB0_AMAS3_GRVW16_IU1_SIA1_SU32_SUS256_SVW2_TT4_64_VW2_WGM4
    SolutionIndex: 148
    SolutionNameMin: Cijk_Alik_Bjlk_I8II_BH_MT128x128x32_MI16x16x16x1_SN_1LDSB0_AMAS0_GRVW16_IU1_SIA3_SU32_SUS256_SVW1_TT4_64_VW1_WGM4
    SolutionIndex: 149
    SolutionNameMin: Cijk_Alik_Bjlk_I8II_BH_MT128x128x32_MI16x16x16x1_SN_1LDSB0_AMAS3_GRVW16_IU1_SIA3_SU32_SUS256_SVW4_TT4_64_VW4_WGM4
    SolutionIndex: 150
    SolutionNameMin: Cijk_Alik_Bjlk_I8II_BH_MT128x128x32_MI16x16x16x1_SN_1LDSB0_AMAS0_GRVW16_IU1_SIA1_SU0_SUS0_SVW1_TT4_64_VW1_WGM8
    SolutionIndex: 151
    SolutionNameMin: Cijk_Alik_Bjlk_I8II_BH_MT128x128x32_MI16x16x16x1_SN_1LDSB0_AMAS3_GRVW16_IU1_SIA1_SU0_SUS0_SVW2_TT4_64_VW2_WGM8
    SolutionIndex: 152
    SolutionNameMin: Cijk_Alik_Bjlk_I8II_BH_MT128x128x32_MI16x16x16x1_SN_1LDSB0_AMAS3_GRVW16_IU1_SIA1_SU0_SUS0_SVW4_TT4_64_VW4_WGM8
    SolutionIndex: 153
    SolutionNameMin: Cijk_Alik_Bjlk_I8II_BH_MT128x128x32_MI16x16x16x1_SN_1LDSB0_AMAS0_GRVW16_IU1_SIA3_SU0_SUS0_SVW1_TT4_64_VW1_WGM8
    SolutionIndex: 154
    SolutionNameMin: Cijk_Alik_Bjlk_I8II_BH_MT128x128x32_MI16x16x16x1_SN_1LDSB0_AMAS3_GRVW16_IU1_SIA3_SU0_SUS0_SVW2_TT4_64_VW2_WGM8
    SolutionIndex: 155
    SolutionNameMin: Cijk_Alik_Bjlk_I8II_BH_MT128x128x32_MI16x16x16x1_SN_1LDSB0_AMAS3_GRVW16_IU1_SIA3_SU0_SUS0_SVW4_TT4_64_VW4_WGM8
    SolutionIndex: 156
    SolutionNameMin: Cijk_Alik_Bjlk_I8II_BH_MT128x128x32_MI16x16x16x1_SN_1LDSB0_AMAS0_GRVW16_IU1_SIA1_SU32_SUS128_SVW1_TT4_64_VW1_WGM8
    SolutionIndex: 157
    SolutionNameMin: Cijk_Alik_Bjlk_I8II_BH_MT128x128x32_MI16x16x16x1_SN_1LDSB0_AMAS3_GRVW16_IU1_SIA1_SU32_SUS128_SVW2_TT4_64_VW2_WGM8
    SolutionIndex: 158
    SolutionNameMin: Cijk_Alik_Bjlk_I8II_BH_MT128x128x32_MI16x16x16x1_SN_1LDSB0_AMAS3_GRVW16_IU1_SIA1_SU32_SUS128_SVW4_TT4_64_VW4_WGM8
    SolutionIndex: 159
    SolutionNameMin: Cijk_Alik_Bjlk_I8II_BH_MT128x128x32_MI16x16x16x1_SN_1LDSB0_AMAS3_GRVW16_IU1_SIA3_SU32_SUS128_SVW4_TT4_64_VW4_WGM8
    SolutionIndex: 160
    SolutionNameMin: Cijk_Alik_Bjlk_I8II_BH_MT128x128x32_MI16x16x16x1_SN_1LDSB0_AMAS3_GRVW16_IU1_SIA1_SU32_SUS256_SVW2_TT4_64_VW2_WGM8
    SolutionIndex: 161
    SolutionNameMin: Cijk_Alik_Bjlk_I8II_BH_MT128x128x32_MI16x16x16x1_SN_1LDSB0_AMAS3_GRVW16_IU1_SIA1_SU32_SUS256_SVW4_TT4_64_VW4_WGM8
    SolutionIndex: 162
    SolutionNameMin: Cijk_Alik_Bjlk_I8II_BH_MT128x128x32_MI16x16x16x1_SN_1LDSB0_AMAS3_GRVW16_IU1_SIA3_SU32_SUS256_SVW2_TT4_64_VW2_WGM8
    SolutionIndex: 163
    SolutionNameMin: Cijk_Alik_Bjlk_I8II_BH_MT128x128x32_MI16x16x16x1_SN_1LDSB0_AMAS3_GRVW16_IU1_SIA3_SU32_SUS256_SVW4_TT4_64_VW4_WGM8
- - - [64, 64, 1, 64, 96, 96, 96, 96]
    - [0, 0.041]
  - - [64, 64, 1, 128, 96, 96, 160, 160]
    - [81, 0.082]
  - - [64, 64, 1, 256, 96, 96, 288, 288]
    - [84, 0.154]
  - - [64, 64, 1, 512, 96, 96, 544, 544]
    - [70, 0.273]
  - - [64, 64, 1, 1024, 96, 96, 1056, 1056]
    - [83, 0.441]
  - - [64, 64, 1, 2048, 96, 96, 2080, 2080]
    - [76, 0.638]
  - - [64, 64, 1, 4096, 96, 96, 4128, 4128]
    - [75, 0.821]
  - - [64, 64, 1, 8192, 96, 96, 8224, 8224]
    - [83, 0.945]
  - - [64, 128, 1, 64, 96, 96, 96, 128]
    - [73, 0.087]
  - - [64, 128, 1, 128, 96, 96, 160, 160]
    - [69, 0.17]
  - - [64, 128, 1, 256, 96, 96, 288, 288]
    - [73, 0.318]
  - - [64, 128, 1, 512, 96, 96, 544, 544]
    - [80, 0.556]
  - - [64, 128, 1, 1024, 96, 96, 1056, 1056]
    - [88, 0.907]
  - - [64, 128, 1, 2048, 96, 96, 2080, 2080]
    - [76, 1.303]
  - - [64, 128, 1, 4096, 96, 96, 4128, 4128]
    - [90, 1.664]
  - - [64, 128, 1, 8192, 96, 96, 8224, 8224]
    - [69, 1.914]
  - - [64, 256, 1, 64, 96, 96, 96, 256]
    - [81, 0.178]
  - - [64, 256, 1, 128, 96, 96, 160, 256]
    - [2, 0.322]
  - - [64, 256, 1, 256, 96, 96, 288, 288]
    - [74, 0.641]
  - - [64, 256, 1, 512, 96, 96, 544, 544]
    - [90, 1.137]
  - - [64, 256, 1, 1024, 96, 96, 1056, 1056]
    - [89, 1.838]
  - - [64, 256, 1, 2048, 96, 96, 2080, 2080]
    - [77, 2.625]
  - - [64, 256, 1, 4096, 96, 96, 4128, 4128]
    - [83, 3.343]
  - - [64, 256, 1, 8192, 96, 96, 8224, 8224]
    - [80, 3.835]
  - - [64, 512, 1, 64, 96, 96, 96, 512]
    - [88, 0.356]
  - - [64, 512, 1, 128, 96, 96, 160, 512]
    - [69, 0.686]
  - - [64, 512, 1, 256, 96, 96, 288, 512]
    - [83, 1.275]
  - - [64, 512, 1, 512, 96, 96, 544, 544]
    - [90, 2.265]
  - - [64, 512, 1, 1024, 96, 96, 1056, 1056]
    - [77, 3.683]
  - - [64, 512, 1, 2048, 96, 96, 2080, 2080]
    - [77, 5.274]
  - - [64, 512, 1, 4096, 96, 96, 4128, 4128]
    - [85, 6.691]
  - - [64, 512, 1, 8192, 96, 96, 8224, 8224]
    - [88, 7.699]
  - - [64, 1024, 1, 64, 96, 96, 96, 1024]
    - [81, 0.708]
  - - [64, 1024, 1, 128, 96, 96, 160, 1024]
    - [76, 1.355]
  - - [64, 1024, 1, 256, 96, 96, 288, 1024]
    - [79, 2.518]
  - - [64, 1024, 1, 512, 96, 96, 544, 1024]
    - [78, 4.454]
  - - [64, 1024, 1, 1024, 96, 96, 1056, 1056]
    - [88, 7.222]
  - - [64, 1024, 1, 2048, 96, 96, 2080, 2080]
    - [81, 10.345]
  - - [64, 1024, 1, 4096, 96, 96, 4128, 4128]
    - [70, 13.144]
  - - [64, 1024, 1, 8192, 96, 96, 8224, 8224]
    - [80, 15.202]
  - - [64, 2048, 1, 64, 96, 96, 96, 2048]
    - [70, 1.376]
  - - [64, 2048, 1, 128, 96, 96, 160, 2048]
    - [68, 2.634]
  - - [64, 2048, 1, 256, 96, 96, 288, 2048]
    - [68, 4.778]
  - - [64, 2048, 1, 512, 96, 96, 544, 2048]
    - [68, 8.154]
  - - [64, 2048, 1, 1024, 96, 96, 1056, 2048]
    - [79, 12.616]
  - - [64, 2048, 1, 2048, 96, 96, 2080, 2080]
    - [69, 17.365]
  - - [64, 2048, 1, 4096, 96, 96, 4128, 4128]
    - [80, 21.069]
  - - [64, 2048, 1, 8192, 96, 96, 8224, 8224]
    - [85, 23.399]
  - - [64, 4096, 1, 64, 96, 96, 96, 4096]
    - [98, 2.666]
  - - [64, 4096, 1, 128, 96, 96, 160, 4096]
    - [104, 5.038]
  - - [64, 4096, 1, 256, 96, 96, 288, 4096]
    - [118, 9.015]
  - - [64, 4096, 1, 512, 96, 96, 544, 4096]
    - [119, 14.91]
  - - [64, 4096, 1, 1024, 96, 96, 1056, 4096]
    - [97, 22.067]
  - - [64, 4096, 1, 2048, 96, 96, 2080, 4096]
    - [110, 28.764]
  - - [64, 4096, 1, 4096, 96, 96, 4128, 4128]
    - [133, 33.534]
  - - [64, 4096, 1, 8192, 96, 96, 8224, 8224]
    - [105, 37.307]
  - - [64, 8192, 1, 64, 96, 96, 96, 8192]
    - [115, 4.745]
  - - [64, 8192, 1, 128, 96, 96, 160, 8192]
    - [92, 8.783]
  - - [64, 8192, 1, 256, 96, 96, 288, 8192]
    - [118, 15.287]
  - - [64, 8192, 1, 512, 96, 96, 544, 8192]
    - [116, 23.741]
  - - [64, 8192, 1, 1024, 96, 96, 1056, 8192]
    - [123, 33.454]
  - - [64, 8192, 1, 2048, 96, 96, 2080, 8192]
    - [116, 42.221]
  - - [64, 8192, 1, 4096, 96, 96, 4128, 8192]
    - [116, 48.672]
  - - [64, 8192, 1, 8192, 96, 96, 8224, 8224]
    - [93, 50.42]
  - - [128, 64, 1, 64, 160, 160, 96, 96]
    - [81, 0.088]
  - - [128, 64, 1, 128, 160, 160, 160, 160]
    - [81, 0.169]
  - - [128, 64, 1, 256, 160, 160, 288, 288]
    - [81, 0.315]
  - - [128, 64, 1, 512, 160, 160, 544, 544]
    - [73, 0.56]
  - - [128, 64, 1, 1024, 160, 160, 1056, 1056]
    - [75, 0.904]
  - - [128, 64, 1, 2048, 160, 160, 2080, 2080]
    - [77, 1.304]
  - - [128, 64, 1, 4096, 160, 160, 4128, 4128]
    - [81, 1.664]
  - - [128, 64, 1, 8192, 160, 160, 8224, 8224]
    - [85, 1.921]
  - - [128, 128, 1, 64, 160, 160, 96, 128]
    - [78, 0.179]
  - - [128, 128, 1, 128, 160, 160, 160, 160]
    - [70, 0.342]
  - - [128, 128, 1, 256, 160, 160, 288, 288]
    - [85, 0.639]
  - - [128, 128, 1, 512, 160, 160, 544, 544]
    - [73, 1.127]
  - - [128, 128, 1, 1024, 160, 160, 1056, 1056]
    - [88, 1.84]
  - - [128, 128, 1, 2048, 160, 160, 2080, 2080]
    - [88, 2.644]
  - - [128, 128, 1, 4096, 160, 160, 4128, 4128]
    - [90, 3.375]
  - - [128, 128, 1, 8192, 160, 160, 8224, 8224]
    - [78, 3.861]
  - - [128, 256, 1, 64, 160, 160, 96, 256]
    - [90, 0.355]
  - - [128, 256, 1, 128, 160, 160, 160, 256]
    - [81, 0.687]
  - - [128, 256, 1, 256, 160, 160, 288, 288]
    - [73, 1.279]
  - - [128, 256, 1, 512, 160, 160, 544, 544]
    - [74, 2.265]
  - - [128, 256, 1, 1024, 160, 160, 1056, 1056]
    - [76, 3.688]
  - - [128, 256, 1, 2048, 160, 160, 2080, 2080]
    - [89, 5.312]
  - - [128, 256, 1, 4096, 160, 160, 4128, 4128]
    - [78, 6.738]
  - - [128, 256, 1, 8192, 160, 160, 8224, 8224]
    - [88, 7.807]
  - - [128, 512, 1, 64, 160, 160, 96, 512]
    - [80, 0.71]
  - - [128, 512, 1, 128, 160, 160, 160, 512]
    - [90, 1.363]
  - - [128, 512, 1, 256, 160, 160, 288, 512]
    - [81, 2.545]
  - - [128, 512, 1, 512, 160, 160, 544, 544]
    - [69, 4.466]
  - - [128, 512, 1, 1024, 160, 160, 1056, 1056]
    - [133, 5.814]
  - - [128, 512, 1, 2048, 160, 160, 2080, 2080]
    - [68, 10.337]
  - - [128, 512, 1, 4096, 160, 160, 4128, 4128]
    - [80, 13.183]
  - - [128, 512, 1, 8192, 160, 160, 8224, 8224]
    - [83, 15.226]
  - - [128, 1024, 1, 64, 160, 160, 96, 1024]
    - [86, 1.381]
  - - [128, 1024, 1, 128, 160, 160, 160, 1024]
    - [77, 2.612]
  - - [128, 1024, 1, 256, 160, 160, 288, 1024]
    - [80, 4.741]
  - - [128, 1024, 1, 512, 160, 160, 544, 1024]
    - [81, 8.199]
  - - [128, 1024, 1, 1024, 160, 160, 1056, 1056]
    - [70, 12.665]
  - - [128, 1024, 1, 2048, 160, 160, 2080, 2080]
    - [79, 17.352]
  - - [128, 1024, 1, 4096, 160, 160, 4128, 4128]
    - [74, 21.105]
  - - [128, 1024, 1, 8192, 160, 160, 8224, 8224]
    - [81, 23.686]
  - - [128, 2048, 1, 64, 160, 160, 96, 2048]
    - [131, 2.674]
  - - [128, 2048, 1, 128, 160, 160, 160, 2048]
    - [132, 5.054]
  - - [128, 2048, 1, 256, 160, 160, 288, 2048]
    - [117, 9.021]
  - - [128, 2048, 1, 512, 160, 160, 544, 2048]
    - [121, 14.995]
  - - [128, 2048, 1, 1024, 160, 160, 1056, 2048]
    - [121, 22.096]
  - - [128, 2048, 1, 2048, 160, 160, 2080, 2080]
    - [97, 28.922]
  - - [128, 2048, 1, 4096, 160, 160, 4128, 4128]
    - [95, 33.709]
  - - [128, 2048, 1, 8192, 160, 160, 8224, 8224]
    - [104, 37.474]
  - - [128, 4096, 1, 64, 160, 160, 96, 4096]
    - [123, 4.819]
  - - [128, 4096, 1, 128, 160, 160, 160, 4096]
    - [108, 8.971]
  - - [128, 4096, 1, 256, 160, 160, 288, 4096]
    - [113, 15.502]
  - - [128, 4096, 1, 512, 160, 160, 544, 4096]
    - [113, 24.283]
  - - [128, 4096, 1, 1024, 160, 160, 1056, 4096]
    - [94, 34.297]
  - - [128, 4096, 1, 2048, 160, 160, 2080, 4096]
    - [94, 42.935]
  - - [128, 4096, 1, 4096, 160, 160, 4128, 4128]
    - [93, 47.32]
  - - [128, 4096, 1, 8192, 160, 160, 8224, 8224]
    - [112, 50.166]
  - - [128, 8192, 1, 64, 160, 160, 96, 8192]
    - [14, 8.373]
  - - [128, 8192, 1, 128, 160, 160, 160, 8192]
    - [121, 14.829]
  - - [128, 8192, 1, 256, 160, 160, 288, 8192]
    - [139, 22.674]
  - - [128, 8192, 1, 512, 160, 160, 544, 8192]
    - [31, 33.551]
  - - [128, 8192, 1, 1024, 160, 160, 1056, 8192]
    - [65, 43.783]
  - - [128, 8192, 1, 2048, 160, 160, 2080, 8192]
    - [30, 51.251]
  - - [128, 8192, 1, 4096, 160, 160, 4128, 8192]
    - [30, 53.257]
  - - [128, 8192, 1, 8192, 160, 160, 8224, 8224]
    - [49, 56.114]
  - - [256, 64, 1, 64, 288, 288, 96, 96]
    - [71, 0.177]
  - - [256, 64, 1, 128, 288, 288, 160, 160]
    - [3, 0.322]
  - - [256, 64, 1, 256, 288, 288, 288, 288]
    - [85, 0.639]
  - - [256, 64, 1, 512, 288, 288, 544, 544]
    - [78, 1.128]
  - - [256, 64, 1, 1024, 288, 288, 1056, 1056]
    - [85, 1.834]
  - - [256, 64, 1, 2048, 288, 288, 2080, 2080]
    - [70, 2.504]
  - - [256, 64, 1, 4096, 288, 288, 4128, 4128]
    - [89, 3.372]
  - - [256, 64, 1, 8192, 288, 288, 8224, 8224]
    - [89, 3.855]
  - - [256, 128, 1, 64, 288, 288, 96, 128]
    - [80, 0.356]
  - - [256, 128, 1, 128, 288, 288, 160, 160]
    - [89, 0.688]
  - - [256, 128, 1, 256, 288, 288, 288, 288]
    - [85, 1.279]
  - - [256, 128, 1, 512, 288, 288, 544, 544]
    - [84, 2.259]
  - - [256, 128, 1, 1024, 288, 288, 1056, 1056]
    - [85, 3.681]
  - - [256, 128, 1, 2048, 288, 288, 2080, 2080]
    - [76, 5.3]
  - - [256, 128, 1, 4096, 288, 288, 4128, 4128]
    - [89, 6.775]
  - - [256, 128, 1, 8192, 288, 288, 8224, 8224]
    - [76, 7.762]
  - - [256, 256, 1, 64, 288, 288, 96, 256]
    - [89, 0.711]
  - - [256, 256, 1, 128, 288, 288, 160, 256]
    - [79, 1.357]
  - - [256, 256, 1, 256, 288, 288, 288, 288]
    - [80, 2.558]
  - - [256, 256, 1, 512, 288, 288, 544, 544]
    - [78, 4.471]
  - - [256, 256, 1, 1024, 288, 288, 1056, 1056]
    - [75, 7.222]
  - - [256, 256, 1, 2048, 288, 288, 2080, 2080]
    - [69, 10.36]
  - - [256, 256, 1, 4096, 288, 288, 4128, 4128]
    - [70, 13.293]
  - - [256, 256, 1, 8192, 288, 288, 8224, 8224]
    - [70, 15.263]
  - - [256, 512, 1, 64, 288, 288, 96, 512]
    - [87, 1.382]
  - - [256, 512, 1, 128, 288, 288, 160, 512]
    - [88, 2.625]
  - - [256, 512, 1, 256, 288, 288, 288, 512]
    - [69, 4.789]
  - - [256, 512, 1, 512, 288, 288, 544, 544]
    - [79, 8.2]
  - - [256, 512, 1, 1024, 288, 288, 1056, 1056]
    - [70, 12.623]
  - - [256, 512, 1, 2048, 288, 288, 2080, 2080]
    - [68, 17.274]
  - - [256, 512, 1, 4096, 288, 288, 4128, 4128]
    - [81, 21.104]
  - - [256, 512, 1, 8192, 288, 288, 8224, 8224]
    - [81, 23.567]
  - - [256, 1024, 1, 64, 288, 288, 96, 1024]
    - [122, 2.651]
  - - [256, 1024, 1, 128, 288, 288, 160, 1024]
    - [97, 5.023]
  - - [256, 1024, 1, 256, 288, 288, 288, 1024]
    - [111, 8.929]
  - - [256, 1024, 1, 512, 288, 288, 544, 1024]
    - [110, 14.587]
  - - [256, 1024, 1, 1024, 288, 288, 1056, 1056]
    - [95, 21.972]
  - - [256, 1024, 1, 2048, 288, 288, 2080, 2080]
    - [98, 28.835]
  - - [256, 1024, 1, 4096, 288, 288, 4128, 4128]
    - [104, 33.559]
  - - [256, 1024, 1, 8192, 288, 288, 8224, 8224]
    - [128, 37.489]
  - - [256, 2048, 1, 64, 288, 288, 96, 2048]
    - [93, 4.812]
  - - [256, 2048, 1, 128, 288, 288, 160, 2048]
    - [92, 8.846]
  - - [256, 2048, 1, 256, 288, 288, 288, 2048]
    - [127, 15.397]
  - - [256, 2048, 1, 512, 288, 288, 544, 2048]
    - [91, 24.346]
  - - [256, 2048, 1, 1024, 288, 288, 1056, 2048]
    - [94, 34.441]
  - - [256, 2048, 1, 2048, 288, 288, 2080, 2080]
    - [99, 42.309]
  - - [256, 2048, 1, 4096, 288, 288, 4128, 4128]
    - [94, 47.979]
  - - [256, 2048, 1, 8192, 288, 288, 8224, 8224]
    - [110, 50.203]
  - - [256, 4096, 1, 64, 288, 288, 96, 4096]
    - [119, 8.307]
  - - [256, 4096, 1, 128, 288, 288, 160, 4096]
    - [129, 14.712]
  - - [256, 4096, 1, 256, 288, 288, 288, 4096]
    - [31, 22.405]
  - - [256, 4096, 1, 512, 288, 288, 544, 4096]
    - [31, 33.361]
  - - [256, 4096, 1, 1024, 288, 288, 1056, 4096]
    - [31, 43.516]
  - - [256, 4096, 1, 2048, 288, 288, 2080, 4096]
    - [31, 51.072]
  - - [256, 4096, 1, 4096, 288, 288, 4128, 4128]
    - [65, 53.281]
  - - [256, 4096, 1, 8192, 288, 288, 8224, 8224]
    - [48, 56.026]
  - - [256, 8192, 1, 64, 288, 288, 96, 8192]
    - [116, 12.998]
  - - [256, 8192, 1, 128, 288, 288, 160, 8192]
    - [61, 23.808]
  - - [256, 8192, 1, 256, 288, 288, 288, 8192]
    - [160, 36.196]
  - - [256, 8192, 1, 512, 288, 288, 544, 8192]
    - [151, 48.482]
  - - [256, 8192, 1, 1024, 288, 288, 1056, 8192]
    - [138, 58.829]
  - - [256, 8192, 1, 2048, 288, 288, 2080, 8192]
    - [162, 65.09]
  - - [256, 8192, 1, 4096, 288, 288, 4128, 8192]
    - [153, 70.928]
  - - [256, 8192, 1, 8192, 288, 288, 8224, 8224]
    - [158, 64.801]
  - - [384, 64, 1, 64, 416, 416, 96, 96]
    - [87, 0.268]
  - - [384, 64, 1, 128, 416, 416, 160, 160]
    - [84, 0.516]
  - - [384, 64, 1, 256, 416, 416, 288, 288]
    - [84, 0.965]
  - - [384, 64, 1, 512, 416, 416, 544, 544]
    - [73, 1.701]
  - - [384, 64, 1, 1024, 416, 416, 1056, 1056]
    - [70, 2.738]
  - - [384, 64, 1, 2048, 416, 416, 2080, 2080]
    - [89, 3.904]
  - - [384, 64, 1, 4096, 416, 416, 4128, 4128]
    - [90, 4.994]
  - - [384, 64, 1, 8192, 416, 416, 8224, 8224]
    - [69, 5.692]
  - - [384, 128, 1, 64, 416, 416, 96, 128]
    - [69, 0.537]
  - - [384, 128, 1, 128, 416, 416, 160, 160]
    - [74, 1.036]
  - - [384, 128, 1, 256, 416, 416, 288, 288]
    - [74, 1.937]
  - - [384, 128, 1, 512, 416, 416, 544, 544]
    - [80, 3.367]
  - - [384, 128, 1, 1024, 416, 416, 1056, 1056]
    - [75, 5.494]
  - - [384, 128, 1, 2048, 416, 416, 2080, 2080]
    - [78, 7.82]
  - - [384, 128, 1, 4096, 416, 416, 4128, 4128]
    - [85, 9.984]
  - - [384, 128, 1, 8192, 416, 416, 8224, 8224]
    - [75, 11.462]
  - - [384, 256, 1, 64, 416, 416, 96, 256]
    - [70, 1.063]
  - - [384, 256, 1, 128, 416, 416, 160, 256]
    - [70, 2.045]
  - - [384, 256, 1, 256, 416, 416, 288, 288]
    - [69, 3.804]
  - - [384, 256, 1, 512, 416, 416, 544, 544]
    - [69, 6.678]
  - - [384, 256, 1, 1024, 416, 416, 1056, 1056]
    - [84, 10.72]
  - - [384, 256, 1, 2048, 416, 416, 2080, 2080]
    - [81, 15.061]
  - - [384, 256, 1, 4096, 416, 416, 4128, 4128]
    - [80, 19.635]
  - - [384, 256, 1, 8192, 416, 416, 8224, 8224]
    - [79, 22.761]
  - - [384, 512, 1, 64, 416, 416, 96, 512]
    - [82, 2.066]
  - - [384, 512, 1, 128, 416, 416, 160, 512]
    - [95, 3.853]
  - - [384, 512, 1, 256, 416, 416, 288, 512]
    - [95, 6.946]
  - - [384, 512, 1, 512, 416, 416, 544, 544]
    - [121, 11.624]
  - - [384, 512, 1, 1024, 416, 416, 1056, 1056]
    - [120, 17.412]
  - - [384, 512, 1, 2048, 416, 416, 2080, 2080]
    - [98, 23.199]
  - - [384, 512, 1, 4096, 416, 416, 4128, 4128]
    - [95, 27.035]
  - - [384, 512, 1, 8192, 416, 416, 8224, 8224]
    - [120, 30.577]
  - - [384, 1024, 1, 64, 416, 416, 96, 1024]
    - [122, 3.871]
  - - [384, 1024, 1, 128, 416, 416, 160, 1024]
    - [97, 7.307]
  - - [384, 1024, 1, 256, 416, 416, 288, 1024]
    - [98, 13.106]
  - - [384, 1024, 1, 512, 416, 416, 544, 1024]
    - [121, 20.991]
  - - [384, 1024, 1, 1024, 416, 416, 1056, 1056]
    - [113, 30.405]
  - - [384, 1024, 1, 2048, 416, 416, 2080, 2080]
    - [114, 39.268]
  - - [384, 1024, 1, 4096, 416, 416, 4128, 4128]
    - [121, 46.347]
  - - [384, 1024, 1, 8192, 416, 416, 8224, 8224]
    - [98, 52.707]
  - - [384, 2048, 1, 64, 416, 416, 96, 2048]
    - [114, 6.579]
  - - [384, 2048, 1, 128, 416, 416, 160, 2048]
    - [15, 11.939]
  - - [384, 2048, 1, 256, 416, 416, 288, 2048]
    - [100, 19.142]
  - - [384, 2048, 1, 512, 416, 416, 544, 2048]
    - [8, 28.946]
  - - [384, 2048, 1, 1024, 416, 416, 1056, 2048]
    - [9, 38.752]
  - - [384, 2048, 1, 2048, 416, 416, 2080, 2080]
    - [20, 46.578]
  - - [384, 2048, 1, 4096, 416, 416, 4128, 4128]
    - [133, 51.963]
  - - [384, 2048, 1, 8192, 416, 416, 8224, 8224]
    - [11, 55.23]
  - - [384, 4096, 1, 64, 416, 416, 96, 4096]
    - [131, 11.181]
  - - [384, 4096, 1, 128, 416, 416, 160, 4096]
    - [136, 18.738]
  - - [384, 4096, 1, 256, 416, 416, 288, 4096]
    - [135, 32.423]
  - - [384, 4096, 1, 512, 416, 416, 544, 4096]
    - [60, 46.781]
  - - [384, 4096, 1, 1024, 416, 416, 1056, 4096]
    - [43, 59.2]
  - - [384, 4096, 1, 2048, 416, 416, 2080, 4096]
    - [56, 71.342]
  - - [384, 4096, 1, 4096, 416, 416, 4128, 4128]
    - [56, 74.8]
  - - [384, 4096, 1, 8192, 416, 416, 8224, 8224]
    - [56, 78.282]
  - - [384, 8192, 1, 64, 416, 416, 96, 8192]
    - [64, 18.493]
  - - [384, 8192, 1, 128, 416, 416, 160, 8192]
    - [147, 29.18]
  - - [384, 8192, 1, 256, 416, 416, 288, 8192]
    - [58, 42.606]
  - - [384, 8192, 1, 512, 416, 416, 544, 8192]
    - [139, 55.047]
  - - [384, 8192, 1, 1024, 416, 416, 1056, 8192]
    - [138, 64.709]
  - - [384, 8192, 1, 2048, 416, 416, 2080, 8192]
    - [155, 70.319]
  - - [384, 8192, 1, 4096, 416, 416, 4128, 8192]
    - [137, 75.022]
  - - [384, 8192, 1, 8192, 416, 416, 8224, 8224]
    - [149, 68.943]
  - - [768, 64, 1, 64, 800, 800, 96, 96]
    - [73, 0.536]
  - - [768, 64, 1, 128, 800, 800, 160, 160]
    - [77, 1.042]
  - - [768, 64, 1, 256, 800, 800, 288, 288]
    - [75, 1.94]
  - - [768, 64, 1, 512, 800, 800, 544, 544]
    - [84, 3.414]
  - - [768, 64, 1, 1024, 800, 800, 1056, 1056]
    - [1, 4.402]
  - - [768, 64, 1, 2048, 800, 800, 2080, 2080]
    - [84, 7.817]
  - - [768, 64, 1, 4096, 800, 800, 4128, 4128]
    - [74, 9.956]
  - - [768, 64, 1, 8192, 800, 800, 8224, 8224]
    - [74, 11.407]
  - - [768, 128, 1, 64, 800, 800, 96, 128]
    - [78, 1.059]
  - - [768, 128, 1, 128, 800, 800, 160, 160]
    - [90, 2.05]
  - - [768, 128, 1, 256, 800, 800, 288, 288]
    - [85, 3.762]
  - - [768, 128, 1, 512, 800, 800, 544, 544]
    - [74, 6.637]
  - - [768, 128, 1, 1024, 800, 800, 1056, 1056]
    - [75, 10.759]
  - - [768, 128, 1, 2048, 800, 800, 2080, 2080]
    - [84, 15.336]
  - - [768, 128, 1, 4096, 800, 800, 4128, 4128]
    - [74, 19.738]
  - - [768, 128, 1, 8192, 800, 800, 8224, 8224]
    - [85, 22.281]
  - - [768, 256, 1, 64, 800, 800, 96, 256]
    - [127, 2.041]
  - - [768, 256, 1, 128, 800, 800, 160, 256]
    - [118, 3.859]
  - - [768, 256, 1, 256, 800, 800, 288, 288]
    - [97, 6.951]
  - - [768, 256, 1, 512, 800, 800, 544, 544]
    - [130, 11.522]
  - - [768, 256, 1, 1024, 800, 800, 1056, 1056]
    - [98, 17.357]
  - - [768, 256, 1, 2048, 800, 800, 2080, 2080]
    - [97, 23.078]
  - - [768, 256, 1, 4096, 800, 800, 4128, 4128]
    - [125, 26.806]
  - - [768, 256, 1, 8192, 800, 800, 8224, 8224]
    - [97, 30.319]
  - - [768, 512, 1, 64, 800, 800, 96, 512]
    - [101, 3.861]
  - - [768, 512, 1, 128, 800, 800, 160, 512]
    - [120, 7.261]
  - - [768, 512, 1, 256, 800, 800, 288, 512]
    - [121, 13.001]
  - - [768, 512, 1, 512, 800, 800, 544, 544]
    - [123, 20.842]
  - - [768, 512, 1, 1024, 800, 800, 1056, 1056]
    - [124, 30.205]
  - - [768, 512, 1, 2048, 800, 800, 2080, 2080]
    - [115, 39.049]
  - - [768, 512, 1, 4096, 800, 800, 4128, 4128]
    - [119, 46.462]
  - - [768, 512, 1, 8192, 800, 800, 8224, 8224]
    - [121, 53.452]
  - - [768, 1024, 1, 64, 800, 800, 96, 1024]
    - [120, 6.554]
  - - [768, 1024, 1, 128, 800, 800, 160, 1024]
    - [97, 12.035]
  - - [768, 1024, 1, 256, 800, 800, 288, 1024]
    - [100, 19.344]
  - - [768, 1024, 1, 512, 800, 800, 544, 1024]
    - [19, 29.2]
  - - [768, 1024, 1, 1024, 800, 800, 1056, 1056]
    - [9, 39.209]
  - - [768, 1024, 1, 2048, 800, 800, 2080, 2080]
    - [121, 48.036]
  - - [768, 1024, 1, 4096, 800, 800, 4128, 4128]
    - [120, 55.693]
  - - [768, 1024, 1, 8192, 800, 800, 8224, 8224]
    - [120, 57.257]
  - - [768, 2048, 1, 64, 800, 800, 96, 2048]
    - [118, 11.153]
  - - [768, 2048, 1, 128, 800, 800, 160, 2048]
    - [158, 18.69]
  - - [768, 2048, 1, 256, 800, 800, 288, 2048]
    - [140, 32.126]
  - - [768, 2048, 1, 512, 800, 800, 544, 2048]
    - [34, 45.82]
  - - [768, 2048, 1, 1024, 800, 800, 1056, 2048]
    - [56, 58.259]
  - - [768, 2048, 1, 2048, 800, 800, 2080, 2080]
    - [27, 69.092]
  - - [768, 2048, 1, 4096, 800, 800, 4128, 4128]
    - [139, 73.639]
  - - [768, 2048, 1, 8192, 800, 800, 8224, 8224]
    - [24, 79.169]
  - - [768, 4096, 1, 64, 800, 800, 96, 4096]
    - [46, 18.572]
  - - [768, 4096, 1, 128, 800, 800, 160, 4096]
    - [143, 30.093]
  - - [768, 4096, 1, 256, 800, 800, 288, 4096]
    - [32, 42.164]
  - - [768, 4096, 1, 512, 800, 800, 544, 4096]
    - [46, 54.757]
  - - [768, 4096, 1, 1024, 800, 800, 1056, 4096]
    - [138, 67.104]
  - - [768, 4096, 1, 2048, 800, 800, 2080, 4096]
    - [138, 73.273]
  - - [768, 4096, 1, 4096, 800, 800, 4128, 4128]
    - [59, 73.011]
  - - [768, 4096, 1, 8192, 800, 800, 8224, 8224]
    - [155, 72.869]
  - - [768, 8192, 1, 64, 800, 800, 96, 8192]
    - [52, 25.038]
  - - [768, 8192, 1, 128, 800, 800, 160, 8192]
    - [146, 39.188]
  - - [768, 8192, 1, 256, 800, 800, 288, 8192]
    - [47, 51.564]
  - - [768, 8192, 1, 512, 800, 800, 544, 8192]
    - [139, 63.816]
  - - [768, 8192, 1, 1024, 800, 800, 1056, 8192]
    - [139, 68.562]
  - - [768, 8192, 1, 2048, 800, 800, 2080, 8192]
    - [155, 76.189]
  - - [768, 8192, 1, 4096, 800, 800, 4128, 8192]
    - [24, 66.529]
  - - [768, 8192, 1, 8192, 800, 800, 8224, 8224]
    - [155, 65.713]
  - - [1536, 64, 1, 64, 1568, 1568, 96, 96]
    - [84, 1.044]
  - - [1536, 64, 1, 128, 1568, 1568, 160, 160]
    - [69, 2.041]
  - - [1536, 64, 1, 256, 1568, 1568, 288, 288]
    - [78, 3.814]
  - - [1536, 64, 1, 512, 1568, 1568, 544, 544]
    - [84, 6.671]
  - - [1536, 64, 1, 1024, 1568, 1568, 1056, 1056]
    - [77, 10.731]
  - - [1536, 64, 1, 2048, 1568, 1568, 2080, 2080]
    - [76, 15.366]
  - - [1536, 64, 1, 4096, 1568, 1568, 4128, 4128]
    - [83, 19.512]
  - - [1536, 64, 1, 8192, 1568, 1568, 8224, 8224]
    - [77, 21.992]
  - - [1536, 128, 1, 64, 1568, 1568, 96, 128]
    - [77, 2.057]
  - - [1536, 128, 1, 128, 1568, 1568, 160, 160]
    - [120, 3.832]
  - - [1536, 128, 1, 256, 1568, 1568, 288, 288]
    - [97, 6.893]
  - - [1536, 128, 1, 512, 1568, 1568, 544, 544]
    - [98, 11.618]
  - - [1536, 128, 1, 1024, 1568, 1568, 1056, 1056]
    - [95, 17.338]
  - - [1536, 128, 1, 2048, 1568, 1568, 2080, 2080]
    - [97, 23.142]
  - - [1536, 128, 1, 4096, 1568, 1568, 4128, 4128]
    - [104, 27.222]
  - - [1536, 128, 1, 8192, 1568, 1568, 8224, 8224]
    - [98, 30.503]
  - - [1536, 256, 1, 64, 1568, 1568, 96, 256]
    - [98, 3.87]
  - - [1536, 256, 1, 128, 1568, 1568, 160, 256]
    - [95, 7.322]
  - - [1536, 256, 1, 256, 1568, 1568, 288, 288]
    - [120, 13.065]
  - - [1536, 256, 1, 512, 1568, 1568, 544, 544]
    - [103, 21.093]
  - - [1536, 256, 1, 1024, 1568, 1568, 1056, 1056]
    - [22, 30.003]
  - - [1536, 256, 1, 2048, 1568, 1568, 2080, 2080]
    - [121, 39.31]
  - - [1536, 256, 1, 4096, 1568, 1568, 4128, 4128]
    - [98, 47.402]
  - - [1536, 256, 1, 8192, 1568, 1568, 8224, 8224]
    - [120, 52.883]
  - - [1536, 512, 1, 64, 1568, 1568, 96, 512]
    - [102, 6.593]
  - - [1536, 512, 1, 128, 1568, 1568, 160, 512]
    - [97, 11.955]
  - - [1536, 512, 1, 256, 1568, 1568, 288, 512]
    - [10, 19.3]
  - - [1536, 512, 1, 512, 1568, 1568, 544, 544]
    - [13, 28.777]
  - - [1536, 512, 1, 1024, 1568, 1568, 1056, 1056]
    - [16, 38.624]
  - - [1536, 512, 1, 2048, 1568, 1568, 2080, 2080]
    - [98, 48.331]
  - - [1536, 512, 1, 4096, 1568, 1568, 4128, 4128]
    - [98, 54.949]
  - - [1536, 512, 1, 8192, 1568, 1568, 8224, 8224]
    - [98, 57.987]
  - - [1536, 1024, 1, 64, 1568, 1568, 96, 1024]
    - [109, 11.102]
  - - [1536, 1024, 1, 128, 1568, 1568, 160, 1024]
    - [161, 19.061]
  - - [1536, 1024, 1, 256, 1568, 1568, 288, 1024]
    - [50, 32.381]
  - - [1536, 1024, 1, 512, 1568, 1568, 544, 1024]
    - [34, 45.862]
  - - [1536, 1024, 1, 1024, 1568, 1568, 1056, 1056]
    - [24, 58.071]
  - - [1536, 1024, 1, 2048, 1568, 1568, 2080, 2080]
    - [28, 70.865]
  - - [1536, 1024, 1, 4096, 1568, 1568, 4128, 4128]
    - [27, 76.661]
  - - [1536, 1024, 1, 8192, 1568, 1568, 8224, 8224]
    - [29, 80.246]
  - - [1536, 2048, 1, 64, 1568, 1568, 96, 2048]
    - [25, 18.388]
  - - [1536, 2048, 1, 128, 1568, 1568, 160, 2048]
    - [33, 29.336]
  - - [1536, 2048, 1, 256, 1568, 1568, 288, 2048]
    - [49, 41.173]
  - - [1536, 2048, 1, 512, 1568, 1568, 544, 2048]
    - [39, 54.906]
  - - [1536, 2048, 1, 1024, 1568, 1568, 1056, 2048]
    - [138, 65.48]
  - - [1536, 2048, 1, 2048, 1568, 1568, 2080, 2080]
    - [139, 68.232]
  - - [1536, 2048, 1, 4096, 1568, 1568, 4128, 4128]
    - [41, 72.653]
  - - [1536, 2048, 1, 8192, 1568, 1568, 8224, 8224]
    - [138, 68.987]
  - - [1536, 4096, 1, 64, 1568, 1568, 96, 4096]
    - [39, 25.07]
  - - [1536, 4096, 1, 128, 1568, 1568, 160, 4096]
    - [147, 38.892]
  - - [1536, 4096, 1, 256, 1568, 1568, 288, 4096]
    - [135, 51.32]
  - - [1536, 4096, 1, 512, 1568, 1568, 544, 4096]
    - [138, 63.609]
  - - [1536, 4096, 1, 1024, 1568, 1568, 1056, 4096]
    - [139, 69.809]
  - - [1536, 4096, 1, 2048, 1568, 1568, 2080, 4096]
    - [63, 71.541]
  - - [1536, 4096, 1, 4096, 1568, 1568, 4128, 4128]
    - [155, 68.105]
  - - [1536, 4096, 1, 8192, 1568, 1568, 8224, 8224]
    - [137, 68.257]
  - - [1536, 8192, 1, 64, 1568, 1568, 96, 8192]
    - [45, 33.786]
  - - [1536, 8192, 1, 128, 1568, 1568, 160, 8192]
    - [135, 47.918]
  - - [1536, 8192, 1, 256, 1568, 1568, 288, 8192]
    - [147, 58.425]
  - - [1536, 8192, 1, 512, 1568, 1568, 544, 8192]
    - [28, 63.978]
  - - [1536, 8192, 1, 1024, 1568, 1568, 1056, 8192]
    - [55, 71.454]
  - - [1536, 8192, 1, 2048, 1568, 1568, 2080, 8192]
    - [154, 66.108]
  - - [1536, 8192, 1, 4096, 1568, 1568, 4128, 8192]
    - [152, 67.81]
  - - [1536, 8192, 1, 8192, 1568, 1568, 8224, 8224]
    - [156, 66.05]
  - - [3072, 64, 1, 64, 3104, 3104, 96, 96]
    - [72, 1.958]
  - - [3072, 64, 1, 128, 3104, 3104, 160, 160]
    - [121, 3.84]
  - - [3072, 64, 1, 256, 3104, 3104, 288, 288]
    - [105, 6.926]
  - - [3072, 64, 1, 512, 3104, 3104, 544, 544]
    - [97, 11.522]
  - - [3072, 64, 1, 1024, 3104, 3104, 1056, 1056]
    - [98, 17.324]
  - - [3072, 64, 1, 2048, 3104, 3104, 2080, 2080]
    - [97, 23.137]
  - - [3072, 64, 1, 4096, 3104, 3104, 4128, 4128]
    - [121, 27.194]
  - - [3072, 64, 1, 8192, 3104, 3104, 8224, 8224]
    - [97, 30.572]
  - - [3072, 128, 1, 64, 3104, 3104, 96, 128]
    - [118, 3.903]
  - - [3072, 128, 1, 128, 3104, 3104, 160, 160]
    - [120, 7.303]
  - - [3072, 128, 1, 256, 3104, 3104, 288, 288]
    - [111, 13.112]
  - - [3072, 128, 1, 512, 3104, 3104, 544, 544]
    - [126, 21.35]
  - - [3072, 128, 1, 1024, 3104, 3104, 1056, 1056]
    - [120, 30.95]
  - - [3072, 128, 1, 2048, 3104, 3104, 2080, 2080]
    - [121, 40.922]
  - - [3072, 128, 1, 4096, 3104, 3104, 4128, 4128]
    - [119, 48.209]
  - - [3072, 128, 1, 8192, 3104, 3104, 8224, 8224]
    - [96, 54.251]
  - - [3072, 256, 1, 64, 3104, 3104, 96, 256]
    - [106, 6.582]
  - - [3072, 256, 1, 128, 3104, 3104, 160, 256]
    - [91, 11.953]
  - - [3072, 256, 1, 256, 3104, 3104, 288, 288]
    - [19, 19.113]
  - - [3072, 256, 1, 512, 3104, 3104, 544, 544]
    - [12, 28.562]
  - - [3072, 256, 1, 1024, 3104, 3104, 1056, 1056]
    - [18, 38.202]
  - - [3072, 256, 1, 2048, 3104, 3104, 2080, 2080]
    - [6, 47.231]
  - - [3072, 256, 1, 4096, 3104, 3104, 4128, 4128]
    - [6, 53.501]
  - - [3072, 256, 1, 8192, 3104, 3104, 8224, 8224]
    - [121, 56.808]
  - - [3072, 512, 1, 64, 3104, 3104, 96, 512]
    - [128, 11.201]
  - - [3072, 512, 1, 128, 3104, 3104, 160, 512]
    - [135, 19.069]
  - - [3072, 512, 1, 256, 3104, 3104, 288, 512]
    - [60, 31.817]
  - - [3072, 512, 1, 512, 3104, 3104, 544, 544]
    - [157, 44.95]
  - - [3072, 512, 1, 1024, 3104, 3104, 1056, 1056]
    - [66, 57.335]
  - - [3072, 512, 1, 2048, 3104, 3104, 2080, 2080]
    - [56, 69.919]
  - - [3072, 512, 1, 4096, 3104, 3104, 4128, 4128]
    - [153, 75.666]
  - - [3072, 512, 1, 8192, 3104, 3104, 8224, 8224]
    - [24, 77.609]
  - - [3072, 1024, 1, 64, 3104, 3104, 96, 1024]
    - [40, 17.713]
  - - [3072, 1024, 1, 128, 3104, 3104, 160, 1024]
    - [42, 28.853]
  - - [3072, 1024, 1, 256, 3104, 3104, 288, 1024]
    - [49, 40.836]
  - - [3072, 1024, 1, 512, 3104, 3104, 544, 1024]
    - [57, 54.599]
  - - [3072, 1024, 1, 1024, 3104, 3104, 1056, 1056]
    - [139, 62.342]
  - - [3072, 1024, 1, 2048, 3104, 3104, 2080, 2080]
    - [138, 66.153]
  - - [3072, 1024, 1, 4096, 3104, 3104, 4128, 4128]
    - [148, 70.296]
  - - [3072, 1024, 1, 8192, 3104, 3104, 8224, 8224]
    - [36, 68.065]
  - - [3072, 2048, 1, 64, 3104, 3104, 96, 2048]
    - [20, 24.959]
  - - [3072, 2048, 1, 128, 3104, 3104, 160, 2048]
    - [134, 38.832]
  - - [3072, 2048, 1, 256, 3104, 3104, 288, 2048]
    - [135, 51.078]
  - - [3072, 2048, 1, 512, 3104, 3104, 544, 2048]
    - [139, 63.881]
  - - [3072, 2048, 1, 1024, 3104, 3104, 1056, 2048]
    - [154, 67.035]
  - - [3072, 2048, 1, 2048, 3104, 3104, 2080, 2080]
    - [149, 70.692]
  - - [3072, 2048, 1, 4096, 3104, 3104, 4128, 4128]
    - [145, 70.286]
  - - [3072, 2048, 1, 8192, 3104, 3104, 8224, 8224]
    - [141, 68.077]
  - - [3072, 4096, 1, 64, 3104, 3104, 96, 4096]
    - [35, 32.797]
  - - [3072, 4096, 1, 128, 3104, 3104, 160, 4096]
    - [151, 47.473]
  - - [3072, 4096, 1, 256, 3104, 3104, 288, 4096]
    - [136, 58.106]
  - - [3072, 4096, 1, 512, 3104, 3104, 544, 4096]
    - [29, 63.414]
  - - [3072, 4096, 1, 1024, 3104, 3104, 1056, 4096]
    - [152, 70.793]
  - - [3072, 4096, 1, 2048, 3104, 3104, 2080, 4096]
    - [53, 67.799]
  - - [3072, 4096, 1, 4096, 3104, 3104, 4128, 4128]
    - [158, 67.608]
  - - [3072, 4096, 1, 8192, 3104, 3104, 8224, 8224]
    - [62, 66.963]
  - - [3072, 8192, 1, 64, 3104, 3104, 96, 8192]
    - [4, 34.721]
  - - [3072, 8192, 1, 128, 3104, 3104, 160, 8192]
    - [147, 50.465]
  - - [3072, 8192, 1, 256, 3104, 3104, 288, 8192]
    - [140, 63.057]
  - - [3072, 8192, 1, 512, 3104, 3104, 544, 8192]
    - [51, 67.787]
  - - [3072, 8192, 1, 1024, 3104, 3104, 1056, 8192]
    - [162, 62.708]
  - - [3072, 8192, 1, 2048, 3104, 3104, 2080, 8192]
    - [152, 62.359]
  - - [3072, 8192, 1, 4096, 3104, 3104, 4128, 8192]
    - [152, 66.051]
  - - [3072, 8192, 1, 8192, 3104, 3104, 8224, 8224]
    - [134, 65.636]
  - - [6144, 64, 1, 64, 6176, 6176, 96, 96]
    - [7, 3.669]
  - - [6144, 64, 1, 128, 6176, 6176, 160, 160]
    - [107, 7.177]
  - - [6144, 64, 1, 256, 6176, 6176, 288, 288]
    - [111, 12.993]
  - - [6144, 64, 1, 512, 6176, 6176, 544, 544]
    - [121, 21.47]
  - - [6144, 64, 1, 1024, 6176, 6176, 1056, 1056]
    - [121, 31.854]
  - - [6144, 64, 1, 2048, 6176, 6176, 2080, 2080]
    - [128, 42.01]
  - - [6144, 64, 1, 4096, 6176, 6176, 4128, 4128]
    - [121, 49.29]
  - - [6144, 64, 1, 8192, 6176, 6176, 8224, 8224]
    - [97, 55.092]
  - - [6144, 128, 1, 64, 6176, 6176, 96, 128]
    - [98, 6.557]
  - - [6144, 128, 1, 128, 6176, 6176, 160, 160]
    - [97, 11.957]
  - - [6144, 128, 1, 256, 6176, 6176, 288, 288]
    - [128, 19.25]
  - - [6144, 128, 1, 512, 6176, 6176, 544, 544]
    - [21, 28.559]
  - - [6144, 128, 1, 1024, 6176, 6176, 1056, 1056]
    - [120, 38.385]
  - - [6144, 128, 1, 2048, 6176, 6176, 2080, 2080]
    - [121, 47.511]
  - - [6144, 128, 1, 4096, 6176, 6176, 4128, 4128]
    - [5, 53.735]
  - - [6144, 128, 1, 8192, 6176, 6176, 8224, 8224]
    - [17, 55.941]
  - - [6144, 256, 1, 64, 6176, 6176, 96, 256]
    - [131, 11.265]
  - - [6144, 256, 1, 128, 6176, 6176, 160, 256]
    - [54, 18.665]
  - - [6144, 256, 1, 256, 6176, 6176, 288, 288]
    - [134, 31.464]
  - - [6144, 256, 1, 512, 6176, 6176, 544, 544]
    - [34, 45.014]
  - - [6144, 256, 1, 1024, 6176, 6176, 1056, 1056]
    - [38, 57.208]
  - - [6144, 256, 1, 2048, 6176, 6176, 2080, 2080]
    - [154, 69.636]
  - - [6144, 256, 1, 4096, 6176, 6176, 4128, 4128]
    - [153, 75.573]
  - - [6144, 256, 1, 8192, 6176, 6176, 8224, 8224]
    - [153, 79.264]
  - - [6144, 512, 1, 64, 6176, 6176, 96, 512]
    - [104, 17.35]
  - - [6144, 512, 1, 128, 6176, 6176, 160, 512]
    - [135, 28.299]
  - - [6144, 512, 1, 256, 6176, 6176, 288, 512]
    - [67, 40.22]
  - - [6144, 512, 1, 512, 6176, 6176, 544, 544]
    - [39, 54.003]
  - - [6144, 512, 1, 1024, 6176, 6176, 1056, 1056]
    - [26, 61.525]
  - - [6144, 512, 1, 2048, 6176, 6176, 2080, 2080]
    - [57, 65.9]
  - - [6144, 512, 1, 4096, 6176, 6176, 4128, 4128]
    - [144, 72.606]
  - - [6144, 512, 1, 8192, 6176, 6176, 8224, 8224]
    - [23, 66.284]
  - - [6144, 1024, 1, 64, 6176, 6176, 96, 1024]
    - [98, 24.663]
  - - [6144, 1024, 1, 128, 6176, 6176, 160, 1024]
    - [135, 38.6]
  - - [6144, 1024, 1, 256, 6176, 6176, 288, 1024]
    - [29, 50.89]
  - - [6144, 1024, 1, 512, 6176, 6176, 544, 1024]
    - [154, 61.751]
  - - [6144, 1024, 1, 1024, 6176, 6176, 1056, 1056]
    - [163, 65.828]
  - - [6144, 1024, 1, 2048, 6176, 6176, 2080, 2080]
    - [163, 72.182]
  - - [6144, 1024, 1, 4096, 6176, 6176, 4128, 4128]
    - [159, 65.902]
  - - [6144, 1024, 1, 8192, 6176, 6176, 8224, 8224]
    - [54, 68.1]
  - - [6144, 2048, 1, 64, 6176, 6176, 96, 2048]
    - [98, 31.114]
  - - [6144, 2048, 1, 128, 6176, 6176, 160, 2048]
    - [135, 47.435]
  - - [6144, 2048, 1, 256, 6176, 6176, 288, 2048]
    - [151, 58.391]
  - - [6144, 2048, 1, 512, 6176, 6176, 544, 2048]
    - [136, 65.155]
  - - [6144, 2048, 1, 1024, 6176, 6176, 1056, 2048]
    - [57, 70.619]
  - - [6144, 2048, 1, 2048, 6176, 6176, 2080, 2080]
    - [135, 64.912]
  - - [6144, 2048, 1, 4096, 6176, 6176, 4128, 4128]
    - [142, 67.027]
  - - [6144, 2048, 1, 8192, 6176, 6176, 8224, 8224]
    - [152, 66.763]
  - - [6144, 4096, 1, 64, 6176, 6176, 96, 4096]
    - [4, 34.27]
  - - [6144, 4096, 1, 128, 6176, 6176, 160, 4096]
    - [147, 50.02]
  - - [6144, 4096, 1, 256, 6176, 6176, 288, 4096]
    - [140, 62.484]
  - - [6144, 4096, 1, 512, 6176, 6176, 544, 4096]
    - [37, 69.291]
  - - [6144, 4096, 1, 1024, 6176, 6176, 1056, 4096]
    - [44, 63.646]
  - - [6144, 4096, 1, 2048, 6176, 6176, 2080, 4096]
    - [152, 62.336]
  - - [6144, 4096, 1, 4096, 6176, 6176, 4128, 4128]
    - [150, 65.88]
  - - [6144, 4096, 1, 8192, 6176, 6176, 8224, 8224]
    - [134, 65.177]
  - - [6144, 8192, 1, 64, 6176, 6176, 96, 8192]
    - [69, 15.143]
  - - [6144, 8192, 1, 128, 6176, 6176, 160, 8192]
    - [73, 27.76]
  - - [6144, 8192, 1, 256, 6176, 6176, 288, 8192]
    - [110, 47.295]
  - - [6144, 8192, 1, 512, 6176, 6176, 544, 8192]
    - [136, 56.838]
  - - [6144, 8192, 1, 1024, 6176, 6176, 1056, 8192]
    - [151, 59.483]
  - - [6144, 8192, 1, 2048, 6176, 6176, 2080, 8192]
    - [150, 64.709]
  - - [6144, 8192, 1, 4096, 6176, 6176, 4128, 8192]
    - [152, 65.419]
  - - [6144, 8192, 1, 8192, 6176, 6176, 8224, 8224]
    - [157, 63.482]
- null
- null
- DeviceEfficiency
