library/src/blas3/Tensile/Logic/asm_full/navi31/navi31_Cijk_Alik_Bjlk_BBS_BH.yaml
- {MinimumRequiredVersion: 4.35.0}
- navi31
- gfx1100
- [Device 73bf]
    SolutionIndex: 0
    SolutionNameMin: Cijk_Alik_Bjlk_BBS_BH_MT32x32x16_MI16x16x16x1_SN_1LDSB0_AMAS0_GRVW8_IU1_NLCB1_SIA1_SU0_SUS0_SVW1_TT1_16_VW1_WGM4
    SolutionIndex: 1
    SolutionNameMin: Cijk_Alik_Bjlk_BBS_BH_MT32x32x16_MI16x16x16x1_SN_1LDSB1_AMAS0_GRVW8_IU1_NLCB1_SIA2_SU0_SUS0_SVW1_TT1_16_VW1_WGM4
    SolutionIndex: 2
    SolutionNameMin: Cijk_Alik_Bjlk_BBS_BH_MT32x32x16_MI16x16x16x1_SN_1LDSB1_AMAS0_GRVW4_IU1_NLCB1_SIA2_SU32_SUS256_SVW1_TT1_16_VW1_WGM4
    SolutionIndex: 3
    SolutionNameMin: Cijk_Alik_Bjlk_BBS_BH_MT32x32x16_MI16x16x16x1_SN_1LDSB0_AMAS0_GRVW4_IU1_NLCB1_SIA3_SU0_SUS0_SVW1_TT1_16_VW1_WGM8
    SolutionIndex: 4
    SolutionNameMin: Cijk_Alik_Bjlk_BBS_BH_MT32x32x16_MI16x16x16x1_SN_1LDSB1_AMAS0_GRVW2_IU1_NLCB1_SIA2_SU32_SUS256_SVW1_TT1_16_VW1_WGM8
    SolutionIndex: 5
    SolutionNameMin: Cijk_Alik_Bjlk_BBS_BH_MT64x64x16_MI16x16x16x1_SN_1LDSB0_AMAS0_GRVW4_IU1_NLCB1_SIA1_SU0_SUS0_SVW1_TT2_32_VW1_WGM4
    SolutionIndex: 6
    SolutionNameMin: Cijk_Alik_Bjlk_BBS_BH_MT64x64x16_MI16x16x16x1_SN_1LDSB0_AMAS0_GRVW8_IU1_NLCB1_SIA1_SU0_SUS0_SVW1_TT2_32_VW1_WGM4
    SolutionIndex: 7
    SolutionNameMin: Cijk_Alik_Bjlk_BBS_BH_MT64x64x16_MI16x16x16x1_SN_1LDSB1_AMAS0_GRVW8_IU1_NLCB1_SIA2_SU0_SUS0_SVW1_TT2_32_VW1_WGM4
    SolutionIndex: 8
    SolutionNameMin: Cijk_Alik_Bjlk_BBS_BH_MT64x64x16_MI16x16x16x1_SN_1LDSB1_AMAS3_GRVW8_IU1_NLCB1_SIA2_SU0_SUS0_SVW2_TT2_32_VW2_WGM4
    SolutionIndex: 9
    SolutionNameMin: Cijk_Alik_Bjlk_BBS_BH_MT64x64x16_MI16x16x16x1_SN_1LDSB1_AMAS3_GRVW8_IU1_NLCB1_SIA2_SU32_SUS128_SVW2_TT2_32_VW2_WGM4
    SolutionIndex: 10
    SolutionNameMin: Cijk_Alik_Bjlk_BBS_BH_MT64x64x16_MI16x16x16x1_SN_1LDSB1_AMAS3_GRVW4_IU1_NLCB1_SIA2_SU32_SUS256_SVW2_TT2_32_VW2_WGM4
    SolutionIndex: 11
    SolutionNameMin: Cijk_Alik_Bjlk_BBS_BH_MT64x64x16_MI16x16x16x1_SN_1LDSB1_AMAS3_GRVW8_IU1_NLCB1_SIA2_SU32_SUS256_SVW2_TT2_32_VW2_WGM4
    SolutionIndex: 12
    SolutionNameMin: Cijk_Alik_Bjlk_BBS_BH_MT64x64x16_MI16x16x16x1_SN_1LDSB0_AMAS3_GRVW4_IU1_NLCB1_SIA1_SU0_SUS0_SVW2_TT2_32_VW2_WGM8
    SolutionIndex: 13
    SolutionNameMin: Cijk_Alik_Bjlk_BBS_BH_MT64x64x16_MI16x16x16x1_SN_1LDSB0_AMAS3_GRVW8_IU1_NLCB1_SIA1_SU0_SUS0_SVW2_TT2_32_VW2_WGM8
    SolutionIndex: 14
    SolutionNameMin: Cijk_Alik_Bjlk_BBS_BH_MT64x64x16_MI16x16x16x1_SN_1LDSB1_AMAS3_GRVW8_IU1_NLCB1_SIA2_SU0_SUS0_SVW2_TT2_32_VW2_WGM8
    SolutionIndex: 15
    SolutionNameMin: Cijk_Alik_Bjlk_BBS_BH_MT64x64x16_MI16x16x16x1_SN_1LDSB1_AMAS3_GRVW4_IU1_NLCB1_SIA2_SU32_SUS128_SVW2_TT2_32_VW2_WGM8
    SolutionIndex: 16
    SolutionNameMin: Cijk_Alik_Bjlk_BBS_BH_MT64x64x16_MI16x16x16x1_SN_1LDSB1_AMAS3_GRVW8_IU1_NLCB1_SIA2_SU32_SUS128_SVW2_TT2_32_VW2_WGM8
    SolutionIndex: 17
    SolutionNameMin: Cijk_Alik_Bjlk_BBS_BH_MT64x64x16_MI16x16x16x1_SN_1LDSB1_AMAS3_GRVW4_IU1_NLCB1_SIA2_SU32_SUS256_SVW2_TT2_32_VW2_WGM8
    SolutionIndex: 18
    SolutionNameMin: Cijk_Alik_Bjlk_BBS_BH_MT64x64x16_MI16x16x16x1_SN_1LDSB1_AMAS3_GRVW8_IU1_NLCB1_SIA2_SU32_SUS256_SVW2_TT2_32_VW2_WGM8
    SolutionIndex: 19
    SolutionNameMin: Cijk_Alik_Bjlk_BBS_BH_MT128x128x16_MI16x16x16x1_SN_1LDSB0_AMAS3_GRVW2_IU1_NLCB2_SIA1_SU0_SUS0_SVW2_TT4_64_VW2_WGM4
    SolutionIndex: 20
    SolutionNameMin: Cijk_Alik_Bjlk_BBS_BH_MT128x128x16_MI16x16x16x1_SN_1LDSB0_AMAS0_GRVW4_IU1_NLCB1_SIA1_SU0_SUS0_SVW1_TT4_64_VW1_WGM4
    SolutionIndex: 21
    SolutionNameMin: Cijk_Alik_Bjlk_BBS_BH_MT128x128x16_MI16x16x16x1_SN_1LDSB0_AMAS0_GRVW8_IU1_NLCB1_SIA1_SU0_SUS0_SVW1_TT4_64_VW1_WGM4
    SolutionIndex: 22
    SolutionNameMin: Cijk_Alik_Bjlk_BBS_BH_MT128x128x16_MI16x16x16x1_SN_1LDSB0_AMAS3_GRVW8_IU1_NLCB1_SIA1_SU0_SUS0_SVW2_TT4_64_VW2_WGM4
    SolutionIndex: 23
    SolutionNameMin: Cijk_Alik_Bjlk_BBS_BH_MT128x128x16_MI16x16x16x1_SN_1LDSB0_AMAS3_GRVW8_IU1_NLCB1_SIA1_SU0_SUS0_SVW4_TT4_64_VW4_WGM4
    SolutionIndex: 24
    SolutionNameMin: Cijk_Alik_Bjlk_BBS_BH_MT128x128x16_MI16x16x16x1_SN_1LDSB1_AMAS3_GRVW2_IU1_NLCB2_SIA2_SU0_SUS0_SVW2_TT4_64_VW2_WGM4
    SolutionIndex: 25
    SolutionNameMin: Cijk_Alik_Bjlk_BBS_BH_MT128x128x16_MI16x16x16x1_SN_1LDSB1_AMAS3_GRVW2_IU1_NLCB2_SIA2_SU0_SUS0_SVW4_TT4_64_VW4_WGM4
    SolutionIndex: 26
    SolutionNameMin: Cijk_Alik_Bjlk_BBS_BH_MT128x128x16_MI16x16x16x1_SN_1LDSB1_AMAS3_GRVW4_IU1_NLCB1_SIA2_SU0_SUS0_SVW2_TT4_64_VW2_WGM4
    SolutionIndex: 27
    SolutionNameMin: Cijk_Alik_Bjlk_BBS_BH_MT128x128x16_MI16x16x16x1_SN_1LDSB1_AMAS3_GRVW4_IU1_NLCB1_SIA2_SU0_SUS0_SVW4_TT4_64_VW4_WGM4
    SolutionIndex: 28
    SolutionNameMin: Cijk_Alik_Bjlk_BBS_BH_MT128x128x16_MI16x16x16x1_SN_1LDSB1_AMAS3_GRVW8_IU1_NLCB1_SIA2_SU0_SUS0_SVW2_TT4_64_VW2_WGM4
    SolutionIndex: 29
    SolutionNameMin: Cijk_Alik_Bjlk_BBS_BH_MT128x128x16_MI16x16x16x1_SN_1LDSB0_AMAS3_GRVW4_IU1_NLCB1_SIA3_SU0_SUS0_SVW2_TT4_64_VW2_WGM4
    SolutionIndex: 30
    SolutionNameMin: Cijk_Alik_Bjlk_BBS_BH_MT128x128x16_MI16x16x16x1_SN_1LDSB0_AMAS3_GRVW8_IU1_NLCB1_SIA3_SU0_SUS0_SVW2_TT4_64_VW2_WGM4
    SolutionIndex: 31
    SolutionNameMin: Cijk_Alik_Bjlk_BBS_BH_MT128x128x16_MI16x16x16x1_SN_1LDSB0_AMAS3_GRVW8_IU1_NLCB1_SIA3_SU0_SUS0_SVW4_TT4_64_VW4_WGM4
    SolutionIndex: 32
    SolutionNameMin: Cijk_Alik_Bjlk_BBS_BH_MT128x128x16_MI16x16x16x1_SN_1LDSB0_AMAS3_GRVW4_IU1_NLCB1_SIA1_SU32_SUS128_SVW2_TT4_64_VW2_WGM4
    SolutionIndex: 33
    SolutionNameMin: Cijk_Alik_Bjlk_BBS_BH_MT128x128x16_MI16x16x16x1_SN_1LDSB0_AMAS3_GRVW8_IU1_NLCB1_SIA1_SU32_SUS128_SVW2_TT4_64_VW2_WGM4
    SolutionIndex: 34
    SolutionNameMin: Cijk_Alik_Bjlk_BBS_BH_MT128x128x16_MI16x16x16x1_SN_1LDSB0_AMAS3_GRVW8_IU1_NLCB1_SIA1_SU32_SUS128_SVW4_TT4_64_VW4_WGM4
    SolutionIndex: 35
    SolutionNameMin: Cijk_Alik_Bjlk_BBS_BH_MT128x128x16_MI16x16x16x1_SN_1LDSB1_AMAS3_GRVW2_IU1_NLCB2_SIA2_SU32_SUS128_SVW2_TT4_64_VW2_WGM4
    SolutionIndex: 36
    SolutionNameMin: Cijk_Alik_Bjlk_BBS_BH_MT128x128x16_MI16x16x16x1_SN_1LDSB1_AMAS3_GRVW8_IU1_NLCB1_SIA2_SU32_SUS128_SVW2_TT4_64_VW2_WGM4
    SolutionIndex: 37
    SolutionNameMin: Cijk_Alik_Bjlk_BBS_BH_MT128x128x16_MI16x16x16x1_SN_1LDSB0_AMAS3_GRVW8_IU1_NLCB1_SIA3_SU32_SUS128_SVW2_TT4_64_VW2_WGM4
    SolutionIndex: 38
    SolutionNameMin: Cijk_Alik_Bjlk_BBS_BH_MT128x128x16_MI16x16x16x1_SN_1LDSB0_AMAS3_GRVW8_IU1_NLCB1_SIA3_SU32_SUS128_SVW4_TT4_64_VW4_WGM4
    SolutionIndex: 39
    SolutionNameMin: Cijk_Alik_Bjlk_BBS_BH_MT128x128x16_MI16x16x16x1_SN_1LDSB0_AMAS3_GRVW4_IU1_NLCB1_SIA1_SU32_SUS256_SVW4_TT4_64_VW4_WGM4
    SolutionIndex: 40
    SolutionNameMin: Cijk_Alik_Bjlk_BBS_BH_MT128x128x16_MI16x16x16x1_SN_1LDSB0_AMAS3_GRVW8_IU1_NLCB1_SIA1_SU32_SUS256_SVW2_TT4_64_VW2_WGM4
    SolutionIndex: 41
    SolutionNameMin: Cijk_Alik_Bjlk_BBS_BH_MT128x128x16_MI16x16x16x1_SN_1LDSB0_AMAS3_GRVW8_IU1_NLCB1_SIA1_SU32_SUS256_SVW4_TT4_64_VW4_WGM4
    SolutionIndex: 42
    SolutionNameMin: Cijk_Alik_Bjlk_BBS_BH_MT128x128x16_MI16x16x16x1_SN_1LDSB1_AMAS3_GRVW4_IU1_NLCB1_SIA2_SU32_SUS256_SVW2_TT4_64_VW2_WGM4
    SolutionIndex: 43
    SolutionNameMin: Cijk_Alik_Bjlk_BBS_BH_MT128x128x16_MI16x16x16x1_SN_1LDSB1_AMAS3_GRVW4_IU1_NLCB1_SIA2_SU32_SUS256_SVW4_TT4_64_VW4_WGM4
    SolutionIndex: 44
    SolutionNameMin: Cijk_Alik_Bjlk_BBS_BH_MT128x128x16_MI16x16x16x1_SN_1LDSB1_AMAS3_GRVW8_IU1_NLCB1_SIA2_SU32_SUS256_SVW2_TT4_64_VW2_WGM4
    SolutionIndex: 45
    SolutionNameMin: Cijk_Alik_Bjlk_BBS_BH_MT128x128x16_MI16x16x16x1_SN_1LDSB1_AMAS3_GRVW8_IU1_NLCB1_SIA2_SU32_SUS256_SVW4_TT4_64_VW4_WGM4
    SolutionIndex: 46
    SolutionNameMin: Cijk_Alik_Bjlk_BBS_BH_MT128x128x16_MI16x16x16x1_SN_1LDSB0_AMAS3_GRVW8_IU1_NLCB1_SIA3_SU32_SUS256_SVW2_TT4_64_VW2_WGM4
    SolutionIndex: 47
    SolutionNameMin: Cijk_Alik_Bjlk_BBS_BH_MT128x128x16_MI16x16x16x1_SN_1LDSB0_AMAS0_GRVW4_IU1_NLCB1_SIA1_SU0_SUS0_SVW1_TT4_64_VW1_WGM8
    SolutionIndex: 48
    SolutionNameMin: Cijk_Alik_Bjlk_BBS_BH_MT128x128x16_MI16x16x16x1_SN_1LDSB0_AMAS3_GRVW4_IU1_NLCB1_SIA1_SU0_SUS0_SVW2_TT4_64_VW2_WGM8
    SolutionIndex: 49
    SolutionNameMin: Cijk_Alik_Bjlk_BBS_BH_MT128x128x16_MI16x16x16x1_SN_1LDSB0_AMAS3_GRVW4_IU1_NLCB1_SIA1_SU0_SUS0_SVW4_TT4_64_VW4_WGM8
    SolutionIndex: 50
    SolutionNameMin: Cijk_Alik_Bjlk_BBS_BH_MT128x128x16_MI16x16x16x1_SN_1LDSB0_AMAS0_GRVW8_IU1_NLCB1_SIA1_SU0_SUS0_SVW1_TT4_64_VW1_WGM8
    SolutionIndex: 51
    SolutionNameMin: Cijk_Alik_Bjlk_BBS_BH_MT128x128x16_MI16x16x16x1_SN_1LDSB0_AMAS3_GRVW8_IU1_NLCB1_SIA1_SU0_SUS0_SVW2_TT4_64_VW2_WGM8
    SolutionIndex: 52
    SolutionNameMin: Cijk_Alik_Bjlk_BBS_BH_MT128x128x16_MI16x16x16x1_SN_1LDSB0_AMAS3_GRVW8_IU1_NLCB1_SIA1_SU0_SUS0_SVW4_TT4_64_VW4_WGM8
    SolutionIndex: 53
    SolutionNameMin: Cijk_Alik_Bjlk_BBS_BH_MT128x128x16_MI16x16x16x1_SN_1LDSB1_AMAS3_GRVW2_IU1_NLCB2_SIA2_SU0_SUS0_SVW2_TT4_64_VW2_WGM8
    SolutionIndex: 54
    SolutionNameMin: Cijk_Alik_Bjlk_BBS_BH_MT128x128x16_MI16x16x16x1_SN_1LDSB1_AMAS0_GRVW4_IU1_NLCB1_SIA2_SU0_SUS0_SVW1_TT4_64_VW1_WGM8
    SolutionIndex: 55
    SolutionNameMin: Cijk_Alik_Bjlk_BBS_BH_MT128x128x16_MI16x16x16x1_SN_1LDSB1_AMAS3_GRVW4_IU1_NLCB1_SIA2_SU0_SUS0_SVW4_TT4_64_VW4_WGM8
    SolutionIndex: 56
    SolutionNameMin: Cijk_Alik_Bjlk_BBS_BH_MT128x128x16_MI16x16x16x1_SN_1LDSB1_AMAS0_GRVW8_IU1_NLCB1_SIA2_SU0_SUS0_SVW1_TT4_64_VW1_WGM8
    SolutionIndex: 57
    SolutionNameMin: Cijk_Alik_Bjlk_BBS_BH_MT128x128x16_MI16x16x16x1_SN_1LDSB1_AMAS3_GRVW8_IU1_NLCB1_SIA2_SU0_SUS0_SVW2_TT4_64_VW2_WGM8
    SolutionIndex: 58
    SolutionNameMin: Cijk_Alik_Bjlk_BBS_BH_MT128x128x16_MI16x16x16x1_SN_1LDSB1_AMAS3_GRVW8_IU1_NLCB1_SIA2_SU0_SUS0_SVW4_TT4_64_VW4_WGM8
    SolutionIndex: 59
    SolutionNameMin: Cijk_Alik_Bjlk_BBS_BH_MT128x128x16_MI16x16x16x1_SN_1LDSB0_AMAS3_GRVW4_IU1_NLCB1_SIA3_SU0_SUS0_SVW4_TT4_64_VW4_WGM8
    SolutionIndex: 60
    SolutionNameMin: Cijk_Alik_Bjlk_BBS_BH_MT128x128x16_MI16x16x16x1_SN_1LDSB0_AMAS3_GRVW8_IU1_NLCB1_SIA3_SU0_SUS0_SVW2_TT4_64_VW2_WGM8
    SolutionIndex: 61
    SolutionNameMin: Cijk_Alik_Bjlk_BBS_BH_MT128x128x16_MI16x16x16x1_SN_1LDSB0_AMAS3_GRVW8_IU1_NLCB1_SIA3_SU0_SUS0_SVW4_TT4_64_VW4_WGM8
    SolutionIndex: 62
    SolutionNameMin: Cijk_Alik_Bjlk_BBS_BH_MT128x128x16_MI16x16x16x1_SN_1LDSB0_AMAS3_GRVW4_IU1_NLCB1_SIA1_SU32_SUS128_SVW2_TT4_64_VW2_WGM8
    SolutionIndex: 63
    SolutionNameMin: Cijk_Alik_Bjlk_BBS_BH_MT128x128x16_MI16x16x16x1_SN_1LDSB0_AMAS3_GRVW8_IU1_NLCB1_SIA1_SU32_SUS128_SVW2_TT4_64_VW2_WGM8
    SolutionIndex: 64
    SolutionNameMin: Cijk_Alik_Bjlk_BBS_BH_MT128x128x16_MI16x16x16x1_SN_1LDSB0_AMAS3_GRVW8_IU1_NLCB1_SIA1_SU32_SUS128_SVW4_TT4_64_VW4_WGM8
    SolutionIndex: 65
    SolutionNameMin: Cijk_Alik_Bjlk_BBS_BH_MT128x128x16_MI16x16x16x1_SN_1LDSB1_AMAS3_GRVW2_IU1_NLCB2_SIA2_SU32_SUS128_SVW2_TT4_64_VW2_WGM8
    SolutionIndex: 66
    SolutionNameMin: Cijk_Alik_Bjlk_BBS_BH_MT128x128x16_MI16x16x16x1_SN_1LDSB1_AMAS3_GRVW4_IU1_NLCB1_SIA2_SU32_SUS128_SVW2_TT4_64_VW2_WGM8
    SolutionIndex: 67
    SolutionNameMin: Cijk_Alik_Bjlk_BBS_BH_MT128x128x16_MI16x16x16x1_SN_1LDSB1_AMAS3_GRVW8_IU1_NLCB1_SIA2_SU32_SUS128_SVW2_TT4_64_VW2_WGM8
    SolutionIndex: 68
    SolutionNameMin: Cijk_Alik_Bjlk_BBS_BH_MT128x128x16_MI16x16x16x1_SN_1LDSB0_AMAS3_GRVW8_IU1_NLCB1_SIA3_SU32_SUS128_SVW2_TT4_64_VW2_WGM8
    SolutionIndex: 69
    SolutionNameMin: Cijk_Alik_Bjlk_BBS_BH_MT128x128x16_MI16x16x16x1_SN_1LDSB0_AMAS3_GRVW8_IU1_NLCB1_SIA3_SU32_SUS128_SVW4_TT4_64_VW4_WGM8
    SolutionIndex: 70
    SolutionNameMin: Cijk_Alik_Bjlk_BBS_BH_MT128x128x16_MI16x16x16x1_SN_1LDSB0_AMAS3_GRVW8_IU1_NLCB1_SIA1_SU32_SUS256_SVW2_TT4_64_VW2_WGM8
    SolutionIndex: 71
    SolutionNameMin: Cijk_Alik_Bjlk_BBS_BH_MT128x128x16_MI16x16x16x1_SN_1LDSB0_AMAS3_GRVW8_IU1_NLCB1_SIA1_SU32_SUS256_SVW4_TT4_64_VW4_WGM8
    SolutionIndex: 72
    SolutionNameMin: Cijk_Alik_Bjlk_BBS_BH_MT128x128x16_MI16x16x16x1_SN_1LDSB1_AMAS3_GRVW4_IU1_NLCB1_SIA2_SU32_SUS256_SVW4_TT4_64_VW4_WGM8
    SolutionIndex: 73
    SolutionNameMin: Cijk_Alik_Bjlk_BBS_BH_MT128x128x16_MI16x16x16x1_SN_1LDSB1_AMAS3_GRVW8_IU1_NLCB1_SIA2_SU32_SUS256_SVW2_TT4_64_VW2_WGM8
    SolutionIndex: 74
    SolutionNameMin: Cijk_Alik_Bjlk_BBS_BH_MT128x128x16_MI16x16x16x1_SN_1LDSB1_AMAS3_GRVW8_IU1_NLCB1_SIA2_SU32_SUS256_SVW4_TT4_64_VW4_WGM8
    SolutionIndex: 75
    SolutionNameMin: Cijk_Alik_Bjlk_BBS_BH_MT128x128x16_MI16x16x16x1_SN_1LDSB0_AMAS3_GRVW8_IU1_NLCB1_SIA3_SU32_SUS256_SVW2_TT4_64_VW2_WGM8
    SolutionIndex: 76
    SolutionNameMin: Cijk_Alik_Bjlk_BBS_BH_MT128x128x16_MI16x16x16x1_SN_1LDSB0_AMAS3_GRVW8_IU1_NLCB1_SIA3_SU32_SUS256_SVW4_TT4_64_VW4_WGM8
    SolutionIndex: 77
    SolutionNameMin: Cijk_Alik_Bjlk_BBS_BH_MT32x32x32_MI16x16x16x1_SN_1LDSB0_AMAS0_GRVW2_IU1_NLCB1_SIA1_SU0_SUS0_SVW1_TT1_16_VW1_WGM4
    SolutionIndex: 78
    SolutionNameMin: Cijk_Alik_Bjlk_BBS_BH_MT32x32x32_MI16x16x16x1_SN_1LDSB0_AMAS0_GRVW4_IU1_NLCB1_SIA1_SU0_SUS0_SVW1_TT1_16_VW1_WGM4
    SolutionIndex: 79
    SolutionNameMin: Cijk_Alik_Bjlk_BBS_BH_MT32x32x32_MI16x16x16x1_SN_1LDSB0_AMAS0_GRVW8_IU1_NLCB1_SIA1_SU0_SUS0_SVW1_TT1_16_VW1_WGM4
    SolutionIndex: 80
    SolutionNameMin: Cijk_Alik_Bjlk_BBS_BH_MT32x32x32_MI16x16x16x1_SN_1LDSB1_AMAS0_GRVW2_IU2_NLCB1_SIA2_SU0_SUS0_SVW1_TT1_16_VW1_WGM4
    SolutionIndex: 81
    SolutionNameMin: Cijk_Alik_Bjlk_BBS_BH_MT32x32x32_MI16x16x16x1_SN_1LDSB1_AMAS0_GRVW4_IU2_NLCB1_SIA2_SU0_SUS0_SVW1_TT1_16_VW1_WGM4
    SolutionIndex: 82
    SolutionNameMin: Cijk_Alik_Bjlk_BBS_BH_MT32x32x32_MI16x16x16x1_SN_1LDSB1_AMAS0_GRVW8_IU2_NLCB1_SIA2_SU0_SUS0_SVW1_TT1_16_VW1_WGM4
    SolutionIndex: 83
    SolutionNameMin: Cijk_Alik_Bjlk_BBS_BH_MT32x32x32_MI16x16x16x1_SN_1LDSB0_AMAS0_GRVW8_IU1_NLCB1_SIA3_SU0_SUS0_SVW1_TT1_16_VW1_WGM4
    SolutionIndex: 84
    SolutionNameMin: Cijk_Alik_Bjlk_BBS_BH_MT32x32x32_MI16x16x16x1_SN_1LDSB0_AMAS0_GRVW2_IU1_NLCB1_SIA1_SU32_SUS128_SVW1_TT1_16_VW1_WGM4
    SolutionIndex: 85
    SolutionNameMin: Cijk_Alik_Bjlk_BBS_BH_MT32x32x32_MI16x16x16x1_SN_1LDSB0_AMAS0_GRVW4_IU1_NLCB1_SIA1_SU32_SUS128_SVW1_TT1_16_VW1_WGM4
    SolutionIndex: 86
    SolutionNameMin: Cijk_Alik_Bjlk_BBS_BH_MT32x32x32_MI16x16x16x1_SN_1LDSB1_AMAS0_GRVW2_IU2_NLCB1_SIA2_SU32_SUS128_SVW1_TT1_16_VW1_WGM4
    SolutionIndex: 87
    SolutionNameMin: Cijk_Alik_Bjlk_BBS_BH_MT32x32x32_MI16x16x16x1_SN_1LDSB1_AMAS0_GRVW4_IU2_NLCB1_SIA2_SU32_SUS128_SVW1_TT1_16_VW1_WGM4
    SolutionIndex: 88
    SolutionNameMin: Cijk_Alik_Bjlk_BBS_BH_MT32x32x32_MI16x16x16x1_SN_1LDSB1_AMAS0_GRVW8_IU2_NLCB1_SIA2_SU32_SUS128_SVW1_TT1_16_VW1_WGM4
    SolutionIndex: 89
    SolutionNameMin: Cijk_Alik_Bjlk_BBS_BH_MT32x32x32_MI16x16x16x1_SN_1LDSB0_AMAS0_GRVW4_IU1_NLCB1_SIA1_SU32_SUS256_SVW1_TT1_16_VW1_WGM4
    SolutionIndex: 90
    SolutionNameMin: Cijk_Alik_Bjlk_BBS_BH_MT32x32x32_MI16x16x16x1_SN_1LDSB1_AMAS0_GRVW2_IU2_NLCB1_SIA2_SU32_SUS256_SVW1_TT1_16_VW1_WGM4
    SolutionIndex: 91
    SolutionNameMin: Cijk_Alik_Bjlk_BBS_BH_MT32x32x32_MI16x16x16x1_SN_1LDSB1_AMAS0_GRVW4_IU2_NLCB1_SIA2_SU32_SUS256_SVW1_TT1_16_VW1_WGM4
    SolutionIndex: 92
    SolutionNameMin: Cijk_Alik_Bjlk_BBS_BH_MT32x32x32_MI16x16x16x1_SN_1LDSB1_AMAS0_GRVW8_IU2_NLCB1_SIA2_SU32_SUS256_SVW1_TT1_16_VW1_WGM4
    SolutionIndex: 93
    SolutionNameMin: Cijk_Alik_Bjlk_BBS_BH_MT32x32x32_MI16x16x16x1_SN_1LDSB0_AMAS0_GRVW4_IU1_NLCB1_SIA1_SU0_SUS0_SVW1_TT1_16_VW1_WGM8
    SolutionIndex: 94
    SolutionNameMin: Cijk_Alik_Bjlk_BBS_BH_MT32x32x32_MI16x16x16x1_SN_1LDSB0_AMAS0_GRVW8_IU1_NLCB1_SIA1_SU0_SUS0_SVW1_TT1_16_VW1_WGM8
    SolutionIndex: 95
    SolutionNameMin: Cijk_Alik_Bjlk_BBS_BH_MT32x32x32_MI16x16x16x1_SN_1LDSB1_AMAS0_GRVW2_IU2_NLCB1_SIA2_SU0_SUS0_SVW1_TT1_16_VW1_WGM8
    SolutionIndex: 96
    SolutionNameMin: Cijk_Alik_Bjlk_BBS_BH_MT32x32x32_MI16x16x16x1_SN_1LDSB1_AMAS0_GRVW4_IU2_NLCB1_SIA2_SU0_SUS0_SVW1_TT1_16_VW1_WGM8
    SolutionIndex: 97
    SolutionNameMin: Cijk_Alik_Bjlk_BBS_BH_MT32x32x32_MI16x16x16x1_SN_1LDSB1_AMAS0_GRVW8_IU2_NLCB1_SIA2_SU0_SUS0_SVW1_TT1_16_VW1_WGM8
    SolutionIndex: 98
    SolutionNameMin: Cijk_Alik_Bjlk_BBS_BH_MT32x32x32_MI16x16x16x1_SN_1LDSB0_AMAS0_GRVW8_IU1_NLCB1_SIA3_SU0_SUS0_SVW1_TT1_16_VW1_WGM8
    SolutionIndex: 99
    SolutionNameMin: Cijk_Alik_Bjlk_BBS_BH_MT32x32x32_MI16x16x16x1_SN_1LDSB0_AMAS0_GRVW2_IU1_NLCB1_SIA1_SU32_SUS128_SVW1_TT1_16_VW1_WGM8
    SolutionIndex: 100
    SolutionNameMin: Cijk_Alik_Bjlk_BBS_BH_MT32x32x32_MI16x16x16x1_SN_1LDSB0_AMAS0_GRVW4_IU1_NLCB1_SIA1_SU32_SUS128_SVW1_TT1_16_VW1_WGM8
    SolutionIndex: 101
    SolutionNameMin: Cijk_Alik_Bjlk_BBS_BH_MT32x32x32_MI16x16x16x1_SN_1LDSB1_AMAS0_GRVW2_IU2_NLCB1_SIA2_SU32_SUS128_SVW1_TT1_16_VW1_WGM8
    SolutionIndex: 102
    SolutionNameMin: Cijk_Alik_Bjlk_BBS_BH_MT32x32x32_MI16x16x16x1_SN_1LDSB1_AMAS0_GRVW4_IU2_NLCB1_SIA2_SU32_SUS128_SVW1_TT1_16_VW1_WGM8
    SolutionIndex: 103
    SolutionNameMin: Cijk_Alik_Bjlk_BBS_BH_MT32x32x32_MI16x16x16x1_SN_1LDSB1_AMAS0_GRVW8_IU2_NLCB1_SIA2_SU32_SUS128_SVW1_TT1_16_VW1_WGM8
    SolutionIndex: 104
    SolutionNameMin: Cijk_Alik_Bjlk_BBS_BH_MT32x32x32_MI16x16x16x1_SN_1LDSB0_AMAS0_GRVW8_IU1_NLCB1_SIA1_SU32_SUS256_SVW1_TT1_16_VW1_WGM8
    SolutionIndex: 105
    SolutionNameMin: Cijk_Alik_Bjlk_BBS_BH_MT32x32x32_MI16x16x16x1_SN_1LDSB1_AMAS0_GRVW2_IU2_NLCB1_SIA2_SU32_SUS256_SVW1_TT1_16_VW1_WGM8
    SolutionIndex: 106
    SolutionNameMin: Cijk_Alik_Bjlk_BBS_BH_MT32x32x32_MI16x16x16x1_SN_1LDSB1_AMAS0_GRVW4_IU2_NLCB1_SIA2_SU32_SUS256_SVW1_TT1_16_VW1_WGM8
    SolutionIndex: 107
    SolutionNameMin: Cijk_Alik_Bjlk_BBS_BH_MT32x32x32_MI16x16x16x1_SN_1LDSB1_AMAS0_GRVW8_IU2_NLCB1_SIA2_SU32_SUS256_SVW1_TT1_16_VW1_WGM8
    SolutionIndex: 108
    SolutionNameMin: Cijk_Alik_Bjlk_BBS_BH_MT64x64x32_MI16x16x16x1_SN_1LDSB0_AMAS0_GRVW4_IU1_NLCB1_SIA1_SU0_SUS0_SVW1_TT2_32_VW1_WGM4
    SolutionIndex: 109
    SolutionNameMin: Cijk_Alik_Bjlk_BBS_BH_MT64x64x32_MI16x16x16x1_SN_1LDSB0_AMAS3_GRVW4_IU1_NLCB1_SIA1_SU0_SUS0_SVW2_TT2_32_VW2_WGM4
    SolutionIndex: 110
    SolutionNameMin: Cijk_Alik_Bjlk_BBS_BH_MT64x64x32_MI16x16x16x1_SN_1LDSB0_AMAS0_GRVW8_IU1_NLCB1_SIA1_SU0_SUS0_SVW1_TT2_32_VW1_WGM4
    SolutionIndex: 111
    SolutionNameMin: Cijk_Alik_Bjlk_BBS_BH_MT64x64x32_MI16x16x16x1_SN_1LDSB0_AMAS3_GRVW8_IU1_NLCB1_SIA1_SU0_SUS0_SVW2_TT2_32_VW2_WGM4
    SolutionIndex: 112
    SolutionNameMin: Cijk_Alik_Bjlk_BBS_BH_MT64x64x32_MI16x16x16x1_SN_1LDSB1_AMAS0_GRVW4_IU2_NLCB1_SIA2_SU0_SUS0_SVW1_TT2_32_VW1_WGM4
    SolutionIndex: 113
    SolutionNameMin: Cijk_Alik_Bjlk_BBS_BH_MT64x64x32_MI16x16x16x1_SN_1LDSB1_AMAS3_GRVW4_IU2_NLCB1_SIA2_SU0_SUS0_SVW2_TT2_32_VW2_WGM4
    SolutionIndex: 114
    SolutionNameMin: Cijk_Alik_Bjlk_BBS_BH_MT64x64x32_MI16x16x16x1_SN_1LDSB1_AMAS0_GRVW8_IU2_NLCB1_SIA2_SU0_SUS0_SVW1_TT2_32_VW1_WGM4
    SolutionIndex: 115
    SolutionNameMin: Cijk_Alik_Bjlk_BBS_BH_MT64x64x32_MI16x16x16x1_SN_1LDSB1_AMAS3_GRVW8_IU2_NLCB1_SIA2_SU0_SUS0_SVW2_TT2_32_VW2_WGM4
    SolutionIndex: 116
    SolutionNameMin: Cijk_Alik_Bjlk_BBS_BH_MT64x64x32_MI16x16x16x1_SN_1LDSB0_AMAS3_GRVW4_IU1_NLCB1_SIA3_SU0_SUS0_SVW2_TT2_32_VW2_WGM4
    SolutionIndex: 117
    SolutionNameMin: Cijk_Alik_Bjlk_BBS_BH_MT64x64x32_MI16x16x16x1_SN_1LDSB0_AMAS0_GRVW8_IU1_NLCB1_SIA3_SU0_SUS0_SVW1_TT2_32_VW1_WGM4
    SolutionIndex: 118
    SolutionNameMin: Cijk_Alik_Bjlk_BBS_BH_MT64x64x32_MI16x16x16x1_SN_1LDSB0_AMAS3_GRVW8_IU1_NLCB1_SIA3_SU0_SUS0_SVW2_TT2_32_VW2_WGM4
    SolutionIndex: 119
    SolutionNameMin: Cijk_Alik_Bjlk_BBS_BH_MT64x64x32_MI16x16x16x1_SN_1LDSB0_AMAS3_GRVW8_IU1_NLCB1_SIA1_SU32_SUS128_SVW2_TT2_32_VW2_WGM4
    SolutionIndex: 120
    SolutionNameMin: Cijk_Alik_Bjlk_BBS_BH_MT64x64x32_MI16x16x16x1_SN_1LDSB1_AMAS3_GRVW4_IU2_NLCB1_SIA2_SU32_SUS128_SVW2_TT2_32_VW2_WGM4
    SolutionIndex: 121
    SolutionNameMin: Cijk_Alik_Bjlk_BBS_BH_MT64x64x32_MI16x16x16x1_SN_1LDSB1_AMAS3_GRVW8_IU2_NLCB1_SIA2_SU32_SUS128_SVW2_TT2_32_VW2_WGM4
    SolutionIndex: 122
    SolutionNameMin: Cijk_Alik_Bjlk_BBS_BH_MT64x64x32_MI16x16x16x1_SN_1LDSB0_AMAS0_GRVW4_IU1_NLCB1_SIA3_SU32_SUS128_SVW1_TT2_32_VW1_WGM4
    SolutionIndex: 123
    SolutionNameMin: Cijk_Alik_Bjlk_BBS_BH_MT64x64x32_MI16x16x16x1_SN_1LDSB0_AMAS3_GRVW8_IU1_NLCB1_SIA1_SU32_SUS256_SVW2_TT2_32_VW2_WGM4
    SolutionIndex: 124
    SolutionNameMin: Cijk_Alik_Bjlk_BBS_BH_MT64x64x32_MI16x16x16x1_SN_1LDSB1_AMAS0_GRVW4_IU2_NLCB1_SIA2_SU32_SUS256_SVW1_TT2_32_VW1_WGM4
    SolutionIndex: 125
    SolutionNameMin: Cijk_Alik_Bjlk_BBS_BH_MT64x64x32_MI16x16x16x1_SN_1LDSB1_AMAS3_GRVW4_IU2_NLCB1_SIA2_SU32_SUS256_SVW2_TT2_32_VW2_WGM4
    SolutionIndex: 126
    SolutionNameMin: Cijk_Alik_Bjlk_BBS_BH_MT64x64x32_MI16x16x16x1_SN_1LDSB1_AMAS0_GRVW8_IU2_NLCB1_SIA2_SU32_SUS256_SVW1_TT2_32_VW1_WGM4
    SolutionIndex: 127
    SolutionNameMin: Cijk_Alik_Bjlk_BBS_BH_MT64x64x32_MI16x16x16x1_SN_1LDSB1_AMAS3_GRVW8_IU2_NLCB1_SIA2_SU32_SUS256_SVW2_TT2_32_VW2_WGM4
    SolutionIndex: 128
    SolutionNameMin: Cijk_Alik_Bjlk_BBS_BH_MT64x64x32_MI16x16x16x1_SN_1LDSB0_AMAS3_GRVW8_IU1_NLCB1_SIA3_SU32_SUS256_SVW2_TT2_32_VW2_WGM4
    SolutionIndex: 129
    SolutionNameMin: Cijk_Alik_Bjlk_BBS_BH_MT64x64x32_MI16x16x16x1_SN_1LDSB0_AMAS3_GRVW4_IU1_NLCB1_SIA1_SU0_SUS0_SVW2_TT2_32_VW2_WGM8
    SolutionIndex: 130
    SolutionNameMin: Cijk_Alik_Bjlk_BBS_BH_MT64x64x32_MI16x16x16x1_SN_1LDSB0_AMAS0_GRVW8_IU1_NLCB1_SIA1_SU0_SUS0_SVW1_TT2_32_VW1_WGM8
    SolutionIndex: 131
    SolutionNameMin: Cijk_Alik_Bjlk_BBS_BH_MT64x64x32_MI16x16x16x1_SN_1LDSB0_AMAS3_GRVW8_IU1_NLCB1_SIA1_SU0_SUS0_SVW2_TT2_32_VW2_WGM8
    SolutionIndex: 132
    SolutionNameMin: Cijk_Alik_Bjlk_BBS_BH_MT64x64x32_MI16x16x16x1_SN_1LDSB1_AMAS3_GRVW4_IU2_NLCB1_SIA2_SU0_SUS0_SVW2_TT2_32_VW2_WGM8
    SolutionIndex: 133
    SolutionNameMin: Cijk_Alik_Bjlk_BBS_BH_MT64x64x32_MI16x16x16x1_SN_1LDSB1_AMAS0_GRVW8_IU2_NLCB1_SIA2_SU0_SUS0_SVW1_TT2_32_VW1_WGM8
    SolutionIndex: 134
    SolutionNameMin: Cijk_Alik_Bjlk_BBS_BH_MT64x64x32_MI16x16x16x1_SN_1LDSB1_AMAS3_GRVW8_IU2_NLCB1_SIA2_SU0_SUS0_SVW2_TT2_32_VW2_WGM8
    SolutionIndex: 135
    SolutionNameMin: Cijk_Alik_Bjlk_BBS_BH_MT64x64x32_MI16x16x16x1_SN_1LDSB0_AMAS3_GRVW4_IU1_NLCB1_SIA3_SU0_SUS0_SVW2_TT2_32_VW2_WGM8
    SolutionIndex: 136
    SolutionNameMin: Cijk_Alik_Bjlk_BBS_BH_MT64x64x32_MI16x16x16x1_SN_1LDSB0_AMAS0_GRVW8_IU1_NLCB1_SIA3_SU0_SUS0_SVW1_TT2_32_VW1_WGM8
    SolutionIndex: 137
    SolutionNameMin: Cijk_Alik_Bjlk_BBS_BH_MT64x64x32_MI16x16x16x1_SN_1LDSB0_AMAS3_GRVW8_IU1_NLCB1_SIA3_SU0_SUS0_SVW2_TT2_32_VW2_WGM8
    SolutionIndex: 138
    SolutionNameMin: Cijk_Alik_Bjlk_BBS_BH_MT64x64x32_MI16x16x16x1_SN_1LDSB0_AMAS3_GRVW8_IU1_NLCB1_SIA1_SU32_SUS128_SVW2_TT2_32_VW2_WGM8
    SolutionIndex: 139
    SolutionNameMin: Cijk_Alik_Bjlk_BBS_BH_MT64x64x32_MI16x16x16x1_SN_1LDSB1_AMAS0_GRVW4_IU2_NLCB1_SIA2_SU32_SUS128_SVW1_TT2_32_VW1_WGM8
    SolutionIndex: 140
    SolutionNameMin: Cijk_Alik_Bjlk_BBS_BH_MT64x64x32_MI16x16x16x1_SN_1LDSB1_AMAS3_GRVW4_IU2_NLCB1_SIA2_SU32_SUS128_SVW2_TT2_32_VW2_WGM8
    SolutionIndex: 141
    SolutionNameMin: Cijk_Alik_Bjlk_BBS_BH_MT64x64x32_MI16x16x16x1_SN_1LDSB1_AMAS0_GRVW8_IU2_NLCB1_SIA2_SU32_SUS128_SVW1_TT2_32_VW1_WGM8
    SolutionIndex: 142
    SolutionNameMin: Cijk_Alik_Bjlk_BBS_BH_MT64x64x32_MI16x16x16x1_SN_1LDSB1_AMAS3_GRVW8_IU2_NLCB1_SIA2_SU32_SUS128_SVW2_TT2_32_VW2_WGM8
    SolutionIndex: 143
    SolutionNameMin: Cijk_Alik_Bjlk_BBS_BH_MT64x64x32_MI16x16x16x1_SN_1LDSB0_AMAS0_GRVW8_IU1_NLCB1_SIA3_SU32_SUS128_SVW1_TT2_32_VW1_WGM8
    SolutionIndex: 144
    SolutionNameMin: Cijk_Alik_Bjlk_BBS_BH_MT64x64x32_MI16x16x16x1_SN_1LDSB0_AMAS3_GRVW8_IU1_NLCB1_SIA3_SU32_SUS128_SVW2_TT2_32_VW2_WGM8
    SolutionIndex: 145
    SolutionNameMin: Cijk_Alik_Bjlk_BBS_BH_MT64x64x32_MI16x16x16x1_SN_1LDSB0_AMAS3_GRVW8_IU1_NLCB1_SIA1_SU32_SUS256_SVW2_TT2_32_VW2_WGM8
    SolutionIndex: 146
    SolutionNameMin: Cijk_Alik_Bjlk_BBS_BH_MT64x64x32_MI16x16x16x1_SN_1LDSB1_AMAS3_GRVW4_IU2_NLCB1_SIA2_SU32_SUS256_SVW2_TT2_32_VW2_WGM8
    SolutionIndex: 147
    SolutionNameMin: Cijk_Alik_Bjlk_BBS_BH_MT64x64x32_MI16x16x16x1_SN_1LDSB1_AMAS3_GRVW8_IU2_NLCB1_SIA2_SU32_SUS256_SVW2_TT2_32_VW2_WGM8
    SolutionIndex: 148
    SolutionNameMin: Cijk_Alik_Bjlk_BBS_BH_MT64x64x32_MI16x16x16x1_SN_1LDSB0_AMAS0_GRVW8_IU1_NLCB1_SIA3_SU32_SUS256_SVW1_TT2_32_VW1_WGM8
    SolutionIndex: 149
    SolutionNameMin: Cijk_Alik_Bjlk_BBS_BH_MT64x64x32_MI16x16x16x1_SN_1LDSB0_AMAS3_GRVW8_IU1_NLCB1_SIA3_SU32_SUS256_SVW2_TT2_32_VW2_WGM8
- - - [64, 64, 1, 64, 96, 96, 96, 96]
    - [0, 0.041]
  - - [64, 64, 1, 128, 96, 96, 160, 160]
    - [81, 0.081]
  - - [64, 64, 1, 256, 96, 96, 288, 288]
    - [82, 0.151]
  - - [64, 64, 1, 512, 96, 96, 544, 544]
    - [103, 0.267]
  - - [64, 64, 1, 1024, 96, 96, 1056, 1056]
    - [107, 0.434]
  - - [64, 64, 1, 2048, 96, 96, 2080, 2080]
    - [96, 0.631]
  - - [64, 64, 1, 4096, 96, 96, 4128, 4128]
    - [91, 0.812]
  - - [64, 64, 1, 8192, 96, 96, 8224, 8224]
    - [86, 0.942]
  - - [64, 128, 1, 64, 96, 96, 96, 128]
    - [106, 0.086]
  - - [64, 128, 1, 128, 96, 96, 160, 160]
    - [81, 0.167]
  - - [64, 128, 1, 256, 96, 96, 288, 288]
    - [96, 0.31]
  - - [64, 128, 1, 512, 96, 96, 544, 544]
    - [106, 0.548]
  - - [64, 128, 1, 1024, 96, 96, 1056, 1056]
    - [92, 0.883]
  - - [64, 128, 1, 2048, 96, 96, 2080, 2080]
    - [91, 1.279]
  - - [64, 128, 1, 4096, 96, 96, 4128, 4128]
    - [87, 1.64]
  - - [64, 128, 1, 8192, 96, 96, 8224, 8224]
    - [101, 1.913]
  - - [64, 256, 1, 64, 96, 96, 96, 256]
    - [92, 0.174]
  - - [64, 256, 1, 128, 96, 96, 160, 256]
    - [102, 0.338]
  - - [64, 256, 1, 256, 96, 96, 288, 288]
    - [88, 0.629]
  - - [64, 256, 1, 512, 96, 96, 544, 544]
    - [4, 0.927]
  - - [64, 256, 1, 1024, 96, 96, 1056, 1056]
    - [86, 1.452]
  - - [64, 256, 1, 2048, 96, 96, 2080, 2080]
    - [81, 2.46]
  - - [64, 256, 1, 4096, 96, 96, 4128, 4128]
    - [102, 3.296]
  - - [64, 256, 1, 8192, 96, 96, 8224, 8224]
    - [102, 3.839]
  - - [64, 512, 1, 64, 96, 96, 96, 512]
    - [103, 0.351]
  - - [64, 512, 1, 128, 96, 96, 160, 512]
    - [92, 0.675]
  - - [64, 512, 1, 256, 96, 96, 288, 512]
    - [103, 1.257]
  - - [64, 512, 1, 512, 96, 96, 544, 544]
    - [81, 2.235]
  - - [64, 512, 1, 1024, 96, 96, 1056, 1056]
    - [106, 3.584]
  - - [64, 512, 1, 2048, 96, 96, 2080, 2080]
    - [105, 5.16]
  - - [64, 512, 1, 4096, 96, 96, 4128, 4128]
    - [102, 6.603]
  - - [64, 512, 1, 8192, 96, 96, 8224, 8224]
    - [95, 7.619]
  - - [64, 1024, 1, 64, 96, 96, 96, 1024]
    - [95, 0.695]
  - - [64, 1024, 1, 128, 96, 96, 160, 1024]
    - [96, 1.337]
  - - [64, 1024, 1, 256, 96, 96, 288, 1024]
    - [96, 2.462]
  - - [64, 1024, 1, 512, 96, 96, 544, 1024]
    - [81, 4.266]
  - - [64, 1024, 1, 1024, 96, 96, 1056, 1056]
    - [102, 6.779]
  - - [64, 1024, 1, 2048, 96, 96, 2080, 2080]
    - [96, 9.547]
  - - [64, 1024, 1, 4096, 96, 96, 4128, 4128]
    - [96, 11.96]
  - - [64, 1024, 1, 8192, 96, 96, 8224, 8224]
    - [82, 13.541]
  - - [64, 2048, 1, 64, 96, 96, 96, 2048]
    - [82, 1.353]
  - - [64, 2048, 1, 128, 96, 96, 160, 2048]
    - [83, 2.55]
  - - [64, 2048, 1, 256, 96, 96, 288, 2048]
    - [97, 4.612]
  - - [64, 2048, 1, 512, 96, 96, 544, 2048]
    - [107, 7.734]
  - - [64, 2048, 1, 1024, 96, 96, 1056, 2048]
    - [94, 11.576]
  - - [64, 2048, 1, 2048, 96, 96, 2080, 2080]
    - [78, 15.556]
  - - [64, 2048, 1, 4096, 96, 96, 4128, 4128]
    - [84, 18.289]
  - - [64, 2048, 1, 8192, 96, 96, 8224, 8224]
    - [77, 20.71]
  - - [64, 4096, 1, 64, 96, 96, 96, 4096]
    - [15, 2.563]
  - - [64, 4096, 1, 128, 96, 96, 160, 4096]
    - [7, 4.746]
  - - [64, 4096, 1, 256, 96, 96, 288, 4096]
    - [133, 8.364]
  - - [64, 4096, 1, 512, 96, 96, 544, 4096]
    - [134, 13.569]
  - - [64, 4096, 1, 1024, 96, 96, 1056, 4096]
    - [134, 19.476]
  - - [64, 4096, 1, 2048, 96, 96, 2080, 4096]
    - [125, 24.796]
  - - [64, 4096, 1, 4096, 96, 96, 4128, 4128]
    - [142, 28.561]
  - - [64, 4096, 1, 8192, 96, 96, 8224, 8224]
    - [147, 27.185]
  - - [64, 8192, 1, 64, 96, 96, 96, 8192]
    - [9, 4.81]
  - - [64, 8192, 1, 128, 96, 96, 160, 8192]
    - [134, 8.831]
  - - [64, 8192, 1, 256, 96, 96, 288, 8192]
    - [115, 14.961]
  - - [64, 8192, 1, 512, 96, 96, 544, 8192]
    - [132, 22.708]
  - - [64, 8192, 1, 1024, 96, 96, 1056, 8192]
    - [142, 30.636]
  - - [64, 8192, 1, 2048, 96, 96, 2080, 8192]
    - [124, 35.925]
  - - [64, 8192, 1, 4096, 96, 96, 4128, 8192]
    - [145, 41.381]
  - - [64, 8192, 1, 8192, 96, 96, 8224, 8224]
    - [112, 35.965]
  - - [128, 64, 1, 64, 160, 160, 96, 96]
    - [3, 0.086]
  - - [128, 64, 1, 128, 160, 160, 160, 160]
    - [96, 0.165]
  - - [128, 64, 1, 256, 160, 160, 288, 288]
    - [103, 0.312]
  - - [128, 64, 1, 512, 160, 160, 544, 544]
    - [103, 0.547]
  - - [128, 64, 1, 1024, 160, 160, 1056, 1056]
    - [88, 0.889]
  - - [128, 64, 1, 2048, 160, 160, 2080, 2080]
    - [97, 1.282]
  - - [128, 64, 1, 4096, 160, 160, 4128, 4128]
    - [106, 1.644]
  - - [128, 64, 1, 8192, 160, 160, 8224, 8224]
    - [81, 1.91]
  - - [128, 128, 1, 64, 160, 160, 96, 128]
    - [96, 0.176]
  - - [128, 128, 1, 128, 160, 160, 160, 160]
    - [82, 0.339]
  - - [128, 128, 1, 256, 160, 160, 288, 288]
    - [92, 0.632]
  - - [128, 128, 1, 512, 160, 160, 544, 544]
    - [88, 1.109]
  - - [128, 128, 1, 1024, 160, 160, 1056, 1056]
    - [106, 1.788]
  - - [128, 128, 1, 2048, 160, 160, 2080, 2080]
    - [81, 2.593]
  - - [128, 128, 1, 4096, 160, 160, 4128, 4128]
    - [106, 3.323]
  - - [128, 128, 1, 8192, 160, 160, 8224, 8224]
    - [81, 3.848]
  - - [128, 256, 1, 64, 160, 160, 96, 256]
    - [95, 0.353]
  - - [128, 256, 1, 128, 160, 160, 160, 256]
    - [107, 0.676]
  - - [128, 256, 1, 256, 160, 160, 288, 288]
    - [82, 1.267]
  - - [128, 256, 1, 512, 160, 160, 544, 544]
    - [102, 2.235]
  - - [128, 256, 1, 1024, 160, 160, 1056, 1056]
    - [81, 3.609]
  - - [128, 256, 1, 2048, 160, 160, 2080, 2080]
    - [107, 5.172]
  - - [128, 256, 1, 4096, 160, 160, 4128, 4128]
    - [106, 6.649]
  - - [128, 256, 1, 8192, 160, 160, 8224, 8224]
    - [80, 7.651]
  - - [128, 512, 1, 64, 160, 160, 96, 512]
    - [96, 0.692]
  - - [128, 512, 1, 128, 160, 160, 160, 512]
    - [97, 1.328]
  - - [128, 512, 1, 256, 160, 160, 288, 512]
    - [103, 2.449]
  - - [128, 512, 1, 512, 160, 160, 544, 544]
    - [103, 4.295]
  - - [128, 512, 1, 1024, 160, 160, 1056, 1056]
    - [97, 6.789]
  - - [128, 512, 1, 2048, 160, 160, 2080, 2080]
    - [92, 9.555]
  - - [128, 512, 1, 4096, 160, 160, 4128, 4128]
    - [96, 11.958]
  - - [128, 512, 1, 8192, 160, 160, 8224, 8224]
    - [96, 13.597]
  - - [128, 1024, 1, 64, 160, 160, 96, 1024]
    - [88, 1.346]
  - - [128, 1024, 1, 128, 160, 160, 160, 1024]
    - [100, 2.552]
  - - [128, 1024, 1, 256, 160, 160, 288, 1024]
    - [104, 4.627]
  - - [128, 1024, 1, 512, 160, 160, 544, 1024]
    - [104, 7.677]
  - - [128, 1024, 1, 1024, 160, 160, 1056, 1056]
    - [77, 11.7]
  - - [128, 1024, 1, 2048, 160, 160, 2080, 2080]
    - [78, 15.784]
  - - [128, 1024, 1, 4096, 160, 160, 4128, 4128]
    - [89, 18.321]
  - - [128, 1024, 1, 8192, 160, 160, 8224, 8224]
    - [79, 21.009]
  - - [128, 2048, 1, 64, 160, 160, 96, 2048]
    - [121, 2.568]
  - - [128, 2048, 1, 128, 160, 160, 160, 2048]
    - [14, 4.752]
  - - [128, 2048, 1, 256, 160, 160, 288, 2048]
    - [115, 8.378]
  - - [128, 2048, 1, 512, 160, 160, 544, 2048]
    - [147, 13.456]
  - - [128, 2048, 1, 1024, 160, 160, 1056, 2048]
    - [134, 19.37]
  - - [128, 2048, 1, 2048, 160, 160, 2080, 2080]
    - [126, 24.684]
  - - [128, 2048, 1, 4096, 160, 160, 4128, 4128]
    - [113, 28.053]
  - - [128, 2048, 1, 8192, 160, 160, 8224, 8224]
    - [115, 28.911]
  - - [128, 4096, 1, 64, 160, 160, 96, 4096]
    - [127, 4.833]
  - - [128, 4096, 1, 128, 160, 160, 160, 4096]
    - [147, 8.881]
  - - [128, 4096, 1, 256, 160, 160, 288, 4096]
    - [132, 15.017]
  - - [128, 4096, 1, 512, 160, 160, 544, 4096]
    - [123, 22.788]
  - - [128, 4096, 1, 1024, 160, 160, 1056, 4096]
    - [134, 30.762]
  - - [128, 4096, 1, 2048, 160, 160, 2080, 4096]
    - [122, 37.111]
  - - [128, 4096, 1, 4096, 160, 160, 4128, 4128]
    - [6, 42.29]
  - - [128, 4096, 1, 8192, 160, 160, 8224, 8224]
    - [121, 40.26]
  - - [128, 8192, 1, 64, 160, 160, 96, 8192]
    - [11, 8.249]
  - - [128, 8192, 1, 128, 160, 160, 160, 8192]
    - [142, 14.554]
  - - [128, 8192, 1, 256, 160, 160, 288, 8192]
    - [42, 22.683]
  - - [128, 8192, 1, 512, 160, 160, 544, 8192]
    - [26, 33.17]
  - - [128, 8192, 1, 1024, 160, 160, 1056, 8192]
    - [67, 42.922]
  - - [128, 8192, 1, 2048, 160, 160, 2080, 8192]
    - [26, 50.142]
  - - [128, 8192, 1, 4096, 160, 160, 4128, 8192]
    - [27, 52.557]
  - - [128, 8192, 1, 8192, 160, 160, 8224, 8224]
    - [57, 52.637]
  - - [256, 64, 1, 64, 288, 288, 96, 96]
    - [1, 0.175]
  - - [256, 64, 1, 128, 288, 288, 160, 160]
    - [81, 0.34]
  - - [256, 64, 1, 256, 288, 288, 288, 288]
    - [103, 0.628]
  - - [256, 64, 1, 512, 288, 288, 544, 544]
    - [81, 1.106]
  - - [256, 64, 1, 1024, 288, 288, 1056, 1056]
    - [88, 1.788]
  - - [256, 64, 1, 2048, 288, 288, 2080, 2080]
    - [81, 2.574]
  - - [256, 64, 1, 4096, 288, 288, 4128, 4128]
    - [96, 3.289]
  - - [256, 64, 1, 8192, 288, 288, 8224, 8224]
    - [103, 3.71]
  - - [256, 128, 1, 64, 288, 288, 96, 128]
    - [102, 0.351]
  - - [256, 128, 1, 128, 288, 288, 160, 160]
    - [102, 0.68]
  - - [256, 128, 1, 256, 288, 288, 288, 288]
    - [88, 1.266]
  - - [256, 128, 1, 512, 288, 288, 544, 544]
    - [92, 2.241]
  - - [256, 128, 1, 1024, 288, 288, 1056, 1056]
    - [86, 2.954]
  - - [256, 128, 1, 2048, 288, 288, 2080, 2080]
    - [106, 5.199]
  - - [256, 128, 1, 4096, 288, 288, 4128, 4128]
    - [106, 6.665]
  - - [256, 128, 1, 8192, 288, 288, 8224, 8224]
    - [90, 7.663]
  - - [256, 256, 1, 64, 288, 288, 96, 256]
    - [83, 0.69]
  - - [256, 256, 1, 128, 288, 288, 160, 256]
    - [92, 1.329]
  - - [256, 256, 1, 256, 288, 288, 288, 288]
    - [92, 2.453]
  - - [256, 256, 1, 512, 288, 288, 544, 544]
    - [81, 4.274]
  - - [256, 256, 1, 1024, 288, 288, 1056, 1056]
    - [87, 6.768]
  - - [256, 256, 1, 2048, 288, 288, 2080, 2080]
    - [82, 9.494]
  - - [256, 256, 1, 4096, 288, 288, 4128, 4128]
    - [81, 11.902]
  - - [256, 256, 1, 8192, 288, 288, 8224, 8224]
    - [91, 13.583]
  - - [256, 512, 1, 64, 288, 288, 96, 512]
    - [106, 1.351]
  - - [256, 512, 1, 128, 288, 288, 160, 512]
    - [100, 2.567]
  - - [256, 512, 1, 256, 288, 288, 288, 512]
    - [99, 4.57]
  - - [256, 512, 1, 512, 288, 288, 544, 544]
    - [79, 7.793]
  - - [256, 512, 1, 1024, 288, 288, 1056, 1056]
    - [104, 11.682]
  - - [256, 512, 1, 2048, 288, 288, 2080, 2080]
    - [93, 15.887]
  - - [256, 512, 1, 4096, 288, 288, 4128, 4128]
    - [85, 18.587]
  - - [256, 512, 1, 8192, 288, 288, 8224, 8224]
    - [93, 21.178]
  - - [256, 1024, 1, 64, 288, 288, 96, 1024]
    - [78, 2.57]
  - - [256, 1024, 1, 128, 288, 288, 160, 1024]
    - [147, 4.764]
  - - [256, 1024, 1, 256, 288, 288, 288, 1024]
    - [138, 8.405]
  - - [256, 1024, 1, 512, 288, 288, 544, 1024]
    - [129, 13.595]
  - - [256, 1024, 1, 1024, 288, 288, 1056, 1056]
    - [129, 19.837]
  - - [256, 1024, 1, 2048, 288, 288, 2080, 2080]
    - [129, 25.614]
  - - [256, 1024, 1, 4096, 288, 288, 4128, 4128]
    - [129, 29.693]
  - - [256, 1024, 1, 8192, 288, 288, 8224, 8224]
    - [131, 32.729]
  - - [256, 2048, 1, 64, 288, 288, 96, 2048]
    - [115, 4.825]
  - - [256, 2048, 1, 128, 288, 288, 160, 2048]
    - [115, 8.807]
  - - [256, 2048, 1, 256, 288, 288, 288, 2048]
    - [134, 15.073]
  - - [256, 2048, 1, 512, 288, 288, 544, 2048]
    - [149, 23.048]
  - - [256, 2048, 1, 1024, 288, 288, 1056, 2048]
    - [118, 31.234]
  - - [256, 2048, 1, 2048, 288, 288, 2080, 2080]
    - [5, 37.311]
  - - [256, 2048, 1, 4096, 288, 288, 4128, 4128]
    - [12, 42.411]
  - - [256, 2048, 1, 8192, 288, 288, 8224, 8224]
    - [13, 43.976]
  - - [256, 4096, 1, 64, 288, 288, 96, 4096]
    - [115, 8.175]
  - - [256, 4096, 1, 128, 288, 288, 160, 4096]
    - [14, 14.469]
  - - [256, 4096, 1, 256, 288, 288, 288, 4096]
    - [42, 22.656]
  - - [256, 4096, 1, 512, 288, 288, 544, 4096]
    - [26, 33.216]
  - - [256, 4096, 1, 1024, 288, 288, 1056, 4096]
    - [24, 42.033]
  - - [256, 4096, 1, 2048, 288, 288, 2080, 4096]
    - [26, 50.14]
  - - [256, 4096, 1, 4096, 288, 288, 4128, 4128]
    - [72, 52.199]
  - - [256, 4096, 1, 8192, 288, 288, 8224, 8224]
    - [141, 44.826]
  - - [256, 8192, 1, 64, 288, 288, 96, 8192]
    - [142, 13.114]
  - - [256, 8192, 1, 128, 288, 288, 160, 8192]
    - [121, 22.813]
  - - [256, 8192, 1, 256, 288, 288, 288, 8192]
    - [52, 34.565]
  - - [256, 8192, 1, 512, 288, 288, 544, 8192]
    - [52, 46.142]
  - - [256, 8192, 1, 1024, 288, 288, 1056, 8192]
    - [38, 56.097]
  - - [256, 8192, 1, 2048, 288, 288, 2080, 8192]
    - [30, 57.553]
  - - [256, 8192, 1, 4096, 288, 288, 4128, 8192]
    - [37, 63.417]
  - - [256, 8192, 1, 8192, 288, 288, 8224, 8224]
    - [30, 59.927]
  - - [384, 64, 1, 64, 416, 416, 96, 96]
    - [1, 0.263]
  - - [384, 64, 1, 128, 416, 416, 160, 160]
    - [92, 0.504]
  - - [384, 64, 1, 256, 416, 416, 288, 288]
    - [88, 0.944]
  - - [384, 64, 1, 512, 416, 416, 544, 544]
    - [107, 1.665]
  - - [384, 64, 1, 1024, 416, 416, 1056, 1056]
    - [107, 2.686]
  - - [384, 64, 1, 2048, 416, 416, 2080, 2080]
    - [87, 3.876]
  - - [384, 64, 1, 4096, 416, 416, 4128, 4128]
    - [102, 4.951]
  - - [384, 64, 1, 8192, 416, 416, 8224, 8224]
    - [106, 5.739]
  - - [384, 128, 1, 64, 416, 416, 96, 128]
    - [106, 0.532]
  - - [384, 128, 1, 128, 416, 416, 160, 160]
    - [97, 1.028]
  - - [384, 128, 1, 256, 416, 416, 288, 288]
    - [102, 1.897]
  - - [384, 128, 1, 512, 416, 416, 544, 544]
    - [96, 3.336]
  - - [384, 128, 1, 1024, 416, 416, 1056, 1056]
    - [106, 5.395]
  - - [384, 128, 1, 2048, 416, 416, 2080, 2080]
    - [86, 7.755]
  - - [384, 128, 1, 4096, 416, 416, 4128, 4128]
    - [106, 9.932]
  - - [384, 128, 1, 8192, 416, 416, 8224, 8224]
    - [81, 11.408]
  - - [384, 256, 1, 64, 416, 416, 96, 256]
    - [81, 1.043]
  - - [384, 256, 1, 128, 416, 416, 160, 256]
    - [87, 1.984]
  - - [384, 256, 1, 256, 416, 416, 288, 288]
    - [106, 3.661]
  - - [384, 256, 1, 512, 416, 416, 544, 544]
    - [82, 6.333]
  - - [384, 256, 1, 1024, 416, 416, 1056, 1056]
    - [88, 10.007]
  - - [384, 256, 1, 2048, 416, 416, 2080, 2080]
    - [81, 14.145]
  - - [384, 256, 1, 4096, 416, 416, 4128, 4128]
    - [91, 17.708]
  - - [384, 256, 1, 8192, 416, 416, 8224, 8224]
    - [106, 19.919]
  - - [384, 512, 1, 64, 416, 416, 96, 512]
    - [94, 1.983]
  - - [384, 512, 1, 128, 416, 416, 160, 512]
    - [134, 3.735]
  - - [384, 512, 1, 256, 416, 416, 288, 512]
    - [134, 6.674]
  - - [384, 512, 1, 512, 416, 416, 544, 544]
    - [147, 11.084]
  - - [384, 512, 1, 1024, 416, 416, 1056, 1056]
    - [115, 16.552]
  - - [384, 512, 1, 2048, 416, 416, 2080, 2080]
    - [115, 21.825]
  - - [384, 512, 1, 4096, 416, 416, 4128, 4128]
    - [147, 25.506]
  - - [384, 512, 1, 8192, 416, 416, 8224, 8224]
    - [134, 28.567]
  - - [384, 1024, 1, 64, 416, 416, 96, 1024]
    - [142, 3.806]
  - - [384, 1024, 1, 128, 416, 416, 160, 1024]
    - [113, 7.103]
  - - [384, 1024, 1, 256, 416, 416, 288, 1024]
    - [147, 12.501]
  - - [384, 1024, 1, 512, 416, 416, 544, 1024]
    - [134, 20.062]
  - - [384, 1024, 1, 1024, 416, 416, 1056, 1056]
    - [111, 28.734]
  - - [384, 1024, 1, 2048, 416, 416, 2080, 2080]
    - [110, 36.859]
  - - [384, 1024, 1, 4096, 416, 416, 4128, 4128]
    - [130, 41.73]
  - - [384, 1024, 1, 8192, 416, 416, 8224, 8224]
    - [108, 43.391]
  - - [384, 2048, 1, 64, 416, 416, 96, 2048]
    - [14, 6.829]
  - - [384, 2048, 1, 128, 416, 416, 160, 2048]
    - [134, 12.3]
  - - [384, 2048, 1, 256, 416, 416, 288, 2048]
    - [18, 20.149]
  - - [384, 2048, 1, 512, 416, 416, 544, 2048]
    - [118, 29.784]
  - - [384, 2048, 1, 1024, 416, 416, 1056, 2048]
    - [118, 38.934]
  - - [384, 2048, 1, 2048, 416, 416, 2080, 2080]
    - [137, 45.848]
  - - [384, 2048, 1, 4096, 416, 416, 4128, 4128]
    - [118, 50.018]
  - - [384, 2048, 1, 8192, 416, 416, 8224, 8224]
    - [148, 51.138]
  - - [384, 4096, 1, 64, 416, 416, 96, 4096]
    - [66, 11.137]
  - - [384, 4096, 1, 128, 416, 416, 160, 4096]
    - [42, 19.973]
  - - [384, 4096, 1, 256, 416, 416, 288, 4096]
    - [41, 31.358]
  - - [384, 4096, 1, 512, 416, 416, 544, 4096]
    - [71, 45.925]
  - - [384, 4096, 1, 1024, 416, 416, 1056, 4096]
    - [43, 56.956]
  - - [384, 4096, 1, 2048, 416, 416, 2080, 4096]
    - [27, 68.538]
  - - [384, 4096, 1, 4096, 416, 416, 4128, 4128]
    - [25, 74.018]
  - - [384, 4096, 1, 8192, 416, 416, 8224, 8224]
    - [35, 55.584]
  - - [384, 8192, 1, 64, 416, 416, 96, 8192]
    - [40, 18.364]
  - - [384, 8192, 1, 128, 416, 416, 160, 8192]
    - [61, 29.675]
  - - [384, 8192, 1, 256, 416, 416, 288, 8192]
    - [30, 43.519]
  - - [384, 8192, 1, 512, 416, 416, 544, 8192]
    - [61, 56.78]
  - - [384, 8192, 1, 1024, 416, 416, 1056, 8192]
    - [37, 66.792]
  - - [384, 8192, 1, 2048, 416, 416, 2080, 8192]
    - [76, 70.321]
  - - [384, 8192, 1, 4096, 416, 416, 4128, 8192]
    - [68, 75.459]
  - - [384, 8192, 1, 8192, 416, 416, 8224, 8224]
    - [51, 61.161]
  - - [768, 64, 1, 64, 800, 800, 96, 96]
    - [2, 0.513]
  - - [768, 64, 1, 128, 800, 800, 160, 160]
    - [106, 1.01]
  - - [768, 64, 1, 256, 800, 800, 288, 288]
    - [82, 1.894]
  - - [768, 64, 1, 512, 800, 800, 544, 544]
    - [92, 3.326]
  - - [768, 64, 1, 1024, 800, 800, 1056, 1056]
    - [87, 5.346]
  - - [768, 64, 1, 2048, 800, 800, 2080, 2080]
    - [87, 7.674]
  - - [768, 64, 1, 4096, 800, 800, 4128, 4128]
    - [96, 9.815]
  - - [768, 64, 1, 8192, 800, 800, 8224, 8224]
    - [96, 11.288]
  - - [768, 128, 1, 64, 800, 800, 96, 128]
    - [77, 1.038]
  - - [768, 128, 1, 128, 800, 800, 160, 160]
    - [92, 1.988]
  - - [768, 128, 1, 256, 800, 800, 288, 288]
    - [88, 3.637]
  - - [768, 128, 1, 512, 800, 800, 544, 544]
    - [92, 6.409]
  - - [768, 128, 1, 1024, 800, 800, 1056, 1056]
    - [82, 10.097]
  - - [768, 128, 1, 2048, 800, 800, 2080, 2080]
    - [96, 14.215]
  - - [768, 128, 1, 4096, 800, 800, 4128, 4128]
    - [96, 17.753]
  - - [768, 128, 1, 8192, 800, 800, 8224, 8224]
    - [80, 20.076]
  - - [768, 256, 1, 64, 800, 800, 96, 256]
    - [78, 2.009]
  - - [768, 256, 1, 128, 800, 800, 160, 256]
    - [147, 3.717]
  - - [768, 256, 1, 256, 800, 800, 288, 288]
    - [127, 6.661]
  - - [768, 256, 1, 512, 800, 800, 544, 544]
    - [134, 11.153]
  - - [768, 256, 1, 1024, 800, 800, 1056, 1056]
    - [134, 16.511]
  - - [768, 256, 1, 2048, 800, 800, 2080, 2080]
    - [142, 21.888]
  - - [768, 256, 1, 4096, 800, 800, 4128, 4128]
    - [115, 25.651]
  - - [768, 256, 1, 8192, 800, 800, 8224, 8224]
    - [134, 28.681]
  - - [768, 512, 1, 64, 800, 800, 96, 512]
    - [8, 3.835]
  - - [768, 512, 1, 128, 800, 800, 160, 512]
    - [10, 7.038]
  - - [768, 512, 1, 256, 800, 800, 288, 512]
    - [115, 12.503]
  - - [768, 512, 1, 512, 800, 800, 544, 544]
    - [113, 19.976]
  - - [768, 512, 1, 1024, 800, 800, 1056, 1056]
    - [129, 28.836]
  - - [768, 512, 1, 2048, 800, 800, 2080, 2080]
    - [130, 36.967]
  - - [768, 512, 1, 4096, 800, 800, 4128, 4128]
    - [131, 41.877]
  - - [768, 512, 1, 8192, 800, 800, 8224, 8224]
    - [139, 43.347]
  - - [768, 1024, 1, 64, 800, 800, 96, 1024]
    - [18, 6.852]
  - - [768, 1024, 1, 128, 800, 800, 160, 1024]
    - [16, 12.243]
  - - [768, 1024, 1, 256, 800, 800, 288, 1024]
    - [149, 20.097]
  - - [768, 1024, 1, 512, 800, 800, 544, 1024]
    - [136, 29.692]
  - - [768, 1024, 1, 1024, 800, 800, 1056, 1056]
    - [136, 38.919]
  - - [768, 1024, 1, 2048, 800, 800, 2080, 2080]
    - [128, 45.473]
  - - [768, 1024, 1, 4096, 800, 800, 4128, 4128]
    - [137, 49.892]
  - - [768, 1024, 1, 8192, 800, 800, 8224, 8224]
    - [143, 51.274]
  - - [768, 2048, 1, 64, 800, 800, 96, 2048]
    - [53, 11.026]
  - - [768, 2048, 1, 128, 800, 800, 160, 2048]
    - [65, 19.536]
  - - [768, 2048, 1, 256, 800, 800, 288, 2048]
    - [64, 31.5]
  - - [768, 2048, 1, 512, 800, 800, 544, 2048]
    - [63, 46.622]
  - - [768, 2048, 1, 1024, 800, 800, 1056, 2048]
    - [41, 59.207]
  - - [768, 2048, 1, 2048, 800, 800, 2080, 2080]
    - [53, 67.38]
  - - [768, 2048, 1, 4096, 800, 800, 4128, 4128]
    - [70, 69.293]
  - - [768, 2048, 1, 8192, 800, 800, 8224, 8224]
    - [65, 78.08]
  - - [768, 4096, 1, 64, 800, 800, 96, 4096]
    - [70, 17.463]
  - - [768, 4096, 1, 128, 800, 800, 160, 4096]
    - [69, 29.539]
  - - [768, 4096, 1, 256, 800, 800, 288, 4096]
    - [75, 43.507]
  - - [768, 4096, 1, 512, 800, 800, 544, 4096]
    - [38, 56.93]
  - - [768, 4096, 1, 1024, 800, 800, 1056, 4096]
    - [69, 67.308]
  - - [768, 4096, 1, 2048, 800, 800, 2080, 4096]
    - [37, 70.308]
  - - [768, 4096, 1, 4096, 800, 800, 4128, 4128]
    - [48, 75.142]
  - - [768, 4096, 1, 8192, 800, 800, 8224, 8224]
    - [55, 59.189]
  - - [768, 8192, 1, 64, 800, 800, 96, 8192]
    - [52, 25.073]
  - - [768, 8192, 1, 128, 800, 800, 160, 8192]
    - [45, 37.895]
  - - [768, 8192, 1, 256, 800, 800, 288, 8192]
    - [59, 50.711]
  - - [768, 8192, 1, 512, 800, 800, 544, 8192]
    - [23, 63.778]
  - - [768, 8192, 1, 1024, 800, 800, 1056, 8192]
    - [64, 69.014]
  - - [768, 8192, 1, 2048, 800, 800, 2080, 8192]
    - [52, 77.774]
  - - [768, 8192, 1, 4096, 800, 800, 4128, 8192]
    - [23, 71.006]
  - - [768, 8192, 1, 8192, 800, 800, 8224, 8224]
    - [22, 60.676]
  - - [1536, 64, 1, 64, 1568, 1568, 96, 96]
    - [92, 0.986]
  - - [1536, 64, 1, 128, 1568, 1568, 160, 160]
    - [81, 1.987]
  - - [1536, 64, 1, 256, 1568, 1568, 288, 288]
    - [97, 3.701]
  - - [1536, 64, 1, 512, 1568, 1568, 544, 544]
    - [82, 6.401]
  - - [1536, 64, 1, 1024, 1568, 1568, 1056, 1056]
    - [97, 10.076]
  - - [1536, 64, 1, 2048, 1568, 1568, 2080, 2080]
    - [96, 14.145]
  - - [1536, 64, 1, 4096, 1568, 1568, 4128, 4128]
    - [81, 17.714]
  - - [1536, 64, 1, 8192, 1568, 1568, 8224, 8224]
    - [81, 20.055]
  - - [1536, 128, 1, 64, 1568, 1568, 96, 128]
    - [98, 1.991]
  - - [1536, 128, 1, 128, 1568, 1568, 160, 160]
    - [121, 3.731]
  - - [1536, 128, 1, 256, 1568, 1568, 288, 288]
    - [134, 6.755]
  - - [1536, 128, 1, 512, 1568, 1568, 544, 544]
    - [115, 11.112]
  - - [1536, 128, 1, 1024, 1568, 1568, 1056, 1056]
    - [115, 16.541]
  - - [1536, 128, 1, 2048, 1568, 1568, 2080, 2080]
    - [114, 21.823]
  - - [1536, 128, 1, 4096, 1568, 1568, 4128, 4128]
    - [133, 25.449]
  - - [1536, 128, 1, 8192, 1568, 1568, 8224, 8224]
    - [142, 28.551]
  - - [1536, 256, 1, 64, 1568, 1568, 96, 256]
    - [147, 3.826]
  - - [1536, 256, 1, 128, 1568, 1568, 160, 256]
    - [119, 7.072]
  - - [1536, 256, 1, 256, 1568, 1568, 288, 288]
    - [131, 12.426]
  - - [1536, 256, 1, 512, 1568, 1568, 544, 544]
    - [131, 19.869]
  - - [1536, 256, 1, 1024, 1568, 1568, 1056, 1056]
    - [132, 28.555]
  - - [1536, 256, 1, 2048, 1568, 1568, 2080, 2080]
    - [115, 36.602]
  - - [1536, 256, 1, 4096, 1568, 1568, 4128, 4128]
    - [134, 41.45]
  - - [1536, 256, 1, 8192, 1568, 1568, 8224, 8224]
    - [114, 43.291]
  - - [1536, 512, 1, 64, 1568, 1568, 96, 512]
    - [8, 6.849]
  - - [1536, 512, 1, 128, 1568, 1568, 160, 512]
    - [15, 12.186]
  - - [1536, 512, 1, 256, 1568, 1568, 288, 512]
    - [118, 20.136]
  - - [1536, 512, 1, 512, 1568, 1568, 544, 544]
    - [118, 29.706]
  - - [1536, 512, 1, 1024, 1568, 1568, 1056, 1056]
    - [149, 38.838]
  - - [1536, 512, 1, 2048, 1568, 1568, 2080, 2080]
    - [116, 45.839]
  - - [1536, 512, 1, 4096, 1568, 1568, 4128, 4128]
    - [118, 50.379]
  - - [1536, 512, 1, 8192, 1568, 1568, 8224, 8224]
    - [135, 51.347]
  - - [1536, 1024, 1, 64, 1568, 1568, 96, 1024]
    - [73, 10.995]
  - - [1536, 1024, 1, 128, 1568, 1568, 160, 1024]
    - [73, 19.763]
  - - [1536, 1024, 1, 256, 1568, 1568, 288, 1024]
    - [33, 31.296]
  - - [1536, 1024, 1, 512, 1568, 1568, 544, 1024]
    - [41, 46.45]
  - - [1536, 1024, 1, 1024, 1568, 1568, 1056, 1056]
    - [40, 59.878]
  - - [1536, 1024, 1, 2048, 1568, 1568, 2080, 2080]
    - [54, 69.24]
  - - [1536, 1024, 1, 4096, 1568, 1568, 4128, 4128]
    - [73, 75.155]
  - - [1536, 1024, 1, 8192, 1568, 1568, 8224, 8224]
    - [58, 82.448]
  - - [1536, 2048, 1, 64, 1568, 1568, 96, 2048]
    - [60, 18.123]
  - - [1536, 2048, 1, 128, 1568, 1568, 160, 2048]
    - [61, 29.773]
  - - [1536, 2048, 1, 256, 1568, 1568, 288, 2048]
    - [61, 43.571]
  - - [1536, 2048, 1, 512, 1568, 1568, 544, 2048]
    - [61, 56.754]
  - - [1536, 2048, 1, 1024, 1568, 1568, 1056, 2048]
    - [31, 67.113]
  - - [1536, 2048, 1, 2048, 1568, 1568, 2080, 2080]
    - [52, 70.647]
  - - [1536, 2048, 1, 4096, 1568, 1568, 4128, 4128]
    - [71, 74.897]
  - - [1536, 2048, 1, 8192, 1568, 1568, 8224, 8224]
    - [21, 71.676]
  - - [1536, 4096, 1, 64, 1568, 1568, 96, 4096]
    - [52, 25.13]
  - - [1536, 4096, 1, 128, 1568, 1568, 160, 4096]
    - [74, 38.147]
  - - [1536, 4096, 1, 256, 1568, 1568, 288, 4096]
    - [59, 50.844]
  - - [1536, 4096, 1, 512, 1568, 1568, 544, 4096]
    - [23, 64.068]
  - - [1536, 4096, 1, 1024, 1568, 1568, 1056, 4096]
    - [22, 69.238]
  - - [1536, 4096, 1, 2048, 1568, 1568, 2080, 4096]
    - [63, 73.563]
  - - [1536, 4096, 1, 4096, 1568, 1568, 4128, 4128]
    - [51, 70.456]
  - - [1536, 4096, 1, 8192, 1568, 1568, 8224, 8224]
    - [51, 63.84]
  - - [1536, 8192, 1, 64, 1568, 1568, 96, 8192]
    - [52, 31.151]
  - - [1536, 8192, 1, 128, 1568, 1568, 160, 8192]
    - [41, 44.789]
  - - [1536, 8192, 1, 256, 1568, 1568, 288, 8192]
    - [23, 58.997]
  - - [1536, 8192, 1, 512, 1568, 1568, 544, 8192]
    - [22, 69.284]
  - - [1536, 8192, 1, 1024, 1568, 1568, 1056, 8192]
    - [51, 75.846]
  - - [1536, 8192, 1, 2048, 1568, 1568, 2080, 8192]
    - [19, 68.784]
  - - [1536, 8192, 1, 4096, 1568, 1568, 4128, 8192]
    - [49, 66.382]
  - - [1536, 8192, 1, 8192, 1568, 1568, 8224, 8224]
    - [52, 65.822]
  - - [3072, 64, 1, 64, 3104, 3104, 96, 96]
    - [79, 1.89]
  - - [3072, 64, 1, 128, 3104, 3104, 160, 160]
    - [79, 3.713]
  - - [3072, 64, 1, 256, 3104, 3104, 288, 288]
    - [115, 6.684]
  - - [3072, 64, 1, 512, 3104, 3104, 544, 544]
    - [142, 11.053]
  - - [3072, 64, 1, 1024, 3104, 3104, 1056, 1056]
    - [134, 16.487]
  - - [3072, 64, 1, 2048, 3104, 3104, 2080, 2080]
    - [115, 21.905]
  - - [3072, 64, 1, 4096, 3104, 3104, 4128, 4128]
    - [121, 25.446]
  - - [3072, 64, 1, 8192, 3104, 3104, 8224, 8224]
    - [133, 28.478]
  - - [3072, 128, 1, 64, 3104, 3104, 96, 128]
    - [115, 3.83]
  - - [3072, 128, 1, 128, 3104, 3104, 160, 160]
    - [11, 7.098]
  - - [3072, 128, 1, 256, 3104, 3104, 288, 288]
    - [138, 12.363]
  - - [3072, 128, 1, 512, 3104, 3104, 544, 544]
    - [131, 19.878]
  - - [3072, 128, 1, 1024, 3104, 3104, 1056, 1056]
    - [109, 28.584]
  - - [3072, 128, 1, 2048, 3104, 3104, 2080, 2080]
    - [134, 36.456]
  - - [3072, 128, 1, 4096, 3104, 3104, 4128, 4128]
    - [146, 41.507]
  - - [3072, 128, 1, 8192, 3104, 3104, 8224, 8224]
    - [142, 43.298]
  - - [3072, 256, 1, 64, 3104, 3104, 96, 256]
    - [134, 6.809]
  - - [3072, 256, 1, 128, 3104, 3104, 160, 256]
    - [113, 12.233]
  - - [3072, 256, 1, 256, 3104, 3104, 288, 288]
    - [117, 19.992]
  - - [3072, 256, 1, 512, 3104, 3104, 544, 544]
    - [149, 29.713]
  - - [3072, 256, 1, 1024, 3104, 3104, 1056, 1056]
    - [144, 38.68]
  - - [3072, 256, 1, 2048, 3104, 3104, 2080, 2080]
    - [136, 45.085]
  - - [3072, 256, 1, 4096, 3104, 3104, 4128, 4128]
    - [117, 49.826]
  - - [3072, 256, 1, 8192, 3104, 3104, 8224, 8224]
    - [118, 51.261]
  - - [3072, 512, 1, 64, 3104, 3104, 96, 512]
    - [36, 11.051]
  - - [3072, 512, 1, 128, 3104, 3104, 160, 512]
    - [67, 19.652]
  - - [3072, 512, 1, 256, 3104, 3104, 288, 512]
    - [41, 31.126]
  - - [3072, 512, 1, 512, 3104, 3104, 544, 544]
    - [32, 45.298]
  - - [3072, 512, 1, 1024, 3104, 3104, 1056, 1056]
    - [40, 58.296]
  - - [3072, 512, 1, 2048, 3104, 3104, 2080, 2080]
    - [24, 68.991]
  - - [3072, 512, 1, 4096, 3104, 3104, 4128, 4128]
    - [57, 76.037]
  - - [3072, 512, 1, 8192, 3104, 3104, 8224, 8224]
    - [36, 81.214]
  - - [3072, 1024, 1, 64, 3104, 3104, 96, 1024]
    - [22, 18.186]
  - - [3072, 1024, 1, 128, 3104, 3104, 160, 1024]
    - [46, 29.741]
  - - [3072, 1024, 1, 256, 3104, 3104, 288, 1024]
    - [46, 43.564]
  - - [3072, 1024, 1, 512, 3104, 3104, 544, 1024]
    - [31, 56.633]
  - - [3072, 1024, 1, 1024, 3104, 3104, 1056, 1056]
    - [30, 66.691]
  - - [3072, 1024, 1, 2048, 3104, 3104, 2080, 2080]
    - [75, 69.546]
  - - [3072, 1024, 1, 4096, 3104, 3104, 4128, 4128]
    - [52, 75.487]
  - - [3072, 1024, 1, 8192, 3104, 3104, 8224, 8224]
    - [52, 71.22]
  - - [3072, 2048, 1, 64, 3104, 3104, 96, 2048]
    - [40, 25.193]
  - - [3072, 2048, 1, 128, 3104, 3104, 160, 2048]
    - [28, 38.015]
  - - [3072, 2048, 1, 256, 3104, 3104, 288, 2048]
    - [36, 51.179]
  - - [3072, 2048, 1, 512, 3104, 3104, 544, 2048]
    - [52, 64.1]
  - - [3072, 2048, 1, 1024, 3104, 3104, 1056, 2048]
    - [52, 68.394]
  - - [3072, 2048, 1, 2048, 3104, 3104, 2080, 2080]
    - [63, 72.375]
  - - [3072, 2048, 1, 4096, 3104, 3104, 4128, 4128]
    - [39, 68.039]
  - - [3072, 2048, 1, 8192, 3104, 3104, 8224, 8224]
    - [49, 65.504]
  - - [3072, 4096, 1, 64, 3104, 3104, 96, 4096]
    - [52, 31.248]
  - - [3072, 4096, 1, 128, 3104, 3104, 160, 4096]
    - [29, 44.339]
  - - [3072, 4096, 1, 256, 3104, 3104, 288, 4096]
    - [23, 58.832]
  - - [3072, 4096, 1, 512, 3104, 3104, 544, 4096]
    - [22, 69.156]
  - - [3072, 4096, 1, 1024, 3104, 3104, 1056, 4096]
    - [21, 74.792]
  - - [3072, 4096, 1, 2048, 3104, 3104, 2080, 4096]
    - [20, 68.67]
  - - [3072, 4096, 1, 4096, 3104, 3104, 4128, 4128]
    - [47, 69.588]
  - - [3072, 4096, 1, 8192, 3104, 3104, 8224, 8224]
    - [52, 67.205]
  - - [3072, 8192, 1, 64, 3104, 3104, 96, 8192]
    - [52, 35.653]
  - - [3072, 8192, 1, 128, 3104, 3104, 160, 8192]
    - [41, 47.535]
  - - [3072, 8192, 1, 256, 3104, 3104, 288, 8192]
    - [64, 62.232]
  - - [3072, 8192, 1, 512, 3104, 3104, 544, 8192]
    - [32, 70.563]
  - - [3072, 8192, 1, 1024, 3104, 3104, 1056, 8192]
    - [49, 67.655]
  - - [3072, 8192, 1, 2048, 3104, 3104, 2080, 8192]
    - [52, 67.298]
  - - [3072, 8192, 1, 4096, 3104, 3104, 4128, 8192]
    - [22, 67.119]
  - - [3072, 8192, 1, 8192, 3104, 3104, 8224, 8224]
    - [52, 67.854]
  - - [6144, 64, 1, 64, 6176, 6176, 96, 96]
    - [82, 3.576]
  - - [6144, 64, 1, 128, 6176, 6176, 160, 160]
    - [119, 6.988]
  - - [6144, 64, 1, 256, 6176, 6176, 288, 288]
    - [127, 12.284]
  - - [6144, 64, 1, 512, 6176, 6176, 544, 544]
    - [132, 19.72]
  - - [6144, 64, 1, 1024, 6176, 6176, 1056, 1056]
    - [132, 28.523]
  - - [6144, 64, 1, 2048, 6176, 6176, 2080, 2080]
    - [113, 36.586]
  - - [6144, 64, 1, 4096, 6176, 6176, 4128, 4128]
    - [120, 41.614]
  - - [6144, 64, 1, 8192, 6176, 6176, 8224, 8224]
    - [147, 43.661]
  - - [6144, 128, 1, 64, 6176, 6176, 96, 128]
    - [115, 6.43]
  - - [6144, 128, 1, 128, 6176, 6176, 160, 160]
    - [14, 12.212]
  - - [6144, 128, 1, 256, 6176, 6176, 288, 288]
    - [17, 19.995]
  - - [6144, 128, 1, 512, 6176, 6176, 544, 544]
    - [137, 29.584]
  - - [6144, 128, 1, 1024, 6176, 6176, 1056, 1056]
    - [116, 38.784]
  - - [6144, 128, 1, 2048, 6176, 6176, 2080, 2080]
    - [116, 45.322]
  - - [6144, 128, 1, 4096, 6176, 6176, 4128, 4128]
    - [137, 49.905]
  - - [6144, 128, 1, 8192, 6176, 6176, 8224, 8224]
    - [140, 50.732]
  - - [6144, 256, 1, 64, 6176, 6176, 96, 256]
    - [11, 11.412]
  - - [6144, 256, 1, 128, 6176, 6176, 160, 256]
    - [44, 20.667]
  - - [6144, 256, 1, 256, 6176, 6176, 288, 288]
    - [64, 32.019]
  - - [6144, 256, 1, 512, 6176, 6176, 544, 544]
    - [23, 46.682]
  - - [6144, 256, 1, 1024, 6176, 6176, 1056, 1056]
    - [22, 59.581]
  - - [6144, 256, 1, 2048, 6176, 6176, 2080, 2080]
    - [28, 69.615]
  - - [6144, 256, 1, 4096, 6176, 6176, 4128, 4128]
    - [56, 75.482]
  - - [6144, 256, 1, 8192, 6176, 6176, 8224, 8224]
    - [40, 61.533]
  - - [6144, 512, 1, 64, 6176, 6176, 96, 512]
    - [51, 17.746]
  - - [6144, 512, 1, 128, 6176, 6176, 160, 512]
    - [43, 29.019]
  - - [6144, 512, 1, 256, 6176, 6176, 288, 512]
    - [58, 42.531]
  - - [6144, 512, 1, 512, 6176, 6176, 544, 544]
    - [58, 55.068]
  - - [6144, 512, 1, 1024, 6176, 6176, 1056, 1056]
    - [22, 65.835]
  - - [6144, 512, 1, 2048, 6176, 6176, 2080, 2080]
    - [20, 70.051]
  - - [6144, 512, 1, 4096, 6176, 6176, 4128, 4128]
    - [20, 75.215]
  - - [6144, 512, 1, 8192, 6176, 6176, 8224, 8224]
    - [21, 61.776]
  - - [6144, 1024, 1, 64, 6176, 6176, 96, 1024]
    - [64, 24.75]
  - - [6144, 1024, 1, 128, 6176, 6176, 160, 1024]
    - [58, 36.778]
  - - [6144, 1024, 1, 256, 6176, 6176, 288, 1024]
    - [71, 49.787]
  - - [6144, 1024, 1, 512, 6176, 6176, 544, 1024]
    - [52, 64.243]
  - - [6144, 1024, 1, 1024, 6176, 6176, 1056, 1056]
    - [51, 68.505]
  - - [6144, 1024, 1, 2048, 6176, 6176, 2080, 2080]
    - [49, 74.105]
  - - [6144, 1024, 1, 4096, 6176, 6176, 4128, 4128]
    - [71, 70.363]
  - - [6144, 1024, 1, 8192, 6176, 6176, 8224, 8224]
    - [52, 63.348]
  - - [6144, 2048, 1, 64, 6176, 6176, 96, 2048]
    - [64, 31.07]
  - - [6144, 2048, 1, 128, 6176, 6176, 160, 2048]
    - [64, 43.882]
  - - [6144, 2048, 1, 256, 6176, 6176, 288, 2048]
    - [71, 58.637]
  - - [6144, 2048, 1, 512, 6176, 6176, 544, 2048]
    - [51, 69.127]
  - - [6144, 2048, 1, 1024, 6176, 6176, 1056, 2048]
    - [48, 76.604]
  - - [6144, 2048, 1, 2048, 6176, 6176, 2080, 2080]
    - [51, 69.983]
  - - [6144, 2048, 1, 4096, 6176, 6176, 4128, 4128]
    - [47, 68.719]
  - - [6144, 2048, 1, 8192, 6176, 6176, 8224, 8224]
    - [51, 64.571]
  - - [6144, 4096, 1, 64, 6176, 6176, 96, 4096]
    - [41, 35.575]
  - - [6144, 4096, 1, 128, 6176, 6176, 160, 4096]
    - [71, 47.511]
  - - [6144, 4096, 1, 256, 6176, 6176, 288, 4096]
    - [34, 62.251]
  - - [6144, 4096, 1, 512, 6176, 6176, 544, 4096]
    - [32, 73.581]
  - - [6144, 4096, 1, 1024, 6176, 6176, 1056, 4096]
    - [21, 63.661]
  - - [6144, 4096, 1, 2048, 6176, 6176, 2080, 4096]
    - [47, 67.922]
  - - [6144, 4096, 1, 4096, 6176, 6176, 4128, 4128]
    - [64, 68.907]
  - - [6144, 4096, 1, 8192, 6176, 6176, 8224, 8224]
    - [52, 66.756]
  - - [6144, 8192, 1, 64, 6176, 6176, 96, 8192]
    - [57, 36.767]
  - - [6144, 8192, 1, 128, 6176, 6176, 160, 8192]
    - [63, 51.39]
  - - [6144, 8192, 1, 256, 6176, 6176, 288, 8192]
    - [50, 63.838]
  - - [6144, 8192, 1, 512, 6176, 6176, 544, 8192]
    - [62, 60.942]
  - - [6144, 8192, 1, 1024, 6176, 6176, 1056, 8192]
    - [23, 61.19]
  - - [6144, 8192, 1, 2048, 6176, 6176, 2080, 8192]
    - [52, 65.827]
  - - [6144, 8192, 1, 4096, 6176, 6176, 4128, 8192]
    - [63, 67.081]
  - - [6144, 8192, 1, 8192, 6176, 6176, 8224, 8224]
    - [52, 66.975]
- null
- null
- DeviceEfficiency
