library/src/blas3/Tensile/Logic/asm_full/navi31/navi31_Cijk_Alik_Bljk_HHS_BH.yaml
- {MinimumRequiredVersion: 4.35.0}
- navi31
- gfx1100
- [Device 73bf]
    SolutionIndex: 0
    SolutionNameMin: Cijk_Alik_Bljk_HHS_BH_MT32x32x16_MI16x16x16x1_SN_1LDSB0_AMAS0_GRVW8_IU1_SIA1_SU0_SUS0_SVW1_TT1_16_VW1_WGM4
    SolutionIndex: 1
    SolutionNameMin: Cijk_Alik_Bljk_HHS_BH_MT32x32x16_MI16x16x16x1_SN_1LDSB1_AMAS0_GRVW4_IU1_SIA2_SU0_SUS0_SVW1_TT1_16_VW1_WGM4
    SolutionIndex: 2
    SolutionNameMin: Cijk_Alik_Bljk_HHS_BH_MT32x32x16_MI16x16x16x1_SN_1LDSB0_AMAS0_GRVW8_IU1_SIA3_SU32_SUS128_SVW1_TT1_16_VW1_WGM4
    SolutionIndex: 3
    SolutionNameMin: Cijk_Alik_Bljk_HHS_BH_MT32x32x16_MI16x16x16x1_SN_1LDSB0_AMAS0_GRVW2_IU1_SIA3_SU32_SUS256_SVW1_TT1_16_VW1_WGM4
    SolutionIndex: 4
    SolutionNameMin: Cijk_Alik_Bljk_HHS_BH_MT32x32x16_MI16x16x16x1_SN_1LDSB0_AMAS0_GRVW4_IU1_SIA1_SU0_SUS0_SVW1_TT1_16_VW1_WGM8
    SolutionIndex: 5
    SolutionNameMin: Cijk_Alik_Bljk_HHS_BH_MT32x32x16_MI16x16x16x1_SN_1LDSB1_AMAS0_GRVW8_IU1_SIA2_SU32_SUS128_SVW1_TT1_16_VW1_WGM8
    SolutionIndex: 6
    SolutionNameMin: Cijk_Alik_Bljk_HHS_BH_MT64x64x16_MI16x16x16x1_SN_1LDSB0_AMAS3_GRVW8_IU1_SIA1_SU0_SUS0_SVW2_TT2_32_VW2_WGM4
    SolutionIndex: 7
    SolutionNameMin: Cijk_Alik_Bljk_HHS_BH_MT64x64x16_MI16x16x16x1_SN_1LDSB0_AMAS0_GRVW4_IU1_SIA3_SU0_SUS0_SVW1_TT2_32_VW1_WGM4
    SolutionIndex: 8
    SolutionNameMin: Cijk_Alik_Bljk_HHS_BH_MT64x64x16_MI16x16x16x1_SN_1LDSB0_AMAS3_GRVW4_IU1_SIA3_SU0_SUS0_SVW2_TT2_32_VW2_WGM4
    SolutionIndex: 9
    SolutionNameMin: Cijk_Alik_Bljk_HHS_BH_MT64x64x16_MI16x16x16x1_SN_1LDSB0_AMAS3_GRVW8_IU1_SIA3_SU0_SUS0_SVW2_TT2_32_VW2_WGM4
    SolutionIndex: 10
    SolutionNameMin: Cijk_Alik_Bljk_HHS_BH_MT64x64x16_MI16x16x16x1_SN_1LDSB0_AMAS3_GRVW8_IU1_SIA1_SU32_SUS128_SVW2_TT2_32_VW2_WGM4
    SolutionIndex: 11
    SolutionNameMin: Cijk_Alik_Bljk_HHS_BH_MT64x64x16_MI16x16x16x1_SN_1LDSB1_AMAS3_GRVW8_IU1_SIA2_SU32_SUS128_SVW2_TT2_32_VW2_WGM4
    SolutionIndex: 12
    SolutionNameMin: Cijk_Alik_Bljk_HHS_BH_MT64x64x16_MI16x16x16x1_SN_1LDSB0_AMAS3_GRVW8_IU1_SIA3_SU32_SUS128_SVW2_TT2_32_VW2_WGM4
    SolutionIndex: 13
    SolutionNameMin: Cijk_Alik_Bljk_HHS_BH_MT64x64x16_MI16x16x16x1_SN_1LDSB0_AMAS3_GRVW8_IU1_SIA3_SU32_SUS256_SVW2_TT2_32_VW2_WGM4
    SolutionIndex: 14
    SolutionNameMin: Cijk_Alik_Bljk_HHS_BH_MT64x64x16_MI16x16x16x1_SN_1LDSB0_AMAS3_GRVW2_IU1_SIA1_SU0_SUS0_SVW2_TT2_32_VW2_WGM8
    SolutionIndex: 15
    SolutionNameMin: Cijk_Alik_Bljk_HHS_BH_MT64x64x16_MI16x16x16x1_SN_1LDSB0_AMAS3_GRVW4_IU1_SIA1_SU0_SUS0_SVW2_TT2_32_VW2_WGM8
    SolutionIndex: 16
    SolutionNameMin: Cijk_Alik_Bljk_HHS_BH_MT64x64x16_MI16x16x16x1_SN_1LDSB0_AMAS3_GRVW8_IU1_SIA1_SU0_SUS0_SVW2_TT2_32_VW2_WGM8
    SolutionIndex: 17
    SolutionNameMin: Cijk_Alik_Bljk_HHS_BH_MT64x64x16_MI16x16x16x1_SN_1LDSB1_AMAS3_GRVW4_IU1_SIA2_SU0_SUS0_SVW2_TT2_32_VW2_WGM8
    SolutionIndex: 18
    SolutionNameMin: Cijk_Alik_Bljk_HHS_BH_MT64x64x16_MI16x16x16x1_SN_1LDSB1_AMAS3_GRVW8_IU1_SIA2_SU0_SUS0_SVW2_TT2_32_VW2_WGM8
    SolutionIndex: 19
    SolutionNameMin: Cijk_Alik_Bljk_HHS_BH_MT64x64x16_MI16x16x16x1_SN_1LDSB0_AMAS3_GRVW4_IU1_SIA1_SU32_SUS128_SVW2_TT2_32_VW2_WGM8
    SolutionIndex: 20
    SolutionNameMin: Cijk_Alik_Bljk_HHS_BH_MT64x64x16_MI16x16x16x1_SN_1LDSB0_AMAS3_GRVW8_IU1_SIA1_SU32_SUS128_SVW2_TT2_32_VW2_WGM8
    SolutionIndex: 21
    SolutionNameMin: Cijk_Alik_Bljk_HHS_BH_MT64x64x16_MI16x16x16x1_SN_1LDSB1_AMAS3_GRVW8_IU1_SIA2_SU32_SUS128_SVW2_TT2_32_VW2_WGM8
    SolutionIndex: 22
    SolutionNameMin: Cijk_Alik_Bljk_HHS_BH_MT64x64x16_MI16x16x16x1_SN_1LDSB0_AMAS3_GRVW8_IU1_SIA3_SU32_SUS128_SVW2_TT2_32_VW2_WGM8
    SolutionIndex: 23
    SolutionNameMin: Cijk_Alik_Bljk_HHS_BH_MT64x64x16_MI16x16x16x1_SN_1LDSB0_AMAS3_GRVW4_IU1_SIA1_SU32_SUS256_SVW2_TT2_32_VW2_WGM8
    SolutionIndex: 24
    SolutionNameMin: Cijk_Alik_Bljk_HHS_BH_MT64x64x16_MI16x16x16x1_SN_1LDSB1_AMAS3_GRVW2_IU1_SIA2_SU32_SUS256_SVW2_TT2_32_VW2_WGM8
    SolutionIndex: 25
    SolutionNameMin: Cijk_Alik_Bljk_HHS_BH_MT64x64x16_MI16x16x16x1_SN_1LDSB1_AMAS3_GRVW8_IU1_SIA2_SU32_SUS256_SVW2_TT2_32_VW2_WGM8
    SolutionIndex: 26
    SolutionNameMin: Cijk_Alik_Bljk_HHS_BH_MT128x128x16_MI16x16x16x1_SN_1LDSB0_AMAS0_GRVW2_IU1_SIA1_SU0_SUS0_SVW1_TT4_64_VW1_WGM4
    SolutionIndex: 27
    SolutionNameMin: Cijk_Alik_Bljk_HHS_BH_MT128x128x16_MI16x16x16x1_SN_1LDSB0_AMAS3_GRVW2_IU1_SIA1_SU0_SUS0_SVW4_TT4_64_VW4_WGM4
    SolutionIndex: 28
    SolutionNameMin: Cijk_Alik_Bljk_HHS_BH_MT128x128x16_MI16x16x16x1_SN_1LDSB0_AMAS3_GRVW4_IU1_SIA1_SU0_SUS0_SVW2_TT4_64_VW2_WGM4
    SolutionIndex: 29
    SolutionNameMin: Cijk_Alik_Bljk_HHS_BH_MT128x128x16_MI16x16x16x1_SN_1LDSB0_AMAS3_GRVW4_IU1_SIA1_SU0_SUS0_SVW4_TT4_64_VW4_WGM4
    SolutionIndex: 30
    SolutionNameMin: Cijk_Alik_Bljk_HHS_BH_MT128x128x16_MI16x16x16x1_SN_1LDSB0_AMAS0_GRVW8_IU1_SIA1_SU0_SUS0_SVW1_TT4_64_VW1_WGM4
    SolutionIndex: 31
    SolutionNameMin: Cijk_Alik_Bljk_HHS_BH_MT128x128x16_MI16x16x16x1_SN_1LDSB0_AMAS3_GRVW8_IU1_SIA1_SU0_SUS0_SVW2_TT4_64_VW2_WGM4
    SolutionIndex: 32
    SolutionNameMin: Cijk_Alik_Bljk_HHS_BH_MT128x128x16_MI16x16x16x1_SN_1LDSB0_AMAS3_GRVW8_IU1_SIA1_SU0_SUS0_SVW4_TT4_64_VW4_WGM4
    SolutionIndex: 33
    SolutionNameMin: Cijk_Alik_Bljk_HHS_BH_MT128x128x16_MI16x16x16x1_SN_1LDSB1_AMAS3_GRVW2_IU1_SIA2_SU0_SUS0_SVW2_TT4_64_VW2_WGM4
    SolutionIndex: 34
    SolutionNameMin: Cijk_Alik_Bljk_HHS_BH_MT128x128x16_MI16x16x16x1_SN_1LDSB1_AMAS3_GRVW4_IU1_SIA2_SU0_SUS0_SVW2_TT4_64_VW2_WGM4
    SolutionIndex: 35
    SolutionNameMin: Cijk_Alik_Bljk_HHS_BH_MT128x128x16_MI16x16x16x1_SN_1LDSB1_AMAS3_GRVW8_IU1_SIA2_SU0_SUS0_SVW4_TT4_64_VW4_WGM4
    SolutionIndex: 36
    SolutionNameMin: Cijk_Alik_Bljk_HHS_BH_MT128x128x16_MI16x16x16x1_SN_1LDSB0_AMAS0_GRVW2_IU1_SIA3_SU0_SUS0_SVW1_TT4_64_VW1_WGM4
    SolutionIndex: 37
    SolutionNameMin: Cijk_Alik_Bljk_HHS_BH_MT128x128x16_MI16x16x16x1_SN_1LDSB0_AMAS3_GRVW2_IU1_SIA3_SU0_SUS0_SVW2_TT4_64_VW2_WGM4
    SolutionIndex: 38
    SolutionNameMin: Cijk_Alik_Bljk_HHS_BH_MT128x128x16_MI16x16x16x1_SN_1LDSB0_AMAS3_GRVW2_IU1_SIA3_SU0_SUS0_SVW4_TT4_64_VW4_WGM4
    SolutionIndex: 39
    SolutionNameMin: Cijk_Alik_Bljk_HHS_BH_MT128x128x16_MI16x16x16x1_SN_1LDSB0_AMAS3_GRVW4_IU1_SIA3_SU0_SUS0_SVW2_TT4_64_VW2_WGM4
    SolutionIndex: 40
    SolutionNameMin: Cijk_Alik_Bljk_HHS_BH_MT128x128x16_MI16x16x16x1_SN_1LDSB0_AMAS3_GRVW4_IU1_SIA3_SU0_SUS0_SVW4_TT4_64_VW4_WGM4
    SolutionIndex: 41
    SolutionNameMin: Cijk_Alik_Bljk_HHS_BH_MT128x128x16_MI16x16x16x1_SN_1LDSB0_AMAS3_GRVW8_IU1_SIA3_SU0_SUS0_SVW2_TT4_64_VW2_WGM4
    SolutionIndex: 42
    SolutionNameMin: Cijk_Alik_Bljk_HHS_BH_MT128x128x16_MI16x16x16x1_SN_1LDSB0_AMAS3_GRVW8_IU1_SIA3_SU0_SUS0_SVW4_TT4_64_VW4_WGM4
    SolutionIndex: 43
    SolutionNameMin: Cijk_Alik_Bljk_HHS_BH_MT128x128x16_MI16x16x16x1_SN_1LDSB0_AMAS3_GRVW2_IU1_SIA1_SU32_SUS128_SVW4_TT4_64_VW4_WGM4
    SolutionIndex: 44
    SolutionNameMin: Cijk_Alik_Bljk_HHS_BH_MT128x128x16_MI16x16x16x1_SN_1LDSB0_AMAS3_GRVW4_IU1_SIA1_SU32_SUS128_SVW4_TT4_64_VW4_WGM4
    SolutionIndex: 45
    SolutionNameMin: Cijk_Alik_Bljk_HHS_BH_MT128x128x16_MI16x16x16x1_SN_1LDSB0_AMAS0_GRVW8_IU1_SIA1_SU32_SUS128_SVW1_TT4_64_VW1_WGM4
    SolutionIndex: 46
    SolutionNameMin: Cijk_Alik_Bljk_HHS_BH_MT128x128x16_MI16x16x16x1_SN_1LDSB0_AMAS3_GRVW8_IU1_SIA1_SU32_SUS128_SVW4_TT4_64_VW4_WGM4
    SolutionIndex: 47
    SolutionNameMin: Cijk_Alik_Bljk_HHS_BH_MT128x128x16_MI16x16x16x1_SN_1LDSB1_AMAS3_GRVW8_IU1_SIA2_SU32_SUS128_SVW2_TT4_64_VW2_WGM4
    SolutionIndex: 48
    SolutionNameMin: Cijk_Alik_Bljk_HHS_BH_MT128x128x16_MI16x16x16x1_SN_1LDSB0_AMAS3_GRVW8_IU1_SIA3_SU32_SUS128_SVW4_TT4_64_VW4_WGM4
    SolutionIndex: 49
    SolutionNameMin: Cijk_Alik_Bljk_HHS_BH_MT128x128x16_MI16x16x16x1_SN_1LDSB0_AMAS0_GRVW2_IU1_SIA1_SU32_SUS256_SVW1_TT4_64_VW1_WGM4
    SolutionIndex: 50
    SolutionNameMin: Cijk_Alik_Bljk_HHS_BH_MT128x128x16_MI16x16x16x1_SN_1LDSB0_AMAS3_GRVW4_IU1_SIA1_SU32_SUS256_SVW2_TT4_64_VW2_WGM4
    SolutionIndex: 51
    SolutionNameMin: Cijk_Alik_Bljk_HHS_BH_MT128x128x16_MI16x16x16x1_SN_1LDSB0_AMAS3_GRVW8_IU1_SIA1_SU32_SUS256_SVW2_TT4_64_VW2_WGM4
    SolutionIndex: 52
    SolutionNameMin: Cijk_Alik_Bljk_HHS_BH_MT128x128x16_MI16x16x16x1_SN_1LDSB0_AMAS3_GRVW8_IU1_SIA1_SU32_SUS256_SVW4_TT4_64_VW4_WGM4
    SolutionIndex: 53
    SolutionNameMin: Cijk_Alik_Bljk_HHS_BH_MT128x128x16_MI16x16x16x1_SN_1LDSB1_AMAS3_GRVW4_IU1_SIA2_SU32_SUS256_SVW2_TT4_64_VW2_WGM4
    SolutionIndex: 54
    SolutionNameMin: Cijk_Alik_Bljk_HHS_BH_MT128x128x16_MI16x16x16x1_SN_1LDSB1_AMAS3_GRVW8_IU1_SIA2_SU32_SUS256_SVW4_TT4_64_VW4_WGM4
    SolutionIndex: 55
    SolutionNameMin: Cijk_Alik_Bljk_HHS_BH_MT128x128x16_MI16x16x16x1_SN_1LDSB0_AMAS3_GRVW4_IU1_SIA3_SU32_SUS256_SVW2_TT4_64_VW2_WGM4
    SolutionIndex: 56
    SolutionNameMin: Cijk_Alik_Bljk_HHS_BH_MT128x128x16_MI16x16x16x1_SN_1LDSB0_AMAS3_GRVW8_IU1_SIA3_SU32_SUS256_SVW4_TT4_64_VW4_WGM4
    SolutionIndex: 57
    SolutionNameMin: Cijk_Alik_Bljk_HHS_BH_MT128x128x16_MI16x16x16x1_SN_1LDSB0_AMAS3_GRVW2_IU1_SIA1_SU0_SUS0_SVW4_TT4_64_VW4_WGM8
    SolutionIndex: 58
    SolutionNameMin: Cijk_Alik_Bljk_HHS_BH_MT128x128x16_MI16x16x16x1_SN_1LDSB0_AMAS0_GRVW4_IU1_SIA1_SU0_SUS0_SVW1_TT4_64_VW1_WGM8
    SolutionIndex: 59
    SolutionNameMin: Cijk_Alik_Bljk_HHS_BH_MT128x128x16_MI16x16x16x1_SN_1LDSB0_AMAS3_GRVW4_IU1_SIA1_SU0_SUS0_SVW4_TT4_64_VW4_WGM8
    SolutionIndex: 60
    SolutionNameMin: Cijk_Alik_Bljk_HHS_BH_MT128x128x16_MI16x16x16x1_SN_1LDSB0_AMAS0_GRVW8_IU1_SIA1_SU0_SUS0_SVW1_TT4_64_VW1_WGM8
    SolutionIndex: 61
    SolutionNameMin: Cijk_Alik_Bljk_HHS_BH_MT128x128x16_MI16x16x16x1_SN_1LDSB0_AMAS3_GRVW8_IU1_SIA1_SU0_SUS0_SVW2_TT4_64_VW2_WGM8
    SolutionIndex: 62
    SolutionNameMin: Cijk_Alik_Bljk_HHS_BH_MT128x128x16_MI16x16x16x1_SN_1LDSB0_AMAS3_GRVW8_IU1_SIA1_SU0_SUS0_SVW4_TT4_64_VW4_WGM8
    SolutionIndex: 63
    SolutionNameMin: Cijk_Alik_Bljk_HHS_BH_MT128x128x16_MI16x16x16x1_SN_1LDSB1_AMAS3_GRVW4_IU1_SIA2_SU0_SUS0_SVW2_TT4_64_VW2_WGM8
    SolutionIndex: 64
    SolutionNameMin: Cijk_Alik_Bljk_HHS_BH_MT128x128x16_MI16x16x16x1_SN_1LDSB1_AMAS3_GRVW4_IU1_SIA2_SU0_SUS0_SVW4_TT4_64_VW4_WGM8
    SolutionIndex: 65
    SolutionNameMin: Cijk_Alik_Bljk_HHS_BH_MT128x128x16_MI16x16x16x1_SN_1LDSB1_AMAS3_GRVW8_IU1_SIA2_SU0_SUS0_SVW2_TT4_64_VW2_WGM8
    SolutionIndex: 66
    SolutionNameMin: Cijk_Alik_Bljk_HHS_BH_MT128x128x16_MI16x16x16x1_SN_1LDSB1_AMAS3_GRVW8_IU1_SIA2_SU0_SUS0_SVW4_TT4_64_VW4_WGM8
    SolutionIndex: 67
    SolutionNameMin: Cijk_Alik_Bljk_HHS_BH_MT128x128x16_MI16x16x16x1_SN_1LDSB0_AMAS0_GRVW2_IU1_SIA3_SU0_SUS0_SVW1_TT4_64_VW1_WGM8
    SolutionIndex: 68
    SolutionNameMin: Cijk_Alik_Bljk_HHS_BH_MT128x128x16_MI16x16x16x1_SN_1LDSB0_AMAS3_GRVW2_IU1_SIA3_SU0_SUS0_SVW4_TT4_64_VW4_WGM8
    SolutionIndex: 69
    SolutionNameMin: Cijk_Alik_Bljk_HHS_BH_MT128x128x16_MI16x16x16x1_SN_1LDSB0_AMAS3_GRVW4_IU1_SIA3_SU0_SUS0_SVW2_TT4_64_VW2_WGM8
    SolutionIndex: 70
    SolutionNameMin: Cijk_Alik_Bljk_HHS_BH_MT128x128x16_MI16x16x16x1_SN_1LDSB0_AMAS3_GRVW4_IU1_SIA3_SU0_SUS0_SVW4_TT4_64_VW4_WGM8
    SolutionIndex: 71
    SolutionNameMin: Cijk_Alik_Bljk_HHS_BH_MT128x128x16_MI16x16x16x1_SN_1LDSB0_AMAS0_GRVW8_IU1_SIA3_SU0_SUS0_SVW1_TT4_64_VW1_WGM8
    SolutionIndex: 72
    SolutionNameMin: Cijk_Alik_Bljk_HHS_BH_MT128x128x16_MI16x16x16x1_SN_1LDSB0_AMAS3_GRVW8_IU1_SIA3_SU0_SUS0_SVW2_TT4_64_VW2_WGM8
    SolutionIndex: 73
    SolutionNameMin: Cijk_Alik_Bljk_HHS_BH_MT128x128x16_MI16x16x16x1_SN_1LDSB0_AMAS3_GRVW8_IU1_SIA3_SU0_SUS0_SVW4_TT4_64_VW4_WGM8
    SolutionIndex: 74
    SolutionNameMin: Cijk_Alik_Bljk_HHS_BH_MT128x128x16_MI16x16x16x1_SN_1LDSB0_AMAS3_GRVW2_IU1_SIA1_SU32_SUS128_SVW2_TT4_64_VW2_WGM8
    SolutionIndex: 75
    SolutionNameMin: Cijk_Alik_Bljk_HHS_BH_MT128x128x16_MI16x16x16x1_SN_1LDSB0_AMAS0_GRVW8_IU1_SIA1_SU32_SUS128_SVW1_TT4_64_VW1_WGM8
    SolutionIndex: 76
    SolutionNameMin: Cijk_Alik_Bljk_HHS_BH_MT128x128x16_MI16x16x16x1_SN_1LDSB0_AMAS3_GRVW8_IU1_SIA1_SU32_SUS128_SVW2_TT4_64_VW2_WGM8
    SolutionIndex: 77
    SolutionNameMin: Cijk_Alik_Bljk_HHS_BH_MT128x128x16_MI16x16x16x1_SN_1LDSB0_AMAS3_GRVW8_IU1_SIA1_SU32_SUS128_SVW4_TT4_64_VW4_WGM8
    SolutionIndex: 78
    SolutionNameMin: Cijk_Alik_Bljk_HHS_BH_MT128x128x16_MI16x16x16x1_SN_1LDSB0_AMAS3_GRVW8_IU1_SIA3_SU32_SUS128_SVW4_TT4_64_VW4_WGM8
    SolutionIndex: 79
    SolutionNameMin: Cijk_Alik_Bljk_HHS_BH_MT128x128x16_MI16x16x16x1_SN_1LDSB1_AMAS3_GRVW8_IU1_SIA2_SU32_SUS256_SVW4_TT4_64_VW4_WGM8
    SolutionIndex: 80
    SolutionNameMin: Cijk_Alik_Bljk_HHS_BH_MT128x128x16_MI16x16x16x1_SN_1LDSB0_AMAS3_GRVW4_IU1_SIA3_SU32_SUS256_SVW2_TT4_64_VW2_WGM8
    SolutionIndex: 81
    SolutionNameMin: Cijk_Alik_Bljk_HHS_BH_MT128x128x16_MI16x16x16x1_SN_1LDSB0_AMAS0_GRVW8_IU1_SIA3_SU32_SUS256_SVW1_TT4_64_VW1_WGM8
    SolutionIndex: 82
    SolutionNameMin: Cijk_Alik_Bljk_HHS_BH_MT128x128x16_MI16x16x16x1_SN_1LDSB0_AMAS3_GRVW8_IU1_SIA3_SU32_SUS256_SVW4_TT4_64_VW4_WGM8
    SolutionIndex: 83
    SolutionNameMin: Cijk_Alik_Bljk_HHS_BH_MT32x32x32_MI16x16x16x1_SN_1LDSB1_AMAS0_GRVW2_IU2_SIA2_SU0_SUS0_SVW1_TT1_16_VW1_WGM4
    SolutionIndex: 84
    SolutionNameMin: Cijk_Alik_Bljk_HHS_BH_MT32x32x32_MI16x16x16x1_SN_1LDSB1_AMAS0_GRVW4_IU2_SIA2_SU0_SUS0_SVW1_TT1_16_VW1_WGM4
    SolutionIndex: 85
    SolutionNameMin: Cijk_Alik_Bljk_HHS_BH_MT32x32x32_MI16x16x16x1_SN_1LDSB1_AMAS0_GRVW8_IU2_SIA2_SU0_SUS0_SVW1_TT1_16_VW1_WGM4
    SolutionIndex: 86
    SolutionNameMin: Cijk_Alik_Bljk_HHS_BH_MT32x32x32_MI16x16x16x1_SN_1LDSB0_AMAS0_GRVW8_IU1_SIA3_SU0_SUS0_SVW1_TT1_16_VW1_WGM4
    SolutionIndex: 87
    SolutionNameMin: Cijk_Alik_Bljk_HHS_BH_MT32x32x32_MI16x16x16x1_SN_1LDSB1_AMAS0_GRVW2_IU2_SIA2_SU32_SUS128_SVW1_TT1_16_VW1_WGM4
    SolutionIndex: 88
    SolutionNameMin: Cijk_Alik_Bljk_HHS_BH_MT32x32x32_MI16x16x16x1_SN_1LDSB1_AMAS0_GRVW4_IU2_SIA2_SU32_SUS128_SVW1_TT1_16_VW1_WGM4
    SolutionIndex: 89
    SolutionNameMin: Cijk_Alik_Bljk_HHS_BH_MT32x32x32_MI16x16x16x1_SN_1LDSB1_AMAS0_GRVW8_IU2_SIA2_SU32_SUS128_SVW1_TT1_16_VW1_WGM4
    SolutionIndex: 90
    SolutionNameMin: Cijk_Alik_Bljk_HHS_BH_MT32x32x32_MI16x16x16x1_SN_1LDSB0_AMAS0_GRVW8_IU1_SIA1_SU32_SUS256_SVW1_TT1_16_VW1_WGM4
    SolutionIndex: 91
    SolutionNameMin: Cijk_Alik_Bljk_HHS_BH_MT32x32x32_MI16x16x16x1_SN_1LDSB1_AMAS0_GRVW2_IU2_SIA2_SU32_SUS256_SVW1_TT1_16_VW1_WGM4
    SolutionIndex: 92
    SolutionNameMin: Cijk_Alik_Bljk_HHS_BH_MT32x32x32_MI16x16x16x1_SN_1LDSB1_AMAS0_GRVW4_IU2_SIA2_SU32_SUS256_SVW1_TT1_16_VW1_WGM4
    SolutionIndex: 93
    SolutionNameMin: Cijk_Alik_Bljk_HHS_BH_MT32x32x32_MI16x16x16x1_SN_1LDSB1_AMAS0_GRVW8_IU2_SIA2_SU32_SUS256_SVW1_TT1_16_VW1_WGM4
    SolutionIndex: 94
    SolutionNameMin: Cijk_Alik_Bljk_HHS_BH_MT32x32x32_MI16x16x16x1_SN_1LDSB0_AMAS0_GRVW4_IU1_SIA3_SU32_SUS256_SVW1_TT1_16_VW1_WGM4
    SolutionIndex: 95
    SolutionNameMin: Cijk_Alik_Bljk_HHS_BH_MT32x32x32_MI16x16x16x1_SN_1LDSB0_AMAS0_GRVW4_IU1_SIA1_SU0_SUS0_SVW1_TT1_16_VW1_WGM8
    SolutionIndex: 96
    SolutionNameMin: Cijk_Alik_Bljk_HHS_BH_MT32x32x32_MI16x16x16x1_SN_1LDSB0_AMAS0_GRVW8_IU1_SIA1_SU0_SUS0_SVW1_TT1_16_VW1_WGM8
    SolutionIndex: 97
    SolutionNameMin: Cijk_Alik_Bljk_HHS_BH_MT32x32x32_MI16x16x16x1_SN_1LDSB1_AMAS0_GRVW2_IU2_SIA2_SU0_SUS0_SVW1_TT1_16_VW1_WGM8
    SolutionIndex: 98
    SolutionNameMin: Cijk_Alik_Bljk_HHS_BH_MT32x32x32_MI16x16x16x1_SN_1LDSB1_AMAS0_GRVW4_IU2_SIA2_SU0_SUS0_SVW1_TT1_16_VW1_WGM8
    SolutionIndex: 99
    SolutionNameMin: Cijk_Alik_Bljk_HHS_BH_MT32x32x32_MI16x16x16x1_SN_1LDSB1_AMAS0_GRVW8_IU2_SIA2_SU0_SUS0_SVW1_TT1_16_VW1_WGM8
    SolutionIndex: 100
    SolutionNameMin: Cijk_Alik_Bljk_HHS_BH_MT32x32x32_MI16x16x16x1_SN_1LDSB0_AMAS0_GRVW8_IU1_SIA3_SU0_SUS0_SVW1_TT1_16_VW1_WGM8
    SolutionIndex: 101
    SolutionNameMin: Cijk_Alik_Bljk_HHS_BH_MT32x32x32_MI16x16x16x1_SN_1LDSB1_AMAS0_GRVW2_IU2_SIA2_SU32_SUS128_SVW1_TT1_16_VW1_WGM8
    SolutionIndex: 102
    SolutionNameMin: Cijk_Alik_Bljk_HHS_BH_MT32x32x32_MI16x16x16x1_SN_1LDSB1_AMAS0_GRVW4_IU2_SIA2_SU32_SUS128_SVW1_TT1_16_VW1_WGM8
    SolutionIndex: 103
    SolutionNameMin: Cijk_Alik_Bljk_HHS_BH_MT32x32x32_MI16x16x16x1_SN_1LDSB1_AMAS0_GRVW8_IU2_SIA2_SU32_SUS128_SVW1_TT1_16_VW1_WGM8
    SolutionIndex: 104
    SolutionNameMin: Cijk_Alik_Bljk_HHS_BH_MT32x32x32_MI16x16x16x1_SN_1LDSB0_AMAS0_GRVW8_IU1_SIA3_SU32_SUS128_SVW1_TT1_16_VW1_WGM8
    SolutionIndex: 105
    SolutionNameMin: Cijk_Alik_Bljk_HHS_BH_MT32x32x32_MI16x16x16x1_SN_1LDSB0_AMAS0_GRVW8_IU1_SIA1_SU32_SUS256_SVW1_TT1_16_VW1_WGM8
    SolutionIndex: 106
    SolutionNameMin: Cijk_Alik_Bljk_HHS_BH_MT32x32x32_MI16x16x16x1_SN_1LDSB1_AMAS0_GRVW2_IU2_SIA2_SU32_SUS256_SVW1_TT1_16_VW1_WGM8
    SolutionIndex: 107
    SolutionNameMin: Cijk_Alik_Bljk_HHS_BH_MT32x32x32_MI16x16x16x1_SN_1LDSB1_AMAS0_GRVW4_IU2_SIA2_SU32_SUS256_SVW1_TT1_16_VW1_WGM8
    SolutionIndex: 108
    SolutionNameMin: Cijk_Alik_Bljk_HHS_BH_MT32x32x32_MI16x16x16x1_SN_1LDSB1_AMAS0_GRVW8_IU2_SIA2_SU32_SUS256_SVW1_TT1_16_VW1_WGM8
    SolutionIndex: 109
    SolutionNameMin: Cijk_Alik_Bljk_HHS_BH_MT32x32x32_MI16x16x16x1_SN_1LDSB0_AMAS0_GRVW4_IU1_SIA3_SU32_SUS256_SVW1_TT1_16_VW1_WGM8
    SolutionIndex: 110
    SolutionNameMin: Cijk_Alik_Bljk_HHS_BH_MT64x64x32_MI16x16x16x1_SN_1LDSB0_AMAS0_GRVW4_IU1_SIA1_SU0_SUS0_SVW1_TT2_32_VW1_WGM4
    SolutionIndex: 111
    SolutionNameMin: Cijk_Alik_Bljk_HHS_BH_MT64x64x32_MI16x16x16x1_SN_1LDSB0_AMAS0_GRVW8_IU1_SIA1_SU0_SUS0_SVW1_TT2_32_VW1_WGM4
    SolutionIndex: 112
    SolutionNameMin: Cijk_Alik_Bljk_HHS_BH_MT64x64x32_MI16x16x16x1_SN_1LDSB0_AMAS3_GRVW8_IU1_SIA1_SU0_SUS0_SVW2_TT2_32_VW2_WGM4
    SolutionIndex: 113
    SolutionNameMin: Cijk_Alik_Bljk_HHS_BH_MT64x64x32_MI16x16x16x1_SN_1LDSB1_AMAS0_GRVW4_IU2_SIA2_SU0_SUS0_SVW1_TT2_32_VW1_WGM4
    SolutionIndex: 114
    SolutionNameMin: Cijk_Alik_Bljk_HHS_BH_MT64x64x32_MI16x16x16x1_SN_1LDSB1_AMAS3_GRVW4_IU2_SIA2_SU0_SUS0_SVW2_TT2_32_VW2_WGM4
    SolutionIndex: 115
    SolutionNameMin: Cijk_Alik_Bljk_HHS_BH_MT64x64x32_MI16x16x16x1_SN_1LDSB1_AMAS3_GRVW8_IU2_SIA2_SU0_SUS0_SVW2_TT2_32_VW2_WGM4
    SolutionIndex: 116
    SolutionNameMin: Cijk_Alik_Bljk_HHS_BH_MT64x64x32_MI16x16x16x1_SN_1LDSB0_AMAS3_GRVW4_IU1_SIA3_SU0_SUS0_SVW2_TT2_32_VW2_WGM4
    SolutionIndex: 117
    SolutionNameMin: Cijk_Alik_Bljk_HHS_BH_MT64x64x32_MI16x16x16x1_SN_1LDSB0_AMAS0_GRVW8_IU1_SIA3_SU0_SUS0_SVW1_TT2_32_VW1_WGM4
    SolutionIndex: 118
    SolutionNameMin: Cijk_Alik_Bljk_HHS_BH_MT64x64x32_MI16x16x16x1_SN_1LDSB0_AMAS3_GRVW8_IU1_SIA3_SU0_SUS0_SVW2_TT2_32_VW2_WGM4
    SolutionIndex: 119
    SolutionNameMin: Cijk_Alik_Bljk_HHS_BH_MT64x64x32_MI16x16x16x1_SN_1LDSB0_AMAS3_GRVW4_IU1_SIA1_SU32_SUS128_SVW2_TT2_32_VW2_WGM4
    SolutionIndex: 120
    SolutionNameMin: Cijk_Alik_Bljk_HHS_BH_MT64x64x32_MI16x16x16x1_SN_1LDSB0_AMAS0_GRVW8_IU1_SIA1_SU32_SUS128_SVW1_TT2_32_VW1_WGM4
    SolutionIndex: 121
    SolutionNameMin: Cijk_Alik_Bljk_HHS_BH_MT64x64x32_MI16x16x16x1_SN_1LDSB0_AMAS3_GRVW8_IU1_SIA1_SU32_SUS128_SVW2_TT2_32_VW2_WGM4
    SolutionIndex: 122
    SolutionNameMin: Cijk_Alik_Bljk_HHS_BH_MT64x64x32_MI16x16x16x1_SN_1LDSB1_AMAS3_GRVW4_IU2_SIA2_SU32_SUS128_SVW2_TT2_32_VW2_WGM4
    SolutionIndex: 123
    SolutionNameMin: Cijk_Alik_Bljk_HHS_BH_MT64x64x32_MI16x16x16x1_SN_1LDSB1_AMAS3_GRVW8_IU2_SIA2_SU32_SUS128_SVW2_TT2_32_VW2_WGM4
    SolutionIndex: 124
    SolutionNameMin: Cijk_Alik_Bljk_HHS_BH_MT64x64x32_MI16x16x16x1_SN_1LDSB0_AMAS3_GRVW8_IU1_SIA1_SU32_SUS256_SVW2_TT2_32_VW2_WGM4
    SolutionIndex: 125
    SolutionNameMin: Cijk_Alik_Bljk_HHS_BH_MT64x64x32_MI16x16x16x1_SN_1LDSB1_AMAS0_GRVW4_IU2_SIA2_SU32_SUS256_SVW1_TT2_32_VW1_WGM4
    SolutionIndex: 126
    SolutionNameMin: Cijk_Alik_Bljk_HHS_BH_MT64x64x32_MI16x16x16x1_SN_1LDSB1_AMAS3_GRVW4_IU2_SIA2_SU32_SUS256_SVW2_TT2_32_VW2_WGM4
    SolutionIndex: 127
    SolutionNameMin: Cijk_Alik_Bljk_HHS_BH_MT64x64x32_MI16x16x16x1_SN_1LDSB1_AMAS3_GRVW8_IU2_SIA2_SU32_SUS256_SVW2_TT2_32_VW2_WGM4
    SolutionIndex: 128
    SolutionNameMin: Cijk_Alik_Bljk_HHS_BH_MT64x64x32_MI16x16x16x1_SN_1LDSB0_AMAS3_GRVW4_IU1_SIA3_SU32_SUS256_SVW2_TT2_32_VW2_WGM4
    SolutionIndex: 129
    SolutionNameMin: Cijk_Alik_Bljk_HHS_BH_MT64x64x32_MI16x16x16x1_SN_1LDSB0_AMAS0_GRVW8_IU1_SIA1_SU0_SUS0_SVW1_TT2_32_VW1_WGM8
    SolutionIndex: 130
    SolutionNameMin: Cijk_Alik_Bljk_HHS_BH_MT64x64x32_MI16x16x16x1_SN_1LDSB0_AMAS3_GRVW8_IU1_SIA1_SU0_SUS0_SVW2_TT2_32_VW2_WGM8
    SolutionIndex: 131
    SolutionNameMin: Cijk_Alik_Bljk_HHS_BH_MT64x64x32_MI16x16x16x1_SN_1LDSB1_AMAS0_GRVW4_IU2_SIA2_SU0_SUS0_SVW1_TT2_32_VW1_WGM8
    SolutionIndex: 132
    SolutionNameMin: Cijk_Alik_Bljk_HHS_BH_MT64x64x32_MI16x16x16x1_SN_1LDSB1_AMAS3_GRVW4_IU2_SIA2_SU0_SUS0_SVW2_TT2_32_VW2_WGM8
    SolutionIndex: 133
    SolutionNameMin: Cijk_Alik_Bljk_HHS_BH_MT64x64x32_MI16x16x16x1_SN_1LDSB1_AMAS0_GRVW8_IU2_SIA2_SU0_SUS0_SVW1_TT2_32_VW1_WGM8
    SolutionIndex: 134
    SolutionNameMin: Cijk_Alik_Bljk_HHS_BH_MT64x64x32_MI16x16x16x1_SN_1LDSB1_AMAS3_GRVW8_IU2_SIA2_SU0_SUS0_SVW2_TT2_32_VW2_WGM8
    SolutionIndex: 135
    SolutionNameMin: Cijk_Alik_Bljk_HHS_BH_MT64x64x32_MI16x16x16x1_SN_1LDSB0_AMAS3_GRVW8_IU1_SIA3_SU0_SUS0_SVW2_TT2_32_VW2_WGM8
    SolutionIndex: 136
    SolutionNameMin: Cijk_Alik_Bljk_HHS_BH_MT64x64x32_MI16x16x16x1_SN_1LDSB0_AMAS3_GRVW8_IU1_SIA1_SU32_SUS128_SVW2_TT2_32_VW2_WGM8
    SolutionIndex: 137
    SolutionNameMin: Cijk_Alik_Bljk_HHS_BH_MT64x64x32_MI16x16x16x1_SN_1LDSB1_AMAS0_GRVW8_IU2_SIA2_SU32_SUS128_SVW1_TT2_32_VW1_WGM8
    SolutionIndex: 138
    SolutionNameMin: Cijk_Alik_Bljk_HHS_BH_MT64x64x32_MI16x16x16x1_SN_1LDSB1_AMAS3_GRVW8_IU2_SIA2_SU32_SUS128_SVW2_TT2_32_VW2_WGM8
    SolutionIndex: 139
    SolutionNameMin: Cijk_Alik_Bljk_HHS_BH_MT64x64x32_MI16x16x16x1_SN_1LDSB0_AMAS3_GRVW4_IU1_SIA1_SU32_SUS256_SVW2_TT2_32_VW2_WGM8
    SolutionIndex: 140
    SolutionNameMin: Cijk_Alik_Bljk_HHS_BH_MT64x64x32_MI16x16x16x1_SN_1LDSB0_AMAS3_GRVW8_IU1_SIA1_SU32_SUS256_SVW2_TT2_32_VW2_WGM8
    SolutionIndex: 141
    SolutionNameMin: Cijk_Alik_Bljk_HHS_BH_MT64x64x32_MI16x16x16x1_SN_1LDSB1_AMAS3_GRVW4_IU2_SIA2_SU32_SUS256_SVW2_TT2_32_VW2_WGM8
    SolutionIndex: 142
    SolutionNameMin: Cijk_Alik_Bljk_HHS_BH_MT64x64x32_MI16x16x16x1_SN_1LDSB1_AMAS0_GRVW8_IU2_SIA2_SU32_SUS256_SVW1_TT2_32_VW1_WGM8
    SolutionIndex: 143
    SolutionNameMin: Cijk_Alik_Bljk_HHS_BH_MT64x64x32_MI16x16x16x1_SN_1LDSB1_AMAS3_GRVW8_IU2_SIA2_SU32_SUS256_SVW2_TT2_32_VW2_WGM8
    SolutionIndex: 144
    SolutionNameMin: Cijk_Alik_Bljk_HHS_BH_MT64x64x32_MI16x16x16x1_SN_1LDSB0_AMAS3_GRVW8_IU1_SIA3_SU32_SUS256_SVW2_TT2_32_VW2_WGM8
- - - [64, 64, 1, 64, 96, 96, 96, 96]
    - [0, 0.043]
  - - [64, 64, 1, 128, 96, 96, 160, 160]
    - [83, 0.083]
  - - [64, 64, 1, 256, 96, 96, 288, 288]
    - [85, 0.157]
  - - [64, 64, 1, 512, 96, 96, 544, 544]
    - [85, 0.278]
  - - [64, 64, 1, 1024, 96, 96, 1056, 1056]
    - [107, 0.444]
  - - [64, 64, 1, 2048, 96, 96, 2080, 2080]
    - [98, 0.647]
  - - [64, 64, 1, 4096, 96, 96, 4128, 4128]
    - [84, 0.827]
  - - [64, 64, 1, 8192, 96, 96, 8224, 8224]
    - [84, 0.96]
  - - [64, 128, 1, 64, 96, 96, 96, 96]
    - [86, 0.088]
  - - [64, 128, 1, 128, 96, 96, 160, 160]
    - [101, 0.171]
  - - [64, 128, 1, 256, 96, 96, 288, 288]
    - [99, 0.318]
  - - [64, 128, 1, 512, 96, 96, 544, 544]
    - [107, 0.555]
  - - [64, 128, 1, 1024, 96, 96, 1056, 1056]
    - [84, 0.903]
  - - [64, 128, 1, 2048, 96, 96, 2080, 2080]
    - [98, 1.297]
  - - [64, 128, 1, 4096, 96, 96, 4128, 4128]
    - [88, 1.657]
  - - [64, 128, 1, 8192, 96, 96, 8224, 8224]
    - [92, 1.925]
  - - [64, 256, 1, 64, 96, 96, 96, 96]
    - [100, 0.178]
  - - [64, 256, 1, 128, 96, 96, 160, 160]
    - [5, 0.333]
  - - [64, 256, 1, 256, 96, 96, 288, 288]
    - [93, 0.638]
  - - [64, 256, 1, 512, 96, 96, 544, 544]
    - [107, 1.123]
  - - [64, 256, 1, 1024, 96, 96, 1056, 1056]
    - [92, 1.806]
  - - [64, 256, 1, 2048, 96, 96, 2080, 2080]
    - [107, 2.598]
  - - [64, 256, 1, 4096, 96, 96, 4128, 4128]
    - [84, 3.333]
  - - [64, 256, 1, 8192, 96, 96, 8224, 8224]
    - [93, 3.824]
  - - [64, 512, 1, 64, 96, 96, 96, 96]
    - [85, 0.356]
  - - [64, 512, 1, 128, 96, 96, 160, 160]
    - [101, 0.682]
  - - [64, 512, 1, 256, 96, 96, 288, 288]
    - [108, 1.282]
  - - [64, 512, 1, 512, 96, 96, 544, 544]
    - [98, 2.243]
  - - [64, 512, 1, 1024, 96, 96, 1056, 1056]
    - [106, 3.618]
  - - [64, 512, 1, 2048, 96, 96, 2080, 2080]
    - [101, 5.191]
  - - [64, 512, 1, 4096, 96, 96, 4128, 4128]
    - [92, 6.632]
  - - [64, 512, 1, 8192, 96, 96, 8224, 8224]
    - [84, 7.686]
  - - [64, 1024, 1, 64, 96, 96, 96, 96]
    - [95, 0.707]
  - - [64, 1024, 1, 128, 96, 96, 160, 160]
    - [101, 1.364]
  - - [64, 1024, 1, 256, 96, 96, 288, 288]
    - [107, 2.547]
  - - [64, 1024, 1, 512, 96, 96, 544, 544]
    - [108, 4.446]
  - - [64, 1024, 1, 1024, 96, 96, 1056, 1056]
    - [84, 7.193]
  - - [64, 1024, 1, 2048, 96, 96, 2080, 2080]
    - [107, 10.328]
  - - [64, 1024, 1, 4096, 96, 96, 4128, 4128]
    - [88, 13.187]
  - - [64, 1024, 1, 8192, 96, 96, 8224, 8224]
    - [85, 15.289]
  - - [64, 2048, 1, 64, 96, 96, 96, 96]
    - [139, 1.36]
  - - [64, 2048, 1, 128, 96, 96, 160, 160]
    - [83, 2.665]
  - - [64, 2048, 1, 256, 96, 96, 288, 288]
    - [83, 4.924]
  - - [64, 2048, 1, 512, 96, 96, 544, 544]
    - [99, 8.624]
  - - [64, 2048, 1, 1024, 96, 96, 1056, 1056]
    - [99, 13.497]
  - - [64, 2048, 1, 2048, 96, 96, 2080, 2080]
    - [89, 19.141]
  - - [64, 2048, 1, 4096, 96, 96, 4128, 4128]
    - [93, 23.995]
  - - [64, 2048, 1, 8192, 96, 96, 8224, 8224]
    - [99, 26.957]
  - - [64, 4096, 1, 64, 96, 96, 96, 96]
    - [23, 2.655]
  - - [64, 4096, 1, 128, 96, 96, 160, 160]
    - [114, 5.099]
  - - [64, 4096, 1, 256, 96, 96, 288, 288]
    - [115, 9.109]
  - - [64, 4096, 1, 512, 96, 96, 544, 544]
    - [126, 15.215]
  - - [64, 4096, 1, 1024, 96, 96, 1056, 1056]
    - [115, 22.748]
  - - [64, 4096, 1, 2048, 96, 96, 2080, 2080]
    - [127, 30.442]
  - - [64, 4096, 1, 4096, 96, 96, 4128, 4128]
    - [126, 36.492]
  - - [64, 4096, 1, 8192, 96, 96, 8224, 8224]
    - [132, 40.213]
  - - [64, 8192, 1, 64, 96, 96, 96, 96]
    - [143, 5.093]
  - - [64, 8192, 1, 128, 96, 96, 160, 160]
    - [138, 9.428]
  - - [64, 8192, 1, 256, 96, 96, 288, 288]
    - [130, 16.572]
  - - [64, 8192, 1, 512, 96, 96, 544, 544]
    - [136, 26.754]
  - - [64, 8192, 1, 1024, 96, 96, 1056, 1056]
    - [112, 38.514]
  - - [64, 8192, 1, 2048, 96, 96, 2080, 2080]
    - [140, 49.441]
  - - [64, 8192, 1, 4096, 96, 96, 4128, 4128]
    - [136, 56.161]
  - - [64, 8192, 1, 8192, 96, 96, 8224, 8224]
    - [142, 28.039]
  - - [128, 64, 1, 64, 160, 160, 96, 96]
    - [4, 0.09]
  - - [128, 64, 1, 128, 160, 160, 160, 160]
    - [99, 0.168]
  - - [128, 64, 1, 256, 160, 160, 288, 288]
    - [101, 0.314]
  - - [128, 64, 1, 512, 160, 160, 544, 544]
    - [83, 0.554]
  - - [128, 64, 1, 1024, 160, 160, 1056, 1056]
    - [102, 0.903]
  - - [128, 64, 1, 2048, 160, 160, 2080, 2080]
    - [102, 1.294]
  - - [128, 64, 1, 4096, 160, 160, 4128, 4128]
    - [102, 1.66]
  - - [128, 64, 1, 8192, 160, 160, 8224, 8224]
    - [97, 1.911]
  - - [128, 128, 1, 64, 160, 160, 96, 96]
    - [109, 0.178]
  - - [128, 128, 1, 128, 160, 160, 160, 160]
    - [106, 0.342]
  - - [128, 128, 1, 256, 160, 160, 288, 288]
    - [103, 0.637]
  - - [128, 128, 1, 512, 160, 160, 544, 544]
    - [107, 1.123]
  - - [128, 128, 1, 1024, 160, 160, 1056, 1056]
    - [98, 1.824]
  - - [128, 128, 1, 2048, 160, 160, 2080, 2080]
    - [102, 2.623]
  - - [128, 128, 1, 4096, 160, 160, 4128, 4128]
    - [92, 3.357]
  - - [128, 128, 1, 8192, 160, 160, 8224, 8224]
    - [98, 3.865]
  - - [128, 256, 1, 64, 160, 160, 96, 96]
    - [104, 0.355]
  - - [128, 256, 1, 128, 160, 160, 160, 160]
    - [84, 0.685]
  - - [128, 256, 1, 256, 160, 160, 288, 288]
    - [83, 1.274]
  - - [128, 256, 1, 512, 160, 160, 544, 544]
    - [102, 2.249]
  - - [128, 256, 1, 1024, 160, 160, 1056, 1056]
    - [88, 3.656]
  - - [128, 256, 1, 2048, 160, 160, 2080, 2080]
    - [102, 5.253]
  - - [128, 256, 1, 4096, 160, 160, 4128, 4128]
    - [84, 6.71]
  - - [128, 256, 1, 8192, 160, 160, 8224, 8224]
    - [85, 7.701]
  - - [128, 512, 1, 64, 160, 160, 96, 96]
    - [85, 0.709]
  - - [128, 512, 1, 128, 160, 160, 160, 160]
    - [89, 1.36]
  - - [128, 512, 1, 256, 160, 160, 288, 288]
    - [106, 2.528]
  - - [128, 512, 1, 512, 160, 160, 544, 544]
    - [106, 4.462]
  - - [128, 512, 1, 1024, 160, 160, 1056, 1056]
    - [92, 7.263]
  - - [128, 512, 1, 2048, 160, 160, 2080, 2080]
    - [84, 10.393]
  - - [128, 512, 1, 4096, 160, 160, 4128, 4128]
    - [84, 13.268]
  - - [128, 512, 1, 8192, 160, 160, 8224, 8224]
    - [99, 15.118]
  - - [128, 1024, 1, 64, 160, 160, 96, 96]
    - [107, 1.392]
  - - [128, 1024, 1, 128, 160, 160, 160, 160]
    - [102, 2.651]
  - - [128, 1024, 1, 256, 160, 160, 288, 288]
    - [99, 4.962]
  - - [128, 1024, 1, 512, 160, 160, 544, 544]
    - [85, 8.552]
  - - [128, 1024, 1, 1024, 160, 160, 1056, 1056]
    - [99, 11.994]
  - - [128, 1024, 1, 2048, 160, 160, 2080, 2080]
    - [108, 19.154]
  - - [128, 1024, 1, 4096, 160, 160, 4128, 4128]
    - [103, 24.107]
  - - [128, 1024, 1, 8192, 160, 160, 8224, 8224]
    - [103, 26.922]
  - - [128, 2048, 1, 64, 160, 160, 96, 96]
    - [130, 2.669]
  - - [128, 2048, 1, 128, 160, 160, 160, 160]
    - [134, 5.07]
  - - [128, 2048, 1, 256, 160, 160, 288, 288]
    - [127, 9.071]
  - - [128, 2048, 1, 512, 160, 160, 544, 544]
    - [114, 15.139]
  - - [128, 2048, 1, 1024, 160, 160, 1056, 1056]
    - [141, 22.546]
  - - [128, 2048, 1, 2048, 160, 160, 2080, 2080]
    - [114, 30.392]
  - - [128, 2048, 1, 4096, 160, 160, 4128, 4128]
    - [127, 36.344]
  - - [128, 2048, 1, 8192, 160, 160, 8224, 8224]
    - [113, 40.106]
  - - [128, 4096, 1, 64, 160, 160, 96, 96]
    - [127, 5.175]
  - - [128, 4096, 1, 128, 160, 160, 160, 160]
    - [20, 9.533]
  - - [128, 4096, 1, 256, 160, 160, 288, 288]
    - [112, 16.714]
  - - [128, 4096, 1, 512, 160, 160, 544, 544]
    - [112, 27.042]
  - - [128, 4096, 1, 1024, 160, 160, 1056, 1056]
    - [112, 38.79]
  - - [128, 4096, 1, 2048, 160, 160, 2080, 2080]
    - [112, 50.071]
  - - [128, 4096, 1, 4096, 160, 160, 4128, 4128]
    - [111, 56.531]
  - - [128, 4096, 1, 8192, 160, 160, 8224, 8224]
    - [130, 63.664]
  - - [128, 8192, 1, 64, 160, 160, 96, 96]
    - [11, 8.878]
  - - [128, 8192, 1, 128, 160, 160, 160, 160]
    - [17, 15.743]
  - - [128, 8192, 1, 256, 160, 160, 288, 288]
    - [12, 24.839]
  - - [128, 8192, 1, 512, 160, 160, 544, 544]
    - [13, 35.983]
  - - [128, 8192, 1, 1024, 160, 160, 1056, 1056]
    - [6, 44.469]
  - - [128, 8192, 1, 2048, 160, 160, 2080, 2080]
    - [123, 54.071]
  - - [128, 8192, 1, 4096, 160, 160, 4128, 4128]
    - [123, 57.371]
  - - [128, 8192, 1, 8192, 160, 160, 8224, 8224]
    - [131, 49.162]
  - - [256, 64, 1, 64, 288, 288, 96, 96]
    - [3, 0.181]
  - - [256, 64, 1, 128, 288, 288, 160, 160]
    - [101, 0.344]
  - - [256, 64, 1, 256, 288, 288, 288, 288]
    - [97, 0.635]
  - - [256, 64, 1, 512, 288, 288, 544, 544]
    - [92, 1.119]
  - - [256, 64, 1, 1024, 288, 288, 1056, 1056]
    - [102, 1.814]
  - - [256, 64, 1, 2048, 288, 288, 2080, 2080]
    - [88, 2.596]
  - - [256, 64, 1, 4096, 288, 288, 4128, 4128]
    - [107, 3.323]
  - - [256, 64, 1, 8192, 288, 288, 8224, 8224]
    - [92, 3.841]
  - - [256, 128, 1, 64, 288, 288, 96, 96]
    - [100, 0.359]
  - - [256, 128, 1, 128, 288, 288, 160, 160]
    - [98, 0.688]
  - - [256, 128, 1, 256, 288, 288, 288, 288]
    - [103, 1.281]
  - - [256, 128, 1, 512, 288, 288, 544, 544]
    - [106, 2.237]
  - - [256, 128, 1, 1024, 288, 288, 1056, 1056]
    - [106, 3.635]
  - - [256, 128, 1, 2048, 288, 288, 2080, 2080]
    - [98, 5.212]
  - - [256, 128, 1, 4096, 288, 288, 4128, 4128]
    - [92, 6.669]
  - - [256, 128, 1, 8192, 288, 288, 8224, 8224]
    - [98, 7.677]
  - - [256, 256, 1, 64, 288, 288, 96, 96]
    - [90, 0.708]
  - - [256, 256, 1, 128, 288, 288, 160, 160]
    - [99, 1.357]
  - - [256, 256, 1, 256, 288, 288, 288, 288]
    - [93, 2.549]
  - - [256, 256, 1, 512, 288, 288, 544, 544]
    - [89, 4.472]
  - - [256, 256, 1, 1024, 288, 288, 1056, 1056]
    - [91, 7.212]
  - - [256, 256, 1, 2048, 288, 288, 2080, 2080]
    - [102, 10.255]
  - - [256, 256, 1, 4096, 288, 288, 4128, 4128]
    - [88, 13.197]
  - - [256, 256, 1, 8192, 288, 288, 8224, 8224]
    - [98, 15.32]
  - - [256, 512, 1, 64, 288, 288, 96, 96]
    - [98, 1.395]
  - - [256, 512, 1, 128, 288, 288, 160, 160]
    - [85, 2.636]
  - - [256, 512, 1, 256, 288, 288, 288, 288]
    - [99, 4.912]
  - - [256, 512, 1, 512, 288, 288, 544, 544]
    - [93, 8.563]
  - - [256, 512, 1, 1024, 288, 288, 1056, 1056]
    - [99, 13.611]
  - - [256, 512, 1, 2048, 288, 288, 2080, 2080]
    - [89, 19.306]
  - - [256, 512, 1, 4096, 288, 288, 4128, 4128]
    - [85, 23.834]
  - - [256, 512, 1, 8192, 288, 288, 8224, 8224]
    - [89, 27.007]
  - - [256, 1024, 1, 64, 288, 288, 96, 96]
    - [93, 2.658]
  - - [256, 1024, 1, 128, 288, 288, 160, 160]
    - [138, 5.01]
  - - [256, 1024, 1, 256, 288, 288, 288, 288]
    - [141, 9.075]
  - - [256, 1024, 1, 512, 288, 288, 544, 544]
    - [138, 15.117]
  - - [256, 1024, 1, 1024, 288, 288, 1056, 1056]
    - [143, 22.739]
  - - [256, 1024, 1, 2048, 288, 288, 2080, 2080]
    - [115, 30.403]
  - - [256, 1024, 1, 4096, 288, 288, 4128, 4128]
    - [125, 35.985]
  - - [256, 1024, 1, 8192, 288, 288, 8224, 8224]
    - [114, 40.256]
  - - [256, 2048, 1, 64, 288, 288, 96, 96]
    - [15, 5.124]
  - - [256, 2048, 1, 128, 288, 288, 160, 160]
    - [10, 9.58]
  - - [256, 2048, 1, 256, 288, 288, 288, 288]
    - [112, 16.878]
  - - [256, 2048, 1, 512, 288, 288, 544, 544]
    - [130, 26.925]
  - - [256, 2048, 1, 1024, 288, 288, 1056, 1056]
    - [121, 38.781]
  - - [256, 2048, 1, 2048, 288, 288, 2080, 2080]
    - [130, 50.671]
  - - [256, 2048, 1, 4096, 288, 288, 4128, 4128]
    - [111, 57.795]
  - - [256, 2048, 1, 8192, 288, 288, 8224, 8224]
    - [121, 63.388]
  - - [256, 4096, 1, 64, 288, 288, 96, 96]
    - [115, 8.88]
  - - [256, 4096, 1, 128, 288, 288, 160, 160]
    - [21, 15.728]
  - - [256, 4096, 1, 256, 288, 288, 288, 288]
    - [8, 24.766]
  - - [256, 4096, 1, 512, 288, 288, 544, 544]
    - [7, 35.971]
  - - [256, 4096, 1, 1024, 288, 288, 1056, 1056]
    - [127, 44.209]
  - - [256, 4096, 1, 2048, 288, 288, 2080, 2080]
    - [12, 54.375]
  - - [256, 4096, 1, 4096, 288, 288, 4128, 4128]
    - [115, 57.401]
  - - [256, 4096, 1, 8192, 288, 288, 8224, 8224]
    - [127, 60.947]
  - - [256, 8192, 1, 64, 288, 288, 96, 96]
    - [25, 14.784]
  - - [256, 8192, 1, 128, 288, 288, 160, 160]
    - [119, 23.171]
  - - [256, 8192, 1, 256, 288, 288, 288, 288]
    - [42, 38.339]
  - - [256, 8192, 1, 512, 288, 288, 544, 544]
    - [78, 53.005]
  - - [256, 8192, 1, 1024, 288, 288, 1056, 1056]
    - [56, 64.293]
  - - [256, 8192, 1, 2048, 288, 288, 2080, 2080]
    - [48, 70.425]
  - - [256, 8192, 1, 4096, 288, 288, 4128, 4128]
    - [81, 72.341]
  - - [256, 8192, 1, 8192, 288, 288, 8224, 8224]
    - [81, 60.87]
  - - [384, 64, 1, 64, 416, 416, 96, 96]
    - [0, 0.273]
  - - [384, 64, 1, 128, 416, 416, 160, 160]
    - [92, 0.513]
  - - [384, 64, 1, 256, 416, 416, 288, 288]
    - [92, 0.954]
  - - [384, 64, 1, 512, 416, 416, 544, 544]
    - [98, 1.678]
  - - [384, 64, 1, 1024, 416, 416, 1056, 1056]
    - [92, 2.712]
  - - [384, 64, 1, 2048, 416, 416, 2080, 2080]
    - [102, 3.881]
  - - [384, 64, 1, 4096, 416, 416, 4128, 4128]
    - [87, 4.955]
  - - [384, 64, 1, 8192, 416, 416, 8224, 8224]
    - [87, 5.657]
  - - [384, 128, 1, 64, 416, 416, 96, 96]
    - [105, 0.531]
  - - [384, 128, 1, 128, 416, 416, 160, 160]
    - [108, 1.036]
  - - [384, 128, 1, 256, 416, 416, 288, 288]
    - [83, 1.923]
  - - [384, 128, 1, 512, 416, 416, 544, 544]
    - [101, 3.37]
  - - [384, 128, 1, 1024, 416, 416, 1056, 1056]
    - [99, 5.444]
  - - [384, 128, 1, 2048, 416, 416, 2080, 2080]
    - [92, 7.829]
  - - [384, 128, 1, 4096, 416, 416, 4128, 4128]
    - [88, 10.0]
  - - [384, 128, 1, 8192, 416, 416, 8224, 8224]
    - [92, 11.578]
  - - [384, 256, 1, 64, 416, 416, 96, 96]
    - [96, 1.058]
  - - [384, 256, 1, 128, 416, 416, 160, 160]
    - [98, 2.03]
  - - [384, 256, 1, 256, 416, 416, 288, 288]
    - [106, 3.794]
  - - [384, 256, 1, 512, 416, 416, 544, 544]
    - [92, 6.677]
  - - [384, 256, 1, 1024, 416, 416, 1056, 1056]
    - [88, 10.779]
  - - [384, 256, 1, 2048, 416, 416, 2080, 2080]
    - [87, 15.206]
  - - [384, 256, 1, 4096, 416, 416, 4128, 4128]
    - [98, 19.757]
  - - [384, 256, 1, 8192, 416, 416, 8224, 8224]
    - [84, 22.824]
  - - [384, 512, 1, 64, 416, 416, 96, 96]
    - [85, 2.054]
  - - [384, 512, 1, 128, 416, 416, 160, 160]
    - [134, 3.879]
  - - [384, 512, 1, 256, 416, 416, 288, 288]
    - [141, 7.047]
  - - [384, 512, 1, 512, 416, 416, 544, 544]
    - [103, 11.93]
  - - [384, 512, 1, 1024, 416, 416, 1056, 1056]
    - [99, 18.262]
  - - [384, 512, 1, 2048, 416, 416, 2080, 2080]
    - [93, 24.855]
  - - [384, 512, 1, 4096, 416, 416, 4128, 4128]
    - [99, 30.33]
  - - [384, 512, 1, 8192, 416, 416, 8224, 8224]
    - [85, 33.657]
  - - [384, 1024, 1, 64, 416, 416, 96, 96]
    - [6, 3.986]
  - - [384, 1024, 1, 128, 416, 416, 160, 160]
    - [123, 7.509]
  - - [384, 1024, 1, 256, 416, 416, 288, 288]
    - [114, 13.465]
  - - [384, 1024, 1, 512, 416, 416, 544, 544]
    - [134, 22.513]
  - - [384, 1024, 1, 1024, 416, 416, 1056, 1056]
    - [134, 33.72]
  - - [384, 1024, 1, 2048, 416, 416, 2080, 2080]
    - [134, 44.942]
  - - [384, 1024, 1, 4096, 416, 416, 4128, 4128]
    - [127, 53.104]
  - - [384, 1024, 1, 8192, 416, 416, 8224, 8224]
    - [138, 59.214]
  - - [384, 2048, 1, 64, 416, 416, 96, 96]
    - [24, 7.293]
  - - [384, 2048, 1, 128, 416, 416, 160, 160]
    - [6, 13.404]
  - - [384, 2048, 1, 256, 416, 416, 288, 288]
    - [134, 22.708]
  - - [384, 2048, 1, 512, 416, 416, 544, 544]
    - [144, 34.271]
  - - [384, 2048, 1, 1024, 416, 416, 1056, 1056]
    - [128, 46.042]
  - - [384, 2048, 1, 2048, 416, 416, 2080, 2080]
    - [118, 56.998]
  - - [384, 2048, 1, 4096, 416, 416, 4128, 4128]
    - [120, 65.397]
  - - [384, 2048, 1, 8192, 416, 416, 8224, 8224]
    - [130, 68.766]
  - - [384, 4096, 1, 64, 416, 416, 96, 96]
    - [115, 11.98]
  - - [384, 4096, 1, 128, 416, 416, 160, 160]
    - [54, 21.026]
  - - [384, 4096, 1, 256, 416, 416, 288, 288]
    - [34, 33.621]
  - - [384, 4096, 1, 512, 416, 416, 544, 544]
    - [65, 48.896]
  - - [384, 4096, 1, 1024, 416, 416, 1056, 1056]
    - [57, 63.204]
  - - [384, 4096, 1, 2048, 416, 416, 2080, 2080]
    - [42, 68.786]
  - - [384, 4096, 1, 4096, 416, 416, 4128, 4128]
    - [71, 71.707]
  - - [384, 4096, 1, 8192, 416, 416, 8224, 8224]
    - [71, 74.1]
  - - [384, 8192, 1, 64, 416, 416, 96, 96]
    - [52, 19.389]
  - - [384, 8192, 1, 128, 416, 416, 160, 160]
    - [52, 33.403]
  - - [384, 8192, 1, 256, 416, 416, 288, 288]
    - [46, 47.906]
  - - [384, 8192, 1, 512, 416, 416, 544, 544]
    - [46, 60.748]
  - - [384, 8192, 1, 1024, 416, 416, 1056, 1056]
    - [48, 71.452]
  - - [384, 8192, 1, 2048, 416, 416, 2080, 2080]
    - [68, 78.385]
  - - [384, 8192, 1, 4096, 416, 416, 4128, 4128]
    - [38, 84.021]
  - - [384, 8192, 1, 8192, 416, 416, 8224, 8224]
    - [55, 71.11]
  - - [768, 64, 1, 64, 800, 800, 96, 96]
    - [1, 0.538]
  - - [768, 64, 1, 128, 800, 800, 160, 160]
    - [106, 1.039]
  - - [768, 64, 1, 256, 800, 800, 288, 288]
    - [89, 1.902]
  - - [768, 64, 1, 512, 800, 800, 544, 544]
    - [98, 3.357]
  - - [768, 64, 1, 1024, 800, 800, 1056, 1056]
    - [88, 5.433]
  - - [768, 64, 1, 2048, 800, 800, 2080, 2080]
    - [106, 7.747]
  - - [768, 64, 1, 4096, 800, 800, 4128, 4128]
    - [88, 9.85]
  - - [768, 64, 1, 8192, 800, 800, 8224, 8224]
    - [102, 11.345]
  - - [768, 128, 1, 64, 800, 800, 96, 96]
    - [84, 1.056]
  - - [768, 128, 1, 128, 800, 800, 160, 160]
    - [2, 1.972]
  - - [768, 128, 1, 256, 800, 800, 288, 288]
    - [108, 3.79]
  - - [768, 128, 1, 512, 800, 800, 544, 544]
    - [106, 6.685]
  - - [768, 128, 1, 1024, 800, 800, 1056, 1056]
    - [98, 10.713]
  - - [768, 128, 1, 2048, 800, 800, 2080, 2080]
    - [98, 15.445]
  - - [768, 128, 1, 4096, 800, 800, 4128, 4128]
    - [85, 19.631]
  - - [768, 128, 1, 8192, 800, 800, 8224, 8224]
    - [84, 22.646]
  - - [768, 256, 1, 64, 800, 800, 96, 96]
    - [123, 2.067]
  - - [768, 256, 1, 128, 800, 800, 160, 160]
    - [83, 3.885]
  - - [768, 256, 1, 256, 800, 800, 288, 288]
    - [99, 7.047]
  - - [768, 256, 1, 512, 800, 800, 544, 544]
    - [93, 11.959]
  - - [768, 256, 1, 1024, 800, 800, 1056, 1056]
    - [93, 18.265]
  - - [768, 256, 1, 2048, 800, 800, 2080, 2080]
    - [85, 25.001]
  - - [768, 256, 1, 4096, 800, 800, 4128, 4128]
    - [99, 30.122]
  - - [768, 256, 1, 8192, 800, 800, 8224, 8224]
    - [85, 33.87]
  - - [768, 512, 1, 64, 800, 800, 96, 96]
    - [18, 3.989]
  - - [768, 512, 1, 128, 800, 800, 160, 160]
    - [141, 7.495]
  - - [768, 512, 1, 256, 800, 800, 288, 288]
    - [114, 13.56]
  - - [768, 512, 1, 512, 800, 800, 544, 544]
    - [114, 22.493]
  - - [768, 512, 1, 1024, 800, 800, 1056, 1056]
    - [134, 33.729]
  - - [768, 512, 1, 2048, 800, 800, 2080, 2080]
    - [134, 44.874]
  - - [768, 512, 1, 4096, 800, 800, 4128, 4128]
    - [127, 52.787]
  - - [768, 512, 1, 8192, 800, 800, 8224, 8224]
    - [137, 59.242]
  - - [768, 1024, 1, 64, 800, 800, 96, 96]
    - [21, 7.324]
  - - [768, 1024, 1, 128, 800, 800, 160, 160]
    - [19, 13.331]
  - - [768, 1024, 1, 256, 800, 800, 288, 288]
    - [134, 22.659]
  - - [768, 1024, 1, 512, 800, 800, 544, 544]
    - [115, 34.401]
  - - [768, 1024, 1, 1024, 800, 800, 1056, 1056]
    - [135, 47.585]
  - - [768, 1024, 1, 2048, 800, 800, 2080, 2080]
    - [117, 57.508]
  - - [768, 1024, 1, 4096, 800, 800, 4128, 4128]
    - [16, 66.693]
  - - [768, 1024, 1, 8192, 800, 800, 8224, 8224]
    - [130, 70.0]
  - - [768, 2048, 1, 64, 800, 800, 96, 96]
    - [66, 11.964]
  - - [768, 2048, 1, 128, 800, 800, 160, 160]
    - [79, 20.8]
  - - [768, 2048, 1, 256, 800, 800, 288, 288]
    - [73, 33.306]
  - - [768, 2048, 1, 512, 800, 800, 544, 544]
    - [65, 47.738]
  - - [768, 2048, 1, 1024, 800, 800, 1056, 1056]
    - [32, 63.264]
  - - [768, 2048, 1, 2048, 800, 800, 2080, 2080]
    - [47, 70.358]
  - - [768, 2048, 1, 4096, 800, 800, 4128, 4128]
    - [54, 74.917]
  - - [768, 2048, 1, 8192, 800, 800, 8224, 8224]
    - [49, 75.719]
  - - [768, 4096, 1, 64, 800, 800, 96, 96]
    - [46, 19.253]
  - - [768, 4096, 1, 128, 800, 800, 160, 160]
    - [52, 33.332]
  - - [768, 4096, 1, 256, 800, 800, 288, 288]
    - [33, 45.111]
  - - [768, 4096, 1, 512, 800, 800, 544, 544]
    - [76, 60.939]
  - - [768, 4096, 1, 1024, 800, 800, 1056, 1056]
    - [38, 72.522]
  - - [768, 4096, 1, 2048, 800, 800, 2080, 2080]
    - [80, 77.073]
  - - [768, 4096, 1, 4096, 800, 800, 4128, 4128]
    - [40, 82.476]
  - - [768, 4096, 1, 8192, 800, 800, 8224, 8224]
    - [72, 75.256]
  - - [768, 8192, 1, 64, 800, 800, 96, 96]
    - [46, 28.85]
  - - [768, 8192, 1, 128, 800, 800, 160, 160]
    - [62, 43.665]
  - - [768, 8192, 1, 256, 800, 800, 288, 288]
    - [42, 56.21]
  - - [768, 8192, 1, 512, 800, 800, 544, 544]
    - [70, 66.977]
  - - [768, 8192, 1, 1024, 800, 800, 1056, 1056]
    - [40, 72.142]
  - - [768, 8192, 1, 2048, 800, 800, 2080, 2080]
    - [61, 73.712]
  - - [768, 8192, 1, 4096, 800, 800, 4128, 4128]
    - [62, 71.055]
  - - [768, 8192, 1, 8192, 800, 800, 8224, 8224]
    - [30, 60.013]
  - - [1536, 64, 1, 64, 1568, 1568, 96, 96]
    - [0, 0.774]
  - - [1536, 64, 1, 128, 1568, 1568, 160, 160]
    - [91, 2.017]
  - - [1536, 64, 1, 256, 1568, 1568, 288, 288]
    - [89, 3.744]
  - - [1536, 64, 1, 512, 1568, 1568, 544, 544]
    - [98, 6.649]
  - - [1536, 64, 1, 1024, 1568, 1568, 1056, 1056]
    - [92, 10.706]
  - - [1536, 64, 1, 2048, 1568, 1568, 2080, 2080]
    - [84, 15.15]
  - - [1536, 64, 1, 4096, 1568, 1568, 4128, 4128]
    - [84, 19.397]
  - - [1536, 64, 1, 8192, 1568, 1568, 8224, 8224]
    - [98, 22.201]
  - - [1536, 128, 1, 64, 1568, 1568, 96, 96]
    - [124, 2.045]
  - - [1536, 128, 1, 128, 1568, 1568, 160, 160]
    - [141, 3.899]
  - - [1536, 128, 1, 256, 1568, 1568, 288, 288]
    - [122, 7.077]
  - - [1536, 128, 1, 512, 1568, 1568, 544, 544]
    - [143, 11.914]
  - - [1536, 128, 1, 1024, 1568, 1568, 1056, 1056]
    - [85, 18.34]
  - - [1536, 128, 1, 2048, 1568, 1568, 2080, 2080]
    - [99, 24.882]
  - - [1536, 128, 1, 4096, 1568, 1568, 4128, 4128]
    - [93, 29.736]
  - - [1536, 128, 1, 8192, 1568, 1568, 8224, 8224]
    - [89, 33.609]
  - - [1536, 256, 1, 64, 1568, 1568, 96, 96]
    - [114, 3.986]
  - - [1536, 256, 1, 128, 1568, 1568, 160, 160]
    - [126, 7.561]
  - - [1536, 256, 1, 256, 1568, 1568, 288, 288]
    - [141, 13.456]
  - - [1536, 256, 1, 512, 1568, 1568, 544, 544]
    - [132, 22.578]
  - - [1536, 256, 1, 1024, 1568, 1568, 1056, 1056]
    - [115, 33.729]
  - - [1536, 256, 1, 2048, 1568, 1568, 2080, 2080]
    - [134, 44.886]
  - - [1536, 256, 1, 4096, 1568, 1568, 4128, 4128]
    - [115, 52.948]
  - - [1536, 256, 1, 8192, 1568, 1568, 8224, 8224]
    - [115, 59.085]
  - - [1536, 512, 1, 64, 1568, 1568, 96, 96]
    - [19, 7.261]
  - - [1536, 512, 1, 128, 1568, 1568, 160, 160]
    - [10, 13.255]
  - - [1536, 512, 1, 256, 1568, 1568, 288, 288]
    - [6, 22.716]
  - - [1536, 512, 1, 512, 1568, 1568, 544, 544]
    - [116, 34.373]
  - - [1536, 512, 1, 1024, 1568, 1568, 1056, 1056]
    - [115, 47.118]
  - - [1536, 512, 1, 2048, 1568, 1568, 2080, 2080]
    - [6, 57.014]
  - - [1536, 512, 1, 4096, 1568, 1568, 4128, 4128]
    - [6, 65.723]
  - - [1536, 512, 1, 8192, 1568, 1568, 8224, 8224]
    - [111, 68.871]
  - - [1536, 1024, 1, 64, 1568, 1568, 96, 96]
    - [9, 11.785]
  - - [1536, 1024, 1, 128, 1568, 1568, 160, 160]
    - [42, 20.489]
  - - [1536, 1024, 1, 256, 1568, 1568, 288, 288]
    - [42, 33.074]
  - - [1536, 1024, 1, 512, 1568, 1568, 544, 544]
    - [42, 48.048]
  - - [1536, 1024, 1, 1024, 1568, 1568, 1056, 1056]
    - [62, 62.576]
  - - [1536, 1024, 1, 2048, 1568, 1568, 2080, 2080]
    - [41, 68.436]
  - - [1536, 1024, 1, 4096, 1568, 1568, 4128, 4128]
    - [43, 73.513]
  - - [1536, 1024, 1, 8192, 1568, 1568, 8224, 8224]
    - [56, 75.568]
  - - [1536, 2048, 1, 64, 1568, 1568, 96, 96]
    - [29, 19.297]
  - - [1536, 2048, 1, 128, 1568, 1568, 160, 160]
    - [77, 33.434]
  - - [1536, 2048, 1, 256, 1568, 1568, 288, 288]
    - [69, 46.903]
  - - [1536, 2048, 1, 512, 1568, 1568, 544, 544]
    - [73, 62.003]
  - - [1536, 2048, 1, 1024, 1568, 1568, 1056, 1056]
    - [42, 72.794]
  - - [1536, 2048, 1, 2048, 1568, 1568, 2080, 2080]
    - [68, 79.426]
  - - [1536, 2048, 1, 4096, 1568, 1568, 4128, 4128]
    - [67, 84.285]
  - - [1536, 2048, 1, 8192, 1568, 1568, 8224, 8224]
    - [37, 80.421]
  - - [1536, 4096, 1, 64, 1568, 1568, 96, 96]
    - [48, 29.65]
  - - [1536, 4096, 1, 128, 1568, 1568, 160, 160]
    - [51, 44.244]
  - - [1536, 4096, 1, 256, 1568, 1568, 288, 288]
    - [32, 55.811]
  - - [1536, 4096, 1, 512, 1568, 1568, 544, 544]
    - [32, 67.234]
  - - [1536, 4096, 1, 1024, 1568, 1568, 1056, 1056]
    - [29, 72.393]
  - - [1536, 4096, 1, 2048, 1568, 1568, 2080, 2080]
    - [38, 73.474]
  - - [1536, 4096, 1, 4096, 1568, 1568, 4128, 4128]
    - [27, 71.439]
  - - [1536, 4096, 1, 8192, 1568, 1568, 8224, 8224]
    - [42, 65.97]
  - - [1536, 8192, 1, 64, 1568, 1568, 96, 96]
    - [42, 39.61]
  - - [1536, 8192, 1, 128, 1568, 1568, 160, 160]
    - [32, 56.294]
  - - [1536, 8192, 1, 256, 1568, 1568, 288, 288]
    - [31, 64.951]
  - - [1536, 8192, 1, 512, 1568, 1568, 544, 544]
    - [31, 70.257]
  - - [1536, 8192, 1, 1024, 1568, 1568, 1056, 1056]
    - [41, 73.272]
  - - [1536, 8192, 1, 2048, 1568, 1568, 2080, 2080]
    - [58, 67.608]
  - - [1536, 8192, 1, 4096, 1568, 1568, 4128, 4128]
    - [31, 65.74]
  - - [1536, 8192, 1, 8192, 1568, 1568, 8224, 8224]
    - [32, 66.265]
  - - [3072, 64, 1, 64, 3104, 3104, 96, 96]
    - [88, 1.962]
  - - [3072, 64, 1, 128, 3104, 3104, 160, 160]
    - [94, 3.873]
  - - [3072, 64, 1, 256, 3104, 3104, 288, 288]
    - [103, 7.053]
  - - [3072, 64, 1, 512, 3104, 3104, 544, 544]
    - [134, 11.95]
  - - [3072, 64, 1, 1024, 3104, 3104, 1056, 1056]
    - [99, 18.345]
  - - [3072, 64, 1, 2048, 3104, 3104, 2080, 2080]
    - [85, 24.964]
  - - [3072, 64, 1, 4096, 3104, 3104, 4128, 4128]
    - [93, 29.248]
  - - [3072, 64, 1, 8192, 3104, 3104, 8224, 8224]
    - [85, 33.977]
  - - [3072, 128, 1, 64, 3104, 3104, 96, 96]
    - [14, 3.991]
  - - [3072, 128, 1, 128, 3104, 3104, 160, 160]
    - [127, 7.502]
  - - [3072, 128, 1, 256, 3104, 3104, 288, 288]
    - [132, 13.522]
  - - [3072, 128, 1, 512, 3104, 3104, 544, 544]
    - [115, 22.7]
  - - [3072, 128, 1, 1024, 3104, 3104, 1056, 1056]
    - [115, 33.761]
  - - [3072, 128, 1, 2048, 3104, 3104, 2080, 2080]
    - [114, 44.89]
  - - [3072, 128, 1, 4096, 3104, 3104, 4128, 4128]
    - [134, 52.751]
  - - [3072, 128, 1, 8192, 3104, 3104, 8224, 8224]
    - [133, 59.141]
  - - [3072, 256, 1, 64, 3104, 3104, 96, 96]
    - [16, 7.24]
  - - [3072, 256, 1, 128, 3104, 3104, 160, 160]
    - [20, 13.258]
  - - [3072, 256, 1, 256, 3104, 3104, 288, 288]
    - [118, 22.566]
  - - [3072, 256, 1, 512, 3104, 3104, 544, 544]
    - [22, 33.205]
  - - [3072, 256, 1, 1024, 3104, 3104, 1056, 1056]
    - [9, 44.715]
  - - [3072, 256, 1, 2048, 3104, 3104, 2080, 2080]
    - [6, 54.326]
  - - [3072, 256, 1, 4096, 3104, 3104, 4128, 4128]
    - [129, 64.278]
  - - [3072, 256, 1, 8192, 3104, 3104, 8224, 8224]
    - [111, 68.072]
  - - [3072, 512, 1, 64, 3104, 3104, 96, 96]
    - [134, 11.809]
  - - [3072, 512, 1, 128, 3104, 3104, 160, 160]
    - [64, 20.811]
  - - [3072, 512, 1, 256, 3104, 3104, 288, 288]
    - [35, 33.461]
  - - [3072, 512, 1, 512, 3104, 3104, 544, 544]
    - [66, 48.07]
  - - [3072, 512, 1, 1024, 3104, 3104, 1056, 1056]
    - [59, 61.654]
  - - [3072, 512, 1, 2048, 3104, 3104, 2080, 2080]
    - [42, 67.936]
  - - [3072, 512, 1, 4096, 3104, 3104, 4128, 4128]
    - [50, 73.793]
  - - [3072, 512, 1, 8192, 3104, 3104, 8224, 8224]
    - [81, 73.774]
  - - [3072, 1024, 1, 64, 3104, 3104, 96, 96]
    - [77, 19.327]
  - - [3072, 1024, 1, 128, 3104, 3104, 160, 160]
    - [52, 33.438]
  - - [3072, 1024, 1, 256, 3104, 3104, 288, 288]
    - [42, 48.319]
  - - [3072, 1024, 1, 512, 3104, 3104, 544, 544]
    - [41, 63.925]
  - - [3072, 1024, 1, 1024, 3104, 3104, 1056, 1056]
    - [68, 72.644]
  - - [3072, 1024, 1, 2048, 3104, 3104, 2080, 2080]
    - [42, 79.373]
  - - [3072, 1024, 1, 4096, 3104, 3104, 4128, 4128]
    - [42, 85.446]
  - - [3072, 1024, 1, 8192, 3104, 3104, 8224, 8224]
    - [37, 75.388]
  - - [3072, 2048, 1, 64, 3104, 3104, 96, 96]
    - [48, 29.477]
  - - [3072, 2048, 1, 128, 3104, 3104, 160, 160]
    - [52, 42.534]
  - - [3072, 2048, 1, 256, 3104, 3104, 288, 288]
    - [42, 56.455]
  - - [3072, 2048, 1, 512, 3104, 3104, 544, 544]
    - [42, 66.066]
  - - [3072, 2048, 1, 1024, 3104, 3104, 1056, 1056]
    - [32, 71.012]
  - - [3072, 2048, 1, 2048, 3104, 3104, 2080, 2080]
    - [28, 78.353]
  - - [3072, 2048, 1, 4096, 3104, 3104, 4128, 4128]
    - [28, 73.239]
  - - [3072, 2048, 1, 8192, 3104, 3104, 8224, 8224]
    - [32, 66.324]
  - - [3072, 4096, 1, 64, 3104, 3104, 96, 96]
    - [46, 40.339]
  - - [3072, 4096, 1, 128, 3104, 3104, 160, 160]
    - [31, 53.484]
  - - [3072, 4096, 1, 256, 3104, 3104, 288, 288]
    - [32, 64.88]
  - - [3072, 4096, 1, 512, 3104, 3104, 544, 544]
    - [32, 69.917]
  - - [3072, 4096, 1, 1024, 3104, 3104, 1056, 1056]
    - [32, 75.056]
  - - [3072, 4096, 1, 2048, 3104, 3104, 2080, 2080]
    - [39, 68.942]
  - - [3072, 4096, 1, 4096, 3104, 3104, 4128, 4128]
    - [32, 69.522]
  - - [3072, 4096, 1, 8192, 3104, 3104, 8224, 8224]
    - [32, 67.571]
  - - [3072, 8192, 1, 64, 3104, 3104, 96, 96]
    - [42, 48.709]
  - - [3072, 8192, 1, 128, 3104, 3104, 160, 160]
    - [32, 62.329]
  - - [3072, 8192, 1, 256, 3104, 3104, 288, 288]
    - [31, 69.394]
  - - [3072, 8192, 1, 512, 3104, 3104, 544, 544]
    - [60, 73.543]
  - - [3072, 8192, 1, 1024, 3104, 3104, 1056, 1056]
    - [74, 67.336]
  - - [3072, 8192, 1, 2048, 3104, 3104, 2080, 2080]
    - [39, 66.971]
  - - [3072, 8192, 1, 4096, 3104, 3104, 4128, 4128]
    - [40, 67.937]
  - - [3072, 8192, 1, 8192, 3104, 3104, 8224, 8224]
    - [32, 68.646]
  - - [6144, 64, 1, 64, 6176, 6176, 96, 96]
    - [114, 3.784]
  - - [6144, 64, 1, 128, 6176, 6176, 160, 160]
    - [126, 7.516]
  - - [6144, 64, 1, 256, 6176, 6176, 288, 288]
    - [143, 13.405]
  - - [6144, 64, 1, 512, 6176, 6176, 544, 544]
    - [143, 22.334]
  - - [6144, 64, 1, 1024, 6176, 6176, 1056, 1056]
    - [114, 33.711]
  - - [6144, 64, 1, 2048, 6176, 6176, 2080, 2080]
    - [114, 44.974]
  - - [6144, 64, 1, 4096, 6176, 6176, 4128, 4128]
    - [133, 52.559]
  - - [6144, 64, 1, 8192, 6176, 6176, 8224, 8224]
    - [134, 48.531]
  - - [6144, 128, 1, 64, 6176, 6176, 96, 96]
    - [6, 7.034]
  - - [6144, 128, 1, 128, 6176, 6176, 160, 160]
    - [127, 13.362]
  - - [6144, 128, 1, 256, 6176, 6176, 288, 288]
    - [115, 22.712]
  - - [6144, 128, 1, 512, 6176, 6176, 544, 544]
    - [16, 33.407]
  - - [6144, 128, 1, 1024, 6176, 6176, 1056, 1056]
    - [118, 45.22]
  - - [6144, 128, 1, 2048, 6176, 6176, 2080, 2080]
    - [110, 54.338]
  - - [6144, 128, 1, 4096, 6176, 6176, 4128, 4128]
    - [129, 64.263]
  - - [6144, 128, 1, 8192, 6176, 6176, 8224, 8224]
    - [134, 66.135]
  - - [6144, 256, 1, 64, 6176, 6176, 96, 96]
    - [123, 12.269]
  - - [6144, 256, 1, 128, 6176, 6176, 160, 160]
    - [63, 21.246]
  - - [6144, 256, 1, 256, 6176, 6176, 288, 288]
    - [48, 33.748]
  - - [6144, 256, 1, 512, 6176, 6176, 544, 544]
    - [73, 48.043]
  - - [6144, 256, 1, 1024, 6176, 6176, 1056, 1056]
    - [59, 61.485]
  - - [6144, 256, 1, 2048, 6176, 6176, 2080, 2080]
    - [53, 70.368]
  - - [6144, 256, 1, 4096, 6176, 6176, 4128, 4128]
    - [44, 73.038]
  - - [6144, 256, 1, 8192, 6176, 6176, 8224, 8224]
    - [130, 64.152]
  - - [6144, 512, 1, 64, 6176, 6176, 96, 96]
    - [127, 19.136]
  - - [6144, 512, 1, 128, 6176, 6176, 160, 160]
    - [32, 33.284]
  - - [6144, 512, 1, 256, 6176, 6176, 288, 288]
    - [64, 44.906]
  - - [6144, 512, 1, 512, 6176, 6176, 544, 544]
    - [82, 59.065]
  - - [6144, 512, 1, 1024, 6176, 6176, 1056, 1056]
    - [68, 72.169]
  - - [6144, 512, 1, 2048, 6176, 6176, 2080, 2080]
    - [68, 77.369]
  - - [6144, 512, 1, 4096, 6176, 6176, 4128, 4128]
    - [36, 84.197]
  - - [6144, 512, 1, 8192, 6176, 6176, 8224, 8224]
    - [40, 66.213]
  - - [6144, 1024, 1, 64, 6176, 6176, 96, 96]
    - [48, 29.046]
  - - [6144, 1024, 1, 128, 6176, 6176, 160, 160]
    - [62, 43.19]
  - - [6144, 1024, 1, 256, 6176, 6176, 288, 288]
    - [32, 56.019]
  - - [6144, 1024, 1, 512, 6176, 6176, 544, 544]
    - [73, 66.126]
  - - [6144, 1024, 1, 1024, 6176, 6176, 1056, 1056]
    - [31, 72.736]
  - - [6144, 1024, 1, 2048, 6176, 6176, 2080, 2080]
    - [61, 77.887]
  - - [6144, 1024, 1, 4096, 6176, 6176, 4128, 4128]
    - [62, 69.787]
  - - [6144, 1024, 1, 8192, 6176, 6176, 8224, 8224]
    - [75, 61.728]
  - - [6144, 2048, 1, 64, 6176, 6176, 96, 96]
    - [73, 37.067]
  - - [6144, 2048, 1, 128, 6176, 6176, 160, 160]
    - [62, 52.751]
  - - [6144, 2048, 1, 256, 6176, 6176, 288, 288]
    - [31, 63.381]
  - - [6144, 2048, 1, 512, 6176, 6176, 544, 544]
    - [30, 67.887]
  - - [6144, 2048, 1, 1024, 6176, 6176, 1056, 1056]
    - [26, 73.623]
  - - [6144, 2048, 1, 2048, 6176, 6176, 2080, 2080]
    - [57, 66.676]
  - - [6144, 2048, 1, 4096, 6176, 6176, 4128, 4128]
    - [32, 67.631]
  - - [6144, 2048, 1, 8192, 6176, 6176, 8224, 8224]
    - [62, 63.109]
  - - [6144, 4096, 1, 64, 6176, 6176, 96, 96]
    - [48, 46.673]
  - - [6144, 4096, 1, 128, 6176, 6176, 160, 160]
    - [62, 62.15]
  - - [6144, 4096, 1, 256, 6176, 6176, 288, 288]
    - [31, 68.63]
  - - [6144, 4096, 1, 512, 6176, 6176, 544, 544]
    - [45, 70.923]
  - - [6144, 4096, 1, 1024, 6176, 6176, 1056, 1056]
    - [28, 66.64]
  - - [6144, 4096, 1, 2048, 6176, 6176, 2080, 2080]
    - [62, 67.087]
  - - [6144, 4096, 1, 4096, 6176, 6176, 4128, 4128]
    - [29, 68.756]
  - - [6144, 4096, 1, 8192, 6176, 6176, 8224, 8224]
    - [62, 65.369]
  - - [6144, 8192, 1, 64, 6176, 6176, 96, 96]
    - [82, 48.221]
  - - [6144, 8192, 1, 128, 6176, 6176, 160, 160]
    - [59, 64.385]
  - - [6144, 8192, 1, 256, 6176, 6176, 288, 288]
    - [62, 69.363]
  - - [6144, 8192, 1, 512, 6176, 6176, 544, 544]
    - [51, 62.407]
  - - [6144, 8192, 1, 1024, 6176, 6176, 1056, 1056]
    - [62, 64.185]
  - - [6144, 8192, 1, 2048, 6176, 6176, 2080, 2080]
    - [62, 67.3]
  - - [6144, 8192, 1, 4096, 6176, 6176, 4128, 4128]
    - [39, 69.057]
  - - [6144, 8192, 1, 8192, 6176, 6176, 8224, 8224]
    - [70, 67.89]
- null
- null
- DeviceEfficiency
