library/src/blas3/Tensile/Logic/asm_full/navi31/navi31_Cijk_Ailk_Bjlk_HB_GB.yaml
- {MinimumRequiredVersion: 4.35.0}
- navi31
- gfx1100
- [Device 73bf]
    SolutionIndex: 0
    SolutionNameMin: Cijk_Ailk_Bjlk_HB_MT32x32x16_MI16x16x16x1_SN_1LDSB0_AMAS0_GRVW8_IU1_NLCA1_NLCB1_SIA1_SU0_SUS0_SVW1_TT1_16_VW1_WGM4
    SolutionIndex: 1
    SolutionNameMin: Cijk_Ailk_Bjlk_HB_MT32x32x16_MI16x16x16x1_SN_1LDSB1_AMAS0_GRVW2_IU1_NLCA1_NLCB1_SIA2_SU0_SUS0_SVW1_TT1_16_VW1_WGM4
    SolutionIndex: 2
    SolutionNameMin: Cijk_Ailk_Bjlk_HB_MT32x32x16_MI16x16x16x1_SN_1LDSB1_AMAS0_GRVW4_IU1_NLCA1_NLCB1_SIA2_SU0_SUS0_SVW1_TT1_16_VW1_WGM4
    SolutionIndex: 3
    SolutionNameMin: Cijk_Ailk_Bjlk_HB_MT32x32x16_MI16x16x16x1_SN_1LDSB1_AMAS0_GRVW8_IU1_NLCA1_NLCB1_SIA2_SU0_SUS0_SVW1_TT1_16_VW1_WGM4
    SolutionIndex: 4
    SolutionNameMin: Cijk_Ailk_Bjlk_HB_MT64x64x16_MI16x16x16x1_SN_1LDSB0_AMAS3_GRVW8_IU1_NLCA1_NLCB1_SIA1_SU0_SUS0_SVW2_TT2_32_VW2_WGM4
    SolutionIndex: 5
    SolutionNameMin: Cijk_Ailk_Bjlk_HB_MT64x64x16_MI16x16x16x1_SN_1LDSB1_AMAS0_GRVW8_IU1_NLCA1_NLCB1_SIA2_SU0_SUS0_SVW1_TT2_32_VW1_WGM4
    SolutionIndex: 6
    SolutionNameMin: Cijk_Ailk_Bjlk_HB_MT64x64x16_MI16x16x16x1_SN_1LDSB1_AMAS3_GRVW8_IU1_NLCA1_NLCB1_SIA2_SU0_SUS0_SVW2_TT2_32_VW2_WGM4
    SolutionIndex: 7
    SolutionNameMin: Cijk_Ailk_Bjlk_HB_MT64x64x16_MI16x16x16x1_SN_1LDSB0_AMAS3_GRVW8_IU1_NLCA1_NLCB1_SIA1_SU32_SUS256_SVW2_TT2_32_VW2_WGM4
    SolutionIndex: 8
    SolutionNameMin: Cijk_Ailk_Bjlk_HB_MT64x64x16_MI16x16x16x1_SN_1LDSB0_AMAS3_GRVW4_IU1_NLCA1_NLCB1_SIA1_SU0_SUS0_SVW2_TT2_32_VW2_WGM8
    SolutionIndex: 9
    SolutionNameMin: Cijk_Ailk_Bjlk_HB_MT64x64x16_MI16x16x16x1_SN_1LDSB0_AMAS3_GRVW8_IU1_NLCA1_NLCB1_SIA1_SU0_SUS0_SVW2_TT2_32_VW2_WGM8
    SolutionIndex: 10
    SolutionNameMin: Cijk_Ailk_Bjlk_HB_MT64x64x16_MI16x16x16x1_SN_1LDSB1_AMAS0_GRVW4_IU1_NLCA1_NLCB1_SIA2_SU0_SUS0_SVW1_TT2_32_VW1_WGM8
    SolutionIndex: 11
    SolutionNameMin: Cijk_Ailk_Bjlk_HB_MT64x64x16_MI16x16x16x1_SN_1LDSB1_AMAS3_GRVW4_IU1_NLCA1_NLCB1_SIA2_SU0_SUS0_SVW2_TT2_32_VW2_WGM8
    SolutionIndex: 12
    SolutionNameMin: Cijk_Ailk_Bjlk_HB_MT64x64x16_MI16x16x16x1_SN_1LDSB1_AMAS3_GRVW8_IU1_NLCA1_NLCB1_SIA2_SU32_SUS128_SVW2_TT2_32_VW2_WGM8
    SolutionIndex: 13
    SolutionNameMin: Cijk_Ailk_Bjlk_HB_MT128x128x16_MI16x16x16x1_SN_1LDSB0_AMAS0_GRVW2_IU1_NLCA2_NLCB2_SIA1_SU0_SUS0_SVW1_TT4_64_VW1_WGM4
    SolutionIndex: 14
    SolutionNameMin: Cijk_Ailk_Bjlk_HB_MT128x128x16_MI16x16x16x1_SN_1LDSB0_AMAS3_GRVW2_IU1_NLCA2_NLCB2_SIA1_SU0_SUS0_SVW2_TT4_64_VW2_WGM4
    SolutionIndex: 15
    SolutionNameMin: Cijk_Ailk_Bjlk_HB_MT128x128x16_MI16x16x16x1_SN_1LDSB0_AMAS0_GRVW4_IU1_NLCA1_NLCB1_SIA1_SU0_SUS0_SVW1_TT4_64_VW1_WGM4
    SolutionIndex: 16
    SolutionNameMin: Cijk_Ailk_Bjlk_HB_MT128x128x16_MI16x16x16x1_SN_1LDSB0_AMAS3_GRVW4_IU1_NLCA1_NLCB1_SIA1_SU0_SUS0_SVW2_TT4_64_VW2_WGM4
    SolutionIndex: 17
    SolutionNameMin: Cijk_Ailk_Bjlk_HB_MT128x128x16_MI16x16x16x1_SN_1LDSB0_AMAS0_GRVW8_IU1_NLCA1_NLCB1_SIA1_SU0_SUS0_SVW1_TT4_64_VW1_WGM4
    SolutionIndex: 18
    SolutionNameMin: Cijk_Ailk_Bjlk_HB_MT128x128x16_MI16x16x16x1_SN_1LDSB0_AMAS3_GRVW8_IU1_NLCA1_NLCB1_SIA1_SU0_SUS0_SVW2_TT4_64_VW2_WGM4
    SolutionIndex: 19
    SolutionNameMin: Cijk_Ailk_Bjlk_HB_MT128x128x16_MI16x16x16x1_SN_1LDSB1_AMAS3_GRVW2_IU1_NLCA2_NLCB2_SIA2_SU0_SUS0_SVW2_TT4_64_VW2_WGM4
    SolutionIndex: 20
    SolutionNameMin: Cijk_Ailk_Bjlk_HB_MT128x128x16_MI16x16x16x1_SN_1LDSB1_AMAS0_GRVW4_IU1_NLCA1_NLCB1_SIA2_SU0_SUS0_SVW1_TT4_64_VW1_WGM4
    SolutionIndex: 21
    SolutionNameMin: Cijk_Ailk_Bjlk_HB_MT128x128x16_MI16x16x16x1_SN_1LDSB1_AMAS3_GRVW4_IU1_NLCA1_NLCB1_SIA2_SU0_SUS0_SVW2_TT4_64_VW2_WGM4
    SolutionIndex: 22
    SolutionNameMin: Cijk_Ailk_Bjlk_HB_MT128x128x16_MI16x16x16x1_SN_1LDSB1_AMAS3_GRVW8_IU1_NLCA1_NLCB1_SIA2_SU0_SUS0_SVW2_TT4_64_VW2_WGM4
    SolutionIndex: 23
    SolutionNameMin: Cijk_Ailk_Bjlk_HB_MT128x128x16_MI16x16x16x1_SN_1LDSB0_AMAS3_GRVW8_IU1_NLCA1_NLCB1_SIA3_SU0_SUS0_SVW2_TT4_64_VW2_WGM4
    SolutionIndex: 24
    SolutionNameMin: Cijk_Ailk_Bjlk_HB_MT128x128x16_MI16x16x16x1_SN_1LDSB0_AMAS0_GRVW4_IU1_NLCA1_NLCB1_SIA1_SU32_SUS128_SVW1_TT4_64_VW1_WGM4
    SolutionIndex: 25
    SolutionNameMin: Cijk_Ailk_Bjlk_HB_MT128x128x16_MI16x16x16x1_SN_1LDSB0_AMAS3_GRVW4_IU1_NLCA1_NLCB1_SIA1_SU32_SUS128_SVW2_TT4_64_VW2_WGM4
    SolutionIndex: 26
    SolutionNameMin: Cijk_Ailk_Bjlk_HB_MT128x128x16_MI16x16x16x1_SN_1LDSB0_AMAS0_GRVW8_IU1_NLCA1_NLCB1_SIA1_SU32_SUS128_SVW1_TT4_64_VW1_WGM4
    SolutionIndex: 27
    SolutionNameMin: Cijk_Ailk_Bjlk_HB_MT128x128x16_MI16x16x16x1_SN_1LDSB0_AMAS3_GRVW8_IU1_NLCA1_NLCB1_SIA1_SU32_SUS128_SVW2_TT4_64_VW2_WGM4
    SolutionIndex: 28
    SolutionNameMin: Cijk_Ailk_Bjlk_HB_MT128x128x16_MI16x16x16x1_SN_1LDSB1_AMAS3_GRVW2_IU1_NLCA2_NLCB2_SIA2_SU32_SUS128_SVW2_TT4_64_VW2_WGM4
    SolutionIndex: 29
    SolutionNameMin: Cijk_Ailk_Bjlk_HB_MT128x128x16_MI16x16x16x1_SN_1LDSB1_AMAS3_GRVW4_IU1_NLCA1_NLCB1_SIA2_SU32_SUS128_SVW2_TT4_64_VW2_WGM4
    SolutionIndex: 30
    SolutionNameMin: Cijk_Ailk_Bjlk_HB_MT128x128x16_MI16x16x16x1_SN_1LDSB0_AMAS3_GRVW8_IU1_NLCA1_NLCB1_SIA3_SU32_SUS128_SVW2_TT4_64_VW2_WGM4
    SolutionIndex: 31
    SolutionNameMin: Cijk_Ailk_Bjlk_HB_MT128x128x16_MI16x16x16x1_SN_1LDSB0_AMAS0_GRVW4_IU1_NLCA1_NLCB1_SIA1_SU32_SUS256_SVW1_TT4_64_VW1_WGM4
    SolutionIndex: 32
    SolutionNameMin: Cijk_Ailk_Bjlk_HB_MT128x128x16_MI16x16x16x1_SN_1LDSB0_AMAS3_GRVW4_IU1_NLCA1_NLCB1_SIA1_SU32_SUS256_SVW2_TT4_64_VW2_WGM4
    SolutionIndex: 33
    SolutionNameMin: Cijk_Ailk_Bjlk_HB_MT128x128x16_MI16x16x16x1_SN_1LDSB0_AMAS0_GRVW8_IU1_NLCA1_NLCB1_SIA1_SU32_SUS256_SVW1_TT4_64_VW1_WGM4
    SolutionIndex: 34
    SolutionNameMin: Cijk_Ailk_Bjlk_HB_MT128x128x16_MI16x16x16x1_SN_1LDSB0_AMAS3_GRVW8_IU1_NLCA1_NLCB1_SIA1_SU32_SUS256_SVW2_TT4_64_VW2_WGM4
    SolutionIndex: 35
    SolutionNameMin: Cijk_Ailk_Bjlk_HB_MT128x128x16_MI16x16x16x1_SN_1LDSB1_AMAS3_GRVW2_IU1_NLCA2_NLCB2_SIA2_SU32_SUS256_SVW2_TT4_64_VW2_WGM4
    SolutionIndex: 36
    SolutionNameMin: Cijk_Ailk_Bjlk_HB_MT128x128x16_MI16x16x16x1_SN_1LDSB1_AMAS0_GRVW4_IU1_NLCA1_NLCB1_SIA2_SU32_SUS256_SVW1_TT4_64_VW1_WGM4
    SolutionIndex: 37
    SolutionNameMin: Cijk_Ailk_Bjlk_HB_MT128x128x16_MI16x16x16x1_SN_1LDSB1_AMAS3_GRVW4_IU1_NLCA1_NLCB1_SIA2_SU32_SUS256_SVW2_TT4_64_VW2_WGM4
    SolutionIndex: 38
    SolutionNameMin: Cijk_Ailk_Bjlk_HB_MT128x128x16_MI16x16x16x1_SN_1LDSB1_AMAS3_GRVW8_IU1_NLCA1_NLCB1_SIA2_SU32_SUS256_SVW2_TT4_64_VW2_WGM4
    SolutionIndex: 39
    SolutionNameMin: Cijk_Ailk_Bjlk_HB_MT128x128x16_MI16x16x16x1_SN_1LDSB0_AMAS3_GRVW8_IU1_NLCA1_NLCB1_SIA3_SU32_SUS256_SVW2_TT4_64_VW2_WGM4
    SolutionIndex: 40
    SolutionNameMin: Cijk_Ailk_Bjlk_HB_MT128x128x16_MI16x16x16x1_SN_1LDSB0_AMAS0_GRVW2_IU1_NLCA2_NLCB2_SIA1_SU0_SUS0_SVW1_TT4_64_VW1_WGM8
    SolutionIndex: 41
    SolutionNameMin: Cijk_Ailk_Bjlk_HB_MT128x128x16_MI16x16x16x1_SN_1LDSB0_AMAS3_GRVW2_IU1_NLCA2_NLCB2_SIA1_SU0_SUS0_SVW2_TT4_64_VW2_WGM8
    SolutionIndex: 42
    SolutionNameMin: Cijk_Ailk_Bjlk_HB_MT128x128x16_MI16x16x16x1_SN_1LDSB0_AMAS0_GRVW4_IU1_NLCA1_NLCB1_SIA1_SU0_SUS0_SVW1_TT4_64_VW1_WGM8
    SolutionIndex: 43
    SolutionNameMin: Cijk_Ailk_Bjlk_HB_MT128x128x16_MI16x16x16x1_SN_1LDSB0_AMAS3_GRVW4_IU1_NLCA1_NLCB1_SIA1_SU0_SUS0_SVW2_TT4_64_VW2_WGM8
    SolutionIndex: 44
    SolutionNameMin: Cijk_Ailk_Bjlk_HB_MT128x128x16_MI16x16x16x1_SN_1LDSB0_AMAS0_GRVW8_IU1_NLCA1_NLCB1_SIA1_SU0_SUS0_SVW1_TT4_64_VW1_WGM8
    SolutionIndex: 45
    SolutionNameMin: Cijk_Ailk_Bjlk_HB_MT128x128x16_MI16x16x16x1_SN_1LDSB0_AMAS3_GRVW8_IU1_NLCA1_NLCB1_SIA1_SU0_SUS0_SVW2_TT4_64_VW2_WGM8
    SolutionIndex: 46
    SolutionNameMin: Cijk_Ailk_Bjlk_HB_MT128x128x16_MI16x16x16x1_SN_1LDSB1_AMAS3_GRVW2_IU1_NLCA2_NLCB2_SIA2_SU0_SUS0_SVW2_TT4_64_VW2_WGM8
    SolutionIndex: 47
    SolutionNameMin: Cijk_Ailk_Bjlk_HB_MT128x128x16_MI16x16x16x1_SN_1LDSB1_AMAS0_GRVW4_IU1_NLCA1_NLCB1_SIA2_SU0_SUS0_SVW1_TT4_64_VW1_WGM8
    SolutionIndex: 48
    SolutionNameMin: Cijk_Ailk_Bjlk_HB_MT128x128x16_MI16x16x16x1_SN_1LDSB1_AMAS3_GRVW4_IU1_NLCA1_NLCB1_SIA2_SU0_SUS0_SVW2_TT4_64_VW2_WGM8
    SolutionIndex: 49
    SolutionNameMin: Cijk_Ailk_Bjlk_HB_MT128x128x16_MI16x16x16x1_SN_1LDSB1_AMAS0_GRVW8_IU1_NLCA1_NLCB1_SIA2_SU0_SUS0_SVW1_TT4_64_VW1_WGM8
    SolutionIndex: 50
    SolutionNameMin: Cijk_Ailk_Bjlk_HB_MT128x128x16_MI16x16x16x1_SN_1LDSB0_AMAS3_GRVW8_IU1_NLCA1_NLCB1_SIA3_SU0_SUS0_SVW2_TT4_64_VW2_WGM8
    SolutionIndex: 51
    SolutionNameMin: Cijk_Ailk_Bjlk_HB_MT128x128x16_MI16x16x16x1_SN_1LDSB0_AMAS0_GRVW2_IU1_NLCA2_NLCB2_SIA1_SU32_SUS128_SVW1_TT4_64_VW1_WGM8
    SolutionIndex: 52
    SolutionNameMin: Cijk_Ailk_Bjlk_HB_MT128x128x16_MI16x16x16x1_SN_1LDSB0_AMAS0_GRVW8_IU1_NLCA1_NLCB1_SIA1_SU32_SUS128_SVW1_TT4_64_VW1_WGM8
    SolutionIndex: 53
    SolutionNameMin: Cijk_Ailk_Bjlk_HB_MT128x128x16_MI16x16x16x1_SN_1LDSB0_AMAS3_GRVW8_IU1_NLCA1_NLCB1_SIA1_SU32_SUS128_SVW2_TT4_64_VW2_WGM8
    SolutionIndex: 54
    SolutionNameMin: Cijk_Ailk_Bjlk_HB_MT128x128x16_MI16x16x16x1_SN_1LDSB1_AMAS3_GRVW4_IU1_NLCA1_NLCB1_SIA2_SU32_SUS128_SVW2_TT4_64_VW2_WGM8
    SolutionIndex: 55
    SolutionNameMin: Cijk_Ailk_Bjlk_HB_MT128x128x16_MI16x16x16x1_SN_1LDSB0_AMAS3_GRVW2_IU1_NLCA2_NLCB2_SIA1_SU32_SUS256_SVW2_TT4_64_VW2_WGM8
    SolutionIndex: 56
    SolutionNameMin: Cijk_Ailk_Bjlk_HB_MT128x128x16_MI16x16x16x1_SN_1LDSB0_AMAS0_GRVW4_IU1_NLCA1_NLCB1_SIA1_SU32_SUS256_SVW1_TT4_64_VW1_WGM8
    SolutionIndex: 57
    SolutionNameMin: Cijk_Ailk_Bjlk_HB_MT128x128x16_MI16x16x16x1_SN_1LDSB0_AMAS3_GRVW4_IU1_NLCA1_NLCB1_SIA1_SU32_SUS256_SVW2_TT4_64_VW2_WGM8
    SolutionIndex: 58
    SolutionNameMin: Cijk_Ailk_Bjlk_HB_MT128x128x16_MI16x16x16x1_SN_1LDSB0_AMAS0_GRVW8_IU1_NLCA1_NLCB1_SIA1_SU32_SUS256_SVW1_TT4_64_VW1_WGM8
    SolutionIndex: 59
    SolutionNameMin: Cijk_Ailk_Bjlk_HB_MT128x128x16_MI16x16x16x1_SN_1LDSB0_AMAS3_GRVW8_IU1_NLCA1_NLCB1_SIA1_SU32_SUS256_SVW2_TT4_64_VW2_WGM8
    SolutionIndex: 60
    SolutionNameMin: Cijk_Ailk_Bjlk_HB_MT128x128x16_MI16x16x16x1_SN_1LDSB1_AMAS0_GRVW4_IU1_NLCA1_NLCB1_SIA2_SU32_SUS256_SVW1_TT4_64_VW1_WGM8
    SolutionIndex: 61
    SolutionNameMin: Cijk_Ailk_Bjlk_HB_MT128x128x16_MI16x16x16x1_SN_1LDSB1_AMAS3_GRVW4_IU1_NLCA1_NLCB1_SIA2_SU32_SUS256_SVW2_TT4_64_VW2_WGM8
    SolutionIndex: 62
    SolutionNameMin: Cijk_Ailk_Bjlk_HB_MT128x128x16_MI16x16x16x1_SN_1LDSB0_AMAS3_GRVW8_IU1_NLCA1_NLCB1_SIA3_SU32_SUS256_SVW2_TT4_64_VW2_WGM8
    SolutionIndex: 63
    SolutionNameMin: Cijk_Ailk_Bjlk_HB_MT32x32x32_MI16x16x16x1_SN_1LDSB0_AMAS0_GRVW8_IU1_NLCA1_NLCB1_SIA1_SU0_SUS0_SVW1_TT1_16_VW1_WGM4
    SolutionIndex: 64
    SolutionNameMin: Cijk_Ailk_Bjlk_HB_MT32x32x32_MI16x16x16x1_SN_1LDSB1_AMAS0_GRVW2_IU2_NLCA1_NLCB1_SIA2_SU0_SUS0_SVW1_TT1_16_VW1_WGM4
    SolutionIndex: 65
    SolutionNameMin: Cijk_Ailk_Bjlk_HB_MT32x32x32_MI16x16x16x1_SN_1LDSB1_AMAS0_GRVW4_IU2_NLCA1_NLCB1_SIA2_SU0_SUS0_SVW1_TT1_16_VW1_WGM4
    SolutionIndex: 66
    SolutionNameMin: Cijk_Ailk_Bjlk_HB_MT32x32x32_MI16x16x16x1_SN_1LDSB1_AMAS0_GRVW8_IU2_NLCA1_NLCB1_SIA2_SU0_SUS0_SVW1_TT1_16_VW1_WGM4
    SolutionIndex: 67
    SolutionNameMin: Cijk_Ailk_Bjlk_HB_MT32x32x32_MI16x16x16x1_SN_1LDSB0_AMAS0_GRVW8_IU1_NLCA1_NLCB1_SIA3_SU0_SUS0_SVW1_TT1_16_VW1_WGM4
    SolutionIndex: 68
    SolutionNameMin: Cijk_Ailk_Bjlk_HB_MT32x32x32_MI16x16x16x1_SN_1LDSB0_AMAS0_GRVW8_IU1_NLCA1_NLCB1_SIA1_SU32_SUS128_SVW1_TT1_16_VW1_WGM4
    SolutionIndex: 69
    SolutionNameMin: Cijk_Ailk_Bjlk_HB_MT32x32x32_MI16x16x16x1_SN_1LDSB1_AMAS0_GRVW2_IU2_NLCA1_NLCB1_SIA2_SU32_SUS128_SVW1_TT1_16_VW1_WGM4
    SolutionIndex: 70
    SolutionNameMin: Cijk_Ailk_Bjlk_HB_MT32x32x32_MI16x16x16x1_SN_1LDSB1_AMAS0_GRVW4_IU2_NLCA1_NLCB1_SIA2_SU32_SUS128_SVW1_TT1_16_VW1_WGM4
    SolutionIndex: 71
    SolutionNameMin: Cijk_Ailk_Bjlk_HB_MT32x32x32_MI16x16x16x1_SN_1LDSB1_AMAS0_GRVW8_IU2_NLCA1_NLCB1_SIA2_SU32_SUS128_SVW1_TT1_16_VW1_WGM4
    SolutionIndex: 72
    SolutionNameMin: Cijk_Ailk_Bjlk_HB_MT32x32x32_MI16x16x16x1_SN_1LDSB0_AMAS0_GRVW2_IU1_NLCA1_NLCB1_SIA3_SU32_SUS128_SVW1_TT1_16_VW1_WGM4
    SolutionIndex: 73
    SolutionNameMin: Cijk_Ailk_Bjlk_HB_MT32x32x32_MI16x16x16x1_SN_1LDSB1_AMAS0_GRVW4_IU2_NLCA1_NLCB1_SIA2_SU32_SUS256_SVW1_TT1_16_VW1_WGM4
    SolutionIndex: 74
    SolutionNameMin: Cijk_Ailk_Bjlk_HB_MT32x32x32_MI16x16x16x1_SN_1LDSB1_AMAS0_GRVW8_IU2_NLCA1_NLCB1_SIA2_SU32_SUS256_SVW1_TT1_16_VW1_WGM4
    SolutionIndex: 75
    SolutionNameMin: Cijk_Ailk_Bjlk_HB_MT32x32x32_MI16x16x16x1_SN_1LDSB0_AMAS0_GRVW4_IU1_NLCA1_NLCB1_SIA1_SU0_SUS0_SVW1_TT1_16_VW1_WGM8
    SolutionIndex: 76
    SolutionNameMin: Cijk_Ailk_Bjlk_HB_MT32x32x32_MI16x16x16x1_SN_1LDSB1_AMAS0_GRVW2_IU2_NLCA1_NLCB1_SIA2_SU0_SUS0_SVW1_TT1_16_VW1_WGM8
    SolutionIndex: 77
    SolutionNameMin: Cijk_Ailk_Bjlk_HB_MT32x32x32_MI16x16x16x1_SN_1LDSB1_AMAS0_GRVW4_IU2_NLCA1_NLCB1_SIA2_SU0_SUS0_SVW1_TT1_16_VW1_WGM8
    SolutionIndex: 78
    SolutionNameMin: Cijk_Ailk_Bjlk_HB_MT32x32x32_MI16x16x16x1_SN_1LDSB1_AMAS0_GRVW8_IU2_NLCA1_NLCB1_SIA2_SU0_SUS0_SVW1_TT1_16_VW1_WGM8
    SolutionIndex: 79
    SolutionNameMin: Cijk_Ailk_Bjlk_HB_MT32x32x32_MI16x16x16x1_SN_1LDSB0_AMAS0_GRVW4_IU1_NLCA1_NLCB1_SIA1_SU32_SUS128_SVW1_TT1_16_VW1_WGM8
    SolutionIndex: 80
    SolutionNameMin: Cijk_Ailk_Bjlk_HB_MT32x32x32_MI16x16x16x1_SN_1LDSB0_AMAS0_GRVW8_IU1_NLCA1_NLCB1_SIA1_SU32_SUS128_SVW1_TT1_16_VW1_WGM8
    SolutionIndex: 81
    SolutionNameMin: Cijk_Ailk_Bjlk_HB_MT32x32x32_MI16x16x16x1_SN_1LDSB1_AMAS0_GRVW2_IU2_NLCA1_NLCB1_SIA2_SU32_SUS128_SVW1_TT1_16_VW1_WGM8
    SolutionIndex: 82
    SolutionNameMin: Cijk_Ailk_Bjlk_HB_MT32x32x32_MI16x16x16x1_SN_1LDSB1_AMAS0_GRVW4_IU2_NLCA1_NLCB1_SIA2_SU32_SUS128_SVW1_TT1_16_VW1_WGM8
    SolutionIndex: 83
    SolutionNameMin: Cijk_Ailk_Bjlk_HB_MT32x32x32_MI16x16x16x1_SN_1LDSB1_AMAS0_GRVW8_IU2_NLCA1_NLCB1_SIA2_SU32_SUS128_SVW1_TT1_16_VW1_WGM8
    SolutionIndex: 84
    SolutionNameMin: Cijk_Ailk_Bjlk_HB_MT32x32x32_MI16x16x16x1_SN_1LDSB0_AMAS0_GRVW2_IU1_NLCA1_NLCB1_SIA3_SU32_SUS128_SVW1_TT1_16_VW1_WGM8
    SolutionIndex: 85
    SolutionNameMin: Cijk_Ailk_Bjlk_HB_MT32x32x32_MI16x16x16x1_SN_1LDSB0_AMAS0_GRVW4_IU1_NLCA1_NLCB1_SIA3_SU32_SUS128_SVW1_TT1_16_VW1_WGM8
    SolutionIndex: 86
    SolutionNameMin: Cijk_Ailk_Bjlk_HB_MT32x32x32_MI16x16x16x1_SN_1LDSB0_AMAS0_GRVW4_IU1_NLCA1_NLCB1_SIA1_SU32_SUS256_SVW1_TT1_16_VW1_WGM8
    SolutionIndex: 87
    SolutionNameMin: Cijk_Ailk_Bjlk_HB_MT32x32x32_MI16x16x16x1_SN_1LDSB0_AMAS0_GRVW8_IU1_NLCA1_NLCB1_SIA1_SU32_SUS256_SVW1_TT1_16_VW1_WGM8
    SolutionIndex: 88
    SolutionNameMin: Cijk_Ailk_Bjlk_HB_MT32x32x32_MI16x16x16x1_SN_1LDSB1_AMAS0_GRVW2_IU2_NLCA1_NLCB1_SIA2_SU32_SUS256_SVW1_TT1_16_VW1_WGM8
    SolutionIndex: 89
    SolutionNameMin: Cijk_Ailk_Bjlk_HB_MT32x32x32_MI16x16x16x1_SN_1LDSB1_AMAS0_GRVW4_IU2_NLCA1_NLCB1_SIA2_SU32_SUS256_SVW1_TT1_16_VW1_WGM8
    SolutionIndex: 90
    SolutionNameMin: Cijk_Ailk_Bjlk_HB_MT32x32x32_MI16x16x16x1_SN_1LDSB1_AMAS0_GRVW8_IU2_NLCA1_NLCB1_SIA2_SU32_SUS256_SVW1_TT1_16_VW1_WGM8
    SolutionIndex: 91
    SolutionNameMin: Cijk_Ailk_Bjlk_HB_MT32x32x32_MI16x16x16x1_SN_1LDSB0_AMAS0_GRVW8_IU1_NLCA1_NLCB1_SIA3_SU32_SUS256_SVW1_TT1_16_VW1_WGM8
    SolutionIndex: 92
    SolutionNameMin: Cijk_Ailk_Bjlk_HB_MT64x64x32_MI16x16x16x1_SN_1LDSB0_AMAS0_GRVW8_IU1_NLCA1_NLCB1_SIA1_SU0_SUS0_SVW1_TT2_32_VW1_WGM4
    SolutionIndex: 93
    SolutionNameMin: Cijk_Ailk_Bjlk_HB_MT64x64x32_MI16x16x16x1_SN_1LDSB0_AMAS3_GRVW8_IU1_NLCA1_NLCB1_SIA1_SU0_SUS0_SVW2_TT2_32_VW2_WGM4
    SolutionIndex: 94
    SolutionNameMin: Cijk_Ailk_Bjlk_HB_MT64x64x32_MI16x16x16x1_SN_1LDSB1_AMAS0_GRVW4_IU2_NLCA1_NLCB1_SIA2_SU0_SUS0_SVW1_TT2_32_VW1_WGM4
    SolutionIndex: 95
    SolutionNameMin: Cijk_Ailk_Bjlk_HB_MT64x64x32_MI16x16x16x1_SN_1LDSB1_AMAS3_GRVW4_IU2_NLCA1_NLCB1_SIA2_SU0_SUS0_SVW2_TT2_32_VW2_WGM4
    SolutionIndex: 96
    SolutionNameMin: Cijk_Ailk_Bjlk_HB_MT64x64x32_MI16x16x16x1_SN_1LDSB1_AMAS0_GRVW8_IU2_NLCA1_NLCB1_SIA2_SU0_SUS0_SVW1_TT2_32_VW1_WGM4
    SolutionIndex: 97
    SolutionNameMin: Cijk_Ailk_Bjlk_HB_MT64x64x32_MI16x16x16x1_SN_1LDSB1_AMAS3_GRVW8_IU2_NLCA1_NLCB1_SIA2_SU0_SUS0_SVW2_TT2_32_VW2_WGM4
    SolutionIndex: 98
    SolutionNameMin: Cijk_Ailk_Bjlk_HB_MT64x64x32_MI16x16x16x1_SN_1LDSB0_AMAS0_GRVW8_IU1_NLCA1_NLCB1_SIA3_SU0_SUS0_SVW1_TT2_32_VW1_WGM4
    SolutionIndex: 99
    SolutionNameMin: Cijk_Ailk_Bjlk_HB_MT64x64x32_MI16x16x16x1_SN_1LDSB0_AMAS3_GRVW8_IU1_NLCA1_NLCB1_SIA3_SU0_SUS0_SVW2_TT2_32_VW2_WGM4
    SolutionIndex: 100
    SolutionNameMin: Cijk_Ailk_Bjlk_HB_MT64x64x32_MI16x16x16x1_SN_1LDSB0_AMAS0_GRVW8_IU1_NLCA1_NLCB1_SIA1_SU32_SUS128_SVW1_TT2_32_VW1_WGM4
    SolutionIndex: 101
    SolutionNameMin: Cijk_Ailk_Bjlk_HB_MT64x64x32_MI16x16x16x1_SN_1LDSB1_AMAS0_GRVW4_IU2_NLCA1_NLCB1_SIA2_SU32_SUS128_SVW1_TT2_32_VW1_WGM4
    SolutionIndex: 102
    SolutionNameMin: Cijk_Ailk_Bjlk_HB_MT64x64x32_MI16x16x16x1_SN_1LDSB1_AMAS3_GRVW4_IU2_NLCA1_NLCB1_SIA2_SU32_SUS128_SVW2_TT2_32_VW2_WGM4
    SolutionIndex: 103
    SolutionNameMin: Cijk_Ailk_Bjlk_HB_MT64x64x32_MI16x16x16x1_SN_1LDSB1_AMAS0_GRVW8_IU2_NLCA1_NLCB1_SIA2_SU32_SUS128_SVW1_TT2_32_VW1_WGM4
    SolutionIndex: 104
    SolutionNameMin: Cijk_Ailk_Bjlk_HB_MT64x64x32_MI16x16x16x1_SN_1LDSB1_AMAS3_GRVW8_IU2_NLCA1_NLCB1_SIA2_SU32_SUS128_SVW2_TT2_32_VW2_WGM4
    SolutionIndex: 105
    SolutionNameMin: Cijk_Ailk_Bjlk_HB_MT64x64x32_MI16x16x16x1_SN_1LDSB0_AMAS0_GRVW8_IU1_NLCA1_NLCB1_SIA3_SU32_SUS128_SVW1_TT2_32_VW1_WGM4
    SolutionIndex: 106
    SolutionNameMin: Cijk_Ailk_Bjlk_HB_MT64x64x32_MI16x16x16x1_SN_1LDSB0_AMAS3_GRVW8_IU1_NLCA1_NLCB1_SIA3_SU32_SUS128_SVW2_TT2_32_VW2_WGM4
    SolutionIndex: 107
    SolutionNameMin: Cijk_Ailk_Bjlk_HB_MT64x64x32_MI16x16x16x1_SN_1LDSB0_AMAS3_GRVW4_IU1_NLCA1_NLCB1_SIA1_SU32_SUS256_SVW2_TT2_32_VW2_WGM4
    SolutionIndex: 108
    SolutionNameMin: Cijk_Ailk_Bjlk_HB_MT64x64x32_MI16x16x16x1_SN_1LDSB0_AMAS0_GRVW8_IU1_NLCA1_NLCB1_SIA1_SU32_SUS256_SVW1_TT2_32_VW1_WGM4
    SolutionIndex: 109
    SolutionNameMin: Cijk_Ailk_Bjlk_HB_MT64x64x32_MI16x16x16x1_SN_1LDSB1_AMAS0_GRVW8_IU2_NLCA1_NLCB1_SIA2_SU32_SUS256_SVW1_TT2_32_VW1_WGM4
    SolutionIndex: 110
    SolutionNameMin: Cijk_Ailk_Bjlk_HB_MT64x64x32_MI16x16x16x1_SN_1LDSB1_AMAS3_GRVW8_IU2_NLCA1_NLCB1_SIA2_SU32_SUS256_SVW2_TT2_32_VW2_WGM4
    SolutionIndex: 111
    SolutionNameMin: Cijk_Ailk_Bjlk_HB_MT64x64x32_MI16x16x16x1_SN_1LDSB0_AMAS0_GRVW8_IU1_NLCA1_NLCB1_SIA3_SU32_SUS256_SVW1_TT2_32_VW1_WGM4
    SolutionIndex: 112
    SolutionNameMin: Cijk_Ailk_Bjlk_HB_MT64x64x32_MI16x16x16x1_SN_1LDSB0_AMAS3_GRVW8_IU1_NLCA1_NLCB1_SIA3_SU32_SUS256_SVW2_TT2_32_VW2_WGM4
    SolutionIndex: 113
    SolutionNameMin: Cijk_Ailk_Bjlk_HB_MT64x64x32_MI16x16x16x1_SN_1LDSB0_AMAS0_GRVW8_IU1_NLCA1_NLCB1_SIA1_SU0_SUS0_SVW1_TT2_32_VW1_WGM8
    SolutionIndex: 114
    SolutionNameMin: Cijk_Ailk_Bjlk_HB_MT64x64x32_MI16x16x16x1_SN_1LDSB1_AMAS0_GRVW4_IU2_NLCA1_NLCB1_SIA2_SU0_SUS0_SVW1_TT2_32_VW1_WGM8
    SolutionIndex: 115
    SolutionNameMin: Cijk_Ailk_Bjlk_HB_MT64x64x32_MI16x16x16x1_SN_1LDSB1_AMAS0_GRVW8_IU2_NLCA1_NLCB1_SIA2_SU0_SUS0_SVW1_TT2_32_VW1_WGM8
    SolutionIndex: 116
    SolutionNameMin: Cijk_Ailk_Bjlk_HB_MT64x64x32_MI16x16x16x1_SN_1LDSB1_AMAS3_GRVW8_IU2_NLCA1_NLCB1_SIA2_SU0_SUS0_SVW2_TT2_32_VW2_WGM8
    SolutionIndex: 117
    SolutionNameMin: Cijk_Ailk_Bjlk_HB_MT64x64x32_MI16x16x16x1_SN_1LDSB0_AMAS0_GRVW8_IU1_NLCA1_NLCB1_SIA3_SU0_SUS0_SVW1_TT2_32_VW1_WGM8
    SolutionIndex: 118
    SolutionNameMin: Cijk_Ailk_Bjlk_HB_MT64x64x32_MI16x16x16x1_SN_1LDSB0_AMAS3_GRVW8_IU1_NLCA1_NLCB1_SIA3_SU0_SUS0_SVW2_TT2_32_VW2_WGM8
    SolutionIndex: 119
    SolutionNameMin: Cijk_Ailk_Bjlk_HB_MT64x64x32_MI16x16x16x1_SN_1LDSB0_AMAS3_GRVW4_IU1_NLCA1_NLCB1_SIA1_SU32_SUS128_SVW2_TT2_32_VW2_WGM8
    SolutionIndex: 120
    SolutionNameMin: Cijk_Ailk_Bjlk_HB_MT64x64x32_MI16x16x16x1_SN_1LDSB0_AMAS3_GRVW8_IU1_NLCA1_NLCB1_SIA1_SU32_SUS128_SVW2_TT2_32_VW2_WGM8
    SolutionIndex: 121
    SolutionNameMin: Cijk_Ailk_Bjlk_HB_MT64x64x32_MI16x16x16x1_SN_1LDSB1_AMAS0_GRVW4_IU2_NLCA1_NLCB1_SIA2_SU32_SUS128_SVW1_TT2_32_VW1_WGM8
    SolutionIndex: 122
    SolutionNameMin: Cijk_Ailk_Bjlk_HB_MT64x64x32_MI16x16x16x1_SN_1LDSB1_AMAS0_GRVW8_IU2_NLCA1_NLCB1_SIA2_SU32_SUS128_SVW1_TT2_32_VW1_WGM8
    SolutionIndex: 123
    SolutionNameMin: Cijk_Ailk_Bjlk_HB_MT64x64x32_MI16x16x16x1_SN_1LDSB1_AMAS3_GRVW8_IU2_NLCA1_NLCB1_SIA2_SU32_SUS128_SVW2_TT2_32_VW2_WGM8
    SolutionIndex: 124
    SolutionNameMin: Cijk_Ailk_Bjlk_HB_MT64x64x32_MI16x16x16x1_SN_1LDSB0_AMAS0_GRVW8_IU1_NLCA1_NLCB1_SIA3_SU32_SUS128_SVW1_TT2_32_VW1_WGM8
    SolutionIndex: 125
    SolutionNameMin: Cijk_Ailk_Bjlk_HB_MT64x64x32_MI16x16x16x1_SN_1LDSB0_AMAS3_GRVW8_IU1_NLCA1_NLCB1_SIA3_SU32_SUS128_SVW2_TT2_32_VW2_WGM8
    SolutionIndex: 126
    SolutionNameMin: Cijk_Ailk_Bjlk_HB_MT64x64x32_MI16x16x16x1_SN_1LDSB0_AMAS3_GRVW8_IU1_NLCA1_NLCB1_SIA1_SU32_SUS256_SVW2_TT2_32_VW2_WGM8
    SolutionIndex: 127
    SolutionNameMin: Cijk_Ailk_Bjlk_HB_MT64x64x32_MI16x16x16x1_SN_1LDSB1_AMAS0_GRVW4_IU2_NLCA1_NLCB1_SIA2_SU32_SUS256_SVW1_TT2_32_VW1_WGM8
    SolutionIndex: 128
    SolutionNameMin: Cijk_Ailk_Bjlk_HB_MT64x64x32_MI16x16x16x1_SN_1LDSB1_AMAS3_GRVW4_IU2_NLCA1_NLCB1_SIA2_SU32_SUS256_SVW2_TT2_32_VW2_WGM8
    SolutionIndex: 129
    SolutionNameMin: Cijk_Ailk_Bjlk_HB_MT64x64x32_MI16x16x16x1_SN_1LDSB1_AMAS0_GRVW8_IU2_NLCA1_NLCB1_SIA2_SU32_SUS256_SVW1_TT2_32_VW1_WGM8
    SolutionIndex: 130
    SolutionNameMin: Cijk_Ailk_Bjlk_HB_MT64x64x32_MI16x16x16x1_SN_1LDSB1_AMAS3_GRVW8_IU2_NLCA1_NLCB1_SIA2_SU32_SUS256_SVW2_TT2_32_VW2_WGM8
    SolutionIndex: 131
    SolutionNameMin: Cijk_Ailk_Bjlk_HB_MT64x64x32_MI16x16x16x1_SN_1LDSB0_AMAS0_GRVW8_IU1_NLCA1_NLCB1_SIA3_SU32_SUS256_SVW1_TT2_32_VW1_WGM8
    SolutionIndex: 132
    SolutionNameMin: Cijk_Ailk_Bjlk_HB_MT64x64x32_MI16x16x16x1_SN_1LDSB0_AMAS3_GRVW8_IU1_NLCA1_NLCB1_SIA3_SU32_SUS256_SVW2_TT2_32_VW2_WGM8
- - - [64, 64, 1, 64, 96, 96, 96, 96]
    - [3, 0.04]
  - - [64, 64, 1, 128, 96, 96, 160, 160]
    - [78, 0.08]
  - - [64, 64, 1, 256, 96, 96, 288, 288]
    - [78, 0.15]
  - - [64, 64, 1, 512, 96, 96, 544, 544]
    - [66, 0.267]
  - - [64, 64, 1, 1024, 96, 96, 1056, 1056]
    - [66, 0.432]
  - - [64, 64, 1, 2048, 96, 96, 2080, 2080]
    - [65, 0.626]
  - - [64, 64, 1, 4096, 96, 96, 4128, 4128]
    - [89, 0.803]
  - - [64, 64, 1, 8192, 96, 96, 8224, 8224]
    - [82, 0.94]
  - - [64, 128, 1, 64, 96, 96, 96, 128]
    - [66, 0.087]
  - - [64, 128, 1, 128, 96, 96, 160, 160]
    - [89, 0.165]
  - - [64, 128, 1, 256, 96, 96, 288, 288]
    - [77, 0.311]
  - - [64, 128, 1, 512, 96, 96, 544, 544]
    - [78, 0.547]
  - - [64, 128, 1, 1024, 96, 96, 1056, 1056]
    - [65, 0.88]
  - - [64, 128, 1, 2048, 96, 96, 2080, 2080]
    - [83, 1.265]
  - - [64, 128, 1, 4096, 96, 96, 4128, 4128]
    - [70, 1.618]
  - - [64, 128, 1, 8192, 96, 96, 8224, 8224]
    - [89, 1.866]
  - - [64, 256, 1, 64, 96, 96, 96, 256]
    - [129, 0.155]
  - - [64, 256, 1, 128, 96, 96, 160, 256]
    - [70, 0.338]
  - - [64, 256, 1, 256, 96, 96, 288, 288]
    - [90, 0.63]
  - - [64, 256, 1, 512, 96, 96, 544, 544]
    - [73, 1.097]
  - - [64, 256, 1, 1024, 96, 96, 1056, 1056]
    - [69, 1.58]
  - - [64, 256, 1, 2048, 96, 96, 2080, 2080]
    - [71, 2.547]
  - - [64, 256, 1, 4096, 96, 96, 4128, 4128]
    - [69, 3.253]
  - - [64, 256, 1, 8192, 96, 96, 8224, 8224]
    - [77, 3.758]
  - - [64, 512, 1, 64, 96, 96, 96, 512]
    - [85, 0.351]
  - - [64, 512, 1, 128, 96, 96, 160, 512]
    - [74, 0.674]
  - - [64, 512, 1, 256, 96, 96, 288, 512]
    - [73, 1.265]
  - - [64, 512, 1, 512, 96, 96, 544, 544]
    - [89, 2.222]
  - - [64, 512, 1, 1024, 96, 96, 1056, 1056]
    - [82, 3.557]
  - - [64, 512, 1, 2048, 96, 96, 2080, 2080]
    - [65, 5.107]
  - - [64, 512, 1, 4096, 96, 96, 4128, 4128]
    - [70, 6.493]
  - - [64, 512, 1, 8192, 96, 96, 8224, 8224]
    - [64, 7.544]
  - - [64, 1024, 1, 64, 96, 96, 96, 1024]
    - [68, 0.694]
  - - [64, 1024, 1, 128, 96, 96, 160, 1024]
    - [90, 1.315]
  - - [64, 1024, 1, 256, 96, 96, 288, 1024]
    - [90, 2.376]
  - - [64, 1024, 1, 512, 96, 96, 544, 1024]
    - [83, 4.036]
  - - [64, 1024, 1, 1024, 96, 96, 1056, 1056]
    - [66, 6.171]
  - - [64, 1024, 1, 2048, 96, 96, 2080, 2080]
    - [64, 8.371]
  - - [64, 1024, 1, 4096, 96, 96, 4128, 4128]
    - [77, 10.147]
  - - [64, 1024, 1, 8192, 96, 96, 8224, 8224]
    - [89, 11.23]
  - - [64, 2048, 1, 64, 96, 96, 96, 2048]
    - [80, 1.358]
  - - [64, 2048, 1, 128, 96, 96, 160, 2048]
    - [77, 2.521]
  - - [64, 2048, 1, 256, 96, 96, 288, 2048]
    - [77, 4.441]
  - - [64, 2048, 1, 512, 96, 96, 544, 2048]
    - [66, 7.171]
  - - [64, 2048, 1, 1024, 96, 96, 1056, 2048]
    - [115, 10.37]
  - - [64, 2048, 1, 2048, 96, 96, 2080, 2080]
    - [103, 13.302]
  - - [64, 2048, 1, 4096, 96, 96, 4128, 4128]
    - [130, 15.398]
  - - [64, 2048, 1, 8192, 96, 96, 8224, 8224]
    - [129, 16.843]
  - - [64, 4096, 1, 64, 96, 96, 96, 4096]
    - [9, 2.595]
  - - [64, 4096, 1, 128, 96, 96, 160, 4096]
    - [113, 4.711]
  - - [64, 4096, 1, 256, 96, 96, 288, 4096]
    - [122, 8.043]
  - - [64, 4096, 1, 512, 96, 96, 544, 4096]
    - [96, 12.481]
  - - [64, 4096, 1, 1024, 96, 96, 1056, 4096]
    - [114, 17.199]
  - - [64, 4096, 1, 2048, 96, 96, 2080, 4096]
    - [102, 21.182]
  - - [64, 4096, 1, 4096, 96, 96, 4128, 4128]
    - [102, 23.876]
  - - [64, 4096, 1, 8192, 96, 96, 8224, 8224]
    - [96, 22.503]
  - - [64, 8192, 1, 64, 96, 96, 96, 8192]
    - [8, 4.935]
  - - [64, 8192, 1, 128, 96, 96, 160, 8192]
    - [11, 8.748]
  - - [64, 8192, 1, 256, 96, 96, 288, 8192]
    - [115, 14.326]
  - - [64, 8192, 1, 512, 96, 96, 544, 8192]
    - [96, 20.689]
  - - [64, 8192, 1, 1024, 96, 96, 1056, 8192]
    - [94, 26.707]
  - - [64, 8192, 1, 2048, 96, 96, 2080, 8192]
    - [94, 31.11]
  - - [64, 8192, 1, 4096, 96, 96, 4128, 8192]
    - [114, 34.001]
  - - [64, 8192, 1, 8192, 96, 96, 8224, 8224]
    - [114, 34.309]
  - - [128, 64, 1, 64, 160, 160, 128, 96]
    - [3, 0.086]
  - - [128, 64, 1, 128, 160, 160, 160, 160]
    - [90, 0.165]
  - - [128, 64, 1, 256, 160, 160, 288, 288]
    - [82, 0.308]
  - - [128, 64, 1, 512, 160, 160, 544, 544]
    - [78, 0.54]
  - - [128, 64, 1, 1024, 160, 160, 1056, 1056]
    - [74, 0.883]
  - - [128, 64, 1, 2048, 160, 160, 2080, 2080]
    - [70, 1.271]
  - - [128, 64, 1, 4096, 160, 160, 4128, 4128]
    - [88, 1.624]
  - - [128, 64, 1, 8192, 160, 160, 8224, 8224]
    - [77, 1.883]
  - - [128, 128, 1, 64, 160, 160, 128, 128]
    - [66, 0.176]
  - - [128, 128, 1, 128, 160, 160, 160, 160]
    - [66, 0.34]
  - - [128, 128, 1, 256, 160, 160, 288, 288]
    - [83, 0.627]
  - - [128, 128, 1, 512, 160, 160, 544, 544]
    - [90, 1.104]
  - - [128, 128, 1, 1024, 160, 160, 1056, 1056]
    - [77, 1.785]
  - - [128, 128, 1, 2048, 160, 160, 2080, 2080]
    - [64, 2.544]
  - - [128, 128, 1, 4096, 160, 160, 4128, 4128]
    - [82, 3.266]
  - - [128, 128, 1, 8192, 160, 160, 8224, 8224]
    - [82, 3.784]
  - - [128, 256, 1, 64, 160, 160, 128, 256]
    - [66, 0.351]
  - - [128, 256, 1, 128, 160, 160, 160, 256]
    - [83, 0.674]
  - - [128, 256, 1, 256, 160, 160, 288, 288]
    - [83, 1.256]
  - - [128, 256, 1, 512, 160, 160, 544, 544]
    - [74, 2.223]
  - - [128, 256, 1, 1024, 160, 160, 1056, 1056]
    - [89, 3.561]
  - - [128, 256, 1, 2048, 160, 160, 2080, 2080]
    - [73, 5.116]
  - - [128, 256, 1, 4096, 160, 160, 4128, 4128]
    - [64, 6.51]
  - - [128, 256, 1, 8192, 160, 160, 8224, 8224]
    - [71, 7.332]
  - - [128, 512, 1, 64, 160, 160, 128, 512]
    - [84, 0.694]
  - - [128, 512, 1, 128, 160, 160, 160, 512]
    - [89, 1.304]
  - - [128, 512, 1, 256, 160, 160, 288, 512]
    - [90, 2.401]
  - - [128, 512, 1, 512, 160, 160, 544, 544]
    - [65, 4.034]
  - - [128, 512, 1, 1024, 160, 160, 1056, 1056]
    - [78, 6.179]
  - - [128, 512, 1, 2048, 160, 160, 2080, 2080]
    - [66, 8.358]
  - - [128, 512, 1, 4096, 160, 160, 4128, 4128]
    - [77, 10.132]
  - - [128, 512, 1, 8192, 160, 160, 8224, 8224]
    - [64, 11.378]
  - - [128, 1024, 1, 64, 160, 160, 128, 1024]
    - [91, 1.354]
  - - [128, 1024, 1, 128, 160, 160, 160, 1024]
    - [75, 2.513]
  - - [128, 1024, 1, 256, 160, 160, 288, 1024]
    - [86, 4.435]
  - - [128, 1024, 1, 512, 160, 160, 544, 1024]
    - [116, 7.165]
  - - [128, 1024, 1, 1024, 160, 160, 1056, 1056]
    - [115, 10.347]
  - - [128, 1024, 1, 2048, 160, 160, 2080, 2080]
    - [96, 13.312]
  - - [128, 1024, 1, 4096, 160, 160, 4128, 4128]
    - [94, 15.387]
  - - [128, 1024, 1, 8192, 160, 160, 8224, 8224]
    - [115, 16.815]
  - - [128, 2048, 1, 64, 160, 160, 128, 2048]
    - [105, 2.584]
  - - [128, 2048, 1, 128, 160, 160, 160, 2048]
    - [132, 4.698]
  - - [128, 2048, 1, 256, 160, 160, 288, 2048]
    - [96, 8.043]
  - - [128, 2048, 1, 512, 160, 160, 544, 2048]
    - [96, 12.529]
  - - [128, 2048, 1, 1024, 160, 160, 1056, 2048]
    - [96, 17.247]
  - - [128, 2048, 1, 2048, 160, 160, 2080, 2080]
    - [109, 21.133]
  - - [128, 2048, 1, 4096, 160, 160, 4128, 4128]
    - [121, 23.919]
  - - [128, 2048, 1, 8192, 160, 160, 8224, 8224]
    - [121, 24.677]
  - - [128, 4096, 1, 64, 160, 160, 128, 4096]
    - [132, 5.002]
  - - [128, 4096, 1, 128, 160, 160, 160, 4096]
    - [6, 8.75]
  - - [128, 4096, 1, 256, 160, 160, 288, 4096]
    - [122, 14.207]
  - - [128, 4096, 1, 512, 160, 160, 544, 4096]
    - [115, 20.664]
  - - [128, 4096, 1, 1024, 160, 160, 1056, 4096]
    - [114, 26.694]
  - - [128, 4096, 1, 2048, 160, 160, 2080, 4096]
    - [96, 31.084]
  - - [128, 4096, 1, 4096, 160, 160, 4128, 4128]
    - [101, 34.143]
  - - [128, 4096, 1, 8192, 160, 160, 8224, 8224]
    - [115, 33.019]
  - - [128, 8192, 1, 64, 160, 160, 128, 8192]
    - [117, 8.487]
  - - [128, 8192, 1, 128, 160, 160, 160, 8192]
    - [48, 14.486]
  - - [128, 8192, 1, 256, 160, 160, 288, 8192]
    - [21, 22.806]
  - - [128, 8192, 1, 512, 160, 160, 544, 8192]
    - [54, 31.678]
  - - [128, 8192, 1, 1024, 160, 160, 1056, 8192]
    - [38, 39.369]
  - - [128, 8192, 1, 2048, 160, 160, 2080, 8192]
    - [54, 44.17]
  - - [128, 8192, 1, 4096, 160, 160, 4128, 8192]
    - [61, 47.19]
  - - [128, 8192, 1, 8192, 160, 160, 8224, 8224]
    - [20, 47.0]
  - - [256, 64, 1, 64, 288, 288, 256, 96]
    - [1, 0.175]
  - - [256, 64, 1, 128, 288, 288, 256, 160]
    - [78, 0.338]
  - - [256, 64, 1, 256, 288, 288, 288, 288]
    - [74, 0.633]
  - - [256, 64, 1, 512, 288, 288, 544, 544]
    - [77, 1.107]
  - - [256, 64, 1, 1024, 288, 288, 1056, 1056]
    - [77, 1.786]
  - - [256, 64, 1, 2048, 288, 288, 2080, 2080]
    - [65, 2.568]
  - - [256, 64, 1, 4096, 288, 288, 4128, 4128]
    - [77, 3.276]
  - - [256, 64, 1, 8192, 288, 288, 8224, 8224]
    - [70, 3.782]
  - - [256, 128, 1, 64, 288, 288, 256, 128]
    - [71, 0.35]
  - - [256, 128, 1, 128, 288, 288, 256, 160]
    - [79, 0.674]
  - - [256, 128, 1, 256, 288, 288, 288, 288]
    - [65, 1.267]
  - - [256, 128, 1, 512, 288, 288, 544, 544]
    - [89, 2.222]
  - - [256, 128, 1, 1024, 288, 288, 1056, 1056]
    - [76, 2.915]
  - - [256, 128, 1, 2048, 288, 288, 2080, 2080]
    - [88, 4.993]
  - - [256, 128, 1, 4096, 288, 288, 4128, 4128]
    - [65, 6.557]
  - - [256, 128, 1, 8192, 288, 288, 8224, 8224]
    - [64, 7.618]
  - - [256, 256, 1, 64, 288, 288, 256, 256]
    - [67, 0.696]
  - - [256, 256, 1, 128, 288, 288, 256, 256]
    - [64, 1.313]
  - - [256, 256, 1, 256, 288, 288, 288, 288]
    - [78, 2.404]
  - - [256, 256, 1, 512, 288, 288, 544, 544]
    - [78, 4.055]
  - - [256, 256, 1, 1024, 288, 288, 1056, 1056]
    - [77, 6.203]
  - - [256, 256, 1, 2048, 288, 288, 2080, 2080]
    - [77, 8.399]
  - - [256, 256, 1, 4096, 288, 288, 4128, 4128]
    - [64, 10.134]
  - - [256, 256, 1, 8192, 288, 288, 8224, 8224]
    - [64, 11.249]
  - - [256, 512, 1, 64, 288, 288, 256, 512]
    - [67, 1.358]
  - - [256, 512, 1, 128, 288, 288, 256, 512]
    - [63, 2.519]
  - - [256, 512, 1, 256, 288, 288, 288, 512]
    - [87, 4.442]
  - - [256, 512, 1, 512, 288, 288, 544, 544]
    - [77, 7.163]
  - - [256, 512, 1, 1024, 288, 288, 1056, 1056]
    - [97, 10.361]
  - - [256, 512, 1, 2048, 288, 288, 2080, 2080]
    - [96, 13.317]
  - - [256, 512, 1, 4096, 288, 288, 4128, 4128]
    - [130, 15.413]
  - - [256, 512, 1, 8192, 288, 288, 8224, 8224]
    - [116, 16.746]
  - - [256, 1024, 1, 64, 288, 288, 256, 1024]
    - [10, 2.593]
  - - [256, 1024, 1, 128, 288, 288, 256, 1024]
    - [131, 4.733]
  - - [256, 1024, 1, 256, 288, 288, 288, 1024]
    - [113, 8.063]
  - - [256, 1024, 1, 512, 288, 288, 544, 1024]
    - [96, 12.42]
  - - [256, 1024, 1, 1024, 288, 288, 1056, 1056]
    - [115, 17.101]
  - - [256, 1024, 1, 2048, 288, 288, 2080, 2080]
    - [123, 20.966]
  - - [256, 1024, 1, 4096, 288, 288, 4128, 4128]
    - [116, 23.485]
  - - [256, 1024, 1, 8192, 288, 288, 8224, 8224]
    - [96, 24.392]
  - - [256, 2048, 1, 64, 288, 288, 256, 2048]
    - [118, 4.941]
  - - [256, 2048, 1, 128, 288, 288, 256, 2048]
    - [98, 8.71]
  - - [256, 2048, 1, 256, 288, 288, 288, 2048]
    - [92, 14.152]
  - - [256, 2048, 1, 512, 288, 288, 544, 2048]
    - [114, 20.518]
  - - [256, 2048, 1, 1024, 288, 288, 1056, 2048]
    - [101, 26.515]
  - - [256, 2048, 1, 2048, 288, 288, 2080, 2080]
    - [128, 30.373]
  - - [256, 2048, 1, 4096, 288, 288, 4128, 4128]
    - [95, 33.75]
  - - [256, 2048, 1, 8192, 288, 288, 8224, 8224]
    - [96, 34.543]
  - - [256, 4096, 1, 64, 288, 288, 256, 4096]
    - [124, 8.446]
  - - [256, 4096, 1, 128, 288, 288, 256, 4096]
    - [54, 14.449]
  - - [256, 4096, 1, 256, 288, 288, 288, 4096]
    - [21, 22.797]
  - - [256, 4096, 1, 512, 288, 288, 544, 4096]
    - [21, 31.868]
  - - [256, 4096, 1, 1024, 288, 288, 1056, 4096]
    - [21, 39.033]
  - - [256, 4096, 1, 2048, 288, 288, 2080, 4096]
    - [61, 44.326]
  - - [256, 4096, 1, 4096, 288, 288, 4128, 4128]
    - [29, 46.56]
  - - [256, 4096, 1, 8192, 288, 288, 8224, 8224]
    - [56, 39.008]
  - - [256, 8192, 1, 64, 288, 288, 256, 8192]
    - [27, 14.389]
  - - [256, 8192, 1, 128, 288, 288, 256, 8192]
    - [45, 23.681]
  - - [256, 8192, 1, 256, 288, 288, 288, 8192]
    - [35, 35.012]
  - - [256, 8192, 1, 512, 288, 288, 544, 8192]
    - [29, 46.847]
  - - [256, 8192, 1, 1024, 288, 288, 1056, 8192]
    - [28, 55.555]
  - - [256, 8192, 1, 2048, 288, 288, 2080, 8192]
    - [48, 57.057]
  - - [256, 8192, 1, 4096, 288, 288, 4128, 8192]
    - [36, 62.43]
  - - [256, 8192, 1, 8192, 288, 288, 8224, 8224]
    - [60, 58.616]
  - - [384, 64, 1, 64, 416, 416, 384, 96]
    - [1, 0.26]
  - - [384, 64, 1, 128, 416, 416, 384, 160]
    - [76, 0.502]
  - - [384, 64, 1, 256, 416, 416, 384, 288]
    - [90, 0.949]
  - - [384, 64, 1, 512, 416, 416, 544, 544]
    - [64, 1.667]
  - - [384, 64, 1, 1024, 416, 416, 1056, 1056]
    - [65, 2.658]
  - - [384, 64, 1, 2048, 416, 416, 2080, 2080]
    - [66, 3.822]
  - - [384, 64, 1, 4096, 416, 416, 4128, 4128]
    - [77, 4.876]
  - - [384, 64, 1, 8192, 416, 416, 8224, 8224]
    - [64, 5.558]
  - - [384, 128, 1, 64, 416, 416, 384, 128]
    - [82, 0.527]
  - - [384, 128, 1, 128, 416, 416, 384, 160]
    - [73, 1.014]
  - - [384, 128, 1, 256, 416, 416, 384, 288]
    - [66, 1.898]
  - - [384, 128, 1, 512, 416, 416, 544, 544]
    - [71, 3.351]
  - - [384, 128, 1, 1024, 416, 416, 1056, 1056]
    - [81, 5.371]
  - - [384, 128, 1, 2048, 416, 416, 2080, 2080]
    - [65, 7.714]
  - - [384, 128, 1, 4096, 416, 416, 4128, 4128]
    - [65, 9.848]
  - - [384, 128, 1, 8192, 416, 416, 8224, 8224]
    - [77, 11.443]
  - - [384, 256, 1, 64, 416, 416, 384, 256]
    - [66, 1.046]
  - - [384, 256, 1, 128, 416, 416, 384, 256]
    - [66, 1.969]
  - - [384, 256, 1, 256, 416, 416, 384, 288]
    - [64, 3.543]
  - - [384, 256, 1, 512, 416, 416, 544, 544]
    - [64, 6.025]
  - - [384, 256, 1, 1024, 416, 416, 1056, 1056]
    - [89, 9.162]
  - - [384, 256, 1, 2048, 416, 416, 2080, 2080]
    - [65, 12.438]
  - - [384, 256, 1, 4096, 416, 416, 4128, 4128]
    - [70, 14.63]
  - - [384, 256, 1, 8192, 416, 416, 8224, 8224]
    - [77, 16.633]
  - - [384, 512, 1, 64, 416, 416, 384, 512]
    - [119, 2.026]
  - - [384, 512, 1, 128, 416, 416, 384, 512]
    - [107, 3.741]
  - - [384, 512, 1, 256, 416, 416, 384, 512]
    - [130, 6.632]
  - - [384, 512, 1, 512, 416, 416, 544, 544]
    - [130, 10.68]
  - - [384, 512, 1, 1024, 416, 416, 1056, 1056]
    - [97, 15.432]
  - - [384, 512, 1, 2048, 416, 416, 2080, 2080]
    - [115, 19.813]
  - - [384, 512, 1, 4096, 416, 416, 4128, 4128]
    - [123, 22.994]
  - - [384, 512, 1, 8192, 416, 416, 8224, 8224]
    - [115, 24.941]
  - - [384, 1024, 1, 64, 416, 416, 384, 1024]
    - [93, 3.861]
  - - [384, 1024, 1, 128, 416, 416, 384, 1024]
    - [126, 7.011]
  - - [384, 1024, 1, 256, 416, 416, 384, 1024]
    - [126, 11.946]
  - - [384, 1024, 1, 512, 416, 416, 544, 1024]
    - [115, 18.493]
  - - [384, 1024, 1, 1024, 416, 416, 1056, 1056]
    - [116, 25.31]
  - - [384, 1024, 1, 2048, 416, 416, 2080, 2080]
    - [109, 31.137]
  - - [384, 1024, 1, 4096, 416, 416, 4128, 4128]
    - [127, 34.565]
  - - [384, 1024, 1, 8192, 416, 416, 8224, 8224]
    - [130, 36.297]
  - - [384, 2048, 1, 64, 416, 416, 384, 2048]
    - [6, 6.981]
  - - [384, 2048, 1, 128, 416, 416, 384, 2048]
    - [99, 11.982]
  - - [384, 2048, 1, 256, 416, 416, 384, 2048]
    - [53, 18.802]
  - - [384, 2048, 1, 512, 416, 416, 544, 2048]
    - [59, 26.488]
  - - [384, 2048, 1, 1024, 416, 416, 1056, 2048]
    - [44, 32.846]
  - - [384, 2048, 1, 2048, 416, 416, 2080, 2080]
    - [43, 37.043]
  - - [384, 2048, 1, 4096, 416, 416, 4128, 4128]
    - [45, 38.923]
  - - [384, 2048, 1, 8192, 416, 416, 8224, 8224]
    - [45, 41.237]
  - - [384, 4096, 1, 64, 416, 416, 384, 4096]
    - [29, 11.814]
  - - [384, 4096, 1, 128, 416, 416, 384, 4096]
    - [61, 20.419]
  - - [384, 4096, 1, 256, 416, 416, 384, 4096]
    - [37, 32.799]
  - - [384, 4096, 1, 512, 416, 416, 544, 4096]
    - [37, 46.181]
  - - [384, 4096, 1, 1024, 416, 416, 1056, 4096]
    - [37, 58.088]
  - - [384, 4096, 1, 2048, 416, 416, 2080, 4096]
    - [29, 65.182]
  - - [384, 4096, 1, 4096, 416, 416, 4128, 4128]
    - [21, 68.416]
  - - [384, 4096, 1, 8192, 416, 416, 8224, 8224]
    - [22, 49.192]
  - - [384, 8192, 1, 64, 416, 416, 384, 8192]
    - [45, 20.533]
  - - [384, 8192, 1, 128, 416, 416, 384, 8192]
    - [27, 32.545]
  - - [384, 8192, 1, 256, 416, 416, 384, 8192]
    - [19, 46.574]
  - - [384, 8192, 1, 512, 416, 416, 544, 8192]
    - [48, 60.182]
  - - [384, 8192, 1, 1024, 416, 416, 1056, 8192]
    - [21, 70.014]
  - - [384, 8192, 1, 2048, 416, 416, 2080, 8192]
    - [48, 72.686]
  - - [384, 8192, 1, 4096, 416, 416, 4128, 8192]
    - [60, 72.962]
  - - [384, 8192, 1, 8192, 416, 416, 8224, 8224]
    - [20, 63.981]
  - - [768, 64, 1, 64, 800, 800, 768, 96]
    - [0, 0.512]
  - - [768, 64, 1, 128, 800, 800, 768, 160]
    - [66, 1.019]
  - - [768, 64, 1, 256, 800, 800, 768, 288]
    - [90, 1.904]
  - - [768, 64, 1, 512, 800, 800, 768, 544]
    - [74, 3.34]
  - - [768, 64, 1, 1024, 800, 800, 1056, 1056]
    - [65, 5.347]
  - - [768, 64, 1, 2048, 800, 800, 2080, 2080]
    - [65, 7.662]
  - - [768, 64, 1, 4096, 800, 800, 4128, 4128]
    - [77, 9.767]
  - - [768, 64, 1, 8192, 800, 800, 8224, 8224]
    - [70, 11.278]
  - - [768, 128, 1, 64, 800, 800, 768, 128]
    - [72, 1.035]
  - - [768, 128, 1, 128, 800, 800, 768, 160]
    - [66, 1.969]
  - - [768, 128, 1, 256, 800, 800, 768, 288]
    - [66, 3.561]
  - - [768, 128, 1, 512, 800, 800, 768, 544]
    - [65, 6.043]
  - - [768, 128, 1, 1024, 800, 800, 1056, 1056]
    - [66, 9.215]
  - - [768, 128, 1, 2048, 800, 800, 2080, 2080]
    - [64, 12.45]
  - - [768, 128, 1, 4096, 800, 800, 4128, 4128]
    - [73, 14.893]
  - - [768, 128, 1, 8192, 800, 800, 8224, 8224]
    - [70, 16.746]
  - - [768, 256, 1, 64, 800, 800, 768, 256]
    - [120, 2.019]
  - - [768, 256, 1, 128, 800, 800, 768, 256]
    - [108, 3.764]
  - - [768, 256, 1, 256, 800, 800, 768, 288]
    - [116, 6.63]
  - - [768, 256, 1, 512, 800, 800, 768, 544]
    - [97, 10.711]
  - - [768, 256, 1, 1024, 800, 800, 1056, 1056]
    - [116, 15.529]
  - - [768, 256, 1, 2048, 800, 800, 2080, 2080]
    - [115, 19.946]
  - - [768, 256, 1, 4096, 800, 800, 4128, 4128]
    - [109, 22.55]
  - - [768, 256, 1, 8192, 800, 800, 8224, 8224]
    - [110, 24.958]
  - - [768, 512, 1, 64, 800, 800, 768, 512]
    - [93, 3.868]
  - - [768, 512, 1, 128, 800, 800, 768, 512]
    - [100, 7.049]
  - - [768, 512, 1, 256, 800, 800, 768, 512]
    - [100, 12.005]
  - - [768, 512, 1, 512, 800, 800, 768, 544]
    - [96, 18.507]
  - - [768, 512, 1, 1024, 800, 800, 1056, 1056]
    - [97, 25.348]
  - - [768, 512, 1, 2048, 800, 800, 2080, 2080]
    - [94, 31.028]
  - - [768, 512, 1, 4096, 800, 800, 4128, 4128]
    - [110, 34.663]
  - - [768, 512, 1, 8192, 800, 800, 8224, 8224]
    - [115, 36.32]
  - - [768, 1024, 1, 64, 800, 800, 768, 1024]
    - [4, 6.98]
  - - [768, 1024, 1, 128, 800, 800, 768, 1024]
    - [125, 12.03]
  - - [768, 1024, 1, 256, 800, 800, 768, 1024]
    - [99, 18.912]
  - - [768, 1024, 1, 512, 800, 800, 768, 1024]
    - [45, 26.667]
  - - [768, 1024, 1, 1024, 800, 800, 1056, 1056]
    - [45, 33.326]
  - - [768, 1024, 1, 2048, 800, 800, 2080, 2080]
    - [45, 38.028]
  - - [768, 1024, 1, 4096, 800, 800, 4128, 4128]
    - [42, 39.14]
  - - [768, 1024, 1, 8192, 800, 800, 8224, 8224]
    - [42, 41.826]
  - - [768, 2048, 1, 64, 800, 800, 768, 2048]
    - [43, 11.685]
  - - [768, 2048, 1, 128, 800, 800, 768, 2048]
    - [21, 20.37]
  - - [768, 2048, 1, 256, 800, 800, 768, 2048]
    - [41, 32.511]
  - - [768, 2048, 1, 512, 800, 800, 768, 2048]
    - [29, 46.135]
  - - [768, 2048, 1, 1024, 800, 800, 1056, 2048]
    - [41, 57.944]
  - - [768, 2048, 1, 2048, 800, 800, 2080, 2080]
    - [37, 65.245]
  - - [768, 2048, 1, 4096, 800, 800, 4128, 4128]
    - [29, 68.434]
  - - [768, 2048, 1, 8192, 800, 800, 8224, 8224]
    - [60, 72.102]
  - - [768, 4096, 1, 64, 800, 800, 768, 4096]
    - [43, 20.363]
  - - [768, 4096, 1, 128, 800, 800, 768, 4096]
    - [27, 32.756]
  - - [768, 4096, 1, 256, 800, 800, 768, 4096]
    - [48, 46.578]
  - - [768, 4096, 1, 512, 800, 800, 768, 4096]
    - [48, 60.025]
  - - [768, 4096, 1, 1024, 800, 800, 1056, 4096]
    - [21, 70.368]
  - - [768, 4096, 1, 2048, 800, 800, 2080, 4096]
    - [21, 72.924]
  - - [768, 4096, 1, 4096, 800, 800, 4128, 4128]
    - [47, 76.121]
  - - [768, 4096, 1, 8192, 800, 800, 8224, 8224]
    - [20, 64.01]
  - - [768, 8192, 1, 64, 800, 800, 768, 8192]
    - [50, 29.326]
  - - [768, 8192, 1, 128, 800, 800, 768, 8192]
    - [57, 43.209]
  - - [768, 8192, 1, 256, 800, 800, 768, 8192]
    - [17, 58.105]
  - - [768, 8192, 1, 512, 800, 800, 768, 8192]
    - [44, 68.434]
  - - [768, 8192, 1, 1024, 800, 800, 1056, 8192]
    - [42, 71.531]
  - - [768, 8192, 1, 2048, 800, 800, 2080, 8192]
    - [24, 74.658]
  - - [768, 8192, 1, 4096, 800, 800, 4128, 8192]
    - [16, 63.497]
  - - [768, 8192, 1, 8192, 800, 800, 8224, 8224]
    - [17, 58.487]
  - - [1536, 64, 1, 64, 1568, 1568, 1536, 96]
    - [78, 0.993]
  - - [1536, 64, 1, 128, 1568, 1568, 1536, 160]
    - [74, 1.951]
  - - [1536, 64, 1, 256, 1568, 1568, 1536, 288]
    - [66, 3.57]
  - - [1536, 64, 1, 512, 1568, 1568, 1536, 544]
    - [66, 6.02]
  - - [1536, 64, 1, 1024, 1568, 1568, 1536, 1056]
    - [73, 9.178]
  - - [1536, 64, 1, 2048, 1568, 1568, 2080, 2080]
    - [65, 12.447]
  - - [1536, 64, 1, 4096, 1568, 1568, 4128, 4128]
    - [65, 15.13]
  - - [1536, 64, 1, 8192, 1568, 1568, 8224, 8224]
    - [65, 16.754]
  - - [1536, 128, 1, 64, 1568, 1568, 1536, 128]
    - [119, 2.033]
  - - [1536, 128, 1, 128, 1568, 1568, 1536, 160]
    - [110, 3.776]
  - - [1536, 128, 1, 256, 1568, 1568, 1536, 288]
    - [116, 6.607]
  - - [1536, 128, 1, 512, 1568, 1568, 1536, 544]
    - [116, 10.72]
  - - [1536, 128, 1, 1024, 1568, 1568, 1536, 1056]
    - [97, 15.433]
  - - [1536, 128, 1, 2048, 1568, 1568, 2080, 2080]
    - [96, 19.825]
  - - [1536, 128, 1, 4096, 1568, 1568, 4128, 4128]
    - [97, 22.964]
  - - [1536, 128, 1, 8192, 1568, 1568, 8224, 8224]
    - [116, 24.89]
  - - [1536, 256, 1, 64, 1568, 1568, 1536, 256]
    - [125, 3.838]
  - - [1536, 256, 1, 128, 1568, 1568, 1536, 256]
    - [126, 7.006]
  - - [1536, 256, 1, 256, 1568, 1568, 1536, 288]
    - [96, 11.969]
  - - [1536, 256, 1, 512, 1568, 1568, 1536, 544]
    - [116, 18.517]
  - - [1536, 256, 1, 1024, 1568, 1568, 1536, 1056]
    - [115, 25.556]
  - - [1536, 256, 1, 2048, 1568, 1568, 2080, 2080]
    - [128, 31.065]
  - - [1536, 256, 1, 4096, 1568, 1568, 4128, 4128]
    - [110, 34.616]
  - - [1536, 256, 1, 8192, 1568, 1568, 8224, 8224]
    - [115, 36.183]
  - - [1536, 512, 1, 64, 1568, 1568, 1536, 512]
    - [118, 6.986]
  - - [1536, 512, 1, 128, 1568, 1568, 1536, 512]
    - [7, 12.049]
  - - [1536, 512, 1, 256, 1568, 1568, 1536, 512]
    - [99, 19.006]
  - - [1536, 512, 1, 512, 1568, 1568, 1536, 544]
    - [117, 26.204]
  - - [1536, 512, 1, 1024, 1568, 1568, 1536, 1056]
    - [111, 32.671]
  - - [1536, 512, 1, 2048, 1568, 1568, 2080, 2080]
    - [98, 37.073]
  - - [1536, 512, 1, 4096, 1568, 1568, 4128, 4128]
    - [15, 38.233]
  - - [1536, 512, 1, 8192, 1568, 1568, 8224, 8224]
    - [16, 40.843]
  - - [1536, 1024, 1, 64, 1568, 1568, 1536, 1024]
    - [34, 11.676]
  - - [1536, 1024, 1, 128, 1568, 1568, 1536, 1024]
    - [14, 20.265]
  - - [1536, 1024, 1, 256, 1568, 1568, 1536, 1024]
    - [16, 32.432]
  - - [1536, 1024, 1, 512, 1568, 1568, 1536, 1024]
    - [14, 46.505]
  - - [1536, 1024, 1, 1024, 1568, 1568, 1536, 1056]
    - [37, 57.696]
  - - [1536, 1024, 1, 2048, 1568, 1568, 2080, 2080]
    - [14, 64.968]
  - - [1536, 1024, 1, 4096, 1568, 1568, 4128, 4128]
    - [13, 69.395]
  - - [1536, 1024, 1, 8192, 1568, 1568, 8224, 8224]
    - [40, 68.573]
  - - [1536, 2048, 1, 64, 1568, 1568, 1536, 2048]
    - [18, 20.817]
  - - [1536, 2048, 1, 128, 1568, 1568, 1536, 2048]
    - [45, 32.739]
  - - [1536, 2048, 1, 256, 1568, 1568, 1536, 2048]
    - [21, 46.635]
  - - [1536, 2048, 1, 512, 1568, 1568, 1536, 2048]
    - [21, 59.889]
  - - [1536, 2048, 1, 1024, 1568, 1568, 1536, 2048]
    - [21, 70.307]
  - - [1536, 2048, 1, 2048, 1568, 1568, 2080, 2080]
    - [29, 72.552]
  - - [1536, 2048, 1, 4096, 1568, 1568, 4128, 4128]
    - [29, 77.378]
  - - [1536, 2048, 1, 8192, 1568, 1568, 8224, 8224]
    - [20, 70.935]
  - - [1536, 4096, 1, 64, 1568, 1568, 1536, 4096]
    - [23, 29.289]
  - - [1536, 4096, 1, 128, 1568, 1568, 1536, 4096]
    - [34, 43.331]
  - - [1536, 4096, 1, 256, 1568, 1568, 1536, 4096]
    - [52, 57.991]
  - - [1536, 4096, 1, 512, 1568, 1568, 1536, 4096]
    - [17, 68.267]
  - - [1536, 4096, 1, 1024, 1568, 1568, 1536, 4096]
    - [42, 71.514]
  - - [1536, 4096, 1, 2048, 1568, 1568, 2080, 4096]
    - [26, 73.35]
  - - [1536, 4096, 1, 4096, 1568, 1568, 4128, 4128]
    - [43, 66.013]
  - - [1536, 4096, 1, 8192, 1568, 1568, 8224, 8224]
    - [26, 61.623]
  - - [1536, 8192, 1, 64, 1568, 1568, 1536, 8192]
    - [50, 39.697]
  - - [1536, 8192, 1, 128, 1568, 1568, 1536, 8192]
    - [17, 54.909]
  - - [1536, 8192, 1, 256, 1568, 1568, 1536, 8192]
    - [58, 67.874]
  - - [1536, 8192, 1, 512, 1568, 1568, 1536, 8192]
    - [17, 72.647]
  - - [1536, 8192, 1, 1024, 1568, 1568, 1536, 8192]
    - [31, 75.499]
  - - [1536, 8192, 1, 2048, 1568, 1568, 2080, 8192]
    - [41, 67.789]
  - - [1536, 8192, 1, 4096, 1568, 1568, 4128, 8192]
    - [16, 64.309]
  - - [1536, 8192, 1, 8192, 1568, 1568, 8224, 8224]
    - [44, 63.244]
  - - [3072, 64, 1, 64, 3104, 3104, 3072, 96]
    - [2, 1.909]
  - - [3072, 64, 1, 128, 3104, 3104, 3072, 160]
    - [12, 3.695]
  - - [3072, 64, 1, 256, 3104, 3104, 3072, 288]
    - [123, 6.615]
  - - [3072, 64, 1, 512, 3104, 3104, 3072, 544]
    - [104, 10.664]
  - - [3072, 64, 1, 1024, 3104, 3104, 3072, 1056]
    - [96, 15.43]
  - - [3072, 64, 1, 2048, 3104, 3104, 3072, 2080]
    - [116, 19.762]
  - - [3072, 64, 1, 4096, 3104, 3104, 4128, 4128]
    - [129, 22.6]
  - - [3072, 64, 1, 8192, 3104, 3104, 8224, 8224]
    - [115, 24.981]
  - - [3072, 128, 1, 64, 3104, 3104, 3072, 128]
    - [119, 3.876]
  - - [3072, 128, 1, 128, 3104, 3104, 3072, 160]
    - [112, 7.035]
  - - [3072, 128, 1, 256, 3104, 3104, 3072, 288]
    - [96, 11.991]
  - - [3072, 128, 1, 512, 3104, 3104, 3072, 544]
    - [115, 18.561]
  - - [3072, 128, 1, 1024, 3104, 3104, 3072, 1056]
    - [115, 25.435]
  - - [3072, 128, 1, 2048, 3104, 3104, 3072, 2080]
    - [116, 31.335]
  - - [3072, 128, 1, 4096, 3104, 3104, 4128, 4128]
    - [114, 34.755]
  - - [3072, 128, 1, 8192, 3104, 3104, 8224, 8224]
    - [109, 36.375]
  - - [3072, 256, 1, 64, 3104, 3104, 3072, 256]
    - [125, 6.957]
  - - [3072, 256, 1, 128, 3104, 3104, 3072, 256]
    - [6, 12.053]
  - - [3072, 256, 1, 256, 3104, 3104, 3072, 288]
    - [118, 18.807]
  - - [3072, 256, 1, 512, 3104, 3104, 3072, 544]
    - [98, 26.104]
  - - [3072, 256, 1, 1024, 3104, 3104, 3072, 1056]
    - [118, 32.191]
  - - [3072, 256, 1, 2048, 3104, 3104, 3072, 2080]
    - [116, 36.55]
  - - [3072, 256, 1, 4096, 3104, 3104, 4128, 4128]
    - [32, 37.905]
  - - [3072, 256, 1, 8192, 3104, 3104, 8224, 8224]
    - [22, 39.918]
  - - [3072, 512, 1, 64, 3104, 3104, 3072, 512]
    - [45, 11.586]
  - - [3072, 512, 1, 128, 3104, 3104, 3072, 512]
    - [21, 20.001]
  - - [3072, 512, 1, 256, 3104, 3104, 3072, 512]
    - [54, 32.265]
  - - [3072, 512, 1, 512, 3104, 3104, 3072, 544]
    - [37, 45.717]
  - - [3072, 512, 1, 1024, 3104, 3104, 3072, 1056]
    - [21, 57.394]
  - - [3072, 512, 1, 2048, 3104, 3104, 3072, 2080]
    - [47, 64.492]
  - - [3072, 512, 1, 4096, 3104, 3104, 4128, 4128]
    - [61, 68.003]
  - - [3072, 512, 1, 8192, 3104, 3104, 8224, 8224]
    - [43, 65.2]
  - - [3072, 1024, 1, 64, 3104, 3104, 3072, 1024]
    - [18, 20.377]
  - - [3072, 1024, 1, 128, 3104, 3104, 3072, 1024]
    - [27, 32.637]
  - - [3072, 1024, 1, 256, 3104, 3104, 3072, 1024]
    - [21, 46.561]
  - - [3072, 1024, 1, 512, 3104, 3104, 3072, 1024]
    - [48, 60.035]
  - - [3072, 1024, 1, 1024, 3104, 3104, 3072, 1056]
    - [48, 70.375]
  - - [3072, 1024, 1, 2048, 3104, 3104, 3072, 2080]
    - [48, 72.703]
  - - [3072, 1024, 1, 4096, 3104, 3104, 4128, 4128]
    - [48, 76.963]
  - - [3072, 1024, 1, 8192, 3104, 3104, 8224, 8224]
    - [61, 68.316]
  - - [3072, 2048, 1, 64, 3104, 3104, 3072, 2048]
    - [39, 29.163]
  - - [3072, 2048, 1, 128, 3104, 3104, 3072, 2048]
    - [53, 43.083]
  - - [3072, 2048, 1, 256, 3104, 3104, 3072, 2048]
    - [58, 57.994]
  - - [3072, 2048, 1, 512, 3104, 3104, 3072, 2048]
    - [58, 68.029]
  - - [3072, 2048, 1, 1024, 3104, 3104, 3072, 2048]
    - [42, 71.577]
  - - [3072, 2048, 1, 2048, 3104, 3104, 3072, 2080]
    - [56, 74.677]
  - - [3072, 2048, 1, 4096, 3104, 3104, 4128, 4128]
    - [24, 67.305]
  - - [3072, 2048, 1, 8192, 3104, 3104, 8224, 8224]
    - [26, 61.826]
  - - [3072, 4096, 1, 64, 3104, 3104, 3072, 4096]
    - [30, 39.651]
  - - [3072, 4096, 1, 128, 3104, 3104, 3072, 4096]
    - [17, 54.65]
  - - [3072, 4096, 1, 256, 3104, 3104, 3072, 4096]
    - [17, 67.998]
  - - [3072, 4096, 1, 512, 3104, 3104, 3072, 4096]
    - [17, 72.713]
  - - [3072, 4096, 1, 1024, 3104, 3104, 3072, 4096]
    - [18, 75.957]
  - - [3072, 4096, 1, 2048, 3104, 3104, 3072, 4096]
    - [53, 65.5]
  - - [3072, 4096, 1, 4096, 3104, 3104, 4128, 4128]
    - [58, 66.655]
  - - [3072, 4096, 1, 8192, 3104, 3104, 8224, 8224]
    - [26, 64.288]
  - - [3072, 8192, 1, 64, 3104, 3104, 3072, 8192]
    - [30, 49.01]
  - - [3072, 8192, 1, 128, 3104, 3104, 3072, 8192]
    - [26, 63.264]
  - - [3072, 8192, 1, 256, 3104, 3104, 3072, 8192]
    - [58, 71.118]
  - - [3072, 8192, 1, 512, 3104, 3104, 3072, 8192]
    - [51, 76.573]
  - - [3072, 8192, 1, 1024, 3104, 3104, 3072, 8192]
    - [52, 68.59]
  - - [3072, 8192, 1, 2048, 3104, 3104, 3072, 8192]
    - [13, 65.885]
  - - [3072, 8192, 1, 4096, 3104, 3104, 4128, 8192]
    - [52, 65.416]
  - - [3072, 8192, 1, 8192, 3104, 3104, 8224, 8224]
    - [17, 64.606]
  - - [6144, 64, 1, 64, 6176, 6176, 6144, 96]
    - [11, 3.624]
  - - [6144, 64, 1, 128, 6176, 6176, 6144, 160]
    - [5, 6.972]
  - - [6144, 64, 1, 256, 6176, 6176, 6144, 288]
    - [97, 11.991]
  - - [6144, 64, 1, 512, 6176, 6176, 6144, 544]
    - [116, 18.409]
  - - [6144, 64, 1, 1024, 6176, 6176, 6144, 1056]
    - [114, 25.478]
  - - [6144, 64, 1, 2048, 6176, 6176, 6144, 2080]
    - [115, 31.362]
  - - [6144, 64, 1, 4096, 6176, 6176, 6144, 4128]
    - [115, 34.709]
  - - [6144, 64, 1, 8192, 6176, 6176, 8224, 8224]
    - [114, 36.863]
  - - [6144, 128, 1, 64, 6176, 6176, 6144, 128]
    - [12, 6.903]
  - - [6144, 128, 1, 128, 6176, 6176, 6144, 160]
    - [106, 12.021]
  - - [6144, 128, 1, 256, 6176, 6176, 6144, 288]
    - [131, 18.757]
  - - [6144, 128, 1, 512, 6176, 6176, 6144, 544]
    - [98, 26.355]
  - - [6144, 128, 1, 1024, 6176, 6176, 6144, 1056]
    - [118, 32.599]
  - - [6144, 128, 1, 2048, 6176, 6176, 6144, 2080]
    - [97, 37.062]
  - - [6144, 128, 1, 4096, 6176, 6176, 6144, 4128]
    - [95, 37.854]
  - - [6144, 128, 1, 8192, 6176, 6176, 8224, 8224]
    - [49, 40.536]
  - - [6144, 256, 1, 64, 6176, 6176, 6144, 256]
    - [45, 11.892]
  - - [6144, 256, 1, 128, 6176, 6176, 6144, 256]
    - [48, 20.987]
  - - [6144, 256, 1, 256, 6176, 6176, 6144, 288]
    - [21, 32.859]
  - - [6144, 256, 1, 512, 6176, 6176, 6144, 544]
    - [21, 46.617]
  - - [6144, 256, 1, 1024, 6176, 6176, 6144, 1056]
    - [46, 57.888]
  - - [6144, 256, 1, 2048, 6176, 6176, 6144, 2080]
    - [48, 65.152]
  - - [6144, 256, 1, 4096, 6176, 6176, 6144, 4128]
    - [21, 68.413]
  - - [6144, 256, 1, 8192, 6176, 6176, 8224, 8224]
    - [15, 58.156]
  - - [6144, 512, 1, 64, 6176, 6176, 6144, 512]
    - [18, 20.149]
  - - [6144, 512, 1, 128, 6176, 6176, 6144, 512]
    - [45, 32.49]
  - - [6144, 512, 1, 256, 6176, 6176, 6144, 512]
    - [48, 46.093]
  - - [6144, 512, 1, 512, 6176, 6176, 6144, 544]
    - [21, 60.014]
  - - [6144, 512, 1, 1024, 6176, 6176, 6144, 1056]
    - [48, 70.373]
  - - [6144, 512, 1, 2048, 6176, 6176, 6144, 2080]
    - [48, 72.773]
  - - [6144, 512, 1, 4096, 6176, 6176, 6144, 4128]
    - [36, 73.34]
  - - [6144, 512, 1, 8192, 6176, 6176, 8224, 8224]
    - [61, 65.25]
  - - [6144, 1024, 1, 64, 6176, 6176, 6144, 1024]
    - [23, 28.747]
  - - [6144, 1024, 1, 128, 6176, 6176, 6144, 1024]
    - [25, 42.966]
  - - [6144, 1024, 1, 256, 6176, 6176, 6144, 1024]
    - [58, 57.669]
  - - [6144, 1024, 1, 512, 6176, 6176, 6144, 1024]
    - [17, 67.912]
  - - [6144, 1024, 1, 1024, 6176, 6176, 6144, 1056]
    - [17, 71.31]
  - - [6144, 1024, 1, 2048, 6176, 6176, 6144, 2080]
    - [51, 72.962]
  - - [6144, 1024, 1, 4096, 6176, 6176, 6144, 4128]
    - [55, 67.189]
  - - [6144, 1024, 1, 8192, 6176, 6176, 8224, 8224]
    - [44, 60.039]
  - - [6144, 2048, 1, 64, 6176, 6176, 6144, 2048]
    - [50, 39.443]
  - - [6144, 2048, 1, 128, 6176, 6176, 6144, 2048]
    - [45, 54.514]
  - - [6144, 2048, 1, 256, 6176, 6176, 6144, 2048]
    - [44, 67.876]
  - - [6144, 2048, 1, 512, 6176, 6176, 6144, 2048]
    - [26, 72.49]
  - - [6144, 2048, 1, 1024, 6176, 6176, 6144, 2048]
    - [44, 76.487]
  - - [6144, 2048, 1, 2048, 6176, 6176, 6144, 2080]
    - [33, 67.785]
  - - [6144, 2048, 1, 4096, 6176, 6176, 6144, 4128]
    - [26, 66.539]
  - - [6144, 2048, 1, 8192, 6176, 6176, 8224, 8224]
    - [42, 62.099]
  - - [6144, 4096, 1, 64, 6176, 6176, 6144, 4096]
    - [62, 48.7]
  - - [6144, 4096, 1, 128, 6176, 6176, 6144, 4096]
    - [59, 62.832]
  - - [6144, 4096, 1, 256, 6176, 6176, 6144, 4096]
    - [44, 71.414]
  - - [6144, 4096, 1, 512, 6176, 6176, 6144, 4096]
    - [16, 76.503]
  - - [6144, 4096, 1, 1024, 6176, 6176, 6144, 4096]
    - [42, 68.402]
  - - [6144, 4096, 1, 2048, 6176, 6176, 6144, 4096]
    - [18, 67.812]
  - - [6144, 4096, 1, 4096, 6176, 6176, 6144, 4128]
    - [59, 66.702]
  - - [6144, 4096, 1, 8192, 6176, 6176, 8224, 8224]
    - [53, 63.798]
  - - [6144, 8192, 1, 64, 6176, 6176, 6144, 8192]
    - [62, 50.533]
  - - [6144, 8192, 1, 128, 6176, 6176, 6144, 8192]
    - [33, 65.035]
  - - [6144, 8192, 1, 256, 6176, 6176, 6144, 8192]
    - [41, 69.927]
  - - [6144, 8192, 1, 512, 6176, 6176, 6144, 8192]
    - [44, 67.324]
  - - [6144, 8192, 1, 1024, 6176, 6176, 6144, 8192]
    - [59, 63.378]
  - - [6144, 8192, 1, 2048, 6176, 6176, 6144, 8192]
    - [52, 67.172]
  - - [6144, 8192, 1, 4096, 6176, 6176, 6144, 8192]
    - [58, 65.955]
  - - [6144, 8192, 1, 8192, 6176, 6176, 8224, 8224]
    - [58, 65.289]
- null
- null
- DeviceEfficiency
