library/src/blas3/Tensile/Logic/asm_full/navi31/navi31_Cijk_Ailk_Bljk_I8II_BH_GB.yaml
- {MinimumRequiredVersion: 4.35.0}
- navi31
- gfx1100
- [Device 73bf]
    SolutionIndex: 0
    SolutionNameMin: Cijk_Ailk_Bljk_I8II_BH_MT32x32x16_MI16x16x16x1_SN_1LDSB0_AMAS0_GRVW16_IU1_SIA1_SU0_SUS0_SVW1_TT1_16_VW1_WGM4
    SolutionIndex: 1
    SolutionNameMin: Cijk_Ailk_Bljk_I8II_BH_MT32x32x16_MI16x16x16x1_SN_1LDSB1_AMAS0_GRVW8_IU1_SIA2_SU32_SUS128_SVW1_TT1_16_VW1_WGM4
    SolutionIndex: 2
    SolutionNameMin: Cijk_Ailk_Bljk_I8II_BH_MT64x64x16_MI16x16x16x1_SN_1LDSB0_AMAS0_GRVW4_IU1_SIA1_SU0_SUS0_SVW1_TT2_32_VW1_WGM4
    SolutionIndex: 3
    SolutionNameMin: Cijk_Ailk_Bljk_I8II_BH_MT64x64x16_MI16x16x16x1_SN_1LDSB0_AMAS3_GRVW8_IU1_SIA1_SU0_SUS0_SVW2_TT2_32_VW2_WGM4
    SolutionIndex: 4
    SolutionNameMin: Cijk_Ailk_Bljk_I8II_BH_MT64x64x16_MI16x16x16x1_SN_1LDSB0_AMAS3_GRVW16_IU1_SIA1_SU0_SUS0_SVW2_TT2_32_VW2_WGM4
    SolutionIndex: 5
    SolutionNameMin: Cijk_Ailk_Bljk_I8II_BH_MT64x64x16_MI16x16x16x1_SN_1LDSB1_AMAS0_GRVW8_IU1_SIA2_SU0_SUS0_SVW1_TT2_32_VW1_WGM4
    SolutionIndex: 6
    SolutionNameMin: Cijk_Ailk_Bljk_I8II_BH_MT64x64x16_MI16x16x16x1_SN_1LDSB1_AMAS0_GRVW16_IU1_SIA2_SU0_SUS0_SVW1_TT2_32_VW1_WGM4
    SolutionIndex: 7
    SolutionNameMin: Cijk_Ailk_Bljk_I8II_BH_MT64x64x16_MI16x16x16x1_SN_1LDSB0_AMAS3_GRVW16_IU1_SIA3_SU0_SUS0_SVW2_TT2_32_VW2_WGM4
    SolutionIndex: 8
    SolutionNameMin: Cijk_Ailk_Bljk_I8II_BH_MT64x64x16_MI16x16x16x1_SN_1LDSB1_AMAS0_GRVW8_IU1_SIA2_SU32_SUS128_SVW1_TT2_32_VW1_WGM4
    SolutionIndex: 9
    SolutionNameMin: Cijk_Ailk_Bljk_I8II_BH_MT64x64x16_MI16x16x16x1_SN_1LDSB1_AMAS3_GRVW8_IU1_SIA2_SU32_SUS128_SVW2_TT2_32_VW2_WGM4
    SolutionIndex: 10
    SolutionNameMin: Cijk_Ailk_Bljk_I8II_BH_MT64x64x16_MI16x16x16x1_SN_1LDSB1_AMAS3_GRVW16_IU1_SIA2_SU32_SUS128_SVW2_TT2_32_VW2_WGM4
    SolutionIndex: 11
    SolutionNameMin: Cijk_Ailk_Bljk_I8II_BH_MT64x64x16_MI16x16x16x1_SN_1LDSB0_AMAS0_GRVW8_IU1_SIA3_SU32_SUS128_SVW1_TT2_32_VW1_WGM4
    SolutionIndex: 12
    SolutionNameMin: Cijk_Ailk_Bljk_I8II_BH_MT64x64x16_MI16x16x16x1_SN_1LDSB0_AMAS3_GRVW8_IU1_SIA3_SU32_SUS128_SVW2_TT2_32_VW2_WGM4
    SolutionIndex: 13
    SolutionNameMin: Cijk_Ailk_Bljk_I8II_BH_MT64x64x16_MI16x16x16x1_SN_1LDSB0_AMAS3_GRVW16_IU1_SIA3_SU32_SUS128_SVW2_TT2_32_VW2_WGM4
    SolutionIndex: 14
    SolutionNameMin: Cijk_Ailk_Bljk_I8II_BH_MT64x64x16_MI16x16x16x1_SN_1LDSB1_AMAS3_GRVW16_IU1_SIA2_SU32_SUS256_SVW2_TT2_32_VW2_WGM4
    SolutionIndex: 15
    SolutionNameMin: Cijk_Ailk_Bljk_I8II_BH_MT64x64x16_MI16x16x16x1_SN_1LDSB0_AMAS0_GRVW4_IU1_SIA3_SU32_SUS256_SVW1_TT2_32_VW1_WGM4
    SolutionIndex: 16
    SolutionNameMin: Cijk_Ailk_Bljk_I8II_BH_MT64x64x16_MI16x16x16x1_SN_1LDSB0_AMAS0_GRVW16_IU1_SIA1_SU0_SUS0_SVW1_TT2_32_VW1_WGM8
    SolutionIndex: 17
    SolutionNameMin: Cijk_Ailk_Bljk_I8II_BH_MT64x64x16_MI16x16x16x1_SN_1LDSB1_AMAS3_GRVW8_IU1_SIA2_SU0_SUS0_SVW2_TT2_32_VW2_WGM8
    SolutionIndex: 18
    SolutionNameMin: Cijk_Ailk_Bljk_I8II_BH_MT64x64x16_MI16x16x16x1_SN_1LDSB1_AMAS0_GRVW16_IU1_SIA2_SU0_SUS0_SVW1_TT2_32_VW1_WGM8
    SolutionIndex: 19
    SolutionNameMin: Cijk_Ailk_Bljk_I8II_BH_MT64x64x16_MI16x16x16x1_SN_1LDSB0_AMAS0_GRVW8_IU1_SIA3_SU0_SUS0_SVW1_TT2_32_VW1_WGM8
    SolutionIndex: 20
    SolutionNameMin: Cijk_Ailk_Bljk_I8II_BH_MT64x64x16_MI16x16x16x1_SN_1LDSB0_AMAS3_GRVW8_IU1_SIA3_SU0_SUS0_SVW2_TT2_32_VW2_WGM8
    SolutionIndex: 21
    SolutionNameMin: Cijk_Ailk_Bljk_I8II_BH_MT64x64x16_MI16x16x16x1_SN_1LDSB1_AMAS0_GRVW4_IU1_SIA2_SU32_SUS128_SVW1_TT2_32_VW1_WGM8
    SolutionIndex: 22
    SolutionNameMin: Cijk_Ailk_Bljk_I8II_BH_MT64x64x16_MI16x16x16x1_SN_1LDSB1_AMAS3_GRVW8_IU1_SIA2_SU32_SUS128_SVW2_TT2_32_VW2_WGM8
    SolutionIndex: 23
    SolutionNameMin: Cijk_Ailk_Bljk_I8II_BH_MT64x64x16_MI16x16x16x1_SN_1LDSB1_AMAS3_GRVW16_IU1_SIA2_SU32_SUS128_SVW2_TT2_32_VW2_WGM8
    SolutionIndex: 24
    SolutionNameMin: Cijk_Ailk_Bljk_I8II_BH_MT64x64x16_MI16x16x16x1_SN_1LDSB0_AMAS3_GRVW16_IU1_SIA3_SU32_SUS256_SVW2_TT2_32_VW2_WGM8
    SolutionIndex: 25
    SolutionNameMin: Cijk_Ailk_Bljk_I8II_BH_MT128x128x16_MI16x16x16x1_SN_1LDSB0_AMAS0_GRVW4_IU1_SIA1_SU0_SUS0_SVW1_TT4_64_VW1_WGM4
    SolutionIndex: 26
    SolutionNameMin: Cijk_Ailk_Bljk_I8II_BH_MT128x128x16_MI16x16x16x1_SN_1LDSB0_AMAS3_GRVW4_IU1_SIA1_SU0_SUS0_SVW4_TT4_64_VW4_WGM4
    SolutionIndex: 27
    SolutionNameMin: Cijk_Ailk_Bljk_I8II_BH_MT128x128x16_MI16x16x16x1_SN_1LDSB0_AMAS0_GRVW8_IU1_SIA1_SU0_SUS0_SVW1_TT4_64_VW1_WGM4
    SolutionIndex: 28
    SolutionNameMin: Cijk_Ailk_Bljk_I8II_BH_MT128x128x16_MI16x16x16x1_SN_1LDSB0_AMAS3_GRVW8_IU1_SIA1_SU0_SUS0_SVW2_TT4_64_VW2_WGM4
    SolutionIndex: 29
    SolutionNameMin: Cijk_Ailk_Bljk_I8II_BH_MT128x128x16_MI16x16x16x1_SN_1LDSB0_AMAS3_GRVW8_IU1_SIA1_SU0_SUS0_SVW4_TT4_64_VW4_WGM4
    SolutionIndex: 30
    SolutionNameMin: Cijk_Ailk_Bljk_I8II_BH_MT128x128x16_MI16x16x16x1_SN_1LDSB0_AMAS0_GRVW16_IU1_SIA1_SU0_SUS0_SVW1_TT4_64_VW1_WGM4
    SolutionIndex: 31
    SolutionNameMin: Cijk_Ailk_Bljk_I8II_BH_MT128x128x16_MI16x16x16x1_SN_1LDSB0_AMAS3_GRVW16_IU1_SIA1_SU0_SUS0_SVW2_TT4_64_VW2_WGM4
    SolutionIndex: 32
    SolutionNameMin: Cijk_Ailk_Bljk_I8II_BH_MT128x128x16_MI16x16x16x1_SN_1LDSB0_AMAS3_GRVW16_IU1_SIA1_SU0_SUS0_SVW4_TT4_64_VW4_WGM4
    SolutionIndex: 33
    SolutionNameMin: Cijk_Ailk_Bljk_I8II_BH_MT128x128x16_MI16x16x16x1_SN_1LDSB1_AMAS3_GRVW8_IU1_SIA2_SU0_SUS0_SVW2_TT4_64_VW2_WGM4
    SolutionIndex: 34
    SolutionNameMin: Cijk_Ailk_Bljk_I8II_BH_MT128x128x16_MI16x16x16x1_SN_1LDSB1_AMAS3_GRVW16_IU1_SIA2_SU0_SUS0_SVW2_TT4_64_VW2_WGM4
    SolutionIndex: 35
    SolutionNameMin: Cijk_Ailk_Bljk_I8II_BH_MT128x128x16_MI16x16x16x1_SN_1LDSB0_AMAS0_GRVW8_IU1_SIA3_SU0_SUS0_SVW1_TT4_64_VW1_WGM4
    SolutionIndex: 36
    SolutionNameMin: Cijk_Ailk_Bljk_I8II_BH_MT128x128x16_MI16x16x16x1_SN_1LDSB0_AMAS3_GRVW16_IU1_SIA3_SU0_SUS0_SVW4_TT4_64_VW4_WGM4
    SolutionIndex: 37
    SolutionNameMin: Cijk_Ailk_Bljk_I8II_BH_MT128x128x16_MI16x16x16x1_SN_1LDSB0_AMAS3_GRVW4_IU1_SIA1_SU32_SUS128_SVW2_TT4_64_VW2_WGM4
    SolutionIndex: 38
    SolutionNameMin: Cijk_Ailk_Bljk_I8II_BH_MT128x128x16_MI16x16x16x1_SN_1LDSB0_AMAS3_GRVW8_IU1_SIA1_SU32_SUS128_SVW2_TT4_64_VW2_WGM4
    SolutionIndex: 39
    SolutionNameMin: Cijk_Ailk_Bljk_I8II_BH_MT128x128x16_MI16x16x16x1_SN_1LDSB0_AMAS0_GRVW16_IU1_SIA1_SU32_SUS128_SVW1_TT4_64_VW1_WGM4
    SolutionIndex: 40
    SolutionNameMin: Cijk_Ailk_Bljk_I8II_BH_MT128x128x16_MI16x16x16x1_SN_1LDSB0_AMAS3_GRVW16_IU1_SIA1_SU32_SUS128_SVW2_TT4_64_VW2_WGM4
    SolutionIndex: 41
    SolutionNameMin: Cijk_Ailk_Bljk_I8II_BH_MT128x128x16_MI16x16x16x1_SN_1LDSB0_AMAS3_GRVW16_IU1_SIA1_SU32_SUS128_SVW4_TT4_64_VW4_WGM4
    SolutionIndex: 42
    SolutionNameMin: Cijk_Ailk_Bljk_I8II_BH_MT128x128x16_MI16x16x16x1_SN_1LDSB0_AMAS0_GRVW16_IU1_SIA3_SU32_SUS128_SVW1_TT4_64_VW1_WGM4
    SolutionIndex: 43
    SolutionNameMin: Cijk_Ailk_Bljk_I8II_BH_MT128x128x16_MI16x16x16x1_SN_1LDSB0_AMAS3_GRVW16_IU1_SIA3_SU32_SUS128_SVW2_TT4_64_VW2_WGM4
    SolutionIndex: 44
    SolutionNameMin: Cijk_Ailk_Bljk_I8II_BH_MT128x128x16_MI16x16x16x1_SN_1LDSB0_AMAS3_GRVW8_IU1_SIA1_SU32_SUS256_SVW2_TT4_64_VW2_WGM4
    SolutionIndex: 45
    SolutionNameMin: Cijk_Ailk_Bljk_I8II_BH_MT128x128x16_MI16x16x16x1_SN_1LDSB0_AMAS3_GRVW16_IU1_SIA1_SU32_SUS256_SVW2_TT4_64_VW2_WGM4
    SolutionIndex: 46
    SolutionNameMin: Cijk_Ailk_Bljk_I8II_BH_MT128x128x16_MI16x16x16x1_SN_1LDSB1_AMAS3_GRVW8_IU1_SIA2_SU32_SUS256_SVW4_TT4_64_VW4_WGM4
    SolutionIndex: 47
    SolutionNameMin: Cijk_Ailk_Bljk_I8II_BH_MT128x128x16_MI16x16x16x1_SN_1LDSB0_AMAS0_GRVW16_IU1_SIA3_SU32_SUS256_SVW1_TT4_64_VW1_WGM4
    SolutionIndex: 48
    SolutionNameMin: Cijk_Ailk_Bljk_I8II_BH_MT128x128x16_MI16x16x16x1_SN_1LDSB0_AMAS3_GRVW16_IU1_SIA3_SU32_SUS256_SVW4_TT4_64_VW4_WGM4
    SolutionIndex: 49
    SolutionNameMin: Cijk_Ailk_Bljk_I8II_BH_MT128x128x16_MI16x16x16x1_SN_1LDSB0_AMAS0_GRVW8_IU1_SIA1_SU0_SUS0_SVW1_TT4_64_VW1_WGM8
    SolutionIndex: 50
    SolutionNameMin: Cijk_Ailk_Bljk_I8II_BH_MT128x128x16_MI16x16x16x1_SN_1LDSB0_AMAS3_GRVW8_IU1_SIA1_SU0_SUS0_SVW4_TT4_64_VW4_WGM8
    SolutionIndex: 51
    SolutionNameMin: Cijk_Ailk_Bljk_I8II_BH_MT128x128x16_MI16x16x16x1_SN_1LDSB0_AMAS0_GRVW16_IU1_SIA1_SU0_SUS0_SVW1_TT4_64_VW1_WGM8
    SolutionIndex: 52
    SolutionNameMin: Cijk_Ailk_Bljk_I8II_BH_MT128x128x16_MI16x16x16x1_SN_1LDSB0_AMAS3_GRVW16_IU1_SIA1_SU0_SUS0_SVW4_TT4_64_VW4_WGM8
    SolutionIndex: 53
    SolutionNameMin: Cijk_Ailk_Bljk_I8II_BH_MT128x128x16_MI16x16x16x1_SN_1LDSB1_AMAS0_GRVW16_IU1_SIA2_SU0_SUS0_SVW1_TT4_64_VW1_WGM8
    SolutionIndex: 54
    SolutionNameMin: Cijk_Ailk_Bljk_I8II_BH_MT128x128x16_MI16x16x16x1_SN_1LDSB1_AMAS3_GRVW16_IU1_SIA2_SU0_SUS0_SVW2_TT4_64_VW2_WGM8
    SolutionIndex: 55
    SolutionNameMin: Cijk_Ailk_Bljk_I8II_BH_MT128x128x16_MI16x16x16x1_SN_1LDSB0_AMAS0_GRVW8_IU1_SIA3_SU0_SUS0_SVW1_TT4_64_VW1_WGM8
    SolutionIndex: 56
    SolutionNameMin: Cijk_Ailk_Bljk_I8II_BH_MT128x128x16_MI16x16x16x1_SN_1LDSB0_AMAS0_GRVW16_IU1_SIA3_SU0_SUS0_SVW1_TT4_64_VW1_WGM8
    SolutionIndex: 57
    SolutionNameMin: Cijk_Ailk_Bljk_I8II_BH_MT128x128x16_MI16x16x16x1_SN_1LDSB0_AMAS3_GRVW16_IU1_SIA3_SU0_SUS0_SVW2_TT4_64_VW2_WGM8
    SolutionIndex: 58
    SolutionNameMin: Cijk_Ailk_Bljk_I8II_BH_MT128x128x16_MI16x16x16x1_SN_1LDSB0_AMAS3_GRVW16_IU1_SIA3_SU0_SUS0_SVW4_TT4_64_VW4_WGM8
    SolutionIndex: 59
    SolutionNameMin: Cijk_Ailk_Bljk_I8II_BH_MT128x128x16_MI16x16x16x1_SN_1LDSB0_AMAS3_GRVW8_IU1_SIA1_SU32_SUS128_SVW4_TT4_64_VW4_WGM8
    SolutionIndex: 60
    SolutionNameMin: Cijk_Ailk_Bljk_I8II_BH_MT128x128x16_MI16x16x16x1_SN_1LDSB0_AMAS3_GRVW16_IU1_SIA1_SU32_SUS128_SVW2_TT4_64_VW2_WGM8
    SolutionIndex: 61
    SolutionNameMin: Cijk_Ailk_Bljk_I8II_BH_MT128x128x16_MI16x16x16x1_SN_1LDSB0_AMAS3_GRVW16_IU1_SIA1_SU32_SUS128_SVW4_TT4_64_VW4_WGM8
    SolutionIndex: 62
    SolutionNameMin: Cijk_Ailk_Bljk_I8II_BH_MT128x128x16_MI16x16x16x1_SN_1LDSB0_AMAS3_GRVW8_IU1_SIA3_SU32_SUS128_SVW2_TT4_64_VW2_WGM8
    SolutionIndex: 63
    SolutionNameMin: Cijk_Ailk_Bljk_I8II_BH_MT128x128x16_MI16x16x16x1_SN_1LDSB0_AMAS0_GRVW16_IU1_SIA3_SU32_SUS128_SVW1_TT4_64_VW1_WGM8
    SolutionIndex: 64
    SolutionNameMin: Cijk_Ailk_Bljk_I8II_BH_MT128x128x16_MI16x16x16x1_SN_1LDSB0_AMAS3_GRVW16_IU1_SIA3_SU32_SUS128_SVW2_TT4_64_VW2_WGM8
    SolutionIndex: 65
    SolutionNameMin: Cijk_Ailk_Bljk_I8II_BH_MT128x128x16_MI16x16x16x1_SN_1LDSB0_AMAS0_GRVW4_IU1_SIA1_SU32_SUS256_SVW1_TT4_64_VW1_WGM8
    SolutionIndex: 66
    SolutionNameMin: Cijk_Ailk_Bljk_I8II_BH_MT128x128x16_MI16x16x16x1_SN_1LDSB0_AMAS0_GRVW16_IU1_SIA1_SU32_SUS256_SVW1_TT4_64_VW1_WGM8
    SolutionIndex: 67
    SolutionNameMin: Cijk_Ailk_Bljk_I8II_BH_MT128x128x16_MI16x16x16x1_SN_1LDSB0_AMAS3_GRVW16_IU1_SIA1_SU32_SUS256_SVW2_TT4_64_VW2_WGM8
    SolutionIndex: 68
    SolutionNameMin: Cijk_Ailk_Bljk_I8II_BH_MT128x128x16_MI16x16x16x1_SN_1LDSB0_AMAS3_GRVW16_IU1_SIA3_SU32_SUS256_SVW2_TT4_64_VW2_WGM8
    SolutionIndex: 69
    SolutionNameMin: Cijk_Ailk_Bljk_I8II_BH_MT128x128x16_MI16x16x16x1_SN_1LDSB0_AMAS3_GRVW16_IU1_SIA3_SU32_SUS256_SVW4_TT4_64_VW4_WGM8
    SolutionIndex: 70
    SolutionNameMin: Cijk_Ailk_Bljk_I8II_BH_MT32x32x32_MI16x16x16x1_SN_1LDSB0_AMAS0_GRVW8_IU1_SIA1_SU0_SUS0_SVW1_TT1_16_VW1_WGM4
    SolutionIndex: 71
    SolutionNameMin: Cijk_Ailk_Bljk_I8II_BH_MT32x32x32_MI16x16x16x1_SN_1LDSB0_AMAS0_GRVW16_IU1_SIA1_SU0_SUS0_SVW1_TT1_16_VW1_WGM4
    SolutionIndex: 72
    SolutionNameMin: Cijk_Ailk_Bljk_I8II_BH_MT32x32x32_MI16x16x16x1_SN_1LDSB1_AMAS0_GRVW4_IU2_SIA2_SU0_SUS0_SVW1_TT1_16_VW1_WGM4
    SolutionIndex: 73
    SolutionNameMin: Cijk_Ailk_Bljk_I8II_BH_MT32x32x32_MI16x16x16x1_SN_1LDSB1_AMAS0_GRVW8_IU2_SIA2_SU0_SUS0_SVW1_TT1_16_VW1_WGM4
    SolutionIndex: 74
    SolutionNameMin: Cijk_Ailk_Bljk_I8II_BH_MT32x32x32_MI16x16x16x1_SN_1LDSB1_AMAS0_GRVW16_IU2_SIA2_SU0_SUS0_SVW1_TT1_16_VW1_WGM4
    SolutionIndex: 75
    SolutionNameMin: Cijk_Ailk_Bljk_I8II_BH_MT32x32x32_MI16x16x16x1_SN_1LDSB0_AMAS0_GRVW4_IU1_SIA3_SU0_SUS0_SVW1_TT1_16_VW1_WGM4
    SolutionIndex: 76
    SolutionNameMin: Cijk_Ailk_Bljk_I8II_BH_MT32x32x32_MI16x16x16x1_SN_1LDSB0_AMAS0_GRVW16_IU1_SIA1_SU32_SUS128_SVW1_TT1_16_VW1_WGM4
    SolutionIndex: 77
    SolutionNameMin: Cijk_Ailk_Bljk_I8II_BH_MT32x32x32_MI16x16x16x1_SN_1LDSB1_AMAS0_GRVW4_IU2_SIA2_SU32_SUS128_SVW1_TT1_16_VW1_WGM4
    SolutionIndex: 78
    SolutionNameMin: Cijk_Ailk_Bljk_I8II_BH_MT32x32x32_MI16x16x16x1_SN_1LDSB1_AMAS0_GRVW8_IU2_SIA2_SU32_SUS128_SVW1_TT1_16_VW1_WGM4
    SolutionIndex: 79
    SolutionNameMin: Cijk_Ailk_Bljk_I8II_BH_MT32x32x32_MI16x16x16x1_SN_1LDSB1_AMAS0_GRVW16_IU2_SIA2_SU32_SUS128_SVW1_TT1_16_VW1_WGM4
    SolutionIndex: 80
    SolutionNameMin: Cijk_Ailk_Bljk_I8II_BH_MT32x32x32_MI16x16x16x1_SN_1LDSB0_AMAS0_GRVW8_IU1_SIA3_SU32_SUS128_SVW1_TT1_16_VW1_WGM4
    SolutionIndex: 81
    SolutionNameMin: Cijk_Ailk_Bljk_I8II_BH_MT32x32x32_MI16x16x16x1_SN_1LDSB0_AMAS0_GRVW16_IU1_SIA1_SU32_SUS256_SVW1_TT1_16_VW1_WGM4
    SolutionIndex: 82
    SolutionNameMin: Cijk_Ailk_Bljk_I8II_BH_MT32x32x32_MI16x16x16x1_SN_1LDSB1_AMAS0_GRVW4_IU2_SIA2_SU32_SUS256_SVW1_TT1_16_VW1_WGM4
    SolutionIndex: 83
    SolutionNameMin: Cijk_Ailk_Bljk_I8II_BH_MT32x32x32_MI16x16x16x1_SN_1LDSB1_AMAS0_GRVW8_IU2_SIA2_SU32_SUS256_SVW1_TT1_16_VW1_WGM4
    SolutionIndex: 84
    SolutionNameMin: Cijk_Ailk_Bljk_I8II_BH_MT32x32x32_MI16x16x16x1_SN_1LDSB1_AMAS0_GRVW16_IU2_SIA2_SU32_SUS256_SVW1_TT1_16_VW1_WGM4
    SolutionIndex: 85
    SolutionNameMin: Cijk_Ailk_Bljk_I8II_BH_MT32x32x32_MI16x16x16x1_SN_1LDSB0_AMAS0_GRVW16_IU1_SIA3_SU32_SUS256_SVW1_TT1_16_VW1_WGM4
    SolutionIndex: 86
    SolutionNameMin: Cijk_Ailk_Bljk_I8II_BH_MT32x32x32_MI16x16x16x1_SN_1LDSB0_AMAS0_GRVW16_IU1_SIA1_SU0_SUS0_SVW1_TT1_16_VW1_WGM8
    SolutionIndex: 87
    SolutionNameMin: Cijk_Ailk_Bljk_I8II_BH_MT32x32x32_MI16x16x16x1_SN_1LDSB1_AMAS0_GRVW4_IU2_SIA2_SU0_SUS0_SVW1_TT1_16_VW1_WGM8
    SolutionIndex: 88
    SolutionNameMin: Cijk_Ailk_Bljk_I8II_BH_MT32x32x32_MI16x16x16x1_SN_1LDSB1_AMAS0_GRVW8_IU2_SIA2_SU0_SUS0_SVW1_TT1_16_VW1_WGM8
    SolutionIndex: 89
    SolutionNameMin: Cijk_Ailk_Bljk_I8II_BH_MT32x32x32_MI16x16x16x1_SN_1LDSB1_AMAS0_GRVW16_IU2_SIA2_SU0_SUS0_SVW1_TT1_16_VW1_WGM8
    SolutionIndex: 90
    SolutionNameMin: Cijk_Ailk_Bljk_I8II_BH_MT32x32x32_MI16x16x16x1_SN_1LDSB0_AMAS0_GRVW8_IU1_SIA3_SU0_SUS0_SVW1_TT1_16_VW1_WGM8
    SolutionIndex: 91
    SolutionNameMin: Cijk_Ailk_Bljk_I8II_BH_MT32x32x32_MI16x16x16x1_SN_1LDSB0_AMAS0_GRVW16_IU1_SIA3_SU0_SUS0_SVW1_TT1_16_VW1_WGM8
    SolutionIndex: 92
    SolutionNameMin: Cijk_Ailk_Bljk_I8II_BH_MT32x32x32_MI16x16x16x1_SN_1LDSB1_AMAS0_GRVW4_IU2_SIA2_SU32_SUS128_SVW1_TT1_16_VW1_WGM8
    SolutionIndex: 93
    SolutionNameMin: Cijk_Ailk_Bljk_I8II_BH_MT32x32x32_MI16x16x16x1_SN_1LDSB1_AMAS0_GRVW8_IU2_SIA2_SU32_SUS128_SVW1_TT1_16_VW1_WGM8
    SolutionIndex: 94
    SolutionNameMin: Cijk_Ailk_Bljk_I8II_BH_MT32x32x32_MI16x16x16x1_SN_1LDSB1_AMAS0_GRVW16_IU2_SIA2_SU32_SUS128_SVW1_TT1_16_VW1_WGM8
    SolutionIndex: 95
    SolutionNameMin: Cijk_Ailk_Bljk_I8II_BH_MT32x32x32_MI16x16x16x1_SN_1LDSB0_AMAS0_GRVW8_IU1_SIA1_SU32_SUS256_SVW1_TT1_16_VW1_WGM8
    SolutionIndex: 96
    SolutionNameMin: Cijk_Ailk_Bljk_I8II_BH_MT32x32x32_MI16x16x16x1_SN_1LDSB1_AMAS0_GRVW4_IU2_SIA2_SU32_SUS256_SVW1_TT1_16_VW1_WGM8
    SolutionIndex: 97
    SolutionNameMin: Cijk_Ailk_Bljk_I8II_BH_MT32x32x32_MI16x16x16x1_SN_1LDSB1_AMAS0_GRVW8_IU2_SIA2_SU32_SUS256_SVW1_TT1_16_VW1_WGM8
    SolutionIndex: 98
    SolutionNameMin: Cijk_Ailk_Bljk_I8II_BH_MT32x32x32_MI16x16x16x1_SN_1LDSB1_AMAS0_GRVW16_IU2_SIA2_SU32_SUS256_SVW1_TT1_16_VW1_WGM8
    SolutionIndex: 99
    SolutionNameMin: Cijk_Ailk_Bljk_I8II_BH_MT32x32x32_MI16x16x16x1_SN_1LDSB0_AMAS0_GRVW8_IU1_SIA3_SU32_SUS256_SVW1_TT1_16_VW1_WGM8
    SolutionIndex: 100
    SolutionNameMin: Cijk_Ailk_Bljk_I8II_BH_MT32x32x32_MI16x16x16x1_SN_1LDSB0_AMAS0_GRVW16_IU1_SIA3_SU32_SUS256_SVW1_TT1_16_VW1_WGM8
    SolutionIndex: 101
    SolutionNameMin: Cijk_Ailk_Bljk_I8II_BH_MT64x64x32_MI16x16x16x1_SN_1LDSB0_AMAS0_GRVW8_IU1_SIA1_SU0_SUS0_SVW1_TT2_32_VW1_WGM4
    SolutionIndex: 102
    SolutionNameMin: Cijk_Ailk_Bljk_I8II_BH_MT64x64x32_MI16x16x16x1_SN_1LDSB0_AMAS3_GRVW8_IU1_SIA1_SU0_SUS0_SVW2_TT2_32_VW2_WGM4
    SolutionIndex: 103
    SolutionNameMin: Cijk_Ailk_Bljk_I8II_BH_MT64x64x32_MI16x16x16x1_SN_1LDSB0_AMAS0_GRVW16_IU1_SIA1_SU0_SUS0_SVW1_TT2_32_VW1_WGM4
    SolutionIndex: 104
    SolutionNameMin: Cijk_Ailk_Bljk_I8II_BH_MT64x64x32_MI16x16x16x1_SN_1LDSB0_AMAS3_GRVW16_IU1_SIA1_SU0_SUS0_SVW2_TT2_32_VW2_WGM4
    SolutionIndex: 105
    SolutionNameMin: Cijk_Ailk_Bljk_I8II_BH_MT64x64x32_MI16x16x16x1_SN_1LDSB1_AMAS0_GRVW4_IU2_SIA2_SU0_SUS0_SVW1_TT2_32_VW1_WGM4
    SolutionIndex: 106
    SolutionNameMin: Cijk_Ailk_Bljk_I8II_BH_MT64x64x32_MI16x16x16x1_SN_1LDSB1_AMAS3_GRVW4_IU2_SIA2_SU0_SUS0_SVW2_TT2_32_VW2_WGM4
    SolutionIndex: 107
    SolutionNameMin: Cijk_Ailk_Bljk_I8II_BH_MT64x64x32_MI16x16x16x1_SN_1LDSB1_AMAS0_GRVW8_IU2_SIA2_SU0_SUS0_SVW1_TT2_32_VW1_WGM4
    SolutionIndex: 108
    SolutionNameMin: Cijk_Ailk_Bljk_I8II_BH_MT64x64x32_MI16x16x16x1_SN_1LDSB1_AMAS3_GRVW8_IU2_SIA2_SU0_SUS0_SVW2_TT2_32_VW2_WGM4
    SolutionIndex: 109
    SolutionNameMin: Cijk_Ailk_Bljk_I8II_BH_MT64x64x32_MI16x16x16x1_SN_1LDSB1_AMAS0_GRVW16_IU2_SIA2_SU0_SUS0_SVW1_TT2_32_VW1_WGM4
    SolutionIndex: 110
    SolutionNameMin: Cijk_Ailk_Bljk_I8II_BH_MT64x64x32_MI16x16x16x1_SN_1LDSB1_AMAS3_GRVW16_IU2_SIA2_SU0_SUS0_SVW2_TT2_32_VW2_WGM4
    SolutionIndex: 111
    SolutionNameMin: Cijk_Ailk_Bljk_I8II_BH_MT64x64x32_MI16x16x16x1_SN_1LDSB0_AMAS0_GRVW16_IU1_SIA3_SU0_SUS0_SVW1_TT2_32_VW1_WGM4
    SolutionIndex: 112
    SolutionNameMin: Cijk_Ailk_Bljk_I8II_BH_MT64x64x32_MI16x16x16x1_SN_1LDSB0_AMAS3_GRVW4_IU1_SIA1_SU32_SUS128_SVW2_TT2_32_VW2_WGM4
    SolutionIndex: 113
    SolutionNameMin: Cijk_Ailk_Bljk_I8II_BH_MT64x64x32_MI16x16x16x1_SN_1LDSB0_AMAS0_GRVW16_IU1_SIA1_SU32_SUS128_SVW1_TT2_32_VW1_WGM4
    SolutionIndex: 114
    SolutionNameMin: Cijk_Ailk_Bljk_I8II_BH_MT64x64x32_MI16x16x16x1_SN_1LDSB0_AMAS3_GRVW16_IU1_SIA1_SU32_SUS128_SVW2_TT2_32_VW2_WGM4
    SolutionIndex: 115
    SolutionNameMin: Cijk_Ailk_Bljk_I8II_BH_MT64x64x32_MI16x16x16x1_SN_1LDSB1_AMAS3_GRVW4_IU2_SIA2_SU32_SUS128_SVW2_TT2_32_VW2_WGM4
    SolutionIndex: 116
    SolutionNameMin: Cijk_Ailk_Bljk_I8II_BH_MT64x64x32_MI16x16x16x1_SN_1LDSB1_AMAS0_GRVW8_IU2_SIA2_SU32_SUS128_SVW1_TT2_32_VW1_WGM4
    SolutionIndex: 117
    SolutionNameMin: Cijk_Ailk_Bljk_I8II_BH_MT64x64x32_MI16x16x16x1_SN_1LDSB1_AMAS3_GRVW8_IU2_SIA2_SU32_SUS128_SVW2_TT2_32_VW2_WGM4
    SolutionIndex: 118
    SolutionNameMin: Cijk_Ailk_Bljk_I8II_BH_MT64x64x32_MI16x16x16x1_SN_1LDSB1_AMAS0_GRVW16_IU2_SIA2_SU32_SUS128_SVW1_TT2_32_VW1_WGM4
    SolutionIndex: 119
    SolutionNameMin: Cijk_Ailk_Bljk_I8II_BH_MT64x64x32_MI16x16x16x1_SN_1LDSB1_AMAS3_GRVW16_IU2_SIA2_SU32_SUS128_SVW2_TT2_32_VW2_WGM4
    SolutionIndex: 120
    SolutionNameMin: Cijk_Ailk_Bljk_I8II_BH_MT64x64x32_MI16x16x16x1_SN_1LDSB0_AMAS0_GRVW8_IU1_SIA1_SU32_SUS256_SVW1_TT2_32_VW1_WGM4
    SolutionIndex: 121
    SolutionNameMin: Cijk_Ailk_Bljk_I8II_BH_MT64x64x32_MI16x16x16x1_SN_1LDSB0_AMAS3_GRVW8_IU1_SIA1_SU32_SUS256_SVW2_TT2_32_VW2_WGM4
    SolutionIndex: 122
    SolutionNameMin: Cijk_Ailk_Bljk_I8II_BH_MT64x64x32_MI16x16x16x1_SN_1LDSB0_AMAS0_GRVW16_IU1_SIA1_SU32_SUS256_SVW1_TT2_32_VW1_WGM4
    SolutionIndex: 123
    SolutionNameMin: Cijk_Ailk_Bljk_I8II_BH_MT64x64x32_MI16x16x16x1_SN_1LDSB1_AMAS0_GRVW8_IU2_SIA2_SU32_SUS256_SVW1_TT2_32_VW1_WGM4
    SolutionIndex: 124
    SolutionNameMin: Cijk_Ailk_Bljk_I8II_BH_MT64x64x32_MI16x16x16x1_SN_1LDSB1_AMAS3_GRVW8_IU2_SIA2_SU32_SUS256_SVW2_TT2_32_VW2_WGM4
    SolutionIndex: 125
    SolutionNameMin: Cijk_Ailk_Bljk_I8II_BH_MT64x64x32_MI16x16x16x1_SN_1LDSB1_AMAS0_GRVW16_IU2_SIA2_SU32_SUS256_SVW1_TT2_32_VW1_WGM4
    SolutionIndex: 126
    SolutionNameMin: Cijk_Ailk_Bljk_I8II_BH_MT64x64x32_MI16x16x16x1_SN_1LDSB1_AMAS3_GRVW16_IU2_SIA2_SU32_SUS256_SVW2_TT2_32_VW2_WGM4
    SolutionIndex: 127
    SolutionNameMin: Cijk_Ailk_Bljk_I8II_BH_MT64x64x32_MI16x16x16x1_SN_1LDSB0_AMAS0_GRVW16_IU1_SIA3_SU32_SUS256_SVW1_TT2_32_VW1_WGM4
    SolutionIndex: 128
    SolutionNameMin: Cijk_Ailk_Bljk_I8II_BH_MT64x64x32_MI16x16x16x1_SN_1LDSB0_AMAS3_GRVW16_IU1_SIA3_SU32_SUS256_SVW2_TT2_32_VW2_WGM4
    SolutionIndex: 129
    SolutionNameMin: Cijk_Ailk_Bljk_I8II_BH_MT64x64x32_MI16x16x16x1_SN_1LDSB0_AMAS0_GRVW8_IU1_SIA1_SU0_SUS0_SVW1_TT2_32_VW1_WGM8
    SolutionIndex: 130
    SolutionNameMin: Cijk_Ailk_Bljk_I8II_BH_MT64x64x32_MI16x16x16x1_SN_1LDSB0_AMAS3_GRVW8_IU1_SIA1_SU0_SUS0_SVW2_TT2_32_VW2_WGM8
    SolutionIndex: 131
    SolutionNameMin: Cijk_Ailk_Bljk_I8II_BH_MT64x64x32_MI16x16x16x1_SN_1LDSB0_AMAS0_GRVW16_IU1_SIA1_SU0_SUS0_SVW1_TT2_32_VW1_WGM8
    SolutionIndex: 132
    SolutionNameMin: Cijk_Ailk_Bljk_I8II_BH_MT64x64x32_MI16x16x16x1_SN_1LDSB0_AMAS3_GRVW16_IU1_SIA1_SU0_SUS0_SVW2_TT2_32_VW2_WGM8
    SolutionIndex: 133
    SolutionNameMin: Cijk_Ailk_Bljk_I8II_BH_MT64x64x32_MI16x16x16x1_SN_1LDSB1_AMAS0_GRVW4_IU2_SIA2_SU0_SUS0_SVW1_TT2_32_VW1_WGM8
    SolutionIndex: 134
    SolutionNameMin: Cijk_Ailk_Bljk_I8II_BH_MT64x64x32_MI16x16x16x1_SN_1LDSB1_AMAS3_GRVW4_IU2_SIA2_SU0_SUS0_SVW2_TT2_32_VW2_WGM8
    SolutionIndex: 135
    SolutionNameMin: Cijk_Ailk_Bljk_I8II_BH_MT64x64x32_MI16x16x16x1_SN_1LDSB1_AMAS0_GRVW8_IU2_SIA2_SU0_SUS0_SVW1_TT2_32_VW1_WGM8
    SolutionIndex: 136
    SolutionNameMin: Cijk_Ailk_Bljk_I8II_BH_MT64x64x32_MI16x16x16x1_SN_1LDSB1_AMAS3_GRVW8_IU2_SIA2_SU0_SUS0_SVW2_TT2_32_VW2_WGM8
    SolutionIndex: 137
    SolutionNameMin: Cijk_Ailk_Bljk_I8II_BH_MT64x64x32_MI16x16x16x1_SN_1LDSB1_AMAS0_GRVW16_IU2_SIA2_SU0_SUS0_SVW1_TT2_32_VW1_WGM8
    SolutionIndex: 138
    SolutionNameMin: Cijk_Ailk_Bljk_I8II_BH_MT64x64x32_MI16x16x16x1_SN_1LDSB1_AMAS3_GRVW16_IU2_SIA2_SU0_SUS0_SVW2_TT2_32_VW2_WGM8
    SolutionIndex: 139
    SolutionNameMin: Cijk_Ailk_Bljk_I8II_BH_MT64x64x32_MI16x16x16x1_SN_1LDSB0_AMAS3_GRVW8_IU1_SIA1_SU32_SUS128_SVW2_TT2_32_VW2_WGM8
    SolutionIndex: 140
    SolutionNameMin: Cijk_Ailk_Bljk_I8II_BH_MT64x64x32_MI16x16x16x1_SN_1LDSB0_AMAS3_GRVW16_IU1_SIA1_SU32_SUS128_SVW2_TT2_32_VW2_WGM8
    SolutionIndex: 141
    SolutionNameMin: Cijk_Ailk_Bljk_I8II_BH_MT64x64x32_MI16x16x16x1_SN_1LDSB1_AMAS0_GRVW4_IU2_SIA2_SU32_SUS128_SVW1_TT2_32_VW1_WGM8
    SolutionIndex: 142
    SolutionNameMin: Cijk_Ailk_Bljk_I8II_BH_MT64x64x32_MI16x16x16x1_SN_1LDSB1_AMAS0_GRVW8_IU2_SIA2_SU32_SUS128_SVW1_TT2_32_VW1_WGM8
    SolutionIndex: 143
    SolutionNameMin: Cijk_Ailk_Bljk_I8II_BH_MT64x64x32_MI16x16x16x1_SN_1LDSB1_AMAS3_GRVW8_IU2_SIA2_SU32_SUS128_SVW2_TT2_32_VW2_WGM8
    SolutionIndex: 144
    SolutionNameMin: Cijk_Ailk_Bljk_I8II_BH_MT64x64x32_MI16x16x16x1_SN_1LDSB1_AMAS3_GRVW16_IU2_SIA2_SU32_SUS128_SVW2_TT2_32_VW2_WGM8
    SolutionIndex: 145
    SolutionNameMin: Cijk_Ailk_Bljk_I8II_BH_MT64x64x32_MI16x16x16x1_SN_1LDSB0_AMAS3_GRVW4_IU1_SIA1_SU32_SUS256_SVW2_TT2_32_VW2_WGM8
    SolutionIndex: 146
    SolutionNameMin: Cijk_Ailk_Bljk_I8II_BH_MT64x64x32_MI16x16x16x1_SN_1LDSB0_AMAS0_GRVW8_IU1_SIA1_SU32_SUS256_SVW1_TT2_32_VW1_WGM8
    SolutionIndex: 147
    SolutionNameMin: Cijk_Ailk_Bljk_I8II_BH_MT64x64x32_MI16x16x16x1_SN_1LDSB0_AMAS0_GRVW16_IU1_SIA1_SU32_SUS256_SVW1_TT2_32_VW1_WGM8
    SolutionIndex: 148
    SolutionNameMin: Cijk_Ailk_Bljk_I8II_BH_MT64x64x32_MI16x16x16x1_SN_1LDSB0_AMAS3_GRVW16_IU1_SIA1_SU32_SUS256_SVW2_TT2_32_VW2_WGM8
    SolutionIndex: 149
    SolutionNameMin: Cijk_Ailk_Bljk_I8II_BH_MT64x64x32_MI16x16x16x1_SN_1LDSB1_AMAS0_GRVW8_IU2_SIA2_SU32_SUS256_SVW1_TT2_32_VW1_WGM8
    SolutionIndex: 150
    SolutionNameMin: Cijk_Ailk_Bljk_I8II_BH_MT64x64x32_MI16x16x16x1_SN_1LDSB1_AMAS0_GRVW16_IU2_SIA2_SU32_SUS256_SVW1_TT2_32_VW1_WGM8
    SolutionIndex: 151
    SolutionNameMin: Cijk_Ailk_Bljk_I8II_BH_MT64x64x32_MI16x16x16x1_SN_1LDSB1_AMAS3_GRVW16_IU2_SIA2_SU32_SUS256_SVW2_TT2_32_VW2_WGM8
    SolutionIndex: 152
    SolutionNameMin: Cijk_Ailk_Bljk_I8II_BH_MT64x64x32_MI16x16x16x1_SN_1LDSB0_AMAS0_GRVW16_IU1_SIA3_SU32_SUS256_SVW1_TT2_32_VW1_WGM8
    SolutionIndex: 153
    SolutionNameMin: Cijk_Ailk_Bljk_I8II_BH_MT128x128x32_MI16x16x16x1_SN_1LDSB0_AMAS0_GRVW16_IU1_SIA1_SU0_SUS0_SVW1_TT4_64_VW1_WGM4
    SolutionIndex: 154
    SolutionNameMin: Cijk_Ailk_Bljk_I8II_BH_MT128x128x32_MI16x16x16x1_SN_1LDSB0_AMAS3_GRVW16_IU1_SIA1_SU0_SUS0_SVW2_TT4_64_VW2_WGM4
    SolutionIndex: 155
    SolutionNameMin: Cijk_Ailk_Bljk_I8II_BH_MT128x128x32_MI16x16x16x1_SN_1LDSB0_AMAS3_GRVW16_IU1_SIA1_SU0_SUS0_SVW4_TT4_64_VW4_WGM4
    SolutionIndex: 156
    SolutionNameMin: Cijk_Ailk_Bljk_I8II_BH_MT128x128x32_MI16x16x16x1_SN_1LDSB0_AMAS0_GRVW16_IU1_SIA3_SU0_SUS0_SVW1_TT4_64_VW1_WGM4
    SolutionIndex: 157
    SolutionNameMin: Cijk_Ailk_Bljk_I8II_BH_MT128x128x32_MI16x16x16x1_SN_1LDSB0_AMAS3_GRVW16_IU1_SIA3_SU0_SUS0_SVW2_TT4_64_VW2_WGM4
    SolutionIndex: 158
    SolutionNameMin: Cijk_Ailk_Bljk_I8II_BH_MT128x128x32_MI16x16x16x1_SN_1LDSB0_AMAS3_GRVW16_IU1_SIA3_SU0_SUS0_SVW4_TT4_64_VW4_WGM4
    SolutionIndex: 159
    SolutionNameMin: Cijk_Ailk_Bljk_I8II_BH_MT128x128x32_MI16x16x16x1_SN_1LDSB0_AMAS0_GRVW16_IU1_SIA1_SU32_SUS128_SVW1_TT4_64_VW1_WGM4
    SolutionIndex: 160
    SolutionNameMin: Cijk_Ailk_Bljk_I8II_BH_MT128x128x32_MI16x16x16x1_SN_1LDSB0_AMAS3_GRVW16_IU1_SIA1_SU32_SUS128_SVW2_TT4_64_VW2_WGM4
    SolutionIndex: 161
    SolutionNameMin: Cijk_Ailk_Bljk_I8II_BH_MT128x128x32_MI16x16x16x1_SN_1LDSB0_AMAS3_GRVW16_IU1_SIA1_SU32_SUS128_SVW4_TT4_64_VW4_WGM4
    SolutionIndex: 162
    SolutionNameMin: Cijk_Ailk_Bljk_I8II_BH_MT128x128x32_MI16x16x16x1_SN_1LDSB0_AMAS3_GRVW16_IU1_SIA3_SU32_SUS128_SVW2_TT4_64_VW2_WGM4
    SolutionIndex: 163
    SolutionNameMin: Cijk_Ailk_Bljk_I8II_BH_MT128x128x32_MI16x16x16x1_SN_1LDSB0_AMAS0_GRVW16_IU1_SIA1_SU32_SUS256_SVW1_TT4_64_VW1_WGM4
    SolutionIndex: 164
    SolutionNameMin: Cijk_Ailk_Bljk_I8II_BH_MT128x128x32_MI16x16x16x1_SN_1LDSB0_AMAS3_GRVW16_IU1_SIA1_SU32_SUS256_SVW2_TT4_64_VW2_WGM4
    SolutionIndex: 165
    SolutionNameMin: Cijk_Ailk_Bljk_I8II_BH_MT128x128x32_MI16x16x16x1_SN_1LDSB0_AMAS3_GRVW16_IU1_SIA1_SU32_SUS256_SVW4_TT4_64_VW4_WGM4
    SolutionIndex: 166
    SolutionNameMin: Cijk_Ailk_Bljk_I8II_BH_MT128x128x32_MI16x16x16x1_SN_1LDSB0_AMAS0_GRVW16_IU1_SIA3_SU32_SUS256_SVW1_TT4_64_VW1_WGM4
    SolutionIndex: 167
    SolutionNameMin: Cijk_Ailk_Bljk_I8II_BH_MT128x128x32_MI16x16x16x1_SN_1LDSB0_AMAS3_GRVW16_IU1_SIA3_SU32_SUS256_SVW4_TT4_64_VW4_WGM4
    SolutionIndex: 168
    SolutionNameMin: Cijk_Ailk_Bljk_I8II_BH_MT128x128x32_MI16x16x16x1_SN_1LDSB0_AMAS0_GRVW16_IU1_SIA1_SU0_SUS0_SVW1_TT4_64_VW1_WGM8
    SolutionIndex: 169
    SolutionNameMin: Cijk_Ailk_Bljk_I8II_BH_MT128x128x32_MI16x16x16x1_SN_1LDSB0_AMAS3_GRVW16_IU1_SIA1_SU0_SUS0_SVW2_TT4_64_VW2_WGM8
    SolutionIndex: 170
    SolutionNameMin: Cijk_Ailk_Bljk_I8II_BH_MT128x128x32_MI16x16x16x1_SN_1LDSB0_AMAS0_GRVW16_IU1_SIA3_SU0_SUS0_SVW1_TT4_64_VW1_WGM8
    SolutionIndex: 171
    SolutionNameMin: Cijk_Ailk_Bljk_I8II_BH_MT128x128x32_MI16x16x16x1_SN_1LDSB0_AMAS3_GRVW16_IU1_SIA3_SU0_SUS0_SVW2_TT4_64_VW2_WGM8
    SolutionIndex: 172
    SolutionNameMin: Cijk_Ailk_Bljk_I8II_BH_MT128x128x32_MI16x16x16x1_SN_1LDSB0_AMAS3_GRVW16_IU1_SIA3_SU0_SUS0_SVW4_TT4_64_VW4_WGM8
    SolutionIndex: 173
    SolutionNameMin: Cijk_Ailk_Bljk_I8II_BH_MT128x128x32_MI16x16x16x1_SN_1LDSB0_AMAS0_GRVW16_IU1_SIA1_SU32_SUS128_SVW1_TT4_64_VW1_WGM8
    SolutionIndex: 174
    SolutionNameMin: Cijk_Ailk_Bljk_I8II_BH_MT128x128x32_MI16x16x16x1_SN_1LDSB0_AMAS3_GRVW16_IU1_SIA1_SU32_SUS128_SVW2_TT4_64_VW2_WGM8
    SolutionIndex: 175
    SolutionNameMin: Cijk_Ailk_Bljk_I8II_BH_MT128x128x32_MI16x16x16x1_SN_1LDSB0_AMAS3_GRVW16_IU1_SIA1_SU32_SUS128_SVW4_TT4_64_VW4_WGM8
    SolutionIndex: 176
    SolutionNameMin: Cijk_Ailk_Bljk_I8II_BH_MT128x128x32_MI16x16x16x1_SN_1LDSB0_AMAS0_GRVW16_IU1_SIA3_SU32_SUS128_SVW1_TT4_64_VW1_WGM8
    SolutionIndex: 177
    SolutionNameMin: Cijk_Ailk_Bljk_I8II_BH_MT128x128x32_MI16x16x16x1_SN_1LDSB0_AMAS3_GRVW16_IU1_SIA3_SU32_SUS128_SVW2_TT4_64_VW2_WGM8
    SolutionIndex: 178
    SolutionNameMin: Cijk_Ailk_Bljk_I8II_BH_MT128x128x32_MI16x16x16x1_SN_1LDSB0_AMAS3_GRVW16_IU1_SIA3_SU32_SUS128_SVW4_TT4_64_VW4_WGM8
    SolutionIndex: 179
    SolutionNameMin: Cijk_Ailk_Bljk_I8II_BH_MT128x128x32_MI16x16x16x1_SN_1LDSB0_AMAS3_GRVW16_IU1_SIA1_SU32_SUS256_SVW2_TT4_64_VW2_WGM8
    SolutionIndex: 180
    SolutionNameMin: Cijk_Ailk_Bljk_I8II_BH_MT128x128x32_MI16x16x16x1_SN_1LDSB0_AMAS3_GRVW16_IU1_SIA1_SU32_SUS256_SVW4_TT4_64_VW4_WGM8
    SolutionIndex: 181
    SolutionNameMin: Cijk_Ailk_Bljk_I8II_BH_MT128x128x32_MI16x16x16x1_SN_1LDSB0_AMAS3_GRVW16_IU1_SIA3_SU32_SUS256_SVW4_TT4_64_VW4_WGM8
- - - [64, 64, 1, 64, 96, 96, 96, 96]
    - [0, 0.041]
  - - [64, 64, 1, 128, 96, 96, 160, 160]
    - [88, 0.081]
  - - [64, 64, 1, 256, 96, 96, 288, 288]
    - [74, 0.153]
  - - [64, 64, 1, 512, 96, 96, 544, 544]
    - [82, 0.27]
  - - [64, 64, 1, 1024, 96, 96, 1056, 1056]
    - [89, 0.438]
  - - [64, 64, 1, 2048, 96, 96, 2080, 2080]
    - [97, 0.636]
  - - [64, 64, 1, 4096, 96, 96, 4128, 4128]
    - [92, 0.82]
  - - [64, 64, 1, 8192, 96, 96, 8224, 8224]
    - [78, 0.946]
  - - [64, 128, 1, 64, 96, 96, 96, 96]
    - [95, 0.088]
  - - [64, 128, 1, 128, 96, 96, 160, 160]
    - [88, 0.169]
  - - [64, 128, 1, 256, 96, 96, 288, 288]
    - [88, 0.312]
  - - [64, 128, 1, 512, 96, 96, 544, 544]
    - [72, 0.554]
  - - [64, 128, 1, 1024, 96, 96, 1056, 1056]
    - [82, 0.897]
  - - [64, 128, 1, 2048, 96, 96, 2080, 2080]
    - [77, 1.291]
  - - [64, 128, 1, 4096, 96, 96, 4128, 4128]
    - [92, 1.656]
  - - [64, 128, 1, 8192, 96, 96, 8224, 8224]
    - [72, 1.908]
  - - [64, 256, 1, 64, 96, 96, 96, 96]
    - [87, 0.178]
  - - [64, 256, 1, 128, 96, 96, 160, 160]
    - [88, 0.343]
  - - [64, 256, 1, 256, 96, 96, 288, 288]
    - [87, 0.633]
  - - [64, 256, 1, 512, 96, 96, 544, 544]
    - [83, 1.121]
  - - [64, 256, 1, 1024, 96, 96, 1056, 1056]
    - [78, 1.811]
  - - [64, 256, 1, 2048, 96, 96, 2080, 2080]
    - [83, 2.602]
  - - [64, 256, 1, 4096, 96, 96, 4128, 4128]
    - [82, 3.338]
  - - [64, 256, 1, 8192, 96, 96, 8224, 8224]
    - [93, 3.803]
  - - [64, 512, 1, 64, 96, 96, 96, 96]
    - [100, 0.356]
  - - [64, 512, 1, 128, 96, 96, 160, 160]
    - [89, 0.694]
  - - [64, 512, 1, 256, 96, 96, 288, 288]
    - [98, 1.275]
  - - [64, 512, 1, 512, 96, 96, 544, 544]
    - [92, 2.259]
  - - [64, 512, 1, 1024, 96, 96, 1056, 1056]
    - [77, 3.638]
  - - [64, 512, 1, 2048, 96, 96, 2080, 2080]
    - [77, 5.195]
  - - [64, 512, 1, 4096, 96, 96, 4128, 4128]
    - [97, 6.615]
  - - [64, 512, 1, 8192, 96, 96, 8224, 8224]
    - [96, 7.598]
  - - [64, 1024, 1, 64, 96, 96, 96, 96]
    - [97, 0.711]
  - - [64, 1024, 1, 128, 96, 96, 160, 160]
    - [78, 1.366]
  - - [64, 1024, 1, 256, 96, 96, 288, 288]
    - [96, 2.544]
  - - [64, 1024, 1, 512, 96, 96, 544, 544]
    - [92, 4.469]
  - - [64, 1024, 1, 1024, 96, 96, 1056, 1056]
    - [87, 7.197]
  - - [64, 1024, 1, 2048, 96, 96, 2080, 2080]
    - [92, 10.288]
  - - [64, 1024, 1, 4096, 96, 96, 4128, 4128]
    - [78, 13.062]
  - - [64, 1024, 1, 8192, 96, 96, 8224, 8224]
    - [77, 14.725]
  - - [64, 2048, 1, 64, 96, 96, 96, 96]
    - [75, 1.387]
  - - [64, 2048, 1, 128, 96, 96, 160, 160]
    - [97, 2.631]
  - - [64, 2048, 1, 256, 96, 96, 288, 288]
    - [74, 4.786]
  - - [64, 2048, 1, 512, 96, 96, 544, 544]
    - [149, 7.686]
  - - [64, 2048, 1, 1024, 96, 96, 1056, 1056]
    - [74, 12.721]
  - - [64, 2048, 1, 2048, 96, 96, 2080, 2080]
    - [97, 17.489]
  - - [64, 2048, 1, 4096, 96, 96, 4128, 4128]
    - [74, 21.331]
  - - [64, 2048, 1, 8192, 96, 96, 8224, 8224]
    - [73, 23.895]
  - - [64, 4096, 1, 64, 96, 96, 96, 96]
    - [143, 2.671]
  - - [64, 4096, 1, 128, 96, 96, 160, 160]
    - [133, 4.975]
  - - [64, 4096, 1, 256, 96, 96, 288, 288]
    - [133, 8.917]
  - - [64, 4096, 1, 512, 96, 96, 544, 544]
    - [119, 14.881]
  - - [64, 4096, 1, 1024, 96, 96, 1056, 1056]
    - [144, 21.877]
  - - [64, 4096, 1, 2048, 96, 96, 2080, 2080]
    - [116, 29.017]
  - - [64, 4096, 1, 4096, 96, 96, 4128, 4128]
    - [137, 34.057]
  - - [64, 4096, 1, 8192, 96, 96, 8224, 8224]
    - [142, 37.817]
  - - [64, 8192, 1, 64, 96, 96, 96, 96]
    - [102, 4.784]
  - - [64, 8192, 1, 128, 96, 96, 160, 160]
    - [111, 8.765]
  - - [64, 8192, 1, 256, 96, 96, 288, 288]
    - [104, 15.276]
  - - [64, 8192, 1, 512, 96, 96, 544, 544]
    - [131, 23.906]
  - - [64, 8192, 1, 1024, 96, 96, 1056, 1056]
    - [103, 34.112]
  - - [64, 8192, 1, 2048, 96, 96, 2080, 2080]
    - [147, 44.299]
  - - [64, 8192, 1, 4096, 96, 96, 4128, 4128]
    - [114, 51.044]
  - - [64, 8192, 1, 8192, 96, 96, 8224, 8224]
    - [113, 53.808]
  - - [128, 64, 1, 64, 160, 160, 128, 96]
    - [91, 0.087]
  - - [128, 64, 1, 128, 160, 160, 160, 160]
    - [77, 0.168]
  - - [128, 64, 1, 256, 160, 160, 288, 288]
    - [89, 0.313]
  - - [128, 64, 1, 512, 160, 160, 544, 544]
    - [98, 0.553]
  - - [128, 64, 1, 1024, 160, 160, 1056, 1056]
    - [98, 0.898]
  - - [128, 64, 1, 2048, 160, 160, 2080, 2080]
    - [84, 1.291]
  - - [128, 64, 1, 4096, 160, 160, 4128, 4128]
    - [82, 1.655]
  - - [128, 64, 1, 8192, 160, 160, 8224, 8224]
    - [98, 1.912]
  - - [128, 128, 1, 64, 160, 160, 128, 96]
    - [92, 0.179]
  - - [128, 128, 1, 128, 160, 160, 160, 160]
    - [92, 0.343]
  - - [128, 128, 1, 256, 160, 160, 288, 288]
    - [74, 0.635]
  - - [128, 128, 1, 512, 160, 160, 544, 544]
    - [84, 1.122]
  - - [128, 128, 1, 1024, 160, 160, 1056, 1056]
    - [97, 1.807]
  - - [128, 128, 1, 2048, 160, 160, 2080, 2080]
    - [96, 2.601]
  - - [128, 128, 1, 4096, 160, 160, 4128, 4128]
    - [96, 3.327]
  - - [128, 128, 1, 8192, 160, 160, 8224, 8224]
    - [96, 3.828]
  - - [128, 256, 1, 64, 160, 160, 128, 96]
    - [90, 0.355]
  - - [128, 256, 1, 128, 160, 160, 160, 160]
    - [92, 0.687]
  - - [128, 256, 1, 256, 160, 160, 288, 288]
    - [72, 1.289]
  - - [128, 256, 1, 512, 160, 160, 544, 544]
    - [77, 2.261]
  - - [128, 256, 1, 1024, 160, 160, 1056, 1056]
    - [73, 3.652]
  - - [128, 256, 1, 2048, 160, 160, 2080, 2080]
    - [78, 5.224]
  - - [128, 256, 1, 4096, 160, 160, 4128, 4128]
    - [78, 6.663]
  - - [128, 256, 1, 8192, 160, 160, 8224, 8224]
    - [78, 7.627]
  - - [128, 512, 1, 64, 160, 160, 128, 96]
    - [70, 0.712]
  - - [128, 512, 1, 128, 160, 160, 160, 160]
    - [72, 1.372]
  - - [128, 512, 1, 256, 160, 160, 288, 288]
    - [97, 2.544]
  - - [128, 512, 1, 512, 160, 160, 544, 544]
    - [93, 4.449]
  - - [128, 512, 1, 1024, 160, 160, 1056, 1056]
    - [89, 5.649]
  - - [128, 512, 1, 2048, 160, 160, 2080, 2080]
    - [96, 10.343]
  - - [128, 512, 1, 4096, 160, 160, 4128, 4128]
    - [74, 13.193]
  - - [128, 512, 1, 8192, 160, 160, 8224, 8224]
    - [74, 15.19]
  - - [128, 1024, 1, 64, 160, 160, 128, 96]
    - [80, 1.39]
  - - [128, 1024, 1, 128, 160, 160, 160, 160]
    - [70, 2.659]
  - - [128, 1024, 1, 256, 160, 160, 288, 288]
    - [89, 4.838]
  - - [128, 1024, 1, 512, 160, 160, 544, 544]
    - [88, 8.294]
  - - [128, 1024, 1, 1024, 160, 160, 1056, 1056]
    - [89, 12.757]
  - - [128, 1024, 1, 2048, 160, 160, 2080, 2080]
    - [73, 17.557]
  - - [128, 1024, 1, 4096, 160, 160, 4128, 4128]
    - [73, 21.519]
  - - [128, 1024, 1, 8192, 160, 160, 8224, 8224]
    - [89, 24.142]
  - - [128, 2048, 1, 64, 160, 160, 128, 96]
    - [121, 2.663]
  - - [128, 2048, 1, 128, 160, 160, 160, 160]
    - [119, 5.047]
  - - [128, 2048, 1, 256, 160, 160, 288, 288]
    - [110, 9.044]
  - - [128, 2048, 1, 512, 160, 160, 544, 544]
    - [135, 14.918]
  - - [128, 2048, 1, 1024, 160, 160, 1056, 1056]
    - [138, 22.151]
  - - [128, 2048, 1, 2048, 160, 160, 2080, 2080]
    - [136, 29.105]
  - - [128, 2048, 1, 4096, 160, 160, 4128, 4128]
    - [123, 34.007]
  - - [128, 2048, 1, 8192, 160, 160, 8224, 8224]
    - [116, 37.896]
  - - [128, 4096, 1, 64, 160, 160, 128, 96]
    - [132, 4.853]
  - - [128, 4096, 1, 128, 160, 160, 160, 160]
    - [122, 8.965]
  - - [128, 4096, 1, 256, 160, 160, 288, 288]
    - [122, 15.573]
  - - [128, 4096, 1, 512, 160, 160, 544, 544]
    - [140, 24.556]
  - - [128, 4096, 1, 1024, 160, 160, 1056, 1056]
    - [103, 34.572]
  - - [128, 4096, 1, 2048, 160, 160, 2080, 2080]
    - [103, 43.806]
  - - [128, 4096, 1, 4096, 160, 160, 4128, 4128]
    - [148, 50.561]
  - - [128, 4096, 1, 8192, 160, 160, 8224, 8224]
    - [103, 52.822]
  - - [128, 8192, 1, 64, 160, 160, 128, 96]
    - [122, 8.378]
  - - [128, 8192, 1, 128, 160, 160, 160, 160]
    - [147, 14.777]
  - - [128, 8192, 1, 256, 160, 160, 288, 288]
    - [53, 22.659]
  - - [128, 8192, 1, 512, 160, 160, 544, 544]
    - [63, 33.364]
  - - [128, 8192, 1, 1024, 160, 160, 1056, 1056]
    - [48, 43.206]
  - - [128, 8192, 1, 2048, 160, 160, 2080, 2080]
    - [46, 51.231]
  - - [128, 8192, 1, 4096, 160, 160, 4128, 4128]
    - [68, 52.721]
  - - [128, 8192, 1, 8192, 160, 160, 8224, 8224]
    - [69, 56.191]
  - - [256, 64, 1, 64, 288, 288, 256, 96]
    - [72, 0.177]
  - - [256, 64, 1, 128, 288, 288, 256, 160]
    - [77, 0.338]
  - - [256, 64, 1, 256, 288, 288, 288, 288]
    - [79, 0.642]
  - - [256, 64, 1, 512, 288, 288, 544, 544]
    - [92, 1.122]
  - - [256, 64, 1, 1024, 288, 288, 1056, 1056]
    - [89, 1.817]
  - - [256, 64, 1, 2048, 288, 288, 2080, 2080]
    - [88, 2.603]
  - - [256, 64, 1, 4096, 288, 288, 4128, 4128]
    - [74, 3.333]
  - - [256, 64, 1, 8192, 288, 288, 8224, 8224]
    - [78, 3.788]
  - - [256, 128, 1, 64, 288, 288, 256, 96]
    - [95, 0.356]
  - - [256, 128, 1, 128, 288, 288, 256, 160]
    - [72, 0.692]
  - - [256, 128, 1, 256, 288, 288, 288, 288]
    - [78, 1.279]
  - - [256, 128, 1, 512, 288, 288, 544, 544]
    - [73, 2.267]
  - - [256, 128, 1, 1024, 288, 288, 1056, 1056]
    - [93, 3.639]
  - - [256, 128, 1, 2048, 288, 288, 2080, 2080]
    - [92, 5.216]
  - - [256, 128, 1, 4096, 288, 288, 4128, 4128]
    - [73, 6.687]
  - - [256, 128, 1, 8192, 288, 288, 8224, 8224]
    - [84, 7.684]
  - - [256, 256, 1, 64, 288, 288, 256, 96]
    - [86, 0.709]
  - - [256, 256, 1, 128, 288, 288, 256, 160]
    - [88, 1.364]
  - - [256, 256, 1, 256, 288, 288, 288, 288]
    - [97, 2.54]
  - - [256, 256, 1, 512, 288, 288, 544, 544]
    - [98, 4.489]
  - - [256, 256, 1, 1024, 288, 288, 1056, 1056]
    - [74, 7.236]
  - - [256, 256, 1, 2048, 288, 288, 2080, 2080]
    - [72, 10.357]
  - - [256, 256, 1, 4096, 288, 288, 4128, 4128]
    - [73, 13.265]
  - - [256, 256, 1, 8192, 288, 288, 8224, 8224]
    - [79, 15.185]
  - - [256, 512, 1, 64, 288, 288, 256, 96]
    - [99, 1.39]
  - - [256, 512, 1, 128, 288, 288, 256, 160]
    - [75, 2.642]
  - - [256, 512, 1, 256, 288, 288, 288, 288]
    - [97, 4.819]
  - - [256, 512, 1, 512, 288, 288, 544, 544]
    - [73, 8.279]
  - - [256, 512, 1, 1024, 288, 288, 1056, 1056]
    - [74, 12.742]
  - - [256, 512, 1, 2048, 288, 288, 2080, 2080]
    - [88, 17.451]
  - - [256, 512, 1, 4096, 288, 288, 4128, 4128]
    - [88, 21.346]
  - - [256, 512, 1, 8192, 288, 288, 8224, 8224]
    - [73, 23.677]
  - - [256, 1024, 1, 64, 288, 288, 256, 96]
    - [145, 2.663]
  - - [256, 1024, 1, 128, 288, 288, 256, 160]
    - [144, 4.961]
  - - [256, 1024, 1, 256, 288, 288, 288, 288]
    - [108, 8.978]
  - - [256, 1024, 1, 512, 288, 288, 544, 544]
    - [138, 14.81]
  - - [256, 1024, 1, 1024, 288, 288, 1056, 1056]
    - [138, 21.989]
  - - [256, 1024, 1, 2048, 288, 288, 2080, 2080]
    - [138, 28.895]
  - - [256, 1024, 1, 4096, 288, 288, 4128, 4128]
    - [119, 34.082]
  - - [256, 1024, 1, 8192, 288, 288, 8224, 8224]
    - [106, 37.553]
  - - [256, 2048, 1, 64, 288, 288, 256, 96]
    - [146, 4.812]
  - - [256, 2048, 1, 128, 288, 288, 256, 160]
    - [104, 8.874]
  - - [256, 2048, 1, 256, 288, 288, 288, 288]
    - [103, 15.49]
  - - [256, 2048, 1, 512, 288, 288, 544, 544]
    - [128, 24.329]
  - - [256, 2048, 1, 1024, 288, 288, 1056, 1056]
    - [127, 34.287]
  - - [256, 2048, 1, 2048, 288, 288, 2080, 2080]
    - [103, 43.018]
  - - [256, 2048, 1, 4096, 288, 288, 4128, 4128]
    - [103, 50.068]
  - - [256, 2048, 1, 8192, 288, 288, 8224, 8224]
    - [103, 52.334]
  - - [256, 4096, 1, 64, 288, 288, 256, 96]
    - [131, 8.364]
  - - [256, 4096, 1, 128, 288, 288, 256, 160]
    - [110, 14.756]
  - - [256, 4096, 1, 256, 288, 288, 288, 288]
    - [54, 22.384]
  - - [256, 4096, 1, 512, 288, 288, 544, 544]
    - [34, 33.118]
  - - [256, 4096, 1, 1024, 288, 288, 1056, 1056]
    - [64, 43.115]
  - - [256, 4096, 1, 2048, 288, 288, 2080, 2080]
    - [42, 50.902]
  - - [256, 4096, 1, 4096, 288, 288, 4128, 4128]
    - [63, 52.898]
  - - [256, 4096, 1, 8192, 288, 288, 8224, 8224]
    - [33, 56.202]
  - - [256, 8192, 1, 64, 288, 288, 256, 96]
    - [132, 13.103]
  - - [256, 8192, 1, 128, 288, 288, 256, 160]
    - [57, 23.755]
  - - [256, 8192, 1, 256, 288, 288, 288, 288]
    - [160, 35.635]
  - - [256, 8192, 1, 512, 288, 288, 544, 544]
    - [62, 46.484]
  - - [256, 8192, 1, 1024, 288, 288, 1056, 1056]
    - [168, 55.539]
  - - [256, 8192, 1, 2048, 288, 288, 2080, 2080]
    - [171, 60.646]
  - - [256, 8192, 1, 4096, 288, 288, 4128, 4128]
    - [177, 67.812]
  - - [256, 8192, 1, 8192, 288, 288, 8224, 8224]
    - [158, 67.295]
  - - [384, 64, 1, 64, 416, 416, 384, 96]
    - [83, 0.268]
  - - [384, 64, 1, 128, 416, 416, 384, 160]
    - [78, 0.517]
  - - [384, 64, 1, 256, 416, 416, 384, 288]
    - [94, 0.967]
  - - [384, 64, 1, 512, 416, 416, 544, 544]
    - [96, 1.686]
  - - [384, 64, 1, 1024, 416, 416, 1056, 1056]
    - [87, 2.72]
  - - [384, 64, 1, 2048, 416, 416, 2080, 2080]
    - [73, 3.895]
  - - [384, 64, 1, 4096, 416, 416, 4128, 4128]
    - [73, 4.988]
  - - [384, 64, 1, 8192, 416, 416, 8224, 8224]
    - [74, 5.723]
  - - [384, 128, 1, 64, 416, 416, 384, 96]
    - [87, 0.534]
  - - [384, 128, 1, 128, 416, 416, 384, 160]
    - [73, 1.033]
  - - [384, 128, 1, 256, 416, 416, 384, 288]
    - [78, 1.941]
  - - [384, 128, 1, 512, 416, 416, 544, 544]
    - [89, 3.385]
  - - [384, 128, 1, 1024, 416, 416, 1056, 1056]
    - [97, 5.425]
  - - [384, 128, 1, 2048, 416, 416, 2080, 2080]
    - [88, 7.806]
  - - [384, 128, 1, 4096, 416, 416, 4128, 4128]
    - [89, 9.991]
  - - [384, 128, 1, 8192, 416, 416, 8224, 8224]
    - [88, 11.489]
  - - [384, 256, 1, 64, 416, 416, 384, 96]
    - [85, 1.052]
  - - [384, 256, 1, 128, 416, 416, 384, 160]
    - [88, 2.022]
  - - [384, 256, 1, 256, 416, 416, 384, 288]
    - [92, 3.778]
  - - [384, 256, 1, 512, 416, 416, 544, 544]
    - [97, 6.677]
  - - [384, 256, 1, 1024, 416, 416, 1056, 1056]
    - [73, 10.739]
  - - [384, 256, 1, 2048, 416, 416, 2080, 2080]
    - [96, 15.452]
  - - [384, 256, 1, 4096, 416, 416, 4128, 4128]
    - [98, 19.686]
  - - [384, 256, 1, 8192, 416, 416, 8224, 8224]
    - [74, 22.613]
  - - [384, 512, 1, 64, 416, 416, 384, 96]
    - [95, 2.06]
  - - [384, 512, 1, 128, 416, 416, 384, 160]
    - [108, 3.842]
  - - [384, 512, 1, 256, 416, 416, 384, 288]
    - [139, 6.981]
  - - [384, 512, 1, 512, 416, 416, 544, 544]
    - [138, 11.635]
  - - [384, 512, 1, 1024, 416, 416, 1056, 1056]
    - [109, 17.422]
  - - [384, 512, 1, 2048, 416, 416, 2080, 2080]
    - [109, 23.309]
  - - [384, 512, 1, 4096, 416, 416, 4128, 4128]
    - [107, 27.0]
  - - [384, 512, 1, 8192, 416, 416, 8224, 8224]
    - [110, 30.434]
  - - [384, 1024, 1, 64, 416, 416, 384, 96]
    - [116, 3.916]
  - - [384, 1024, 1, 128, 416, 416, 384, 160]
    - [126, 7.29]
  - - [384, 1024, 1, 256, 416, 416, 384, 288]
    - [108, 13.136]
  - - [384, 1024, 1, 512, 416, 416, 544, 544]
    - [119, 21.455]
  - - [384, 1024, 1, 1024, 416, 416, 1056, 1056]
    - [124, 31.335]
  - - [384, 1024, 1, 2048, 416, 416, 2080, 2080]
    - [116, 42.059]
  - - [384, 1024, 1, 4096, 416, 416, 4128, 4128]
    - [118, 49.645]
  - - [384, 1024, 1, 8192, 416, 416, 8224, 8224]
    - [116, 55.223]
  - - [384, 2048, 1, 64, 416, 416, 384, 96]
    - [148, 6.661]
  - - [384, 2048, 1, 128, 416, 416, 384, 160]
    - [107, 12.097]
  - - [384, 2048, 1, 256, 416, 416, 384, 288]
    - [8, 19.57]
  - - [384, 2048, 1, 512, 416, 416, 544, 544]
    - [13, 29.086]
  - - [384, 2048, 1, 1024, 416, 416, 1056, 1056]
    - [122, 38.946]
  - - [384, 2048, 1, 2048, 416, 416, 2080, 2080]
    - [141, 47.859]
  - - [384, 2048, 1, 4096, 416, 416, 4128, 4128]
    - [18, 54.448]
  - - [384, 2048, 1, 8192, 416, 416, 8224, 8224]
    - [135, 57.36]
  - - [384, 4096, 1, 64, 416, 416, 384, 96]
    - [117, 11.231]
  - - [384, 4096, 1, 128, 416, 416, 384, 160]
    - [180, 18.735]
  - - [384, 4096, 1, 256, 416, 416, 384, 288]
    - [179, 32.191]
  - - [384, 4096, 1, 512, 416, 416, 544, 544]
    - [55, 45.457]
  - - [384, 4096, 1, 1024, 416, 416, 1056, 1056]
    - [35, 57.505]
  - - [384, 4096, 1, 2048, 416, 416, 2080, 2080]
    - [42, 70.08]
  - - [384, 4096, 1, 4096, 416, 416, 4128, 4128]
    - [51, 74.942]
  - - [384, 4096, 1, 8192, 416, 416, 8224, 8224]
    - [60, 79.56]
  - - [384, 8192, 1, 64, 416, 416, 384, 96]
    - [61, 18.178]
  - - [384, 8192, 1, 128, 416, 416, 384, 160]
    - [169, 29.009]
  - - [384, 8192, 1, 256, 416, 416, 384, 288]
    - [167, 41.656]
  - - [384, 8192, 1, 512, 416, 416, 544, 544]
    - [67, 54.759]
  - - [384, 8192, 1, 1024, 416, 416, 1056, 1056]
    - [158, 62.191]
  - - [384, 8192, 1, 2048, 416, 416, 2080, 2080]
    - [158, 66.425]
  - - [384, 8192, 1, 4096, 416, 416, 4128, 4128]
    - [156, 70.5]
  - - [384, 8192, 1, 8192, 416, 416, 8224, 8224]
    - [51, 66.305]
  - - [768, 64, 1, 64, 800, 800, 768, 96]
    - [88, 0.535]
  - - [768, 64, 1, 128, 800, 800, 768, 160]
    - [87, 1.031]
  - - [768, 64, 1, 256, 800, 800, 768, 288]
    - [94, 1.94]
  - - [768, 64, 1, 512, 800, 800, 768, 544]
    - [92, 3.481]
  - - [768, 64, 1, 1024, 800, 800, 1056, 1056]
    - [72, 5.425]
  - - [768, 64, 1, 2048, 800, 800, 2080, 2080]
    - [72, 7.775]
  - - [768, 64, 1, 4096, 800, 800, 4128, 4128]
    - [89, 9.889]
  - - [768, 64, 1, 8192, 800, 800, 8224, 8224]
    - [74, 11.387]
  - - [768, 128, 1, 64, 800, 800, 768, 96]
    - [81, 1.051]
  - - [768, 128, 1, 128, 800, 800, 768, 160]
    - [73, 2.036]
  - - [768, 128, 1, 256, 800, 800, 768, 288]
    - [78, 3.774]
  - - [768, 128, 1, 512, 800, 800, 768, 544]
    - [96, 6.692]
  - - [768, 128, 1, 1024, 800, 800, 1056, 1056]
    - [96, 10.713]
  - - [768, 128, 1, 2048, 800, 800, 2080, 2080]
    - [73, 15.339]
  - - [768, 128, 1, 4096, 800, 800, 4128, 4128]
    - [74, 19.614]
  - - [768, 128, 1, 8192, 800, 800, 8224, 8224]
    - [78, 22.305]
  - - [768, 256, 1, 64, 800, 800, 768, 96]
    - [132, 2.05]
  - - [768, 256, 1, 128, 800, 800, 768, 160]
    - [70, 3.869]
  - - [768, 256, 1, 256, 800, 800, 768, 288]
    - [107, 6.963]
  - - [768, 256, 1, 512, 800, 800, 768, 544]
    - [137, 11.581]
  - - [768, 256, 1, 1024, 800, 800, 1056, 1056]
    - [138, 17.482]
  - - [768, 256, 1, 2048, 800, 800, 2080, 2080]
    - [137, 23.276]
  - - [768, 256, 1, 4096, 800, 800, 4128, 4128]
    - [137, 26.813]
  - - [768, 256, 1, 8192, 800, 800, 8224, 8224]
    - [110, 30.753]
  - - [768, 512, 1, 64, 800, 800, 768, 96]
    - [102, 3.9]
  - - [768, 512, 1, 128, 800, 800, 768, 160]
    - [108, 7.278]
  - - [768, 512, 1, 256, 800, 800, 768, 288]
    - [137, 13.006]
  - - [768, 512, 1, 512, 800, 800, 768, 544]
    - [104, 20.994]
  - - [768, 512, 1, 1024, 800, 800, 1056, 1056]
    - [129, 30.724]
  - - [768, 512, 1, 2048, 800, 800, 2080, 2080]
    - [118, 41.999]
  - - [768, 512, 1, 4096, 800, 800, 4128, 4128]
    - [116, 48.905]
  - - [768, 512, 1, 8192, 800, 800, 8224, 8224]
    - [118, 54.595]
  - - [768, 1024, 1, 64, 800, 800, 768, 96]
    - [101, 6.635]
  - - [768, 1024, 1, 128, 800, 800, 768, 160]
    - [117, 12.044]
  - - [768, 1024, 1, 256, 800, 800, 768, 288]
    - [125, 19.476]
  - - [768, 1024, 1, 512, 800, 800, 768, 544]
    - [11, 29.408]
  - - [768, 1024, 1, 1024, 800, 800, 1056, 1056]
    - [11, 39.2]
  - - [768, 1024, 1, 2048, 800, 800, 2080, 2080]
    - [137, 48.415]
  - - [768, 1024, 1, 4096, 800, 800, 4128, 4128]
    - [109, 55.839]
  - - [768, 1024, 1, 8192, 800, 800, 8224, 8224]
    - [135, 58.998]
  - - [768, 2048, 1, 64, 800, 800, 768, 96]
    - [143, 11.263]
  - - [768, 2048, 1, 128, 800, 800, 768, 160]
    - [155, 18.668]
  - - [768, 2048, 1, 256, 800, 800, 768, 288]
    - [35, 32.081]
  - - [768, 2048, 1, 512, 800, 800, 768, 544]
    - [179, 45.654]
  - - [768, 2048, 1, 1024, 800, 800, 1056, 1056]
    - [31, 57.805]
  - - [768, 2048, 1, 2048, 800, 800, 2080, 2080]
    - [63, 70.459]
  - - [768, 2048, 1, 4096, 800, 800, 4128, 4128]
    - [51, 75.242]
  - - [768, 2048, 1, 8192, 800, 800, 8224, 8224]
    - [63, 81.376]
  - - [768, 4096, 1, 64, 800, 800, 768, 96]
    - [29, 18.425]
  - - [768, 4096, 1, 128, 800, 800, 768, 160]
    - [164, 28.922]
  - - [768, 4096, 1, 256, 800, 800, 768, 288]
    - [172, 41.005]
  - - [768, 4096, 1, 512, 800, 800, 768, 544]
    - [44, 55.538]
  - - [768, 4096, 1, 1024, 800, 800, 1056, 1056]
    - [30, 61.649]
  - - [768, 4096, 1, 2048, 800, 800, 2080, 2080]
    - [158, 66.104]
  - - [768, 4096, 1, 4096, 800, 800, 4128, 4128]
    - [162, 69.382]
  - - [768, 4096, 1, 8192, 800, 800, 8224, 8224]
    - [27, 66.416]
  - - [768, 8192, 1, 64, 800, 800, 768, 96]
    - [140, 24.821]
  - - [768, 8192, 1, 128, 800, 800, 768, 160]
    - [159, 39.061]
  - - [768, 8192, 1, 256, 800, 800, 768, 288]
    - [173, 51.38]
  - - [768, 8192, 1, 512, 800, 800, 768, 544]
    - [157, 61.003]
  - - [768, 8192, 1, 1024, 800, 800, 1056, 1056]
    - [165, 64.923]
  - - [768, 8192, 1, 2048, 800, 800, 2080, 2080]
    - [167, 71.751]
  - - [768, 8192, 1, 4096, 800, 800, 4128, 4128]
    - [159, 67.903]
  - - [768, 8192, 1, 8192, 800, 800, 8224, 8224]
    - [156, 64.935]
  - - [1536, 64, 1, 64, 1568, 1568, 1536, 96]
    - [84, 1.025]
  - - [1536, 64, 1, 128, 1568, 1568, 1536, 160]
    - [89, 2.001]
  - - [1536, 64, 1, 256, 1568, 1568, 1536, 288]
    - [89, 3.802]
  - - [1536, 64, 1, 512, 1568, 1568, 1536, 544]
    - [96, 6.658]
  - - [1536, 64, 1, 1024, 1568, 1568, 1536, 1056]
    - [84, 10.766]
  - - [1536, 64, 1, 2048, 1568, 1568, 2080, 2080]
    - [73, 15.287]
  - - [1536, 64, 1, 4096, 1568, 1568, 4128, 4128]
    - [73, 19.529]
  - - [1536, 64, 1, 8192, 1568, 1568, 8224, 8224]
    - [74, 22.179]
  - - [1536, 128, 1, 64, 1568, 1568, 1536, 96]
    - [87, 2.06]
  - - [1536, 128, 1, 128, 1568, 1568, 1536, 160]
    - [119, 3.863]
  - - [1536, 128, 1, 256, 1568, 1568, 1536, 288]
    - [140, 6.908]
  - - [1536, 128, 1, 512, 1568, 1568, 1536, 544]
    - [110, 11.639]
  - - [1536, 128, 1, 1024, 1568, 1568, 1536, 1056]
    - [136, 17.473]
  - - [1536, 128, 1, 2048, 1568, 1568, 2080, 2080]
    - [138, 23.283]
  - - [1536, 128, 1, 4096, 1568, 1568, 4128, 4128]
    - [110, 27.046]
  - - [1536, 128, 1, 8192, 1568, 1568, 8224, 8224]
    - [138, 30.902]
  - - [1536, 256, 1, 64, 1568, 1568, 1536, 96]
    - [130, 3.891]
  - - [1536, 256, 1, 128, 1568, 1568, 1536, 160]
    - [107, 7.331]
  - - [1536, 256, 1, 256, 1568, 1568, 1536, 288]
    - [151, 13.087]
  - - [1536, 256, 1, 512, 1568, 1568, 1536, 544]
    - [139, 21.221]
  - - [1536, 256, 1, 1024, 1568, 1568, 1536, 1056]
    - [120, 30.927]
  - - [1536, 256, 1, 2048, 1568, 1568, 2080, 2080]
    - [130, 39.908]
  - - [1536, 256, 1, 4096, 1568, 1568, 4128, 4128]
    - [110, 46.479]
  - - [1536, 256, 1, 8192, 1568, 1568, 8224, 8224]
    - [134, 53.152]
  - - [1536, 512, 1, 64, 1568, 1568, 1536, 96]
    - [107, 6.557]
  - - [1536, 512, 1, 128, 1568, 1568, 1536, 160]
    - [131, 11.966]
  - - [1536, 512, 1, 256, 1568, 1568, 1536, 288]
    - [12, 19.419]
  - - [1536, 512, 1, 512, 1568, 1568, 1536, 544]
    - [7, 29.089]
  - - [1536, 512, 1, 1024, 1568, 1568, 1536, 1056]
    - [15, 39.018]
  - - [1536, 512, 1, 2048, 1568, 1568, 2080, 2080]
    - [109, 46.853]
  - - [1536, 512, 1, 4096, 1568, 1568, 4128, 4128]
    - [6, 54.282]
  - - [1536, 512, 1, 8192, 1568, 1568, 8224, 8224]
    - [109, 57.144]
  - - [1536, 1024, 1, 64, 1568, 1568, 1536, 96]
    - [115, 11.155]
  - - [1536, 1024, 1, 128, 1568, 1568, 1536, 160]
    - [175, 19.084]
  - - [1536, 1024, 1, 256, 1568, 1568, 1536, 288]
    - [154, 32.024]
  - - [1536, 1024, 1, 512, 1568, 1568, 1536, 544]
    - [159, 45.58]
  - - [1536, 1024, 1, 1024, 1568, 1568, 1536, 1056]
    - [28, 57.861]
  - - [1536, 1024, 1, 2048, 1568, 1568, 2080, 2080]
    - [42, 69.96]
  - - [1536, 1024, 1, 4096, 1568, 1568, 4128, 4128]
    - [51, 75.157]
  - - [1536, 1024, 1, 8192, 1568, 1568, 8224, 8224]
    - [27, 81.326]
  - - [1536, 2048, 1, 64, 1568, 1568, 1536, 96]
    - [43, 18.42]
  - - [1536, 2048, 1, 128, 1568, 1568, 1536, 160]
    - [154, 29.106]
  - - [1536, 2048, 1, 256, 1568, 1568, 1536, 288]
    - [158, 41.136]
  - - [1536, 2048, 1, 512, 1568, 1568, 1536, 544]
    - [45, 55.639]
  - - [1536, 2048, 1, 1024, 1568, 1568, 1536, 1056]
    - [31, 64.127]
  - - [1536, 2048, 1, 2048, 1568, 1568, 2080, 2080]
    - [158, 66.817]
  - - [1536, 2048, 1, 4096, 1568, 1568, 4128, 4128]
    - [154, 72.399]
  - - [1536, 2048, 1, 8192, 1568, 1568, 8224, 8224]
    - [156, 67.385]
  - - [1536, 4096, 1, 64, 1568, 1568, 1536, 96]
    - [47, 24.927]
  - - [1536, 4096, 1, 128, 1568, 1568, 1536, 160]
    - [159, 38.922]
  - - [1536, 4096, 1, 256, 1568, 1568, 1536, 288]
    - [153, 50.996]
  - - [1536, 4096, 1, 512, 1568, 1568, 1536, 544]
    - [170, 61.367]
  - - [1536, 4096, 1, 1024, 1568, 1568, 1536, 1056]
    - [176, 66.157]
  - - [1536, 4096, 1, 2048, 1568, 1568, 2080, 2080]
    - [44, 70.636]
  - - [1536, 4096, 1, 4096, 1568, 1568, 4128, 4128]
    - [180, 66.576]
  - - [1536, 4096, 1, 8192, 1568, 1568, 8224, 8224]
    - [153, 69.635]
  - - [1536, 8192, 1, 64, 1568, 1568, 1536, 96]
    - [39, 33.469]
  - - [1536, 8192, 1, 128, 1568, 1568, 1536, 160]
    - [160, 47.945]
  - - [1536, 8192, 1, 256, 1568, 1568, 1536, 288]
    - [154, 58.598]
  - - [1536, 8192, 1, 512, 1568, 1568, 1536, 544]
    - [41, 64.068]
  - - [1536, 8192, 1, 1024, 1568, 1568, 1536, 1056]
    - [175, 71.513]
  - - [1536, 8192, 1, 2048, 1568, 1568, 2080, 2080]
    - [173, 66.898]
  - - [1536, 8192, 1, 4096, 1568, 1568, 4128, 4128]
    - [153, 65.846]
  - - [1536, 8192, 1, 8192, 1568, 1568, 8224, 8224]
    - [153, 65.659]
  - - [3072, 64, 1, 64, 3104, 3104, 3072, 96]
    - [71, 1.949]
  - - [3072, 64, 1, 128, 3104, 3104, 3072, 160]
    - [109, 3.835]
  - - [3072, 64, 1, 256, 3104, 3104, 3072, 288]
    - [150, 6.961]
  - - [3072, 64, 1, 512, 3104, 3104, 3072, 544]
    - [123, 11.605]
  - - [3072, 64, 1, 1024, 3104, 3104, 3072, 1056]
    - [110, 17.487]
  - - [3072, 64, 1, 2048, 3104, 3104, 3072, 2080]
    - [109, 23.27]
  - - [3072, 64, 1, 4096, 3104, 3104, 4128, 4128]
    - [108, 27.903]
  - - [3072, 64, 1, 8192, 3104, 3104, 8224, 8224]
    - [138, 30.858]
  - - [3072, 128, 1, 64, 3104, 3104, 3072, 96]
    - [151, 3.887]
  - - [3072, 128, 1, 128, 3104, 3104, 3072, 160]
    - [110, 7.282]
  - - [3072, 128, 1, 256, 3104, 3104, 3072, 288]
    - [136, 13.046]
  - - [3072, 128, 1, 512, 3104, 3104, 3072, 544]
    - [146, 21.224]
  - - [3072, 128, 1, 1024, 3104, 3104, 3072, 1056]
    - [121, 30.758]
  - - [3072, 128, 1, 2048, 3104, 3104, 3072, 2080]
    - [101, 39.669]
  - - [3072, 128, 1, 4096, 3104, 3104, 4128, 4128]
    - [135, 46.186]
  - - [3072, 128, 1, 8192, 3104, 3104, 8224, 8224]
    - [133, 53.184]
  - - [3072, 256, 1, 64, 3104, 3104, 3072, 96]
    - [121, 6.591]
  - - [3072, 256, 1, 128, 3104, 3104, 3072, 160]
    - [152, 11.935]
  - - [3072, 256, 1, 256, 3104, 3104, 3072, 288]
    - [19, 19.156]
  - - [3072, 256, 1, 512, 3104, 3104, 3072, 544]
    - [20, 28.902]
  - - [3072, 256, 1, 1024, 3104, 3104, 3072, 1056]
    - [16, 38.374]
  - - [3072, 256, 1, 2048, 3104, 3104, 3072, 2080]
    - [5, 47.293]
  - - [3072, 256, 1, 4096, 3104, 3104, 4128, 4128]
    - [135, 51.691]
  - - [3072, 256, 1, 8192, 3104, 3104, 8224, 8224]
    - [17, 55.703]
  - - [3072, 512, 1, 64, 3104, 3104, 3072, 96]
    - [21, 11.127]
  - - [3072, 512, 1, 128, 3104, 3104, 3072, 160]
    - [175, 18.901]
  - - [3072, 512, 1, 256, 3104, 3104, 3072, 288]
    - [58, 31.849]
  - - [3072, 512, 1, 512, 3104, 3104, 3072, 544]
    - [153, 45.302]
  - - [3072, 512, 1, 1024, 3104, 3104, 3072, 1056]
    - [30, 57.58]
  - - [3072, 512, 1, 2048, 3104, 3104, 3072, 2080]
    - [51, 70.289]
  - - [3072, 512, 1, 4096, 3104, 3104, 4128, 4128]
    - [30, 75.354]
  - - [3072, 512, 1, 8192, 3104, 3104, 8224, 8224]
    - [30, 77.787]
  - - [3072, 1024, 1, 64, 3104, 3104, 3072, 96]
    - [110, 17.884]
  - - [3072, 1024, 1, 128, 3104, 3104, 3072, 160]
    - [169, 28.637]
  - - [3072, 1024, 1, 256, 3104, 3104, 3072, 288]
    - [30, 40.773]
  - - [3072, 1024, 1, 512, 3104, 3104, 3072, 544]
    - [32, 54.484]
  - - [3072, 1024, 1, 1024, 3104, 3104, 3072, 1056]
    - [170, 64.455]
  - - [3072, 1024, 1, 2048, 3104, 3104, 3072, 2080]
    - [170, 68.165]
  - - [3072, 1024, 1, 4096, 3104, 3104, 4128, 4128]
    - [65, 71.79]
  - - [3072, 1024, 1, 8192, 3104, 3104, 8224, 8224]
    - [171, 66.459]
  - - [3072, 2048, 1, 64, 3104, 3104, 3072, 96]
    - [22, 24.927]
  - - [3072, 2048, 1, 128, 3104, 3104, 3072, 160]
    - [160, 38.79]
  - - [3072, 2048, 1, 256, 3104, 3104, 3072, 288]
    - [153, 50.911]
  - - [3072, 2048, 1, 512, 3104, 3104, 3072, 544]
    - [170, 62.166]
  - - [3072, 2048, 1, 1024, 3104, 3104, 3072, 1056]
    - [167, 66.623]
  - - [3072, 2048, 1, 2048, 3104, 3104, 3072, 2080]
    - [164, 72.377]
  - - [3072, 2048, 1, 4096, 3104, 3104, 4128, 4128]
    - [50, 69.175]
  - - [3072, 2048, 1, 8192, 3104, 3104, 8224, 8224]
    - [49, 69.38]
  - - [3072, 4096, 1, 64, 3104, 3104, 3072, 96]
    - [36, 32.377]
  - - [3072, 4096, 1, 128, 3104, 3104, 3072, 160]
    - [154, 47.824]
  - - [3072, 4096, 1, 256, 3104, 3104, 3072, 288]
    - [169, 58.359]
  - - [3072, 4096, 1, 512, 3104, 3104, 3072, 544]
    - [166, 63.671]
  - - [3072, 4096, 1, 1024, 3104, 3104, 3072, 1056]
    - [177, 70.453]
  - - [3072, 4096, 1, 2048, 3104, 3104, 3072, 2080]
    - [37, 65.601]
  - - [3072, 4096, 1, 4096, 3104, 3104, 4128, 4128]
    - [66, 66.799]
  - - [3072, 4096, 1, 8192, 3104, 3104, 8224, 8224]
    - [159, 67.726]
  - - [3072, 8192, 1, 64, 3104, 3104, 3072, 96]
    - [3, 34.596]
  - - [3072, 8192, 1, 128, 3104, 3104, 3072, 160]
    - [155, 50.508]
  - - [3072, 8192, 1, 256, 3104, 3104, 3072, 288]
    - [161, 62.757]
  - - [3072, 8192, 1, 512, 3104, 3104, 3072, 544]
    - [154, 67.854]
  - - [3072, 8192, 1, 1024, 3104, 3104, 3072, 1056]
    - [180, 63.642]
  - - [3072, 8192, 1, 2048, 3104, 3104, 3072, 2080]
    - [26, 62.651]
  - - [3072, 8192, 1, 4096, 3104, 3104, 4128, 4128]
    - [153, 66.085]
  - - [3072, 8192, 1, 8192, 3104, 3104, 8224, 8224]
    - [154, 65.721]
  - - [6144, 64, 1, 64, 6176, 6176, 6144, 96]
    - [23, 3.69]
  - - [6144, 64, 1, 128, 6176, 6176, 6144, 160]
    - [138, 7.277]
  - - [6144, 64, 1, 256, 6176, 6176, 6144, 288]
    - [115, 13.022]
  - - [6144, 64, 1, 512, 6176, 6176, 6144, 544]
    - [120, 21.146]
  - - [6144, 64, 1, 1024, 6176, 6176, 6144, 1056]
    - [129, 30.405]
  - - [6144, 64, 1, 2048, 6176, 6176, 6144, 2080]
    - [129, 39.298]
  - - [6144, 64, 1, 4096, 6176, 6176, 6144, 4128]
    - [105, 46.721]
  - - [6144, 64, 1, 8192, 6176, 6176, 8224, 8224]
    - [134, 53.322]
  - - [6144, 128, 1, 64, 6176, 6176, 6144, 96]
    - [109, 6.565]
  - - [6144, 128, 1, 128, 6176, 6176, 6144, 160]
    - [138, 12.044]
  - - [6144, 128, 1, 256, 6176, 6176, 6144, 288]
    - [110, 19.206]
  - - [6144, 128, 1, 512, 6176, 6176, 6144, 544]
    - [24, 28.919]
  - - [6144, 128, 1, 1024, 6176, 6176, 6144, 1056]
    - [4, 38.5]
  - - [6144, 128, 1, 2048, 6176, 6176, 6144, 2080]
    - [6, 47.228]
  - - [6144, 128, 1, 4096, 6176, 6176, 6144, 4128]
    - [6, 54.189]
  - - [6144, 128, 1, 8192, 6176, 6176, 8224, 8224]
    - [5, 55.199]
  - - [6144, 256, 1, 64, 6176, 6176, 6144, 96]
    - [9, 11.143]
  - - [6144, 256, 1, 128, 6176, 6176, 6144, 160]
    - [155, 18.864]
  - - [6144, 256, 1, 256, 6176, 6176, 6144, 288]
    - [56, 31.93]
  - - [6144, 256, 1, 512, 6176, 6176, 6144, 544]
    - [168, 45.18]
  - - [6144, 256, 1, 1024, 6176, 6176, 6144, 1056]
    - [35, 57.627]
  - - [6144, 256, 1, 2048, 6176, 6176, 6144, 2080]
    - [47, 70.407]
  - - [6144, 256, 1, 4096, 6176, 6176, 6144, 4128]
    - [51, 75.527]
  - - [6144, 256, 1, 8192, 6176, 6176, 8224, 8224]
    - [157, 78.484]
  - - [6144, 512, 1, 64, 6176, 6176, 6144, 96]
    - [109, 17.35]
  - - [6144, 512, 1, 128, 6176, 6176, 6144, 160]
    - [173, 28.504]
  - - [6144, 512, 1, 256, 6176, 6176, 6144, 288]
    - [51, 40.543]
  - - [6144, 512, 1, 512, 6176, 6176, 6144, 544]
    - [44, 54.256]
  - - [6144, 512, 1, 1024, 6176, 6176, 6144, 1056]
    - [156, 63.824]
  - - [6144, 512, 1, 2048, 6176, 6176, 6144, 2080]
    - [157, 68.549]
  - - [6144, 512, 1, 4096, 6176, 6176, 6144, 4128]
    - [171, 74.004]
  - - [6144, 512, 1, 8192, 6176, 6176, 8224, 8224]
    - [31, 67.709]
  - - [6144, 1024, 1, 64, 6176, 6176, 6144, 96]
    - [10, 24.738]
  - - [6144, 1024, 1, 128, 6176, 6176, 6144, 160]
    - [164, 38.787]
  - - [6144, 1024, 1, 256, 6176, 6176, 6144, 288]
    - [164, 51.375]
  - - [6144, 1024, 1, 512, 6176, 6176, 6144, 544]
    - [158, 63.539]
  - - [6144, 1024, 1, 1024, 6176, 6176, 6144, 1056]
    - [170, 68.483]
  - - [6144, 1024, 1, 2048, 6176, 6176, 6144, 2080]
    - [178, 73.711]
  - - [6144, 1024, 1, 4096, 6176, 6176, 6144, 4128]
    - [25, 68.461]
  - - [6144, 1024, 1, 8192, 6176, 6176, 8224, 8224]
    - [31, 68.913]
  - - [6144, 2048, 1, 64, 6176, 6176, 6144, 96]
    - [14, 31.168]
  - - [6144, 2048, 1, 128, 6176, 6176, 6144, 160]
    - [169, 47.639]
  - - [6144, 2048, 1, 256, 6176, 6176, 6144, 288]
    - [169, 58.513]
  - - [6144, 2048, 1, 512, 6176, 6176, 6144, 544]
    - [181, 63.827]
  - - [6144, 2048, 1, 1024, 6176, 6176, 6144, 1056]
    - [52, 70.942]
  - - [6144, 2048, 1, 2048, 6176, 6176, 6144, 2080]
    - [59, 66.905]
  - - [6144, 2048, 1, 4096, 6176, 6176, 6144, 4128]
    - [173, 67.795]
  - - [6144, 2048, 1, 8192, 6176, 6176, 8224, 8224]
    - [153, 67.307]
  - - [6144, 4096, 1, 64, 6176, 6176, 6144, 96]
    - [2, 34.081]
  - - [6144, 4096, 1, 128, 6176, 6176, 6144, 160]
    - [160, 50.138]
  - - [6144, 4096, 1, 256, 6176, 6176, 6144, 288]
    - [164, 62.398]
  - - [6144, 4096, 1, 512, 6176, 6176, 6144, 544]
    - [40, 69.692]
  - - [6144, 4096, 1, 1024, 6176, 6176, 6144, 1056]
    - [38, 66.737]
  - - [6144, 4096, 1, 2048, 6176, 6176, 6144, 2080]
    - [163, 62.863]
  - - [6144, 4096, 1, 4096, 6176, 6176, 6144, 4128]
    - [174, 67.13]
  - - [6144, 4096, 1, 8192, 6176, 6176, 8224, 8224]
    - [153, 65.809]
  - - [6144, 8192, 1, 64, 6176, 6176, 6144, 96]
    - [1, 14.994]
  - - [6144, 8192, 1, 128, 6176, 6176, 6144, 160]
    - [76, 28.848]
  - - [6144, 8192, 1, 256, 6176, 6176, 6144, 288]
    - [112, 49.146]
  - - [6144, 8192, 1, 512, 6176, 6176, 6144, 544]
    - [168, 59.174]
  - - [6144, 8192, 1, 1024, 6176, 6176, 6144, 1056]
    - [179, 59.289]
  - - [6144, 8192, 1, 2048, 6176, 6176, 6144, 2080]
    - [154, 65.492]
  - - [6144, 8192, 1, 4096, 6176, 6176, 6144, 4128]
    - [159, 66.278]
  - - [6144, 8192, 1, 8192, 6176, 6176, 8224, 8224]
    - [168, 64.0]
- null
- null
- DeviceEfficiency
