library/src/blas3/Tensile/Logic/asm_full/navi31/navi31_Cijk_Alik_Bljk_HB_GB.yaml
- {MinimumRequiredVersion: 4.35.0}
- navi31
- gfx1100
- [Device 73bf]
    SolutionIndex: 0
    SolutionNameMin: Cijk_Alik_Bljk_HB_MT32x32x16_MI16x16x16x1_SN_1LDSB0_AMAS0_GRVW8_IU1_SIA1_SU0_SUS0_SVW1_TT1_16_VW1_WGM4
    SolutionIndex: 1
    SolutionNameMin: Cijk_Alik_Bljk_HB_MT32x32x16_MI16x16x16x1_SN_1LDSB1_AMAS0_GRVW4_IU1_SIA2_SU0_SUS0_SVW1_TT1_16_VW1_WGM4
    SolutionIndex: 2
    SolutionNameMin: Cijk_Alik_Bljk_HB_MT32x32x16_MI16x16x16x1_SN_1LDSB0_AMAS0_GRVW2_IU1_SIA1_SU32_SUS128_SVW1_TT1_16_VW1_WGM4
    SolutionIndex: 3
    SolutionNameMin: Cijk_Alik_Bljk_HB_MT32x32x16_MI16x16x16x1_SN_1LDSB1_AMAS0_GRVW4_IU1_SIA2_SU32_SUS256_SVW1_TT1_16_VW1_WGM4
    SolutionIndex: 4
    SolutionNameMin: Cijk_Alik_Bljk_HB_MT32x32x16_MI16x16x16x1_SN_1LDSB0_AMAS0_GRVW4_IU1_SIA1_SU0_SUS0_SVW1_TT1_16_VW1_WGM8
    SolutionIndex: 5
    SolutionNameMin: Cijk_Alik_Bljk_HB_MT32x32x16_MI16x16x16x1_SN_1LDSB0_AMAS0_GRVW4_IU1_SIA3_SU0_SUS0_SVW1_TT1_16_VW1_WGM8
    SolutionIndex: 6
    SolutionNameMin: Cijk_Alik_Bljk_HB_MT32x32x16_MI16x16x16x1_SN_1LDSB1_AMAS0_GRVW4_IU1_SIA2_SU32_SUS256_SVW1_TT1_16_VW1_WGM8
    SolutionIndex: 7
    SolutionNameMin: Cijk_Alik_Bljk_HB_MT64x64x16_MI16x16x16x1_SN_1LDSB0_AMAS0_GRVW8_IU1_SIA1_SU0_SUS0_SVW1_TT2_32_VW1_WGM4
    SolutionIndex: 8
    SolutionNameMin: Cijk_Alik_Bljk_HB_MT64x64x16_MI16x16x16x1_SN_1LDSB0_AMAS3_GRVW8_IU1_SIA1_SU0_SUS0_SVW2_TT2_32_VW2_WGM4
    SolutionIndex: 9
    SolutionNameMin: Cijk_Alik_Bljk_HB_MT64x64x16_MI16x16x16x1_SN_1LDSB1_AMAS3_GRVW4_IU1_SIA2_SU0_SUS0_SVW2_TT2_32_VW2_WGM4
    SolutionIndex: 10
    SolutionNameMin: Cijk_Alik_Bljk_HB_MT64x64x16_MI16x16x16x1_SN_1LDSB0_AMAS3_GRVW8_IU1_SIA3_SU0_SUS0_SVW2_TT2_32_VW2_WGM4
    SolutionIndex: 11
    SolutionNameMin: Cijk_Alik_Bljk_HB_MT64x64x16_MI16x16x16x1_SN_1LDSB0_AMAS3_GRVW4_IU1_SIA1_SU32_SUS128_SVW2_TT2_32_VW2_WGM4
    SolutionIndex: 12
    SolutionNameMin: Cijk_Alik_Bljk_HB_MT64x64x16_MI16x16x16x1_SN_1LDSB1_AMAS3_GRVW4_IU1_SIA2_SU32_SUS128_SVW2_TT2_32_VW2_WGM4
    SolutionIndex: 13
    SolutionNameMin: Cijk_Alik_Bljk_HB_MT64x64x16_MI16x16x16x1_SN_1LDSB0_AMAS3_GRVW4_IU1_SIA1_SU32_SUS256_SVW2_TT2_32_VW2_WGM4
    SolutionIndex: 14
    SolutionNameMin: Cijk_Alik_Bljk_HB_MT64x64x16_MI16x16x16x1_SN_1LDSB0_AMAS3_GRVW8_IU1_SIA1_SU32_SUS256_SVW2_TT2_32_VW2_WGM4
    SolutionIndex: 15
    SolutionNameMin: Cijk_Alik_Bljk_HB_MT64x64x16_MI16x16x16x1_SN_1LDSB0_AMAS3_GRVW4_IU1_SIA3_SU32_SUS256_SVW2_TT2_32_VW2_WGM4
    SolutionIndex: 16
    SolutionNameMin: Cijk_Alik_Bljk_HB_MT64x64x16_MI16x16x16x1_SN_1LDSB0_AMAS3_GRVW8_IU1_SIA3_SU32_SUS256_SVW2_TT2_32_VW2_WGM4
    SolutionIndex: 17
    SolutionNameMin: Cijk_Alik_Bljk_HB_MT64x64x16_MI16x16x16x1_SN_1LDSB0_AMAS3_GRVW2_IU1_SIA1_SU0_SUS0_SVW2_TT2_32_VW2_WGM8
    SolutionIndex: 18
    SolutionNameMin: Cijk_Alik_Bljk_HB_MT64x64x16_MI16x16x16x1_SN_1LDSB1_AMAS3_GRVW4_IU1_SIA2_SU0_SUS0_SVW2_TT2_32_VW2_WGM8
    SolutionIndex: 19
    SolutionNameMin: Cijk_Alik_Bljk_HB_MT64x64x16_MI16x16x16x1_SN_1LDSB0_AMAS3_GRVW8_IU1_SIA3_SU0_SUS0_SVW2_TT2_32_VW2_WGM8
    SolutionIndex: 20
    SolutionNameMin: Cijk_Alik_Bljk_HB_MT64x64x16_MI16x16x16x1_SN_1LDSB0_AMAS3_GRVW8_IU1_SIA1_SU32_SUS128_SVW2_TT2_32_VW2_WGM8
    SolutionIndex: 21
    SolutionNameMin: Cijk_Alik_Bljk_HB_MT64x64x16_MI16x16x16x1_SN_1LDSB0_AMAS3_GRVW8_IU1_SIA1_SU32_SUS256_SVW2_TT2_32_VW2_WGM8
    SolutionIndex: 22
    SolutionNameMin: Cijk_Alik_Bljk_HB_MT64x64x16_MI16x16x16x1_SN_1LDSB1_AMAS3_GRVW4_IU1_SIA2_SU32_SUS256_SVW2_TT2_32_VW2_WGM8
    SolutionIndex: 23
    SolutionNameMin: Cijk_Alik_Bljk_HB_MT64x64x16_MI16x16x16x1_SN_1LDSB1_AMAS3_GRVW8_IU1_SIA2_SU32_SUS256_SVW2_TT2_32_VW2_WGM8
    SolutionIndex: 24
    SolutionNameMin: Cijk_Alik_Bljk_HB_MT64x64x16_MI16x16x16x1_SN_1LDSB0_AMAS3_GRVW8_IU1_SIA3_SU32_SUS256_SVW2_TT2_32_VW2_WGM8
    SolutionIndex: 25
    SolutionNameMin: Cijk_Alik_Bljk_HB_MT128x128x16_MI16x16x16x1_SN_1LDSB0_AMAS0_GRVW2_IU1_SIA1_SU0_SUS0_SVW1_TT4_64_VW1_WGM4
    SolutionIndex: 26
    SolutionNameMin: Cijk_Alik_Bljk_HB_MT128x128x16_MI16x16x16x1_SN_1LDSB0_AMAS3_GRVW2_IU1_SIA1_SU0_SUS0_SVW2_TT4_64_VW2_WGM4
    SolutionIndex: 27
    SolutionNameMin: Cijk_Alik_Bljk_HB_MT128x128x16_MI16x16x16x1_SN_1LDSB0_AMAS0_GRVW4_IU1_SIA1_SU0_SUS0_SVW1_TT4_64_VW1_WGM4
    SolutionIndex: 28
    SolutionNameMin: Cijk_Alik_Bljk_HB_MT128x128x16_MI16x16x16x1_SN_1LDSB0_AMAS3_GRVW4_IU1_SIA1_SU0_SUS0_SVW2_TT4_64_VW2_WGM4
    SolutionIndex: 29
    SolutionNameMin: Cijk_Alik_Bljk_HB_MT128x128x16_MI16x16x16x1_SN_1LDSB0_AMAS0_GRVW8_IU1_SIA1_SU0_SUS0_SVW1_TT4_64_VW1_WGM4
    SolutionIndex: 30
    SolutionNameMin: Cijk_Alik_Bljk_HB_MT128x128x16_MI16x16x16x1_SN_1LDSB0_AMAS3_GRVW8_IU1_SIA1_SU0_SUS0_SVW2_TT4_64_VW2_WGM4
    SolutionIndex: 31
    SolutionNameMin: Cijk_Alik_Bljk_HB_MT128x128x16_MI16x16x16x1_SN_1LDSB0_AMAS3_GRVW2_IU1_SIA3_SU0_SUS0_SVW2_TT4_64_VW2_WGM4
    SolutionIndex: 32
    SolutionNameMin: Cijk_Alik_Bljk_HB_MT128x128x16_MI16x16x16x1_SN_1LDSB0_AMAS0_GRVW4_IU1_SIA3_SU0_SUS0_SVW1_TT4_64_VW1_WGM4
    SolutionIndex: 33
    SolutionNameMin: Cijk_Alik_Bljk_HB_MT128x128x16_MI16x16x16x1_SN_1LDSB0_AMAS3_GRVW4_IU1_SIA3_SU0_SUS0_SVW2_TT4_64_VW2_WGM4
    SolutionIndex: 34
    SolutionNameMin: Cijk_Alik_Bljk_HB_MT128x128x16_MI16x16x16x1_SN_1LDSB0_AMAS3_GRVW8_IU1_SIA3_SU0_SUS0_SVW2_TT4_64_VW2_WGM4
    SolutionIndex: 35
    SolutionNameMin: Cijk_Alik_Bljk_HB_MT128x128x16_MI16x16x16x1_SN_1LDSB0_AMAS3_GRVW2_IU1_SIA1_SU32_SUS128_SVW2_TT4_64_VW2_WGM4
    SolutionIndex: 36
    SolutionNameMin: Cijk_Alik_Bljk_HB_MT128x128x16_MI16x16x16x1_SN_1LDSB0_AMAS3_GRVW4_IU1_SIA1_SU32_SUS128_SVW2_TT4_64_VW2_WGM4
    SolutionIndex: 37
    SolutionNameMin: Cijk_Alik_Bljk_HB_MT128x128x16_MI16x16x16x1_SN_1LDSB0_AMAS3_GRVW8_IU1_SIA1_SU32_SUS128_SVW2_TT4_64_VW2_WGM4
    SolutionIndex: 38
    SolutionNameMin: Cijk_Alik_Bljk_HB_MT128x128x16_MI16x16x16x1_SN_1LDSB0_AMAS0_GRVW2_IU1_SIA3_SU32_SUS128_SVW1_TT4_64_VW1_WGM4
    SolutionIndex: 39
    SolutionNameMin: Cijk_Alik_Bljk_HB_MT128x128x16_MI16x16x16x1_SN_1LDSB0_AMAS3_GRVW2_IU1_SIA3_SU32_SUS128_SVW2_TT4_64_VW2_WGM4
    SolutionIndex: 40
    SolutionNameMin: Cijk_Alik_Bljk_HB_MT128x128x16_MI16x16x16x1_SN_1LDSB0_AMAS0_GRVW8_IU1_SIA3_SU32_SUS128_SVW1_TT4_64_VW1_WGM4
    SolutionIndex: 41
    SolutionNameMin: Cijk_Alik_Bljk_HB_MT128x128x16_MI16x16x16x1_SN_1LDSB0_AMAS3_GRVW8_IU1_SIA3_SU32_SUS128_SVW2_TT4_64_VW2_WGM4
    SolutionIndex: 42
    SolutionNameMin: Cijk_Alik_Bljk_HB_MT128x128x16_MI16x16x16x1_SN_1LDSB0_AMAS0_GRVW2_IU1_SIA1_SU32_SUS256_SVW1_TT4_64_VW1_WGM4
    SolutionIndex: 43
    SolutionNameMin: Cijk_Alik_Bljk_HB_MT128x128x16_MI16x16x16x1_SN_1LDSB0_AMAS3_GRVW2_IU1_SIA1_SU32_SUS256_SVW2_TT4_64_VW2_WGM4
    SolutionIndex: 44
    SolutionNameMin: Cijk_Alik_Bljk_HB_MT128x128x16_MI16x16x16x1_SN_1LDSB0_AMAS0_GRVW4_IU1_SIA1_SU32_SUS256_SVW1_TT4_64_VW1_WGM4
    SolutionIndex: 45
    SolutionNameMin: Cijk_Alik_Bljk_HB_MT128x128x16_MI16x16x16x1_SN_1LDSB0_AMAS3_GRVW4_IU1_SIA1_SU32_SUS256_SVW2_TT4_64_VW2_WGM4
    SolutionIndex: 46
    SolutionNameMin: Cijk_Alik_Bljk_HB_MT128x128x16_MI16x16x16x1_SN_1LDSB0_AMAS3_GRVW8_IU1_SIA1_SU32_SUS256_SVW2_TT4_64_VW2_WGM4
    SolutionIndex: 47
    SolutionNameMin: Cijk_Alik_Bljk_HB_MT128x128x16_MI16x16x16x1_SN_1LDSB1_AMAS3_GRVW2_IU1_SIA2_SU32_SUS256_SVW2_TT4_64_VW2_WGM4
    SolutionIndex: 48
    SolutionNameMin: Cijk_Alik_Bljk_HB_MT128x128x16_MI16x16x16x1_SN_1LDSB0_AMAS3_GRVW8_IU1_SIA3_SU32_SUS256_SVW2_TT4_64_VW2_WGM4
    SolutionIndex: 49
    SolutionNameMin: Cijk_Alik_Bljk_HB_MT128x128x16_MI16x16x16x1_SN_1LDSB0_AMAS0_GRVW2_IU1_SIA1_SU0_SUS0_SVW1_TT4_64_VW1_WGM8
    SolutionIndex: 50
    SolutionNameMin: Cijk_Alik_Bljk_HB_MT128x128x16_MI16x16x16x1_SN_1LDSB0_AMAS3_GRVW2_IU1_SIA1_SU0_SUS0_SVW2_TT4_64_VW2_WGM8
    SolutionIndex: 51
    SolutionNameMin: Cijk_Alik_Bljk_HB_MT128x128x16_MI16x16x16x1_SN_1LDSB0_AMAS0_GRVW4_IU1_SIA1_SU0_SUS0_SVW1_TT4_64_VW1_WGM8
    SolutionIndex: 52
    SolutionNameMin: Cijk_Alik_Bljk_HB_MT128x128x16_MI16x16x16x1_SN_1LDSB0_AMAS3_GRVW4_IU1_SIA1_SU0_SUS0_SVW2_TT4_64_VW2_WGM8
    SolutionIndex: 53
    SolutionNameMin: Cijk_Alik_Bljk_HB_MT128x128x16_MI16x16x16x1_SN_1LDSB0_AMAS0_GRVW8_IU1_SIA1_SU0_SUS0_SVW1_TT4_64_VW1_WGM8
    SolutionIndex: 54
    SolutionNameMin: Cijk_Alik_Bljk_HB_MT128x128x16_MI16x16x16x1_SN_1LDSB0_AMAS3_GRVW8_IU1_SIA1_SU0_SUS0_SVW2_TT4_64_VW2_WGM8
    SolutionIndex: 55
    SolutionNameMin: Cijk_Alik_Bljk_HB_MT128x128x16_MI16x16x16x1_SN_1LDSB0_AMAS3_GRVW2_IU1_SIA3_SU0_SUS0_SVW2_TT4_64_VW2_WGM8
    SolutionIndex: 56
    SolutionNameMin: Cijk_Alik_Bljk_HB_MT128x128x16_MI16x16x16x1_SN_1LDSB0_AMAS3_GRVW4_IU1_SIA3_SU0_SUS0_SVW2_TT4_64_VW2_WGM8
    SolutionIndex: 57
    SolutionNameMin: Cijk_Alik_Bljk_HB_MT128x128x16_MI16x16x16x1_SN_1LDSB0_AMAS3_GRVW8_IU1_SIA3_SU0_SUS0_SVW2_TT4_64_VW2_WGM8
    SolutionIndex: 58
    SolutionNameMin: Cijk_Alik_Bljk_HB_MT128x128x16_MI16x16x16x1_SN_1LDSB0_AMAS3_GRVW2_IU1_SIA1_SU32_SUS128_SVW2_TT4_64_VW2_WGM8
    SolutionIndex: 59
    SolutionNameMin: Cijk_Alik_Bljk_HB_MT128x128x16_MI16x16x16x1_SN_1LDSB0_AMAS0_GRVW4_IU1_SIA1_SU32_SUS128_SVW1_TT4_64_VW1_WGM8
    SolutionIndex: 60
    SolutionNameMin: Cijk_Alik_Bljk_HB_MT128x128x16_MI16x16x16x1_SN_1LDSB0_AMAS3_GRVW4_IU1_SIA1_SU32_SUS128_SVW2_TT4_64_VW2_WGM8
    SolutionIndex: 61
    SolutionNameMin: Cijk_Alik_Bljk_HB_MT128x128x16_MI16x16x16x1_SN_1LDSB0_AMAS3_GRVW8_IU1_SIA1_SU32_SUS128_SVW2_TT4_64_VW2_WGM8
    SolutionIndex: 62
    SolutionNameMin: Cijk_Alik_Bljk_HB_MT128x128x16_MI16x16x16x1_SN_1LDSB1_AMAS3_GRVW2_IU1_SIA2_SU32_SUS128_SVW2_TT4_64_VW2_WGM8
    SolutionIndex: 63
    SolutionNameMin: Cijk_Alik_Bljk_HB_MT128x128x16_MI16x16x16x1_SN_1LDSB1_AMAS3_GRVW8_IU1_SIA2_SU32_SUS128_SVW2_TT4_64_VW2_WGM8
    SolutionIndex: 64
    SolutionNameMin: Cijk_Alik_Bljk_HB_MT128x128x16_MI16x16x16x1_SN_1LDSB0_AMAS3_GRVW8_IU1_SIA3_SU32_SUS128_SVW2_TT4_64_VW2_WGM8
    SolutionIndex: 65
    SolutionNameMin: Cijk_Alik_Bljk_HB_MT128x128x16_MI16x16x16x1_SN_1LDSB0_AMAS0_GRVW2_IU1_SIA1_SU32_SUS256_SVW1_TT4_64_VW1_WGM8
    SolutionIndex: 66
    SolutionNameMin: Cijk_Alik_Bljk_HB_MT128x128x16_MI16x16x16x1_SN_1LDSB0_AMAS3_GRVW4_IU1_SIA1_SU32_SUS256_SVW2_TT4_64_VW2_WGM8
    SolutionIndex: 67
    SolutionNameMin: Cijk_Alik_Bljk_HB_MT128x128x16_MI16x16x16x1_SN_1LDSB0_AMAS3_GRVW8_IU1_SIA1_SU32_SUS256_SVW2_TT4_64_VW2_WGM8
    SolutionIndex: 68
    SolutionNameMin: Cijk_Alik_Bljk_HB_MT128x128x16_MI16x16x16x1_SN_1LDSB1_AMAS3_GRVW4_IU1_SIA2_SU32_SUS256_SVW2_TT4_64_VW2_WGM8
    SolutionIndex: 69
    SolutionNameMin: Cijk_Alik_Bljk_HB_MT128x128x16_MI16x16x16x1_SN_1LDSB0_AMAS3_GRVW4_IU1_SIA3_SU32_SUS256_SVW2_TT4_64_VW2_WGM8
    SolutionIndex: 70
    SolutionNameMin: Cijk_Alik_Bljk_HB_MT128x128x16_MI16x16x16x1_SN_1LDSB0_AMAS3_GRVW8_IU1_SIA3_SU32_SUS256_SVW2_TT4_64_VW2_WGM8
    SolutionIndex: 71
    SolutionNameMin: Cijk_Alik_Bljk_HB_MT32x32x32_MI16x16x16x1_SN_1LDSB1_AMAS0_GRVW2_IU2_SIA2_SU0_SUS0_SVW1_TT1_16_VW1_WGM4
    SolutionIndex: 72
    SolutionNameMin: Cijk_Alik_Bljk_HB_MT32x32x32_MI16x16x16x1_SN_1LDSB1_AMAS0_GRVW4_IU2_SIA2_SU0_SUS0_SVW1_TT1_16_VW1_WGM4
    SolutionIndex: 73
    SolutionNameMin: Cijk_Alik_Bljk_HB_MT32x32x32_MI16x16x16x1_SN_1LDSB1_AMAS0_GRVW8_IU2_SIA2_SU0_SUS0_SVW1_TT1_16_VW1_WGM4
    SolutionIndex: 74
    SolutionNameMin: Cijk_Alik_Bljk_HB_MT32x32x32_MI16x16x16x1_SN_1LDSB0_AMAS0_GRVW4_IU1_SIA3_SU0_SUS0_SVW1_TT1_16_VW1_WGM4
    SolutionIndex: 75
    SolutionNameMin: Cijk_Alik_Bljk_HB_MT32x32x32_MI16x16x16x1_SN_1LDSB1_AMAS0_GRVW2_IU2_SIA2_SU32_SUS128_SVW1_TT1_16_VW1_WGM4
    SolutionIndex: 76
    SolutionNameMin: Cijk_Alik_Bljk_HB_MT32x32x32_MI16x16x16x1_SN_1LDSB1_AMAS0_GRVW4_IU2_SIA2_SU32_SUS128_SVW1_TT1_16_VW1_WGM4
    SolutionIndex: 77
    SolutionNameMin: Cijk_Alik_Bljk_HB_MT32x32x32_MI16x16x16x1_SN_1LDSB1_AMAS0_GRVW8_IU2_SIA2_SU32_SUS128_SVW1_TT1_16_VW1_WGM4
    SolutionIndex: 78
    SolutionNameMin: Cijk_Alik_Bljk_HB_MT32x32x32_MI16x16x16x1_SN_1LDSB0_AMAS0_GRVW2_IU1_SIA3_SU32_SUS128_SVW1_TT1_16_VW1_WGM4
    SolutionIndex: 79
    SolutionNameMin: Cijk_Alik_Bljk_HB_MT32x32x32_MI16x16x16x1_SN_1LDSB0_AMAS0_GRVW4_IU1_SIA3_SU32_SUS128_SVW1_TT1_16_VW1_WGM4
    SolutionIndex: 80
    SolutionNameMin: Cijk_Alik_Bljk_HB_MT32x32x32_MI16x16x16x1_SN_1LDSB0_AMAS0_GRVW8_IU1_SIA1_SU32_SUS256_SVW1_TT1_16_VW1_WGM4
    SolutionIndex: 81
    SolutionNameMin: Cijk_Alik_Bljk_HB_MT32x32x32_MI16x16x16x1_SN_1LDSB1_AMAS0_GRVW2_IU2_SIA2_SU32_SUS256_SVW1_TT1_16_VW1_WGM4
    SolutionIndex: 82
    SolutionNameMin: Cijk_Alik_Bljk_HB_MT32x32x32_MI16x16x16x1_SN_1LDSB1_AMAS0_GRVW4_IU2_SIA2_SU32_SUS256_SVW1_TT1_16_VW1_WGM4
    SolutionIndex: 83
    SolutionNameMin: Cijk_Alik_Bljk_HB_MT32x32x32_MI16x16x16x1_SN_1LDSB1_AMAS0_GRVW8_IU2_SIA2_SU32_SUS256_SVW1_TT1_16_VW1_WGM4
    SolutionIndex: 84
    SolutionNameMin: Cijk_Alik_Bljk_HB_MT32x32x32_MI16x16x16x1_SN_1LDSB0_AMAS0_GRVW8_IU1_SIA1_SU0_SUS0_SVW1_TT1_16_VW1_WGM8
    SolutionIndex: 85
    SolutionNameMin: Cijk_Alik_Bljk_HB_MT32x32x32_MI16x16x16x1_SN_1LDSB1_AMAS0_GRVW2_IU2_SIA2_SU0_SUS0_SVW1_TT1_16_VW1_WGM8
    SolutionIndex: 86
    SolutionNameMin: Cijk_Alik_Bljk_HB_MT32x32x32_MI16x16x16x1_SN_1LDSB1_AMAS0_GRVW4_IU2_SIA2_SU0_SUS0_SVW1_TT1_16_VW1_WGM8
    SolutionIndex: 87
    SolutionNameMin: Cijk_Alik_Bljk_HB_MT32x32x32_MI16x16x16x1_SN_1LDSB1_AMAS0_GRVW8_IU2_SIA2_SU0_SUS0_SVW1_TT1_16_VW1_WGM8
    SolutionIndex: 88
    SolutionNameMin: Cijk_Alik_Bljk_HB_MT32x32x32_MI16x16x16x1_SN_1LDSB1_AMAS0_GRVW2_IU2_SIA2_SU32_SUS128_SVW1_TT1_16_VW1_WGM8
    SolutionIndex: 89
    SolutionNameMin: Cijk_Alik_Bljk_HB_MT32x32x32_MI16x16x16x1_SN_1LDSB1_AMAS0_GRVW4_IU2_SIA2_SU32_SUS128_SVW1_TT1_16_VW1_WGM8
    SolutionIndex: 90
    SolutionNameMin: Cijk_Alik_Bljk_HB_MT32x32x32_MI16x16x16x1_SN_1LDSB1_AMAS0_GRVW8_IU2_SIA2_SU32_SUS128_SVW1_TT1_16_VW1_WGM8
    SolutionIndex: 91
    SolutionNameMin: Cijk_Alik_Bljk_HB_MT32x32x32_MI16x16x16x1_SN_1LDSB0_AMAS0_GRVW4_IU1_SIA1_SU32_SUS256_SVW1_TT1_16_VW1_WGM8
    SolutionIndex: 92
    SolutionNameMin: Cijk_Alik_Bljk_HB_MT32x32x32_MI16x16x16x1_SN_1LDSB0_AMAS0_GRVW8_IU1_SIA1_SU32_SUS256_SVW1_TT1_16_VW1_WGM8
    SolutionIndex: 93
    SolutionNameMin: Cijk_Alik_Bljk_HB_MT32x32x32_MI16x16x16x1_SN_1LDSB1_AMAS0_GRVW2_IU2_SIA2_SU32_SUS256_SVW1_TT1_16_VW1_WGM8
    SolutionIndex: 94
    SolutionNameMin: Cijk_Alik_Bljk_HB_MT32x32x32_MI16x16x16x1_SN_1LDSB1_AMAS0_GRVW4_IU2_SIA2_SU32_SUS256_SVW1_TT1_16_VW1_WGM8
    SolutionIndex: 95
    SolutionNameMin: Cijk_Alik_Bljk_HB_MT32x32x32_MI16x16x16x1_SN_1LDSB1_AMAS0_GRVW8_IU2_SIA2_SU32_SUS256_SVW1_TT1_16_VW1_WGM8
    SolutionIndex: 96
    SolutionNameMin: Cijk_Alik_Bljk_HB_MT32x32x32_MI16x16x16x1_SN_1LDSB0_AMAS0_GRVW2_IU1_SIA3_SU32_SUS256_SVW1_TT1_16_VW1_WGM8
    SolutionIndex: 97
    SolutionNameMin: Cijk_Alik_Bljk_HB_MT64x64x32_MI16x16x16x1_SN_1LDSB0_AMAS0_GRVW4_IU1_SIA1_SU0_SUS0_SVW1_TT2_32_VW1_WGM4
    SolutionIndex: 98
    SolutionNameMin: Cijk_Alik_Bljk_HB_MT64x64x32_MI16x16x16x1_SN_1LDSB0_AMAS3_GRVW4_IU1_SIA1_SU0_SUS0_SVW2_TT2_32_VW2_WGM4
    SolutionIndex: 99
    SolutionNameMin: Cijk_Alik_Bljk_HB_MT64x64x32_MI16x16x16x1_SN_1LDSB0_AMAS0_GRVW8_IU1_SIA1_SU0_SUS0_SVW1_TT2_32_VW1_WGM4
    SolutionIndex: 100
    SolutionNameMin: Cijk_Alik_Bljk_HB_MT64x64x32_MI16x16x16x1_SN_1LDSB0_AMAS3_GRVW8_IU1_SIA1_SU0_SUS0_SVW2_TT2_32_VW2_WGM4
    SolutionIndex: 101
    SolutionNameMin: Cijk_Alik_Bljk_HB_MT64x64x32_MI16x16x16x1_SN_1LDSB1_AMAS0_GRVW4_IU2_SIA2_SU0_SUS0_SVW1_TT2_32_VW1_WGM4
    SolutionIndex: 102
    SolutionNameMin: Cijk_Alik_Bljk_HB_MT64x64x32_MI16x16x16x1_SN_1LDSB1_AMAS3_GRVW4_IU2_SIA2_SU0_SUS0_SVW2_TT2_32_VW2_WGM4
    SolutionIndex: 103
    SolutionNameMin: Cijk_Alik_Bljk_HB_MT64x64x32_MI16x16x16x1_SN_1LDSB1_AMAS0_GRVW8_IU2_SIA2_SU0_SUS0_SVW1_TT2_32_VW1_WGM4
    SolutionIndex: 104
    SolutionNameMin: Cijk_Alik_Bljk_HB_MT64x64x32_MI16x16x16x1_SN_1LDSB1_AMAS3_GRVW8_IU2_SIA2_SU0_SUS0_SVW2_TT2_32_VW2_WGM4
    SolutionIndex: 105
    SolutionNameMin: Cijk_Alik_Bljk_HB_MT64x64x32_MI16x16x16x1_SN_1LDSB0_AMAS0_GRVW8_IU1_SIA1_SU32_SUS128_SVW1_TT2_32_VW1_WGM4
    SolutionIndex: 106
    SolutionNameMin: Cijk_Alik_Bljk_HB_MT64x64x32_MI16x16x16x1_SN_1LDSB0_AMAS3_GRVW8_IU1_SIA1_SU32_SUS128_SVW2_TT2_32_VW2_WGM4
    SolutionIndex: 107
    SolutionNameMin: Cijk_Alik_Bljk_HB_MT64x64x32_MI16x16x16x1_SN_1LDSB1_AMAS3_GRVW4_IU2_SIA2_SU32_SUS128_SVW2_TT2_32_VW2_WGM4
    SolutionIndex: 108
    SolutionNameMin: Cijk_Alik_Bljk_HB_MT64x64x32_MI16x16x16x1_SN_1LDSB1_AMAS0_GRVW8_IU2_SIA2_SU32_SUS128_SVW1_TT2_32_VW1_WGM4
    SolutionIndex: 109
    SolutionNameMin: Cijk_Alik_Bljk_HB_MT64x64x32_MI16x16x16x1_SN_1LDSB1_AMAS3_GRVW8_IU2_SIA2_SU32_SUS128_SVW2_TT2_32_VW2_WGM4
    SolutionIndex: 110
    SolutionNameMin: Cijk_Alik_Bljk_HB_MT64x64x32_MI16x16x16x1_SN_1LDSB0_AMAS0_GRVW4_IU1_SIA1_SU32_SUS256_SVW1_TT2_32_VW1_WGM4
    SolutionIndex: 111
    SolutionNameMin: Cijk_Alik_Bljk_HB_MT64x64x32_MI16x16x16x1_SN_1LDSB0_AMAS3_GRVW4_IU1_SIA1_SU32_SUS256_SVW2_TT2_32_VW2_WGM4
    SolutionIndex: 112
    SolutionNameMin: Cijk_Alik_Bljk_HB_MT64x64x32_MI16x16x16x1_SN_1LDSB0_AMAS0_GRVW8_IU1_SIA1_SU32_SUS256_SVW1_TT2_32_VW1_WGM4
    SolutionIndex: 113
    SolutionNameMin: Cijk_Alik_Bljk_HB_MT64x64x32_MI16x16x16x1_SN_1LDSB1_AMAS0_GRVW4_IU2_SIA2_SU32_SUS256_SVW1_TT2_32_VW1_WGM4
    SolutionIndex: 114
    SolutionNameMin: Cijk_Alik_Bljk_HB_MT64x64x32_MI16x16x16x1_SN_1LDSB1_AMAS3_GRVW4_IU2_SIA2_SU32_SUS256_SVW2_TT2_32_VW2_WGM4
    SolutionIndex: 115
    SolutionNameMin: Cijk_Alik_Bljk_HB_MT64x64x32_MI16x16x16x1_SN_1LDSB1_AMAS0_GRVW8_IU2_SIA2_SU32_SUS256_SVW1_TT2_32_VW1_WGM4
    SolutionIndex: 116
    SolutionNameMin: Cijk_Alik_Bljk_HB_MT64x64x32_MI16x16x16x1_SN_1LDSB1_AMAS3_GRVW8_IU2_SIA2_SU32_SUS256_SVW2_TT2_32_VW2_WGM4
    SolutionIndex: 117
    SolutionNameMin: Cijk_Alik_Bljk_HB_MT64x64x32_MI16x16x16x1_SN_1LDSB0_AMAS3_GRVW4_IU1_SIA1_SU0_SUS0_SVW2_TT2_32_VW2_WGM8
    SolutionIndex: 118
    SolutionNameMin: Cijk_Alik_Bljk_HB_MT64x64x32_MI16x16x16x1_SN_1LDSB0_AMAS0_GRVW8_IU1_SIA1_SU0_SUS0_SVW1_TT2_32_VW1_WGM8
    SolutionIndex: 119
    SolutionNameMin: Cijk_Alik_Bljk_HB_MT64x64x32_MI16x16x16x1_SN_1LDSB0_AMAS3_GRVW8_IU1_SIA1_SU0_SUS0_SVW2_TT2_32_VW2_WGM8
    SolutionIndex: 120
    SolutionNameMin: Cijk_Alik_Bljk_HB_MT64x64x32_MI16x16x16x1_SN_1LDSB1_AMAS3_GRVW2_IU2_SIA2_SU0_SUS0_SVW2_TT2_32_VW2_WGM8
    SolutionIndex: 121
    SolutionNameMin: Cijk_Alik_Bljk_HB_MT64x64x32_MI16x16x16x1_SN_1LDSB1_AMAS0_GRVW4_IU2_SIA2_SU0_SUS0_SVW1_TT2_32_VW1_WGM8
    SolutionIndex: 122
    SolutionNameMin: Cijk_Alik_Bljk_HB_MT64x64x32_MI16x16x16x1_SN_1LDSB1_AMAS3_GRVW4_IU2_SIA2_SU0_SUS0_SVW2_TT2_32_VW2_WGM8
    SolutionIndex: 123
    SolutionNameMin: Cijk_Alik_Bljk_HB_MT64x64x32_MI16x16x16x1_SN_1LDSB1_AMAS0_GRVW8_IU2_SIA2_SU0_SUS0_SVW1_TT2_32_VW1_WGM8
    SolutionIndex: 124
    SolutionNameMin: Cijk_Alik_Bljk_HB_MT64x64x32_MI16x16x16x1_SN_1LDSB1_AMAS3_GRVW8_IU2_SIA2_SU0_SUS0_SVW2_TT2_32_VW2_WGM8
    SolutionIndex: 125
    SolutionNameMin: Cijk_Alik_Bljk_HB_MT64x64x32_MI16x16x16x1_SN_1LDSB0_AMAS3_GRVW2_IU1_SIA3_SU0_SUS0_SVW2_TT2_32_VW2_WGM8
    SolutionIndex: 126
    SolutionNameMin: Cijk_Alik_Bljk_HB_MT64x64x32_MI16x16x16x1_SN_1LDSB0_AMAS3_GRVW4_IU1_SIA1_SU32_SUS128_SVW2_TT2_32_VW2_WGM8
    SolutionIndex: 127
    SolutionNameMin: Cijk_Alik_Bljk_HB_MT64x64x32_MI16x16x16x1_SN_1LDSB1_AMAS0_GRVW4_IU2_SIA2_SU32_SUS128_SVW1_TT2_32_VW1_WGM8
    SolutionIndex: 128
    SolutionNameMin: Cijk_Alik_Bljk_HB_MT64x64x32_MI16x16x16x1_SN_1LDSB1_AMAS3_GRVW4_IU2_SIA2_SU32_SUS128_SVW2_TT2_32_VW2_WGM8
    SolutionIndex: 129
    SolutionNameMin: Cijk_Alik_Bljk_HB_MT64x64x32_MI16x16x16x1_SN_1LDSB1_AMAS3_GRVW8_IU2_SIA2_SU32_SUS128_SVW2_TT2_32_VW2_WGM8
    SolutionIndex: 130
    SolutionNameMin: Cijk_Alik_Bljk_HB_MT64x64x32_MI16x16x16x1_SN_1LDSB0_AMAS3_GRVW4_IU1_SIA1_SU32_SUS256_SVW2_TT2_32_VW2_WGM8
    SolutionIndex: 131
    SolutionNameMin: Cijk_Alik_Bljk_HB_MT64x64x32_MI16x16x16x1_SN_1LDSB0_AMAS3_GRVW8_IU1_SIA1_SU32_SUS256_SVW2_TT2_32_VW2_WGM8
    SolutionIndex: 132
    SolutionNameMin: Cijk_Alik_Bljk_HB_MT64x64x32_MI16x16x16x1_SN_1LDSB1_AMAS0_GRVW4_IU2_SIA2_SU32_SUS256_SVW1_TT2_32_VW1_WGM8
    SolutionIndex: 133
    SolutionNameMin: Cijk_Alik_Bljk_HB_MT64x64x32_MI16x16x16x1_SN_1LDSB1_AMAS3_GRVW4_IU2_SIA2_SU32_SUS256_SVW2_TT2_32_VW2_WGM8
    SolutionIndex: 134
    SolutionNameMin: Cijk_Alik_Bljk_HB_MT64x64x32_MI16x16x16x1_SN_1LDSB1_AMAS3_GRVW8_IU2_SIA2_SU32_SUS256_SVW2_TT2_32_VW2_WGM8
- - - [64, 64, 1, 64, 96, 96, 96, 96]
    - [0, 0.043]
  - - [64, 64, 1, 128, 96, 96, 160, 160]
    - [73, 0.084]
  - - [64, 64, 1, 256, 96, 96, 288, 288]
    - [82, 0.155]
  - - [64, 64, 1, 512, 96, 96, 544, 544]
    - [73, 0.275]
  - - [64, 64, 1, 1024, 96, 96, 1056, 1056]
    - [73, 0.446]
  - - [64, 64, 1, 2048, 96, 96, 2080, 2080]
    - [86, 0.648]
  - - [64, 64, 1, 4096, 96, 96, 4128, 4128]
    - [89, 0.826]
  - - [64, 64, 1, 8192, 96, 96, 8224, 8224]
    - [76, 0.962]
  - - [64, 128, 1, 64, 96, 96, 96, 96]
    - [72, 0.088]
  - - [64, 128, 1, 128, 96, 96, 160, 160]
    - [90, 0.171]
  - - [64, 128, 1, 256, 96, 96, 288, 288]
    - [86, 0.316]
  - - [64, 128, 1, 512, 96, 96, 544, 544]
    - [86, 0.561]
  - - [64, 128, 1, 1024, 96, 96, 1056, 1056]
    - [72, 0.901]
  - - [64, 128, 1, 2048, 96, 96, 2080, 2080]
    - [87, 1.301]
  - - [64, 128, 1, 4096, 96, 96, 4128, 4128]
    - [88, 1.665]
  - - [64, 128, 1, 8192, 96, 96, 8224, 8224]
    - [89, 1.931]
  - - [64, 256, 1, 64, 96, 96, 96, 96]
    - [84, 0.177]
  - - [64, 256, 1, 128, 96, 96, 160, 160]
    - [131, 0.315]
  - - [64, 256, 1, 256, 96, 96, 288, 288]
    - [94, 0.643]
  - - [64, 256, 1, 512, 96, 96, 544, 544]
    - [73, 1.117]
  - - [64, 256, 1, 1024, 96, 96, 1056, 1056]
    - [82, 1.819]
  - - [64, 256, 1, 2048, 96, 96, 2080, 2080]
    - [76, 2.556]
  - - [64, 256, 1, 4096, 96, 96, 4128, 4128]
    - [88, 3.316]
  - - [64, 256, 1, 8192, 96, 96, 8224, 8224]
    - [88, 3.836]
  - - [64, 512, 1, 64, 96, 96, 96, 96]
    - [84, 0.357]
  - - [64, 512, 1, 128, 96, 96, 160, 160]
    - [73, 0.693]
  - - [64, 512, 1, 256, 96, 96, 288, 288]
    - [82, 1.284]
  - - [64, 512, 1, 512, 96, 96, 544, 544]
    - [90, 2.255]
  - - [64, 512, 1, 1024, 96, 96, 1056, 1056]
    - [94, 3.654]
  - - [64, 512, 1, 2048, 96, 96, 2080, 2080]
    - [81, 5.186]
  - - [64, 512, 1, 4096, 96, 96, 4128, 4128]
    - [89, 6.628]
  - - [64, 512, 1, 8192, 96, 96, 8224, 8224]
    - [82, 7.659]
  - - [64, 1024, 1, 64, 96, 96, 96, 96]
    - [94, 0.712]
  - - [64, 1024, 1, 128, 96, 96, 160, 160]
    - [90, 1.382]
  - - [64, 1024, 1, 256, 96, 96, 288, 288]
    - [94, 2.562]
  - - [64, 1024, 1, 512, 96, 96, 544, 544]
    - [77, 4.478]
  - - [64, 1024, 1, 1024, 96, 96, 1056, 1056]
    - [89, 7.193]
  - - [64, 1024, 1, 2048, 96, 96, 2080, 2080]
    - [86, 10.338]
  - - [64, 1024, 1, 4096, 96, 96, 4128, 4128]
    - [72, 13.198]
  - - [64, 1024, 1, 8192, 96, 96, 8224, 8224]
    - [73, 15.067]
  - - [64, 2048, 1, 64, 96, 96, 96, 96]
    - [73, 1.398]
  - - [64, 2048, 1, 128, 96, 96, 160, 160]
    - [83, 2.672]
  - - [64, 2048, 1, 256, 96, 96, 288, 288]
    - [87, 4.932]
  - - [64, 2048, 1, 512, 96, 96, 544, 544]
    - [73, 8.656]
  - - [64, 2048, 1, 1024, 96, 96, 1056, 1056]
    - [73, 13.722]
  - - [64, 2048, 1, 2048, 96, 96, 2080, 2080]
    - [87, 19.373]
  - - [64, 2048, 1, 4096, 96, 96, 4128, 4128]
    - [73, 24.478]
  - - [64, 2048, 1, 8192, 96, 96, 8224, 8224]
    - [77, 27.316]
  - - [64, 4096, 1, 64, 96, 96, 96, 96]
    - [74, 2.685]
  - - [64, 4096, 1, 128, 96, 96, 160, 160]
    - [133, 5.066]
  - - [64, 4096, 1, 256, 96, 96, 288, 288]
    - [114, 9.16]
  - - [64, 4096, 1, 512, 96, 96, 544, 544]
    - [104, 15.388]
  - - [64, 4096, 1, 1024, 96, 96, 1056, 1056]
    - [128, 22.925]
  - - [64, 4096, 1, 2048, 96, 96, 2080, 2080]
    - [113, 30.664]
  - - [64, 4096, 1, 4096, 96, 96, 4128, 4128]
    - [121, 36.202]
  - - [64, 4096, 1, 8192, 96, 96, 8224, 8224]
    - [101, 40.367]
  - - [64, 8192, 1, 64, 96, 96, 96, 96]
    - [134, 5.127]
  - - [64, 8192, 1, 128, 96, 96, 160, 160]
    - [134, 9.479]
  - - [64, 8192, 1, 256, 96, 96, 288, 288]
    - [100, 16.767]
  - - [64, 8192, 1, 512, 96, 96, 544, 544]
    - [22, 26.388]
  - - [64, 8192, 1, 1024, 96, 96, 1056, 1056]
    - [131, 38.902]
  - - [64, 8192, 1, 2048, 96, 96, 2080, 2080]
    - [112, 50.183]
  - - [64, 8192, 1, 4096, 96, 96, 4128, 4128]
    - [131, 57.248]
  - - [64, 8192, 1, 8192, 96, 96, 8224, 8224]
    - [121, 28.023]
  - - [128, 64, 1, 64, 160, 160, 96, 96]
    - [4, 0.09]
  - - [128, 64, 1, 128, 160, 160, 160, 160]
    - [89, 0.171]
  - - [128, 64, 1, 256, 160, 160, 288, 288]
    - [89, 0.316]
  - - [128, 64, 1, 512, 160, 160, 544, 544]
    - [88, 0.558]
  - - [128, 64, 1, 1024, 160, 160, 1056, 1056]
    - [89, 0.905]
  - - [128, 64, 1, 2048, 160, 160, 2080, 2080]
    - [89, 1.3]
  - - [128, 64, 1, 4096, 160, 160, 4128, 4128]
    - [89, 1.661]
  - - [128, 64, 1, 8192, 160, 160, 8224, 8224]
    - [75, 1.92]
  - - [128, 128, 1, 64, 160, 160, 96, 96]
    - [84, 0.178]
  - - [128, 128, 1, 128, 160, 160, 160, 160]
    - [76, 0.343]
  - - [128, 128, 1, 256, 160, 160, 288, 288]
    - [71, 0.638]
  - - [128, 128, 1, 512, 160, 160, 544, 544]
    - [72, 1.125]
  - - [128, 128, 1, 1024, 160, 160, 1056, 1056]
    - [73, 1.819]
  - - [128, 128, 1, 2048, 160, 160, 2080, 2080]
    - [88, 2.61]
  - - [128, 128, 1, 4096, 160, 160, 4128, 4128]
    - [81, 3.34]
  - - [128, 128, 1, 8192, 160, 160, 8224, 8224]
    - [89, 3.871]
  - - [128, 256, 1, 64, 160, 160, 96, 96]
    - [72, 0.356]
  - - [128, 256, 1, 128, 160, 160, 160, 160]
    - [90, 0.687]
  - - [128, 256, 1, 256, 160, 160, 288, 288]
    - [71, 1.285]
  - - [128, 256, 1, 512, 160, 160, 544, 544]
    - [82, 2.267]
  - - [128, 256, 1, 1024, 160, 160, 1056, 1056]
    - [76, 3.65]
  - - [128, 256, 1, 2048, 160, 160, 2080, 2080]
    - [83, 5.234]
  - - [128, 256, 1, 4096, 160, 160, 4128, 4128]
    - [83, 6.7]
  - - [128, 256, 1, 8192, 160, 160, 8224, 8224]
    - [72, 7.679]
  - - [128, 512, 1, 64, 160, 160, 96, 96]
    - [96, 0.709]
  - - [128, 512, 1, 128, 160, 160, 160, 160]
    - [76, 1.368]
  - - [128, 512, 1, 256, 160, 160, 288, 288]
    - [82, 2.551]
  - - [128, 512, 1, 512, 160, 160, 544, 544]
    - [88, 4.48]
  - - [128, 512, 1, 1024, 160, 160, 1056, 1056]
    - [72, 7.209]
  - - [128, 512, 1, 2048, 160, 160, 2080, 2080]
    - [83, 10.409]
  - - [128, 512, 1, 4096, 160, 160, 4128, 4128]
    - [82, 13.297]
  - - [128, 512, 1, 8192, 160, 160, 8224, 8224]
    - [71, 15.022]
  - - [128, 1024, 1, 64, 160, 160, 96, 96]
    - [72, 1.401]
  - - [128, 1024, 1, 128, 160, 160, 160, 160]
    - [72, 2.708]
  - - [128, 1024, 1, 256, 160, 160, 288, 288]
    - [87, 4.998]
  - - [128, 1024, 1, 512, 160, 160, 544, 544]
    - [87, 8.57]
  - - [128, 1024, 1, 1024, 160, 160, 1056, 1056]
    - [73, 13.724]
  - - [128, 1024, 1, 2048, 160, 160, 2080, 2080]
    - [73, 19.517]
  - - [128, 1024, 1, 4096, 160, 160, 4128, 4128]
    - [77, 24.199]
  - - [128, 1024, 1, 8192, 160, 160, 8224, 8224]
    - [87, 27.384]
  - - [128, 2048, 1, 64, 160, 160, 96, 96]
    - [18, 2.696]
  - - [128, 2048, 1, 128, 160, 160, 160, 160]
    - [124, 5.074]
  - - [128, 2048, 1, 256, 160, 160, 288, 288]
    - [101, 9.178]
  - - [128, 2048, 1, 512, 160, 160, 544, 544]
    - [124, 15.408]
  - - [128, 2048, 1, 1024, 160, 160, 1056, 1056]
    - [101, 22.991]
  - - [128, 2048, 1, 2048, 160, 160, 2080, 2080]
    - [115, 30.631]
  - - [128, 2048, 1, 4096, 160, 160, 4128, 4128]
    - [107, 36.566]
  - - [128, 2048, 1, 8192, 160, 160, 8224, 8224]
    - [123, 40.721]
  - - [128, 4096, 1, 64, 160, 160, 96, 96]
    - [109, 5.195]
  - - [128, 4096, 1, 128, 160, 160, 160, 160]
    - [104, 9.655]
  - - [128, 4096, 1, 256, 160, 160, 288, 288]
    - [100, 16.902]
  - - [128, 4096, 1, 512, 160, 160, 544, 544]
    - [111, 27.244]
  - - [128, 4096, 1, 1024, 160, 160, 1056, 1056]
    - [119, 39.207]
  - - [128, 4096, 1, 2048, 160, 160, 2080, 2080]
    - [100, 50.641]
  - - [128, 4096, 1, 4096, 160, 160, 4128, 4128]
    - [97, 57.078]
  - - [128, 4096, 1, 8192, 160, 160, 8224, 8224]
    - [119, 63.946]
  - - [128, 8192, 1, 64, 160, 160, 96, 96]
    - [124, 8.936]
  - - [128, 8192, 1, 128, 160, 160, 160, 160]
    - [23, 15.886]
  - - [128, 8192, 1, 256, 160, 160, 288, 288]
    - [19, 25.686]
  - - [128, 8192, 1, 512, 160, 160, 544, 544]
    - [10, 37.842]
  - - [128, 8192, 1, 1024, 160, 160, 1056, 1056]
    - [24, 48.937]
  - - [128, 8192, 1, 2048, 160, 160, 2080, 2080]
    - [109, 57.275]
  - - [128, 8192, 1, 4096, 160, 160, 4128, 4128]
    - [20, 62.893]
  - - [128, 8192, 1, 8192, 160, 160, 8224, 8224]
    - [115, 49.239]
  - - [256, 64, 1, 64, 288, 288, 96, 96]
    - [0, 0.182]
  - - [256, 64, 1, 128, 288, 288, 160, 160]
    - [72, 0.344]
  - - [256, 64, 1, 256, 288, 288, 288, 288]
    - [82, 0.643]
  - - [256, 64, 1, 512, 288, 288, 544, 544]
    - [76, 1.127]
  - - [256, 64, 1, 1024, 288, 288, 1056, 1056]
    - [2, 1.549]
  - - [256, 64, 1, 2048, 288, 288, 2080, 2080]
    - [82, 2.611]
  - - [256, 64, 1, 4096, 288, 288, 4128, 4128]
    - [75, 3.325]
  - - [256, 64, 1, 8192, 288, 288, 8224, 8224]
    - [82, 3.818]
  - - [256, 128, 1, 64, 288, 288, 96, 96]
    - [78, 0.357]
  - - [256, 128, 1, 128, 288, 288, 160, 160]
    - [83, 0.689]
  - - [256, 128, 1, 256, 288, 288, 288, 288]
    - [71, 1.278]
  - - [256, 128, 1, 512, 288, 288, 544, 544]
    - [77, 2.254]
  - - [256, 128, 1, 1024, 288, 288, 1056, 1056]
    - [6, 3.109]
  - - [256, 128, 1, 2048, 288, 288, 2080, 2080]
    - [76, 5.197]
  - - [256, 128, 1, 4096, 288, 288, 4128, 4128]
    - [86, 6.632]
  - - [256, 128, 1, 8192, 288, 288, 8224, 8224]
    - [75, 7.517]
  - - [256, 256, 1, 64, 288, 288, 96, 96]
    - [80, 0.709]
  - - [256, 256, 1, 128, 288, 288, 160, 160]
    - [72, 1.368]
  - - [256, 256, 1, 256, 288, 288, 288, 288]
    - [77, 2.548]
  - - [256, 256, 1, 512, 288, 288, 544, 544]
    - [86, 4.479]
  - - [256, 256, 1, 1024, 288, 288, 1056, 1056]
    - [86, 7.241]
  - - [256, 256, 1, 2048, 288, 288, 2080, 2080]
    - [82, 10.373]
  - - [256, 256, 1, 4096, 288, 288, 4128, 4128]
    - [72, 13.294]
  - - [256, 256, 1, 8192, 288, 288, 8224, 8224]
    - [87, 15.299]
  - - [256, 512, 1, 64, 288, 288, 96, 96]
    - [83, 1.393]
  - - [256, 512, 1, 128, 288, 288, 160, 160]
    - [72, 2.668]
  - - [256, 512, 1, 256, 288, 288, 288, 288]
    - [134, 4.712]
  - - [256, 512, 1, 512, 288, 288, 544, 544]
    - [3, 7.907]
  - - [256, 512, 1, 1024, 288, 288, 1056, 1056]
    - [83, 12.829]
  - - [256, 512, 1, 2048, 288, 288, 2080, 2080]
    - [87, 19.415]
  - - [256, 512, 1, 4096, 288, 288, 4128, 4128]
    - [90, 24.17]
  - - [256, 512, 1, 8192, 288, 288, 8224, 8224]
    - [73, 27.64]
  - - [256, 1024, 1, 64, 288, 288, 96, 96]
    - [9, 2.69]
  - - [256, 1024, 1, 128, 288, 288, 160, 160]
    - [130, 5.066]
  - - [256, 1024, 1, 256, 288, 288, 288, 288]
    - [122, 9.176]
  - - [256, 1024, 1, 512, 288, 288, 544, 544]
    - [134, 15.282]
  - - [256, 1024, 1, 1024, 288, 288, 1056, 1056]
    - [108, 22.887]
  - - [256, 1024, 1, 2048, 288, 288, 2080, 2080]
    - [101, 30.603]
  - - [256, 1024, 1, 4096, 288, 288, 4128, 4128]
    - [129, 36.243]
  - - [256, 1024, 1, 8192, 288, 288, 8224, 8224]
    - [101, 40.347]
  - - [256, 2048, 1, 64, 288, 288, 96, 96]
    - [125, 5.181]
  - - [256, 2048, 1, 128, 288, 288, 160, 160]
    - [11, 9.615]
  - - [256, 2048, 1, 256, 288, 288, 288, 288]
    - [100, 16.922]
  - - [256, 2048, 1, 512, 288, 288, 544, 544]
    - [100, 27.155]
  - - [256, 2048, 1, 1024, 288, 288, 1056, 1056]
    - [100, 39.469]
  - - [256, 2048, 1, 2048, 288, 288, 2080, 2080]
    - [99, 50.706]
  - - [256, 2048, 1, 4096, 288, 288, 4128, 4128]
    - [100, 57.547]
  - - [256, 2048, 1, 8192, 288, 288, 8224, 8224]
    - [98, 62.247]
  - - [256, 4096, 1, 64, 288, 288, 96, 96]
    - [19, 8.938]
  - - [256, 4096, 1, 128, 288, 288, 160, 160]
    - [10, 15.934]
  - - [256, 4096, 1, 256, 288, 288, 288, 288]
    - [10, 25.777]
  - - [256, 4096, 1, 512, 288, 288, 544, 544]
    - [109, 37.567]
  - - [256, 4096, 1, 1024, 288, 288, 1056, 1056]
    - [16, 48.493]
  - - [256, 4096, 1, 2048, 288, 288, 2080, 2080]
    - [116, 57.474]
  - - [256, 4096, 1, 4096, 288, 288, 4128, 4128]
    - [7, 59.043]
  - - [256, 4096, 1, 8192, 288, 288, 8224, 8224]
    - [10, 63.484]
  - - [256, 8192, 1, 64, 288, 288, 96, 96]
    - [9, 15.139]
  - - [256, 8192, 1, 128, 288, 288, 160, 160]
    - [70, 24.792]
  - - [256, 8192, 1, 256, 288, 288, 288, 288]
    - [57, 38.519]
  - - [256, 8192, 1, 512, 288, 288, 544, 544]
    - [57, 51.96]
  - - [256, 8192, 1, 1024, 288, 288, 1056, 1056]
    - [64, 63.603]
  - - [256, 8192, 1, 2048, 288, 288, 2080, 2080]
    - [48, 70.192]
  - - [256, 8192, 1, 4096, 288, 288, 4128, 4128]
    - [40, 72.871]
  - - [256, 8192, 1, 8192, 288, 288, 8224, 8224]
    - [34, 69.608]
  - - [384, 64, 1, 64, 416, 416, 96, 96]
    - [0, 0.275]
  - - [384, 64, 1, 128, 416, 416, 160, 160]
    - [90, 0.517]
  - - [384, 64, 1, 256, 416, 416, 288, 288]
    - [85, 0.957]
  - - [384, 64, 1, 512, 416, 416, 544, 544]
    - [86, 1.696]
  - - [384, 64, 1, 1024, 416, 416, 1056, 1056]
    - [90, 2.728]
  - - [384, 64, 1, 2048, 416, 416, 2080, 2080]
    - [82, 3.913]
  - - [384, 64, 1, 4096, 416, 416, 4128, 4128]
    - [82, 4.988]
  - - [384, 64, 1, 8192, 416, 416, 8224, 8224]
    - [72, 5.753]
  - - [384, 128, 1, 64, 416, 416, 96, 96]
    - [91, 0.537]
  - - [384, 128, 1, 128, 416, 416, 160, 160]
    - [85, 1.04]
  - - [384, 128, 1, 256, 416, 416, 288, 288]
    - [88, 1.911]
  - - [384, 128, 1, 512, 416, 416, 544, 544]
    - [82, 3.4]
  - - [384, 128, 1, 1024, 416, 416, 1056, 1056]
    - [88, 5.446]
  - - [384, 128, 1, 2048, 416, 416, 2080, 2080]
    - [86, 7.825]
  - - [384, 128, 1, 4096, 416, 416, 4128, 4128]
    - [89, 10.015]
  - - [384, 128, 1, 8192, 416, 416, 8224, 8224]
    - [76, 11.547]
  - - [384, 256, 1, 64, 416, 416, 96, 96]
    - [73, 1.067]
  - - [384, 256, 1, 128, 416, 416, 160, 160]
    - [89, 2.047]
  - - [384, 256, 1, 256, 416, 416, 288, 288]
    - [82, 3.803]
  - - [384, 256, 1, 512, 416, 416, 544, 544]
    - [76, 6.715]
  - - [384, 256, 1, 1024, 416, 416, 1056, 1056]
    - [94, 10.751]
  - - [384, 256, 1, 2048, 416, 416, 2080, 2080]
    - [94, 15.439]
  - - [384, 256, 1, 4096, 416, 416, 4128, 4128]
    - [72, 19.743]
  - - [384, 256, 1, 8192, 416, 416, 8224, 8224]
    - [71, 22.21]
  - - [384, 512, 1, 64, 416, 416, 96, 96]
    - [126, 2.068]
  - - [384, 512, 1, 128, 416, 416, 160, 160]
    - [129, 3.913]
  - - [384, 512, 1, 256, 416, 416, 288, 288]
    - [72, 7.08]
  - - [384, 512, 1, 512, 416, 416, 544, 544]
    - [87, 12.051]
  - - [384, 512, 1, 1024, 416, 416, 1056, 1056]
    - [87, 18.493]
  - - [384, 512, 1, 2048, 416, 416, 2080, 2080]
    - [87, 25.105]
  - - [384, 512, 1, 4096, 416, 416, 4128, 4128]
    - [87, 30.12]
  - - [384, 512, 1, 8192, 416, 416, 8224, 8224]
    - [90, 34.113]
  - - [384, 1024, 1, 64, 416, 416, 96, 96]
    - [124, 4.002]
  - - [384, 1024, 1, 128, 416, 416, 160, 160]
    - [129, 7.523]
  - - [384, 1024, 1, 256, 416, 416, 288, 288]
    - [104, 13.595]
  - - [384, 1024, 1, 512, 416, 416, 544, 544]
    - [122, 22.663]
  - - [384, 1024, 1, 1024, 416, 416, 1056, 1056]
    - [124, 33.833]
  - - [384, 1024, 1, 2048, 416, 416, 2080, 2080]
    - [104, 45.2]
  - - [384, 1024, 1, 4096, 416, 416, 4128, 4128]
    - [132, 52.417]
  - - [384, 1024, 1, 8192, 416, 416, 8224, 8224]
    - [127, 59.476]
  - - [384, 2048, 1, 64, 416, 416, 96, 96]
    - [12, 7.312]
  - - [384, 2048, 1, 128, 416, 416, 160, 160]
    - [20, 13.407]
  - - [384, 2048, 1, 256, 416, 416, 288, 288]
    - [8, 23.141]
  - - [384, 2048, 1, 512, 416, 416, 544, 544]
    - [8, 35.697]
  - - [384, 2048, 1, 1024, 416, 416, 1056, 1056]
    - [100, 49.168]
  - - [384, 2048, 1, 2048, 416, 416, 2080, 2080]
    - [99, 61.481]
  - - [384, 2048, 1, 4096, 416, 416, 4128, 4128]
    - [99, 68.436]
  - - [384, 2048, 1, 8192, 416, 416, 8224, 8224]
    - [100, 71.506]
  - - [384, 4096, 1, 64, 416, 416, 96, 96]
    - [107, 12.111]
  - - [384, 4096, 1, 128, 416, 416, 160, 160]
    - [129, 20.776]
  - - [384, 4096, 1, 256, 416, 416, 288, 288]
    - [34, 33.412]
  - - [384, 4096, 1, 512, 416, 416, 544, 544]
    - [99, 48.324]
  - - [384, 4096, 1, 1024, 416, 416, 1056, 1056]
    - [54, 63.483]
  - - [384, 4096, 1, 2048, 416, 416, 2080, 2080]
    - [119, 68.803]
  - - [384, 4096, 1, 4096, 416, 416, 4128, 4128]
    - [57, 72.649]
  - - [384, 4096, 1, 8192, 416, 416, 8224, 8224]
    - [57, 76.911]
  - - [384, 8192, 1, 64, 416, 416, 96, 96]
    - [129, 19.491]
  - - [384, 8192, 1, 128, 416, 416, 160, 160]
    - [46, 34.434]
  - - [384, 8192, 1, 256, 416, 416, 288, 288]
    - [34, 49.868]
  - - [384, 8192, 1, 512, 416, 416, 544, 544]
    - [57, 65.653]
  - - [384, 8192, 1, 1024, 416, 416, 1056, 1056]
    - [64, 77.12]
  - - [384, 8192, 1, 2048, 416, 416, 2080, 2080]
    - [70, 79.634]
  - - [384, 8192, 1, 4096, 416, 416, 4128, 4128]
    - [39, 85.399]
  - - [384, 8192, 1, 8192, 416, 416, 8224, 8224]
    - [69, 74.238]
  - - [768, 64, 1, 64, 800, 800, 96, 96]
    - [1, 0.542]
  - - [768, 64, 1, 128, 800, 800, 160, 160]
    - [87, 1.041]
  - - [768, 64, 1, 256, 800, 800, 288, 288]
    - [89, 1.915]
  - - [768, 64, 1, 512, 800, 800, 544, 544]
    - [93, 3.373]
  - - [768, 64, 1, 1024, 800, 800, 1056, 1056]
    - [89, 5.443]
  - - [768, 64, 1, 2048, 800, 800, 2080, 2080]
    - [82, 7.78]
  - - [768, 64, 1, 4096, 800, 800, 4128, 4128]
    - [89, 9.902]
  - - [768, 64, 1, 8192, 800, 800, 8224, 8224]
    - [76, 11.205]
  - - [768, 128, 1, 64, 800, 800, 96, 96]
    - [5, 1.059]
  - - [768, 128, 1, 128, 800, 800, 160, 160]
    - [90, 2.043]
  - - [768, 128, 1, 256, 800, 800, 288, 288]
    - [72, 3.802]
  - - [768, 128, 1, 512, 800, 800, 544, 544]
    - [72, 6.739]
  - - [768, 128, 1, 1024, 800, 800, 1056, 1056]
    - [89, 10.777]
  - - [768, 128, 1, 2048, 800, 800, 2080, 2080]
    - [86, 15.388]
  - - [768, 128, 1, 4096, 800, 800, 4128, 4128]
    - [86, 19.649]
  - - [768, 128, 1, 8192, 800, 800, 8224, 8224]
    - [87, 22.186]
  - - [768, 256, 1, 64, 800, 800, 96, 96]
    - [120, 2.058]
  - - [768, 256, 1, 128, 800, 800, 160, 160]
    - [92, 3.907]
  - - [768, 256, 1, 256, 800, 800, 288, 288]
    - [73, 7.106]
  - - [768, 256, 1, 512, 800, 800, 544, 544]
    - [83, 12.062]
  - - [768, 256, 1, 1024, 800, 800, 1056, 1056]
    - [73, 18.517]
  - - [768, 256, 1, 2048, 800, 800, 2080, 2080]
    - [73, 25.171]
  - - [768, 256, 1, 4096, 800, 800, 4128, 4128]
    - [101, 29.975]
  - - [768, 256, 1, 8192, 800, 800, 8224, 8224]
    - [73, 33.913]
  - - [768, 512, 1, 64, 800, 800, 96, 96]
    - [21, 4.023]
  - - [768, 512, 1, 128, 800, 800, 160, 160]
    - [122, 7.536]
  - - [768, 512, 1, 256, 800, 800, 288, 288]
    - [104, 13.581]
  - - [768, 512, 1, 512, 800, 800, 544, 544]
    - [109, 22.63]
  - - [768, 512, 1, 1024, 800, 800, 1056, 1056]
    - [104, 34.002]
  - - [768, 512, 1, 2048, 800, 800, 2080, 2080]
    - [103, 45.375]
  - - [768, 512, 1, 4096, 800, 800, 4128, 4128]
    - [103, 53.073]
  - - [768, 512, 1, 8192, 800, 800, 8224, 8224]
    - [121, 59.514]
  - - [768, 1024, 1, 64, 800, 800, 96, 96]
    - [122, 7.4]
  - - [768, 1024, 1, 128, 800, 800, 160, 160]
    - [14, 13.494]
  - - [768, 1024, 1, 256, 800, 800, 288, 288]
    - [8, 23.129]
  - - [768, 1024, 1, 512, 800, 800, 544, 544]
    - [117, 35.743]
  - - [768, 1024, 1, 1024, 800, 800, 1056, 1056]
    - [119, 49.36]
  - - [768, 1024, 1, 2048, 800, 800, 2080, 2080]
    - [100, 60.388]
  - - [768, 1024, 1, 4096, 800, 800, 4128, 4128]
    - [119, 68.257]
  - - [768, 1024, 1, 8192, 800, 800, 8224, 8224]
    - [118, 71.388]
  - - [768, 2048, 1, 64, 800, 800, 96, 96]
    - [15, 11.994]
  - - [768, 2048, 1, 128, 800, 800, 160, 160]
    - [19, 20.838]
  - - [768, 2048, 1, 256, 800, 800, 288, 288]
    - [99, 33.412]
  - - [768, 2048, 1, 512, 800, 800, 544, 544]
    - [99, 48.333]
  - - [768, 2048, 1, 1024, 800, 800, 1056, 1056]
    - [26, 63.986]
  - - [768, 2048, 1, 2048, 800, 800, 2080, 2080]
    - [99, 68.833]
  - - [768, 2048, 1, 4096, 800, 800, 4128, 4128]
    - [35, 74.856]
  - - [768, 2048, 1, 8192, 800, 800, 8224, 8224]
    - [57, 76.39]
  - - [768, 4096, 1, 64, 800, 800, 96, 96]
    - [104, 19.342]
  - - [768, 4096, 1, 128, 800, 800, 160, 160]
    - [48, 34.191]
  - - [768, 4096, 1, 256, 800, 800, 288, 288]
    - [56, 49.883]
  - - [768, 4096, 1, 512, 800, 800, 544, 544]
    - [34, 65.534]
  - - [768, 4096, 1, 1024, 800, 800, 1056, 1056]
    - [34, 77.094]
  - - [768, 4096, 1, 2048, 800, 800, 2080, 2080]
    - [31, 79.98]
  - - [768, 4096, 1, 4096, 800, 800, 4128, 4128]
    - [64, 85.491]
  - - [768, 4096, 1, 8192, 800, 800, 8224, 8224]
    - [38, 82.402]
  - - [768, 8192, 1, 64, 800, 800, 96, 96]
    - [48, 29.605]
  - - [768, 8192, 1, 128, 800, 800, 160, 160]
    - [46, 45.055]
  - - [768, 8192, 1, 256, 800, 800, 288, 288]
    - [30, 61.161]
  - - [768, 8192, 1, 512, 800, 800, 544, 544]
    - [30, 73.095]
  - - [768, 8192, 1, 1024, 800, 800, 1056, 1056]
    - [29, 77.295]
  - - [768, 8192, 1, 2048, 800, 800, 2080, 2080]
    - [54, 79.205]
  - - [768, 8192, 1, 4096, 800, 800, 4128, 4128]
    - [25, 74.945]
  - - [768, 8192, 1, 8192, 800, 800, 8224, 8224]
    - [29, 62.236]
  - - [1536, 64, 1, 64, 1568, 1568, 96, 96]
    - [86, 1.021]
  - - [1536, 64, 1, 128, 1568, 1568, 160, 160]
    - [93, 2.029]
  - - [1536, 64, 1, 256, 1568, 1568, 288, 288]
    - [71, 3.825]
  - - [1536, 64, 1, 512, 1568, 1568, 544, 544]
    - [83, 6.681]
  - - [1536, 64, 1, 1024, 1568, 1568, 1056, 1056]
    - [94, 10.739]
  - - [1536, 64, 1, 2048, 1568, 1568, 2080, 2080]
    - [81, 15.173]
  - - [1536, 64, 1, 4096, 1568, 1568, 4128, 4128]
    - [86, 19.494]
  - - [1536, 64, 1, 8192, 1568, 1568, 8224, 8224]
    - [88, 22.508]
  - - [1536, 128, 1, 64, 1568, 1568, 96, 96]
    - [106, 2.068]
  - - [1536, 128, 1, 128, 1568, 1568, 160, 160]
    - [95, 3.907]
  - - [1536, 128, 1, 256, 1568, 1568, 288, 288]
    - [102, 7.058]
  - - [1536, 128, 1, 512, 1568, 1568, 544, 544]
    - [95, 11.978]
  - - [1536, 128, 1, 1024, 1568, 1568, 1056, 1056]
    - [87, 18.45]
  - - [1536, 128, 1, 2048, 1568, 1568, 2080, 2080]
    - [73, 25.078]
  - - [1536, 128, 1, 4096, 1568, 1568, 4128, 4128]
    - [87, 30.462]
  - - [1536, 128, 1, 8192, 1568, 1568, 8224, 8224]
    - [73, 33.894]
  - - [1536, 256, 1, 64, 1568, 1568, 96, 96]
    - [13, 3.971]
  - - [1536, 256, 1, 128, 1568, 1568, 160, 160]
    - [133, 7.487]
  - - [1536, 256, 1, 256, 1568, 1568, 288, 288]
    - [128, 13.499]
  - - [1536, 256, 1, 512, 1568, 1568, 544, 544]
    - [102, 22.606]
  - - [1536, 256, 1, 1024, 1568, 1568, 1056, 1056]
    - [122, 33.874]
  - - [1536, 256, 1, 2048, 1568, 1568, 2080, 2080]
    - [122, 45.143]
  - - [1536, 256, 1, 4096, 1568, 1568, 4128, 4128]
    - [129, 52.589]
  - - [1536, 256, 1, 8192, 1568, 1568, 8224, 8224]
    - [103, 59.273]
  - - [1536, 512, 1, 64, 1568, 1568, 96, 96]
    - [133, 7.322]
  - - [1536, 512, 1, 128, 1568, 1568, 160, 160]
    - [8, 13.444]
  - - [1536, 512, 1, 256, 1568, 1568, 288, 288]
    - [8, 22.994]
  - - [1536, 512, 1, 512, 1568, 1568, 544, 544]
    - [119, 35.748]
  - - [1536, 512, 1, 1024, 1568, 1568, 1056, 1056]
    - [100, 49.559]
  - - [1536, 512, 1, 2048, 1568, 1568, 2080, 2080]
    - [118, 60.627]
  - - [1536, 512, 1, 4096, 1568, 1568, 4128, 4128]
    - [105, 68.934]
  - - [1536, 512, 1, 8192, 1568, 1568, 8224, 8224]
    - [105, 71.551]
  - - [1536, 1024, 1, 64, 1568, 1568, 96, 96]
    - [10, 12.016]
  - - [1536, 1024, 1, 128, 1568, 1568, 160, 160]
    - [116, 20.735]
  - - [1536, 1024, 1, 256, 1568, 1568, 288, 288]
    - [62, 33.443]
  - - [1536, 1024, 1, 512, 1568, 1568, 544, 544]
    - [63, 49.947]
  - - [1536, 1024, 1, 1024, 1568, 1568, 1056, 1056]
    - [52, 62.971]
  - - [1536, 1024, 1, 2048, 1568, 1568, 2080, 2080]
    - [119, 69.49]
  - - [1536, 1024, 1, 4096, 1568, 1568, 4128, 4128]
    - [43, 74.584]
  - - [1536, 1024, 1, 8192, 1568, 1568, 8224, 8224]
    - [65, 77.57]
  - - [1536, 2048, 1, 64, 1568, 1568, 96, 96]
    - [104, 19.395]
  - - [1536, 2048, 1, 128, 1568, 1568, 160, 160]
    - [34, 34.275]
  - - [1536, 2048, 1, 256, 1568, 1568, 288, 288]
    - [70, 50.291]
  - - [1536, 2048, 1, 512, 1568, 1568, 544, 544]
    - [34, 65.807]
  - - [1536, 2048, 1, 1024, 1568, 1568, 1056, 1056]
    - [34, 77.286]
  - - [1536, 2048, 1, 2048, 1568, 1568, 2080, 2080]
    - [31, 79.746]
  - - [1536, 2048, 1, 4096, 1568, 1568, 4128, 4128]
    - [33, 84.359]
  - - [1536, 2048, 1, 8192, 1568, 1568, 8224, 8224]
    - [31, 81.944]
  - - [1536, 4096, 1, 64, 1568, 1568, 96, 96]
    - [35, 29.904]
  - - [1536, 4096, 1, 128, 1568, 1568, 160, 160]
    - [30, 45.289]
  - - [1536, 4096, 1, 256, 1568, 1568, 288, 288]
    - [28, 62.294]
  - - [1536, 4096, 1, 512, 1568, 1568, 544, 544]
    - [28, 74.197]
  - - [1536, 4096, 1, 1024, 1568, 1568, 1056, 1056]
    - [30, 78.757]
  - - [1536, 4096, 1, 2048, 1568, 1568, 2080, 2080]
    - [52, 81.429]
  - - [1536, 4096, 1, 4096, 1568, 1568, 4128, 4128]
    - [49, 74.514]
  - - [1536, 4096, 1, 8192, 1568, 1568, 8224, 8224]
    - [34, 65.766]
  - - [1536, 8192, 1, 64, 1568, 1568, 96, 96]
    - [37, 40.7]
  - - [1536, 8192, 1, 128, 1568, 1568, 160, 160]
    - [30, 57.426]
  - - [1536, 8192, 1, 256, 1568, 1568, 288, 288]
    - [28, 71.425]
  - - [1536, 8192, 1, 512, 1568, 1568, 544, 544]
    - [30, 77.802]
  - - [1536, 8192, 1, 1024, 1568, 1568, 1056, 1056]
    - [29, 79.274]
  - - [1536, 8192, 1, 2048, 1568, 1568, 2080, 2080]
    - [25, 69.325]
  - - [1536, 8192, 1, 4096, 1568, 1568, 4128, 4128]
    - [28, 68.061]
  - - [1536, 8192, 1, 8192, 1568, 1568, 8224, 8224]
    - [27, 66.651]
  - - [3072, 64, 1, 64, 3104, 3104, 96, 96]
    - [74, 1.991]
  - - [3072, 64, 1, 128, 3104, 3104, 160, 160]
    - [79, 3.904]
  - - [3072, 64, 1, 256, 3104, 3104, 288, 288]
    - [77, 7.068]
  - - [3072, 64, 1, 512, 3104, 3104, 544, 544]
    - [95, 12.083]
  - - [3072, 64, 1, 1024, 3104, 3104, 1056, 1056]
    - [87, 18.308]
  - - [3072, 64, 1, 2048, 3104, 3104, 2080, 2080]
    - [87, 25.191]
  - - [3072, 64, 1, 4096, 3104, 3104, 4128, 4128]
    - [87, 30.575]
  - - [3072, 64, 1, 8192, 3104, 3104, 8224, 8224]
    - [73, 34.064]
  - - [3072, 128, 1, 64, 3104, 3104, 96, 96]
    - [124, 2.981]
  - - [3072, 128, 1, 128, 3104, 3104, 160, 160]
    - [116, 7.527]
  - - [3072, 128, 1, 256, 3104, 3104, 288, 288]
    - [114, 13.525]
  - - [3072, 128, 1, 512, 3104, 3104, 544, 544]
    - [122, 22.647]
  - - [3072, 128, 1, 1024, 3104, 3104, 1056, 1056]
    - [128, 32.524]
  - - [3072, 128, 1, 2048, 3104, 3104, 2080, 2080]
    - [101, 45.35]
  - - [3072, 128, 1, 4096, 3104, 3104, 4128, 4128]
    - [116, 53.807]
  - - [3072, 128, 1, 8192, 3104, 3104, 8224, 8224]
    - [103, 59.737]
  - - [3072, 256, 1, 64, 3104, 3104, 96, 96]
    - [98, 7.319]
  - - [3072, 256, 1, 128, 3104, 3104, 160, 160]
    - [18, 13.35]
  - - [3072, 256, 1, 256, 3104, 3104, 288, 288]
    - [100, 22.956]
  - - [3072, 256, 1, 512, 3104, 3104, 544, 544]
    - [119, 35.809]
  - - [3072, 256, 1, 1024, 3104, 3104, 1056, 1056]
    - [100, 49.501]
  - - [3072, 256, 1, 2048, 3104, 3104, 2080, 2080]
    - [119, 59.63]
  - - [3072, 256, 1, 4096, 3104, 3104, 4128, 4128]
    - [100, 68.16]
  - - [3072, 256, 1, 8192, 3104, 3104, 8224, 8224]
    - [100, 70.849]
  - - [3072, 512, 1, 64, 3104, 3104, 96, 96]
    - [17, 11.878]
  - - [3072, 512, 1, 128, 3104, 3104, 160, 160]
    - [104, 20.57]
  - - [3072, 512, 1, 256, 3104, 3104, 288, 288]
    - [47, 33.738]
  - - [3072, 512, 1, 512, 3104, 3104, 544, 544]
    - [63, 49.283]
  - - [3072, 512, 1, 1024, 3104, 3104, 1056, 1056]
    - [28, 62.853]
  - - [3072, 512, 1, 2048, 3104, 3104, 2080, 2080]
    - [43, 69.596]
  - - [3072, 512, 1, 4096, 3104, 3104, 4128, 4128]
    - [43, 75.635]
  - - [3072, 512, 1, 8192, 3104, 3104, 8224, 8224]
    - [42, 78.381]
  - - [3072, 1024, 1, 64, 3104, 3104, 96, 96]
    - [124, 19.425]
  - - [3072, 1024, 1, 128, 3104, 3104, 160, 160]
    - [28, 34.331]
  - - [3072, 1024, 1, 256, 3104, 3104, 288, 288]
    - [41, 50.447]
  - - [3072, 1024, 1, 512, 3104, 3104, 544, 544]
    - [31, 65.962]
  - - [3072, 1024, 1, 1024, 3104, 3104, 1056, 1056]
    - [34, 77.239]
  - - [3072, 1024, 1, 2048, 3104, 3104, 2080, 2080]
    - [31, 80.041]
  - - [3072, 1024, 1, 4096, 3104, 3104, 4128, 4128]
    - [55, 86.374]
  - - [3072, 1024, 1, 8192, 3104, 3104, 8224, 8224]
    - [58, 78.401]
  - - [3072, 2048, 1, 64, 3104, 3104, 96, 96]
    - [36, 29.647]
  - - [3072, 2048, 1, 128, 3104, 3104, 160, 160]
    - [30, 44.858]
  - - [3072, 2048, 1, 256, 3104, 3104, 288, 288]
    - [30, 61.396]
  - - [3072, 2048, 1, 512, 3104, 3104, 544, 544]
    - [30, 73.166]
  - - [3072, 2048, 1, 1024, 3104, 3104, 1056, 1056]
    - [30, 78.133]
  - - [3072, 2048, 1, 2048, 3104, 3104, 2080, 2080]
    - [54, 82.658]
  - - [3072, 2048, 1, 4096, 3104, 3104, 4128, 4128]
    - [50, 72.737]
  - - [3072, 2048, 1, 8192, 3104, 3104, 8224, 8224]
    - [34, 66.997]
  - - [3072, 4096, 1, 64, 3104, 3104, 96, 96]
    - [45, 40.262]
  - - [3072, 4096, 1, 128, 3104, 3104, 160, 160]
    - [46, 57.64]
  - - [3072, 4096, 1, 256, 3104, 3104, 288, 288]
    - [30, 71.41]
  - - [3072, 4096, 1, 512, 3104, 3104, 544, 544]
    - [30, 77.871]
  - - [3072, 4096, 1, 1024, 3104, 3104, 1056, 1056]
    - [30, 81.455]
  - - [3072, 4096, 1, 2048, 3104, 3104, 2080, 2080]
    - [49, 69.179]
  - - [3072, 4096, 1, 4096, 3104, 3104, 4128, 4128]
    - [54, 72.095]
  - - [3072, 4096, 1, 8192, 3104, 3104, 8224, 8224]
    - [28, 67.477]
  - - [3072, 8192, 1, 64, 3104, 3104, 96, 96]
    - [46, 50.096]
  - - [3072, 8192, 1, 128, 3104, 3104, 160, 160]
    - [30, 66.513]
  - - [3072, 8192, 1, 256, 3104, 3104, 288, 288]
    - [30, 75.154]
  - - [3072, 8192, 1, 512, 3104, 3104, 544, 544]
    - [51, 77.629]
  - - [3072, 8192, 1, 1024, 3104, 3104, 1056, 1056]
    - [31, 68.191]
  - - [3072, 8192, 1, 2048, 3104, 3104, 2080, 2080]
    - [29, 70.502]
  - - [3072, 8192, 1, 4096, 3104, 3104, 4128, 4128]
    - [27, 68.268]
  - - [3072, 8192, 1, 8192, 3104, 3104, 8224, 8224]
    - [29, 69.427]
  - - [6144, 64, 1, 64, 6176, 6176, 96, 96]
    - [124, 3.826]
  - - [6144, 64, 1, 128, 6176, 6176, 160, 160]
    - [107, 7.438]
  - - [6144, 64, 1, 256, 6176, 6176, 288, 288]
    - [134, 13.52]
  - - [6144, 64, 1, 512, 6176, 6176, 544, 544]
    - [102, 22.618]
  - - [6144, 64, 1, 1024, 6176, 6176, 1056, 1056]
    - [122, 33.82]
  - - [6144, 64, 1, 2048, 6176, 6176, 2080, 2080]
    - [104, 45.334]
  - - [6144, 64, 1, 4096, 6176, 6176, 4128, 4128]
    - [120, 52.666]
  - - [6144, 64, 1, 8192, 6176, 6176, 8224, 8224]
    - [103, 48.586]
  - - [6144, 128, 1, 64, 6176, 6176, 96, 96]
    - [8, 7.061]
  - - [6144, 128, 1, 128, 6176, 6176, 160, 160]
    - [100, 13.422]
  - - [6144, 128, 1, 256, 6176, 6176, 288, 288]
    - [119, 23.12]
  - - [6144, 128, 1, 512, 6176, 6176, 544, 544]
    - [119, 35.657]
  - - [6144, 128, 1, 1024, 6176, 6176, 1056, 1056]
    - [118, 48.362]
  - - [6144, 128, 1, 2048, 6176, 6176, 2080, 2080]
    - [99, 60.37]
  - - [6144, 128, 1, 4096, 6176, 6176, 4128, 4128]
    - [99, 68.737]
  - - [6144, 128, 1, 8192, 6176, 6176, 8224, 8224]
    - [103, 68.8]
  - - [6144, 256, 1, 64, 6176, 6176, 96, 96]
    - [122, 12.513]
  - - [6144, 256, 1, 128, 6176, 6176, 160, 160]
    - [70, 21.292]
  - - [6144, 256, 1, 256, 6176, 6176, 288, 288]
    - [57, 34.016]
  - - [6144, 256, 1, 512, 6176, 6176, 544, 544]
    - [34, 48.459]
  - - [6144, 256, 1, 1024, 6176, 6176, 1056, 1056]
    - [58, 61.984]
  - - [6144, 256, 1, 2048, 6176, 6176, 2080, 2080]
    - [58, 69.567]
  - - [6144, 256, 1, 4096, 6176, 6176, 4128, 4128]
    - [43, 75.192]
  - - [6144, 256, 1, 8192, 6176, 6176, 8224, 8224]
    - [64, 65.61]
  - - [6144, 512, 1, 64, 6176, 6176, 96, 96]
    - [110, 17.4]
  - - [6144, 512, 1, 128, 6176, 6176, 160, 160]
    - [43, 33.644]
  - - [6144, 512, 1, 256, 6176, 6176, 288, 288]
    - [57, 49.77]
  - - [6144, 512, 1, 512, 6176, 6176, 544, 544]
    - [57, 65.177]
  - - [6144, 512, 1, 1024, 6176, 6176, 1056, 1056]
    - [34, 75.984]
  - - [6144, 512, 1, 2048, 6176, 6176, 2080, 2080]
    - [34, 79.825]
  - - [6144, 512, 1, 4096, 6176, 6176, 4128, 4128]
    - [33, 84.769]
  - - [6144, 512, 1, 8192, 6176, 6176, 8224, 8224]
    - [56, 67.859]
  - - [6144, 1024, 1, 64, 6176, 6176, 96, 96]
    - [37, 29.099]
  - - [6144, 1024, 1, 128, 6176, 6176, 160, 160]
    - [66, 44.636]
  - - [6144, 1024, 1, 256, 6176, 6176, 288, 288]
    - [30, 61.235]
  - - [6144, 1024, 1, 512, 6176, 6176, 544, 544]
    - [30, 73.701]
  - - [6144, 1024, 1, 1024, 6176, 6176, 1056, 1056]
    - [30, 78.454]
  - - [6144, 1024, 1, 2048, 6176, 6176, 2080, 2080]
    - [54, 80.072]
  - - [6144, 1024, 1, 4096, 6176, 6176, 4128, 4128]
    - [26, 81.072]
  - - [6144, 1024, 1, 8192, 6176, 6176, 8224, 8224]
    - [54, 61.691]
  - - [6144, 2048, 1, 64, 6176, 6176, 96, 96]
    - [36, 38.435]
  - - [6144, 2048, 1, 128, 6176, 6176, 160, 160]
    - [46, 57.011]
  - - [6144, 2048, 1, 256, 6176, 6176, 288, 288]
    - [30, 71.986]
  - - [6144, 2048, 1, 512, 6176, 6176, 544, 544]
    - [30, 77.845]
  - - [6144, 2048, 1, 1024, 6176, 6176, 1056, 1056]
    - [30, 81.781]
  - - [6144, 2048, 1, 2048, 6176, 6176, 2080, 2080]
    - [67, 72.596]
  - - [6144, 2048, 1, 4096, 6176, 6176, 4128, 4128]
    - [29, 72.39]
  - - [6144, 2048, 1, 8192, 6176, 6176, 8224, 8224]
    - [53, 62.891]
  - - [6144, 4096, 1, 64, 6176, 6176, 96, 96]
    - [37, 48.165]
  - - [6144, 4096, 1, 128, 6176, 6176, 160, 160]
    - [67, 65.738]
  - - [6144, 4096, 1, 256, 6176, 6176, 288, 288]
    - [30, 74.952]
  - - [6144, 4096, 1, 512, 6176, 6176, 544, 544]
    - [52, 79.88]
  - - [6144, 4096, 1, 1024, 6176, 6176, 1056, 1056]
    - [59, 74.084]
  - - [6144, 4096, 1, 2048, 6176, 6176, 2080, 2080]
    - [30, 70.353]
  - - [6144, 4096, 1, 4096, 6176, 6176, 4128, 4128]
    - [27, 68.755]
  - - [6144, 4096, 1, 8192, 6176, 6176, 8224, 8224]
    - [32, 66.501]
  - - [6144, 8192, 1, 64, 6176, 6176, 96, 96]
    - [68, 46.851]
  - - [6144, 8192, 1, 128, 6176, 6176, 160, 160]
    - [66, 66.983]
  - - [6144, 8192, 1, 256, 6176, 6176, 288, 288]
    - [61, 77.201]
  - - [6144, 8192, 1, 512, 6176, 6176, 544, 544]
    - [44, 67.633]
  - - [6144, 8192, 1, 1024, 6176, 6176, 1056, 1056]
    - [60, 65.392]
  - - [6144, 8192, 1, 2048, 6176, 6176, 2080, 2080]
    - [54, 68.514]
  - - [6144, 8192, 1, 4096, 6176, 6176, 4128, 4128]
    - [56, 70.044]
  - - [6144, 8192, 1, 8192, 6176, 6176, 8224, 8224]
    - [56, 68.324]
- null
- null
- DeviceEfficiency
