library/src/blas3/Tensile/Logic/asm_full/navi31/navi31_Cijk_Alik_Bljk_I8II_BH_GB.yaml
- {MinimumRequiredVersion: 4.35.0}
- navi31
- gfx1100
- [Device 73bf]
    SolutionIndex: 0
    SolutionNameMin: Cijk_Alik_Bljk_I8II_BH_MT32x32x16_MI16x16x16x1_SN_1LDSB0_AMAS0_GRVW16_IU1_SIA1_SU0_SUS0_SVW1_TT1_16_VW1_WGM4
    SolutionIndex: 1
    SolutionNameMin: Cijk_Alik_Bljk_I8II_BH_MT32x32x16_MI16x16x16x1_SN_1LDSB1_AMAS0_GRVW16_IU1_SIA2_SU0_SUS0_SVW1_TT1_16_VW1_WGM8
    SolutionIndex: 2
    SolutionNameMin: Cijk_Alik_Bljk_I8II_BH_MT32x32x16_MI16x16x16x1_SN_1LDSB1_AMAS0_GRVW8_IU1_SIA2_SU32_SUS256_SVW1_TT1_16_VW1_WGM8
    SolutionIndex: 3
    SolutionNameMin: Cijk_Alik_Bljk_I8II_BH_MT32x32x16_MI16x16x16x1_SN_1LDSB0_AMAS0_GRVW8_IU1_SIA3_SU32_SUS256_SVW1_TT1_16_VW1_WGM8
    SolutionIndex: 4
    SolutionNameMin: Cijk_Alik_Bljk_I8II_BH_MT64x64x16_MI16x16x16x1_SN_1LDSB0_AMAS0_GRVW4_IU1_SIA1_SU0_SUS0_SVW1_TT2_32_VW1_WGM4
    SolutionIndex: 5
    SolutionNameMin: Cijk_Alik_Bljk_I8II_BH_MT64x64x16_MI16x16x16x1_SN_1LDSB0_AMAS0_GRVW8_IU1_SIA3_SU0_SUS0_SVW1_TT2_32_VW1_WGM4
    SolutionIndex: 6
    SolutionNameMin: Cijk_Alik_Bljk_I8II_BH_MT64x64x16_MI16x16x16x1_SN_1LDSB0_AMAS3_GRVW8_IU1_SIA3_SU0_SUS0_SVW2_TT2_32_VW2_WGM4
    SolutionIndex: 7
    SolutionNameMin: Cijk_Alik_Bljk_I8II_BH_MT64x64x16_MI16x16x16x1_SN_1LDSB0_AMAS3_GRVW8_IU1_SIA1_SU0_SUS0_SVW2_TT2_32_VW2_WGM8
    SolutionIndex: 8
    SolutionNameMin: Cijk_Alik_Bljk_I8II_BH_MT128x128x16_MI16x16x16x1_SN_1LDSB0_AMAS0_GRVW16_IU1_SIA1_SU0_SUS0_SVW1_TT4_64_VW1_WGM4
    SolutionIndex: 9
    SolutionNameMin: Cijk_Alik_Bljk_I8II_BH_MT128x128x16_MI16x16x16x1_SN_1LDSB0_AMAS3_GRVW16_IU1_SIA1_SU0_SUS0_SVW2_TT4_64_VW2_WGM4
    SolutionIndex: 10
    SolutionNameMin: Cijk_Alik_Bljk_I8II_BH_MT128x128x16_MI16x16x16x1_SN_1LDSB0_AMAS3_GRVW4_IU1_SIA3_SU0_SUS0_SVW2_TT4_64_VW2_WGM4
    SolutionIndex: 11
    SolutionNameMin: Cijk_Alik_Bljk_I8II_BH_MT128x128x16_MI16x16x16x1_SN_1LDSB0_AMAS0_GRVW16_IU1_SIA3_SU0_SUS0_SVW1_TT4_64_VW1_WGM4
    SolutionIndex: 12
    SolutionNameMin: Cijk_Alik_Bljk_I8II_BH_MT128x128x16_MI16x16x16x1_SN_1LDSB0_AMAS3_GRVW16_IU1_SIA3_SU0_SUS0_SVW4_TT4_64_VW4_WGM4
    SolutionIndex: 13
    SolutionNameMin: Cijk_Alik_Bljk_I8II_BH_MT128x128x16_MI16x16x16x1_SN_1LDSB0_AMAS3_GRVW8_IU1_SIA1_SU32_SUS128_SVW2_TT4_64_VW2_WGM4
    SolutionIndex: 14
    SolutionNameMin: Cijk_Alik_Bljk_I8II_BH_MT128x128x16_MI16x16x16x1_SN_1LDSB0_AMAS3_GRVW4_IU1_SIA3_SU32_SUS128_SVW4_TT4_64_VW4_WGM4
    SolutionIndex: 15
    SolutionNameMin: Cijk_Alik_Bljk_I8II_BH_MT128x128x16_MI16x16x16x1_SN_1LDSB0_AMAS0_GRVW16_IU1_SIA3_SU32_SUS256_SVW1_TT4_64_VW1_WGM4
    SolutionIndex: 16
    SolutionNameMin: Cijk_Alik_Bljk_I8II_BH_MT128x128x16_MI16x16x16x1_SN_1LDSB0_AMAS3_GRVW16_IU1_SIA1_SU32_SUS128_SVW4_TT4_64_VW4_WGM8
    SolutionIndex: 17
    SolutionNameMin: Cijk_Alik_Bljk_I8II_BH_MT128x128x16_MI16x16x16x1_SN_1LDSB0_AMAS0_GRVW16_IU1_SIA3_SU32_SUS128_SVW1_TT4_64_VW1_WGM8
    SolutionIndex: 18
    SolutionNameMin: Cijk_Alik_Bljk_I8II_BH_MT128x128x16_MI16x16x16x1_SN_1LDSB0_AMAS3_GRVW16_IU1_SIA3_SU32_SUS128_SVW2_TT4_64_VW2_WGM8
    SolutionIndex: 19
    SolutionNameMin: Cijk_Alik_Bljk_I8II_BH_MT32x32x32_MI16x16x16x1_SN_1LDSB0_AMAS0_GRVW4_IU1_SIA1_SU0_SUS0_SVW1_TT1_16_VW1_WGM4
    SolutionIndex: 20
    SolutionNameMin: Cijk_Alik_Bljk_I8II_BH_MT32x32x32_MI16x16x16x1_SN_1LDSB0_AMAS0_GRVW8_IU1_SIA1_SU0_SUS0_SVW1_TT1_16_VW1_WGM4
    SolutionIndex: 21
    SolutionNameMin: Cijk_Alik_Bljk_I8II_BH_MT32x32x32_MI16x16x16x1_SN_1LDSB0_AMAS0_GRVW16_IU1_SIA1_SU0_SUS0_SVW1_TT1_16_VW1_WGM4
    SolutionIndex: 22
    SolutionNameMin: Cijk_Alik_Bljk_I8II_BH_MT32x32x32_MI16x16x16x1_SN_1LDSB1_AMAS0_GRVW4_IU2_SIA2_SU0_SUS0_SVW1_TT1_16_VW1_WGM4
    SolutionIndex: 23
    SolutionNameMin: Cijk_Alik_Bljk_I8II_BH_MT32x32x32_MI16x16x16x1_SN_1LDSB1_AMAS0_GRVW8_IU2_SIA2_SU0_SUS0_SVW1_TT1_16_VW1_WGM4
    SolutionIndex: 24
    SolutionNameMin: Cijk_Alik_Bljk_I8II_BH_MT32x32x32_MI16x16x16x1_SN_1LDSB1_AMAS0_GRVW16_IU2_SIA2_SU0_SUS0_SVW1_TT1_16_VW1_WGM4
    SolutionIndex: 25
    SolutionNameMin: Cijk_Alik_Bljk_I8II_BH_MT32x32x32_MI16x16x16x1_SN_1LDSB0_AMAS0_GRVW4_IU1_SIA3_SU0_SUS0_SVW1_TT1_16_VW1_WGM4
    SolutionIndex: 26
    SolutionNameMin: Cijk_Alik_Bljk_I8II_BH_MT32x32x32_MI16x16x16x1_SN_1LDSB0_AMAS0_GRVW8_IU1_SIA3_SU0_SUS0_SVW1_TT1_16_VW1_WGM4
    SolutionIndex: 27
    SolutionNameMin: Cijk_Alik_Bljk_I8II_BH_MT32x32x32_MI16x16x16x1_SN_1LDSB0_AMAS0_GRVW4_IU1_SIA1_SU32_SUS128_SVW1_TT1_16_VW1_WGM4
    SolutionIndex: 28
    SolutionNameMin: Cijk_Alik_Bljk_I8II_BH_MT32x32x32_MI16x16x16x1_SN_1LDSB0_AMAS0_GRVW8_IU1_SIA1_SU32_SUS128_SVW1_TT1_16_VW1_WGM4
    SolutionIndex: 29
    SolutionNameMin: Cijk_Alik_Bljk_I8II_BH_MT32x32x32_MI16x16x16x1_SN_1LDSB1_AMAS0_GRVW4_IU2_SIA2_SU32_SUS128_SVW1_TT1_16_VW1_WGM4
    SolutionIndex: 30
    SolutionNameMin: Cijk_Alik_Bljk_I8II_BH_MT32x32x32_MI16x16x16x1_SN_1LDSB1_AMAS0_GRVW8_IU2_SIA2_SU32_SUS128_SVW1_TT1_16_VW1_WGM4
    SolutionIndex: 31
    SolutionNameMin: Cijk_Alik_Bljk_I8II_BH_MT32x32x32_MI16x16x16x1_SN_1LDSB1_AMAS0_GRVW16_IU2_SIA2_SU32_SUS128_SVW1_TT1_16_VW1_WGM4
    SolutionIndex: 32
    SolutionNameMin: Cijk_Alik_Bljk_I8II_BH_MT32x32x32_MI16x16x16x1_SN_1LDSB0_AMAS0_GRVW4_IU1_SIA3_SU32_SUS128_SVW1_TT1_16_VW1_WGM4
    SolutionIndex: 33
    SolutionNameMin: Cijk_Alik_Bljk_I8II_BH_MT32x32x32_MI16x16x16x1_SN_1LDSB0_AMAS0_GRVW4_IU1_SIA1_SU32_SUS256_SVW1_TT1_16_VW1_WGM4
    SolutionIndex: 34
    SolutionNameMin: Cijk_Alik_Bljk_I8II_BH_MT32x32x32_MI16x16x16x1_SN_1LDSB0_AMAS0_GRVW8_IU1_SIA1_SU32_SUS256_SVW1_TT1_16_VW1_WGM4
    SolutionIndex: 35
    SolutionNameMin: Cijk_Alik_Bljk_I8II_BH_MT32x32x32_MI16x16x16x1_SN_1LDSB0_AMAS0_GRVW16_IU1_SIA1_SU32_SUS256_SVW1_TT1_16_VW1_WGM4
    SolutionIndex: 36
    SolutionNameMin: Cijk_Alik_Bljk_I8II_BH_MT32x32x32_MI16x16x16x1_SN_1LDSB1_AMAS0_GRVW4_IU2_SIA2_SU32_SUS256_SVW1_TT1_16_VW1_WGM4
    SolutionIndex: 37
    SolutionNameMin: Cijk_Alik_Bljk_I8II_BH_MT32x32x32_MI16x16x16x1_SN_1LDSB1_AMAS0_GRVW8_IU2_SIA2_SU32_SUS256_SVW1_TT1_16_VW1_WGM4
    SolutionIndex: 38
    SolutionNameMin: Cijk_Alik_Bljk_I8II_BH_MT32x32x32_MI16x16x16x1_SN_1LDSB1_AMAS0_GRVW16_IU2_SIA2_SU32_SUS256_SVW1_TT1_16_VW1_WGM4
    SolutionIndex: 39
    SolutionNameMin: Cijk_Alik_Bljk_I8II_BH_MT32x32x32_MI16x16x16x1_SN_1LDSB0_AMAS0_GRVW4_IU1_SIA3_SU32_SUS256_SVW1_TT1_16_VW1_WGM4
    SolutionIndex: 40
    SolutionNameMin: Cijk_Alik_Bljk_I8II_BH_MT32x32x32_MI16x16x16x1_SN_1LDSB0_AMAS0_GRVW4_IU1_SIA1_SU0_SUS0_SVW1_TT1_16_VW1_WGM8
    SolutionIndex: 41
    SolutionNameMin: Cijk_Alik_Bljk_I8II_BH_MT32x32x32_MI16x16x16x1_SN_1LDSB0_AMAS0_GRVW16_IU1_SIA1_SU0_SUS0_SVW1_TT1_16_VW1_WGM8
    SolutionIndex: 42
    SolutionNameMin: Cijk_Alik_Bljk_I8II_BH_MT32x32x32_MI16x16x16x1_SN_1LDSB1_AMAS0_GRVW4_IU2_SIA2_SU0_SUS0_SVW1_TT1_16_VW1_WGM8
    SolutionIndex: 43
    SolutionNameMin: Cijk_Alik_Bljk_I8II_BH_MT32x32x32_MI16x16x16x1_SN_1LDSB1_AMAS0_GRVW8_IU2_SIA2_SU0_SUS0_SVW1_TT1_16_VW1_WGM8
    SolutionIndex: 44
    SolutionNameMin: Cijk_Alik_Bljk_I8II_BH_MT32x32x32_MI16x16x16x1_SN_1LDSB1_AMAS0_GRVW16_IU2_SIA2_SU0_SUS0_SVW1_TT1_16_VW1_WGM8
    SolutionIndex: 45
    SolutionNameMin: Cijk_Alik_Bljk_I8II_BH_MT32x32x32_MI16x16x16x1_SN_1LDSB0_AMAS0_GRVW4_IU1_SIA3_SU0_SUS0_SVW1_TT1_16_VW1_WGM8
    SolutionIndex: 46
    SolutionNameMin: Cijk_Alik_Bljk_I8II_BH_MT32x32x32_MI16x16x16x1_SN_1LDSB0_AMAS0_GRVW8_IU1_SIA3_SU0_SUS0_SVW1_TT1_16_VW1_WGM8
    SolutionIndex: 47
    SolutionNameMin: Cijk_Alik_Bljk_I8II_BH_MT32x32x32_MI16x16x16x1_SN_1LDSB1_AMAS0_GRVW4_IU2_SIA2_SU32_SUS128_SVW1_TT1_16_VW1_WGM8
    SolutionIndex: 48
    SolutionNameMin: Cijk_Alik_Bljk_I8II_BH_MT32x32x32_MI16x16x16x1_SN_1LDSB1_AMAS0_GRVW8_IU2_SIA2_SU32_SUS128_SVW1_TT1_16_VW1_WGM8
    SolutionIndex: 49
    SolutionNameMin: Cijk_Alik_Bljk_I8II_BH_MT32x32x32_MI16x16x16x1_SN_1LDSB1_AMAS0_GRVW16_IU2_SIA2_SU32_SUS128_SVW1_TT1_16_VW1_WGM8
    SolutionIndex: 50
    SolutionNameMin: Cijk_Alik_Bljk_I8II_BH_MT32x32x32_MI16x16x16x1_SN_1LDSB0_AMAS0_GRVW4_IU1_SIA3_SU32_SUS128_SVW1_TT1_16_VW1_WGM8
    SolutionIndex: 51
    SolutionNameMin: Cijk_Alik_Bljk_I8II_BH_MT32x32x32_MI16x16x16x1_SN_1LDSB0_AMAS0_GRVW8_IU1_SIA3_SU32_SUS128_SVW1_TT1_16_VW1_WGM8
    SolutionIndex: 52
    SolutionNameMin: Cijk_Alik_Bljk_I8II_BH_MT32x32x32_MI16x16x16x1_SN_1LDSB0_AMAS0_GRVW16_IU1_SIA3_SU32_SUS128_SVW1_TT1_16_VW1_WGM8
    SolutionIndex: 53
    SolutionNameMin: Cijk_Alik_Bljk_I8II_BH_MT32x32x32_MI16x16x16x1_SN_1LDSB0_AMAS0_GRVW4_IU1_SIA1_SU32_SUS256_SVW1_TT1_16_VW1_WGM8
    SolutionIndex: 54
    SolutionNameMin: Cijk_Alik_Bljk_I8II_BH_MT32x32x32_MI16x16x16x1_SN_1LDSB0_AMAS0_GRVW8_IU1_SIA1_SU32_SUS256_SVW1_TT1_16_VW1_WGM8
    SolutionIndex: 55
    SolutionNameMin: Cijk_Alik_Bljk_I8II_BH_MT32x32x32_MI16x16x16x1_SN_1LDSB1_AMAS0_GRVW4_IU2_SIA2_SU32_SUS256_SVW1_TT1_16_VW1_WGM8
    SolutionIndex: 56
    SolutionNameMin: Cijk_Alik_Bljk_I8II_BH_MT32x32x32_MI16x16x16x1_SN_1LDSB1_AMAS0_GRVW8_IU2_SIA2_SU32_SUS256_SVW1_TT1_16_VW1_WGM8
    SolutionIndex: 57
    SolutionNameMin: Cijk_Alik_Bljk_I8II_BH_MT32x32x32_MI16x16x16x1_SN_1LDSB1_AMAS0_GRVW16_IU2_SIA2_SU32_SUS256_SVW1_TT1_16_VW1_WGM8
    SolutionIndex: 58
    SolutionNameMin: Cijk_Alik_Bljk_I8II_BH_MT32x32x32_MI16x16x16x1_SN_1LDSB0_AMAS0_GRVW4_IU1_SIA3_SU32_SUS256_SVW1_TT1_16_VW1_WGM8
    SolutionIndex: 59
    SolutionNameMin: Cijk_Alik_Bljk_I8II_BH_MT32x32x32_MI16x16x16x1_SN_1LDSB0_AMAS0_GRVW8_IU1_SIA3_SU32_SUS256_SVW1_TT1_16_VW1_WGM8
    SolutionIndex: 60
    SolutionNameMin: Cijk_Alik_Bljk_I8II_BH_MT32x32x32_MI16x16x16x1_SN_1LDSB0_AMAS0_GRVW16_IU1_SIA3_SU32_SUS256_SVW1_TT1_16_VW1_WGM8
    SolutionIndex: 61
    SolutionNameMin: Cijk_Alik_Bljk_I8II_BH_MT64x64x32_MI16x16x16x1_SN_1LDSB0_AMAS0_GRVW4_IU1_SIA1_SU0_SUS0_SVW1_TT2_32_VW1_WGM4
    SolutionIndex: 62
    SolutionNameMin: Cijk_Alik_Bljk_I8II_BH_MT64x64x32_MI16x16x16x1_SN_1LDSB0_AMAS3_GRVW4_IU1_SIA1_SU0_SUS0_SVW2_TT2_32_VW2_WGM4
    SolutionIndex: 63
    SolutionNameMin: Cijk_Alik_Bljk_I8II_BH_MT64x64x32_MI16x16x16x1_SN_1LDSB0_AMAS0_GRVW8_IU1_SIA1_SU0_SUS0_SVW1_TT2_32_VW1_WGM4
    SolutionIndex: 64
    SolutionNameMin: Cijk_Alik_Bljk_I8II_BH_MT64x64x32_MI16x16x16x1_SN_1LDSB0_AMAS3_GRVW8_IU1_SIA1_SU0_SUS0_SVW2_TT2_32_VW2_WGM4
    SolutionIndex: 65
    SolutionNameMin: Cijk_Alik_Bljk_I8II_BH_MT64x64x32_MI16x16x16x1_SN_1LDSB0_AMAS0_GRVW16_IU1_SIA1_SU0_SUS0_SVW1_TT2_32_VW1_WGM4
    SolutionIndex: 66
    SolutionNameMin: Cijk_Alik_Bljk_I8II_BH_MT64x64x32_MI16x16x16x1_SN_1LDSB0_AMAS3_GRVW16_IU1_SIA1_SU0_SUS0_SVW2_TT2_32_VW2_WGM4
    SolutionIndex: 67
    SolutionNameMin: Cijk_Alik_Bljk_I8II_BH_MT64x64x32_MI16x16x16x1_SN_1LDSB1_AMAS0_GRVW4_IU2_SIA2_SU0_SUS0_SVW1_TT2_32_VW1_WGM4
    SolutionIndex: 68
    SolutionNameMin: Cijk_Alik_Bljk_I8II_BH_MT64x64x32_MI16x16x16x1_SN_1LDSB1_AMAS0_GRVW8_IU2_SIA2_SU0_SUS0_SVW1_TT2_32_VW1_WGM4
    SolutionIndex: 69
    SolutionNameMin: Cijk_Alik_Bljk_I8II_BH_MT64x64x32_MI16x16x16x1_SN_1LDSB1_AMAS3_GRVW8_IU2_SIA2_SU0_SUS0_SVW2_TT2_32_VW2_WGM4
    SolutionIndex: 70
    SolutionNameMin: Cijk_Alik_Bljk_I8II_BH_MT64x64x32_MI16x16x16x1_SN_1LDSB1_AMAS0_GRVW16_IU2_SIA2_SU0_SUS0_SVW1_TT2_32_VW1_WGM4
    SolutionIndex: 71
    SolutionNameMin: Cijk_Alik_Bljk_I8II_BH_MT64x64x32_MI16x16x16x1_SN_1LDSB1_AMAS3_GRVW16_IU2_SIA2_SU0_SUS0_SVW2_TT2_32_VW2_WGM4
    SolutionIndex: 72
    SolutionNameMin: Cijk_Alik_Bljk_I8II_BH_MT64x64x32_MI16x16x16x1_SN_1LDSB0_AMAS3_GRVW4_IU1_SIA3_SU0_SUS0_SVW2_TT2_32_VW2_WGM4
    SolutionIndex: 73
    SolutionNameMin: Cijk_Alik_Bljk_I8II_BH_MT64x64x32_MI16x16x16x1_SN_1LDSB0_AMAS3_GRVW8_IU1_SIA3_SU0_SUS0_SVW2_TT2_32_VW2_WGM4
    SolutionIndex: 74
    SolutionNameMin: Cijk_Alik_Bljk_I8II_BH_MT64x64x32_MI16x16x16x1_SN_1LDSB0_AMAS3_GRVW16_IU1_SIA3_SU0_SUS0_SVW2_TT2_32_VW2_WGM4
    SolutionIndex: 75
    SolutionNameMin: Cijk_Alik_Bljk_I8II_BH_MT64x64x32_MI16x16x16x1_SN_1LDSB0_AMAS0_GRVW8_IU1_SIA1_SU32_SUS128_SVW1_TT2_32_VW1_WGM4
    SolutionIndex: 76
    SolutionNameMin: Cijk_Alik_Bljk_I8II_BH_MT64x64x32_MI16x16x16x1_SN_1LDSB0_AMAS3_GRVW8_IU1_SIA1_SU32_SUS128_SVW2_TT2_32_VW2_WGM4
    SolutionIndex: 77
    SolutionNameMin: Cijk_Alik_Bljk_I8II_BH_MT64x64x32_MI16x16x16x1_SN_1LDSB0_AMAS0_GRVW16_IU1_SIA1_SU32_SUS128_SVW1_TT2_32_VW1_WGM4
    SolutionIndex: 78
    SolutionNameMin: Cijk_Alik_Bljk_I8II_BH_MT64x64x32_MI16x16x16x1_SN_1LDSB0_AMAS3_GRVW16_IU1_SIA1_SU32_SUS128_SVW2_TT2_32_VW2_WGM4
    SolutionIndex: 79
    SolutionNameMin: Cijk_Alik_Bljk_I8II_BH_MT64x64x32_MI16x16x16x1_SN_1LDSB1_AMAS3_GRVW8_IU2_SIA2_SU32_SUS128_SVW2_TT2_32_VW2_WGM4
    SolutionIndex: 80
    SolutionNameMin: Cijk_Alik_Bljk_I8II_BH_MT64x64x32_MI16x16x16x1_SN_1LDSB1_AMAS3_GRVW16_IU2_SIA2_SU32_SUS128_SVW2_TT2_32_VW2_WGM4
    SolutionIndex: 81
    SolutionNameMin: Cijk_Alik_Bljk_I8II_BH_MT64x64x32_MI16x16x16x1_SN_1LDSB0_AMAS0_GRVW8_IU1_SIA3_SU32_SUS128_SVW1_TT2_32_VW1_WGM4
    SolutionIndex: 82
    SolutionNameMin: Cijk_Alik_Bljk_I8II_BH_MT64x64x32_MI16x16x16x1_SN_1LDSB0_AMAS3_GRVW8_IU1_SIA3_SU32_SUS128_SVW2_TT2_32_VW2_WGM4
    SolutionIndex: 83
    SolutionNameMin: Cijk_Alik_Bljk_I8II_BH_MT64x64x32_MI16x16x16x1_SN_1LDSB0_AMAS3_GRVW16_IU1_SIA3_SU32_SUS128_SVW2_TT2_32_VW2_WGM4
    SolutionIndex: 84
    SolutionNameMin: Cijk_Alik_Bljk_I8II_BH_MT64x64x32_MI16x16x16x1_SN_1LDSB0_AMAS0_GRVW4_IU1_SIA1_SU32_SUS256_SVW1_TT2_32_VW1_WGM4
    SolutionIndex: 85
    SolutionNameMin: Cijk_Alik_Bljk_I8II_BH_MT64x64x32_MI16x16x16x1_SN_1LDSB0_AMAS3_GRVW4_IU1_SIA1_SU32_SUS256_SVW2_TT2_32_VW2_WGM4
    SolutionIndex: 86
    SolutionNameMin: Cijk_Alik_Bljk_I8II_BH_MT64x64x32_MI16x16x16x1_SN_1LDSB0_AMAS0_GRVW8_IU1_SIA1_SU32_SUS256_SVW1_TT2_32_VW1_WGM4
    SolutionIndex: 87
    SolutionNameMin: Cijk_Alik_Bljk_I8II_BH_MT64x64x32_MI16x16x16x1_SN_1LDSB0_AMAS3_GRVW8_IU1_SIA1_SU32_SUS256_SVW2_TT2_32_VW2_WGM4
    SolutionIndex: 88
    SolutionNameMin: Cijk_Alik_Bljk_I8II_BH_MT64x64x32_MI16x16x16x1_SN_1LDSB0_AMAS0_GRVW16_IU1_SIA1_SU32_SUS256_SVW1_TT2_32_VW1_WGM4
    SolutionIndex: 89
    SolutionNameMin: Cijk_Alik_Bljk_I8II_BH_MT64x64x32_MI16x16x16x1_SN_1LDSB0_AMAS3_GRVW16_IU1_SIA1_SU32_SUS256_SVW2_TT2_32_VW2_WGM4
    SolutionIndex: 90
    SolutionNameMin: Cijk_Alik_Bljk_I8II_BH_MT64x64x32_MI16x16x16x1_SN_1LDSB1_AMAS3_GRVW8_IU2_SIA2_SU32_SUS256_SVW2_TT2_32_VW2_WGM4
    SolutionIndex: 91
    SolutionNameMin: Cijk_Alik_Bljk_I8II_BH_MT64x64x32_MI16x16x16x1_SN_1LDSB1_AMAS3_GRVW16_IU2_SIA2_SU32_SUS256_SVW2_TT2_32_VW2_WGM4
    SolutionIndex: 92
    SolutionNameMin: Cijk_Alik_Bljk_I8II_BH_MT64x64x32_MI16x16x16x1_SN_1LDSB0_AMAS0_GRVW16_IU1_SIA3_SU32_SUS256_SVW1_TT2_32_VW1_WGM4
    SolutionIndex: 93
    SolutionNameMin: Cijk_Alik_Bljk_I8II_BH_MT64x64x32_MI16x16x16x1_SN_1LDSB0_AMAS3_GRVW16_IU1_SIA3_SU32_SUS256_SVW2_TT2_32_VW2_WGM4
    SolutionIndex: 94
    SolutionNameMin: Cijk_Alik_Bljk_I8II_BH_MT64x64x32_MI16x16x16x1_SN_1LDSB0_AMAS0_GRVW4_IU1_SIA1_SU0_SUS0_SVW1_TT2_32_VW1_WGM8
    SolutionIndex: 95
    SolutionNameMin: Cijk_Alik_Bljk_I8II_BH_MT64x64x32_MI16x16x16x1_SN_1LDSB0_AMAS3_GRVW8_IU1_SIA1_SU0_SUS0_SVW2_TT2_32_VW2_WGM8
    SolutionIndex: 96
    SolutionNameMin: Cijk_Alik_Bljk_I8II_BH_MT64x64x32_MI16x16x16x1_SN_1LDSB0_AMAS0_GRVW16_IU1_SIA1_SU0_SUS0_SVW1_TT2_32_VW1_WGM8
    SolutionIndex: 97
    SolutionNameMin: Cijk_Alik_Bljk_I8II_BH_MT64x64x32_MI16x16x16x1_SN_1LDSB0_AMAS3_GRVW16_IU1_SIA1_SU0_SUS0_SVW2_TT2_32_VW2_WGM8
    SolutionIndex: 98
    SolutionNameMin: Cijk_Alik_Bljk_I8II_BH_MT64x64x32_MI16x16x16x1_SN_1LDSB1_AMAS0_GRVW8_IU2_SIA2_SU0_SUS0_SVW1_TT2_32_VW1_WGM8
    SolutionIndex: 99
    SolutionNameMin: Cijk_Alik_Bljk_I8II_BH_MT64x64x32_MI16x16x16x1_SN_1LDSB1_AMAS3_GRVW8_IU2_SIA2_SU0_SUS0_SVW2_TT2_32_VW2_WGM8
    SolutionIndex: 100
    SolutionNameMin: Cijk_Alik_Bljk_I8II_BH_MT64x64x32_MI16x16x16x1_SN_1LDSB1_AMAS0_GRVW16_IU2_SIA2_SU0_SUS0_SVW1_TT2_32_VW1_WGM8
    SolutionIndex: 101
    SolutionNameMin: Cijk_Alik_Bljk_I8II_BH_MT64x64x32_MI16x16x16x1_SN_1LDSB1_AMAS3_GRVW16_IU2_SIA2_SU0_SUS0_SVW2_TT2_32_VW2_WGM8
    SolutionIndex: 102
    SolutionNameMin: Cijk_Alik_Bljk_I8II_BH_MT64x64x32_MI16x16x16x1_SN_1LDSB0_AMAS0_GRVW4_IU1_SIA3_SU0_SUS0_SVW1_TT2_32_VW1_WGM8
    SolutionIndex: 103
    SolutionNameMin: Cijk_Alik_Bljk_I8II_BH_MT64x64x32_MI16x16x16x1_SN_1LDSB0_AMAS0_GRVW8_IU1_SIA3_SU0_SUS0_SVW1_TT2_32_VW1_WGM8
    SolutionIndex: 104
    SolutionNameMin: Cijk_Alik_Bljk_I8II_BH_MT64x64x32_MI16x16x16x1_SN_1LDSB0_AMAS3_GRVW8_IU1_SIA3_SU0_SUS0_SVW2_TT2_32_VW2_WGM8
    SolutionIndex: 105
    SolutionNameMin: Cijk_Alik_Bljk_I8II_BH_MT64x64x32_MI16x16x16x1_SN_1LDSB0_AMAS0_GRVW16_IU1_SIA3_SU0_SUS0_SVW1_TT2_32_VW1_WGM8
    SolutionIndex: 106
    SolutionNameMin: Cijk_Alik_Bljk_I8II_BH_MT64x64x32_MI16x16x16x1_SN_1LDSB0_AMAS3_GRVW16_IU1_SIA3_SU0_SUS0_SVW2_TT2_32_VW2_WGM8
    SolutionIndex: 107
    SolutionNameMin: Cijk_Alik_Bljk_I8II_BH_MT64x64x32_MI16x16x16x1_SN_1LDSB0_AMAS3_GRVW8_IU1_SIA1_SU32_SUS128_SVW2_TT2_32_VW2_WGM8
    SolutionIndex: 108
    SolutionNameMin: Cijk_Alik_Bljk_I8II_BH_MT64x64x32_MI16x16x16x1_SN_1LDSB1_AMAS0_GRVW16_IU2_SIA2_SU32_SUS128_SVW1_TT2_32_VW1_WGM8
    SolutionIndex: 109
    SolutionNameMin: Cijk_Alik_Bljk_I8II_BH_MT64x64x32_MI16x16x16x1_SN_1LDSB1_AMAS3_GRVW16_IU2_SIA2_SU32_SUS128_SVW2_TT2_32_VW2_WGM8
    SolutionIndex: 110
    SolutionNameMin: Cijk_Alik_Bljk_I8II_BH_MT64x64x32_MI16x16x16x1_SN_1LDSB0_AMAS3_GRVW8_IU1_SIA3_SU32_SUS128_SVW2_TT2_32_VW2_WGM8
    SolutionIndex: 111
    SolutionNameMin: Cijk_Alik_Bljk_I8II_BH_MT64x64x32_MI16x16x16x1_SN_1LDSB0_AMAS0_GRVW16_IU1_SIA3_SU32_SUS128_SVW1_TT2_32_VW1_WGM8
    SolutionIndex: 112
    SolutionNameMin: Cijk_Alik_Bljk_I8II_BH_MT64x64x32_MI16x16x16x1_SN_1LDSB0_AMAS3_GRVW16_IU1_SIA3_SU32_SUS128_SVW2_TT2_32_VW2_WGM8
    SolutionIndex: 113
    SolutionNameMin: Cijk_Alik_Bljk_I8II_BH_MT64x64x32_MI16x16x16x1_SN_1LDSB0_AMAS0_GRVW4_IU1_SIA1_SU32_SUS256_SVW1_TT2_32_VW1_WGM8
    SolutionIndex: 114
    SolutionNameMin: Cijk_Alik_Bljk_I8II_BH_MT64x64x32_MI16x16x16x1_SN_1LDSB0_AMAS0_GRVW8_IU1_SIA1_SU32_SUS256_SVW1_TT2_32_VW1_WGM8
    SolutionIndex: 115
    SolutionNameMin: Cijk_Alik_Bljk_I8II_BH_MT64x64x32_MI16x16x16x1_SN_1LDSB0_AMAS3_GRVW8_IU1_SIA1_SU32_SUS256_SVW2_TT2_32_VW2_WGM8
    SolutionIndex: 116
    SolutionNameMin: Cijk_Alik_Bljk_I8II_BH_MT64x64x32_MI16x16x16x1_SN_1LDSB0_AMAS0_GRVW16_IU1_SIA1_SU32_SUS256_SVW1_TT2_32_VW1_WGM8
    SolutionIndex: 117
    SolutionNameMin: Cijk_Alik_Bljk_I8II_BH_MT64x64x32_MI16x16x16x1_SN_1LDSB0_AMAS3_GRVW16_IU1_SIA1_SU32_SUS256_SVW2_TT2_32_VW2_WGM8
    SolutionIndex: 118
    SolutionNameMin: Cijk_Alik_Bljk_I8II_BH_MT64x64x32_MI16x16x16x1_SN_1LDSB1_AMAS0_GRVW8_IU2_SIA2_SU32_SUS256_SVW1_TT2_32_VW1_WGM8
    SolutionIndex: 119
    SolutionNameMin: Cijk_Alik_Bljk_I8II_BH_MT64x64x32_MI16x16x16x1_SN_1LDSB1_AMAS3_GRVW8_IU2_SIA2_SU32_SUS256_SVW2_TT2_32_VW2_WGM8
    SolutionIndex: 120
    SolutionNameMin: Cijk_Alik_Bljk_I8II_BH_MT64x64x32_MI16x16x16x1_SN_1LDSB1_AMAS0_GRVW16_IU2_SIA2_SU32_SUS256_SVW1_TT2_32_VW1_WGM8
    SolutionIndex: 121
    SolutionNameMin: Cijk_Alik_Bljk_I8II_BH_MT64x64x32_MI16x16x16x1_SN_1LDSB1_AMAS3_GRVW16_IU2_SIA2_SU32_SUS256_SVW2_TT2_32_VW2_WGM8
    SolutionIndex: 122
    SolutionNameMin: Cijk_Alik_Bljk_I8II_BH_MT128x128x32_MI16x16x16x1_SN_1LDSB0_AMAS0_GRVW4_IU1_SIA1_SU0_SUS0_SVW1_TT4_64_VW1_WGM4
    SolutionIndex: 123
    SolutionNameMin: Cijk_Alik_Bljk_I8II_BH_MT128x128x32_MI16x16x16x1_SN_1LDSB0_AMAS3_GRVW4_IU1_SIA1_SU0_SUS0_SVW2_TT4_64_VW2_WGM4
    SolutionIndex: 124
    SolutionNameMin: Cijk_Alik_Bljk_I8II_BH_MT128x128x32_MI16x16x16x1_SN_1LDSB0_AMAS3_GRVW4_IU1_SIA1_SU0_SUS0_SVW4_TT4_64_VW4_WGM4
    SolutionIndex: 125
    SolutionNameMin: Cijk_Alik_Bljk_I8II_BH_MT128x128x32_MI16x16x16x1_SN_1LDSB0_AMAS0_GRVW8_IU1_SIA1_SU0_SUS0_SVW1_TT4_64_VW1_WGM4
    SolutionIndex: 126
    SolutionNameMin: Cijk_Alik_Bljk_I8II_BH_MT128x128x32_MI16x16x16x1_SN_1LDSB0_AMAS3_GRVW8_IU1_SIA1_SU0_SUS0_SVW2_TT4_64_VW2_WGM4
    SolutionIndex: 127
    SolutionNameMin: Cijk_Alik_Bljk_I8II_BH_MT128x128x32_MI16x16x16x1_SN_1LDSB0_AMAS3_GRVW8_IU1_SIA1_SU0_SUS0_SVW4_TT4_64_VW4_WGM4
    SolutionIndex: 128
    SolutionNameMin: Cijk_Alik_Bljk_I8II_BH_MT128x128x32_MI16x16x16x1_SN_1LDSB0_AMAS0_GRVW16_IU1_SIA1_SU0_SUS0_SVW1_TT4_64_VW1_WGM4
    SolutionIndex: 129
    SolutionNameMin: Cijk_Alik_Bljk_I8II_BH_MT128x128x32_MI16x16x16x1_SN_1LDSB0_AMAS3_GRVW16_IU1_SIA1_SU0_SUS0_SVW2_TT4_64_VW2_WGM4
    SolutionIndex: 130
    SolutionNameMin: Cijk_Alik_Bljk_I8II_BH_MT128x128x32_MI16x16x16x1_SN_1LDSB0_AMAS3_GRVW16_IU1_SIA1_SU0_SUS0_SVW4_TT4_64_VW4_WGM4
    SolutionIndex: 131
    SolutionNameMin: Cijk_Alik_Bljk_I8II_BH_MT128x128x32_MI16x16x16x1_SN_1LDSB1_AMAS3_GRVW16_IU2_SIA2_SU0_SUS0_SVW4_TT4_64_VW4_WGM4
    SolutionIndex: 132
    SolutionNameMin: Cijk_Alik_Bljk_I8II_BH_MT128x128x32_MI16x16x16x1_SN_1LDSB0_AMAS3_GRVW4_IU1_SIA3_SU0_SUS0_SVW4_TT4_64_VW4_WGM4
    SolutionIndex: 133
    SolutionNameMin: Cijk_Alik_Bljk_I8II_BH_MT128x128x32_MI16x16x16x1_SN_1LDSB0_AMAS3_GRVW8_IU1_SIA3_SU0_SUS0_SVW2_TT4_64_VW2_WGM4
    SolutionIndex: 134
    SolutionNameMin: Cijk_Alik_Bljk_I8II_BH_MT128x128x32_MI16x16x16x1_SN_1LDSB0_AMAS3_GRVW8_IU1_SIA3_SU0_SUS0_SVW4_TT4_64_VW4_WGM4
    SolutionIndex: 135
    SolutionNameMin: Cijk_Alik_Bljk_I8II_BH_MT128x128x32_MI16x16x16x1_SN_1LDSB0_AMAS0_GRVW16_IU1_SIA3_SU0_SUS0_SVW1_TT4_64_VW1_WGM4
    SolutionIndex: 136
    SolutionNameMin: Cijk_Alik_Bljk_I8II_BH_MT128x128x32_MI16x16x16x1_SN_1LDSB0_AMAS3_GRVW16_IU1_SIA3_SU0_SUS0_SVW2_TT4_64_VW2_WGM4
    SolutionIndex: 137
    SolutionNameMin: Cijk_Alik_Bljk_I8II_BH_MT128x128x32_MI16x16x16x1_SN_1LDSB0_AMAS3_GRVW16_IU1_SIA3_SU0_SUS0_SVW4_TT4_64_VW4_WGM4
    SolutionIndex: 138
    SolutionNameMin: Cijk_Alik_Bljk_I8II_BH_MT128x128x32_MI16x16x16x1_SN_1LDSB0_AMAS3_GRVW8_IU1_SIA1_SU32_SUS128_SVW2_TT4_64_VW2_WGM4
    SolutionIndex: 139
    SolutionNameMin: Cijk_Alik_Bljk_I8II_BH_MT128x128x32_MI16x16x16x1_SN_1LDSB0_AMAS3_GRVW8_IU1_SIA1_SU32_SUS128_SVW4_TT4_64_VW4_WGM4
    SolutionIndex: 140
    SolutionNameMin: Cijk_Alik_Bljk_I8II_BH_MT128x128x32_MI16x16x16x1_SN_1LDSB0_AMAS0_GRVW16_IU1_SIA1_SU32_SUS128_SVW1_TT4_64_VW1_WGM4
    SolutionIndex: 141
    SolutionNameMin: Cijk_Alik_Bljk_I8II_BH_MT128x128x32_MI16x16x16x1_SN_1LDSB0_AMAS3_GRVW16_IU1_SIA1_SU32_SUS128_SVW2_TT4_64_VW2_WGM4
    SolutionIndex: 142
    SolutionNameMin: Cijk_Alik_Bljk_I8II_BH_MT128x128x32_MI16x16x16x1_SN_1LDSB0_AMAS3_GRVW16_IU1_SIA1_SU32_SUS128_SVW4_TT4_64_VW4_WGM4
    SolutionIndex: 143
    SolutionNameMin: Cijk_Alik_Bljk_I8II_BH_MT128x128x32_MI16x16x16x1_SN_1LDSB1_AMAS0_GRVW16_IU2_SIA2_SU32_SUS128_SVW1_TT4_64_VW1_WGM4
    SolutionIndex: 144
    SolutionNameMin: Cijk_Alik_Bljk_I8II_BH_MT128x128x32_MI16x16x16x1_SN_1LDSB0_AMAS0_GRVW16_IU1_SIA3_SU32_SUS128_SVW1_TT4_64_VW1_WGM4
    SolutionIndex: 145
    SolutionNameMin: Cijk_Alik_Bljk_I8II_BH_MT128x128x32_MI16x16x16x1_SN_1LDSB0_AMAS3_GRVW16_IU1_SIA3_SU32_SUS128_SVW4_TT4_64_VW4_WGM4
    SolutionIndex: 146
    SolutionNameMin: Cijk_Alik_Bljk_I8II_BH_MT128x128x32_MI16x16x16x1_SN_1LDSB0_AMAS3_GRVW8_IU1_SIA1_SU32_SUS256_SVW2_TT4_64_VW2_WGM4
    SolutionIndex: 147
    SolutionNameMin: Cijk_Alik_Bljk_I8II_BH_MT128x128x32_MI16x16x16x1_SN_1LDSB0_AMAS3_GRVW8_IU1_SIA1_SU32_SUS256_SVW4_TT4_64_VW4_WGM4
    SolutionIndex: 148
    SolutionNameMin: Cijk_Alik_Bljk_I8II_BH_MT128x128x32_MI16x16x16x1_SN_1LDSB0_AMAS0_GRVW16_IU1_SIA1_SU32_SUS256_SVW1_TT4_64_VW1_WGM4
    SolutionIndex: 149
    SolutionNameMin: Cijk_Alik_Bljk_I8II_BH_MT128x128x32_MI16x16x16x1_SN_1LDSB0_AMAS3_GRVW16_IU1_SIA1_SU32_SUS256_SVW2_TT4_64_VW2_WGM4
    SolutionIndex: 150
    SolutionNameMin: Cijk_Alik_Bljk_I8II_BH_MT128x128x32_MI16x16x16x1_SN_1LDSB0_AMAS3_GRVW16_IU1_SIA1_SU32_SUS256_SVW4_TT4_64_VW4_WGM4
    SolutionIndex: 151
    SolutionNameMin: Cijk_Alik_Bljk_I8II_BH_MT128x128x32_MI16x16x16x1_SN_1LDSB1_AMAS3_GRVW8_IU2_SIA2_SU32_SUS256_SVW4_TT4_64_VW4_WGM4
    SolutionIndex: 152
    SolutionNameMin: Cijk_Alik_Bljk_I8II_BH_MT128x128x32_MI16x16x16x1_SN_1LDSB0_AMAS0_GRVW4_IU1_SIA3_SU32_SUS256_SVW1_TT4_64_VW1_WGM4
    SolutionIndex: 153
    SolutionNameMin: Cijk_Alik_Bljk_I8II_BH_MT128x128x32_MI16x16x16x1_SN_1LDSB0_AMAS3_GRVW4_IU1_SIA3_SU32_SUS256_SVW2_TT4_64_VW2_WGM4
    SolutionIndex: 154
    SolutionNameMin: Cijk_Alik_Bljk_I8II_BH_MT128x128x32_MI16x16x16x1_SN_1LDSB0_AMAS3_GRVW16_IU1_SIA3_SU32_SUS256_SVW2_TT4_64_VW2_WGM4
    SolutionIndex: 155
    SolutionNameMin: Cijk_Alik_Bljk_I8II_BH_MT128x128x32_MI16x16x16x1_SN_1LDSB0_AMAS0_GRVW4_IU1_SIA1_SU0_SUS0_SVW1_TT4_64_VW1_WGM8
    SolutionIndex: 156
    SolutionNameMin: Cijk_Alik_Bljk_I8II_BH_MT128x128x32_MI16x16x16x1_SN_1LDSB0_AMAS3_GRVW4_IU1_SIA1_SU0_SUS0_SVW4_TT4_64_VW4_WGM8
    SolutionIndex: 157
    SolutionNameMin: Cijk_Alik_Bljk_I8II_BH_MT128x128x32_MI16x16x16x1_SN_1LDSB0_AMAS3_GRVW8_IU1_SIA1_SU0_SUS0_SVW2_TT4_64_VW2_WGM8
    SolutionIndex: 158
    SolutionNameMin: Cijk_Alik_Bljk_I8II_BH_MT128x128x32_MI16x16x16x1_SN_1LDSB0_AMAS3_GRVW8_IU1_SIA1_SU0_SUS0_SVW4_TT4_64_VW4_WGM8
    SolutionIndex: 159
    SolutionNameMin: Cijk_Alik_Bljk_I8II_BH_MT128x128x32_MI16x16x16x1_SN_1LDSB0_AMAS0_GRVW16_IU1_SIA1_SU0_SUS0_SVW1_TT4_64_VW1_WGM8
    SolutionIndex: 160
    SolutionNameMin: Cijk_Alik_Bljk_I8II_BH_MT128x128x32_MI16x16x16x1_SN_1LDSB0_AMAS3_GRVW16_IU1_SIA1_SU0_SUS0_SVW2_TT4_64_VW2_WGM8
    SolutionIndex: 161
    SolutionNameMin: Cijk_Alik_Bljk_I8II_BH_MT128x128x32_MI16x16x16x1_SN_1LDSB0_AMAS3_GRVW16_IU1_SIA1_SU0_SUS0_SVW4_TT4_64_VW4_WGM8
    SolutionIndex: 162
    SolutionNameMin: Cijk_Alik_Bljk_I8II_BH_MT128x128x32_MI16x16x16x1_SN_1LDSB1_AMAS3_GRVW16_IU2_SIA2_SU0_SUS0_SVW4_TT4_64_VW4_WGM8
    SolutionIndex: 163
    SolutionNameMin: Cijk_Alik_Bljk_I8II_BH_MT128x128x32_MI16x16x16x1_SN_1LDSB0_AMAS3_GRVW4_IU1_SIA3_SU0_SUS0_SVW4_TT4_64_VW4_WGM8
    SolutionIndex: 164
    SolutionNameMin: Cijk_Alik_Bljk_I8II_BH_MT128x128x32_MI16x16x16x1_SN_1LDSB0_AMAS0_GRVW8_IU1_SIA3_SU0_SUS0_SVW1_TT4_64_VW1_WGM8
    SolutionIndex: 165
    SolutionNameMin: Cijk_Alik_Bljk_I8II_BH_MT128x128x32_MI16x16x16x1_SN_1LDSB0_AMAS0_GRVW16_IU1_SIA3_SU0_SUS0_SVW1_TT4_64_VW1_WGM8
    SolutionIndex: 166
    SolutionNameMin: Cijk_Alik_Bljk_I8II_BH_MT128x128x32_MI16x16x16x1_SN_1LDSB0_AMAS3_GRVW16_IU1_SIA3_SU0_SUS0_SVW2_TT4_64_VW2_WGM8
    SolutionIndex: 167
    SolutionNameMin: Cijk_Alik_Bljk_I8II_BH_MT128x128x32_MI16x16x16x1_SN_1LDSB0_AMAS3_GRVW16_IU1_SIA3_SU0_SUS0_SVW4_TT4_64_VW4_WGM8
    SolutionIndex: 168
    SolutionNameMin: Cijk_Alik_Bljk_I8II_BH_MT128x128x32_MI16x16x16x1_SN_1LDSB0_AMAS0_GRVW4_IU1_SIA1_SU32_SUS128_SVW1_TT4_64_VW1_WGM8
    SolutionIndex: 169
    SolutionNameMin: Cijk_Alik_Bljk_I8II_BH_MT128x128x32_MI16x16x16x1_SN_1LDSB0_AMAS3_GRVW4_IU1_SIA1_SU32_SUS128_SVW2_TT4_64_VW2_WGM8
    SolutionIndex: 170
    SolutionNameMin: Cijk_Alik_Bljk_I8II_BH_MT128x128x32_MI16x16x16x1_SN_1LDSB0_AMAS3_GRVW4_IU1_SIA1_SU32_SUS128_SVW4_TT4_64_VW4_WGM8
    SolutionIndex: 171
    SolutionNameMin: Cijk_Alik_Bljk_I8II_BH_MT128x128x32_MI16x16x16x1_SN_1LDSB0_AMAS3_GRVW8_IU1_SIA1_SU32_SUS128_SVW2_TT4_64_VW2_WGM8
    SolutionIndex: 172
    SolutionNameMin: Cijk_Alik_Bljk_I8II_BH_MT128x128x32_MI16x16x16x1_SN_1LDSB0_AMAS3_GRVW8_IU1_SIA1_SU32_SUS128_SVW4_TT4_64_VW4_WGM8
    SolutionIndex: 173
    SolutionNameMin: Cijk_Alik_Bljk_I8II_BH_MT128x128x32_MI16x16x16x1_SN_1LDSB0_AMAS0_GRVW16_IU1_SIA1_SU32_SUS128_SVW1_TT4_64_VW1_WGM8
    SolutionIndex: 174
    SolutionNameMin: Cijk_Alik_Bljk_I8II_BH_MT128x128x32_MI16x16x16x1_SN_1LDSB0_AMAS3_GRVW16_IU1_SIA1_SU32_SUS128_SVW2_TT4_64_VW2_WGM8
    SolutionIndex: 175
    SolutionNameMin: Cijk_Alik_Bljk_I8II_BH_MT128x128x32_MI16x16x16x1_SN_1LDSB0_AMAS3_GRVW16_IU1_SIA1_SU32_SUS128_SVW4_TT4_64_VW4_WGM8
    SolutionIndex: 176
    SolutionNameMin: Cijk_Alik_Bljk_I8II_BH_MT128x128x32_MI16x16x16x1_SN_1LDSB0_AMAS0_GRVW4_IU1_SIA3_SU32_SUS128_SVW1_TT4_64_VW1_WGM8
    SolutionIndex: 177
    SolutionNameMin: Cijk_Alik_Bljk_I8II_BH_MT128x128x32_MI16x16x16x1_SN_1LDSB0_AMAS0_GRVW16_IU1_SIA3_SU32_SUS128_SVW1_TT4_64_VW1_WGM8
    SolutionIndex: 178
    SolutionNameMin: Cijk_Alik_Bljk_I8II_BH_MT128x128x32_MI16x16x16x1_SN_1LDSB0_AMAS3_GRVW4_IU1_SIA1_SU32_SUS256_SVW2_TT4_64_VW2_WGM8
    SolutionIndex: 179
    SolutionNameMin: Cijk_Alik_Bljk_I8II_BH_MT128x128x32_MI16x16x16x1_SN_1LDSB0_AMAS3_GRVW8_IU1_SIA1_SU32_SUS256_SVW2_TT4_64_VW2_WGM8
    SolutionIndex: 180
    SolutionNameMin: Cijk_Alik_Bljk_I8II_BH_MT128x128x32_MI16x16x16x1_SN_1LDSB0_AMAS0_GRVW16_IU1_SIA1_SU32_SUS256_SVW1_TT4_64_VW1_WGM8
    SolutionIndex: 181
    SolutionNameMin: Cijk_Alik_Bljk_I8II_BH_MT128x128x32_MI16x16x16x1_SN_1LDSB0_AMAS3_GRVW16_IU1_SIA1_SU32_SUS256_SVW2_TT4_64_VW2_WGM8
    SolutionIndex: 182
    SolutionNameMin: Cijk_Alik_Bljk_I8II_BH_MT128x128x32_MI16x16x16x1_SN_1LDSB0_AMAS3_GRVW16_IU1_SIA1_SU32_SUS256_SVW4_TT4_64_VW4_WGM8
    SolutionIndex: 183
    SolutionNameMin: Cijk_Alik_Bljk_I8II_BH_MT128x128x32_MI16x16x16x1_SN_1LDSB0_AMAS0_GRVW4_IU1_SIA3_SU32_SUS256_SVW1_TT4_64_VW1_WGM8
    SolutionIndex: 184
    SolutionNameMin: Cijk_Alik_Bljk_I8II_BH_MT128x128x32_MI16x16x16x1_SN_1LDSB0_AMAS3_GRVW4_IU1_SIA3_SU32_SUS256_SVW2_TT4_64_VW2_WGM8
- - - [64, 64, 1, 64, 96, 96, 96, 96]
    - [0, 0.043]
  - - [64, 64, 1, 128, 96, 96, 160, 160]
    - [23, 0.087]
  - - [64, 64, 1, 256, 96, 96, 288, 288]
    - [31, 0.161]
  - - [64, 64, 1, 512, 96, 96, 544, 544]
    - [22, 0.283]
  - - [64, 64, 1, 1024, 96, 96, 1056, 1056]
    - [42, 0.458]
  - - [64, 64, 1, 2048, 96, 96, 2080, 2080]
    - [24, 0.66]
  - - [64, 64, 1, 4096, 96, 96, 4128, 4128]
    - [57, 0.846]
  - - [64, 64, 1, 8192, 96, 96, 8224, 8224]
    - [22, 0.969]
  - - [64, 128, 1, 64, 96, 96, 96, 96]
    - [46, 0.09]
  - - [64, 128, 1, 128, 96, 96, 160, 160]
    - [44, 0.175]
  - - [64, 128, 1, 256, 96, 96, 288, 288]
    - [42, 0.328]
  - - [64, 128, 1, 512, 96, 96, 544, 544]
    - [48, 0.576]
  - - [64, 128, 1, 1024, 96, 96, 1056, 1056]
    - [30, 0.926]
  - - [64, 128, 1, 2048, 96, 96, 2080, 2080]
    - [57, 1.337]
  - - [64, 128, 1, 4096, 96, 96, 4128, 4128]
    - [36, 1.707]
  - - [64, 128, 1, 8192, 96, 96, 8224, 8224]
    - [57, 1.954]
  - - [64, 256, 1, 64, 96, 96, 96, 96]
    - [51, 0.181]
  - - [64, 256, 1, 128, 96, 96, 160, 160]
    - [45, 0.353]
  - - [64, 256, 1, 256, 96, 96, 288, 288]
    - [49, 0.656]
  - - [64, 256, 1, 512, 96, 96, 544, 544]
    - [56, 1.146]
  - - [64, 256, 1, 1024, 96, 96, 1056, 1056]
    - [2, 1.613]
  - - [64, 256, 1, 2048, 96, 96, 2080, 2080]
    - [37, 2.683]
  - - [64, 256, 1, 4096, 96, 96, 4128, 4128]
    - [36, 3.401]
  - - [64, 256, 1, 8192, 96, 96, 8224, 8224]
    - [30, 3.9]
  - - [64, 512, 1, 64, 96, 96, 96, 96]
    - [34, 0.362]
  - - [64, 512, 1, 128, 96, 96, 160, 160]
    - [26, 0.708]
  - - [64, 512, 1, 256, 96, 96, 288, 288]
    - [30, 1.313]
  - - [64, 512, 1, 512, 96, 96, 544, 544]
    - [49, 2.321]
  - - [64, 512, 1, 1024, 96, 96, 1056, 1056]
    - [37, 3.739]
  - - [64, 512, 1, 2048, 96, 96, 2080, 2080]
    - [36, 5.373]
  - - [64, 512, 1, 4096, 96, 96, 4128, 4128]
    - [56, 6.821]
  - - [64, 512, 1, 8192, 96, 96, 8224, 8224]
    - [47, 7.869]
  - - [64, 1024, 1, 64, 96, 96, 96, 96]
    - [41, 0.725]
  - - [64, 1024, 1, 128, 96, 96, 160, 160]
    - [40, 1.401]
  - - [64, 1024, 1, 256, 96, 96, 288, 288]
    - [23, 2.613]
  - - [64, 1024, 1, 512, 96, 96, 544, 544]
    - [31, 4.624]
  - - [64, 1024, 1, 1024, 96, 96, 1056, 1056]
    - [37, 7.438]
  - - [64, 1024, 1, 2048, 96, 96, 2080, 2080]
    - [55, 10.704]
  - - [64, 1024, 1, 4096, 96, 96, 4128, 4128]
    - [57, 13.557]
  - - [64, 1024, 1, 8192, 96, 96, 8224, 8224]
    - [57, 15.216]
  - - [64, 2048, 1, 64, 96, 96, 96, 96]
    - [41, 1.419]
  - - [64, 2048, 1, 128, 96, 96, 160, 160]
    - [22, 2.75]
  - - [64, 2048, 1, 256, 96, 96, 288, 288]
    - [43, 5.087]
  - - [64, 2048, 1, 512, 96, 96, 544, 544]
    - [48, 8.976]
  - - [64, 2048, 1, 1024, 96, 96, 1056, 1056]
    - [38, 14.604]
  - - [64, 2048, 1, 2048, 96, 96, 2080, 2080]
    - [37, 21.01]
  - - [64, 2048, 1, 4096, 96, 96, 4128, 4128]
    - [44, 26.359]
  - - [64, 2048, 1, 8192, 96, 96, 8224, 8224]
    - [57, 30.505]
  - - [64, 4096, 1, 64, 96, 96, 96, 96]
    - [25, 2.717]
  - - [64, 4096, 1, 128, 96, 96, 160, 160]
    - [56, 5.167]
  - - [64, 4096, 1, 256, 96, 96, 288, 288]
    - [30, 9.583]
  - - [64, 4096, 1, 512, 96, 96, 544, 544]
    - [23, 16.79]
  - - [64, 4096, 1, 1024, 96, 96, 1056, 1056]
    - [79, 26.012]
  - - [64, 4096, 1, 2048, 96, 96, 2080, 2080]
    - [71, 37.009]
  - - [64, 4096, 1, 4096, 96, 96, 4128, 4128]
    - [71, 46.769]
  - - [64, 4096, 1, 8192, 96, 96, 8224, 8224]
    - [100, 52.972]
  - - [64, 8192, 1, 64, 96, 96, 96, 96]
    - [64, 4.787]
  - - [64, 8192, 1, 128, 96, 96, 160, 160]
    - [71, 8.984]
  - - [64, 8192, 1, 256, 96, 96, 288, 288]
    - [91, 16.302]
  - - [64, 8192, 1, 512, 96, 96, 544, 544]
    - [97, 25.674]
  - - [64, 8192, 1, 1024, 96, 96, 1056, 1056]
    - [117, 37.305]
  - - [64, 8192, 1, 2048, 96, 96, 2080, 2080]
    - [89, 49.474]
  - - [64, 8192, 1, 4096, 96, 96, 4128, 4128]
    - [87, 58.768]
  - - [64, 8192, 1, 8192, 96, 96, 8224, 8224]
    - [89, 65.814]
  - - [128, 64, 1, 64, 160, 160, 96, 96]
    - [19, 0.089]
  - - [128, 64, 1, 128, 160, 160, 160, 160]
    - [46, 0.176]
  - - [128, 64, 1, 256, 160, 160, 288, 288]
    - [31, 0.326]
  - - [128, 64, 1, 512, 160, 160, 544, 544]
    - [1, 0.527]
  - - [128, 64, 1, 1024, 160, 160, 1056, 1056]
    - [30, 0.926]
  - - [128, 64, 1, 2048, 160, 160, 2080, 2080]
    - [30, 1.33]
  - - [128, 64, 1, 4096, 160, 160, 4128, 4128]
    - [48, 1.696]
  - - [128, 64, 1, 8192, 160, 160, 8224, 8224]
    - [36, 1.955]
  - - [128, 128, 1, 64, 160, 160, 96, 96]
    - [22, 0.18]
  - - [128, 128, 1, 128, 160, 160, 160, 160]
    - [53, 0.351]
  - - [128, 128, 1, 256, 160, 160, 288, 288]
    - [30, 0.651]
  - - [128, 128, 1, 512, 160, 160, 544, 544]
    - [48, 1.149]
  - - [128, 128, 1, 1024, 160, 160, 1056, 1056]
    - [31, 1.86]
  - - [128, 128, 1, 2048, 160, 160, 2080, 2080]
    - [48, 2.686]
  - - [128, 128, 1, 4096, 160, 160, 4128, 4128]
    - [56, 3.439]
  - - [128, 128, 1, 8192, 160, 160, 8224, 8224]
    - [29, 3.963]
  - - [128, 256, 1, 64, 160, 160, 96, 96]
    - [60, 0.363]
  - - [128, 256, 1, 128, 160, 160, 160, 160]
    - [26, 0.706]
  - - [128, 256, 1, 256, 160, 160, 288, 288]
    - [30, 1.315]
  - - [128, 256, 1, 512, 160, 160, 544, 544]
    - [49, 2.307]
  - - [128, 256, 1, 1024, 160, 160, 1056, 1056]
    - [30, 3.734]
  - - [128, 256, 1, 2048, 160, 160, 2080, 2080]
    - [49, 5.362]
  - - [128, 256, 1, 4096, 160, 160, 4128, 4128]
    - [37, 6.858]
  - - [128, 256, 1, 8192, 160, 160, 8224, 8224]
    - [36, 7.914]
  - - [128, 512, 1, 64, 160, 160, 96, 96]
    - [52, 0.724]
  - - [128, 512, 1, 128, 160, 160, 160, 160]
    - [58, 1.403]
  - - [128, 512, 1, 256, 160, 160, 288, 288]
    - [42, 2.598]
  - - [128, 512, 1, 512, 160, 160, 544, 544]
    - [30, 4.584]
  - - [128, 512, 1, 1024, 160, 160, 1056, 1056]
    - [37, 7.418]
  - - [128, 512, 1, 2048, 160, 160, 2080, 2080]
    - [30, 10.68]
  - - [128, 512, 1, 4096, 160, 160, 4128, 4128]
    - [38, 13.623]
  - - [128, 512, 1, 8192, 160, 160, 8224, 8224]
    - [36, 15.851]
  - - [128, 1024, 1, 64, 160, 160, 96, 96]
    - [22, 1.413]
  - - [128, 1024, 1, 128, 160, 160, 160, 160]
    - [20, 2.74]
  - - [128, 1024, 1, 256, 160, 160, 288, 288]
    - [48, 5.099]
  - - [128, 1024, 1, 512, 160, 160, 544, 544]
    - [29, 9.029]
  - - [128, 1024, 1, 1024, 160, 160, 1056, 1056]
    - [29, 14.648]
  - - [128, 1024, 1, 2048, 160, 160, 2080, 2080]
    - [31, 21.081]
  - - [128, 1024, 1, 4096, 160, 160, 4128, 4128]
    - [36, 27.011]
  - - [128, 1024, 1, 8192, 160, 160, 8224, 8224]
    - [48, 30.487]
  - - [128, 2048, 1, 64, 160, 160, 96, 96]
    - [26, 2.705]
  - - [128, 2048, 1, 128, 160, 160, 160, 160]
    - [19, 5.202]
  - - [128, 2048, 1, 256, 160, 160, 288, 288]
    - [43, 9.706]
  - - [128, 2048, 1, 512, 160, 160, 544, 544]
    - [23, 16.854]
  - - [128, 2048, 1, 1024, 160, 160, 1056, 1056]
    - [98, 26.297]
  - - [128, 2048, 1, 2048, 160, 160, 2080, 2080]
    - [70, 37.272]
  - - [128, 2048, 1, 4096, 160, 160, 4128, 4128]
    - [71, 47.057]
  - - [128, 2048, 1, 8192, 160, 160, 8224, 8224]
    - [71, 53.234]
  - - [128, 4096, 1, 64, 160, 160, 96, 96]
    - [100, 4.87]
  - - [128, 4096, 1, 128, 160, 160, 160, 160]
    - [77, 9.168]
  - - [128, 4096, 1, 256, 160, 160, 288, 288]
    - [119, 16.582]
  - - [128, 4096, 1, 512, 160, 160, 544, 544]
    - [114, 26.142]
  - - [128, 4096, 1, 1024, 160, 160, 1056, 1056]
    - [102, 37.359]
  - - [128, 4096, 1, 2048, 160, 160, 2080, 2080]
    - [77, 49.293]
  - - [128, 4096, 1, 4096, 160, 160, 4128, 4128]
    - [78, 59.132]
  - - [128, 4096, 1, 8192, 160, 160, 8224, 8224]
    - [94, 65.498]
  - - [128, 8192, 1, 64, 160, 160, 96, 96]
    - [84, 8.36]
  - - [128, 8192, 1, 128, 160, 160, 160, 160]
    - [97, 15.374]
  - - [128, 8192, 1, 256, 160, 160, 288, 288]
    - [73, 23.688]
  - - [128, 8192, 1, 512, 160, 160, 544, 544]
    - [74, 34.438]
  - - [128, 8192, 1, 1024, 160, 160, 1056, 1056]
    - [93, 47.844]
  - - [128, 8192, 1, 2048, 160, 160, 2080, 2080]
    - [112, 57.366]
  - - [128, 8192, 1, 4096, 160, 160, 4128, 4128]
    - [111, 57.921]
  - - [128, 8192, 1, 8192, 160, 160, 8224, 8224]
    - [83, 66.762]
  - - [256, 64, 1, 64, 288, 288, 96, 96]
    - [50, 0.181]
  - - [256, 64, 1, 128, 288, 288, 160, 160]
    - [32, 0.351]
  - - [256, 64, 1, 256, 288, 288, 288, 288]
    - [44, 0.655]
  - - [256, 64, 1, 512, 288, 288, 544, 544]
    - [48, 1.149]
  - - [256, 64, 1, 1024, 288, 288, 1056, 1056]
    - [48, 1.845]
  - - [256, 64, 1, 2048, 288, 288, 2080, 2080]
    - [38, 2.66]
  - - [256, 64, 1, 4096, 288, 288, 4128, 4128]
    - [29, 3.388]
  - - [256, 64, 1, 8192, 288, 288, 8224, 8224]
    - [22, 3.882]
  - - [256, 128, 1, 64, 288, 288, 96, 96]
    - [21, 0.36]
  - - [256, 128, 1, 128, 288, 288, 160, 160]
    - [30, 0.705]
  - - [256, 128, 1, 256, 288, 288, 288, 288]
    - [57, 1.311]
  - - [256, 128, 1, 512, 288, 288, 544, 544]
    - [48, 2.31]
  - - [256, 128, 1, 1024, 288, 288, 1056, 1056]
    - [42, 3.697]
  - - [256, 128, 1, 2048, 288, 288, 2080, 2080]
    - [56, 5.336]
  - - [256, 128, 1, 4096, 288, 288, 4128, 4128]
    - [48, 6.8]
  - - [256, 128, 1, 8192, 288, 288, 8224, 8224]
    - [55, 7.794]
  - - [256, 256, 1, 64, 288, 288, 96, 96]
    - [50, 0.721]
  - - [256, 256, 1, 128, 288, 288, 160, 160]
    - [35, 1.394]
  - - [256, 256, 1, 256, 288, 288, 288, 288]
    - [49, 2.605]
  - - [256, 256, 1, 512, 288, 288, 544, 544]
    - [37, 4.55]
  - - [256, 256, 1, 1024, 288, 288, 1056, 1056]
    - [38, 7.394]
  - - [256, 256, 1, 2048, 288, 288, 2080, 2080]
    - [49, 10.613]
  - - [256, 256, 1, 4096, 288, 288, 4128, 4128]
    - [36, 13.609]
  - - [256, 256, 1, 8192, 288, 288, 8224, 8224]
    - [22, 15.721]
  - - [256, 512, 1, 64, 288, 288, 96, 96]
    - [59, 1.416]
  - - [256, 512, 1, 128, 288, 288, 160, 160]
    - [23, 2.749]
  - - [256, 512, 1, 256, 288, 288, 288, 288]
    - [44, 5.132]
  - - [256, 512, 1, 512, 288, 288, 544, 544]
    - [24, 8.984]
  - - [256, 512, 1, 1024, 288, 288, 1056, 1056]
    - [56, 14.62]
  - - [256, 512, 1, 2048, 288, 288, 2080, 2080]
    - [37, 21.01]
  - - [256, 512, 1, 4096, 288, 288, 4128, 4128]
    - [29, 26.979]
  - - [256, 512, 1, 8192, 288, 288, 8224, 8224]
    - [29, 30.752]
  - - [256, 1024, 1, 64, 288, 288, 96, 96]
    - [113, 2.708]
  - - [256, 1024, 1, 128, 288, 288, 160, 160]
    - [42, 5.223]
  - - [256, 1024, 1, 256, 288, 288, 288, 288]
    - [22, 9.657]
  - - [256, 1024, 1, 512, 288, 288, 544, 544]
    - [56, 16.838]
  - - [256, 1024, 1, 1024, 288, 288, 1056, 1056]
    - [98, 26.26]
  - - [256, 1024, 1, 2048, 288, 288, 2080, 2080]
    - [101, 37.4]
  - - [256, 1024, 1, 4096, 288, 288, 4128, 4128]
    - [70, 47.185]
  - - [256, 1024, 1, 8192, 288, 288, 8224, 8224]
    - [70, 52.967]
  - - [256, 2048, 1, 64, 288, 288, 96, 96]
    - [77, 4.843]
  - - [256, 2048, 1, 128, 288, 288, 160, 160]
    - [63, 9.091]
  - - [256, 2048, 1, 256, 288, 288, 288, 288]
    - [91, 16.445]
  - - [256, 2048, 1, 512, 288, 288, 544, 544]
    - [78, 26.488]
  - - [256, 2048, 1, 1024, 288, 288, 1056, 1056]
    - [88, 39.17]
  - - [256, 2048, 1, 2048, 288, 288, 2080, 2080]
    - [89, 49.797]
  - - [256, 2048, 1, 4096, 288, 288, 4128, 4128]
    - [65, 59.644]
  - - [256, 2048, 1, 8192, 288, 288, 8224, 8224]
    - [64, 66.422]
  - - [256, 4096, 1, 64, 288, 288, 96, 96]
    - [72, 8.334]
  - - [256, 4096, 1, 128, 288, 288, 160, 160]
    - [97, 15.285]
  - - [256, 4096, 1, 256, 288, 288, 288, 288]
    - [105, 23.684]
  - - [256, 4096, 1, 512, 288, 288, 544, 544]
    - [74, 34.455]
  - - [256, 4096, 1, 1024, 288, 288, 1056, 1056]
    - [92, 47.462]
  - - [256, 4096, 1, 2048, 288, 288, 2080, 2080]
    - [92, 56.909]
  - - [256, 4096, 1, 4096, 288, 288, 4128, 4128]
    - [104, 57.634]
  - - [256, 4096, 1, 8192, 288, 288, 8224, 8224]
    - [82, 66.961]
  - - [256, 8192, 1, 64, 288, 288, 96, 96]
    - [102, 13.05]
  - - [256, 8192, 1, 128, 288, 288, 160, 160]
    - [12, 24.192]
  - - [256, 8192, 1, 256, 288, 288, 288, 288]
    - [18, 37.123]
  - - [256, 8192, 1, 512, 288, 288, 544, 544]
    - [17, 50.367]
  - - [256, 8192, 1, 1024, 288, 288, 1056, 1056]
    - [136, 60.218]
  - - [256, 8192, 1, 2048, 288, 288, 2080, 2080]
    - [136, 67.14]
  - - [256, 8192, 1, 4096, 288, 288, 4128, 4128]
    - [165, 74.152]
  - - [256, 8192, 1, 8192, 288, 288, 8224, 8224]
    - [14, 75.885]
  - - [384, 64, 1, 64, 416, 416, 96, 96]
    - [56, 0.274]
  - - [384, 64, 1, 128, 416, 416, 160, 160]
    - [23, 0.53]
  - - [384, 64, 1, 256, 416, 416, 288, 288]
    - [23, 0.985]
  - - [384, 64, 1, 512, 416, 416, 544, 544]
    - [56, 1.733]
  - - [384, 64, 1, 1024, 416, 416, 1056, 1056]
    - [38, 2.779]
  - - [384, 64, 1, 2048, 416, 416, 2080, 2080]
    - [30, 3.981]
  - - [384, 64, 1, 4096, 416, 416, 4128, 4128]
    - [47, 5.082]
  - - [384, 64, 1, 8192, 416, 416, 8224, 8224]
    - [56, 5.847]
  - - [384, 128, 1, 64, 416, 416, 96, 96]
    - [33, 0.547]
  - - [384, 128, 1, 128, 416, 416, 160, 160]
    - [59, 1.065]
  - - [384, 128, 1, 256, 416, 416, 288, 288]
    - [43, 1.96]
  - - [384, 128, 1, 512, 416, 416, 544, 544]
    - [48, 3.454]
  - - [384, 128, 1, 1024, 416, 416, 1056, 1056]
    - [38, 5.574]
  - - [384, 128, 1, 2048, 416, 416, 2080, 2080]
    - [31, 7.999]
  - - [384, 128, 1, 4096, 416, 416, 4128, 4128]
    - [48, 10.242]
  - - [384, 128, 1, 8192, 416, 416, 8224, 8224]
    - [47, 11.76]
  - - [384, 256, 1, 64, 416, 416, 96, 96]
    - [45, 1.074]
  - - [384, 256, 1, 128, 416, 416, 160, 160]
    - [57, 2.083]
  - - [384, 256, 1, 256, 416, 416, 288, 288]
    - [31, 3.877]
  - - [384, 256, 1, 512, 416, 416, 544, 544]
    - [29, 6.846]
  - - [384, 256, 1, 1024, 416, 416, 1056, 1056]
    - [57, 11.028]
  - - [384, 256, 1, 2048, 416, 416, 2080, 2080]
    - [38, 15.795]
  - - [384, 256, 1, 4096, 416, 416, 4128, 4128]
    - [31, 20.182]
  - - [384, 256, 1, 8192, 416, 416, 8224, 8224]
    - [57, 23.155]
  - - [384, 512, 1, 64, 416, 416, 96, 96]
    - [25, 2.101]
  - - [384, 512, 1, 128, 416, 416, 160, 160]
    - [23, 4.058]
  - - [384, 512, 1, 256, 416, 416, 288, 288]
    - [162, 5.644]
  - - [384, 512, 1, 512, 416, 416, 544, 544]
    - [48, 13.311]
  - - [384, 512, 1, 1024, 416, 416, 1056, 1056]
    - [23, 21.332]
  - - [384, 512, 1, 2048, 416, 416, 2080, 2080]
    - [24, 30.837]
  - - [384, 512, 1, 4096, 416, 416, 4128, 4128]
    - [23, 39.666]
  - - [384, 512, 1, 8192, 416, 416, 8224, 8224]
    - [22, 45.04]
  - - [384, 1024, 1, 64, 416, 416, 96, 96]
    - [114, 3.954]
  - - [384, 1024, 1, 128, 416, 416, 160, 160]
    - [69, 7.493]
  - - [384, 1024, 1, 256, 416, 416, 288, 288]
    - [71, 13.837]
  - - [384, 1024, 1, 512, 416, 416, 544, 544]
    - [101, 23.964]
  - - [384, 1024, 1, 1024, 416, 416, 1056, 1056]
    - [71, 33.603]
  - - [384, 1024, 1, 2048, 416, 416, 2080, 2080]
    - [71, 46.501]
  - - [384, 1024, 1, 4096, 416, 416, 4128, 4128]
    - [80, 56.56]
  - - [384, 1024, 1, 8192, 416, 416, 8224, 8224]
    - [71, 65.3]
  - - [384, 2048, 1, 64, 416, 416, 96, 96]
    - [63, 6.691]
  - - [384, 2048, 1, 128, 416, 416, 160, 160]
    - [107, 12.493]
  - - [384, 2048, 1, 256, 416, 416, 288, 288]
    - [101, 20.859]
  - - [384, 2048, 1, 512, 416, 416, 544, 544]
    - [110, 32.859]
  - - [384, 2048, 1, 1024, 416, 416, 1056, 1056]
    - [89, 44.361]
  - - [384, 2048, 1, 2048, 416, 416, 2080, 2080]
    - [66, 56.047]
  - - [384, 2048, 1, 4096, 416, 416, 4128, 4128]
    - [106, 64.705]
  - - [384, 2048, 1, 8192, 416, 416, 8224, 8224]
    - [117, 68.914]
  - - [384, 4096, 1, 64, 416, 416, 96, 96]
    - [94, 11.283]
  - - [384, 4096, 1, 128, 416, 416, 160, 160]
    - [75, 19.443]
  - - [384, 4096, 1, 256, 416, 416, 288, 288]
    - [11, 32.722]
  - - [384, 4096, 1, 512, 416, 416, 544, 544]
    - [176, 47.743]
  - - [384, 4096, 1, 1024, 416, 416, 1056, 1056]
    - [183, 61.703]
  - - [384, 4096, 1, 2048, 416, 416, 2080, 2080]
    - [165, 73.666]
  - - [384, 4096, 1, 4096, 416, 416, 4128, 4128]
    - [145, 78.4]
  - - [384, 4096, 1, 8192, 416, 416, 8224, 8224]
    - [166, 85.068]
  - - [384, 8192, 1, 64, 416, 416, 96, 96]
    - [16, 18.095]
  - - [384, 8192, 1, 128, 416, 416, 160, 160]
    - [148, 29.539]
  - - [384, 8192, 1, 256, 416, 416, 288, 288]
    - [69, 42.076]
  - - [384, 8192, 1, 512, 416, 416, 544, 544]
    - [147, 56.506]
  - - [384, 8192, 1, 1024, 416, 416, 1056, 1056]
    - [130, 65.549]
  - - [384, 8192, 1, 2048, 416, 416, 2080, 2080]
    - [143, 72.472]
  - - [384, 8192, 1, 4096, 416, 416, 4128, 4128]
    - [167, 80.931]
  - - [384, 8192, 1, 8192, 416, 416, 8224, 8224]
    - [137, 74.508]
  - - [768, 64, 1, 64, 800, 800, 96, 96]
    - [27, 0.542]
  - - [768, 64, 1, 128, 800, 800, 160, 160]
    - [54, 1.057]
  - - [768, 64, 1, 256, 800, 800, 288, 288]
    - [37, 1.969]
  - - [768, 64, 1, 512, 800, 800, 544, 544]
    - [55, 3.446]
  - - [768, 64, 1, 1024, 800, 800, 1056, 1056]
    - [38, 5.526]
  - - [768, 64, 1, 2048, 800, 800, 2080, 2080]
    - [38, 7.886]
  - - [768, 64, 1, 4096, 800, 800, 4128, 4128]
    - [49, 10.044]
  - - [768, 64, 1, 8192, 800, 800, 8224, 8224]
    - [49, 11.261]
  - - [768, 128, 1, 64, 800, 800, 96, 96]
    - [57, 1.074]
  - - [768, 128, 1, 128, 800, 800, 160, 160]
    - [40, 2.092]
  - - [768, 128, 1, 256, 800, 800, 288, 288]
    - [29, 3.872]
  - - [768, 128, 1, 512, 800, 800, 544, 544]
    - [31, 6.805]
  - - [768, 128, 1, 1024, 800, 800, 1056, 1056]
    - [38, 11.046]
  - - [768, 128, 1, 2048, 800, 800, 2080, 2080]
    - [42, 15.867]
  - - [768, 128, 1, 4096, 800, 800, 4128, 4128]
    - [24, 20.286]
  - - [768, 128, 1, 8192, 800, 800, 8224, 8224]
    - [24, 23.206]
  - - [768, 256, 1, 64, 800, 800, 96, 96]
    - [24, 2.095]
  - - [768, 256, 1, 128, 800, 800, 160, 160]
    - [19, 3.969]
  - - [768, 256, 1, 256, 800, 800, 288, 288]
    - [29, 7.532]
  - - [768, 256, 1, 512, 800, 800, 544, 544]
    - [36, 13.289]
  - - [768, 256, 1, 1024, 800, 800, 1056, 1056]
    - [24, 21.481]
  - - [768, 256, 1, 2048, 800, 800, 2080, 2080]
    - [23, 30.992]
  - - [768, 256, 1, 4096, 800, 800, 4128, 4128]
    - [23, 39.738]
  - - [768, 256, 1, 8192, 800, 800, 8224, 8224]
    - [24, 45.32]
  - - [768, 512, 1, 64, 800, 800, 96, 96]
    - [115, 3.924]
  - - [768, 512, 1, 128, 800, 800, 160, 160]
    - [67, 7.459]
  - - [768, 512, 1, 256, 800, 800, 288, 288]
    - [121, 13.75]
  - - [768, 512, 1, 512, 800, 800, 544, 544]
    - [101, 23.654]
  - - [768, 512, 1, 1024, 800, 800, 1056, 1056]
    - [71, 33.558]
  - - [768, 512, 1, 2048, 800, 800, 2080, 2080]
    - [70, 46.415]
  - - [768, 512, 1, 4096, 800, 800, 4128, 4128]
    - [108, 56.113]
  - - [768, 512, 1, 8192, 800, 800, 8224, 8224]
    - [70, 65.429]
  - - [768, 1024, 1, 64, 800, 800, 96, 96]
    - [85, 6.651]
  - - [768, 1024, 1, 128, 800, 800, 160, 160]
    - [63, 12.458]
  - - [768, 1024, 1, 256, 800, 800, 288, 288]
    - [117, 20.946]
  - - [768, 1024, 1, 512, 800, 800, 544, 544]
    - [81, 32.411]
  - - [768, 1024, 1, 1024, 800, 800, 1056, 1056]
    - [82, 44.271]
  - - [768, 1024, 1, 2048, 800, 800, 2080, 2080]
    - [65, 56.326]
  - - [768, 1024, 1, 4096, 800, 800, 4128, 4128]
    - [97, 64.67]
  - - [768, 1024, 1, 8192, 800, 800, 8224, 8224]
    - [105, 68.747]
  - - [768, 2048, 1, 64, 800, 800, 96, 96]
    - [62, 11.325]
  - - [768, 2048, 1, 128, 800, 800, 160, 160]
    - [89, 19.619]
  - - [768, 2048, 1, 256, 800, 800, 288, 288]
    - [152, 32.536]
  - - [768, 2048, 1, 512, 800, 800, 544, 544]
    - [184, 47.455]
  - - [768, 2048, 1, 1024, 800, 800, 1056, 1056]
    - [183, 60.81]
  - - [768, 2048, 1, 2048, 800, 800, 2080, 2080]
    - [177, 73.535]
  - - [768, 2048, 1, 4096, 800, 800, 4128, 4128]
    - [144, 78.141]
  - - [768, 2048, 1, 8192, 800, 800, 8224, 8224]
    - [154, 84.757]
  - - [768, 4096, 1, 64, 800, 800, 96, 96]
    - [13, 18.704]
  - - [768, 4096, 1, 128, 800, 800, 160, 160]
    - [129, 29.241]
  - - [768, 4096, 1, 256, 800, 800, 288, 288]
    - [90, 41.961]
  - - [768, 4096, 1, 512, 800, 800, 544, 544]
    - [174, 55.917]
  - - [768, 4096, 1, 1024, 800, 800, 1056, 1056]
    - [136, 69.178]
  - - [768, 4096, 1, 2048, 800, 800, 2080, 2080]
    - [136, 77.661]
  - - [768, 4096, 1, 4096, 800, 800, 4128, 4128]
    - [135, 85.334]
  - - [768, 4096, 1, 8192, 800, 800, 8224, 8224]
    - [166, 80.834]
  - - [768, 8192, 1, 64, 800, 800, 96, 96]
    - [148, 25.417]
  - - [768, 8192, 1, 128, 800, 800, 160, 160]
    - [130, 39.879]
  - - [768, 8192, 1, 256, 800, 800, 288, 288]
    - [130, 52.795]
  - - [768, 8192, 1, 512, 800, 800, 544, 544]
    - [182, 63.09]
  - - [768, 8192, 1, 1024, 800, 800, 1056, 1056]
    - [130, 67.444]
  - - [768, 8192, 1, 2048, 800, 800, 2080, 2080]
    - [161, 73.277]
  - - [768, 8192, 1, 4096, 800, 800, 4128, 4128]
    - [9, 69.326]
  - - [768, 8192, 1, 8192, 800, 800, 8224, 8224]
    - [122, 66.364]
  - - [1536, 64, 1, 64, 1568, 1568, 96, 96]
    - [3, 1.066]
  - - [1536, 64, 1, 128, 1568, 1568, 160, 160]
    - [42, 2.087]
  - - [1536, 64, 1, 256, 1568, 1568, 288, 288]
    - [55, 3.863]
  - - [1536, 64, 1, 512, 1568, 1568, 544, 544]
    - [44, 6.852]
  - - [1536, 64, 1, 1024, 1568, 1568, 1056, 1056]
    - [49, 11.007]
  - - [1536, 64, 1, 2048, 1568, 1568, 2080, 2080]
    - [37, 15.728]
  - - [1536, 64, 1, 4096, 1568, 1568, 4128, 4128]
    - [42, 19.864]
  - - [1536, 64, 1, 8192, 1568, 1568, 8224, 8224]
    - [24, 22.906]
  - - [1536, 128, 1, 64, 1568, 1568, 96, 96]
    - [157, 1.8]
  - - [1536, 128, 1, 128, 1568, 1568, 160, 160]
    - [28, 4.032]
  - - [1536, 128, 1, 256, 1568, 1568, 288, 288]
    - [37, 7.493]
  - - [1536, 128, 1, 512, 1568, 1568, 544, 544]
    - [24, 13.244]
  - - [1536, 128, 1, 1024, 1568, 1568, 1056, 1056]
    - [56, 20.97]
  - - [1536, 128, 1, 2048, 1568, 1568, 2080, 2080]
    - [56, 29.306]
  - - [1536, 128, 1, 4096, 1568, 1568, 4128, 4128]
    - [44, 37.929]
  - - [1536, 128, 1, 8192, 1568, 1568, 8224, 8224]
    - [23, 44.807]
  - - [1536, 256, 1, 64, 1568, 1568, 96, 96]
    - [114, 3.928]
  - - [1536, 256, 1, 128, 1568, 1568, 160, 160]
    - [114, 7.456]
  - - [1536, 256, 1, 256, 1568, 1568, 288, 288]
    - [120, 13.828]
  - - [1536, 256, 1, 512, 1568, 1568, 544, 544]
    - [98, 23.552]
  - - [1536, 256, 1, 1024, 1568, 1568, 1056, 1056]
    - [70, 33.438]
  - - [1536, 256, 1, 2048, 1568, 1568, 2080, 2080]
    - [69, 46.063]
  - - [1536, 256, 1, 4096, 1568, 1568, 4128, 4128]
    - [68, 56.738]
  - - [1536, 256, 1, 8192, 1568, 1568, 8224, 8224]
    - [100, 65.11]
  - - [1536, 512, 1, 64, 1568, 1568, 96, 96]
    - [87, 6.647]
  - - [1536, 512, 1, 128, 1568, 1568, 160, 160]
    - [117, 12.363]
  - - [1536, 512, 1, 256, 1568, 1568, 288, 288]
    - [86, 20.886]
  - - [1536, 512, 1, 512, 1568, 1568, 544, 544]
    - [82, 32.906]
  - - [1536, 512, 1, 1024, 1568, 1568, 1056, 1056]
    - [63, 44.486]
  - - [1536, 512, 1, 2048, 1568, 1568, 2080, 2080]
    - [66, 57.325]
  - - [1536, 512, 1, 4096, 1568, 1568, 4128, 4128]
    - [5, 65.947]
  - - [1536, 512, 1, 8192, 1568, 1568, 8224, 8224]
    - [65, 69.782]
  - - [1536, 1024, 1, 64, 1568, 1568, 96, 96]
    - [89, 11.245]
  - - [1536, 1024, 1, 128, 1568, 1568, 160, 160]
    - [78, 19.794]
  - - [1536, 1024, 1, 256, 1568, 1568, 288, 288]
    - [180, 31.226]
  - - [1536, 1024, 1, 512, 1568, 1568, 544, 544]
    - [184, 47.202]
  - - [1536, 1024, 1, 1024, 1568, 1568, 1056, 1056]
    - [10, 59.982]
  - - [1536, 1024, 1, 2048, 1568, 1568, 2080, 2080]
    - [136, 73.345]
  - - [1536, 1024, 1, 4096, 1568, 1568, 4128, 4128]
    - [165, 77.872]
  - - [1536, 1024, 1, 8192, 1568, 1568, 8224, 8224]
    - [135, 85.166]
  - - [1536, 2048, 1, 64, 1568, 1568, 96, 96]
    - [95, 18.121]
  - - [1536, 2048, 1, 128, 1568, 1568, 160, 160]
    - [149, 29.703]
  - - [1536, 2048, 1, 256, 1568, 1568, 288, 288]
    - [151, 42.812]
  - - [1536, 2048, 1, 512, 1568, 1568, 544, 544]
    - [131, 57.004]
  - - [1536, 2048, 1, 1024, 1568, 1568, 1056, 1056]
    - [133, 69.718]
  - - [1536, 2048, 1, 2048, 1568, 1568, 2080, 2080]
    - [136, 78.101]
  - - [1536, 2048, 1, 4096, 1568, 1568, 4128, 4128]
    - [137, 85.555]
  - - [1536, 2048, 1, 8192, 1568, 1568, 8224, 8224]
    - [132, 75.339]
  - - [1536, 4096, 1, 64, 1568, 1568, 96, 96]
    - [125, 25.221]
  - - [1536, 4096, 1, 128, 1568, 1568, 160, 160]
    - [130, 39.573]
  - - [1536, 4096, 1, 256, 1568, 1568, 288, 288]
    - [150, 52.324]
  - - [1536, 4096, 1, 512, 1568, 1568, 544, 544]
    - [127, 62.418]
  - - [1536, 4096, 1, 1024, 1568, 1568, 1056, 1056]
    - [130, 68.416]
  - - [1536, 4096, 1, 2048, 1568, 1568, 2080, 2080]
    - [182, 74.412]
  - - [1536, 4096, 1, 4096, 1568, 1568, 4128, 4128]
    - [124, 69.526]
  - - [1536, 4096, 1, 8192, 1568, 1568, 8224, 8224]
    - [172, 71.72]
  - - [1536, 8192, 1, 64, 1568, 1568, 96, 96]
    - [8, 33.603]
  - - [1536, 8192, 1, 128, 1568, 1568, 160, 160]
    - [141, 48.877]
  - - [1536, 8192, 1, 256, 1568, 1568, 288, 288]
    - [129, 60.471]
  - - [1536, 8192, 1, 512, 1568, 1568, 544, 544]
    - [122, 66.105]
  - - [1536, 8192, 1, 1024, 1568, 1568, 1056, 1056]
    - [175, 72.868]
  - - [1536, 8192, 1, 2048, 1568, 1568, 2080, 2080]
    - [127, 70.228]
  - - [1536, 8192, 1, 4096, 1568, 1568, 4128, 4128]
    - [179, 70.135]
  - - [1536, 8192, 1, 8192, 1568, 1568, 8224, 8224]
    - [130, 67.674]
  - - [3072, 64, 1, 64, 3104, 3104, 96, 96]
    - [45, 2.018]
  - - [3072, 64, 1, 128, 3104, 3104, 160, 160]
    - [31, 4.046]
  - - [3072, 64, 1, 256, 3104, 3104, 288, 288]
    - [24, 7.498]
  - - [3072, 64, 1, 512, 3104, 3104, 544, 544]
    - [44, 13.23]
  - - [3072, 64, 1, 1024, 3104, 3104, 1056, 1056]
    - [43, 21.11]
  - - [3072, 64, 1, 2048, 3104, 3104, 2080, 2080]
    - [44, 30.201]
  - - [3072, 64, 1, 4096, 3104, 3104, 4128, 4128]
    - [24, 38.538]
  - - [3072, 64, 1, 8192, 3104, 3104, 8224, 8224]
    - [44, 43.259]
  - - [3072, 128, 1, 64, 3104, 3104, 96, 96]
    - [95, 3.957]
  - - [3072, 128, 1, 128, 3104, 3104, 160, 160]
    - [99, 7.502]
  - - [3072, 128, 1, 256, 3104, 3104, 288, 288]
    - [118, 13.81]
  - - [3072, 128, 1, 512, 3104, 3104, 544, 544]
    - [121, 23.797]
  - - [3072, 128, 1, 1024, 3104, 3104, 1056, 1056]
    - [109, 33.594]
  - - [3072, 128, 1, 2048, 3104, 3104, 2080, 2080]
    - [101, 46.266]
  - - [3072, 128, 1, 4096, 3104, 3104, 4128, 4128]
    - [101, 57.214]
  - - [3072, 128, 1, 8192, 3104, 3104, 8224, 8224]
    - [71, 64.953]
  - - [3072, 256, 1, 64, 3104, 3104, 96, 96]
    - [76, 6.596]
  - - [3072, 256, 1, 128, 3104, 3104, 160, 160]
    - [65, 12.383]
  - - [3072, 256, 1, 256, 3104, 3104, 288, 288]
    - [117, 20.725]
  - - [3072, 256, 1, 512, 3104, 3104, 544, 544]
    - [95, 31.433]
  - - [3072, 256, 1, 1024, 3104, 3104, 1056, 1056]
    - [64, 44.055]
  - - [3072, 256, 1, 2048, 3104, 3104, 2080, 2080]
    - [66, 55.731]
  - - [3072, 256, 1, 4096, 3104, 3104, 4128, 4128]
    - [103, 64.315]
  - - [3072, 256, 1, 8192, 3104, 3104, 8224, 8224]
    - [6, 67.644]
  - - [3072, 512, 1, 64, 3104, 3104, 96, 96]
    - [97, 11.279]
  - - [3072, 512, 1, 128, 3104, 3104, 160, 160]
    - [76, 19.591]
  - - [3072, 512, 1, 256, 3104, 3104, 288, 288]
    - [140, 32.352]
  - - [3072, 512, 1, 512, 3104, 3104, 544, 544]
    - [183, 47.228]
  - - [3072, 512, 1, 1024, 3104, 3104, 1056, 1056]
    - [152, 61.59]
  - - [3072, 512, 1, 2048, 3104, 3104, 2080, 2080]
    - [165, 73.259]
  - - [3072, 512, 1, 4096, 3104, 3104, 4128, 4128]
    - [137, 78.148]
  - - [3072, 512, 1, 8192, 3104, 3104, 8224, 8224]
    - [136, 84.764]
  - - [3072, 1024, 1, 64, 3104, 3104, 96, 96]
    - [64, 17.966]
  - - [3072, 1024, 1, 128, 3104, 3104, 160, 160]
    - [66, 29.19]
  - - [3072, 1024, 1, 256, 3104, 3104, 288, 288]
    - [69, 42.2]
  - - [3072, 1024, 1, 512, 3104, 3104, 544, 544]
    - [142, 56.0]
  - - [3072, 1024, 1, 1024, 3104, 3104, 1056, 1056]
    - [137, 69.361]
  - - [3072, 1024, 1, 2048, 3104, 3104, 2080, 2080]
    - [137, 77.885]
  - - [3072, 1024, 1, 4096, 3104, 3104, 4128, 4128]
    - [134, 85.482]
  - - [3072, 1024, 1, 8192, 3104, 3104, 8224, 8224]
    - [163, 75.444]
  - - [3072, 2048, 1, 64, 3104, 3104, 96, 96]
    - [64, 25.299]
  - - [3072, 2048, 1, 128, 3104, 3104, 160, 160]
    - [130, 40.003]
  - - [3072, 2048, 1, 256, 3104, 3104, 288, 288]
    - [129, 52.389]
  - - [3072, 2048, 1, 512, 3104, 3104, 544, 544]
    - [127, 63.299]
  - - [3072, 2048, 1, 1024, 3104, 3104, 1056, 1056]
    - [126, 68.142]
  - - [3072, 2048, 1, 2048, 3104, 3104, 2080, 2080]
    - [127, 73.031]
  - - [3072, 2048, 1, 4096, 3104, 3104, 4128, 4128]
    - [155, 69.994]
  - - [3072, 2048, 1, 8192, 3104, 3104, 8224, 8224]
    - [126, 70.793]
  - - [3072, 4096, 1, 64, 3104, 3104, 96, 96]
    - [66, 32.659]
  - - [3072, 4096, 1, 128, 3104, 3104, 160, 160]
    - [148, 48.338]
  - - [3072, 4096, 1, 256, 3104, 3104, 288, 288]
    - [129, 59.641]
  - - [3072, 4096, 1, 512, 3104, 3104, 544, 544]
    - [146, 65.309]
  - - [3072, 4096, 1, 1024, 3104, 3104, 1056, 1056]
    - [124, 73.729]
  - - [3072, 4096, 1, 2048, 3104, 3104, 2080, 2080]
    - [171, 68.111]
  - - [3072, 4096, 1, 4096, 3104, 3104, 4128, 4128]
    - [156, 69.703]
  - - [3072, 4096, 1, 8192, 3104, 3104, 8224, 8224]
    - [168, 70.409]
  - - [3072, 8192, 1, 64, 3104, 3104, 96, 96]
    - [65, 32.731]
  - - [3072, 8192, 1, 128, 3104, 3104, 160, 160]
    - [182, 51.029]
  - - [3072, 8192, 1, 256, 3104, 3104, 288, 288]
    - [127, 62.556]
  - - [3072, 8192, 1, 512, 3104, 3104, 544, 544]
    - [150, 70.779]
  - - [3072, 8192, 1, 1024, 3104, 3104, 1056, 1056]
    - [175, 65.325]
  - - [3072, 8192, 1, 2048, 3104, 3104, 2080, 2080]
    - [169, 64.688]
  - - [3072, 8192, 1, 4096, 3104, 3104, 4128, 4128]
    - [173, 68.49]
  - - [3072, 8192, 1, 8192, 3104, 3104, 8224, 8224]
    - [159, 69.285]
  - - [6144, 64, 1, 64, 6176, 6176, 96, 96]
    - [7, 3.756]
  - - [6144, 64, 1, 128, 6176, 6176, 160, 160]
    - [88, 7.428]
  - - [6144, 64, 1, 256, 6176, 6176, 288, 288]
    - [68, 13.66]
  - - [6144, 64, 1, 512, 6176, 6176, 544, 544]
    - [99, 23.632]
  - - [6144, 64, 1, 1024, 6176, 6176, 1056, 1056]
    - [100, 33.381]
  - - [6144, 64, 1, 2048, 6176, 6176, 2080, 2080]
    - [100, 46.245]
  - - [6144, 64, 1, 4096, 6176, 6176, 4128, 4128]
    - [71, 56.62]
  - - [6144, 64, 1, 8192, 6176, 6176, 8224, 8224]
    - [99, 64.896]
  - - [6144, 128, 1, 64, 6176, 6176, 96, 96]
    - [116, 6.594]
  - - [6144, 128, 1, 128, 6176, 6176, 160, 160]
    - [96, 12.349]
  - - [6144, 128, 1, 256, 6176, 6176, 288, 288]
    - [115, 20.756]
  - - [6144, 128, 1, 512, 6176, 6176, 544, 544]
    - [88, 31.503]
  - - [6144, 128, 1, 1024, 6176, 6176, 1056, 1056]
    - [97, 44.032]
  - - [6144, 128, 1, 2048, 6176, 6176, 2080, 2080]
    - [66, 55.92]
  - - [6144, 128, 1, 4096, 6176, 6176, 4128, 4128]
    - [66, 64.461]
  - - [6144, 128, 1, 8192, 6176, 6176, 8224, 8224]
    - [65, 66.962]
  - - [6144, 256, 1, 64, 6176, 6176, 96, 96]
    - [61, 11.305]
  - - [6144, 256, 1, 128, 6176, 6176, 160, 160]
    - [66, 19.539]
  - - [6144, 256, 1, 256, 6176, 6176, 288, 288]
    - [15, 32.109]
  - - [6144, 256, 1, 512, 6176, 6176, 544, 544]
    - [183, 47.0]
  - - [6144, 256, 1, 1024, 6176, 6176, 1056, 1056]
    - [153, 60.279]
  - - [6144, 256, 1, 2048, 6176, 6176, 2080, 2080]
    - [165, 73.079]
  - - [6144, 256, 1, 4096, 6176, 6176, 4128, 4128]
    - [165, 78.064]
  - - [6144, 256, 1, 8192, 6176, 6176, 8224, 8224]
    - [165, 85.036]
  - - [6144, 512, 1, 64, 6176, 6176, 96, 96]
    - [63, 17.321]
  - - [6144, 512, 1, 128, 6176, 6176, 160, 160]
    - [115, 28.689]
  - - [6144, 512, 1, 256, 6176, 6176, 288, 288]
    - [99, 41.898]
  - - [6144, 512, 1, 512, 6176, 6176, 544, 544]
    - [141, 55.694]
  - - [6144, 512, 1, 1024, 6176, 6176, 1056, 1056]
    - [126, 65.756]
  - - [6144, 512, 1, 2048, 6176, 6176, 2080, 2080]
    - [166, 71.732]
  - - [6144, 512, 1, 4096, 6176, 6176, 4128, 4128]
    - [164, 79.535]
  - - [6144, 512, 1, 8192, 6176, 6176, 8224, 8224]
    - [136, 74.043]
  - - [6144, 1024, 1, 64, 6176, 6176, 96, 96]
    - [76, 24.608]
  - - [6144, 1024, 1, 128, 6176, 6176, 160, 160]
    - [128, 39.188]
  - - [6144, 1024, 1, 256, 6176, 6176, 288, 288]
    - [160, 52.033]
  - - [6144, 1024, 1, 512, 6176, 6176, 544, 544]
    - [130, 63.016]
  - - [6144, 1024, 1, 1024, 6176, 6176, 1056, 1056]
    - [130, 68.558]
  - - [6144, 1024, 1, 2048, 6176, 6176, 2080, 2080]
    - [130, 74.019]
  - - [6144, 1024, 1, 4096, 6176, 6176, 4128, 4128]
    - [181, 68.137]
  - - [6144, 1024, 1, 8192, 6176, 6176, 8224, 8224]
    - [178, 71.267]
  - - [6144, 2048, 1, 64, 6176, 6176, 96, 96]
    - [62, 31.83]
  - - [6144, 2048, 1, 128, 6176, 6176, 160, 160]
    - [161, 48.375]
  - - [6144, 2048, 1, 256, 6176, 6176, 288, 288]
    - [160, 60.1]
  - - [6144, 2048, 1, 512, 6176, 6176, 544, 544]
    - [129, 66.571]
  - - [6144, 2048, 1, 1024, 6176, 6176, 1056, 1056]
    - [173, 71.471]
  - - [6144, 2048, 1, 2048, 6176, 6176, 2080, 2080]
    - [123, 69.632]
  - - [6144, 2048, 1, 4096, 6176, 6176, 4128, 4128]
    - [157, 71.025]
  - - [6144, 2048, 1, 8192, 6176, 6176, 8224, 8224]
    - [129, 69.867]
  - - [6144, 4096, 1, 64, 6176, 6176, 96, 96]
    - [4, 34.216]
  - - [6144, 4096, 1, 128, 6176, 6176, 160, 160]
    - [138, 50.95]
  - - [6144, 4096, 1, 256, 6176, 6176, 288, 288]
    - [130, 63.881]
  - - [6144, 4096, 1, 512, 6176, 6176, 544, 544]
    - [139, 71.968]
  - - [6144, 4096, 1, 1024, 6176, 6176, 1056, 1056]
    - [179, 66.199]
  - - [6144, 4096, 1, 2048, 6176, 6176, 2080, 2080]
    - [130, 64.48]
  - - [6144, 4096, 1, 4096, 6176, 6176, 4128, 4128]
    - [158, 68.235]
  - - [6144, 4096, 1, 8192, 6176, 6176, 8224, 8224]
    - [161, 69.452]
  - - [6144, 8192, 1, 64, 6176, 6176, 96, 96]
    - [34, 14.742]
  - - [6144, 8192, 1, 128, 6176, 6176, 160, 160]
    - [39, 27.99]
  - - [6144, 8192, 1, 256, 6176, 6176, 288, 288]
    - [64, 47.43]
  - - [6144, 8192, 1, 512, 6176, 6176, 544, 544]
    - [142, 63.232]
  - - [6144, 8192, 1, 1024, 6176, 6176, 1056, 1056]
    - [170, 60.311]
  - - [6144, 8192, 1, 2048, 6176, 6176, 2080, 2080]
    - [125, 66.148]
  - - [6144, 8192, 1, 4096, 6176, 6176, 4128, 4128]
    - [175, 68.892]
  - - [6144, 8192, 1, 8192, 6176, 6176, 8224, 8224]
    - [182, 67.378]
- null
- null
- DeviceEfficiency
