library/src/blas3/Tensile/Logic/asm_full/navi31/navi31_Cijk_Alik_Bjlk_HHS_BH.yaml
- {MinimumRequiredVersion: 4.35.0}
- navi31
- gfx1100
- [Device 73bf]
    SolutionIndex: 0
    SolutionNameMin: Cijk_Alik_Bjlk_HHS_BH_MT32x32x16_MI16x16x16x1_SN_1LDSB1_AMAS0_GRVW2_IU1_NLCB1_SIA2_SU0_SUS0_SVW1_TT1_16_VW1_WGM4
    SolutionIndex: 1
    SolutionNameMin: Cijk_Alik_Bjlk_HHS_BH_MT32x32x16_MI16x16x16x1_SN_1LDSB1_AMAS0_GRVW8_IU1_NLCB1_SIA2_SU0_SUS0_SVW1_TT1_16_VW1_WGM4
    SolutionIndex: 2
    SolutionNameMin: Cijk_Alik_Bjlk_HHS_BH_MT32x32x16_MI16x16x16x1_SN_1LDSB1_AMAS0_GRVW8_IU1_NLCB1_SIA2_SU32_SUS128_SVW1_TT1_16_VW1_WGM4
    SolutionIndex: 3
    SolutionNameMin: Cijk_Alik_Bjlk_HHS_BH_MT32x32x16_MI16x16x16x1_SN_1LDSB1_AMAS0_GRVW2_IU1_NLCB1_SIA2_SU32_SUS256_SVW1_TT1_16_VW1_WGM4
    SolutionIndex: 4
    SolutionNameMin: Cijk_Alik_Bjlk_HHS_BH_MT32x32x16_MI16x16x16x1_SN_1LDSB1_AMAS0_GRVW4_IU1_NLCB1_SIA2_SU32_SUS256_SVW1_TT1_16_VW1_WGM4
    SolutionIndex: 5
    SolutionNameMin: Cijk_Alik_Bjlk_HHS_BH_MT32x32x16_MI16x16x16x1_SN_1LDSB0_AMAS0_GRVW8_IU1_NLCB1_SIA1_SU0_SUS0_SVW1_TT1_16_VW1_WGM8
    SolutionIndex: 6
    SolutionNameMin: Cijk_Alik_Bjlk_HHS_BH_MT32x32x16_MI16x16x16x1_SN_1LDSB1_AMAS0_GRVW8_IU1_NLCB1_SIA2_SU32_SUS128_SVW1_TT1_16_VW1_WGM8
    SolutionIndex: 7
    SolutionNameMin: Cijk_Alik_Bjlk_HHS_BH_MT32x32x16_MI16x16x16x1_SN_1LDSB1_AMAS0_GRVW8_IU1_NLCB1_SIA2_SU32_SUS256_SVW1_TT1_16_VW1_WGM8
    SolutionIndex: 8
    SolutionNameMin: Cijk_Alik_Bjlk_HHS_BH_MT64x64x16_MI16x16x16x1_SN_1LDSB0_AMAS3_GRVW4_IU1_NLCB1_SIA1_SU0_SUS0_SVW2_TT2_32_VW2_WGM4
    SolutionIndex: 9
    SolutionNameMin: Cijk_Alik_Bjlk_HHS_BH_MT64x64x16_MI16x16x16x1_SN_1LDSB0_AMAS3_GRVW8_IU1_NLCB1_SIA1_SU0_SUS0_SVW2_TT2_32_VW2_WGM4
    SolutionIndex: 10
    SolutionNameMin: Cijk_Alik_Bjlk_HHS_BH_MT64x64x16_MI16x16x16x1_SN_1LDSB1_AMAS3_GRVW4_IU1_NLCB1_SIA2_SU0_SUS0_SVW2_TT2_32_VW2_WGM4
    SolutionIndex: 11
    SolutionNameMin: Cijk_Alik_Bjlk_HHS_BH_MT64x64x16_MI16x16x16x1_SN_1LDSB1_AMAS3_GRVW8_IU1_NLCB1_SIA2_SU0_SUS0_SVW2_TT2_32_VW2_WGM4
    SolutionIndex: 12
    SolutionNameMin: Cijk_Alik_Bjlk_HHS_BH_MT64x64x16_MI16x16x16x1_SN_1LDSB0_AMAS3_GRVW4_IU1_NLCB1_SIA1_SU32_SUS128_SVW2_TT2_32_VW2_WGM4
    SolutionIndex: 13
    SolutionNameMin: Cijk_Alik_Bjlk_HHS_BH_MT64x64x16_MI16x16x16x1_SN_1LDSB0_AMAS3_GRVW8_IU1_NLCB1_SIA1_SU32_SUS128_SVW2_TT2_32_VW2_WGM4
    SolutionIndex: 14
    SolutionNameMin: Cijk_Alik_Bjlk_HHS_BH_MT64x64x16_MI16x16x16x1_SN_1LDSB1_AMAS3_GRVW4_IU1_NLCB1_SIA2_SU32_SUS128_SVW2_TT2_32_VW2_WGM4
    SolutionIndex: 15
    SolutionNameMin: Cijk_Alik_Bjlk_HHS_BH_MT64x64x16_MI16x16x16x1_SN_1LDSB1_AMAS3_GRVW4_IU1_NLCB1_SIA2_SU32_SUS256_SVW2_TT2_32_VW2_WGM4
    SolutionIndex: 16
    SolutionNameMin: Cijk_Alik_Bjlk_HHS_BH_MT64x64x16_MI16x16x16x1_SN_1LDSB1_AMAS3_GRVW8_IU1_NLCB1_SIA2_SU32_SUS256_SVW2_TT2_32_VW2_WGM4
    SolutionIndex: 17
    SolutionNameMin: Cijk_Alik_Bjlk_HHS_BH_MT64x64x16_MI16x16x16x1_SN_1LDSB1_AMAS3_GRVW4_IU1_NLCB1_SIA2_SU0_SUS0_SVW2_TT2_32_VW2_WGM8
    SolutionIndex: 18
    SolutionNameMin: Cijk_Alik_Bjlk_HHS_BH_MT64x64x16_MI16x16x16x1_SN_1LDSB1_AMAS3_GRVW8_IU1_NLCB1_SIA2_SU0_SUS0_SVW2_TT2_32_VW2_WGM8
    SolutionIndex: 19
    SolutionNameMin: Cijk_Alik_Bjlk_HHS_BH_MT64x64x16_MI16x16x16x1_SN_1LDSB1_AMAS3_GRVW4_IU1_NLCB1_SIA2_SU32_SUS128_SVW2_TT2_32_VW2_WGM8
    SolutionIndex: 20
    SolutionNameMin: Cijk_Alik_Bjlk_HHS_BH_MT64x64x16_MI16x16x16x1_SN_1LDSB1_AMAS3_GRVW8_IU1_NLCB1_SIA2_SU32_SUS128_SVW2_TT2_32_VW2_WGM8
    SolutionIndex: 21
    SolutionNameMin: Cijk_Alik_Bjlk_HHS_BH_MT64x64x16_MI16x16x16x1_SN_1LDSB1_AMAS3_GRVW8_IU1_NLCB1_SIA2_SU32_SUS256_SVW2_TT2_32_VW2_WGM8
    SolutionIndex: 22
    SolutionNameMin: Cijk_Alik_Bjlk_HHS_BH_MT128x128x16_MI16x16x16x1_SN_1LDSB0_AMAS0_GRVW2_IU1_NLCB2_SIA1_SU0_SUS0_SVW1_TT4_64_VW1_WGM4
    SolutionIndex: 23
    SolutionNameMin: Cijk_Alik_Bjlk_HHS_BH_MT128x128x16_MI16x16x16x1_SN_1LDSB0_AMAS3_GRVW2_IU1_NLCB2_SIA1_SU0_SUS0_SVW2_TT4_64_VW2_WGM4
    SolutionIndex: 24
    SolutionNameMin: Cijk_Alik_Bjlk_HHS_BH_MT128x128x16_MI16x16x16x1_SN_1LDSB0_AMAS3_GRVW4_IU1_NLCB1_SIA1_SU0_SUS0_SVW2_TT4_64_VW2_WGM4
    SolutionIndex: 25
    SolutionNameMin: Cijk_Alik_Bjlk_HHS_BH_MT128x128x16_MI16x16x16x1_SN_1LDSB0_AMAS3_GRVW4_IU1_NLCB1_SIA1_SU0_SUS0_SVW4_TT4_64_VW4_WGM4
    SolutionIndex: 26
    SolutionNameMin: Cijk_Alik_Bjlk_HHS_BH_MT128x128x16_MI16x16x16x1_SN_1LDSB0_AMAS0_GRVW8_IU1_NLCB1_SIA1_SU0_SUS0_SVW1_TT4_64_VW1_WGM4
    SolutionIndex: 27
    SolutionNameMin: Cijk_Alik_Bjlk_HHS_BH_MT128x128x16_MI16x16x16x1_SN_1LDSB0_AMAS3_GRVW8_IU1_NLCB1_SIA1_SU0_SUS0_SVW2_TT4_64_VW2_WGM4
    SolutionIndex: 28
    SolutionNameMin: Cijk_Alik_Bjlk_HHS_BH_MT128x128x16_MI16x16x16x1_SN_1LDSB0_AMAS3_GRVW8_IU1_NLCB1_SIA1_SU0_SUS0_SVW4_TT4_64_VW4_WGM4
    SolutionIndex: 29
    SolutionNameMin: Cijk_Alik_Bjlk_HHS_BH_MT128x128x16_MI16x16x16x1_SN_1LDSB1_AMAS3_GRVW2_IU1_NLCB2_SIA2_SU0_SUS0_SVW2_TT4_64_VW2_WGM4
    SolutionIndex: 30
    SolutionNameMin: Cijk_Alik_Bjlk_HHS_BH_MT128x128x16_MI16x16x16x1_SN_1LDSB1_AMAS3_GRVW2_IU1_NLCB2_SIA2_SU0_SUS0_SVW4_TT4_64_VW4_WGM4
    SolutionIndex: 31
    SolutionNameMin: Cijk_Alik_Bjlk_HHS_BH_MT128x128x16_MI16x16x16x1_SN_1LDSB1_AMAS3_GRVW4_IU1_NLCB1_SIA2_SU0_SUS0_SVW4_TT4_64_VW4_WGM4
    SolutionIndex: 32
    SolutionNameMin: Cijk_Alik_Bjlk_HHS_BH_MT128x128x16_MI16x16x16x1_SN_1LDSB1_AMAS3_GRVW8_IU1_NLCB1_SIA2_SU0_SUS0_SVW2_TT4_64_VW2_WGM4
    SolutionIndex: 33
    SolutionNameMin: Cijk_Alik_Bjlk_HHS_BH_MT128x128x16_MI16x16x16x1_SN_1LDSB0_AMAS3_GRVW4_IU1_NLCB1_SIA3_SU0_SUS0_SVW4_TT4_64_VW4_WGM4
    SolutionIndex: 34
    SolutionNameMin: Cijk_Alik_Bjlk_HHS_BH_MT128x128x16_MI16x16x16x1_SN_1LDSB0_AMAS3_GRVW8_IU1_NLCB1_SIA3_SU0_SUS0_SVW2_TT4_64_VW2_WGM4
    SolutionIndex: 35
    SolutionNameMin: Cijk_Alik_Bjlk_HHS_BH_MT128x128x16_MI16x16x16x1_SN_1LDSB0_AMAS3_GRVW8_IU1_NLCB1_SIA3_SU0_SUS0_SVW4_TT4_64_VW4_WGM4
    SolutionIndex: 36
    SolutionNameMin: Cijk_Alik_Bjlk_HHS_BH_MT128x128x16_MI16x16x16x1_SN_1LDSB0_AMAS3_GRVW4_IU1_NLCB1_SIA1_SU32_SUS128_SVW2_TT4_64_VW2_WGM4
    SolutionIndex: 37
    SolutionNameMin: Cijk_Alik_Bjlk_HHS_BH_MT128x128x16_MI16x16x16x1_SN_1LDSB0_AMAS3_GRVW8_IU1_NLCB1_SIA1_SU32_SUS128_SVW4_TT4_64_VW4_WGM4
    SolutionIndex: 38
    SolutionNameMin: Cijk_Alik_Bjlk_HHS_BH_MT128x128x16_MI16x16x16x1_SN_1LDSB1_AMAS3_GRVW4_IU1_NLCB1_SIA2_SU32_SUS128_SVW2_TT4_64_VW2_WGM4
    SolutionIndex: 39
    SolutionNameMin: Cijk_Alik_Bjlk_HHS_BH_MT128x128x16_MI16x16x16x1_SN_1LDSB1_AMAS3_GRVW4_IU1_NLCB1_SIA2_SU32_SUS128_SVW4_TT4_64_VW4_WGM4
    SolutionIndex: 40
    SolutionNameMin: Cijk_Alik_Bjlk_HHS_BH_MT128x128x16_MI16x16x16x1_SN_1LDSB1_AMAS0_GRVW8_IU1_NLCB1_SIA2_SU32_SUS128_SVW1_TT4_64_VW1_WGM4
    SolutionIndex: 41
    SolutionNameMin: Cijk_Alik_Bjlk_HHS_BH_MT128x128x16_MI16x16x16x1_SN_1LDSB0_AMAS3_GRVW8_IU1_NLCB1_SIA3_SU32_SUS128_SVW4_TT4_64_VW4_WGM4
    SolutionIndex: 42
    SolutionNameMin: Cijk_Alik_Bjlk_HHS_BH_MT128x128x16_MI16x16x16x1_SN_1LDSB0_AMAS3_GRVW4_IU1_NLCB1_SIA1_SU32_SUS256_SVW2_TT4_64_VW2_WGM4
    SolutionIndex: 43
    SolutionNameMin: Cijk_Alik_Bjlk_HHS_BH_MT128x128x16_MI16x16x16x1_SN_1LDSB0_AMAS3_GRVW8_IU1_NLCB1_SIA1_SU32_SUS256_SVW4_TT4_64_VW4_WGM4
    SolutionIndex: 44
    SolutionNameMin: Cijk_Alik_Bjlk_HHS_BH_MT128x128x16_MI16x16x16x1_SN_1LDSB1_AMAS3_GRVW2_IU1_NLCB2_SIA2_SU32_SUS256_SVW4_TT4_64_VW4_WGM4
    SolutionIndex: 45
    SolutionNameMin: Cijk_Alik_Bjlk_HHS_BH_MT128x128x16_MI16x16x16x1_SN_1LDSB1_AMAS3_GRVW4_IU1_NLCB1_SIA2_SU32_SUS256_SVW4_TT4_64_VW4_WGM4
    SolutionIndex: 46
    SolutionNameMin: Cijk_Alik_Bjlk_HHS_BH_MT128x128x16_MI16x16x16x1_SN_1LDSB0_AMAS3_GRVW4_IU1_NLCB1_SIA3_SU32_SUS256_SVW4_TT4_64_VW4_WGM4
    SolutionIndex: 47
    SolutionNameMin: Cijk_Alik_Bjlk_HHS_BH_MT128x128x16_MI16x16x16x1_SN_1LDSB0_AMAS3_GRVW8_IU1_NLCB1_SIA3_SU32_SUS256_SVW4_TT4_64_VW4_WGM4
    SolutionIndex: 48
    SolutionNameMin: Cijk_Alik_Bjlk_HHS_BH_MT128x128x16_MI16x16x16x1_SN_1LDSB0_AMAS3_GRVW2_IU1_NLCB2_SIA1_SU0_SUS0_SVW4_TT4_64_VW4_WGM8
    SolutionIndex: 49
    SolutionNameMin: Cijk_Alik_Bjlk_HHS_BH_MT128x128x16_MI16x16x16x1_SN_1LDSB0_AMAS3_GRVW4_IU1_NLCB1_SIA1_SU0_SUS0_SVW2_TT4_64_VW2_WGM8
    SolutionIndex: 50
    SolutionNameMin: Cijk_Alik_Bjlk_HHS_BH_MT128x128x16_MI16x16x16x1_SN_1LDSB0_AMAS3_GRVW4_IU1_NLCB1_SIA1_SU0_SUS0_SVW4_TT4_64_VW4_WGM8
    SolutionIndex: 51
    SolutionNameMin: Cijk_Alik_Bjlk_HHS_BH_MT128x128x16_MI16x16x16x1_SN_1LDSB0_AMAS3_GRVW8_IU1_NLCB1_SIA1_SU0_SUS0_SVW2_TT4_64_VW2_WGM8
    SolutionIndex: 52
    SolutionNameMin: Cijk_Alik_Bjlk_HHS_BH_MT128x128x16_MI16x16x16x1_SN_1LDSB0_AMAS3_GRVW8_IU1_NLCB1_SIA1_SU0_SUS0_SVW4_TT4_64_VW4_WGM8
    SolutionIndex: 53
    SolutionNameMin: Cijk_Alik_Bjlk_HHS_BH_MT128x128x16_MI16x16x16x1_SN_1LDSB1_AMAS3_GRVW4_IU1_NLCB1_SIA2_SU0_SUS0_SVW4_TT4_64_VW4_WGM8
    SolutionIndex: 54
    SolutionNameMin: Cijk_Alik_Bjlk_HHS_BH_MT128x128x16_MI16x16x16x1_SN_1LDSB1_AMAS0_GRVW8_IU1_NLCB1_SIA2_SU0_SUS0_SVW1_TT4_64_VW1_WGM8
    SolutionIndex: 55
    SolutionNameMin: Cijk_Alik_Bjlk_HHS_BH_MT128x128x16_MI16x16x16x1_SN_1LDSB1_AMAS3_GRVW8_IU1_NLCB1_SIA2_SU0_SUS0_SVW4_TT4_64_VW4_WGM8
    SolutionIndex: 56
    SolutionNameMin: Cijk_Alik_Bjlk_HHS_BH_MT128x128x16_MI16x16x16x1_SN_1LDSB0_AMAS3_GRVW8_IU1_NLCB1_SIA3_SU0_SUS0_SVW4_TT4_64_VW4_WGM8
    SolutionIndex: 57
    SolutionNameMin: Cijk_Alik_Bjlk_HHS_BH_MT128x128x16_MI16x16x16x1_SN_1LDSB0_AMAS3_GRVW4_IU1_NLCB1_SIA1_SU32_SUS128_SVW2_TT4_64_VW2_WGM8
    SolutionIndex: 58
    SolutionNameMin: Cijk_Alik_Bjlk_HHS_BH_MT128x128x16_MI16x16x16x1_SN_1LDSB0_AMAS3_GRVW4_IU1_NLCB1_SIA1_SU32_SUS128_SVW4_TT4_64_VW4_WGM8
    SolutionIndex: 59
    SolutionNameMin: Cijk_Alik_Bjlk_HHS_BH_MT128x128x16_MI16x16x16x1_SN_1LDSB0_AMAS0_GRVW8_IU1_NLCB1_SIA1_SU32_SUS128_SVW1_TT4_64_VW1_WGM8
    SolutionIndex: 60
    SolutionNameMin: Cijk_Alik_Bjlk_HHS_BH_MT128x128x16_MI16x16x16x1_SN_1LDSB0_AMAS3_GRVW8_IU1_NLCB1_SIA1_SU32_SUS128_SVW2_TT4_64_VW2_WGM8
    SolutionIndex: 61
    SolutionNameMin: Cijk_Alik_Bjlk_HHS_BH_MT128x128x16_MI16x16x16x1_SN_1LDSB0_AMAS3_GRVW8_IU1_NLCB1_SIA1_SU32_SUS128_SVW4_TT4_64_VW4_WGM8
    SolutionIndex: 62
    SolutionNameMin: Cijk_Alik_Bjlk_HHS_BH_MT128x128x16_MI16x16x16x1_SN_1LDSB1_AMAS3_GRVW4_IU1_NLCB1_SIA2_SU32_SUS128_SVW4_TT4_64_VW4_WGM8
    SolutionIndex: 63
    SolutionNameMin: Cijk_Alik_Bjlk_HHS_BH_MT128x128x16_MI16x16x16x1_SN_1LDSB0_AMAS3_GRVW8_IU1_NLCB1_SIA3_SU32_SUS128_SVW2_TT4_64_VW2_WGM8
    SolutionIndex: 64
    SolutionNameMin: Cijk_Alik_Bjlk_HHS_BH_MT128x128x16_MI16x16x16x1_SN_1LDSB0_AMAS3_GRVW8_IU1_NLCB1_SIA3_SU32_SUS128_SVW4_TT4_64_VW4_WGM8
    SolutionIndex: 65
    SolutionNameMin: Cijk_Alik_Bjlk_HHS_BH_MT128x128x16_MI16x16x16x1_SN_1LDSB0_AMAS0_GRVW4_IU1_NLCB1_SIA1_SU32_SUS256_SVW1_TT4_64_VW1_WGM8
    SolutionIndex: 66
    SolutionNameMin: Cijk_Alik_Bjlk_HHS_BH_MT128x128x16_MI16x16x16x1_SN_1LDSB0_AMAS3_GRVW4_IU1_NLCB1_SIA1_SU32_SUS256_SVW2_TT4_64_VW2_WGM8
    SolutionIndex: 67
    SolutionNameMin: Cijk_Alik_Bjlk_HHS_BH_MT128x128x16_MI16x16x16x1_SN_1LDSB0_AMAS3_GRVW4_IU1_NLCB1_SIA1_SU32_SUS256_SVW4_TT4_64_VW4_WGM8
    SolutionIndex: 68
    SolutionNameMin: Cijk_Alik_Bjlk_HHS_BH_MT128x128x16_MI16x16x16x1_SN_1LDSB0_AMAS3_GRVW8_IU1_NLCB1_SIA1_SU32_SUS256_SVW2_TT4_64_VW2_WGM8
    SolutionIndex: 69
    SolutionNameMin: Cijk_Alik_Bjlk_HHS_BH_MT128x128x16_MI16x16x16x1_SN_1LDSB0_AMAS3_GRVW8_IU1_NLCB1_SIA1_SU32_SUS256_SVW4_TT4_64_VW4_WGM8
    SolutionIndex: 70
    SolutionNameMin: Cijk_Alik_Bjlk_HHS_BH_MT128x128x16_MI16x16x16x1_SN_1LDSB1_AMAS3_GRVW4_IU1_NLCB1_SIA2_SU32_SUS256_SVW2_TT4_64_VW2_WGM8
    SolutionIndex: 71
    SolutionNameMin: Cijk_Alik_Bjlk_HHS_BH_MT128x128x16_MI16x16x16x1_SN_1LDSB0_AMAS3_GRVW4_IU1_NLCB1_SIA3_SU32_SUS256_SVW4_TT4_64_VW4_WGM8
    SolutionIndex: 72
    SolutionNameMin: Cijk_Alik_Bjlk_HHS_BH_MT128x128x16_MI16x16x16x1_SN_1LDSB0_AMAS3_GRVW8_IU1_NLCB1_SIA3_SU32_SUS256_SVW4_TT4_64_VW4_WGM8
    SolutionIndex: 73
    SolutionNameMin: Cijk_Alik_Bjlk_HHS_BH_MT32x32x32_MI16x16x16x1_SN_1LDSB0_AMAS0_GRVW4_IU1_NLCB1_SIA1_SU0_SUS0_SVW1_TT1_16_VW1_WGM4
    SolutionIndex: 74
    SolutionNameMin: Cijk_Alik_Bjlk_HHS_BH_MT32x32x32_MI16x16x16x1_SN_1LDSB0_AMAS0_GRVW8_IU1_NLCB1_SIA1_SU0_SUS0_SVW1_TT1_16_VW1_WGM4
    SolutionIndex: 75
    SolutionNameMin: Cijk_Alik_Bjlk_HHS_BH_MT32x32x32_MI16x16x16x1_SN_1LDSB1_AMAS0_GRVW2_IU2_NLCB1_SIA2_SU0_SUS0_SVW1_TT1_16_VW1_WGM4
    SolutionIndex: 76
    SolutionNameMin: Cijk_Alik_Bjlk_HHS_BH_MT32x32x32_MI16x16x16x1_SN_1LDSB1_AMAS0_GRVW4_IU2_NLCB1_SIA2_SU0_SUS0_SVW1_TT1_16_VW1_WGM4
    SolutionIndex: 77
    SolutionNameMin: Cijk_Alik_Bjlk_HHS_BH_MT32x32x32_MI16x16x16x1_SN_1LDSB1_AMAS0_GRVW8_IU2_NLCB1_SIA2_SU0_SUS0_SVW1_TT1_16_VW1_WGM4
    SolutionIndex: 78
    SolutionNameMin: Cijk_Alik_Bjlk_HHS_BH_MT32x32x32_MI16x16x16x1_SN_1LDSB0_AMAS0_GRVW8_IU1_NLCB1_SIA1_SU32_SUS128_SVW1_TT1_16_VW1_WGM4
    SolutionIndex: 79
    SolutionNameMin: Cijk_Alik_Bjlk_HHS_BH_MT32x32x32_MI16x16x16x1_SN_1LDSB1_AMAS0_GRVW4_IU2_NLCB1_SIA2_SU32_SUS128_SVW1_TT1_16_VW1_WGM4
    SolutionIndex: 80
    SolutionNameMin: Cijk_Alik_Bjlk_HHS_BH_MT32x32x32_MI16x16x16x1_SN_1LDSB1_AMAS0_GRVW8_IU2_NLCB1_SIA2_SU32_SUS128_SVW1_TT1_16_VW1_WGM4
    SolutionIndex: 81
    SolutionNameMin: Cijk_Alik_Bjlk_HHS_BH_MT32x32x32_MI16x16x16x1_SN_1LDSB1_AMAS0_GRVW2_IU2_NLCB1_SIA2_SU32_SUS256_SVW1_TT1_16_VW1_WGM4
    SolutionIndex: 82
    SolutionNameMin: Cijk_Alik_Bjlk_HHS_BH_MT32x32x32_MI16x16x16x1_SN_1LDSB1_AMAS0_GRVW4_IU2_NLCB1_SIA2_SU32_SUS256_SVW1_TT1_16_VW1_WGM4
    SolutionIndex: 83
    SolutionNameMin: Cijk_Alik_Bjlk_HHS_BH_MT32x32x32_MI16x16x16x1_SN_1LDSB1_AMAS0_GRVW8_IU2_NLCB1_SIA2_SU32_SUS256_SVW1_TT1_16_VW1_WGM4
    SolutionIndex: 84
    SolutionNameMin: Cijk_Alik_Bjlk_HHS_BH_MT32x32x32_MI16x16x16x1_SN_1LDSB0_AMAS0_GRVW2_IU1_NLCB1_SIA1_SU0_SUS0_SVW1_TT1_16_VW1_WGM8
    SolutionIndex: 85
    SolutionNameMin: Cijk_Alik_Bjlk_HHS_BH_MT32x32x32_MI16x16x16x1_SN_1LDSB0_AMAS0_GRVW4_IU1_NLCB1_SIA1_SU0_SUS0_SVW1_TT1_16_VW1_WGM8
    SolutionIndex: 86
    SolutionNameMin: Cijk_Alik_Bjlk_HHS_BH_MT32x32x32_MI16x16x16x1_SN_1LDSB0_AMAS0_GRVW8_IU1_NLCB1_SIA1_SU0_SUS0_SVW1_TT1_16_VW1_WGM8
    SolutionIndex: 87
    SolutionNameMin: Cijk_Alik_Bjlk_HHS_BH_MT32x32x32_MI16x16x16x1_SN_1LDSB1_AMAS0_GRVW2_IU2_NLCB1_SIA2_SU0_SUS0_SVW1_TT1_16_VW1_WGM8
    SolutionIndex: 88
    SolutionNameMin: Cijk_Alik_Bjlk_HHS_BH_MT32x32x32_MI16x16x16x1_SN_1LDSB1_AMAS0_GRVW4_IU2_NLCB1_SIA2_SU0_SUS0_SVW1_TT1_16_VW1_WGM8
    SolutionIndex: 89
    SolutionNameMin: Cijk_Alik_Bjlk_HHS_BH_MT32x32x32_MI16x16x16x1_SN_1LDSB1_AMAS0_GRVW8_IU2_NLCB1_SIA2_SU0_SUS0_SVW1_TT1_16_VW1_WGM8
    SolutionIndex: 90
    SolutionNameMin: Cijk_Alik_Bjlk_HHS_BH_MT32x32x32_MI16x16x16x1_SN_1LDSB0_AMAS0_GRVW8_IU1_NLCB1_SIA3_SU0_SUS0_SVW1_TT1_16_VW1_WGM8
    SolutionIndex: 91
    SolutionNameMin: Cijk_Alik_Bjlk_HHS_BH_MT32x32x32_MI16x16x16x1_SN_1LDSB0_AMAS0_GRVW8_IU1_NLCB1_SIA1_SU32_SUS128_SVW1_TT1_16_VW1_WGM8
    SolutionIndex: 92
    SolutionNameMin: Cijk_Alik_Bjlk_HHS_BH_MT32x32x32_MI16x16x16x1_SN_1LDSB1_AMAS0_GRVW2_IU2_NLCB1_SIA2_SU32_SUS128_SVW1_TT1_16_VW1_WGM8
    SolutionIndex: 93
    SolutionNameMin: Cijk_Alik_Bjlk_HHS_BH_MT32x32x32_MI16x16x16x1_SN_1LDSB1_AMAS0_GRVW4_IU2_NLCB1_SIA2_SU32_SUS128_SVW1_TT1_16_VW1_WGM8
    SolutionIndex: 94
    SolutionNameMin: Cijk_Alik_Bjlk_HHS_BH_MT32x32x32_MI16x16x16x1_SN_1LDSB1_AMAS0_GRVW8_IU2_NLCB1_SIA2_SU32_SUS128_SVW1_TT1_16_VW1_WGM8
    SolutionIndex: 95
    SolutionNameMin: Cijk_Alik_Bjlk_HHS_BH_MT32x32x32_MI16x16x16x1_SN_1LDSB0_AMAS0_GRVW4_IU1_NLCB1_SIA3_SU32_SUS128_SVW1_TT1_16_VW1_WGM8
    SolutionIndex: 96
    SolutionNameMin: Cijk_Alik_Bjlk_HHS_BH_MT32x32x32_MI16x16x16x1_SN_1LDSB0_AMAS0_GRVW2_IU1_NLCB1_SIA1_SU32_SUS256_SVW1_TT1_16_VW1_WGM8
    SolutionIndex: 97
    SolutionNameMin: Cijk_Alik_Bjlk_HHS_BH_MT32x32x32_MI16x16x16x1_SN_1LDSB1_AMAS0_GRVW2_IU2_NLCB1_SIA2_SU32_SUS256_SVW1_TT1_16_VW1_WGM8
    SolutionIndex: 98
    SolutionNameMin: Cijk_Alik_Bjlk_HHS_BH_MT32x32x32_MI16x16x16x1_SN_1LDSB1_AMAS0_GRVW4_IU2_NLCB1_SIA2_SU32_SUS256_SVW1_TT1_16_VW1_WGM8
    SolutionIndex: 99
    SolutionNameMin: Cijk_Alik_Bjlk_HHS_BH_MT32x32x32_MI16x16x16x1_SN_1LDSB1_AMAS0_GRVW8_IU2_NLCB1_SIA2_SU32_SUS256_SVW1_TT1_16_VW1_WGM8
    SolutionIndex: 100
    SolutionNameMin: Cijk_Alik_Bjlk_HHS_BH_MT32x32x32_MI16x16x16x1_SN_1LDSB0_AMAS0_GRVW4_IU1_NLCB1_SIA3_SU32_SUS256_SVW1_TT1_16_VW1_WGM8
    SolutionIndex: 101
    SolutionNameMin: Cijk_Alik_Bjlk_HHS_BH_MT64x64x32_MI16x16x16x1_SN_1LDSB0_AMAS0_GRVW4_IU1_NLCB1_SIA1_SU0_SUS0_SVW1_TT2_32_VW1_WGM4
    SolutionIndex: 102
    SolutionNameMin: Cijk_Alik_Bjlk_HHS_BH_MT64x64x32_MI16x16x16x1_SN_1LDSB0_AMAS3_GRVW4_IU1_NLCB1_SIA1_SU0_SUS0_SVW2_TT2_32_VW2_WGM4
    SolutionIndex: 103
    SolutionNameMin: Cijk_Alik_Bjlk_HHS_BH_MT64x64x32_MI16x16x16x1_SN_1LDSB0_AMAS0_GRVW8_IU1_NLCB1_SIA1_SU0_SUS0_SVW1_TT2_32_VW1_WGM4
    SolutionIndex: 104
    SolutionNameMin: Cijk_Alik_Bjlk_HHS_BH_MT64x64x32_MI16x16x16x1_SN_1LDSB0_AMAS3_GRVW8_IU1_NLCB1_SIA1_SU0_SUS0_SVW2_TT2_32_VW2_WGM4
    SolutionIndex: 105
    SolutionNameMin: Cijk_Alik_Bjlk_HHS_BH_MT64x64x32_MI16x16x16x1_SN_1LDSB1_AMAS3_GRVW4_IU2_NLCB1_SIA2_SU0_SUS0_SVW2_TT2_32_VW2_WGM4
    SolutionIndex: 106
    SolutionNameMin: Cijk_Alik_Bjlk_HHS_BH_MT64x64x32_MI16x16x16x1_SN_1LDSB1_AMAS0_GRVW8_IU2_NLCB1_SIA2_SU0_SUS0_SVW1_TT2_32_VW1_WGM4
    SolutionIndex: 107
    SolutionNameMin: Cijk_Alik_Bjlk_HHS_BH_MT64x64x32_MI16x16x16x1_SN_1LDSB1_AMAS3_GRVW8_IU2_NLCB1_SIA2_SU0_SUS0_SVW2_TT2_32_VW2_WGM4
    SolutionIndex: 108
    SolutionNameMin: Cijk_Alik_Bjlk_HHS_BH_MT64x64x32_MI16x16x16x1_SN_1LDSB0_AMAS0_GRVW8_IU1_NLCB1_SIA3_SU0_SUS0_SVW1_TT2_32_VW1_WGM4
    SolutionIndex: 109
    SolutionNameMin: Cijk_Alik_Bjlk_HHS_BH_MT64x64x32_MI16x16x16x1_SN_1LDSB0_AMAS3_GRVW8_IU1_NLCB1_SIA3_SU0_SUS0_SVW2_TT2_32_VW2_WGM4
    SolutionIndex: 110
    SolutionNameMin: Cijk_Alik_Bjlk_HHS_BH_MT64x64x32_MI16x16x16x1_SN_1LDSB0_AMAS3_GRVW4_IU1_NLCB1_SIA1_SU32_SUS128_SVW2_TT2_32_VW2_WGM4
    SolutionIndex: 111
    SolutionNameMin: Cijk_Alik_Bjlk_HHS_BH_MT64x64x32_MI16x16x16x1_SN_1LDSB1_AMAS0_GRVW4_IU2_NLCB1_SIA2_SU32_SUS128_SVW1_TT2_32_VW1_WGM4
    SolutionIndex: 112
    SolutionNameMin: Cijk_Alik_Bjlk_HHS_BH_MT64x64x32_MI16x16x16x1_SN_1LDSB1_AMAS0_GRVW8_IU2_NLCB1_SIA2_SU32_SUS128_SVW1_TT2_32_VW1_WGM4
    SolutionIndex: 113
    SolutionNameMin: Cijk_Alik_Bjlk_HHS_BH_MT64x64x32_MI16x16x16x1_SN_1LDSB1_AMAS3_GRVW8_IU2_NLCB1_SIA2_SU32_SUS128_SVW2_TT2_32_VW2_WGM4
    SolutionIndex: 114
    SolutionNameMin: Cijk_Alik_Bjlk_HHS_BH_MT64x64x32_MI16x16x16x1_SN_1LDSB0_AMAS3_GRVW8_IU1_NLCB1_SIA1_SU32_SUS256_SVW2_TT2_32_VW2_WGM4
    SolutionIndex: 115
    SolutionNameMin: Cijk_Alik_Bjlk_HHS_BH_MT64x64x32_MI16x16x16x1_SN_1LDSB1_AMAS3_GRVW8_IU2_NLCB1_SIA2_SU32_SUS256_SVW2_TT2_32_VW2_WGM4
    SolutionIndex: 116
    SolutionNameMin: Cijk_Alik_Bjlk_HHS_BH_MT64x64x32_MI16x16x16x1_SN_1LDSB0_AMAS3_GRVW8_IU1_NLCB1_SIA3_SU32_SUS256_SVW2_TT2_32_VW2_WGM4
    SolutionIndex: 117
    SolutionNameMin: Cijk_Alik_Bjlk_HHS_BH_MT64x64x32_MI16x16x16x1_SN_1LDSB0_AMAS3_GRVW4_IU1_NLCB1_SIA1_SU0_SUS0_SVW2_TT2_32_VW2_WGM8
    SolutionIndex: 118
    SolutionNameMin: Cijk_Alik_Bjlk_HHS_BH_MT64x64x32_MI16x16x16x1_SN_1LDSB0_AMAS0_GRVW8_IU1_NLCB1_SIA1_SU0_SUS0_SVW1_TT2_32_VW1_WGM8
    SolutionIndex: 119
    SolutionNameMin: Cijk_Alik_Bjlk_HHS_BH_MT64x64x32_MI16x16x16x1_SN_1LDSB0_AMAS3_GRVW8_IU1_NLCB1_SIA1_SU0_SUS0_SVW2_TT2_32_VW2_WGM8
    SolutionIndex: 120
    SolutionNameMin: Cijk_Alik_Bjlk_HHS_BH_MT64x64x32_MI16x16x16x1_SN_1LDSB1_AMAS0_GRVW4_IU2_NLCB1_SIA2_SU0_SUS0_SVW1_TT2_32_VW1_WGM8
    SolutionIndex: 121
    SolutionNameMin: Cijk_Alik_Bjlk_HHS_BH_MT64x64x32_MI16x16x16x1_SN_1LDSB1_AMAS3_GRVW4_IU2_NLCB1_SIA2_SU0_SUS0_SVW2_TT2_32_VW2_WGM8
    SolutionIndex: 122
    SolutionNameMin: Cijk_Alik_Bjlk_HHS_BH_MT64x64x32_MI16x16x16x1_SN_1LDSB1_AMAS0_GRVW8_IU2_NLCB1_SIA2_SU0_SUS0_SVW1_TT2_32_VW1_WGM8
    SolutionIndex: 123
    SolutionNameMin: Cijk_Alik_Bjlk_HHS_BH_MT64x64x32_MI16x16x16x1_SN_1LDSB1_AMAS3_GRVW8_IU2_NLCB1_SIA2_SU0_SUS0_SVW2_TT2_32_VW2_WGM8
    SolutionIndex: 124
    SolutionNameMin: Cijk_Alik_Bjlk_HHS_BH_MT64x64x32_MI16x16x16x1_SN_1LDSB0_AMAS0_GRVW8_IU1_NLCB1_SIA3_SU0_SUS0_SVW1_TT2_32_VW1_WGM8
    SolutionIndex: 125
    SolutionNameMin: Cijk_Alik_Bjlk_HHS_BH_MT64x64x32_MI16x16x16x1_SN_1LDSB0_AMAS3_GRVW8_IU1_NLCB1_SIA3_SU0_SUS0_SVW2_TT2_32_VW2_WGM8
    SolutionIndex: 126
    SolutionNameMin: Cijk_Alik_Bjlk_HHS_BH_MT64x64x32_MI16x16x16x1_SN_1LDSB0_AMAS3_GRVW8_IU1_NLCB1_SIA1_SU32_SUS128_SVW2_TT2_32_VW2_WGM8
    SolutionIndex: 127
    SolutionNameMin: Cijk_Alik_Bjlk_HHS_BH_MT64x64x32_MI16x16x16x1_SN_1LDSB1_AMAS0_GRVW4_IU2_NLCB1_SIA2_SU32_SUS128_SVW1_TT2_32_VW1_WGM8
    SolutionIndex: 128
    SolutionNameMin: Cijk_Alik_Bjlk_HHS_BH_MT64x64x32_MI16x16x16x1_SN_1LDSB1_AMAS3_GRVW4_IU2_NLCB1_SIA2_SU32_SUS128_SVW2_TT2_32_VW2_WGM8
    SolutionIndex: 129
    SolutionNameMin: Cijk_Alik_Bjlk_HHS_BH_MT64x64x32_MI16x16x16x1_SN_1LDSB1_AMAS0_GRVW8_IU2_NLCB1_SIA2_SU32_SUS128_SVW1_TT2_32_VW1_WGM8
    SolutionIndex: 130
    SolutionNameMin: Cijk_Alik_Bjlk_HHS_BH_MT64x64x32_MI16x16x16x1_SN_1LDSB1_AMAS3_GRVW8_IU2_NLCB1_SIA2_SU32_SUS128_SVW2_TT2_32_VW2_WGM8
    SolutionIndex: 131
    SolutionNameMin: Cijk_Alik_Bjlk_HHS_BH_MT64x64x32_MI16x16x16x1_SN_1LDSB0_AMAS3_GRVW8_IU1_NLCB1_SIA3_SU32_SUS128_SVW2_TT2_32_VW2_WGM8
    SolutionIndex: 132
    SolutionNameMin: Cijk_Alik_Bjlk_HHS_BH_MT64x64x32_MI16x16x16x1_SN_1LDSB0_AMAS3_GRVW4_IU1_NLCB1_SIA1_SU32_SUS256_SVW2_TT2_32_VW2_WGM8
    SolutionIndex: 133
    SolutionNameMin: Cijk_Alik_Bjlk_HHS_BH_MT64x64x32_MI16x16x16x1_SN_1LDSB1_AMAS3_GRVW4_IU2_NLCB1_SIA2_SU32_SUS256_SVW2_TT2_32_VW2_WGM8
    SolutionIndex: 134
    SolutionNameMin: Cijk_Alik_Bjlk_HHS_BH_MT64x64x32_MI16x16x16x1_SN_1LDSB1_AMAS0_GRVW8_IU2_NLCB1_SIA2_SU32_SUS256_SVW1_TT2_32_VW1_WGM8
    SolutionIndex: 135
    SolutionNameMin: Cijk_Alik_Bjlk_HHS_BH_MT64x64x32_MI16x16x16x1_SN_1LDSB1_AMAS3_GRVW8_IU2_NLCB1_SIA2_SU32_SUS256_SVW2_TT2_32_VW2_WGM8
    SolutionIndex: 136
    SolutionNameMin: Cijk_Alik_Bjlk_HHS_BH_MT64x64x32_MI16x16x16x1_SN_1LDSB0_AMAS0_GRVW8_IU1_NLCB1_SIA3_SU32_SUS256_SVW1_TT2_32_VW1_WGM8
    SolutionIndex: 137
    SolutionNameMin: Cijk_Alik_Bjlk_HHS_BH_MT64x64x32_MI16x16x16x1_SN_1LDSB0_AMAS3_GRVW8_IU1_NLCB1_SIA3_SU32_SUS256_SVW2_TT2_32_VW2_WGM8
- - - [64, 64, 1, 64, 96, 96, 96, 96]
    - [1, 0.042]
  - - [64, 64, 1, 128, 96, 96, 160, 160]
    - [89, 0.081]
  - - [64, 64, 1, 256, 96, 96, 288, 288]
    - [94, 0.153]
  - - [64, 64, 1, 512, 96, 96, 544, 544]
    - [83, 0.272]
  - - [64, 64, 1, 1024, 96, 96, 1056, 1056]
    - [94, 0.44]
  - - [64, 64, 1, 2048, 96, 96, 2080, 2080]
    - [82, 0.634]
  - - [64, 64, 1, 4096, 96, 96, 4128, 4128]
    - [94, 0.816]
  - - [64, 64, 1, 8192, 96, 96, 8224, 8224]
    - [77, 0.943]
  - - [64, 128, 1, 64, 96, 96, 96, 128]
    - [90, 0.087]
  - - [64, 128, 1, 128, 96, 96, 160, 160]
    - [99, 0.168]
  - - [64, 128, 1, 256, 96, 96, 288, 288]
    - [89, 0.312]
  - - [64, 128, 1, 512, 96, 96, 544, 544]
    - [94, 0.55]
  - - [64, 128, 1, 1024, 96, 96, 1056, 1056]
    - [83, 0.897]
  - - [64, 128, 1, 2048, 96, 96, 2080, 2080]
    - [93, 1.283]
  - - [64, 128, 1, 4096, 96, 96, 4128, 4128]
    - [79, 1.645]
  - - [64, 128, 1, 8192, 96, 96, 8224, 8224]
    - [94, 1.892]
  - - [64, 256, 1, 64, 96, 96, 96, 256]
    - [100, 0.176]
  - - [64, 256, 1, 128, 96, 96, 160, 256]
    - [2, 0.324]
  - - [64, 256, 1, 256, 96, 96, 288, 288]
    - [82, 0.627]
  - - [64, 256, 1, 512, 96, 96, 544, 544]
    - [89, 1.115]
  - - [64, 256, 1, 1024, 96, 96, 1056, 1056]
    - [98, 1.803]
  - - [64, 256, 1, 2048, 96, 96, 2080, 2080]
    - [98, 2.583]
  - - [64, 256, 1, 4096, 96, 96, 4128, 4128]
    - [97, 3.282]
  - - [64, 256, 1, 8192, 96, 96, 8224, 8224]
    - [87, 3.821]
  - - [64, 512, 1, 64, 96, 96, 96, 512]
    - [128, 0.326]
  - - [64, 512, 1, 128, 96, 96, 160, 512]
    - [89, 0.68]
  - - [64, 512, 1, 256, 96, 96, 288, 512]
    - [99, 1.262]
  - - [64, 512, 1, 512, 96, 96, 544, 544]
    - [88, 2.236]
  - - [64, 512, 1, 1024, 96, 96, 1056, 1056]
    - [82, 3.598]
  - - [64, 512, 1, 2048, 96, 96, 2080, 2080]
    - [79, 5.169]
  - - [64, 512, 1, 4096, 96, 96, 4128, 4128]
    - [79, 6.609]
  - - [64, 512, 1, 8192, 96, 96, 8224, 8224]
    - [92, 7.633]
  - - [64, 1024, 1, 64, 96, 96, 96, 1024]
    - [89, 0.705]
  - - [64, 1024, 1, 128, 96, 96, 160, 1024]
    - [75, 1.336]
  - - [64, 1024, 1, 256, 96, 96, 288, 1024]
    - [77, 2.482]
  - - [64, 1024, 1, 512, 96, 96, 544, 1024]
    - [97, 4.281]
  - - [64, 1024, 1, 1024, 96, 96, 1056, 1056]
    - [93, 6.811]
  - - [64, 1024, 1, 2048, 96, 96, 2080, 2080]
    - [98, 9.566]
  - - [64, 1024, 1, 4096, 96, 96, 4128, 4128]
    - [76, 12.004]
  - - [64, 1024, 1, 8192, 96, 96, 8224, 8224]
    - [77, 13.504]
  - - [64, 2048, 1, 64, 96, 96, 96, 2048]
    - [95, 1.363]
  - - [64, 2048, 1, 128, 96, 96, 160, 2048]
    - [89, 2.584]
  - - [64, 2048, 1, 256, 96, 96, 288, 2048]
    - [91, 4.634]
  - - [64, 2048, 1, 512, 96, 96, 544, 2048]
    - [85, 7.788]
  - - [64, 2048, 1, 1024, 96, 96, 1056, 2048]
    - [85, 11.684]
  - - [64, 2048, 1, 2048, 96, 96, 2080, 2080]
    - [78, 15.552]
  - - [64, 2048, 1, 4096, 96, 96, 4128, 4128]
    - [74, 18.114]
  - - [64, 2048, 1, 8192, 96, 96, 8224, 8224]
    - [74, 20.614]
  - - [64, 4096, 1, 64, 96, 96, 96, 4096]
    - [10, 2.629]
  - - [64, 4096, 1, 128, 96, 96, 160, 4096]
    - [107, 4.872]
  - - [64, 4096, 1, 256, 96, 96, 288, 4096]
    - [107, 8.506]
  - - [64, 4096, 1, 512, 96, 96, 544, 4096]
    - [115, 13.589]
  - - [64, 4096, 1, 1024, 96, 96, 1056, 4096]
    - [123, 19.483]
  - - [64, 4096, 1, 2048, 96, 96, 2080, 4096]
    - [135, 24.814]
  - - [64, 4096, 1, 4096, 96, 96, 4128, 4128]
    - [107, 28.602]
  - - [64, 4096, 1, 8192, 96, 96, 8224, 8224]
    - [122, 25.859]
  - - [64, 8192, 1, 64, 96, 96, 96, 8192]
    - [12, 5.025]
  - - [64, 8192, 1, 128, 96, 96, 160, 8192]
    - [113, 9.089]
  - - [64, 8192, 1, 256, 96, 96, 288, 8192]
    - [13, 15.235]
  - - [64, 8192, 1, 512, 96, 96, 544, 8192]
    - [107, 23.219]
  - - [64, 8192, 1, 1024, 96, 96, 1056, 8192]
    - [107, 31.231]
  - - [64, 8192, 1, 2048, 96, 96, 2080, 8192]
    - [136, 36.676]
  - - [64, 8192, 1, 4096, 96, 96, 4128, 8192]
    - [134, 41.811]
  - - [64, 8192, 1, 8192, 96, 96, 8224, 8224]
    - [135, 35.998]
  - - [128, 64, 1, 64, 160, 160, 96, 96]
    - [5, 0.087]
  - - [128, 64, 1, 128, 160, 160, 160, 160]
    - [89, 0.168]
  - - [128, 64, 1, 256, 160, 160, 288, 288]
    - [79, 0.313]
  - - [128, 64, 1, 512, 160, 160, 544, 544]
    - [98, 0.553]
  - - [128, 64, 1, 1024, 160, 160, 1056, 1056]
    - [88, 0.894]
  - - [128, 64, 1, 2048, 160, 160, 2080, 2080]
    - [88, 1.287]
  - - [128, 64, 1, 4096, 160, 160, 4128, 4128]
    - [93, 1.655]
  - - [128, 64, 1, 8192, 160, 160, 8224, 8224]
    - [79, 1.912]
  - - [128, 128, 1, 64, 160, 160, 96, 128]
    - [74, 0.177]
  - - [128, 128, 1, 128, 160, 160, 160, 160]
    - [88, 0.342]
  - - [128, 128, 1, 256, 160, 160, 288, 288]
    - [89, 0.635]
  - - [128, 128, 1, 512, 160, 160, 544, 544]
    - [89, 1.118]
  - - [128, 128, 1, 1024, 160, 160, 1056, 1056]
    - [83, 1.804]
  - - [128, 128, 1, 2048, 160, 160, 2080, 2080]
    - [88, 2.585]
  - - [128, 128, 1, 4096, 160, 160, 4128, 4128]
    - [93, 3.329]
  - - [128, 128, 1, 8192, 160, 160, 8224, 8224]
    - [97, 3.839]
  - - [128, 256, 1, 64, 160, 160, 96, 256]
    - [89, 0.356]
  - - [128, 256, 1, 128, 160, 160, 160, 256]
    - [76, 0.684]
  - - [128, 256, 1, 256, 160, 160, 288, 288]
    - [98, 1.279]
  - - [128, 256, 1, 512, 160, 160, 544, 544]
    - [88, 2.241]
  - - [128, 256, 1, 1024, 160, 160, 1056, 1056]
    - [98, 3.637]
  - - [128, 256, 1, 2048, 160, 160, 2080, 2080]
    - [81, 5.169]
  - - [128, 256, 1, 4096, 160, 160, 4128, 4128]
    - [82, 6.637]
  - - [128, 256, 1, 8192, 160, 160, 8224, 8224]
    - [98, 7.659]
  - - [128, 512, 1, 64, 160, 160, 96, 512]
    - [99, 0.7]
  - - [128, 512, 1, 128, 160, 160, 160, 512]
    - [77, 1.334]
  - - [128, 512, 1, 256, 160, 160, 288, 512]
    - [94, 2.471]
  - - [128, 512, 1, 512, 160, 160, 544, 544]
    - [83, 4.299]
  - - [128, 512, 1, 1024, 160, 160, 1056, 1056]
    - [76, 6.801]
  - - [128, 512, 1, 2048, 160, 160, 2080, 2080]
    - [98, 9.544]
  - - [128, 512, 1, 4096, 160, 160, 4128, 4128]
    - [79, 11.932]
  - - [128, 512, 1, 8192, 160, 160, 8224, 8224]
    - [83, 13.459]
  - - [128, 1024, 1, 64, 160, 160, 96, 1024]
    - [77, 1.357]
  - - [128, 1024, 1, 128, 160, 160, 160, 1024]
    - [89, 2.582]
  - - [128, 1024, 1, 256, 160, 160, 288, 1024]
    - [74, 4.621]
  - - [128, 1024, 1, 512, 160, 160, 544, 1024]
    - [74, 7.714]
  - - [128, 1024, 1, 1024, 160, 160, 1056, 1056]
    - [85, 11.751]
  - - [128, 1024, 1, 2048, 160, 160, 2080, 2080]
    - [86, 15.773]
  - - [128, 1024, 1, 4096, 160, 160, 4128, 4128]
    - [84, 18.264]
  - - [128, 1024, 1, 8192, 160, 160, 8224, 8224]
    - [85, 21.162]
  - - [128, 2048, 1, 64, 160, 160, 96, 2048]
    - [17, 2.645]
  - - [128, 2048, 1, 128, 160, 160, 160, 2048]
    - [16, 4.888]
  - - [128, 2048, 1, 256, 160, 160, 288, 2048]
    - [107, 8.497]
  - - [128, 2048, 1, 512, 160, 160, 544, 2048]
    - [104, 13.56]
  - - [128, 2048, 1, 1024, 160, 160, 1056, 2048]
    - [119, 19.472]
  - - [128, 2048, 1, 2048, 160, 160, 2080, 2080]
    - [123, 24.721]
  - - [128, 2048, 1, 4096, 160, 160, 4128, 4128]
    - [112, 28.381]
  - - [128, 2048, 1, 8192, 160, 160, 8224, 8224]
    - [127, 28.942]
  - - [128, 4096, 1, 64, 160, 160, 96, 4096]
    - [109, 5.06]
  - - [128, 4096, 1, 128, 160, 160, 160, 4096]
    - [131, 9.115]
  - - [128, 4096, 1, 256, 160, 160, 288, 4096]
    - [107, 15.405]
  - - [128, 4096, 1, 512, 160, 160, 544, 4096]
    - [113, 23.332]
  - - [128, 4096, 1, 1024, 160, 160, 1056, 4096]
    - [105, 31.228]
  - - [128, 4096, 1, 2048, 160, 160, 2080, 4096]
    - [9, 37.321]
  - - [128, 4096, 1, 4096, 160, 160, 4128, 4128]
    - [113, 42.094]
  - - [128, 4096, 1, 8192, 160, 160, 8224, 8224]
    - [129, 40.989]
  - - [128, 8192, 1, 64, 160, 160, 96, 8192]
    - [21, 8.756]
  - - [128, 8192, 1, 128, 160, 160, 160, 8192]
    - [53, 15.079]
  - - [128, 8192, 1, 256, 160, 160, 288, 8192]
    - [31, 24.03]
  - - [128, 8192, 1, 512, 160, 160, 544, 8192]
    - [31, 34.805]
  - - [128, 8192, 1, 1024, 160, 160, 1056, 8192]
    - [31, 43.955]
  - - [128, 8192, 1, 2048, 160, 160, 2080, 8192]
    - [62, 50.631]
  - - [128, 8192, 1, 4096, 160, 160, 4128, 8192]
    - [70, 52.242]
  - - [128, 8192, 1, 8192, 160, 160, 8224, 8224]
    - [29, 47.485]
  - - [256, 64, 1, 64, 288, 288, 96, 96]
    - [4, 0.176]
  - - [256, 64, 1, 128, 288, 288, 160, 160]
    - [77, 0.339]
  - - [256, 64, 1, 256, 288, 288, 288, 288]
    - [76, 0.633]
  - - [256, 64, 1, 512, 288, 288, 544, 544]
    - [83, 1.118]
  - - [256, 64, 1, 1024, 288, 288, 1056, 1056]
    - [80, 1.797]
  - - [256, 64, 1, 2048, 288, 288, 2080, 2080]
    - [97, 2.573]
  - - [256, 64, 1, 4096, 288, 288, 4128, 4128]
    - [82, 3.312]
  - - [256, 64, 1, 8192, 288, 288, 8224, 8224]
    - [76, 3.822]
  - - [256, 128, 1, 64, 288, 288, 96, 128]
    - [77, 0.354]
  - - [256, 128, 1, 128, 288, 288, 160, 160]
    - [93, 0.686]
  - - [256, 128, 1, 256, 288, 288, 288, 288]
    - [89, 1.275]
  - - [256, 128, 1, 512, 288, 288, 544, 544]
    - [93, 2.236]
  - - [256, 128, 1, 1024, 288, 288, 1056, 1056]
    - [7, 2.922]
  - - [256, 128, 1, 2048, 288, 288, 2080, 2080]
    - [93, 5.197]
  - - [256, 128, 1, 4096, 288, 288, 4128, 4128]
    - [82, 6.649]
  - - [256, 128, 1, 8192, 288, 288, 8224, 8224]
    - [88, 7.682]
  - - [256, 256, 1, 64, 288, 288, 96, 256]
    - [89, 0.702]
  - - [256, 256, 1, 128, 288, 288, 160, 256]
    - [83, 1.349]
  - - [256, 256, 1, 256, 288, 288, 288, 288]
    - [93, 2.483]
  - - [256, 256, 1, 512, 288, 288, 544, 544]
    - [82, 4.29]
  - - [256, 256, 1, 1024, 288, 288, 1056, 1056]
    - [3, 5.752]
  - - [256, 256, 1, 2048, 288, 288, 2080, 2080]
    - [79, 9.514]
  - - [256, 256, 1, 4096, 288, 288, 4128, 4128]
    - [80, 11.902]
  - - [256, 256, 1, 8192, 288, 288, 8224, 8224]
    - [76, 13.413]
  - - [256, 512, 1, 64, 288, 288, 96, 512]
    - [96, 1.364]
  - - [256, 512, 1, 128, 288, 288, 160, 512]
    - [94, 2.586]
  - - [256, 512, 1, 256, 288, 288, 288, 512]
    - [91, 4.631]
  - - [256, 512, 1, 512, 288, 288, 544, 544]
    - [85, 7.8]
  - - [256, 512, 1, 1024, 288, 288, 1056, 1056]
    - [85, 11.767]
  - - [256, 512, 1, 2048, 288, 288, 2080, 2080]
    - [86, 15.646]
  - - [256, 512, 1, 4096, 288, 288, 4128, 4128]
    - [73, 18.392]
  - - [256, 512, 1, 8192, 288, 288, 8224, 8224]
    - [73, 21.392]
  - - [256, 1024, 1, 64, 288, 288, 96, 1024]
    - [107, 2.622]
  - - [256, 1024, 1, 128, 288, 288, 160, 1024]
    - [16, 4.857]
  - - [256, 1024, 1, 256, 288, 288, 288, 1024]
    - [114, 8.516]
  - - [256, 1024, 1, 512, 288, 288, 544, 1024]
    - [101, 13.617]
  - - [256, 1024, 1, 1024, 288, 288, 1056, 1056]
    - [104, 19.635]
  - - [256, 1024, 1, 2048, 288, 288, 2080, 2080]
    - [101, 25.013]
  - - [256, 1024, 1, 4096, 288, 288, 4128, 4128]
    - [103, 28.361]
  - - [256, 1024, 1, 8192, 288, 288, 8224, 8224]
    - [102, 31.374]
  - - [256, 2048, 1, 64, 288, 288, 96, 2048]
    - [16, 5.047]
  - - [256, 2048, 1, 128, 288, 288, 160, 2048]
    - [13, 9.125]
  - - [256, 2048, 1, 256, 288, 288, 288, 2048]
    - [9, 15.329]
  - - [256, 2048, 1, 512, 288, 288, 544, 2048]
    - [9, 23.368]
  - - [256, 2048, 1, 1024, 288, 288, 1056, 2048]
    - [8, 31.368]
  - - [256, 2048, 1, 2048, 288, 288, 2080, 2080]
    - [113, 37.637]
  - - [256, 2048, 1, 4096, 288, 288, 4128, 4128]
    - [109, 42.094]
  - - [256, 2048, 1, 8192, 288, 288, 8224, 8224]
    - [108, 43.467]
  - - [256, 4096, 1, 64, 288, 288, 96, 4096]
    - [21, 8.741]
  - - [256, 4096, 1, 128, 288, 288, 160, 4096]
    - [31, 15.017]
  - - [256, 4096, 1, 256, 288, 288, 288, 4096]
    - [31, 24.116]
  - - [256, 4096, 1, 512, 288, 288, 544, 4096]
    - [45, 34.537]
  - - [256, 4096, 1, 1024, 288, 288, 1056, 4096]
    - [45, 43.062]
  - - [256, 4096, 1, 2048, 288, 288, 2080, 4096]
    - [31, 50.54]
  - - [256, 4096, 1, 4096, 288, 288, 4128, 4128]
    - [39, 52.412]
  - - [256, 4096, 1, 8192, 288, 288, 8224, 8224]
    - [106, 46.91]
  - - [256, 8192, 1, 64, 288, 288, 96, 8192]
    - [41, 14.704]
  - - [256, 8192, 1, 128, 288, 288, 160, 8192]
    - [56, 24.556]
  - - [256, 8192, 1, 256, 288, 288, 288, 8192]
    - [56, 36.298]
  - - [256, 8192, 1, 512, 288, 288, 544, 8192]
    - [35, 48.159]
  - - [256, 8192, 1, 1024, 288, 288, 1056, 8192]
    - [64, 57.224]
  - - [256, 8192, 1, 2048, 288, 288, 2080, 8192]
    - [41, 59.752]
  - - [256, 8192, 1, 4096, 288, 288, 4128, 8192]
    - [34, 64.442]
  - - [256, 8192, 1, 8192, 288, 288, 8224, 8224]
    - [41, 66.642]
  - - [384, 64, 1, 64, 416, 416, 96, 96]
    - [0, 0.266]
  - - [384, 64, 1, 128, 416, 416, 160, 160]
    - [89, 0.512]
  - - [384, 64, 1, 256, 416, 416, 288, 288]
    - [82, 0.95]
  - - [384, 64, 1, 512, 416, 416, 544, 544]
    - [83, 1.664]
  - - [384, 64, 1, 1024, 416, 416, 1056, 1056]
    - [93, 2.693]
  - - [384, 64, 1, 2048, 416, 416, 2080, 2080]
    - [98, 3.87]
  - - [384, 64, 1, 4096, 416, 416, 4128, 4128]
    - [82, 4.94]
  - - [384, 64, 1, 8192, 416, 416, 8224, 8224]
    - [93, 5.703]
  - - [384, 128, 1, 64, 416, 416, 96, 128]
    - [98, 0.532]
  - - [384, 128, 1, 128, 416, 416, 160, 160]
    - [75, 1.029]
  - - [384, 128, 1, 256, 416, 416, 288, 288]
    - [77, 1.927]
  - - [384, 128, 1, 512, 416, 416, 544, 544]
    - [94, 3.361]
  - - [384, 128, 1, 1024, 416, 416, 1056, 1056]
    - [82, 5.448]
  - - [384, 128, 1, 2048, 416, 416, 2080, 2080]
    - [93, 7.837]
  - - [384, 128, 1, 4096, 416, 416, 4128, 4128]
    - [93, 10.041]
  - - [384, 128, 1, 8192, 416, 416, 8224, 8224]
    - [88, 11.551]
  - - [384, 256, 1, 64, 416, 416, 96, 256]
    - [83, 1.055]
  - - [384, 256, 1, 128, 416, 416, 160, 256]
    - [89, 2.008]
  - - [384, 256, 1, 256, 416, 416, 288, 288]
    - [94, 3.73]
  - - [384, 256, 1, 512, 416, 416, 544, 544]
    - [6, 5.797]
  - - [384, 256, 1, 1024, 416, 416, 1056, 1056]
    - [80, 10.157]
  - - [384, 256, 1, 2048, 416, 416, 2080, 2080]
    - [88, 14.2]
  - - [384, 256, 1, 4096, 416, 416, 4128, 4128]
    - [76, 17.771]
  - - [384, 256, 1, 8192, 416, 416, 8224, 8224]
    - [80, 20.068]
  - - [384, 512, 1, 64, 416, 416, 96, 512]
    - [135, 2.026]
  - - [384, 512, 1, 128, 416, 416, 160, 512]
    - [107, 3.813]
  - - [384, 512, 1, 256, 416, 416, 288, 512]
    - [115, 6.809]
  - - [384, 512, 1, 512, 416, 416, 544, 544]
    - [107, 11.206]
  - - [384, 512, 1, 1024, 416, 416, 1056, 1056]
    - [107, 16.616]
  - - [384, 512, 1, 2048, 416, 416, 2080, 2080]
    - [121, 21.752]
  - - [384, 512, 1, 4096, 416, 416, 4128, 4128]
    - [123, 25.747]
  - - [384, 512, 1, 8192, 416, 416, 8224, 8224]
    - [134, 28.123]
  - - [384, 1024, 1, 64, 416, 416, 96, 1024]
    - [10, 3.883]
  - - [384, 1024, 1, 128, 416, 416, 160, 1024]
    - [20, 7.246]
  - - [384, 1024, 1, 256, 416, 416, 288, 1024]
    - [123, 12.72]
  - - [384, 1024, 1, 512, 416, 416, 544, 1024]
    - [107, 20.393]
  - - [384, 1024, 1, 1024, 416, 416, 1056, 1056]
    - [123, 28.754]
  - - [384, 1024, 1, 2048, 416, 416, 2080, 2080]
    - [117, 36.549]
  - - [384, 1024, 1, 4096, 416, 416, 4128, 4128]
    - [106, 41.524]
  - - [384, 1024, 1, 8192, 416, 416, 8224, 8224]
    - [117, 45.433]
  - - [384, 2048, 1, 64, 416, 416, 96, 2048]
    - [109, 7.174]
  - - [384, 2048, 1, 128, 416, 416, 160, 2048]
    - [135, 12.628]
  - - [384, 2048, 1, 256, 416, 416, 288, 2048]
    - [107, 20.654]
  - - [384, 2048, 1, 512, 416, 416, 544, 2048]
    - [123, 30.104]
  - - [384, 2048, 1, 1024, 416, 416, 1056, 2048]
    - [123, 38.85]
  - - [384, 2048, 1, 2048, 416, 416, 2080, 2080]
    - [124, 44.47]
  - - [384, 2048, 1, 4096, 416, 416, 4128, 4128]
    - [125, 49.716]
  - - [384, 2048, 1, 8192, 416, 416, 8224, 8224]
    - [108, 51.012]
  - - [384, 4096, 1, 64, 416, 416, 96, 4096]
    - [37, 11.921]
  - - [384, 4096, 1, 128, 416, 416, 160, 4096]
    - [44, 20.914]
  - - [384, 4096, 1, 256, 416, 416, 288, 4096]
    - [58, 33.675]
  - - [384, 4096, 1, 512, 416, 416, 544, 4096]
    - [69, 48.496]
  - - [384, 4096, 1, 1024, 416, 416, 1056, 4096]
    - [29, 61.507]
  - - [384, 4096, 1, 2048, 416, 416, 2080, 4096]
    - [38, 72.715]
  - - [384, 4096, 1, 4096, 416, 416, 4128, 4128]
    - [30, 74.605]
  - - [384, 4096, 1, 8192, 416, 416, 8224, 8224]
    - [40, 54.898]
  - - [384, 8192, 1, 64, 416, 416, 96, 8192]
    - [28, 21.047]
  - - [384, 8192, 1, 128, 416, 416, 160, 8192]
    - [28, 33.253]
  - - [384, 8192, 1, 256, 416, 416, 288, 8192]
    - [52, 47.504]
  - - [384, 8192, 1, 512, 416, 416, 544, 8192]
    - [35, 60.605]
  - - [384, 8192, 1, 1024, 416, 416, 1056, 8192]
    - [41, 70.513]
  - - [384, 8192, 1, 2048, 416, 416, 2080, 8192]
    - [41, 72.721]
  - - [384, 8192, 1, 4096, 416, 416, 4128, 8192]
    - [63, 76.931]
  - - [384, 8192, 1, 8192, 416, 416, 8224, 8224]
    - [41, 67.291]
  - - [768, 64, 1, 64, 800, 800, 96, 96]
    - [3, 0.509]
  - - [768, 64, 1, 128, 800, 800, 160, 160]
    - [88, 1.021]
  - - [768, 64, 1, 256, 800, 800, 288, 288]
    - [77, 1.916]
  - - [768, 64, 1, 512, 800, 800, 544, 544]
    - [92, 3.336]
  - - [768, 64, 1, 1024, 800, 800, 1056, 1056]
    - [93, 5.377]
  - - [768, 64, 1, 2048, 800, 800, 2080, 2080]
    - [76, 7.722]
  - - [768, 64, 1, 4096, 800, 800, 4128, 4128]
    - [81, 9.78]
  - - [768, 64, 1, 8192, 800, 800, 8224, 8224]
    - [88, 11.345]
  - - [768, 128, 1, 64, 800, 800, 96, 128]
    - [89, 1.052]
  - - [768, 128, 1, 128, 800, 800, 160, 160]
    - [89, 2.01]
  - - [768, 128, 1, 256, 800, 800, 288, 288]
    - [94, 3.714]
  - - [768, 128, 1, 512, 800, 800, 544, 544]
    - [98, 6.399]
  - - [768, 128, 1, 1024, 800, 800, 1056, 1056]
    - [88, 10.115]
  - - [768, 128, 1, 2048, 800, 800, 2080, 2080]
    - [89, 14.197]
  - - [768, 128, 1, 4096, 800, 800, 4128, 4128]
    - [76, 17.753]
  - - [768, 128, 1, 8192, 800, 800, 8224, 8224]
    - [75, 19.958]
  - - [768, 256, 1, 64, 800, 800, 96, 256]
    - [80, 2.035]
  - - [768, 256, 1, 128, 800, 800, 160, 256]
    - [113, 3.83]
  - - [768, 256, 1, 256, 800, 800, 288, 288]
    - [115, 6.773]
  - - [768, 256, 1, 512, 800, 800, 544, 544]
    - [130, 11.185]
  - - [768, 256, 1, 1024, 800, 800, 1056, 1056]
    - [123, 16.576]
  - - [768, 256, 1, 2048, 800, 800, 2080, 2080]
    - [130, 21.785]
  - - [768, 256, 1, 4096, 800, 800, 4128, 4128]
    - [107, 25.339]
  - - [768, 256, 1, 8192, 800, 800, 8224, 8224]
    - [106, 28.362]
  - - [768, 512, 1, 64, 800, 800, 96, 512]
    - [119, 3.901]
  - - [768, 512, 1, 128, 800, 800, 160, 512]
    - [132, 7.193]
  - - [768, 512, 1, 256, 800, 800, 288, 512]
    - [126, 12.705]
  - - [768, 512, 1, 512, 800, 800, 544, 544]
    - [117, 20.317]
  - - [768, 512, 1, 1024, 800, 800, 1056, 1056]
    - [117, 29.292]
  - - [768, 512, 1, 2048, 800, 800, 2080, 2080]
    - [117, 37.481]
  - - [768, 512, 1, 4096, 800, 800, 4128, 4128]
    - [117, 42.039]
  - - [768, 512, 1, 8192, 800, 800, 8224, 8224]
    - [117, 46.718]
  - - [768, 1024, 1, 64, 800, 800, 96, 1024]
    - [137, 7.146]
  - - [768, 1024, 1, 128, 800, 800, 160, 1024]
    - [109, 12.666]
  - - [768, 1024, 1, 256, 800, 800, 288, 1024]
    - [109, 20.698]
  - - [768, 1024, 1, 512, 800, 800, 544, 1024]
    - [109, 30.039]
  - - [768, 1024, 1, 1024, 800, 800, 1056, 1056]
    - [109, 38.832]
  - - [768, 1024, 1, 2048, 800, 800, 2080, 2080]
    - [108, 45.471]
  - - [768, 1024, 1, 4096, 800, 800, 4128, 4128]
    - [109, 49.916]
  - - [768, 1024, 1, 8192, 800, 800, 8224, 8224]
    - [125, 51.151]
  - - [768, 2048, 1, 64, 800, 800, 96, 2048]
    - [43, 11.816]
  - - [768, 2048, 1, 128, 800, 800, 160, 2048]
    - [58, 20.876]
  - - [768, 2048, 1, 256, 800, 800, 288, 2048]
    - [61, 33.72]
  - - [768, 2048, 1, 512, 800, 800, 544, 2048]
    - [37, 49.423]
  - - [768, 2048, 1, 1024, 800, 800, 1056, 2048]
    - [43, 61.433]
  - - [768, 2048, 1, 2048, 800, 800, 2080, 2080]
    - [52, 69.55]
  - - [768, 2048, 1, 4096, 800, 800, 4128, 4128]
    - [51, 73.927]
  - - [768, 2048, 1, 8192, 800, 800, 8224, 8224]
    - [43, 77.046]
  - - [768, 4096, 1, 64, 800, 800, 96, 4096]
    - [25, 19.247]
  - - [768, 4096, 1, 128, 800, 800, 160, 4096]
    - [61, 33.594]
  - - [768, 4096, 1, 256, 800, 800, 288, 4096]
    - [61, 48.655]
  - - [768, 4096, 1, 512, 800, 800, 544, 4096]
    - [28, 61.669]
  - - [768, 4096, 1, 1024, 800, 800, 1056, 4096]
    - [52, 71.283]
  - - [768, 4096, 1, 2048, 800, 800, 2080, 4096]
    - [52, 73.499]
  - - [768, 4096, 1, 4096, 800, 800, 4128, 4128]
    - [49, 76.972]
  - - [768, 4096, 1, 8192, 800, 800, 8224, 8224]
    - [64, 60.989]
  - - [768, 8192, 1, 64, 800, 800, 96, 8192]
    - [28, 30.534]
  - - [768, 8192, 1, 128, 800, 800, 160, 8192]
    - [69, 44.66]
  - - [768, 8192, 1, 256, 800, 800, 288, 8192]
    - [25, 58.721]
  - - [768, 8192, 1, 512, 800, 800, 544, 8192]
    - [28, 68.389]
  - - [768, 8192, 1, 1024, 800, 800, 1056, 8192]
    - [28, 73.729]
  - - [768, 8192, 1, 2048, 800, 800, 2080, 8192]
    - [48, 78.293]
  - - [768, 8192, 1, 4096, 800, 800, 4128, 8192]
    - [24, 73.797]
  - - [768, 8192, 1, 8192, 800, 800, 8224, 8224]
    - [23, 61.589]
  - - [1536, 64, 1, 64, 1568, 1568, 96, 96]
    - [94, 0.994]
  - - [1536, 64, 1, 128, 1568, 1568, 160, 160]
    - [80, 2.0]
  - - [1536, 64, 1, 256, 1568, 1568, 288, 288]
    - [82, 3.722]
  - - [1536, 64, 1, 512, 1568, 1568, 544, 544]
    - [93, 6.421]
  - - [1536, 64, 1, 1024, 1568, 1568, 1056, 1056]
    - [76, 10.123]
  - - [1536, 64, 1, 2048, 1568, 1568, 2080, 2080]
    - [76, 14.165]
  - - [1536, 64, 1, 4096, 1568, 1568, 4128, 4128]
    - [98, 17.666]
  - - [1536, 64, 1, 8192, 1568, 1568, 8224, 8224]
    - [76, 20.024]
  - - [1536, 128, 1, 64, 1568, 1568, 96, 128]
    - [104, 2.021]
  - - [1536, 128, 1, 128, 1568, 1568, 160, 160]
    - [123, 3.812]
  - - [1536, 128, 1, 256, 1568, 1568, 288, 288]
    - [133, 6.777]
  - - [1536, 128, 1, 512, 1568, 1568, 544, 544]
    - [115, 11.221]
  - - [1536, 128, 1, 1024, 1568, 1568, 1056, 1056]
    - [133, 16.5]
  - - [1536, 128, 1, 2048, 1568, 1568, 2080, 2080]
    - [130, 21.671]
  - - [1536, 128, 1, 4096, 1568, 1568, 4128, 4128]
    - [134, 25.359]
  - - [1536, 128, 1, 8192, 1568, 1568, 8224, 8224]
    - [135, 28.288]
  - - [1536, 256, 1, 64, 1568, 1568, 96, 256]
    - [14, 3.88]
  - - [1536, 256, 1, 128, 1568, 1568, 160, 256]
    - [119, 7.192]
  - - [1536, 256, 1, 256, 1568, 1568, 288, 288]
    - [104, 12.692]
  - - [1536, 256, 1, 512, 1568, 1568, 544, 544]
    - [119, 20.291]
  - - [1536, 256, 1, 1024, 1568, 1568, 1056, 1056]
    - [102, 29.143]
  - - [1536, 256, 1, 2048, 1568, 1568, 2080, 2080]
    - [118, 36.924]
  - - [1536, 256, 1, 4096, 1568, 1568, 4128, 4128]
    - [110, 42.657]
  - - [1536, 256, 1, 8192, 1568, 1568, 8224, 8224]
    - [110, 43.347]
  - - [1536, 512, 1, 64, 1568, 1568, 96, 512]
    - [135, 7.128]
  - - [1536, 512, 1, 128, 1568, 1568, 160, 512]
    - [123, 12.72]
  - - [1536, 512, 1, 256, 1568, 1568, 288, 512]
    - [131, 20.617]
  - - [1536, 512, 1, 512, 1568, 1568, 544, 544]
    - [107, 30.057]
  - - [1536, 512, 1, 1024, 1568, 1568, 1056, 1056]
    - [107, 39.094]
  - - [1536, 512, 1, 2048, 1568, 1568, 2080, 2080]
    - [108, 44.289]
  - - [1536, 512, 1, 4096, 1568, 1568, 4128, 4128]
    - [109, 49.657]
  - - [1536, 512, 1, 8192, 1568, 1568, 8224, 8224]
    - [125, 50.805]
  - - [1536, 1024, 1, 64, 1568, 1568, 96, 1024]
    - [43, 11.715]
  - - [1536, 1024, 1, 128, 1568, 1568, 160, 1024]
    - [61, 20.694]
  - - [1536, 1024, 1, 256, 1568, 1568, 288, 1024]
    - [37, 33.465]
  - - [1536, 1024, 1, 512, 1568, 1568, 544, 1024]
    - [37, 48.992]
  - - [1536, 1024, 1, 1024, 1568, 1568, 1056, 1056]
    - [42, 61.328]
  - - [1536, 1024, 1, 2048, 1568, 1568, 2080, 2080]
    - [25, 72.014]
  - - [1536, 1024, 1, 4096, 1568, 1568, 4128, 4128]
    - [25, 75.428]
  - - [1536, 1024, 1, 8192, 1568, 1568, 8224, 8224]
    - [54, 81.55]
  - - [1536, 2048, 1, 64, 1568, 1568, 96, 2048]
    - [25, 19.159]
  - - [1536, 2048, 1, 128, 1568, 1568, 160, 2048]
    - [69, 33.443]
  - - [1536, 2048, 1, 256, 1568, 1568, 288, 2048]
    - [28, 48.093]
  - - [1536, 2048, 1, 512, 1568, 1568, 544, 2048]
    - [28, 61.775]
  - - [1536, 2048, 1, 1024, 1568, 1568, 1056, 2048]
    - [28, 71.46]
  - - [1536, 2048, 1, 2048, 1568, 1568, 2080, 2080]
    - [35, 73.537]
  - - [1536, 2048, 1, 4096, 1568, 1568, 4128, 4128]
    - [28, 78.549]
  - - [1536, 2048, 1, 8192, 1568, 1568, 8224, 8224]
    - [26, 70.526]
  - - [1536, 4096, 1, 64, 1568, 1568, 96, 4096]
    - [28, 30.664]
  - - [1536, 4096, 1, 128, 1568, 1568, 160, 4096]
    - [43, 45.18]
  - - [1536, 4096, 1, 256, 1568, 1568, 288, 4096]
    - [25, 59.214]
  - - [1536, 4096, 1, 512, 1568, 1568, 544, 4096]
    - [34, 69.419]
  - - [1536, 4096, 1, 1024, 1568, 1568, 1056, 4096]
    - [28, 74.382]
  - - [1536, 4096, 1, 2048, 1568, 1568, 2080, 4096]
    - [27, 80.616]
  - - [1536, 4096, 1, 4096, 1568, 1568, 4128, 4128]
    - [50, 72.791]
  - - [1536, 4096, 1, 8192, 1568, 1568, 8224, 8224]
    - [61, 64.869]
  - - [1536, 8192, 1, 64, 1568, 1568, 96, 8192]
    - [72, 40.635]
  - - [1536, 8192, 1, 128, 1568, 1568, 160, 8192]
    - [43, 55.66]
  - - [1536, 8192, 1, 256, 1568, 1568, 288, 8192]
    - [28, 68.744]
  - - [1536, 8192, 1, 512, 1568, 1568, 544, 8192]
    - [28, 75.489]
  - - [1536, 8192, 1, 1024, 1568, 1568, 1056, 8192]
    - [24, 81.73]
  - - [1536, 8192, 1, 2048, 1568, 1568, 2080, 8192]
    - [52, 70.817]
  - - [1536, 8192, 1, 4096, 1568, 1568, 4128, 8192]
    - [52, 66.469]
  - - [1536, 8192, 1, 8192, 1568, 1568, 8224, 8224]
    - [27, 66.468]
  - - [3072, 64, 1, 64, 3104, 3104, 96, 96]
    - [77, 1.931]
  - - [3072, 64, 1, 128, 3104, 3104, 160, 160]
    - [135, 3.749]
  - - [3072, 64, 1, 256, 3104, 3104, 288, 288]
    - [115, 6.808]
  - - [3072, 64, 1, 512, 3104, 3104, 544, 544]
    - [105, 11.195]
  - - [3072, 64, 1, 1024, 3104, 3104, 1056, 1056]
    - [105, 16.567]
  - - [3072, 64, 1, 2048, 3104, 3104, 2080, 2080]
    - [123, 21.829]
  - - [3072, 64, 1, 4096, 3104, 3104, 4128, 4128]
    - [107, 25.542]
  - - [3072, 64, 1, 8192, 3104, 3104, 8224, 8224]
    - [113, 28.337]
  - - [3072, 128, 1, 64, 3104, 3104, 96, 128]
    - [15, 3.925]
  - - [3072, 128, 1, 128, 3104, 3104, 160, 160]
    - [21, 7.241]
  - - [3072, 128, 1, 256, 3104, 3104, 288, 288]
    - [11, 12.605]
  - - [3072, 128, 1, 512, 3104, 3104, 544, 544]
    - [107, 20.139]
  - - [3072, 128, 1, 1024, 3104, 3104, 1056, 1056]
    - [115, 28.676]
  - - [3072, 128, 1, 2048, 3104, 3104, 2080, 2080]
    - [128, 36.467]
  - - [3072, 128, 1, 4096, 3104, 3104, 4128, 4128]
    - [107, 41.447]
  - - [3072, 128, 1, 8192, 3104, 3104, 8224, 8224]
    - [120, 43.331]
  - - [3072, 256, 1, 64, 3104, 3104, 96, 256]
    - [19, 7.135]
  - - [3072, 256, 1, 128, 3104, 3104, 160, 256]
    - [113, 12.628]
  - - [3072, 256, 1, 256, 3104, 3104, 288, 288]
    - [107, 20.61]
  - - [3072, 256, 1, 512, 3104, 3104, 544, 544]
    - [107, 29.886]
  - - [3072, 256, 1, 1024, 3104, 3104, 1056, 1056]
    - [109, 38.671]
  - - [3072, 256, 1, 2048, 3104, 3104, 2080, 2080]
    - [113, 45.133]
  - - [3072, 256, 1, 4096, 3104, 3104, 4128, 4128]
    - [108, 49.343]
  - - [3072, 256, 1, 8192, 3104, 3104, 8224, 8224]
    - [123, 50.193]
  - - [3072, 512, 1, 64, 3104, 3104, 96, 512]
    - [32, 11.783]
  - - [3072, 512, 1, 128, 3104, 3104, 160, 512]
    - [53, 20.732]
  - - [3072, 512, 1, 256, 3104, 3104, 288, 512]
    - [25, 33.315]
  - - [3072, 512, 1, 512, 3104, 3104, 544, 544]
    - [25, 48.043]
  - - [3072, 512, 1, 1024, 3104, 3104, 1056, 1056]
    - [27, 61.4]
  - - [3072, 512, 1, 2048, 3104, 3104, 2080, 2080]
    - [24, 70.773]
  - - [3072, 512, 1, 4096, 3104, 3104, 4128, 4128]
    - [55, 76.215]
  - - [3072, 512, 1, 8192, 3104, 3104, 8224, 8224]
    - [32, 81.994]
  - - [3072, 1024, 1, 64, 3104, 3104, 96, 1024]
    - [67, 19.276]
  - - [3072, 1024, 1, 128, 3104, 3104, 160, 1024]
    - [28, 33.509]
  - - [3072, 1024, 1, 256, 3104, 3104, 288, 1024]
    - [28, 48.218]
  - - [3072, 1024, 1, 512, 3104, 3104, 544, 1024]
    - [28, 60.931]
  - - [3072, 1024, 1, 1024, 3104, 3104, 1056, 1056]
    - [35, 70.106]
  - - [3072, 1024, 1, 2048, 3104, 3104, 2080, 2080]
    - [28, 74.095]
  - - [3072, 1024, 1, 4096, 3104, 3104, 4128, 4128]
    - [56, 76.152]
  - - [3072, 1024, 1, 8192, 3104, 3104, 8224, 8224]
    - [60, 69.432]
  - - [3072, 2048, 1, 64, 3104, 3104, 96, 2048]
    - [35, 29.858]
  - - [3072, 2048, 1, 128, 3104, 3104, 160, 2048]
    - [35, 43.669]
  - - [3072, 2048, 1, 256, 3104, 3104, 288, 2048]
    - [34, 56.696]
  - - [3072, 2048, 1, 512, 3104, 3104, 544, 2048]
    - [28, 68.847]
  - - [3072, 2048, 1, 1024, 3104, 3104, 1056, 2048]
    - [28, 74.492]
  - - [3072, 2048, 1, 2048, 3104, 3104, 2080, 2080]
    - [52, 78.856]
  - - [3072, 2048, 1, 4096, 3104, 3104, 4128, 4128]
    - [57, 71.364]
  - - [3072, 2048, 1, 8192, 3104, 3104, 8224, 8224]
    - [50, 66.193]
  - - [3072, 4096, 1, 64, 3104, 3104, 96, 4096]
    - [41, 40.134]
  - - [3072, 4096, 1, 128, 3104, 3104, 160, 4096]
    - [47, 55.312]
  - - [3072, 4096, 1, 256, 3104, 3104, 288, 4096]
    - [35, 66.955]
  - - [3072, 4096, 1, 512, 3104, 3104, 544, 4096]
    - [27, 73.987]
  - - [3072, 4096, 1, 1024, 3104, 3104, 1056, 4096]
    - [48, 74.167]
  - - [3072, 4096, 1, 2048, 3104, 3104, 2080, 4096]
    - [22, 72.685]
  - - [3072, 4096, 1, 4096, 3104, 3104, 4128, 4128]
    - [52, 70.663]
  - - [3072, 4096, 1, 8192, 3104, 3104, 8224, 8224]
    - [51, 66.728]
  - - [3072, 8192, 1, 64, 3104, 3104, 96, 8192]
    - [41, 48.867]
  - - [3072, 8192, 1, 128, 3104, 3104, 160, 8192]
    - [47, 62.493]
  - - [3072, 8192, 1, 256, 3104, 3104, 288, 8192]
    - [50, 70.604]
  - - [3072, 8192, 1, 512, 3104, 3104, 544, 8192]
    - [66, 77.844]
  - - [3072, 8192, 1, 1024, 3104, 3104, 1056, 8192]
    - [56, 67.305]
  - - [3072, 8192, 1, 2048, 3104, 3104, 2080, 8192]
    - [52, 67.444]
  - - [3072, 8192, 1, 4096, 3104, 3104, 4128, 8192]
    - [61, 67.886]
  - - [3072, 8192, 1, 8192, 3104, 3104, 8224, 8224]
    - [24, 67.698]
  - - [6144, 64, 1, 64, 6176, 6176, 96, 96]
    - [90, 3.653]
  - - [6144, 64, 1, 128, 6176, 6176, 160, 160]
    - [11, 7.169]
  - - [6144, 64, 1, 256, 6176, 6176, 288, 288]
    - [135, 12.523]
  - - [6144, 64, 1, 512, 6176, 6176, 544, 544]
    - [121, 19.989]
  - - [6144, 64, 1, 1024, 6176, 6176, 1056, 1056]
    - [123, 28.578]
  - - [6144, 64, 1, 2048, 6176, 6176, 2080, 2080]
    - [107, 36.586]
  - - [6144, 64, 1, 4096, 6176, 6176, 4128, 4128]
    - [133, 41.721]
  - - [6144, 64, 1, 8192, 6176, 6176, 8224, 8224]
    - [106, 43.754]
  - - [6144, 128, 1, 64, 6176, 6176, 96, 128]
    - [18, 6.806]
  - - [6144, 128, 1, 128, 6176, 6176, 160, 160]
    - [116, 12.53]
  - - [6144, 128, 1, 256, 6176, 6176, 288, 288]
    - [107, 20.546]
  - - [6144, 128, 1, 512, 6176, 6176, 544, 544]
    - [107, 29.801]
  - - [6144, 128, 1, 1024, 6176, 6176, 1056, 1056]
    - [123, 38.727]
  - - [6144, 128, 1, 2048, 6176, 6176, 2080, 2080]
    - [130, 45.032]
  - - [6144, 128, 1, 4096, 6176, 6176, 4128, 4128]
    - [105, 49.306]
  - - [6144, 128, 1, 8192, 6176, 6176, 8224, 8224]
    - [111, 50.594]
  - - [6144, 256, 1, 64, 6176, 6176, 96, 256]
    - [17, 12.203]
  - - [6144, 256, 1, 128, 6176, 6176, 160, 256]
    - [31, 21.529]
  - - [6144, 256, 1, 256, 6176, 6176, 288, 288]
    - [28, 33.933]
  - - [6144, 256, 1, 512, 6176, 6176, 544, 544]
    - [52, 48.986]
  - - [6144, 256, 1, 1024, 6176, 6176, 1056, 1056]
    - [28, 61.927]
  - - [6144, 256, 1, 2048, 6176, 6176, 2080, 2080]
    - [32, 70.412]
  - - [6144, 256, 1, 4096, 6176, 6176, 4128, 4128]
    - [31, 76.066]
  - - [6144, 256, 1, 8192, 6176, 6176, 8224, 8224]
    - [25, 61.701]
  - - [6144, 512, 1, 64, 6176, 6176, 96, 512]
    - [50, 20.226]
  - - [6144, 512, 1, 128, 6176, 6176, 160, 512]
    - [28, 32.748]
  - - [6144, 512, 1, 256, 6176, 6176, 288, 512]
    - [71, 45.228]
  - - [6144, 512, 1, 512, 6176, 6176, 544, 544]
    - [52, 57.227]
  - - [6144, 512, 1, 1024, 6176, 6176, 1056, 1056]
    - [28, 68.557]
  - - [6144, 512, 1, 2048, 6176, 6176, 2080, 2080]
    - [28, 73.277]
  - - [6144, 512, 1, 4096, 6176, 6176, 4128, 4128]
    - [28, 76.383]
  - - [6144, 512, 1, 8192, 6176, 6176, 8224, 8224]
    - [24, 66.642]
  - - [6144, 1024, 1, 64, 6176, 6176, 96, 1024]
    - [46, 28.803]
  - - [6144, 1024, 1, 128, 6176, 6176, 160, 1024]
    - [43, 40.449]
  - - [6144, 1024, 1, 256, 6176, 6176, 288, 1024]
    - [28, 55.031]
  - - [6144, 1024, 1, 512, 6176, 6176, 544, 1024]
    - [28, 68.431]
  - - [6144, 1024, 1, 1024, 6176, 6176, 1056, 1056]
    - [28, 74.318]
  - - [6144, 1024, 1, 2048, 6176, 6176, 2080, 2080]
    - [28, 80.597]
  - - [6144, 1024, 1, 4096, 6176, 6176, 4128, 4128]
    - [65, 71.173]
  - - [6144, 1024, 1, 8192, 6176, 6176, 8224, 8224]
    - [60, 63.852]
  - - [6144, 2048, 1, 64, 6176, 6176, 96, 2048]
    - [33, 38.743]
  - - [6144, 2048, 1, 128, 6176, 6176, 160, 2048]
    - [61, 52.008]
  - - [6144, 2048, 1, 256, 6176, 6176, 288, 2048]
    - [28, 66.281]
  - - [6144, 2048, 1, 512, 6176, 6176, 544, 2048]
    - [28, 74.022]
  - - [6144, 2048, 1, 1024, 6176, 6176, 1056, 2048]
    - [49, 80.655]
  - - [6144, 2048, 1, 2048, 6176, 6176, 2080, 2080]
    - [24, 74.383]
  - - [6144, 2048, 1, 4096, 6176, 6176, 4128, 4128]
    - [50, 69.856]
  - - [6144, 2048, 1, 8192, 6176, 6176, 8224, 8224]
    - [59, 64.799]
  - - [6144, 4096, 1, 64, 6176, 6176, 96, 4096]
    - [28, 46.91]
  - - [6144, 4096, 1, 128, 6176, 6176, 160, 4096]
    - [28, 61.341]
  - - [6144, 4096, 1, 256, 6176, 6176, 288, 4096]
    - [69, 70.841]
  - - [6144, 4096, 1, 512, 6176, 6176, 544, 4096]
    - [36, 77.297]
  - - [6144, 4096, 1, 1024, 6176, 6176, 1056, 4096]
    - [22, 66.31]
  - - [6144, 4096, 1, 2048, 6176, 6176, 2080, 4096]
    - [28, 69.794]
  - - [6144, 4096, 1, 4096, 6176, 6176, 4128, 4128]
    - [58, 69.538]
  - - [6144, 4096, 1, 8192, 6176, 6176, 8224, 8224]
    - [69, 66.823]
  - - [6144, 8192, 1, 64, 6176, 6176, 96, 8192]
    - [72, 49.495]
  - - [6144, 8192, 1, 128, 6176, 6176, 160, 8192]
    - [35, 63.387]
  - - [6144, 8192, 1, 256, 6176, 6176, 288, 8192]
    - [50, 72.103]
  - - [6144, 8192, 1, 512, 6176, 6176, 544, 8192]
    - [49, 65.093]
  - - [6144, 8192, 1, 1024, 6176, 6176, 1056, 8192]
    - [69, 62.76]
  - - [6144, 8192, 1, 2048, 6176, 6176, 2080, 8192]
    - [60, 67.842]
  - - [6144, 8192, 1, 4096, 6176, 6176, 4128, 8192]
    - [50, 67.645]
  - - [6144, 8192, 1, 8192, 6176, 6176, 8224, 8224]
    - [68, 67.001]
- null
- null
- DeviceEfficiency
