library/src/blas3/Tensile/Logic/asm_full/navi31/navi31_Cijk_Ailk_Bjlk_BBS_BH_GB.yaml
- {MinimumRequiredVersion: 4.35.0}
- navi31
- gfx1100
- [Device 73bf]
    SolutionIndex: 0
    SolutionNameMin: Cijk_Ailk_Bjlk_BBS_BH_MT32x32x16_MI16x16x16x1_SN_1LDSB1_AMAS0_GRVW2_IU1_NLCA1_NLCB1_SIA2_SU0_SUS0_SVW1_TT1_16_VW1_WGM4
    SolutionIndex: 1
    SolutionNameMin: Cijk_Ailk_Bjlk_BBS_BH_MT32x32x16_MI16x16x16x1_SN_1LDSB1_AMAS0_GRVW4_IU1_NLCA1_NLCB1_SIA2_SU0_SUS0_SVW1_TT1_16_VW1_WGM4
    SolutionIndex: 2
    SolutionNameMin: Cijk_Ailk_Bjlk_BBS_BH_MT32x32x16_MI16x16x16x1_SN_1LDSB1_AMAS0_GRVW8_IU1_NLCA1_NLCB1_SIA2_SU0_SUS0_SVW1_TT1_16_VW1_WGM4
    SolutionIndex: 3
    SolutionNameMin: Cijk_Ailk_Bjlk_BBS_BH_MT32x32x16_MI16x16x16x1_SN_1LDSB1_AMAS0_GRVW2_IU1_NLCA1_NLCB1_SIA2_SU32_SUS128_SVW1_TT1_16_VW1_WGM4
    SolutionIndex: 4
    SolutionNameMin: Cijk_Ailk_Bjlk_BBS_BH_MT64x64x16_MI16x16x16x1_SN_1LDSB1_AMAS3_GRVW4_IU1_NLCA1_NLCB1_SIA2_SU0_SUS0_SVW2_TT2_32_VW2_WGM4
    SolutionIndex: 5
    SolutionNameMin: Cijk_Ailk_Bjlk_BBS_BH_MT64x64x16_MI16x16x16x1_SN_1LDSB1_AMAS3_GRVW8_IU1_NLCA1_NLCB1_SIA2_SU0_SUS0_SVW2_TT2_32_VW2_WGM4
    SolutionIndex: 6
    SolutionNameMin: Cijk_Ailk_Bjlk_BBS_BH_MT64x64x16_MI16x16x16x1_SN_1LDSB1_AMAS3_GRVW8_IU1_NLCA1_NLCB1_SIA2_SU32_SUS128_SVW2_TT2_32_VW2_WGM4
    SolutionIndex: 7
    SolutionNameMin: Cijk_Ailk_Bjlk_BBS_BH_MT64x64x16_MI16x16x16x1_SN_1LDSB1_AMAS3_GRVW4_IU1_NLCA1_NLCB1_SIA2_SU0_SUS0_SVW2_TT2_32_VW2_WGM8
    SolutionIndex: 8
    SolutionNameMin: Cijk_Ailk_Bjlk_BBS_BH_MT64x64x16_MI16x16x16x1_SN_1LDSB1_AMAS3_GRVW8_IU1_NLCA1_NLCB1_SIA2_SU0_SUS0_SVW2_TT2_32_VW2_WGM8
    SolutionIndex: 9
    SolutionNameMin: Cijk_Ailk_Bjlk_BBS_BH_MT64x64x16_MI16x16x16x1_SN_1LDSB1_AMAS3_GRVW8_IU1_NLCA1_NLCB1_SIA2_SU32_SUS128_SVW2_TT2_32_VW2_WGM8
    SolutionIndex: 10
    SolutionNameMin: Cijk_Ailk_Bjlk_BBS_BH_MT64x64x16_MI16x16x16x1_SN_1LDSB0_AMAS3_GRVW8_IU1_NLCA1_NLCB1_SIA1_SU32_SUS256_SVW2_TT2_32_VW2_WGM8
    SolutionIndex: 11
    SolutionNameMin: Cijk_Ailk_Bjlk_BBS_BH_MT64x64x16_MI16x16x16x1_SN_1LDSB1_AMAS3_GRVW8_IU1_NLCA1_NLCB1_SIA2_SU32_SUS256_SVW2_TT2_32_VW2_WGM8
    SolutionIndex: 12
    SolutionNameMin: Cijk_Ailk_Bjlk_BBS_BH_MT128x128x16_MI16x16x16x1_SN_1LDSB0_AMAS0_GRVW2_IU1_NLCA2_NLCB2_SIA1_SU0_SUS0_SVW1_TT4_64_VW1_WGM4
    SolutionIndex: 13
    SolutionNameMin: Cijk_Ailk_Bjlk_BBS_BH_MT128x128x16_MI16x16x16x1_SN_1LDSB0_AMAS3_GRVW2_IU1_NLCA2_NLCB2_SIA1_SU0_SUS0_SVW2_TT4_64_VW2_WGM4
    SolutionIndex: 14
    SolutionNameMin: Cijk_Ailk_Bjlk_BBS_BH_MT128x128x16_MI16x16x16x1_SN_1LDSB0_AMAS3_GRVW2_IU1_NLCA2_NLCB2_SIA1_SU0_SUS0_SVW4_TT4_64_VW4_WGM4
    SolutionIndex: 15
    SolutionNameMin: Cijk_Ailk_Bjlk_BBS_BH_MT128x128x16_MI16x16x16x1_SN_1LDSB0_AMAS0_GRVW4_IU1_NLCA1_NLCB1_SIA1_SU0_SUS0_SVW1_TT4_64_VW1_WGM4
    SolutionIndex: 16
    SolutionNameMin: Cijk_Ailk_Bjlk_BBS_BH_MT128x128x16_MI16x16x16x1_SN_1LDSB0_AMAS3_GRVW4_IU1_NLCA1_NLCB1_SIA1_SU0_SUS0_SVW2_TT4_64_VW2_WGM4
    SolutionIndex: 17
    SolutionNameMin: Cijk_Ailk_Bjlk_BBS_BH_MT128x128x16_MI16x16x16x1_SN_1LDSB0_AMAS3_GRVW4_IU1_NLCA1_NLCB1_SIA1_SU0_SUS0_SVW4_TT4_64_VW4_WGM4
    SolutionIndex: 18
    SolutionNameMin: Cijk_Ailk_Bjlk_BBS_BH_MT128x128x16_MI16x16x16x1_SN_1LDSB0_AMAS0_GRVW8_IU1_NLCA1_NLCB1_SIA1_SU0_SUS0_SVW1_TT4_64_VW1_WGM4
    SolutionIndex: 19
    SolutionNameMin: Cijk_Ailk_Bjlk_BBS_BH_MT128x128x16_MI16x16x16x1_SN_1LDSB0_AMAS3_GRVW8_IU1_NLCA1_NLCB1_SIA1_SU0_SUS0_SVW2_TT4_64_VW2_WGM4
    SolutionIndex: 20
    SolutionNameMin: Cijk_Ailk_Bjlk_BBS_BH_MT128x128x16_MI16x16x16x1_SN_1LDSB0_AMAS3_GRVW8_IU1_NLCA1_NLCB1_SIA1_SU0_SUS0_SVW4_TT4_64_VW4_WGM4
    SolutionIndex: 21
    SolutionNameMin: Cijk_Ailk_Bjlk_BBS_BH_MT128x128x16_MI16x16x16x1_SN_1LDSB1_AMAS0_GRVW2_IU1_NLCA2_NLCB2_SIA2_SU0_SUS0_SVW1_TT4_64_VW1_WGM4
    SolutionIndex: 22
    SolutionNameMin: Cijk_Ailk_Bjlk_BBS_BH_MT128x128x16_MI16x16x16x1_SN_1LDSB1_AMAS3_GRVW2_IU1_NLCA2_NLCB2_SIA2_SU0_SUS0_SVW2_TT4_64_VW2_WGM4
    SolutionIndex: 23
    SolutionNameMin: Cijk_Ailk_Bjlk_BBS_BH_MT128x128x16_MI16x16x16x1_SN_1LDSB1_AMAS3_GRVW2_IU1_NLCA2_NLCB2_SIA2_SU0_SUS0_SVW4_TT4_64_VW4_WGM4
    SolutionIndex: 24
    SolutionNameMin: Cijk_Ailk_Bjlk_BBS_BH_MT128x128x16_MI16x16x16x1_SN_1LDSB1_AMAS0_GRVW4_IU1_NLCA1_NLCB1_SIA2_SU0_SUS0_SVW1_TT4_64_VW1_WGM4
    SolutionIndex: 25
    SolutionNameMin: Cijk_Ailk_Bjlk_BBS_BH_MT128x128x16_MI16x16x16x1_SN_1LDSB1_AMAS3_GRVW4_IU1_NLCA1_NLCB1_SIA2_SU0_SUS0_SVW2_TT4_64_VW2_WGM4
    SolutionIndex: 26
    SolutionNameMin: Cijk_Ailk_Bjlk_BBS_BH_MT128x128x16_MI16x16x16x1_SN_1LDSB1_AMAS3_GRVW4_IU1_NLCA1_NLCB1_SIA2_SU0_SUS0_SVW4_TT4_64_VW4_WGM4
    SolutionIndex: 27
    SolutionNameMin: Cijk_Ailk_Bjlk_BBS_BH_MT128x128x16_MI16x16x16x1_SN_1LDSB1_AMAS0_GRVW8_IU1_NLCA1_NLCB1_SIA2_SU0_SUS0_SVW1_TT4_64_VW1_WGM4
    SolutionIndex: 28
    SolutionNameMin: Cijk_Ailk_Bjlk_BBS_BH_MT128x128x16_MI16x16x16x1_SN_1LDSB1_AMAS3_GRVW8_IU1_NLCA1_NLCB1_SIA2_SU0_SUS0_SVW4_TT4_64_VW4_WGM4
    SolutionIndex: 29
    SolutionNameMin: Cijk_Ailk_Bjlk_BBS_BH_MT128x128x16_MI16x16x16x1_SN_1LDSB0_AMAS3_GRVW4_IU1_NLCA1_NLCB1_SIA1_SU32_SUS128_SVW2_TT4_64_VW2_WGM4
    SolutionIndex: 30
    SolutionNameMin: Cijk_Ailk_Bjlk_BBS_BH_MT128x128x16_MI16x16x16x1_SN_1LDSB0_AMAS3_GRVW4_IU1_NLCA1_NLCB1_SIA1_SU32_SUS128_SVW4_TT4_64_VW4_WGM4
    SolutionIndex: 31
    SolutionNameMin: Cijk_Ailk_Bjlk_BBS_BH_MT128x128x16_MI16x16x16x1_SN_1LDSB0_AMAS3_GRVW8_IU1_NLCA1_NLCB1_SIA1_SU32_SUS128_SVW4_TT4_64_VW4_WGM4
    SolutionIndex: 32
    SolutionNameMin: Cijk_Ailk_Bjlk_BBS_BH_MT128x128x16_MI16x16x16x1_SN_1LDSB1_AMAS3_GRVW2_IU1_NLCA2_NLCB2_SIA2_SU32_SUS128_SVW4_TT4_64_VW4_WGM4
    SolutionIndex: 33
    SolutionNameMin: Cijk_Ailk_Bjlk_BBS_BH_MT128x128x16_MI16x16x16x1_SN_1LDSB1_AMAS3_GRVW4_IU1_NLCA1_NLCB1_SIA2_SU32_SUS128_SVW2_TT4_64_VW2_WGM4
    SolutionIndex: 34
    SolutionNameMin: Cijk_Ailk_Bjlk_BBS_BH_MT128x128x16_MI16x16x16x1_SN_1LDSB1_AMAS3_GRVW4_IU1_NLCA1_NLCB1_SIA2_SU32_SUS128_SVW4_TT4_64_VW4_WGM4
    SolutionIndex: 35
    SolutionNameMin: Cijk_Ailk_Bjlk_BBS_BH_MT128x128x16_MI16x16x16x1_SN_1LDSB1_AMAS3_GRVW8_IU1_NLCA1_NLCB1_SIA2_SU32_SUS128_SVW2_TT4_64_VW2_WGM4
    SolutionIndex: 36
    SolutionNameMin: Cijk_Ailk_Bjlk_BBS_BH_MT128x128x16_MI16x16x16x1_SN_1LDSB0_AMAS3_GRVW8_IU1_NLCA1_NLCB1_SIA3_SU32_SUS128_SVW2_TT4_64_VW2_WGM4
    SolutionIndex: 37
    SolutionNameMin: Cijk_Ailk_Bjlk_BBS_BH_MT128x128x16_MI16x16x16x1_SN_1LDSB0_AMAS3_GRVW4_IU1_NLCA1_NLCB1_SIA1_SU32_SUS256_SVW2_TT4_64_VW2_WGM4
    SolutionIndex: 38
    SolutionNameMin: Cijk_Ailk_Bjlk_BBS_BH_MT128x128x16_MI16x16x16x1_SN_1LDSB0_AMAS0_GRVW8_IU1_NLCA1_NLCB1_SIA1_SU32_SUS256_SVW1_TT4_64_VW1_WGM4
    SolutionIndex: 39
    SolutionNameMin: Cijk_Ailk_Bjlk_BBS_BH_MT128x128x16_MI16x16x16x1_SN_1LDSB0_AMAS3_GRVW8_IU1_NLCA1_NLCB1_SIA1_SU32_SUS256_SVW2_TT4_64_VW2_WGM4
    SolutionIndex: 40
    SolutionNameMin: Cijk_Ailk_Bjlk_BBS_BH_MT128x128x16_MI16x16x16x1_SN_1LDSB0_AMAS3_GRVW8_IU1_NLCA1_NLCB1_SIA1_SU32_SUS256_SVW4_TT4_64_VW4_WGM4
    SolutionIndex: 41
    SolutionNameMin: Cijk_Ailk_Bjlk_BBS_BH_MT128x128x16_MI16x16x16x1_SN_1LDSB1_AMAS3_GRVW4_IU1_NLCA1_NLCB1_SIA2_SU32_SUS256_SVW2_TT4_64_VW2_WGM4
    SolutionIndex: 42
    SolutionNameMin: Cijk_Ailk_Bjlk_BBS_BH_MT128x128x16_MI16x16x16x1_SN_1LDSB1_AMAS3_GRVW8_IU1_NLCA1_NLCB1_SIA2_SU32_SUS256_SVW2_TT4_64_VW2_WGM4
    SolutionIndex: 43
    SolutionNameMin: Cijk_Ailk_Bjlk_BBS_BH_MT128x128x16_MI16x16x16x1_SN_1LDSB0_AMAS3_GRVW8_IU1_NLCA1_NLCB1_SIA3_SU32_SUS256_SVW2_TT4_64_VW2_WGM4
    SolutionIndex: 44
    SolutionNameMin: Cijk_Ailk_Bjlk_BBS_BH_MT128x128x16_MI16x16x16x1_SN_1LDSB0_AMAS0_GRVW4_IU1_NLCA1_NLCB1_SIA1_SU0_SUS0_SVW1_TT4_64_VW1_WGM8
    SolutionIndex: 45
    SolutionNameMin: Cijk_Ailk_Bjlk_BBS_BH_MT128x128x16_MI16x16x16x1_SN_1LDSB0_AMAS3_GRVW4_IU1_NLCA1_NLCB1_SIA1_SU0_SUS0_SVW2_TT4_64_VW2_WGM8
    SolutionIndex: 46
    SolutionNameMin: Cijk_Ailk_Bjlk_BBS_BH_MT128x128x16_MI16x16x16x1_SN_1LDSB0_AMAS3_GRVW4_IU1_NLCA1_NLCB1_SIA1_SU0_SUS0_SVW4_TT4_64_VW4_WGM8
    SolutionIndex: 47
    SolutionNameMin: Cijk_Ailk_Bjlk_BBS_BH_MT128x128x16_MI16x16x16x1_SN_1LDSB0_AMAS0_GRVW8_IU1_NLCA1_NLCB1_SIA1_SU0_SUS0_SVW1_TT4_64_VW1_WGM8
    SolutionIndex: 48
    SolutionNameMin: Cijk_Ailk_Bjlk_BBS_BH_MT128x128x16_MI16x16x16x1_SN_1LDSB0_AMAS3_GRVW8_IU1_NLCA1_NLCB1_SIA1_SU0_SUS0_SVW2_TT4_64_VW2_WGM8
    SolutionIndex: 49
    SolutionNameMin: Cijk_Ailk_Bjlk_BBS_BH_MT128x128x16_MI16x16x16x1_SN_1LDSB0_AMAS3_GRVW8_IU1_NLCA1_NLCB1_SIA1_SU0_SUS0_SVW4_TT4_64_VW4_WGM8
    SolutionIndex: 50
    SolutionNameMin: Cijk_Ailk_Bjlk_BBS_BH_MT128x128x16_MI16x16x16x1_SN_1LDSB1_AMAS0_GRVW4_IU1_NLCA1_NLCB1_SIA2_SU0_SUS0_SVW1_TT4_64_VW1_WGM8
    SolutionIndex: 51
    SolutionNameMin: Cijk_Ailk_Bjlk_BBS_BH_MT128x128x16_MI16x16x16x1_SN_1LDSB1_AMAS3_GRVW4_IU1_NLCA1_NLCB1_SIA2_SU0_SUS0_SVW2_TT4_64_VW2_WGM8
    SolutionIndex: 52
    SolutionNameMin: Cijk_Ailk_Bjlk_BBS_BH_MT128x128x16_MI16x16x16x1_SN_1LDSB1_AMAS3_GRVW4_IU1_NLCA1_NLCB1_SIA2_SU0_SUS0_SVW4_TT4_64_VW4_WGM8
    SolutionIndex: 53
    SolutionNameMin: Cijk_Ailk_Bjlk_BBS_BH_MT128x128x16_MI16x16x16x1_SN_1LDSB1_AMAS0_GRVW8_IU1_NLCA1_NLCB1_SIA2_SU0_SUS0_SVW1_TT4_64_VW1_WGM8
    SolutionIndex: 54
    SolutionNameMin: Cijk_Ailk_Bjlk_BBS_BH_MT128x128x16_MI16x16x16x1_SN_1LDSB1_AMAS3_GRVW8_IU1_NLCA1_NLCB1_SIA2_SU0_SUS0_SVW4_TT4_64_VW4_WGM8
    SolutionIndex: 55
    SolutionNameMin: Cijk_Ailk_Bjlk_BBS_BH_MT128x128x16_MI16x16x16x1_SN_1LDSB0_AMAS3_GRVW8_IU1_NLCA1_NLCB1_SIA3_SU0_SUS0_SVW2_TT4_64_VW2_WGM8
    SolutionIndex: 56
    SolutionNameMin: Cijk_Ailk_Bjlk_BBS_BH_MT128x128x16_MI16x16x16x1_SN_1LDSB0_AMAS0_GRVW4_IU1_NLCA1_NLCB1_SIA1_SU32_SUS128_SVW1_TT4_64_VW1_WGM8
    SolutionIndex: 57
    SolutionNameMin: Cijk_Ailk_Bjlk_BBS_BH_MT128x128x16_MI16x16x16x1_SN_1LDSB0_AMAS3_GRVW4_IU1_NLCA1_NLCB1_SIA1_SU32_SUS128_SVW4_TT4_64_VW4_WGM8
    SolutionIndex: 58
    SolutionNameMin: Cijk_Ailk_Bjlk_BBS_BH_MT128x128x16_MI16x16x16x1_SN_1LDSB0_AMAS0_GRVW8_IU1_NLCA1_NLCB1_SIA1_SU32_SUS128_SVW1_TT4_64_VW1_WGM8
    SolutionIndex: 59
    SolutionNameMin: Cijk_Ailk_Bjlk_BBS_BH_MT128x128x16_MI16x16x16x1_SN_1LDSB0_AMAS3_GRVW8_IU1_NLCA1_NLCB1_SIA1_SU32_SUS128_SVW2_TT4_64_VW2_WGM8
    SolutionIndex: 60
    SolutionNameMin: Cijk_Ailk_Bjlk_BBS_BH_MT128x128x16_MI16x16x16x1_SN_1LDSB0_AMAS3_GRVW8_IU1_NLCA1_NLCB1_SIA1_SU32_SUS128_SVW4_TT4_64_VW4_WGM8
    SolutionIndex: 61
    SolutionNameMin: Cijk_Ailk_Bjlk_BBS_BH_MT128x128x16_MI16x16x16x1_SN_1LDSB1_AMAS0_GRVW4_IU1_NLCA1_NLCB1_SIA2_SU32_SUS128_SVW1_TT4_64_VW1_WGM8
    SolutionIndex: 62
    SolutionNameMin: Cijk_Ailk_Bjlk_BBS_BH_MT128x128x16_MI16x16x16x1_SN_1LDSB1_AMAS3_GRVW4_IU1_NLCA1_NLCB1_SIA2_SU32_SUS128_SVW2_TT4_64_VW2_WGM8
    SolutionIndex: 63
    SolutionNameMin: Cijk_Ailk_Bjlk_BBS_BH_MT128x128x16_MI16x16x16x1_SN_1LDSB1_AMAS3_GRVW4_IU1_NLCA1_NLCB1_SIA2_SU32_SUS128_SVW4_TT4_64_VW4_WGM8
    SolutionIndex: 64
    SolutionNameMin: Cijk_Ailk_Bjlk_BBS_BH_MT128x128x16_MI16x16x16x1_SN_1LDSB1_AMAS0_GRVW8_IU1_NLCA1_NLCB1_SIA2_SU32_SUS128_SVW1_TT4_64_VW1_WGM8
    SolutionIndex: 65
    SolutionNameMin: Cijk_Ailk_Bjlk_BBS_BH_MT128x128x16_MI16x16x16x1_SN_1LDSB1_AMAS3_GRVW8_IU1_NLCA1_NLCB1_SIA2_SU32_SUS128_SVW2_TT4_64_VW2_WGM8
    SolutionIndex: 66
    SolutionNameMin: Cijk_Ailk_Bjlk_BBS_BH_MT128x128x16_MI16x16x16x1_SN_1LDSB1_AMAS3_GRVW8_IU1_NLCA1_NLCB1_SIA2_SU32_SUS128_SVW4_TT4_64_VW4_WGM8
    SolutionIndex: 67
    SolutionNameMin: Cijk_Ailk_Bjlk_BBS_BH_MT128x128x16_MI16x16x16x1_SN_1LDSB0_AMAS3_GRVW4_IU1_NLCA1_NLCB1_SIA1_SU32_SUS256_SVW2_TT4_64_VW2_WGM8
    SolutionIndex: 68
    SolutionNameMin: Cijk_Ailk_Bjlk_BBS_BH_MT128x128x16_MI16x16x16x1_SN_1LDSB0_AMAS0_GRVW8_IU1_NLCA1_NLCB1_SIA1_SU32_SUS256_SVW1_TT4_64_VW1_WGM8
    SolutionIndex: 69
    SolutionNameMin: Cijk_Ailk_Bjlk_BBS_BH_MT128x128x16_MI16x16x16x1_SN_1LDSB0_AMAS3_GRVW8_IU1_NLCA1_NLCB1_SIA1_SU32_SUS256_SVW2_TT4_64_VW2_WGM8
    SolutionIndex: 70
    SolutionNameMin: Cijk_Ailk_Bjlk_BBS_BH_MT128x128x16_MI16x16x16x1_SN_1LDSB1_AMAS3_GRVW4_IU1_NLCA1_NLCB1_SIA2_SU32_SUS256_SVW2_TT4_64_VW2_WGM8
    SolutionIndex: 71
    SolutionNameMin: Cijk_Ailk_Bjlk_BBS_BH_MT128x128x16_MI16x16x16x1_SN_1LDSB1_AMAS3_GRVW8_IU1_NLCA1_NLCB1_SIA2_SU32_SUS256_SVW2_TT4_64_VW2_WGM8
    SolutionIndex: 72
    SolutionNameMin: Cijk_Ailk_Bjlk_BBS_BH_MT128x128x16_MI16x16x16x1_SN_1LDSB0_AMAS3_GRVW8_IU1_NLCA1_NLCB1_SIA3_SU32_SUS256_SVW2_TT4_64_VW2_WGM8
    SolutionIndex: 73
    SolutionNameMin: Cijk_Ailk_Bjlk_BBS_BH_MT32x32x32_MI16x16x16x1_SN_1LDSB0_AMAS0_GRVW4_IU1_NLCA1_NLCB1_SIA1_SU0_SUS0_SVW1_TT1_16_VW1_WGM4
    SolutionIndex: 74
    SolutionNameMin: Cijk_Ailk_Bjlk_BBS_BH_MT32x32x32_MI16x16x16x1_SN_1LDSB0_AMAS0_GRVW8_IU1_NLCA1_NLCB1_SIA1_SU0_SUS0_SVW1_TT1_16_VW1_WGM4
    SolutionIndex: 75
    SolutionNameMin: Cijk_Ailk_Bjlk_BBS_BH_MT32x32x32_MI16x16x16x1_SN_1LDSB1_AMAS0_GRVW2_IU2_NLCA1_NLCB1_SIA2_SU0_SUS0_SVW1_TT1_16_VW1_WGM4
    SolutionIndex: 76
    SolutionNameMin: Cijk_Ailk_Bjlk_BBS_BH_MT32x32x32_MI16x16x16x1_SN_1LDSB1_AMAS0_GRVW4_IU2_NLCA1_NLCB1_SIA2_SU0_SUS0_SVW1_TT1_16_VW1_WGM4
    SolutionIndex: 77
    SolutionNameMin: Cijk_Ailk_Bjlk_BBS_BH_MT32x32x32_MI16x16x16x1_SN_1LDSB1_AMAS0_GRVW8_IU2_NLCA1_NLCB1_SIA2_SU0_SUS0_SVW1_TT1_16_VW1_WGM4
    SolutionIndex: 78
    SolutionNameMin: Cijk_Ailk_Bjlk_BBS_BH_MT32x32x32_MI16x16x16x1_SN_1LDSB0_AMAS0_GRVW4_IU1_NLCA1_NLCB1_SIA3_SU0_SUS0_SVW1_TT1_16_VW1_WGM4
    SolutionIndex: 79
    SolutionNameMin: Cijk_Ailk_Bjlk_BBS_BH_MT32x32x32_MI16x16x16x1_SN_1LDSB0_AMAS0_GRVW4_IU1_NLCA1_NLCB1_SIA1_SU32_SUS128_SVW1_TT1_16_VW1_WGM4
    SolutionIndex: 80
    SolutionNameMin: Cijk_Ailk_Bjlk_BBS_BH_MT32x32x32_MI16x16x16x1_SN_1LDSB0_AMAS0_GRVW8_IU1_NLCA1_NLCB1_SIA1_SU32_SUS128_SVW1_TT1_16_VW1_WGM4
    SolutionIndex: 81
    SolutionNameMin: Cijk_Ailk_Bjlk_BBS_BH_MT32x32x32_MI16x16x16x1_SN_1LDSB1_AMAS0_GRVW2_IU2_NLCA1_NLCB1_SIA2_SU32_SUS128_SVW1_TT1_16_VW1_WGM4
    SolutionIndex: 82
    SolutionNameMin: Cijk_Ailk_Bjlk_BBS_BH_MT32x32x32_MI16x16x16x1_SN_1LDSB1_AMAS0_GRVW4_IU2_NLCA1_NLCB1_SIA2_SU32_SUS128_SVW1_TT1_16_VW1_WGM4
    SolutionIndex: 83
    SolutionNameMin: Cijk_Ailk_Bjlk_BBS_BH_MT32x32x32_MI16x16x16x1_SN_1LDSB1_AMAS0_GRVW8_IU2_NLCA1_NLCB1_SIA2_SU32_SUS128_SVW1_TT1_16_VW1_WGM4
    SolutionIndex: 84
    SolutionNameMin: Cijk_Ailk_Bjlk_BBS_BH_MT32x32x32_MI16x16x16x1_SN_1LDSB0_AMAS0_GRVW8_IU1_NLCA1_NLCB1_SIA1_SU32_SUS256_SVW1_TT1_16_VW1_WGM4
    SolutionIndex: 85
    SolutionNameMin: Cijk_Ailk_Bjlk_BBS_BH_MT32x32x32_MI16x16x16x1_SN_1LDSB1_AMAS0_GRVW4_IU2_NLCA1_NLCB1_SIA2_SU32_SUS256_SVW1_TT1_16_VW1_WGM4
    SolutionIndex: 86
    SolutionNameMin: Cijk_Ailk_Bjlk_BBS_BH_MT32x32x32_MI16x16x16x1_SN_1LDSB1_AMAS0_GRVW8_IU2_NLCA1_NLCB1_SIA2_SU32_SUS256_SVW1_TT1_16_VW1_WGM4
    SolutionIndex: 87
    SolutionNameMin: Cijk_Ailk_Bjlk_BBS_BH_MT32x32x32_MI16x16x16x1_SN_1LDSB0_AMAS0_GRVW4_IU1_NLCA1_NLCB1_SIA1_SU0_SUS0_SVW1_TT1_16_VW1_WGM8
    SolutionIndex: 88
    SolutionNameMin: Cijk_Ailk_Bjlk_BBS_BH_MT32x32x32_MI16x16x16x1_SN_1LDSB0_AMAS0_GRVW8_IU1_NLCA1_NLCB1_SIA1_SU0_SUS0_SVW1_TT1_16_VW1_WGM8
    SolutionIndex: 89
    SolutionNameMin: Cijk_Ailk_Bjlk_BBS_BH_MT32x32x32_MI16x16x16x1_SN_1LDSB1_AMAS0_GRVW2_IU2_NLCA1_NLCB1_SIA2_SU0_SUS0_SVW1_TT1_16_VW1_WGM8
    SolutionIndex: 90
    SolutionNameMin: Cijk_Ailk_Bjlk_BBS_BH_MT32x32x32_MI16x16x16x1_SN_1LDSB1_AMAS0_GRVW4_IU2_NLCA1_NLCB1_SIA2_SU0_SUS0_SVW1_TT1_16_VW1_WGM8
    SolutionIndex: 91
    SolutionNameMin: Cijk_Ailk_Bjlk_BBS_BH_MT32x32x32_MI16x16x16x1_SN_1LDSB1_AMAS0_GRVW8_IU2_NLCA1_NLCB1_SIA2_SU0_SUS0_SVW1_TT1_16_VW1_WGM8
    SolutionIndex: 92
    SolutionNameMin: Cijk_Ailk_Bjlk_BBS_BH_MT32x32x32_MI16x16x16x1_SN_1LDSB0_AMAS0_GRVW8_IU1_NLCA1_NLCB1_SIA3_SU0_SUS0_SVW1_TT1_16_VW1_WGM8
    SolutionIndex: 93
    SolutionNameMin: Cijk_Ailk_Bjlk_BBS_BH_MT32x32x32_MI16x16x16x1_SN_1LDSB0_AMAS0_GRVW4_IU1_NLCA1_NLCB1_SIA1_SU32_SUS128_SVW1_TT1_16_VW1_WGM8
    SolutionIndex: 94
    SolutionNameMin: Cijk_Ailk_Bjlk_BBS_BH_MT32x32x32_MI16x16x16x1_SN_1LDSB1_AMAS0_GRVW4_IU2_NLCA1_NLCB1_SIA2_SU32_SUS128_SVW1_TT1_16_VW1_WGM8
    SolutionIndex: 95
    SolutionNameMin: Cijk_Ailk_Bjlk_BBS_BH_MT32x32x32_MI16x16x16x1_SN_1LDSB1_AMAS0_GRVW8_IU2_NLCA1_NLCB1_SIA2_SU32_SUS128_SVW1_TT1_16_VW1_WGM8
    SolutionIndex: 96
    SolutionNameMin: Cijk_Ailk_Bjlk_BBS_BH_MT32x32x32_MI16x16x16x1_SN_1LDSB0_AMAS0_GRVW8_IU1_NLCA1_NLCB1_SIA1_SU32_SUS256_SVW1_TT1_16_VW1_WGM8
    SolutionIndex: 97
    SolutionNameMin: Cijk_Ailk_Bjlk_BBS_BH_MT32x32x32_MI16x16x16x1_SN_1LDSB1_AMAS0_GRVW2_IU2_NLCA1_NLCB1_SIA2_SU32_SUS256_SVW1_TT1_16_VW1_WGM8
    SolutionIndex: 98
    SolutionNameMin: Cijk_Ailk_Bjlk_BBS_BH_MT32x32x32_MI16x16x16x1_SN_1LDSB1_AMAS0_GRVW4_IU2_NLCA1_NLCB1_SIA2_SU32_SUS256_SVW1_TT1_16_VW1_WGM8
    SolutionIndex: 99
    SolutionNameMin: Cijk_Ailk_Bjlk_BBS_BH_MT32x32x32_MI16x16x16x1_SN_1LDSB1_AMAS0_GRVW8_IU2_NLCA1_NLCB1_SIA2_SU32_SUS256_SVW1_TT1_16_VW1_WGM8
    SolutionIndex: 100
    SolutionNameMin: Cijk_Ailk_Bjlk_BBS_BH_MT32x32x32_MI16x16x16x1_SN_1LDSB0_AMAS0_GRVW4_IU1_NLCA1_NLCB1_SIA3_SU32_SUS256_SVW1_TT1_16_VW1_WGM8
    SolutionIndex: 101
    SolutionNameMin: Cijk_Ailk_Bjlk_BBS_BH_MT64x64x32_MI16x16x16x1_SN_1LDSB0_AMAS0_GRVW4_IU1_NLCA1_NLCB1_SIA1_SU0_SUS0_SVW1_TT2_32_VW1_WGM4
    SolutionIndex: 102
    SolutionNameMin: Cijk_Ailk_Bjlk_BBS_BH_MT64x64x32_MI16x16x16x1_SN_1LDSB0_AMAS3_GRVW4_IU1_NLCA1_NLCB1_SIA1_SU0_SUS0_SVW2_TT2_32_VW2_WGM4
    SolutionIndex: 103
    SolutionNameMin: Cijk_Ailk_Bjlk_BBS_BH_MT64x64x32_MI16x16x16x1_SN_1LDSB0_AMAS0_GRVW8_IU1_NLCA1_NLCB1_SIA1_SU0_SUS0_SVW1_TT2_32_VW1_WGM4
    SolutionIndex: 104
    SolutionNameMin: Cijk_Ailk_Bjlk_BBS_BH_MT64x64x32_MI16x16x16x1_SN_1LDSB0_AMAS3_GRVW8_IU1_NLCA1_NLCB1_SIA1_SU0_SUS0_SVW2_TT2_32_VW2_WGM4
    SolutionIndex: 105
    SolutionNameMin: Cijk_Ailk_Bjlk_BBS_BH_MT64x64x32_MI16x16x16x1_SN_1LDSB1_AMAS0_GRVW4_IU2_NLCA1_NLCB1_SIA2_SU0_SUS0_SVW1_TT2_32_VW1_WGM4
    SolutionIndex: 106
    SolutionNameMin: Cijk_Ailk_Bjlk_BBS_BH_MT64x64x32_MI16x16x16x1_SN_1LDSB1_AMAS3_GRVW4_IU2_NLCA1_NLCB1_SIA2_SU0_SUS0_SVW2_TT2_32_VW2_WGM4
    SolutionIndex: 107
    SolutionNameMin: Cijk_Ailk_Bjlk_BBS_BH_MT64x64x32_MI16x16x16x1_SN_1LDSB1_AMAS0_GRVW8_IU2_NLCA1_NLCB1_SIA2_SU0_SUS0_SVW1_TT2_32_VW1_WGM4
    SolutionIndex: 108
    SolutionNameMin: Cijk_Ailk_Bjlk_BBS_BH_MT64x64x32_MI16x16x16x1_SN_1LDSB1_AMAS3_GRVW8_IU2_NLCA1_NLCB1_SIA2_SU0_SUS0_SVW2_TT2_32_VW2_WGM4
    SolutionIndex: 109
    SolutionNameMin: Cijk_Ailk_Bjlk_BBS_BH_MT64x64x32_MI16x16x16x1_SN_1LDSB0_AMAS3_GRVW8_IU1_NLCA1_NLCB1_SIA3_SU0_SUS0_SVW2_TT2_32_VW2_WGM4
    SolutionIndex: 110
    SolutionNameMin: Cijk_Ailk_Bjlk_BBS_BH_MT64x64x32_MI16x16x16x1_SN_1LDSB0_AMAS3_GRVW4_IU1_NLCA1_NLCB1_SIA1_SU32_SUS128_SVW2_TT2_32_VW2_WGM4
    SolutionIndex: 111
    SolutionNameMin: Cijk_Ailk_Bjlk_BBS_BH_MT64x64x32_MI16x16x16x1_SN_1LDSB0_AMAS3_GRVW8_IU1_NLCA1_NLCB1_SIA1_SU32_SUS128_SVW2_TT2_32_VW2_WGM4
    SolutionIndex: 112
    SolutionNameMin: Cijk_Ailk_Bjlk_BBS_BH_MT64x64x32_MI16x16x16x1_SN_1LDSB1_AMAS0_GRVW8_IU2_NLCA1_NLCB1_SIA2_SU32_SUS128_SVW1_TT2_32_VW1_WGM4
    SolutionIndex: 113
    SolutionNameMin: Cijk_Ailk_Bjlk_BBS_BH_MT64x64x32_MI16x16x16x1_SN_1LDSB1_AMAS3_GRVW8_IU2_NLCA1_NLCB1_SIA2_SU32_SUS128_SVW2_TT2_32_VW2_WGM4
    SolutionIndex: 114
    SolutionNameMin: Cijk_Ailk_Bjlk_BBS_BH_MT64x64x32_MI16x16x16x1_SN_1LDSB0_AMAS3_GRVW8_IU1_NLCA1_NLCB1_SIA3_SU32_SUS128_SVW2_TT2_32_VW2_WGM4
    SolutionIndex: 115
    SolutionNameMin: Cijk_Ailk_Bjlk_BBS_BH_MT64x64x32_MI16x16x16x1_SN_1LDSB0_AMAS3_GRVW4_IU1_NLCA1_NLCB1_SIA1_SU32_SUS256_SVW2_TT2_32_VW2_WGM4
    SolutionIndex: 116
    SolutionNameMin: Cijk_Ailk_Bjlk_BBS_BH_MT64x64x32_MI16x16x16x1_SN_1LDSB0_AMAS3_GRVW8_IU1_NLCA1_NLCB1_SIA1_SU32_SUS256_SVW2_TT2_32_VW2_WGM4
    SolutionIndex: 117
    SolutionNameMin: Cijk_Ailk_Bjlk_BBS_BH_MT64x64x32_MI16x16x16x1_SN_1LDSB1_AMAS0_GRVW4_IU2_NLCA1_NLCB1_SIA2_SU32_SUS256_SVW1_TT2_32_VW1_WGM4
    SolutionIndex: 118
    SolutionNameMin: Cijk_Ailk_Bjlk_BBS_BH_MT64x64x32_MI16x16x16x1_SN_1LDSB1_AMAS3_GRVW4_IU2_NLCA1_NLCB1_SIA2_SU32_SUS256_SVW2_TT2_32_VW2_WGM4
    SolutionIndex: 119
    SolutionNameMin: Cijk_Ailk_Bjlk_BBS_BH_MT64x64x32_MI16x16x16x1_SN_1LDSB1_AMAS0_GRVW8_IU2_NLCA1_NLCB1_SIA2_SU32_SUS256_SVW1_TT2_32_VW1_WGM4
    SolutionIndex: 120
    SolutionNameMin: Cijk_Ailk_Bjlk_BBS_BH_MT64x64x32_MI16x16x16x1_SN_1LDSB1_AMAS3_GRVW8_IU2_NLCA1_NLCB1_SIA2_SU32_SUS256_SVW2_TT2_32_VW2_WGM4
    SolutionIndex: 121
    SolutionNameMin: Cijk_Ailk_Bjlk_BBS_BH_MT64x64x32_MI16x16x16x1_SN_1LDSB0_AMAS3_GRVW8_IU1_NLCA1_NLCB1_SIA3_SU32_SUS256_SVW2_TT2_32_VW2_WGM4
    SolutionIndex: 122
    SolutionNameMin: Cijk_Ailk_Bjlk_BBS_BH_MT64x64x32_MI16x16x16x1_SN_1LDSB0_AMAS3_GRVW4_IU1_NLCA1_NLCB1_SIA1_SU0_SUS0_SVW2_TT2_32_VW2_WGM8
    SolutionIndex: 123
    SolutionNameMin: Cijk_Ailk_Bjlk_BBS_BH_MT64x64x32_MI16x16x16x1_SN_1LDSB0_AMAS0_GRVW8_IU1_NLCA1_NLCB1_SIA1_SU0_SUS0_SVW1_TT2_32_VW1_WGM8
    SolutionIndex: 124
    SolutionNameMin: Cijk_Ailk_Bjlk_BBS_BH_MT64x64x32_MI16x16x16x1_SN_1LDSB0_AMAS3_GRVW8_IU1_NLCA1_NLCB1_SIA1_SU0_SUS0_SVW2_TT2_32_VW2_WGM8
    SolutionIndex: 125
    SolutionNameMin: Cijk_Ailk_Bjlk_BBS_BH_MT64x64x32_MI16x16x16x1_SN_1LDSB1_AMAS3_GRVW4_IU2_NLCA1_NLCB1_SIA2_SU0_SUS0_SVW2_TT2_32_VW2_WGM8
    SolutionIndex: 126
    SolutionNameMin: Cijk_Ailk_Bjlk_BBS_BH_MT64x64x32_MI16x16x16x1_SN_1LDSB1_AMAS0_GRVW8_IU2_NLCA1_NLCB1_SIA2_SU0_SUS0_SVW1_TT2_32_VW1_WGM8
    SolutionIndex: 127
    SolutionNameMin: Cijk_Ailk_Bjlk_BBS_BH_MT64x64x32_MI16x16x16x1_SN_1LDSB1_AMAS3_GRVW8_IU2_NLCA1_NLCB1_SIA2_SU0_SUS0_SVW2_TT2_32_VW2_WGM8
    SolutionIndex: 128
    SolutionNameMin: Cijk_Ailk_Bjlk_BBS_BH_MT64x64x32_MI16x16x16x1_SN_1LDSB0_AMAS3_GRVW8_IU1_NLCA1_NLCB1_SIA3_SU0_SUS0_SVW2_TT2_32_VW2_WGM8
    SolutionIndex: 129
    SolutionNameMin: Cijk_Ailk_Bjlk_BBS_BH_MT64x64x32_MI16x16x16x1_SN_1LDSB0_AMAS3_GRVW8_IU1_NLCA1_NLCB1_SIA1_SU32_SUS128_SVW2_TT2_32_VW2_WGM8
    SolutionIndex: 130
    SolutionNameMin: Cijk_Ailk_Bjlk_BBS_BH_MT64x64x32_MI16x16x16x1_SN_1LDSB1_AMAS0_GRVW4_IU2_NLCA1_NLCB1_SIA2_SU32_SUS128_SVW1_TT2_32_VW1_WGM8
    SolutionIndex: 131
    SolutionNameMin: Cijk_Ailk_Bjlk_BBS_BH_MT64x64x32_MI16x16x16x1_SN_1LDSB1_AMAS3_GRVW4_IU2_NLCA1_NLCB1_SIA2_SU32_SUS128_SVW2_TT2_32_VW2_WGM8
    SolutionIndex: 132
    SolutionNameMin: Cijk_Ailk_Bjlk_BBS_BH_MT64x64x32_MI16x16x16x1_SN_1LDSB1_AMAS3_GRVW8_IU2_NLCA1_NLCB1_SIA2_SU32_SUS128_SVW2_TT2_32_VW2_WGM8
    SolutionIndex: 133
    SolutionNameMin: Cijk_Ailk_Bjlk_BBS_BH_MT64x64x32_MI16x16x16x1_SN_1LDSB0_AMAS3_GRVW8_IU1_NLCA1_NLCB1_SIA3_SU32_SUS128_SVW2_TT2_32_VW2_WGM8
    SolutionIndex: 134
    SolutionNameMin: Cijk_Ailk_Bjlk_BBS_BH_MT64x64x32_MI16x16x16x1_SN_1LDSB0_AMAS3_GRVW4_IU1_NLCA1_NLCB1_SIA1_SU32_SUS256_SVW2_TT2_32_VW2_WGM8
    SolutionIndex: 135
    SolutionNameMin: Cijk_Ailk_Bjlk_BBS_BH_MT64x64x32_MI16x16x16x1_SN_1LDSB0_AMAS3_GRVW8_IU1_NLCA1_NLCB1_SIA1_SU32_SUS256_SVW2_TT2_32_VW2_WGM8
    SolutionIndex: 136
    SolutionNameMin: Cijk_Ailk_Bjlk_BBS_BH_MT64x64x32_MI16x16x16x1_SN_1LDSB1_AMAS3_GRVW8_IU2_NLCA1_NLCB1_SIA2_SU32_SUS256_SVW2_TT2_32_VW2_WGM8
    SolutionIndex: 137
    SolutionNameMin: Cijk_Ailk_Bjlk_BBS_BH_MT64x64x32_MI16x16x16x1_SN_1LDSB0_AMAS3_GRVW4_IU1_NLCA1_NLCB1_SIA3_SU32_SUS256_SVW2_TT2_32_VW2_WGM8
    SolutionIndex: 138
    SolutionNameMin: Cijk_Ailk_Bjlk_BBS_BH_MT64x64x32_MI16x16x16x1_SN_1LDSB0_AMAS3_GRVW8_IU1_NLCA1_NLCB1_SIA3_SU32_SUS256_SVW2_TT2_32_VW2_WGM8
- - - [64, 64, 1, 64, 96, 96, 96, 96]
    - [2, 0.04]
  - - [64, 64, 1, 128, 96, 96, 160, 160]
    - [91, 0.078]
  - - [64, 64, 1, 256, 96, 96, 288, 288]
    - [91, 0.149]
  - - [64, 64, 1, 512, 96, 96, 544, 544]
    - [99, 0.262]
  - - [64, 64, 1, 1024, 96, 96, 1056, 1056]
    - [91, 0.428]
  - - [64, 64, 1, 2048, 96, 96, 2080, 2080]
    - [77, 0.622]
  - - [64, 64, 1, 4096, 96, 96, 4128, 4128]
    - [76, 0.8]
  - - [64, 64, 1, 8192, 96, 96, 8224, 8224]
    - [75, 0.933]
  - - [64, 128, 1, 64, 96, 96, 96, 128]
    - [77, 0.085]
  - - [64, 128, 1, 128, 96, 96, 160, 160]
    - [77, 0.166]
  - - [64, 128, 1, 256, 96, 96, 288, 288]
    - [86, 0.306]
  - - [64, 128, 1, 512, 96, 96, 544, 544]
    - [90, 0.543]
  - - [64, 128, 1, 1024, 96, 96, 1056, 1056]
    - [76, 0.877]
  - - [64, 128, 1, 2048, 96, 96, 2080, 2080]
    - [94, 1.269]
  - - [64, 128, 1, 4096, 96, 96, 4128, 4128]
    - [85, 1.624]
  - - [64, 128, 1, 8192, 96, 96, 8224, 8224]
    - [94, 1.888]
  - - [64, 256, 1, 64, 96, 96, 96, 256]
    - [93, 0.174]
  - - [64, 256, 1, 128, 96, 96, 160, 256]
    - [83, 0.335]
  - - [64, 256, 1, 256, 96, 96, 288, 288]
    - [90, 0.627]
  - - [64, 256, 1, 512, 96, 96, 544, 544]
    - [90, 1.101]
  - - [64, 256, 1, 1024, 96, 96, 1056, 1056]
    - [85, 1.78]
  - - [64, 256, 1, 2048, 96, 96, 2080, 2080]
    - [76, 2.529]
  - - [64, 256, 1, 4096, 96, 96, 4128, 4128]
    - [82, 3.272]
  - - [64, 256, 1, 8192, 96, 96, 8224, 8224]
    - [85, 3.787]
  - - [64, 512, 1, 64, 96, 96, 96, 512]
    - [75, 0.351]
  - - [64, 512, 1, 128, 96, 96, 160, 512]
    - [94, 0.68]
  - - [64, 512, 1, 256, 96, 96, 288, 512]
    - [94, 1.257]
  - - [64, 512, 1, 512, 96, 96, 544, 544]
    - [98, 2.216]
  - - [64, 512, 1, 1024, 96, 96, 1056, 1056]
    - [91, 3.56]
  - - [64, 512, 1, 2048, 96, 96, 2080, 2080]
    - [76, 5.119]
  - - [64, 512, 1, 4096, 96, 96, 4128, 4128]
    - [94, 6.502]
  - - [64, 512, 1, 8192, 96, 96, 8224, 8224]
    - [94, 7.545]
  - - [64, 1024, 1, 64, 96, 96, 96, 1024]
    - [83, 0.692]
  - - [64, 1024, 1, 128, 96, 96, 160, 1024]
    - [95, 1.311]
  - - [64, 1024, 1, 256, 96, 96, 288, 1024]
    - [90, 2.385]
  - - [64, 1024, 1, 512, 96, 96, 544, 1024]
    - [77, 4.027]
  - - [64, 1024, 1, 1024, 96, 96, 1056, 1056]
    - [98, 6.178]
  - - [64, 1024, 1, 2048, 96, 96, 2080, 2080]
    - [90, 8.41]
  - - [64, 1024, 1, 4096, 96, 96, 4128, 4128]
    - [77, 10.165]
  - - [64, 1024, 1, 8192, 96, 96, 8224, 8224]
    - [94, 11.269]
  - - [64, 2048, 1, 64, 96, 96, 96, 2048]
    - [100, 1.326]
  - - [64, 2048, 1, 128, 96, 96, 160, 2048]
    - [96, 2.49]
  - - [64, 2048, 1, 256, 96, 96, 288, 2048]
    - [84, 4.439]
  - - [64, 2048, 1, 512, 96, 96, 544, 2048]
    - [90, 7.164]
  - - [64, 2048, 1, 1024, 96, 96, 1056, 2048]
    - [90, 10.324]
  - - [64, 2048, 1, 2048, 96, 96, 2080, 2080]
    - [77, 13.267]
  - - [64, 2048, 1, 4096, 96, 96, 4128, 4128]
    - [113, 15.383]
  - - [64, 2048, 1, 8192, 96, 96, 8224, 8224]
    - [107, 16.963]
  - - [64, 4096, 1, 64, 96, 96, 96, 4096]
    - [88, 2.55]
  - - [64, 4096, 1, 128, 96, 96, 160, 4096]
    - [104, 4.63]
  - - [64, 4096, 1, 256, 96, 96, 288, 4096]
    - [113, 7.941]
  - - [64, 4096, 1, 512, 96, 96, 544, 4096]
    - [113, 12.361]
  - - [64, 4096, 1, 1024, 96, 96, 1056, 4096]
    - [108, 17.077]
  - - [64, 4096, 1, 2048, 96, 96, 2080, 4096]
    - [107, 21.088]
  - - [64, 4096, 1, 4096, 96, 96, 4128, 4128]
    - [103, 23.621]
  - - [64, 4096, 1, 8192, 96, 96, 8224, 8224]
    - [136, 22.716]
  - - [64, 8192, 1, 64, 96, 96, 96, 8192]
    - [125, 4.799]
  - - [64, 8192, 1, 128, 96, 96, 160, 8192]
    - [136, 8.648]
  - - [64, 8192, 1, 256, 96, 96, 288, 8192]
    - [113, 14.138]
  - - [64, 8192, 1, 512, 96, 96, 544, 8192]
    - [127, 20.639]
  - - [64, 8192, 1, 1024, 96, 96, 1056, 8192]
    - [106, 26.839]
  - - [64, 8192, 1, 2048, 96, 96, 2080, 8192]
    - [120, 31.345]
  - - [64, 8192, 1, 4096, 96, 96, 4128, 8192]
    - [118, 34.444]
  - - [64, 8192, 1, 8192, 96, 96, 8224, 8224]
    - [117, 34.216]
  - - [128, 64, 1, 64, 160, 160, 128, 96]
    - [2, 0.086]
  - - [128, 64, 1, 128, 160, 160, 160, 160]
    - [77, 0.164]
  - - [128, 64, 1, 256, 160, 160, 288, 288]
    - [95, 0.309]
  - - [128, 64, 1, 512, 160, 160, 544, 544]
    - [76, 0.543]
  - - [128, 64, 1, 1024, 160, 160, 1056, 1056]
    - [98, 0.881]
  - - [128, 64, 1, 2048, 160, 160, 2080, 2080]
    - [90, 1.271]
  - - [128, 64, 1, 4096, 160, 160, 4128, 4128]
    - [94, 1.635]
  - - [128, 64, 1, 8192, 160, 160, 8224, 8224]
    - [98, 1.898]
  - - [128, 128, 1, 64, 160, 160, 128, 128]
    - [91, 0.174]
  - - [128, 128, 1, 128, 160, 160, 160, 160]
    - [90, 0.337]
  - - [128, 128, 1, 256, 160, 160, 288, 288]
    - [90, 0.624]
  - - [128, 128, 1, 512, 160, 160, 544, 544]
    - [81, 1.103]
  - - [128, 128, 1, 1024, 160, 160, 1056, 1056]
    - [74, 1.402]
  - - [128, 128, 1, 2048, 160, 160, 2080, 2080]
    - [76, 2.56]
  - - [128, 128, 1, 4096, 160, 160, 4128, 4128]
    - [98, 3.262]
  - - [128, 128, 1, 8192, 160, 160, 8224, 8224]
    - [90, 3.793]
  - - [128, 256, 1, 64, 160, 160, 128, 256]
    - [79, 0.352]
  - - [128, 256, 1, 128, 160, 160, 160, 256]
    - [98, 0.675]
  - - [128, 256, 1, 256, 160, 160, 288, 288]
    - [98, 1.263]
  - - [128, 256, 1, 512, 160, 160, 544, 544]
    - [77, 2.206]
  - - [128, 256, 1, 1024, 160, 160, 1056, 1056]
    - [82, 3.557]
  - - [128, 256, 1, 2048, 160, 160, 2080, 2080]
    - [86, 4.916]
  - - [128, 256, 1, 4096, 160, 160, 4128, 4128]
    - [77, 6.52]
  - - [128, 256, 1, 8192, 160, 160, 8224, 8224]
    - [75, 7.475]
  - - [128, 512, 1, 64, 160, 160, 128, 512]
    - [88, 0.692]
  - - [128, 512, 1, 128, 160, 160, 160, 512]
    - [87, 1.304]
  - - [128, 512, 1, 256, 160, 160, 288, 512]
    - [94, 2.377]
  - - [128, 512, 1, 512, 160, 160, 544, 544]
    - [77, 4.054]
  - - [128, 512, 1, 1024, 160, 160, 1056, 1056]
    - [77, 6.207]
  - - [128, 512, 1, 2048, 160, 160, 2080, 2080]
    - [76, 8.386]
  - - [128, 512, 1, 4096, 160, 160, 4128, 4128]
    - [90, 10.13]
  - - [128, 512, 1, 8192, 160, 160, 8224, 8224]
    - [76, 11.326]
  - - [128, 1024, 1, 64, 160, 160, 128, 1024]
    - [73, 1.341]
  - - [128, 1024, 1, 128, 160, 160, 160, 1024]
    - [90, 2.498]
  - - [128, 1024, 1, 256, 160, 160, 288, 1024]
    - [73, 4.483]
  - - [128, 1024, 1, 512, 160, 160, 544, 1024]
    - [88, 7.262]
  - - [128, 1024, 1, 1024, 160, 160, 1056, 1056]
    - [88, 10.522]
  - - [128, 1024, 1, 2048, 160, 160, 2080, 2080]
    - [87, 13.342]
  - - [128, 1024, 1, 4096, 160, 160, 4128, 4128]
    - [88, 15.507]
  - - [128, 1024, 1, 8192, 160, 160, 8224, 8224]
    - [88, 17.321]
  - - [128, 2048, 1, 64, 160, 160, 128, 2048]
    - [10, 2.525]
  - - [128, 2048, 1, 128, 160, 160, 160, 2048]
    - [104, 4.662]
  - - [128, 2048, 1, 256, 160, 160, 288, 2048]
    - [108, 8.039]
  - - [128, 2048, 1, 512, 160, 160, 544, 2048]
    - [104, 12.551]
  - - [128, 2048, 1, 1024, 160, 160, 1056, 2048]
    - [103, 17.394]
  - - [128, 2048, 1, 2048, 160, 160, 2080, 2080]
    - [102, 21.319]
  - - [128, 2048, 1, 4096, 160, 160, 4128, 4128]
    - [103, 24.029]
  - - [128, 2048, 1, 8192, 160, 160, 8224, 8224]
    - [104, 25.14]
  - - [128, 4096, 1, 64, 160, 160, 128, 4096]
    - [8, 4.813]
  - - [128, 4096, 1, 128, 160, 160, 160, 4096]
    - [125, 8.617]
  - - [128, 4096, 1, 256, 160, 160, 288, 4096]
    - [116, 14.071]
  - - [128, 4096, 1, 512, 160, 160, 544, 4096]
    - [116, 20.588]
  - - [128, 4096, 1, 1024, 160, 160, 1056, 4096]
    - [106, 26.783]
  - - [128, 4096, 1, 2048, 160, 160, 2080, 4096]
    - [131, 31.43]
  - - [128, 4096, 1, 4096, 160, 160, 4128, 4128]
    - [130, 34.358]
  - - [128, 4096, 1, 8192, 160, 160, 8224, 8224]
    - [120, 33.775]
  - - [128, 8192, 1, 64, 160, 160, 128, 8192]
    - [8, 8.137]
  - - [128, 8192, 1, 128, 160, 160, 160, 8192]
    - [110, 13.897]
  - - [128, 8192, 1, 256, 160, 160, 288, 8192]
    - [25, 21.835]
  - - [128, 8192, 1, 512, 160, 160, 544, 8192]
    - [25, 30.904]
  - - [128, 8192, 1, 1024, 160, 160, 1056, 8192]
    - [33, 39.004]
  - - [128, 8192, 1, 2048, 160, 160, 2080, 8192]
    - [33, 44.571]
  - - [128, 8192, 1, 4096, 160, 160, 4128, 8192]
    - [61, 47.931]
  - - [128, 8192, 1, 8192, 160, 160, 8224, 8224]
    - [34, 50.108]
  - - [256, 64, 1, 64, 288, 288, 256, 96]
    - [2, 0.175]
  - - [256, 64, 1, 128, 288, 288, 256, 160]
    - [83, 0.336]
  - - [256, 64, 1, 256, 288, 288, 288, 288]
    - [77, 0.626]
  - - [256, 64, 1, 512, 288, 288, 544, 544]
    - [83, 1.098]
  - - [256, 64, 1, 1024, 288, 288, 1056, 1056]
    - [77, 1.777]
  - - [256, 64, 1, 2048, 288, 288, 2080, 2080]
    - [76, 2.568]
  - - [256, 64, 1, 4096, 288, 288, 4128, 4128]
    - [89, 3.292]
  - - [256, 64, 1, 8192, 288, 288, 8224, 8224]
    - [90, 3.722]
  - - [256, 128, 1, 64, 288, 288, 256, 128]
    - [98, 0.35]
  - - [256, 128, 1, 128, 288, 288, 256, 160]
    - [3, 0.656]
  - - [256, 128, 1, 256, 288, 288, 288, 288]
    - [91, 1.256]
  - - [256, 128, 1, 512, 288, 288, 544, 544]
    - [94, 2.221]
  - - [256, 128, 1, 1024, 288, 288, 1056, 1056]
    - [75, 3.561]
  - - [256, 128, 1, 2048, 288, 288, 2080, 2080]
    - [98, 5.134]
  - - [256, 128, 1, 4096, 288, 288, 4128, 4128]
    - [82, 6.568]
  - - [256, 128, 1, 8192, 288, 288, 8224, 8224]
    - [89, 7.599]
  - - [256, 256, 1, 64, 288, 288, 256, 256]
    - [98, 0.693]
  - - [256, 256, 1, 128, 288, 288, 256, 256]
    - [90, 1.313]
  - - [256, 256, 1, 256, 288, 288, 288, 288]
    - [77, 2.392]
  - - [256, 256, 1, 512, 288, 288, 544, 544]
    - [77, 4.05]
  - - [256, 256, 1, 1024, 288, 288, 1056, 1056]
    - [76, 6.185]
  - - [256, 256, 1, 2048, 288, 288, 2080, 2080]
    - [90, 8.384]
  - - [256, 256, 1, 4096, 288, 288, 4128, 4128]
    - [75, 10.145]
  - - [256, 256, 1, 8192, 288, 288, 8224, 8224]
    - [76, 11.28]
  - - [256, 512, 1, 64, 288, 288, 256, 512]
    - [92, 1.343]
  - - [256, 512, 1, 128, 288, 288, 256, 512]
    - [79, 2.49]
  - - [256, 512, 1, 256, 288, 288, 288, 512]
    - [76, 4.432]
  - - [256, 512, 1, 512, 288, 288, 544, 544]
    - [74, 7.254]
  - - [256, 512, 1, 1024, 288, 288, 1056, 1056]
    - [74, 10.402]
  - - [256, 512, 1, 2048, 288, 288, 2080, 2080]
    - [80, 13.349]
  - - [256, 512, 1, 4096, 288, 288, 4128, 4128]
    - [113, 15.412]
  - - [256, 512, 1, 8192, 288, 288, 8224, 8224]
    - [126, 16.861]
  - - [256, 1024, 1, 64, 288, 288, 256, 1024]
    - [7, 2.534]
  - - [256, 1024, 1, 128, 288, 288, 256, 1024]
    - [129, 4.62]
  - - [256, 1024, 1, 256, 288, 288, 288, 1024]
    - [111, 8.062]
  - - [256, 1024, 1, 512, 288, 288, 544, 1024]
    - [104, 12.644]
  - - [256, 1024, 1, 1024, 288, 288, 1056, 1056]
    - [103, 17.406]
  - - [256, 1024, 1, 2048, 288, 288, 2080, 2080]
    - [104, 21.767]
  - - [256, 1024, 1, 4096, 288, 288, 4128, 4128]
    - [103, 24.532]
  - - [256, 1024, 1, 8192, 288, 288, 8224, 8224]
    - [104, 25.406]
  - - [256, 2048, 1, 64, 288, 288, 256, 2048]
    - [9, 4.796]
  - - [256, 2048, 1, 128, 288, 288, 256, 2048]
    - [4, 8.587]
  - - [256, 2048, 1, 256, 288, 288, 288, 2048]
    - [111, 14.176]
  - - [256, 2048, 1, 512, 288, 288, 544, 2048]
    - [134, 20.743]
  - - [256, 2048, 1, 1024, 288, 288, 1056, 2048]
    - [106, 26.822]
  - - [256, 2048, 1, 2048, 288, 288, 2080, 2080]
    - [107, 31.28]
  - - [256, 2048, 1, 4096, 288, 288, 4128, 4128]
    - [131, 34.595]
  - - [256, 2048, 1, 8192, 288, 288, 8224, 8224]
    - [124, 35.54]
  - - [256, 4096, 1, 64, 288, 288, 256, 4096]
    - [5, 8.135]
  - - [256, 4096, 1, 128, 288, 288, 256, 4096]
    - [129, 13.842]
  - - [256, 4096, 1, 256, 288, 288, 288, 4096]
    - [51, 21.891]
  - - [256, 4096, 1, 512, 288, 288, 544, 4096]
    - [25, 31.397]
  - - [256, 4096, 1, 1024, 288, 288, 1056, 4096]
    - [26, 39.131]
  - - [256, 4096, 1, 2048, 288, 288, 2080, 4096]
    - [25, 44.81]
  - - [256, 4096, 1, 4096, 288, 288, 4128, 4128]
    - [51, 47.093]
  - - [256, 4096, 1, 8192, 288, 288, 8224, 8224]
    - [67, 41.441]
  - - [256, 8192, 1, 64, 288, 288, 256, 8192]
    - [6, 13.265]
  - - [256, 8192, 1, 128, 288, 288, 256, 8192]
    - [20, 22.073]
  - - [256, 8192, 1, 256, 288, 288, 288, 8192]
    - [49, 33.098]
  - - [256, 8192, 1, 512, 288, 288, 544, 8192]
    - [23, 44.644]
  - - [256, 8192, 1, 1024, 288, 288, 1056, 8192]
    - [23, 54.134]
  - - [256, 8192, 1, 2048, 288, 288, 2080, 8192]
    - [22, 56.378]
  - - [256, 8192, 1, 4096, 288, 288, 4128, 8192]
    - [21, 60.818]
  - - [256, 8192, 1, 8192, 288, 288, 8224, 8224]
    - [32, 58.521]
  - - [384, 64, 1, 64, 416, 416, 384, 96]
    - [1, 0.263]
  - - [384, 64, 1, 128, 416, 416, 384, 160]
    - [77, 0.502]
  - - [384, 64, 1, 256, 416, 416, 384, 288]
    - [83, 0.945]
  - - [384, 64, 1, 512, 416, 416, 544, 544]
    - [76, 1.67]
  - - [384, 64, 1, 1024, 416, 416, 1056, 1056]
    - [95, 2.678]
  - - [384, 64, 1, 2048, 416, 416, 2080, 2080]
    - [75, 3.842]
  - - [384, 64, 1, 4096, 416, 416, 4128, 4128]
    - [85, 4.916]
  - - [384, 64, 1, 8192, 416, 416, 8224, 8224]
    - [85, 5.668]
  - - [384, 128, 1, 64, 416, 416, 384, 128]
    - [86, 0.531]
  - - [384, 128, 1, 128, 416, 416, 384, 160]
    - [77, 1.022]
  - - [384, 128, 1, 256, 416, 416, 384, 288]
    - [95, 1.892]
  - - [384, 128, 1, 512, 416, 416, 544, 544]
    - [98, 3.309]
  - - [384, 128, 1, 1024, 416, 416, 1056, 1056]
    - [98, 5.349]
  - - [384, 128, 1, 2048, 416, 416, 2080, 2080]
    - [89, 7.659]
  - - [384, 128, 1, 4096, 416, 416, 4128, 4128]
    - [75, 9.786]
  - - [384, 128, 1, 8192, 416, 416, 8224, 8224]
    - [90, 11.383]
  - - [384, 256, 1, 64, 416, 416, 384, 256]
    - [77, 1.034]
  - - [384, 256, 1, 128, 416, 416, 384, 256]
    - [77, 1.958]
  - - [384, 256, 1, 256, 416, 416, 384, 288]
    - [77, 3.576]
  - - [384, 256, 1, 512, 416, 416, 544, 544]
    - [76, 6.004]
  - - [384, 256, 1, 1024, 416, 416, 1056, 1056]
    - [77, 9.189]
  - - [384, 256, 1, 2048, 416, 416, 2080, 2080]
    - [76, 12.489]
  - - [384, 256, 1, 4096, 416, 416, 4128, 4128]
    - [77, 14.756]
  - - [384, 256, 1, 8192, 416, 416, 8224, 8224]
    - [75, 16.798]
  - - [384, 512, 1, 64, 416, 416, 384, 512]
    - [102, 1.986]
  - - [384, 512, 1, 128, 416, 416, 384, 512]
    - [127, 3.7]
  - - [384, 512, 1, 256, 416, 416, 384, 512]
    - [108, 6.492]
  - - [384, 512, 1, 512, 416, 416, 544, 544]
    - [127, 10.571]
  - - [384, 512, 1, 1024, 416, 416, 1056, 1056]
    - [127, 15.418]
  - - [384, 512, 1, 2048, 416, 416, 2080, 2080]
    - [132, 19.825]
  - - [384, 512, 1, 4096, 416, 416, 4128, 4128]
    - [126, 23.064]
  - - [384, 512, 1, 8192, 416, 416, 8224, 8224]
    - [126, 25.249]
  - - [384, 1024, 1, 64, 416, 416, 384, 1024]
    - [127, 3.77]
  - - [384, 1024, 1, 128, 416, 416, 384, 1024]
    - [135, 6.977]
  - - [384, 1024, 1, 256, 416, 416, 384, 1024]
    - [104, 12.003]
  - - [384, 1024, 1, 512, 416, 416, 544, 1024]
    - [104, 18.875]
  - - [384, 1024, 1, 1024, 416, 416, 1056, 1056]
    - [104, 26.374]
  - - [384, 1024, 1, 2048, 416, 416, 2080, 2080]
    - [124, 32.484]
  - - [384, 1024, 1, 4096, 416, 416, 4128, 4128]
    - [124, 36.804]
  - - [384, 1024, 1, 8192, 416, 416, 8224, 8224]
    - [102, 38.601]
  - - [384, 2048, 1, 64, 416, 416, 384, 2048]
    - [9, 6.832]
  - - [384, 2048, 1, 128, 416, 416, 384, 2048]
    - [5, 11.937]
  - - [384, 2048, 1, 256, 416, 416, 384, 2048]
    - [109, 18.816]
  - - [384, 2048, 1, 512, 416, 416, 544, 2048]
    - [129, 26.622]
  - - [384, 2048, 1, 1024, 416, 416, 1056, 2048]
    - [104, 33.135]
  - - [384, 2048, 1, 2048, 416, 416, 2080, 2080]
    - [104, 37.733]
  - - [384, 2048, 1, 4096, 416, 416, 4128, 4128]
    - [124, 39.052]
  - - [384, 2048, 1, 8192, 416, 416, 8224, 8224]
    - [103, 41.341]
  - - [384, 4096, 1, 64, 416, 416, 384, 4096]
    - [71, 11.077]
  - - [384, 4096, 1, 128, 416, 416, 384, 4096]
    - [25, 19.446]
  - - [384, 4096, 1, 256, 416, 416, 384, 4096]
    - [65, 31.472]
  - - [384, 4096, 1, 512, 416, 416, 544, 4096]
    - [25, 45.281]
  - - [384, 4096, 1, 1024, 416, 416, 1056, 4096]
    - [25, 57.739]
  - - [384, 4096, 1, 2048, 416, 416, 2080, 4096]
    - [33, 65.472]
  - - [384, 4096, 1, 4096, 416, 416, 4128, 4128]
    - [33, 69.159]
  - - [384, 4096, 1, 8192, 416, 416, 8224, 8224]
    - [53, 52.555]
  - - [384, 8192, 1, 64, 416, 416, 384, 8192]
    - [19, 18.126]
  - - [384, 8192, 1, 128, 416, 416, 384, 8192]
    - [62, 29.481]
  - - [384, 8192, 1, 256, 416, 416, 384, 8192]
    - [32, 43.05]
  - - [384, 8192, 1, 512, 416, 416, 544, 8192]
    - [50, 57.798]
  - - [384, 8192, 1, 1024, 416, 416, 1056, 8192]
    - [24, 69.043]
  - - [384, 8192, 1, 2048, 416, 416, 2080, 8192]
    - [53, 73.225]
  - - [384, 8192, 1, 4096, 416, 416, 4128, 8192]
    - [28, 79.239]
  - - [384, 8192, 1, 8192, 416, 416, 8224, 8224]
    - [65, 66.2]
  - - [768, 64, 1, 64, 800, 800, 768, 96]
    - [88, 0.497]
  - - [768, 64, 1, 128, 800, 800, 768, 160]
    - [86, 1.018]
  - - [768, 64, 1, 256, 800, 800, 768, 288]
    - [86, 1.887]
  - - [768, 64, 1, 512, 800, 800, 768, 544]
    - [91, 3.332]
  - - [768, 64, 1, 1024, 800, 800, 1056, 1056]
    - [77, 5.337]
  - - [768, 64, 1, 2048, 800, 800, 2080, 2080]
    - [76, 7.688]
  - - [768, 64, 1, 4096, 800, 800, 4128, 4128]
    - [90, 9.767]
  - - [768, 64, 1, 8192, 800, 800, 8224, 8224]
    - [90, 11.291]
  - - [768, 128, 1, 64, 800, 800, 768, 128]
    - [97, 1.035]
  - - [768, 128, 1, 128, 800, 800, 768, 160]
    - [91, 1.951]
  - - [768, 128, 1, 256, 800, 800, 768, 288]
    - [77, 3.531]
  - - [768, 128, 1, 512, 800, 800, 768, 544]
    - [91, 6.03]
  - - [768, 128, 1, 1024, 800, 800, 1056, 1056]
    - [76, 9.209]
  - - [768, 128, 1, 2048, 800, 800, 2080, 2080]
    - [76, 12.5]
  - - [768, 128, 1, 4096, 800, 800, 4128, 4128]
    - [98, 14.586]
  - - [768, 128, 1, 8192, 800, 800, 8224, 8224]
    - [90, 16.813]
  - - [768, 256, 1, 64, 800, 800, 768, 256]
    - [122, 1.987]
  - - [768, 256, 1, 128, 800, 800, 768, 256]
    - [102, 3.695]
  - - [768, 256, 1, 256, 800, 800, 768, 288]
    - [107, 6.476]
  - - [768, 256, 1, 512, 800, 800, 768, 544]
    - [132, 10.573]
  - - [768, 256, 1, 1024, 800, 800, 1056, 1056]
    - [108, 15.415]
  - - [768, 256, 1, 2048, 800, 800, 2080, 2080]
    - [125, 19.738]
  - - [768, 256, 1, 4096, 800, 800, 4128, 4128]
    - [112, 23.06]
  - - [768, 256, 1, 8192, 800, 800, 8224, 8224]
    - [136, 25.192]
  - - [768, 512, 1, 64, 800, 800, 768, 512]
    - [108, 3.763]
  - - [768, 512, 1, 128, 800, 800, 768, 512]
    - [108, 6.919]
  - - [768, 512, 1, 256, 800, 800, 768, 512]
    - [135, 11.996]
  - - [768, 512, 1, 512, 800, 800, 768, 544]
    - [104, 18.963]
  - - [768, 512, 1, 1024, 800, 800, 1056, 1056]
    - [104, 26.466]
  - - [768, 512, 1, 2048, 800, 800, 2080, 2080]
    - [124, 32.53]
  - - [768, 512, 1, 4096, 800, 800, 4128, 4128]
    - [101, 36.26]
  - - [768, 512, 1, 8192, 800, 800, 8224, 8224]
    - [123, 38.239]
  - - [768, 1024, 1, 64, 800, 800, 768, 1024]
    - [7, 6.753]
  - - [768, 1024, 1, 128, 800, 800, 768, 1024]
    - [5, 11.872]
  - - [768, 1024, 1, 256, 800, 800, 768, 1024]
    - [124, 18.872]
  - - [768, 1024, 1, 512, 800, 800, 768, 1024]
    - [104, 26.51]
  - - [768, 1024, 1, 1024, 800, 800, 1056, 1056]
    - [137, 33.142]
  - - [768, 1024, 1, 2048, 800, 800, 2080, 2080]
    - [102, 37.747]
  - - [768, 1024, 1, 4096, 800, 800, 4128, 4128]
    - [101, 39.215]
  - - [768, 1024, 1, 8192, 800, 800, 8224, 8224]
    - [112, 41.352]
  - - [768, 2048, 1, 64, 800, 800, 768, 2048]
    - [41, 11.022]
  - - [768, 2048, 1, 128, 800, 800, 768, 2048]
    - [33, 19.398]
  - - [768, 2048, 1, 256, 800, 800, 768, 2048]
    - [33, 31.23]
  - - [768, 2048, 1, 512, 800, 800, 768, 2048]
    - [33, 45.087]
  - - [768, 2048, 1, 1024, 800, 800, 1056, 2048]
    - [33, 57.749]
  - - [768, 2048, 1, 2048, 800, 800, 2080, 2080]
    - [62, 65.546]
  - - [768, 2048, 1, 4096, 800, 800, 4128, 4128]
    - [62, 69.213]
  - - [768, 2048, 1, 8192, 800, 800, 8224, 8224]
    - [50, 73.247]
  - - [768, 4096, 1, 64, 800, 800, 768, 4096]
    - [19, 18.092]
  - - [768, 4096, 1, 128, 800, 800, 768, 4096]
    - [38, 29.391]
  - - [768, 4096, 1, 256, 800, 800, 768, 4096]
    - [26, 43.372]
  - - [768, 4096, 1, 512, 800, 800, 768, 4096]
    - [24, 56.863]
  - - [768, 4096, 1, 1024, 800, 800, 1056, 4096]
    - [24, 67.991]
  - - [768, 4096, 1, 2048, 800, 800, 2080, 4096]
    - [28, 73.326]
  - - [768, 4096, 1, 4096, 800, 800, 4128, 4128]
    - [25, 78.2]
  - - [768, 4096, 1, 8192, 800, 800, 8224, 8224]
    - [35, 66.081]
  - - [768, 8192, 1, 64, 800, 800, 768, 8192]
    - [48, 25.125]
  - - [768, 8192, 1, 128, 800, 800, 768, 8192]
    - [42, 38.234]
  - - [768, 8192, 1, 256, 800, 800, 768, 8192]
    - [36, 51.169]
  - - [768, 8192, 1, 512, 800, 800, 768, 8192]
    - [19, 62.961]
  - - [768, 8192, 1, 1024, 800, 800, 1056, 8192]
    - [19, 69.313]
  - - [768, 8192, 1, 2048, 800, 800, 2080, 8192]
    - [29, 74.274]
  - - [768, 8192, 1, 4096, 800, 800, 4128, 8192]
    - [14, 62.398]
  - - [768, 8192, 1, 8192, 800, 800, 8224, 8224]
    - [49, 60.281]
  - - [1536, 64, 1, 64, 1568, 1568, 1536, 96]
    - [0, 0.975]
  - - [1536, 64, 1, 128, 1568, 1568, 1536, 160]
    - [77, 1.933]
  - - [1536, 64, 1, 256, 1568, 1568, 1536, 288]
    - [95, 3.559]
  - - [1536, 64, 1, 512, 1568, 1568, 1536, 544]
    - [91, 6.066]
  - - [1536, 64, 1, 1024, 1568, 1568, 1536, 1056]
    - [76, 9.246]
  - - [1536, 64, 1, 2048, 1568, 1568, 2080, 2080]
    - [76, 12.535]
  - - [1536, 64, 1, 4096, 1568, 1568, 4128, 4128]
    - [90, 15.084]
  - - [1536, 64, 1, 8192, 1568, 1568, 8224, 8224]
    - [90, 16.976]
  - - [1536, 128, 1, 64, 1568, 1568, 1536, 128]
    - [78, 1.982]
  - - [1536, 128, 1, 128, 1568, 1568, 1536, 160]
    - [127, 3.698]
  - - [1536, 128, 1, 256, 1568, 1568, 1536, 288]
    - [127, 6.521]
  - - [1536, 128, 1, 512, 1568, 1568, 1536, 544]
    - [125, 10.555]
  - - [1536, 128, 1, 1024, 1568, 1568, 1536, 1056]
    - [108, 15.354]
  - - [1536, 128, 1, 2048, 1568, 1568, 2080, 2080]
    - [127, 19.794]
  - - [1536, 128, 1, 4096, 1568, 1568, 4128, 4128]
    - [112, 22.991]
  - - [1536, 128, 1, 8192, 1568, 1568, 8224, 8224]
    - [120, 25.235]
  - - [1536, 256, 1, 64, 1568, 1568, 1536, 256]
    - [135, 3.773]
  - - [1536, 256, 1, 128, 1568, 1568, 1536, 256]
    - [129, 6.876]
  - - [1536, 256, 1, 256, 1568, 1568, 1536, 288]
    - [104, 12.021]
  - - [1536, 256, 1, 512, 1568, 1568, 1536, 544]
    - [135, 18.749]
  - - [1536, 256, 1, 1024, 1568, 1568, 1536, 1056]
    - [102, 26.042]
  - - [1536, 256, 1, 2048, 1568, 1568, 2080, 2080]
    - [122, 32.463]
  - - [1536, 256, 1, 4096, 1568, 1568, 4128, 4128]
    - [101, 36.769]
  - - [1536, 256, 1, 8192, 1568, 1568, 8224, 8224]
    - [101, 38.399]
  - - [1536, 512, 1, 64, 1568, 1568, 1536, 512]
    - [5, 6.773]
  - - [1536, 512, 1, 128, 1568, 1568, 1536, 512]
    - [5, 11.865]
  - - [1536, 512, 1, 256, 1568, 1568, 1536, 512]
    - [114, 18.799]
  - - [1536, 512, 1, 512, 1568, 1568, 1536, 544]
    - [128, 26.374]
  - - [1536, 512, 1, 1024, 1568, 1568, 1536, 1056]
    - [102, 33.192]
  - - [1536, 512, 1, 2048, 1568, 1568, 2080, 2080]
    - [124, 37.673]
  - - [1536, 512, 1, 4096, 1568, 1568, 4128, 4128]
    - [108, 38.885]
  - - [1536, 512, 1, 8192, 1568, 1568, 8224, 8224]
    - [132, 41.376]
  - - [1536, 1024, 1, 64, 1568, 1568, 1536, 1024]
    - [19, 10.946]
  - - [1536, 1024, 1, 128, 1568, 1568, 1536, 1024]
    - [70, 19.303]
  - - [1536, 1024, 1, 256, 1568, 1568, 1536, 1024]
    - [51, 30.871]
  - - [1536, 1024, 1, 512, 1568, 1568, 1536, 1024]
    - [25, 45.014]
  - - [1536, 1024, 1, 1024, 1568, 1568, 1536, 1056]
    - [16, 57.244]
  - - [1536, 1024, 1, 2048, 1568, 1568, 2080, 2080]
    - [13, 66.366]
  - - [1536, 1024, 1, 4096, 1568, 1568, 4128, 4128]
    - [17, 69.546]
  - - [1536, 1024, 1, 8192, 1568, 1568, 8224, 8224]
    - [64, 73.061]
  - - [1536, 2048, 1, 64, 1568, 1568, 1536, 2048]
    - [48, 17.262]
  - - [1536, 2048, 1, 128, 1568, 1568, 1536, 2048]
    - [39, 29.309]
  - - [1536, 2048, 1, 256, 1568, 1568, 1536, 2048]
    - [51, 43.601]
  - - [1536, 2048, 1, 512, 1568, 1568, 1536, 2048]
    - [52, 58.519]
  - - [1536, 2048, 1, 1024, 1568, 1568, 1536, 2048]
    - [25, 69.38]
  - - [1536, 2048, 1, 2048, 1568, 1568, 2080, 2080]
    - [54, 73.353]
  - - [1536, 2048, 1, 4096, 1568, 1568, 4128, 4128]
    - [52, 78.971]
  - - [1536, 2048, 1, 8192, 1568, 1568, 8224, 8224]
    - [54, 75.971]
  - - [1536, 4096, 1, 64, 1568, 1568, 1536, 4096]
    - [49, 25.198]
  - - [1536, 4096, 1, 128, 1568, 1568, 1536, 4096]
    - [54, 38.173]
  - - [1536, 4096, 1, 256, 1568, 1568, 1536, 4096]
    - [72, 51.078]
  - - [1536, 4096, 1, 512, 1568, 1568, 1536, 4096]
    - [19, 63.345]
  - - [1536, 4096, 1, 1024, 1568, 1568, 1536, 4096]
    - [19, 69.635]
  - - [1536, 4096, 1, 2048, 1568, 1568, 2080, 4096]
    - [46, 75.272]
  - - [1536, 4096, 1, 4096, 1568, 1568, 4128, 4128]
    - [47, 66.487]
  - - [1536, 4096, 1, 8192, 1568, 1568, 8224, 8224]
    - [46, 63.324]
  - - [1536, 8192, 1, 64, 1568, 1568, 1536, 8192]
    - [60, 31.456]
  - - [1536, 8192, 1, 128, 1568, 1568, 1536, 8192]
    - [72, 45.332]
  - - [1536, 8192, 1, 256, 1568, 1568, 1536, 8192]
    - [48, 58.702]
  - - [1536, 8192, 1, 512, 1568, 1568, 1536, 8192]
    - [19, 68.396]
  - - [1536, 8192, 1, 1024, 1568, 1568, 1536, 8192]
    - [18, 76.127]
  - - [1536, 8192, 1, 2048, 1568, 1568, 2080, 8192]
    - [30, 64.034]
  - - [1536, 8192, 1, 4096, 1568, 1568, 4128, 8192]
    - [48, 62.779]
  - - [1536, 8192, 1, 8192, 1568, 1568, 8224, 8224]
    - [19, 63.806]
  - - [3072, 64, 1, 64, 3104, 3104, 3072, 96]
    - [2, 1.874]
  - - [3072, 64, 1, 128, 3104, 3104, 3072, 160]
    - [8, 3.677]
  - - [3072, 64, 1, 256, 3104, 3104, 3072, 288]
    - [108, 6.542]
  - - [3072, 64, 1, 512, 3104, 3104, 3072, 544]
    - [108, 10.566]
  - - [3072, 64, 1, 1024, 3104, 3104, 3072, 1056]
    - [107, 15.271]
  - - [3072, 64, 1, 2048, 3104, 3104, 3072, 2080]
    - [120, 19.81]
  - - [3072, 64, 1, 4096, 3104, 3104, 4128, 4128]
    - [127, 22.638]
  - - [3072, 64, 1, 8192, 3104, 3104, 8224, 8224]
    - [127, 25.176]
  - - [3072, 128, 1, 64, 3104, 3104, 3072, 128]
    - [128, 3.77]
  - - [3072, 128, 1, 128, 3104, 3104, 3072, 160]
    - [104, 6.922]
  - - [3072, 128, 1, 256, 3104, 3104, 3072, 288]
    - [124, 11.885]
  - - [3072, 128, 1, 512, 3104, 3104, 3072, 544]
    - [115, 18.498]
  - - [3072, 128, 1, 1024, 3104, 3104, 3072, 1056]
    - [102, 25.571]
  - - [3072, 128, 1, 2048, 3104, 3104, 3072, 2080]
    - [101, 31.86]
  - - [3072, 128, 1, 4096, 3104, 3104, 4128, 4128]
    - [104, 35.662]
  - - [3072, 128, 1, 8192, 3104, 3104, 8224, 8224]
    - [102, 37.551]
  - - [3072, 256, 1, 64, 3104, 3104, 3072, 256]
    - [108, 6.782]
  - - [3072, 256, 1, 128, 3104, 3104, 3072, 256]
    - [121, 11.825]
  - - [3072, 256, 1, 256, 3104, 3104, 3072, 288]
    - [128, 18.743]
  - - [3072, 256, 1, 512, 3104, 3104, 3072, 544]
    - [109, 26.21]
  - - [3072, 256, 1, 1024, 3104, 3104, 3072, 1056]
    - [133, 32.608]
  - - [3072, 256, 1, 2048, 3104, 3104, 3072, 2080]
    - [102, 37.314]
  - - [3072, 256, 1, 4096, 3104, 3104, 4128, 4128]
    - [127, 38.742]
  - - [3072, 256, 1, 8192, 3104, 3104, 8224, 8224]
    - [119, 41.335]
  - - [3072, 512, 1, 64, 3104, 3104, 3072, 512]
    - [70, 10.961]
  - - [3072, 512, 1, 128, 3104, 3104, 3072, 512]
    - [25, 19.327]
  - - [3072, 512, 1, 256, 3104, 3104, 3072, 512]
    - [25, 31.157]
  - - [3072, 512, 1, 512, 3104, 3104, 3072, 544]
    - [52, 44.213]
  - - [3072, 512, 1, 1024, 3104, 3104, 3072, 1056]
    - [26, 57.247]
  - - [3072, 512, 1, 2048, 3104, 3104, 3072, 2080]
    - [26, 65.159]
  - - [3072, 512, 1, 4096, 3104, 3104, 4128, 4128]
    - [52, 69.258]
  - - [3072, 512, 1, 8192, 3104, 3104, 8224, 8224]
    - [17, 67.904]
  - - [3072, 1024, 1, 64, 3104, 3104, 3072, 1024]
    - [37, 17.175]
  - - [3072, 1024, 1, 128, 3104, 3104, 3072, 1024]
    - [35, 29.262]
  - - [3072, 1024, 1, 256, 3104, 3104, 3072, 1024]
    - [52, 43.647]
  - - [3072, 1024, 1, 512, 3104, 3104, 3072, 1024]
    - [27, 58.182]
  - - [3072, 1024, 1, 1024, 3104, 3104, 3072, 1056]
    - [27, 69.216]
  - - [3072, 1024, 1, 2048, 3104, 3104, 3072, 2080]
    - [28, 73.133]
  - - [3072, 1024, 1, 4096, 3104, 3104, 4128, 4128]
    - [27, 79.724]
  - - [3072, 1024, 1, 8192, 3104, 3104, 8224, 8224]
    - [26, 78.246]
  - - [3072, 2048, 1, 64, 3104, 3104, 3072, 2048]
    - [48, 25.055]
  - - [3072, 2048, 1, 128, 3104, 3104, 3072, 2048]
    - [54, 38.101]
  - - [3072, 2048, 1, 256, 3104, 3104, 3072, 2048]
    - [72, 50.934]
  - - [3072, 2048, 1, 512, 3104, 3104, 3072, 2048]
    - [59, 62.995]
  - - [3072, 2048, 1, 1024, 3104, 3104, 3072, 2048]
    - [45, 69.435]
  - - [3072, 2048, 1, 2048, 3104, 3104, 3072, 2080]
    - [19, 75.566]
  - - [3072, 2048, 1, 4096, 3104, 3104, 4128, 4128]
    - [15, 66.761]
  - - [3072, 2048, 1, 8192, 3104, 3104, 8224, 8224]
    - [46, 62.465]
  - - [3072, 4096, 1, 64, 3104, 3104, 3072, 4096]
    - [49, 31.314]
  - - [3072, 4096, 1, 128, 3104, 3104, 3072, 4096]
    - [55, 45.208]
  - - [3072, 4096, 1, 256, 3104, 3104, 3072, 4096]
    - [20, 58.722]
  - - [3072, 4096, 1, 512, 3104, 3104, 3072, 4096]
    - [48, 68.086]
  - - [3072, 4096, 1, 1024, 3104, 3104, 3072, 4096]
    - [56, 74.827]
  - - [3072, 4096, 1, 2048, 3104, 3104, 3072, 4096]
    - [19, 67.336]
  - - [3072, 4096, 1, 4096, 3104, 3104, 4128, 4128]
    - [16, 67.023]
  - - [3072, 4096, 1, 8192, 3104, 3104, 8224, 8224]
    - [16, 64.742]
  - - [3072, 8192, 1, 64, 3104, 3104, 3072, 8192]
    - [20, 35.879]
  - - [3072, 8192, 1, 128, 3104, 3104, 3072, 8192]
    - [43, 48.135]
  - - [3072, 8192, 1, 256, 3104, 3104, 3072, 8192]
    - [49, 62.361]
  - - [3072, 8192, 1, 512, 3104, 3104, 3072, 8192]
    - [48, 73.57]
  - - [3072, 8192, 1, 1024, 3104, 3104, 3072, 8192]
    - [46, 64.707]
  - - [3072, 8192, 1, 2048, 3104, 3104, 3072, 8192]
    - [58, 64.51]
  - - [3072, 8192, 1, 4096, 3104, 3104, 4128, 8192]
    - [18, 65.027]
  - - [3072, 8192, 1, 8192, 3104, 3104, 8224, 8224]
    - [18, 64.198]
  - - [6144, 64, 1, 64, 6176, 6176, 6144, 96]
    - [4, 3.495]
  - - [6144, 64, 1, 128, 6176, 6176, 6144, 160]
    - [116, 6.863]
  - - [6144, 64, 1, 256, 6176, 6176, 6144, 288]
    - [135, 11.785]
  - - [6144, 64, 1, 512, 6176, 6176, 6144, 544]
    - [6, 17.834]
  - - [6144, 64, 1, 1024, 6176, 6176, 6144, 1056]
    - [127, 25.432]
  - - [6144, 64, 1, 2048, 6176, 6176, 6144, 2080]
    - [126, 31.323]
  - - [6144, 64, 1, 4096, 6176, 6176, 6144, 4128]
    - [105, 34.812]
  - - [6144, 64, 1, 8192, 6176, 6176, 8224, 8224]
    - [108, 37.138]
  - - [6144, 128, 1, 64, 6176, 6176, 6144, 128]
    - [7, 6.531]
  - - [6144, 128, 1, 128, 6176, 6176, 6144, 160]
    - [5, 11.825]
  - - [6144, 128, 1, 256, 6176, 6176, 6144, 288]
    - [138, 18.726]
  - - [6144, 128, 1, 512, 6176, 6176, 6144, 544]
    - [5, 26.221]
  - - [6144, 128, 1, 1024, 6176, 6176, 6144, 1056]
    - [5, 32.85]
  - - [6144, 128, 1, 2048, 6176, 6176, 6144, 2080]
    - [7, 37.111]
  - - [6144, 128, 1, 4096, 6176, 6176, 6144, 4128]
    - [107, 38.788]
  - - [6144, 128, 1, 8192, 6176, 6176, 8224, 8224]
    - [119, 41.676]
  - - [6144, 256, 1, 64, 6176, 6176, 6144, 256]
    - [11, 11.147]
  - - [6144, 256, 1, 128, 6176, 6176, 6144, 256]
    - [51, 19.973]
  - - [6144, 256, 1, 256, 6176, 6176, 6144, 288]
    - [51, 31.737]
  - - [6144, 256, 1, 512, 6176, 6176, 6144, 544]
    - [25, 45.228]
  - - [6144, 256, 1, 1024, 6176, 6176, 6144, 1056]
    - [25, 57.818]
  - - [6144, 256, 1, 2048, 6176, 6176, 6144, 2080]
    - [52, 65.967]
  - - [6144, 256, 1, 4096, 6176, 6176, 6144, 4128]
    - [24, 69.086]
  - - [6144, 256, 1, 8192, 6176, 6176, 8224, 8224]
    - [26, 61.549]
  - - [6144, 512, 1, 64, 6176, 6176, 6144, 512]
    - [46, 17.641]
  - - [6144, 512, 1, 128, 6176, 6176, 6144, 512]
    - [63, 29.177]
  - - [6144, 512, 1, 256, 6176, 6176, 6144, 512]
    - [25, 43.339]
  - - [6144, 512, 1, 512, 6176, 6176, 6144, 544]
    - [26, 56.178]
  - - [6144, 512, 1, 1024, 6176, 6176, 6144, 1056]
    - [27, 68.082]
  - - [6144, 512, 1, 2048, 6176, 6176, 6144, 2080]
    - [27, 73.243]
  - - [6144, 512, 1, 4096, 6176, 6176, 6144, 4128]
    - [28, 79.325]
  - - [6144, 512, 1, 8192, 6176, 6176, 8224, 8224]
    - [27, 79.133]
  - - [6144, 1024, 1, 64, 6176, 6176, 6144, 1024]
    - [20, 24.736]
  - - [6144, 1024, 1, 128, 6176, 6176, 6144, 1024]
    - [66, 38.064]
  - - [6144, 1024, 1, 256, 6176, 6176, 6144, 1024]
    - [72, 50.851]
  - - [6144, 1024, 1, 512, 6176, 6176, 6144, 1024]
    - [69, 62.881]
  - - [6144, 1024, 1, 1024, 6176, 6176, 6144, 1056]
    - [49, 69.416]
  - - [6144, 1024, 1, 2048, 6176, 6176, 6144, 2080]
    - [57, 75.447]
  - - [6144, 1024, 1, 4096, 6176, 6176, 6144, 4128]
    - [48, 67.914]
  - - [6144, 1024, 1, 8192, 6176, 6176, 8224, 8224]
    - [49, 60.67]
  - - [6144, 2048, 1, 64, 6176, 6176, 6144, 2048]
    - [49, 31.153]
  - - [6144, 2048, 1, 128, 6176, 6176, 6144, 2048]
    - [55, 45.166]
  - - [6144, 2048, 1, 256, 6176, 6176, 6144, 2048]
    - [49, 58.721]
  - - [6144, 2048, 1, 512, 6176, 6176, 6144, 2048]
    - [48, 68.427]
  - - [6144, 2048, 1, 1024, 6176, 6176, 6144, 2048]
    - [49, 76.047]
  - - [6144, 2048, 1, 2048, 6176, 6176, 6144, 2080]
    - [49, 65.058]
  - - [6144, 2048, 1, 4096, 6176, 6176, 6144, 4128]
    - [47, 66.556]
  - - [6144, 2048, 1, 8192, 6176, 6176, 8224, 8224]
    - [46, 61.816]
  - - [6144, 4096, 1, 64, 6176, 6176, 6144, 4096]
    - [49, 35.813]
  - - [6144, 4096, 1, 128, 6176, 6176, 6144, 4096]
    - [55, 48.258]
  - - [6144, 4096, 1, 256, 6176, 6176, 6144, 4096]
    - [40, 62.395]
  - - [6144, 4096, 1, 512, 6176, 6176, 6144, 4096]
    - [16, 73.457]
  - - [6144, 4096, 1, 1024, 6176, 6176, 6144, 4096]
    - [12, 66.717]
  - - [6144, 4096, 1, 2048, 6176, 6176, 6144, 4096]
    - [44, 67.322]
  - - [6144, 4096, 1, 4096, 6176, 6176, 6144, 4128]
    - [60, 65.37]
  - - [6144, 4096, 1, 8192, 6176, 6176, 8224, 8224]
    - [44, 62.749]
  - - [6144, 8192, 1, 64, 6176, 6176, 6144, 8192]
    - [66, 37.059]
  - - [6144, 8192, 1, 128, 6176, 6176, 6144, 8192]
    - [20, 52.03]
  - - [6144, 8192, 1, 256, 6176, 6176, 6144, 8192]
    - [31, 66.138]
  - - [6144, 8192, 1, 512, 6176, 6176, 6144, 8192]
    - [68, 58.607]
  - - [6144, 8192, 1, 1024, 6176, 6176, 6144, 8192]
    - [16, 59.751]
  - - [6144, 8192, 1, 2048, 6176, 6176, 6144, 8192]
    - [47, 64.971]
  - - [6144, 8192, 1, 4096, 6176, 6176, 6144, 8192]
    - [48, 63.806]
  - - [6144, 8192, 1, 8192, 6176, 6176, 8224, 8224]
    - [47, 63.053]
- null
- null
- DeviceEfficiency
