library/src/blas3/Tensile/Logic/asm_full/navi31/navi31_Cijk_Ailk_Bjlk_I8II_BH_GB.yaml
- {MinimumRequiredVersion: 4.35.0}
- navi31
- gfx1100
- [Device 73bf]
    SolutionIndex: 0
    SolutionNameMin: Cijk_Ailk_Bjlk_I8II_BH_MT32x32x16_MI16x16x16x1_SN_1LDSB1_AMAS0_GRVW4_IU1_SIA2_SU0_SUS0_SVW1_TT1_16_VW1_WGM4
    SolutionIndex: 1
    SolutionNameMin: Cijk_Ailk_Bjlk_I8II_BH_MT32x32x16_MI16x16x16x1_SN_1LDSB1_AMAS0_GRVW8_IU1_SIA2_SU0_SUS0_SVW1_TT1_16_VW1_WGM4
    SolutionIndex: 2
    SolutionNameMin: Cijk_Ailk_Bjlk_I8II_BH_MT32x32x16_MI16x16x16x1_SN_1LDSB1_AMAS0_GRVW16_IU1_SIA2_SU0_SUS0_SVW1_TT1_16_VW1_WGM8
    SolutionIndex: 3
    SolutionNameMin: Cijk_Ailk_Bjlk_I8II_BH_MT64x64x16_MI16x16x16x1_SN_1LDSB0_AMAS3_GRVW16_IU1_SIA1_SU0_SUS0_SVW2_TT2_32_VW2_WGM4
    SolutionIndex: 4
    SolutionNameMin: Cijk_Ailk_Bjlk_I8II_BH_MT64x64x16_MI16x16x16x1_SN_1LDSB1_AMAS0_GRVW4_IU1_SIA2_SU0_SUS0_SVW1_TT2_32_VW1_WGM4
    SolutionIndex: 5
    SolutionNameMin: Cijk_Ailk_Bjlk_I8II_BH_MT64x64x16_MI16x16x16x1_SN_1LDSB1_AMAS0_GRVW16_IU1_SIA2_SU0_SUS0_SVW1_TT2_32_VW1_WGM4
    SolutionIndex: 6
    SolutionNameMin: Cijk_Ailk_Bjlk_I8II_BH_MT64x64x16_MI16x16x16x1_SN_1LDSB1_AMAS3_GRVW16_IU1_SIA2_SU0_SUS0_SVW2_TT2_32_VW2_WGM4
    SolutionIndex: 7
    SolutionNameMin: Cijk_Ailk_Bjlk_I8II_BH_MT64x64x16_MI16x16x16x1_SN_1LDSB1_AMAS3_GRVW8_IU1_SIA2_SU32_SUS256_SVW2_TT2_32_VW2_WGM4
    SolutionIndex: 8
    SolutionNameMin: Cijk_Ailk_Bjlk_I8II_BH_MT64x64x16_MI16x16x16x1_SN_1LDSB1_AMAS0_GRVW4_IU1_SIA2_SU0_SUS0_SVW1_TT2_32_VW1_WGM8
    SolutionIndex: 9
    SolutionNameMin: Cijk_Ailk_Bjlk_I8II_BH_MT64x64x16_MI16x16x16x1_SN_1LDSB1_AMAS3_GRVW8_IU1_SIA2_SU0_SUS0_SVW2_TT2_32_VW2_WGM8
    SolutionIndex: 10
    SolutionNameMin: Cijk_Ailk_Bjlk_I8II_BH_MT64x64x16_MI16x16x16x1_SN_1LDSB1_AMAS0_GRVW8_IU1_SIA2_SU32_SUS128_SVW1_TT2_32_VW1_WGM8
    SolutionIndex: 11
    SolutionNameMin: Cijk_Ailk_Bjlk_I8II_BH_MT64x64x16_MI16x16x16x1_SN_1LDSB1_AMAS0_GRVW8_IU1_SIA2_SU32_SUS256_SVW1_TT2_32_VW1_WGM8
    SolutionIndex: 12
    SolutionNameMin: Cijk_Ailk_Bjlk_I8II_BH_MT128x128x16_MI16x16x16x1_SN_1LDSB0_AMAS0_GRVW4_IU1_SIA1_SU0_SUS0_SVW1_TT4_64_VW1_WGM4
    SolutionIndex: 13
    SolutionNameMin: Cijk_Ailk_Bjlk_I8II_BH_MT128x128x16_MI16x16x16x1_SN_1LDSB0_AMAS3_GRVW4_IU1_SIA1_SU0_SUS0_SVW2_TT4_64_VW2_WGM4
    SolutionIndex: 14
    SolutionNameMin: Cijk_Ailk_Bjlk_I8II_BH_MT128x128x16_MI16x16x16x1_SN_1LDSB0_AMAS0_GRVW8_IU1_SIA1_SU0_SUS0_SVW1_TT4_64_VW1_WGM4
    SolutionIndex: 15
    SolutionNameMin: Cijk_Ailk_Bjlk_I8II_BH_MT128x128x16_MI16x16x16x1_SN_1LDSB0_AMAS3_GRVW8_IU1_SIA1_SU0_SUS0_SVW2_TT4_64_VW2_WGM4
    SolutionIndex: 16
    SolutionNameMin: Cijk_Ailk_Bjlk_I8II_BH_MT128x128x16_MI16x16x16x1_SN_1LDSB0_AMAS3_GRVW8_IU1_SIA1_SU0_SUS0_SVW4_TT4_64_VW4_WGM4
    SolutionIndex: 17
    SolutionNameMin: Cijk_Ailk_Bjlk_I8II_BH_MT128x128x16_MI16x16x16x1_SN_1LDSB0_AMAS0_GRVW16_IU1_SIA1_SU0_SUS0_SVW1_TT4_64_VW1_WGM4
    SolutionIndex: 18
    SolutionNameMin: Cijk_Ailk_Bjlk_I8II_BH_MT128x128x16_MI16x16x16x1_SN_1LDSB0_AMAS3_GRVW16_IU1_SIA1_SU0_SUS0_SVW2_TT4_64_VW2_WGM4
    SolutionIndex: 19
    SolutionNameMin: Cijk_Ailk_Bjlk_I8II_BH_MT128x128x16_MI16x16x16x1_SN_1LDSB0_AMAS3_GRVW16_IU1_SIA1_SU0_SUS0_SVW4_TT4_64_VW4_WGM4
    SolutionIndex: 20
    SolutionNameMin: Cijk_Ailk_Bjlk_I8II_BH_MT128x128x16_MI16x16x16x1_SN_1LDSB1_AMAS0_GRVW4_IU1_SIA2_SU0_SUS0_SVW1_TT4_64_VW1_WGM4
    SolutionIndex: 21
    SolutionNameMin: Cijk_Ailk_Bjlk_I8II_BH_MT128x128x16_MI16x16x16x1_SN_1LDSB1_AMAS3_GRVW4_IU1_SIA2_SU0_SUS0_SVW4_TT4_64_VW4_WGM4
    SolutionIndex: 22
    SolutionNameMin: Cijk_Ailk_Bjlk_I8II_BH_MT128x128x16_MI16x16x16x1_SN_1LDSB1_AMAS0_GRVW8_IU1_SIA2_SU0_SUS0_SVW1_TT4_64_VW1_WGM4
    SolutionIndex: 23
    SolutionNameMin: Cijk_Ailk_Bjlk_I8II_BH_MT128x128x16_MI16x16x16x1_SN_1LDSB1_AMAS3_GRVW8_IU1_SIA2_SU0_SUS0_SVW2_TT4_64_VW2_WGM4
    SolutionIndex: 24
    SolutionNameMin: Cijk_Ailk_Bjlk_I8II_BH_MT128x128x16_MI16x16x16x1_SN_1LDSB1_AMAS3_GRVW8_IU1_SIA2_SU0_SUS0_SVW4_TT4_64_VW4_WGM4
    SolutionIndex: 25
    SolutionNameMin: Cijk_Ailk_Bjlk_I8II_BH_MT128x128x16_MI16x16x16x1_SN_1LDSB1_AMAS0_GRVW16_IU1_SIA2_SU0_SUS0_SVW1_TT4_64_VW1_WGM4
    SolutionIndex: 26
    SolutionNameMin: Cijk_Ailk_Bjlk_I8II_BH_MT128x128x16_MI16x16x16x1_SN_1LDSB1_AMAS3_GRVW16_IU1_SIA2_SU0_SUS0_SVW2_TT4_64_VW2_WGM4
    SolutionIndex: 27
    SolutionNameMin: Cijk_Ailk_Bjlk_I8II_BH_MT128x128x16_MI16x16x16x1_SN_1LDSB0_AMAS3_GRVW16_IU1_SIA3_SU0_SUS0_SVW2_TT4_64_VW2_WGM4
    SolutionIndex: 28
    SolutionNameMin: Cijk_Ailk_Bjlk_I8II_BH_MT128x128x16_MI16x16x16x1_SN_1LDSB0_AMAS3_GRVW16_IU1_SIA3_SU0_SUS0_SVW4_TT4_64_VW4_WGM4
    SolutionIndex: 29
    SolutionNameMin: Cijk_Ailk_Bjlk_I8II_BH_MT128x128x16_MI16x16x16x1_SN_1LDSB0_AMAS3_GRVW8_IU1_SIA1_SU32_SUS128_SVW2_TT4_64_VW2_WGM4
    SolutionIndex: 30
    SolutionNameMin: Cijk_Ailk_Bjlk_I8II_BH_MT128x128x16_MI16x16x16x1_SN_1LDSB0_AMAS0_GRVW16_IU1_SIA1_SU32_SUS128_SVW1_TT4_64_VW1_WGM4
    SolutionIndex: 31
    SolutionNameMin: Cijk_Ailk_Bjlk_I8II_BH_MT128x128x16_MI16x16x16x1_SN_1LDSB0_AMAS3_GRVW16_IU1_SIA1_SU32_SUS128_SVW2_TT4_64_VW2_WGM4
    SolutionIndex: 32
    SolutionNameMin: Cijk_Ailk_Bjlk_I8II_BH_MT128x128x16_MI16x16x16x1_SN_1LDSB0_AMAS3_GRVW16_IU1_SIA1_SU32_SUS128_SVW4_TT4_64_VW4_WGM4
    SolutionIndex: 33
    SolutionNameMin: Cijk_Ailk_Bjlk_I8II_BH_MT128x128x16_MI16x16x16x1_SN_1LDSB1_AMAS0_GRVW16_IU1_SIA2_SU32_SUS128_SVW1_TT4_64_VW1_WGM4
    SolutionIndex: 34
    SolutionNameMin: Cijk_Ailk_Bjlk_I8II_BH_MT128x128x16_MI16x16x16x1_SN_1LDSB1_AMAS3_GRVW16_IU1_SIA2_SU32_SUS128_SVW2_TT4_64_VW2_WGM4
    SolutionIndex: 35
    SolutionNameMin: Cijk_Ailk_Bjlk_I8II_BH_MT128x128x16_MI16x16x16x1_SN_1LDSB0_AMAS3_GRVW16_IU1_SIA3_SU32_SUS128_SVW4_TT4_64_VW4_WGM4
    SolutionIndex: 36
    SolutionNameMin: Cijk_Ailk_Bjlk_I8II_BH_MT128x128x16_MI16x16x16x1_SN_1LDSB0_AMAS0_GRVW4_IU1_SIA1_SU32_SUS256_SVW1_TT4_64_VW1_WGM4
    SolutionIndex: 37
    SolutionNameMin: Cijk_Ailk_Bjlk_I8II_BH_MT128x128x16_MI16x16x16x1_SN_1LDSB0_AMAS3_GRVW4_IU1_SIA1_SU32_SUS256_SVW2_TT4_64_VW2_WGM4
    SolutionIndex: 38
    SolutionNameMin: Cijk_Ailk_Bjlk_I8II_BH_MT128x128x16_MI16x16x16x1_SN_1LDSB0_AMAS3_GRVW8_IU1_SIA1_SU32_SUS256_SVW2_TT4_64_VW2_WGM4
    SolutionIndex: 39
    SolutionNameMin: Cijk_Ailk_Bjlk_I8II_BH_MT128x128x16_MI16x16x16x1_SN_1LDSB0_AMAS3_GRVW8_IU1_SIA1_SU32_SUS256_SVW4_TT4_64_VW4_WGM4
    SolutionIndex: 40
    SolutionNameMin: Cijk_Ailk_Bjlk_I8II_BH_MT128x128x16_MI16x16x16x1_SN_1LDSB0_AMAS0_GRVW16_IU1_SIA1_SU32_SUS256_SVW1_TT4_64_VW1_WGM4
    SolutionIndex: 41
    SolutionNameMin: Cijk_Ailk_Bjlk_I8II_BH_MT128x128x16_MI16x16x16x1_SN_1LDSB1_AMAS3_GRVW4_IU1_SIA2_SU32_SUS256_SVW4_TT4_64_VW4_WGM4
    SolutionIndex: 42
    SolutionNameMin: Cijk_Ailk_Bjlk_I8II_BH_MT128x128x16_MI16x16x16x1_SN_1LDSB1_AMAS3_GRVW8_IU1_SIA2_SU32_SUS256_SVW2_TT4_64_VW2_WGM4
    SolutionIndex: 43
    SolutionNameMin: Cijk_Ailk_Bjlk_I8II_BH_MT128x128x16_MI16x16x16x1_SN_1LDSB1_AMAS0_GRVW16_IU1_SIA2_SU32_SUS256_SVW1_TT4_64_VW1_WGM4
    SolutionIndex: 44
    SolutionNameMin: Cijk_Ailk_Bjlk_I8II_BH_MT128x128x16_MI16x16x16x1_SN_1LDSB0_AMAS3_GRVW8_IU1_SIA3_SU32_SUS256_SVW4_TT4_64_VW4_WGM4
    SolutionIndex: 45
    SolutionNameMin: Cijk_Ailk_Bjlk_I8II_BH_MT128x128x16_MI16x16x16x1_SN_1LDSB0_AMAS0_GRVW16_IU1_SIA3_SU32_SUS256_SVW1_TT4_64_VW1_WGM4
    SolutionIndex: 46
    SolutionNameMin: Cijk_Ailk_Bjlk_I8II_BH_MT128x128x16_MI16x16x16x1_SN_1LDSB0_AMAS3_GRVW16_IU1_SIA3_SU32_SUS256_SVW4_TT4_64_VW4_WGM4
    SolutionIndex: 47
    SolutionNameMin: Cijk_Ailk_Bjlk_I8II_BH_MT128x128x16_MI16x16x16x1_SN_1LDSB0_AMAS0_GRVW4_IU1_SIA1_SU0_SUS0_SVW1_TT4_64_VW1_WGM8
    SolutionIndex: 48
    SolutionNameMin: Cijk_Ailk_Bjlk_I8II_BH_MT128x128x16_MI16x16x16x1_SN_1LDSB0_AMAS3_GRVW4_IU1_SIA1_SU0_SUS0_SVW4_TT4_64_VW4_WGM8
    SolutionIndex: 49
    SolutionNameMin: Cijk_Ailk_Bjlk_I8II_BH_MT128x128x16_MI16x16x16x1_SN_1LDSB0_AMAS0_GRVW8_IU1_SIA1_SU0_SUS0_SVW1_TT4_64_VW1_WGM8
    SolutionIndex: 50
    SolutionNameMin: Cijk_Ailk_Bjlk_I8II_BH_MT128x128x16_MI16x16x16x1_SN_1LDSB0_AMAS3_GRVW8_IU1_SIA1_SU0_SUS0_SVW2_TT4_64_VW2_WGM8
    SolutionIndex: 51
    SolutionNameMin: Cijk_Ailk_Bjlk_I8II_BH_MT128x128x16_MI16x16x16x1_SN_1LDSB0_AMAS3_GRVW8_IU1_SIA1_SU0_SUS0_SVW4_TT4_64_VW4_WGM8
    SolutionIndex: 52
    SolutionNameMin: Cijk_Ailk_Bjlk_I8II_BH_MT128x128x16_MI16x16x16x1_SN_1LDSB0_AMAS0_GRVW16_IU1_SIA1_SU0_SUS0_SVW1_TT4_64_VW1_WGM8
    SolutionIndex: 53
    SolutionNameMin: Cijk_Ailk_Bjlk_I8II_BH_MT128x128x16_MI16x16x16x1_SN_1LDSB0_AMAS3_GRVW16_IU1_SIA1_SU0_SUS0_SVW2_TT4_64_VW2_WGM8
    SolutionIndex: 54
    SolutionNameMin: Cijk_Ailk_Bjlk_I8II_BH_MT128x128x16_MI16x16x16x1_SN_1LDSB0_AMAS3_GRVW16_IU1_SIA1_SU0_SUS0_SVW4_TT4_64_VW4_WGM8
    SolutionIndex: 55
    SolutionNameMin: Cijk_Ailk_Bjlk_I8II_BH_MT128x128x16_MI16x16x16x1_SN_1LDSB1_AMAS0_GRVW4_IU1_SIA2_SU0_SUS0_SVW1_TT4_64_VW1_WGM8
    SolutionIndex: 56
    SolutionNameMin: Cijk_Ailk_Bjlk_I8II_BH_MT128x128x16_MI16x16x16x1_SN_1LDSB1_AMAS3_GRVW4_IU1_SIA2_SU0_SUS0_SVW2_TT4_64_VW2_WGM8
    SolutionIndex: 57
    SolutionNameMin: Cijk_Ailk_Bjlk_I8II_BH_MT128x128x16_MI16x16x16x1_SN_1LDSB1_AMAS0_GRVW8_IU1_SIA2_SU0_SUS0_SVW1_TT4_64_VW1_WGM8
    SolutionIndex: 58
    SolutionNameMin: Cijk_Ailk_Bjlk_I8II_BH_MT128x128x16_MI16x16x16x1_SN_1LDSB1_AMAS3_GRVW8_IU1_SIA2_SU0_SUS0_SVW2_TT4_64_VW2_WGM8
    SolutionIndex: 59
    SolutionNameMin: Cijk_Ailk_Bjlk_I8II_BH_MT128x128x16_MI16x16x16x1_SN_1LDSB1_AMAS0_GRVW16_IU1_SIA2_SU0_SUS0_SVW1_TT4_64_VW1_WGM8
    SolutionIndex: 60
    SolutionNameMin: Cijk_Ailk_Bjlk_I8II_BH_MT128x128x16_MI16x16x16x1_SN_1LDSB1_AMAS3_GRVW16_IU1_SIA2_SU0_SUS0_SVW2_TT4_64_VW2_WGM8
    SolutionIndex: 61
    SolutionNameMin: Cijk_Ailk_Bjlk_I8II_BH_MT128x128x16_MI16x16x16x1_SN_1LDSB1_AMAS3_GRVW16_IU1_SIA2_SU0_SUS0_SVW4_TT4_64_VW4_WGM8
    SolutionIndex: 62
    SolutionNameMin: Cijk_Ailk_Bjlk_I8II_BH_MT128x128x16_MI16x16x16x1_SN_1LDSB0_AMAS3_GRVW8_IU1_SIA3_SU0_SUS0_SVW2_TT4_64_VW2_WGM8
    SolutionIndex: 63
    SolutionNameMin: Cijk_Ailk_Bjlk_I8II_BH_MT128x128x16_MI16x16x16x1_SN_1LDSB0_AMAS3_GRVW16_IU1_SIA3_SU0_SUS0_SVW4_TT4_64_VW4_WGM8
    SolutionIndex: 64
    SolutionNameMin: Cijk_Ailk_Bjlk_I8II_BH_MT128x128x16_MI16x16x16x1_SN_1LDSB0_AMAS3_GRVW4_IU1_SIA1_SU32_SUS128_SVW2_TT4_64_VW2_WGM8
    SolutionIndex: 65
    SolutionNameMin: Cijk_Ailk_Bjlk_I8II_BH_MT128x128x16_MI16x16x16x1_SN_1LDSB0_AMAS0_GRVW8_IU1_SIA1_SU32_SUS128_SVW1_TT4_64_VW1_WGM8
    SolutionIndex: 66
    SolutionNameMin: Cijk_Ailk_Bjlk_I8II_BH_MT128x128x16_MI16x16x16x1_SN_1LDSB0_AMAS3_GRVW8_IU1_SIA1_SU32_SUS128_SVW2_TT4_64_VW2_WGM8
    SolutionIndex: 67
    SolutionNameMin: Cijk_Ailk_Bjlk_I8II_BH_MT128x128x16_MI16x16x16x1_SN_1LDSB0_AMAS3_GRVW8_IU1_SIA1_SU32_SUS128_SVW4_TT4_64_VW4_WGM8
    SolutionIndex: 68
    SolutionNameMin: Cijk_Ailk_Bjlk_I8II_BH_MT128x128x16_MI16x16x16x1_SN_1LDSB0_AMAS0_GRVW16_IU1_SIA1_SU32_SUS128_SVW1_TT4_64_VW1_WGM8
    SolutionIndex: 69
    SolutionNameMin: Cijk_Ailk_Bjlk_I8II_BH_MT128x128x16_MI16x16x16x1_SN_1LDSB0_AMAS3_GRVW16_IU1_SIA1_SU32_SUS128_SVW2_TT4_64_VW2_WGM8
    SolutionIndex: 70
    SolutionNameMin: Cijk_Ailk_Bjlk_I8II_BH_MT128x128x16_MI16x16x16x1_SN_1LDSB0_AMAS3_GRVW16_IU1_SIA1_SU32_SUS128_SVW4_TT4_64_VW4_WGM8
    SolutionIndex: 71
    SolutionNameMin: Cijk_Ailk_Bjlk_I8II_BH_MT128x128x16_MI16x16x16x1_SN_1LDSB1_AMAS0_GRVW4_IU1_SIA2_SU32_SUS128_SVW1_TT4_64_VW1_WGM8
    SolutionIndex: 72
    SolutionNameMin: Cijk_Ailk_Bjlk_I8II_BH_MT128x128x16_MI16x16x16x1_SN_1LDSB1_AMAS3_GRVW8_IU1_SIA2_SU32_SUS128_SVW2_TT4_64_VW2_WGM8
    SolutionIndex: 73
    SolutionNameMin: Cijk_Ailk_Bjlk_I8II_BH_MT128x128x16_MI16x16x16x1_SN_1LDSB1_AMAS3_GRVW8_IU1_SIA2_SU32_SUS128_SVW4_TT4_64_VW4_WGM8
    SolutionIndex: 74
    SolutionNameMin: Cijk_Ailk_Bjlk_I8II_BH_MT128x128x16_MI16x16x16x1_SN_1LDSB1_AMAS3_GRVW16_IU1_SIA2_SU32_SUS128_SVW2_TT4_64_VW2_WGM8
    SolutionIndex: 75
    SolutionNameMin: Cijk_Ailk_Bjlk_I8II_BH_MT128x128x16_MI16x16x16x1_SN_1LDSB1_AMAS3_GRVW16_IU1_SIA2_SU32_SUS128_SVW4_TT4_64_VW4_WGM8
    SolutionIndex: 76
    SolutionNameMin: Cijk_Ailk_Bjlk_I8II_BH_MT128x128x16_MI16x16x16x1_SN_1LDSB0_AMAS0_GRVW8_IU1_SIA3_SU32_SUS128_SVW1_TT4_64_VW1_WGM8
    SolutionIndex: 77
    SolutionNameMin: Cijk_Ailk_Bjlk_I8II_BH_MT128x128x16_MI16x16x16x1_SN_1LDSB0_AMAS3_GRVW8_IU1_SIA3_SU32_SUS128_SVW4_TT4_64_VW4_WGM8
    SolutionIndex: 78
    SolutionNameMin: Cijk_Ailk_Bjlk_I8II_BH_MT128x128x16_MI16x16x16x1_SN_1LDSB0_AMAS0_GRVW8_IU1_SIA1_SU32_SUS256_SVW1_TT4_64_VW1_WGM8
    SolutionIndex: 79
    SolutionNameMin: Cijk_Ailk_Bjlk_I8II_BH_MT128x128x16_MI16x16x16x1_SN_1LDSB0_AMAS0_GRVW16_IU1_SIA1_SU32_SUS256_SVW1_TT4_64_VW1_WGM8
    SolutionIndex: 80
    SolutionNameMin: Cijk_Ailk_Bjlk_I8II_BH_MT128x128x16_MI16x16x16x1_SN_1LDSB0_AMAS3_GRVW16_IU1_SIA1_SU32_SUS256_SVW2_TT4_64_VW2_WGM8
    SolutionIndex: 81
    SolutionNameMin: Cijk_Ailk_Bjlk_I8II_BH_MT128x128x16_MI16x16x16x1_SN_1LDSB1_AMAS0_GRVW4_IU1_SIA2_SU32_SUS256_SVW1_TT4_64_VW1_WGM8
    SolutionIndex: 82
    SolutionNameMin: Cijk_Ailk_Bjlk_I8II_BH_MT128x128x16_MI16x16x16x1_SN_1LDSB1_AMAS0_GRVW8_IU1_SIA2_SU32_SUS256_SVW1_TT4_64_VW1_WGM8
    SolutionIndex: 83
    SolutionNameMin: Cijk_Ailk_Bjlk_I8II_BH_MT128x128x16_MI16x16x16x1_SN_1LDSB1_AMAS0_GRVW16_IU1_SIA2_SU32_SUS256_SVW1_TT4_64_VW1_WGM8
    SolutionIndex: 84
    SolutionNameMin: Cijk_Ailk_Bjlk_I8II_BH_MT128x128x16_MI16x16x16x1_SN_1LDSB1_AMAS3_GRVW16_IU1_SIA2_SU32_SUS256_SVW2_TT4_64_VW2_WGM8
    SolutionIndex: 85
    SolutionNameMin: Cijk_Ailk_Bjlk_I8II_BH_MT128x128x16_MI16x16x16x1_SN_1LDSB1_AMAS3_GRVW16_IU1_SIA2_SU32_SUS256_SVW4_TT4_64_VW4_WGM8
    SolutionIndex: 86
    SolutionNameMin: Cijk_Ailk_Bjlk_I8II_BH_MT128x128x16_MI16x16x16x1_SN_1LDSB0_AMAS0_GRVW8_IU1_SIA3_SU32_SUS256_SVW1_TT4_64_VW1_WGM8
    SolutionIndex: 87
    SolutionNameMin: Cijk_Ailk_Bjlk_I8II_BH_MT128x128x16_MI16x16x16x1_SN_1LDSB0_AMAS3_GRVW8_IU1_SIA3_SU32_SUS256_SVW4_TT4_64_VW4_WGM8
    SolutionIndex: 88
    SolutionNameMin: Cijk_Ailk_Bjlk_I8II_BH_MT128x128x16_MI16x16x16x1_SN_1LDSB0_AMAS3_GRVW16_IU1_SIA3_SU32_SUS256_SVW4_TT4_64_VW4_WGM8
    SolutionIndex: 89
    SolutionNameMin: Cijk_Ailk_Bjlk_I8II_BH_MT32x32x32_MI16x16x16x1_SN_1LDSB0_AMAS0_GRVW8_IU1_SIA1_SU0_SUS0_SVW1_TT1_16_VW1_WGM4
    SolutionIndex: 90
    SolutionNameMin: Cijk_Ailk_Bjlk_I8II_BH_MT32x32x32_MI16x16x16x1_SN_1LDSB0_AMAS0_GRVW16_IU1_SIA1_SU0_SUS0_SVW1_TT1_16_VW1_WGM4
    SolutionIndex: 91
    SolutionNameMin: Cijk_Ailk_Bjlk_I8II_BH_MT32x32x32_MI16x16x16x1_SN_1LDSB1_AMAS0_GRVW4_IU2_SIA2_SU0_SUS0_SVW1_TT1_16_VW1_WGM4
    SolutionIndex: 92
    SolutionNameMin: Cijk_Ailk_Bjlk_I8II_BH_MT32x32x32_MI16x16x16x1_SN_1LDSB1_AMAS0_GRVW8_IU2_SIA2_SU0_SUS0_SVW1_TT1_16_VW1_WGM4
    SolutionIndex: 93
    SolutionNameMin: Cijk_Ailk_Bjlk_I8II_BH_MT32x32x32_MI16x16x16x1_SN_1LDSB1_AMAS0_GRVW16_IU2_SIA2_SU0_SUS0_SVW1_TT1_16_VW1_WGM4
    SolutionIndex: 94
    SolutionNameMin: Cijk_Ailk_Bjlk_I8II_BH_MT32x32x32_MI16x16x16x1_SN_1LDSB0_AMAS0_GRVW8_IU1_SIA3_SU0_SUS0_SVW1_TT1_16_VW1_WGM4
    SolutionIndex: 95
    SolutionNameMin: Cijk_Ailk_Bjlk_I8II_BH_MT32x32x32_MI16x16x16x1_SN_1LDSB0_AMAS0_GRVW8_IU1_SIA1_SU32_SUS128_SVW1_TT1_16_VW1_WGM4
    SolutionIndex: 96
    SolutionNameMin: Cijk_Ailk_Bjlk_I8II_BH_MT32x32x32_MI16x16x16x1_SN_1LDSB1_AMAS0_GRVW4_IU2_SIA2_SU32_SUS128_SVW1_TT1_16_VW1_WGM4
    SolutionIndex: 97
    SolutionNameMin: Cijk_Ailk_Bjlk_I8II_BH_MT32x32x32_MI16x16x16x1_SN_1LDSB1_AMAS0_GRVW8_IU2_SIA2_SU32_SUS128_SVW1_TT1_16_VW1_WGM4
    SolutionIndex: 98
    SolutionNameMin: Cijk_Ailk_Bjlk_I8II_BH_MT32x32x32_MI16x16x16x1_SN_1LDSB1_AMAS0_GRVW16_IU2_SIA2_SU32_SUS128_SVW1_TT1_16_VW1_WGM4
    SolutionIndex: 99
    SolutionNameMin: Cijk_Ailk_Bjlk_I8II_BH_MT32x32x32_MI16x16x16x1_SN_1LDSB0_AMAS0_GRVW4_IU1_SIA1_SU32_SUS256_SVW1_TT1_16_VW1_WGM4
    SolutionIndex: 100
    SolutionNameMin: Cijk_Ailk_Bjlk_I8II_BH_MT32x32x32_MI16x16x16x1_SN_1LDSB0_AMAS0_GRVW8_IU1_SIA1_SU32_SUS256_SVW1_TT1_16_VW1_WGM4
    SolutionIndex: 101
    SolutionNameMin: Cijk_Ailk_Bjlk_I8II_BH_MT32x32x32_MI16x16x16x1_SN_1LDSB1_AMAS0_GRVW4_IU2_SIA2_SU32_SUS256_SVW1_TT1_16_VW1_WGM4
    SolutionIndex: 102
    SolutionNameMin: Cijk_Ailk_Bjlk_I8II_BH_MT32x32x32_MI16x16x16x1_SN_1LDSB1_AMAS0_GRVW8_IU2_SIA2_SU32_SUS256_SVW1_TT1_16_VW1_WGM4
    SolutionIndex: 103
    SolutionNameMin: Cijk_Ailk_Bjlk_I8II_BH_MT32x32x32_MI16x16x16x1_SN_1LDSB1_AMAS0_GRVW16_IU2_SIA2_SU32_SUS256_SVW1_TT1_16_VW1_WGM4
    SolutionIndex: 104
    SolutionNameMin: Cijk_Ailk_Bjlk_I8II_BH_MT32x32x32_MI16x16x16x1_SN_1LDSB0_AMAS0_GRVW8_IU1_SIA1_SU0_SUS0_SVW1_TT1_16_VW1_WGM8
    SolutionIndex: 105
    SolutionNameMin: Cijk_Ailk_Bjlk_I8II_BH_MT32x32x32_MI16x16x16x1_SN_1LDSB0_AMAS0_GRVW16_IU1_SIA1_SU0_SUS0_SVW1_TT1_16_VW1_WGM8
    SolutionIndex: 106
    SolutionNameMin: Cijk_Ailk_Bjlk_I8II_BH_MT32x32x32_MI16x16x16x1_SN_1LDSB1_AMAS0_GRVW4_IU2_SIA2_SU0_SUS0_SVW1_TT1_16_VW1_WGM8
    SolutionIndex: 107
    SolutionNameMin: Cijk_Ailk_Bjlk_I8II_BH_MT32x32x32_MI16x16x16x1_SN_1LDSB1_AMAS0_GRVW8_IU2_SIA2_SU0_SUS0_SVW1_TT1_16_VW1_WGM8
    SolutionIndex: 108
    SolutionNameMin: Cijk_Ailk_Bjlk_I8II_BH_MT32x32x32_MI16x16x16x1_SN_1LDSB1_AMAS0_GRVW16_IU2_SIA2_SU0_SUS0_SVW1_TT1_16_VW1_WGM8
    SolutionIndex: 109
    SolutionNameMin: Cijk_Ailk_Bjlk_I8II_BH_MT32x32x32_MI16x16x16x1_SN_1LDSB0_AMAS0_GRVW16_IU1_SIA1_SU32_SUS128_SVW1_TT1_16_VW1_WGM8
    SolutionIndex: 110
    SolutionNameMin: Cijk_Ailk_Bjlk_I8II_BH_MT32x32x32_MI16x16x16x1_SN_1LDSB1_AMAS0_GRVW4_IU2_SIA2_SU32_SUS128_SVW1_TT1_16_VW1_WGM8
    SolutionIndex: 111
    SolutionNameMin: Cijk_Ailk_Bjlk_I8II_BH_MT32x32x32_MI16x16x16x1_SN_1LDSB1_AMAS0_GRVW8_IU2_SIA2_SU32_SUS128_SVW1_TT1_16_VW1_WGM8
    SolutionIndex: 112
    SolutionNameMin: Cijk_Ailk_Bjlk_I8II_BH_MT32x32x32_MI16x16x16x1_SN_1LDSB1_AMAS0_GRVW16_IU2_SIA2_SU32_SUS128_SVW1_TT1_16_VW1_WGM8
    SolutionIndex: 113
    SolutionNameMin: Cijk_Ailk_Bjlk_I8II_BH_MT32x32x32_MI16x16x16x1_SN_1LDSB0_AMAS0_GRVW4_IU1_SIA3_SU32_SUS128_SVW1_TT1_16_VW1_WGM8
    SolutionIndex: 114
    SolutionNameMin: Cijk_Ailk_Bjlk_I8II_BH_MT32x32x32_MI16x16x16x1_SN_1LDSB0_AMAS0_GRVW4_IU1_SIA1_SU32_SUS256_SVW1_TT1_16_VW1_WGM8
    SolutionIndex: 115
    SolutionNameMin: Cijk_Ailk_Bjlk_I8II_BH_MT32x32x32_MI16x16x16x1_SN_1LDSB1_AMAS0_GRVW4_IU2_SIA2_SU32_SUS256_SVW1_TT1_16_VW1_WGM8
    SolutionIndex: 116
    SolutionNameMin: Cijk_Ailk_Bjlk_I8II_BH_MT32x32x32_MI16x16x16x1_SN_1LDSB1_AMAS0_GRVW8_IU2_SIA2_SU32_SUS256_SVW1_TT1_16_VW1_WGM8
    SolutionIndex: 117
    SolutionNameMin: Cijk_Ailk_Bjlk_I8II_BH_MT32x32x32_MI16x16x16x1_SN_1LDSB1_AMAS0_GRVW16_IU2_SIA2_SU32_SUS256_SVW1_TT1_16_VW1_WGM8
    SolutionIndex: 118
    SolutionNameMin: Cijk_Ailk_Bjlk_I8II_BH_MT64x64x32_MI16x16x16x1_SN_1LDSB0_AMAS0_GRVW4_IU1_SIA1_SU0_SUS0_SVW1_TT2_32_VW1_WGM4
    SolutionIndex: 119
    SolutionNameMin: Cijk_Ailk_Bjlk_I8II_BH_MT64x64x32_MI16x16x16x1_SN_1LDSB0_AMAS3_GRVW4_IU1_SIA1_SU0_SUS0_SVW2_TT2_32_VW2_WGM4
    SolutionIndex: 120
    SolutionNameMin: Cijk_Ailk_Bjlk_I8II_BH_MT64x64x32_MI16x16x16x1_SN_1LDSB0_AMAS0_GRVW8_IU1_SIA1_SU0_SUS0_SVW1_TT2_32_VW1_WGM4
    SolutionIndex: 121
    SolutionNameMin: Cijk_Ailk_Bjlk_I8II_BH_MT64x64x32_MI16x16x16x1_SN_1LDSB0_AMAS3_GRVW8_IU1_SIA1_SU0_SUS0_SVW2_TT2_32_VW2_WGM4
    SolutionIndex: 122
    SolutionNameMin: Cijk_Ailk_Bjlk_I8II_BH_MT64x64x32_MI16x16x16x1_SN_1LDSB0_AMAS0_GRVW16_IU1_SIA1_SU0_SUS0_SVW1_TT2_32_VW1_WGM4
    SolutionIndex: 123
    SolutionNameMin: Cijk_Ailk_Bjlk_I8II_BH_MT64x64x32_MI16x16x16x1_SN_1LDSB0_AMAS3_GRVW16_IU1_SIA1_SU0_SUS0_SVW2_TT2_32_VW2_WGM4
    SolutionIndex: 124
    SolutionNameMin: Cijk_Ailk_Bjlk_I8II_BH_MT64x64x32_MI16x16x16x1_SN_1LDSB1_AMAS0_GRVW8_IU2_SIA2_SU0_SUS0_SVW1_TT2_32_VW1_WGM4
    SolutionIndex: 125
    SolutionNameMin: Cijk_Ailk_Bjlk_I8II_BH_MT64x64x32_MI16x16x16x1_SN_1LDSB1_AMAS3_GRVW8_IU2_SIA2_SU0_SUS0_SVW2_TT2_32_VW2_WGM4
    SolutionIndex: 126
    SolutionNameMin: Cijk_Ailk_Bjlk_I8II_BH_MT64x64x32_MI16x16x16x1_SN_1LDSB1_AMAS0_GRVW16_IU2_SIA2_SU0_SUS0_SVW1_TT2_32_VW1_WGM4
    SolutionIndex: 127
    SolutionNameMin: Cijk_Ailk_Bjlk_I8II_BH_MT64x64x32_MI16x16x16x1_SN_1LDSB1_AMAS3_GRVW16_IU2_SIA2_SU0_SUS0_SVW2_TT2_32_VW2_WGM4
    SolutionIndex: 128
    SolutionNameMin: Cijk_Ailk_Bjlk_I8II_BH_MT64x64x32_MI16x16x16x1_SN_1LDSB0_AMAS3_GRVW4_IU1_SIA3_SU0_SUS0_SVW2_TT2_32_VW2_WGM4
    SolutionIndex: 129
    SolutionNameMin: Cijk_Ailk_Bjlk_I8II_BH_MT64x64x32_MI16x16x16x1_SN_1LDSB0_AMAS0_GRVW8_IU1_SIA3_SU0_SUS0_SVW1_TT2_32_VW1_WGM4
    SolutionIndex: 130
    SolutionNameMin: Cijk_Ailk_Bjlk_I8II_BH_MT64x64x32_MI16x16x16x1_SN_1LDSB0_AMAS3_GRVW8_IU1_SIA3_SU0_SUS0_SVW2_TT2_32_VW2_WGM4
    SolutionIndex: 131
    SolutionNameMin: Cijk_Ailk_Bjlk_I8II_BH_MT64x64x32_MI16x16x16x1_SN_1LDSB0_AMAS0_GRVW16_IU1_SIA3_SU0_SUS0_SVW1_TT2_32_VW1_WGM4
    SolutionIndex: 132
    SolutionNameMin: Cijk_Ailk_Bjlk_I8II_BH_MT64x64x32_MI16x16x16x1_SN_1LDSB0_AMAS3_GRVW16_IU1_SIA3_SU0_SUS0_SVW2_TT2_32_VW2_WGM4
    SolutionIndex: 133
    SolutionNameMin: Cijk_Ailk_Bjlk_I8II_BH_MT64x64x32_MI16x16x16x1_SN_1LDSB0_AMAS3_GRVW4_IU1_SIA1_SU32_SUS128_SVW2_TT2_32_VW2_WGM4
    SolutionIndex: 134
    SolutionNameMin: Cijk_Ailk_Bjlk_I8II_BH_MT64x64x32_MI16x16x16x1_SN_1LDSB0_AMAS0_GRVW8_IU1_SIA1_SU32_SUS128_SVW1_TT2_32_VW1_WGM4
    SolutionIndex: 135
    SolutionNameMin: Cijk_Ailk_Bjlk_I8II_BH_MT64x64x32_MI16x16x16x1_SN_1LDSB0_AMAS3_GRVW8_IU1_SIA1_SU32_SUS128_SVW2_TT2_32_VW2_WGM4
    SolutionIndex: 136
    SolutionNameMin: Cijk_Ailk_Bjlk_I8II_BH_MT64x64x32_MI16x16x16x1_SN_1LDSB0_AMAS0_GRVW16_IU1_SIA1_SU32_SUS128_SVW1_TT2_32_VW1_WGM4
    SolutionIndex: 137
    SolutionNameMin: Cijk_Ailk_Bjlk_I8II_BH_MT64x64x32_MI16x16x16x1_SN_1LDSB0_AMAS3_GRVW16_IU1_SIA1_SU32_SUS128_SVW2_TT2_32_VW2_WGM4
    SolutionIndex: 138
    SolutionNameMin: Cijk_Ailk_Bjlk_I8II_BH_MT64x64x32_MI16x16x16x1_SN_1LDSB1_AMAS0_GRVW8_IU2_SIA2_SU32_SUS128_SVW1_TT2_32_VW1_WGM4
    SolutionIndex: 139
    SolutionNameMin: Cijk_Ailk_Bjlk_I8II_BH_MT64x64x32_MI16x16x16x1_SN_1LDSB1_AMAS0_GRVW16_IU2_SIA2_SU32_SUS128_SVW1_TT2_32_VW1_WGM4
    SolutionIndex: 140
    SolutionNameMin: Cijk_Ailk_Bjlk_I8II_BH_MT64x64x32_MI16x16x16x1_SN_1LDSB1_AMAS3_GRVW16_IU2_SIA2_SU32_SUS128_SVW2_TT2_32_VW2_WGM4
    SolutionIndex: 141
    SolutionNameMin: Cijk_Ailk_Bjlk_I8II_BH_MT64x64x32_MI16x16x16x1_SN_1LDSB0_AMAS0_GRVW16_IU1_SIA3_SU32_SUS128_SVW1_TT2_32_VW1_WGM4
    SolutionIndex: 142
    SolutionNameMin: Cijk_Ailk_Bjlk_I8II_BH_MT64x64x32_MI16x16x16x1_SN_1LDSB0_AMAS3_GRVW16_IU1_SIA3_SU32_SUS128_SVW2_TT2_32_VW2_WGM4
    SolutionIndex: 143
    SolutionNameMin: Cijk_Ailk_Bjlk_I8II_BH_MT64x64x32_MI16x16x16x1_SN_1LDSB0_AMAS0_GRVW16_IU1_SIA1_SU32_SUS256_SVW1_TT2_32_VW1_WGM4
    SolutionIndex: 144
    SolutionNameMin: Cijk_Ailk_Bjlk_I8II_BH_MT64x64x32_MI16x16x16x1_SN_1LDSB0_AMAS3_GRVW16_IU1_SIA1_SU32_SUS256_SVW2_TT2_32_VW2_WGM4
    SolutionIndex: 145
    SolutionNameMin: Cijk_Ailk_Bjlk_I8II_BH_MT64x64x32_MI16x16x16x1_SN_1LDSB1_AMAS3_GRVW16_IU2_SIA2_SU32_SUS256_SVW2_TT2_32_VW2_WGM4
    SolutionIndex: 146
    SolutionNameMin: Cijk_Ailk_Bjlk_I8II_BH_MT64x64x32_MI16x16x16x1_SN_1LDSB0_AMAS0_GRVW16_IU1_SIA3_SU32_SUS256_SVW1_TT2_32_VW1_WGM4
    SolutionIndex: 147
    SolutionNameMin: Cijk_Ailk_Bjlk_I8II_BH_MT64x64x32_MI16x16x16x1_SN_1LDSB0_AMAS3_GRVW16_IU1_SIA3_SU32_SUS256_SVW2_TT2_32_VW2_WGM4
    SolutionIndex: 148
    SolutionNameMin: Cijk_Ailk_Bjlk_I8II_BH_MT64x64x32_MI16x16x16x1_SN_1LDSB0_AMAS3_GRVW4_IU1_SIA1_SU0_SUS0_SVW2_TT2_32_VW2_WGM8
    SolutionIndex: 149
    SolutionNameMin: Cijk_Ailk_Bjlk_I8II_BH_MT64x64x32_MI16x16x16x1_SN_1LDSB0_AMAS0_GRVW8_IU1_SIA1_SU0_SUS0_SVW1_TT2_32_VW1_WGM8
    SolutionIndex: 150
    SolutionNameMin: Cijk_Ailk_Bjlk_I8II_BH_MT64x64x32_MI16x16x16x1_SN_1LDSB0_AMAS3_GRVW8_IU1_SIA1_SU0_SUS0_SVW2_TT2_32_VW2_WGM8
    SolutionIndex: 151
    SolutionNameMin: Cijk_Ailk_Bjlk_I8II_BH_MT64x64x32_MI16x16x16x1_SN_1LDSB0_AMAS0_GRVW16_IU1_SIA1_SU0_SUS0_SVW1_TT2_32_VW1_WGM8
    SolutionIndex: 152
    SolutionNameMin: Cijk_Ailk_Bjlk_I8II_BH_MT64x64x32_MI16x16x16x1_SN_1LDSB0_AMAS3_GRVW16_IU1_SIA1_SU0_SUS0_SVW2_TT2_32_VW2_WGM8
    SolutionIndex: 153
    SolutionNameMin: Cijk_Ailk_Bjlk_I8II_BH_MT64x64x32_MI16x16x16x1_SN_1LDSB1_AMAS0_GRVW8_IU2_SIA2_SU0_SUS0_SVW1_TT2_32_VW1_WGM8
    SolutionIndex: 154
    SolutionNameMin: Cijk_Ailk_Bjlk_I8II_BH_MT64x64x32_MI16x16x16x1_SN_1LDSB1_AMAS3_GRVW8_IU2_SIA2_SU0_SUS0_SVW2_TT2_32_VW2_WGM8
    SolutionIndex: 155
    SolutionNameMin: Cijk_Ailk_Bjlk_I8II_BH_MT64x64x32_MI16x16x16x1_SN_1LDSB1_AMAS0_GRVW16_IU2_SIA2_SU0_SUS0_SVW1_TT2_32_VW1_WGM8
    SolutionIndex: 156
    SolutionNameMin: Cijk_Ailk_Bjlk_I8II_BH_MT64x64x32_MI16x16x16x1_SN_1LDSB1_AMAS3_GRVW16_IU2_SIA2_SU0_SUS0_SVW2_TT2_32_VW2_WGM8
    SolutionIndex: 157
    SolutionNameMin: Cijk_Ailk_Bjlk_I8II_BH_MT64x64x32_MI16x16x16x1_SN_1LDSB0_AMAS0_GRVW8_IU1_SIA3_SU0_SUS0_SVW1_TT2_32_VW1_WGM8
    SolutionIndex: 158
    SolutionNameMin: Cijk_Ailk_Bjlk_I8II_BH_MT64x64x32_MI16x16x16x1_SN_1LDSB0_AMAS3_GRVW8_IU1_SIA3_SU0_SUS0_SVW2_TT2_32_VW2_WGM8
    SolutionIndex: 159
    SolutionNameMin: Cijk_Ailk_Bjlk_I8II_BH_MT64x64x32_MI16x16x16x1_SN_1LDSB0_AMAS0_GRVW16_IU1_SIA3_SU0_SUS0_SVW1_TT2_32_VW1_WGM8
    SolutionIndex: 160
    SolutionNameMin: Cijk_Ailk_Bjlk_I8II_BH_MT64x64x32_MI16x16x16x1_SN_1LDSB0_AMAS3_GRVW16_IU1_SIA3_SU0_SUS0_SVW2_TT2_32_VW2_WGM8
    SolutionIndex: 161
    SolutionNameMin: Cijk_Ailk_Bjlk_I8II_BH_MT64x64x32_MI16x16x16x1_SN_1LDSB0_AMAS3_GRVW8_IU1_SIA1_SU32_SUS128_SVW2_TT2_32_VW2_WGM8
    SolutionIndex: 162
    SolutionNameMin: Cijk_Ailk_Bjlk_I8II_BH_MT64x64x32_MI16x16x16x1_SN_1LDSB0_AMAS0_GRVW16_IU1_SIA1_SU32_SUS128_SVW1_TT2_32_VW1_WGM8
    SolutionIndex: 163
    SolutionNameMin: Cijk_Ailk_Bjlk_I8II_BH_MT64x64x32_MI16x16x16x1_SN_1LDSB0_AMAS3_GRVW16_IU1_SIA1_SU32_SUS128_SVW2_TT2_32_VW2_WGM8
    SolutionIndex: 164
    SolutionNameMin: Cijk_Ailk_Bjlk_I8II_BH_MT64x64x32_MI16x16x16x1_SN_1LDSB1_AMAS3_GRVW8_IU2_SIA2_SU32_SUS128_SVW2_TT2_32_VW2_WGM8
    SolutionIndex: 165
    SolutionNameMin: Cijk_Ailk_Bjlk_I8II_BH_MT64x64x32_MI16x16x16x1_SN_1LDSB1_AMAS0_GRVW16_IU2_SIA2_SU32_SUS128_SVW1_TT2_32_VW1_WGM8
    SolutionIndex: 166
    SolutionNameMin: Cijk_Ailk_Bjlk_I8II_BH_MT64x64x32_MI16x16x16x1_SN_1LDSB1_AMAS3_GRVW16_IU2_SIA2_SU32_SUS128_SVW2_TT2_32_VW2_WGM8
    SolutionIndex: 167
    SolutionNameMin: Cijk_Ailk_Bjlk_I8II_BH_MT64x64x32_MI16x16x16x1_SN_1LDSB0_AMAS3_GRVW16_IU1_SIA3_SU32_SUS128_SVW2_TT2_32_VW2_WGM8
    SolutionIndex: 168
    SolutionNameMin: Cijk_Ailk_Bjlk_I8II_BH_MT64x64x32_MI16x16x16x1_SN_1LDSB0_AMAS0_GRVW4_IU1_SIA1_SU32_SUS256_SVW1_TT2_32_VW1_WGM8
    SolutionIndex: 169
    SolutionNameMin: Cijk_Ailk_Bjlk_I8II_BH_MT64x64x32_MI16x16x16x1_SN_1LDSB0_AMAS0_GRVW8_IU1_SIA1_SU32_SUS256_SVW1_TT2_32_VW1_WGM8
    SolutionIndex: 170
    SolutionNameMin: Cijk_Ailk_Bjlk_I8II_BH_MT64x64x32_MI16x16x16x1_SN_1LDSB0_AMAS3_GRVW8_IU1_SIA1_SU32_SUS256_SVW2_TT2_32_VW2_WGM8
    SolutionIndex: 171
    SolutionNameMin: Cijk_Ailk_Bjlk_I8II_BH_MT64x64x32_MI16x16x16x1_SN_1LDSB0_AMAS0_GRVW16_IU1_SIA1_SU32_SUS256_SVW1_TT2_32_VW1_WGM8
    SolutionIndex: 172
    SolutionNameMin: Cijk_Ailk_Bjlk_I8II_BH_MT64x64x32_MI16x16x16x1_SN_1LDSB0_AMAS3_GRVW16_IU1_SIA1_SU32_SUS256_SVW2_TT2_32_VW2_WGM8
    SolutionIndex: 173
    SolutionNameMin: Cijk_Ailk_Bjlk_I8II_BH_MT64x64x32_MI16x16x16x1_SN_1LDSB1_AMAS3_GRVW8_IU2_SIA2_SU32_SUS256_SVW2_TT2_32_VW2_WGM8
    SolutionIndex: 174
    SolutionNameMin: Cijk_Ailk_Bjlk_I8II_BH_MT64x64x32_MI16x16x16x1_SN_1LDSB1_AMAS0_GRVW16_IU2_SIA2_SU32_SUS256_SVW1_TT2_32_VW1_WGM8
    SolutionIndex: 175
    SolutionNameMin: Cijk_Ailk_Bjlk_I8II_BH_MT64x64x32_MI16x16x16x1_SN_1LDSB1_AMAS3_GRVW16_IU2_SIA2_SU32_SUS256_SVW2_TT2_32_VW2_WGM8
    SolutionIndex: 176
    SolutionNameMin: Cijk_Ailk_Bjlk_I8II_BH_MT64x64x32_MI16x16x16x1_SN_1LDSB0_AMAS3_GRVW16_IU1_SIA3_SU32_SUS256_SVW2_TT2_32_VW2_WGM8
- - - [64, 64, 1, 64, 96, 96, 96, 96]
    - [0, 0.041]
  - - [64, 64, 1, 128, 96, 96, 160, 160]
    - [93, 0.079]
  - - [64, 64, 1, 256, 96, 96, 288, 288]
    - [93, 0.148]
  - - [64, 64, 1, 512, 96, 96, 544, 544]
    - [93, 0.264]
  - - [64, 64, 1, 1024, 96, 96, 1056, 1056]
    - [116, 0.427]
  - - [64, 64, 1, 2048, 96, 96, 2080, 2080]
    - [106, 0.621]
  - - [64, 64, 1, 4096, 96, 96, 4128, 4128]
    - [98, 0.799]
  - - [64, 64, 1, 8192, 96, 96, 8224, 8224]
    - [98, 0.91]
  - - [64, 128, 1, 64, 96, 96, 96, 128]
    - [113, 0.086]
  - - [64, 128, 1, 128, 96, 96, 160, 160]
    - [107, 0.166]
  - - [64, 128, 1, 256, 96, 96, 288, 288]
    - [91, 0.309]
  - - [64, 128, 1, 512, 96, 96, 544, 544]
    - [92, 0.544]
  - - [64, 128, 1, 1024, 96, 96, 1056, 1056]
    - [107, 0.881]
  - - [64, 128, 1, 2048, 96, 96, 2080, 2080]
    - [103, 1.267]
  - - [64, 128, 1, 4096, 96, 96, 4128, 4128]
    - [116, 1.618]
  - - [64, 128, 1, 8192, 96, 96, 8224, 8224]
    - [102, 1.857]
  - - [64, 256, 1, 64, 96, 96, 96, 256]
    - [98, 0.175]
  - - [64, 256, 1, 128, 96, 96, 160, 256]
    - [91, 0.334]
  - - [64, 256, 1, 256, 96, 96, 288, 288]
    - [108, 0.624]
  - - [64, 256, 1, 512, 96, 96, 544, 544]
    - [108, 1.102]
  - - [64, 256, 1, 1024, 96, 96, 1056, 1056]
    - [93, 1.783]
  - - [64, 256, 1, 2048, 96, 96, 2080, 2080]
    - [103, 2.55]
  - - [64, 256, 1, 4096, 96, 96, 4128, 4128]
    - [112, 3.248]
  - - [64, 256, 1, 8192, 96, 96, 8224, 8224]
    - [106, 3.749]
  - - [64, 512, 1, 64, 96, 96, 96, 512]
    - [96, 0.352]
  - - [64, 512, 1, 128, 96, 96, 160, 512]
    - [116, 0.679]
  - - [64, 512, 1, 256, 96, 96, 288, 512]
    - [107, 1.264]
  - - [64, 512, 1, 512, 96, 96, 544, 544]
    - [91, 2.236]
  - - [64, 512, 1, 1024, 96, 96, 1056, 1056]
    - [110, 3.567]
  - - [64, 512, 1, 2048, 96, 96, 2080, 2080]
    - [111, 5.1]
  - - [64, 512, 1, 4096, 96, 96, 4128, 4128]
    - [112, 6.514]
  - - [64, 512, 1, 8192, 96, 96, 8224, 8224]
    - [103, 7.457]
  - - [64, 1024, 1, 64, 96, 96, 96, 1024]
    - [99, 0.694]
  - - [64, 1024, 1, 128, 96, 96, 160, 1024]
    - [98, 1.32]
  - - [64, 1024, 1, 256, 96, 96, 288, 1024]
    - [102, 2.404]
  - - [64, 1024, 1, 512, 96, 96, 544, 1024]
    - [103, 4.087]
  - - [64, 1024, 1, 1024, 96, 96, 1056, 1056]
    - [91, 6.279]
  - - [64, 1024, 1, 2048, 96, 96, 2080, 2080]
    - [93, 8.592]
  - - [64, 1024, 1, 4096, 96, 96, 4128, 4128]
    - [111, 10.422]
  - - [64, 1024, 1, 8192, 96, 96, 8224, 8224]
    - [97, 11.629]
  - - [64, 2048, 1, 64, 96, 96, 96, 2048]
    - [107, 1.362]
  - - [64, 2048, 1, 128, 96, 96, 160, 2048]
    - [95, 2.567]
  - - [64, 2048, 1, 256, 96, 96, 288, 2048]
    - [114, 4.461]
  - - [64, 2048, 1, 512, 96, 96, 544, 2048]
    - [105, 7.288]
  - - [64, 2048, 1, 1024, 96, 96, 1056, 2048]
    - [103, 10.067]
  - - [64, 2048, 1, 2048, 96, 96, 2080, 2080]
    - [116, 13.484]
  - - [64, 2048, 1, 4096, 96, 96, 4128, 4128]
    - [93, 15.655]
  - - [64, 2048, 1, 8192, 96, 96, 8224, 8224]
    - [107, 17.059]
  - - [64, 4096, 1, 64, 96, 96, 96, 4096]
    - [134, 2.603]
  - - [64, 4096, 1, 128, 96, 96, 160, 4096]
    - [148, 4.777]
  - - [64, 4096, 1, 256, 96, 96, 288, 4096]
    - [121, 8.165]
  - - [64, 4096, 1, 512, 96, 96, 544, 4096]
    - [120, 12.68]
  - - [64, 4096, 1, 1024, 96, 96, 1056, 4096]
    - [127, 17.566]
  - - [64, 4096, 1, 2048, 96, 96, 2080, 4096]
    - [165, 21.727]
  - - [64, 4096, 1, 4096, 96, 96, 4128, 4128]
    - [121, 24.217]
  - - [64, 4096, 1, 8192, 96, 96, 8224, 8224]
    - [126, 25.411]
  - - [64, 8192, 1, 64, 96, 96, 96, 8192]
    - [157, 4.612]
  - - [64, 8192, 1, 128, 96, 96, 160, 8192]
    - [160, 8.244]
  - - [64, 8192, 1, 256, 96, 96, 288, 8192]
    - [164, 13.724]
  - - [64, 8192, 1, 512, 96, 96, 544, 8192]
    - [139, 20.583]
  - - [64, 8192, 1, 1024, 96, 96, 1056, 8192]
    - [175, 27.193]
  - - [64, 8192, 1, 2048, 96, 96, 2080, 8192]
    - [173, 31.816]
  - - [64, 8192, 1, 4096, 96, 96, 4128, 8192]
    - [174, 35.33]
  - - [64, 8192, 1, 8192, 96, 96, 8224, 8224]
    - [155, 36.218]
  - - [128, 64, 1, 64, 160, 160, 128, 96]
    - [107, 0.086]
  - - [128, 64, 1, 128, 160, 160, 160, 160]
    - [93, 0.166]
  - - [128, 64, 1, 256, 160, 160, 288, 288]
    - [108, 0.31]
  - - [128, 64, 1, 512, 160, 160, 544, 544]
    - [103, 0.545]
  - - [128, 64, 1, 1024, 160, 160, 1056, 1056]
    - [106, 0.882]
  - - [128, 64, 1, 2048, 160, 160, 2080, 2080]
    - [92, 1.265]
  - - [128, 64, 1, 4096, 160, 160, 4128, 4128]
    - [107, 1.621]
  - - [128, 64, 1, 8192, 160, 160, 8224, 8224]
    - [91, 1.84]
  - - [128, 128, 1, 64, 160, 160, 128, 128]
    - [106, 0.176]
  - - [128, 128, 1, 128, 160, 160, 160, 160]
    - [93, 0.341]
  - - [128, 128, 1, 256, 160, 160, 288, 288]
    - [93, 0.633]
  - - [128, 128, 1, 512, 160, 160, 544, 544]
    - [111, 1.107]
  - - [128, 128, 1, 1024, 160, 160, 1056, 1056]
    - [116, 1.792]
  - - [128, 128, 1, 2048, 160, 160, 2080, 2080]
    - [112, 2.562]
  - - [128, 128, 1, 4096, 160, 160, 4128, 4128]
    - [92, 3.259]
  - - [128, 128, 1, 8192, 160, 160, 8224, 8224]
    - [98, 3.78]
  - - [128, 256, 1, 64, 160, 160, 128, 256]
    - [112, 0.356]
  - - [128, 256, 1, 128, 160, 160, 160, 256]
    - [108, 0.68]
  - - [128, 256, 1, 256, 160, 160, 288, 288]
    - [106, 1.265]
  - - [128, 256, 1, 512, 160, 160, 544, 544]
    - [101, 2.223]
  - - [128, 256, 1, 1024, 160, 160, 1056, 1056]
    - [115, 3.574]
  - - [128, 256, 1, 2048, 160, 160, 2080, 2080]
    - [117, 5.098]
  - - [128, 256, 1, 4096, 160, 160, 4128, 4128]
    - [117, 6.5]
  - - [128, 256, 1, 8192, 160, 160, 8224, 8224]
    - [107, 7.312]
  - - [128, 512, 1, 64, 160, 160, 128, 512]
    - [3, 0.534]
  - - [128, 512, 1, 128, 160, 160, 160, 512]
    - [94, 1.303]
  - - [128, 512, 1, 256, 160, 160, 288, 512]
    - [106, 2.407]
  - - [128, 512, 1, 512, 160, 160, 544, 544]
    - [107, 4.121]
  - - [128, 512, 1, 1024, 160, 160, 1056, 1056]
    - [93, 6.263]
  - - [128, 512, 1, 2048, 160, 160, 2080, 2080]
    - [107, 8.587]
  - - [128, 512, 1, 4096, 160, 160, 4128, 4128]
    - [92, 10.443]
  - - [128, 512, 1, 8192, 160, 160, 8224, 8224]
    - [97, 11.528]
  - - [128, 1024, 1, 64, 160, 160, 128, 1024]
    - [90, 1.359]
  - - [128, 1024, 1, 128, 160, 160, 160, 1024]
    - [95, 2.549]
  - - [128, 1024, 1, 256, 160, 160, 288, 1024]
    - [104, 4.51]
  - - [128, 1024, 1, 512, 160, 160, 544, 1024]
    - [2, 7.054]
  - - [128, 1024, 1, 1024, 160, 160, 1056, 1056]
    - [105, 10.641]
  - - [128, 1024, 1, 2048, 160, 160, 2080, 2080]
    - [109, 13.687]
  - - [128, 1024, 1, 4096, 160, 160, 4128, 4128]
    - [114, 15.702]
  - - [128, 1024, 1, 8192, 160, 160, 8224, 8224]
    - [105, 17.141]
  - - [128, 2048, 1, 64, 160, 160, 128, 2048]
    - [9, 2.607]
  - - [128, 2048, 1, 128, 160, 160, 160, 2048]
    - [122, 4.771]
  - - [128, 2048, 1, 256, 160, 160, 288, 2048]
    - [152, 8.223]
  - - [128, 2048, 1, 512, 160, 160, 544, 2048]
    - [123, 12.831]
  - - [128, 2048, 1, 1024, 160, 160, 1056, 2048]
    - [123, 17.882]
  - - [128, 2048, 1, 2048, 160, 160, 2080, 2080]
    - [118, 22.142]
  - - [128, 2048, 1, 4096, 160, 160, 4128, 4128]
    - [125, 24.742]
  - - [128, 2048, 1, 8192, 160, 160, 8224, 8224]
    - [125, 25.508]
  - - [128, 4096, 1, 64, 160, 160, 128, 4096]
    - [121, 4.729]
  - - [128, 4096, 1, 128, 160, 160, 160, 4096]
    - [160, 8.41]
  - - [128, 4096, 1, 256, 160, 160, 288, 4096]
    - [174, 13.899]
  - - [128, 4096, 1, 512, 160, 160, 544, 4096]
    - [140, 20.623]
  - - [128, 4096, 1, 1024, 160, 160, 1056, 4096]
    - [156, 27.04]
  - - [128, 4096, 1, 2048, 160, 160, 2080, 4096]
    - [145, 31.813]
  - - [128, 4096, 1, 4096, 160, 160, 4128, 4128]
    - [138, 35.207]
  - - [128, 4096, 1, 8192, 160, 160, 8224, 8224]
    - [165, 35.898]
  - - [128, 8192, 1, 64, 160, 160, 128, 8192]
    - [149, 8.002]
  - - [128, 8192, 1, 128, 160, 160, 160, 8192]
    - [144, 13.45]
  - - [128, 8192, 1, 256, 160, 160, 288, 8192]
    - [58, 21.9]
  - - [128, 8192, 1, 512, 160, 160, 544, 8192]
    - [22, 31.38]
  - - [128, 8192, 1, 1024, 160, 160, 1056, 8192]
    - [61, 40.181]
  - - [128, 8192, 1, 2048, 160, 160, 2080, 8192]
    - [60, 45.478]
  - - [128, 8192, 1, 4096, 160, 160, 4128, 8192]
    - [85, 48.445]
  - - [128, 8192, 1, 8192, 160, 160, 8224, 8224]
    - [20, 51.15]
  - - [256, 64, 1, 64, 288, 288, 256, 96]
    - [93, 0.177]
  - - [256, 64, 1, 128, 288, 288, 256, 160]
    - [93, 0.341]
  - - [256, 64, 1, 256, 288, 288, 288, 288]
    - [107, 0.632]
  - - [256, 64, 1, 512, 288, 288, 544, 544]
    - [112, 1.112]
  - - [256, 64, 1, 1024, 288, 288, 1056, 1056]
    - [96, 1.465]
  - - [256, 64, 1, 2048, 288, 288, 2080, 2080]
    - [93, 2.556]
  - - [256, 64, 1, 4096, 288, 288, 4128, 4128]
    - [106, 3.279]
  - - [256, 64, 1, 8192, 288, 288, 8224, 8224]
    - [97, 3.728]
  - - [256, 128, 1, 64, 288, 288, 256, 128]
    - [114, 0.354]
  - - [256, 128, 1, 128, 288, 288, 256, 160]
    - [108, 0.674]
  - - [256, 128, 1, 256, 288, 288, 288, 288]
    - [92, 1.261]
  - - [256, 128, 1, 512, 288, 288, 544, 544]
    - [108, 2.217]
  - - [256, 128, 1, 1024, 288, 288, 1056, 1056]
    - [98, 3.59]
  - - [256, 128, 1, 2048, 288, 288, 2080, 2080]
    - [116, 5.114]
  - - [256, 128, 1, 4096, 288, 288, 4128, 4128]
    - [107, 6.525]
  - - [256, 128, 1, 8192, 288, 288, 8224, 8224]
    - [111, 7.334]
  - - [256, 256, 1, 64, 288, 288, 256, 256]
    - [100, 0.698]
  - - [256, 256, 1, 128, 288, 288, 256, 256]
    - [105, 1.321]
  - - [256, 256, 1, 256, 288, 288, 288, 288]
    - [116, 2.409]
  - - [256, 256, 1, 512, 288, 288, 544, 544]
    - [91, 4.081]
  - - [256, 256, 1, 1024, 288, 288, 1056, 1056]
    - [107, 6.281]
  - - [256, 256, 1, 2048, 288, 288, 2080, 2080]
    - [108, 8.587]
  - - [256, 256, 1, 4096, 288, 288, 4128, 4128]
    - [92, 10.459]
  - - [256, 256, 1, 8192, 288, 288, 8224, 8224]
    - [93, 11.524]
  - - [256, 512, 1, 64, 288, 288, 256, 512]
    - [105, 1.358]
  - - [256, 512, 1, 128, 288, 288, 256, 512]
    - [105, 2.559]
  - - [256, 512, 1, 256, 288, 288, 288, 512]
    - [105, 4.534]
  - - [256, 512, 1, 512, 288, 288, 544, 544]
    - [90, 7.4]
  - - [256, 512, 1, 1024, 288, 288, 1056, 1056]
    - [89, 10.866]
  - - [256, 512, 1, 2048, 288, 288, 2080, 2080]
    - [89, 14.185]
  - - [256, 512, 1, 4096, 288, 288, 4128, 4128]
    - [89, 16.527]
  - - [256, 512, 1, 8192, 288, 288, 8224, 8224]
    - [89, 18.159]
  - - [256, 1024, 1, 64, 288, 288, 256, 1024]
    - [11, 2.611]
  - - [256, 1024, 1, 128, 288, 288, 256, 1024]
    - [136, 4.781]
  - - [256, 1024, 1, 256, 288, 288, 288, 1024]
    - [123, 8.205]
  - - [256, 1024, 1, 512, 288, 288, 544, 1024]
    - [121, 12.849]
  - - [256, 1024, 1, 1024, 288, 288, 1056, 1056]
    - [123, 17.823]
  - - [256, 1024, 1, 2048, 288, 288, 2080, 2080]
    - [123, 22.17]
  - - [256, 1024, 1, 4096, 288, 288, 4128, 4128]
    - [123, 24.998]
  - - [256, 1024, 1, 8192, 288, 288, 8224, 8224]
    - [123, 25.832]
  - - [256, 2048, 1, 64, 288, 288, 256, 2048]
    - [158, 4.669]
  - - [256, 2048, 1, 128, 288, 288, 256, 2048]
    - [131, 8.397]
  - - [256, 2048, 1, 256, 288, 288, 288, 2048]
    - [131, 13.839]
  - - [256, 2048, 1, 512, 288, 288, 544, 2048]
    - [167, 20.56]
  - - [256, 2048, 1, 1024, 288, 288, 1056, 2048]
    - [131, 27.099]
  - - [256, 2048, 1, 2048, 288, 288, 2080, 2080]
    - [126, 32.379]
  - - [256, 2048, 1, 4096, 288, 288, 4128, 4128]
    - [155, 35.202]
  - - [256, 2048, 1, 8192, 288, 288, 8224, 8224]
    - [139, 35.982]
  - - [256, 4096, 1, 64, 288, 288, 256, 4096]
    - [137, 8.005]
  - - [256, 4096, 1, 128, 288, 288, 256, 4096]
    - [74, 13.381]
  - - [256, 4096, 1, 256, 288, 288, 288, 4096]
    - [66, 21.579]
  - - [256, 4096, 1, 512, 288, 288, 544, 4096]
    - [38, 31.371]
  - - [256, 4096, 1, 1024, 288, 288, 1056, 4096]
    - [34, 40.043]
  - - [256, 4096, 1, 2048, 288, 288, 2080, 4096]
    - [42, 45.536]
  - - [256, 4096, 1, 4096, 288, 288, 4128, 4128]
    - [60, 48.363]
  - - [256, 4096, 1, 8192, 288, 288, 8224, 8224]
    - [22, 51.527]
  - - [256, 8192, 1, 64, 288, 288, 256, 8192]
    - [18, 12.327]
  - - [256, 8192, 1, 128, 288, 288, 256, 8192]
    - [45, 22.384]
  - - [256, 8192, 1, 256, 288, 288, 288, 8192]
    - [52, 33.078]
  - - [256, 8192, 1, 512, 288, 288, 544, 8192]
    - [23, 44.381]
  - - [256, 8192, 1, 1024, 288, 288, 1056, 8192]
    - [59, 54.256]
  - - [256, 8192, 1, 2048, 288, 288, 2080, 8192]
    - [25, 57.732]
  - - [256, 8192, 1, 4096, 288, 288, 4128, 8192]
    - [59, 63.561]
  - - [256, 8192, 1, 8192, 288, 288, 8224, 8224]
    - [23, 63.319]
  - - [384, 64, 1, 64, 416, 416, 384, 96]
    - [112, 0.267]
  - - [384, 64, 1, 128, 416, 416, 384, 160]
    - [112, 0.51]
  - - [384, 64, 1, 256, 416, 416, 384, 288]
    - [108, 0.955]
  - - [384, 64, 1, 512, 416, 416, 544, 544]
    - [108, 1.662]
  - - [384, 64, 1, 1024, 416, 416, 1056, 1056]
    - [117, 2.67]
  - - [384, 64, 1, 2048, 416, 416, 2080, 2080]
    - [103, 3.823]
  - - [384, 64, 1, 4096, 416, 416, 4128, 4128]
    - [92, 4.861]
  - - [384, 64, 1, 8192, 416, 416, 8224, 8224]
    - [93, 5.502]
  - - [384, 128, 1, 64, 416, 416, 384, 128]
    - [106, 0.531]
  - - [384, 128, 1, 128, 416, 416, 384, 160]
    - [93, 1.025]
  - - [384, 128, 1, 256, 416, 416, 384, 288]
    - [106, 1.898]
  - - [384, 128, 1, 512, 416, 416, 544, 544]
    - [102, 3.336]
  - - [384, 128, 1, 1024, 416, 416, 1056, 1056]
    - [102, 5.365]
  - - [384, 128, 1, 2048, 416, 416, 2080, 2080]
    - [103, 7.647]
  - - [384, 128, 1, 4096, 416, 416, 4128, 4128]
    - [103, 9.705]
  - - [384, 128, 1, 8192, 416, 416, 8224, 8224]
    - [91, 10.914]
  - - [384, 256, 1, 64, 416, 416, 384, 256]
    - [91, 1.044]
  - - [384, 256, 1, 128, 416, 416, 384, 256]
    - [93, 1.974]
  - - [384, 256, 1, 256, 416, 416, 384, 288]
    - [91, 3.609]
  - - [384, 256, 1, 512, 416, 416, 544, 544]
    - [92, 6.137]
  - - [384, 256, 1, 1024, 416, 416, 1056, 1056]
    - [92, 9.402]
  - - [384, 256, 1, 2048, 416, 416, 2080, 2080]
    - [93, 12.719]
  - - [384, 256, 1, 4096, 416, 416, 4128, 4128]
    - [91, 15.466]
  - - [384, 256, 1, 8192, 416, 416, 8224, 8224]
    - [93, 17.179]
  - - [384, 512, 1, 64, 416, 416, 384, 512]
    - [170, 2.016]
  - - [384, 512, 1, 128, 416, 416, 384, 512]
    - [151, 3.729]
  - - [384, 512, 1, 256, 416, 416, 384, 512]
    - [135, 6.643]
  - - [384, 512, 1, 512, 416, 416, 544, 544]
    - [126, 10.578]
  - - [384, 512, 1, 1024, 416, 416, 1056, 1056]
    - [127, 15.3]
  - - [384, 512, 1, 2048, 416, 416, 2080, 2080]
    - [126, 19.527]
  - - [384, 512, 1, 4096, 416, 416, 4128, 4128]
    - [156, 22.591]
  - - [384, 512, 1, 8192, 416, 416, 8224, 8224]
    - [154, 24.497]
  - - [384, 1024, 1, 64, 416, 416, 384, 1024]
    - [4, 3.798]
  - - [384, 1024, 1, 128, 416, 416, 384, 1024]
    - [171, 6.989]
  - - [384, 1024, 1, 256, 416, 416, 384, 1024]
    - [122, 12.044]
  - - [384, 1024, 1, 512, 416, 416, 544, 1024]
    - [122, 18.912]
  - - [384, 1024, 1, 1024, 416, 416, 1056, 1056]
    - [150, 26.454]
  - - [384, 1024, 1, 2048, 416, 416, 2080, 2080]
    - [120, 33.061]
  - - [384, 1024, 1, 4096, 416, 416, 4128, 4128]
    - [121, 37.461]
  - - [384, 1024, 1, 8192, 416, 416, 8224, 8224]
    - [121, 38.693]
  - - [384, 2048, 1, 64, 416, 416, 384, 2048]
    - [123, 6.427]
  - - [384, 2048, 1, 128, 416, 416, 384, 2048]
    - [132, 11.211]
  - - [384, 2048, 1, 256, 416, 416, 384, 2048]
    - [162, 17.991]
  - - [384, 2048, 1, 512, 416, 416, 544, 2048]
    - [130, 25.911]
  - - [384, 2048, 1, 1024, 416, 416, 1056, 2048]
    - [176, 33.354]
  - - [384, 2048, 1, 2048, 416, 416, 2080, 2080]
    - [119, 38.81]
  - - [384, 2048, 1, 4096, 416, 416, 4128, 4128]
    - [151, 40.07]
  - - [384, 2048, 1, 8192, 416, 416, 8224, 8224]
    - [129, 42.36]
  - - [384, 4096, 1, 64, 416, 416, 384, 4096]
    - [121, 10.72]
  - - [384, 4096, 1, 128, 416, 416, 384, 4096]
    - [17, 18.377]
  - - [384, 4096, 1, 256, 416, 416, 384, 4096]
    - [49, 31.61]
  - - [384, 4096, 1, 512, 416, 416, 544, 4096]
    - [40, 45.103]
  - - [384, 4096, 1, 1024, 416, 416, 1056, 4096]
    - [40, 56.342]
  - - [384, 4096, 1, 2048, 416, 416, 2080, 4096]
    - [59, 65.517]
  - - [384, 4096, 1, 4096, 416, 416, 4128, 4128]
    - [33, 68.212]
  - - [384, 4096, 1, 8192, 416, 416, 8224, 8224]
    - [71, 72.856]
  - - [384, 8192, 1, 64, 416, 416, 384, 8192]
    - [18, 18.051]
  - - [384, 8192, 1, 128, 416, 416, 384, 8192]
    - [73, 27.769]
  - - [384, 8192, 1, 256, 416, 416, 384, 8192]
    - [57, 40.391]
  - - [384, 8192, 1, 512, 416, 416, 544, 8192]
    - [26, 51.224]
  - - [384, 8192, 1, 1024, 416, 416, 1056, 8192]
    - [25, 59.292]
  - - [384, 8192, 1, 2048, 416, 416, 2080, 8192]
    - [81, 63.408]
  - - [384, 8192, 1, 4096, 416, 416, 4128, 8192]
    - [55, 71.587]
  - - [384, 8192, 1, 8192, 416, 416, 8224, 8224]
    - [55, 65.872]
  - - [768, 64, 1, 64, 800, 800, 768, 96]
    - [104, 0.53]
  - - [768, 64, 1, 128, 800, 800, 768, 160]
    - [107, 1.026]
  - - [768, 64, 1, 256, 800, 800, 768, 288]
    - [92, 1.896]
  - - [768, 64, 1, 512, 800, 800, 768, 544]
    - [106, 3.338]
  - - [768, 64, 1, 1024, 800, 800, 1056, 1056]
    - [98, 5.36]
  - - [768, 64, 1, 2048, 800, 800, 2080, 2080]
    - [93, 7.647]
  - - [768, 64, 1, 4096, 800, 800, 4128, 4128]
    - [107, 9.737]
  - - [768, 64, 1, 8192, 800, 800, 8224, 8224]
    - [106, 10.905]
  - - [768, 128, 1, 64, 800, 800, 768, 128]
    - [106, 1.047]
  - - [768, 128, 1, 128, 800, 800, 768, 160]
    - [91, 1.98]
  - - [768, 128, 1, 256, 800, 800, 768, 288]
    - [108, 3.58]
  - - [768, 128, 1, 512, 800, 800, 768, 544]
    - [107, 6.072]
  - - [768, 128, 1, 1024, 800, 800, 1056, 1056]
    - [107, 9.34]
  - - [768, 128, 1, 2048, 800, 800, 2080, 2080]
    - [106, 12.737]
  - - [768, 128, 1, 4096, 800, 800, 4128, 4128]
    - [107, 15.458]
  - - [768, 128, 1, 8192, 800, 800, 8224, 8224]
    - [91, 17.149]
  - - [768, 256, 1, 64, 800, 800, 768, 256]
    - [123, 2.02]
  - - [768, 256, 1, 128, 800, 800, 768, 256]
    - [124, 3.737]
  - - [768, 256, 1, 256, 800, 800, 768, 288]
    - [161, 6.616]
  - - [768, 256, 1, 512, 800, 800, 768, 544]
    - [170, 10.644]
  - - [768, 256, 1, 1024, 800, 800, 1056, 1056]
    - [125, 15.214]
  - - [768, 256, 1, 2048, 800, 800, 2080, 2080]
    - [124, 19.461]
  - - [768, 256, 1, 4096, 800, 800, 4128, 4128]
    - [156, 22.076]
  - - [768, 256, 1, 8192, 800, 800, 8224, 8224]
    - [156, 24.431]
  - - [768, 512, 1, 64, 800, 800, 768, 512]
    - [120, 3.784]
  - - [768, 512, 1, 128, 800, 800, 768, 512]
    - [123, 6.988]
  - - [768, 512, 1, 256, 800, 800, 768, 512]
    - [123, 12.081]
  - - [768, 512, 1, 512, 800, 800, 768, 544]
    - [122, 19.003]
  - - [768, 512, 1, 1024, 800, 800, 1056, 1056]
    - [120, 26.735]
  - - [768, 512, 1, 2048, 800, 800, 2080, 2080]
    - [123, 33.432]
  - - [768, 512, 1, 4096, 800, 800, 4128, 4128]
    - [123, 37.702]
  - - [768, 512, 1, 8192, 800, 800, 8224, 8224]
    - [121, 38.874]
  - - [768, 1024, 1, 64, 800, 800, 768, 1024]
    - [123, 6.393]
  - - [768, 1024, 1, 128, 800, 800, 768, 1024]
    - [141, 11.215]
  - - [768, 1024, 1, 256, 800, 800, 768, 1024]
    - [130, 17.999]
  - - [768, 1024, 1, 512, 800, 800, 768, 1024]
    - [123, 26.036]
  - - [768, 1024, 1, 1024, 800, 800, 1056, 1056]
    - [121, 33.936]
  - - [768, 1024, 1, 2048, 800, 800, 2080, 2080]
    - [176, 39.146]
  - - [768, 1024, 1, 4096, 800, 800, 4128, 4128]
    - [159, 40.081]
  - - [768, 1024, 1, 8192, 800, 800, 8224, 8224]
    - [131, 42.308]
  - - [768, 2048, 1, 64, 800, 800, 768, 2048]
    - [166, 10.531]
  - - [768, 2048, 1, 128, 800, 800, 768, 2048]
    - [47, 17.925]
  - - [768, 2048, 1, 256, 800, 800, 768, 2048]
    - [86, 30.133]
  - - [768, 2048, 1, 512, 800, 800, 768, 2048]
    - [36, 42.341]
  - - [768, 2048, 1, 1024, 800, 800, 1056, 2048]
    - [79, 55.97]
  - - [768, 2048, 1, 2048, 800, 800, 2080, 2080]
    - [83, 64.469]
  - - [768, 2048, 1, 4096, 800, 800, 4128, 4128]
    - [25, 68.997]
  - - [768, 2048, 1, 8192, 800, 800, 8224, 8224]
    - [23, 73.752]
  - - [768, 4096, 1, 64, 800, 800, 768, 4096]
    - [18, 18.398]
  - - [768, 4096, 1, 128, 800, 800, 768, 4096]
    - [59, 27.338]
  - - [768, 4096, 1, 256, 800, 800, 768, 4096]
    - [62, 40.553]
  - - [768, 4096, 1, 512, 800, 800, 768, 4096]
    - [70, 51.979]
  - - [768, 4096, 1, 1024, 800, 800, 1056, 4096]
    - [18, 59.528]
  - - [768, 4096, 1, 2048, 800, 800, 2080, 4096]
    - [34, 64.629]
  - - [768, 4096, 1, 4096, 800, 800, 4128, 4128]
    - [81, 68.09]
  - - [768, 4096, 1, 8192, 800, 800, 8224, 8224]
    - [72, 65.038]
  - - [768, 8192, 1, 64, 800, 800, 768, 8192]
    - [30, 24.682]
  - - [768, 8192, 1, 128, 800, 800, 768, 8192]
    - [17, 37.442]
  - - [768, 8192, 1, 256, 800, 800, 768, 8192]
    - [52, 48.882]
  - - [768, 8192, 1, 512, 800, 800, 768, 8192]
    - [19, 52.899]
  - - [768, 8192, 1, 1024, 800, 800, 1056, 8192]
    - [16, 62.273]
  - - [768, 8192, 1, 2048, 800, 800, 2080, 8192]
    - [68, 67.085]
  - - [768, 8192, 1, 4096, 800, 800, 4128, 8192]
    - [88, 61.339]
  - - [768, 8192, 1, 8192, 800, 800, 8224, 8224]
    - [12, 59.257]
  - - [1536, 64, 1, 64, 1568, 1568, 1536, 96]
    - [104, 1.025]
  - - [1536, 64, 1, 128, 1568, 1568, 1536, 160]
    - [108, 1.955]
  - - [1536, 64, 1, 256, 1568, 1568, 1536, 288]
    - [102, 3.555]
  - - [1536, 64, 1, 512, 1568, 1568, 1536, 544]
    - [108, 6.093]
  - - [1536, 64, 1, 1024, 1568, 1568, 1536, 1056]
    - [108, 9.36]
  - - [1536, 64, 1, 2048, 1568, 1568, 2080, 2080]
    - [108, 12.75]
  - - [1536, 64, 1, 4096, 1568, 1568, 4128, 4128]
    - [92, 15.554]
  - - [1536, 64, 1, 8192, 1568, 1568, 8224, 8224]
    - [92, 17.264]
  - - [1536, 128, 1, 64, 1568, 1568, 1536, 128]
    - [118, 2.022]
  - - [1536, 128, 1, 128, 1568, 1568, 1536, 160]
    - [154, 3.718]
  - - [1536, 128, 1, 256, 1568, 1568, 1536, 288]
    - [135, 6.623]
  - - [1536, 128, 1, 512, 1568, 1568, 1536, 544]
    - [169, 10.657]
  - - [1536, 128, 1, 1024, 1568, 1568, 1536, 1056]
    - [156, 15.247]
  - - [1536, 128, 1, 2048, 1568, 1568, 2080, 2080]
    - [126, 19.544]
  - - [1536, 128, 1, 4096, 1568, 1568, 4128, 4128]
    - [154, 21.962]
  - - [1536, 128, 1, 8192, 1568, 1568, 8224, 8224]
    - [127, 24.398]
  - - [1536, 256, 1, 64, 1568, 1568, 1536, 256]
    - [123, 3.813]
  - - [1536, 256, 1, 128, 1568, 1568, 1536, 256]
    - [172, 6.992]
  - - [1536, 256, 1, 256, 1568, 1568, 1536, 288]
    - [123, 12.003]
  - - [1536, 256, 1, 512, 1568, 1568, 1536, 544]
    - [122, 18.777]
  - - [1536, 256, 1, 1024, 1568, 1568, 1536, 1056]
    - [121, 26.358]
  - - [1536, 256, 1, 2048, 1568, 1568, 2080, 2080]
    - [119, 32.684]
  - - [1536, 256, 1, 4096, 1568, 1568, 4128, 4128]
    - [149, 36.902]
  - - [1536, 256, 1, 8192, 1568, 1568, 8224, 8224]
    - [119, 38.6]
  - - [1536, 512, 1, 64, 1568, 1568, 1536, 512]
    - [161, 6.378]
  - - [1536, 512, 1, 128, 1568, 1568, 1536, 512]
    - [143, 11.163]
  - - [1536, 512, 1, 256, 1568, 1568, 1536, 512]
    - [130, 17.989]
  - - [1536, 512, 1, 512, 1568, 1568, 1536, 544]
    - [133, 26.286]
  - - [1536, 512, 1, 1024, 1568, 1568, 1536, 1056]
    - [147, 33.924]
  - - [1536, 512, 1, 2048, 1568, 1568, 2080, 2080]
    - [132, 39.298]
  - - [1536, 512, 1, 4096, 1568, 1568, 4128, 4128]
    - [148, 40.412]
  - - [1536, 512, 1, 8192, 1568, 1568, 8224, 8224]
    - [121, 42.343]
  - - [1536, 1024, 1, 64, 1568, 1568, 1536, 1024]
    - [78, 10.63]
  - - [1536, 1024, 1, 128, 1568, 1568, 1536, 1024]
    - [49, 18.591]
  - - [1536, 1024, 1, 256, 1568, 1568, 1536, 1024]
    - [76, 30.387]
  - - [1536, 1024, 1, 512, 1568, 1568, 1536, 1024]
    - [62, 42.161]
  - - [1536, 1024, 1, 1024, 1568, 1568, 1536, 1056]
    - [17, 55.249]
  - - [1536, 1024, 1, 2048, 1568, 1568, 2080, 2080]
    - [17, 64.461]
  - - [1536, 1024, 1, 4096, 1568, 1568, 4128, 4128]
    - [25, 68.551]
  - - [1536, 1024, 1, 8192, 1568, 1568, 8224, 8224]
    - [24, 72.301]
  - - [1536, 2048, 1, 64, 1568, 1568, 1536, 2048]
    - [37, 18.157]
  - - [1536, 2048, 1, 128, 1568, 1568, 1536, 2048]
    - [25, 27.852]
  - - [1536, 2048, 1, 256, 1568, 1568, 1536, 2048]
    - [87, 40.74]
  - - [1536, 2048, 1, 512, 1568, 1568, 1536, 2048]
    - [32, 52.224]
  - - [1536, 2048, 1, 1024, 1568, 1568, 1536, 2048]
    - [17, 61.075]
  - - [1536, 2048, 1, 2048, 1568, 1568, 2080, 2080]
    - [61, 62.693]
  - - [1536, 2048, 1, 4096, 1568, 1568, 4128, 4128]
    - [75, 67.632]
  - - [1536, 2048, 1, 8192, 1568, 1568, 8224, 8224]
    - [83, 65.674]
  - - [1536, 4096, 1, 64, 1568, 1568, 1536, 4096]
    - [30, 24.644]
  - - [1536, 4096, 1, 128, 1568, 1568, 1536, 4096]
    - [27, 37.295]
  - - [1536, 4096, 1, 256, 1568, 1568, 1536, 4096]
    - [52, 48.498]
  - - [1536, 4096, 1, 512, 1568, 1568, 1536, 4096]
    - [19, 52.195]
  - - [1536, 4096, 1, 1024, 1568, 1568, 1536, 4096]
    - [70, 62.195]
  - - [1536, 4096, 1, 2048, 1568, 1568, 2080, 4096]
    - [50, 65.228]
  - - [1536, 4096, 1, 4096, 1568, 1568, 4128, 4128]
    - [18, 66.27]
  - - [1536, 4096, 1, 8192, 1568, 1568, 8224, 8224]
    - [14, 63.141]
  - - [1536, 8192, 1, 64, 1568, 1568, 1536, 8192]
    - [28, 32.711]
  - - [1536, 8192, 1, 128, 1568, 1568, 1536, 8192]
    - [18, 46.07]
  - - [1536, 8192, 1, 256, 1568, 1568, 1536, 8192]
    - [15, 51.49]
  - - [1536, 8192, 1, 512, 1568, 1568, 1536, 8192]
    - [48, 61.268]
  - - [1536, 8192, 1, 1024, 1568, 1568, 1536, 8192]
    - [78, 66.096]
  - - [1536, 8192, 1, 2048, 1568, 1568, 2080, 8192]
    - [13, 64.62]
  - - [1536, 8192, 1, 4096, 1568, 1568, 4128, 8192]
    - [51, 63.666]
  - - [1536, 8192, 1, 8192, 1568, 1568, 8224, 8224]
    - [52, 62.586]
  - - [3072, 64, 1, 64, 3104, 3104, 3072, 96]
    - [104, 1.889]
  - - [3072, 64, 1, 128, 3104, 3104, 3072, 160]
    - [8, 3.697]
  - - [3072, 64, 1, 256, 3104, 3104, 3072, 288]
    - [156, 6.605]
  - - [3072, 64, 1, 512, 3104, 3104, 3072, 544]
    - [125, 10.617]
  - - [3072, 64, 1, 1024, 3104, 3104, 3072, 1056]
    - [124, 15.219]
  - - [3072, 64, 1, 2048, 3104, 3104, 3072, 2080]
    - [156, 19.514]
  - - [3072, 64, 1, 4096, 3104, 3104, 4128, 4128]
    - [155, 22.204]
  - - [3072, 64, 1, 8192, 3104, 3104, 8224, 8224]
    - [156, 24.453]
  - - [3072, 128, 1, 64, 3104, 3104, 3072, 128]
    - [10, 3.811]
  - - [3072, 128, 1, 128, 3104, 3104, 3072, 160]
    - [149, 7.0]
  - - [3072, 128, 1, 256, 3104, 3104, 3072, 288]
    - [134, 11.971]
  - - [3072, 128, 1, 512, 3104, 3104, 3072, 544]
    - [122, 18.665]
  - - [3072, 128, 1, 1024, 3104, 3104, 3072, 1056]
    - [139, 25.881]
  - - [3072, 128, 1, 2048, 3104, 3104, 3072, 2080]
    - [174, 32.036]
  - - [3072, 128, 1, 4096, 3104, 3104, 4128, 4128]
    - [126, 35.74]
  - - [3072, 128, 1, 8192, 3104, 3104, 8224, 8224]
    - [166, 37.537]
  - - [3072, 256, 1, 64, 3104, 3104, 3072, 256]
    - [149, 6.341]
  - - [3072, 256, 1, 128, 3104, 3104, 3072, 256]
    - [9, 11.147]
  - - [3072, 256, 1, 256, 3104, 3104, 3072, 288]
    - [134, 17.925]
  - - [3072, 256, 1, 512, 3104, 3104, 3072, 544]
    - [168, 25.897]
  - - [3072, 256, 1, 1024, 3104, 3104, 3072, 1056]
    - [160, 33.385]
  - - [3072, 256, 1, 2048, 3104, 3104, 3072, 2080]
    - [131, 38.693]
  - - [3072, 256, 1, 4096, 3104, 3104, 4128, 4128]
    - [131, 39.791]
  - - [3072, 256, 1, 8192, 3104, 3104, 8224, 8224]
    - [131, 42.353]
  - - [3072, 512, 1, 64, 3104, 3104, 3072, 512]
    - [163, 10.796]
  - - [3072, 512, 1, 128, 3104, 3104, 3072, 512]
    - [52, 19.97]
  - - [3072, 512, 1, 256, 3104, 3104, 3072, 512]
    - [14, 31.484]
  - - [3072, 512, 1, 512, 3104, 3104, 3072, 544]
    - [14, 44.105]
  - - [3072, 512, 1, 1024, 3104, 3104, 3072, 1056]
    - [49, 56.658]
  - - [3072, 512, 1, 2048, 3104, 3104, 3072, 2080]
    - [59, 65.531]
  - - [3072, 512, 1, 4096, 3104, 3104, 4128, 4128]
    - [26, 68.991]
  - - [3072, 512, 1, 8192, 3104, 3104, 8224, 8224]
    - [63, 69.916]
  - - [3072, 1024, 1, 64, 3104, 3104, 3072, 1024]
    - [16, 17.436]
  - - [3072, 1024, 1, 128, 3104, 3104, 3072, 1024]
    - [24, 27.126]
  - - [3072, 1024, 1, 256, 3104, 3104, 3072, 1024]
    - [44, 40.375]
  - - [3072, 1024, 1, 512, 3104, 3104, 3072, 1024]
    - [54, 51.146]
  - - [3072, 1024, 1, 1024, 3104, 3104, 3072, 1056]
    - [80, 58.873]
  - - [3072, 1024, 1, 2048, 3104, 3104, 3072, 2080]
    - [84, 63.739]
  - - [3072, 1024, 1, 4096, 3104, 3104, 4128, 4128]
    - [25, 68.063]
  - - [3072, 1024, 1, 8192, 3104, 3104, 8224, 8224]
    - [25, 67.439]
  - - [3072, 2048, 1, 64, 3104, 3104, 3072, 2048]
    - [30, 24.37]
  - - [3072, 2048, 1, 128, 3104, 3104, 3072, 2048]
    - [41, 37.095]
  - - [3072, 2048, 1, 256, 3104, 3104, 3072, 2048]
    - [17, 48.965]
  - - [3072, 2048, 1, 512, 3104, 3104, 3072, 2048]
    - [51, 52.258]
  - - [3072, 2048, 1, 1024, 3104, 3104, 3072, 2048]
    - [69, 61.684]
  - - [3072, 2048, 1, 2048, 3104, 3104, 3072, 2080]
    - [80, 66.623]
  - - [3072, 2048, 1, 4096, 3104, 3104, 4128, 4128]
    - [18, 61.846]
  - - [3072, 2048, 1, 8192, 3104, 3104, 8224, 8224]
    - [52, 63.155]
  - - [3072, 4096, 1, 64, 3104, 3104, 3072, 4096]
    - [46, 32.138]
  - - [3072, 4096, 1, 128, 3104, 3104, 3072, 4096]
    - [40, 45.762]
  - - [3072, 4096, 1, 256, 3104, 3104, 3072, 4096]
    - [64, 51.159]
  - - [3072, 4096, 1, 512, 3104, 3104, 3072, 4096]
    - [80, 60.89]
  - - [3072, 4096, 1, 1024, 3104, 3104, 3072, 4096]
    - [29, 67.378]
  - - [3072, 4096, 1, 2048, 3104, 3104, 3072, 4096]
    - [48, 61.553]
  - - [3072, 4096, 1, 4096, 3104, 3104, 4128, 4128]
    - [65, 64.047]
  - - [3072, 4096, 1, 8192, 3104, 3104, 8224, 8224]
    - [54, 63.045]
  - - [3072, 8192, 1, 64, 3104, 3104, 3072, 8192]
    - [132, 33.05]
  - - [3072, 8192, 1, 128, 3104, 3104, 3072, 8192]
    - [53, 48.497]
  - - [3072, 8192, 1, 256, 3104, 3104, 3072, 8192]
    - [43, 59.283]
  - - [3072, 8192, 1, 512, 3104, 3104, 3072, 8192]
    - [79, 65.421]
  - - [3072, 8192, 1, 1024, 3104, 3104, 3072, 8192]
    - [20, 60.697]
  - - [3072, 8192, 1, 2048, 3104, 3104, 3072, 8192]
    - [17, 59.376]
  - - [3072, 8192, 1, 4096, 3104, 3104, 4128, 8192]
    - [17, 62.712]
  - - [3072, 8192, 1, 8192, 3104, 3104, 8224, 8224]
    - [52, 61.824]
  - - [6144, 64, 1, 64, 6176, 6176, 6144, 96]
    - [6, 3.562]
  - - [6144, 64, 1, 128, 6176, 6176, 6144, 160]
    - [7, 6.894]
  - - [6144, 64, 1, 256, 6176, 6176, 6144, 288]
    - [152, 11.908]
  - - [6144, 64, 1, 512, 6176, 6176, 6144, 544]
    - [123, 18.679]
  - - [6144, 64, 1, 1024, 6176, 6176, 6144, 1056]
    - [155, 25.768]
  - - [6144, 64, 1, 2048, 6176, 6176, 6144, 2080]
    - [118, 32.016]
  - - [6144, 64, 1, 4096, 6176, 6176, 6144, 4128]
    - [119, 35.832]
  - - [6144, 64, 1, 8192, 6176, 6176, 8224, 8224]
    - [153, 37.316]
  - - [6144, 128, 1, 64, 6176, 6176, 6144, 128]
    - [137, 6.386]
  - - [6144, 128, 1, 128, 6176, 6176, 6144, 160]
    - [5, 11.128]
  - - [6144, 128, 1, 256, 6176, 6176, 6144, 288]
    - [137, 18.082]
  - - [6144, 128, 1, 512, 6176, 6176, 6144, 544]
    - [170, 26.232]
  - - [6144, 128, 1, 1024, 6176, 6176, 6144, 1056]
    - [146, 33.396]
  - - [6144, 128, 1, 2048, 6176, 6176, 6144, 2080]
    - [160, 38.75]
  - - [6144, 128, 1, 4096, 6176, 6176, 6144, 4128]
    - [159, 39.75]
  - - [6144, 128, 1, 8192, 6176, 6176, 8224, 8224]
    - [131, 42.315]
  - - [6144, 256, 1, 64, 6176, 6176, 6144, 256]
    - [127, 10.619]
  - - [6144, 256, 1, 128, 6176, 6176, 6144, 256]
    - [17, 19.512]
  - - [6144, 256, 1, 256, 6176, 6176, 6144, 288]
    - [15, 31.464]
  - - [6144, 256, 1, 512, 6176, 6176, 6144, 544]
    - [14, 44.198]
  - - [6144, 256, 1, 1024, 6176, 6176, 6144, 1056]
    - [14, 55.422]
  - - [6144, 256, 1, 2048, 6176, 6176, 6144, 2080]
    - [59, 65.357]
  - - [6144, 256, 1, 4096, 6176, 6176, 6144, 4128]
    - [25, 69.228]
  - - [6144, 256, 1, 8192, 6176, 6176, 8224, 8224]
    - [60, 72.362]
  - - [6144, 512, 1, 64, 6176, 6176, 6144, 512]
    - [51, 16.815]
  - - [6144, 512, 1, 128, 6176, 6176, 6144, 512]
    - [44, 27.205]
  - - [6144, 512, 1, 256, 6176, 6176, 6144, 512]
    - [77, 40.162]
  - - [6144, 512, 1, 512, 6176, 6176, 6144, 544]
    - [19, 51.396]
  - - [6144, 512, 1, 1024, 6176, 6176, 6144, 1056]
    - [52, 59.754]
  - - [6144, 512, 1, 2048, 6176, 6176, 6144, 2080]
    - [25, 64.047]
  - - [6144, 512, 1, 4096, 6176, 6176, 6144, 4128]
    - [56, 69.116]
  - - [6144, 512, 1, 8192, 6176, 6176, 8224, 8224]
    - [59, 64.365]
  - - [6144, 1024, 1, 64, 6176, 6176, 6144, 1024]
    - [147, 23.469]
  - - [6144, 1024, 1, 128, 6176, 6176, 6144, 1024]
    - [21, 36.948]
  - - [6144, 1024, 1, 256, 6176, 6176, 6144, 1024]
    - [19, 48.639]
  - - [6144, 1024, 1, 512, 6176, 6176, 6144, 1024]
    - [54, 55.716]
  - - [6144, 1024, 1, 1024, 6176, 6176, 6144, 1056]
    - [49, 62.249]
  - - [6144, 1024, 1, 2048, 6176, 6176, 6144, 2080]
    - [18, 65.193]
  - - [6144, 1024, 1, 4096, 6176, 6176, 6144, 4128]
    - [88, 61.627]
  - - [6144, 1024, 1, 8192, 6176, 6176, 8224, 8224]
    - [39, 62.899]
  - - [6144, 2048, 1, 64, 6176, 6176, 6144, 2048]
    - [142, 29.072]
  - - [6144, 2048, 1, 128, 6176, 6176, 6144, 2048]
    - [17, 45.605]
  - - [6144, 2048, 1, 256, 6176, 6176, 6144, 2048]
    - [39, 51.333]
  - - [6144, 2048, 1, 512, 6176, 6176, 6144, 2048]
    - [31, 61.16]
  - - [6144, 2048, 1, 1024, 6176, 6176, 6144, 2048]
    - [49, 64.502]
  - - [6144, 2048, 1, 2048, 6176, 6176, 6144, 2080]
    - [18, 62.807]
  - - [6144, 2048, 1, 4096, 6176, 6176, 6144, 4128]
    - [67, 65.288]
  - - [6144, 2048, 1, 8192, 6176, 6176, 8224, 8224]
    - [69, 63.075]
  - - [6144, 4096, 1, 64, 6176, 6176, 6144, 4096]
    - [131, 32.258]
  - - [6144, 4096, 1, 128, 6176, 6176, 6144, 4096]
    - [18, 48.524]
  - - [6144, 4096, 1, 256, 6176, 6176, 6144, 4096]
    - [31, 60.221]
  - - [6144, 4096, 1, 512, 6176, 6176, 6144, 4096]
    - [82, 66.674]
  - - [6144, 4096, 1, 1024, 6176, 6176, 6144, 4096]
    - [56, 62.613]
  - - [6144, 4096, 1, 2048, 6176, 6176, 6144, 4096]
    - [64, 59.47]
  - - [6144, 4096, 1, 4096, 6176, 6176, 6144, 4128]
    - [65, 63.354]
  - - [6144, 4096, 1, 8192, 6176, 6176, 8224, 8224]
    - [52, 61.24]
  - - [6144, 8192, 1, 64, 6176, 6176, 6144, 8192]
    - [1, 15.152]
  - - [6144, 8192, 1, 128, 6176, 6176, 6144, 8192]
    - [128, 25.358]
  - - [6144, 8192, 1, 256, 6176, 6176, 6144, 8192]
    - [35, 43.95]
  - - [6144, 8192, 1, 512, 6176, 6176, 6144, 8192]
    - [23, 56.573]
  - - [6144, 8192, 1, 1024, 6176, 6176, 6144, 8192]
    - [82, 54.601]
  - - [6144, 8192, 1, 2048, 6176, 6176, 6144, 8192]
    - [53, 61.535]
  - - [6144, 8192, 1, 4096, 6176, 6176, 6144, 8192]
    - [53, 61.82]
  - - [6144, 8192, 1, 8192, 6176, 6176, 8224, 8224]
    - [17, 60.072]
- null
- null
- DeviceEfficiency
