library/src/blas3/Tensile/Logic/asm_full/navi31/navi31_Cijk_Ailk_Bljk_SB.yaml
- {MinimumRequiredVersion: 4.26.0}
- navi31
- gfx1100
- [Device 73a2]
    SolutionIndex: 0
    SolutionNameMin: Cijk_Ailk_Bljk_SB_MT128x64x8_SN_SU0_SUM0_TT8_8_WG16_8_1_WGM1
    SolutionIndex: 1
    SolutionNameMin: Cijk_Ailk_Bljk_SB_MT128x128x8_SN_SU0_SUM0_TT8_16_WG16_8_1_WGM1
    SolutionIndex: 2
    SolutionNameMin: Cijk_Ailk_Bljk_SB_MT128x128x8_SN_SU0_SUM0_TT8_8_WG16_16_1_WGM1
    SolutionIndex: 3
    SolutionNameMin: Cijk_Ailk_Bljk_SB_MT128x64x16_SN_SU0_SUM0_TT8_8_WG16_8_1_WGM1
    SolutionIndex: 4
    SolutionNameMin: Cijk_Ailk_Bljk_SB_MT128x128x16_SN_SU0_SUM0_TT8_16_WG16_8_1_WGM1
    SolutionIndex: 5
    SolutionNameMin: Cijk_Ailk_Bljk_SB_MT128x256x16_SN_SU0_SUM0_TT8_16_WG16_16_1_WGM1
    SolutionIndex: 6
    SolutionNameMin: Cijk_Ailk_Bljk_SB_MT128x64x8_SN_SU32_SUM3_TT8_8_WG16_8_1_WGM1
    SolutionIndex: 7
    SolutionNameMin: Cijk_Ailk_Bljk_SB_MT128x128x8_SN_SU32_SUM3_TT8_16_WG16_8_1_WGM1
    SolutionIndex: 8
    SolutionNameMin: Cijk_Ailk_Bljk_SB_MT128x128x8_SN_SU32_SUM3_TT8_8_WG16_16_1_WGM1
    SolutionIndex: 9
    SolutionNameMin: Cijk_Ailk_Bljk_SB_MT128x256x8_SN_SU32_SUM3_TT8_16_WG16_16_1_WGM1
    SolutionIndex: 10
    SolutionNameMin: Cijk_Ailk_Bljk_SB_MT128x64x16_SN_SU32_SUM3_TT8_8_WG16_8_1_WGM1
    SolutionIndex: 11
    SolutionNameMin: Cijk_Ailk_Bljk_SB_MT128x128x16_SN_SU32_SUM3_TT8_16_WG16_8_1_WGM1
    SolutionIndex: 12
    SolutionNameMin: Cijk_Ailk_Bljk_SB_MT128x128x16_SN_SU32_SUM3_TT8_8_WG16_16_1_WGM1
    SolutionIndex: 13
    SolutionNameMin: Cijk_Ailk_Bljk_SB_MT128x256x16_SN_SU32_SUM3_TT8_16_WG16_16_1_WGM1
    SolutionIndex: 14
    SolutionNameMin: Cijk_Ailk_Bljk_SB_MT128x64x8_SN_SU0_SUM0_TT8_8_WG16_8_1_WGM4
    SolutionIndex: 15
    SolutionNameMin: Cijk_Ailk_Bljk_SB_MT128x128x8_SN_SU0_SUM0_TT8_16_WG16_8_1_WGM4
    SolutionIndex: 16
    SolutionNameMin: Cijk_Ailk_Bljk_SB_MT128x128x8_SN_SU0_SUM0_TT8_8_WG16_16_1_WGM4
    SolutionIndex: 17
    SolutionNameMin: Cijk_Ailk_Bljk_SB_MT128x256x8_SN_SU0_SUM0_TT8_16_WG16_16_1_WGM4
    SolutionIndex: 18
    SolutionNameMin: Cijk_Ailk_Bljk_SB_MT128x64x16_SN_SU0_SUM0_TT8_8_WG16_8_1_WGM4
    SolutionIndex: 19
    SolutionNameMin: Cijk_Ailk_Bljk_SB_MT128x128x16_SN_SU0_SUM0_TT8_16_WG16_8_1_WGM4
    SolutionIndex: 20
    SolutionNameMin: Cijk_Ailk_Bljk_SB_MT128x128x16_SN_SU0_SUM0_TT8_8_WG16_16_1_WGM4
    SolutionIndex: 21
    SolutionNameMin: Cijk_Ailk_Bljk_SB_MT128x256x16_SN_SU0_SUM0_TT8_16_WG16_16_1_WGM4
    SolutionIndex: 22
    SolutionNameMin: Cijk_Ailk_Bljk_SB_MT128x64x8_SN_SU32_SUM3_TT8_8_WG16_8_1_WGM4
    SolutionIndex: 23
    SolutionNameMin: Cijk_Ailk_Bljk_SB_MT128x128x8_SN_SU32_SUM3_TT8_16_WG16_8_1_WGM4
    SolutionIndex: 24
    SolutionNameMin: Cijk_Ailk_Bljk_SB_MT128x128x8_SN_SU32_SUM3_TT8_8_WG16_16_1_WGM4
    SolutionIndex: 25
    SolutionNameMin: Cijk_Ailk_Bljk_SB_MT128x256x8_SN_SU32_SUM3_TT8_16_WG16_16_1_WGM4
    SolutionIndex: 26
    SolutionNameMin: Cijk_Ailk_Bljk_SB_MT128x64x16_SN_SU32_SUM3_TT8_8_WG16_8_1_WGM4
    SolutionIndex: 27
    SolutionNameMin: Cijk_Ailk_Bljk_SB_MT128x128x16_SN_SU32_SUM3_TT8_16_WG16_8_1_WGM4
    SolutionIndex: 28
    SolutionNameMin: Cijk_Ailk_Bljk_SB_MT128x256x16_SN_SU32_SUM3_TT8_16_WG16_16_1_WGM4
    SolutionIndex: 29
    SolutionNameMin: Cijk_Ailk_Bljk_SB_MT128x64x8_SN_SU0_SUM0_TT8_8_WG16_8_1_WGM8
    SolutionIndex: 30
    SolutionNameMin: Cijk_Ailk_Bljk_SB_MT128x128x8_SN_SU0_SUM0_TT8_16_WG16_8_1_WGM8
    SolutionIndex: 31
    SolutionNameMin: Cijk_Ailk_Bljk_SB_MT128x128x8_SN_SU0_SUM0_TT8_8_WG16_16_1_WGM8
    SolutionIndex: 32
    SolutionNameMin: Cijk_Ailk_Bljk_SB_MT128x64x16_SN_SU0_SUM0_TT8_8_WG16_8_1_WGM8
    SolutionIndex: 33
    SolutionNameMin: Cijk_Ailk_Bljk_SB_MT128x128x16_SN_SU0_SUM0_TT8_16_WG16_8_1_WGM8
    SolutionIndex: 34
    SolutionNameMin: Cijk_Ailk_Bljk_SB_MT128x256x16_SN_SU0_SUM0_TT8_16_WG16_16_1_WGM8
    SolutionIndex: 35
    SolutionNameMin: Cijk_Ailk_Bljk_SB_MT128x64x8_SN_SU32_SUM3_TT8_8_WG16_8_1_WGM8
    SolutionIndex: 36
    SolutionNameMin: Cijk_Ailk_Bljk_SB_MT128x128x8_SN_SU32_SUM3_TT8_16_WG16_8_1_WGM8
    SolutionIndex: 37
    SolutionNameMin: Cijk_Ailk_Bljk_SB_MT128x128x8_SN_SU32_SUM3_TT8_8_WG16_16_1_WGM8
    SolutionIndex: 38
    SolutionNameMin: Cijk_Ailk_Bljk_SB_MT128x64x16_SN_SU32_SUM3_TT8_8_WG16_8_1_WGM8
    SolutionIndex: 39
    SolutionNameMin: Cijk_Ailk_Bljk_SB_MT128x128x16_SN_SU32_SUM3_TT8_16_WG16_8_1_WGM8
    SolutionIndex: 40
    SolutionNameMin: Cijk_Ailk_Bljk_SB_MT128x256x16_SN_SU32_SUM3_TT8_16_WG16_16_1_WGM8
    SolutionIndex: 41
    SolutionNameMin: Cijk_Ailk_Bljk_SB_MT128x64x8_SN_SU0_SUM0_TT8_8_WG16_8_1_WGM1
    SolutionIndex: 42
    SolutionNameMin: Cijk_Ailk_Bljk_SB_MT128x128x8_SN_SU0_SUM0_TT8_16_WG16_8_1_WGM1
    SolutionIndex: 43
    SolutionNameMin: Cijk_Ailk_Bljk_SB_MT128x256x16_SN_SU0_SUM0_TT8_16_WG16_16_1_WGM1
    SolutionIndex: 44
    SolutionNameMin: Cijk_Ailk_Bljk_SB_MT128x64x8_SN_SU0_SUM0_TT8_8_WG16_8_1_WGM4
    SolutionIndex: 45
    SolutionNameMin: Cijk_Ailk_Bljk_SB_MT128x128x8_SN_SU0_SUM0_TT8_8_WG16_16_1_WGM4
    SolutionIndex: 46
    SolutionNameMin: Cijk_Ailk_Bljk_SB_MT128x256x16_SN_SU0_SUM0_TT8_16_WG16_16_1_WGM4
    SolutionIndex: 47
    SolutionNameMin: Cijk_Ailk_Bljk_SB_MT128x64x8_SN_SU0_SUM0_TT8_8_WG16_8_1_WGM8
    SolutionIndex: 48
    SolutionNameMin: Cijk_Ailk_Bljk_SB_MT128x256x8_SN_SU0_SUM0_TT8_16_WG16_16_1_WGM8
    SolutionIndex: 49
    SolutionNameMin: Cijk_Ailk_Bljk_SB_MT128x64x16_SN_SU0_SUM0_TT8_8_WG16_8_1_WGM8
    SolutionIndex: 50
    SolutionNameMin: Cijk_Ailk_Bljk_SB_MT128x256x16_SN_SU0_SUM0_TT8_16_WG16_16_1_WGM8
    SolutionIndex: 51
    SolutionNameMin: Cijk_Ailk_Bljk_SB_MT128x256x16_SN_SU32_SUM3_TT8_16_WG16_16_1_WGM8
    SolutionIndex: 52
    SolutionNameMin: Cijk_Ailk_Bljk_SB_MT32x32x8_SN_SU0_SUM0_TT4_4_WG8_8_1_WGM1
    SolutionIndex: 53
    SolutionNameMin: Cijk_Ailk_Bljk_SB_MT32x64x8_SN_SU0_SUM0_TT4_8_WG8_8_1_WGM1
    SolutionIndex: 54
    SolutionNameMin: Cijk_Ailk_Bljk_SB_MT64x64x8_SN_SU0_SUM0_TT8_8_WG8_8_1_WGM1
    SolutionIndex: 55
    SolutionNameMin: Cijk_Ailk_Bljk_SB_MT64x64x8_SN_SU0_SUM0_TT4_8_WG16_8_1_WGM1
    SolutionIndex: 56
    SolutionNameMin: Cijk_Ailk_Bljk_SB_MT128x64x8_SN_SU0_SUM0_TT8_8_WG16_8_1_WGM1
    SolutionIndex: 57
    SolutionNameMin: Cijk_Ailk_Bljk_SB_MT128x128x8_SN_SU0_SUM0_TT8_8_WG16_16_1_WGM1
    SolutionIndex: 58
    SolutionNameMin: Cijk_Ailk_Bljk_SB_MT64x64x16_SN_SU0_SUM0_TT8_8_WG8_8_1_WGM1
    SolutionIndex: 59
    SolutionNameMin: Cijk_Ailk_Bljk_SB_MT64x64x16_SN_SU0_SUM0_TT4_8_WG16_8_1_WGM1
    SolutionIndex: 60
    SolutionNameMin: Cijk_Ailk_Bljk_SB_MT128x128x16_SN_SU0_SUM0_TT8_8_WG16_16_1_WGM1
    SolutionIndex: 61
    SolutionNameMin: Cijk_Ailk_Bljk_SB_MT64x64x8_SN_SU32_SUM3_TT8_8_WG8_8_1_WGM1
    SolutionIndex: 62
    SolutionNameMin: Cijk_Ailk_Bljk_SB_MT64x64x8_SN_SU32_SUM3_TT4_8_WG16_8_1_WGM1
    SolutionIndex: 63
    SolutionNameMin: Cijk_Ailk_Bljk_SB_MT128x64x8_SN_SU32_SUM3_TT8_8_WG16_8_1_WGM1
    SolutionIndex: 64
    SolutionNameMin: Cijk_Ailk_Bljk_SB_MT128x128x8_SN_SU32_SUM3_TT8_8_WG16_16_1_WGM1
    SolutionIndex: 65
    SolutionNameMin: Cijk_Ailk_Bljk_SB_MT64x64x16_SN_SU32_SUM3_TT8_8_WG8_8_1_WGM1
    SolutionIndex: 66
    SolutionNameMin: Cijk_Ailk_Bljk_SB_MT64x64x16_SN_SU32_SUM3_TT4_8_WG16_8_1_WGM1
    SolutionIndex: 67
    SolutionNameMin: Cijk_Ailk_Bljk_SB_MT128x64x16_SN_SU32_SUM3_TT8_8_WG16_8_1_WGM1
    SolutionIndex: 68
    SolutionNameMin: Cijk_Ailk_Bljk_SB_MT64x128x16_SN_SU32_SUM3_TT4_8_WG16_16_1_WGM1
    SolutionIndex: 69
    SolutionNameMin: Cijk_Ailk_Bljk_SB_MT64x64x32_SN_SU32_SUM3_TT8_8_WG8_8_1_WGM1
    SolutionIndex: 70
    SolutionNameMin: Cijk_Ailk_Bljk_SB_MT64x64x32_SN_SU32_SUM3_TT4_8_WG16_8_1_WGM1
    SolutionIndex: 71
    SolutionNameMin: Cijk_Ailk_Bljk_SB_MT32x64x8_SN_SU0_SUM0_TT4_8_WG8_8_1_WGM4
    SolutionIndex: 72
    SolutionNameMin: Cijk_Ailk_Bljk_SB_MT64x64x8_SN_SU0_SUM0_TT8_8_WG8_8_1_WGM4
    SolutionIndex: 73
    SolutionNameMin: Cijk_Ailk_Bljk_SB_MT64x64x8_SN_SU0_SUM0_TT4_8_WG16_8_1_WGM4
    SolutionIndex: 74
    SolutionNameMin: Cijk_Ailk_Bljk_SB_MT128x64x8_SN_SU0_SUM0_TT8_8_WG16_8_1_WGM4
    SolutionIndex: 75
    SolutionNameMin: Cijk_Ailk_Bljk_SB_MT128x128x8_SN_SU0_SUM0_TT8_8_WG16_16_1_WGM4
    SolutionIndex: 76
    SolutionNameMin: Cijk_Ailk_Bljk_SB_MT64x64x16_SN_SU0_SUM0_TT8_8_WG8_8_1_WGM4
    SolutionIndex: 77
    SolutionNameMin: Cijk_Ailk_Bljk_SB_MT64x64x16_SN_SU0_SUM0_TT4_8_WG16_8_1_WGM4
    SolutionIndex: 78
    SolutionNameMin: Cijk_Ailk_Bljk_SB_MT128x64x16_SN_SU0_SUM0_TT8_8_WG16_8_1_WGM4
    SolutionIndex: 79
    SolutionNameMin: Cijk_Ailk_Bljk_SB_MT128x128x16_SN_SU0_SUM0_TT8_8_WG16_16_1_WGM4
    SolutionIndex: 80
    SolutionNameMin: Cijk_Ailk_Bljk_SB_MT64x64x8_SN_SU32_SUM3_TT8_8_WG8_8_1_WGM4
    SolutionIndex: 81
    SolutionNameMin: Cijk_Ailk_Bljk_SB_MT64x64x8_SN_SU32_SUM3_TT4_8_WG16_8_1_WGM4
    SolutionIndex: 82
    SolutionNameMin: Cijk_Ailk_Bljk_SB_MT128x64x8_SN_SU32_SUM3_TT8_8_WG16_8_1_WGM4
    SolutionIndex: 83
    SolutionNameMin: Cijk_Ailk_Bljk_SB_MT128x128x8_SN_SU32_SUM3_TT8_8_WG16_16_1_WGM4
    SolutionIndex: 84
    SolutionNameMin: Cijk_Ailk_Bljk_SB_MT64x64x16_SN_SU32_SUM3_TT8_8_WG8_8_1_WGM4
    SolutionIndex: 85
    SolutionNameMin: Cijk_Ailk_Bljk_SB_MT64x32x16_SN_SU32_SUM3_TT4_4_WG16_8_1_WGM4
    SolutionIndex: 86
    SolutionNameMin: Cijk_Ailk_Bljk_SB_MT64x64x16_SN_SU32_SUM3_TT4_8_WG16_8_1_WGM4
    SolutionIndex: 87
    SolutionNameMin: Cijk_Ailk_Bljk_SB_MT128x64x16_SN_SU32_SUM3_TT8_8_WG16_8_1_WGM4
    SolutionIndex: 88
    SolutionNameMin: Cijk_Ailk_Bljk_SB_MT64x128x16_SN_SU32_SUM3_TT4_8_WG16_16_1_WGM4
    SolutionIndex: 89
    SolutionNameMin: Cijk_Ailk_Bljk_SB_MT128x128x16_SN_SU32_SUM3_TT8_8_WG16_16_1_WGM4
    SolutionIndex: 90
    SolutionNameMin: Cijk_Ailk_Bljk_SB_MT64x64x32_SN_SU32_SUM3_TT8_8_WG8_8_1_WGM4
    SolutionIndex: 91
    SolutionNameMin: Cijk_Ailk_Bljk_SB_MT64x32x32_SN_SU32_SUM3_TT4_4_WG16_8_1_WGM4
    SolutionIndex: 92
    SolutionNameMin: Cijk_Ailk_Bljk_SB_MT64x64x32_SN_SU32_SUM3_TT4_8_WG16_8_1_WGM4
    SolutionIndex: 93
    SolutionNameMin: Cijk_Ailk_Bljk_SB_MT32x32x8_SN_SU0_SUM0_TT4_4_WG8_8_1_WGM8
    SolutionIndex: 94
    SolutionNameMin: Cijk_Ailk_Bljk_SB_MT32x64x8_SN_SU0_SUM0_TT4_8_WG8_8_1_WGM8
    SolutionIndex: 95
    SolutionNameMin: Cijk_Ailk_Bljk_SB_MT64x64x8_SN_SU0_SUM0_TT8_8_WG8_8_1_WGM8
    SolutionIndex: 96
    SolutionNameMin: Cijk_Ailk_Bljk_SB_MT64x64x8_SN_SU0_SUM0_TT4_8_WG16_8_1_WGM8
    SolutionIndex: 97
    SolutionNameMin: Cijk_Ailk_Bljk_SB_MT128x64x8_SN_SU0_SUM0_TT8_8_WG16_8_1_WGM8
    SolutionIndex: 98
    SolutionNameMin: Cijk_Ailk_Bljk_SB_MT128x128x8_SN_SU0_SUM0_TT8_8_WG16_16_1_WGM8
    SolutionIndex: 99
    SolutionNameMin: Cijk_Ailk_Bljk_SB_MT64x64x16_SN_SU0_SUM0_TT8_8_WG8_8_1_WGM8
    SolutionIndex: 100
    SolutionNameMin: Cijk_Ailk_Bljk_SB_MT64x64x16_SN_SU0_SUM0_TT4_4_WG16_16_1_WGM8
    SolutionIndex: 101
    SolutionNameMin: Cijk_Ailk_Bljk_SB_MT128x128x16_SN_SU0_SUM0_TT8_8_WG16_16_1_WGM8
    SolutionIndex: 102
    SolutionNameMin: Cijk_Ailk_Bljk_SB_MT32x64x8_SN_SU32_SUM3_TT4_8_WG8_8_1_WGM8
    SolutionIndex: 103
    SolutionNameMin: Cijk_Ailk_Bljk_SB_MT64x64x8_SN_SU32_SUM3_TT8_8_WG8_8_1_WGM8
    SolutionIndex: 104
    SolutionNameMin: Cijk_Ailk_Bljk_SB_MT64x64x8_SN_SU32_SUM3_TT4_8_WG16_8_1_WGM8
    SolutionIndex: 105
    SolutionNameMin: Cijk_Ailk_Bljk_SB_MT128x64x8_SN_SU32_SUM3_TT8_8_WG16_8_1_WGM8
    SolutionIndex: 106
    SolutionNameMin: Cijk_Ailk_Bljk_SB_MT128x128x8_SN_SU32_SUM3_TT8_8_WG16_16_1_WGM8
    SolutionIndex: 107
    SolutionNameMin: Cijk_Ailk_Bljk_SB_MT64x64x16_SN_SU32_SUM3_TT8_8_WG8_8_1_WGM8
    SolutionIndex: 108
    SolutionNameMin: Cijk_Ailk_Bljk_SB_MT64x32x16_SN_SU32_SUM3_TT4_4_WG16_8_1_WGM8
    SolutionIndex: 109
    SolutionNameMin: Cijk_Ailk_Bljk_SB_MT64x64x16_SN_SU32_SUM3_TT4_8_WG16_8_1_WGM8
    SolutionIndex: 110
    SolutionNameMin: Cijk_Ailk_Bljk_SB_MT128x64x16_SN_SU32_SUM3_TT8_8_WG16_8_1_WGM8
    SolutionIndex: 111
    SolutionNameMin: Cijk_Ailk_Bljk_SB_MT64x64x16_SN_SU32_SUM3_TT4_4_WG16_16_1_WGM8
    SolutionIndex: 112
    SolutionNameMin: Cijk_Ailk_Bljk_SB_MT64x64x32_SN_SU32_SUM3_TT4_8_WG16_8_1_WGM8
    SolutionIndex: 113
    SolutionNameMin: Cijk_Ailk_Bljk_SB_MT128x64x8_SN_SU0_SUM0_TT8_8_WG16_8_1_WGM1
    SolutionIndex: 114
    SolutionNameMin: Cijk_Ailk_Bljk_SB_MT128x128x8_SN_SU0_SUM0_TT8_8_WG16_16_1_WGM1
    SolutionIndex: 115
    SolutionNameMin: Cijk_Ailk_Bljk_SB_MT128x64x8_SN_SU32_SUM3_TT8_8_WG16_8_1_WGM1
    SolutionIndex: 116
    SolutionNameMin: Cijk_Ailk_Bljk_SB_MT128x64x8_SN_SU0_SUM0_TT8_8_WG16_8_1_WGM4
    SolutionIndex: 117
    SolutionNameMin: Cijk_Ailk_Bljk_SB_MT128x64x8_SN_SU32_SUM3_TT8_8_WG16_8_1_WGM4
    SolutionIndex: 118
    SolutionNameMin: Cijk_Ailk_Bljk_SB_MT128x64x8_SN_SU0_SUM0_TT8_8_WG16_8_1_WGM8
    SolutionIndex: 119
    SolutionNameMin: Cijk_Ailk_Bljk_SB_MT128x128x8_SN_SU0_SUM0_TT8_8_WG16_16_1_WGM8
    SolutionIndex: 120
    SolutionNameMin: Cijk_Ailk_Bljk_SB_MT16x16x8_SN_SU0_SUM0_TT2_2_WG8_8_1_WGM1
    SolutionIndex: 121
    SolutionNameMin: Cijk_Ailk_Bljk_SB_MT32x32x8_SN_SU0_SUM0_TT4_4_WG8_8_1_WGM1
    SolutionIndex: 122
    SolutionNameMin: Cijk_Ailk_Bljk_SB_MT32x16x8_SN_SU0_SUM0_TT2_2_WG16_8_1_WGM1
    SolutionIndex: 123
    SolutionNameMin: Cijk_Ailk_Bljk_SB_MT64x32x8_SN_SU0_SUM0_TT4_4_WG16_8_1_WGM1
    SolutionIndex: 124
    SolutionNameMin: Cijk_Ailk_Bljk_SB_MT32x32x8_SN_SU0_SUM0_TT2_2_WG16_16_1_WGM1
    SolutionIndex: 125
    SolutionNameMin: Cijk_Ailk_Bljk_SB_MT64x64x8_SN_SU0_SUM0_TT4_4_WG16_16_1_WGM1
    SolutionIndex: 126
    SolutionNameMin: Cijk_Ailk_Bljk_SB_MT16x16x16_SN_SU0_SUM0_TT2_2_WG8_8_1_WGM1
    SolutionIndex: 127
    SolutionNameMin: Cijk_Ailk_Bljk_SB_MT32x16x16_SN_SU0_SUM0_TT2_2_WG16_8_1_WGM1
    SolutionIndex: 128
    SolutionNameMin: Cijk_Ailk_Bljk_SB_MT64x32x16_SN_SU0_SUM0_TT4_4_WG16_8_1_WGM1
    SolutionIndex: 129
    SolutionNameMin: Cijk_Ailk_Bljk_SB_MT32x32x16_SN_SU0_SUM0_TT2_2_WG16_16_1_WGM1
    SolutionIndex: 130
    SolutionNameMin: Cijk_Ailk_Bljk_SB_MT16x16x32_SN_SU0_SUM0_TT2_2_WG8_8_1_WGM1
    SolutionIndex: 131
    SolutionNameMin: Cijk_Ailk_Bljk_SB_MT32x16x32_SN_SU0_SUM0_TT2_2_WG16_8_1_WGM1
    SolutionIndex: 132
    SolutionNameMin: Cijk_Ailk_Bljk_SB_MT16x16x8_SN_SU32_SUM3_TT2_2_WG8_8_1_WGM1
    SolutionIndex: 133
    SolutionNameMin: Cijk_Ailk_Bljk_SB_MT32x32x8_SN_SU32_SUM3_TT4_4_WG8_8_1_WGM1
    SolutionIndex: 134
    SolutionNameMin: Cijk_Ailk_Bljk_SB_MT32x16x8_SN_SU32_SUM3_TT2_2_WG16_8_1_WGM1
    SolutionIndex: 135
    SolutionNameMin: Cijk_Ailk_Bljk_SB_MT64x32x8_SN_SU32_SUM3_TT4_4_WG16_8_1_WGM1
    SolutionIndex: 136
    SolutionNameMin: Cijk_Ailk_Bljk_SB_MT32x32x8_SN_SU32_SUM3_TT2_2_WG16_16_1_WGM1
    SolutionIndex: 137
    SolutionNameMin: Cijk_Ailk_Bljk_SB_MT64x64x8_SN_SU32_SUM3_TT4_4_WG16_16_1_WGM1
    SolutionIndex: 138
    SolutionNameMin: Cijk_Ailk_Bljk_SB_MT16x16x16_SN_SU32_SUM3_TT2_2_WG8_8_1_WGM1
    SolutionIndex: 139
    SolutionNameMin: Cijk_Ailk_Bljk_SB_MT32x32x16_SN_SU32_SUM3_TT4_4_WG8_8_1_WGM1
    SolutionIndex: 140
    SolutionNameMin: Cijk_Ailk_Bljk_SB_MT32x16x16_SN_SU32_SUM3_TT2_2_WG16_8_1_WGM1
    SolutionIndex: 141
    SolutionNameMin: Cijk_Ailk_Bljk_SB_MT64x32x16_SN_SU32_SUM3_TT4_4_WG16_8_1_WGM1
    SolutionIndex: 142
    SolutionNameMin: Cijk_Ailk_Bljk_SB_MT64x32x32_SN_SU32_SUM3_TT4_4_WG16_8_1_WGM1
    SolutionIndex: 143
    SolutionNameMin: Cijk_Ailk_Bljk_SB_MT32x16x8_SN_SU0_SUM0_TT2_2_WG16_8_1_WGM4
    SolutionIndex: 144
    SolutionNameMin: Cijk_Ailk_Bljk_SB_MT64x32x8_SN_SU0_SUM0_TT4_4_WG16_8_1_WGM4
    SolutionIndex: 145
    SolutionNameMin: Cijk_Ailk_Bljk_SB_MT32x32x8_SN_SU0_SUM0_TT2_2_WG16_16_1_WGM4
    SolutionIndex: 146
    SolutionNameMin: Cijk_Ailk_Bljk_SB_MT64x64x8_SN_SU0_SUM0_TT4_4_WG16_16_1_WGM4
    SolutionIndex: 147
    SolutionNameMin: Cijk_Ailk_Bljk_SB_MT16x16x16_SN_SU0_SUM0_TT2_2_WG8_8_1_WGM4
    SolutionIndex: 148
    SolutionNameMin: Cijk_Ailk_Bljk_SB_MT32x16x16_SN_SU0_SUM0_TT2_2_WG16_8_1_WGM4
    SolutionIndex: 149
    SolutionNameMin: Cijk_Ailk_Bljk_SB_MT64x32x16_SN_SU0_SUM0_TT4_4_WG16_8_1_WGM4
    SolutionIndex: 150
    SolutionNameMin: Cijk_Ailk_Bljk_SB_MT16x16x8_SN_SU32_SUM3_TT2_2_WG8_8_1_WGM4
    SolutionIndex: 151
    SolutionNameMin: Cijk_Ailk_Bljk_SB_MT32x32x8_SN_SU32_SUM3_TT4_4_WG8_8_1_WGM4
    SolutionIndex: 152
    SolutionNameMin: Cijk_Ailk_Bljk_SB_MT32x16x8_SN_SU32_SUM3_TT2_2_WG16_8_1_WGM4
    SolutionIndex: 153
    SolutionNameMin: Cijk_Ailk_Bljk_SB_MT64x32x8_SN_SU32_SUM3_TT4_4_WG16_8_1_WGM4
    SolutionIndex: 154
    SolutionNameMin: Cijk_Ailk_Bljk_SB_MT64x64x8_SN_SU32_SUM3_TT4_4_WG16_16_1_WGM4
    SolutionIndex: 155
    SolutionNameMin: Cijk_Ailk_Bljk_SB_MT16x16x16_SN_SU32_SUM3_TT2_2_WG8_8_1_WGM4
    SolutionIndex: 156
    SolutionNameMin: Cijk_Ailk_Bljk_SB_MT32x32x16_SN_SU32_SUM3_TT4_4_WG8_8_1_WGM4
    SolutionIndex: 157
    SolutionNameMin: Cijk_Ailk_Bljk_SB_MT32x16x16_SN_SU32_SUM3_TT2_2_WG16_8_1_WGM4
    SolutionIndex: 158
    SolutionNameMin: Cijk_Ailk_Bljk_SB_MT64x32x16_SN_SU32_SUM3_TT4_4_WG16_8_1_WGM4
    SolutionIndex: 159
    SolutionNameMin: Cijk_Ailk_Bljk_SB_MT16x16x8_SN_SU0_SUM0_TT2_2_WG8_8_1_WGM8
    SolutionIndex: 160
    SolutionNameMin: Cijk_Ailk_Bljk_SB_MT32x32x8_SN_SU0_SUM0_TT4_4_WG8_8_1_WGM8
    SolutionIndex: 161
    SolutionNameMin: Cijk_Ailk_Bljk_SB_MT32x16x8_SN_SU0_SUM0_TT2_2_WG16_8_1_WGM8
    SolutionIndex: 162
    SolutionNameMin: Cijk_Ailk_Bljk_SB_MT64x32x8_SN_SU0_SUM0_TT4_4_WG16_8_1_WGM8
    SolutionIndex: 163
    SolutionNameMin: Cijk_Ailk_Bljk_SB_MT64x64x8_SN_SU0_SUM0_TT4_4_WG16_16_1_WGM8
    SolutionIndex: 164
    SolutionNameMin: Cijk_Ailk_Bljk_SB_MT32x16x16_SN_SU0_SUM0_TT2_2_WG16_8_1_WGM8
    SolutionIndex: 165
    SolutionNameMin: Cijk_Ailk_Bljk_SB_MT64x32x16_SN_SU0_SUM0_TT4_4_WG16_8_1_WGM8
    SolutionIndex: 166
    SolutionNameMin: Cijk_Ailk_Bljk_SB_MT16x16x8_SN_SU32_SUM3_TT2_2_WG8_8_1_WGM8
    SolutionIndex: 167
    SolutionNameMin: Cijk_Ailk_Bljk_SB_MT32x16x8_SN_SU32_SUM3_TT2_2_WG16_8_1_WGM8
    SolutionIndex: 168
    SolutionNameMin: Cijk_Ailk_Bljk_SB_MT64x32x8_SN_SU32_SUM3_TT4_4_WG16_8_1_WGM8
    SolutionIndex: 169
    SolutionNameMin: Cijk_Ailk_Bljk_SB_MT64x64x8_SN_SU32_SUM3_TT4_4_WG16_16_1_WGM8
    SolutionIndex: 170
    SolutionNameMin: Cijk_Ailk_Bljk_SB_MT16x16x16_SN_SU32_SUM3_TT2_2_WG8_8_1_WGM8
    SolutionIndex: 171
    SolutionNameMin: Cijk_Ailk_Bljk_SB_MT32x16x16_SN_SU32_SUM3_TT2_2_WG16_8_1_WGM8
    SolutionIndex: 172
    SolutionNameMin: Cijk_Ailk_Bljk_SB_MT64x32x16_SN_SU32_SUM3_TT4_4_WG16_8_1_WGM8
    SolutionIndex: 173
    SolutionNameMin: Cijk_Ailk_Bljk_SB_MT32x8x8_SN_SU0_SUM0_TT2_2_WG16_4_1_WGM1
    SolutionIndex: 174
    SolutionNameMin: Cijk_Ailk_Bljk_SB_MT64x8x8_SN_SU0_SUM0_TT4_2_WG16_4_1_WGM1
    SolutionIndex: 175
    SolutionNameMin: Cijk_Ailk_Bljk_SB_MT32x8x16_SN_SU0_SUM0_TT2_2_WG16_4_1_WGM1
    SolutionIndex: 176
    SolutionNameMin: Cijk_Ailk_Bljk_SB_MT64x4x16_SN_SU0_SUM0_TT4_1_WG16_4_1_WGM1
    SolutionIndex: 177
    SolutionNameMin: Cijk_Ailk_Bljk_SB_MT64x16x16_SN_SU0_SUM0_TT4_2_WG16_8_1_WGM1
    SolutionIndex: 178
    SolutionNameMin: Cijk_Ailk_Bljk_SB_MT64x8x16_SN_SU0_SUM0_TT2_2_WG32_4_1_WGM1
    SolutionIndex: 179
    SolutionNameMin: Cijk_Ailk_Bljk_SB_MT128x8x16_SN_SU0_SUM0_TT4_2_WG32_4_1_WGM1
    SolutionIndex: 180
    SolutionNameMin: Cijk_Ailk_Bljk_SB_MT64x4x32_SN_SU0_SUM0_TT4_1_WG16_4_1_WGM1
    SolutionIndex: 181
    SolutionNameMin: Cijk_Ailk_Bljk_SB_MT64x8x32_SN_SU0_SUM0_TT4_1_WG16_8_1_WGM1
    SolutionIndex: 182
    SolutionNameMin: Cijk_Ailk_Bljk_SB_MT64x8x32_SN_SU0_SUM0_TT2_2_WG32_4_1_WGM1
    SolutionIndex: 183
    SolutionNameMin: Cijk_Ailk_Bljk_SB_MT128x4x32_SN_SU0_SUM0_TT4_1_WG32_4_1_WGM1
    SolutionIndex: 184
    SolutionNameMin: Cijk_Ailk_Bljk_SB_MT64x4x16_SN_SU32_SUM3_TT4_1_WG16_4_1_WGM1
    SolutionIndex: 185
    SolutionNameMin: Cijk_Ailk_Bljk_SB_MT64x16x16_SN_SU32_SUM3_TT4_2_WG16_8_1_WGM1
    SolutionIndex: 186
    SolutionNameMin: Cijk_Ailk_Bljk_SB_MT32x8x8_SN_SU0_SUM0_TT2_2_WG16_4_1_WGM4
    SolutionIndex: 187
    SolutionNameMin: Cijk_Ailk_Bljk_SB_MT64x8x16_SN_SU0_SUM0_TT4_2_WG16_4_1_WGM4
    SolutionIndex: 188
    SolutionNameMin: Cijk_Ailk_Bljk_SB_MT64x8x16_SN_SU0_SUM0_TT2_2_WG32_4_1_WGM4
    SolutionIndex: 189
    SolutionNameMin: Cijk_Ailk_Bljk_SB_MT128x8x16_SN_SU0_SUM0_TT4_2_WG32_4_1_WGM4
    SolutionIndex: 190
    SolutionNameMin: Cijk_Ailk_Bljk_SB_MT64x4x32_SN_SU0_SUM0_TT4_1_WG16_4_1_WGM4
    SolutionIndex: 191
    SolutionNameMin: Cijk_Ailk_Bljk_SB_MT64x8x32_SN_SU0_SUM0_TT2_2_WG32_4_1_WGM4
    SolutionIndex: 192
    SolutionNameMin: Cijk_Ailk_Bljk_SB_MT128x4x32_SN_SU0_SUM0_TT4_1_WG32_4_1_WGM4
    SolutionIndex: 193
    SolutionNameMin: Cijk_Ailk_Bljk_SB_MT64x8x8_SN_SU32_SUM3_TT4_2_WG16_4_1_WGM4
    SolutionIndex: 194
    SolutionNameMin: Cijk_Ailk_Bljk_SB_MT64x16x8_SN_SU32_SUM3_TT4_2_WG16_8_1_WGM4
    SolutionIndex: 195
    SolutionNameMin: Cijk_Ailk_Bljk_SB_MT32x8x16_SN_SU32_SUM3_TT2_2_WG16_4_1_WGM4
    SolutionIndex: 196
    SolutionNameMin: Cijk_Ailk_Bljk_SB_MT64x4x16_SN_SU32_SUM3_TT4_1_WG16_4_1_WGM4
    SolutionIndex: 197
    SolutionNameMin: Cijk_Ailk_Bljk_SB_MT64x16x8_SN_SU0_SUM0_TT4_2_WG16_8_1_WGM8
    SolutionIndex: 198
    SolutionNameMin: Cijk_Ailk_Bljk_SB_MT64x4x16_SN_SU0_SUM0_TT4_1_WG16_4_1_WGM8
    SolutionIndex: 199
    SolutionNameMin: Cijk_Ailk_Bljk_SB_MT64x16x16_SN_SU0_SUM0_TT4_2_WG16_8_1_WGM8
    SolutionIndex: 200
    SolutionNameMin: Cijk_Ailk_Bljk_SB_MT64x8x16_SN_SU0_SUM0_TT2_2_WG32_4_1_WGM8
    SolutionIndex: 201
    SolutionNameMin: Cijk_Ailk_Bljk_SB_MT128x8x16_SN_SU0_SUM0_TT4_2_WG32_4_1_WGM8
    SolutionIndex: 202
    SolutionNameMin: Cijk_Ailk_Bljk_SB_MT64x4x32_SN_SU0_SUM0_TT4_1_WG16_4_1_WGM8
    SolutionIndex: 203
    SolutionNameMin: Cijk_Ailk_Bljk_SB_MT64x8x32_SN_SU0_SUM0_TT4_1_WG16_8_1_WGM8
    SolutionIndex: 204
    SolutionNameMin: Cijk_Ailk_Bljk_SB_MT128x4x32_SN_SU0_SUM0_TT4_1_WG32_4_1_WGM8
    SolutionIndex: 205
    SolutionNameMin: Cijk_Ailk_Bljk_SB_MT64x8x8_SN_SU32_SUM3_TT4_2_WG16_4_1_WGM8
    SolutionIndex: 206
    SolutionNameMin: Cijk_Ailk_Bljk_SB_MT8x32x8_SN_SU32_SUM3_TT1_4_WG8_8_1_WGM1
    SolutionIndex: 207
    SolutionNameMin: Cijk_Ailk_Bljk_SB_MT8x32x8_SN_SU32_SUM3_TT1_4_WG8_8_1_WGM4
    SolutionIndex: 208
    SolutionNameMin: Cijk_Ailk_Bljk_SB_MT8x32x8_SN_SU32_SUM3_TT1_4_WG8_8_1_WGM8
    SolutionIndex: 209
    SolutionNameMin: Cijk_Ailk_Bljk_SB_MT64x32x8_SN_SU0_SUM0_TT4_4_WG16_8_1_WGM1
    SolutionIndex: 210
    SolutionNameMin: Cijk_Ailk_Bljk_SB_MT64x32x16_SN_SU0_SUM0_TT4_4_WG16_8_1_WGM1
    SolutionIndex: 211
    SolutionNameMin: Cijk_Ailk_Bljk_SB_MT32x16x32_SN_SU0_SUM0_TT2_2_WG16_8_1_WGM1
    SolutionIndex: 212
    SolutionNameMin: Cijk_Ailk_Bljk_SB_MT32x16x16_SN_SU32_SUM3_TT2_2_WG16_8_1_WGM1
    SolutionIndex: 213
    SolutionNameMin: Cijk_Ailk_Bljk_SB_MT32x16x32_SN_SU32_SUM3_TT2_2_WG16_8_1_WGM1
    SolutionIndex: 214
    SolutionNameMin: Cijk_Ailk_Bljk_SB_MT32x16x32_SN_SU0_SUM0_TT2_2_WG16_8_1_WGM4
    SolutionIndex: 215
    SolutionNameMin: Cijk_Ailk_Bljk_SB_MT32x16x32_SN_SU32_SUM3_TT2_2_WG16_8_1_WGM4
    SolutionIndex: 216
    SolutionNameMin: Cijk_Ailk_Bljk_SB_MT32x16x32_SN_SU32_SUM3_TT2_2_WG16_8_1_WGM8
    SolutionIndex: 217
    SolutionNameMin: Cijk_Ailk_Bljk_SB_MT64x64x16_SN_SU32_SUM3_SUS128_TT8_8_WG8_8_1_WGM4
    SolutionIndex: 218
    SolutionNameMin: Cijk_Ailk_Bljk_SB_MT64x64x32_SN_SU0_SUM0_SUS0_TT4_8_WG16_8_1_WGM1
    SolutionIndex: 219
    SolutionNameMin: Cijk_Ailk_Bljk_SB_MT64x32x32_SN_SU0_SUM0_SUS0_TT4_4_WG16_8_1_WGM1
    SolutionIndex: 220
    SolutionNameMin: Cijk_Ailk_Bljk_SB_MT64x32x8_SN_SU32_SUM3_SUS128_TT4_4_WG16_8_1_WGM4
    SolutionIndex: 221
    SolutionNameMin: Cijk_Ailk_Bljk_SB_MT64x64x16_SN_SU32_SUM3_SUS128_TT4_8_WG16_8_1_WGM1
    SolutionIndex: 222
    SolutionNameMin: Cijk_Ailk_Bljk_SB_MT64x128x16_SN_SU32_SUM3_SUS128_TT4_8_WG16_16_1_WGM1
    SolutionIndex: 223
    SolutionNameMin: Cijk_Ailk_Bljk_SB_MT64x128x16_SN_SU32_SUM3_SUS128_TT8_16_WG8_8_1_WGM8
    SolutionIndex: 224
    SolutionNameMin: Cijk_Ailk_Bljk_SB_MT64x64x16_SN_SU32_SUM3_SUS128_TT8_8_WG8_8_1_WGM1
    SolutionIndex: 225
    SolutionNameMin: Cijk_Ailk_Bljk_SB_MT64x64x16_SN_SU32_SUM3_SUS128_TT8_8_WG8_8_1_WGM1
    SolutionIndex: 226
    SolutionNameMin: Cijk_Ailk_Bljk_SB_MT64x32x16_SN_SU32_SUM3_SUS128_TT4_4_WG16_8_1_WGM4
    SolutionIndex: 227
    SolutionNameMin: Cijk_Ailk_Bljk_SB_MT64x32x16_SN_SU32_SUM3_SUS128_TT4_4_WG16_8_1_WGM8
    SolutionIndex: 228
    SolutionNameMin: Cijk_Ailk_Bljk_SB_MT64x32x32_SN_SU32_SUM3_SUS128_TT4_8_WG16_4_1_WGM1
    SolutionIndex: 229
    SolutionNameMin: Cijk_Ailk_Bljk_SB_MT32x32x8_SN_SU32_SUM3_SUS128_TT4_4_WG8_8_1_WGM1
    SolutionIndex: 230
    SolutionNameMin: Cijk_Ailk_Bljk_SB_MT64x64x16_SN_SU32_SUM3_SUS128_TT8_8_WG8_8_1_WGM8
    SolutionIndex: 231
    SolutionNameMin: Cijk_Ailk_Bljk_SB_MT64x128x32_SN_SU32_SUM3_SUS128_TT4_8_WG16_16_1_WGM4
    SolutionIndex: 232
    SolutionNameMin: Cijk_Ailk_Bljk_SB_MT64x64x32_SN_SU32_SUM3_SUS128_TT4_8_WG16_8_1_WGM4
    SolutionIndex: 233
    SolutionNameMin: Cijk_Ailk_Bljk_SB_MT64x64x32_SN_SU32_SUM3_SUS128_TT4_8_WG16_8_1_WGM8
    SolutionIndex: 234
    SolutionNameMin: Cijk_Ailk_Bljk_SB_MT64x64x32_SN_SU32_SUM3_SUS128_TT4_8_WG16_8_1_WGM1
    SolutionIndex: 235
    SolutionNameMin: Cijk_Ailk_Bljk_SB_MT64x128x32_SN_SU32_SUM3_SUS128_TT4_8_WG16_16_1_WGM1
    SolutionIndex: 236
    SolutionNameMin: Cijk_Ailk_Bljk_SB_MT64x64x32_SN_SU32_SUM3_SUS128_TT4_8_WG16_8_1_WGM1
    SolutionIndex: 237
    SolutionNameMin: Cijk_Ailk_Bljk_SB_MT16x16x8_SN_SU0_SUM0_SUS0_TT2_2_WG8_8_1_WGM1
    SolutionIndex: 238
    SolutionNameMin: Cijk_Ailk_Bljk_SB_MT32x32x16_SN_SU0_SUM0_SUS0_TT4_4_WG8_8_1_WGM8
    SolutionIndex: 239
    SolutionNameMin: Cijk_Ailk_Bljk_SB_MT64x32x8_SN_SU0_SUM0_SUS0_TT4_8_WG16_4_1_WGM1
    SolutionIndex: 240
    SolutionNameMin: Cijk_Ailk_Bljk_SB_MT128x64x8_SN_SU0_SUM0_SUS0_TT8_8_WG16_8_1_WGM8
    SolutionIndex: 241
    SolutionNameMin: Cijk_Ailk_Bljk_SB_MT128x64x8_SN_SU0_SUM0_SUS0_TT8_8_WG16_8_1_WGM4
    SolutionIndex: 242
    SolutionNameMin: Cijk_Ailk_Bljk_SB_MT128x64x8_SN_SU0_SUM0_SUS0_TT8_8_WG16_8_1_WGM1
    SolutionIndex: 243
    SolutionNameMin: Cijk_Ailk_Bljk_SB_MT128x64x8_SN_SU0_SUM0_SUS0_TT8_8_WG16_8_1_WGM4
    SolutionIndex: 244
    SolutionNameMin: Cijk_Ailk_Bljk_SB_MT128x64x8_SN_SU0_SUM0_SUS0_TT8_8_WG16_8_1_WGM1
    SolutionIndex: 245
    SolutionNameMin: Cijk_Ailk_Bljk_SB_MT128x64x8_SN_SU0_SUM0_SUS0_TT8_8_WG16_8_1_WGM1
    SolutionIndex: 246
    SolutionNameMin: Cijk_Ailk_Bljk_SB_MT64x64x8_SN_SU0_SUM0_SUS0_TT8_8_WG8_8_1_WGM1
    SolutionIndex: 247
    SolutionNameMin: Cijk_Ailk_Bljk_SB_MT128x128x8_SN_SU0_SUM0_SUS0_TT8_8_WG16_16_1_WGM4
    SolutionIndex: 248
    SolutionNameMin: Cijk_Ailk_Bljk_SB_MT128x64x16_SN_SU0_SUM0_SUS0_TT8_8_WG16_8_1_WGM1
    SolutionIndex: 249
    SolutionNameMin: Cijk_Ailk_Bljk_SB_MT128x64x8_SN_SU0_SUM0_SUS0_TT8_8_WG16_8_1_WGM8
    SolutionIndex: 250
    SolutionNameMin: Cijk_Ailk_Bljk_SB_MT128x32x8_SN_SU0_SUM0_SUS0_TT8_8_WG16_4_1_WGM1
    SolutionIndex: 251
    SolutionNameMin: Cijk_Ailk_Bljk_SB_MT128x32x16_SN_SU32_SUM3_SUS128_TT4_8_WG32_4_1_WGM8
    SolutionIndex: 252
    SolutionNameMin: Cijk_Ailk_Bljk_SB_MT128x32x8_SN_SU0_SUM0_SUS0_TT4_8_WG32_4_1_WGM1
    SolutionIndex: 253
    SolutionNameMin: Cijk_Ailk_Bljk_SB_MT128x16x8_SN_SU32_SUM3_SUS128_TT4_4_WG32_4_1_WGM8
    SolutionIndex: 254
    SolutionNameMin: Cijk_Ailk_Bljk_SB_MT128x16x8_SN_SU0_SUM0_SUS0_TT4_4_WG32_4_1_WGM8
    SolutionIndex: 255
    SolutionNameMin: Cijk_Ailk_Bljk_SB_MT128x16x8_SN_SU0_SUM0_SUS0_TT4_4_WG32_4_1_WGM8
    SolutionIndex: 256
    SolutionNameMin: Cijk_Ailk_Bljk_SB_MT128x32x16_SN_SU32_SUM3_SUS128_TT8_8_WG16_4_1_WGM1
    SolutionIndex: 257
    SolutionNameMin: Cijk_Ailk_Bljk_SB_MT64x16x16_SN_SU32_SUM3_SUS128_TT4_4_WG16_4_1_WGM1
    SolutionIndex: 258
    SolutionNameMin: Cijk_Ailk_Bljk_SB_MT64x32x8_SN_SU32_SUM3_SUS128_TT4_8_WG16_4_1_WGM1
    SolutionIndex: 259
    SolutionNameMin: Cijk_Ailk_Bljk_SB_MT128x32x16_SN_SU0_SUM0_SUS0_TT4_8_WG32_4_1_WGM1
    SolutionIndex: 260
    SolutionNameMin: Cijk_Ailk_Bljk_SB_MT256x64x8_SN_SU0_SUM0_SUS0_TT8_16_WG32_4_1_WGM1
    SolutionIndex: 261
    SolutionNameMin: Cijk_Ailk_Bljk_SB_MT256x64x8_SN_SU0_SUM0_SUS0_TT8_16_WG32_4_1_WGM8
    SolutionIndex: 262
    SolutionNameMin: Cijk_Ailk_Bljk_SB_MT256x64x8_SN_SU0_SUM0_SUS0_TT8_16_WG32_4_1_WGM1
    SolutionIndex: 263
    SolutionNameMin: Cijk_Ailk_Bljk_SB_MT256x64x8_SN_SU0_SUM0_SUS0_TT8_16_WG32_4_1_WGM4
    SolutionIndex: 264
    SolutionNameMin: Cijk_Ailk_Bljk_SB_MT256x64x8_SN_SU0_SUM0_SUS0_TT8_16_WG32_4_1_WGM8
    SolutionIndex: 265
    SolutionNameMin: Cijk_Ailk_Bljk_SB_MT256x64x8_SN_SU32_SUM3_SUS128_TT8_16_WG32_4_1_WGM8
    SolutionIndex: 266
    SolutionNameMin: Cijk_Ailk_Bljk_SB_MT32x16x8_SN_SU32_SUM3_SUS128_TT2_2_WG16_8_1_WGM1
    SolutionIndex: 267
    SolutionNameMin: Cijk_Ailk_Bljk_SB_MT64x16x16_SN_SU32_SUM3_SUS128_TT4_4_WG16_4_1_WGM1
    SolutionIndex: 268
    SolutionNameMin: Cijk_Ailk_Bljk_SB_MT128x16x16_SN_SU0_SUM0_SUS0_TT4_4_WG32_4_1_WGM1
    SolutionIndex: 269
    SolutionNameMin: Cijk_Ailk_Bljk_SB_MT128x32x8_SN_SU0_SUM0_SUS0_TT4_8_WG32_4_1_WGM1
    SolutionIndex: 270
    SolutionNameMin: Cijk_Ailk_Bljk_SB_MT128x32x8_SN_SU0_SUM0_SUS0_TT8_8_WG16_4_1_WGM1
    SolutionIndex: 271
    SolutionNameMin: Cijk_Ailk_Bljk_SB_MT256x32x8_SN_SU0_SUM0_SUS0_TT8_8_WG32_4_1_WGM1
    SolutionIndex: 272
    SolutionNameMin: Cijk_Ailk_Bljk_SB_MT128x64x8_SN_SU32_SUM3_SUS128_TT8_8_WG16_8_1_WGM1
    SolutionIndex: 273
    SolutionNameMin: Cijk_Ailk_Bljk_SB_MT128x128x16_SN_SU32_SUM3_SUS128_TT8_8_WG16_16_1_WGM4
    SolutionIndex: 274
    SolutionNameMin: Cijk_Ailk_Bljk_SB_MT128x64x8_SN_SU32_SUM3_SUS128_TT8_8_WG16_8_1_WGM1
    SolutionIndex: 276
    SolutionNameMin: Cijk_Ailk_Bljk_SB_MT256x64x8_SN_SU32_SUM3_SUS128_TT8_16_WG32_4_1_WGM1
    SolutionIndex: 280
    SolutionNameMin: Cijk_Ailk_Bljk_SB_MT256x64x8_SN_SU32_SUM3_SUS128_TT8_16_WG32_4_1_WGM1
    SolutionIndex: 286
    SolutionNameMin: Cijk_Ailk_Bljk_SB_MT128x32x16_SN_SU0_SUM0_SUS0_TT4_8_WG32_4_1_WGM1
    SolutionIndex: 288
    SolutionNameMin: Cijk_Ailk_Bljk_SB_MT128x64x16_SN_SU0_SUM0_SUS0_TT8_8_WG16_8_1_WGM1
    SolutionIndex: 290
    SolutionNameMin: Cijk_Ailk_Bljk_SB_MT256x64x8_SN_SU0_SUM0_SUS0_TT8_16_WG32_4_1_WGM1
    SolutionIndex: 291
    SolutionNameMin: Cijk_Ailk_Bljk_SB_MT256x64x8_SN_SU32_SUM3_SUS128_TT8_16_WG32_4_1_WGM1
    SolutionIndex: 327
    SolutionNameMin: Cijk_Ailk_Bljk_SB_MT64x16x16_SN_SU0_SUM0_SUS0_TT4_4_WG16_4_1_WGM4
- - - [1024, 4096, 1, 1024]
    - [6, 80.733]
  - - [4096, 4096, 1, 1024]
    - [262, 90.843]
  - - [1024, 2048, 1, 1024]
    - [28, 77.191]
  - - [4096, 2048, 1, 1024]
    - [7, 86.359]
  - - [768, 4096, 1, 2]
    - [29, 4.033]
  - - [768, 4096, 1, 768]
    - [35, 81.414]
  - - [3072, 4096, 1, 768]
    - [7, 89.269]
  - - [768, 2048, 1, 2]
    - [6, 3.397]
  - - [768, 2048, 1, 768]
    - [16, 73.825]
  - - [3072, 2048, 1, 768]
    - [1, 87.347]
  - - [3072, 1024, 1, 768]
    - [29, 81.856]
  - - [3072, 512, 1, 768]
    - [31, 73.888]
  - - [1024, 3072, 1, 1024]
    - [35, 81.649]
  - - [3072, 2048, 1, 1024]
    - [23, 87.518]
  - - [3072, 3072, 1, 1024]
    - [23, 91.195]
  - - [3072, 512, 1, 1024]
    - [16, 74.227]
  - - [3072, 4096, 1, 1024]
    - [264, 89.282]
  - - [1024, 2048, 1, 2]
    - [6, 4.061]
  - - [1024, 3072, 1, 2]
    - [6, 4.507]
  - - [1024, 4096, 1, 2]
    - [6, 4.674]
  - - [128, 128, 512, 64]
    - [12, 70.004]
  - - [512, 512, 64, 64]
    - [6, 82.925]
  - - [2944, 4288, 1, 1280]
    - [1, 89.819]
  - - [2368, 5888, 1, 256]
    - [1, 85.348]
  - - [5888, 1856, 1, 256]
    - [29, 84.044]
  - - [512, 24000, 1, 1536]
    - [23, 90.14]
  - - [5888, 1408, 1, 256]
    - [1, 83.133]
  - - [5888, 1856, 1, 3328]
    - [1, 86.075]
  - - [1856, 4288, 1, 256]
    - [22, 81.477]
  - - [1024, 5056, 1, 128]
    - [6, 79.731]
  - - [5056, 5056, 1, 3328]
    - [30, 90.465]
  - - [1408, 5888, 1, 1280]
    - [1, 86.16]
  - - [6144, 6000, 1, 2560]
    - [1, 93.163]
  - - [2368, 6784, 1, 128]
    - [30, 82.831]
  - - [1024, 3584, 1, 3328]
    - [29, 82.019]
  - - [512, 48000, 1, 2048]
    - [39, 91.52]
  - - [5888, 1408, 1, 1280]
    - [1, 86.436]
  - - [1408, 4288, 1, 256]
    - [29, 82.483]
  - - [1024, 2368, 1, 256]
    - [29, 73.704]
  - - [1408, 1856, 1, 1280]
    - [29, 82.199]
  - - [5056, 5056, 1, 1280]
    - [1, 90.135]
  - - [448, 5056, 1, 256]
    - [10, 62.677]
  - - [1856, 1408, 1, 128]
    - [14, 69.481]
  - - [6784, 256, 1, 3328]
    - [31, 83.201]
  - - [1408, 3584, 1, 256]
    - [30, 82.348]
  - - [4288, 448, 1, 256]
    - [6, 71.994]
  - - [1024, 1856, 1, 128]
    - [0, 68.596]
  - - [4288, 2944, 1, 1280]
    - [36, 89.91]
  - - [704, 5056, 1, 1280]
    - [23, 76.379]
  - - [2368, 704, 1, 3328]
    - [0, 78.545]
  - - [256, 5888, 1, 256]
    - [35, 66.349]
  - - [1856, 4288, 1, 3328]
    - [29, 83.634]
  - - [5888, 1024, 1, 256]
    - [14, 82.294]
  - - [1408, 2944, 1, 256]
    - [29, 78.666]
  - - [6784, 5056, 1, 3328]
    - [1, 92.504]
  - - [5056, 5056, 1, 256]
    - [15, 87.424]
  - - [704, 5056, 1, 128]
    - [29, 68.429]
  - - [2368, 2944, 1, 1280]
    - [1, 83.386]
  - - [6784, 6784, 1, 1280]
    - [15, 92.901]
  - - [1408, 4288, 1, 1280]
    - [36, 84.099]
  - - [3584, 4288, 1, 1280]
    - [1, 89.806]
  - - [512, 6000, 1, 2560]
    - [35, 80.426]
  - - [2368, 704, 1, 1280]
    - [14, 77.227]
  - - [5056, 4288, 1, 3328]
    - [1, 90.46]
  - - [3584, 2368, 1, 3328]
    - [36, 88.407]
  - - [5888, 6784, 1, 1280]
    - [30, 93.181]
  - - [6784, 448, 1, 1280]
    - [14, 79.564]
  - - [2944, 5888, 1, 256]
    - [15, 89.314]
  - - [4288, 2944, 1, 256]
    - [1, 86.499]
  - - [5888, 704, 1, 1280]
    - [14, 80.634]
  - - [448, 5888, 1, 128]
    - [29, 63.313]
  - - [5056, 2368, 1, 1280]
    - [1, 85.475]
  - - [448, 3584, 1, 1280]
    - [22, 64.788]
  - - [6784, 5888, 1, 256]
    - [1, 91.367]
  - - [1024, 1408, 1, 256]
    - [29, 70.622]
  - - [2368, 2368, 1, 3328]
    - [0, 82.222]
  - - [1856, 6784, 1, 128]
    - [14, 80.828]
  - - [5056, 704, 1, 3328]
    - [0, 79.677]
  - - [1408, 1856, 1, 256]
    - [29, 79.095]
  - - [2368, 5056, 1, 256]
    - [14, 82.975]
  - - [3584, 2368, 1, 1280]
    - [23, 87.839]
  - - [704, 5888, 1, 256]
    - [23, 73.609]
  - - [6784, 2944, 1, 128]
    - [7, 88.033]
  - - [2944, 6784, 1, 3328]
    - [1, 93.0]
  - - [3584, 704, 1, 3328]
    - [29, 80.196]
  - - [448, 4288, 1, 256]
    - [35, 63.611]
  - - [704, 2368, 1, 1280]
    - [22, 67.464]
  - - [1856, 2368, 1, 1280]
    - [36, 83.192]
  - - [1856, 4288, 1, 1280]
    - [29, 83.332]
  - - [256, 193600, 1, 64]
    - [0, 68.082]
  - - [704, 2944, 1, 128]
    - [6, 62.668]
  - - [1408, 1024, 1, 1280]
    - [29, 79.104]
  - - [704, 6784, 1, 256]
    - [7, 75.192]
  - - [6784, 704, 1, 256]
    - [14, 80.106]
  - - [5056, 1408, 1, 128]
    - [6, 80.137]
  - - [2048, 7000, 1, 2048]
    - [23, 90.212]
  - - [5056, 704, 1, 256]
    - [6, 75.937]
  - - [3584, 4288, 1, 3328]
    - [30, 90.049]
  - - [5888, 1856, 1, 1280]
    - [30, 85.587]
  - - [2368, 3584, 1, 1280]
    - [1, 87.924]
  - - [2944, 3584, 1, 3328]
    - [1, 92.026]
  - - [6784, 2944, 1, 256]
    - [7, 90.262]
  - - [1024, 1500, 1, 2560]
    - [16, 73.198]
  - - [1856, 2368, 1, 256]
    - [15, 78.098]
  - - [3584, 6784, 1, 3328]
    - [30, 92.017]
  - - [1024, 5888, 1, 3328]
    - [7, 85.064]
  - - [6144, 24000, 1, 2560]
    - [1, 94.015]
  - - [5056, 4288, 1, 1280]
    - [1, 90.036]
  - - [2368, 2368, 1, 1280]
    - [14, 81.626]
  - - [2944, 5888, 1, 128]
    - [36, 86.824]
  - - [704, 5888, 1, 1280]
    - [36, 78.901]
  - - [2368, 3584, 1, 128]
    - [14, 80.349]
  - - [1856, 5056, 1, 128]
    - [0, 79.673]
  - - [2944, 6784, 1, 1280]
    - [36, 92.635]
  - - [1024, 5056, 1, 1280]
    - [30, 86.941]
  - - [4288, 1024, 1, 256]
    - [2, 78.265]
  - - [2944, 2368, 1, 128]
    - [29, 82.195]
  - - [5888, 448, 1, 1280]
    - [0, 76.329]
  - - [704, 5888, 1, 3328]
    - [5, 79.763]
  - - [3584, 2944, 1, 256]
    - [36, 88.335]
  - - [1856, 2368, 1, 3328]
    - [36, 84.342]
  - - [512, 6000, 1, 2816]
    - [22, 80.512]
  - - [512, 24000, 1, 2048]
    - [27, 90.031]
  - - [1408, 5056, 1, 3328]
    - [23, 85.407]
  - - [1856, 1856, 1, 3328]
    - [29, 77.241]
  - - [2368, 2368, 1, 256]
    - [14, 80.056]
  - - [4288, 4288, 1, 1280]
    - [23, 88.123]
  - - [5888, 1024, 1, 1280]
    - [1, 84.766]
  - - [1024, 12544, 1, 256]
    - [7, 87.943]
  - - [5888, 448, 1, 128]
    - [29, 70.92]
  - - [512, 48000, 1, 2560]
    - [36, 91.881]
  - - [704, 6784, 1, 3328]
    - [23, 81.707]
  - - [5888, 5888, 1, 1280]
    - [1, 93.23]
  - - [5056, 1024, 1, 1280]
    - [1, 87.347]
  - - [448, 5888, 1, 3328]
    - [22, 69.512]
  - - [1024, 2944, 1, 1280]
    - [29, 79.05]
  - - [5056, 5888, 1, 1280]
    - [1, 90.952]
  - - [4288, 5888, 1, 128]
    - [1, 85.655]
  - - [1408, 3584, 1, 128]
    - [35, 78.296]
  - - [448, 3584, 1, 128]
    - [14, 56.13]
  - - [5888, 2944, 1, 1280]
    - [1, 91.001]
  - - [2368, 5888, 1, 128]
    - [7, 82.447]
  - - [3584, 5888, 1, 256]
    - [7, 90.104]
  - - [2368, 1024, 1, 128]
    - [14, 67.13]
  - - [2368, 704, 1, 128]
    - [14, 64.612]
  - - [3584, 2368, 1, 128]
    - [29, 83.295]
  - - [5056, 704, 1, 128]
    - [0, 74.859]
  - - [5056, 1408, 1, 3328]
    - [1, 85.614]
  - - [6784, 1024, 1, 3328]
    - [1, 90.068]
  - - [6784, 2944, 1, 3328]
    - [1, 93.063]
  - - [1856, 1856, 1, 256]
    - [29, 73.112]
  - - [6784, 2368, 1, 1280]
    - [1, 90.289]
  - - [4288, 3584, 1, 256]
    - [15, 87.36]
  - - [4288, 5888, 1, 1280]
    - [1, 90.835]
  - - [1024, 6000, 1, 1536]
    - [23, 85.696]
  - - [4288, 1856, 1, 1280]
    - [0, 83.557]
  - - [1856, 2944, 1, 3328]
    - [36, 84.676]
  - - [256, 6784, 1, 3328]
    - [8, 82.695]
  - - [512, 3000, 1, 1536]
    - [24, 72.63]
  - - [256, 5056, 1, 128]
    - [29, 61.368]
  - - [5056, 1024, 1, 256]
    - [7, 83.656]
  - - [5056, 1856, 1, 3328]
    - [36, 86.589]
  - - [4288, 1408, 1, 128]
    - [14, 78.211]
  - - [1856, 5888, 1, 3328]
    - [36, 85.962]
  - - [4288, 5056, 1, 256]
    - [15, 87.536]
  - - [4096, 7000, 1, 4096]
    - [1, 92.531]
  - - [5056, 256, 1, 3328]
    - [29, 71.741]
  - - [1024, 3000, 1, 2560]
    - [22, 80.543]
  - - [1024, 5888, 1, 1280]
    - [15, 84.329]
  - - [6784, 2368, 1, 128]
    - [29, 84.956]
  - - [1856, 1024, 1, 1280]
    - [0, 76.731]
  - - [6784, 4288, 1, 1280]
    - [1, 90.708]
  - - [1856, 1856, 1, 1280]
    - [22, 76.532]
  - - [3072, 24000, 1, 1024]
    - [4, 91.859]
  - - [1408, 5056, 1, 1280]
    - [23, 84.748]
  - - [5888, 1856, 1, 128]
    - [35, 83.129]
  - - [448, 6784, 1, 128]
    - [6, 65.835]
  - - [5056, 3584, 1, 128]
    - [1, 84.487]
  - - [5888, 5888, 1, 3328]
    - [1, 93.542]
  - - [6784, 1024, 1, 256]
    - [30, 85.484]
  - - [2944, 2368, 1, 256]
    - [29, 83.769]
  - - [5056, 5888, 1, 3328]
    - [30, 91.304]
  - - [1856, 1024, 1, 256]
    - [29, 69.688]
  - - [512, 48000, 1, 1536]
    - [23, 91.597]
  - - [3584, 448, 1, 1280]
    - [29, 74.813]
  - - [448, 5888, 1, 256]
    - [22, 65.916]
  - - [1408, 6784, 1, 3328]
    - [23, 88.082]
  - - [4288, 704, 1, 128]
    - [29, 70.067]
  - - [5056, 2944, 1, 256]
    - [15, 87.681]
  - - [6784, 5888, 1, 128]
    - [1, 88.804]
  - - [2944, 704, 1, 128]
    - [29, 66.494]
  - - [1408, 3584, 1, 3328]
    - [23, 86.679]
  - - [2368, 6784, 1, 256]
    - [30, 86.269]
  - - [5056, 1408, 1, 1280]
    - [1, 84.978]
  - - [5056, 4288, 1, 128]
    - [30, 85.078]
  - - [4288, 2368, 1, 3328]
    - [1, 88.574]
  - - [1408, 1856, 1, 128]
    - [6, 72.977]
  - - [1408, 5888, 1, 3328]
    - [23, 86.815]
  - - [6784, 6784, 1, 256]
    - [1, 91.01]
  - - [5888, 5056, 1, 128]
    - [35, 85.89]
  - - [4288, 2368, 1, 128]
    - [35, 81.085]
  - - [2368, 2944, 1, 256]
    - [29, 79.993]
  - - [3584, 1856, 1, 1280]
    - [1, 85.47]
  - - [6784, 6784, 1, 128]
    - [1, 88.782]
  - - [5888, 5056, 1, 256]
    - [7, 88.534]
  - - [8448, 48000, 1, 2816]
    - [1, 94.381]
  - - [512, 6000, 1, 2048]
    - [35, 80.196]
  - - [3584, 448, 1, 256]
    - [35, 70.193]
  - - [448, 4288, 1, 128]
    - [29, 59.708]
  - - [256, 6784, 1, 256]
    - [35, 75.409]
  - - [1408, 4288, 1, 128]
    - [29, 80.823]
  - - [2944, 704, 1, 3328]
    - [21, 78.233]
  - - [3584, 3584, 1, 256]
    - [36, 88.552]
  - - [3584, 5056, 1, 256]
    - [30, 87.212]
  - - [2944, 2368, 1, 1280]
    - [0, 85.096]
  - - [704, 6784, 1, 128]
    - [29, 72.621]
  - - [6784, 3584, 1, 256]
    - [15, 90.18]
  - - [1856, 1408, 1, 256]
    - [2, 71.321]
  - - [5056, 2368, 1, 128]
    - [29, 82.195]
  - - [2944, 2944, 1, 3328]
    - [36, 90.379]
  - - [5056, 6784, 1, 256]
    - [1, 89.486]
  - - [1856, 3584, 1, 128]
    - [6, 77.417]
  - - [3584, 6784, 1, 128]
    - [7, 87.618]
  - - [2368, 6784, 1, 1280]
    - [36, 90.248]
  - - [5056, 1856, 1, 256]
    - [15, 83.052]
  - - [1024, 3000, 1, 2816]
    - [29, 80.715]
  - - [1024, 1856, 1, 256]
    - [29, 71.876]
  - - [1408, 6784, 1, 1280]
    - [7, 87.938]
  - - [3584, 3584, 1, 1280]
    - [1, 91.457]
  - - [7680, 24000, 1, 2560]
    - [1, 93.939]
  - - [4608, 48000, 1, 1536]
    - [23, 93.961]
  - - [5888, 5888, 1, 128]
    - [36, 88.019]
  - - [5056, 2368, 1, 3328]
    - [23, 85.804]
  - - [2944, 4288, 1, 256]
    - [30, 86.093]
  - - [1408, 3584, 1, 1280]
    - [23, 85.984]
  - - [1024, 1500, 1, 2816]
    - [7, 73.194]
  - - [1024, 6000, 1, 2048]
    - [7, 86.323]
  - - [512, 24000, 1, 2560]
    - [7, 90.374]
  - - [6144, 3000, 1, 2560]
    - [1, 90.704]
  - - [2368, 6784, 1, 3328]
    - [1, 90.492]
  - - [1856, 1408, 1, 1280]
    - [30, 76.122]
  - - [6784, 704, 1, 128]
    - [14, 78.581]
  - - [5056, 2944, 1, 128]
    - [1, 84.342]
  - - [1408, 5888, 1, 256]
    - [15, 83.819]
  - - [704, 2944, 1, 1280]
    - [17, 75.382]
  - - [3584, 704, 1, 1280]
    - [29, 79.564]
  - - [5888, 2368, 1, 256]
    - [36, 85.24]
  - - [2944, 6784, 1, 128]
    - [36, 88.1]
  - - [3584, 448, 1, 3328]
    - [29, 75.734]
  - - [704, 2368, 1, 3328]
    - [6, 68.064]
  - - [4608, 6000, 1, 1536]
    - [1, 91.448]
  - - [256, 5888, 1, 128]
    - [29, 58.58]
  - - [2944, 2944, 1, 1280]
    - [1, 89.937]
  - - [5056, 448, 1, 3328]
    - [14, 81.067]
  - - [6784, 704, 1, 3328]
    - [29, 82.195]
  - - [5888, 4288, 1, 128]
    - [0, 85.808]
  - - [1408, 2944, 1, 3328]
    - [29, 80.927]
  - - [3584, 704, 1, 128]
    - [29, 72.567]
  - - [448, 5056, 1, 128]
    - [14, 59.785]
  - - [5056, 3584, 1, 256]
    - [1, 87.234]
  - - [4288, 4288, 1, 256]
    - [7, 85.957]
  - - [1408, 5056, 1, 128]
    - [29, 80.99]
  - - [2944, 3584, 1, 128]
    - [1, 85.556]
  - - [3584, 2368, 1, 256]
    - [29, 84.622]
  - - [5888, 5056, 1, 1280]
    - [1, 90.965]
  - - [8448, 24000, 1, 2816]
    - [1, 94.101]
  - - [3584, 3584, 1, 3328]
    - [1, 91.899]
  - - [3072, 1500, 1, 128]
    - [35, 77.493]
  - - [2048, 3136, 1, 512]
    - [29, 84.672]
  - - [3025, 256, 64, 64]
    - [0, 54.7]
  - - [5888, 6784, 1, 256]
    - [1, 90.23]
  - - [4288, 2944, 1, 3328]
    - [1, 90.424]
  - - [256, 5056, 1, 1280]
    - [35, 71.163]
  - - [2944, 5888, 1, 3328]
    - [15, 91.371]
  - - [6784, 5888, 1, 1280]
    - [15, 93.433]
  - - [5888, 4288, 1, 1280]
    - [1, 90.65]
  - - [1024, 24000, 1, 2048]
    - [23, 91.173]
  - - [5888, 3584, 1, 128]
    - [30, 86.639]
  - - [6784, 6784, 1, 3328]
    - [1, 93.176]
  - - [704, 3584, 1, 128]
    - [14, 63.462]
  - - [5888, 448, 1, 3328]
    - [29, 76.415]
  - - [2368, 4288, 1, 1280]
    - [36, 87.794]
  - - [4288, 2944, 1, 128]
    - [1, 83.277]
  - - [5056, 2944, 1, 3328]
    - [1, 90.478]
  - - [2944, 3584, 1, 256]
    - [15, 87.875]
  - - [1408, 1408, 1, 3328]
    - [29, 80.877]
  - - [3584, 3584, 1, 128]
    - [1, 85.479]
  - - [3584, 704, 1, 256]
    - [14, 76.65]
  - - [3584, 1408, 1, 3328]
    - [1, 86.652]
  - - [704, 3584, 1, 1280]
    - [23, 73.69]
  - - [1024, 1408, 1, 128]
    - [0, 67.473]
  - - [1856, 6784, 1, 256]
    - [1, 83.53]
  - - [4288, 448, 1, 3328]
    - [0, 78.423]
  - - [6784, 4288, 1, 128]
    - [30, 86.178]
  - - [6784, 704, 1, 1280]
    - [29, 81.847]
  - - [3584, 6784, 1, 256]
    - [36, 89.526]
  - - [5888, 1024, 1, 3328]
    - [1, 85.217]
  - - [704, 6784, 1, 1280]
    - [36, 81.13]
  - - [1856, 5056, 1, 3328]
    - [23, 86.557]
  - - [1024, 3584, 1, 128]
    - [35, 75.053]
  - - [2368, 2944, 1, 128]
    - [6, 78.233]
  - - [5888, 2944, 1, 3328]
    - [1, 91.448]
  - - [1408, 2368, 1, 128]
    - [29, 74.457]
  - - [5888, 2368, 1, 128]
    - [29, 84.225]
  - - [3584, 6784, 1, 1280]
    - [1, 91.782]
  - - [4288, 1856, 1, 256]
    - [6, 81.752]
  - - [1856, 5888, 1, 256]
    - [1, 83.214]
  - - [4288, 4288, 1, 3328]
    - [1, 88.497]
  - - [4288, 1408, 1, 1280]
    - [7, 84.184]
  - - [3584, 5056, 1, 128]
    - [0, 84.915]
  - - [4288, 2368, 1, 256]
    - [30, 84.667]
  - - [2944, 5056, 1, 1280]
    - [1, 90.027]
  - - [448, 6784, 1, 256]
    - [16, 69.318]
  - - [1856, 2368, 1, 128]
    - [0, 75.72]
  - - [6784, 2368, 1, 3328]
    - [1, 90.677]
  - - [1408, 6784, 1, 128]
    - [29, 82.28]
  - - [4288, 1856, 1, 3328]
    - [14, 83.679]
  - - [3584, 448, 1, 128]
    - [29, 66.232]
  - - [3584, 1024, 1, 1280]
    - [0, 81.635]
  - - [1856, 5056, 1, 256]
    - [15, 82.574]
  - - [6784, 4288, 1, 3328]
    - [1, 91.078]
  - - [1024, 4288, 1, 256]
    - [29, 81.955]
  - - [5888, 3584, 1, 3328]
    - [1, 92.693]
  - - [5056, 3584, 1, 3328]
    - [1, 89.612]
  - - [2368, 1408, 1, 1280]
    - [30, 81.955]
  - - [5056, 2944, 1, 1280]
    - [1, 89.874]
  - - [8448, 6000, 1, 2816]
    - [1, 93.131]
  - - [3584, 2944, 1, 1280]
    - [1, 91.331]
  - - [1024, 6784, 1, 256]
    - [11, 84.617]
  - - [6784, 448, 1, 256]
    - [14, 77.114]
  - - [5124, 9124, 1, 2048]
    - [23, 90.298]
  - - [2944, 5056, 1, 3328]
    - [30, 90.266]
  - - [2944, 1408, 1, 128]
    - [29, 75.612]
  - - [5056, 6784, 1, 3328]
    - [1, 92.508]
  - - [704, 2368, 1, 128]
    - [14, 57.236]
  - - [3072, 1500, 1, 1024]
    - [23, 86.084]
  - - [3584, 4288, 1, 256]
    - [30, 86.594]
  - - [1856, 6784, 1, 3328]
    - [1, 86.539]
  - - [5888, 4288, 1, 256]
    - [30, 88.182]
  - - [5056, 1408, 1, 256]
    - [7, 81.536]
  - - [3584, 1024, 1, 256]
    - [29, 79.379]
  - - [512, 6000, 1, 1536]
    - [35, 79.79]
  - - [5888, 5888, 1, 256]
    - [1, 90.699]
  - - [4288, 1024, 1, 1280]
    - [1, 82.871]
  - - [448, 6784, 1, 3328]
    - [21, 76.911]
  - - [2944, 1408, 1, 1280]
    - [14, 80.507]
  - - [3072, 6000, 1, 1024]
    - [7, 90.437]
  - - [2944, 1856, 1, 3328]
    - [36, 84.595]
  - - [3584, 5888, 1, 1280]
    - [36, 92.4]
  - - [6784, 1856, 1, 1280]
    - [35, 86.3]
  - - [2944, 5056, 1, 256]
    - [15, 86.986]
  - - [5888, 256, 1, 3328]
    - [1, 72.643]
  - - [2944, 4288, 1, 128]
    - [29, 84.653]
  - - [3584, 1408, 1, 256]
    - [1, 82.158]
  - - [704, 3584, 1, 3328]
    - [23, 75.508]
  - - [5056, 448, 1, 1280]
    - [29, 79.997]
  - - [3584, 1856, 1, 3328]
    - [36, 86.323]
  - - [4288, 6784, 1, 1280]
    - [1, 90.645]
  - - [1024, 3000, 1, 2048]
    - [22, 80.209]
  - - [2944, 1024, 1, 256]
    - [14, 76.559]
  - - [2368, 4288, 1, 3328]
    - [1, 88.506]
  - - [1024, 1408, 1, 1280]
    - [35, 78.066]
  - - [6784, 5056, 1, 256]
    - [1, 89.738]
  - - [1856, 1856, 1, 128]
    - [6, 70.645]
  - - [4288, 5888, 1, 256]
    - [7, 88.962]
  - - [2944, 6784, 1, 256]
    - [1, 90.541]
  - - [2944, 2944, 1, 128]
    - [7, 83.53]
  - - [1856, 3584, 1, 1280]
    - [36, 85.448]
  - - [3584, 1408, 1, 1280]
    - [1, 85.93]
  - - [4288, 448, 1, 128]
    - [6, 66.349]
  - - [5056, 256, 1, 1280]
    - [29, 70.771]
  - - [1856, 1408, 1, 3328]
    - [15, 78.202]
  - - [1024, 4288, 1, 3328]
    - [29, 85.285]
  - - [5056, 448, 1, 256]
    - [0, 75.219]
  - - [2944, 2368, 1, 3328]
    - [29, 85.452]
  - - [704, 4288, 1, 3328]
    - [21, 76.767]
  - - [1024, 1856, 1, 1280]
    - [29, 76.934]
  - - [6784, 1856, 1, 256]
    - [29, 85.402]
  - - [512, 48000, 1, 2816]
    - [23, 92.179]
  - - [512, 3000, 1, 2816]
    - [37, 73.216]
  - - [1024, 5888, 1, 256]
    - [29, 82.064]
  - - [6784, 1408, 1, 256]
    - [7, 85.614]
  - - [1408, 2368, 1, 256]
    - [29, 78.017]
  - - [1408, 1408, 1, 256]
    - [29, 75.82]
  - - [2368, 2368, 1, 128]
    - [29, 76.884]
  - - [6784, 1408, 1, 128]
    - [14, 83.002]
  - - [1408, 5056, 1, 256]
    - [29, 82.371]
  - - [512, 50176, 1, 128]
    - [1, 87.591]
  - - [4288, 3584, 1, 128]
    - [14, 83.647]
  - - [3584, 5056, 1, 1280]
    - [7, 89.386]
  - - [1856, 1024, 1, 128]
    - [29, 64.486]
  - - [1024, 24000, 1, 1536]
    - [7, 91.371]
  - - [704, 4288, 1, 256]
    - [29, 68.745]
  - - [5888, 2368, 1, 1280]
    - [1, 87.952]
  - - [6784, 1856, 1, 3328]
    - [29, 86.607]
  - - [2368, 5888, 1, 1280]
    - [15, 87.708]
  - - [5888, 256, 1, 1280]
    - [1, 71.845]
  - - [2368, 1856, 1, 3328]
    - [1, 84.347]
  - - [2944, 704, 1, 256]
    - [14, 71.245]
  - - [2368, 1024, 1, 3328]
    - [0, 77.047]
  - - [704, 3584, 1, 256]
    - [36, 68.926]
  - - [704, 2944, 1, 3328]
    - [5, 77.547]
  - - [6784, 1024, 1, 128]
    - [23, 82.276]
  - - [2944, 1024, 1, 3328]
    - [14, 79.492]
  - - [2944, 5056, 1, 128]
    - [0, 84.658]
  - - [1408, 6784, 1, 256]
    - [15, 85.614]
  - - [6784, 1408, 1, 3328]
    - [1, 88.227]
  - - [4288, 6784, 1, 128]
    - [7, 85.93]
  - - [1408, 2944, 1, 128]
    - [35, 75.752]
  - - [6784, 2944, 1, 1280]
    - [1, 92.707]
  - - [4288, 1856, 1, 128]
    - [14, 79.298]
  - - [1856, 2944, 1, 128]
    - [0, 76.108]
  - - [6784, 448, 1, 128]
    - [29, 74.561]
  - - [448, 5056, 1, 1280]
    - [35, 70.875]
  - - [4288, 5056, 1, 1280]
    - [1, 90.108]
  - - [2368, 1856, 1, 128]
    - [14, 74.561]
  - - [4288, 704, 1, 256]
    - [6, 75.404]
  - - [5888, 704, 1, 256]
    - [29, 78.639]
  - - [3584, 1024, 1, 128]
    - [0, 76.79]
  - - [256, 5888, 1, 3328]
    - [23, 72.386]
  - - [1408, 4288, 1, 3328]
    - [23, 85.353]
  - - [6784, 4288, 1, 256]
    - [7, 88.466]
  - - [5888, 256, 1, 256]
    - [35, 65.794]
  - - [6784, 1024, 1, 1280]
    - [36, 89.558]
  - - [5888, 1024, 1, 128]
    - [29, 80.823]
  - - [6784, 3584, 1, 1280]
    - [1, 91.768]
  - - [1024, 6784, 1, 1280]
    - [23, 88.768]
  - - [1408, 2944, 1, 1280]
    - [0, 80.584]
  - - [1408, 2368, 1, 3328]
    - [36, 84.193]
  - - [2944, 1856, 1, 128]
    - [29, 80.417]
  - - [256, 6784, 1, 128]
    - [0, 69.841]
  - - [5056, 6784, 1, 128]
    - [15, 86.445]
  - - [4288, 5056, 1, 128]
    - [23, 84.017]
  - - [1856, 5888, 1, 128]
    - [0, 80.128]
  - - [3584, 1856, 1, 256]
    - [29, 83.201]
  - - [4288, 3584, 1, 1280]
    - [15, 89.666]
  - - [704, 5888, 1, 128]
    - [14, 70.365]
  - - [6784, 3584, 1, 128]
    - [36, 87.834]
  - - [5124, 1500, 1, 2048]
    - [23, 85.249]
  - - [4288, 5056, 1, 3328]
    - [1, 90.469]
  - - [1408, 1408, 1, 128]
    - [29, 68.885]
  - - [5056, 2368, 1, 256]
    - [14, 83.313]
  - - [4288, 704, 1, 3328]
    - [29, 79.447]
  - - [448, 3584, 1, 256]
    - [22, 60.525]
  - - [2368, 1024, 1, 1280]
    - [14, 76.248]
  - - [2944, 1408, 1, 3328]
    - [29, 80.891]
  - - [6144, 1500, 1, 2560]
    - [23, 89.937]
  - - [1024, 1408, 1, 3328]
    - [29, 79.939]
  - - [2944, 5888, 1, 1280]
    - [30, 91.051]
  - - [5888, 3584, 1, 256]
    - [36, 89.905]
  - - [2368, 5056, 1, 128]
    - [14, 81.707]
  - - [1408, 1856, 1, 3328]
    - [29, 82.831]
  - - [5888, 5056, 1, 3328]
    - [1, 91.389]
  - - [7680, 6000, 1, 2560]
    - [23, 92.982]
  - - [6784, 1408, 1, 1280]
    - [1, 87.852]
  - - [512, 3000, 1, 2560]
    - [36, 73.216]
  - - [704, 2944, 1, 256]
    - [8, 69.228]
  - - [6784, 5888, 1, 3328]
    - [1, 93.758]
  - - [2368, 4288, 1, 128]
    - [29, 80.394]
  - - [1024, 6784, 1, 128]
    - [7, 81.807]
  - - [1024, 1500, 1, 1536]
    - [7, 72.106]
  - - [1408, 1408, 1, 1280]
    - [29, 79.781]
  - - [3072, 3000, 1, 1024]
    - [23, 88.728]
  - - [448, 4288, 1, 3328]
    - [34, 72.215]
  - - [2368, 1408, 1, 256]
    - [14, 77.141]
  - - [704, 2368, 1, 256]
    - [22, 63.34]
  - - [1024, 24000, 1, 2560]
    - [23, 91.935]
  - - [5888, 2368, 1, 3328]
    - [30, 88.168]
  - - [5124, 9124, 1, 1760]
    - [15, 90.884]
  - - [4288, 448, 1, 1280]
    - [14, 76.965]
  - - [5888, 704, 1, 3328]
    - [29, 80.949]
  - - [5056, 256, 1, 128]
    - [6, 56.541]
  - - [1024, 6784, 1, 3328]
    - [36, 89.458]
  - - [1408, 5888, 1, 128]
    - [35, 81.202]
  - - [512, 3136, 1, 2048]
    - [24, 76.045]
  - - [1408, 1024, 1, 256]
    - [14, 73.685]
  - - [8448, 1500, 1, 2816]
    - [1, 90.465]
  - - [2560, 7000, 1, 2560]
    - [23, 91.168]
  - - [5056, 6784, 1, 1280]
    - [1, 92.017]
  - - [704, 5056, 1, 3328]
    - [23, 77.566]
  - - [3584, 5056, 1, 3328]
    - [36, 89.54]
  - - [2368, 2944, 1, 3328]
    - [1, 83.53]
  - - [2368, 3584, 1, 256]
    - [1, 84.342]
  - - [4608, 3000, 1, 1536]
    - [36, 90.437]
  - - [5056, 3584, 1, 1280]
    - [1, 89.409]
  - - [5124, 9124, 1, 4096]
    - [7, 90.474]
  - - [7680, 48000, 1, 2560]
    - [1, 94.281]
  - - [1856, 2944, 1, 1280]
    - [36, 83.336]
  - - [4608, 1500, 1, 1536]
    - [36, 88.66]
  - - [1024, 48000, 1, 2816]
    - [15, 93.09]
  - - [5124, 9124, 1, 2560]
    - [1, 90.604]
  - - [2944, 1408, 1, 256]
    - [14, 78.179]
  - - [4288, 1408, 1, 3328]
    - [1, 85.466]
  - - [5888, 2944, 1, 128]
    - [36, 85.84]
  - - [2944, 1024, 1, 128]
    - [14, 73.834]
  - - [5124, 700, 1, 2048]
    - [29, 79.578]
  - - [6784, 5056, 1, 128]
    - [1, 86.621]
  - - [256, 12544, 1, 1024]
    - [22, 82.894]
  - - [5888, 1408, 1, 3328]
    - [1, 86.882]
  - - [2368, 1856, 1, 256]
    - [14, 77.547]
  - - [256, 5056, 1, 256]
    - [35, 66.268]
  - - [5056, 5056, 1, 128]
    - [23, 85.087]
  - - [448, 3584, 1, 3328]
    - [22, 65.411]
  - - [5888, 256, 1, 128]
    - [6, 62.447]
  - - [3584, 1856, 1, 128]
    - [29, 81.491]
  - - [4288, 4288, 1, 128]
    - [0, 83.571]
  - - [1856, 1024, 1, 3328]
    - [14, 77.363]
  - - [1856, 4288, 1, 128]
    - [6, 78.486]
  - - [1024, 6000, 1, 2560]
    - [7, 86.476]
  - - [1024, 5056, 1, 256]
    - [29, 81.915]
  - - [5056, 5888, 1, 128]
    - [15, 86.49]
  - - [2368, 1408, 1, 3328]
    - [36, 83.914]
  - - [1024, 48000, 1, 1536]
    - [23, 92.626]
  - - [5888, 448, 1, 256]
    - [14, 72.508]
  - - [5888, 6784, 1, 128]
    - [1, 87.365]
  - - [6784, 5056, 1, 1280]
    - [15, 91.976]
  - - [5056, 704, 1, 1280]
    - [6, 78.838]
  - - [1024, 48000, 1, 2560]
    - [23, 93.0]
  - - [1024, 2368, 1, 128]
    - [29, 68.511]
  - - [3072, 48000, 1, 1024]
    - [27, 92.59]
  - - [1024, 5888, 1, 128]
    - [29, 79.605]
  - - [3584, 5888, 1, 128]
    - [7, 87.739]
  - - [5056, 5888, 1, 256]
    - [36, 88.867]
  - - [2368, 1024, 1, 256]
    - [0, 71.19]
  - - [2944, 1856, 1, 256]
    - [29, 82.366]
  - - [1856, 6784, 1, 1280]
    - [15, 86.165]
  - - [8448, 3000, 1, 2816]
    - [1, 91.398]
  - - [6784, 448, 1, 3328]
    - [0, 79.93]
  - - [5056, 1856, 1, 1280]
    - [23, 85.799]
  - - [1408, 1024, 1, 3328]
    - [14, 80.187]
  - - [7680, 1500, 1, 2560]
    - [36, 90.203]
  - - [5888, 3584, 1, 1280]
    - [23, 92.387]
  - - [1856, 3584, 1, 3328]
    - [36, 86.255]
  - - [1024, 2944, 1, 256]
    - [29, 75.991]
  - - [448, 6784, 1, 1280]
    - [21, 75.219]
  - - [704, 5056, 1, 256]
    - [6, 71.15]
  - - [3584, 1024, 1, 3328]
    - [14, 82.023]
  - - [2944, 1856, 1, 1280]
    - [14, 83.95]
  - - [5056, 256, 1, 256]
    - [0, 64.215]
  - - [2944, 4288, 1, 3328]
    - [30, 90.225]
  - - [2368, 3584, 1, 3328]
    - [36, 88.601]
  - - [2944, 704, 1, 1280]
    - [34, 76.14]
  - - [2944, 3584, 1, 1280]
    - [1, 91.57]
  - - [1856, 5888, 1, 1280]
    - [1, 85.682]
  - - [4608, 24000, 1, 1536]
    - [1, 93.623]
  - - [4288, 1408, 1, 256]
    - [6, 81.635]
  - - [5888, 1408, 1, 128]
    - [14, 81.59]
  - - [4288, 2368, 1, 1280]
    - [23, 88.042]
  - - [6784, 2368, 1, 256]
    - [1, 87.347]
  - - [1024, 24000, 1, 2816]
    - [30, 92.265]
  - - [1856, 2944, 1, 256]
    - [1, 78.184]
  - - [5056, 1024, 1, 128]
    - [6, 79.817]
  - - [7680, 3000, 1, 2560]
    - [1, 91.119]
  - - [4224, 1500, 1, 176]
    - [29, 80.99]
  - - [5124, 700, 1, 2560]
    - [14, 79.876]
  - - [6784, 256, 1, 128]
    - [29, 70.73]
  - - [5888, 704, 1, 128]
    - [14, 76.92]
  - - [1024, 4288, 1, 1280]
    - [29, 84.699]
  - - [2368, 5056, 1, 3328]
    - [36, 85.718]
  - - [4288, 1024, 1, 3328]
    - [1, 84.288]
  - - [6144, 48000, 1, 2560]
    - [1, 94.214]
  - - [1024, 5056, 1, 3328]
    - [23, 88.371]
  - - [1024, 1856, 1, 3328]
    - [29, 77.633]
  - - [5124, 1500, 1, 2560]
    - [36, 85.344]
  - - [4288, 6784, 1, 256]
    - [7, 88.43]
  - - [3584, 2944, 1, 3328]
    - [23, 91.895]
  - - [5888, 2944, 1, 256]
    - [30, 88.308]
  - - [448, 4288, 1, 1280]
    - [34, 70.117]
  - - [1024, 4288, 1, 128]
    - [0, 79.839]
  - - [5056, 4288, 1, 256]
    - [23, 87.825]
  - - [1024, 3584, 1, 256]
    - [29, 78.82]
  - - [448, 5888, 1, 1280]
    - [22, 68.844]
  - - [512, 3000, 1, 2048]
    - [8, 72.806]
  - - [5056, 448, 1, 128]
    - [6, 69.878]
  - - [4288, 704, 1, 1280]
    - [22, 78.495]
  - - [3584, 2944, 1, 128]
    - [1, 84.726]
  - - [6784, 256, 1, 1280]
    - [31, 82.249]
  - - [2368, 5888, 1, 3328]
    - [1, 88.046]
  - - [2368, 1856, 1, 1280]
    - [23, 82.826]
  - - [448, 5056, 1, 3328]
    - [35, 71.592]
  - - [3584, 4288, 1, 128]
    - [29, 84.365]
  - - [1024, 6000, 1, 2816]
    - [23, 86.508]
  - - [5888, 4288, 1, 3328]
    - [15, 91.015]
  - - [2368, 704, 1, 256]
    - [14, 69.611]
  - - [3584, 1408, 1, 128]
    - [0, 78.549]
  - - [1856, 5056, 1, 1280]
    - [36, 86.016]
  - - [2944, 1024, 1, 1280]
    - [29, 78.897]
  - - [3584, 5888, 1, 3328]
    - [1, 92.815]
  - - [2368, 4288, 1, 256]
    - [15, 83.462]
  - - [1024, 2368, 1, 3328]
    - [29, 77.087]
  - - [1024, 2944, 1, 128]
    - [14, 73.519]
  - - [1024, 3584, 1, 1280]
    - [29, 81.567]
  - - [4288, 5888, 1, 3328]
    - [1, 91.146]
  - - [1024, 2944, 1, 3328]
    - [29, 79.42]
  - - [256, 6784, 1, 1280]
    - [8, 81.013]
  - - [1856, 3584, 1, 256]
    - [30, 81.716]
  - - [6784, 1856, 1, 128]
    - [29, 84.608]
  - - [1024, 1500, 1, 2048]
    - [7, 72.684]
  - - [512, 24000, 1, 2816]
    - [23, 91.105]
  - - [256, 5888, 1, 1280]
    - [37, 70.92]
  - - [4288, 6784, 1, 3328]
    - [1, 90.983]
  - - [2368, 1408, 1, 128]
    - [14, 72.77]
  - - [1408, 1024, 1, 128]
    - [0, 68.028]
  - - [6784, 3584, 1, 3328]
    - [36, 92.003]
  - - [1760, 7000, 1, 1760]
    - [15, 88.29]
  - - [2368, 5056, 1, 1280]
    - [36, 85.434]
  - - [1408, 2368, 1, 1280]
    - [36, 82.7]
  - - [704, 4288, 1, 128]
    - [6, 66.083]
  - - [2944, 2944, 1, 256]
    - [15, 87.23]
  - - [6784, 256, 1, 256]
    - [14, 76.559]
  - - [256, 5056, 1, 3328]
    - [22, 72.066]
  - - [5056, 1856, 1, 128]
    - [14, 81.441]
  - - [1024, 3000, 1, 1536]
    - [35, 80.16]
  - - [5056, 1024, 1, 3328]
    - [1, 88.75]
  - - [4288, 3584, 1, 3328]
    - [15, 89.991]
  - - [1024, 2368, 1, 1280]
    - [29, 76.406]
  - - [5888, 6784, 1, 3328]
    - [1, 93.699]
  - - [704, 4288, 1, 1280]
    - [7, 74.493]
  - - [128, 50176, 1, 512]
    - [7, 86.508]
  - - [1024, 48000, 1, 2048]
    - [27, 92.089]
  - - [4288, 1024, 1, 128]
    - [22, 74.231]
  - - [784, 128, 128, 512]
    - [39, 70.708]
  - - [784, 512, 256, 128]
    - [0, 71.375]
  - - [3136, 256, 256, 64]
    - [10, 42.212]
  - - [784, 512, 128, 128]
    - [14, 67.356]
  - - [784, 128, 256, 512]
    - [39, 71.592]
  - - [3136, 256, 128, 64]
    - [0, 46.859]
  - - [4096, 512, 1, 1024]
    - [7, 75.91]
  - - [2048, 768, 1, 512]
    - [16, 71.948]
  - - [4096, 512, 1, 2048]
    - [34, 78.648]
  - - [4096, 1024, 1, 2048]
    - [29, 81.342]
  - - [2048, 1024, 1, 2048]
    - [40, 78.581]
  - - [2048, 1024, 1, 4096]
    - [28, 79.352]
  - - [4096, 1024, 1, 1024]
    - [29, 80.746]
  - - [2048, 1024, 1, 512]
    - [21, 74.737]
  - - [4096, 1024, 1, 4096]
    - [22, 81.599]
  - - [2048, 1024, 1, 1024]
    - [28, 76.762]
  - - [4096, 384, 1, 2048]
    - [7, 74.759]
  - - [1225, 192, 64, 384]
    - [0, 78.743]
  - - [289, 128, 64, 1024]
    - [22, 60.827]
  - - [4096, 384, 1, 1536]
    - [1, 74.872]
  - - [289, 192, 64, 1024]
    - [38, 61.391]
  - - [4096, 384, 1, 1280]
    - [36, 74.516]
  - - [4096, 448, 1, 1280]
    - [14, 74.367]
  - - [289, 256, 64, 1024]
    - [11, 63.593]
  - - [4096, 448, 1, 2048]
    - [22, 74.452]
  - - [289, 384, 64, 1024]
    - [11, 64.766]
  - - [1024, 3594, 1, 4096]
    - [6, 81.973]
  - - [4096, 3103, 1, 1024]
    - [7, 86.359]
  - - [4096, 3136, 1, 1024]
    - [7, 87.424]
  - - [1024, 3141, 1, 4096]
    - [40, 81.766]
  - - [4096, 3559, 1, 1024]
    - [7, 90.595]
  - - [4096, 3368, 1, 1024]
    - [7, 89.395]
  - - [1024, 3335, 1, 4096]
    - [7, 85.984]
  - - [1024, 3510, 1, 4096]
    - [6, 80.187]
  - - [4096, 3209, 1, 1024]
    - [7, 85.542]
  - - [4096, 3322, 1, 1024]
    - [7, 88.376]
  - - [1024, 3400, 1, 4096]
    - [7, 87.667]
  - - [1024, 3995, 1, 4096]
    - [6, 84.798]
  - - [1024, 3503, 1, 4096]
    - [6, 79.997]
  - - [4096, 3594, 1, 1024]
    - [7, 88.294]
  - - [4096, 3473, 1, 1024]
    - [7, 88.362]
  - - [4096, 3522, 1, 1024]
    - [7, 90.009]
  - - [1024, 3103, 1, 4096]
    - [6, 83.277]
  - - [1024, 3214, 1, 4096]
    - [28, 83.607]
  - - [4096, 3449, 1, 1024]
    - [7, 91.525]
  - - [1024, 3136, 1, 4096]
    - [6, 84.207]
  - - [1024, 3955, 1, 33708]
    - [30, 87.888]
  - - [1024, 3780, 1, 4096]
    - [7, 84.351]
  - - [1024, 3906, 1, 33708]
    - [7, 86.923]
  - - [1024, 3386, 1, 4096]
    - [23, 87.085]
  - - [4096, 3396, 1, 1024]
    - [7, 89.81]
  - - [1024, 3183, 1, 4096]
    - [40, 82.677]
  - - [1024, 3098, 1, 4096]
    - [22, 83.16]
  - - [1024, 3548, 1, 4096]
    - [6, 80.913]
  - - [1024, 3224, 1, 4096]
    - [28, 83.886]
  - - [4096, 3469, 1, 1024]
    - [7, 88.461]
  - - [1024, 3582, 1, 4096]
    - [22, 81.87]
  - - [1024, 2977, 1, 4096]
    - [22, 80.015]
  - - [1024, 3939, 1, 1024]
    - [23, 85.601]
  - - [4096, 3176, 1, 1024]
    - [7, 88.29]
  - - [1024, 3559, 1, 4096]
    - [22, 81.256]
  - - [1024, 3478, 1, 4096]
    - [6, 79.424]
  - - [4096, 3343, 1, 1024]
    - [7, 88.682]
  - - [4096, 3440, 1, 1024]
    - [7, 91.087]
  - - [1024, 3996, 1, 33708]
    - [0, 84.947]
  - - [1024, 4012, 1, 4096]
    - [6, 85.132]
  - - [1024, 3322, 1, 4096]
    - [13, 86.007]
  - - [1024, 3990, 1, 33708]
    - [0, 84.82]
  - - [1024, 3314, 1, 4096]
    - [40, 85.651]
  - - [4096, 3513, 1, 1024]
    - [7, 89.395]
  - - [1024, 3562, 1, 4096]
    - [22, 81.364]
  - - [1024, 3443, 1, 4096]
    - [7, 88.691]
  - - [1024, 3554, 1, 4096]
    - [22, 81.301]
  - - [1024, 3063, 1, 4096]
    - [22, 82.244]
  - - [4096, 3460, 1, 1024]
    - [7, 88.186]
  - - [1024, 3209, 1, 4096]
    - [40, 83.377]
  - - [1024, 3147, 1, 4096]
    - [28, 82.014]
  - - [4096, 3387, 1, 1024]
    - [7, 89.91]
  - - [4096, 3436, 1, 1024]
    - [7, 91.168]
  - - [1024, 3341, 1, 4096]
    - [7, 86.093]
  - - [1024, 3516, 1, 4096]
    - [6, 80.349]
  - - [4096, 3277, 1, 1024]
    - [7, 87.234]
  - - [1024, 3454, 1, 4096]
    - [23, 88.894]
  - - [1024, 3969, 1, 4096]
    - [22, 84.311]
  - - [1024, 3999, 1, 4096]
    - [22, 84.866]
  - - [1024, 4032, 1, 4096]
    - [22, 85.664]
  - - [4096, 3541, 1, 1024]
    - [7, 90.117]
  - - [4096, 3334, 1, 1024]
    - [7, 88.416]
  - - [1024, 3365, 1, 4096]
    - [23, 86.724]
  - - [1024, 3527, 1, 4096]
    - [22, 80.417]
  - - [1024, 3190, 1, 4096]
    - [28, 83.025]
  - - [4096, 3906, 1, 1024]
    - [7, 89.161]
  - - [1024, 3593, 1, 4096]
    - [6, 81.874]
  - - [1024, 3336, 1, 4096]
    - [23, 85.966]
  - - [4096, 3504, 1, 1024]
    - [7, 89.323]
  - - [4096, 3977, 1, 1024]
    - [7, 88.118]
  - - [1024, 3906, 1, 4096]
    - [23, 87.153]
  - - [4096, 3415, 1, 1024]
    - [7, 90.528]
  - - [1024, 3295, 1, 4096]
    - [40, 85.461]
  - - [4096, 3321, 1, 1024]
    - [7, 88.7]
  - - [1024, 3072, 1, 4096]
    - [290, 83.544]
  - - [1024, 3408, 1, 4096]
    - [23, 87.794]
  - - [1024, 3522, 1, 4096]
    - [22, 80.426]
  - - [4096, 3751, 1, 1024]
    - [7, 88.976]
  - - [4096, 3378, 1, 1024]
    - [7, 89.616]
  - - [1024, 3925, 1, 33708]
    - [7, 87.351]
  - - [1024, 3990, 1, 1024]
    - [35, 83.643]
  - - [1024, 3290, 1, 4096]
    - [28, 85.204]
  - - [4096, 3500, 1, 1024]
    - [7, 89.17]
  - - [4096, 3565, 1, 1024]
    - [7, 90.907]
  - - [1024, 3484, 1, 4096]
    - [22, 79.7]
  - - [4096, 3395, 1, 1024]
    - [7, 90.027]
  - - [1024, 3681, 1, 1024]
    - [22, 82.777]
  - - [1024, 3584, 1, 1024]
    - [22, 80.981]
  - - [4096, 3093, 1, 1024]
    - [7, 85.953]
  - - [1024, 4050, 1, 1024]
    - [22, 79.876]
  - - [1024, 3301, 1, 4096]
    - [40, 85.664]
  - - [1024, 3581, 1, 4096]
    - [6, 81.789]
  - - [4096, 3374, 1, 1024]
    - [7, 89.553]
  - - [1024, 3449, 1, 4096]
    - [7, 88.719]
  - - [4096, 3215, 1, 1024]
    - [7, 85.533]
  - - [4096, 3312, 1, 1024]
    - [7, 88.515]
  - - [4096, 3479, 1, 1024]
    - [7, 88.8]
  - - [4096, 3544, 1, 1024]
    - [7, 90.474]
  - - [1024, 3263, 1, 4096]
    - [40, 84.595]
  - - [4096, 3455, 1, 1024]
    - [7, 91.615]
  - - [1024, 3379, 1, 4096]
    - [23, 87.031]
  - - [1024, 3490, 1, 4096]
    - [6, 79.812]
  - - [1024, 3368, 1, 4096]
    - [23, 86.932]
  - - [4096, 3186, 1, 1024]
    - [7, 88.691]
  - - [1024, 3428, 1, 4096]
    - [23, 88.461]
  - - [4096, 3561, 1, 1024]
    - [7, 90.816]
  - - [4096, 3418, 1, 1024]
    - [7, 90.636]
  - - [1024, 3064, 1, 4096]
    - [22, 82.316]
  - - [4096, 3259, 1, 1024]
    - [7, 87.067]
  - - [4096, 3308, 1, 1024]
    - [7, 88.019]
  - - [1024, 3533, 1, 4096]
    - [22, 80.71]
  - - [1024, 3344, 1, 4096]
    - [23, 86.553]
  - - [1024, 4030, 1, 1024]
    - [22, 84.369]
  - - [4096, 3459, 1, 1024]
    - [7, 88.227]
  - - [1024, 3572, 1, 4096]
    - [6, 81.531]
  - - [1024, 3925, 1, 1024]
    - [7, 85.389]
  - - [4096, 3435, 1, 1024]
    - [7, 91.128]
  - - [1024, 3956, 1, 4096]
    - [23, 88.227]
  - - [1024, 3463, 1, 4096]
    - [22, 79.154]
  - - [4096, 3182, 1, 1024]
    - [7, 88.34]
  - - [4096, 3976, 1, 1024]
    - [7, 88.137]
  - - [1024, 3417, 1, 4096]
    - [7, 88.024]
  - - [1024, 3528, 1, 4096]
    - [22, 80.57]
  - - [4096, 3446, 1, 1024]
    - [7, 91.489]
  - - [1024, 3543, 1, 4096]
    - [6, 80.891]
  - - [4096, 3287, 1, 1024]
    - [7, 87.505]
  - - [1024, 3499, 1, 4096]
    - [22, 79.93]
  - - [1024, 3231, 1, 4096]
    - [13, 84.031]
  - - [4096, 3519, 1, 1024]
    - [7, 89.729]
  - - [4096, 3552, 1, 1024]
    - [7, 90.361]
  - - [1024, 3458, 1, 4096]
    - [22, 79.054]
  - - [1024, 3374, 1, 4096]
    - [23, 87.099]
  - - [1024, 3396, 1, 4096]
    - [23, 87.631]
  - - [1024, 2967, 1, 4096]
    - [22, 79.88]
  - - [4096, 3482, 1, 1024]
    - [7, 88.719]
  - - [1024, 3226, 1, 4096]
    - [13, 83.571]
  - - [4096, 3377, 1, 1024]
    - [7, 89.436]
  - - [4096, 3426, 1, 1024]
    - [7, 90.785]
  - - [4096, 2935, 1, 1024]
    - [7, 88.881]
  - - [1024, 3439, 1, 4096]
    - [7, 88.525]
  - - [4096, 3267, 1, 1024]
    - [7, 86.954]
  - - [4096, 3499, 1, 1024]
    - [7, 89.03]
  - - [4096, 3356, 1, 1024]
    - [7, 88.872]
  - - [4096, 3939, 1, 1024]
    - [7, 90.018]
  - - [1024, 3526, 1, 4096]
    - [22, 80.561]
  - - [1024, 3859, 1, 33708]
    - [1, 85.894]
  - - [1024, 3385, 1, 4096]
    - [7, 87.171]
  - - [1024, 3496, 1, 4096]
    - [22, 79.934]
  - - [4096, 3141, 1, 1024]
    - [7, 87.342]
  - - [4096, 3510, 1, 1024]
    - [7, 89.643]
  - - [1024, 3434, 1, 4096]
    - [7, 88.443]
  - - [4096, 3969, 1, 1024]
    - [7, 87.893]
  - - [1024, 3121, 1, 4096]
    - [22, 83.706]
  - - [1024, 3232, 1, 4096]
    - [40, 84.004]
  - - [1024, 4030, 1, 33708]
    - [0, 85.619]
  - - [1024, 3780, 1, 33708]
    - [1, 84.189]
  - - [1024, 3969, 1, 1024]
    - [35, 83.025]
  - - [4096, 3527, 1, 1024]
    - [7, 89.878]
  - - [4096, 3336, 1, 1024]
    - [7, 88.34]
  - - [4096, 3290, 1, 1024]
    - [7, 87.577]
  - - [1024, 3469, 1, 4096]
    - [6, 79.393]
  - - [4096, 3490, 1, 1024]
    - [7, 89.152]
  - - [4096, 3064, 1, 1024]
    - [7, 88.84]
  - - [4096, 3582, 1, 1024]
    - [7, 91.394]
  - - [1024, 3956, 1, 1024]
    - [23, 85.551]
  - - [4096, 3417, 1, 1024]
    - [7, 90.708]
  - - [1024, 2736, 1, 4096]
    - [23, 83.783]
  - - [1024, 3205, 1, 4096]
    - [28, 83.323]
  - - [1024, 3143, 1, 4096]
    - [28, 81.91]
  - - [1024, 4020, 1, 4096]
    - [6, 85.285]
  - - [1024, 3318, 1, 4096]
    - [28, 86.034]
  - - [4096, 3364, 1, 1024]
    - [7, 89.287]
  - - [1024, 3353, 1, 4096]
    - [7, 86.557]
  - - [1024, 3464, 1, 4096]
    - [6, 79.136]
  - - [4096, 3205, 1, 1024]
    - [7, 85.411]
  - - [4096, 3318, 1, 1024]
    - [7, 88.358]
  - - [1024, 3402, 1, 4096]
    - [23, 87.798]
  - - [4096, 3181, 1, 1024]
    - [7, 88.434]
  - - [4096, 3550, 1, 1024]
    - [7, 90.659]
  - - [4096, 3445, 1, 1024]
    - [7, 91.398]
  - - [1024, 3138, 1, 4096]
    - [40, 81.653]
  - - [4096, 3079, 1, 1024]
    - [7, 85.614]
  - - [4096, 3144, 1, 1024]
    - [7, 87.545]
  - - [4096, 3860, 1, 1024]
    - [7, 88.245]
  - - [1024, 3515, 1, 4096]
    - [6, 80.417]
  - - [4096, 3408, 1, 1024]
    - [7, 90.388]
  - - [1024, 3181, 1, 4096]
    - [28, 82.655]
  - - [4096, 3298, 1, 1024]
    - [7, 87.866]
  - - [4096, 3585, 1, 1024]
    - [7, 88.141]
  - - [1024, 3550, 1, 4096]
    - [22, 81.112]
  - - [1024, 4020, 1, 1024]
    - [35, 84.189]
  - - [4096, 3481, 1, 1024]
    - [7, 88.809]
  - - [4096, 3530, 1, 1024]
    - [7, 89.698]
  - - [4096, 3425, 1, 1024]
    - [7, 90.771]
  - - [4096, 4026, 1, 1024]
    - [7, 89.084]
  - - [1024, 3860, 1, 1024]
    - [23, 83.968]
  - - [4096, 3975, 1, 1024]
    - [7, 88.078]
  - - [1024, 3286, 1, 4096]
    - [40, 85.29]
  - - [1024, 3176, 1, 4096]
    - [28, 82.759]
  - - [1024, 3894, 1, 4096]
    - [23, 87.103]
  - - [4096, 3355, 1, 1024]
    - [7, 89.084]
  - - [4096, 3404, 1, 1024]
    - [7, 90.442]
  - - [1024, 3501, 1, 4096]
    - [22, 80.088]
  - - [4096, 3245, 1, 1024]
    - [7, 86.463]
  - - [1024, 3431, 1, 4096]
    - [23, 88.448]
  - - [1024, 4000, 1, 1024]
    - [35, 83.882]
  - - [4096, 3509, 1, 1024]
    - [7, 89.476]
  - - [4096, 3558, 1, 1024]
    - [7, 90.875]
  - - [1024, 3535, 1, 4096]
    - [22, 80.742]
  - - [1024, 3414, 1, 4096]
    - [23, 88.168]
  - - [1024, 3445, 1, 4096]
    - [7, 88.746]
  - - [1024, 3436, 1, 4096]
    - [7, 88.529]
  - - [4096, 3472, 1, 1024]
    - [7, 88.583]
  - - [1024, 3211, 1, 4096]
    - [40, 83.48]
  - - [4096, 3383, 1, 1024]
    - [7, 89.72]
  - - [4096, 3448, 1, 1024]
    - [7, 91.534]
  - - [1024, 3343, 1, 4096]
    - [23, 86.224]
  - - [1024, 3518, 1, 4096]
    - [6, 80.453]
  - - [4096, 3289, 1, 1024]
    - [7, 87.613]
  - - [1024, 3440, 1, 4096]
    - [7, 88.588]
  - - [1024, 4032, 1, 33708]
    - [14, 85.484]
  - - [4096, 3489, 1, 1024]
    - [7, 88.867]
  - - [4096, 3346, 1, 1024]
    - [7, 88.515]
  - - [1024, 3534, 1, 4096]
    - [6, 80.733]
  - - [1024, 3079, 1, 4096]
    - [22, 82.709]
  - - [1024, 3955, 1, 4096]
    - [23, 88.294]
  - - [4096, 3236, 1, 1024]
    - [7, 86.535]
  - - [1024, 3545, 1, 4096]
    - [22, 81.04]
  - - [1024, 3144, 1, 4096]
    - [28, 81.973]
  - - [4096, 3780, 1, 1024]
    - [7, 89.612]
  - - [4096, 3163, 1, 1024]
    - [7, 87.961]
  - - [4096, 3468, 1, 1024]
    - [7, 88.488]
  - - [1024, 3539, 1, 4096]
    - [22, 80.828]
  - - [1024, 3541, 1, 4096]
    - [22, 80.873]
  - - [4096, 3363, 1, 1024]
    - [7, 89.206]
  - - [1024, 3475, 1, 4096]
    - [35, 79.51]
  - - [4096, 3110, 1, 1024]
    - [7, 86.67]
  - - [1024, 3509, 1, 4096]
    - [22, 80.259]
  - - [1024, 3413, 1, 4096]
    - [23, 88.078]
  - - [1024, 3975, 1, 1024]
    - [22, 83.291]
  - - [4096, 3549, 1, 1024]
    - [7, 90.505]
  - - [4096, 3342, 1, 1024]
    - [7, 88.525]
  - - [1024, 2985, 1, 4096]
    - [35, 80.273]
  - - [1024, 3876, 1, 33708]
    - [7, 86.318]
  - - [4096, 3280, 1, 1024]
    - [7, 87.32]
  - - [4096, 3191, 1, 1024]
    - [7, 88.579]
  - - [4096, 3512, 1, 1024]
    - [7, 89.652]
  - - [1024, 3560, 1, 4096]
    - [22, 81.306]
  - - [4096, 2499, 1, 1024]
    - [7, 88.042]
  - - [1024, 3248, 1, 4096]
    - [13, 84.374]
  - - [4096, 3423, 1, 1024]
    - [7, 90.758]
  - - [4096, 3297, 1, 1024]
    - [7, 87.69]
  - - [4096, 3154, 1, 1024]
    - [7, 87.857]
  - - [1024, 3303, 1, 4096]
    - [40, 85.551]
  - - [1024, 3222, 1, 4096]
    - [28, 83.72]
  - - [1024, 3978, 1, 1024]
    - [35, 83.458]
  - - [4096, 3529, 1, 1024]
    - [7, 89.946]
  - - [4096, 3386, 1, 1024]
    - [7, 89.869]
  - - [1024, 3451, 1, 4096]
    - [23, 88.822]
  - - [4096, 3562, 1, 1024]
    - [7, 90.776]
  - - [4096, 3276, 1, 1024]
    - [7, 87.342]
  - - [1024, 3894, 1, 33708]
    - [7, 86.621]
  - - [4096, 3540, 1, 1024]
    - [7, 90.077]
  - - [1024, 3416, 1, 4096]
    - [23, 88.001]
  - - [1024, 4005, 1, 33708]
    - [14, 85.082]
  - - [1024, 3942, 1, 4096]
    - [7, 87.721]
  - - [4096, 3403, 1, 1024]
    - [7, 90.108]
  - - [4096, 3381, 1, 1024]
    - [7, 89.612]
  - - [1024, 3492, 1, 4096]
    - [22, 79.844]
  - - [4096, 3101, 1, 1024]
    - [7, 86.336]
  - - [1024, 3430, 1, 4096]
    - [23, 88.38]
  - - [1024, 3977, 1, 4096]
    - [22, 84.482]
  - - [1024, 3640, 1, 4096]
    - [22, 83.056]
  - - [4096, 3557, 1, 1024]
    - [7, 90.686]
  - - [4096, 3414, 1, 1024]
    - [7, 90.392]
  - - [1024, 3391, 1, 4096]
    - [23, 87.536]
  - - [1024, 3356, 1, 4096]
    - [7, 86.594]
  - - [4096, 3320, 1, 1024]
    - [1, 88.362]
  - - [4096, 2765, 1, 1024]
    - [7, 87.911]
  - - [1024, 3411, 1, 4096]
    - [23, 87.952]
  - - [1024, 3978, 1, 4096]
    - [22, 84.514]
  - - [4096, 3487, 1, 1024]
    - [7, 88.773]
  - - [4096, 3520, 1, 1024]
    - [7, 89.797]
  - - [4096, 3942, 1, 1024]
    - [7, 89.914]
  - - [4096, 3431, 1, 1024]
    - [7, 91.042]
  - - [1024, 3271, 1, 4096]
    - [40, 84.875]
  - - [4096, 4020, 1, 1024]
    - [7, 89.048]
  - - [1024, 3481, 1, 4096]
    - [6, 79.506]
  - - [1024, 3419, 1, 4096]
    - [23, 88.209]
  - - [1024, 4059, 1, 4096]
    - [22, 80.846]
  - - [4096, 3345, 1, 1024]
    - [7, 88.696]
  - - [4096, 3394, 1, 1024]
    - [7, 90.027]
  - - [1024, 3298, 1, 4096]
    - [40, 85.47]
  - - [4096, 3235, 1, 1024]
    - [7, 86.237]
  - - [1024, 3681, 1, 33708]
    - [14, 84.022]
  - - [1024, 3362, 1, 4096]
    - [7, 86.508]
  - - [4096, 3467, 1, 1024]
    - [7, 88.353]
  - - [1024, 3349, 1, 4096]
    - [23, 86.26]
  - - [1024, 3460, 1, 4096]
    - [6, 79.158]
  - - [4096, 3214, 1, 1024]
    - [7, 85.308]
  - - [1024, 3398, 1, 4096]
    - [23, 87.559]
  - - [4096, 3478, 1, 1024]
    - [7, 88.281]
  - - [1024, 4050, 1, 33708]
    - [14, 80.868]
  - - [1024, 3244, 1, 4096]
    - [40, 83.945]
  - - [4096, 3341, 1, 1024]
    - [7, 88.682]
  - - [4096, 3454, 1, 1024]
    - [7, 91.38]
  - - [1024, 3166, 1, 4096]
    - [40, 82.334]
  - - [1024, 3425, 1, 4096]
    - [23, 88.547]
  - - [4096, 3295, 1, 1024]
    - [7, 87.721]
  - - [4096, 3072, 1, 1024]
    - [262, 89.375]
  - - [4096, 3822, 1, 1024]
    - [7, 90.744]
  - - [1024, 3681, 1, 4096]
    - [6, 83.751]
  - - [1024, 4050, 1, 4096]
    - [22, 80.62]
  - - [4096, 3495, 1, 1024]
    - [7, 89.057]
  - - [4096, 3560, 1, 1024]
    - [7, 90.668]
  - - [1024, 3524, 1, 4096]
    - [22, 80.467]
  - - [1024, 3942, 1, 33708]
    - [7, 87.613]
  - - [1024, 3304, 1, 4096]
    - [40, 85.19]
  - - [1024, 3387, 1, 4096]
    - [23, 87.207]
  - - [1024, 3498, 1, 4096]
    - [22, 79.785]
  - - [4096, 3458, 1, 1024]
    - [7, 88.155]
  - - [4096, 2967, 1, 1024]
    - [7, 86.052]
  - - [4096, 3385, 1, 1024]
    - [7, 89.589]
  - - [4096, 3434, 1, 1024]
    - [7, 91.06]
  - - [1024, 3519, 1, 4096]
    - [22, 80.363]
  - - [1024, 3511, 1, 4096]
    - [6, 80.295]
  - - [1024, 3288, 1, 4096]
    - [28, 85.42]
  - - [1024, 2918, 1, 4096]
    - [6, 78.576]
  - - [4096, 3573, 1, 1024]
    - [7, 90.929]
  - - [1024, 3822, 1, 33708]
    - [1, 85.244]
  - - [4096, 3539, 1, 1024]
    - [7, 90.095]
  - - [4096, 3332, 1, 1024]
    - [7, 88.24]
  - - [4096, 3286, 1, 1024]
    - [7, 87.329]
  - - [1024, 4026, 1, 4096]
    - [6, 85.38]
  - - [1024, 3277, 1, 4096]
    - [28, 85.073]
  - - [1024, 3471, 1, 4096]
    - [6, 79.415]
  - - [4096, 3518, 1, 1024]
    - [7, 89.576]
  - - [1024, 3393, 1, 4096]
    - [23, 87.338]
  - - [4096, 3413, 1, 1024]
    - [7, 90.374]
  - - [4096, 3303, 1, 1024]
    - [7, 87.834]
  - - [1024, 3207, 1, 4096]
    - [40, 83.332]
  - - [1024, 3894, 1, 1024]
    - [23, 84.635]
  - - [1024, 3977, 1, 1024]
    - [35, 83.494]
  - - [4096, 3535, 1, 1024]
    - [7, 90.095]
  - - [4096, 3376, 1, 1024]
    - [7, 89.58]
  - - [1024, 3355, 1, 4096]
    - [23, 86.535]
  - - [1024, 3466, 1, 4096]
    - [22, 79.248]
  - - [4096, 3266, 1, 1024]
    - [7, 86.747]
  - - [1024, 3404, 1, 4096]
    - [7, 87.69]
  - - [1024, 3999, 1, 1024]
    - [35, 83.895]
  - - [4096, 3498, 1, 1024]
    - [7, 89.224]
  - - [1024, 4032, 1, 1024]
    - [35, 84.613]
  - - [1024, 3410, 1, 4096]
    - [23, 87.875]
  - - [4096, 3393, 1, 1024]
    - [7, 89.968]
  - - [1024, 3140, 1, 4096]
    - [40, 81.658]
  - - [1024, 3910, 1, 33708]
    - [7, 87.072]
  - - [1024, 3334, 1, 4096]
    - [7, 85.781]
  - - [4096, 3140, 1, 1024]
    - [7, 87.225]
  - - [1024, 4005, 1, 4096]
    - [6, 84.978]
  - - [1024, 3579, 1, 4096]
    - [22, 81.671]
  - - [4096, 3372, 1, 1024]
    - [7, 89.278]
  - - [1024, 3245, 1, 4096]
    - [40, 84.414]
  - - [4096, 3956, 1, 1024]
    - [7, 90.126]
  - - [4096, 3213, 1, 1024]
    - [7, 85.542]
  - - [1024, 3361, 1, 4096]
    - [23, 86.711]
  - - [1024, 3536, 1, 4096]
    - [22, 80.805]
  - - [4096, 3477, 1, 1024]
    - [7, 88.583]
  - - [4096, 3526, 1, 1024]
    - [7, 89.941]
  - - [1024, 4005, 1, 1024]
    - [35, 83.986]
  - - [1024, 3530, 1, 4096]
    - [6, 80.643]
  - - [1024, 3944, 1, 4096]
    - [7, 88.019]
  - - [4096, 3453, 1, 1024]
    - [7, 91.268]
  - - [4096, 3184, 1, 1024]
    - [7, 88.457]
  - - [4096, 3579, 1, 1024]
    - [7, 91.168]
  - - [4096, 3351, 1, 1024]
    - [7, 88.84]
  - - [4096, 3416, 1, 1024]
    - [7, 90.695]
  - - [1024, 3822, 1, 4096]
    - [23, 85.393]
  - - [1024, 3796, 1, 4096]
    - [7, 84.64]
  - - [4096, 3257, 1, 1024]
    - [7, 86.639]
  - - [4096, 3306, 1, 1024]
    - [7, 87.888]
  - - [1024, 3505, 1, 4096]
    - [22, 80.115]
  - - [1024, 3315, 1, 4096]
    - [13, 85.998]
  - - [1024, 3486, 1, 4096]
    - [6, 79.524]
  - - [4096, 3457, 1, 1024]
    - [7, 88.416]
  - - [4096, 3870, 1, 1024]
    - [7, 88.398]
  - - [1024, 3447, 1, 4096]
    - [7, 88.7]
  - - [1024, 3558, 1, 4096]
    - [22, 81.261]
  - - [4096, 3433, 1, 1024]
    - [7, 90.866]
  - - [4096, 3180, 1, 1024]
    - [7, 88.227]
  - - [1024, 3213, 1, 4096]
    - [40, 83.332]
  - - [1024, 3900, 1, 4096]
    - [7, 87.058]
  - - [4096, 3444, 1, 1024]
    - [7, 91.146]
  - - [1024, 3504, 1, 4096]
    - [22, 80.074]
  - - [4096, 4059, 1, 1024]
    - [7, 89.517]
  - - [1024, 3442, 1, 4096]
    - [7, 88.398]
  - - [4096, 3517, 1, 1024]
    - [7, 89.305]
  - - [1024, 3566, 1, 4096]
    - [6, 81.319]
  - - [4096, 3248, 1, 1024]
    - [7, 86.612]
  - - [1024, 3547, 1, 4096]
    - [22, 80.9]
  - - [1024, 3340, 1, 4096]
    - [23, 86.242]
  - - [4096, 3480, 1, 1024]
    - [7, 88.795]
  - - [4096, 3424, 1, 1024]
    - [7, 90.866]
  - - [1024, 3906, 1, 1024]
    - [23, 84.888]
  - - [4096, 3265, 1, 1024]
    - [7, 87.045]
  - - [1024, 3384, 1, 4096]
    - [7, 87.306]
  - - [1024, 3494, 1, 4096]
    - [22, 79.817]
  - - [1024, 3236, 1, 4096]
    - [13, 84.157]
  - - [4096, 3497, 1, 1024]
    - [7, 89.174]
  - - [4096, 3354, 1, 1024]
    - [7, 88.89]
  - - [4096, 3055, 1, 1024]
    - [7, 88.371]
  - - [4096, 3244, 1, 1024]
    - [7, 86.332]
  - - [4096, 3139, 1, 1024]
    - [7, 87.424]
  - - [4096, 3508, 1, 1024]
    - [7, 89.49]
  - - [4096, 4050, 1, 1024]
    - [7, 89.67]
  - - [1024, 3472, 1, 4096]
    - [22, 79.402]
  - - [1024, 3861, 1, 1024]
    - [23, 83.828]
  - - [1024, 3910, 1, 1024]
    - [23, 84.906]
  - - [4096, 3371, 1, 1024]
    - [7, 89.594]
  - - [1024, 3751, 1, 4096]
    - [7, 83.814]
  - - [4096, 3325, 1, 1024]
    - [7, 88.389]
  - - [1024, 3321, 1, 4096]
    - [40, 85.885]
  - - [1024, 3944, 1, 1024]
    - [7, 85.488]
  - - [4096, 3525, 1, 1024]
    - [7, 89.792]
  - - [4096, 3382, 1, 1024]
    - [7, 89.549]
  - - [1024, 3453, 1, 4096]
    - [7, 88.845]
  - - [4096, 3564, 1, 1024]
    - [7, 90.668]
  - - [4096, 3288, 1, 1024]
    - [7, 87.649]
  - - [1024, 3925, 1, 4096]
    - [23, 87.293]
  - - [1024, 3057, 1, 4096]
    - [22, 82.109]
  - - [4096, 3488, 1, 1024]
    - [7, 88.759]
  - - [4096, 3046, 1, 1024]
    - [7, 88.254]
  - - [1024, 3189, 1, 4096]
    - [40, 82.871]
  - - [4096, 3399, 1, 1024]
    - [7, 89.973]
  - - [1024, 3383, 1, 4096]
    - [23, 87.248]
  - - [1024, 3415, 1, 4096]
    - [7, 87.965]
  - - [1024, 3388, 1, 4096]
    - [23, 87.496]
  - - [1024, 3376, 1, 4096]
    - [23, 87.284]
  - - [1024, 3473, 1, 4096]
    - [6, 79.424]
  - - [4096, 3162, 1, 1024]
    - [7, 88.006]
  - - [1024, 3448, 1, 4096]
    - [23, 88.719]
  - - [4096, 3362, 1, 1024]
    - [7, 89.197]
  - - [1024, 3262, 1, 4096]
    - [40, 84.847]
  - - [1024, 3184, 1, 4096]
    - [13, 82.844]
  - - [1024, 3378, 1, 4096]
    - [23, 87.311]
  - - [4096, 3548, 1, 1024]
    - [7, 90.532]
  - - [4096, 2977, 1, 1024]
    - [7, 86.359]
  - - [4096, 3443, 1, 1024]
    - [7, 91.069]
  - - [1024, 3289, 1, 4096]
    - [28, 85.159]
  - - [1024, 3483, 1, 4096]
    - [22, 79.609]
  - - [4096, 3190, 1, 1024]
    - [7, 88.759]
  - - [1024, 3421, 1, 4096]
    - [23, 88.2]
  - - [1024, 3514, 1, 4096]
    - [22, 80.295]
  - - [1024, 3532, 1, 4096]
    - [22, 80.656]
  - - [1024, 3565, 1, 4096]
    - [22, 81.459]
  - - [4096, 3422, 1, 1024]
    - [7, 90.731]
  - - [4096, 3263, 1, 1024]
    - [7, 86.968]
  - - [4096, 3296, 1, 1024]
    - [7, 87.527]
  - - [4096, 3640, 1, 1024]
    - [7, 89.526]
  - - [4096, 3463, 1, 1024]
    - [7, 88.412]
  - - [4096, 3528, 1, 1024]
    - [7, 89.977]
  - - [1024, 3351, 1, 4096]
    - [7, 86.278]
  - - [1024, 3462, 1, 4096]
    - [22, 79.19]
  - - [4096, 3226, 1, 1024]
    - [7, 86.129]
  - - [4096, 3439, 1, 1024]
    - [7, 91.024]
  - - [4096, 3121, 1, 1024]
    - [7, 86.941]
  - - [1024, 4059, 1, 33708]
    - [14, 81.13]
  - - [1024, 3311, 1, 4096]
    - [40, 85.42]
  - - [1024, 3230, 1, 4096]
    - [28, 83.932]
  - - [4096, 3353, 1, 1024]
    - [7, 88.989]
  - - [4096, 3402, 1, 1024]
    - [7, 90.32]
  - - [1024, 3427, 1, 4096]
    - [36, 88.344]
  - - [1024, 3346, 1, 4096]
    - [23, 86.544]
  - - [1024, 3126, 1, 4096]
    - [22, 83.855]
  - - [1024, 3796, 1, 1024]
    - [23, 82.515]
  - - [1024, 3990, 1, 4096]
    - [22, 84.649]
  - - [1024, 3257, 1, 4096]
    - [13, 84.676]
  - - [4096, 3996, 1, 1024]
    - [7, 88.47]
  - - [1024, 3306, 1, 4096]
    - [40, 85.836]
  - - [1024, 3389, 1, 4096]
    - [23, 87.609]
  - - [1024, 3500, 1, 4096]
    - [6, 80.015]
  - - [1024, 3999, 1, 33708]
    - [14, 84.933]
  - - [4096, 3486, 1, 1024]
    - [7, 88.881]
  - - [1024, 3438, 1, 4096]
    - [7, 88.326]
  - - [4096, 3616, 1, 1024]
    - [7, 88.664]
  - - [1024, 3955, 1, 1024]
    - [7, 85.213]
  - - [4096, 3430, 1, 1024]
    - [7, 90.938]
  - - [4096, 3271, 1, 1024]
    - [7, 86.918]
  - - [1024, 3364, 1, 4096]
    - [23, 86.756]
  - - [1024, 3497, 1, 4096]
    - [22, 79.925]
  - - [4096, 3503, 1, 1024]
    - [7, 89.377]
  - - [4096, 3344, 1, 1024]
    - [7, 88.484]
  - - [1024, 3457, 1, 4096]
    - [22, 78.933]
  - - [4096, 3466, 1, 1024]
    - [7, 88.249]
  - - [1024, 3976, 1, 33708]
    - [22, 84.351]
  - - [1024, 3395, 1, 4096]
    - [23, 87.433]
  - - [4096, 3361, 1, 1024]
    - [7, 88.894]
  - - [1024, 3751, 1, 33708]
    - [7, 83.521]
  - - [1024, 3822, 1, 1024]
    - [36, 82.064]
  - - [4096, 3315, 1, 1024]
    - [7, 88.502]
  - - [1024, 3163, 1, 4096]
    - [40, 81.888]
  - - [4096, 3547, 1, 1024]
    - [7, 90.108]
  - - [4096, 3340, 1, 1024]
    - [7, 88.515]
  - - [1024, 3296, 1, 4096]
    - [40, 85.226]
  - - [1024, 3468, 1, 4096]
    - [6, 79.113]
  - - [4096, 3294, 1, 1024]
    - [7, 87.536]
  - - [1024, 3406, 1, 4096]
    - [23, 87.627]
  - - [1024, 3860, 1, 33708]
    - [1, 85.912]
  - - [1024, 3584, 1, 4096]
    - [22, 81.838]
  - - [4096, 3189, 1, 1024]
    - [7, 88.308]
  - - [4096, 3494, 1, 1024]
    - [7, 89.043]
  - - [1024, 3093, 1, 4096]
    - [22, 82.831]
  - - [4096, 3421, 1, 1024]
    - [7, 90.428]
  - - [1024, 3479, 1, 4096]
    - [6, 79.33]
  - - [1024, 3433, 1, 4096]
    - [7, 88.497]
  - - [4096, 3311, 1, 1024]
    - [7, 87.735]
  - - [1024, 3381, 1, 4096]
    - [7, 87.031]
  - - [1024, 3996, 1, 4096]
    - [35, 84.789]
  - - [4096, 3384, 1, 1024]
    - [7, 89.698]
  - - [1024, 3247, 1, 4096]
    - [40, 84.256]
  - - [1024, 3169, 1, 4096]
    - [28, 82.402]
  - - [1024, 3088, 1, 4096]
    - [22, 82.939]
  - - [1024, 3363, 1, 4096]
    - [23, 86.724]
  - - [1024, 3538, 1, 4096]
    - [6, 80.855]
  - - [1024, 3996, 1, 1024]
    - [22, 83.909]
  - - [4096, 3169, 1, 1024]
    - [7, 88.227]
  - - [4096, 3538, 1, 1024]
    - [7, 90.243]
  - - [4096, 3401, 1, 1024]
    - [7, 90.049]
  - - [4096, 3581, 1, 1024]
    - [7, 91.173]
  - - [1024, 3180, 1, 4096]
    - [40, 82.492]
  - - [1024, 3870, 1, 1024]
    - [23, 83.877]
  - - [4096, 3555, 1, 1024]
    - [7, 90.419]
  - - [4096, 3412, 1, 1024]
    - [7, 90.392]
  - - [4096, 3302, 1, 1024]
    - [7, 87.893]
  - - [1024, 3561, 1, 4096]
    - [6, 81.328]
  - - [1024, 3302, 1, 4096]
    - [28, 85.808]
  - - [1024, 3976, 1, 4096]
    - [6, 84.378]
  - - [4096, 3485, 1, 1024]
    - [7, 88.849]
  - - [4096, 3534, 1, 1024]
    - [7, 89.986]
  - - [1024, 3110, 1, 4096]
    - [22, 83.494]
  - - [1024, 3401, 1, 4096]
    - [23, 87.852]
  - - [4096, 3216, 1, 1024]
    - [7, 85.524]
  - - [1024, 4020, 1, 33708]
    - [14, 85.375]
  - - [1024, 3215, 1, 4096]
    - [40, 83.228]
  - - [4096, 3566, 1, 1024]
    - [7, 90.69]
  - - [1024, 3137, 1, 4096]
    - [40, 81.653]
  - - [4096, 3359, 1, 1024]
    - [7, 88.967]
  - - [4096, 3392, 1, 1024]
    - [7, 90.036]
  - - [1024, 3506, 1, 4096]
    - [35, 80.151]
  - - [4096, 3233, 1, 1024]
    - [7, 86.057]
  - - [1024, 3444, 1, 4096]
    - [36, 88.687]
  - - [1024, 3975, 1, 4096]
    - [6, 84.405]
  - - [1024, 3870, 1, 33708]
    - [1, 85.993]
  - - [4096, 3465, 1, 1024]
    - [7, 88.367]
  - - [1024, 3523, 1, 4096]
    - [22, 80.557]
  - - [4096, 3990, 1, 1024]
    - [7, 88.29]
  - - [1024, 3549, 1, 4096]
    - [22, 81.053]
  - - [1024, 3342, 1, 4096]
    - [23, 86.242]
  - - [4096, 3476, 1, 1024]
    - [7, 88.723]
  - - [1024, 3418, 1, 4096]
    - [23, 88.091]
  - - [1024, 3859, 1, 1024]
    - [7, 83.914]
  - - [4096, 3339, 1, 1024]
    - [7, 88.529]
  - - [4096, 3452, 1, 1024]
    - [7, 91.565]
  - - [4096, 3293, 1, 1024]
    - [7, 87.735]
  - - [1024, 3369, 1, 4096]
    - [7, 86.959]
  - - [1024, 3544, 1, 4096]
    - [22, 80.859]
  - - [4096, 3493, 1, 1024]
    - [7, 89.107]
  - - [4096, 3350, 1, 1024]
    - [7, 88.935]
  - - [4096, 3256, 1, 1024]
    - [7, 86.756]
  - - [1024, 3870, 1, 4096]
    - [23, 86.323]
  - - [4096, 4012, 1, 1024]
    - [7, 88.732]
  - - [1024, 3280, 1, 4096]
    - [40, 84.798]
  - - [4096, 3456, 1, 1024]
    - [7, 91.755]
  - - [1024, 3555, 1, 4096]
    - [6, 81.17]
  - - [4096, 3014, 1, 1024]
    - [7, 87.162]
  - - [1024, 3474, 1, 4096]
    - [22, 79.474]
  - - [4096, 3367, 1, 1024]
    - [7, 89.21]
  - - [4096, 3432, 1, 1024]
    - [7, 91.096]
  - - [4096, 3273, 1, 1024]
    - [7, 87.185]
  - - [4096, 3130, 1, 1024]
    - [7, 87.153]
  - - [1024, 2984, 1, 4096]
    - [35, 80.304]
  - - [1024, 3995, 1, 1024]
    - [22, 83.733]
  - - [1024, 3517, 1, 4096]
    - [35, 80.471]
  - - [1024, 3455, 1, 4096]
    - [7, 88.962]
  - - [1024, 3939, 1, 4096]
    - [23, 87.965]
  - - [4096, 3147, 1, 1024]
    - [7, 87.591]
  - - [4096, 3516, 1, 1024]
    - [7, 89.689]
  - - [1024, 3876, 1, 4096]
    - [7, 86.395]
  - - [1024, 3191, 1, 4096]
    - [28, 83.038]
  - - [4096, 3411, 1, 1024]
    - [7, 90.555]
  - - [1024, 3337, 1, 4096]
    - [7, 85.944]
  - - [1024, 3512, 1, 4096]
    - [6, 80.187]
  - - [4096, 3301, 1, 1024]
    - [7, 87.816]
  - - [1024, 3450, 1, 4096]
    - [23, 88.746]
  - - [4096, 3533, 1, 1024]
    - [7, 90.059]
  - - [4096, 3390, 1, 1024]
    - [7, 89.824]
  - - [4096, 3231, 1, 1024]
    - [7, 86.224]
  - - [1024, 2499, 1, 4096]
    - [22, 80.909]
  - - [1024, 3186, 1, 4096]
    - [28, 82.844]
  - - [1024, 3380, 1, 4096]
    - [23, 87.225]
  - - [4096, 3496, 1, 1024]
    - [7, 89.296]
  - - [1024, 3956, 1, 33708]
    - [7, 88.006]
  - - [1024, 3976, 1, 1024]
    - [35, 83.246]
  - - [4096, 2736, 1, 1024]
    - [7, 86.954]
  - - [1024, 3291, 1, 4096]
    - [40, 85.226]
  - - [1024, 3944, 1, 33708]
    - [7, 87.627]
  - - [1024, 3485, 1, 4096]
    - [35, 79.663]
  - - [4096, 3138, 1, 1024]
    - [7, 87.266]
  - - [1024, 3423, 1, 4096]
    - [23, 88.213]
  - - [1024, 3491, 1, 4096]
    - [22, 79.826]
  - - [1024, 3860, 1, 4096]
    - [7, 86.237]
  - - [4096, 3211, 1, 1024]
    - [7, 85.434]
  - - [1024, 3221, 1, 4096]
    - [40, 83.729]
  - - [1024, 2917, 1, 4096]
    - [6, 78.549]
  - - [4096, 3475, 1, 1024]
    - [7, 88.786]
  - - [4096, 3524, 1, 1024]
    - [7, 89.91]
  - - [4096, 2985, 1, 1024]
    - [7, 86.544]
  - - [1024, 3480, 1, 4096]
    - [22, 79.673]
  - - [4096, 3222, 1, 1024]
    - [7, 85.98]
  - - [4096, 3451, 1, 1024]
    - [7, 91.471]
  - - [1024, 3969, 1, 33708]
    - [14, 84.423]
  - - [1024, 3640, 1, 1024]
    - [35, 81.527]
  - - [1024, 3297, 1, 4096]
    - [28, 85.393]
  - - [4096, 3944, 1, 1024]
    - [7, 90.099]
  - - [1024, 3216, 1, 4096]
    - [40, 83.517]
  - - [4096, 3349, 1, 1024]
    - [7, 88.728]
  - - [4096, 3398, 1, 1024]
    - [7, 90.068]
  - - [1024, 3154, 1, 4096]
    - [40, 82.005]
  - - [1024, 3978, 1, 33708]
    - [14, 84.568]
  - - [1024, 3348, 1, 4096]
    - [23, 86.242]
  - - [4096, 3304, 1, 1024]
    - [7, 88.015]
  - - [4096, 4030, 1, 1024]
    - [7, 89.31]
  - - [1024, 4026, 1, 1024]
    - [35, 84.306]
  - - [4096, 3471, 1, 1024]
    - [7, 88.71]
  - - [1024, 3259, 1, 4096]
    - [40, 84.59]
  - - [1024, 3308, 1, 4096]
    - [40, 85.885]
  - - [4096, 3391, 1, 1024]
    - [7, 89.937]
  - - [1024, 3312, 1, 4096]
    - [40, 85.845]
  - - [1024, 3502, 1, 4096]
    - [22, 80.101]
  - - [1024, 3968, 1, 33708]
    - [7, 88.177]
  - - [1024, 3424, 1, 4096]
    - [23, 88.001]
  - - [4096, 4032, 1, 1024]
    - [7, 88.989]
  - - [1024, 3900, 1, 1024]
    - [36, 84.288]
  - - [4096, 3442, 1, 1024]
    - [7, 91.326]
  - - [1024, 3366, 1, 4096]
    - [23, 86.738]
  - - [4096, 3999, 1, 1024]
    - [7, 88.493]
  - - [1024, 3477, 1, 4096]
    - [22, 79.546]
  - - [1024, 2505, 1, 4096]
    - [22, 80.954]
  - - [4096, 3515, 1, 1024]
    - [7, 89.634]
  - - [1024, 3564, 1, 4096]
    - [22, 81.337]
  - - [4096, 3057, 1, 1024]
    - [7, 88.461]
  - - [1024, 3339, 1, 4096]
    - [23, 86.156]
  - - [4096, 3262, 1, 1024]
    - [7, 86.833]
  - - [1024, 4030, 1, 4096]
    - [22, 85.511]
  - - [1024, 3265, 1, 4096]
    - [28, 84.816]
  - - [1024, 3459, 1, 4096]
    - [22, 79.136]
  - - [4096, 3462, 1, 1024]
    - [7, 88.249]
  - - [1024, 3513, 1, 4096]
    - [22, 80.304]
  - - [1024, 3397, 1, 4096]
    - [23, 87.735]
  - - [4096, 3572, 1, 1024]
    - [7, 91.024]
  - - [4096, 3389, 1, 1024]
    - [7, 89.846]
  - - [4096, 3438, 1, 1024]
    - [7, 91.209]
  - - [1024, 3640, 1, 33708]
    - [14, 83.169]
  - - [1024, 3995, 1, 33708]
    - [14, 84.96]
  - - [1024, 3165, 1, 4096]
    - [40, 82.046]
  - - [4096, 3543, 1, 1024]
    - [7, 90.302]
  - - [4096, 3352, 1, 1024]
    - [7, 88.822]
  - - [1024, 3359, 1, 4096]
    - [23, 86.584]
  - - [1024, 3470, 1, 4096]
    - [6, 79.289]
  - - [1024, 3392, 1, 4096]
    - [23, 87.631]
  - - [4096, 3137, 1, 1024]
    - [7, 87.383]
  - - [4096, 3506, 1, 1024]
    - [7, 89.422]
  - - [1024, 3095, 1, 4096]
    - [22, 83.092]
  - - [1024, 3859, 1, 4096]
    - [23, 85.984]
  - - [4096, 3369, 1, 1024]
    - [7, 89.359]
  - - [1024, 3435, 1, 4096]
    - [23, 88.52]
  - - [1024, 3354, 1, 4096]
    - [23, 86.67]
  - - [1024, 3055, 1, 4096]
    - [22, 82.158]
  - - [4096, 3523, 1, 1024]
    - [7, 89.833]
  - - [4096, 3380, 1, 1024]
    - [7, 89.81]
  - - [1024, 3233, 1, 4096]
    - [40, 83.986]
  - - [4096, 3221, 1, 1024]
    - [7, 86.088]
  - - [4096, 3270, 1, 1024]
    - [7, 87.171]
  - - [4096, 3593, 1, 1024]
    - [7, 88.358]
  - - [1024, 3358, 1, 4096]
    - [23, 86.598]
  - - [1024, 3540, 1, 4096]
    - [22, 80.949]
  - - [4096, 3502, 1, 1024]
    - [7, 89.373]
  - - [4096, 2505, 1, 1024]
    - [7, 88.191]
  - - [4096, 3397, 1, 1024]
    - [7, 90.216]
  - - [1024, 3300, 1, 4096]
    - [40, 85.484]
  - - [4096, 3095, 1, 1024]
    - [7, 86.273]
  - - [1024, 3182, 1, 4096]
    - [40, 82.759]
  - - [1024, 3299, 1, 4096]
    - [13, 85.705]
  - - [1024, 3276, 1, 4096]
    - [13, 85.186]
  - - [1024, 3360, 1, 4096]
    - [23, 86.788]
  - - [4096, 3360, 1, 1024]
    - [7, 89.174]
  - - [4096, 2918, 1, 1024]
    - [7, 88.669]
  - - [1024, 3939, 1, 33708]
    - [7, 87.595]
  - - [4096, 3314, 1, 1024]
    - [7, 88.042]
  - - [1024, 3319, 1, 4096]
    - [40, 85.966]
  - - [1024, 3942, 1, 1024]
    - [7, 85.398]
  - - [1024, 3465, 1, 4096]
    - [22, 79.289]
  - - [4096, 3546, 1, 1024]
    - [7, 90.379]
  - - [1024, 3403, 1, 4096]
    - [23, 87.676]
  - - [1024, 3948, 1, 1024]
    - [23, 85.772]
  - - [4096, 3441, 1, 1024]
    - [7, 91.051]
  - - [1024, 3139, 1, 4096]
    - [40, 81.468]
  - - [1024, 3563, 1, 4096]
    - [22, 81.477]
  - - [1024, 3508, 1, 4096]
    - [22, 80.173]
  - - [1024, 3975, 1, 33708]
    - [14, 84.581]
  - - [1024, 3446, 1, 4096]
    - [7, 88.592]
  - - [1024, 3529, 1, 4096]
    - [22, 80.602]
  - - [4096, 3461, 1, 1024]
    - [7, 88.24]
  - - [1024, 3574, 1, 4096]
    - [6, 81.468]
  - - [1024, 3101, 1, 4096]
    - [6, 83.192]
  - - [1024, 3927, 1, 1024]
    - [23, 85.439]
  - - [4096, 3224, 1, 1024]
    - [7, 85.881]
  - - [4096, 3437, 1, 1024]
    - [7, 91.204]
  - - [4096, 3900, 1, 1024]
    - [7, 89.269]
  - - [1024, 3495, 1, 4096]
    - [6, 79.871]
  - - [1024, 3977, 1, 33708]
    - [14, 84.441]
  - - [1024, 3328, 1, 4096]
    - [13, 86.553]
  - - [4096, 3168, 1, 1024]
    - [7, 88.042]
  - - [1024, 4026, 1, 33708]
    - [14, 85.502]
  - - [1024, 3292, 1, 4096]
    - [40, 85.204]
  - - [1024, 3294, 1, 4096]
    - [13, 85.529]
  - - [4096, 3335, 1, 1024]
    - [7, 88.479]
  - - [4096, 3400, 1, 1024]
    - [7, 90.289]
  - - [1024, 3287, 1, 4096]
    - [40, 85.127]
  - - [1024, 3910, 1, 4096]
    - [23, 87.347]
  - - [1024, 3780, 1, 1024]
    - [23, 82.348]
  - - [4096, 3098, 1, 1024]
    - [7, 86.291]
  - - [1024, 3584, 1, 33708]
    - [29, 81.973]
  - - [1024, 3371, 1, 4096]
    - [7, 86.738]
  - - [1024, 3546, 1, 4096]
    - [22, 81.085]
  - - [1024, 4012, 1, 1024]
    - [22, 83.977]
  - - [4096, 3505, 1, 1024]
    - [7, 89.422]
  - - [4096, 3554, 1, 1024]
    - [7, 90.74]
  - - [4096, 3063, 1, 1024]
    - [7, 88.619]
  - - [1024, 3900, 1, 33708]
    - [1, 86.788]
  - - [1024, 3345, 1, 4096]
    - [23, 85.998]
  - - [1024, 3357, 1, 4096]
    - [23, 86.751]
  - - [1024, 3282, 1, 4096]
    - [28, 85.276]
  - - [4096, 3484, 1, 1024]
    - [7, 88.813]
  - - [1024, 3557, 1, 4096]
    - [6, 81.161]
  - - [1024, 3476, 1, 4096]
    - [22, 79.442]
  - - [1024, 3751, 1, 1024]
    - [23, 81.513]
  - - [4096, 3379, 1, 1024]
    - [7, 89.513]
  - - [4096, 3428, 1, 1024]
    - [7, 90.974]
  - - [4096, 3126, 1, 1024]
    - [7, 87.018]
  - - [1024, 3325, 1, 4096]
    - [40, 86.242]
  - - [4096, 3501, 1, 1024]
    - [7, 89.382]
  - - [4096, 3358, 1, 1024]
    - [7, 89.098]
  - - [1024, 3441, 1, 4096]
    - [7, 88.737]
  - - [1024, 3552, 1, 4096]
    - [22, 81.22]
  - - [4096, 3232, 1, 1024]
    - [7, 86.219]
  - - [1024, 3412, 1, 4096]
    - [7, 88.055]
  - - [1024, 3372, 1, 4096]
    - [23, 87.162]
  - - [1024, 3585, 1, 4096]
    - [22, 81.879]
  - - [4096, 3143, 1, 1024]
    - [7, 87.577]
  - - [4096, 3464, 1, 1024]
    - [7, 88.403]
  - - [1024, 3145, 1, 4096]
    - [28, 81.856]
  - - [4096, 3375, 1, 1024]
    - [7, 89.689]
  - - [4096, 2917, 1, 1024]
    - [7, 88.615]
  - - [4096, 3978, 1, 1024]
    - [7, 88.127]
  - - [1024, 2765, 1, 4096]
    - [23, 84.658]
  - - [1024, 3452, 1, 4096]
    - [23, 88.98]
  - - [4096, 3584, 1, 1024]
    - [7, 91.75]
  - - [4096, 3545, 1, 1024]
    - [7, 90.465]
  - - [1024, 3352, 1, 4096]
    - [23, 86.305]
  - - [4096, 3292, 1, 1024]
    - [7, 87.658]
  - - [1024, 3525, 1, 4096]
    - [22, 80.512]
  - - [1024, 3266, 1, 4096]
    - [13, 84.911]
  - - [1024, 3382, 1, 4096]
    - [23, 87.261]
  - - [4096, 3492, 1, 1024]
    - [7, 89.088]
  - - [4096, 3419, 1, 1024]
    - [7, 90.415]
  - - [1024, 3796, 1, 33708]
    - [1, 84.726]
  - - [1024, 3293, 1, 4096]
    - [40, 84.951]
  - - [4096, 3796, 1, 1024]
    - [7, 89.842]
  - - [1024, 3487, 1, 4096]
    - [22, 79.654]
  - - [4096, 3166, 1, 1024]
    - [7, 87.938]
  - - [1024, 3409, 1, 4096]
    - [23, 87.744]
  - - [1024, 3520, 1, 4096]
    - [35, 80.579]
  - - [1024, 3573, 1, 4096]
    - [22, 81.581]
  - - [4096, 3366, 1, 1024]
    - [7, 89.4]
  - - [4096, 3720, 1, 1024]
    - [7, 88.326]
  - - [4096, 3207, 1, 1024]
    - [7, 85.578]
  - - [4096, 3272, 1, 1024]
    - [7, 87.266]
  - - [1024, 3390, 1, 4096]
    - [23, 87.505]
  - - [4096, 3183, 1, 1024]
    - [7, 88.506]
  - - [4096, 3536, 1, 1024]
    - [7, 90.243]
  - - [4096, 3563, 1, 1024]
    - [7, 90.735]
  - - [1024, 3482, 1, 4096]
    - [6, 79.623]
  - - [4096, 3447, 1, 1024]
    - [7, 91.245]
  - - [4096, 3955, 1, 1024]
    - [7, 90.374]
  - - [4096, 4005, 1, 1024]
    - [7, 88.457]
  - - [1024, 3493, 1, 4096]
    - [6, 79.853]
  - - [4096, 3410, 1, 1024]
    - [7, 90.419]
  - - [1024, 3422, 1, 4096]
    - [7, 88.042]
  - - [1024, 3350, 1, 4096]
    - [7, 86.368]
  - - [4096, 3300, 1, 1024]
    - [7, 87.803]
  - - [4096, 3910, 1, 1024]
    - [7, 89.296]
  - - [1024, 3489, 1, 4096]
    - [22, 79.763]
  - - [4096, 3483, 1, 1024]
    - [7, 88.728]
  - - [4096, 3532, 1, 1024]
    - [7, 90.104]
  - - [4096, 3230, 1, 1024]
    - [7, 85.993]
  - - [4096, 3427, 1, 1024]
    - [7, 90.974]
  - - [1024, 3377, 1, 4096]
    - [23, 87.126]
  - - [1024, 3488, 1, 4096]
    - [22, 79.754]
  - - [1024, 3616, 1, 4096]
    - [22, 82.425]
  - - [1024, 3426, 1, 4096]
    - [23, 88.299]
  - - [4096, 3357, 1, 1024]
    - [7, 88.985]
  - - [4096, 3406, 1, 1024]
    - [7, 90.253]
  - - [1024, 3046, 1, 4096]
    - [6, 81.802]
  - - [1024, 3272, 1, 4096]
    - [40, 84.811]
  - - [1024, 3256, 1, 4096]
    - [28, 84.613]
  - - [4096, 3247, 1, 1024]
    - [7, 86.548]
  - - [4096, 3088, 1, 1024]
    - [7, 85.971]
  - - [1024, 3531, 1, 4096]
    - [35, 80.593]
  - - [4096, 3511, 1, 1024]
    - [7, 89.598]
  - - [1024, 3720, 1, 33708]
    - [1, 82.885]
  - - [1024, 3267, 1, 4096]
    - [40, 84.509]
  - - [1024, 3270, 1, 4096]
    - [13, 84.911]
  - - [1024, 3461, 1, 4096]
    - [22, 79.266]
  - - [4096, 3474, 1, 1024]
    - [7, 88.606]
  - - [4096, 2984, 1, 1024]
    - [7, 86.544]
  - - [1024, 3399, 1, 4096]
    - [23, 87.645]
  - - [4096, 3574, 1, 1024]
    - [7, 90.943]
  - - [1024, 3876, 1, 1024]
    - [7, 84.175]
  - - [4096, 3337, 1, 1024]
    - [7, 88.637]
  - - [4096, 3450, 1, 1024]
    - [7, 91.561]
  - - [1024, 3720, 1, 1024]
    - [23, 81.148]
  - - [1024, 4059, 1, 1024]
    - [22, 80.065]
  - - [4096, 3291, 1, 1024]
    - [7, 87.591]
  - - [4096, 3995, 1, 1024]
    - [7, 88.439]
  - - [4096, 3491, 1, 1024]
    - [7, 89.134]
  - - [4096, 3348, 1, 1024]
    - [7, 88.958]
  - - [4096, 3925, 1, 1024]
    - [7, 89.693]
  - - [4096, 3894, 1, 1024]
    - [7, 89.025]
  - - [1024, 3456, 1, 4096]
    - [23, 89.161]
  - - [1024, 3394, 1, 4096]
    - [23, 87.564]
  - - [4096, 3165, 1, 1024]
    - [7, 87.979]
  - - [4096, 3470, 1, 1024]
    - [7, 88.66]
  - - [1024, 3014, 1, 4096]
    - [6, 80.958]
  - - [1024, 3375, 1, 4096]
    - [23, 87.225]
  - - [4096, 3859, 1, 1024]
    - [7, 88.155]
  - - [4096, 3365, 1, 1024]
    - [7, 89.418]
  - - [1024, 3162, 1, 4096]
    - [28, 82.217]
  - - [1024, 3840, 1, 33708]
    - [1, 85.628]
  - - [1024, 3437, 1, 4096]
    - [7, 88.394]
  - - [4096, 3319, 1, 1024]
    - [7, 88.263]
  - - [1024, 3320, 1, 4096]
    - [40, 85.948]
  - - [4096, 3328, 1, 1024]
    - [7, 88.885]
  - - [1024, 3235, 1, 4096]
    - [40, 83.995]
  - - [4096, 3282, 1, 1024]
    - [7, 87.356]
  - - [1024, 3367, 1, 4096]
    - [23, 86.63]
  - - [1024, 3542, 1, 4096]
    - [22, 81.003]
  - - [4096, 3145, 1, 1024]
    - [7, 87.582]
  - - [4096, 3514, 1, 1024]
    - [7, 89.729]
  - - [1024, 3432, 1, 4096]
    - [23, 88.52]
  - - [4096, 3409, 1, 1024]
    - [7, 90.474]
  - - [1024, 4012, 1, 33708]
    - [14, 85.267]
  - - [4096, 3876, 1, 1024]
    - [7, 88.57]
  - - [4096, 3299, 1, 1024]
    - [7, 87.78]
  - - [1024, 3168, 1, 4096]
    - [40, 82.316]
  - - [4096, 3681, 1, 1024]
    - [7, 90.302]
  - - [4096, 3531, 1, 1024]
    - [7, 89.869]
  - - [4096, 3388, 1, 1024]
    - [7, 89.81]
  - - [1024, 3720, 1, 4096]
    - [7, 83.052]
  - - [1024, 3332, 1, 4096]
    - [23, 86.043]
  - - [1024, 3273, 1, 4096]
    - [13, 85.041]
  - - [1024, 2935, 1, 4096]
    - [6, 79.072]
  - - [1024, 3467, 1, 4096]
    - [6, 79.28]
  - - [4096, 3542, 1, 1024]
    - [7, 90.262]
  - - [1024, 3130, 1, 4096]
    - [22, 84.017]
  - - [1024, 3405, 1, 4096]
    - [23, 87.902]
  - - [1024, 3960, 1, 1024]
    - [7, 85.678]
  - - [4096, 3405, 1, 1024]
    - [7, 90.428]
  - - [1024, 10080, 1, 1024]
    - [7, 88.714]
  - - [36548, 1216, 1, 1024]
    - [36, 87.284]
  - - [1024, 2592, 1, 1024]
    - [36, 76.717]
  - - [1024, 1568, 1, 1024]
    - [24, 74.66]
  - - [1024, 4445, 1, 1024]
    - [23, 85.109]
  - - [1024, 6272, 1, 1024]
    - [23, 89.043]
  - - [36548, 3584, 1, 1024]
    - [36, 92.982]
  - - [1024, 1827, 1, 1024]
    - [35, 74.407]
  - - [1024, 3220, 1, 1024]
    - [23, 81.071]
  - - [1024, 1856, 1, 1024]
    - [22, 76.036]
  - - [1024, 1760, 1, 1024]
    - [35, 71.791]
  - - [36548, 4235, 1, 1024]
    - [36, 90.478]
  - - [1024, 1984, 1, 1024]
    - [22, 80.873]
  - - [1024, 14720, 1, 1024]
    - [23, 90.465]
  - - [1024, 1152, 1, 1024]
    - [24, 79.009]
  - - [36548, 14976, 1, 1024]
    - [36, 93.293]
  - - [36548, 1152, 1, 1024]
    - [4, 91.209]
  - - [1024, 3392, 1, 1024]
    - [7, 83.061]
  - - [1024, 1408, 1, 1024]
    - [22, 78.017]
  - - [1024, 2080, 1, 1024]
    - [9, 76.519]
  - - [1024, 1824, 1, 1024]
    - [22, 74.362]
  - - [36548, 2432, 1, 1024]
    - [36, 92.418]
  - - [36548, 1827, 1, 1024]
    - [36, 87.884]
  - - [1024, 10176, 1, 1024]
    - [23, 89.138]
  - - [1024, 1952, 1, 1024]
    - [35, 79.104]
  - - [1024, 17024, 1, 1024]
    - [7, 90.383]
  - - [1024, 1472, 1, 1024]
    - [24, 69.932]
  - - [36548, 4459, 1, 1024]
    - [36, 92.445]
  - - [1024, 3712, 1, 1024]
    - [35, 83.544]
  - - [36548, 12928, 1, 1024]
    - [36, 93.244]
  - - [1024, 1632, 1, 1024]
    - [24, 76.28]
  - - [1024, 1696, 1, 1024]
    - [22, 79.095]
  - - [36548, 1764, 1, 1024]
    - [36, 90.65]
  - - [1024, 2944, 1, 1024]
    - [35, 78.378]
  - - [36548, 14080, 1, 1024]
    - [36, 93.257]
  - - [1024, 1280, 1, 1024]
    - [6, 70.843]
  - - [1024, 13440, 1, 1024]
    - [23, 89.206]
  - - [36548, 9120, 1, 1024]
    - [36, 92.301]
  - - [1024, 3008, 1, 1024]
    - [6, 79.894]
  - - [1024, 2560, 1, 1024]
    - [35, 81.5]
  - - [1024, 2208, 1, 1024]
    - [7, 80.8]
  - - [1024, 1920, 1, 1024]
    - [22, 78.603]
  - - [36548, 2496, 1, 1024]
    - [36, 90.415]
  - - [1024, 2016, 1, 1024]
    - [23, 73.401]
  - - [1024, 1184, 1, 1024]
    - [6, 65.253]
  - - [1024, 1664, 1, 1024]
    - [8, 79.388]
  - - [1024, 11424, 1, 1024]
    - [23, 90.555]
  - - [1024, 1216, 1, 1024]
    - [6, 67.969]
  - - [36548, 3185, 1, 1024]
    - [36, 92.378]
  - - [36548, 9216, 1, 1024]
    - [36, 93.253]
  - - [1024, 3200, 1, 1024]
    - [7, 80.697]
  - - [1024, 2656, 1, 1024]
    - [36, 78.346]
  - - [1024, 2368, 1, 1024]
    - [22, 76.126]
  - - [1024, 4459, 1, 1024]
    - [7, 85.479]
  - - [1024, 3808, 1, 1024]
    - [23, 82.912]
  - - [1024, 2336, 1, 1024]
    - [35, 74.371]
  - - [1024, 2304, 1, 1024]
    - [28, 85.475]
  - - [1024, 1560, 1, 1024]
    - [24, 74.353]
  - - [1024, 2496, 1, 1024]
    - [35, 79.582]
  - - [1024, 1504, 1, 1024]
    - [24, 71.281]
  - - [1024, 3232, 1, 1024]
    - [23, 81.391]
  - - [36548, 1015, 1, 1024]
    - [36, 90.898]
  - - [1024, 2000, 1, 1024]
    - [23, 72.941]
  - - [36548, 243, 1, 1024]
    - [11, 83.814]
  - - [1024, 13184, 1, 1024]
    - [23, 91.11]
  - - [1024, 2688, 1, 1024]
    - [7, 80.354]
  - - [36548, 950, 1, 1024]
    - [29, 85.786]
  - - [1024, 1764, 1, 1024]
    - [35, 71.66]
  - - [1024, 1376, 1, 1024]
    - [6, 75.657]
  - - [36548, 774, 1, 1024]
    - [29, 80.602]
  - - [1024, 4256, 1, 1024]
    - [35, 83.097]
  - - [36548, 3712, 1, 1024]
    - [36, 92.833]
  - - [1024, 3360, 1, 1024]
    - [7, 82.294]
  - - [1024, 2784, 1, 1024]
    - [23, 82.339]
  - - [1024, 4992, 1, 1024]
    - [23, 86.102]
  - - [36548, 1102, 1, 1024]
    - [36, 87.694]
  - - [1024, 1536, 1, 1024]
    - [8, 73.103]
  - - [1024, 2720, 1, 1024]
    - [36, 80.304]
  - - [1024, 2752, 1, 1024]
    - [23, 81.617]
  - - [1024, 2816, 1, 1024]
    - [23, 83.882]
  - - [1024, 2624, 1, 1024]
    - [23, 78.066]
  - - [1024, 2144, 1, 1024]
    - [25, 78.554]
  - - [36548, 1131, 1, 1024]
    - [19, 89.738]
  - - [1024, 3296, 1, 1024]
    - [23, 81.017]
  - - [36548, 4992, 1, 1024]
    - [36, 93.099]
  - - [1024, 1344, 1, 1024]
    - [22, 73.866]
  - - [36548, 2401, 1, 1024]
    - [36, 91.164]
  - - [1024, 15744, 1, 1024]
    - [36, 89.716]
  - - [1024, 15232, 1, 1024]
    - [23, 90.406]
  - - [1024, 1888, 1, 1024]
    - [35, 76.654]
  - - [1024, 1792, 1, 1024]
    - [22, 73.694]
  - - [36548, 1073, 1, 1024]
    - [36, 85.637]
  - - [36548, 15488, 1, 1024]
    - [36, 93.235]
  - - [1024, 2464, 1, 1024]
    - [35, 78.351]
  - - [1024, 2272, 1, 1024]
    - [23, 82.781]
  - - [1024, 2432, 1, 1024]
    - [35, 77.71]
  - - [1024, 3936, 1, 1024]
    - [7, 85.587]
  - - [36548, 13824, 1, 1024]
    - [36, 93.298]
  - - [1024, 2401, 1, 1024]
    - [35, 76.388]
  - - [1024, 2176, 1, 1024]
    - [23, 80.615]
  - - [1024, 2240, 1, 1024]
    - [7, 81.793]
  - - [1024, 1728, 1, 1024]
    - [22, 81.166]
  - - [1024, 2528, 1, 1024]
    - [35, 80.408]
  - - [1024, 2400, 1, 1024]
    - [35, 76.677]
  - - [1024, 1440, 1, 1024]
    - [24, 68.912]
  - - [1024, 2912, 1, 1024]
    - [22, 77.299]
  - - [1024, 2880, 1, 1024]
    - [22, 83.467]
  - - [1024, 4064, 1, 1024]
    - [35, 80.142]
  - - [1024, 4655, 1, 1024]
    - [22, 80.891]
  - - [36548, 6272, 1, 1024]
    - [36, 93.167]
  - - [768, 2048, 1, 3072]
    - [276, 76.427]
  - - [768, 4096, 1, 3072]
    - [22, 82.483]
  - - [6272, 256, 1, 528]
    - [16, 74.646]
  - - [3136, 2048, 1, 1024]
    - [23, 82.411]
  - - [50176, 128, 1, 256]
    - [36, 86.174]
  - - [12544, 1024, 1, 256]
    - [30, 88.89]
  - - [12544, 256, 1, 1024]
    - [0, 83.638]
  - - [3136, 512, 1, 1024]
    - [8, 74.868]
  - - [3136, 2048, 1, 512]
    - [23, 81.446]
  - - [289, 384, 32, 1024]
    - [23, 65.948]
  - - [4096, 512, 1, 4096]
    - [21, 79.239]
  - - [50176, 512, 1, 256]
    - [1, 89.959]
  - - [12544, 1024, 1, 512]
    - [1, 90.212]
  - - [12544, 256, 1, 512]
    - [14, 82.718]
  - - [784, 128, 32, 256]
    - [22, 67.829]
  - - [4096, 512, 1, 9216]
    - [21, 79.889]
  - - [3136, 512, 1, 2048]
    - [16, 75.788]
  - - [1225, 192, 32, 384]
    - [29, 80.751]
  - - [8192, 320, 1, 1280]
    - [14, 82.267]
  - - [8192, 320, 1, 2048]
    - [0, 82.456]
  - - [8192, 384, 1, 1280]
    - [0, 82.1]
  - - [8192, 384, 1, 2048]
    - [0, 82.357]
  - - [8192, 448, 1, 2048]
    - [14, 81.816]
  - - [8192, 448, 1, 1280]
    - [14, 81.549]
  - - [256, 6400, 1, 4096]
    - [23, 77.8]
  - - [512, 3433, 1, 2048]
    - [37, 82.668]
  - - [512, 3439, 1, 2048]
    - [24, 82.849]
  - - [512, 3461, 1, 2048]
    - [35, 71.894]
  - - [512, 3479, 1, 2048]
    - [22, 72.255]
  - - [512, 3494, 1, 2048]
    - [6, 72.458]
  - - [512, 3520, 1, 2048]
    - [6, 73.212]
  - - [512, 3530, 1, 2048]
    - [22, 73.266]
  - - [512, 3541, 1, 2048]
    - [35, 73.347]
  - - [512, 3564, 1, 2048]
    - [22, 73.83]
  - - [512, 3776, 1, 2048]
    - [35, 78.26]
  - - [512, 3859, 1, 512]
    - [6, 76.095]
  - - [512, 3925, 1, 2048]
    - [35, 80.958]
  - - [512, 3944, 1, 2048]
    - [6, 81.428]
  - - [512, 3955, 1, 2048]
    - [22, 81.549]
  - - [512, 3969, 1, 2048]
    - [13, 75.571]
  - - [512, 3976, 1, 2048]
    - [13, 75.72]
  - - [2048, 1232, 1, 512]
    - [29, 77.322]
  - - [2048, 3165, 1, 512]
    - [29, 81.892]
  - - [512, 2387, 1, 512]
    - [35, 64.31]
  - - [512, 2418, 1, 512]
    - [35, 64.73]
  - - [512, 2418, 1, 2048]
    - [35, 68.222]
  - - [512, 2496, 1, 512]
    - [35, 68.398]
  - - [512, 2496, 1, 2048]
    - [6, 70.658]
  - - [512, 2790, 1, 2048]
    - [6, 78.287]
  - - [512, 2864, 1, 2048]
    - [8, 69.729]
  - - [512, 3092, 1, 2048]
    - [8, 75.084]
  - - [512, 3113, 1, 2048]
    - [37, 75.607]
  - - [512, 3137, 1, 2048]
    - [37, 75.995]
  - - [512, 3165, 1, 2048]
    - [24, 76.668]
  - - [512, 3166, 1, 2048]
    - [24, 76.857]
  - - [512, 3194, 1, 2048]
    - [8, 77.344]
  - - [512, 3219, 1, 2048]
    - [8, 78.08]
  - - [512, 3222, 1, 2048]
    - [24, 77.994]
  - - [512, 3234, 1, 2048]
    - [36, 78.229]
  - - [512, 3237, 1, 2048]
    - [8, 78.459]
  - - [512, 3242, 1, 2048]
    - [37, 78.558]
  - - [512, 3246, 1, 2048]
    - [24, 78.581]
  - - [512, 3249, 1, 2048]
    - [24, 78.712]
  - - [512, 3251, 1, 2048]
    - [24, 78.761]
  - - [512, 3257, 1, 2048]
    - [23, 78.784]
  - - [512, 3262, 1, 2048]
    - [8, 79.009]
  - - [512, 3268, 1, 2048]
    - [8, 79.122]
  - - [512, 3282, 1, 2048]
    - [24, 79.429]
  - - [512, 3286, 1, 2048]
    - [8, 79.479]
  - - [512, 3287, 1, 2048]
    - [8, 79.519]
  - - [512, 3293, 1, 2048]
    - [8, 79.645]
  - - [512, 3297, 1, 2048]
    - [24, 79.668]
  - - [512, 3307, 1, 2048]
    - [37, 79.943]
  - - [512, 3314, 1, 2048]
    - [37, 79.984]
  - - [512, 3315, 1, 2048]
    - [8, 80.128]
  - - [512, 3319, 1, 2048]
    - [8, 79.966]
  - - [512, 3322, 1, 2048]
    - [37, 80.11]
  - - [512, 3323, 1, 2048]
    - [36, 80.083]
  - - [512, 3324, 1, 2048]
    - [23, 80.2]
  - - [512, 3325, 1, 2048]
    - [24, 80.304]
  - - [512, 3327, 1, 2048]
    - [8, 80.255]
  - - [512, 3329, 1, 2048]
    - [37, 80.543]
  - - [512, 3332, 1, 2048]
    - [24, 80.597]
  - - [512, 3336, 1, 2048]
    - [8, 80.579]
  - - [512, 3339, 1, 2048]
    - [37, 80.719]
  - - [512, 3342, 1, 2048]
    - [8, 80.846]
  - - [512, 3344, 1, 2048]
    - [8, 80.814]
  - - [512, 3358, 1, 2048]
    - [8, 81.076]
  - - [512, 3360, 1, 2048]
    - [37, 81.202]
  - - [512, 3364, 1, 2048]
    - [8, 81.197]
  - - [512, 3365, 1, 2048]
    - [37, 81.306]
  - - [512, 3369, 1, 2048]
    - [24, 81.351]
  - - [512, 3370, 1, 2048]
    - [8, 81.428]
  - - [512, 3371, 1, 2048]
    - [37, 81.36]
  - - [512, 3374, 1, 2048]
    - [8, 81.563]
  - - [512, 3376, 1, 2048]
    - [37, 81.554]
  - - [512, 3377, 1, 2048]
    - [8, 81.545]
  - - [512, 3378, 1, 2048]
    - [37, 81.608]
  - - [512, 3381, 1, 2048]
    - [37, 81.685]
  - - [512, 3382, 1, 2048]
    - [8, 81.834]
  - - [512, 3383, 1, 2048]
    - [24, 81.757]
  - - [512, 3384, 1, 2048]
    - [37, 81.689]
  - - [512, 3385, 1, 2048]
    - [8, 81.712]
  - - [512, 3386, 1, 2048]
    - [8, 81.789]
  - - [512, 3388, 1, 2048]
    - [24, 81.852]
  - - [512, 3390, 1, 2048]
    - [8, 81.793]
  - - [512, 3391, 1, 2048]
    - [8, 81.716]
  - - [512, 3396, 1, 2048]
    - [37, 82.145]
  - - [512, 3399, 1, 2048]
    - [24, 82.032]
  - - [512, 3402, 1, 2048]
    - [24, 82.249]
  - - [512, 3410, 1, 2048]
    - [24, 82.181]
  - - [512, 3412, 1, 2048]
    - [37, 82.163]
  - - [512, 3414, 1, 2048]
    - [37, 82.389]
  - - [512, 3415, 1, 2048]
    - [37, 82.51]
  - - [512, 3418, 1, 2048]
    - [24, 82.384]
  - - [512, 3420, 1, 2048]
    - [24, 82.506]
  - - [512, 3422, 1, 2048]
    - [24, 82.614]
  - - [512, 3425, 1, 2048]
    - [24, 82.601]
  - - [512, 3426, 1, 2048]
    - [37, 82.619]
  - - [512, 3427, 1, 2048]
    - [37, 82.592]
  - - [512, 3428, 1, 2048]
    - [8, 82.546]
  - - [512, 3430, 1, 2048]
    - [8, 82.506]
  - - [512, 3431, 1, 2048]
    - [24, 82.808]
  - - [512, 3432, 1, 2048]
    - [8, 82.957]
  - - [512, 3438, 1, 2048]
    - [24, 82.88]
  - - [512, 3440, 1, 2048]
    - [24, 82.804]
  - - [512, 3443, 1, 2048]
    - [37, 83.138]
  - - [512, 3445, 1, 2048]
    - [24, 82.934]
  - - [512, 3447, 1, 2048]
    - [8, 82.795]
  - - [512, 3448, 1, 2048]
    - [37, 82.695]
  - - [512, 3450, 1, 2048]
    - [24, 82.984]
  - - [512, 3451, 1, 2048]
    - [8, 83.119]
  - - [512, 3452, 1, 2048]
    - [8, 82.713]
  - - [512, 3453, 1, 2048]
    - [37, 83.304]
  - - [512, 3455, 1, 2048]
    - [24, 83.192]
  - - [512, 3456, 1, 2048]
    - [37, 83.309]
  - - [512, 3457, 1, 2048]
    - [22, 71.894]
  - - [512, 3458, 1, 2048]
    - [22, 71.908]
  - - [512, 3459, 1, 2048]
    - [35, 71.854]
  - - [512, 3460, 1, 2048]
    - [35, 71.93]
  - - [512, 3462, 1, 2048]
    - [6, 71.921]
  - - [512, 3466, 1, 2048]
    - [22, 72.21]
  - - [512, 3467, 1, 2048]
    - [6, 72.097]
  - - [512, 3468, 1, 2048]
    - [35, 72.219]
  - - [512, 3470, 1, 2048]
    - [35, 72.021]
  - - [512, 3471, 1, 2048]
    - [22, 72.729]
  - - [512, 3472, 1, 2048]
    - [22, 72.174]
  - - [512, 3475, 1, 2048]
    - [6, 72.097]
  - - [512, 3476, 1, 2048]
    - [22, 72.246]
  - - [512, 3477, 1, 2048]
    - [6, 72.67]
  - - [512, 3478, 1, 2048]
    - [35, 72.156]
  - - [512, 3480, 1, 2048]
    - [22, 72.327]
  - - [512, 3481, 1, 2048]
    - [35, 72.291]
  - - [512, 3483, 1, 2048]
    - [35, 72.364]
  - - [512, 3484, 1, 2048]
    - [6, 72.341]
  - - [512, 3487, 1, 2048]
    - [22, 72.454]
  - - [512, 3489, 1, 2048]
    - [22, 72.413]
  - - [512, 3490, 1, 2048]
    - [6, 72.503]
  - - [512, 3491, 1, 2048]
    - [22, 72.454]
  - - [512, 3493, 1, 2048]
    - [22, 72.345]
  - - [512, 3495, 1, 2048]
    - [22, 72.391]
  - - [512, 3497, 1, 2048]
    - [22, 72.585]
  - - [512, 3498, 1, 2048]
    - [6, 72.607]
  - - [512, 3499, 1, 2048]
    - [22, 72.679]
  - - [512, 3501, 1, 2048]
    - [35, 72.86]
  - - [512, 3503, 1, 2048]
    - [35, 72.86]
  - - [512, 3505, 1, 2048]
    - [6, 72.652]
  - - [512, 3507, 1, 2048]
    - [35, 72.864]
  - - [512, 3508, 1, 2048]
    - [35, 72.733]
  - - [512, 3509, 1, 2048]
    - [22, 73.009]
  - - [512, 3510, 1, 2048]
    - [35, 72.95]
  - - [512, 3511, 1, 2048]
    - [6, 72.864]
  - - [512, 3513, 1, 2048]
    - [6, 72.797]
  - - [512, 3514, 1, 2048]
    - [35, 72.625]
  - - [512, 3515, 1, 2048]
    - [6, 72.946]
  - - [512, 3517, 1, 2048]
    - [6, 72.918]
  - - [512, 3518, 1, 2048]
    - [6, 72.927]
  - - [512, 3519, 1, 2048]
    - [6, 72.801]
  - - [512, 3523, 1, 2048]
    - [6, 73.216]
  - - [512, 3528, 1, 2048]
    - [6, 73.189]
  - - [512, 3529, 1, 2048]
    - [22, 73.117]
  - - [512, 3531, 1, 2048]
    - [22, 73.112]
  - - [512, 3532, 1, 2048]
    - [22, 73.221]
  - - [512, 3533, 1, 2048]
    - [22, 73.334]
  - - [512, 3534, 1, 2048]
    - [22, 73.194]
  - - [512, 3538, 1, 2048]
    - [22, 73.361]
  - - [512, 3539, 1, 2048]
    - [6, 73.338]
  - - [512, 3540, 1, 2048]
    - [22, 73.325]
  - - [512, 3547, 1, 2048]
    - [22, 73.546]
  - - [512, 3548, 1, 2048]
    - [22, 73.541]
  - - [512, 3552, 1, 2048]
    - [22, 73.622]
  - - [512, 3575, 1, 2048]
    - [6, 74.01]
  - - [512, 3598, 1, 2048]
    - [22, 74.597]
  - - [512, 3599, 1, 2048]
    - [22, 74.52]
  - - [512, 3608, 1, 2048]
    - [22, 74.791]
  - - [512, 3776, 1, 512]
    - [35, 76.081]
  - - [512, 3780, 1, 512]
    - [6, 74.836]
  - - [512, 3780, 1, 2048]
    - [6, 78.202]
  - - [512, 3780, 1, 33708]
    - [0, 78.865]
  - - [512, 3796, 1, 512]
    - [22, 72.133]
  - - [512, 3796, 1, 2048]
    - [22, 78.581]
  - - [512, 3796, 1, 33708]
    - [0, 79.095]
  - - [512, 3822, 1, 512]
    - [35, 73.027]
  - - [512, 3822, 1, 2048]
    - [6, 78.725]
  - - [512, 3822, 1, 33708]
    - [14, 79.614]
  - - [512, 3835, 1, 512]
    - [35, 73.464]
  - - [512, 3835, 1, 2048]
    - [22, 79.054]
  - - [512, 3840, 1, 512]
    - [22, 77.29]
  - - [512, 3840, 1, 2048]
    - [22, 79.393]
  - - [512, 3840, 1, 33708]
    - [29, 79.961]
  - - [512, 3859, 1, 2048]
    - [22, 79.451]
  - - [512, 3859, 1, 33708]
    - [22, 80.273]
  - - [512, 3864, 1, 512]
    - [35, 73.852]
  - - [512, 3864, 1, 2048]
    - [35, 79.826]
  - - [512, 3870, 1, 512]
    - [35, 76.487]
  - - [512, 3870, 1, 2048]
    - [35, 79.871]
  - - [512, 3870, 1, 33708]
    - [14, 80.372]
  - - [512, 3876, 1, 512]
    - [6, 73.866]
  - - [512, 3876, 1, 2048]
    - [6, 79.961]
  - - [512, 3876, 1, 33708]
    - [29, 80.471]
  - - [512, 3906, 1, 512]
    - [35, 74.728]
  - - [512, 3906, 1, 2048]
    - [22, 80.701]
  - - [512, 3906, 1, 33708]
    - [0, 81.315]
  - - [512, 3910, 1, 512]
    - [35, 75.12]
  - - [512, 3910, 1, 2048]
    - [35, 80.755]
  - - [512, 3910, 1, 33708]
    - [0, 81.216]
  - - [512, 3925, 1, 512]
    - [35, 74.872]
  - - [512, 3925, 1, 33708]
    - [29, 81.41]
  - - [512, 3927, 1, 512]
    - [22, 75.107]
  - - [512, 3942, 1, 512]
    - [35, 78.071]
  - - [512, 3942, 1, 2048]
    - [6, 81.382]
  - - [512, 3942, 1, 33708]
    - [29, 81.834]
  - - [512, 3944, 1, 512]
    - [35, 75.382]
  - - [512, 3944, 1, 33708]
    - [14, 81.825]
  - - [512, 3955, 1, 512]
    - [22, 75.594]
  - - [512, 3955, 1, 33708]
    - [14, 82.118]
  - - [512, 3968, 1, 512]
    - [35, 79.167]
  - - [512, 3968, 1, 2048]
    - [35, 82.041]
  - - [512, 3968, 1, 33708]
    - [0, 82.393]
  - - [512, 3969, 1, 512]
    - [22, 70.293]
  - - [512, 3969, 1, 33708]
    - [34, 77.809]
  - - [512, 3976, 1, 512]
    - [22, 70.017]
  - - [512, 3976, 1, 33708]
    - [5, 77.936]
  - - [512, 3977, 1, 512]
    - [6, 69.666]
  - - [512, 3977, 1, 2048]
    - [40, 75.639]
  - - [512, 3977, 1, 33708]
    - [21, 78.021]
  - - [512, 3978, 1, 512]
    - [22, 69.869]
  - - [512, 3978, 1, 2048]
    - [13, 75.716]
  - - [512, 3978, 1, 33708]
    - [21, 78.026]
  - - [512, 3990, 1, 512]
    - [22, 70.478]
  - - [512, 3990, 1, 2048]
    - [40, 75.666]
  - - [512, 3990, 1, 33708]
    - [34, 78.278]
  - - [512, 3995, 1, 512]
    - [35, 70.924]
  - - [512, 3995, 1, 2048]
    - [40, 75.829]
  - - [512, 3995, 1, 33708]
    - [21, 78.382]
  - - [512, 3996, 1, 512]
    - [37, 70.518]
  - - [512, 3996, 1, 2048]
    - [40, 75.892]
  - - [512, 3996, 1, 33708]
    - [21, 78.427]
  - - [512, 3999, 1, 512]
    - [22, 70.802]
  - - [512, 3999, 1, 2048]
    - [40, 76.004]
  - - [512, 3999, 1, 33708]
    - [21, 78.441]
  - - [512, 4005, 1, 512]
    - [22, 71.015]
  - - [512, 4005, 1, 2048]
    - [40, 75.914]
  - - [512, 4005, 1, 33708]
    - [21, 78.581]
  - - [512, 4012, 1, 512]
    - [35, 70.992]
  - - [512, 4012, 1, 2048]
    - [13, 76.23]
  - - [512, 4012, 1, 33708]
    - [21, 78.675]
  - - [512, 4020, 1, 512]
    - [37, 71.028]
  - - [512, 4020, 1, 2048]
    - [13, 76.447]
  - - [512, 4020, 1, 33708]
    - [21, 78.878]
  - - [512, 4026, 1, 512]
    - [35, 71.114]
  - - [512, 4026, 1, 2048]
    - [28, 76.392]
  - - [512, 4026, 1, 33708]
    - [34, 78.964]
  - - [512, 4030, 1, 512]
    - [37, 71.267]
  - - [512, 4030, 1, 2048]
    - [13, 76.55]
  - - [512, 4030, 1, 33708]
    - [21, 79.036]
  - - [512, 4032, 1, 512]
    - [35, 71.971]
  - - [512, 4032, 1, 2048]
    - [13, 76.654]
  - - [512, 4032, 1, 33708]
    - [21, 79.104]
  - - [512, 4050, 1, 512]
    - [6, 71.384]
  - - [512, 4059, 1, 512]
    - [36, 72.039]
  - - [2048, 644, 1, 512]
    - [29, 69.273]
  - - [2048, 668, 1, 512]
    - [29, 71.791]
  - - [2048, 714, 1, 512]
    - [29, 65.871]
  - - [2048, 720, 1, 512]
    - [29, 66.476]
  - - [2048, 722, 1, 512]
    - [29, 66.584]
  - - [2048, 781, 1, 512]
    - [29, 71.52]
  - - [2048, 848, 1, 512]
    - [35, 67.721]
  - - [2048, 872, 1, 512]
    - [35, 69.499]
  - - [2048, 936, 1, 512]
    - [6, 74.299]
  - - [2048, 980, 1, 512]
    - [29, 70.162]
  - - [2048, 1139, 1, 512]
    - [29, 79.244]
  - - [2048, 1184, 1, 512]
    - [29, 74.525]
  - - [2048, 1186, 1, 512]
    - [29, 74.434]
  - - [2048, 1279, 1, 512]
    - [22, 78.991]
  - - [2048, 1290, 1, 512]
    - [23, 74.191]
  - - [2048, 1327, 1, 512]
    - [35, 75.874]
  - - [2048, 1331, 1, 512]
    - [23, 76.51]
  - - [2048, 1341, 1, 512]
    - [23, 77.178]
  - - [2048, 1350, 1, 512]
    - [23, 77.489]
  - - [2048, 1359, 1, 512]
    - [29, 77.742]
  - - [2048, 1391, 1, 512]
    - [23, 79.497]
  - - [2048, 1424, 1, 512]
    - [29, 74.655]
  - - [2048, 1458, 1, 512]
    - [29, 76.42]
  - - [2048, 1462, 1, 512]
    - [29, 76.713]
  - - [2048, 1467, 1, 512]
    - [29, 76.993]
  - - [2048, 1472, 1, 512]
    - [29, 77.895]
  - - [2048, 1520, 1, 512]
    - [29, 79.704]
  - - [2048, 1596, 1, 512]
    - [7, 77.552]
  - - [2048, 1599, 1, 512]
    - [7, 77.94]
  - - [2048, 1615, 1, 512]
    - [7, 78.603]
  - - [2048, 1680, 1, 512]
    - [29, 80.706]
  - - [2048, 1709, 1, 512]
    - [29, 81.847]
  - - [2048, 1902, 1, 512]
    - [23, 80.471]
  - - [2048, 1917, 1, 512]
    - [23, 80.846]
  - - [2048, 2076, 1, 512]
    - [29, 80.408]
  - - [2048, 2195, 1, 512]
    - [23, 81.883]
  - - [2048, 2205, 1, 512]
    - [7, 82.334]
  - - [2048, 2418, 1, 512]
    - [29, 83.255]
  - - [2048, 2496, 1, 512]
    - [23, 83.485]
  - - [2048, 2790, 1, 512]
    - [7, 84.414]
  - - [2048, 2864, 1, 512]
    - [29, 84.302]
  - - [2048, 3092, 1, 512]
    - [22, 82.655]
  - - [2048, 3113, 1, 512]
    - [29, 83.562]
  - - [2048, 3137, 1, 512]
    - [29, 81.053]
  - - [2048, 3166, 1, 512]
    - [29, 81.563]
  - - [2048, 3194, 1, 512]
    - [7, 82.285]
  - - [2048, 3219, 1, 512]
    - [29, 82.944]
  - - [2048, 3222, 1, 512]
    - [22, 82.804]
  - - [2048, 3234, 1, 512]
    - [29, 83.422]
  - - [2048, 3237, 1, 512]
    - [22, 83.038]
  - - [2048, 3242, 1, 512]
    - [29, 83.584]
  - - [2048, 3246, 1, 512]
    - [29, 83.575]
  - - [2048, 3249, 1, 512]
    - [29, 83.598]
  - - [2048, 3251, 1, 512]
    - [29, 83.742]
  - - [2048, 3257, 1, 512]
    - [29, 83.823]
  - - [2048, 3262, 1, 512]
    - [29, 83.895]
  - - [2048, 3268, 1, 512]
    - [23, 83.517]
  - - [2048, 3282, 1, 512]
    - [23, 83.756]
  - - [2048, 3286, 1, 512]
    - [7, 83.968]
  - - [2048, 3287, 1, 512]
    - [23, 84.067]
  - - [2048, 3293, 1, 512]
    - [7, 84.166]
  - - [2048, 3297, 1, 512]
    - [7, 84.532]
  - - [2048, 3307, 1, 512]
    - [7, 84.577]
  - - [2048, 3314, 1, 512]
    - [7, 84.365]
  - - [2048, 3315, 1, 512]
    - [7, 84.708]
  - - [2048, 3319, 1, 512]
    - [7, 84.509]
  - - [2048, 3322, 1, 512]
    - [23, 84.577]
  - - [2048, 3323, 1, 512]
    - [23, 84.893]
  - - [2048, 3324, 1, 512]
    - [7, 84.875]
  - - [2048, 3325, 1, 512]
    - [7, 84.753]
  - - [2048, 3327, 1, 512]
    - [23, 84.811]
  - - [2048, 3329, 1, 512]
    - [7, 84.681]
  - - [2048, 3332, 1, 512]
    - [7, 84.829]
  - - [2048, 3336, 1, 512]
    - [23, 84.897]
  - - [2048, 3339, 1, 512]
    - [23, 85.402]
  - - [2048, 3342, 1, 512]
    - [23, 85.159]
  - - [2048, 3344, 1, 512]
    - [7, 85.199]
  - - [2048, 3358, 1, 512]
    - [7, 85.511]
  - - [2048, 3360, 1, 512]
    - [23, 85.849]
  - - [2048, 3364, 1, 512]
    - [23, 85.831]
  - - [2048, 3365, 1, 512]
    - [23, 85.885]
  - - [2048, 3369, 1, 512]
    - [7, 85.524]
  - - [2048, 3370, 1, 512]
    - [7, 85.714]
  - - [2048, 3371, 1, 512]
    - [7, 85.804]
  - - [2048, 3374, 1, 512]
    - [23, 86.097]
  - - [2048, 3376, 1, 512]
    - [23, 85.768]
  - - [2048, 3377, 1, 512]
    - [7, 85.772]
  - - [2048, 3378, 1, 512]
    - [7, 85.984]
  - - [2048, 3381, 1, 512]
    - [7, 86.133]
  - - [2048, 3382, 1, 512]
    - [23, 86.242]
  - - [2048, 3383, 1, 512]
    - [7, 86.205]
  - - [2048, 3384, 1, 512]
    - [7, 86.183]
  - - [2048, 3385, 1, 512]
    - [23, 86.187]
  - - [2048, 3386, 1, 512]
    - [23, 86.336]
  - - [2048, 3388, 1, 512]
    - [7, 86.463]
  - - [2048, 3390, 1, 512]
    - [7, 86.057]
  - - [2048, 3391, 1, 512]
    - [23, 86.499]
  - - [2048, 3396, 1, 512]
    - [23, 86.472]
  - - [2048, 3399, 1, 512]
    - [23, 86.566]
  - - [2048, 3402, 1, 512]
    - [23, 86.873]
  - - [2048, 3410, 1, 512]
    - [23, 86.797]
  - - [2048, 3412, 1, 512]
    - [23, 86.86]
  - - [2048, 3414, 1, 512]
    - [23, 86.715]
  - - [2048, 3415, 1, 512]
    - [23, 87.076]
  - - [2048, 3418, 1, 512]
    - [23, 86.851]
  - - [2048, 3420, 1, 512]
    - [7, 87.036]
  - - [2048, 3422, 1, 512]
    - [7, 86.936]
  - - [2048, 3425, 1, 512]
    - [7, 86.788]
  - - [2048, 3426, 1, 512]
    - [23, 87.478]
  - - [2048, 3427, 1, 512]
    - [23, 87.166]
  - - [2048, 3428, 1, 512]
    - [7, 87.013]
  - - [2048, 3430, 1, 512]
    - [23, 87.27]
  - - [2048, 3431, 1, 512]
    - [23, 87.428]
  - - [2048, 3432, 1, 512]
    - [7, 87.234]
  - - [2048, 3433, 1, 512]
    - [23, 87.685]
  - - [2048, 3438, 1, 512]
    - [7, 87.473]
  - - [2048, 3439, 1, 512]
    - [7, 87.379]
  - - [2048, 3440, 1, 512]
    - [23, 87.338]
  - - [2048, 3443, 1, 512]
    - [23, 87.721]
  - - [2048, 3445, 1, 512]
    - [23, 87.586]
  - - [2048, 3447, 1, 512]
    - [23, 87.609]
  - - [2048, 3448, 1, 512]
    - [23, 87.749]
  - - [2048, 3450, 1, 512]
    - [7, 87.636]
  - - [2048, 3451, 1, 512]
    - [23, 87.87]
  - - [2048, 3452, 1, 512]
    - [7, 87.586]
  - - [2048, 3453, 1, 512]
    - [23, 87.609]
  - - [2048, 3455, 1, 512]
    - [23, 87.915]
  - - [2048, 3456, 1, 512]
    - [7, 88.741]
  - - [2048, 3457, 1, 512]
    - [29, 82.357]
  - - [2048, 3458, 1, 512]
    - [23, 82.664]
  - - [2048, 3459, 1, 512]
    - [29, 82.168]
  - - [2048, 3460, 1, 512]
    - [23, 82.596]
  - - [2048, 3461, 1, 512]
    - [29, 82.362]
  - - [2048, 3462, 1, 512]
    - [23, 82.587]
  - - [2048, 3466, 1, 512]
    - [23, 82.673]
  - - [2048, 3467, 1, 512]
    - [29, 82.519]
  - - [2048, 3468, 1, 512]
    - [23, 82.578]
  - - [2048, 3470, 1, 512]
    - [23, 82.628]
  - - [2048, 3471, 1, 512]
    - [23, 82.7]
  - - [2048, 3472, 1, 512]
    - [29, 82.655]
  - - [2048, 3475, 1, 512]
    - [23, 82.885]
  - - [2048, 3476, 1, 512]
    - [29, 82.709]
  - - [2048, 3477, 1, 512]
    - [23, 82.858]
  - - [2048, 3478, 1, 512]
    - [23, 82.993]
  - - [2048, 3479, 1, 512]
    - [23, 82.998]
  - - [2048, 3480, 1, 512]
    - [23, 83.115]
  - - [2048, 3481, 1, 512]
    - [23, 83.07]
  - - [2048, 3483, 1, 512]
    - [29, 83.002]
  - - [2048, 3484, 1, 512]
    - [23, 82.993]
  - - [2048, 3487, 1, 512]
    - [29, 82.88]
  - - [2048, 3489, 1, 512]
    - [29, 82.993]
  - - [2048, 3490, 1, 512]
    - [23, 83.187]
  - - [2048, 3491, 1, 512]
    - [23, 82.984]
  - - [2048, 3493, 1, 512]
    - [23, 83.291]
  - - [2048, 3494, 1, 512]
    - [29, 83.214]
  - - [2048, 3495, 1, 512]
    - [23, 83.273]
  - - [2048, 3497, 1, 512]
    - [23, 83.295]
  - - [2048, 3498, 1, 512]
    - [29, 83.291]
  - - [2048, 3501, 1, 512]
    - [29, 83.354]
  - - [2048, 3503, 1, 512]
    - [23, 83.494]
  - - [2048, 3505, 1, 512]
    - [23, 83.232]
  - - [2048, 3507, 1, 512]
    - [23, 83.539]
  - - [2048, 3508, 1, 512]
    - [23, 83.489]
  - - [2048, 3509, 1, 512]
    - [23, 83.512]
  - - [2048, 3510, 1, 512]
    - [23, 83.602]
  - - [2048, 3511, 1, 512]
    - [23, 83.593]
  - - [2048, 3513, 1, 512]
    - [23, 83.489]
  - - [2048, 3514, 1, 512]
    - [29, 83.53]
  - - [2048, 3515, 1, 512]
    - [23, 83.832]
  - - [2048, 3517, 1, 512]
    - [23, 83.873]
  - - [2048, 3518, 1, 512]
    - [23, 83.652]
  - - [2048, 3519, 1, 512]
    - [23, 83.945]
  - - [2048, 3520, 1, 512]
    - [29, 83.823]
  - - [2048, 3523, 1, 512]
    - [23, 83.972]
  - - [2048, 3528, 1, 512]
    - [23, 84.049]
  - - [2048, 3529, 1, 512]
    - [23, 84.013]
  - - [2048, 3530, 1, 512]
    - [23, 84.189]
  - - [2048, 3531, 1, 512]
    - [29, 83.891]
  - - [2048, 3532, 1, 512]
    - [29, 84.121]
  - - [2048, 3533, 1, 512]
    - [23, 84.311]
  - - [2048, 3534, 1, 512]
    - [23, 84.117]
  - - [2048, 3538, 1, 512]
    - [23, 84.356]
  - - [2048, 3539, 1, 512]
    - [23, 84.148]
  - - [2048, 3540, 1, 512]
    - [7, 84.117]
  - - [2048, 3541, 1, 512]
    - [29, 84.306]
  - - [2048, 3547, 1, 512]
    - [29, 84.545]
  - - [2048, 3548, 1, 512]
    - [23, 84.509]
  - - [2048, 3552, 1, 512]
    - [29, 84.496]
  - - [2048, 3564, 1, 512]
    - [29, 84.653]
  - - [2048, 3575, 1, 512]
    - [29, 84.843]
  - - [2048, 3598, 1, 512]
    - [23, 84.983]
  - - [2048, 3599, 1, 512]
    - [23, 85.082]
  - - [2048, 3608, 1, 512]
    - [7, 85.217]
  - - [2048, 3776, 1, 512]
    - [29, 83.72]
  - - [2048, 3780, 1, 512]
    - [7, 83.76]
  - - [2048, 3796, 1, 512]
    - [23, 83.846]
  - - [2048, 3822, 1, 512]
    - [23, 84.658]
  - - [2048, 3835, 1, 512]
    - [7, 84.599]
  - - [2048, 3840, 1, 512]
    - [7, 85.66]
  - - [2048, 3859, 1, 512]
    - [23, 84.92]
  - - [2048, 3864, 1, 512]
    - [23, 85.357]
  - - [2048, 3870, 1, 512]
    - [7, 85.204]
  - - [2048, 3876, 1, 512]
    - [23, 85.479]
  - - [2048, 3906, 1, 512]
    - [7, 86.052]
  - - [2048, 3910, 1, 512]
    - [23, 86.269]
  - - [2048, 3925, 1, 512]
    - [7, 86.228]
  - - [2048, 3942, 1, 512]
    - [23, 86.661]
  - - [2048, 3944, 1, 512]
    - [23, 86.914]
  - - [2048, 3955, 1, 512]
    - [23, 87.108]
  - - [2048, 3968, 1, 512]
    - [23, 87.843]
  - - [2048, 3969, 1, 512]
    - [29, 84.229]
  - - [2048, 3976, 1, 512]
    - [29, 84.473]
  - - [2048, 3977, 1, 512]
    - [29, 84.523]
  - - [2048, 3978, 1, 512]
    - [29, 84.468]
  - - [2048, 3990, 1, 512]
    - [22, 84.45]
  - - [2048, 3995, 1, 512]
    - [29, 84.897]
  - - [2048, 3996, 1, 512]
    - [29, 84.933]
  - - [2048, 3999, 1, 512]
    - [29, 84.87]
  - - [2048, 4005, 1, 512]
    - [29, 85.041]
  - - [2048, 4012, 1, 512]
    - [29, 85.235]
  - - [2048, 4020, 1, 512]
    - [29, 85.299]
  - - [2048, 4026, 1, 512]
    - [29, 85.416]
  - - [2048, 4030, 1, 512]
    - [29, 85.344]
  - - [2048, 4032, 1, 512]
    - [29, 85.876]
  - - [1024, 4096, 1, 3072]
    - [22, 81.617]
  - - [1024, 3840, 1, 1024]
    - [23, 83.918]
  - - [1024, 3840, 1, 4096]
    - [7, 85.808]
  - - [1024, 3968, 1, 1024]
    - [23, 86.436]
  - - [1024, 3968, 1, 4096]
    - [7, 88.696]
  - - [1024, 3968, 1, 42720]
    - [30, 87.947]
  - - [1024, 7200, 1, 1024]
    - [23, 86.16]
  - - [1024, 7200, 1, 4096]
    - [23, 87.442]
  - - [1024, 7200, 1, 42720]
    - [15, 88.258]
  - - [1024, 8160, 1, 1024]
    - [36, 85.515]
  - - [1024, 8160, 1, 4096]
    - [23, 86.982]
  - - [1024, 9520, 1, 1024]
    - [23, 88.177]
  - - [1024, 9520, 1, 4096]
    - [11, 88.606]
  - - [1024, 9520, 1, 42720]
    - [30, 89.923]
  - - [1024, 10200, 1, 1024]
    - [23, 89.251]
  - - [1024, 10200, 1, 4096]
    - [13, 89.874]
  - - [4096, 3840, 1, 1024]
    - [7, 90.961]
  - - [4096, 3968, 1, 1024]
    - [7, 90.965]
  - - [4096, 7200, 1, 1024]
    - [1, 90.28]
  - - [4096, 8160, 1, 1024]
    - [4, 91.168]
  - - [4096, 9520, 1, 1024]
    - [4, 90.889]
  - - [4096, 10200, 1, 1024]
    - [1, 91.006]
  - - [1024, 2048, 1, 4096]
    - [291, 80.07]
  - - [1024, 2048, 1, 30528]
    - [21, 80.399]
  - - [1024, 4096, 1, 30528]
    - [14, 81.987]
  - - [1024, 10240, 1, 256]
    - [7, 86.138]
  - - [1024, 10496, 1, 256]
    - [7, 85.754]
  - - [1024, 11008, 1, 256]
    - [7, 85.709]
  - - [1024, 11264, 1, 256]
    - [7, 87.162]
  - - [1024, 11520, 1, 256]
    - [4, 88.209]
  - - [1024, 12288, 1, 256]
    - [7, 86.972]
  - - [1024, 13312, 1, 256]
    - [7, 86.842]
  - - [1024, 13568, 1, 256]
    - [7, 87.69]
  - - [1024, 14336, 1, 256]
    - [4, 88.885]
  - - [1024, 14592, 1, 256]
    - [7, 87.712]
  - - [1024, 14848, 1, 256]
    - [7, 88.619]
  - - [1024, 15104, 1, 256]
    - [7, 87.73]
  - - [1024, 1600, 1, 1024]
    - [8, 75.968]
  - - [1024, 1600, 1, 1]
    - [6, 1.769]
  - - [1024, 16128, 1, 256]
    - [7, 89.012]
  - - [1024, 17152, 1, 256]
    - [7, 89.098]
  - - [1024, 1792, 1, 256]
    - [29, 70.694]
  - - [1024, 18944, 1, 256]
    - [4, 89.58]
  - - [1024, 19712, 1, 256]
    - [7, 88.746]
  - - [1024, 19968, 1, 256]
    - [4, 89.31]
  - - [1024, 20480, 1, 256]
    - [4, 89.138]
  - - [1024, 2048, 1, 256]
    - [29, 71.75]
  - - [1024, 20992, 1, 256]
    - [7, 89.224]
  - - [1024, 21504, 1, 256]
    - [7, 89.025]
  - - [1024, 22016, 1, 256]
    - [7, 89.152]
  - - [1024, 23552, 1, 256]
    - [11, 89.991]
  - - [1024, 2560, 1, 256]
    - [29, 78.806]
  - - [1024, 28672, 1, 256]
    - [4, 88.75]
  - - [1024, 3072, 1, 256]
    - [29, 78.847]
  - - [1024, 3328, 1, 256]
    - [29, 79.483]
  - - [1024, 33536, 1, 256]
    - [19, 87.816]
  - - [1024, 3840, 1, 256]
    - [29, 78.549]
  - - [1024, 40448, 1, 256]
    - [19, 88.164]
  - - [1024, 4096, 1, 256]
    - [29, 78.874]
  - - [1024, 4608, 1, 256]
    - [4, 83.589]
  - - [1024, 4864, 1, 256]
    - [29, 83.038]
  - - [1024, 5120, 1, 256]
    - [4, 83.476]
  - - [1024, 5632, 1, 256]
    - [7, 83.828]
  - - [1024, 6144, 1, 256]
    - [7, 83.679]
  - - [1024, 6400, 1, 256]
    - [29, 81.973]
  - - [1024, 7168, 1, 256]
    - [29, 84.324]
  - - [1024, 7424, 1, 256]
    - [4, 86.102]
  - - [1024, 7680, 1, 256]
    - [29, 84.026]
  - - [1024, 7936, 1, 256]
    - [11, 85.781]
  - - [1024, 8192, 1, 256]
    - [7, 84.004]
  - - [1024, 8448, 1, 256]
    - [4, 85.723]
  - - [1024, 8704, 1, 256]
    - [7, 84.076]
  - - [1024, 8960, 1, 256]
    - [7, 85.655]
  - - [1024, 9728, 1, 256]
    - [7, 87.415]
  - - [1024, 9984, 1, 256]
    - [4, 85.272]
  - - [2048, 1024, 1, 1]
    - [6, 1.841]
  - - [2048, 1024, 1, 256]
    - [14, 72.26]
  - - [256, 8976, 1, 10240]
    - [27, 81.419]
  - - [256, 8976, 1, 10496]
    - [13, 86.788]
  - - [256, 8976, 1, 11008]
    - [13, 86.869]
  - - [256, 8976, 1, 11520]
    - [13, 86.9]
  - - [256, 8976, 1, 12288]
    - [27, 81.382]
  - - [256, 8976, 1, 14336]
    - [27, 81.41]
  - - [256, 8976, 1, 14848]
    - [13, 87.099]
  - - [256, 8976, 1, 15104]
    - [28, 87.126]
  - - [256, 8976, 1, 1536]
    - [25, 82.38]
  - - [256, 8976, 1, 15872]
    - [13, 87.176]
  - - [256, 8976, 1, 17152]
    - [13, 87.189]
  - - [256, 8976, 1, 19712]
    - [40, 87.302]
  - - [256, 8976, 1, 19968]
    - [13, 87.23]
  - - [256, 8976, 1, 20480]
    - [12, 79.641]
  - - [256, 8976, 1, 2048]
    - [9, 83.395]
  - - [256, 8976, 1, 20992]
    - [13, 87.306]
  - - [256, 8976, 1, 22016]
    - [13, 87.324]
  - - [256, 8976, 1, 2304]
    - [9, 83.607]
  - - [256, 8976, 1, 2560]
    - [40, 85.235]
  - - [256, 8976, 1, 26112]
    - [13, 87.374]
  - - [256, 8976, 1, 2816]
    - [34, 84.293]
  - - [256, 8976, 1, 3072]
    - [40, 85.691]
  - - [256, 8976, 1, 33536]
    - [13, 87.288]
  - - [256, 8976, 1, 4352]
    - [13, 85.317]
  - - [256, 8976, 1, 44505]
    - [21, 87.649]
  - - [256, 8976, 1, 4864]
    - [13, 85.664]
  - - [256, 8976, 1, 5376]
    - [13, 85.921]
  - - [256, 8976, 1, 5632]
    - [40, 85.993]
  - - [256, 8976, 1, 5888]
    - [28, 86.088]
  - - [256, 8976, 1, 6144]
    - [11, 82.181]
  - - [256, 8976, 1, 6656]
    - [13, 86.269]
  - - [256, 8976, 1, 7168]
    - [27, 81.807]
  - - [256, 8976, 1, 7424]
    - [40, 86.445]
  - - [256, 8976, 1, 8192]
    - [39, 78.54]
  - - [256, 8976, 1, 8448]
    - [28, 86.494]
  - - [256, 8976, 1, 8960]
    - [40, 86.625]
  - - [256, 8976, 1, 9472]
    - [13, 86.702]
  - - [256, 8976, 1, 9728]
    - [40, 86.765]
  - - [256, 8976, 1, 9984]
    - [28, 86.783]
  - - [3200, 1024, 1, 2048]
    - [23, 82.384]
  - - [4096, 1024, 1, 1]
    - [6, 2.184]
  - - [1024, 4096, 1, 4096]
    - [276, 85.171]
  - - [1024, 3072, 1, 3072]
    - [35, 82.528]
  - - [1024, 2048, 1, 3072]
    - [28, 79.221]
  - - [30528, 4096, 1, 1024]
    - [36, 93.28]
  - - [30528, 2048, 1, 1024]
    - [36, 92.585]
  - - [512, 32768, 1, 256]
    - [36, 88.105]
  - - [256, 32768, 1, 128]
    - [29, 82.028]
  - - [1024, 32768, 1, 512]
    - [11, 89.819]
  - - [1024, 32768, 1, 1024]
    - [265, 92.563]
  - - [479, 32768, 1, 1024]
    - [39, 82.786]
  - - [289, 128, 64, 768]
    - [35, 60.552]
  - - [289, 160, 64, 768]
    - [22, 53.085]
  - - [289, 192, 64, 768]
    - [35, 63.579]
  - - [3136, 256, 64, 64]
    - [0, 62.248]
  - - [784, 512, 64, 128]
    - [29, 73.861]
  - - [784, 128, 64, 512]
    - [39, 72.648]
  - - [196, 1024, 64, 256]
    - [7, 64.486]
  - - [196, 256, 64, 1024]
    - [7, 59.478]
  - - [3136, 256, 32, 64]
    - [29, 81.843]
  - - [784, 512, 32, 128]
    - [2, 72.927]
  - - [784, 128, 32, 512]
    - [35, 69.796]
  - - [196, 1024, 32, 256]
    - [35, 63.349]
  - - [256, 6912, 1, 4]
    - [6, 6.944]
  - - [512, 4096, 1, 256]
    - [36, 71.366]
  - - [1024, 4096, 1, 512]
    - [22, 80.088]
  - - [480, 4096, 1, 1024]
    - [23, 71.118]
  - - [512, 6912, 1, 256]
    - [11, 81.879]
  - - [1024, 6912, 1, 512]
    - [23, 88.664]
  - - [1024, 6912, 1, 1024]
    - [23, 89.824]
  - - [480, 6912, 1, 1024]
    - [23, 81.811]
  - - [256, 55296, 1, 128]
    - [30, 85.817]
  - - [512, 55296, 1, 256]
    - [1, 88.141]
  - - [1920, 2048, 1, 2048]
    - [7, 84.635]
  - - [2880, 3072, 1, 3072]
    - [36, 86.765]
  - - [3840, 4096, 1, 4096]
    - [7, 91.714]
  - - [7680, 8192, 1, 8192]
    - [4, 92.716]
  - - [2048, 2048, 1, 2048]
    - [22, 81.301]
  - - [3072, 3072, 1, 3072]
    - [7, 92.143]
  - - [4096, 4096, 1, 4096]
    - [7, 91.367]
  - - [8192, 8192, 1, 8192]
    - [4, 92.788]
  - - [1152, 1152, 1, 1152]
    - [29, 72.454]
  - - [1536, 1536, 1, 1536]
    - [21, 87.415]
  - - [1920, 1920, 1, 1920]
    - [14, 82.158]
  - - [2304, 2304, 1, 2304]
    - [16, 86.806]
  - - [2688, 2688, 1, 2688]
    - [30, 86.932]
  - - [3456, 3456, 1, 3456]
    - [1, 89.761]
  - - [3840, 3840, 1, 3840]
    - [23, 89.571]
  - - [4224, 4224, 1, 4224]
    - [30, 91.583]
  - - [4608, 4608, 1, 4608]
    - [1, 93.348]
  - - [4992, 4992, 1, 4992]
    - [15, 92.468]
  - - [5376, 5376, 1, 5376]
    - [15, 92.111]
  - - [5760, 5760, 1, 5760]
    - [15, 92.901]
  - - [6144, 6144, 1, 6144]
    - [23, 92.612]
  - - [6528, 6528, 1, 6528]
    - [15, 93.271]
  - - [6912, 6912, 1, 6912]
    - [15, 93.009]
  - - [7296, 7296, 1, 7296]
    - [30, 93.496]
  - - [7680, 7680, 1, 7680]
    - [21, 93.09]
  - - [1152, 1152, 1, 384]
    - [29, 68.673]
  - - [1536, 1536, 1, 384]
    - [1, 82.51]
  - - [1920, 1920, 1, 384]
    - [29, 80.701]
  - - [2304, 2304, 1, 384]
    - [16, 84.856]
  - - [2688, 2688, 1, 384]
    - [1, 85.073]
  - - [3072, 3072, 1, 384]
    - [1, 90.194]
  - - [3456, 3456, 1, 384]
    - [30, 88.385]
  - - [3840, 3840, 1, 384]
    - [1, 88.371]
  - - [4224, 4224, 1, 384]
    - [15, 90.04]
  - - [4608, 4608, 1, 384]
    - [30, 91.719]
  - - [4992, 4992, 1, 384]
    - [15, 90.875]
  - - [5376, 5376, 1, 384]
    - [1, 90.677]
  - - [5760, 5760, 1, 384]
    - [15, 91.177]
  - - [6144, 6144, 1, 384]
    - [1, 90.505]
  - - [6528, 6528, 1, 384]
    - [1, 91.353]
  - - [6912, 6912, 1, 384]
    - [1, 91.074]
  - - [7296, 7296, 1, 384]
    - [1, 91.525]
  - - [7680, 7680, 1, 384]
    - [1, 91.895]
  - - [8064, 8064, 1, 384]
    - [1, 92.107]
  - - [8448, 8448, 1, 384]
    - [1, 92.283]
  - - [8832, 8832, 1, 384]
    - [15, 92.445]
  - - [9216, 9216, 1, 384]
    - [27, 91.047]
  - - [9600, 9600, 1, 384]
    - [1, 92.572]
  - - [9984, 9984, 1, 384]
    - [1, 92.594]
  - - [10368, 10368, 1, 384]
    - [1, 92.779]
  - - [10752, 10752, 1, 384]
    - [1, 92.711]
  - - [11136, 11136, 1, 384]
    - [1, 93.059]
  - - [11520, 11520, 1, 384]
    - [7, 92.941]
  - - [11904, 11904, 1, 384]
    - [1, 93.095]
  - - [12288, 12288, 1, 384]
    - [1, 92.459]
  - - [12672, 12672, 1, 384]
    - [1, 93.081]
  - - [13056, 13056, 1, 384]
    - [1, 93.059]
  - - [13440, 13440, 1, 384]
    - [15, 93.199]
  - - [13824, 13824, 1, 384]
    - [23, 92.653]
  - - [14208, 14208, 1, 384]
    - [7, 93.366]
  - - [14592, 14592, 1, 384]
    - [1, 93.145]
  - - [14976, 14976, 1, 384]
    - [1, 93.293]
  - - [15360, 15360, 1, 384]
    - [1, 92.978]
  - - [15744, 15744, 1, 384]
    - [1, 93.483]
  - - [16128, 16128, 1, 384]
    - [1, 93.271]
  - - [16512, 16512, 1, 384]
    - [15, 93.487]
  - - [16896, 16896, 1, 384]
    - [1, 93.375]
  - - [17280, 17280, 1, 384]
    - [1, 93.514]
  - - [17664, 17664, 1, 384]
    - [1, 93.456]
  - - [18048, 18048, 1, 384]
    - [15, 93.6]
  - - [18432, 18432, 1, 384]
    - [7, 92.811]
  - - [18816, 18816, 1, 384]
    - [15, 93.614]
  - - [19200, 19200, 1, 384]
    - [1, 93.465]
  - - [19584, 19584, 1, 384]
    - [1, 93.546]
  - - [19968, 19968, 1, 384]
    - [1, 93.438]
  - - [20352, 20352, 1, 384]
    - [15, 93.663]
  - - [20736, 20736, 1, 384]
    - [1, 93.528]
  - - [21120, 21120, 1, 384]
    - [15, 93.713]
  - - [21504, 21504, 1, 384]
    - [7, 93.334]
  - - [21888, 21888, 1, 384]
    - [1, 93.56]
  - - [22272, 22272, 1, 384]
    - [15, 93.587]
  - - [22656, 22656, 1, 384]
    - [15, 93.749]
  - - [23040, 23040, 1, 384]
    - [23, 93.271]
  - - [8192, 1024, 1, 1024]
    - [7, 86.476]
  - - [8192, 4096, 1, 1024]
    - [1, 91.895]
  - - [16384, 16384, 1, 16384]
    - [21, 86.472]
  - - [1444, 256, 120, 128]
    - [0, 71.375]
  - - [1444, 256, 139, 128]
    - [3, 60.155]
  - - [1444, 256, 160, 128]
    - [3, 60.204]
  - - [1444, 256, 18, 128]
    - [6, 74.877]
  - - [1444, 256, 19, 128]
    - [35, 75.928]
  - - [1444, 256, 120, 256]
    - [4, 80.57]
  - - [1444, 256, 139, 256]
    - [4, 80.85]
  - - [1444, 256, 160, 256]
    - [4, 80.471]
  - - [1444, 256, 18, 256]
    - [31, 79.361]
  - - [1444, 256, 19, 256]
    - [7, 79.235]
  - - [361, 256, 120, 512]
    - [40, 73.162]
  - - [361, 256, 139, 512]
    - [12, 71.511]
  - - [361, 256, 160, 512]
    - [11, 71.578]
  - - [361, 256, 18, 512]
    - [35, 72.147]
  - - [361, 256, 19, 512]
    - [35, 68.123]
  - - [173280, 128, 1, 64]
    - [35, 80.886]
  - - [200716, 128, 1, 64]
    - [0, 65.975]
  - - [231040, 128, 1, 64]
    - [7, 46.029]
  - - [25992, 128, 1, 64]
    - [6, 56.708]
  - - [27436, 128, 1, 64]
    - [16, 64.342]
  - - [8192, 7680, 1, 8192]
    - [4, 92.716]
  - - [4096, 3840, 1, 4096]
    - [7, 91.408]
  - - [2048, 1920, 1, 2048]
    - [7, 84.992]
  - - [1024, 1280, 1, 2]
    - [6, 3.113]
  - - [1024, 1280, 1, 4096]
    - [6, 72.765]
  - - [4096, 1280, 1, 1024]
    - [7, 88.24]
  - - [1024, 4992, 1, 2]
    - [0, 4.886]
  - - [1024, 4992, 1, 4096]
    - [23, 87.527]
  - - [4096, 4992, 1, 1024]
    - [7, 91.773]
  - - [1024, 5120, 1, 2]
    - [6, 4.665]
  - - [1024, 5120, 1, 1024]
    - [7, 87.582]
  - - [1024, 5120, 1, 4096]
    - [7, 88.547]
  - - [4096, 5120, 1, 1024]
    - [7, 91.317]
  - - [1024, 5248, 1, 2]
    - [6, 4.652]
  - - [1024, 5248, 1, 1024]
    - [35, 82.195]
  - - [1024, 5248, 1, 4096]
    - [7, 83.034]
  - - [4096, 5248, 1, 1024]
    - [7, 91.259]
  - - [1024, 2560, 1, 2]
    - [6, 3.916]
  - - [1024, 2560, 1, 4096]
    - [22, 82.912]
  - - [4096, 2560, 1, 1024]
    - [7, 90.248]
  - - [1024, 1152, 1, 2]
    - [35, 3.059]
  - - [1024, 1152, 1, 4096]
    - [24, 82.177]
  - - [4096, 1152, 1, 1024]
    - [7, 88.691]
  - - [1024, 8192, 1, 1024]
    - [23, 86.643]
  - - [1024, 8192, 1, 4096]
    - [265, 87.548]
  - - [1024, 8192, 1, 33712]
    - [1, 87.717]
  - - [1024, 9600, 1, 1024]
    - [23, 89.31]
  - - [1024, 9600, 1, 4096]
    - [11, 89.273]
  - - [1024, 9600, 1, 33712]
    - [30, 90.695]
  - - [4096, 8192, 1, 1024]
    - [262, 92.908]
  - - [4096, 9600, 1, 1024]
    - [4, 91.583]
  - - [1024, 10064, 1, 1024]
    - [23, 88.281]
  - - [1024, 10064, 1, 4096]
    - [23, 89.098]
  - - [1024, 10080, 1, 4096]
    - [13, 88.98]
  - - [1024, 10080, 1, 42720]
    - [21, 90.212]
  - - [1024, 6528, 1, 1024]
    - [7, 85.01]
  - - [1024, 6528, 1, 4096]
    - [23, 86.233]
  - - [1024, 6528, 1, 42720]
    - [21, 87.333]
  - - [1024, 7104, 1, 1024]
    - [23, 85.565]
  - - [1024, 7104, 1, 4096]
    - [23, 87.076]
  - - [1024, 7104, 1, 42720]
    - [15, 87.162]
  - - [1024, 8064, 1, 1024]
    - [7, 90.153]
  - - [1024, 8064, 1, 4096]
    - [11, 90.505]
  - - [1024, 9216, 1, 1024]
    - [23, 90.731]
  - - [1024, 9216, 1, 4096]
    - [28, 91.218]
  - - [4096, 10064, 1, 1024]
    - [1, 91.173]
  - - [4096, 10080, 1, 1024]
    - [4, 90.911]
  - - [4096, 6528, 1, 1024]
    - [4, 90.672]
  - - [4096, 7104, 1, 1024]
    - [4, 90.451]
  - - [4096, 8064, 1, 1024]
    - [1, 91.836]
  - - [4096, 9216, 1, 1024]
    - [4, 91.538]
  - - [480, 32768, 1, 1024]
    - [27, 83.219]
  - - [2048, 960, 1, 2048]
    - [22, 79.289]
  - - [2048, 1024, 1, 30592]
    - [34, 80.421]
  - - [2048, 1024, 1, 6144]
    - [28, 79.524]
  - - [2048, 1024, 1, 8192]
    - [13, 79.894]
  - - [8192, 1024, 1, 2048]
    - [7, 87.225]
  - - [1024, 8192, 1, 30592]
    - [7, 86.603]
  - - [1024, 8192, 1, 3072]
    - [23, 87.5]
  - - [512, 512, 256, 64]
    - [0, 57.164]
  - - [1024, 2048, 1, 30592]
    - [21, 80.381]
  - - [1024, 4096, 1, 30592]
    - [5, 81.789]
  - - [512, 512, 128, 64]
    - [0, 78.364]
  - - [2560, 2048, 1, 1920]
    - [30, 89.594]
  - - [2560, 2048, 1, 2560]
    - [23, 89.63]
  - - [2560, 2048, 1, 7680]
    - [36, 88.637]
  - - [640, 2048, 1, 2560]
    - [35, 72.201]
  - - [512, 512, 40, 64]
    - [0, 81.13]
  - - [1536, 4096, 1, 1536]
    - [36, 88.218]
  - - [1536, 4096, 1, 4608]
    - [23, 88.795]
  - - [1536, 4096, 1, 50304]
    - [4, 87.694]
  - - [1536, 4096, 1, 6144]
    - [23, 88.588]
  - - [6144, 4096, 1, 1536]
    - [1, 92.432]
  - - [1024, 1024, 64, 96]
    - [0, 69.756]
  - - [1536, 8192, 1, 1536]
    - [36, 89.652]
  - - [1536, 8192, 1, 4608]
    - [36, 89.959]
  - - [1536, 8192, 1, 50304]
    - [34, 90.122]
  - - [1536, 8192, 1, 6144]
    - [40, 89.792]
  - - [6144, 8192, 1, 1536]
    - [1, 93.176]
  - - [1024, 1024, 128, 96]
    - [0, 68.569]
  - - [1024, 16384, 1, 1024]
    - [280, 90.658]
  - - [1024, 16384, 1, 3072]
    - [23, 90.69]
  - - [1024, 16384, 1, 4096]
    - [265, 91.625]
  - - [1024, 16384, 1, 50304]
    - [4, 90.541]
  - - [4096, 16384, 1, 1024]
    - [262, 93.496]
  - - [1024, 1024, 256, 64]
    - [10, 49.701]
  - - [1024, 2048, 1, 50304]
    - [34, 80.39]
  - - [1024, 1024, 32, 64]
    - [0, 81.107]
  - - [1024, 4096, 1, 50304]
    - [21, 81.811]
  - - [1024, 1024, 64, 64]
    - [0, 67.586]
  - - [1024, 8192, 1, 50304]
    - [33, 86.404]
  - - [1024, 1024, 128, 64]
    - [0, 55.657]
  - - [128, 128, 1024, 64]
    - [20, 73.221]
  - - [1024, 8192, 1, 30528]
    - [15, 87.46]
  - - [1024, 3456, 1, 1024]
    - [7, 86.287]
  - - [1024, 3456, 1, 512]
    - [7, 84.942]
  - - [256, 6912, 1, 128]
    - [0, 70.766]
  - - [480, 3456, 1, 1024]
    - [24, 75.896]
  - - [512, 3456, 1, 256]
    - [35, 76.257]
  - - [1024, 1280, 1, 30528]
    - [14, 73.613]
  - - [1024, 1600, 1, 30528]
    - [2, 79.127]
  - - [1024, 10240, 1, 1024]
    - [23, 89.928]
  - - [1024, 10240, 1, 4096]
    - [27, 89.883]
  - - [4096, 10240, 1, 1024]
    - [1, 91.624]
  - - [128, 128, 1280, 64]
    - [23, 32.633]
  - - [1024, 1640, 1, 30528]
    - [37, 80.994]
  - - [1024, 10496, 1, 1024]
    - [7, 88.015]
  - - [1024, 10496, 1, 4096]
    - [23, 88.421]
  - - [4096, 10496, 1, 1024]
    - [1, 92.224]
  - - [128, 128, 1312, 64]
    - [36, 30.878]
  - - [1024, 6144, 1, 4096]
    - [265, 88.584]
  - - [4096, 6144, 1, 1024]
    - [262, 92.413]
  - - [1024, 6144, 1, 1024]
    - [7, 87.027]
  - - [512, 512, 192, 64]
    - [245, 67.9]
  - - [256, 6912, 1, 1]
    - [6, 1.692]
  - - [3136, 128, 64, 64]
    - [36, 49.724]
  - - [3136, 256, 64, 128]
    - [18, 66.783]
  - - [784, 512, 64, 256]
    - [4, 75.698]
  - - [3136, 128, 64, 256]
    - [32, 74.714]
  - - [3136, 256, 64, 256]
    - [19, 86.837]
  - - [196, 1024, 64, 512]
    - [27, 65.217]
  - - [784, 256, 64, 512]
    - [4, 75.21]
  - - [784, 512, 64, 512]
    - [4, 77.669]
  - - [196, 512, 64, 1024]
    - [27, 61.45]
  - - [196, 1024, 64, 1024]
    - [27, 64.621]
  - - [3136, 128, 32, 64]
    - [14, 78.084]
  - - [3136, 256, 32, 128]
    - [0, 83.688]
  - - [784, 512, 32, 256]
    - [36, 76.068]
  - - [3136, 128, 32, 256]
    - [4, 80.665]
  - - [3136, 256, 32, 256]
    - [19, 84.726]
  - - [196, 1024, 32, 512]
    - [36, 64.477]
  - - [784, 256, 32, 512]
    - [23, 74.263]
  - - [784, 512, 32, 512]
    - [36, 78.716]
  - - [196, 512, 32, 1024]
    - [35, 61.427]
  - - [196, 1024, 32, 1024]
    - [27, 63.787]
  - - [1024, 10224, 1, 1024]
    - [7, 89.445]
  - - [1024, 10192, 1, 1024]
    - [23, 89.661]
  - - [1024, 10208, 1, 1024]
    - [23, 89.77]
  - - [1024, 10224, 1, 4096]
    - [13, 89.928]
  - - [1024, 10224, 1, 3072]
    - [28, 89.666]
  - - [4096, 10224, 1, 1024]
    - [1, 91.186]
  - - [1024, 10240, 1, 3072]
    - [11, 89.923]
  - - [1024, 10192, 1, 3072]
    - [28, 89.589]
  - - [4096, 10192, 1, 1024]
    - [1, 91.344]
  - - [1024, 10192, 1, 4096]
    - [13, 89.779]
  - - [1024, 10200, 1, 3072]
    - [28, 89.612]
  - - [1024, 10184, 1, 1024]
    - [23, 89.043]
  - - [4096, 10208, 1, 1024]
    - [1, 91.223]
  - - [1024, 10208, 1, 3072]
    - [28, 89.535]
  - - [1024, 10208, 1, 4096]
    - [13, 89.842]
  - - [1024, 10224, 1, 2048]
    - [7, 90.298]
  - - [1024, 10240, 1, 2048]
    - [7, 90.347]
  - - [1024, 10120, 1, 1024]
    - [7, 88.461]
  - - [1024, 10192, 1, 2048]
    - [7, 90.086]
  - - [1024, 10152, 1, 1024]
    - [7, 88.791]
  - - [1024, 10080, 1, 3072]
    - [23, 89.319]
  - - [100352, 512, 1, 256]
    - [27, 89.612]
  - - [12544, 2048, 1, 1024]
    - [36, 91.836]
  - - [200704, 512, 1, 256]
    - [27, 90.695]
  - - [25088, 1024, 1, 512]
    - [1, 91.263]
  - - [50176, 1024, 1, 512]
    - [7, 91.204]
  - - [6272, 2048, 1, 1024]
    - [7, 90.902]
  - - [196, 1024, 128, 256]
    - [10, 61.427]
  - - [196, 1024, 256, 256]
    - [10, 61.973]
  - - [196, 256, 128, 1024]
    - [38, 57.533]
  - - [196, 256, 256, 1024]
    - [26, 59.889]
  - - [196, 512, 128, 1024]
    - [39, 63.2]
  - - [196, 512, 256, 1024]
    - [39, 64.288]
  - - [3136, 128, 128, 256]
    - [32, 73.311]
  - - [3136, 128, 256, 256]
    - [32, 72.341]
  - - [784, 256, 128, 512]
    - [11, 76.993]
  - - [784, 256, 256, 512]
    - [11, 78.698]
  - - [128, 128, 2048, 64]
    - [0, 31.162]
  - - [1024, 2560, 1, 30528]
    - [14, 82.506]
  - - [128, 128, 1536, 64]
    - [0, 36.18]
  - - [1024, 12288, 1, 4096]
    - [265, 90.198]
  - - [1024, 12288, 1, 1024]
    - [280, 89.158]
  - - [4096, 12288, 1, 1024]
    - [262, 92.83]
  - - [1024, 1920, 1, 30528]
    - [14, 80.169]
  - - [128, 128, 192, 64]
    - [14, 56.843]
  - - [384, 384, 144, 64]
    - [0, 83.783]
  - - [768, 4608, 1, 2]
    - [29, 4.061]
  - - [3072, 4608, 1, 768]
    - [1, 91.579]
  - - [768, 4608, 1, 3072]
    - [40, 89.472]
  - - [768, 4608, 1, 768]
    - [36, 87.004]
  - - [512, 512, 48, 64]
    - [29, 82.055]
  - - [128, 128, 256, 64]
    - [0, 64.698]
  - - [384, 384, 192, 64]
    - [0, 80.846]
  - - [1024, 4608, 1, 2]
    - [6, 4.462]
  - - [4096, 4608, 1, 1024]
    - [7, 92.197]
  - - [1024, 4608, 1, 4096]
    - [13, 90.442]
  - - [1024, 4608, 1, 1024]
    - [7, 88.015]
  - - [3072, 256, 2, 1024]
    - [31, 73.519]
  - - [2852, 256, 2, 1024]
    - [24, 67.856]
  - - [3220, 256, 2, 1024]
    - [8, 76.059]
  - - [850, 2048, 2, 512]
    - [35, 75.644]
  - - [768, 2048, 2, 512]
    - [35, 80.652]
  - - [2904, 256, 2, 1024]
    - [8, 69.539]
  - - [805, 2048, 2, 512]
    - [35, 71.493]
  - - [864, 2048, 2, 512]
    - [22, 76.907]
  - - [2992, 256, 2, 1024]
    - [7, 71.56]
  - - [3400, 256, 2, 1024]
    - [8, 80.782]
  - - [4032, 256, 2, 1024]
    - [5, 74.281]
  - - [15200, 128, 2, 512]
    - [7, 80.516]
  - - [12288, 128, 2, 512]
    - [29, 80.954]
  - - [888, 2048, 2, 512]
    - [22, 78.878]
  - - [13600, 128, 2, 512]
    - [23, 82.655]
  - - [12880, 128, 2, 512]
    - [1, 78.508]
  - - [3456, 256, 2, 1024]
    - [16, 83.061]
  - - [2944, 256, 2, 1024]
    - [23, 70.784]
  - - [2688, 256, 2, 1024]
    - [22, 74.507]
  - - [13824, 128, 2, 512]
    - [1, 86.472]
  - - [3036, 256, 2, 1024]
    - [8, 72.571]
  - - [3168, 256, 2, 1024]
    - [8, 75.283]
  - - [3360, 256, 2, 1024]
    - [8, 80.137]
  - - [3552, 256, 2, 1024]
    - [6, 72.431]
  - - [11616, 128, 2, 512]
    - [14, 75.869]
  - - [4200, 256, 2, 1024]
    - [7, 77.76]
  - - [840, 2048, 2, 512]
    - [35, 74.795]
  - - [14208, 128, 2, 512]
    - [29, 80.079]
  - - [11968, 128, 2, 512]
    - [29, 77.588]
  - - [3264, 256, 2, 1024]
    - [8, 77.254]
  - - [713, 2048, 2, 512]
    - [22, 74.168]
  - - [13600, 256, 2, 512]
    - [36, 87.221]
  - - [12880, 256, 2, 512]
    - [29, 82.871]
  - - [12288, 256, 2, 512]
    - [1, 86.891]
  - - [2816, 256, 2, 1024]
    - [6, 77.633]
  - - [850, 2048, 1, 512]
    - [6, 67.518]
  - - [660, 2048, 2, 512]
    - [22, 68.732]
  - - [672, 2048, 2, 512]
    - [22, 70.225]
  - - [13440, 128, 2, 512]
    - [1, 84.459]
  - - [726, 2048, 2, 512]
    - [35, 75.635]
  - - [3500, 256, 2, 1024]
    - [6, 71.114]
  - - [13824, 256, 2, 512]
    - [1, 89.982]
  - - [15200, 256, 2, 512]
    - [1, 84.514]
  - - [3700, 256, 2, 1024]
    - [35, 74.624]
  - - [748, 2048, 2, 512]
    - [22, 77.723]
  - - [3600, 256, 2, 1024]
    - [22, 72.882]
  - - [4032, 1024, 2, 256]
    - [7, 82.849]
  - - [16128, 128, 2, 512]
    - [31, 84.672]
  - - [15200, 128, 1, 512]
    - [0, 75.662]
  - - [13600, 128, 1, 512]
    - [2, 77.899]
  - - [2904, 1024, 2, 256]
    - [0, 80.855]
  - - [2992, 1024, 2, 256]
    - [1, 82.736]
  - - [1536, 2048, 1, 1024]
    - [22, 81.473]
  - - [24576, 128, 1, 256]
    - [0, 79.262]
  - - [24576, 512, 1, 256]
    - [1, 86.954]
  - - [25760, 128, 1, 256]
    - [16, 74.556]
  - - [25760, 512, 1, 256]
    - [30, 86.869]
  - - [6144, 256, 1, 512]
    - [29, 72.233]
  - - [6440, 256, 1, 512]
    - [37, 74.529]
  - - [3036, 1024, 2, 256]
    - [7, 82.037]
  - - [13600, 512, 1, 128]
    - [7, 81.536]
  - - [9408, 512, 2, 128]
    - [0, 82.813]
  - - [56000, 256, 2, 64]
    - [0, 81.391]
  - - [2852, 1024, 2, 256]
    - [29, 78.206]
  - - [2816, 1024, 2, 256]
    - [30, 84.766]
  - - [60800, 256, 1, 64]
    - [29, 83.259]
  - - [2944, 1024, 2, 256]
    - [14, 82.434]
  - - [11776, 512, 2, 128]
    - [29, 84.613]
  - - [11616, 512, 2, 128]
    - [29, 82.208]
  - - [4200, 1024, 2, 256]
    - [1, 84.622]
  - - [54400, 256, 1, 64]
    - [14, 82.267]
  - - [15200, 512, 1, 128]
    - [29, 79.799]
  - - [2688, 1024, 2, 256]
    - [29, 82.768]
  - - [12672, 512, 2, 128]
    - [30, 86.693]
  - - [11968, 512, 2, 128]
    - [22, 83.656]
  - - [46464, 256, 2, 64]
    - [29, 84.306]
  - - [2400, 256, 2, 1024]
    - [35, 66.056]
  - - [2520, 256, 2, 1024]
    - [35, 69.508]
  - - [2400, 1024, 2, 256]
    - [14, 81.545]
  - - [10752, 128, 2, 512]
    - [36, 79.537]
  - - [45632, 256, 2, 64]
    - [35, 82.073]
  - - [2520, 1024, 2, 256]
    - [1, 83.02]
  - - [53760, 256, 2, 64]
    - [0, 82.411]
  - - [2352, 256, 2, 1024]
    - [35, 64.752]
  - - [47872, 256, 2, 64]
    - [35, 83.341]
  - - [47104, 256, 2, 64]
    - [35, 83.341]
  - - [50688, 256, 2, 64]
    - [35, 83.652]
  - - [45056, 256, 2, 64]
    - [35, 83.201]
  - - [13440, 512, 2, 128]
    - [36, 85.389]
  - - [2352, 1024, 2, 256]
    - [6, 79.072]
  - - [11264, 512, 2, 128]
    - [1, 84.554]
  - - [10560, 128, 2, 512]
    - [14, 75.346]
  - - [16128, 512, 2, 128]
    - [1, 86.625]
  - - [37632, 256, 2, 64]
    - [29, 83.011]
  - - [51520, 256, 2, 64]
    - [35, 82.131]
  - - [14000, 512, 2, 128]
    - [1, 83.291]
  - - [10560, 512, 2, 128]
    - [6, 83.332]
  - - [64512, 256, 2, 64]
    - [0, 77.931]
  - - [54400, 256, 2, 64]
    - [14, 83.426]
  - - [3264, 1024, 2, 256]
    - [1, 81.703]
  - - [10752, 512, 2, 128]
    - [7, 84.306]
  - - [3168, 1024, 2, 256]
    - [1, 80.787]
  - - [950, 2048, 1, 512]
    - [7, 68.032]
  - - [55296, 256, 2, 256]
    - [39, 87.803]
  - - [51520, 256, 2, 256]
    - [33, 87.135]
  - - [11408, 128, 2, 512]
    - [16, 80.873]
  - - [60800, 256, 2, 256]
    - [33, 88.836]
  - - [54400, 256, 2, 256]
    - [33, 87.582]
  - - [3700, 1024, 2, 256]
    - [7, 83.751]
  - - [60800, 256, 2, 64]
    - [1, 72.733]
  - - [3800, 1024, 1, 256]
    - [6, 77.169]
  - - [3400, 1024, 1, 256]
    - [2, 79.943]
  - - [3072, 1024, 2, 256]
    - [1, 84.694]
  - - [3600, 1024, 2, 256]
    - [1, 83.652]
  - - [12288, 512, 2, 128]
    - [7, 84.279]
  - - [49152, 256, 2, 256]
    - [39, 85.872]
  - - [12880, 512, 2, 128]
    - [6, 82.646]
  - - [11408, 512, 2, 128]
    - [30, 84.035]
  - - [42240, 256, 2, 64]
    - [22, 83.309]
  - - [1008, 2048, 2, 512]
    - [22, 78.522]
  - - [3360, 1024, 2, 256]
    - [1, 84.053]
  - - [14208, 512, 2, 128]
    - [36, 86.404]
  - - [56832, 256, 2, 64]
    - [0, 80.958]
  - - [43008, 256, 2, 64]
    - [14, 81.978]
  - - [13600, 512, 2, 128]
    - [0, 83.638]
  - - [3500, 1024, 2, 256]
    - [14, 82.019]
  - - [2640, 1024, 2, 256]
    - [0, 80.746]
  - - [13824, 512, 2, 128]
    - [1, 86.196]
  - - [3800, 256, 2, 1024]
    - [22, 76.591]
  - - [55296, 256, 2, 64]
    - [0, 80.223]
  - - [2640, 256, 2, 1024]
    - [35, 72.395]
  - - [15200, 512, 2, 128]
    - [1, 85.542]
  - - [3552, 1024, 2, 256]
    - [1, 83.67]
  - - [3220, 1024, 2, 256]
    - [7, 81.031]
  - - [3456, 1024, 2, 256]
    - [1, 87.735]
  - - [49152, 256, 2, 64]
    - [35, 82.799]
  - - [3400, 1024, 2, 256]
    - [36, 82.98]
  - - [950, 2048, 2, 512]
    - [22, 74.006]
  - - [3800, 1024, 2, 256]
    - [6, 82.104]
  - - [1610, 2048, 1, 1024]
    - [7, 80.624]
  - - [6912, 256, 1, 512]
    - [0, 80.304]
  - - [6800, 256, 1, 512]
    - [31, 78.815]
  - - [27648, 128, 1, 256]
    - [7, 83.147]
  - - [27200, 128, 1, 256]
    - [2, 78.725]
  - - [30400, 128, 1, 256]
    - [8, 76.799]
  - - [7600, 256, 1, 512]
    - [0, 76.28]
  - - [6144, 1024, 1, 512]
    - [1, 86.819]
  - - [6912, 1024, 1, 512]
    - [1, 89.883]
  - - [6440, 1024, 1, 512]
    - [7, 83.07]
  - - [27648, 512, 1, 256]
    - [1, 89.58]
  - - [1728, 2048, 1, 1024]
    - [35, 77.818]
  - - [27200, 512, 1, 256]
    - [23, 87.487]
  - - [6800, 1024, 1, 512]
    - [36, 86.909]
  - - [1700, 2048, 1, 1024]
    - [22, 76.681]
  - - [7600, 1024, 1, 512]
    - [1, 84.41]
  - - [30400, 512, 1, 256]
    - [30, 87.491]
  - - [1900, 2048, 1, 1024]
    - [7, 82.655]
  - - [12544, 1024, 1, 1024]
    - [7, 91.191]
  - - [1024, 1024, 160, 96]
    - [0, 70.279]
  - - [1920, 16384, 1, 25216]
    - [15, 92.125]
  - - [3840, 16384, 1, 1920]
    - [1, 93.934]
  - - [1920, 16384, 1, 3840]
    - [23, 92.405]
  - - [960, 16384, 1, 1920]
    - [1, 85.47]
  - - [1920, 16384, 1, 2880]
    - [15, 92.847]
  - - [1024, 1024, 40, 96]
    - [0, 85.466]
  - - [1920, 4096, 1, 25216]
    - [21, 88.073]
  - - [3840, 4096, 1, 1920]
    - [15, 91.904]
  - - [1920, 4096, 1, 3840]
    - [34, 87.555]
  - - [960, 4096, 1, 1920]
    - [0, 76.271]
  - - [1920, 4096, 1, 2880]
    - [15, 87.924]
  - - [1024, 1024, 80, 96]
    - [0, 76.889]
  - - [1920, 8192, 1, 25216]
    - [30, 91.597]
  - - [3840, 8192, 1, 1920]
    - [1, 92.793]
  - - [1920, 8192, 1, 3840]
    - [23, 91.317]
  - - [960, 8192, 1, 1920]
    - [1, 81.924]
  - - [1920, 8192, 1, 2880]
    - [30, 92.147]
  - - [1024, 1024, 96, 96]
    - [0, 72.806]
  - - [2304, 16384, 1, 12672]
    - [30, 93.79]
  - - [2304, 16384, 1, 2304]
    - [1, 93.627]
  - - [576, 16384, 1, 2304]
    - [36, 81.387]
  - - [2304, 16384, 1, 1728]
    - [15, 93.853]
  - - [1024, 1024, 24, 96]
    - [7, 85.542]
  - - [2304, 4096, 1, 12672]
    - [21, 92.662]
  - - [2304, 4096, 1, 2304]
    - [1, 92.161]
  - - [576, 4096, 1, 2304]
    - [35, 74.344]
  - - [2304, 4096, 1, 1728]
    - [30, 92.445]
  - - [1024, 1024, 48, 96]
    - [0, 85.872]
  - - [2304, 8192, 1, 12672]
    - [15, 93.212]
  - - [2304, 8192, 1, 2304]
    - [1, 93.063]
  - - [576, 8192, 1, 2304]
    - [7, 80.458]
  - - [2304, 8192, 1, 1728]
    - [30, 93.361]
  - - [1024, 1024, 16, 96]
    - [35, 84.437]
  - - [3072, 4096, 1, 6400]
    - [1, 90.135]
  - - [1536, 4096, 1, 3072]
    - [36, 88.547]
  - - [3072, 4096, 1, 1536]
    - [7, 89.481]
  - - [384, 4096, 1, 3072]
    - [37, 75.197]
  - - [3072, 4096, 1, 1152]
    - [1, 89.815]
  - - [1024, 1024, 32, 96]
    - [0, 85.804]
  - - [3072, 8192, 1, 6400]
    - [15, 93.117]
  - - [1536, 8192, 1, 3072]
    - [23, 89.607]
  - - [3072, 8192, 1, 1536]
    - [1, 92.197]
  - - [384, 8192, 1, 3072]
    - [22, 82.398]
  - - [3072, 8192, 1, 1152]
    - [1, 92.662]
  - - [2048, 4096, 1, 2048]
    - [7, 87.108]
  - - [2048, 4096, 1, 4096]
    - [7, 87.469]
  - - [4096, 4096, 1, 2048]
    - [7, 91.457]
  - - [1024, 2283, 1, 29000]
    - [21, 89.143]
  - - [1024, 2296, 1, 29000]
    - [21, 89.598]
  - - [1024, 2306, 1, 29000]
    - [29, 75.17]
  - - [1024, 2309, 1, 29000]
    - [29, 75.233]
  - - [1024, 2318, 1, 29000]
    - [0, 75.129]
  - - [1024, 2320, 1, 29000]
    - [29, 75.698]
  - - [1024, 2324, 1, 29000]
    - [0, 75.332]
  - - [1024, 2325, 1, 29000]
    - [29, 75.847]
  - - [1024, 2329, 1, 29000]
    - [29, 75.847]
  - - [1024, 2338, 1, 29000]
    - [14, 76.027]
  - - [1024, 2345, 1, 29000]
    - [29, 76.122]
  - - [1024, 2350, 1, 29000]
    - [29, 76.438]
  - - [1024, 2362, 1, 29000]
    - [29, 76.853]
  - - [1024, 2366, 1, 29000]
    - [29, 76.961]
  - - [1024, 2368, 1, 29000]
    - [29, 77.051]
  - - [1024, 2374, 1, 29000]
    - [14, 76.893]
  - - [1024, 2390, 1, 29000]
    - [0, 77.575]
  - - [512, 512, 320, 64]
    - [0, 52.99]
  - - [512, 512, 80, 64]
    - [29, 82.389]
  - - [2560, 1024, 1, 2560]
    - [29, 82.907]
  - - [2560, 1024, 1, 4096]
    - [35, 82.862]
  - - [4096, 1024, 1, 2560]
    - [29, 81.522]
  - - [1024, 1024, 512, 64]
    - [10, 49.846]
  - - [1024, 32768, 1, 3072]
    - [23, 92.373]
  - - [1024, 32768, 1, 4096]
    - [265, 93.511]
  - - [1024, 32768, 1, 50304]
    - [5, 90.32]
  - - [4096, 32768, 1, 1024]
    - [280, 93.944]
  - - [1024, 1024, 24, 128]
    - [7, 87.162]
  - - [128, 1024, 24, 1024]
    - [10, 78.075]
  - - [768, 320, 1, 30522]
    - [45, 67.374]
  - - [768, 640, 1, 30522]
    - [44, 78.26]
  - - [768, 1280, 1, 30522]
    - [42, 84.775]
  - - [1024, 780, 1, 30522]
    - [41, 76.226]
  - - [1024, 308, 1, 30522]
    - [41, 68.529]
  - - [1024, 800, 1, 30522]
    - [41, 78.057]
  - - [1024, 820, 1, 30522]
    - [41, 79.921]
  - - [1024, 385, 1, 30522]
    - [41, 63.629]
  - - [1024, 462, 1, 30522]
    - [43, 69.747]
  - - [1024, 640, 1, 30528]
    - [41, 81.197]
  - - [2048, 199, 1, 29000]
    - [50, 60.286]
  - - [2048, 221, 1, 29000]
    - [48, 66.449]
  - - [2048, 224, 1, 29000]
    - [46, 67.297]
  - - [2048, 229, 1, 29000]
    - [51, 69.138]
  - - [2048, 234, 1, 29000]
    - [51, 70.505]
  - - [2048, 242, 1, 29000]
    - [51, 72.878]
  - - [2048, 246, 1, 29000]
    - [43, 73.64]
  - - [2048, 247, 1, 29000]
    - [43, 74.421]
  - - [2048, 256, 1, 29000]
    - [50, 77.033]
  - - [2048, 262, 1, 29000]
    - [47, 65.623]
  - - [2048, 264, 1, 29000]
    - [47, 66.155]
  - - [2048, 265, 1, 29000]
    - [47, 66.399]
  - - [2048, 274, 1, 29000]
    - [47, 68.456]
  - - [2048, 277, 1, 29000]
    - [49, 68.953]
  - - [2048, 279, 1, 29000]
    - [47, 69.9]
  - - [2048, 288, 1, 29000]
    - [47, 71.795]
  - - [2048, 296, 1, 29000]
    - [47, 73.821]
  - - [2048, 315, 1, 29000]
    - [47, 78.572]
  - - [2048, 335, 1, 29000]
    - [47, 70.338]
  - - [1024, 561, 1, 29000]
    - [41, 80.552]
  - - [1024, 574, 1, 29000]
    - [41, 82.343]
  - - [1024, 600, 1, 29000]
    - [41, 76.392]
  - - [1024, 608, 1, 29000]
    - [41, 77.299]
  - - [1024, 615, 1, 29000]
    - [41, 78.057]
  - - [1024, 622, 1, 29000]
    - [41, 78.991]
  - - [1024, 625, 1, 29000]
    - [41, 79.257]
  - - [1024, 626, 1, 29000]
    - [41, 79.456]
  - - [1024, 628, 1, 29000]
    - [41, 79.763]
  - - [1024, 636, 1, 29000]
    - [41, 80.661]
  - - [1024, 651, 1, 29000]
    - [41, 75.657]
  - - [1024, 658, 1, 29000]
    - [41, 76.686]
  - - [1024, 669, 1, 29000]
    - [41, 77.746]
  - - [1024, 670, 1, 29000]
    - [41, 77.886]
  - - [1024, 672, 1, 29000]
    - [41, 78.157]
  - - [1024, 684, 1, 29000]
    - [41, 79.361]
  - - [1024, 716, 1, 29000]
    - [41, 76.217]
  - - [1024, 730, 1, 29000]
    - [41, 77.692]
  - - [1600, 512, 1, 1024]
    - [82, 66.164]
  - - [1024, 512, 1, 1]
    - [93, 0.961]
  - - [1024, 512, 1, 64]
    - [53, 30.522]
  - - [2048, 512, 1, 1]
    - [93, 1.548]
  - - [768, 640, 1, 768]
    - [97, 57.267]
  - - [768, 1024, 1, 2]
    - [93, 2.752]
  - - [768, 1024, 1, 768]
    - [97, 66.755]
  - - [768, 1280, 1, 768]
    - [64, 66.219]
  - - [768, 512, 1, 2]
    - [93, 1.674]
  - - [768, 512, 1, 768]
    - [96, 47.242]
  - - [1024, 512, 1, 1024]
    - [105, 61.229]
  - - [1024, 512, 1, 2]
    - [93, 2.075]
  - - [64, 64, 768, 64]
    - [77, 45.013]
  - - [64, 64, 96, 64]
    - [55, 26.407]
  - - [704, 1024, 1, 128]
    - [73, 45.952]
  - - [1024, 1024, 1, 3328]
    - [57, 73.546]
  - - [1856, 448, 1, 3328]
    - [56, 73.329]
  - - [128, 6784, 1, 3328]
    - [106, 60.908]
  - - [2368, 448, 1, 128]
    - [54, 56.103]
  - - [256, 4288, 1, 3328]
    - [64, 76.582]
  - - [704, 1856, 1, 3328]
    - [97, 72.481]
  - - [448, 1024, 1, 1280]
    - [74, 54.335]
  - - [256, 1408, 1, 3328]
    - [81, 45.577]
  - - [704, 1856, 1, 1280]
    - [82, 71.159]
  - - [128, 5056, 1, 128]
    - [97, 42.185]
  - - [2368, 128, 1, 256]
    - [55, 33.089]
  - - [64, 5056, 1, 256]
    - [62, 34.479]
  - - [256, 2944, 1, 256]
    - [63, 57.042]
  - - [256, 1856, 1, 1280]
    - [105, 56.974]
  - - [4288, 256, 1, 256]
    - [56, 65.086]
  - - [2944, 128, 1, 128]
    - [55, 34.217]
  - - [5888, 64, 1, 3328]
    - [55, 47.387]
  - - [2944, 256, 1, 3328]
    - [97, 67.166]
  - - [1408, 448, 1, 1280]
    - [74, 55.395]
  - - [1408, 704, 1, 3328]
    - [57, 69.999]
  - - [1408, 256, 1, 1280]
    - [55, 44.765]
  - - [3072, 128, 1, 1024]
    - [55, 47.883]
  - - [6784, 64, 1, 256]
    - [74, 43.457]
  - - [2944, 256, 1, 256]
    - [74, 57.421]
  - - [704, 1408, 1, 3328]
    - [64, 69.278]
  - - [2944, 256, 1, 128]
    - [97, 49.236]
  - - [2368, 128, 1, 3328]
    - [104, 38.715]
  - - [64, 193600, 1, 64]
    - [65, 61.644]
  - - [448, 1408, 1, 256]
    - [63, 46.227]
  - - [64, 5056, 1, 3328]
    - [62, 40.966]
  - - [512, 1500, 1, 2816]
    - [97, 67.816]
  - - [1024, 448, 1, 128]
    - [54, 36.694]
  - - [256, 3584, 1, 3328]
    - [75, 64.215]
  - - [256, 1408, 1, 256]
    - [104, 37.984]
  - - [5056, 64, 1, 1280]
    - [55, 40.154]
  - - [1024, 704, 1, 256]
    - [63, 54.488]
  - - [128, 4288, 1, 128]
    - [63, 42.834]
  - - [3584, 256, 1, 128]
    - [63, 50.752]
  - - [448, 1024, 1, 256]
    - [61, 44.007]
  - - [5888, 64, 1, 256]
    - [73, 39.784]
  - - [1856, 256, 1, 1280]
    - [74, 55.544]
  - - [64, 5888, 1, 3328]
    - [104, 46.683]
  - - [448, 1856, 1, 128]
    - [54, 52.079]
  - - [1024, 704, 1, 1280]
    - [56, 62.699]
  - - [128, 5888, 1, 256]
    - [63, 56.893]
  - - [704, 704, 1, 3328]
    - [56, 61.057]
  - - [704, 1408, 1, 1280]
    - [64, 67.554]
  - - [3584, 256, 1, 3328]
    - [98, 65.28]
  - - [704, 1856, 1, 128]
    - [54, 58.77]
  - - [128, 3584, 1, 3328]
    - [82, 56.536]
  - - [2944, 448, 1, 128]
    - [74, 62.636]
  - - [64, 193600, 1, 256]
    - [92, 42.266]
  - - [128, 2944, 1, 1280]
    - [81, 45.564]
  - - [448, 2944, 1, 1280]
    - [64, 61.914]
  - - [3584, 128, 1, 256]
    - [56, 45.212]
  - - [448, 1408, 1, 3328]
    - [56, 56.036]
  - - [704, 1024, 1, 256]
    - [103, 53.103]
  - - [256, 3584, 1, 256]
    - [63, 56.306]
  - - [256, 2944, 1, 3328]
    - [56, 66.99]
  - - [448, 2368, 1, 128]
    - [54, 56.415]
  - - [1408, 704, 1, 256]
    - [97, 60.962]
  - - [448, 2944, 1, 3328]
    - [64, 62.975]
  - - [64, 5888, 1, 256]
    - [66, 37.456]
  - - [512, 1500, 1, 2048]
    - [105, 66.819]
  - - [6784, 128, 1, 3328]
    - [75, 62.045]
  - - [704, 704, 1, 256]
    - [80, 46.999]
  - - [448, 704, 1, 1280]
    - [96, 39.202]
  - - [1024, 448, 1, 3328]
    - [56, 57.114]
  - - [2944, 128, 1, 256]
    - [55, 40.831]
  - - [1024, 1024, 1, 1280]
    - [75, 72.039]
  - - [448, 1024, 1, 128]
    - [54, 36.292]
  - - [448, 2368, 1, 3328]
    - [58, 64.761]
  - - [5056, 64, 1, 128]
    - [55, 30.138]
  - - [1024, 700, 1, 512]
    - [97, 56.744]
  - - [128, 6784, 1, 1280]
    - [64, 59.699]
  - - [1856, 256, 1, 256]
    - [54, 45.884]
  - - [128, 5888, 1, 1280]
    - [82, 65.077]
  - - [256, 4288, 1, 1280]
    - [64, 74.687]
  - - [256, 1856, 1, 128]
    - [97, 38.214]
  - - [7680, 64, 1, 2560]
    - [97, 60.953]
  - - [448, 1408, 1, 128]
    - [54, 40.655]
  - - [6784, 128, 1, 256]
    - [74, 55.048]
  - - [704, 448, 1, 256]
    - [55, 34.298]
  - - [704, 448, 1, 128]
    - [55, 29.859]
  - - [704, 1408, 1, 128]
    - [54, 53.202]
  - - [4288, 128, 1, 1280]
    - [106, 64.166]
  - - [128, 2944, 1, 128]
    - [55, 34.217]
  - - [128, 4288, 1, 256]
    - [63, 52.566]
  - - [704, 448, 1, 3328]
    - [73, 40.091]
  - - [448, 2368, 1, 1280]
    - [58, 63.909]
  - - [64, 6784, 1, 3328]
    - [65, 47.725]
  - - [2944, 256, 1, 1280]
    - [74, 65.646]
  - - [256, 2368, 1, 128]
    - [63, 40.33]
  - - [1856, 704, 1, 256]
    - [56, 65.785]
  - - [1856, 448, 1, 1280]
    - [56, 70.951]
  - - [128, 5888, 1, 128]
    - [97, 48.041]
  - - [1024, 1024, 1, 256]
    - [75, 64.973]
  - - [704, 1856, 1, 256]
    - [82, 64.824]
  - - [256, 2368, 1, 1280]
    - [56, 52.963]
  - - [2944, 448, 1, 256]
    - [74, 67.644]
  - - [1856, 448, 1, 128]
    - [54, 52.769]
  - - [2368, 128, 1, 1280]
    - [55, 38.002]
  - - [64, 6784, 1, 256]
    - [61, 38.756]
  - - [64, 5056, 1, 1280]
    - [62, 39.441]
  - - [3025, 64, 64, 64]
    - [74, 72.571]
  - - [2368, 256, 1, 1280]
    - [74, 52.052]
  - - [2368, 448, 1, 1280]
    - [74, 70.193]
  - - [128, 3584, 1, 256]
    - [63, 44.675]
  - - [704, 448, 1, 1280]
    - [55, 39.356]
  - - [4288, 256, 1, 1280]
    - [98, 74.953]
  - - [4288, 128, 1, 3328]
    - [56, 67.671]
  - - [7680, 128, 1, 2560]
    - [75, 69.386]
  - - [1408, 256, 1, 128]
    - [55, 33.576]
  - - [256, 1408, 1, 1280]
    - [81, 44.251]
  - - [6784, 64, 1, 3328]
    - [74, 54.362]
  - - [128, 2944, 1, 3328]
    - [104, 47.739]
  - - [2944, 448, 1, 3328]
    - [74, 73.487]
  - - [5888, 128, 1, 256]
    - [56, 56.672]
  - - [5056, 64, 1, 256]
    - [55, 35.124]
  - - [512, 1500, 1, 1536]
    - [82, 65.984]
  - - [128, 3584, 1, 1280]
    - [63, 54.669]
  - - [1024, 704, 1, 128]
    - [56, 47.093]
  - - [128, 5056, 1, 3328]
    - [82, 57.642]
  - - [1024, 1024, 1, 128]
    - [56, 56.911]
  - - [4288, 128, 1, 256]
    - [54, 52.304]
  - - [1408, 448, 1, 128]
    - [74, 42.063]
  - - [3584, 256, 1, 256]
    - [74, 56.852]
  - - [128, 2944, 1, 256]
    - [104, 39.712]
  - - [128, 6784, 1, 128]
    - [63, 48.127]
  - - [448, 1856, 1, 256]
    - [80, 59.063]
  - - [3584, 128, 1, 3328]
    - [57, 57.258]
  - - [5888, 128, 1, 3328]
    - [56, 66.927]
  - - [1408, 704, 1, 1280]
    - [98, 68.307]
  - - [448, 2944, 1, 256]
    - [103, 62.023]
  - - [448, 2368, 1, 256]
    - [103, 60.66]
  - - [64, 6784, 1, 1280]
    - [103, 46.778]
  - - [128, 2368, 1, 3328]
    - [104, 38.679]
  - - [5056, 64, 1, 3328]
    - [96, 41.03]
  - - [64, 5888, 1, 128]
    - [62, 34.005]
  - - [5056, 128, 1, 3328]
    - [56, 57.209]
  - - [448, 704, 1, 256]
    - [96, 33.982]
  - - [2944, 128, 1, 3328]
    - [75, 47.666]
  - - [128, 5056, 1, 1280]
    - [63, 56.27]
  - - [704, 704, 1, 128]
    - [61, 38.778]
  - - [2368, 128, 1, 128]
    - [55, 28.884]
  - - [5056, 128, 1, 128]
    - [55, 41.801]
  - - [448, 1024, 1, 3328]
    - [82, 56.469]
  - - [2368, 256, 1, 256]
    - [54, 46.187]
  - - [256, 2368, 1, 3328]
    - [56, 54.109]
  - - [256, 3584, 1, 128]
    - [97, 51.443]
  - - [4288, 256, 1, 128]
    - [54, 57.949]
  - - [448, 1856, 1, 3328]
    - [84, 64.928]
  - - [2368, 256, 1, 128]
    - [73, 39.423]
  - - [256, 1856, 1, 256]
    - [63, 46.196]
  - - [256, 2944, 1, 128]
    - [97, 48.903]
  - - [1408, 256, 1, 3328]
    - [73, 45.74]
  - - [2368, 448, 1, 256]
    - [74, 61.571]
  - - [4288, 256, 1, 3328]
    - [75, 77.615]
  - - [1856, 704, 1, 128]
    - [95, 59.604]
  - - [4288, 128, 1, 128]
    - [54, 42.491]
  - - [6784, 64, 1, 1280]
    - [74, 52.877]
  - - [3584, 128, 1, 128]
    - [54, 36.595]
  - - [256, 2368, 1, 256]
    - [63, 46.552]
  - - [2944, 448, 1, 1280]
    - [97, 72.72]
  - - [448, 1408, 1, 1280]
    - [56, 54.583]
  - - [448, 1856, 1, 1280]
    - [61, 64.802]
  - - [1856, 256, 1, 128]
    - [54, 37.483]
  - - [128, 2368, 1, 256]
    - [81, 32.597]
  - - [5888, 64, 1, 1280]
    - [55, 46.421]
  - - [1024, 448, 1, 1280]
    - [56, 55.377]
  - - [128, 5056, 1, 256]
    - [63, 49.304]
  - - [1856, 704, 1, 1280]
    - [97, 71.403]
  - - [448, 2944, 1, 128]
    - [54, 59.135]
  - - [1408, 256, 1, 256]
    - [55, 38.765]
  - - [2368, 448, 1, 3328]
    - [97, 71.863]
  - - [128, 5888, 1, 3328]
    - [63, 66.503]
  - - [64, 5056, 1, 128]
    - [104, 29.57]
  - - [64, 6784, 1, 128]
    - [62, 33.432]
  - - [448, 704, 1, 128]
    - [55, 29.759]
  - - [1408, 448, 1, 256]
    - [56, 48.7]
  - - [1408, 704, 1, 128]
    - [74, 55.147]
  - - [2368, 256, 1, 3328]
    - [97, 53.884]
  - - [5888, 128, 1, 1280]
    - [56, 65.452]
  - - [256, 3584, 1, 1280]
    - [64, 62.957]
  - - [256, 1408, 1, 128]
    - [55, 32.426]
  - - [256, 4288, 1, 128]
    - [97, 59.248]
  - - [5888, 128, 1, 128]
    - [56, 48.253]
  - - [1408, 448, 1, 3328]
    - [97, 56.523]
  - - [704, 1024, 1, 1280]
    - [56, 62.361]
  - - [1856, 256, 1, 3328]
    - [56, 58.738]
  - - [64, 5888, 1, 1280]
    - [109, 43.786]
  - - [6784, 64, 1, 128]
    - [74, 34.921]
  - - [704, 704, 1, 1280]
    - [56, 58.458]
  - - [128, 2368, 1, 1280]
    - [104, 37.772]
  - - [3584, 256, 1, 1280]
    - [75, 63.854]
  - - [128, 4288, 1, 3328]
    - [105, 67.807]
  - - [3584, 128, 1, 1280]
    - [56, 55.354]
  - - [5056, 128, 1, 1280]
    - [56, 56.424]
  - - [256, 4288, 1, 256]
    - [63, 66.589]
  - - [1024, 448, 1, 256]
    - [56, 45.365]
  - - [2944, 128, 1, 1280]
    - [55, 46.579]
  - - [128, 2368, 1, 128]
    - [55, 28.51]
  - - [256, 2944, 1, 1280]
    - [63, 65.352]
  - - [2560, 128, 1, 2560]
    - [104, 41.309]
  - - [704, 1024, 1, 3328]
    - [56, 64.012]
  - - [128, 6784, 1, 256]
    - [63, 53.748]
  - - [256, 1856, 1, 3328]
    - [56, 59.275]
  - - [6784, 128, 1, 128]
    - [97, 49.552]
  - - [128, 3584, 1, 128]
    - [74, 36.392]
  - - [704, 1408, 1, 256]
    - [64, 59.135]
  - - [4096, 128, 1, 4096]
    - [60, 64.919]
  - - [5888, 64, 1, 128]
    - [62, 33.175]
  - - [5056, 128, 1, 256]
    - [54, 48.474]
  - - [6784, 128, 1, 1280]
    - [75, 60.814]
  - - [1856, 448, 1, 256]
    - [74, 59.649]
  - - [1024, 704, 1, 3328]
    - [56, 64.206]
  - - [128, 4288, 1, 1280]
    - [63, 65.005]
  - - [448, 704, 1, 3328]
    - [96, 40.01]
  - - [1856, 704, 1, 3328]
    - [74, 72.621]
  - - [512, 1500, 1, 2560]
    - [63, 67.008]
  - - [3136, 64, 128, 64]
    - [52, 40.912]
  - - [3136, 64, 128, 256]
    - [66, 45.884]
  - - [3136, 64, 256, 64]
    - [52, 27.986]
  - - [3136, 64, 256, 256]
    - [86, 46.011]
  - - [1024, 512, 1, 2048]
    - [82, 62.122]
  - - [4096, 256, 1, 2048]
    - [64, 73.311]
  - - [2048, 256, 1, 4096]
    - [79, 64.946]
  - - [512, 768, 1, 2048]
    - [104, 48.903]
  - - [2048, 256, 1, 1024]
    - [74, 61.477]
  - - [2048, 200, 1, 512]
    - [97, 44.129]
  - - [4096, 200, 1, 1024]
    - [98, 54.835]
  - - [2048, 200, 1, 4096]
    - [74, 50.843]
  - - [2048, 512, 1, 1024]
    - [106, 71.263]
  - - [1024, 1024, 1, 512]
    - [75, 68.307]
  - - [2048, 512, 1, 4096]
    - [57, 73.361]
  - - [1024, 1024, 1, 4096]
    - [274, 74.284]
  - - [4096, 200, 1, 2048]
    - [75, 56.681]
  - - [2048, 200, 1, 1024]
    - [97, 47.933]
  - - [1024, 768, 1, 512]
    - [97, 64.012]
  - - [2048, 200, 1, 2048]
    - [97, 50.008]
  - - [2048, 256, 1, 2048]
    - [97, 63.742]
  - - [512, 768, 1, 512]
    - [104, 45.099]
  - - [4096, 256, 1, 4096]
    - [106, 73.794]
  - - [1024, 512, 1, 512]
    - [63, 57.615]
  - - [1024, 1024, 1, 2048]
    - [64, 72.49]
  - - [4096, 256, 1, 1024]
    - [64, 71.533]
  - - [512, 768, 1, 1024]
    - [81, 47.707]
  - - [1024, 512, 1, 4096]
    - [79, 65.095]
  - - [4096, 200, 1, 4096]
    - [75, 57.89]
  - - [2048, 256, 1, 512]
    - [56, 58.395]
  - - [1024, 1024, 1, 1024]
    - [64, 70.64]
  - - [4096, 192, 1, 2048]
    - [82, 69.007]
  - - [5329, 64, 64, 160]
    - [52, 38.521]
  - - [1225, 64, 64, 384]
    - [78, 72.855]
  - - [4096, 320, 1, 1280]
    - [74, 71.073]
  - - [4096, 192, 1, 1280]
    - [97, 68.028]
  - - [1225, 96, 64, 384]
    - [60, 58.179]
  - - [4096, 320, 1, 2048]
    - [74, 71.926]
  - - [4096, 256, 1, 1536]
    - [75, 72.752]
  - - [64, 147, 432, 148]
    - [76, 46.741]
  - - [64, 123, 528, 123]
    - [99, 51.032]
  - - [64, 111, 576, 112]
    - [76, 51.461]
  - - [64, 77, 816, 77]
    - [54, 37.655]
  - - [64, 92, 688, 92]
    - [76, 41.413]
  - - [64, 159, 400, 159]
    - [76, 51.37]
  - - [64, 85, 752, 84]
    - [54, 40.123]
  - - [64, 122, 528, 123]
    - [76, 51.226]
  - - [64, 93, 688, 92]
    - [61, 42.879]
  - - [64, 102, 624, 99]
    - [58, 44.206]
  - - [64, 133, 480, 133]
    - [76, 44.319]
  - - [64, 232, 272, 232]
    - [58, 56.866]
  - - [64, 162, 400, 159]
    - [58, 52.544]
  - - [64, 78, 816, 78]
    - [72, 39.04]
  - - [64, 99, 624, 99]
    - [99, 43.777]
  - - [64, 101, 624, 102]
    - [76, 44.662]
  - - [64, 111, 576, 111]
    - [58, 48.036]
  - - [64, 134, 480, 134]
    - [72, 52.065]
  - - [64, 135, 480, 132]
    - [99, 44.296]
  - - [64, 134, 480, 132]
    - [58, 44.206]
  - - [64, 134, 480, 135]
    - [99, 44.251]
  - - [64, 162, 400, 162]
    - [99, 52.3]
  - - [64, 102, 624, 102]
    - [76, 44.675]
  - - [64, 135, 480, 133]
    - [99, 44.107]
  - - [64, 148, 432, 143]
    - [99, 48.636]
  - - [64, 100, 624, 100]
    - [80, 45.045]
  - - [64, 65, 992, 65]
    - [95, 34.957]
  - - [64, 122, 528, 122]
    - [76, 50.653]
  - - [64, 228, 272, 228]
    - [99, 55.99]
  - - [64, 112, 576, 111]
    - [58, 48.88]
  - - [64, 143, 432, 143]
    - [76, 47.22]
  - - [64, 135, 480, 135]
    - [58, 44.301]
  - - [64, 232, 272, 228]
    - [99, 56.753]
  - - [64, 193, 320, 193]
    - [58, 48.203]
  - - [64, 71, 896, 71]
    - [54, 36.288]
  - - [64, 84, 752, 84]
    - [72, 39.92]
  - - [64, 132, 480, 132]
    - [54, 48.145]
  - - [64, 85, 752, 85]
    - [58, 37.461]
  - - [64, 102, 624, 100]
    - [58, 45.65]
  - - [64, 78, 816, 77]
    - [95, 37.438]
  - - [64, 112, 576, 112]
    - [76, 51.312]
  - - [64, 148, 432, 148]
    - [76, 48.772]
  - - [64, 159, 400, 160]
    - [58, 53.211]
  - - [64, 102, 624, 101]
    - [76, 44.792]
  - - [64, 101, 624, 101]
    - [58, 44.098]
  - - [64, 160, 400, 160]
    - [95, 61.729]
  - - [64, 93, 688, 93]
    - [58, 41.165]
  - - [64, 147, 432, 147]
    - [58, 47.274]
  - - [64, 100, 624, 102]
    - [76, 44.63]
  - - [64, 177, 352, 177]
    - [76, 55.359]
  - - [500, 1024, 1, 512]
    - [105, 53.807]
  - - [512, 1024, 1, 512]
    - [105, 58.228]
  - - [200, 2048, 1, 512]
    - [82, 43.322]
  - - [512, 2000, 1, 1024]
    - [64, 68.962]
  - - [512, 2048, 1, 512]
    - [83, 67.965]
  - - [200, 2000, 1, 100]
    - [94, 27.679]
  - - [200, 2000, 1, 1024]
    - [82, 46.177]
  - - [500, 1024, 1, 2048]
    - [82, 61.12]
  - - [512, 2048, 1, 100]
    - [97, 52.449]
  - - [512, 2048, 1, 2000]
    - [75, 74.164]
  - - [200, 2000, 1, 10]
    - [93, 6.939]
  - - [500, 2048, 1, 1024]
    - [83, 67.698]
  - - [500, 2000, 1, 10]
    - [100, 11.167]
  - - [500, 2048, 1, 100]
    - [97, 46.854]
  - - [512, 1024, 1, 500]
    - [97, 57.922]
  - - [200, 2000, 1, 2000]
    - [75, 49.146]
  - - [500, 2048, 1, 2000]
    - [98, 71.43]
  - - [512, 2048, 1, 1024]
    - [64, 70.888]
  - - [512, 1024, 1, 100]
    - [97, 36.392]
  - - [256, 2000, 1, 10]
    - [93, 9.023]
  - - [512, 2000, 1, 100]
    - [97, 49.042]
  - - [512, 2000, 1, 2048]
    - [64, 70.735]
  - - [500, 1024, 1, 500]
    - [56, 54.948]
  - - [256, 2000, 1, 100]
    - [96, 33.576]
  - - [512, 1024, 1, 2048]
    - [82, 63.859]
  - - [500, 2048, 1, 2048]
    - [106, 69.85]
  - - [200, 2048, 1, 10]
    - [93, 7.219]
  - - [500, 2000, 1, 512]
    - [105, 62.772]
  - - [500, 1024, 1, 1024]
    - [105, 58.58]
  - - [200, 2000, 1, 500]
    - [56, 43.01]
  - - [256, 2048, 1, 100]
    - [97, 36.17]
  - - [500, 2000, 1, 1024]
    - [83, 66.115]
  - - [256, 2048, 1, 1024]
    - [105, 61.508]
  - - [200, 2048, 1, 1024]
    - [82, 47.12]
  - - [512, 2048, 1, 500]
    - [75, 69.693]
  - - [512, 2000, 1, 10]
    - [93, 12.904]
  - - [500, 1024, 1, 2000]
    - [75, 62.808]
  - - [512, 2000, 1, 512]
    - [64, 65.452]
  - - [500, 2000, 1, 2000]
    - [75, 69.918]
  - - [500, 1024, 1, 10]
    - [93, 8.135]
  - - [256, 2048, 1, 10]
    - [93, 9.389]
  - - [256, 2048, 1, 500]
    - [97, 57.976]
  - - [256, 2048, 1, 2048]
    - [105, 63.841]
  - - [256, 2000, 1, 512]
    - [64, 52.99]
  - - [512, 1024, 1, 2000]
    - [98, 65.524]
  - - [256, 2000, 1, 2000]
    - [57, 63.065]
  - - [256, 2048, 1, 2000]
    - [75, 65.488]
  - - [200, 2048, 1, 100]
    - [55, 28.433]
  - - [200, 2000, 1, 2048]
    - [63, 48.05]
  - - [500, 2048, 1, 512]
    - [82, 64.491]
  - - [500, 2000, 1, 500]
    - [98, 63.976]
  - - [200, 2048, 1, 2048]
    - [82, 49.345]
  - - [200, 2048, 1, 500]
    - [97, 44.039]
  - - [512, 2000, 1, 500]
    - [98, 66.038]
  - - [200, 2048, 1, 2000]
    - [75, 50.274]
  - - [500, 1024, 1, 100]
    - [53, 33.188]
  - - [512, 1024, 1, 10]
    - [93, 9.096]
  - - [512, 1024, 1, 1024]
    - [105, 61.793]
  - - [500, 2048, 1, 10]
    - [111, 11.379]
  - - [200, 2000, 1, 512]
    - [105, 42.27]
  - - [256, 2000, 1, 500]
    - [97, 54.479]
  - - [256, 2048, 1, 512]
    - [63, 57.782]
  - - [256, 2000, 1, 2048]
    - [82, 61.486]
  - - [500, 2048, 1, 500]
    - [75, 65.736]
  - - [256, 2000, 1, 1024]
    - [105, 58.436]
  - - [500, 2000, 1, 2048]
    - [83, 68.24]
  - - [512, 2000, 1, 2000]
    - [64, 71.597]
  - - [512, 2048, 1, 2048]
    - [64, 72.391]
  - - [512, 2048, 1, 10]
    - [93, 13.364]
  - - [500, 2000, 1, 100]
    - [95, 44.761]
  - - [1024, 1131, 1, 1024]
    - [106, 75.896]
  - - [1024, 1102, 1, 1024]
    - [83, 75.188]
  - - [1024, 774, 1, 1024]
    - [63, 66.575]
  - - [4096, 128, 1, 2048]
    - [56, 63.593]
  - - [4096, 128, 1, 3072]
    - [56, 64.328]
  - - [1024, 1120, 1, 1024]
    - [83, 76.149]
  - - [1024, 1015, 1, 1024]
    - [83, 69.07]
  - - [1024, 992, 1, 1024]
    - [106, 67.662]
  - - [1024, 950, 1, 1024]
    - [106, 65.402]
  - - [1024, 1088, 1, 1024]
    - [83, 74.466]
  - - [64, 128, 96, 128]
    - [107, 42.925]
  - - [768, 1024, 1, 3072]
    - [274, 70.441]
  - - [768, 512, 1, 3072]
    - [272, 55.084]
  - - [64, 256, 192, 256]
    - [65, 59.541]
  - - [64, 128, 384, 128]
    - [107, 52.656]
  - - [64, 256, 96, 256]
    - [65, 52.719]
  - - [6272, 112, 1, 512]
    - [97, 56.383]
  - - [2048, 320, 1, 1280]
    - [97, 57.155]
  - - [5329, 64, 1, 448]
    - [102, 38.214]
  - - [784, 64, 32, 192]
    - [54, 63.57]
  - - [6272, 64, 1, 480]
    - [55, 46.787]
  - - [6272, 64, 1, 512]
    - [55, 46.972]
  - - [6272, 160, 1, 528]
    - [74, 54.479]
  - - [289, 160, 32, 768]
    - [82, 51.641]
  - - [5329, 64, 32, 160]
    - [82, 55.562]
  - - [5329, 96, 1, 576]
    - [97, 40.533]
  - - [1225, 64, 32, 288]
    - [56, 74.976]
  - - [289, 192, 32, 768]
    - [82, 61.77]
  - - [2048, 448, 1, 1280]
    - [75, 63.092]
  - - [3136, 64, 32, 64]
    - [54, 71.109]
  - - [6272, 128, 1, 528]
    - [74, 66.498]
  - - [6272, 96, 1, 480]
    - [97, 48.582]
  - - [2048, 448, 1, 2048]
    - [75, 63.399]
  - - [784, 96, 32, 192]
    - [74, 51.213]
  - - [1001, 512, 1, 4096]
    - [101, 63.101]
  - - [2048, 192, 1, 1280]
    - [55, 48.42]
  - - [1225, 64, 32, 256]
    - [78, 69.323]
  - - [2048, 256, 1, 1536]
    - [56, 63.345]
  - - [6272, 128, 1, 512]
    - [74, 65.858]
  - - [1568, 384, 1, 832]
    - [74, 50.928]
  - - [1568, 256, 1, 832]
    - [55, 48.262]
  - - [1568, 192, 1, 832]
    - [71, 37.172]
  - - [289, 192, 32, 1024]
    - [63, 61.707]
  - - [1225, 64, 32, 384]
    - [56, 75.905]
  - - [2048, 320, 1, 2048]
    - [63, 57.615]
  - - [2048, 384, 1, 1536]
    - [74, 68.244]
  - - [5041, 96, 1, 576]
    - [97, 40.231]
  - - [6272, 192, 1, 480]
    - [97, 65.199]
  - - [5041, 192, 1, 720]
    - [97, 63.033]
  - - [289, 128, 32, 768]
    - [106, 54.763]
  - - [12544, 64, 1, 147]
    - [97, 52.201]
  - - [6272, 160, 1, 512]
    - [97, 54.366]
  - - [1225, 64, 32, 192]
    - [105, 71.867]
  - - [784, 64, 32, 256]
    - [105, 59.176]
  - - [6272, 144, 1, 512]
    - [56, 48.497]
  - - [8192, 192, 1, 1280]
    - [97, 73.514]
  - - [8192, 192, 1, 2048]
    - [56, 73.803]
  - - [65, 6400, 1, 1024]
    - [63, 34.794]
  - - [512, 1290, 1, 2048]
    - [105, 57.714]
  - - [512, 2205, 1, 2048]
    - [64, 77.615]
  - - [64, 512, 16, 512]
    - [107, 50.17]
  - - [512, 600, 1, 2048]
    - [104, 38.305]
  - - [512, 644, 1, 512]
    - [81, 37.632]
  - - [512, 644, 1, 2048]
    - [81, 41.025]
  - - [512, 668, 1, 2048]
    - [81, 42.636]
  - - [512, 714, 1, 512]
    - [104, 41.395]
  - - [512, 714, 1, 2048]
    - [104, 45.474]
  - - [512, 720, 1, 512]
    - [81, 41.783]
  - - [512, 720, 1, 2048]
    - [104, 45.821]
  - - [512, 722, 1, 2048]
    - [104, 45.961]
  - - [512, 781, 1, 512]
    - [104, 45.104]
  - - [512, 781, 1, 2048]
    - [81, 49.769]
  - - [512, 848, 1, 2048]
    - [82, 52.58]
  - - [512, 872, 1, 2048]
    - [82, 54.136]
  - - [512, 936, 1, 512]
    - [105, 51.253]
  - - [512, 936, 1, 2048]
    - [82, 57.912]
  - - [512, 980, 1, 512]
    - [64, 52.07]
  - - [512, 980, 1, 2048]
    - [105, 60.556]
  - - [512, 1139, 1, 2048]
    - [82, 69.783]
  - - [512, 1184, 1, 2048]
    - [82, 52.814]
  - - [512, 1186, 1, 2048]
    - [82, 53.144]
  - - [512, 1232, 1, 512]
    - [105, 50.734]
  - - [512, 1232, 1, 2048]
    - [82, 55.476]
  - - [512, 1279, 1, 2048]
    - [82, 57.376]
  - - [512, 1290, 1, 512]
    - [105, 52.756]
  - - [512, 1327, 1, 2048]
    - [82, 59.338]
  - - [512, 1331, 1, 2048]
    - [105, 59.18]
  - - [512, 1341, 1, 2048]
    - [82, 59.974]
  - - [512, 1350, 1, 512]
    - [105, 55.481]
  - - [512, 1350, 1, 2048]
    - [82, 60.642]
  - - [512, 1359, 1, 2048]
    - [105, 60.629]
  - - [512, 1391, 1, 2048]
    - [82, 62.185]
  - - [512, 1424, 1, 512]
    - [105, 58.116]
  - - [512, 1424, 1, 2048]
    - [63, 63.624]
  - - [512, 1458, 1, 512]
    - [105, 59.505]
  - - [512, 1458, 1, 2048]
    - [105, 64.987]
  - - [512, 1462, 1, 512]
    - [105, 59.379]
  - - [512, 1462, 1, 2048]
    - [105, 65.055]
  - - [512, 1467, 1, 2048]
    - [82, 65.131]
  - - [512, 1472, 1, 2048]
    - [105, 65.835]
  - - [512, 1520, 1, 512]
    - [105, 61.734]
  - - [512, 1520, 1, 2048]
    - [82, 67.595]
  - - [512, 1596, 1, 512]
    - [63, 63.814]
  - - [512, 1596, 1, 2048]
    - [82, 70.685]
  - - [512, 1599, 1, 512]
    - [63, 63.421]
  - - [512, 1599, 1, 2048]
    - [63, 70.775]
  - - [512, 1615, 1, 512]
    - [63, 64.748]
  - - [512, 1615, 1, 2048]
    - [105, 71.727]
  - - [512, 1680, 1, 512]
    - [83, 55.688]
  - - [512, 1680, 1, 2048]
    - [106, 59.839]
  - - [512, 1709, 1, 2048]
    - [64, 60.899]
  - - [512, 1890, 1, 512]
    - [83, 61.919]
  - - [512, 1902, 1, 2048]
    - [83, 67.342]
  - - [512, 1917, 1, 512]
    - [83, 62.253]
  - - [512, 1917, 1, 2048]
    - [106, 67.518]
  - - [512, 2076, 1, 2048]
    - [106, 73.27]
  - - [512, 2195, 1, 2048]
    - [83, 77.218]
  - - [512, 2205, 1, 512]
    - [106, 71.763]
  - - [2048, 198, 1, 512]
    - [74, 43.692]
  - - [2048, 207, 1, 512]
    - [74, 45.677]
  - - [2048, 208, 1, 512]
    - [74, 45.767]
  - - [2048, 245, 1, 512]
    - [82, 51.835]
  - - [2048, 246, 1, 512]
    - [74, 52.282]
  - - [2048, 264, 1, 512]
    - [56, 43.547]
  - - [2048, 401, 1, 512]
    - [75, 55.052]
  - - [2048, 439, 1, 512]
    - [98, 58.567]
  - - [2048, 443, 1, 512]
    - [98, 58.905]
  - - [2048, 446, 1, 512]
    - [75, 59.104]
  - - [2048, 465, 1, 512]
    - [97, 61.585]
  - - [2048, 468, 1, 512]
    - [97, 61.639]
  - - [2048, 493, 1, 512]
    - [74, 63.724]
  - - [2048, 495, 1, 512]
    - [97, 64.725]
  - - [2048, 511, 1, 512]
    - [97, 66.413]
  - - [2048, 512, 1, 512]
    - [75, 69.327]
  - - [2048, 540, 1, 512]
    - [63, 69.156]
  - - [2048, 550, 1, 512]
    - [63, 70.135]
  - - [2048, 560, 1, 512]
    - [63, 71.218]
  - - [2048, 600, 1, 512]
    - [97, 64.364]
  - - [64, 64, 496, 64]
    - [77, 40.29]
  - - [64, 65, 496, 64]
    - [54, 32.521]
  - - [64, 65, 496, 65]
    - [95, 31.483]
  - - [64, 70, 216, 70]
    - [54, 30.377]
  - - [64, 71, 216, 71]
    - [54, 30.702]
  - - [64, 78, 248, 77]
    - [95, 33.973]
  - - [64, 80, 152, 80]
    - [72, 29.507]
  - - [64, 93, 344, 93]
    - [55, 36.464]
  - - [64, 102, 312, 102]
    - [55, 39.451]
  - - [64, 122, 264, 122]
    - [77, 43.84]
  - - [64, 122, 264, 123]
    - [59, 43.998]
  - - [64, 123, 264, 123]
    - [77, 44.562]
  - - [64, 512, 96, 512]
    - [107, 62.785]
  - - [64, 512, 128, 512]
    - [69, 48.984]
  - - [64, 128, 512, 128]
    - [107, 51.037]
  - - [64, 512, 64, 512]
    - [65, 56.293]
  - - [2048, 512, 1, 2048]
    - [64, 72.53]
  - - [512, 1600, 1, 32]
    - [93, 27.124]
  - - [512, 1600, 1, 512]
    - [63, 66.963]
  - - [560, 1600, 1, 1024]
    - [64, 60.132]
  - - [1024, 512, 1, 3072]
    - [79, 64.373]
  - - [64, 192, 64, 1280]
    - [65, 60.85]
  - - [64, 320, 64, 1280]
    - [65, 57.213]
  - - [64, 384, 64, 1280]
    - [107, 49.458]
  - - [64, 448, 64, 1280]
    - [90, 46.457]
  - - [64, 192, 64, 2048]
    - [107, 57.863]
  - - [64, 320, 64, 2048]
    - [108, 39.5]
  - - [64, 384, 64, 2048]
    - [70, 39.013]
  - - [64, 448, 64, 2048]
    - [91, 38.165]
  - - [1225, 64, 64, 192]
    - [74, 76.902]
  - - [1225, 64, 64, 256]
    - [63, 77.065]
  - - [1225, 64, 64, 288]
    - [97, 79.122]
  - - [5329, 80, 64, 64]
    - [52, 34.749]
  - - [3136, 64, 64, 64]
    - [74, 74.989]
  - - [3136, 64, 64, 256]
    - [66, 45.821]
  - - [64, 192, 32, 1280]
    - [81, 45.289]
  - - [64, 320, 32, 1280]
    - [65, 51.438]
  - - [64, 384, 32, 1280]
    - [65, 60.782]
  - - [64, 448, 32, 1280]
    - [107, 56.203]
  - - [64, 192, 32, 2048]
    - [62, 46.308]
  - - [64, 320, 32, 2048]
    - [84, 52.264]
  - - [64, 384, 32, 2048]
    - [65, 60.525]
  - - [64, 448, 32, 2048]
    - [65, 55.702]
  - - [5329, 80, 32, 64]
    - [97, 48.645]
  - - [3136, 64, 32, 256]
    - [74, 79.934]
  - - [196, 256, 32, 1024]
    - [105, 56.207]
  - - [256, 4096, 1, 4]
    - [93, 6.186]
  - - [960, 1024, 1, 1024]
    - [83, 65.479]
  - - [768, 768, 1, 768]
    - [97, 67.807]
  - - [768, 768, 1, 384]
    - [97, 62.69]
  - - [100, 128, 120, 512]
    - [105, 58.147]
  - - [100, 128, 139, 512]
    - [105, 59.257]
  - - [100, 128, 160, 512]
    - [67, 59.388]
  - - [22500, 64, 1, 147]
    - [82, 62.014]
  - - [1024, 960, 1, 1024]
    - [83, 65.686]
  - - [1024, 616, 1, 1024]
    - [63, 53.162]
  - - [64, 128, 128, 128]
    - [107, 47.089]
  - - [64, 128, 160, 128]
    - [68, 44.265]
  - - [1024, 1024, 1, 2]
    - [61, 3.072]
  - - [64, 128, 624, 128]
    - [65, 58.828]
  - - [1024, 780, 1, 1024]
    - [63, 66.972]
  - - [64, 128, 640, 128]
    - [107, 57.827]
  - - [1024, 800, 1, 1024]
    - [105, 68.438]
  - - [64, 128, 656, 128]
    - [65, 58.337]
  - - [1024, 820, 1, 1024]
    - [82, 70.049]
  - - [64, 512, 80, 512]
    - [84, 61.057]
  - - [1024, 385, 1, 1024]
    - [97, 45.762]
  - - [1024, 462, 1, 1024]
    - [97, 54.835]
  - - [64, 128, 144, 128]
    - [107, 50.315]
  - - [1024, 960, 1, 64]
    - [54, 44.075]
  - - [64, 512, 256, 512]
    - [70, 44.31]
  - - [64, 512, 40, 512]
    - [84, 52.237]
  - - [96, 1024, 64, 1024]
    - [110, 47.662]
  - - [96, 1024, 128, 1024]
    - [89, 48.767]
  - - [64, 1024, 256, 1024]
    - [112, 44.043]
  - - [64, 1024, 32, 1024]
    - [107, 52.092]
  - - [64, 1024, 64, 1024]
    - [112, 44.138]
  - - [64, 1024, 128, 1024]
    - [112, 43.886]
  - - [64, 128, 1024, 128]
    - [107, 58.607]
  - - [1024, 864, 1, 1024]
    - [83, 58.328]
  - - [1024, 864, 1, 512]
    - [63, 56.302]
  - - [256, 3456, 1, 128]
    - [105, 49.507]
  - - [256, 4096, 1, 128]
    - [97, 56.595]
  - - [480, 864, 1, 1024]
    - [82, 47.996]
  - - [512, 864, 1, 256]
    - [103, 38.706]
  - - [64, 128, 1280, 128]
    - [108, 32.647]
  - - [64, 128, 1312, 128]
    - [85, 31.74]
  - - [64, 512, 192, 512]
    - [112, 43.664]
  - - [256, 4096, 1, 1]
    - [93, 1.462]
  - - [64, 128, 2048, 128]
    - [219, 31.122]
  - - [64, 128, 1536, 128]
    - [218, 31.501]
  - - [64, 128, 192, 128]
    - [88, 43.01]
  - - [64, 384, 144, 384]
    - [107, 63.561]
  - - [64, 512, 48, 512]
    - [65, 55.95]
  - - [64, 128, 256, 128]
    - [109, 48.56]
  - - [64, 384, 192, 384]
    - [68, 54.326]
  - - [950, 512, 2, 2048]
    - [64, 66.092]
  - - [3400, 256, 1, 1024]
    - [75, 58.738]
  - - [3800, 256, 1, 1024]
    - [57, 65.267]
  - - [850, 512, 2, 2048]
    - [64, 59.902]
  - - [805, 512, 2, 2048]
    - [65, 63.345]
  - - [864, 512, 2, 2048]
    - [64, 60.962]
  - - [950, 256, 2, 2048]
    - [63, 57.709]
  - - [888, 512, 2, 2048]
    - [106, 62.393]
  - - [51520, 64, 2, 256]
    - [56, 80.94]
  - - [46464, 64, 2, 256]
    - [97, 81.739]
  - - [49152, 64, 2, 256]
    - [97, 82.276]
  - - [1900, 512, 1, 1024]
    - [83, 64.761]
  - - [1700, 512, 1, 1024]
    - [83, 58.499]
  - - [1610, 512, 1, 1024]
    - [105, 67.96]
  - - [1536, 512, 1, 1024]
    - [82, 66.814]
  - - [1728, 512, 1, 1024]
    - [106, 59.514]
  - - [1024, 1024, 1, 320]
    - [75, 66.868]
  - - [51520, 64, 2, 64]
    - [103, 71.745]
  - - [55296, 64, 2, 64]
    - [97, 74.371]
  - - [49152, 64, 2, 64]
    - [56, 72.436]
  - - [54400, 64, 2, 64]
    - [63, 74.525]
  - - [42240, 64, 2, 256]
    - [97, 81.739]
  - - [672, 512, 2, 2048]
    - [82, 59.893]
  - - [54400, 64, 2, 256]
    - [87, 78.847]
  - - [56832, 64, 2, 256]
    - [67, 76.704]
  - - [55296, 64, 2, 256]
    - [110, 77.71]
  - - [60800, 64, 2, 64]
    - [56, 70.798]
  - - [660, 512, 2, 2048]
    - [82, 58.616]
  - - [768, 512, 2, 2048]
    - [82, 68.565]
  - - [43008, 64, 2, 256]
    - [97, 82.921]
  - - [864, 256, 2, 2048]
    - [63, 52.877]
  - - [726, 512, 2, 2048]
    - [82, 64.405]
  - - [768, 256, 2, 2048]
    - [104, 48.821]
  - - [45632, 64, 2, 256]
    - [63, 82.032]
  - - [713, 512, 2, 2048]
    - [82, 63.119]
  - - [805, 256, 2, 2048]
    - [81, 50.942]
  - - [60800, 64, 2, 256]
    - [67, 67.423]
  - - [850, 256, 2, 2048]
    - [82, 50.797]
  - - [1024, 1024, 1, 81]
    - [56, 48.262]
  - - [96, 1024, 160, 1024]
    - [87, 49.814]
  - - [96, 1024, 40, 1024]
    - [67, 51.023]
  - - [96, 1024, 80, 1024]
    - [87, 47.788]
  - - [96, 1024, 96, 1024]
    - [67, 48.632]
  - - [96, 1024, 24, 1024]
    - [63, 60.186]
  - - [96, 1024, 48, 1024]
    - [67, 49.097]
  - - [96, 1024, 16, 1024]
    - [82, 55.142]
  - - [96, 1024, 32, 1024]
    - [110, 57.236]
  - - [64, 512, 320, 512]
    - [70, 44.634]
  - - [64, 1024, 512, 1024]
    - [70, 44.332]
  - - [1024, 80, 1, 30522]
    - [113, 38.859]
  - - [1024, 120, 1, 30522]
    - [113, 57.732]
  - - [1024, 77, 1, 30522]
    - [113, 37.465]
  - - [1024, 200, 1, 30522]
    - [119, 55.882]
  - - [1024, 160, 1, 30522]
    - [113, 55.512]
  - - [1024, 180, 1, 30522]
    - [113, 62.713]
  - - [1024, 160, 1, 30528]
    - [115, 55.751]
  - - [1024, 240, 1, 30528]
    - [114, 66.327]
  - - [2560, 109, 1, 29000]
    - [118, 59.149]
  - - [2560, 121, 1, 29000]
    - [116, 65.591]
  - - [2560, 65, 1, 29000]
    - [115, 35.462]
  - - [2560, 66, 1, 29000]
    - [118, 35.972]
  - - [2560, 67, 1, 29000]
    - [118, 36.581]
  - - [2560, 69, 1, 29000]
    - [116, 37.655]
  - - [2560, 70, 1, 29000]
    - [116, 38.174]
  - - [2560, 71, 1, 29000]
    - [116, 38.652]
  - - [2560, 73, 1, 29000]
    - [116, 39.762]
  - - [2560, 74, 1, 29000]
    - [118, 40.199]
  - - [2560, 75, 1, 29000]
    - [118, 40.885]
  - - [2560, 77, 1, 29000]
    - [118, 41.959]
  - - [2560, 78, 1, 29000]
    - [118, 42.532]
  - - [2560, 80, 1, 29000]
    - [118, 43.592]
  - - [2560, 81, 1, 29000]
    - [118, 44.066]
  - - [2560, 82, 1, 29000]
    - [117, 44.472]
  - - [2560, 83, 1, 29000]
    - [118, 45.262]
  - - [2560, 84, 1, 29000]
    - [118, 45.735]
  - - [2560, 88, 1, 29000]
    - [118, 47.847]
  - - [2560, 89, 1, 29000]
    - [116, 48.442]
  - - [2560, 90, 1, 29000]
    - [118, 48.961]
  - - [2560, 92, 1, 29000]
    - [116, 50.058]
  - - [2560, 95, 1, 29000]
    - [118, 51.551]
  - - [2560, 98, 1, 29000]
    - [118, 53.265]
  - - [512, 200, 1, 32]
    - [124, 5.477]
  - - [1024, 200, 1, 1]
    - [143, 0.541]
  - - [512, 200, 1, 1]
    - [145, 0.298]
  - - [768, 320, 1, 768]
    - [169, 29.484]
  - - [768, 160, 1, 768]
    - [123, 23.948]
  - - [1024, 120, 1, 1024]
    - [168, 22.983]
  - - [1024, 160, 1, 1024]
    - [144, 25.451]
  - - [2368, 64, 1, 3328]
    - [135, 24.467]
  - - [64, 3584, 1, 1280]
    - [137, 27.968]
  - - [1408, 64, 1, 128]
    - [122, 13.346]
  - - [1408, 64, 1, 1280]
    - [122, 18.827]
  - - [4096, 32, 1, 4096]
    - [128, 25.852]
  - - [3072, 64, 1, 1024]
    - [123, 30.441]
  - - [2944, 64, 1, 256]
    - [123, 25.13]
  - - [448, 448, 1, 3328]
    - [144, 32.493]
  - - [1024, 256, 1, 3328]
    - [146, 32.173]
  - - [6144, 32, 1, 2560]
    - [168, 30.788]
  - - [1856, 64, 1, 1280]
    - [123, 22.834]
  - - [704, 128, 1, 1280]
    - [135, 19.103]
  - - [4288, 64, 1, 3328]
    - [146, 33.716]
  - - [64, 3584, 1, 3328]
    - [154, 28.658]
  - - [1760, 128, 1, 1760]
    - [125, 27.503]
  - - [704, 256, 1, 128]
    - [123, 20.172]
  - - [128, 1408, 1, 128]
    - [168, 19.937]
  - - [1024, 256, 1, 256]
    - [146, 27.779]
  - - [448, 448, 1, 256]
    - [123, 26.705]
  - - [7680, 32, 1, 2560]
    - [135, 28.807]
  - - [128, 1024, 1, 3328]
    - [162, 28.564]
  - - [64, 1856, 1, 1280]
    - [153, 25.73]
  - - [256, 1024, 1, 256]
    - [146, 28.189]
  - - [1024, 128, 1, 1280]
    - [153, 25.523]
  - - [3072, 32, 1, 1024]
    - [327, 18.955]
  - - [448, 256, 1, 3328]
    - [123, 25.171]
  - - [128, 1024, 1, 128]
    - [135, 16.973]
  - - [128, 704, 1, 1280]
    - [168, 19.712]
  - - [1856, 128, 1, 3328]
    - [146, 29.254]
  - - [35, 8457, 1, 1760]
    - [146, 18.674]
  - - [64, 2944, 1, 128]
    - [168, 20.767]
  - - [8448, 32, 1, 2816]
    - [153, 31.447]
  - - [1408, 128, 1, 1280]
    - [123, 28.234]
  - - [128, 1856, 1, 1280]
    - [146, 29.069]
  - - [256, 448, 1, 256]
    - [153, 19.085]
  - - [2048, 128, 1, 2048]
    - [146, 31.88]
  - - [128, 1856, 1, 128]
    - [146, 22.491]
  - - [64, 1408, 1, 3328]
    - [135, 20.181]
  - - [128, 1408, 1, 256]
    - [135, 23.926]
  - - [35, 8457, 1, 2560]
    - [154, 18.66]
  - - [4288, 64, 1, 128]
    - [125, 25.315]
  - - [256, 448, 1, 3328]
    - [153, 25.672]
  - - [64, 2368, 1, 1280]
    - [168, 23.98]
  - - [2368, 64, 1, 256]
    - [123, 20.307]
  - - [1024, 128, 1, 128]
    - [123, 15.768]
  - - [704, 128, 1, 3328]
    - [123, 19.978]
  - - [4288, 64, 1, 1280]
    - [146, 33.057]
  - - [2560, 64, 1, 2560]
    - [123, 26.398]
  - - [1408, 128, 1, 128]
    - [123, 20.172]
  - - [128, 1024, 1, 1280]
    - [153, 28.352]
  - - [2944, 64, 1, 128]
    - [123, 21.169]
  - - [1024, 128, 1, 3328]
    - [153, 26.646]
  - - [704, 128, 1, 256]
    - [122, 15.868]
  - - [448, 256, 1, 1280]
    - [135, 24.62]
  - - [64, 4288, 1, 3328]
    - [169, 34.0]
  - - [2944, 64, 1, 3328]
    - [162, 30.188]
  - - [1856, 128, 1, 1280]
    - [125, 28.821]
  - - [64, 3584, 1, 256]
    - [154, 24.715]
  - - [3584, 64, 1, 128]
    - [123, 21.16]
  - - [256, 1024, 1, 1280]
    - [146, 32.263]
  - - [64, 4288, 1, 128]
    - [154, 25.478]
  - - [3584, 64, 1, 1280]
    - [163, 27.585]
  - - [1408, 128, 1, 3328]
    - [168, 28.843]
  - - [64, 2944, 1, 3328]
    - [153, 30.432]
  - - [64, 1856, 1, 256]
    - [153, 20.0]
  - - [128, 1500, 1, 1280]
    - [135, 29.822]
  - - [35, 8457, 1, 4096]
    - [154, 17.988]
  - - [256, 704, 1, 256]
    - [162, 21.864]
  - - [2368, 64, 1, 128]
    - [162, 17.027]
  - - [256, 1024, 1, 128]
    - [146, 24.499]
  - - [64, 1408, 1, 128]
    - [134, 12.944]
  - - [704, 256, 1, 3328]
    - [144, 29.231]
  - - [35, 8457, 1, 2048]
    - [154, 18.647]
  - - [64, 2944, 1, 256]
    - [168, 25.013]
  - - [448, 256, 1, 128]
    - [135, 15.051]
  - - [64, 1408, 1, 1280]
    - [168, 19.667]
  - - [1408, 128, 1, 256]
    - [123, 24.147]
  - - [64, 2944, 1, 1280]
    - [168, 29.583]
  - - [128, 704, 1, 128]
    - [122, 13.206]
  - - [256, 448, 1, 1280]
    - [135, 24.657]
  - - [704, 256, 1, 1280]
    - [144, 28.451]
  - - [64, 2368, 1, 3328]
    - [135, 24.634]
  - - [1856, 64, 1, 128]
    - [135, 15.177]
  - - [4096, 64, 1, 4096]
    - [137, 32.006]
  - - [704, 128, 1, 128]
    - [122, 13.206]
  - - [256, 704, 1, 3328]
    - [168, 29.173]
  - - [256, 448, 1, 128]
    - [162, 14.397]
  - - [64, 3584, 1, 128]
    - [154, 21.503]
  - - [1024, 128, 1, 256]
    - [123, 19.712]
  - - [2944, 64, 1, 1280]
    - [123, 29.439]
  - - [128, 1408, 1, 3328]
    - [123, 29.123]
  - - [1408, 64, 1, 256]
    - [122, 16.012]
  - - [64, 1856, 1, 128]
    - [135, 15.66]
  - - [64, 2368, 1, 256]
    - [168, 20.213]
  - - [1856, 128, 1, 128]
    - [125, 22.64]
  - - [2368, 64, 1, 1280]
    - [123, 24.057]
  - - [4288, 64, 1, 256]
    - [146, 29.403]
  - - [64, 4288, 1, 1280]
    - [154, 33.522]
  - - [1408, 64, 1, 3328]
    - [123, 19.382]
  - - [1024, 256, 1, 128]
    - [146, 24.26]
  - - [256, 704, 1, 128]
    - [123, 19.937]
  - - [448, 448, 1, 1280]
    - [162, 31.6]
  - - [1024, 256, 1, 1280]
    - [125, 32.06]
  - - [128, 1024, 1, 256]
    - [135, 22.067]
  - - [3584, 64, 1, 3328]
    - [169, 28.23]
  - - [256, 1024, 1, 3328]
    - [137, 32.683]
  - - [1856, 64, 1, 3328]
    - [123, 23.637]
  - - [448, 256, 1, 256]
    - [153, 19.594]
  - - [4608, 32, 1, 1536]
    - [149, 27.86]
  - - [128, 704, 1, 256]
    - [122, 15.768]
  - - [3584, 64, 1, 256]
    - [123, 24.305]
  - - [64, 1856, 1, 3328]
    - [135, 26.502]
  - - [128, 704, 1, 3328]
    - [135, 20.1]
  - - [128, 1856, 1, 256]
    - [154, 25.595]
  - - [64, 4288, 1, 256]
    - [154, 29.403]
  - - [1856, 64, 1, 256]
    - [168, 19.107]
  - - [2560, 32, 1, 2560]
    - [152, 17.524]
  - - [256, 704, 1, 1280]
    - [123, 28.361]
  - - [64, 2368, 1, 128]
    - [135, 16.833]
  - - [176, 1500, 1, 1408]
    - [146, 32.426]
  - - [1856, 128, 1, 256]
    - [125, 25.983]
  - - [2048, 64, 1, 2048]
    - [165, 25.284]
  - - [64, 1408, 1, 256]
    - [152, 15.674]
  - - [128, 1408, 1, 1280]
    - [153, 28.311]
  - - [128, 1856, 1, 3328]
    - [169, 29.719]
  - - [1760, 64, 1, 1760]
    - [160, 22.229]
  - - [448, 448, 1, 128]
    - [123, 22.374]
  - - [704, 256, 1, 256]
    - [162, 24.038]
  - - [1024, 256, 1, 1024]
    - [259, 36.722]
  - - [512, 200, 1, 512]
    - [135, 19.486]
  - - [1024, 200, 1, 1024]
    - [125, 24.706]
  - - [512, 256, 1, 1024]
    - [168, 27.526]
  - - [1024, 256, 1, 2048]
    - [125, 32.331]
  - - [1024, 200, 1, 4096]
    - [146, 25.207]
  - - [1024, 200, 1, 512]
    - [146, 23.632]
  - - [512, 200, 1, 1024]
    - [168, 21.543]
  - - [512, 256, 1, 512]
    - [168, 24.9]
  - - [1024, 256, 1, 4096]
    - [288, 51.296]
  - - [1024, 200, 1, 2048]
    - [125, 25.324]
  - - [1024, 256, 1, 512]
    - [125, 30.156]
  - - [512, 200, 1, 2048]
    - [135, 21.67]
  - - [64, 32, 1984, 32]
    - [141, 29.989]
  - - [64, 38, 1680, 38]
    - [135, 22.252]
  - - [64, 59, 1088, 59]
    - [135, 33.648]
  - - [64, 54, 1184, 54]
    - [135, 31.212]
  - - [64, 49, 1296, 49]
    - [168, 27.612]
  - - [64, 45, 1424, 45]
    - [135, 26.051]
  - - [64, 35, 1808, 35]
    - [162, 20.149]
  - - [64, 41, 1552, 41]
    - [135, 23.195]
  - - [512, 512, 1, 1024]
    - [169, 31.853]
  - - [512, 512, 1, 2000]
    - [125, 32.403]
  - - [100, 1024, 1, 2048]
    - [153, 22.004]
  - - [100, 2000, 1, 1024]
    - [137, 24.241]
  - - [128, 2000, 1, 100]
    - [146, 21.71]
  - - [64, 2000, 1, 1024]
    - [135, 26.709]
  - - [100, 1024, 1, 1024]
    - [168, 21.602]
  - - [128, 1024, 1, 512]
    - [135, 25.703]
  - - [512, 500, 1, 2000]
    - [146, 31.564]
  - - [500, 512, 1, 100]
    - [125, 21.39]
  - - [100, 1024, 1, 500]
    - [135, 19.152]
  - - [128, 2000, 1, 512]
    - [154, 29.159]
  - - [256, 1024, 1, 100]
    - [146, 21.904]
  - - [200, 500, 1, 1024]
    - [168, 21.174]
  - - [100, 2000, 1, 512]
    - [137, 23.032]
  - - [200, 512, 1, 100]
    - [166, 11.379]
  - - [64, 2048, 1, 10]
    - [124, 3.212]
  - - [64, 2048, 1, 500]
    - [168, 24.846]
  - - [512, 512, 1, 512]
    - [146, 30.707]
  - - [500, 500, 1, 2000]
    - [125, 30.878]
  - - [256, 500, 1, 10]
    - [161, 3.009]
  - - [512, 500, 1, 512]
    - [146, 29.57]
  - - [128, 1024, 1, 2000]
    - [144, 28.374]
  - - [100, 2000, 1, 2048]
    - [137, 24.693]
  - - [256, 512, 1, 10]
    - [145, 3.082]
  - - [64, 2000, 1, 2048]
    - [168, 26.66]
  - - [64, 2048, 1, 512]
    - [135, 25.487]
  - - [64, 2000, 1, 10]
    - [124, 3.14]
  - - [128, 1024, 1, 500]
    - [135, 24.598]
  - - [200, 512, 1, 1024]
    - [168, 21.62]
  - - [128, 2048, 1, 10]
    - [161, 5.477]
  - - [64, 2048, 1, 100]
    - [168, 14.149]
  - - [64, 2000, 1, 100]
    - [168, 13.246]
  - - [200, 500, 1, 100]
    - [159, 10.896]
  - - [500, 500, 1, 500]
    - [146, 28.834]
  - - [128, 2048, 1, 512]
    - [154, 30.522]
  - - [100, 2048, 1, 500]
    - [146, 23.474]
  - - [500, 500, 1, 2048]
    - [146, 30.675]
  - - [128, 2000, 1, 2000]
    - [125, 31.55]
  - - [256, 500, 1, 1024]
    - [168, 26.854]
  - - [64, 2048, 1, 2000]
    - [135, 28.889]
  - - [100, 2048, 1, 1024]
    - [137, 24.769]
  - - [128, 1024, 1, 100]
    - [162, 13.689]
  - - [256, 1024, 1, 2048]
    - [137, 32.349]
  - - [500, 512, 1, 512]
    - [154, 29.511]
  - - [256, 500, 1, 2000]
    - [123, 27.697]
  - - [256, 512, 1, 100]
    - [162, 13.562]
  - - [128, 2000, 1, 500]
    - [146, 29.403]
  - - [200, 512, 1, 2048]
    - [144, 20.925]
  - - [64, 2048, 1, 2048]
    - [168, 27.499]
  - - [200, 1024, 1, 2048]
    - [137, 25.306]
  - - [512, 512, 1, 10]
    - [161, 5.527]
  - - [512, 500, 1, 10]
    - [161, 5.252]
  - - [200, 512, 1, 10]
    - [124, 2.567]
  - - [500, 500, 1, 1024]
    - [137, 30.206]
  - - [256, 1024, 1, 512]
    - [169, 30.49]
  - - [256, 500, 1, 512]
    - [168, 24.156]
  - - [200, 500, 1, 2048]
    - [151, 19.811]
  - - [100, 2000, 1, 10]
    - [161, 4.065]
  - - [100, 2048, 1, 2048]
    - [137, 25.284]
  - - [128, 1024, 1, 2048]
    - [153, 27.968]
  - - [100, 2000, 1, 500]
    - [125, 22.902]
  - - [100, 2048, 1, 100]
    - [146, 17.113]
  - - [100, 1024, 1, 10]
    - [124, 2.459]
  - - [100, 1024, 1, 2000]
    - [153, 22.125]
  - - [256, 512, 1, 500]
    - [144, 24.354]
  - - [100, 2000, 1, 100]
    - [146, 16.77]
  - - [128, 1024, 1, 10]
    - [161, 3.145]
  - - [100, 2048, 1, 10]
    - [161, 4.124]
  - - [512, 500, 1, 100]
    - [146, 21.792]
  - - [128, 2000, 1, 1024]
    - [137, 30.914]
  - - [200, 1024, 1, 500]
    - [146, 23.718]
  - - [256, 512, 1, 2000]
    - [123, 28.419]
  - - [256, 1024, 1, 2000]
    - [146, 32.548]
  - - [200, 512, 1, 500]
    - [135, 19.283]
  - - [64, 2000, 1, 512]
    - [168, 24.237]
  - - [200, 1024, 1, 100]
    - [146, 17.569]
  - - [200, 1024, 1, 1024]
    - [137, 24.796]
  - - [500, 512, 1, 2000]
    - [125, 31.636]
  - - [200, 500, 1, 512]
    - [153, 18.967]
  - - [256, 512, 1, 512]
    - [135, 25.23]
  - - [512, 512, 1, 500]
    - [146, 30.702]
  - - [100, 1024, 1, 512]
    - [153, 19.743]
  - - [128, 1024, 1, 1024]
    - [135, 27.878]
  - - [200, 512, 1, 2000]
    - [144, 21.95]
  - - [256, 1024, 1, 500]
    - [146, 30.386]
  - - [200, 1024, 1, 512]
    - [137, 23.844]
  - - [256, 500, 1, 500]
    - [135, 23.709]
  - - [256, 500, 1, 2048]
    - [144, 26.759]
  - - [512, 500, 1, 1024]
    - [169, 31.027]
  - - [256, 512, 1, 1024]
    - [135, 27.675]
  - - [128, 2048, 1, 1024]
    - [154, 31.871]
  - - [500, 512, 1, 500]
    - [146, 29.705]
  - - [200, 500, 1, 500]
    - [135, 18.769]
  - - [64, 2000, 1, 2000]
    - [168, 27.806]
  - - [128, 2000, 1, 2048]
    - [137, 31.591]
  - - [256, 1024, 1, 10]
    - [161, 5.378]
  - - [256, 1024, 1, 1024]
    - [154, 31.803]
  - - [500, 500, 1, 10]
    - [124, 4.99]
  - - [256, 500, 1, 100]
    - [135, 12.89]
  - - [256, 512, 1, 2048]
    - [144, 27.828]
  - - [200, 1024, 1, 2000]
    - [125, 25.396]
  - - [100, 2048, 1, 512]
    - [137, 23.632]
  - - [512, 500, 1, 2048]
    - [146, 31.447]
  - - [128, 2048, 1, 2000]
    - [125, 32.511]
  - - [500, 512, 1, 2048]
    - [137, 31.438]
  - - [200, 500, 1, 2000]
    - [144, 21.435]
  - - [500, 512, 1, 1024]
    - [137, 30.833]
  - - [100, 1024, 1, 100]
    - [133, 10.548]
  - - [64, 2000, 1, 500]
    - [135, 24.061]
  - - [128, 2048, 1, 2048]
    - [137, 32.453]
  - - [128, 2000, 1, 10]
    - [161, 5.396]
  - - [500, 512, 1, 10]
    - [124, 5.112]
  - - [200, 512, 1, 512]
    - [153, 19.355]
  - - [512, 500, 1, 500]
    - [146, 29.768]
  - - [512, 512, 1, 100]
    - [154, 22.315]
  - - [500, 500, 1, 512]
    - [146, 28.677]
  - - [128, 2048, 1, 500]
    - [146, 30.17]
  - - [200, 500, 1, 10]
    - [124, 2.509]
  - - [100, 2048, 1, 2000]
    - [125, 25.365]
  - - [200, 1024, 1, 10]
    - [124, 4.485]
  - - [64, 2048, 1, 1024]
    - [135, 27.779]
  - - [100, 2000, 1, 2000]
    - [125, 24.729]
  - - [500, 500, 1, 100]
    - [125, 20.506]
  - - [128, 2048, 1, 100]
    - [146, 22.486]
  - - [4096, 64, 1, 2048]
    - [146, 31.763]
  - - [4096, 91, 1, 2048]
    - [153, 28.97]
  - - [4096, 86, 1, 3072]
    - [144, 27.517]
  - - [4096, 49, 1, 2048]
    - [146, 24.336]
  - - [4096, 91, 1, 3072]
    - [144, 29.182]
  - - [4096, 64, 1, 3072]
    - [137, 31.988]
  - - [4096, 63, 1, 3072]
    - [125, 31.474]
  - - [4096, 96, 1, 2048]
    - [168, 30.526]
  - - [4096, 32, 1, 2048]
    - [149, 25.23]
  - - [4096, 49, 1, 3072]
    - [125, 24.499]
  - - [1024, 96, 1, 1024]
    - [123, 19.441]
  - - [4096, 86, 1, 2048]
    - [153, 27.652]
  - - [4096, 96, 1, 3072]
    - [168, 30.635]
  - - [4096, 35, 1, 3072]
    - [146, 17.533]
  - - [4096, 50, 1, 2048]
    - [137, 24.828]
  - - [36548, 32, 1, 1024]
    - [162, 36.694]
  - - [4096, 32, 1, 3072]
    - [128, 25.135]
  - - [1024, 243, 1, 1024]
    - [125, 29.998]
  - - [4096, 50, 1, 3072]
    - [137, 25.031]
  - - [1024, 128, 1, 1024]
    - [153, 25.126]
  - - [1024, 216, 1, 1024]
    - [125, 26.624]
  - - [4096, 35, 1, 2048]
    - [125, 17.447]
  - - [4096, 63, 1, 2048]
    - [125, 31.284]
  - - [289, 256, 1, 1568]
    - [135, 16.355]
  - - [3025, 64, 1, 363]
    - [123, 26.822]
  - - [784, 32, 32, 192]
    - [135, 31.754]
  - - [289, 256, 1, 2016]
    - [135, 16.698]
  - - [21609, 32, 1, 288]
    - [162, 32.651]
  - - [1225, 192, 1, 1728]
    - [125, 28.979]
  - - [784, 96, 1, 800]
    - [122, 15.38]
  - - [1225, 64, 1, 1200]
    - [122, 16.378]
  - - [729, 192, 1, 1600]
    - [162, 28.162]
  - - [6272, 32, 1, 528]
    - [162, 29.083]
  - - [1568, 160, 1, 832]
    - [123, 29.299]
  - - [289, 256, 1, 1792]
    - [133, 16.653]
  - - [784, 32, 32, 256]
    - [162, 32.286]
  - - [6272, 32, 1, 512]
    - [123, 29.087]
  - - [289, 384, 1, 3456]
    - [144, 24.214]
  - - [289, 384, 1, 2592]
    - [123, 23.962]
  - - [1225, 32, 32, 192]
    - [162, 34.172]
  - - [1568, 128, 1, 832]
    - [123, 30.504]
  - - [1225, 48, 32, 288]
    - [162, 27.341]
  - - [1001, 128, 1, 2048]
    - [153, 25.965]
  - - [2048, 174, 1, 512]
    - [125, 28.212]
  - - [2048, 189, 1, 512]
    - [137, 30.454]
  - - [64, 35, 904, 35]
    - [162, 18.854]
  - - [64, 103, 16, 103]
    - [143, 11.04]
  - - [64, 104, 16, 103]
    - [168, 11.198]
  - - [64, 123, 16, 112]
    - [168, 13.896]
  - - [64, 123, 16, 123]
    - [168, 14.564]
  - - [512, 540, 1, 512]
    - [146, 31.808]
  - - [512, 540, 1, 2048]
    - [146, 34.244]
  - - [512, 550, 1, 512]
    - [146, 31.979]
  - - [512, 550, 1, 2048]
    - [146, 34.853]
  - - [512, 560, 1, 512]
    - [146, 32.53]
  - - [512, 560, 1, 2048]
    - [146, 35.417]
  - - [2048, 160, 1, 512]
    - [123, 30.156]
  - - [2048, 184, 1, 512]
    - [125, 29.75]
  - - [512, 160, 1, 2048]
    - [143, 17.474]
  - - [512, 174, 1, 2048]
    - [135, 19.003]
  - - [512, 182, 1, 512]
    - [135, 17.528]
  - - [512, 184, 1, 512]
    - [135, 17.722]
  - - [512, 184, 1, 2048]
    - [135, 19.874]
  - - [512, 189, 1, 512]
    - [153, 18.205]
  - - [512, 189, 1, 2048]
    - [144, 20.813]
  - - [512, 198, 1, 2048]
    - [135, 21.584]
  - - [512, 206, 1, 512]
    - [135, 19.806]
  - - [512, 207, 1, 2048]
    - [135, 22.554]
  - - [512, 208, 1, 512]
    - [135, 20.0]
  - - [512, 208, 1, 2048]
    - [135, 22.671]
  - - [512, 224, 1, 512]
    - [135, 22.189]
  - - [512, 245, 1, 2048]
    - [123, 26.163]
  - - [512, 246, 1, 512]
    - [168, 23.614]
  - - [512, 246, 1, 2048]
    - [123, 26.258]
  - - [512, 264, 1, 512]
    - [153, 25.058]
  - - [512, 264, 1, 2048]
    - [123, 26.339]
  - - [512, 401, 1, 2048]
    - [135, 32.719]
  - - [512, 439, 1, 2048]
    - [146, 27.824]
  - - [512, 443, 1, 2048]
    - [146, 28.049]
  - - [512, 446, 1, 2048]
    - [146, 28.18]
  - - [512, 455, 1, 512]
    - [146, 27.124]
  - - [512, 465, 1, 512]
    - [146, 27.693]
  - - [512, 465, 1, 2048]
    - [146, 29.489]
  - - [512, 468, 1, 512]
    - [146, 27.869]
  - - [512, 468, 1, 2048]
    - [146, 29.656]
  - - [512, 476, 1, 512]
    - [146, 28.374]
  - - [512, 493, 1, 512]
    - [146, 29.182]
  - - [512, 493, 1, 2048]
    - [146, 31.14]
  - - [512, 495, 1, 2048]
    - [146, 31.239]
  - - [512, 511, 1, 2048]
    - [146, 32.209]
  - - [512, 512, 1, 2048]
    - [146, 32.453]
  - - [64, 59, 512, 59]
    - [144, 30.743]
  - - [64, 59, 544, 59]
    - [144, 30.892]
  - - [256, 1024, 1, 1]
    - [161, 0.681]
  - - [257, 1024, 1, 4096]
    - [151, 26.764]
  - - [512, 215, 1, 2048]
    - [135, 23.213]
  - - [512, 256, 1, 2048]
    - [123, 27.35]
  - - [560, 200, 1, 1024]
    - [168, 23.348]
  - - [768, 215, 1, 2048]
    - [144, 26.258]
  - - [768, 256, 1, 2048]
    - [144, 31.334]
  - - [32, 33, 1600, 33]
    - [121, 14.374]
  - - [512, 512, 1, 64]
    - [146, 19.608]
  - - [1225, 32, 64, 192]
    - [162, 36.112]
  - - [1225, 48, 64, 192]
    - [153, 27.919]
  - - [1225, 48, 64, 256]
    - [162, 27.973]
  - - [1225, 48, 64, 288]
    - [123, 28.013]
  - - [49, 2048, 64, 512]
    - [135, 30.364]
  - - [49, 512, 64, 2048]
    - [141, 25.636]
  - - [1225, 48, 32, 192]
    - [135, 27.012]
  - - [1225, 48, 32, 256]
    - [123, 27.269]
  - - [49, 2048, 32, 512]
    - [135, 29.619]
  - - [49, 512, 32, 2048]
    - [135, 27.07]
  - - [384, 384, 1, 384]
    - [135, 24.237]
  - - [100, 128, 18, 512]
    - [169, 25.988]
  - - [100, 128, 19, 512]
    - [168, 21.724]
  - - [1444, 128, 1, 576]
    - [123, 27.228]
  - - [361, 512, 1, 2304]
    - [144, 29.597]
  - - [480, 512, 1, 512]
    - [137, 28.442]
  - - [512, 480, 1, 512]
    - [146, 28.528]
  - - [1024, 308, 1, 1024]
    - [123, 29.2]
  - - [1024, 180, 1, 1024]
    - [135, 28.424]
  - - [64, 32, 4608, 32]
    - [172, 32.381]
  - - [64, 34, 4736, 34]
    - [123, 20.19]
  - - [64, 35, 4608, 32]
    - [135, 21.652]
  - - [64, 35, 4608, 35]
    - [123, 20.925]
  - - [256, 864, 1, 128]
    - [123, 20.736]
  - - [49, 2048, 64, 1024]
    - [168, 28.925]
  - - [49, 1024, 64, 2048]
    - [158, 26.385]
  - - [49, 2048, 32, 1024]
    - [168, 28.0]
  - - [49, 1024, 32, 2048]
    - [141, 25.622]
  - - [3136, 64, 1, 576]
    - [123, 28.501]
  - - [784, 128, 1, 1152]
    - [123, 20.488]
  - - [49, 2048, 128, 512]
    - [135, 30.72]
  - - [49, 2048, 256, 512]
    - [153, 30.937]
  - - [49, 512, 128, 2048]
    - [141, 26.353]
  - - [49, 512, 256, 2048]
    - [141, 26.61]
  - - [1024, 128, 1, 2]
    - [161, 0.641]
  - - [1024, 96, 1, 2]
    - [161, 0.559]
  - - [1909283, 40, 1, 40]
    - [161, 15.606]
  - - [3818566, 40, 1, 40]
    - [152, 15.669]
  - - [2560, 35, 1, 29000]
    - [143, 13.589]
  - - [2560, 36, 1, 29000]
    - [143, 13.995]
  - - [2560, 39, 1, 29000]
    - [143, 15.15]
  - - [2560, 40, 1, 29000]
    - [143, 15.529]
  - - [2560, 42, 1, 29000]
    - [143, 16.337]
  - - [2560, 43, 1, 29000]
    - [143, 16.729]
  - - [2560, 44, 1, 29000]
    - [143, 17.086]
  - - [2560, 46, 1, 29000]
    - [143, 17.848]
  - - [2560, 48, 1, 29000]
    - [143, 18.611]
  - - [2560, 49, 1, 29000]
    - [123, 18.439]
  - - [2560, 50, 1, 29000]
    - [123, 18.778]
  - - [2560, 51, 1, 29000]
    - [123, 19.206]
  - - [2560, 53, 1, 29000]
    - [123, 19.906]
  - - [2560, 54, 1, 29000]
    - [123, 20.307]
  - - [2560, 55, 1, 29000]
    - [123, 20.601]
  - - [2560, 56, 1, 29000]
    - [123, 21.029]
  - - [2560, 57, 1, 29000]
    - [123, 21.435]
  - - [2560, 58, 1, 29000]
    - [123, 21.765]
  - - [2560, 59, 1, 29000]
    - [123, 22.211]
  - - [2560, 61, 1, 29000]
    - [123, 22.911]
  - - [2560, 63, 1, 29000]
    - [123, 23.511]
  - - [1760, 32, 1, 1760]
    - [177, 15.94]
  - - [3584, 4, 1, 1280]
    - [181, 5.193]
  - - [2560, 16, 1, 2560]
    - [182, 13.824]
  - - [2944, 4, 1, 256]
    - [176, 2.766]
  - - [5056, 4, 1, 3328]
    - [180, 7.557]
  - - [1760, 16, 1, 1760]
    - [181, 10.508]
  - - [2368, 4, 1, 1280]
    - [181, 3.451]
  - - [6784, 4, 1, 1280]
    - [183, 8.5]
  - - [8448, 4, 1, 2816]
    - [183, 10.765]
  - - [1856, 4, 1, 1280]
    - [181, 2.897]
  - - [4608, 1, 1, 1536]
    - [181, 1.701]
  - - [7680, 4, 1, 2560]
    - [180, 10.224]
  - - [8448, 16, 1, 2816]
    - [201, 25.794]
  - - [3072, 2, 1, 1024]
    - [181, 2.161]
  - - [2368, 4, 1, 256]
    - [176, 2.269]
  - - [7680, 1, 1, 2560]
    - [180, 2.518]
  - - [4608, 2, 1, 1536]
    - [181, 3.402]
  - - [4608, 4, 1, 1536]
    - [181, 6.786]
  - - [3072, 1, 1, 128]
    - [140, 0.505]
  - - [2048, 32, 1, 2048]
    - [177, 19.139]
  - - [4288, 4, 1, 256]
    - [178, 3.853]
  - - [3584, 4, 1, 3328]
    - [180, 5.694]
  - - [5888, 4, 1, 1280]
    - [182, 7.48]
  - - [2048, 16, 1, 2048]
    - [181, 12.493]
  - - [5888, 4, 1, 128]
    - [178, 3.618]
  - - [8448, 1, 1, 2816]
    - [192, 2.784]
  - - [1408, 4, 1, 256]
    - [148, 1.408]
  - - [6144, 4, 1, 2560]
    - [180, 8.473]
  - - [3072, 1, 1, 1024]
    - [181, 1.078]
  - - [5056, 4, 1, 1280]
    - [202, 6.799]
  - - [3072, 16, 1, 1024]
    - [182, 15.2]
  - - [1408, 4, 1, 3328]
    - [181, 2.504]
  - - [6144, 1, 1, 2560]
    - [180, 2.134]
  - - [6144, 16, 1, 2560]
    - [189, 23.217]
  - - [4096, 16, 1, 4096]
    - [201, 19.64]
  - - [1408, 4, 1, 128]
    - [164, 0.984]
  - - [1856, 4, 1, 256]
    - [148, 1.818]
  - - [6784, 4, 1, 128]
    - [176, 4.124]
  - - [2944, 4, 1, 128]
    - [164, 1.99]
  - - [5888, 4, 1, 3328]
    - [204, 8.225]
  - - [5056, 4, 1, 128]
    - [184, 3.208]
  - - [3072, 4, 1, 1024]
    - [181, 4.309]
  - - [2944, 4, 1, 3328]
    - [180, 4.692]
  - - [2368, 4, 1, 128]
    - [176, 1.611]
  - - [1856, 4, 1, 128]
    - [164, 1.286]
  - - [7680, 2, 1, 2560]
    - [190, 5.062]
  - - [7680, 16, 1, 2560]
    - [201, 23.28]
  - - [4224, 1, 1, 128]
    - [178, 0.672]
  - - [8448, 2, 1, 2816]
    - [190, 5.671]
  - - [1408, 4, 1, 1280]
    - [181, 2.202]
  - - [6784, 4, 1, 256]
    - [176, 5.599]
  - - [4288, 4, 1, 128]
    - [184, 2.797]
  - - [1856, 4, 1, 3328]
    - [181, 3.298]
  - - [3584, 4, 1, 256]
    - [184, 3.379]
  - - [2368, 4, 1, 3328]
    - [180, 3.781]
  - - [6784, 4, 1, 3328]
    - [183, 9.393]
  - - [4288, 4, 1, 1280]
    - [181, 6.159]
  - - [3584, 4, 1, 128]
    - [184, 2.378]
  - - [5056, 4, 1, 256]
    - [195, 4.39]
  - - [4288, 4, 1, 3328]
    - [181, 6.759]
  - - [4608, 16, 1, 1536]
    - [179, 20.853]
  - - [6144, 2, 1, 2560]
    - [180, 4.246]
  - - [2944, 4, 1, 1280]
    - [181, 4.268]
  - - [5888, 4, 1, 256]
    - [178, 5.017]
  - - [4096, 29, 1, 2048]
    - [201, 22.527]
  - - [4096, 25, 1, 2048]
    - [189, 19.477]
  - - [4096, 29, 1, 3072]
    - [201, 22.852]
  - - [4096, 24, 1, 2048]
    - [201, 23.136]
  - - [36548, 1, 1, 1024]
    - [174, 1.845]
  - - [4096, 27, 1, 2048]
    - [201, 20.596]
  - - [4096, 1, 1, 2048]
    - [181, 1.557]
  - - [4096, 24, 1, 3072]
    - [201, 23.502]
  - - [4096, 27, 1, 3072]
    - [201, 21.259]
  - - [36548, 25, 1, 1024]
    - [194, 22.162]
  - - [4096, 1, 1, 3072]
    - [181, 1.552]
  - - [4096, 25, 1, 3072]
    - [201, 19.667]
  - - [36548, 24, 1, 1024]
    - [189, 25.766]
  - - [6272, 16, 1, 480]
    - [189, 18.354]
  - - [1568, 32, 1, 832]
    - [127, 14.853]
  - - [1568, 48, 1, 832]
    - [187, 16.797]
  - - [6272, 24, 1, 512]
    - [179, 21.571]
  - - [2048, 1, 1, 512]
    - [127, 0.623]
  - - [2048, 2, 1, 2]
    - [173, 0.023]
  - - [2048, 2, 1, 2048]
    - [181, 1.723]
  - - [2560, 4, 1, 2]
    - [173, 0.063]
  - - [2560, 4, 1, 2560]
    - [181, 3.997]
  - - [12288, 12, 2, 256]
    - [177, 18.755]
  - - [12288, 3, 2, 256]
    - [174, 6.925]
  - - [51520, 12, 2, 256]
    - [201, 21.706]
  - - [51520, 3, 2, 256]
    - [184, 9.944]
  - - [15200, 12, 2, 256]
    - [201, 19.012]
  - - [15200, 3, 2, 256]
    - [193, 7.273]
  - - [3456, 3, 2, 256]
    - [175, 4.16]
  - - [13600, 12, 2, 256]
    - [199, 19.058]
  - - [12880, 3, 2, 256]
    - [174, 6.898]
  - - [3400, 3, 2, 256]
    - [178, 4.061]
  - - [12880, 12, 2, 256]
    - [189, 18.214]
  - - [13824, 12, 2, 256]
    - [199, 19.432]
  - - [13824, 3, 2, 256]
    - [205, 7.268]
  - - [13600, 3, 2, 256]
    - [174, 7.16]
  - - [3456, 12, 2, 256]
    - [188, 13.052]
  - - [3800, 3, 2, 256]
    - [178, 4.48]
  - - [3400, 12, 2, 256]
    - [200, 12.773]
  - - [3800, 12, 2, 256]
    - [201, 13.607]
  - - [55296, 3, 2, 256]
    - [184, 10.679]
  - - [3220, 3, 2, 256]
    - [178, 3.916]
  - - [3072, 3, 2, 256]
    - [175, 3.83]
  - - [3220, 12, 2, 256]
    - [189, 13.165]
  - - [3072, 12, 2, 256]
    - [201, 12.673]
  - - [54400, 3, 2, 256]
    - [196, 10.729]
  - - [60800, 12, 2, 256]
    - [197, 21.692]
  - - [60800, 3, 2, 256]
    - [198, 10.661]
  - - [1909283, 11, 1, 11]
    - [185, 9.199]
  - - [3818566, 11, 1, 11]
    - [186, 5.076]
  - - [2048, 8, 1, 2]
    - [143, 0.081]
  - - [2048, 8, 1, 2048]
    - [203, 6.524]
  - - [2560, 2, 1, 2]
    - [173, 0.032]
  - - [2560, 2, 1, 2560]
    - [181, 1.999]
  - - [2560, 27, 1, 29000]
    - [191, 16.355]
  - - [4, 1856, 1, 3328]
    - [155, 2.45]
  - - [35, 1500, 1, 2560]
    - [132, 12.601]
  - - [4, 2368, 1, 1280]
    - [132, 2.761]
  - - [4, 3584, 1, 128]
    - [208, 2.179]
  - - [4, 1408, 1, 3328]
    - [155, 2.026]
  - - [4, 6784, 1, 3328]
    - [132, 4.232]
  - - [4, 4288, 1, 128]
    - [208, 2.54]
  - - [4, 6784, 1, 1280]
    - [132, 4.124]
  - - [4, 5056, 1, 256]
    - [208, 3.339]
  - - [4, 2944, 1, 3328]
    - [155, 3.257]
  - - [4, 5056, 1, 1280]
    - [208, 4.043]
  - - [35, 1500, 1, 2048]
    - [150, 12.294]
  - - [4, 2368, 1, 3328]
    - [155, 2.91]
  - - [4, 1856, 1, 256]
    - [132, 1.737]
  - - [4, 2944, 1, 256]
    - [132, 2.527]
  - - [4, 6784, 1, 128]
    - [207, 3.014]
  - - [4, 3584, 1, 1280]
    - [132, 3.528]
  - - [4, 5888, 1, 256]
    - [206, 3.542]
  - - [4, 5888, 1, 3328]
    - [207, 4.421]
  - - [4, 6784, 1, 256]
    - [206, 3.307]
  - - [4, 1408, 1, 1280]
    - [155, 1.927]
  - - [4, 3584, 1, 256]
    - [132, 2.806]
  - - [4, 2944, 1, 1280]
    - [132, 3.136]
  - - [4, 1408, 1, 256]
    - [132, 1.354]
  - - [4, 4288, 1, 3328]
    - [132, 4.142]
  - - [4, 2368, 1, 128]
    - [132, 1.588]
  - - [4, 5888, 1, 1280]
    - [207, 4.295]
  - - [4, 1856, 1, 1280]
    - [155, 2.346]
  - - [4, 1856, 1, 128]
    - [132, 1.268]
  - - [4, 2944, 1, 128]
    - [207, 1.922]
  - - [4, 4288, 1, 1280]
    - [132, 3.979]
  - - [4, 5056, 1, 3328]
    - [206, 4.124]
  - - [4, 5056, 1, 128]
    - [207, 2.716]
  - - [4, 4288, 1, 256]
    - [206, 3.208]
  - - [4, 3584, 1, 3328]
    - [132, 3.618]
  - - [4, 2368, 1, 256]
    - [132, 2.102]
  - - [4, 5888, 1, 128]
    - [207, 2.955]
  - - [4, 1408, 1, 128]
    - [132, 0.984]
  - - [16, 2000, 1, 2048]
    - [170, 10.336]
  - - [2, 2048, 1, 2000]
    - [126, 1.299]
  - - [32, 2000, 1, 2048]
    - [134, 16.202]
  - - [10, 2000, 1, 1024]
    - [155, 6.127]
  - - [2, 2000, 1, 100]
    - [120, 0.568]
  - - [10, 2000, 1, 512]
    - [155, 5.608]
  - - [32, 2000, 1, 500]
    - [122, 14.794]
  - - [32, 2000, 1, 1024]
    - [152, 16.071]
  - - [4, 2048, 1, 500]
    - [126, 2.166]
  - - [16, 2000, 1, 500]
    - [147, 8.455]
  - - [4, 2048, 1, 100]
    - [132, 1.164]
  - - [16, 2000, 1, 100]
    - [147, 4.485]
  - - [4, 2000, 1, 10]
    - [124, 0.217]
  - - [10, 2000, 1, 10]
    - [124, 0.537]
  - - [2, 2048, 1, 512]
    - [155, 1.164]
  - - [10, 2048, 1, 100]
    - [124, 2.802]
  - - [8, 2048, 1, 100]
    - [132, 2.31]
  - - [2, 2048, 1, 1024]
    - [155, 1.259]
  - - [16, 2000, 1, 1024]
    - [155, 9.881]
  - - [10, 2000, 1, 2000]
    - [126, 6.334]
  - - [8, 2000, 1, 500]
    - [147, 4.227]
  - - [16, 2000, 1, 2000]
    - [126, 10.174]
  - - [10, 2048, 1, 2048]
    - [170, 6.655]
  - - [8, 2000, 1, 512]
    - [155, 4.507]
  - - [2, 2000, 1, 2048]
    - [155, 1.304]
  - - [16, 2048, 1, 500]
    - [126, 8.635]
  - - [8, 2048, 1, 1024]
    - [155, 5.008]
  - - [2, 2000, 1, 500]
    - [147, 1.06]
  - - [32, 2048, 1, 100]
    - [136, 9.069]
  - - [10, 2048, 1, 500]
    - [126, 5.382]
  - - [4, 2000, 1, 2048]
    - [170, 2.594]
  - - [8, 2000, 1, 1024]
    - [155, 4.913]
  - - [32, 2048, 1, 512]
    - [152, 15.2]
  - - [32, 2048, 1, 1024]
    - [134, 16.382]
  - - [32, 2048, 1, 500]
    - [122, 15.209]
  - - [10, 2048, 1, 1024]
    - [155, 6.289]
  - - [8, 2048, 1, 2048]
    - [155, 5.292]
  - - [16, 2048, 1, 2048]
    - [170, 10.603]
  - - [8, 2000, 1, 10]
    - [124, 0.447]
  - - [4, 2000, 1, 2000]
    - [126, 2.531]
  - - [8, 2048, 1, 512]
    - [155, 4.584]
  - - [8, 2000, 1, 2048]
    - [155, 5.175]
  - - [32, 2048, 1, 2000]
    - [152, 17.28]
  - - [16, 2000, 1, 10]
    - [124, 0.88]
  - - [8, 2048, 1, 2000]
    - [126, 5.184]
  - - [4, 2048, 1, 2048]
    - [155, 2.644]
  - - [10, 2048, 1, 2000]
    - [126, 6.488]
  - - [8, 2000, 1, 100]
    - [126, 2.269]
  - - [2, 2000, 1, 2000]
    - [126, 1.268]
  - - [16, 2048, 1, 1024]
    - [155, 10.052]
  - - [32, 2000, 1, 2000]
    - [134, 16.937]
  - - [32, 2048, 1, 2048]
    - [167, 16.481]
  - - [2, 2048, 1, 10]
    - [124, 0.113]
  - - [4, 2048, 1, 512]
    - [155, 2.319]
  - - [4, 2048, 1, 10]
    - [124, 0.226]
  - - [16, 2048, 1, 100]
    - [147, 4.561]
  - - [4, 2000, 1, 500]
    - [147, 2.116]
  - - [10, 2000, 1, 500]
    - [155, 5.261]
  - - [32, 2000, 1, 512]
    - [152, 14.875]
  - - [2, 2000, 1, 1024]
    - [155, 1.232]
  - - [2, 2000, 1, 512]
    - [155, 1.128]
  - - [4, 2048, 1, 1024]
    - [155, 2.527]
  - - [8, 2048, 1, 500]
    - [147, 4.318]
  - - [4, 2048, 1, 2000]
    - [126, 2.594]
  - - [8, 2000, 1, 2000]
    - [126, 5.076]
  - - [4, 2000, 1, 1024]
    - [155, 2.459]
  - - [32, 2000, 1, 100]
    - [124, 8.748]
  - - [2, 2048, 1, 100]
    - [132, 0.582]
  - - [8, 2048, 1, 10]
    - [124, 0.451]
  - - [2, 2048, 1, 2048]
    - [170, 1.322]
  - - [10, 2000, 1, 2048]
    - [155, 6.497]
  - - [16, 2048, 1, 2000]
    - [126, 10.404]
  - - [10, 2048, 1, 512]
    - [155, 5.784]
  - - [16, 2048, 1, 512]
    - [155, 9.276]
  - - [2, 2000, 1, 10]
    - [124, 0.108]
  - - [4, 2000, 1, 100]
    - [132, 1.128]
  - - [16, 2000, 1, 512]
    - [155, 9.06]
  - - [32, 2048, 1, 10]
    - [124, 1.782]
  - - [10, 2048, 1, 10]
    - [124, 0.555]
  - - [4, 2000, 1, 512]
    - [155, 2.26]
  - - [16, 2048, 1, 10]
    - [122, 0.889]
  - - [32, 2000, 1, 10]
    - [129, 1.742]
  - - [10, 2000, 1, 100]
    - [132, 2.752]
  - - [2, 2048, 1, 500]
    - [126, 1.078]
  - - [1024, 1, 1, 500000]
    - [211, 0.848]
  - - [1024, 16, 1, 500000]
    - [212, 13.052]
  - - [1024, 2, 1, 500000]
    - [213, 1.692]
  - - [512, 1, 1, 500000]
    - [214, 0.753]
  - - [1024, 8, 1, 500000]
    - [213, 6.632]
  - - [1024, 4, 1, 500000]
    - [216, 3.361]
  - - [512, 16, 1, 500000]
    - [214, 11.875]
  - - [512, 2, 1, 500000]
    - [215, 1.516]
  - - [512, 8, 1, 500000]
    - [215, 6.005]
  - - [512, 4, 1, 500000]
    - [213, 3.023]
  - - [1024, 20, 1, 30522]
    - [210, 15.444]
  - - [49, 512, 1, 4608]
    - [209, 14.726]
  - - [64, 512, 1, 1]
    - [125, 0.086]
  - - [1024, 32, 1, 2]
    - [129, 0.199]
  - - [1024, 32, 1, 1024]
    - [127, 11.13]
  - - [768, 32, 1, 768]
    - [127, 8.617]
  - - [768, 32, 1, 2]
    - [161, 0.153]
  - - [768, 64, 1, 768]
    - [148, 14.361]
  - - [768, 64, 1, 2]
    - [161, 0.298]
  - - [1024, 20, 1, 1024]
    - [127, 7.169]
  - - [1024, 80, 1, 1024]
    - [122, 17.032]
  - - [32, 200, 1, 1]
    - [120, 0.018]
  - - [1024, 4, 1, 1024]
    - [148, 1.498]
  - - [1024, 4, 1, 2]
    - [120, 0.023]
  - - [768, 16, 1, 768]
    - [164, 4.453]
  - - [768, 16, 1, 2]
    - [143, 0.077]
  - - [768, 8, 1, 768]
    - [164, 2.193]
  - - [1024, 6, 1, 1024]
    - [148, 2.251]
  - - [1024, 6, 1, 2]
    - [120, 0.036]
  - - [1024, 8, 1, 1024]
    - [148, 3.005]
  - - [4, 704, 1, 1280]
    - [157, 1.038]
  - - [512, 4, 1, 512]
    - [148, 0.663]
  - - [64, 4, 1, 256]
    - [126, 0.063]
  - - [64, 704, 1, 128]
    - [134, 7.981]
  - - [448, 64, 1, 1280]
    - [127, 10.792]
  - - [128, 4, 1, 1280]
    - [140, 0.199]
  - - [128, 256, 1, 256]
    - [148, 8.446]
  - - [64, 1024, 1, 1280]
    - [134, 16.838]
  - - [64, 704, 1, 1280]
    - [152, 13.973]
  - - [64, 64, 1, 1280]
    - [127, 1.593]
  - - [1024, 64, 1, 128]
    - [124, 10.454]
  - - [64, 1024, 1, 3328]
    - [134, 17.542]
  - - [128, 1, 1, 1408]
    - [126, 0.05]
  - - [1024, 64, 1, 1280]
    - [161, 16.513]
  - - [704, 4, 1, 1280]
    - [148, 1.087]
  - - [64, 256, 1, 128]
    - [134, 3.054]
  - - [256, 256, 1, 3328]
    - [134, 17.293]
  - - [64, 1024, 1, 128]
    - [134, 10.63]
  - - [128, 256, 1, 3328]
    - [164, 13.052]
  - - [64, 448, 1, 1280]
    - [148, 10.562]
  - - [448, 4, 1, 256]
    - [148, 0.447]
  - - [256, 4, 1, 1280]
    - [127, 0.393]
  - - [512, 32, 1, 512]
    - [127, 5.392]
  - - [64, 64, 1, 3328]
    - [164, 1.719]
  - - [512, 1, 1, 512]
    - [148, 0.167]
  - - [704, 64, 1, 3328]
    - [148, 14.744]
  - - [256, 4, 1, 256]
    - [148, 0.257]
  - - [256, 64, 1, 1280]
    - [140, 6.42]
  - - [1024, 4, 1, 256]
    - [148, 1.047]
  - - [4, 704, 1, 256]
    - [132, 0.69]
  - - [704, 64, 1, 1280]
    - [148, 13.991]
  - - [128, 448, 1, 256]
    - [122, 11.911]
  - - [128, 256, 1, 1280]
    - [164, 12.146]
  - - [448, 64, 1, 3328]
    - [164, 11.505]
  - - [256, 128, 1, 128]
    - [148, 6.028]
  - - [4, 448, 1, 128]
    - [134, 0.32]
  - - [64, 128, 1, 3328]
    - [171, 3.465]
  - - [128, 128, 1, 3328]
    - [127, 6.971]
  - - [256, 128, 1, 256]
    - [157, 8.41]
  - - [64, 1, 1, 1216]
    - [126, 0.023]
  - - [1024, 4, 1, 3328]
    - [131, 1.692]
  - - [4, 4, 1, 256]
    - [120, 0.005]
  - - [256, 64, 1, 256]
    - [127, 4.507]
  - - [256, 128, 1, 1280]
    - [148, 12.209]
  - - [128, 64, 1, 1280]
    - [157, 3.221]
  - - [4, 448, 1, 3328]
    - [171, 0.753]
  - - [64, 1024, 1, 256]
    - [167, 13.422]
  - - [64, 704, 1, 256]
    - [134, 10.409]
  - - [704, 64, 1, 128]
    - [134, 7.981]
  - - [448, 4, 1, 1280]
    - [148, 0.686]
  - - [1024, 2, 1, 512]
    - [148, 0.659]
  - - [256, 64, 1, 3328]
    - [148, 6.948]
  - - [448, 128, 1, 256]
    - [122, 11.911]
  - - [448, 64, 1, 128]
    - [148, 5.306]
  - - [4, 448, 1, 256]
    - [134, 0.442]
  - - [64, 704, 1, 3328]
    - [148, 14.744]
  - - [256, 256, 1, 256]
    - [167, 13.278]
  - - [4, 1024, 1, 3328]
    - [140, 1.597]
  - - [4, 704, 1, 128]
    - [132, 0.501]
  - - [64, 128, 1, 128]
    - [127, 1.534]
  - - [704, 4, 1, 128]
    - [148, 0.492]
  - - [64, 448, 1, 3328]
    - [148, 11.315]
  - - [448, 4, 1, 3328]
    - [140, 0.744]
  - - [256, 4, 1, 3328]
    - [131, 0.424]
  - - [4, 256, 1, 256]
    - [132, 0.248]
  - - [4, 64, 1, 1280]
    - [127, 0.099]
  - - [4, 4, 1, 128]
    - [120, 0.005]
  - - [4, 128, 1, 256]
    - [132, 0.126]
  - - [448, 128, 1, 3328]
    - [143, 15.665]
  - - [64, 448, 1, 256]
    - [148, 7.39]
  - - [64, 256, 1, 1280]
    - [157, 6.411]
  - - [1024, 32, 1, 512]
    - [127, 10.228]
  - - [64, 4, 1, 128]
    - [127, 0.045]
  - - [256, 64, 1, 128]
    - [126, 3.072]
  - - [64, 64, 1, 256]
    - [157, 1.083]
  - - [4, 704, 1, 3328]
    - [140, 1.11]
  - - [4, 4, 1, 1280]
    - [120, 0.005]
  - - [128, 128, 1, 128]
    - [127, 3.285]
  - - [1024, 4, 1, 128]
    - [148, 0.726]
  - - [4, 64, 1, 128]
    - [132, 0.045]
  - - [64, 128, 1, 1280]
    - [127, 3.194]
  - - [128, 128, 1, 1280]
    - [140, 6.429]
  - - [512, 2, 1, 512]
    - [140, 0.329]
  - - [64, 128, 1, 256]
    - [157, 2.179]
  - - [1024, 4, 1, 1280]
    - [148, 1.543]
  - - [35, 700, 1, 2048]
    - [170, 8.18]
  - - [704, 64, 1, 256]
    - [152, 10.575]
  - - [128, 448, 1, 1280]
    - [161, 15.011]
  - - [128, 64, 1, 3328]
    - [127, 3.492]
  - - [448, 64, 1, 256]
    - [148, 7.458]
  - - [1024, 16, 1, 512]
    - [148, 5.392]
  - - [4, 256, 1, 128]
    - [132, 0.18]
  - - [512, 16, 1, 512]
    - [140, 2.689]
  - - [1024, 64, 1, 256]
    - [161, 13.278]
  - - [4, 4, 1, 3328]
    - [120, 0.005]
  - - [4, 1024, 1, 1280]
    - [157, 1.493]
  - - [704, 4, 1, 256]
    - [148, 0.708]
  - - [128, 64, 1, 256]
    - [157, 2.17]
  - - [128, 4, 1, 3328]
    - [164, 0.217]
  - - [128, 4, 1, 128]
    - [132, 0.09]
  - - [128, 1, 1, 1024]
    - [127, 0.05]
  - - [4, 128, 1, 3328]
    - [127, 0.217]
  - - [256, 256, 1, 128]
    - [124, 10.693]
  - - [704, 4, 1, 3328]
    - [127, 1.173]
  - - [448, 128, 1, 1280]
    - [143, 15.011]
  - - [1024, 64, 1, 3328]
    - [161, 17.199]
  - - [256, 4, 1, 128]
    - [164, 0.18]
  - - [4, 1024, 1, 128]
    - [134, 0.726]
  - - [64, 256, 1, 3328]
    - [148, 6.844]
  - - [448, 128, 1, 128]
    - [122, 9.569]
  - - [128, 256, 1, 128]
    - [148, 6.064]
  - - [128, 4, 1, 256]
    - [127, 0.126]
  - - [256, 256, 1, 1280]
    - [143, 16.973]
  - - [256, 128, 1, 3328]
    - [164, 13.17]
  - - [4, 448, 1, 1280]
    - [140, 0.69]
  - - [448, 4, 1, 128]
    - [138, 0.307]
  - - [4, 256, 1, 3328]
    - [127, 0.429]
  - - [4, 128, 1, 128]
    - [132, 0.09]
  - - [4, 256, 1, 1280]
    - [140, 0.393]
  - - [64, 4, 1, 3328]
    - [148, 0.108]
  - - [4, 64, 1, 3328]
    - [127, 0.108]
  - - [35, 700, 1, 2560]
    - [126, 8.338]
  - - [4, 1024, 1, 256]
    - [140, 1.002]
  - - [64, 256, 1, 256]
    - [157, 4.322]
  - - [1024, 4, 1, 512]
    - [148, 1.331]
  - - [4, 64, 1, 256]
    - [140, 0.063]
  - - [128, 448, 1, 128]
    - [122, 9.741]
  - - [64, 448, 1, 128]
    - [134, 5.306]
  - - [128, 448, 1, 3328]
    - [122, 15.683]
  - - [4, 128, 1, 1280]
    - [140, 0.199]
  - - [128, 64, 1, 128]
    - [148, 1.534]
  - - [64, 64, 1, 128]
    - [148, 0.767]
  - - [64, 4, 1, 1280]
    - [148, 0.099]
  - - [1024, 1, 1, 512]
    - [148, 0.334]
  - - [128, 128, 1, 256]
    - [157, 4.34]
  - - [64, 12, 5040, 12]
    - [161, 12.967]
  - - [64, 17, 3632, 17]
    - [162, 16.874]
  - - [64, 19, 3264, 19]
    - [162, 19.224]
  - - [64, 9, 6544, 9]
    - [122, 8.798]
  - - [64, 7, 8192, 7]
    - [135, 6.186]
  - - [64, 16, 3840, 16]
    - [161, 18.873]
  - - [64, 8, 7280, 8]
    - [168, 7.923]
  - - [64, 27, 2336, 27]
    - [162, 26.353]
  - - [64, 11, 5456, 11]
    - [122, 11.667]
  - - [64, 21, 2976, 21]
    - [168, 21.557]
  - - [64, 10, 5952, 10]
    - [122, 10.278]
  - - [64, 14, 4368, 14]
    - [161, 15.606]
  - - [64, 25, 2512, 25]
    - [168, 24.666]
  - - [64, 13, 4672, 13]
    - [161, 14.284]
  - - [64, 15, 4096, 15]
    - [161, 16.865]
  - - [64, 29, 2176, 29]
    - [162, 27.725]
  - - [64, 18, 3440, 18]
    - [144, 18.602]
  - - [64, 23, 2720, 23]
    - [168, 23.109]
  - - [8, 500, 1, 512]
    - [140, 1.268]
  - - [32, 512, 1, 512]
    - [157, 5.423]
  - - [8, 512, 1, 500]
    - [157, 1.286]
  - - [8, 500, 1, 1024]
    - [140, 1.493]
  - - [64, 1024, 1, 100]
    - [124, 9.181]
  - - [64, 1024, 1, 500]
    - [143, 15.304]
  - - [64, 1024, 1, 1024]
    - [167, 16.526]
  - - [2, 500, 1, 2048]
    - [140, 0.406]
  - - [16, 512, 1, 10]
    - [126, 0.239]
  - - [8, 512, 1, 10]
    - [126, 0.113]
  - - [16, 500, 1, 2048]
    - [157, 3.248]
  - - [10, 100, 1, 500]
    - [157, 0.316]
  - - [16, 100, 1, 10]
    - [129, 0.045]
  - - [2, 100, 1, 2000]
    - [127, 0.081]
  - - [256, 100, 1, 2048]
    - [148, 9.989]
  - - [2, 512, 1, 512]
    - [140, 0.325]
  - - [2, 100, 1, 10]
    - [120, 0.005]
  - - [200, 100, 1, 100]
    - [167, 3.027]
  - - [500, 100, 1, 100]
    - [132, 7.007]
  - - [4, 100, 1, 10]
    - [120, 0.009]
  - - [32, 100, 1, 512]
    - [148, 1.02]
  - - [16, 1024, 1, 512]
    - [157, 5.103]
  - - [4, 1024, 1, 1024]
    - [157, 1.457]
  - - [4, 512, 1, 10]
    - [126, 0.059]
  - - [128, 100, 1, 10]
    - [129, 0.352]
  - - [4, 512, 1, 2048]
    - [140, 0.83]
  - - [10, 1024, 1, 2000]
    - [148, 3.826]
  - - [256, 100, 1, 100]
    - [166, 3.749]
  - - [64, 1024, 1, 2048]
    - [167, 17.068]
  - - [16, 1024, 1, 100]
    - [148, 2.387]
  - - [32, 1024, 1, 1024]
    - [157, 11.735]
  - - [8, 100, 1, 500]
    - [127, 0.253]
  - - [10, 512, 1, 512]
    - [140, 1.602]
  - - [8, 500, 1, 10]
    - [122, 0.108]
  - - [16, 1024, 1, 10]
    - [126, 0.456]
  - - [16, 512, 1, 2048]
    - [157, 3.325]
  - - [128, 512, 1, 2048]
    - [134, 17.203]
  - - [128, 512, 1, 100]
    - [124, 9.014]
  - - [64, 500, 1, 2048]
    - [157, 12.218]
  - - [500, 100, 1, 10]
    - [129, 1.295]
  - - [64, 100, 1, 2048]
    - [157, 2.59]
  - - [64, 100, 1, 10]
    - [129, 0.176]
  - - [16, 512, 1, 500]
    - [127, 2.554]
  - - [200, 100, 1, 2000]
    - [148, 7.819]
  - - [2, 100, 1, 512]
    - [127, 0.063]
  - - [32, 512, 1, 100]
    - [132, 2.463]
  - - [16, 512, 1, 1024]
    - [140, 3.032]
  - - [4, 1024, 1, 512]
    - [157, 1.277]
  - - [2, 500, 1, 500]
    - [127, 0.316]
  - - [32, 100, 1, 100]
    - [132, 0.483]
  - - [100, 500, 1, 2000]
    - [122, 13.192]
  - - [10, 512, 1, 10]
    - [126, 0.14]
  - - [100, 500, 1, 2048]
    - [152, 13.17]
  - - [2, 100, 1, 1024]
    - [127, 0.072]
  - - [32, 512, 1, 1024]
    - [171, 6.226]
  - - [256, 100, 1, 1024]
    - [164, 9.267]
  - - [128, 100, 1, 100]
    - [132, 1.963]
  - - [32, 512, 1, 10]
    - [129, 0.469]
  - - [128, 100, 1, 1024]
    - [148, 4.814]
  - - [16, 500, 1, 2000]
    - [148, 3.167]
  - - [64, 500, 1, 500]
    - [148, 9.754]
  - - [128, 512, 1, 1024]
    - [134, 16.599]
  - - [128, 512, 1, 2000]
    - [122, 17.546]
  - - [2, 512, 1, 10]
    - [120, 0.027]
  - - [10, 512, 1, 500]
    - [164, 1.602]
  - - [4, 1024, 1, 2000]
    - [148, 1.529]
  - - [256, 100, 1, 2000]
    - [148, 10.007]
  - - [100, 100, 1, 10]
    - [129, 0.28]
  - - [128, 512, 1, 10]
    - [129, 1.719]
  - - [256, 100, 1, 500]
    - [148, 8.044]
  - - [64, 100, 1, 512]
    - [140, 2.044]
  - - [64, 512, 1, 500]
    - [148, 10.043]
  - - [8, 100, 1, 512]
    - [140, 0.253]
  - - [32, 100, 1, 500]
    - [140, 1.006]
  - - [32, 500, 1, 2048]
    - [171, 6.501]
  - - [128, 500, 1, 2000]
    - [143, 17.117]
  - - [8, 1024, 1, 10]
    - [129, 0.221]
  - - [2, 500, 1, 100]
    - [134, 0.149]
  - - [10, 500, 1, 512]
    - [171, 1.597]
  - - [32, 500, 1, 500]
    - [148, 5.085]
  - - [100, 500, 1, 100]
    - [132, 7.007]
  - - [10, 1024, 1, 512]
    - [140, 3.19]
  - - [512, 100, 1, 512]
    - [143, 12.069]
  - - [4, 500, 1, 500]
    - [148, 0.636]
  - - [64, 100, 1, 1024]
    - [171, 2.382]
  - - [2, 500, 1, 2000]
    - [127, 0.397]
  - - [32, 512, 1, 2048]
    - [171, 6.709]
  - - [10, 100, 1, 2000]
    - [127, 0.402]
  - - [4, 100, 1, 512]
    - [140, 0.126]
  - - [2, 512, 1, 2048]
    - [140, 0.415]
  - - [100, 100, 1, 2000]
    - [127, 4.015]
  - - [10, 500, 1, 500]
    - [127, 1.579]
  - - [2, 100, 1, 2048]
    - [127, 0.081]
  - - [32, 100, 1, 2048]
    - [171, 1.304]
  - - [16, 100, 1, 1024]
    - [140, 0.596]
  - - [2, 500, 1, 10]
    - [120, 0.027]
  - - [500, 100, 1, 2048]
    - [143, 13.089]
  - - [16, 1024, 1, 2000]
    - [148, 6.109]
  - - [10, 1024, 1, 1024]
    - [157, 3.632]
  - - [500, 100, 1, 512]
    - [152, 11.667]
  - - [32, 512, 1, 500]
    - [164, 5.161]
  - - [100, 500, 1, 512]
    - [152, 11.712]
  - - [8, 500, 1, 2000]
    - [148, 1.584]
  - - [4, 100, 1, 1024]
    - [127, 0.149]
  - - [2, 500, 1, 1024]
    - [140, 0.374]
  - - [100, 500, 1, 1024]
    - [152, 12.664]
  - - [32, 100, 1, 1024]
    - [127, 1.196]
  - - [64, 100, 1, 2000]
    - [171, 2.572]
  - - [64, 500, 1, 10]
    - [129, 0.893]
  - - [64, 500, 1, 512]
    - [157, 9.678]
  - - [10, 100, 1, 1024]
    - [140, 0.374]
  - - [16, 512, 1, 100]
    - [164, 1.209]
  - - [4, 100, 1, 2000]
    - [127, 0.158]
  - - [2, 512, 1, 1024]
    - [140, 0.379]
  - - [64, 512, 1, 1024]
    - [157, 11.717]
  - - [512, 100, 1, 2048]
    - [143, 13.72]
  - - [32, 100, 1, 2000]
    - [140, 1.277]
  - - [4, 512, 1, 500]
    - [127, 0.641]
  - - [4, 500, 1, 1024]
    - [140, 0.744]
  - - [32, 100, 1, 10]
    - [129, 0.09]
  - - [10, 1024, 1, 2048]
    - [171, 3.885]
  - - [8, 500, 1, 100]
    - [126, 0.587]
  - - [200, 100, 1, 1024]
    - [164, 7.232]
  - - [16, 100, 1, 100]
    - [127, 0.23]
  - - [8, 1024, 1, 2000]
    - [148, 3.054]
  - - [4, 512, 1, 100]
    - [127, 0.302]
  - - [16, 500, 1, 100]
    - [164, 1.178]
  - - [8, 1024, 1, 2048]
    - [157, 3.104]
  - - [16, 1024, 1, 2048]
    - [157, 6.181]
  - - [64, 512, 1, 100]
    - [132, 4.927]
  - - [2, 100, 1, 500]
    - [127, 0.063]
  - - [2, 500, 1, 512]
    - [157, 0.32]
  - - [128, 500, 1, 1024]
    - [167, 16.265]
  - - [10, 100, 1, 10]
    - [120, 0.027]
  - - [64, 1024, 1, 10]
    - [120, 1.805]
  - - [500, 100, 1, 500]
    - [152, 11.699]
  - - [2, 512, 1, 100]
    - [120, 0.149]
  - - [16, 100, 1, 500]
    - [140, 0.501]
  - - [128, 100, 1, 500]
    - [157, 4.101]
  - - [512, 100, 1, 1024]
    - [161, 13.025]
  - - [16, 100, 1, 2000]
    - [127, 0.636]
  - - [10, 512, 1, 100]
    - [148, 0.749]
  - - [8, 512, 1, 100]
    - [127, 0.605]
  - - [128, 100, 1, 2000]
    - [127, 5.179]
  - - [2, 1024, 1, 2000]
    - [148, 0.767]
  - - [100, 512, 1, 512]
    - [152, 11.97]
  - - [32, 1024, 1, 2000]
    - [148, 12.258]
  - - [128, 500, 1, 100]
    - [124, 8.857]
  - - [100, 100, 1, 100]
    - [132, 1.493]
  - - [8, 512, 1, 1024]
    - [157, 1.52]
  - - [200, 100, 1, 500]
    - [148, 6.267]
  - - [2, 1024, 1, 2048]
    - [140, 0.772]
  - - [512, 100, 1, 2000]
    - [161, 13.634]
  - - [16, 512, 1, 2000]
    - [127, 3.244]
  - - [64, 500, 1, 1024]
    - [157, 11.234]
  - - [10, 512, 1, 1024]
    - [140, 1.908]
  - - [512, 100, 1, 100]
    - [161, 7.129]
  - - [8, 100, 1, 1024]
    - [140, 0.298]
  - - [10, 100, 1, 100]
    - [127, 0.144]
  - - [10, 500, 1, 2000]
    - [171, 1.981]
  - - [500, 100, 1, 2000]
    - [161, 13.404]
  - - [100, 512, 1, 2000]
    - [167, 13.454]
  - - [64, 1024, 1, 512]
    - [134, 15.353]
  - - [32, 500, 1, 100]
    - [132, 2.423]
  - - [10, 100, 1, 2048]
    - [140, 0.406]
  - - [64, 100, 1, 100]
    - [132, 0.97]
  - - [2, 1024, 1, 100]
    - [120, 0.298]
  - - [64, 500, 1, 2000]
    - [148, 12.042]
  - - [8, 512, 1, 512]
    - [140, 1.29]
  - - [8, 512, 1, 2048]
    - [157, 1.665]
  - - [100, 100, 1, 1024]
    - [171, 3.763]
  - - [8, 100, 1, 2000]
    - [140, 0.32]
  - - [2, 1024, 1, 1024]
    - [171, 0.726]
  - - [16, 512, 1, 512]
    - [148, 2.594]
  - - [32, 500, 1, 512]
    - [140, 5.022]
  - - [32, 500, 1, 1024]
    - [171, 5.96]
  - - [32, 500, 1, 10]
    - [129, 0.447]
  - - [4, 1024, 1, 500]
    - [164, 1.241]
  - - [256, 100, 1, 512]
    - [148, 8.121]
  - - [8, 1024, 1, 500]
    - [148, 2.477]
  - - [4, 1024, 1, 100]
    - [127, 0.591]
  - - [100, 500, 1, 500]
    - [134, 11.464]
  - - [2, 1024, 1, 500]
    - [127, 0.618]
  - - [64, 100, 1, 500]
    - [140, 2.035]
  - - [2, 512, 1, 500]
    - [127, 0.32]
  - - [10, 1024, 1, 500]
    - [127, 3.104]
  - - [128, 500, 1, 512]
    - [167, 14.902]
  - - [10, 500, 1, 2048]
    - [157, 2.035]
  - - [128, 512, 1, 512]
    - [152, 15.322]
  - - [64, 512, 1, 10]
    - [129, 0.947]
  - - [32, 500, 1, 2000]
    - [171, 6.362]
  - - [100, 100, 1, 2048]
    - [171, 4.088]
  - - [200, 100, 1, 512]
    - [148, 6.362]
  - - [200, 100, 1, 2048]
    - [148, 7.796]
  - - [8, 100, 1, 10]
    - [120, 0.023]
  - - [100, 100, 1, 500]
    - [157, 3.194]
  - - [100, 500, 1, 10]
    - [129, 1.313]
  - - [10, 500, 1, 1024]
    - [140, 1.868]
  - - [256, 100, 1, 10]
    - [129, 0.713]
  - - [10, 512, 1, 2048]
    - [157, 2.08]
  - - [2, 1024, 1, 512]
    - [157, 0.645]
  - - [4, 500, 1, 2048]
    - [171, 0.817]
  - - [100, 512, 1, 100]
    - [132, 7.174]
  - - [16, 500, 1, 512]
    - [140, 2.545]
  - - [10, 1024, 1, 100]
    - [148, 1.48]
  - - [8, 1024, 1, 100]
    - [127, 1.191]
  - - [64, 1024, 1, 2000]
    - [122, 17.537]
  - - [10, 100, 1, 512]
    - [140, 0.316]
  - - [4, 500, 1, 2000]
    - [148, 0.794]
  - - [4, 100, 1, 100]
    - [120, 0.059]
  - - [32, 1024, 1, 512]
    - [140, 10.341]
  - - [8, 512, 1, 2000]
    - [127, 1.62]
  - - [100, 100, 1, 512]
    - [157, 3.199]
  - - [2, 512, 1, 2000]
    - [127, 0.406]
  - - [16, 500, 1, 10]
    - [126, 0.221]
  - - [10, 500, 1, 100]
    - [148, 0.726]
  - - [4, 100, 1, 500]
    - [127, 0.126]
  - - [64, 500, 1, 100]
    - [132, 4.751]
  - - [2, 100, 1, 100]
    - [120, 0.032]
  - - [10, 512, 1, 2000]
    - [148, 2.03]
  - - [8, 500, 1, 500]
    - [127, 1.259]
  - - [4, 500, 1, 512]
    - [157, 0.636]
  - - [10, 500, 1, 10]
    - [126, 0.135]
  - - [64, 512, 1, 2000]
    - [148, 12.506]
  - - [32, 512, 1, 2000]
    - [127, 6.515]
  - - [128, 500, 1, 2048]
    - [134, 16.707]
  - - [4, 512, 1, 512]
    - [140, 0.645]
  - - [16, 500, 1, 1024]
    - [140, 2.982]
  - - [10, 1024, 1, 10]
    - [124, 0.28]
  - - [16, 500, 1, 500]
    - [148, 2.499]
  - - [500, 100, 1, 1024]
    - [134, 12.57]
  - - [16, 100, 1, 512]
    - [140, 0.51]
  - - [64, 512, 1, 2048]
    - [157, 12.47]
  - - [32, 1024, 1, 10]
    - [129, 0.925]
  - - [8, 1024, 1, 512]
    - [157, 2.549]
  - - [4, 1024, 1, 2048]
    - [171, 1.557]
  - - [128, 500, 1, 500]
    - [122, 14.979]
  - - [100, 512, 1, 1024]
    - [167, 12.953]
  - - [16, 1024, 1, 500]
    - [148, 4.954]
  - - [128, 100, 1, 2048]
    - [127, 5.274]
  - - [100, 512, 1, 500]
    - [152, 11.74]
  - - [8, 1024, 1, 1024]
    - [157, 2.901]
  - - [4, 500, 1, 10]
    - [122, 0.054]
  - - [128, 500, 1, 10]
    - [129, 1.696]
  - - [32, 1024, 1, 100]
    - [132, 4.895]
  - - [8, 500, 1, 2048]
    - [171, 1.629]
  - - [16, 1024, 1, 1024]
    - [171, 5.798]
  - - [200, 100, 1, 10]
    - [129, 0.555]
  - - [512, 100, 1, 500]
    - [143, 12.055]
  - - [4, 500, 1, 100]
    - [126, 0.293]
  - - [8, 100, 1, 2048]
    - [140, 0.325]
  - - [512, 100, 1, 10]
    - [129, 1.376]
  - - [4, 512, 1, 1024]
    - [157, 0.758]
  - - [32, 1024, 1, 2048]
    - [171, 12.43]
  - - [128, 100, 1, 512]
    - [127, 4.106]
  - - [32, 1024, 1, 500]
    - [148, 9.935]
  - - [4, 1024, 1, 10]
    - [129, 0.117]
  - - [100, 512, 1, 10]
    - [124, 1.344]
  - - [8, 100, 1, 100]
    - [127, 0.117]
  - - [128, 512, 1, 500]
    - [122, 15.43]
  - - [16, 100, 1, 2048]
    - [140, 0.654]
  - - [2, 1024, 1, 10]
    - [120, 0.054]
  - - [4, 100, 1, 2048]
    - [127, 0.162]
  - - [4, 512, 1, 2000]
    - [157, 0.812]
  - - [1024, 29, 1, 1024]
    - [127, 10.363]
  - - [1024, 1, 1, 21]
    - [120, 0.05]
  - - [1024, 49, 1, 1024]
    - [161, 12.412]
  - - [1024, 35, 1, 1024]
    - [148, 10.891]
  - - [1024, 24, 1, 1024]
    - [127, 8.604]
  - - [1024, 21, 1, 1024]
    - [127, 7.526]
  - - [1024, 1, 1, 14]
    - [129, 0.041]
  - - [1024, 91, 1, 1024]
    - [123, 18.367]
  - - [1024, 14, 1, 1024]
    - [148, 5.225]
  - - [1024, 25, 1, 1024]
    - [127, 8.947]
  - - [1024, 27, 1, 1024]
    - [127, 9.664]
  - - [1024, 50, 1, 1024]
    - [161, 12.637]
  - - [1024, 64, 1, 1024]
    - [122, 16.138]
  - - [1024, 13, 1, 1024]
    - [164, 4.859]
  - - [1024, 63, 1, 1024]
    - [161, 15.872]
  - - [1024, 86, 1, 1024]
    - [123, 17.388]
  - - [1024, 1, 1, 13]
    - [126, 0.036]
  - - [289, 192, 1, 1344]
    - [161, 14.465]
  - - [196, 128, 1, 800]
    - [148, 8.807]
  - - [64, 512, 1, 1344]
    - [127, 12.146]
  - - [289, 224, 1, 1568]
    - [122, 16.567]
  - - [64, 256, 1, 1536]
    - [157, 6.547]
  - - [289, 160, 1, 1120]
    - [148, 14.059]
  - - [64, 256, 1, 1152]
    - [171, 6.343]
  - - [289, 224, 1, 1344]
    - [161, 16.382]
  - - [289, 192, 1, 896]
    - [161, 14.0]
  - - [784, 16, 32, 192]
    - [122, 17.848]
  - - [49, 128, 1, 1200]
    - [148, 2.36]
  - - [289, 128, 1, 896]
    - [148, 11.013]
  - - [1001, 32, 1, 1024]
    - [127, 11.527]
  - - [64, 448, 1, 1152]
    - [148, 10.526]
  - - [1001, 32, 1, 2048]
    - [127, 12.394]
  - - [289, 192, 1, 1120]
    - [161, 14.275]
  - - [64, 320, 1, 1728]
    - [127, 7.95]
  - - [289, 96, 1, 864]
    - [148, 9.727]
  - - [196, 64, 1, 800]
    - [140, 4.476]
  - - [784, 32, 1, 400]
    - [127, 7.35]
  - - [64, 320, 1, 2880]
    - [127, 8.27]
  - - [1001, 32, 1, 1536]
    - [127, 12.146]
  - - [64, 384, 1, 1152]
    - [127, 9.032]
  - - [64, 192, 1, 1728]
    - [148, 4.891]
  - - [1001, 64, 1, 1536]
    - [143, 16.215]
  - - [1001, 64, 1, 2048]
    - [122, 16.554]
  - - [1024, 64, 1, 4096]
    - [286, 25.912]
  - - [64, 10, 448, 10]
    - [122, 4.372]
  - - [64, 18, 648, 18]
    - [168, 12.123]
  - - [64, 18, 1720, 18]
    - [144, 16.355]
  - - [64, 19, 1632, 19]
    - [123, 16.454]
  - - [64, 21, 1472, 21]
    - [168, 18.196]
  - - [64, 23, 64, 23]
    - [161, 4.444]
  - - [64, 26, 56, 26]
    - [143, 5.013]
  - - [1024, 1, 1, 2]
    - [120, 0.005]
  - - [1024, 1, 1, 1024]
    - [148, 0.374]
  - - [64, 27, 56, 26]
    - [161, 5.306]
  - - [64, 17, 1, 17]
    - [120, 0.045]
  - - [64, 30, 1, 30]
    - [120, 0.122]
  - - [64, 31, 1, 30]
    - [124, 0.131]
  - - [64, 31, 1, 31]
    - [130, 0.135]
  - - [64, 14, 1, 14]
    - [171, 0.041]
  - - [64, 14, 1, 15]
    - [126, 0.036]
  - - [64, 15, 1, 15]
    - [126, 0.041]
  - - [64, 15, 1, 17]
    - [120, 0.041]
  - - [100, 512, 1, 2048]
    - [134, 13.486]
  - - [1024, 1, 1, 1600]
    - [127, 0.393]
  - - [1024, 1, 1, 200]
    - [127, 0.221]
  - - [1, 200, 1, 1]
    - [120, 0.001]
  - - [1, 512, 1, 1]
    - [161, 0.002]
  - - [67, 512, 1, 2048]
    - [157, 10.932]
  - - [74, 512, 1, 2048]
    - [171, 12.073]
  - - [64, 3, 512, 3]
    - [168, 0.578]
  - - [64, 5, 512, 5]
    - [120, 1.457]
  - - [64, 9, 512, 9]
    - [122, 4.047]
  - - [64, 512, 1, 512]
    - [157, 10.427]
  - - [25, 128, 120, 256]
    - [156, 16.761]
  - - [25, 128, 139, 256]
    - [133, 17.988]
  - - [25, 128, 160, 256]
    - [139, 17.415]
  - - [25, 128, 18, 256]
    - [152, 11.433]
  - - [25, 128, 19, 256]
    - [134, 10.481]
  - - [9, 128, 120, 256]
    - [170, 7.783]
  - - [9, 128, 139, 256]
    - [138, 7.868]
  - - [9, 128, 160, 256]
    - [138, 8.126]
  - - [9, 128, 18, 256]
    - [132, 4.606]
  - - [9, 128, 19, 256]
    - [132, 4.841]
  - - [1, 256, 1, 1152]
    - [140, 0.099]
  - - [100, 512, 1, 2304]
    - [134, 13.576]
  - - [25, 256, 1, 1152]
    - [140, 2.427]
  - - [9, 256, 1, 1152]
    - [140, 0.875]
  - - [1024, 77, 1, 1024]
    - [122, 16.247]
  - - [1024, 10, 1, 2]
    - [161, 0.063]
  - - [1024, 10, 1, 1024]
    - [164, 3.763]
  - - [1024, 39, 1, 2]
    - [143, 0.239]
  - - [1024, 39, 1, 1024]
    - [148, 12.137]
  - - [1024, 40, 1, 2]
    - [161, 0.248]
  - - [1024, 40, 1, 1024]
    - [148, 12.466]
  - - [1024, 41, 1, 2]
    - [161, 0.253]
  - - [1024, 41, 1, 1024]
    - [148, 12.71]
  - - [1024, 5, 1, 2]
    - [120, 0.032]
  - - [1024, 5, 1, 1024]
    - [148, 1.886]
  - - [1024, 8, 1, 2]
    - [120, 0.05]
  - - [1024, 9, 1, 2]
    - [161, 0.059]
  - - [1024, 9, 1, 1024]
    - [148, 3.388]
  - - [64, 4, 32768, 4]
    - [123, 2.761]
  - - [64, 4, 38400, 4]
    - [123, 2.775]
  - - [64, 14, 10880, 14]
    - [161, 16.68]
  - - [64, 14, 10880, 15]
    - [161, 16.996]
  - - [64, 15, 7680, 15]
    - [161, 17.781]
  - - [64, 15, 10880, 15]
    - [161, 18.115]
  - - [64, 15, 7680, 17]
    - [161, 17.474]
  - - [64, 17, 6144, 17]
    - [123, 17.875]
  - - [64, 17, 7680, 17]
    - [144, 18.205]
  - - [64, 17, 6144, 21]
    - [162, 19.391]
  - - [64, 21, 6144, 21]
    - [162, 23.637]
  - - [64, 24, 4736, 24]
    - [153, 26.308]
  - - [64, 24, 4736, 34]
    - [135, 27.034]
  - - [64, 30, 2048, 30]
    - [135, 28.582]
  - - [64, 31, 2048, 30]
    - [135, 28.645]
  - - [64, 31, 2048, 31]
    - [162, 28.613]
  - - [128, 128, 1, 64]
    - [132, 2.075]
  - - [64, 5, 1, 5]
    - [120, 0.005]
  - - [32, 33, 1, 33]
    - [124, 0.081]
  - - [64, 5, 960, 5]
    - [120, 2.026]
  - - [74, 960, 1, 2048]
    - [168, 15.132]
  - - [128, 27, 32768, 27]
    - [142, 10.594]
  - - [1024, 16, 1, 1024]
    - [171, 5.725]
  - - [1024, 16, 1, 2]
    - [129, 0.099]
  - - [1024, 64, 1, 2]
    - [143, 0.383]
  - - [1024, 80, 1, 2]
    - [143, 0.474]
  - - [1024, 82, 1, 1024]
    - [123, 16.382]
  - - [1024, 82, 1, 2]
    - [143, 0.492]
  - - [1024, 12, 1, 1024]
    - [148, 4.476]
  - - [1024, 12, 1, 2]
    - [120, 0.072]
  - - [64, 24, 6816, 24]
    - [168, 26.953]
  - - [64, 26, 6272, 26]
    - [135, 28.658]
  - - [196, 256, 1, 2304]
    - [126, 13.725]
  - - [850, 3, 2, 256]
    - [148, 1.281]
  - - [850, 12, 2, 256]
    - [148, 5.035]
  - - [805, 12, 2, 256]
    - [148, 4.769]
  - - [805, 3, 2, 256]
    - [148, 1.2]
  - - [768, 3, 2, 256]
    - [148, 1.132]
  - - [768, 12, 2, 256]
    - [148, 4.548]
  - - [864, 12, 2, 256]
    - [148, 5.116]
  - - [864, 3, 2, 256]
    - [148, 1.29]
  - - [247, 3, 2, 256]
    - [148, 0.37]
  - - [216, 3, 2, 256]
    - [126, 0.32]
  - - [950, 3, 2, 256]
    - [148, 1.412]
  - - [187, 12, 2, 256]
    - [148, 1.114]
  - - [176, 12, 2, 256]
    - [148, 1.056]
  - - [247, 12, 2, 256]
    - [127, 1.462]
  - - [187, 3, 2, 256]
    - [148, 0.28]
  - - [228, 12, 2, 256]
    - [148, 1.349]
  - - [221, 12, 2, 256]
    - [127, 1.308]
  - - [176, 3, 2, 256]
    - [148, 0.266]
  - - [950, 12, 2, 256]
    - [148, 5.626]
  - - [192, 12, 2, 256]
    - [148, 1.146]
  - - [228, 3, 2, 256]
    - [127, 0.338]
  - - [221, 3, 2, 256]
    - [126, 0.329]
  - - [192, 3, 2, 256]
    - [148, 0.289]
  - - [216, 12, 2, 256]
    - [127, 1.286]
  - - [2, 6, 1, 1024]
    - [120, 0.005]
  - - [1024, 20, 1, 2]
    - [120, 0.126]
  - - [64, 128, 768, 128]
    - [217, 54.456]
  - - [64, 128, 3072, 128]
    - [219, 30.384]
  - - [64, 256, 12, 256]
    - [220, 13.326]
  - - [64, 256, 16, 256]
    - [221, 19.384]
  - - [64, 256, 24, 256]
    - [221, 25.63]
  - - [64, 256, 32, 256]
    - [222, 29.226]
  - - [64, 256, 48, 256]
    - [217, 37.879]
  - - [64, 256, 64, 256]
    - [223, 45.09]
  - - [64, 256, 128, 256]
    - [217, 52.113]
  - - [64, 256, 256, 256]
    - [224, 58.48]
  - - [64, 256, 384, 256]
    - [225, 50.421]
  - - [64, 256, 512, 256]
    - [226, 36.215]
  - - [64, 256, 768, 256]
    - [227, 36.393]
  - - [64, 256, 1024, 256]
    - [228, 36.692]
  - - [64, 256, 1536, 256]
    - [226, 36.911]
  - - [64, 256, 2048, 256]
    - [227, 37.053]
  - - [64, 256, 3072, 256]
    - [226, 37.126]
  - - [64, 384, 12, 384]
    - [229, 23.267]
  - - [64, 384, 16, 384]
    - [221, 30.197]
  - - [64, 384, 24, 384]
    - [224, 38.187]
  - - [64, 384, 32, 384]
    - [224, 40.05]
  - - [64, 384, 48, 384]
    - [224, 57.798]
  - - [64, 384, 64, 384]
    - [224, 57.684]
  - - [64, 384, 96, 384]
    - [217, 56.332]
  - - [64, 384, 128, 384]
    - [230, 59.628]
  - - [64, 384, 256, 384]
    - [231, 40.186]
  - - [64, 384, 384, 384]
    - [232, 40.452]
  - - [64, 384, 512, 384]
    - [233, 41.027]
  - - [64, 384, 768, 384]
    - [234, 41.181]
  - - [64, 384, 1024, 384]
    - [235, 41.494]
  - - [64, 384, 1536, 384]
    - [233, 41.665]
  - - [64, 384, 2048, 384]
    - [234, 41.662]
  - - [64, 384, 3072, 384]
    - [233, 41.743]
  - - [64, 512, 12, 512]
    - [221, 31.649]
  - - [64, 512, 24, 512]
    - [217, 40.532]
  - - [64, 512, 32, 512]
    - [230, 55.1]
  - - [64, 512, 384, 512]
    - [233, 44.726]
  - - [64, 512, 512, 512]
    - [234, 44.823]
  - - [64, 512, 768, 512]
    - [234, 45.211]
  - - [64, 512, 1024, 512]
    - [232, 45.193]
  - - [64, 512, 1536, 512]
    - [232, 45.441]
  - - [64, 512, 2048, 512]
    - [236, 45.372]
  - - [64, 512, 3072, 512]
    - [233, 45.41]
  - - [128, 128, 12, 64]
    - [237, 5.501]
  - - [128, 128, 24, 64]
    - [238, 10.631]
  - - [128, 128, 48, 64]
    - [239, 17.994]
  - - [128, 128, 96, 64]
    - [240, 35.874]
  - - [128, 128, 384, 64]
    - [241, 58.527]
  - - [256, 256, 12, 64]
    - [242, 23.459]
  - - [256, 256, 24, 64]
    - [242, 30.896]
  - - [256, 256, 48, 64]
    - [243, 50.407]
  - - [256, 256, 96, 64]
    - [242, 65.207]
  - - [256, 256, 192, 64]
    - [244, 74.059]
  - - [256, 256, 384, 64]
    - [245, 71.325]
  - - [384, 384, 12, 64]
    - [246, 38.59]
  - - [384, 384, 24, 64]
    - [247, 54.124]
  - - [384, 384, 48, 64]
    - [240, 67.901]
  - - [384, 384, 96, 64]
    - [240, 75.75]
  - - [384, 384, 384, 64]
    - [248, 55.544]
  - - [512, 512, 12, 64]
    - [245, 48.316]
  - - [512, 512, 24, 64]
    - [242, 65.02]
  - - [512, 512, 96, 64]
    - [249, 79.365]
  - - [512, 512, 384, 64]
    - [250, 53.949]
  - - [768, 1536, 1, 1]
    - [251, 0.657]
  - - [768, 2048, 1, 1]
    - [252, 0.917]
  - - [768, 3072, 1, 1]
    - [252, 1.167]
  - - [768, 4096, 1, 1]
    - [253, 1.354]
  - - [768, 6144, 1, 1]
    - [254, 1.62]
  - - [768, 8192, 1, 1]
    - [255, 1.799]
  - - [768, 12288, 1, 1]
    - [254, 2.029]
  - - [768, 16384, 1, 1]
    - [256, 2.352]
  - - [768, 128, 1, 768]
    - [257, 18.196]
  - - [768, 256, 1, 768]
    - [258, 27.185]
  - - [768, 384, 1, 768]
    - [259, 38.973]
  - - [768, 1536, 1, 768]
    - [247, 73.781]
  - - [768, 3072, 1, 768]
    - [260, 82.045]
  - - [768, 6144, 1, 768]
    - [261, 87.874]
  - - [768, 8192, 1, 768]
    - [260, 86.776]
  - - [768, 12288, 1, 768]
    - [262, 90.788]
  - - [768, 16384, 1, 768]
    - [263, 89.066]
  - - [768, 24576, 1, 768]
    - [264, 92.011]
  - - [768, 32768, 1, 768]
    - [264, 91.518]
  - - [768, 49152, 1, 768]
    - [265, 92.743]
  - - [768, 65536, 1, 768]
    - [265, 92.666]
  - - [768, 98304, 1, 768]
    - [265, 93.635]
  - - [768, 131072, 1, 768]
    - [265, 93.693]
  - - [768, 16, 1, 3072]
    - [266, 5.286]
  - - [768, 32, 1, 3072]
    - [267, 10.651]
  - - [768, 64, 1, 3072]
    - [268, 18.235]
  - - [768, 128, 1, 3072]
    - [269, 28.733]
  - - [768, 256, 1, 3072]
    - [270, 41.975]
  - - [768, 384, 1, 3072]
    - [271, 52.283]
  - - [768, 768, 1, 3072]
    - [273, 68.825]
