library/src/blas3/Tensile/Logic/asm_full/navi31/navi31_Cijk_Ailk_Bljk_HHS_BH_GB.yaml
- {MinimumRequiredVersion: 4.35.0}
- navi31
- gfx1100
- [Device 73bf]
    SolutionIndex: 0
    SolutionNameMin: Cijk_Ailk_Bljk_HHS_BH_MT32x32x16_MI16x16x16x1_SN_1LDSB0_AMAS0_GRVW4_IU1_NLCA1_SIA1_SU0_SUS0_SVW1_TT1_16_VW1_WGM4
    SolutionIndex: 1
    SolutionNameMin: Cijk_Ailk_Bljk_HHS_BH_MT32x32x16_MI16x16x16x1_SN_1LDSB0_AMAS0_GRVW8_IU1_NLCA1_SIA1_SU0_SUS0_SVW1_TT1_16_VW1_WGM4
    SolutionIndex: 2
    SolutionNameMin: Cijk_Ailk_Bljk_HHS_BH_MT32x32x16_MI16x16x16x1_SN_1LDSB1_AMAS0_GRVW8_IU1_NLCA1_SIA2_SU32_SUS128_SVW1_TT1_16_VW1_WGM4
    SolutionIndex: 3
    SolutionNameMin: Cijk_Ailk_Bljk_HHS_BH_MT32x32x16_MI16x16x16x1_SN_1LDSB1_AMAS0_GRVW2_IU1_NLCA1_SIA2_SU0_SUS0_SVW1_TT1_16_VW1_WGM8
    SolutionIndex: 4
    SolutionNameMin: Cijk_Ailk_Bljk_HHS_BH_MT32x32x16_MI16x16x16x1_SN_1LDSB1_AMAS0_GRVW4_IU1_NLCA1_SIA2_SU0_SUS0_SVW1_TT1_16_VW1_WGM8
    SolutionIndex: 5
    SolutionNameMin: Cijk_Ailk_Bljk_HHS_BH_MT64x64x16_MI16x16x16x1_SN_1LDSB0_AMAS3_GRVW4_IU1_NLCA1_SIA1_SU0_SUS0_SVW2_TT2_32_VW2_WGM4
    SolutionIndex: 6
    SolutionNameMin: Cijk_Ailk_Bljk_HHS_BH_MT64x64x16_MI16x16x16x1_SN_1LDSB0_AMAS3_GRVW8_IU1_NLCA1_SIA1_SU0_SUS0_SVW2_TT2_32_VW2_WGM4
    SolutionIndex: 7
    SolutionNameMin: Cijk_Ailk_Bljk_HHS_BH_MT64x64x16_MI16x16x16x1_SN_1LDSB1_AMAS3_GRVW4_IU1_NLCA1_SIA2_SU0_SUS0_SVW2_TT2_32_VW2_WGM4
    SolutionIndex: 8
    SolutionNameMin: Cijk_Ailk_Bljk_HHS_BH_MT64x64x16_MI16x16x16x1_SN_1LDSB1_AMAS3_GRVW8_IU1_NLCA1_SIA2_SU0_SUS0_SVW2_TT2_32_VW2_WGM4
    SolutionIndex: 9
    SolutionNameMin: Cijk_Ailk_Bljk_HHS_BH_MT64x64x16_MI16x16x16x1_SN_1LDSB0_AMAS3_GRVW8_IU1_NLCA1_SIA1_SU32_SUS128_SVW2_TT2_32_VW2_WGM4
    SolutionIndex: 10
    SolutionNameMin: Cijk_Ailk_Bljk_HHS_BH_MT64x64x16_MI16x16x16x1_SN_1LDSB1_AMAS3_GRVW8_IU1_NLCA1_SIA2_SU32_SUS128_SVW2_TT2_32_VW2_WGM4
    SolutionIndex: 11
    SolutionNameMin: Cijk_Ailk_Bljk_HHS_BH_MT64x64x16_MI16x16x16x1_SN_1LDSB1_AMAS3_GRVW4_IU1_NLCA1_SIA2_SU32_SUS256_SVW2_TT2_32_VW2_WGM4
    SolutionIndex: 12
    SolutionNameMin: Cijk_Ailk_Bljk_HHS_BH_MT64x64x16_MI16x16x16x1_SN_1LDSB0_AMAS0_GRVW8_IU1_NLCA1_SIA1_SU0_SUS0_SVW1_TT2_32_VW1_WGM8
    SolutionIndex: 13
    SolutionNameMin: Cijk_Ailk_Bljk_HHS_BH_MT64x64x16_MI16x16x16x1_SN_1LDSB0_AMAS3_GRVW8_IU1_NLCA1_SIA1_SU0_SUS0_SVW2_TT2_32_VW2_WGM8
    SolutionIndex: 14
    SolutionNameMin: Cijk_Ailk_Bljk_HHS_BH_MT64x64x16_MI16x16x16x1_SN_1LDSB1_AMAS3_GRVW4_IU1_NLCA1_SIA2_SU0_SUS0_SVW2_TT2_32_VW2_WGM8
    SolutionIndex: 15
    SolutionNameMin: Cijk_Ailk_Bljk_HHS_BH_MT64x64x16_MI16x16x16x1_SN_1LDSB1_AMAS3_GRVW8_IU1_NLCA1_SIA2_SU0_SUS0_SVW2_TT2_32_VW2_WGM8
    SolutionIndex: 16
    SolutionNameMin: Cijk_Ailk_Bljk_HHS_BH_MT64x64x16_MI16x16x16x1_SN_1LDSB0_AMAS0_GRVW8_IU1_NLCA1_SIA1_SU32_SUS128_SVW1_TT2_32_VW1_WGM8
    SolutionIndex: 17
    SolutionNameMin: Cijk_Ailk_Bljk_HHS_BH_MT64x64x16_MI16x16x16x1_SN_1LDSB0_AMAS3_GRVW8_IU1_NLCA1_SIA1_SU32_SUS128_SVW2_TT2_32_VW2_WGM8
    SolutionIndex: 18
    SolutionNameMin: Cijk_Ailk_Bljk_HHS_BH_MT64x64x16_MI16x16x16x1_SN_1LDSB1_AMAS3_GRVW8_IU1_NLCA1_SIA2_SU32_SUS128_SVW2_TT2_32_VW2_WGM8
    SolutionIndex: 19
    SolutionNameMin: Cijk_Ailk_Bljk_HHS_BH_MT64x64x16_MI16x16x16x1_SN_1LDSB0_AMAS3_GRVW8_IU1_NLCA1_SIA1_SU32_SUS256_SVW2_TT2_32_VW2_WGM8
    SolutionIndex: 20
    SolutionNameMin: Cijk_Ailk_Bljk_HHS_BH_MT64x64x16_MI16x16x16x1_SN_1LDSB1_AMAS3_GRVW8_IU1_NLCA1_SIA2_SU32_SUS256_SVW2_TT2_32_VW2_WGM8
    SolutionIndex: 21
    SolutionNameMin: Cijk_Ailk_Bljk_HHS_BH_MT128x128x16_MI16x16x16x1_SN_1LDSB0_AMAS3_GRVW2_IU1_NLCA2_SIA1_SU0_SUS0_SVW2_TT4_64_VW2_WGM4
    SolutionIndex: 22
    SolutionNameMin: Cijk_Ailk_Bljk_HHS_BH_MT128x128x16_MI16x16x16x1_SN_1LDSB0_AMAS3_GRVW2_IU1_NLCA2_SIA1_SU0_SUS0_SVW4_TT4_64_VW4_WGM4
    SolutionIndex: 23
    SolutionNameMin: Cijk_Ailk_Bljk_HHS_BH_MT128x128x16_MI16x16x16x1_SN_1LDSB0_AMAS0_GRVW4_IU1_NLCA1_SIA1_SU0_SUS0_SVW1_TT4_64_VW1_WGM4
    SolutionIndex: 24
    SolutionNameMin: Cijk_Ailk_Bljk_HHS_BH_MT128x128x16_MI16x16x16x1_SN_1LDSB0_AMAS3_GRVW4_IU1_NLCA1_SIA1_SU0_SUS0_SVW2_TT4_64_VW2_WGM4
    SolutionIndex: 25
    SolutionNameMin: Cijk_Ailk_Bljk_HHS_BH_MT128x128x16_MI16x16x16x1_SN_1LDSB0_AMAS3_GRVW4_IU1_NLCA1_SIA1_SU0_SUS0_SVW4_TT4_64_VW4_WGM4
    SolutionIndex: 26
    SolutionNameMin: Cijk_Ailk_Bljk_HHS_BH_MT128x128x16_MI16x16x16x1_SN_1LDSB0_AMAS0_GRVW8_IU1_NLCA1_SIA1_SU0_SUS0_SVW1_TT4_64_VW1_WGM4
    SolutionIndex: 27
    SolutionNameMin: Cijk_Ailk_Bljk_HHS_BH_MT128x128x16_MI16x16x16x1_SN_1LDSB0_AMAS3_GRVW8_IU1_NLCA1_SIA1_SU0_SUS0_SVW2_TT4_64_VW2_WGM4
    SolutionIndex: 28
    SolutionNameMin: Cijk_Ailk_Bljk_HHS_BH_MT128x128x16_MI16x16x16x1_SN_1LDSB0_AMAS3_GRVW8_IU1_NLCA1_SIA1_SU0_SUS0_SVW4_TT4_64_VW4_WGM4
    SolutionIndex: 29
    SolutionNameMin: Cijk_Ailk_Bljk_HHS_BH_MT128x128x16_MI16x16x16x1_SN_1LDSB1_AMAS3_GRVW2_IU1_NLCA2_SIA2_SU0_SUS0_SVW2_TT4_64_VW2_WGM4
    SolutionIndex: 30
    SolutionNameMin: Cijk_Ailk_Bljk_HHS_BH_MT128x128x16_MI16x16x16x1_SN_1LDSB1_AMAS3_GRVW2_IU1_NLCA2_SIA2_SU0_SUS0_SVW4_TT4_64_VW4_WGM4
    SolutionIndex: 31
    SolutionNameMin: Cijk_Ailk_Bljk_HHS_BH_MT128x128x16_MI16x16x16x1_SN_1LDSB1_AMAS3_GRVW4_IU1_NLCA1_SIA2_SU0_SUS0_SVW2_TT4_64_VW2_WGM4
    SolutionIndex: 32
    SolutionNameMin: Cijk_Ailk_Bljk_HHS_BH_MT128x128x16_MI16x16x16x1_SN_1LDSB1_AMAS3_GRVW4_IU1_NLCA1_SIA2_SU0_SUS0_SVW4_TT4_64_VW4_WGM4
    SolutionIndex: 33
    SolutionNameMin: Cijk_Ailk_Bljk_HHS_BH_MT128x128x16_MI16x16x16x1_SN_1LDSB1_AMAS3_GRVW8_IU1_NLCA1_SIA2_SU0_SUS0_SVW4_TT4_64_VW4_WGM4
    SolutionIndex: 34
    SolutionNameMin: Cijk_Ailk_Bljk_HHS_BH_MT128x128x16_MI16x16x16x1_SN_1LDSB0_AMAS3_GRVW4_IU1_NLCA1_SIA3_SU0_SUS0_SVW4_TT4_64_VW4_WGM4
    SolutionIndex: 35
    SolutionNameMin: Cijk_Ailk_Bljk_HHS_BH_MT128x128x16_MI16x16x16x1_SN_1LDSB0_AMAS3_GRVW8_IU1_NLCA1_SIA3_SU0_SUS0_SVW2_TT4_64_VW2_WGM4
    SolutionIndex: 36
    SolutionNameMin: Cijk_Ailk_Bljk_HHS_BH_MT128x128x16_MI16x16x16x1_SN_1LDSB0_AMAS3_GRVW8_IU1_NLCA1_SIA3_SU0_SUS0_SVW4_TT4_64_VW4_WGM4
    SolutionIndex: 37
    SolutionNameMin: Cijk_Ailk_Bljk_HHS_BH_MT128x128x16_MI16x16x16x1_SN_1LDSB0_AMAS3_GRVW2_IU1_NLCA2_SIA1_SU32_SUS128_SVW2_TT4_64_VW2_WGM4
    SolutionIndex: 38
    SolutionNameMin: Cijk_Ailk_Bljk_HHS_BH_MT128x128x16_MI16x16x16x1_SN_1LDSB0_AMAS3_GRVW4_IU1_NLCA1_SIA1_SU32_SUS128_SVW4_TT4_64_VW4_WGM4
    SolutionIndex: 39
    SolutionNameMin: Cijk_Ailk_Bljk_HHS_BH_MT128x128x16_MI16x16x16x1_SN_1LDSB0_AMAS0_GRVW8_IU1_NLCA1_SIA1_SU32_SUS128_SVW1_TT4_64_VW1_WGM4
    SolutionIndex: 40
    SolutionNameMin: Cijk_Ailk_Bljk_HHS_BH_MT128x128x16_MI16x16x16x1_SN_1LDSB0_AMAS3_GRVW8_IU1_NLCA1_SIA1_SU32_SUS128_SVW4_TT4_64_VW4_WGM4
    SolutionIndex: 41
    SolutionNameMin: Cijk_Ailk_Bljk_HHS_BH_MT128x128x16_MI16x16x16x1_SN_1LDSB1_AMAS3_GRVW8_IU1_NLCA1_SIA2_SU32_SUS128_SVW4_TT4_64_VW4_WGM4
    SolutionIndex: 42
    SolutionNameMin: Cijk_Ailk_Bljk_HHS_BH_MT128x128x16_MI16x16x16x1_SN_1LDSB0_AMAS3_GRVW4_IU1_NLCA1_SIA3_SU32_SUS128_SVW4_TT4_64_VW4_WGM4
    SolutionIndex: 43
    SolutionNameMin: Cijk_Ailk_Bljk_HHS_BH_MT128x128x16_MI16x16x16x1_SN_1LDSB0_AMAS3_GRVW8_IU1_NLCA1_SIA3_SU32_SUS128_SVW2_TT4_64_VW2_WGM4
    SolutionIndex: 44
    SolutionNameMin: Cijk_Ailk_Bljk_HHS_BH_MT128x128x16_MI16x16x16x1_SN_1LDSB0_AMAS3_GRVW8_IU1_NLCA1_SIA3_SU32_SUS128_SVW4_TT4_64_VW4_WGM4
    SolutionIndex: 45
    SolutionNameMin: Cijk_Ailk_Bljk_HHS_BH_MT128x128x16_MI16x16x16x1_SN_1LDSB0_AMAS3_GRVW4_IU1_NLCA1_SIA1_SU32_SUS256_SVW4_TT4_64_VW4_WGM4
    SolutionIndex: 46
    SolutionNameMin: Cijk_Ailk_Bljk_HHS_BH_MT128x128x16_MI16x16x16x1_SN_1LDSB0_AMAS3_GRVW8_IU1_NLCA1_SIA1_SU32_SUS256_SVW2_TT4_64_VW2_WGM4
    SolutionIndex: 47
    SolutionNameMin: Cijk_Ailk_Bljk_HHS_BH_MT128x128x16_MI16x16x16x1_SN_1LDSB0_AMAS3_GRVW8_IU1_NLCA1_SIA1_SU32_SUS256_SVW4_TT4_64_VW4_WGM4
    SolutionIndex: 48
    SolutionNameMin: Cijk_Ailk_Bljk_HHS_BH_MT128x128x16_MI16x16x16x1_SN_1LDSB0_AMAS3_GRVW4_IU1_NLCA1_SIA3_SU32_SUS256_SVW4_TT4_64_VW4_WGM4
    SolutionIndex: 49
    SolutionNameMin: Cijk_Ailk_Bljk_HHS_BH_MT128x128x16_MI16x16x16x1_SN_1LDSB0_AMAS3_GRVW8_IU1_NLCA1_SIA3_SU32_SUS256_SVW4_TT4_64_VW4_WGM4
    SolutionIndex: 50
    SolutionNameMin: Cijk_Ailk_Bljk_HHS_BH_MT128x128x16_MI16x16x16x1_SN_1LDSB0_AMAS3_GRVW2_IU1_NLCA2_SIA1_SU0_SUS0_SVW2_TT4_64_VW2_WGM8
    SolutionIndex: 51
    SolutionNameMin: Cijk_Ailk_Bljk_HHS_BH_MT128x128x16_MI16x16x16x1_SN_1LDSB0_AMAS3_GRVW2_IU1_NLCA2_SIA1_SU0_SUS0_SVW4_TT4_64_VW4_WGM8
    SolutionIndex: 52
    SolutionNameMin: Cijk_Ailk_Bljk_HHS_BH_MT128x128x16_MI16x16x16x1_SN_1LDSB0_AMAS0_GRVW4_IU1_NLCA1_SIA1_SU0_SUS0_SVW1_TT4_64_VW1_WGM8
    SolutionIndex: 53
    SolutionNameMin: Cijk_Ailk_Bljk_HHS_BH_MT128x128x16_MI16x16x16x1_SN_1LDSB0_AMAS3_GRVW4_IU1_NLCA1_SIA1_SU0_SUS0_SVW2_TT4_64_VW2_WGM8
    SolutionIndex: 54
    SolutionNameMin: Cijk_Ailk_Bljk_HHS_BH_MT128x128x16_MI16x16x16x1_SN_1LDSB0_AMAS3_GRVW4_IU1_NLCA1_SIA1_SU0_SUS0_SVW4_TT4_64_VW4_WGM8
    SolutionIndex: 55
    SolutionNameMin: Cijk_Ailk_Bljk_HHS_BH_MT128x128x16_MI16x16x16x1_SN_1LDSB0_AMAS0_GRVW8_IU1_NLCA1_SIA1_SU0_SUS0_SVW1_TT4_64_VW1_WGM8
    SolutionIndex: 56
    SolutionNameMin: Cijk_Ailk_Bljk_HHS_BH_MT128x128x16_MI16x16x16x1_SN_1LDSB0_AMAS3_GRVW8_IU1_NLCA1_SIA1_SU0_SUS0_SVW2_TT4_64_VW2_WGM8
    SolutionIndex: 57
    SolutionNameMin: Cijk_Ailk_Bljk_HHS_BH_MT128x128x16_MI16x16x16x1_SN_1LDSB0_AMAS3_GRVW8_IU1_NLCA1_SIA1_SU0_SUS0_SVW4_TT4_64_VW4_WGM8
    SolutionIndex: 58
    SolutionNameMin: Cijk_Ailk_Bljk_HHS_BH_MT128x128x16_MI16x16x16x1_SN_1LDSB1_AMAS3_GRVW2_IU1_NLCA2_SIA2_SU0_SUS0_SVW2_TT4_64_VW2_WGM8
    SolutionIndex: 59
    SolutionNameMin: Cijk_Ailk_Bljk_HHS_BH_MT128x128x16_MI16x16x16x1_SN_1LDSB1_AMAS3_GRVW2_IU1_NLCA2_SIA2_SU0_SUS0_SVW4_TT4_64_VW4_WGM8
    SolutionIndex: 60
    SolutionNameMin: Cijk_Ailk_Bljk_HHS_BH_MT128x128x16_MI16x16x16x1_SN_1LDSB1_AMAS3_GRVW4_IU1_NLCA1_SIA2_SU0_SUS0_SVW4_TT4_64_VW4_WGM8
    SolutionIndex: 61
    SolutionNameMin: Cijk_Ailk_Bljk_HHS_BH_MT128x128x16_MI16x16x16x1_SN_1LDSB1_AMAS3_GRVW8_IU1_NLCA1_SIA2_SU0_SUS0_SVW4_TT4_64_VW4_WGM8
    SolutionIndex: 62
    SolutionNameMin: Cijk_Ailk_Bljk_HHS_BH_MT128x128x16_MI16x16x16x1_SN_1LDSB0_AMAS3_GRVW4_IU1_NLCA1_SIA3_SU0_SUS0_SVW4_TT4_64_VW4_WGM8
    SolutionIndex: 63
    SolutionNameMin: Cijk_Ailk_Bljk_HHS_BH_MT128x128x16_MI16x16x16x1_SN_1LDSB0_AMAS3_GRVW8_IU1_NLCA1_SIA3_SU0_SUS0_SVW4_TT4_64_VW4_WGM8
    SolutionIndex: 64
    SolutionNameMin: Cijk_Ailk_Bljk_HHS_BH_MT128x128x16_MI16x16x16x1_SN_1LDSB0_AMAS3_GRVW2_IU1_NLCA2_SIA1_SU32_SUS128_SVW2_TT4_64_VW2_WGM8
    SolutionIndex: 65
    SolutionNameMin: Cijk_Ailk_Bljk_HHS_BH_MT128x128x16_MI16x16x16x1_SN_1LDSB0_AMAS3_GRVW4_IU1_NLCA1_SIA1_SU32_SUS128_SVW4_TT4_64_VW4_WGM8
    SolutionIndex: 66
    SolutionNameMin: Cijk_Ailk_Bljk_HHS_BH_MT128x128x16_MI16x16x16x1_SN_1LDSB0_AMAS0_GRVW8_IU1_NLCA1_SIA1_SU32_SUS128_SVW1_TT4_64_VW1_WGM8
    SolutionIndex: 67
    SolutionNameMin: Cijk_Ailk_Bljk_HHS_BH_MT128x128x16_MI16x16x16x1_SN_1LDSB0_AMAS3_GRVW8_IU1_NLCA1_SIA1_SU32_SUS128_SVW2_TT4_64_VW2_WGM8
    SolutionIndex: 68
    SolutionNameMin: Cijk_Ailk_Bljk_HHS_BH_MT128x128x16_MI16x16x16x1_SN_1LDSB0_AMAS3_GRVW8_IU1_NLCA1_SIA1_SU32_SUS128_SVW4_TT4_64_VW4_WGM8
    SolutionIndex: 69
    SolutionNameMin: Cijk_Ailk_Bljk_HHS_BH_MT128x128x16_MI16x16x16x1_SN_1LDSB1_AMAS3_GRVW4_IU1_NLCA1_SIA2_SU32_SUS128_SVW2_TT4_64_VW2_WGM8
    SolutionIndex: 70
    SolutionNameMin: Cijk_Ailk_Bljk_HHS_BH_MT128x128x16_MI16x16x16x1_SN_1LDSB1_AMAS3_GRVW4_IU1_NLCA1_SIA2_SU32_SUS128_SVW4_TT4_64_VW4_WGM8
    SolutionIndex: 71
    SolutionNameMin: Cijk_Ailk_Bljk_HHS_BH_MT128x128x16_MI16x16x16x1_SN_1LDSB0_AMAS3_GRVW4_IU1_NLCA1_SIA3_SU32_SUS128_SVW4_TT4_64_VW4_WGM8
    SolutionIndex: 72
    SolutionNameMin: Cijk_Ailk_Bljk_HHS_BH_MT128x128x16_MI16x16x16x1_SN_1LDSB0_AMAS3_GRVW8_IU1_NLCA1_SIA3_SU32_SUS128_SVW4_TT4_64_VW4_WGM8
    SolutionIndex: 73
    SolutionNameMin: Cijk_Ailk_Bljk_HHS_BH_MT128x128x16_MI16x16x16x1_SN_1LDSB0_AMAS3_GRVW4_IU1_NLCA1_SIA1_SU32_SUS256_SVW2_TT4_64_VW2_WGM8
    SolutionIndex: 74
    SolutionNameMin: Cijk_Ailk_Bljk_HHS_BH_MT128x128x16_MI16x16x16x1_SN_1LDSB0_AMAS0_GRVW8_IU1_NLCA1_SIA1_SU32_SUS256_SVW1_TT4_64_VW1_WGM8
    SolutionIndex: 75
    SolutionNameMin: Cijk_Ailk_Bljk_HHS_BH_MT128x128x16_MI16x16x16x1_SN_1LDSB0_AMAS3_GRVW8_IU1_NLCA1_SIA1_SU32_SUS256_SVW2_TT4_64_VW2_WGM8
    SolutionIndex: 76
    SolutionNameMin: Cijk_Ailk_Bljk_HHS_BH_MT128x128x16_MI16x16x16x1_SN_1LDSB0_AMAS3_GRVW8_IU1_NLCA1_SIA1_SU32_SUS256_SVW4_TT4_64_VW4_WGM8
    SolutionIndex: 77
    SolutionNameMin: Cijk_Ailk_Bljk_HHS_BH_MT128x128x16_MI16x16x16x1_SN_1LDSB1_AMAS0_GRVW4_IU1_NLCA1_SIA2_SU32_SUS256_SVW1_TT4_64_VW1_WGM8
    SolutionIndex: 78
    SolutionNameMin: Cijk_Ailk_Bljk_HHS_BH_MT128x128x16_MI16x16x16x1_SN_1LDSB1_AMAS3_GRVW4_IU1_NLCA1_SIA2_SU32_SUS256_SVW4_TT4_64_VW4_WGM8
    SolutionIndex: 79
    SolutionNameMin: Cijk_Ailk_Bljk_HHS_BH_MT128x128x16_MI16x16x16x1_SN_1LDSB1_AMAS3_GRVW8_IU1_NLCA1_SIA2_SU32_SUS256_SVW4_TT4_64_VW4_WGM8
    SolutionIndex: 80
    SolutionNameMin: Cijk_Ailk_Bljk_HHS_BH_MT128x128x16_MI16x16x16x1_SN_1LDSB0_AMAS3_GRVW4_IU1_NLCA1_SIA3_SU32_SUS256_SVW4_TT4_64_VW4_WGM8
    SolutionIndex: 81
    SolutionNameMin: Cijk_Ailk_Bljk_HHS_BH_MT128x128x16_MI16x16x16x1_SN_1LDSB0_AMAS3_GRVW8_IU1_NLCA1_SIA3_SU32_SUS256_SVW4_TT4_64_VW4_WGM8
    SolutionIndex: 82
    SolutionNameMin: Cijk_Ailk_Bljk_HHS_BH_MT32x32x32_MI16x16x16x1_SN_1LDSB0_AMAS0_GRVW2_IU1_NLCA1_SIA1_SU0_SUS0_SVW1_TT1_16_VW1_WGM4
    SolutionIndex: 83
    SolutionNameMin: Cijk_Ailk_Bljk_HHS_BH_MT32x32x32_MI16x16x16x1_SN_1LDSB0_AMAS0_GRVW4_IU1_NLCA1_SIA1_SU0_SUS0_SVW1_TT1_16_VW1_WGM4
    SolutionIndex: 84
    SolutionNameMin: Cijk_Ailk_Bljk_HHS_BH_MT32x32x32_MI16x16x16x1_SN_1LDSB0_AMAS0_GRVW8_IU1_NLCA1_SIA1_SU0_SUS0_SVW1_TT1_16_VW1_WGM4
    SolutionIndex: 85
    SolutionNameMin: Cijk_Ailk_Bljk_HHS_BH_MT32x32x32_MI16x16x16x1_SN_1LDSB1_AMAS0_GRVW2_IU2_NLCA1_SIA2_SU0_SUS0_SVW1_TT1_16_VW1_WGM4
    SolutionIndex: 86
    SolutionNameMin: Cijk_Ailk_Bljk_HHS_BH_MT32x32x32_MI16x16x16x1_SN_1LDSB1_AMAS0_GRVW4_IU2_NLCA1_SIA2_SU0_SUS0_SVW1_TT1_16_VW1_WGM4
    SolutionIndex: 87
    SolutionNameMin: Cijk_Ailk_Bljk_HHS_BH_MT32x32x32_MI16x16x16x1_SN_1LDSB1_AMAS0_GRVW8_IU2_NLCA1_SIA2_SU0_SUS0_SVW1_TT1_16_VW1_WGM4
    SolutionIndex: 88
    SolutionNameMin: Cijk_Ailk_Bljk_HHS_BH_MT32x32x32_MI16x16x16x1_SN_1LDSB0_AMAS0_GRVW4_IU1_NLCA1_SIA1_SU32_SUS128_SVW1_TT1_16_VW1_WGM4
    SolutionIndex: 89
    SolutionNameMin: Cijk_Ailk_Bljk_HHS_BH_MT32x32x32_MI16x16x16x1_SN_1LDSB0_AMAS0_GRVW8_IU1_NLCA1_SIA1_SU32_SUS128_SVW1_TT1_16_VW1_WGM4
    SolutionIndex: 90
    SolutionNameMin: Cijk_Ailk_Bljk_HHS_BH_MT32x32x32_MI16x16x16x1_SN_1LDSB1_AMAS0_GRVW2_IU2_NLCA1_SIA2_SU32_SUS128_SVW1_TT1_16_VW1_WGM4
    SolutionIndex: 91
    SolutionNameMin: Cijk_Ailk_Bljk_HHS_BH_MT32x32x32_MI16x16x16x1_SN_1LDSB1_AMAS0_GRVW4_IU2_NLCA1_SIA2_SU32_SUS128_SVW1_TT1_16_VW1_WGM4
    SolutionIndex: 92
    SolutionNameMin: Cijk_Ailk_Bljk_HHS_BH_MT32x32x32_MI16x16x16x1_SN_1LDSB1_AMAS0_GRVW8_IU2_NLCA1_SIA2_SU32_SUS128_SVW1_TT1_16_VW1_WGM4
    SolutionIndex: 93
    SolutionNameMin: Cijk_Ailk_Bljk_HHS_BH_MT32x32x32_MI16x16x16x1_SN_1LDSB0_AMAS0_GRVW4_IU1_NLCA1_SIA3_SU32_SUS128_SVW1_TT1_16_VW1_WGM4
    SolutionIndex: 94
    SolutionNameMin: Cijk_Ailk_Bljk_HHS_BH_MT32x32x32_MI16x16x16x1_SN_1LDSB0_AMAS0_GRVW8_IU1_NLCA1_SIA3_SU32_SUS128_SVW1_TT1_16_VW1_WGM4
    SolutionIndex: 95
    SolutionNameMin: Cijk_Ailk_Bljk_HHS_BH_MT32x32x32_MI16x16x16x1_SN_1LDSB0_AMAS0_GRVW8_IU1_NLCA1_SIA1_SU32_SUS256_SVW1_TT1_16_VW1_WGM4
    SolutionIndex: 96
    SolutionNameMin: Cijk_Ailk_Bljk_HHS_BH_MT32x32x32_MI16x16x16x1_SN_1LDSB1_AMAS0_GRVW4_IU2_NLCA1_SIA2_SU32_SUS256_SVW1_TT1_16_VW1_WGM4
    SolutionIndex: 97
    SolutionNameMin: Cijk_Ailk_Bljk_HHS_BH_MT32x32x32_MI16x16x16x1_SN_1LDSB1_AMAS0_GRVW8_IU2_NLCA1_SIA2_SU32_SUS256_SVW1_TT1_16_VW1_WGM4
    SolutionIndex: 98
    SolutionNameMin: Cijk_Ailk_Bljk_HHS_BH_MT32x32x32_MI16x16x16x1_SN_1LDSB0_AMAS0_GRVW8_IU1_NLCA1_SIA3_SU32_SUS256_SVW1_TT1_16_VW1_WGM4
    SolutionIndex: 99
    SolutionNameMin: Cijk_Ailk_Bljk_HHS_BH_MT32x32x32_MI16x16x16x1_SN_1LDSB0_AMAS0_GRVW4_IU1_NLCA1_SIA1_SU0_SUS0_SVW1_TT1_16_VW1_WGM8
    SolutionIndex: 100
    SolutionNameMin: Cijk_Ailk_Bljk_HHS_BH_MT32x32x32_MI16x16x16x1_SN_1LDSB0_AMAS0_GRVW8_IU1_NLCA1_SIA1_SU0_SUS0_SVW1_TT1_16_VW1_WGM8
    SolutionIndex: 101
    SolutionNameMin: Cijk_Ailk_Bljk_HHS_BH_MT32x32x32_MI16x16x16x1_SN_1LDSB1_AMAS0_GRVW4_IU2_NLCA1_SIA2_SU0_SUS0_SVW1_TT1_16_VW1_WGM8
    SolutionIndex: 102
    SolutionNameMin: Cijk_Ailk_Bljk_HHS_BH_MT32x32x32_MI16x16x16x1_SN_1LDSB1_AMAS0_GRVW8_IU2_NLCA1_SIA2_SU0_SUS0_SVW1_TT1_16_VW1_WGM8
    SolutionIndex: 103
    SolutionNameMin: Cijk_Ailk_Bljk_HHS_BH_MT32x32x32_MI16x16x16x1_SN_1LDSB0_AMAS0_GRVW4_IU1_NLCA1_SIA1_SU32_SUS128_SVW1_TT1_16_VW1_WGM8
    SolutionIndex: 104
    SolutionNameMin: Cijk_Ailk_Bljk_HHS_BH_MT32x32x32_MI16x16x16x1_SN_1LDSB0_AMAS0_GRVW8_IU1_NLCA1_SIA1_SU32_SUS128_SVW1_TT1_16_VW1_WGM8
    SolutionIndex: 105
    SolutionNameMin: Cijk_Ailk_Bljk_HHS_BH_MT32x32x32_MI16x16x16x1_SN_1LDSB1_AMAS0_GRVW4_IU2_NLCA1_SIA2_SU32_SUS128_SVW1_TT1_16_VW1_WGM8
    SolutionIndex: 106
    SolutionNameMin: Cijk_Ailk_Bljk_HHS_BH_MT32x32x32_MI16x16x16x1_SN_1LDSB1_AMAS0_GRVW8_IU2_NLCA1_SIA2_SU32_SUS128_SVW1_TT1_16_VW1_WGM8
    SolutionIndex: 107
    SolutionNameMin: Cijk_Ailk_Bljk_HHS_BH_MT32x32x32_MI16x16x16x1_SN_1LDSB0_AMAS0_GRVW8_IU1_NLCA1_SIA1_SU32_SUS256_SVW1_TT1_16_VW1_WGM8
    SolutionIndex: 108
    SolutionNameMin: Cijk_Ailk_Bljk_HHS_BH_MT32x32x32_MI16x16x16x1_SN_1LDSB1_AMAS0_GRVW4_IU2_NLCA1_SIA2_SU32_SUS256_SVW1_TT1_16_VW1_WGM8
    SolutionIndex: 109
    SolutionNameMin: Cijk_Ailk_Bljk_HHS_BH_MT32x32x32_MI16x16x16x1_SN_1LDSB1_AMAS0_GRVW8_IU2_NLCA1_SIA2_SU32_SUS256_SVW1_TT1_16_VW1_WGM8
    SolutionIndex: 110
    SolutionNameMin: Cijk_Ailk_Bljk_HHS_BH_MT64x64x32_MI16x16x16x1_SN_1LDSB0_AMAS3_GRVW4_IU1_NLCA1_SIA1_SU0_SUS0_SVW2_TT2_32_VW2_WGM4
    SolutionIndex: 111
    SolutionNameMin: Cijk_Ailk_Bljk_HHS_BH_MT64x64x32_MI16x16x16x1_SN_1LDSB0_AMAS0_GRVW8_IU1_NLCA1_SIA1_SU0_SUS0_SVW1_TT2_32_VW1_WGM4
    SolutionIndex: 112
    SolutionNameMin: Cijk_Ailk_Bljk_HHS_BH_MT64x64x32_MI16x16x16x1_SN_1LDSB0_AMAS3_GRVW8_IU1_NLCA1_SIA1_SU0_SUS0_SVW2_TT2_32_VW2_WGM4
    SolutionIndex: 113
    SolutionNameMin: Cijk_Ailk_Bljk_HHS_BH_MT64x64x32_MI16x16x16x1_SN_1LDSB1_AMAS0_GRVW4_IU2_NLCA1_SIA2_SU0_SUS0_SVW1_TT2_32_VW1_WGM4
    SolutionIndex: 114
    SolutionNameMin: Cijk_Ailk_Bljk_HHS_BH_MT64x64x32_MI16x16x16x1_SN_1LDSB1_AMAS3_GRVW4_IU2_NLCA1_SIA2_SU0_SUS0_SVW2_TT2_32_VW2_WGM4
    SolutionIndex: 115
    SolutionNameMin: Cijk_Ailk_Bljk_HHS_BH_MT64x64x32_MI16x16x16x1_SN_1LDSB1_AMAS0_GRVW8_IU2_NLCA1_SIA2_SU0_SUS0_SVW1_TT2_32_VW1_WGM4
    SolutionIndex: 116
    SolutionNameMin: Cijk_Ailk_Bljk_HHS_BH_MT64x64x32_MI16x16x16x1_SN_1LDSB1_AMAS3_GRVW8_IU2_NLCA1_SIA2_SU0_SUS0_SVW2_TT2_32_VW2_WGM4
    SolutionIndex: 117
    SolutionNameMin: Cijk_Ailk_Bljk_HHS_BH_MT64x64x32_MI16x16x16x1_SN_1LDSB0_AMAS3_GRVW4_IU1_NLCA1_SIA3_SU0_SUS0_SVW2_TT2_32_VW2_WGM4
    SolutionIndex: 118
    SolutionNameMin: Cijk_Ailk_Bljk_HHS_BH_MT64x64x32_MI16x16x16x1_SN_1LDSB0_AMAS0_GRVW8_IU1_NLCA1_SIA3_SU0_SUS0_SVW1_TT2_32_VW1_WGM4
    SolutionIndex: 119
    SolutionNameMin: Cijk_Ailk_Bljk_HHS_BH_MT64x64x32_MI16x16x16x1_SN_1LDSB0_AMAS3_GRVW8_IU1_NLCA1_SIA3_SU0_SUS0_SVW2_TT2_32_VW2_WGM4
    SolutionIndex: 120
    SolutionNameMin: Cijk_Ailk_Bljk_HHS_BH_MT64x64x32_MI16x16x16x1_SN_1LDSB1_AMAS3_GRVW4_IU2_NLCA1_SIA2_SU32_SUS128_SVW2_TT2_32_VW2_WGM4
    SolutionIndex: 121
    SolutionNameMin: Cijk_Ailk_Bljk_HHS_BH_MT64x64x32_MI16x16x16x1_SN_1LDSB1_AMAS3_GRVW8_IU2_NLCA1_SIA2_SU32_SUS128_SVW2_TT2_32_VW2_WGM4
    SolutionIndex: 122
    SolutionNameMin: Cijk_Ailk_Bljk_HHS_BH_MT64x64x32_MI16x16x16x1_SN_1LDSB0_AMAS3_GRVW8_IU1_NLCA1_SIA3_SU32_SUS128_SVW2_TT2_32_VW2_WGM4
    SolutionIndex: 123
    SolutionNameMin: Cijk_Ailk_Bljk_HHS_BH_MT64x64x32_MI16x16x16x1_SN_1LDSB0_AMAS3_GRVW8_IU1_NLCA1_SIA1_SU32_SUS256_SVW2_TT2_32_VW2_WGM4
    SolutionIndex: 124
    SolutionNameMin: Cijk_Ailk_Bljk_HHS_BH_MT64x64x32_MI16x16x16x1_SN_1LDSB1_AMAS3_GRVW4_IU2_NLCA1_SIA2_SU32_SUS256_SVW2_TT2_32_VW2_WGM4
    SolutionIndex: 125
    SolutionNameMin: Cijk_Ailk_Bljk_HHS_BH_MT64x64x32_MI16x16x16x1_SN_1LDSB1_AMAS3_GRVW8_IU2_NLCA1_SIA2_SU32_SUS256_SVW2_TT2_32_VW2_WGM4
    SolutionIndex: 126
    SolutionNameMin: Cijk_Ailk_Bljk_HHS_BH_MT64x64x32_MI16x16x16x1_SN_1LDSB0_AMAS3_GRVW8_IU1_NLCA1_SIA3_SU32_SUS256_SVW2_TT2_32_VW2_WGM4
    SolutionIndex: 127
    SolutionNameMin: Cijk_Ailk_Bljk_HHS_BH_MT64x64x32_MI16x16x16x1_SN_1LDSB0_AMAS0_GRVW4_IU1_NLCA1_SIA1_SU0_SUS0_SVW1_TT2_32_VW1_WGM8
    SolutionIndex: 128
    SolutionNameMin: Cijk_Ailk_Bljk_HHS_BH_MT64x64x32_MI16x16x16x1_SN_1LDSB0_AMAS3_GRVW4_IU1_NLCA1_SIA1_SU0_SUS0_SVW2_TT2_32_VW2_WGM8
    SolutionIndex: 129
    SolutionNameMin: Cijk_Ailk_Bljk_HHS_BH_MT64x64x32_MI16x16x16x1_SN_1LDSB0_AMAS0_GRVW8_IU1_NLCA1_SIA1_SU0_SUS0_SVW1_TT2_32_VW1_WGM8
    SolutionIndex: 130
    SolutionNameMin: Cijk_Ailk_Bljk_HHS_BH_MT64x64x32_MI16x16x16x1_SN_1LDSB0_AMAS3_GRVW8_IU1_NLCA1_SIA1_SU0_SUS0_SVW2_TT2_32_VW2_WGM8
    SolutionIndex: 131
    SolutionNameMin: Cijk_Ailk_Bljk_HHS_BH_MT64x64x32_MI16x16x16x1_SN_1LDSB1_AMAS3_GRVW4_IU2_NLCA1_SIA2_SU0_SUS0_SVW2_TT2_32_VW2_WGM8
    SolutionIndex: 132
    SolutionNameMin: Cijk_Ailk_Bljk_HHS_BH_MT64x64x32_MI16x16x16x1_SN_1LDSB1_AMAS0_GRVW8_IU2_NLCA1_SIA2_SU0_SUS0_SVW1_TT2_32_VW1_WGM8
    SolutionIndex: 133
    SolutionNameMin: Cijk_Ailk_Bljk_HHS_BH_MT64x64x32_MI16x16x16x1_SN_1LDSB1_AMAS3_GRVW8_IU2_NLCA1_SIA2_SU0_SUS0_SVW2_TT2_32_VW2_WGM8
    SolutionIndex: 134
    SolutionNameMin: Cijk_Ailk_Bljk_HHS_BH_MT64x64x32_MI16x16x16x1_SN_1LDSB0_AMAS0_GRVW8_IU1_NLCA1_SIA3_SU0_SUS0_SVW1_TT2_32_VW1_WGM8
    SolutionIndex: 135
    SolutionNameMin: Cijk_Ailk_Bljk_HHS_BH_MT64x64x32_MI16x16x16x1_SN_1LDSB0_AMAS3_GRVW8_IU1_NLCA1_SIA3_SU0_SUS0_SVW2_TT2_32_VW2_WGM8
    SolutionIndex: 136
    SolutionNameMin: Cijk_Ailk_Bljk_HHS_BH_MT64x64x32_MI16x16x16x1_SN_1LDSB0_AMAS0_GRVW8_IU1_NLCA1_SIA1_SU32_SUS128_SVW1_TT2_32_VW1_WGM8
    SolutionIndex: 137
    SolutionNameMin: Cijk_Ailk_Bljk_HHS_BH_MT64x64x32_MI16x16x16x1_SN_1LDSB0_AMAS3_GRVW8_IU1_NLCA1_SIA1_SU32_SUS128_SVW2_TT2_32_VW2_WGM8
    SolutionIndex: 138
    SolutionNameMin: Cijk_Ailk_Bljk_HHS_BH_MT64x64x32_MI16x16x16x1_SN_1LDSB1_AMAS0_GRVW8_IU2_NLCA1_SIA2_SU32_SUS128_SVW1_TT2_32_VW1_WGM8
    SolutionIndex: 139
    SolutionNameMin: Cijk_Ailk_Bljk_HHS_BH_MT64x64x32_MI16x16x16x1_SN_1LDSB1_AMAS3_GRVW8_IU2_NLCA1_SIA2_SU32_SUS128_SVW2_TT2_32_VW2_WGM8
    SolutionIndex: 140
    SolutionNameMin: Cijk_Ailk_Bljk_HHS_BH_MT64x64x32_MI16x16x16x1_SN_1LDSB0_AMAS3_GRVW8_IU1_NLCA1_SIA3_SU32_SUS128_SVW2_TT2_32_VW2_WGM8
    SolutionIndex: 141
    SolutionNameMin: Cijk_Ailk_Bljk_HHS_BH_MT64x64x32_MI16x16x16x1_SN_1LDSB0_AMAS3_GRVW8_IU1_NLCA1_SIA1_SU32_SUS256_SVW2_TT2_32_VW2_WGM8
    SolutionIndex: 142
    SolutionNameMin: Cijk_Ailk_Bljk_HHS_BH_MT64x64x32_MI16x16x16x1_SN_1LDSB1_AMAS0_GRVW8_IU2_NLCA1_SIA2_SU32_SUS256_SVW1_TT2_32_VW1_WGM8
    SolutionIndex: 143
    SolutionNameMin: Cijk_Ailk_Bljk_HHS_BH_MT64x64x32_MI16x16x16x1_SN_1LDSB1_AMAS3_GRVW8_IU2_NLCA1_SIA2_SU32_SUS256_SVW2_TT2_32_VW2_WGM8
    SolutionIndex: 144
    SolutionNameMin: Cijk_Ailk_Bljk_HHS_BH_MT64x64x32_MI16x16x16x1_SN_1LDSB0_AMAS0_GRVW8_IU1_NLCA1_SIA3_SU32_SUS256_SVW1_TT2_32_VW1_WGM8
- - - [64, 64, 1, 64, 96, 96, 96, 96]
    - [100, 0.04]
  - - [64, 64, 1, 128, 96, 96, 160, 160]
    - [102, 0.081]
  - - [64, 64, 1, 256, 96, 96, 288, 288]
    - [86, 0.152]
  - - [64, 64, 1, 512, 96, 96, 544, 544]
    - [96, 0.267]
  - - [64, 64, 1, 1024, 96, 96, 1056, 1056]
    - [105, 0.438]
  - - [64, 64, 1, 2048, 96, 96, 2080, 2080]
    - [86, 0.635]
  - - [64, 64, 1, 4096, 96, 96, 4128, 4128]
    - [108, 0.816]
  - - [64, 64, 1, 8192, 96, 96, 8224, 8224]
    - [91, 0.931]
  - - [64, 128, 1, 64, 96, 96, 96, 96]
    - [106, 0.087]
  - - [64, 128, 1, 128, 96, 96, 160, 160]
    - [106, 0.167]
  - - [64, 128, 1, 256, 96, 96, 288, 288]
    - [92, 0.312]
  - - [64, 128, 1, 512, 96, 96, 544, 544]
    - [92, 0.546]
  - - [64, 128, 1, 1024, 96, 96, 1056, 1056]
    - [86, 0.886]
  - - [64, 128, 1, 2048, 96, 96, 2080, 2080]
    - [97, 1.263]
  - - [64, 128, 1, 4096, 96, 96, 4128, 4128]
    - [101, 1.637]
  - - [64, 128, 1, 8192, 96, 96, 8224, 8224]
    - [105, 1.905]
  - - [64, 256, 1, 64, 96, 96, 96, 96]
    - [102, 0.176]
  - - [64, 256, 1, 128, 96, 96, 160, 160]
    - [109, 0.337]
  - - [64, 256, 1, 256, 96, 96, 288, 288]
    - [96, 0.63]
  - - [64, 256, 1, 512, 96, 96, 544, 544]
    - [86, 1.113]
  - - [64, 256, 1, 1024, 96, 96, 1056, 1056]
    - [102, 1.786]
  - - [64, 256, 1, 2048, 96, 96, 2080, 2080]
    - [101, 2.574]
  - - [64, 256, 1, 4096, 96, 96, 4128, 4128]
    - [105, 3.286]
  - - [64, 256, 1, 8192, 96, 96, 8224, 8224]
    - [96, 3.797]
  - - [64, 512, 1, 64, 96, 96, 96, 96]
    - [96, 0.355]
  - - [64, 512, 1, 128, 96, 96, 160, 160]
    - [86, 0.679]
  - - [64, 512, 1, 256, 96, 96, 288, 288]
    - [90, 1.266]
  - - [64, 512, 1, 512, 96, 96, 544, 544]
    - [109, 2.216]
  - - [64, 512, 1, 1024, 96, 96, 1056, 1056]
    - [101, 3.592]
  - - [64, 512, 1, 2048, 96, 96, 2080, 2080]
    - [86, 5.12]
  - - [64, 512, 1, 4096, 96, 96, 4128, 4128]
    - [108, 6.564]
  - - [64, 512, 1, 8192, 96, 96, 8224, 8224]
    - [91, 7.609]
  - - [64, 1024, 1, 64, 96, 96, 96, 96]
    - [100, 0.699]
  - - [64, 1024, 1, 128, 96, 96, 160, 160]
    - [97, 1.339]
  - - [64, 1024, 1, 256, 96, 96, 288, 288]
    - [102, 2.495]
  - - [64, 1024, 1, 512, 96, 96, 544, 544]
    - [105, 4.333]
  - - [64, 1024, 1, 1024, 96, 96, 1056, 1056]
    - [101, 6.814]
  - - [64, 1024, 1, 2048, 96, 96, 2080, 2080]
    - [102, 9.622]
  - - [64, 1024, 1, 4096, 96, 96, 4128, 4128]
    - [102, 12.04]
  - - [64, 1024, 1, 8192, 96, 96, 8224, 8224]
    - [91, 13.65]
  - - [64, 2048, 1, 64, 96, 96, 96, 96]
    - [95, 1.372]
  - - [64, 2048, 1, 128, 96, 96, 160, 160]
    - [84, 2.591]
  - - [64, 2048, 1, 256, 96, 96, 288, 288]
    - [84, 4.697]
  - - [64, 2048, 1, 512, 96, 96, 544, 544]
    - [100, 7.923]
  - - [64, 2048, 1, 1024, 96, 96, 1056, 1056]
    - [99, 12.023]
  - - [64, 2048, 1, 2048, 96, 96, 2080, 2080]
    - [104, 16.001]
  - - [64, 2048, 1, 4096, 96, 96, 4128, 4128]
    - [83, 18.721]
  - - [64, 2048, 1, 8192, 96, 96, 8224, 8224]
    - [84, 21.572]
  - - [64, 4096, 1, 64, 96, 96, 96, 96]
    - [11, 2.606]
  - - [64, 4096, 1, 128, 96, 96, 160, 160]
    - [8, 4.832]
  - - [64, 4096, 1, 256, 96, 96, 288, 288]
    - [141, 8.513]
  - - [64, 4096, 1, 512, 96, 96, 544, 544]
    - [18, 13.366]
  - - [64, 4096, 1, 1024, 96, 96, 1056, 1056]
    - [130, 19.716]
  - - [64, 4096, 1, 2048, 96, 96, 2080, 2080]
    - [136, 25.322]
  - - [64, 4096, 1, 4096, 96, 96, 4128, 4128]
    - [112, 29.004]
  - - [64, 4096, 1, 8192, 96, 96, 8224, 8224]
    - [112, 32.14]
  - - [64, 8192, 1, 64, 96, 96, 96, 96]
    - [5, 4.952]
  - - [64, 8192, 1, 128, 96, 96, 160, 160]
    - [126, 9.023]
  - - [64, 8192, 1, 256, 96, 96, 288, 288]
    - [116, 15.174]
  - - [64, 8192, 1, 512, 96, 96, 544, 544]
    - [116, 23.127]
  - - [64, 8192, 1, 1024, 96, 96, 1056, 1056]
    - [125, 31.245]
  - - [64, 8192, 1, 2048, 96, 96, 2080, 2080]
    - [124, 37.656]
  - - [64, 8192, 1, 4096, 96, 96, 4128, 4128]
    - [136, 42.281]
  - - [64, 8192, 1, 8192, 96, 96, 8224, 8224]
    - [116, 28.285]
  - - [128, 64, 1, 64, 160, 160, 128, 96]
    - [3, 0.087]
  - - [128, 64, 1, 128, 160, 160, 160, 160]
    - [101, 0.166]
  - - [128, 64, 1, 256, 160, 160, 288, 288]
    - [105, 0.312]
  - - [128, 64, 1, 512, 160, 160, 544, 544]
    - [87, 0.551]
  - - [128, 64, 1, 1024, 160, 160, 1056, 1056]
    - [105, 0.888]
  - - [128, 64, 1, 2048, 160, 160, 2080, 2080]
    - [86, 1.285]
  - - [128, 64, 1, 4096, 160, 160, 4128, 4128]
    - [91, 1.638]
  - - [128, 64, 1, 8192, 160, 160, 8224, 8224]
    - [101, 1.906]
  - - [128, 128, 1, 64, 160, 160, 128, 96]
    - [93, 0.175]
  - - [128, 128, 1, 128, 160, 160, 160, 160]
    - [106, 0.34]
  - - [128, 128, 1, 256, 160, 160, 288, 288]
    - [92, 0.632]
  - - [128, 128, 1, 512, 160, 160, 544, 544]
    - [108, 1.115]
  - - [128, 128, 1, 1024, 160, 160, 1056, 1056]
    - [86, 1.802]
  - - [128, 128, 1, 2048, 160, 160, 2080, 2080]
    - [85, 2.58]
  - - [128, 128, 1, 4096, 160, 160, 4128, 4128]
    - [91, 3.304]
  - - [128, 128, 1, 8192, 160, 160, 8224, 8224]
    - [86, 3.836]
  - - [128, 256, 1, 64, 160, 160, 128, 96]
    - [90, 0.35]
  - - [128, 256, 1, 128, 160, 160, 160, 160]
    - [91, 0.682]
  - - [128, 256, 1, 256, 160, 160, 288, 288]
    - [101, 1.265]
  - - [128, 256, 1, 512, 160, 160, 544, 544]
    - [91, 2.235]
  - - [128, 256, 1, 1024, 160, 160, 1056, 1056]
    - [96, 3.63]
  - - [128, 256, 1, 2048, 160, 160, 2080, 2080]
    - [96, 5.206]
  - - [128, 256, 1, 4096, 160, 160, 4128, 4128]
    - [91, 6.616]
  - - [128, 256, 1, 8192, 160, 160, 8224, 8224]
    - [105, 7.621]
  - - [128, 512, 1, 64, 160, 160, 128, 96]
    - [89, 0.699]
  - - [128, 512, 1, 128, 160, 160, 160, 160]
    - [106, 1.345]
  - - [128, 512, 1, 256, 160, 160, 288, 288]
    - [96, 2.496]
  - - [128, 512, 1, 512, 160, 160, 544, 544]
    - [102, 4.319]
  - - [128, 512, 1, 1024, 160, 160, 1056, 1056]
    - [97, 6.797]
  - - [128, 512, 1, 2048, 160, 160, 2080, 2080]
    - [101, 9.592]
  - - [128, 512, 1, 4096, 160, 160, 4128, 4128]
    - [92, 12.028]
  - - [128, 512, 1, 8192, 160, 160, 8224, 8224]
    - [86, 13.499]
  - - [128, 1024, 1, 64, 160, 160, 128, 96]
    - [89, 1.374]
  - - [128, 1024, 1, 128, 160, 160, 160, 160]
    - [94, 2.582]
  - - [128, 1024, 1, 256, 160, 160, 288, 288]
    - [99, 4.684]
  - - [128, 1024, 1, 512, 160, 160, 544, 544]
    - [107, 7.94]
  - - [128, 1024, 1, 1024, 160, 160, 1056, 1056]
    - [95, 11.996]
  - - [128, 1024, 1, 2048, 160, 160, 2080, 2080]
    - [84, 16.184]
  - - [128, 1024, 1, 4096, 160, 160, 4128, 4128]
    - [99, 18.738]
  - - [128, 1024, 1, 8192, 160, 160, 8224, 8224]
    - [83, 21.765]
  - - [128, 2048, 1, 64, 160, 160, 128, 96]
    - [120, 2.614]
  - - [128, 2048, 1, 128, 160, 160, 160, 160]
    - [123, 4.863]
  - - [128, 2048, 1, 256, 160, 160, 288, 288]
    - [112, 8.556]
  - - [128, 2048, 1, 512, 160, 160, 544, 544]
    - [112, 13.833]
  - - [128, 2048, 1, 1024, 160, 160, 1056, 1056]
    - [130, 19.997]
  - - [128, 2048, 1, 2048, 160, 160, 2080, 2080]
    - [111, 25.67]
  - - [128, 2048, 1, 4096, 160, 160, 4128, 4128]
    - [136, 29.579]
  - - [128, 2048, 1, 8192, 160, 160, 8224, 8224]
    - [130, 32.536]
  - - [128, 4096, 1, 64, 160, 160, 128, 96]
    - [9, 4.993]
  - - [128, 4096, 1, 128, 160, 160, 160, 160]
    - [143, 9.158]
  - - [128, 4096, 1, 256, 160, 160, 288, 288]
    - [119, 15.419]
  - - [128, 4096, 1, 512, 160, 160, 544, 544]
    - [123, 23.42]
  - - [128, 4096, 1, 1024, 160, 160, 1056, 1056]
    - [112, 31.795]
  - - [128, 4096, 1, 2048, 160, 160, 2080, 2080]
    - [112, 38.343]
  - - [128, 4096, 1, 4096, 160, 160, 4128, 4128]
    - [128, 42.942]
  - - [128, 4096, 1, 8192, 160, 160, 8224, 8224]
    - [129, 44.452]
  - - [128, 8192, 1, 64, 160, 160, 128, 96]
    - [7, 8.736]
  - - [128, 8192, 1, 128, 160, 160, 160, 160]
    - [121, 14.961]
  - - [128, 8192, 1, 256, 160, 160, 288, 288]
    - [32, 23.509]
  - - [128, 8192, 1, 512, 160, 160, 544, 544]
    - [31, 34.276]
  - - [128, 8192, 1, 1024, 160, 160, 1056, 1056]
    - [45, 42.48]
  - - [128, 8192, 1, 2048, 160, 160, 2080, 2080]
    - [60, 50.542]
  - - [128, 8192, 1, 4096, 160, 160, 4128, 4128]
    - [70, 53.008]
  - - [128, 8192, 1, 8192, 160, 160, 8224, 8224]
    - [138, 45.292]
  - - [256, 64, 1, 64, 288, 288, 256, 96]
    - [4, 0.178]
  - - [256, 64, 1, 128, 288, 288, 256, 160]
    - [93, 0.338]
  - - [256, 64, 1, 256, 288, 288, 288, 288]
    - [96, 0.634]
  - - [256, 64, 1, 512, 288, 288, 544, 544]
    - [106, 1.11]
  - - [256, 64, 1, 1024, 288, 288, 1056, 1056]
    - [86, 1.797]
  - - [256, 64, 1, 2048, 288, 288, 2080, 2080]
    - [101, 2.582]
  - - [256, 64, 1, 4096, 288, 288, 4128, 4128]
    - [105, 3.309]
  - - [256, 64, 1, 8192, 288, 288, 8224, 8224]
    - [96, 3.814]
  - - [256, 128, 1, 64, 288, 288, 256, 96]
    - [100, 0.353]
  - - [256, 128, 1, 128, 288, 288, 256, 160]
    - [106, 0.679]
  - - [256, 128, 1, 256, 288, 288, 288, 288]
    - [97, 1.26]
  - - [256, 128, 1, 512, 288, 288, 544, 544]
    - [108, 2.236]
  - - [256, 128, 1, 1024, 288, 288, 1056, 1056]
    - [102, 3.604]
  - - [256, 128, 1, 2048, 288, 288, 2080, 2080]
    - [91, 5.191]
  - - [256, 128, 1, 4096, 288, 288, 4128, 4128]
    - [91, 6.599]
  - - [256, 128, 1, 8192, 288, 288, 8224, 8224]
    - [101, 7.534]
  - - [256, 256, 1, 64, 288, 288, 256, 96]
    - [87, 0.698]
  - - [256, 256, 1, 128, 288, 288, 256, 160]
    - [105, 1.343]
  - - [256, 256, 1, 256, 288, 288, 288, 288]
    - [139, 2.25]
  - - [256, 256, 1, 512, 288, 288, 544, 544]
    - [86, 4.331]
  - - [256, 256, 1, 1024, 288, 288, 1056, 1056]
    - [102, 6.831]
  - - [256, 256, 1, 2048, 288, 288, 2080, 2080]
    - [87, 9.589]
  - - [256, 256, 1, 4096, 288, 288, 4128, 4128]
    - [102, 12.013]
  - - [256, 256, 1, 8192, 288, 288, 8224, 8224]
    - [97, 13.474]
  - - [256, 512, 1, 64, 288, 288, 256, 96]
    - [83, 1.362]
  - - [256, 512, 1, 128, 288, 288, 256, 160]
    - [102, 2.58]
  - - [256, 512, 1, 256, 288, 288, 288, 288]
    - [99, 4.717]
  - - [256, 512, 1, 512, 288, 288, 544, 544]
    - [88, 7.907]
  - - [256, 512, 1, 1024, 288, 288, 1056, 1056]
    - [84, 11.984]
  - - [256, 512, 1, 2048, 288, 288, 2080, 2080]
    - [83, 16.207]
  - - [256, 512, 1, 4096, 288, 288, 4128, 4128]
    - [82, 19.477]
  - - [256, 512, 1, 8192, 288, 288, 8224, 8224]
    - [84, 21.631]
  - - [256, 1024, 1, 64, 288, 288, 256, 96]
    - [15, 2.614]
  - - [256, 1024, 1, 128, 288, 288, 256, 160]
    - [121, 4.877]
  - - [256, 1024, 1, 256, 288, 288, 288, 288]
    - [128, 8.644]
  - - [256, 1024, 1, 512, 288, 288, 544, 544]
    - [128, 13.943]
  - - [256, 1024, 1, 1024, 288, 288, 1056, 1056]
    - [130, 20.344]
  - - [256, 1024, 1, 2048, 288, 288, 2080, 2080]
    - [130, 26.312]
  - - [256, 1024, 1, 4096, 288, 288, 4128, 4128]
    - [128, 30.534]
  - - [256, 1024, 1, 8192, 288, 288, 8224, 8224]
    - [127, 33.339]
  - - [256, 2048, 1, 64, 288, 288, 256, 96]
    - [14, 5.038]
  - - [256, 2048, 1, 128, 288, 288, 256, 160]
    - [13, 9.119]
  - - [256, 2048, 1, 256, 288, 288, 288, 288]
    - [119, 15.49]
  - - [256, 2048, 1, 512, 288, 288, 544, 544]
    - [19, 23.584]
  - - [256, 2048, 1, 1024, 288, 288, 1056, 1056]
    - [112, 31.874]
  - - [256, 2048, 1, 2048, 288, 288, 2080, 2080]
    - [12, 37.874]
  - - [256, 2048, 1, 4096, 288, 288, 4128, 4128]
    - [110, 43.306]
  - - [256, 2048, 1, 8192, 288, 288, 8224, 8224]
    - [16, 44.419]
  - - [256, 4096, 1, 64, 288, 288, 256, 96]
    - [10, 8.707]
  - - [256, 4096, 1, 128, 288, 288, 256, 160]
    - [32, 14.945]
  - - [256, 4096, 1, 256, 288, 288, 288, 288]
    - [29, 23.704]
  - - [256, 4096, 1, 512, 288, 288, 544, 544]
    - [30, 33.561]
  - - [256, 4096, 1, 1024, 288, 288, 1056, 1056]
    - [38, 42.544]
  - - [256, 4096, 1, 2048, 288, 288, 2080, 2080]
    - [30, 49.775]
  - - [256, 4096, 1, 4096, 288, 288, 4128, 4128]
    - [78, 52.383]
  - - [256, 4096, 1, 8192, 288, 288, 8224, 8224]
    - [77, 56.152]
  - - [256, 8192, 1, 64, 288, 288, 256, 96]
    - [40, 14.64]
  - - [256, 8192, 1, 128, 288, 288, 256, 160]
    - [28, 24.095]
  - - [256, 8192, 1, 256, 288, 288, 288, 288]
    - [36, 37.111]
  - - [256, 8192, 1, 512, 288, 288, 544, 544]
    - [63, 48.605]
  - - [256, 8192, 1, 1024, 288, 288, 1056, 1056]
    - [36, 57.927]
  - - [256, 8192, 1, 2048, 288, 288, 2080, 2080]
    - [57, 59.183]
  - - [256, 8192, 1, 4096, 288, 288, 4128, 4128]
    - [35, 64.684]
  - - [256, 8192, 1, 8192, 288, 288, 8224, 8224]
    - [72, 60.524]
  - - [384, 64, 1, 64, 416, 416, 384, 96]
    - [0, 0.259]
  - - [384, 64, 1, 128, 416, 416, 384, 160]
    - [91, 0.509]
  - - [384, 64, 1, 256, 416, 416, 384, 288]
    - [96, 0.965]
  - - [384, 64, 1, 512, 416, 416, 544, 544]
    - [87, 1.679]
  - - [384, 64, 1, 1024, 416, 416, 1056, 1056]
    - [86, 2.711]
  - - [384, 64, 1, 2048, 416, 416, 2080, 2080]
    - [108, 3.882]
  - - [384, 64, 1, 4096, 416, 416, 4128, 4128]
    - [91, 4.96]
  - - [384, 64, 1, 8192, 416, 416, 8224, 8224]
    - [108, 5.745]
  - - [384, 128, 1, 64, 416, 416, 384, 96]
    - [98, 0.531]
  - - [384, 128, 1, 128, 416, 416, 384, 160]
    - [2, 0.984]
  - - [384, 128, 1, 256, 416, 416, 384, 288]
    - [86, 1.923]
  - - [384, 128, 1, 512, 416, 416, 544, 544]
    - [106, 3.339]
  - - [384, 128, 1, 1024, 416, 416, 1056, 1056]
    - [90, 4.339]
  - - [384, 128, 1, 2048, 416, 416, 2080, 2080]
    - [91, 7.763]
  - - [384, 128, 1, 4096, 416, 416, 4128, 4128]
    - [96, 9.932]
  - - [384, 128, 1, 8192, 416, 416, 8224, 8224]
    - [91, 11.489]
  - - [384, 256, 1, 64, 416, 416, 384, 96]
    - [102, 1.045]
  - - [384, 256, 1, 128, 416, 416, 384, 160]
    - [103, 2.0]
  - - [384, 256, 1, 256, 416, 416, 384, 288]
    - [101, 3.697]
  - - [384, 256, 1, 512, 416, 416, 544, 544]
    - [87, 6.425]
  - - [384, 256, 1, 1024, 416, 416, 1056, 1056]
    - [86, 10.188]
  - - [384, 256, 1, 2048, 416, 416, 2080, 2080]
    - [87, 14.26]
  - - [384, 256, 1, 4096, 416, 416, 4128, 4128]
    - [97, 17.833]
  - - [384, 256, 1, 8192, 416, 416, 8224, 8224]
    - [92, 20.157]
  - - [384, 512, 1, 64, 416, 416, 384, 96]
    - [130, 2.036]
  - - [384, 512, 1, 128, 416, 416, 384, 160]
    - [133, 3.819]
  - - [384, 512, 1, 256, 416, 416, 384, 288]
    - [116, 6.815]
  - - [384, 512, 1, 512, 416, 416, 544, 544]
    - [131, 11.217]
  - - [384, 512, 1, 1024, 416, 416, 1056, 1056]
    - [116, 16.644]
  - - [384, 512, 1, 2048, 416, 416, 2080, 2080]
    - [116, 21.951]
  - - [384, 512, 1, 4096, 416, 416, 4128, 4128]
    - [113, 25.378]
  - - [384, 512, 1, 8192, 416, 416, 8224, 8224]
    - [133, 28.413]
  - - [384, 1024, 1, 64, 416, 416, 384, 96]
    - [8, 3.937]
  - - [384, 1024, 1, 128, 416, 416, 384, 160]
    - [8, 7.212]
  - - [384, 1024, 1, 256, 416, 416, 384, 288]
    - [110, 12.795]
  - - [384, 1024, 1, 512, 416, 416, 544, 544]
    - [130, 20.776]
  - - [384, 1024, 1, 1024, 416, 416, 1056, 1056]
    - [110, 29.946]
  - - [384, 1024, 1, 2048, 416, 416, 2080, 2080]
    - [128, 38.707]
  - - [384, 1024, 1, 4096, 416, 416, 4128, 4128]
    - [127, 43.838]
  - - [384, 1024, 1, 8192, 416, 416, 8224, 8224]
    - [128, 49.282]
  - - [384, 2048, 1, 64, 416, 416, 384, 96]
    - [130, 7.104]
  - - [384, 2048, 1, 128, 416, 416, 384, 160]
    - [112, 12.648]
  - - [384, 2048, 1, 256, 416, 416, 384, 288]
    - [135, 20.749]
  - - [384, 2048, 1, 512, 416, 416, 544, 544]
    - [119, 30.35]
  - - [384, 2048, 1, 1024, 416, 416, 1056, 1056]
    - [117, 39.526]
  - - [384, 2048, 1, 2048, 416, 416, 2080, 2080]
    - [126, 46.179]
  - - [384, 2048, 1, 4096, 416, 416, 4128, 4128]
    - [134, 50.758]
  - - [384, 2048, 1, 8192, 416, 416, 8224, 8224]
    - [119, 51.408]
  - - [384, 4096, 1, 64, 416, 416, 384, 96]
    - [61, 11.98]
  - - [384, 4096, 1, 128, 416, 416, 384, 160]
    - [33, 21.107]
  - - [384, 4096, 1, 256, 416, 416, 384, 288]
    - [54, 33.563]
  - - [384, 4096, 1, 512, 416, 416, 544, 544]
    - [51, 48.778]
  - - [384, 4096, 1, 1024, 416, 416, 1056, 1056]
    - [51, 63.034]
  - - [384, 4096, 1, 2048, 416, 416, 2080, 2080]
    - [21, 72.475]
  - - [384, 4096, 1, 4096, 416, 416, 4128, 4128]
    - [51, 76.84]
  - - [384, 4096, 1, 8192, 416, 416, 8224, 8224]
    - [73, 80.309]
  - - [384, 8192, 1, 64, 416, 416, 384, 96]
    - [47, 19.285]
  - - [384, 8192, 1, 128, 416, 416, 384, 160]
    - [40, 32.323]
  - - [384, 8192, 1, 256, 416, 416, 384, 288]
    - [68, 47.197]
  - - [384, 8192, 1, 512, 416, 416, 544, 544]
    - [40, 60.858]
  - - [384, 8192, 1, 1024, 416, 416, 1056, 1056]
    - [40, 69.938]
  - - [384, 8192, 1, 2048, 416, 416, 2080, 2080]
    - [68, 75.132]
  - - [384, 8192, 1, 4096, 416, 416, 4128, 4128]
    - [52, 79.142]
  - - [384, 8192, 1, 8192, 416, 416, 8224, 8224]
    - [66, 63.291]
  - - [768, 64, 1, 64, 800, 800, 768, 96]
    - [1, 0.528]
  - - [768, 64, 1, 128, 800, 800, 768, 160]
    - [91, 1.015]
  - - [768, 64, 1, 256, 800, 800, 768, 288]
    - [92, 1.916]
  - - [768, 64, 1, 512, 800, 800, 768, 544]
    - [106, 3.349]
  - - [768, 64, 1, 1024, 800, 800, 1056, 1056]
    - [86, 5.403]
  - - [768, 64, 1, 2048, 800, 800, 2080, 2080]
    - [92, 7.648]
  - - [768, 64, 1, 4096, 800, 800, 4128, 4128]
    - [105, 9.821]
  - - [768, 64, 1, 8192, 800, 800, 8224, 8224]
    - [96, 11.114]
  - - [768, 128, 1, 64, 800, 800, 768, 96]
    - [91, 1.044]
  - - [768, 128, 1, 128, 800, 800, 768, 160]
    - [109, 2.015]
  - - [768, 128, 1, 256, 800, 800, 768, 288]
    - [86, 3.716]
  - - [768, 128, 1, 512, 800, 800, 768, 544]
    - [109, 6.414]
  - - [768, 128, 1, 1024, 800, 800, 1056, 1056]
    - [109, 10.182]
  - - [768, 128, 1, 2048, 800, 800, 2080, 2080]
    - [86, 14.271]
  - - [768, 128, 1, 4096, 800, 800, 4128, 4128]
    - [106, 17.815]
  - - [768, 128, 1, 8192, 800, 800, 8224, 8224]
    - [102, 20.112]
  - - [768, 256, 1, 64, 800, 800, 768, 96]
    - [121, 2.036]
  - - [768, 256, 1, 128, 800, 800, 768, 160]
    - [131, 3.793]
  - - [768, 256, 1, 256, 800, 800, 768, 288]
    - [115, 6.764]
  - - [768, 256, 1, 512, 800, 800, 768, 544]
    - [133, 11.33]
  - - [768, 256, 1, 1024, 800, 800, 1056, 1056]
    - [139, 16.598]
  - - [768, 256, 1, 2048, 800, 800, 2080, 2080]
    - [121, 21.947]
  - - [768, 256, 1, 4096, 800, 800, 4128, 4128]
    - [125, 25.395]
  - - [768, 256, 1, 8192, 800, 800, 8224, 8224]
    - [139, 28.386]
  - - [768, 512, 1, 64, 800, 800, 768, 96]
    - [8, 3.908]
  - - [768, 512, 1, 128, 800, 800, 768, 160]
    - [8, 7.213]
  - - [768, 512, 1, 256, 800, 800, 768, 288]
    - [130, 12.892]
  - - [768, 512, 1, 512, 800, 800, 768, 544]
    - [130, 20.759]
  - - [768, 512, 1, 1024, 800, 800, 1056, 1056]
    - [130, 29.794]
  - - [768, 512, 1, 2048, 800, 800, 2080, 2080]
    - [128, 38.266]
  - - [768, 512, 1, 4096, 800, 800, 4128, 4128]
    - [130, 43.367]
  - - [768, 512, 1, 8192, 800, 800, 8224, 8224]
    - [130, 48.734]
  - - [768, 1024, 1, 64, 800, 800, 768, 96]
    - [121, 7.154]
  - - [768, 1024, 1, 128, 800, 800, 768, 160]
    - [130, 12.733]
  - - [768, 1024, 1, 256, 800, 800, 768, 288]
    - [13, 20.752]
  - - [768, 1024, 1, 512, 800, 800, 768, 544]
    - [119, 30.343]
  - - [768, 1024, 1, 1024, 800, 800, 1056, 1056]
    - [135, 39.372]
  - - [768, 1024, 1, 2048, 800, 800, 2080, 2080]
    - [132, 45.375]
  - - [768, 1024, 1, 4096, 800, 800, 4128, 4128]
    - [135, 50.485]
  - - [768, 1024, 1, 8192, 800, 800, 8224, 8224]
    - [144, 51.729]
  - - [768, 2048, 1, 64, 800, 800, 768, 96]
    - [47, 11.937]
  - - [768, 2048, 1, 128, 800, 800, 768, 160]
    - [79, 21.061]
  - - [768, 2048, 1, 256, 800, 800, 768, 288]
    - [40, 34.117]
  - - [768, 2048, 1, 512, 800, 800, 768, 544]
    - [28, 49.991]
  - - [768, 2048, 1, 1024, 800, 800, 1056, 1056]
    - [28, 64.481]
  - - [768, 2048, 1, 2048, 800, 800, 2080, 2080]
    - [28, 75.317]
  - - [768, 2048, 1, 4096, 800, 800, 4128, 4128]
    - [28, 79.072]
  - - [768, 2048, 1, 8192, 800, 800, 8224, 8224]
    - [21, 84.156]
  - - [768, 4096, 1, 64, 800, 800, 768, 96]
    - [28, 19.265]
  - - [768, 4096, 1, 128, 800, 800, 768, 160]
    - [48, 32.369]
  - - [768, 4096, 1, 256, 800, 800, 768, 288]
    - [39, 46.816]
  - - [768, 4096, 1, 512, 800, 800, 768, 544]
    - [68, 62.252]
  - - [768, 4096, 1, 1024, 800, 800, 1056, 1056]
    - [67, 70.855]
  - - [768, 4096, 1, 2048, 800, 800, 2080, 2080]
    - [68, 75.588]
  - - [768, 4096, 1, 4096, 800, 800, 4128, 4128]
    - [46, 78.99]
  - - [768, 4096, 1, 8192, 800, 800, 8224, 8224]
    - [69, 61.115]
  - - [768, 8192, 1, 64, 800, 800, 768, 96]
    - [42, 28.926]
  - - [768, 8192, 1, 128, 800, 800, 768, 160]
    - [57, 40.645]
  - - [768, 8192, 1, 256, 800, 800, 768, 288]
    - [28, 55.346]
  - - [768, 8192, 1, 512, 800, 800, 768, 544]
    - [28, 68.35]
  - - [768, 8192, 1, 1024, 800, 800, 1056, 1056]
    - [54, 72.045]
  - - [768, 8192, 1, 2048, 800, 800, 2080, 2080]
    - [55, 78.924]
  - - [768, 8192, 1, 4096, 800, 800, 4128, 4128]
    - [50, 65.326]
  - - [768, 8192, 1, 8192, 800, 800, 8224, 8224]
    - [65, 63.241]
  - - [1536, 64, 1, 64, 1568, 1568, 1536, 96]
    - [109, 1.001]
  - - [1536, 64, 1, 128, 1568, 1568, 1536, 160]
    - [87, 1.985]
  - - [1536, 64, 1, 256, 1568, 1568, 1536, 288]
    - [101, 3.715]
  - - [1536, 64, 1, 512, 1568, 1568, 1536, 544]
    - [101, 6.429]
  - - [1536, 64, 1, 1024, 1568, 1568, 1536, 1056]
    - [96, 10.118]
  - - [1536, 64, 1, 2048, 1568, 1568, 2080, 2080]
    - [109, 14.236]
  - - [1536, 64, 1, 4096, 1568, 1568, 4128, 4128]
    - [87, 17.852]
  - - [1536, 64, 1, 8192, 1568, 1568, 8224, 8224]
    - [86, 20.146]
  - - [1536, 128, 1, 64, 1568, 1568, 1536, 96]
    - [130, 2.04]
  - - [1536, 128, 1, 128, 1568, 1568, 1536, 160]
    - [133, 3.81]
  - - [1536, 128, 1, 256, 1568, 1568, 1536, 288]
    - [116, 6.792]
  - - [1536, 128, 1, 512, 1568, 1568, 1536, 544]
    - [143, 11.181]
  - - [1536, 128, 1, 1024, 1568, 1568, 1536, 1056]
    - [114, 16.697]
  - - [1536, 128, 1, 2048, 1568, 1568, 2080, 2080]
    - [116, 22.004]
  - - [1536, 128, 1, 4096, 1568, 1568, 4128, 4128]
    - [115, 25.59]
  - - [1536, 128, 1, 8192, 1568, 1568, 8224, 8224]
    - [116, 28.589]
  - - [1536, 256, 1, 64, 1568, 1568, 1536, 96]
    - [8, 3.904]
  - - [1536, 256, 1, 128, 1568, 1568, 1536, 160]
    - [130, 7.3]
  - - [1536, 256, 1, 256, 1568, 1568, 1536, 288]
    - [112, 12.735]
  - - [1536, 256, 1, 512, 1568, 1568, 1536, 544]
    - [112, 20.644]
  - - [1536, 256, 1, 1024, 1568, 1568, 1536, 1056]
    - [130, 29.784]
  - - [1536, 256, 1, 2048, 1568, 1568, 2080, 2080]
    - [111, 38.188]
  - - [1536, 256, 1, 4096, 1568, 1568, 4128, 4128]
    - [130, 43.289]
  - - [1536, 256, 1, 8192, 1568, 1568, 8224, 8224]
    - [129, 48.504]
  - - [1536, 512, 1, 64, 1568, 1568, 1536, 96]
    - [6, 7.146]
  - - [1536, 512, 1, 128, 1568, 1568, 1536, 160]
    - [13, 12.707]
  - - [1536, 512, 1, 256, 1568, 1568, 1536, 288]
    - [119, 20.804]
  - - [1536, 512, 1, 512, 1568, 1568, 1536, 544]
    - [119, 30.285]
  - - [1536, 512, 1, 1024, 1568, 1568, 1536, 1056]
    - [135, 39.378]
  - - [1536, 512, 1, 2048, 1568, 1568, 2080, 2080]
    - [144, 45.927]
  - - [1536, 512, 1, 4096, 1568, 1568, 4128, 4128]
    - [118, 50.576]
  - - [1536, 512, 1, 8192, 1568, 1568, 8224, 8224]
    - [135, 51.668]
  - - [1536, 1024, 1, 64, 1568, 1568, 1536, 96]
    - [28, 11.792]
  - - [1536, 1024, 1, 128, 1568, 1568, 1536, 160]
    - [47, 20.824]
  - - [1536, 1024, 1, 256, 1568, 1568, 1536, 288]
    - [37, 33.536]
  - - [1536, 1024, 1, 512, 1568, 1568, 1536, 544]
    - [40, 49.264]
  - - [1536, 1024, 1, 1024, 1568, 1568, 1536, 1056]
    - [40, 63.793]
  - - [1536, 1024, 1, 2048, 1568, 1568, 2080, 2080]
    - [28, 75.199]
  - - [1536, 1024, 1, 4096, 1568, 1568, 4128, 4128]
    - [28, 79.525]
  - - [1536, 1024, 1, 8192, 1568, 1568, 8224, 8224]
    - [28, 85.816]
  - - [1536, 2048, 1, 64, 1568, 1568, 1536, 96]
    - [40, 20.897]
  - - [1536, 2048, 1, 128, 1568, 1568, 1536, 160]
    - [68, 33.702]
  - - [1536, 2048, 1, 256, 1568, 1568, 1536, 288]
    - [81, 47.97]
  - - [1536, 2048, 1, 512, 1568, 1568, 1536, 544]
    - [40, 61.343]
  - - [1536, 2048, 1, 1024, 1568, 1568, 1536, 1056]
    - [40, 72.847]
  - - [1536, 2048, 1, 2048, 1568, 1568, 2080, 2080]
    - [40, 75.904]
  - - [1536, 2048, 1, 4096, 1568, 1568, 4128, 4128]
    - [53, 78.992]
  - - [1536, 2048, 1, 8192, 1568, 1568, 8224, 8224]
    - [52, 71.544]
  - - [1536, 4096, 1, 64, 1568, 1568, 1536, 96]
    - [62, 30.032]
  - - [1536, 4096, 1, 128, 1568, 1568, 1536, 160]
    - [80, 42.744]
  - - [1536, 4096, 1, 256, 1568, 1568, 1536, 288]
    - [28, 55.734]
  - - [1536, 4096, 1, 512, 1568, 1568, 1536, 544]
    - [57, 69.014]
  - - [1536, 4096, 1, 1024, 1568, 1568, 1536, 1056]
    - [57, 74.789]
  - - [1536, 4096, 1, 2048, 1568, 1568, 2080, 2080]
    - [24, 79.895]
  - - [1536, 4096, 1, 4096, 1568, 1568, 4128, 4128]
    - [64, 72.759]
  - - [1536, 4096, 1, 8192, 1568, 1568, 8224, 8224]
    - [52, 66.061]
  - - [1536, 8192, 1, 64, 1568, 1568, 1536, 96]
    - [68, 39.678]
  - - [1536, 8192, 1, 128, 1568, 1568, 1536, 160]
    - [76, 52.84]
  - - [1536, 8192, 1, 256, 1568, 1568, 1536, 288]
    - [28, 66.739]
  - - [1536, 8192, 1, 512, 1568, 1568, 1536, 544]
    - [28, 74.673]
  - - [1536, 8192, 1, 1024, 1568, 1568, 1536, 1056]
    - [66, 75.203]
  - - [1536, 8192, 1, 2048, 1568, 1568, 2080, 2080]
    - [54, 70.788]
  - - [1536, 8192, 1, 4096, 1568, 1568, 4128, 4128]
    - [26, 68.183]
  - - [1536, 8192, 1, 8192, 1568, 1568, 8224, 8224]
    - [52, 66.845]
  - - [3072, 64, 1, 64, 3104, 3104, 3072, 96]
    - [100, 1.921]
  - - [3072, 64, 1, 128, 3104, 3104, 3072, 160]
    - [131, 3.795]
  - - [3072, 64, 1, 256, 3104, 3104, 3072, 288]
    - [143, 6.812]
  - - [3072, 64, 1, 512, 3104, 3104, 3072, 544]
    - [133, 11.285]
  - - [3072, 64, 1, 1024, 3104, 3104, 3072, 1056]
    - [143, 16.644]
  - - [3072, 64, 1, 2048, 3104, 3104, 3072, 2080]
    - [133, 22.068]
  - - [3072, 64, 1, 4096, 3104, 3104, 4128, 4128]
    - [133, 25.446]
  - - [3072, 64, 1, 8192, 3104, 3104, 8224, 8224]
    - [115, 28.534]
  - - [3072, 128, 1, 64, 3104, 3104, 3072, 96]
    - [10, 3.916]
  - - [3072, 128, 1, 128, 3104, 3104, 3072, 160]
    - [128, 7.25]
  - - [3072, 128, 1, 256, 3104, 3104, 3072, 288]
    - [133, 12.787]
  - - [3072, 128, 1, 512, 3104, 3104, 3072, 544]
    - [112, 20.533]
  - - [3072, 128, 1, 1024, 3104, 3104, 3072, 1056]
    - [112, 29.453]
  - - [3072, 128, 1, 2048, 3104, 3104, 3072, 2080]
    - [112, 37.609]
  - - [3072, 128, 1, 4096, 3104, 3104, 4128, 4128]
    - [112, 42.285]
  - - [3072, 128, 1, 8192, 3104, 3104, 8224, 8224]
    - [130, 43.633]
  - - [3072, 256, 1, 64, 3104, 3104, 3072, 96]
    - [17, 7.099]
  - - [3072, 256, 1, 128, 3104, 3104, 3072, 160]
    - [135, 12.661]
  - - [3072, 256, 1, 256, 3104, 3104, 3072, 288]
    - [135, 20.698]
  - - [3072, 256, 1, 512, 3104, 3104, 3072, 544]
    - [119, 30.259]
  - - [3072, 256, 1, 1024, 3104, 3104, 3072, 1056]
    - [135, 39.393]
  - - [3072, 256, 1, 2048, 3104, 3104, 3072, 2080]
    - [118, 45.992]
  - - [3072, 256, 1, 4096, 3104, 3104, 4128, 4128]
    - [122, 50.091]
  - - [3072, 256, 1, 8192, 3104, 3104, 8224, 8224]
    - [126, 51.421]
  - - [3072, 512, 1, 64, 3104, 3104, 3072, 96]
    - [76, 11.708]
  - - [3072, 512, 1, 128, 3104, 3104, 3072, 160]
    - [76, 20.776]
  - - [3072, 512, 1, 256, 3104, 3104, 3072, 288]
    - [57, 33.345]
  - - [3072, 512, 1, 512, 3104, 3104, 3072, 544]
    - [28, 48.683]
  - - [3072, 512, 1, 1024, 3104, 3104, 3072, 1056]
    - [28, 61.366]
  - - [3072, 512, 1, 2048, 3104, 3104, 3072, 2080]
    - [56, 70.393]
  - - [3072, 512, 1, 4096, 3104, 3104, 4128, 4128]
    - [28, 76.5]
  - - [3072, 512, 1, 8192, 3104, 3104, 8224, 8224]
    - [47, 79.244]
  - - [3072, 1024, 1, 64, 3104, 3104, 3072, 96]
    - [54, 19.315]
  - - [3072, 1024, 1, 128, 3104, 3104, 3072, 160]
    - [40, 33.496]
  - - [3072, 1024, 1, 256, 3104, 3104, 3072, 288]
    - [36, 47.505]
  - - [3072, 1024, 1, 512, 3104, 3104, 3072, 544]
    - [49, 61.235]
  - - [3072, 1024, 1, 1024, 3104, 3104, 3072, 1056]
    - [57, 71.608]
  - - [3072, 1024, 1, 2048, 3104, 3104, 3072, 2080]
    - [68, 74.857]
  - - [3072, 1024, 1, 4096, 3104, 3104, 4128, 4128]
    - [57, 80.156]
  - - [3072, 1024, 1, 8192, 3104, 3104, 8224, 8224]
    - [22, 66.743]
  - - [3072, 2048, 1, 64, 3104, 3104, 3072, 96]
    - [34, 29.939]
  - - [3072, 2048, 1, 128, 3104, 3104, 3072, 160]
    - [48, 43.673]
  - - [3072, 2048, 1, 256, 3104, 3104, 3072, 288]
    - [76, 55.504]
  - - [3072, 2048, 1, 512, 3104, 3104, 3072, 544]
    - [28, 68.958]
  - - [3072, 2048, 1, 1024, 3104, 3104, 3072, 1056]
    - [28, 74.785]
  - - [3072, 2048, 1, 2048, 3104, 3104, 3072, 2080]
    - [28, 80.178]
  - - [3072, 2048, 1, 4096, 3104, 3104, 4128, 4128]
    - [26, 73.293]
  - - [3072, 2048, 1, 8192, 3104, 3104, 8224, 8224]
    - [40, 66.301]
  - - [3072, 4096, 1, 64, 3104, 3104, 3072, 96]
    - [28, 40.047]
  - - [3072, 4096, 1, 128, 3104, 3104, 3072, 160]
    - [76, 53.905]
  - - [3072, 4096, 1, 256, 3104, 3104, 3072, 288]
    - [76, 66.715]
  - - [3072, 4096, 1, 512, 3104, 3104, 3072, 544]
    - [27, 74.065]
  - - [3072, 4096, 1, 1024, 3104, 3104, 3072, 1056]
    - [25, 77.883]
  - - [3072, 4096, 1, 2048, 3104, 3104, 3072, 2080]
    - [22, 72.589]
  - - [3072, 4096, 1, 4096, 3104, 3104, 4128, 4128]
    - [76, 70.703]
  - - [3072, 4096, 1, 8192, 3104, 3104, 8224, 8224]
    - [27, 69.002]
  - - [3072, 8192, 1, 64, 3104, 3104, 3072, 96]
    - [49, 48.206]
  - - [3072, 8192, 1, 128, 3104, 3104, 3072, 160]
    - [57, 62.123]
  - - [3072, 8192, 1, 256, 3104, 3104, 3072, 288]
    - [57, 71.651]
  - - [3072, 8192, 1, 512, 3104, 3104, 3072, 544]
    - [35, 78.486]
  - - [3072, 8192, 1, 1024, 3104, 3104, 3072, 1056]
    - [40, 68.09]
  - - [3072, 8192, 1, 2048, 3104, 3104, 3072, 2080]
    - [76, 68.945]
  - - [3072, 8192, 1, 4096, 3104, 3104, 4128, 4128]
    - [57, 68.753]
  - - [3072, 8192, 1, 8192, 3104, 3104, 8224, 8224]
    - [27, 68.697]
  - - [6144, 64, 1, 64, 6176, 6176, 6144, 96]
    - [10, 3.695]
  - - [6144, 64, 1, 128, 6176, 6176, 6144, 160]
    - [20, 7.278]
  - - [6144, 64, 1, 256, 6176, 6176, 6144, 288]
    - [112, 12.831]
  - - [6144, 64, 1, 512, 6176, 6176, 6144, 544]
    - [137, 20.262]
  - - [6144, 64, 1, 1024, 6176, 6176, 6144, 1056]
    - [133, 29.234]
  - - [6144, 64, 1, 2048, 6176, 6176, 6144, 2080]
    - [116, 37.35]
  - - [6144, 64, 1, 4096, 6176, 6176, 6144, 4128]
    - [115, 42.113]
  - - [6144, 64, 1, 8192, 6176, 6176, 8224, 8224]
    - [131, 45.097]
  - - [6144, 128, 1, 64, 6176, 6176, 6144, 96]
    - [139, 7.047]
  - - [6144, 128, 1, 128, 6176, 6176, 6144, 160]
    - [7, 12.684]
  - - [6144, 128, 1, 256, 6176, 6176, 6144, 288]
    - [119, 20.583]
  - - [6144, 128, 1, 512, 6176, 6176, 6144, 544]
    - [140, 30.205]
  - - [6144, 128, 1, 1024, 6176, 6176, 6144, 1056]
    - [119, 39.498]
  - - [6144, 128, 1, 2048, 6176, 6176, 6144, 2080]
    - [126, 45.025]
  - - [6144, 128, 1, 4096, 6176, 6176, 6144, 4128]
    - [119, 50.16]
  - - [6144, 128, 1, 8192, 6176, 6176, 8224, 8224]
    - [142, 51.444]
  - - [6144, 256, 1, 64, 6176, 6176, 6144, 96]
    - [7, 12.296]
  - - [6144, 256, 1, 128, 6176, 6176, 6144, 160]
    - [76, 21.547]
  - - [6144, 256, 1, 256, 6176, 6176, 6144, 288]
    - [57, 34.039]
  - - [6144, 256, 1, 512, 6176, 6176, 6144, 544]
    - [40, 48.389]
  - - [6144, 256, 1, 1024, 6176, 6176, 6144, 1056]
    - [28, 61.205]
  - - [6144, 256, 1, 2048, 6176, 6176, 6144, 2080]
    - [60, 69.846]
  - - [6144, 256, 1, 4096, 6176, 6176, 6144, 4128]
    - [59, 73.068]
  - - [6144, 256, 1, 8192, 6176, 6176, 8224, 8224]
    - [58, 81.337]
  - - [6144, 512, 1, 64, 6176, 6176, 6144, 96]
    - [57, 20.579]
  - - [6144, 512, 1, 128, 6176, 6176, 6144, 160]
    - [40, 33.266]
  - - [6144, 512, 1, 256, 6176, 6176, 6144, 288]
    - [81, 47.72]
  - - [6144, 512, 1, 512, 6176, 6176, 6144, 544]
    - [63, 60.562]
  - - [6144, 512, 1, 1024, 6176, 6176, 6144, 1056]
    - [35, 70.709]
  - - [6144, 512, 1, 2048, 6176, 6176, 6144, 2080]
    - [57, 74.433]
  - - [6144, 512, 1, 4096, 6176, 6176, 6144, 4128]
    - [26, 79.515]
  - - [6144, 512, 1, 8192, 6176, 6176, 8224, 8224]
    - [43, 65.492]
  - - [6144, 1024, 1, 64, 6176, 6176, 6144, 96]
    - [34, 29.536]
  - - [6144, 1024, 1, 128, 6176, 6176, 6144, 160]
    - [71, 43.715]
  - - [6144, 1024, 1, 256, 6176, 6176, 6144, 288]
    - [63, 57.715]
  - - [6144, 1024, 1, 512, 6176, 6176, 6144, 544]
    - [57, 68.814]
  - - [6144, 1024, 1, 1024, 6176, 6176, 6144, 1056]
    - [28, 74.825]
  - - [6144, 1024, 1, 2048, 6176, 6176, 6144, 2080]
    - [53, 81.307]
  - - [6144, 1024, 1, 4096, 6176, 6176, 6144, 4128]
    - [23, 71.265]
  - - [6144, 1024, 1, 8192, 6176, 6176, 8224, 8224]
    - [57, 64.797]
  - - [6144, 2048, 1, 64, 6176, 6176, 6144, 96]
    - [48, 39.286]
  - - [6144, 2048, 1, 128, 6176, 6176, 6144, 160]
    - [67, 53.962]
  - - [6144, 2048, 1, 256, 6176, 6176, 6144, 288]
    - [28, 66.915]
  - - [6144, 2048, 1, 512, 6176, 6176, 6144, 544]
    - [46, 74.232]
  - - [6144, 2048, 1, 1024, 6176, 6176, 6144, 1056]
    - [28, 81.431]
  - - [6144, 2048, 1, 2048, 6176, 6176, 6144, 2080]
    - [75, 71.329]
  - - [6144, 2048, 1, 4096, 6176, 6176, 6144, 4128]
    - [53, 72.026]
  - - [6144, 2048, 1, 8192, 6176, 6176, 8224, 8224]
    - [57, 66.061]
  - - [6144, 4096, 1, 64, 6176, 6176, 6144, 96]
    - [41, 47.713]
  - - [6144, 4096, 1, 128, 6176, 6176, 6144, 160]
    - [57, 62.196]
  - - [6144, 4096, 1, 256, 6176, 6176, 6144, 288]
    - [76, 71.724]
  - - [6144, 4096, 1, 512, 6176, 6176, 6144, 544]
    - [53, 78.077]
  - - [6144, 4096, 1, 1024, 6176, 6176, 6144, 1056]
    - [22, 71.736]
  - - [6144, 4096, 1, 2048, 6176, 6176, 6144, 2080]
    - [27, 70.626]
  - - [6144, 4096, 1, 4096, 6176, 6176, 6144, 4128]
    - [74, 70.085]
  - - [6144, 4096, 1, 8192, 6176, 6176, 8224, 8224]
    - [54, 67.338]
  - - [6144, 8192, 1, 64, 6176, 6176, 6144, 96]
    - [44, 50.263]
  - - [6144, 8192, 1, 128, 6176, 6176, 6144, 160]
    - [57, 64.736]
  - - [6144, 8192, 1, 256, 6176, 6176, 6144, 288]
    - [27, 74.689]
  - - [6144, 8192, 1, 512, 6176, 6176, 6144, 544]
    - [50, 65.855]
  - - [6144, 8192, 1, 1024, 6176, 6176, 6144, 1056]
    - [23, 65.398]
  - - [6144, 8192, 1, 2048, 6176, 6176, 6144, 2080]
    - [56, 68.878]
  - - [6144, 8192, 1, 4096, 6176, 6176, 6144, 4128]
    - [26, 69.482]
  - - [6144, 8192, 1, 8192, 6176, 6176, 8224, 8224]
    - [68, 67.612]
- null
- null
- DeviceEfficiency
