library/src/blas3/Tensile/Logic/asm_full/navi31/navi31_Cijk_Alik_Bjlk_HB.yaml
- {MinimumRequiredVersion: 4.35.0}
- navi31
- gfx1100
- [Device 73bf]
    SolutionIndex: 0
    SolutionNameMin: Cijk_Alik_Bjlk_HB_MT32x32x16_MI16x16x16x1_SN_1LDSB1_AMAS0_GRVW2_IU1_NLCB1_SIA2_SU0_SUS0_SVW1_TT1_16_VW1_WGM4
    SolutionIndex: 1
    SolutionNameMin: Cijk_Alik_Bjlk_HB_MT32x32x16_MI16x16x16x1_SN_1LDSB1_AMAS0_GRVW8_IU1_NLCB1_SIA2_SU0_SUS0_SVW1_TT1_16_VW1_WGM4
    SolutionIndex: 2
    SolutionNameMin: Cijk_Alik_Bjlk_HB_MT32x32x16_MI16x16x16x1_SN_1LDSB1_AMAS0_GRVW4_IU1_NLCB1_SIA2_SU32_SUS256_SVW1_TT1_16_VW1_WGM4
    SolutionIndex: 3
    SolutionNameMin: Cijk_Alik_Bjlk_HB_MT32x32x16_MI16x16x16x1_SN_1LDSB1_AMAS0_GRVW8_IU1_NLCB1_SIA2_SU0_SUS0_SVW1_TT1_16_VW1_WGM8
    SolutionIndex: 4
    SolutionNameMin: Cijk_Alik_Bjlk_HB_MT32x32x16_MI16x16x16x1_SN_1LDSB1_AMAS0_GRVW4_IU1_NLCB1_SIA2_SU32_SUS128_SVW1_TT1_16_VW1_WGM8
    SolutionIndex: 5
    SolutionNameMin: Cijk_Alik_Bjlk_HB_MT64x64x16_MI16x16x16x1_SN_1LDSB0_AMAS0_GRVW4_IU1_NLCB1_SIA1_SU0_SUS0_SVW1_TT2_32_VW1_WGM4
    SolutionIndex: 6
    SolutionNameMin: Cijk_Alik_Bjlk_HB_MT64x64x16_MI16x16x16x1_SN_1LDSB0_AMAS3_GRVW4_IU1_NLCB1_SIA1_SU0_SUS0_SVW2_TT2_32_VW2_WGM4
    SolutionIndex: 7
    SolutionNameMin: Cijk_Alik_Bjlk_HB_MT64x64x16_MI16x16x16x1_SN_1LDSB1_AMAS3_GRVW4_IU1_NLCB1_SIA2_SU0_SUS0_SVW2_TT2_32_VW2_WGM4
    SolutionIndex: 8
    SolutionNameMin: Cijk_Alik_Bjlk_HB_MT64x64x16_MI16x16x16x1_SN_1LDSB1_AMAS3_GRVW8_IU1_NLCB1_SIA2_SU0_SUS0_SVW2_TT2_32_VW2_WGM4
    SolutionIndex: 9
    SolutionNameMin: Cijk_Alik_Bjlk_HB_MT64x64x16_MI16x16x16x1_SN_1LDSB1_AMAS3_GRVW4_IU1_NLCB1_SIA2_SU32_SUS128_SVW2_TT2_32_VW2_WGM4
    SolutionIndex: 10
    SolutionNameMin: Cijk_Alik_Bjlk_HB_MT64x64x16_MI16x16x16x1_SN_1LDSB1_AMAS3_GRVW8_IU1_NLCB1_SIA2_SU32_SUS128_SVW2_TT2_32_VW2_WGM4
    SolutionIndex: 11
    SolutionNameMin: Cijk_Alik_Bjlk_HB_MT64x64x16_MI16x16x16x1_SN_1LDSB1_AMAS3_GRVW4_IU1_NLCB1_SIA2_SU32_SUS256_SVW2_TT2_32_VW2_WGM4
    SolutionIndex: 12
    SolutionNameMin: Cijk_Alik_Bjlk_HB_MT64x64x16_MI16x16x16x1_SN_1LDSB1_AMAS3_GRVW8_IU1_NLCB1_SIA2_SU32_SUS256_SVW2_TT2_32_VW2_WGM4
    SolutionIndex: 13
    SolutionNameMin: Cijk_Alik_Bjlk_HB_MT64x64x16_MI16x16x16x1_SN_1LDSB0_AMAS0_GRVW8_IU1_NLCB1_SIA1_SU0_SUS0_SVW1_TT2_32_VW1_WGM8
    SolutionIndex: 14
    SolutionNameMin: Cijk_Alik_Bjlk_HB_MT64x64x16_MI16x16x16x1_SN_1LDSB0_AMAS3_GRVW8_IU1_NLCB1_SIA1_SU0_SUS0_SVW2_TT2_32_VW2_WGM8
    SolutionIndex: 15
    SolutionNameMin: Cijk_Alik_Bjlk_HB_MT64x64x16_MI16x16x16x1_SN_1LDSB1_AMAS3_GRVW4_IU1_NLCB1_SIA2_SU0_SUS0_SVW2_TT2_32_VW2_WGM8
    SolutionIndex: 16
    SolutionNameMin: Cijk_Alik_Bjlk_HB_MT64x64x16_MI16x16x16x1_SN_1LDSB1_AMAS3_GRVW8_IU1_NLCB1_SIA2_SU0_SUS0_SVW2_TT2_32_VW2_WGM8
    SolutionIndex: 17
    SolutionNameMin: Cijk_Alik_Bjlk_HB_MT64x64x16_MI16x16x16x1_SN_1LDSB1_AMAS3_GRVW8_IU1_NLCB1_SIA2_SU32_SUS128_SVW2_TT2_32_VW2_WGM8
    SolutionIndex: 18
    SolutionNameMin: Cijk_Alik_Bjlk_HB_MT128x128x16_MI16x16x16x1_SN_1LDSB0_AMAS3_GRVW2_IU1_NLCB2_SIA1_SU0_SUS0_SVW2_TT4_64_VW2_WGM4
    SolutionIndex: 19
    SolutionNameMin: Cijk_Alik_Bjlk_HB_MT128x128x16_MI16x16x16x1_SN_1LDSB0_AMAS0_GRVW4_IU1_NLCB1_SIA1_SU0_SUS0_SVW1_TT4_64_VW1_WGM4
    SolutionIndex: 20
    SolutionNameMin: Cijk_Alik_Bjlk_HB_MT128x128x16_MI16x16x16x1_SN_1LDSB0_AMAS3_GRVW4_IU1_NLCB1_SIA1_SU0_SUS0_SVW2_TT4_64_VW2_WGM4
    SolutionIndex: 21
    SolutionNameMin: Cijk_Alik_Bjlk_HB_MT128x128x16_MI16x16x16x1_SN_1LDSB0_AMAS0_GRVW8_IU1_NLCB1_SIA1_SU0_SUS0_SVW1_TT4_64_VW1_WGM4
    SolutionIndex: 22
    SolutionNameMin: Cijk_Alik_Bjlk_HB_MT128x128x16_MI16x16x16x1_SN_1LDSB0_AMAS3_GRVW8_IU1_NLCB1_SIA1_SU0_SUS0_SVW2_TT4_64_VW2_WGM4
    SolutionIndex: 23
    SolutionNameMin: Cijk_Alik_Bjlk_HB_MT128x128x16_MI16x16x16x1_SN_1LDSB1_AMAS3_GRVW4_IU1_NLCB1_SIA2_SU0_SUS0_SVW2_TT4_64_VW2_WGM4
    SolutionIndex: 24
    SolutionNameMin: Cijk_Alik_Bjlk_HB_MT128x128x16_MI16x16x16x1_SN_1LDSB1_AMAS3_GRVW8_IU1_NLCB1_SIA2_SU0_SUS0_SVW2_TT4_64_VW2_WGM4
    SolutionIndex: 25
    SolutionNameMin: Cijk_Alik_Bjlk_HB_MT128x128x16_MI16x16x16x1_SN_1LDSB0_AMAS3_GRVW8_IU1_NLCB1_SIA3_SU0_SUS0_SVW2_TT4_64_VW2_WGM4
    SolutionIndex: 26
    SolutionNameMin: Cijk_Alik_Bjlk_HB_MT128x128x16_MI16x16x16x1_SN_1LDSB0_AMAS3_GRVW4_IU1_NLCB1_SIA1_SU32_SUS128_SVW2_TT4_64_VW2_WGM4
    SolutionIndex: 27
    SolutionNameMin: Cijk_Alik_Bjlk_HB_MT128x128x16_MI16x16x16x1_SN_1LDSB0_AMAS0_GRVW8_IU1_NLCB1_SIA1_SU32_SUS128_SVW1_TT4_64_VW1_WGM4
    SolutionIndex: 28
    SolutionNameMin: Cijk_Alik_Bjlk_HB_MT128x128x16_MI16x16x16x1_SN_1LDSB0_AMAS3_GRVW8_IU1_NLCB1_SIA1_SU32_SUS128_SVW2_TT4_64_VW2_WGM4
    SolutionIndex: 29
    SolutionNameMin: Cijk_Alik_Bjlk_HB_MT128x128x16_MI16x16x16x1_SN_1LDSB1_AMAS3_GRVW2_IU1_NLCB2_SIA2_SU32_SUS128_SVW2_TT4_64_VW2_WGM4
    SolutionIndex: 30
    SolutionNameMin: Cijk_Alik_Bjlk_HB_MT128x128x16_MI16x16x16x1_SN_1LDSB1_AMAS3_GRVW4_IU1_NLCB1_SIA2_SU32_SUS128_SVW2_TT4_64_VW2_WGM4
    SolutionIndex: 31
    SolutionNameMin: Cijk_Alik_Bjlk_HB_MT128x128x16_MI16x16x16x1_SN_1LDSB1_AMAS3_GRVW8_IU1_NLCB1_SIA2_SU32_SUS128_SVW2_TT4_64_VW2_WGM4
    SolutionIndex: 32
    SolutionNameMin: Cijk_Alik_Bjlk_HB_MT128x128x16_MI16x16x16x1_SN_1LDSB0_AMAS0_GRVW8_IU1_NLCB1_SIA3_SU32_SUS128_SVW1_TT4_64_VW1_WGM4
    SolutionIndex: 33
    SolutionNameMin: Cijk_Alik_Bjlk_HB_MT128x128x16_MI16x16x16x1_SN_1LDSB0_AMAS0_GRVW4_IU1_NLCB1_SIA1_SU32_SUS256_SVW1_TT4_64_VW1_WGM4
    SolutionIndex: 34
    SolutionNameMin: Cijk_Alik_Bjlk_HB_MT128x128x16_MI16x16x16x1_SN_1LDSB0_AMAS3_GRVW4_IU1_NLCB1_SIA1_SU32_SUS256_SVW2_TT4_64_VW2_WGM4
    SolutionIndex: 35
    SolutionNameMin: Cijk_Alik_Bjlk_HB_MT128x128x16_MI16x16x16x1_SN_1LDSB0_AMAS3_GRVW8_IU1_NLCB1_SIA1_SU32_SUS256_SVW2_TT4_64_VW2_WGM4
    SolutionIndex: 36
    SolutionNameMin: Cijk_Alik_Bjlk_HB_MT128x128x16_MI16x16x16x1_SN_1LDSB1_AMAS3_GRVW4_IU1_NLCB1_SIA2_SU32_SUS256_SVW2_TT4_64_VW2_WGM4
    SolutionIndex: 37
    SolutionNameMin: Cijk_Alik_Bjlk_HB_MT128x128x16_MI16x16x16x1_SN_1LDSB1_AMAS3_GRVW8_IU1_NLCB1_SIA2_SU32_SUS256_SVW2_TT4_64_VW2_WGM4
    SolutionIndex: 38
    SolutionNameMin: Cijk_Alik_Bjlk_HB_MT128x128x16_MI16x16x16x1_SN_1LDSB0_AMAS3_GRVW8_IU1_NLCB1_SIA3_SU32_SUS256_SVW2_TT4_64_VW2_WGM4
    SolutionIndex: 39
    SolutionNameMin: Cijk_Alik_Bjlk_HB_MT128x128x16_MI16x16x16x1_SN_1LDSB0_AMAS3_GRVW2_IU1_NLCB2_SIA1_SU0_SUS0_SVW2_TT4_64_VW2_WGM8
    SolutionIndex: 40
    SolutionNameMin: Cijk_Alik_Bjlk_HB_MT128x128x16_MI16x16x16x1_SN_1LDSB0_AMAS0_GRVW4_IU1_NLCB1_SIA1_SU0_SUS0_SVW1_TT4_64_VW1_WGM8
    SolutionIndex: 41
    SolutionNameMin: Cijk_Alik_Bjlk_HB_MT128x128x16_MI16x16x16x1_SN_1LDSB0_AMAS3_GRVW4_IU1_NLCB1_SIA1_SU0_SUS0_SVW2_TT4_64_VW2_WGM8
    SolutionIndex: 42
    SolutionNameMin: Cijk_Alik_Bjlk_HB_MT128x128x16_MI16x16x16x1_SN_1LDSB0_AMAS0_GRVW8_IU1_NLCB1_SIA1_SU0_SUS0_SVW1_TT4_64_VW1_WGM8
    SolutionIndex: 43
    SolutionNameMin: Cijk_Alik_Bjlk_HB_MT128x128x16_MI16x16x16x1_SN_1LDSB0_AMAS3_GRVW8_IU1_NLCB1_SIA1_SU0_SUS0_SVW2_TT4_64_VW2_WGM8
    SolutionIndex: 44
    SolutionNameMin: Cijk_Alik_Bjlk_HB_MT128x128x16_MI16x16x16x1_SN_1LDSB1_AMAS3_GRVW2_IU1_NLCB2_SIA2_SU0_SUS0_SVW2_TT4_64_VW2_WGM8
    SolutionIndex: 45
    SolutionNameMin: Cijk_Alik_Bjlk_HB_MT128x128x16_MI16x16x16x1_SN_1LDSB1_AMAS3_GRVW4_IU1_NLCB1_SIA2_SU0_SUS0_SVW2_TT4_64_VW2_WGM8
    SolutionIndex: 46
    SolutionNameMin: Cijk_Alik_Bjlk_HB_MT128x128x16_MI16x16x16x1_SN_1LDSB1_AMAS3_GRVW8_IU1_NLCB1_SIA2_SU0_SUS0_SVW2_TT4_64_VW2_WGM8
    SolutionIndex: 47
    SolutionNameMin: Cijk_Alik_Bjlk_HB_MT128x128x16_MI16x16x16x1_SN_1LDSB0_AMAS3_GRVW8_IU1_NLCB1_SIA3_SU0_SUS0_SVW2_TT4_64_VW2_WGM8
    SolutionIndex: 48
    SolutionNameMin: Cijk_Alik_Bjlk_HB_MT128x128x16_MI16x16x16x1_SN_1LDSB0_AMAS0_GRVW2_IU1_NLCB2_SIA1_SU32_SUS128_SVW1_TT4_64_VW1_WGM8
    SolutionIndex: 49
    SolutionNameMin: Cijk_Alik_Bjlk_HB_MT128x128x16_MI16x16x16x1_SN_1LDSB0_AMAS0_GRVW4_IU1_NLCB1_SIA1_SU32_SUS128_SVW1_TT4_64_VW1_WGM8
    SolutionIndex: 50
    SolutionNameMin: Cijk_Alik_Bjlk_HB_MT128x128x16_MI16x16x16x1_SN_1LDSB0_AMAS3_GRVW4_IU1_NLCB1_SIA1_SU32_SUS128_SVW2_TT4_64_VW2_WGM8
    SolutionIndex: 51
    SolutionNameMin: Cijk_Alik_Bjlk_HB_MT128x128x16_MI16x16x16x1_SN_1LDSB0_AMAS0_GRVW8_IU1_NLCB1_SIA1_SU32_SUS128_SVW1_TT4_64_VW1_WGM8
    SolutionIndex: 52
    SolutionNameMin: Cijk_Alik_Bjlk_HB_MT128x128x16_MI16x16x16x1_SN_1LDSB0_AMAS3_GRVW8_IU1_NLCB1_SIA1_SU32_SUS128_SVW2_TT4_64_VW2_WGM8
    SolutionIndex: 53
    SolutionNameMin: Cijk_Alik_Bjlk_HB_MT128x128x16_MI16x16x16x1_SN_1LDSB1_AMAS3_GRVW2_IU1_NLCB2_SIA2_SU32_SUS128_SVW2_TT4_64_VW2_WGM8
    SolutionIndex: 54
    SolutionNameMin: Cijk_Alik_Bjlk_HB_MT128x128x16_MI16x16x16x1_SN_1LDSB1_AMAS3_GRVW4_IU1_NLCB1_SIA2_SU32_SUS128_SVW2_TT4_64_VW2_WGM8
    SolutionIndex: 55
    SolutionNameMin: Cijk_Alik_Bjlk_HB_MT128x128x16_MI16x16x16x1_SN_1LDSB1_AMAS3_GRVW8_IU1_NLCB1_SIA2_SU32_SUS128_SVW2_TT4_64_VW2_WGM8
    SolutionIndex: 56
    SolutionNameMin: Cijk_Alik_Bjlk_HB_MT128x128x16_MI16x16x16x1_SN_1LDSB0_AMAS0_GRVW8_IU1_NLCB1_SIA3_SU32_SUS128_SVW1_TT4_64_VW1_WGM8
    SolutionIndex: 57
    SolutionNameMin: Cijk_Alik_Bjlk_HB_MT128x128x16_MI16x16x16x1_SN_1LDSB0_AMAS3_GRVW8_IU1_NLCB1_SIA3_SU32_SUS128_SVW2_TT4_64_VW2_WGM8
    SolutionIndex: 58
    SolutionNameMin: Cijk_Alik_Bjlk_HB_MT128x128x16_MI16x16x16x1_SN_1LDSB0_AMAS3_GRVW4_IU1_NLCB1_SIA1_SU32_SUS256_SVW2_TT4_64_VW2_WGM8
    SolutionIndex: 59
    SolutionNameMin: Cijk_Alik_Bjlk_HB_MT128x128x16_MI16x16x16x1_SN_1LDSB0_AMAS0_GRVW8_IU1_NLCB1_SIA1_SU32_SUS256_SVW1_TT4_64_VW1_WGM8
    SolutionIndex: 60
    SolutionNameMin: Cijk_Alik_Bjlk_HB_MT128x128x16_MI16x16x16x1_SN_1LDSB0_AMAS3_GRVW8_IU1_NLCB1_SIA1_SU32_SUS256_SVW2_TT4_64_VW2_WGM8
    SolutionIndex: 61
    SolutionNameMin: Cijk_Alik_Bjlk_HB_MT128x128x16_MI16x16x16x1_SN_1LDSB1_AMAS3_GRVW2_IU1_NLCB2_SIA2_SU32_SUS256_SVW2_TT4_64_VW2_WGM8
    SolutionIndex: 62
    SolutionNameMin: Cijk_Alik_Bjlk_HB_MT128x128x16_MI16x16x16x1_SN_1LDSB1_AMAS3_GRVW4_IU1_NLCB1_SIA2_SU32_SUS256_SVW2_TT4_64_VW2_WGM8
    SolutionIndex: 63
    SolutionNameMin: Cijk_Alik_Bjlk_HB_MT128x128x16_MI16x16x16x1_SN_1LDSB1_AMAS0_GRVW8_IU1_NLCB1_SIA2_SU32_SUS256_SVW1_TT4_64_VW1_WGM8
    SolutionIndex: 64
    SolutionNameMin: Cijk_Alik_Bjlk_HB_MT128x128x16_MI16x16x16x1_SN_1LDSB1_AMAS3_GRVW8_IU1_NLCB1_SIA2_SU32_SUS256_SVW2_TT4_64_VW2_WGM8
    SolutionIndex: 65
    SolutionNameMin: Cijk_Alik_Bjlk_HB_MT128x128x16_MI16x16x16x1_SN_1LDSB0_AMAS3_GRVW8_IU1_NLCB1_SIA3_SU32_SUS256_SVW2_TT4_64_VW2_WGM8
    SolutionIndex: 66
    SolutionNameMin: Cijk_Alik_Bjlk_HB_MT32x32x32_MI16x16x16x1_SN_1LDSB0_AMAS0_GRVW4_IU1_NLCB1_SIA1_SU0_SUS0_SVW1_TT1_16_VW1_WGM4
    SolutionIndex: 67
    SolutionNameMin: Cijk_Alik_Bjlk_HB_MT32x32x32_MI16x16x16x1_SN_1LDSB0_AMAS0_GRVW8_IU1_NLCB1_SIA1_SU0_SUS0_SVW1_TT1_16_VW1_WGM4
    SolutionIndex: 68
    SolutionNameMin: Cijk_Alik_Bjlk_HB_MT32x32x32_MI16x16x16x1_SN_1LDSB1_AMAS0_GRVW2_IU2_NLCB1_SIA2_SU0_SUS0_SVW1_TT1_16_VW1_WGM4
    SolutionIndex: 69
    SolutionNameMin: Cijk_Alik_Bjlk_HB_MT32x32x32_MI16x16x16x1_SN_1LDSB1_AMAS0_GRVW4_IU2_NLCB1_SIA2_SU0_SUS0_SVW1_TT1_16_VW1_WGM4
    SolutionIndex: 70
    SolutionNameMin: Cijk_Alik_Bjlk_HB_MT32x32x32_MI16x16x16x1_SN_1LDSB1_AMAS0_GRVW8_IU2_NLCB1_SIA2_SU0_SUS0_SVW1_TT1_16_VW1_WGM4
    SolutionIndex: 71
    SolutionNameMin: Cijk_Alik_Bjlk_HB_MT32x32x32_MI16x16x16x1_SN_1LDSB0_AMAS0_GRVW4_IU1_NLCB1_SIA1_SU32_SUS128_SVW1_TT1_16_VW1_WGM4
    SolutionIndex: 72
    SolutionNameMin: Cijk_Alik_Bjlk_HB_MT32x32x32_MI16x16x16x1_SN_1LDSB0_AMAS0_GRVW8_IU1_NLCB1_SIA1_SU32_SUS128_SVW1_TT1_16_VW1_WGM4
    SolutionIndex: 73
    SolutionNameMin: Cijk_Alik_Bjlk_HB_MT32x32x32_MI16x16x16x1_SN_1LDSB1_AMAS0_GRVW4_IU2_NLCB1_SIA2_SU32_SUS128_SVW1_TT1_16_VW1_WGM4
    SolutionIndex: 74
    SolutionNameMin: Cijk_Alik_Bjlk_HB_MT32x32x32_MI16x16x16x1_SN_1LDSB1_AMAS0_GRVW8_IU2_NLCB1_SIA2_SU32_SUS128_SVW1_TT1_16_VW1_WGM4
    SolutionIndex: 75
    SolutionNameMin: Cijk_Alik_Bjlk_HB_MT32x32x32_MI16x16x16x1_SN_1LDSB0_AMAS0_GRVW8_IU1_NLCB1_SIA1_SU32_SUS256_SVW1_TT1_16_VW1_WGM4
    SolutionIndex: 76
    SolutionNameMin: Cijk_Alik_Bjlk_HB_MT32x32x32_MI16x16x16x1_SN_1LDSB1_AMAS0_GRVW4_IU2_NLCB1_SIA2_SU32_SUS256_SVW1_TT1_16_VW1_WGM4
    SolutionIndex: 77
    SolutionNameMin: Cijk_Alik_Bjlk_HB_MT32x32x32_MI16x16x16x1_SN_1LDSB1_AMAS0_GRVW8_IU2_NLCB1_SIA2_SU32_SUS256_SVW1_TT1_16_VW1_WGM4
    SolutionIndex: 78
    SolutionNameMin: Cijk_Alik_Bjlk_HB_MT32x32x32_MI16x16x16x1_SN_1LDSB0_AMAS0_GRVW2_IU1_NLCB1_SIA1_SU0_SUS0_SVW1_TT1_16_VW1_WGM8
    SolutionIndex: 79
    SolutionNameMin: Cijk_Alik_Bjlk_HB_MT32x32x32_MI16x16x16x1_SN_1LDSB0_AMAS0_GRVW4_IU1_NLCB1_SIA1_SU0_SUS0_SVW1_TT1_16_VW1_WGM8
    SolutionIndex: 80
    SolutionNameMin: Cijk_Alik_Bjlk_HB_MT32x32x32_MI16x16x16x1_SN_1LDSB0_AMAS0_GRVW8_IU1_NLCB1_SIA1_SU0_SUS0_SVW1_TT1_16_VW1_WGM8
    SolutionIndex: 81
    SolutionNameMin: Cijk_Alik_Bjlk_HB_MT32x32x32_MI16x16x16x1_SN_1LDSB1_AMAS0_GRVW2_IU2_NLCB1_SIA2_SU0_SUS0_SVW1_TT1_16_VW1_WGM8
    SolutionIndex: 82
    SolutionNameMin: Cijk_Alik_Bjlk_HB_MT32x32x32_MI16x16x16x1_SN_1LDSB1_AMAS0_GRVW4_IU2_NLCB1_SIA2_SU0_SUS0_SVW1_TT1_16_VW1_WGM8
    SolutionIndex: 83
    SolutionNameMin: Cijk_Alik_Bjlk_HB_MT32x32x32_MI16x16x16x1_SN_1LDSB1_AMAS0_GRVW8_IU2_NLCB1_SIA2_SU0_SUS0_SVW1_TT1_16_VW1_WGM8
    SolutionIndex: 84
    SolutionNameMin: Cijk_Alik_Bjlk_HB_MT32x32x32_MI16x16x16x1_SN_1LDSB0_AMAS0_GRVW2_IU1_NLCB1_SIA3_SU0_SUS0_SVW1_TT1_16_VW1_WGM8
    SolutionIndex: 85
    SolutionNameMin: Cijk_Alik_Bjlk_HB_MT32x32x32_MI16x16x16x1_SN_1LDSB0_AMAS0_GRVW2_IU1_NLCB1_SIA1_SU32_SUS128_SVW1_TT1_16_VW1_WGM8
    SolutionIndex: 86
    SolutionNameMin: Cijk_Alik_Bjlk_HB_MT32x32x32_MI16x16x16x1_SN_1LDSB0_AMAS0_GRVW8_IU1_NLCB1_SIA1_SU32_SUS128_SVW1_TT1_16_VW1_WGM8
    SolutionIndex: 87
    SolutionNameMin: Cijk_Alik_Bjlk_HB_MT32x32x32_MI16x16x16x1_SN_1LDSB1_AMAS0_GRVW4_IU2_NLCB1_SIA2_SU32_SUS128_SVW1_TT1_16_VW1_WGM8
    SolutionIndex: 88
    SolutionNameMin: Cijk_Alik_Bjlk_HB_MT32x32x32_MI16x16x16x1_SN_1LDSB1_AMAS0_GRVW8_IU2_NLCB1_SIA2_SU32_SUS128_SVW1_TT1_16_VW1_WGM8
    SolutionIndex: 89
    SolutionNameMin: Cijk_Alik_Bjlk_HB_MT32x32x32_MI16x16x16x1_SN_1LDSB0_AMAS0_GRVW4_IU1_NLCB1_SIA1_SU32_SUS256_SVW1_TT1_16_VW1_WGM8
    SolutionIndex: 90
    SolutionNameMin: Cijk_Alik_Bjlk_HB_MT32x32x32_MI16x16x16x1_SN_1LDSB1_AMAS0_GRVW4_IU2_NLCB1_SIA2_SU32_SUS256_SVW1_TT1_16_VW1_WGM8
    SolutionIndex: 91
    SolutionNameMin: Cijk_Alik_Bjlk_HB_MT32x32x32_MI16x16x16x1_SN_1LDSB1_AMAS0_GRVW8_IU2_NLCB1_SIA2_SU32_SUS256_SVW1_TT1_16_VW1_WGM8
    SolutionIndex: 92
    SolutionNameMin: Cijk_Alik_Bjlk_HB_MT64x64x32_MI16x16x16x1_SN_1LDSB0_AMAS3_GRVW8_IU1_NLCB1_SIA1_SU0_SUS0_SVW2_TT2_32_VW2_WGM4
    SolutionIndex: 93
    SolutionNameMin: Cijk_Alik_Bjlk_HB_MT64x64x32_MI16x16x16x1_SN_1LDSB1_AMAS0_GRVW4_IU2_NLCB1_SIA2_SU0_SUS0_SVW1_TT2_32_VW1_WGM4
    SolutionIndex: 94
    SolutionNameMin: Cijk_Alik_Bjlk_HB_MT64x64x32_MI16x16x16x1_SN_1LDSB1_AMAS3_GRVW4_IU2_NLCB1_SIA2_SU0_SUS0_SVW2_TT2_32_VW2_WGM4
    SolutionIndex: 95
    SolutionNameMin: Cijk_Alik_Bjlk_HB_MT64x64x32_MI16x16x16x1_SN_1LDSB1_AMAS0_GRVW8_IU2_NLCB1_SIA2_SU0_SUS0_SVW1_TT2_32_VW1_WGM4
    SolutionIndex: 96
    SolutionNameMin: Cijk_Alik_Bjlk_HB_MT64x64x32_MI16x16x16x1_SN_1LDSB1_AMAS3_GRVW8_IU2_NLCB1_SIA2_SU0_SUS0_SVW2_TT2_32_VW2_WGM4
    SolutionIndex: 97
    SolutionNameMin: Cijk_Alik_Bjlk_HB_MT64x64x32_MI16x16x16x1_SN_1LDSB0_AMAS3_GRVW4_IU1_NLCB1_SIA3_SU0_SUS0_SVW2_TT2_32_VW2_WGM4
    SolutionIndex: 98
    SolutionNameMin: Cijk_Alik_Bjlk_HB_MT64x64x32_MI16x16x16x1_SN_1LDSB0_AMAS0_GRVW8_IU1_NLCB1_SIA3_SU0_SUS0_SVW1_TT2_32_VW1_WGM4
    SolutionIndex: 99
    SolutionNameMin: Cijk_Alik_Bjlk_HB_MT64x64x32_MI16x16x16x1_SN_1LDSB0_AMAS3_GRVW8_IU1_NLCB1_SIA3_SU0_SUS0_SVW2_TT2_32_VW2_WGM4
    SolutionIndex: 100
    SolutionNameMin: Cijk_Alik_Bjlk_HB_MT64x64x32_MI16x16x16x1_SN_1LDSB1_AMAS3_GRVW4_IU2_NLCB1_SIA2_SU32_SUS128_SVW2_TT2_32_VW2_WGM4
    SolutionIndex: 101
    SolutionNameMin: Cijk_Alik_Bjlk_HB_MT64x64x32_MI16x16x16x1_SN_1LDSB1_AMAS3_GRVW8_IU2_NLCB1_SIA2_SU32_SUS128_SVW2_TT2_32_VW2_WGM4
    SolutionIndex: 102
    SolutionNameMin: Cijk_Alik_Bjlk_HB_MT64x64x32_MI16x16x16x1_SN_1LDSB0_AMAS0_GRVW8_IU1_NLCB1_SIA3_SU32_SUS128_SVW1_TT2_32_VW1_WGM4
    SolutionIndex: 103
    SolutionNameMin: Cijk_Alik_Bjlk_HB_MT64x64x32_MI16x16x16x1_SN_1LDSB0_AMAS3_GRVW8_IU1_NLCB1_SIA3_SU32_SUS128_SVW2_TT2_32_VW2_WGM4
    SolutionIndex: 104
    SolutionNameMin: Cijk_Alik_Bjlk_HB_MT64x64x32_MI16x16x16x1_SN_1LDSB1_AMAS0_GRVW4_IU2_NLCB1_SIA2_SU32_SUS256_SVW1_TT2_32_VW1_WGM4
    SolutionIndex: 105
    SolutionNameMin: Cijk_Alik_Bjlk_HB_MT64x64x32_MI16x16x16x1_SN_1LDSB1_AMAS3_GRVW4_IU2_NLCB1_SIA2_SU32_SUS256_SVW2_TT2_32_VW2_WGM4
    SolutionIndex: 106
    SolutionNameMin: Cijk_Alik_Bjlk_HB_MT64x64x32_MI16x16x16x1_SN_1LDSB1_AMAS0_GRVW8_IU2_NLCB1_SIA2_SU32_SUS256_SVW1_TT2_32_VW1_WGM4
    SolutionIndex: 107
    SolutionNameMin: Cijk_Alik_Bjlk_HB_MT64x64x32_MI16x16x16x1_SN_1LDSB1_AMAS3_GRVW8_IU2_NLCB1_SIA2_SU32_SUS256_SVW2_TT2_32_VW2_WGM4
    SolutionIndex: 108
    SolutionNameMin: Cijk_Alik_Bjlk_HB_MT64x64x32_MI16x16x16x1_SN_1LDSB0_AMAS0_GRVW8_IU1_NLCB1_SIA3_SU32_SUS256_SVW1_TT2_32_VW1_WGM4
    SolutionIndex: 109
    SolutionNameMin: Cijk_Alik_Bjlk_HB_MT64x64x32_MI16x16x16x1_SN_1LDSB0_AMAS3_GRVW8_IU1_NLCB1_SIA3_SU32_SUS256_SVW2_TT2_32_VW2_WGM4
    SolutionIndex: 110
    SolutionNameMin: Cijk_Alik_Bjlk_HB_MT64x64x32_MI16x16x16x1_SN_1LDSB0_AMAS0_GRVW4_IU1_NLCB1_SIA1_SU0_SUS0_SVW1_TT2_32_VW1_WGM8
    SolutionIndex: 111
    SolutionNameMin: Cijk_Alik_Bjlk_HB_MT64x64x32_MI16x16x16x1_SN_1LDSB0_AMAS3_GRVW4_IU1_NLCB1_SIA1_SU0_SUS0_SVW2_TT2_32_VW2_WGM8
    SolutionIndex: 112
    SolutionNameMin: Cijk_Alik_Bjlk_HB_MT64x64x32_MI16x16x16x1_SN_1LDSB0_AMAS0_GRVW8_IU1_NLCB1_SIA1_SU0_SUS0_SVW1_TT2_32_VW1_WGM8
    SolutionIndex: 113
    SolutionNameMin: Cijk_Alik_Bjlk_HB_MT64x64x32_MI16x16x16x1_SN_1LDSB0_AMAS3_GRVW8_IU1_NLCB1_SIA1_SU0_SUS0_SVW2_TT2_32_VW2_WGM8
    SolutionIndex: 114
    SolutionNameMin: Cijk_Alik_Bjlk_HB_MT64x64x32_MI16x16x16x1_SN_1LDSB1_AMAS0_GRVW4_IU2_NLCB1_SIA2_SU0_SUS0_SVW1_TT2_32_VW1_WGM8
    SolutionIndex: 115
    SolutionNameMin: Cijk_Alik_Bjlk_HB_MT64x64x32_MI16x16x16x1_SN_1LDSB1_AMAS3_GRVW4_IU2_NLCB1_SIA2_SU0_SUS0_SVW2_TT2_32_VW2_WGM8
    SolutionIndex: 116
    SolutionNameMin: Cijk_Alik_Bjlk_HB_MT64x64x32_MI16x16x16x1_SN_1LDSB1_AMAS0_GRVW8_IU2_NLCB1_SIA2_SU0_SUS0_SVW1_TT2_32_VW1_WGM8
    SolutionIndex: 117
    SolutionNameMin: Cijk_Alik_Bjlk_HB_MT64x64x32_MI16x16x16x1_SN_1LDSB1_AMAS3_GRVW8_IU2_NLCB1_SIA2_SU0_SUS0_SVW2_TT2_32_VW2_WGM8
    SolutionIndex: 118
    SolutionNameMin: Cijk_Alik_Bjlk_HB_MT64x64x32_MI16x16x16x1_SN_1LDSB0_AMAS0_GRVW8_IU1_NLCB1_SIA3_SU0_SUS0_SVW1_TT2_32_VW1_WGM8
    SolutionIndex: 119
    SolutionNameMin: Cijk_Alik_Bjlk_HB_MT64x64x32_MI16x16x16x1_SN_1LDSB0_AMAS3_GRVW8_IU1_NLCB1_SIA3_SU0_SUS0_SVW2_TT2_32_VW2_WGM8
    SolutionIndex: 120
    SolutionNameMin: Cijk_Alik_Bjlk_HB_MT64x64x32_MI16x16x16x1_SN_1LDSB1_AMAS3_GRVW4_IU2_NLCB1_SIA2_SU32_SUS128_SVW2_TT2_32_VW2_WGM8
    SolutionIndex: 121
    SolutionNameMin: Cijk_Alik_Bjlk_HB_MT64x64x32_MI16x16x16x1_SN_1LDSB1_AMAS0_GRVW8_IU2_NLCB1_SIA2_SU32_SUS128_SVW1_TT2_32_VW1_WGM8
    SolutionIndex: 122
    SolutionNameMin: Cijk_Alik_Bjlk_HB_MT64x64x32_MI16x16x16x1_SN_1LDSB1_AMAS3_GRVW8_IU2_NLCB1_SIA2_SU32_SUS128_SVW2_TT2_32_VW2_WGM8
    SolutionIndex: 123
    SolutionNameMin: Cijk_Alik_Bjlk_HB_MT64x64x32_MI16x16x16x1_SN_1LDSB0_AMAS0_GRVW8_IU1_NLCB1_SIA3_SU32_SUS128_SVW1_TT2_32_VW1_WGM8
    SolutionIndex: 124
    SolutionNameMin: Cijk_Alik_Bjlk_HB_MT64x64x32_MI16x16x16x1_SN_1LDSB0_AMAS3_GRVW8_IU1_NLCB1_SIA3_SU32_SUS128_SVW2_TT2_32_VW2_WGM8
    SolutionIndex: 125
    SolutionNameMin: Cijk_Alik_Bjlk_HB_MT64x64x32_MI16x16x16x1_SN_1LDSB1_AMAS3_GRVW2_IU2_NLCB1_SIA2_SU32_SUS256_SVW2_TT2_32_VW2_WGM8
    SolutionIndex: 126
    SolutionNameMin: Cijk_Alik_Bjlk_HB_MT64x64x32_MI16x16x16x1_SN_1LDSB1_AMAS3_GRVW4_IU2_NLCB1_SIA2_SU32_SUS256_SVW2_TT2_32_VW2_WGM8
    SolutionIndex: 127
    SolutionNameMin: Cijk_Alik_Bjlk_HB_MT64x64x32_MI16x16x16x1_SN_1LDSB1_AMAS0_GRVW8_IU2_NLCB1_SIA2_SU32_SUS256_SVW1_TT2_32_VW1_WGM8
    SolutionIndex: 128
    SolutionNameMin: Cijk_Alik_Bjlk_HB_MT64x64x32_MI16x16x16x1_SN_1LDSB1_AMAS3_GRVW8_IU2_NLCB1_SIA2_SU32_SUS256_SVW2_TT2_32_VW2_WGM8
    SolutionIndex: 129
    SolutionNameMin: Cijk_Alik_Bjlk_HB_MT64x64x32_MI16x16x16x1_SN_1LDSB0_AMAS3_GRVW4_IU1_NLCB1_SIA3_SU32_SUS256_SVW2_TT2_32_VW2_WGM8
- - - [64, 64, 1, 64, 96, 96, 96, 96]
    - [1, 0.042]
  - - [64, 64, 1, 128, 96, 96, 160, 160]
    - [88, 0.082]
  - - [64, 64, 1, 256, 96, 96, 288, 288]
    - [88, 0.153]
  - - [64, 64, 1, 512, 96, 96, 544, 544]
    - [91, 0.271]
  - - [64, 64, 1, 1024, 96, 96, 1056, 1056]
    - [82, 0.437]
  - - [64, 64, 1, 2048, 96, 96, 2080, 2080]
    - [69, 0.636]
  - - [64, 64, 1, 4096, 96, 96, 4128, 4128]
    - [88, 0.814]
  - - [64, 64, 1, 8192, 96, 96, 8224, 8224]
    - [76, 0.95]
  - - [64, 128, 1, 64, 96, 96, 96, 128]
    - [90, 0.087]
  - - [64, 128, 1, 128, 96, 96, 160, 160]
    - [74, 0.168]
  - - [64, 128, 1, 256, 96, 96, 288, 288]
    - [82, 0.312]
  - - [64, 128, 1, 512, 96, 96, 544, 544]
    - [73, 0.555]
  - - [64, 128, 1, 1024, 96, 96, 1056, 1056]
    - [77, 0.894]
  - - [64, 128, 1, 2048, 96, 96, 2080, 2080]
    - [73, 1.285]
  - - [64, 128, 1, 4096, 96, 96, 4128, 4128]
    - [73, 1.643]
  - - [64, 128, 1, 8192, 96, 96, 8224, 8224]
    - [87, 1.846]
  - - [64, 256, 1, 64, 96, 96, 96, 256]
    - [88, 0.176]
  - - [64, 256, 1, 128, 96, 96, 160, 256]
    - [83, 0.342]
  - - [64, 256, 1, 256, 96, 96, 288, 288]
    - [70, 0.635]
  - - [64, 256, 1, 512, 96, 96, 544, 544]
    - [90, 1.122]
  - - [64, 256, 1, 1024, 96, 96, 1056, 1056]
    - [73, 1.793]
  - - [64, 256, 1, 2048, 96, 96, 2080, 2080]
    - [87, 2.585]
  - - [64, 256, 1, 4096, 96, 96, 4128, 4128]
    - [90, 3.307]
  - - [64, 256, 1, 8192, 96, 96, 8224, 8224]
    - [87, 3.827]
  - - [64, 512, 1, 64, 96, 96, 96, 512]
    - [4, 0.346]
  - - [64, 512, 1, 128, 96, 96, 160, 512]
    - [74, 0.682]
  - - [64, 512, 1, 256, 96, 96, 288, 512]
    - [73, 1.265]
  - - [64, 512, 1, 512, 96, 96, 544, 544]
    - [76, 2.234]
  - - [64, 512, 1, 1024, 96, 96, 1056, 1056]
    - [70, 3.589]
  - - [64, 512, 1, 2048, 96, 96, 2080, 2080]
    - [68, 5.098]
  - - [64, 512, 1, 4096, 96, 96, 4128, 4128]
    - [82, 6.572]
  - - [64, 512, 1, 8192, 96, 96, 8224, 8224]
    - [90, 7.631]
  - - [64, 1024, 1, 64, 96, 96, 96, 1024]
    - [83, 0.71]
  - - [64, 1024, 1, 128, 96, 96, 160, 1024]
    - [91, 1.342]
  - - [64, 1024, 1, 256, 96, 96, 288, 1024]
    - [69, 2.483]
  - - [64, 1024, 1, 512, 96, 96, 544, 1024]
    - [82, 4.307]
  - - [64, 1024, 1, 1024, 96, 96, 1056, 1056]
    - [70, 6.771]
  - - [64, 1024, 1, 2048, 96, 96, 2080, 2080]
    - [88, 9.483]
  - - [64, 1024, 1, 4096, 96, 96, 4128, 4128]
    - [83, 11.815]
  - - [64, 1024, 1, 8192, 96, 96, 8224, 8224]
    - [91, 13.298]
  - - [64, 2048, 1, 64, 96, 96, 96, 2048]
    - [66, 1.377]
  - - [64, 2048, 1, 128, 96, 96, 160, 2048]
    - [66, 2.607]
  - - [64, 2048, 1, 256, 96, 96, 288, 2048]
    - [91, 4.663]
  - - [64, 2048, 1, 512, 96, 96, 544, 2048]
    - [79, 7.747]
  - - [64, 2048, 1, 1024, 96, 96, 1056, 2048]
    - [125, 10.732]
  - - [64, 2048, 1, 2048, 96, 96, 2080, 2080]
    - [80, 15.725]
  - - [64, 2048, 1, 4096, 96, 96, 4128, 4128]
    - [72, 18.299]
  - - [64, 2048, 1, 8192, 96, 96, 8224, 8224]
    - [78, 20.919]
  - - [64, 4096, 1, 64, 96, 96, 96, 4096]
    - [16, 2.668]
  - - [64, 4096, 1, 128, 96, 96, 160, 4096]
    - [116, 4.916]
  - - [64, 4096, 1, 256, 96, 96, 288, 4096]
    - [106, 8.61]
  - - [64, 4096, 1, 512, 96, 96, 544, 4096]
    - [127, 13.821]
  - - [64, 4096, 1, 1024, 96, 96, 1056, 4096]
    - [95, 19.642]
  - - [64, 4096, 1, 2048, 96, 96, 2080, 4096]
    - [128, 24.896]
  - - [64, 4096, 1, 4096, 96, 96, 4128, 4128]
    - [106, 27.917]
  - - [64, 4096, 1, 8192, 96, 96, 8224, 8224]
    - [128, 26.891]
  - - [64, 8192, 1, 64, 96, 96, 96, 8192]
    - [119, 5.054]
  - - [64, 8192, 1, 128, 96, 96, 160, 8192]
    - [124, 9.145]
  - - [64, 8192, 1, 256, 96, 96, 288, 8192]
    - [99, 15.525]
  - - [64, 8192, 1, 512, 96, 96, 544, 8192]
    - [96, 23.213]
  - - [64, 8192, 1, 1024, 96, 96, 1056, 8192]
    - [95, 31.298]
  - - [64, 8192, 1, 2048, 96, 96, 2080, 8192]
    - [122, 36.492]
  - - [64, 8192, 1, 4096, 96, 96, 4128, 8192]
    - [127, 41.608]
  - - [64, 8192, 1, 8192, 96, 96, 8224, 8224]
    - [121, 36.489]
  - - [128, 64, 1, 64, 160, 160, 96, 96]
    - [3, 0.088]
  - - [128, 64, 1, 128, 160, 160, 160, 160]
    - [83, 0.169]
  - - [128, 64, 1, 256, 160, 160, 288, 288]
    - [82, 0.311]
  - - [128, 64, 1, 512, 160, 160, 544, 544]
    - [69, 0.553]
  - - [128, 64, 1, 1024, 160, 160, 1056, 1056]
    - [82, 0.894]
  - - [128, 64, 1, 2048, 160, 160, 2080, 2080]
    - [76, 1.287]
  - - [128, 64, 1, 4096, 160, 160, 4128, 4128]
    - [87, 1.65]
  - - [128, 64, 1, 8192, 160, 160, 8224, 8224]
    - [69, 1.922]
  - - [128, 128, 1, 64, 160, 160, 96, 128]
    - [73, 0.177]
  - - [128, 128, 1, 128, 160, 160, 160, 160]
    - [91, 0.342]
  - - [128, 128, 1, 256, 160, 160, 288, 288]
    - [83, 0.636]
  - - [128, 128, 1, 512, 160, 160, 544, 544]
    - [77, 1.116]
  - - [128, 128, 1, 1024, 160, 160, 1056, 1056]
    - [76, 1.805]
  - - [128, 128, 1, 2048, 160, 160, 2080, 2080]
    - [76, 2.599]
  - - [128, 128, 1, 4096, 160, 160, 4128, 4128]
    - [87, 3.333]
  - - [128, 128, 1, 8192, 160, 160, 8224, 8224]
    - [90, 3.811]
  - - [128, 256, 1, 64, 160, 160, 96, 256]
    - [90, 0.357]
  - - [128, 256, 1, 128, 160, 160, 160, 256]
    - [73, 0.683]
  - - [128, 256, 1, 256, 160, 160, 288, 288]
    - [77, 1.268]
  - - [128, 256, 1, 512, 160, 160, 544, 544]
    - [68, 2.233]
  - - [128, 256, 1, 1024, 160, 160, 1056, 1056]
    - [77, 3.645]
  - - [128, 256, 1, 2048, 160, 160, 2080, 2080]
    - [77, 5.201]
  - - [128, 256, 1, 4096, 160, 160, 4128, 4128]
    - [73, 6.663]
  - - [128, 256, 1, 8192, 160, 160, 8224, 8224]
    - [90, 7.626]
  - - [128, 512, 1, 64, 160, 160, 96, 512]
    - [91, 0.702]
  - - [128, 512, 1, 128, 160, 160, 160, 512]
    - [81, 1.35]
  - - [128, 512, 1, 256, 160, 160, 288, 512]
    - [70, 2.468]
  - - [128, 512, 1, 512, 160, 160, 544, 544]
    - [69, 4.321]
  - - [128, 512, 1, 1024, 160, 160, 1056, 1056]
    - [91, 6.746]
  - - [128, 512, 1, 2048, 160, 160, 2080, 2080]
    - [83, 9.477]
  - - [128, 512, 1, 4096, 160, 160, 4128, 4128]
    - [70, 11.824]
  - - [128, 512, 1, 8192, 160, 160, 8224, 8224]
    - [91, 13.333]
  - - [128, 1024, 1, 64, 160, 160, 96, 1024]
    - [84, 1.369]
  - - [128, 1024, 1, 128, 160, 160, 160, 1024]
    - [80, 2.596]
  - - [128, 1024, 1, 256, 160, 160, 288, 1024]
    - [86, 4.647]
  - - [128, 1024, 1, 512, 160, 160, 544, 1024]
    - [70, 7.78]
  - - [128, 1024, 1, 1024, 160, 160, 1056, 1056]
    - [66, 11.822]
  - - [128, 1024, 1, 2048, 160, 160, 2080, 2080]
    - [66, 15.874]
  - - [128, 1024, 1, 4096, 160, 160, 4128, 4128]
    - [71, 18.404]
  - - [128, 1024, 1, 8192, 160, 160, 8224, 8224]
    - [67, 21.154]
  - - [128, 2048, 1, 64, 160, 160, 96, 2048]
    - [96, 2.662]
  - - [128, 2048, 1, 128, 160, 160, 160, 2048]
    - [8, 4.887]
  - - [128, 2048, 1, 256, 160, 160, 288, 2048]
    - [96, 8.587]
  - - [128, 2048, 1, 512, 160, 160, 544, 2048]
    - [106, 13.753]
  - - [128, 2048, 1, 1024, 160, 160, 1056, 2048]
    - [117, 19.592]
  - - [128, 2048, 1, 2048, 160, 160, 2080, 2080]
    - [95, 24.812]
  - - [128, 2048, 1, 4096, 160, 160, 4128, 4128]
    - [107, 28.037]
  - - [128, 2048, 1, 8192, 160, 160, 8224, 8224]
    - [114, 28.85]
  - - [128, 4096, 1, 64, 160, 160, 96, 4096]
    - [15, 5.087]
  - - [128, 4096, 1, 128, 160, 160, 160, 4096]
    - [14, 9.127]
  - - [128, 4096, 1, 256, 160, 160, 288, 4096]
    - [108, 15.385]
  - - [128, 4096, 1, 512, 160, 160, 544, 4096]
    - [118, 23.394]
  - - [128, 4096, 1, 1024, 160, 160, 1056, 4096]
    - [118, 31.342]
  - - [128, 4096, 1, 2048, 160, 160, 2080, 4096]
    - [5, 37.454]
  - - [128, 4096, 1, 4096, 160, 160, 4128, 4128]
    - [124, 42.008]
  - - [128, 4096, 1, 8192, 160, 160, 8224, 8224]
    - [127, 41.692]
  - - [128, 8192, 1, 64, 160, 160, 96, 8192]
    - [101, 8.721]
  - - [128, 8192, 1, 128, 160, 160, 160, 8192]
    - [10, 14.998]
  - - [128, 8192, 1, 256, 160, 160, 288, 8192]
    - [23, 24.133]
  - - [128, 8192, 1, 512, 160, 160, 544, 8192]
    - [54, 34.626]
  - - [128, 8192, 1, 1024, 160, 160, 1056, 8192]
    - [36, 44.064]
  - - [128, 8192, 1, 2048, 160, 160, 2080, 8192]
    - [54, 50.752]
  - - [128, 8192, 1, 4096, 160, 160, 4128, 8192]
    - [30, 53.144]
  - - [128, 8192, 1, 8192, 160, 160, 8224, 8224]
    - [24, 52.103]
  - - [256, 64, 1, 64, 288, 288, 96, 96]
    - [1, 0.178]
  - - [256, 64, 1, 128, 288, 288, 160, 160]
    - [69, 0.339]
  - - [256, 64, 1, 256, 288, 288, 288, 288]
    - [70, 0.635]
  - - [256, 64, 1, 512, 288, 288, 544, 544]
    - [91, 1.121]
  - - [256, 64, 1, 1024, 288, 288, 1056, 1056]
    - [82, 1.804]
  - - [256, 64, 1, 2048, 288, 288, 2080, 2080]
    - [87, 2.599]
  - - [256, 64, 1, 4096, 288, 288, 4128, 4128]
    - [73, 3.311]
  - - [256, 64, 1, 8192, 288, 288, 8224, 8224]
    - [90, 3.812]
  - - [256, 128, 1, 64, 288, 288, 96, 128]
    - [69, 0.357]
  - - [256, 128, 1, 128, 288, 288, 160, 160]
    - [74, 0.686]
  - - [256, 128, 1, 256, 288, 288, 288, 288]
    - [77, 1.279]
  - - [256, 128, 1, 512, 288, 288, 544, 544]
    - [90, 2.242]
  - - [256, 128, 1, 1024, 288, 288, 1056, 1056]
    - [2, 2.95]
  - - [256, 128, 1, 2048, 288, 288, 2080, 2080]
    - [91, 5.218]
  - - [256, 128, 1, 4096, 288, 288, 4128, 4128]
    - [87, 6.688]
  - - [256, 128, 1, 8192, 288, 288, 8224, 8224]
    - [83, 7.66]
  - - [256, 256, 1, 64, 288, 288, 96, 256]
    - [83, 0.707]
  - - [256, 256, 1, 128, 288, 288, 160, 256]
    - [68, 1.351]
  - - [256, 256, 1, 256, 288, 288, 288, 288]
    - [73, 2.483]
  - - [256, 256, 1, 512, 288, 288, 544, 544]
    - [77, 4.297]
  - - [256, 256, 1, 1024, 288, 288, 1056, 1056]
    - [82, 6.763]
  - - [256, 256, 1, 2048, 288, 288, 2080, 2080]
    - [83, 9.47]
  - - [256, 256, 1, 4096, 288, 288, 4128, 4128]
    - [82, 11.804]
  - - [256, 256, 1, 8192, 288, 288, 8224, 8224]
    - [69, 13.308]
  - - [256, 512, 1, 64, 288, 288, 96, 512]
    - [89, 1.371]
  - - [256, 512, 1, 128, 288, 288, 160, 512]
    - [67, 2.582]
  - - [256, 512, 1, 256, 288, 288, 288, 512]
    - [85, 4.647]
  - - [256, 512, 1, 512, 288, 288, 544, 544]
    - [72, 7.888]
  - - [256, 512, 1, 1024, 288, 288, 1056, 1056]
    - [75, 11.897]
  - - [256, 512, 1, 2048, 288, 288, 2080, 2080]
    - [79, 15.848]
  - - [256, 512, 1, 4096, 288, 288, 4128, 4128]
    - [66, 18.843]
  - - [256, 512, 1, 8192, 288, 288, 8224, 8224]
    - [79, 21.166]
  - - [256, 1024, 1, 64, 288, 288, 96, 1024]
    - [107, 2.643]
  - - [256, 1024, 1, 128, 288, 288, 160, 1024]
    - [122, 4.927]
  - - [256, 1024, 1, 256, 288, 288, 288, 1024]
    - [117, 8.58]
  - - [256, 1024, 1, 512, 288, 288, 544, 1024]
    - [110, 13.744]
  - - [256, 1024, 1, 1024, 288, 288, 1056, 1056]
    - [110, 19.704]
  - - [256, 1024, 1, 2048, 288, 288, 2080, 2080]
    - [111, 25.034]
  - - [256, 1024, 1, 4096, 288, 288, 4128, 4128]
    - [111, 28.486]
  - - [256, 1024, 1, 8192, 288, 288, 8224, 8224]
    - [110, 29.852]
  - - [256, 2048, 1, 64, 288, 288, 96, 2048]
    - [16, 5.044]
  - - [256, 2048, 1, 128, 288, 288, 160, 2048]
    - [119, 9.178]
  - - [256, 2048, 1, 256, 288, 288, 288, 2048]
    - [6, 15.419]
  - - [256, 2048, 1, 512, 288, 288, 544, 2048]
    - [94, 22.468]
  - - [256, 2048, 1, 1024, 288, 288, 1056, 2048]
    - [99, 31.889]
  - - [256, 2048, 1, 2048, 288, 288, 2080, 2080]
    - [102, 37.342]
  - - [256, 2048, 1, 4096, 288, 288, 4128, 4128]
    - [98, 42.614]
  - - [256, 2048, 1, 8192, 288, 288, 8224, 8224]
    - [13, 44.082]
  - - [256, 4096, 1, 64, 288, 288, 96, 4096]
    - [11, 8.723]
  - - [256, 4096, 1, 128, 288, 288, 160, 4096]
    - [36, 15.114]
  - - [256, 4096, 1, 256, 288, 288, 288, 4096]
    - [45, 24.147]
  - - [256, 4096, 1, 512, 288, 288, 544, 4096]
    - [23, 34.758]
  - - [256, 4096, 1, 1024, 288, 288, 1056, 4096]
    - [36, 44.154]
  - - [256, 4096, 1, 2048, 288, 288, 2080, 4096]
    - [36, 50.375]
  - - [256, 4096, 1, 4096, 288, 288, 4128, 4128]
    - [62, 53.05]
  - - [256, 4096, 1, 8192, 288, 288, 8224, 8224]
    - [121, 45.438]
  - - [256, 8192, 1, 64, 288, 288, 96, 8192]
    - [7, 14.707]
  - - [256, 8192, 1, 128, 288, 288, 160, 8192]
    - [25, 24.682]
  - - [256, 8192, 1, 256, 288, 288, 288, 8192]
    - [47, 36.554]
  - - [256, 8192, 1, 512, 288, 288, 544, 8192]
    - [25, 48.545]
  - - [256, 8192, 1, 1024, 288, 288, 1056, 8192]
    - [47, 58.082]
  - - [256, 8192, 1, 2048, 288, 288, 2080, 8192]
    - [25, 62.163]
  - - [256, 8192, 1, 4096, 288, 288, 4128, 8192]
    - [47, 65.393]
  - - [256, 8192, 1, 8192, 288, 288, 8224, 8224]
    - [65, 64.467]
  - - [384, 64, 1, 64, 416, 416, 96, 96]
    - [0, 0.268]
  - - [384, 64, 1, 128, 416, 416, 160, 160]
    - [69, 0.512]
  - - [384, 64, 1, 256, 416, 416, 288, 288]
    - [88, 0.955]
  - - [384, 64, 1, 512, 416, 416, 544, 544]
    - [77, 1.685]
  - - [384, 64, 1, 1024, 416, 416, 1056, 1056]
    - [76, 2.712]
  - - [384, 64, 1, 2048, 416, 416, 2080, 2080]
    - [73, 3.898]
  - - [384, 64, 1, 4096, 416, 416, 4128, 4128]
    - [90, 4.975]
  - - [384, 64, 1, 8192, 416, 416, 8224, 8224]
    - [68, 5.648]
  - - [384, 128, 1, 64, 416, 416, 96, 128]
    - [73, 0.534]
  - - [384, 128, 1, 128, 416, 416, 160, 160]
    - [88, 1.034]
  - - [384, 128, 1, 256, 416, 416, 288, 288]
    - [87, 1.91]
  - - [384, 128, 1, 512, 416, 416, 544, 544]
    - [90, 3.366]
  - - [384, 128, 1, 1024, 416, 416, 1056, 1056]
    - [77, 5.427]
  - - [384, 128, 1, 2048, 416, 416, 2080, 2080]
    - [73, 7.795]
  - - [384, 128, 1, 4096, 416, 416, 4128, 4128]
    - [73, 9.959]
  - - [384, 128, 1, 8192, 416, 416, 8224, 8224]
    - [87, 11.471]
  - - [384, 256, 1, 64, 416, 416, 96, 256]
    - [67, 1.056]
  - - [384, 256, 1, 128, 416, 416, 160, 256]
    - [90, 2.021]
  - - [384, 256, 1, 256, 416, 416, 288, 288]
    - [88, 3.69]
  - - [384, 256, 1, 512, 416, 416, 544, 544]
    - [69, 6.383]
  - - [384, 256, 1, 1024, 416, 416, 1056, 1056]
    - [76, 10.076]
  - - [384, 256, 1, 2048, 416, 416, 2080, 2080]
    - [70, 14.041]
  - - [384, 256, 1, 4096, 416, 416, 4128, 4128]
    - [88, 17.532]
  - - [384, 256, 1, 8192, 416, 416, 8224, 8224]
    - [68, 19.757]
  - - [384, 512, 1, 64, 416, 416, 96, 512]
    - [126, 2.034]
  - - [384, 512, 1, 128, 416, 416, 160, 512]
    - [117, 3.836]
  - - [384, 512, 1, 256, 416, 416, 288, 512]
    - [96, 6.827]
  - - [384, 512, 1, 512, 416, 416, 544, 544]
    - [96, 11.229]
  - - [384, 512, 1, 1024, 416, 416, 1056, 1056]
    - [126, 16.216]
  - - [384, 512, 1, 2048, 416, 416, 2080, 2080]
    - [127, 21.658]
  - - [384, 512, 1, 4096, 416, 416, 4128, 4128]
    - [100, 25.212]
  - - [384, 512, 1, 8192, 416, 416, 8224, 8224]
    - [107, 27.905]
  - - [384, 1024, 1, 64, 416, 416, 96, 1024]
    - [16, 3.973]
  - - [384, 1024, 1, 128, 416, 416, 160, 1024]
    - [96, 7.336]
  - - [384, 1024, 1, 256, 416, 416, 288, 1024]
    - [107, 12.839]
  - - [384, 1024, 1, 512, 416, 416, 544, 1024]
    - [117, 20.426]
  - - [384, 1024, 1, 1024, 416, 416, 1056, 1056]
    - [95, 29.073]
  - - [384, 1024, 1, 2048, 416, 416, 2080, 2080]
    - [112, 37.013]
  - - [384, 1024, 1, 4096, 416, 416, 4128, 4128]
    - [92, 42.523]
  - - [384, 1024, 1, 8192, 416, 416, 8224, 8224]
    - [120, 43.402]
  - - [384, 2048, 1, 64, 416, 416, 96, 2048]
    - [117, 7.21]
  - - [384, 2048, 1, 128, 416, 416, 160, 2048]
    - [119, 12.816]
  - - [384, 2048, 1, 256, 416, 416, 288, 2048]
    - [99, 20.725]
  - - [384, 2048, 1, 512, 416, 416, 544, 2048]
    - [124, 30.336]
  - - [384, 2048, 1, 1024, 416, 416, 1056, 2048]
    - [109, 39.436]
  - - [384, 2048, 1, 2048, 416, 416, 2080, 2080]
    - [98, 46.034]
  - - [384, 2048, 1, 4096, 416, 416, 4128, 4128]
    - [118, 50.552]
  - - [384, 2048, 1, 8192, 416, 416, 8224, 8224]
    - [119, 51.745]
  - - [384, 4096, 1, 64, 416, 416, 96, 4096]
    - [28, 11.892]
  - - [384, 4096, 1, 128, 416, 416, 160, 4096]
    - [36, 21.121]
  - - [384, 4096, 1, 256, 416, 416, 288, 4096]
    - [36, 34.415]
  - - [384, 4096, 1, 512, 416, 416, 544, 4096]
    - [36, 49.947]
  - - [384, 4096, 1, 1024, 416, 416, 1056, 4096]
    - [30, 64.3]
  - - [384, 4096, 1, 2048, 416, 416, 2080, 4096]
    - [23, 73.993]
  - - [384, 4096, 1, 4096, 416, 416, 4128, 4128]
    - [29, 76.27]
  - - [384, 4096, 1, 8192, 416, 416, 8224, 8224]
    - [63, 56.658]
  - - [384, 8192, 1, 64, 416, 416, 96, 8192]
    - [101, 19.416]
  - - [384, 8192, 1, 128, 416, 416, 160, 8192]
    - [43, 33.474]
  - - [384, 8192, 1, 256, 416, 416, 288, 8192]
    - [22, 47.993]
  - - [384, 8192, 1, 512, 416, 416, 544, 8192]
    - [41, 60.722]
  - - [384, 8192, 1, 1024, 416, 416, 1056, 8192]
    - [22, 70.038]
  - - [384, 8192, 1, 2048, 416, 416, 2080, 8192]
    - [38, 72.011]
  - - [384, 8192, 1, 4096, 416, 416, 4128, 8192]
    - [56, 75.824]
  - - [384, 8192, 1, 8192, 416, 416, 8224, 8224]
    - [47, 65.131]
  - - [768, 64, 1, 64, 800, 800, 96, 96]
    - [0, 0.514]
  - - [768, 64, 1, 128, 800, 800, 160, 160]
    - [87, 1.021]
  - - [768, 64, 1, 256, 800, 800, 288, 288]
    - [77, 1.92]
  - - [768, 64, 1, 512, 800, 800, 544, 544]
    - [83, 3.363]
  - - [768, 64, 1, 1024, 800, 800, 1056, 1056]
    - [90, 5.423]
  - - [768, 64, 1, 2048, 800, 800, 2080, 2080]
    - [69, 7.784]
  - - [768, 64, 1, 4096, 800, 800, 4128, 4128]
    - [69, 9.916]
  - - [768, 64, 1, 8192, 800, 800, 8224, 8224]
    - [82, 11.333]
  - - [768, 128, 1, 64, 800, 800, 96, 128]
    - [81, 1.052]
  - - [768, 128, 1, 128, 800, 800, 160, 160]
    - [88, 2.021]
  - - [768, 128, 1, 256, 800, 800, 288, 288]
    - [88, 3.696]
  - - [768, 128, 1, 512, 800, 800, 544, 544]
    - [83, 6.431]
  - - [768, 128, 1, 1024, 800, 800, 1056, 1056]
    - [70, 10.079]
  - - [768, 128, 1, 2048, 800, 800, 2080, 2080]
    - [70, 14.056]
  - - [768, 128, 1, 4096, 800, 800, 4128, 4128]
    - [69, 17.521]
  - - [768, 128, 1, 8192, 800, 800, 8224, 8224]
    - [69, 19.814]
  - - [768, 256, 1, 64, 800, 800, 96, 256]
    - [105, 2.031]
  - - [768, 256, 1, 128, 800, 800, 160, 256]
    - [100, 3.814]
  - - [768, 256, 1, 256, 800, 800, 288, 288]
    - [115, 6.832]
  - - [768, 256, 1, 512, 800, 800, 544, 544]
    - [117, 11.24]
  - - [768, 256, 1, 1024, 800, 800, 1056, 1056]
    - [95, 16.589]
  - - [768, 256, 1, 2048, 800, 800, 2080, 2080]
    - [95, 21.654]
  - - [768, 256, 1, 4096, 800, 800, 4128, 4128]
    - [126, 25.077]
  - - [768, 256, 1, 8192, 800, 800, 8224, 8224]
    - [94, 28.02]
  - - [768, 512, 1, 64, 800, 800, 96, 512]
    - [12, 3.938]
  - - [768, 512, 1, 128, 800, 800, 160, 512]
    - [101, 7.309]
  - - [768, 512, 1, 256, 800, 800, 288, 512]
    - [95, 12.71]
  - - [768, 512, 1, 512, 800, 800, 544, 544]
    - [16, 19.85]
  - - [768, 512, 1, 1024, 800, 800, 1056, 1056]
    - [117, 29.106]
  - - [768, 512, 1, 2048, 800, 800, 2080, 2080]
    - [116, 36.781]
  - - [768, 512, 1, 4096, 800, 800, 4128, 4128]
    - [122, 41.663]
  - - [768, 512, 1, 8192, 800, 800, 8224, 8224]
    - [127, 43.31]
  - - [768, 1024, 1, 64, 800, 800, 96, 1024]
    - [8, 7.241]
  - - [768, 1024, 1, 128, 800, 800, 160, 1024]
    - [14, 12.743]
  - - [768, 1024, 1, 256, 800, 800, 288, 1024]
    - [119, 20.859]
  - - [768, 1024, 1, 512, 800, 800, 544, 1024]
    - [119, 30.442]
  - - [768, 1024, 1, 1024, 800, 800, 1056, 1056]
    - [99, 39.436]
  - - [768, 1024, 1, 2048, 800, 800, 2080, 2080]
    - [109, 45.768]
  - - [768, 1024, 1, 4096, 800, 800, 4128, 4128]
    - [98, 50.305]
  - - [768, 1024, 1, 8192, 800, 800, 8224, 8224]
    - [118, 51.79]
  - - [768, 2048, 1, 64, 800, 800, 96, 2048]
    - [60, 11.814]
  - - [768, 2048, 1, 128, 800, 800, 160, 2048]
    - [26, 20.725]
  - - [768, 2048, 1, 256, 800, 800, 288, 2048]
    - [50, 33.567]
  - - [768, 2048, 1, 512, 800, 800, 544, 2048]
    - [44, 49.264]
  - - [768, 2048, 1, 1024, 800, 800, 1056, 2048]
    - [53, 60.247]
  - - [768, 2048, 1, 2048, 800, 800, 2080, 2080]
    - [61, 72.472]
  - - [768, 2048, 1, 4096, 800, 800, 4128, 4128]
    - [43, 71.186]
  - - [768, 2048, 1, 8192, 800, 800, 8224, 8224]
    - [44, 80.146]
  - - [768, 4096, 1, 64, 800, 800, 96, 4096]
    - [52, 19.212]
  - - [768, 4096, 1, 128, 800, 800, 160, 4096]
    - [43, 33.599]
  - - [768, 4096, 1, 256, 800, 800, 288, 4096]
    - [50, 48.329]
  - - [768, 4096, 1, 512, 800, 800, 544, 4096]
    - [22, 61.354]
  - - [768, 4096, 1, 1024, 800, 800, 1056, 4096]
    - [20, 70.417]
  - - [768, 4096, 1, 2048, 800, 800, 2080, 4096]
    - [20, 72.79]
  - - [768, 4096, 1, 4096, 800, 800, 4128, 4128]
    - [43, 77.287]
  - - [768, 4096, 1, 8192, 800, 800, 8224, 8224]
    - [57, 61.024]
  - - [768, 8192, 1, 64, 800, 800, 96, 8192]
    - [60, 29.78]
  - - [768, 8192, 1, 128, 800, 800, 160, 8192]
    - [39, 44.557]
  - - [768, 8192, 1, 256, 800, 800, 288, 8192]
    - [22, 61.235]
  - - [768, 8192, 1, 512, 800, 800, 544, 8192]
    - [22, 72.251]
  - - [768, 8192, 1, 1024, 800, 800, 1056, 8192]
    - [22, 76.393]
  - - [768, 8192, 1, 2048, 800, 800, 2080, 8192]
    - [39, 80.369]
  - - [768, 8192, 1, 4096, 800, 800, 4128, 8192]
    - [42, 74.354]
  - - [768, 8192, 1, 8192, 800, 800, 8224, 8224]
    - [40, 62.74]
  - - [1536, 64, 1, 64, 1568, 1568, 96, 96]
    - [90, 0.993]
  - - [1536, 64, 1, 128, 1568, 1568, 160, 160]
    - [70, 2.016]
  - - [1536, 64, 1, 256, 1568, 1568, 288, 288]
    - [88, 3.731]
  - - [1536, 64, 1, 512, 1568, 1568, 544, 544]
    - [69, 6.392]
  - - [1536, 64, 1, 1024, 1568, 1568, 1056, 1056]
    - [70, 10.118]
  - - [1536, 64, 1, 2048, 1568, 1568, 2080, 2080]
    - [77, 14.027]
  - - [1536, 64, 1, 4096, 1568, 1568, 4128, 4128]
    - [69, 17.554]
  - - [1536, 64, 1, 8192, 1568, 1568, 8224, 8224]
    - [81, 19.78]
  - - [1536, 128, 1, 64, 1568, 1568, 96, 128]
    - [117, 2.035]
  - - [1536, 128, 1, 128, 1568, 1568, 160, 160]
    - [122, 3.825]
  - - [1536, 128, 1, 256, 1568, 1568, 288, 288]
    - [101, 6.817]
  - - [1536, 128, 1, 512, 1568, 1568, 544, 544]
    - [107, 11.221]
  - - [1536, 128, 1, 1024, 1568, 1568, 1056, 1056]
    - [96, 16.572]
  - - [1536, 128, 1, 2048, 1568, 1568, 2080, 2080]
    - [96, 21.662]
  - - [1536, 128, 1, 4096, 1568, 1568, 4128, 4128]
    - [94, 25.289]
  - - [1536, 128, 1, 8192, 1568, 1568, 8224, 8224]
    - [106, 28.001]
  - - [1536, 256, 1, 64, 1568, 1568, 96, 256]
    - [128, 3.933]
  - - [1536, 256, 1, 128, 1568, 1568, 160, 256]
    - [113, 7.29]
  - - [1536, 256, 1, 256, 1568, 1568, 288, 288]
    - [107, 12.684]
  - - [1536, 256, 1, 512, 1568, 1568, 544, 544]
    - [107, 20.446]
  - - [1536, 256, 1, 1024, 1568, 1568, 1056, 1056]
    - [96, 29.042]
  - - [1536, 256, 1, 2048, 1568, 1568, 2080, 2080]
    - [94, 36.802]
  - - [1536, 256, 1, 4096, 1568, 1568, 4128, 4128]
    - [106, 41.52]
  - - [1536, 256, 1, 8192, 1568, 1568, 8224, 8224]
    - [106, 43.315]
  - - [1536, 512, 1, 64, 1568, 1568, 96, 512]
    - [101, 7.207]
  - - [1536, 512, 1, 128, 1568, 1568, 160, 512]
    - [129, 12.664]
  - - [1536, 512, 1, 256, 1568, 1568, 288, 512]
    - [109, 20.811]
  - - [1536, 512, 1, 512, 1568, 1568, 544, 544]
    - [103, 30.107]
  - - [1536, 512, 1, 1024, 1568, 1568, 1056, 1056]
    - [98, 39.298]
  - - [1536, 512, 1, 2048, 1568, 1568, 2080, 2080]
    - [98, 46.095]
  - - [1536, 512, 1, 4096, 1568, 1568, 4128, 4128]
    - [99, 50.341]
  - - [1536, 512, 1, 8192, 1568, 1568, 8224, 8224]
    - [123, 51.407]
  - - [1536, 1024, 1, 64, 1568, 1568, 96, 1024]
    - [17, 11.693]
  - - [1536, 1024, 1, 128, 1568, 1568, 160, 1024]
    - [62, 20.671]
  - - [1536, 1024, 1, 256, 1568, 1568, 288, 1024]
    - [62, 33.635]
  - - [1536, 1024, 1, 512, 1568, 1568, 544, 1024]
    - [46, 49.632]
  - - [1536, 1024, 1, 1024, 1568, 1568, 1056, 1056]
    - [46, 64.383]
  - - [1536, 1024, 1, 2048, 1568, 1568, 2080, 2080]
    - [46, 74.639]
  - - [1536, 1024, 1, 4096, 1568, 1568, 4128, 4128]
    - [64, 77.763]
  - - [1536, 1024, 1, 8192, 1568, 1568, 8224, 8224]
    - [64, 83.527]
  - - [1536, 2048, 1, 64, 1568, 1568, 96, 2048]
    - [96, 19.512]
  - - [1536, 2048, 1, 128, 1568, 1568, 160, 2048]
    - [60, 33.483]
  - - [1536, 2048, 1, 256, 1568, 1568, 288, 2048]
    - [22, 48.218]
  - - [1536, 2048, 1, 512, 1568, 1568, 544, 2048]
    - [60, 62.125]
  - - [1536, 2048, 1, 1024, 1568, 1568, 1056, 2048]
    - [43, 71.827]
  - - [1536, 2048, 1, 2048, 1568, 1568, 2080, 2080]
    - [22, 74.835]
  - - [1536, 2048, 1, 4096, 1568, 1568, 4128, 4128]
    - [60, 76.353]
  - - [1536, 2048, 1, 8192, 1568, 1568, 8224, 8224]
    - [22, 71.546]
  - - [1536, 4096, 1, 64, 1568, 1568, 96, 4096]
    - [28, 29.395]
  - - [1536, 4096, 1, 128, 1568, 1568, 160, 4096]
    - [18, 44.596]
  - - [1536, 4096, 1, 256, 1568, 1568, 288, 4096]
    - [22, 61.012]
  - - [1536, 4096, 1, 512, 1568, 1568, 544, 4096]
    - [22, 72.524]
  - - [1536, 4096, 1, 1024, 1568, 1568, 1056, 4096]
    - [22, 76.634]
  - - [1536, 4096, 1, 2048, 1568, 1568, 2080, 4096]
    - [32, 80.057]
  - - [1536, 4096, 1, 4096, 1568, 1568, 4128, 4128]
    - [35, 74.081]
  - - [1536, 4096, 1, 8192, 1568, 1568, 8224, 8224]
    - [40, 66.12]
  - - [1536, 8192, 1, 64, 1568, 1568, 96, 8192]
    - [47, 39.729]
  - - [1536, 8192, 1, 128, 1568, 1568, 160, 8192]
    - [65, 56.147]
  - - [1536, 8192, 1, 256, 1568, 1568, 288, 8192]
    - [41, 70.165]
  - - [1536, 8192, 1, 512, 1568, 1568, 544, 8192]
    - [22, 77.227]
  - - [1536, 8192, 1, 1024, 1568, 1568, 1056, 8192]
    - [22, 83.58]
  - - [1536, 8192, 1, 2048, 1568, 1568, 2080, 8192]
    - [22, 72.747]
  - - [1536, 8192, 1, 4096, 1568, 1568, 4128, 8192]
    - [22, 67.406]
  - - [1536, 8192, 1, 8192, 1568, 1568, 8224, 8224]
    - [52, 66.268]
  - - [3072, 64, 1, 64, 3104, 3104, 96, 96]
    - [80, 1.937]
  - - [3072, 64, 1, 128, 3104, 3104, 160, 160]
    - [101, 3.767]
  - - [3072, 64, 1, 256, 3104, 3104, 288, 288]
    - [115, 6.82]
  - - [3072, 64, 1, 512, 3104, 3104, 544, 544]
    - [107, 11.173]
  - - [3072, 64, 1, 1024, 3104, 3104, 1056, 1056]
    - [96, 16.537]
  - - [3072, 64, 1, 2048, 3104, 3104, 2080, 2080]
    - [116, 21.603]
  - - [3072, 64, 1, 4096, 3104, 3104, 4128, 4128]
    - [116, 25.282]
  - - [3072, 64, 1, 8192, 3104, 3104, 8224, 8224]
    - [93, 28.003]
  - - [3072, 128, 1, 64, 3104, 3104, 96, 128]
    - [100, 3.904]
  - - [3072, 128, 1, 128, 3104, 3104, 160, 160]
    - [92, 7.282]
  - - [3072, 128, 1, 256, 3104, 3104, 288, 288]
    - [96, 12.71]
  - - [3072, 128, 1, 512, 3104, 3104, 544, 544]
    - [117, 20.459]
  - - [3072, 128, 1, 1024, 3104, 3104, 1056, 1056]
    - [96, 29.069]
  - - [3072, 128, 1, 2048, 3104, 3104, 2080, 2080]
    - [95, 36.816]
  - - [3072, 128, 1, 4096, 3104, 3104, 4128, 4128]
    - [93, 41.477]
  - - [3072, 128, 1, 8192, 3104, 3104, 8224, 8224]
    - [116, 43.457]
  - - [3072, 256, 1, 64, 3104, 3104, 96, 256]
    - [101, 7.195]
  - - [3072, 256, 1, 128, 3104, 3104, 160, 256]
    - [10, 12.687]
  - - [3072, 256, 1, 256, 3104, 3104, 288, 288]
    - [124, 20.705]
  - - [3072, 256, 1, 512, 3104, 3104, 544, 544]
    - [109, 30.187]
  - - [3072, 256, 1, 1024, 3104, 3104, 1056, 1056]
    - [99, 39.437]
  - - [3072, 256, 1, 2048, 3104, 3104, 2080, 2080]
    - [99, 45.731]
  - - [3072, 256, 1, 4096, 3104, 3104, 4128, 4128]
    - [102, 50.062]
  - - [3072, 256, 1, 8192, 3104, 3104, 8224, 8224]
    - [119, 51.418]
  - - [3072, 512, 1, 64, 3104, 3104, 96, 512]
    - [31, 11.774]
  - - [3072, 512, 1, 128, 3104, 3104, 160, 512]
    - [37, 20.893]
  - - [3072, 512, 1, 256, 3104, 3104, 288, 512]
    - [23, 34.378]
  - - [3072, 512, 1, 512, 3104, 3104, 544, 544]
    - [24, 49.868]
  - - [3072, 512, 1, 1024, 3104, 3104, 1056, 1056]
    - [24, 64.26]
  - - [3072, 512, 1, 2048, 3104, 3104, 2080, 2080]
    - [23, 74.069]
  - - [3072, 512, 1, 4096, 3104, 3104, 4128, 4128]
    - [23, 77.815]
  - - [3072, 512, 1, 8192, 3104, 3104, 8224, 8224]
    - [64, 83.159]
  - - [3072, 1024, 1, 64, 3104, 3104, 96, 1024]
    - [101, 19.603]
  - - [3072, 1024, 1, 128, 3104, 3104, 160, 1024]
    - [35, 33.465]
  - - [3072, 1024, 1, 256, 3104, 3104, 288, 1024]
    - [58, 48.093]
  - - [3072, 1024, 1, 512, 3104, 3104, 544, 1024]
    - [60, 61.996]
  - - [3072, 1024, 1, 1024, 3104, 3104, 1056, 1056]
    - [22, 71.666]
  - - [3072, 1024, 1, 2048, 3104, 3104, 2080, 2080]
    - [22, 74.736]
  - - [3072, 1024, 1, 4096, 3104, 3104, 4128, 4128]
    - [50, 75.965]
  - - [3072, 1024, 1, 8192, 3104, 3104, 8224, 8224]
    - [22, 70.155]
  - - [3072, 2048, 1, 64, 3104, 3104, 96, 2048]
    - [34, 29.419]
  - - [3072, 2048, 1, 128, 3104, 3104, 160, 2048]
    - [47, 44.082]
  - - [3072, 2048, 1, 256, 3104, 3104, 288, 2048]
    - [22, 60.446]
  - - [3072, 2048, 1, 512, 3104, 3104, 544, 2048]
    - [22, 72.731]
  - - [3072, 2048, 1, 1024, 3104, 3104, 1056, 2048]
    - [43, 76.639]
  - - [3072, 2048, 1, 2048, 3104, 3104, 2080, 2080]
    - [20, 80.92]
  - - [3072, 2048, 1, 4096, 3104, 3104, 4128, 4128]
    - [33, 72.268]
  - - [3072, 2048, 1, 8192, 3104, 3104, 8224, 8224]
    - [43, 67.465]
  - - [3072, 4096, 1, 64, 3104, 3104, 96, 4096]
    - [65, 39.691]
  - - [3072, 4096, 1, 128, 3104, 3104, 160, 4096]
    - [65, 55.62]
  - - [3072, 4096, 1, 256, 3104, 3104, 288, 4096]
    - [22, 70.395]
  - - [3072, 4096, 1, 512, 3104, 3104, 544, 4096]
    - [43, 76.529]
  - - [3072, 4096, 1, 1024, 3104, 3104, 1056, 4096]
    - [59, 80.799]
  - - [3072, 4096, 1, 2048, 3104, 3104, 2080, 4096]
    - [42, 73.143]
  - - [3072, 4096, 1, 4096, 3104, 3104, 4128, 4128]
    - [48, 72.851]
  - - [3072, 4096, 1, 8192, 3104, 3104, 8224, 8224]
    - [43, 67.418]
  - - [3072, 8192, 1, 64, 3104, 3104, 96, 8192]
    - [38, 49.523]
  - - [3072, 8192, 1, 128, 3104, 3104, 160, 8192]
    - [65, 64.776]
  - - [3072, 8192, 1, 256, 3104, 3104, 288, 8192]
    - [43, 74.321]
  - - [3072, 8192, 1, 512, 3104, 3104, 544, 8192]
    - [22, 82.394]
  - - [3072, 8192, 1, 1024, 3104, 3104, 1056, 8192]
    - [59, 71.952]
  - - [3072, 8192, 1, 2048, 3104, 3104, 2080, 8192]
    - [42, 68.646]
  - - [3072, 8192, 1, 4096, 3104, 3104, 4128, 8192]
    - [49, 67.996]
  - - [3072, 8192, 1, 8192, 3104, 3104, 8224, 8224]
    - [43, 68.244]
  - - [6144, 64, 1, 64, 6176, 6176, 96, 96]
    - [120, 3.669]
  - - [6144, 64, 1, 128, 6176, 6176, 160, 160]
    - [9, 7.174]
  - - [6144, 64, 1, 256, 6176, 6176, 288, 288]
    - [107, 12.58]
  - - [6144, 64, 1, 512, 6176, 6176, 544, 544]
    - [96, 20.216]
  - - [6144, 64, 1, 1024, 6176, 6176, 1056, 1056]
    - [94, 28.949]
  - - [6144, 64, 1, 2048, 6176, 6176, 2080, 2080]
    - [117, 36.786]
  - - [6144, 64, 1, 4096, 6176, 6176, 4128, 4128]
    - [104, 42.092]
  - - [6144, 64, 1, 8192, 6176, 6176, 8224, 8224]
    - [117, 43.226]
  - - [6144, 128, 1, 64, 6176, 6176, 96, 128]
    - [119, 6.806]
  - - [6144, 128, 1, 128, 6176, 6176, 160, 160]
    - [8, 12.659]
  - - [6144, 128, 1, 256, 6176, 6176, 288, 288]
    - [99, 20.701]
  - - [6144, 128, 1, 512, 6176, 6176, 544, 544]
    - [99, 30.097]
  - - [6144, 128, 1, 1024, 6176, 6176, 1056, 1056]
    - [97, 39.13]
  - - [6144, 128, 1, 2048, 6176, 6176, 2080, 2080]
    - [118, 45.686]
  - - [6144, 128, 1, 4096, 6176, 6176, 4128, 4128]
    - [124, 49.738]
  - - [6144, 128, 1, 8192, 6176, 6176, 8224, 8224]
    - [95, 50.521]
  - - [6144, 256, 1, 64, 6176, 6176, 96, 256]
    - [16, 12.093]
  - - [6144, 256, 1, 128, 6176, 6176, 160, 256]
    - [23, 21.547]
  - - [6144, 256, 1, 256, 6176, 6176, 288, 288]
    - [23, 34.647]
  - - [6144, 256, 1, 512, 6176, 6176, 544, 544]
    - [45, 50.502]
  - - [6144, 256, 1, 1024, 6176, 6176, 1056, 1056]
    - [45, 64.821]
  - - [6144, 256, 1, 2048, 6176, 6176, 2080, 2080]
    - [45, 74.176]
  - - [6144, 256, 1, 4096, 6176, 6176, 4128, 4128]
    - [23, 77.793]
  - - [6144, 256, 1, 8192, 6176, 6176, 8224, 8224]
    - [52, 60.907]
  - - [6144, 512, 1, 64, 6176, 6176, 96, 512]
    - [21, 17.331]
  - - [6144, 512, 1, 128, 6176, 6176, 160, 512]
    - [58, 33.332]
  - - [6144, 512, 1, 256, 6176, 6176, 288, 512]
    - [22, 48.167]
  - - [6144, 512, 1, 512, 6176, 6176, 544, 544]
    - [41, 61.912]
  - - [6144, 512, 1, 1024, 6176, 6176, 1056, 1056]
    - [22, 71.796]
  - - [6144, 512, 1, 2048, 6176, 6176, 2080, 2080]
    - [41, 74.55]
  - - [6144, 512, 1, 4096, 6176, 6176, 4128, 4128]
    - [40, 77.331]
  - - [6144, 512, 1, 8192, 6176, 6176, 8224, 8224]
    - [21, 67.877]
  - - [6144, 1024, 1, 64, 6176, 6176, 96, 1024]
    - [34, 29.113]
  - - [6144, 1024, 1, 128, 6176, 6176, 160, 1024]
    - [43, 43.928]
  - - [6144, 1024, 1, 256, 6176, 6176, 288, 1024]
    - [22, 60.708]
  - - [6144, 1024, 1, 512, 6176, 6176, 544, 1024]
    - [22, 72.519]
  - - [6144, 1024, 1, 1024, 6176, 6176, 1056, 1056]
    - [22, 76.761]
  - - [6144, 1024, 1, 2048, 6176, 6176, 2080, 2080]
    - [40, 81.088]
  - - [6144, 1024, 1, 4096, 6176, 6176, 4128, 4128]
    - [27, 75.889]
  - - [6144, 1024, 1, 8192, 6176, 6176, 8224, 8224]
    - [51, 65.293]
  - - [6144, 2048, 1, 64, 6176, 6176, 96, 2048]
    - [34, 39.067]
  - - [6144, 2048, 1, 128, 6176, 6176, 160, 2048]
    - [43, 55.617]
  - - [6144, 2048, 1, 256, 6176, 6176, 288, 2048]
    - [22, 70.756]
  - - [6144, 2048, 1, 512, 6176, 6176, 544, 2048]
    - [43, 76.768]
  - - [6144, 2048, 1, 1024, 6176, 6176, 1056, 2048]
    - [22, 83.506]
  - - [6144, 2048, 1, 2048, 6176, 6176, 2080, 2080]
    - [50, 72.907]
  - - [6144, 2048, 1, 4096, 6176, 6176, 4128, 4128]
    - [59, 69.859]
  - - [6144, 2048, 1, 8192, 6176, 6176, 8224, 8224]
    - [43, 65.281]
  - - [6144, 4096, 1, 64, 6176, 6176, 96, 4096]
    - [25, 48.436]
  - - [6144, 4096, 1, 128, 6176, 6176, 160, 4096]
    - [38, 64.674]
  - - [6144, 4096, 1, 256, 6176, 6176, 288, 4096]
    - [43, 73.977]
  - - [6144, 4096, 1, 512, 6176, 6176, 544, 4096]
    - [43, 81.092]
  - - [6144, 4096, 1, 1024, 6176, 6176, 1056, 4096]
    - [47, 74.661]
  - - [6144, 4096, 1, 2048, 6176, 6176, 2080, 4096]
    - [19, 69.196]
  - - [6144, 4096, 1, 4096, 6176, 6176, 4128, 4128]
    - [60, 69.996]
  - - [6144, 4096, 1, 8192, 6176, 6176, 8224, 8224]
    - [60, 67.482]
  - - [6144, 8192, 1, 64, 6176, 6176, 96, 8192]
    - [55, 49.556]
  - - [6144, 8192, 1, 128, 6176, 6176, 160, 8192]
    - [43, 66.485]
  - - [6144, 8192, 1, 256, 6176, 6176, 288, 8192]
    - [51, 76.204]
  - - [6144, 8192, 1, 512, 6176, 6176, 544, 8192]
    - [60, 68.447]
  - - [6144, 8192, 1, 1024, 6176, 6176, 1056, 8192]
    - [52, 65.857]
  - - [6144, 8192, 1, 2048, 6176, 6176, 2080, 8192]
    - [52, 68.451]
  - - [6144, 8192, 1, 4096, 6176, 6176, 4128, 8192]
    - [59, 68.48]
  - - [6144, 8192, 1, 8192, 6176, 6176, 8224, 8224]
    - [43, 67.656]
- null
- null
- DeviceEfficiency
