library/src/blas3/Tensile/Logic/asm_full/navi31/navi31_Cijk_Ailk_Bljk_BBS_BH_GB.yaml
- {MinimumRequiredVersion: 4.35.0}
- navi31
- gfx1100
- [Device 73bf]
    SolutionIndex: 0
    SolutionNameMin: Cijk_Ailk_Bljk_BBS_BH_MT32x32x16_MI16x16x16x1_SN_1LDSB0_AMAS0_GRVW4_IU1_LPB8_NLCA1_SIA1_SU0_SUS0_SVW1_TT1_16_VW1_WGM4
    SolutionIndex: 1
    SolutionNameMin: Cijk_Ailk_Bljk_BBS_BH_MT32x32x16_MI16x16x16x1_SN_1LDSB1_AMAS0_GRVW8_IU1_LPB8_NLCA1_SIA2_SU0_SUS0_SVW1_TT1_16_VW1_WGM4
    SolutionIndex: 2
    SolutionNameMin: Cijk_Ailk_Bljk_BBS_BH_MT32x32x16_MI16x16x16x1_SN_1LDSB1_AMAS0_GRVW4_IU1_LPB8_NLCA1_SIA2_SU32_SUS128_SVW1_TT1_16_VW1_WGM4
    SolutionIndex: 3
    SolutionNameMin: Cijk_Ailk_Bljk_BBS_BH_MT32x32x16_MI16x16x16x1_SN_1LDSB1_AMAS0_GRVW4_IU1_LPB8_NLCA1_SIA2_SU0_SUS0_SVW1_TT1_16_VW1_WGM8
    SolutionIndex: 4
    SolutionNameMin: Cijk_Ailk_Bljk_BBS_BH_MT64x64x16_MI16x16x16x1_SN_1LDSB1_AMAS3_GRVW4_IU1_LPB8_NLCA1_SIA2_SU0_SUS0_SVW2_TT2_32_VW2_WGM4
    SolutionIndex: 5
    SolutionNameMin: Cijk_Ailk_Bljk_BBS_BH_MT64x64x16_MI16x16x16x1_SN_1LDSB1_AMAS3_GRVW8_IU1_LPB8_NLCA1_SIA2_SU0_SUS0_SVW2_TT2_32_VW2_WGM4
    SolutionIndex: 6
    SolutionNameMin: Cijk_Ailk_Bljk_BBS_BH_MT64x64x16_MI16x16x16x1_SN_1LDSB1_AMAS3_GRVW8_IU1_LPB8_NLCA1_SIA2_SU32_SUS128_SVW2_TT2_32_VW2_WGM4
    SolutionIndex: 7
    SolutionNameMin: Cijk_Ailk_Bljk_BBS_BH_MT64x64x16_MI16x16x16x1_SN_1LDSB1_AMAS3_GRVW8_IU1_LPB8_NLCA1_SIA2_SU32_SUS256_SVW2_TT2_32_VW2_WGM4
    SolutionIndex: 8
    SolutionNameMin: Cijk_Ailk_Bljk_BBS_BH_MT64x64x16_MI16x16x16x1_SN_1LDSB0_AMAS3_GRVW4_IU1_LPB8_NLCA1_SIA1_SU0_SUS0_SVW2_TT2_32_VW2_WGM8
    SolutionIndex: 9
    SolutionNameMin: Cijk_Ailk_Bljk_BBS_BH_MT64x64x16_MI16x16x16x1_SN_1LDSB0_AMAS0_GRVW8_IU1_LPB8_NLCA1_SIA1_SU0_SUS0_SVW1_TT2_32_VW1_WGM8
    SolutionIndex: 10
    SolutionNameMin: Cijk_Ailk_Bljk_BBS_BH_MT64x64x16_MI16x16x16x1_SN_1LDSB0_AMAS3_GRVW8_IU1_LPB8_NLCA1_SIA1_SU0_SUS0_SVW2_TT2_32_VW2_WGM8
    SolutionIndex: 11
    SolutionNameMin: Cijk_Ailk_Bljk_BBS_BH_MT64x64x16_MI16x16x16x1_SN_1LDSB1_AMAS3_GRVW4_IU1_LPB8_NLCA1_SIA2_SU0_SUS0_SVW2_TT2_32_VW2_WGM8
    SolutionIndex: 12
    SolutionNameMin: Cijk_Ailk_Bljk_BBS_BH_MT64x64x16_MI16x16x16x1_SN_1LDSB1_AMAS3_GRVW8_IU1_LPB8_NLCA1_SIA2_SU0_SUS0_SVW2_TT2_32_VW2_WGM8
    SolutionIndex: 13
    SolutionNameMin: Cijk_Ailk_Bljk_BBS_BH_MT64x64x16_MI16x16x16x1_SN_1LDSB1_AMAS3_GRVW4_IU1_LPB8_NLCA1_SIA2_SU32_SUS128_SVW2_TT2_32_VW2_WGM8
    SolutionIndex: 14
    SolutionNameMin: Cijk_Ailk_Bljk_BBS_BH_MT64x64x16_MI16x16x16x1_SN_1LDSB0_AMAS3_GRVW4_IU1_LPB8_NLCA1_SIA1_SU32_SUS256_SVW2_TT2_32_VW2_WGM8
    SolutionIndex: 15
    SolutionNameMin: Cijk_Ailk_Bljk_BBS_BH_MT64x64x16_MI16x16x16x1_SN_1LDSB0_AMAS0_GRVW8_IU1_LPB8_NLCA1_SIA1_SU32_SUS256_SVW1_TT2_32_VW1_WGM8
    SolutionIndex: 16
    SolutionNameMin: Cijk_Ailk_Bljk_BBS_BH_MT64x64x16_MI16x16x16x1_SN_1LDSB0_AMAS3_GRVW8_IU1_LPB8_NLCA1_SIA1_SU32_SUS256_SVW2_TT2_32_VW2_WGM8
    SolutionIndex: 17
    SolutionNameMin: Cijk_Ailk_Bljk_BBS_BH_MT128x128x16_MI16x16x16x1_SN_1LDSB0_AMAS0_GRVW4_IU1_LPB8_NLCA1_SIA1_SU0_SUS0_SVW1_TT4_64_VW1_WGM4
    SolutionIndex: 18
    SolutionNameMin: Cijk_Ailk_Bljk_BBS_BH_MT128x128x16_MI16x16x16x1_SN_1LDSB0_AMAS3_GRVW4_IU1_LPB8_NLCA1_SIA1_SU0_SUS0_SVW4_TT4_64_VW4_WGM4
    SolutionIndex: 19
    SolutionNameMin: Cijk_Ailk_Bljk_BBS_BH_MT128x128x16_MI16x16x16x1_SN_1LDSB0_AMAS0_GRVW8_IU1_LPB16_NLCA1_SIA1_SU0_SUS0_SVW1_TT4_64_VW1_WGM4
    SolutionIndex: 20
    SolutionNameMin: Cijk_Ailk_Bljk_BBS_BH_MT128x128x16_MI16x16x16x1_SN_1LDSB0_AMAS0_GRVW8_IU1_LPB8_NLCA1_SIA1_SU0_SUS0_SVW1_TT4_64_VW1_WGM4
    SolutionIndex: 21
    SolutionNameMin: Cijk_Ailk_Bljk_BBS_BH_MT128x128x16_MI16x16x16x1_SN_1LDSB0_AMAS3_GRVW8_IU1_LPB8_NLCA1_SIA1_SU0_SUS0_SVW2_TT4_64_VW2_WGM4
    SolutionIndex: 22
    SolutionNameMin: Cijk_Ailk_Bljk_BBS_BH_MT128x128x16_MI16x16x16x1_SN_1LDSB0_AMAS3_GRVW8_IU1_LPB16_NLCA1_SIA1_SU0_SUS0_SVW4_TT4_64_VW4_WGM4
    SolutionIndex: 23
    SolutionNameMin: Cijk_Ailk_Bljk_BBS_BH_MT128x128x16_MI16x16x16x1_SN_1LDSB0_AMAS3_GRVW8_IU1_LPB8_NLCA1_SIA1_SU0_SUS0_SVW4_TT4_64_VW4_WGM4
    SolutionIndex: 24
    SolutionNameMin: Cijk_Ailk_Bljk_BBS_BH_MT128x128x16_MI16x16x16x1_SN_1LDSB1_AMAS0_GRVW4_IU1_LPB16_NLCA1_SIA2_SU0_SUS0_SVW1_TT4_64_VW1_WGM4
    SolutionIndex: 25
    SolutionNameMin: Cijk_Ailk_Bljk_BBS_BH_MT128x128x16_MI16x16x16x1_SN_1LDSB1_AMAS3_GRVW4_IU1_LPB8_NLCA1_SIA2_SU0_SUS0_SVW2_TT4_64_VW2_WGM4
    SolutionIndex: 26
    SolutionNameMin: Cijk_Ailk_Bljk_BBS_BH_MT128x128x16_MI16x16x16x1_SN_1LDSB1_AMAS3_GRVW4_IU1_LPB8_NLCA1_SIA2_SU0_SUS0_SVW4_TT4_64_VW4_WGM4
    SolutionIndex: 27
    SolutionNameMin: Cijk_Ailk_Bljk_BBS_BH_MT128x128x16_MI16x16x16x1_SN_1LDSB1_AMAS0_GRVW8_IU1_LPB16_NLCA1_SIA2_SU0_SUS0_SVW1_TT4_64_VW1_WGM4
    SolutionIndex: 28
    SolutionNameMin: Cijk_Ailk_Bljk_BBS_BH_MT128x128x16_MI16x16x16x1_SN_1LDSB1_AMAS3_GRVW8_IU1_LPB16_NLCA1_SIA2_SU0_SUS0_SVW2_TT4_64_VW2_WGM4
    SolutionIndex: 29
    SolutionNameMin: Cijk_Ailk_Bljk_BBS_BH_MT128x128x16_MI16x16x16x1_SN_1LDSB1_AMAS3_GRVW8_IU1_LPB8_NLCA1_SIA2_SU0_SUS0_SVW2_TT4_64_VW2_WGM4
    SolutionIndex: 30
    SolutionNameMin: Cijk_Ailk_Bljk_BBS_BH_MT128x128x16_MI16x16x16x1_SN_1LDSB1_AMAS3_GRVW8_IU1_LPB8_NLCA1_SIA2_SU0_SUS0_SVW4_TT4_64_VW4_WGM4
    SolutionIndex: 31
    SolutionNameMin: Cijk_Ailk_Bljk_BBS_BH_MT128x128x16_MI16x16x16x1_SN_1LDSB0_AMAS0_GRVW4_IU1_LPB16_NLCA1_SIA3_SU0_SUS0_SVW1_TT4_64_VW1_WGM4
    SolutionIndex: 32
    SolutionNameMin: Cijk_Ailk_Bljk_BBS_BH_MT128x128x16_MI16x16x16x1_SN_1LDSB0_AMAS3_GRVW8_IU1_LPB8_NLCA1_SIA3_SU0_SUS0_SVW2_TT4_64_VW2_WGM4
    SolutionIndex: 33
    SolutionNameMin: Cijk_Ailk_Bljk_BBS_BH_MT128x128x16_MI16x16x16x1_SN_1LDSB0_AMAS3_GRVW4_IU1_LPB16_NLCA1_SIA1_SU32_SUS128_SVW2_TT4_64_VW2_WGM4
    SolutionIndex: 34
    SolutionNameMin: Cijk_Ailk_Bljk_BBS_BH_MT128x128x16_MI16x16x16x1_SN_1LDSB0_AMAS3_GRVW4_IU1_LPB8_NLCA1_SIA1_SU32_SUS128_SVW2_TT4_64_VW2_WGM4
    SolutionIndex: 35
    SolutionNameMin: Cijk_Ailk_Bljk_BBS_BH_MT128x128x16_MI16x16x16x1_SN_1LDSB0_AMAS3_GRVW4_IU1_LPB8_NLCA1_SIA1_SU32_SUS128_SVW4_TT4_64_VW4_WGM4
    SolutionIndex: 36
    SolutionNameMin: Cijk_Ailk_Bljk_BBS_BH_MT128x128x16_MI16x16x16x1_SN_1LDSB0_AMAS3_GRVW8_IU1_LPB16_NLCA1_SIA1_SU32_SUS128_SVW2_TT4_64_VW2_WGM4
    SolutionIndex: 37
    SolutionNameMin: Cijk_Ailk_Bljk_BBS_BH_MT128x128x16_MI16x16x16x1_SN_1LDSB0_AMAS3_GRVW8_IU1_LPB8_NLCA1_SIA1_SU32_SUS128_SVW2_TT4_64_VW2_WGM4
    SolutionIndex: 38
    SolutionNameMin: Cijk_Ailk_Bljk_BBS_BH_MT128x128x16_MI16x16x16x1_SN_1LDSB1_AMAS0_GRVW4_IU1_LPB8_NLCA1_SIA2_SU32_SUS128_SVW1_TT4_64_VW1_WGM4
    SolutionIndex: 39
    SolutionNameMin: Cijk_Ailk_Bljk_BBS_BH_MT128x128x16_MI16x16x16x1_SN_1LDSB1_AMAS3_GRVW8_IU1_LPB8_NLCA1_SIA2_SU32_SUS128_SVW2_TT4_64_VW2_WGM4
    SolutionIndex: 40
    SolutionNameMin: Cijk_Ailk_Bljk_BBS_BH_MT128x128x16_MI16x16x16x1_SN_1LDSB1_AMAS3_GRVW8_IU1_LPB8_NLCA1_SIA2_SU32_SUS128_SVW4_TT4_64_VW4_WGM4
    SolutionIndex: 41
    SolutionNameMin: Cijk_Ailk_Bljk_BBS_BH_MT128x128x16_MI16x16x16x1_SN_1LDSB0_AMAS0_GRVW4_IU1_LPB16_NLCA1_SIA1_SU32_SUS256_SVW1_TT4_64_VW1_WGM4
    SolutionIndex: 42
    SolutionNameMin: Cijk_Ailk_Bljk_BBS_BH_MT128x128x16_MI16x16x16x1_SN_1LDSB0_AMAS0_GRVW4_IU1_LPB8_NLCA1_SIA1_SU32_SUS256_SVW1_TT4_64_VW1_WGM4
    SolutionIndex: 43
    SolutionNameMin: Cijk_Ailk_Bljk_BBS_BH_MT128x128x16_MI16x16x16x1_SN_1LDSB0_AMAS3_GRVW8_IU1_LPB16_NLCA1_SIA1_SU32_SUS256_SVW2_TT4_64_VW2_WGM4
    SolutionIndex: 44
    SolutionNameMin: Cijk_Ailk_Bljk_BBS_BH_MT128x128x16_MI16x16x16x1_SN_1LDSB0_AMAS3_GRVW8_IU1_LPB8_NLCA1_SIA1_SU32_SUS256_SVW4_TT4_64_VW4_WGM4
    SolutionIndex: 45
    SolutionNameMin: Cijk_Ailk_Bljk_BBS_BH_MT128x128x16_MI16x16x16x1_SN_1LDSB1_AMAS0_GRVW2_IU1_LPB16_NLCA2_SIA2_SU32_SUS256_SVW1_TT4_64_VW1_WGM4
    SolutionIndex: 46
    SolutionNameMin: Cijk_Ailk_Bljk_BBS_BH_MT128x128x16_MI16x16x16x1_SN_1LDSB1_AMAS0_GRVW8_IU1_LPB16_NLCA1_SIA2_SU32_SUS256_SVW1_TT4_64_VW1_WGM4
    SolutionIndex: 47
    SolutionNameMin: Cijk_Ailk_Bljk_BBS_BH_MT128x128x16_MI16x16x16x1_SN_1LDSB1_AMAS3_GRVW8_IU1_LPB16_NLCA1_SIA2_SU32_SUS256_SVW2_TT4_64_VW2_WGM4
    SolutionIndex: 48
    SolutionNameMin: Cijk_Ailk_Bljk_BBS_BH_MT128x128x16_MI16x16x16x1_SN_1LDSB1_AMAS3_GRVW8_IU1_LPB8_NLCA1_SIA2_SU32_SUS256_SVW2_TT4_64_VW2_WGM4
    SolutionIndex: 49
    SolutionNameMin: Cijk_Ailk_Bljk_BBS_BH_MT128x128x16_MI16x16x16x1_SN_1LDSB1_AMAS3_GRVW8_IU1_LPB8_NLCA1_SIA2_SU32_SUS256_SVW4_TT4_64_VW4_WGM4
    SolutionIndex: 50
    SolutionNameMin: Cijk_Ailk_Bljk_BBS_BH_MT128x128x16_MI16x16x16x1_SN_1LDSB0_AMAS3_GRVW4_IU1_LPB8_NLCA1_SIA1_SU0_SUS0_SVW2_TT4_64_VW2_WGM8
    SolutionIndex: 51
    SolutionNameMin: Cijk_Ailk_Bljk_BBS_BH_MT128x128x16_MI16x16x16x1_SN_1LDSB0_AMAS3_GRVW4_IU1_LPB8_NLCA1_SIA1_SU0_SUS0_SVW4_TT4_64_VW4_WGM8
    SolutionIndex: 52
    SolutionNameMin: Cijk_Ailk_Bljk_BBS_BH_MT128x128x16_MI16x16x16x1_SN_1LDSB0_AMAS0_GRVW8_IU1_LPB8_NLCA1_SIA1_SU0_SUS0_SVW1_TT4_64_VW1_WGM8
    SolutionIndex: 53
    SolutionNameMin: Cijk_Ailk_Bljk_BBS_BH_MT128x128x16_MI16x16x16x1_SN_1LDSB0_AMAS3_GRVW8_IU1_LPB8_NLCA1_SIA1_SU0_SUS0_SVW2_TT4_64_VW2_WGM8
    SolutionIndex: 54
    SolutionNameMin: Cijk_Ailk_Bljk_BBS_BH_MT128x128x16_MI16x16x16x1_SN_1LDSB0_AMAS3_GRVW8_IU1_LPB16_NLCA1_SIA1_SU0_SUS0_SVW4_TT4_64_VW4_WGM8
    SolutionIndex: 55
    SolutionNameMin: Cijk_Ailk_Bljk_BBS_BH_MT128x128x16_MI16x16x16x1_SN_1LDSB0_AMAS3_GRVW8_IU1_LPB8_NLCA1_SIA1_SU0_SUS0_SVW4_TT4_64_VW4_WGM8
    SolutionIndex: 56
    SolutionNameMin: Cijk_Ailk_Bljk_BBS_BH_MT128x128x16_MI16x16x16x1_SN_1LDSB1_AMAS0_GRVW4_IU1_LPB16_NLCA1_SIA2_SU0_SUS0_SVW1_TT4_64_VW1_WGM8
    SolutionIndex: 57
    SolutionNameMin: Cijk_Ailk_Bljk_BBS_BH_MT128x128x16_MI16x16x16x1_SN_1LDSB1_AMAS3_GRVW4_IU1_LPB16_NLCA1_SIA2_SU0_SUS0_SVW2_TT4_64_VW2_WGM8
    SolutionIndex: 58
    SolutionNameMin: Cijk_Ailk_Bljk_BBS_BH_MT128x128x16_MI16x16x16x1_SN_1LDSB1_AMAS3_GRVW4_IU1_LPB8_NLCA1_SIA2_SU0_SUS0_SVW2_TT4_64_VW2_WGM8
    SolutionIndex: 59
    SolutionNameMin: Cijk_Ailk_Bljk_BBS_BH_MT128x128x16_MI16x16x16x1_SN_1LDSB1_AMAS3_GRVW4_IU1_LPB16_NLCA1_SIA2_SU0_SUS0_SVW4_TT4_64_VW4_WGM8
    SolutionIndex: 60
    SolutionNameMin: Cijk_Ailk_Bljk_BBS_BH_MT128x128x16_MI16x16x16x1_SN_1LDSB1_AMAS0_GRVW8_IU1_LPB16_NLCA1_SIA2_SU0_SUS0_SVW1_TT4_64_VW1_WGM8
    SolutionIndex: 61
    SolutionNameMin: Cijk_Ailk_Bljk_BBS_BH_MT128x128x16_MI16x16x16x1_SN_1LDSB1_AMAS0_GRVW8_IU1_LPB8_NLCA1_SIA2_SU0_SUS0_SVW1_TT4_64_VW1_WGM8
    SolutionIndex: 62
    SolutionNameMin: Cijk_Ailk_Bljk_BBS_BH_MT128x128x16_MI16x16x16x1_SN_1LDSB1_AMAS3_GRVW8_IU1_LPB16_NLCA1_SIA2_SU0_SUS0_SVW2_TT4_64_VW2_WGM8
    SolutionIndex: 63
    SolutionNameMin: Cijk_Ailk_Bljk_BBS_BH_MT128x128x16_MI16x16x16x1_SN_1LDSB1_AMAS3_GRVW8_IU1_LPB8_NLCA1_SIA2_SU0_SUS0_SVW2_TT4_64_VW2_WGM8
    SolutionIndex: 64
    SolutionNameMin: Cijk_Ailk_Bljk_BBS_BH_MT128x128x16_MI16x16x16x1_SN_1LDSB1_AMAS3_GRVW8_IU1_LPB16_NLCA1_SIA2_SU0_SUS0_SVW4_TT4_64_VW4_WGM8
    SolutionIndex: 65
    SolutionNameMin: Cijk_Ailk_Bljk_BBS_BH_MT128x128x16_MI16x16x16x1_SN_1LDSB1_AMAS3_GRVW8_IU1_LPB8_NLCA1_SIA2_SU0_SUS0_SVW4_TT4_64_VW4_WGM8
    SolutionIndex: 66
    SolutionNameMin: Cijk_Ailk_Bljk_BBS_BH_MT128x128x16_MI16x16x16x1_SN_1LDSB0_AMAS3_GRVW8_IU1_LPB16_NLCA1_SIA3_SU0_SUS0_SVW4_TT4_64_VW4_WGM8
    SolutionIndex: 67
    SolutionNameMin: Cijk_Ailk_Bljk_BBS_BH_MT128x128x16_MI16x16x16x1_SN_1LDSB0_AMAS3_GRVW8_IU1_LPB8_NLCA1_SIA3_SU0_SUS0_SVW4_TT4_64_VW4_WGM8
    SolutionIndex: 68
    SolutionNameMin: Cijk_Ailk_Bljk_BBS_BH_MT128x128x16_MI16x16x16x1_SN_1LDSB0_AMAS3_GRVW4_IU1_LPB8_NLCA1_SIA1_SU32_SUS128_SVW2_TT4_64_VW2_WGM8
    SolutionIndex: 69
    SolutionNameMin: Cijk_Ailk_Bljk_BBS_BH_MT128x128x16_MI16x16x16x1_SN_1LDSB0_AMAS0_GRVW8_IU1_LPB8_NLCA1_SIA1_SU32_SUS128_SVW1_TT4_64_VW1_WGM8
    SolutionIndex: 70
    SolutionNameMin: Cijk_Ailk_Bljk_BBS_BH_MT128x128x16_MI16x16x16x1_SN_1LDSB0_AMAS3_GRVW8_IU1_LPB16_NLCA1_SIA1_SU32_SUS128_SVW2_TT4_64_VW2_WGM8
    SolutionIndex: 71
    SolutionNameMin: Cijk_Ailk_Bljk_BBS_BH_MT128x128x16_MI16x16x16x1_SN_1LDSB0_AMAS3_GRVW8_IU1_LPB8_NLCA1_SIA1_SU32_SUS128_SVW2_TT4_64_VW2_WGM8
    SolutionIndex: 72
    SolutionNameMin: Cijk_Ailk_Bljk_BBS_BH_MT128x128x16_MI16x16x16x1_SN_1LDSB0_AMAS3_GRVW8_IU1_LPB16_NLCA1_SIA1_SU32_SUS128_SVW4_TT4_64_VW4_WGM8
    SolutionIndex: 73
    SolutionNameMin: Cijk_Ailk_Bljk_BBS_BH_MT128x128x16_MI16x16x16x1_SN_1LDSB0_AMAS3_GRVW8_IU1_LPB8_NLCA1_SIA1_SU32_SUS128_SVW4_TT4_64_VW4_WGM8
    SolutionIndex: 74
    SolutionNameMin: Cijk_Ailk_Bljk_BBS_BH_MT128x128x16_MI16x16x16x1_SN_1LDSB1_AMAS0_GRVW8_IU1_LPB16_NLCA1_SIA2_SU32_SUS128_SVW1_TT4_64_VW1_WGM8
    SolutionIndex: 75
    SolutionNameMin: Cijk_Ailk_Bljk_BBS_BH_MT128x128x16_MI16x16x16x1_SN_1LDSB1_AMAS3_GRVW8_IU1_LPB8_NLCA1_SIA2_SU32_SUS128_SVW2_TT4_64_VW2_WGM8
    SolutionIndex: 76
    SolutionNameMin: Cijk_Ailk_Bljk_BBS_BH_MT128x128x16_MI16x16x16x1_SN_1LDSB1_AMAS3_GRVW8_IU1_LPB16_NLCA1_SIA2_SU32_SUS128_SVW4_TT4_64_VW4_WGM8
    SolutionIndex: 77
    SolutionNameMin: Cijk_Ailk_Bljk_BBS_BH_MT128x128x16_MI16x16x16x1_SN_1LDSB1_AMAS3_GRVW8_IU1_LPB8_NLCA1_SIA2_SU32_SUS128_SVW4_TT4_64_VW4_WGM8
    SolutionIndex: 78
    SolutionNameMin: Cijk_Ailk_Bljk_BBS_BH_MT128x128x16_MI16x16x16x1_SN_1LDSB0_AMAS3_GRVW4_IU1_LPB8_NLCA1_SIA1_SU32_SUS256_SVW2_TT4_64_VW2_WGM8
    SolutionIndex: 79
    SolutionNameMin: Cijk_Ailk_Bljk_BBS_BH_MT128x128x16_MI16x16x16x1_SN_1LDSB0_AMAS3_GRVW8_IU1_LPB16_NLCA1_SIA1_SU32_SUS256_SVW2_TT4_64_VW2_WGM8
    SolutionIndex: 80
    SolutionNameMin: Cijk_Ailk_Bljk_BBS_BH_MT128x128x16_MI16x16x16x1_SN_1LDSB0_AMAS3_GRVW8_IU1_LPB8_NLCA1_SIA1_SU32_SUS256_SVW2_TT4_64_VW2_WGM8
    SolutionIndex: 81
    SolutionNameMin: Cijk_Ailk_Bljk_BBS_BH_MT128x128x16_MI16x16x16x1_SN_1LDSB0_AMAS3_GRVW8_IU1_LPB8_NLCA1_SIA1_SU32_SUS256_SVW4_TT4_64_VW4_WGM8
    SolutionIndex: 82
    SolutionNameMin: Cijk_Ailk_Bljk_BBS_BH_MT128x128x16_MI16x16x16x1_SN_1LDSB1_AMAS3_GRVW4_IU1_LPB16_NLCA1_SIA2_SU32_SUS256_SVW2_TT4_64_VW2_WGM8
    SolutionIndex: 83
    SolutionNameMin: Cijk_Ailk_Bljk_BBS_BH_MT128x128x16_MI16x16x16x1_SN_1LDSB1_AMAS3_GRVW4_IU1_LPB8_NLCA1_SIA2_SU32_SUS256_SVW2_TT4_64_VW2_WGM8
    SolutionIndex: 84
    SolutionNameMin: Cijk_Ailk_Bljk_BBS_BH_MT128x128x16_MI16x16x16x1_SN_1LDSB1_AMAS3_GRVW8_IU1_LPB16_NLCA1_SIA2_SU32_SUS256_SVW2_TT4_64_VW2_WGM8
    SolutionIndex: 85
    SolutionNameMin: Cijk_Ailk_Bljk_BBS_BH_MT128x128x16_MI16x16x16x1_SN_1LDSB1_AMAS3_GRVW8_IU1_LPB8_NLCA1_SIA2_SU32_SUS256_SVW2_TT4_64_VW2_WGM8
    SolutionIndex: 86
    SolutionNameMin: Cijk_Ailk_Bljk_BBS_BH_MT32x32x32_MI16x16x16x1_SN_1LDSB0_AMAS0_GRVW4_IU1_LPB8_NLCA1_SIA1_SU0_SUS0_SVW1_TT1_16_VW1_WGM4
    SolutionIndex: 87
    SolutionNameMin: Cijk_Ailk_Bljk_BBS_BH_MT32x32x32_MI16x16x16x1_SN_1LDSB0_AMAS0_GRVW8_IU1_LPB8_NLCA1_SIA1_SU0_SUS0_SVW1_TT1_16_VW1_WGM4
    SolutionIndex: 88
    SolutionNameMin: Cijk_Ailk_Bljk_BBS_BH_MT32x32x32_MI16x16x16x1_SN_1LDSB1_AMAS0_GRVW2_IU2_LPB8_NLCA1_SIA2_SU0_SUS0_SVW1_TT1_16_VW1_WGM4
    SolutionIndex: 89
    SolutionNameMin: Cijk_Ailk_Bljk_BBS_BH_MT32x32x32_MI16x16x16x1_SN_1LDSB1_AMAS0_GRVW4_IU2_LPB16_NLCA1_SIA2_SU0_SUS0_SVW1_TT1_16_VW1_WGM4
    SolutionIndex: 90
    SolutionNameMin: Cijk_Ailk_Bljk_BBS_BH_MT32x32x32_MI16x16x16x1_SN_1LDSB1_AMAS0_GRVW4_IU2_LPB8_NLCA1_SIA2_SU0_SUS0_SVW1_TT1_16_VW1_WGM4
    SolutionIndex: 91
    SolutionNameMin: Cijk_Ailk_Bljk_BBS_BH_MT32x32x32_MI16x16x16x1_SN_1LDSB1_AMAS0_GRVW8_IU2_LPB16_NLCA1_SIA2_SU0_SUS0_SVW1_TT1_16_VW1_WGM4
    SolutionIndex: 92
    SolutionNameMin: Cijk_Ailk_Bljk_BBS_BH_MT32x32x32_MI16x16x16x1_SN_1LDSB1_AMAS0_GRVW8_IU2_LPB8_NLCA1_SIA2_SU0_SUS0_SVW1_TT1_16_VW1_WGM4
    SolutionIndex: 93
    SolutionNameMin: Cijk_Ailk_Bljk_BBS_BH_MT32x32x32_MI16x16x16x1_SN_1LDSB0_AMAS0_GRVW2_IU1_LPB8_NLCA1_SIA3_SU0_SUS0_SVW1_TT1_16_VW1_WGM4
    SolutionIndex: 94
    SolutionNameMin: Cijk_Ailk_Bljk_BBS_BH_MT32x32x32_MI16x16x16x1_SN_1LDSB0_AMAS0_GRVW4_IU1_LPB8_NLCA1_SIA3_SU0_SUS0_SVW1_TT1_16_VW1_WGM4
    SolutionIndex: 95
    SolutionNameMin: Cijk_Ailk_Bljk_BBS_BH_MT32x32x32_MI16x16x16x1_SN_1LDSB0_AMAS0_GRVW8_IU1_LPB8_NLCA1_SIA3_SU0_SUS0_SVW1_TT1_16_VW1_WGM4
    SolutionIndex: 96
    SolutionNameMin: Cijk_Ailk_Bljk_BBS_BH_MT32x32x32_MI16x16x16x1_SN_1LDSB0_AMAS0_GRVW4_IU1_LPB8_NLCA1_SIA1_SU32_SUS128_SVW1_TT1_16_VW1_WGM4
    SolutionIndex: 97
    SolutionNameMin: Cijk_Ailk_Bljk_BBS_BH_MT32x32x32_MI16x16x16x1_SN_1LDSB0_AMAS0_GRVW8_IU1_LPB8_NLCA1_SIA1_SU32_SUS128_SVW1_TT1_16_VW1_WGM4
    SolutionIndex: 98
    SolutionNameMin: Cijk_Ailk_Bljk_BBS_BH_MT32x32x32_MI16x16x16x1_SN_1LDSB1_AMAS0_GRVW4_IU2_LPB16_NLCA1_SIA2_SU32_SUS128_SVW1_TT1_16_VW1_WGM4
    SolutionIndex: 99
    SolutionNameMin: Cijk_Ailk_Bljk_BBS_BH_MT32x32x32_MI16x16x16x1_SN_1LDSB1_AMAS0_GRVW4_IU2_LPB8_NLCA1_SIA2_SU32_SUS128_SVW1_TT1_16_VW1_WGM4
    SolutionIndex: 100
    SolutionNameMin: Cijk_Ailk_Bljk_BBS_BH_MT32x32x32_MI16x16x16x1_SN_1LDSB1_AMAS0_GRVW8_IU2_LPB16_NLCA1_SIA2_SU32_SUS128_SVW1_TT1_16_VW1_WGM4
    SolutionIndex: 101
    SolutionNameMin: Cijk_Ailk_Bljk_BBS_BH_MT32x32x32_MI16x16x16x1_SN_1LDSB1_AMAS0_GRVW8_IU2_LPB8_NLCA1_SIA2_SU32_SUS128_SVW1_TT1_16_VW1_WGM4
    SolutionIndex: 102
    SolutionNameMin: Cijk_Ailk_Bljk_BBS_BH_MT32x32x32_MI16x16x16x1_SN_1LDSB0_AMAS0_GRVW8_IU1_LPB16_NLCA1_SIA3_SU32_SUS128_SVW1_TT1_16_VW1_WGM4
    SolutionIndex: 103
    SolutionNameMin: Cijk_Ailk_Bljk_BBS_BH_MT32x32x32_MI16x16x16x1_SN_1LDSB0_AMAS0_GRVW8_IU1_LPB8_NLCA1_SIA1_SU32_SUS256_SVW1_TT1_16_VW1_WGM4
    SolutionIndex: 104
    SolutionNameMin: Cijk_Ailk_Bljk_BBS_BH_MT32x32x32_MI16x16x16x1_SN_1LDSB1_AMAS0_GRVW4_IU2_LPB16_NLCA1_SIA2_SU32_SUS256_SVW1_TT1_16_VW1_WGM4
    SolutionIndex: 105
    SolutionNameMin: Cijk_Ailk_Bljk_BBS_BH_MT32x32x32_MI16x16x16x1_SN_1LDSB1_AMAS0_GRVW4_IU2_LPB8_NLCA1_SIA2_SU32_SUS256_SVW1_TT1_16_VW1_WGM4
    SolutionIndex: 106
    SolutionNameMin: Cijk_Ailk_Bljk_BBS_BH_MT32x32x32_MI16x16x16x1_SN_1LDSB1_AMAS0_GRVW8_IU2_LPB8_NLCA1_SIA2_SU32_SUS256_SVW1_TT1_16_VW1_WGM4
    SolutionIndex: 107
    SolutionNameMin: Cijk_Ailk_Bljk_BBS_BH_MT32x32x32_MI16x16x16x1_SN_1LDSB0_AMAS0_GRVW2_IU1_LPB8_NLCA1_SIA1_SU0_SUS0_SVW1_TT1_16_VW1_WGM8
    SolutionIndex: 108
    SolutionNameMin: Cijk_Ailk_Bljk_BBS_BH_MT32x32x32_MI16x16x16x1_SN_1LDSB0_AMAS0_GRVW4_IU1_LPB8_NLCA1_SIA1_SU0_SUS0_SVW1_TT1_16_VW1_WGM8
    SolutionIndex: 109
    SolutionNameMin: Cijk_Ailk_Bljk_BBS_BH_MT32x32x32_MI16x16x16x1_SN_1LDSB0_AMAS0_GRVW8_IU1_LPB8_NLCA1_SIA1_SU0_SUS0_SVW1_TT1_16_VW1_WGM8
    SolutionIndex: 110
    SolutionNameMin: Cijk_Ailk_Bljk_BBS_BH_MT32x32x32_MI16x16x16x1_SN_1LDSB1_AMAS0_GRVW2_IU2_LPB8_NLCA1_SIA2_SU0_SUS0_SVW1_TT1_16_VW1_WGM8
    SolutionIndex: 111
    SolutionNameMin: Cijk_Ailk_Bljk_BBS_BH_MT32x32x32_MI16x16x16x1_SN_1LDSB1_AMAS0_GRVW4_IU2_LPB16_NLCA1_SIA2_SU0_SUS0_SVW1_TT1_16_VW1_WGM8
    SolutionIndex: 112
    SolutionNameMin: Cijk_Ailk_Bljk_BBS_BH_MT32x32x32_MI16x16x16x1_SN_1LDSB1_AMAS0_GRVW4_IU2_LPB8_NLCA1_SIA2_SU0_SUS0_SVW1_TT1_16_VW1_WGM8
    SolutionIndex: 113
    SolutionNameMin: Cijk_Ailk_Bljk_BBS_BH_MT32x32x32_MI16x16x16x1_SN_1LDSB1_AMAS0_GRVW8_IU2_LPB16_NLCA1_SIA2_SU0_SUS0_SVW1_TT1_16_VW1_WGM8
    SolutionIndex: 114
    SolutionNameMin: Cijk_Ailk_Bljk_BBS_BH_MT32x32x32_MI16x16x16x1_SN_1LDSB1_AMAS0_GRVW8_IU2_LPB8_NLCA1_SIA2_SU0_SUS0_SVW1_TT1_16_VW1_WGM8
    SolutionIndex: 115
    SolutionNameMin: Cijk_Ailk_Bljk_BBS_BH_MT32x32x32_MI16x16x16x1_SN_1LDSB0_AMAS0_GRVW4_IU1_LPB8_NLCA1_SIA3_SU0_SUS0_SVW1_TT1_16_VW1_WGM8
    SolutionIndex: 116
    SolutionNameMin: Cijk_Ailk_Bljk_BBS_BH_MT32x32x32_MI16x16x16x1_SN_1LDSB0_AMAS0_GRVW8_IU1_LPB8_NLCA1_SIA3_SU0_SUS0_SVW1_TT1_16_VW1_WGM8
    SolutionIndex: 117
    SolutionNameMin: Cijk_Ailk_Bljk_BBS_BH_MT32x32x32_MI16x16x16x1_SN_1LDSB0_AMAS0_GRVW4_IU1_LPB8_NLCA1_SIA1_SU32_SUS128_SVW1_TT1_16_VW1_WGM8
    SolutionIndex: 118
    SolutionNameMin: Cijk_Ailk_Bljk_BBS_BH_MT32x32x32_MI16x16x16x1_SN_1LDSB1_AMAS0_GRVW4_IU2_LPB16_NLCA1_SIA2_SU32_SUS128_SVW1_TT1_16_VW1_WGM8
    SolutionIndex: 119
    SolutionNameMin: Cijk_Ailk_Bljk_BBS_BH_MT32x32x32_MI16x16x16x1_SN_1LDSB1_AMAS0_GRVW4_IU2_LPB8_NLCA1_SIA2_SU32_SUS128_SVW1_TT1_16_VW1_WGM8
    SolutionIndex: 120
    SolutionNameMin: Cijk_Ailk_Bljk_BBS_BH_MT32x32x32_MI16x16x16x1_SN_1LDSB1_AMAS0_GRVW8_IU2_LPB8_NLCA1_SIA2_SU32_SUS128_SVW1_TT1_16_VW1_WGM8
    SolutionIndex: 121
    SolutionNameMin: Cijk_Ailk_Bljk_BBS_BH_MT32x32x32_MI16x16x16x1_SN_1LDSB0_AMAS0_GRVW4_IU1_LPB8_NLCA1_SIA1_SU32_SUS256_SVW1_TT1_16_VW1_WGM8
    SolutionIndex: 122
    SolutionNameMin: Cijk_Ailk_Bljk_BBS_BH_MT32x32x32_MI16x16x16x1_SN_1LDSB0_AMAS0_GRVW8_IU1_LPB8_NLCA1_SIA1_SU32_SUS256_SVW1_TT1_16_VW1_WGM8
    SolutionIndex: 123
    SolutionNameMin: Cijk_Ailk_Bljk_BBS_BH_MT32x32x32_MI16x16x16x1_SN_1LDSB1_AMAS0_GRVW4_IU2_LPB8_NLCA1_SIA2_SU32_SUS256_SVW1_TT1_16_VW1_WGM8
    SolutionIndex: 124
    SolutionNameMin: Cijk_Ailk_Bljk_BBS_BH_MT32x32x32_MI16x16x16x1_SN_1LDSB1_AMAS0_GRVW8_IU2_LPB8_NLCA1_SIA2_SU32_SUS256_SVW1_TT1_16_VW1_WGM8
    SolutionIndex: 125
    SolutionNameMin: Cijk_Ailk_Bljk_BBS_BH_MT64x64x32_MI16x16x16x1_SN_1LDSB0_AMAS0_GRVW4_IU1_LPB8_NLCA1_SIA1_SU0_SUS0_SVW1_TT2_32_VW1_WGM4
    SolutionIndex: 126
    SolutionNameMin: Cijk_Ailk_Bljk_BBS_BH_MT64x64x32_MI16x16x16x1_SN_1LDSB0_AMAS3_GRVW4_IU1_LPB8_NLCA1_SIA1_SU0_SUS0_SVW2_TT2_32_VW2_WGM4
    SolutionIndex: 127
    SolutionNameMin: Cijk_Ailk_Bljk_BBS_BH_MT64x64x32_MI16x16x16x1_SN_1LDSB0_AMAS0_GRVW8_IU1_LPB8_NLCA1_SIA1_SU0_SUS0_SVW1_TT2_32_VW1_WGM4
    SolutionIndex: 128
    SolutionNameMin: Cijk_Ailk_Bljk_BBS_BH_MT64x64x32_MI16x16x16x1_SN_1LDSB0_AMAS3_GRVW8_IU1_LPB8_NLCA1_SIA1_SU0_SUS0_SVW2_TT2_32_VW2_WGM4
    SolutionIndex: 129
    SolutionNameMin: Cijk_Ailk_Bljk_BBS_BH_MT64x64x32_MI16x16x16x1_SN_1LDSB1_AMAS3_GRVW4_IU2_LPB8_NLCA1_SIA2_SU0_SUS0_SVW2_TT2_32_VW2_WGM4
    SolutionIndex: 130
    SolutionNameMin: Cijk_Ailk_Bljk_BBS_BH_MT64x64x32_MI16x16x16x1_SN_1LDSB1_AMAS0_GRVW8_IU2_LPB8_NLCA1_SIA2_SU0_SUS0_SVW1_TT2_32_VW1_WGM4
    SolutionIndex: 131
    SolutionNameMin: Cijk_Ailk_Bljk_BBS_BH_MT64x64x32_MI16x16x16x1_SN_1LDSB1_AMAS3_GRVW8_IU2_LPB8_NLCA1_SIA2_SU0_SUS0_SVW2_TT2_32_VW2_WGM4
    SolutionIndex: 132
    SolutionNameMin: Cijk_Ailk_Bljk_BBS_BH_MT64x64x32_MI16x16x16x1_SN_1LDSB0_AMAS3_GRVW4_IU1_LPB8_NLCA1_SIA3_SU0_SUS0_SVW2_TT2_32_VW2_WGM4
    SolutionIndex: 133
    SolutionNameMin: Cijk_Ailk_Bljk_BBS_BH_MT64x64x32_MI16x16x16x1_SN_1LDSB0_AMAS0_GRVW8_IU1_LPB8_NLCA1_SIA3_SU0_SUS0_SVW1_TT2_32_VW1_WGM4
    SolutionIndex: 134
    SolutionNameMin: Cijk_Ailk_Bljk_BBS_BH_MT64x64x32_MI16x16x16x1_SN_1LDSB0_AMAS3_GRVW8_IU1_LPB8_NLCA1_SIA3_SU0_SUS0_SVW2_TT2_32_VW2_WGM4
    SolutionIndex: 135
    SolutionNameMin: Cijk_Ailk_Bljk_BBS_BH_MT64x64x32_MI16x16x16x1_SN_1LDSB0_AMAS0_GRVW8_IU1_LPB8_NLCA1_SIA1_SU32_SUS128_SVW1_TT2_32_VW1_WGM4
    SolutionIndex: 136
    SolutionNameMin: Cijk_Ailk_Bljk_BBS_BH_MT64x64x32_MI16x16x16x1_SN_1LDSB0_AMAS3_GRVW8_IU1_LPB8_NLCA1_SIA1_SU32_SUS128_SVW2_TT2_32_VW2_WGM4
    SolutionIndex: 137
    SolutionNameMin: Cijk_Ailk_Bljk_BBS_BH_MT64x64x32_MI16x16x16x1_SN_1LDSB1_AMAS3_GRVW4_IU2_LPB8_NLCA1_SIA2_SU32_SUS128_SVW2_TT2_32_VW2_WGM4
    SolutionIndex: 138
    SolutionNameMin: Cijk_Ailk_Bljk_BBS_BH_MT64x64x32_MI16x16x16x1_SN_1LDSB1_AMAS3_GRVW8_IU2_LPB8_NLCA1_SIA2_SU32_SUS128_SVW2_TT2_32_VW2_WGM4
    SolutionIndex: 139
    SolutionNameMin: Cijk_Ailk_Bljk_BBS_BH_MT64x64x32_MI16x16x16x1_SN_1LDSB0_AMAS0_GRVW8_IU1_LPB8_NLCA1_SIA1_SU32_SUS256_SVW1_TT2_32_VW1_WGM4
    SolutionIndex: 140
    SolutionNameMin: Cijk_Ailk_Bljk_BBS_BH_MT64x64x32_MI16x16x16x1_SN_1LDSB0_AMAS3_GRVW8_IU1_LPB16_NLCA1_SIA1_SU32_SUS256_SVW2_TT2_32_VW2_WGM4
    SolutionIndex: 141
    SolutionNameMin: Cijk_Ailk_Bljk_BBS_BH_MT64x64x32_MI16x16x16x1_SN_1LDSB0_AMAS3_GRVW8_IU1_LPB8_NLCA1_SIA1_SU32_SUS256_SVW2_TT2_32_VW2_WGM4
    SolutionIndex: 142
    SolutionNameMin: Cijk_Ailk_Bljk_BBS_BH_MT64x64x32_MI16x16x16x1_SN_1LDSB1_AMAS3_GRVW8_IU2_LPB8_NLCA1_SIA2_SU32_SUS256_SVW2_TT2_32_VW2_WGM4
    SolutionIndex: 143
    SolutionNameMin: Cijk_Ailk_Bljk_BBS_BH_MT64x64x32_MI16x16x16x1_SN_1LDSB0_AMAS0_GRVW8_IU1_LPB8_NLCA1_SIA3_SU32_SUS256_SVW1_TT2_32_VW1_WGM4
    SolutionIndex: 144
    SolutionNameMin: Cijk_Ailk_Bljk_BBS_BH_MT64x64x32_MI16x16x16x1_SN_1LDSB0_AMAS3_GRVW8_IU1_LPB8_NLCA1_SIA3_SU32_SUS256_SVW2_TT2_32_VW2_WGM4
    SolutionIndex: 145
    SolutionNameMin: Cijk_Ailk_Bljk_BBS_BH_MT64x64x32_MI16x16x16x1_SN_1LDSB0_AMAS0_GRVW2_IU1_LPB8_NLCA1_SIA1_SU0_SUS0_SVW1_TT2_32_VW1_WGM8
    SolutionIndex: 146
    SolutionNameMin: Cijk_Ailk_Bljk_BBS_BH_MT64x64x32_MI16x16x16x1_SN_1LDSB0_AMAS0_GRVW4_IU1_LPB8_NLCA1_SIA1_SU0_SUS0_SVW1_TT2_32_VW1_WGM8
    SolutionIndex: 147
    SolutionNameMin: Cijk_Ailk_Bljk_BBS_BH_MT64x64x32_MI16x16x16x1_SN_1LDSB0_AMAS3_GRVW4_IU1_LPB8_NLCA1_SIA1_SU0_SUS0_SVW2_TT2_32_VW2_WGM8
    SolutionIndex: 148
    SolutionNameMin: Cijk_Ailk_Bljk_BBS_BH_MT64x64x32_MI16x16x16x1_SN_1LDSB0_AMAS0_GRVW8_IU1_LPB8_NLCA1_SIA1_SU0_SUS0_SVW1_TT2_32_VW1_WGM8
    SolutionIndex: 149
    SolutionNameMin: Cijk_Ailk_Bljk_BBS_BH_MT64x64x32_MI16x16x16x1_SN_1LDSB0_AMAS3_GRVW8_IU1_LPB8_NLCA1_SIA1_SU0_SUS0_SVW2_TT2_32_VW2_WGM8
    SolutionIndex: 150
    SolutionNameMin: Cijk_Ailk_Bljk_BBS_BH_MT64x64x32_MI16x16x16x1_SN_1LDSB1_AMAS0_GRVW8_IU2_LPB8_NLCA1_SIA2_SU0_SUS0_SVW1_TT2_32_VW1_WGM8
    SolutionIndex: 151
    SolutionNameMin: Cijk_Ailk_Bljk_BBS_BH_MT64x64x32_MI16x16x16x1_SN_1LDSB1_AMAS3_GRVW8_IU2_LPB8_NLCA1_SIA2_SU0_SUS0_SVW2_TT2_32_VW2_WGM8
    SolutionIndex: 152
    SolutionNameMin: Cijk_Ailk_Bljk_BBS_BH_MT64x64x32_MI16x16x16x1_SN_1LDSB0_AMAS0_GRVW4_IU1_LPB8_NLCA1_SIA3_SU0_SUS0_SVW1_TT2_32_VW1_WGM8
    SolutionIndex: 153
    SolutionNameMin: Cijk_Ailk_Bljk_BBS_BH_MT64x64x32_MI16x16x16x1_SN_1LDSB0_AMAS3_GRVW4_IU1_LPB8_NLCA1_SIA3_SU0_SUS0_SVW2_TT2_32_VW2_WGM8
    SolutionIndex: 154
    SolutionNameMin: Cijk_Ailk_Bljk_BBS_BH_MT64x64x32_MI16x16x16x1_SN_1LDSB0_AMAS0_GRVW8_IU1_LPB8_NLCA1_SIA3_SU0_SUS0_SVW1_TT2_32_VW1_WGM8
    SolutionIndex: 155
    SolutionNameMin: Cijk_Ailk_Bljk_BBS_BH_MT64x64x32_MI16x16x16x1_SN_1LDSB0_AMAS3_GRVW8_IU1_LPB8_NLCA1_SIA3_SU0_SUS0_SVW2_TT2_32_VW2_WGM8
    SolutionIndex: 156
    SolutionNameMin: Cijk_Ailk_Bljk_BBS_BH_MT64x64x32_MI16x16x16x1_SN_1LDSB0_AMAS3_GRVW4_IU1_LPB8_NLCA1_SIA1_SU32_SUS128_SVW2_TT2_32_VW2_WGM8
    SolutionIndex: 157
    SolutionNameMin: Cijk_Ailk_Bljk_BBS_BH_MT64x64x32_MI16x16x16x1_SN_1LDSB0_AMAS3_GRVW8_IU1_LPB8_NLCA1_SIA1_SU32_SUS128_SVW2_TT2_32_VW2_WGM8
    SolutionIndex: 158
    SolutionNameMin: Cijk_Ailk_Bljk_BBS_BH_MT64x64x32_MI16x16x16x1_SN_1LDSB1_AMAS3_GRVW8_IU2_LPB8_NLCA1_SIA2_SU32_SUS128_SVW2_TT2_32_VW2_WGM8
    SolutionIndex: 159
    SolutionNameMin: Cijk_Ailk_Bljk_BBS_BH_MT64x64x32_MI16x16x16x1_SN_1LDSB0_AMAS3_GRVW4_IU1_LPB8_NLCA1_SIA1_SU32_SUS256_SVW2_TT2_32_VW2_WGM8
    SolutionIndex: 160
    SolutionNameMin: Cijk_Ailk_Bljk_BBS_BH_MT64x64x32_MI16x16x16x1_SN_1LDSB0_AMAS3_GRVW8_IU1_LPB8_NLCA1_SIA1_SU32_SUS256_SVW2_TT2_32_VW2_WGM8
    SolutionIndex: 161
    SolutionNameMin: Cijk_Ailk_Bljk_BBS_BH_MT64x64x32_MI16x16x16x1_SN_1LDSB1_AMAS0_GRVW4_IU2_LPB8_NLCA1_SIA2_SU32_SUS256_SVW1_TT2_32_VW1_WGM8
    SolutionIndex: 162
    SolutionNameMin: Cijk_Ailk_Bljk_BBS_BH_MT64x64x32_MI16x16x16x1_SN_1LDSB1_AMAS0_GRVW8_IU2_LPB8_NLCA1_SIA2_SU32_SUS256_SVW1_TT2_32_VW1_WGM8
    SolutionIndex: 163
    SolutionNameMin: Cijk_Ailk_Bljk_BBS_BH_MT64x64x32_MI16x16x16x1_SN_1LDSB1_AMAS3_GRVW8_IU2_LPB8_NLCA1_SIA2_SU32_SUS256_SVW2_TT2_32_VW2_WGM8
    SolutionIndex: 164
    SolutionNameMin: Cijk_Ailk_Bljk_BBS_BH_MT64x64x32_MI16x16x16x1_SN_1LDSB0_AMAS3_GRVW8_IU1_LPB8_NLCA1_SIA3_SU32_SUS256_SVW2_TT2_32_VW2_WGM8
- - - [64, 64, 1, 64, 96, 96, 96, 96]
    - [1, 0.041]
  - - [64, 64, 1, 128, 96, 96, 160, 160]
    - [91, 0.08]
  - - [64, 64, 1, 256, 96, 96, 288, 288]
    - [100, 0.151]
  - - [64, 64, 1, 512, 96, 96, 544, 544]
    - [106, 0.269]
  - - [64, 64, 1, 1024, 96, 96, 1056, 1056]
    - [115, 0.364]
  - - [64, 64, 1, 2048, 96, 96, 2080, 2080]
    - [124, 0.628]
  - - [64, 64, 1, 4096, 96, 96, 4128, 4128]
    - [99, 0.814]
  - - [64, 64, 1, 8192, 96, 96, 8224, 8224]
    - [90, 0.951]
  - - [64, 128, 1, 64, 96, 96, 96, 96]
    - [116, 0.087]
  - - [64, 128, 1, 128, 96, 96, 160, 160]
    - [120, 0.167]
  - - [64, 128, 1, 256, 96, 96, 288, 288]
    - [104, 0.31]
  - - [64, 128, 1, 512, 96, 96, 544, 544]
    - [111, 0.548]
  - - [64, 128, 1, 1024, 96, 96, 1056, 1056]
    - [124, 0.89]
  - - [64, 128, 1, 2048, 96, 96, 2080, 2080]
    - [89, 1.285]
  - - [64, 128, 1, 4096, 96, 96, 4128, 4128]
    - [90, 1.648]
  - - [64, 128, 1, 8192, 96, 96, 8224, 8224]
    - [90, 1.909]
  - - [64, 256, 1, 64, 96, 96, 96, 96]
    - [109, 0.174]
  - - [64, 256, 1, 128, 96, 96, 160, 160]
    - [92, 0.34]
  - - [64, 256, 1, 256, 96, 96, 288, 288]
    - [111, 0.632]
  - - [64, 256, 1, 512, 96, 96, 544, 544]
    - [119, 1.106]
  - - [64, 256, 1, 1024, 96, 96, 1056, 1056]
    - [124, 1.798]
  - - [64, 256, 1, 2048, 96, 96, 2080, 2080]
    - [119, 2.565]
  - - [64, 256, 1, 4096, 96, 96, 4128, 4128]
    - [112, 3.289]
  - - [64, 256, 1, 8192, 96, 96, 8224, 8224]
    - [118, 3.8]
  - - [64, 512, 1, 64, 96, 96, 96, 96]
    - [91, 0.351]
  - - [64, 512, 1, 128, 96, 96, 160, 160]
    - [124, 0.682]
  - - [64, 512, 1, 256, 96, 96, 288, 288]
    - [112, 1.26]
  - - [64, 512, 1, 512, 96, 96, 544, 544]
    - [123, 2.224]
  - - [64, 512, 1, 1024, 96, 96, 1056, 1056]
    - [106, 3.589]
  - - [64, 512, 1, 2048, 96, 96, 2080, 2080]
    - [119, 5.122]
  - - [64, 512, 1, 4096, 96, 96, 4128, 4128]
    - [119, 6.571]
  - - [64, 512, 1, 8192, 96, 96, 8224, 8224]
    - [112, 7.528]
  - - [64, 1024, 1, 64, 96, 96, 96, 96]
    - [123, 0.698]
  - - [64, 1024, 1, 128, 96, 96, 160, 160]
    - [106, 1.344]
  - - [64, 1024, 1, 256, 96, 96, 288, 288]
    - [110, 2.482]
  - - [64, 1024, 1, 512, 96, 96, 544, 544]
    - [114, 4.31]
  - - [64, 1024, 1, 1024, 96, 96, 1056, 1056]
    - [90, 6.816]
  - - [64, 1024, 1, 2048, 96, 96, 2080, 2080]
    - [90, 9.559]
  - - [64, 1024, 1, 4096, 96, 96, 4128, 4128]
    - [99, 11.905]
  - - [64, 1024, 1, 8192, 96, 96, 8224, 8224]
    - [90, 13.444]
  - - [64, 2048, 1, 64, 96, 96, 96, 96]
    - [93, 1.363]
  - - [64, 2048, 1, 128, 96, 96, 160, 160]
    - [86, 2.568]
  - - [64, 2048, 1, 256, 96, 96, 288, 288]
    - [86, 4.665]
  - - [64, 2048, 1, 512, 96, 96, 544, 544]
    - [122, 7.87]
  - - [64, 2048, 1, 1024, 96, 96, 1056, 1056]
    - [87, 11.881]
  - - [64, 2048, 1, 2048, 96, 96, 2080, 2080]
    - [86, 15.853]
  - - [64, 2048, 1, 4096, 96, 96, 4128, 4128]
    - [109, 18.696]
  - - [64, 2048, 1, 8192, 96, 96, 8224, 8224]
    - [97, 21.507]
  - - [64, 4096, 1, 64, 96, 96, 96, 96]
    - [96, 2.56]
  - - [64, 4096, 1, 128, 96, 96, 160, 160]
    - [138, 4.749]
  - - [64, 4096, 1, 256, 96, 96, 288, 288]
    - [131, 8.409]
  - - [64, 4096, 1, 512, 96, 96, 544, 544]
    - [156, 13.519]
  - - [64, 4096, 1, 1024, 96, 96, 1056, 1056]
    - [149, 19.382]
  - - [64, 4096, 1, 2048, 96, 96, 2080, 2080]
    - [156, 25.045]
  - - [64, 4096, 1, 4096, 96, 96, 4128, 4128]
    - [159, 28.348]
  - - [64, 4096, 1, 8192, 96, 96, 8224, 8224]
    - [159, 30.8]
  - - [64, 8192, 1, 64, 96, 96, 96, 96]
    - [129, 4.84]
  - - [64, 8192, 1, 128, 96, 96, 160, 160]
    - [131, 8.861]
  - - [64, 8192, 1, 256, 96, 96, 288, 288]
    - [157, 14.979]
  - - [64, 8192, 1, 512, 96, 96, 544, 544]
    - [128, 22.962]
  - - [64, 8192, 1, 1024, 96, 96, 1056, 1056]
    - [136, 31.345]
  - - [64, 8192, 1, 2048, 96, 96, 2080, 2080]
    - [163, 37.706]
  - - [64, 8192, 1, 4096, 96, 96, 4128, 4128]
    - [136, 42.907]
  - - [64, 8192, 1, 8192, 96, 96, 8224, 8224]
    - [131, 28.057]
  - - [128, 64, 1, 64, 160, 160, 128, 96]
    - [2, 0.087]
  - - [128, 64, 1, 128, 160, 160, 160, 160]
    - [89, 0.167]
  - - [128, 64, 1, 256, 160, 160, 288, 288]
    - [120, 0.309]
  - - [128, 64, 1, 512, 160, 160, 544, 544]
    - [114, 0.551]
  - - [128, 64, 1, 1024, 160, 160, 1056, 1056]
    - [90, 0.888]
  - - [128, 64, 1, 2048, 160, 160, 2080, 2080]
    - [112, 1.284]
  - - [128, 64, 1, 4096, 160, 160, 4128, 4128]
    - [90, 1.645]
  - - [128, 64, 1, 8192, 160, 160, 8224, 8224]
    - [123, 1.902]
  - - [128, 128, 1, 64, 160, 160, 128, 96]
    - [109, 0.176]
  - - [128, 128, 1, 128, 160, 160, 160, 160]
    - [113, 0.34]
  - - [128, 128, 1, 256, 160, 160, 288, 288]
    - [100, 0.634]
  - - [128, 128, 1, 512, 160, 160, 544, 544]
    - [124, 1.112]
  - - [128, 128, 1, 1024, 160, 160, 1056, 1056]
    - [105, 1.802]
  - - [128, 128, 1, 2048, 160, 160, 2080, 2080]
    - [90, 2.591]
  - - [128, 128, 1, 4096, 160, 160, 4128, 4128]
    - [105, 3.327]
  - - [128, 128, 1, 8192, 160, 160, 8224, 8224]
    - [104, 3.821]
  - - [128, 256, 1, 64, 160, 160, 128, 96]
    - [102, 0.351]
  - - [128, 256, 1, 128, 160, 160, 160, 160]
    - [124, 0.687]
  - - [128, 256, 1, 256, 160, 160, 288, 288]
    - [101, 1.268]
  - - [128, 256, 1, 512, 160, 160, 544, 544]
    - [101, 2.227]
  - - [128, 256, 1, 1024, 160, 160, 1056, 1056]
    - [106, 3.605]
  - - [128, 256, 1, 2048, 160, 160, 2080, 2080]
    - [123, 5.183]
  - - [128, 256, 1, 4096, 160, 160, 4128, 4128]
    - [105, 6.659]
  - - [128, 256, 1, 8192, 160, 160, 8224, 8224]
    - [89, 7.658]
  - - [128, 512, 1, 64, 160, 160, 128, 96]
    - [103, 0.696]
  - - [128, 512, 1, 128, 160, 160, 160, 160]
    - [124, 1.34]
  - - [128, 512, 1, 256, 160, 160, 288, 288]
    - [112, 2.488]
  - - [128, 512, 1, 512, 160, 160, 544, 544]
    - [87, 4.067]
  - - [128, 512, 1, 1024, 160, 160, 1056, 1056]
    - [99, 6.799]
  - - [128, 512, 1, 2048, 160, 160, 2080, 2080]
    - [119, 9.542]
  - - [128, 512, 1, 4096, 160, 160, 4128, 4128]
    - [105, 11.979]
  - - [128, 512, 1, 8192, 160, 160, 8224, 8224]
    - [90, 13.515]
  - - [128, 1024, 1, 64, 160, 160, 128, 96]
    - [117, 1.365]
  - - [128, 1024, 1, 128, 160, 160, 160, 160]
    - [121, 2.579]
  - - [128, 1024, 1, 256, 160, 160, 288, 288]
    - [103, 4.695]
  - - [128, 1024, 1, 512, 160, 160, 544, 544]
    - [121, 7.871]
  - - [128, 1024, 1, 1024, 160, 160, 1056, 1056]
    - [87, 11.986]
  - - [128, 1024, 1, 2048, 160, 160, 2080, 2080]
    - [87, 16.167]
  - - [128, 1024, 1, 4096, 160, 160, 4128, 4128]
    - [87, 18.763]
  - - [128, 1024, 1, 8192, 160, 160, 8224, 8224]
    - [86, 21.675]
  - - [128, 2048, 1, 64, 160, 160, 128, 96]
    - [103, 2.582]
  - - [128, 2048, 1, 128, 160, 160, 160, 160]
    - [151, 4.78]
  - - [128, 2048, 1, 256, 160, 160, 288, 288]
    - [128, 8.417]
  - - [128, 2048, 1, 512, 160, 160, 544, 544]
    - [141, 13.604]
  - - [128, 2048, 1, 1024, 160, 160, 1056, 1056]
    - [128, 19.651]
  - - [128, 2048, 1, 2048, 160, 160, 2080, 2080]
    - [128, 25.286]
  - - [128, 2048, 1, 4096, 160, 160, 4128, 4128]
    - [147, 28.711]
  - - [128, 2048, 1, 8192, 160, 160, 8224, 8224]
    - [128, 32.24]
  - - [128, 4096, 1, 64, 160, 160, 128, 96]
    - [15, 4.869]
  - - [128, 4096, 1, 128, 160, 160, 160, 160]
    - [12, 8.893]
  - - [128, 4096, 1, 256, 160, 160, 288, 288]
    - [128, 15.207]
  - - [128, 4096, 1, 512, 160, 160, 544, 544]
    - [141, 23.264]
  - - [128, 4096, 1, 1024, 160, 160, 1056, 1056]
    - [128, 31.483]
  - - [128, 4096, 1, 2048, 160, 160, 2080, 2080]
    - [135, 37.392]
  - - [128, 4096, 1, 4096, 160, 160, 4128, 4128]
    - [136, 43.245]
  - - [128, 4096, 1, 8192, 160, 160, 8224, 8224]
    - [125, 44.466]
  - - [128, 8192, 1, 64, 160, 160, 128, 96]
    - [6, 8.244]
  - - [128, 8192, 1, 128, 160, 160, 160, 160]
    - [142, 14.556]
  - - [128, 8192, 1, 256, 160, 160, 288, 288]
    - [138, 22.9]
  - - [128, 8192, 1, 512, 160, 160, 544, 544]
    - [75, 33.361]
  - - [128, 8192, 1, 1024, 160, 160, 1056, 1056]
    - [85, 43.732]
  - - [128, 8192, 1, 2048, 160, 160, 2080, 2080]
    - [40, 51.433]
  - - [128, 8192, 1, 4096, 160, 160, 4128, 4128]
    - [75, 54.826]
  - - [128, 8192, 1, 8192, 160, 160, 8224, 8224]
    - [65, 47.668]
  - - [256, 64, 1, 64, 288, 288, 256, 96]
    - [1, 0.176]
  - - [256, 64, 1, 128, 288, 288, 256, 160]
    - [113, 0.339]
  - - [256, 64, 1, 256, 288, 288, 288, 288]
    - [101, 0.628]
  - - [256, 64, 1, 512, 288, 288, 544, 544]
    - [92, 1.111]
  - - [256, 64, 1, 1024, 288, 288, 1056, 1056]
    - [99, 1.8]
  - - [256, 64, 1, 2048, 288, 288, 2080, 2080]
    - [105, 2.575]
  - - [256, 64, 1, 4096, 288, 288, 4128, 4128]
    - [105, 3.289]
  - - [256, 64, 1, 8192, 288, 288, 8224, 8224]
    - [118, 3.798]
  - - [256, 128, 1, 64, 288, 288, 256, 96]
    - [89, 0.352]
  - - [256, 128, 1, 128, 288, 288, 256, 160]
    - [89, 0.677]
  - - [256, 128, 1, 256, 288, 288, 288, 288]
    - [111, 1.262]
  - - [256, 128, 1, 512, 288, 288, 544, 544]
    - [90, 2.22]
  - - [256, 128, 1, 1024, 288, 288, 1056, 1056]
    - [106, 3.59]
  - - [256, 128, 1, 2048, 288, 288, 2080, 2080]
    - [99, 5.159]
  - - [256, 128, 1, 4096, 288, 288, 4128, 4128]
    - [99, 6.587]
  - - [256, 128, 1, 8192, 288, 288, 8224, 8224]
    - [123, 7.622]
  - - [256, 256, 1, 64, 288, 288, 256, 96]
    - [109, 0.699]
  - - [256, 256, 1, 128, 288, 288, 256, 160]
    - [96, 1.332]
  - - [256, 256, 1, 256, 288, 288, 288, 288]
    - [119, 2.444]
  - - [256, 256, 1, 512, 288, 288, 544, 544]
    - [123, 4.255]
  - - [256, 256, 1, 1024, 288, 288, 1056, 1056]
    - [112, 6.779]
  - - [256, 256, 1, 2048, 288, 288, 2080, 2080]
    - [119, 9.517]
  - - [256, 256, 1, 4096, 288, 288, 4128, 4128]
    - [112, 11.918]
  - - [256, 256, 1, 8192, 288, 288, 8224, 8224]
    - [105, 13.5]
  - - [256, 512, 1, 64, 288, 288, 256, 96]
    - [122, 1.372]
  - - [256, 512, 1, 128, 288, 288, 256, 160]
    - [87, 2.581]
  - - [256, 512, 1, 256, 288, 288, 288, 288]
    - [107, 4.679]
  - - [256, 512, 1, 512, 288, 288, 544, 544]
    - [96, 7.955]
  - - [256, 512, 1, 1024, 288, 288, 1056, 1056]
    - [161, 10.93]
  - - [256, 512, 1, 2048, 288, 288, 2080, 2080]
    - [86, 16.069]
  - - [256, 512, 1, 4096, 288, 288, 4128, 4128]
    - [86, 18.792]
  - - [256, 512, 1, 8192, 288, 288, 8224, 8224]
    - [108, 21.468]
  - - [256, 1024, 1, 64, 288, 288, 256, 96]
    - [94, 2.575]
  - - [256, 1024, 1, 128, 288, 288, 256, 160]
    - [160, 4.802]
  - - [256, 1024, 1, 256, 288, 288, 288, 288]
    - [147, 8.532]
  - - [256, 1024, 1, 512, 288, 288, 544, 544]
    - [139, 13.878]
  - - [256, 1024, 1, 1024, 288, 288, 1056, 1056]
    - [146, 20.163]
  - - [256, 1024, 1, 2048, 288, 288, 2080, 2080]
    - [147, 26.312]
  - - [256, 1024, 1, 4096, 288, 288, 4128, 4128]
    - [145, 30.515]
  - - [256, 1024, 1, 8192, 288, 288, 8224, 8224]
    - [147, 33.576]
  - - [256, 2048, 1, 64, 288, 288, 256, 96]
    - [10, 4.862]
  - - [256, 2048, 1, 128, 288, 288, 256, 160]
    - [142, 8.933]
  - - [256, 2048, 1, 256, 288, 288, 288, 288]
    - [14, 15.139]
  - - [256, 2048, 1, 512, 288, 288, 544, 544]
    - [9, 23.252]
  - - [256, 2048, 1, 1024, 288, 288, 1056, 1056]
    - [128, 31.693]
  - - [256, 2048, 1, 2048, 288, 288, 2080, 2080]
    - [8, 37.311]
  - - [256, 2048, 1, 4096, 288, 288, 4128, 4128]
    - [9, 43.39]
  - - [256, 2048, 1, 8192, 288, 288, 8224, 8224]
    - [15, 45.026]
  - - [256, 4096, 1, 64, 288, 288, 256, 96]
    - [131, 8.274]
  - - [256, 4096, 1, 128, 288, 288, 256, 160]
    - [142, 14.504]
  - - [256, 4096, 1, 256, 288, 288, 288, 288]
    - [29, 22.894]
  - - [256, 4096, 1, 512, 288, 288, 544, 544]
    - [63, 33.729]
  - - [256, 4096, 1, 1024, 288, 288, 1056, 1056]
    - [25, 43.949]
  - - [256, 4096, 1, 2048, 288, 288, 2080, 2080]
    - [58, 51.302]
  - - [256, 4096, 1, 4096, 288, 288, 4128, 4128]
    - [25, 54.609]
  - - [256, 4096, 1, 8192, 288, 288, 8224, 8224]
    - [58, 58.705]
  - - [256, 8192, 1, 64, 288, 288, 256, 96]
    - [142, 13.267]
  - - [256, 8192, 1, 128, 288, 288, 256, 160]
    - [23, 23.051]
  - - [256, 8192, 1, 256, 288, 288, 288, 288]
    - [67, 34.765]
  - - [256, 8192, 1, 512, 288, 288, 544, 544]
    - [60, 47.823]
  - - [256, 8192, 1, 1024, 288, 288, 1056, 1056]
    - [46, 58.53]
  - - [256, 8192, 1, 2048, 288, 288, 2080, 2080]
    - [24, 65.14]
  - - [256, 8192, 1, 4096, 288, 288, 4128, 4128]
    - [24, 67.224]
  - - [256, 8192, 1, 8192, 288, 288, 8224, 8224]
    - [45, 67.502]
  - - [384, 64, 1, 64, 416, 416, 384, 96]
    - [0, 0.263]
  - - [384, 64, 1, 128, 416, 416, 384, 160]
    - [124, 0.514]
  - - [384, 64, 1, 256, 416, 416, 384, 288]
    - [124, 0.945]
  - - [384, 64, 1, 512, 416, 416, 544, 544]
    - [123, 1.677]
  - - [384, 64, 1, 1024, 416, 416, 1056, 1056]
    - [112, 2.706]
  - - [384, 64, 1, 2048, 416, 416, 2080, 2080]
    - [110, 3.866]
  - - [384, 64, 1, 4096, 416, 416, 4128, 4128]
    - [123, 4.959]
  - - [384, 64, 1, 8192, 416, 416, 8224, 8224]
    - [98, 5.685]
  - - [384, 128, 1, 64, 416, 416, 384, 96]
    - [111, 0.53]
  - - [384, 128, 1, 128, 416, 416, 384, 160]
    - [90, 1.022]
  - - [384, 128, 1, 256, 416, 416, 384, 288]
    - [105, 1.9]
  - - [384, 128, 1, 512, 416, 416, 544, 544]
    - [101, 3.338]
  - - [384, 128, 1, 1024, 416, 416, 1056, 1056]
    - [112, 5.404]
  - - [384, 128, 1, 2048, 416, 416, 2080, 2080]
    - [112, 7.739]
  - - [384, 128, 1, 4096, 416, 416, 4128, 4128]
    - [105, 9.889]
  - - [384, 128, 1, 8192, 416, 416, 8224, 8224]
    - [90, 11.513]
  - - [384, 256, 1, 64, 416, 416, 384, 96]
    - [92, 1.046]
  - - [384, 256, 1, 128, 416, 416, 384, 160]
    - [90, 2.0]
  - - [384, 256, 1, 256, 416, 416, 384, 288]
    - [112, 3.671]
  - - [384, 256, 1, 512, 416, 416, 544, 544]
    - [92, 6.365]
  - - [384, 256, 1, 1024, 416, 416, 1056, 1056]
    - [114, 10.077]
  - - [384, 256, 1, 2048, 416, 416, 2080, 2080]
    - [90, 14.281]
  - - [384, 256, 1, 4096, 416, 416, 4128, 4128]
    - [123, 17.763]
  - - [384, 256, 1, 8192, 416, 416, 8224, 8224]
    - [88, 20.212]
  - - [384, 512, 1, 64, 416, 416, 384, 96]
    - [109, 2.019]
  - - [384, 512, 1, 128, 416, 416, 384, 160]
    - [109, 3.766]
  - - [384, 512, 1, 256, 416, 416, 384, 288]
    - [151, 6.776]
  - - [384, 512, 1, 512, 416, 416, 544, 544]
    - [151, 11.211]
  - - [384, 512, 1, 1024, 416, 416, 1056, 1056]
    - [158, 16.561]
  - - [384, 512, 1, 2048, 416, 416, 2080, 2080]
    - [158, 21.931]
  - - [384, 512, 1, 4096, 416, 416, 4128, 4128]
    - [129, 25.354]
  - - [384, 512, 1, 8192, 416, 416, 8224, 8224]
    - [162, 28.486]
  - - [384, 1024, 1, 64, 416, 416, 384, 96]
    - [12, 3.828]
  - - [384, 1024, 1, 128, 416, 416, 384, 160]
    - [131, 7.124]
  - - [384, 1024, 1, 256, 416, 416, 384, 288]
    - [160, 12.583]
  - - [384, 1024, 1, 512, 416, 416, 544, 544]
    - [149, 20.304]
  - - [384, 1024, 1, 1024, 416, 416, 1056, 1056]
    - [149, 29.419]
  - - [384, 1024, 1, 2048, 416, 416, 2080, 2080]
    - [127, 37.815]
  - - [384, 1024, 1, 4096, 416, 416, 4128, 4128]
    - [146, 43.155]
  - - [384, 1024, 1, 8192, 416, 416, 8224, 8224]
    - [125, 48.228]
  - - [384, 2048, 1, 64, 416, 416, 384, 96]
    - [5, 6.855]
  - - [384, 2048, 1, 128, 416, 416, 384, 160]
    - [11, 12.339]
  - - [384, 2048, 1, 256, 416, 416, 384, 288]
    - [134, 20.324]
  - - [384, 2048, 1, 512, 416, 416, 544, 544]
    - [134, 29.936]
  - - [384, 2048, 1, 1024, 416, 416, 1056, 1056]
    - [155, 39.2]
  - - [384, 2048, 1, 2048, 416, 416, 2080, 2080]
    - [164, 45.773]
  - - [384, 2048, 1, 4096, 416, 416, 4128, 4128]
    - [154, 50.296]
  - - [384, 2048, 1, 8192, 416, 416, 8224, 8224]
    - [153, 51.526]
  - - [384, 4096, 1, 64, 416, 416, 384, 96]
    - [29, 11.171]
  - - [384, 4096, 1, 128, 416, 416, 384, 160]
    - [85, 19.894]
  - - [384, 4096, 1, 256, 416, 416, 384, 288]
    - [43, 31.734]
  - - [384, 4096, 1, 512, 416, 416, 544, 544]
    - [36, 46.432]
  - - [384, 4096, 1, 1024, 416, 416, 1056, 1056]
    - [36, 59.712]
  - - [384, 4096, 1, 2048, 416, 416, 2080, 2080]
    - [63, 70.85]
  - - [384, 4096, 1, 4096, 416, 416, 4128, 4128]
    - [25, 77.642]
  - - [384, 4096, 1, 8192, 416, 416, 8224, 8224]
    - [40, 84.831]
  - - [384, 8192, 1, 64, 416, 416, 384, 96]
    - [55, 17.521]
  - - [384, 8192, 1, 128, 416, 416, 384, 160]
    - [49, 29.675]
  - - [384, 8192, 1, 256, 416, 416, 384, 288]
    - [77, 42.904]
  - - [384, 8192, 1, 512, 416, 416, 544, 544]
    - [39, 55.636]
  - - [384, 8192, 1, 1024, 416, 416, 1056, 1056]
    - [60, 64.813]
  - - [384, 8192, 1, 2048, 416, 416, 2080, 2080]
    - [56, 70.255]
  - - [384, 8192, 1, 4096, 416, 416, 4128, 4128]
    - [82, 71.596]
  - - [384, 8192, 1, 8192, 416, 416, 8224, 8224]
    - [35, 62.775]
  - - [768, 64, 1, 64, 800, 800, 768, 96]
    - [0, 0.512]
  - - [768, 64, 1, 128, 800, 800, 768, 160]
    - [106, 1.023]
  - - [768, 64, 1, 256, 800, 800, 768, 288]
    - [120, 1.931]
  - - [768, 64, 1, 512, 800, 800, 768, 544]
    - [123, 3.37]
  - - [768, 64, 1, 1024, 800, 800, 1056, 1056]
    - [99, 5.396]
  - - [768, 64, 1, 2048, 800, 800, 2080, 2080]
    - [111, 7.717]
  - - [768, 64, 1, 4096, 800, 800, 4128, 4128]
    - [119, 9.845]
  - - [768, 64, 1, 8192, 800, 800, 8224, 8224]
    - [119, 11.404]
  - - [768, 128, 1, 64, 800, 800, 768, 96]
    - [114, 1.046]
  - - [768, 128, 1, 128, 800, 800, 768, 160]
    - [124, 1.932]
  - - [768, 128, 1, 256, 800, 800, 768, 288]
    - [114, 3.673]
  - - [768, 128, 1, 512, 800, 800, 768, 544]
    - [92, 6.377]
  - - [768, 128, 1, 1024, 800, 800, 1056, 1056]
    - [90, 10.11]
  - - [768, 128, 1, 2048, 800, 800, 2080, 2080]
    - [112, 14.116]
  - - [768, 128, 1, 4096, 800, 800, 4128, 4128]
    - [99, 17.559]
  - - [768, 128, 1, 8192, 800, 800, 8224, 8224]
    - [105, 19.889]
  - - [768, 256, 1, 64, 800, 800, 768, 96]
    - [140, 1.995]
  - - [768, 256, 1, 128, 800, 800, 768, 160]
    - [87, 3.76]
  - - [768, 256, 1, 256, 800, 800, 768, 288]
    - [151, 6.75]
  - - [768, 256, 1, 512, 800, 800, 768, 544]
    - [131, 11.193]
  - - [768, 256, 1, 1024, 800, 800, 1056, 1056]
    - [151, 16.594]
  - - [768, 256, 1, 2048, 800, 800, 2080, 2080]
    - [131, 21.88]
  - - [768, 256, 1, 4096, 800, 800, 4128, 4128]
    - [150, 25.633]
  - - [768, 256, 1, 8192, 800, 800, 8224, 8224]
    - [131, 28.675]
  - - [768, 512, 1, 64, 800, 800, 768, 96]
    - [12, 3.854]
  - - [768, 512, 1, 128, 800, 800, 768, 160]
    - [131, 7.175]
  - - [768, 512, 1, 256, 800, 800, 768, 288]
    - [149, 12.664]
  - - [768, 512, 1, 512, 800, 800, 768, 544]
    - [127, 20.459]
  - - [768, 512, 1, 1024, 800, 800, 1056, 1056]
    - [149, 29.615]
  - - [768, 512, 1, 2048, 800, 800, 2080, 2080]
    - [148, 37.975]
  - - [768, 512, 1, 4096, 800, 800, 4128, 4128]
    - [146, 43.473]
  - - [768, 512, 1, 8192, 800, 800, 8224, 8224]
    - [148, 48.401]
  - - [768, 1024, 1, 64, 800, 800, 768, 96]
    - [129, 6.854]
  - - [768, 1024, 1, 128, 800, 800, 768, 160]
    - [6, 12.319]
  - - [768, 1024, 1, 256, 800, 800, 768, 288]
    - [16, 20.298]
  - - [768, 1024, 1, 512, 800, 800, 768, 544]
    - [133, 29.808]
  - - [768, 1024, 1, 1024, 800, 800, 1056, 1056]
    - [154, 39.393]
  - - [768, 1024, 1, 2048, 800, 800, 2080, 2080]
    - [152, 46.101]
  - - [768, 1024, 1, 4096, 800, 800, 4128, 4128]
    - [154, 51.002]
  - - [768, 1024, 1, 8192, 800, 800, 8224, 8224]
    - [154, 52.031]
  - - [768, 2048, 1, 64, 800, 800, 768, 96]
    - [29, 11.183]
  - - [768, 2048, 1, 128, 800, 800, 768, 160]
    - [158, 19.084]
  - - [768, 2048, 1, 256, 800, 800, 768, 288]
    - [79, 31.567]
  - - [768, 2048, 1, 512, 800, 800, 768, 544]
    - [43, 46.535]
  - - [768, 2048, 1, 1024, 800, 800, 1056, 1056]
    - [19, 60.089]
  - - [768, 2048, 1, 2048, 800, 800, 2080, 2080]
    - [26, 71.085]
  - - [768, 2048, 1, 4096, 800, 800, 4128, 4128]
    - [30, 77.274]
  - - [768, 2048, 1, 8192, 800, 800, 8224, 8224]
    - [61, 84.677]
  - - [768, 4096, 1, 64, 800, 800, 768, 96]
    - [44, 17.617]
  - - [768, 4096, 1, 128, 800, 800, 768, 160]
    - [29, 29.798]
  - - [768, 4096, 1, 256, 800, 800, 768, 288]
    - [29, 43.628]
  - - [768, 4096, 1, 512, 800, 800, 768, 544]
    - [29, 56.213]
  - - [768, 4096, 1, 1024, 800, 800, 1056, 1056]
    - [27, 65.372]
  - - [768, 4096, 1, 2048, 800, 800, 2080, 2080]
    - [32, 70.143]
  - - [768, 4096, 1, 4096, 800, 800, 4128, 4128]
    - [74, 76.368]
  - - [768, 4096, 1, 8192, 800, 800, 8224, 8224]
    - [83, 62.676]
  - - [768, 8192, 1, 64, 800, 800, 768, 96]
    - [71, 25.496]
  - - [768, 8192, 1, 128, 800, 800, 768, 160]
    - [31, 36.338]
  - - [768, 8192, 1, 256, 800, 800, 768, 288]
    - [23, 50.386]
  - - [768, 8192, 1, 512, 800, 800, 768, 544]
    - [23, 64.206]
  - - [768, 8192, 1, 1024, 800, 800, 1056, 1056]
    - [30, 67.923]
  - - [768, 8192, 1, 2048, 800, 800, 2080, 2080]
    - [20, 75.455]
  - - [768, 8192, 1, 4096, 800, 800, 4128, 4128]
    - [71, 63.716]
  - - [768, 8192, 1, 8192, 800, 800, 8224, 8224]
    - [21, 61.545]
  - - [1536, 64, 1, 64, 1568, 1568, 1536, 96]
    - [112, 0.993]
  - - [1536, 64, 1, 128, 1568, 1568, 1536, 160]
    - [120, 1.993]
  - - [1536, 64, 1, 256, 1568, 1568, 1536, 288]
    - [124, 3.676]
  - - [1536, 64, 1, 512, 1568, 1568, 1536, 544]
    - [101, 6.377]
  - - [1536, 64, 1, 1024, 1568, 1568, 1536, 1056]
    - [90, 10.077]
  - - [1536, 64, 1, 2048, 1568, 1568, 2080, 2080]
    - [90, 14.17]
  - - [1536, 64, 1, 4096, 1568, 1568, 4128, 4128]
    - [112, 17.714]
  - - [1536, 64, 1, 8192, 1568, 1568, 8224, 8224]
    - [123, 19.922]
  - - [1536, 128, 1, 64, 1568, 1568, 1536, 96]
    - [95, 1.989]
  - - [1536, 128, 1, 128, 1568, 1568, 1536, 160]
    - [163, 3.731]
  - - [1536, 128, 1, 256, 1568, 1568, 1536, 288]
    - [131, 6.768]
  - - [1536, 128, 1, 512, 1568, 1568, 1536, 544]
    - [131, 11.161]
  - - [1536, 128, 1, 1024, 1568, 1568, 1536, 1056]
    - [151, 16.565]
  - - [1536, 128, 1, 2048, 1568, 1568, 2080, 2080]
    - [151, 21.854]
  - - [1536, 128, 1, 4096, 1568, 1568, 4128, 4128]
    - [151, 25.557]
  - - [1536, 128, 1, 8192, 1568, 1568, 8224, 8224]
    - [151, 28.593]
  - - [1536, 256, 1, 64, 1568, 1568, 1536, 96]
    - [13, 3.814]
  - - [1536, 256, 1, 128, 1568, 1568, 1536, 160]
    - [131, 7.164]
  - - [1536, 256, 1, 256, 1568, 1568, 1536, 288]
    - [138, 12.518]
  - - [1536, 256, 1, 512, 1568, 1568, 1536, 544]
    - [128, 20.36]
  - - [1536, 256, 1, 1024, 1568, 1568, 1536, 1056]
    - [149, 29.258]
  - - [1536, 256, 1, 2048, 1568, 1568, 2080, 2080]
    - [126, 37.439]
  - - [1536, 256, 1, 4096, 1568, 1568, 4128, 4128]
    - [148, 42.818]
  - - [1536, 256, 1, 8192, 1568, 1568, 8224, 8224]
    - [127, 47.36]
  - - [1536, 512, 1, 64, 1568, 1568, 1536, 96]
    - [4, 6.867]
  - - [1536, 512, 1, 128, 1568, 1568, 1536, 160]
    - [12, 12.395]
  - - [1536, 512, 1, 256, 1568, 1568, 1536, 288]
    - [143, 20.242]
  - - [1536, 512, 1, 512, 1568, 1568, 1536, 544]
    - [155, 29.989]
  - - [1536, 512, 1, 1024, 1568, 1568, 1536, 1056]
    - [128, 39.307]
  - - [1536, 512, 1, 2048, 1568, 1568, 2080, 2080]
    - [132, 46.264]
  - - [1536, 512, 1, 4096, 1568, 1568, 4128, 4128]
    - [134, 50.665]
  - - [1536, 512, 1, 8192, 1568, 1568, 8224, 8224]
    - [154, 51.852]
  - - [1536, 1024, 1, 64, 1568, 1568, 1536, 96]
    - [85, 11.116]
  - - [1536, 1024, 1, 128, 1568, 1568, 1536, 160]
    - [63, 19.967]
  - - [1536, 1024, 1, 256, 1568, 1568, 1536, 288]
    - [33, 31.745]
  - - [1536, 1024, 1, 512, 1568, 1568, 1536, 544]
    - [22, 46.462]
  - - [1536, 1024, 1, 1024, 1568, 1568, 1536, 1056]
    - [22, 60.125]
  - - [1536, 1024, 1, 2048, 1568, 1568, 2080, 2080]
    - [29, 70.952]
  - - [1536, 1024, 1, 4096, 1568, 1568, 4128, 4128]
    - [29, 77.923]
  - - [1536, 1024, 1, 8192, 1568, 1568, 8224, 8224]
    - [39, 84.335]
  - - [1536, 2048, 1, 64, 1568, 1568, 1536, 96]
    - [53, 18.239]
  - - [1536, 2048, 1, 128, 1568, 1568, 1536, 160]
    - [64, 29.636]
  - - [1536, 2048, 1, 256, 1568, 1568, 1536, 288]
    - [62, 43.794]
  - - [1536, 2048, 1, 512, 1568, 1568, 1536, 544]
    - [64, 57.848]
  - - [1536, 2048, 1, 1024, 1568, 1568, 1536, 1056]
    - [60, 68.768]
  - - [1536, 2048, 1, 2048, 1568, 1568, 2080, 2080]
    - [56, 73.655]
  - - [1536, 2048, 1, 4096, 1568, 1568, 4128, 4128]
    - [23, 78.101]
  - - [1536, 2048, 1, 8192, 1568, 1568, 8224, 8224]
    - [50, 68.91]
  - - [1536, 4096, 1, 64, 1568, 1568, 1536, 96]
    - [73, 25.437]
  - - [1536, 4096, 1, 128, 1568, 1568, 1536, 160]
    - [65, 38.787]
  - - [1536, 4096, 1, 256, 1568, 1568, 1536, 288]
    - [63, 52.121]
  - - [1536, 4096, 1, 512, 1568, 1568, 1536, 544]
    - [23, 64.537]
  - - [1536, 4096, 1, 1024, 1568, 1568, 1536, 1056]
    - [20, 70.816]
  - - [1536, 4096, 1, 2048, 1568, 1568, 2080, 2080]
    - [21, 75.614]
  - - [1536, 4096, 1, 4096, 1568, 1568, 4128, 4128]
    - [79, 73.031]
  - - [1536, 4096, 1, 8192, 1568, 1568, 8224, 8224]
    - [55, 65.028]
  - - [1536, 8192, 1, 64, 1568, 1568, 1536, 96]
    - [23, 31.468]
  - - [1536, 8192, 1, 128, 1568, 1568, 1536, 160]
    - [63, 44.806]
  - - [1536, 8192, 1, 256, 1568, 1568, 1536, 288]
    - [81, 59.047]
  - - [1536, 8192, 1, 512, 1568, 1568, 1536, 544]
    - [23, 69.72]
  - - [1536, 8192, 1, 1024, 1568, 1568, 1536, 1056]
    - [17, 76.062]
  - - [1536, 8192, 1, 2048, 1568, 1568, 2080, 2080]
    - [70, 68.961]
  - - [1536, 8192, 1, 4096, 1568, 1568, 4128, 4128]
    - [51, 64.983]
  - - [1536, 8192, 1, 8192, 1568, 1568, 8224, 8224]
    - [55, 66.337]
  - - [3072, 64, 1, 64, 3104, 3104, 3072, 96]
    - [3, 1.897]
  - - [3072, 64, 1, 128, 3104, 3104, 3072, 160]
    - [163, 3.746]
  - - [3072, 64, 1, 256, 3104, 3104, 3072, 288]
    - [137, 6.68]
  - - [3072, 64, 1, 512, 3104, 3104, 3072, 544]
    - [151, 11.237]
  - - [3072, 64, 1, 1024, 3104, 3104, 3072, 1056]
    - [151, 16.583]
  - - [3072, 64, 1, 2048, 3104, 3104, 3072, 2080]
    - [130, 21.941]
  - - [3072, 64, 1, 4096, 3104, 3104, 4128, 4128]
    - [131, 25.705]
  - - [3072, 64, 1, 8192, 3104, 3104, 8224, 8224]
    - [158, 28.676]
  - - [3072, 128, 1, 64, 3104, 3104, 3072, 96]
    - [7, 3.847]
  - - [3072, 128, 1, 128, 3104, 3104, 3072, 160]
    - [142, 7.107]
  - - [3072, 128, 1, 256, 3104, 3104, 3072, 288]
    - [151, 12.523]
  - - [3072, 128, 1, 512, 3104, 3104, 3072, 544]
    - [149, 20.184]
  - - [3072, 128, 1, 1024, 3104, 3104, 3072, 1056]
    - [163, 28.952]
  - - [3072, 128, 1, 2048, 3104, 3104, 3072, 2080]
    - [129, 36.845]
  - - [3072, 128, 1, 4096, 3104, 3104, 4128, 4128]
    - [150, 41.985]
  - - [3072, 128, 1, 8192, 3104, 3104, 8224, 8224]
    - [125, 43.406]
  - - [3072, 256, 1, 64, 3104, 3104, 3072, 96]
    - [5, 6.891]
  - - [3072, 256, 1, 128, 3104, 3104, 3072, 160]
    - [4, 12.417]
  - - [3072, 256, 1, 256, 3104, 3104, 3072, 288]
    - [4, 20.317]
  - - [3072, 256, 1, 512, 3104, 3104, 3072, 544]
    - [134, 30.089]
  - - [3072, 256, 1, 1024, 3104, 3104, 3072, 1056]
    - [134, 39.045]
  - - [3072, 256, 1, 2048, 3104, 3104, 3072, 2080]
    - [164, 45.958]
  - - [3072, 256, 1, 4096, 3104, 3104, 4128, 4128]
    - [154, 50.684]
  - - [3072, 256, 1, 8192, 3104, 3104, 8224, 8224]
    - [155, 51.832]
  - - [3072, 512, 1, 64, 3104, 3104, 3072, 96]
    - [83, 11.036]
  - - [3072, 512, 1, 128, 3104, 3104, 3072, 160]
    - [48, 19.86]
  - - [3072, 512, 1, 256, 3104, 3104, 3072, 288]
    - [34, 30.984]
  - - [3072, 512, 1, 512, 3104, 3104, 3072, 544]
    - [23, 44.914]
  - - [3072, 512, 1, 1024, 3104, 3104, 3072, 1056]
    - [23, 58.108]
  - - [3072, 512, 1, 2048, 3104, 3104, 3072, 2080]
    - [25, 70.469]
  - - [3072, 512, 1, 4096, 3104, 3104, 4128, 4128]
    - [65, 77.724]
  - - [3072, 512, 1, 8192, 3104, 3104, 8224, 8224]
    - [63, 84.548]
  - - [3072, 1024, 1, 64, 3104, 3104, 3072, 96]
    - [21, 18.131]
  - - [3072, 1024, 1, 128, 3104, 3104, 3072, 160]
    - [84, 29.546]
  - - [3072, 1024, 1, 256, 3104, 3104, 3072, 288]
    - [59, 43.669]
  - - [3072, 1024, 1, 512, 3104, 3104, 3072, 544]
    - [64, 57.492]
  - - [3072, 1024, 1, 1024, 3104, 3104, 3072, 1056]
    - [60, 68.506]
  - - [3072, 1024, 1, 2048, 3104, 3104, 3072, 2080]
    - [68, 71.009]
  - - [3072, 1024, 1, 4096, 3104, 3104, 4128, 4128]
    - [27, 77.425]
  - - [3072, 1024, 1, 8192, 3104, 3104, 8224, 8224]
    - [20, 73.662]
  - - [3072, 2048, 1, 64, 3104, 3104, 3072, 96]
    - [44, 25.287]
  - - [3072, 2048, 1, 128, 3104, 3104, 3072, 160]
    - [40, 38.653]
  - - [3072, 2048, 1, 256, 3104, 3104, 3072, 288]
    - [65, 52.553]
  - - [3072, 2048, 1, 512, 3104, 3104, 3072, 544]
    - [65, 65.459]
  - - [3072, 2048, 1, 1024, 3104, 3104, 3072, 1056]
    - [20, 71.833]
  - - [3072, 2048, 1, 2048, 3104, 3104, 3072, 2080]
    - [23, 79.788]
  - - [3072, 2048, 1, 4096, 3104, 3104, 4128, 4128]
    - [38, 70.445]
  - - [3072, 2048, 1, 8192, 3104, 3104, 8224, 8224]
    - [20, 65.063]
  - - [3072, 4096, 1, 64, 3104, 3104, 3072, 96]
    - [23, 31.582]
  - - [3072, 4096, 1, 128, 3104, 3104, 3072, 160]
    - [66, 44.926]
  - - [3072, 4096, 1, 256, 3104, 3104, 3072, 288]
    - [81, 59.33]
  - - [3072, 4096, 1, 512, 3104, 3104, 3072, 544]
    - [21, 69.83]
  - - [3072, 4096, 1, 1024, 3104, 3104, 3072, 1056]
    - [20, 78.009]
  - - [3072, 4096, 1, 2048, 3104, 3104, 3072, 2080]
    - [21, 69.779]
  - - [3072, 4096, 1, 4096, 3104, 3104, 4128, 4128]
    - [52, 68.32]
  - - [3072, 4096, 1, 8192, 3104, 3104, 8224, 8224]
    - [55, 67.213]
  - - [3072, 8192, 1, 64, 3104, 3104, 3072, 96]
    - [23, 36.024]
  - - [3072, 8192, 1, 128, 3104, 3104, 3072, 160]
    - [54, 48.11]
  - - [3072, 8192, 1, 256, 3104, 3104, 3072, 288]
    - [23, 62.916]
  - - [3072, 8192, 1, 512, 3104, 3104, 3072, 544]
    - [80, 75.241]
  - - [3072, 8192, 1, 1024, 3104, 3104, 3072, 1056]
    - [41, 67.122]
  - - [3072, 8192, 1, 2048, 3104, 3104, 3072, 2080]
    - [23, 66.71]
  - - [3072, 8192, 1, 4096, 3104, 3104, 4128, 4128]
    - [50, 67.372]
  - - [3072, 8192, 1, 8192, 3104, 3104, 8224, 8224]
    - [53, 67.95]
  - - [6144, 64, 1, 64, 6176, 6176, 6144, 96]
    - [12, 3.626]
  - - [6144, 64, 1, 128, 6176, 6176, 6144, 160]
    - [5, 7.104]
  - - [6144, 64, 1, 256, 6176, 6176, 6144, 288]
    - [150, 12.53]
  - - [6144, 64, 1, 512, 6176, 6176, 6144, 544]
    - [138, 20.024]
  - - [6144, 64, 1, 1024, 6176, 6176, 6144, 1056]
    - [150, 28.82]
  - - [6144, 64, 1, 2048, 6176, 6176, 6144, 2080]
    - [151, 37.141]
  - - [6144, 64, 1, 4096, 6176, 6176, 6144, 4128]
    - [151, 41.718]
  - - [6144, 64, 1, 8192, 6176, 6176, 8224, 8224]
    - [150, 44.738]
  - - [6144, 128, 1, 64, 6176, 6176, 6144, 96]
    - [154, 6.65]
  - - [6144, 128, 1, 128, 6176, 6176, 6144, 160]
    - [12, 12.39]
  - - [6144, 128, 1, 256, 6176, 6176, 6144, 288]
    - [10, 20.203]
  - - [6144, 128, 1, 512, 6176, 6176, 6144, 544]
    - [134, 29.819]
  - - [6144, 128, 1, 1024, 6176, 6176, 6144, 1056]
    - [144, 39.085]
  - - [6144, 128, 1, 2048, 6176, 6176, 6144, 2080]
    - [155, 45.731]
  - - [6144, 128, 1, 4096, 6176, 6176, 6144, 4128]
    - [154, 50.446]
  - - [6144, 128, 1, 8192, 6176, 6176, 8224, 8224]
    - [131, 51.419]
  - - [6144, 256, 1, 64, 6176, 6176, 6144, 96]
    - [63, 11.451]
  - - [6144, 256, 1, 128, 6176, 6176, 6144, 160]
    - [63, 20.623]
  - - [6144, 256, 1, 256, 6176, 6176, 6144, 288]
    - [84, 31.947]
  - - [6144, 256, 1, 512, 6176, 6176, 6144, 544]
    - [55, 45.937]
  - - [6144, 256, 1, 1024, 6176, 6176, 6144, 1056]
    - [55, 59.123]
  - - [6144, 256, 1, 2048, 6176, 6176, 6144, 2080]
    - [29, 71.105]
  - - [6144, 256, 1, 4096, 6176, 6176, 6144, 4128]
    - [65, 77.768]
  - - [6144, 256, 1, 8192, 6176, 6176, 8224, 8224]
    - [30, 85.25]
  - - [6144, 512, 1, 64, 6176, 6176, 6144, 96]
    - [37, 18.009]
  - - [6144, 512, 1, 128, 6176, 6176, 6144, 160]
    - [76, 29.57]
  - - [6144, 512, 1, 256, 6176, 6176, 6144, 288]
    - [47, 43.966]
  - - [6144, 512, 1, 512, 6176, 6176, 6144, 544]
    - [82, 57.818]
  - - [6144, 512, 1, 1024, 6176, 6176, 6144, 1056]
    - [27, 69.005]
  - - [6144, 512, 1, 2048, 6176, 6176, 6144, 2080]
    - [57, 72.028]
  - - [6144, 512, 1, 4096, 6176, 6176, 6144, 4128]
    - [28, 77.143]
  - - [6144, 512, 1, 8192, 6176, 6176, 8224, 8224]
    - [27, 65.736]
  - - [6144, 1024, 1, 64, 6176, 6176, 6144, 96]
    - [73, 25.088]
  - - [6144, 1024, 1, 128, 6176, 6176, 6144, 160]
    - [65, 38.763]
  - - [6144, 1024, 1, 256, 6176, 6176, 6144, 288]
    - [63, 52.422]
  - - [6144, 1024, 1, 512, 6176, 6176, 6144, 544]
    - [30, 65.602]
  - - [6144, 1024, 1, 1024, 6176, 6176, 6144, 1056]
    - [20, 71.861]
  - - [6144, 1024, 1, 2048, 6176, 6176, 6144, 2080]
    - [20, 79.568]
  - - [6144, 1024, 1, 4096, 6176, 6176, 6144, 4128]
    - [69, 72.349]
  - - [6144, 1024, 1, 8192, 6176, 6176, 8224, 8224]
    - [52, 61.467]
  - - [6144, 2048, 1, 64, 6176, 6176, 6144, 96]
    - [23, 31.425]
  - - [6144, 2048, 1, 128, 6176, 6176, 6144, 160]
    - [72, 45.825]
  - - [6144, 2048, 1, 256, 6176, 6176, 6144, 288]
    - [81, 59.379]
  - - [6144, 2048, 1, 512, 6176, 6176, 6144, 544]
    - [23, 69.912]
  - - [6144, 2048, 1, 1024, 6176, 6176, 6144, 1056]
    - [54, 76.362]
  - - [6144, 2048, 1, 2048, 6176, 6176, 6144, 2080]
    - [70, 69.579]
  - - [6144, 2048, 1, 4096, 6176, 6176, 6144, 4128]
    - [20, 68.69]
  - - [6144, 2048, 1, 8192, 6176, 6176, 8224, 8224]
    - [55, 64.032]
  - - [6144, 4096, 1, 64, 6176, 6176, 6144, 96]
    - [55, 35.823]
  - - [6144, 4096, 1, 128, 6176, 6176, 6144, 160]
    - [72, 48.729]
  - - [6144, 4096, 1, 256, 6176, 6176, 6144, 288]
    - [23, 62.964]
  - - [6144, 4096, 1, 512, 6176, 6176, 6144, 544]
    - [78, 74.805]
  - - [6144, 4096, 1, 1024, 6176, 6176, 6144, 1056]
    - [22, 71.836]
  - - [6144, 4096, 1, 2048, 6176, 6176, 6144, 2080]
    - [21, 67.369]
  - - [6144, 4096, 1, 4096, 6176, 6176, 6144, 4128]
    - [20, 68.532]
  - - [6144, 4096, 1, 8192, 6176, 6176, 8224, 8224]
    - [55, 66.378]
  - - [6144, 8192, 1, 64, 6176, 6176, 6144, 96]
    - [29, 37.056]
  - - [6144, 8192, 1, 128, 6176, 6176, 6144, 160]
    - [23, 51.807]
  - - [6144, 8192, 1, 256, 6176, 6176, 6144, 288]
    - [55, 66.618]
  - - [6144, 8192, 1, 512, 6176, 6176, 6144, 544]
    - [18, 61.112]
  - - [6144, 8192, 1, 1024, 6176, 6176, 6144, 1056]
    - [42, 62.275]
  - - [6144, 8192, 1, 2048, 6176, 6176, 6144, 2080]
    - [21, 66.426]
  - - [6144, 8192, 1, 4096, 6176, 6176, 6144, 4128]
    - [52, 67.841]
  - - [6144, 8192, 1, 8192, 6176, 6176, 8224, 8224]
    - [52, 66.406]
- null
- null
- DeviceEfficiency
