library/src/blas3/Tensile/Logic/asm_full/aquavanjaram942X/aquavanjaram942_Cijk_Alik_Bljk_HHS_BH.yaml
- {MinimumRequiredVersion: 4.36.0}
- aquavanjaram942
- {Architecture: gfx942, IsAPU: 0}
- [Device 74a1]
    SolutionIndex: 0
    SolutionNameMin: Cijk_Alik_Bljk_HHS_BH_MT256x256x32_MI32x32x8x1_SN_DTVA0_FL2_GLS1_NTC2_NTD3_NLCA1_ONLL2_SU32_SUS64_SPO0_SSO10_WGM18
    SolutionIndex: 1
    SolutionNameMin: Cijk_Alik_Bljk_HHS_BH_MT256x256x32_MI32x32x8x1_SN_FL2_GLS0_NTC2_NTD3_NEPBS0_ONLL2_SU32_SUS64_SPO0_SSO6_WGM4
    SolutionIndex: 2
    SolutionNameMin: Cijk_Alik_Bljk_HHS_BH_MT256x256x32_MI32x32x8x1_SN_FL0_GLS0_NTC2_NTD3_NEPBS8_ONLL1_SU32_SUS64_SPO0_SSO6_WGM18
    SolutionIndex: 3
    SolutionNameMin: Cijk_Alik_Bljk_HHS_BH_MT256x256x32_MI32x32x8x1_SN_FL2_GLS1_NTC2_NTD2_NEPBS0_ONLL1_SU32_SUS128_SPO0_SSO8_WGM19
    SolutionIndex: 4
    SolutionNameMin: Cijk_Alik_Bljk_HHS_BH_MT256x256x32_MI32x32x8x1_SN_FL2_GLS0_NTC3_NTD2_NEPBS0_ONLL2_SU32_SUS128_SPO0_SSO6_WGM19
    SolutionIndex: 5
    SolutionNameMin: Cijk_Alik_Bljk_HHS_BH_MT256x256x32_MI32x32x8x1_SN_FL0_GLS0_NTC3_NTD2_NEPBS0_ONLL1_SU32_SUS128_SPO1_SSO8_WGM19
    SolutionIndex: 6
    SolutionNameMin: Cijk_Alik_Bljk_HHS_BH_MT256x256x32_MI32x32x8x1_SN_FL2_GLS1_NTC3_NTD3_NEPBS0_ONLL0_SU32_SUS128_SPO1_SSO10_WGM19
    SolutionIndex: 7
    SolutionNameMin: Cijk_Alik_Bljk_HHS_BH_MT256x256x32_MI32x32x8x1_SN_FL0_GLS1_NTC3_NTD2_NEPBS0_ONLL1_SU32_SUS128_SPO1_SSO6_WGM19
    SolutionIndex: 8
    SolutionNameMin: Cijk_Alik_Bljk_HHS_BH_MT256x256x32_MI32x32x8x1_SN_FL2_GLS1_NTC3_NTD2_NEPBS0_ONLL0_SU32_SUS128_SPO0_SSO8_WGM18
    SolutionIndex: 9
    SolutionNameMin: Cijk_Alik_Bljk_HHS_BH_MT256x256x32_MI32x32x8x1_SN_FL0_GLS0_NTC3_NTD3_NEPBS0_ONLL2_SU32_SUS128_SPO1_SSO10_WGM19
    SolutionIndex: 10
    SolutionNameMin: Cijk_Alik_Bljk_HHS_BH_MT256x256x32_MI32x32x8x1_SN_FL0_GLS1_NTC2_NTD3_NEPBS0_ONLL0_SU32_SUS64_SPO1_SSO6_WGM18
    SolutionIndex: 11
    SolutionNameMin: Cijk_Alik_Bljk_HHS_BH_MT256x256x32_MI32x32x8x1_SN_FL0_GLS0_NTC2_NTD3_NEPBS0_ONLL1_SU0_SUS0_SPO0_SSO6_WGM18
    SolutionIndex: 12
    SolutionNameMin: Cijk_Alik_Bljk_HHS_BH_MT256x256x32_MI32x32x8x1_SN_FL2_GLS0_NTC3_NTD3_NEPBS0_ONLL2_SU32_SUS64_SPO0_SSO8_WGM19
    SolutionIndex: 13
    SolutionNameMin: Cijk_Alik_Bljk_HHS_BH_MT256x256x32_MI32x32x8x1_SN_1LDSB1_DTVA0_GLS0_LRVW8_NEPBS0_NLCA1_SU32_SUS64_SSO8_WGM12
    SolutionIndex: 14
    SolutionNameMin: Cijk_Alik_Bljk_HHS_BH_MT256x192x64_MI32x32x8x1_SN_AMAS0_GLS1_NEPBS0_PLR9_SU0_SUS0_SSO4_SVW1_TT4_96_VW1_WG64_4_1_WGM32
    SolutionIndex: 15
    SolutionNameMin: Cijk_Alik_Bljk_HHS_BH_MT256x256x32_MI32x32x8x1_SN_AMAS3_CLR0_ELFLR0_GLS1_LBSPPA128_LBSPPB128_LPA8_LPB8_LRVW8_NLCA1_SU4_SUS512_SPO1_SVW2_TT8_64_TLDS1_UMLDSA1_UMLDSB1_VW2_VFLRP0_WG32_8_1_WGM32
    SolutionIndex: 16
    SolutionNameMin: Cijk_Alik_Bljk_HHS_BH_MT256x256x32_MI32x32x8x1_SN_AMAS3_CLR0_ELFLR0_GLS0_LBSPPA128_LBSPPB128_LPA8_LPB8_LRVW8_NLCA1_SU4_SUS512_SPO0_SVW2_TT8_64_TLDS1_UMLDSA1_UMLDSB1_VW2_VFLRP0_WG32_8_1_WGM32
    SolutionIndex: 17
    SolutionNameMin: Cijk_Alik_Bljk_HHS_BH_MT256x256x32_MI32x32x8x1_SN_1LDSB1_DTVA0_GLS0_LBSPPA128_LPA8_LPB8_LRVW8_NEPBS0_NLCA1_SU32_SUS64_SSO6_WGM6
    SolutionIndex: 18
    SolutionNameMin: Cijk_Alik_Bljk_HHS_BH_MT256x256x32_MI32x32x8x1_SN_1LDSB1_DTVA0_GLS0_LBSPPA128_LPA8_LPB8_LRVW8_NEPBS0_NLCA1_SU32_SUS64_SSO8_WGM6
    SolutionIndex: 19
    SolutionNameMin: Cijk_Alik_Bljk_HHS_BH_MT256x128x64_MI16x16x16x1_SN_1LDSB1_DTVA0_GLS1_LBSPPA256_LPA16_LPB16_LRVW8_NEPBS0_NLCA1_SU32_SUS128_SSO8_WGM18
    SolutionIndex: 20
    SolutionNameMin: Cijk_Alik_Bljk_HHS_BH_MT256x256x32_MI32x32x8x1_SN_1LDSB1_DTVA0_GLS0_LBSPPA128_LPA8_LPB8_LRVW8_NEPBS0_NLCA1_SU32_SUS64_SSO8_WGM18
    SolutionIndex: 21
    SolutionNameMin: Cijk_Alik_Bljk_HHS_BH_MT256x128x64_MI16x16x16x1_SN_1LDSB1_DTVA0_GLS0_LBSPPA256_LPA16_LPB16_LRVW8_NEPBS0_NLCA1_SU0_SUS0_SSO6_WGM12
    SolutionIndex: 22
    SolutionNameMin: Cijk_Alik_Bljk_HHS_BH_MT256x224x64_MI16x16x16x1_SN_AMAS3_NEPBS8_SU2_SUS1024_SPO1_SSO0_TT8_112_VW4_WGM32
    SolutionIndex: 23
    SolutionNameMin: Cijk_Alik_Bljk_HHS_BH_MT256x224x64_MI16x16x16x1_SN_AMAS0_NEPBS0_SU2_SUS512_SPO0_SSO0_TT8_112_VW1_WGM16
    SolutionIndex: 24
    SolutionNameMin: Cijk_Alik_Bljk_HHS_BH_MT256x224x64_MI16x16x16x1_SN_AMAS3_NEPBS0_SU2_SUS512_SPO0_SSO0_TT8_112_VW4_WGM16
    SolutionIndex: 25
    SolutionNameMin: Cijk_Alik_Bljk_HHS_BH_MT256x224x64_MI16x16x16x1_SN_AMAS3_NEPBS0_SU0_SUS0_SPO0_SSO0_TT8_112_VW4_WGM16
    SolutionIndex: 26
    SolutionNameMin: Cijk_Alik_Bljk_HHS_BH_MT256x224x64_MI16x16x16x1_SN_AMAS0_NEPBS16_SU4_SUS512_SPO1_SSO0_TT8_112_VW1_WGM16
    SolutionIndex: 27
    SolutionNameMin: Cijk_Alik_Bljk_HHS_BH_MT16x16x512_MI16x16x16x1_SN_AMAS0_EPS1_GLS0_LBSPPA1024_LBSPPB1024_NEPBS0_ONLL1_PLR9_SS0_SPO1_SVW4_TT1_16_U64SL0_VW1_WSGRB1_WG16_4_4
    SolutionIndex: 28
    SolutionNameMin: Cijk_Alik_Bljk_HHS_BH_MT16x16x512_MI16x16x16x1_SN_AMAS0_EPS0_GLS1_LBSPPA1024_LBSPPB1024_NEPBS0_ONLL1_PLR9_SS1_SPO0_SVW1_TT1_16_U64SL0_VW1_WSGRB1_WG16_4_4
    SolutionIndex: 29
    SolutionNameMin: Cijk_Alik_Bljk_HHS_BH_MT32x16x512_MI16x16x16x1_SN_AMAS3_EPS0_GLS1_LBSPPA2048_LBSPPB1024_NEPBS16_ONLL1_PLR9_SS1_SPO0_SVW2_TT2_16_U64SL1_VW2_WSGRB0_WG16_4_4
    SolutionIndex: 30
    SolutionNameMin: Cijk_Alik_Bljk_HHS_BH_MT16x16x256_MI16x16x16x1_SN_AMAS0_EPS0_GLS0_LBSPPA512_LBSPPB512_NEPBS16_ONLL0_PLR5_SS0_SPO1_SVW4_TT1_16_U64SL0_VW1_WSGRB0_WG16_4_4
    SolutionIndex: 31
    SolutionNameMin: Cijk_Alik_Bljk_HHS_BH_MT32x16x256_MI16x16x16x1_SN_AMAS0_EPS1_GLS0_LBSPPA512_LBSPPB512_NEPBS0_ONLL0_PLR5_SS1_SPO0_SVW1_TT2_16_U64SL1_VW1_WSGRB0_WG16_4_4
    SolutionIndex: 32
    SolutionNameMin: Cijk_Alik_Bljk_HHS_BH_MT16x32x512_MI16x16x16x1_SN_AMAS0_EMLL0_GLS0_LBSPPA1024_LBSPPB1024_LPA16_LPB16_NEPBS16_PLR9_SS0_SPO1_SSO0_SVW4_TT1_32_VW1_WG16_4_4
    SolutionIndex: 33
    SolutionNameMin: Cijk_Alik_Bljk_HHS_BH_MT32x32x256_MI16x16x16x1_SN_AMAS3_EMLL0_GLS1_LBSPPA1024_LBSPPB512_LPA16_LPB16_NEPBS0_PLR5_SS1_SPO1_SSO0_SVW2_TT2_32_VW2_WG16_4_4
    SolutionIndex: 34
    SolutionNameMin: Cijk_Alik_Bljk_HHS_BH_MT16x64x256_MI16x16x16x1_SN_AMAS3_EMLL4_GLS0_LBSPPA512_LBSPPB512_LPA16_LPB16_NEPBS16_PLR5_SS0_SPO0_SSO0_SVW4_TT1_64_VW4_WG16_4_4
    SolutionIndex: 35
    SolutionNameMin: Cijk_Alik_Bljk_HHS_BH_MT16x32x512_MI16x16x16x1_SN_AMAS3_EMLL0_GLS1_LBSPPA1024_LBSPPB1024_LPA16_LPB16_NEPBS0_PLR9_SS0_SPO0_SSO0_SVW4_TT1_32_VW4_WG16_4_4
    SolutionIndex: 36
    SolutionNameMin: Cijk_Alik_Bljk_HHS_BH_MT64x32x256_MI16x16x16x1_SN_AMAS3_EMLL4_GLS0_LBSPPA1024_LBSPPB512_LPA16_LPB16_NEPBS16_PLR9_SS1_SPO0_SSO0_SVW2_TT2_32_VW2_WG32_4_2
    SolutionIndex: 37
    SolutionNameMin: Cijk_Alik_Bljk_HHS_BH_MT64x32x256_MI16x16x16x1_SN_AMAS0_EMLL0_GLS1_LBSPPA512_LBSPPB512_LPA16_LPB16_NEPBS16_PLR5_SS1_SPO0_SSO0_SVW1_TT4_32_VW1_WG16_4_4
    SolutionIndex: 38
    SolutionNameMin: Cijk_Alik_Bljk_HHS_BH_MT64x32x256_MI16x16x16x1_SN_AMAS3_EMLL0_GLS0_LBSPPA1024_LBSPPB512_LPA16_LPB16_NEPBS16_PLR5_SS1_SPO0_SSO0_SVW2_TT4_32_VW2_WG16_4_4
    SolutionIndex: 39
    SolutionNameMin: Cijk_Alik_Bljk_HHS_BH_MT256x224x64_MI16x16x16x1_SN_FL1_GLVWA2_GLVWB2_GRVW2_LBSPPA512_LBSPPB128_LPA4_LPB4_LRVW4_PLR5_SVW4_TT8_112_VW4_WSGRA0_WG32_8_1_WGM16
    SolutionIndex: 40
    SolutionNameMin: Cijk_Alik_Bljk_HHS_BH_MT256x256x32_MI16x16x16x1_SN_ELFLR0_GLVWA4_GLVWB4_GRVW4_GLS0_LBSPPA128_LBSPPB128_LPA4_LPB4_LRVW4_PLR3_SU8_SUS128_SVW2_TT8_128_VW2_WG32_8_1_WGM32
    SolutionIndex: 41
    SolutionNameMin: Cijk_Alik_Bljk_HHS_BH_MT256x256x32_MI32x32x8x1_SN_ELFLR0_GLVWA8_GLVWB8_GRVW8_GLS1_LBSPPA256_LBSPPB128_LPA8_LPB8_LRVW8_PLR5_SU8_SUS128_SVW4_TT4_128_VW4_WG64_4_1_WGM16
    SolutionIndex: 42
    SolutionNameMin: Cijk_Alik_Bljk_HHS_BH_MT256x256x32_MI16x16x16x1_SN_ELFLR4_GLVWA4_GLVWB4_GRVW4_GLS0_LBSPPA256_LBSPPB128_LPA4_LPB4_LRVW4_PLR3_SU8_SUS128_SVW4_TT8_128_VW4_WG32_8_1_WGM32
    SolutionIndex: 43
    SolutionNameMin: Cijk_Alik_Bljk_HHS_BH_MT256x256x32_MI32x32x8x1_SN_ELFLR4_GLVWA8_GLVWB8_GRVW8_GLS0_LBSPPA128_LBSPPB128_LPA8_LPB8_LRVW8_PLR5_SU0_SUS0_SVW2_TT4_128_VW2_WG64_4_1_WGM32
    SolutionIndex: 44
    SolutionNameMin: Cijk_Alik_Bljk_HHS_BH_MT256x224x64_MI16x16x16x1_SN_ELFLR0_GLVWA2_GLVWB2_GRVW2_GLS0_LBSPPA256_LBSPPB128_LPA4_LPB4_LRVW4_PLR5_SU8_SUS128_SVW2_TT8_112_VW2_WG32_8_1_WGM16
    SolutionIndex: 45
    SolutionNameMin: Cijk_Alik_Bljk_HHS_BH_MT256x224x64_MI16x16x16x1_SN_ELFLR4_GLVWA2_GLVWB2_GRVW2_GLS0_LBSPPA256_LBSPPB128_LPA4_LPB4_LRVW4_PLR5_SU8_SUS128_SVW2_TT8_112_VW2_WG32_8_1_WGM1
    SolutionIndex: 46
    SolutionNameMin: Cijk_Alik_Bljk_HHS_BH_MT256x224x64_MI16x16x16x1_SN_ELFLR0_GLVWA2_GLVWB2_GRVW2_GLS1_LBSPPA256_LBSPPB128_LPA4_LPB4_LRVW4_PLR5_SU8_SUS128_SVW2_TT8_112_VW2_WG32_8_1_WGM16
    SolutionIndex: 47
    SolutionNameMin: Cijk_Alik_Bljk_HHS_BH_MT256x256x32_MI32x32x8x1_SN_ELFLR4_GLVWA8_GLVWB8_GRVW8_GLS1_LBSPPA128_LBSPPB128_LPA8_LPB8_LRVW8_PLR5_SU8_SUS128_SVW2_TT4_128_VW2_WG64_4_1_WGM32
    SolutionIndex: 48
    SolutionNameMin: Cijk_Alik_Bljk_HHS_BH_MT256x224x64_MI16x16x16x1_SN_ELFLR4_GLVWA2_GLVWB2_GRVW2_GLS0_LBSPPA512_LBSPPB128_LPA4_LPB4_LRVW4_PLR5_SU8_SUS128_SVW4_TT8_112_VW4_WG32_8_1_WGM16
    SolutionIndex: 49
    SolutionNameMin: Cijk_Alik_Bljk_HHS_BH_MT256x256x32_MI16x16x16x1_SN_ELFLR0_GLVWA2_GLVWB2_GRVW2_GLS0_LBSPPA256_LBSPPB128_LPA4_LPB4_LRVW4_PLR3_SU0_SUS0_SVW4_TT8_128_VW4_WG32_8_1_WGM32
    SolutionIndex: 50
    SolutionNameMin: Cijk_Alik_Bljk_HHS_BH_MT256x256x32_MI32x32x8x1_SN_ELFLR0_GLVWA8_GLVWB8_GRVW8_GLS0_LBSPPA128_LBSPPB128_LPA8_LPB8_LRVW8_PLR5_SU0_SUS0_SVW2_TT4_128_VW2_WG64_4_1_WGMn16
    SolutionIndex: 51
    SolutionNameMin: Cijk_Alik_Bljk_HHS_BH_MT16x16x512_MI16x16x16x1_SN_AMAS0_GLVWB8_GSU1_GSUASB_GLS1_LBSPPA1024_LBSPPB1024_PLR9_SS1_SU0_SUS0_SPO0_SVW1_TT1_16_VW1_WG16_4_4
    SolutionIndex: 52
    SolutionNameMin: Cijk_Alik_Bljk_HHS_BH_MT16x16x512_MI16x16x16x1_SN_AMAS0_GLVWB8_GSU1_GSUASB_GLS1_LBSPPA1024_LBSPPB1024_PLR9_SS0_SU0_SUS0_SPO0_SVW4_TT1_16_VW1_WG16_4_4
    SolutionIndex: 53
    SolutionNameMin: Cijk_Alik_Bljk_HHS_BH_MT16x16x512_MI16x16x16x1_SN_AMAS0_GLVWB8_GSU1_GSUASB_GLS0_LBSPPA1024_LBSPPB1024_LPA16_LPB16_PLR9_SS0_SPO0_SVW4_TT1_16_VW1_WSGRA1_WG16_4_4
    SolutionIndex: 54
    SolutionNameMin: Cijk_Alik_Bljk_HHS_BH_MT32x16x128_MI16x16x16x1_SN_AMAS0_GLVWB8_GSU1_GSUASB_GLS0_LBSPPA256_LBSPPB256_PLR5_SS1_SU0_SUS0_SPO0_SVW1_TT1_16_VW1_WG32_4_2
    SolutionIndex: 55
    SolutionNameMin: Cijk_Alik_Bljk_HHS_BH_MT16x16x256_MI16x16x16x1_SN_AMAS0_GLVWB8_GSU1_GSUASB_GLS0_LBSPPA512_LBSPPB512_PLR5_SS1_SU0_SUS0_SPO1_SVW1_TT1_16_VW1_WG16_4_4
    SolutionIndex: 56
    SolutionNameMin: Cijk_Alik_Bljk_HHS_BH_MT64x16x64_MI16x16x16x1_SN_AMAS0_GLVWB4_GSU4_GSUAMB_GLS0_LBSPPA128_LBSPPB128_PLR5_SS0_SU0_SUS0_SPO0_SVW4_TT1_16_VW1_WG64_4_1
    SolutionIndex: 57
    SolutionNameMin: Cijk_Alik_Bljk_HHS_BH_MT32x16x256_MI16x16x16x1_SN_AMAS3_GLVWB8_GSU1_GSUASB_GLS1_LBSPPA1024_LBSPPB512_PLR5_SS1_SU0_SUS0_SPO0_SVW2_TT2_16_VW2_WG16_4_4
    SolutionIndex: 58
    SolutionNameMin: Cijk_Alik_Bljk_HHS_BH_MT32x16x256_MI16x16x16x1_SN_AMAS3_GLVWB8_GSU1_GSUASB_GLS0_LBSPPA1024_LBSPPB512_PLR5_SS1_SU0_SUS0_SPO1_SVW2_TT2_16_VW2_WG16_4_4
    SolutionIndex: 59
    SolutionNameMin: Cijk_Alik_Bljk_HHS_BH_MT32x16x256_MI16x16x16x1_SN_AMAS3_GLVWB8_GSU1_GSUASB_GLS0_LBSPPA1024_LBSPPB512_PLR5_SS1_SU0_SUS0_SPO0_SVW2_TT2_16_VW2_WG16_4_4
    SolutionIndex: 60
    SolutionNameMin: Cijk_Alik_Bljk_HHS_BH_MT16x16x256_MI16x16x16x1_SN_AMAS3_GLVWB8_GSU1_GSUASB_GLS0_LBSPPA512_LBSPPB512_PLR5_SS0_SU0_SUS0_SPO1_SVW4_TT1_16_VW4_WG16_4_4
    SolutionIndex: 61
    SolutionNameMin: Cijk_Alik_Bljk_HHS_BH_MT32x16x256_MI16x16x16x1_SN_AMAS3_GLVWB8_GSU1_GSUASB_GLS1_LBSPPA1024_SPO0_SVW2_TT2_16_VW2
    SolutionIndex: 62
    SolutionNameMin: Cijk_Alik_Bljk_HHS_BH_MT32x16x256_MI16x16x16x1_SN_AMAS3_GLVWB4_GSU1_GSUASB_GLS0_LBSPPA1024_SPO0_SVW2_TT2_16_VW2
    SolutionIndex: 63
    SolutionNameMin: Cijk_Alik_Bljk_HHS_BH_MT16x16x256_MI16x16x16x1_SN_AMAS0_GLVWA4_GLVWB4_LBSPPA512_SS0_SVW4_TT1_16_VW1
    SolutionIndex: 64
    SolutionNameMin: Cijk_Alik_Bljk_HHS_BH_MT64x16x256_MI16x16x16x1_SN_AMAS3_GLVWB8_GSU1_GSUASB_GLS1_LBSPPA512_LBSPPB512_PLR17_SS0_SU0_SUS0_SPO0_SVW4_TT1_16_VW2_WG64_4_1
    SolutionIndex: 65
    SolutionNameMin: Cijk_Alik_Bljk_HHS_BH_MT16x16x256_MI16x16x16x1_SN_AMAS0_GLVWA8_GLVWB8_LBSPPA512_SS0_SVW4_TT1_16_VW1
    SolutionIndex: 66
    SolutionNameMin: Cijk_Alik_Bljk_HHS_BH_MT64x16x128_MI16x16x16x1_SN_AMAS3_GLVWA8_GLVWB8_GSU1_GSUASB_GLS1_LBSPPA256_LBSPPB256_NLCA1_NLCB1_PLR9_SS0_SU4_SUS256_SPO1_SVW4_TT1_16_VW4_WG64_4_1
    SolutionIndex: 67
    SolutionNameMin: Cijk_Alik_Bljk_HHS_BH_MT192x16x64_MI16x16x16x1_SN_AMAS3_GLVWA8_GLVWB4_GSU3_GSUAMB_GLS0_LBSPPA128_LBSPPB128_NLCA1_NLCB1_PLR5_SS0_SU0_SUS0_SPO1_SVW4_TT3_16_VW2_WG64_4_1
    SolutionIndex: 68
    SolutionNameMin: Cijk_Alik_Bljk_HHS_BH_MT32x16x256_MI16x16x16x1_SN_AMAS3_GLVWB4_GSU1_GSUASB_GLS0_LBSPPA1024_PLR5_SPO1_SSO0_SVW2_TT2_16_VW2_WG16_4_4
    SolutionIndex: 69
    SolutionNameMin: Cijk_Alik_Bljk_HHS_BH_MT32x16x256_MI16x16x16x1_SN_AMAS0_GLVWB4_GSU1_GSUASB_GLS1_LBSPPA512_PLR5_SPO1_SSO0_SVW1_TT2_16_VW1_WG16_4_4
    SolutionIndex: 70
    SolutionNameMin: Cijk_Alik_Bljk_HHS_BH_MT128x16x128_MI16x16x16x1_SN_AMAS3_GLVWA8_GLVWB8_GSU1_GSUASB_GLS0_LBSPPA512_LBSPPB256_NLCA1_NLCB1_PLR9_SS1_SU0_SUS0_SPO1_SVW2_TT2_16_VW2_WG64_4_1
    SolutionIndex: 71
    SolutionNameMin: Cijk_Alik_Bljk_HHS_BH_MT128x16x128_MI16x16x16x1_SN_AMAS3_GLVWA8_GLVWB8_GSU1_GSUASB_GLS0_LBSPPA256_LBSPPB256_NLCA1_NLCB1_PLR9_SS0_SU0_SUS0_SPO0_SVW4_TT2_16_VW4_WG64_4_1
    SolutionIndex: 72
    SolutionNameMin: Cijk_Alik_Bljk_HHS_BH_MT192x16x128_MI16x16x16x1_SN_AMAS3_GLVWA8_GLVWB8_GSU2_GSUAMB_GLS1_LBSPPA256_LBSPPB256_NLCA1_NLCB1_PLR9_SS0_SU8_SUS256_SPO1_SVW4_TT3_16_VW4_WG64_4_1
    SolutionIndex: 73
    SolutionNameMin: Cijk_Alik_Bljk_HHS_BH_MT128x16x128_MI16x16x16x1_SN_AMAS0_GLVWA8_GLVWB8_GSU1_GSUASB_GLS0_LBSPPA256_LBSPPB256_NLCA1_NLCB1_PLR5_SS1_SU8_SUS256_SPO0_SVW1_TT4_16_VW1_WG32_4_2
    SolutionIndex: 74
    SolutionNameMin: Cijk_Alik_Bljk_HHS_BH_MT192x16x128_MI16x16x16x1_SN_AMAS3_GLVWA8_GLVWB4_GSU1_GSUASB_GLS0_LBSPPA256_LBSPPB256_NLCA1_NLCB1_PLR9_SS0_SU8_SUS256_SPO0_SVW4_TT3_16_VW2_WG64_4_1
    SolutionIndex: 75
    SolutionNameMin: Cijk_Alik_Bljk_HHS_BH_MT192x16x128_MI16x16x16x1_SN_AMAS3_GLVWA4_GLVWB8_GSU1_GSUASB_GLS0_LBSPPA256_LBSPPB256_NLCA1_NLCB1_PLR9_SS0_SU8_SUS256_SPO0_SVW4_TT3_16_VW4_WG64_4_1
    SolutionIndex: 76
    SolutionNameMin: Cijk_Alik_Bljk_HHS_BH_MT32x16x256_MI16x16x16x1_SN_AMAS3_GLVWB8_GSU1_GSUASB_GLS1_LBSPPA1024_LBSPPB512_PLR5_SS1_SU0_SUS0_SVW2_TT2_16_VW2_WG16_4_4
    SolutionIndex: 77
    SolutionNameMin: Cijk_Alik_Bljk_HHS_BH_MT32x16x128_MI16x16x16x1_SN_AMAS3_GLVWB8_GSU1_GSUASB_GLS1_LBSPPA256_LBSPPB256_PLR5_SS0_SU4_SUS256_SVW4_TT1_16_VW2_WG32_4_2
    SolutionIndex: 78
    SolutionNameMin: Cijk_Alik_Bljk_HHS_BH_MT128x16x128_MI16x16x16x1_SN_AMAS0_GLVWB8_GSU4_GSUAMB_GLS0_LBSPPA256_LBSPPB256_PLR9_SS0_SU4_SUS256_SVW4_TT2_16_VW1_WG64_4_1
    SolutionIndex: 79
    SolutionNameMin: Cijk_Alik_Bljk_HHS_BH_MT16x16x512_MI16x16x16x1_SN_AMAS3_GLVWA8_GLVWB8_GRVW8_GSU1_GSUASB_GLS1_LBSPPA1024_LBSPPB1024_LPA16_LPB16_PLR9_SS0_SU0_SUS0_SPO1_SVW4_TT1_16_VW2_WG16_4_4
    SolutionIndex: 80
    SolutionNameMin: Cijk_Alik_Bljk_HHS_BH_MT16x16x512_MI16x16x16x1_SN_AMAS3_GLVWA8_GLVWB8_GRVW8_GSU1_GSUASB_GLS1_LBSPPA1024_LBSPPB1024_LPA16_LPB16_PLR9_SS0_SU0_SUS0_SPO0_SVW4_TT1_16_VW4_WG16_4_4
    SolutionIndex: 81
    SolutionNameMin: Cijk_Alik_Bljk_HHS_BH_MT16x32x512_MI16x16x16x1_SN_AMAS3_GLVWA8_GLVWB8_GRVW8_GSU1_GSUASB_GLS1_LBSPPA1024_LBSPPB1024_LPA16_LPB16_PLR9_SS0_SU0_SUS0_SPO0_SVW4_TT1_32_VW2_WG16_4_4
    SolutionIndex: 82
    SolutionNameMin: Cijk_Alik_Bljk_HHS_BH_MT16x32x512_MI16x16x16x1_SN_AMAS3_GLVWA8_GLVWB8_GRVW8_GSU1_GSUASB_GLS1_LBSPPA1024_LBSPPB1024_LPA16_LPB16_PLR9_SS0_SU0_SUS0_SPO0_SVW4_TT1_32_VW4_WG16_4_4
    SolutionIndex: 83
    SolutionNameMin: Cijk_Alik_Bljk_HHS_BH_MT32x16x512_MI16x16x16x1_SN_AMAS0_GLVWB8_GSU1_GSUASB_GLS0_LBSPPA1024_LBSPPB1024_LPA16_LPB16_PLR9_SS1_SPO1_SVW1_TT2_16_VW1_WSGRA0_WG16_4_4
    SolutionIndex: 84
    SolutionNameMin: Cijk_Alik_Bljk_HHS_BH_MT16x32x512_MI16x16x16x1_SN_AMAS0_GLVWB8_GSU1_GSUASB_GLS0_LBSPPA1024_LBSPPB1024_LPA16_LPB16_PLR9_SS1_SPO1_SVW1_TT1_32_VW1_WSGRA1_WG16_4_4
    SolutionIndex: 85
    SolutionNameMin: Cijk_Alik_Bljk_HHS_BH_MT32x32x128_MI16x16x16x1_SN_AMAS0_GLVWA8_GLVWB8_GRVW8_GSU1_GSUASB_GLS0_LBSPPA256_LBSPPB256_LPA16_LPB16_PLR9_SS1_SU0_SUS0_SPO1_SVW1_TT1_16_VW1_WG32_8_1
    SolutionIndex: 86
    SolutionNameMin: Cijk_Alik_Bljk_HHS_BH_MT32x32x256_MI32x32x8x1_SN_AMAS0_FL0_GLVWB8_GSU1_GSUASB_GLS0_LBSPPA512_LPA8_LPB8_PLR9_SS1_SPO0_SVW1_TT1_32_VW1_WSGRA1_WG32_2_4
    SolutionIndex: 87
    SolutionNameMin: Cijk_Alik_Bljk_HHS_BH_MT32x32x128_MI32x32x8x1_SN_AMAS0_GLVWA8_GLVWB8_GRVW8_GSU1_GSUASB_GLS0_LBSPPA256_LBSPPB256_LPA8_LPB8_PLR5_SS1_SU0_SUS0_SPO0_SVW1_TT1_32_VW1_WG32_2_4
    SolutionIndex: 88
    SolutionNameMin: Cijk_Alik_Bljk_HHS_BH_MT32x32x256_MI32x32x8x1_SN_AMAS0_GLVWA8_GLVWB8_GRVW8_GSU1_GSUASB_GLS1_LBSPPA512_LBSPPB512_LPA8_LPB8_PLR9_SS1_SU0_SUS0_SPO0_SVW1_TT1_32_VW1_WG32_2_4
    SolutionIndex: 89
    SolutionNameMin: Cijk_Alik_Bljk_HHS_BH_MT32x32x128_MI32x32x8x1_SN_AMAS0_GLVWA8_GLVWB8_GRVW8_GSU1_GSUASB_GLS1_LBSPPA256_LBSPPB256_LPA8_LPB8_PLR5_SS1_SU4_SUS256_SPO0_SVW1_TT1_32_VW1_WG32_2_4
    SolutionIndex: 90
    SolutionNameMin: Cijk_Alik_Bljk_HHS_BH_MT32x32x256_MI16x16x16x1_SN_AMAS3_GLVWA8_GLVWB8_GRVW8_GSU1_GSUASB_GLS1_LBSPPA1024_LBSPPB512_LPA16_LPB16_PLR5_SS1_SU0_SUS0_SPO0_SVW2_TT2_32_VW2_WG16_4_4
    SolutionIndex: 91
    SolutionNameMin: Cijk_Alik_Bljk_HHS_BH_MT32x32x256_MI16x16x16x1_SN_AMAS3_GLVWA8_GLVWB8_GRVW8_GSU1_GSUASB_GLS0_LBSPPA1024_LBSPPB512_LPA16_LPB16_PLR5_SS1_SU0_SUS0_SPO0_SVW2_TT2_32_VW2_WG16_4_4
    SolutionIndex: 92
    SolutionNameMin: Cijk_Alik_Bljk_HHS_BH_MT64x32x256_MI16x16x16x1_SN_AMAS3_GLVWA8_GLVWB8_GRVW8_GSU1_GSUASB_GLS1_LBSPPA1024_LBSPPB512_LPA16_LPB16_PLR5_SS1_SU0_SUS0_SPO0_SVW2_TT4_32_VW2_WG16_4_4
    SolutionIndex: 93
    SolutionNameMin: Cijk_Alik_Bljk_HHS_BH_MT32x32x256_MI16x16x16x1_SN_AMAS3_GLVWB8_GSU1_GSUASB_GLS1_LBSPPA1024_SPO1_SVW2_TT2_32_VW2
    SolutionIndex: 94
    SolutionNameMin: Cijk_Alik_Bljk_HHS_BH_MT16x32x256_MI16x16x16x1_SN_AMAS0_GLVWA8_GLVWB8_GRVW8_GSU1_GSUASB_GLS1_LBSPPA512_LBSPPB512_LPA16_LPB16_PLR5_SS1_SU0_SUS0_SPO1_SVW1_TT1_32_VW1_WG16_4_4
    SolutionIndex: 95
    SolutionNameMin: Cijk_Alik_Bljk_HHS_BH_MT32x32x256_MI16x16x16x1_SN_AMAS0_GLVWB8_GSU1_GSUASB_GLS0_LBSPPA512_SPO1_SVW1_TT2_32_VW1
    SolutionIndex: 96
    SolutionNameMin: Cijk_Alik_Bljk_HHS_BH_MT64x16x256_MI16x16x16x1_SN_AMAS0_GLVWA8_GLVWB8_GRVW8_GSU1_GSUASB_GLS0_LBSPPA512_LBSPPB512_LPA16_LPB16_PLR17_SS1_SU0_SUS0_SPO1_SVW1_TT1_16_VW1_WG64_4_1
    SolutionIndex: 97
    SolutionNameMin: Cijk_Alik_Bljk_HHS_BH_MT64x32x256_MI16x16x16x1_SN_AMAS3_GLVWA8_GLVWB8_GRVW8_GSU1_GSUASB_GLS0_LBSPPA1024_LBSPPB512_LPA16_LPB16_PLR9_SS1_SU0_SUS0_SPO1_SVW2_TT2_32_VW2_WG32_4_2
    SolutionIndex: 98
    SolutionNameMin: Cijk_Alik_Bljk_HHS_BH_MT64x16x256_MI16x16x16x1_SN_AMAS3_GLVWA8_GLVWB8_GRVW8_GSU1_GSUASB_GLS0_LBSPPA1024_LBSPPB512_LPA16_LPB16_PLR5_SS1_SU0_SUS0_SPO1_SVW2_TT4_16_VW2_WG16_4_4
    SolutionIndex: 99
    SolutionNameMin: Cijk_Alik_Bljk_HHS_BH_MT64x32x128_MI32x32x8x1_SN_AMAS3_GLVWA4_GLVWB8_GLS0_LBSPPA512_LBSPPB256_LPA8_LPB8_PLR5_SU8_SUS256_SPO0_SVW2_TT2_32_VW2_WG32_2_4
    SolutionIndex: 100
    SolutionNameMin: Cijk_Alik_Bljk_HHS_BH_MT128x16x128_MI16x16x16x1_SN_AMAS3_GLVWA8_GLVWB8_GLS0_LBSPPA512_LBSPPB256_LPA16_LPB16_PLR5_SU0_SUS0_SPO1_SVW2_TT4_16_VW2_WG32_4_2
    SolutionIndex: 101
    SolutionNameMin: Cijk_Alik_Bljk_HHS_BH_MT64x32x128_MI32x32x8x1_SN_AMAS0_GLVWA4_GLVWB8_GLS0_LBSPPA256_LBSPPB256_LPA8_LPB8_PLR9_SU8_SUS256_SPO0_SVW1_TT1_32_VW1_WG64_2_2
    SolutionIndex: 102
    SolutionNameMin: Cijk_Alik_Bljk_HHS_BH_MT32x32x128_MI16x16x16x1_SN_AMAS3_GLVWA8_GLVWB8_GLS0_LBSPPA512_LBSPPB256_LPA16_LPB16_PLR5_SU8_SUS256_SPO1_SVW2_TT2_16_VW2_WG16_8_2
    SolutionIndex: 103
    SolutionNameMin: Cijk_Alik_Bljk_HHS_BH_MT128x32x128_MI16x16x16x1_SN_AMAS3_GLVWA8_GLVWB8_GLS0_LBSPPA1024_LBSPPB256_LPA16_LPB16_PLR5_SU0_SUS0_SPO0_SVW4_TT4_32_VW4_WG32_4_2
    SolutionIndex: 104
    SolutionNameMin: Cijk_Alik_Bljk_HHS_BH_MT128x32x128_MI32x32x8x1_SN_AMAS3_GLVWA8_GLVWB8_GLS1_LBSPPA1024_LBSPPB256_LPA8_LPB8_PLR5_SU0_SUS0_SPO1_SVW4_TT4_32_VW4_WG32_2_4
    SolutionIndex: 105
    SolutionNameMin: Cijk_Alik_Bljk_HHS_BH_MT96x32x128_MI16x16x16x1_SN_AMAS0_GLVWA8_GLVWB8_GLS0_LBSPPA256_LBSPPB256_LPA16_LPB16_PLR9_SU8_SUS256_SPO0_SVW1_TT3_16_VW1_WG32_8_1
    SolutionIndex: 106
    SolutionNameMin: Cijk_Alik_Bljk_HHS_BH_MT128x32x128_MI32x32x8x1_SN_AMAS0_GLVWA8_GLVWB8_GLS1_LBSPPA256_LBSPPB256_LPA8_LPB8_PLR5_SU8_SUS256_SPO0_SVW1_TT4_32_VW1_WG32_2_4
    SolutionIndex: 107
    SolutionNameMin: Cijk_Alik_Bljk_HHS_BH_MT64x32x128_MI16x16x16x1_SN_AMAS3_GLVWA8_GLVWB8_GLS0_LBSPPA512_LBSPPB256_LPA16_LPB16_PLR5_SU8_SUS256_SPO1_SVW2_TT2_32_VW2_WG32_4_2
    SolutionIndex: 108
    SolutionNameMin: Cijk_Alik_Bljk_HHS_BH_MT192x32x128_MI16x16x16x1_SN_AMAS3_GLVWA8_GLVWB8_GLS0_LBSPPA512_LBSPPB256_LPA16_LPB16_PLR9_SU4_SUS256_SPO0_SVW2_TT6_16_VW2_WG32_8_1
    SolutionIndex: 109
    SolutionNameMin: Cijk_Alik_Bljk_HHS_BH_MT128x32x128_MI16x16x16x1_SN_AMAS3_GLVWB8_GSU4_GSUAMB_LBSPPA512_LBSPPB256_LPA16_LPB16_NLCB1_PLR9_SU0_SUS0_SPO0_SVW2_TT2_32_VW2_WG64_4_1
    SolutionIndex: 110
    SolutionNameMin: Cijk_Alik_Bljk_HHS_BH_MT128x16x128_MI16x16x16x1_SN_AMAS0_GLVWB8_GSU2_GSUAMB_LBSPPA256_LBSPPB256_LPA16_LPB16_NLCB1_PLR5_SU4_SUS256_SPO1_SVW1_TT4_16_VW1_WG32_4_2
    SolutionIndex: 111
    SolutionNameMin: Cijk_Alik_Bljk_HHS_BH_MT128x32x128_MI16x16x16x1_SN_AMAS3_GLVWB8_GSU4_GSUAMB_LBSPPA1024_LBSPPB256_LPA16_LPB16_NLCB1_PLR5_SU4_SUS256_SPO1_SVW4_TT4_32_VW4_WG32_4_2
    SolutionIndex: 112
    SolutionNameMin: Cijk_Alik_Bljk_HHS_BH_MT16x32x128_MI16x16x16x1_SN_AMAS0_EMLL0_GLS1_LBSPPA256_LBSPPB256_LPA16_LPB16_NEPBS0_PLR5_SS0_SPO0_SSO4_SVW4_TT1_32_VW1_WG16_4_2
    SolutionIndex: 113
    SolutionNameMin: Cijk_Alik_Bljk_HHS_BH_MT64x64x64_MI16x16x16x1_SN_AMAS3_ELFLR0_GLVWA8_GLVWB2_LBSPPA512_LPA16_LPB16_LRVW8_PLR5_SU64_SUS128_SSO0_SVW4_TT4_16_VW4_WG16_16_1_WGM48
    SolutionIndex: 114
    SolutionNameMin: Cijk_Alik_Bljk_HHS_BH_MT64x64x64_MI16x16x16x1_SN_AMAS3_ELFLR0_GLVWA2_GLVWB8_LBSPPA256_LPA16_LPB16_LRVW8_PLR5_SU64_SUS128_SSO0_SVW2_TT2_32_VW2_WG32_8_1_WGM8
    SolutionIndex: 115
    SolutionNameMin: Cijk_Alik_Bljk_HHS_BH_MT64x64x64_MI16x16x16x1_SN_AMAS0_ELFLR4_GLVWA8_GLVWB8_LBSPPA128_LPA16_LPB16_LRVW8_PLR5_SU8_SUS256_SSO0_SVW1_TT2_32_VW1_WG32_8_1_WGM48
    SolutionIndex: 116
    SolutionNameMin: Cijk_Alik_Bljk_HHS_BH_MT64x64x64_MI16x16x16x1_SN_AMAS3_ELFLR4_GLVWA8_GLVWB4_LBSPPA256_LPA16_LPB16_LRVW8_PLR5_SU8_SUS128_SSO0_SVW2_TT2_32_VW2_WG32_8_1_WGMn48
    SolutionIndex: 117
    SolutionNameMin: Cijk_Alik_Bljk_HHS_BH_MT64x64x64_MI16x16x16x1_SN_AMAS3_ELFLR4_GLVWA2_GLVWB4_LBSPPA256_LPA4_LPB4_LRVW4_PLR1_SU64_SUS128_SSO0_SVW2_TT2_32_VW2_WG32_8_1_WGMn48
    SolutionIndex: 118
    SolutionNameMin: Cijk_Alik_Bljk_HHS_BH_MT32x32x64_MI16x16x16x1_SN_GLVWA2_GLVWB2_LPA4_LPB4_LRVW4_PLR1_SU0_SUS0_WGM1
    SolutionIndex: 119
    SolutionNameMin: Cijk_Alik_Bljk_HHS_BH_MT128x128x64_MI16x16x16x1_SN_GLVWA8_GLVWB8_GRVW8_LPA8_LPB8_NEPBS16_PLR5_SU0_SUS0_SPO1_SSO0_TT4_64_VW4_WG32_8_1_WGM32
    SolutionIndex: 120
    SolutionNameMin: Cijk_Alik_Bljk_HHS_BH_MT128x128x64_MI32x32x8x1_SN_GLVWA8_GLVWB8_GRVW8_LPA8_LPB8_NEPBS16_PLR9_SU2_SUS512_SPO0_SSO4_TT2_64_VW8_WG64_4_1_WGM48
    SolutionIndex: 121
    SolutionNameMin: Cijk_Alik_Bljk_HHS_BH_MT128x128x64_MI16x16x16x1_SN_GLVWA8_GLVWB8_GRVW8_LPA8_LPB8_NEPBS0_PLR1_SU8_SUS512_SPO0_SSO0_TT4_64_VW8_WG32_8_1_WGM16
    SolutionIndex: 122
    SolutionNameMin: Cijk_Alik_Bljk_HHS_BH_MT128x128x64_MI32x32x8x1_SN_GLVWA8_GLVWB8_GRVW8_LPA8_LPB8_NEPBS8_PLR9_SU16_SUS512_SPO0_SSO4_TT2_64_VW4_WG64_4_1_WGM16
    SolutionIndex: 123
    SolutionNameMin: Cijk_Alik_Bljk_HHS_BH_MT128x128x64_MI16x16x16x1_SN_GLVWA8_GLVWB8_GRVW8_LPA8_LPB8_NEPBS0_PLR5_SU64_SUS1024_SPO0_SSO4_TT4_64_VW4_WG32_8_1_WGM16
    SolutionIndex: 124
    SolutionNameMin: Cijk_Alik_Bljk_HHS_BH_MT128x128x64_MI32x32x8x1_SN_GLVWA8_GLVWB8_GRVW8_LPA8_LPB8_NEPBS8_PLR1_SU0_SUS0_SPO0_SSO0_TT2_64_VW8_WG64_4_1_WGM16
    SolutionIndex: 125
    SolutionNameMin: Cijk_Alik_Bljk_HHS_BH_MT32x32x128_MI16x16x16x1_SN_ELFLR4_GLVWA8_GLVWB8_GRVW8_GSU1_GSUASB_LBSPPA256_LBSPPB256_LPA8_LPB8_MKFGSU256_NEPBS4_PLR1_SU0_SUS0_SSO0_TT1_16_WG32_8_1_WGM1
    SolutionIndex: 126
    SolutionNameMin: Cijk_Alik_Bljk_HHS_BH_MT32x32x128_MI16x16x16x1_SN_ELFLR4_GLVWA8_GLVWB8_GRVW8_GSU1_GSUASB_LBSPPA256_LBSPPB256_LPA8_LPB8_MKFGSU256_NEPBS4_PLR9_SU0_SUS0_SSO0_TT1_16_WG32_8_1_WGM1
    SolutionIndex: 127
    SolutionNameMin: Cijk_Alik_Bljk_HHS_BH_MT32x32x128_MI16x16x16x1_SN_ELFLR4_GLVWA4_GLVWB4_GRVW4_GSU1_GSUASB_LBSPPA256_LBSPPB256_LPA4_LPB4_MKFGSU256_NEPBS16_PLR1_SU0_SUS0_SSO0_TT1_16_WG32_8_1_WGM1
    SolutionIndex: 128
    SolutionNameMin: Cijk_Alik_Bljk_HHS_BH_MT16x16x128_MI16x16x16x1_SN_ELFLR0_GLVWA8_GLVWB8_GRVW8_GSU1_GSUASB_LBSPPA256_LBSPPB256_LPA8_LPB8_MKFGSU256_NEPBS4_PLR1_SU0_SUS0_SSO0_TT1_16_WG16_4_1_WGM16
    SolutionIndex: 129
    SolutionNameMin: Cijk_Alik_Bljk_HHS_BH_MT16x16x128_MI16x16x16x1_SN_ELFLR4_GLVWA8_GLVWB8_GRVW8_GSU1_GSUASB_LBSPPA256_LBSPPB256_LPA8_LPB8_MKFGSU256_NEPBS16_PLR1_SU0_SUS0_SSO0_TT1_16_WG16_4_1_WGM16
    SolutionIndex: 130
    SolutionNameMin: Cijk_Alik_Bljk_HHS_BH_MT16x16x128_MI16x16x16x1_SN_ELFLR4_GLVWA8_GLVWB8_GRVW8_GSU1_GSUASB_LBSPPA256_LBSPPB256_LPA8_LPB8_MKFGSU256_NEPBS4_PLR1_SU0_SUS0_SSO0_TT1_16_WG16_4_1_WGM16
    SolutionIndex: 131
    SolutionNameMin: Cijk_Alik_Bljk_HHS_BH_MT32x32x64_MI16x16x16x1_SN_ELFLR0_GSU1_GSUASB_GLS1_LBSPPA128_LBSPPB128_LPA4_LPB4_MIAV1_MKFGSU256_SS1_SU0_SUS0_SVW1_TLDS1_UMLDSA1_UMLDSB1_VFLRP0_WGM1
    SolutionIndex: 132
    SolutionNameMin: Cijk_Alik_Bljk_HHS_BH_MT32x32x64_MI16x16x16x1_SN_ELFLR4_GSU1_GSUASB_GLS0_LBSPPA128_LBSPPB128_LPA4_LPB4_MIAV0_MKFGSU256_SS1_SU0_SUS0_SVW1_TLDS1_UMLDSA1_UMLDSB1_VFLRP0_WGM1
    SolutionIndex: 133
    SolutionNameMin: Cijk_Alik_Bljk_HHS_BH_MT32x32x64_MI16x16x16x1_SN_ELFLR0_GSU1_GSUASB_GLS0_LBSPPA128_LBSPPB128_LPA4_LPB4_MIAV0_MKFGSU256_SS1_SU0_SUS0_SVW1_TLDS1_UMLDSA1_UMLDSB1_VFLRP0_WGM16
    SolutionIndex: 134
    SolutionNameMin: Cijk_Alik_Bljk_HHS_BH_MT32x32x64_MI16x16x16x1_SN_ELFLR0_GSU1_GSUASB_GLS0_LBSPPA128_LBSPPB128_LPA4_LPB4_MIAV1_MKFGSU256_SS1_SU0_SUS0_SVW1_TLDS1_UMLDSA1_UMLDSB1_VFLRP0_WGM16
    SolutionIndex: 135
    SolutionNameMin: Cijk_Alik_Bljk_HHS_BH_MT32x32x32_MI16x16x16x1_SN_ELFLR4_GSU1_GSUASB_GLS0_LBSPPA128_LBSPPB128_LPA4_LPB4_MIAV0_MKFGSU256_SS0_SU0_SUS0_SVW4_TLDS1_UMLDSA1_UMLDSB1_VFLRP0_WGM1
    SolutionIndex: 136
    SolutionNameMin: Cijk_Alik_Bljk_HHS_BH_MT32x32x64_MI16x16x16x1_SN_ELFLR0_GSU1_GSUASB_GLS1_LBSPPA128_LBSPPB128_LPA4_LPB4_MIAV1_MKFGSU256_SS0_SU0_SUS0_SVW4_TLDS1_UMLDSA1_UMLDSB1_VFLRP0_WGM16
- - - [12288, 9728, 1, 16512]
    - [0, 83.215]
  - - [6144, 4864, 1, 4096]
    - [1, 72.688]
  - - [6144, 4864, 1, 8192]
    - [2, 81.645]
  - - [6144, 4864, 1, 16384]
    - [3, 70.351]
  - - [6144, 9728, 1, 4096]
    - [4, 70.358]
  - - [6144, 9728, 1, 8192]
    - [5, 72.553]
  - - [6144, 9728, 1, 16384]
    - [6, 63.371]
  - - [9216, 4864, 1, 4096]
    - [7, 70.002]
  - - [9216, 4864, 1, 8192]
    - [8, 75.338]
  - - [9216, 4864, 1, 16384]
    - [9, 67.44]
  - - [6144, 4864, 1, 4352]
    - [10, 73.763]
  - - [6144, 4864, 1, 8448]
    - [11, 77.512]
  - - [6144, 4864, 1, 16640]
    - [12, 63.729]
  - - [4864, 3072, 1, 4096]
    - [18, 78.828]
  - - [12288, 9728, 1, 16416]
    - [50, 63.012]
  - - [12320, 9728, 1, 16512]
    - [13, 74.895]
  - - [4864, 4096, 1, 8192]
    - [41, 61.551]
  - - [9728, 8192, 1, 8192]
    - [16, 69.278]
  - - [9728, 8192, 1, 65536]
    - [14, 55.219]
  - - [8192, 8192, 1, 8192]
    - [15, 63.041]
  - - [4864, 3072, 1, 2048]
    - [17, 80.381]
  - - [4864, 3072, 1, 6144]
    - [19, 78.468]
  - - [4864, 3072, 1, 8192]
    - [17, 92.627]
  - - [3072, 4864, 1, 2048]
    - [17, 80.114]
  - - [3072, 4864, 1, 4096]
    - [20, 82.172]
  - - [3072, 4864, 1, 6144]
    - [21, 79.244]
  - - [3072, 4864, 1, 8192]
    - [17, 92.618]
  - - [7168, 65536, 1, 28672]
    - [22, 92.58]
  - - [21504, 65536, 1, 7168]
    - [23, 85.12]
  - - [28672, 65536, 1, 7168]
    - [24, 85.24]
  - - [7168, 65536, 1, 7168]
    - [25, 88.18]
  - - [50432, 65536, 1, 7168]
    - [26, 84.64]
  - - [4000, 8, 1, 8192]
    - [27, 2.312]
  - - [1280, 8, 1, 8192]
    - [28, 1.399]
  - - [8192, 8, 1, 1024]
    - [29, 1.505]
  - - [7168, 8, 1, 8192]
    - [30, 2.822]
  - - [8192, 8, 1, 3584]
    - [31, 2.859]
  - - [4000, 32, 1, 8192]
    - [32, 9.573]
  - - [1280, 32, 1, 8192]
    - [79, 4.769]
  - - [8192, 32, 1, 1024]
    - [96, 5.288]
  - - [7168, 32, 1, 8192]
    - [94, 11.855]
  - - [8192, 32, 1, 3584]
    - [33, 11.752]
  - - [4000, 64, 1, 8192]
    - [34, 16.166]
  - - [1280, 64, 1, 8192]
    - [35, 8.604]
  - - [8192, 64, 1, 1024]
    - [36, 12.981]
  - - [7168, 64, 1, 8192]
    - [37, 19.432]
  - - [8192, 64, 1, 3584]
    - [38, 24.702]
  - - [4096, 4096, 1, 8192]
    - [39, 79.579]
  - - [4864, 4096, 1, 4096]
    - [40, 56.231]
  - - [4864, 4096, 1, 8256]
    - [42, 57.497]
  - - [9728, 8192, 1, 16416]
    - [43, 63.143]
  - - [9728, 12288, 1, 4096]
    - [44, 60.691]
  - - [9728, 12288, 1, 8192]
    - [45, 61.024]
  - - [9728, 12288, 1, 8256]
    - [46, 63.661]
  - - [9728, 12288, 1, 16416]
    - [47, 62.54]
  - - [14592, 12288, 1, 8192]
    - [44, 57.402]
  - - [14592, 12288, 1, 8256]
    - [48, 61.839]
  - - [14592, 12288, 1, 16416]
    - [49, 63.231]
  - - [1920, 8, 1, 5120]
    - [28, 1.361]
  - - [2560, 8, 1, 8192]
    - [51, 1.972]
  - - [3456, 8, 1, 5120]
    - [52, 2.293]
  - - [3840, 8, 1, 5120]
    - [53, 2.365]
  - - [4000, 8, 1, 5120]
    - [27, 2.523]
  - - [5120, 8, 1, 640]
    - [54, 0.65]
  - - [5120, 8, 1, 1280]
    - [55, 1.246]
  - - [5120, 8, 1, 1728]
    - [56, 0.969]
  - - [5120, 8, 1, 2560]
    - [57, 1.86]
  - - [5120, 8, 1, 3456]
    - [54, 1.477]
  - - [5120, 8, 1, 5120]
    - [58, 2.502]
  - - [5120, 8, 1, 6912]
    - [59, 3.053]
  - - [5120, 8, 1, 8192]
    - [60, 2.572]
  - - [6912, 8, 1, 5120]
    - [61, 3.095]
  - - [7680, 8, 1, 5120]
    - [62, 3.074]
  - - [8000, 8, 1, 5120]
    - [31, 3.095]
  - - [8000, 8, 1, 8192]
    - [63, 2.66]
  - - [8192, 8, 1, 2048]
    - [64, 1.34]
  - - [8192, 8, 1, 4096]
    - [65, 2.025]
  - - [8192, 8, 1, 7168]
    - [30, 3.16]
  - - [8192, 8, 1, 8192]
    - [30, 2.573]
  - - [10240, 8, 1, 8192]
    - [30, 2.913]
  - - [13824, 8, 1, 5120]
    - [66, 3.349]
  - - [14336, 8, 1, 8192]
    - [67, 2.445]
  - - [15360, 8, 1, 5120]
    - [68, 3.214]
  - - [16000, 8, 1, 5120]
    - [69, 3.357]
  - - [16000, 8, 1, 8192]
    - [70, 2.229]
  - - [27648, 8, 1, 5120]
    - [71, 3.417]
  - - [28672, 8, 1, 8192]
    - [72, 3.777]
  - - [32000, 8, 1, 5120]
    - [73, 4.186]
  - - [32000, 8, 1, 8192]
    - [74, 3.624]
  - - [57344, 8, 1, 8192]
    - [75, 4.517]
  - - [5120, 8, 1, 13824]
    - [76, 3.27]
  - - [8192, 8, 1, 14336]
    - [77, 2.953]
  - - [8192, 8, 1, 28672]
    - [78, 4.513]
  - - [1920, 32, 1, 5120]
    - [80, 6.102]
  - - [2560, 32, 1, 8192]
    - [81, 7.479]
  - - [3456, 32, 1, 5120]
    - [82, 8.851]
  - - [3840, 32, 1, 5120]
    - [83, 8.861]
  - - [4000, 32, 1, 5120]
    - [84, 8.869]
  - - [5120, 32, 1, 640]
    - [85, 2.556]
  - - [5120, 32, 1, 1280]
    - [86, 4.602]
  - - [5120, 32, 1, 1728]
    - [87, 3.285]
  - - [5120, 32, 1, 2560]
    - [88, 7.555]
  - - [5120, 32, 1, 3456]
    - [89, 6.149]
  - - [5120, 32, 1, 5120]
    - [90, 9.618]
  - - [5120, 32, 1, 6912]
    - [91, 10.954]
  - - [5120, 32, 1, 8192]
    - [92, 8.028]
  - - [6912, 32, 1, 5120]
    - [93, 11.394]
  - - [7680, 32, 1, 5120]
    - [95, 11.474]
  - - [8000, 32, 1, 5120]
    - [93, 11.534]
  - - [8000, 32, 1, 8192]
    - [94, 11.08]
  - - [8192, 32, 1, 2048]
    - [97, 5.366]
  - - [8192, 32, 1, 4096]
    - [33, 7.743]
  - - [8192, 32, 1, 7168]
    - [98, 14.068]
  - - [8192, 32, 1, 8192]
    - [94, 9.758]
  - - [10240, 32, 1, 8192]
    - [112, 9.921]
  - - [13824, 32, 1, 5120]
    - [99, 13.211]
  - - [14336, 32, 1, 8192]
    - [100, 9.286]
  - - [15360, 32, 1, 5120]
    - [101, 14.731]
  - - [16000, 32, 1, 5120]
    - [102, 14.549]
  - - [16000, 32, 1, 8192]
    - [103, 8.62]
  - - [27648, 32, 1, 5120]
    - [104, 13.481]
  - - [28672, 32, 1, 8192]
    - [105, 16.119]
  - - [32000, 32, 1, 5120]
    - [106, 16.335]
  - - [32000, 32, 1, 8192]
    - [107, 16.042]
  - - [57344, 32, 1, 8192]
    - [108, 17.345]
  - - [5120, 32, 1, 13824]
    - [109, 12.144]
  - - [8192, 32, 1, 14336]
    - [110, 11.559]
  - - [8192, 32, 1, 28672]
    - [111, 16.777]
  - - [1216, 1024, 1, 1024]
    - [113, 4.15]
  - - [1216, 1024, 1, 2048]
    - [114, 7.73]
  - - [1216, 4096, 1, 4096]
    - [115, 25.62]
  - - [2432, 512, 1, 1024]
    - [116, 6.57]
  - - [4864, 512, 1, 1024]
    - [117, 10.71]
  - - [512, 608, 1, 512]
    - [118, 1.05]
  - - [608, 512, 1, 512]
    - [118, 1.12]
  - - [1216, 256, 1, 512]
    - [118, 1.1]
  - - [2432, 2048, 1, 1024]
    - [119, 27.3]
  - - [2432, 2048, 1, 2048]
    - [120, 35.8]
  - - [2048, 2432, 1, 1024]
    - [121, 30.5]
  - - [2048, 2432, 1, 2048]
    - [122, 35.1]
  - - [4864, 1024, 1, 1024]
    - [123, 31.1]
  - - [4864, 1024, 1, 2048]
    - [124, 35.7]
  - - [32, 32, 1, 256]
    - [125, 0.01]
  - - [32, 32, 1, 512]
    - [126, 0.02]
  - - [64, 64, 1, 256]
    - [127, 0.03]
  - - [64, 64, 1, 512]
    - [127, 0.07]
  - - [128, 128, 1, 256]
    - [128, 0.12]
  - - [128, 128, 1, 512]
    - [129, 0.26]
  - - [128, 128, 1, 1024]
    - [130, 0.45]
  - - [256, 256, 1, 512]
    - [131, 8.561]
  - - [256, 256, 1, 1024]
    - [132, 12.324]
  - - [512, 512, 1, 512]
    - [133, 32.45]
  - - [512, 512, 1, 1024]
    - [134, 48.265]
  - - [1024, 64, 1, 256]
    - [135, 4.596]
  - - [1024, 128, 1, 256]
    - [136, 8.889]
- null
- null
- DeviceEfficiency
