library/src/blas3/Tensile/Logic/asm_full/aquavanjaram942X/aquavanjaram942_Cijk_Alik_Bjlk_BBS_BH.yaml
- {MinimumRequiredVersion: 4.36.0}
- aquavanjaram942
- {Architecture: gfx942, IsAPU: 0}
- [Device 74a1]
    SolutionIndex: 0
    SolutionNameMin: Cijk_Alik_Bjlk_BBS_BH_MT256x256x32_MI32x32x8x1_SN_FL1_NTA0_NTB0_NTC2_NTD0_SU0_SUS0_SPO0_WGM6
    SolutionIndex: 1
    SolutionNameMin: Cijk_Alik_Bjlk_BBS_BH_MT256x256x32_MI32x32x8x1_SN_FL2_NTA0_NTB0_NTC2_NTD2_SU0_SUS0_SPO0_WGM19
    SolutionIndex: 2
    SolutionNameMin: Cijk_Alik_Bjlk_BBS_BH_MT256x256x32_MI32x32x8x1_SN_FL2_NTA0_NTB0_NTC3_NTD2_SU0_SUS0_SPO0_WGM18
    SolutionIndex: 3
    SolutionNameMin: Cijk_Alik_Bjlk_BBS_BH_MT256x256x32_MI32x32x8x1_SN_FL1_NTA1_NTB0_NTC2_NTD0_SU0_SUS0_SPO0_WGM18
    SolutionIndex: 4
    SolutionNameMin: Cijk_Alik_Bjlk_BBS_BH_MT256x256x32_MI32x32x8x1_SN_FL1_NTA1_NTB0_NTC2_NTD2_SU0_SUS0_SPO0_WGM19
    SolutionIndex: 5
    SolutionNameMin: Cijk_Alik_Bjlk_BBS_BH_MT256x256x32_MI32x32x8x1_SN_FL2_NTA0_NTB1_NTC2_NTD1_SU0_SUS0_SPO0_WGM18
    SolutionIndex: 6
    SolutionNameMin: Cijk_Alik_Bjlk_BBS_BH_MT256x256x32_MI32x32x8x1_SN_FL1_NTA0_NTB1_NTC3_NTD2_SU0_SUS0_SPO0_WGM19
    SolutionIndex: 7
    SolutionNameMin: Cijk_Alik_Bjlk_BBS_BH_MT256x256x32_MI32x32x8x1_SN_FL2_NTA1_NTB1_NTC2_NTD1_SU0_SUS0_SPO0_WGM20
    SolutionIndex: 8
    SolutionNameMin: Cijk_Alik_Bjlk_BBS_BH_MT256x256x32_MI32x32x8x1_SN_FL2_NTA1_NTB1_NTC3_NTD0_SU0_SUS0_SPO0_WGM12
    SolutionIndex: 9
    SolutionNameMin: Cijk_Alik_Bjlk_BBS_BH_MT256x256x32_MI32x32x8x1_SN_FL2_NTA1_NTB1_NTC3_NTD3_SU0_SUS0_SPO0_WGM6
    SolutionIndex: 10
    SolutionNameMin: Cijk_Alik_Bjlk_BBS_BH_MT256x256x32_MI32x32x8x1_SN_AMAS3_CLR0_ELFLR0_GLS0_LBSPPA128_LPA8_LRVW8_NLCA1_SU0_SUS0_SPO0_SVW2_TT8_64_TLDS1_UMLDSA1_VW2_WG32_8_1_WGM1
    SolutionIndex: 11
    SolutionNameMin: Cijk_Alik_Bjlk_BBS_BH_MT256x256x32_MI32x32x8x1_SN_AMAS3_CLR1_ELFLR0_GLS0_LBSPPA128_LPA8_LRVW8_NLCA1_SU0_SUS0_SPO1_SVW2_TT8_64_TLDS1_UMLDSA1_VW2_WG32_8_1_WGM32
    SolutionIndex: 12
    SolutionNameMin: Cijk_Alik_Bjlk_BBS_BH_MT256x256x32_MI32x32x8x1_SN_1LDSB1_GLS0_LRVW8_MIAV0_NEPBS0_NLCA1_SU32_SUS64_SSO6_TT8_64_WG32_8_1_WGM8
    SolutionIndex: 13
    SolutionNameMin: Cijk_Alik_Bjlk_BBS_BH_MT256x256x32_MI32x32x8x1_SN_1LDSB1_GLS0_LRVW8_MIAV0_NEPBS0_NLCA1_SU32_SUS64_SSO6_TT8_64_WG32_8_1_WGM18
    SolutionIndex: 14
    SolutionNameMin: Cijk_Alik_Bjlk_BBS_BH_MT256x256x32_MI32x32x8x1_SN_1LDSB1_GLS1_LRVW8_MIAV0_NEPBS0_NLCA1_SU32_SUS64_SSO8_TT8_64_WG32_8_1_WGM30
    SolutionIndex: 15
    SolutionNameMin: Cijk_Alik_Bjlk_BBS_BH_MT256x256x32_MI32x32x8x1_SN_1LDSB1_GLS0_LRVW8_MIAV0_NEPBS0_NLCA1_SU32_SUS64_SSO6_TT8_64_WG32_8_1_WGM6
    SolutionIndex: 16
    SolutionNameMin: Cijk_Alik_Bjlk_BBS_BH_MT128x256x32_MI32x32x8x1_SN_1LDSB1_GLS0_LRVW8_MIAV1_NEPBS0_NLCA1_SU0_SUS0_SSO8_TT4_64_WG32_8_1_WGM18
    SolutionIndex: 17
    SolutionNameMin: Cijk_Alik_Bjlk_BBS_BH_MT256x256x32_MI32x32x8x1_SN_1LDSB1_GLS1_LRVW8_MIAV0_NEPBS0_NLCA1_SU32_SUS128_SSO8_TT8_64_WG32_8_1_WGM18
    SolutionIndex: 18
    SolutionNameMin: Cijk_Alik_Bjlk_BBS_BH_MT256x256x32_MI32x32x8x1_SN_1LDSB1_GLS1_LRVW8_MIAV0_NEPBS0_NLCA1_SU32_SUS64_SSO8_TT8_64_WG32_8_1_WGM18
    SolutionIndex: 19
    SolutionNameMin: Cijk_Alik_Bjlk_BBS_BH_MT256x256x32_MI32x32x8x1_SN_1LDSB1_GLS0_LRVW8_MIAV0_NEPBS0_NLCA1_SU32_SUS128_SSO6_TT8_64_WG32_8_1_WGM18
    SolutionIndex: 20
    SolutionNameMin: Cijk_Alik_Bjlk_BBS_BH_MT256x256x32_MI32x32x8x1_SN_ELFLR4_GLVWA8_GLVWB8_GRVW8_GLS0_LBSPPA256_LBSPPB0_LPA8_LPB0_LRVW4_NLCB1_SU8_SUS128_SVW4_TT4_128_VW4_WG64_4_1_WGM16
    SolutionIndex: 21
    SolutionNameMin: Cijk_Alik_Bjlk_BBS_BH_MT256x256x32_MI32x32x8x1_SN_ELFLR4_GLVWA8_GLVWB8_GRVW8_GLS0_LBSPPA256_LBSPPB0_LPA8_LPB0_LRVW8_NLCB1_SU0_SUS0_SVW4_TT4_128_VW4_WG64_4_1_WGM16
    SolutionIndex: 22
    SolutionNameMin: Cijk_Alik_Bjlk_BBS_BH_MT256x256x32_MI32x32x8x1_SN_ELFLR0_GLVWA8_GLVWB8_GRVW8_GLS1_LBSPPA128_LBSPPB0_LPA8_LPB0_LRVW8_NLCB1_SU8_SUS128_SVW2_TT4_128_VW2_WG64_4_1_WGM16
    SolutionIndex: 23
    SolutionNameMin: Cijk_Alik_Bjlk_BBS_BH_MT256x256x32_MI32x32x8x1_SN_ELFLR0_GLVWA8_GLVWB8_GRVW8_GLS0_LBSPPA128_LBSPPB0_LPA8_LPB0_LRVW8_NLCB1_SU0_SUS0_SVW2_TT4_128_VW2_WG64_4_1_WGM32
    SolutionIndex: 24
    SolutionNameMin: Cijk_Alik_Bjlk_BBS_BH_MT256x256x32_MI32x32x8x1_SN_ELFLR0_GLVWA8_GLVWB8_GRVW8_GLS1_LBSPPA128_LBSPPB0_LPA8_LPB0_LRVW8_NLCB1_SU0_SUS0_SVW2_TT4_128_VW2_WG64_4_1_WGM32
    SolutionIndex: 25
    SolutionNameMin: Cijk_Alik_Bjlk_BBS_BH_MT256x256x32_MI32x32x8x1_SN_ELFLR0_GLVWA8_GLVWB8_GRVW8_GLS1_LBSPPA256_LBSPPB0_LPA8_LPB0_LRVW8_NLCB1_SU0_SUS0_SVW4_TT4_128_VW4_WG64_4_1_WGM32
    SolutionIndex: 26
    SolutionNameMin: Cijk_Alik_Bjlk_BBS_BH_MT256x256x32_MI32x32x8x1_SN_ELFLR4_GLVWA8_GLVWB8_GRVW8_GLS1_LBSPPA128_LBSPPB0_LPA8_LPB0_LRVW8_NLCB1_SU8_SUS128_SVW2_TT4_128_VW2_WG64_4_1_WGM16
    SolutionIndex: 27
    SolutionNameMin: Cijk_Alik_Bjlk_BBS_BH_MT256x256x32_MI32x32x8x1_SN_ELFLR0_GLVWA8_GLVWB8_GRVW8_GLS0_LBSPPA128_LBSPPB0_LPA8_LPB0_LRVW8_NLCB1_SU0_SUS0_SVW2_TT4_128_VW2_WG64_4_1_WGM16
    SolutionIndex: 28
    SolutionNameMin: Cijk_Alik_Bjlk_BBS_BH_MT256x256x32_MI32x32x8x1_SN_ELFLR4_GLVWA8_GLVWB8_GRVW8_GLS1_LBSPPA256_LBSPPB0_LPA8_LPB0_LRVW8_NLCB1_SU0_SUS0_SVW4_TT4_128_VW4_WG64_4_1_WGM32
    SolutionIndex: 29
    SolutionNameMin: Cijk_Alik_Bjlk_BBS_BH_MT256x256x32_MI32x32x8x1_SN_ELFLR0_GLVWA8_GLVWB8_GRVW8_GLS1_LBSPPA128_LBSPPB0_LPA8_LPB0_LRVW8_NLCB1_SU0_SUS0_SVW2_TT4_128_VW2_WG64_4_1_WGMn16
- - - [6144, 4864, 1, 4096]
    - [2, 67.392]
  - - [6144, 4864, 1, 8192]
    - [3, 71.853]
  - - [6144, 4864, 1, 16384]
    - [1, 67.205]
  - - [6144, 4864, 1, 4352]
    - [5, 67.121]
  - - [6144, 4864, 1, 8448]
    - [9, 70.067]
  - - [6144, 4864, 1, 16640]
    - [6, 64.421]
  - - [4864, 3072, 1, 4096]
    - [13, 77.797]
  - - [4864, 3072, 1, 8192]
    - [15, 83.066]
  - - [4864, 3072, 1, 16384]
    - [4, 66.678]
  - - [4864, 3072, 1, 4352]
    - [7, 66.04]
  - - [4864, 3072, 1, 8448]
    - [8, 69.948]
  - - [4864, 3072, 1, 16640]
    - [0, 64.515]
  - - [8192, 8192, 1, 8192]
    - [10, 65.706]
  - - [9728, 8192, 1, 8192]
    - [11, 70.691]
  - - [4864, 3072, 1, 2048]
    - [12, 69.939]
  - - [4864, 3072, 1, 6144]
    - [14, 78.033]
  - - [3072, 4864, 1, 2048]
    - [16, 71.8]
  - - [3072, 4864, 1, 4096]
    - [17, 78.074]
  - - [3072, 4864, 1, 6144]
    - [18, 79.427]
  - - [3072, 4864, 1, 8192]
    - [19, 84.072]
  - - [4864, 4096, 1, 4096]
    - [20, 52.255]
  - - [4864, 4096, 1, 8192]
    - [21, 57.565]
  - - [4864, 4096, 1, 8256]
    - [22, 58.344]
  - - [9728, 8192, 1, 16416]
    - [23, 61.357]
  - - [9728, 12288, 1, 4096]
    - [24, 53.973]
  - - [9728, 12288, 1, 8192]
    - [25, 55.727]
  - - [9728, 12288, 1, 8256]
    - [26, 56.178]
  - - [9728, 12288, 1, 16416]
    - [27, 61.438]
  - - [14592, 12288, 1, 8192]
    - [28, 55.266]
  - - [14592, 12288, 1, 8256]
    - [21, 56.992]
  - - [14592, 12288, 1, 16416]
    - [26, 60.155]
  - - [12288, 9728, 1, 16416]
    - [29, 60.971]
- null
- null
- DeviceEfficiency
