library/src/blas3/Tensile/Logic/asm_full/aquavanjaram942X/aquavanjaram942_Cijk_Ailk_Bljk_SB.yaml
- {MinimumRequiredVersion: 4.31.0}
- aquavanjaram942
- {Architecture: gfx942, IsAPU: 0}
- [Device 74a1]
    SolutionIndex: 0
    SolutionNameMin: Cijk_Ailk_Bljk_SB_MT256x64x16_MI32x32x2x1_SN_DTVA0_GRVW4_GLS1_LPB4_LRVW4_NEPBS4_NLCA1_NLCB1_PLR9_SU0_SUS0_SVW2_TT2_64_VW2_WG128_2_1_WGM42
    SolutionIndex: 1
    SolutionNameMin: Cijk_Ailk_Bljk_SB_MT128x128x16_MI32x32x2x1_SN_DTVA0_GRVW4_GLS1_LPB4_LRVW4_NEPBS0_NLCA1_NLCB1_PLR9_SU0_SUS0_SVW2_TT2_64_VW2_WG64_4_1_WGM30
    SolutionIndex: 2
    SolutionNameMin: Cijk_Ailk_Bljk_SB_MT256x64x16_MI16x16x4x1_SN_DTVA0_GRVW2_GLS0_LPB2_LRVW1_NEPBS4_NLCA1_NLCB1_PLR5_SU0_SUS0_SVW2_TT4_64_VW2_WG64_4_1_WGM42
    SolutionIndex: 3
    SolutionNameMin: Cijk_Ailk_Bljk_SB_MT256x64x16_MI16x16x4x1_SN_DTVA0_GRVW4_GLS0_LPB4_LRVW1_NEPBS4_NLCA1_NLCB1_PLR1_SU0_SUS0_SVW2_TT4_64_VW2_WG64_4_1_WGM36
    SolutionIndex: 4
    SolutionNameMin: Cijk_Ailk_Bljk_SB_MT128x64x32_MI16x16x4x1_SN_DTVA0_GRVW2_GLS1_LPB2_LRVW1_NEPBS4_NLCA1_PLR9_SU0_SUS0_SVW2_TT2_64_VW2_WG64_4_1_WGM42
    SolutionIndex: 5
    SolutionNameMin: Cijk_Ailk_Bljk_SB_MT128x64x32_MI16x16x4x1_SN_DTVA0_GRVW4_GLS0_LPB8_LRVW4_NEPBS0_NLCA1_PLR9_SU0_SUS0_SVW2_TT2_64_VW2_WG64_4_1_WGM42
    SolutionIndex: 6
    SolutionNameMin: Cijk_Ailk_Bljk_SB_MT128x64x16_MI16x16x4x1_SN_DTVA0_EPS0_GRVW4_LPB4_LRVW1_NEPBS0_NLCA1_PLR5_SU32_SUS256_SVW2_TT4_32_VW2_WG32_8_1_WGM24
    SolutionIndex: 7
    SolutionNameMin: Cijk_Ailk_Bljk_SB_MT64x32x32_MI16x16x4x1_SN_DTVA0_GRVW4_LPB8_LRVW4_MIAV1_NEPBS0_PLR9_SU0_SUS0_SVW2_TT2_16_VW2_WG32_8_1
    SolutionIndex: 8
    SolutionNameMin: Cijk_Ailk_Bljk_SB_MT64x32x32_MI16x16x4x1_SN_DTVA0_GRVW4_LPB8_LRVW4_MIAV0_NEPBS4_PLR9_SU4_SUS512_SVW2_TT2_16_VW2_WG32_8_1
    SolutionIndex: 9
    SolutionNameMin: Cijk_Ailk_Bljk_SB_MT64x32x32_MI16x16x4x1_SN_DTVA0_EPS0_GRVW4_LPB8_LRVW4_NEPBS0_NLCA1_PLR9_SU32_SUS256_SVW2_TT2_16_VW2_WG32_8_1_WGM18
    SolutionIndex: 10
    SolutionNameMin: Cijk_Ailk_Bljk_SB_MT64x32x32_MI16x16x4x1_SN_DTVA0_EPS0_GRVW4_LPB4_LRVW2_NEPBS0_NLCA1_PLR9_SU32_SUS256_SVW2_TT2_16_VW2_WG32_8_1_WGM18
    SolutionIndex: 11
    SolutionNameMin: Cijk_Ailk_Bljk_SB_MT64x32x16_MI16x16x4x1_SN_AMAS0_DTVA0_GRVW2_LBSPP128_LPB2_LRVW2_NEPBS0_NLCA1_PLR5_SS0_SVW4_TT1_32_TLDS1_UMLDSB1_VW1_WG64_4_1_WGM6
    SolutionIndex: 12
    SolutionNameMin: Cijk_Ailk_Bljk_SB_MT32x64x32_MI16x16x4x1_SN_AMAS3_DTVA0_GRVW1_LBSPP128_LPB2_LRVW1_NEPBS4_NLCA1_PLR9_SS0_SVW4_TT2_16_TLDS1_UMLDSB1_VW2_WG16_16_1_WGM12
    SolutionIndex: 13
    SolutionNameMin: Cijk_Ailk_Bljk_SB_MT32x64x32_MI16x16x4x1_SN_AMAS0_DTVA0_GRVW1_LBSPP128_LPB2_LRVW1_NEPBS0_NLCA1_PLR9_SS1_SVW1_TT2_16_TLDS1_UMLDSB1_VW1_WG16_16_1_WGM12
    SolutionIndex: 14
    SolutionNameMin: Cijk_Ailk_Bljk_SB_MT64x64x16_MI32x32x2x1_SN_AMAS0_DTVA0_GRVW1_LBSPP0_LPB1_LRVW1_NEPBS4_NLCA1_PLR9_SS1_SVW1_TT1_32_TLDS0_UMLDSB0_VW1_WG64_4_1_WGM6
    SolutionIndex: 15
    SolutionNameMin: Cijk_Ailk_Bljk_SB_MT64x64x16_MI32x32x2x1_SN_AMAS0_DTVA0_GRVW1_LBSPP0_LPB1_LRVW1_NEPBS0_NLCA1_PLR9_SS1_SVW1_TT1_32_TLDS0_UMLDSB0_VW1_WG64_4_1_WGM6
    SolutionIndex: 16
    SolutionNameMin: Cijk_Ailk_Bljk_SB_MT64x64x16_MI32x32x2x1_SN_AMAS0_DTVA0_GRVW1_LBSPP0_LPB1_LRVW1_NEPBS0_NLCA1_PLR9_SS1_SVW1_TT1_32_TLDS0_UMLDSB0_VW1_WG64_4_1_WGM12
    SolutionIndex: 17
    SolutionNameMin: Cijk_Ailk_Bljk_SB_MT64x32x32_MI16x16x4x1_SN_AMAS3_DTVA0_GRVW2_LBSPP128_LPB2_LRVW2_NEPBS0_NLCA1_PLR9_SS1_SVW2_TT2_16_TLDS1_UMLDSB1_VW2_WG32_8_1_WGM6
    SolutionIndex: 18
    SolutionNameMin: Cijk_Ailk_Bljk_SB_MT64x64x16_MI32x32x2x1_SN_AMAS0_DTVA0_GRVW4_LBSPP0_LPB1_LRVW1_NEPBS0_NLCA1_PLR9_SS1_SVW1_TT1_32_TLDS0_UMLDSB0_VW1_WG64_4_1_WGM12
    SolutionIndex: 19
    SolutionNameMin: Cijk_Ailk_Bljk_SB_MT32x64x16_MI16x16x4x1_SN_AMAS0_DTVA0_GRVW1_LBSPP128_LPB2_LRVW2_NEPBS0_NLCA1_PLR5_SS1_SVW1_TT1_32_TLDS1_UMLDSB1_VW1_WG32_8_1_WGM12
    SolutionIndex: 20
    SolutionNameMin: Cijk_Ailk_Bljk_SB_MT64x32x16_MI16x16x4x1_SN_AMAS0_DTVA1_GRVW1_LBSPP128_LPB2_LRVW2_NEPBS0_NLCA1_PLR5_SS1_SVW1_TT1_32_TLDS1_UMLDSB1_VW1_WG64_4_1_WGM6
    SolutionIndex: 21
    SolutionNameMin: Cijk_Ailk_Bljk_SB_MT128x64x16_MI32x32x2x1_SN_AMAS0_DTVA0_GRVW1_LBSPP0_LPB1_LRVW1_NEPBS0_NLCA1_PLR9_SS1_SVW1_TT2_32_TLDS0_UMLDSB0_VW1_WG64_4_1_WGM6
    SolutionIndex: 22
    SolutionNameMin: Cijk_Ailk_Bljk_SB_MT64x64x16_MI32x32x2x1_SN_AMAS0_DTVA0_GRVW1_LBSPP128_LPB2_LRVW2_NEPBS0_NLCA1_PLR9_SS1_SVW1_TT1_32_TLDS1_UMLDSB1_VW1_WG64_4_1_WGM12
    SolutionIndex: 23
    SolutionNameMin: Cijk_Ailk_Bljk_SB_MT64x32x32_MI16x16x4x1_SN_AMAS0_DTVA0_GRVW1_LBSPP128_LPB2_LRVW2_NEPBS0_NLCA1_PLR9_SS1_SVW1_TT1_32_TLDS1_UMLDSB1_VW1_WG64_4_1_WGM6
    SolutionIndex: 24
    SolutionNameMin: Cijk_Ailk_Bljk_SB_MT64x32x32_MI16x16x4x1_SN_AMAS3_DTVA0_GRVW1_LBSPP128_LPB2_LRVW1_NEPBS0_NLCA1_PLR9_SS1_SVW2_TT2_16_TLDS1_UMLDSB1_VW2_WG32_8_1_WGM6
    SolutionIndex: 25
    SolutionNameMin: Cijk_Ailk_Bljk_SB_MT64x64x16_MI32x32x2x1_SN_AMAS0_DTVA0_GRVW1_LBSPP128_LPB1_LRVW1_NEPBS0_NLCA1_PLR9_SS1_SVW1_TT1_32_TLDS1_UMLDSB1_VW1_WG64_4_1_WGM6
    SolutionIndex: 26
    SolutionNameMin: Cijk_Ailk_Bljk_SB_MT64x64x16_MI32x32x2x1_SN_AMAS0_DTVA0_GRVW4_LBSPP128_LPB4_LRVW1_NEPBS0_NLCA1_PLR9_SS1_SVW1_TT1_32_TLDS1_UMLDSB1_VW1_WG64_4_1_WGM6
    SolutionIndex: 27
    SolutionNameMin: Cijk_Ailk_Bljk_SB_MT32x64x32_MI16x16x4x1_SN_AMAS3_DTVA0_GRVW1_LBSPP0_LPB2_LRVW1_NEPBS0_NLCA1_PLR9_SS1_SVW2_TT2_16_TLDS0_UMLDSB0_VW2_WG16_16_1_WGM12
    SolutionIndex: 28
    SolutionNameMin: Cijk_Ailk_Bljk_SB_MT32x64x32_MI16x16x4x1_SN_AMAS3_DTVA0_GRVW2_LBSPP128_LPB2_LRVW2_NEPBS0_NLCA1_PLR9_SS1_SVW2_TT2_16_TLDS1_UMLDSB1_VW2_WG16_16_1_WGM6
    SolutionIndex: 29
    SolutionNameMin: Cijk_Ailk_Bljk_SB_MT64x64x16_MI16x16x4x1_SN_AMAS3_DTVA0_GRVW1_LBSPP128_LPB2_LRVW1_NEPBS0_NLCA1_PLR5_SS1_SVW2_TT2_32_TLDS1_UMLDSB1_VW2_WG32_8_1_WGM12
    SolutionIndex: 30
    SolutionNameMin: Cijk_Ailk_Bljk_SB_MT64x64x16_MI16x16x4x1_SN_AMAS3_DTVA0_GRVW2_LBSPP0_LPB2_LRVW1_NEPBS0_NLCA1_PLR5_SS1_SVW2_TT2_32_TLDS0_UMLDSB0_VW2_WG32_8_1_WGM6
    SolutionIndex: 31
    SolutionNameMin: Cijk_Ailk_Bljk_SB_MT64x64x16_MI16x16x4x1_SN_AMAS3_DTVA0_GRVW4_LBSPP128_LPB4_LRVW1_NEPBS0_NLCA1_PLR5_SS1_SVW2_TT2_32_TLDS1_UMLDSB1_VW2_WG32_8_1_WGM6
    SolutionIndex: 32
    SolutionNameMin: Cijk_Ailk_Bljk_SB_MT64x64x16_MI16x16x4x1_SN_AMAS3_DTVA0_GRVW2_LBSPP128_LPB2_LRVW1_NEPBS0_NLCA1_PLR5_SS1_SVW2_TT2_32_TLDS1_UMLDSB1_VW2_WG32_8_1_WGM12
    SolutionIndex: 33
    SolutionNameMin: Cijk_Ailk_Bljk_SB_MT32x64x32_MI16x16x4x1_SN_AMAS3_DTVA0_GRVW2_LBSPP0_LPB2_LRVW1_NEPBS4_NLCA1_PLR9_SS1_SVW2_TT2_16_TLDS0_UMLDSB0_VW2_WG16_16_1_WGM6
    SolutionIndex: 34
    SolutionNameMin: Cijk_Ailk_Bljk_SB_MT64x64x32_MI16x16x4x1_SN_AMAS3_DTVA0_GRVW1_LBSPP0_LPB2_LRVW1_NEPBS4_NLCA1_PLR9_SS0_SVW4_TT2_32_TLDS0_UMLDSB0_VW2_WG32_8_1_WGM6
    SolutionIndex: 35
    SolutionNameMin: Cijk_Ailk_Bljk_SB_MT64x32x32_MI16x16x4x1_SN_AMAS3_DTVA0_GRVW4_LBSPP0_LPB2_LRVW1_NEPBS0_NLCA1_PLR9_SS1_SVW2_TT2_16_TLDS0_UMLDSB0_VW2_WG32_8_1_WGM12
    SolutionIndex: 36
    SolutionNameMin: Cijk_Ailk_Bljk_SB_MT64x64x16_MI16x16x4x1_SN_AMAS3_DTVA0_GRVW2_LBSPP0_LPB2_LRVW1_NEPBS4_NLCA1_PLR5_SS1_SVW2_TT2_32_TLDS0_UMLDSB0_VW2_WG32_8_1_WGM12
    SolutionIndex: 37
    SolutionNameMin: Cijk_Ailk_Bljk_SB_MT32x64x16_MI16x16x4x1_SN_AMAS0_DTVA0_GRVW1_LBSPP128_LPB2_LRVW2_NEPBS4_NLCA1_PLR5_SS1_SVW1_TT1_32_TLDS1_UMLDSB1_VW1_WG32_8_1_WGM6
    SolutionIndex: 38
    SolutionNameMin: Cijk_Ailk_Bljk_SB_MT32x64x32_MI16x16x4x1_SN_AMAS3_DTVA0_GRVW1_LBSPP0_LPB2_LRVW1_NEPBS4_NLCA1_PLR9_SS1_SVW2_TT2_16_TLDS0_UMLDSB0_VW2_WG16_16_1_WGM6
    SolutionIndex: 39
    SolutionNameMin: Cijk_Ailk_Bljk_SB_MT32x64x32_MI16x16x4x1_SN_AMAS3_DTVA0_GRVW4_LBSPP128_LPB4_LRVW1_NEPBS0_NLCA1_PLR9_SS1_SVW2_TT2_16_TLDS1_UMLDSB1_VW2_WG16_16_1_WGM12
    SolutionIndex: 40
    SolutionNameMin: Cijk_Ailk_Bljk_SB_MT64x64x16_MI16x16x4x1_SN_AMAS3_DTVA0_GRVW1_LBSPP128_LPB2_LRVW2_NEPBS4_NLCA1_PLR5_SS1_SVW2_TT2_32_TLDS1_UMLDSB1_VW2_WG32_8_1_WGM12
    SolutionIndex: 41
    SolutionNameMin: Cijk_Ailk_Bljk_SB_MT128x64x16_MI32x32x2x1_SN_AMAS3_DTVA0_GRVW2_LBSPP0_LPB2_LRVW1_NEPBS0_NLCA1_PLR9_SS1_SVW2_TT2_32_TLDS0_UMLDSB0_VW2_WG64_4_1_WGM12
    SolutionIndex: 42
    SolutionNameMin: Cijk_Ailk_Bljk_SB_MT128x64x16_MI32x32x2x1_SN_AMAS0_DTVA0_GRVW1_LBSPP128_LPB2_LRVW2_NEPBS0_NLCA1_PLR9_SS1_SVW1_TT2_32_TLDS1_UMLDSB1_VW1_WG64_4_1_WGM6
    SolutionIndex: 43
    SolutionNameMin: Cijk_Ailk_Bljk_SB_MT64x64x16_MI16x16x4x1_SN_AMAS3_DTVA0_GRVW1_LBSPP0_LPB2_LRVW1_NEPBS4_NLCA1_PLR5_SS1_SVW2_TT2_32_TLDS0_UMLDSB0_VW2_WG32_8_1_WGM6
    SolutionIndex: 44
    SolutionNameMin: Cijk_Ailk_Bljk_SB_MT64x32x32_MI16x16x4x1_SN_AMAS3_DTVA0_GRVW2_LBSPP0_LPB2_LRVW1_NEPBS0_NLCA1_PLR9_SS1_SVW2_TT2_16_TLDS0_UMLDSB0_VW2_WG32_8_1_WGM6
    SolutionIndex: 45
    SolutionNameMin: Cijk_Ailk_Bljk_SB_MT64x32x32_MI16x16x4x1_SN_AMAS3_DTVA0_GRVW4_LBSPP128_LPB4_LRVW1_NEPBS0_NLCA1_PLR9_SS1_SVW2_TT2_16_TLDS1_UMLDSB1_VW2_WG32_8_1_WGM6
    SolutionIndex: 46
    SolutionNameMin: Cijk_Ailk_Bljk_SB_MT64x32x32_MI16x16x4x1_SN_AMAS3_DTVA0_GRVW2_LBSPP128_LPB2_LRVW2_NEPBS4_NLCA1_PLR9_SS1_SVW2_TT2_16_TLDS1_UMLDSB1_VW2_WG32_8_1_WGM6
    SolutionIndex: 47
    SolutionNameMin: Cijk_Ailk_Bljk_SB_MT64x32x32_MI16x16x4x1_SN_AMAS3_DTVA0_GRVW2_LBSPP128_LPB2_LRVW2_NEPBS0_NLCA1_PLR9_SS1_SVW2_TT2_16_TLDS1_UMLDSB1_VW2_WG32_8_1_WGM6
    SolutionIndex: 48
    SolutionNameMin: Cijk_Ailk_Bljk_SB_MT64x32x32_MI16x16x4x1_SN_AMAS3_DTVA0_GRVW2_LBSPP128_LPB2_LRVW1_NEPBS4_NLCA1_PLR9_SS1_SVW2_TT2_16_TLDS1_UMLDSB1_VW2_WG32_8_1_WGM6
    SolutionIndex: 49
    SolutionNameMin: Cijk_Ailk_Bljk_SB_MT128x128x16_MI16x16x4x1_SN_1LDSB1_GRVW2_GLS1_LPB2_NEPBS0_PLR1_SU0_SUS0_TT4_64_WG32_8_1_WGM30
    SolutionIndex: 50
    SolutionNameMin: Cijk_Ailk_Bljk_SB_MT128x128x16_MI16x16x4x1_SN_1LDSB0_GRVW4_GLS1_LPB4_NEPBS0_PLR1_SU0_SUS0_TT2_128_WG64_4_1_WGM42
    SolutionIndex: 51
    SolutionNameMin: Cijk_Ailk_Bljk_SB_MT128x128x16_MI16x16x4x1_SN_1LDSB1_GRVW4_GLS1_LPB4_NEPBS4_PLR5_SU0_SUS0_TT4_64_WG32_8_1_WGM30
    SolutionIndex: 52
    SolutionNameMin: Cijk_Ailk_Bljk_SB_MT128x128x16_MI16x16x4x1_SN_1LDSB1_GRVW4_GLS1_LPB4_NEPBS0_PLR5_SU0_SUS0_TT4_64_WG32_8_1_WGM30
    SolutionIndex: 53
    SolutionNameMin: Cijk_Ailk_Bljk_SB_MT128x128x16_MI16x16x4x1_SN_1LDSB1_GRVW4_GLS1_LPB4_NEPBS0_PLR1_SU0_SUS0_TT4_64_WG32_8_1_WGM18
    SolutionIndex: 54
    SolutionNameMin: Cijk_Ailk_Bljk_SB_MT128x128x16_MI16x16x4x1_SN_1LDSB0_GRVW4_GLS0_LPB4_NEPBS4_PLR1_SU32_SUS256_TT8_32_WG16_16_1_WGM18
    SolutionIndex: 55
    SolutionNameMin: Cijk_Ailk_Bljk_SB_MT128x128x16_MI16x16x4x1_SN_1LDSB1_GRVW4_GLS1_LPB4_NEPBS4_PLR5_SU0_SUS0_TT4_64_WG32_8_1_WGM36
    SolutionIndex: 56
    SolutionNameMin: Cijk_Ailk_Bljk_SB_MT128x128x16_MI16x16x4x1_SN_1LDSB0_GRVW2_GLS0_LPB2_NEPBS4_PLR1_SU0_SUS0_TT4_64_WG32_8_1_WGM24
    SolutionIndex: 57
    SolutionNameMin: Cijk_Ailk_Bljk_SB_MT256x256x16_MI16x16x4x1_SN_AMAS0_GLS1_LPA16_NTC0_NTD3_NEPBS4_PLR1_SS1_SU0_SUS0_SPO0_SSO0_SVW1_TT8_128_VW1_WGM30
    SolutionIndex: 58
    SolutionNameMin: Cijk_Ailk_Bljk_SB_MT256x256x16_MI16x16x4x1_SN_AMAS3_GLS1_LPA16_NTC3_NTD3_NEPBS4_PLR5_SS0_SU0_SUS0_SPO1_SSO0_SVW4_TT8_128_VW4_WGM24
    SolutionIndex: 59
    SolutionNameMin: Cijk_Ailk_Bljk_SB_MT256x256x16_MI16x16x4x1_SN_AMAS0_GLS0_LPA16_NTC3_NTD3_NEPBS4_PLR5_SS0_SU0_SUS0_SPO0_SSO0_SVW4_TT8_128_VW1_WGM18
    SolutionIndex: 60
    SolutionNameMin: Cijk_Ailk_Bljk_SB_MT256x256x8_MI16x16x4x1_SN_AMAS3_GLS0_LPA16_NTC0_NTD0_NEPBS0_PLR1_SS0_SU32_SUS256_SPO0_SSO8_SVW4_TT8_128_VW4_WGM18
    SolutionIndex: 61
    SolutionNameMin: Cijk_Ailk_Bljk_SB_MT256x256x16_MI16x16x4x1_SN_1LDSB1_AMAS3_DTVA0_GLVWB4_LBSPPB128_LPA0_LPB4_LRVW1_NEPBS8_PLR1_SU0_SUS0_SSO0_SVW2_TT8_128_VW2_WG32_8_1_WGM36
    SolutionIndex: 62
    SolutionNameMin: Cijk_Ailk_Bljk_SB_MT256x128x32_MI16x16x4x1_SN_1LDSB0_AMAS3_DTVA1_GLVWB4_LBSPPB128_LPA0_LPB8_LRVW4_NEPBS8_PLR9_SU0_SUS0_SSO8_SVW4_TT4_128_VW4_WG64_4_1_WGM24
    SolutionIndex: 63
    SolutionNameMin: Cijk_Ailk_Bljk_SB_MT256x128x32_MI16x16x4x1_SN_1LDSB0_AMAS3_DTVA1_GLVWB4_LBSPPB128_LPA0_LPB8_LRVW4_NEPBS8_PLR9_SU0_SUS0_SSO8_SVW4_TT4_128_VW4_WG64_4_1_WGM36
    SolutionIndex: 64
    SolutionNameMin: Cijk_Ailk_Bljk_SB_MT256x128x32_MI16x16x4x1_SN_1LDSB1_AMAS3_DTVA1_GLVWB2_LBSPPB128_LPA0_LPB8_LRVW4_NEPBS8_PLR9_SU0_SUS0_SSO0_SVW4_TT4_128_VW4_WG64_4_1_WGM36
    SolutionIndex: 65
    SolutionNameMin: Cijk_Ailk_Bljk_SB_MT32x32x64_MI16x16x4x1_SN_1LDSB0_GLVWB4_LBSPPB256_LPB4_NTC3_NTD3_PLR1_SU32_SUS256_WGM8
    SolutionIndex: 66
    SolutionNameMin: Cijk_Ailk_Bljk_SB_MT32x32x64_MI16x16x4x1_SN_1LDSB0_GLVWB4_LBSPPB256_LPB4_NTC3_NTD3_PLR1_SU0_SUS0_WGM1
    SolutionIndex: 67
    SolutionNameMin: Cijk_Ailk_Bljk_SB_MT32x32x32_MI16x16x4x1_SN_1LDSB0_GLVWB2_LBSPPB128_LPB2_NTC3_NTD3_PLR1_SU32_SUS256_WGM1
    SolutionIndex: 68
    SolutionNameMin: Cijk_Ailk_Bljk_SB_MT32x32x32_MI16x16x4x1_SN_1LDSB0_GLVWB2_LBSPPB128_LPB2_NTC3_NTD3_PLR1_SU0_SUS0_WGM1
    SolutionIndex: 69
    SolutionNameMin: Cijk_Ailk_Bljk_SB_MT64x64x32_MI16x16x4x1_SN_1LDSB1_AMAS0_GLVWA4_LPA16_NTC0_NTD3_NEPBS8_SS1_SU0_SUS0_SSO0_SVW1_TT2_32_VW1_WG32_8_1_WGM48
    SolutionIndex: 70
    SolutionNameMin: Cijk_Ailk_Bljk_SB_MT64x64x32_MI16x16x4x1_SN_1LDSB1_AMAS0_GLVWA4_LPA16_NTC3_NTD3_NEPBS0_SS1_SU0_SUS0_SSO0_SVW1_TT1_64_VW1_WG64_4_1_WGM48
    SolutionIndex: 71
    SolutionNameMin: Cijk_Ailk_Bljk_SB_MT64x64x32_MI16x16x4x1_SN_1LDSB1_AMAS0_GLVWA4_LPA16_NTC0_NTD3_NEPBS8_SS0_SU0_SUS0_SSO0_SVW4_TT2_32_VW1_WG32_8_1_WGM32
    SolutionIndex: 72
    SolutionNameMin: Cijk_Ailk_Bljk_SB_MT64x64x32_MI16x16x4x1_SN_1LDSB0_AMAS0_GLVWA4_LPA16_NTC3_NTD3_NEPBS8_SS1_SU32_SUS256_SSO4_SVW1_TT2_32_VW1_WG32_8_1_WGM1
    SolutionIndex: 73
    SolutionNameMin: Cijk_Ailk_Bljk_SB_MT64x64x32_MI16x16x4x1_SN_1LDSB1_AMAS3_GLVWA4_LPA16_NTC3_NTD3_NEPBS8_SS0_SU32_SUS256_SSO4_SVW4_TT2_32_VW2_WG32_8_1_WGM1
    SolutionIndex: 74
    SolutionNameMin: Cijk_Ailk_Bljk_SB_MT64x64x32_MI16x16x4x1_SN_1LDSB1_AMAS0_GLVWA4_LPA16_NTC3_NTD3_NEPBS0_SS0_SU0_SUS0_SSO0_SVW4_TT2_32_VW1_WG32_8_1_WGM1
    SolutionIndex: 75
    SolutionNameMin: Cijk_Ailk_Bljk_SB_MT64x64x32_MI16x16x4x1_SN_1LDSB1_AMAS3_DTVA0_GLVWA4_LPB8_LRVW4_NTC0_NTD3_NEPBS0_SU0_SUS0_SSO4_TT2_32_VW4_WG32_8_1_WGM48
    SolutionIndex: 76
    SolutionNameMin: Cijk_Ailk_Bljk_SB_MT32x32x64_MI16x16x4x1_SN_ELFLR0_MIAV0_NTC2_NTD3_NEPBS4_ONLL2_SU0_SUS0_SPO0_SSO4_TT2_16_WSGRB0_WG16_8_2_WGM16
    SolutionIndex: 77
    SolutionNameMin: Cijk_Ailk_Bljk_SB_MT32x32x64_MI16x16x4x1_SN_ELFLR0_MIAV1_NTC3_NTD2_NEPBS4_ONLL2_SU0_SUS0_SPO0_SSO4_TT1_32_WSGRB1_WG32_4_2_WGM16
    SolutionIndex: 78
    SolutionNameMin: Cijk_Ailk_Bljk_SB_MT32x32x64_MI16x16x4x1_SN_ELFLR0_MIAV0_NTC3_NTD3_NEPBS16_ONLL1_SU32_SUS256_SPO0_SSO0_TT2_16_WSGRB0_WG16_8_2_WGMn16
    SolutionIndex: 79
    SolutionNameMin: Cijk_Ailk_Bljk_SB_MT32x32x64_MI16x16x4x1_SN_ELFLR4_MIAV0_NTC3_NTD3_NEPBS16_ONLL1_SU0_SUS0_SPO1_SSO4_TT2_16_WSGRB1_WG16_8_2_WGMn16
    SolutionIndex: 80
    SolutionNameMin: Cijk_Ailk_Bljk_SB_MT32x32x64_MI16x16x4x1_SN_ELFLR0_MIAV1_NTC3_NTD3_NEPBS16_ONLL1_SU0_SUS0_SPO0_SSO0_TT1_32_WSGRB1_WG32_4_2_WGMn16
    SolutionIndex: 81
    SolutionNameMin: Cijk_Ailk_Bljk_SB_MT64x64x32_MI16x16x4x1_SN_AMAS3_ELFLR0_GLS0_LPA0_MIAV1_NTC3_NTD0_ONLL2_SS1_SU32_SUS256_SSO0_SVW2_VW2_WGM1
    SolutionIndex: 82
    SolutionNameMin: Cijk_Ailk_Bljk_SB_MT64x64x32_MI16x16x4x1_SN_AMAS3_ELFLR0_GLS0_LPA0_MIAV0_NTC2_NTD0_ONLL0_SS1_SU8_SUS128_SSO0_SVW2_VW2_WGM1
    SolutionIndex: 83
    SolutionNameMin: Cijk_Ailk_Bljk_SB_MT128x128x32_MI16x16x4x1_SN_AMAS3_GLS1_LPA16_NTC0_NTD0_SS0_SU8_SUS256_SRVW0_SSO0_SVW4_VW2_WSGRB1_WGM1
    SolutionIndex: 84
    SolutionNameMin: Cijk_Ailk_Bljk_SB_MT128x128x32_MI16x16x4x1_SN_AMAS0_GLS0_LPA16_NTC2_NTD3_SS0_SU8_SUS256_SRVW0_SSO4_SVW4_VW1_WSGRB0_WGMn32
    SolutionIndex: 85
    SolutionNameMin: Cijk_Ailk_Bljk_SB_MT32x32x64_MI16x16x4x1_SN_1LDSB0_DTVA1_GLVWA2_GLVWB4_GSU1_GSUASB_LBSPPB256_LPB4_NTC0_NTD3_PLR1_SU0_SUS0_TT2_32_WSGRA0_WG16_4_4_WGM1
    SolutionIndex: 86
    SolutionNameMin: Cijk_Ailk_Bljk_SB_MT32x32x64_MI16x16x4x1_SN_1LDSB1_DTVA1_GLVWA2_GLVWB4_GSU1_GSUASB_LBSPPB256_LPB4_NTC0_NTD0_PLR1_SU0_SUS0_TT2_32_WSGRA0_WG16_4_4_WGM1
    SolutionIndex: 87
    SolutionNameMin: Cijk_Ailk_Bljk_SB_MT32x32x64_MI16x16x4x1_SN_1LDSB1_DTVA1_GLVWA2_GLVWB4_GSU1_GSUASB_LBSPPB256_LPB4_NTC3_NTD0_PLR1_SU32_SUS256_TT2_32_WSGRA0_WG16_4_4_WGM1
    SolutionIndex: 88
    SolutionNameMin: Cijk_Ailk_Bljk_SB_MT32x32x64_MI16x16x4x1_SN_1LDSB1_DTVA1_GLVWA2_GLVWB4_GSU1_GSUASB_LBSPPB256_LPB4_NTC3_NTD0_PLR1_SU0_SUS0_TT2_32_WSGRA0_WG16_4_4_WGM1
    SolutionIndex: 89
    SolutionNameMin: Cijk_Ailk_Bljk_SB_MT128x64x32_MI16x16x4x1_SN_AMAS0_EPS1_ELFLR0_GLS0_LPA16_NTC3_NTD3_SU32_SUS256_SSO0_SVW1_TT4_32_VW1_WG32_8_1_WGM32
    SolutionIndex: 90
    SolutionNameMin: Cijk_Ailk_Bljk_SB_MT128x64x32_MI16x16x4x1_SN_AMAS0_EPS1_ELFLR0_GLS1_LPA16_NTC3_NTD2_SU0_SUS0_SSO0_SVW1_TT4_32_VW1_WG32_8_1_WGM32
    SolutionIndex: 91
    SolutionNameMin: Cijk_Ailk_Bljk_SB_MT128x64x32_MI16x16x4x1_SN_AMAS0_EPS0_ELFLR0_GLS1_LPA16_NTC0_NTD3_SU0_SUS0_SSO4_SVW1_TT4_32_VW1_WG32_8_1_WGM1
    SolutionIndex: 92
    SolutionNameMin: Cijk_Ailk_Bljk_SB_MT128x64x32_MI16x16x4x1_SN_AMAS0_EPS1_ELFLR0_GLS1_LPA16_NTC2_NTD2_SU0_SUS0_SSO4_SVW1_TT4_32_VW1_WG32_8_1_WGM1
    SolutionIndex: 93
    SolutionNameMin: Cijk_Ailk_Bljk_SB_MT128x128x32_MI16x16x4x1_SN_AMAS0_EPS0_ELFLR0_GLS1_LPA16_NTC0_NTD3_SU0_SUS0_SSO0_SVW1_TT4_64_VW1_WG32_8_1_WGM1
    SolutionIndex: 94
    SolutionNameMin: Cijk_Ailk_Bljk_SB_MT128x128x32_MI16x16x4x1_SN_AMAS0_EPS1_ELFLR4_GLS1_LPA16_NTC2_NTD3_SU32_SUS256_SSO0_SVW1_TT4_64_VW1_WG32_8_1_WGM1
- - - [6144, 4864, 1, 512]
    - [0, 92.47]
  - - [4864, 3072, 1, 4096]
    - [58, 97.3]
  - - [7296, 4608, 1, 4096]
    - [1, 98.387]
  - - [9728, 6144, 1, 4096]
    - [2, 98.748]
  - - [16384, 16384, 1, 4096]
    - [3, 98.851]
  - - [19456, 18432, 1, 512]
    - [0, 96.92]
  - - [4094, 4094, 1, 2046]
    - [4, 93.707]
  - - [4096, 4096, 1, 2048]
    - [5, 96.451]
  - - [1031, 1031, 1, 1031]
    - [9, 45.229]
  - - [2047, 2047, 1, 2047]
    - [10, 74.37]
  - - [4095, 4095, 1, 2047]
    - [6, 88.705]
  - - [1030, 1030, 1, 1030]
    - [7, 49.919]
  - - [1032, 1032, 1, 1032]
    - [8, 49.914]
  - - [2046, 2046, 1, 2046]
    - [7, 83.962]
  - - [2048, 2048, 1, 2048]
    - [7, 88.524]
  - - [64, 1, 1000, 64]
    - [11, 0.537]
  - - [1, 64, 1000, 64]
    - [12, 0.537]
  - - [31, 31, 1000, 31]
    - [13, 4.166]
  - - [33, 33, 1000, 33]
    - [14, 3.963]
  - - [47, 47, 1000, 47]
    - [15, 8.704]
  - - [49, 49, 1000, 49]
    - [16, 9.39]
  - - [63, 63, 128, 63]
    - [15, 5.548]
  - - [65, 65, 128, 65]
    - [17, 4.785]
  - - [79, 79, 128, 79]
    - [17, 7.272]
  - - [81, 81, 128, 81]
    - [18, 7.709]
  - - [95, 95, 64, 95]
    - [19, 8.117]
  - - [97, 97, 64, 97]
    - [20, 7.934]
  - - [127, 127, 64, 127]
    - [21, 15.192]
  - - [129, 129, 64, 129]
    - [22, 12.694]
  - - [255, 255, 16, 255]
    - [23, 24.366]
  - - [257, 257, 16, 257]
    - [24, 23.084]
  - - [511, 511, 16, 511]
    - [25, 63.068]
  - - [513, 513, 16, 513]
    - [26, 56.537]
  - - [30, 30, 1000, 30]
    - [27, 4.93]
  - - [32, 32, 1000, 32]
    - [28, 6.401]
  - - [34, 34, 1000, 34]
    - [29, 4.642]
  - - [46, 46, 1000, 46]
    - [30, 8.782]
  - - [48, 48, 1000, 48]
    - [31, 11.437]
  - - [50, 50, 1000, 50]
    - [32, 10.339]
  - - [62, 62, 128, 62]
    - [33, 5.57]
  - - [64, 64, 128, 64]
    - [34, 6.792]
  - - [66, 66, 128, 66]
    - [35, 5.135]
  - - [78, 78, 128, 78]
    - [36, 7.613]
  - - [80, 80, 128, 80]
    - [37, 8.824]
  - - [82, 82, 128, 82]
    - [32, 8.465]
  - - [94, 94, 64, 94]
    - [38, 8.323]
  - - [96, 96, 64, 96]
    - [39, 9.899]
  - - [98, 98, 64, 98]
    - [40, 8.64]
  - - [126, 126, 64, 126]
    - [41, 15.915]
  - - [128, 128, 64, 128]
    - [42, 18.153]
  - - [130, 130, 64, 130]
    - [43, 13.498]
  - - [254, 254, 16, 254]
    - [44, 25.408]
  - - [256, 256, 16, 256]
    - [45, 27.484]
  - - [258, 258, 16, 258]
    - [44, 23.615]
  - - [510, 510, 16, 510]
    - [46, 64.462]
  - - [512, 512, 16, 512]
    - [47, 70.893]
  - - [514, 514, 16, 514]
    - [48, 58.64]
  - - [4864, 768, 1, 4096]
    - [49, 96.57]
  - - [4864, 768, 1, 8192]
    - [50, 97.69]
  - - [2432, 1536, 1, 4096]
    - [51, 95.73]
  - - [2432, 1536, 1, 8192]
    - [52, 97.49]
  - - [1536, 2432, 1, 4096]
    - [53, 96.12]
  - - [1536, 2432, 1, 8192]
    - [54, 97.17]
  - - [768, 4864, 1, 4096]
    - [55, 95.86]
  - - [768, 4864, 1, 8192]
    - [56, 97.65]
  - - [4864, 3072, 1, 2048]
    - [57, 95.08]
  - - [3072, 4864, 1, 2048]
    - [59, 95.39]
  - - [3072, 4864, 1, 4096]
    - [60, 96.87]
  - - [4864, 3072, 1, 6144]
    - [61, 98.01]
  - - [4864, 3072, 1, 8192]
    - [62, 98.86]
  - - [3072, 4864, 1, 6144]
    - [63, 98.45]
  - - [3072, 4864, 1, 8192]
    - [64, 99.21]
  - - [2432, 2048, 1, 1024]
    - [89, 79.23]
  - - [2432, 2048, 1, 2048]
    - [90, 89.4]
  - - [2048, 2432, 1, 1024]
    - [91, 81.33]
  - - [2048, 2432, 1, 2048]
    - [92, 89.8]
  - - [4864, 1024, 1, 1024]
    - [93, 74.35]
  - - [4864, 1024, 1, 2048]
    - [94, 86.95]
  - - [4864, 64, 1, 512]
    - [65, 35.82]
  - - [2432, 128, 1, 512]
    - [66, 25.93]
  - - [2432, 128, 1, 1024]
    - [67, 35.19]
  - - [9728, 64, 1, 1024]
    - [68, 57.34]
  - - [1216, 1024, 1, 1024]
    - [75, 64.23]
  - - [1216, 1024, 1, 2048]
    - [69, 80.59]
  - - [1216, 4096, 1, 4096]
    - [70, 91.63]
  - - [1024, 2432, 1, 2048]
    - [71, 84.83]
  - - [2432, 512, 1, 1024]
    - [72, 72.04]
  - - [4864, 256, 1, 1024]
    - [73, 67.85]
  - - [4864, 256, 1, 2048]
    - [74, 80.07]
  - - [512, 608, 1, 512]
    - [76, 28.78]
  - - [512, 608, 1, 1024]
    - [77, 37.18]
  - - [608, 512, 1, 512]
    - [78, 29.93]
  - - [608, 512, 1, 1024]
    - [79, 44.88]
  - - [1216, 256, 1, 512]
    - [80, 30.28]
  - - [9728, 128, 1, 1024]
    - [81, 70.16]
  - - [9728, 128, 1, 2048]
    - [82, 82.26]
  - - [19456, 256, 1, 512]
    - [83, 67.76]
  - - [19456, 256, 1, 1024]
    - [84, 79.65]
  - - [64, 64, 1, 512]
    - [85, 0.68]
  - - [128, 128, 1, 512]
    - [86, 1.72]
  - - [256, 256, 1, 512]
    - [87, 6.75]
  - - [256, 256, 1, 1024]
    - [88, 9.22]
- null
