library/src/blas3/Tensile/Logic/asm_full/aquavanjaram942X/aquavanjaram942_Cijk_Alik_Bljk_SB.yaml
- {MinimumRequiredVersion: 4.31.0}
- aquavanjaram942
- {Architecture: gfx942, IsAPU: 0}
- [Device 74a1]
    SolutionIndex: 0
    SolutionNameMin: Cijk_Alik_Bljk_SB_MT128x128x16_MI32x32x2x1_SN_GRVW4_GLS0_LPA4_LPB4_LRVW4_NEPBS4_NLCB1_PLR9_SU32_SUS256_SVW4_TT4_32_VW4_WG32_8_1_WGM24
    SolutionIndex: 1
    SolutionNameMin: Cijk_Alik_Bljk_SB_MT256x64x16_MI16x16x4x1_SN_GRVW2_GLS0_LPA2_LPB2_LRVW1_NEPBS4_NLCB1_PLR5_SU32_SUS256_SVW4_TT4_64_VW4_WG64_4_1_WGM24
    SolutionIndex: 2
    SolutionNameMin: Cijk_Alik_Bljk_SB_MT128x128x16_MI32x32x2x1_SN_GRVW2_GLS1_LPA2_LPB2_LRVW2_NEPBS4_NLCB1_PLR9_SU0_SUS0_SVW2_TT4_32_VW2_WG32_8_1_WGM42
    SolutionIndex: 3
    SolutionNameMin: Cijk_Alik_Bljk_SB_MT256x128x16_MI16x16x4x1_SN_GRVW2_GLS1_LPA2_LPB2_LRVW1_NEPBS4_NLCB1_PLR5_SU32_SUS256_SVW4_TT4_128_VW4_WG64_4_1_WGM36
    SolutionIndex: 4
    SolutionNameMin: Cijk_Alik_Bljk_SB_MT256x128x16_MI16x16x4x1_SN_GRVW2_GLS1_LPA2_LPB2_LRVW1_NEPBS4_NLCB2_PLR5_SU0_SUS0_SVW4_TT4_128_VW4_WG64_4_1_WGM42
    SolutionIndex: 5
    SolutionNameMin: Cijk_Alik_Bljk_SB_MT256x128x16_MI16x16x4x1_SN_GRVW2_GLS1_LPA2_LPB2_LRVW2_NEPBS4_NLCB1_PLR5_SU32_SUS256_SVW4_TT4_128_VW4_WG64_4_1_WGM36
    SolutionIndex: 6
    SolutionNameMin: Cijk_Alik_Bljk_SB_MT128x64x32_MI16x16x4x1_SN_GRVW2_GLS1_LPA2_LPB2_LRVW1_NEPBS0_PLR9_SU0_SUS0_SVW2_TT2_64_VW2_WG64_4_1_WGM42
    SolutionIndex: 7
    SolutionNameMin: Cijk_Alik_Bljk_SB_MT128x64x32_MI16x16x4x1_SN_GRVW2_GLS1_LPA2_LPB2_LRVW1_NEPBS4_PLR9_SU0_SUS0_SVW2_TT2_64_VW2_WG64_4_1_WGM36
    SolutionIndex: 8
    SolutionNameMin: Cijk_Alik_Bljk_SB_MT128x64x16_MI16x16x4x1_SN_GRVW4_LPA4_LPB4_LRVW1_NEPBS0_PLR5_SU32_SUS256_SVW2_TT2_64_VW2_WG64_4_1_WGM36
    SolutionIndex: 9
    SolutionNameMin: Cijk_Alik_Bljk_SB_MT64x64x16_MI16x16x4x1_SN_GRVW4_LPA4_LPB4_LRVW1_NEPBS0_PLR5_SU0_SUS0_SVW2_TT2_32_VW2_WG32_8_1_WGM18
    SolutionIndex: 10
    SolutionNameMin: Cijk_Alik_Bljk_SB_MT64x32x32_MI16x16x4x1_SN_GRVW4_LPA8_LPB8_LRVW4_MIAV0_NEPBS0_PLR9_SS0_SU0_SUS0_SVW4_TT2_16_VW4_WG32_8_1_WGM36
    SolutionIndex: 11
    SolutionNameMin: Cijk_Alik_Bljk_SB_MT64x32x32_MI16x16x4x1_SN_GRVW2_LPA2_LPB2_LRVW2_MIAV0_NEPBS0_PLR9_SS0_SU4_SUS512_SVW4_TT2_16_VW2_WG32_8_1_WGM18
    SolutionIndex: 12
    SolutionNameMin: Cijk_Alik_Bljk_SB_MT64x32x32_MI16x16x4x1_SN_GRVW4_LPA8_LPB8_LRVW4_MIAV1_NEPBS0_PLR9_SS1_SU0_SUS0_SVW2_TT2_16_VW2_WG32_8_1_WGM36
    SolutionIndex: 13
    SolutionNameMin: Cijk_Alik_Bljk_SB_MT64x32x32_MI16x16x4x1_SN_GRVW4_LPA8_LPB8_LRVW4_MIAV0_NEPBS4_PLR9_SS0_SU0_SUS0_SVW4_TT2_16_VW4_WG32_8_1_WGM36
    SolutionIndex: 14
    SolutionNameMin: Cijk_Alik_Bljk_SB_MT64x32x32_MI16x16x4x1_SN_GRVW4_LPA4_LPB4_LRVW1_MIAV0_NEPBS4_PLR9_SS0_SU32_SUS256_SVW4_TT2_16_VW4_WG32_8_1_WGM18
    SolutionIndex: 15
    SolutionNameMin: Cijk_Alik_Bljk_SB_MT64x32x32_MI16x16x4x1_SN_AMAS0_GRVW2_LBSPP0_LPA1_LPB1_LRVW1_NEPBS0_PLR9_SS1_SVW1_TT2_16_TLDS0_UMLDSA0_UMLDSB0_VW1_WG32_8_1_WGM6
    SolutionIndex: 16
    SolutionNameMin: Cijk_Alik_Bljk_SB_MT32x64x32_MI16x16x4x1_SN_AMAS0_GRVW2_LBSPP0_LPA1_LPB1_LRVW1_NEPBS0_PLR9_SS0_SVW4_TT2_16_TLDS0_UMLDSA0_UMLDSB0_VW1_WG16_16_1_WGM12
    SolutionIndex: 17
    SolutionNameMin: Cijk_Alik_Bljk_SB_MT64x32x32_MI16x16x4x1_SN_AMAS0_GRVW1_LBSPP0_LPA1_LPB1_LRVW1_NEPBS0_PLR9_SS1_SVW1_TT1_32_TLDS0_UMLDSA0_UMLDSB0_VW1_WG64_4_1_WGM6
    SolutionIndex: 18
    SolutionNameMin: Cijk_Alik_Bljk_SB_MT64x64x16_MI32x32x2x1_SN_AMAS0_GRVW1_LBSPP0_LPA1_LPB1_LRVW1_NEPBS0_PLR9_SS1_SVW1_TT1_32_TLDS0_UMLDSA0_UMLDSB0_VW1_WG64_4_1_WGM12
    SolutionIndex: 19
    SolutionNameMin: Cijk_Alik_Bljk_SB_MT64x64x16_MI32x32x2x1_SN_AMAS0_GRVW2_LBSPP128_LPA2_LPB2_LRVW2_NEPBS4_PLR9_SS1_SVW1_TT1_32_TLDS1_UMLDSA1_UMLDSB1_VW1_WG64_4_1_WGM6
    SolutionIndex: 20
    SolutionNameMin: Cijk_Alik_Bljk_SB_MT64x64x16_MI32x32x2x1_SN_AMAS0_GRVW1_LBSPP0_LPA1_LPB1_LRVW1_NEPBS0_PLR9_SS1_SVW1_TT1_32_TLDS0_UMLDSA0_UMLDSB0_VW1_WG64_4_1_WGM6
    SolutionIndex: 21
    SolutionNameMin: Cijk_Alik_Bljk_SB_MT32x64x16_MI16x16x4x1_SN_AMAS0_GRVW1_LBSPP128_LPA2_LPB2_LRVW2_NEPBS4_PLR5_SS1_SVW1_TT1_32_TLDS1_UMLDSA1_UMLDSB1_VW1_WG32_8_1_WGM6
    SolutionIndex: 22
    SolutionNameMin: Cijk_Alik_Bljk_SB_MT32x64x32_MI16x16x4x1_SN_AMAS3_GRVW1_LBSPP128_LPA2_LPB2_LRVW1_NEPBS0_PLR9_SS1_SVW2_TT2_16_TLDS1_UMLDSA1_UMLDSB1_VW2_WG16_16_1_WGM6
    SolutionIndex: 23
    SolutionNameMin: Cijk_Alik_Bljk_SB_MT32x64x32_MI16x16x4x1_SN_AMAS0_GRVW1_LBSPP128_LPA2_LPB2_LRVW2_NEPBS4_PLR9_SS1_SVW1_TT1_32_TLDS1_UMLDSA1_UMLDSB1_VW1_WG32_8_1_WGM6
    SolutionIndex: 24
    SolutionNameMin: Cijk_Alik_Bljk_SB_MT32x64x32_MI16x16x4x1_SN_AMAS0_GRVW1_LBSPP0_LPA1_LPB1_LRVW1_NEPBS4_PLR9_SS1_SVW1_TT2_16_TLDS0_UMLDSA0_UMLDSB0_VW1_WG16_16_1_WGM12
    SolutionIndex: 25
    SolutionNameMin: Cijk_Alik_Bljk_SB_MT64x32x32_MI16x16x4x1_SN_AMAS0_GRVW1_LBSPP128_LPA2_LPB2_LRVW1_NEPBS4_PLR9_SS1_SVW1_TT1_32_TLDS1_UMLDSA1_UMLDSB1_VW1_WG64_4_1_WGM6
    SolutionIndex: 26
    SolutionNameMin: Cijk_Alik_Bljk_SB_MT32x64x32_MI16x16x4x1_SN_AMAS0_GRVW1_LBSPP128_LPA2_LPB2_LRVW2_NEPBS0_PLR9_SS1_SVW1_TT2_16_TLDS1_UMLDSA1_UMLDSB1_VW1_WG16_16_1_WGM12
    SolutionIndex: 27
    SolutionNameMin: Cijk_Alik_Bljk_SB_MT128x64x16_MI32x32x2x1_SN_AMAS0_GRVW1_LBSPP0_LPA1_LPB1_LRVW1_NEPBS0_PLR9_SS1_SVW1_TT2_32_TLDS0_UMLDSA0_UMLDSB0_VW1_WG64_4_1_WGM6
    SolutionIndex: 28
    SolutionNameMin: Cijk_Alik_Bljk_SB_MT32x64x32_MI16x16x4x1_SN_AMAS3_GRVW1_LBSPP0_LPA2_LPB2_LRVW1_NEPBS4_PLR9_SS1_SVW2_TT2_16_TLDS0_UMLDSA0_UMLDSB0_VW2_WG16_16_1_WGM12
    SolutionIndex: 29
    SolutionNameMin: Cijk_Alik_Bljk_SB_MT32x64x32_MI16x16x4x1_SN_AMAS3_GRVW1_LBSPP0_LPA2_LPB2_LRVW1_NEPBS0_PLR9_SS1_SVW2_TT2_16_TLDS0_UMLDSA0_UMLDSB0_VW2_WG16_16_1_WGM6
    SolutionIndex: 30
    SolutionNameMin: Cijk_Alik_Bljk_SB_MT64x64x16_MI32x32x2x1_SN_AMAS0_GRVW1_LBSPP128_LPA2_LPB2_LRVW2_NEPBS0_PLR9_SS1_SVW1_TT1_32_TLDS1_UMLDSA1_UMLDSB1_VW1_WG64_4_1_WGM6
    SolutionIndex: 31
    SolutionNameMin: Cijk_Alik_Bljk_SB_MT64x32x32_MI16x16x4x1_SN_AMAS3_GRVW1_LBSPP128_LPA2_LPB2_LRVW2_NEPBS0_PLR9_SS1_SVW2_TT2_16_TLDS1_UMLDSA1_UMLDSB1_VW2_WG32_8_1_WGM6
    SolutionIndex: 32
    SolutionNameMin: Cijk_Alik_Bljk_SB_MT32x64x32_MI16x16x4x1_SN_AMAS3_GRVW1_LBSPP0_LPA2_LPB2_LRVW1_NEPBS4_PLR9_SS1_SVW2_TT2_16_TLDS0_UMLDSA0_UMLDSB0_VW2_WG16_16_1_WGM6
    SolutionIndex: 33
    SolutionNameMin: Cijk_Alik_Bljk_SB_MT32x64x32_MI16x16x4x1_SN_AMAS3_GRVW4_LBSPP0_LPA2_LPB2_LRVW1_NEPBS0_PLR9_SS1_SVW2_TT2_16_TLDS0_UMLDSA0_UMLDSB0_VW2_WG16_16_1_WGM6
    SolutionIndex: 34
    SolutionNameMin: Cijk_Alik_Bljk_SB_MT64x64x16_MI16x16x4x1_SN_AMAS3_GRVW1_LBSPP128_LPA2_LPB2_LRVW1_NEPBS0_PLR5_SS1_SVW2_TT2_32_TLDS1_UMLDSA1_UMLDSB1_VW2_WG32_8_1_WGM12
    SolutionIndex: 35
    SolutionNameMin: Cijk_Alik_Bljk_SB_MT64x64x16_MI16x16x4x1_SN_AMAS3_GRVW1_LBSPP128_LPA2_LPB2_LRVW2_NEPBS0_PLR5_SS1_SVW2_TT2_32_TLDS1_UMLDSA1_UMLDSB1_VW2_WG32_8_1_WGM12
    SolutionIndex: 36
    SolutionNameMin: Cijk_Alik_Bljk_SB_MT64x64x16_MI16x16x4x1_SN_AMAS3_GRVW2_LBSPP128_LPA2_LPB2_LRVW2_NEPBS4_PLR5_SS1_SVW2_TT2_32_TLDS1_UMLDSA1_UMLDSB1_VW2_WG32_8_1_WGM6
    SolutionIndex: 37
    SolutionNameMin: Cijk_Alik_Bljk_SB_MT64x64x16_MI16x16x4x1_SN_AMAS3_GRVW1_LBSPP0_LPA2_LPB2_LRVW1_NEPBS0_PLR5_SS1_SVW2_TT2_32_TLDS0_UMLDSA0_UMLDSB0_VW2_WG32_8_1_WGM6
    SolutionIndex: 38
    SolutionNameMin: Cijk_Alik_Bljk_SB_MT32x64x16_MI16x16x4x1_SN_AMAS3_GRVW2_LBSPP128_LPA2_LPB2_LRVW2_NEPBS4_PLR5_SS1_SVW2_TT2_16_TLDS1_UMLDSA1_UMLDSB1_VW2_WG16_16_1_WGM12
    SolutionIndex: 39
    SolutionNameMin: Cijk_Alik_Bljk_SB_MT64x64x32_MI16x16x4x1_SN_AMAS3_GRVW4_LBSPP0_LPA2_LPB2_LRVW1_NEPBS0_PLR9_SS1_SVW2_TT2_32_TLDS0_UMLDSA0_UMLDSB0_VW2_WG32_8_1_WGM6
    SolutionIndex: 40
    SolutionNameMin: Cijk_Alik_Bljk_SB_MT32x64x32_MI16x16x4x1_SN_AMAS3_GRVW1_LBSPP0_LPA2_LPB2_LRVW1_NEPBS0_PLR9_SS1_SVW2_TT2_16_TLDS0_UMLDSA0_UMLDSB0_VW2_WG16_16_1_WGM12
    SolutionIndex: 41
    SolutionNameMin: Cijk_Alik_Bljk_SB_MT32x64x32_MI16x16x4x1_SN_AMAS3_GRVW2_LBSPP128_LPA2_LPB2_LRVW1_NEPBS4_PLR9_SS1_SVW2_TT2_16_TLDS1_UMLDSA1_UMLDSB1_VW2_WG16_16_1_WGM6
    SolutionIndex: 42
    SolutionNameMin: Cijk_Alik_Bljk_SB_MT32x64x16_MI16x16x4x1_SN_AMAS3_GRVW2_LBSPP128_LPA2_LPB2_LRVW2_NEPBS0_PLR5_SS1_SVW2_TT2_16_TLDS1_UMLDSA1_UMLDSB1_VW2_WG16_16_1_WGM12
    SolutionIndex: 43
    SolutionNameMin: Cijk_Alik_Bljk_SB_MT32x64x16_MI16x16x4x1_SN_AMAS3_GRVW1_LBSPP128_LPA2_LPB2_LRVW2_NEPBS0_PLR5_SS1_SVW2_TT2_16_TLDS1_UMLDSA1_UMLDSB1_VW2_WG16_16_1_WGM6
    SolutionIndex: 44
    SolutionNameMin: Cijk_Alik_Bljk_SB_MT32x64x32_MI16x16x4x1_SN_AMAS0_GRVW4_LBSPP128_LPA4_LPB4_LRVW2_NEPBS0_PLR9_SS1_SVW1_TT2_16_TLDS1_UMLDSA1_UMLDSB1_VW1_WG16_16_1_WGM12
    SolutionIndex: 45
    SolutionNameMin: Cijk_Alik_Bljk_SB_MT32x64x16_MI16x16x4x1_SN_AMAS3_GRVW2_LBSPP128_LPA2_LPB2_LRVW2_NEPBS4_PLR5_SS1_SVW2_TT2_16_TLDS1_UMLDSA1_UMLDSB1_VW2_WG16_16_1_WGM6
    SolutionIndex: 46
    SolutionNameMin: Cijk_Alik_Bljk_SB_MT128x64x16_MI32x32x2x1_SN_AMAS3_GRVW2_LBSPP0_LPA2_LPB2_LRVW1_NEPBS0_PLR9_SS1_SVW2_TT2_32_TLDS0_UMLDSA0_UMLDSB0_VW2_WG64_4_1_WGM12
    SolutionIndex: 47
    SolutionNameMin: Cijk_Alik_Bljk_SB_MT128x64x32_MI16x16x4x1_SN_AMAS3_GRVW2_LBSPP128_LPA2_LPB2_LRVW1_NEPBS0_PLR9_SS1_SVW2_TT2_64_TLDS1_UMLDSA1_UMLDSB1_VW2_WG64_4_1_WGM12
    SolutionIndex: 48
    SolutionNameMin: Cijk_Alik_Bljk_SB_MT32x64x32_MI16x16x4x1_SN_AMAS3_GRVW2_LBSPP0_LPA2_LPB2_LRVW1_NEPBS0_PLR9_SS1_SVW2_TT2_16_TLDS0_UMLDSA0_UMLDSB0_VW2_WG16_16_1_WGM12
    SolutionIndex: 49
    SolutionNameMin: Cijk_Alik_Bljk_SB_MT32x64x32_MI16x16x4x1_SN_AMAS0_GRVW4_LBSPP0_LPA1_LPB1_LRVW1_NEPBS0_PLR9_SS1_SVW1_TT1_32_TLDS0_UMLDSA0_UMLDSB0_VW1_WG32_8_1_WGM6
    SolutionIndex: 50
    SolutionNameMin: Cijk_Alik_Bljk_SB_MT64x32x32_MI16x16x4x1_SN_AMAS3_GRVW2_LBSPP128_LPA2_LPB2_LRVW1_NEPBS0_PLR9_SS1_SVW2_TT2_16_TLDS1_UMLDSA1_UMLDSB1_VW2_WG32_8_1_WGM6
    SolutionIndex: 51
    SolutionNameMin: Cijk_Alik_Bljk_SB_MT64x32x32_MI16x16x4x1_SN_AMAS3_GRVW1_LBSPP128_LPA2_LPB2_LRVW1_NEPBS0_PLR9_SS1_SVW2_TT2_16_TLDS1_UMLDSA1_UMLDSB1_VW2_WG32_8_1_WGM12
    SolutionIndex: 52
    SolutionNameMin: Cijk_Alik_Bljk_SB_MT64x32x32_MI16x16x4x1_SN_AMAS3_GRVW4_LBSPP0_LPA2_LPB2_LRVW1_NEPBS0_PLR9_SS1_SVW2_TT2_16_TLDS0_UMLDSA0_UMLDSB0_VW2_WG32_8_1_WGM6
    SolutionIndex: 53
    SolutionNameMin: Cijk_Alik_Bljk_SB_MT64x64x16_MI32x32x2x1_SN_AMAS0_GRVW2_LBSPP128_LPA2_LPB2_LRVW1_NEPBS0_PLR9_SS1_SVW1_TT1_32_TLDS1_UMLDSA1_UMLDSB1_VW1_WG64_4_1_WGM12
    SolutionIndex: 54
    SolutionNameMin: Cijk_Alik_Bljk_SB_MT256x256x32_MI32x32x2x1_SN_AMAS3_GRVW2_LPA0_LPB0_PLR17_SS1_SU0_SUS0_SPO1_SSO0_SVW2_TT2_256_VW2_WG128_2_1_WGM18
    SolutionIndex: 55
    SolutionNameMin: Cijk_Alik_Bljk_SB_MT256x256x32_MI32x32x2x1_SN_AMAS3_GRVW4_LPA0_LPB0_PLR17_SS0_SU0_SUS0_SPO1_SSO0_SVW4_TT4_128_VW2_WG64_4_1_WGM36
    SolutionIndex: 56
    SolutionNameMin: Cijk_Alik_Bljk_SB_MT256x256x32_MI32x32x2x1_SN_AMAS0_GRVW4_LPA0_LPB0_PLR17_SS1_SU0_SUS0_SPO0_SSO4_SVW1_TT4_128_VW1_WG64_4_1_WGM42
    SolutionIndex: 57
    SolutionNameMin: Cijk_Alik_Bljk_SB_MT256x256x32_MI32x32x2x1_SN_AMAS3_GRVW4_LPA0_LPB0_PLR17_SS0_SU0_SUS0_SPO1_SSO0_SVW4_TT4_128_VW4_WG64_4_1_WGM42
    SolutionIndex: 58
    SolutionNameMin: Cijk_Alik_Bljk_SB_MT256x256x16_MI32x32x2x1_SN_AMAS3_GRVW4_LPA2_LPB2_PLR9_SS1_SU16_SUS256_SPO1_SSO4_SVW2_TT4_128_VW2_WG64_4_1_WGM18
    SolutionIndex: 59
    SolutionNameMin: Cijk_Alik_Bljk_SB_MT256x256x16_MI32x32x2x1_SN_AMAS0_GRVW4_LPA1_LPB1_PLR1_SS1_SU16_SUS256_SPO0_SSO8_SVW1_TT2_256_VW1_WG128_2_1_WGM18
    SolutionIndex: 60
    SolutionNameMin: Cijk_Alik_Bljk_SB_MT256x256x16_MI32x32x2x1_SN_AMAS0_GRVW1_LPA1_LPB1_PLR9_SS1_SU16_SUS256_SPO1_SSO0_SVW1_TT2_256_VW1_WG128_2_1_WGM36
    SolutionIndex: 61
    SolutionNameMin: Cijk_Alik_Bljk_SB_MT256x256x32_MI32x32x2x1_SN_AMAS3_GRVW4_LPA0_LPB0_PLR17_SS1_SU0_SUS0_SPO1_SSO8_SVW2_TT2_256_VW2_WG128_2_1_WGM18
    SolutionIndex: 62
    SolutionNameMin: Cijk_Alik_Bljk_SB_MT64x64x32_MI16x16x4x1_SN_ELFLR4_GLS0_NTC2_NTD3_NEPBS0_ONLL0_SU8_SUS128_SRVW0_SSO0_TT2_32_VW4_WG32_8_1_WGM32
    SolutionIndex: 63
    SolutionNameMin: Cijk_Alik_Bljk_SB_MT64x64x32_MI16x16x4x1_SN_ELFLR0_GLS0_NTC3_NTD2_NEPBS2_ONLL2_SU0_SUS0_SRVW0_SSO0_TT2_32_VW2_WG32_8_1_WGM32
    SolutionIndex: 64
    SolutionNameMin: Cijk_Alik_Bljk_SB_MT64x64x32_MI16x16x4x1_SN_ELFLR4_GLS0_NTC3_NTD2_NEPBS4_ONLL2_SU0_SUS0_SRVW4_SSO0_TT4_16_VW2_WG16_16_1_WGM32
    SolutionIndex: 65
    SolutionNameMin: Cijk_Alik_Bljk_SB_MT32x32x64_MI16x16x4x1_SN_AMAS3_ELFLR0_GLS0_LBSPPA512_MIAV0_NTC0_NTD3_NEPBS4_PLR1_SU32_SVW2_TT2_16_VW2_WG16_8_2_WGM32
    SolutionIndex: 66
    SolutionNameMin: Cijk_Alik_Bljk_SB_MT32x16x64_MI16x16x4x1_SN_AMAS0_ELFLR4_GLS0_LBSPPA256_MIAV1_NTC2_NTD3_NEPBS4_PLR1_SU32_SVW1_TT2_16_VW1_WG16_4_4_WGM16
    SolutionIndex: 67
    SolutionNameMin: Cijk_Alik_Bljk_SB_MT32x32x64_MI16x16x4x1_SN_AMAS3_ELFLR0_GLS0_LBSPPA512_MIAV1_NTC0_NTD3_NEPBS16_PLR1_SU32_SVW2_TT2_16_VW2_WG16_8_2_WGMn16
    SolutionIndex: 68
    SolutionNameMin: Cijk_Alik_Bljk_SB_MT32x16x64_MI16x16x4x1_SN_AMAS3_ELFLR4_GLS1_LBSPPA512_MIAV0_NTC0_NTD3_NEPBS16_PLR1_SU32_SVW2_TT2_16_VW2_WG16_4_4_WGM32
    SolutionIndex: 69
    SolutionNameMin: Cijk_Alik_Bljk_SB_MT32x32x64_MI16x16x4x1_SN_AMAS0_ELFLR0_GLS0_LBSPPA256_MIAV0_NTC2_NTD2_NEPBS4_PLR1_SU8_SVW1_TT1_16_VW1_WG32_8_1_WGM16
    SolutionIndex: 70
    SolutionNameMin: Cijk_Alik_Bljk_SB_MT64x64x32_MI16x16x4x1_SN_1LDSB1_AMAS0_EPS1_ELFLR4_GLVWA4_GLVWB4_GRVW4_GLS0_LPA4_LPB4_NEPBS2_ONLL0_SU0_SUS0_SPO0_VW1_WSGRB0_WGM32
    SolutionIndex: 71
    SolutionNameMin: Cijk_Alik_Bljk_SB_MT64x64x32_MI16x16x4x1_SN_1LDSB1_AMAS0_EPS0_ELFLR4_GLVWA4_GLVWB4_GRVW4_GLS0_LPA4_LPB4_NEPBS2_ONLL2_SU0_SUS0_SPO1_VW1_WSGRB0_WGM32
    SolutionIndex: 72
    SolutionNameMin: Cijk_Alik_Bljk_SB_MT64x64x32_MI16x16x4x1_SN_1LDSB0_AMAS0_EPS1_ELFLR0_GLVWA4_GLVWB4_GRVW4_GLS0_LPA4_LPB4_NEPBS2_ONLL0_SU8_SUS128_SPO1_VW1_WSGRB0_WGMn16
    SolutionIndex: 73
    SolutionNameMin: Cijk_Alik_Bljk_SB_MT64x64x32_MI16x16x4x1_SN_1LDSB1_AMAS0_EPS1_ELFLR0_GLVWA4_GLVWB4_GRVW4_GLS0_LPA4_LPB4_NEPBS2_ONLL2_SU8_SUS256_SPO0_VW1_WSGRB1_WGMn32
    SolutionIndex: 74
    SolutionNameMin: Cijk_Alik_Bljk_SB_MT16x32x128_MI16x16x4x1_SN_1LDSB0_AMAS0_GLVWA4_GLVWB4_GRVW4_GSU1_GSUASB_LBSPPA512_LBSPPB512_LPA4_LPB4_MIAV1_MKFGSU256_NTC2_NTD2_NEPBS2_NLCA1_PLR9_SVW1_TT1_32_VW1_WG16_4_4_WGM1
    SolutionIndex: 75
    SolutionNameMin: Cijk_Alik_Bljk_SB_MT32x32x128_MI16x16x4x1_SN_1LDSB1_AMAS0_GLVWA4_GLVWB4_GRVW4_GSU1_GSUASB_LBSPPA512_LBSPPB512_LPA4_LPB4_MIAV1_MKFGSU256_NTC0_NTD0_NEPBS4_NLCA1_PLR17_SVW1_TT2_16_VW1_WG16_8_2_WGM1
    SolutionIndex: 76
    SolutionNameMin: Cijk_Alik_Bljk_SB_MT32x16x128_MI16x16x4x1_SN_1LDSB0_AMAS0_GLVWA4_GLVWB4_GRVW4_GSU1_GSUASB_LBSPPA512_LBSPPB512_LPA4_LPB4_MIAV1_MKFGSU256_NTC2_NTD2_NEPBS2_NLCA1_PLR17_SVW1_TT1_16_VW1_WG32_4_2_WGM1
    SolutionIndex: 77
    SolutionNameMin: Cijk_Alik_Bljk_SB_MT32x16x128_MI16x16x4x1_SN_1LDSB0_AMAS0_GLVWA4_GLVWB4_GRVW4_GSU1_GSUASB_LBSPPA512_LBSPPB512_LPA4_LPB4_MIAV1_MKFGSU256_NTC0_NTD0_NEPBS4_NLCA1_PLR17_SVW1_TT1_16_VW1_WG32_4_2_WGM1
    SolutionIndex: 78
    SolutionNameMin: Cijk_Alik_Bljk_SB_MT16x32x128_MI16x16x4x1_SN_1LDSB0_AMAS0_GLVWA4_GLVWB4_GRVW4_GSU1_GSUASB_LBSPPA512_LBSPPB512_LPA4_LPB4_MIAV1_MKFGSU256_NTC0_NTD0_NEPBS4_NLCA1_PLR9_SVW1_TT1_32_VW1_WG16_4_4_WGM1
    SolutionIndex: 79
    SolutionNameMin: Cijk_Alik_Bljk_SB_MT128x128x32_MI16x16x4x1_SN_AMAS3_ELFLR8_GLVWA4_GLVWB4_GLS0_LBSPPA256_NEPBS2_SU8_SUS128_SPO0_SVW2_TT4_64_VW2_WG32_8_1_WGM32
    SolutionIndex: 80
    SolutionNameMin: Cijk_Alik_Bljk_SB_MT128x128x32_MI16x16x4x1_SN_AMAS3_ELFLR8_GLVWA4_GLVWB2_GLS1_LBSPPA256_NEPBS2_SU8_SUS128_SPO1_SVW2_TT2_128_VW2_WG64_4_1_WGM32
    SolutionIndex: 81
    SolutionNameMin: Cijk_Alik_Bljk_SB_MT128x64x32_MI16x16x4x1_SN_AMAS3_ELFLR0_GLVWA4_GLVWB4_GLS0_LBSPPA256_NEPBS4_SU8_SUS128_SPO1_SVW2_TT2_64_VW2_WG64_4_1_WGMn32
    SolutionIndex: 82
    SolutionNameMin: Cijk_Alik_Bljk_SB_MT128x128x32_MI16x16x4x1_SN_AMAS3_ELFLR8_GLVWA2_GLVWB4_GLS0_LBSPPA256_NEPBS2_SU4_SUS128_SPO0_SVW2_TT2_128_VW2_WG64_4_1_WGMn32
    SolutionIndex: 83
    SolutionNameMin: Cijk_Alik_Bljk_SB_MT128x128x32_MI16x16x4x1_SN_AMAS3_ELFLR0_GLVWA4_GLVWB4_GLS0_LBSPPA256_NEPBS2_SU0_SUS0_SPO0_SVW2_TT4_64_VW2_WG32_8_1_WGMn32
    SolutionIndex: 84
    SolutionNameMin: Cijk_Alik_Bljk_SB_MT128x64x32_MI16x16x4x1_SN_AMAS3_ELFLR8_GLVWA4_GLVWB4_GLS0_LBSPPA256_NEPBS4_SU4_SUS128_SPO0_SVW2_TT4_32_VW2_WG32_8_1_WGMn32
    SolutionIndex: 85
    SolutionNameMin: Cijk_Alik_Bljk_SB_MT64x32x64_MI16x16x4x1_SN_ASGT_GLVWA4_GLVWB4_GRVW4_GSU1_LBSPPA256_LBSPPB256_PLR17_SU0_SUS0_TT2_16_WG32_8_1_WGM8
    SolutionIndex: 86
    SolutionNameMin: Cijk_Alik_Bljk_SB_MT64x48x64_MI16x16x4x1_SN_ASGT_GLVWA4_GLVWB4_GRVW4_GSU1_LBSPPA256_LBSPPB256_PLR9_SU4_SUS256_TT2_48_WG32_4_2_WGM8
    SolutionIndex: 87
    SolutionNameMin: Cijk_Alik_Bljk_SB_MT64x32x64_MI16x16x4x1_SN_ASGT_GLVWA4_GLVWB4_GRVW4_GSU1_LBSPPA256_LBSPPB256_PLR9_SU4_SUS256_TT2_32_WG32_4_2_WGM1
    SolutionIndex: 88
    SolutionNameMin: Cijk_Alik_Bljk_SB_MT128x128x32_MI16x16x4x1_SN_GLVWA4_GLVWB4_GRVW4_LPA8_LPB8_LRVW4_MIAV0_NTC0_NTD0_PLR9_SU4_SUS256_TT2_128_WG64_4_1_WGMn24
    SolutionIndex: 89
    SolutionNameMin: Cijk_Alik_Bljk_SB_MT128x128x16_MI16x16x4x1_SN_GLVWA4_GLVWB4_GRVW4_LPA4_LPB4_LRVW2_MIAV0_NTC0_NTD0_PLR5_SU4_SUS256_TT2_128_WG64_4_1_WGM1
    SolutionIndex: 90
    SolutionNameMin: Cijk_Alik_Bljk_SB_MT128x128x32_MI16x16x4x1_SN_GLVWA1_GLVWB4_LPA8_LPB8_LRVW4_MIAV1_PLR9_SU0_SUS0_TT4_64_WG32_8_1_WGM1
    SolutionIndex: 91
    SolutionNameMin: Cijk_Alik_Bljk_SB_MT192x128x32_MI16x16x4x1_SN_GLVWA4_GLVWB4_GRVW4_LPA4_LPB4_LRVW1_MIAV1_NTC0_NTD0_PLR9_SU4_SUS256_TT6_64_WG32_8_1_WGM1
    SolutionIndex: 92
    SolutionNameMin: Cijk_Alik_Bljk_SB_MT128x128x16_MI16x16x4x1_SN_GLVWA1_GLVWB1_GRVW1_LPA2_LPB2_LRVW1_NTC3_NTD3_PLR1_SU4_SUS256_TT4_64_WG32_8_1_WGMn32
    SolutionIndex: 93
    SolutionNameMin: Cijk_Alik_Bljk_SB_MT128x32x32_MI16x16x4x1_SN_GLVWB4_GLS0_LPA8_LPB8_LRVW4_NTC0_NTD0_PLR9_SU0_SUS0_TT2_32_WG64_4_1_WGMn24
    SolutionIndex: 94
    SolutionNameMin: Cijk_Alik_Bljk_SB_MT128x128x16_MI16x16x4x1_SN_GLVWA1_GLVWB1_GRVW1_LPA2_LPB2_MIAV0_NTC0_NTD0_PLR1_SU0_SUS0_SSO4_TT2_128_WG64_4_1_WGM1
    SolutionIndex: 95
    SolutionNameMin: Cijk_Alik_Bljk_SB_MT16x16x64_MI16x16x4x1_SN_LBSPPA256_LBSPPB256_PLR9_SU0_SUS0_WG16_4_2
    SolutionIndex: 96
    SolutionNameMin: Cijk_Alik_Bljk_SB_MT16x16x256_MI16x16x4x1_SN_GSU2_GSUAMB_LBSPPA1024_LBSPPB1024_LPA8_LPB8_PGR2_PLR17_SU0_SUS0_WG16_4_4
    SolutionIndex: 97
    SolutionNameMin: Cijk_Alik_Bljk_SB_MT16x16x64_MI16x16x4x1_SN_GSU14_GSUAMB_LBSPPA256_LBSPPB256_LPA8_LPB8_PGR2_PLR9_SU0_SUS0_WG16_4_2
    SolutionIndex: 98
    SolutionNameMin: Cijk_Alik_Bljk_SB_MT16x16x128_MI16x16x4x1_SN_GSU14_LBSPPA512_LBSPPB512_LPA8_LPB8_PLR9
    SolutionIndex: 99
    SolutionNameMin: Cijk_Alik_Bljk_SB_MT96x64x32_MI16x16x4x1_SN_GLVWA2_GLVWB2_GRVW2_LPA2_LPB2_LRVW2_MIAV1_PLR9_SU4_SUS256_TT3_32_WG32_8_1_WGMn8
    SolutionIndex: 100
    SolutionNameMin: Cijk_Alik_Bljk_SB_MT96x64x32_MI16x16x4x1_SN_GLVWA4_GLVWB4_GRVW4_LPA4_LPB4_LRVW1_MIAV1_PLR9_SU0_SUS0_TT3_32_WG32_8_1_WGMn8
    SolutionIndex: 101
    SolutionNameMin: Cijk_Alik_Bljk_SB_MT96x64x16_MI16x16x4x1_SN_GLVWA1_GLVWB1_GRVW1_LPA2_LPB2_LRVW2_MIAV0_PLR5_SU0_SUS0_TT3_32_WG32_8_1_WGMn8
    SolutionIndex: 102
    SolutionNameMin: Cijk_Alik_Bljk_SB_MT96x96x32_MI16x16x4x1_SN_GLVWA4_GLVWB4_GRVW4_LPA4_LPB4_LRVW1_MIAV1_PLR9_SU0_SUS0_TT3_48_WG32_8_1_WGMn8
    SolutionIndex: 103
    SolutionNameMin: Cijk_Alik_Bljk_SB_MT96x64x32_MI16x16x4x1_SN_GLVWA4_GLVWB4_GRVW4_LPA4_LPB4_LRVW1_MIAV1_PLR9_SU0_SUS0_TT3_32_WG32_8_1_WGM1
    SolutionIndex: 104
    SolutionNameMin: Cijk_Alik_Bljk_SB_MT96x64x32_MI16x16x4x1_SN_GLVWA4_GLVWB4_GRVW4_LPA4_LPB4_LRVW2_MIAV1_PLR9_SU0_SUS0_TT3_32_WG32_8_1_WGM1
    SolutionIndex: 105
    SolutionNameMin: Cijk_Alik_Bljk_SB_MT96x96x32_MI16x16x4x1_SN_GLVWA4_GLVWB4_GRVW4_LPA4_LPB4_LRVW1_MIAV1_PLR9_SU0_SUS0_TT3_48_WG32_8_1_WGM1
    SolutionIndex: 106
    SolutionNameMin: Cijk_Alik_Bljk_SB_MT128x128x16_MI16x16x4x1_SN_GLVWA1_GLVWB1_GRVW1_GLS1_LPA2_LPB2_LRVW1_MIAV0_NTC0_NTD0_PLR1_TT2_128_WG64_4_1_WGM1
    SolutionIndex: 107
    SolutionNameMin: Cijk_Alik_Bljk_SB_MT128x128x8_MI16x16x4x1_SN_GLVWA2_GLVWB2_GRVW2_GLS0_LPA2_LPB2_LRVW1_MIAV0_NTC3_NTD3_PLR3_TT4_64_WG32_8_1_WGM1
    SolutionIndex: 108
    SolutionNameMin: Cijk_Alik_Bljk_SB_MT128x128x16_MI16x16x4x1_SN_GLVWA4_GLVWB4_GRVW4_GLS1_LPA4_LPB4_LRVW1_MIAV0_NTC0_NTD0_PLR1_TT4_64_WG32_8_1_WGMn32
    SolutionIndex: 109
    SolutionNameMin: Cijk_Alik_Bljk_SB_MT128x128x16_MI16x16x4x1_SN_GLVWA4_GLVWB4_GRVW4_GLS0_LPA4_LPB4_LRVW1_MIAV1_NTC0_NTD0_PLR1_TT4_64_WG32_8_1_WGMn32
    SolutionIndex: 110
    SolutionNameMin: Cijk_Alik_Bljk_SB_MT192x16x16_MI16x16x4x1_SN_GLVWA1_GLVWB1_LPA2_LPB2_LRVW1_MIAV1_PLR1_SU0_SUS0_TT3_16_WGMn24
    SolutionIndex: 111
    SolutionNameMin: Cijk_Alik_Bljk_SB_MT128x48x16_MI16x16x4x1_SN_GLVWA1_GLVWB1_GLS0_LPA2_LPB2_LRVW2_NTC3_NTD3_PLR5_TT2_48_WG64_4_1_WGMn24
    SolutionIndex: 112
    SolutionNameMin: Cijk_Alik_Bljk_SB_MT128x64x16_MI16x16x4x1_SN_GLVWA2_GLVWB1_GLS1_LPA2_LPB2_LRVW1_NTC3_NTD3_PLR1_TT4_32_WG32_8_1_WGMn32
    SolutionIndex: 113
    SolutionNameMin: Cijk_Alik_Bljk_SB_MT128x128x16_MI16x16x4x1_SN_GLVWA4_GLVWB4_GLS1_LPA4_LPB4_LRVW1_NTC3_NTD3_PLR1_TT4_64_WG32_8_1_WGMn32
    SolutionIndex: 114
    SolutionNameMin: Cijk_Alik_Bljk_SB_MT128x128x16_MI16x16x4x1_SN_GLVWA1_GLVWB1_GRVW1_GLS1_LPA2_LPB2_LRVW1_MIAV1_NTC0_NTD0_PLR1_TT4_64_WG32_8_1_WGM1
    SolutionIndex: 115
    SolutionNameMin: Cijk_Alik_Bljk_SB_MT128x128x16_MI16x16x4x1_SN_GLVWA1_GLVWB1_GRVW1_GLS1_LPA2_LPB2_LRVW1_MIAV0_NTC0_NTD0_PLR1_TT4_64_WG32_8_1_WGMn32
    SolutionIndex: 116
    SolutionNameMin: Cijk_Alik_Bljk_SB_MT128x64x32_MI16x16x4x1_SN_GLVWA4_GLVWB4_GRVW4_GLS0_LPA4_LPB4_LRVW2_MIAV0_NTC0_NTD0_PLR9_SU4_SUS256_SPO0_TT4_32_WG32_8_1_WGM1
    SolutionIndex: 117
    SolutionNameMin: Cijk_Alik_Bljk_SB_MT128x128x16_MI16x16x4x1_SN_GLVWA4_GLVWB4_GRVW4_GLS1_LPA4_LPB4_LRVW1_MIAV1_NTC0_NTD0_PLR5_SU4_SUS256_SPO1_TT2_128_WG64_4_1_WGM1
    SolutionIndex: 118
    SolutionNameMin: Cijk_Alik_Bljk_SB_MT192x128x16_MI16x16x4x1_SN_GLVWA4_GLVWB4_GRVW4_GLS1_LPA4_LPB4_LRVW1_MIAV0_NTC0_NTD0_PLR5_SU4_SUS256_SPO1_TT3_128_WG64_4_1_WGM1
    SolutionIndex: 119
    SolutionNameMin: Cijk_Alik_Bljk_SB_MT64x128x32_MI16x16x4x1_SN_AMAS0_ELFLR0_GLVWA4_GLVWB4_LBSPPA128_LPA4_LPB4_LRVW1_MIAV0_SS0_SU0_SUS0_SVW4_TT1_128_VW1_WG64_4_1_WGM1
    SolutionIndex: 120
    SolutionNameMin: Cijk_Alik_Bljk_SB_MT64x128x32_MI16x16x4x1_SN_AMAS0_ELFLR4_GLVWA1_GLVWB4_LBSPPA128_LPA8_LPB8_LRVW4_MIAV1_SS1_SU0_SUS0_SVW1_TT4_32_VW1_WG16_16_1_WGMn16
    SolutionIndex: 121
    SolutionNameMin: Cijk_Alik_Bljk_SB_MT64x128x32_MI16x16x4x1_SN_AMAS0_ELFLR0_GLVWA4_GLVWB4_LBSPPA128_LPA4_LPB4_LRVW2_MIAV1_SS0_SU0_SUS0_SVW4_TT1_128_VW1_WG64_4_1_WGMn16
    SolutionIndex: 122
    SolutionNameMin: Cijk_Alik_Bljk_SB_MT64x64x32_MI16x16x4x1_SN_AMAS3_ELFLR0_GLVWA1_GLVWB4_LBSPPA256_LPA2_LPB4_LRVW1_MIAV1_SS1_SU4_SUS128_SVW2_TT4_16_VW2_WG16_16_1_WGMn16
    SolutionIndex: 123
    SolutionNameMin: Cijk_Alik_Bljk_SB_MT64x32x32_MI16x16x4x1_SN_ELFLR4_GLVWA4_GLVWB1_GLS1_LPA4_LRVW1_NEPBS0_ONLL1_PLR1_TT2_16_WG32_8_1_WGM1
    SolutionIndex: 124
    SolutionNameMin: Cijk_Alik_Bljk_SB_MT64x32x32_MI16x16x4x1_SN_ELFLR4_GLVWA4_GLVWB2_GLS1_LPA4_LRVW1_NEPBS4_ONLL0_PLR1_TT2_16_WG32_8_1_WGM1
    SolutionIndex: 125
    SolutionNameMin: Cijk_Alik_Bljk_SB_MT64x32x16_MI16x16x4x1_SN_ELFLR4_GLVWA4_GLVWB1_GLS1_LPA4_LRVW1_NEPBS2_ONLL0_PLR1_TT2_16_WG32_8_1_WGM1
    SolutionIndex: 126
    SolutionNameMin: Cijk_Alik_Bljk_SB_MT32x128x16_MI16x16x4x1_SN_ELFLR4_GLVWA1_GLVWB2_GLS0_LPA2_LRVW1_NEPBS0_ONLL1_PLR1_TT1_64_WG32_8_1_WGM16
    SolutionIndex: 127
    SolutionNameMin: Cijk_Alik_Bljk_SB_MT64x128x32_MI16x16x4x1_SN_ELFLR0_GLVWA1_GLVWB2_GLS1_LPA2_LRVW2_NEPBS4_ONLL0_PLR9_TT4_32_WG16_16_1_WGM16
    SolutionIndex: 128
    SolutionNameMin: Cijk_Alik_Bljk_SB_MT32x64x32_MI16x16x4x1_SN_AMAS0_EPS0_ELFLR4_GLVWA4_GLS0_LBSPPA128_LPA4_LRVW1_MIAV1_ONLL0_PGR2_SU0_SUS0_SPO1_SVW1_TT1_32_VW1_WG32_8_1_WGM32
    SolutionIndex: 129
    SolutionNameMin: Cijk_Alik_Bljk_SB_MT32x128x32_MI16x16x4x1_SN_AMAS3_EPS1_ELFLR0_GLVWA4_GLS0_LBSPPA256_LPA4_LRVW1_MIAV1_ONLL1_PGR2_SU0_SUS0_SPO1_SVW2_TT2_32_VW2_WG16_16_1_WGM32
    SolutionIndex: 130
    SolutionNameMin: Cijk_Alik_Bljk_SB_MT32x64x32_MI16x16x4x1_SN_AMAS0_EPS0_ELFLR4_GLVWA1_GLS0_LBSPPA128_LPA2_LRVW1_MIAV1_ONLL0_PGR2_SU0_SUS0_SPO1_SVW1_TT2_16_VW1_WG16_16_1_WGM16
    SolutionIndex: 131
    SolutionNameMin: Cijk_Alik_Bljk_SB_MT32x64x32_MI16x16x4x1_SN_AMAS3_EPS1_ELFLR0_GLVWA4_GLS1_LBSPPA256_LPA4_LRVW2_MIAV1_ONLL1_PGR2_SU0_SUS0_SPO1_SVW2_TT2_16_VW2_WG16_16_1_WGM16
    SolutionIndex: 132
    SolutionNameMin: Cijk_Alik_Bljk_SB_MT32x64x32_MI16x16x4x1_SN_AMAS0_EPS1_ELFLR0_GLVWA4_GLS0_LBSPPA128_LPA4_LRVW2_MIAV1_ONLL0_PGR2_SU4_SUS256_SPO0_SVW1_TT1_32_VW1_WG32_8_1_WGM16
    SolutionIndex: 133
    SolutionNameMin: Cijk_Alik_Bljk_SB_MT32x128x32_MI16x16x4x1_SN_AMAS3_EPS0_ELFLR0_GLVWA1_GLS0_LBSPPA256_LPA2_LRVW2_MIAV1_ONLL0_PGR2_SU0_SUS0_SPO0_SVW2_TT2_32_VW2_WG16_16_1_WGM32
    SolutionIndex: 134
    SolutionNameMin: Cijk_Alik_Bljk_SB_MT32x64x32_MI16x16x4x1_SN_AMAS0_EPS1_ELFLR4_GLVWA4_GLS1_LBSPPA128_LPA4_LRVW2_MIAV0_ONLL1_PGR2_SU4_SUS256_SPO0_SVW1_TT2_16_VW1_WG16_16_1_WGM32
    SolutionIndex: 135
    SolutionNameMin: Cijk_Alik_Bljk_SB_MT32x64x32_MI16x16x4x1_SN_AMAS0_EPS1_ELFLR0_GLVWA1_GLS1_LBSPPA128_LPA2_LRVW2_MIAV1_ONLL1_PGR2_SU0_SUS0_SPO0_SVW1_TT2_16_VW1_WG16_16_1_WGM16
    SolutionIndex: 136
    SolutionNameMin: Cijk_Alik_Bljk_SB_MT32x64x32_MI16x16x4x1_SN_AMAS0_EPS0_ELFLR0_GLVWA4_GLS1_LBSPPA128_LPA4_LRVW2_MIAV1_ONLL1_PGR1_SU0_SUS0_SPO1_SVW1_TT2_16_VW1_WG16_16_1_WGM32
    SolutionIndex: 137
    SolutionNameMin: Cijk_Alik_Bljk_SB_MT32x128x32_MI16x16x4x1_SN_AMAS3_EPS1_ELFLR0_GLVWA4_GLS0_LBSPPA256_LPA4_LRVW2_MIAV1_ONLL0_PGR2_SU0_SUS0_SPO0_SVW2_TT2_32_VW2_WG16_16_1_WGM32
    SolutionIndex: 138
    SolutionNameMin: Cijk_Alik_Bljk_SB_MT32x64x64_MI16x16x4x1_SN_1LDSB0_AMAS0_EPS1_ELFLR4_GLVWA1_GLVWB4_LBSPPA256_LBSPPB256_LPA2_LPB4_MIAV1_ONLL0_PGR1_PLR1_SVW1_TT2_16_VW1_WG16_16_1_WGM16
    SolutionIndex: 139
    SolutionNameMin: Cijk_Alik_Bljk_SB_MT32x64x64_MI16x16x4x1_SN_1LDSB0_AMAS0_EPS1_ELFLR0_GLVWA2_GLVWB2_LBSPPA256_LBSPPB256_LPA2_LPB2_MIAV1_ONLL1_PGR2_PLR1_SVW1_TT2_16_VW1_WG16_16_1_WGM16
    SolutionIndex: 140
    SolutionNameMin: Cijk_Alik_Bljk_SB_MT32x64x32_MI16x16x4x1_SN_1LDSB0_AMAS0_EPS1_ELFLR0_GLVWA2_GLVWB4_LBSPPA128_LBSPPB128_LPA2_LPB4_MIAV0_ONLL1_PGR2_PLR9_SVW1_TT1_32_VW1_WG32_8_1_WGM16
    SolutionIndex: 141
    SolutionNameMin: Cijk_Alik_Bljk_SB_MT64x64x32_MI16x16x4x1_SN_AMAS3_GLVWB4_GLS0_LBSPPA256_LPB4_SU4_SUS256_SVW2_TT2_32_VW2_WSGRA1_WG32_8_1_WGM16
    SolutionIndex: 142
    SolutionNameMin: Cijk_Alik_Bljk_SB_MT32x64x32_MI16x16x4x1_SN_1LDSB0_AMAS0_EPS0_ELFLR0_GLVWA4_GLVWB4_LBSPPA128_LBSPPB128_LPA4_LPB4_MIAV0_ONLL1_PGR2_PLR9_SVW1_TT1_32_VW1_WG32_8_1_WGM32
    SolutionIndex: 143
    SolutionNameMin: Cijk_Alik_Bljk_SB_MT192x32x32_MI16x16x4x1_SN_AMAS0_GLVWB4_GLS0_LBSPPA128_LPB4_SU0_SUS0_SVW1_TT3_32_VW1_WSGRA0_WG64_4_1_WGM16
    SolutionIndex: 144
    SolutionNameMin: Cijk_Alik_Bljk_SB_MT64x64x32_MI16x16x4x1_SN_AMAS3_EPS1_GLVWA1_GLS0_LBSPPA256_LPA2_MIAV1_ONLL1_SPO1_SSO4_SVW2_TT2_32_VW2_WG32_8_1_WGM32
    SolutionIndex: 145
    SolutionNameMin: Cijk_Alik_Bljk_SB_MT64x64x32_MI16x16x4x1_SN_AMAS3_EPS1_GLVWA4_GLS0_LBSPPA512_LPA4_MIAV1_ONLL0_SPO1_SSO4_SVW4_TT4_16_VW4_WG16_16_1_WGM32
    SolutionIndex: 146
    SolutionNameMin: Cijk_Alik_Bljk_SB_MT64x64x32_MI16x16x4x1_SN_AMAS0_EPS0_GLVWA1_GLS1_LBSPPA128_LPA2_MIAV1_ONLL1_SPO1_SSO0_SVW1_TT2_32_VW1_WG32_8_1_WGM16
    SolutionIndex: 147
    SolutionNameMin: Cijk_Alik_Bljk_SB_MT64x128x32_MI16x16x4x1_SN_AMAS3_EPS0_GLVWA1_GLS0_LBSPPA512_LPA2_MIAV0_ONLL0_SPO1_SSO4_SVW4_TT4_32_VW4_WG16_16_1_WGM32
    SolutionIndex: 148
    SolutionNameMin: Cijk_Alik_Bljk_SB_MT32x128x16_MI16x16x4x1_SN_AMAS3_EPS0_ELFLR4_GLVWA1_GLS0_MIAV1_ONLL2_PGR1_SU4_SUS128_SSO0_SVW2_VW2_WGM32
    SolutionIndex: 149
    SolutionNameMin: Cijk_Alik_Bljk_SB_MT32x128x16_MI16x16x4x1_SN_AMAS3_EPS0_ELFLR0_GLVWA1_GLS0_MIAV1_ONLL1_PGR2_SU4_SUS256_SSO0_SVW2_VW2_WGM32
    SolutionIndex: 150
    SolutionNameMin: Cijk_Alik_Bljk_SB_MT32x128x16_MI16x16x4x1_SN_AMAS0_EPS0_ELFLR4_GLVWA1_GLS1_MIAV1_ONLL0_PGR2_SU4_SUS128_SSO0_SVW1_VW1_WGM32
    SolutionIndex: 151
    SolutionNameMin: Cijk_Alik_Bljk_SB_MT32x128x16_MI16x16x4x1_SN_AMAS3_EPS1_ELFLR0_GLVWA1_GLS1_MIAV0_ONLL1_PGR2_SU4_SUS256_SSO4_SVW2_VW2_WGM32
    SolutionIndex: 152
    SolutionNameMin: Cijk_Alik_Bljk_SB_MT32x128x16_MI16x16x4x1_SN_AMAS3_EPS1_ELFLR4_GLVWA1_GLS1_MIAV1_ONLL2_PGR1_SU4_SUS256_SSO0_SVW2_VW2_WGM32
    SolutionIndex: 153
    SolutionNameMin: Cijk_Alik_Bljk_SB_MT32x128x16_MI16x16x4x1_SN_AMAS0_EPS0_ELFLR4_GLVWA2_GLS1_MIAV1_ONLL1_PGR2_SU4_SUS128_SSO4_SVW1_VW1_WGM32
    SolutionIndex: 154
    SolutionNameMin: Cijk_Alik_Bljk_SB_MT64x128x16_MI16x16x4x1_SN_AMAS0_ELFLR0_GLVWA4_GLVWB4_GLS0_LBSPPA128_LPA4_LPB4_LRVW1_ONLL1_SU4_SUS256_SPO0_SVW1_TT2_64_VW1_WG32_8_1_WGM16
    SolutionIndex: 155
    SolutionNameMin: Cijk_Alik_Bljk_SB_MT64x128x16_MI16x16x4x1_SN_AMAS0_ELFLR0_GLVWA4_GLVWB4_GLS1_LBSPPA128_LPA4_LPB4_LRVW1_ONLL1_SU4_SUS256_SPO0_SVW1_TT4_32_VW1_WG16_16_1_WGM32
    SolutionIndex: 156
    SolutionNameMin: Cijk_Alik_Bljk_SB_MT64x128x16_MI16x16x4x1_SN_AMAS3_ELFLR0_GLVWA2_GLVWB4_GLS1_LBSPPA128_LPA2_LPB4_LRVW1_ONLL1_SU4_SUS256_SPO0_SVW2_TT2_64_VW2_WG32_8_1_WGM32
    SolutionIndex: 157
    SolutionNameMin: Cijk_Alik_Bljk_SB_MT64x128x16_MI16x16x4x1_SN_AMAS3_ELFLR0_GLVWA2_GLVWB4_GLS1_LBSPPA256_LPA2_LPB4_LRVW1_ONLL0_SU0_SUS0_SPO1_SVW4_TT4_32_VW4_WG16_16_1_WGM16
    SolutionIndex: 158
    SolutionNameMin: Cijk_Alik_Bljk_SB_MT64x128x16_MI16x16x4x1_SN_AMAS3_ELFLR0_GLVWA2_GLVWB1_GLS1_LBSPPA256_LPA2_LPB2_LRVW1_ONLL0_SU0_SUS0_SPO1_SVW4_TT4_32_VW4_WG16_16_1_WGM32
    SolutionIndex: 159
    SolutionNameMin: Cijk_Alik_Bljk_SB_MT128x128x16_MI16x16x4x1_SN_AMAS3_ELFLR4_GLVWA2_GLVWB1_GLS1_LBSPPA256_LPA2_LPB2_LRVW1_ONLL0_SU0_SUS0_SPO1_SVW4_TT8_32_VW4_WG16_16_1_WGM32
    SolutionIndex: 160
    SolutionNameMin: Cijk_Alik_Bljk_SB_MT64x32x64_MI16x16x4x1_SN_1LDSB0_AMAS0_EPS1_ELFLR0_GLVWA2_GLVWB2_GLS0_LBSPPA256_LBSPPB256_LPA2_LPB2_MIAV0_ONLL0_PLR1_SVW1_TT1_32_VW1_WG64_4_1_WGM1
    SolutionIndex: 161
    SolutionNameMin: Cijk_Alik_Bljk_SB_MT64x32x64_MI16x16x4x1_SN_1LDSB0_AMAS0_EPS1_ELFLR0_GLVWA2_GLVWB2_GLS0_LBSPPA256_LBSPPB256_LPA2_LPB2_MIAV0_ONLL1_PLR1_SVW1_TT2_16_VW1_WG32_8_1_WGM1
    SolutionIndex: 162
    SolutionNameMin: Cijk_Alik_Bljk_SB_MT64x32x32_MI16x16x4x1_SN_1LDSB0_AMAS0_EPS1_ELFLR4_GLVWA4_GLVWB4_GLS0_LBSPPA128_LBSPPB128_LPA4_LPB4_MIAV0_ONLL1_PLR1_SVW1_TT2_16_VW1_WG32_8_1_WGM16
    SolutionIndex: 163
    SolutionNameMin: Cijk_Alik_Bljk_SB_MT64x32x32_MI16x16x4x1_SN_1LDSB1_AMAS0_EPS1_ELFLR4_GLVWA4_GLVWB4_GLS0_LBSPPA128_LBSPPB128_LPA4_LPB4_MIAV1_ONLL0_PLR9_SVW1_TT2_16_VW1_WG32_8_1_WGM32
    SolutionIndex: 164
    SolutionNameMin: Cijk_Alik_Bljk_SB_MT64x64x32_MI16x16x4x1_SN_1LDSB1_AMAS3_EPS0_ELFLR0_GLVWA4_GLVWB4_GLS0_LBSPPA512_LBSPPB128_LPA4_LPB4_MIAV0_ONLL0_PLR9_SVW4_TT4_16_VW4_WG16_16_1_WGM16
    SolutionIndex: 165
    SolutionNameMin: Cijk_Alik_Bljk_SB_MT64x64x32_MI16x16x4x1_SN_1LDSB1_AMAS3_EPS0_ELFLR4_GLVWA4_GLVWB4_GLS0_LBSPPA512_LBSPPB128_LPA4_LPB4_MIAV1_ONLL1_PLR9_SVW4_TT4_16_VW4_WG16_16_1_WGM16
    SolutionIndex: 166
    SolutionNameMin: Cijk_Alik_Bljk_SB_MT128x64x32_MI16x16x4x1_SN_1LDSB1_AMAS3_EPS1_ELFLR0_GLVWA4_GLVWB4_GLS0_LBSPPA512_LBSPPB128_LPA4_LPB4_MIAV1_ONLL0_PLR9_SVW4_TT4_32_VW4_WG32_8_1_WGM16
    SolutionIndex: 167
    SolutionNameMin: Cijk_Alik_Bljk_SB_MT32x32x64_MI16x16x4x1_SN_1LDSB0_AMAS3_ELFLR4_GLVWA4_GLVWB4_GLS0_LBSPPA512_LBSPPB256_LPA4_LPB4_MIAV0_ONLL0_PLR9_SU4_SUS256_SVW2_TT2_16_VW2_WG16_8_2_WGM16
    SolutionIndex: 168
    SolutionNameMin: Cijk_Alik_Bljk_SB_MT64x32x64_MI16x16x4x1_SN_1LDSB0_AMAS0_ELFLR0_GLVWA2_GLVWB2_GLS0_LBSPPA256_LBSPPB256_LPA2_LPB2_MIAV1_ONLL1_PLR1_SU0_SUS0_SVW1_TT2_16_VW1_WG32_8_1_WGM16
    SolutionIndex: 169
    SolutionNameMin: Cijk_Alik_Bljk_SB_MT64x64x32_MI16x16x4x1_SN_1LDSB1_AMAS0_ELFLR0_GLVWA4_GLVWB4_GLS0_LBSPPA128_LBSPPB128_LPA4_LPB4_MIAV0_ONLL0_PLR9_SU0_SUS0_SVW1_TT2_32_VW1_WG32_8_1_WGM32
    SolutionIndex: 170
    SolutionNameMin: Cijk_Alik_Bljk_SB_MT64x32x32_MI16x16x4x1_SN_1LDSB0_AMAS0_ELFLR4_GLVWA4_GLVWB2_GLS1_LBSPPA128_LBSPPB128_LPA4_LPB2_MIAV1_ONLL0_PLR9_SU0_SUS0_SVW1_TT1_32_VW1_WG64_4_1_WGM32
    SolutionIndex: 171
    SolutionNameMin: Cijk_Alik_Bljk_SB_MT64x64x32_MI16x16x4x1_SN_1LDSB1_AMAS3_ELFLR0_GLVWA4_GLVWB4_GLS0_LBSPPA256_LBSPPB128_LPA4_LPB4_MIAV1_ONLL0_PLR9_SU0_SUS0_SVW2_TT2_32_VW2_WG32_8_1_WGM16
    SolutionIndex: 172
    SolutionNameMin: Cijk_Alik_Bljk_SB_MT64x64x32_MI16x16x4x1_SN_1LDSB1_AMAS3_ELFLR4_GLVWA4_GLVWB4_GLS1_LBSPPA256_LBSPPB128_LPA4_LPB4_MIAV1_ONLL1_PLR9_SU0_SUS0_SVW2_TT2_32_VW2_WG32_8_1_WGM32
    SolutionIndex: 173
    SolutionNameMin: Cijk_Alik_Bljk_SB_MT128x64x32_MI16x16x4x1_SN_1LDSB1_AMAS3_ELFLR4_GLVWA4_GLVWB4_GLS0_LBSPPA256_LBSPPB128_LPA4_LPB4_MIAV1_ONLL1_PLR9_SU0_SUS0_SVW2_TT4_32_VW2_WG32_8_1_WGM32
    SolutionIndex: 174
    SolutionNameMin: Cijk_Alik_Bljk_SB_MT64x16x64_MI16x16x4x1_SN_1LDSB0_EPS0_ELFLR0_GLVWA4_GLVWB4_LBSPPA256_LBSPPB256_LPA4_LPB4_MIAV1_NEPBS2_PLR1_SS0_SU8_SUS256_SVW4_TT1_16_WG64_4_1_WGM1
    SolutionIndex: 175
    SolutionNameMin: Cijk_Alik_Bljk_SB_MT64x16x64_MI16x16x4x1_SN_1LDSB0_EPS1_ELFLR8_GLVWA4_GLVWB4_LBSPPA256_LBSPPB256_LPA4_LPB4_MIAV1_NEPBS2_PLR1_SS0_SU0_SUS0_SVW4_TT1_16_WG64_4_1_WGM1
    SolutionIndex: 176
    SolutionNameMin: Cijk_Alik_Bljk_SB_MT64x16x64_MI16x16x4x1_SN_1LDSB0_EPS1_ELFLR0_GLVWA4_GLVWB4_LBSPPA256_LBSPPB256_LPA4_LPB4_MIAV1_NEPBS2_PLR1_SS0_SU8_SUS256_SVW4_TT1_16_WG64_4_1_WGM1
    SolutionIndex: 177
    SolutionNameMin: Cijk_Alik_Bljk_SB_MT64x32x64_MI16x16x4x1_SN_1LDSB0_EPS1_ELFLR0_GLVWA2_GLVWB4_LBSPPA256_LBSPPB256_LPA2_LPB4_MIAV1_NEPBS2_PLR1_SS1_SU8_SUS256_SVW1_TT1_32_WG64_4_1_WGM1
    SolutionIndex: 178
    SolutionNameMin: Cijk_Alik_Bljk_SB_MT64x64x32_MI16x16x4x1_SN_1LDSB1_EPS1_ELFLR0_GLVWA4_GLVWB4_LBSPPA128_LBSPPB128_LPA4_LPB4_MIAV0_NEPBS2_PLR9_SS0_SU8_SUS256_SVW4_TT2_32_WG32_8_1_WGM1
    SolutionIndex: 179
    SolutionNameMin: Cijk_Alik_Bljk_SB_MT128x64x32_MI16x16x4x1_SN_AMAS0_EPS0_ELFLR0_GLVWA4_GLS0_LBSPPA128_LPA8_LPB8_LRVW4_MIAV1_NEPBS2_SS0_SU8_SUS256_SVW4_TT4_32_VW1_WG32_8_1_WGMn32
    SolutionIndex: 180
    SolutionNameMin: Cijk_Alik_Bljk_SB_MT64x64x32_MI16x16x4x1_SN_AMAS3_EPS0_ELFLR0_GLVWA4_GLS0_LBSPPA256_LPA8_LPB8_LRVW4_MIAV1_NEPBS0_SS1_SU0_SUS0_SVW2_TT4_16_VW2_WG16_16_1_WGMn32
    SolutionIndex: 181
    SolutionNameMin: Cijk_Alik_Bljk_SB_MT128x64x32_MI16x16x4x1_SN_AMAS3_EPS1_ELFLR8_GLVWA4_GLS0_LBSPPA256_LPA8_LPB8_LRVW4_MIAV0_NEPBS2_SS1_SU8_SUS256_SVW2_TT4_32_VW2_WG32_8_1_WGM1
    SolutionIndex: 182
    SolutionNameMin: Cijk_Alik_Bljk_SB_MT128x256x32_MI16x16x4x1_SN_1LDSB1_AMAS3_EPS0_ELFLR8_LBSPPA512_LBSPPB128_LPA4_LPB4_MIAV0_NEPBS0_PLR1_SVW4_TT8_64_VW4_WG16_16_1_WGMn16
    SolutionIndex: 183
    SolutionNameMin: Cijk_Alik_Bljk_SB_MT128x256x16_MI16x16x4x1_SN_1LDSB1_AMAS3_EPS0_ELFLR0_LBSPPA256_LBSPPB128_LPA4_LPB4_MIAV0_NEPBS2_PLR1_SVW4_TT8_64_VW4_WG16_16_1_WGMn32
    SolutionIndex: 184
    SolutionNameMin: Cijk_Alik_Bljk_SB_MT128x256x16_MI16x16x4x1_SN_1LDSB1_AMAS3_EPS1_ELFLR0_LBSPPA256_LBSPPB128_LPA4_LPB4_MIAV1_NEPBS2_PLR1_SVW4_TT8_64_VW4_WG16_16_1_WGM1
    SolutionIndex: 185
    SolutionNameMin: Cijk_Alik_Bljk_SB_MT128x128x16_MI16x16x4x1_SN_1LDSB1_AMAS3_EPS1_ELFLR0_LBSPPA256_LBSPPB128_LPA4_LPB4_MIAV1_NEPBS2_PLR1_SVW4_TT8_32_VW4_WG16_16_1_WGM1
    SolutionIndex: 186
    SolutionNameMin: Cijk_Alik_Bljk_SB_MT128x128x16_MI16x16x4x1_SN_1LDSB1_AMAS3_EPS1_ELFLR0_LBSPPA256_LBSPPB128_LPA4_LPB4_MIAV1_NEPBS2_PLR1_SVW4_TT4_64_VW4_WG32_8_1_WGM1
    SolutionIndex: 187
    SolutionNameMin: Cijk_Alik_Bljk_SB_MT128x128x16_MI16x16x4x1_SN_1LDSB1_AMAS3_EPS0_ELFLR0_LBSPPA256_LBSPPB128_LPA4_LPB4_MIAV0_NEPBS2_PLR5_SVW4_TT4_64_VW4_WG32_8_1_WGM1
    SolutionIndex: 188
    SolutionNameMin: Cijk_Alik_Bljk_SB_MT32x32x64_MI16x16x4x1_SN_1LDSB0_AMAS0_EPS1_GLVWA2_LBSPPA256_LBSPPB256_LPA2_LPB4_MIAV0_NEPBS4_PGR2_PLR1_SU0_SUS0_SVW1_TT1_16_VW1_WG32_8_1_WGM1
    SolutionIndex: 189
    SolutionNameMin: Cijk_Alik_Bljk_SB_MT32x32x64_MI16x16x4x1_SN_1LDSB0_AMAS3_EPS0_GLVWA2_LBSPPA512_LBSPPB256_LPA2_LPB4_MIAV1_NEPBS2_PGR2_PLR9_SVW2_TT2_16_VW2_WG16_8_2_WGM1
    SolutionIndex: 190
    SolutionNameMin: Cijk_Alik_Bljk_SB_MT64x32x64_MI16x16x4x1_SN_1LDSB0_AMAS3_EPS1_GLVWA2_LBSPPA512_LBSPPB256_LPA2_LPB4_MIAV0_NEPBS4_PGR2_PLR1_SU0_SUS0_SVW2_TT2_16_VW2_WG32_8_1_WGM1
    SolutionIndex: 191
    SolutionNameMin: Cijk_Alik_Bljk_SB_MT64x64x32_MI16x16x4x1_SN_1LDSB1_AMAS3_EPS1_GLVWA4_LBSPPA256_LBSPPB128_LPA4_LPB4_MIAV0_NEPBS4_PGR2_PLR9_SU8_SUS128_SVW2_TT2_32_VW2_WG32_8_1_WGM16
    SolutionIndex: 192
    SolutionNameMin: Cijk_Alik_Bljk_SB_MT64x128x32_MI16x16x4x1_SN_1LDSB1_AMAS3_EPS0_GLVWA4_LBSPPA512_LBSPPB128_LPA4_LPB4_MIAV0_NEPBS2_PGR2_PLR9_SU0_SUS0_SVW4_TT4_32_VW4_WG16_16_1_WGM32
    SolutionIndex: 193
    SolutionNameMin: Cijk_Alik_Bljk_SB_MT64x64x32_MI16x16x4x1_SN_1LDSB1_AMAS3_EPS0_GLVWA4_LBSPPA256_LBSPPB128_LPA4_LPB4_MIAV0_NEPBS4_PGR2_PLR9_SU0_SUS0_SVW2_TT2_32_VW2_WG32_8_1_WGM16
    SolutionIndex: 194
    SolutionNameMin: Cijk_Alik_Bljk_SB_MT64x128x32_MI16x16x4x1_SN_1LDSB1_AMAS3_EPS1_GLVWA4_LBSPPA512_LBSPPB128_LPA4_LPB4_MIAV1_NEPBS2_PGR2_PLR9_SU0_SUS0_SVW4_TT4_32_VW4_WG16_16_1_WGM16
    SolutionIndex: 195
    SolutionNameMin: Cijk_Alik_Bljk_SB_MT32x32x128_MI16x16x4x1_SN_1LDSB1_AMAS0_EPS0_GLVWA4_GLVWB4_LBSPPA512_LBSPPB512_LPA4_LPB4_MIAV0_PLR17_SU0_SUS0_SVW1_TT1_32_VW1_WG32_4_2_WGM1
    SolutionIndex: 196
    SolutionNameMin: Cijk_Alik_Bljk_SB_MT32x32x64_MI16x16x4x1_SN_1LDSB0_AMAS0_EPS0_GLVWA4_GLVWB4_LBSPPA256_LBSPPB256_LPA4_LPB4_MIAV0_PLR9_SU4_SUS256_SVW1_TT2_16_VW1_WG16_8_2_WGM1
    SolutionIndex: 197
    SolutionNameMin: Cijk_Alik_Bljk_SB_MT64x32x64_MI16x16x4x1_SN_1LDSB0_AMAS3_EPS1_GLVWA4_GLVWB2_LBSPPA512_LBSPPB256_LPA4_LPB2_MIAV0_PLR17_SU4_SUS256_SVW2_TT2_16_VW2_WG32_8_1_WGM1
    SolutionIndex: 198
    SolutionNameMin: Cijk_Alik_Bljk_SB_MT128x64x32_MI16x16x4x1_SN_1LDSB1_AMAS3_EPS0_GLVWA4_GLVWB4_LBSPPA256_LBSPPB128_LPA4_LPB4_MIAV0_PLR9_SU0_SUS0_SVW2_TT2_64_VW2_WG64_4_1_WGM8
    SolutionIndex: 199
    SolutionNameMin: Cijk_Alik_Bljk_SB_MT64x128x16_MI16x16x4x1_SN_1LDSB1_GLVWA4_GLVWB4_LBSPPA256_LPA4_LPB4_MIAV1_PLR5_SU0_SUS0_SSO2_SVW4_TT4_32_VW4_WG16_16_1_WGM16
    SolutionIndex: 200
    SolutionNameMin: Cijk_Alik_Bljk_SB_MT64x64x16_MI16x16x4x1_SN_1LDSB1_GLVWA4_GLVWB4_LBSPPA256_LPA4_LPB4_MIAV1_PLR5_SU4_SUS128_SSO1_SVW4_TT4_16_VW4_WG16_16_1_WGM32
    SolutionIndex: 201
    SolutionNameMin: Cijk_Alik_Bljk_SB_MT64x64x16_MI16x16x4x1_SN_1LDSB1_GLVWA4_GLVWB4_LBSPPA256_LPA4_LPB4_MIAV1_PLR5_SU4_SUS128_SSO2_SVW4_TT4_16_VW4_WG16_16_1_WGM16
    SolutionIndex: 202
    SolutionNameMin: Cijk_Alik_Bljk_SB_MT64x64x16_MI16x16x4x1_SN_1LDSB1_GLVWA4_GLVWB4_LBSPPA256_LPA4_LPB4_MIAV1_PLR5_SU4_SUS128_SSO0_SVW4_TT4_16_VW4_WG16_16_1_WGM16
    SolutionIndex: 203
    SolutionNameMin: Cijk_Alik_Bljk_SB_MT16x32x32_MI16x16x4x1_SN_1LDSB1_GLVWA4_GLVWB4_LPA8_LPB8_LRVW4_NTA0_PLR9_SPO1_SSO0_WG16_8_1
    SolutionIndex: 204
    SolutionNameMin: Cijk_Alik_Bljk_SB_MT16x32x32_MI16x16x4x1_SN_1LDSB1_GLVWA4_GLVWB4_LPA4_LPB4_LRVW2_NTA0_PLR9_SPO0_SSO0_WG16_8_1
    SolutionIndex: 205
    SolutionNameMin: Cijk_Alik_Bljk_SB_MT16x32x128_MI16x16x4x1_SN_1LDSB0_GLVWA1_GLVWB2_LBSPPA512_LBSPPB512_LPA2_LPB2_LRVW1_NLCA1_NLCB1_PLR9_SPO1_SSO0_TT1_16_WG16_8_4
    SolutionIndex: 206
    SolutionNameMin: Cijk_Alik_Bljk_SB_MT16x32x128_MI16x16x4x1_SN_1LDSB0_GLVWA1_GLVWB2_LBSPPA512_LBSPPB512_LPA2_LPB2_LRVW1_NLCA1_NLCB1_PLR1_SPO1_SSO0_TT1_16_WG16_8_4
    SolutionIndex: 207
    SolutionNameMin: Cijk_Alik_Bljk_SB_MT16x16x128_MI16x16x4x1_SN_1LDSB0_GLVWA4_GLVWB4_LBSPPA512_LBSPPB512_LPA4_LPB4_LRVW1_NTB0_NLCA1_NLCB1_PLR9_TT1_16_WG16_4_4
    SolutionIndex: 208
    SolutionNameMin: Cijk_Alik_Bljk_SB_MT16x16x128_MI16x16x4x1_SN_1LDSB0_GLVWA4_GLVWB4_LBSPPA512_LBSPPB512_LPA8_LPB8_LRVW4_NTB0_NLCA1_NLCB1_PLR9_TT1_16_WG16_4_4
    SolutionIndex: 209
    SolutionNameMin: Cijk_Alik_Bljk_SB_MT16x16x128_MI16x16x4x1_SN_1LDSB1_GLVWA4_GLVWB4_LBSPPA512_LBSPPB512_LPA8_LPB8_LRVW4_NTB4_NLCA1_NLCB1_PLR9_TT1_16_WG16_4_4
    SolutionIndex: 210
    SolutionNameMin: Cijk_Alik_Bljk_SB_MT64x64x32_MI16x16x4x1_SN_1LDSB0_AMAS0_GLVWA1_GLVWB1_LBSPPA128_LPA2_LPB2_LRVW2_PLR9_SU0_SUS0_SVW1_TT2_32_VW1_WG32_8_1_WGM1
    SolutionIndex: 211
    SolutionNameMin: Cijk_Alik_Bljk_SB_MT64x64x32_MI16x16x4x1_SN_1LDSB1_AMAS3_GLVWA1_GLVWB1_LBSPPA256_LPA8_LPB8_LRVW4_PLR9_SU0_SUS0_SVW2_TT4_16_VW2_WG16_16_1_WGM1
    SolutionIndex: 212
    SolutionNameMin: Cijk_Alik_Bljk_SB_MT128x64x16_MI16x16x4x1_SN_1LDSB0_AMAS3_GLVWA4_GLVWB1_LBSPPA256_LPA4_LPB2_LRVW2_PLR5_SU4_SUS256_SVW4_TT4_32_VW4_WG32_8_1_WGM16
    SolutionIndex: 213
    SolutionNameMin: Cijk_Alik_Bljk_SB_MT64x64x32_MI16x16x4x1_SN_1LDSB1_AMAS3_GLVWA4_GLVWB4_LBSPPA256_LBSPPB128_LPA4_LPB4_LRVW1_PLR9_SU4_SUS256_SVW2_TT2_32_VW2_WGM8
    SolutionIndex: 214
    SolutionNameMin: Cijk_Alik_Bljk_SB_MT64x64x32_MI16x16x4x1_SN_AMAS3_GLVWA4_LBSPPA256_LPA8_LPB8_LRVW4_MIAV0_PLR9_SSO0_SVW2_VW2_WGM8
    SolutionIndex: 215
    SolutionNameMin: Cijk_Alik_Bljk_SB_MT64x128x32_MI16x16x4x1_SN_1LDSB1_AMAS3_GLVWA1_GLVWB4_LBSPPA256_LBSPPB128_LPA8_LPB8_LRVW4_PLR9_SU4_SUS256_SVW2_TT2_64_VW2_WGM1
    SolutionIndex: 216
    SolutionNameMin: Cijk_Alik_Bljk_SB_MT64x64x32_MI16x16x4x1_SN_1LDSB1_AMAS3_GLVWA2_GLVWB4_LBSPPA256_LBSPPB128_LPA8_LPB8_LRVW4_PLR9_SU4_SUS256_SVW2_TT2_32_VW2_WGM1
    SolutionIndex: 217
    SolutionNameMin: Cijk_Alik_Bljk_SB_MT192x128x32_MI16x16x4x1_SN_AMAS0_GLVWA4_GLVWB4_LBSPPA128_LPA8_LPB8_LRVW4_MIAV0_PLR9_SU4_SUS256_SVW1_TT3_128_VW1_WG64_4_1_WGM1
    SolutionIndex: 218
    SolutionNameMin: Cijk_Alik_Bljk_SB_MT128x64x32_MI16x16x4x1_SN_AMAS3_LBSPPA512_LPA8_LPB8_LRVW4_MIAV1_PLR9_SVW4_TT4_32_VW4_WG32_8_1_WGM1
    SolutionIndex: 219
    SolutionNameMin: Cijk_Alik_Bljk_SB_MT256x128x16_MI16x16x4x1_SN_AMAS3_GLVWA4_GLVWB4_LBSPPA256_LPA4_LPB4_LRVW1_MIAV1_PLR1_SU0_SUS0_SVW4_TT4_128_VW4_WG64_4_1_WGM32
    SolutionIndex: 220
    SolutionNameMin: Cijk_Alik_Bljk_SB_MT16x16x64_MI16x16x4x1_SN_EPS1_ELFLR0_GLS0_LBSPPA256_LBSPPB256_LPA4_LPB4_MIAV0_NEPBS0_ONLL0_PLR1_SU0_SUS0_SPO1_SSO4_TT1_16_WG16_4_4_WGMn32
    SolutionIndex: 221
    SolutionNameMin: Cijk_Alik_Bljk_SB_MT16x32x128_MI16x16x4x1_SN_EPS1_ELFLR8_GLS1_LBSPPA512_LBSPPB512_LPA4_LPB4_MIAV1_NEPBS0_ONLL1_PLR9_SU0_SUS0_SPO0_SSO0_TT1_32_WG16_4_4_WGM32
    SolutionIndex: 222
    SolutionNameMin: Cijk_Alik_Bljk_SB_MT16x32x128_MI16x16x4x1_SN_EPS1_ELFLR0_GLS1_LBSPPA512_LBSPPB512_LPA4_LPB4_MIAV1_NEPBS4_ONLL0_PLR1_SU0_SUS0_SPO0_SSO0_TT1_32_WG16_4_4_WGMn16
    SolutionIndex: 223
    SolutionNameMin: Cijk_Alik_Bljk_SB_MT32x32x64_MI16x16x4x1_SN_EPS1_ELFLR8_GLS0_LBSPPA256_LBSPPB256_LPA4_LPB4_MIAV1_NEPBS4_ONLL0_PLR9_SU0_SUS0_SPO0_SSO0_TT1_32_WG32_4_2_WGM32
    SolutionIndex: 224
    SolutionNameMin: Cijk_Alik_Bljk_SB_MT32x32x64_MI16x16x4x1_SN_EPS1_ELFLR8_GLS0_LBSPPA256_LBSPPB256_LPA4_LPB4_MIAV0_NEPBS4_ONLL0_PLR9_SU8_SUS256_SPO1_SSO0_TT1_32_WG32_4_2_WGM32
    SolutionIndex: 225
    SolutionNameMin: Cijk_Alik_Bljk_SB_MT32x32x64_MI16x16x4x1_SN_EPS1_ELFLR0_GLS0_LBSPPA256_LBSPPB256_LPA4_LPB4_MIAV0_NEPBS4_ONLL1_PLR9_SU8_SUS256_SPO0_SSO0_TT1_32_WG32_4_2_WGM32
    SolutionIndex: 226
    SolutionNameMin: Cijk_Alik_Bljk_SB_MT64x32x64_MI16x16x4x1_SN_1LDSB0_EPS1_ELFLR8_GLVWA4_GLVWB4_LBSPPA256_LBSPPB256_LPA4_LPB4_MIAV0_NEPBS0_PLR17_SU0_SUS0_SPO1_SSO0_TT2_16_WG32_8_1_WGM32
    SolutionIndex: 227
    SolutionNameMin: Cijk_Alik_Bljk_SB_MT64x64x64_MI16x16x4x1_SN_1LDSB1_EPS1_ELFLR0_GLVWA2_GLVWB4_LBSPPA256_LBSPPB256_LPA2_LPB4_MIAV1_NEPBS0_PLR17_SU8_SUS256_SPO0_SSO0_TT4_16_WG16_16_1_WGM16
    SolutionIndex: 228
    SolutionNameMin: Cijk_Alik_Bljk_SB_MT64x64x32_MI16x16x4x1_SN_1LDSB1_EPS0_ELFLR8_GLVWA4_GLVWB4_LBSPPA128_LBSPPB128_LPA4_LPB4_MIAV0_NEPBS0_PLR9_SU8_SUS128_SPO0_SSO4_TT4_16_WG16_16_1_WGM32
    SolutionIndex: 229
    SolutionNameMin: Cijk_Alik_Bljk_SB_MT64x64x32_MI16x16x4x1_SN_1LDSB0_EPS1_ELFLR0_GLVWA2_GLVWB2_LBSPPA128_LBSPPB128_LPA2_LPB2_MIAV1_NEPBS0_PLR9_SU8_SUS128_SPO0_SSO4_TT4_16_WG16_16_1_WGM16
    SolutionIndex: 230
    SolutionNameMin: Cijk_Alik_Bljk_SB_MT64x64x32_MI16x16x4x1_SN_1LDSB1_EPS0_ELFLR0_GLVWA4_GLVWB4_LBSPPA128_LBSPPB128_LPA4_LPB4_MIAV1_NEPBS0_PLR9_SU8_SUS256_SPO1_SSO0_TT4_16_WG16_16_1_WGM32
    SolutionIndex: 231
    SolutionNameMin: Cijk_Alik_Bljk_SB_MT64x96x32_MI16x16x4x1_SN_1LDSB1_EPS1_ELFLR8_GLVWA2_GLVWB4_LBSPPA128_LBSPPB128_LPA2_LPB4_MIAV1_PLR9_SU8_SUS256_SPO0_SSO0_TT2_48_WG32_8_1_WGM16
    SolutionIndex: 232
    SolutionNameMin: Cijk_Alik_Bljk_SB_MT64x96x32_MI16x16x4x1_SN_1LDSB1_EPS0_ELFLR8_GLVWA4_GLVWB4_LBSPPA128_LBSPPB128_LPA4_LPB4_MIAV0_PLR9_SU4_SUS128_SPO0_SSO4_TT2_48_WG32_8_1_WGM16
    SolutionIndex: 233
    SolutionNameMin: Cijk_Alik_Bljk_SB_MT64x64x32_MI16x16x4x1_SN_ELFLR8_GLVWA4_GLS1_LPA4_ONLL0_PGR1_SU8_SUS256_WSGRA0_WGM16
    SolutionIndex: 234
    SolutionNameMin: Cijk_Alik_Bljk_SB_MT64x64x32_MI16x16x4x1_SN_ELFLR0_GLVWA4_GLS1_LPA4_ONLL1_PGR1_SU0_SUS0_WSGRA1_WGM32
    SolutionIndex: 235
    SolutionNameMin: Cijk_Alik_Bljk_SB_MT64x64x32_MI16x16x4x1_SN_ELFLR8_GLVWA4_GLS0_LPA4_ONLL1_PGR1_SU0_SUS0_WSGRA0_WGM32
    SolutionIndex: 236
    SolutionNameMin: Cijk_Alik_Bljk_SB_MT64x64x32_MI16x16x4x1_SN_ELFLR8_GLVWA4_GLS0_LPA4_ONLL1_PGR1_SU4_SUS256_WSGRA0_WGM16
    SolutionIndex: 237
    SolutionNameMin: Cijk_Alik_Bljk_SB_MT64x64x32_MI16x16x4x1_SN_ELFLR8_GLVWA4_GLS0_LPA4_ONLL1_PGR2_SU4_SUS128_WSGRA0_WGM32
    SolutionIndex: 238
    SolutionNameMin: Cijk_Alik_Bljk_SB_MT64x64x32_MI16x16x4x1_SN_ELFLR8_GLVWA4_GLS1_LPA4_ONLL1_PGR2_SU0_SUS0_WSGRA1_WGM16
- - - [6144, 4864, 1, 512]
    - [0, 91.517]
  - - [4864, 3072, 1, 4096]
    - [1, 97.616]
  - - [7296, 4608, 1, 4096]
    - [2, 98.076]
  - - [9728, 6144, 1, 4096]
    - [3, 98.629]
  - - [16384, 16384, 1, 4096]
    - [4, 98.811]
  - - [19456, 18432, 1, 512]
    - [5, 95.586]
  - - [4094, 4094, 1, 2046]
    - [6, 93.773]
  - - [4096, 4096, 1, 2048]
    - [7, 96.249]
  - - [1031, 1031, 1, 1031]
    - [14, 43.762]
  - - [2047, 2047, 1, 2047]
    - [9, 72.991]
  - - [4095, 4095, 1, 2047]
    - [8, 87.798]
  - - [1030, 1030, 1, 1030]
    - [10, 49.297]
  - - [1032, 1032, 1, 1032]
    - [11, 48.448]
  - - [2046, 2046, 1, 2046]
    - [12, 82.284]
  - - [2048, 2048, 1, 2048]
    - [13, 87.964]
  - - [64, 1, 1000, 64]
    - [15, 0.563]
  - - [1, 64, 1000, 64]
    - [16, 0.553]
  - - [31, 31, 1000, 31]
    - [17, 4.234]
  - - [33, 33, 1000, 33]
    - [18, 3.928]
  - - [47, 47, 1000, 47]
    - [19, 8.473]
  - - [49, 49, 1000, 49]
    - [20, 9.39]
  - - [63, 63, 128, 63]
    - [21, 5.66]
  - - [65, 65, 128, 65]
    - [22, 5.078]
  - - [79, 79, 128, 79]
    - [23, 7.845]
  - - [81, 81, 128, 81]
    - [24, 8.003]
  - - [95, 95, 64, 95]
    - [25, 8.235]
  - - [97, 97, 64, 97]
    - [26, 8.005]
  - - [127, 127, 64, 127]
    - [27, 14.748]
  - - [129, 129, 64, 129]
    - [28, 13.355]
  - - [255, 255, 16, 255]
    - [29, 23.422]
  - - [257, 257, 16, 257]
    - [30, 22.283]
  - - [511, 511, 16, 511]
    - [20, 59.256]
  - - [513, 513, 16, 513]
    - [31, 52.642]
  - - [30, 30, 1000, 30]
    - [32, 4.49]
  - - [32, 32, 1000, 32]
    - [33, 5.778]
  - - [34, 34, 1000, 34]
    - [34, 4.633]
  - - [46, 46, 1000, 46]
    - [35, 8.68]
  - - [48, 48, 1000, 48]
    - [36, 10.994]
  - - [50, 50, 1000, 50]
    - [37, 10.108]
  - - [62, 62, 128, 62]
    - [38, 5.723]
  - - [64, 64, 128, 64]
    - [39, 6.814]
  - - [66, 66, 128, 66]
    - [40, 5.591]
  - - [78, 78, 128, 78]
    - [41, 8.27]
  - - [80, 80, 128, 80]
    - [42, 9.444]
  - - [82, 82, 128, 82]
    - [41, 9.26]
  - - [94, 94, 64, 94]
    - [43, 8.793]
  - - [96, 96, 64, 96]
    - [44, 9.927]
  - - [98, 98, 64, 98]
    - [45, 9.063]
  - - [126, 126, 64, 126]
    - [46, 15.883]
  - - [128, 128, 64, 128]
    - [47, 17.686]
  - - [130, 130, 64, 130]
    - [48, 14.64]
  - - [254, 254, 16, 254]
    - [32, 22.565]
  - - [256, 256, 16, 256]
    - [49, 27.53]
  - - [258, 258, 16, 258]
    - [50, 21.03]
  - - [510, 510, 16, 510]
    - [51, 61.838]
  - - [512, 512, 16, 512]
    - [52, 67.078]
  - - [514, 514, 16, 514]
    - [53, 55.847]
  - - [4864, 6144, 1, 2048]
    - [54, 95.77]
  - - [4864, 6144, 1, 4096]
    - [55, 95.93]
  - - [4864, 6144, 1, 6144]
    - [56, 97.8]
  - - [4864, 6144, 1, 8192]
    - [57, 97.71]
  - - [6144, 4864, 1, 2048]
    - [58, 95.73]
  - - [6144, 4864, 1, 4096]
    - [59, 97.89]
  - - [6144, 4864, 1, 6144]
    - [60, 98.52]
  - - [6144, 4864, 1, 8192]
    - [61, 98.13]
  - - [256, 4864, 1, 1024]
    - [62, 67.06]
  - - [256, 4864, 1, 2048]
    - [63, 80.47]
  - - [1216, 1024, 1, 1024]
    - [70, 64.6]
  - - [1216, 1024, 1, 2048]
    - [71, 80.04]
  - - [1216, 4096, 1, 4096]
    - [64, 91.7]
  - - [2432, 512, 1, 1024]
    - [72, 70.95]
  - - [4864, 512, 1, 1024]
    - [73, 77.25]
  - - [512, 608, 1, 512]
    - [65, 29.7]
  - - [512, 608, 1, 1024]
    - [66, 37.81]
  - - [608, 512, 1, 512]
    - [67, 30.03]
  - - [608, 512, 1, 1024]
    - [68, 38.31]
  - - [1216, 256, 1, 512]
    - [69, 29.34]
  - - [32, 32, 1, 512]
    - [74, 0.13]
  - - [64, 64, 1, 512]
    - [75, 0.42]
  - - [64, 64, 1, 1024]
    - [76, 0.79]
  - - [128, 128, 1, 512]
    - [77, 1.97]
  - - [128, 128, 1, 1024]
    - [78, 3.18]
  - - [2432, 2048, 1, 1024]
    - [79, 78.54]
  - - [2432, 2048, 1, 2048]
    - [80, 86.26]
  - - [2048, 2432, 1, 1024]
    - [81, 82.03]
  - - [2048, 2432, 1, 2048]
    - [82, 83.51]
  - - [4864, 1024, 1, 1024]
    - [83, 78.8]
  - - [4864, 1024, 1, 2048]
    - [84, 91.32]
  - - [728, 728, 1, 3456]
    - [85, 63.904]
  - - [728, 1024, 1, 3456]
    - [86, 65.472]
  - - [1280, 256, 1, 3456]
    - [87, 37.613]
  - - [6912, 728, 1, 256]
    - [73, 39.31]
  - - [13824, 256, 1, 2304]
    - [88, 63.071]
  - - [13824, 2304, 1, 256]
    - [89, 69.439]
  - - [27648, 128, 1, 256]
    - [90, 34.663]
  - - [27648, 256, 1, 128]
    - [91, 32.315]
  - - [110592, 128, 1, 64]
    - [92, 34.616]
  - - [221184, 27, 1, 256]
    - [93, 40.734]
  - - [221184, 256, 1, 27]
    - [94, 24.055]
  - - [9, 1, 1024, 3456]
    - [95, 1.584]
  - - [9, 1, 128, 13824]
    - [96, 1.254]
  - - [9, 1, 128, 55296]
    - [97, 1.74]
  - - [9, 1, 64, 221184]
    - [98, 1.84]
  - - [3456, 256, 2, 1280]
    - [99, 69.353]
  - - [3456, 256, 2, 2048]
    - [100, 73.898]
  - - [3456, 728, 2, 728]
    - [101, 70.129]
  - - [3456, 728, 2, 1024]
    - [102, 72.296]
  - - [3456, 1024, 2, 728]
    - [101, 77.587]
  - - [3456, 1024, 2, 1024]
    - [103, 79.569]
  - - [3456, 1280, 2, 256]
    - [104, 55.537]
  - - [3456, 1536, 2, 1024]
    - [105, 81.056]
  - - [3456, 1536, 2, 1536]
    - [105, 84.398]
  - - [3456, 2048, 2, 256]
    - [104, 61.954]
  - - [13824, 256, 2, 256]
    - [106, 49.185]
  - - [13824, 256, 2, 728]
    - [107, 61.418]
  - - [13824, 728, 2, 256]
    - [108, 61.355]
  - - [13824, 728, 2, 728]
    - [109, 72.854]
  - - [55296, 9, 128, 1]
    - [110, 0.714]
  - - [55296, 48, 2, 128]
    - [111, 38.96]
  - - [55296, 128, 2, 48]
    - [112, 22.637]
  - - [55296, 128, 2, 128]
    - [113, 50.759]
  - - [55296, 256, 2, 128]
    - [114, 60.5]
  - - [55296, 256, 2, 256]
    - [115, 73.667]
  - - [221184, 64, 2, 128]
    - [116, 49.735]
  - - [221184, 128, 2, 64]
    - [117, 44.905]
  - - [221184, 128, 2, 128]
    - [118, 59.411]
  - - [64, 68096, 1, 64]
    - [119, 23.93]
  - - [64, 68096, 1, 256]
    - [120, 50.21]
  - - [64, 97280, 1, 64]
    - [121, 22.49]
  - - [64, 97280, 1, 256]
    - [122, 62.13]
  - - [64, 4864, 1, 64]
    - [123, 4.51]
  - - [64, 9728, 1, 64]
    - [124, 7.75]
  - - [64, 24320, 1, 64]
    - [125, 15.25]
  - - [64, 34048, 1, 64]
    - [126, 17.08]
  - - [64, 34048, 1, 256]
    - [127, 40.69]
  - - [96, 34816, 1, 96]
    - [128, 31.67]
  - - [96, 34816, 1, 384]
    - [129, 41.12]
  - - [96, 65536, 1, 96]
    - [130, 40.17]
  - - [96, 65536, 1, 384]
    - [131, 56.49]
  - - [96, 98304, 1, 96]
    - [132, 44.2]
  - - [96, 98304, 1, 384]
    - [133, 60.02]
  - - [96, 131072, 1, 96]
    - [134, 48.94]
  - - [96, 131072, 1, 384]
    - [135, 66.54]
  - - [96, 147456, 1, 96]
    - [136, 47.69]
  - - [96, 147456, 1, 384]
    - [137, 64.23]
  - - [192, 2048, 1, 192]
    - [138, 13.18]
  - - [192, 2048, 1, 768]
    - [139, 32.63]
  - - [192, 4096, 1, 192]
    - [140, 23.01]
  - - [192, 4096, 1, 768]
    - [141, 37.75]
  - - [192, 8192, 1, 192]
    - [142, 31.45]
  - - [192, 8192, 1, 768]
    - [143, 42.98]
  - - [192, 16384, 1, 192]
    - [144, 42]
  - - [192, 16384, 1, 768]
    - [145, 66.16]
  - - [192, 32768, 1, 192]
    - [146, 42.89]
  - - [192, 32768, 1, 768]
    - [147, 71.29]
  - - [288, 34816, 1, 96]
    - [148, 39.24]
  - - [288, 49152, 1, 96]
    - [149, 44.43]
  - - [288, 65536, 1, 96]
    - [150, 44.93]
  - - [288, 98304, 1, 96]
    - [151, 52.75]
  - - [288, 131072, 1, 96]
    - [152, 55.08]
  - - [288, 147456, 1, 96]
    - [153, 49.78]
  - - [384, 34816, 1, 96]
    - [154, 39.85]
  - - [384, 49152, 1, 96]
    - [155, 43.76]
  - - [384, 65536, 1, 96]
    - [156, 50.26]
  - - [384, 98304, 1, 96]
    - [157, 48.66]
  - - [384, 131072, 1, 96]
    - [158, 58.02]
  - - [384, 147456, 1, 96]
    - [159, 54.2]
  - - [384, 512, 1, 384]
    - [160, 11.64]
  - - [384, 1024, 1, 384]
    - [161, 22.98]
  - - [384, 2048, 1, 384]
    - [162, 29.39]
  - - [384, 4096, 1, 384]
    - [163, 42.47]
  - - [384, 8192, 1, 384]
    - [164, 53.55]
  - - [384, 9216, 1, 384]
    - [165, 62.02]
  - - [384, 10240, 1, 384]
    - [166, 47.85]
  - - [384, 512, 1, 1536]
    - [167, 23.67]
  - - [384, 1024, 1, 1536]
    - [168, 39.36]
  - - [384, 2048, 1, 1536]
    - [169, 40.07]
  - - [384, 4096, 1, 1536]
    - [170, 52.23]
  - - [384, 8192, 1, 1536]
    - [171, 72.56]
  - - [384, 9216, 1, 1536]
    - [172, 79.72]
  - - [384, 10240, 1, 1536]
    - [173, 66.84]
  - - [4096, 16, 1, 1024]
    - [174, 6.05]
  - - [4096, 32, 1, 1024]
    - [175, 12.19]
  - - [4096, 64, 1, 1024]
    - [176, 25.19]
  - - [4096, 128, 1, 1024]
    - [177, 41.07]
  - - [4096, 256, 1, 1024]
    - [178, 48.85]
  - - [4096, 512, 1, 1024]
    - [179, 61.29]
  - - [4096, 768, 1, 1024]
    - [180, 68.97]
  - - [4096, 1024, 1, 1024]
    - [181, 69.61]
  - - [4096, 2048, 1, 1024]
    - [182, 63.67]
  - - [4096, 4096, 1, 1024]
    - [183, 74.74]
  - - [4096, 6144, 1, 1024]
    - [184, 76.81]
  - - [4096, 8192, 1, 1024]
    - [185, 86.77]
  - - [4096, 10240, 1, 1024]
    - [186, 85.38]
  - - [4096, 20480, 1, 1024]
    - [187, 93.25]
  - - [768, 1024, 1, 3072]
    - [86, 67.34]
  - - [768, 2048, 1, 3072]
    - [86, 72.14]
  - - [768, 224, 1, 768]
    - [188, 17.4]
  - - [768, 256, 1, 768]
    - [189, 19.71]
  - - [768, 512, 1, 768]
    - [190, 31.51]
  - - [768, 1024, 1, 768]
    - [191, 37.42]
  - - [768, 2048, 1, 768]
    - [192, 46.96]
  - - [768, 4096, 1, 768]
    - [193, 64.3]
  - - [768, 8192, 1, 768]
    - [194, 69.77]
  - - [768, 224, 1, 3072]
    - [195, 32.02]
  - - [768, 256, 1, 3072]
    - [196, 28.29]
  - - [768, 512, 1, 3072]
    - [197, 43.51]
  - - [768, 4096, 1, 3072]
    - [193, 75.78]
  - - [768, 8192, 1, 3072]
    - [198, 77.62]
  - - [768, 8704, 1, 192]
    - [199, 43.32]
  - - [768, 16384, 1, 192]
    - [200, 59.2]
  - - [768, 20480, 1, 192]
    - [201, 60.87]
  - - [768, 32768, 1, 192]
    - [202, 66.72]
  - - [8, 7680, 1, 64]
    - [203, 0.74]
  - - [8, 8192, 1, 64]
    - [204, 0.789]
  - - [8, 7680, 1, 1024]
    - [205, 4.854]
  - - [8, 8192, 1, 1024]
    - [206, 4.55]
  - - [1024, 4, 1, 1024]
    - [207, 0.644]
  - - [1024, 8, 1, 1024]
    - [208, 1.292]
  - - [1024, 8, 1, 1280]
    - [209, 1.354]
  - - [2304, 512, 1, 784]
    - [210, 54.9]
  - - [2304, 1024, 1, 784]
    - [211, 66.015]
  - - [2304, 2048, 1, 784]
    - [212, 70.766]
  - - [3072, 224, 1, 768]
    - [213, 34.876]
  - - [3072, 256, 1, 768]
    - [214, 39.109]
  - - [3072, 512, 1, 768]
    - [215, 45.74]
  - - [3072, 1024, 1, 768]
    - [216, 65.19]
  - - [3072, 2048, 1, 768]
    - [217, 63.212]
  - - [3072, 3072, 1, 768]
    - [218, 81.004]
  - - [3072, 53760, 1, 768]
    - [219, 89.858]
  - - [512, 128, 1, 128]
    - [220, 2.19]
  - - [512, 128, 1, 768]
    - [221, 8.96]
  - - [512, 256, 1, 768]
    - [222, 17.54]
  - - [512, 384, 1, 768]
    - [223, 19.53]
  - - [512, 512, 1, 512]
    - [224, 21.21]
  - - [512, 512, 1, 768]
    - [225, 26.73]
  - - [512, 1024, 1, 512]
    - [226, 34.91]
  - - [512, 1536, 1, 512]
    - [227, 33.82]
  - - [512, 1664, 1, 512]
    - [228, 35.3]
  - - [512, 2048, 1, 1024]
    - [229, 52.13]
  - - [512, 2304, 1, 1024]
    - [230, 59.37]
  - - [512, 2688, 1, 1024]
    - [231, 51.92]
  - - [512, 2816, 1, 1024]
    - [232, 55.12]
  - - [576, 8704, 1, 192]
    - [233, 46.5]
  - - [576, 12288, 1, 192]
    - [234, 55.31]
  - - [576, 16384, 1, 192]
    - [235, 58.38]
  - - [576, 20480, 1, 192]
    - [236, 60.7]
  - - [576, 32768, 1, 192]
    - [237, 65.9]
  - - [576, 40960, 1, 192]
    - [238, 68.76]
  - - [1536, 6304, 1, 384]
    - [62, 73.9]
  - - [384, 6304, 1, 1536]
    - [63, 79.4]
  - - [384, 6304, 1, 384]
    - [62, 50.3]
  - - [384, 1600, 1, 384]
    - [228, 36.9]
  - - [768, 25088, 1, 192]
    - [201, 68.3]
  - - [192, 25088, 1, 768]
    - [236, 79.3]
  - - [256, 100352, 1, 64]
    - [151, 40.1]
  - - [192, 25088, 1, 192]
    - [236, 51.2]
  - - [64, 100352, 1, 256]
    - [133, 55.8]
  - - [192, 25088, 1, 192]
    - [236, 66.6]
  - - [192, 6272, 1, 192]
    - [62, 42.3]
  - - [1536, 2167, 1, 384]
    - [81, 60.7]
  - - [384, 2167, 1, 1536]
    - [169, 53.4]
  - - [64, 100352, 1, 64]
    - [132, 28.2]
  - - [384, 2167, 1, 384]
    - [162, 35.9]
  - - [64, 100352, 1, 64]
    - [132, 42.1]
  - - [64, 25088, 1, 64]
    - [125, 23.0]
  - - [384, 550, 1, 384]
    - [160, 13.7]
  - - [1000, 32, 1, 384]
    - [69, 2.7]
  - - [768, 8624, 1, 192]
    - [199, 48.3]
  - - [192, 8624, 1, 768]
    - [143, 53.6]
  - - [256, 34496, 1, 64]
    - [148, 27.4]
  - - [192, 8624, 1, 192]
    - [233, 23.5]
  - - [192, 8624, 1, 192]
    - [233, 38.0]
  - - [192, 2156, 1, 192]
    - [138, 19.6]
  - - [64, 34496, 1, 256]
    - [129, 47.4]
  - - [64, 8624, 1, 64]
    - [142, 9.6]
  - - [64, 34496, 1, 64]
    - [128, 15.0]
  - - [64, 34496, 1, 64]
    - [128, 29.2]
  - - [1000, 11, 1, 384]
    - [69, 0.9]
- null
