library/src/blas3/Tensile/Logic/asm_full/aquavanjaram942X/aquavanjaram942_Cijk_Alik_Bljk_BBS_BH.yaml
- {MinimumRequiredVersion: 4.36.0}
- aquavanjaram942
- {Architecture: gfx942, IsAPU: 0}
- [Device 74a1]
    SolutionIndex: 0
    SolutionNameMin: Cijk_Alik_Bljk_BBS_BH_MT256x256x32_MI32x32x8x1_SN_FL0_GLS0_NTC3_NTD2_NEPBS0_NLCA1_ONLL1_SU32_SUS64_SPO0_SSO6_WGM4
    SolutionIndex: 1
    SolutionNameMin: Cijk_Alik_Bljk_BBS_BH_MT256x256x32_MI32x32x8x1_SN_FL2_GLS0_NTC3_NTD2_NEPBS0_NLCA1_ONLL2_SU0_SUS0_SPO0_SSO6_WGM18
    SolutionIndex: 2
    SolutionNameMin: Cijk_Alik_Bljk_BBS_BH_MT256x256x32_MI32x32x8x1_SN_FL2_GLS0_NTC3_NTD3_NEPBS0_NLCA1_ONLL0_SU32_SUS64_SPO0_SSO6_WGM18
    SolutionIndex: 3
    SolutionNameMin: Cijk_Alik_Bljk_BBS_BH_MT256x256x32_MI32x32x8x1_SN_FL0_GLS0_NTC2_NTD3_NEPBS0_NLCA1_ONLL2_SU32_SUS64_SPO1_SSO6_WGM18
    SolutionIndex: 4
    SolutionNameMin: Cijk_Alik_Bljk_BBS_BH_MT256x256x32_MI32x32x8x1_SN_FL2_GLS0_NTC3_NTD2_NEPBS0_NLCA1_ONLL1_SU0_SUS0_SPO0_SSO8_WGM18
    SolutionIndex: 5
    SolutionNameMin: Cijk_Alik_Bljk_BBS_BH_MT256x256x32_MI32x32x8x1_SN_FL0_GLS0_NTC2_NTD2_NEPBS0_NLCA1_ONLL1_SU32_SUS64_SPO1_SSO8_WGM19
    SolutionIndex: 6
    SolutionNameMin: Cijk_Alik_Bljk_BBS_BH_MT256x256x32_MI32x32x8x1_SN_FL0_GLS0_NTC3_NTD2_NEPBS0_NLCA1_ONLL1_SU32_SUS128_SPO1_SSO8_WGM4
    SolutionIndex: 7
    SolutionNameMin: Cijk_Alik_Bljk_BBS_BH_MT256x256x32_MI32x32x8x1_SN_FL2_GLS0_NTC3_NTD2_NEPBS0_NLCA1_ONLL0_SU32_SUS128_SPO1_SSO8_WGM19
    SolutionIndex: 8
    SolutionNameMin: Cijk_Alik_Bljk_BBS_BH_MT256x256x32_MI32x32x8x1_SN_FL0_GLS0_NTC2_NTD2_NEPBS8_NLCA1_ONLL1_SU32_SUS128_SPO0_SSO8_WGM19
    SolutionIndex: 9
    SolutionNameMin: Cijk_Alik_Bljk_BBS_BH_MT256x256x32_MI32x32x8x1_SN_FL0_GLS1_NTC2_NTD2_NEPBS0_NLCA1_ONLL1_SU32_SUS128_SPO0_SSO6_WGM19
    SolutionIndex: 10
    SolutionNameMin: Cijk_Alik_Bljk_BBS_BH_MT256x256x32_MI32x32x8x1_SN_FL2_GLS1_NTC2_NTD3_NEPBS0_NLCA1_ONLL1_SU32_SUS128_SPO0_SSO6_WGM19
    SolutionIndex: 11
    SolutionNameMin: Cijk_Alik_Bljk_BBS_BH_MT256x256x32_MI32x32x8x1_SN_FL2_GLS1_NTC2_NTD2_NEPBS0_NLCA1_ONLL1_SU32_SUS64_SPO1_SSO6_WGM4
    SolutionIndex: 12
    SolutionNameMin: Cijk_Alik_Bljk_BBS_BH_MT256x256x32_MI32x32x8x1_SN_1LDSB1_DTVA0_GLS0_LRVW8_NEPBS0_NLCA1_SU32_SUS64_SSO6_WGM18
    SolutionIndex: 13
    SolutionNameMin: Cijk_Alik_Bljk_BBS_BH_MT256x128x64_MI32x32x8x1_SN_AMAS0_GLS1_NEPBS0_PLR9_SU0_SUS0_SSO4_SVW1_TT4_64_VW1_WG64_4_1_WGM32
    SolutionIndex: 14
    SolutionNameMin: Cijk_Alik_Bljk_BBS_BH_MT256x256x32_MI32x32x8x1_SN_1LDSB1_DTVA0_GLS0_LBSPPA128_LPA8_LPB8_LRVW8_NEPBS0_NLCA1_SU32_SUS64_SSO6_WGM6
    SolutionIndex: 15
    SolutionNameMin: Cijk_Alik_Bljk_BBS_BH_MT256x256x32_MI32x32x8x1_SN_1LDSB1_DTVA0_GLS0_LBSPPA128_LPA8_LPB8_LRVW8_NEPBS0_NLCA1_SU32_SUS64_SSO8_WGM6
    SolutionIndex: 16
    SolutionNameMin: Cijk_Alik_Bljk_BBS_BH_MT256x128x64_MI16x16x16x1_SN_1LDSB1_DTVA0_GLS1_LBSPPA256_LPA16_LPB16_LRVW8_NEPBS0_NLCA1_SU32_SUS128_SSO8_WGM18
    SolutionIndex: 17
    SolutionNameMin: Cijk_Alik_Bljk_BBS_BH_MT256x256x32_MI32x32x8x1_SN_1LDSB1_DTVA0_GLS0_LBSPPA128_LPA8_LPB8_LRVW8_NEPBS0_NLCA1_SU32_SUS64_SSO8_WGM18
    SolutionIndex: 18
    SolutionNameMin: Cijk_Alik_Bljk_BBS_BH_MT256x128x64_MI16x16x16x1_SN_1LDSB1_DTVA0_GLS0_LBSPPA256_LPA16_LPB16_LRVW8_NEPBS0_NLCA1_SU0_SUS0_SSO6_WGM12
    SolutionIndex: 19
    SolutionNameMin: Cijk_Alik_Bljk_BBS_BH_MT256x224x64_MI16x16x16x1_SN_AMAS3_NEPBS8_SU2_SUS1024_SPO1_SSO0_TT8_112_VW4_WGM32
    SolutionIndex: 20
    SolutionNameMin: Cijk_Alik_Bljk_BBS_BH_MT256x224x64_MI16x16x16x1_SN_AMAS0_NEPBS0_SU2_SUS512_SPO0_SSO0_TT8_112_VW1_WGM16
    SolutionIndex: 21
    SolutionNameMin: Cijk_Alik_Bljk_BBS_BH_MT256x224x64_MI16x16x16x1_SN_AMAS3_NEPBS0_SU2_SUS512_SPO0_SSO0_TT8_112_VW4_WGM16
    SolutionIndex: 22
    SolutionNameMin: Cijk_Alik_Bljk_BBS_BH_MT256x224x64_MI16x16x16x1_SN_AMAS3_NEPBS0_SU0_SUS0_SPO0_SSO0_TT8_112_VW4_WGM16
    SolutionIndex: 23
    SolutionNameMin: Cijk_Alik_Bljk_BBS_BH_MT256x224x64_MI16x16x16x1_SN_AMAS0_NEPBS16_SU4_SUS512_SPO1_SSO0_TT8_112_VW1_WGM16
    SolutionIndex: 24
    SolutionNameMin: Cijk_Alik_Bljk_BBS_BH_MT16x16x512_MI16x16x16x1_SN_AMAS0_EPS1_GLS0_LBSPPA1024_LBSPPB1024_NEPBS0_ONLL1_PLR9_SS0_SPO1_SVW4_TT1_16_U64SL0_VW1_WSGRB1_WG16_4_4
    SolutionIndex: 25
    SolutionNameMin: Cijk_Alik_Bljk_BBS_BH_MT16x16x512_MI16x16x16x1_SN_AMAS0_EPS0_GLS1_LBSPPA1024_LBSPPB1024_NEPBS0_ONLL1_PLR9_SS1_SPO0_SVW1_TT1_16_U64SL0_VW1_WSGRB1_WG16_4_4
    SolutionIndex: 26
    SolutionNameMin: Cijk_Alik_Bljk_BBS_BH_MT32x16x512_MI16x16x16x1_SN_AMAS3_EPS0_GLS1_LBSPPA2048_LBSPPB1024_NEPBS16_ONLL1_PLR9_SS1_SPO0_SVW2_TT2_16_U64SL1_VW2_WSGRB0_WG16_4_4
    SolutionIndex: 27
    SolutionNameMin: Cijk_Alik_Bljk_BBS_BH_MT16x16x256_MI16x16x16x1_SN_AMAS0_EPS0_GLS0_LBSPPA512_LBSPPB512_NEPBS16_ONLL0_PLR5_SS0_SPO1_SVW4_TT1_16_U64SL0_VW1_WSGRB0_WG16_4_4
    SolutionIndex: 28
    SolutionNameMin: Cijk_Alik_Bljk_BBS_BH_MT32x16x256_MI16x16x16x1_SN_AMAS0_EPS1_GLS0_LBSPPA512_LBSPPB512_NEPBS0_ONLL0_PLR5_SS1_SPO0_SVW1_TT2_16_U64SL1_VW1_WSGRB0_WG16_4_4
    SolutionIndex: 29
    SolutionNameMin: Cijk_Alik_Bljk_BBS_BH_MT32x32x256_MI16x16x16x1_SN_AMAS3_EMLL0_GLS1_LBSPPA1024_LBSPPB512_LPA16_LPB16_NEPBS0_PLR5_SS1_SPO1_SSO0_SVW2_TT2_32_VW2_WG16_4_4
    SolutionIndex: 30
    SolutionNameMin: Cijk_Alik_Bljk_BBS_BH_MT16x64x256_MI16x16x16x1_SN_AMAS3_EMLL4_GLS0_LBSPPA512_LBSPPB512_LPA16_LPB16_NEPBS16_PLR5_SS0_SPO0_SSO0_SVW4_TT1_64_VW4_WG16_4_4
    SolutionIndex: 31
    SolutionNameMin: Cijk_Alik_Bljk_BBS_BH_MT16x32x512_MI16x16x16x1_SN_AMAS3_EMLL0_GLS1_LBSPPA1024_LBSPPB1024_LPA16_LPB16_NEPBS0_PLR9_SS0_SPO0_SSO0_SVW4_TT1_32_VW4_WG16_4_4
    SolutionIndex: 32
    SolutionNameMin: Cijk_Alik_Bljk_BBS_BH_MT64x32x256_MI16x16x16x1_SN_AMAS3_EMLL4_GLS0_LBSPPA1024_LBSPPB512_LPA16_LPB16_NEPBS16_PLR9_SS1_SPO0_SSO0_SVW2_TT2_32_VW2_WG32_4_2
    SolutionIndex: 33
    SolutionNameMin: Cijk_Alik_Bljk_BBS_BH_MT64x32x256_MI16x16x16x1_SN_AMAS0_EMLL0_GLS1_LBSPPA512_LBSPPB512_LPA16_LPB16_NEPBS16_PLR5_SS1_SPO0_SSO0_SVW1_TT4_32_VW1_WG16_4_4
    SolutionIndex: 34
    SolutionNameMin: Cijk_Alik_Bljk_BBS_BH_MT64x32x256_MI16x16x16x1_SN_AMAS3_EMLL0_GLS0_LBSPPA1024_LBSPPB512_LPA16_LPB16_NEPBS16_PLR5_SS1_SPO0_SSO0_SVW2_TT4_32_VW2_WG16_4_4
    SolutionIndex: 35
    SolutionNameMin: Cijk_Alik_Bljk_BBS_BH_MT256x224x64_MI16x16x16x1_SN_FL1_GLVWA2_GLVWB2_GRVW2_LBSPPA512_LBSPPB128_LPA4_LPB4_LRVW4_PLR5_SVW4_TT8_112_VW4_WSGRA0_WG32_8_1_WGM16
    SolutionIndex: 36
    SolutionNameMin: Cijk_Alik_Bljk_BBS_BH_MT256x256x32_MI32x32x8x1_SN_ELFLR0_GLVWA8_GLVWB8_GRVW8_GLS1_LBSPPA256_LBSPPB128_LPA8_LPB8_LRVW8_PLR5_SU8_SUS128_SVW4_TT4_128_VW4_WG64_4_1_WGM16
    SolutionIndex: 37
    SolutionNameMin: Cijk_Alik_Bljk_BBS_BH_MT256x256x32_MI16x16x16x1_SN_ELFLR4_GLVWA4_GLVWB4_GRVW4_GLS0_LBSPPA256_LBSPPB128_LPA4_LPB4_LRVW4_PLR3_SU8_SUS128_SVW4_TT8_128_VW4_WG32_8_1_WGM32
    SolutionIndex: 38
    SolutionNameMin: Cijk_Alik_Bljk_BBS_BH_MT256x256x32_MI32x32x8x1_SN_ELFLR4_GLVWA8_GLVWB8_GRVW8_GLS0_LBSPPA128_LBSPPB128_LPA8_LPB8_LRVW8_PLR5_SU0_SUS0_SVW2_TT4_128_VW2_WG64_4_1_WGM32
    SolutionIndex: 39
    SolutionNameMin: Cijk_Alik_Bljk_BBS_BH_MT256x224x64_MI16x16x16x1_SN_ELFLR0_GLVWA2_GLVWB2_GRVW2_GLS0_LBSPPA256_LBSPPB128_LPA4_LPB4_LRVW4_PLR5_SU8_SUS128_SVW2_TT8_112_VW2_WG32_8_1_WGM16
    SolutionIndex: 40
    SolutionNameMin: Cijk_Alik_Bljk_BBS_BH_MT256x224x64_MI16x16x16x1_SN_ELFLR4_GLVWA2_GLVWB2_GRVW2_GLS0_LBSPPA256_LBSPPB128_LPA4_LPB4_LRVW4_PLR5_SU8_SUS128_SVW2_TT8_112_VW2_WG32_8_1_WGM1
    SolutionIndex: 41
    SolutionNameMin: Cijk_Alik_Bljk_BBS_BH_MT256x224x64_MI16x16x16x1_SN_ELFLR0_GLVWA2_GLVWB2_GRVW2_GLS1_LBSPPA256_LBSPPB128_LPA4_LPB4_LRVW4_PLR5_SU8_SUS128_SVW2_TT8_112_VW2_WG32_8_1_WGM16
    SolutionIndex: 42
    SolutionNameMin: Cijk_Alik_Bljk_BBS_BH_MT256x256x32_MI32x32x8x1_SN_ELFLR4_GLVWA8_GLVWB8_GRVW8_GLS1_LBSPPA128_LBSPPB128_LPA8_LPB8_LRVW8_PLR5_SU8_SUS128_SVW2_TT4_128_VW2_WG64_4_1_WGM32
    SolutionIndex: 43
    SolutionNameMin: Cijk_Alik_Bljk_BBS_BH_MT256x224x64_MI16x16x16x1_SN_ELFLR4_GLVWA2_GLVWB2_GRVW2_GLS0_LBSPPA512_LBSPPB128_LPA4_LPB4_LRVW4_PLR5_SU8_SUS128_SVW4_TT8_112_VW4_WG32_8_1_WGM16
    SolutionIndex: 44
    SolutionNameMin: Cijk_Alik_Bljk_BBS_BH_MT256x256x32_MI16x16x16x1_SN_ELFLR0_GLVWA2_GLVWB2_GRVW2_GLS0_LBSPPA256_LBSPPB128_LPA4_LPB4_LRVW4_PLR3_SU0_SUS0_SVW4_TT8_128_VW4_WG32_8_1_WGM32
    SolutionIndex: 45
    SolutionNameMin: Cijk_Alik_Bljk_BBS_BH_MT256x256x32_MI32x32x8x1_SN_ELFLR0_GLVWA8_GLVWB8_GRVW8_GLS0_LBSPPA128_LBSPPB128_LPA8_LPB8_LRVW8_PLR5_SU0_SUS0_SVW2_TT4_128_VW2_WG64_4_1_WGMn16
    SolutionIndex: 46
    SolutionNameMin: Cijk_Alik_Bljk_BBS_BH_MT32x16x128_MI16x16x16x1_SN_AMAS0_GLVWB8_GSU1_GSUASB_GLS0_LBSPPA256_LBSPPB256_PLR5_SS1_SU0_SUS0_SPO0_SVW1_TT1_16_VW1_WG32_4_2
    SolutionIndex: 47
    SolutionNameMin: Cijk_Alik_Bljk_BBS_BH_MT16x16x256_MI16x16x16x1_SN_AMAS0_GLVWB8_GSU1_GSUASB_GLS0_LBSPPA512_LBSPPB512_PLR5_SS1_SU0_SUS0_SPO1_SVW1_TT1_16_VW1_WG16_4_4
    SolutionIndex: 48
    SolutionNameMin: Cijk_Alik_Bljk_BBS_BH_MT64x16x64_MI16x16x16x1_SN_AMAS0_GLVWB4_GSU4_GSUAMB_GLS0_LBSPPA128_LBSPPB128_PLR5_SS0_SU0_SUS0_SPO0_SVW4_TT1_16_VW1_WG64_4_1
    SolutionIndex: 49
    SolutionNameMin: Cijk_Alik_Bljk_BBS_BH_MT32x16x256_MI16x16x16x1_SN_AMAS3_GLVWB8_GSU1_GSUASB_GLS1_LBSPPA1024_LBSPPB512_PLR5_SS1_SU0_SUS0_SPO0_SVW2_TT2_16_VW2_WG16_4_4
    SolutionIndex: 50
    SolutionNameMin: Cijk_Alik_Bljk_BBS_BH_MT16x16x256_MI16x16x16x1_SN_AMAS3_GLVWB8_GSU1_GSUASB_GLS0_LBSPPA512_LBSPPB512_PLR5_SS0_SU0_SUS0_SPO1_SVW4_TT1_16_VW4_WG16_4_4
    SolutionIndex: 51
    SolutionNameMin: Cijk_Alik_Bljk_BBS_BH_MT16x16x256_MI16x16x16x1_SN_AMAS0_GLVWA4_GLVWB4_LBSPPA512_SS0_SVW4_TT1_16_VW1
    SolutionIndex: 52
    SolutionNameMin: Cijk_Alik_Bljk_BBS_BH_MT64x16x256_MI16x16x16x1_SN_AMAS3_GLVWB8_GSU1_GSUASB_GLS1_LBSPPA512_LBSPPB512_PLR17_SS0_SU0_SUS0_SPO0_SVW4_TT1_16_VW2_WG64_4_1
    SolutionIndex: 53
    SolutionNameMin: Cijk_Alik_Bljk_BBS_BH_MT64x16x128_MI16x16x16x1_SN_AMAS3_GLVWA8_GLVWB8_GSU1_GSUASB_GLS1_LBSPPA256_LBSPPB256_NLCA1_NLCB1_PLR9_SS0_SU4_SUS256_SPO1_SVW4_TT1_16_VW4_WG64_4_1
    SolutionIndex: 54
    SolutionNameMin: Cijk_Alik_Bljk_BBS_BH_MT192x16x64_MI16x16x16x1_SN_AMAS3_GLVWA8_GLVWB4_GSU3_GSUAMB_GLS0_LBSPPA128_LBSPPB128_NLCA1_NLCB1_PLR5_SS0_SU0_SUS0_SPO1_SVW4_TT3_16_VW2_WG64_4_1
    SolutionIndex: 55
    SolutionNameMin: Cijk_Alik_Bljk_BBS_BH_MT32x16x256_MI16x16x16x1_SN_AMAS3_GLVWB4_GSU1_GSUASB_GLS0_LBSPPA1024_PLR5_SPO1_SSO0_SVW2_TT2_16_VW2_WG16_4_4
    SolutionIndex: 56
    SolutionNameMin: Cijk_Alik_Bljk_BBS_BH_MT32x16x256_MI16x16x16x1_SN_AMAS0_GLVWB4_GSU1_GSUASB_GLS1_LBSPPA512_PLR5_SPO1_SSO0_SVW1_TT2_16_VW1_WG16_4_4
    SolutionIndex: 57
    SolutionNameMin: Cijk_Alik_Bljk_BBS_BH_MT128x16x128_MI16x16x16x1_SN_AMAS3_GLVWA8_GLVWB8_GSU1_GSUASB_GLS0_LBSPPA256_LBSPPB256_NLCA1_NLCB1_PLR9_SS0_SU0_SUS0_SPO0_SVW4_TT2_16_VW4_WG64_4_1
    SolutionIndex: 58
    SolutionNameMin: Cijk_Alik_Bljk_BBS_BH_MT192x16x128_MI16x16x16x1_SN_AMAS3_GLVWA4_GLVWB8_GSU1_GSUASB_GLS0_LBSPPA256_LBSPPB256_NLCA1_NLCB1_PLR9_SS0_SU8_SUS256_SPO0_SVW4_TT3_16_VW4_WG64_4_1
    SolutionIndex: 59
    SolutionNameMin: Cijk_Alik_Bljk_BBS_BH_MT32x16x256_MI16x16x16x1_SN_AMAS3_GLVWB8_GSU1_GSUASB_GLS1_LBSPPA1024_LBSPPB512_PLR5_SS1_SU0_SUS0_SVW2_TT2_16_VW2_WG16_4_4
    SolutionIndex: 60
    SolutionNameMin: Cijk_Alik_Bljk_BBS_BH_MT32x16x128_MI16x16x16x1_SN_AMAS3_GLVWB8_GSU1_GSUASB_GLS1_LBSPPA256_LBSPPB256_PLR5_SS0_SU4_SUS256_SVW4_TT1_16_VW2_WG32_4_2
    SolutionIndex: 61
    SolutionNameMin: Cijk_Alik_Bljk_BBS_BH_MT16x32x512_MI16x16x16x1_SN_AMAS3_GLVWA8_GLVWB8_GRVW8_GSU1_GSUASB_GLS1_LBSPPA1024_LBSPPB1024_LPA16_LPB16_PLR9_SS0_SU0_SUS0_SPO0_SVW4_TT1_32_VW4_WG16_4_4
    SolutionIndex: 62
    SolutionNameMin: Cijk_Alik_Bljk_BBS_BH_MT32x32x128_MI16x16x16x1_SN_AMAS0_GLVWA8_GLVWB8_GRVW8_GSU1_GSUASB_GLS0_LBSPPA256_LBSPPB256_LPA16_LPB16_PLR9_SS1_SU0_SUS0_SPO1_SVW1_TT1_16_VW1_WG32_8_1
    SolutionIndex: 63
    SolutionNameMin: Cijk_Alik_Bljk_BBS_BH_MT32x32x256_MI32x32x8x1_SN_AMAS0_FL0_GLVWB8_GSU1_GSUASB_GLS0_LBSPPA512_LPA8_LPB8_PLR9_SS1_SPO0_SVW1_TT1_32_VW1_WSGRA1_WG32_2_4
    SolutionIndex: 64
    SolutionNameMin: Cijk_Alik_Bljk_BBS_BH_MT32x32x128_MI32x32x8x1_SN_AMAS0_GLVWA8_GLVWB8_GRVW8_GSU1_GSUASB_GLS0_LBSPPA256_LBSPPB256_LPA8_LPB8_PLR5_SS1_SU0_SUS0_SPO0_SVW1_TT1_32_VW1_WG32_2_4
    SolutionIndex: 65
    SolutionNameMin: Cijk_Alik_Bljk_BBS_BH_MT32x32x128_MI32x32x8x1_SN_AMAS0_GLVWA8_GLVWB8_GRVW8_GSU1_GSUASB_GLS1_LBSPPA256_LBSPPB256_LPA8_LPB8_PLR5_SS1_SU4_SUS256_SPO0_SVW1_TT1_32_VW1_WG32_2_4
    SolutionIndex: 66
    SolutionNameMin: Cijk_Alik_Bljk_BBS_BH_MT64x32x256_MI16x16x16x1_SN_AMAS3_GLVWA8_GLVWB8_GRVW8_GSU1_GSUASB_GLS1_LBSPPA1024_LBSPPB512_LPA16_LPB16_PLR5_SS1_SU0_SUS0_SPO0_SVW2_TT4_32_VW2_WG16_4_4
    SolutionIndex: 67
    SolutionNameMin: Cijk_Alik_Bljk_BBS_BH_MT16x32x256_MI16x16x16x1_SN_AMAS0_GLVWA8_GLVWB8_GRVW8_GSU1_GSUASB_GLS1_LBSPPA512_LBSPPB512_LPA16_LPB16_PLR5_SS1_SU0_SUS0_SPO1_SVW1_TT1_32_VW1_WG16_4_4
    SolutionIndex: 68
    SolutionNameMin: Cijk_Alik_Bljk_BBS_BH_MT64x32x256_MI16x16x16x1_SN_AMAS3_GLVWA8_GLVWB8_GRVW8_GSU1_GSUASB_GLS0_LBSPPA1024_LBSPPB512_LPA16_LPB16_PLR9_SS1_SU0_SUS0_SPO1_SVW2_TT2_32_VW2_WG32_4_2
    SolutionIndex: 69
    SolutionNameMin: Cijk_Alik_Bljk_BBS_BH_MT64x32x128_MI32x32x8x1_SN_AMAS3_GLVWA4_GLVWB8_GLS0_LBSPPA512_LBSPPB256_LPA8_LPB8_PLR5_SU8_SUS256_SPO0_SVW2_TT2_32_VW2_WG32_2_4
    SolutionIndex: 70
    SolutionNameMin: Cijk_Alik_Bljk_BBS_BH_MT64x32x128_MI32x32x8x1_SN_AMAS0_GLVWA4_GLVWB8_GLS0_LBSPPA256_LBSPPB256_LPA8_LPB8_PLR9_SU8_SUS256_SPO0_SVW1_TT1_32_VW1_WG64_2_2
    SolutionIndex: 71
    SolutionNameMin: Cijk_Alik_Bljk_BBS_BH_MT32x32x128_MI16x16x16x1_SN_AMAS3_GLVWA8_GLVWB8_GLS0_LBSPPA512_LBSPPB256_LPA16_LPB16_PLR5_SU8_SUS256_SPO1_SVW2_TT2_16_VW2_WG16_8_2
    SolutionIndex: 72
    SolutionNameMin: Cijk_Alik_Bljk_BBS_BH_MT96x32x128_MI16x16x16x1_SN_AMAS0_GLVWA8_GLVWB8_GLS0_LBSPPA256_LBSPPB256_LPA16_LPB16_PLR9_SU8_SUS256_SPO0_SVW1_TT3_16_VW1_WG32_8_1
    SolutionIndex: 73
    SolutionNameMin: Cijk_Alik_Bljk_BBS_BH_MT128x32x128_MI32x32x8x1_SN_AMAS0_GLVWA8_GLVWB8_GLS1_LBSPPA256_LBSPPB256_LPA8_LPB8_PLR5_SU8_SUS256_SPO0_SVW1_TT4_32_VW1_WG32_2_4
    SolutionIndex: 74
    SolutionNameMin: Cijk_Alik_Bljk_BBS_BH_MT128x16x128_MI16x16x16x1_SN_AMAS0_GLVWB8_GSU2_GSUAMB_LBSPPA256_LBSPPB256_LPA16_LPB16_NLCB1_PLR5_SU4_SUS256_SPO1_SVW1_TT4_16_VW1_WG32_4_2
    SolutionIndex: 75
    SolutionNameMin: Cijk_Alik_Bljk_BBS_BH_MT16x32x128_MI16x16x16x1_SN_AMAS0_EMLL0_GLS1_LBSPPA256_LBSPPB256_LPA16_LPB16_NEPBS0_PLR5_SS0_SPO0_SSO4_SVW4_TT1_32_VW1_WG16_4_2
    SolutionIndex: 76
    SolutionNameMin: Cijk_Alik_Bljk_BBS_BH_MT64x64x64_MI16x16x16x1_SN_AMAS3_ELFLR0_GLVWA8_GLVWB2_LBSPPA512_LPA16_LPB16_LRVW8_PLR5_SU64_SUS128_SSO0_SVW4_TT4_16_VW4_WG16_16_1_WGM48
    SolutionIndex: 77
    SolutionNameMin: Cijk_Alik_Bljk_BBS_BH_MT64x64x64_MI16x16x16x1_SN_AMAS3_ELFLR0_GLVWA2_GLVWB8_LBSPPA256_LPA16_LPB16_LRVW8_PLR5_SU64_SUS128_SSO0_SVW2_TT2_32_VW2_WG32_8_1_WGM8
    SolutionIndex: 78
    SolutionNameMin: Cijk_Alik_Bljk_BBS_BH_MT64x64x64_MI16x16x16x1_SN_AMAS0_ELFLR4_GLVWA8_GLVWB8_LBSPPA128_LPA16_LPB16_LRVW8_PLR5_SU8_SUS256_SSO0_SVW1_TT2_32_VW1_WG32_8_1_WGM48
    SolutionIndex: 79
    SolutionNameMin: Cijk_Alik_Bljk_BBS_BH_MT64x64x64_MI16x16x16x1_SN_AMAS3_ELFLR4_GLVWA8_GLVWB4_LBSPPA256_LPA16_LPB16_LRVW8_PLR5_SU8_SUS128_SSO0_SVW2_TT2_32_VW2_WG32_8_1_WGMn48
    SolutionIndex: 80
    SolutionNameMin: Cijk_Alik_Bljk_BBS_BH_MT64x64x64_MI16x16x16x1_SN_AMAS3_ELFLR4_GLVWA2_GLVWB4_LBSPPA256_LPA4_LPB4_LRVW4_PLR1_SU64_SUS128_SSO0_SVW2_TT2_32_VW2_WG32_8_1_WGMn48
    SolutionIndex: 81
    SolutionNameMin: Cijk_Alik_Bljk_BBS_BH_MT32x32x64_MI16x16x16x1_SN_GLVWA2_GLVWB2_LPA4_LPB4_LRVW4_PLR1_SU0_SUS0_WGM1
    SolutionIndex: 82
    SolutionNameMin: Cijk_Alik_Bljk_BBS_BH_MT128x128x64_MI16x16x16x1_SN_GLVWA8_GLVWB8_GRVW8_LPA8_LPB8_NEPBS16_PLR5_SU0_SUS0_SPO1_SSO0_TT4_64_VW4_WG32_8_1_WGM32
    SolutionIndex: 83
    SolutionNameMin: Cijk_Alik_Bljk_BBS_BH_MT128x128x64_MI16x16x16x1_SN_GLVWA8_GLVWB8_GRVW8_LPA8_LPB8_NEPBS0_PLR1_SU8_SUS512_SPO0_SSO0_TT4_64_VW8_WG32_8_1_WGM16
    SolutionIndex: 84
    SolutionNameMin: Cijk_Alik_Bljk_BBS_BH_MT128x128x64_MI32x32x8x1_SN_GLVWA8_GLVWB8_GRVW8_LPA8_LPB8_NEPBS8_PLR9_SU16_SUS512_SPO0_SSO4_TT2_64_VW4_WG64_4_1_WGM16
    SolutionIndex: 85
    SolutionNameMin: Cijk_Alik_Bljk_BBS_BH_MT128x128x64_MI16x16x16x1_SN_GLVWA8_GLVWB8_GRVW8_LPA8_LPB8_NEPBS0_PLR5_SU64_SUS1024_SPO0_SSO4_TT4_64_VW4_WG32_8_1_WGM16
    SolutionIndex: 86
    SolutionNameMin: Cijk_Alik_Bljk_BBS_BH_MT128x128x64_MI32x32x8x1_SN_GLVWA8_GLVWB8_GRVW8_LPA8_LPB8_NEPBS8_PLR1_SU0_SUS0_SPO0_SSO0_TT2_64_VW8_WG64_4_1_WGM16
    SolutionIndex: 87
    SolutionNameMin: Cijk_Alik_Bljk_BBS_BH_MT32x32x128_MI16x16x16x1_SN_ELFLR4_GLVWA8_GLVWB8_GRVW8_GSU1_GSUASB_LBSPPA256_LBSPPB256_LPA8_LPB8_MKFGSU256_NEPBS4_PLR1_SU0_SUS0_SSO0_TT1_16_WG32_8_1_WGM1
    SolutionIndex: 88
    SolutionNameMin: Cijk_Alik_Bljk_BBS_BH_MT32x32x128_MI16x16x16x1_SN_ELFLR4_GLVWA8_GLVWB8_GRVW8_GSU1_GSUASB_LBSPPA256_LBSPPB256_LPA8_LPB8_MKFGSU256_NEPBS4_PLR9_SU0_SUS0_SSO0_TT1_16_WG32_8_1_WGM1
    SolutionIndex: 89
    SolutionNameMin: Cijk_Alik_Bljk_BBS_BH_MT32x32x128_MI16x16x16x1_SN_ELFLR4_GLVWA4_GLVWB4_GRVW4_GSU1_GSUASB_LBSPPA256_LBSPPB256_LPA4_LPB4_MKFGSU256_NEPBS16_PLR1_SU0_SUS0_SSO0_TT1_16_WG32_8_1_WGM1
    SolutionIndex: 90
    SolutionNameMin: Cijk_Alik_Bljk_BBS_BH_MT16x16x128_MI16x16x16x1_SN_ELFLR0_GLVWA8_GLVWB8_GRVW8_GSU1_GSUASB_LBSPPA256_LBSPPB256_LPA8_LPB8_MKFGSU256_NEPBS4_PLR1_SU0_SUS0_SSO0_TT1_16_WG16_4_1_WGM16
    SolutionIndex: 91
    SolutionNameMin: Cijk_Alik_Bljk_BBS_BH_MT16x16x128_MI16x16x16x1_SN_ELFLR4_GLVWA8_GLVWB8_GRVW8_GSU1_GSUASB_LBSPPA256_LBSPPB256_LPA8_LPB8_MKFGSU256_NEPBS16_PLR1_SU0_SUS0_SSO0_TT1_16_WG16_4_1_WGM16
    SolutionIndex: 92
    SolutionNameMin: Cijk_Alik_Bljk_BBS_BH_MT16x16x128_MI16x16x16x1_SN_ELFLR4_GLVWA8_GLVWB8_GRVW8_GSU1_GSUASB_LBSPPA256_LBSPPB256_LPA8_LPB8_MKFGSU256_NEPBS4_PLR1_SU0_SUS0_SSO0_TT1_16_WG16_4_1_WGM16
    SolutionIndex: 93
    SolutionNameMin: Cijk_Alik_Bljk_BBS_BH_MT32x64x64_MI16x16x16x1_SN_AMAS0_GLVWA4_GLVWB8_LBSPPA128_LBSPPB256_LPA4_LPB8_NTC3_NTD3_PLR5_SVW1_TT1_32_VW1_VWB2_WSGRA0_WG32_8_1_WGM32
    SolutionIndex: 94
    SolutionNameMin: Cijk_Alik_Bljk_BBS_BH_MT64x128x64_MI16x16x16x1_SN_AMAS3_GLVWA2_GLVWB8_LBSPPA256_LBSPPB256_LPA4_LPB8_NTC0_NTD0_PLR1_SVW2_TT4_32_VW2_VWB2_WSGRA0_WG16_16_1_WGM16
    SolutionIndex: 95
    SolutionNameMin: Cijk_Alik_Bljk_BBS_BH_MT64x128x64_MI16x16x16x1_SN_AMAS3_GLVWA2_GLVWB8_LBSPPA256_LBSPPB256_LPA4_LPB8_NTC1_NTD1_PLR5_SVW2_TT4_32_VW2_VWB2_WSGRA0_WG16_16_1_WGM32
    SolutionIndex: 96
    SolutionNameMin: Cijk_Alik_Bljk_BBS_BH_MT64x128x64_MI16x16x16x1_SN_AMAS3_GLVWA2_GLVWB8_LBSPPA256_LBSPPB256_LPA4_LPB8_NTC0_NTD0_PLR5_SVW2_TT4_32_VW2_VWB2_WSGRA1_WG16_16_1_WGM16
    SolutionIndex: 97
    SolutionNameMin: Cijk_Alik_Bljk_BBS_BH_MT64x128x64_MI16x16x16x1_SN_AMAS3_GLVWA2_GLVWB8_LBSPPA256_LBSPPB256_LPA4_LPB8_NTC3_NTD3_PLR5_SVW2_TT4_32_VW2_VWB2_WSGRA0_WG16_16_1_WGM32
    SolutionIndex: 98
    SolutionNameMin: Cijk_Alik_Bljk_BBS_BH_MT128x256x32_MI16x16x16x1_SN_AMAS3_GLVWA2_GLVWB8_LBSPPA128_LBSPPB128_LPA4_LPB8_NTC3_NTD3_PLR1_SVW2_TT4_128_VW2_VWB2_WSGRA1_WG32_8_1_WGM16
    SolutionIndex: 99
    SolutionNameMin: Cijk_Alik_Bljk_BBS_BH_MT128x256x32_MI16x16x16x1_SN_AMAS3_GLVWA4_GLVWB8_LBSPPA128_LBSPPB128_LPA4_LPB8_NTC1_NTD1_PLR3_SVW2_TT4_128_VW2_VWB2_WSGRA1_WG32_8_1_WGM8
    SolutionIndex: 100
    SolutionNameMin: Cijk_Alik_Bljk_BBS_BH_MT32x32x64_MI16x16x16x1_SN_AMAS0_GLVWA2_GLVWB2_LBSPPA128_LBSPPB128_LPA4_LPB4_NTC3_NTD3_PLR5_SVW1_TT1_16_VW1_VWB1_WSGRA1_WG32_8_1_WGM32
    SolutionIndex: 101
    SolutionNameMin: Cijk_Alik_Bljk_BBS_BH_MT32x64x64_MI16x16x16x1_SN_AMAS0_GLVWA4_GLVWB8_LBSPPA128_LBSPPB256_LPA4_LPB8_NTC2_NTD2_PLR5_SVW1_TT1_32_VW1_VWB2_WSGRA0_WG32_8_1_WGM1
    SolutionIndex: 102
    SolutionNameMin: Cijk_Alik_Bljk_BBS_BH_MT32x64x64_MI16x16x16x1_SN_AMAS0_GLVWA4_GLVWB8_LBSPPA128_LBSPPB256_LPA4_LPB8_NTC0_NTD0_PLR1_SVW1_TT1_32_VW1_VWB2_WSGRA1_WG32_8_1_WGM32
    SolutionIndex: 103
    SolutionNameMin: Cijk_Alik_Bljk_BBS_BH_MT64x128x64_MI16x16x16x1_SN_AMAS3_GLVWA8_GLVWB8_LBSPPA256_LBSPPB256_LPA8_LPB8_NTC3_NTD3_PLR1_SVW2_TT4_32_VW2_VWB2_WSGRA0_WG16_16_1_WGM8
    SolutionIndex: 104
    SolutionNameMin: Cijk_Alik_Bljk_BBS_BH_MT128x256x32_MI16x16x16x1_SN_AMAS3_GLVWA2_GLVWB8_LBSPPA128_LBSPPB128_LPA4_LPB8_NTC2_NTD2_PLR1_SVW2_TT8_64_VW2_VWB2_WSGRA0_WG16_16_1_WGM32
    SolutionIndex: 105
    SolutionNameMin: Cijk_Alik_Bljk_BBS_BH_MT256x128x64_MI16x16x16x1_SN_1LDSB1_AMAS3_DTVA0_GLVWA8_GLVWB8_LBSPPA256_LBSPPB256_LPA16_LPB16_LRVW8_NLCA1_PLR5_SVW2_TT8_64_VW2_WSGRA1_WSGRB1_WG32_8_1_WGM1
    SolutionIndex: 106
    SolutionNameMin: Cijk_Alik_Bljk_BBS_BH_MT128x256x32_MI16x16x16x1_SN_1LDSB0_AMAS3_EMLL2_GLVWA2_LBSPPA128_LBSPPB128_LPA4_LPB8_PLR3_SVW2_TT8_64_VW2_VWB2_WSGRA1_WSGRB0_WG16_16_1_WGM1
    SolutionIndex: 107
    SolutionNameMin: Cijk_Alik_Bljk_BBS_BH_MT128x256x32_MI16x16x16x1_SN_1LDSB0_AMAS3_EMLL2_GLVWA2_LBSPPA128_LBSPPB128_LPA4_LPB8_PLR3_SVW2_TT4_128_VW2_VWB2_WSGRA0_WSGRB0_WG32_8_1_WGM1
    SolutionIndex: 108
    SolutionNameMin: Cijk_Alik_Bljk_BBS_BH_MT128x256x32_MI16x16x16x1_SN_1LDSB1_AMAS3_EMLL0_GLVWA4_LBSPPA128_LBSPPB128_LPA4_LPB8_PLR3_SVW2_TT4_128_VW2_VWB2_WSGRA1_WSGRB1_WG32_8_1_WGM1
    SolutionIndex: 109
    SolutionNameMin: Cijk_Alik_Bljk_BBS_BH_MT128x256x32_MI16x16x16x1_SN_1LDSB1_AMAS3_EMLL0_GLVWA2_LBSPPA128_LBSPPB128_LPA4_LPB8_PLR3_SVW2_TT8_64_VW2_VWB2_WSGRA1_WSGRB0_WG16_16_1_WGM48
    SolutionIndex: 110
    SolutionNameMin: Cijk_Alik_Bljk_BBS_BH_MT128x256x32_MI16x16x16x1_SN_1LDSB1_AMAS3_EMLL0_GLVWA2_LBSPPA256_LBSPPB128_LPA4_LPB8_PLR1_SVW4_TT8_64_VW4_VWB2_WSGRA1_WSGRB0_WG16_16_1_WGM1
    SolutionIndex: 111
    SolutionNameMin: Cijk_Alik_Bljk_BBS_BH_MT64x256x64_MI16x16x16x1_SN_AMAS3_EMLL0_GLVWA2_LBSPPA256_LBSPPB256_LPA16_LPB16_LRVW8_NTC2_NTD2_NEPBS8_PLR5_SSO0_SVW2_VW2_WSGRA0_WSGRB0_WGM8
    SolutionIndex: 112
    SolutionNameMin: Cijk_Alik_Bljk_BBS_BH_MT64x256x32_MI16x16x16x1_SN_AMAS3_EMLL0_GLVWA4_LBSPPA128_LBSPPB128_LPA4_LPB8_LRVW4_NTC3_NTD3_NEPBS8_PLR3_SSO0_SVW2_VW2_WSGRA1_WSGRB0_WGM32
    SolutionIndex: 113
    SolutionNameMin: Cijk_Alik_Bljk_BBS_BH_MT64x256x32_MI16x16x16x1_SN_AMAS3_EMLL0_GLVWA8_LBSPPA128_LBSPPB128_LPA8_LPB8_LRVW4_NTC3_NTD3_NEPBS8_PLR3_SSO0_SVW2_VW2_WSGRA0_WSGRB1_WGM8
    SolutionIndex: 114
    SolutionNameMin: Cijk_Alik_Bljk_BBS_BH_MT64x256x64_MI16x16x16x1_SN_AMAS3_EMLL0_GLVWA8_LBSPPA512_LBSPPB256_LPA16_LPB16_LRVW8_NTC2_NTD2_NEPBS0_PLR5_SSO0_SVW4_VW4_WSGRA0_WSGRB1_WGM8
    SolutionIndex: 115
    SolutionNameMin: Cijk_Alik_Bljk_BBS_BH_MT64x256x64_MI16x16x16x1_SN_AMAS3_EMLL0_GLVWA8_LBSPPA512_LBSPPB256_LPA16_LPB16_LRVW8_NTC3_NTD3_NEPBS0_PLR5_SSO0_SVW4_VW4_WSGRA0_WSGRB1_WGM16
    SolutionIndex: 116
    SolutionNameMin: Cijk_Alik_Bljk_BBS_BH_MT64x64x32_MI16x16x16x1_SN_AMAS3_ASLT365_GLVWA2_GLVWB8_LBSPPA128_LPA4_LPB8_LRVW4_NEPBS8_PLR1_SU0_SUS0_SVW2_TT4_16_VW2_VWB1_WSGRA1_WSGRB0_WGM1
    SolutionIndex: 117
    SolutionNameMin: Cijk_Alik_Bljk_BBS_BH_MT64x64x64_MI16x16x16x1_SN_AMAS3_ASLT365_GLVWA8_GLVWB4_LBSPPA512_LPA8_LPB4_LRVW4_NEPBS0_PLR1_SU0_SUS0_SVW4_TT4_16_VW4_VWB1_WSGRA1_WSGRB0_WGM1
    SolutionIndex: 118
    SolutionNameMin: Cijk_Alik_Bljk_BBS_BH_MT32x256x32_MI16x16x16x1_SN_AMAS3_ASLT365_GLVWA2_GLVWB8_LBSPPA128_LPA4_LPB8_LRVW4_NEPBS0_PLR1_SU8_SUS256_SVW2_TT2_64_VW2_VWB2_WSGRA1_WSGRB1_WGM1
    SolutionIndex: 119
    SolutionNameMin: Cijk_Alik_Bljk_BBS_BH_MT32x256x32_MI16x16x16x1_SN_AMAS3_ASLT065_GLVWA2_GLVWB8_LBSPPA128_LPA4_LPB8_LRVW4_NEPBS0_PLR1_SU0_SUS0_SVW2_TT2_64_VW2_VWB2_WSGRA0_WSGRB0_WGM1
    SolutionIndex: 120
    SolutionNameMin: Cijk_Alik_Bljk_BBS_BH_MT32x256x32_MI16x16x16x1_SN_AMAS3_ASLT365_GLVWA2_GLVWB4_LBSPPA128_LPA4_LPB4_LRVW4_NEPBS0_PLR1_SU0_SUS0_SVW2_TT2_64_VW2_VWB2_WSGRA1_WSGRB0_WGM8
    SolutionIndex: 121
    SolutionNameMin: Cijk_Alik_Bljk_BBS_BH_MT32x256x32_MI16x16x16x1_SN_AMAS3_ASLT065_GLVWA4_GLVWB8_LBSPPA128_LPA4_LPB8_LRVW4_NEPBS8_PLR1_SU0_SUS0_SVW2_TT2_64_VW2_VWB2_WSGRA1_WSGRB1_WGM48
    SolutionIndex: 122
    SolutionNameMin: Cijk_Alik_Bljk_BBS_BH_MT256x128x32_MI16x16x16x1_SN_1LDSB1_AMAS3_DTVA0_GLVWA8_GLVWB4_GRCGA1_LBSPPA128_LBSPPB128_LPA8_LPB4_LRVW4_NLCA1_PLR1_SVW2_TT8_64_VW2_WSGRA0_WSGRB1_WG32_8_1_WGM1
    SolutionIndex: 123
    SolutionNameMin: Cijk_Alik_Bljk_BBS_BH_MT256x128x32_MI16x16x16x1_SN_1LDSB1_AMAS3_DTVA0_GLVWA8_GLVWB8_GRCGA1_LBSPPA128_LBSPPB128_LPA8_LPB8_LRVW4_NLCA1_PLR1_SVW2_TT4_128_VW2_WSGRA0_WSGRB1_WG64_4_1_WGM1
    SolutionIndex: 124
    SolutionNameMin: Cijk_Alik_Bljk_BBS_BH_MT256x256x32_MI16x16x16x1_SN_1LDSB1_AMAS3_DTVA0_GLVWA4_GLVWB2_GRCGA1_LBSPPA128_LBSPPB128_LPA4_LPB4_LRVW4_NLCA1_PLR3_SVW2_TT16_64_VW2_WSGRA1_WSGRB1_WG16_16_1_WGM1
    SolutionIndex: 125
    SolutionNameMin: Cijk_Alik_Bljk_BBS_BH_MT256x128x32_MI16x16x16x1_SN_1LDSB1_AMAS3_DTVA0_GLVWA8_GLVWB8_GRCGA1_LBSPPA128_LBSPPB128_LPA8_LPB8_LRVW4_NLCA1_PLR3_SVW2_TT4_128_VW2_WSGRA1_WSGRB1_WG64_4_1_WGM1
    SolutionIndex: 126
    SolutionNameMin: Cijk_Alik_Bljk_BBS_BH_MT256x224x64_MI16x16x16x1_SN_GLVWA2_NTC0_NTD0
    SolutionIndex: 127
    SolutionNameMin: Cijk_Alik_Bljk_BBS_BH_MT256x224x64_MI16x16x16x1_SN_AMAS3_GLVWA2_GLVWB2_LBSPPA256_LBSPPB128_LPA4_LPB4_NTC2_NTD2_PLR5_SS1_SU8_SVW2_TT8_112_VW2_VWB1_WG32_8_1
    SolutionIndex: 128
    SolutionNameMin: Cijk_Alik_Bljk_BBS_BH_MT256x224x64_MI16x16x16x1_SN_AMAS3_GLVWA2_GLVWB4_LBSPPA512_LBSPPB128_LPA4_LPB4_NTC0_NTD0_PLR5_SS1_SU4_SVW4_TT8_112_VW4_VWB1_WG32_8_1
    SolutionIndex: 129
    SolutionNameMin: Cijk_Alik_Bljk_BBS_BH_MT256x224x64_MI16x16x16x1_SN_AMAS3_GLVWA2_GLVWB4_LBSPPA512_LBSPPB128_LPA4_LPB4_NTC1_NTD1_PLR5_SS1_SU8_SVW4_TT8_112_VW4_VWB1_WG32_8_1
    SolutionIndex: 130
    SolutionNameMin: Cijk_Alik_Bljk_BBS_BH_MT16x16x512_MI16x16x16x1_SN_AMAS0_ETB_ELFLR4_GLVWB8_GSU1_GSUASB_LBSPPA1024_LBSPPB1024_NTA0_PLR9_PKA1_SS1_SVW1_TT1_16_VW1_WG16_4_4
    SolutionIndex: 131
    SolutionNameMin: Cijk_Alik_Bljk_BBS_BH_MT16x16x512_MI16x16x16x1_SN_AMAS0_ETB_ELFLR0_GLVWB8_GSU1_GSUASB_LBSPPA1024_LBSPPB1024_NTA0_PLR9_PKA1_SS1_SVW1_TT1_16_VW1_WG16_4_4
    SolutionIndex: 132
    SolutionNameMin: Cijk_Alik_Bljk_BBS_BH_MT32x16x512_MI16x16x16x1_SN_AMAS0_ETSP_ELFLR0_GLVWB8_GSU1_GSUASB_LBSPPA1024_LBSPPB1024_NTA0_PLR9_PKA0_SS1_SVW1_TT2_16_VW1_WG16_4_4
    SolutionIndex: 133
    SolutionNameMin: Cijk_Alik_Bljk_BBS_BH_MT32x16x256_MI16x16x16x1_SN_AMAS3_ETB_ELFLR0_GLVWB8_GSU1_GSUASB_LBSPPA1024_LBSPPB512_NTA0_PLR5_PKA1_SS1_SVW2_TT2_16_VW2_WG16_4_4
    SolutionIndex: 134
    SolutionNameMin: Cijk_Alik_Bljk_BBS_BH_MT32x16x256_MI16x16x16x1_SN_AMAS0_ETB_ELFLR0_GLVWB8_GSU1_GSUASB_LBSPPA512_LBSPPB512_NTA0_PLR9_PKA1_SS1_SVW1_TT1_16_VW1_WG32_4_2
    SolutionIndex: 135
    SolutionNameMin: Cijk_Alik_Bljk_BBS_BH_MT16x16x256_MI16x16x16x1_SN_AMAS0_ETB_ELFLR0_GLVWB8_GSU1_GSUASB_LBSPPA512_LBSPPB512_NTA0_PLR5_PKA1_SS1_SVW1_TT1_16_VW1_WG16_4_4
    SolutionIndex: 136
    SolutionNameMin: Cijk_Alik_Bljk_BBS_BH_MT16x16x512_MI16x16x16x1_SN_AMAS0_ETB_ELFLR0_GLVWA8_GLVWB8_GRVW8_GSU1_GSUASB_LBSPPA1024_LBSPPB1024_LPA16_LPB16_NTA0_PLR9_PKA1_SS1_SVW1_TT1_16_VW1_VWB1_WG16_4_4
    SolutionIndex: 137
    SolutionNameMin: Cijk_Alik_Bljk_BBS_BH_MT16x32x512_MI16x16x16x1_SN_AMAS0_ETSP_ELFLR4_GLVWA8_GLVWB8_GRVW8_GSU1_GSUASB_LBSPPA1024_LBSPPB2048_LPA16_LPB16_NTA0_PLR9_PKA0_SS1_SVW1_TT1_32_VW1_VWB2_WG16_4_4
    SolutionIndex: 138
    SolutionNameMin: Cijk_Alik_Bljk_BBS_BH_MT32x16x512_MI16x16x16x1_SN_AMAS3_ETSP_ELFLR0_GLVWA8_GLVWB8_GRVW8_GSU1_GSUASB_LBSPPA2048_LBSPPB1024_LPA16_LPB16_NTA0_PLR9_PKA0_SS1_SVW2_TT2_16_VW2_VWB1_WG16_4_4
    SolutionIndex: 139
    SolutionNameMin: Cijk_Alik_Bljk_BBS_BH_MT16x32x512_MI16x16x16x1_SN_AMAS0_ETB_ELFLR0_GLVWA8_GLVWB8_GRVW8_GSU1_GSUASB_LBSPPA1024_LBSPPB2048_LPA16_LPB16_NTA0_PLR9_PKA1_SS1_SVW1_TT1_32_VW1_VWB2_WG16_4_4
    SolutionIndex: 140
    SolutionNameMin: Cijk_Alik_Bljk_BBS_BH_MT32x32x256_MI32x32x8x1_SN_AMAS0_ETSP_ELFLR4_GLVWA8_GLVWB8_GRVW8_GSU1_GSUASB_LBSPPA512_LBSPPB512_LPA8_LPB8_NTA0_PLR9_PKA0_SS1_SVW1_TT1_32_VW1_VWB1_WG32_2_4
    SolutionIndex: 141
    SolutionNameMin: Cijk_Alik_Bljk_BBS_BH_MT32x32x256_MI32x32x8x1_SN_AMAS0_ETB_ELFLR0_GLVWA8_GLVWB8_GRVW8_GSU1_GSUASB_LBSPPA512_LBSPPB512_LPA8_LPB8_NTA0_PLR9_PKA1_SS1_SVW1_TT1_32_VW1_VWB1_WG32_2_4
    SolutionIndex: 142
    SolutionNameMin: Cijk_Alik_Bljk_BBS_BH_MT32x32x256_MI32x32x8x1_SN_AMAS0_ETB_ELFLR4_GLVWA8_GLVWB8_GRVW8_GSU1_GSUASB_LBSPPA512_LBSPPB512_LPA8_LPB8_NTA0_PLR9_PKA1_SS1_SVW1_TT1_32_VW1_VWB1_WG32_2_4
    SolutionIndex: 143
    SolutionNameMin: Cijk_Alik_Bljk_BBS_BH_MT16x32x256_MI16x16x16x1_SN_AMAS0_ETSP_ELFLR4_GLVWA8_GLVWB8_GRVW8_GSU1_GSUASB_LBSPPA512_LBSPPB512_LPA16_LPB16_NTA0_PLR9_PKA0_SS1_SVW1_TT1_16_VW1_VWB1_WG16_8_2
    SolutionIndex: 144
    SolutionNameMin: Cijk_Alik_Bljk_BBS_BH_MT64x16x256_MI16x16x16x1_SN_AMAS0_ETSP_ELFLR4_GLVWA8_GLVWB8_GRVW8_GSU1_GSUASB_LBSPPA512_LBSPPB512_LPA16_LPB16_NTA0_PLR17_PKA0_SS1_SVW1_TT1_16_VW1_VWB1_WG64_4_1
    SolutionIndex: 145
    SolutionNameMin: Cijk_Alik_Bljk_BBS_BH_MT16x32x512_MI16x16x16x1_SN_AMAS0_ETSP_GLVWA8_GLVWB8_GRVW8_GSU1_GSUASB_LBSPPA1024_LBSPPB2048_LPA16_LPB16_NTA0_PLR9_PKA0_SS1_SVW1_TT1_32_VW1_VWB2_WG16_4_4
    SolutionIndex: 146
    SolutionNameMin: Cijk_Alik_Bljk_BBS_BH_MT32x32x256_MI16x16x16x1_SN_AMAS3_ETB_GLVWA8_GLVWB8_GRVW8_GSU1_GSUASB_LBSPPA1024_LBSPPB1024_LPA16_LPB16_NTA0_PLR5_PKA1_SS1_SVW2_TT2_32_VW2_VWB2_WG16_4_4
    SolutionIndex: 147
    SolutionNameMin: Cijk_Alik_Bljk_BBS_BH_MT16x64x256_MI16x16x16x1_SN_AMAS0_ETSP_GLVWA8_GLVWB8_GRVW8_GSU1_GSUASB_LBSPPA512_LBSPPB1024_LPA16_LPB16_NTA0_PLR5_PKA0_SS1_SVW1_TT1_64_VW1_VWB2_WG16_4_4
    SolutionIndex: 148
    SolutionNameMin: Cijk_Alik_Bljk_BBS_BH_MT32x32x256_MI16x16x16x1_SN_AMAS0_ETSP_GLVWA8_GLVWB8_GRVW8_GSU1_GSUASB_LBSPPA512_LBSPPB1024_LPA16_LPB16_NTA0_PLR5_PKA0_SS1_SVW1_TT2_32_VW1_VWB2_WG16_4_4
    SolutionIndex: 149
    SolutionNameMin: Cijk_Alik_Bljk_BBS_BH_MT32x64x256_MI16x16x16x1_SN_AMAS0_ETSP_GLVWA8_GLVWB8_GRVW8_GSU1_GSUASB_LBSPPA512_LBSPPB1024_LPA16_LPB16_NTA0_PLR5_PKA0_SS1_SVW1_TT2_64_VW1_VWB2_WG16_4_4
    SolutionIndex: 150
    SolutionNameMin: Cijk_Alik_Bljk_BBS_BH_MT64x32x128_MI16x16x16x1_SN_AMAS3_ETSP_GLVWA8_GLVWB8_GRVW8_GSU1_GSUASB_LBSPPA512_LBSPPB256_LPA16_LPB16_NTA0_PLR9_PKA0_SS1_SVW2_TT2_16_VW2_VWB1_WG32_8_1
    SolutionIndex: 151
    SolutionNameMin: Cijk_Alik_Bljk_BBS_BH_MT32x64x256_MI16x16x16x1_SN_AMAS3_ETSP_GLVWA8_GLVWB8_GRVW8_GSU1_GSUASB_LBSPPA1024_LBSPPB1024_LPA16_LPB16_NTA0_PLR5_PKA0_SS1_SVW2_TT2_64_VW2_VWB2_WG16_4_4
    SolutionIndex: 152
    SolutionNameMin: Cijk_Alik_Bljk_BBS_BH_MT32x32x64_MI16x16x16x1_SN_AMAS0_ETSP_GLVWA8_GLVWB8_GRVW8_GSU1_GSUASB_LBSPPA128_LBSPPB128_LPA16_LPB16_NTA0_PLR5_PKA0_SS1_SVW1_TT1_16_VW1_VWB1_WG32_8_1
    SolutionIndex: 153
    SolutionNameMin: Cijk_Alik_Bljk_BBS_BH_MT64x32x256_MI16x16x16x1_SN_AMAS3_ETSP_GLVWA8_GLVWB8_GRVW8_GSU1_GSUASB_LBSPPA1024_LBSPPB1024_LPA16_LPB16_NTA0_PLR5_PKA0_SS1_SVW2_TT4_32_VW2_VWB2_WG16_4_4
    SolutionIndex: 154
    SolutionNameMin: Cijk_Alik_Bljk_BBS_BH_MT64x32x128_MI16x16x16x1_SN_AMAS3_ETSP_GLVWA8_GLVWB8_GRVW8_GSU1_GSUASB_LBSPPA512_LBSPPB512_LPA16_LPB16_NTA0_PLR5_PKA0_SS1_SVW2_TT2_32_VW2_VWB2_WG32_4_2
    SolutionIndex: 155
    SolutionNameMin: Cijk_Alik_Bljk_BBS_BH_MT64x32x256_MI16x16x16x1_SN_AMAS3_ETSP_GLVWA8_GLVWB8_GRVW8_GSU1_GSUASB_LBSPPA2048_LBSPPB1024_LPA16_LPB16_NTA0_PLR5_PKA0_SS1_SVW4_TT4_32_VW4_VWB2_WG16_4_4
    SolutionIndex: 156
    SolutionNameMin: Cijk_Alik_Bljk_BBS_BH_MT64x32x256_MI16x16x16x1_SN_AMAS0_ETSP_GLVWA8_GLVWB8_GRVW8_GSU1_GSUASB_LBSPPA512_LBSPPB1024_LPA16_LPB16_NTA0_PLR5_PKA0_SS1_SVW1_TT4_32_VW1_VWB2_WG16_4_4
    SolutionIndex: 157
    SolutionNameMin: Cijk_Alik_Bljk_BBS_BH_MT32x64x256_MI16x16x16x1_SN_AMAS0_ETB_GLVWA8_GLVWB8_GRVW8_GSU1_GSUASB_LBSPPA512_LBSPPB1024_LPA16_LPB16_NTA0_PLR5_PKA1_SS1_SVW1_TT2_64_VW1_VWB2_WG16_4_4
    SolutionIndex: 158
    SolutionNameMin: Cijk_Alik_Bljk_BBS_BH_MT64x64x128_MI16x16x16x1_SN_AMAS0_ETB_GLVWA8_GLVWB8_GRVW8_GSU1_GSUASB_LBSPPA256_LBSPPB512_LPA16_LPB16_NTA0_PLR5_PKA1_SS1_SVW1_TT2_64_VW1_VWB2_WG32_4_2
    SolutionIndex: 159
    SolutionNameMin: Cijk_Alik_Bljk_BBS_BH_MT32x64x256_MI16x16x16x1_SN_AMAS3_ETB_GLVWA8_GLVWB8_GRVW8_GSU1_GSUASB_LBSPPA1024_LBSPPB1024_LPA16_LPB16_NTA0_PLR9_PKA1_SS1_SVW2_TT2_32_VW2_VWB2_WG16_8_2
    SolutionIndex: 160
    SolutionNameMin: Cijk_Alik_Bljk_BBS_BH_MT64x32x256_MI16x16x16x1_SN_AMAS3_ETB_GLVWA8_GLVWB8_GRVW8_GSU1_GSUASB_LBSPPA1024_LBSPPB1024_LPA16_LPB16_NTA0_PLR9_PKA1_SS0_SVW4_TT2_32_VW2_VWB2_WG32_4_2
    SolutionIndex: 161
    SolutionNameMin: Cijk_Alik_Bljk_BBS_BH_MT64x64x128_MI16x16x16x1_SN_AMAS0_ETSP_GLVWA8_GLVWB8_GRVW8_GSU1_GSUASB_LBSPPA256_LBSPPB512_LPA16_LPB16_NTA0_PLR5_PKA0_SS1_SVW1_TT2_64_VW1_VWB2_WG32_4_2
    SolutionIndex: 162
    SolutionNameMin: Cijk_Alik_Bljk_BBS_BH_MT32x32x256_MI16x16x16x1_SN_AMAS3_ETSP_GLVWA8_GLVWB8_GRVW8_GSU1_GSUASB_LBSPPA1024_LBSPPB1024_LPA16_LPB16_PLR5_PKA0_SS1_SVW2_TT2_32_VW2_VWB2_WG16_4_4
    SolutionIndex: 163
    SolutionNameMin: Cijk_Alik_Bljk_BBS_BH_MT32x32x256_MI16x16x16x1_SN_AMAS0_ETB_GLVWA8_GLVWB8_GRVW8_GSU1_GSUASB_LBSPPA512_LBSPPB1024_LPA16_LPB16_PLR5_PKA1_SS1_SVW1_TT2_32_VW1_VWB2_WG16_4_4
    SolutionIndex: 164
    SolutionNameMin: Cijk_Alik_Bljk_BBS_BH_MT32x64x256_MI16x16x16x1_SN_AMAS3_ETB_GLVWA8_GLVWB8_GRVW8_GSU1_GSUASB_LBSPPA1024_LBSPPB1024_LPA16_LPB16_PLR5_PKA1_SS1_SVW2_TT2_64_VW2_VWB2_WG16_4_4
    SolutionIndex: 165
    SolutionNameMin: Cijk_Alik_Bljk_BBS_BH_MT32x64x256_MI16x16x16x1_SN_AMAS0_ETSP_GLVWA8_GLVWB8_GRVW8_GSU1_GSUASB_LBSPPA512_LBSPPB1024_LPA16_LPB16_PLR9_PKA0_SS1_SVW1_TT2_32_VW1_VWB2_WG16_8_2
    SolutionIndex: 166
    SolutionNameMin: Cijk_Alik_Bljk_BBS_BH_MT32x64x256_MI16x16x16x1_SN_AMAS3_ETSP_GLVWA8_GLVWB8_GRVW8_GSU1_GSUASB_LBSPPA1024_LBSPPB1024_LPA16_LPB16_PLR5_PKA0_SS1_SVW2_TT2_64_VW2_VWB2_WG16_4_4
    SolutionIndex: 167
    SolutionNameMin: Cijk_Alik_Bljk_BBS_BH_MT64x64x128_MI16x16x16x1_SN_AMAS3_ETSP_GLVWA8_GLVWB8_GRVW8_GSU1_GSUASB_LBSPPA512_LBSPPB512_LPA16_LPB16_PLR9_PKA0_SS1_SVW2_TT2_32_VW2_VWB2_WG32_8_1
    SolutionIndex: 168
    SolutionNameMin: Cijk_Alik_Bljk_BBS_BH_MT64x64x128_MI16x16x16x1_SN_AMAS3_ETSP_GLVWA8_GLVWB8_GRVW8_GSU1_GSUASB_LBSPPA512_LBSPPB512_LPA16_LPB16_PLR5_PKA0_SS1_SVW2_TT2_64_VW2_VWB2_WG32_4_2
    SolutionIndex: 169
    SolutionNameMin: Cijk_Alik_Bljk_BBS_BH_MT64x64x64_MI16x16x16x1_SN_AMAS3_ETB_GLVWA8_GLVWB8_GRVW8_GSU1_GSUASB_LBSPPA256_LBSPPB256_LPA16_LPB16_PLR5_PKA1_SS1_SVW2_TT2_32_VW2_VWB2_WG32_8_1
    SolutionIndex: 170
    SolutionNameMin: Cijk_Alik_Bljk_BBS_BH_MT64x64x128_MI16x16x16x1_SN_AMAS0_ETSP_GLVWA8_GLVWB8_GRVW8_GSU1_GSUASB_LBSPPA256_LBSPPB512_LPA16_LPB16_PLR9_PKA0_SS1_SVW1_TT2_32_VW1_VWB2_WG32_8_1
    SolutionIndex: 171
    SolutionNameMin: Cijk_Alik_Bljk_BBS_BH_MT64x64x128_MI16x16x16x1_SN_AMAS3_ETB_GLVWA8_GLVWB8_GRVW8_GSU1_GSUASB_LBSPPA512_LBSPPB512_LPA16_LPB16_PLR5_PKA1_SS1_SVW2_TT2_64_VW2_VWB2_WG32_4_2
    SolutionIndex: 172
    SolutionNameMin: Cijk_Alik_Bljk_BBS_BH_MT64x64x128_MI16x16x16x1_SN_AMAS0_ETSP_GLVWA8_GLVWB8_GRVW8_GSU1_GSUASB_LBSPPA256_LBSPPB512_LPA16_LPB16_PLR5_PKA0_SS1_SVW1_TT2_64_VW1_VWB2_WG32_4_2
    SolutionIndex: 173
    SolutionNameMin: Cijk_Alik_Bljk_BBS_BH_MT64x64x128_MI16x16x16x1_SN_AMAS0_ETB_GLVWA8_GLVWB8_GRVW8_GSU1_GSUASB_LBSPPA256_LBSPPB512_LPA16_LPB16_PLR5_PKA1_SS1_SVW1_TT2_64_VW1_VWB2_WG32_4_2
    SolutionIndex: 174
    SolutionNameMin: Cijk_Alik_Bljk_BBS_BH_MT32x128x128_MI16x16x16x1_SN_AMAS3_ETSP_GLVWA8_GLVWB8_GRVW8_GSU1_GSUASB_LBSPPA512_LBSPPB512_LPA16_LPB16_PLR5_PKA0_SS1_SVW2_TT2_64_VW2_VWB2_WG16_8_2
    SolutionIndex: 175
    SolutionNameMin: Cijk_Alik_Bljk_BBS_BH_MT64x64x128_MI16x16x16x1_SN_AMAS3_ETB_GLVWA8_GLVWB8_GRVW8_GSU1_GSUASB_LBSPPA512_LBSPPB512_LPA16_LPB16_PLR9_PKA1_SS1_SVW2_TT2_32_VW2_VWB2_WG32_8_1
    SolutionIndex: 176
    SolutionNameMin: Cijk_Alik_Bljk_BBS_BH_MT32x128x128_MI16x16x16x1_SN_AMAS0_ETSP_GLVWA8_GLVWB8_GRVW8_GSU1_GSUASB_LBSPPA256_LBSPPB512_LPA16_LPB16_PLR5_PKA0_SS1_SVW1_TT2_64_VW1_VWB2_WG16_8_2
    SolutionIndex: 177
    SolutionNameMin: Cijk_Alik_Bljk_BBS_BH_MT64x32x256_MI16x16x16x1_SN_AMAS3_ETSP_GLVWA8_GLVWB8_GRVW8_GSU1_GSUASB_LBSPPA1024_LBSPPB1024_LPA16_LPB16_PLR9_PKA0_SS1_SVW2_TT2_32_VW2_VWB2_WG32_4_2
    SolutionIndex: 178
    SolutionNameMin: Cijk_Alik_Bljk_BBS_BH_MT64x128x128_MI16x16x16x1_SN_AMAS3_ETSP_GLVWA8_GLVWB8_GRVW8_GSU1_GSUASB_LBSPPA512_LBSPPB512_LPA16_LPB16_PLR9_PKA0_SS1_SVW2_TT2_64_VW2_VWB2_WG32_8_1
    SolutionIndex: 179
    SolutionNameMin: Cijk_Alik_Bljk_BBS_BH_MT64x128x64_MI16x16x16x1_SN_AMAS3_ETSP_GLVWA8_GLVWB8_GRVW8_GSU1_GSUASB_LBSPPA256_LBSPPB256_LPA16_LPB16_PLR5_PKA0_SS1_SVW2_TT2_64_VW2_VWB2_WG32_8_1
    SolutionIndex: 180
    SolutionNameMin: Cijk_Alik_Bljk_BBS_BH_MT64x128x128_MI16x16x16x1_SN_AMAS0_ETB_GLVWA8_GLVWB8_GRVW8_GSU1_GSUASB_LBSPPA256_LBSPPB512_LPA16_LPB16_PLR9_PKA1_SS1_SVW1_TT2_64_VW1_VWB2_WG32_8_1
    SolutionIndex: 181
    SolutionNameMin: Cijk_Alik_Bljk_BBS_BH_MT64x128x128_MI16x16x16x1_SN_AMAS3_ETB_GLVWA8_GLVWB8_GRVW8_GSU1_GSUASB_LBSPPA512_LBSPPB512_LPA16_LPB16_PLR5_PKA1_SS1_SVW2_TT2_128_VW2_VWB2_WG32_4_2
    SolutionIndex: 182
    SolutionNameMin: Cijk_Alik_Bljk_BBS_BH_MT64x128x128_MI16x16x16x1_SN_AMAS3_ETSP_GLVWA8_GLVWB8_GRVW8_GSU1_GSUASB_LBSPPA512_LBSPPB512_LPA16_LPB16_PLR5_PKA0_SS1_SVW2_TT2_128_VW2_VWB2_WG32_4_2
    SolutionIndex: 183
    SolutionNameMin: Cijk_Alik_Bljk_BBS_BH_MT64x128x128_MI16x16x16x1_SN_AMAS0_ETSP_GLVWA8_GLVWB8_GRVW8_GSU1_GSUASB_LBSPPA256_LBSPPB512_LPA16_LPB16_PLR9_PKA0_SS0_SVW4_TT2_64_VW1_VWB2_WG32_8_1
    SolutionIndex: 184
    SolutionNameMin: Cijk_Alik_Bljk_BBS_BH_MT64x128x128_MI16x16x16x1_SN_AMAS0_ETSP_GLVWA8_GLVWB8_GRVW8_GSU1_GSUASB_LBSPPA256_LBSPPB512_LPA16_LPB16_PLR5_PKA0_SS1_SVW1_TT2_128_VW1_VWB2_WG32_4_2
    SolutionIndex: 185
    SolutionNameMin: Cijk_Alik_Bljk_BBS_BH_MT64x128x128_MI16x16x16x1_SN_AMAS0_ETSP_GLVWA8_GLVWB8_GRVW8_GSU1_GSUASB_LBSPPA256_LBSPPB512_LPA16_LPB16_PLR5_PKA0_SS0_SVW4_TT2_128_VW1_VWB2_WG32_4_2
    SolutionIndex: 186
    SolutionNameMin: Cijk_Alik_Bljk_BBS_BH_MT128x16x128_MI16x16x16x1_SN_AMAS3_ETSP_ELFLR4_GLVWA8_GLVWB4_GSU1_GSUASB_LBSPPA1024_LBSPPB256_NTA0_PLR5_PKA0_SS1_SVW4_TT4_16_VW4_WG32_4_2
    SolutionIndex: 187
    SolutionNameMin: Cijk_Alik_Bljk_BBS_BH_MT64x16x128_MI16x16x16x1_SN_AMAS0_ETB_ELFLR0_GLVWA8_GLVWB8_GSU1_GSUASB_LBSPPA256_LBSPPB256_NTA4_PLR9_PKA1_SS0_SVW4_TT1_16_VW1_WG64_4_1
    SolutionIndex: 188
    SolutionNameMin: Cijk_Alik_Bljk_BBS_BH_MT64x16x128_MI16x16x16x1_SN_AMAS0_ETB_ELFLR4_GLVWA8_GLVWB4_GSU1_GSUASB_LBSPPA256_LBSPPB256_NTA4_PLR9_PKA1_SS0_SVW4_TT1_16_VW1_WG64_4_1
    SolutionIndex: 189
    SolutionNameMin: Cijk_Alik_Bljk_BBS_BH_MT64x16x128_MI16x16x16x1_SN_AMAS0_ETB_ELFLR4_GLVWA8_GLVWB8_GSU1_GSUASB_LBSPPA256_LBSPPB256_NTA4_PLR9_PKA1_SS0_SVW4_TT1_16_VW1_WG64_4_1
    SolutionIndex: 190
    SolutionNameMin: Cijk_Alik_Bljk_BBS_BH_MT16x32x128_MI16x16x16x1_SN_AMAS0_ETSP_ELFLR0_GLVWA4_GLVWB8_LBSPPA256_LBSPPB256_LPA16_LPB16_NTA0_PLR5_PKA0_SS1_SVW1_TT1_16_VW1_VWB1_WG16_8_2
    SolutionIndex: 191
    SolutionNameMin: Cijk_Alik_Bljk_BBS_BH_MT128x32x128_MI16x16x16x1_SN_AMAS3_ETSP_ELFLR0_GLVWA8_GLVWB8_LBSPPA512_LBSPPB256_LPA16_LPB16_NTA0_PLR9_PKA0_SS1_SVW2_TT4_16_VW2_VWB1_WG32_8_1
    SolutionIndex: 192
    SolutionNameMin: Cijk_Alik_Bljk_BBS_BH_MT128x32x128_MI16x16x16x1_SN_AMAS3_ETB_ELFLR4_GLVWA8_GLVWB8_LBSPPA512_LBSPPB512_LPA16_LPB16_NTA0_PLR5_PKA1_SS0_SVW4_TT4_32_VW2_VWB2_WG32_4_2
    SolutionIndex: 193
    SolutionNameMin: Cijk_Alik_Bljk_BBS_BH_MT64x32x128_MI32x32x8x1_SN_AMAS3_ETB_ELFLR0_GLVWA8_GLVWB8_LBSPPA512_LBSPPB256_LPA8_LPB8_NTA4_PLR5_PKA1_SS1_SVW2_TT2_32_VW2_VWB1_WG32_2_4
    SolutionIndex: 194
    SolutionNameMin: Cijk_Alik_Bljk_BBS_BH_MT96x32x128_MI16x16x16x1_SN_AMAS0_ETSP_ELFLR4_GLVWA4_GLVWB8_LBSPPA256_LBSPPB256_LPA16_LPB16_NTA4_PLR9_PKA0_SS0_SVW4_TT3_16_VW1_VWB1_WG32_8_1
    SolutionIndex: 195
    SolutionNameMin: Cijk_Alik_Bljk_BBS_BH_MT128x32x128_MI16x16x16x1_SN_AMAS3_ETSP_GLVWA8_LBSPPA512_LBSPPB512_LPA16_LPB16_NTA0_PLR5_PKA0_SS1_SVW2_TT4_32_VW2_VWB2_WG32_4_2
    SolutionIndex: 196
    SolutionNameMin: Cijk_Alik_Bljk_BBS_BH_MT64x64x128_MI16x16x16x1_SN_AMAS0_ETSP_GLVWA8_LBSPPA256_LBSPPB512_LPA16_LPB16_NTA0_PLR5_PKA0_SS1_SVW1_TT2_64_VW1_VWB2_WG32_4_2
    SolutionIndex: 197
    SolutionNameMin: Cijk_Alik_Bljk_BBS_BH_MT128x32x128_MI16x16x16x1_SN_AMAS3_ETSP_GLVWA8_LBSPPA1024_LBSPPB512_LPA16_LPB16_NTA0_PLR5_PKA0_SS1_SVW4_TT4_32_VW4_VWB2_WG32_4_2
    SolutionIndex: 198
    SolutionNameMin: Cijk_Alik_Bljk_BBS_BH_MT64x64x128_MI16x16x16x1_SN_AMAS3_ETB_GLVWA8_LBSPPA1024_LBSPPB512_LPA16_LPB16_NTA0_PLR5_PKA1_SS1_SVW4_TT4_32_VW4_VWB2_WG16_8_2
    SolutionIndex: 199
    SolutionNameMin: Cijk_Alik_Bljk_BBS_BH_MT64x64x128_MI16x16x16x1_SN_AMAS3_ETB_GLVWA8_LBSPPA512_LBSPPB512_LPA16_LPB16_NTA0_PLR5_PKA1_SS1_SVW2_TT2_64_VW2_VWB2_WG32_4_2
    SolutionIndex: 200
    SolutionNameMin: Cijk_Alik_Bljk_BBS_BH_MT96x64x128_MI16x16x16x1_SN_AMAS0_ETB_GLVWA8_LBSPPA256_LBSPPB512_LPA16_LPB16_NTA0_PLR9_PKA1_SS1_SVW1_TT3_32_VW1_VWB2_WG32_8_1
    SolutionIndex: 201
    SolutionNameMin: Cijk_Alik_Bljk_BBS_BH_MT128x64x128_MI16x16x16x1_SN_AMAS3_ETB_GLVWA8_LBSPPA1024_LBSPPB512_LPA16_LPB16_NTA0_PLR5_PKA1_SS1_SVW4_TT4_64_VW4_VWB2_WG32_4_2
    SolutionIndex: 202
    SolutionNameMin: Cijk_Alik_Bljk_BBS_BH_MT96x64x128_MI16x16x16x1_SN_AMAS0_ETSP_GLVWA8_LBSPPA256_LBSPPB512_LPA16_LPB16_NTA4_PLR9_PKA0_SS1_SVW1_TT3_32_VW1_VWB2_WG32_8_1
    SolutionIndex: 203
    SolutionNameMin: Cijk_Alik_Bljk_BBS_BH_MT128x64x128_MI16x16x16x1_SN_AMAS3_ETSP_GLVWA8_LBSPPA1024_LBSPPB512_LPA16_LPB16_NTA4_PLR5_PKA0_SS0_SVW4_TT4_64_VW4_VWB2_WG32_4_2
    SolutionIndex: 204
    SolutionNameMin: Cijk_Alik_Bljk_BBS_BH_MT128x64x128_MI16x16x16x1_SN_AMAS0_ETB_GLVWA8_LBSPPA256_LBSPPB512_LPA16_LPB16_NTA4_PLR5_PKA1_SS1_SVW1_TT4_64_VW1_VWB2_WG32_4_2
    SolutionIndex: 205
    SolutionNameMin: Cijk_Alik_Bljk_BBS_BH_MT96x64x128_MI16x16x16x1_SN_AMAS0_ETB_GLVWA8_LBSPPA256_LBSPPB512_LPA16_LPB16_NTA4_PLR9_PKA1_SS0_SVW4_TT3_32_VW1_VWB2_WG32_8_1
    SolutionIndex: 206
    SolutionNameMin: Cijk_Alik_Bljk_BBS_BH_MT64x128x128_MI16x16x16x1_SN_AMAS3_ETSP_GLVWA8_LBSPPA512_LBSPPB512_LPA16_LPB16_PLR5_PKA0_SS1_SVW2_TT4_64_VW2_VWB2_WG16_8_2
    SolutionIndex: 207
    SolutionNameMin: Cijk_Alik_Bljk_BBS_BH_MT64x128x128_MI16x16x16x1_SN_AMAS3_ETB_GLVWA8_LBSPPA1024_LBSPPB512_LPA16_LPB16_PLR5_PKA1_SS1_SVW4_TT4_64_VW4_VWB2_WG16_8_2
    SolutionIndex: 208
    SolutionNameMin: Cijk_Alik_Bljk_BBS_BH_MT128x64x128_MI16x16x16x1_SN_AMAS3_ETSP_GLVWA8_LBSPPA512_LBSPPB512_LPA16_LPB16_PLR5_PKA0_SS1_SVW2_TT4_64_VW2_VWB2_WG32_4_2
    SolutionIndex: 209
    SolutionNameMin: Cijk_Alik_Bljk_BBS_BH_MT128x64x128_MI16x16x16x1_SN_AMAS3_ETSP_GLVWA8_LBSPPA1024_LBSPPB512_LPA16_LPB16_PLR5_PKA0_SS1_SVW4_TT4_64_VW4_VWB2_WG32_4_2
    SolutionIndex: 210
    SolutionNameMin: Cijk_Alik_Bljk_BBS_BH_MT96x128x128_MI16x16x16x1_SN_AMAS0_ETSP_LBSPPA256_LBSPPB512_LPA16_LPB16_LRVW8_MIAV1_NTA0_PLR9_PKA0_SS1_SU4_SUS256_SVW1_TT3_64_VW1_WG32_8_1
    SolutionIndex: 211
    SolutionNameMin: Cijk_Alik_Bljk_BBS_BH_MT96x128x128_MI16x16x16x1_SN_AMAS0_ETSP_LBSPPA256_LBSPPB512_LPA16_LPB16_LRVW8_MIAV1_NTA4_PLR9_PKA0_SS1_SU4_SUS256_SVW1_TT3_64_VW1_WG32_8_1
    SolutionIndex: 212
    SolutionNameMin: Cijk_Alik_Bljk_BBS_BH_MT128x128x64_MI16x16x16x1_SN_AMAS3_ETSP_LBSPPA256_LBSPPB256_LPA16_LPB16_LRVW8_MIAV1_NTA4_PLR5_PKA0_SS1_SU0_SUS0_SVW2_TT4_64_VW2_WG32_8_1
    SolutionIndex: 213
    SolutionNameMin: Cijk_Alik_Bljk_BBS_BH_MT128x128x64_MI16x16x16x1_SN_AMAS3_ETSP_LBSPPA256_LBSPPB256_LPA16_LPB16_LRVW8_MIAV0_NTA4_PLR5_PKA0_SS0_SU4_SUS256_SVW4_TT2_128_VW2_WG64_4_1
    SolutionIndex: 214
    SolutionNameMin: Cijk_Alik_Bljk_BBS_BH_MT192x128x64_MI16x16x16x1_SN_AMAS0_ETSP_LBSPPA128_LBSPPB256_LPA16_LPB16_LRVW8_MIAV1_NTA4_PLR5_PKA0_SS1_SU4_SUS256_SVW1_TT6_64_VW1_WG32_8_1
    SolutionIndex: 215
    SolutionNameMin: Cijk_Alik_Bljk_BBS_BH_MT96x128x128_MI16x16x16x1_SN_AMAS0_ETB_GLVWA8_LBSPPA256_LBSPPB512_LPA16_LPB16_PLR9_PKA1_SS1_SVW1_TT3_64_VW1_VWB2_WG32_8_1
    SolutionIndex: 216
    SolutionNameMin: Cijk_Alik_Bljk_BBS_BH_MT96x128x64_MI16x16x16x1_SN_AMAS0_ETSP_GLVWA8_LBSPPA128_LBSPPB256_LPA16_LPB16_PLR5_PKA0_SS1_SVW1_TT3_64_VW1_VWB2_WG32_8_1
    SolutionIndex: 217
    SolutionNameMin: Cijk_Alik_Bljk_BBS_BH_MT128x128x64_MI16x16x16x1_SN_AMAS3_ETSP_GLVWA8_LBSPPA512_LBSPPB256_LPA16_LPB16_PLR5_PKA0_SS1_SVW4_TT4_64_VW4_VWB2_WG32_8_1
    SolutionIndex: 218
    SolutionNameMin: Cijk_Alik_Bljk_BBS_BH_MT128x128x64_MI16x16x16x1_SN_AMAS3_ETB_GLVWA8_LBSPPA512_LBSPPB256_LPA16_LPB16_PLR5_PKA1_SS1_SVW4_TT4_64_VW4_VWB2_WG32_8_1
    SolutionIndex: 219
    SolutionNameMin: Cijk_Alik_Bljk_BBS_BH_MT128x128x64_MI16x16x16x1_SN_AMAS3_ETB_GLVWA8_LBSPPA512_LBSPPB256_LPA16_LPB16_PLR5_PKA1_SS0_SVW4_TT4_64_VW4_VWB2_WG32_8_1
    SolutionIndex: 220
    SolutionNameMin: Cijk_Alik_Bljk_BBS_BH_MT128x128x64_MI16x16x16x1_SN_AMAS0_ETB_GLVWA8_LBSPPA128_LBSPPB256_LPA16_LPB16_PLR5_PKA1_SS1_SVW1_TT4_64_VW1_VWB2_WG32_8_1
    SolutionIndex: 221
    SolutionNameMin: Cijk_Alik_Bljk_BBS_BH_MT192x128x64_MI16x16x16x1_SN_AMAS3_ETB_LBSPPA256_LBSPPB256_LPA16_LPB16_LRVW8_MIAV1_PLR5_PKA1_SS1_SU0_SUS0_SVW2_TT6_64_VW2_WG32_8_1
    SolutionIndex: 222
    SolutionNameMin: Cijk_Alik_Bljk_BBS_BH_MT192x128x64_MI16x16x16x1_SN_AMAS0_ETSP_LBSPPA128_LBSPPB256_LPA16_LPB16_LRVW8_MIAV0_PLR5_PKA0_SS1_SU4_SUS256_SVW1_TT6_64_VW1_WG32_8_1
    SolutionIndex: 223
    SolutionNameMin: Cijk_Alik_Bljk_BBS_BH_MT256x128x64_MI16x16x16x1_SN_AMAS3_ETSP_LBSPPA512_LBSPPB256_LPA16_LPB16_LRVW8_MIAV0_PLR5_PKA0_SS1_SU4_SUS256_SVW4_TT8_64_VW4_WG32_8_1
    SolutionIndex: 224
    SolutionNameMin: Cijk_Alik_Bljk_BBS_BH_MT192x256x64_MI16x16x16x1_SN_AMAS3_ETB_LBSPPA256_LBSPPB256_LPA16_LPB16_LRVW8_MIAV0_PLR5_PKA1_SS1_SU0_SUS0_SVW2_TT6_128_VW2_WG32_8_1
    SolutionIndex: 225
    SolutionNameMin: Cijk_Alik_Bljk_BBS_BH_MT32x16x256_MI16x16x16x1_SN_AMAS0_ETB_ELFLR4_GLVWB8_GSU1_GSUASB_LBSPPA512_LBSPPB512_NTA4_PLR5_PKA1_SS1_SVW1_TT2_16_VW1_WG16_4_4
    SolutionIndex: 226
    SolutionNameMin: Cijk_Alik_Bljk_BBS_BH_MT32x32x256_MI16x16x16x1_SN_AMAS3_ETB_GLVWB8_GSU1_GSUASB_LBSPPA1024_LBSPPB1024_LPA16_LPB16_NTA0_PLR5_PKA1_SVW2_TT2_32_VW2_VWB2_WG16_4_4
    SolutionIndex: 227
    SolutionNameMin: Cijk_Alik_Bljk_BBS_BH_MT32x32x256_MI16x16x16x1_SN_AMAS3_ETB_GLVWB8_GSU1_GSUASB_LBSPPA1024_LBSPPB1024_LPA16_LPB16_NTA4_PLR5_PKA1_SVW2_TT2_32_VW2_VWB2_WG16_4_4
    SolutionIndex: 228
    SolutionNameMin: Cijk_Alik_Bljk_BBS_BH_MT64x32x256_MI16x16x16x1_SN_AMAS0_ETB_GLVWB8_GSU1_GSUASB_LBSPPA512_LBSPPB1024_LPA16_LPB16_NTA0_PLR5_PKA1_SVW1_TT4_32_VW1_VWB2_WG16_4_4
    SolutionIndex: 229
    SolutionNameMin: Cijk_Alik_Bljk_BBS_BH_MT128x64x128_MI16x16x16x1_SN_AMAS3_ETB_GLVWB8_GSU4_GSUAMB_LBSPPA512_LBSPPB512_LPA16_LPB16_NTA4_PLR5_PKA1_SVW2_TT4_64_VW2_VWB2_WG32_4_2
    SolutionIndex: 230
    SolutionNameMin: Cijk_Alik_Bljk_BBS_BH_MT128x128x64_MI16x16x16x1_SN_AMAS0_ETB_GLVWB8_GSU7_GSUAMB_LBSPPA128_LBSPPB256_LPA16_LPB16_PLR5_PKA1_SVW1_TT4_64_VW1_VWB2_WG32_8_1
    SolutionIndex: 231
    SolutionNameMin: Cijk_Alik_Bljk_BBS_BH_MT64x64x128_MI16x16x16x1_SN_AMAS3_ETSP_GLVWB8_GSU1_GSUASB_LBSPPA512_LBSPPB512_LPA16_LPB16_PLR5_PKA0_SVW2_TT2_64_VW2_VWB2_WG32_4_2
    SolutionIndex: 232
    SolutionNameMin: Cijk_Alik_Bljk_BBS_BH_MT96x128x128_MI16x16x16x1_SN_AMAS0_ETB_GLVWB8_GSU7_GSUAMB_LBSPPA256_LBSPPB512_LPA16_LPB16_PLR9_PKA1_SVW1_TT3_64_VW1_VWB2_WG32_8_1
    SolutionIndex: 233
    SolutionNameMin: Cijk_Alik_Bljk_BBS_BH_MT128x64x128_MI16x16x16x1_SN_AMAS3_ETB_GLVWB8_GSU1_GSUASB_LBSPPA1024_LBSPPB512_LPA16_LPB16_PLR5_PKA1_SVW4_TT4_64_VW4_VWB2_WG32_4_2
    SolutionIndex: 234
    SolutionNameMin: Cijk_Alik_Bljk_BBS_BH_MT128x64x128_MI16x16x16x1_SN_AMAS3_ETSP_GLVWB8_GSU1_GSUASB_LBSPPA1024_LBSPPB512_LPA16_LPB16_PLR5_PKA0_SVW4_TT4_64_VW4_VWB2_WG32_4_2
    SolutionIndex: 235
    SolutionNameMin: Cijk_Alik_Bljk_BBS_BH_MT32x32x256_MI16x16x16x1_SN_AMAS0_GLS0_LBSPPA512_LBSPPB512_LPA16_LPB16_LRVW8_PLR9_SU0_SUS0_SSO0_SVW1_TT2_16_VW1_WG16_8_2_WGM16
    SolutionIndex: 236
    SolutionNameMin: Cijk_Alik_Bljk_BBS_BH_MT64x32x128_MI16x16x16x1_SN_AMAS3_GLS1_LBSPPA1024_LBSPPB256_LPA16_LPB16_LRVW8_PLR5_SU0_SUS0_SSO0_SVW4_TT4_16_VW4_WG16_8_2_WGM16
    SolutionIndex: 237
    SolutionNameMin: Cijk_Alik_Bljk_BBS_BH_MT64x64x128_MI16x16x16x1_SN_AMAS0_GLS0_LBSPPA256_LBSPPB256_LPA16_LPB16_LRVW8_PLR9_SU0_SUS0_SSO0_SVW1_TT4_16_VW1_WG16_16_1_WGM32
    SolutionIndex: 238
    SolutionNameMin: Cijk_Alik_Bljk_BBS_BH_MT64x64x128_MI16x16x16x1_SN_AMAS0_GLS0_LBSPPA256_LBSPPB256_LPA16_LPB16_LRVW8_PLR5_SU0_SUS0_SSO4_SVW1_TT4_32_VW1_WG16_8_2_WGM32
    SolutionIndex: 239
    SolutionNameMin: Cijk_Alik_Bljk_BBS_BH_MT128x64x128_MI16x16x16x1_SN_AMAS3_GLS0_LBSPPA512_LBSPPB256_LPA16_LPB16_LRVW8_PLR9_SU4_SUS256_SSO4_SVW2_TT4_32_VW2_WG32_8_1_WGM16
    SolutionIndex: 240
    SolutionNameMin: Cijk_Alik_Bljk_BBS_BH_MT128x64x128_MI16x16x16x1_SN_AMAS3_GLS0_LBSPPA1024_LBSPPB256_LPA16_LPB16_LRVW8_PLR9_SU0_SUS0_SSO4_SVW4_TT4_32_VW4_WG32_8_1_WGM16
    SolutionIndex: 241
    SolutionNameMin: Cijk_Alik_Bljk_BBS_BH_MT128x64x128_MI16x16x16x1_SN_AMAS3_GLS0_LBSPPA512_LBSPPB256_LPA16_LPB16_LRVW8_PLR9_SU0_SUS0_SSO0_SVW2_TT4_32_VW2_WG32_8_1_WGM32
    SolutionIndex: 242
    SolutionNameMin: Cijk_Alik_Bljk_BBS_BH_MT128x64x128_MI16x16x16x1_SN_AMAS3_GLS0_LBSPPA1024_LBSPPB256_LPA16_LPB16_LRVW8_PLR9_SU4_SUS256_SSO4_SVW4_TT4_32_VW4_WG32_8_1_WGM32
    SolutionIndex: 243
    SolutionNameMin: Cijk_Alik_Bljk_BBS_BH_MT96x128x128_MI16x16x16x1_SN_AMAS3_GLS1_LBSPPA512_LBSPPB256_LPA16_LPB16_LRVW8_PLR9_SU4_SUS256_SSO4_SVW2_TT6_32_VW2_WG16_16_1_WGM32
    SolutionIndex: 244
    SolutionNameMin: Cijk_Alik_Bljk_BBS_BH_MT96x128x128_MI16x16x16x1_SN_AMAS3_GLS1_LBSPPA512_LBSPPB256_LPA16_LPB16_LRVW8_PLR9_SU4_SUS256_SSO0_SVW2_TT6_32_VW2_WG16_16_1_WGM16
    SolutionIndex: 245
    SolutionNameMin: Cijk_Alik_Bljk_BBS_BH_MT96x128x128_MI16x16x16x1_SN_AMAS3_GLS1_LBSPPA512_LBSPPB256_LPA16_LPB16_LRVW8_PLR9_SU4_SUS256_SSO4_SVW2_TT6_32_VW2_WG16_16_1_WGM16
    SolutionIndex: 246
    SolutionNameMin: Cijk_Alik_Bljk_BBS_BH_MT96x128x128_MI16x16x16x1_SN_AMAS3_GLS0_LBSPPA512_LBSPPB256_LPA16_LPB16_LRVW8_PLR9_SU0_SUS0_SSO0_SVW2_TT6_32_VW2_WG16_16_1_WGM32
    SolutionIndex: 247
    SolutionNameMin: Cijk_Alik_Bljk_BBS_BH_MT96x128x128_MI16x16x16x1_SN_AMAS3_GLS0_LBSPPA512_LBSPPB256_LPA16_LPB16_LRVW8_PLR9_SU0_SUS0_SSO0_SVW2_TT6_32_VW2_WG16_16_1_WGM16
    SolutionIndex: 248
    SolutionNameMin: Cijk_Alik_Bljk_BBS_BH_MT128x128x64_MI16x16x16x1_SN_AMAS3_GLS0_LBSPPA512_LBSPPB128_LPA16_LPB16_LRVW8_PLR5_SU0_SUS0_SSO4_SVW4_TT4_64_VW4_WG32_8_1_WGM32
    SolutionIndex: 249
    SolutionNameMin: Cijk_Alik_Bljk_BBS_BH_MT128x128x64_MI16x16x16x1_SN_AMAS3_GLS0_LBSPPA256_LBSPPB128_LPA16_LPB16_LRVW8_PLR5_SU0_SUS0_SSO0_SVW2_TT4_64_VW2_WG32_8_1_WGM16
    SolutionIndex: 250
    SolutionNameMin: Cijk_Alik_Bljk_BBS_BH_MT128x128x64_MI16x16x16x1_SN_AMAS3_ELFLR0_GLVWA8_GLVWB8_LBSPPA512_LBSPPB128_LPA16_LPB16_LRVW8_MIAV1_PLR5_SU0_SUS0_SSO0_SVW4_TT4_64_VW4_WG32_8_1
    SolutionIndex: 251
    SolutionNameMin: Cijk_Alik_Bljk_BBS_BH_MT128x128x64_MI16x16x16x1_SN_AMAS3_ELFLR4_GLVWA8_GLVWB8_LBSPPA256_LBSPPB128_LPA16_LPB16_LRVW8_MIAV1_PLR5_SU0_SUS0_SSO6_SVW2_TT4_64_VW2_WG32_8_1
    SolutionIndex: 252
    SolutionNameMin: Cijk_Alik_Bljk_BBS_BH_MT128x128x64_MI16x16x16x1_SN_AMAS3_ELFLR4_GLVWA8_GLVWB8_LBSPPA512_LBSPPB128_LPA8_LPB8_LRVW4_MIAV1_PLR1_SU4_SUS256_SSO0_SVW4_TT4_64_VW4_WG32_8_1
    SolutionIndex: 253
    SolutionNameMin: Cijk_Alik_Bljk_BBS_BH_MT160x128x64_MI16x16x16x1_SN_AMAS3_ELFLR0_GLVWA2_GLVWB8_LBSPPA256_LBSPPB128_LPA16_LPB16_LRVW8_MIAV0_PLR5_SU4_SUS256_SSO6_SVW2_TT10_32_VW2_WG16_16_1
    SolutionIndex: 254
    SolutionNameMin: Cijk_Alik_Bljk_BBS_BH_MT144x128x64_MI16x16x16x1_SN_AMAS0_ELFLR0_GLVWA2_GLVWB8_LBSPPA128_LBSPPB128_LPA4_LPB8_LRVW4_MIAV0_PLR1_SU4_SUS256_SSO0_SVW1_TT9_32_VW1_WG16_16_1
    SolutionIndex: 255
    SolutionNameMin: Cijk_Alik_Bljk_BBS_BH_MT160x128x64_MI16x16x16x1_SN_AMAS3_ELFLR4_GLVWA8_GLVWB8_LBSPPA256_LBSPPB128_LPA16_LPB16_LRVW8_MIAV0_PLR5_SU4_SUS256_SSO0_SVW2_TT10_32_VW2_WG16_16_1
    SolutionIndex: 256
    SolutionNameMin: Cijk_Alik_Bljk_BBS_BH_MT160x128x64_MI16x16x16x1_SN_AMAS3_ELFLR4_GLVWA8_GLVWB8_LBSPPA256_LBSPPB128_LPA16_LPB16_LRVW8_MIAV0_PLR5_SU0_SUS0_SSO0_SVW2_TT10_32_VW2_WG16_16_1
    SolutionIndex: 257
    SolutionNameMin: Cijk_Alik_Bljk_BBS_BH_MT192x128x64_MI16x16x16x1_SN_AMAS3_ELFLR0_GLVWA2_GLVWB8_LBSPPA512_LBSPPB128_LPA16_LPB16_LRVW8_MIAV0_PLR5_SU0_SUS0_SSO0_SVW4_TT12_32_VW4_WG16_16_1
    SolutionIndex: 258
    SolutionNameMin: Cijk_Alik_Bljk_BBS_BH_MT192x128x64_MI16x16x16x1_SN_AMAS3_ELFLR0_GLVWA8_GLVWB8_LBSPPA512_LBSPPB128_LPA16_LPB16_LRVW8_MIAV0_PLR5_SU4_SUS256_SSO6_SVW4_TT12_32_VW4_WG16_16_1
    SolutionIndex: 259
    SolutionNameMin: Cijk_Alik_Bljk_BBS_BH_MT192x128x64_MI16x16x16x1_SN_AMAS3_ELFLR0_GLVWA4_GLVWB8_LBSPPA256_LBSPPB128_LPA16_LPB16_LRVW8_MIAV0_PLR5_SU4_SUS256_SSO6_SVW2_TT6_64_VW2_WG32_8_1
    SolutionIndex: 260
    SolutionNameMin: Cijk_Alik_Bljk_BBS_BH_MT192x128x64_MI16x16x16x1_SN_AMAS3_ELFLR0_GLVWA8_GLVWB8_LBSPPA256_LBSPPB128_LPA16_LPB16_LRVW8_MIAV0_PLR5_SU0_SUS0_SSO6_SVW2_TT6_64_VW2_WG32_8_1
    SolutionIndex: 261
    SolutionNameMin: Cijk_Alik_Bljk_BBS_BH_MT192x128x64_MI16x16x16x1_SN_AMAS0_ELFLR0_GLVWA8_GLVWB8_LBSPPA128_LBSPPB128_LPA16_LPB16_LRVW8_MIAV0_PLR5_SU0_SUS0_SSO6_SVW1_TT6_64_VW1_WG32_8_1
    SolutionIndex: 262
    SolutionNameMin: Cijk_Alik_Bljk_BBS_BH_MT256x128x64_MI16x16x16x1_SN_AMAS3_ELFLR0_GLVWA2_GLVWB8_LBSPPA512_LBSPPB128_LPA16_LPB16_LRVW8_MIAV0_PLR5_SU4_SUS256_SSO6_SVW4_TT8_64_VW4_WG32_8_1
    SolutionIndex: 263
    SolutionNameMin: Cijk_Alik_Bljk_BBS_BH_MT256x128x64_MI16x16x16x1_SN_AMAS3_GLVWA8_GLVWB8_LBSPPA256_LBSPPB128_LPA16_LPB16_LRVW8_MIAV0_PLR5_SU4_SUS256_SSO0_SVW2_TT8_64_VW2_WG32_8_1
    SolutionIndex: 264
    SolutionNameMin: Cijk_Alik_Bljk_BBS_BH_MT256x128x64_MI16x16x16x1_SN_AMAS3_ELFLR0_GLVWA2_GLVWB8_LBSPPA256_LBSPPB128_LPA4_LPB8_LRVW4_MIAV0_PLR5_SU4_SUS256_SSO0_SVW2_TT8_64_VW2_WG32_8_1
    SolutionIndex: 265
    SolutionNameMin: Cijk_Alik_Bljk_BBS_BH_MT256x128x64_MI16x16x16x1_SN_AMAS3_GLVWA8_GLVWB8_LBSPPA512_LBSPPB128_LPA16_LPB16_LRVW8_MIAV0_PLR5_SU0_SUS0_SSO0_SVW4_TT8_64_VW4_WG32_8_1
    SolutionIndex: 266
    SolutionNameMin: Cijk_Alik_Bljk_BBS_BH_MT256x128x64_MI16x16x16x1_SN_AMAS3_ELFLR4_GLVWA2_GLVWB8_LBSPPA512_LBSPPB128_LPA16_LPB16_LRVW8_MIAV0_PLR5_SU4_SUS256_SSO0_SVW4_TT8_64_VW4_WG32_8_1
    SolutionIndex: 267
    SolutionNameMin: Cijk_Alik_Bljk_BBS_BH_MT256x128x64_MI16x16x16x1_SN_AMAS3_ELFLR0_GLVWA8_GLVWB8_LBSPPA512_LBSPPB128_LPA16_LPB16_LRVW8_MIAV0_PLR5_SU4_SUS256_SSO0_SVW4_TT8_64_VW4_WG32_8_1
    SolutionIndex: 268
    SolutionNameMin: Cijk_Alik_Bljk_BBS_BH_MT256x128x64_MI16x16x16x1_SN_AMAS3_ELFLR4_GLVWA2_GLVWB8_LBSPPA512_LBSPPB128_LPA16_LPB16_LRVW8_MIAV0_PLR5_SU4_SUS256_SSO6_SVW4_TT8_64_VW4_WG32_8_1
    SolutionIndex: 269
    SolutionNameMin: Cijk_Alik_Bljk_BBS_BH_MT128x256x64_MI16x16x16x1_SN_AMAS3_ELFLR0_GLVWA2_GLVWB8_LBSPPA512_LBSPPB128_LPA16_LPB16_LRVW8_MIAV0_PLR5_SU4_SUS256_SSO6_SVW4_TT4_128_VW4_WG32_8_1
    SolutionIndex: 270
    SolutionNameMin: Cijk_Alik_Bljk_BBS_BH_MT256x128x64_MI16x16x16x1_SN_AMAS3_ELFLR0_GLVWA2_GLVWB8_LBSPPA512_LBSPPB128_LPA16_LPB16_LRVW8_MIAV0_PLR5_SU4_SUS256_SSO0_SVW4_TT8_64_VW4_WG32_8_1
    SolutionIndex: 271
    SolutionNameMin: Cijk_Alik_Bljk_BBS_BH_MT160x256x64_MI16x16x16x1_SN_AMAS3_ELFLR0_GLVWA8_GLVWB8_LBSPPA256_LBSPPB128_LPA16_LPB16_LRVW8_MIAV0_PLR5_SU0_SUS0_SSO6_SVW2_TT10_64_VW2_WG16_16_1
    SolutionIndex: 272
    SolutionNameMin: Cijk_Alik_Bljk_BBS_BH_MT160x256x64_MI16x16x16x1_SN_AMAS3_ELFLR4_GLVWA2_GLVWB8_LBSPPA256_LBSPPB128_LPA16_LPB16_LRVW8_MIAV0_PLR5_SU4_SUS256_SSO6_SVW2_TT10_64_VW2_WG16_16_1
    SolutionIndex: 273
    SolutionNameMin: Cijk_Alik_Bljk_BBS_BH_MT256x160x64_MI16x16x16x1_SN_AMAS3_GLVWA8_GLVWB8_LBSPPA512_LBSPPB128_LPA16_LPB16_LRVW8_MIAV0_PLR5_SU4_SUS256_SSO0_SVW4_TT4_160_VW4_WG64_4_1
    SolutionIndex: 274
    SolutionNameMin: Cijk_Alik_Bljk_BBS_BH_MT160x256x64_MI16x16x16x1_SN_AMAS0_ELFLR4_GLVWA2_GLVWB8_LBSPPA128_LBSPPB128_LPA4_LPB8_LRVW4_MIAV0_PLR5_SU4_SUS256_SSO6_SVW1_TT10_64_VW1_WG16_16_1
    SolutionIndex: 275
    SolutionNameMin: Cijk_Alik_Bljk_BBS_BH_MT160x256x64_MI16x16x16x1_SN_AMAS3_ELFLR4_GLVWA4_GLVWB8_LBSPPA256_LBSPPB128_LPA16_LPB16_LRVW8_MIAV0_PLR5_SU4_SUS256_SSO6_SVW2_TT10_64_VW2_WG16_16_1
    SolutionIndex: 276
    SolutionNameMin: Cijk_Alik_Bljk_BBS_BH_MT256x160x64_MI16x16x16x1_SN_AMAS3_ELFLR0_GLVWA8_GLVWB8_LBSPPA256_LBSPPB128_LPA16_LPB16_LRVW8_MIAV0_PLR5_SU0_SUS0_SSO0_SVW2_TT4_160_VW2_WG64_4_1
    SolutionIndex: 277
    SolutionNameMin: Cijk_Alik_Bljk_BBS_BH_MT160x256x64_MI16x16x16x1_SN_AMAS3_ELFLR4_GLVWA8_GLVWB8_LBSPPA256_LBSPPB128_LPA16_LPB16_LRVW8_MIAV0_PLR5_SU4_SUS256_SSO6_SVW2_TT10_64_VW2_WG16_16_1
    SolutionIndex: 278
    SolutionNameMin: Cijk_Alik_Bljk_BBS_BH_MT176x256x64_MI16x16x16x1_SN_AMAS0_ELFLR0_GLVWA2_GLVWB8_LBSPPA128_LBSPPB128_LPA4_LPB8_LRVW4_MIAV0_PLR5_SU4_SUS256_SSO0_SVW1_TT11_64_VW1_WG16_16_1
    SolutionIndex: 279
    SolutionNameMin: Cijk_Alik_Bljk_BBS_BH_MT192x256x64_MI16x16x16x1_SN_AMAS0_ELFLR4_GLVWA2_GLVWB2_LBSPPA128_LBSPPB128_LPA4_LPB4_LRVW4_MIAV0_PLR5_SU4_SUS256_SSO6_SVW1_TT6_128_VW1_WG32_8_1
    SolutionIndex: 280
    SolutionNameMin: Cijk_Alik_Bljk_BBS_BH_MT192x256x64_MI16x16x16x1_SN_AMAS3_ELFLR0_GLVWA2_GLVWB8_LBSPPA256_LBSPPB128_LPA4_LPB8_LRVW4_MIAV0_PLR5_SU4_SUS256_SSO0_SVW2_TT12_64_VW2_WG16_16_1
    SolutionIndex: 281
    SolutionNameMin: Cijk_Alik_Bljk_BBS_BH_MT192x256x64_MI16x16x16x1_SN_AMAS0_ELFLR4_GLVWA2_GLVWB8_LBSPPA128_LBSPPB128_LPA4_LPB8_LRVW4_MIAV0_PLR5_SU0_SUS0_SSO6_SVW1_TT12_64_VW1_WG16_16_1
    SolutionIndex: 282
    SolutionNameMin: Cijk_Alik_Bljk_BBS_BH_MT192x256x64_MI16x16x16x1_SN_AMAS3_ELFLR0_GLVWA2_GLVWB2_LBSPPA256_LBSPPB128_LPA4_LPB4_LRVW4_MIAV0_PLR5_SU4_SUS256_SSO0_SVW2_TT6_128_VW2_WG32_8_1
    SolutionIndex: 283
    SolutionNameMin: Cijk_Alik_Bljk_BBS_BH_MT192x256x64_MI16x16x16x1_SN_AMAS0_ELFLR4_GLVWA4_GLVWB8_LBSPPA128_LBSPPB128_LPA4_LPB8_LRVW4_MIAV0_PLR5_SU0_SUS0_SSO6_SVW1_TT6_128_VW1_WG32_8_1
    SolutionIndex: 284
    SolutionNameMin: Cijk_Alik_Bljk_BBS_BH_MT192x256x64_MI16x16x16x1_SN_AMAS3_ELFLR0_GLVWA4_GLVWB8_LBSPPA256_LBSPPB128_LPA4_LPB8_LRVW4_MIAV0_PLR5_SU0_SUS0_SSO0_SVW2_TT6_128_VW2_WG32_8_1
    SolutionIndex: 285
    SolutionNameMin: Cijk_Alik_Bljk_BBS_BH_MT192x256x64_MI16x16x16x1_SN_AMAS0_ELFLR4_GLVWA2_GLVWB8_LBSPPA128_LBSPPB128_LPA4_LPB8_LRVW4_MIAV0_PLR5_SU4_SUS256_SSO0_SVW1_TT12_64_VW1_WG16_16_1
    SolutionIndex: 286
    SolutionNameMin: Cijk_Alik_Bljk_BBS_BH_MT192x256x64_MI16x16x16x1_SN_AMAS3_ELFLR4_GLVWA2_GLVWB8_LBSPPA256_LBSPPB128_LPA4_LPB8_LRVW4_MIAV0_PLR5_SU4_SUS256_SSO6_SVW2_TT12_64_VW2_WG16_16_1
    SolutionIndex: 287
    SolutionNameMin: Cijk_Alik_Bljk_BBS_BH_MT192x256x64_MI16x16x16x1_SN_AMAS3_ELFLR0_GLVWA2_GLVWB8_LBSPPA512_LBSPPB128_LPA4_LPB8_LRVW4_MIAV0_PLR5_SU4_SUS256_SSO6_SVW4_TT12_64_VW4_WG16_16_1
    SolutionIndex: 288
    SolutionNameMin: Cijk_Alik_Bljk_BBS_BH_MT224x256x64_MI16x16x16x1_SN_AMAS0_ELFLR4_GLVWA2_GLVWB2_LBSPPA128_LBSPPB128_LPA4_LPB4_LRVW4_MIAV0_PLR5_SU0_SUS0_SSO0_SVW1_TT7_128_VW1_WG32_8_1
    SolutionIndex: 289
    SolutionNameMin: Cijk_Alik_Bljk_BBS_BH_MT208x256x64_MI16x16x16x1_SN_AMAS0_ELFLR0_GLVWA2_GLVWB8_LBSPPA128_LBSPPB128_LPA4_LPB8_LRVW4_MIAV0_PLR5_SU4_SUS256_SSO6_SVW1_TT13_64_VW1_WG16_16_1
    SolutionIndex: 290
    SolutionNameMin: Cijk_Alik_Bljk_BBS_BH_MT208x256x64_MI16x16x16x1_SN_AMAS0_ELFLR4_GLVWA2_GLVWB8_LBSPPA128_LBSPPB128_LPA4_LPB8_LRVW4_MIAV0_PLR5_SU4_SUS256_SSO6_SVW1_TT13_64_VW1_WG16_16_1
    SolutionIndex: 291
    SolutionNameMin: Cijk_Alik_Bljk_BBS_BH_MT224x256x64_MI16x16x16x1_SN_AMAS0_ELFLR4_GLVWA4_GLVWB4_LBSPPA128_LBSPPB128_LPA4_LPB4_LRVW4_MIAV0_PLR5_SU0_SUS0_SSO6_SVW1_TT7_128_VW1_WG32_8_1
    SolutionIndex: 292
    SolutionNameMin: Cijk_Alik_Bljk_BBS_BH_MT224x256x64_MI16x16x16x1_SN_AMAS0_ELFLR0_GLVWA2_GLVWB2_LBSPPA128_LBSPPB128_LPA4_LPB4_LRVW4_MIAV0_PLR5_SU4_SUS256_SSO0_SVW1_TT7_128_VW1_WG32_8_1
    SolutionIndex: 293
    SolutionNameMin: Cijk_Alik_Bljk_BBS_BH_MT128x256x64_MI16x16x16x1_SN_AMAS3_ELFLR4_GLVWA8_GLVWB8_LBSPPA512_LBSPPB128_LPA16_LPB16_LRVW8_PLR5_SU4_SUS256_SSO6_SVW4_TT4_128_VW4_WG32_8_1
    SolutionIndex: 294
    SolutionNameMin: Cijk_Alik_Bljk_BBS_BH_MT224x256x64_MI16x16x16x1_SN_AMAS3_ELFLR0_GLVWA2_GLVWB4_LBSPPA256_LBSPPB128_LPA4_LPB4_LRVW4_PLR5_SU4_SUS256_SSO0_SVW2_TT14_64_VW2_WG16_16_1
    SolutionIndex: 295
    SolutionNameMin: Cijk_Alik_Bljk_BBS_BH_MT224x256x64_MI16x16x16x1_SN_AMAS0_ELFLR4_GLVWA2_GLVWB2_LBSPPA128_LBSPPB128_LPA4_LPB4_LRVW4_PLR5_SU4_SUS256_SSO0_SVW1_TT7_128_VW1_WG32_8_1
    SolutionIndex: 296
    SolutionNameMin: Cijk_Alik_Bljk_BBS_BH_MT256x256x32_MI32x32x8x1_SN_AMAS3_ELFLR4_GLVWA8_GLS0_LBSPPA128_LBSPPB128_LPA8_LPB8_LRVW8_PLR5_SU32_SUS128_SSO6_SVW2_TT8_64_VW2_WG32_8_1_WGM32
    SolutionIndex: 297
    SolutionNameMin: Cijk_Alik_Bljk_BBS_BH_MT256x256x32_MI16x16x16x1_SN_AMAS3_ELFLR0_GLVWA2_GLS0_LBSPPA256_LBSPPB128_LPA4_LPB8_LRVW4_PLR3_SU32_SUS256_SSO6_SVW4_TT16_64_VW4_WG16_16_1_WGM32
    SolutionIndex: 298
    SolutionNameMin: Cijk_Alik_Bljk_BBS_BH_MT256x256x32_MI16x16x16x1_SN_AMAS3_ELFLR0_GLVWA2_GLS1_LBSPPA256_LBSPPB128_LPA4_LPB8_LRVW4_PLR3_SU32_SUS256_SSO6_SVW4_TT16_64_VW4_WG16_16_1_WGM32
    SolutionIndex: 299
    SolutionNameMin: Cijk_Alik_Bljk_BBS_BH_MT256x256x32_MI32x32x8x1_SN_AMAS3_ELFLR4_GLVWA8_GLS1_LBSPPA128_LBSPPB128_LPA8_LPB8_LRVW8_PLR5_SU32_SUS256_SSO6_SVW2_TT4_128_VW2_WG64_4_1_WGM32
    SolutionIndex: 300
    SolutionNameMin: Cijk_Alik_Bljk_BBS_BH_MT256x128x64_MI16x16x16x1_SN_AMAS3_ELFLR0_GLVWA2_GLVWB8_LBSPPA256_LBSPPB128_LPA16_LPB16_LRVW8_PLR5_SU4_SUS256_SSO0_SVW2_TT8_64_VW2_WG32_8_1
    SolutionIndex: 301
    SolutionNameMin: Cijk_Alik_Bljk_BBS_BH_MT256x256x32_MI16x16x16x1_SN_AMAS3_ELFLR4_GLVWA2_GLS1_LBSPPA128_LBSPPB128_LPA4_LPB8_LRVW4_PLR3_SU32_SUS128_SSO0_SVW2_TT8_128_VW2_WG32_8_1_WGM32
    SolutionIndex: 302
    SolutionNameMin: Cijk_Alik_Bljk_BBS_BH_MT256x256x32_MI16x16x16x1_SN_AMAS3_ELFLR0_GLVWA2_GLS1_LBSPPA128_LBSPPB128_LPA4_LPB8_LRVW4_PLR3_SU32_SUS128_SSO6_SVW2_TT16_64_VW2_WG16_16_1_WGM32
    SolutionIndex: 303
    SolutionNameMin: Cijk_Alik_Bljk_BBS_BH_MT256x256x32_MI16x16x16x1_SN_AMAS3_ELFLR4_GLVWA2_GLS1_LBSPPA128_LBSPPB128_LPA4_LPB8_LRVW4_PLR3_SU32_SUS128_SSO6_SVW2_TT16_64_VW2_WG16_16_1_WGM32
    SolutionIndex: 304
    SolutionNameMin: Cijk_Alik_Bljk_BBS_BH_MT256x256x32_MI16x16x16x1_SN_ELFLR4_GLVWA2_LBSPPA128_LPA4_LRVW4_PLR3_SU16_SUS256_SVW2_TT16_64_VW2_WG16_16_1
    SolutionIndex: 305
    SolutionNameMin: Cijk_Alik_Bljk_BBS_BH_MT256x256x32_MI16x16x16x1_SN_ELFLR0_GLVWA2_LBSPPA128_LPA4_LRVW4_PLR3_SU16_SUS256_SVW2_TT16_64_VW2_WG16_16_1
    SolutionIndex: 306
    SolutionNameMin: Cijk_Alik_Bljk_BBS_BH_MT224x160x64_MI16x16x16x1_SN_AMAS0_GLVWA8_GLVWB8_LBSPPA128_LBSPPB128_LPA16_LPB16_LRVW8_MIAV0_SU0_SUS0_SSO0_SVW1_TT7_80_VW1_WG32_8_1
    SolutionIndex: 307
    SolutionNameMin: Cijk_Alik_Bljk_BBS_BH_MT192x192x64_MI16x16x16x1_SN_AMAS3_GLVWA8_GLVWB8_LBSPPA256_LBSPPB128_LPA16_LPB16_LRVW8_MIAV0_SU0_SUS0_SSO0_SVW2_TT6_96_VW2_WG32_8_1
    SolutionIndex: 308
    SolutionNameMin: Cijk_Alik_Bljk_BBS_BH_MT160x256x64_MI16x16x16x1_SN_AMAS3_ELFLR0_GLVWA8_GLVWB8_LBSPPA256_LBSPPB128_LPA16_LPB16_LRVW8_PLR5_SU4_SUS256_SSO6_SVW2_TT10_64_VW2_WG16_16_1
    SolutionIndex: 309
    SolutionNameMin: Cijk_Alik_Bljk_BBS_BH_MT160x256x64_MI16x16x16x1_SN_AMAS3_ELFLR0_GLVWA2_GLVWB8_LBSPPA256_LBSPPB128_LPA16_LPB16_LRVW8_PLR5_SU0_SUS0_SSO6_SVW2_TT10_64_VW2_WG16_16_1
    SolutionIndex: 310
    SolutionNameMin: Cijk_Alik_Bljk_BBS_BH_MT144x256x64_MI16x16x16x1_SN_AMAS0_ELFLR4_GLVWA2_GLVWB8_LBSPPA128_LBSPPB128_LPA16_LPB16_LRVW8_PLR5_SU0_SUS0_SSO6_SVW1_TT9_64_VW1_WG16_16_1
    SolutionIndex: 311
    SolutionNameMin: Cijk_Alik_Bljk_BBS_BH_MT144x256x64_MI16x16x16x1_SN_AMAS0_ELFLR4_GLVWA2_GLVWB8_LBSPPA128_LBSPPB128_LPA16_LPB16_LRVW8_PLR5_SU4_SUS256_SSO6_SVW1_TT9_64_VW1_WG16_16_1
    SolutionIndex: 312
    SolutionNameMin: Cijk_Alik_Bljk_BBS_BH_MT192x128x64_MI16x16x16x1_SN_AMAS3_ELFLR4_GLVWA8_GLVWB8_LBSPPA256_LBSPPB128_LPA16_LPB16_LRVW8_PLR5_SU0_SUS0_SSO6_SVW2_TT6_64_VW2_WG32_8_1
    SolutionIndex: 313
    SolutionNameMin: Cijk_Alik_Bljk_BBS_BH_MT160x256x64_MI16x16x16x1_SN_AMAS3_ELFLR0_GLVWA4_GLVWB8_LBSPPA256_LBSPPB128_LPA16_LPB16_LRVW8_PLR5_SU4_SUS256_SSO0_SVW2_TT10_64_VW2_WG16_16_1
    SolutionIndex: 314
    SolutionNameMin: Cijk_Alik_Bljk_BBS_BH_MT160x256x64_MI16x16x16x1_SN_AMAS3_ELFLR0_GLVWA4_GLVWB8_LBSPPA256_LBSPPB128_LPA16_LPB16_LRVW8_PLR5_SU0_SUS0_SSO0_SVW2_TT10_64_VW2_WG16_16_1
    SolutionIndex: 315
    SolutionNameMin: Cijk_Alik_Bljk_BBS_BH_MT256x160x64_MI16x16x16x1_SN_AMAS3_GLVWA2_GLVWB8_LBSPPA256_LBSPPB128_LPA16_LPB16_LRVW8_MIAV0_SU0_SUS0_SSO0_SVW2_TT8_80_VW2_WG32_8_1
    SolutionIndex: 316
    SolutionNameMin: Cijk_Alik_Bljk_BBS_BH_MT256x160x64_MI16x16x16x1_SN_AMAS3_ELFLR4_GLVWA8_GLVWB8_LBSPPA512_LBSPPB128_LPA16_LPB16_LRVW8_PLR5_SU4_SUS256_SSO0_SVW4_TT4_160_VW4_WG64_4_1
    SolutionIndex: 317
    SolutionNameMin: Cijk_Alik_Bljk_BBS_BH_MT256x160x64_MI16x16x16x1_SN_AMAS3_ELFLR0_GLVWA2_GLVWB8_LBSPPA512_LBSPPB128_LPA16_LPB16_LRVW8_PLR5_SU4_SUS256_SSO0_SVW4_TT4_160_VW4_WG64_4_1
    SolutionIndex: 318
    SolutionNameMin: Cijk_Alik_Bljk_BBS_BH_MT160x256x64_MI16x16x16x1_SN_AMAS3_ELFLR0_GLVWA2_GLVWB8_LBSPPA256_LBSPPB128_LPA16_LPB16_LRVW8_PLR5_SU0_SUS0_SSO0_SVW2_TT10_64_VW2_WG16_16_1
    SolutionIndex: 319
    SolutionNameMin: Cijk_Alik_Bljk_BBS_BH_MT160x256x64_MI16x16x16x1_SN_AMAS3_ELFLR4_GLVWA8_GLVWB8_LBSPPA256_LBSPPB128_LPA16_LPB16_LRVW8_PLR5_SU0_SUS0_SSO6_SVW2_TT10_64_VW2_WG16_16_1
    SolutionIndex: 320
    SolutionNameMin: Cijk_Alik_Bljk_BBS_BH_MT160x256x64_MI16x16x16x1_SN_AMAS3_ELFLR4_GLVWA2_GLVWB8_LBSPPA256_LBSPPB128_LPA16_LPB16_LRVW8_PLR5_SU4_SUS256_SSO0_SVW2_TT10_64_VW2_WG16_16_1
    SolutionIndex: 321
    SolutionNameMin: Cijk_Alik_Bljk_BBS_BH_MT256x160x64_MI16x16x16x1_SN_AMAS3_GLVWA8_GLVWB8_LBSPPA256_LBSPPB128_LPA16_LPB16_LRVW8_MIAV0_SU4_SUS256_SSO0_SVW2_TT8_80_VW2_WG32_8_1
    SolutionIndex: 322
    SolutionNameMin: Cijk_Alik_Bljk_BBS_BH_MT160x256x64_MI16x16x16x1_SN_AMAS3_ELFLR0_GLVWA8_GLVWB8_LBSPPA256_LBSPPB128_LPA16_LPB16_LRVW8_PLR5_SU0_SUS0_SSO6_SVW2_TT10_64_VW2_WG16_16_1
    SolutionIndex: 323
    SolutionNameMin: Cijk_Alik_Bljk_BBS_BH_MT160x256x64_MI16x16x16x1_SN_AMAS3_ELFLR4_GLVWA8_GLVWB8_LBSPPA256_LBSPPB128_LPA16_LPB16_LRVW8_PLR5_SU4_SUS256_SSO6_SVW2_TT10_64_VW2_WG16_16_1
    SolutionIndex: 324
    SolutionNameMin: Cijk_Alik_Bljk_BBS_BH_MT192x256x64_MI16x16x16x1_SN_AMAS3_ELFLR0_GLVWA4_GLVWB8_LBSPPA512_LBSPPB128_LPA4_LPB8_LRVW4_PLR5_SU4_SUS256_SSO6_SVW4_TT12_64_VW4_WG16_16_1
    SolutionIndex: 325
    SolutionNameMin: Cijk_Alik_Bljk_BBS_BH_MT224x128x64_MI16x16x16x1_SN_AMAS0_ELFLR4_GLVWA8_GLVWB8_LBSPPA128_LBSPPB128_LPA16_LPB16_LRVW8_PLR5_SU0_SUS0_SSO0_SVW1_TT7_64_VW1_WG32_8_1
    SolutionIndex: 326
    SolutionNameMin: Cijk_Alik_Bljk_BBS_BH_MT176x256x64_MI16x16x16x1_SN_AMAS0_GLVWA2_GLVWB8_LBSPPA128_LBSPPB128_LPA4_LPB8_LRVW4_MIAV0_SU0_SUS0_SSO0_SVW1_TT11_64_VW1_WG16_16_1
    SolutionIndex: 327
    SolutionNameMin: Cijk_Alik_Bljk_BBS_BH_MT176x256x64_MI16x16x16x1_SN_AMAS0_ELFLR4_GLVWA2_GLVWB8_LBSPPA128_LBSPPB128_LPA4_LPB8_LRVW4_PLR5_SU4_SUS256_SSO0_SVW1_TT11_64_VW1_WG16_16_1
    SolutionIndex: 328
    SolutionNameMin: Cijk_Alik_Bljk_BBS_BH_MT192x256x64_MI16x16x16x1_SN_AMAS0_ELFLR0_GLVWA2_GLVWB2_LBSPPA128_LBSPPB128_LPA4_LPB4_LRVW4_PLR5_SU0_SUS0_SSO0_SVW1_TT6_128_VW1_WG32_8_1
    SolutionIndex: 329
    SolutionNameMin: Cijk_Alik_Bljk_BBS_BH_MT192x256x64_MI16x16x16x1_SN_AMAS3_ELFLR4_GLVWA4_GLVWB8_LBSPPA512_LBSPPB128_LPA4_LPB8_LRVW4_PLR5_SU0_SUS0_SSO0_SVW4_TT12_64_VW4_WG16_16_1
    SolutionIndex: 330
    SolutionNameMin: Cijk_Alik_Bljk_BBS_BH_MT256x192x64_MI16x16x16x1_SN_AMAS3_GLVWA8_GLVWB8_LBSPPA512_LBSPPB128_LPA16_LPB16_LRVW8_MIAV0_SU4_SUS256_SSO0_SVW4_TT8_96_VW4_WG32_8_1
    SolutionIndex: 331
    SolutionNameMin: Cijk_Alik_Bljk_BBS_BH_MT256x224x64_MI16x16x16x1_SN_AMAS3_GLVWA2_GLVWB2_LBSPPA256_LBSPPB128_LPA4_LPB4_LRVW4_MIAV0_SU0_SUS0_SSO6_SVW2_TT8_112_VW2_WG32_8_1
    SolutionIndex: 332
    SolutionNameMin: Cijk_Alik_Bljk_BBS_BH_MT192x256x64_MI16x16x16x1_SN_AMAS3_ELFLR0_GLVWA4_GLVWB8_LBSPPA512_LBSPPB128_LPA4_LPB8_LRVW4_PLR5_SU0_SUS0_SSO6_SVW4_TT12_64_VW4_WG16_16_1
    SolutionIndex: 333
    SolutionNameMin: Cijk_Alik_Bljk_BBS_BH_MT192x256x64_MI16x16x16x1_SN_AMAS3_ELFLR0_GLVWA2_GLVWB8_LBSPPA512_LBSPPB128_LPA4_LPB8_LRVW4_PLR5_SU0_SUS0_SSO6_SVW4_TT12_64_VW4_WG16_16_1
    SolutionIndex: 334
    SolutionNameMin: Cijk_Alik_Bljk_BBS_BH_MT192x256x64_MI16x16x16x1_SN_AMAS3_ELFLR4_GLVWA4_GLVWB8_LBSPPA512_LBSPPB128_LPA4_LPB8_LRVW4_PLR5_SU4_SUS256_SSO6_SVW4_TT12_64_VW4_WG16_16_1
    SolutionIndex: 335
    SolutionNameMin: Cijk_Alik_Bljk_BBS_BH_MT192x256x64_MI16x16x16x1_SN_AMAS3_ELFLR4_GLVWA2_GLVWB8_LBSPPA256_LBSPPB128_LPA4_LPB8_LRVW4_PLR5_SU0_SUS0_SSO0_SVW2_TT12_64_VW2_WG16_16_1
    SolutionIndex: 336
    SolutionNameMin: Cijk_Alik_Bljk_BBS_BH_MT192x256x64_MI16x16x16x1_SN_AMAS3_ELFLR4_GLVWA2_GLVWB8_LBSPPA256_LBSPPB128_LPA4_LPB8_LRVW4_PLR5_SU4_SUS256_SSO0_SVW2_TT12_64_VW2_WG16_16_1
    SolutionIndex: 337
    SolutionNameMin: Cijk_Alik_Bljk_BBS_BH_MT192x256x64_MI16x16x16x1_SN_AMAS3_ELFLR4_GLVWA4_GLVWB8_LBSPPA256_LBSPPB128_LPA4_LPB8_LRVW4_PLR5_SU4_SUS256_SSO0_SVW2_TT12_64_VW2_WG16_16_1
    SolutionIndex: 338
    SolutionNameMin: Cijk_Alik_Bljk_BBS_BH_MT192x256x64_MI16x16x16x1_SN_AMAS0_ELFLR0_GLVWA2_GLVWB8_LBSPPA128_LBSPPB128_LPA4_LPB8_LRVW4_PLR5_SU0_SUS0_SSO0_SVW1_TT12_64_VW1_WG16_16_1
    SolutionIndex: 339
    SolutionNameMin: Cijk_Alik_Bljk_BBS_BH_MT192x256x64_MI16x16x16x1_SN_AMAS3_ELFLR0_GLVWA4_GLVWB8_LBSPPA256_LBSPPB128_LPA4_LPB8_LRVW4_PLR5_SU0_SUS0_SSO6_SVW2_TT12_64_VW2_WG16_16_1
    SolutionIndex: 340
    SolutionNameMin: Cijk_Alik_Bljk_BBS_BH_MT160x256x64_MI16x16x16x1_SN_AMAS3_ELFLR4_GLVWA8_GLVWB8_LBSPPA256_LBSPPB128_LPA16_LPB16_LRVW8_PLR5_SU4_SUS256_SSO0_SVW2_TT10_64_VW2_WG16_16_1
    SolutionIndex: 341
    SolutionNameMin: Cijk_Alik_Bljk_BBS_BH_MT208x256x64_MI16x16x16x1_SN_AMAS0_ELFLR0_GLVWA4_GLVWB8_LBSPPA128_LBSPPB128_LPA4_LPB8_LRVW4_PLR5_SU4_SUS256_SSO6_SVW1_TT13_64_VW1_WG16_16_1
    SolutionIndex: 342
    SolutionNameMin: Cijk_Alik_Bljk_BBS_BH_MT208x256x64_MI16x16x16x1_SN_AMAS0_ELFLR0_GLVWA2_GLVWB8_LBSPPA128_LBSPPB128_LPA4_LPB8_LRVW4_PLR5_SU0_SUS0_SSO6_SVW1_TT13_64_VW1_WG16_16_1
    SolutionIndex: 343
    SolutionNameMin: Cijk_Alik_Bljk_BBS_BH_MT208x256x64_MI16x16x16x1_SN_AMAS0_ELFLR0_GLVWA2_GLVWB8_LBSPPA128_LBSPPB128_LPA4_LPB8_LRVW4_PLR5_SU4_SUS256_SSO6_SVW1_TT13_64_VW1_WG16_16_1
    SolutionIndex: 344
    SolutionNameMin: Cijk_Alik_Bljk_BBS_BH_MT224x256x64_MI16x16x16x1_SN_AMAS3_ELFLR0_GLVWA2_GLVWB4_LBSPPA256_LBSPPB128_LPA4_LPB4_LRVW4_PLR5_SU4_SUS256_SSO6_SVW2_TT14_64_VW2_WG16_16_1
    SolutionIndex: 345
    SolutionNameMin: Cijk_Alik_Bljk_BBS_BH_MT256x224x64_MI16x16x16x1_SN_AMAS3_GLVWA2_GLVWB4_LBSPPA256_LBSPPB128_LPA4_LPB4_LRVW4_MIAV0_SU0_SUS0_SSO0_SVW2_TT8_112_VW2_WG32_8_1
    SolutionIndex: 346
    SolutionNameMin: Cijk_Alik_Bljk_BBS_BH_MT208x256x64_MI16x16x16x1_SN_AMAS0_ELFLR4_GLVWA4_GLVWB8_LBSPPA128_LBSPPB128_LPA4_LPB8_LRVW4_PLR5_SU4_SUS256_SSO0_SVW1_TT13_64_VW1_WG16_16_1
    SolutionIndex: 347
    SolutionNameMin: Cijk_Alik_Bljk_BBS_BH_MT208x256x64_MI16x16x16x1_SN_AMAS0_ELFLR4_GLVWA4_GLVWB8_LBSPPA128_LBSPPB128_LPA4_LPB8_LRVW4_PLR5_SU0_SUS0_SSO0_SVW1_TT13_64_VW1_WG16_16_1
    SolutionIndex: 348
    SolutionNameMin: Cijk_Alik_Bljk_BBS_BH_MT224x256x64_MI16x16x16x1_SN_AMAS0_ELFLR0_GLVWA2_GLVWB4_LBSPPA128_LBSPPB128_LPA4_LPB4_LRVW4_PLR5_SU4_SUS256_SSO6_SVW1_TT7_128_VW1_WG32_8_1
    SolutionIndex: 349
    SolutionNameMin: Cijk_Alik_Bljk_BBS_BH_MT224x256x64_MI16x16x16x1_SN_AMAS0_ELFLR4_GLVWA2_GLVWB2_LBSPPA128_LBSPPB128_LPA4_LPB4_LRVW4_PLR5_SU0_SUS0_SSO6_SVW1_TT7_128_VW1_WG32_8_1
    SolutionIndex: 350
    SolutionNameMin: Cijk_Alik_Bljk_BBS_BH_MT256x160x64_MI16x16x16x1_SN_AMAS3_ELFLR0_GLVWA4_GLVWB8_LBSPPA512_LBSPPB128_LPA16_LPB16_LRVW8_PLR5_SU4_SUS256_SSO0_SVW4_TT4_160_VW4_WG64_4_1
    SolutionIndex: 351
    SolutionNameMin: Cijk_Alik_Bljk_BBS_BH_MT160x256x64_MI16x16x16x1_SN_AMAS3_ELFLR0_GLVWA4_GLVWB8_LBSPPA256_LBSPPB128_LPA4_LPB8_LRVW4_PLR5_SU0_SUS0_SSO6_SVW2_TT10_64_VW2_WG16_16_1
    SolutionIndex: 352
    SolutionNameMin: Cijk_Alik_Bljk_BBS_BH_MT224x256x64_MI16x16x16x1_SN_AMAS0_ELFLR0_GLVWA4_GLVWB4_LBSPPA128_LBSPPB128_LPA4_LPB4_LRVW4_PLR5_SU4_SUS256_SSO0_SVW1_TT7_128_VW1_WG32_8_1
    SolutionIndex: 353
    SolutionNameMin: Cijk_Alik_Bljk_BBS_BH_MT224x256x64_MI16x16x16x1_SN_AMAS3_ELFLR4_GLVWA4_GLVWB4_LBSPPA256_LBSPPB128_LPA4_LPB4_LRVW4_PLR5_SU0_SUS0_SSO0_SVW2_TT14_64_VW2_WG16_16_1
    SolutionIndex: 354
    SolutionNameMin: Cijk_Alik_Bljk_BBS_BH_MT160x256x64_MI16x16x16x1_SN_AMAS3_ELFLR0_GLVWA8_GLVWB8_LBSPPA256_LBSPPB128_LPA16_LPB16_LRVW8_PLR5_SU0_SUS0_SSO0_SVW2_TT10_64_VW2_WG16_16_1
    SolutionIndex: 355
    SolutionNameMin: Cijk_Alik_Bljk_BBS_BH_MT256x160x64_MI16x16x16x1_SN_LBSPPA256_LPA16_LPB16_LRVW8_NEPBS0_PLR5_SU32_SUS256_SSO6_SVW2_TT4_160_VW2_WG64_4_1_WGMn32
    SolutionIndex: 356
    SolutionNameMin: Cijk_Alik_Bljk_BBS_BH_MT160x256x64_MI16x16x16x1_SN_AMAS3_ELFLR0_GLVWA4_GLS0_LBSPPA256_LBSPPB128_LPA16_LPB16_LRVW8_PLR5_SU32_SUS128_SSO6_SVW2_TT10_64_VW2_WG16_16_1_WGM32
    SolutionIndex: 357
    SolutionNameMin: Cijk_Alik_Bljk_BBS_BH_MT160x256x64_MI16x16x16x1_SN_AMAS3_ELFLR4_GLVWA8_GLVWB8_LBSPPA256_LBSPPB128_LPA16_LPB16_LRVW8_PLR5_SU0_SUS0_SSO0_SVW2_TT10_64_VW2_WG16_16_1
    SolutionIndex: 358
    SolutionNameMin: Cijk_Alik_Bljk_BBS_BH_MT160x256x64_MI16x16x16x1_SN_AMAS3_ELFLR0_GLVWA4_GLVWB8_LBSPPA256_LBSPPB128_LPA4_LPB8_LRVW4_PLR5_SU4_SUS256_SSO6_SVW2_TT10_64_VW2_WG16_16_1
    SolutionIndex: 359
    SolutionNameMin: Cijk_Alik_Bljk_BBS_BH_MT160x256x64_MI16x16x16x1_SN_AMAS3_ELFLR0_GLVWA2_GLS1_LBSPPA256_LBSPPB128_LPA16_LPB16_LRVW8_PLR5_SU32_SUS128_SSO6_SVW2_TT10_64_VW2_WG16_16_1_WGM32
    SolutionIndex: 360
    SolutionNameMin: Cijk_Alik_Bljk_BBS_BH_MT256x256x32_MI16x16x16x1_SN_AMAS3_ELFLR0_GLVWA2_GLS1_LBSPPA256_LBSPPB128_LPA4_LPB8_LRVW4_PLR3_SU32_SUS128_SSO0_SVW4_TT16_64_VW4_WG16_16_1_WGM32
    SolutionIndex: 361
    SolutionNameMin: Cijk_Alik_Bljk_BBS_BH_MT256x128x64_MI16x16x16x1_SN_AMAS3_GLVWA8_GLVWB8_LBSPPA512_LBSPPB128_LPA16_LPB16_LRVW8_MIAV0_SU0_SUS0_SSO6_SVW4_TT8_64_VW4_WG32_8_1
    SolutionIndex: 362
    SolutionNameMin: Cijk_Alik_Bljk_BBS_BH_MT256x256x32_MI16x16x16x1_SN_AMAS3_ELFLR4_GLVWA2_GLS0_LBSPPA256_LBSPPB128_LPA4_LPB8_LRVW4_PLR3_SU32_SUS128_SSO0_SVW4_TT16_64_VW4_WG16_16_1_WGM32
    SolutionIndex: 363
    SolutionNameMin: Cijk_Alik_Bljk_BBS_BH_MT256x256x32_MI16x16x16x1_SN_AMAS3_ELFLR4_GLVWA2_GLS0_LBSPPA128_LBSPPB128_LPA4_LPB8_LRVW4_PLR3_SU32_SUS128_SSO0_SVW2_TT16_64_VW2_WG16_16_1_WGM32
    SolutionIndex: 364
    SolutionNameMin: Cijk_Alik_Bljk_BBS_BH_MT256x256x32_MI16x16x16x1_SN_AMAS3_ELFLR4_GLVWA2_GLS0_LBSPPA128_LBSPPB128_LPA4_LPB8_LRVW4_PLR3_SU32_SUS256_SSO0_SVW2_TT8_128_VW2_WG32_8_1_WGM32
    SolutionIndex: 365
    SolutionNameMin: Cijk_Alik_Bljk_BBS_BH_MT256x256x32_MI32x32x8x1_SN_LBSPPA256_LPA8_LPB8_LRVW8_NEPBS0_PLR5_SU32_SUS128_SSO6_SVW4_TT4_128_VW4_WG64_4_1_WGM32
    SolutionIndex: 366
    SolutionNameMin: Cijk_Alik_Bljk_BBS_BH_MT128x256x64_MI16x16x16x1_SN_LBSPPA256_LPA16_LPB16_LRVW8_NEPBS16_PLR5_SU32_SUS256_SSO0_SVW2_TT4_128_VW2_WG32_8_1_WGM32
    SolutionIndex: 367
    SolutionNameMin: Cijk_Alik_Bljk_BBS_BH_MT256x256x32_MI32x32x8x1_SN_LBSPPA128_LPA8_LPB8_LRVW8_NEPBS0_PLR5_SU32_SUS128_SSO0_SVW2_TT4_128_VW2_WG64_4_1_WGM32
    SolutionIndex: 368
    SolutionNameMin: Cijk_Alik_Bljk_BBS_BH_MT256x256x32_MI16x16x16x1_SN_AMAS3_ELFLR0_GLVWA2_GLS0_LBSPPA256_LBSPPB128_LPA4_LPB8_LRVW4_PLR3_SU32_SUS256_SSO0_SVW4_TT8_128_VW4_WG32_8_1_WGM32
    SolutionIndex: 369
    SolutionNameMin: Cijk_Alik_Bljk_BBS_BH_MT128x256x64_MI16x16x16x1_SN_LBSPPA256_LPA16_LPB16_LRVW8_NEPBS0_PLR5_SU32_SUS128_SSO0_SVW2_TT4_128_VW2_WG32_8_1_WGMn32
    SolutionIndex: 370
    SolutionNameMin: Cijk_Alik_Bljk_BBS_BH_MT192x256x64_MI16x16x16x1_SN_AMAS3_ELFLR0_GLVWA2_GLVWB8_LBSPPA512_LBSPPB128_LPA4_LPB8_LRVW4_PLR5_SU4_SUS256_SSO6_SVW4_TT12_64_VW4_WG16_16_1
    SolutionIndex: 371
    SolutionNameMin: Cijk_Alik_Bljk_BBS_BH_MT176x256x64_MI16x16x16x1_SN_AMAS0_ELFLR4_GLVWA2_GLVWB8_LBSPPA128_LBSPPB128_LPA4_LPB8_LRVW4_PLR5_SU0_SUS0_SSO0_SVW1_TT11_64_VW1_WG16_16_1
    SolutionIndex: 372
    SolutionNameMin: Cijk_Alik_Bljk_BBS_BH_MT192x256x64_MI16x16x16x1_SN_AMAS3_ELFLR4_GLVWA4_GLVWB2_LBSPPA256_LBSPPB128_LPA4_LPB4_LRVW4_PLR5_SU4_SUS256_SSO6_SVW2_TT6_128_VW2_WG32_8_1
    SolutionIndex: 373
    SolutionNameMin: Cijk_Alik_Bljk_BBS_BH_MT64x32x256_MI16x16x16x1_SN_AMAS0_FL0_GLS0_LBSPPA512_LBSPPB512_LPA16_LPB16_LRVW8_MIAV1_PLR17_SU0_SUS0_SSO0_SVW1_TT2_16_VW1_WG32_8_1
    SolutionIndex: 374
    SolutionNameMin: Cijk_Alik_Bljk_BBS_BH_MT64x64x128_MI16x16x16x1_SN_AMAS3_FL0_GLS1_LBSPPA1024_LBSPPB256_LPA16_LPB16_LRVW8_MIAV1_PLR5_SU0_SUS0_SSO0_SVW4_TT4_32_VW4_WG16_8_2
    SolutionIndex: 375
    SolutionNameMin: Cijk_Alik_Bljk_BBS_BH_MT128x64x128_MI16x16x16x1_SN_AMAS3_FL0_GLS0_LBSPPA1024_LBSPPB256_LPA16_LPB16_LRVW8_MIAV1_PLR9_SU0_SUS0_SSO4_SVW4_TT4_32_VW4_WG32_8_1
    SolutionIndex: 376
    SolutionNameMin: Cijk_Alik_Bljk_BBS_BH_MT128x64x128_MI16x16x16x1_SN_AMAS0_FL0_GLS1_LBSPPA256_LBSPPB256_LPA16_LPB16_LRVW8_MIAV1_PLR5_SU0_SUS0_SSO4_SVW1_TT8_32_VW1_WG16_8_2
    SolutionIndex: 377
    SolutionNameMin: Cijk_Alik_Bljk_BBS_BH_MT96x128x128_MI16x16x16x1_SN_AMAS3_FL0_GLS0_LBSPPA512_LBSPPB256_LPA16_LPB16_LRVW8_MIAV1_PLR9_SU0_SUS0_SSO4_SVW2_TT6_32_VW2_WG16_16_1
    SolutionIndex: 378
    SolutionNameMin: Cijk_Alik_Bljk_BBS_BH_MT96x128x128_MI16x16x16x1_SN_AMAS0_FL0_GLS1_LBSPPA256_LBSPPB256_LPA16_LPB16_LRVW8_MIAV1_PLR9_SU0_SUS0_SSO4_SVW1_TT6_32_VW1_WG16_16_1
    SolutionIndex: 379
    SolutionNameMin: Cijk_Alik_Bljk_BBS_BH_MT128x128x64_MI16x16x16x1_SN_AMAS3_FL0_GLS0_LBSPPA256_LBSPPB128_LPA16_LPB16_LRVW8_MIAV1_PLR5_SU0_SUS0_SSO0_SVW2_TT4_64_VW2_WG32_8_1
    SolutionIndex: 380
    SolutionNameMin: Cijk_Alik_Bljk_BBS_BH_MT128x128x64_MI16x16x16x1_SN_AMAS3_FL0_GLS0_LBSPPA512_LBSPPB128_LPA16_LPB16_LRVW8_MIAV1_PLR5_SU0_SUS0_SSO0_SVW4_TT4_64_VW4_WG32_8_1
    SolutionIndex: 381
    SolutionNameMin: Cijk_Alik_Bljk_BBS_BH_MT128x128x64_MI16x16x16x1_SN_AMAS3_FL0_GLS0_LBSPPA256_LBSPPB128_LPA16_LPB16_LRVW8_MIAV1_PLR5_SU0_SUS0_SSO4_SVW2_TT4_64_VW2_WG32_8_1
    SolutionIndex: 382
    SolutionNameMin: Cijk_Alik_Bljk_BBS_BH_MT160x128x64_MI16x16x16x1_SN_AMAS3_GLVWA4_GLVWB8_LBSPPA256_LBSPPB128_LPA16_LPB16_LRVW8_SU0_SUS0_SVW2_TT10_32_VW2_WG16_16_1
    SolutionIndex: 383
    SolutionNameMin: Cijk_Alik_Bljk_BBS_BH_MT160x128x64_MI16x16x16x1_SN_AMAS0_GLVWA2_GLVWB8_LBSPPA128_LBSPPB128_LPA16_LPB16_LRVW8_SU4_SUS256_SVW1_TT5_64_VW1_WG32_8_1
    SolutionIndex: 384
    SolutionNameMin: Cijk_Alik_Bljk_BBS_BH_MT192x128x64_MI16x16x16x1_SN_AMAS3_GLVWA2_GLVWB8_LBSPPA512_LBSPPB128_LPA16_LPB16_LRVW8_PLR5_SU0_SUS0_SSO6_SVW4_TT12_32_VW4_WG16_16_1
    SolutionIndex: 385
    SolutionNameMin: Cijk_Alik_Bljk_BBS_BH_MT192x128x64_MI16x16x16x1_SN_AMAS3_GLVWA8_GLVWB8_LBSPPA512_LBSPPB128_LPA16_LPB16_LRVW8_SU4_SUS256_SVW4_TT12_32_VW4_WG16_16_1
    SolutionIndex: 386
    SolutionNameMin: Cijk_Alik_Bljk_BBS_BH_MT224x128x64_MI16x16x16x1_SN_AMAS0_GLVWA8_GLVWB8_LBSPPA128_LBSPPB128_LPA16_LPB16_LRVW8_PLR5_SU4_SUS256_SSO0_SVW1_TT7_64_VW1_WG32_8_1
    SolutionIndex: 387
    SolutionNameMin: Cijk_Alik_Bljk_BBS_BH_MT224x128x64_MI16x16x16x1_SN_AMAS3_GLVWA8_GLVWB8_LBSPPA256_LBSPPB128_LPA16_LPB16_LRVW8_PLR5_SU4_SUS256_SSO6_SVW2_TT14_32_VW2_WG16_16_1
    SolutionIndex: 388
    SolutionNameMin: Cijk_Alik_Bljk_BBS_BH_MT256x128x64_MI16x16x16x1_SN_AMAS3_GLVWA8_GLVWB8_LBSPPA512_LBSPPB128_LPA16_LPB16_LRVW8_PLR5_SU4_SUS256_SSO6_SVW4_TT8_64_VW4_WG32_8_1
    SolutionIndex: 389
    SolutionNameMin: Cijk_Alik_Bljk_BBS_BH_MT128x256x64_MI16x16x16x1_SN_AMAS3_GLVWA8_GLVWB8_LBSPPA256_LBSPPB128_LPA16_LPB16_LRVW8_PLR5_SU4_SUS256_SSO6_SVW2_TT4_128_VW2_WG32_8_1
    SolutionIndex: 390
    SolutionNameMin: Cijk_Alik_Bljk_BBS_BH_MT256x128x64_MI16x16x16x1_SN_AMAS3_GLVWA8_GLVWB8_LBSPPA256_LBSPPB128_LPA16_LPB16_LRVW8_PLR5_SU0_SUS0_SSO0_SVW2_TT8_64_VW2_WG32_8_1
    SolutionIndex: 391
    SolutionNameMin: Cijk_Alik_Bljk_BBS_BH_MT128x256x64_MI16x16x16x1_SN_AMAS3_GLVWA2_GLVWB8_LBSPPA256_LBSPPB128_LPA16_LPB16_LRVW8_PLR5_SU0_SUS0_SSO6_SVW2_TT4_128_VW2_WG32_8_1
    SolutionIndex: 392
    SolutionNameMin: Cijk_Alik_Bljk_BBS_BH_MT160x256x64_MI16x16x16x1_SN_AMAS3_GLVWA8_GLVWB8_LBSPPA256_LBSPPB128_LPA16_LPB16_LRVW8_SU0_SUS0_SVW2_TT10_64_VW2_WG16_16_1
    SolutionIndex: 393
    SolutionNameMin: Cijk_Alik_Bljk_BBS_BH_MT144x256x64_MI16x16x16x1_SN_AMAS0_GLVWA4_GLVWB8_LBSPPA128_LBSPPB128_LPA4_LPB8_LRVW4_PLR5_SU0_SUS0_SSO0_SVW1_TT9_64_VW1_WG16_16_1
    SolutionIndex: 394
    SolutionNameMin: Cijk_Alik_Bljk_BBS_BH_MT160x256x64_MI16x16x16x1_SN_AMAS3_GLVWA8_GLVWB8_LBSPPA256_LBSPPB128_LPA16_LPB16_LRVW8_PLR5_SU4_SUS256_SSO0_SVW2_TT10_64_VW2_WG16_16_1
    SolutionIndex: 395
    SolutionNameMin: Cijk_Alik_Bljk_BBS_BH_MT192x256x64_MI16x16x16x1_SN_AMAS3_GLVWA2_GLVWB8_LBSPPA512_LBSPPB128_LPA4_LPB8_LRVW4_NEPBS0_PLR5_SU0_SUS0_SSO6_SVW4_TT12_64_VW4_WG16_16_1
    SolutionIndex: 396
    SolutionNameMin: Cijk_Alik_Bljk_BBS_BH_MT192x256x64_MI16x16x16x1_SN_AMAS3_GLVWA2_GLVWB8_LBSPPA512_LBSPPB128_LPA4_LPB8_LRVW4_SU4_SUS256_SVW4_TT12_64_VW4_WG16_16_1
    SolutionIndex: 397
    SolutionNameMin: Cijk_Alik_Bljk_BBS_BH_MT192x256x64_MI16x16x16x1_SN_AMAS3_GLVWA2_GLVWB8_LBSPPA512_LBSPPB128_LPA4_LPB8_LRVW4_PLR5_SU0_SUS0_SSO0_SVW4_TT12_64_VW4_WG16_16_1
    SolutionIndex: 398
    SolutionNameMin: Cijk_Alik_Bljk_BBS_BH_MT208x256x64_MI16x16x16x1_SN_AMAS0_GLVWA4_GLVWB8_LBSPPA128_LBSPPB128_LPA4_LPB8_LRVW4_SU4_SUS256_SVW1_TT13_64_VW1_WG16_16_1
    SolutionIndex: 399
    SolutionNameMin: Cijk_Alik_Bljk_BBS_BH_MT224x256x64_MI16x16x16x1_SN_AMAS0_GLVWA2_GLVWB2_LBSPPA128_LBSPPB128_LPA4_LPB4_LRVW4_PLR5_SU4_SUS256_SSO6_SVW1_TT7_128_VW1_WG32_8_1
    SolutionIndex: 400
    SolutionNameMin: Cijk_Alik_Bljk_BBS_BH_MT224x256x64_MI16x16x16x1_SN_AMAS0_GLVWA2_GLVWB2_LBSPPA128_LBSPPB128_LPA4_LPB4_LRVW4_PLR5_SU4_SUS256_SSO0_SVW1_TT7_128_VW1_WG32_8_1
    SolutionIndex: 401
    SolutionNameMin: Cijk_Alik_Bljk_BBS_BH_MT256x256x32_MI16x16x16x1_SN_AMAS3_GLVWA4_GLVWB8_LBSPPA256_LBSPPB128_LPA4_LPB8_LRVW4_PLR3_SU4_SUS256_SPO0_SSO6_SVW4_TT8_128_VW4_WG32_8_1
    SolutionIndex: 402
    SolutionNameMin: Cijk_Alik_Bljk_BBS_BH_MT128x256x64_MI16x16x16x1_SN_AMAS3_GLVWA8_GLVWB8_LBSPPA256_LBSPPB128_LPA16_LPB16_LRVW8_SU4_SUS256_SSO0_SVW2_TT4_128_VW2_WG32_8_1
    SolutionIndex: 403
    SolutionNameMin: Cijk_Alik_Bljk_BBS_BH_MT256x256x32_MI16x16x16x1_SN_AMAS3_GLVWA2_GLVWB4_LBSPPA256_LBSPPB128_LPA4_LPB4_LRVW4_NEPBS16_PLR3_SU4_SUS256_SSO0_SVW4_TT8_128_VW4_WG32_8_1
    SolutionIndex: 404
    SolutionNameMin: Cijk_Alik_Bljk_BBS_BH_MT128x256x64_MI16x16x16x1_SN_AMAS3_GLVWA8_GLVWB8_LBSPPA256_LBSPPB128_LPA16_LPB16_LRVW8_PLR5_SU0_SUS0_SPO0_SSO0_SVW2_TT4_128_VW2_WG32_8_1
    SolutionIndex: 405
    SolutionNameMin: Cijk_Alik_Bljk_BBS_BH_MT160x256x64_MI16x16x16x1_SN_AMAS3_GLVWA2_GLVWB8_LBSPPA256_LBSPPB128_LPA4_LPB8_LRVW4_SU0_SUS0_SSO0_SVW2_TT10_64_VW2_WG16_16_1
    SolutionIndex: 406
    SolutionNameMin: Cijk_Alik_Bljk_BBS_BH_MT256x144x64_MI16x16x16x1_SN_AMAS3_GLVWA2_GLVWB2_LBSPPA256_LBSPPB128_LPA4_LPB4_LRVW4_SU4_SUS256_SSO0_SVW2_TT4_144_VW2_WG64_4_1
    SolutionIndex: 407
    SolutionNameMin: Cijk_Alik_Bljk_BBS_BH_MT192x128x64_MI16x16x16x1_SN_AMAS3_GLVWA8_GLVWB8_LBSPPA256_LBSPPB128_LPA16_LPB16_LRVW8_SU0_SUS0_SSO0_SVW2_TT6_64_VW2_WG32_8_1
    SolutionIndex: 408
    SolutionNameMin: Cijk_Alik_Bljk_BBS_BH_MT160x256x64_MI16x16x16x1_SN_AMAS0_GLVWA2_GLVWB2_LBSPPA128_LBSPPB128_LPA4_LPB4_LRVW4_SU4_SUS256_SSO6_SVW1_TT5_128_VW1_WG32_8_1
    SolutionIndex: 409
    SolutionNameMin: Cijk_Alik_Bljk_BBS_BH_MT256x160x64_MI16x16x16x1_SN_AMAS3_GLVWA2_GLVWB8_LBSPPA512_LBSPPB128_LPA16_LPB16_LRVW8_SU4_SUS256_SSO0_SVW4_TT4_160_VW4_WG64_4_1
    SolutionIndex: 410
    SolutionNameMin: Cijk_Alik_Bljk_BBS_BH_MT160x256x64_MI16x16x16x1_SN_AMAS3_GLVWA2_GLVWB8_LBSPPA256_LBSPPB128_LPA16_LPB16_LRVW8_SU4_SUS256_SSO6_SVW2_TT10_64_VW2_WG16_16_1
    SolutionIndex: 411
    SolutionNameMin: Cijk_Alik_Bljk_BBS_BH_MT160x256x64_MI16x16x16x1_SN_AMAS3_GLVWA4_GLVWB8_LBSPPA256_LBSPPB128_LPA16_LPB16_LRVW8_SU4_SUS256_SSO6_SVW2_TT10_64_VW2_WG16_16_1
    SolutionIndex: 412
    SolutionNameMin: Cijk_Alik_Bljk_BBS_BH_MT176x256x64_MI16x16x16x1_SN_AMAS0_GLVWA2_GLVWB4_LBSPPA128_LBSPPB128_LPA4_LPB4_LRVW4_SU4_SUS256_SSO0_SVW1_TT11_64_VW1_WG16_16_1
    SolutionIndex: 413
    SolutionNameMin: Cijk_Alik_Bljk_BBS_BH_MT192x256x64_MI16x16x16x1_SN_AMAS3_GLVWA2_GLVWB2_LBSPPA256_LBSPPB128_LPA4_LPB4_LRVW4_SU4_SUS256_SSO0_SVW2_TT6_128_VW2_WG32_8_1
    SolutionIndex: 414
    SolutionNameMin: Cijk_Alik_Bljk_BBS_BH_MT192x256x64_MI16x16x16x1_SN_AMAS3_GLVWA2_GLVWB2_LBSPPA256_LBSPPB128_LPA4_LPB4_LRVW4_SU0_SUS0_SSO0_SVW2_TT6_128_VW2_WG32_8_1
    SolutionIndex: 415
    SolutionNameMin: Cijk_Alik_Bljk_BBS_BH_MT176x256x64_MI16x16x16x1_SN_AMAS0_GLVWA2_GLVWB2_LBSPPA128_LBSPPB128_LPA4_LPB4_LRVW4_SU0_SUS0_SSO0_SVW1_TT11_64_VW1_WG16_16_1
    SolutionIndex: 416
    SolutionNameMin: Cijk_Alik_Bljk_BBS_BH_MT192x256x64_MI16x16x16x1_SN_AMAS3_GLVWA2_GLVWB2_LBSPPA256_LBSPPB128_LPA4_LPB4_LRVW4_SU4_SUS256_SSO0_SVW2_TT12_64_VW2_WG16_16_1
    SolutionIndex: 417
    SolutionNameMin: Cijk_Alik_Bljk_BBS_BH_MT192x256x64_MI16x16x16x1_SN_AMAS3_GLVWA4_GLVWB8_LBSPPA256_LBSPPB128_LPA4_LPB8_LRVW4_SU4_SUS256_SSO6_SVW2_TT12_64_VW2_WG16_16_1
    SolutionIndex: 418
    SolutionNameMin: Cijk_Alik_Bljk_BBS_BH_MT256x192x64_MI16x16x16x1_SN_AMAS3_GLVWA4_GLVWB4_LBSPPA512_LBSPPB128_LPA16_LPB16_LRVW8_SU4_SUS256_SSO6_SVW4_TT4_192_VW4_WG64_4_1
    SolutionIndex: 419
    SolutionNameMin: Cijk_Alik_Bljk_BBS_BH_MT192x256x64_MI16x16x16x1_SN_AMAS3_GLVWA2_GLVWB2_LBSPPA256_LBSPPB128_LPA4_LPB4_LRVW4_SU0_SUS0_SSO6_SVW2_TT6_128_VW2_WG32_8_1
    SolutionIndex: 420
    SolutionNameMin: Cijk_Alik_Bljk_BBS_BH_MT192x256x64_MI16x16x16x1_SN_AMAS3_GLVWA2_GLVWB8_LBSPPA512_LBSPPB128_LPA4_LPB8_LRVW4_SU4_SUS256_SSO6_SVW4_TT12_64_VW4_WG16_16_1
    SolutionIndex: 421
    SolutionNameMin: Cijk_Alik_Bljk_BBS_BH_MT256x224x64_MI16x16x16x1_SN_AMAS3_GLVWA2_GLVWB2_LBSPPA256_LBSPPB128_LPA4_LPB4_LRVW4_NEPBS16_PLR5_SU4_SUS128_SSO0_SVW2_TT8_112_VW2_WG32_8_1
    SolutionIndex: 422
    SolutionNameMin: Cijk_Alik_Bljk_BBS_BH_MT208x256x64_MI16x16x16x1_SN_AMAS0_GLVWA4_GLVWB8_LBSPPA128_LBSPPB128_LPA4_LPB8_LRVW4_NEPBS0_PLR5_SU0_SUS0_SSO6_SVW1_TT13_64_VW1_WG16_16_1
    SolutionIndex: 423
    SolutionNameMin: Cijk_Alik_Bljk_BBS_BH_MT208x256x64_MI16x16x16x1_SN_AMAS0_GLVWA2_GLVWB8_LBSPPA128_LBSPPB128_LPA4_LPB8_LRVW4_SU0_SUS0_SSO0_SVW1_TT13_64_VW1_WG16_16_1
    SolutionIndex: 424
    SolutionNameMin: Cijk_Alik_Bljk_BBS_BH_MT224x256x64_MI16x16x16x1_SN_AMAS0_GLVWA2_GLVWB2_LBSPPA128_LBSPPB128_LPA4_LPB4_LRVW4_SU0_SUS0_SSO0_SVW1_TT7_128_VW1_WG32_8_1
    SolutionIndex: 425
    SolutionNameMin: Cijk_Alik_Bljk_BBS_BH_MT256x224x64_MI16x16x16x1_SN_AMAS3_GLVWA4_GLVWB4_LBSPPA256_LBSPPB128_LPA4_LPB4_LRVW4_SU0_SUS0_SSO6_SVW2_TT4_224_VW2_WG64_4_1
    SolutionIndex: 426
    SolutionNameMin: Cijk_Alik_Bljk_BBS_BH_MT256x160x64_MI16x16x16x1_SN_AMAS3_GLVWA8_GLVWB8_LBSPPA256_LBSPPB128_LPA16_LPB16_LRVW8_SU4_SUS256_SSO0_SVW2_TT4_160_VW2_WG64_4_1
    SolutionIndex: 427
    SolutionNameMin: Cijk_Alik_Bljk_BBS_BH_MT256x160x64_MI16x16x16x1_SN_AMAS3_GLVWA8_GLVWB8_LBSPPA512_LBSPPB128_LPA16_LPB16_LRVW8_PLR5_SU4_SUS256_SPO1_SSO6_SVW4_TT8_80_VW4_WG32_8_1
    SolutionIndex: 428
    SolutionNameMin: Cijk_Alik_Bljk_BBS_BH_MT192x256x64_MI16x16x16x1_SN_AMAS3_GLVWA2_GLVWB8_LBSPPA512_LBSPPB128_LPA4_LPB8_LRVW4_SU0_SUS0_SSO0_SVW4_TT12_64_VW4_WG16_16_1
    SolutionIndex: 429
    SolutionNameMin: Cijk_Alik_Bljk_BBS_BH_MT176x256x64_MI16x16x16x1_SN_AMAS0_GLVWA4_GLVWB8_LBSPPA128_LBSPPB128_LPA4_LPB8_LRVW4_MIAV0_SU0_SUS0_SSO0_SVW1_TT11_64_VW1_WG16_16_1
    SolutionIndex: 430
    SolutionNameMin: Cijk_Alik_Bljk_BBS_BH_MT240x192x64_MI16x16x16x1_SN_AMAS0_GLVWA2_GLVWB8_LBSPPA128_LBSPPB128_LPA4_LPB8_LRVW4_PLR5_SU4_SUS256_SPO0_SSO0_SVW1_TT15_48_VW1_WG16_16_1
    SolutionIndex: 431
    SolutionNameMin: Cijk_Alik_Bljk_BBS_BH_MT192x256x64_MI16x16x16x1_SN_AMAS3_GLVWA2_GLVWB8_LBSPPA256_LBSPPB128_LPA4_LPB8_LRVW4_SU0_SUS0_SSO6_SVW2_TT12_64_VW2_WG16_16_1
    SolutionIndex: 432
    SolutionNameMin: Cijk_Alik_Bljk_BBS_BH_MT176x256x64_MI16x16x16x1_SN_AMAS0_GLVWA2_GLVWB2_LBSPPA128_LBSPPB128_LPA4_LPB4_LRVW4_SU4_SUS256_SSO0_SVW1_TT11_64_VW1_WG16_16_1
    SolutionIndex: 433
    SolutionNameMin: Cijk_Alik_Bljk_BBS_BH_MT256x192x64_MI16x16x16x1_SN_AMAS3_GLVWA2_GLVWB8_LBSPPA512_LBSPPB128_LPA16_LPB16_LRVW8_SU4_SUS256_SSO6_SVW4_TT4_192_VW4_WG64_4_1
    SolutionIndex: 434
    SolutionNameMin: Cijk_Alik_Bljk_BBS_BH_MT256x192x64_MI16x16x16x1_SN_AMAS3_GLVWA8_GLVWB8_LBSPPA512_LBSPPB128_LPA16_LPB16_LRVW8_SU4_SUS256_SSO0_SVW4_TT4_192_VW4_WG64_4_1
    SolutionIndex: 435
    SolutionNameMin: Cijk_Alik_Bljk_BBS_BH_MT208x256x64_MI16x16x16x1_SN_AMAS0_GLVWA2_GLVWB8_LBSPPA128_LBSPPB128_LPA4_LPB8_LRVW4_SU0_SUS0_SSO6_SVW1_TT13_64_VW1_WG16_16_1
    SolutionIndex: 436
    SolutionNameMin: Cijk_Alik_Bljk_BBS_BH_MT256x224x64_MI16x16x16x1_SN_AMAS3_GLVWA2_GLVWB2_LBSPPA512_LBSPPB128_LPA4_LPB4_LRVW4_NEPBS16_PLR5_SU4_SUS256_SSO6_SVW4_TT8_112_VW4_WG32_8_1
    SolutionIndex: 437
    SolutionNameMin: Cijk_Alik_Bljk_BBS_BH_MT208x256x64_MI16x16x16x1_SN_AMAS0_GLVWA2_GLVWB8_LBSPPA128_LBSPPB128_LPA4_LPB8_LRVW4_SU4_SUS256_SSO6_SVW1_TT13_64_VW1_WG16_16_1
    SolutionIndex: 438
    SolutionNameMin: Cijk_Alik_Bljk_BBS_BH_MT208x256x64_MI16x16x16x1_SN_AMAS0_GLVWA2_GLVWB8_LBSPPA128_LBSPPB128_LPA4_LPB8_LRVW4_SU4_SUS256_SSO0_SVW1_TT13_64_VW1_WG16_16_1
    SolutionIndex: 439
    SolutionNameMin: Cijk_Alik_Bljk_BBS_BH_MT160x256x64_MI16x16x16x1_SN_AMAS3_GLVWA2_GLVWB8_LBSPPA256_LBSPPB128_LPA16_LPB16_LRVW8_SU0_SUS0_SSO0_SVW2_TT10_64_VW2_WG16_16_1
    SolutionIndex: 440
    SolutionNameMin: Cijk_Alik_Bljk_BBS_BH_MT256x224x64_MI16x16x16x1_SN_AMAS3_GLVWA4_GLVWB4_LBSPPA256_LBSPPB128_LPA4_LPB4_LRVW4_SU4_SUS256_SSO0_SVW2_TT4_224_VW2_WG64_4_1
    SolutionIndex: 441
    SolutionNameMin: Cijk_Alik_Bljk_BBS_BH_MT224x256x64_MI16x16x16x1_SN_AMAS0_GLVWA2_GLVWB2_LBSPPA128_LBSPPB128_LPA4_LPB4_LRVW4_SU4_SUS256_SSO6_SVW1_TT7_128_VW1_WG32_8_1
    SolutionIndex: 442
    SolutionNameMin: Cijk_Alik_Bljk_BBS_BH_MT224x256x64_MI16x16x16x1_SN_AMAS3_GLVWA4_GLVWB4_LBSPPA256_LBSPPB128_LPA4_LPB4_LRVW4_SU0_SUS0_SSO6_SVW2_TT14_64_VW2_WG16_16_1
    SolutionIndex: 443
    SolutionNameMin: Cijk_Alik_Bljk_BBS_BH_MT192x256x64_MI16x16x16x1_SN_AMAS3_GLVWA2_GLVWB8_LBSPPA512_LBSPPB128_LPA4_LPB8_LRVW4_NEPBS16_PLR5_SU0_SUS0_SSO0_SVW4_TT12_64_VW4_WG16_16_1
    SolutionIndex: 444
    SolutionNameMin: Cijk_Alik_Bljk_BBS_BH_MT256x192x64_MI16x16x16x1_SN_AMAS3_GLVWA8_GLVWB8_LBSPPA512_LBSPPB128_LPA16_LPB16_LRVW8_NEPBS0_PLR5_SU4_SUS256_SSO6_SVW4_TT8_96_VW4_WG32_8_1
    SolutionIndex: 445
    SolutionNameMin: Cijk_Alik_Bljk_BBS_BH_MT256x192x64_MI16x16x16x1_SN_AMAS3_GLVWA8_GLVWB8_LBSPPA512_LBSPPB128_LPA16_LPB16_LRVW8_NEPBS16_PLR5_SU0_SUS0_SSO6_SVW4_TT8_96_VW4_WG32_8_1
    SolutionIndex: 446
    SolutionNameMin: Cijk_Alik_Bljk_BBS_BH_MT192x256x64_MI16x16x16x1_SN_AMAS3_GLVWA2_GLVWB2_LBSPPA256_LBSPPB128_LPA4_LPB4_LRVW4_NEPBS16_PLR5_SU4_SUS256_SSO0_SVW2_TT6_128_VW2_WG32_8_1
    SolutionIndex: 447
    SolutionNameMin: Cijk_Alik_Bljk_BBS_BH_MT192x256x64_MI16x16x16x1_SN_AMAS3_GLVWA2_GLVWB8_LBSPPA512_LBSPPB128_LPA4_LPB8_LRVW4_SU4_SUS256_SSO0_SVW4_TT12_64_VW4_WG16_16_1
    SolutionIndex: 448
    SolutionNameMin: Cijk_Alik_Bljk_BBS_BH_MT256x160x64_MI16x16x16x1_SN_AMAS3_GLVWA2_GLVWB8_LBSPPA256_LBSPPB128_LPA16_LPB16_LRVW8_SU4_SUS256_SSO0_SVW2_TT4_160_VW2_WG64_4_1
    SolutionIndex: 449
    SolutionNameMin: Cijk_Alik_Bljk_BBS_BH_MT192x256x64_MI16x16x16x1_SN_AMAS3_GLVWA4_GLVWB8_LBSPPA256_LBSPPB128_LPA4_LPB8_LRVW4_SU0_SUS0_SSO6_SVW2_TT12_64_VW2_WG16_16_1
    SolutionIndex: 450
    SolutionNameMin: Cijk_Alik_Bljk_BBS_BH_MT224x256x64_MI16x16x16x1_SN_AMAS3_GLVWA4_GLVWB4_LBSPPA256_LBSPPB128_LPA4_LPB4_LRVW4_SU4_SUS256_SSO0_SVW2_TT14_64_VW2_WG16_16_1
    SolutionIndex: 451
    SolutionNameMin: Cijk_Alik_Bljk_BBS_BH_MT256x224x64_MI16x16x16x1_SN_AMAS3_GLVWA4_GLVWB4_LBSPPA512_LBSPPB128_LPA4_LPB4_LRVW4_SU0_SUS0_SSO6_SVW4_TT4_224_VW4_WG64_4_1
    SolutionIndex: 452
    SolutionNameMin: Cijk_Alik_Bljk_BBS_BH_MT256x224x64_MI16x16x16x1_SN_AMAS3_GLVWA4_GLVWB2_LBSPPA512_LBSPPB128_LPA4_LPB4_LRVW4_SU0_SUS0_SSO0_SVW4_TT4_224_VW4_WG64_4_1
    SolutionIndex: 453
    SolutionNameMin: Cijk_Alik_Bljk_BBS_BH_MT192x256x64_MI16x16x16x1_SN_AMAS3_GLVWA4_GLVWB8_LBSPPA512_LBSPPB128_LPA4_LPB8_LRVW4_SU0_SUS0_SSO6_SVW4_TT12_64_VW4_WG16_16_1
    SolutionIndex: 454
    SolutionNameMin: Cijk_Alik_Bljk_BBS_BH_MT192x256x64_MI16x16x16x1_SN_AMAS3_GLVWA2_GLVWB8_LBSPPA512_LBSPPB128_LPA4_LPB8_LRVW4_MIAV0_SU0_SUS0_SSO6_SVW4_TT12_64_VW4_WG16_16_1
    SolutionIndex: 455
    SolutionNameMin: Cijk_Alik_Bljk_BBS_BH_MT192x256x64_MI16x16x16x1_SN_AMAS3_GLVWA2_GLVWB2_LBSPPA256_LBSPPB128_LPA4_LPB4_LRVW4_SU4_SUS256_SSO6_SVW2_TT6_128_VW2_WG32_8_1
    SolutionIndex: 456
    SolutionNameMin: Cijk_Alik_Bljk_BBS_BH_MT256x224x64_MI16x16x16x1_SN_AMAS3_GLVWA2_GLVWB2_LBSPPA256_LBSPPB128_LPA4_LPB4_LRVW4_MIAV0_SU4_SUS256_SSO6_SVW2_TT8_112_VW2_WG32_8_1
    SolutionIndex: 457
    SolutionNameMin: Cijk_Alik_Bljk_BBS_BH_MT256x224x64_MI16x16x16x1_SN_AMAS3_GLVWA4_GLVWB4_LBSPPA256_LBSPPB128_LPA4_LPB4_LRVW4_MIAV0_SU0_SUS0_SSO0_SVW2_TT8_112_VW2_WG32_8_1
    SolutionIndex: 458
    SolutionNameMin: Cijk_Alik_Bljk_BBS_BH_MT192x256x64_MI16x16x16x1_SN_AMAS3_GLVWA4_GLVWB8_LBSPPA512_LBSPPB128_LPA4_LPB8_LRVW4_PLR5_SU0_SUS0_SPO0_SSO6_SVW4_TT12_64_VW4_WG16_16_1
    SolutionIndex: 459
    SolutionNameMin: Cijk_Alik_Bljk_BBS_BH_MT192x256x64_MI16x16x16x1_SN_AMAS3_GLVWA4_GLVWB8_LBSPPA512_LBSPPB128_LPA4_LPB8_LRVW4_PLR5_SU0_SUS0_SPO0_SSO0_SVW4_TT12_64_VW4_WG16_16_1
    SolutionIndex: 460
    SolutionNameMin: Cijk_Alik_Bljk_BBS_BH_MT128x64x128_MI16x16x16x1_SN_AMAS3_FL0_GLS1_LBSPPA512_LBSPPB256_LPA16_LPB16_LRVW8_MIAV1_PLR5_SU0_SUS0_SSO0_SVW2_TT8_32_VW2_WG16_8_2
    SolutionIndex: 461
    SolutionNameMin: Cijk_Alik_Bljk_BBS_BH_MT128x112x64_MI16x16x16x1_SN_AMAS0_FL1_GLS1_LBSPPA128_LBSPPB128_LPA16_LPB16_LRVW8_MIAV0_PLR5_SU0_SUS0_SSO0_SVW1_TT2_112_VW1_WG64_4_1
    SolutionIndex: 462
    SolutionNameMin: Cijk_Alik_Bljk_BBS_BH_MT96x96x128_MI16x16x16x1_SN_AMAS0_FL0_GLS1_LBSPPA256_LBSPPB256_LPA16_LPB16_LRVW8_MIAV1_PLR9_SU4_SUS256_SSO0_SVW1_TT3_48_VW1_WG32_8_1
    SolutionIndex: 463
    SolutionNameMin: Cijk_Alik_Bljk_BBS_BH_MT160x160x64_MI16x16x16x1_SN_AMAS0_GLVWA8_GLVWB8_LBSPPA128_LBSPPB128_LPA16_LPB16_LRVW8_SU0_SUS0_SVW1_TT5_80_VW1_WG32_8_1
    SolutionIndex: 464
    SolutionNameMin: Cijk_Alik_Bljk_BBS_BH_MT192x160x64_MI16x16x16x1_SN_AMAS3_GLVWA4_GLVWB8_LBSPPA256_LBSPPB128_LPA16_LPB16_LRVW8_SU0_SUS0_SVW2_TT6_80_VW2_WG32_8_1
    SolutionIndex: 465
    SolutionNameMin: Cijk_Alik_Bljk_BBS_BH_MT128x256x64_MI16x16x16x1_SN_AMAS3_GLVWA8_GLVWB8_LBSPPA512_LBSPPB128_LPA16_LPB16_LRVW8_SU0_SUS0_SVW4_TT4_128_VW4_WG32_8_1
    SolutionIndex: 466
    SolutionNameMin: Cijk_Alik_Bljk_BBS_BH_MT128x256x64_MI16x16x16x1_SN_AMAS3_GLVWA8_GLVWB8_LBSPPA256_LBSPPB128_LPA16_LPB16_LRVW8_SU0_SUS0_SVW2_TT4_128_VW2_WG32_8_1
    SolutionIndex: 467
    SolutionNameMin: Cijk_Alik_Bljk_BBS_BH_MT144x256x64_MI16x16x16x1_SN_AMAS0_GLVWA4_GLVWB8_LBSPPA128_LBSPPB128_LPA16_LPB16_LRVW8_PLR5_SU0_SUS0_SPO0_SSO6_SVW1_TT9_64_VW1_WG16_16_1
    SolutionIndex: 468
    SolutionNameMin: Cijk_Alik_Bljk_BBS_BH_MT192x224x64_MI16x16x16x1_SN_AMAS3_GLVWA4_GLVWB8_LBSPPA256_LBSPPB128_LPA16_LPB16_LRVW8_PLR5_SU0_SUS0_SPO0_SSO6_SVW2_TT6_112_VW2_WG32_8_1
    SolutionIndex: 469
    SolutionNameMin: Cijk_Alik_Bljk_BBS_BH_MT192x256x64_MI16x16x16x1_SN_AMAS3_GLVWA4_GLVWB8_LBSPPA256_LBSPPB128_LPA4_LPB8_LRVW4_SU4_SUS256_SVW2_TT6_128_VW2_WG32_8_1
    SolutionIndex: 470
    SolutionNameMin: Cijk_Alik_Bljk_BBS_BH_MT256x192x64_MI16x16x16x1_SN_AMAS3_GLVWA2_GLVWB8_LBSPPA512_LBSPPB128_LPA16_LPB16_LRVW8_SU0_SUS0_SVW4_TT8_96_VW4_WG32_8_1
    SolutionIndex: 471
    SolutionNameMin: Cijk_Alik_Bljk_BBS_BH_MT256x224x64_MI16x16x16x1_SN_AMAS3_GLVWA2_GLVWB8_LBSPPA512_LBSPPB128_LPA4_LPB8_LRVW4_SU4_SUS256_SVW4_TT8_112_VW4_WG32_8_1
    SolutionIndex: 472
    SolutionNameMin: Cijk_Alik_Bljk_BBS_BH_MT128x256x64_MI16x16x16x1_SN_AMAS3_GLVWA8_GLVWB8_LBSPPA512_LBSPPB128_LPA16_LPB16_LRVW8_PLR5_SU4_SUS256_SPO1_SSO6_SVW4_TT4_128_VW4_WG32_8_1
    SolutionIndex: 473
    SolutionNameMin: Cijk_Alik_Bljk_BBS_BH_MT160x224x64_MI16x16x16x1_SN_AMAS0_GLVWA8_GLVWB8_LBSPPA128_LBSPPB128_LPA16_LPB16_LRVW8_PLR5_SU0_SUS0_SPO0_SSO0_SVW1_TT5_112_VW1_WG32_8_1
    SolutionIndex: 474
    SolutionNameMin: Cijk_Alik_Bljk_BBS_BH_MT192x224x64_MI16x16x16x1_SN_AMAS3_GLVWA8_GLVWB8_LBSPPA256_LBSPPB128_LPA16_LPB16_LRVW8_MIAV0_SU0_SUS0_SSO0_SVW2_TT6_112_VW2_WG32_8_1_WGM32
    SolutionIndex: 475
    SolutionNameMin: Cijk_Alik_Bljk_BBS_BH_MT192x256x64_MI16x16x16x1_SN_AMAS3_GLVWA2_GLVWB2_LBSPPA256_LBSPPB128_LPA4_LPB4_LRVW4_MIAV0_SU4_SUS256_SSO0_SVW2_TT6_128_VW2_WG32_8_1_WGM32
    SolutionIndex: 476
    SolutionNameMin: Cijk_Alik_Bljk_BBS_BH_MT176x256x64_MI16x16x16x1_SN_AMAS0_GLVWA2_GLVWB8_LBSPPA128_LBSPPB128_LPA4_LPB8_LRVW4_SU4_SUS256_SVW1_TT11_64_VW1_WG16_16_1_WGM32
    SolutionIndex: 477
    SolutionNameMin: Cijk_Alik_Bljk_BBS_BH_MT256x192x64_MI16x16x16x1_SN_AMAS3_GLVWA8_GLVWB8_LBSPPA512_LBSPPB128_LPA16_LPB16_LRVW8_SU4_SUS256_SVW4_TT8_96_VW4_WG32_8_1_WGM32
    SolutionIndex: 478
    SolutionNameMin: Cijk_Alik_Bljk_BBS_BH_MT208x256x64_MI16x16x16x1_SN_AMAS0_GLVWA2_GLVWB8_LBSPPA128_LBSPPB128_LPA4_LPB8_LRVW4_SU0_SUS0_SVW1_TT13_64_VW1_WG16_16_1_WGM32
    SolutionIndex: 479
    SolutionNameMin: Cijk_Alik_Bljk_BBS_BH_MT224x256x64_MI16x16x16x1_SN_AMAS0_GLVWA2_GLVWB2_LBSPPA128_LBSPPB128_LPA4_LPB4_LRVW4_PLR5_SU8_SUS256_SPO1_SSO6_SVW1_TT7_128_VW1_WG32_8_1
    SolutionIndex: 480
    SolutionNameMin: Cijk_Alik_Bljk_BBS_BH_MT256x224x64_MI16x16x16x1_SN_AMAS3_GLVWA2_GLVWB8_LBSPPA512_LBSPPB128_LPA4_LPB8_LRVW4_PLR5_SU8_SUS256_SPO1_SSO6_SVW4_TT8_112_VW4_WG32_8_1
    SolutionIndex: 481
    SolutionNameMin: Cijk_Alik_Bljk_BBS_BH_MT160x256x64_MI16x16x16x1_SN_AMAS3_GLVWA8_GLVWB8_LBSPPA256_LBSPPB128_LPA16_LPB16_LRVW8_MIAV0_SU0_SUS0_SSO0_SVW2_TT10_64_VW2_WG16_16_1_WGM32
    SolutionIndex: 482
    SolutionNameMin: Cijk_Alik_Bljk_BBS_BH_MT192x224x64_MI16x16x16x1_SN_AMAS3_GLVWA8_GLVWB8_LBSPPA256_LBSPPB128_LPA16_LPB16_LRVW8_MIAV0_SU0_SUS0_SSO6_SVW2_TT6_112_VW2_WG32_8_1_WGM32
    SolutionIndex: 483
    SolutionNameMin: Cijk_Alik_Bljk_BBS_BH_MT208x256x64_MI16x16x16x1_SN_AMAS0_GLVWA2_GLVWB8_LBSPPA128_LBSPPB128_LPA4_LPB8_LRVW4_MIAV0_SU4_SUS256_SSO0_SVW1_TT13_64_VW1_WG16_16_1_WGM32
    SolutionIndex: 484
    SolutionNameMin: Cijk_Alik_Bljk_BBS_BH_MT256x224x64_MI16x16x16x1_SN_AMAS3_GLVWA2_GLVWB8_LBSPPA512_LBSPPB128_LPA4_LPB8_LRVW4_SU0_SUS0_SVW4_TT8_112_VW4_WG32_8_1_WGMn32
    SolutionIndex: 485
    SolutionNameMin: Cijk_Alik_Bljk_BBS_BH_MT256x224x64_MI16x16x16x1_SN_AMAS3_GLVWA2_GLVWB2_LBSPPA256_LBSPPB128_LPA4_LPB4_LRVW4_SU0_SUS0_SVW2_TT8_112_VW2_WG32_8_1_WGMn32
    SolutionIndex: 486
    SolutionNameMin: Cijk_Alik_Bljk_BBS_BH_MT256x192x64_MI16x16x16x1_SN_AMAS3_GLVWA8_GLVWB8_LBSPPA512_LBSPPB128_LPA16_LPB16_LRVW8_SU0_SUS0_SVW4_TT8_96_VW4_WG32_8_1_WGMn32
    SolutionIndex: 487
    SolutionNameMin: Cijk_Alik_Bljk_BBS_BH_MT192x256x64_MI16x16x16x1_SN_AMAS3_GLVWA2_GLVWB8_LBSPPA512_LBSPPB128_LPA4_LPB8_LRVW4_SU0_SUS0_SVW4_TT12_64_VW4_WG16_16_1_WGM32
    SolutionIndex: 488
    SolutionNameMin: Cijk_Alik_Bljk_BBS_BH_MT192x256x64_MI16x16x16x1_SN_AMAS3_GLVWA4_GLVWB8_LBSPPA512_LBSPPB128_LPA4_LPB8_LRVW4_SU4_SUS256_SVW4_TT12_64_VW4_WG16_16_1_WGM32
    SolutionIndex: 489
    SolutionNameMin: Cijk_Alik_Bljk_BBS_BH_MT160x256x64_MI16x16x16x1_SN_AMAS3_GLVWA2_GLVWB8_LBSPPA256_LBSPPB128_LPA16_LPB16_LRVW8_MIAV0_SU4_SUS256_SSO0_SVW2_TT10_64_VW2_WG16_16_1_WGM32
    SolutionIndex: 490
    SolutionNameMin: Cijk_Alik_Bljk_BBS_BH_MT192x224x64_MI16x16x16x1_SN_AMAS3_GLVWA8_GLVWB8_LBSPPA256_LBSPPB128_LPA16_LPB16_LRVW8_MIAV0_SU4_SUS256_SSO0_SVW2_TT6_112_VW2_WG32_8_1_WGMn32
    SolutionIndex: 491
    SolutionNameMin: Cijk_Alik_Bljk_BBS_BH_MT208x256x64_MI16x16x16x1_SN_AMAS0_GLVWA2_GLVWB8_LBSPPA128_LBSPPB128_LPA4_LPB8_LRVW4_MIAV0_SU0_SUS0_SSO0_SVW1_TT13_64_VW1_WG16_16_1_WGM32
    SolutionIndex: 492
    SolutionNameMin: Cijk_Alik_Bljk_BBS_BH_MT224x256x64_MI16x16x16x1_SN_AMAS3_GLVWA2_GLVWB4_LBSPPA256_LBSPPB128_LPA4_LPB4_LRVW4_MIAV0_SU4_SUS256_SSO0_SVW2_TT14_64_VW2_WG16_16_1_WGMn32
    SolutionIndex: 493
    SolutionNameMin: Cijk_Alik_Bljk_BBS_BH_MT256x224x64_MI16x16x16x1_SN_AMAS3_GLVWA2_GLVWB2_LBSPPA512_LBSPPB128_LPA4_LPB4_LRVW4_SU4_SUS256_SVW4_TT8_112_VW4_WG32_8_1_WGMn32
    SolutionIndex: 494
    SolutionNameMin: Cijk_Alik_Bljk_BBS_BH_MT224x256x64_MI16x16x16x1_SN_AMAS0_GLVWA2_GLVWB4_LBSPPA128_LBSPPB128_LPA4_LPB4_LRVW4_SU4_SUS256_SVW1_TT7_128_VW1_WG32_8_1_WGM32
    SolutionIndex: 495
    SolutionNameMin: Cijk_Alik_Bljk_BBS_BH_MT224x256x64_MI16x16x16x1_SN_AMAS0_GLVWA2_GLVWB2_LBSPPA128_LBSPPB128_LPA4_LPB4_LRVW4_SU0_SUS0_SVW1_TT7_128_VW1_WG32_8_1
    SolutionIndex: 496
    SolutionNameMin: Cijk_Alik_Bljk_BBS_BH_MT192x192x64_MI16x16x16x1_SN_AMAS3_GLVWA8_GLVWB8_LBSPPA256_LBSPPB128_LPA16_LPB16_LRVW8_SU4_SUS256_SVW2_TT6_96_VW2_WG32_8_1_WGMn32
    SolutionIndex: 497
    SolutionNameMin: Cijk_Alik_Bljk_BBS_BH_MT176x256x64_MI16x16x16x1_SN_AMAS0_GLVWA2_GLVWB8_LBSPPA128_LBSPPB128_LPA4_LPB8_LRVW4_SU0_SUS0_SVW1_TT11_64_VW1_WG16_16_1_WGMn32
    SolutionIndex: 498
    SolutionNameMin: Cijk_Alik_Bljk_BBS_BH_MT192x256x64_MI16x16x16x1_SN_AMAS3_GLVWA2_GLVWB8_LBSPPA256_LBSPPB128_LPA4_LPB8_LRVW4_MIAV0_SU4_SUS256_SSO0_SVW2_TT12_64_VW2_WG16_16_1_WGM32
    SolutionIndex: 499
    SolutionNameMin: Cijk_Alik_Bljk_BBS_BH_MT128x112x128_MI16x16x16x1_SN_AMAS0_GLVWA4_GLVWB4_GRVW4_LBSPPA256_SVW1_TT2_112_VW1_WG64_4_1
    SolutionIndex: 500
    SolutionNameMin: Cijk_Alik_Bljk_BBS_BH_MT256x176x64_MI16x16x16x1_SN_
    SolutionIndex: 501
    SolutionNameMin: Cijk_Alik_Bljk_BBS_BH_MT144x256x64_MI16x16x16x1_SN_NTC1_NTD1
    SolutionIndex: 502
    SolutionNameMin: Cijk_Alik_Bljk_BBS_BH_MT192x256x64_MI16x16x16x1_SN_AMAS3_ELFLR0_GLVWA2_GLVWB8_GSU2_GSUAMB_LBSPPA256_LBSPPB256_LPA16_LPB16_LRVW8_MIAV0_PLR5_SS1_SU4_SUS256_SVW2_TT12_64_VW2_VWB2_WG16_16_1
    SolutionIndex: 503
    SolutionNameMin: Cijk_Alik_Bljk_BBS_BH_MT192x256x64_MI16x16x16x1_SN_FL0_GLVWA2_GLVWB2_LBSPPB128_LPA4_LPB4_NTC4_NTD4_SUS512_TT6_128_VWB1
    SolutionIndex: 504
    SolutionNameMin: Cijk_Alik_Bljk_BBS_BH_MT128x160x64_MI16x16x16x1_SN_ELFLR0_EMLL4_FL2_GSU7_GSUAMB_NTC3_NTD3_SU0_SUS0_TT4_80_WG32_8_1_WGM16
    SolutionIndex: 505
    SolutionNameMin: Cijk_Alik_Bljk_BBS_BH_MT144x128x64_MI16x16x16x1_SN_ELFLR4_EMLL4_FL2_GSU4_GSUAMB_NTC3_NTD3_SU4_SUS512_TT9_32_WG16_16_1_WGMn8
    SolutionIndex: 506
    SolutionNameMin: Cijk_Alik_Bljk_BBS_BH_MT144x128x64_MI16x16x16x1_SN_ELFLR4_EMLL4_FL2_GSU1_GSUASB_NTC2_NTD2_SU0_SUS0_TT9_32_WG16_16_1_WGM32
    SolutionIndex: 507
    SolutionNameMin: Cijk_Alik_Bljk_BBS_BH_MT256x128x64_MI16x16x16x1_SN_AMAS3_FL0_GLVWA2_GLVWB8_LBSPPA512_LBSPPB256_LPA16_LPB16_LRVW8_SUS256_SVW4_TT8_64_VW4_VWB2_WGM0
    SolutionIndex: 508
    SolutionNameMin: Cijk_Alik_Bljk_BBS_BH_MT128x128x64_MI16x16x16x1_SN_AMAS0_FL2_GLVWA8_GLVWB8_LBSPPA128_LBSPPB128_LPA16_LPB16_LRVW8_SUS512_SVW1_TT4_64_VW1_VWB1_WGM1
    SolutionIndex: 509
    SolutionNameMin: Cijk_Alik_Bljk_BBS_BH_MT144x128x64_MI16x16x16x1_SN_AMAS0_LBSPPA128_LBSPPB128_LPA4_NTC3_NTD3_NEPBS0_SU0_SUS0_SPO0_SSO4_SVW1_TT9_32_VW1_VWB1_WG16_16_1_WGM16
    SolutionIndex: 510
    SolutionNameMin: Cijk_Alik_Bljk_BBS_BH_MT256x224x64_MI16x16x16x1_SN_AMAS3_LBSPPA512_LBSPPB128_LPA4_NTC0_NTD0_NEPBS0_SU0_SUS0_SPO1_SSO0_SVW4_TT8_112_VW4_VWB1_WG32_8_1_WGMn32
    SolutionIndex: 511
    SolutionNameMin: Cijk_Alik_Bljk_BBS_BH_MT256x176x64_MI16x16x16x1_SN_FL0_GLVWA4_GLVWB2_GSU5_GSUAMB_LBSPPB128_TT4_176_VWB1_WG64_4_1
    SolutionIndex: 512
    SolutionNameMin: Cijk_Alik_Bljk_BBS_BH_MT128x128x64_MI16x16x16x1_SN_AMAS3_ELFLR12_FL1_GLVWA8_LBSPPA256_LBSPPB128_NTC3_NTD3_SUS512_SSO0_SVW2_TT4_64_VW2_VWB1_WG32_8_1_WGM0
    SolutionIndex: 513
    SolutionNameMin: Cijk_Alik_Bljk_BBS_BH_MT128x128x64_MI16x16x16x1_SN_AMAS3_ELFLR12_FL1_GLVWA8_LBSPPA256_LBSPPB128_NTC3_NTD3_SUS128_SSO0_SVW2_TT4_64_VW2_VWB1_WG32_8_1_WGM0
    SolutionIndex: 514
    SolutionNameMin: Cijk_Alik_Bljk_BBS_BH_MT128x128x64_MI16x16x16x1_SN_AMAS3_ELFLR0_FL2_GLVWA8_LBSPPA256_LBSPPB128_NTC2_NTD2_SUS1024_SSO0_SVW2_TT4_64_VW2_VWB1_WG32_8_1_WGMn16
    SolutionIndex: 515
    SolutionNameMin: Cijk_Alik_Bljk_BBS_BH_MT128x128x64_MI16x16x16x1_SN_AMAS3_ELFLR0_FL2_GLVWA8_LBSPPA512_LBSPPB128_NTC3_NTD3_SUS1024_SSO0_SVW4_TT4_64_VW4_VWB1_WG32_8_1_WGMn32
    SolutionIndex: 516
    SolutionNameMin: Cijk_Alik_Bljk_BBS_BH_MT128x128x64_MI16x16x16x1_SN_AMAS3_ELFLR4_FL1_GLVWA8_LBSPPA256_LBSPPB512_NTC0_NTD0_SUS128_SSO4_SVW2_TT4_64_VW2_VWB4_WG32_8_1_WGM0
    SolutionIndex: 517
    SolutionNameMin: Cijk_Alik_Bljk_BBS_BH_MT128x128x64_MI16x16x16x1_SN_AMAS3_ELFLR0_FL1_GLVWA8_LBSPPA256_LBSPPB512_NTC0_NTD0_SUS256_SSO0_SVW2_TT4_64_VW2_VWB4_WG32_8_1_WGMn32
    SolutionIndex: 518
    SolutionNameMin: Cijk_Alik_Bljk_BBS_BH_MT128x128x64_MI16x16x16x1_SN_AMAS3_ELFLR4_FL2_GLVWA8_LBSPPA256_LBSPPB256_NTC0_NTD0_SUS1024_SSO4_SVW2_TT4_64_VW2_VWB2_WG32_8_1_WGMn32
    SolutionIndex: 519
    SolutionNameMin: Cijk_Alik_Bljk_BBS_BH_MT128x128x64_MI16x16x16x1_SN_AMAS3_ELFLR12_FL1_GLVWA8_LBSPPA512_LBSPPB256_NTC3_NTD3_SUS1024_SSO0_SVW4_TT4_64_VW4_VWB2_WG32_8_1_WGMn32
    SolutionIndex: 520
    SolutionNameMin: Cijk_Alik_Bljk_BBS_BH_MT192x96x64_MI16x16x16x1_SN_AMAS0_FL2_GLVWA8_GLVWB8_LBSPPA128_LBSPPB128_LPA16_LPB16_SUS256_SVW1_TT6_48_VW1_VWB1_WG32_8_1_WGMn32
    SolutionIndex: 521
    SolutionNameMin: Cijk_Alik_Bljk_BBS_BH_MT128x256x64_MI16x16x16x1_SN_AMAS3_FL0_GLVWA8_GLVWB8_LBSPPA256_LBSPPB128_LPA16_LPB16_SUS256_SVW2_TT8_64_VW2_VWB1_WG16_16_1_WGMn32
    SolutionIndex: 522
    SolutionNameMin: Cijk_Alik_Bljk_BBS_BH_MT128x256x64_MI16x16x16x1_SN_AMAS3_FL0_GLVWA4_GLVWB8_LBSPPA1024_LBSPPB256_LPA16_LPB16_SUS256_SVW8_TT8_64_VW8_VWB2_WG16_16_1_WGMn32
    SolutionIndex: 523
    SolutionNameMin: Cijk_Alik_Bljk_BBS_BH_MT256x128x64_MI16x16x16x1_SN_AMAS3_FL2_GLVWA2_GLVWB8_LBSPPA512_LBSPPB256_LPA16_LPB16_SUS256_SVW4_TT4_128_VW4_VWB2_WG64_4_1_WGMn32
    SolutionIndex: 524
    SolutionNameMin: Cijk_Alik_Bljk_BBS_BH_MT128x256x64_MI16x16x16x1_SN_AMAS3_FL2_GLVWA4_GLVWB8_LBSPPA256_LBSPPB512_LPA16_LPB16_SUS256_SVW2_TT4_128_VW2_VWB4_WG32_8_1_WGMn32
    SolutionIndex: 525
    SolutionNameMin: Cijk_Alik_Bljk_BBS_BH_MT256x128x64_MI16x16x16x1_SN_AMAS3_FL0_GLVWA2_GLVWB8_LBSPPA256_LBSPPB256_LPA16_LPB16_SUS256_SVW2_TT4_128_VW2_VWB2_WG64_4_1_WGMn32
    SolutionIndex: 526
    SolutionNameMin: Cijk_Alik_Bljk_BBS_BH_MT256x128x64_MI16x16x16x1_SN_AMAS3_FL2_GLVWA2_GLVWB8_LBSPPA512_LBSPPB256_LPA16_LPB16_SUS256_SVW4_TT8_64_VW4_VWB2_WG32_8_1_WGMn32
    SolutionIndex: 527
    SolutionNameMin: Cijk_Alik_Bljk_BBS_BH_MT256x128x64_MI16x16x16x1_SN_AMAS3_FL2_GLVWA8_GLVWB8_LBSPPA256_LBSPPB512_LPA16_LPB16_SUS256_SVW2_TT8_64_VW2_VWB4_WG32_8_1_WGMn32
    SolutionIndex: 528
    SolutionNameMin: Cijk_Alik_Bljk_BBS_BH_MT128x256x64_MI16x16x16x1_SN_AMAS3_FL0_GLVWA8_GLVWB8_LBSPPA256_LBSPPB256_LPA16_LPB16_SUS512_SVW2_TT8_64_VW2_VWB2_WG16_16_1_WGMn32
    SolutionIndex: 529
    SolutionNameMin: Cijk_Alik_Bljk_BBS_BH_MT128x256x64_MI16x16x16x1_SN_AMAS0_FL2_GLVWA8_GLVWB8_LBSPPA128_LBSPPB128_LPA16_LPB16_SUS256_SVW1_TT8_64_VW1_VWB1_WG16_16_1_WGM8
    SolutionIndex: 530
    SolutionNameMin: Cijk_Alik_Bljk_BBS_BH_MT192x128x64_MI16x16x16x1_SN_AMAS3_FL1_GLVWA8_GLVWB8_LBSPPA256_LBSPPB128_LPA16_LPB16_SUS256_SVW2_TT6_64_VW2_VWB1_WG32_8_1_WGMn32
    SolutionIndex: 531
    SolutionNameMin: Cijk_Alik_Bljk_BBS_BH_MT256x128x64_MI16x16x16x1_SN_AMAS3_FL2_GLVWA2_GLVWB8_LBSPPA512_LBSPPB1024_LPA16_LPB16_SUS512_SVW4_TT4_128_VW4_VWB8_WG64_4_1_WGMn32
- - - [6144, 4864, 1, 4096]
    - [0, 71.999]
  - - [6144, 4864, 1, 8192]
    - [2, 81.103]
  - - [6144, 4864, 1, 16384]
    - [10, 66.767]
  - - [6144, 9728, 1, 4096]
    - [11, 68.787]
  - - [6144, 9728, 1, 8192]
    - [7, 67.313]
  - - [6144, 9728, 1, 16384]
    - [5, 62.851]
  - - [9216, 4864, 1, 4096]
    - [9, 69.909]
  - - [9216, 4864, 1, 8192]
    - [3, 75.653]
  - - [9216, 4864, 1, 16384]
    - [8, 64.851]
  - - [6144, 4864, 1, 4352]
    - [1, 71.902]
  - - [6144, 4864, 1, 8448]
    - [4, 77.093]
  - - [6144, 4864, 1, 16640]
    - [6, 63.668]
  - - [4864, 3072, 1, 4096]
    - [15, 87.628]
  - - [12288, 9728, 1, 16416]
    - [45, 63.012]
  - - [12320, 9728, 1, 16512]
    - [12, 74.928]
  - - [4864, 4096, 1, 8192]
    - [36, 61.551]
  - - [9728, 8192, 1, 8192]
    - [290, 78.982]
  - - [9728, 8192, 1, 65536]
    - [13, 64.114]
  - - [8192, 8192, 1, 8192]
    - [456, 83.976]
  - - [4864, 3072, 1, 2048]
    - [14, 78.643]
  - - [4864, 3072, 1, 6144]
    - [16, 77.522]
  - - [4864, 3072, 1, 8192]
    - [14, 91.714]
  - - [3072, 4864, 1, 2048]
    - [14, 77.885]
  - - [3072, 4864, 1, 4096]
    - [17, 87.481]
  - - [3072, 4864, 1, 6144]
    - [18, 78.41]
  - - [3072, 4864, 1, 8192]
    - [14, 92.847]
  - - [7168, 65536, 1, 28672]
    - [19, 82.49]
  - - [21504, 65536, 1, 7168]
    - [20, 79.01]
  - - [28672, 65536, 1, 7168]
    - [21, 79.83]
  - - [7168, 65536, 1, 7168]
    - [22, 86.96]
  - - [50432, 65536, 1, 7168]
    - [23, 80.75]
  - - [4000, 8, 1, 8192]
    - [24, 2.312]
  - - [1280, 8, 1, 8192]
    - [25, 1.399]
  - - [8192, 8, 1, 1024]
    - [26, 1.505]
  - - [7168, 8, 1, 8192]
    - [27, 2.822]
  - - [8192, 8, 1, 3584]
    - [28, 2.859]
  - - [4000, 32, 1, 8192]
    - [137, 7.54]
  - - [1280, 32, 1, 8192]
    - [136, 4.43]
  - - [8192, 32, 1, 1024]
    - [144, 4.649]
  - - [7168, 32, 1, 8192]
    - [67, 11.855]
  - - [8192, 32, 1, 3584]
    - [141, 10.963]
  - - [4000, 64, 1, 8192]
    - [30, 16.166]
  - - [1280, 64, 1, 8192]
    - [31, 8.604]
  - - [8192, 64, 1, 1024]
    - [32, 12.981]
  - - [7168, 64, 1, 8192]
    - [33, 19.432]
  - - [8192, 64, 1, 3584]
    - [159, 18.403]
  - - [4096, 4096, 1, 8192]
    - [35, 79.579]
  - - [4864, 4096, 1, 4096]
    - [404, 60.966]
  - - [4864, 4096, 1, 8256]
    - [37, 57.497]
  - - [9728, 8192, 1, 16416]
    - [38, 63.143]
  - - [9728, 12288, 1, 4096]
    - [39, 60.691]
  - - [9728, 12288, 1, 8192]
    - [40, 61.024]
  - - [9728, 12288, 1, 8256]
    - [41, 63.661]
  - - [9728, 12288, 1, 16416]
    - [42, 62.54]
  - - [14592, 12288, 1, 8192]
    - [39, 57.402]
  - - [14592, 12288, 1, 8256]
    - [43, 61.839]
  - - [14592, 12288, 1, 16416]
    - [44, 63.231]
  - - [1920, 8, 1, 5120]
    - [25, 1.361]
  - - [2560, 8, 1, 8192]
    - [130, 1.674]
  - - [3456, 8, 1, 5120]
    - [131, 1.793]
  - - [3840, 8, 1, 5120]
    - [130, 1.86]
  - - [4000, 8, 1, 5120]
    - [131, 1.878]
  - - [5120, 8, 1, 640]
    - [46, 0.65]
  - - [5120, 8, 1, 1280]
    - [47, 1.246]
  - - [5120, 8, 1, 1728]
    - [48, 0.969]
  - - [5120, 8, 1, 2560]
    - [49, 1.86]
  - - [5120, 8, 1, 3456]
    - [46, 1.477]
  - - [5120, 8, 1, 5120]
    - [132, 1.758]
  - - [5120, 8, 1, 6912]
    - [133, 2.307]
  - - [5120, 8, 1, 8192]
    - [50, 2.572]
  - - [6912, 8, 1, 5120]
    - [133, 1.916]
  - - [7680, 8, 1, 5120]
    - [134, 1.986]
  - - [8000, 8, 1, 5120]
    - [134, 1.958]
  - - [8000, 8, 1, 8192]
    - [51, 2.66]
  - - [8192, 8, 1, 2048]
    - [52, 1.34]
  - - [8192, 8, 1, 4096]
    - [135, 1.403]
  - - [8192, 8, 1, 7168]
    - [27, 3.16]
  - - [8192, 8, 1, 8192]
    - [27, 2.573]
  - - [10240, 8, 1, 8192]
    - [27, 2.913]
  - - [13824, 8, 1, 5120]
    - [53, 3.349]
  - - [14336, 8, 1, 8192]
    - [54, 2.445]
  - - [15360, 8, 1, 5120]
    - [55, 3.214]
  - - [16000, 8, 1, 5120]
    - [56, 3.357]
  - - [16000, 8, 1, 8192]
    - [186, 1.319]
  - - [27648, 8, 1, 5120]
    - [57, 3.417]
  - - [28672, 8, 1, 8192]
    - [187, 2.777]
  - - [32000, 8, 1, 5120]
    - [188, 3.789]
  - - [32000, 8, 1, 8192]
    - [189, 2.813]
  - - [57344, 8, 1, 8192]
    - [58, 4.517]
  - - [5120, 8, 1, 13824]
    - [59, 3.27]
  - - [8192, 8, 1, 14336]
    - [60, 2.953]
  - - [8192, 8, 1, 28672]
    - [225, 3.891]
  - - [1920, 32, 1, 5120]
    - [136, 5.565]
  - - [2560, 32, 1, 8192]
    - [137, 6.325]
  - - [3456, 32, 1, 5120]
    - [61, 8.851]
  - - [3840, 32, 1, 5120]
    - [138, 7.735]
  - - [4000, 32, 1, 5120]
    - [139, 8.026]
  - - [5120, 32, 1, 640]
    - [62, 2.556]
  - - [5120, 32, 1, 1280]
    - [63, 4.602]
  - - [5120, 32, 1, 1728]
    - [64, 3.285]
  - - [5120, 32, 1, 2560]
    - [140, 6.435]
  - - [5120, 32, 1, 3456]
    - [65, 6.149]
  - - [5120, 32, 1, 5120]
    - [141, 7.772]
  - - [5120, 32, 1, 6912]
    - [141, 9.994]
  - - [5120, 32, 1, 8192]
    - [66, 8.028]
  - - [6912, 32, 1, 5120]
    - [142, 8.846]
  - - [7680, 32, 1, 5120]
    - [141, 8.965]
  - - [8000, 32, 1, 5120]
    - [141, 8.779]
  - - [8000, 32, 1, 8192]
    - [143, 9.214]
  - - [8192, 32, 1, 2048]
    - [68, 5.366]
  - - [8192, 32, 1, 4096]
    - [29, 7.743]
  - - [8192, 32, 1, 7168]
    - [142, 10.641]
  - - [8192, 32, 1, 8192]
    - [67, 9.758]
  - - [10240, 32, 1, 8192]
    - [75, 9.921]
  - - [13824, 32, 1, 5120]
    - [69, 13.211]
  - - [14336, 32, 1, 8192]
    - [190, 7.716]
  - - [15360, 32, 1, 5120]
    - [70, 14.731]
  - - [16000, 32, 1, 5120]
    - [71, 14.549]
  - - [16000, 32, 1, 8192]
    - [191, 5.643]
  - - [27648, 32, 1, 5120]
    - [192, 9.091]
  - - [28672, 32, 1, 8192]
    - [72, 16.119]
  - - [32000, 32, 1, 5120]
    - [73, 16.335]
  - - [32000, 32, 1, 8192]
    - [193, 13.012]
  - - [57344, 32, 1, 8192]
    - [194, 11.943]
  - - [5120, 32, 1, 13824]
    - [226, 11.54]
  - - [8192, 32, 1, 14336]
    - [74, 11.559]
  - - [8192, 32, 1, 28672]
    - [227, 18.563]
  - - [1216, 1024, 1, 1024]
    - [76, 6.58]
  - - [1216, 1024, 1, 2048]
    - [77, 11.25]
  - - [1216, 4096, 1, 4096]
    - [78, 28.47]
  - - [2432, 512, 1, 1024]
    - [79, 6.3]
  - - [4864, 512, 1, 1024]
    - [80, 10.15]
  - - [512, 608, 1, 512]
    - [81, 1.06]
  - - [608, 512, 1, 512]
    - [81, 1.12]
  - - [1216, 256, 1, 512]
    - [81, 1.1]
  - - [2432, 2048, 1, 1024]
    - [82, 26.7]
  - - [2432, 2048, 1, 2048]
    - [252, 34.497]
  - - [2048, 2432, 1, 1024]
    - [83, 30.7]
  - - [2048, 2432, 1, 2048]
    - [84, 34.8]
  - - [4864, 1024, 1, 1024]
    - [85, 31.2]
  - - [4864, 1024, 1, 2048]
    - [86, 36.0]
  - - [32, 32, 1, 256]
    - [87, 0.01]
  - - [32, 32, 1, 512]
    - [88, 0.02]
  - - [64, 64, 1, 256]
    - [89, 0.03]
  - - [64, 64, 1, 512]
    - [89, 0.06]
  - - [128, 128, 1, 256]
    - [90, 0.12]
  - - [128, 128, 1, 512]
    - [91, 0.25]
  - - [128, 128, 1, 1024]
    - [92, 0.46]
  - - [1024, 128, 1, 1024]
    - [93, 1.1]
  - - [1024, 256, 1, 1024]
    - [94, 1.64]
  - - [1024, 512, 1, 1024]
    - [95, 3.55]
  - - [1024, 1024, 1, 1024]
    - [96, 5.46]
  - - [1024, 2048, 1, 1024]
    - [97, 8.41]
  - - [1024, 4096, 1, 1024]
    - [98, 14.41]
  - - [1024, 8192, 1, 1024]
    - [99, 15.27]
  - - [1024, 128, 1, 4096]
    - [100, 1.79]
  - - [1024, 256, 1, 4096]
    - [101, 3.64]
  - - [1024, 512, 1, 4096]
    - [102, 6.88]
  - - [1024, 2048, 1, 4096]
    - [103, 17.91]
  - - [1024, 16384, 1, 4096]
    - [104, 34.13]
  - - [1024, 16384, 1, 1024]
    - [11, 32.71]
  - - [1024, 1024, 1, 4096]
    - [77, 13.14]
  - - [1024, 4096, 1, 4096]
    - [380, 33.926]
  - - [1024, 8192, 1, 4096]
    - [17, 18.76]
  - - [32768, 1024, 1, 64]
    - [122, 4.11]
  - - [32768, 2048, 1, 64]
    - [123, 3.95]
  - - [32768, 4096, 1, 64]
    - [124, 4.83]
  - - [32768, 8192, 1, 64]
    - [125, 5.45]
  - - [32768, 1024, 1, 1024]
    - [105, 31.51]
  - - [32768, 2048, 1, 1024]
    - [39, 41.31]
  - - [32768, 4096, 1, 1024]
    - [39, 52.88]
  - - [32768, 8192, 1, 1024]
    - [39, 46.19]
  - - [64, 1024, 1, 64]
    - [116, 0.09]
  - - [64, 2048, 1, 64]
    - [117, 0.11]
  - - [64, 4096, 1, 64]
    - [118, 0.13]
  - - [64, 8192, 1, 64]
    - [119, 0.16]
  - - [64, 100352, 1, 64]
    - [120, 0.69]
  - - [64, 401408, 1, 64]
    - [121, 1.14]
  - - [192, 24320, 1, 192]
    - [111, 3.73]
  - - [192, 99712, 1, 192]
    - [112, 3.69]
  - - [192, 102144, 1, 192]
    - [113, 3.71]
  - - [192, 99712, 1, 768]
    - [114, 10.63]
  - - [192, 102144, 1, 768]
    - [115, 11.01]
  - - [4096, 1024, 1, 1024]
    - [106, 12.77]
  - - [4096, 2048, 1, 1024]
    - [107, 23.16]
  - - [4096, 4096, 1, 1024]
    - [108, 34.02]
  - - [4096, 8192, 1, 1024]
    - [109, 39.83]
  - - [4096, 16384, 1, 1024]
    - [110, 50.25]
  - - [65536, 8192, 1, 12800]
    - [126, 72.8]
  - - [4096, 6144, 1, 8192]
    - [127, 50.6]
  - - [4096, 8192, 1, 2048]
    - [128, 58.4]
  - - [8192, 8192, 1, 4096]
    - [129, 67.3]
  - - [1920, 64, 1, 5120]
    - [145, 8.887]
  - - [2560, 64, 1, 8192]
    - [146, 10.2]
  - - [3456, 64, 1, 5120]
    - [147, 10.873]
  - - [3840, 64, 1, 5120]
    - [148, 13.305]
  - - [4000, 64, 1, 5120]
    - [149, 10.753]
  - - [5120, 64, 1, 640]
    - [150, 4.537]
  - - [5120, 64, 1, 1280]
    - [151, 6.93]
  - - [5120, 64, 1, 1728]
    - [152, 5.411]
  - - [5120, 64, 1, 2560]
    - [153, 10.738]
  - - [5120, 64, 1, 3456]
    - [154, 10.042]
  - - [5120, 64, 1, 5120]
    - [155, 13.431]
  - - [5120, 64, 1, 6912]
    - [156, 15.896]
  - - [5120, 64, 1, 8192]
    - [153, 14.819]
  - - [6912, 64, 1, 5120]
    - [151, 17.009]
  - - [7680, 64, 1, 5120]
    - [153, 18.44]
  - - [8000, 64, 1, 5120]
    - [157, 18.04]
  - - [8000, 64, 1, 8192]
    - [158, 11.232]
  - - [8192, 64, 1, 4096]
    - [34, 12.007]
  - - [8192, 64, 1, 7168]
    - [160, 22.137]
  - - [8192, 64, 1, 8192]
    - [161, 11.02]
  - - [1280, 128, 1, 8192]
    - [162, 10.779]
  - - [1920, 128, 1, 5120]
    - [163, 14.62]
  - - [2560, 128, 1, 8192]
    - [164, 17.102]
  - - [3456, 128, 1, 5120]
    - [165, 19.004]
  - - [3840, 128, 1, 5120]
    - [166, 21.84]
  - - [4000, 128, 1, 5120]
    - [164, 22.1]
  - - [4000, 128, 1, 8192]
    - [164, 21.384]
  - - [5120, 128, 1, 640]
    - [167, 8.415]
  - - [5120, 128, 1, 1280]
    - [168, 10.751]
  - - [5120, 128, 1, 1728]
    - [169, 10.587]
  - - [5120, 128, 1, 2560]
    - [168, 14.14]
  - - [5120, 128, 1, 3456]
    - [168, 18.526]
  - - [5120, 128, 1, 5120]
    - [170, 15.498]
  - - [5120, 128, 1, 6912]
    - [171, 16.914]
  - - [5120, 128, 1, 8192]
    - [171, 17.998]
  - - [6912, 128, 1, 5120]
    - [172, 24.07]
  - - [7168, 128, 1, 8192]
    - [173, 24.699]
  - - [7680, 128, 1, 5120]
    - [168, 25.982]
  - - [8000, 128, 1, 5120]
    - [172, 26.875]
  - - [8000, 128, 1, 8192]
    - [174, 18.412]
  - - [8192, 128, 1, 1024]
    - [175, 14.725]
  - - [8192, 128, 1, 2048]
    - [171, 16.238]
  - - [8192, 128, 1, 3584]
    - [168, 27.161]
  - - [8192, 128, 1, 4096]
    - [172, 21.496]
  - - [8192, 128, 1, 7168]
    - [168, 30.308]
  - - [8192, 128, 1, 8192]
    - [176, 18.386]
  - - [1280, 256, 1, 8192]
    - [177, 16.399]
  - - [1920, 256, 1, 5120]
    - [164, 23.486]
  - - [2560, 256, 1, 8192]
    - [168, 19.439]
  - - [3456, 256, 1, 5120]
    - [175, 23.069]
  - - [3840, 256, 1, 5120]
    - [168, 28.287]
  - - [4000, 256, 1, 5120]
    - [168, 27.955]
  - - [4000, 256, 1, 8192]
    - [174, 25.408]
  - - [5120, 256, 1, 640]
    - [178, 12.399]
  - - [5120, 256, 1, 1280]
    - [178, 15.359]
  - - [5120, 256, 1, 1728]
    - [179, 17.96]
  - - [5120, 256, 1, 2560]
    - [178, 18.394]
  - - [5120, 256, 1, 3456]
    - [180, 25.005]
  - - [5120, 256, 1, 5120]
    - [181, 20.92]
  - - [5120, 256, 1, 6912]
    - [182, 22.794]
  - - [5120, 256, 1, 8192]
    - [182, 24.546]
  - - [6912, 256, 1, 5120]
    - [183, 29.183]
  - - [7168, 256, 1, 8192]
    - [184, 32.629]
  - - [7680, 256, 1, 5120]
    - [182, 29.397]
  - - [8000, 256, 1, 5120]
    - [182, 36.328]
  - - [8000, 256, 1, 8192]
    - [184, 39.407]
  - - [8192, 256, 1, 1024]
    - [185, 18.255]
  - - [8192, 256, 1, 2048]
    - [178, 24.156]
  - - [8192, 256, 1, 3584]
    - [181, 31.34]
  - - [8192, 256, 1, 4096]
    - [182, 26.185]
  - - [8192, 256, 1, 7168]
    - [181, 36.861]
  - - [8192, 256, 1, 8192]
    - [184, 36.739]
  - - [10240, 64, 1, 8192]
    - [195, 11.205]
  - - [13824, 64, 1, 5120]
    - [196, 18.432]
  - - [14336, 64, 1, 8192]
    - [197, 14.231]
  - - [15360, 64, 1, 5120]
    - [198, 20.858]
  - - [16000, 64, 1, 5120]
    - [199, 21.257]
  - - [16000, 64, 1, 8192]
    - [200, 13.162]
  - - [27648, 64, 1, 5120]
    - [201, 21.035]
  - - [28672, 64, 1, 8192]
    - [202, 22.502]
  - - [32000, 64, 1, 5120]
    - [203, 25.703]
  - - [32000, 64, 1, 8192]
    - [204, 20.481]
  - - [57344, 64, 1, 8192]
    - [205, 30.397]
  - - [10240, 128, 1, 8192]
    - [206, 20.303]
  - - [13824, 128, 1, 5120]
    - [207, 28.817]
  - - [14336, 128, 1, 8192]
    - [208, 30.104]
  - - [15360, 128, 1, 5120]
    - [209, 34.376]
  - - [16000, 128, 1, 5120]
    - [206, 33.559]
  - - [16000, 128, 1, 8192]
    - [206, 31.635]
  - - [27648, 128, 1, 5120]
    - [210, 42.122]
  - - [28672, 128, 1, 8192]
    - [211, 51.403]
  - - [32000, 128, 1, 5120]
    - [212, 39.982]
  - - [32000, 128, 1, 8192]
    - [213, 43.058]
  - - [57344, 128, 1, 8192]
    - [214, 54.764]
  - - [10240, 256, 1, 8192]
    - [215, 37.033]
  - - [13824, 256, 1, 5120]
    - [216, 27.773]
  - - [14336, 256, 1, 8192]
    - [217, 30.871]
  - - [15360, 256, 1, 5120]
    - [218, 28.206]
  - - [16000, 256, 1, 5120]
    - [219, 33.62]
  - - [16000, 256, 1, 8192]
    - [220, 37.031]
  - - [27648, 256, 1, 5120]
    - [221, 38.042]
  - - [28672, 256, 1, 8192]
    - [222, 63.182]
  - - [32000, 256, 1, 5120]
    - [105, 48.154]
  - - [32000, 256, 1, 8192]
    - [223, 51.125]
  - - [57344, 256, 1, 8192]
    - [224, 65.545]
  - - [5120, 64, 1, 13824]
    - [228, 18.204]
  - - [8192, 64, 1, 14336]
    - [228, 20.213]
  - - [8192, 64, 1, 28672]
    - [229, 31.754]
  - - [5120, 128, 1, 13824]
    - [230, 30.648]
  - - [8192, 128, 1, 14336]
    - [231, 27.501]
  - - [8192, 128, 1, 28672]
    - [232, 45.435]
  - - [5120, 256, 1, 13824]
    - [233, 25.264]
  - - [8192, 256, 1, 14336]
    - [234, 37.577]
  - - [8192, 256, 1, 28672]
    - [233, 39.911]
  - - [128, 2048, 1, 2048]
    - [235, 9.368]
  - - [256, 2048, 1, 2048]
    - [236, 12.888]
  - - [384, 2048, 1, 2048]
    - [237, 16.501]
  - - [512, 2048, 1, 2048]
    - [238, 22.441]
  - - [640, 2048, 1, 2048]
    - [239, 20.085]
  - - [768, 2048, 1, 2048]
    - [240, 23.545]
  - - [896, 2048, 1, 2048]
    - [241, 25.27]
  - - [1024, 2048, 1, 2048]
    - [242, 29.855]
  - - [1152, 2048, 1, 2048]
    - [243, 26.819]
  - - [1280, 2048, 1, 2048]
    - [244, 27.567]
  - - [1408, 2048, 1, 2048]
    - [244, 31.397]
  - - [1536, 2048, 1, 2048]
    - [245, 34.107]
  - - [1664, 2048, 1, 2048]
    - [246, 39.528]
  - - [1792, 2048, 1, 2048]
    - [247, 41.055]
  - - [1920, 2048, 1, 2048]
    - [248, 28.941]
  - - [2048, 2048, 1, 2048]
    - [249, 30.05]
  - - [2176, 2048, 1, 2048]
    - [250, 29.577]
  - - [2304, 2048, 1, 2048]
    - [251, 31.069]
  - - [2560, 2048, 1, 2048]
    - [253, 32.837]
  - - [2688, 2048, 1, 2048]
    - [254, 43.943]
  - - [2816, 2048, 1, 2048]
    - [255, 39.185]
  - - [2944, 2048, 1, 2048]
    - [256, 50.419]
  - - [3072, 2048, 1, 2048]
    - [257, 33.597]
  - - [3200, 2048, 1, 2048]
    - [258, 36.753]
  - - [3328, 2048, 1, 2048]
    - [259, 41.83]
  - - [3456, 2048, 1, 2048]
    - [260, 38.045]
  - - [3584, 2048, 1, 2048]
    - [261, 52.337]
  - - [3712, 2048, 1, 2048]
    - [262, 45.919]
  - - [3840, 2048, 1, 2048]
    - [262, 47.17]
  - - [3968, 2048, 1, 2048]
    - [263, 47.198]
  - - [4096, 2048, 1, 2048]
    - [264, 48.249]
  - - [4224, 2048, 1, 2048]
    - [265, 53.055]
  - - [4352, 2048, 1, 2048]
    - [266, 42.6]
  - - [4480, 2048, 1, 2048]
    - [267, 56.383]
  - - [4608, 2048, 1, 2048]
    - [268, 46.12]
  - - [4736, 2048, 1, 2048]
    - [269, 46.239]
  - - [4864, 2048, 1, 2048]
    - [270, 50.475]
  - - [4992, 2048, 1, 2048]
    - [271, 48.065]
  - - [5120, 2048, 1, 2048]
    - [272, 42.862]
  - - [5248, 2048, 1, 2048]
    - [273, 51.711]
  - - [5376, 2048, 1, 2048]
    - [274, 55.897]
  - - [5504, 2048, 1, 2048]
    - [275, 54.422]
  - - [5632, 2048, 1, 2048]
    - [276, 53.984]
  - - [5760, 2048, 1, 2048]
    - [277, 49.649]
  - - [5888, 2048, 1, 2048]
    - [278, 48.619]
  - - [6016, 2048, 1, 2048]
    - [279, 56]
  - - [6144, 2048, 1, 2048]
    - [280, 49.12]
  - - [6272, 2048, 1, 2048]
    - [281, 55.095]
  - - [6400, 2048, 1, 2048]
    - [282, 54.364]
  - - [6528, 2048, 1, 2048]
    - [280, 61.596]
  - - [6656, 2048, 1, 2048]
    - [278, 64.217]
  - - [6784, 2048, 1, 2048]
    - [283, 58.194]
  - - [6912, 2048, 1, 2048]
    - [284, 50.958]
  - - [7040, 2048, 1, 2048]
    - [285, 63.123]
  - - [7168, 2048, 1, 2048]
    - [286, 60.499]
  - - [7296, 2048, 1, 2048]
    - [287, 70.669]
  - - [7424, 2048, 1, 2048]
    - [288, 49.885]
  - - [7552, 2048, 1, 2048]
    - [289, 63.455]
  - - [7680, 2048, 1, 2048]
    - [289, 64.078]
  - - [7808, 2048, 1, 2048]
    - [290, 65.976]
  - - [7936, 2048, 1, 2048]
    - [291, 58.605]
  - - [8064, 2048, 1, 2048]
    - [292, 63.014]
  - - [8192, 2048, 1, 2048]
    - [293, 42.425]
  - - [8320, 2048, 1, 2048]
    - [294, 60.137]
  - - [8448, 2048, 1, 2048]
    - [295, 58.605]
  - - [8576, 2048, 1, 2048]
    - [296, 62.553]
  - - [8704, 2048, 1, 2048]
    - [297, 60.703]
  - - [8832, 2048, 1, 2048]
    - [298, 56.54]
  - - [8960, 2048, 1, 2048]
    - [299, 68.97]
  - - [9088, 2048, 1, 2048]
    - [300, 55.994]
  - - [9216, 2048, 1, 2048]
    - [301, 65.628]
  - - [9344, 2048, 1, 2048]
    - [302, 63.25]
  - - [9472, 2048, 1, 2048]
    - [303, 70.711]
  - - [9600, 2048, 1, 2048]
    - [304, 58.99]
  - - [9728, 2048, 1, 2048]
    - [305, 60.441]
  - - [9856, 2048, 1, 2048]
    - [306, 51.688]
  - - [9984, 2048, 1, 2048]
    - [307, 54.366]
  - - [10112, 2048, 1, 2048]
    - [308, 50.794]
  - - [10240, 2048, 1, 2048]
    - [309, 48.932]
  - - [10368, 2048, 1, 2048]
    - [310, 50.73]
  - - [10496, 2048, 1, 2048]
    - [311, 59.728]
  - - [10624, 2048, 1, 2048]
    - [312, 53.898]
  - - [10752, 2048, 1, 2048]
    - [313, 54.187]
  - - [10880, 2048, 1, 2048]
    - [314, 49.01]
  - - [11008, 2048, 1, 2048]
    - [315, 59.333]
  - - [11136, 2048, 1, 2048]
    - [316, 54.197]
  - - [11264, 2048, 1, 2048]
    - [317, 57.526]
  - - [11392, 2048, 1, 2048]
    - [318, 57.26]
  - - [11520, 2048, 1, 2048]
    - [319, 57.307]
  - - [11648, 2048, 1, 2048]
    - [320, 61.221]
  - - [11776, 2048, 1, 2048]
    - [321, 63.138]
  - - [11904, 2048, 1, 2048]
    - [322, 63.319]
  - - [12032, 2048, 1, 2048]
    - [322, 61.072]
  - - [12160, 2048, 1, 2048]
    - [323, 60.878]
  - - [12288, 2048, 1, 2048]
    - [324, 54.475]
  - - [12416, 2048, 1, 2048]
    - [325, 51.164]
  - - [12544, 2048, 1, 2048]
    - [326, 56.503]
  - - [12672, 2048, 1, 2048]
    - [327, 56.783]
  - - [12800, 2048, 1, 2048]
    - [327, 62.949]
  - - [12928, 2048, 1, 2048]
    - [328, 58.109]
  - - [13056, 2048, 1, 2048]
    - [329, 55.927]
  - - [13184, 2048, 1, 2048]
    - [330, 57.09]
  - - [13312, 2048, 1, 2048]
    - [331, 49.603]
  - - [13440, 2048, 1, 2048]
    - [324, 65.698]
  - - [13568, 2048, 1, 2048]
    - [332, 60.593]
  - - [13696, 2048, 1, 2048]
    - [333, 58.547]
  - - [13824, 2048, 1, 2048]
    - [334, 62.233]
  - - [13952, 2048, 1, 2048]
    - [335, 63.421]
  - - [14080, 2048, 1, 2048]
    - [336, 66.196]
  - - [14208, 2048, 1, 2048]
    - [337, 69.284]
  - - [14336, 2048, 1, 2048]
    - [338, 65.666]
  - - [14464, 2048, 1, 2048]
    - [339, 62.133]
  - - [14592, 2048, 1, 2048]
    - [332, 63.179]
  - - [14720, 2048, 1, 2048]
    - [340, 56.334]
  - - [14848, 2048, 1, 2048]
    - [341, 59.106]
  - - [14976, 2048, 1, 2048]
    - [342, 59.477]
  - - [15104, 2048, 1, 2048]
    - [343, 64.907]
  - - [15232, 2048, 1, 2048]
    - [344, 57.184]
  - - [15360, 2048, 1, 2048]
    - [345, 59.188]
  - - [15488, 2048, 1, 2048]
    - [346, 65.744]
  - - [15616, 2048, 1, 2048]
    - [347, 63.435]
  - - [15744, 2048, 1, 2048]
    - [341, 65.443]
  - - [15872, 2048, 1, 2048]
    - [313, 58.11]
  - - [16000, 2048, 1, 2048]
    - [348, 57.123]
  - - [16128, 2048, 1, 2048]
    - [349, 58.151]
  - - [16256, 2048, 1, 2048]
    - [348, 65.413]
  - - [16384, 2048, 1, 2048]
    - [350, 54.569]
  - - [16512, 2048, 1, 2048]
    - [351, 54.789]
  - - [16640, 2048, 1, 2048]
    - [340, 58.447]
  - - [16768, 2048, 1, 2048]
    - [352, 67.844]
  - - [16896, 2048, 1, 2048]
    - [353, 59.969]
  - - [17024, 2048, 1, 2048]
    - [294, 65.064]
  - - [17152, 2048, 1, 2048]
    - [354, 59.16]
  - - [17280, 2048, 1, 2048]
    - [340, 59.183]
  - - [17408, 2048, 1, 2048]
    - [355, 62.447]
  - - [17536, 2048, 1, 2048]
    - [356, 58.817]
  - - [17664, 2048, 1, 2048]
    - [357, 64.236]
  - - [17792, 2048, 1, 2048]
    - [358, 60.476]
  - - [17920, 2048, 1, 2048]
    - [340, 63.368]
  - - [18048, 2048, 1, 2048]
    - [359, 64.385]
  - - [18176, 2048, 1, 2048]
    - [360, 68.37]
  - - [18304, 2048, 1, 2048]
    - [361, 58.407]
  - - [18432, 2048, 1, 2048]
    - [333, 55.84]
  - - [18560, 2048, 1, 2048]
    - [362, 66.902]
  - - [18688, 2048, 1, 2048]
    - [363, 72.057]
  - - [18816, 2048, 1, 2048]
    - [364, 65.615]
  - - [18944, 2048, 1, 2048]
    - [365, 76.508]
  - - [19072, 2048, 1, 2048]
    - [366, 64.282]
  - - [19200, 2048, 1, 2048]
    - [367, 77.966]
  - - [19328, 2048, 1, 2048]
    - [368, 67.264]
  - - [19456, 2048, 1, 2048]
    - [369, 63.358]
  - - [19584, 2048, 1, 2048]
    - [370, 64.655]
  - - [19712, 2048, 1, 2048]
    - [371, 58.002]
  - - [19840, 2048, 1, 2048]
    - [372, 56.799]
  - - [19968, 2048, 1, 2048]
    - [339, 60.393]
  - - [128, 4096, 1, 4096]
    - [373, 18.224]
  - - [256, 4096, 1, 4096]
    - [374, 23.298]
  - - [384, 4096, 1, 4096]
    - [375, 24.157]
  - - [512, 4096, 1, 4096]
    - [376, 34.26]
  - - [640, 4096, 1, 4096]
    - [377, 32.983]
  - - [768, 4096, 1, 4096]
    - [378, 39.227]
  - - [896, 4096, 1, 4096]
    - [379, 28.912]
  - - [1152, 4096, 1, 4096]
    - [381, 40.174]
  - - [1280, 4096, 1, 4096]
    - [382, 34.611]
  - - [1408, 4096, 1, 4096]
    - [383, 43.159]
  - - [1536, 4096, 1, 4096]
    - [384, 39.965]
  - - [1664, 4096, 1, 4096]
    - [385, 46.141]
  - - [1792, 4096, 1, 4096]
    - [386, 39.962]
  - - [1920, 4096, 1, 4096]
    - [387, 46.452]
  - - [2048, 4096, 1, 4096]
    - [388, 43.64]
  - - [2176, 4096, 1, 4096]
    - [389, 46.907]
  - - [2304, 4096, 1, 4096]
    - [390, 51.349]
  - - [2432, 4096, 1, 4096]
    - [391, 54.436]
  - - [2560, 4096, 1, 4096]
    - [392, 49.11]
  - - [2688, 4096, 1, 4096]
    - [393, 58.56]
  - - [2816, 4096, 1, 4096]
    - [394, 59.577]
  - - [2944, 4096, 1, 4096]
    - [392, 64.635]
  - - [3072, 4096, 1, 4096]
    - [395, 54.665]
  - - [3200, 4096, 1, 4096]
    - [290, 55.749]
  - - [3328, 4096, 1, 4096]
    - [396, 63.376]
  - - [3456, 4096, 1, 4096]
    - [397, 63.064]
  - - [3584, 4096, 1, 4096]
    - [290, 64.574]
  - - [3712, 4096, 1, 4096]
    - [290, 65.455]
  - - [3840, 4096, 1, 4096]
    - [398, 67.112]
  - - [3968, 4096, 1, 4096]
    - [399, 66.065]
  - - [4096, 4096, 1, 4096]
    - [400, 69.057]
  - - [4224, 4096, 1, 4096]
    - [399, 68.086]
  - - [4352, 4096, 1, 4096]
    - [401, 48.553]
  - - [4480, 4096, 1, 4096]
    - [367, 70.61]
  - - [4608, 4096, 1, 4096]
    - [402, 57.297]
  - - [4736, 4096, 1, 4096]
    - [403, 66.248]
  - - [4992, 4096, 1, 4096]
    - [405, 55.058]
  - - [5120, 4096, 1, 4096]
    - [406, 55.149]
  - - [5248, 4096, 1, 4096]
    - [407, 63.161]
  - - [5376, 4096, 1, 4096]
    - [408, 55.883]
  - - [5504, 4096, 1, 4096]
    - [409, 62.423]
  - - [5632, 4096, 1, 4096]
    - [410, 64.911]
  - - [5760, 4096, 1, 4096]
    - [411, 65.696]
  - - [5888, 4096, 1, 4096]
    - [412, 56.438]
  - - [6016, 4096, 1, 4096]
    - [413, 57.297]
  - - [6144, 4096, 1, 4096]
    - [414, 57.967]
  - - [6272, 4096, 1, 4096]
    - [415, 60.921]
  - - [6400, 4096, 1, 4096]
    - [416, 62.4]
  - - [6528, 4096, 1, 4096]
    - [417, 66.332]
  - - [6656, 4096, 1, 4096]
    - [418, 57.195]
  - - [6784, 4096, 1, 4096]
    - [419, 68.227]
  - - [6912, 4096, 1, 4096]
    - [420, 70.208]
  - - [7040, 4096, 1, 4096]
    - [421, 62.654]
  - - [7168, 4096, 1, 4096]
    - [413, 73.327]
  - - [7296, 4096, 1, 4096]
    - [336, 75.013]
  - - [7424, 4096, 1, 4096]
    - [422, 67.197]
  - - [7552, 4096, 1, 4096]
    - [323, 58.834]
  - - [7680, 4096, 1, 4096]
    - [323, 60.438]
  - - [7808, 4096, 1, 4096]
    - [423, 74.406]
  - - [7936, 4096, 1, 4096]
    - [295, 69.934]
  - - [8064, 4096, 1, 4096]
    - [424, 69.442]
  - - [8192, 4096, 1, 4096]
    - [425, 65.578]
  - - [8320, 4096, 1, 4096]
    - [295, 73.951]
  - - [8448, 4096, 1, 4096]
    - [295, 76.151]
  - - [8576, 4096, 1, 4096]
    - [426, 67.614]
  - - [8704, 4096, 1, 4096]
    - [427, 70.491]
  - - [8832, 4096, 1, 4096]
    - [319, 69.282]
  - - [8960, 4096, 1, 4096]
    - [319, 70.936]
  - - [9088, 4096, 1, 4096]
    - [329, 62.066]
  - - [9216, 4096, 1, 4096]
    - [428, 63.372]
  - - [9344, 4096, 1, 4096]
    - [429, 68.403]
  - - [9472, 4096, 1, 4096]
    - [430, 62.405]
  - - [9600, 4096, 1, 4096]
    - [431, 69.468]
  - - [9728, 4096, 1, 4096]
    - [432, 64.339]
  - - [9856, 4096, 1, 4096]
    - [432, 65.243]
  - - [9984, 4096, 1, 4096]
    - [329, 69.715]
  - - [10112, 4096, 1, 4096]
    - [433, 68.054]
  - - [10240, 4096, 1, 4096]
    - [434, 68.063]
  - - [10368, 4096, 1, 4096]
    - [329, 74.893]
  - - [10496, 4096, 1, 4096]
    - [413, 77.477]
  - - [10624, 4096, 1, 4096]
    - [413, 74.33]
  - - [10752, 4096, 1, 4096]
    - [414, 73.789]
  - - [10880, 4096, 1, 4096]
    - [336, 76.725]
  - - [11008, 4096, 1, 4096]
    - [435, 71.224]
  - - [11136, 4096, 1, 4096]
    - [436, 68.291]
  - - [11264, 4096, 1, 4096]
    - [437, 73.744]
  - - [11392, 4096, 1, 4096]
    - [340, 68.815]
  - - [11520, 4096, 1, 4096]
    - [438, 72.207]
  - - [11648, 4096, 1, 4096]
    - [438, 72.852]
  - - [11776, 4096, 1, 4096]
    - [437, 76.952]
  - - [11904, 4096, 1, 4096]
    - [295, 76.488]
  - - [12032, 4096, 1, 4096]
    - [319, 71.381]
  - - [12160, 4096, 1, 4096]
    - [439, 72.704]
  - - [12288, 4096, 1, 4096]
    - [440, 70.106]
  - - [12416, 4096, 1, 4096]
    - [441, 75.484]
  - - [12544, 4096, 1, 4096]
    - [442, 71.387]
  - - [12672, 4096, 1, 4096]
    - [327, 69.053]
  - - [12800, 4096, 1, 4096]
    - [323, 62.092]
  - - [12928, 4096, 1, 4096]
    - [443, 68.264]
  - - [13056, 4096, 1, 4096]
    - [420, 68.539]
  - - [13184, 4096, 1, 4096]
    - [444, 71.009]
  - - [13312, 4096, 1, 4096]
    - [445, 66.845]
  - - [13440, 4096, 1, 4096]
    - [441, 65.847]
  - - [13568, 4096, 1, 4096]
    - [446, 78.313]
  - - [13696, 4096, 1, 4096]
    - [447, 71.981]
  - - [13824, 4096, 1, 4096]
    - [431, 73.165]
  - - [13952, 4096, 1, 4096]
    - [323, 67.873]
  - - [14080, 4096, 1, 4096]
    - [319, 68.694]
  - - [14208, 4096, 1, 4096]
    - [295, 65.593]
  - - [14336, 4096, 1, 4096]
    - [448, 70.229]
  - - [14464, 4096, 1, 4096]
    - [413, 80.623]
  - - [14592, 4096, 1, 4096]
    - [335, 80.541]
  - - [14720, 4096, 1, 4096]
    - [319, 71.015]
  - - [14848, 4096, 1, 4096]
    - [438, 71.767]
  - - [14976, 4096, 1, 4096]
    - [423, 71.811]
  - - [15104, 4096, 1, 4096]
    - [349, 72.423]
  - - [15232, 4096, 1, 4096]
    - [449, 64.623]
  - - [15360, 4096, 1, 4096]
    - [417, 65.325]
  - - [15488, 4096, 1, 4096]
    - [429, 66.166]
  - - [15616, 4096, 1, 4096]
    - [437, 76.972]
  - - [15744, 4096, 1, 4096]
    - [437, 77.923]
  - - [15872, 4096, 1, 4096]
    - [295, 78.19]
  - - [16000, 4096, 1, 4096]
    - [450, 70.696]
  - - [16128, 4096, 1, 4096]
    - [349, 75.37]
  - - [16256, 4096, 1, 4096]
    - [451, 68.648]
  - - [16384, 4096, 1, 4096]
    - [452, 68.956]
  - - [16512, 4096, 1, 4096]
    - [319, 67.034]
  - - [16640, 4096, 1, 4096]
    - [357, 68.096]
  - - [16768, 4096, 1, 4096]
    - [453, 71.261]
  - - [16896, 4096, 1, 4096]
    - [329, 72.004]
  - - [17024, 4096, 1, 4096]
    - [442, 78.183]
  - - [17152, 4096, 1, 4096]
    - [428, 75.732]
  - - [17280, 4096, 1, 4096]
    - [454, 76.552]
  - - [17408, 4096, 1, 4096]
    - [455, 80.324]
  - - [17536, 4096, 1, 4096]
    - [455, 79.914]
  - - [17664, 4096, 1, 4096]
    - [428, 78.617]
  - - [17792, 4096, 1, 4096]
    - [357, 72.916]
  - - [17920, 4096, 1, 4096]
    - [323, 73.65]
  - - [18048, 4096, 1, 4096]
    - [447, 79.903]
  - - [18176, 4096, 1, 4096]
    - [413, 83.777]
  - - [18304, 4096, 1, 4096]
    - [438, 70.914]
  - - [18432, 4096, 1, 4096]
    - [335, 65.901]
  - - [18560, 4096, 1, 4096]
    - [414, 72.532]
  - - [18688, 4096, 1, 4096]
    - [450, 68.991]
  - - [18816, 4096, 1, 4096]
    - [353, 67.973]
  - - [18944, 4096, 1, 4096]
    - [455, 74.521]
  - - [19072, 4096, 1, 4096]
    - [319, 68.501]
  - - [19200, 4096, 1, 4096]
    - [319, 67.908]
  - - [19328, 4096, 1, 4096]
    - [456, 77.85]
  - - [19456, 4096, 1, 4096]
    - [457, 75.737]
  - - [19584, 4096, 1, 4096]
    - [441, 72.957]
  - - [19712, 4096, 1, 4096]
    - [441, 72.84]
  - - [19840, 4096, 1, 4096]
    - [458, 71.753]
  - - [19968, 4096, 1, 4096]
    - [459, 72.423]
  - - [128, 8192, 1, 8192]
    - [374, 29.105]
  - - [256, 8192, 1, 8192]
    - [460, 32.559]
  - - [384, 8192, 1, 8192]
    - [377, 45.362]
  - - [512, 8192, 1, 8192]
    - [461, 47.318]
  - - [640, 8192, 1, 8192]
    - [462, 55.21]
  - - [768, 8192, 1, 8192]
    - [463, 51.208]
  - - [896, 8192, 1, 8192]
    - [464, 51.094]
  - - [1024, 8192, 1, 8192]
    - [465, 49.671]
  - - [1152, 8192, 1, 8192]
    - [466, 58.908]
  - - [1280, 8192, 1, 8192]
    - [467, 59.396]
  - - [1408, 8192, 1, 8192]
    - [272, 65.447]
  - - [1536, 8192, 1, 8192]
    - [468, 70.863]
  - - [1664, 8192, 1, 8192]
    - [469, 66.836]
  - - [1792, 8192, 1, 8192]
    - [470, 75.89]
  - - [1920, 8192, 1, 8192]
    - [400, 69.916]
  - - [2048, 8192, 1, 8192]
    - [471, 71.623]
  - - [2176, 8192, 1, 8192]
    - [472, 62.657]
  - - [2304, 8192, 1, 8192]
    - [389, 67.09]
  - - [2432, 8192, 1, 8192]
    - [389, 72.037]
  - - [2560, 8192, 1, 8192]
    - [473, 69.953]
  - - [2688, 8192, 1, 8192]
    - [277, 63.758]
  - - [2816, 8192, 1, 8192]
    - [394, 67.06]
  - - [2944, 8192, 1, 8192]
    - [277, 70.586]
  - - [3072, 8192, 1, 8192]
    - [474, 73.924]
  - - [3200, 8192, 1, 8192]
    - [475, 67.225]
  - - [3328, 8192, 1, 8192]
    - [476, 75.353]
  - - [3456, 8192, 1, 8192]
    - [286, 75.917]
  - - [3584, 8192, 1, 8192]
    - [477, 76.026]
  - - [3712, 8192, 1, 8192]
    - [290, 73.834]
  - - [3840, 8192, 1, 8192]
    - [478, 76.937]
  - - [3968, 8192, 1, 8192]
    - [479, 72.705]
  - - [4096, 8192, 1, 8192]
    - [480, 75.437]
  - - [4224, 8192, 1, 8192]
    - [399, 74.63]
  - - [4352, 8192, 1, 8192]
    - [481, 71.182]
  - - [4480, 8192, 1, 8192]
    - [392, 73.988]
  - - [4608, 8192, 1, 8192]
    - [482, 74.981]
  - - [4736, 8192, 1, 8192]
    - [465, 72.997]
  - - [4864, 8192, 1, 8192]
    - [465, 75.066]
  - - [4992, 8192, 1, 8192]
    - [286, 73.58]
  - - [5120, 8192, 1, 8192]
    - [286, 74.874]
  - - [5248, 8192, 1, 8192]
    - [396, 77.62]
  - - [5376, 8192, 1, 8192]
    - [396, 80.448]
  - - [5504, 8192, 1, 8192]
    - [483, 72.793]
  - - [5632, 8192, 1, 8192]
    - [478, 75.442]
  - - [5760, 8192, 1, 8192]
    - [290, 77.228]
  - - [5888, 8192, 1, 8192]
    - [392, 73.442]
  - - [6016, 8192, 1, 8192]
    - [484, 74.376]
  - - [6144, 8192, 1, 8192]
    - [485, 82.314]
  - - [6272, 8192, 1, 8192]
    - [441, 84.607]
  - - [6400, 8192, 1, 8192]
    - [476, 72.641]
  - - [6528, 8192, 1, 8192]
    - [396, 72.45]
  - - [6656, 8192, 1, 8192]
    - [396, 73.969]
  - - [6784, 8192, 1, 8192]
    - [396, 75.493]
  - - [6912, 8192, 1, 8192]
    - [286, 76.862]
  - - [7040, 8192, 1, 8192]
    - [486, 76.087]
  - - [7168, 8192, 1, 8192]
    - [487, 79.942]
  - - [7296, 8192, 1, 8192]
    - [488, 80.502]
  - - [7424, 8192, 1, 8192]
    - [489, 76.593]
  - - [7552, 8192, 1, 8192]
    - [483, 76.27]
  - - [7680, 8192, 1, 8192]
    - [490, 76.76]
  - - [7808, 8192, 1, 8192]
    - [491, 79.769]
  - - [7936, 8192, 1, 8192]
    - [492, 75.177]
  - - [8064, 8192, 1, 8192]
    - [493, 81.563]
  - - [8320, 8192, 1, 8192]
    - [494, 77.044]
  - - [8448, 8192, 1, 8192]
    - [495, 77.767]
  - - [8576, 8192, 1, 8192]
    - [286, 76.61]
  - - [8704, 8192, 1, 8192]
    - [487, 78.031]
  - - [8832, 8192, 1, 8192]
    - [487, 79.599]
  - - [8960, 8192, 1, 8192]
    - [323, 76.82]
  - - [9088, 8192, 1, 8192]
    - [392, 76.11]
  - - [9216, 8192, 1, 8192]
    - [496, 75.246]
  - - [9344, 8192, 1, 8192]
    - [290, 75.149]
  - - [9472, 8192, 1, 8192]
    - [290, 76.919]
  - - [9600, 8192, 1, 8192]
    - [290, 77.709]
  - - [9856, 8192, 1, 8192]
    - [497, 77.743]
  - - [9984, 8192, 1, 8192]
    - [498, 74.663]
  - - [98304, 98304, 1, 98304]
    - [499, 46.897]
  - - [12288, 2048, 1, 3072]
    - [500, 61.9]
  - - [49152, 2048, 1, 3072]
    - [501, 65.9]
  - - [3072, 2048, 1, 49152]
    - [502, 63.7]
  - - [7168, 4096, 1, 8192]
    - [503, 83.3]
  - - [7168, 1024, 1, 8192]
    - [507, 56.8]
  - - [7168, 574, 1, 8192]
    - [508, 57.0]
  - - [1280, 574, 1, 8192]
    - [504, 32.3]
  - - [1280, 1024, 1, 8192]
    - [505, 40.6]
  - - [1280, 4096, 1, 8192]
    - [506, 55.7]
  - - [8192, 574, 1, 3584]
    - [509, 30.27]
  - - [8192, 4096, 1, 3584]
    - [510, 62.43]
  - - [8192, 4096, 1, 1024]
    - [293, 42.61]
  - - [5120, 512, 1, 8192]
    - [511, 47.3]
  - - [8192, 512, 1, 1024]
    - [512, 47.5]
  - - [8192, 512, 1, 2048]
    - [513, 36.4]
  - - [8192, 512, 1, 3584]
    - [514, 44.9]
  - - [8192, 512, 1, 4096]
    - [515, 46.2]
  - - [8192, 512, 1, 7168]
    - [516, 45.1]
  - - [8192, 512, 1, 8192]
    - [517, 57.7]
  - - [8192, 512, 1, 14336]
    - [518, 50.3]
  - - [8192, 512, 1, 28672]
    - [519, 33.1]
  - - [5120, 1024, 1, 8192]
    - [520, 59.4]
  - - [5120, 1536, 1, 8192]
    - [521, 60.0]
  - - [8192, 1024, 1, 1024]
    - [522, 41.0]
  - - [8192, 1024, 1, 2048]
    - [523, 44.7]
  - - [8192, 1024, 1, 3584]
    - [524, 53.4]
  - - [8192, 1024, 1, 4096]
    - [525, 57.9]
  - - [8192, 1024, 1, 7168]
    - [526, 60.1]
  - - [8192, 1024, 1, 8192]
    - [527, 63.0]
  - - [8192, 1024, 1, 14336]
    - [528, 53.4]
  - - [8192, 1024, 1, 28672]
    - [529, 56.0]
  - - [10240, 512, 1, 8192]
    - [530, 51.0]
  - - [14336, 512, 1, 8192]
    - [531, 47.4]
- null
- null
- DeviceEfficiency
