library/src/blas3/Tensile/Logic/asm_full/aquavanjaram942X/aquavanjaram942_Cijk_Alik_Bjlk_SB.yaml
- {MinimumRequiredVersion: 4.31.0}
- aquavanjaram942
- {Architecture: gfx942, IsAPU: 0}
- [Device 74a1]
    SolutionIndex: 0
    SolutionNameMin: Cijk_Alik_Bjlk_SB_MT64x256x16_MI32x32x2x1_SN_GRVW4_GLS1_LPA4_LRVW2_NEPBS0_NLCB2_PLR9_SVW2_TT2_64_VW2_WG32_8_1_WGM18
    SolutionIndex: 1
    SolutionNameMin: Cijk_Alik_Bjlk_SB_MT128x128x16_MI32x32x2x1_SN_GRVW2_GLS0_LPA2_LRVW2_NEPBS0_NLCB2_PLR9_SVW2_TT4_32_VW2_WG32_8_1_WGM42
    SolutionIndex: 2
    SolutionNameMin: Cijk_Alik_Bjlk_SB_MT128x128x16_MI32x32x2x1_SN_GRVW4_GLS1_LPA4_LRVW1_NEPBS0_NLCB2_PLR1_SVW2_TT2_64_VW2_WG64_4_1_WGM42
    SolutionIndex: 3
    SolutionNameMin: Cijk_Alik_Bjlk_SB_MT256x128x16_MI16x16x4x1_SN_GRVW2_GLS0_LPA2_LRVW1_NEPBS4_NLCB2_PLR5_SVW4_TT8_64_VW4_WG32_8_1_WGM36
    SolutionIndex: 4
    SolutionNameMin: Cijk_Alik_Bjlk_SB_MT256x128x16_MI16x16x4x1_SN_GRVW2_GLS0_LPA2_LRVW1_NEPBS4_NLCB1_PLR5_SVW4_TT8_64_VW4_WG32_8_1_WGM42
    SolutionIndex: 5
    SolutionNameMin: Cijk_Alik_Bjlk_SB_MT128x128x16_MI32x32x2x1_SN_GRVW4_GLS1_LPA4_LRVW2_NEPBS4_NLCB1_PLR9_SVW2_TT2_64_VW2_WG64_4_1_WGM18
    SolutionIndex: 6
    SolutionNameMin: Cijk_Alik_Bjlk_SB_MT64x128x16_MI32x32x2x1_SN_GRVW2_GLS1_LPA2_LRVW1_NEPBS0_PLR9_SU0_SUS0_SVW2_TT2_32_VW2_WG32_8_1_WGM30
    SolutionIndex: 7
    SolutionNameMin: Cijk_Alik_Bjlk_SB_MT128x64x16_MI16x16x4x1_SN_GRVW4_GLS1_LPA4_LRVW2_NEPBS4_PLR5_SU0_SUS0_SVW2_TT4_32_VW2_WG32_8_1_WGM42
    SolutionIndex: 8
    SolutionNameMin: Cijk_Alik_Bjlk_SB_MT64x32x16_MI16x16x4x1_SN_GRVW2_LPA2_LRVW2_MIAV1_NEPBS4_PLR5_SU0_SUS0_SVW2_TT2_16_VW2_WG32_8_1_WGM18
    SolutionIndex: 9
    SolutionNameMin: Cijk_Alik_Bjlk_SB_MT64x32x32_MI16x16x4x1_SN_GRVW4_LPA8_LRVW4_MIAV0_NEPBS0_PLR9_SU4_SUS512_SVW2_TT2_16_VW2_WG32_8_1_WGM18
    SolutionIndex: 10
    SolutionNameMin: Cijk_Alik_Bjlk_SB_MT64x64x32_MI16x16x4x1_SN_GRVW2_LPA2_LRVW2_MIAV0_NEPBS0_PLR9_SU0_SUS0_SVW2_TT2_32_VW2_WG32_8_1_WGM18
    SolutionIndex: 11
    SolutionNameMin: Cijk_Alik_Bjlk_SB_MT64x32x32_MI16x16x4x1_SN_GRVW2_LPA2_LRVW2_MIAV0_NEPBS4_PLR9_SU0_SUS0_SVW2_TT2_16_VW2_WG32_8_1_WGM36
    SolutionIndex: 12
    SolutionNameMin: Cijk_Alik_Bjlk_SB_MT64x32x32_MI16x16x4x1_SN_GRVW4_LPA8_LRVW4_NEPBS0_PLR9_SU0_SUS0_SVW2_TT2_16_VW2_WG32_8_1_WGM18
    SolutionIndex: 13
    SolutionNameMin: Cijk_Alik_Bjlk_SB_MT64x64x16_MI16x16x4x1_SN_GRVW4_LPA4_LRVW1_NEPBS0_PLR5_SU0_SUS0_SVW2_TT2_32_VW2_WG32_8_1_WGM18
    SolutionIndex: 14
    SolutionNameMin: Cijk_Alik_Bjlk_SB_MT64x128x16_MI32x32x2x1_SN_GRVW4_LPA4_LRVW2_NEPBS0_PLR9_SU32_SUS256_SVW2_TT2_32_VW2_WG32_8_1_WGM18
    SolutionIndex: 15
    SolutionNameMin: Cijk_Alik_Bjlk_SB_MT64x32x16_MI16x16x4x1_SN_AMAS0_DTVB0_GRVW1_LBSPP128_LPA2_LRVW2_NEPBS4_NLCB1_PLR5_SVW1_TT2_16_TLDS1_UMLDSA1_VW1_WG32_8_1_WGM6
    SolutionIndex: 16
    SolutionNameMin: Cijk_Alik_Bjlk_SB_MT32x64x32_MI16x16x4x1_SN_AMAS0_DTVB0_GRVW2_LBSPP128_LPA2_LRVW1_NEPBS0_NLCB1_PLR9_SVW1_TT1_32_TLDS1_UMLDSA1_VW1_WG32_8_1_WGM12
    SolutionIndex: 17
    SolutionNameMin: Cijk_Alik_Bjlk_SB_MT32x64x32_MI16x16x4x1_SN_AMAS0_DTVB1_GRVW1_LBSPP128_LPA2_LRVW2_NEPBS0_NLCB1_PLR9_SVW1_TT2_16_TLDS1_UMLDSA1_VW1_WG16_16_1_WGM12
    SolutionIndex: 18
    SolutionNameMin: Cijk_Alik_Bjlk_SB_MT64x64x16_MI32x32x2x1_SN_AMAS0_DTVB0_GRVW1_LBSPP0_LPA1_LRVW1_NEPBS0_NLCB1_PLR9_SVW1_TT1_32_TLDS0_UMLDSA0_VW1_WG64_4_1_WGM6
    SolutionIndex: 19
    SolutionNameMin: Cijk_Alik_Bjlk_SB_MT64x64x16_MI32x32x2x1_SN_AMAS0_DTVB0_GRVW2_LBSPP0_LPA1_LRVW1_NEPBS0_NLCB1_PLR9_SVW1_TT1_32_TLDS0_UMLDSA0_VW1_WG64_4_1_WGM12
    SolutionIndex: 20
    SolutionNameMin: Cijk_Alik_Bjlk_SB_MT64x64x16_MI32x32x2x1_SN_AMAS0_DTVB0_GRVW1_LBSPP0_LPA1_LRVW1_NEPBS0_NLCB1_PLR9_SVW1_TT1_32_TLDS0_UMLDSA0_VW1_WG64_4_1_WGM12
    SolutionIndex: 21
    SolutionNameMin: Cijk_Alik_Bjlk_SB_MT32x64x16_MI16x16x4x1_SN_AMAS0_DTVB0_GRVW1_LBSPP128_LPA2_LRVW2_NEPBS4_NLCB1_PLR5_SVW1_TT2_16_TLDS1_UMLDSA1_VW1_WG16_16_1_WGM6
    SolutionIndex: 22
    SolutionNameMin: Cijk_Alik_Bjlk_SB_MT32x64x32_MI16x16x4x1_SN_AMAS3_DTVB0_GRVW2_LBSPP128_LPA2_LRVW1_NEPBS0_NLCB1_PLR9_SVW2_TT2_16_TLDS1_UMLDSA1_VW2_WG16_16_1_WGM6
    SolutionIndex: 23
    SolutionNameMin: Cijk_Alik_Bjlk_SB_MT32x64x16_MI16x16x4x1_SN_AMAS0_DTVB0_GRVW4_LBSPP128_LPA4_LRVW2_NEPBS0_NLCB1_PLR5_SVW1_TT2_16_TLDS1_UMLDSA1_VW1_WG16_16_1_WGM6
    SolutionIndex: 24
    SolutionNameMin: Cijk_Alik_Bjlk_SB_MT64x64x16_MI32x32x2x1_SN_AMAS0_DTVB0_GRVW4_LBSPP0_LPA1_LRVW1_NEPBS0_NLCB1_PLR9_SVW1_TT1_32_TLDS0_UMLDSA0_VW1_WG64_4_1_WGM6
    SolutionIndex: 25
    SolutionNameMin: Cijk_Alik_Bjlk_SB_MT64x32x32_MI16x16x4x1_SN_AMAS0_DTVB0_GRVW1_LBSPP128_LPA2_LRVW1_NEPBS4_NLCB1_PLR9_SVW1_TT2_16_TLDS1_UMLDSA1_VW1_WG32_8_1_WGM12
    SolutionIndex: 26
    SolutionNameMin: Cijk_Alik_Bjlk_SB_MT64x64x16_MI32x32x2x1_SN_AMAS0_DTVB0_GRVW2_LBSPP0_LPA1_LRVW1_NEPBS0_NLCB1_PLR9_SVW1_TT1_32_TLDS0_UMLDSA0_VW1_WG64_4_1_WGM6
    SolutionIndex: 27
    SolutionNameMin: Cijk_Alik_Bjlk_SB_MT64x128x16_MI32x32x2x1_SN_AMAS0_DTVB1_GRVW1_LBSPP0_LPA1_LRVW1_NEPBS0_NLCB1_PLR9_SVW1_TT2_32_TLDS0_UMLDSA0_VW1_WG32_8_1_WGM6
    SolutionIndex: 28
    SolutionNameMin: Cijk_Alik_Bjlk_SB_MT32x64x32_MI16x16x4x1_SN_AMAS3_DTVB0_GRVW1_LBSPP0_LPA2_LRVW1_NEPBS0_NLCB1_PLR9_SVW2_TT2_16_TLDS0_UMLDSA0_VW2_WG16_16_1_WGM12
    SolutionIndex: 29
    SolutionNameMin: Cijk_Alik_Bjlk_SB_MT64x64x16_MI32x32x2x1_SN_AMAS0_DTVB0_GRVW1_LBSPP128_LPA1_LRVW1_NEPBS0_NLCB1_PLR9_SVW1_TT1_32_TLDS1_UMLDSA1_VW1_WG64_4_1_WGM12
    SolutionIndex: 30
    SolutionNameMin: Cijk_Alik_Bjlk_SB_MT64x64x16_MI16x16x4x1_SN_AMAS3_DTVB0_GRVW2_LBSPP128_LPA2_LRVW2_NEPBS0_NLCB1_PLR5_SVW2_TT4_16_TLDS1_UMLDSA1_VW2_WG16_16_1_WGM12
    SolutionIndex: 31
    SolutionNameMin: Cijk_Alik_Bjlk_SB_MT64x64x16_MI32x32x2x1_SN_AMAS0_DTVB0_GRVW4_LBSPP128_LPA4_LRVW1_NEPBS0_NLCB1_PLR9_SVW1_TT1_32_TLDS1_UMLDSA1_VW1_WG64_4_1_WGM6
    SolutionIndex: 32
    SolutionNameMin: Cijk_Alik_Bjlk_SB_MT32x64x32_MI16x16x4x1_SN_AMAS3_DTVB0_GRVW2_LBSPP128_LPA2_LRVW2_NEPBS0_NLCB1_PLR9_SVW2_TT2_16_TLDS1_UMLDSA1_VW2_WG16_16_1_WGM12
    SolutionIndex: 33
    SolutionNameMin: Cijk_Alik_Bjlk_SB_MT64x32x32_MI16x16x4x1_SN_AMAS0_DTVB0_GRVW1_LBSPP128_LPA2_LRVW1_NEPBS0_NLCB1_PLR9_SVW1_TT2_16_TLDS1_UMLDSA1_VW1_WG32_8_1_WGM12
    SolutionIndex: 34
    SolutionNameMin: Cijk_Alik_Bjlk_SB_MT64x64x16_MI16x16x4x1_SN_AMAS3_DTVB0_GRVW1_LBSPP0_LPA2_LRVW1_NEPBS0_NLCB1_PLR5_SVW2_TT4_16_TLDS0_UMLDSA0_VW2_WG16_16_1_WGM12
    SolutionIndex: 35
    SolutionNameMin: Cijk_Alik_Bjlk_SB_MT64x64x16_MI16x16x4x1_SN_AMAS3_DTVB0_GRVW2_LBSPP128_LPA2_LRVW1_NEPBS0_NLCB1_PLR5_SVW2_TT4_16_TLDS1_UMLDSA1_VW2_WG16_16_1_WGM6
    SolutionIndex: 36
    SolutionNameMin: Cijk_Alik_Bjlk_SB_MT64x64x16_MI16x16x4x1_SN_AMAS3_DTVB0_GRVW2_LBSPP128_LPA2_LRVW2_NEPBS0_NLCB1_PLR5_SVW2_TT4_16_TLDS1_UMLDSA1_VW2_WG16_16_1_WGM6
    SolutionIndex: 37
    SolutionNameMin: Cijk_Alik_Bjlk_SB_MT64x64x16_MI16x16x4x1_SN_AMAS3_DTVB0_GRVW4_LBSPP128_LPA4_LRVW2_NEPBS0_NLCB1_PLR5_SVW2_TT4_16_TLDS1_UMLDSA1_VW2_WG16_16_1_WGM12
    SolutionIndex: 38
    SolutionNameMin: Cijk_Alik_Bjlk_SB_MT32x64x32_MI16x16x4x1_SN_AMAS3_DTVB0_GRVW2_LBSPP128_LPA2_LRVW1_NEPBS4_NLCB1_PLR9_SVW2_TT2_16_TLDS1_UMLDSA1_VW2_WG16_16_1_WGM6
    SolutionIndex: 39
    SolutionNameMin: Cijk_Alik_Bjlk_SB_MT64x64x32_MI16x16x4x1_SN_AMAS0_DTVB0_GRVW4_LBSPP128_LPA4_LRVW1_NEPBS0_NLCB1_PLR9_SVW1_TT1_64_TLDS1_UMLDSA1_VW1_WG64_4_1_WGM12
    SolutionIndex: 40
    SolutionNameMin: Cijk_Alik_Bjlk_SB_MT64x64x16_MI16x16x4x1_SN_AMAS3_DTVB0_GRVW2_LBSPP0_LPA2_LRVW1_NEPBS0_NLCB1_PLR5_SVW2_TT2_32_TLDS0_UMLDSA0_VW2_WG32_8_1_WGM6
    SolutionIndex: 41
    SolutionNameMin: Cijk_Alik_Bjlk_SB_MT64x64x16_MI16x16x4x1_SN_AMAS3_DTVB0_GRVW2_LBSPP128_LPA2_LRVW1_NEPBS0_NLCB1_PLR5_SVW2_TT2_32_TLDS1_UMLDSA1_VW2_WG32_8_1_WGM12
    SolutionIndex: 42
    SolutionNameMin: Cijk_Alik_Bjlk_SB_MT32x64x16_MI16x16x4x1_SN_AMAS3_DTVB0_GRVW4_LBSPP128_LPA4_LRVW2_NEPBS4_NLCB1_PLR5_SVW2_TT2_16_TLDS1_UMLDSA1_VW2_WG16_16_1_WGM6
    SolutionIndex: 43
    SolutionNameMin: Cijk_Alik_Bjlk_SB_MT64x64x16_MI16x16x4x1_SN_AMAS3_DTVB0_GRVW2_LBSPP0_LPA2_LRVW1_NEPBS0_NLCB1_PLR5_SVW2_TT4_16_TLDS0_UMLDSA0_VW2_WG16_16_1_WGM6
    SolutionIndex: 44
    SolutionNameMin: Cijk_Alik_Bjlk_SB_MT64x32x16_MI16x16x4x1_SN_AMAS3_DTVB0_GRVW1_LBSPP128_LPA2_LRVW2_NEPBS4_NLCB1_PLR5_SVW2_TT2_16_TLDS1_UMLDSA1_VW2_WG32_8_1_WGM12
    SolutionIndex: 45
    SolutionNameMin: Cijk_Alik_Bjlk_SB_MT64x128x16_MI32x32x2x1_SN_AMAS3_DTVB0_GRVW1_LBSPP128_LPA1_LRVW1_NEPBS0_NLCB1_PLR9_SVW2_TT2_32_TLDS1_UMLDSA1_VW2_WG32_8_1_WGM12
    SolutionIndex: 46
    SolutionNameMin: Cijk_Alik_Bjlk_SB_MT64x128x16_MI32x32x2x1_SN_AMAS3_DTVB0_GRVW1_LBSPP128_LPA1_LRVW1_NEPBS0_NLCB1_PLR9_SVW2_TT2_32_TLDS1_UMLDSA1_VW2_WG32_8_1_WGM6
    SolutionIndex: 47
    SolutionNameMin: Cijk_Alik_Bjlk_SB_MT128x64x16_MI32x32x2x1_SN_AMAS0_DTVB0_GRVW4_LBSPP128_LPA4_LRVW2_NEPBS0_NLCB1_PLR9_SVW1_TT2_32_TLDS1_UMLDSA1_VW1_WG64_4_1_WGM12
    SolutionIndex: 48
    SolutionNameMin: Cijk_Alik_Bjlk_SB_MT32x64x32_MI16x16x4x1_SN_AMAS3_DTVB0_GRVW2_LBSPP0_LPA2_LRVW1_NEPBS4_NLCB1_PLR9_SVW2_TT2_16_TLDS0_UMLDSA0_VW2_WG16_16_1_WGM12
    SolutionIndex: 49
    SolutionNameMin: Cijk_Alik_Bjlk_SB_MT64x128x16_MI32x32x2x1_SN_AMAS3_DTVB0_GRVW2_LBSPP128_LPA2_LRVW1_NEPBS4_NLCB1_PLR9_SVW2_TT2_32_TLDS1_UMLDSA1_VW2_WG32_8_1_WGM6
    SolutionIndex: 50
    SolutionNameMin: Cijk_Alik_Bjlk_SB_MT32x64x16_MI16x16x4x1_SN_AMAS3_DTVB0_GRVW4_LBSPP128_LPA4_LRVW2_NEPBS4_NLCB1_PLR5_SVW2_TT2_16_TLDS1_UMLDSA1_VW2_WG16_16_1_WGM12
    SolutionIndex: 51
    SolutionNameMin: Cijk_Alik_Bjlk_SB_MT64x64x16_MI16x16x4x1_SN_AMAS3_DTVB0_GRVW2_LBSPP128_LPA2_LRVW2_NEPBS0_NLCB1_PLR5_SVW2_TT2_32_TLDS1_UMLDSA1_VW2_WG32_8_1_WGM6
    SolutionIndex: 52
    SolutionNameMin: Cijk_Alik_Bjlk_SB_MT64x64x16_MI32x32x2x1_SN_AMAS0_DTVB0_GRVW1_LBSPP128_LPA1_LRVW1_NEPBS0_NLCB1_PLR9_SVW1_TT1_32_TLDS1_UMLDSA1_VW1_WG64_4_1_WGM6
    SolutionIndex: 53
    SolutionNameMin: Cijk_Alik_Bjlk_SB_MT32x64x32_MI16x16x4x1_SN_AMAS3_DTVB0_GRVW4_LBSPP0_LPA2_LRVW1_NEPBS4_NLCB1_PLR9_SVW2_TT2_16_TLDS0_UMLDSA0_VW2_WG16_16_1_WGM6
    SolutionIndex: 54
    SolutionNameMin: Cijk_Alik_Bjlk_SB_MT32x64x32_MI16x16x4x1_SN_AMAS3_DTVB0_GRVW2_LBSPP128_LPA2_LRVW1_NEPBS0_NLCB1_PLR9_SVW2_TT2_16_TLDS1_UMLDSA1_VW2_WG16_16_1_WGM6
- - - [6144, 4864, 1, 512]
    - [0, 91.856]
  - - [4864, 3072, 1, 4096]
    - [1, 97.351]
  - - [7296, 4608, 1, 4096]
    - [2, 98.332]
  - - [9728, 6144, 1, 4096]
    - [3, 98.637]
  - - [16384, 16384, 1, 4096]
    - [4, 98.805]
  - - [19456, 18432, 1, 512]
    - [5, 95.973]
  - - [4094, 4094, 1, 2046]
    - [6, 95.057]
  - - [4096, 4096, 1, 2048]
    - [7, 96.315]
  - - [1030, 1030, 1, 1030]
    - [8, 47.054]
  - - [1032, 1032, 1, 1032]
    - [9, 43.974]
  - - [2046, 2046, 1, 2046]
    - [10, 80.011]
  - - [2048, 2048, 1, 2048]
    - [11, 83.372]
  - - [1031, 1031, 1, 1031]
    - [12, 42.439]
  - - [2047, 2047, 1, 2047]
    - [13, 73.408]
  - - [4095, 4095, 1, 2047]
    - [14, 88.735]
  - - [64, 1, 1000, 64]
    - [15, 0.54]
  - - [1, 64, 1000, 64]
    - [16, 0.543]
  - - [31, 31, 1000, 31]
    - [17, 4.234]
  - - [33, 33, 1000, 33]
    - [18, 4.065]
  - - [47, 47, 1000, 47]
    - [19, 8.669]
  - - [49, 49, 1000, 49]
    - [20, 9.589]
  - - [63, 63, 128, 63]
    - [21, 5.742]
  - - [65, 65, 128, 65]
    - [22, 4.839]
  - - [79, 79, 128, 79]
    - [23, 7.341]
  - - [81, 81, 128, 81]
    - [24, 7.766]
  - - [95, 95, 64, 95]
    - [25, 7.762]
  - - [97, 97, 64, 97]
    - [26, 8.187]
  - - [127, 127, 64, 127]
    - [27, 15.366]
  - - [129, 129, 64, 129]
    - [28, 12.675]
  - - [255, 255, 16, 255]
    - [29, 23.591]
  - - [257, 257, 16, 257]
    - [30, 22.463]
  - - [511, 511, 16, 511]
    - [18, 61.647]
  - - [513, 513, 16, 513]
    - [31, 55.453]
  - - [30, 30, 1000, 30]
    - [32, 4.761]
  - - [32, 32, 1000, 32]
    - [33, 5.664]
  - - [34, 34, 1000, 34]
    - [34, 4.761]
  - - [46, 46, 1000, 46]
    - [35, 9.047]
  - - [48, 48, 1000, 48]
    - [36, 11.673]
  - - [50, 50, 1000, 50]
    - [37, 10.408]
  - - [62, 62, 128, 62]
    - [38, 5.741]
  - - [64, 64, 128, 64]
    - [39, 7.047]
  - - [66, 66, 128, 66]
    - [40, 5.194]
  - - [78, 78, 128, 78]
    - [41, 7.582]
  - - [80, 80, 128, 80]
    - [42, 8.844]
  - - [82, 82, 128, 82]
    - [43, 8.351]
  - - [94, 94, 64, 94]
    - [44, 8.344]
  - - [96, 96, 64, 96]
    - [42, 10.339]
  - - [98, 98, 64, 98]
    - [45, 8.62]
  - - [126, 126, 64, 126]
    - [46, 16.243]
  - - [128, 128, 64, 128]
    - [47, 18.272]
  - - [130, 130, 64, 130]
    - [48, 13.91]
  - - [254, 254, 16, 254]
    - [49, 23.416]
  - - [256, 256, 16, 256]
    - [50, 28.48]
  - - [258, 258, 16, 258]
    - [51, 20.396]
  - - [510, 510, 16, 510]
    - [52, 61.75]
  - - [512, 512, 16, 512]
    - [53, 71.468]
  - - [514, 514, 16, 514]
    - [54, 57.903]
- null
