library/src/blas3/Tensile/Logic/asm_full/aquavanjaram942X/aquavanjaram942_Cijk_Ailk_Bjlk_BBS_BH.yaml
- {MinimumRequiredVersion: 4.36.0}
- aquavanjaram942
- {Architecture: gfx942, IsAPU: 0}
- [Device 74a1]
    SolutionIndex: 0
    SolutionNameMin: Cijk_Ailk_Bjlk_BBS_BH_MT256x128x16_MI32x32x8x1_SN_AMAS3_MIAV0_NTA0_NTB0_NTC2_NTD2_SVW2_VW2_WSGRA0_WSGRB0_WGM12
    SolutionIndex: 1
    SolutionNameMin: Cijk_Ailk_Bjlk_BBS_BH_MT256x128x16_MI32x32x8x1_SN_AMAS3_MIAV0_NTA0_NTB0_NTC3_NTD0_SVW2_VW2_WSGRA0_WSGRB0_WGM12
    SolutionIndex: 2
    SolutionNameMin: Cijk_Ailk_Bjlk_BBS_BH_MT256x128x16_MI32x32x8x1_SN_AMAS3_MIAV0_NTA0_NTB1_NTC2_NTD1_SVW2_VW2_WSGRA0_WSGRB0_WGM12
    SolutionIndex: 3
    SolutionNameMin: Cijk_Ailk_Bjlk_BBS_BH_MT256x128x16_MI32x32x8x1_SN_AMAS3_MIAV0_NTA0_NTB1_NTC2_NTD2_SVW2_VW2_WSGRA0_WSGRB0_WGM18
    SolutionIndex: 4
    SolutionNameMin: Cijk_Ailk_Bjlk_BBS_BH_MT256x128x16_MI32x32x8x1_SN_AMAS3_MIAV0_NTA0_NTB1_NTC3_NTD0_SVW2_VW2_WSGRA0_WSGRB0_WGM12
    SolutionIndex: 5
    SolutionNameMin: Cijk_Ailk_Bjlk_BBS_BH_MT256x128x16_MI32x32x8x1_SN_AMAS3_MIAV0_NTA0_NTB1_NTC3_NTD2_SVW2_VW2_WSGRA0_WSGRB0_WGM12
    SolutionIndex: 6
    SolutionNameMin: Cijk_Ailk_Bjlk_BBS_BH_MT256x128x16_MI32x32x8x1_SN_AMAS3_MIAV0_NTA0_NTB1_NTC3_NTD3_SVW2_VW2_WSGRA0_WSGRB0_WGM18
    SolutionIndex: 7
    SolutionNameMin: Cijk_Ailk_Bjlk_BBS_BH_MT256x128x16_MI32x32x8x1_SN_AMAS3_MIAV0_NTA1_NTB1_NTC3_NTD0_SVW2_VW2_WSGRA0_WSGRB0_WGM12
    SolutionIndex: 8
    SolutionNameMin: Cijk_Ailk_Bjlk_BBS_BH_MT256x128x16_MI32x32x8x1_SN_AMAS3_MIAV0_NTA1_NTB1_NTC3_NTD2_SVW2_VW2_WSGRA0_WSGRB0_WGM6
    SolutionIndex: 9
    SolutionNameMin: Cijk_Ailk_Bjlk_BBS_BH_MT256x256x32_MI32x32x8x1_SN_1LDSB1_AMAS3_CLR1_ELFLR0_GLS1_NTC3_NTD0_NLCA2_SVW2_TT2_256_VW2_WG128_2_1_WGM32
    SolutionIndex: 10
    SolutionNameMin: Cijk_Ailk_Bjlk_BBS_BH_MT256x256x32_MI32x32x8x1_SN_1LDSB1_AMAS3_CLR1_ELFLR0_GLS0_NTC0_NTD3_NLCA1_SVW2_TT2_256_VW2_WG128_2_1_WGM32
    SolutionIndex: 11
    SolutionNameMin: Cijk_Ailk_Bjlk_BBS_BH_MT256x256x32_MI16x16x16x1_SN_NTA2_NTB2_NTC2_NEPBS8_PLR3_SU32_SUS64_SPO0_SSO8_VFLRP0_WSGRA0_WSGRB0_WGM18
    SolutionIndex: 12
    SolutionNameMin: Cijk_Ailk_Bjlk_BBS_BH_MT256x256x32_MI16x16x16x1_SN_NTA1_NTB1_NTC2_NEPBS8_PLR3_SU32_SUS64_SPO0_SSO8_VFLRP1_WSGRA0_WSGRB0_WGM6
    SolutionIndex: 13
    SolutionNameMin: Cijk_Ailk_Bjlk_BBS_BH_MT256x128x16_MI32x32x8x1_SN_1LDSB0_CLR1_GRVW8_LBSPPA0_LBSPPB0_LPA0_LPB0_NEPBS8_PLR3_SU0_SUS0_SVW4_TT4_64_VW4_VFLRP1_WG64_4_1_WGM42
    SolutionIndex: 14
    SolutionNameMin: Cijk_Ailk_Bjlk_BBS_BH_MT256x256x32_MI16x16x16x1_SN_1LDSB0_CLR1_GRVW8_LBSPPA0_LBSPPB0_LPA0_LPB0_NEPBS8_PLR3_SU0_SUS0_SVW2_TT8_128_VW2_VFLRP1_WG32_8_1_WGM36
    SolutionIndex: 15
    SolutionNameMin: Cijk_Ailk_Bjlk_BBS_BH_MT256x256x32_MI16x16x16x1_SN_1LDSB1_CLR1_GRVW8_LBSPPA2048_LBSPPB2048_LPA32_LPB16_NEPBS8_PLR3_SU0_SUS0_SVW2_TT8_128_VW2_VFLRP1_WG32_8_1_WGM42
    SolutionIndex: 16
    SolutionNameMin: Cijk_Ailk_Bjlk_BBS_BH_MT256x256x32_MI16x16x16x1_SN_1LDSB0_CLR1_GRVW8_LBSPPA0_LBSPPB0_LPA0_LPB0_NEPBS8_PLR3_SU0_SUS0_SVW2_TT8_128_VW2_VFLRP1_WG32_8_1_WGM18
    SolutionIndex: 17
    SolutionNameMin: Cijk_Ailk_Bjlk_BBS_BH_MT256x256x32_MI16x16x16x1_SN_1LDSB1_CLR1_GRVW8_LBSPPA2048_LBSPPB2048_LPA32_LPB16_NEPBS8_PLR3_SU0_SUS0_SVW2_TT8_128_VW2_VFLRP1_WG32_8_1_WGM12
    SolutionIndex: 18
    SolutionNameMin: Cijk_Ailk_Bjlk_BBS_BH_MT256x256x32_MI16x16x16x1_SN_1LDSB1_CLR1_GRVW8_LBSPPA2048_LBSPPB2048_LPA32_LPB16_NEPBS8_PLR3_SU0_SUS0_SVW2_TT8_128_VW2_VFLRP1_WG32_8_1_WGM18
    SolutionIndex: 19
    SolutionNameMin: Cijk_Ailk_Bjlk_BBS_BH_MT16x64x32_MI16x16x16x1_SN_1LDSB0_AMAS0_GLVWB8_GSU32_LBSPPB512_PLR3_SS0_SVW4_TT1_16_VW1_VFLRP1_WG16_16_1
    SolutionIndex: 20
    SolutionNameMin: Cijk_Ailk_Bjlk_BBS_BH_MT256x256x32_MI32x32x8x1_SN_AMAS0_ELFLR0_GLS0_NTC0_NTD3_NEPBS8_SU4_SUS512_SPO0_VW1_WGM32
    SolutionIndex: 21
    SolutionNameMin: Cijk_Ailk_Bjlk_BBS_BH_MT256x256x32_MI32x32x8x1_SN_AMAS3_ELFLR0_GLS0_NTC0_NTD0_NEPBS0_SU0_SUS0_SPO0_VW4_WGM48
    SolutionIndex: 22
    SolutionNameMin: Cijk_Ailk_Bjlk_BBS_BH_MT256x256x32_MI32x32x8x1_SN_AMAS3_ELFLR0_GLS1_NTC0_NTD0_NEPBS0_SU2_SUS512_SPO0_VW4_WGM32
    SolutionIndex: 23
    SolutionNameMin: Cijk_Ailk_Bjlk_BBS_BH_MT256x256x32_MI32x32x8x1_SN_AMAS3_ELFLR8_GLS0_NTC3_NTD0_NEPBS16_SU0_SUS0_SPO1_VW2_WGM16
    SolutionIndex: 24
    SolutionNameMin: Cijk_Ailk_Bjlk_BBS_BH_MT256x256x32_MI32x32x8x1_SN_AMAS0_ELFLR0_GLS1_NTC0_NTD0_NEPBS0_SU4_SUS512_SPO0_VW1_WGM16
    SolutionIndex: 25
    SolutionNameMin: Cijk_Ailk_Bjlk_BBS_BH_MT256x256x32_MI16x16x16x1_SN_ASM0256_ELFLR0_EMLL0_LBSPPA0_LBSPPB2048_LPA0_LPB32_PLR3_SSO0_SVW2_TT8_128_VW2_WG32_8_1
    SolutionIndex: 26
    SolutionNameMin: Cijk_Ailk_Bjlk_BBS_BH_MT16x128x32_MI16x16x16x1_SN_1LDSB0_AMAS3_CLR1_GSU8_LBSPPB1024_PGR2_PLR3_TT1_32_VW2_VFLRP1_WG16_16_1
    SolutionIndex: 27
    SolutionNameMin: Cijk_Ailk_Bjlk_BBS_BH_MT16x64x32_MI16x16x16x1_SN_1LDSB0_AMAS0_GSU16_LBSPPB512_PLR3_SS0_SU0_SUS0_SVW4_TT1_16_VW1_VFLRP0_WG16_16_1
    SolutionIndex: 28
    SolutionNameMin: Cijk_Ailk_Bjlk_BBS_BH_MT256x256x32_MI32x32x8x1_SN_ELFLR4_GLVWA8_GLVWB8_GRVW8_GLS0_NLCA1_SU8_SUS128_SVW2_VW2_WGM16
    SolutionIndex: 29
    SolutionNameMin: Cijk_Ailk_Bjlk_BBS_BH_MT256x256x32_MI32x32x8x1_SN_ELFLR4_GLVWA8_GLVWB8_GRVW8_GLS1_NLCA1_SU0_SUS0_SVW2_VW2_WGM32
    SolutionIndex: 30
    SolutionNameMin: Cijk_Ailk_Bjlk_BBS_BH_MT256x256x32_MI32x32x8x1_SN_ELFLR0_GLVWA8_GLVWB8_GRVW8_GLS1_NLCA1_SU0_SUS0_SVW2_VW2_WGM32
    SolutionIndex: 31
    SolutionNameMin: Cijk_Ailk_Bjlk_BBS_BH_MT256x256x32_MI32x32x8x1_SN_ELFLR4_GLVWA8_GLVWB8_GRVW8_GLS0_NLCA1_SU0_SUS0_SVW2_VW2_WGM32
    SolutionIndex: 32
    SolutionNameMin: Cijk_Ailk_Bjlk_BBS_BH_MT256x256x32_MI32x32x8x1_SN_ELFLR4_GLVWA8_GLVWB8_GRVW8_GLS1_NLCA1_SU0_SUS0_SVW2_VW2_WGM16
    SolutionIndex: 33
    SolutionNameMin: Cijk_Ailk_Bjlk_BBS_BH_MT256x256x32_MI32x32x8x1_SN_ELFLR0_GLVWA8_GLVWB8_GRVW8_GLS0_NLCA1_SU8_SUS128_SVW2_VW2_WGM32
    SolutionIndex: 34
    SolutionNameMin: Cijk_Ailk_Bjlk_BBS_BH_MT256x256x32_MI32x32x8x1_SN_ELFLR4_GLVWA8_GLVWB8_GRVW8_GLS0_NLCA1_SU0_SUS0_SVW2_VW2_WGMn32
    SolutionIndex: 35
    SolutionNameMin: Cijk_Ailk_Bjlk_BBS_BH_MT128x128x32_MI16x16x16x1_SN_AMAS3_CLR1_GLVWA8_GLVWB4_LBSPPA0_LPA0_MIAV0_PLR3_SU0_SUS0_SSO0_SVW4_TT8_32_VW4_VFLRP1_WSGRA0_WG16_16_1_WGM40
    SolutionIndex: 36
    SolutionNameMin: Cijk_Ailk_Bjlk_BBS_BH_MT128x128x32_MI16x16x16x1_SN_AMAS3_CLR1_GLVWA2_GLVWB8_LBSPPA0_LPA0_MIAV1_PLR3_SU0_SUS0_SSO0_SVW4_TT4_64_VW4_VFLRP1_WSGRA0_WG32_8_1_WGM40
    SolutionIndex: 37
    SolutionNameMin: Cijk_Ailk_Bjlk_BBS_BH_MT128x128x32_MI16x16x16x1_SN_AMAS3_CLR1_GLVWA8_GLVWB2_LBSPPA0_LPA0_MIAV0_PLR3_SU16_SUS512_SSO4_SVW4_TT8_32_VW4_VFLRP1_WSGRA0_WG16_16_1_WGM1
    SolutionIndex: 38
    SolutionNameMin: Cijk_Ailk_Bjlk_BBS_BH_MT128x128x32_MI16x16x16x1_SN_AMAS3_CLR1_GLVWA8_GLVWB8_LBSPPA1024_LPA32_MIAV1_PLR3_SU0_SUS0_SSO4_SVW2_TT4_64_VW2_VFLRP1_WSGRA0_WG32_8_1_WGM1
    SolutionIndex: 39
    SolutionNameMin: Cijk_Ailk_Bjlk_BBS_BH_MT128x128x32_MI16x16x16x1_SN_AMAS0_CLR0_GLVWA8_GLVWB8_LBSPPA1024_LPA16_MIAV1_PLR3_SU0_SUS0_SSO0_SVW1_TT4_64_VW1_VFLRP0_WSGRA0_WG32_8_1_WGM1
    SolutionIndex: 40
    SolutionNameMin: Cijk_Ailk_Bjlk_BBS_BH_MT128x128x32_MI16x16x16x1_SN_AMAS0_GLVWA8_GLVWB8_LPA16_NTC0_NTD3_PLR3_SU0_SUS0_SSO0_SVW1_TT4_64_VW1_WSGRA0_WG32_8_1_WGM1
- - - [6144, 4864, 1, 4096]
    - [7, 75.625]
  - - [6144, 4864, 1, 8192]
    - [3, 79.757]
  - - [6144, 4864, 1, 16384]
    - [6, 81.813]
  - - [6144, 4864, 1, 4352]
    - [5, 76.068]
  - - [6144, 4864, 1, 8448]
    - [5, 79.884]
  - - [6144, 4864, 1, 16640]
    - [0, 81.842]
  - - [4864, 3072, 1, 4096]
    - [14, 72.99]
  - - [4864, 3072, 1, 8192]
    - [16, 76.36]
  - - [4864, 3072, 1, 16384]
    - [1, 81.454]
  - - [4864, 3072, 1, 4352]
    - [2, 74.923]
  - - [4864, 3072, 1, 8448]
    - [4, 79.216]
  - - [4864, 3072, 1, 16640]
    - [8, 81.448]
  - - [8192, 8192, 1, 8192]
    - [9, 60.621]
  - - [9728, 8192, 1, 8192]
    - [10, 64.914]
  - - [4864, 3072, 1, 2048]
    - [13, 66.2]
  - - [4864, 3072, 1, 6144]
    - [15, 76.62]
  - - [3072, 4864, 1, 2048]
    - [11, 65.36]
  - - [3072, 4864, 1, 4096]
    - [12, 70.29]
  - - [3072, 4864, 1, 6144]
    - [17, 75.19]
  - - [3072, 4864, 1, 8192]
    - [18, 77.49]
  - - [2, 7168, 1, 8192]
    - [26, 0.757]
  - - [2, 3584, 1, 8192]
    - [27, 0.639]
  - - [2, 1280, 1, 8192]
    - [19, 0.302]
  - - [7168, 28672, 1, 65536]
    - [20, 78.43]
  - - [28672, 7168, 1, 65536]
    - [21, 79.71]
  - - [7168, 21504, 1, 65536]
    - [22, 85.0]
  - - [7168, 7168, 1, 65536]
    - [23, 73.64]
  - - [7168, 50432, 1, 65536]
    - [24, 81.82]
  - - [4096, 4096, 1, 8192]
    - [18, 69.89]
  - - [4864, 4096, 1, 8192]
    - [25, 79.343]
  - - [9728, 8192, 1, 16416]
    - [28, 55.901]
  - - [9728, 12288, 1, 4096]
    - [29, 54.714]
  - - [9728, 12288, 1, 8192]
    - [30, 55.657]
  - - [9728, 12288, 1, 8256]
    - [31, 55.878]
  - - [9728, 12288, 1, 16416]
    - [32, 55.505]
  - - [14592, 12288, 1, 8192]
    - [29, 55.861]
  - - [14592, 12288, 1, 8256]
    - [31, 56.237]
  - - [14592, 12288, 1, 16416]
    - [33, 55.465]
  - - [12288, 9728, 1, 16416]
    - [34, 55.201]
  - - [2432, 2048, 1, 1024]
    - [35, 29.87]
  - - [2432, 2048, 1, 2048]
    - [36, 35.34]
  - - [2048, 2432, 1, 1024]
    - [37, 31.6]
  - - [2048, 2432, 1, 2048]
    - [38, 42.91]
  - - [4864, 1024, 1, 1024]
    - [40, 33.41]
  - - [4864, 1024, 1, 2048]
    - [39, 39.23]
- null
- null
- DeviceEfficiency
