library/src/blas3/Tensile/Logic/asm_full/aquavanjaram942X/aquavanjaram942_Cijk_Ailk_Bjlk_SB.yaml
- {MinimumRequiredVersion: 4.31.0}
- aquavanjaram942
- {Architecture: gfx942, IsAPU: 0}
- [Device 74a1]
    SolutionIndex: 0
    SolutionNameMin: Cijk_Ailk_Bjlk_SB_MT128x128x16_MI32x32x2x1_SN_1LDSB1_TT1_128_WG128_2_1_WGM8
    SolutionIndex: 1
    SolutionNameMin: Cijk_Ailk_Bjlk_SB_MT128x128x16_MI32x32x2x1_SN_1LDSB1_TT4_32_WG32_8_1_WGM2
    SolutionIndex: 2
    SolutionNameMin: Cijk_Ailk_Bjlk_SB_MT256x64x16_MI16x16x4x1_SN_DTVA0_GRVW4_GLS1_NEPBS4_NLCA1_NLCB1_PLR5_SVW2_TT4_64_VW2_WG64_4_1_WGM18
    SolutionIndex: 3
    SolutionNameMin: Cijk_Ailk_Bjlk_SB_MT128x128x8_MI32x32x2x1_SN_DTVA0_GRVW4_GLS0_NEPBS1_NLCA1_NLCB1_PLR5_SVW2_TT2_64_VW2_WG64_4_1_WGM18
    SolutionIndex: 4
    SolutionNameMin: Cijk_Ailk_Bjlk_SB_MT256x64x16_MI16x16x4x1_SN_DTVA1_GRVW4_GLS1_NEPBS1_NLCA1_NLCB1_PLR5_SVW4_TT4_64_VW4_WG64_4_1_WGM24
    SolutionIndex: 5
    SolutionNameMin: Cijk_Ailk_Bjlk_SB_MT256x64x16_MI16x16x4x1_SN_DTVA0_GRVW4_GLS1_NEPBS4_NLCA1_NLCB1_PLR5_SVW2_TT4_64_VW2_WG64_4_1_WGM24
    SolutionIndex: 6
    SolutionNameMin: Cijk_Ailk_Bjlk_SB_MT256x128x16_MI16x16x4x1_SN_DTVA1_GRVW4_GLS1_NEPBS4_NLCA1_NLCB2_PLR5_SVW4_TT4_128_VW4_WG64_4_1_WGM30
    SolutionIndex: 7
    SolutionNameMin: Cijk_Ailk_Bjlk_SB_MT128x64x32_MI16x16x4x1_SN_DTVA0_GRVW4_GLS1_NEPBS0_NLCA1_PLR9_SU0_SUS0_SVW2_TT4_32_VW2_WG32_8_1_WGM24
    SolutionIndex: 8
    SolutionNameMin: Cijk_Ailk_Bjlk_SB_MT128x64x32_MI16x16x4x1_SN_DTVA0_GRVW4_GLS0_NEPBS0_NLCA1_PLR9_SU0_SUS0_SVW2_TT4_32_VW2_WG32_8_1_WGM30
    SolutionIndex: 9
    SolutionNameMin: Cijk_Ailk_Bjlk_SB_MT128x64x16_MI16x16x4x1_SN_DTVA0_EPS0_GRVW4_NEPBS0_NLCA1_PLR5_SU0_SUS0_SVW2_TT2_64_VW2_WG64_4_1_WGM24
    SolutionIndex: 10
    SolutionNameMin: Cijk_Ailk_Bjlk_SB_MT64x32x32_MI16x16x4x1_SN_DTVA0_GRVW4_MIAV1_NEPBS0_PLR9_SU0_SUS0_SVW2_TT2_16_VW2_WG32_8_1_WGM18
    SolutionIndex: 11
    SolutionNameMin: Cijk_Ailk_Bjlk_SB_MT64x32x32_MI16x16x4x1_SN_DTVA0_GRVW4_MIAV0_NEPBS0_PLR9_SU0_SUS0_SVW2_TT2_16_VW2_WG32_8_1_WGM18
    SolutionIndex: 12
    SolutionNameMin: Cijk_Ailk_Bjlk_SB_MT64x32x32_MI16x16x4x1_SN_DTVA0_GRVW4_MIAV1_NEPBS0_PLR9_SU0_SUS0_SVW2_TT2_16_VW2_WG32_8_1_WGM36
    SolutionIndex: 13
    SolutionNameMin: Cijk_Ailk_Bjlk_SB_MT64x32x32_MI16x16x4x1_SN_DTVA0_EPS0_GRVW4_NEPBS0_NLCA1_PLR9_SU32_SUS256_SVW2_TT2_16_VW2_WG32_8_1_WGM18
    SolutionIndex: 14
    SolutionNameMin: Cijk_Ailk_Bjlk_SB_MT64x64x32_MI16x16x4x1_SN_DTVA0_EPS0_GRVW4_NEPBS0_NLCA1_PLR9_SU32_SUS256_SVW2_TT2_32_VW2_WG32_8_1_WGM18
    SolutionIndex: 15
    SolutionNameMin: Cijk_Ailk_Bjlk_SB_MT64x32x32_MI16x16x4x1_SN_AMAS0_DTVA0_GRVW1_NEPBS4_NLCA1_PLR9_SVW1_TT1_32_VW1_WG64_4_1_WGM6
    SolutionIndex: 16
    SolutionNameMin: Cijk_Ailk_Bjlk_SB_MT32x64x32_MI16x16x4x1_SN_AMAS0_DTVA0_GRVW1_NEPBS4_NLCA1_PLR9_SVW1_TT1_32_VW1_WG32_8_1_WGM6
    SolutionIndex: 17
    SolutionNameMin: Cijk_Ailk_Bjlk_SB_MT32x64x32_MI16x16x4x1_SN_AMAS0_DTVA0_GRVW1_NEPBS4_NLCA1_PLR9_SVW1_TT2_16_VW1_WG16_16_1_WGM12
    SolutionIndex: 18
    SolutionNameMin: Cijk_Ailk_Bjlk_SB_MT64x64x16_MI32x32x2x1_SN_AMAS0_DTVA0_GRVW1_NEPBS0_NLCA1_PLR9_SVW1_TT1_32_VW1_WG64_4_1_WGM6
    SolutionIndex: 19
    SolutionNameMin: Cijk_Ailk_Bjlk_SB_MT64x64x16_MI32x32x2x1_SN_AMAS0_DTVA0_GRVW1_NEPBS4_NLCA1_PLR9_SVW1_TT1_32_VW1_WG64_4_1_WGM6
    SolutionIndex: 20
    SolutionNameMin: Cijk_Ailk_Bjlk_SB_MT64x64x16_MI16x16x4x1_SN_AMAS0_DTVA1_GRVW1_NEPBS0_NLCA1_PLR5_SVW1_TT1_64_VW1_WG64_4_1_WGM6
    SolutionIndex: 21
    SolutionNameMin: Cijk_Ailk_Bjlk_SB_MT128x64x16_MI16x16x4x1_SN_AMAS0_DTVA1_GRVW1_NEPBS0_NLCA2_PLR5_SVW1_TT2_64_VW1_WG64_4_1_WGM12
    SolutionIndex: 22
    SolutionNameMin: Cijk_Ailk_Bjlk_SB_MT128x64x16_MI32x32x2x1_SN_AMAS0_DTVA0_GRVW1_NEPBS0_NLCA1_PLR9_SVW1_TT2_32_VW1_WG64_4_1_WGM6
    SolutionIndex: 23
    SolutionNameMin: Cijk_Ailk_Bjlk_SB_MT64x128x16_MI32x32x2x1_SN_AMAS0_DTVA0_GRVW1_NEPBS0_NLCA1_PLR9_SVW1_TT1_64_VW1_WG64_4_1_WGM6
    SolutionIndex: 24
    SolutionNameMin: Cijk_Ailk_Bjlk_SB_MT64x64x16_MI32x32x2x1_SN_AMAS0_DTVA0_GRVW1_NEPBS0_NLCA1_PLR9_SVW1_TT1_32_VW1_WG64_4_1_WGM12
    SolutionIndex: 25
    SolutionNameMin: Cijk_Ailk_Bjlk_SB_MT32x64x32_MI16x16x4x1_SN_AMAS3_DTVA0_GRVW1_NEPBS4_NLCA1_PLR9_SVW2_TT2_16_VW2_WG16_16_1_WGM6
    SolutionIndex: 26
    SolutionNameMin: Cijk_Ailk_Bjlk_SB_MT32x64x32_MI16x16x4x1_SN_AMAS3_DTVA0_GRVW2_NEPBS0_NLCA1_PLR9_SVW2_TT2_16_VW2_WG16_16_1_WGM6
    SolutionIndex: 27
    SolutionNameMin: Cijk_Ailk_Bjlk_SB_MT64x64x16_MI16x16x4x1_SN_AMAS3_DTVA0_GRVW2_NEPBS0_NLCA1_PLR5_SVW2_TT2_32_VW2_WG32_8_1_WGM6
    SolutionIndex: 28
    SolutionNameMin: Cijk_Ailk_Bjlk_SB_MT64x64x16_MI16x16x4x1_SN_AMAS3_DTVA0_GRVW2_NEPBS0_NLCA1_PLR5_SVW2_TT2_32_VW2_WG32_8_1_WGM12
    SolutionIndex: 29
    SolutionNameMin: Cijk_Ailk_Bjlk_SB_MT64x64x16_MI16x16x4x1_SN_AMAS3_DTVA0_GRVW2_NEPBS4_NLCA1_PLR5_SVW2_TT2_32_VW2_WG32_8_1_WGM6
    SolutionIndex: 30
    SolutionNameMin: Cijk_Ailk_Bjlk_SB_MT64x64x16_MI32x32x2x1_SN_AMAS0_DTVA0_GRVW1_NEPBS4_NLCA1_PLR9_SVW1_TT1_32_VW1_WG64_4_1_WGM6
    SolutionIndex: 31
    SolutionNameMin: Cijk_Ailk_Bjlk_SB_MT32x64x32_MI16x16x4x1_SN_AMAS3_DTVA0_GRVW2_NEPBS4_NLCA1_PLR9_SVW2_TT2_16_VW2_WG16_16_1_WGM6
    SolutionIndex: 32
    SolutionNameMin: Cijk_Ailk_Bjlk_SB_MT64x64x32_MI16x16x4x1_SN_AMAS3_DTVA0_GRVW2_NEPBS0_NLCA1_PLR9_SVW2_TT2_32_VW2_WG32_8_1_WGM6
    SolutionIndex: 33
    SolutionNameMin: Cijk_Ailk_Bjlk_SB_MT64x64x16_MI16x16x4x1_SN_AMAS3_DTVA0_GRVW1_NEPBS4_NLCA1_PLR5_SVW2_TT2_32_VW2_WG32_8_1_WGM12
    SolutionIndex: 34
    SolutionNameMin: Cijk_Ailk_Bjlk_SB_MT128x64x16_MI16x16x4x1_SN_AMAS3_DTVA0_GRVW2_NEPBS0_NLCA1_PLR1_SVW2_TT2_64_VW2_WG64_4_1_WGM12
    SolutionIndex: 35
    SolutionNameMin: Cijk_Ailk_Bjlk_SB_MT64x64x16_MI16x16x4x1_SN_AMAS0_DTVA0_GRVW4_NEPBS0_NLCA1_PLR5_SVW1_TT2_32_VW1_WG32_8_1_WGM12
    SolutionIndex: 36
    SolutionNameMin: Cijk_Ailk_Bjlk_SB_MT128x64x16_MI32x32x2x1_SN_AMAS3_DTVA0_GRVW2_NEPBS0_NLCA1_PLR9_SVW2_TT2_32_VW2_WG64_4_1_WGM12
    SolutionIndex: 37
    SolutionNameMin: Cijk_Ailk_Bjlk_SB_MT128x64x16_MI16x16x4x1_SN_AMAS3_DTVA0_GRVW1_NEPBS0_NLCA1_PLR5_SVW2_TT2_64_VW2_WG64_4_1_WGM6
    SolutionIndex: 38
    SolutionNameMin: Cijk_Ailk_Bjlk_SB_MT32x64x32_MI16x16x4x1_SN_AMAS0_DTVA0_GRVW4_NEPBS0_NLCA1_PLR9_SVW1_TT1_32_VW1_WG32_8_1_WGM6
    SolutionIndex: 39
    SolutionNameMin: Cijk_Ailk_Bjlk_SB_MT128x64x16_MI32x32x2x1_SN_AMAS0_DTVA0_GRVW1_NEPBS0_NLCA1_PLR9_SVW1_TT2_32_VW1_WG64_4_1_WGM6
    SolutionIndex: 40
    SolutionNameMin: Cijk_Ailk_Bjlk_SB_MT64x64x16_MI32x32x2x1_SN_AMAS0_DTVA0_GRVW2_NEPBS0_NLCA1_PLR9_SVW1_TT1_32_VW1_WG64_4_1_WGM12
    SolutionIndex: 41
    SolutionNameMin: Cijk_Ailk_Bjlk_SB_MT128x64x16_MI32x32x2x1_SN_AMAS0_DTVA0_GRVW2_NEPBS0_NLCA1_PLR9_SVW1_TT2_32_VW1_WG64_4_1_WGM6
    SolutionIndex: 42
    SolutionNameMin: Cijk_Ailk_Bjlk_SB_MT64x64x16_MI16x16x4x1_SN_AMAS3_DTVA0_GRVW2_NEPBS4_NLCA1_PLR5_SVW2_TT2_32_VW2_WG32_8_1_WGM12
    SolutionIndex: 43
    SolutionNameMin: Cijk_Ailk_Bjlk_SB_MT64x64x16_MI32x32x2x1_SN_AMAS0_DTVA0_GRVW2_NEPBS0_NLCA1_PLR9_SVW1_TT1_32_VW1_WG64_4_1_WGM6
    SolutionIndex: 44
    SolutionNameMin: Cijk_Ailk_Bjlk_SB_MT64x64x16_MI32x32x2x1_SN_AMAS0_DTVA0_GRVW1_NEPBS0_NLCA1_PLR9_SVW1_TT1_32_VW1_WG64_4_1_WGM6
    SolutionIndex: 45
    SolutionNameMin: Cijk_Ailk_Bjlk_SB_MT128x128x16_MI16x16x4x1_SN_1LDSB0_GRVW4_GLS0_NEPBS4_PLR5_SU0_SUS0_TT4_32_WG32_16_1_WGM42
    SolutionIndex: 46
    SolutionNameMin: Cijk_Ailk_Bjlk_SB_MT128x128x16_MI16x16x4x1_SN_1LDSB0_GRVW2_GLS0_NEPBS0_PLR5_SU0_SUS0_TT4_64_WG32_8_1_WGM36
    SolutionIndex: 47
    SolutionNameMin: Cijk_Ailk_Bjlk_SB_MT128x128x16_MI16x16x4x1_SN_1LDSB1_GRVW4_GLS1_NEPBS4_PLR5_SU32_SUS256_TT4_64_WG32_8_1_WGM24
    SolutionIndex: 48
    SolutionNameMin: Cijk_Ailk_Bjlk_SB_MT128x128x16_MI16x16x4x1_SN_1LDSB0_GRVW2_GLS0_NEPBS4_PLR1_SU0_SUS0_TT4_64_WG32_8_1_WGM18
    SolutionIndex: 49
    SolutionNameMin: Cijk_Ailk_Bjlk_SB_MT128x128x16_MI16x16x4x1_SN_1LDSB1_GRVW4_GLS0_NEPBS0_PLR1_SU32_SUS256_TT4_64_WG32_8_1_WGM18
    SolutionIndex: 50
    SolutionNameMin: Cijk_Ailk_Bjlk_SB_MT128x128x16_MI16x16x4x1_SN_1LDSB1_GRVW4_GLS0_NEPBS0_PLR1_SU0_SUS0_TT2_128_WG64_4_1_WGM18
    SolutionIndex: 51
    SolutionNameMin: Cijk_Ailk_Bjlk_SB_MT128x128x16_MI16x16x4x1_SN_1LDSB1_GRVW4_GLS0_NEPBS4_PLR1_SU32_SUS256_TT4_64_WG32_8_1_WGM36
    SolutionIndex: 52
    SolutionNameMin: Cijk_Ailk_Bjlk_SB_MT128x128x16_MI16x16x4x1_SN_1LDSB1_GRVW2_GLS0_NEPBS4_PLR1_SU0_SUS0_TT4_64_WG32_8_1_WGM36
    SolutionIndex: 53
    SolutionNameMin: Cijk_Ailk_Bjlk_SB_MT256x256x8_MI16x16x4x1_SN_AMAS3_DTVA1_GRVW4_LPA0_NLCA1_PGR2_PLR1_SS1_SU2_SUS256_SVW4_TT4_256_VW4_WG64_4_1_WGM18
    SolutionIndex: 54
    SolutionNameMin: Cijk_Ailk_Bjlk_SB_MT256x256x8_MI16x16x4x1_SN_AMAS3_DTVA0_GRVW1_LPA0_NLCA1_PGR1_PLR3_SS1_SU2_SUS256_SVW4_TT4_256_VW4_WG64_4_1_WGM18
    SolutionIndex: 55
    SolutionNameMin: Cijk_Ailk_Bjlk_SB_MT256x256x16_MI16x16x4x1_SN_AMAS3_DTVA0_GRVW4_LPA0_NLCA1_PGR2_PLR1_SS1_SU0_SUS0_SVW2_TT8_128_VW2_WG32_8_1_WGM36
    SolutionIndex: 56
    SolutionNameMin: Cijk_Ailk_Bjlk_SB_MT256x256x16_MI16x16x4x1_SN_AMAS0_DTVA1_GRVW1_LPA16_NLCA4_PGR1_PLR1_SS0_SU2_SUS256_SVW4_TT4_256_VW1_WG64_4_1_WGM18
    SolutionIndex: 57
    SolutionNameMin: Cijk_Ailk_Bjlk_SB_MT256x256x8_MI16x16x4x1_SN_AMAS0_DTVA0_GRVW2_LPA16_NLCA1_PGR2_PLR3_SS1_SU0_SUS0_SVW1_TT8_128_VW1_WG32_8_1_WGM18
    SolutionIndex: 58
    SolutionNameMin: Cijk_Ailk_Bjlk_SB_MT256x128x8_MI16x16x4x1_SN_AMAS0_DTVA1_GRVW2_LPA16_NLCA4_PGR2_PLR1_SS0_SU0_SUS0_SVW4_TT4_128_VW1_WG64_4_1_WGM42
    SolutionIndex: 59
    SolutionNameMin: Cijk_Ailk_Bjlk_SB_MT256x256x8_MI16x16x4x1_SN_AMAS3_DTVA0_GRVW1_LPA16_NLCA1_PGR1_PLR3_SS0_SU0_SUS0_SVW4_TT4_256_VW2_WG64_4_1_WGM18
    SolutionIndex: 60
    SolutionNameMin: Cijk_Ailk_Bjlk_SB_MT256x256x16_MI16x16x4x1_SN_AMAS3_DTVA0_GRVW1_LPA16_NLCA1_PGR1_PLR5_SS0_SU0_SUS0_SVW4_TT4_256_VW4_WG64_4_1_WGM18
    SolutionIndex: 61
    SolutionNameMin: Cijk_Ailk_Bjlk_SB_MT32x32x64_MI16x16x4x1_SN_1LDSB0_AMAS3_ELFLR0_GLVWA4_GLVWB4_GRVW4_GLS1_LPA16_NEPBS4_PLR1_SS0_SVW4_TT1_16_VW4_WG32_8_1_WGM16
    SolutionIndex: 62
    SolutionNameMin: Cijk_Ailk_Bjlk_SB_MT32x32x32_MI16x16x4x1_SN_1LDSB0_AMAS0_ELFLR0_GLVWA4_GLVWB4_GRVW4_GLS0_LPA16_NEPBS2_PLR9_SS0_SVW4_TT1_16_VW1_WG32_8_1_WGM16
    SolutionIndex: 63
    SolutionNameMin: Cijk_Ailk_Bjlk_SB_MT32x32x64_MI16x16x4x1_SN_1LDSB0_AMAS0_ELFLR0_GLVWA4_GLVWB4_GRVW4_GLS0_LPA16_NEPBS4_PLR1_SS0_SVW4_TT1_16_VW1_WG32_8_1_WGM16
    SolutionIndex: 64
    SolutionNameMin: Cijk_Ailk_Bjlk_SB_MT32x32x32_MI16x16x4x1_SN_1LDSB0_AMAS0_ELFLR4_GLVWA2_GLVWB2_GRVW2_GLS0_LPA16_NEPBS4_PLR9_SS1_SVW1_TT1_16_VW1_WG32_8_1_WGM1
    SolutionIndex: 65
    SolutionNameMin: Cijk_Ailk_Bjlk_SB_MT32x32x64_MI16x16x4x1_SN_1LDSB0_AMAS0_ELFLR0_GLVWA4_GLVWB4_GRVW4_GLS0_LPA16_NEPBS2_PLR1_SS0_SVW4_TT1_16_VW1_WG32_8_1_WGM16
    SolutionIndex: 66
    SolutionNameMin: Cijk_Ailk_Bjlk_SB_MT32x32x64_MI16x16x4x1_SN_1LDSB0_AMAS0_ELFLR4_GLVWA4_GLVWB4_GRVW4_GLS0_LPA16_NEPBS4_PLR17_SS1_SVW1_TT1_16_VW1_WG32_8_1_WGMn32
    SolutionIndex: 67
    SolutionNameMin: Cijk_Ailk_Bjlk_SB_MT32x64x64_MI16x16x4x1_SN_1LDSB0_AMAS3_ELFLR4_GLVWA4_GLVWB4_GRVW4_GLS1_LPA16_NEPBS2_PLR1_SS0_SVW4_TT2_16_VW4_WG16_16_1_WGMn32
    SolutionIndex: 68
    SolutionNameMin: Cijk_Ailk_Bjlk_SB_MT32x64x32_MI16x16x4x1_SN_1LDSB0_AMAS3_ELFLR0_GLVWA4_GLVWB4_GRVW4_GLS0_LPA0_NEPBS4_PLR1_SS1_SVW2_TT2_16_VW2_WG16_16_1_WGM16
    SolutionIndex: 69
    SolutionNameMin: Cijk_Ailk_Bjlk_SB_MT32x32x64_MI16x16x4x1_SN_1LDSB0_AMAS3_ELFLR0_GLVWA4_GLVWB4_GRVW4_GLS0_LPA16_NEPBS2_PLR1_SS0_SVW4_TT1_16_VW4_WG32_8_1_WGMn32
    SolutionIndex: 70
    SolutionNameMin: Cijk_Ailk_Bjlk_SB_MT64x64x32_MI16x16x4x1_SN_1LDSB0_AMAS0_ELFLR4_GLVWA4_GLVWB4_GRVW4_GLS1_LPA16_LPB16_NTC3_NTD2_NEPBS2_ONLL2_SS0_SU0_SUS0_SVW4_VW1_WG32_8_1_WGM32
    SolutionIndex: 71
    SolutionNameMin: Cijk_Ailk_Bjlk_SB_MT64x64x32_MI16x16x4x1_SN_1LDSB1_AMAS0_ELFLR0_GLVWA4_GLVWB4_GRVW4_GLS0_LPA16_LPB16_NTC2_NTD2_NEPBS2_ONLL0_SS0_SU0_SUS0_SVW4_VW1_WG32_8_1_WGM16
    SolutionIndex: 72
    SolutionNameMin: Cijk_Ailk_Bjlk_SB_MT64x64x32_MI16x16x4x1_SN_1LDSB0_AMAS0_ELFLR4_GLVWA4_GLVWB4_GRVW4_GLS0_LPA16_LPB16_NTC2_NTD2_NEPBS2_ONLL0_SS0_SU0_SUS0_SVW4_VW1_WG32_8_1_WGM16
    SolutionIndex: 73
    SolutionNameMin: Cijk_Ailk_Bjlk_SB_MT64x64x32_MI16x16x4x1_SN_1LDSB1_AMAS0_ELFLR0_GLVWA4_GLVWB4_GRVW4_GLS1_LPA16_LPB16_NTC2_NTD3_NEPBS2_ONLL2_SS0_SU0_SUS0_SVW4_VW1_WG32_8_1_WGM32
    SolutionIndex: 74
    SolutionNameMin: Cijk_Ailk_Bjlk_SB_MT64x64x32_MI16x16x4x1_SN_1LDSB0_AMAS0_ELFLR4_GLVWA4_GLVWB4_GRVW4_GLS1_LPA16_LPB16_NTC2_NTD3_NEPBS2_ONLL2_SS0_SU8_SUS128_SVW4_VW1_WG32_8_1_WGM32
    SolutionIndex: 75
    SolutionNameMin: Cijk_Ailk_Bjlk_SB_MT64x64x32_MI16x16x4x1_SN_1LDSB1_AMAS3_ELFLR4_GLVWA4_GLVWB4_GRVW4_GLS0_LPA0_LPB16_NTC2_NTD3_NEPBS4_ONLL0_SS1_SU8_SUS128_SVW2_VW2_WG32_8_1_WGM16
    SolutionIndex: 76
    SolutionNameMin: Cijk_Ailk_Bjlk_SB_MT128x128x32_MI16x16x4x1_SN_AMAS0_DTVA0_EPS0_ELFLR0_GLVWA4_MIAV0_NLCA1_SU0_SUS0_SPO1_SSO4_VW1_WSGRB0_WGMn32
    SolutionIndex: 77
    SolutionNameMin: Cijk_Ailk_Bjlk_SB_MT128x128x32_MI16x16x4x1_SN_AMAS0_DTVA1_EPS1_ELFLR0_GLVWA1_MIAV1_NLCA2_SU8_SUS128_SPO1_SSO4_VW1_WSGRB1_WGM1
    SolutionIndex: 78
    SolutionNameMin: Cijk_Ailk_Bjlk_SB_MT128x128x32_MI16x16x4x1_SN_AMAS0_DTVA0_EPS0_ELFLR4_GLVWA4_MIAV0_NLCA1_SU0_SUS0_SPO1_SSO0_VW1_WSGRB0_WGMn16
    SolutionIndex: 79
    SolutionNameMin: Cijk_Ailk_Bjlk_SB_MT128x128x32_MI16x16x4x1_SN_AMAS0_DTVA0_EPS1_ELFLR4_GLVWA4_MIAV1_NLCA1_SU8_SUS256_SPO0_SSO4_VW1_WSGRB1_WGM1
    SolutionIndex: 80
    SolutionNameMin: Cijk_Ailk_Bjlk_SB_MT128x128x32_MI16x16x4x1_SN_AMAS0_DTVA0_EPS0_ELFLR0_GLVWA4_GRCGB1_NLCA1_ONLL0_SU8_SUS128_SPO1_SSO4_TT4_64_VW1_WSGRA1_WG32_8_1_WGM32
    SolutionIndex: 81
    SolutionNameMin: Cijk_Ailk_Bjlk_SB_MT128x128x32_MI16x16x4x1_SN_AMAS3_DTVA0_EPS0_ELFLR4_GLVWA4_GRCGB0_NLCA1_ONLL2_SU0_SUS0_SPO1_SSO4_TT4_64_VW2_WSGRA1_WG32_8_1_WGM16
    SolutionIndex: 82
    SolutionNameMin: Cijk_Ailk_Bjlk_SB_MT128x128x32_MI16x16x4x1_SN_AMAS3_DTVA0_EPS1_ELFLR4_GLVWA4_GRCGB1_NLCA1_ONLL0_SU0_SUS0_SPO0_SSO0_TT4_64_VW2_WSGRA0_WG32_8_1_WGM1
    SolutionIndex: 83
    SolutionNameMin: Cijk_Ailk_Bjlk_SB_MT128x128x32_MI16x16x4x1_SN_AMAS3_DTVA0_EPS1_ELFLR0_GLVWA4_GRCGB0_NLCA1_ONLL0_SU8_SUS256_SPO0_SSO0_TT4_64_VW2_WSGRA0_WG32_8_1_WGM1
    SolutionIndex: 84
    SolutionNameMin: Cijk_Ailk_Bjlk_SB_MT128x128x32_MI16x16x4x1_SN_AMAS3_DTVA0_EPS0_ELFLR4_GLVWA4_GRCGB1_NLCA1_ONLL0_SU0_SUS0_SPO0_SSO4_TT4_64_VW2_WSGRA0_WG32_8_1_WGM1
    SolutionIndex: 85
    SolutionNameMin: Cijk_Ailk_Bjlk_SB_MT128x64x32_MI16x16x4x1_SN_AMAS3_DTVA0_EPS1_ELFLR4_GLVWA4_GRCGB1_NLCA1_ONLL0_SU8_SUS256_SPO0_SSO0_TT2_64_VW2_WSGRA0_WG64_4_1_WGM32
    SolutionIndex: 86
    SolutionNameMin: Cijk_Ailk_Bjlk_SB_MT32x32x64_MI32x32x2x1_SN_AMAS0_ELFLR4_GLVWA4_GLVWB4_GRVW4_GLS1_LPA0_LPB0_MIAV0_NTC2_NTD2_ONLL0_SS1_SU0_SUS0_SVW1_TT1_32_VW1_WG32_2_4_WGM32
    SolutionIndex: 87
    SolutionNameMin: Cijk_Ailk_Bjlk_SB_MT32x32x64_MI16x16x4x1_SN_AMAS3_ELFLR4_GLVWA4_GLVWB4_GRVW4_GLS0_LPA0_LPB16_MIAV1_NTC3_NTD2_ONLL0_SS0_SU0_SUS0_SVW4_TT2_16_VW2_WG16_8_2_WGM16
    SolutionIndex: 88
    SolutionNameMin: Cijk_Ailk_Bjlk_SB_MT32x16x32_MI16x16x4x1_SN_1LDSB0_DTVA1_ELFLR4_GLVWA1_GLVWB1_GRVWn1_GLS0_LPB0_MIAV1_NTC2_NTD2_SS0_SSO0_SVW4_WG32_4_1_WGM12
    SolutionIndex: 89
    SolutionNameMin: Cijk_Ailk_Bjlk_SB_MT32x32x32_MI16x16x4x1_SN_1LDSB0_DTVA0_ELFLR0_GLVWA1_GLVWB1_GRVWn1_GLS0_LPB16_MIAV0_NTC2_NTD3_SS1_SSO0_SVW1_WG32_8_1_WGM16
    SolutionIndex: 90
    SolutionNameMin: Cijk_Ailk_Bjlk_SB_MT96x96x16_MI16x16x4x1_SN_AMAS0_DTVA0_DTVB0_EPS1_EMLL8_GLVWA1_GLVWB1_GSU19_LPA16_LPB16_PGR2_PLR1_TT3_48_VW1_WG32_8_1_WGM32
    SolutionIndex: 91
    SolutionNameMin: Cijk_Ailk_Bjlk_SB_MT96x96x16_MI16x16x4x1_SN_AMAS0_DTVA0_DTVB0_EPS1_EMLL0_GLVWA1_GLVWB1_GSU38_LPA16_LPB16_PGR2_PLR1_TT3_48_VW1_WG32_8_1_WGM16
    SolutionIndex: 92
    SolutionNameMin: Cijk_Ailk_Bjlk_SB_MT96x96x16_MI16x16x4x1_SN_AMAS0_DTVA0_DTVB0_EPS1_EMLL8_GLVWA1_GLVWB1_GSU57_LPA16_LPB16_PGR2_PLR1_TT3_48_VW1_WG32_8_1_WGM32
    SolutionIndex: 93
    SolutionNameMin: Cijk_Ailk_Bjlk_SB_MT96x96x16_MI16x16x4x1_SN_AMAS0_DTVA0_DTVB0_EPS1_EMLL4_GLVWA1_GLVWB1_GSU76_LPA16_LPB16_PGR2_PLR5_TT3_48_VW1_WG32_8_1_WGM1
    SolutionIndex: 94
    SolutionNameMin: Cijk_Ailk_Bjlk_SB_MT192x48x16_MI16x16x4x1_SN_AMAS0_DTVA1_DTVB0_EPS1_EMLL4_GLVWA1_GLVWB1_GSU76_LPA0_LPB16_PGR1_PLR5_TT3_48_VW1_WG64_4_1_WGM1
    SolutionIndex: 95
    SolutionNameMin: Cijk_Ailk_Bjlk_SB_MT48x192x16_MI16x16x4x1_SN_AMAS0_DTVA0_DTVB1_EPS1_EMLL4_GLVWA1_GLVWB1_GSU76_LPA16_LPB0_PGR1_PLR1_TT3_48_VW1_WG16_16_1_WGM1
    SolutionIndex: 96
    SolutionNameMin: Cijk_Ailk_Bjlk_SB_MT192x48x16_MI16x16x4x1_SN_AMAS0_DTVA1_DTVB0_EPS1_EMLL4_GLVWA1_GLVWB1_GSU152_LPA0_LPB16_PGR1_PLR5_TT3_48_VW1_WG64_4_1_WGM32
    SolutionIndex: 97
    SolutionNameMin: Cijk_Ailk_Bjlk_SB_MT192x48x32_MI16x16x4x1_SN_AMAS0_DTVA0_DTVB0_EPS1_EMLL4_GLVWA1_GLVWB1_GSU25_LPA0_LPB16_PGR2_PLR9_TT3_48_VW1_WG64_4_1_WGM1
    SolutionIndex: 98
    SolutionNameMin: Cijk_Ailk_Bjlk_SB_MT192x48x16_MI16x16x4x1_SN_AMAS0_DTVA1_DTVB0_EPS1_EMLL8_GLVWA1_GLVWB1_GSU25_LPA0_LPB16_PGR1_PLR1_TT3_48_VW1_WG64_4_1_WGM1
    SolutionIndex: 99
    SolutionNameMin: Cijk_Ailk_Bjlk_SB_MT192x48x16_MI16x16x4x1_SN_AMAS0_DTVA0_DTVB0_EPS0_EMLL8_GLVWA1_GLVWB1_GSU50_LPA16_LPB16_PGR0_PLR5_TT3_48_VW1_WG64_4_1_WGM32
    SolutionIndex: 100
    SolutionNameMin: Cijk_Ailk_Bjlk_SB_MT96x192x16_MI16x16x4x1_SN_AMAS3_DTVA0_DTVB0_EPS1_EMLL8_GLVWA2_GLVWB2_GSU50_LPA0_LPB16_PGR2_PLR5_TT6_48_VW2_WG16_16_1_WGM32
    SolutionIndex: 101
    SolutionNameMin: Cijk_Ailk_Bjlk_SB_MT96x192x16_MI16x16x4x1_SN_AMAS3_DTVA0_DTVB0_EPS1_EMLL8_GLVWA2_GLVWB2_GSU50_LPA0_LPB16_PGR2_PLR5_TT6_48_VW2_WG16_16_1_WGM1
    SolutionIndex: 102
    SolutionNameMin: Cijk_Ailk_Bjlk_SB_MT192x48x16_MI16x16x4x1_SN_AMAS0_DTVA0_DTVB0_EPS0_EMLL4_GLVWA1_GLVWB1_GSU50_LPA16_LPB16_PGR0_PLR5_TT3_48_VW1_WG64_4_1_WGM16
    SolutionIndex: 103
    SolutionNameMin: Cijk_Ailk_Bjlk_SB_MT96x192x32_MI16x16x4x1_SN_AMAS0_DTVA0_DTVB1_EPS1_EMLL8_GLVWA1_GLVWB1_GSU28_LPA16_LPB0_PGR1_PLR1_TT6_48_VW1_WG16_16_1_WGM32
    SolutionIndex: 104
    SolutionNameMin: Cijk_Ailk_Bjlk_SB_MT192x48x16_MI16x16x4x1_SN_AMAS0_DTVA0_DTVB0_EPS0_EMLL8_GLVWA1_GLVWB1_GSU38_LPA16_LPB16_PGR0_PLR1_TT3_48_VW1_WG64_4_1_WGM16
    SolutionIndex: 105
    SolutionNameMin: Cijk_Ailk_Bjlk_SB_MT192x48x16_MI16x16x4x1_SN_AMAS0_DTVA0_DTVB0_EPS0_EMLL8_GLVWA1_GLVWB1_GSU38_LPA16_LPB16_PGR0_PLR5_TT3_48_VW1_WG64_4_1_WGM16
    SolutionIndex: 106
    SolutionNameMin: Cijk_Ailk_Bjlk_SB_MT96x192x16_MI16x16x4x1_SN_AMAS0_DTVA0_DTVB1_EPS1_EMLL0_GLVWA1_GLVWB1_GSU38_LPA16_LPB0_PGR1_PLR1_TT6_48_VW1_WG16_16_1_WGM1
    SolutionIndex: 107
    SolutionNameMin: Cijk_Ailk_Bjlk_SB_MT192x48x16_MI16x16x4x1_SN_AMAS0_DTVA0_DTVB0_EPS0_EMLL4_GLVWA1_GLVWB1_GSU38_LPA16_LPB16_PGR0_PLR1_TT3_48_VW1_WG64_4_1_WGM32
    SolutionIndex: 108
    SolutionNameMin: Cijk_Ailk_Bjlk_SB_MT192x48x16_MI16x16x4x1_SN_AMAS0_DTVA0_DTVB0_EPS0_EMLL0_GLVWA1_GLVWB1_GSU38_LPA16_LPB16_PGR0_PLR5_TT3_48_VW1_WG64_4_1_WGM16
    SolutionIndex: 109
    SolutionNameMin: Cijk_Ailk_Bjlk_SB_MT192x48x16_MI16x16x4x1_SN_AMAS0_DTVA0_DTVB0_EPS0_EMLL0_GLVWA1_GLVWB1_GSU38_LPA16_LPB16_PGR0_PLR5_TT3_48_VW1_WG64_4_1_WGM1
    SolutionIndex: 110
    SolutionNameMin: Cijk_Ailk_Bjlk_SB_MT192x48x16_MI16x16x4x1_SN_1LDSB0_AMAS0_DTVA1_EPS1_EMLL8_GLVWA1_GLVWB1_GSU76_LPA0_LPB16_PGR1_PLR1_TT3_48_VW1_VWB1_WG64_4_1_WGM1
    SolutionIndex: 111
    SolutionNameMin: Cijk_Ailk_Bjlk_SB_MT192x48x32_MI16x16x4x1_SN_1LDSB0_AMAS0_DTVA1_EPS1_EMLL4_GLVWA1_GLVWB1_GSU76_LPA0_LPB16_PGR1_PLR1_TT3_48_VW1_VWB1_WG64_4_1_WGM1
    SolutionIndex: 112
    SolutionNameMin: Cijk_Ailk_Bjlk_SB_MT192x48x16_MI16x16x4x1_SN_1LDSB0_AMAS0_DTVA1_EPS1_EMLL0_GLVWA1_GLVWB1_GSU76_LPA0_LPB16_PGR1_PLR5_TT3_48_VW1_VWB1_WG64_4_1_WGM1
    SolutionIndex: 113
    SolutionNameMin: Cijk_Ailk_Bjlk_SB_MT192x48x16_MI16x16x4x1_SN_1LDSB1_AMAS0_DTVA1_EPS1_EMLL8_GLVWA1_GLVWB1_GSU76_LPA0_LPB16_PGR1_PLR1_TT3_48_VW1_VWB1_WG64_4_1_WGM1
    SolutionIndex: 114
    SolutionNameMin: Cijk_Ailk_Bjlk_SB_MT192x48x16_MI16x16x4x1_SN_1LDSB1_AMAS0_DTVA1_EPS1_EMLL4_GLVWA1_GLVWB1_GSU76_LPA0_LPB16_PGR2_PLR1_TT3_48_VW1_VWB1_WG64_4_1_WGM1
    SolutionIndex: 115
    SolutionNameMin: Cijk_Ailk_Bjlk_SB_MT192x48x16_MI16x16x4x1_SN_1LDSB1_AMAS0_DTVA0_EPS1_EMLL0_GLVWA1_GLVWB1_GSU76_LPA16_LPB16_PGR2_PLR5_TT3_48_VW1_VWB1_WG64_4_1_WGM1
    SolutionIndex: 116
    SolutionNameMin: Cijk_Ailk_Bjlk_SB_MT192x48x16_MI16x16x4x1_SN_1LDSB1_DTVA1_DTVB0_EPS1_EMLL0_GSU19_LPA0_LPB16_PGR1_PLR5_WG64_4_1_WGM1
    SolutionIndex: 117
    SolutionNameMin: Cijk_Ailk_Bjlk_SB_MT192x48x16_MI16x16x4x1_SN_1LDSB0_DTVA1_DTVB0_EPS1_EMLL0_GSU14_LPA0_LPB16_PGR1_PLR1_WG64_4_1_WGM32
    SolutionIndex: 118
    SolutionNameMin: Cijk_Ailk_Bjlk_SB_MT192x48x16_MI16x16x4x1_SN_1LDSB1_DTVA1_DTVB0_EPS1_EMLL0_GSU19_LPA0_LPB16_PGR2_PLR5_WG64_4_1_WGM1
    SolutionIndex: 119
    SolutionNameMin: Cijk_Ailk_Bjlk_SB_MT192x48x16_MI16x16x4x1_SN_1LDSB0_DTVA1_DTVB0_EPS1_EMLL0_GSU19_LPA0_LPB16_PGR1_PLR1_WG64_4_1_WGM1
    SolutionIndex: 120
    SolutionNameMin: Cijk_Ailk_Bjlk_SB_MT48x192x16_MI16x16x4x1_SN_1LDSB0_DTVA0_DTVB1_EPS1_EMLL8_GSU19_LPA16_LPB0_PGR1_PLR5_WG16_16_1_WGM16
    SolutionIndex: 121
    SolutionNameMin: Cijk_Ailk_Bjlk_SB_MT192x48x16_MI16x16x4x1_SN_AMAS0_DTVA1_DTVB0_EPS1_EMLL0_GLVWA1_GLVWB1_GSU6_LPA0_LPB16_NLCA3_NLCB3_PGR1_PLR1_TT3_48_VW1_VWB1_WG64_4_1_WGM32
    SolutionIndex: 122
    SolutionNameMin: Cijk_Ailk_Bjlk_SB_MT192x48x32_MI16x16x4x1_SN_AMAS0_DTVA1_DTVB0_EPS1_EMLL8_GLVWA1_GLVWB1_GSU6_LPA0_LPB16_NLCA3_NLCB3_PGR1_PLR1_TT3_48_VW1_VWB1_WG64_4_1_WGM1
    SolutionIndex: 123
    SolutionNameMin: Cijk_Ailk_Bjlk_SB_MT192x96x32_MI16x16x4x1_SN_AMAS0_DTVA1_DTVB0_EPS1_EMLL4_GLVWA1_GLVWB1_GSU12_LPA0_LPB0_NLCA3_NLCB3_PGR1_PLR1_TT3_96_VW1_VWB2_WG64_4_1_WGM32
    SolutionIndex: 124
    SolutionNameMin: Cijk_Ailk_Bjlk_SB_MT192x48x16_MI16x16x4x1_SN_AMAS0_DTVA1_DTVB0_EPS1_EMLL8_GLVWA1_GLVWB1_GSU12_LPA0_LPB16_NLCA3_NLCB3_PGR1_PLR1_TT3_48_VW1_VWB1_WG64_4_1_WGM1
    SolutionIndex: 125
    SolutionNameMin: Cijk_Ailk_Bjlk_SB_MT192x48x16_MI16x16x4x1_SN_AMAS0_DTVA0_DTVB0_EPS0_EMLL8_GLVWA1_GLVWB1_GSU12_LPA16_LPB16_NLCA3_NLCB3_PGR0_PLR5_TT3_48_VW1_VWB1_WG64_4_1_WGM1
    SolutionIndex: 126
    SolutionNameMin: Cijk_Ailk_Bjlk_SB_MT192x96x32_MI16x16x4x1_SN_AMAS0_DTVA1_DTVB0_EPS1_EMLL4_GLVWA1_GLVWB1_GSU12_LPA0_LPB16_NLCA3_NLCB3_PGR1_PLR9_TT3_96_VW1_VWB1_WG64_4_1_WGM16
    SolutionIndex: 127
    SolutionNameMin: Cijk_Ailk_Bjlk_SB_MT96x96x32_MI16x16x4x1_SN_AMAS0_DTVA0_DTVB0_EPS1_EMLL8_GLVWA1_GLVWB1_GSU4_LPA16_LPB16_NLCA3_NLCB3_PGR2_PLR1_TT3_48_VW1_VWB1_WG32_8_1_WGM32
    SolutionIndex: 128
    SolutionNameMin: Cijk_Ailk_Bjlk_SB_MT192x48x32_MI16x16x4x1_SN_AMAS0_DTVA1_DTVB0_EPS1_EMLL0_GLVWA1_GLVWB1_GSU4_LPA0_LPB16_NLCA3_NLCB3_PGR1_PLR9_TT3_48_VW1_VWB1_WG64_4_1_WGM32
    SolutionIndex: 129
    SolutionNameMin: Cijk_Ailk_Bjlk_SB_MT192x48x16_MI16x16x4x1_SN_AMAS0_DTVA0_DTVB0_EPS0_EMLL8_GLVWA1_GLVWB1_GSU9_LPA16_LPB16_NLCA3_NLCB3_PGR0_PLR1_TT3_48_VW1_VWB1_WG64_4_1_WGM1
    SolutionIndex: 130
    SolutionNameMin: Cijk_Ailk_Bjlk_SB_MT96x192x16_MI16x16x4x1_SN_AMAS3_DTVA0_DTVB0_EPS1_EMLL8_GLVWA2_GLVWB2_GSU9_LPA0_LPB16_NLCA3_NLCB3_PGR2_PLR5_TT6_48_VW2_VWB1_WG16_16_1_WGM1
    SolutionIndex: 131
    SolutionNameMin: Cijk_Ailk_Bjlk_SB_MT192x48x16_MI16x16x4x1_SN_AMAS0_DTVA0_DTVB0_EPS0_EMLL4_GLVWA1_GLVWB1_GSU9_LPA16_LPB16_NLCA3_NLCB3_PGR0_PLR5_TT3_48_VW1_VWB1_WG64_4_1_WGM1
    SolutionIndex: 132
    SolutionNameMin: Cijk_Ailk_Bjlk_SB_MT32x64x64_MI16x16x4x1_SN_AMAS0_DTVA1_DTVB1_EPS1_EMLL4_GLVWA1_GLVWB1_LPA0_LPB0_NLCA2_NLCB4_PGR1_PLR5_VW1_VWB1_WGM32
    SolutionIndex: 133
    SolutionNameMin: Cijk_Ailk_Bjlk_SB_MT16x64x64_MI16x16x4x1_SN_1LDSB0_AMAS0_DTVA1_DTVB1_GLVWA1_GLVWB1_LPA16_LPB16_NLCA1_NLCB4_TT1_64_VW1_VWB1_WG16_4_4
    SolutionIndex: 134
    SolutionNameMin: Cijk_Ailk_Bjlk_SB_MT32x64x64_MI16x16x4x1_SN_1LDSB0_AMAS3_DTVA1_DTVB1_GLVWA2_GLVWB2_LPA0_LPB0_NLCA1_NLCB2_TT2_64_VW2_VWB2_WG16_4_4
    SolutionIndex: 135
    SolutionNameMin: Cijk_Ailk_Bjlk_SB_MT256x64x32_MI16x16x4x1_SN_AMAS3_DTVA1_EPS1_EMLL0_GLVWA4_GLVWB4_LPA0_LPB16_MIAV0_NEPBS16_NLCA1_PGR2_PLR9_SSO0_TT4_64_VW4_VWB1_WGM1
    SolutionIndex: 136
    SolutionNameMin: Cijk_Ailk_Bjlk_SB_MT256x64x16_MI16x16x4x1_SN_AMAS3_DTVA1_EPS1_EMLL0_GLVWA4_GLVWB4_LPA0_LPB16_MIAV1_NEPBS0_NLCA1_PGR2_PLR5_SSO0_TT4_64_VW4_VWB1_WGM1
    SolutionIndex: 137
    SolutionNameMin: Cijk_Ailk_Bjlk_SB_MT256x64x32_MI16x16x4x1_SN_AMAS3_DTVA1_EPS1_EMLL0_GLVWA4_GLVWB4_LPA0_LPB16_MIAV1_NEPBS16_NLCA1_PGR2_PLR9_SSO4_TT4_64_VW4_VWB1_WGM1
    SolutionIndex: 138
    SolutionNameMin: Cijk_Ailk_Bjlk_SB_MT256x64x16_MI16x16x4x1_SN_AMAS3_DTVA1_EPS1_EMLL0_GLVWA4_GLVWB4_LPA0_LPB0_MIAV0_NEPBS16_NLCA1_PGR2_PLR5_SSO4_TT4_64_VW4_VWB2_WGM1
    SolutionIndex: 139
    SolutionNameMin: Cijk_Ailk_Bjlk_SB_MT256x64x16_MI16x16x4x1_SN_AMAS3_DTVA1_EPS1_EMLL0_GLVWA4_GLVWB4_LPA0_LPB0_MIAV1_NEPBS0_NLCA1_PGR2_PLR5_SSO4_TT4_64_VW4_VWB2_WGM1
    SolutionIndex: 140
    SolutionNameMin: Cijk_Ailk_Bjlk_SB_MT32x32x64_MI16x16x4x1_SN_1LDSB0_DTVB1_EMLL4_GLVWA2_GLVWB2_GRVW2_LPB0_NEPBS0_NLCA1_PGR1_PLR5_SSO0_TT2_32_VW2_VWB2_WSGRB0_WG16_4_4_WGM1
    SolutionIndex: 141
    SolutionNameMin: Cijk_Ailk_Bjlk_SB_MT32x32x64_MI16x16x4x1_SN_1LDSB0_DTVB1_EMLL0_GLVWA2_GLVWB2_GRVW2_LPB0_NEPBS0_NLCA1_PGR1_PLR5_SSO0_TT2_32_VW2_VWB2_WSGRB0_WG16_4_4_WGM1
    SolutionIndex: 142
    SolutionNameMin: Cijk_Ailk_Bjlk_SB_MT32x32x64_MI16x16x4x1_SN_1LDSB1_DTVB0_EMLL8_GLVWA2_GLVWB2_GRVW2_LPB0_NEPBS0_NLCA1_PGR2_PLR5_SSO0_TT2_32_VW2_VWB2_WSGRB0_WG16_4_4_WGM32
    SolutionIndex: 143
    SolutionNameMin: Cijk_Ailk_Bjlk_SB_MT32x32x64_MI16x16x4x1_SN_1LDSB1_DTVB1_EMLL4_GLVWA2_GLVWB2_GRVW2_LPB0_NEPBS16_NLCA1_PGR1_PLR5_SSO4_TT2_32_VW2_VWB2_WSGRB0_WG16_4_4_WGM16
    SolutionIndex: 144
    SolutionNameMin: Cijk_Ailk_Bjlk_SB_MT64x32x64_MI16x16x4x1_SN_1LDSB0_DTVB0_EMLL4_GLVWA4_GLVWB4_GRVW4_LPB16_NEPBS16_NLCA1_PGR1_PLR5_SSO0_TT4_32_VW4_VWB1_WSGRB0_WG16_4_4_WGM1
    SolutionIndex: 145
    SolutionNameMin: Cijk_Ailk_Bjlk_SB_MT64x32x64_MI16x16x4x1_SN_1LDSB1_DTVB0_EMLL0_GLVWA4_GLVWB4_GRVW4_LPB16_NEPBS16_NLCA1_PGR2_PLR5_SSO0_TT4_32_VW4_VWB1_WSGRB0_WG16_4_4_WGM32
    SolutionIndex: 146
    SolutionNameMin: Cijk_Ailk_Bjlk_SB_MT64x32x64_MI16x16x4x1_SN_1LDSB1_DTVB0_EMLL0_GLVWA4_GLVWB4_GRVW4_LPB16_NEPBS16_NLCA1_PGR1_PLR5_SSO0_TT4_32_VW4_VWB1_WSGRB0_WG16_4_4_WGM16
    SolutionIndex: 147
    SolutionNameMin: Cijk_Ailk_Bjlk_SB_MT64x32x32_MI16x16x4x1_SN_1LDSB1_DTVB0_EMLL8_GLVWA4_GLVWB4_GRVW4_LPB0_NEPBS0_NLCA1_PGR2_PLR3_SSO0_TT4_32_VW4_VWB2_WSGRB1_WG16_4_4_WGM32
    SolutionIndex: 148
    SolutionNameMin: Cijk_Ailk_Bjlk_SB_MT128x32x32_MI32x32x2x1_SN_1LDSB1_DTVB0_EMLL0_GLVWA4_GLVWB4_GRVW4_LPB0_NEPBS16_NLCA1_PGR1_PLR5_SSO0_TT4_32_VW4_VWB1_WSGRB1_WG32_2_4_WGM16
    SolutionIndex: 149
    SolutionNameMin: Cijk_Ailk_Bjlk_SB_MT64x32x32_MI16x16x4x1_SN_1LDSB0_AMAS0_DTVA1_DTVB1_GLVWA1_GLVWB1_LPA16_LPB16_NLCA4_NLCB2_TT4_32_VW1_VWB1_WG16_4_4
    SolutionIndex: 150
    SolutionNameMin: Cijk_Ailk_Bjlk_SB_MT128x32x32_MI16x16x4x1_SN_1LDSB1_AMAS0_DTVA1_DTVB0_GLVWA1_GLVWB1_LPA16_LPB0_NLCA2_NLCB1_TT2_32_VW1_VWB2_WG64_4_1
    SolutionIndex: 151
    SolutionNameMin: Cijk_Ailk_Bjlk_SB_MT32x64x64_MI16x16x4x1_SN_1LDSB1_DTVA1_DTVB1_EPS1_ELFLR4_LPA16_LPB16_NLCA2_NLCB4_PGR1_SSO0_TT2_64_VWB1_WSGRA0_WSGRB0_WG16_4_4_WGM1
    SolutionIndex: 152
    SolutionNameMin: Cijk_Ailk_Bjlk_SB_MT32x64x64_MI16x16x4x1_SN_1LDSB0_DTVA0_DTVB1_EPS1_ELFLR0_LPA16_LPB16_NLCA1_NLCB4_PGR2_SSO0_TT2_64_VWB1_WSGRA1_WSGRB0_WG16_4_4_WGM1
    SolutionIndex: 153
    SolutionNameMin: Cijk_Ailk_Bjlk_SB_MT32x64x64_MI16x16x4x1_SN_1LDSB0_DTVA1_DTVB1_EPS1_ELFLR4_LPA16_LPB16_NLCA2_NLCB4_PGR1_SSO4_TT2_64_VWB1_WSGRA0_WSGRB0_WG16_4_4_WGM1
    SolutionIndex: 154
    SolutionNameMin: Cijk_Ailk_Bjlk_SB_MT32x64x64_MI16x16x4x1_SN_1LDSB1_DTVA1_DTVB1_EPS1_ELFLR0_LPA16_LPB16_NLCA2_NLCB4_PGR1_SSO0_TT2_64_VWB1_WSGRA0_WSGRB0_WG16_4_4_WGM1
    SolutionIndex: 155
    SolutionNameMin: Cijk_Ailk_Bjlk_SB_MT32x64x64_MI16x16x4x1_SN_1LDSB1_DTVB0_EPS1_EMLL0_GLVWA4_GLVWB4_GRVW4_LPB0_NEPBS16_NLCB1_PGR2_PLR5_SSO0_VWB2_WSGRA1_WSGRB1
    SolutionIndex: 156
    SolutionNameMin: Cijk_Ailk_Bjlk_SB_MT32x64x64_MI16x16x4x1_SN_1LDSB1_DTVB1_EMLL0_GLVWA2_GLVWB2_GRVW2_LPB0_NEPBS0_NLCB2_SSO0_TT2_64_VWB2_WSGRA0_WSGRB0_WG16_4_4_WGM1
    SolutionIndex: 157
    SolutionNameMin: Cijk_Ailk_Bjlk_SB_MT32x64x64_MI16x16x4x1_SN_1LDSB1_DTVB0_EPS1_EMLL0_GLVWA4_GLVWB4_GRVW4_LPB16_NEPBS16_NLCB1_PGR2_PLR5_SSO0_VWB1_WSGRA0_WSGRB0
    SolutionIndex: 158
    SolutionNameMin: Cijk_Ailk_Bjlk_SB_MT64x128x32_MI16x16x4x1_SN_1LDSB0_AMAS3_DTVA0_DTVB0_GLVWA4_GLVWB4_LPA0_LPB16_NLCA1_NLCB1_TT4_32_VW4_VWB1_WG16_16_1
    SolutionIndex: 159
    SolutionNameMin: Cijk_Ailk_Bjlk_SB_MT64x256x16_MI16x16x4x1_SN_1LDSB0_AMAS0_DTVA0_DTVB1_GLVWA1_GLVWB1_LPA16_LPB16_NLCA1_NLCB4_TT4_64_VW1_VWB1_WG16_16_1
    SolutionIndex: 160
    SolutionNameMin: Cijk_Ailk_Bjlk_SB_MT96x96x32_MI16x16x4x1_SN_1LDSB0_EPS1_EMLL0_GLVWA4_GLVWB4_GRVW4_LPA16_LPB16_PGR1_PLR9_SSO0_TT3_48_WG32_8_1_WGM1
    SolutionIndex: 161
    SolutionNameMin: Cijk_Ailk_Bjlk_SB_MT192x48x32_MI16x16x4x1_SN_1LDSB1_EPS1_EMLL0_GLVWA2_GLVWB2_GRVW2_LPA16_LPB16_PGR2_PLR9_SSO0_TT3_48_WG64_4_1_WGM1
    SolutionIndex: 162
    SolutionNameMin: Cijk_Ailk_Bjlk_SB_MT96x96x32_MI16x16x4x1_SN_1LDSB1_EPS1_EMLL0_GLVWA4_GLVWB4_GRVW4_LPA16_LPB16_PGR2_PLR9_SSO4_TT3_48_WG32_8_1_WGM1
    SolutionIndex: 163
    SolutionNameMin: Cijk_Ailk_Bjlk_SB_MT32x64x32_MI16x16x4x1_SN_AMAS3_DTVA1_DTVB1_EMLL8_GLVWA2_GLVWB2_GRVW2_LPA0_LPB0_NLCA1_NLCB2_SSO0_TT2_64_VW2_VWB2_WSGRA0_WSGRB0_WG16_4_4
    SolutionIndex: 164
    SolutionNameMin: Cijk_Ailk_Bjlk_SB_MT64x256x16_MI16x16x4x1_SN_AMAS3_DTVA0_DTVB0_EMLL4_GLVWA4_GLVWB4_GRVW4_LPA0_LPB0_NLCA1_NLCB1_SSO0_TT4_64_VW2_VWB2_WSGRA1_WSGRB0_WG16_16_1
    SolutionIndex: 165
    SolutionNameMin: Cijk_Ailk_Bjlk_SB_MT256x128x16_MI16x16x4x1_SN_1LDSB0_AMAS3_DTVA1_DTVB0_ELFLR0_GLVWA4_GLVWB4_LPA0_LPB16_NLCA1_NLCB1_SSO0_TT4_128_VW4_VWB1_WSGRA0_WSGRB1_WG64_4_1
    SolutionIndex: 166
    SolutionNameMin: Cijk_Ailk_Bjlk_SB_MT256x128x32_MI16x16x4x1_SN_1LDSB0_AMAS0_DTVA1_DTVB0_ELFLR0_GLVWA1_GLVWB1_LPA16_LPB16_NLCA4_NLCB1_SSO4_TT4_128_VW1_VWB1_WSGRA0_WSGRB0_WG64_4_1
    SolutionIndex: 167
    SolutionNameMin: Cijk_Ailk_Bjlk_SB_MT128x64x16_MI16x16x4x1_SN_1LDSB0_AMAS3_DTVA1_DTVB0_ELFLR4_GLVWA4_GLVWB4_LPA0_LPB16_NLCA1_NLCB1_SSO4_TT4_64_VW4_VWB1_WSGRA0_WSGRB0_WG32_4_2
    SolutionIndex: 168
    SolutionNameMin: Cijk_Ailk_Bjlk_SB_MT128x64x16_MI16x16x4x1_SN_1LDSB0_AMAS3_DTVA1_DTVB0_ELFLR4_GLVWA4_GLVWB4_LPA0_LPB16_NLCA1_NLCB1_SSO0_TT4_64_VW4_VWB1_WSGRA0_WSGRB0_WG32_4_2
    SolutionIndex: 169
    SolutionNameMin: Cijk_Ailk_Bjlk_SB_MT128x64x16_MI16x16x4x1_SN_1LDSB1_AMAS3_DTVA1_DTVB0_ELFLR0_GLVWA4_GLVWB4_LPA0_LPB0_NLCA1_NLCB1_SSO0_TT4_64_VW4_VWB2_WSGRA0_WSGRB0_WG32_4_2
    SolutionIndex: 170
    SolutionNameMin: Cijk_Ailk_Bjlk_SB_MT32x64x32_MI16x16x4x1_SN_1LDSB0_AMAS0_DTVA0_DTVB1_ELFLR4_GLVWA1_GLVWB1_LPA16_LPB16_NLCA1_NLCB1_SSO0_TT2_16_VW1_VWB1_WSGRA0_WSGRB0_WG16_16_1
    SolutionIndex: 171
    SolutionNameMin: Cijk_Ailk_Bjlk_SB_MT64x64x32_MI16x16x4x1_SN_1LDSB0_AMAS0_DTVA1_DTVB0_ELFLR0_GLVWA1_GLVWB1_LPA16_LPB0_NLCA1_NLCB1_SSO0_TT1_64_VW1_VWB2_WSGRA0_WSGRB0_WG64_4_1
    SolutionIndex: 172
    SolutionNameMin: Cijk_Ailk_Bjlk_SB_MT32x64x32_MI16x16x4x1_SN_1LDSB0_AMAS0_DTVA0_DTVB1_ELFLR4_GLVWA1_GLVWB1_LPA16_LPB16_NLCA1_NLCB1_SSO0_TT2_16_VW1_VWB1_WSGRA1_WSGRB0_WG16_16_1
    SolutionIndex: 173
    SolutionNameMin: Cijk_Ailk_Bjlk_SB_MT128x32x32_MI16x16x4x1_SN_1LDSB1_AMAS0_DTVA1_DTVB0_ELFLR4_GLVWA1_GLVWB1_LPA16_LPB0_NLCA2_NLCB1_SSO0_TT2_32_VW1_VWB2_WSGRA0_WSGRB0_WG64_4_1
    SolutionIndex: 174
    SolutionNameMin: Cijk_Ailk_Bjlk_SB_MT32x512x16_MI16x16x4x1_SN_1LDSB0_AMAS0_DTVA0_DTVB1_ELFLR0_GLVWA1_GLVWB1_LPA16_LPB16_NLCA1_NLCB8_SSO0_TT2_128_VW1_VWB1_WSGRA0_WSGRB0_WG16_16_1
    SolutionIndex: 175
    SolutionNameMin: Cijk_Ailk_Bjlk_SB_MT256x96x32_MI16x16x4x1_SN_1LDSB1_EPS1_EMLL0_LPA16_LPB16_PGR1_PLR1_SSO0_WGM1
    SolutionIndex: 176
    SolutionNameMin: Cijk_Ailk_Bjlk_SB_MT32x32x32_MI32x32x2x1_SN_AMAS0_FL2_GLVWA1_GLVWB2_GSU64_LPA0_LPB0_NLCA1_NLCB1_PLR5_SVW1_TT1_32_VW1_VWB1_WG32_2_4
    SolutionIndex: 177
    SolutionNameMin: Cijk_Ailk_Bjlk_SB_MT32x32x128_MI16x16x4x1_SN_AMAS0_FL1_GLVWA1_GLVWB2_GSU32_LPA16_LPB0_NLCA1_NLCB1_PLR9_SVW1_TT2_32_VW1_VWB2_WG16_4_4
    SolutionIndex: 178
    SolutionNameMin: Cijk_Ailk_Bjlk_SB_MT96x96x32_MI16x16x4x1_SN_AMAS0_FL0_GLVWA1_GLVWB4_GSU152_LPA16_LPB16_NLCA3_NLCB3_PLR9_SVW1_TT3_48_VW1_VWB1_WG32_8_1
    SolutionIndex: 179
    SolutionNameMin: Cijk_Ailk_Bjlk_SB_MT96x96x16_MI16x16x4x1_SN_AMAS0_FL1_GLVWA1_GLVWB1_GSU304_LPA16_LPB16_NLCA1_NLCB1_PLR1_SVW1_TT3_48_VW1_VWB1_WG32_8_1
    SolutionIndex: 180
    SolutionNameMin: Cijk_Ailk_Bjlk_SB_MT96x96x16_MI16x16x4x1_SN_AMAS0_FL1_GLVWA1_GLVWB4_GSU304_LPA16_LPB16_NLCA1_NLCB1_PLR1_SVW1_TT3_48_VW1_VWB1_WG32_8_1
    SolutionIndex: 181
    SolutionNameMin: Cijk_Ailk_Bjlk_SB_MT96x96x16_MI16x16x4x1_SN_AMAS0_FL0_GLVWA1_GLVWB1_GSU304_LPA16_LPB16_NLCA3_NLCB3_PLR5_SVW1_TT3_48_VW1_VWB1_WG32_8_1
    SolutionIndex: 182
    SolutionNameMin: Cijk_Ailk_Bjlk_SB_MT96x96x32_MI16x16x4x1_SN_AMAS0_FL0_GLVWA1_GLVWB1_GSU64_LPA16_LPB16_NLCA3_NLCB3_PLR9_SVW1_TT3_48_VW1_VWB1_WG32_8_1
    SolutionIndex: 183
    SolutionNameMin: Cijk_Ailk_Bjlk_SB_MT96x32x64_MI16x16x4x1_SN_AMAS0_FL2_GLVWA1_GLVWB4_GSU32_LPA16_LPB16_NLCA1_NLCB1_PLR17_SVW1_TT3_16_VW1_VWB1_WG32_8_1
    SolutionIndex: 184
    SolutionNameMin: Cijk_Ailk_Bjlk_SB_MT96x32x64_MI16x16x4x1_SN_AMAS0_FL0_GLVWA1_GLVWB4_GSU32_LPA16_LPB16_NLCA3_NLCB1_PLR17_SVW1_TT3_16_VW1_VWB1_WG32_8_1
    SolutionIndex: 185
    SolutionNameMin: Cijk_Ailk_Bjlk_SB_MT96x96x32_MI16x16x4x1_SN_AMAS0_FL0_GLVWA1_GLVWB4_GSU76_LPA16_LPB16_NLCA3_NLCB3_PLR9_SVW1_TT3_48_VW1_VWB1_WG32_8_1
    SolutionIndex: 186
    SolutionNameMin: Cijk_Ailk_Bjlk_SB_MT96x32x128_MI16x16x4x1_SN_AMAS0_FL0_GLVWA1_GLVWB4_GSU32_LPA0_LPB0_NLCA3_NLCB1_PLR33_SVW1_TT3_16_VW1_VWB1_WG32_8_1
    SolutionIndex: 187
    SolutionNameMin: Cijk_Ailk_Bjlk_SB_MT96x96x16_MI16x16x4x1_SN_AMAS0_FL0_GLVWA1_GLVWB1_GSU64_LPA16_LPB16_NLCA3_NLCB3_PLR5_SVW1_TT3_48_VW1_VWB1_WG32_8_1
    SolutionIndex: 188
    SolutionNameMin: Cijk_Ailk_Bjlk_SB_MT96x96x8_MI16x16x4x1_SN_AMAS0_FL0_GLVWA1_GLVWB1_GSU76_LPA16_LPB16_NLCA3_NLCB3_PLR3_SVW1_TT3_48_VW1_VWB1_WG32_8_1
    SolutionIndex: 189
    SolutionNameMin: Cijk_Ailk_Bjlk_SB_MT96x96x8_MI16x16x4x1_SN_AMAS0_FL2_GLVWA1_GLVWB1_GSU76_LPA16_LPB16_NLCA1_NLCB1_PLR1_SVW1_TT3_48_VW1_VWB1_WG32_8_1
    SolutionIndex: 190
    SolutionNameMin: Cijk_Ailk_Bjlk_SB_MT96x96x32_MI16x16x4x1_SN_AMAS0_FL0_GLVWA1_GLVWB2_GSU76_LPA16_LPB16_NLCA3_NLCB3_PLR9_SVW1_TT3_48_VW1_VWB1_WG32_8_1
    SolutionIndex: 191
    SolutionNameMin: Cijk_Ailk_Bjlk_SB_MT96x96x32_MI16x16x4x1_SN_AMAS0_FL0_GLVWA1_GLVWB4_GSU64_LPA16_LPB16_NLCA3_NLCB3_PLR9_SVW1_TT3_48_VW1_VWB1_WG32_8_1
    SolutionIndex: 192
    SolutionNameMin: Cijk_Ailk_Bjlk_SB_MT96x96x64_MI16x16x4x1_SN_AMAS0_FL0_GLVWA1_GLVWB4_GSU64_LPA16_LPB16_NLCA3_NLCB3_PLR17_SVW1_TT3_48_VW1_VWB1_WG32_8_1
    SolutionIndex: 193
    SolutionNameMin: Cijk_Ailk_Bjlk_SB_MT256x8x4_MI4x4x1x16_SN_1LDSB0_DTVA0_EPS0_GLVWA1_LPB4_NLCA1_PGR0_PLR5_SU0_SUS0_SVW2_TT2_4_VW2_WG128_2_1
    SolutionIndex: 194
    SolutionNameMin: Cijk_Ailk_Bjlk_SB_MT256x8x4_MI4x4x1x16_SN_1LDSB0_DTVA0_EPS1_GLVWA1_LPB4_NLCA1_PGR2_PLR1_SU0_SUS0_SVW2_TT2_4_VW2_WG128_2_1
    SolutionIndex: 195
    SolutionNameMin: Cijk_Ailk_Bjlk_SB_MT128x16x8_MI16x16x4x1_SN_1LDSB0_DTVA0_EPS1_GLVWA1_LPB16_NLCA1_PGR2_PLR3_SU32_SUS128_SVW2_TT2_16_VW2_WG64_4_1
    SolutionIndex: 196
    SolutionNameMin: Cijk_Ailk_Bjlk_SB_MT128x16x8_MI16x16x4x1_SN_1LDSB0_DTVA0_EPS1_GLVWA1_LPB16_NLCA1_PGR1_PLR1_SU0_SUS0_SVW2_TT2_16_VW2_WG64_4_1
    SolutionIndex: 197
    SolutionNameMin: Cijk_Ailk_Bjlk_SB_MT128x16x8_MI16x16x4x1_SN_1LDSB0_DTVA0_EPS1_GLVWA1_LPB16_NLCA1_PGR2_PLR3_SU32_SUS256_SVW2_TT2_16_VW2_WG64_4_1
    SolutionIndex: 198
    SolutionNameMin: Cijk_Ailk_Bjlk_SB_MT64x32x16_MI16x16x4x1_SN_1LDSB0_AMAS3_DTVA0_EPS1_GLVWA1_GLVWB1_LPA0_NLCA1_PGR2_PLR5_SU0_SUS0_SVW2_TT2_16_VW2_WG32_8_1
    SolutionIndex: 199
    SolutionNameMin: Cijk_Ailk_Bjlk_SB_MT64x32x16_MI16x16x4x1_SN_1LDSB1_AMAS0_DTVA0_EPS1_GLVWA1_GLVWB1_LPA16_NLCA1_PGR2_PLR5_SU0_SUS0_SVW1_TT2_16_VW1_WG32_8_1
    SolutionIndex: 200
    SolutionNameMin: Cijk_Ailk_Bjlk_SB_MT64x32x16_MI16x16x4x1_SN_1LDSB1_AMAS3_DTVA0_EPS1_GLVWA1_GLVWB1_LPA0_NLCA1_PGR2_PLR5_SU32_SUS256_SVW2_TT2_16_VW2_WG32_8_1
    SolutionIndex: 201
    SolutionNameMin: Cijk_Ailk_Bjlk_SB_MT64x32x16_MI16x16x4x1_SN_1LDSB0_DTVA0_EPS1_FL1_GLVWA1_GLVWB1_NLCA1_PGR2_PLR1_SU0_SUS0_SVW2_TT2_16_VW2_WG32_8_1
    SolutionIndex: 202
    SolutionNameMin: Cijk_Ailk_Bjlk_SB_MT64x32x16_MI16x16x4x1_SN_1LDSB1_DTVA0_EPS1_FL1_GLVWA1_GLVWB1_NLCA1_PGR2_PLR5_SU0_SUS0_SVW2_TT2_16_VW2_WG32_8_1
    SolutionIndex: 203
    SolutionNameMin: Cijk_Ailk_Bjlk_SB_MT64x32x8_MI16x16x4x1_SN_1LDSB0_AMAS0_DTVA0_EPS1_GLVWA1_GLVWB1_LPA16_MIAV0_NLCA1_PGR1_PLR1_SU0_SUS0_SVW1_TT2_16_VW1_WG32_8_1
    SolutionIndex: 204
    SolutionNameMin: Cijk_Ailk_Bjlk_SB_MT64x32x8_MI16x16x4x1_SN_1LDSB0_AMAS3_DTVA0_EPS1_GLVWA1_GLVWB1_LPA0_MIAV0_NLCA1_PGR2_PLR1_SU0_SUS0_SVW2_TT2_16_VW2_WG32_8_1
    SolutionIndex: 205
    SolutionNameMin: Cijk_Ailk_Bjlk_SB_MT64x32x16_MI16x16x4x1_SN_1LDSB0_AMAS0_DTVA0_EPS1_GLVWA1_GLVWB1_LPA16_MIAV1_NLCA1_PGR2_PLR5_SU0_SUS0_SVW1_TT2_16_VW1_WG32_8_1
    SolutionIndex: 206
    SolutionNameMin: Cijk_Ailk_Bjlk_SB_MT32x32x16_MI16x16x4x1_SN_1LDSB0_AMAS3_DTVA0_EPS1_GLVWA1_GLVWB1_LPA0_MIAV1_NLCA1_PGR2_PLR1_SU0_SUS0_SVW2_TT2_16_VW2_WG16_8_1
    SolutionIndex: 207
    SolutionNameMin: Cijk_Ailk_Bjlk_SB_MT64x32x16_MI16x16x4x1_SN_1LDSB0_AMAS0_DTVA0_EPS1_GLVWA1_GLVWB1_LPA16_MIAV1_NLCA1_PGR2_PLR1_SU0_SUS0_SVW1_TT2_16_VW1_WG32_8_1
    SolutionIndex: 208
    SolutionNameMin: Cijk_Ailk_Bjlk_SB_MT64x32x16_MI16x16x4x1_SN_1LDSB1_AMAS0_DTVA0_EPS1_GLVWA1_GLVWB1_LPA16_MIAV0_NLCA1_PGR2_PLR5_SU0_SUS0_SVW1_TT2_16_VW1_WG32_8_1
    SolutionIndex: 209
    SolutionNameMin: Cijk_Ailk_Bjlk_SB_MT64x64x64_MI16x16x4x1_SN_1LDSB1_AMAS3_DTVA0_DTVB0_GLVWA4_GLVWB4_GRVW4_LPA0_LPB0_MIAV1_NLCA1_NLCB1_PLR17_SU32_SUS256_SVW2_TT2_32_VW2_VWB2_WG32_8_1_WGM1
    SolutionIndex: 210
    SolutionNameMin: Cijk_Ailk_Bjlk_SB_MT64x64x64_MI16x16x4x1_SN_1LDSB1_AMAS0_DTVA0_DTVB0_GLVWA4_GLVWB4_GRVW4_LPA16_LPB16_MIAV0_NLCA1_NLCB1_PLR17_SU32_SUS256_SVW1_TT1_64_VW1_VWB1_WG64_4_1_WGM1
    SolutionIndex: 211
    SolutionNameMin: Cijk_Ailk_Bjlk_SB_MT64x64x32_MI16x16x4x1_SN_1LDSB1_AMAS0_DTVA1_DTVB0_GLVWA1_GLVWB1_GRVW1_LPA0_LPB16_MIAV0_NLCA1_NLCB1_PLR9_SU32_SUS256_SVW1_TT1_64_VW1_VWB1_WG64_4_1_WGM1
    SolutionIndex: 212
    SolutionNameMin: Cijk_Ailk_Bjlk_SB_MT64x64x32_MI16x16x4x1_SN_1LDSB1_AMAS0_DTVA1_DTVB0_GLVWA1_GLVWB1_GRVW1_LPA0_LPB16_MIAV1_NLCA1_NLCB1_PLR9_SU0_SUS0_SVW1_TT1_64_VW1_VWB1_WG64_4_1_WGM1
    SolutionIndex: 213
    SolutionNameMin: Cijk_Ailk_Bjlk_SB_MT64x64x32_MI16x16x4x1_SN_1LDSB1_AMAS0_DTVA0_DTVB0_GLVWA4_GLVWB4_GRVW4_LPA16_LPB0_MIAV1_NLCA1_NLCB1_PLR9_SU0_SUS0_SVW1_TT1_64_VW1_VWB2_WG64_4_1_WGM1
    SolutionIndex: 214
    SolutionNameMin: Cijk_Ailk_Bjlk_SB_MT64x64x64_MI16x16x4x1_SN_1LDSB1_AMAS3_DTVA0_DTVB0_GLVWA4_GLVWB4_GRVW4_LPA0_LPB0_MIAV1_NLCA1_NLCB1_PLR17_SU0_SUS0_SVW2_TT2_32_VW2_VWB2_WG32_8_1_WGM1
    SolutionIndex: 215
    SolutionNameMin: Cijk_Ailk_Bjlk_SB_MT64x64x64_MI16x16x4x1_SN_1LDSB1_AMAS3_DTVA0_DTVB0_GLVWA4_GLVWB4_GRVW4_LPA0_LPB16_MIAV1_NLCA1_NLCB1_PLR17_SU0_SUS0_SVW2_TT2_32_VW2_VWB1_WG32_8_1_WGM1
    SolutionIndex: 216
    SolutionNameMin: Cijk_Ailk_Bjlk_SB_MT64x64x64_MI16x16x4x1_SN_1LDSB1_AMAS3_DTVA0_DTVB0_GLVWA4_GLVWB4_GRVW4_LPA0_LPB0_MIAV0_NLCA1_NLCB1_PLR17_SU0_SUS0_SVW2_TT2_32_VW2_VWB2_WG32_8_1_WGM1
    SolutionIndex: 217
    SolutionNameMin: Cijk_Ailk_Bjlk_SB_MT64x64x16_MI16x16x4x1_SN_1LDSB1_AMAS3_DTVA0_DTVB0_GLVWA4_GLVWB4_GRVW4_LPA0_LPB16_MIAV0_NLCA1_NLCB1_PLR5_SU32_SUS256_SVW2_TT2_32_VW2_VWB1_WG32_8_1_WGM1
    SolutionIndex: 218
    SolutionNameMin: Cijk_Ailk_Bjlk_SB_MT128x64x16_MI16x16x4x1_SN_1LDSB0_AMAS3_DTVA0_DTVB0_GLVWA4_GLVWB4_GRVW4_LPA0_LPB16_MIAV1_NLCA1_NLCB1_PLR5_SU0_SUS0_SVW2_TT2_64_VW2_VWB1_WG64_4_1_WGM16
    SolutionIndex: 219
    SolutionNameMin: Cijk_Ailk_Bjlk_SB_MT64x64x16_MI16x16x4x1_SN_1LDSB1_AMAS3_DTVA0_DTVB0_GLVWA4_GLVWB4_GRVW4_LPA0_LPB0_MIAV0_NLCA1_NLCB1_PLR5_SU32_SUS256_SVW2_TT2_32_VW2_VWB2_WG32_8_1_WGM1
    SolutionIndex: 220
    SolutionNameMin: Cijk_Ailk_Bjlk_SB_MT64x64x16_MI16x16x4x1_SN_1LDSB1_AMAS3_DTVA0_DTVB0_GLVWA4_GLVWB4_GRVW4_LPA0_LPB0_MIAV1_NLCA1_NLCB1_PLR5_SU32_SUS256_SVW2_TT2_32_VW2_VWB2_WG32_8_1_WGM1
    SolutionIndex: 221
    SolutionNameMin: Cijk_Ailk_Bjlk_SB_MT64x64x32_MI16x16x4x1_SN_1LDSB1_AMAS3_DTVA0_DTVB0_GLVWA4_GLVWB4_GRVW4_LPA0_LPB0_MIAV1_NLCA1_NLCB1_PLR9_SU0_SUS0_SVW2_TT2_32_VW2_VWB2_WG32_8_1_WGM1
    SolutionIndex: 222
    SolutionNameMin: Cijk_Ailk_Bjlk_SB_MT64x64x16_MI16x16x4x1_SN_1LDSB0_AMAS0_DTVA1_DTVB0_GLVWA1_GLVWB1_GRVW1_LPA0_LPB0_MIAV1_NLCA1_NLCB1_PLR5_SU32_SUS256_SVW1_TT1_64_VW1_VWB2_WG64_4_1_WGM1
    SolutionIndex: 223
    SolutionNameMin: Cijk_Ailk_Bjlk_SB_MT32x32x64_MI16x16x4x1_SN_1LDSB0_AMAS0_DTVA0_DTVB1_GLVWA1_GLVWB1_GRVW1_LPA16_LPB0_NLCB1_PLR1_SSO0_SVW1_TT2_16_VW1_VWB1_WG16_8_4
    SolutionIndex: 224
    SolutionNameMin: Cijk_Ailk_Bjlk_SB_MT32x32x64_MI16x16x4x1_SN_1LDSB0_AMAS0_DTVA0_DTVB1_GLVWA1_GLVWB1_GRVW1_LPA16_LPB0_NLCB1_PLR5_SSO0_SVW1_TT2_16_VW1_VWB1_WG16_8_4
    SolutionIndex: 225
    SolutionNameMin: Cijk_Ailk_Bjlk_SB_MT32x128x64_MI16x16x4x1_SN_1LDSB1_AMAS0_DTVA0_DTVB0_GLVWA4_GLVWB4_GRVW4_LPA16_LPB16_MIAV0_NLCB1_PLR17_SSO0_SVW1_TT2_32_VW1_VWB1_WG16_16_1
    SolutionIndex: 226
    SolutionNameMin: Cijk_Ailk_Bjlk_SB_MT64x64x64_MI16x16x4x1_SN_1LDSB0_AMAS3_DTVA0_DTVB1_GLVWA1_GLVWB1_GRVW1_LPA0_LPB0_MIAV1_NLCB1_PLR17_SSO4_SVW2_TT4_16_VW2_VWB1_WG16_16_1
    SolutionIndex: 227
    SolutionNameMin: Cijk_Ailk_Bjlk_SB_MT16x32x64_MI16x16x4x1_SN_1LDSB0_AMAS0_DTVA0_DTVB1_GLVWA1_GLVWB1_GRVW1_LPA16_LPB0_MIAV0_NLCA1_PLR9_SVW1_TT1_16_VW1_WG16_8_2
    SolutionIndex: 228
    SolutionNameMin: Cijk_Ailk_Bjlk_SB_MT64x128x16_MI16x16x4x1_SN_1LDSB1_AMAS0_DTVA0_DTVB1_GLVWA1_GLVWB1_GRVW1_LPA16_LPB0_MIAV1_NLCB2_PLR1_SSO4_SVW1_TT4_32_VW1_VWB1_WG16_16_1
    SolutionIndex: 229
    SolutionNameMin: Cijk_Ailk_Bjlk_SB_MT128x32x64_MI16x16x4x1_SN_1LDSB1_AMAS3_DTVA0_DTVB0_GLVWA4_GLVWB4_GRVW4_LPA0_LPB0_MIAV1_NLCA1_PLR17_SSO4_SVW2_TT2_32_VW2_VWB2_WG64_4_1
    SolutionIndex: 230
    SolutionNameMin: Cijk_Ailk_Bjlk_SB_MT128x64x16_MI16x16x4x1_SN_1LDSB1_AMAS0_DTVA1_DTVB0_GLVWA1_GLVWB1_GRVW1_LPA0_LPB16_MIAV1_NLCA2_PLR1_SSO0_SVW1_TT2_64_VW1_VWB1_WG64_4_1
    SolutionIndex: 231
    SolutionNameMin: Cijk_Ailk_Bjlk_SB_MT32x32x128_MI16x16x4x1_SN_1LDSB1_AMAS3_DTVB1_EPS1_LPA0_LPB0_PGR2_PLR17_SSO0_SVW2_VW2
    SolutionIndex: 232
    SolutionNameMin: Cijk_Ailk_Bjlk_SB_MT96x64x64_MI16x16x4x1_SN_1LDSB1_AMAS3_DTVA0_DTVB1_GLVWA1_GLVWB1_GRVW1_LPA0_LPB0_MIAV1_NLCA3_NLCB1_PLR17_SSO4_SVW2_TT6_16_VW2_VWB1_WG16_16_1
    SolutionIndex: 233
    SolutionNameMin: Cijk_Ailk_Bjlk_SB_MT96x64x16_MI16x16x4x1_SN_1LDSB1_AMAS3_DTVA0_DTVB1_GLVWA1_GLVWB1_GRVW1_LPA0_LPB0_MIAV1_NLCA3_NLCB1_PLR1_SSO0_SVW2_TT6_16_VW2_VWB1_WG16_16_1
    SolutionIndex: 234
    SolutionNameMin: Cijk_Ailk_Bjlk_SB_MT96x64x16_MI16x16x4x1_SN_1LDSB1_AMAS3_DTVA0_DTVB1_GLVWA1_GLVWB1_GRVW1_LPA0_LPB0_MIAV0_NLCA3_NLCB1_PLR1_SSO0_SVW2_TT6_16_VW2_VWB1_WG16_16_1
    SolutionIndex: 235
    SolutionNameMin: Cijk_Ailk_Bjlk_SB_MT256x8x4_MI4x4x1x16_SN_1LDSB0_DTVA0_EPS0_GLVWA1_LPB4_NLCA1_PGR0_PLR5_SU0_SUS0_SSO0_SVW2_TT2_4_VW2_WG128_2_1
    SolutionIndex: 236
    SolutionNameMin: Cijk_Ailk_Bjlk_SB_MT128x16x16_MI16x16x4x1_SN_1LDSB0_DTVA0_EPS1_FL1_GLVWA2_GLVWB1_PGR2_PLR1_SU0_SUS0_SSO0_WG64_4_1
    SolutionIndex: 237
    SolutionNameMin: Cijk_Ailk_Bjlk_SB_MT64x16x64_MI16x16x4x1_SN_1LDSB1_AMAS0_DTVA1_DTVB0_GLVWA1_GLVWB1_LPA0_LPB16_NLCA1_NLCB1_PLR9_SU0_SUS0_SSO0_SVW1_TT1_16_VW1_VWB1_WG64_4_2
    SolutionIndex: 238
    SolutionNameMin: Cijk_Ailk_Bjlk_SB_MT32x32x64_MI16x16x4x1_SN_1LDSB0_AMAS0_DTVA0_DTVB1_GLVWA1_GLVWB1_LPA16_LPB0_NLCA1_NLCB1_PLR9_SU0_SUS0_SSO0_SVW1_TT2_16_VW1_VWB1_WG16_8_2
    SolutionIndex: 239
    SolutionNameMin: Cijk_Ailk_Bjlk_SB_MT64x32x16_MI16x16x4x1_SN_1LDSB1_AMAS0_DTVA0_DTVB0_GLVWA4_GLVWB2_LPA16_LPB16_NLCA1_NLCB1_PLR5_SU0_SUS0_SSO0_SVW1_TT2_16_VW1_VWB1_WG32_8_1
    SolutionIndex: 240
    SolutionNameMin: Cijk_Ailk_Bjlk_SB_MT64x64x64_MI16x16x4x1_SN_AMAS3_DTVA0_DTVB0_GLVWA4_GLVWB4_GRVW4_LPA0_LPB16_MIAV0_NLCB1_PLR17_SU0_SUS0_SSO0_SVW2_TT2_32_VW2_VWB1_WG32_8_1
    SolutionIndex: 241
    SolutionNameMin: Cijk_Ailk_Bjlk_SB_MT32x64x32_MI16x16x4x1_SN_AMAS0_DTVB1_GLVWA1_GLVWB1_LPA16_LPB0_NLCB2_PLR1_SU32_SUS256_SSO0_SVW1_VW1_WG16_8_2
    SolutionIndex: 242
    SolutionNameMin: Cijk_Ailk_Bjlk_SB_MT224x64x16_MI16x16x4x1_SN_AMAS3_DTVA0_DTVB1_GLVWA1_GLVWB1_GRVW1_LPA0_LPB0_NTB0_NTC3_NTD3_NLCA7_PLR5_SPO1_SSO0_SVW2_TT14_16_VW2_VWB1_WG16_16_1
    SolutionIndex: 243
    SolutionNameMin: Cijk_Ailk_Bjlk_SB_MT224x64x16_MI16x16x4x1_SN_AMAS3_DTVA0_DTVB0_GLVWA2_GLVWB2_GRVW2_LPA0_LPB16_NTB4_NTC3_NTD3_NLCA7_PLR5_SPO1_SSO0_SVW2_TT14_16_VW2_VWB1_WG16_16_1
    SolutionIndex: 244
    SolutionNameMin: Cijk_Ailk_Bjlk_SB_MT16x16x4_MI16x16x4x1_SN_1LDSB0_AMAS0_DTVA0_EPS1_LPA16_MIAV0_PGR1_PLR1_SU32_SUS256_SSO0_SVW1_TT1_16_VW1_WG16_4_1
    SolutionIndex: 245
    SolutionNameMin: Cijk_Ailk_Bjlk_SB_MT16x16x4_MI16x16x4x1_SN_1LDSB0_AMAS0_DTVA0_EPS1_LPA16_MIAV1_PGR2_PLR1_SU0_SUS0_SSO0_SVW1_TT1_16_VW1_WG16_4_1
    SolutionIndex: 246
    SolutionNameMin: Cijk_Ailk_Bjlk_SB_MT16x16x4_MI16x16x4x1_SN_1LDSB0_AMAS0_DTVA1_EPS1_LPA0_MIAV0_PGR2_PLR1_SU0_SUS0_SSO0_SVW1_TT1_16_VW1_WG16_4_1
    SolutionIndex: 247
    SolutionNameMin: Cijk_Ailk_Bjlk_SB_MT16x16x16_MI16x16x4x1_SN_1LDSB0_AMAS0_DTVA0_EPS1_LPA16_MIAV0_PGR2_PLR5_SU0_SUS0_SSO0_SVW1_TT1_16_VW1_WG16_4_1
    SolutionIndex: 248
    SolutionNameMin: Cijk_Ailk_Bjlk_SB_MT16x16x16_MI16x16x4x1_SN_1LDSB0_AMAS0_DTVA0_EPS1_LPA16_MIAV1_PGR1_PLR5_SU0_SUS0_SSO0_SVW1_TT1_16_VW1_WG16_4_1
    SolutionIndex: 249
    SolutionNameMin: Cijk_Ailk_Bjlk_SB_MT16x16x16_MI16x16x4x1_SN_1LDSB0_AMAS0_DTVA0_EPS1_LPA16_MIAV0_PGR1_PLR5_SU0_SUS0_SSO0_SVW1_TT1_16_VW1_WG16_4_1
    SolutionIndex: 250
    SolutionNameMin: Cijk_Ailk_Bjlk_SB_MT32x64x16_MI16x16x4x1_SN_1LDSB1_AMAS0_EPS1_GLVWA1_GLVWB1_LPA16_LPB16_PGR2_PLR5_TT1_32_VW1_VWB1_WG32_8_1_WGM16
    SolutionIndex: 251
    SolutionNameMin: Cijk_Ailk_Bjlk_SB_MT32x64x16_MI16x16x4x1_SN_1LDSB0_AMAS0_DTVB0_EPS1_GLVWA1_GLVWB1_LPA16_LPB0_NLCB1_PGR2_PLR5_TT1_32_VW1_VWB2_WG32_8_1_WGM1
    SolutionIndex: 252
    SolutionNameMin: Cijk_Ailk_Bjlk_SB_MT32x64x32_MI16x16x4x1_SN_1LDSB0_AMAS0_DTVB0_EPS1_GLVWA1_GLVWB1_LPA16_LPB16_NLCB1_PGR1_PLR9_TT1_32_VW1_VWB1_WG32_8_1_WGM16
    SolutionIndex: 253
    SolutionNameMin: Cijk_Ailk_Bjlk_SB_MT16x256x32_MI16x16x1x4_SN_1LDSB0_AMAS0_DTVB1_EPS1_GLVWA1_GLVWB1_LPA16_LPB0_NLCB1_PGR2_PLR1_TT1_16_VW1_VWB1_WG16_16_1_WGM16
    SolutionIndex: 254
    SolutionNameMin: Cijk_Ailk_Bjlk_SB_MT32x256x8_MI16x16x4x1_SN_1LDSB1_AMAS3_DTVB0_EPS1_GLVWA1_GLVWB2_LPA0_LPB0_NLCB1_PGR2_PLR1_TT2_64_VW2_VWB4_WG16_16_1_WGM16
    SolutionIndex: 255
    SolutionNameMin: Cijk_Ailk_Bjlk_SB_MT32x256x8_MI16x16x4x1_SN_1LDSB1_AMAS3_DTVB0_EPS1_GLVWA1_GLVWB2_LPA0_LPB0_NLCB1_PGR2_PLR1_TT2_64_VW2_VWB4_WG16_16_1_WGM1
    SolutionIndex: 256
    SolutionNameMin: Cijk_Ailk_Bjlk_SB_MT128x256x16_MI16x16x1x4_SN_1LDSB0_AMAS0_EPS1_GLVWA1_GLVWB1_LPA0_LPB0_PGR2_PLR1_TT4_32_VW1_VWB2_WG32_8_1_WGM1
    SolutionIndex: 257
    SolutionNameMin: Cijk_Ailk_Bjlk_SB_MT64x128x16_MI16x16x4x1_SN_1LDSB0_AMAS0_EPS0_GLVWA1_GLVWB1_LPA16_LPB0_PGR0_PLR1_TT1_128_VW1_VWB2_WG64_4_1_WGM1
    SolutionIndex: 258
    SolutionNameMin: Cijk_Ailk_Bjlk_SB_MT64x128x4_MI16x16x4x1_SN_1LDSB0_AMAS0_DTVA1_DTVB0_EPS1_GLVWA1_GLVWB1_LPA0_LPB16_NLCA1_NLCB1_PGR2_PLR1_TT1_128_VW1_VWB1_WG64_4_1_WGM1
    SolutionIndex: 259
    SolutionNameMin: Cijk_Ailk_Bjlk_SB_MT64x128x4_MI16x16x4x1_SN_1LDSB0_AMAS0_DTVA0_DTVB0_EPS1_GLVWA1_GLVWB1_LPA16_LPB16_NLCA1_NLCB1_PGR1_PLR1_TT1_128_VW1_VWB1_WG64_4_1_WGM1
    SolutionIndex: 260
    SolutionNameMin: Cijk_Ailk_Bjlk_SB_MT64x256x4_MI16x16x4x1_SN_1LDSB0_AMAS0_DTVA0_DTVB0_EPS0_GLVWA1_GLVWB1_LPA16_LPB0_NLCA1_NLCB1_PGR0_PLR1_TT2_128_VW1_VWB2_WG32_8_1_WGM1
    SolutionIndex: 261
    SolutionNameMin: Cijk_Ailk_Bjlk_SB_MT64x256x4_MI16x16x4x1_SN_1LDSB0_AMAS0_DTVA0_DTVB0_EPS0_GLVWA1_GLVWB1_LPA16_LPB0_NLCA1_NLCB1_PGR0_PLR1_TT2_128_VW1_VWB4_WG32_8_1_WGM32
    SolutionIndex: 262
    SolutionNameMin: Cijk_Ailk_Bjlk_SB_MT64x128x8_MI16x16x4x1_SN_1LDSB0_AMAS0_DTVA0_DTVB0_EPS1_GLVWA1_GLVWB1_LPA16_LPB0_NLCA1_NLCB1_PGR1_PLR1_TT4_32_VW1_VWB2_WG16_16_1_WGM1
    SolutionIndex: 263
    SolutionNameMin: Cijk_Ailk_Bjlk_SB_MT128x256x4_MI16x16x1x4_SN_1LDSB0_AMAS0_DTVA0_DTVB0_EPS1_GLVWA1_GLVWB1_LPA0_LPB0_NLCA1_NLCB1_PGR1_PLR1_TT4_32_VW1_VWB2_WG32_8_1_WGM1
    SolutionIndex: 264
    SolutionNameMin: Cijk_Ailk_Bjlk_SB_MT64x256x16_MI16x16x4x1_SN_1LDSB0_AMAS0_DTVA0_DTVB0_EPS1_GLVWA1_GLVWB1_LPA16_LPB16_NLCA1_NLCB1_PGR1_PLR5_TT2_128_VW1_VWB1_WG32_8_1_WGM1
    SolutionIndex: 265
    SolutionNameMin: Cijk_Ailk_Bjlk_SB_MT64x128x16_MI16x16x4x1_SN_1LDSB0_AMAS0_DTVA1_DTVB0_EPS1_GLVWA1_GLVWB1_LPA0_LPB0_NLCA1_NLCB1_PGR1_PLR5_TT1_128_VW1_VWB2_WG64_4_1_WGM1
    SolutionIndex: 266
    SolutionNameMin: Cijk_Ailk_Bjlk_SB_MT64x256x4_MI16x16x4x1_SN_1LDSB0_AMAS0_DTVA0_DTVB0_EPS0_GLVWA1_GLVWB1_LPA16_LPB0_NLCA1_NLCB1_PGR0_PLR1_TT2_128_VW1_VWB2_WG32_8_1_WGM32
    SolutionIndex: 267
    SolutionNameMin: Cijk_Ailk_Bjlk_SB_MT64x256x4_MI16x16x4x1_SN_1LDSB0_AMAS0_DTVA0_DTVB0_EPS0_GLVWA1_GLVWB1_LPA16_LPB0_NLCA1_NLCB1_PGR0_PLR1_TT2_128_VW1_VWB4_WG32_8_1_WGM1
    SolutionIndex: 268
    SolutionNameMin: Cijk_Ailk_Bjlk_SB_MT64x128x8_MI16x16x4x1_SN_1LDSB0_AMAS0_DTVA0_DTVB0_EPS1_GLVWA1_GLVWB1_LPA16_LPB0_NLCA1_NLCB1_PGR2_PLR1_TT4_32_VW1_VWB2_WG16_16_1_WGM1
    SolutionIndex: 269
    SolutionNameMin: Cijk_Ailk_Bjlk_SB_MT64x128x16_MI16x16x4x1_SN_1LDSB1_AMAS0_DTVA1_DTVB0_EPS1_GLVWA1_GLVWB1_LPA0_LPB16_NLCA1_NLCB1_PGR1_PLR5_TT1_128_VW1_VWB1_WG64_4_1_WGM1
    SolutionIndex: 270
    SolutionNameMin: Cijk_Ailk_Bjlk_SB_MT64x32x16_MI16x16x4x1_SN_1LDSB0_AMAS0_EPS1_GLVWA1_GLVWB1_LPA16_LPB16_NLCB1_PGR2_PLR5_TT1_32_VW1_VWB1_WG64_4_1_WGM32
    SolutionIndex: 271
    SolutionNameMin: Cijk_Ailk_Bjlk_SB_MT64x32x16_MI16x16x4x1_SN_1LDSB0_AMAS0_EPS1_GLVWA1_GLVWB1_LPA16_LPB16_NLCB1_PGR2_PLR5_TT2_16_VW1_VWB1_WG32_8_1_WGM32
    SolutionIndex: 272
    SolutionNameMin: Cijk_Ailk_Bjlk_SB_MT64x32x16_MI16x16x4x1_SN_1LDSB0_AMAS0_EPS1_GLVWA1_GLVWB1_LPA16_LPB16_NLCB1_PGR2_PLR1_TT1_32_VW1_VWB1_WG64_4_1_WGM1
    SolutionIndex: 273
    SolutionNameMin: Cijk_Ailk_Bjlk_SB_MT64x96x32_MI16x16x4x1_SN_1LDSB0_AMAS3_EPS0_GLVWA2_GLVWB2_LPA0_LPB16_NLCB3_PGR0_PLR9_TT2_48_VW2_VWB1_WG32_8_1_WGM32
    SolutionIndex: 274
    SolutionNameMin: Cijk_Ailk_Bjlk_SB_MT64x96x16_MI16x16x4x1_SN_1LDSB1_AMAS3_EPS1_GLVWA2_GLVWB2_LPA0_LPB16_NLCB3_PGR2_PLR1_TT2_48_VW2_VWB1_WG32_8_1_WGM16
    SolutionIndex: 275
    SolutionNameMin: Cijk_Ailk_Bjlk_SB_MT64x96x16_MI16x16x4x1_SN_1LDSB1_AMAS0_EPS1_GLVWA1_GLVWB1_LPA16_LPB16_NLCB3_PGR2_PLR5_TT2_48_VW1_VWB1_WG32_8_1_WGM16
    SolutionIndex: 276
    SolutionNameMin: Cijk_Ailk_Bjlk_SB_MT64x96x16_MI16x16x4x1_SN_1LDSB1_AMAS0_EPS1_GLVWA1_GLVWB1_LPA16_LPB16_NLCB3_PGR1_PLR5_TT2_48_VW1_VWB1_WG32_8_1_WGM1
    SolutionIndex: 277
    SolutionNameMin: Cijk_Ailk_Bjlk_SB_MT128x96x16_MI16x16x4x1_SN_1LDSB0_AMAS0_EPS1_GLVWA1_GLVWB1_LPA16_LPB0_NLCB3_PGR1_PLR5_TT2_96_VW1_VWB2_WG64_4_1_WGM32
    SolutionIndex: 278
    SolutionNameMin: Cijk_Ailk_Bjlk_SB_MT64x32x32_MI16x16x4x1_SN_1LDSB0_AMAS0_DTVA1_EPS1_GLVWA1_GLVWB1_LPA0_LPB16_NLCA1_NLCB1_PGR1_PLR1_TT1_32_VW1_VWB1_WG64_4_1_WGM32
    SolutionIndex: 279
    SolutionNameMin: Cijk_Ailk_Bjlk_SB_MT64x32x16_MI16x16x4x1_SN_1LDSB1_AMAS0_DTVA0_EPS1_GLVWA1_GLVWB1_LPA16_LPB0_NLCA1_NLCB1_PGR2_PLR5_TT1_32_VW1_VWB2_WG64_4_1_WGM16
    SolutionIndex: 280
    SolutionNameMin: Cijk_Ailk_Bjlk_SB_MT64x32x16_MI16x16x4x1_SN_1LDSB0_AMAS0_DTVA1_EPS1_GLVWA1_GLVWB1_LPA0_LPB0_NLCA1_NLCB1_PGR2_PLR5_TT1_32_VW1_VWB2_WG64_4_1_WGM1
    SolutionIndex: 281
    SolutionNameMin: Cijk_Ailk_Bjlk_SB_MT64x32x16_MI16x16x4x1_SN_1LDSB0_AMAS0_DTVA0_EPS1_GLVWA1_GLVWB1_LPA16_LPB16_NLCA1_NLCB1_PGR2_PLR1_TT2_16_VW1_VWB1_WG32_8_1_WGM32
    SolutionIndex: 282
    SolutionNameMin: Cijk_Ailk_Bjlk_SB_MT64x96x16_MI16x16x4x1_SN_1LDSB0_AMAS0_DTVA0_EPS1_GLVWA1_GLVWB1_LPA16_LPB16_NLCA1_NLCB3_PGR2_PLR1_TT2_48_VW1_VWB1_WG32_8_1_WGM32
    SolutionIndex: 283
    SolutionNameMin: Cijk_Ailk_Bjlk_SB_MT128x96x16_MI16x16x4x1_SN_1LDSB0_AMAS0_DTVA1_EPS1_GLVWA1_GLVWB1_LPA0_LPB16_NLCA2_NLCB3_PGR1_PLR5_TT2_96_VW1_VWB1_WG64_4_1_WGM1
    SolutionIndex: 284
    SolutionNameMin: Cijk_Ailk_Bjlk_SB_MT64x256x16_MI16x16x4x1_SN_1LDSB0_AMAS0_EPS1_GLVWA1_GLVWB1_LPA16_LPB0_PGR2_PLR5_TT4_64_VW1_VWB2_WG16_16_1_WGM32
    SolutionIndex: 285
    SolutionNameMin: Cijk_Ailk_Bjlk_SB_MT64x256x16_MI16x16x4x1_SN_1LDSB1_AMAS0_EPS1_GLVWA1_GLVWB1_LPA16_LPB16_PGR2_PLR1_TT1_256_VW1_VWB1_WG64_4_1_WGM32
    SolutionIndex: 286
    SolutionNameMin: Cijk_Ailk_Bjlk_SB_MT64x256x8_MI16x16x4x1_SN_1LDSB0_AMAS0_DTVA0_DTVB0_EPS1_GLVWA1_GLVWB1_LPA16_LPB16_NLCB1_PGR1_PLR1_TT4_64_VW1_VWB1_WG16_16_1_WGM16
    SolutionIndex: 287
    SolutionNameMin: Cijk_Ailk_Bjlk_SB_MT64x256x8_MI16x16x4x1_SN_1LDSB0_AMAS0_DTVA1_DTVB0_EPS1_GLVWA1_GLVWB1_LPA0_LPB16_NLCB1_PGR1_PLR1_TT1_256_VW1_VWB1_WG64_4_1_WGM1
    SolutionIndex: 288
    SolutionNameMin: Cijk_Ailk_Bjlk_SB_MT64x256x8_MI16x16x4x1_SN_1LDSB0_AMAS0_DTVA1_DTVB0_EPS1_GLVWA1_GLVWB1_LPA0_LPB16_NLCB1_PGR2_PLR1_TT1_256_VW1_VWB1_WG64_4_1_WGM32
    SolutionIndex: 289
    SolutionNameMin: Cijk_Ailk_Bjlk_SB_MT64x256x8_MI16x16x4x1_SN_1LDSB0_AMAS0_DTVA1_DTVB0_EPS1_GLVWA1_GLVWB1_LPA0_LPB16_NLCB1_PGR1_PLR1_TT1_256_VW1_VWB1_WG64_4_1_WGM32
    SolutionIndex: 290
    SolutionNameMin: Cijk_Ailk_Bjlk_SB_MT64x256x4_MI16x16x4x1_SN_1LDSB1_AMAS0_DTVA0_DTVB1_EPS1_GLVWA1_GLVWB1_LPA16_LPB0_NLCB4_PGR1_PLR1_TT4_64_VW1_VWB1_WG16_16_1_WGM1
    SolutionIndex: 291
    SolutionNameMin: Cijk_Ailk_Bjlk_SB_MT64x256x4_MI16x16x4x1_SN_1LDSB0_AMAS0_DTVA0_DTVB1_EPS1_GLVWA1_GLVWB1_LPA16_LPB0_NLCB4_PGR1_PLR1_TT4_64_VW1_VWB1_WG16_16_1_WGM16
    SolutionIndex: 292
    SolutionNameMin: Cijk_Ailk_Bjlk_SB_MT64x64x32_MI16x16x4x1_SN_1LDSB1_AMAS0_EPS1_GLVWA1_GLVWB1_LPA16_LPB16_PGR1_PLR9_TT2_32_VW1_VWB1_WG32_8_1_WGM1
    SolutionIndex: 293
    SolutionNameMin: Cijk_Ailk_Bjlk_SB_MT64x128x16_MI16x16x4x1_SN_1LDSB1_AMAS0_EPS1_GLVWA1_GLVWB1_LPA16_LPB0_PGR2_PLR5_TT4_32_VW1_VWB2_WG16_16_1_WGM1
    SolutionIndex: 294
    SolutionNameMin: Cijk_Ailk_Bjlk_SB_MT64x256x16_MI16x16x4x1_SN_1LDSB0_AMAS0_EPS1_GLVWA1_GLVWB1_LPA16_LPB0_PGR1_PLR1_TT4_64_VW1_VWB4_WG16_16_1_WGM1
    SolutionIndex: 295
    SolutionNameMin: Cijk_Ailk_Bjlk_SB_MT64x128x32_MI16x16x4x1_SN_1LDSB1_AMAS0_DTVA0_DTVB1_EPS1_GLVWA1_GLVWB1_LPA16_LPB0_NLCA1_NLCB2_PGR1_PLR9_TT4_32_VW1_VWB1_WG16_16_1_WGM1
    SolutionIndex: 296
    SolutionNameMin: Cijk_Ailk_Bjlk_SB_MT64x128x32_MI16x16x4x1_SN_1LDSB0_AMAS0_DTVA0_DTVB1_EPS1_GLVWA1_GLVWB1_LPA16_LPB0_NLCA1_NLCB2_PGR1_PLR1_TT4_32_VW1_VWB1_WG16_16_1_WGM1
    SolutionIndex: 297
    SolutionNameMin: Cijk_Ailk_Bjlk_SB_MT64x128x16_MI16x16x4x1_SN_1LDSB0_AMAS0_DTVA0_DTVB1_EPS1_GLVWA1_GLVWB1_LPA16_LPB0_NLCA1_NLCB2_PGR2_PLR1_TT4_32_VW1_VWB1_WG16_16_1_WGM1
    SolutionIndex: 298
    SolutionNameMin: Cijk_Ailk_Bjlk_SB_MT64x256x8_MI16x16x4x1_SN_1LDSB0_AMAS0_DTVA0_DTVB1_EPS1_GLVWA1_GLVWB1_LPA16_LPB0_NLCA1_NLCB4_PGR2_PLR3_TT4_64_VW1_VWB1_WG16_16_1_WGM1
    SolutionIndex: 299
    SolutionNameMin: Cijk_Ailk_Bjlk_SB_MT64x256x8_MI16x16x4x1_SN_1LDSB0_AMAS0_DTVA0_DTVB1_EPS1_GLVWA1_GLVWB1_LPA16_LPB0_NLCA1_NLCB4_PGR1_PLR3_TT4_64_VW1_VWB1_WG16_16_1_WGM1
    SolutionIndex: 300
    SolutionNameMin: Cijk_Ailk_Bjlk_SB_MT64x128x16_MI16x16x4x1_SN_1LDSB0_AMAS0_DTVA0_DTVB1_EPS1_GLVWA1_GLVWB1_LPA16_LPB0_NLCA1_NLCB2_PGR1_PLR5_TT4_32_VW1_VWB1_WG16_16_1_WGM1
    SolutionIndex: 301
    SolutionNameMin: Cijk_Ailk_Bjlk_SB_MT64x128x16_MI16x16x4x1_SN_1LDSB0_AMAS0_DTVA0_DTVB1_EPS1_GLVWA1_GLVWB1_LPA16_LPB0_NLCA1_NLCB2_PGR2_PLR5_TT4_32_VW1_VWB1_WG16_16_1_WGM1
    SolutionIndex: 302
    SolutionNameMin: Cijk_Ailk_Bjlk_SB_MT64x256x8_MI16x16x4x1_SN_1LDSB0_AMAS0_DTVA0_DTVB1_EPS1_GLVWA1_GLVWB1_LPA16_LPB0_NLCA1_NLCB4_PGR2_PLR1_TT4_64_VW1_VWB1_WG16_16_1_WGM1
    SolutionIndex: 303
    SolutionNameMin: Cijk_Ailk_Bjlk_SB_MT64x256x8_MI16x16x4x1_SN_1LDSB1_AMAS0_DTVA0_DTVB1_EPS1_GLVWA1_GLVWB1_LPA16_LPB0_NLCA1_NLCB4_PGR1_PLR1_TT4_64_VW1_VWB1_WG16_16_1_WGM1
    SolutionIndex: 304
    SolutionNameMin: Cijk_Ailk_Bjlk_SB_MT128x64x8_MI16x16x4x1_SN_1LDSB0_AMAS0_DTVA1_DTVB0_EPS1_GLVWA1_GLVWB1_LPA0_LPB16_NLCA2_NLCB1_PGR2_PLR1_TT2_64_VW1_VWB1_WG64_4_1_WGM1
    SolutionIndex: 305
    SolutionNameMin: Cijk_Ailk_Bjlk_SB_MT64x64x16_MI16x16x4x1_SN_1LDSB0_AMAS3_DTVA0_DTVB0_EPS1_GLVWA1_GLVWB1_LPA0_LPB16_NLCA1_NLCB1_PGR2_PLR5_SU4_SUS256_SVW2_TT4_16_VW2_VWB1_WG16_16_1
    SolutionIndex: 306
    SolutionNameMin: Cijk_Ailk_Bjlk_SB_MT64x64x16_MI16x16x4x1_SN_1LDSB0_AMAS0_DTVA0_DTVB0_EPS1_GLVWA1_GLVWB1_LPA16_LPB16_NLCA1_NLCB1_PGR1_PLR5_SU0_SUS0_SVW1_TT2_32_VW1_VWB1_WG32_8_1
    SolutionIndex: 307
    SolutionNameMin: Cijk_Ailk_Bjlk_SB_MT64x64x16_MI16x16x4x1_SN_1LDSB0_AMAS0_DTVA0_GLVWA1_GLVWB4_LPA16_LPB0_NLCA1_PGR1_SU32_SUS256_SVW1_TT1_64_VW1_VWB2_WG64_4_1_WGM16
    SolutionIndex: 308
    SolutionNameMin: Cijk_Ailk_Bjlk_SB_MT128x64x8_MI16x16x4x1_SN_1LDSB0_AMAS0_DTVA0_GLVWA1_GLVWB1_LPA16_LPB16_NLCA1_PGR1_SU0_SUS0_SVW1_TT4_32_VW1_VWB1_WG32_8_1_WGM8
    SolutionIndex: 309
    SolutionNameMin: Cijk_Ailk_Bjlk_SB_MT128x64x8_MI16x16x4x1_SN_1LDSB0_AMAS0_DTVA0_GLVWA1_GLVWB1_LPA16_LPB16_NLCA1_PGR2_SU0_SUS0_SVW1_TT2_64_VW1_VWB1_WG64_4_1_WGM32
    SolutionIndex: 310
    SolutionNameMin: Cijk_Ailk_Bjlk_SB_MT128x64x16_MI16x16x4x1_SN_1LDSB0_AMAS3_DTVA0_GLVWA1_GLVWB1_LPA0_LPB0_NLCA1_PGR1_SU0_SUS0_SVW4_TT4_32_VW4_VWB2_WG32_8_1_WGM1
    SolutionIndex: 311
    SolutionNameMin: Cijk_Ailk_Bjlk_SB_MT128x64x16_MI16x16x4x1_SN_1LDSB1_AMAS0_DTVA0_GLVWA1_GLVWB1_LPA16_LPB0_NLCA1_PGR1_SU0_SUS0_SVW1_TT2_64_VW1_VWB2_WG64_4_1_WGM8
    SolutionIndex: 312
    SolutionNameMin: Cijk_Ailk_Bjlk_SB_MT64x32x32_MI16x16x4x1_SN_AMAS3_DTVA1_DTVB0_GLVWA2_GLVWB1_LPA0_LPB0_NLCA1_NLCB1_PLR5_SU4_SUS256_SVW2_TT2_32_VW2_VWB2_WG32_4_2_WGM1
    SolutionIndex: 313
    SolutionNameMin: Cijk_Ailk_Bjlk_SB_MT128x32x32_MI16x16x4x1_SN_AMAS3_DTVA1_DTVB0_GLVWA4_GLVWB1_LPA0_LPB0_NLCA2_NLCB1_PLR3_SU0_SUS0_SVW4_TT8_32_VW4_VWB2_WG16_4_4_WGM8
    SolutionIndex: 314
    SolutionNameMin: Cijk_Ailk_Bjlk_SB_MT64x32x64_MI16x16x4x1_SN_1LDSB0_BS0_ELFLR6_LPB16_NTC2_NTD2_NEPBS16_SU0_SUS0_SSO0_TLDSn1_VWB1_WGMn24
    SolutionIndex: 315
    SolutionNameMin: Cijk_Ailk_Bjlk_SB_MT64x32x64_MI16x16x4x1_SN_1LDSB0_BS1_ELFLR2_LPB16_NTC3_NTD3_NEPBS16_SU32_SUS256_SSO0_TLDS0_VWB1_WGM2
    SolutionIndex: 316
    SolutionNameMin: Cijk_Ailk_Bjlk_SB_MT64x32x64_MI16x16x4x1_SN_1LDSB1_BS1_ELFLR6_LPB16_NTC2_NTD2_NEPBS16_SU32_SUS256_SSO4_TLDSn1_VWB1_WGM2
    SolutionIndex: 317
    SolutionNameMin: Cijk_Ailk_Bjlk_SB_MT64x32x64_MI16x16x4x1_SN_1LDSB1_BS1_ELFLR2_LPB0_NTC2_NTD2_NEPBS16_SU32_SUS256_SSO0_TLDS0_VWB2_WGM2
    SolutionIndex: 318
    SolutionNameMin: Cijk_Ailk_Bjlk_SB_MT64x32x4_MI16x16x4x1_SN_DTVA1_FL2_LPA0_LPB0_NTC3_NTD3_PLR1_TT1_32_VWB2_WGMn20
    SolutionIndex: 319
    SolutionNameMin: Cijk_Ailk_Bjlk_SB_MT64x32x16_MI16x16x4x1_SN_DTVA0_FL1_LPA16_LPB0_NTC0_NTD0_PLR5_TT1_32_VWB2_WGMn15
    SolutionIndex: 320
    SolutionNameMin: Cijk_Ailk_Bjlk_SB_MT64x32x16_MI16x16x4x1_SN_DTVA0_FL2_LPA16_LPB4_NTC2_NTD2_PLR5_TT1_32_VWB2_WGMn15
    SolutionIndex: 321
    SolutionNameMin: Cijk_Ailk_Bjlk_SB_MT64x32x32_MI16x16x4x1_SN_DTVA0_FL0_LPA16_LPB0_NTC2_NTD2_PLR9_TT1_32_VWB2_WGMn10
    SolutionIndex: 322
    SolutionNameMin: Cijk_Ailk_Bjlk_SB_MT64x32x32_MI16x16x4x1_SN_DTVA0_FL2_LPA8_LPB8_NTC3_NTD3_PLR9_TT1_32_VWB2_WGMn20
    SolutionIndex: 323
    SolutionNameMin: Cijk_Ailk_Bjlk_SB_MT64x64x32_MI16x16x4x1_SN_AMAS0_DTVA0_DTVB1_FL0_GLVWA1_GLVWB1_GSU1_GSUASB_LPA16_LPB0_MIAV0_NLCA2_NLCB1_PLR9_SVW1_TT4_16_VW1_VWB1_WG16_16_1
    SolutionIndex: 324
    SolutionNameMin: Cijk_Ailk_Bjlk_SB_MT128x32x16_MI16x16x4x1_SN_AMAS3_DTVA1_DTVB0_FL0_GLVWA2_GLVWB1_GSU1_GSUASB_LPA0_LPB16_MIAV0_NLCA1_NLCB2_PLR5_SVW2_TT2_32_VW2_VWB1_WG64_4_1
    SolutionIndex: 325
    SolutionNameMin: Cijk_Ailk_Bjlk_SB_MT128x32x32_MI16x16x4x1_SN_AMAS0_DTVA1_DTVB0_FL0_GLVWA1_GLVWB4_GSU1_GSUASB_LPA0_LPB16_MIAV1_NLCA2_NLCB1_PLR1_SVW1_TT2_32_VW1_VWB1_WG64_4_1
    SolutionIndex: 326
    SolutionNameMin: Cijk_Ailk_Bjlk_SB_MT128x32x16_MI16x16x4x1_SN_AMAS3_DTVA1_DTVB0_FL1_GLVWA2_GLVWB1_GSU1_GSUASB_LPA0_LPB16_MIAV0_NLCA1_NLCB1_PLR5_SVW2_TT2_32_VW2_VWB1_WG64_4_1
    SolutionIndex: 327
    SolutionNameMin: Cijk_Ailk_Bjlk_SB_MT64x64x32_MI16x16x4x1_SN_AMAS3_DTVA0_DTVB0_FL0_GLVWA2_GLVWB4_GSU1_GSUASB_LPA0_LPB16_MIAV0_NLCA2_NLCB1_PLR9_SVW2_TT2_32_VW2_VWB1_WG32_8_1
    SolutionIndex: 328
    SolutionNameMin: Cijk_Ailk_Bjlk_SB_MT64x64x32_MI16x16x4x1_SN_AMAS3_DTVA0_DTVB0_FL0_GLVWA2_GLVWB4_GSU1_GSUASB_LPA0_LPB16_MIAV1_NLCA1_NLCB1_PLR9_SVW2_TT2_32_VW2_VWB1_WG32_8_1
    SolutionIndex: 329
    SolutionNameMin: Cijk_Ailk_Bjlk_SB_MT128x128x16_MI16x16x4x1_SN_AMAS0_DTVA0_DTVB1_FL0_GLVWA1_GLVWB1_GSU4_GSUAMB_LPA16_LPB0_MIAV0_NLCA1_NLCB2_PLR5_SVW1_TT8_32_VW1_VWB1_WG16_16_1
    SolutionIndex: 330
    SolutionNameMin: Cijk_Ailk_Bjlk_SB_MT128x128x16_MI16x16x4x1_SN_AMAS0_DTVA0_FL2_GLVWA4_GLVWB4_GSU1_GSUASB_LPA16_LPB0_NLCA1_NLCB1_PLR1_SU32_SUS256_SVW1_TT2_128_VW1_VWB2_WG64_4_1
    SolutionIndex: 331
    SolutionNameMin: Cijk_Ailk_Bjlk_SB_MT128x128x16_MI16x16x4x1_SN_AMAS3_DTVA0_FL1_GLVWA1_GLVWB1_GSU1_GSUASB_LPA0_LPB16_NLCA1_NLCB1_PLR1_SU32_SUS256_SVW4_TT4_64_VW4_VWB1_WG32_8_1
    SolutionIndex: 332
    SolutionNameMin: Cijk_Ailk_Bjlk_SB_MT128x128x16_MI16x16x4x1_SN_AMAS3_DTVA0_FL1_GLVWA2_GLVWB4_GSU1_GSUASB_LPA0_LPB0_NLCA1_NLCB1_PLR1_SU0_SUS0_SVW4_TT4_64_VW4_VWB2_WG32_8_1
    SolutionIndex: 333
    SolutionNameMin: Cijk_Ailk_Bjlk_SB_MT128x128x16_MI16x16x4x1_SN_AMAS3_DTVA0_FL1_GLVWA2_GLVWB4_GSU1_GSUASB_LPA0_LPB16_NLCA1_NLCB1_PLR1_SU4_SUS256_SVW4_TT4_64_VW4_VWB1_WG32_8_1
    SolutionIndex: 334
    SolutionNameMin: Cijk_Ailk_Bjlk_SB_MT128x128x16_MI16x16x4x1_SN_AMAS0_DTVA1_FL0_GLVWA1_GLVWB4_GSU1_GSUASB_LPA0_LPB0_NLCA2_NLCB1_PLR1_SU0_SUS0_SVW1_TT2_128_VW1_VWB4_WG64_4_1
    SolutionIndex: 335
    SolutionNameMin: Cijk_Ailk_Bjlk_SB_MT128x112x16_MI16x16x4x1_SN_AMAS0_DTVA1_FL0_GLVWA1_GLVWB1_GSU1_GSUASB_LPA0_LPB16_NLCA2_NLCB7_PLR5_SU32_SUS256_SVW1_TT2_112_VW1_VWB1_WG64_4_1
    SolutionIndex: 336
    SolutionNameMin: Cijk_Ailk_Bjlk_SB_MT128x112x32_MI16x16x4x1_SN_AMAS0_DTVA0_FL0_GLVWA2_GLVWB2_GSU1_GSUASB_LPA16_LPB16_NLCA1_NLCB7_PLR9_SU0_SUS0_SVW1_TT2_112_VW1_VWB1_WG64_4_1
    SolutionIndex: 337
    SolutionNameMin: Cijk_Ailk_Bjlk_SB_MT128x112x32_MI16x16x4x1_SN_AMAS3_DTVA1_FL0_GLVWA2_GLVWB1_GSU1_GSUASB_LPA0_LPB16_NLCA1_NLCB7_PLR9_SU32_SUS256_SVW2_TT2_112_VW2_VWB1_WG64_4_1
    SolutionIndex: 338
    SolutionNameMin: Cijk_Ailk_Bjlk_SB_MT128x112x16_MI16x16x4x1_SN_AMAS0_DTVA1_FL1_GLVWA1_GLVWB4_GSU1_GSUASB_LPA0_LPB16_NLCA2_NLCB1_PLR1_SU2_SUS256_SVW1_TT2_112_VW1_VWB1_WG64_4_1
    SolutionIndex: 339
    SolutionNameMin: Cijk_Ailk_Bjlk_SB_MT128x112x32_MI16x16x4x1_SN_AMAS3_DTVA1_FL1_GLVWA2_GLVWB4_GSU1_GSUASB_LPA0_LPB16_NLCA1_NLCB1_PLR9_SU0_SUS0_SVW2_TT2_112_VW2_VWB1_WG64_4_1
    SolutionIndex: 340
    SolutionNameMin: Cijk_Ailk_Bjlk_SB_MT256x224x32_MI16x16x4x1_SN_AMAS3_DTVA0_FL1_GLVWA4_GLVWB4_GSU4_GSUAMB_LPA0_LPB16_NLCA1_NLCB1_PLR1_SU2_SUS256_SVW2_TT8_112_VW2_VWB1_WG32_8_1
    SolutionIndex: 341
    SolutionNameMin: Cijk_Ailk_Bjlk_SB_MT32x48x32_MI16x16x4x1_SN_1LDSB0_AMAS0_GLVWA1_GLVWB1_LPA16_LPB16_NLCB3_TT1_48_VW1_VWB1_WG32_4_2_WGM1
    SolutionIndex: 342
    SolutionNameMin: Cijk_Ailk_Bjlk_SB_MT32x64x32_MI16x16x4x1_SN_1LDSB0_AMAS0_GLVWA1_GLVWB1_LPA16_LPB0_NLCB1_TT1_32_VW1_VWB2_WG32_8_1_WGM1
    SolutionIndex: 343
    SolutionNameMin: Cijk_Ailk_Bjlk_SB_MT32x32x16_MI16x16x4x1_SN_1LDSB0_AMAS0_GLVWA1_GLVWB1_LPA16_LPB16_NLCB1_TT1_16_VW1_VWB1_WG32_8_1_WGM16
    SolutionIndex: 344
    SolutionNameMin: Cijk_Ailk_Bjlk_SB_MT32x256x16_MI16x16x1x4_SN_1LDSB0_AMAS0_GLVWA1_GLVWB1_LPA16_LPB0_NLCB1_TT2_16_VW1_VWB1_WG16_16_1_WGM1
    SolutionIndex: 345
    SolutionNameMin: Cijk_Ailk_Bjlk_SB_MT32x256x16_MI16x16x1x4_SN_1LDSB1_AMAS0_DTVB0_EPS1_GLVWA1_GLVWB1_GRVW1_LPA16_LPB0_NLCB1_PGR1_PLR17_TT2_16_VW1_VWB1_WG16_16_1_WGM1
    SolutionIndex: 346
    SolutionNameMin: Cijk_Ailk_Bjlk_SB_MT32x256x8_MI16x16x4x1_SN_1LDSB1_AMAS3_GLVWA1_GLVWB4_GRVW4_LPA0_LPB0_NLCB1_TT2_64_VW2_VWB4_WG16_16_1_WGM1
    SolutionIndex: 347
    SolutionNameMin: Cijk_Ailk_Bjlk_SB_MT16x256x16_MI16x16x4x1_SN_1LDSB1_AMAS0_GLVWA1_GLVWB1_GRVW1_LPA16_LPB16_NLCB1_TT1_128_VW1_VWB1_WG16_8_2_WGM16
    SolutionIndex: 348
    SolutionNameMin: Cijk_Ailk_Bjlk_SB_MT32x192x16_MI16x16x4x1_SN_1LDSB1_AMAS0_GLVWA1_GLVWB1_GRVW1_LPA16_LPB16_NLCB3_TT2_48_VW1_VWB1_WG16_16_1_WGM1
    SolutionIndex: 349
    SolutionNameMin: Cijk_Ailk_Bjlk_SB_MT32x32x16_MI16x16x4x1_SN_1LDSB0_DTVB0_EPS1_GLVWA1_GLVWB1_GRVW1_LPB16_NTB1_NLCB1_PGR2_PLR5_TT1_16_VWB1_WG32_8_1_WGM32
    SolutionIndex: 350
    SolutionNameMin: Cijk_Ailk_Bjlk_SB_MT32x256x16_MI16x16x4x1_SN_1LDSB1_DTVB1_EPS1_GLVWA2_GLVWB4_GRVW4_LPB0_NTB1_NLCB1_PGR2_PLR5_TT2_64_VWB4_WG16_16_1_WGM1
    SolutionIndex: 351
    SolutionNameMin: Cijk_Ailk_Bjlk_SB_MT16x256x16_MI16x16x4x1_SN_1LDSB0_AMAS0_GLVWA1_GLVWB1_LPA16_LPB16_NLCB1_TT1_64_VW1_VWB1_WG16_16_1_WGM32
    SolutionIndex: 352
    SolutionNameMin: Cijk_Ailk_Bjlk_SB_MT16x256x16_MI16x16x1x4_SN_1LDSB0_AMAS0_DTVB0_EPS1_GLVWA1_GLVWB4_GRVW4_LPA16_LPB0_NLCB1_PGR2_PLR1_TT1_16_TLDSn1_VW1_WGM16
    SolutionIndex: 353
    SolutionNameMin: Cijk_Ailk_Bjlk_SB_MT32x256x8_MI16x16x4x1_SN_1LDSB1_AMAS3_EPS1_GLVWA1_GLVWB4_GRVW4_LPA0_LPB0_PGR2_PLR1_TT2_64_VW2_VWB2_WG16_16_1_WGM16
    SolutionIndex: 354
    SolutionNameMin: Cijk_Ailk_Bjlk_SB_MT16x256x16_MI16x16x1x4_SN_1LDSB0_AMAS0_GLVWA1_GLVWB1_LPA16_LPB0_NLCB1_TT1_16_VW1_VWB1_WG16_16_1_WGM16
    SolutionIndex: 355
    SolutionNameMin: Cijk_Ailk_Bjlk_SB_MT32x256x16_MI16x16x1x4_SN_1LDSB0_AMAS0_GLVWA1_GLVWB1_LPA0_LPB16_NLCB1_TT1_32_VW1_VWB1_WG32_8_1_WGM1
    SolutionIndex: 356
    SolutionNameMin: Cijk_Ailk_Bjlk_SB_MT32x256x16_MI16x16x4x1_SN_1LDSB0_AMAS0_GLVWA1_GLVWB1_LPA16_LPB0_NLCB1_TT2_64_VW1_VWB2_WG16_16_1_WGM16
    SolutionIndex: 357
    SolutionNameMin: Cijk_Ailk_Bjlk_SB_MT16x256x16_MI16x16x4x1_SN_1LDSB0_AMAS0_DTVB1_EPS1_GLVWA1_GLVWB1_GRVW1_LPA16_LPB0_NTB1_NLCB4_PGR2_PLR5_TT1_64_VW1_VWB1_WG16_16_1_WGM32
    SolutionIndex: 358
    SolutionNameMin: Cijk_Ailk_Bjlk_SB_MT32x32x16_MI16x16x4x1_SN_EPS1_PGR2_PLR1_WGM1
    SolutionIndex: 359
    SolutionNameMin: Cijk_Ailk_Bjlk_SB_MT48x64x64_MI4x4x1x16_SN_1LDSB0_AMAS0_GLVWA1_GLVWB1_LPA0_LPB4_NLCA3_NLCB1_TT3_4_VW1_VWB1_WG16_16_1_WGM32
    SolutionIndex: 360
    SolutionNameMin: Cijk_Ailk_Bjlk_SB_MT48x128x64_MI16x16x4x1_SN_1LDSB1_AMAS0_GLVWA1_GLVWB1_LPA16_LPB16_NLCA3_NLCB1_TT3_32_VW1_VWB1_WG16_16_1_WGM32
    SolutionIndex: 361
    SolutionNameMin: Cijk_Ailk_Bjlk_SB_MT48x192x16_MI16x16x4x1_SN_1LDSB1_AMAS0_GLVWA1_GLVWB1_LPA16_LPB16_NLCA3_NLCB3_TT3_48_VW1_VWB1_WG16_16_1_WGM1
    SolutionIndex: 362
    SolutionNameMin: Cijk_Ailk_Bjlk_SB_MT48x64x64_MI16x16x4x1_SN_1LDSB0_AMAS0_GLVWA1_GLVWB1_LPA0_LPB16_NLCA3_NLCB1_TT3_16_VW1_VWB1_WG16_16_1_WGM1
    SolutionIndex: 363
    SolutionNameMin: Cijk_Ailk_Bjlk_SB_MT48x128x64_MI16x16x4x1_SN_1LDSB1_AMAS0_GLVWA1_GLVWB1_LPA16_LPB16_NLCA3_NLCB1_TT3_32_VW1_VWB1_WG16_16_1_WGM1
    SolutionIndex: 364
    SolutionNameMin: Cijk_Ailk_Bjlk_SB_MT48x128x32_MI16x16x4x1_SN_1LDSB1_AMAS0_GLVWA1_GLVWB1_LPA16_LPB16_NLCA3_NLCB1_TT3_32_VW1_VWB1_WG16_16_1_WGM32
    SolutionIndex: 365
    SolutionNameMin: Cijk_Ailk_Bjlk_SB_MT48x128x32_MI16x16x4x1_SN_1LDSB1_AMAS0_GLVWA1_GLVWB1_LPA16_LPB16_NLCA3_NLCB1_TT3_32_VW1_VWB1_WG16_16_1_WGM1
    SolutionIndex: 366
    SolutionNameMin: Cijk_Ailk_Bjlk_SB_MT48x256x16_MI16x16x4x1_SN_1LDSB1_AMAS0_GLVWA1_GLVWB1_LPA16_LPB0_NLCA3_NLCB1_TT3_64_VW1_VWB2_WG16_16_1_WGM32
    SolutionIndex: 367
    SolutionNameMin: Cijk_Ailk_Bjlk_SB_MT48x128x32_MI16x16x4x1_SN_1LDSB1_LPA16_LPB16_NLCA3_NLCB1_TT3_32_WG16_16_1_WGM16
    SolutionIndex: 368
    SolutionNameMin: Cijk_Ailk_Bjlk_SB_MT48x64x16_MI16x16x4x1_SN_1LDSB1_DTVB0_EPS1_LPA16_LPB16_NLCB1_PGR2_PLR1_TT3_16_VWB1_WGM1
- - - [6144, 5120, 1, 4096]
    - [0, 91.069]
  - - [6144, 4864, 1, 4096]
    - [1, 96.736]
  - - [8192, 8192, 1, 4096]
    - [0, 97.203]
  - - [6144, 4864, 1, 512]
    - [2, 92.343]
  - - [4864, 3072, 1, 4096]
    - [54, 97.31]
  - - [7296, 4608, 1, 4096]
    - [3, 97.451]
  - - [9728, 6144, 1, 4096]
    - [4, 98.68]
  - - [16384, 16384, 1, 4096]
    - [5, 98.854]
  - - [19456, 18432, 1, 512]
    - [6, 96.538]
  - - [4094, 4094, 1, 2046]
    - [7, 93.42]
  - - [4096, 4096, 1, 2048]
    - [8, 96.302]
  - - [1031, 1031, 1, 1031]
    - [13, 44.749]
  - - [2047, 2047, 1, 2047]
    - [14, 73.901]
  - - [4095, 4095, 1, 2047]
    - [9, 88.534]
  - - [1030, 1030, 1, 1030]
    - [10, 47.756]
  - - [1032, 1032, 1, 1032]
    - [10, 48.137]
  - - [2046, 2046, 1, 2046]
    - [11, 81.609]
  - - [2048, 2048, 1, 2048]
    - [12, 86.102]
  - - [64, 1, 1000, 64]
    - [15, 0.539]
  - - [1, 64, 1000, 64]
    - [16, 0.514]
  - - [31, 31, 1000, 31]
    - [17, 4.092]
  - - [33, 33, 1000, 33]
    - [18, 3.992]
  - - [47, 47, 1000, 47]
    - [18, 8.873]
  - - [49, 49, 1000, 49]
    - [19, 9.353]
  - - [63, 63, 128, 63]
    - [18, 5.627]
  - - [65, 65, 128, 65]
    - [20, 4.309]
  - - [79, 79, 128, 79]
    - [21, 7.061]
  - - [81, 81, 128, 81]
    - [22, 7.515]
  - - [95, 95, 64, 95]
    - [23, 7.587]
  - - [97, 97, 64, 97]
    - [23, 8.15]
  - - [127, 127, 64, 127]
    - [22, 15.25]
  - - [129, 129, 64, 129]
    - [19, 12.199]
  - - [255, 255, 16, 255]
    - [18, 23.867]
  - - [257, 257, 16, 257]
    - [24, 22.925]
  - - [511, 511, 16, 511]
    - [19, 63.19]
  - - [513, 513, 16, 513]
    - [18, 56.251]
  - - [30, 30, 1000, 30]
    - [25, 4.552]
  - - [32, 32, 1000, 32]
    - [26, 5.745]
  - - [34, 34, 1000, 34]
    - [27, 4.633]
  - - [46, 46, 1000, 46]
    - [28, 8.731]
  - - [48, 48, 1000, 48]
    - [29, 11.342]
  - - [50, 50, 1000, 50]
    - [30, 10.147]
  - - [62, 62, 128, 62]
    - [31, 6.196]
  - - [64, 64, 128, 64]
    - [32, 6.682]
  - - [66, 66, 128, 66]
    - [33, 4.603]
  - - [78, 78, 128, 78]
    - [34, 7.066]
  - - [80, 80, 128, 80]
    - [35, 8.402]
  - - [82, 82, 128, 82]
    - [36, 8.225]
  - - [94, 94, 64, 94]
    - [37, 7.589]
  - - [96, 96, 64, 96]
    - [38, 9.52]
  - - [98, 98, 64, 98]
    - [36, 8.367]
  - - [126, 126, 64, 126]
    - [36, 16.144]
  - - [128, 128, 64, 128]
    - [39, 18.56]
  - - [130, 130, 64, 130]
    - [29, 12.631]
  - - [254, 254, 16, 254]
    - [40, 24.632]
  - - [256, 256, 16, 256]
    - [41, 28.044]
  - - [258, 258, 16, 258]
    - [42, 23.419]
  - - [510, 510, 16, 510]
    - [43, 64.02]
  - - [512, 512, 16, 512]
    - [44, 70.252]
  - - [514, 514, 16, 514]
    - [31, 57.555]
  - - [4864, 768, 1, 4096]
    - [45, 95.29]
  - - [4864, 768, 1, 8192]
    - [46, 98.22]
  - - [2432, 1536, 1, 4096]
    - [47, 95.74]
  - - [2432, 1536, 1, 8192]
    - [48, 97.44]
  - - [1536, 2432, 1, 4096]
    - [49, 96.33]
  - - [1536, 2432, 1, 8192]
    - [50, 97.44]
  - - [768, 4864, 1, 4096]
    - [51, 96.06]
  - - [768, 4864, 1, 8192]
    - [52, 97.52]
  - - [4864, 3072, 1, 2048]
    - [53, 95.08]
  - - [4864, 3072, 1, 6144]
    - [55, 98.33]
  - - [4864, 3072, 1, 8192]
    - [56, 98.6]
  - - [3072, 4864, 1, 2048]
    - [57, 94.75]
  - - [3072, 4864, 1, 4096]
    - [58, 98.09]
  - - [3072, 4864, 1, 6144]
    - [59, 97.96]
  - - [3072, 4864, 1, 8192]
    - [60, 98.48]
  - - [128, 2432, 1, 512]
    - [61, 26.55]
  - - [128, 2432, 1, 1024]
    - [62, 30.09]
  - - [512, 608, 1, 512]
    - [63, 29.02]
  - - [512, 608, 1, 1024]
    - [64, 30.13]
  - - [608, 512, 1, 512]
    - [65, 29.18]
  - - [608, 512, 1, 1024]
    - [66, 41.89]
  - - [608, 1024, 1, 512]
    - [67, 40.54]
  - - [608, 1024, 1, 1024]
    - [68, 46.03]
  - - [1216, 256, 1, 512]
    - [69, 27.85]
  - - [256, 4864, 1, 1024]
    - [70, 66.57]
  - - [256, 4864, 1, 2048]
    - [71, 80.36]
  - - [1216, 1024, 1, 1024]
    - [72, 66.87]
  - - [1216, 1024, 1, 2048]
    - [73, 81.22]
  - - [1216, 4096, 1, 4096]
    - [74, 86.25]
  - - [2432, 512, 1, 1024]
    - [75, 72.61]
  - - [9728, 512, 1, 512]
    - [76, 67.81]
  - - [9728, 512, 1, 1024]
    - [77, 79.55]
  - - [19456, 256, 1, 512]
    - [78, 67.98]
  - - [19456, 256, 1, 1024]
    - [79, 80.01]
  - - [2432, 2048, 1, 1024]
    - [80, 78.02]
  - - [2432, 2048, 1, 2048]
    - [81, 83.59]
  - - [2048, 2432, 1, 1024]
    - [82, 73.38]
  - - [2048, 2432, 1, 2048]
    - [83, 84.48]
  - - [4864, 1024, 1, 1024]
    - [84, 73.83]
  - - [4864, 1024, 1, 2048]
    - [85, 87.77]
  - - [64, 4864, 1, 512]
    - [86, 27.641]
  - - [64, 9728, 1, 1024]
    - [87, 59.727]
  - - [256, 256, 1, 1024]
    - [66, 41.89]
  - - [512, 512, 1, 1024]
    - [140, 37.392]
  - - [1024, 64, 1, 256]
    - [69, 27.85]
  - - [1024, 128, 1, 256]
    - [69, 27.85]
  - - [256, 256, 1, 512]
    - [88, 5.998]
  - - [512, 512, 1, 512]
    - [89, 21.74]
  - - [192, 192, 1, 8704]
    - [90, 12.476]
  - - [192, 192, 1, 12288]
    - [91, 21.283]
  - - [192, 192, 1, 16384]
    - [92, 30.173]
  - - [192, 192, 1, 20480]
    - [93, 37.58]
  - - [192, 192, 1, 32768]
    - [94, 42.936]
  - - [192, 192, 1, 36864]
    - [95, 43.158]
  - - [192, 192, 1, 40960]
    - [96, 49.885]
  - - [192, 576, 1, 8704]
    - [97, 40.738]
  - - [192, 576, 1, 12288]
    - [98, 44.546]
  - - [192, 576, 1, 16384]
    - [99, 54.814]
  - - [192, 576, 1, 20480]
    - [99, 59.496]
  - - [192, 576, 1, 32768]
    - [100, 58.842]
  - - [192, 576, 1, 36864]
    - [101, 60.093]
  - - [192, 576, 1, 40960]
    - [102, 70.527]
  - - [192, 768, 1, 8704]
    - [103, 37.413]
  - - [192, 768, 1, 12288]
    - [104, 55.745]
  - - [192, 768, 1, 16384]
    - [105, 62.629]
  - - [192, 768, 1, 20480]
    - [106, 56.99]
  - - [192, 768, 1, 32768]
    - [107, 73.516]
  - - [192, 768, 1, 36864]
    - [108, 75.05]
  - - [192, 768, 1, 40960]
    - [109, 75.986]
  - - [384, 96, 1, 34816]
    - [110, 32.51]
  - - [384, 96, 1, 49152]
    - [111, 40.539]
  - - [384, 96, 1, 65536]
    - [112, 46.734]
  - - [384, 96, 1, 98304]
    - [113, 56.231]
  - - [384, 96, 1, 131072]
    - [114, 60.658]
  - - [384, 96, 1, 147456]
    - [115, 68.905]
  - - [384, 384, 1, 2176]
    - [116, 24.652]
  - - [384, 384, 1, 3072]
    - [117, 30.508]
  - - [384, 384, 1, 4096]
    - [118, 39.53]
  - - [384, 384, 1, 6144]
    - [119, 50.104]
  - - [384, 384, 1, 8192]
    - [120, 57.664]
  - - [384, 384, 1, 10240]
    - [116, 63.822]
  - - [384, 1152, 1, 2176]
    - [121, 35.223]
  - - [384, 1152, 1, 3072]
    - [122, 41.13]
  - - [384, 1152, 1, 4096]
    - [123, 45.234]
  - - [384, 1152, 1, 6144]
    - [124, 54.311]
  - - [384, 1152, 1, 8192]
    - [125, 61.162]
  - - [384, 1152, 1, 10240]
    - [126, 60.119]
  - - [384, 1536, 1, 3072]
    - [127, 43.526]
  - - [384, 1536, 1, 4096]
    - [128, 44.071]
  - - [384, 1536, 1, 6144]
    - [129, 63.513]
  - - [384, 1536, 1, 8192]
    - [130, 59.813]
  - - [384, 1536, 1, 10240]
    - [131, 67.061]
  - - [384, 1536, 1, 2176]
    - [132, 50.606]
  - - [512, 512, 1, 960]
    - [133, 37.879]
  - - [512, 2048, 1, 960]
    - [134, 52.478]
  - - [512, 1024, 1, 146880]
    - [135, 90.952]
  - - [512, 1024, 1, 185588]
    - [136, 91.043]
  - - [512, 1024, 1, 224296]
    - [137, 91.618]
  - - [512, 1024, 1, 263004]
    - [138, 91.687]
  - - [512, 1024, 1, 301712]
    - [139, 92.11]
  - - [512, 512, 1, 1280]
    - [141, 39.752]
  - - [512, 512, 1, 1536]
    - [142, 37.808]
  - - [512, 512, 1, 1792]
    - [143, 37.129]
  - - [512, 1024, 1, 2048]
    - [144, 58.075]
  - - [512, 2048, 1, 1024]
    - [145, 53.667]
  - - [512, 2048, 1, 1280]
    - [146, 57.452]
  - - [512, 2048, 1, 1536]
    - [147, 58.932]
  - - [512, 2048, 1, 1792]
    - [148, 60.705]
  - - [512, 1024, 1, 48]
    - [31, 5.888]
  - - [1536, 1024, 1, 512]
    - [149, 44.331]
  - - [1792, 1024, 1, 512]
    - [150, 49.166]
  - - [1536, 384, 1, 2048]
    - [151, 61.593]
  - - [1536, 384, 1, 6144]
    - [152, 80.293]
  - - [1536, 384, 1, 8192]
    - [153, 84.336]
  - - [1536, 1024, 1, 2048]
    - [153, 70.097]
  - - [1792, 1024, 1, 2048]
    - [154, 81.53]
  - - [1536, 384, 1, 4096]
    - [155, 76.471]
  - - [1536, 384, 1, 3072]
    - [156, 73.067]
  - - [1536, 384, 1, 9216]
    - [157, 83.829]
  - - [3072, 768, 1, 53760]
    - [175, 90.783]
  - - [4096, 512, 1, 1024]
    - [158, 55.041]
  - - [5120, 512, 1, 256]
    - [159, 28.301]
  - - [3072, 768, 1, 1536]
    - [160, 64.322]
  - - [3072, 768, 1, 2048]
    - [161, 68.082]
  - - [3072, 768, 1, 768]
    - [162, 58.648]
  - - [5152, 512, 1, 1024]
    - [163, 66.212]
  - - [8400, 512, 1, 1024]
    - [164, 58.412]
  - - [2048, 4096, 1, 2448]
    - [165, 73.83]
  - - [2048, 4096, 1, 2816]
    - [166, 74.535]
  - - [3072, 768, 1, 3072]
    - [167, 81.715]
  - - [3072, 768, 1, 4096]
    - [168, 84.546]
  - - [3072, 768, 1, 8192]
    - [169, 87.81]
  - - [5120, 512, 1, 1024]
    - [170, 67.701]
  - - [6144, 512, 1, 1024]
    - [171, 71.39]
  - - [8400, 512, 1, 256]
    - [172, 51.28]
  - - [4096, 512, 1, 256]
    - [173, 36.968]
  - - [5152, 512, 1, 256]
    - [174, 27.54]
  - - [3072, 768, 1, 1024]
    - [75, 79.279]
  - - [8192, 512, 1, 1024]
    - [77, 67.538]
  - - [8192, 512, 1, 256]
    - [76, 46.071]
  - - [3072, 768, 1, 256]
    - [75, 44.376]
  - - [3072, 768, 1, 512]
    - [75, 67.516]
  - - [6144, 512, 1, 256]
    - [84, 35.421]
  - - [96, 96, 1, 34816]
    - [176, 22.3]
  - - [96, 96, 1, 49152]
    - [177, 27.6]
  - - [96, 96, 1, 65536]
    - [178, 26.4]
  - - [96, 96, 1, 98304]
    - [179, 35.3]
  - - [96, 96, 1, 131072]
    - [180, 44.2]
  - - [96, 96, 1, 147456]
    - [181, 49.7]
  - - [96, 288, 1, 34816]
    - [182, 39.7]
  - - [96, 288, 1, 49152]
    - [183, 52.5]
  - - [96, 288, 1, 65536]
    - [184, 60.3]
  - - [96, 288, 1, 98304]
    - [185, 59.3]
  - - [96, 288, 1, 131072]
    - [186, 72.2]
  - - [96, 288, 1, 147456]
    - [187, 55.4]
  - - [96, 384, 1, 34816]
    - [188, 48.8]
  - - [96, 384, 1, 49152]
    - [189, 55.0]
  - - [96, 384, 1, 65536]
    - [185, 71.2]
  - - [96, 384, 1, 98304]
    - [190, 78.9]
  - - [96, 384, 1, 131072]
    - [191, 72.2]
  - - [96, 384, 1, 147456]
    - [192, 72.7]
  - - [512, 8, 304, 1]
    - [193, 0.177]
  - - [768, 8, 304, 1]
    - [194, 0.202]
  - - [1024, 8, 304, 1]
    - [195, 0.216]
  - - [2048, 8, 304, 1]
    - [196, 0.331]
  - - [3072, 8, 304, 1]
    - [197, 0.368]
  - - [1024, 32, 24, 32]
    - [198, 4.692]
  - - [2048, 32, 24, 32]
    - [199, 7.512]
  - - [3072, 32, 24, 32]
    - [200, 10.179]
  - - [768, 32, 48, 32]
    - [201, 5.712]
  - - [1024, 32, 48, 32]
    - [202, 7.646]
  - - [768, 256, 2, 3]
    - [203, 0.232]
  - - [1024, 256, 2, 3]
    - [203, 0.308]
  - - [2048, 256, 2, 3]
    - [203, 0.627]
  - - [3072, 256, 2, 3]
    - [204, 0.805]
  - - [768, 256, 2, 12]
    - [205, 0.925]
  - - [1024, 256, 2, 12]
    - [206, 1.243]
  - - [2048, 256, 2, 12]
    - [207, 2.491]
  - - [3072, 256, 2, 12]
    - [208, 3.09]
  - - [1536, 256, 2, 1024]
    - [209, 44.793]
  - - [2048, 256, 2, 1024]
    - [210, 56.659]
  - - [3072, 256, 2, 1024]
    - [295, 51.224]
  - - [1024, 304, 2, 256]
    - [211, 20.585]
  - - [2048, 304, 2, 256]
    - [212, 27.831]
  - - [3072, 304, 2, 256]
    - [213, 39.339]
  - - [768, 512, 2, 2048]
    - [214, 52.146]
  - - [1024, 512, 2, 2048]
    - [215, 66.928]
  - - [768, 768, 2, 256]
    - [211, 34.862]
  - - [1024, 768, 2, 256]
    - [216, 32.829]
  - - [1536, 1024, 2, 256]
    - [217, 44.17]
  - - [3128, 1024, 2, 256]
    - [218, 50.14]
  - - [768, 2048, 2, 256]
    - [219, 46.665]
  - - [1024, 2048, 2, 256]
    - [220, 52.623]
  - - [768, 2048, 2, 512]
    - [221, 63.144]
  - - [1024, 2048, 2, 512]
    - [222, 61.779]
  - - [64, 64, 48, 512]
    - [223, 14.169]
  - - [64, 64, 48, 768]
    - [224, 18.744]
  - - [64, 64, 48, 1024]
    - [224, 21.693]
  - - [64, 128, 152, 128]
    - [225, 18.46]
  - - [64, 128, 304, 128]
    - [226, 30.648]
  - - [64, 224, 12, 224]
    - [227, 6.567]
  - - [64, 512, 128, 512]
    - [228, 67.498]
  - - [128, 64, 96, 128]
    - [229, 13.223]
  - - [128, 64, 304, 128]
    - [230, 28.918]
  - - [192, 288, 12, 128]
    - [231, 14.348]
  - - [192, 384, 32, 192]
    - [232, 30.809]
  - - [192, 1760, 32, 128]
    - [233, 48.527]
  - - [192, 2000, 32, 192]
    - [234, 65.166]
  - - [256, 8, 768, 1]
    - [235, 0.216]
  - - [256, 32, 48, 32]
    - [236, 2.033]
  - - [224, 64, 12, 224]
    - [237, 6.244]
  - - [224, 64, 20, 224]
    - [238, 11.213]
  - - [224, 64, 48, 224]
    - [239, 19.651]
  - - [224, 64, 64, 224]
    - [240, 21.216]
  - - [224, 64, 80, 224]
    - [241, 29.948]
  - - [224, 64, 192, 224]
    - [242, 35.157]
  - - [224, 64, 256, 224]
    - [243, 45.187]
  - - [128, 256, 2, 3]
    - [244, 0.039]
  - - [192, 256, 2, 3]
    - [245, 0.059]
  - - [256, 256, 2, 3]
    - [246, 0.078]
  - - [128, 256, 2, 12]
    - [247, 0.157]
  - - [192, 256, 2, 12]
    - [248, 0.236]
  - - [256, 256, 2, 12]
    - [249, 0.313]
  - - [32, 17408, 1, 32]
    - [250, 4.255]
  - - [32, 16384, 1, 32]
    - [251, 4.163]
  - - [32, 19456, 1, 32]
    - [252, 4.496]
  - - [32, 38912, 1, 32]
    - [253, 6.947]
  - - [32, 75776, 1, 32]
    - [254, 8.429]
  - - [32, 77824, 1, 32]
    - [255, 8.714]
  - - [32768, 256, 1, 3]
    - [256, 1.456]
  - - [24576, 256, 1, 12]
    - [257, 6.053]
  - - [24576, 256, 1, 3]
    - [258, 1.534]
  - - [40960, 256, 1, 3]
    - [259, 1.773]
  - - [49152, 256, 1, 3]
    - [260, 2.018]
  - - [57344, 256, 1, 3]
    - [261, 2.336]
  - - [65536, 256, 1, 3]
    - [262, 2.132]
  - - [73728, 256, 1, 3]
    - [263, 2.103]
  - - [32768, 256, 1, 12]
    - [264, 6.113]
  - - [40960, 256, 1, 12]
    - [265, 6.922]
  - - [49152, 256, 1, 12]
    - [266, 7.471]
  - - [57344, 256, 1, 12]
    - [267, 8.648]
  - - [65536, 256, 1, 12]
    - [268, 8.988]
  - - [73728, 256, 1, 12]
    - [269, 8.722]
  - - [49152, 32, 1, 32]
    - [270, 8.717]
  - - [57344, 32, 1, 32]
    - [271, 10.233]
  - - [65536, 32, 1, 32]
    - [272, 8.636]
  - - [24576, 96, 1, 256]
    - [273, 34.223]
  - - [40960, 96, 1, 256]
    - [274, 43.85]
  - - [49152, 96, 1, 256]
    - [275, 52.949]
  - - [57344, 96, 1, 256]
    - [276, 58.741]
  - - [73728, 96, 1, 256]
    - [277, 58.897]
  - - [24576, 32, 1, 32]
    - [278, 5.603]
  - - [32768, 32, 1, 32]
    - [279, 6.106]
  - - [40960, 32, 1, 32]
    - [280, 7.389]
  - - [73728, 32, 1, 32]
    - [281, 11.205]
  - - [32768, 96, 1, 256]
    - [282, 48.383]
  - - [65536, 96, 1, 256]
    - [283, 51.836]
  - - [6144, 256, 2, 12]
    - [284, 4.754]
  - - [12288, 256, 2, 12]
    - [285, 5.743]
  - - [4096, 256, 2, 3]
    - [286, 0.9]
  - - [6144, 256, 2, 3]
    - [287, 1.254]
  - - [8192, 256, 2, 3]
    - [288, 1.505]
  - - [12288, 256, 2, 3]
    - [289, 1.488]
  - - [16384, 256, 2, 3]
    - [290, 1.764]
  - - [4096, 256, 2, 12]
    - [287, 3.452]
  - - [8192, 256, 2, 12]
    - [289, 5.737]
  - - [16384, 256, 2, 12]
    - [291, 6.84]
  - - [4096, 384, 2, 256]
    - [292, 45.564]
  - - [3072, 1024, 2, 256]
    - [293, 54.395]
  - - [4096, 1024, 2, 256]
    - [294, 52.43]
  - - [4096, 256, 2, 1024]
    - [296, 66.3]
  - - [6144, 512, 2, 128]
    - [297, 41.728]
  - - [8192, 512, 2, 128]
    - [298, 41.891]
  - - [12288, 512, 2, 128]
    - [299, 41.914]
  - - [16384, 512, 2, 128]
    - [300, 49.357]
  - - [6144, 512, 2, 256]
    - [301, 53.94]
  - - [8192, 512, 2, 256]
    - [302, 53.132]
  - - [12288, 512, 2, 256]
    - [303, 53.09]
  - - [16384, 512, 2, 256]
    - [304, 71.328]
  - - [3072, 384, 2, 256]
    - [214, 46.717]
  - - [256, 768, 1, 256]
    - [312, 4.55]
  - - [768, 768, 1, 256]
    - [313, 10.512]
  - - [128, 128, 1, 16]
    - [305, 0.069]
  - - [128, 256, 1, 16]
    - [306, 0.098]
  - - [256, 256, 1, 16]
    - [307, 0.21]
  - - [256, 256, 1, 3]
    - [308, 0.037]
  - - [768, 256, 1, 3]
    - [309, 0.095]
  - - [256, 256, 1, 12]
    - [310, 0.155]
  - - [768, 256, 1, 12]
    - [311, 0.36]
  - - [1024, 512, 1, 2048]
    - [314, 84.0]
  - - [1024, 512, 1, 2448]
    - [315, 56.3]
  - - [1024, 512, 1, 2720]
    - [316, 67.3]
  - - [1024, 512, 1, 2864]
    - [317, 64.5]
  - - [1024, 1024, 1, 4]
    - [318, 0.9]
  - - [1024, 1024, 1, 8]
    - [319, 1.6]
  - - [1024, 1024, 1, 16]
    - [320, 3.3]
  - - [1024, 1024, 1, 32]
    - [321, 6.6]
  - - [1024, 1024, 1, 64]
    - [322, 12.4]
  - - [1024, 1024, 1, 128]
    - [323, 18.7]
  - - [1024, 1024, 1, 256]
    - [324, 31.3]
  - - [1024, 1024, 1, 512]
    - [325, 40.5]
  - - [1024, 1024, 1, 1024]
    - [326, 50.7]
  - - [1024, 1024, 1, 2048]
    - [73, 81.22]
  - - [1024, 1024, 1, 4096]
    - [327, 72.6]
  - - [1024, 1024, 1, 8192]
    - [328, 76.0]
  - - [1024, 1024, 1, 16384]
    - [329, 75.3]
  - - [1024, 4096, 1, 16]
    - [330, 4.9]
  - - [1024, 4096, 1, 32]
    - [331, 8.5]
  - - [1024, 4096, 1, 64]
    - [332, 14.8]
  - - [1024, 4096, 1, 128]
    - [333, 25.5]
  - - [1024, 4096, 1, 256]
    - [334, 39.2]
  - - [1024, 4096, 1, 512]
    - [335, 56.1]
  - - [1024, 4096, 1, 1024]
    - [336, 69.3]
  - - [1024, 4096, 1, 2048]
    - [337, 77.4]
  - - [1024, 4096, 1, 4096]
    - [338, 81.8]
  - - [1024, 4096, 1, 8192]
    - [339, 85.8]
  - - [1024, 4096, 1, 16384]
    - [340, 87.0]
  - - [32, 48, 304, 48]
    - [341, 4.446]
  - - [32, 256, 48, 32]
    - [342, 2.58]
  - - [32, 512, 48, 32]
    - [343, 4.974]
  - - [32, 768, 48, 32]
    - [344, 5.615]
  - - [32, 1024, 48, 32]
    - [345, 6.606]
  - - [32, 3072, 24, 32]
    - [346, 5.814]
  - - [32, 4096, 24, 32]
    - [347, 6.114]
  - - [32, 4736, 24, 32]
    - [348, 6.584]
  - - [32, 1024, 24, 32]
    - [349, 5.317]
  - - [32, 2048, 24, 32]
    - [350, 4.965]
  - - [32, 8192, 12, 32]
    - [351, 2.03]
  - - [32, 6144, 12, 32]
    - [352, 2.229]
  - - [32, 4352, 12, 32]
    - [353, 5.296]
  - - [32, 38912, 2, 32]
    - [354, 2.295]
  - - [32, 17408, 2, 32]
    - [355, 3.59]
  - - [32, 19456, 2, 32]
    - [356, 3.958]
  - - [32, 16384, 2, 32]
    - [357, 1.361]
  - - [48, 32, 304, 48]
    - [358, 4.655]
  - - [48, 512, 32, 128]
    - [359, 13.677]
  - - [48, 768, 32, 128]
    - [360, 19.043]
  - - [48, 1024, 32, 128]
    - [361, 18.297]
  - - [48, 512, 32, 192]
    - [362, 20.124]
  - - [48, 768, 32, 192]
    - [363, 23.036]
  - - [48, 1024, 32, 192]
    - [362, 13.996]
  - - [48, 1536, 32, 192]
    - [364, 15.148]
  - - [48, 1792, 32, 192]
    - [365, 14.617]
  - - [48, 2048, 32, 192]
    - [366, 14.755]
  - - [48, 1536, 32, 128]
    - [367, 20.064]
  - - [48, 1792, 32, 128]
    - [368, 22.995]
- null
