library/src/blas3/Tensile/Logic/asm_full/aquavanjaram942X/aquavanjaram942_Cijk_Ailk_Bjlk_BBS_BH.yaml
- {MinimumRequiredVersion: 4.36.0}
- aquavanjaram942
- {Architecture: gfx942, IsAPU: 0}
- [Device 74a1]
    SolutionIndex: 0
    SolutionNameMin: Cijk_Ailk_Bjlk_BBS_BH_MT128x128x32_MI16x16x16x1_SN_AMAS3_CLR1_GLVWA8_GLVWB4_LBSPPA0_LPA0_MIAV0_PLR3_SU0_SUS0_SSO0_SVW4_TT8_32_VW4_VFLRP1_WSGRA0_WG16_16_1_WGM40
    SolutionIndex: 1
    SolutionNameMin: Cijk_Ailk_Bjlk_BBS_BH_MT128x128x32_MI16x16x16x1_SN_AMAS3_CLR1_GLVWA2_GLVWB8_LBSPPA0_LPA0_MIAV1_PLR3_SU0_SUS0_SSO0_SVW4_TT4_64_VW4_VFLRP1_WSGRA0_WG32_8_1_WGM40
    SolutionIndex: 2
    SolutionNameMin: Cijk_Ailk_Bjlk_BBS_BH_MT128x128x32_MI16x16x16x1_SN_AMAS3_CLR1_GLVWA8_GLVWB2_LBSPPA0_LPA0_MIAV0_PLR3_SU16_SUS512_SSO4_SVW4_TT8_32_VW4_VFLRP1_WSGRA0_WG16_16_1_WGM1
    SolutionIndex: 3
    SolutionNameMin: Cijk_Ailk_Bjlk_BBS_BH_MT128x128x32_MI16x16x16x1_SN_AMAS3_CLR1_GLVWA8_GLVWB8_LBSPPA1024_LPA32_MIAV1_PLR3_SU0_SUS0_SSO4_SVW2_TT4_64_VW2_VFLRP1_WSGRA0_WG32_8_1_WGM1
    SolutionIndex: 4
    SolutionNameMin: Cijk_Ailk_Bjlk_BBS_BH_MT128x128x32_MI16x16x16x1_SN_AMAS0_CLR0_GLVWA8_GLVWB8_LBSPPA1024_LPA16_MIAV1_PLR3_SU0_SUS0_SSO0_SVW1_TT4_64_VW1_VFLRP0_WSGRA0_WG32_8_1_WGM1
    SolutionIndex: 5
    SolutionNameMin: Cijk_Ailk_Bjlk_BBS_BH_MT128x128x32_MI16x16x16x1_SN_AMAS0_GLVWA8_GLVWB8_LPA16_NTC0_NTD3_PLR3_SU0_SUS0_SSO0_SVW1_TT4_64_VW1_WSGRA0_WG32_8_1_WGM1
    SolutionIndex: 6
    SolutionNameMin: Cijk_Ailk_Bjlk_BBS_BH_MT32x32x64_MI16x16x16x1_SN_1LDSB0_AMAS3_CLR1_ELFLR0_GLVWA2_GLVWB2_GRVW2_GLS1_LBSPPA256_LPA32_LPB16_MIAV1_PLR3_SS1_SU0_SUS0_SVW2_TT2_16_VW2_VFLRP1_WG16_8_2_WGM16
    SolutionIndex: 7
    SolutionNameMin: Cijk_Ailk_Bjlk_BBS_BH_MT32x32x64_MI16x16x16x1_SN_1LDSB0_AMAS3_CLR1_ELFLR4_GLVWA8_GLVWB8_GRVW8_GLS0_LBSPPA256_LPA32_LPB16_MIAV1_PLR3_SS1_SU8_SUS128_SVW2_TT2_16_VW2_VFLRP1_WG16_8_2_WGM32
    SolutionIndex: 8
    SolutionNameMin: Cijk_Ailk_Bjlk_BBS_BH_MT32x32x64_MI16x16x16x1_SN_1LDSB0_AMAS0_ELFLR4_GLVWA2_GLVWB2_GRVW2_GLS1_LBSPPA256_LBSPPB256_LPA16_LPB16_MIAV1_PLR5_SU0_SUS0_SVW1_TT1_16_VW1_WG32_8_1_WGM32
    SolutionIndex: 9
    SolutionNameMin: Cijk_Ailk_Bjlk_BBS_BH_MT32x32x64_MI16x16x16x1_SN_1LDSB0_AMAS0_ELFLR0_GLVWA8_GLVWB8_GRVW8_GLS0_LBSPPA256_LBSPPB256_LPA16_LPB16_MIAV0_PLR5_SU0_SUS0_SVW1_TT1_16_VW1_WG32_8_1_WGM16
    SolutionIndex: 10
    SolutionNameMin: Cijk_Ailk_Bjlk_BBS_BH_MT32x32x64_MI16x16x16x1_SN_1LDSB0_AMAS0_ELFLR0_GLVWA2_GLVWB2_GRVW2_GLS0_LBSPPA256_LBSPPB256_LPA16_LPB16_MIAV0_PLR5_SU8_SUS128_SVW1_TT1_16_VW1_WG32_8_1_WGM1
    SolutionIndex: 11
    SolutionNameMin: Cijk_Ailk_Bjlk_BBS_BH_MT32x32x64_MI16x16x16x1_SN_1LDSB0_AMAS0_ELFLR0_GLVWA8_GLVWB8_GRVW8_GLS1_LBSPPA256_LBSPPB256_LPA16_LPB16_MIAV1_PLR5_SU8_SUS128_SVW1_TT1_16_VW1_WG32_8_1_WGM32
    SolutionIndex: 12
    SolutionNameMin: Cijk_Ailk_Bjlk_BBS_BH_MT64x64x64_MI32x32x8x1_SN_AMAS3_CLR1_ELFLR0_GLVWA8_GLVWB8_GRVW8_GLS1_MIAV0_PLR5_SS1_SU0_SUS0_SVW2_VW2_VFLRP1_WGM32
    SolutionIndex: 13
    SolutionNameMin: Cijk_Ailk_Bjlk_BBS_BH_MT64x64x64_MI32x32x8x1_SN_AMAS3_CLR1_ELFLR0_GLVWA8_GLVWB8_GRVW8_GLS0_MIAV0_PLR5_SS1_SU0_SUS0_SVW2_VW2_VFLRP1_WGM16
    SolutionIndex: 14
    SolutionNameMin: Cijk_Ailk_Bjlk_BBS_BH_MT32x32x64_MI16x16x16x1_SN_CLR1_ELFLR0_GLVWA2_GLVWB2_GRVW2_GLS1_LBSPPA256_LBSPPB256_LPA16_LPB32_MIAV0_PLR3_SS1_SU0_SUS0_SVW1_TT1_32_VWB2_VFLRP1_WG32_4_2_WGM1
    SolutionIndex: 15
    SolutionNameMin: Cijk_Ailk_Bjlk_BBS_BH_MT32x32x64_MI32x32x8x1_SN_CLR0_ELFLR0_GLVWA2_GLVWB2_GRVW2_GLS1_LBSPPA0_LBSPPB0_LPA0_LPB0_MIAV1_PLR1_SS1_SU8_SUS128_SVW1_TT1_32_VWB1_VFLRP1_WG32_2_4_WGM16
    SolutionIndex: 16
    SolutionNameMin: Cijk_Ailk_Bjlk_BBS_BH_MT32x32x64_MI32x32x8x1_SN_CLR1_ELFLR0_GLVWA8_GLVWB8_GRVW8_GLS0_LBSPPA0_LBSPPB0_LPA0_LPB0_MIAV0_PLR3_SS1_SU8_SUS128_SVW1_TT1_32_VWB1_VFLRP1_WG32_2_4_WGM16
    SolutionIndex: 17
    SolutionNameMin: Cijk_Ailk_Bjlk_BBS_BH_MT64x64x64_MI16x16x16x1_SN_AMAS3_CLR1_ELFLR0_GLVWA8_GLVWB8_GRVW8_GLS0_LBSPPA0_LBSPPB512_LPA0_LPB16_MIAV0_PLR5_SS1_SU0_SUS0_SVW4_TT4_16_VW4_VWB1_VFLRP1_WG16_16_1_WGM32
    SolutionIndex: 18
    SolutionNameMin: Cijk_Ailk_Bjlk_BBS_BH_MT64x64x64_MI16x16x16x1_SN_AMAS3_CLR1_ELFLR0_GLVWA8_GLVWB8_GRVW8_GLS0_LBSPPA0_LBSPPB512_LPA0_LPB16_MIAV0_PLR5_SS1_SU8_SUS128_SVW4_TT4_16_VW4_VWB1_VFLRP1_WG16_16_1_WGM1
    SolutionIndex: 19
    SolutionNameMin: Cijk_Ailk_Bjlk_BBS_BH_MT64x64x64_MI32x32x8x1_SN_AMAS3_CLR1_ELFLR0_GLVWA8_GLVWB8_GRVW8_GLS0_LBSPPA0_LBSPPB0_LPA0_LPB0_MIAV1_PLR1_SS1_SU8_SUS128_SVW2_TT2_32_VW2_VWB1_VFLRP1_WG32_4_2_WGM16
    SolutionIndex: 20
    SolutionNameMin: Cijk_Ailk_Bjlk_BBS_BH_MT64x64x64_MI32x32x8x1_SN_AMAS3_CLR1_ELFLR4_GLVWA8_GLVWB8_GRVW8_GLS0_LBSPPA0_LBSPPB0_LPA0_LPB0_MIAV1_PLR5_SS1_SU0_SUS0_SVW2_TT2_32_VW2_VWB1_VFLRP1_WG32_4_2_WGM32
    SolutionIndex: 21
    SolutionNameMin: Cijk_Ailk_Bjlk_BBS_BH_MT128x128x32_MI16x16x16x1_SN_CLR1_ELFLR4_GLVWA8_GLVWB8_GRVW8_GLS0_LBSPPA0_LBSPPB1024_LPA0_LPB32_MIAV0_SS1_SU8_SUS128_SVW4_VW4_VWB2_VFLRP1
    SolutionIndex: 22
    SolutionNameMin: Cijk_Ailk_Bjlk_BBS_BH_MT128x128x32_MI16x16x16x1_SN_CLR1_ELFLR4_GLVWA8_GLVWB8_GRVW8_GLS1_LBSPPA1024_LBSPPB0_LPA32_LPB0_MIAV1_SS0_SU8_SUS128_SVW4_VW2_VWB4_VFLRP1
    SolutionIndex: 23
    SolutionNameMin: Cijk_Ailk_Bjlk_BBS_BH_MT32x32x64_MI16x16x16x1_SN_1LDSB0_CLR1_ELFLR0_GLVWA2_GLVWB2_GRVW2_GLS0_LPB32_MIAV0_PLR1_SU8_SUS128_TT1_32_VWB2_VFLRP1_WG32_4_2_WGM32
    SolutionIndex: 24
    SolutionNameMin: Cijk_Ailk_Bjlk_BBS_BH_MT32x32x64_MI16x16x16x1_SN_1LDSB0_CLR1_ELFLR4_GLVWA2_GLVWB2_GRVW2_GLS1_LPB32_MIAV1_PLR1_SU0_SUS0_TT1_32_VWB2_VFLRP1_WG32_4_2_WGM16
    SolutionIndex: 25
    SolutionNameMin: Cijk_Ailk_Bjlk_BBS_BH_MT256x256x64_MI16x16x16x1_SN_1LDSB1_DTVA0_ELFLR0_GRPM1_NLCB1_PGR2_PLR5_TT8_128_WSGRA1_WG32_8_1_WGM1
    SolutionIndex: 26
    SolutionNameMin: Cijk_Ailk_Bjlk_BBS_BH_MT256x256x64_MI16x16x16x1_SN_ELFLR4_NLCB2_WGM16
    SolutionIndex: 27
    SolutionNameMin: Cijk_Ailk_Bjlk_BBS_BH_MT256x256x64_MI16x16x16x1_SN_ELFLR12_NLCB1_WGM1
    SolutionIndex: 28
    SolutionNameMin: Cijk_Ailk_Bjlk_BBS_BH_MT256x256x64_MI16x16x16x1_SN_ELFLR12_NLCB1_WGM32
    SolutionIndex: 29
    SolutionNameMin: Cijk_Ailk_Bjlk_BBS_BH_MT256x256x64_MI16x16x16x1_SN_ELFLR8_NLCB2_WGM32
    SolutionIndex: 30
    SolutionNameMin: Cijk_Ailk_Bjlk_BBS_BH_MT256x256x64_MI16x16x16x1_SN_ELFLR4_NLCB2_WGM32
    SolutionIndex: 31
    SolutionNameMin: Cijk_Ailk_Bjlk_BBS_BH_MT256x256x64_MI16x16x16x1_SN_ELFLR12_NLCB2_WGM32
    SolutionIndex: 32
    SolutionNameMin: Cijk_Ailk_Bjlk_BBS_BH_MT256x256x64_MI16x16x16x1_SN_ELFLR8_NLCB1_WGM32
    SolutionIndex: 33
    SolutionNameMin: Cijk_Ailk_Bjlk_BBS_BH_MT256x256x64_MI16x16x16x1_SN_ELFLR4_NLCB1_WGM1
    SolutionIndex: 34
    SolutionNameMin: Cijk_Ailk_Bjlk_BBS_BH_MT256x128x32_MI16x16x16x1_SN_1LDSB0_DTVA1_ELFLRn20_GRPM0p30_NLCB1_PGR1_PLR1_TT4_128_WSGRA0_WG64_4_1_WGM1
    SolutionIndex: 35
    SolutionNameMin: Cijk_Ailk_Bjlk_BBS_BH_MT256x128x32_MI16x16x16x1_SN_1LDSB1_DTVA1_ELFLRn20_GRPM0p24_NLCB1_PGR1_PLR1_TT4_128_WSGRA0_WG64_4_1_WGM1
    SolutionIndex: 36
    SolutionNameMin: Cijk_Ailk_Bjlk_BBS_BH_MT256x128x32_MI16x16x16x1_SN_1LDSB0_DTVA1_ELFLRn20_GRPM0p24_NLCB1_PGR1_PLR3_TT4_128_WSGRA0_WG64_4_1_WGM1
    SolutionIndex: 37
    SolutionNameMin: Cijk_Ailk_Bjlk_BBS_BH_MT256x128x32_MI16x16x16x1_SN_1LDSB1_DTVA1_ELFLRn20_GRPM0p30_NLCB2_PGR1_PLR1_TT4_128_WSGRA0_WG64_4_1_WGM1
    SolutionIndex: 38
    SolutionNameMin: Cijk_Ailk_Bjlk_BBS_BH_MT256x128x32_MI16x16x16x1_SN_1LDSB0_DTVA1_ELFLRn20_GRPM0p26_NLCB1_PGR1_PLR1_TT4_128_WSGRA0_WG64_4_1_WGM1
    SolutionIndex: 39
    SolutionNameMin: Cijk_Ailk_Bjlk_BBS_BH_MT256x128x32_MI16x16x16x1_SN_1LDSB0_DTVA1_ELFLRn20_GRPM0p24_NLCB1_PGR1_PLR1_TT4_128_WSGRA0_WG64_4_1_WGM1
    SolutionIndex: 40
    SolutionNameMin: Cijk_Ailk_Bjlk_BBS_BH_MT256x256x64_MI16x16x16x1_SN_ELFLR12_NLCB2_TT8_128_WGM16
    SolutionIndex: 41
    SolutionNameMin: Cijk_Ailk_Bjlk_BBS_BH_MT256x256x64_MI16x16x16x1_SN_ELFLR12_NLCB2_TT8_128_WGM32
    SolutionIndex: 42
    SolutionNameMin: Cijk_Ailk_Bjlk_BBS_BH_MT256x256x64_MI16x16x16x1_SN_ELFLR0_NLCB1_TT8_128_WGM16
    SolutionIndex: 43
    SolutionNameMin: Cijk_Ailk_Bjlk_BBS_BH_MT256x256x64_MI16x16x16x1_SN_ELFLR4_NLCB2_TT8_128_WGM32
    SolutionIndex: 44
    SolutionNameMin: Cijk_Ailk_Bjlk_BBS_BH_MT256x256x64_MI16x16x16x1_SN_ELFLR4_NLCB1_TT8_128_WGM16
    SolutionIndex: 45
    SolutionNameMin: Cijk_Ailk_Bjlk_BBS_BH_MT256x128x32_MI16x16x16x1_SN_1LDSB0_DTVA1_ELFLRn20_GRPM0p24_NLCB1_PGR1_PLR3_TT4_128_WSGRA0_WG64_4_1_WGM16
    SolutionIndex: 46
    SolutionNameMin: Cijk_Ailk_Bjlk_BBS_BH_MT256x256x64_MI16x16x16x1_SN_ELFLR12_NLCB1_TT8_128_WGM32
    SolutionIndex: 47
    SolutionNameMin: Cijk_Ailk_Bjlk_BBS_BH_MT256x128x32_MI16x16x16x1_SN_1LDSB0_DTVA1_ELFLRn20_GRPM0p26_NLCB1_PGR1_PLR3_TT4_128_WSGRA0_WG64_4_1_WGMn16
    SolutionIndex: 48
    SolutionNameMin: Cijk_Ailk_Bjlk_BBS_BH_MT256x256x64_MI16x16x16x1_SN_ELFLR0_NLCB2_TT8_128_WGMn32
    SolutionIndex: 49
    SolutionNameMin: Cijk_Ailk_Bjlk_BBS_BH_MT256x256x64_MI16x16x16x1_SN_ELFLR12_NLCB1_TT8_128_WGMn32
    SolutionIndex: 50
    SolutionNameMin: Cijk_Ailk_Bjlk_BBS_BH_MT256x256x64_MI16x16x16x1_SN_ELFLR12_NLCB2_TT8_128_WGMn16
    SolutionIndex: 51
    SolutionNameMin: Cijk_Ailk_Bjlk_BBS_BH_MT256x256x64_MI16x16x16x1_SN_ELFLR8_NLCB2_TT8_128_WGM32
    SolutionIndex: 52
    SolutionNameMin: Cijk_Ailk_Bjlk_BBS_BH_MT256x256x64_MI16x16x16x1_SN_ELFLR0_NLCB2_TT8_128_WGM32
    SolutionIndex: 53
    SolutionNameMin: Cijk_Ailk_Bjlk_BBS_BH_MT256x256x64_MI16x16x16x1_SN_ELFLR0_NLCB1_TT8_128_WGM1
    SolutionIndex: 54
    SolutionNameMin: Cijk_Ailk_Bjlk_BBS_BH_MT16x128x32_MI16x16x16x1_SN_1LDSB0_DTVB1_GLVWB2_GSU5_GSUAMB_LBSPPB0_LPB0_NLCB1_PGR2_PLR1_TT1_32_VWB2_WG16_16_1
    SolutionIndex: 55
    SolutionNameMin: Cijk_Ailk_Bjlk_BBS_BH_MT16x128x32_MI16x16x16x1_SN_1LDSB0_DTVB1_GLVWB2_GSU10_LBSPPB0_LPB0_NLCB1_PGR2_PLR1_TT1_32_VWB2_WG16_16_1
    SolutionIndex: 56
    SolutionNameMin: Cijk_Ailk_Bjlk_BBS_BH_MT16x64x64_MI16x16x16x1_SN_GSU15_LBSPPB512_LPB16_PLR5_SS0_SU0_SUS0_SVW4_TT1_16_VWB1_WG16_16_1
    SolutionIndex: 57
    SolutionNameMin: Cijk_Ailk_Bjlk_BBS_BH_MT128x128x64_MI16x16x16x1_SN_1LDSB0_DTVA1_EPS1_ELFLR8_GLVWA2_GLVWB8_GRPM0p50_NTC0_NTD0_NLCB2_PGR1_PLR5_SVW2_TT2_128_VW2_VWB4_WG64_4_1_WGMn16
    SolutionIndex: 58
    SolutionNameMin: Cijk_Ailk_Bjlk_BBS_BH_MT128x128x64_MI16x16x16x1_SN_1LDSB0_DTVA1_EPS1_ELFLR8_GLVWA2_GLVWB8_GRPM0p50_NTC0_NTD0_NLCB1_PGR1_PLR5_SVW2_TT2_128_VW2_VWB4_WG64_4_1_WGM1
    SolutionIndex: 59
    SolutionNameMin: Cijk_Ailk_Bjlk_BBS_BH_MT64x32x64_MI32x32x8x1_SN_CLR1_SU0_SUS0_SSO0_VFLRP1_WGM1
    SolutionIndex: 60
    SolutionNameMin: Cijk_Ailk_Bjlk_BBS_BH_MT64x32x64_MI32x32x8x1_SN_CLR0_SU0_SUS0_SSO4_VFLRP1_WGM1
    SolutionIndex: 61
    SolutionNameMin: Cijk_Ailk_Bjlk_BBS_BH_MT64x64x64_MI16x16x16x1_SN_AMAS3_CLR1_ELFLR4_GLS0_LBSPPB512_LPA32_LPB32_MIAV0_PLR5_SU0_SUS0_SSO0_SVW2_TT2_32_VW2_VWB2_VFLRP1_WG32_8_1_WGM32
    SolutionIndex: 62
    SolutionNameMin: Cijk_Ailk_Bjlk_BBS_BH_MT64x64x64_MI16x16x16x1_SN_AMAS3_GSU8_LBSPPA512_LBSPPB0_LPA32_LPB32_SU16_SUS128_SVW2_TT2_32_VW2_VWB1_WG32_8_1_WGM1
    SolutionIndex: 63
    SolutionNameMin: Cijk_Ailk_Bjlk_BBS_BH_MT128x128x64_MI32x32x8x1_SN_AMAS3_GSU4_LBSPPA0_LBSPPB0_LPA0_LPB0_SU0_SUS0_SVW2_TT2_64_VW2_VWB2_WG64_4_1_WGM1
    SolutionIndex: 64
    SolutionNameMin: Cijk_Ailk_Bjlk_BBS_BH_MT128x128x64_MI32x32x8x1_SN_AMAS3_GSU4_LBSPPA0_LBSPPB0_LPA0_LPB0_SU0_SUS0_SVW1_TT2_64_VW2_VWB2_WG64_4_1_WGM1
    SolutionIndex: 65
    SolutionNameMin: Cijk_Ailk_Bjlk_BBS_BH_MT128x64x64_MI32x32x8x1_SN_1LDSB1_AMAS3_CLR1_EPS1_ELFLR0_PGR2_SU0_SUS0_SSO0_VW2_VWB2_VFLRP1_WG64_2_2_WGM16
    SolutionIndex: 66
    SolutionNameMin: Cijk_Ailk_Bjlk_BBS_BH_MT64x64x64_MI16x16x16x1_SN_AMAS0_CLR0_EPS1_FL0_GSU33_LBSPPA512_LBSPPB512_LPA16_LPB16_NLCB1_PGR1_TT2_64_VW1_VFLRP1_WG32_4_2_WGM1
    SolutionIndex: 67
    SolutionNameMin: Cijk_Ailk_Bjlk_BBS_BH_MT64x192x32_MI16x16x16x1_SN_AMAS3_CLR1_EPS1_FL0_GSU101_LBSPPA512_LBSPPB0_LPA32_LPB16_NLCB3_PGR2_TT4_48_VW2_VFLRP1_WG16_16_1_WGM16
    SolutionIndex: 68
    SolutionNameMin: Cijk_Ailk_Bjlk_BBS_BH_MT256x128x64_MI16x16x16x1_SN_DTVA1_GLVWB4_LBSPPA0_LBSPPB0_LPA0_LPB0_NLCA1_NLCB1_PLR5_TT4_128_VWB4_WG64_4_1_WGM2
    SolutionIndex: 69
    SolutionNameMin: Cijk_Ailk_Bjlk_BBS_BH_MT128x128x64_MI16x16x16x1_SN_GLVWB2_GRPM0p80_LBSPPB1024_LPB8_NTC0_NTD0_NEPBS0_NLCB1_PGR1_PLR1_SSO6_VWB2
    SolutionIndex: 70
    SolutionNameMin: Cijk_Ailk_Bjlk_BBS_BH_MT128x128x64_MI16x16x16x1_SN_GLVWB4_GRPM1_LBSPPB1024_LPB8_NTC1_NTD1_NEPBS16_NLCB1_PGR2_PLR1_SSO4_VWB4
    SolutionIndex: 71
    SolutionNameMin: Cijk_Ailk_Bjlk_BBS_BH_MT128x128x64_MI16x16x16x1_SN_GLVWB4_GRPM1_LBSPPB1024_LPB8_NTC1_NTD1_NEPBS16_NLCB2_PGR2_PLR1_SSO6_VWB4
    SolutionIndex: 72
    SolutionNameMin: Cijk_Ailk_Bjlk_BBS_BH_MT128x128x64_MI16x16x16x1_SN_GLVWB4_GRPM1_LBSPPB0_LPB0_NTC1_NTD1_NEPBS0_NLCB2_PGR2_PLR1_SSO6_VWB4
    SolutionIndex: 73
    SolutionNameMin: Cijk_Ailk_Bjlk_BBS_BH_MT128x128x64_MI16x16x16x1_SN_GLVWB4_GRPM1_LBSPPB0_LPB0_NTC1_NTD1_NEPBS8_NLCB2_PGR2_PLR1_SSO6_VWB4
    SolutionIndex: 74
    SolutionNameMin: Cijk_Ailk_Bjlk_BBS_BH_MT128x128x64_MI16x16x16x1_SN_DTVA0_ELFLR8_GLVWA4_GLVWB4_GRPM1_LBSPPA0_LBSPPB0_LPA0_LPB0_NLCA1_NLCB1_PGR2_PLR5_SVW4_TT4_64_VW4_VWB4_WG32_8_1_WGMn16
    SolutionIndex: 75
    SolutionNameMin: Cijk_Ailk_Bjlk_BBS_BH_MT128x128x64_MI16x16x16x1_SN_DTVA1_ELFLR8_GLVWA2_GLVWB2_GRPM0p90_LBSPPA0_LBSPPB0_LPA0_LPB0_NLCA1_NLCB1_PGR1_PLR5_SVW2_TT2_128_VW2_VWB4_WG64_4_1_WGMn32
    SolutionIndex: 76
    SolutionNameMin: Cijk_Ailk_Bjlk_BBS_BH_MT128x128x64_MI16x16x16x1_SN_DTVA1_ELFLR12_GLVWA2_GLVWB2_GRPM1_LBSPPA0_LBSPPB0_LPA0_LPB0_NLCA1_NLCB1_PGR2_PLR1_SVW2_TT2_128_VW2_VWB4_WG64_4_1_WGM2
    SolutionIndex: 77
    SolutionNameMin: Cijk_Ailk_Bjlk_BBS_BH_MT128x128x64_MI16x16x16x1_SN_DTVA1_ELFLR8_GLVWA2_GLVWB4_GRPM1_LBSPPA0_LBSPPB0_LPA0_LPB0_NLCA1_NLCB1_PGR2_PLR1_SVW2_TT2_128_VW2_VWB4_WG64_4_1_WGM2
    SolutionIndex: 78
    SolutionNameMin: Cijk_Ailk_Bjlk_BBS_BH_MT128x128x64_MI16x16x16x1_SN_DTVA1_ELFLR12_GLVWA2_GLVWB2_GRPM1_LBSPPA0_LBSPPB0_LPA0_LPB0_NLCA1_NLCB1_PGR2_PLR5_SVW2_TT2_128_VW2_VWB4_WG64_4_1_WGM2
    SolutionIndex: 79
    SolutionNameMin: Cijk_Ailk_Bjlk_BBS_BH_MT128x128x64_MI16x16x16x1_SN_DTVA1_ELFLR8_GLVWA2_GLVWB2_GRPM1_LBSPPA0_LBSPPB0_LPA0_LPB0_NLCA1_NLCB1_PGR2_PLR5_SVW2_TT2_128_VW2_VWB4_WG64_4_1_WGM2
    SolutionIndex: 80
    SolutionNameMin: Cijk_Ailk_Bjlk_BBS_BH_MT256x256x32_MI16x16x16x1_SN_GLVWA2_GRPM0p30_LBSPPB0_LPB0_NTC0_NTD0_NLCA2_NLCB2_SU0_SUS0_SSO4_SVW2_VW2_WGM32
    SolutionIndex: 81
    SolutionNameMin: Cijk_Ailk_Bjlk_BBS_BH_MT256x256x32_MI16x16x16x1_SN_GLVWA2_GRPM0p30_LBSPPB0_LPB0_NTC1_NTD1_NLCA2_NLCB2_SU0_SUS0_SSO8_SVW2_VW2_WGM16
    SolutionIndex: 82
    SolutionNameMin: Cijk_Ailk_Bjlk_BBS_BH_MT256x256x64_MI16x16x16x1_SN_GLVWA4_GRPM0p20_LBSPPB0_LPB0_NTC1_NTD1_NLCA1_NLCB2_SU0_SUS0_SSO4_SVW4_VW4_WGM16
    SolutionIndex: 83
    SolutionNameMin: Cijk_Ailk_Bjlk_BBS_BH_MT128x64x16_MI16x16x16x1_SN_DTVA0_GLVWA4_GLVWB4_GSU1_GSUASB_LBSPPA0_LBSPPB512_LPA0_LPB16_MIAV1_NLCA1_NLCB1_PLR1_SVW4_TT8_16_VW4_VWB1_WG16_16_1_WGMn32
    SolutionIndex: 84
    SolutionNameMin: Cijk_Ailk_Bjlk_BBS_BH_MT128x64x16_MI16x16x16x1_SN_DTVA0_GLVWA4_GLVWB2_GSU1_GSUASB_LBSPPA0_LBSPPB512_LPA0_LPB16_MIAV0_NLCA2_NLCB2_PLR1_SVW4_TT8_16_VW4_VWB1_WG16_16_1_WGMn16
    SolutionIndex: 85
    SolutionNameMin: Cijk_Ailk_Bjlk_BBS_BH_MT128x64x32_MI16x16x16x1_SN_DTVA1_GLVWA2_GLVWB4_GSU1_GSUASB_LBSPPA0_LBSPPB0_LPA0_LPB0_MIAV0_NLCA1_NLCB1_PLR1_SVW2_TT2_64_VW2_VWB4_WG64_4_1_WGMn16
    SolutionIndex: 86
    SolutionNameMin: Cijk_Ailk_Bjlk_BBS_BH_MT128x64x32_MI16x16x16x1_SN_DTVA1_GLVWA2_GLVWB4_GSU1_GSUASB_LBSPPA0_LBSPPB0_LPA0_LPB0_MIAV0_NLCA1_NLCB1_PLR1_SVW2_TT2_64_VW2_VWB4_WG64_4_1_WGMn32
    SolutionIndex: 87
    SolutionNameMin: Cijk_Ailk_Bjlk_BBS_BH_MT64x64x64_MI16x16x16x1_SN_DTVA0_GLVWA2_GLVWB2_GSU1_GSUASB_LBSPPA512_LBSPPB512_LPA32_LPB32_MIAV1_NLCA2_NLCB2_PLR1_SVW2_TT2_32_VW2_VWB2_WG32_8_1_WGMn32
    SolutionIndex: 88
    SolutionNameMin: Cijk_Ailk_Bjlk_BBS_BH_MT64x64x64_MI16x16x16x1_SN_DTVA0_GLVWA2_GLVWB2_GSU1_GSUASB_LBSPPA512_LBSPPB512_LPA32_LPB32_MIAV1_NLCA2_NLCB2_PLR1_SVW2_TT2_32_VW2_VWB2_WG32_8_1_WGM16
    SolutionIndex: 89
    SolutionNameMin: Cijk_Ailk_Bjlk_BBS_BH_MT128x64x32_MI16x16x16x1_SN_DTVA1_GLVWA2_GLVWB4_GSU2_GSUAMB_LBSPPA0_LBSPPB0_LPA0_LPB0_MIAV0_NLCA1_NLCB1_PLR1_SVW2_TT2_64_VW2_VWB4_WG64_4_1_WGM2
    SolutionIndex: 90
    SolutionNameMin: Cijk_Ailk_Bjlk_BBS_BH_MT128x128x64_MI16x16x16x1_SN_DTVA1_GLVWA2_GLVWB4_GSU4_GSUAMB_LBSPPA0_LBSPPB0_LPA0_LPB0_MIAV1_NLCA1_NLCB1_PLR1_SVW2_TT2_128_VW2_VWB4_WG64_4_1_WGMn32
    SolutionIndex: 91
    SolutionNameMin: Cijk_Ailk_Bjlk_BBS_BH_MT128x128x64_MI16x16x16x1_SN_DTVA1_GLVWA2_GLVWB4_GSU4_GSUAMB_LBSPPA0_LBSPPB0_LPA0_LPB0_MIAV0_NLCA1_NLCB1_PLR1_SVW2_TT2_128_VW2_VWB4_WG64_4_1_WGMn32
    SolutionIndex: 92
    SolutionNameMin: Cijk_Ailk_Bjlk_BBS_BH_MT16x16x16_MI4x4x4x16_SN_1LDSB0_ASGT_GLVWA4_GLVWB4_LBSPPA128_LBSPPB128_LPA16_LPB4_NLCB1_PLR1_SS1_SVW1_TT1_4_VWB1_WSGRB1_WG16_4_1_WGM16
    SolutionIndex: 93
    SolutionNameMin: Cijk_Ailk_Bjlk_BBS_BH_MT16x64x16_MI16x16x16x1_SN_1LDSB1_ASGT2152_GLVWA2_GLVWB8_LBSPPA128_LBSPPB512_LPA16_LPB32_NLCB1_PLR1_SS1_SVW1_TT1_32_VWB2_WSGRB0_WG16_8_1_WGM1
    SolutionIndex: 94
    SolutionNameMin: Cijk_Ailk_Bjlk_BBS_BH_MT16x32x8_MI4x4x4x16_SN_1LDSB0_ASGT2152_GLVWA2_GLVWB4_LBSPPA128_LBSPPB256_LPA16_LPB8_NLCB1_PLR1_SS1_SVW1_TT1_8_VWB2_WSGRB1_WG16_4_1_WGM8
    SolutionIndex: 95
    SolutionNameMin: Cijk_Ailk_Bjlk_BBS_BH_MT16x16x8_MI4x4x4x16_SN_1LDSB0_ASGT_GLVWA2_GLVWB2_LBSPPA128_LBSPPB128_LPA16_LPB4_NLCB1_PLR3_SS1_SVW1_TT1_4_VWB1_WSGRB1_WG16_4_1_WGM8
    SolutionIndex: 96
    SolutionNameMin: Cijk_Ailk_Bjlk_BBS_BH_MT16x32x8_MI4x4x4x16_SN_1LDSB0_ASGT2152_GLVWA2_GLVWB2_LBSPPA128_LBSPPB256_LPA16_LPB4_NLCB1_PLR3_SS0_SVW4_TT1_8_VWB1_WSGRB0_WG16_4_1_WGM1
    SolutionIndex: 97
    SolutionNameMin: Cijk_Ailk_Bjlk_BBS_BH_MT16x16x16_MI4x4x4x16_SN_1LDSB0_ASGT_GLVWA2_GLVWB2_LBSPPA128_LBSPPB128_LPA16_LPB4_NLCB1_PLR1_SS1_SVW1_TT1_4_VWB1_WSGRB0_WG16_4_1_WGM8
    SolutionIndex: 98
    SolutionNameMin: Cijk_Ailk_Bjlk_BBS_BH_MT16x32x8_MI4x4x4x16_SN_1LDSB0_ASGT2152_GLVWA2_GLVWB2_LBSPPA128_LBSPPB256_LPA16_LPB8_NLCB1_PLR3_SS0_SVW4_TT1_8_VWB2_WSGRB1_WG16_4_1_WGM1
    SolutionIndex: 99
    SolutionNameMin: Cijk_Ailk_Bjlk_BBS_BH_MT16x16x16_MI4x4x4x16_SN_1LDSB0_ASGT_GLVWA2_GLVWB2_LBSPPA128_LBSPPB128_LPA16_LPB4_NLCB1_PLR5_SS0_SVW4_TT1_4_VWB1_WSGRB0_WG16_4_1_WGM1
    SolutionIndex: 100
    SolutionNameMin: Cijk_Ailk_Bjlk_BBS_BH_MT16x32x8_MI4x4x4x16_SN_1LDSB0_ASGT2152_GLVWA2_GLVWB2_LBSPPA128_LBSPPB256_LPA16_LPB4_NLCB1_PLR3_SS1_SVW1_TT1_8_VWB1_WSGRB0_WG16_4_1_WGM1
    SolutionIndex: 101
    SolutionNameMin: Cijk_Ailk_Bjlk_BBS_BH_MT16x32x32_MI4x4x4x16_SN_1LDSB0_ASGT2152_GLVWA4_GLVWB4_LBSPPA128_LBSPPB256_LPA16_LPB8_NLCB1_PLR1_SS1_SVW1_TT1_8_VWB2_WSGRB1_WG16_4_1_WGM1
    SolutionIndex: 102
    SolutionNameMin: Cijk_Ailk_Bjlk_BBS_BH_MT16x16x32_MI4x4x4x16_SN_1LDSB0_ASGT_GLVWA4_GLVWB2_LBSPPA128_LBSPPB128_LPA16_LPB4_NLCB1_PLR1_SS1_SVW1_TT1_4_VWB1_WSGRB1_WG16_4_1_WGM8
    SolutionIndex: 103
    SolutionNameMin: Cijk_Ailk_Bjlk_BBS_BH_MT32x16x16_MI16x16x16x1_SN_AMAS0_GLVWA4_GLVWB2_LBSPPA256_LBSPPB128_LPA16_LPB16_NLCB1_PLR1_SS1_SVW1_TT2_16_VW1_VWB1_WSGRB1_WG16_4_1
    SolutionIndex: 104
    SolutionNameMin: Cijk_Ailk_Bjlk_BBS_BH_MT16x32x16_MI16x16x16x1_SN_AMAS0_GLVWA2_GLVWB2_LBSPPA128_LBSPPB256_LPA16_LPB32_NLCB1_PLR1_SS1_SVW1_TT1_32_VW1_VWB2_WSGRB0_WG16_4_1
    SolutionIndex: 105
    SolutionNameMin: Cijk_Ailk_Bjlk_BBS_BH_MT32x16x32_MI16x16x16x1_SN_AMAS0_GLVWA2_GLVWB8_LBSPPA256_LBSPPB128_LPA16_LPB16_NLCB1_PLR3_SS1_SVW1_TT2_16_VW1_VWB1_WSGRB0_WG16_4_1
    SolutionIndex: 106
    SolutionNameMin: Cijk_Ailk_Bjlk_BBS_BH_MT16x32x32_MI16x16x16x1_SN_AMAS0_GLVWA4_GLVWB4_LBSPPA128_LBSPPB256_LPA16_LPB16_NLCB1_PLR1_SS0_SVW4_TT1_32_VW1_VWB1_WSGRB0_WG16_4_1
    SolutionIndex: 107
    SolutionNameMin: Cijk_Ailk_Bjlk_BBS_BH_MT32x16x16_MI16x16x16x1_SN_AMAS3_GLVWA4_GLVWB4_LBSPPA256_LBSPPB128_LPA32_LPB16_NLCB1_PLR1_SS1_SVW2_TT2_16_VW2_VWB1_WSGRB1_WG16_4_1
    SolutionIndex: 108
    SolutionNameMin: Cijk_Ailk_Bjlk_BBS_BH_MT32x64x32_MI16x16x16x1_SN_AMAS0_GLVWA4_GLVWB4_LBSPPA256_LBSPPB512_LPA16_LPB16_NLCB1_PLR1_SS1_SVW1_TT2_16_VW1_VWB1_WSGRB0_WG16_16_1
    SolutionIndex: 109
    SolutionNameMin: Cijk_Ailk_Bjlk_BBS_BH_MT32x64x64_MI16x16x16x1_SN_AMAS0_GLVWA4_GLVWB2_LBSPPA256_LBSPPB512_LPA16_LPB16_NLCB1_PLR5_SS1_SVW1_TT1_32_VW1_VWB1_WSGRB0_WG32_8_1
    SolutionIndex: 110
    SolutionNameMin: Cijk_Ailk_Bjlk_BBS_BH_MT32x64x64_MI16x16x16x1_SN_AMAS0_GLVWA2_GLVWB2_LBSPPA256_LBSPPB512_LPA16_LPB16_NLCB1_PLR1_SS0_SVW4_TT2_16_VW1_VWB1_WSGRB0_WG16_16_1
    SolutionIndex: 111
    SolutionNameMin: Cijk_Ailk_Bjlk_BBS_BH_MT32x128x64_MI16x16x4x4_SN_AMAS0_GLVWA8_GLVWB8_LBSPPA0_LBSPPB1024_LPA0_LPB16_NLCB1_PLR1_SS0_SVW4_TT1_16_VW1_VWB1_WSGRB1_WG32_8_1
    SolutionIndex: 112
    SolutionNameMin: Cijk_Ailk_Bjlk_BBS_BH_MT32x256x32_MI16x16x16x1_SN_AMAS0_GLVWA2_GLVWB8_LBSPPA256_LBSPPB2048_LPA16_LPB32_NLCB1_PLR3_SS1_SVW1_TT2_64_VW1_VWB2_WSGRB0_WG16_16_1
    SolutionIndex: 113
    SolutionNameMin: Cijk_Ailk_Bjlk_BBS_BH_MT32x128x64_MI16x16x16x1_SN_AMAS3_GLVWA4_GLVWB8_LBSPPA256_LBSPPB1024_LPA32_LPB32_NLCB1_PLR1_SS1_SVW2_TT2_32_VW2_VWB2_WSGRB1_WG16_16_1
    SolutionIndex: 114
    SolutionNameMin: Cijk_Ailk_Bjlk_BBS_BH_MT64x32x64_MI16x16x16x1_SN_AMAS3_GLVWA2_GLVWB2_LBSPPA512_LBSPPB256_LPA32_LPB16_NLCB1_PLR1_SVW2_TT2_16_VW2_VWB1_WSGRB0_WG32_8_1_WGM1
    SolutionIndex: 115
    SolutionNameMin: Cijk_Ailk_Bjlk_BBS_BH_MT64x16x16_MI4x4x4x16_SN_AMAS0_GLVWA2_GLVWB2_LBSPPA0_LBSPPB128_LPA0_LPB8_NLCB1_PLR1_SVW1_TT1_8_VW1_VWB2_WSGRB0_WG64_2_1_WGM16
    SolutionIndex: 116
    SolutionNameMin: Cijk_Ailk_Bjlk_BBS_BH_MT64x8x16_MI4x4x4x16_SN_AMAS0_GLVWA8_GLVWB2_LBSPPA0_LBSPPB128_LPA0_LPB36_NLCB1_PLR5_SVW1_TT2_4_VW1_VWB1_WSGRB0_WG32_2_1_WGM16
    SolutionIndex: 117
    SolutionNameMin: Cijk_Ailk_Bjlk_BBS_BH_MT64x16x32_MI16x16x16x1_SN_AMAS3_GLVWA4_GLVWB4_LBSPPA512_LBSPPB128_LPA32_LPB16_NLCB1_PLR3_SVW2_TT2_16_VW2_VWB1_WSGRB0_WG32_4_1_WGM16
    SolutionIndex: 118
    SolutionNameMin: Cijk_Ailk_Bjlk_BBS_BH_MT64x32x32_MI16x16x16x1_SN_AMAS3_GLVWA2_GLVWB4_LBSPPA512_LBSPPB256_LPA32_LPB16_NLCB1_PLR3_SVW2_TT2_16_VW2_VWB1_WSGRB1_WG32_8_1_WGM1
    SolutionIndex: 119
    SolutionNameMin: Cijk_Ailk_Bjlk_BBS_BH_MT64x128x32_MI16x16x16x1_SN_AMAS3_GLVWA4_GLVWB4_LBSPPA512_LBSPPB1024_LPA32_LPB32_NLCB1_PLR1_SVW2_TT2_64_VW2_VWB2_WSGRB1_WG32_8_1_WGM8
    SolutionIndex: 120
    SolutionNameMin: Cijk_Ailk_Bjlk_BBS_BH_MT64x128x32_MI16x16x16x1_SN_AMAS3_GLVWA8_GLVWB4_LBSPPA512_LBSPPB1024_LPA32_LPB32_NLCB1_PLR3_SVW2_TT2_64_VW2_VWB2_WSGRB0_WG32_8_1_WGM16
    SolutionIndex: 121
    SolutionNameMin: Cijk_Ailk_Bjlk_BBS_BH_MT64x256x32_MI16x16x16x1_SN_AMAS3_GLVWA8_GLVWB2_LBSPPA512_LBSPPB2048_LPA32_LPB32_NLCB2_PLR1_SVW2_TT4_128_VW2_VWB2_WSGRB1_WG16_8_1_WGM8
    SolutionIndex: 122
    SolutionNameMin: Cijk_Ailk_Bjlk_BBS_BH_MT64x32x32_MI16x16x16x1_SN_AMAS3_GLVWA2_GLVWB2_LBSPPA512_LBSPPB256_LPA32_LPB16_NLCB1_PLR1_SVW2_TT2_16_VW2_VWB1_WSGRB1_WG32_8_1_WGM8
    SolutionIndex: 123
    SolutionNameMin: Cijk_Ailk_Bjlk_BBS_BH_MT128x64x16_MI16x16x4x4_SN_AMAS0_GLVWA2_GLVWB4_LBSPPA0_LBSPPB512_LPA0_LPB32_NLCB1_PLR1_SVW1_TT1_32_VW1_VWB2_WSGRB1_WG128_2_1_WGM16
    SolutionIndex: 124
    SolutionNameMin: Cijk_Ailk_Bjlk_BBS_BH_MT64x64x32_MI16x16x16x1_SN_AMAS3_GLVWA4_GLVWB2_LBSPPA512_LBSPPB512_LPA32_LPB32_NLCB1_PLR1_SVW2_TT2_64_VW2_VWB2_WSGRB1_WG32_4_1_WGM1
    SolutionIndex: 125
    SolutionNameMin: Cijk_Ailk_Bjlk_BBS_BH_MT64x32x32_MI16x16x16x1_SN_AMAS0_GLVWA2_GLVWB4_LBSPPA512_LBSPPB256_LPA16_LPB16_NLCB1_PLR1_SVW1_TT2_16_VW1_VWB1_WSGRB1_WG32_8_1_WGM1
    SolutionIndex: 126
    SolutionNameMin: Cijk_Ailk_Bjlk_BBS_BH_MT64x64x64_MI32x32x8x1_SN_1LDSB0_AMAS3_DTVA0_GLVWA8_GLVWB8_LBSPPA0_LBSPPB0_LPA0_LPB0_NTC2_NTD2_NEPBS16_PLR1_SU0_SUS0_SSO4_SVW2_TT2_32_VW2_VWB1_WSGRA1_WG32_4_2_WGM32
    SolutionIndex: 127
    SolutionNameMin: Cijk_Ailk_Bjlk_BBS_BH_MT64x64x64_MI32x32x8x1_SN_1LDSB0_AMAS3_DTVA0_GLVWA8_GLVWB8_LBSPPA0_LBSPPB0_LPA0_LPB0_NTC3_NTD3_NEPBS16_PLR1_SU0_SUS0_SSO4_SVW2_TT2_32_VW2_VWB1_WSGRA1_WG32_4_2_WGM32
    SolutionIndex: 128
    SolutionNameMin: Cijk_Ailk_Bjlk_BBS_BH_MT64x64x64_MI32x32x8x1_SN_1LDSB0_AMAS3_DTVA0_GLVWA8_GLVWB8_LBSPPA0_LBSPPB0_LPA0_LPB0_NTC2_NTD2_NEPBS16_PLR5_SU0_SUS0_SSO4_SVW2_TT2_32_VW2_VWB1_WSGRA1_WG32_4_2_WGM1
    SolutionIndex: 129
    SolutionNameMin: Cijk_Ailk_Bjlk_BBS_BH_MT256x128x32_MI16x16x16x1_SN_1LDSB0_AMAS3_DTVA1_GLVWA4_GLVWB8_LBSPPA0_LBSPPB1024_LPA0_LPB32_NTC3_NTD3_NEPBS0_PLR1_SU32_SUS256_SSO0_SVW4_TT4_128_VW4_VWB2_WSGRA0_WG64_4_1_WGM16
    SolutionIndex: 130
    SolutionNameMin: Cijk_Ailk_Bjlk_BBS_BH_MT256x128x64_MI16x16x16x1_SN_1LDSB1_AMAS3_DTVA0_GLVWA4_GLVWB8_LBSPPA0_LBSPPB0_LPA0_LPB0_NTC2_NTD2_NEPBS0_PLR5_SU32_SUS256_SSO0_SVW4_TT4_128_VW4_VWB4_WSGRA1_WG64_4_1_WGM16
    SolutionIndex: 131
    SolutionNameMin: Cijk_Ailk_Bjlk_BBS_BH_MT256x128x64_MI16x16x16x1_SN_1LDSB1_AMAS3_DTVA0_GLVWA8_GLVWB8_LBSPPA0_LBSPPB0_LPA0_LPB0_NTC2_NTD2_NEPBS0_PLR5_SU32_SUS256_SSO0_SVW4_TT4_128_VW4_VWB4_WSGRA1_WG64_4_1_WGM1
    SolutionIndex: 132
    SolutionNameMin: Cijk_Ailk_Bjlk_BBS_BH_MT64x128x64_MI16x16x16x1_SN_1LDSB1_GLVWA2_GLVWB2_LBSPPA512_LPA32_MIAV1_NTC3_NTD3_NLCB2_PLR3_SVW2_VW2_VWB2_WGM32
    SolutionIndex: 133
    SolutionNameMin: Cijk_Ailk_Bjlk_BBS_BH_MT64x128x64_MI16x16x16x1_SN_1LDSB0_GLVWA4_GLVWB2_LBSPPA0_LPA0_MIAV1_NTC3_NTD3_NLCB2_PLR1_SVW4_VW4_VWB2_WGM32
    SolutionIndex: 134
    SolutionNameMin: Cijk_Ailk_Bjlk_BBS_BH_MT64x128x64_MI16x16x16x1_SN_1LDSB0_GLVWA2_GLVWB2_LBSPPA512_LPA32_MIAV0_NTC2_NTD2_NLCB2_PLR3_SVW2_VW2_VWB2_WGM32
    SolutionIndex: 135
    SolutionNameMin: Cijk_Ailk_Bjlk_BBS_BH_MT64x128x64_MI16x16x16x1_SN_1LDSB0_GLVWA4_GLVWB4_LBSPPA0_LPA0_MIAV1_NTB4_NTC3_NTD3_NLCB1_PLR1_SVW4_VW4_VWB4_WGMn32
    SolutionIndex: 136
    SolutionNameMin: Cijk_Ailk_Bjlk_BBS_BH_MT32x16x64_MI16x16x16x1_SN_GLVWB2_GRPM1_GSU8_NTC2_NTD2_PGR2_PLR1_WG16_4_4_WGMn2
    SolutionIndex: 137
    SolutionNameMin: Cijk_Ailk_Bjlk_BBS_BH_MT32x16x64_MI16x16x16x1_SN_GLVWB2_GRPM1_GSU16_NTC2_NTD2_PGR2_PLR1_WG16_4_4_WGMn2
    SolutionIndex: 138
    SolutionNameMin: Cijk_Ailk_Bjlk_BBS_BH_MT32x16x64_MI16x16x16x1_SN_GLVWB2_GRPM1_GSU16_NTC3_NTD3_PGR2_PLR1_WG16_4_4_WGMn2
    SolutionIndex: 139
    SolutionNameMin: Cijk_Ailk_Bjlk_BBS_BH_MT256x160x64_MI16x16x16x1_SN_FL2_NTC3_NTD3_NEPBS0_SUS256_SSO4
    SolutionIndex: 140
    SolutionNameMin: Cijk_Ailk_Bjlk_BBS_BH_MT256x160x64_MI16x16x16x1_SN_FL1_NTC2_NTD2_NEPBS8_SUS256_SSO4
    SolutionIndex: 141
    SolutionNameMin: Cijk_Ailk_Bjlk_BBS_BH_MT112x128x64_MI16x16x16x1_SN_WGM16
    SolutionIndex: 142
    SolutionNameMin: Cijk_Ailk_Bjlk_BBS_BH_MT64x512x32_MI16x16x16x1_SN_AMAS3_CLR1_GLVWA8_GLVWB8_GRVW8_LBSPPA0_LBSPPB0_LPA0_LPB0_PGR2_PLR1_TT4_128_VW4_VWB4_VFLRP1_WG16_16_1_WGM16
    SolutionIndex: 143
    SolutionNameMin: Cijk_Ailk_Bjlk_BBS_BH_MT64x64x32_MI16x16x16x1_SN_AMAS0_CLR1_GLVWA2_GLVWB2_GRVW2_LBSPPA512_LBSPPB512_LPA16_LPB32_PGR2_PLR1_TT4_32_VW1_VWB2_VFLRP1_WG16_8_2_WGM16
    SolutionIndex: 144
    SolutionNameMin: Cijk_Ailk_Bjlk_BBS_BH_MT512x64x16_MI16x16x16x1_SN_AMAS3_CLR1_LBSPPA4096_LBSPPB512_LPA32_LPB32_PGR1_TT8_64_VW2_VWB2_VFLRP1_WG64_4_1_WGM1
    SolutionIndex: 145
    SolutionNameMin: Cijk_Ailk_Bjlk_BBS_BH_MT128x64x16_MI16x16x16x1_SN_AMAS0_CLR0_LBSPPA1024_LBSPPB512_LPA16_LPB32_PGR1_TT4_32_VW1_VWB2_VFLRP1_WG32_8_1_WGM1
    SolutionIndex: 146
    SolutionNameMin: Cijk_Ailk_Bjlk_BBS_BH_MT128x128x32_MI16x16x16x1_SN_1LDSB0_AMAS0_EPS0_GLVWA8_GLVWB8_GRVW8_GSU8_GSUAMB_LBSPPA1024_LBSPPB1024_LPA16_LPB32_MIAV0_SS0_SVW4_TT2_128_VW1_VWB2_WG64_4_1_WGM16
    SolutionIndex: 147
    SolutionNameMin: Cijk_Ailk_Bjlk_BBS_BH_MT256x64x32_MI16x16x16x1_SN_1LDSB0_AMAS3_CLR1_DTVA1_GLVWA2_GLVWB2_GRVW2_LBSPPA0_LPA0_NLCA2_PGR2_PLR3_SS1_SVW2_VW2_VFLRP1_WGM32
    SolutionIndex: 148
    SolutionNameMin: Cijk_Ailk_Bjlk_BBS_BH_MT64x256x32_MI16x16x16x1_SN_1LDSB0_AMAS3_GSU304_GSUAMB_LBSPPA512_LBSPPB2048_LPA32_LPB32_NLCA1_NLCB1_TT4_64_VW2_VWB2_WG16_16_1_WGM32
    SolutionIndex: 149
    SolutionNameMin: Cijk_Ailk_Bjlk_BBS_BH_MT192x128x32_MI16x16x16x1_SN_AMAS0_CLR1_EPS1_GLVWA2_GLVWB2_GSU38_LBSPPA0_LBSPPB0_LPA16_LPB0_NLCA3_NLCB1_PGR2_PLR1_TT3_128_VW1_VWB4_VFLRP1_WG64_4_1_WGM1
    SolutionIndex: 150
    SolutionNameMin: Cijk_Ailk_Bjlk_BBS_BH_MT64x64x128_MI32x32x8x1_SN_AMAS0_CLR1_EPS1_GLVWA2_GLVWB2_GSU152_LBSPPA0_LBSPPB0_LPA0_LPB0_NLCA1_NLCB1_PGR1_PLR9_TT1_64_VW1_VWB2_VFLRP1_WG64_2_2_WGM32
    SolutionIndex: 151
    SolutionNameMin: Cijk_Ailk_Bjlk_BBS_BH_MT64x64x128_MI32x32x8x1_SN_AMAS0_CLR1_EPS1_GLVWA2_GLVWB2_GSU304_LBSPPA0_LBSPPB0_LPA0_LPB0_NLCA1_NLCB1_PGR2_PLR1_TT1_64_VW1_VWB2_VFLRP1_WG64_2_2_WGM32
    SolutionIndex: 152
    SolutionNameMin: Cijk_Ailk_Bjlk_BBS_BH_MT192x192x32_MI16x16x16x1_SN_AMAS3_CLR1_EPS1_GLVWA2_GLVWB2_GSU152_LBSPPA0_LBSPPB0_LPA32_LPB32_NLCA3_NLCB3_PGR1_PLR3_TT6_96_VW2_VWB2_VFLRP1_WG32_8_1_WGM1
    SolutionIndex: 153
    SolutionNameMin: Cijk_Ailk_Bjlk_BBS_BH_MT256x64x32_MI16x16x16x1_SN_AMAS0_CLR0_EPS1_GLVWA2_GLVWB2_GSU304_LBSPPA2048_LBSPPB512_LPA16_LPB16_NLCA1_NLCB1_PGR2_PLR3_TT4_64_VW1_VWB1_VFLRP0_WG64_4_1_WGM16
    SolutionIndex: 154
    SolutionNameMin: Cijk_Ailk_Bjlk_BBS_BH_MT128x192x32_MI16x16x16x1_SN_1LDSB0_AMAS3_GSU38_GSUAMB_LBSPPA1024_LBSPPB0_LPA32_LPB16_NLCA1_NLCB3_TT8_48_VW2_VWB1_WG16_16_1_WGM16
    SolutionIndex: 155
    SolutionNameMin: Cijk_Ailk_Bjlk_BBS_BH_MT64x32x128_MI32x32x8x1_SN_1LDSB0_AMAS0_CLR0_EPS1_GLVWA2_GLVWB2_GSU1_GSUASB_LBSPPA0_LPA0_LPB0_MIAV1_NLCB1_PGR2_PLR1_TT1_32_VW1_VFLRP1_WG64_2_2_WGM1
    SolutionIndex: 156
    SolutionNameMin: Cijk_Ailk_Bjlk_BBS_BH_MT32x128x64_MI32x32x8x1_SN_CLR0_GSU1_GSUASB_MIAV1_NLCA1_TT1_32_VWB1_VFLRP1_WG32_8_1
    SolutionIndex: 157
    SolutionNameMin: Cijk_Ailk_Bjlk_BBS_BH_MT192x128x32_MI32x32x8x1_SN_CLR1_GSU38_GSUAMB_MIAV1_NLCA3_TT3_64_VWB2_VFLRP1_WG64_4_1
- - - [6144, 4864, 1, 4096]
    - [34, 79.947]
  - - [6144, 4864, 1, 8192]
    - [35, 82.197]
  - - [6144, 4864, 1, 16384]
    - [36, 86.295]
  - - [6144, 4864, 1, 4352]
    - [37, 79.01]
  - - [6144, 4864, 1, 8448]
    - [38, 83.061]
  - - [6144, 4864, 1, 16640]
    - [39, 86.024]
  - - [4864, 3072, 1, 4096]
    - [40, 51.377]
  - - [4864, 3072, 1, 8192]
    - [41, 57.33]
  - - [4864, 3072, 1, 16384]
    - [42, 62.895]
  - - [4864, 3072, 1, 4352]
    - [43, 51.935]
  - - [4864, 3072, 1, 8448]
    - [41, 57.373]
  - - [4864, 3072, 1, 16640]
    - [44, 62.692]
  - - [8192, 8192, 1, 8192]
    - [27, 69.02]
  - - [9728, 8192, 1, 8192]
    - [28, 79.958]
  - - [4864, 3072, 1, 2048]
    - [45, 54.971]
  - - [4864, 3072, 1, 6144]
    - [46, 55.071]
  - - [3072, 4864, 1, 2048]
    - [47, 55.72]
  - - [3072, 4864, 1, 4096]
    - [48, 54.939]
  - - [3072, 4864, 1, 6144]
    - [49, 58.442]
  - - [3072, 4864, 1, 8192]
    - [50, 59.46]
  - - [2, 7168, 1, 8192]
    - [54, 0.799]
  - - [2, 3584, 1, 8192]
    - [55, 0.583]
  - - [2, 1280, 1, 8192]
    - [56, 0.28]
  - - [7168, 28672, 1, 65536]
    - [51, 81.625]
  - - [28672, 7168, 1, 65536]
    - [52, 80.538]
  - - [7168, 21504, 1, 65536]
    - [51, 83.605]
  - - [7168, 7168, 1, 65536]
    - [53, 74.551]
  - - [7168, 50432, 1, 65536]
    - [51, 82.481]
  - - [4096, 4096, 1, 8192]
    - [25, 66.711]
  - - [4864, 4096, 1, 8192]
    - [26, 73.688]
  - - [9728, 8192, 1, 16416]
    - [29, 83.589]
  - - [9728, 12288, 1, 4096]
    - [30, 73.376]
  - - [9728, 12288, 1, 8192]
    - [29, 80.897]
  - - [9728, 12288, 1, 8256]
    - [31, 80.869]
  - - [9728, 12288, 1, 16416]
    - [31, 84.158]
  - - [14592, 12288, 1, 8192]
    - [28, 81.182]
  - - [14592, 12288, 1, 8256]
    - [32, 82.337]
  - - [14592, 12288, 1, 16416]
    - [31, 84.769]
  - - [12288, 9728, 1, 16416]
    - [33, 84.038]
  - - [2432, 2048, 1, 1024]
    - [0, 29.87]
  - - [2432, 2048, 1, 2048]
    - [1, 35.34]
  - - [2048, 2432, 1, 1024]
    - [2, 31.6]
  - - [2048, 2432, 1, 2048]
    - [3, 42.91]
  - - [4864, 1024, 1, 1024]
    - [5, 33.41]
  - - [4864, 1024, 1, 2048]
    - [4, 39.23]
  - - [512, 608, 1, 1024]
    - [14, 6.567]
  - - [608, 512, 1, 512]
    - [6, 4.184]
  - - [608, 1024, 1, 1024]
    - [7, 9.617]
  - - [128, 2432, 1, 512]
    - [8, 4.081]
  - - [128, 2432, 1, 1024]
    - [9, 5.835]
  - - [512, 608, 1, 512]
    - [10, 3.926]
  - - [608, 512, 1, 1024]
    - [15, 6.519]
  - - [608, 1024, 1, 512]
    - [16, 6.91]
  - - [1216, 256, 1, 512]
    - [11, 4.095]
  - - [256, 4864, 1, 1024]
    - [12, 18.075]
  - - [256, 4864, 1, 2048]
    - [13, 21.743]
  - - [1216, 1024, 1, 2048]
    - [19, 22.445]
  - - [1216, 4096, 1, 4096]
    - [20, 39.308]
  - - [2432, 512, 1, 1024]
    - [18, 15.251]
  - - [1216, 1024, 1, 1024]
    - [17, 16.227]
  - - [9728, 512, 1, 512]
    - [21, 25.768]
  - - [9728, 512, 1, 1024]
    - [22, 34.775]
  - - [19456, 256, 1, 512]
    - [57, 30.2]
  - - [19456, 256, 1, 1024]
    - [58, 42.4]
  - - [64, 4864, 1, 512]
    - [23, 6.379]
  - - [64, 9728, 1, 1024]
    - [24, 8.422]
  - - [64, 64, 1, 100352]
    - [59, 4.176]
  - - [64, 64, 1, 401408]
    - [60, 9.782]
  - - [192, 768, 1, 100352]
    - [61, 24.317]
  - - [192, 192, 1, 25088]
    - [66, 7.053]
  - - [192, 192, 1, 100352]
    - [67, 15.402]
  - - [384, 384, 1, 6400]
    - [62, 9.929]
  - - [384, 2432, 1, 25216]
    - [63, 43.756]
  - - [2432, 384, 1, 25216]
    - [64, 42.842]
  - - [384, 384, 1, 25216]
    - [65, 27.775]
  - - [2048, 4096, 1, 8192]
    - [68, 62.7]
  - - [4096, 1024, 1, 512]
    - [69, 23.88]
  - - [4096, 1024, 1, 1024]
    - [70, 30.84]
  - - [4096, 1024, 1, 2048]
    - [71, 40.04]
  - - [4096, 1024, 1, 4096]
    - [72, 46.04]
  - - [4096, 1024, 1, 8192]
    - [72, 50.93]
  - - [4096, 1024, 1, 16384]
    - [73, 52.98]
  - - [1024, 4096, 1, 512]
    - [74, 27.52]
  - - [1024, 4096, 1, 1024]
    - [75, 34.16]
  - - [1024, 4096, 1, 2048]
    - [76, 41.04]
  - - [1024, 4096, 1, 4096]
    - [77, 48.06]
  - - [1024, 4096, 1, 8192]
    - [78, 52.15]
  - - [1024, 4096, 1, 16384]
    - [79, 50.75]
  - - [1024, 32768, 1, 4096]
    - [80, 59.54]
  - - [1024, 32768, 1, 6144]
    - [81, 64.05]
  - - [1024, 32768, 1, 8192]
    - [82, 66.32]
  - - [1024, 1024, 1, 8]
    - [83, 0.22]
  - - [1024, 1024, 1, 16]
    - [84, 0.51]
  - - [1024, 1024, 1, 64]
    - [85, 1.84]
  - - [1024, 1024, 1, 128]
    - [86, 3.45]
  - - [1024, 1024, 1, 256]
    - [85, 6.07]
  - - [1024, 1024, 1, 512]
    - [85, 9.52]
  - - [1024, 1024, 1, 1024]
    - [87, 14.14]
  - - [1024, 1024, 1, 2048]
    - [88, 17.0]
  - - [1024, 1024, 1, 4096]
    - [89, 23.58]
  - - [1024, 1024, 1, 8192]
    - [90, 35.29]
  - - [1024, 1024, 1, 16384]
    - [91, 43.49]
  - - [4, 32, 304, 4]
    - [92, 0.001]
  - - [4, 64, 304, 4]
    - [93, 0.002]
  - - [8, 32, 304, 8]
    - [94, 0.0045]
  - - [8, 64, 304, 8]
    - [95, 0.0089]
  - - [32, 2, 304, 2]
    - [96, 0.0002]
  - - [32, 4, 304, 4]
    - [97, 0.001]
  - - [32, 8, 304, 8]
    - [98, 0.004]
  - - [16, 32, 304, 16]
    - [99, 0.01]
  - - [16, 64, 304, 16]
    - [100, 0.037]
  - - [16, 32, 304, 32]
    - [101, 0.035]
  - - [16, 64, 304, 32]
    - [102, 0.07]
  - - [32, 16, 304, 16]
    - [103, 0.017]
  - - [32, 32, 304, 16]
    - [104, 0.035]
  - - [32, 32, 304, 32]
    - [105, 0.07]
  - - [32, 32, 304, 64]
    - [106, 0.13]
  - - [32, 16, 304, 32]
    - [107, 0.03]
  - - [32, 64, 304, 32]
    - [108, 0.13]
  - - [32, 64, 304, 64]
    - [109, 0.26]
  - - [32, 128, 304, 128]
    - [110, 0.98]
  - - [32, 128, 152, 128]
    - [111, 0.69]
  - - [32, 256, 152, 256]
    - [112, 2.3]
  - - [32, 128, 76, 128]
    - [113, 0.52]
  - - [64, 8, 304, 8]
    - [114, 0.008]
  - - [64, 16, 304, 8]
    - [115, 0.017]
  - - [64, 16, 304, 16]
    - [116, 0.03]
  - - [64, 32, 304, 64]
    - [117, 0.26]
  - - [64, 64, 304, 64]
    - [118, 0.51]
  - - [64, 128, 304, 64]
    - [119, 0.95]
  - - [64, 128, 304, 128]
    - [120, 1.73]
  - - [64, 256, 304, 256]
    - [121, 5.16]
  - - [128, 32, 304, 32]
    - [122, 0.26]
  - - [128, 64, 304, 64]
    - [123, 0.91]
  - - [128, 64, 304, 128]
    - [124, 1.78]
  - - [64, 32, 152, 32]
    - [125, 0.1]
  - - [64, 4680, 1, 4680]
    - [126, 4.38]
  - - [64, 6144, 1, 6144]
    - [127, 6.08]
  - - [64, 8192, 1, 8192]
    - [128, 9.33]
  - - [1024, 4680, 1, 4680]
    - [129, 28.41]
  - - [1024, 6144, 1, 6144]
    - [130, 43.71]
  - - [1024, 8192, 1, 8192]
    - [131, 59.2]
  - - [64, 32768, 1, 1024]
    - [132, 23.09]
  - - [64, 32768, 1, 2048]
    - [133, 31.33]
  - - [64, 32768, 1, 4096]
    - [134, 34.98]
  - - [64, 32768, 1, 8192]
    - [135, 35.15]
  - - [64, 64, 1, 2048]
    - [136, 0.13]
  - - [64, 64, 1, 4096]
    - [137, 0.26]
  - - [64, 64, 1, 8192]
    - [138, 0.51]
  - - [1000, 4000, 1, 31744]
    - [139, 58.2]
  - - [1000, 4000, 1, 32768]
    - [140, 58.9]
  - - [1000, 4000, 1, 1024]
    - [141, 21.9]
  - - [224, 4000, 1, 32768]
    - [63, 41.5]
  - - [1000, 100, 1, 1024]
    - [15, 2.3]
  - - [64, 784, 256, 3136]
    - [142, 15.961]
  - - [64, 50, 1536, 197]
    - [143, 4.092]
  - - [784, 64, 256, 3136]
    - [144, 17.71]
  - - [196, 64, 768, 784]
    - [145, 2.384]
  - - [128, 4096, 1, 6144]
    - [146, 19.13]
  - - [768, 4096, 1, 6144]
    - [147, 33.28]
  - - [64, 256, 1, 802816]
    - [148, 18.677]
  - - [384, 384, 1, 12800]
    - [149, 6.844]
  - - [64, 64, 1, 200704]
    - [150, 7.067]
  - - [64, 64, 1, 802816]
    - [151, 13.651]
  - - [192, 192, 1, 200704]
    - [152, 23.075]
  - - [256, 64, 1, 802816]
    - [153, 8.827]
  - - [768, 192, 1, 200704]
    - [154, 28.415]
  - - [1536, 384, 1, 50432]
    - [155, 2.57]
  - - [384, 1536, 1, 50432]
    - [156, 2.582]
  - - [192, 768, 1, 200704]
    - [157, 21.916]
- null
- null
- DeviceEfficiency
