library/src/blas3/Tensile/Logic/asm_full/aquavanjaram942X/aquavanjaram942_Cijk_Ailk_Bljk_HHS_BH.yaml
- {MinimumRequiredVersion: 4.36.0}
- aquavanjaram942
- {Architecture: gfx942, IsAPU: 0}
- [Device 74a1]
    SolutionIndex: 0
    SolutionNameMin: Cijk_Ailk_Bljk_HHS_BH_MT128x16x128_MI16x16x16x1_SN_1LDSB1_AMAS3_EMLL8_GSU16_GSUAMB_LBSPP256_LPB16_LRVW8_PLR5_SVW2_TT2_16_VW2_WG64_4_2
    SolutionIndex: 1
    SolutionNameMin: Cijk_Ailk_Bljk_HHS_BH_MT64x16x128_MI16x16x16x1_SN_AMAS3_EMLL6_GLS0_PLR5_SVW2_TT2_16_VW2_WG32_4_2
    SolutionIndex: 2
    SolutionNameMin: Cijk_Ailk_Bljk_HHS_BH_MT256x224x64_MI16x16x16x1_SN_CLR0_GLVWB4_LBSPPA0_LBSPPB128_LPA0_LPB4_LRVW4_PLR5_SVW4_TT4_224_VW4_WGM32
    SolutionIndex: 3
    SolutionNameMin: Cijk_Ailk_Bljk_HHS_BH_MT64x64x64_MI16x16x16x1_SN_AMAS3_CLR0_GLVWA8_GLVWB8_LBSPPA1024_LPA16_LPB16_MIAV0_SU16_SUS512_TT2_32_VW2_VFLRP1_WG32_8_1_WGM16
    SolutionIndex: 4
    SolutionNameMin: Cijk_Ailk_Bljk_HHS_BH_MT64x64x64_MI16x16x16x1_SN_AMAS3_CLR0_GLVWA2_GLVWB8_LBSPPA1024_LPA16_LPB16_MIAV0_SU8_SUS1024_TT1_64_VW2_VFLRP0_WG64_4_1_WGM16
    SolutionIndex: 5
    SolutionNameMin: Cijk_Ailk_Bljk_HHS_BH_MT64x64x32_MI32x32x8x1_SN_AMAS3_CLR0_GLVWA8_GLVWB8_LBSPPA0_LPA0_LPB8_MIAV0_SU2_SUS512_TT1_32_VW2_VFLRP1_WG64_4_1_WGM32
    SolutionIndex: 6
    SolutionNameMin: Cijk_Ailk_Bljk_HHS_BH_MT64x64x64_MI16x16x16x1_SN_AMAS3_CLR1_GLVWA8_GLVWB8_LBSPPA1024_LPA16_LPB16_MIAV0_SU16_SUS1024_TT1_64_VW2_VFLRP1_WG64_4_1_WGM32
    SolutionIndex: 7
    SolutionNameMin: Cijk_Ailk_Bljk_HHS_BH_MT64x64x64_MI16x16x16x1_SN_AMAS3_CLR1_GLVWA8_GLVWB8_LBSPPA1024_LPA16_LPB16_MIAV0_SU16_SUS1024_TT1_64_VW4_VFLRP1_WG64_4_1_WGMn16
    SolutionIndex: 8
    SolutionNameMin: Cijk_Ailk_Bljk_HHS_BH_MT64x64x64_MI16x16x16x1_SN_AMAS3_CLR1_GLVWA2_GLVWB8_LBSPPA1024_LPA16_LPB16_MIAV0_SU16_SUS512_TT1_64_VW2_VFLRP1_WG64_4_1_WGMn16
    SolutionIndex: 9
    SolutionNameMin: Cijk_Ailk_Bljk_HHS_BH_MT64x64x64_MI16x16x16x1_SN_AMAS3_CLR0_GLVWA8_GLVWB8_LBSPPA1024_LPA16_LPB16_MIAV0_SU8_SUS1024_TT1_64_VW2_VFLRP0_WG64_4_1_WGMn16
    SolutionIndex: 10
    SolutionNameMin: Cijk_Ailk_Bljk_HHS_BH_MT32x32x64_MI16x16x16x1_SN_AMAS3_ELFLR8_GLVWB8_GLS1_LBSPPA512_LPB16_LRVW8_MIAV0_PLR5_SU64_SUS128_VW2_VFLRP1_WGM16
    SolutionIndex: 11
    SolutionNameMin: Cijk_Ailk_Bljk_HHS_BH_MT32x32x64_MI16x16x16x1_SN_AMAS3_ELFLR0_GLVWB8_GLS1_LBSPPA256_LPB8_LRVW4_MIAV1_PLR5_SU64_SUS128_VW2_VFLRP1_WGM16
    SolutionIndex: 12
    SolutionNameMin: Cijk_Ailk_Bljk_HHS_BH_MT32x32x64_MI16x16x16x1_SN_AMAS3_ELFLR0_GLVWB8_GLS1_LBSPPA512_LPB16_LRVW8_MIAV0_PLR5_SU8_SUS128_VW2_VFLRP1_WGM16
    SolutionIndex: 13
    SolutionNameMin: Cijk_Ailk_Bljk_HHS_BH_MT32x32x64_MI16x16x16x1_SN_AMAS3_ELFLR4_GLVWB2_GLS1_LBSPPA512_LPB16_LRVW8_MIAV0_PLR5_SU4_SUS512_VW4_VFLRP0_WGM16
    SolutionIndex: 14
    SolutionNameMin: Cijk_Ailk_Bljk_HHS_BH_MT32x32x64_MI16x16x16x1_SN_AMAS3_ELFLR4_GLVWB2_GLS0_LBSPPA512_LPB16_LRVW8_MIAV1_PLR5_SU4_SUS512_VW4_VFLRP0_WGM16
    SolutionIndex: 15
    SolutionNameMin: Cijk_Ailk_Bljk_HHS_BH_MT64x64x64_MI16x16x16x1_SN_AMAS3_ELFLR4_GLS1_LBSPPA512_LBSPPB256_LPA32_LPB4_LRVW4_NTC2_NTD2_PLR1_SS1_SU64_SUS512_SPO1_SVW2_TT2_32_VW2_VWB2_VFLRP1_WG32_8_1
    SolutionIndex: 16
    SolutionNameMin: Cijk_Ailk_Bljk_HHS_BH_MT64x64x64_MI16x16x16x1_SN_AMAS3_ELFLR4_GLS0_LBSPPA512_LBSPPB256_LPA32_LPB4_LRVW4_NTC3_NTD3_PLR1_SS1_SU64_SUS512_SPO0_SVW2_TT2_32_VW2_VWB2_VFLRP0_WG32_8_1
    SolutionIndex: 17
    SolutionNameMin: Cijk_Ailk_Bljk_HHS_BH_MT16x16x256_MI16x16x16x1_SN_GLVWA8_GLVWB8_GSU1_GSUASB_LBSPPA256_LBSPPB512_LPB16_LRVW8_MKFGSU256_NLCB1_PGR2_PLR5_SU0_SUS0_WG16_4_4
    SolutionIndex: 18
    SolutionNameMin: Cijk_Ailk_Bljk_HHS_BH_MT16x16x256_MI16x16x16x1_SN_GLVWA8_GLVWB8_LBSPPA128_LBSPPB512_LPA16_LPB8_LRVW4_PLR5_VFLRP1_WG16_4_4
    SolutionIndex: 19
    SolutionNameMin: Cijk_Ailk_Bljk_HHS_BH_MT16x16x256_MI16x16x16x1_SN_GLVWA8_GLVWB4_GSU128_LBSPPA128_LBSPPB512_LPB4_LRVW4_NLCB1_PGR2_PLR1_SU0_SUS0_WG16_4_4
    SolutionIndex: 20
    SolutionNameMin: Cijk_Ailk_Bljk_HHS_BH_MT16x32x256_MI16x16x16x1_SN_1LDSB0_GLVWA8_GLVWB8_LBSPPA256_LBSPPB512_LPB16_LRVW8_PLR9_SU0_SUS0_TT1_16_WG16_8_2
    SolutionIndex: 21
    SolutionNameMin: Cijk_Ailk_Bljk_HHS_BH_MT16x64x128_MI16x16x16x1_SN_1LDSB0_GLVWA8_GLVWB8_GSU8_LBSPPB256_LPB8_PLR3_TT1_64_WG16_4_4
    SolutionIndex: 22
    SolutionNameMin: Cijk_Ailk_Bljk_HHS_BH_MT16x128x64_MI16x16x16x1_SN_GLVWA4_GLVWB4_GSU18_LPB4_TT1_128
    SolutionIndex: 23
    SolutionNameMin: Cijk_Ailk_Bljk_HHS_BH_MT16x64x128_MI16x16x16x1_SN_1LDSB0_GLVWA8_GLVWB2_LBSPPA256_LBSPPB256_LPB16_LRVW8_PLR9_SU0_SUS0_TT1_16_WG16_16_1
    SolutionIndex: 24
    SolutionNameMin: Cijk_Ailk_Bljk_HHS_BH_MT16x64x64_MI16x16x16x1_SN_1LDSB1_GLVWA4_GLVWB2_GSU9_LBSPPB128_LPB4_PLR1_TT1_64_WG16_4_4
    SolutionIndex: 25
    SolutionNameMin: Cijk_Ailk_Bljk_HHS_BH_MT16x256x64_MI16x16x16x1_SN_GLVWA4_GLVWB8_GSU9_LPB8_TT1_256
    SolutionIndex: 26
    SolutionNameMin: Cijk_Ailk_Bljk_HHS_BH_MT32x16x128_MI16x16x16x1_SN_GLVWA2_GLVWB8_LBSPPB256_LPB16_LRVW8_NLCA1_PGR2_PLR5_SU4_SUS256_SVW2_TT2_16_VW2_WG16_4_2
    SolutionIndex: 27
    SolutionNameMin: Cijk_Ailk_Bljk_HHS_BH_MT256x16x64_MI16x16x16x1_SN_GLVWA2_GLVWB2_GSU18_LBSPPB128_NLCA4_PGR2_PLR1_SVW2_TT8_16_VW2_WG32_4_2
    SolutionIndex: 28
    SolutionNameMin: Cijk_Ailk_Bljk_HHS_BH_MT256x16x64_MI16x16x16x1_SN_GLVWA2_GLVWB4_GSU4_GSUAMB_LBSPPB128_LPB4_NLCA4_PGR2_PLR3_SU0_SUS0_SVW2_TT8_16_VW2_WG32_4_2
    SolutionIndex: 29
    SolutionNameMin: Cijk_Ailk_Bljk_HHS_BH_MT256x16x64_MI16x16x16x1_SN_GLVWA2_GLVWB2_GSU5_LBSPPB128_NLCA4_PGR2_PLR1_SVW2_TT8_16_VW2_WG32_4_2
    SolutionIndex: 30
    SolutionNameMin: Cijk_Ailk_Bljk_HHS_BH_MT128x112x64_MI16x16x16x1_SN_1LDSB0_ELFLRn30_FL0_GLVWB2_GRPM0p35_LPB4_LRVW4_MIAV1_PGR2_PLR1
    SolutionIndex: 31
    SolutionNameMin: Cijk_Ailk_Bljk_HHS_BH_MT128x112x128_MI16x16x16x1_SN_1LDSB0_GLVWB8_GRPM0p50_LPB16_LRVW8_MIAV0_NEPBS0_PGR1_PLR9_SU4_SUS512_SPO0_SSO0
    SolutionIndex: 32
    SolutionNameMin: Cijk_Ailk_Bljk_HHS_BH_MT256x128x64_MI16x16x16x1_SN_1LDSB0_DTVA1_ELFLRn20_FL1_GLVWA2_GRPM0p50_GSU2_GSUAMB_LBSPPA0_LBSPPB256_LPA0_LPB4_NLCA2_PGR2_PLR5_SVW2_TT4_128_VW2_VWB2_WSGRA0_WG64_4_1
    SolutionIndex: 33
    SolutionNameMin: Cijk_Ailk_Bljk_HHS_BH_MT256x224x64_MI16x16x16x1_SN_1LDSB1_ELFLRn20_GLVWB2_GRPM0p26_LBSPPB256_LPB4_LRVW4_PGR1_PLR1_TT4_224_VWB2
    SolutionIndex: 34
    SolutionNameMin: Cijk_Ailk_Bljk_HHS_BH_MT256x224x64_MI16x16x16x1_SN_1LDSB1_CLR1_DTVA1_ELFLR0_GLVWA4_GLVWB2_GRPM0p25_LBSPPA0_LBSPPB256_LPA0_LPB4_LRVW4_PGR1_PLR1_SVW4_TT4_224_VW4_VWB2_WSGRA0_WGM32
    SolutionIndex: 35
    SolutionNameMin: Cijk_Ailk_Bljk_HHS_BH_MT256x240x32_MI16x16x16x1_SN_1LDSB0_DTVA1_ELFLRn20_GLVWA2_GLVWB2_LBSPPA0_LBSPPB128_LPA0_LPB4_LRVW4_MIAV0_NLCA2_PGR2_PLR1_SU8_SUS256_SVW2_TT4_240_VW2_VWB1_WSGRA0_WGMn16
    SolutionIndex: 36
    SolutionNameMin: Cijk_Ailk_Bljk_HHS_BH_MT256x240x64_MI16x16x16x1_SN_1LDSB0_ASGT3256_ELFLRn30_GLVWA4_GLVWB2_GRPM0p27_NLCA1_PGR1_PLR1_SVW4_VW4_WGMn32
    SolutionIndex: 37
    SolutionNameMin: Cijk_Ailk_Bljk_HHS_BH_MT256x240x64_MI16x16x16x1_SN_1LDSB0_ASGT_ELFLR0_GLVWA4_GLVWB2_GRPM1_NLCA1_PGR2_PLR1_SPO0_SVW4_VW4
    SolutionIndex: 38
    SolutionNameMin: Cijk_Ailk_Bljk_HHS_BH_MT256x144x32_MI16x16x16x1_SN_1LDSB0_DTVA1_ELFLR0_GLVWA4_GRPM0p50_LBSPPB128_LPB4_LRVW4_MIAV1_PGR2_PLR1_TT4_144_VWB1_WSGRA0
    SolutionIndex: 39
    SolutionNameMin: Cijk_Ailk_Bljk_HHS_BH_MT256x224x64_MI16x16x16x1_SN_1LDSB0_CLR1_DTVA1_ELFLR0_GLVWA4_GLVWB2_GRPM0p26_LBSPPA0_LBSPPB256_LPA0_LPB4_LRVW4_PGR1_PLR1_SVW4_TT4_224_VW4_VWB2_WSGRA0_WGMn32
    SolutionIndex: 40
    SolutionNameMin: Cijk_Ailk_Bljk_HHS_BH_MT256x224x64_MI16x16x16x1_SN_1LDSB0_CLR1_DTVA1_ELFLR0_GLVWA4_GLVWB2_GRPM0p26_LBSPPA0_LBSPPB256_LPA0_LPB4_LRVW4_NLCA1_PGR1_PLR1_SVW4_TT4_224_VW4_VWB2_WSGRA0_WGM1
    SolutionIndex: 41
    SolutionNameMin: Cijk_Ailk_Bljk_HHS_BH_MT256x224x64_MI16x16x16x1_SN_1LDSB1_ELFLRn30_GLVWB2_GRPM0p27_LPB4_LRVW4_PGR1_PLR1_SU8_SUS256_WGMn32
    SolutionIndex: 42
    SolutionNameMin: Cijk_Ailk_Bljk_HHS_BH_MT256x256x64_MI16x16x16x1_SN_1LDSB1_ELFLRn30_GLVWB2_GRPM0p26_LBSPPB256_LPB4_PGR1_SU8_SUS256_WGM32
    SolutionIndex: 43
    SolutionNameMin: Cijk_Ailk_Bljk_HHS_BH_MT256x128x64_MI16x16x16x1_SN_1LDSB1_ELFLRn20_GLVWA2_GLVWB2_GRPM1_LBSPPB256_LPB4_NLCA2_PGR2_PLR5_SU8_SUS256_SVW2_TT4_128_VW2_VWB2_WGMn32
    SolutionIndex: 44
    SolutionNameMin: Cijk_Ailk_Bljk_HHS_BH_MT256x128x64_MI16x16x16x1_SN_1LDSB0_ELFLRn20_GLVWA2_GLVWB2_GRPM0p50_LBSPPB256_LPB4_NLCA2_PGR1_PLR5_SU0_SUS0_SVW2_TT4_128_VW2_VWB2_WGMn32
    SolutionIndex: 45
    SolutionNameMin: Cijk_Ailk_Bljk_HHS_BH_MT256x224x64_MI16x16x16x1_SN_1LDSB1_ELFLRn20_GLVWA4_GLVWB2_GRPM0p26_LBSPPB256_LPB4_NLCA1_PGR1_PLR1_SU0_SUS0_SVW4_TT4_224_VW4_VWB2_WGM1
    SolutionIndex: 46
    SolutionNameMin: Cijk_Ailk_Bljk_HHS_BH_MT256x128x32_MI16x16x16x1_SN_1LDSB1_ELFLRn20_GLVWA2_GLVWB4_GRPM1_LBSPPB128_LPB4_NLCA2_PGR2_PLR1_SU0_SUS0_SVW2_TT4_128_VW2_VWB2_WGM1
    SolutionIndex: 47
    SolutionNameMin: Cijk_Ailk_Bljk_HHS_BH_MT256x128x64_MI16x16x16x1_SN_1LDSB0_ELFLRn20_GLVWA2_GLVWB2_GRPM1_LBSPPB256_LPB4_NLCA2_PGR2_PLR1_SU0_SUS0_SVW2_TT4_128_VW2_VWB2_WGM1
    SolutionIndex: 48
    SolutionNameMin: Cijk_Ailk_Bljk_HHS_BH_MT256x224x64_MI16x16x16x1_SN_1LDSB0_ELFLR0_GLVWA4_GLVWB2_GRPM0p26_LBSPPB256_LPB4_NLCA1_PGR1_PLR1_SU8_SUS256_SVW4_TT4_224_VW4_VWB2_WGMn32
    SolutionIndex: 49
    SolutionNameMin: Cijk_Ailk_Bljk_HHS_BH_MT256x112x64_MI16x16x16x1_SN_1LDSB0_ELFLR0_GLVWA4_GLVWB4_GRPM0p30_LBSPPB128_LPB4_NLCA1_PGR1_PLR1_SU0_SUS0_SVW4_TT4_112_VW4_VWB1_WGM32
    SolutionIndex: 50
    SolutionNameMin: Cijk_Ailk_Bljk_HHS_BH_MT256x224x64_MI16x16x16x1_SN_1LDSB0_ELFLRn20_GLVWA2_GLVWB2_GRPM0p40_LBSPPB256_LPB4_NLCA2_PGR1_PLR1_SU8_SUS256_SVW2_TT4_224_VW2_VWB2_WGM1
    SolutionIndex: 51
    SolutionNameMin: Cijk_Ailk_Bljk_HHS_BH_MT256x224x64_MI16x16x16x1_SN_1LDSB1_ELFLRn20_GLVWA4_GLVWB2_GRPM0p26_LBSPPB256_LPB4_NLCA1_PGR1_PLR1_SU0_SUS0_SVW4_TT4_224_VW4_VWB2_WGM32
    SolutionIndex: 52
    SolutionNameMin: Cijk_Ailk_Bljk_HHS_BH_MT256x224x64_MI16x16x16x1_SN_1LDSB1_ELFLRn20_GLVWA2_GLVWB2_GRPM0p40_LBSPPB256_LPB4_NLCA2_PGR1_PLR1_SU0_SUS0_SVW2_TT4_224_VW2_VWB2_WGM1
    SolutionIndex: 53
    SolutionNameMin: Cijk_Ailk_Bljk_HHS_BH_MT256x224x64_MI16x16x16x1_SN_1LDSB0_ELFLR0_GLVWA4_GLVWB2_GRPM0p26_LBSPPB256_LPB4_NLCA1_PGR1_PLR1_SU0_SUS0_SVW4_TT4_224_VW4_VWB2_WGM32
    SolutionIndex: 54
    SolutionNameMin: Cijk_Ailk_Bljk_HHS_BH_MT256x128x32_MI16x16x16x1_SN_1LDSB0_ELFLR0_GLVWA4_GLVWB4_GRPM0p24_LBSPPB128_LPB4_NLCA1_PGR1_PLR1_SU0_SUS0_SVW4_TT4_128_VW4_VWB2_WGM32
    SolutionIndex: 55
    SolutionNameMin: Cijk_Ailk_Bljk_HHS_BH_MT256x256x64_MI16x16x16x1_SN_1LDSB1_ELFLRn20_GLVWA4_GLVWB2_GRPM0p26_LBSPPB256_LPB4_NLCA1_PGR1_PLR1_SU8_SUS256_SVW4_TT4_256_VW4_VWB2_WGM32
    SolutionIndex: 56
    SolutionNameMin: Cijk_Ailk_Bljk_HHS_BH_MT256x112x32_MI16x16x16x1_SN_1LDSB0_ELFLRn20_GLVWA2_GLVWB2_GRPM0p30_LBSPPB128_LPB4_NLCA2_PGR1_PLR3_SU0_SUS0_SVW2_TT4_112_VW2_VWB1_WGM32
    SolutionIndex: 57
    SolutionNameMin: Cijk_Ailk_Bljk_HHS_BH_MT256x224x64_MI16x16x16x1_SN_1LDSB1_ELFLRn20_GLVWA2_GLVWB2_GRPM0p50_LBSPPB256_LPB4_NLCA2_PGR1_PLR1_SU0_SUS0_SVW2_TT4_224_VW2_VWB2_WGM32
    SolutionIndex: 58
    SolutionNameMin: Cijk_Ailk_Bljk_HHS_BH_MT256x112x32_MI16x16x16x1_SN_1LDSB1_ELFLR0_GLVWA4_GLVWB2_GRPM0p50_LBSPPB128_LPB4_NLCA1_PGR1_PLR3_SU8_SUS256_SVW4_TT4_112_VW4_VWB1_WGMn32
    SolutionIndex: 59
    SolutionNameMin: Cijk_Ailk_Bljk_HHS_BH_MT256x224x64_MI16x16x16x1_SN_1LDSB0_ELFLR0_GLVWA4_GLVWB2_GRPM0p30_LBSPPB256_LPB4_NLCA1_PGR1_PLR1_SU8_SUS256_SVW4_TT4_224_VW4_VWB2_WGMn32
    SolutionIndex: 60
    SolutionNameMin: Cijk_Ailk_Bljk_HHS_BH_MT256x224x64_MI16x16x16x1_SN_1LDSB1_ELFLRn20_GLVWA2_GLVWB2_GRPM0p40_LBSPPB256_LPB4_NLCA2_PGR1_PLR1_SU8_SUS256_SVW2_TT4_224_VW2_VWB2_WGM1
    SolutionIndex: 61
    SolutionNameMin: Cijk_Ailk_Bljk_HHS_BH_MT256x224x64_MI16x16x16x1_SN_1LDSB1_ELFLRn20_GLVWA4_GLVWB2_GRPM0p30_LBSPPB256_LPB4_NLCA1_PGR1_PLR1_SU8_SUS256_SVW4_TT4_224_VW4_VWB2_WGMn32
    SolutionIndex: 62
    SolutionNameMin: Cijk_Ailk_Bljk_HHS_BH_MT256x256x64_MI16x16x16x1_SN_1LDSB1_DTVA1_ELFLRn20_GLVWA4_GLVWB2_GRPM0p24_LBSPPB256_LPB4_LRVW4_PGR1_PLR1_SU0_SUS0_TT4_256_WSGRA0_WGM32
    SolutionIndex: 63
    SolutionNameMin: Cijk_Ailk_Bljk_HHS_BH_MT256x256x64_MI16x16x16x1_SN_1LDSB1_DTVA1_ELFLRn20_GLVWA4_GLVWB2_GRPM0p26_LBSPPB256_LPB4_LRVW4_PGR1_PLR1_SU0_SUS0_TT4_256_WSGRA0_WGM32
    SolutionIndex: 64
    SolutionNameMin: Cijk_Ailk_Bljk_HHS_BH_MT256x256x64_MI16x16x16x1_SN_1LDSB1_DTVA1_ELFLR0_GLVWA4_GLVWB2_GRPM0p28_LBSPPB256_LPB4_LRVW4_PGR1_PLR1_SU8_SUS256_TT4_256_WSGRA0_WGM32
    SolutionIndex: 65
    SolutionNameMin: Cijk_Ailk_Bljk_HHS_BH_MT256x256x64_MI16x16x16x1_SN_1LDSB1_DTVA1_ELFLR0_GLVWA4_GLVWB2_GRPM0p26_LBSPPB256_LPB4_LRVW4_PGR1_PLR1_SU8_SUS256_TT4_256_WSGRA0_WGM32
    SolutionIndex: 66
    SolutionNameMin: Cijk_Ailk_Bljk_HHS_BH_MT256x256x64_MI16x16x16x1_SN_1LDSB1_DTVA1_ELFLRn20_GLVWA4_GLVWB2_GRPM0p26_LBSPPB256_LPB4_LRVW4_PGR1_PLR1_SU0_SUS0_TT4_256_WSGRA0_WGMn32
    SolutionIndex: 67
    SolutionNameMin: Cijk_Ailk_Bljk_HHS_BH_MT256x256x64_MI16x16x16x1_SN_1LDSB1_DTVA1_ELFLR0_GLVWA4_GLVWB2_GRPM0p24_LBSPPB256_LPB4_LRVW4_PGR1_PLR1_SU0_SUS0_TT4_256_WSGRA0_WGM32
    SolutionIndex: 68
    SolutionNameMin: Cijk_Ailk_Bljk_HHS_BH_MT256x256x64_MI16x16x16x1_SN_1LDSB1_DTVA1_ELFLR0_GLVWA4_GLVWB2_GRPM0p26_LBSPPB256_LPB4_LRVW4_PGR1_PLR1_SU0_SUS0_TT4_256_WSGRA0_WGM32
    SolutionIndex: 69
    SolutionNameMin: Cijk_Ailk_Bljk_HHS_BH_MT128x128x64_MI16x16x16x1_SN_ELFLRn20_GLVWB8_GRPM0p45_LBSPPB256_LPB16_LRVW8_MIAV0_PGR2_PLR5_SU8_SUS128_WGM16
    SolutionIndex: 70
    SolutionNameMin: Cijk_Ailk_Bljk_HHS_BH_MT128x128x64_MI16x16x16x1_SN_ELFLR0_GLVWB2_GRPM0p40_LBSPPB256_LPB16_LRVW8_MIAV1_PGR2_PLR5_SU8_SUS128_WGM16
    SolutionIndex: 71
    SolutionNameMin: Cijk_Ailk_Bljk_HHS_BH_MT128x128x64_MI16x16x16x1_SN_ELFLR0_GLVWB8_GRPM0p70_LBSPPB256_LPB16_LRVW8_MIAV0_PGR2_PLR5_SU8_SUS128_WGM16
    SolutionIndex: 72
    SolutionNameMin: Cijk_Ailk_Bljk_HHS_BH_MT128x128x64_MI16x16x16x1_SN_ELFLR0_GLVWB2_GRPM0p80_LBSPPB256_LPB4_LRVW4_MIAV0_PGR2_PLR5_SU8_SUS128_WGM16
    SolutionIndex: 73
    SolutionNameMin: Cijk_Ailk_Bljk_HHS_BH_MT32x32x64_MI16x16x16x1_SN_CLR1_EPS1_ELFLR4_EMLL2_GLS1_LBSPPA512_LBSPPB128_NTC0_NTD0_NEPBS8_SU16_SPO0_SSO1_TT1_16_VWB1_WG32_8_1
    SolutionIndex: 74
    SolutionNameMin: Cijk_Ailk_Bljk_HHS_BH_MT32x32x64_MI16x16x16x1_SN_CLR0_EPS1_ELFLR0_EMLL0_GLS0_LBSPPA512_LBSPPB128_NTC2_NTD2_NEPBS8_SU64_SPO1_SSO1_TT1_16_VWB1_WG32_8_1
    SolutionIndex: 75
    SolutionNameMin: Cijk_Ailk_Bljk_HHS_BH_MT32x32x64_MI16x16x16x1_SN_CLR0_EPS0_ELFLR4_EMLL0_GLS0_LBSPPA512_LBSPPB128_NTC2_NTD2_NEPBS8_SU4_SPO0_SSO0_TT1_16_VWB1_WG32_8_1
    SolutionIndex: 76
    SolutionNameMin: Cijk_Ailk_Bljk_HHS_BH_MT64x32x64_MI16x16x16x1_SN_CLR1_EPS1_ELFLR0_EMLL2_GLS0_LBSPPA1024_LBSPPB256_NTC2_NTD2_NEPBS8_SU8_SPO0_SSO1_TT1_32_VWB2_WG64_4_1
    SolutionIndex: 77
    SolutionNameMin: Cijk_Ailk_Bljk_HHS_BH_MT256x256x32_MI32x32x8x1_SN_LBSPPB128_SSO0_WGM32
- - - [6144, 4864, 1, 4096]
    - [43, 74.92]
  - - [6144, 4864, 1, 8192]
    - [44, 80.797]
  - - [6144, 4864, 1, 16384]
    - [45, 76.745]
  - - [6144, 4864, 1, 4352]
    - [46, 77.945]
  - - [6144, 4864, 1, 8448]
    - [47, 79.917]
  - - [6144, 4864, 1, 16640]
    - [48, 75.823]
  - - [4864, 3072, 1, 4096]
    - [49, 67.914]
  - - [4864, 3072, 1, 8192]
    - [50, 69.404]
  - - [4864, 3072, 1, 16384]
    - [51, 73.003]
  - - [4864, 3072, 1, 4352]
    - [52, 60.462]
  - - [4864, 3072, 1, 8448]
    - [51, 67.685]
  - - [4864, 3072, 1, 16640]
    - [53, 72.472]
  - - [2048, 16, 1, 1024]
    - [26, 0.55]
  - - [2048, 16, 1, 8192]
    - [0, 1.462]
  - - [2048, 16, 1, 65536]
    - [27, 7.123]
  - - [8192, 16, 1, 1024]
    - [1, 1.518]
  - - [8192, 16, 1, 8192]
    - [28, 6.553]
  - - [8192, 16, 1, 65536]
    - [29, 9.141]
  - - [2048, 2048, 1, 65536]
    - [32, 71.185]
  - - [2048, 8192, 1, 65536]
    - [34, 84.008]
  - - [8192, 2048, 1, 65536]
    - [37, 81.38]
  - - [2048, 2048, 1, 1024]
    - [30, 37.919]
  - - [2048, 2048, 1, 8192]
    - [31, 57.852]
  - - [2048, 8192, 1, 1024]
    - [2, 67.471]
  - - [2048, 8192, 1, 8192]
    - [33, 75.304]
  - - [8192, 2048, 1, 1024]
    - [35, 44.076]
  - - [8192, 2048, 1, 8192]
    - [36, 73.999]
  - - [8192, 8192, 1, 1024]
    - [38, 63.727]
  - - [8192, 8192, 1, 8192]
    - [39, 83.146]
  - - [8192, 8192, 1, 65536]
    - [40, 88.201]
  - - [9728, 8192, 1, 1024]
    - [54, 61.074]
  - - [9728, 8192, 1, 8192]
    - [55, 86.001]
  - - [9728, 8192, 1, 65536]
    - [62, 64.303]
  - - [4864, 4096, 1, 8192]
    - [42, 80.501]
  - - [16, 16, 1, 1024]
    - [17, 0.007]
  - - [16, 16, 1, 8192]
    - [18, 0.041]
  - - [16, 16, 1, 65536]
    - [19, 0.268]
  - - [16, 2048, 1, 1024]
    - [20, 0.791]
  - - [16, 2048, 1, 8192]
    - [21, 2.962]
  - - [16, 2048, 1, 65536]
    - [22, 6.595]
  - - [16, 8192, 1, 1024]
    - [23, 2.162]
  - - [16, 8192, 1, 8192]
    - [24, 5.746]
  - - [16, 8192, 1, 65536]
    - [25, 7.887]
  - - [9728, 8192, 1, 16384]
    - [63, 67.941]
  - - [4864, 3072, 1, 2048]
    - [56, 90.463]
  - - [4864, 3072, 1, 6144]
    - [57, 87.873]
  - - [3072, 4864, 1, 2048]
    - [58, 56.094]
  - - [3072, 4864, 1, 4096]
    - [59, 56.774]
  - - [3072, 4864, 1, 6144]
    - [60, 54.472]
  - - [3072, 4864, 1, 8192]
    - [61, 61.958]
  - - [4096, 4096, 1, 8192]
    - [41, 80.377]
  - - [9728, 8192, 1, 16416]
    - [55, 88.752]
  - - [9728, 12288, 1, 4096]
    - [64, 80.635]
  - - [9728, 12288, 1, 8192]
    - [65, 85.656]
  - - [9728, 12288, 1, 8256]
    - [66, 87.673]
  - - [9728, 12288, 1, 16416]
    - [65, 88.067]
  - - [14592, 12288, 1, 8192]
    - [63, 84.803]
  - - [14592, 12288, 1, 8256]
    - [67, 85.018]
  - - [14592, 12288, 1, 16416]
    - [68, 87.403]
  - - [12288, 9728, 1, 16416]
    - [66, 88.868]
  - - [1216, 1024, 1, 1024]
    - [3, 15.0]
  - - [1216, 1024, 1, 2048]
    - [4, 14.8]
  - - [1216, 4096, 1, 4096]
    - [5, 22.3]
  - - [1024, 2432, 1, 2048]
    - [6, 15.8]
  - - [2432, 512, 1, 1024]
    - [7, 12.9]
  - - [4864, 256, 1, 1024]
    - [8, 12.2]
  - - [4864, 256, 1, 2048]
    - [9, 14.8]
  - - [512, 608, 1, 512]
    - [10, 2.6]
  - - [512, 608, 1, 1024]
    - [11, 4.9]
  - - [608, 512, 1, 512]
    - [12, 2.8]
  - - [608, 512, 1, 1024]
    - [13, 5.2]
  - - [1216, 256, 1, 512]
    - [14, 3.7]
  - - [2432, 2048, 1, 1024]
    - [69, 40.381]
  - - [2432, 2048, 1, 2048]
    - [70, 45.426]
  - - [2048, 2432, 1, 1024]
    - [71, 42.143]
  - - [2048, 2432, 1, 2048]
    - [72, 45.492]
  - - [9728, 128, 1, 1024]
    - [15, 20.0]
  - - [9728, 128, 1, 2048]
    - [16, 23.7]
  - - [4864, 64, 1, 512]
    - [73, 2.7]
  - - [2432, 128, 1, 512]
    - [74, 4.3]
  - - [2432, 128, 1, 1024]
    - [75, 6.2]
  - - [9728, 64, 1, 1024]
    - [76, 10.1]
  - - [98304, 98304, 1, 98304]
    - [77, 86.12]
- null
- null
- DeviceEfficiency
