library/src/blas3/Tensile/Logic/asm_full/aquavanjaram942X/aquavanjaram942_Cijk_Ailk_Bjlk_HHS_BH.yaml
- {MinimumRequiredVersion: 4.36.0}
- aquavanjaram942
- {Architecture: gfx942, IsAPU: 0}
- [Device 74a1]
    SolutionIndex: 0
    SolutionNameMin: Cijk_Ailk_Bjlk_HHS_BH_MT128x128x32_MI16x16x16x1_SN_AMAS3_CLR1_GLVWA8_GLVWB4_LBSPPA0_LPA0_MIAV0_PLR3_SU0_SUS0_SSO0_SVW4_TT8_32_VW4_VFLRP1_WSGRA0_WG16_16_1_WGM40
    SolutionIndex: 1
    SolutionNameMin: Cijk_Ailk_Bjlk_HHS_BH_MT128x128x32_MI16x16x16x1_SN_AMAS3_CLR1_GLVWA2_GLVWB8_LBSPPA0_LPA0_MIAV1_PLR3_SU0_SUS0_SSO0_SVW4_TT4_64_VW4_VFLRP1_WSGRA0_WG32_8_1_WGM40
    SolutionIndex: 2
    SolutionNameMin: Cijk_Ailk_Bjlk_HHS_BH_MT128x128x32_MI16x16x16x1_SN_AMAS3_CLR1_GLVWA8_GLVWB2_LBSPPA0_LPA0_MIAV0_PLR3_SU16_SUS512_SSO4_SVW4_TT8_32_VW4_VFLRP1_WSGRA0_WG16_16_1_WGM1
    SolutionIndex: 3
    SolutionNameMin: Cijk_Ailk_Bjlk_HHS_BH_MT128x128x32_MI16x16x16x1_SN_AMAS3_CLR1_GLVWA8_GLVWB8_LBSPPA1024_LPA32_MIAV1_PLR3_SU0_SUS0_SSO4_SVW2_TT4_64_VW2_VFLRP1_WSGRA0_WG32_8_1_WGM1
    SolutionIndex: 4
    SolutionNameMin: Cijk_Ailk_Bjlk_HHS_BH_MT128x128x32_MI16x16x16x1_SN_AMAS0_CLR0_GLVWA8_GLVWB8_LBSPPA1024_LPA16_MIAV1_PLR3_SU0_SUS0_SSO0_SVW1_TT4_64_VW1_VFLRP0_WSGRA0_WG32_8_1_WGM1
    SolutionIndex: 5
    SolutionNameMin: Cijk_Ailk_Bjlk_HHS_BH_MT128x128x32_MI16x16x16x1_SN_AMAS0_GLVWA8_GLVWB8_LPA16_NTC0_NTD3_PLR3_SU0_SUS0_SSO0_SVW1_TT4_64_VW1_WSGRA0_WG32_8_1_WGM1
    SolutionIndex: 6
    SolutionNameMin: Cijk_Ailk_Bjlk_HHS_BH_MT32x32x64_MI16x16x16x1_SN_1LDSB0_AMAS3_CLR1_ELFLR4_GLVWA4_GLVWB4_GRVW4_GLS1_LBSPPA256_LPA32_LPB16_MIAV1_PLR3_SS1_SU8_SUS128_SVW2_TT2_16_VW2_VFLRP1_WG16_8_2_WGM16
    SolutionIndex: 7
    SolutionNameMin: Cijk_Ailk_Bjlk_HHS_BH_MT32x32x64_MI16x16x16x1_SN_1LDSB0_AMAS3_CLR1_ELFLR4_GLVWA2_GLVWB2_GRVW2_GLS1_LBSPPA256_LPA32_LPB16_MIAV0_PLR3_SS1_SU0_SUS0_SVW2_TT2_16_VW2_VFLRP1_WG16_8_2_WGM1
    SolutionIndex: 8
    SolutionNameMin: Cijk_Ailk_Bjlk_HHS_BH_MT32x32x64_MI16x16x16x1_SN_1LDSB0_AMAS3_CLR1_ELFLR0_GLVWA2_GLVWB2_GRVW2_GLS1_LBSPPA256_LPA32_LPB16_MIAV1_PLR3_SS1_SU0_SUS0_SVW2_TT2_16_VW2_VFLRP1_WG16_8_2_WGM16
    SolutionIndex: 9
    SolutionNameMin: Cijk_Ailk_Bjlk_HHS_BH_MT32x32x64_MI16x16x16x1_SN_1LDSB0_AMAS3_CLR1_ELFLR4_GLVWA8_GLVWB8_GRVW8_GLS0_LBSPPA256_LPA32_LPB16_MIAV1_PLR3_SS1_SU8_SUS128_SVW2_TT2_16_VW2_VFLRP1_WG16_8_2_WGM32
    SolutionIndex: 10
    SolutionNameMin: Cijk_Ailk_Bjlk_HHS_BH_MT64x64x64_MI32x32x8x1_SN_AMAS3_CLR1_ELFLR0_GLVWA8_GLVWB8_GRVW8_GLS1_MIAV0_PLR5_SS1_SU0_SUS0_SVW2_VW2_VFLRP1_WGM32
    SolutionIndex: 11
    SolutionNameMin: Cijk_Ailk_Bjlk_HHS_BH_MT64x64x64_MI32x32x8x1_SN_AMAS3_CLR1_ELFLR0_GLVWA8_GLVWB8_GRVW8_GLS0_MIAV0_PLR5_SS1_SU0_SUS0_SVW2_VW2_VFLRP1_WGM16
    SolutionIndex: 12
    SolutionNameMin: Cijk_Ailk_Bjlk_HHS_BH_MT32x32x64_MI32x32x8x1_SN_CLR0_ELFLR0_GLVWA2_GLVWB2_GRVW2_GLS1_LBSPPA0_LBSPPB0_LPA0_LPB0_MIAV1_PLR1_SS1_SU8_SUS128_SVW1_TT1_32_VWB1_VFLRP1_WG32_2_4_WGM16
    SolutionIndex: 13
    SolutionNameMin: Cijk_Ailk_Bjlk_HHS_BH_MT32x32x64_MI16x16x16x1_SN_1LDSB1_AMAS0_CLR1_ELFLR0_GLVWA4_GLVWB4_GRVW4_GLS0_LPA16_LPB32_MIAV1_SS1_SU0_SUS0_SVW1_TT2_32_VW1_VWB2_VFLRP1_WG16_4_4_WGM16
    SolutionIndex: 14
    SolutionNameMin: Cijk_Ailk_Bjlk_HHS_BH_MT32x32x64_MI16x16x16x1_SN_1LDSB0_AMAS3_CLR1_ELFLR4_GLVWA2_GLVWB2_GRVW2_GLS0_LPA32_LPB32_MIAV0_SS0_SU8_SUS128_SVW4_TT2_32_VW2_VWB2_VFLRP1_WG16_4_4_WGM16
    SolutionIndex: 15
    SolutionNameMin: Cijk_Ailk_Bjlk_HHS_BH_MT32x32x64_MI16x16x16x1_SN_1LDSB1_AMAS3_CLR1_ELFLR0_GLVWA2_GLVWB2_GRVW2_GLS1_LPA32_LPB32_MIAV0_SS1_SU8_SUS128_SVW2_TT2_32_VW2_VWB2_VFLRP1_WG16_4_4_WGM16
    SolutionIndex: 16
    SolutionNameMin: Cijk_Ailk_Bjlk_HHS_BH_MT32x32x64_MI16x16x16x1_SN_1LDSB0_AMAS3_CLR1_ELFLR0_GLVWA4_GLVWB4_GRVW4_GLS0_LPA32_LPB16_MIAV0_SS1_SU0_SUS0_SVW2_TT2_32_VW2_VWB1_VFLRP1_WG16_4_4_WGM16
    SolutionIndex: 17
    SolutionNameMin: Cijk_Ailk_Bjlk_HHS_BH_MT64x64x64_MI16x16x16x1_SN_AMAS3_CLR1_ELFLR0_GLVWA8_GLVWB8_GRVW8_GLS0_LBSPPA0_LBSPPB512_LPA0_LPB16_MIAV0_PLR5_SS1_SU0_SUS0_SVW4_TT4_16_VW4_VWB1_VFLRP1_WG16_16_1_WGM32
    SolutionIndex: 18
    SolutionNameMin: Cijk_Ailk_Bjlk_HHS_BH_MT64x64x64_MI16x16x16x1_SN_AMAS3_CLR1_ELFLR0_GLVWA8_GLVWB8_GRVW8_GLS0_LBSPPA0_LBSPPB512_LPA0_LPB16_MIAV0_PLR5_SS1_SU8_SUS128_SVW4_TT4_16_VW4_VWB1_VFLRP1_WG16_16_1_WGM1
    SolutionIndex: 19
    SolutionNameMin: Cijk_Ailk_Bjlk_HHS_BH_MT64x64x64_MI16x16x16x1_SN_AMAS3_CLR1_ELFLR4_GLVWA8_GLVWB8_GRVW8_GLS0_LBSPPA0_LBSPPB512_LPA0_LPB16_MIAV0_PLR1_SS1_SU0_SUS0_SVW4_TT4_16_VW4_VWB1_VFLRP1_WG16_16_1_WGM1
    SolutionIndex: 20
    SolutionNameMin: Cijk_Ailk_Bjlk_HHS_BH_MT64x64x64_MI16x16x16x1_SN_AMAS3_CLR1_ELFLR0_GLVWA8_GLVWB8_GRVW8_GLS0_LBSPPA0_LBSPPB512_LPA0_LPB16_MIAV1_PLR1_SS1_SU0_SUS0_SVW4_TT4_16_VW4_VWB1_VFLRP1_WG16_16_1_WGM32
    SolutionIndex: 21
    SolutionNameMin: Cijk_Ailk_Bjlk_HHS_BH_MT128x128x32_MI16x16x16x1_SN_CLR1_ELFLR4_GLVWA8_GLVWB8_GRVW8_GLS0_LBSPPA0_LBSPPB1024_LPA0_LPB32_MIAV0_SS1_SU8_SUS128_SVW4_VW4_VWB2_VFLRP1
    SolutionIndex: 22
    SolutionNameMin: Cijk_Ailk_Bjlk_HHS_BH_MT128x128x32_MI16x16x16x1_SN_CLR1_ELFLR4_GLVWA8_GLVWB8_GRVW8_GLS1_LBSPPA1024_LBSPPB0_LPA32_LPB0_MIAV1_SS0_SU8_SUS128_SVW4_VW2_VWB4_VFLRP1
    SolutionIndex: 23
    SolutionNameMin: Cijk_Ailk_Bjlk_HHS_BH_MT128x128x32_MI16x16x16x1_SN_CLR1_ELFLR0_GLVWA8_GLVWB8_GRVW8_GLS1_LBSPPA0_LBSPPB0_LPA0_LPB0_MIAV0_SS1_SU0_SUS0_SVW4_VW4_VWB4_VFLRP1
    SolutionIndex: 24
    SolutionNameMin: Cijk_Ailk_Bjlk_HHS_BH_MT128x128x32_MI16x16x16x1_SN_CLR1_ELFLR0_GLVWA8_GLVWB8_GRVW8_GLS0_LBSPPA0_LBSPPB0_LPA0_LPB0_MIAV1_SS1_SU0_SUS0_SVW4_VW4_VWB4_VFLRP1
    SolutionIndex: 25
    SolutionNameMin: Cijk_Ailk_Bjlk_HHS_BH_MT32x32x64_MI16x16x16x1_SN_1LDSB0_CLR1_ELFLR0_GLVWA2_GLVWB2_GRVW2_GLS0_LPB32_MIAV0_PLR1_SU8_SUS128_TT1_32_VWB2_VFLRP1_WG32_4_2_WGM32
    SolutionIndex: 26
    SolutionNameMin: Cijk_Ailk_Bjlk_HHS_BH_MT32x32x64_MI16x16x16x1_SN_1LDSB0_CLR1_ELFLR4_GLVWA2_GLVWB2_GRVW2_GLS1_LPB32_MIAV1_PLR1_SU0_SUS0_TT1_32_VWB2_VFLRP1_WG32_4_2_WGM16
    SolutionIndex: 27
    SolutionNameMin: Cijk_Ailk_Bjlk_HHS_BH_MT256x256x64_MI16x16x16x1_SN_1LDSB1_DTVA0_ELFLR0_GRPM1_NLCB1_PGR2_PLR5_TT8_128_WSGRA1_WG32_8_1_WGM1
    SolutionIndex: 28
    SolutionNameMin: Cijk_Ailk_Bjlk_HHS_BH_MT256x256x64_MI16x16x16x1_SN_ELFLR4_NLCB2_WGM16
    SolutionIndex: 29
    SolutionNameMin: Cijk_Ailk_Bjlk_HHS_BH_MT256x256x64_MI16x16x16x1_SN_ELFLR12_NLCB1_WGM1
    SolutionIndex: 30
    SolutionNameMin: Cijk_Ailk_Bjlk_HHS_BH_MT256x256x64_MI16x16x16x1_SN_ELFLR12_NLCB1_WGM32
    SolutionIndex: 31
    SolutionNameMin: Cijk_Ailk_Bjlk_HHS_BH_MT256x256x64_MI16x16x16x1_SN_ELFLR8_NLCB2_WGM32
    SolutionIndex: 32
    SolutionNameMin: Cijk_Ailk_Bjlk_HHS_BH_MT256x256x64_MI16x16x16x1_SN_ELFLR4_NLCB2_WGM32
    SolutionIndex: 33
    SolutionNameMin: Cijk_Ailk_Bjlk_HHS_BH_MT256x256x64_MI16x16x16x1_SN_ELFLR12_NLCB2_WGM32
    SolutionIndex: 34
    SolutionNameMin: Cijk_Ailk_Bjlk_HHS_BH_MT256x256x64_MI16x16x16x1_SN_ELFLR8_NLCB1_WGM32
    SolutionIndex: 35
    SolutionNameMin: Cijk_Ailk_Bjlk_HHS_BH_MT256x256x64_MI16x16x16x1_SN_ELFLR4_NLCB1_WGM1
    SolutionIndex: 36
    SolutionNameMin: Cijk_Ailk_Bjlk_HHS_BH_MT256x128x32_MI16x16x16x1_SN_1LDSB0_DTVA1_ELFLRn20_GRPM0p30_NLCB1_PGR1_PLR1_TT4_128_WSGRA0_WG64_4_1_WGM1
    SolutionIndex: 37
    SolutionNameMin: Cijk_Ailk_Bjlk_HHS_BH_MT256x128x32_MI16x16x16x1_SN_1LDSB1_DTVA1_ELFLRn20_GRPM0p24_NLCB1_PGR1_PLR1_TT4_128_WSGRA0_WG64_4_1_WGM1
    SolutionIndex: 38
    SolutionNameMin: Cijk_Ailk_Bjlk_HHS_BH_MT256x128x32_MI16x16x16x1_SN_1LDSB0_DTVA1_ELFLRn20_GRPM0p24_NLCB1_PGR1_PLR3_TT4_128_WSGRA0_WG64_4_1_WGM1
    SolutionIndex: 39
    SolutionNameMin: Cijk_Ailk_Bjlk_HHS_BH_MT256x128x32_MI16x16x16x1_SN_1LDSB1_DTVA1_ELFLRn20_GRPM0p30_NLCB2_PGR1_PLR1_TT4_128_WSGRA0_WG64_4_1_WGM1
    SolutionIndex: 40
    SolutionNameMin: Cijk_Ailk_Bjlk_HHS_BH_MT256x128x32_MI16x16x16x1_SN_1LDSB0_DTVA1_ELFLRn20_GRPM0p26_NLCB1_PGR1_PLR1_TT4_128_WSGRA0_WG64_4_1_WGM1
    SolutionIndex: 41
    SolutionNameMin: Cijk_Ailk_Bjlk_HHS_BH_MT256x128x32_MI16x16x16x1_SN_1LDSB0_DTVA1_ELFLRn20_GRPM0p24_NLCB1_PGR1_PLR1_TT4_128_WSGRA0_WG64_4_1_WGM1
    SolutionIndex: 42
    SolutionNameMin: Cijk_Ailk_Bjlk_HHS_BH_MT256x256x64_MI16x16x16x1_SN_ELFLR12_NLCB2_TT8_128_WGM16
    SolutionIndex: 43
    SolutionNameMin: Cijk_Ailk_Bjlk_HHS_BH_MT256x256x64_MI16x16x16x1_SN_ELFLR12_NLCB2_TT8_128_WGM32
    SolutionIndex: 44
    SolutionNameMin: Cijk_Ailk_Bjlk_HHS_BH_MT256x256x64_MI16x16x16x1_SN_ELFLR0_NLCB1_TT8_128_WGM16
    SolutionIndex: 45
    SolutionNameMin: Cijk_Ailk_Bjlk_HHS_BH_MT256x256x64_MI16x16x16x1_SN_ELFLR4_NLCB2_TT8_128_WGM32
    SolutionIndex: 46
    SolutionNameMin: Cijk_Ailk_Bjlk_HHS_BH_MT256x256x64_MI16x16x16x1_SN_ELFLR4_NLCB1_TT8_128_WGM16
    SolutionIndex: 47
    SolutionNameMin: Cijk_Ailk_Bjlk_HHS_BH_MT256x128x32_MI16x16x16x1_SN_1LDSB0_DTVA1_ELFLRn20_GRPM0p24_NLCB1_PGR1_PLR3_TT4_128_WSGRA0_WG64_4_1_WGM16
    SolutionIndex: 48
    SolutionNameMin: Cijk_Ailk_Bjlk_HHS_BH_MT256x256x64_MI16x16x16x1_SN_ELFLR12_NLCB1_TT8_128_WGM32
    SolutionIndex: 49
    SolutionNameMin: Cijk_Ailk_Bjlk_HHS_BH_MT256x128x32_MI16x16x16x1_SN_1LDSB0_DTVA1_ELFLRn20_GRPM0p26_NLCB1_PGR1_PLR3_TT4_128_WSGRA0_WG64_4_1_WGMn16
    SolutionIndex: 50
    SolutionNameMin: Cijk_Ailk_Bjlk_HHS_BH_MT256x256x64_MI16x16x16x1_SN_ELFLR0_NLCB2_TT8_128_WGMn32
    SolutionIndex: 51
    SolutionNameMin: Cijk_Ailk_Bjlk_HHS_BH_MT256x256x64_MI16x16x16x1_SN_ELFLR12_NLCB1_TT8_128_WGMn32
    SolutionIndex: 52
    SolutionNameMin: Cijk_Ailk_Bjlk_HHS_BH_MT256x256x64_MI16x16x16x1_SN_ELFLR12_NLCB2_TT8_128_WGMn16
    SolutionIndex: 53
    SolutionNameMin: Cijk_Ailk_Bjlk_HHS_BH_MT256x256x64_MI16x16x16x1_SN_ELFLR8_NLCB2_TT8_128_WGM32
    SolutionIndex: 54
    SolutionNameMin: Cijk_Ailk_Bjlk_HHS_BH_MT256x256x64_MI16x16x16x1_SN_ELFLR0_NLCB2_TT8_128_WGM32
    SolutionIndex: 55
    SolutionNameMin: Cijk_Ailk_Bjlk_HHS_BH_MT256x256x64_MI16x16x16x1_SN_ELFLR0_NLCB1_TT8_128_WGM1
    SolutionIndex: 56
    SolutionNameMin: Cijk_Ailk_Bjlk_HHS_BH_MT16x128x32_MI16x16x16x1_SN_1LDSB0_DTVB1_GLVWB2_GSU5_GSUAMB_LBSPPB0_LPB0_NLCB1_PGR2_PLR1_TT1_32_VWB2_WG16_16_1
    SolutionIndex: 57
    SolutionNameMin: Cijk_Ailk_Bjlk_HHS_BH_MT16x128x32_MI16x16x16x1_SN_1LDSB0_DTVB1_GLVWB2_GSU10_LBSPPB0_LPB0_NLCB1_PGR2_PLR1_TT1_32_VWB2_WG16_16_1
    SolutionIndex: 58
    SolutionNameMin: Cijk_Ailk_Bjlk_HHS_BH_MT16x64x64_MI16x16x16x1_SN_GSU15_LBSPPB512_LPB16_PLR5_SS0_SU0_SUS0_SVW4_TT1_16_VWB1_WG16_16_1
- - - [6144, 4864, 1, 4096]
    - [36, 79.947]
  - - [6144, 4864, 1, 8192]
    - [37, 82.197]
  - - [6144, 4864, 1, 16384]
    - [38, 86.295]
  - - [6144, 4864, 1, 4352]
    - [39, 79.01]
  - - [6144, 4864, 1, 8448]
    - [40, 83.061]
  - - [6144, 4864, 1, 16640]
    - [41, 86.024]
  - - [4864, 3072, 1, 4096]
    - [42, 51.377]
  - - [4864, 3072, 1, 8192]
    - [43, 57.33]
  - - [4864, 3072, 1, 16384]
    - [44, 62.895]
  - - [4864, 3072, 1, 4352]
    - [45, 51.935]
  - - [4864, 3072, 1, 8448]
    - [43, 57.373]
  - - [4864, 3072, 1, 16640]
    - [46, 62.692]
  - - [8192, 8192, 1, 8192]
    - [29, 69.02]
  - - [9728, 8192, 1, 8192]
    - [30, 79.958]
  - - [4864, 3072, 1, 2048]
    - [47, 54.971]
  - - [4864, 3072, 1, 6144]
    - [48, 55.071]
  - - [3072, 4864, 1, 2048]
    - [49, 55.72]
  - - [3072, 4864, 1, 4096]
    - [50, 54.939]
  - - [3072, 4864, 1, 6144]
    - [51, 58.442]
  - - [3072, 4864, 1, 8192]
    - [52, 59.46]
  - - [2, 7168, 1, 8192]
    - [56, 0.799]
  - - [2, 3584, 1, 8192]
    - [57, 0.583]
  - - [2, 1280, 1, 8192]
    - [58, 0.28]
  - - [7168, 28672, 1, 65536]
    - [53, 81.625]
  - - [28672, 7168, 1, 65536]
    - [54, 80.538]
  - - [7168, 21504, 1, 65536]
    - [53, 83.605]
  - - [7168, 7168, 1, 65536]
    - [55, 74.551]
  - - [7168, 50432, 1, 65536]
    - [53, 82.481]
  - - [4096, 4096, 1, 8192]
    - [27, 66.711]
  - - [4864, 4096, 1, 8192]
    - [28, 73.688]
  - - [9728, 8192, 1, 16416]
    - [31, 83.589]
  - - [9728, 12288, 1, 4096]
    - [32, 73.376]
  - - [9728, 12288, 1, 8192]
    - [31, 80.897]
  - - [9728, 12288, 1, 8256]
    - [33, 80.869]
  - - [9728, 12288, 1, 16416]
    - [33, 84.158]
  - - [14592, 12288, 1, 8192]
    - [30, 81.182]
  - - [14592, 12288, 1, 8256]
    - [34, 82.337]
  - - [14592, 12288, 1, 16416]
    - [33, 84.769]
  - - [12288, 9728, 1, 16416]
    - [35, 84.038]
  - - [2432, 2048, 1, 1024]
    - [0, 29.44]
  - - [2432, 2048, 1, 2048]
    - [1, 35.86]
  - - [2048, 2432, 1, 1024]
    - [2, 33.1]
  - - [2048, 2432, 1, 2048]
    - [3, 42.83]
  - - [4864, 1024, 1, 1024]
    - [5, 33.41]
  - - [4864, 1024, 1, 2048]
    - [4, 38.82]
  - - [128, 2432, 1, 512]
    - [13, 4.164]
  - - [128, 2432, 1, 1024]
    - [6, 6.095]
  - - [512, 608, 1, 512]
    - [7, 4.253]
  - - [512, 608, 1, 1024]
    - [14, 6.373]
  - - [608, 512, 1, 512]
    - [8, 4.396]
  - - [608, 512, 1, 1024]
    - [12, 6.587]
  - - [608, 1024, 1, 512]
    - [15, 6.958]
  - - [608, 1024, 1, 1024]
    - [9, 9.761]
  - - [1216, 256, 1, 512]
    - [16, 4.226]
  - - [256, 4864, 1, 1024]
    - [10, 18.456]
  - - [256, 4864, 1, 2048]
    - [11, 21.987]
  - - [1216, 1024, 1, 2048]
    - [19, 22.924]
  - - [1216, 4096, 1, 4096]
    - [20, 40.095]
  - - [2432, 512, 1, 1024]
    - [18, 15.306]
  - - [1216, 1024, 1, 1024]
    - [17, 15.922]
  - - [9728, 512, 1, 512]
    - [21, 23.797]
  - - [9728, 512, 1, 1024]
    - [22, 34.687]
  - - [19456, 256, 1, 512]
    - [23, 30.395]
  - - [19456, 256, 1, 1024]
    - [24, 40.731]
  - - [64, 4864, 1, 512]
    - [25, 6.685]
  - - [64, 9728, 1, 1024]
    - [26, 8.313]
- null
- null
- DeviceEfficiency
