library/src/blas3/Tensile/Logic/asm_full/aquavanjaram941/aquavanjaram941_Cijk_AlikC_Bjlk_ZB.yaml
- {MinimumRequiredVersion: 4.28.0}
- aquavanjaram941
- gfx941
- [Device 0049]
    SolutionIndex: 0
    SolutionNameMin: Cijk_AlikC_Bjlk_ZB_MT16x16x16_MI16x16x4x1_SN_1LDSB1_IU4_NLCB1_SIA2_TT1_16_WG16_4_1
    SolutionIndex: 1
    SolutionNameMin: Cijk_AlikC_Bjlk_ZB_MT16x16x16_MI16x16x4x1_SN_1LDSB0_IU1_NLCB1_SIA3_TT1_16_WG16_4_1
    SolutionIndex: 2
    SolutionNameMin: Cijk_AlikC_Bjlk_ZB_MT64x96x16_MI16x16x4x1_SN_ASGT_LWPMn1_NEPBS0_NLCB3_SU32_SUS256_TT1_96_WG64_4_1_WGM3
    SolutionIndex: 3
    SolutionNameMin: Cijk_AlikC_Bjlk_ZB_MT64x96x16_MI16x16x4x1_SN_ASGT332_LWPMn1_NEPBS0_NLCB3_SU32_SUS256_TT1_96_WG64_4_1_WGM3
    SolutionIndex: 4
    SolutionNameMin: Cijk_AlikC_Bjlk_ZB_MT64x96x16_MI16x16x4x1_SN_ASGT332_LWPMn1_NEPBS0_NLCB3_SU16_SUS256_TT1_96_WG64_4_1_WGM3
    SolutionIndex: 5
    SolutionNameMin: Cijk_AlikC_Bjlk_ZB_MT64x96x16_MI16x16x4x1_SN_ASGT_LWPMn1_NEPBS0_NLCB3_SU0_SUS0_TT1_96_WG64_4_1_WGM3
    SolutionIndex: 6
    SolutionNameMin: Cijk_AlikC_Bjlk_ZB_MT64x96x16_MI16x16x4x1_SN_ASGT332_LWPMn1_NEPBS0_NLCB3_SU0_SUS0_TT1_96_WG64_4_1_WGM3
    SolutionIndex: 7
    SolutionNameMin: Cijk_AlikC_Bjlk_ZB_MT64x96x16_MI16x16x4x1_SN_ASGT332_LWPMn1_NEPBS0_NLCB3_SU4_SUS256_TT1_96_WG64_4_1_WGM3
    SolutionIndex: 8
    SolutionNameMin: Cijk_AlikC_Bjlk_ZB_MT64x96x16_MI16x16x4x1_SN_ASGT332_LWPMn1_NEPBS0_NLCB3_SU0_SUS0_TT1_96_WG64_4_1_WGM7
    SolutionIndex: 9
    SolutionNameMin: Cijk_AlikC_Bjlk_ZB_MT64x96x16_MI16x16x4x1_SN_ASGT332_LWPMn1_NEPBS0_NLCB3_SU32_SUS256_TT1_96_WG64_4_1_WGM7
    SolutionIndex: 10
    SolutionNameMin: Cijk_AlikC_Bjlk_ZB_MT64x96x16_MI16x16x4x1_SN_ASGT_LWPMn1_NEPBS0_NLCB3_SU16_SUS256_TT1_96_WG64_4_1_WGM3
    SolutionIndex: 11
    SolutionNameMin: Cijk_AlikC_Bjlk_ZB_MT64x96x16_MI16x16x4x1_SN_ASGT332_LWPMn1_NEPBS0_NLCB3_SU32_SUS256_TT1_96_WG64_4_1_WGM5
    SolutionIndex: 12
    SolutionNameMin: Cijk_AlikC_Bjlk_ZB_MT64x96x16_MI16x16x4x1_SN_ASGT_LWPMn1_NEPBS0_NLCB3_SU0_SUS0_TT1_96_WG64_4_1_WGM7
    SolutionIndex: 13
    SolutionNameMin: Cijk_AlikC_Bjlk_ZB_MT64x96x16_MI16x16x4x1_SN_ASGT_LWPMn1_NEPBS0_NLCB3_SU16_SUS256_TT1_96_WG64_4_1_WGM7
    SolutionIndex: 14
    SolutionNameMin: Cijk_AlikC_Bjlk_ZB_MT64x96x16_MI16x16x4x1_SN_ASGT332_LWPMn1_NEPBS0_NLCB3_SU4_SUS256_TT1_96_WG64_4_1_WGM5
    SolutionIndex: 15
    SolutionNameMin: Cijk_AlikC_Bjlk_ZB_MT64x96x16_MI16x16x4x1_SN_ASGT_LWPMn1_NEPBS0_NLCB3_SU16_SUS256_TT1_96_WG64_4_1_WGM10
- - - [64, 1, 1, 256]
    - [1, 0.015]
  - - [64, 64, 1, 256]
    - [0, 1.112]
  - - [1, 1, 1, 256]
    - [0, 0.0]
  - - [1, 64, 1, 256]
    - [1, 0.016]
  - - [6454, 6454, 1, 689]
    - [2, 81.242]
  - - [7561, 7561, 1, 411]
    - [2, 74.963]
  - - [7985, 7985, 1, 701]
    - [3, 80.367]
  - - [7985, 7985, 1, 1948]
    - [4, 86.993]
  - - [8709, 8709, 1, 875]
    - [2, 83.119]
  - - [9603, 9603, 1, 1371]
    - [5, 85.452]
  - - [9603, 9603, 1, 701]
    - [6, 80.527]
  - - [10606, 10606, 1, 1239]
    - [7, 86.692]
  - - [11505, 11505, 1, 1278]
    - [2, 85.922]
  - - [12301, 12301, 1, 837]
    - [5, 83.235]
  - - [13179, 13179, 1, 1392]
    - [2, 87.564]
  - - [14487, 14487, 1, 1169]
    - [3, 86.117]
  - - [15420, 15420, 1, 2986]
    - [8, 91.317]
  - - [15420, 15420, 1, 701]
    - [6, 84.513]
  - - [17445, 17445, 1, 1266]
    - [5, 86.309]
  - - [18395, 18395, 1, 1008]
    - [3, 86.167]
  - - [19343, 19343, 1, 501]
    - [9, 78.992]
  - - [19343, 19343, 1, 1266]
    - [8, 85.874]
  - - [20342, 20342, 1, 1636]
    - [5, 88.751]
  - - [21581, 21581, 1, 701]
    - [10, 81.659]
  - - [21581, 21581, 1, 2921]
    - [11, 88.449]
  - - [24261, 24261, 1, 659]
    - [5, 81.449]
  - - [25109, 25109, 1, 1087]
    - [12, 84.499]
  - - [25854, 25854, 1, 701]
    - [13, 81.886]
  - - [25854, 25854, 1, 1820]
    - [6, 87.98]
  - - [27412, 27412, 1, 501]
    - [12, 79.721]
  - - [27412, 27412, 1, 1416]
    - [6, 87.802]
  - - [28005, 28005, 1, 701]
    - [9, 80.228]
  - - [28005, 28005, 1, 2572]
    - [14, 86.106]
  - - [29829, 29829, 1, 1582]
    - [9, 79.0]
  - - [30421, 30421, 1, 1186]
    - [15, 77.178]
- null
- null
- DeviceEfficiency
