library/src/blas3/Tensile/Logic/asm_full/aquavanjaram941/aquavanjaram941_Cijk_Alik_Bljk_HSS_BH.yaml
- {MinimumRequiredVersion: 4.36.0}
- aquavanjaram941
- gfx941
- [Device 0049, Device 0050]
    SolutionIndex: 0
    SolutionNameMin: Cijk_Alik_Bljk_HSS_BH_MT256x256x32_MI32x32x8x1_SN_FL0_GLS0_NTC3_NTD2_NEPBS8_ONLL1_SU32_SUS128_SPO0_SSO6_WGM19
    SolutionIndex: 1
    SolutionNameMin: Cijk_Alik_Bljk_HSS_BH_MT256x256x32_MI32x32x8x1_SN_FL0_GLS0_NTC3_NTD3_NEPBS8_ONLL2_SU32_SUS128_SPO1_SSO6_WGM19
    SolutionIndex: 2
    SolutionNameMin: Cijk_Alik_Bljk_HSS_BH_MT256x256x32_MI32x32x8x1_SN_FL2_GLS0_NTC3_NTD3_NEPBS0_ONLL1_SU0_SUS0_SPO0_SSO8_WGM4
    SolutionIndex: 3
    SolutionNameMin: Cijk_Alik_Bljk_HSS_BH_MT256x256x32_MI32x32x8x1_SN_FL2_GLS0_NTC3_NTD3_NEPBS0_ONLL0_SU32_SUS64_SPO0_SSO8_WGM18
    SolutionIndex: 4
    SolutionNameMin: Cijk_Alik_Bljk_HSS_BH_MT256x256x32_MI32x32x8x1_SN_FL0_GLS0_NTC2_NTD3_NEPBS0_ONLL0_SU32_SUS128_SPO1_SSO8_WGM4
    SolutionIndex: 5
    SolutionNameMin: Cijk_Alik_Bljk_HSS_BH_MT256x256x32_MI32x32x8x1_SN_FL0_GLS0_NTC3_NTD2_NEPBS0_ONLL1_SU32_SUS128_SPO1_SSO8_WGM18
    SolutionIndex: 6
    SolutionNameMin: Cijk_Alik_Bljk_HSS_BH_MT256x256x32_MI32x32x8x1_SN_FL0_GLS0_NTC2_NTD2_NEPBS0_ONLL2_SU32_SUS128_SPO0_SSO10_WGM18
    SolutionIndex: 7
    SolutionNameMin: Cijk_Alik_Bljk_HSS_BH_MT256x256x32_MI32x32x8x1_SN_FL2_GLS0_NTC2_NTD2_NEPBS0_ONLL2_SU32_SUS128_SPO0_SSO10_WGM19
    SolutionIndex: 8
    SolutionNameMin: Cijk_Alik_Bljk_HSS_BH_MT256x256x32_MI32x32x8x1_SN_FL2_GLS0_NTC2_NTD3_NEPBS0_ONLL2_SU32_SUS128_SPO0_SSO10_WGM19
    SolutionIndex: 9
    SolutionNameMin: Cijk_Alik_Bljk_HSS_BH_MT256x256x32_MI32x32x8x1_SN_FL2_GLS0_NTC3_NTD2_NEPBS0_ONLL0_SU32_SUS64_SPO0_SSO10_WGM18
    SolutionIndex: 10
    SolutionNameMin: Cijk_Alik_Bljk_HSS_BH_MT256x256x32_MI32x32x8x1_SN_FL0_GLS1_NTC2_NTD3_NEPBS0_ONLL2_SU32_SUS128_SPO1_SSO6_WGM19
    SolutionIndex: 11
    SolutionNameMin: Cijk_Alik_Bljk_HSS_BH_MT256x256x32_MI32x32x8x1_SN_FL2_GLS1_NTC2_NTD3_NEPBS0_ONLL1_SU32_SUS64_SPO0_SSO8_WGM4
    SolutionIndex: 12
    SolutionNameMin: Cijk_Alik_Bljk_HSS_BH_MT256x256x32_MI32x32x8x1_SN_FL0_GLS1_NTC2_NTD2_NEPBS0_ONLL1_SU32_SUS128_SPO1_SSO8_WGM18
- - - [6144, 4864, 1, 4096]
    - [12, 67.575]
  - - [6144, 4864, 1, 8192]
    - [6, 76.025]
  - - [6144, 4864, 1, 16384]
    - [1, 63.964]
  - - [6144, 9728, 1, 4096]
    - [0, 63.304]
  - - [6144, 9728, 1, 8192]
    - [10, 63.42]
  - - [6144, 9728, 1, 16384]
    - [8, 61.911]
  - - [9216, 4864, 1, 4096]
    - [5, 65.212]
  - - [9216, 4864, 1, 8192]
    - [3, 71.496]
  - - [9216, 4864, 1, 16384]
    - [7, 62.884]
  - - [6144, 4864, 1, 4352]
    - [9, 68.792]
  - - [6144, 4864, 1, 8448]
    - [2, 72.905]
  - - [6144, 4864, 1, 16640]
    - [4, 62.185]
  - - [4864, 3072, 1, 4096]
    - [11, 65.548]
- null
- null
- DeviceEfficiency
