library/src/blas3/Tensile/Logic/asm_full/aquavanjaram941/aquavanjaram941_Cijk_Alik_BjlkC_ZB.yaml
- {MinimumRequiredVersion: 4.28.0}
- aquavanjaram941
- gfx941
- [Device 0049]
    SolutionIndex: 0
    SolutionNameMin: Cijk_Alik_BjlkC_ZB_MT16x16x16_MI16x16x4x1_SN_1LDSB1_IU4_NLCB1_SIA2_TT1_16_WG16_4_1
    SolutionIndex: 1
    SolutionNameMin: Cijk_Alik_BjlkC_ZB_MT16x16x16_MI16x16x4x1_SN_1LDSB0_IU1_NLCB1_SIA3_TT1_16_WG16_4_1
    SolutionIndex: 2
    SolutionNameMin: Cijk_Alik_BjlkC_ZB_MT32x32x16_MI16x16x4x1_SN_1LDSB0_IU1_NLCB1_SIA3_TT1_16_WG32_8_1
    SolutionIndex: 3
    SolutionNameMin: Cijk_Alik_BjlkC_ZB_MT64x96x16_MI16x16x4x1_SN_ASGT332_LWPMn1_NEPBS0_NLCB3_SU0_SUS0_TT1_96_WG64_4_1_WGM7
    SolutionIndex: 4
    SolutionNameMin: Cijk_Alik_BjlkC_ZB_MT64x96x16_MI16x16x4x1_SN_ASGT332_LWPMn1_NEPBS0_NLCB3_SU0_SUS0_TT1_96_WG64_4_1_WGM5
    SolutionIndex: 5
    SolutionNameMin: Cijk_Alik_BjlkC_ZB_MT64x96x16_MI16x16x4x1_SN_ASGT332_LWPMn1_NEPBS0_NLCB3_SU0_SUS0_TT1_96_WG64_4_1_WGM3
    SolutionIndex: 6
    SolutionNameMin: Cijk_Alik_BjlkC_ZB_MT64x96x16_MI16x16x4x1_SN_ASGT_LWPMn1_NEPBS0_NLCB3_SU0_SUS0_TT1_96_WG64_4_1_WGM7
    SolutionIndex: 7
    SolutionNameMin: Cijk_Alik_BjlkC_ZB_MT64x96x16_MI16x16x4x1_SN_ASGT_LWPMn1_NEPBS0_NLCB3_SU0_SUS0_TT1_96_WG64_4_1_WGM3
    SolutionIndex: 8
    SolutionNameMin: Cijk_Alik_BjlkC_ZB_MT64x96x16_MI16x16x4x1_SN_ASGT332_LWPMn1_NEPBS0_NLCB3_SU32_SUS256_TT1_96_WG64_4_1_WGM3
    SolutionIndex: 9
    SolutionNameMin: Cijk_Alik_BjlkC_ZB_MT64x96x16_MI16x16x4x1_SN_ASGT332_LWPMn1_NEPBS0_NLCB3_SU4_SUS256_TT1_96_WG64_4_1_WGM7
    SolutionIndex: 10
    SolutionNameMin: Cijk_Alik_BjlkC_ZB_MT64x96x16_MI16x16x4x1_SN_ASGT_LWPMn1_NEPBS0_NLCB3_SU16_SUS256_TT1_96_WG64_4_1_WGM7
    SolutionIndex: 11
    SolutionNameMin: Cijk_Alik_BjlkC_ZB_MT64x96x16_MI16x16x4x1_SN_ASGT_LWPMn1_NEPBS0_NLCB3_SU32_SUS256_TT1_96_WG64_4_1_WGM7
    SolutionIndex: 12
    SolutionNameMin: Cijk_Alik_BjlkC_ZB_MT64x96x16_MI16x16x4x1_SN_ASGT332_LWPMn1_NEPBS0_NLCB3_SU16_SUS256_TT1_96_WG64_4_1_WGM7
    SolutionIndex: 13
    SolutionNameMin: Cijk_Alik_BjlkC_ZB_MT64x96x16_MI16x16x4x1_SN_ASGT332_LWPMn1_NEPBS0_NLCB3_SU32_SUS256_TT1_96_WG64_4_1_WGM7
    SolutionIndex: 14
    SolutionNameMin: Cijk_Alik_BjlkC_ZB_MT64x96x16_MI16x16x4x1_SN_ASGT_LWPMn1_NEPBS0_NLCB3_SU32_SUS256_TT1_96_WG64_4_1_WGM3
    SolutionIndex: 15
    SolutionNameMin: Cijk_Alik_BjlkC_ZB_MT64x96x16_MI16x16x4x1_SN_ASGT_LWPMn1_NEPBS0_NLCB3_SU32_SUS256_TT1_96_WG64_4_1_WGM5
    SolutionIndex: 16
    SolutionNameMin: Cijk_Alik_BjlkC_ZB_MT64x96x16_MI16x16x4x1_SN_ASGT_LWPMn1_NEPBS0_NLCB3_SU4_SUS256_TT1_96_WG64_4_1_WGM5
    SolutionIndex: 17
    SolutionNameMin: Cijk_Alik_BjlkC_ZB_MT64x96x16_MI16x16x4x1_SN_ASGT332_LWPMn1_NEPBS0_NLCB3_SU16_SUS256_TT1_96_WG64_4_1_WGM10
- - - [64, 1, 1, 256]
    - [1, 0.015]
  - - [64, 64, 1, 256]
    - [0, 1.05]
  - - [1, 1, 1, 256]
    - [2, 0.0]
  - - [1, 64, 1, 256]
    - [2, 0.017]
  - - [6454, 6454, 1, 689]
    - [3, 81.884]
  - - [7561, 7561, 1, 411]
    - [4, 74.922]
  - - [7985, 7985, 1, 701]
    - [5, 80.474]
  - - [7985, 7985, 1, 1948]
    - [6, 87.454]
  - - [8709, 8709, 1, 875]
    - [7, 83.251]
  - - [9603, 9603, 1, 1371]
    - [3, 85.7]
  - - [9603, 9603, 1, 701]
    - [5, 80.513]
  - - [10606, 10606, 1, 1239]
    - [7, 87.028]
  - - [11505, 11505, 1, 1278]
    - [6, 86.153]
  - - [12301, 12301, 1, 837]
    - [8, 83.295]
  - - [13179, 13179, 1, 1392]
    - [9, 87.546]
  - - [14487, 14487, 1, 1169]
    - [10, 86.271]
  - - [15420, 15420, 1, 2986]
    - [6, 91.3]
  - - [15420, 15420, 1, 701]
    - [5, 84.324]
  - - [17445, 17445, 1, 1266]
    - [11, 86.626]
  - - [18395, 18395, 1, 1008]
    - [12, 86.127]
  - - [19343, 19343, 1, 501]
    - [13, 79.372]
  - - [19343, 19343, 1, 1266]
    - [6, 85.972]
  - - [20342, 20342, 1, 1636]
    - [11, 88.85]
  - - [21581, 21581, 1, 701]
    - [14, 81.71]
  - - [21581, 21581, 1, 2921]
    - [15, 88.195]
  - - [24261, 24261, 1, 659]
    - [11, 81.39]
  - - [25109, 25109, 1, 1087]
    - [10, 84.539]
  - - [25854, 25854, 1, 701]
    - [10, 82.024]
  - - [25854, 25854, 1, 1820]
    - [13, 87.634]
  - - [27412, 27412, 1, 501]
    - [6, 79.453]
  - - [27412, 27412, 1, 1416]
    - [7, 87.342]
  - - [28005, 28005, 1, 701]
    - [11, 80.107]
  - - [28005, 28005, 1, 2572]
    - [16, 85.498]
  - - [29829, 29829, 1, 1582]
    - [13, 78.541]
  - - [30421, 30421, 1, 1186]
    - [17, 76.711]
- null
- null
- DeviceEfficiency
