library/src/blas3/Tensile/Logic/asm_full/aquavanjaram941/aquavanjaram941_Cijk_Alik_Bljk_DB.yaml
- {MinimumRequiredVersion: 4.7.2}
- aquavanjaram941
- gfx941
- [Device 0049]
    SolutionIndex: 0
    SolutionNameMin: Cijk_Alik_Bljk_DB_MT64x16x16_MI16x16x4x1_SN_IU2_NEPBS0_PLR3_SU32_SUS128_TLDS0_WGM5
    SolutionIndex: 1
    SolutionNameMin: Cijk_Alik_Bljk_DB_MT64x16x16_MI16x16x4x1_SN_IU1_NEPBS0_PLR5_SU32_SUS128_TLDS0_WGM5
    SolutionIndex: 2
    SolutionNameMin: Cijk_Alik_Bljk_DB_MT64x16x16_MI16x16x4x1_SN_IU1_NEPBS0_PLR5_SU0_SUS0_TLDS0_WGM11
    SolutionIndex: 3
    SolutionNameMin: Cijk_Alik_Bljk_DB_MT64x16x16_MI16x16x4x1_SN_IU2_NEPBS0_PLR3_SU32_SUS128_TLDS0_WGM11
    SolutionIndex: 4
    SolutionNameMin: Cijk_Alik_Bljk_DB_MT64x16x16_MI16x16x4x1_SN_IU1_NEPBS0_PLR5_SU32_SUS128_TLDS0_WGM11
    SolutionIndex: 5
    SolutionNameMin: Cijk_Alik_Bljk_DB_MT128x128x16_MI16x16x4x1_SN_MIAV1_SUS256_SSO4_WGM5
    SolutionIndex: 6
    SolutionNameMin: Cijk_Alik_Bljk_DB_MT128x128x16_MI16x16x4x1_SN_MIAV0_SUS256_SSO4_WGM6
    SolutionIndex: 7
    SolutionNameMin: Cijk_Alik_Bljk_DB_MT128x128x16_MI16x16x4x1_SN_MIAV0_SUS256_SSO4_WGM5
    SolutionIndex: 8
    SolutionNameMin: Cijk_Alik_Bljk_DB_MT128x128x16_MI16x16x4x1_SN_MIAV0_SUS128_SSO4_WGM5
    SolutionIndex: 9
    SolutionNameMin: Cijk_Alik_Bljk_DB_MT128x128x16_MI16x16x4x1_SN_MIAV1_SUS128_SSO4_WGM5
    SolutionIndex: 10
    SolutionNameMin: Cijk_Alik_Bljk_DB_MT128x128x16_MI16x16x4x1_SN_MIAV0_SUS128_SSO4_WGM6
    SolutionIndex: 11
    SolutionNameMin: Cijk_Alik_Bljk_DB_MT128x128x16_MI16x16x4x1_SN_MIAV1_SUS128_SSO4_WGM6
    SolutionIndex: 12
    SolutionNameMin: Cijk_Alik_Bljk_DB_MT128x128x16_MI16x16x4x1_SN_MIAV0_SUS256_SSO4_WGM8
    SolutionIndex: 13
    SolutionNameMin: Cijk_Alik_Bljk_DB_MT128x128x16_MI16x16x4x1_SN_MIAV1_SUS256_SSO4_WGM8
    SolutionIndex: 14
    SolutionNameMin: Cijk_Alik_Bljk_DB_MT128x128x16_MI16x16x4x1_SN_MIAV1_SUS256_SSO4_WGM6
    SolutionIndex: 15
    SolutionNameMin: Cijk_Alik_Bljk_DB_MT128x128x16_MI16x16x4x1_SN_MIAV0_SUS128_SSO4_WGM8
    SolutionIndex: 16
    SolutionNameMin: Cijk_Alik_Bljk_DB_MT128x128x16_MI16x16x4x1_SN_MIAV1_SUS128_SSO4_WGM11
    SolutionIndex: 17
    SolutionNameMin: Cijk_Alik_Bljk_DB_MT128x128x16_MI16x16x4x1_SN_MIAV1_SUS256_SSO6_WGM5
    SolutionIndex: 18
    SolutionNameMin: Cijk_Alik_Bljk_DB_MT128x128x16_MI16x16x4x1_SN_MIAV1_SUS128_SSO4_WGM8
    SolutionIndex: 19
    SolutionNameMin: Cijk_Alik_Bljk_DB_MT64x16x64_MI16x16x4x1_SN_BL1_EPS1_GSU175_NEPBS0_NLCA4_SU0_SUS0_WGM8
    SolutionIndex: 20
    SolutionNameMin: Cijk_Alik_Bljk_DB_MT64x16x64_MI16x16x4x1_SN_BL1_EPS1_GSU125_NEPBS2_NLCA4_SU2_SUS512_WGM6
    SolutionIndex: 21
    SolutionNameMin: Cijk_Alik_Bljk_DB_MT64x16x64_MI16x16x4x1_SN_BL0_EPS0_GSU125_NEPBS0_NLCA4_SU0_SUS0_WGM8
    SolutionIndex: 22
    SolutionNameMin: Cijk_Alik_Bljk_DB_MT64x16x64_MI16x16x4x1_SN_BL0_EPS0_GSU125_NEPBS0_NLCA2_SU0_SUS0_WGM6
    SolutionIndex: 23
    SolutionNameMin: Cijk_Alik_Bljk_DB_MT256x128x16_MI16x16x4x1_SN_GSU500_SU32_SUS256_TT4_128_WG64_4_1_WGM7
    SolutionIndex: 24
    SolutionNameMin: Cijk_Alik_Bljk_DB_MT256x128x16_MI16x16x4x1_SN_GSU625_SU8_SUS256_TT4_128_WG64_4_1_WGM4
    SolutionIndex: 25
    SolutionNameMin: Cijk_Alik_Bljk_DB_MT256x128x16_MI16x16x4x1_SN_GSU875_SU8_SUS256_TT4_128_WG64_4_1_WGM4
    SolutionIndex: 26
    SolutionNameMin: Cijk_Alik_Bljk_DB_MT256x128x16_MI16x16x4x1_SN_GSU625_SU0_SUS0_TT4_128_WG64_4_1_WGM4
    SolutionIndex: 27
    SolutionNameMin: Cijk_Alik_Bljk_DB_MT128x256x16_MI16x16x4x1_SN_GSU625_SU8_SUS256_TT8_64_WG16_16_1_WGM7
    SolutionIndex: 28
    SolutionNameMin: Cijk_Alik_Bljk_DB_MT256x128x16_MI16x16x4x1_SN_GSU875_SU32_SUS256_TT4_128_WG64_4_1_WGM7
    SolutionIndex: 29
    SolutionNameMin: Cijk_Alik_Bljk_DB_MT256x128x16_MI16x16x4x1_SN_GSU875_SU0_SUS0_TT4_128_WG64_4_1_WGM4
    SolutionIndex: 30
    SolutionNameMin: Cijk_Alik_Bljk_DB_MT256x128x16_MI16x16x4x1_SN_BL1_EPS1_GSU175_SU32_SUS256_TT4_128_WG64_4_1_WGM4
    SolutionIndex: 31
    SolutionNameMin: Cijk_Alik_Bljk_DB_MT128x128x16_MI16x16x4x1_SN_AMAS3_DTVA1_GLS0_LBSPP128_LPA4_LPB4_LRVW2_NTC3_NTD3_NEPBS16_NLCA2_NLCB1_ONLL1_SVW2_TT2_128_TLDS1_UMLDSA1_UMLDSB1_VW2_WG64_4_1_WGM36
    SolutionIndex: 32
    SolutionNameMin: Cijk_Alik_Bljk_DB_MT128x128x16_MI16x16x4x1_SN_AMAS3_DTVA0_GLS0_LBSPP128_LPA4_LPB4_LRVW2_NTC2_NTD3_NEPBS8_NLCA1_NLCB1_ONLL1_SVW2_TT2_128_TLDS1_UMLDSA1_UMLDSB1_VW2_WG64_4_1_WGM18
    SolutionIndex: 33
    SolutionNameMin: Cijk_Alik_Bljk_DB_MT128x128x16_MI16x16x4x1_SN_AMAS0_DTVA0_GLS0_LBSPP128_LPA4_LPB4_LRVW2_NTC2_NTD2_NEPBS16_NLCA1_NLCB1_ONLL1_SVW1_TT4_64_TLDS1_UMLDSA1_UMLDSB1_VW1_WG32_8_1_WGM42
    SolutionIndex: 34
    SolutionNameMin: Cijk_Alik_Bljk_DB_MT128x128x16_MI16x16x4x1_SN_AMAS3_DTVA0_GLS1_LBSPP128_LPA4_LPB4_LRVW2_NTC3_NTD3_NEPBS8_NLCA1_NLCB1_ONLL1_SVW2_TT4_64_TLDS1_UMLDSA1_UMLDSB1_VW2_WG32_8_1_WGM18
    SolutionIndex: 35
    SolutionNameMin: Cijk_Alik_Bljk_DB_MT128x128x16_MI16x16x4x1_SN_AMAS0_DTVA0_GLS0_LBSPP0_LPA1_LPB1_LRVW1_NTC2_NTD3_NEPBS8_NLCA1_NLCB1_ONLL1_SVW1_TT4_64_TLDS0_UMLDSA0_UMLDSB0_VW1_WG32_8_1_WGM42
    SolutionIndex: 36
    SolutionNameMin: Cijk_Alik_Bljk_DB_MT128x128x16_MI16x16x4x1_SN_AMAS3_DTVA0_GLS0_LBSPP128_LPA4_LPB4_LRVW2_NTC3_NTD3_NEPBS16_NLCA1_NLCB1_ONLL0_SVW2_TT4_64_TLDS1_UMLDSA1_UMLDSB1_VW2_WG32_8_1_WGM30
    SolutionIndex: 37
    SolutionNameMin: Cijk_Alik_Bljk_DB_MT128x128x16_MI16x16x4x1_SN_AMAS0_DTVA0_GLS0_LBSPP0_LPA1_LPB1_LRVW1_NTC3_NTD3_NEPBS8_NLCA1_NLCB1_ONLL0_SVW1_TT4_64_TLDS0_UMLDSA0_UMLDSB0_VW1_WG32_8_1_WGM30
    SolutionIndex: 38
    SolutionNameMin: Cijk_Alik_Bljk_DB_MT128x128x16_MI16x16x4x1_SN_AMAS3_DTVA0_GLS1_LBSPP128_LPA4_LPB4_LRVW2_NTC3_NTD3_NEPBS16_NLCA1_NLCB1_ONLL0_SVW2_TT4_64_TLDS1_UMLDSA1_UMLDSB1_VW2_WG32_8_1_WGM30
    SolutionIndex: 39
    SolutionNameMin: Cijk_Alik_Bljk_DB_MT128x128x16_MI16x16x4x1_SN_AMAS3_DTVA1_GLS1_LBSPP128_LPA4_LPB4_LRVW2_NTC3_NTD3_NEPBS8_NLCA2_NLCB1_ONLL1_SVW2_TT2_128_TLDS1_UMLDSA1_UMLDSB1_VW2_WG64_4_1_WGM48
    SolutionIndex: 40
    SolutionNameMin: Cijk_Alik_Bljk_DB_MT128x128x16_MI16x16x4x1_SN_AMAS3_DTVA1_GLS1_LBSPP128_LPA4_LPB4_LRVW2_NTC3_NTD2_NEPBS16_NLCA2_NLCB1_ONLL1_SVW2_TT2_128_TLDS1_UMLDSA1_UMLDSB1_VW2_WG64_4_1_WGM48
- - - [1, 64, 1, 64]
    - [2, 0.002]
  - - [64, 1, 1, 64]
    - [3, 0.002]
  - - [1, 1, 1, 64]
    - [4, 0.0]
  - - [64, 64, 1, 64]
    - [0, 0.147]
  - - [128, 1, 1, 128]
    - [1, 0.006]
  - - [250, 9, 1, 500000]
    - [19, 7.93]
  - - [250, 250, 1, 500000]
    - [30, 42.133]
  - - [250, 250, 1, 8000000]
    - [27, 43.114]
  - - [250, 9, 1, 8000000]
    - [20, 8.326]
  - - [250, 250, 1, 12000000]
    - [28, 43.913]
  - - [250, 250, 1, 16000000]
    - [29, 43.355]
  - - [250, 9, 1, 12000000]
    - [21, 8.3]
  - - [250, 9, 1, 16000000]
    - [22, 8.219]
  - - [250, 250, 1, 4000000]
    - [23, 43.067]
  - - [250, 250, 1, 5000000]
    - [24, 43.299]
  - - [250, 250, 1, 6000000]
    - [25, 43.418]
  - - [250, 250, 1, 7000000]
    - [26, 42.097]
  - - [6454, 6454, 1, 689]
    - [5, 60.556]
  - - [7561, 7561, 1, 411]
    - [6, 49.947]
  - - [7985, 7985, 1, 701]
    - [7, 61.65]
  - - [7985, 7985, 1, 1948]
    - [7, 78.111]
  - - [8709, 8709, 1, 875]
    - [6, 65.904]
  - - [9603, 9603, 1, 1371]
    - [8, 71.34]
  - - [9603, 9603, 1, 701]
    - [7, 62.106]
  - - [10606, 10606, 1, 1239]
    - [7, 73.699]
  - - [11505, 11505, 1, 1278]
    - [7, 74.052]
  - - [12301, 12301, 1, 837]
    - [9, 66.86]
  - - [13179, 13179, 1, 1392]
    - [5, 78.08]
  - - [14487, 14487, 1, 1169]
    - [6, 72.955]
  - - [15420, 15420, 1, 2986]
    - [6, 83.264]
  - - [15420, 15420, 1, 701]
    - [8, 64.647]
  - - [17445, 17445, 1, 1266]
    - [7, 74.918]
  - - [18395, 18395, 1, 1008]
    - [6, 74.338]
  - - [19343, 19343, 1, 501]
    - [10, 57.724]
  - - [19343, 19343, 1, 1266]
    - [7, 74.934]
  - - [20342, 20342, 1, 1636]
    - [6, 79.295]
  - - [21581, 21581, 1, 701]
    - [6, 64.329]
  - - [21581, 21581, 1, 2921]
    - [11, 81.298]
  - - [24261, 24261, 1, 659]
    - [6, 64.233]
  - - [25109, 25109, 1, 1087]
    - [7, 71.905]
  - - [25854, 25854, 1, 701]
    - [12, 64.816]
  - - [25854, 25854, 1, 1820]
    - [6, 80.031]
  - - [27412, 27412, 1, 501]
    - [10, 58.684]
  - - [27412, 27412, 1, 1416]
    - [7, 77.843]
  - - [28005, 28005, 1, 701]
    - [13, 64.673]
  - - [28005, 28005, 1, 2572]
    - [11, 82.82]
  - - [29829, 29829, 1, 1582]
    - [7, 77.105]
  - - [30421, 30421, 1, 1186]
    - [7, 74.391]
  - - [31256, 31256, 1, 415]
    - [12, 53.721]
  - - [31256, 31256, 1, 1186]
    - [7, 74.545]
  - - [32163, 32163, 1, 1796]
    - [6, 79.679]
  - - [33974, 33974, 1, 1225]
    - [7, 74.11]
  - - [35882, 35882, 1, 701]
    - [12, 64.745]
  - - [35882, 35882, 1, 2387]
    - [14, 80.543]
  - - [36653, 36653, 1, 501]
    - [15, 58.061]
  - - [36653, 36653, 1, 2845]
    - [16, 79.593]
  - - [37967, 37967, 1, 1339]
    - [6, 75.035]
  - - [38361, 38361, 1, 701]
    - [10, 64.582]
  - - [38361, 38361, 1, 3690]
    - [17, 84.552]
  - - [39067, 39067, 1, 1224]
    - [6, 75.189]
  - - [39761, 39761, 1, 3821]
    - [6, 83.021]
  - - [40401, 40401, 1, 701]
    - [10, 64.604]
  - - [40401, 40401, 1, 1925]
    - [14, 78.883]
  - - [41535, 41535, 1, 701]
    - [18, 60.78]
  - - [41535, 41535, 1, 2235]
    - [11, 80.053]
  - - [43623, 43623, 1, 701]
    - [14, 64.631]
  - - [43623, 43623, 1, 3812]
    - [7, 86.088]
  - - [45312, 45312, 1, 701]
    - [6, 65.958]
  - - [45312, 45312, 1, 3235]
    - [14, 83.442]
  - - [47463, 47463, 1, 3020]
    - [8, 84.225]
  - - [47463, 47463, 1, 701]
    - [12, 64.472]
  - - [49109, 49109, 1, 3250]
    - [14, 84.662]
  - - [51821, 51821, 1, 701]
    - [12, 64.422]
  - - [51821, 51821, 1, 3954]
    - [10, 85.609]
  - - [60766, 60766, 1, 701]
    - [12, 64.537]
  - - [60766, 60766, 1, 2493]
    - [14, 80.754]
  - - [67143, 67143, 1, 701]
    - [16, 63.425]
  - - [67143, 67143, 1, 3914]
    - [6, 85.241]
  - - [6144, 4864, 1, 512]
    - [31, 75.208]
  - - [4864, 3072, 1, 4096]
    - [32, 92.995]
  - - [7296, 4096, 1, 4096]
    - [33, 93.016]
  - - [7296, 4608, 1, 4096]
    - [34, 93.046]
  - - [7296, 4608, 1, 8192]
    - [35, 94.531]
  - - [9728, 6144, 1, 4096]
    - [36, 93.389]
  - - [9728, 6144, 1, 8192]
    - [37, 94.477]
  - - [16384, 16384, 1, 4096]
    - [38, 94.315]
  - - [14592, 15360, 1, 512]
    - [39, 73.255]
  - - [19456, 18432, 1, 512]
    - [40, 73.759]
- null
