library/src/blas3/Tensile/Logic/asm_full/aquavanjaram941/aquavanjaram941_Cijk_Alik_Bljk_F8HS_BH.yaml
- {MinimumRequiredVersion: 4.36.0}
- aquavanjaram941
- gfx941
- [Device 0049, Device 0050]
    SolutionIndex: 0
    SolutionNameMin: Cijk_Alik_Bljk_F8HS_BH_MT256x256x64_MI32x32x16x1_SN_GLS0_LPA16_NLCA1_SU0_SUS0_WGM6
    SolutionIndex: 1
    SolutionNameMin: Cijk_Alik_Bljk_F8HS_BH_MT256x256x64_MI32x32x16x1_SN_GLS0_LPA16_NLCA1_SU32_SUS64_WGM6
    SolutionIndex: 2
    SolutionNameMin: Cijk_Alik_Bljk_F8HS_BH_MT256x256x64_MI32x32x16x1_SN_GLS0_LPA16_NLCA1_SU32_SUS128_WGM6
    SolutionIndex: 3
    SolutionNameMin: Cijk_Alik_Bljk_F8HS_BH_MT256x256x64_MI32x32x16x1_SN_GLS0_LPA16_NLCA2_SU0_SUS0_WGM6
    SolutionIndex: 4
    SolutionNameMin: Cijk_Alik_Bljk_F8HS_BH_MT256x256x64_MI32x32x16x1_SN_GLS0_LPA16_NLCA1_SU0_SUS0_WGM12
    SolutionIndex: 5
    SolutionNameMin: Cijk_Alik_Bljk_F8HS_BH_MT256x256x64_MI32x32x16x1_SN_GLS0_LPA16_NLCA1_SU32_SUS128_WGM12
    SolutionIndex: 6
    SolutionNameMin: Cijk_Alik_Bljk_F8HS_BH_MT256x256x64_MI32x32x16x1_SN_GLS1_LPA16_NLCA1_SU32_SUS128_WGM6
    SolutionIndex: 7
    SolutionNameMin: Cijk_Alik_Bljk_F8HS_BH_MT256x256x64_MI32x32x16x1_SN_GLS1_LPA16_NLCA1_SU32_SUS64_WGM12
    SolutionIndex: 8
    SolutionNameMin: Cijk_Alik_Bljk_F8HS_BH_MT256x256x64_MI32x32x16x1_SN_GLS1_LPA16_NLCA1_SU32_SUS128_WGM12
    SolutionIndex: 9
    SolutionNameMin: Cijk_Alik_Bljk_F8HS_BH_MT256x256x64_MI32x32x16x1_SN_GLS1_LPA16_NLCA1_SU32_SUS128_WGM19
- - - [6144, 4864, 1, 4096]
    - [1, 68.624]
  - - [6144, 4864, 1, 8192]
    - [2, 74.223]
  - - [6144, 4864, 1, 16384]
    - [7, 75.447]
  - - [6144, 9728, 1, 4096]
    - [1, 69.711]
  - - [6144, 9728, 1, 8192]
    - [6, 72.347]
  - - [6144, 9728, 1, 16384]
    - [8, 71.949]
  - - [9216, 4864, 1, 4096]
    - [1, 69.311]
  - - [9216, 4864, 1, 8192]
    - [9, 74.018]
  - - [9216, 4864, 1, 16384]
    - [5, 72.756]
  - - [6144, 4864, 1, 4352]
    - [4, 70.598]
  - - [6144, 4864, 1, 8448]
    - [0, 75.431]
  - - [6144, 4864, 1, 16640]
    - [3, 77.736]
  - - [4864, 3072, 1, 4096]
    - [2, 67.386]
- null
- null
- DeviceEfficiency
