library/src/blas3/Tensile/Logic/asm_full/aquavanjaram941/aquavanjaram941_Cijk_Ailk_Bljk_HHS_BH.yaml
- {MinimumRequiredVersion: 4.36.0}
- aquavanjaram941
- gfx941
- [Device 0049, Device 0050]
    SolutionIndex: 0
    SolutionNameMin: Cijk_Ailk_Bljk_HHS_BH_MT256x128x16_MI32x32x8x1_SN_1LDSB1_AMAS3_FL0_MIAV0_NTA0_NTB0_NTC3_NTD3_NLCA2_ONLL1_SVW2_TT2_128_VW2_WSGRA1_WSGRB1_WG128_2_1_WGM12
    SolutionIndex: 1
    SolutionNameMin: Cijk_Ailk_Bljk_HHS_BH_MT256x128x16_MI32x32x8x1_SN_1LDSB0_AMAS3_FL0_MIAV0_NTA1_NTB0_NTC3_NTD3_NLCA2_ONLL1_SVW2_TT4_64_VW2_WSGRA0_WSGRB1_WG64_4_1_WGM6
    SolutionIndex: 2
    SolutionNameMin: Cijk_Ailk_Bljk_HHS_BH_MT256x128x16_MI32x32x8x1_SN_1LDSB1_AMAS3_FL0_MIAV0_NTA1_NTB0_NTC3_NTD3_NLCA2_ONLL0_SVW2_TT2_128_VW2_WSGRA0_WSGRB0_WG128_2_1_WGM6
    SolutionIndex: 3
    SolutionNameMin: Cijk_Ailk_Bljk_HHS_BH_MT256x128x16_MI32x32x8x1_SN_1LDSB1_AMAS3_FL0_MIAV0_NTA0_NTB1_NTC3_NTD2_NLCA2_ONLL1_SVW2_TT2_128_VW2_WSGRA1_WSGRB1_WG128_2_1_WGM6
    SolutionIndex: 4
    SolutionNameMin: Cijk_Ailk_Bljk_HHS_BH_MT256x128x16_MI32x32x8x1_SN_1LDSB1_AMAS3_FL0_MIAV0_NTA1_NTB1_NTC2_NTD1_NLCA2_ONLL0_SVW2_TT2_128_VW2_WSGRA0_WSGRB1_WG128_2_1_WGM6
    SolutionIndex: 5
    SolutionNameMin: Cijk_Ailk_Bljk_HHS_BH_MT256x128x16_MI32x32x8x1_SN_1LDSB1_AMAS3_FL0_MIAV0_NTA1_NTB1_NTC3_NTD3_NLCA2_ONLL0_SVW2_TT2_128_VW2_WSGRA0_WSGRB0_WG128_2_1_WGM6
    SolutionIndex: 6
    SolutionNameMin: Cijk_Ailk_Bljk_HHS_BH_MT256x128x16_MI32x32x8x1_SN_1LDSB1_AMAS3_FL0_MIAV1_NTA0_NTB0_NTC2_NTD2_NLCA2_ONLL2_SVW2_TT2_128_VW2_WSGRA0_WSGRB0_WG128_2_1_WGM6
    SolutionIndex: 7
    SolutionNameMin: Cijk_Ailk_Bljk_HHS_BH_MT256x128x16_MI32x32x8x1_SN_1LDSB1_AMAS0_FL0_MIAV1_NTA1_NTB0_NTC2_NTD1_NLCA2_ONLL0_SVW1_TT2_128_VW1_WSGRA0_WSGRB0_WG128_2_1_WGM6
    SolutionIndex: 8
    SolutionNameMin: Cijk_Ailk_Bljk_HHS_BH_MT256x128x16_MI32x32x8x1_SN_1LDSB1_AMAS3_FL0_MIAV1_NTA1_NTB0_NTC3_NTD2_NLCA2_ONLL1_SVW2_TT4_64_VW2_WSGRA0_WSGRB1_WG64_4_1_WGM12
    SolutionIndex: 9
    SolutionNameMin: Cijk_Ailk_Bljk_HHS_BH_MT256x128x16_MI32x32x8x1_SN_1LDSB0_AMAS3_FL0_MIAV1_NTA0_NTB1_NTC2_NTD1_NLCA2_ONLL2_SVW2_TT2_128_VW2_WSGRA1_WSGRB1_WG128_2_1_WGM6
    SolutionIndex: 10
    SolutionNameMin: Cijk_Ailk_Bljk_HHS_BH_MT256x128x16_MI32x32x8x1_SN_1LDSB1_AMAS3_FL0_MIAV1_NTA1_NTB1_NTC2_NTD3_NLCA2_ONLL0_SVW2_TT2_128_VW2_WSGRA0_WSGRB0_WG128_2_1_WGM6
    SolutionIndex: 11
    SolutionNameMin: Cijk_Ailk_Bljk_HHS_BH_MT256x128x16_MI32x32x8x1_SN_1LDSB1_AMAS3_FL0_MIAV1_NTA1_NTB1_NTC3_NTD3_NLCA2_ONLL0_SVW2_TT2_128_VW2_WSGRA1_WSGRB1_WG128_2_1_WGM6
    SolutionIndex: 12
    SolutionNameMin: Cijk_Ailk_Bljk_HHS_H_MT16x128x64_MI16x16x16x1_SN_AMAS3_GSU16_LBSPP128_LPA4_LRVW4_MIAV0_NEPBS4_PLR1_SS0_SVW4_TT1_32_TLDS1_UMLDSB1_VW2_WGM18
    SolutionIndex: 13
    SolutionNameMin: Cijk_Ailk_Bljk_HHS_H_MT128x16x64_MI16x16x16x1_SN_AMAS0_GSU16_LBSPP128_LPA8_LRVW4_MIAV0_NEPBS0_PLR5_SS0_SVW4_TT2_16_TLDS1_UMLDSB1_VW1_WGM18
    SolutionIndex: 14
    SolutionNameMin: Cijk_Ailk_Bljk_HHS_H_MT16x16x128_MI16x16x16x1_SN_AMAS0_LBSPP256_LPA8_MIAV1_NEPBS4_SS1_SVW1_TLDS1_UMLDSB1_VW1_WGM1
    SolutionIndex: 15
    SolutionNameMin: Cijk_Ailk_Bljk_HHS_BH_MT16x32x128_MI16x16x16x1_SN_AMAS3_LPB8_MIAV0_NEPBS4_SS0_SVW4_TT1_16_VW2_WSGRA0_WSGRB1_WG16_8_1_WGM1
    SolutionIndex: 16
    SolutionNameMin: Cijk_Ailk_Bljk_HHS_H_MT16x32x256_MI16x16x16x1_SN_AMAS0_LBSPP512_LPA8_LRVW4_MIAV1_NEPBS0_PLR1_SS0_SVW4_TLDS1_UMLDSB1_VW1_WG16_8_1_WGM8
    SolutionIndex: 17
    SolutionNameMin: Cijk_Ailk_Bljk_HHS_BH_MT16x16x128_MI16x16x16x1_SN_AMAS0_GRVW8_LBSPP256_LPA8_LPB8_MIAV1_NEPBS0_SS0_SVW4_TLDS1_UMLDSB1_VW1_WGM18
    SolutionIndex: 18
    SolutionNameMin: Cijk_Ailk_Bljk_HHS_BH_MT16x16x128_MI16x16x16x1_SN_GRVW8_LPA8_LPB4_NEPBS4_WGM12
    SolutionIndex: 19
    SolutionNameMin: Cijk_Ailk_Bljk_HHS_BH_MT16x64x128_MI16x16x16x1_SN_AMAS3_LBSPP256_LPA8_LPB8_MIAV0_NEPBS0_SS0_SVW4_TT1_16_TLDS1_UMLDSB1_VW2_WG16_16_1_WGM16
    SolutionIndex: 20
    SolutionNameMin: Cijk_Ailk_Bljk_HHS_BH_MT16x64x128_MI16x16x16x1_SN_AMAS3_LBSPP256_LPA8_MIAV0_NEPBS4_SS0_SVW4_TLDS1_UMLDSB1_VW2_WGM1
    SolutionIndex: 21
    SolutionNameMin: Cijk_Ailk_Bljk_HHS_BH_MT16x64x64_MI16x16x16x1_SN_AMAS0_GRVW4_LBSPP128_LPA8_LPB4_LRVW4_MIAV1_NEPBS0_PLR5_SS0_SVW4_TLDS1_UMLDSB1_VW1_WGM1
    SolutionIndex: 22
    SolutionNameMin: Cijk_Ailk_Bljk_HHS_BH_MT32x16x128_MI16x16x16x1_SN_AMAS3_LBSPP256_LPB4_MIAV0_NEPBS0_PLR1_SS0_SVW4_VW2_WSGRA0_WSGRB1_WG32_4_1_WGM1
    SolutionIndex: 23
    SolutionNameMin: Cijk_Ailk_Bljk_HHS_BH_MT128x16x64_MI16x16x16x1_SN_AMAS0_GRVW8_LPA8_LPB4_LRVW4_MIAV1_NEPBS0_PLR5_SS1_SVW1_TT2_16_VW1_WG64_4_1_WGM8
    SolutionIndex: 24
    SolutionNameMin: Cijk_Ailk_Bljk_HHS_BH_MT64x16x128_MI16x16x16x1_SN_AMAS0_LBSPP256_LPA8_MIAV1_NEPBS0_SS1_SVW1_TLDS1_UMLDSB1_VW1_WGM18
    SolutionIndex: 25
    SolutionNameMin: Cijk_Ailk_Bljk_HHS_BH_MT128x16x64_MI16x16x16x1_SN_AMAS3_LBSPP128_LPA8_LRVW4_MIAV1_NEPBS4_PLR1_SS0_SVW4_TLDS1_UMLDSB1_VW2_WGM8
    SolutionIndex: 26
    SolutionNameMin: Cijk_Ailk_Bljk_HHS_BH_MT256x16x32_MI16x16x16x1_SN_AMAS3_GRVW8_LPA4_LPB4_MIAV1_NEPBS0_SS1_SVW2_VW2_WSGRA1_WSGRB1_WGM8
    SolutionIndex: 27
    SolutionNameMin: Cijk_Ailk_Bljk_HHS_BH_MT256x256x32_MI32x32x8x1_SN_AMAS3_MIAV0_NLCA1_PLR5_SU0_SUS0_SPO1_SVW2_TT2_256_VW2_WGM32
    SolutionIndex: 28
    SolutionNameMin: Cijk_Ailk_Bljk_HHS_BH_MT256x128x32_MI32x32x8x1_SN_AMAS3_MIAV1_NLCA2_PLR5_SU0_SUS0_SPO1_SVW2_TT2_128_VW2_WGM32
    SolutionIndex: 29
    SolutionNameMin: Cijk_Ailk_Bljk_HHS_BH_MT256x256x32_MI32x32x8x1_SN_AMAS3_MIAV0_NLCA2_PLR5_SU4_SUS512_SPO0_SVW2_TT2_256_VW2_WGM32
    SolutionIndex: 30
    SolutionNameMin: Cijk_Ailk_Bljk_HHS_BH_MT256x256x32_MI32x32x8x1_SN_AMAS0_MIAV0_NLCA1_PLR5_SU0_SUS0_SPO1_SVW1_TT2_256_VW1_WGM1
    SolutionIndex: 31
    SolutionNameMin: Cijk_Ailk_Bljk_HHS_BH_MT256x128x64_MI32x32x8x1_SN_
    SolutionIndex: 32
    SolutionNameMin: Cijk_Ailk_Bljk_HHS_BH_MT256x112x32_MI16x16x16x1_SN_
    SolutionIndex: 33
    SolutionNameMin: Cijk_Ailk_Bljk_HHS_BH_MT256x224x64_MI32x32x8x1_SN_
    SolutionIndex: 34
    SolutionNameMin: Cijk_Ailk_Bljk_HHS_BH_MT256x224x64_MI32x32x8x1_SN_
    SolutionIndex: 35
    SolutionNameMin: Cijk_Ailk_Bljk_HHS_BH_MT256x112x32_MI16x16x16x1_SN_
    SolutionIndex: 36
    SolutionNameMin: Cijk_Ailk_Bljk_HHS_BH_MT256x256x32_MI32x32x8x1_SN_
    SolutionIndex: 37
    SolutionNameMin: Cijk_Ailk_Bljk_HHS_BH_MT256x128x32_MI32x32x8x1_SN_
    SolutionIndex: 38
    SolutionNameMin: Cijk_Ailk_Bljk_HHS_BH_MT256x224x64_MI32x32x8x1_SN_
    SolutionIndex: 39
    SolutionNameMin: Cijk_Ailk_Bljk_HHS_BH_MT256x224x64_MI32x32x8x1_SN_
    SolutionIndex: 40
    SolutionNameMin: Cijk_Ailk_Bljk_HHS_BH_MT256x256x32_MI32x32x8x1_SN_
    SolutionIndex: 41
    SolutionNameMin: Cijk_Ailk_Bljk_HHS_BH_MT128x128x64_MI32x32x8x1_SN_
- - - [6144, 4864, 1, 4096]
    - [4, 70.659]
  - - [6144, 4864, 1, 8192]
    - [3, 74.046]
  - - [6144, 4864, 1, 16384]
    - [10, 68.435]
  - - [6144, 4864, 1, 4352]
    - [2, 72.307]
  - - [6144, 4864, 1, 8448]
    - [7, 71.533]
  - - [6144, 4864, 1, 16640]
    - [11, 68.353]
  - - [4864, 3072, 1, 4096]
    - [1, 74.241]
  - - [4864, 3072, 1, 8192]
    - [9, 80.212]
  - - [4864, 3072, 1, 16384]
    - [5, 76.438]
  - - [4864, 3072, 1, 4352]
    - [0, 75.329]
  - - [4864, 3072, 1, 8448]
    - [8, 79.887]
  - - [4864, 3072, 1, 16640]
    - [6, 74.744]
  - - [2048, 2048, 1, 1024]
    - [41, 33.44]
  - - [2048, 2048, 1, 8192]
    - [41, 61.67]
  - - [2048, 2048, 1, 65536]
    - [31, 61.11]
  - - [2048, 8192, 1, 1024]
    - [32, 59.27]
  - - [2048, 8192, 1, 8192]
    - [33, 87.21]
  - - [2048, 8192, 1, 65536]
    - [34, 85.99]
  - - [8192, 2048, 1, 1024]
    - [35, 60.4]
  - - [8192, 2048, 1, 8192]
    - [35, 81.54]
  - - [8192, 2048, 1, 65536]
    - [36, 76.2]
  - - [8192, 8192, 1, 1024]
    - [37, 80.36]
  - - [8192, 8192, 1, 8192]
    - [38, 78.41]
  - - [8192, 8192, 1, 65536]
    - [39, 91.75]
  - - [16, 16, 1, 1024]
    - [14, 0.004]
  - - [16, 16, 1, 8192]
    - [17, 0.015]
  - - [16, 16, 1, 65536]
    - [18, 0.097]
  - - [16, 2048, 1, 1024]
    - [15, 0.308]
  - - [16, 2048, 1, 8192]
    - [12, 1.768]
  - - [16, 2048, 1, 65536]
    - [19, 4.997]
  - - [16, 8192, 1, 1024]
    - [20, 1.195]
  - - [16, 8192, 1, 8192]
    - [21, 3.302]
  - - [16, 8192, 1, 65536]
    - [16, 5.92]
  - - [2048, 16, 1, 1024]
    - [22, 0.358]
  - - [2048, 16, 1, 8192]
    - [13, 1.775]
  - - [2048, 16, 1, 65536]
    - [23, 4.754]
  - - [8192, 16, 1, 1024]
    - [24, 1.182]
  - - [8192, 16, 1, 8192]
    - [25, 3.314]
  - - [8192, 16, 1, 65536]
    - [26, 6.216]
  - - [9728, 8192, 1, 1024]
    - [28, 53.947]
  - - [9728, 8192, 1, 8192]
    - [29, 60.177]
  - - [9728, 8192, 1, 65536]
    - [30, 63.237]
  - - [4864, 4096, 1, 8192]
    - [27, 59.353]
  - - [9728, 8192, 1, 16384]
    - [40, 90.44]
- null
- null
- DeviceEfficiency
