library/src/blas3/Tensile/Logic/asm_full/aquavanjaram941/aquavanjaram941_Cijk_Ailk_Bljk_F8B8SS_BH.yaml
- {MinimumRequiredVersion: 4.36.0}
- aquavanjaram941
- gfx941
- [Device 0049, Device 0050]
    SolutionIndex: 0
    SolutionNameMin: Cijk_Ailk_Bljk_F8B8SS_BH_MT256x256x64_MI32x32x16x1_SN_GRVW16_GLS0_LPB16_NLCA1_SU0_SUM0_SUS0_SSO0_WGM4
    SolutionIndex: 1
    SolutionNameMin: Cijk_Ailk_Bljk_F8B8SS_BH_MT256x256x64_MI32x32x16x1_SN_GRVW16_GLS0_LPB16_NLCA2_SU0_SUM0_SUS0_SSO0_WGM4
    SolutionIndex: 2
    SolutionNameMin: Cijk_Ailk_Bljk_F8B8SS_BH_MT256x256x64_MI32x32x16x1_SN_GRVW16_GLS0_LPB16_NLCA1_SU0_SUM0_SUS0_SSO0_WGM6
    SolutionIndex: 3
    SolutionNameMin: Cijk_Ailk_Bljk_F8B8SS_BH_MT256x256x64_MI32x32x16x1_SN_GRVW16_GLS0_LPB16_NLCA2_SU0_SUM0_SUS0_SSO0_WGM6
    SolutionIndex: 4
    SolutionNameMin: Cijk_Ailk_Bljk_F8B8SS_BH_MT256x256x64_MI32x32x16x1_SN_GRVW16_GLS0_LPB16_NLCA1_SU0_SUM0_SUS0_SSO0_WGM12
    SolutionIndex: 5
    SolutionNameMin: Cijk_Ailk_Bljk_F8B8SS_BH_MT256x256x64_MI32x32x16x1_SN_GRVW16_GLS0_LPB16_NLCA2_SU0_SUM0_SUS0_SSO0_WGM12
    SolutionIndex: 6
    SolutionNameMin: Cijk_Ailk_Bljk_F8B8SS_BH_MT256x256x64_MI32x32x16x1_SN_GRVW16_GLS0_LPB16_NLCA2_SU0_SUM0_SUS0_SSO0_WGM19
    SolutionIndex: 7
    SolutionNameMin: Cijk_Ailk_Bljk_F8B8SS_BH_MT256x256x64_MI32x32x16x1_SN_GRVW16_GLS0_LPB16_NLCA1_SU0_SUM0_SUS0_SSO0_WGM20
    SolutionIndex: 8
    SolutionNameMin: Cijk_Ailk_Bljk_F8B8SS_BH_MT256x256x64_MI32x32x16x1_SN_GRVW16_GLS1_LPB16_NLCA2_SU0_SUM0_SUS0_SSO0_WGM4
    SolutionIndex: 9
    SolutionNameMin: Cijk_Ailk_Bljk_F8B8SS_BH_MT256x256x64_MI32x32x16x1_SN_GRVW16_GLS1_LPB16_NLCA1_SU0_SUM0_SUS0_SSO0_WGM12
    SolutionIndex: 10
    SolutionNameMin: Cijk_Ailk_Bljk_F8B8SS_BH_MT64x64x64_MI32x32x16x1_SN_1LDSB0_GRVW4_LPA16_NLCA2_PGR2_SU0_SUM0_SUS0_TSGRA0_UMLDSA1_VW2_WGM1
    SolutionIndex: 11
    SolutionNameMin: Cijk_Ailk_Bljk_F8B8SS_BH_MT64x64x64_MI32x32x16x1_SN_1LDSB1_GRVW4_LPA16_NLCA1_PGR2_SU32_SUM2_SUS64_TSGRA0_UMLDSA1_VW2_WGM12
    SolutionIndex: 12
    SolutionNameMin: Cijk_Ailk_Bljk_F8B8SS_BH_MT64x64x64_MI32x32x16x1_SN_1LDSB0_GRVW16_LPA16_NLCA1_PGR2_SU32_SUM2_SUS64_TSGRA0_UMLDSA1_VW4_WGM19
    SolutionIndex: 13
    SolutionNameMin: Cijk_Ailk_Bljk_F8B8SS_BH_MT64x64x64_MI32x32x16x1_SN_1LDSB0_GRVW16_LPA16_NLCA1_PGR1_SU0_SUM0_SUS0_TSGRA0_UMLDSA1_VW4_WGM1
- - - [6144, 4864, 1, 4096]
    - [0, 58.284]
  - - [6144, 4864, 1, 8192]
    - [5, 64.803]
  - - [6144, 4864, 1, 16384]
    - [0, 68.454]
  - - [6144, 9728, 1, 4096]
    - [1, 58.727]
  - - [6144, 9728, 1, 8192]
    - [9, 64.663]
  - - [6144, 9728, 1, 16384]
    - [0, 65.552]
  - - [9216, 4864, 1, 4096]
    - [3, 58.62]
  - - [9216, 4864, 1, 8192]
    - [0, 64.804]
  - - [9216, 4864, 1, 16384]
    - [8, 66.987]
  - - [6144, 4864, 1, 4352]
    - [2, 59.137]
  - - [6144, 4864, 1, 8448]
    - [7, 64.946]
  - - [6144, 4864, 1, 16640]
    - [4, 68.527]
  - - [4864, 3072, 1, 4096]
    - [6, 57.201]
  - - [4, 4, 1, 16]
    - [10, 0.0]
  - - [4, 64, 1, 64]
    - [11, 0.0]
  - - [16, 64, 1, 64]
    - [12, 0.001]
  - - [64, 4, 1, 64]
    - [13, 0.0]
  - - [64, 16, 1, 64]
    - [13, 0.001]
- null
- null
- DeviceEfficiency
