library/src/blas3/Tensile/Logic/asm_ci/vega20_Cijk_Ailk_Bjlk_4xi8BH.yaml
- {MinimumRequiredVersion: 4.6.0}
- vega20
- gfx906
- [Device 66a0, Device 66a1, Device 66a7, Device 66af, Vega 20]
    SolutionIndex: 0
    SolutionNameMin: Cijk_Ailk_Bjlk_4xi8BH_MT016x016x08_GRVW02_GSU01_SNLL0_TT02_02_VW02_WG08_08_01
    SolutionIndex: 1
    SolutionNameMin: Cijk_Ailk_Bjlk_4xi8BH_MT032x016x08_GRVW02_GSU01_SNLL0_TT02_02_VW02_WG16_08_01
    SolutionIndex: 2
    SolutionNameMin: Cijk_Ailk_Bjlk_4xi8BH_MT016x016x16_GRVW02_GSU01_SNLL0_TT02_02_VW02_WG08_08_01
    SolutionIndex: 3
    SolutionNameMin: Cijk_Ailk_Bjlk_4xi8BH_MT032x016x16_GRVW02_GSU01_SNLL0_TT02_02_VW02_WG16_08_01
    SolutionIndex: 4
    SolutionNameMin: Cijk_Ailk_Bjlk_4xi8BH_MT032x016x08_GRVW02_GSU02_SNLL0_TT04_02_VW02_WG08_08_02
    SolutionIndex: 5
    SolutionNameMin: Cijk_Ailk_Bjlk_4xi8BH_MT016x016x08_GRVW02_GSU04_SNLL0_TT02_02_VW02_WG08_08_02
    SolutionIndex: 6
    SolutionNameMin: Cijk_Ailk_Bjlk_4xi8BH_MT032x016x08_GRVW02_GSU04_SNLL0_TT04_02_VW02_WG08_08_02
    SolutionIndex: 7
    SolutionNameMin: Cijk_Ailk_Bjlk_4xi8BH_MT016x016x08_GRVW02_GSU08_SNLL0_TT02_02_VW02_WG08_08_02
    SolutionIndex: 8
    SolutionNameMin: Cijk_Ailk_Bjlk_4xi8BH_MT064x016x16_GRVW04_GSU02_SNLL0_TT04_04_VW04_WG16_04_04
    SolutionIndex: 9
    SolutionNameMin: Cijk_Ailk_Bjlk_4xi8BH_MT032x032x16_GRVW04_GSU02_SNLL0_TT04_04_VW04_WG08_08_02
    SolutionIndex: 10
    SolutionNameMin: Cijk_Ailk_Bjlk_4xi8BH_MT064x032x16_GRVW04_GSU02_SNLL0_TT08_04_VW04_WG08_08_02
    SolutionIndex: 11
    SolutionNameMin: Cijk_Ailk_Bjlk_4xi8BH_MT016x016x16_GRVW02_GSU02_SNLL0_TT02_02_VW02_WG08_08_04
    SolutionIndex: 12
    SolutionNameMin: Cijk_Ailk_Bjlk_4xi8BH_MT032x016x16_GRVW02_GSU02_SNLL0_TT04_02_VW02_WG08_08_04
    SolutionIndex: 13
    SolutionNameMin: Cijk_Ailk_Bjlk_4xi8BH_MT064x016x16_GRVW04_GSU02_SNLL0_TT04_04_VW04_WG16_04_04
    SolutionIndex: 14
    SolutionNameMin: Cijk_Ailk_Bjlk_4xi8BH_MT032x032x16_GRVW04_GSU02_SNLL0_TT04_04_VW04_WG08_08_02
    SolutionIndex: 15
    SolutionNameMin: Cijk_Ailk_Bjlk_4xi8BH_MT016x016x16_GRVW02_GSU04_SNLL0_TT02_02_VW02_WG08_08_04
    SolutionIndex: 16
    SolutionNameMin: Cijk_Ailk_Bjlk_4xi8BH_MT032x016x16_GRVW02_GSU04_SNLL0_TT04_02_VW02_WG08_08_04
    SolutionIndex: 17
    SolutionNameMin: Cijk_Ailk_Bjlk_4xi8BH_MT016x016x16_GRVW02_GSU08_SNLL0_TT02_02_VW02_WG08_08_04
    SolutionIndex: 18
    SolutionNameMin: Cijk_Ailk_Bjlk_4xi8BH_MT032x016x16_GRVW02_GSU08_SNLL0_TT04_02_VW02_WG08_08_04
    SolutionIndex: 19
    SolutionNameMin: Cijk_Ailk_Bjlk_4xi8BH_MT032x008x32_GRVW02_GSU02_SNLL0_TT02_02_VW02_WG16_04_04
    SolutionIndex: 20
    SolutionNameMin: Cijk_Ailk_Bjlk_4xi8BH_MT016x016x32_GRVW02_GSU02_SNLL0_TT02_02_VW02_WG08_08_04
    SolutionIndex: 21
    SolutionNameMin: Cijk_Ailk_Bjlk_4xi8BH_MT032x016x32_GRVW02_GSU02_SNLL0_TT04_02_VW02_WG08_08_04
    SolutionIndex: 22
    SolutionNameMin: Cijk_Ailk_Bjlk_4xi8BH_MT032x032x32_GRVW04_GSU02_SNLL0_TT04_04_VW04_WG08_08_04
    SolutionIndex: 23
    SolutionNameMin: Cijk_Ailk_Bjlk_4xi8BH_MT064x032x32_GRVW04_GSU02_SNLL0_TT08_04_VW04_WG08_08_04
    SolutionIndex: 24
    SolutionNameMin: Cijk_Ailk_Bjlk_4xi8BH_MT032x016x32_GRVW02_GSU02_SNLL0_TT04_02_VW02_WG08_08_04
    SolutionIndex: 25
    SolutionNameMin: Cijk_Ailk_Bjlk_4xi8BH_MT032x032x32_GRVW04_GSU02_SNLL0_TT04_04_VW04_WG08_08_04
    SolutionIndex: 26
    SolutionNameMin: Cijk_Ailk_Bjlk_4xi8BH_MT016x016x32_GRVW02_GSU04_SNLL0_TT02_02_VW02_WG08_08_04
    SolutionIndex: 27
    SolutionNameMin: Cijk_Ailk_Bjlk_4xi8BH_MT032x016x32_GRVW02_GSU04_SNLL0_TT04_02_VW02_WG08_08_04
    SolutionIndex: 28
    SolutionNameMin: Cijk_Ailk_Bjlk_4xi8BH_MT032x032x32_GRVW04_GSU04_SNLL0_TT04_04_VW04_WG08_08_04
    SolutionIndex: 29
    SolutionNameMin: Cijk_Ailk_Bjlk_4xi8BH_MT032x008x32_GRVW02_GSU04_SNLL0_TT02_02_VW02_WG16_04_04
    SolutionIndex: 30
    SolutionNameMin: Cijk_Ailk_Bjlk_4xi8BH_MT016x016x32_GRVW02_GSU04_SNLL0_TT02_02_VW02_WG08_08_04
    SolutionIndex: 31
    SolutionNameMin: Cijk_Ailk_Bjlk_4xi8BH_MT032x032x32_GRVW04_GSU04_SNLL0_TT04_04_VW04_WG08_08_04
    SolutionIndex: 32
    SolutionNameMin: Cijk_Ailk_Bjlk_4xi8BH_MT016x016x32_GRVW02_GSU08_SNLL0_TT02_02_VW02_WG08_08_04
    SolutionIndex: 33
    SolutionNameMin: Cijk_Ailk_Bjlk_4xi8BH_MT096x128x16_GRVW02_GSU01_SNLL0_TT06_08_VW02_WG16_16_01
    SolutionIndex: 34
    SolutionNameMin: Cijk_Ailk_Bjlk_4xi8BH_MT064x064x16_GRVW04_GSU01_SNLL1_TT04_04_VW04_WG16_16_01
    SolutionIndex: 35
    SolutionNameMin: Cijk_Ailk_Bjlk_4xi8BH_MT128x064x16_GRVW04_GSU01_SNLL1_TT08_04_VW04_WG16_16_01
    SolutionIndex: 36
    SolutionNameMin: Cijk_Ailk_Bjlk_4xi8BH_MT128x128x16_GRVW04_GSU01_SNLL1_TT08_08_VW04_WG16_16_01
    SolutionIndex: 37
    SolutionNameMin: Cijk_Ailk_Bjlk_4xi8BH_MT064x064x16_GRVW04_GSU01_SNLL1_TT04_04_VW04_WG16_16_01
    SolutionIndex: 38
    SolutionNameMin: Cijk_Ailk_Bjlk_4xi8BH_MT128x064x16_GRVW04_GSU01_SNLL1_TT08_04_VW04_WG16_16_01
    SolutionIndex: 39
    SolutionNameMin: Cijk_Ailk_Bjlk_4xi8BH_MT128x128x16_GRVW04_GSU01_SNLL1_TT08_08_VW04_WG16_16_01
    SolutionIndex: 40
    SolutionNameMin: Cijk_Ailk_Bjlk_4xi8BH_MT016x016x04_GRVW02_GSU01_SNLL0_TT02_02_VW02_WG08_08_01
    SolutionIndex: 41
    SolutionNameMin: Cijk_Ailk_Bjlk_4xi8BH_MT032x032x02_GRVW04_GSU01_SNLL0_TT04_04_VW04_WG08_08_01
    SolutionIndex: 42
    SolutionNameMin: Cijk_Ailk_Bjlk_4xi8BH_MT016x016x08_GRVW02_GSU01_SNLL1_TT02_02_VW02_WG08_08_02
    SolutionIndex: 43
    SolutionNameMin: Cijk_Ailk_Bjlk_4xi8BH_MT008x008x08_GRVW02_GSU01_SNLL1_TT02_02_VW02_WG04_04_04
    SolutionIndex: 44
    SolutionNameMin: Cijk_Ailk_Bjlk_4xi8BH_MT016x016x16_GRVW02_GSU01_SNLL1_TT02_02_VW02_WG08_08_04
    SolutionIndex: 45
    SolutionNameMin: Cijk_Ailk_Bjlk_4xi8BH_MT016x016x04_GRVW02_GSU08_SNLL0_TT02_02_VW02_WG08_08_01
    SolutionIndex: 46
    SolutionNameMin: Cijk_Ailk_Bjlk_4xi8BH_MT008x008x08_GRVW02_GSU08_SNLL0_TT02_02_VW02_WG04_04_04
    SolutionIndex: 47
    SolutionNameMin: Cijk_Ailk_Bjlk_4xi8BH_MT016x016x08_GRVW02_GSU16_SNLL0_TT02_02_VW02_WG08_08_02
    SolutionIndex: 48
    SolutionNameMin: Cijk_Ailk_Bjlk_4xi8BH_MT008x008x08_GRVW02_GSU16_SNLL0_TT02_02_VW02_WG04_04_04
    SolutionIndex: 49
    SolutionNameMin: Cijk_Ailk_Bjlk_4xi8BH_MT016x016x16_GRVW02_GSU16_SNLL0_TT02_02_VW02_WG08_08_04
- - - [1024, 128, 1, 128]
    - [2, 2362.99]
  - - [4, 704, 1, 1280]
    - [17, 763.661]
  - - [4, 1856, 1, 3328]
    - [17, 2137.29]
  - - [1856, 448, 1, 3328]
    - [34, 27279.1]
  - - [2944, 4288, 1, 1280]
    - [37, 36930.5]
  - - [2368, 64, 1, 3328]
    - [25, 20452.8]
  - - [2368, 5888, 1, 256]
    - [34, 35643.6]
  - - [128, 64, 1, 256]
    - [29, 566.798]
  - - [5888, 1024, 1, 1280]
    - [39, 35041.4]
  - - [128, 6784, 1, 3328]
    - [34, 28382.2]
  - - [64, 4, 1, 256]
    - [44, 40.96]
  - - [5888, 1856, 1, 3328]
    - [37, 37494.4]
  - - [5056, 704, 1, 256]
    - [37, 32848.3]
  - - [5888, 2944, 1, 3328]
    - [37, 37428.0]
  - - [1856, 4288, 1, 256]
    - [34, 34827.1]
  - - [1024, 5056, 1, 128]
    - [33, 570.408]
  - - [5056, 5056, 1, 3328]
    - [37, 37740.3]
  - - [1408, 5888, 1, 1280]
    - [37, 36784.5]
  - - [2368, 448, 1, 128]
    - [33, 152.225]
  - - [1024, 3584, 1, 3328]
    - [37, 36588.0]
  - - [4, 2944, 1, 1280]
    - [44, 2059.19]
  - - [1408, 64, 1, 128]
    - [2, 1629.14]
  - - [256, 4288, 1, 3328]
    - [37, 29058.5]
  - - [5888, 1408, 1, 1280]
    - [37, 36815.1]
  - - [704, 1856, 1, 3328]
    - [37, 34375.1]
  - - [4, 1408, 1, 128]
    - [40, 126.473]
  - - [1024, 2368, 1, 256]
    - [37, 28792.1]
  - - [1408, 1856, 1, 1280]
    - [37, 35630.1]
  - - [1408, 64, 1, 1280]
    - [25, 11604.0]
  - - [448, 1024, 1, 1280]
    - [34, 25180.2]
  - - [256, 1408, 1, 3328]
    - [34, 20964.2]
  - - [5056, 5056, 1, 1280]
    - [37, 37593.7]
  - - [448, 5056, 1, 256]
    - [34, 31242.6]
  - - [704, 1856, 1, 1280]
    - [34, 33476.4]
  - - [128, 5056, 1, 128]
    - [2, 3779.08]
  - - [2368, 128, 1, 256]
    - [34, 13019.2]
  - - [1856, 1408, 1, 128]
    - [33, 331.433]
  - - [64, 5056, 1, 256]
    - [34, 13898.9]
  - - [6784, 256, 1, 3328]
    - [37, 33740.5]
  - - [6784, 4288, 1, 3328]
    - [37, 37957.9]
  - - [4288, 448, 1, 256]
    - [37, 29342.6]
  - - [64, 704, 1, 128]
    - [2, 889.995]
  - - [1856, 2368, 1, 3328]
    - [37, 36529.9]
  - - [4288, 2944, 1, 1280]
    - [37, 36871.5]
  - - [704, 5056, 1, 1280]
    - [34, 35252.7]
  - - [2368, 704, 1, 3328]
    - [34, 32429.4]
  - - [256, 5888, 1, 256]
    - [34, 28839.8]
  - - [1856, 4288, 1, 3328]
    - [37, 36765.7]
  - - [256, 2944, 1, 256]
    - [34, 24117.2]
  - - [5888, 1024, 1, 256]
    - [37, 33671.6]
  - - [448, 64, 1, 1280]
    - [21, 5611.65]
  - - [448, 5056, 1, 3328]
    - [34, 34754.3]
  - - [3584, 4, 1, 1280]
    - [44, 2370.81]
  - - [2944, 64, 1, 256]
    - [34, 10048.9]
  - - [128, 4, 1, 1280]
    - [49, 191.626]
  - - [1408, 2944, 1, 256]
    - [37, 33666.2]
  - - [256, 1856, 1, 1280]
    - [34, 26057.2]
  - - [6784, 5056, 1, 3328]
    - [37, 37912.5]
  - - [5056, 5056, 1, 256]
    - [37, 36348.4]
  - - [1408, 6784, 1, 128]
    - [33, 852.465]
  - - [64, 1024, 1, 1280]
    - [22, 10131.2]
  - - [2944, 4, 1, 256]
    - [44, 1382.87]
  - - [704, 5056, 1, 128]
    - [33, 399.816]
  - - [4, 2368, 1, 1280]
    - [44, 1717.3]
  - - [2368, 2944, 1, 1280]
    - [34, 36598.2]
  - - [128, 3584, 1, 1280]
    - [37, 25245.2]
  - - [6784, 6784, 1, 1280]
    - [39, 38377.2]
  - - [1024, 256, 1, 3328]
    - [37, 21573.1]
  - - [1408, 4288, 1, 1280]
    - [37, 35547.4]
  - - [3584, 4288, 1, 1280]
    - [37, 37273.2]
  - - [2368, 704, 1, 1280]
    - [37, 31858.1]
  - - [5056, 4288, 1, 3328]
    - [37, 37779.6]
  - - [3584, 2368, 1, 3328]
    - [37, 36845.7]
  - - [64, 704, 1, 1280]
    - [21, 7608.4]
  - - [4288, 256, 1, 256]
    - [34, 24521.7]
  - - [2944, 128, 1, 128]
    - [2, 3344.97]
  - - [6784, 448, 1, 1280]
    - [37, 34958.8]
  - - [1408, 2944, 1, 128]
    - [33, 476.917]
  - - [4288, 2944, 1, 256]
    - [37, 35560.2]
  - - [5888, 704, 1, 1280]
    - [37, 36217.0]
  - - [1856, 64, 1, 1280]
    - [22, 13290.5]
  - - [448, 5888, 1, 128]
    - [33, 334.749]
  - - [5888, 64, 1, 3328]
    - [23, 22810.1]
  - - [2944, 256, 1, 3328]
    - [37, 31573.4]
  - - [1024, 64, 1, 128]
    - [0, 1290.56]
  - - [5056, 2368, 1, 1280]
    - [37, 37219.9]
  - - [448, 3584, 1, 1280]
    - [37, 30583.5]
  - - [6784, 5888, 1, 256]
    - [34, 36510.0]
  - - [704, 1024, 1, 128]
    - [33, 105.392]
  - - [704, 128, 1, 1280]
    - [25, 11698.1]
  - - [5888, 2944, 1, 128]
    - [33, 1152.44]
  - - [4, 3584, 1, 128]
    - [40, 320.806]
  - - [1408, 448, 1, 1280]
    - [34, 25878.3]
  - - [1024, 1408, 1, 256]
    - [37, 26214.4]
  - - [2368, 2368, 1, 3328]
    - [37, 36264.1]
  - - [1856, 6784, 1, 128]
    - [33, 990.682]
  - - [5056, 704, 1, 3328]
    - [37, 35757.6]
  - - [1408, 1856, 1, 256]
    - [34, 32761.6]
  - - [1408, 704, 1, 3328]
    - [37, 32455.9]
  - - [2368, 5056, 1, 256]
    - [34, 35739.1]
  - - [5888, 1856, 1, 256]
    - [37, 35592.9]
  - - [4288, 64, 1, 3328]
    - [25, 22947.5]
  - - [2368, 4, 1, 1280]
    - [5, 1693.32]
  - - [704, 5888, 1, 256]
    - [34, 33881.2]
  - - [4288, 64, 1, 256]
    - [37, 11748.3]
  - - [6784, 64, 1, 256]
    - [34, 18161.6]
  - - [2944, 256, 1, 256]
    - [34, 24992.0]
  - - [2944, 6784, 1, 3328]
    - [37, 37496.1]
  - - [704, 1408, 1, 3328]
    - [34, 32404.9]
  - - [3584, 704, 1, 3328]
    - [37, 35031.3]
  - - [2944, 256, 1, 128]
    - [33, 101.7]
  - - [6784, 4, 1, 1280]
    - [44, 2722.11]
  - - [1024, 64, 1, 1280]
    - [12, 8886.24]
  - - [448, 4288, 1, 256]
    - [34, 29483.3]
  - - [64, 3584, 1, 3328]
    - [9, 22678.7]
  - - [704, 2368, 1, 1280]
    - [37, 31716.0]
  - - [448, 2944, 1, 128]
    - [33, 186.41]
  - - [1856, 2368, 1, 1280]
    - [37, 36191.5]
  - - [2368, 128, 1, 3328]
    - [25, 24097.7]
  - - [2944, 128, 1, 256]
    - [34, 15919.0]
  - - [448, 1408, 1, 256]
    - [37, 21191.7]
  - - [1856, 4288, 1, 1280]
    - [37, 36548.9]
  - - [64, 5056, 1, 3328]
    - [22, 25267.2]
  - - [4, 704, 1, 256]
    - [44, 444.998]
  - - [1024, 448, 1, 128]
    - [33, 68.2556]
  - - [704, 4, 1, 1280]
    - [17, 776.828]
  - - [704, 256, 1, 128]
    - [33, 26.6604]
  - - [704, 2944, 1, 128]
    - [33, 277.849]
  - - [1408, 1024, 1, 1280]
    - [37, 31471.6]
  - - [704, 6784, 1, 256]
    - [34, 33332.6]
  - - [6784, 704, 1, 256]
    - [37, 33423.7]
  - - [5056, 1408, 1, 128]
    - [33, 695.253]
  - - [256, 3584, 1, 3328]
    - [34, 29994.6]
  - - [4, 5888, 1, 3328]
    - [44, 2937.82]
  - - [128, 1408, 1, 128]
    - [2, 2639.44]
  - - [3584, 4288, 1, 3328]
    - [37, 37550.0]
  - - [5888, 1856, 1, 1280]
    - [37, 37168.5]
  - - [5056, 1024, 1, 3328]
    - [39, 36419.8]
  - - [5056, 64, 1, 1280]
    - [37, 17961.3]
  - - [1024, 704, 1, 256]
    - [37, 22783.9]
  - - [1024, 4288, 1, 128]
    - [33, 474.661]
  - - [4288, 64, 1, 1280]
    - [25, 16553.9]
  - - [2368, 3584, 1, 1280]
    - [37, 36584.0]
  - - [2368, 6784, 1, 1280]
    - [37, 37229.5]
  - - [1024, 256, 1, 256]
    - [37, 12955.4]
  - - [1856, 4, 1, 1280]
    - [44, 1393.36]
  - - [448, 448, 1, 256]
    - [34, 10443.1]
  - - [2944, 3584, 1, 3328]
    - [37, 36986.2]
  - - [128, 4288, 1, 128]
    - [2, 3505.72]
  - - [64, 448, 1, 256]
    - [34, 1609.66]
  - - [128, 1024, 1, 3328]
    - [8, 20421.7]
  - - [4, 1408, 1, 3328]
    - [7, 1998.22]
  - - [6784, 2944, 1, 256]
    - [34, 35995.9]
  - - [64, 1856, 1, 1280]
    - [22, 13551.1]
  - - [64, 1024, 1, 128]
    - [2, 1271.0]
  - - [4288, 2368, 1, 3328]
    - [37, 37475.6]
  - - [1856, 2368, 1, 256]
    - [34, 34239.9]
  - - [3584, 256, 1, 128]
    - [33, 127.166]
  - - [3584, 6784, 1, 3328]
    - [37, 37857.1]
  - - [256, 1024, 1, 256]
    - [37, 13315.3]
  - - [4, 6784, 1, 3328]
    - [45, 2749.96]
  - - [1024, 5888, 1, 3328]
    - [37, 37093.9]
  - - [1024, 128, 1, 1280]
    - [4, 10994.2]
  - - [4288, 128, 1, 1280]
    - [34, 22488.7]
  - - [5056, 4288, 1, 1280]
    - [37, 37614.6]
  - - [5888, 64, 1, 256]
    - [34, 15971.7]
  - - [1856, 256, 1, 1280]
    - [34, 26214.4]
  - - [64, 5888, 1, 3328]
    - [22, 24982.0]
  - - [2944, 5888, 1, 128]
    - [33, 1151.82]
  - - [704, 5888, 1, 1280]
    - [37, 36162.7]
  - - [2368, 3584, 1, 128]
    - [33, 812.473]
  - - [6784, 5888, 1, 3328]
    - [39, 37938.3]
  - - [704, 1024, 1, 1280]
    - [34, 29256.4]
  - - [448, 256, 1, 3328]
    - [25, 19065.0]
  - - [448, 1856, 1, 128]
    - [33, 106.112]
  - - [128, 1024, 1, 128]
    - [2, 2323.71]
  - - [2944, 4, 1, 128]
    - [40, 264.444]
  - - [1024, 704, 1, 1280]
    - [37, 28710.2]
  - - [128, 5888, 1, 256]
    - [34, 24299.5]
  - - [1024, 5056, 1, 1280]
    - [37, 36024.1]
  - - [4288, 1024, 1, 256]
    - [37, 33394.9]
  - - [2944, 2368, 1, 128]
    - [33, 686.805]
  - - [704, 704, 1, 3328]
    - [34, 28595.9]
  - - [704, 1408, 1, 1280]
    - [34, 31452.1]
  - - [5888, 448, 1, 1280]
    - [37, 33024.4]
  - - [3584, 256, 1, 3328]
    - [34, 29947.6]
  - - [704, 5888, 1, 3328]
    - [34, 36558.7]
  - - [704, 1856, 1, 128]
    - [33, 181.283]
  - - [128, 3584, 1, 3328]
    - [34, 26496.5]
  - - [6784, 2368, 1, 1280]
    - [37, 37177.0]
  - - [4, 4288, 1, 128]
    - [40, 305.774]
  - - [128, 704, 1, 1280]
    - [25, 11674.4]
  - - [3584, 2944, 1, 256]
    - [34, 35125.3]
  - - [1856, 128, 1, 3328]
    - [14, 23294.8]
  - - [4, 64, 1, 1280]
    - [15, 97.5238]
  - - [4, 5056, 1, 3328]
    - [44, 3010.08]
  - - [128, 2944, 1, 1280]
    - [34, 20808.7]
  - - [2368, 1024, 1, 3328]
    - [35, 32383.0]
  - - [128, 256, 1, 3328]
    - [16, 9226.05]
  - - [1408, 5056, 1, 3328]
    - [37, 36392.5]
  - - [1856, 1856, 1, 3328]
    - [37, 34607.5]
  - - [3584, 128, 1, 256]
    - [34, 18820.6]
  - - [448, 1408, 1, 3328]
    - [34, 26755.7]
  - - [2368, 2368, 1, 256]
    - [34, 32834.0]
  - - [4288, 4288, 1, 1280]
    - [37, 37218.2]
  - - [64, 448, 1, 1280]
    - [21, 6178.48]
  - - [1408, 4288, 1, 256]
    - [34, 33835.4]
  - - [448, 4, 1, 256]
    - [44, 309.968]
  - - [5888, 448, 1, 128]
    - [33, 335.374]
  - - [448, 4, 1, 1280]
    - [7, 518.95]
  - - [704, 6784, 1, 3328]
    - [37, 35672.7]
  - - [5888, 5888, 1, 1280]
    - [37, 37648.7]
  - - [5056, 1024, 1, 1280]
    - [39, 35571.7]
  - - [448, 5888, 1, 3328]
    - [34, 33429.9]
  - - [128, 4, 1, 128]
    - [40, 12.0029]
  - - [1024, 2944, 1, 1280]
    - [37, 34257.5]
  - - [5056, 5888, 1, 1280]
    - [37, 37711.5]
  - - [4288, 5888, 1, 128]
    - [33, 1323.71]
  - - [256, 3584, 1, 256]
    - [34, 24828.9]
  - - [1408, 3584, 1, 128]
    - [33, 557.032]
  - - [256, 2944, 1, 3328]
    - [34, 31645.1]
  - - [448, 3584, 1, 128]
    - [33, 213.293]
  - - [5888, 2944, 1, 1280]
    - [37, 37160.6]
  - - [4, 6784, 1, 1280]
    - [42, 2498.85]
  - - [2368, 5888, 1, 128]
    - [33, 1051.86]
  - - [64, 2944, 1, 128]
    - [2, 2722.04]
  - - [3584, 5888, 1, 256]
    - [37, 36111.4]
  - - [2368, 704, 1, 128]
    - [33, 227.218]
  - - [3584, 2944, 1, 1280]
    - [37, 36800.2]
  - - [3584, 2368, 1, 128]
    - [33, 773.152]
  - - [5056, 704, 1, 128]
    - [33, 402.067]
  - - [448, 2368, 1, 128]
    - [33, 137.842]
  - - [5056, 1408, 1, 3328]
    - [39, 36379.1]
  - - [1408, 704, 1, 256]
    - [34, 27582.1]
  - - [6784, 1024, 1, 3328]
    - [37, 35943.7]
  - - [6784, 2944, 1, 3328]
    - [37, 37483.0]
  - - [2944, 5056, 1, 3328]
    - [37, 37632.3]
  - - [1856, 1856, 1, 256]
    - [34, 32114.1]
  - - [1024, 5888, 1, 128]
    - [33, 599.242]
  - - [2048, 7133, 1, 2048]
    - [36, 37702.9]
  - - [256, 4, 1, 128]
    - [40, 23.8313]
  - - [4288, 5888, 1, 1280]
    - [37, 37476.1]
  - - [4288, 4288, 1, 256]
    - [34, 35959.2]
  - - [448, 2944, 1, 3328]
    - [34, 29713.9]
  - - [4288, 1856, 1, 1280]
    - [37, 36493.9]
  - - [1856, 2944, 1, 3328]
    - [37, 36960.2]
  - - [256, 6784, 1, 3328]
    - [34, 33716.9]
  - - [64, 5888, 1, 256]
    - [34, 16078.2]
  - - [256, 5056, 1, 128]
    - [33, 166.414]
  - - [5056, 1024, 1, 256]
    - [37, 33554.4]
  - - [704, 64, 1, 3328]
    - [28, 13222.8]
  - - [5056, 1856, 1, 3328]
    - [34, 37401.8]
  - - [4, 2944, 1, 3328]
    - [7, 2558.13]
  - - [4, 5056, 1, 256]
    - [44, 1946.37]
  - - [1856, 1408, 1, 256]
    - [34, 32729.5]
  - - [3584, 4, 1, 128]
    - [40, 320.806]
  - - [448, 448, 1, 3328]
    - [25, 21574.4]
  - - [6784, 128, 1, 3328]
    - [37, 28354.4]
  - - [4288, 1408, 1, 128]
    - [33, 645.442]
  - - [4288, 5056, 1, 256]
    - [34, 36318.0]
  - - [1408, 128, 1, 1280]
    - [25, 14902.2]
  - - [5056, 256, 1, 3328]
    - [37, 34003.4]
  - - [704, 704, 1, 256]
    - [34, 21006.2]
  - - [1024, 5888, 1, 1280]
    - [37, 36379.4]
  - - [6784, 2368, 1, 128]
    - [33, 1082.77]
  - - [4, 5056, 1, 1280]
    - [44, 2777.55]
  - - [64, 128, 1, 256]
    - [34, 546.133]
  - - [128, 1856, 1, 1280]
    - [34, 18208.8]
  - - [5056, 3584, 1, 256]
    - [37, 35810.6]
  - - [1856, 1024, 1, 1280]
    - [34, 30942.5]
  - - [6784, 4288, 1, 1280]
    - [37, 37756.0]
  - - [1856, 1856, 1, 1280]
    - [34, 34233.4]
  - - [6784, 2944, 1, 128]
    - [33, 1216.49]
  - - [1408, 5056, 1, 1280]
    - [34, 36039.1]
  - - [4, 2368, 1, 3328]
    - [15, 2338.49]
  - - [5888, 1856, 1, 128]
    - [33, 909.47]
  - - [448, 704, 1, 1280]
    - [37, 17521.8]
  - - [2368, 1024, 1, 128]
    - [33, 308.356]
  - - [1024, 448, 1, 3328]
    - [34, 26432.2]
  - - [1856, 704, 1, 1280]
    - [34, 33503.2]
  - - [5056, 3584, 1, 128]
    - [33, 1162.9]
  - - [5888, 5888, 1, 3328]
    - [37, 37846.6]
  - - [6784, 1024, 1, 256]
    - [37, 34278.8]
  - - [2944, 2368, 1, 256]
    - [34, 34721.3]
  - - [256, 448, 1, 256]
    - [34, 6220.37]
  - - [5056, 5888, 1, 3328]
    - [39, 37893.9]
  - - [1856, 1024, 1, 256]
    - [34, 28995.2]
  - - [448, 1408, 1, 1280]
    - [37, 25729.9]
  - - [3584, 448, 1, 1280]
    - [37, 30729.8]
  - - [1024, 1024, 1, 1280]
    - [37, 31477.0]
  - - [448, 5888, 1, 256]
    - [34, 30390.8]
  - - [704, 64, 1, 128]
    - [2, 898.313]
  - - [1408, 6784, 1, 3328]
    - [37, 37070.4]
  - - [448, 1024, 1, 128]
    - [33, 67.6719]
  - - [4288, 704, 1, 128]
    - [33, 369.013]
  - - [128, 1856, 1, 128]
    - [2, 2901.59]
  - - [448, 2368, 1, 3328]
    - [34, 28051.4]
  - - [5056, 64, 1, 128]
    - [2, 3281.99]
  - - [5056, 2944, 1, 256]
    - [34, 36036.7]
  - - [6784, 5888, 1, 128]
    - [33, 1525.39]
  - - [704, 1024, 1, 256]
    - [34, 23843.6]
  - - [1024, 4, 1, 256]
    - [44, 647.269]
  - - [2368, 1856, 1, 256]
    - [34, 34012.2]
  - - [128, 6784, 1, 1280]
    - [37, 27512.1]
  - - [1408, 3584, 1, 3328]
    - [37, 35828.0]
  - - [2368, 6784, 1, 256]
    - [34, 35904.6]
  - - [5056, 1408, 1, 1280]
    - [37, 36096.2]
  - - [256, 256, 1, 128]
    - [0, 1302.58]
  - - [5056, 4288, 1, 128]
    - [33, 1245.43]
  - - [1408, 1856, 1, 128]
    - [33, 331.171]
  - - [1408, 5888, 1, 3328]
    - [39, 37264.8]
  - - [1856, 256, 1, 256]
    - [34, 20205.1]
  - - [6784, 6784, 1, 256]
    - [36, 36717.2]
  - - [64, 256, 1, 128]
    - [1, 339.345]
  - - [4288, 2368, 1, 128]
    - [33, 881.279]
  - - [1856, 4288, 1, 128]
    - [33, 764.325]
  - - [256, 4288, 1, 1280]
    - [34, 28282.8]
  - - [2368, 2944, 1, 256]
    - [34, 34748.4]
  - - [4, 1856, 1, 256]
    - [44, 1144.91]
  - - [3584, 1856, 1, 1280]
    - [37, 36284.1]
  - - [6784, 6784, 1, 128]
    - [33, 1589.16]
  - - [256, 1856, 1, 128]
    - [33, 70.6194]
  - - [704, 64, 1, 1280]
    - [21, 7648.76]
  - - [5888, 5056, 1, 256]
    - [34, 36467.8]
  - - [3584, 448, 1, 256]
    - [34, 27586.7]
  - - [448, 4288, 1, 128]
    - [33, 256.185]
  - - [2944, 4288, 1, 3328]
    - [37, 37125.8]
  - - [256, 6784, 1, 256]
    - [34, 29173.0]
  - - [1408, 4288, 1, 128]
    - [33, 642.683]
  - - [2944, 704, 1, 3328]
    - [37, 35484.8]
  - - [128, 448, 1, 256]
    - [34, 3205.25]
  - - [512, 32, 1, 512]
    - [20, 1777.25]
  - - [3584, 3584, 1, 256]
    - [37, 35305.3]
  - - [448, 1408, 1, 128]
    - [33, 91.8068]
  - - [128, 256, 1, 1280]
    - [24, 6452.78]
  - - [3584, 5056, 1, 256]
    - [34, 35816.1]
  - - [6784, 128, 1, 256]
    - [34, 23851.7]
  - - [4288, 4, 1, 256]
    - [44, 1675.92]
  - - [64, 1408, 1, 3328]
    - [22, 18466.3]
  - - [704, 448, 1, 256]
    - [34, 13501.7]
  - - [2944, 2368, 1, 1280]
    - [37, 36562.2]
  - - [448, 64, 1, 3328]
    - [27, 9561.16]
  - - [1408, 3584, 1, 256]
    - [34, 33571.9]
  - - [3584, 4, 1, 3328]
    - [15, 2578.93]
  - - [6784, 3584, 1, 256]
    - [37, 36408.2]
  - - [256, 128, 1, 128]
    - [1, 678.69]
  - - [704, 1408, 1, 128]
    - [33, 138.959]
  - - [4, 2368, 1, 256]
    - [44, 1188.64]
  - - [2944, 448, 1, 128]
    - [33, 171.548]
  - - [128, 1408, 1, 256]
    - [37, 10207.4]
  - - [4, 2944, 1, 256]
    - [44, 1395.67]
  - - [64, 128, 1, 3328]
    - [17, 5163.44]
  - - [5056, 2368, 1, 128]
    - [33, 959.536]
  - - [2944, 2944, 1, 3328]
    - [37, 36606.2]
  - - [5056, 6784, 1, 256]
    - [34, 36577.4]
  - - [1856, 3584, 1, 128]
    - [33, 679.275]
  - - [128, 2944, 1, 128]
    - [2, 3344.97]
  - - [1024, 704, 1, 3328]
    - [37, 30208.3]
  - - [6784, 448, 1, 256]
    - [34, 32418.5]
  - - [3584, 6784, 1, 128]
    - [33, 1269.24]
  - - [128, 4288, 1, 256]
    - [34, 18439.5]
  - - [704, 448, 1, 3328]
    - [34, 18408.0]
  - - [1024, 1024, 1, 3328]
    - [35, 32921.3]
  - - [128, 128, 1, 3328]
    - [30, 6972.63]
  - - [5056, 1856, 1, 256]
    - [37, 35421.5]
  - - [256, 128, 1, 256]
    - [34, 1941.81]
  - - [1024, 1856, 1, 256]
    - [37, 28254.3]
  - - [4288, 64, 1, 128]
    - [2, 2814.69]
  - - [256, 448, 1, 3328]
    - [25, 18438.7]
  - - [1408, 6784, 1, 1280]
    - [37, 36839.8]
  - - [3584, 3584, 1, 1280]
    - [37, 37403.1]
  - - [64, 2368, 1, 1280]
    - [9, 13836.4]
  - - [448, 2368, 1, 1280]
    - [37, 27465.7]
  - - [5888, 5888, 1, 128]
    - [33, 1475.19]
  - - [64, 6784, 1, 3328]
    - [34, 25164.4]
  - - [2944, 256, 1, 1280]
    - [37, 30664.0]
  - - [5056, 5888, 1, 128]
    - [33, 1400.36]
  - - [256, 2368, 1, 128]
    - [33, 90.017]
  - - [5056, 2368, 1, 3328]
    - [37, 37522.2]
  - - [2944, 4288, 1, 256]
    - [37, 35568.0]
  - - [1408, 3584, 1, 1280]
    - [37, 35424.1]
  - - [2368, 64, 1, 256]
    - [34, 8116.59]
  - - [64, 448, 1, 3328]
    - [31, 10023.2]
  - - [256, 256, 1, 3328]
    - [22, 15188.3]
  - - [5888, 4, 1, 128]
    - [40, 408.49]
  - - [1856, 704, 1, 256]
    - [34, 29393.3]
  - - [4, 4288, 1, 1280]
    - [44, 2558.81]
  - - [1408, 448, 1, 3328]
    - [37, 26728.4]
  - - [1024, 4, 1, 3328]
    - [15, 1752.12]
  - - [2368, 256, 1, 256]
    - [34, 20747.2]
  - - [2368, 6784, 1, 3328]
    - [37, 37399.1]
  - - [1856, 1408, 1, 1280]
    - [37, 35691.0]
  - - [1856, 448, 1, 1280]
    - [34, 26567.8]
  - - [6784, 704, 1, 128]
    - [33, 526.982]
  - - [4, 4, 1, 256]
    - [44, 1.8789]
  - - [128, 5888, 1, 128]
    - [2, 3759.51]
  - - [1408, 5888, 1, 256]
    - [34, 35091.2]
  - - [704, 2944, 1, 1280]
    - [37, 34888.2]
  - - [1856, 2368, 1, 128]
    - [33, 504.44]
  - - [4096, 7133, 1, 4096]
    - [36, 38459.9]
  - - [256, 64, 1, 256]
    - [20, 1081.01]
  - - [1024, 1024, 1, 256]
    - [37, 25663.0]
  - - [704, 1856, 1, 256]
    - [37, 29086.6]
  - - [128, 4288, 1, 3328]
    - [22, 26627.1]
  - - [3584, 704, 1, 1280]
    - [37, 34541.3]
  - - [256, 128, 1, 1280]
    - [6, 6260.16]
  - - [2368, 4, 1, 256]
    - [44, 1224.66]
  - - [256, 2368, 1, 1280]
    - [34, 24743.2]
  - - [2944, 6784, 1, 128]
    - [33, 1182.5]
  - - [3584, 448, 1, 3328]
    - [37, 31285.4]
  - - [1408, 4, 1, 256]
    - [44, 858.21]
  - - [704, 2368, 1, 3328]
    - [37, 32406.6]
  - - [2944, 448, 1, 256]
    - [34, 26133.2]
  - - [1856, 448, 1, 128]
    - [33, 116.147]
  - - [2368, 128, 1, 1280]
    - [25, 17061.3]
  - - [256, 5888, 1, 128]
    - [33, 202.662]
  - - [64, 6784, 1, 256]
    - [34, 18281.1]
  - - [64, 5056, 1, 1280]
    - [34, 18166.1]
  - - [4, 6784, 1, 128]
    - [40, 466.856]
  - - [2944, 2944, 1, 1280]
    - [37, 36316.4]
  - - [5888, 2368, 1, 256]
    - [34, 35544.2]
  - - [4, 3584, 1, 1280]
    - [44, 2389.33]
  - - [1408, 128, 1, 128]
    - [2, 2639.44]
  - - [6784, 704, 1, 3328]
    - [37, 35659.9]
  - - [128, 64, 1, 1280]
    - [30, 2340.57]
  - - [2368, 256, 1, 1280]
    - [34, 24870.1]
  - - [4, 448, 1, 3328]
    - [49, 1024.7]
  - - [5888, 4288, 1, 128]
    - [33, 1321.97]
  - - [4, 5888, 1, 256]
    - [44, 1957.57]
  - - [1408, 2944, 1, 3328]
    - [37, 36611.1]
  - - [3584, 704, 1, 128]
    - [33, 317.538]
  - - [64, 1024, 1, 256]
    - [37, 3901.68]
  - - [5056, 5056, 1, 128]
    - [33, 1326.74]
  - - [2368, 448, 1, 1280]
    - [34, 27610.9]
  - - [128, 3584, 1, 256]
    - [34, 18942.0]
  - - [704, 448, 1, 1280]
    - [34, 17537.0]
  - - [448, 5056, 1, 128]
    - [33, 288.592]
  - - [256, 4, 1, 1280]
    - [17, 372.364]
  - - [128, 5056, 1, 256]
    - [34, 21295.0]
  - - [1408, 5056, 1, 128]
    - [33, 707.233]
  - - [2944, 3584, 1, 128]
    - [33, 859.215]
  - - [3584, 2368, 1, 256]
    - [34, 34795.8]
  - - [5888, 5056, 1, 1280]
    - [37, 37648.2]
  - - [2368, 5056, 1, 128]
    - [33, 959.392]
  - - [64, 704, 1, 256]
    - [34, 2563.19]
  - - [4288, 256, 1, 1280]
    - [37, 28397.2]
  - - [3584, 3584, 1, 3328]
    - [37, 37718.9]
  - - [1024, 256, 1, 128]
    - [33, 39.3998]
  - - [4, 704, 1, 128]
    - [40, 62.7958]
  - - [5888, 6784, 1, 256]
    - [34, 36520.4]
  - - [4288, 2944, 1, 3328]
    - [37, 37131.7]
  - - [2944, 64, 1, 128]
    - [2, 2753.11]
  - - [1856, 64, 1, 256]
    - [37, 6361.65]
  - - [4288, 128, 1, 3328]
    - [25, 26116.9]
  - - [4288, 704, 1, 1280]
    - [34, 34760.7]
  - - [256, 5056, 1, 1280]
    - [34, 33121.8]
  - - [1408, 256, 1, 128]
    - [33, 53.4616]
  - - [2944, 5888, 1, 3328]
    - [39, 37422.1]
  - - [6784, 5888, 1, 1280]
    - [37, 37735.5]
  - - [704, 128, 1, 256]
    - [37, 5364.81]
  - - [5888, 4288, 1, 1280]
    - [37, 37509.1]
  - - [448, 256, 1, 1280]
    - [22, 12809.8]
  - - [5888, 3584, 1, 128]
    - [33, 1239.09]
  - - [1856, 1856, 1, 128]
    - [33, 419.682]
  - - [5056, 4, 1, 1280]
    - [44, 2876.3]
  - - [256, 1408, 1, 1280]
    - [34, 20042.3]
  - - [512, 16, 1, 512]
    - [15, 903.945]
  - - [704, 3584, 1, 128]
    - [33, 320.093]
  - - [5888, 448, 1, 3328]
    - [34, 33457.9]
  - - [2368, 4288, 1, 1280]
    - [37, 37160.1]
  - - [4288, 2944, 1, 128]
    - [33, 979.663]
  - - [1024, 6784, 1, 3328]
    - [37, 36729.5]
  - - [128, 2368, 1, 256]
    - [34, 12889.5]
  - - [6784, 64, 1, 3328]
    - [34, 25042.2]
  - - [5056, 2944, 1, 3328]
    - [37, 37683.2]
  - - [448, 128, 1, 256]
    - [34, 3276.8]
  - - [2944, 3584, 1, 256]
    - [37, 35189.3]
  - - [1408, 1408, 1, 3328]
    - [34, 33962.9]
  - - [1856, 128, 1, 1280]
    - [34, 18274.5]
  - - [3584, 3584, 1, 128]
    - [33, 954.857]
  - - [64, 3584, 1, 256]
    - [34, 12032.8]
  - - [1408, 4, 1, 3328]
    - [17, 2041.75]
  - - [128, 2944, 1, 3328]
    - [22, 25531.3]
  - - [3584, 704, 1, 256]
    - [34, 31416.5]
  - - [2944, 448, 1, 3328]
    - [37, 29713.9]
  - - [3584, 1408, 1, 3328]
    - [37, 35821.8]
  - - [704, 3584, 1, 1280]
    - [37, 34379.5]
  - - [2944, 6784, 1, 1280]
    - [37, 37277.7]
  - - [1856, 6784, 1, 256]
    - [34, 35475.7]
  - - [4288, 448, 1, 3328]
    - [37, 32998.7]
  - - [6784, 4288, 1, 128]
    - [33, 1358.87]
  - - [6784, 704, 1, 1280]
    - [37, 35356.8]
  - - [256, 4288, 1, 256]
    - [34, 23774.8]
  - - [3584, 64, 1, 128]
    - [2, 2775.06]
  - - [5888, 1024, 1, 3328]
    - [39, 35807.0]
  - - [448, 64, 1, 128]
    - [1, 590.035]
  - - [704, 6784, 1, 1280]
    - [34, 35267.1]
  - - [5888, 128, 1, 256]
    - [34, 24863.1]
  - - [2368, 448, 1, 3328]
    - [37, 28136.4]
  - - [1856, 5056, 1, 3328]
    - [37, 37425.1]
  - - [4, 6784, 1, 256]
    - [44, 2055.27]
  - - [1024, 3584, 1, 128]
    - [33, 446.729]
  - - [1024, 1408, 1, 128]
    - [33, 203.212]
  - - [2368, 2944, 1, 128]
    - [33, 716.289]
  - - [5056, 64, 1, 256]
    - [34, 13852.4]
  - - [4, 448, 1, 1280]
    - [46, 548.746]
  - - [5056, 2944, 1, 128]
    - [33, 1063.81]
  - - [5888, 5056, 1, 3328]
    - [36, 37868.4]
  - - [1024, 704, 1, 128]
    - [33, 101.548]
  - - [1408, 2368, 1, 128]
    - [33, 405.722]
  - - [5888, 2368, 1, 128]
    - [33, 1029.94]
  - - [128, 5056, 1, 3328]
    - [37, 27311.4]
  - - [3584, 6784, 1, 1280]
    - [37, 37573.0]
  - - [3072, 7435, 1, 1024]
    - [37, 36698.2]
  - - [1856, 5888, 1, 256]
    - [34, 35638.2]
  - - [256, 256, 1, 256]
    - [34, 3695.42]
  - - [256, 64, 1, 128]
    - [1, 333.941]
  - - [4288, 4288, 1, 3328]
    - [37, 37440.3]
  - - [4288, 1408, 1, 1280]
    - [34, 35560.5]
  - - [3584, 5056, 1, 128]
    - [33, 1161.14]
  - - [4, 1024, 1, 3328]
    - [15, 1756.64]
  - - [4288, 2368, 1, 256]
    - [34, 35511.2]
  - - [2944, 5056, 1, 1280]
    - [37, 37415.3]
  - - [448, 6784, 1, 256]
    - [34, 32418.5]
  - - [64, 1024, 1, 3328]
    - [22, 15668.4]
  - - [6784, 2368, 1, 3328]
    - [37, 37417.4]
  - - [256, 1024, 1, 1280]
    - [34, 19925.4]
  - - [704, 4, 1, 128]
    - [40, 64.5964]
  - - [256, 4, 1, 256]
    - [44, 189.959]
  - - [4288, 128, 1, 256]
    - [34, 18439.5]
  - - [4288, 1856, 1, 3328]
    - [37, 36746.3]
  - - [3584, 448, 1, 128]
    - [33, 212.508]
  - - [256, 4, 1, 3328]
    - [49, 788.859]
  - - [4, 1408, 1, 1280]
    - [15, 1234.41]
  - - [3584, 64, 1, 1280]
    - [34, 17518.0]
  - - [1408, 448, 1, 128]
    - [33, 94.303]
  - - [3584, 1024, 1, 1280]
    - [38, 34592.2]
  - - [1856, 5056, 1, 256]
    - [34, 35600.0]
  - - [4, 3584, 1, 256]
    - [44, 1568.38]
  - - [1024, 4288, 1, 256]
    - [34, 32116.4]
  - - [5888, 3584, 1, 3328]
    - [37, 37773.6]
  - - [4, 256, 1, 256]
    - [44, 182.044]
  - - [5056, 3584, 1, 3328]
    - [37, 37417.9]
  - - [128, 5888, 1, 1280]
    - [34, 30547.5]
  - - [704, 448, 1, 128]
    - [33, 47.0778]
  - - [2368, 1408, 1, 1280]
    - [37, 35576.1]
  - - [5056, 2944, 1, 1280]
    - [37, 37399.2]
  - - [4, 4, 1, 128]
    - [41, 0.179965]
  - - [3584, 256, 1, 256]
    - [34, 25094.1]
  - - [128, 1856, 1, 3328]
    - [9, 23432.9]
  - - [1024, 6784, 1, 256]
    - [34, 33303.1]
  - - [4, 128, 1, 256]
    - [44, 94.9797]
  - - [64, 64, 1, 1280]
    - [26, 1087.73]
  - - [6784, 4, 1, 128]
    - [40, 469.379]
  - - [2944, 1408, 1, 128]
    - [33, 480.032]
  - - [448, 128, 1, 3328]
    - [31, 14348.9]
  - - [64, 2944, 1, 3328]
    - [25, 21489.0]
  - - [64, 4288, 1, 3328]
    - [25, 23771.7]
  - - [5056, 6784, 1, 3328]
    - [37, 37956.2]
  - - [128, 2944, 1, 256]
    - [34, 15711.6]
  - - [128, 6784, 1, 128]
    - [2, 3772.88]
  - - [3584, 4288, 1, 256]
    - [37, 35883.4]
  - - [448, 1856, 1, 256]
    - [34, 23036.9]
  - - [1856, 6784, 1, 3328]
    - [37, 37045.1]
  - - [3584, 128, 1, 3328]
    - [34, 26459.7]
  - - [64, 1856, 1, 256]
    - [34, 6388.38]
  - - [1024, 448, 1, 1280]
    - [34, 24902.6]
  - - [5888, 4288, 1, 256]
    - [37, 36303.2]
  - - [4, 448, 1, 128]
    - [40, 40.8142]
  - - [5056, 1408, 1, 256]
    - [34, 34333.6]
  - - [64, 256, 1, 1280]
    - [27, 3666.35]
  - - [3584, 1024, 1, 256]
    - [37, 31443.2]
  - - [256, 704, 1, 256]
    - [34, 10438.3]
  - - [5888, 5888, 1, 256]
    - [34, 36418.3]
  - - [4288, 1024, 1, 1280]
    - [37, 35017.9]
  - - [5888, 128, 1, 3328]
    - [37, 31581.4]
  - - [448, 6784, 1, 3328]
    - [34, 35464.8]
  - - [2944, 1408, 1, 1280]
    - [37, 36172.6]
  - - [1024, 32, 1, 512]
    - [11, 3039.35]
  - - [2944, 1856, 1, 3328]
    - [37, 36988.7]
  - - [2368, 64, 1, 128]
    - [2, 2229.73]
  - - [2944, 2944, 1, 128]
    - [33, 750.899]
  - - [4, 128, 1, 3328]
    - [17, 425.984]
  - - [3584, 5888, 1, 1280]
    - [37, 37461.6]
  - - [64, 4, 1, 128]
    - [40, 3.65714]
  - - [6784, 1856, 1, 1280]
    - [37, 36801.0]
  - - [2944, 5056, 1, 256]
    - [34, 36050.4]
  - - [2944, 5888, 1, 1280]
    - [37, 37127.1]
  - - [5888, 256, 1, 3328]
    - [37, 33807.7]
  - - [1856, 5888, 1, 3328]
    - [37, 37449.6]
  - - [3584, 1408, 1, 256]
    - [34, 33381.0]
  - - [704, 3584, 1, 3328]
    - [34, 35022.5]
  - - [5056, 448, 1, 1280]
    - [37, 34246.5]
  - - [3584, 1856, 1, 3328]
    - [37, 36576.5]
  - - [64, 1408, 1, 128]
    - [2, 1615.45]
  - - [1408, 704, 1, 1280]
    - [37, 31593.1]
  - - [2944, 1024, 1, 256]
    - [37, 30944.3]
  - - [1024, 2368, 1, 128]
    - [33, 308.215]
  - - [2368, 4288, 1, 3328]
    - [37, 37439.0]
  - - [4, 1408, 1, 256]
    - [43, 661.372]
  - - [1024, 1408, 1, 1280]
    - [37, 31279.6]
  - - [64, 64, 1, 256]
    - [17, 266.136]
  - - [704, 256, 1, 3328]
    - [34, 15062.4]
  - - [6784, 5056, 1, 256]
    - [34, 36580.5]
  - - [4, 4288, 1, 3328]
    - [44, 2718.18]
  - - [448, 6784, 1, 128]
    - [33, 369.14]
  - - [4, 704, 1, 3328]
    - [48, 1374.14]
  - - [448, 2944, 1, 256]
    - [34, 25892.8]
  - - [2944, 6784, 1, 256]
    - [34, 36153.7]
  - - [2368, 2368, 1, 1280]
    - [37, 35977.5]
  - - [4, 4, 1, 1280]
    - [17, 5.36126]
  - - [1856, 3584, 1, 1280]
    - [37, 36234.7]
  - - [64, 2944, 1, 256]
    - [34, 9924.79]
  - - [3584, 1408, 1, 1280]
    - [37, 35490.3]
  - - [448, 256, 1, 128]
    - [2, 2061.81]
  - - [4288, 448, 1, 128]
    - [33, 252.165]
  - - [5056, 256, 1, 1280]
    - [34, 33228.0]
  - - [1856, 1408, 1, 3328]
    - [37, 36228.0]
  - - [128, 128, 1, 128]
    - [1, 335.008]
  - - [1024, 4288, 1, 3328]
    - [37, 36390.5]
  - - [448, 2368, 1, 256]
    - [34, 23864.8]
  - - [1024, 4, 1, 128]
    - [40, 92.3042]
  - - [5056, 448, 1, 256]
    - [37, 31209.0]
  - - [2944, 2368, 1, 3328]
    - [37, 36921.6]
  - - [704, 128, 1, 3328]
    - [25, 18534.8]
  - - [64, 64, 1, 3328]
    - [18, 2242.02]
  - - [1024, 1856, 1, 1280]
    - [37, 31766.7]
  - - [6784, 1856, 1, 256]
    - [34, 35413.3]
  - - [128, 2368, 1, 3328]
    - [25, 24236.7]
  - - [1024, 5888, 1, 256]
    - [37, 32784.7]
  - - [5056, 128, 1, 1280]
    - [34, 26364.6]
  - - [5056, 64, 1, 3328]
    - [25, 24710.6]
  - - [128, 704, 1, 128]
    - [2, 1633.76]
  - - [1408, 2368, 1, 256]
    - [34, 33160.1]
  - - [1408, 1408, 1, 256]
    - [34, 30353.5]
  - - [4, 64, 1, 128]
    - [40, 6.50159]
  - - [64, 128, 1, 1280]
    - [26, 2647.92]
  - - [2368, 2368, 1, 128]
    - [33, 597.657]
  - - [64, 5888, 1, 128]
    - [2, 3363.63]
  - - [5888, 4, 1, 3328]
    - [44, 2931.23]
  - - [6784, 1408, 1, 128]
    - [33, 839.945]
  - - [4288, 5888, 1, 256]
    - [34, 36278.8]
  - - [1408, 5056, 1, 256]
    - [34, 34411.3]
  - - [5056, 128, 1, 3328]
    - [37, 27297.5]
  - - [128, 128, 1, 1280]
    - [27, 4228.13]
  - - [448, 704, 1, 256]
    - [34, 13412.0]
  - - [4288, 3584, 1, 128]
    - [33, 1092.97]
  - - [2944, 128, 1, 3328]
    - [25, 25274.0]
  - - [128, 5056, 1, 1280]
    - [37, 26364.6]
  - - [3584, 5056, 1, 1280]
    - [37, 37176.6]
  - - [256, 448, 1, 1280]
    - [25, 12461.9]
  - - [704, 704, 1, 128]
    - [33, 72.4982]
  - - [5056, 4, 1, 128]
    - [40, 349.821]
  - - [704, 256, 1, 1280]
    - [34, 14100.7]
  - - [64, 2368, 1, 3328]
    - [25, 20126.3]
  - - [1856, 1024, 1, 128]
    - [33, 255.718]
  - - [1856, 64, 1, 128]
    - [2, 2111.72]
  - - [64, 6784, 1, 1280]
    - [34, 23933.9]
  - - [704, 4288, 1, 256]
    - [34, 32443.3]
  - - [5888, 2368, 1, 1280]
    - [37, 37052.6]
  - - [128, 256, 1, 256]
    - [34, 2097.15]
  - - [256, 64, 1, 1280]
    - [15, 3971.88]
  - - [2368, 5888, 1, 1280]
    - [37, 37005.0]
  - - [5888, 256, 1, 1280]
    - [34, 32992.1]
  - - [4, 5888, 1, 1280]
    - [44, 2791.35]
  - - [704, 128, 1, 128]
    - [2, 1629.14]
  - - [1024, 4, 1, 1280]
    - [15, 939.584]
  - - [2368, 1856, 1, 3328]
    - [37, 36579.3]
  - - [2368, 128, 1, 128]
    - [2, 3108.76]
  - - [2944, 704, 1, 256]
    - [34, 31885.8]
  - - [5056, 128, 1, 128]
    - [2, 3768.77]
  - - [256, 704, 1, 3328]
    - [34, 15085.1]
  - - [704, 3584, 1, 256]
    - [34, 31631.9]
  - - [1024, 1024, 1, 1024]
    - [37, 30836.9]
  - - [704, 2944, 1, 3328]
    - [34, 35514.0]
  - - [6784, 1024, 1, 128]
    - [33, 709.957]
  - - [256, 448, 1, 128]
    - [2, 2050.29]
  - - [448, 1024, 1, 3328]
    - [37, 26579.5]
  - - [2944, 1024, 1, 3328]
    - [39, 34092.6]
  - - [2944, 5056, 1, 128]
    - [33, 1066.42]
  - - [1408, 6784, 1, 256]
    - [34, 35336.4]
  - - [6784, 1408, 1, 3328]
    - [34, 37073.0]
  - - [4288, 6784, 1, 128]
    - [33, 1363.64]
  - - [704, 64, 1, 256]
    - [34, 2433.4]
  - - [5888, 4, 1, 1280]
    - [44, 2730.67]
  - - [256, 2368, 1, 3328]
    - [37, 25680.5]
  - - [6784, 2944, 1, 1280]
    - [37, 37352.8]
  - - [4288, 1856, 1, 128]
    - [33, 751.913]
  - - [1856, 2944, 1, 128]
    - [33, 584.373]
  - - [6784, 448, 1, 128]
    - [33, 361.672]
  - - [64, 3584, 1, 128]
    - [2, 2785.59]
  - - [448, 5056, 1, 1280]
    - [37, 34165.8]
  - - [2368, 1856, 1, 128]
    - [33, 470.204]
  - - [128, 448, 1, 1280]
    - [22, 8973.14]
  - - [4288, 704, 1, 256]
    - [34, 32334.7]
  - - [256, 3584, 1, 128]
    - [33, 131.902]
  - - [5888, 704, 1, 256]
    - [34, 33794.9]
  - - [3584, 1024, 1, 128]
    - [33, 410.23]
  - - [256, 5888, 1, 3328]
    - [37, 33739.5]
  - - [1408, 4288, 1, 3328]
    - [34, 35896.7]
  - - [6784, 4288, 1, 256]
    - [34, 36508.4]
  - - [4288, 256, 1, 128]
    - [33, 152.82]
  - - [5888, 256, 1, 256]
    - [34, 29013.2]
  - - [6784, 1024, 1, 1280]
    - [37, 35293.8]
  - - [5888, 1024, 1, 128]
    - [33, 639.333]
  - - [1024, 128, 1, 256]
    - [37, 6847.84]
  - - [128, 64, 1, 3328]
    - [32, 4484.04]
  - - [448, 64, 1, 256]
    - [19, 1575.11]
  - - [2368, 256, 1, 128]
    - [33, 91.0971]
  - - [6784, 3584, 1, 1280]
    - [37, 37653.0]
  - - [1024, 6784, 1, 1280]
    - [37, 36028.9]
  - - [2944, 64, 1, 1280]
    - [22, 15479.6]
  - - [1408, 2944, 1, 1280]
    - [37, 36167.7]
  - - [256, 1856, 1, 256]
    - [34, 19940.1]
  - - [1408, 2368, 1, 3328]
    - [37, 36009.7]
  - - [2944, 4, 1, 3328]
    - [7, 2578.32]
  - - [128, 1408, 1, 3328]
    - [22, 21528.6]
  - - [2944, 1856, 1, 128]
    - [33, 582.087]
  - - [256, 2944, 1, 128]
    - [33, 106.061]
  - - [256, 6784, 1, 128]
    - [33, 235.885]
  - - [2368, 4, 1, 128]
    - [40, 134.414]
  - - [1408, 256, 1, 3328]
    - [34, 20971.5]
  - - [1856, 4, 1, 128]
    - [40, 167.305]
  - - [1024, 16, 1, 512]
    - [19, 1711.96]
  - - [5056, 6784, 1, 128]
    - [33, 1480.76]
  - - [4288, 5056, 1, 128]
    - [33, 1237.98]
  - - [1856, 5888, 1, 128]
    - [33, 909.056]
  - - [2944, 5888, 1, 256]
    - [34, 35856.3]
  - - [3584, 1856, 1, 256]
    - [34, 34290.9]
  - - [4288, 3584, 1, 1280]
    - [37, 37413.5]
  - - [2368, 448, 1, 256]
    - [34, 24162.0]
  - - [4288, 256, 1, 3328]
    - [37, 28975.6]
  - - [1856, 704, 1, 128]
    - [33, 181.882]
  - - [1408, 64, 1, 256]
    - [34, 4866.81]
  - - [64, 1856, 1, 128]
    - [2, 2129.46]
  - - [4, 256, 1, 128]
    - [40, 23.4057]
  - - [704, 4288, 1, 3328]
    - [34, 35203.6]
  - - [704, 5888, 1, 128]
    - [33, 480.345]
  - - [6784, 3584, 1, 128]
    - [33, 1316.32]
  - - [1024, 64, 1, 256]
    - [34, 3509.88]
  - - [64, 2368, 1, 256]
    - [34, 8219.77]
  - - [4288, 5056, 1, 3328]
    - [37, 37757.9]
  - - [4, 1856, 1, 1280]
    - [11, 1426.83]
  - - [4288, 128, 1, 128]
    - [2, 3509.22]
  - - [1408, 1408, 1, 128]
    - [33, 268.223]
  - - [1024, 128, 1, 3328]
    - [25, 16548.1]
  - - [1856, 128, 1, 128]
    - [2, 2874.17]
  - - [5056, 2368, 1, 256]
    - [34, 35656.0]
  - - [4288, 704, 1, 3328]
    - [37, 35164.2]
  - - [448, 3584, 1, 256]
    - [34, 27329.9]
  - - [64, 128, 1, 128]
    - [1, 170.778]
  - - [2368, 64, 1, 1280]
    - [25, 13661.0]
  - - [2368, 1024, 1, 1280]
    - [37, 31710.1]
  - - [2944, 1408, 1, 3328]
    - [37, 36578.1]
  - - [1408, 448, 1, 256]
    - [34, 21359.9]
  - - [1024, 1408, 1, 3328]
    - [37, 32259.5]
  - - [2560, 7133, 1, 2560]
    - [34, 37438.8]
  - - [1408, 4, 1, 1280]
    - [17, 1242.92]
  - - [5888, 3584, 1, 256]
    - [37, 36179.1]
  - - [128, 1024, 1, 1280]
    - [13, 13729.3]
  - - [1408, 1856, 1, 3328]
    - [37, 36243.1]
  - - [4, 4, 1, 3328]
    - [49, 13.3789]
  - - [6784, 1408, 1, 1280]
    - [37, 36850.9]
  - - [4, 1024, 1, 1280]
    - [7, 978.149]
  - - [704, 2944, 1, 256]
    - [34, 31544.6]
  - - [704, 4288, 1, 128]
    - [33, 369.365]
  - - [2368, 4288, 1, 128]
    - [33, 825.37]
  - - [64, 4288, 1, 1280]
    - [22, 17068.7]
  - - [6784, 64, 1, 1280]
    - [34, 23975.2]
  - - [3584, 128, 1, 128]
    - [2, 3571.79]
  - - [1024, 6784, 1, 128]
    - [33, 690.013]
  - - [4, 1856, 1, 128]
    - [40, 98.9867]
  - - [1408, 64, 1, 3328]
    - [25, 18087.6]
  - - [6784, 4, 1, 256]
    - [44, 1996.21]
  - - [1408, 1408, 1, 1280]
    - [37, 33318.7]
  - - [256, 2368, 1, 256]
    - [34, 20206.9]
  - - [448, 4288, 1, 3328]
    - [34, 32947.7]
  - - [2368, 1408, 1, 256]
    - [34, 33108.6]
  - - [5888, 5056, 1, 128]
    - [33, 1401.82]
  - - [704, 2368, 1, 256]
    - [34, 28758.1]
  - - [2944, 448, 1, 1280]
    - [37, 29197.6]
  - - [5888, 2368, 1, 3328]
    - [37, 37297.3]
  - - [64, 2944, 1, 1280]
    - [25, 15559.5]
  - - [448, 1856, 1, 1280]
    - [34, 26594.3]
  - - [4288, 448, 1, 1280]
    - [37, 32508.1]
  - - [5888, 704, 1, 3328]
    - [37, 36551.0]
  - - [5056, 256, 1, 128]
    - [33, 180.168]
  - - [1856, 256, 1, 128]
    - [33, 70.1017]
  - - [5056, 128, 1, 256]
    - [34, 21628.6]
  - - [704, 4, 1, 256]
    - [44, 444.998]
  - - [1408, 5888, 1, 128]
    - [33, 780.655]
  - - [4288, 4, 1, 128]
    - [40, 305.774]
  - - [1408, 1024, 1, 256]
    - [37, 27793.6]
  - - [1024, 1856, 1, 128]
    - [33, 256.365]
  - - [256, 704, 1, 128]
    - [33, 24.1249]
  - - [256, 1024, 1, 128]
    - [33, 38.7527]
  - - [448, 1024, 1, 256]
    - [37, 19443.8]
  - - [128, 4, 1, 3328]
    - [49, 453.174]
  - - [5056, 6784, 1, 1280]
    - [37, 37779.1]
  - - [704, 5056, 1, 3328]
    - [37, 35805.1]
  - - [64, 1408, 1, 1280]
    - [22, 11604.0]
  - - [3584, 5056, 1, 3328]
    - [37, 37452.3]
  - - [1856, 4, 1, 3328]
    - [49, 2213.9]
  - - [4, 2944, 1, 128]
    - [40, 265.375]
  - - [2368, 2944, 1, 3328]
    - [37, 36894.6]
  - - [448, 448, 1, 1280]
    - [25, 15819.0]
  - - [2368, 3584, 1, 256]
    - [34, 34997.6]
  - - [1024, 256, 1, 1280]
    - [37, 19901.8]
  - - [5056, 3584, 1, 1280]
    - [37, 37177.8]
  - - [448, 4, 1, 3328]
    - [17, 1092.27]
  - - [1856, 2944, 1, 1280]
    - [37, 36583.3]
  - - [3584, 2368, 1, 1280]
    - [37, 36588.9]
  - - [128, 1024, 1, 256]
    - [34, 7078.99]
  - - [2944, 1408, 1, 256]
    - [34, 33773.4]
  - - [4288, 1408, 1, 3328]
    - [37, 35835.2]
  - - [3584, 64, 1, 3328]
    - [10, 20152.1]
  - - [1408, 128, 1, 256]
    - [37, 9858.41]
  - - [2944, 1024, 1, 128]
    - [33, 379.867]
  - - [4288, 5056, 1, 1280]
    - [37, 37592.2]
  - - [5888, 6784, 1, 1280]
    - [37, 37673.2]
  - - [6784, 5056, 1, 128]
    - [33, 1425.78]
  - - [256, 1024, 1, 3328]
    - [34, 21637.3]
  - - [3584, 4, 1, 256]
    - [44, 1555.09]
  - - [1856, 64, 1, 3328]
    - [25, 19985.5]
  - - [64, 6784, 1, 128]
    - [2, 3413.67]
  - - [5888, 1408, 1, 3328]
    - [39, 37261.8]
  - - [5888, 64, 1, 1280]
    - [34, 20790.7]
  - - [256, 5056, 1, 256]
    - [34, 27938.4]
  - - [128, 3584, 1, 128]
    - [2, 3598.06]
  - - [448, 3584, 1, 3328]
    - [34, 31263.4]
  - - [704, 2368, 1, 128]
    - [33, 225.418]
  - - [5888, 256, 1, 128]
    - [33, 196.451]
  - - [4, 5056, 1, 128]
    - [40, 348.878]
  - - [448, 256, 1, 256]
    - [34, 6246.84]
  - - [704, 4, 1, 3328]
    - [47, 1432.97]
  - - [1408, 256, 1, 256]
    - [34, 15379.1]
  - - [3584, 1856, 1, 128]
    - [33, 645.151]
  - - [4288, 4288, 1, 128]
    - [33, 1180.38]
  - - [1856, 1024, 1, 3328]
    - [35, 31346.1]
  - - [128, 5888, 1, 3328]
    - [34, 31541.7]
  - - [1024, 5056, 1, 256]
    - [34, 32533.1]
  - - [2368, 1408, 1, 3328]
    - [37, 35977.0]
  - - [5888, 448, 1, 256]
    - [37, 30500.6]
  - - [5888, 6784, 1, 128]
    - [33, 1530.5]
  - - [2368, 4, 1, 3328]
    - [49, 2363.03]
  - - [6784, 5056, 1, 1280]
    - [37, 37768.7]
  - - [5056, 704, 1, 1280]
    - [37, 35345.7]
  - - [1408, 256, 1, 1280]
    - [34, 20094.7]
  - - [4288, 6784, 1, 1280]
    - [37, 37823.5]
  - - [128, 704, 1, 256]
    - [37, 5364.81]
  - - [1024, 1024, 1, 128]
    - [33, 147.625]
  - - [448, 128, 1, 1280]
    - [22, 8717.38]
  - - [6784, 4, 1, 3328]
    - [45, 2792.47]
  - - [4288, 4, 1, 1280]
    - [44, 2523.51]
  - - [1024, 64, 1, 3328]
    - [22, 13734.5]
  - - [1856, 4, 1, 256]
    - [44, 1117.97]
  - - [64, 3584, 1, 1280]
    - [34, 17708.2]
  - - [6784, 1408, 1, 256]
    - [37, 35143.4]
  - - [3584, 5888, 1, 128]
    - [33, 1236.13]
  - - [5056, 5888, 1, 256]
    - [37, 36446.9]
  - - [2368, 1024, 1, 256]
    - [37, 29930.4]
  - - [2944, 1856, 1, 256]
    - [37, 34572.4]
  - - [1856, 6784, 1, 1280]
    - [37, 36759.0]
  - - [64, 5056, 1, 128]
    - [2, 3281.99]
  - - [5888, 64, 1, 128]
    - [2, 3335.72]
  - - [448, 704, 1, 128]
    - [33, 46.8908]
  - - [4, 1024, 1, 128]
    - [40, 91.9824]
  - - [4288, 3584, 1, 256]
    - [37, 35876.9]
  - - [1408, 704, 1, 128]
    - [33, 138.995]
  - - [64, 256, 1, 3328]
    - [27, 6919.54]
  - - [5056, 1856, 1, 1280]
    - [37, 37138.8]
  - - [1408, 1024, 1, 3328]
    - [37, 32220.5]
  - - [2368, 256, 1, 3328]
    - [34, 25654.4]
  - - [5888, 3584, 1, 1280]
    - [37, 37449.2]
  - - [1856, 3584, 1, 3328]
    - [34, 36554.7]
  - - [5888, 128, 1, 1280]
    - [37, 30451.1]
  - - [1024, 2944, 1, 256]
    - [37, 30005.9]
  - - [448, 6784, 1, 1280]
    - [37, 34808.7]
  - - [256, 3584, 1, 1280]
    - [34, 29141.6]
  - - [448, 128, 1, 128]
    - [0, 1146.88]
  - - [704, 5056, 1, 256]
    - [34, 33014.9]
  - - [3584, 1024, 1, 3328]
    - [38, 35402.4]
  - - [2944, 1856, 1, 1280]
    - [34, 36587.2]
  - - [128, 256, 1, 128]
    - [1, 687.591]
  - - [5056, 256, 1, 256]
    - [34, 28913.6]
  - - [2368, 3584, 1, 3328]
    - [37, 36865.0]
  - - [2944, 704, 1, 1280]
    - [37, 34897.4]
  - - [128, 4, 1, 256]
    - [44, 94.9797]
  - - [2944, 3584, 1, 1280]
    - [37, 36816.2]
  - - [1856, 5888, 1, 1280]
    - [34, 37091.7]
  - - [256, 256, 1, 1280]
    - [25, 9754.2]
  - - [5056, 448, 1, 3328]
    - [37, 34747.9]
  - - [4288, 1408, 1, 256]
    - [34, 33732.0]
  - - [3584, 64, 1, 256]
    - [34, 11604.8]
  - - [64, 1856, 1, 3328]
    - [22, 20046.3]
  - - [256, 1408, 1, 128]
    - [33, 49.6528]
  - - [5888, 1408, 1, 128]
    - [33, 773.643]
  - - [4288, 2368, 1, 1280]
    - [37, 37109.1]
  - - [4, 4288, 1, 256]
    - [44, 1701.9]
  - - [256, 4288, 1, 128]
    - [33, 139.938]
  - - [256, 128, 1, 3328]
    - [21, 10366.2]
  - - [6784, 2368, 1, 256]
    - [37, 35842.0]
  - - [5888, 128, 1, 128]
    - [2, 3756.58]
  - - [4288, 1856, 1, 256]
    - [34, 34743.9]
  - - [1856, 256, 1, 3328]
    - [34, 27480.9]
  - - [1856, 2944, 1, 256]
    - [34, 34675.3]
  - - [5056, 1024, 1, 128]
    - [33, 576.913]
  - - [64, 5888, 1, 1280]
    - [34, 20862.7]
  - - [1760, 7133, 1, 1760]
    - [37, 36660.3]
  - - [6784, 256, 1, 128]
    - [33, 228.42]
  - - [5888, 704, 1, 128]
    - [33, 472.315]
  - - [6784, 64, 1, 128]
    - [2, 3392.83]
  - - [1024, 4288, 1, 1280]
    - [37, 35839.6]
  - - [2368, 5056, 1, 3328]
    - [37, 37448.9]
  - - [448, 4, 1, 128]
    - [40, 41.7057]
  - - [4, 256, 1, 3328]
    - [17, 695.484]
  - - [4288, 1024, 1, 3328]
    - [37, 35273.1]
  - - [1024, 5056, 1, 3328]
    - [37, 36613.3]
  - - [1024, 1856, 1, 3328]
    - [37, 32579.6]
  - - [704, 704, 1, 1280]
    - [34, 27203.6]
  - - [128, 2368, 1, 1280]
    - [22, 17429.2]
  - - [1408, 128, 1, 3328]
    - [25, 21606.1]
  - - [3584, 256, 1, 1280]
    - [37, 29185.0]
  - - [4, 128, 1, 128]
    - [40, 11.7871]
  - - [704, 6784, 1, 128]
    - [33, 528.394]
  - - [3584, 128, 1, 1280]
    - [34, 25180.2]
  - - [4, 256, 1, 1280]
    - [17, 368.18]
  - - [128, 704, 1, 3328]
    - [22, 18511.9]
  - - [4288, 6784, 1, 256]
    - [37, 36526.3]
  - - [3584, 2944, 1, 3328]
    - [37, 37031.5]
  - - [128, 1856, 1, 256]
    - [34, 12411.7]
  - - [64, 4288, 1, 256]
    - [37, 11631.6]
  - - [4, 3584, 1, 3328]
    - [7, 2627.21]
  - - [64, 4, 1, 3328]
    - [17, 224.202]
  - - [4, 64, 1, 3328]
    - [49, 230.262]
  - - [5888, 2944, 1, 256]
    - [37, 35833.1]
  - - [2368, 6784, 1, 128]
    - [33, 1118.13]
  - - [448, 4288, 1, 1280]
    - [34, 32413.8]
  - - [448, 1856, 1, 3328]
    - [34, 27177.3]
  - - [4, 1024, 1, 256]
    - [44, 624.152]
  - - [5056, 4288, 1, 256]
    - [37, 36218.4]
  - - [1024, 448, 1, 256]
    - [34, 18292.9]
  - - [1024, 3584, 1, 256]
    - [37, 30743.6]
  - - [2944, 128, 1, 1280]
    - [34, 20917.0]
  - - [1856, 5056, 1, 128]
    - [33, 833.422]
  - - [64, 256, 1, 256]
    - [19, 1145.98]
  - - [1408, 4, 1, 128]
    - [40, 126.918]
  - - [128, 2368, 1, 128]
    - [2, 3103.78]
  - - [256, 704, 1, 1280]
    - [37, 13981.0]
  - - [64, 2368, 1, 128]
    - [2, 2234.87]
  - - [6784, 6784, 1, 3328]
    - [39, 38731.4]
  - - [448, 5888, 1, 1280]
    - [37, 32914.9]
  - - [5056, 448, 1, 128]
    - [33, 284.503]
  - - [3584, 2944, 1, 128]
    - [33, 912.36]
  - - [6784, 256, 1, 1280]
    - [37, 33001.5]
  - - [256, 2944, 1, 1280]
    - [34, 30298.0]
  - - [64, 4288, 1, 128]
    - [2, 2792.31]
  - - [2368, 5888, 1, 3328]
    - [37, 37257.2]
  - - [4, 64, 1, 256]
    - [44, 47.4899]
  - - [704, 1024, 1, 3328]
    - [34, 30399.7]
  - - [2368, 1856, 1, 1280]
    - [37, 36238.1]
  - - [128, 448, 1, 128]
    - [0, 1143.31]
  - - [128, 6784, 1, 256]
    - [37, 23350.6]
  - - [3584, 4288, 1, 128]
    - [33, 1020.98]
  - - [64, 448, 1, 128]
    - [1, 590.035]
  - - [5888, 4288, 1, 3328]
    - [37, 37689.6]
  - - [2368, 704, 1, 256]
    - [34, 28796.9]
  - - [256, 1856, 1, 3328]
    - [34, 27452.3]
  - - [1856, 128, 1, 256]
    - [34, 12261.6]
  - - [6784, 128, 1, 128]
    - [2, 3772.88]
  - - [3584, 1408, 1, 128]
    - [33, 556.197]
  - - [1856, 5056, 1, 1280]
    - [37, 37113.6]
  - - [2944, 1024, 1, 1280]
    - [37, 33236.5]
  - - [5056, 4, 1, 256]
    - [44, 1961.12]
  - - [3584, 5888, 1, 3328]
    - [37, 37767.1]
  - - [2368, 4288, 1, 256]
    - [37, 35637.8]
  - - [1024, 2368, 1, 3328]
    - [37, 33624.4]
  - - [64, 704, 1, 3328]
    - [28, 12433.4]
  - - [704, 1408, 1, 256]
    - [34, 27522.3]
  - - [6784, 1856, 1, 3328]
    - [37, 37022.2]
  - - [1024, 2944, 1, 128]
    - [33, 383.361]
  - - [1024, 3584, 1, 1280]
    - [37, 35485.9]
  - - [4288, 5888, 1, 3328]
    - [37, 37625.5]
  - - [4288, 4, 1, 3328]
    - [44, 2637.79]
  - - [256, 1408, 1, 256]
    - [34, 15277.3]
  - - [448, 2944, 1, 1280]
    - [34, 28997.0]
  - - [4, 5888, 1, 128]
    - [40, 407.386]
  - - [1024, 2944, 1, 3328]
    - [37, 34984.2]
  - - [3584, 6784, 1, 256]
    - [34, 36310.5]
  - - [256, 6784, 1, 1280]
    - [34, 33040.7]
  - - [1856, 3584, 1, 256]
    - [34, 34485.4]
  - - [128, 448, 1, 3328]
    - [22, 14157.3]
  - - [6784, 1856, 1, 128]
    - [33, 975.665]
  - - [4, 448, 1, 256]
    - [44, 309.968]
  - - [2944, 704, 1, 128]
    - [33, 256.378]
  - - [256, 5888, 1, 1280]
    - [34, 32924.6]
  - - [4, 128, 1, 1280]
    - [17, 201.031]
  - - [4288, 6784, 1, 3328]
    - [37, 37954.3]
  - - [6784, 128, 1, 1280]
    - [34, 27662.8]
  - - [64, 1408, 1, 256]
    - [34, 4929.2]
  - - [7680, 5481, 1, 2560]
    - [39, 37901.8]
  - - [2368, 1408, 1, 128]
    - [33, 407.769]
  - - [1856, 448, 1, 256]
    - [34, 23340.0]
  - - [1408, 1024, 1, 128]
    - [33, 203.204]
  - - [128, 64, 1, 128]
    - [1, 166.971]
  - - [6784, 3584, 1, 3328]
    - [37, 37846.8]
  - - [2944, 64, 1, 3328]
    - [25, 22188.6]
  - - [64, 64, 1, 128]
    - [1, 83.2203]
  - - [2368, 5056, 1, 1280]
    - [34, 37185.6]
  - - [64, 4, 1, 1280]
    - [17, 105.703]
  - - [1408, 2368, 1, 1280]
    - [34, 35469.6]
  - - [128, 1408, 1, 1280]
    - [25, 15097.3]
  - - [256, 64, 1, 3328]
    - [15, 6491.18]
  - - [2944, 4288, 1, 128]
    - [33, 981.436]
  - - [2944, 2944, 1, 256]
    - [34, 34777.2]
  - - [2944, 4, 1, 1280]
    - [44, 2048.0]
  - - [5888, 4, 1, 256]
    - [44, 1983.33]
  - - [6784, 256, 1, 256]
    - [37, 29600.3]
  - - [256, 5056, 1, 3328]
    - [34, 34067.9]
  - - [128, 4288, 1, 1280]
    - [37, 22402.6]
  - - [5056, 1856, 1, 128]
    - [33, 836.09]
  - - [5888, 1408, 1, 256]
    - [34, 35091.2]
  - - [128, 128, 1, 256]
    - [34, 1092.27]
  - - [5056, 4, 1, 3328]
    - [44, 2951.99]
  - - [4288, 3584, 1, 3328]
    - [37, 37626.8]
  - - [448, 704, 1, 3328]
    - [34, 18446.8]
  - - [448, 448, 1, 128]
    - [3, 2428.18]
  - - [1024, 2368, 1, 1280]
    - [37, 33075.3]
  - - [1856, 704, 1, 3328]
    - [34, 34407.7]
  - - [4, 2368, 1, 128]
    - [40, 212.705]
  - - [5888, 6784, 1, 3328]
    - [39, 37935.9]
  - - [704, 4288, 1, 1280]
    - [34, 34785.8]
  - - [704, 256, 1, 256]
    - [34, 9858.41]
  - - [6784, 448, 1, 3328]
    - [37, 35452.4]
  - - [4288, 1024, 1, 128]
    - [33, 500.71]
- null
