library/src/blas3/Tensile/Logic/asm_ci/vega20_Cijk_Ailk_Bjlk_HBH.yaml
- {MinimumRequiredVersion: 4.6.0}
- vega20
- gfx906
- [Device 66a0, Device 66a1, Device 66a7, Device 66af, Vega 20]
    SolutionIndex: 0
    SolutionNameMin: Cijk_Ailk_Bjlk_HBH_MT016x016x08_PGR1_PLR1_TT02_02
    SolutionIndex: 1
    SolutionNameMin: Cijk_Ailk_Bjlk_HBH_MT016x016x16_PGR1_PLR1_TT02_02
    SolutionIndex: 2
    SolutionNameMin: Cijk_Ailk_Bjlk_HBH_MT032x016x16_PGR1_PLR1_TT04_02
    SolutionIndex: 3
    SolutionNameMin: Cijk_Ailk_Bjlk_HBH_MT016x016x24_PGR1_PLR1_TT02_02
    SolutionIndex: 4
    SolutionNameMin: Cijk_Ailk_Bjlk_HBH_MT032x016x24_PGR1_PLR1_TT04_02
    SolutionIndex: 5
    SolutionNameMin: Cijk_Ailk_Bjlk_HBH_MT016x016x32_PGR1_PLR1_TT02_02
    SolutionIndex: 6
    SolutionNameMin: Cijk_Ailk_Bjlk_HBH_MT032x016x32_PGR1_PLR1_TT02_02
    SolutionIndex: 7
    SolutionNameMin: Cijk_Ailk_Bjlk_HBH_MT064x016x32_PGR1_PLR1_TT02_02
    SolutionIndex: 8
    SolutionNameMin: Cijk_Ailk_Bjlk_HBH_MT016x016x32_PGR1_PLR1_TT02_02
    SolutionIndex: 9
    SolutionNameMin: Cijk_Ailk_Bjlk_HBH_MT064x016x32_PGR1_PLR1_TT02_02
    SolutionIndex: 10
    SolutionNameMin: Cijk_Ailk_Bjlk_HBH_MT016x016x64_PGR1_PLR1_TT02_02
    SolutionIndex: 11
    SolutionNameMin: Cijk_Ailk_Bjlk_HBH_MT032x016x64_PGR1_PLR1_TT02_02
    SolutionIndex: 12
    SolutionNameMin: Cijk_Ailk_Bjlk_HBH_MT064x016x64_PGR1_PLR1_TT02_02
    SolutionIndex: 13
    SolutionNameMin: Cijk_Ailk_Bjlk_HBH_MT016x016x64_PGR1_PLR1_TT02_02
    SolutionIndex: 14
    SolutionNameMin: Cijk_Ailk_Bjlk_HBH_MT032x016x64_PGR1_PLR1_TT02_02
    SolutionIndex: 15
    SolutionNameMin: Cijk_Ailk_Bjlk_HBH_MT032x032x08_PGR1_PLR1_TT02_02
    SolutionIndex: 16
    SolutionNameMin: Cijk_Ailk_Bjlk_HBH_MT032x032x16_PGR1_PLR1_TT02_02
    SolutionIndex: 17
    SolutionNameMin: Cijk_Ailk_Bjlk_HBH_MT032x032x32_PGR1_PLR1_TT02_02
    SolutionIndex: 18
    SolutionNameMin: Cijk_Ailk_Bjlk_HBH_MT032x032x64_PGR1_PLR1_TT02_02
    SolutionIndex: 19
    SolutionNameMin: Cijk_Ailk_Bjlk_HBH_MT064x064x04_PGR0_PLR1_TT04_04
    SolutionIndex: 20
    SolutionNameMin: Cijk_Ailk_Bjlk_HBH_MT064x064x04_PGR1_PLR1_TT04_04
    SolutionIndex: 21
    SolutionNameMin: Cijk_Ailk_Bjlk_HBH_MT064x064x08_PGR0_PLR1_TT04_04
    SolutionIndex: 22
    SolutionNameMin: Cijk_Ailk_Bjlk_HBH_MT064x064x16_PGR1_PLR1_TT04_04
    SolutionIndex: 23
    SolutionNameMin: Cijk_Ailk_Bjlk_HBH_MT064x032x16_PGR1_PLR1_TT04_04
    SolutionIndex: 24
    SolutionNameMin: Cijk_Ailk_Bjlk_HBH_MT064x032x32_PGR1_PLR1_TT04_04
    SolutionIndex: 25
    SolutionNameMin: Cijk_Ailk_Bjlk_HBH_MT128x032x32_PGR1_PLR1_TT04_04
    SolutionIndex: 26
    SolutionNameMin: Cijk_Ailk_Bjlk_HBH_MT128x016x32_PGR1_PLR1_TT04_04
    SolutionIndex: 27
    SolutionNameMin: Cijk_Ailk_Bjlk_HBH_MT128x016x32_PGR1_PLR1_TT04_04
    SolutionIndex: 28
    SolutionNameMin: Cijk_Ailk_Bjlk_HBH_MT064x064x08_PGR1_PLR1_TT08_08
    SolutionIndex: 29
    SolutionNameMin: Cijk_Ailk_Bjlk_HBH_MT064x064x16_PGR1_PLR1_TT08_08
    SolutionIndex: 30
    SolutionNameMin: Cijk_Ailk_Bjlk_HBH_MT064x128x16_PGR1_PLR1_TT04_08
    SolutionIndex: 31
    SolutionNameMin: Cijk_Ailk_Bjlk_HBH_MT128x128x16_PGR1_PLR1_TT08_08
    SolutionIndex: 32
    SolutionNameMin: Cijk_Ailk_Bjlk_HBH_MT128x128x32_PGR1_PLR1_TT08_08
    SolutionIndex: 33
    SolutionNameMin: Cijk_Ailk_Bjlk_HBH_MT064x128x04_PGR0_PLR0_TT04_08
    SolutionIndex: 34
    SolutionNameMin: Cijk_Ailk_Bjlk_HBH_MT064x064x08_PGR0_PLR0_TT04_04
    SolutionIndex: 35
    SolutionNameMin: Cijk_Ailk_Bjlk_HBH_MT064x064x08_PGR0_PLR1_TT04_04
    SolutionIndex: 36
    SolutionNameMin: Cijk_Ailk_Bjlk_HBH_MT064x064x16_PGR0_PLR0_TT04_04
    SolutionIndex: 37
    SolutionNameMin: Cijk_Ailk_Bjlk_HBH_MT064x128x16_PGR1_PLR1_TT04_08
    SolutionIndex: 38
    SolutionNameMin: Cijk_Ailk_Bjlk_HBH_MT064x064x04_PGR0_PLR0_TT04_04
    SolutionIndex: 39
    SolutionNameMin: Cijk_Ailk_Bjlk_HBH_MT128x128x04_PGR0_PLR1_TT08_08
    SolutionIndex: 40
    SolutionNameMin: Cijk_Ailk_Bjlk_HBH_MT064x128x04_PGR1_PLR1_TT04_08
    SolutionIndex: 41
    SolutionNameMin: Cijk_Ailk_Bjlk_HBH_MT064x064x08_PGR1_PLR0_TT04_04
    SolutionIndex: 42
    SolutionNameMin: Cijk_Ailk_Bjlk_HBH_MT064x128x08_PGR1_PLR1_TT04_08
    SolutionIndex: 43
    SolutionNameMin: Cijk_Ailk_Bjlk_HBH_MT064x128x16_PGR0_PLR1_TT04_08
    SolutionIndex: 44
    SolutionNameMin: Cijk_Ailk_Bjlk_HBH_MT064x128x16_EPS1_GRVW04_PGR1_PLR1_SNLL1_TT08_04_VW04_WG08_32_01_WGM01
    SolutionIndex: 45
    SolutionNameMin: Cijk_Ailk_Bjlk_HBH_MT128x128x16_EPS1_GRVW04_PGR1_PLR1_SNLL1_TT08_08_VW04_WG16_16_01_WGM01
    SolutionIndex: 46
    SolutionNameMin: Cijk_Ailk_Bjlk_HBH_MT064x128x16_EPS1_GRVW04_PGR1_PLR1_SNLL1_TT08_04_VW04_WG08_32_01_WGM08
    SolutionIndex: 47
    SolutionNameMin: Cijk_Ailk_Bjlk_HBH_MT128x064x16_EPS1_GRVW04_PGR1_PLR1_SNLL1_TT08_04_VW04_WG16_16_01_WGM08
    SolutionIndex: 48
    SolutionNameMin: Cijk_Ailk_Bjlk_HBH_MT128x128x16_EPS1_GRVW04_PGR1_PLR1_SNLL1_TT08_08_VW04_WG16_16_01_WGM08
    SolutionIndex: 49
    SolutionNameMin: Cijk_Ailk_Bjlk_HBH_MT128x064x16_EPS1_GRVW04_PGR1_PLR1_SNLL1_TT08_04_VW04_WG16_16_01_WGM64
    SolutionIndex: 50
    SolutionNameMin: Cijk_Ailk_Bjlk_HBH_MT064x064x32_EPS0_GRVW04_PGR0_PLR0_SNLL0_TT04_04_VW04_WG16_16_01_WGM01
    SolutionIndex: 51
    SolutionNameMin: Cijk_Ailk_Bjlk_HBH_MT128x064x16_EPS1_GRVW08_PGR1_PLR1_SNLL1_TT08_08_VW08_WG16_08_01_WGM64
    SolutionIndex: 52
    SolutionNameMin: Cijk_Ailk_Bjlk_HBH_MT128x128x32_EPS1_GRVW08_PGR1_PLR1_SNLL1_TT08_08_VW08_WG16_16_01_WGM64
    SolutionIndex: 53
    SolutionNameMin: Cijk_Ailk_Bjlk_HBH_MT64x64x24_SE_GRVW4_LRVW4_TT4_4_VW4_WG16_16_1_WGM8
    SolutionIndex: 54
    SolutionNameMin: Cijk_Ailk_Bjlk_HBH_MT64x64x16_SE_GRVW4_LRVW4_TT4_4_VW4_WG16_16_1_WGM8
    SolutionIndex: 55
    SolutionNameMin: Cijk_Ailk_Bjlk_HBH_MT64x64x16_SE_GRVW4_LRVW4_TT4_4_VW4_WG16_16_1_WGM1
    SolutionIndex: 56
    SolutionNameMin: Cijk_Ailk_Bjlk_HBH_MT64x96x16_SE_GRVW2_LRVW2_TT4_6_VW2_WG16_16_1_WGM1
    SolutionIndex: 57
    SolutionNameMin: Cijk_Ailk_Bjlk_HBH_MT96x64x16_SE_GRVW2_LRVW2_TT6_4_VW2_WG16_16_1_WGM8
    SolutionIndex: 58
    SolutionNameMin: Cijk_Ailk_Bjlk_HBH_MT96x64x24_SE_GRVW2_LRVW2_TT6_4_VW2_WG16_16_1_WGM1
    SolutionIndex: 59
    SolutionNameMin: Cijk_Ailk_Bjlk_HBH_MT64x64x32_SE_GRVW4_LRVW4_TT4_4_VW4_WG16_16_1_WGM1
    SolutionIndex: 60
    SolutionNameMin: Cijk_Ailk_Bjlk_HBH_MT64x64x16_SE_GRVW4_LRVW4_TT4_4_VW4_WG16_16_1_WGM1
    SolutionIndex: 61
    SolutionNameMin: Cijk_Ailk_Bjlk_HBH_MT64x64x16_SE_GRVW4_LRVW4_TT4_4_VW4_WG16_16_1_WGM8
    SolutionIndex: 62
    SolutionNameMin: Cijk_Ailk_Bjlk_HBH_MT64x64x8_SE_GRVW2_LRVW2_TT4_4_VW2_WG16_16_1_WGM1
    SolutionIndex: 63
    SolutionNameMin: Cijk_Ailk_Bjlk_HBH_MT96x64x8_SE_GRVW2_LRVW2_TT6_4_VW2_WG16_16_1_WGM1
    SolutionIndex: 64
    SolutionNameMin: Cijk_Ailk_Bjlk_HBH_MT64x64x16_SE_GRVW4_LRVW4_TT8_4_VW4_WG8_16_1_WGM1
    SolutionIndex: 65
    SolutionNameMin: Cijk_Ailk_Bjlk_HBH_MT64x64x8_SE_GRVW2_LRVW2_TT4_4_VW2_WG16_16_1_WGM8
    SolutionIndex: 66
    SolutionNameMin: Cijk_Ailk_Bjlk_HBH_MT64x32x8_SE_GRVW2_LRVW2_TT4_8_VW2_WG16_4_1_WGM8
    SolutionIndex: 67
    SolutionNameMin: Cijk_Ailk_Bjlk_HBH_MT64x64x16_SE_GRVW2_LRVW2_TT4_4_VW2_WG16_16_1_WGM1
    SolutionIndex: 68
    SolutionNameMin: Cijk_Ailk_Bjlk_HBH_MT64x32x8_SE_GRVW4_LRVW4_TT8_4_VW4_WG8_8_1_WGM8
    SolutionIndex: 69
    SolutionNameMin: Cijk_Ailk_Bjlk_HBH_MT64x32x8_SE_GRVW4_LRVW4_TT8_4_VW4_WG8_8_1_WGM1
    SolutionIndex: 70
    SolutionNameMin: Cijk_Ailk_Bjlk_HBH_MT64x32x8_SE_GRVW2_LRVW2_TT4_8_VW2_WG16_4_1_WGM1
    SolutionIndex: 71
    SolutionNameMin: Cijk_Ailk_Bjlk_HBH_MT64x32x8_SE_GRVW2_LRVW2_TT8_4_VW2_WG8_8_1_WGM1
    SolutionIndex: 72
    SolutionNameMin: Cijk_Ailk_Bjlk_HBH_MT64x96x8_SE_GRVW2_LRVW2_TT4_6_VW2_WG16_16_1_WGM1
    SolutionIndex: 73
    SolutionNameMin: Cijk_Ailk_Bjlk_HBH_MT48x64x8_SE_GRVW2_LRVW2_TT6_4_VW2_WG8_16_1_WGM8
    SolutionIndex: 74
    SolutionNameMin: Cijk_Ailk_Bjlk_HBH_MT64x64x8_SE_GRVW4_LRVW4_TT4_8_VW4_WG16_8_1_WGM8
    SolutionIndex: 75
    SolutionNameMin: Cijk_Ailk_Bjlk_HBH_MT64x64x16_SE_GRVW2_LRVW2_TT4_4_VW2_WG16_16_1_WGM8
    SolutionIndex: 76
    SolutionNameMin: Cijk_Ailk_Bjlk_HBH_MT64x64x8_SE_GRVW2_LRVW2_TT4_8_VW2_WG16_8_1_WGM1
    SolutionIndex: 77
    SolutionNameMin: Cijk_Ailk_Bjlk_HBH_MT24x64x8_SE_GRVW2_LRVW2_TT6_4_VW2_WG4_16_1_WGM8
    SolutionIndex: 78
    SolutionNameMin: Cijk_Ailk_Bjlk_HBH_MT64x32x8_SE_GRVW4_LRVW4_TT4_8_VW4_WG16_4_1_WGM1
    SolutionIndex: 79
    SolutionNameMin: Cijk_Ailk_Bjlk_HBH_MT64x96x8_SE_GRVW2_LRVW2_TT4_6_VW2_WG16_16_1_WGM8
    SolutionIndex: 80
    SolutionNameMin: Cijk_Ailk_Bjlk_HBH_MT32x128x8_SE_GRVW4_LRVW4_TT4_8_VW4_WG8_16_1_WGM8
    SolutionIndex: 81
    SolutionNameMin: Cijk_Ailk_Bjlk_HBH_MT64x64x8_SE_GRVW2_LRVW2_TT8_4_VW2_WG8_16_1_WGM1
    SolutionIndex: 82
    SolutionNameMin: Cijk_Ailk_Bjlk_HBH_MT64x64x8_SE_GRVW2_LRVW2_TT8_4_VW2_WG8_16_1_WGM8
    SolutionIndex: 83
    SolutionNameMin: Cijk_Ailk_Bjlk_HBH_MT96x32x8_SE_GRVW2_LRVW2_TT6_4_VW2_WG16_8_1_WGM1
    SolutionIndex: 84
    SolutionNameMin: Cijk_Ailk_Bjlk_HBH_MT32x64x8_SE_GRVW4_LRVW4_TT8_4_VW4_WG4_16_1_WGM1
    SolutionIndex: 85
    SolutionNameMin: Cijk_Ailk_Bjlk_HBH_MT48x64x8_SE_GRVW2_LRVW2_TT6_4_VW2_WG8_16_1_WGM1
    SolutionIndex: 86
    SolutionNameMin: Cijk_Ailk_Bjlk_HBH_MT96x32x8_SE_GRVW2_LRVW2_TT6_4_VW2_WG16_8_1_WGM8
    SolutionIndex: 87
    SolutionNameMin: Cijk_Ailk_Bjlk_HBH_MT64x128x8_SE_GRVW4_LRVW4_TT4_8_VW4_WG16_16_1_WGM1
    SolutionIndex: 88
    SolutionNameMin: Cijk_Ailk_Bjlk_HBH_MT64x24x8_SE_GRVW2_LRVW2_TT4_6_VW2_WG16_4_1_WGM1
    SolutionIndex: 89
    SolutionNameMin: Cijk_Ailk_Bjlk_HBH_MT32x96x8_SE_GRVW2_LRVW2_TT4_6_VW2_WG8_16_1_WGM1
    SolutionIndex: 90
    SolutionNameMin: Cijk_Ailk_Bjlk_HBH_MT96x64x8_SE_GRVW2_LRVW2_TT6_4_VW2_WG16_16_1_WGM8
    SolutionIndex: 91
    SolutionNameMin: Cijk_Ailk_Bjlk_HBH_MT32x64x8_SE_GRVW4_LRVW4_TT4_4_VW4_WG8_16_1_WGM8
    SolutionIndex: 92
    SolutionNameMin: Cijk_Ailk_Bjlk_HBH_MT64x32x8_SE_GRVW4_LRVW4_TT4_8_VW4_WG16_4_1_WGM8
    SolutionIndex: 93
    SolutionNameMin: Cijk_Ailk_Bjlk_HBH_MT32x64x8_SE_GRVW2_LRVW2_TT8_4_VW2_WG4_16_1_WGM1
    SolutionIndex: 94
    SolutionNameMin: Cijk_Ailk_Bjlk_HBH_MT128x64x16_SE_GRVW4_LRVW4_TT8_4_VW4_WG16_16_1_WGM8
    SolutionIndex: 95
    SolutionNameMin: Cijk_Ailk_Bjlk_HBH_MT128x64x16_SE_GRVW4_LRVW4_TT8_4_VW4_WG16_16_1_WGM1
    SolutionIndex: 96
    SolutionNameMin: Cijk_Ailk_Bjlk_HBH_MT64x64x8_SE_GRVW4_LRVW4_TT8_4_VW4_WG8_16_1_WGM8
    SolutionIndex: 97
    SolutionNameMin: Cijk_Ailk_Bjlk_HBH_MT64x64x16_SE_GRVW2_LRVW2_TT8_4_VW2_WG8_16_1_WGM8
    SolutionIndex: 98
    SolutionNameMin: Cijk_Ailk_Bjlk_HBH_MT32x64x8_SE_GRVW4_LRVW4_TT4_8_VW4_WG8_8_1_WGM1
    SolutionIndex: 99
    SolutionNameMin: Cijk_Ailk_Bjlk_HBH_MT64x64x32_SE_GRVW4_LRVW4_TT4_4_VW4_WG16_16_1_WGM8
    SolutionIndex: 100
    SolutionNameMin: Cijk_Ailk_Bjlk_HBH_MT64x64x16_SE_GRVW4_LRVW4_TT8_4_VW4_WG8_16_1_WGM8
    SolutionIndex: 101
    SolutionNameMin: Cijk_Ailk_Bjlk_HBH_MT64x64x8_SE_GRVW4_LRVW4_TT8_4_VW4_WG8_16_1_WGM1
    SolutionIndex: 102
    SolutionNameMin: Cijk_Ailk_Bjlk_HBH_MT64x64x8_SE_GRVW2_LRVW2_TT4_8_VW2_WG16_8_1_WGM8
    SolutionIndex: 103
    SolutionNameMin: Cijk_Ailk_Bjlk_HBH_MT64x128x8_SE_GRVW2_LRVW2_TT4_8_VW2_WG16_16_1_WGM8
    SolutionIndex: 104
    SolutionNameMin: Cijk_Ailk_Bjlk_HBH_MT64x24x8_SE_GRVW2_LRVW2_TT4_6_VW2_WG16_4_1_WGM8
    SolutionIndex: 105
    SolutionNameMin: Cijk_Ailk_Bjlk_HBH_MT64x128x16_SE_GRVW4_LRVW4_TT4_8_VW4_WG16_16_1_WGM8
    SolutionIndex: 106
    SolutionNameMin: Cijk_Ailk_Bjlk_HBH_MT64x96x24_SE_GRVW2_LRVW2_TT4_6_VW2_WG16_16_1_WGM8
    SolutionIndex: 107
    SolutionNameMin: Cijk_Ailk_Bjlk_HBH_MT32x96x8_SE_GRVW2_LRVW2_TT4_6_VW2_WG8_16_1_WGM8
    SolutionIndex: 108
    SolutionNameMin: Cijk_Ailk_Bjlk_HBH_MT32x128x8_SE_GRVW4_LRVW4_TT4_8_VW4_WG8_16_1_WGM1
    SolutionIndex: 109
    SolutionNameMin: Cijk_Ailk_Bjlk_HBH_MT32x64x8_SE_GRVW2_LRVW2_TT4_4_VW2_WG8_16_1_WGM8
    SolutionIndex: 110
    SolutionNameMin: Cijk_Ailk_Bjlk_HBH_MT64x32x8_SE_GRVW2_LRVW2_TT8_4_VW2_WG8_8_1_WGM8
    SolutionIndex: 111
    SolutionNameMin: Cijk_Ailk_Bjlk_HBH_MT64x128x16_SE_GRVW2_LRVW2_TT4_8_VW2_WG16_16_1_WGM1
    SolutionIndex: 112
    SolutionNameMin: Cijk_Ailk_Bjlk_HBH_MT32x64x8_SE_GRVW4_LRVW4_TT8_4_VW4_WG4_16_1_WGM8
    SolutionIndex: 113
    SolutionNameMin: Cijk_Ailk_Bjlk_HBH_MT32x64x8_SE_GRVW4_LRVW4_TT4_8_VW4_WG8_8_1_WGM8
    SolutionIndex: 114
    SolutionNameMin: Cijk_Ailk_Bjlk_HBH_MT48x64x16_SE_GRVW2_LRVW2_TT6_4_VW2_WG8_16_1_WGM8
    SolutionIndex: 115
    SolutionNameMin: Cijk_Ailk_Bjlk_HBH_MT64x128x8_SE_GRVW4_LRVW4_TT4_8_VW4_WG16_16_1_WGM8
    SolutionIndex: 116
    SolutionNameMin: Cijk_Ailk_Bjlk_HBH_MT32x32x8_SE_GRVW2_LRVW2_TT4_4_VW2_WG8_8_1_WGM1
    SolutionIndex: 117
    SolutionNameMin: Cijk_Ailk_Bjlk_HBH_MT64x128x8_SE_GRVW2_LRVW2_TT4_8_VW2_WG16_16_1_WGM1
- - - [64, 448, 1, 3328]
    - [10, 1447.52]
  - - [1, 64, 1, 256]
    - [20, 0.446193]
  - - [3584, 64, 1, 1280]
    - [17, 5816.19]
  - - [64, 128, 1, 256]
    - [1, 211.406]
  - - [64, 5888, 1, 1280]
    - [17, 7027.17]
  - - [64, 4288, 1, 1280]
    - [18, 5870.2]
  - - [3584, 64, 1, 3328]
    - [17, 6228.49]
  - - [64, 1024, 1, 3328]
    - [18, 3296.64]
  - - [1, 64, 1, 1280]
    - [22, 0.688638]
  - - [704, 64, 1, 3328]
    - [10, 2159.37]
  - - [64, 448, 1, 1280]
    - [6, 1325.87]
  - - [64, 704, 1, 3328]
    - [11, 2197.34]
  - - [64, 64, 1, 1280]
    - [9, 182.044]
  - - [64, 5056, 1, 256]
    - [0, 4907.44]
  - - [64, 4288, 1, 3328]
    - [17, 6241.87]
  - - [1856, 64, 1, 3328]
    - [18, 5478.29]
  - - [1, 64, 1, 1]
    - [19, 0.00601504]
  - - [448, 64, 1, 1280]
    - [5, 1325.87]
  - - [5888, 64, 1, 1280]
    - [17, 6970.3]
  - - [2944, 64, 1, 256]
    - [1, 3915.14]
  - - [64, 1856, 1, 256]
    - [12, 3276.8]
  - - [64, 1024, 1, 1280]
    - [18, 3066.01]
  - - [64, 256, 1, 1280]
    - [10, 777.89]
  - - [704, 64, 1, 1280]
    - [3, 1877.33]
  - - [64, 128, 1, 1280]
    - [5, 352.344]
  - - [2368, 64, 1, 256]
    - [5, 3464.05]
  - - [2368, 64, 1, 3328]
    - [18, 5297.95]
  - - [64, 1408, 1, 3328]
    - [11, 4165.18]
  - - [1856, 64, 1, 1280]
    - [18, 4848.33]
  - - [64, 3584, 1, 1280]
    - [4, 6016.42]
  - - [448, 64, 1, 3328]
    - [10, 1449.28]
  - - [5888, 64, 1, 3328]
    - [17, 7352.84]
  - - [128, 64, 1, 256]
    - [16, 211.406]
  - - [64, 128, 1, 3328]
    - [6, 393.974]
  - - [64, 256, 1, 3328]
    - [13, 827.153]
  - - [4288, 64, 1, 3328]
    - [17, 6204.57]
  - - [64, 2944, 1, 256]
    - [16, 4158.15]
  - - [6784, 64, 1, 256]
    - [17, 5962.93]
  - - [1024, 64, 1, 1280]
    - [18, 3120.76]
  - - [64, 2368, 1, 1280]
    - [6, 5009.98]
  - - [64, 3584, 1, 3328]
    - [17, 6220.39]
  - - [64, 6784, 1, 3328]
    - [17, 7454.3]
  - - [3584, 64, 1, 256]
    - [17, 4369.07]
  - - [64, 1856, 1, 3328]
    - [18, 5448.09]
  - - [448, 64, 1, 256]
    - [5, 841.747]
  - - [64, 5056, 1, 3328]
    - [17, 7213.88]
  - - [256, 64, 1, 256]
    - [1, 509.017]
  - - [4288, 64, 1, 1280]
    - [17, 6031.47]
  - - [1, 1, 1, 1]
    - [21, 9.92063e-05]
  - - [5056, 64, 1, 1280]
    - [18, 6893.99]
  - - [1024, 64, 1, 3328]
    - [17, 3245.59]
  - - [1408, 64, 1, 256]
    - [16, 2507.46]
  - - [64, 1408, 1, 256]
    - [7, 2551.84]
  - - [64, 2368, 1, 3328]
    - [6, 5306.9]
  - - [64, 448, 1, 256]
    - [5, 882.215]
  - - [64, 6784, 1, 1280]
    - [18, 7139.58]
  - - [64, 1856, 1, 1280]
    - [14, 4848.33]
  - - [64, 6784, 1, 256]
    - [17, 5912.18]
  - - [64, 5056, 1, 1280]
    - [18, 6741.33]
  - - [64, 4288, 1, 256]
    - [16, 4671.18]
  - - [128, 64, 1, 1280]
    - [5, 344.926]
  - - [5888, 64, 1, 256]
    - [16, 5153.26]
  - - [64, 5888, 1, 3328]
    - [17, 7436.53]
  - - [64, 1024, 1, 256]
    - [11, 1906.5]
  - - [5056, 64, 1, 3328]
    - [17, 7351.77]
  - - [256, 64, 1, 1280]
    - [10, 766.503]
  - - [64, 256, 1, 256]
    - [5, 499.322]
  - - [704, 64, 1, 256]
    - [5, 1310.72]
  - - [64, 1408, 1, 1280]
    - [18, 3865.39]
  - - [1, 1, 1, 256]
    - [20, 0.00683761]
  - - [64, 704, 1, 256]
    - [8, 1347.47]
  - - [64, 2944, 1, 3328]
    - [18, 6570.08]
  - - [64, 64, 1, 256]
    - [1, 107.436]
  - - [1856, 64, 1, 256]
    - [17, 3393.83]
  - - [128, 64, 1, 3328]
    - [17, 392.612]
  - - [2944, 64, 1, 1280]
    - [17, 5922.78]
  - - [4288, 64, 1, 256]
    - [18, 4573.87]
  - - [1, 1, 1, 1280]
    - [22, 0.0107311]
  - - [64, 2944, 1, 1280]
    - [18, 6190.26]
  - - [1408, 64, 1, 1280]
    - [18, 3875.79]
  - - [6784, 64, 1, 3328]
    - [17, 7414.52]
  - - [1024, 64, 1, 256]
    - [18, 2076.39]
  - - [64, 2368, 1, 256]
    - [7, 3619.15]
  - - [64, 3584, 1, 256]
    - [2, 4475.63]
  - - [2944, 64, 1, 3328]
    - [18, 6559.08]
  - - [2368, 64, 1, 1280]
    - [5, 4898.65]
  - - [256, 64, 1, 3328]
    - [10, 828.158]
  - - [64, 64, 1, 3328]
    - [17, 202.608]
  - - [1, 1, 1, 3328]
    - [22, 0.0115076]
  - - [64, 5888, 1, 256]
    - [17, 5481.19]
  - - [64, 704, 1, 1280]
    - [13, 1980.48]
  - - [6784, 64, 1, 1280]
    - [17, 7038.31]
  - - [5056, 64, 1, 256]
    - [15, 4622.63]
  - - [1408, 64, 1, 3328]
    - [18, 4128.48]
  - - [4096, 7133, 1, 4096]
    - [31, 18834.1]
  - - [512, 16, 1, 512]
    - [26, 264.792]
  - - [2048, 7133, 1, 2048]
    - [29, 18669.8]
  - - [2560, 7133, 1, 2560]
    - [30, 18330.9]
  - - [1024, 1024, 1, 1024]
    - [30, 14385.6]
  - - [3072, 7435, 1, 1024]
    - [29, 18501.2]
  - - [1024, 32, 1, 512]
    - [23, 900.065]
  - - [1760, 7133, 1, 1760]
    - [30, 17490.3]
  - - [7680, 5481, 1, 2560]
    - [29, 18657.2]
  - - [1024, 16, 1, 512]
    - [23, 444.312]
  - - [512, 32, 1, 512]
    - [25, 516.54]
  - - [3136, 256, 64, 64]
    - [45, 17694.4]
  - - [784, 512, 64, 128]
    - [46, 18837.8]
  - - [784, 128, 64, 512]
    - [44, 20717.8]
  - - [3136, 64, 128, 64]
    - [50, 15383.3]
  - - [196, 256, 128, 1024]
    - [45, 17751.8]
  - - [196, 256, 64, 1024]
    - [45, 17162.5]
  - - [196, 1024, 128, 256]
    - [45, 16832.2]
  - - [784, 128, 256, 512]
    - [44, 21422.4]
  - - [3136, 64, 64, 256]
    - [49, 19953.5]
  - - [3136, 64, 256, 256]
    - [47, 20976.9]
  - - [3136, 256, 256, 64]
    - [52, 18870.2]
  - - [3136, 64, 128, 256]
    - [51, 20843.9]
  - - [784, 128, 128, 512]
    - [44, 21204.1]
  - - [784, 512, 128, 128]
    - [44, 19252.5]
  - - [784, 512, 256, 128]
    - [46, 19261.6]
  - - [196, 1024, 64, 256]
    - [45, 16634.6]
  - - [3136, 64, 64, 64]
    - [50, 14979.7]
  - - [196, 1024, 256, 256]
    - [48, 16995.7]
  - - [196, 256, 256, 1024]
    - [45, 18063.8]
  - - [3136, 256, 128, 64]
    - [51, 18163.6]
  - - [3136, 64, 256, 64]
    - [50, 15640.9]
  - - [64, 512, 64, 512]
    - [53, 12450.6]
  - - [64, 512, 256, 512]
    - [54, 13773.0]
  - - [64, 512, 128, 512]
    - [54, 13408.4]
  - - [64, 512, 40, 512]
    - [55, 11848.3]
  - - [1024, 96, 64, 1024]
    - [56, 13640.0]
  - - [96, 1024, 64, 1024]
    - [57, 13635.4]
  - - [1024, 96, 128, 1024]
    - [56, 13949.5]
  - - [96, 1024, 128, 1024]
    - [58, 13917.0]
  - - [1024, 64, 256, 1024]
    - [59, 14144.9]
  - - [64, 1024, 256, 1024]
    - [54, 14175.7]
  - - [1024, 64, 32, 1024]
    - [55, 13190.9]
  - - [64, 1024, 32, 1024]
    - [54, 13335.1]
  - - [1024, 64, 64, 1024]
    - [55, 13706.2]
  - - [64, 1024, 64, 1024]
    - [55, 13783.6]
  - - [4096, 1024, 1, 2912]
    - [60, 12047.1]
  - - [4096, 1024, 1, 7392]
    - [61, 12078.2]
  - - [1024, 33712, 1, 7480]
    - [62, 13007.9]
  - - [1024, 33712, 1, 7424]
    - [62, 12963.8]
  - - [1024, 1024, 1, 9040]
    - [63, 10402.9]
  - - [1024, 4096, 1, 7904]
    - [64, 11693.6]
  - - [1024, 4096, 1, 8352]
    - [65, 11822.3]
  - - [1024, 4096, 1, 6480]
    - [62, 11660.8]
  - - [1024, 33712, 1, 8320]
    - [60, 12071.8]
  - - [1024, 1024, 1, 9512]
    - [63, 10414.8]
  - - [4096, 1024, 1, 3120]
    - [63, 10938.0]
  - - [4096, 1024, 1, 7296]
    - [66, 11161.9]
  - - [4096, 1024, 1, 5888]
    - [67, 11054.2]
  - - [1024, 4096, 1, 6976]
    - [68, 11481.1]
  - - [1024, 33712, 1, 9184]
    - [69, 11595.9]
  - - [1024, 4096, 1, 1344]
    - [61, 11920.9]
  - - [1024, 4096, 1, 7872]
    - [69, 11322.2]
  - - [4096, 1024, 1, 9960]
    - [65, 11127.7]
  - - [1024, 4096, 1, 3240]
    - [70, 11211.7]
  - - [1024, 4096, 1, 8680]
    - [70, 11308.9]
  - - [1024, 33712, 1, 3240]
    - [62, 12241.1]
  - - [1024, 4096, 1, 6600]
    - [70, 11258.1]
  - - [1024, 4096, 1, 5984]
    - [71, 11248.1]
  - - [4096, 1024, 1, 9112]
    - [62, 11747.4]
  - - [1024, 1024, 1, 8288]
    - [63, 9702.77]
  - - [1024, 1024, 1, 9744]
    - [63, 10412.2]
  - - [4096, 1024, 1, 9976]
    - [72, 11628.3]
  - - [1024, 1024, 1, 7200]
    - [73, 9707.01]
  - - [1024, 4096, 1, 10000]
    - [74, 11084.3]
  - - [1024, 1024, 1, 9520]
    - [75, 9750.74]
  - - [1024, 1024, 1, 9792]
    - [63, 9704.02]
  - - [1024, 33712, 1, 8528]
    - [70, 11864.8]
  - - [1024, 33712, 1, 8616]
    - [62, 11950.1]
  - - [1024, 4096, 1, 8760]
    - [65, 11861.1]
  - - [1024, 33712, 1, 8296]
    - [70, 11883.5]
  - - [1024, 33712, 1, 9760]
    - [76, 11444.3]
  - - [4096, 1024, 1, 7208]
    - [75, 11927.7]
  - - [1024, 4096, 1, 6688]
    - [68, 11403.4]
  - - [1024, 1024, 1, 6400]
    - [77, 10107.9]
  - - [1024, 4096, 1, 9088]
    - [78, 11167.7]
  - - [4096, 1024, 1, 8648]
    - [62, 11610.2]
  - - [1024, 1024, 1, 3000]
    - [79, 10261.3]
  - - [4096, 1024, 1, 10152]
    - [80, 11096.7]
  - - [1024, 33712, 1, 5760]
    - [81, 12201.9]
  - - [1024, 1024, 1, 9696]
    - [73, 10116.8]
  - - [1024, 4096, 1, 5888]
    - [71, 11277.9]
  - - [4096, 1024, 1, 9696]
    - [62, 11447.5]
  - - [4096, 1024, 1, 9240]
    - [62, 11119.9]
  - - [1024, 1024, 1, 9952]
    - [63, 9712.04]
  - - [4096, 1024, 1, 8320]
    - [68, 10860.6]
  - - [4096, 1024, 1, 9632]
    - [62, 11628.8]
  - - [1024, 4096, 1, 7200]
    - [81, 11389.3]
  - - [4096, 1024, 1, 8576]
    - [62, 11473.6]
  - - [1024, 1024, 1, 7640]
    - [67, 9812.71]
  - - [1024, 4096, 1, 6624]
    - [82, 11265.7]
  - - [1024, 33712, 1, 7040]
    - [70, 12044.9]
  - - [1024, 1024, 1, 800]
    - [79, 9763.28]
  - - [1024, 4096, 1, 9440]
    - [83, 11542.7]
  - - [4096, 1024, 1, 9440]
    - [62, 11337.2]
  - - [1024, 33712, 1, 4864]
    - [70, 12070.8]
  - - [1024, 33712, 1, 9440]
    - [84, 11427.2]
  - - [1024, 1024, 1, 6048]
    - [63, 10382.7]
  - - [4096, 1024, 1, 9288]
    - [83, 10928.4]
  - - [1024, 4096, 1, 8480]
    - [69, 11394.0]
  - - [1024, 1024, 1, 8856]
    - [77, 10058.7]
  - - [1024, 1024, 1, 8816]
    - [63, 9704.6]
  - - [1024, 33712, 1, 9648]
    - [76, 11410.1]
  - - [4096, 1024, 1, 1232]
    - [61, 11926.2]
  - - [4096, 1024, 1, 2720]
    - [63, 10933.5]
  - - [1024, 1024, 1, 9152]
    - [63, 9705.24]
  - - [1024, 1024, 1, 1856]
    - [63, 10178.6]
  - - [4096, 1024, 1, 5640]
    - [62, 11920.4]
  - - [4096, 1024, 1, 3040]
    - [63, 10942.1]
  - - [1024, 1024, 1, 5328]
    - [73, 10356.7]
  - - [4096, 1024, 1, 9168]
    - [85, 11079.1]
  - - [1024, 1024, 1, 9640]
    - [86, 10335.6]
  - - [1024, 33712, 1, 5400]
    - [70, 12122.5]
  - - [1024, 1024, 1, 8944]
    - [61, 10023.1]
  - - [1024, 1024, 1, 5784]
    - [63, 10378.1]
  - - [1024, 33712, 1, 8640]
    - [70, 11771.0]
  - - [1024, 4096, 1, 6912]
    - [65, 11866.0]
  - - [1024, 1024, 1, 8208]
    - [67, 9777.66]
  - - [1024, 4096, 1, 5760]
    - [71, 10763.4]
  - - [1024, 4096, 1, 8664]
    - [62, 11487.9]
  - - [1024, 1024, 1, 2400]
    - [61, 9885.99]
  - - [1024, 4096, 1, 2400]
    - [62, 11533.3]
  - - [1024, 33712, 1, 2400]
    - [62, 12080.0]
  - - [1024, 4096, 1, 9344]
    - [62, 11682.2]
  - - [1024, 1024, 1, 9312]
    - [73, 10313.8]
  - - [4096, 1024, 1, 9408]
    - [87, 11711.9]
  - - [1024, 1024, 1, 7296]
    - [63, 9697.78]
  - - [1024, 4096, 1, 4216]
    - [83, 10996.4]
  - - [1024, 33712, 1, 9408]
    - [76, 11564.9]
  - - [1024, 4096, 1, 9760]
    - [65, 11858.4]
  - - [1024, 4096, 1, 9512]
    - [62, 11568.6]
  - - [4096, 1024, 1, 5400]
    - [62, 11823.5]
  - - [1024, 33712, 1, 3120]
    - [88, 11800.4]
  - - [1024, 4096, 1, 7480]
    - [69, 11475.6]
  - - [1024, 1024, 1, 3600]
    - [63, 10311.6]
  - - [1024, 4096, 1, 800]
    - [89, 11205.7]
  - - [1024, 1024, 1, 3240]
    - [63, 10300.1]
  - - [1024, 4096, 1, 9288]
    - [83, 11055.1]
  - - [1024, 1024, 1, 3024]
    - [61, 9909.01]
  - - [1024, 1024, 1, 9752]
    - [90, 10379.3]
  - - [1024, 1024, 1, 8064]
    - [77, 10246.8]
  - - [4096, 1024, 1, 4048]
    - [91, 11031.9]
  - - [1024, 4096, 1, 7840]
    - [78, 11465.9]
  - - [1024, 33712, 1, 8928]
    - [76, 11666.8]
  - - [1024, 33712, 1, 8064]
    - [62, 12338.4]
  - - [1024, 1024, 1, 3344]
    - [60, 9927.6]
  - - [4096, 1024, 1, 6400]
    - [92, 10887.5]
  - - [4096, 1024, 1, 7872]
    - [68, 11243.9]
  - - [1024, 4096, 1, 4032]
    - [71, 11168.8]
  - - [1024, 1024, 1, 5984]
    - [63, 10376.1]
  - - [4096, 1024, 1, 4032]
    - [93, 11089.1]
  - - [1024, 4096, 1, 6400]
    - [63, 10943.3]
  - - [1024, 33712, 1, 6272]
    - [87, 12351.8]
  - - [1024, 4096, 1, 8432]
    - [65, 11833.9]
  - - [1024, 1024, 1, 5304]
    - [63, 10371.5]
  - - [1024, 1024, 1, 8832]
    - [73, 10378.6]
  - - [1024, 1024, 1, 4488]
    - [63, 10349.2]
  - - [4096, 1024, 1, 9520]
    - [94, 11043.7]
  - - [1024, 1024, 1, 2176]
    - [63, 10211.7]
  - - [4096, 1024, 1, 6480]
    - [66, 11285.5]
  - - [4096, 1024, 1, 4968]
    - [94, 10985.5]
  - - [1024, 4096, 1, 4560]
    - [95, 11027.9]
  - - [1024, 4096, 1, 8880]
    - [62, 11303.2]
  - - [1024, 33712, 1, 8960]
    - [70, 11692.1]
  - - [1024, 1024, 1, 8968]
    - [61, 10031.1]
  - - [4096, 1024, 1, 8216]
    - [86, 10782.9]
  - - [1024, 4096, 1, 8968]
    - [62, 11688.5]
  - - [4096, 1024, 1, 8968]
    - [65, 11126.2]
  - - [1024, 4096, 1, 9520]
    - [94, 11039.8]
  - - [1024, 1024, 1, 5016]
    - [75, 9760.32]
  - - [1024, 1024, 1, 6816]
    - [63, 10402.7]
  - - [4096, 1024, 1, 9656]
    - [83, 11146.2]
  - - [1024, 1024, 1, 9272]
    - [73, 10357.9]
  - - [1024, 1024, 1, 6976]
    - [86, 10307.2]
  - - [1024, 33712, 1, 9384]
    - [70, 11488.7]
  - - [1024, 4096, 1, 9272]
    - [65, 11825.7]
  - - [1024, 1024, 1, 5280]
    - [75, 9778.98]
  - - [1024, 1024, 1, 6912]
    - [63, 9685.34]
  - - [1024, 1024, 1, 9168]
    - [63, 9701.8]
  - - [1024, 1024, 1, 5640]
    - [86, 10283.0]
  - - [4096, 1024, 1, 9384]
    - [83, 11028.0]
  - - [1024, 4096, 1, 9168]
    - [70, 11327.9]
  - - [1024, 1024, 1, 10224]
    - [73, 10407.6]
  - - [1024, 1024, 1, 9384]
    - [86, 10334.2]
  - - [1024, 1024, 1, 8528]
    - [63, 9899.73]
  - - [1024, 33712, 1, 8800]
    - [76, 12115.3]
  - - [1024, 1024, 1, 4704]
    - [61, 9970.26]
  - - [1024, 33712, 1, 9936]
    - [78, 11360.3]
  - - [4096, 1024, 1, 4704]
    - [75, 11902.7]
  - - [1024, 33712, 1, 4704]
    - [70, 12107.7]
  - - [1024, 1024, 1, 8352]
    - [90, 10368.5]
  - - [1024, 1024, 1, 7752]
    - [86, 10314.4]
  - - [1024, 4096, 1, 7224]
    - [92, 11441.4]
  - - [1024, 1024, 1, 3808]
    - [63, 10316.7]
  - - [1024, 33712, 1, 8000]
    - [61, 12042.0]
  - - [1024, 4096, 1, 8856]
    - [65, 11850.0]
  - - [1024, 1024, 1, 7168]
    - [77, 10132.9]
  - - [4096, 1024, 1, 2400]
    - [86, 10754.6]
  - - [1024, 1024, 1, 9632]
    - [73, 10384.8]
  - - [4096, 1024, 1, 9800]
    - [96, 11350.2]
  - - [1024, 4096, 1, 10040]
    - [96, 11368.5]
  - - [1024, 4096, 1, 8512]
    - [83, 11565.4]
  - - [1024, 1024, 1, 8512]
    - [67, 9824.6]
  - - [4096, 1024, 1, 7128]
    - [68, 11109.5]
  - - [1024, 4096, 1, 9672]
    - [83, 11563.1]
  - - [1024, 4096, 1, 3360]
    - [65, 11905.9]
  - - [1024, 33712, 1, 6624]
    - [72, 12189.0]
  - - [1024, 33712, 1, 10224]
    - [76, 11282.9]
  - - [1024, 4096, 1, 7168]
    - [65, 11884.8]
  - - [4096, 1024, 1, 6976]
    - [62, 11718.7]
  - - [1024, 4096, 1, 2176]
    - [97, 11051.5]
  - - [1024, 1024, 1, 7360]
    - [73, 10371.9]
  - - [4096, 1024, 1, 2176]
    - [70, 11458.9]
  - - [4096, 1024, 1, 9936]
    - [83, 11254.9]
  - - [1024, 33712, 1, 7800]
    - [70, 11979.8]
  - - [1024, 4096, 1, 9120]
    - [65, 11859.7]
  - - [1024, 4096, 1, 5600]
    - [62, 11565.0]
  - - [4096, 1024, 1, 1856]
    - [65, 11840.8]
  - - [1024, 4096, 1, 8232]
    - [69, 11408.1]
  - - [1024, 33712, 1, 8360]
    - [70, 11865.1]
  - - [1024, 33712, 1, 5600]
    - [62, 12760.0]
  - - [1024, 1024, 1, 8544]
    - [61, 9951.79]
  - - [1024, 4096, 1, 7696]
    - [69, 11415.8]
  - - [1024, 1024, 1, 6800]
    - [67, 9809.45]
  - - [4096, 1024, 1, 8232]
    - [80, 10833.7]
  - - [1024, 4096, 1, 9856]
    - [83, 11440.3]
  - - [1024, 4096, 1, 6936]
    - [62, 11619.2]
  - - [1024, 4096, 1, 8216]
    - [69, 11335.0]
  - - [4096, 1024, 1, 9672]
    - [62, 11127.2]
  - - [4096, 1024, 1, 9248]
    - [80, 11162.9]
  - - [1024, 33712, 1, 3864]
    - [98, 11971.4]
  - - [1024, 4096, 1, 9152]
    - [62, 11778.1]
  - - [1024, 4096, 1, 8096]
    - [78, 11418.3]
  - - [4096, 1024, 1, 8096]
    - [62, 11583.1]
  - - [1024, 4096, 1, 5280]
    - [65, 11662.6]
  - - [1024, 33712, 1, 8096]
    - [70, 11927.0]
  - - [1024, 33712, 1, 9656]
    - [98, 11426.4]
  - - [1024, 1024, 1, 6496]
    - [73, 10387.2]
  - - [4096, 1024, 1, 4920]
    - [80, 10733.1]
  - - [1024, 1024, 1, 6560]
    - [86, 9992.2]
  - - [4096, 1024, 1, 8832]
    - [83, 11316.5]
  - - [1024, 4096, 1, 9960]
    - [83, 11144.8]
  - - [1024, 33712, 1, 8600]
    - [70, 11809.8]
  - - [1024, 1024, 1, 6960]
    - [77, 10226.0]
  - - [1024, 1024, 1, 6072]
    - [63, 9679.72]
  - - [1024, 4096, 1, 6072]
    - [66, 11293.3]
  - - [1024, 4096, 1, 3808]
    - [62, 11583.9]
  - - [4096, 1024, 1, 6072]
    - [80, 11324.2]
  - - [1024, 33712, 1, 6072]
    - [70, 12166.6]
  - - [4096, 1024, 1, 8784]
    - [65, 11929.1]
  - - [1024, 4096, 1, 9072]
    - [62, 11527.1]
  - - [1024, 33712, 1, 8256]
    - [70, 11832.1]
  - - [1024, 4096, 1, 9040]
    - [65, 11848.3]
  - - [1024, 1024, 1, 5600]
    - [67, 9781.46]
  - - [1024, 33712, 1, 9072]
    - [76, 11543.5]
  - - [1024, 4096, 1, 4968]
    - [75, 11839.9]
  - - [4096, 1024, 1, 8120]
    - [62, 11495.7]
  - - [1024, 4096, 1, 8400]
    - [62, 11634.5]
  - - [1024, 4096, 1, 4600]
    - [65, 11080.2]
  - - [4096, 1024, 1, 8400]
    - [65, 11117.6]
  - - [4096, 1024, 1, 10032]
    - [62, 11601.0]
  - - [1024, 4096, 1, 7800]
    - [92, 11396.3]
  - - [1024, 4096, 1, 5680]
    - [62, 11597.3]
  - - [1024, 33712, 1, 6400]
    - [87, 12322.5]
  - - [1024, 1024, 1, 8960]
    - [73, 10366.3]
  - - [1024, 4096, 1, 8976]
    - [70, 11230.7]
  - - [1024, 33712, 1, 5824]
    - [81, 12341.8]
  - - [1024, 4096, 1, 5800]
    - [75, 11807.3]
  - - [1024, 1024, 1, 8496]
    - [65, 9763.14]
  - - [1024, 4096, 1, 4224]
    - [83, 11514.5]
  - - [1024, 4096, 1, 6800]
    - [81, 11339.9]
  - - [4096, 1024, 1, 6800]
    - [92, 11136.2]
  - - [4096, 1024, 1, 5440]
    - [81, 11409.4]
  - - [1024, 1024, 1, 4560]
    - [63, 9651.0]
  - - [1024, 1024, 1, 8200]
    - [63, 10405.5]
  - - [1024, 33712, 1, 5104]
    - [70, 12094.1]
  - - [4096, 1024, 1, 7448]
    - [66, 10860.2]
  - - [1024, 4096, 1, 8832]
    - [78, 11271.9]
  - - [1024, 1024, 1, 7384]
    - [75, 9795.88]
  - - [1024, 33712, 1, 10176]
    - [76, 11307.3]
  - - [1024, 4096, 1, 6864]
    - [65, 11892.6]
  - - [1024, 4096, 1, 5504]
    - [65, 11095.3]
  - - [4096, 1024, 1, 1344]
    - [65, 11801.1]
  - - [1024, 4096, 1, 8648]
    - [83, 11534.9]
  - - [4096, 1024, 1, 6864]
    - [62, 11709.2]
  - - [4096, 1024, 1, 9272]
    - [99, 11175.1]
  - - [1024, 1024, 1, 6864]
    - [63, 10393.7]
  - - [1024, 1024, 1, 7216]
    - [63, 9682.77]
  - - [1024, 33712, 1, 9504]
    - [76, 11543.2]
  - - [1024, 1024, 1, 7744]
    - [61, 10023.9]
  - - [4096, 1024, 1, 6160]
    - [66, 11439.9]
  - - [4096, 1024, 1, 7744]
    - [68, 11103.7]
  - - [1024, 4096, 1, 8704]
    - [78, 11414.5]
  - - [1024, 4096, 1, 8800]
    - [70, 11189.7]
  - - [1024, 33712, 1, 8184]
    - [70, 11873.3]
  - - [1024, 1024, 1, 9016]
    - [73, 10361.6]
  - - [4096, 1024, 1, 8840]
    - [83, 10897.7]
  - - [4096, 1024, 1, 9016]
    - [62, 11122.0]
  - - [1024, 33712, 1, 9016]
    - [76, 11667.3]
  - - [4096, 1024, 1, 5784]
    - [75, 11924.3]
  - - [4096, 1024, 1, 7840]
    - [92, 11113.1]
  - - [1024, 33712, 1, 9744]
    - [70, 11356.8]
  - - [1024, 4096, 1, 1984]
    - [61, 12007.2]
  - - [1024, 33712, 1, 9776]
    - [69, 11322.3]
  - - [1024, 33712, 1, 7072]
    - [62, 12593.7]
  - - [1024, 1024, 1, 5504]
    - [63, 10369.7]
  - - [1024, 1024, 1, 6936]
    - [83, 10282.9]
  - - [4096, 1024, 1, 9912]
    - [96, 11284.7]
  - - [1024, 4096, 1, 6512]
    - [81, 11357.8]
  - - [4096, 1024, 1, 9152]
    - [99, 11186.1]
  - - [1024, 4096, 1, 5824]
    - [65, 11097.4]
  - - [1024, 1024, 1, 5832]
    - [63, 10380.4]
  - - [1024, 1024, 1, 6624]
    - [63, 10386.6]
  - - [1024, 4096, 1, 6528]
    - [68, 11244.3]
  - - [1024, 1024, 1, 9024]
    - [63, 9702.15]
  - - [1024, 33712, 1, 7192]
    - [67, 12072.4]
  - - [4096, 1024, 1, 9048]
    - [65, 11928.5]
  - - [4096, 1024, 1, 8904]
    - [62, 11061.4]
  - - [1024, 4096, 1, 9952]
    - [74, 11200.1]
  - - [1024, 1024, 1, 6968]
    - [73, 10359.6]
  - - [4096, 1024, 1, 8856]
    - [70, 11059.7]
  - - [1024, 4096, 1, 9504]
    - [70, 11199.6]
  - - [1024, 1024, 1, 9672]
    - [67, 9821.23]
  - - [1024, 4096, 1, 5040]
    - [81, 11261.5]
  - - [1024, 33712, 1, 8664]
    - [70, 11751.8]
  - - [4096, 1024, 1, 10240]
    - [65, 11934.7]
  - - [1024, 1024, 1, 8016]
    - [63, 10404.7]
  - - [4096, 1024, 1, 8600]
    - [100, 10874.9]
  - - [1024, 1024, 1, 8648]
    - [63, 9704.68]
  - - [1024, 1024, 1, 8024]
    - [63, 9697.72]
  - - [1024, 1024, 1, 8464]
    - [90, 10368.1]
  - - [1024, 1024, 1, 9184]
    - [63, 9707.75]
  - - [1024, 33712, 1, 6528]
    - [72, 12161.3]
  - - [1024, 33712, 1, 7936]
    - [70, 11930.1]
  - - [1024, 4096, 1, 7896]
    - [65, 11904.1]
  - - [1024, 4096, 1, 4920]
    - [65, 11469.5]
  - - [1024, 1024, 1, 9424]
    - [86, 10153.9]
  - - [1024, 4096, 1, 3000]
    - [66, 11262.1]
  - - [1024, 4096, 1, 6560]
    - [62, 11709.9]
  - - [1024, 1024, 1, 10160]
    - [67, 9826.49]
  - - [1024, 1024, 1, 8432]
    - [90, 10358.9]
  - - [1024, 33712, 1, 9272]
    - [76, 11585.1]
  - - [1024, 4096, 1, 9240]
    - [65, 11872.4]
  - - [1024, 33712, 1, 9952]
    - [69, 11322.4]
  - - [1024, 4096, 1, 9360]
    - [65, 11838.8]
  - - [1024, 1024, 1, 3256]
    - [72, 10276.2]
  - - [1024, 1024, 1, 9112]
    - [63, 9704.43]
  - - [1024, 4096, 1, 9984]
    - [96, 11436.7]
  - - [1024, 4096, 1, 9752]
    - [83, 11513.8]
  - - [4096, 1024, 1, 9768]
    - [62, 11531.2]
  - - [1024, 4096, 1, 8592]
    - [64, 11500.6]
  - - [1024, 4096, 1, 9792]
    - [62, 11377.1]
  - - [1024, 1024, 1, 9728]
    - [73, 10405.3]
  - - [1024, 4096, 1, 5120]
    - [83, 11299.2]
  - - [1024, 1024, 1, 8568]
    - [77, 10167.7]
  - - [1024, 1024, 1, 8760]
    - [63, 10418.2]
  - - [4096, 1024, 1, 1984]
    - [100, 11635.2]
  - - [1024, 1024, 1, 9920]
    - [63, 10267.9]
  - - [1024, 1024, 1, 8904]
    - [86, 10310.6]
  - - [1024, 4096, 1, 5200]
    - [83, 11258.7]
  - - [4096, 1024, 1, 8064]
    - [65, 11119.5]
  - - [4096, 1024, 1, 7968]
    - [62, 11874.0]
  - - [1024, 1024, 1, 5200]
    - [63, 10363.0]
  - - [1024, 4096, 1, 8288]
    - [83, 11531.8]
  - - [4096, 1024, 1, 10120]
    - [74, 11208.0]
  - - [4096, 1024, 1, 3024]
    - [62, 11108.0]
  - - [1024, 4096, 1, 9568]
    - [83, 11107.0]
  - - [1024, 33712, 1, 9920]
    - [76, 11357.2]
  - - [1024, 1024, 1, 1224]
    - [63, 10027.0]
  - - [1024, 1024, 1, 9912]
    - [86, 10326.5]
  - - [1024, 1024, 1, 6888]
    - [86, 10305.0]
  - - [1024, 4096, 1, 3120]
    - [70, 11220.8]
  - - [4096, 1024, 1, 8736]
    - [62, 11412.5]
  - - [1024, 4096, 1, 8208]
    - [78, 11335.6]
  - - [4096, 1024, 1, 8816]
    - [62, 11558.7]
  - - [1024, 1024, 1, 6160]
    - [63, 9684.54]
  - - [1024, 33712, 1, 8592]
    - [70, 11816.6]
  - - [1024, 4096, 1, 10168]
    - [62, 11853.1]
  - - [1024, 33712, 1, 7568]
    - [87, 12116.8]
  - - [4096, 1024, 1, 6496]
    - [75, 11936.6]
  - - [1024, 4096, 1, 9184]
    - [78, 11034.3]
  - - [1024, 1024, 1, 8232]
    - [86, 10309.4]
  - - [1024, 1024, 1, 3120]
    - [63, 10295.7]
  - - [1024, 1024, 1, 10080]
    - [86, 10330.8]
  - - [1024, 1024, 1, 8320]
    - [73, 10195.5]
  - - [1024, 33712, 1, 8968]
    - [70, 11673.7]
  - - [4096, 1024, 1, 5576]
    - [75, 11919.2]
  - - [4096, 1024, 1, 7224]
    - [92, 11294.0]
  - - [4096, 1024, 1, 912]
    - [73, 11314.5]
  - - [4096, 1024, 1, 10080]
    - [101, 11217.1]
  - - [1024, 33712, 1, 10080]
    - [78, 11299.1]
  - - [1024, 33712, 1, 4488]
    - [62, 13001.3]
  - - [1024, 33712, 1, 5800]
    - [81, 12162.2]
  - - [1024, 4096, 1, 10064]
    - [65, 11776.9]
  - - [4096, 1024, 1, 8960]
    - [62, 11600.5]
  - - [1024, 1024, 1, 10000]
    - [63, 9712.6]
  - - [1024, 1024, 1, 8184]
    - [63, 9697.07]
  - - [4096, 1024, 1, 6624]
    - [68, 11208.2]
  - - [1024, 4096, 1, 10224]
    - [101, 11452.2]
  - - [1024, 33712, 1, 10064]
    - [69, 11302.4]
  - - [4096, 1024, 1, 7640]
    - [75, 11949.0]
  - - [1024, 33712, 1, 8448]
    - [76, 11864.3]
  - - [1024, 33712, 1, 9856]
    - [76, 11386.2]
  - - [1024, 4096, 1, 10120]
    - [65, 11825.6]
  - - [4096, 1024, 1, 9576]
    - [62, 11571.9]
  - - [1024, 1024, 1, 8480]
    - [63, 9698.84]
  - - [1024, 33712, 1, 5040]
    - [70, 12084.0]
  - - [1024, 4096, 1, 3600]
    - [102, 11386.5]
  - - [1024, 4096, 1, 2912]
    - [62, 11643.7]
  - - [1024, 33712, 1, 8584]
    - [70, 11816.4]
  - - [1024, 1024, 1, 10152]
    - [86, 10328.6]
  - - [1024, 1024, 1, 4224]
    - [63, 9642.05]
  - - [1024, 4096, 1, 8024]
    - [78, 11433.6]
  - - [1024, 33712, 1, 8112]
    - [103, 12086.8]
  - - [1024, 4096, 1, 10152]
    - [65, 11836.8]
  - - [4096, 1024, 1, 8928]
    - [62, 11632.3]
  - - [4096, 1024, 1, 7616]
    - [65, 11117.5]
  - - [1024, 33712, 1, 10152]
    - [98, 11250.0]
  - - [1024, 4096, 1, 2040]
    - [61, 11999.8]
  - - [4096, 1024, 1, 8568]
    - [83, 10958.7]
  - - [1024, 1024, 1, 7800]
    - [63, 10406.7]
  - - [1024, 4096, 1, 10176]
    - [74, 11472.9]
  - - [1024, 33712, 1, 6960]
    - [70, 12059.2]
  - - [1024, 1024, 1, 4032]
    - [104, 10241.9]
  - - [1024, 1024, 1, 7840]
    - [63, 9687.04]
  - - [1024, 1024, 1, 9120]
    - [63, 9705.06]
  - - [1024, 1024, 1, 8976]
    - [63, 9707.88]
  - - [1024, 4096, 1, 8064]
    - [78, 11342.0]
  - - [4096, 1024, 1, 9360]
    - [83, 11138.6]
  - - [1024, 1024, 1, 5840]
    - [63, 10376.3]
  - - [1024, 33712, 1, 8576]
    - [70, 11787.0]
  - - [1024, 4096, 1, 9384]
    - [65, 11836.6]
  - - [4096, 1024, 1, 8040]
    - [62, 11742.3]
  - - [1024, 1024, 1, 9880]
    - [67, 9774.96]
  - - [4096, 1024, 1, 6720]
    - [68, 11383.9]
  - - [1024, 33712, 1, 10168]
    - [76, 11312.8]
  - - [1024, 1024, 1, 5920]
    - [63, 10380.5]
  - - [1024, 4096, 1, 4800]
    - [76, 10596.5]
  - - [1024, 4096, 1, 9976]
    - [83, 11271.4]
  - - [4096, 1024, 1, 9984]
    - [62, 11553.1]
  - - [1024, 33712, 1, 5576]
    - [61, 12264.8]
  - - [1024, 1024, 1, 7896]
    - [86, 10308.2]
  - - [1024, 1024, 1, 8664]
    - [63, 9705.19]
  - - [4096, 1024, 1, 3256]
    - [68, 10853.7]
  - - [1024, 4096, 1, 6496]
    - [81, 11270.3]
  - - [1024, 1024, 1, 10192]
    - [63, 9708.44]
  - - [1024, 4096, 1, 9840]
    - [83, 11387.7]
  - - [1024, 1024, 1, 8584]
    - [86, 10276.9]
  - - [4096, 1024, 1, 8480]
    - [105, 11025.8]
  - - [4096, 1024, 1, 5760]
    - [62, 11738.7]
  - - [1024, 1024, 1, 6384]
    - [86, 10299.9]
  - - [1024, 33712, 1, 9672]
    - [69, 11437.4]
  - - [4096, 1024, 1, 5832]
    - [75, 11920.6]
  - - [1024, 4096, 1, 5920]
    - [71, 10963.5]
  - - [1024, 1024, 1, 5472]
    - [63, 10372.0]
  - - [1024, 4096, 1, 9928]
    - [63, 11768.6]
  - - [4096, 1024, 1, 3344]
    - [65, 11902.3]
  - - [1024, 4096, 1, 4368]
    - [81, 11136.9]
  - - [4096, 1024, 1, 8528]
    - [99, 11162.7]
  - - [1024, 4096, 1, 9472]
    - [83, 11406.0]
  - - [4096, 1024, 1, 7728]
    - [62, 11819.0]
  - - [1024, 33712, 1, 5880]
    - [70, 12143.3]
  - - [1024, 33712, 1, 2912]
    - [106, 12182.6]
  - - [1024, 4096, 1, 7296]
    - [68, 11350.7]
  - - [1024, 4096, 1, 7504]
    - [70, 11281.0]
  - - [1024, 33712, 1, 9792]
    - [76, 11457.1]
  - - [1024, 1024, 1, 4080]
    - [63, 10333.8]
  - - [1024, 4096, 1, 8576]
    - [78, 11508.3]
  - - [4096, 1024, 1, 10200]
    - [62, 11512.9]
  - - [1024, 1024, 1, 5576]
    - [63, 10369.7]
  - - [1024, 1024, 1, 9464]
    - [63, 9700.96]
  - - [1024, 4096, 1, 9800]
    - [95, 11042.4]
  - - [1024, 4096, 1, 8320]
    - [62, 11707.7]
  - - [1024, 1024, 1, 8616]
    - [63, 10418.0]
  - - [1024, 1024, 1, 9408]
    - [86, 10165.9]
  - - [1024, 4096, 1, 6888]
    - [68, 11476.4]
  - - [4096, 1024, 1, 8464]
    - [62, 11234.3]
  - - [4096, 1024, 1, 7920]
    - [62, 11639.4]
  - - [1024, 4096, 1, 7056]
    - [69, 11434.7]
  - - [1024, 33712, 1, 3072]
    - [62, 12243.2]
  - - [1024, 1024, 1, 6600]
    - [63, 10400.0]
  - - [1024, 1024, 1, 9344]
    - [73, 10184.0]
  - - [4096, 1024, 1, 4368]
    - [76, 10857.1]
  - - [1024, 1024, 1, 9968]
    - [73, 10387.4]
  - - [1024, 33712, 1, 5504]
    - [61, 12301.5]
  - - [1024, 33712, 1, 9696]
    - [76, 11440.2]
  - - [4096, 1024, 1, 7168]
    - [75, 11944.1]
  - - [1024, 4096, 1, 7616]
    - [69, 11385.7]
  - - [4096, 1024, 1, 3600]
    - [62, 11302.0]
  - - [1024, 1024, 1, 1984]
    - [72, 9501.14]
  - - [1024, 4096, 1, 9024]
    - [70, 11260.1]
  - - [1024, 33712, 1, 8200]
    - [70, 11843.9]
  - - [1024, 4096, 1, 8904]
    - [65, 11887.0]
  - - [1024, 33712, 1, 9976]
    - [76, 11386.8]
  - - [1024, 33712, 1, 5936]
    - [62, 12826.4]
  - - [1024, 4096, 1, 7936]
    - [65, 11735.6]
  - - [1024, 1024, 1, 5120]
    - [63, 10362.7]
  - - [4096, 1024, 1, 9880]
    - [83, 11150.5]
  - - [1024, 1024, 1, 9568]
    - [77, 10176.8]
  - - [1024, 33712, 1, 8704]
    - [76, 11730.0]
  - - [1024, 1024, 1, 8192]
    - [83, 10281.9]
  - - [1024, 1024, 1, 9200]
    - [86, 10330.3]
  - - [1024, 1024, 1, 9248]
    - [63, 9707.3]
  - - [1024, 1024, 1, 9840]
    - [63, 9709.01]
  - - [1024, 1024, 1, 9936]
    - [63, 9709.44]
  - - [1024, 1024, 1, 9176]
    - [73, 10397.8]
  - - [1024, 1024, 1, 9976]
    - [63, 10207.4]
  - - [1024, 33712, 1, 8976]
    - [76, 11669.3]
  - - [4096, 1024, 1, 8192]
    - [75, 11954.3]
  - - [1024, 1024, 1, 9984]
    - [63, 10422.3]
  - - [1024, 4096, 1, 6720]
    - [69, 11289.1]
  - - [1024, 1024, 1, 7936]
    - [63, 10412.3]
  - - [1024, 1024, 1, 1584]
    - [63, 10117.8]
  - - [1024, 33712, 1, 5984]
    - [75, 12196.2]
  - - [4096, 1024, 1, 6960]
    - [65, 11853.7]
  - - [4096, 1024, 1, 6272]
    - [66, 11224.5]
  - - [1024, 4096, 1, 6816]
    - [81, 11264.1]
  - - [1024, 4096, 1, 10160]
    - [96, 11244.7]
  - - [4096, 1024, 1, 4080]
    - [62, 11870.6]
  - - [1024, 1024, 1, 8784]
    - [63, 9705.24]
  - - [1024, 1024, 1, 8840]
    - [63, 9703.32]
  - - [1024, 33712, 1, 9728]
    - [69, 11414.6]
  - - [1024, 1024, 1, 8000]
    - [73, 10372.7]
  - - [1024, 4096, 1, 9400]
    - [70, 11287.9]
  - - [1024, 4096, 1, 8928]
    - [62, 11391.1]
  - - [1024, 4096, 1, 10208]
    - [62, 11398.0]
  - - [4096, 1024, 1, 6768]
    - [62, 11880.2]
  - - [1024, 1024, 1, 10208]
    - [90, 10380.0]
  - - [1024, 4096, 1, 3344]
    - [66, 10597.9]
  - - [1024, 1024, 1, 9072]
    - [73, 10371.4]
  - - [1024, 1024, 1, 7560]
    - [86, 10312.2]
  - - [4096, 1024, 1, 8880]
    - [64, 10897.8]
  - - [4096, 1024, 1, 8208]
    - [65, 11118.9]
  - - [1024, 1024, 1, 7776]
    - [63, 10067.3]
  - - [4096, 1024, 1, 7776]
    - [92, 11157.5]
  - - [1024, 1024, 1, 2592]
    - [79, 9535.17]
  - - [4096, 1024, 1, 6032]
    - [65, 11102.7]
  - - [1024, 1024, 1, 7520]
    - [63, 9692.78]
  - - [4096, 1024, 1, 3000]
    - [63, 10930.2]
  - - [1024, 4096, 1, 9656]
    - [76, 11071.9]
  - - [4096, 1024, 1, 8976]
    - [80, 11520.2]
  - - [1024, 4096, 1, 8280]
    - [70, 11314.4]
  - - [4096, 1024, 1, 8000]
    - [92, 11187.2]
  - - [1024, 33712, 1, 7560]
    - [70, 12047.5]
  - - [1024, 1024, 1, 8448]
    - [86, 10224.3]
  - - [4096, 1024, 1, 5680]
    - [73, 10801.4]
  - - [4096, 1024, 1, 9400]
    - [83, 11020.3]
  - - [1024, 1024, 1, 7144]
    - [77, 10209.1]
  - - [4096, 1024, 1, 10064]
    - [96, 10843.9]
  - - [4096, 1024, 1, 7560]
    - [92, 11421.5]
  - - [1024, 4096, 1, 8736]
    - [70, 11308.8]
  - - [4096, 1024, 1, 8496]
    - [62, 11687.5]
  - - [1024, 1024, 1, 10120]
    - [73, 10394.5]
  - - [4096, 1024, 1, 10040]
    - [96, 11152.0]
  - - [1024, 1024, 1, 8928]
    - [63, 9707.24]
  - - [1024, 1024, 1, 10064]
    - [63, 9711.44]
  - - [1024, 33712, 1, 10040]
    - [76, 11338.5]
  - - [1024, 4096, 1, 8448]
    - [65, 11897.7]
  - - [4096, 1024, 1, 9568]
    - [83, 11249.7]
  - - [4096, 1024, 1, 10208]
    - [96, 11331.4]
  - - [4096, 1024, 1, 7752]
    - [68, 10925.2]
  - - [1024, 4096, 1, 10240]
    - [101, 11263.9]
  - - [1024, 4096, 1, 4704]
    - [62, 11342.7]
  - - [1024, 1024, 1, 1344]
    - [107, 9907.8]
  - - [4096, 1024, 1, 3696]
    - [62, 11116.1]
  - - [1024, 33712, 1, 6496]
    - [87, 12407.1]
  - - [1024, 33712, 1, 10120]
    - [69, 11219.3]
  - - [1024, 1024, 1, 2720]
    - [63, 10268.3]
  - - [1024, 1024, 1, 8704]
    - [63, 10409.2]
  - - [4096, 1024, 1, 7800]
    - [108, 11124.1]
  - - [1024, 33712, 1, 4536]
    - [70, 12068.9]
  - - [1024, 4096, 1, 6360]
    - [82, 11087.9]
  - - [4096, 1024, 1, 8200]
    - [65, 11118.1]
  - - [1024, 1024, 1, 6656]
    - [73, 10334.2]
  - - [1024, 4096, 1, 8640]
    - [64, 11461.3]
  - - [1024, 33712, 1, 10192]
    - [78, 11151.0]
  - - [1024, 33712, 1, 10160]
    - [69, 11481.3]
  - - [4096, 1024, 1, 9504]
    - [75, 11966.4]
  - - [1024, 1024, 1, 6512]
    - [73, 10358.5]
  - - [4096, 1024, 1, 10224]
    - [96, 11342.6]
  - - [1024, 4096, 1, 9328]
    - [78, 11169.2]
  - - [4096, 1024, 1, 9024]
    - [62, 11337.8]
  - - [4096, 1024, 1, 9728]
    - [83, 11163.2]
  - - [1024, 4096, 1, 3584]
    - [71, 11201.4]
  - - [1024, 4096, 1, 9728]
    - [83, 11551.9]
  - - [1024, 4096, 1, 7424]
    - [69, 11435.8]
  - - [4096, 1024, 1, 10192]
    - [96, 11142.8]
  - - [1024, 33712, 1, 4920]
    - [70, 12086.5]
  - - [1024, 33712, 1, 9296]
    - [76, 11584.7]
  - - [1024, 1024, 1, 10184]
    - [61, 10037.1]
  - - [4096, 1024, 1, 8664]
    - [86, 10829.5]
  - - [1024, 4096, 1, 9696]
    - [63, 11502.4]
  - - [1024, 1024, 1, 2912]
    - [77, 10124.1]
  - - [4096, 1024, 1, 8448]
    - [99, 11174.1]
  - - [1024, 4096, 1, 9016]
    - [62, 11711.1]
  - - [4096, 1024, 1, 6936]
    - [62, 11888.9]
  - - [4096, 1024, 1, 8280]
    - [86, 11227.7]
  - - [4096, 1024, 1, 8008]
    - [80, 11299.6]
  - - [1024, 4096, 1, 7072]
    - [68, 11415.1]
  - - [4096, 1024, 1, 8024]
    - [92, 11222.5]
  - - [1024, 1024, 1, 9720]
    - [67, 9819.01]
  - - [1024, 33712, 1, 10240]
    - [76, 11247.8]
  - - [1024, 1024, 1, 7072]
    - [61, 10027.5]
  - - [1024, 33712, 1, 8160]
    - [70, 11855.3]
  - - [1024, 1024, 1, 7504]
    - [60, 10017.9]
  - - [1024, 33712, 1, 9984]
    - [76, 11301.0]
  - - [1024, 1024, 1, 5800]
    - [63, 10375.5]
  - - [1024, 4096, 1, 8192]
    - [78, 11443.1]
  - - [1024, 1024, 1, 6480]
    - [73, 10354.1]
  - - [1024, 1024, 1, 9600]
    - [63, 9707.51]
  - - [1024, 1024, 1, 7872]
    - [63, 9695.51]
  - - [1024, 4096, 1, 8296]
    - [78, 11389.4]
  - - [1024, 4096, 1, 7440]
    - [69, 11337.6]
  - - [1024, 1024, 1, 4640]
    - [63, 10350.1]
  - - [4096, 1024, 1, 7896]
    - [92, 11106.3]
  - - [1024, 33712, 1, 9568]
    - [69, 11432.7]
  - - [1024, 1024, 1, 8280]
    - [61, 10019.1]
  - - [1024, 4096, 1, 4640]
    - [96, 10888.9]
  - - [4096, 1024, 1, 9000]
    - [62, 11124.3]
  - - [1024, 33712, 1, 10208]
    - [78, 11217.2]
  - - [1024, 33712, 1, 6720]
    - [62, 12708.1]
  - - [4096, 1024, 1, 9792]
    - [65, 11931.9]
  - - [4096, 1024, 1, 5936]
    - [62, 11007.2]
  - - [1024, 1024, 1, 9856]
    - [73, 10278.0]
  - - [4096, 1024, 1, 9856]
    - [80, 11285.7]
  - - [4096, 1024, 1, 9760]
    - [64, 10891.0]
  - - [1024, 4096, 1, 9880]
    - [101, 10898.3]
  - - [1024, 4096, 1, 7448]
    - [92, 11515.4]
  - - [1024, 1024, 1, 9504]
    - [67, 9827.27]
  - - [1024, 4096, 1, 7360]
    - [69, 11400.9]
  - - [1024, 1024, 1, 5440]
    - [75, 9797.06]
  - - [1024, 1024, 1, 6720]
    - [63, 9686.59]
  - - [4096, 1024, 1, 7904]
    - [95, 11032.9]
  - - [1024, 4096, 1, 6960]
    - [69, 11337.0]
  - - [1024, 4096, 1, 9464]
    - [70, 11167.0]
  - - [1024, 1024, 1, 9960]
    - [65, 9770.77]
  - - [4096, 1024, 1, 9312]
    - [83, 11098.8]
  - - [1024, 4096, 1, 10192]
    - [83, 11164.7]
  - - [1024, 4096, 1, 4864]
    - [65, 11874.3]
  - - [4096, 1024, 1, 9464]
    - [62, 11445.7]
  - - [4096, 1024, 1, 4480]
    - [65, 11082.9]
  - - [1024, 33712, 1, 10200]
    - [76, 11264.5]
  - - [1024, 1024, 1, 8096]
    - [61, 10021.3]
  - - [1024, 4096, 1, 10200]
    - [83, 11198.7]
  - - [1024, 1024, 1, 4368]
    - [63, 10353.0]
  - - [1024, 4096, 1, 8008]
    - [69, 11440.3]
  - - [1024, 4096, 1, 6048]
    - [65, 11103.7]
  - - [1024, 1024, 1, 10200]
    - [65, 9777.17]
  - - [1024, 1024, 1, 9760]
    - [86, 9905.99]
  - - [1024, 4096, 1, 8200]
    - [78, 11400.2]
  - - [1024, 33712, 1, 10112]
    - [78, 11240.2]
  - - [4096, 1024, 1, 9928]
    - [65, 11940.8]
  - - [1024, 4096, 1, 9776]
    - [70, 11307.2]
  - - [1024, 1024, 1, 8424]
    - [65, 9757.4]
  - - [4096, 1024, 1, 8800]
    - [83, 10975.4]
  - - [4096, 1024, 1, 8160]
    - [62, 11457.7]
  - - [1024, 33712, 1, 8192]
    - [70, 11866.8]
  - - [1024, 4096, 1, 2112]
    - [65, 11864.3]
  - - [1024, 4096, 1, 3024]
    - [70, 11245.1]
  - - [4096, 1024, 1, 10168]
    - [62, 11544.6]
  - - [1024, 33712, 1, 9912]
    - [76, 11362.1]
  - - [1024, 33712, 1, 7168]
    - [62, 12633.8]
  - - [1024, 1024, 1, 8880]
    - [61, 10030.3]
  - - [1024, 1024, 1, 10240]
    - [63, 10424.6]
  - - [1024, 4096, 1, 9744]
    - [83, 11030.2]
  - - [1024, 4096, 1, 8784]
    - [62, 11418.3]
  - - [4096, 1024, 1, 6880]
    - [62, 11557.1]
  - - [1024, 33712, 1, 9400]
    - [78, 11435.8]
  - - [1024, 33712, 1, 8904]
    - [62, 12058.2]
  - - [4096, 1024, 1, 8944]
    - [65, 11935.5]
  - - [1024, 1024, 1, 9440]
    - [86, 10330.8]
  - - [4096, 1024, 1, 4640]
    - [73, 11467.4]
  - - [1024, 4096, 1, 10112]
    - [70, 11120.5]
  - - [1024, 33712, 1, 8832]
    - [76, 11626.9]
  - - [4096, 1024, 1, 7488]
    - [75, 11951.2]
  - - [4096, 1024, 1, 8584]
    - [62, 11118.3]
  - - [1024, 4096, 1, 8584]
    - [62, 11495.2]
  - - [1024, 4096, 1, 5832]
    - [62, 11699.0]
  - - [4096, 1024, 1, 8424]
    - [62, 11562.4]
  - - [1024, 33712, 1, 4896]
    - [70, 12118.1]
  - - [1024, 4096, 1, 10184]
    - [102, 11061.4]
  - - [1024, 1024, 1, 2040]
    - [61, 9833.99]
  - - [1024, 1024, 1, 7424]
    - [62, 9734.65]
  - - [1024, 1024, 1, 10032]
    - [63, 9711.3]
  - - [1024, 1024, 1, 8736]
    - [63, 9702.92]
  - - [1024, 4096, 1, 7560]
    - [69, 11464.1]
  - - [1024, 4096, 1, 8960]
    - [70, 11313.0]
  - - [4096, 1024, 1, 8288]
    - [62, 11363.5]
  - - [1024, 33712, 1, 8008]
    - [70, 11909.9]
  - - [4096, 1024, 1, 800]
    - [61, 11818.2]
  - - [1024, 1024, 1, 5680]
    - [63, 9668.66]
  - - [4096, 1024, 1, 6912]
    - [66, 10849.3]
  - - [1024, 1024, 1, 7400]
    - [63, 9692.51]
  - - [1024, 33712, 1, 8208]
    - [70, 11877.0]
  - - [1024, 33712, 1, 4048]
    - [62, 12973.7]
  - - [4096, 1024, 1, 7424]
    - [92, 11418.1]
  - - [4096, 1024, 1, 2392]
    - [70, 11304.2]
  - - [1024, 1024, 1, 7040]
    - [63, 10392.4]
  - - [4096, 1024, 1, 2112]
    - [102, 11408.3]
  - - [1024, 4096, 1, 9600]
    - [83, 10969.5]
  - - [1024, 33712, 1, 5472]
    - [70, 12109.6]
  - - [1024, 1024, 1, 4920]
    - [63, 9650.89]
  - - [1024, 1024, 1, 9576]
    - [63, 9705.71]
  - - [4096, 1024, 1, 8592]
    - [68, 10778.0]
  - - [4096, 1024, 1, 9920]
    - [62, 11510.8]
  - - [1024, 4096, 1, 6160]
    - [71, 11185.9]
  - - [1024, 33712, 1, 8016]
    - [70, 11905.7]
  - - [1024, 4096, 1, 9920]
    - [65, 11854.8]
  - - [4096, 1024, 1, 7440]
    - [62, 11760.4]
  - - [4096, 1024, 1, 6560]
    - [66, 11443.0]
  - - [1024, 1024, 1, 9656]
    - [63, 9704.99]
  - - [1024, 4096, 1, 8184]
    - [78, 11444.8]
  - - [1024, 33712, 1, 9768]
    - [76, 11453.3]
  - - [1024, 4096, 1, 9768]
    - [65, 11817.8]
  - - [1024, 33712, 1, 9112]
    - [76, 11636.7]
  - - [1024, 4096, 1, 6784]
    - [65, 11897.9]
  - - [1024, 1024, 1, 8160]
    - [63, 9956.66]
  - - [1024, 4096, 1, 8840]
    - [70, 11300.0]
  - - [1024, 4096, 1, 3040]
    - [65, 11895.1]
  - - [4096, 1024, 1, 8296]
    - [65, 11119.2]
  - - [1024, 33712, 1, 9752]
    - [76, 11303.9]
  - - [1024, 4096, 1, 8160]
    - [65, 11859.8]
  - - [4096, 1024, 1, 9776]
    - [102, 11154.1]
  - - [4096, 1024, 1, 9328]
    - [62, 11127.8]
  - - [1024, 33712, 1, 5280]
    - [70, 12101.0]
  - - [4096, 1024, 1, 8640]
    - [75, 11153.4]
  - - [4096, 1024, 1, 7936]
    - [62, 11591.1]
  - - [4096, 1024, 1, 8520]
    - [65, 11123.6]
  - - [1024, 4096, 1, 7392]
    - [62, 11807.0]
  - - [4096, 1024, 1, 6360]
    - [62, 11759.7]
  - - [4096, 1024, 1, 7040]
    - [66, 11085.0]
  - - [4096, 1024, 1, 5504]
    - [65, 11098.3]
  - - [1024, 33712, 1, 9168]
    - [76, 11692.7]
  - - [4096, 1024, 1, 8704]
    - [75, 11961.7]
  - - [1024, 33712, 1, 8736]
    - [76, 11724.8]
  - - [1024, 33712, 1, 9600]
    - [76, 11442.7]
  - - [4096, 1024, 1, 8544]
    - [75, 11962.6]
  - - [4096, 1024, 1, 9344]
    - [62, 11575.1]
  - - [1024, 4096, 1, 5472]
    - [105, 10994.5]
  - - [1024, 1024, 1, 9360]
    - [77, 10089.1]
  - - [4096, 1024, 1, 9176]
    - [83, 11129.5]
  - - [1024, 4096, 1, 6440]
    - [68, 11301.4]
  - - [1024, 4096, 1, 8424]
    - [86, 11491.4]
  - - [4096, 1024, 1, 6888]
    - [65, 11112.0]
  - - [4096, 1024, 1, 5280]
    - [65, 11057.4]
  - - [1024, 1024, 1, 9240]
    - [63, 9701.23]
  - - [4096, 1024, 1, 8432]
    - [68, 10860.0]
  - - [1024, 4096, 1, 9632]
    - [83, 11371.9]
  - - [1024, 33712, 1, 9520]
    - [69, 11492.5]
  - - [1024, 33712, 1, 8760]
    - [62, 12073.1]
  - - [1024, 1024, 1, 4896]
    - [63, 10367.1]
  - - [1024, 33712, 1, 9360]
    - [78, 11425.1]
  - - [1024, 4096, 1, 7920]
    - [65, 11907.4]
  - - [1024, 4096, 1, 5640]
    - [62, 11606.4]
  - - [1024, 4096, 1, 9408]
    - [83, 11385.9]
  - - [1024, 33712, 1, 7920]
    - [70, 11918.0]
  - - [4096, 1024, 1, 9472]
    - [65, 11930.4]
  - - [4096, 1024, 1, 9184]
    - [62, 11117.4]
  - - [1024, 4096, 1, 9312]
    - [69, 11205.1]
  - - [1024, 1024, 1, 6688]
    - [67, 9808.74]
  - - [1024, 1024, 1, 9216]
    - [63, 9700.9]
  - - [1024, 33712, 1, 9216]
    - [76, 11615.2]
  - - [4096, 1024, 1, 9216]
    - [65, 11934.8]
  - - [1024, 4096, 1, 9216]
    - [78, 11085.2]
  - - [1024, 1024, 1, 5824]
    - [67, 9799.24]
  - - [4096, 1024, 1, 9840]
    - [81, 11262.7]
  - - [4096, 1024, 1, 5824]
    - [62, 11095.8]
  - - [1024, 1024, 1, 8400]
    - [73, 10366.3]
  - - [4096, 1024, 1, 5600]
    - [109, 10742.0]
  - - [1024, 1024, 1, 5456]
    - [63, 9667.8]
  - - [1024, 4096, 1, 8128]
    - [70, 11237.0]
  - - [4096, 1024, 1, 5104]
    - [62, 11082.4]
  - - [1024, 1024, 1, 7208]
    - [63, 9693.86]
  - - [1024, 4096, 1, 6384]
    - [66, 11252.1]
  - - [1024, 4096, 1, 5104]
    - [62, 11414.7]
  - - [1024, 4096, 1, 7776]
    - [78, 11295.4]
  - - [4096, 1024, 1, 5920]
    - [62, 11449.7]
  - - [1024, 1024, 1, 8600]
    - [77, 10069.8]
  - - [1024, 4096, 1, 8600]
    - [83, 11511.3]
  - - [1024, 33712, 1, 8648]
    - [70, 11666.5]
  - - [1024, 4096, 1, 5400]
    - [65, 11893.1]
  - - [1024, 1024, 1, 5400]
    - [63, 10367.5]
  - - [1024, 33712, 1, 9472]
    - [76, 11501.1]
  - - [4096, 1024, 1, 4352]
    - [75, 11896.2]
  - - [4096, 1024, 1, 5456]
    - [75, 11034.6]
  - - [1024, 1024, 1, 8520]
    - [63, 9698.89]
  - - [1024, 4096, 1, 8520]
    - [78, 11344.0]
  - - [1024, 33712, 1, 8784]
    - [70, 11663.6]
  - - [1024, 4096, 1, 6656]
    - [65, 11901.1]
  - - [1024, 4096, 1, 7656]
    - [92, 11338.8]
  - - [4096, 1024, 1, 6688]
    - [65, 11110.7]
  - - [1024, 1024, 1, 9768]
    - [63, 10340.1]
  - - [4096, 1024, 1, 5840]
    - [68, 11184.0]
  - - [1024, 1024, 1, 5104]
    - [63, 10359.1]
  - - [1024, 1024, 1, 2392]
    - [72, 10225.8]
  - - [1024, 4096, 1, 2392]
    - [81, 11082.5]
  - - [1024, 1024, 1, 3584]
    - [63, 9610.49]
  - - [4096, 1024, 1, 5200]
    - [83, 10734.7]
  - - [1024, 33712, 1, 9800]
    - [84, 11507.1]
  - - [4096, 1024, 1, 3584]
    - [61, 11943.3]
  - - [1024, 4096, 1, 8360]
    - [70, 11288.9]
  - - [1024, 33712, 1, 7968]
    - [70, 11844.9]
  - - [1024, 1024, 1, 7968]
    - [61, 10031.5]
  - - [1024, 4096, 1, 9640]
    - [70, 11270.7]
  - - [4096, 1024, 1, 5328]
    - [62, 11864.1]
  - - [1024, 1024, 1, 3696]
    - [86, 10222.4]
  - - [1024, 4096, 1, 5304]
    - [110, 11060.9]
  - - [1024, 4096, 1, 3696]
    - [62, 11746.2]
  - - [4096, 1024, 1, 8680]
    - [62, 11119.9]
  - - [1024, 33712, 1, 8400]
    - [70, 11825.1]
  - - [4096, 1024, 1, 3240]
    - [67, 11920.6]
  - - [1024, 33712, 1, 8520]
    - [76, 11793.8]
  - - [1024, 33712, 1, 6976]
    - [62, 12523.1]
  - - [1024, 33712, 1, 9576]
    - [98, 11401.4]
  - - [4096, 1024, 1, 3072]
    - [60, 12055.5]
  - - [1024, 1024, 1, 3072]
    - [63, 9593.8]
  - - [1024, 1024, 1, 5760]
    - [86, 10294.1]
  - - [4096, 1024, 1, 9040]
    - [99, 11839.4]
  - - [1024, 1024, 1, 2304]
    - [86, 10113.5]
  - - [4096, 1024, 1, 2304]
    - [62, 11876.5]
  - - [1024, 4096, 1, 2304]
    - [66, 10555.4]
  - - [1024, 1024, 1, 2880]
    - [86, 10180.3]
  - - [4096, 1024, 1, 3400]
    - [111, 11451.7]
  - - [1024, 4096, 1, 7744]
    - [92, 11362.6]
  - - [1024, 1024, 1, 9328]
    - [67, 9826.68]
  - - [1024, 33712, 1, 9880]
    - [76, 11415.2]
  - - [1024, 1024, 1, 9088]
    - [60, 10035.2]
  - - [4096, 1024, 1, 6384]
    - [66, 11402.0]
  - - [1024, 33712, 1, 9640]
    - [78, 11427.5]
  - - [4096, 1024, 1, 9640]
    - [75, 11965.8]
  - - [1024, 1024, 1, 6120]
    - [63, 9671.55]
  - - [4096, 1024, 1, 6120]
    - [68, 10900.4]
  - - [1024, 4096, 1, 6120]
    - [71, 10869.7]
  - - [4096, 1024, 1, 5016]
    - [62, 11516.6]
  - - [1024, 33712, 1, 9720]
    - [76, 11448.3]
  - - [4096, 1024, 1, 9720]
    - [65, 11939.9]
  - - [4096, 1024, 1, 9744]
    - [83, 11165.7]
  - - [1024, 33712, 1, 5840]
    - [61, 12269.0]
  - - [1024, 33712, 1, 8624]
    - [70, 11750.6]
  - - [4096, 1024, 1, 7504]
    - [75, 11954.2]
  - - [1024, 4096, 1, 7176]
    - [68, 11363.0]
  - - [1024, 4096, 1, 4608]
    - [65, 11484.1]
  - - [4096, 1024, 1, 8624]
    - [65, 11122.9]
  - - [1024, 4096, 1, 8624]
    - [78, 11452.5]
  - - [1024, 1024, 1, 8624]
    - [63, 10415.2]
  - - [1024, 1024, 1, 4216]
    - [63, 9635.54]
  - - [1024, 1024, 1, 6128]
    - [73, 10347.9]
  - - [1024, 33712, 1, 8120]
    - [76, 12089.8]
  - - [4096, 1024, 1, 4392]
    - [62, 11911.2]
  - - [1024, 4096, 1, 9176]
    - [78, 11132.4]
  - - [1024, 33712, 1, 8352]
    - [70, 11847.8]
  - - [1024, 33712, 1, 6336]
    - [62, 12660.8]
  - - [1024, 4096, 1, 6032]
    - [65, 11904.7]
  - - [1024, 4096, 1, 7640]
    - [69, 11477.5]
  - - [4096, 1024, 1, 6336]
    - [65, 11114.0]
  - - [4096, 1024, 1, 1224]
    - [66, 11207.2]
  - - [1024, 1024, 1, 10168]
    - [77, 10263.7]
  - - [1024, 4096, 1, 6336]
    - [71, 11277.8]
  - - [1024, 4096, 1, 8944]
    - [62, 11492.1]
  - - [1024, 1024, 1, 6336]
    - [86, 10307.4]
  - - [4096, 1024, 1, 9680]
    - [86, 10830.1]
  - - [1024, 1024, 1, 9648]
    - [63, 9711.1]
  - - [4096, 1024, 1, 9648]
    - [83, 11025.8]
  - - [1024, 4096, 1, 9648]
    - [83, 11429.9]
  - - [1024, 33712, 1, 9680]
    - [76, 11473.7]
  - - [1024, 4096, 1, 2880]
    - [65, 11899.6]
  - - [1024, 4096, 1, 7040]
    - [68, 11426.8]
  - - [1024, 4096, 1, 5440]
    - [83, 11339.5]
  - - [1024, 33712, 1, 9464]
    - [78, 11477.7]
  - - [1024, 1024, 1, 3040]
    - [63, 10282.8]
  - - [4096, 1024, 1, 8712]
    - [99, 11176.7]
  - - [4096, 1024, 1, 7200]
    - [62, 11561.2]
  - - [1024, 33712, 1, 10184]
    - [76, 11344.9]
  - - [1024, 1024, 1, 8040]
    - [63, 10406.0]
  - - [1024, 4096, 1, 8040]
    - [69, 11402.2]
  - - [1024, 33712, 1, 9864]
    - [78, 11291.1]
  - - [1024, 33712, 1, 9176]
    - [62, 11975.0]
  - - [1024, 1024, 1, 4864]
    - [61, 9980.16]
  - - [1024, 1024, 1, 6032]
    - [86, 10290.6]
  - - [1024, 33712, 1, 9152]
    - [76, 11553.6]
  - - [1024, 33712, 1, 8840]
    - [62, 11995.0]
  - - [1024, 1024, 1, 9928]
    - [60, 10016.8]
  - - [1024, 33712, 1, 4800]
    - [70, 12074.5]
  - - [4096, 1024, 1, 10176]
    - [76, 11088.3]
  - - [4096, 1024, 1, 4800]
    - [95, 10992.8]
  - - [1024, 1024, 1, 4800]
    - [63, 10363.1]
  - - [1024, 33712, 1, 8816]
    - [76, 11757.4]
  - - [4096, 1024, 1, 7680]
    - [75, 11957.0]
  - - [1024, 4096, 1, 9720]
    - [83, 11386.8]
  - - [1024, 1024, 1, 6784]
    - [67, 9822.05]
  - - [4096, 1024, 1, 6784]
    - [112, 11011.6]
  - - [1024, 1024, 1, 7728]
    - [61, 9346.88]
  - - [1024, 1024, 1, 5888]
    - [63, 9667.41]
  - - [1024, 4096, 1, 7728]
    - [92, 11467.5]
  - - [4096, 1024, 1, 4536]
    - [85, 11118.6]
  - - [1024, 33712, 1, 7056]
    - [70, 12060.3]
  - - [4096, 1024, 1, 7056]
    - [75, 11936.1]
  - - [1024, 4096, 1, 8112]
    - [78, 11126.0]
  - - [4096, 1024, 1, 7176]
    - [65, 11113.2]
  - - [1024, 4096, 1, 9200]
    - [83, 11394.3]
  - - [1024, 1024, 1, 7056]
    - [77, 10212.5]
  - - [4096, 1024, 1, 9968]
    - [64, 10944.7]
  - - [1024, 4096, 1, 9968]
    - [101, 11133.3]
  - - [1024, 33712, 1, 7616]
    - [70, 11952.2]
  - - [1024, 1024, 1, 9280]
    - [61, 10036.7]
  - - [4096, 1024, 1, 9280]
    - [86, 11021.9]
  - - [1024, 4096, 1, 9280]
    - [83, 11391.4]
  - - [1024, 1024, 1, 7344]
    - [75, 9811.33]
  - - [1024, 4096, 1, 7968]
    - [69, 11357.5]
  - - [4096, 1024, 1, 7344]
    - [65, 11115.4]
  - - [1024, 4096, 1, 7344]
    - [69, 11344.9]
  - - [1024, 4096, 1, 8816]
    - [62, 11420.5]
  - - [1024, 4096, 1, 7144]
    - [68, 11382.1]
  - - [1024, 4096, 1, 5016]
    - [65, 11276.1]
  - - [4096, 1024, 1, 8760]
    - [62, 11126.9]
  - - [4096, 1024, 1, 7400]
    - [62, 11796.0]
  - - [4096, 1024, 1, 9120]
    - [83, 11000.8]
  - - [1024, 1024, 1, 8800]
    - [63, 9704.92]
  - - [1024, 1024, 1, 7488]
    - [77, 9885.82]
  - - [1024, 4096, 1, 7488]
    - [68, 11481.8]
  - - [1024, 33712, 1, 4368]
    - [70, 11989.6]
  - - [1024, 33712, 1, 5568]
    - [70, 12092.8]
  - - [4096, 1024, 1, 9072]
    - [75, 11155.7]
  - - [1024, 33712, 1, 9840]
    - [69, 11264.3]
  - - [1024, 4096, 1, 5568]
    - [65, 11896.3]
  - - [1024, 1024, 1, 5568]
    - [73, 10346.0]
  - - [1024, 33712, 1, 7520]
    - [70, 12008.9]
  - - [4096, 1024, 1, 7520]
    - [65, 11915.2]
  - - [1024, 1024, 1, 6000]
    - [60, 9992.75]
  - - [1024, 33712, 1, 6864]
    - [70, 12067.3]
  - - [1024, 1024, 1, 6768]
    - [61, 10012.3]
  - - [1024, 4096, 1, 6768]
    - [68, 11253.2]
  - - [4096, 1024, 1, 6240]
    - [65, 11107.7]
  - - [1024, 1024, 1, 10040]
    - [63, 9706.86]
  - - [4096, 1024, 1, 10000]
    - [81, 11009.6]
  - - [1024, 1024, 1, 7480]
    - [63, 10402.3]
  - - [1024, 1024, 1, 7680]
    - [90, 10357.3]
  - - [1024, 4096, 1, 7680]
    - [68, 11418.2]
  - - [4096, 1024, 1, 9144]
    - [65, 11126.2]
  - - [1024, 1024, 1, 7440]
    - [63, 9691.64]
  - - [4096, 1024, 1, 4472]
    - [86, 10731.9]
  - - [1024, 33712, 1, 6032]
    - [70, 12095.7]
  - - [4096, 1024, 1, 9296]
    - [67, 11600.1]
  - - [1024, 4096, 1, 9296]
    - [86, 11118.7]
  - - [4096, 1024, 1, 5472]
    - [62, 11863.3]
  - - [4096, 1024, 1, 5776]
    - [86, 10794.5]
  - - [1024, 1024, 1, 4600]
    - [86, 10257.4]
  - - [4096, 1024, 1, 9512]
    - [94, 11039.8]
  - - [1024, 33712, 1, 9928]
    - [76, 11209.1]
  - - [1024, 33712, 1, 10032]
    - [62, 11472.3]
  - - [1024, 1024, 1, 7632]
    - [61, 10028.5]
  - - [4096, 1024, 1, 4896]
    - [86, 10781.2]
  - - [1024, 4096, 1, 4896]
    - [110, 10915.1]
  - - [1024, 4096, 1, 8120]
    - [69, 11395.4]
  - - [4096, 1024, 1, 8128]
    - [65, 11120.3]
  - - [1024, 1024, 1, 8128]
    - [63, 10410.9]
  - - [4096, 1024, 1, 6128]
    - [66, 11208.6]
  - - [1024, 4096, 1, 6128]
    - [63, 10975.4]
  - - [1024, 4096, 1, 7400]
    - [92, 11532.4]
  - - [4096, 1024, 1, 5632]
    - [113, 11277.5]
  - - [1024, 1024, 1, 7224]
    - [63, 9685.57]
  - - [1024, 4096, 1, 5632]
    - [110, 10990.0]
  - - [4096, 1024, 1, 4560]
    - [65, 11542.8]
  - - [1024, 1024, 1, 9800]
    - [86, 10340.5]
  - - [1024, 1024, 1, 7568]
    - [63, 10157.2]
  - - [4096, 1024, 1, 7568]
    - [92, 11214.8]
  - - [1024, 4096, 1, 7568]
    - [69, 11439.2]
  - - [1024, 33712, 1, 6912]
    - [70, 12056.7]
  - - [1024, 33712, 1, 7992]
    - [62, 11898.2]
  - - [4096, 1024, 1, 7992]
    - [65, 11926.7]
  - - [1024, 33712, 1, 9288]
    - [70, 11443.7]
  - - [1024, 4096, 1, 7992]
    - [65, 11896.9]
  - - [1024, 1024, 1, 7992]
    - [67, 9786.29]
  - - [1024, 1024, 1, 8576]
    - [77, 10248.6]
  - - [1024, 33712, 1, 4160]
    - [78, 11976.9]
  - - [1024, 1024, 1, 5936]
    - [77, 10060.0]
  - - [4096, 1024, 1, 7384]
    - [66, 11037.6]
  - - [4096, 1024, 1, 6440]
    - [66, 11299.9]
  - - [1024, 4096, 1, 7384]
    - [69, 11323.0]
  - - [4096, 1024, 1, 2040]
    - [61, 11192.4]
  - - [1024, 33712, 1, 7344]
    - [70, 12025.8]
  - - [4096, 1024, 1, 8616]
    - [65, 11929.6]
  - - [1024, 4096, 1, 5784]
    - [62, 11752.4]
  - - [1024, 1024, 1, 5776]
    - [75, 9804.06]
  - - [1024, 4096, 1, 5776]
    - [71, 11209.6]
  - - [1024, 4096, 1, 6664]
    - [62, 11508.8]
  - - [1024, 4096, 1, 9112]
    - [70, 11198.0]
  - - [4096, 1024, 1, 8016]
    - [65, 11119.7]
  - - [1024, 4096, 1, 8016]
    - [78, 11352.1]
  - - [1024, 1024, 1, 7920]
    - [67, 9816.43]
  - - [1024, 1024, 1, 912]
    - [72, 9879.15]
  - - [1024, 33712, 1, 6968]
    - [95, 12098.7]
  - - [1024, 1024, 1, 6240]
    - [77, 10062.6]
  - - [1024, 4096, 1, 8000]
    - [78, 11419.2]
  - - [4096, 1024, 1, 7696]
    - [92, 11403.2]
  - - [1024, 1024, 1, 6696]
    - [90, 9692.5]
  - - [4096, 1024, 1, 5040]
    - [114, 10703.2]
  - - [1024, 33712, 1, 8712]
    - [69, 11616.7]
  - - [1024, 1024, 1, 5040]
    - [63, 10370.5]
  - - [4096, 1024, 1, 7144]
    - [70, 11084.0]
  - - [4096, 1024, 1, 8360]
    - [65, 11124.7]
  - - [1024, 1024, 1, 8360]
    - [65, 9760.9]
  - - [1024, 33712, 1, 7176]
    - [70, 12065.2]
  - - [1024, 1024, 1, 7176]
    - [61, 10014.6]
  - - [1024, 33712, 1, 7488]
    - [70, 12021.2]
  - - [1024, 4096, 1, 5576]
    - [65, 11899.8]
  - - [4096, 1024, 1, 2880]
    - [65, 11741.4]
  - - [4096, 1024, 1, 8184]
    - [68, 11376.2]
  - - [1024, 33712, 1, 9328]
    - [76, 11561.8]
  - - [4096, 1024, 1, 7072]
    - [75, 11943.5]
  - - [4096, 1024, 1, 10184]
    - [96, 11404.4]
  - - [1024, 33712, 1, 9120]
    - [76, 11667.2]
  - - [4096, 1024, 1, 7688]
    - [75, 11946.7]
  - - [1024, 33712, 1, 4352]
    - [70, 12116.1]
  - - [1024, 33712, 1, 5120]
    - [70, 12098.5]
  - - [1024, 4096, 1, 4352]
    - [61, 11118.3]
  - - [1024, 1024, 1, 4352]
    - [63, 9638.79]
  - - [4096, 1024, 1, 6000]
    - [105, 10997.9]
  - - [1024, 4096, 1, 9680]
    - [83, 11334.1]
  - - [1024, 1024, 1, 9680]
    - [77, 9949.6]
  - - [1024, 1024, 1, 10112]
    - [86, 10261.7]
  - - [1024, 33712, 1, 9312]
    - [76, 11559.2]
  - - [4096, 1024, 1, 5880]
    - [65, 11901.8]
  - - [1024, 4096, 1, 5880]
    - [71, 11274.6]
  - - [4096, 1024, 1, 5120]
    - [83, 11154.6]
  - - [1024, 4096, 1, 9576]
    - [83, 11315.2]
  - - [1024, 1024, 1, 3864]
    - [63, 10317.0]
  - - [1024, 33712, 1, 7872]
    - [115, 11947.4]
  - - [1024, 4096, 1, 10080]
    - [65, 11801.7]
  - - [1024, 33712, 1, 8512]
    - [76, 11760.1]
  - - [1024, 33712, 1, 9048]
    - [62, 11705.0]
  - - [1024, 1024, 1, 6360]
    - [63, 10395.5]
  - - [1024, 33712, 1, 7680]
    - [70, 11947.2]
  - - [1024, 1024, 1, 7888]
    - [61, 10023.2]
  - - [4096, 1024, 1, 7888]
    - [70, 11023.5]
  - - [1024, 4096, 1, 7888]
    - [78, 11317.3]
  - - [1024, 33712, 1, 8680]
    - [70, 11685.9]
  - - [1024, 4096, 1, 9864]
    - [65, 11849.4]
  - - [1024, 33712, 1, 2720]
    - [62, 12210.7]
  - - [1024, 1024, 1, 8680]
    - [73, 10374.8]
  - - [4096, 1024, 1, 9752]
    - [83, 11188.6]
  - - [4096, 1024, 1, 4488]
    - [62, 11070.3]
  - - [1024, 1024, 1, 8120]
    - [63, 10407.8]
  - - [1024, 4096, 1, 6696]
    - [68, 11401.5]
  - - [1024, 4096, 1, 6000]
    - [71, 11097.2]
  - - [1024, 33712, 1, 8880]
    - [70, 11668.0]
  - - [1024, 1024, 1, 8536]
    - [61, 10024.4]
  - - [1024, 33712, 1, 9240]
    - [76, 11625.6]
  - - [4096, 1024, 1, 8536]
    - [75, 11957.1]
  - - [1024, 4096, 1, 8536]
    - [62, 11478.4]
  - - [1024, 33712, 1, 7744]
    - [70, 11991.1]
  - - [1024, 1024, 1, 8712]
    - [60, 10026.3]
  - - [1024, 4096, 1, 8712]
    - [78, 11379.7]
  - - [4096, 1024, 1, 9952]
    - [62, 11526.5]
  - - [4096, 1024, 1, 3808]
    - [62, 11059.0]
  - - [4096, 1024, 1, 6968]
    - [112, 11177.1]
  - - [1024, 4096, 1, 6968]
    - [68, 11371.6]
  - - [1024, 1024, 1, 5632]
    - [77, 10061.3]
  - - [1024, 33712, 1, 9144]
    - [76, 11545.3]
  - - [1024, 4096, 1, 912]
    - [60, 11858.9]
  - - [1024, 33712, 1, 10000]
    - [76, 11279.2]
  - - [1024, 4096, 1, 6272]
    - [65, 11901.3]
  - - [1024, 1024, 1, 6272]
    - [63, 10386.4]
  - - [4096, 1024, 1, 10112]
    - [81, 11069.2]
  - - [4096, 1024, 1, 5304]
    - [95, 10998.3]
  - - [4096, 1024, 1, 5984]
    - [80, 11351.1]
  - - [1024, 33712, 1, 9088]
    - [76, 11596.7]
  - - [1024, 1024, 1, 3400]
    - [77, 10179.2]
  - - [4096, 1024, 1, 9088]
    - [62, 11120.8]
  - - [4096, 1024, 1, 6528]
    - [65, 11109.3]
  - - [1024, 1024, 1, 7616]
    - [63, 9692.6]
  - - [1024, 33712, 1, 7688]
    - [78, 12043.2]
  - - [1024, 4096, 1, 9048]
    - [65, 11911.8]
  - - [1024, 1024, 1, 8640]
    - [63, 9702.36]
  - - [1024, 4096, 1, 7688]
    - [92, 11383.9]
  - - [1024, 1024, 1, 7688]
    - [67, 9807.09]
  - - [4096, 1024, 1, 6696]
    - [92, 11439.7]
  - - [1024, 33712, 1, 5016]
    - [70, 12062.9]
  - - [1024, 33712, 1, 9424]
    - [84, 11458.9]
  - - [1024, 4096, 1, 5840]
    - [65, 11896.2]
  - - [1024, 1024, 1, 10176]
    - [86, 10222.9]
  - - [1024, 33712, 1, 7360]
    - [87, 12094.1]
  - - [4096, 1024, 1, 4608]
    - [62, 11904.6]
  - - [4096, 1024, 1, 7360]
    - [68, 11276.6]
  - - [1024, 1024, 1, 8216]
    - [63, 9699.04]
  - - [4096, 1024, 1, 4216]
    - [83, 11085.2]
  - - [4096, 1024, 1, 9424]
    - [83, 11169.6]
  - - [1024, 4096, 1, 9424]
    - [62, 11031.9]
  - - [1024, 4096, 1, 5456]
    - [65, 11484.3]
  - - [4096, 1024, 1, 4160]
    - [62, 11826.4]
  - - [1024, 4096, 1, 7208]
    - [92, 11407.8]
  - - [1024, 4096, 1, 3072]
    - [65, 11098.5]
  - - [4096, 1024, 1, 10160]
    - [62, 11393.4]
  - - [1024, 4096, 1, 4160]
    - [83, 11272.1]
  - - [1024, 33712, 1, 9024]
    - [76, 11537.0]
  - - [1024, 1024, 1, 7128]
    - [63, 10398.2]
  - - [1024, 4096, 1, 7128]
    - [69, 11473.7]
  - - [1024, 4096, 1, 9248]
    - [83, 11325.9]
  - - [1024, 4096, 1, 4488]
    - [65, 11757.9]
  - - [1024, 1024, 1, 4480]
    - [63, 10345.3]
  - - [1024, 4096, 1, 4480]
    - [94, 11022.1]
  - - [1024, 4096, 1, 10032]
    - [101, 11200.7]
  - - [4096, 1024, 1, 9200]
    - [83, 11168.7]
  - - [4096, 1024, 1, 9600]
    - [62, 11122.7]
  - - [1024, 4096, 1, 5936]
    - [71, 11032.1]
  - - [1024, 4096, 1, 3864]
    - [65, 11060.5]
  - - [1024, 33712, 1, 7392]
    - [70, 11984.7]
  - - [1024, 4096, 1, 7216]
    - [65, 11907.1]
  - - [1024, 4096, 1, 7520]
    - [92, 11432.2]
  - - [4096, 1024, 1, 7192]
    - [62, 11386.6]
  - - [1024, 4096, 1, 7192]
    - [68, 11456.8]
  - - [1024, 1024, 1, 7192]
    - [90, 9648.59]
  - - [1024, 1024, 1, 9288]
    - [63, 9703.44]
  - - [4096, 1024, 1, 2592]
    - [70, 11427.4]
  - - [1024, 4096, 1, 2592]
    - [78, 10516.6]
  - - [4096, 1024, 1, 6816]
    - [62, 11775.2]
  - - [4096, 1024, 1, 1584]
    - [63, 11650.8]
  - - [1024, 1024, 1, 8592]
    - [63, 9701.65]
  - - [1024, 4096, 1, 4536]
    - [83, 11567.5]
  - - [1024, 1024, 1, 4536]
    - [63, 10343.4]
  - - [4096, 1024, 1, 8512]
    - [73, 10833.7]
  - - [1024, 33712, 1, 6048]
    - [81, 12185.3]
  - - [1024, 1024, 1, 6880]
    - [60, 10006.4]
  - - [1024, 4096, 1, 6880]
    - [66, 11302.5]
  - - [1024, 1024, 1, 9000]
    - [67, 9815.65]
  - - [1024, 4096, 1, 9000]
    - [78, 11290.4]
  - - [1024, 4096, 1, 9936]
    - [83, 11439.7]
  - - [1024, 33712, 1, 4608]
    - [70, 12057.0]
  - - [1024, 1024, 1, 4608]
    - [63, 9637.43]
  - - [1024, 1024, 1, 2112]
    - [63, 9512.83]
  - - [1024, 33712, 1, 7776]
    - [70, 11965.7]
  - - [4096, 1024, 1, 8112]
    - [65, 11923.6]
  - - [1024, 1024, 1, 8112]
    - [63, 10405.7]
  - - [1024, 4096, 1, 8568]
    - [78, 11369.2]
  - - [1024, 4096, 1, 4048]
    - [65, 11489.3]
  - - [1024, 1024, 1, 4048]
    - [90, 10290.5]
  - - [1024, 4096, 1, 8256]
    - [69, 11428.1]
  - - [1024, 4096, 1, 7632]
    - [69, 11327.6]
  - - [1024, 1024, 1, 7656]
    - [63, 10406.4]
  - - [4096, 1024, 1, 7656]
    - [92, 11262.8]
  - - [1024, 4096, 1, 2720]
    - [75, 11067.6]
  - - [1024, 33712, 1, 7144]
    - [70, 12096.9]
  - - [1024, 4096, 1, 1232]
    - [61, 11928.4]
  - - [1024, 33712, 1, 7400]
    - [70, 11996.0]
  - - [4096, 1024, 1, 9864]
    - [65, 11932.8]
  - - [1024, 1024, 1, 9864]
    - [73, 10385.5]
  - - [1024, 1024, 1, 4392]
    - [63, 10340.7]
  - - [1024, 4096, 1, 4392]
    - [83, 11509.3]
  - - [1024, 33712, 1, 6664]
    - [72, 12276.6]
  - - [1024, 4096, 1, 8544]
    - [65, 11899.0]
  - - [1024, 1024, 1, 7392]
    - [73, 10367.9]
  - - [1024, 33712, 1, 7208]
    - [70, 12055.0]
  - - [1024, 4096, 1, 8496]
    - [65, 11867.5]
  - - [1024, 1024, 1, 4968]
    - [63, 10352.4]
  - - [1024, 4096, 1, 8464]
    - [70, 11313.1]
  - - [4096, 1024, 1, 8256]
    - [65, 11121.8]
  - - [1024, 4096, 1, 1856]
    - [62, 11846.5]
  - - [1024, 33712, 1, 7840]
    - [70, 11930.9]
  - - [4096, 1024, 1, 8352]
    - [65, 11930.5]
  - - [1024, 4096, 1, 8528]
    - [62, 11601.2]
  - - [4096, 1024, 1, 6656]
    - [62, 11847.4]
  - - [1024, 33712, 1, 3256]
    - [116, 12015.8]
  - - [1024, 4096, 1, 3256]
    - [66, 10529.7]
  - - [1024, 33712, 1, 7888]
    - [70, 11960.9]
  - - [1024, 4096, 1, 5328]
    - [65, 11882.8]
  - - [1024, 33712, 1, 6840]
    - [95, 12115.8]
  - - [4096, 1024, 1, 6840]
    - [62, 11904.5]
  - - [1024, 4096, 1, 6840]
    - [81, 11354.6]
  - - [1024, 1024, 1, 6840]
    - [63, 9685.93]
  - - [4096, 1024, 1, 6512]
    - [68, 11606.4]
  - - [1024, 4096, 1, 7752]
    - [69, 11413.0]
  - - [1024, 33712, 1, 3360]
    - [62, 11909.8]
  - - [4096, 1024, 1, 3360]
    - [66, 11126.1]
  - - [1024, 1024, 1, 3360]
    - [79, 10289.7]
  - - [1024, 1024, 1, 4160]
    - [63, 9650.59]
  - - [1024, 1024, 1, 6528]
    - [86, 10306.4]
  - - [1024, 4096, 1, 9144]
    - [70, 11315.9]
  - - [1024, 33712, 1, 8128]
    - [70, 11848.1]
  - - [1024, 1024, 1, 9144]
    - [61, 10026.9]
  - - [1024, 4096, 1, 1224]
    - [70, 11370.1]
  - - [4096, 1024, 1, 7632]
    - [66, 10933.6]
  - - [4096, 1024, 1, 4224]
    - [65, 11811.8]
  - - [1024, 1024, 1, 9296]
    - [63, 10385.6]
  - - [1024, 1024, 1, 1232]
    - [72, 10023.6]
  - - [4096, 1024, 1, 6664]
    - [66, 11204.7]
  - - [1024, 1024, 1, 4472]
    - [86, 10256.4]
  - - [4096, 1024, 1, 5568]
    - [83, 10984.4]
  - - [1024, 4096, 1, 4472]
    - [71, 10591.8]
  - - [4096, 1024, 1, 3864]
    - [117, 11413.2]
  - - [1024, 1024, 1, 7448]
    - [63, 9692.43]
  - - [1024, 4096, 1, 1584]
    - [93, 11046.4]
  - - [4096, 1024, 1, 6048]
    - [66, 11438.2]
  - - [1024, 33712, 1, 5632]
    - [81, 12404.8]
  - - [1024, 1024, 1, 9048]
    - [61, 10037.5]
  - - [1024, 33712, 1, 9512]
    - [76, 11428.8]
  - - [1024, 1024, 1, 7904]
    - [61, 10033.8]
  - - [1024, 33712, 1, 4640]
    - [70, 12038.8]
  - - [1024, 33712, 1, 5720]
    - [81, 12276.2]
  - - [4096, 1024, 1, 5720]
    - [75, 11180.4]
  - - [1024, 4096, 1, 5720]
    - [71, 11206.7]
  - - [1024, 1024, 1, 5720]
    - [86, 10290.0]
  - - [1024, 33712, 1, 6600]
    - [87, 12309.8]
  - - [4096, 1024, 1, 6600]
    - [75, 11937.8]
  - - [1024, 1024, 1, 8296]
    - [73, 10383.6]
  - - [1024, 1024, 1, 6664]
    - [63, 9681.46]
  - - [1024, 4096, 1, 3400]
    - [70, 11169.7]
  - - [1024, 33712, 1, 4600]
    - [70, 12031.4]
  - - [1024, 1024, 1, 5880]
    - [63, 10379.8]
  - - [4096, 1024, 1, 4600]
    - [95, 10979.3]
  - - [1024, 1024, 1, 8256]
    - [63, 9698.22]
  - - [1024, 1024, 1, 9776]
    - [63, 9710.19]
  - - [1024, 33712, 1, 9000]
    - [76, 11626.7]
  - - [1024, 33712, 1, 8432]
    - [62, 12152.4]
  - - [1024, 1024, 1, 6440]
    - [73, 10341.8]
  - - [4096, 1024, 1, 7480]
    - [92, 11287.3]
  - - [1024, 4096, 1, 4080]
    - [83, 10716.9]
  - - [1024, 33712, 1, 7200]
    - [95, 12050.7]
  - - [1024, 33712, 1, 7640]
    - [62, 12116.5]
  - - [1024, 1024, 1, 8008]
    - [73, 10373.8]
  - - [1024, 1024, 1, 9472]
    - [63, 9709.16]
  - - [1024, 4096, 1, 8616]
    - [78, 11448.3]
  - - [4096, 1024, 1, 4864]
    - [75, 11111.7]
  - - [1024, 4096, 1, 9912]
    - [83, 10993.9]
  - - [1024, 33712, 1, 8232]
    - [70, 11951.8]
  - - [1024, 1024, 1, 9400]
    - [60, 10023.4]
  - - [4096, 1024, 1, 5800]
    - [86, 10713.3]
  - - [4096, 1024, 1, 7216]
    - [92, 11561.1]
  - - [1024, 1024, 1, 7696]
    - [63, 9691.84]
  - - [1024, 4096, 1, 6240]
    - [66, 11297.6]
- null
