library/src/blas3/Tensile/Logic/asm_ci/vega20_Cijk_Alik_Bljk_HBH.yaml
- {MinimumRequiredVersion: 4.6.0}
- vega20
- gfx906
- [Device 66a0, Device 66a1, Device 66a7, Device 66af, Vega 20]
    SolutionIndex: 0
    SolutionNameMin: Cijk_Alik_Bljk_HBH_MT032x016x08_PGR1_PLR1_TT04_02
    SolutionIndex: 1
    SolutionNameMin: Cijk_Alik_Bljk_HBH_MT032x016x08_PGR1_PLR1_TT02_02
    SolutionIndex: 2
    SolutionNameMin: Cijk_Alik_Bljk_HBH_MT032x032x08_PGR1_PLR1_TT02_02
    SolutionIndex: 3
    SolutionNameMin: Cijk_Alik_Bljk_HBH_MT016x016x16_PGR1_PLR1_TT02_02
    SolutionIndex: 4
    SolutionNameMin: Cijk_Alik_Bljk_HBH_MT032x032x16_PGR1_PLR1_TT04_04
    SolutionIndex: 5
    SolutionNameMin: Cijk_Alik_Bljk_HBH_MT064x032x16_PGR1_PLR1_TT04_04
    SolutionIndex: 6
    SolutionNameMin: Cijk_Alik_Bljk_HBH_MT032x032x32_PGR1_PLR1_TT04_04
    SolutionIndex: 7
    SolutionNameMin: Cijk_Alik_Bljk_HBH_MT032x016x08_PGR1_PLR1_TT04_02
    SolutionIndex: 8
    SolutionNameMin: Cijk_Alik_Bljk_HBH_MT016x016x16_PGR1_PLR1_TT02_02
    SolutionIndex: 9
    SolutionNameMin: Cijk_Alik_Bljk_HBH_MT032x032x16_PGR1_PLR1_TT04_04
    SolutionIndex: 10
    SolutionNameMin: Cijk_Alik_Bljk_HBH_MT064x064x16_PGR1_PLR1_TT08_08
    SolutionIndex: 11
    SolutionNameMin: Cijk_Alik_Bljk_HBH_MT064x032x16_PGR1_PLR1_TT04_04
    SolutionIndex: 12
    SolutionNameMin: Cijk_Alik_Bljk_HBH_MT016x016x24_PGR1_PLR1_TT02_02
    SolutionIndex: 13
    SolutionNameMin: Cijk_Alik_Bljk_HBH_MT032x032x24_PGR1_PLR1_TT04_04
    SolutionIndex: 14
    SolutionNameMin: Cijk_Alik_Bljk_HBH_MT016x016x24_PGR1_PLR1_TT02_02
    SolutionIndex: 15
    SolutionNameMin: Cijk_Alik_Bljk_HBH_MT032x016x24_PGR1_PLR1_TT04_02
    SolutionIndex: 16
    SolutionNameMin: Cijk_Alik_Bljk_HBH_MT032x032x24_PGR1_PLR1_TT04_04
    SolutionIndex: 17
    SolutionNameMin: Cijk_Alik_Bljk_HBH_MT064x064x24_PGR1_PLR1_TT08_08
    SolutionIndex: 18
    SolutionNameMin: Cijk_Alik_Bljk_HBH_MT064x064x08_PGR1_PLR1_TT04_04
    SolutionIndex: 19
    SolutionNameMin: Cijk_Alik_Bljk_HBH_MT064x128x08_PGR1_PLR1_TT04_08
    SolutionIndex: 20
    SolutionNameMin: Cijk_Alik_Bljk_HBH_MT128x064x08_PGR1_PLR1_TT08_04
    SolutionIndex: 21
    SolutionNameMin: Cijk_Alik_Bljk_HBH_MT064x064x16_PGR1_PLR1_TT04_04
    SolutionIndex: 22
    SolutionNameMin: Cijk_Alik_Bljk_HBH_MT064x128x16_PGR1_PLR1_TT04_08
    SolutionIndex: 23
    SolutionNameMin: Cijk_Alik_Bljk_HBH_MT128x128x16_PGR1_PLR1_TT08_08
    SolutionIndex: 24
    SolutionNameMin: Cijk_Alik_Bljk_HBH_MT128x064x32_PGR1_PLR1_TT08_04
    SolutionIndex: 25
    SolutionNameMin: Cijk_Alik_Bljk_HBH_MT064x128x04_PGR0_PLR0_TT04_08
    SolutionIndex: 26
    SolutionNameMin: Cijk_Alik_Bljk_HBH_MT064x064x04_PGR0_PLR0_TT04_04
    SolutionIndex: 27
    SolutionNameMin: Cijk_Alik_Bljk_HBH_MT064x064x04_PGR1_PLR0_TT04_04
    SolutionIndex: 28
    SolutionNameMin: Cijk_Alik_Bljk_HBH_MT064x064x04_PGR0_PLR1_TT04_04
    SolutionIndex: 29
    SolutionNameMin: Cijk_Alik_Bljk_HBH_MT064x064x08_PGR0_PLR0_TT04_04
    SolutionIndex: 30
    SolutionNameMin: Cijk_Alik_Bljk_HBH_MT064x064x08_PGR1_PLR0_TT04_04
    SolutionIndex: 31
    SolutionNameMin: Cijk_Alik_Bljk_HBH_MT128x128x08_PGR0_PLR1_TT08_08
    SolutionIndex: 32
    SolutionNameMin: Cijk_Alik_Bljk_HBH_MT064x128x08_PGR0_PLR1_TT04_08
    SolutionIndex: 33
    SolutionNameMin: Cijk_Alik_Bljk_HBH_MT064x064x08_PGR0_PLR1_TT04_04
    SolutionIndex: 34
    SolutionNameMin: Cijk_Alik_Bljk_HBH_MT064x064x08_PGR1_PLR1_TT04_04
    SolutionIndex: 35
    SolutionNameMin: Cijk_Alik_Bljk_HBH_MT064x064x16_PGR0_PLR0_TT04_04
    SolutionIndex: 36
    SolutionNameMin: Cijk_Alik_Bljk_HBH_MT064x064x16_PGR1_PLR0_TT04_04
    SolutionIndex: 37
    SolutionNameMin: Cijk_Alik_Bljk_HBH_MT064x064x16_PGR0_PLR1_TT04_04
    SolutionIndex: 38
    SolutionNameMin: Cijk_Alik_Bljk_HBH_MT064x064x16_PGR1_PLR1_TT04_04
    SolutionIndex: 39
    SolutionNameMin: Cijk_Alik_Bljk_HBH_MT064x128x04_PGR0_PLR0_TT04_08
    SolutionIndex: 40
    SolutionNameMin: Cijk_Alik_Bljk_HBH_MT064x064x04_PGR0_PLR0_TT04_04
    SolutionIndex: 41
    SolutionNameMin: Cijk_Alik_Bljk_HBH_MT064x128x04_PGR1_PLR0_TT04_08
    SolutionIndex: 42
    SolutionNameMin: Cijk_Alik_Bljk_HBH_MT064x064x04_PGR1_PLR0_TT04_04
    SolutionIndex: 43
    SolutionNameMin: Cijk_Alik_Bljk_HBH_MT128x128x04_PGR0_PLR1_TT08_08
    SolutionIndex: 44
    SolutionNameMin: Cijk_Alik_Bljk_HBH_MT064x128x04_PGR0_PLR1_TT04_08
    SolutionIndex: 45
    SolutionNameMin: Cijk_Alik_Bljk_HBH_MT064x064x04_PGR0_PLR1_TT04_04
    SolutionIndex: 46
    SolutionNameMin: Cijk_Alik_Bljk_HBH_MT064x128x04_PGR1_PLR1_TT04_08
    SolutionIndex: 47
    SolutionNameMin: Cijk_Alik_Bljk_HBH_MT064x064x04_PGR1_PLR1_TT04_04
    SolutionIndex: 48
    SolutionNameMin: Cijk_Alik_Bljk_HBH_MT128x128x08_PGR0_PLR0_TT08_08
    SolutionIndex: 49
    SolutionNameMin: Cijk_Alik_Bljk_HBH_MT064x128x08_PGR0_PLR0_TT04_08
    SolutionIndex: 50
    SolutionNameMin: Cijk_Alik_Bljk_HBH_MT064x064x08_PGR0_PLR0_TT04_04
    SolutionIndex: 51
    SolutionNameMin: Cijk_Alik_Bljk_HBH_MT064x064x08_PGR1_PLR0_TT04_04
    SolutionIndex: 52
    SolutionNameMin: Cijk_Alik_Bljk_HBH_MT064x128x08_PGR0_PLR1_TT04_08
    SolutionIndex: 53
    SolutionNameMin: Cijk_Alik_Bljk_HBH_MT064x064x08_PGR0_PLR1_TT04_04
    SolutionIndex: 54
    SolutionNameMin: Cijk_Alik_Bljk_HBH_MT064x128x08_PGR1_PLR1_TT04_08
    SolutionIndex: 55
    SolutionNameMin: Cijk_Alik_Bljk_HBH_MT064x064x08_PGR1_PLR1_TT04_04
    SolutionIndex: 56
    SolutionNameMin: Cijk_Alik_Bljk_HBH_MT064x064x16_PGR1_PLR1_TT04_04
    SolutionIndex: 57
    SolutionNameMin: Cijk_Alik_Bljk_HBH_MT064x032x16_EPS1_GRVW04_LPB04_PGR1_PLR1_SNLL1_TT04_04_VW04_WG16_08_01_WGM01
    SolutionIndex: 58
    SolutionNameMin: Cijk_Alik_Bljk_HBH_MT064x064x16_EPS1_GRVW04_LPB04_PGR1_PLR1_SNLL1_TT04_04_VW04_WG16_16_01_WGM01
    SolutionIndex: 59
    SolutionNameMin: Cijk_Alik_Bljk_HBH_MT064x032x16_EPS1_GRVW04_LPB04_PGR1_PLR1_SNLL1_TT04_04_VW04_WG16_08_01_WGM08
    SolutionIndex: 60
    SolutionNameMin: Cijk_Alik_Bljk_HBH_MT064x032x16_EPS1_GRVW04_LPB04_PGR1_PLR1_SNLL1_TT04_04_VW04_WG16_08_01_WGM64
    SolutionIndex: 61
    SolutionNameMin: Cijk_Alik_Bljk_HBH_MT032x128x32_EPS1_GRVW04_LPB04_PGR1_PLR1_SNLL1_TT04_04_VW04_WG08_32_01_WGM01
    SolutionIndex: 62
    SolutionNameMin: Cijk_Alik_Bljk_HBH_MT032x128x32_EPS1_GRVW04_LPB04_PGR1_PLR1_SNLL1_TT04_04_VW04_WG08_32_01_WGM64
    SolutionIndex: 63
    SolutionNameMin: Cijk_Alik_Bljk_HBH_MT032x032x08_PGR1_PLR1_TT04_04
    SolutionIndex: 64
    SolutionNameMin: Cijk_Alik_Bljk_HBH_MT032x032x16_PGR1_PLR1_TT04_04
    SolutionIndex: 65
    SolutionNameMin: Cijk_Alik_Bljk_HBH_MT064x016x16_PGR1_PLR1_TT04_04
    SolutionIndex: 66
    SolutionNameMin: Cijk_Alik_Bljk_HBH_MT032x032x32_PGR1_PLR1_TT04_04
    SolutionIndex: 67
    SolutionNameMin: Cijk_Alik_Bljk_HBH_MT064x016x32_PGR1_PLR1_TT04_04
    SolutionIndex: 68
    SolutionNameMin: Cijk_Alik_Bljk_HBH_MT032x032x16_PGR1_PLR1_TT04_04
    SolutionIndex: 69
    SolutionNameMin: Cijk_Alik_Bljk_HBH_MT032x032x32_PGR1_PLR1_TT04_04
    SolutionIndex: 70
    SolutionNameMin: Cijk_Alik_Bljk_HBH_MT064x032x32_PGR1_PLR1_TT04_04
    SolutionIndex: 71
    SolutionNameMin: Cijk_Alik_Bljk_HBH_MT064x064x08_PGR1_PLR1_TT08_08
    SolutionIndex: 72
    SolutionNameMin: Cijk_Alik_Bljk_HBH_MT064x064x16_PGR1_PLR1_TT08_08
    SolutionIndex: 73
    SolutionNameMin: Cijk_Alik_Bljk_HBH_MT064x064x32_PGR1_PLR1_TT08_08
    SolutionIndex: 74
    SolutionNameMin: Cijk_Alik_Bljk_HBH_MT128x128x08_PGR1_PLR1_TT08_08
    SolutionIndex: 75
    SolutionNameMin: Cijk_Alik_Bljk_HBH_MT064x064x16_PGR1_PLR1_TT04_04
    SolutionIndex: 76
    SolutionNameMin: Cijk_Alik_Bljk_HBH_MT128x064x16_PGR1_PLR1_TT08_04
    SolutionIndex: 77
    SolutionNameMin: Cijk_Alik_Bljk_HBH_MT128x128x32_PGR1_PLR1_TT08_08
    SolutionIndex: 78
    SolutionNameMin: Cijk_Alik_Bljk_HBH_MT128x128x16_PGR1_PLR1_TT08_08
    SolutionIndex: 79
    SolutionNameMin: Cijk_Alik_Bljk_HBH_MT128x128x32_PGR1_PLR1_TT08_08
    SolutionIndex: 80
    SolutionNameMin: Cijk_Alik_Bljk_HBH_MT064x064x04_PGR0_PLR0_TT04_04
    SolutionIndex: 81
    SolutionNameMin: Cijk_Alik_Bljk_HBH_MT064x064x04_PGR1_PLR1_TT04_04
    SolutionIndex: 82
    SolutionNameMin: Cijk_Alik_Bljk_HBH_MT064x064x08_PGR0_PLR0_TT04_04
    SolutionIndex: 83
    SolutionNameMin: Cijk_Alik_Bljk_HBH_MT064x064x08_PGR1_PLR0_TT04_04
    SolutionIndex: 84
    SolutionNameMin: Cijk_Alik_Bljk_HBH_MT064x064x08_PGR1_PLR1_TT04_04
    SolutionIndex: 85
    SolutionNameMin: Cijk_Alik_Bljk_HBH_MT064x128x16_PGR1_PLR1_TT04_08
    SolutionIndex: 86
    SolutionNameMin: Cijk_Alik_Bljk_HBH_MT128x128x04_PGR0_PLR0_TT08_08
    SolutionIndex: 87
    SolutionNameMin: Cijk_Alik_Bljk_HBH_MT064x064x04_PGR0_PLR0_TT04_04
    SolutionIndex: 88
    SolutionNameMin: Cijk_Alik_Bljk_HBH_MT064x064x04_PGR1_PLR0_TT04_04
    SolutionIndex: 89
    SolutionNameMin: Cijk_Alik_Bljk_HBH_MT064x064x04_PGR0_PLR1_TT04_04
    SolutionIndex: 90
    SolutionNameMin: Cijk_Alik_Bljk_HBH_MT064x064x04_PGR1_PLR1_TT04_04
    SolutionIndex: 91
    SolutionNameMin: Cijk_Alik_Bljk_HBH_MT064x128x08_PGR0_PLR0_TT04_08
    SolutionIndex: 92
    SolutionNameMin: Cijk_Alik_Bljk_HBH_MT064x064x08_PGR1_PLR0_TT04_04
    SolutionIndex: 93
    SolutionNameMin: Cijk_Alik_Bljk_HBH_MT064x064x08_PGR1_PLR1_TT04_04
    SolutionIndex: 94
    SolutionNameMin: Cijk_Alik_Bljk_HBH_MT064x064x16_PGR1_PLR1_TT04_04
    SolutionIndex: 95
    SolutionNameMin: Cijk_Alik_Bljk_HBH_MT64x64x16_SE_GRVW4_LRVW4_TT4_4_VW4_WG16_16_1_WGM1
    SolutionIndex: 96
    SolutionNameMin: Cijk_Alik_Bljk_HBH_MT128x64x16_SE_GRVW4_LRVW4_TT8_4_VW4_WG16_16_1_WGM1
    SolutionIndex: 97
    SolutionNameMin: Cijk_Alik_Bljk_HBH_MT64x64x16_SE_GRVW4_LRVW4_TT4_4_VW4_WG16_16_1_WGM8
    SolutionIndex: 98
    SolutionNameMin: Cijk_Alik_Bljk_HBH_MT64x64x32_SE_GRVW4_LRVW4_TT4_4_VW4_WG16_16_1_WGM1
    SolutionIndex: 99
    SolutionNameMin: Cijk_Alik_Bljk_HBH_MT96x64x16_SE_GRVW2_LRVW2_TT6_4_VW2_WG16_16_1_WGM1
    SolutionIndex: 100
    SolutionNameMin: Cijk_Alik_Bljk_HBH_MT96x64x16_SE_GRVW2_LRVW2_TT6_4_VW2_WG16_16_1_WGM8
- - - [2368, 1024, 1, 1]
    - [40, 135.921]
  - - [448, 1, 1, 256]
    - [55, 2.9317]
  - - [5056, 1408, 1, 3328]
    - [23, 9713.46]
  - - [5056, 1856, 1, 3328]
    - [21, 9979.08]
  - - [5888, 128, 1, 1]
    - [44, 63.2268]
  - - [448, 3584, 1, 3328]
    - [21, 8233.0]
  - - [704, 64, 1, 3328]
    - [14, 1985.52]
  - - [5056, 4288, 1, 32]
    - [25, 3673.04]
  - - [3584, 1024, 1, 256]
    - [21, 9167.88]
  - - [32, 5056, 1, 1280]
    - [38, 1183.66]
  - - [1856, 256, 1, 1]
    - [40, 41.5329]
  - - [256, 1856, 1, 32]
    - [33, 931.639]
  - - [1408, 3584, 1, 3328]
    - [21, 9700.78]
  - - [128, 3584, 1, 1280]
    - [16, 6478.4]
  - - [1024, 2368, 1, 3328]
    - [21, 8980.86]
  - - [4288, 64, 1, 3328]
    - [14, 4487.57]
  - - [1, 4288, 1, 1280]
    - [55, 28.4562]
  - - [2368, 64, 1, 1]
    - [53, 11.9899]
  - - [256, 128, 1, 256]
    - [3, 944.663]
  - - [448, 64, 1, 1]
    - [48, 2.54184]
  - - [32, 1408, 1, 32]
    - [27, 94.8547]
  - - [448, 3584, 1, 32]
    - [33, 2013.33]
  - - [64, 1024, 1, 1280]
    - [14, 2582.7]
  - - [1, 1408, 1, 3328]
    - [56, 13.9892]
  - - [1408, 128, 1, 32]
    - [27, 343.284]
  - - [4288, 6784, 1, 3328]
    - [21, 10375.2]
  - - [1024, 1, 1, 3328]
    - [56, 10.2523]
  - - [2944, 128, 1, 32]
    - [34, 832.778]
  - - [64, 6784, 1, 1]
    - [40, 40.5015]
  - - [1024, 64, 1, 1280]
    - [14, 2570.04]
  - - [448, 128, 1, 256]
    - [3, 1504.1]
  - - [64, 5056, 1, 3328]
    - [11, 4864.87]
  - - [5888, 4288, 1, 3328]
    - [21, 10103.2]
  - - [1, 2368, 1, 1280]
    - [56, 21.5763]
  - - [704, 1024, 1, 1]
    - [45, 61.3007]
  - - [2368, 1408, 1, 32]
    - [25, 2699.71]
  - - [256, 1856, 1, 1280]
    - [16, 6692.06]
  - - [1024, 2944, 1, 1]
    - [40, 151.338]
  - - [2944, 3584, 1, 3328]
    - [21, 10082.3]
  - - [2368, 2944, 1, 1280]
    - [21, 9948.47]
  - - [256, 1408, 1, 1]
    - [40, 31.9546]
  - - [1, 1024, 1, 3328]
    - [56, 10.2474]
  - - [6784, 5888, 1, 3328]
    - [19, 10078.0]
  - - [3584, 1408, 1, 32]
    - [25, 3044.51]
  - - [5056, 256, 1, 256]
    - [21, 7770.87]
  - - [1856, 2368, 1, 256]
    - [21, 9198.19]
  - - [2368, 1024, 1, 3328]
    - [21, 8964.9]
  - - [3584, 4288, 1, 32]
    - [25, 3541.06]
  - - [1024, 1024, 1, 1280]
    - [23, 8529.34]
  - - [3584, 3584, 1, 1]
    - [44, 234.742]
  - - [32, 2944, 1, 3328]
    - [38, 1056.92]
  - - [704, 1408, 1, 3328]
    - [17, 8222.38]
  - - [1408, 704, 1, 256]
    - [21, 7275.1]
  - - [704, 64, 1, 32]
    - [27, 90.112]
  - - [5888, 1, 1, 3328]
    - [55, 39.9838]
  - - [2368, 32, 1, 256]
    - [34, 528.286]
  - - [6784, 128, 1, 3328]
    - [5, 7259.53]
  - - [2944, 256, 1, 1]
    - [49, 55.0924]
  - - [1408, 2368, 1, 1]
    - [45, 157.271]
  - - [32, 448, 1, 3328]
    - [38, 163.66]
  - - [5056, 1, 1, 3328]
    - [55, 34.3732]
  - - [2944, 256, 1, 32]
    - [27, 1351.86]
  - - [5056, 6784, 1, 1280]
    - [21, 10126.7]
  - - [4288, 5056, 1, 1]
    - [40, 243.706]
  - - [5056, 4288, 1, 1]
    - [40, 243.488]
  - - [128, 4288, 1, 3328]
    - [16, 5792.17]
  - - [5056, 128, 1, 256]
    - [11, 5883.35]
  - - [1408, 4288, 1, 1280]
    - [21, 9675.49]
  - - [1856, 704, 1, 1280]
    - [21, 8802.52]
  - - [4288, 1024, 1, 3328]
    - [21, 9839.05]
  - - [1, 5888, 1, 3328]
    - [55, 40.036]
  - - [1024, 128, 1, 32]
    - [27, 266.136]
  - - [32, 4288, 1, 1280]
    - [38, 989.39]
  - - [1024, 5056, 1, 1]
    - [40, 188.13]
  - - [704, 3584, 1, 1280]
    - [21, 9204.33]
  - - [1856, 5056, 1, 256]
    - [21, 9643.09]
  - - [1408, 1024, 1, 1280]
    - [21, 8337.07]
  - - [5056, 5888, 1, 3328]
    - [20, 9933.66]
  - - [448, 1, 1, 1]
    - [48, 0.0478633]
  - - [3584, 3584, 1, 1280]
    - [21, 10217.3]
  - - [2368, 3584, 1, 32]
    - [25, 3361.15]
  - - [2944, 2368, 1, 1]
    - [40, 204.56]
  - - [704, 4288, 1, 1]
    - [40, 150.938]
  - - [2368, 256, 1, 32]
    - [29, 1182.84]
  - - [1024, 6784, 1, 1280]
    - [21, 9909.87]
  - - [1024, 3584, 1, 1]
    - [46, 165.019]
  - - [32, 5056, 1, 32]
    - [29, 380.687]
  - - [5888, 32, 1, 32]
    - [27, 443.332]
  - - [64, 128, 1, 3328]
    - [12, 361.386]
  - - [256, 5056, 1, 32]
    - [33, 1842.47]
  - - [5056, 64, 1, 32]
    - [34, 775.051]
  - - [2368, 5056, 1, 32]
    - [25, 3430.55]
  - - [6784, 1856, 1, 32]
    - [25, 3435.5]
  - - [64, 128, 1, 1]
    - [40, 0.682667]
  - - [64, 2368, 1, 1280]
    - [12, 4089.09]
  - - [128, 704, 1, 32]
    - [27, 179.327]
  - - [64, 6784, 1, 3328]
    - [13, 6382.23]
  - - [2944, 256, 1, 1280]
    - [21, 7734.85]
  - - [5056, 704, 1, 1]
    - [40, 162.977]
  - - [2944, 4288, 1, 256]
    - [21, 9650.36]
  - - [1024, 1024, 1, 3328]
    - [23, 8699.79]
  - - [5056, 704, 1, 32]
    - [29, 2661.25]
  - - [1856, 4288, 1, 3328]
    - [21, 10002.3]
  - - [1, 1856, 1, 256]
    - [55, 12.0715]
  - - [6784, 4288, 1, 32]
    - [25, 3717.55]
  - - [5888, 64, 1, 256]
    - [5, 4567.66]
  - - [256, 128, 1, 1]
    - [52, 3.2]
  - - [5888, 5056, 1, 256]
    - [21, 9716.76]
  - - [2944, 448, 1, 256]
    - [21, 7010.83]
  - - [3584, 2368, 1, 3328]
    - [21, 10020.6]
  - - [4288, 1856, 1, 1]
    - [45, 211.663]
  - - [1856, 2944, 1, 1]
    - [40, 188.676]
  - - [32, 4288, 1, 3328]
    - [38, 1031.66]
  - - [1, 3584, 1, 3328]
    - [56, 35.909]
  - - [256, 32, 1, 3328]
    - [38, 95.673]
  - - [1856, 2368, 1, 32]
    - [25, 2886.7]
  - - [4288, 1856, 1, 32]
    - [25, 3255.02]
  - - [5056, 64, 1, 3328]
    - [5, 4871.91]
  - - [6784, 1, 1, 1280]
    - [55, 44.0698]
  - - [1024, 448, 1, 32]
    - [27, 960.737]
  - - [1408, 64, 1, 1]
    - [47, 7.41053]
  - - [1, 1, 1, 3328]
    - [56, 0.00988828]
  - - [5056, 2368, 1, 256]
    - [21, 9535.18]
  - - [1408, 5888, 1, 256]
    - [23, 9546.23]
  - - [5056, 6784, 1, 1]
    - [45, 256.275]
  - - [32, 448, 1, 1280]
    - [38, 148.08]
  - - [32, 448, 1, 32]
    - [33, 29.2571]
  - - [1856, 64, 1, 256]
    - [8, 2639.64]
  - - [1024, 1408, 1, 3328]
    - [21, 8456.02]
  - - [256, 5056, 1, 1280]
    - [21, 8712.4]
  - - [704, 2368, 1, 1]
    - [42, 110.256]
  - - [64, 1024, 1, 32]
    - [27, 132.396]
  - - [1024, 256, 1, 256]
    - [9, 4279.9]
  - - [128, 1, 1, 1]
    - [56, 0.0117647]
  - - [3584, 4288, 1, 1280]
    - [21, 10194.1]
  - - [1856, 128, 1, 32]
    - [34, 539.927]
  - - [1856, 128, 1, 1280]
    - [16, 5279.29]
  - - [128, 2944, 1, 3328]
    - [11, 5645.02]
  - - [1, 6784, 1, 3328]
    - [55, 45.8885]
  - - [3584, 2368, 1, 1]
    - [46, 213.884]
  - - [4288, 448, 1, 3328]
    - [21, 8702.45]
  - - [4288, 32, 1, 3328]
    - [38, 1033.16]
  - - [256, 1856, 1, 1]
    - [42, 41.2444]
  - - [704, 6784, 1, 1280]
    - [21, 9561.43]
  - - [2368, 4288, 1, 32]
    - [25, 3353.92]
  - - [704, 5056, 1, 1280]
    - [21, 9506.06]
  - - [256, 3584, 1, 3328]
    - [23, 7615.36]
  - - [1024, 32, 1, 3328]
    - [38, 372.445]
  - - [3584, 6784, 1, 32]
    - [25, 3712.04]
  - - [3584, 6784, 1, 1280]
    - [21, 10288.0]
  - - [4288, 4288, 1, 3328]
    - [21, 10217.3]
  - - [3584, 64, 1, 1280]
    - [16, 5069.08]
  - - [64, 1856, 1, 256]
    - [3, 2695.81]
  - - [3584, 64, 1, 32]
    - [34, 539.708]
  - - [448, 1, 1, 1280]
    - [56, 4.16019]
  - - [256, 4288, 1, 1280]
    - [21, 7429.63]
  - - [1408, 3584, 1, 1]
    - [39, 185.525]
  - - [4288, 1856, 1, 3328]
    - [21, 9984.76]
  - - [1856, 2944, 1, 1280]
    - [21, 9921.13]
  - - [4288, 256, 1, 256]
    - [21, 6729.37]
  - - [128, 5888, 1, 32]
    - [33, 1333.92]
  - - [128, 5888, 1, 1280]
    - [21, 7705.19]
  - - [1408, 128, 1, 3328]
    - [14, 4697.57]
  - - [3584, 256, 1, 256]
    - [21, 6749.45]
  - - [32, 6784, 1, 3328]
    - [38, 1619.59]
  - - [64, 64, 1, 1280]
    - [12, 162.62]
  - - [32, 3584, 1, 256]
    - [38, 915.216]
  - - [704, 256, 1, 32]
    - [27, 340.045]
  - - [448, 128, 1, 3328]
    - [12, 2474.6]
  - - [64, 2944, 1, 3328]
    - [14, 4951.42]
  - - [64, 4288, 1, 3328]
    - [2, 4464.75]
  - - [5056, 1024, 1, 3328]
    - [23, 9792.55]
  - - [128, 256, 1, 1280]
    - [12, 1372.48]
  - - [1856, 256, 1, 256]
    - [9, 5508.82]
  - - [3584, 704, 1, 1]
    - [45, 138.939]
  - - [256, 704, 1, 256]
    - [9, 3186.28]
  - - [448, 5056, 1, 1]
    - [45, 131.691]
  - - [5888, 5888, 1, 256]
    - [21, 9722.13]
  - - [3584, 704, 1, 32]
    - [33, 2420.27]
  - - [448, 6784, 1, 3328]
    - [21, 9479.8]
  - - [6784, 4288, 1, 1]
    - [41, 249.398]
  - - [3584, 6784, 1, 1]
    - [39, 251.799]
  - - [1408, 2368, 1, 32]
    - [25, 2656.69]
  - - [448, 5056, 1, 32]
    - [29, 2317.23]
  - - [4288, 4288, 1, 1280]
    - [21, 10167.7]
  - - [6784, 1408, 1, 1]
    - [39, 222.343]
  - - [1856, 5888, 1, 3328]
    - [21, 10203.6]
  - - [1024, 704, 1, 1]
    - [42, 60.8865]
  - - [3584, 1856, 1, 3328]
    - [21, 9897.67]
  - - [5056, 5888, 1, 1]
    - [40, 252.8]
  - - [2944, 1024, 1, 256]
    - [21, 8738.08]
  - - [448, 1408, 1, 3328]
    - [21, 6618.06]
  - - [5056, 32, 1, 3328]
    - [38, 1218.2]
  - - [2368, 4288, 1, 3328]
    - [21, 10188.3]
  - - [1024, 704, 1, 32]
    - [34, 1304.79]
  - - [448, 2944, 1, 256]
    - [21, 6976.06]
  - - [2944, 6784, 1, 256]
    - [21, 9781.25]
  - - [2368, 2368, 1, 1280]
    - [21, 9749.92]
  - - [5888, 128, 1, 3328]
    - [21, 7806.88]
  - - [256, 256, 1, 32]
    - [27, 127.875]
  - - [1024, 1, 1, 256]
    - [55, 6.68735]
  - - [3584, 3584, 1, 32]
    - [25, 3526.44]
  - - [2944, 448, 1, 1]
    - [55, 88.6366]
  - - [128, 32, 1, 32]
    - [27, 8.57801]
  - - [5056, 64, 1, 1280]
    - [5, 4710.96]
  - - [2944, 2944, 1, 1280]
    - [21, 9892.58]
  - - [1, 2368, 1, 256]
    - [55, 15.2467]
  - - [1408, 5056, 1, 1]
    - [39, 205.985]
  - - [2944, 32, 1, 1280]
    - [38, 987.764]
  - - [64, 1408, 1, 3328]
    - [12, 3454.97]
  - - [256, 448, 1, 1280]
    - [12, 3855.06]
  - - [2368, 6784, 1, 1]
    - [40, 220.182]
  - - [6784, 4288, 1, 1280]
    - [21, 10119.3]
  - - [2944, 704, 1, 256]
    - [21, 8524.73]
  - - [2368, 6784, 1, 1280]
    - [21, 10158.6]
  - - [704, 2944, 1, 3328]
    - [10, 9393.09]
  - - [5888, 256, 1, 1]
    - [40, 103.525]
  - - [704, 704, 1, 32]
    - [29, 991.232]
  - - [256, 4288, 1, 256]
    - [21, 6820.83]
  - - [5056, 6784, 1, 32]
    - [25, 3765.08]
  - - [5056, 128, 1, 1]
    - [40, 57.7829]
  - - [448, 5056, 1, 1280]
    - [21, 9092.17]
  - - [448, 448, 1, 256]
    - [9, 3548.36]
  - - [256, 5888, 1, 3328]
    - [21, 8824.21]
  - - [704, 448, 1, 1280]
    - [9, 4525.8]
  - - [448, 64, 1, 256]
    - [3, 819.2]
  - - [1024, 704, 1, 1280]
    - [21, 7365.48]
  - - [5888, 1024, 1, 1]
    - [44, 196.779]
  - - [5888, 448, 1, 32]
    - [33, 2365.76]
  - - [6784, 2944, 1, 256]
    - [21, 9622.2]
  - - [1024, 256, 1, 1]
    - [40, 24.6376]
  - - [2368, 448, 1, 256]
    - [21, 6478.56]
  - - [4288, 256, 1, 3328]
    - [21, 7548.01]
  - - [4288, 2944, 1, 256]
    - [21, 9611.32]
  - - [448, 5888, 1, 3328]
    - [21, 8943.24]
  - - [128, 256, 1, 3328]
    - [12, 1465.75]
  - - [128, 6784, 1, 32]
    - [29, 1478.05]
  - - [1856, 64, 1, 32]
    - [27, 239.968]
  - - [1408, 4288, 1, 1]
    - [39, 196.533]
  - - [1408, 1856, 1, 3328]
    - [21, 9652.06]
  - - [4288, 64, 1, 256]
    - [14, 3471.08]
  - - [3584, 1024, 1, 3328]
    - [21, 9893.89]
  - - [2944, 5888, 1, 3328]
    - [21, 10215.1]
  - - [128, 6784, 1, 3328]
    - [5, 7302.09]
  - - [448, 4288, 1, 3328]
    - [21, 8714.79]
  - - [704, 2368, 1, 256]
    - [21, 7731.35]
  - - [1, 64, 1, 3328]
    - [56, 0.633905]
  - - [4288, 128, 1, 1]
    - [40, 50.0788]
  - - [256, 2368, 1, 32]
    - [34, 1182.84]
  - - [4288, 3584, 1, 3328]
    - [21, 10250.9]
  - - [1408, 64, 1, 256]
    - [2, 2089.55]
  - - [1408, 1024, 1, 1]
    - [39, 100.684]
  - - [64, 1024, 1, 1]
    - [47, 5.61096]
  - - [1408, 1024, 1, 256]
    - [21, 7638.63]
  - - [5056, 3584, 1, 1]
    - [45, 232.554]
  - - [448, 1024, 1, 256]
    - [21, 5397.08]
  - - [6784, 6784, 1, 3328]
    - [23, 10167.0]
  - - [6784, 32, 1, 32]
    - [33, 485.113]
  - - [64, 1024, 1, 3328]
    - [12, 2751.06]
  - - [2368, 2944, 1, 3328]
    - [21, 10010.3]
  - - [448, 448, 1, 1280]
    - [16, 4441.58]
  - - [5056, 3584, 1, 32]
    - [25, 3609.7]
  - - [5056, 3584, 1, 1280]
    - [21, 9970.46]
  - - [1856, 1856, 1, 256]
    - [21, 8693.34]
  - - [32, 5888, 1, 256]
    - [38, 1110.37]
  - - [256, 1408, 1, 32]
    - [34, 754.865]
  - - [2944, 1, 1, 3328]
    - [56, 28.9802]
  - - [32, 704, 1, 3328]
    - [38, 253.083]
  - - [5888, 4288, 1, 1]
    - [44, 250.472]
  - - [1024, 128, 1, 256]
    - [1, 2892.62]
  - - [32, 1856, 1, 3328]
    - [38, 668.301]
  - - [5056, 704, 1, 256]
    - [21, 8795.49]
  - - [2368, 5056, 1, 256]
    - [21, 9689.5]
  - - [1024, 5056, 1, 256]
    - [21, 9297.14]
  - - [32, 1024, 1, 3328]
    - [38, 368.419]
  - - [5888, 448, 1, 256]
    - [21, 8116.38]
  - - [6784, 5056, 1, 1280]
    - [21, 10124.3]
  - - [4288, 6784, 1, 1280]
    - [21, 10329.3]
  - - [64, 1, 1, 256]
    - [55, 0.417108]
  - - [1856, 64, 1, 1280]
    - [14, 3959.47]
  - - [128, 1408, 1, 1]
    - [42, 13.9062]
  - - [1024, 64, 1, 32]
    - [27, 133.747]
  - - [1024, 64, 1, 3328]
    - [12, 2745.52]
  - - [704, 6784, 1, 3328]
    - [21, 9645.55]
  - - [2944, 1856, 1, 1]
    - [40, 191.319]
  - - [5888, 4288, 1, 1280]
    - [21, 10045.8]
  - - [5888, 3584, 1, 1280]
    - [21, 10041.1]
  - - [32, 2368, 1, 1280]
    - [38, 798.167]
  - - [3584, 1408, 1, 1280]
    - [21, 9608.51]
  - - [1024, 2944, 1, 256]
    - [23, 8659.69]
  - - [1, 2944, 1, 1280]
    - [56, 27.0247]
  - - [32, 1024, 1, 256]
    - [34, 214.433]
  - - [2944, 1856, 1, 1280]
    - [21, 9924.51]
  - - [3584, 1, 1, 1280]
    - [56, 32.7867]
  - - [256, 3584, 1, 32]
    - [33, 1535.57]
  - - [1024, 2368, 1, 1]
    - [39, 135.921]
  - - [2944, 3584, 1, 1280]
    - [21, 10022.0]
  - - [64, 1, 1, 1]
    - [45, 0.00610687]
  - - [1856, 4288, 1, 256]
    - [21, 9467.39]
  - - [256, 1, 1, 256]
    - [55, 1.92753]
  - - [256, 128, 1, 3328]
    - [12, 1472.08]
  - - [1, 1856, 1, 3328]
    - [56, 18.4535]
  - - [448, 3584, 1, 1]
    - [45, 110.886]
  - - [2368, 2944, 1, 32]
    - [25, 3231.24]
  - - [128, 4288, 1, 32]
    - [34, 1081.51]
  - - [448, 256, 1, 256]
    - [8, 2463.1]
  - - [64, 64, 1, 1]
    - [45, 0.343624]
  - - [1, 1408, 1, 1]
    - [40, 0.129412]
  - - [2944, 32, 1, 32]
    - [27, 179.444]
  - - [448, 1856, 1, 1]
    - [51, 66.2013]
  - - [4288, 704, 1, 256]
    - [21, 8726.29]
  - - [1856, 1024, 1, 256]
    - [21, 7898.36]
  - - [448, 1856, 1, 32]
    - [29, 1439.81]
  - - [448, 1856, 1, 3328]
    - [17, 6915.21]
  - - [448, 448, 1, 32]
    - [35, 330.377]
  - - [1024, 448, 1, 256]
    - [21, 5397.08]
  - - [6784, 1, 1, 256]
    - [55, 37.1091]
  - - [704, 6784, 1, 32]
    - [25, 2851.31]
  - - [1024, 4288, 1, 1]
    - [40, 177.626]
  - - [704, 256, 1, 3328]
    - [16, 4242.96]
  - - [704, 1856, 1, 32]
    - [33, 1880.03]
  - - [1408, 5888, 1, 1280]
    - [21, 10023.8]
  - - [32, 704, 1, 1280]
    - [38, 238.392]
  - - [5056, 1856, 1, 256]
    - [21, 9472.74]
  - - [6784, 704, 1, 1280]
    - [21, 9393.35]
  - - [704, 1408, 1, 32]
    - [33, 1585.97]
  - - [5888, 1024, 1, 256]
    - [21, 9320.68]
  - - [64, 2944, 1, 1]
    - [45, 14.5383]
  - - [64, 2944, 1, 32]
    - [29, 345.717]
  - - [64, 2944, 1, 1280]
    - [12, 4637.93]
  - - [6784, 1856, 1, 3328]
    - [21, 9901.31]
  - - [2368, 5888, 1, 1280]
    - [21, 10108.5]
  - - [5888, 6784, 1, 32]
    - [25, 3787.97]
  - - [1, 6784, 1, 256]
    - [55, 37.3645]
  - - [6784, 6784, 1, 32]
    - [25, 3798.03]
  - - [256, 1, 1, 1280]
    - [56, 2.51751]
  - - [5888, 128, 1, 32]
    - [29, 1272.01]
  - - [6784, 256, 1, 256]
    - [21, 7939.22]
  - - [2368, 3584, 1, 3328]
    - [21, 10026.9]
  - - [128, 4288, 1, 1280]
    - [21, 5662.04]
  - - [32, 3584, 1, 1280]
    - [38, 1263.78]
  - - [5888, 1024, 1, 1280]
    - [21, 9838.75]
  - - [1856, 704, 1, 3328]
    - [21, 8960.69]
  - - [5888, 6784, 1, 3328]
    - [21, 10157.2]
  - - [6784, 448, 1, 1]
    - [40, 150.16]
  - - [6784, 1856, 1, 1]
    - [41, 231.114]
  - - [128, 32, 1, 1280]
    - [38, 42.4731]
  - - [2944, 2368, 1, 1280]
    - [21, 9934.3]
  - - [128, 256, 1, 1]
    - [41, 3.25079]
  - - [6784, 448, 1, 32]
    - [29, 2511.76]
  - - [6784, 448, 1, 3328]
    - [21, 9299.89]
  - - [1, 6784, 1, 1]
    - [45, 0.724786]
  - - [448, 3584, 1, 1280]
    - [21, 8106.69]
  - - [1408, 6784, 1, 1280]
    - [21, 10030.2]
  - - [5056, 5888, 1, 1280]
    - [21, 10089.9]
  - - [32, 2944, 1, 32]
    - [27, 185.632]
  - - [5888, 704, 1, 1]
    - [45, 170.442]
  - - [3584, 1856, 1, 1]
    - [45, 200.359]
  - - [1, 256, 1, 256]
    - [56, 1.99319]
  - - [5056, 2944, 1, 32]
    - [25, 3639.33]
  - - [32, 6784, 1, 256]
    - [38, 1249.43]
  - - [4288, 6784, 1, 1]
    - [40, 252.516]
  - - [1, 4288, 1, 3328]
    - [55, 29.3148]
  - - [1024, 6784, 1, 1]
    - [46, 187.145]
  - - [2368, 5888, 1, 32]
    - [25, 3609.78]
  - - [448, 448, 1, 3328]
    - [16, 4706.47]
  - - [1, 256, 1, 1]
    - [42, 0.0323232]
  - - [3584, 4288, 1, 1]
    - [46, 240.429]
  - - [5888, 1024, 1, 3328]
    - [21, 9467.37]
  - - [6784, 5888, 1, 256]
    - [21, 9746.19]
  - - [704, 128, 1, 1280]
    - [14, 3232.72]
  - - [4288, 128, 1, 256]
    - [21, 5032.56]
  - - [5056, 1024, 1, 1]
    - [40, 187.043]
  - - [32, 3584, 1, 3328]
    - [38, 1328.61]
  - - [1024, 1, 1, 1280]
    - [56, 9.509]
  - - [4288, 2368, 1, 32]
    - [25, 3427.51]
  - - [704, 3584, 1, 1]
    - [42, 137.127]
  - - [704, 1856, 1, 3328]
    - [21, 8965.13]
  - - [2944, 128, 1, 1280]
    - [5, 5491.18]
  - - [1, 2368, 1, 3328]
    - [56, 23.4936]
  - - [6784, 704, 1, 32]
    - [25, 2847.06]
  - - [4288, 1, 1, 1280]
    - [55, 28.1526]
  - - [704, 5888, 1, 256]
    - [21, 9129.03]
  - - [2368, 3584, 1, 1280]
    - [21, 9964.81]
  - - [64, 448, 1, 256]
    - [3, 819.2]
  - - [1408, 448, 1, 1280]
    - [21, 6448.91]
  - - [3584, 5056, 1, 32]
    - [25, 3579.4]
  - - [1024, 32, 1, 1280]
    - [38, 346.522]
  - - [128, 2368, 1, 1]
    - [47, 28.703]
  - - [6784, 1856, 1, 1280]
    - [21, 9852.67]
  - - [5056, 5056, 1, 3328]
    - [22, 9686.26]
  - - [128, 704, 1, 1280]
    - [14, 3218.29]
  - - [128, 2944, 1, 1280]
    - [5, 5491.18]
  - - [2368, 5056, 1, 1]
    - [45, 230.597]
  - - [5888, 1408, 1, 256]
    - [23, 9430.85]
  - - [2368, 1024, 1, 32]
    - [25, 2359.93]
  - - [256, 256, 1, 3328]
    - [12, 2740.0]
  - - [64, 4288, 1, 1]
    - [40, 25.2235]
  - - [4288, 1024, 1, 256]
    - [21, 9195.63]
  - - [3584, 32, 1, 32]
    - [34, 278.032]
  - - [3584, 64, 1, 1]
    - [51, 22.5764]
  - - [704, 32, 1, 1280]
    - [38, 234.362]
  - - [32, 4288, 1, 32]
    - [38, 308.351]
  - - [64, 64, 1, 3328]
    - [12, 181.849]
  - - [64, 1408, 1, 1]
    - [47, 7.76828]
  - - [4288, 5888, 1, 1280]
    - [21, 10242.0]
  - - [1856, 2944, 1, 3328]
    - [21, 10013.9]
  - - [256, 1024, 1, 256]
    - [9, 4485.89]
  - - [5056, 5888, 1, 256]
    - [21, 9720.72]
  - - [1408, 128, 1, 1280]
    - [14, 4541.08]
  - - [5056, 256, 1, 3328]
    - [21, 8745.23]
  - - [1024, 5888, 1, 1280]
    - [21, 10040.5]
  - - [1024, 448, 1, 1]
    - [45, 42.477]
  - - [32, 32, 1, 32]
    - [29, 2.12228]
  - - [5056, 1, 1, 1280]
    - [55, 33.5668]
  - - [5888, 5056, 1, 1280]
    - [21, 10088.9]
  - - [5888, 2944, 1, 1]
    - [39, 240.485]
  - - [64, 4288, 1, 1280]
    - [7, 4480.52]
  - - [1408, 4288, 1, 3328]
    - [21, 9733.76]
  - - [704, 2944, 1, 32]
    - [25, 2355.2]
  - - [1, 5888, 1, 1280]
    - [55, 38.3738]
  - - [2944, 4288, 1, 3328]
    - [21, 10131.0]
  - - [256, 2944, 1, 256]
    - [21, 6755.53]
  - - [704, 448, 1, 32]
    - [34, 712.75]
  - - [5056, 2944, 1, 256]
    - [21, 9616.71]
  - - [704, 1024, 1, 256]
    - [21, 6535.03]
  - - [2368, 1856, 1, 256]
    - [21, 9216.27]
  - - [64, 3584, 1, 1]
    - [42, 16.4782]
  - - [1024, 128, 1, 1280]
    - [14, 4324.02]
  - - [2368, 4288, 1, 1280]
    - [21, 10118.6]
  - - [3584, 448, 1, 256]
    - [21, 7457.22]
  - - [256, 6784, 1, 256]
    - [21, 8054.28]
  - - [1024, 32, 1, 32]
    - [27, 69.7191]
  - - [1024, 1408, 1, 1]
    - [40, 101.249]
  - - [128, 64, 1, 32]
    - [27, 16.7184]
  - - [64, 1, 1, 1280]
    - [56, 0.585141]
  - - [2368, 32, 1, 32]
    - [27, 156.239]
  - - [256, 5888, 1, 1]
    - [45, 104.097]
  - - [2944, 2944, 1, 1]
    - [39, 219.31]
  - - [6784, 3584, 1, 256]
    - [21, 9704.91]
  - - [1408, 1856, 1, 256]
    - [21, 8821.09]
  - - [128, 1408, 1, 256]
    - [1, 3151.46]
  - - [2944, 2944, 1, 32]
    - [25, 3289.24]
  - - [2944, 2944, 1, 3328]
    - [21, 9956.17]
  - - [1, 2944, 1, 256]
    - [55, 18.5084]
  - - [448, 32, 1, 1280]
    - [38, 151.104]
  - - [3584, 1, 1, 256]
    - [51, 22.9836]
  - - [704, 32, 1, 3328]
    - [38, 257.321]
  - - [256, 448, 1, 3328]
    - [14, 4109.41]
  - - [128, 128, 1, 256]
    - [3, 480.998]
  - - [2368, 64, 1, 256]
    - [14, 2819.57]
  - - [64, 448, 1, 1280]
    - [12, 1200.92]
  - - [6784, 1408, 1, 32]
    - [25, 3402.27]
  - - [1408, 448, 1, 3328]
    - [21, 6608.06]
  - - [2368, 6784, 1, 3328]
    - [21, 10217.2]
  - - [256, 2368, 1, 1]
    - [53, 52.2593]
  - - [4288, 3584, 1, 32]
    - [25, 3494.76]
  - - [5888, 64, 1, 3328]
    - [5, 5642.98]
  - - [3584, 704, 1, 1280]
    - [21, 9206.43]
  - - [448, 5056, 1, 3328]
    - [21, 9224.45]
  - - [4288, 448, 1, 256]
    - [21, 7860.97]
  - - [5056, 256, 1, 1280]
    - [21, 8589.54]
  - - [704, 448, 1, 3328]
    - [16, 4684.15]
  - - [2944, 5888, 1, 32]
    - [25, 3647.4]
  - - [3584, 5056, 1, 256]
    - [21, 9740.68]
  - - [6784, 1, 1, 3328]
    - [55, 46.0157]
  - - [32, 2368, 1, 3328]
    - [38, 856.598]
  - - [4288, 256, 1, 1]
    - [41, 83.1612]
  - - [64, 256, 1, 1]
    - [45, 1.57538]
  - - [1856, 448, 1, 3328]
    - [21, 6895.91]
  - - [3584, 2368, 1, 256]
    - [21, 9475.97]
  - - [4288, 4288, 1, 256]
    - [21, 9722.11]
  - - [4288, 256, 1, 1280]
    - [21, 7429.63]
  - - [448, 5056, 1, 256]
    - [21, 8302.73]
  - - [128, 1856, 1, 1]
    - [42, 22.497]
  - - [4288, 704, 1, 1280]
    - [21, 9317.14]
  - - [128, 1856, 1, 32]
    - [38, 546.133]
  - - [2368, 704, 1, 1]
    - [45, 109.102]
  - - [3584, 32, 1, 256]
    - [38, 843.682]
  - - [448, 2368, 1, 1280]
    - [21, 7161.95]
  - - [3584, 256, 1, 1]
    - [40, 73.5179]
  - - [1408, 1856, 1, 1280]
    - [21, 9530.88]
  - - [3584, 4288, 1, 3328]
    - [21, 10260.3]
  - - [448, 4288, 1, 32]
    - [25, 2227.27]
  - - [448, 4288, 1, 1280]
    - [21, 8580.79]
  - - [64, 3584, 1, 256]
    - [9, 3989.15]
  - - [1, 6784, 1, 1280]
    - [55, 44.742]
  - - [5056, 1024, 1, 256]
    - [21, 9173.59]
  - - [2368, 448, 1, 32]
    - [29, 1625.85]
  - - [4288, 3584, 1, 1280]
    - [21, 10189.8]
  - - [32, 2944, 1, 1280]
    - [38, 959.47]
  - - [1408, 704, 1, 1]
    - [42, 74.194]
  - - [2368, 256, 1, 256]
    - [21, 5590.39]
  - - [1, 5056, 1, 1]
    - [45, 0.549565]
  - - [4288, 32, 1, 32]
    - [34, 345.197]
  - - [1856, 3584, 1, 32]
    - [25, 3047.84]
  - - [5056, 3584, 1, 3328]
    - [19, 9923.39]
  - - [4288, 5056, 1, 256]
    - [21, 9858.8]
  - - [1856, 5888, 1, 256]
    - [21, 9684.3]
  - - [256, 256, 1, 256]
    - [8, 1777.25]
  - - [2368, 3584, 1, 1]
    - [40, 215.185]
  - - [4288, 2368, 1, 256]
    - [21, 9630.33]
  - - [448, 1, 1, 3328]
    - [56, 4.43311]
  - - [1856, 256, 1, 1280]
    - [16, 6616.34]
  - - [256, 2944, 1, 1]
    - [41, 61.5739]
  - - [1408, 2944, 1, 3328]
    - [21, 9850.8]
  - - [32, 1856, 1, 32]
    - [27, 121.83]
  - - [5888, 3584, 1, 1]
    - [44, 246.526]
  - - [256, 1, 1, 1]
    - [47, 0.0336842]
  - - [6784, 5056, 1, 3328]
    - [21, 10162.1]
  - - [6784, 5056, 1, 1]
    - [39, 257.816]
  - - [5888, 3584, 1, 32]
    - [25, 3698.96]
  - - [5888, 3584, 1, 3328]
    - [21, 10089.6]
  - - [32, 1024, 1, 1280]
    - [38, 339.125]
  - - [1, 256, 1, 3328]
    - [56, 2.5943]
  - - [1024, 6784, 1, 256]
    - [21, 9423.4]
  - - [6784, 5888, 1, 32]
    - [25, 3772.77]
  - - [1408, 1, 1, 1280]
    - [56, 13.0597]
  - - [2368, 6784, 1, 32]
    - [25, 3607.98]
  - - [6784, 64, 1, 1]
    - [45, 42.4]
  - - [5056, 1408, 1, 1280]
    - [23, 9632.26]
  - - [3584, 1408, 1, 3328]
    - [21, 9686.9]
  - - [2944, 3584, 1, 1]
    - [39, 229.376]
  - - [2944, 1408, 1, 1280]
    - [21, 9756.17]
  - - [1856, 64, 1, 1]
    - [40, 9.89867]
  - - [3584, 1024, 1, 1]
    - [40, 163.84]
  - - [256, 32, 1, 256]
    - [38, 70.6588]
  - - [2944, 1856, 1, 3328]
    - [21, 10006.4]
  - - [128, 1024, 1, 3328]
    - [12, 4656.36]
  - - [1408, 128, 1, 1]
    - [45, 13.1743]
  - - [2944, 3584, 1, 32]
    - [25, 3467.97]
  - - [5888, 256, 1, 32]
    - [32, 1944.94]
  - - [6784, 64, 1, 256]
    - [21, 5145.79]
  - - [256, 128, 1, 1280]
    - [12, 1376.08]
  - - [6784, 5056, 1, 256]
    - [21, 9755.54]
  - - [1408, 32, 1, 3328]
    - [38, 507.261]
  - - [1856, 3584, 1, 1280]
    - [21, 9841.0]
  - - [256, 5888, 1, 256]
    - [21, 7894.35]
  - - [5056, 32, 1, 256]
    - [38, 978.704]
  - - [1024, 4288, 1, 3328]
    - [21, 9856.57]
  - - [448, 2368, 1, 256]
    - [21, 6553.6]
  - - [64, 1408, 1, 1280]
    - [12, 3232.72]
  - - [3584, 32, 1, 1280]
    - [38, 1228.25]
  - - [128, 2368, 1, 3328]
    - [5, 4560.26]
  - - [64, 5056, 1, 256]
    - [5, 4044.8]
  - - [256, 64, 1, 256]
    - [3, 468.114]
  - - [32, 1408, 1, 256]
    - [34, 319.688]
  - - [2368, 448, 1, 3328]
    - [21, 7310.24]
  - - [2368, 1408, 1, 1]
    - [40, 157.271]
  - - [1, 1, 1, 1]
    - [45, 8.99281e-05]
  - - [1024, 1856, 1, 32]
    - [25, 2153.59]
  - - [32, 1024, 1, 32]
    - [26, 65.536]
  - - [4288, 1, 1, 256]
    - [55, 24.2004]
  - - [1856, 128, 1, 3328]
    - [16, 5574.07]
  - - [5888, 2368, 1, 1]
    - [45, 235.839]
  - - [2368, 2368, 1, 1]
    - [40, 192.035]
  - - [704, 256, 1, 1280]
    - [16, 3999.42]
  - - [704, 4288, 1, 256]
    - [21, 8663.68]
  - - [5888, 2368, 1, 32]
    - [25, 3461.9]
  - - [5888, 2368, 1, 1280]
    - [20, 9612.39]
  - - [128, 256, 1, 256]
    - [3, 936.229]
  - - [2944, 5056, 1, 3328]
    - [21, 10283.5]
  - - [6784, 704, 1, 3328]
    - [21, 9461.34]
  - - [1856, 1856, 1, 32]
    - [25, 2701.75]
  - - [4288, 2944, 1, 32]
    - [25, 3428.07]
  - - [256, 5056, 1, 1]
    - [41, 92.4526]
  - - [704, 64, 1, 256]
    - [3, 1264.73]
  - - [256, 2368, 1, 3328]
    - [21, 6363.42]
  - - [704, 1, 1, 1]
    - [40, 0.0637681]
  - - [128, 448, 1, 1280]
    - [12, 2311.09]
  - - [5056, 5056, 1, 256]
    - [21, 9693.33]
  - - [5888, 256, 1, 256]
    - [21, 7830.28]
  - - [5888, 64, 1, 1]
    - [42, 37.6832]
  - - [6784, 6784, 1, 256]
    - [23, 9863.53]
  - - [256, 3584, 1, 1]
    - [40, 72.5873]
  - - [2368, 1, 1, 256]
    - [55, 15.3083]
  - - [448, 32, 1, 32]
    - [27, 30.1811]
  - - [704, 64, 1, 1]
    - [53, 3.83129]
  - - [3584, 704, 1, 3328]
    - [21, 9315.09]
  - - [4288, 704, 1, 3328]
    - [21, 9404.63]
  - - [4288, 2944, 1, 1280]
    - [21, 10053.9]
  - - [448, 3584, 1, 256]
    - [21, 7457.22]
  - - [704, 32, 1, 256]
    - [34, 158.788]
  - - [6784, 256, 1, 32]
    - [33, 2124.41]
  - - [1856, 128, 1, 1]
    - [42, 21.6759]
  - - [1856, 32, 1, 32]
    - [27, 127.725]
  - - [6784, 1408, 1, 1280]
    - [21, 9840.31]
  - - [2368, 5056, 1, 1280]
    - [21, 10145.2]
  - - [704, 1856, 1, 1280]
    - [21, 8765.61]
  - - [1408, 1408, 1, 1280]
    - [23, 8950.18]
  - - [448, 1024, 1, 3328]
    - [21, 6587.53]
  - - [32, 704, 1, 32]
    - [27, 47.1791]
  - - [256, 704, 1, 1]
    - [45, 13.5711]
  - - [5888, 1856, 1, 32]
    - [25, 3439.22]
  - - [5888, 704, 1, 3328]
    - [21, 9671.24]
  - - [5056, 1, 1, 256]
    - [55, 28.6358]
  - - [448, 6784, 1, 256]
    - [21, 8714.64]
  - - [1024, 128, 1, 1]
    - [47, 11.1456]
  - - [128, 64, 1, 256]
    - [3, 209.715]
  - - [1856, 128, 1, 256]
    - [9, 4154.19]
  - - [2944, 5888, 1, 256]
    - [21, 9745.2]
  - - [1024, 256, 1, 1280]
    - [16, 5777.28]
  - - [128, 5056, 1, 32]
    - [29, 1226.86]
  - - [128, 5056, 1, 1280]
    - [21, 6658.96]
  - - [448, 32, 1, 3328]
    - [38, 158.569]
  - - [1856, 1408, 1, 32]
    - [25, 2506.71]
  - - [64, 704, 1, 32]
    - [27, 91.4843]
  - - [64, 704, 1, 3328]
    - [12, 1979.23]
  - - [64, 2368, 1, 32]
    - [27, 297.161]
  - - [5888, 64, 1, 32]
    - [36, 757.451]
  - - [2368, 256, 1, 1]
    - [55, 48.265]
  - - [5888, 64, 1, 1280]
    - [11, 5451.46]
  - - [5056, 1, 1, 1]
    - [53, 0.5056]
  - - [5888, 2944, 1, 1280]
    - [23, 9808.6]
  - - [32, 2368, 1, 256]
    - [34, 529.439]
  - - [256, 1408, 1, 256]
    - [9, 4385.68]
  - - [448, 5888, 1, 1]
    - [45, 142.739]
  - - [3584, 1408, 1, 1]
    - [39, 183.902]
  - - [32, 6784, 1, 1280]
    - [38, 1561.78]
  - - [32, 6784, 1, 32]
    - [34, 482.418]
  - - [448, 5888, 1, 32]
    - [25, 2425.59]
  - - [5056, 704, 1, 1280]
    - [21, 9340.79]
  - - [1856, 6784, 1, 1]
    - [45, 231.454]
  - - [5056, 64, 1, 1]
    - [47, 31.355]
  - - [1, 5888, 1, 1]
    - [40, 0.623729]
  - - [2368, 1024, 1, 256]
    - [21, 8290.02]
  - - [1856, 6784, 1, 32]
    - [25, 3507.27]
  - - [1856, 6784, 1, 1280]
    - [21, 10056.3]
  - - [64, 3584, 1, 3328]
    - [13, 5381.86]
  - - [5888, 5056, 1, 3328]
    - [19, 9915.45]
  - - [1, 2944, 1, 3328]
    - [56, 29.1596]
  - - [1408, 6784, 1, 32]
    - [25, 3348.6]
  - - [32, 5888, 1, 1280]
    - [38, 1354.29]
  - - [448, 256, 1, 1]
    - [40, 9.49404]
  - - [3584, 5888, 1, 3328]
    - [21, 10294.5]
  - - [4288, 1408, 1, 256]
    - [21, 9191.25]
  - - [448, 64, 1, 1280]
    - [12, 1207.24]
  - - [128, 448, 1, 32]
    - [37, 106.687]
  - - [6784, 2368, 1, 256]
    - [21, 9569.32]
  - - [1408, 448, 1, 32]
    - [29, 1213.05]
  - - [1856, 1408, 1, 1280]
    - [21, 9539.58]
  - - [448, 256, 1, 3328]
    - [14, 4095.3]
  - - [1856, 2368, 1, 1]
    - [40, 177.218]
  - - [1408, 5056, 1, 3328]
    - [21, 9884.32]
  - - [128, 704, 1, 3328]
    - [12, 3477.42]
  - - [5056, 128, 1, 1280]
    - [5, 6663.25]
  - - [5056, 4288, 1, 256]
    - [21, 9677.28]
  - - [5056, 5056, 1, 32]
    - [25, 3723.69]
  - - [1856, 704, 1, 256]
    - [21, 7874.19]
  - - [64, 256, 1, 256]
    - [3, 485.452]
  - - [448, 5888, 1, 1280]
    - [21, 8831.38]
  - - [128, 6784, 1, 256]
    - [5, 6387.88]
  - - [5056, 448, 1, 256]
    - [21, 8255.45]
  - - [4288, 5888, 1, 1]
    - [40, 249.484]
  - - [1856, 5056, 1, 1280]
    - [21, 10114.7]
  - - [2368, 4288, 1, 1]
    - [45, 222.675]
  - - [2368, 32, 1, 3328]
    - [38, 851.278]
  - - [3584, 1856, 1, 256]
    - [21, 9352.41]
  - - [256, 3584, 1, 256]
    - [21, 6703.23]
  - - [64, 704, 1, 1]
    - [45, 3.83129]
  - - [4288, 5888, 1, 32]
    - [25, 3672.4]
  - - [4288, 5888, 1, 3328]
    - [21, 10292.6]
  - - [1, 1024, 1, 1]
    - [45, 0.0934307]
  - - [1024, 2944, 1, 3328]
    - [21, 9409.5]
  - - [2944, 2368, 1, 256]
    - [21, 9452.73]
  - - [1024, 1856, 1, 256]
    - [21, 7888.12]
  - - [2944, 64, 1, 3328]
    - [15, 4632.45]
  - - [1024, 5888, 1, 32]
    - [33, 2973.77]
  - - [1024, 5888, 1, 3328]
    - [21, 10125.9]
  - - [5056, 2368, 1, 32]
    - [25, 3339.64]
  - - [1408, 2368, 1, 1280]
    - [21, 9551.71]
  - - [256, 1, 1, 3328]
    - [56, 2.54106]
  - - [128, 1024, 1, 32]
    - [27, 259.549]
  - - [5056, 6784, 1, 3328]
    - [21, 10178.4]
  - - [448, 704, 1, 1]
    - [55, 27.9603]
  - - [32, 64, 1, 32]
    - [27, 4.20103]
  - - [448, 704, 1, 32]
    - [34, 678.262]
  - - [448, 704, 1, 3328]
    - [16, 4692.53]
  - - [1408, 2944, 1, 256]
    - [23, 9211.45]
  - - [64, 5888, 1, 1]
    - [50, 35.1522]
  - - [2368, 128, 1, 32]
    - [34, 684.981]
  - - [2368, 256, 1, 1280]
    - [21, 6253.6]
  - - [2368, 128, 1, 3328]
    - [11, 4556.97]
  - - [704, 5056, 1, 32]
    - [25, 2786.24]
  - - [32, 2368, 1, 32]
    - [27, 152.314]
  - - [1408, 1, 1, 256]
    - [55, 9.23279]
  - - [4288, 256, 1, 32]
    - [33, 1728.71]
  - - [448, 1408, 1, 1]
    - [51, 53.2757]
  - - [5056, 4288, 1, 1280]
    - [21, 10064.2]
  - - [1408, 256, 1, 256]
    - [21, 4402.42]
  - - [4288, 448, 1, 1]
    - [40, 87.3193]
  - - [256, 4288, 1, 32]
    - [29, 1701.9]
  - - [1408, 256, 1, 1280]
    - [16, 5103.69]
  - - [256, 256, 1, 1]
    - [40, 5.49799]
  - - [1408, 1, 1, 1]
    - [47, 0.129412]
  - - [448, 1408, 1, 256]
    - [21, 5750.74]
  - - [5888, 5888, 1, 1]
    - [44, 262.005]
  - - [128, 2944, 1, 32]
    - [34, 819.2]
  - - [32, 256, 1, 32]
    - [34, 23.4057]
  - - [2944, 704, 1, 1280]
    - [21, 9262.91]
  - - [1024, 3584, 1, 1280]
    - [21, 9799.78]
  - - [1856, 448, 1, 1]
    - [40, 66.6256]
  - - [2368, 2944, 1, 1]
    - [45, 204.56]
  - - [5056, 256, 1, 32]
    - [33, 1903.44]
  - - [4288, 1, 1, 3328]
    - [55, 29.31]
  - - [5056, 1024, 1, 1280]
    - [23, 9676.14]
  - - [704, 704, 1, 1]
    - [45, 43.6282]
  - - [1856, 448, 1, 1280]
    - [21, 6780.74]
  - - [3584, 6784, 1, 256]
    - [21, 9877.41]
  - - [64, 1856, 1, 1280]
    - [14, 3984.37]
  - - [1856, 1408, 1, 256]
    - [21, 8830.41]
  - - [4288, 4288, 1, 32]
    - [25, 3628.41]
  - - [128, 1, 1, 256]
    - [55, 0.835908]
  - - [32, 64, 1, 3328]
    - [38, 23.2334]
  - - [5888, 448, 1, 1]
    - [40, 139.126]
  - - [128, 5888, 1, 256]
    - [21, 6643.87]
  - - [3584, 256, 1, 3328]
    - [17, 7616.88]
  - - [5056, 5056, 1, 1280]
    - [21, 10067.7]
  - - [6784, 1408, 1, 3328]
    - [21, 9895.84]
  - - [448, 2368, 1, 1]
    - [53, 79.8843]
  - - [2368, 1, 1, 1280]
    - [56, 21.9259]
  - - [32, 3584, 1, 32]
    - [34, 273.067]
  - - [128, 6784, 1, 1]
    - [45, 72.8483]
  - - [1, 3584, 1, 1]
    - [40, 0.373333]
  - - [5888, 5888, 1, 3328]
    - [19, 10023.9]
  - - [256, 2944, 1, 3328]
    - [21, 7897.34]
  - - [1, 128, 1, 3328]
    - [56, 1.27114]
  - - [32, 256, 1, 256]
    - [38, 70.4688]
  - - [5888, 1408, 1, 32]
    - [25, 3390.72]
  - - [704, 256, 1, 1]
    - [45, 14.1686]
  - - [1, 448, 1, 1]
    - [46, 0.0533333]
  - - [256, 6784, 1, 3328]
    - [21, 8889.74]
  - - [64, 5888, 1, 256]
    - [5, 4637.93]
  - - [1856, 1, 1, 1]
    - [40, 0.170588]
  - - [1024, 256, 1, 3328]
    - [16, 6133.4]
  - - [704, 704, 1, 256]
    - [21, 5746.27]
  - - [448, 1024, 1, 32]
    - [29, 899.514]
  - - [6784, 2368, 1, 1280]
    - [21, 9952.06]
  - - [128, 1856, 1, 1280]
    - [13, 5271.97]
  - - [256, 2368, 1, 256]
    - [21, 5558.35]
  - - [2944, 1408, 1, 1]
    - [40, 173.874]
  - - [6784, 1024, 1, 256]
    - [21, 9270.15]
  - - [5056, 1408, 1, 32]
    - [25, 3178.06]
  - - [1408, 6784, 1, 3328]
    - [21, 10099.1]
  - - [2944, 1408, 1, 3328]
    - [21, 9849.68]
  - - [1856, 32, 1, 256]
    - [34, 424.229]
  - - [704, 2368, 1, 32]
    - [29, 2033.01]
  - - [448, 256, 1, 32]
    - [28, 220.554]
  - - [704, 6784, 1, 1]
    - [45, 182.566]
  - - [2368, 6784, 1, 256]
    - [21, 9712.16]
  - - [1856, 3584, 1, 3328]
    - [21, 9915.41]
  - - [1, 704, 1, 3328]
    - [56, 7.00464]
  - - [64, 1, 1, 3328]
    - [56, 0.635266]
  - - [448, 704, 1, 1280]
    - [9, 4542.1]
  - - [704, 1856, 1, 1]
    - [47, 93.8667]
  - - [704, 448, 1, 256]
    - [21, 3866.87]
  - - [448, 64, 1, 3328]
    - [12, 1293.66]
  - - [704, 6784, 1, 256]
    - [21, 9037.84]
  - - [256, 32, 1, 1280]
    - [38, 86.6878]
  - - [2368, 448, 1, 1280]
    - [21, 7195.35]
  - - [6784, 2944, 1, 32]
    - [25, 3684.89]
  - - [64, 4288, 1, 32]
    - [27, 620.185]
  - - [128, 704, 1, 1]
    - [47, 7.66258]
  - - [128, 448, 1, 3328]
    - [14, 2487.5]
  - - [5888, 2368, 1, 3328]
    - [21, 9960.49]
  - - [2368, 704, 1, 1280]
    - [21, 8432.87]
  - - [1024, 1408, 1, 1280]
    - [21, 8325.03]
  - - [4288, 64, 1, 1280]
    - [14, 4321.76]
  - - [128, 5056, 1, 1]
    - [51, 57.373]
  - - [2944, 5056, 1, 32]
    - [25, 3569.51]
  - - [448, 448, 1, 1]
    - [55, 14.336]
  - - [256, 2368, 1, 1280]
    - [21, 6241.52]
  - - [704, 2368, 1, 3328]
    - [21, 8534.36]
  - - [3584, 2944, 1, 256]
    - [21, 9559.5]
  - - [64, 6784, 1, 256]
    - [9, 5203.61]
  - - [3584, 1024, 1, 1280]
    - [21, 9780.19]
  - - [64, 1024, 1, 256]
    - [3, 1733.18]
  - - [1408, 32, 1, 32]
    - [27, 94.8547]
  - - [128, 3584, 1, 256]
    - [9, 5417.0]
  - - [704, 1408, 1, 1]
    - [42, 76.0147]
  - - [5056, 3584, 1, 256]
    - [21, 9587.67]
  - - [2368, 704, 1, 256]
    - [21, 7753.82]
  - - [1856, 1856, 1, 1280]
    - [21, 9219.77]
  - - [32, 5888, 1, 32]
    - [27, 440.739]
  - - [64, 32, 1, 32]
    - [27, 4.38075]
  - - [4288, 704, 1, 1]
    - [43, 117.553]
  - - [1856, 1024, 1, 1]
    - [45, 118.193]
  - - [4288, 2944, 1, 3328]
    - [21, 10118.2]
  - - [1024, 128, 1, 3328]
    - [12, 4668.32]
  - - [4288, 128, 1, 3328]
    - [16, 5784.83]
  - - [4288, 704, 1, 32]
    - [33, 2552.86]
  - - [1856, 1024, 1, 32]
    - [31, 2105.87]
  - - [1, 448, 1, 3328]
    - [56, 4.42154]
  - - [2944, 6784, 1, 1]
    - [44, 252.683]
  - - [6784, 2368, 1, 32]
    - [25, 3561.98]
  - - [5888, 5056, 1, 1]
    - [39, 255.403]
  - - [128, 6784, 1, 1280]
    - [11, 7146.93]
  - - [704, 5888, 1, 1]
    - [40, 174.459]
  - - [6784, 6784, 1, 1]
    - [44, 252.65]
  - - [1856, 32, 1, 1280]
    - [38, 630.572]
  - - [5888, 448, 1, 3328]
    - [21, 8787.11]
  - - [704, 5888, 1, 32]
    - [25, 2903.78]
  - - [704, 5888, 1, 1280]
    - [21, 9753.3]
  - - [1024, 6784, 1, 3328]
    - [21, 9994.39]
  - - [704, 2944, 1, 1280]
    - [21, 9252.57]
  - - [4288, 6784, 1, 256]
    - [21, 9912.4]
  - - [3584, 256, 1, 32]
    - [29, 1535.57]
  - - [1408, 1408, 1, 32]
    - [25, 2246.42]
  - - [1408, 1408, 1, 3328]
    - [23, 9045.79]
  - - [1024, 64, 1, 256]
    - [3, 1747.63]
  - - [4288, 64, 1, 32]
    - [34, 616.701]
  - - [1408, 256, 1, 32]
    - [34, 800.996]
  - - [5888, 128, 1, 256]
    - [21, 6755.53]
  - - [64, 704, 1, 1280]
    - [12, 1839.02]
  - - [2944, 1856, 1, 256]
    - [21, 9385.4]
  - - [128, 5056, 1, 3328]
    - [5, 6798.53]
  - - [4288, 2944, 1, 1]
    - [45, 231.037]
  - - [6784, 5056, 1, 32]
    - [25, 3746.58]
  - - [1024, 448, 1, 3328]
    - [16, 6647.19]
  - - [3584, 128, 1, 1]
    - [47, 43.774]
  - - [2944, 4288, 1, 1280]
    - [21, 10065.4]
  - - [64, 32, 1, 3328]
    - [38, 23.348]
  - - [1024, 4288, 1, 256]
    - [21, 9195.63]
  - - [128, 2368, 1, 256]
    - [0, 3848.94]
  - - [2368, 64, 1, 32]
    - [27, 298.625]
  - - [1408, 1, 1, 3328]
    - [56, 13.9659]
  - - [64, 1408, 1, 32]
    - [29, 180.224]
  - - [2368, 5888, 1, 1]
    - [45, 235.52]
  - - [1408, 1856, 1, 32]
    - [33, 2381.09]
  - - [448, 1856, 1, 256]
    - [21, 6102.66]
  - - [1856, 6784, 1, 3328]
    - [21, 10106.9]
  - - [3584, 128, 1, 256]
    - [9, 5417.0]
  - - [1024, 448, 1, 1280]
    - [21, 6404.91]
  - - [1024, 2368, 1, 32]
    - [25, 2377.29]
  - - [32, 2944, 1, 256]
    - [34, 599.335]
  - - [128, 5888, 1, 1]
    - [44, 63.2268]
  - - [64, 5056, 1, 1]
    - [47, 29.9615]
  - - [1856, 256, 1, 32]
    - [27, 950.272]
  - - [2368, 2368, 1, 3328]
    - [21, 9828.05]
  - - [64, 448, 1, 1]
    - [54, 2.8672]
  - - [3584, 5888, 1, 32]
    - [25, 3619.66]
  - - [3584, 5888, 1, 1280]
    - [21, 10238.4]
  - - [64, 5056, 1, 32]
    - [34, 739.621]
  - - [2944, 64, 1, 1]
    - [47, 14.188]
  - - [6784, 704, 1, 256]
    - [21, 8906.17]
  - - [3584, 1024, 1, 32]
    - [25, 2817.67]
  - - [1408, 704, 1, 32]
    - [29, 1598.76]
  - - [1408, 704, 1, 1280]
    - [21, 8042.45]
  - - [2368, 5888, 1, 256]
    - [21, 9680.39]
  - - [2944, 64, 1, 32]
    - [27, 347.311]
  - - [1, 1408, 1, 256]
    - [55, 9.25175]
  - - [64, 2944, 1, 256]
    - [1, 3387.25]
  - - [5888, 5888, 1, 32]
    - [25, 3752.01]
  - - [1856, 1408, 1, 3328]
    - [21, 9658.06]
  - - [1024, 1024, 1, 32]
    - [29, 1671.04]
  - - [4288, 1024, 1, 1]
    - [40, 175.356]
  - - [704, 4288, 1, 3328]
    - [21, 9420.87]
  - - [2944, 5056, 1, 1280]
    - [21, 10223.1]
  - - [6784, 2944, 1, 1280]
    - [21, 9995.1]
  - - [6784, 256, 1, 3328]
    - [21, 8751.89]
  - - [5056, 128, 1, 3328]
    - [5, 6800.25]
  - - [128, 128, 1, 1280]
    - [12, 686.241]
  - - [128, 4288, 1, 1]
    - [53, 48.6582]
  - - [1408, 5056, 1, 32]
    - [25, 3075.1]
  - - [2944, 128, 1, 3328]
    - [5, 5655.2]
  - - [5888, 1856, 1, 1280]
    - [21, 9930.71]
  - - [64, 128, 1, 256]
    - [3, 222.156]
  - - [5888, 256, 1, 1280]
    - [21, 8576.55]
  - - [1856, 5056, 1, 1]
    - [45, 203.292]
  - - [3584, 1856, 1, 1280]
    - [21, 9838.28]
  - - [6784, 448, 1, 256]
    - [21, 8546.17]
  - - [704, 3584, 1, 256]
    - [21, 8498.98]
  - - [1856, 5056, 1, 32]
    - [25, 3357.4]
  - - [1856, 5056, 1, 3328]
    - [21, 10189.0]
  - - [1024, 2944, 1, 32]
    - [25, 2571.14]
  - - [1408, 6784, 1, 256]
    - [21, 9575.81]
  - - [1024, 2368, 1, 1280]
    - [21, 8872.01]
  - - [1856, 3584, 1, 1]
    - [45, 201.329]
  - - [5888, 128, 1, 1280]
    - [21, 7670.88]
  - - [2944, 5888, 1, 1280]
    - [21, 10160.4]
  - - [1, 1856, 1, 1]
    - [50, 0.166906]
  - - [3584, 3584, 1, 256]
    - [21, 9749.57]
  - - [1856, 2368, 1, 3328]
    - [21, 9862.57]
  - - [5888, 704, 1, 256]
    - [21, 9041.91]
  - - [64, 448, 1, 32]
    - [27, 58.5143]
  - - [6784, 4288, 1, 256]
    - [21, 9746.34]
  - - [128, 64, 1, 3328]
    - [12, 361.77]
  - - [1, 5056, 1, 1280]
    - [55, 33.6086]
  - - [32, 64, 1, 1280]
    - [38, 21.2366]
  - - [1408, 2368, 1, 3328]
    - [21, 9646.71]
  - - [1024, 3584, 1, 256]
    - [21, 9160.73]
  - - [2944, 128, 1, 256]
    - [11, 4550.42]
  - - [6784, 128, 1, 1]
    - [42, 71.4105]
  - - [1408, 256, 1, 3328]
    - [16, 5246.55]
  - - [448, 32, 1, 256]
    - [34, 100.383]
  - - [1024, 32, 1, 256]
    - [34, 231.986]
  - - [1, 5888, 1, 256]
    - [55, 32.4855]
  - - [64, 2368, 1, 256]
    - [1, 3012.21]
  - - [2944, 256, 1, 256]
    - [21, 6793.59]
  - - [1, 128, 1, 256]
    - [55, 0.834216]
  - - [32, 256, 1, 1280]
    - [38, 92.0449]
  - - [5888, 1, 1, 256]
    - [55, 32.6544]
  - - [32, 128, 1, 3328]
    - [38, 46.696]
  - - [6784, 128, 1, 256]
    - [21, 6272.52]
  - - [6784, 64, 1, 1280]
    - [16, 6104.41]
  - - [4288, 1024, 1, 32]
    - [25, 2922.4]
  - - [1408, 64, 1, 3328]
    - [14, 3461.37]
  - - [2944, 448, 1, 1280]
    - [21, 7659.74]
  - - [6784, 32, 1, 1280]
    - [38, 1541.68]
  - - [2944, 64, 1, 1280]
    - [14, 4616.62]
  - - [704, 448, 1, 1]
    - [53, 29.8667]
  - - [32, 128, 1, 32]
    - [27, 8.53333]
  - - [1, 128, 1, 1]
    - [45, 0.0115942]
  - - [5888, 1, 1, 1]
    - [40, 0.598374]
  - - [5888, 1856, 1, 3328]
    - [20, 9825.58]
  - - [2368, 3584, 1, 256]
    - [21, 9485.87]
  - - [4288, 1408, 1, 3328]
    - [21, 9723.2]
  - - [1856, 32, 1, 3328]
    - [38, 667.939]
  - - [2944, 32, 1, 256]
    - [34, 638.698]
  - - [128, 64, 1, 1]
    - [56, 0.682667]
  - - [256, 1024, 1, 3328]
    - [16, 6147.23]
  - - [32, 448, 1, 256]
    - [34, 99.7287]
  - - [1856, 64, 1, 3328]
    - [14, 4263.52]
  - - [256, 5056, 1, 256]
    - [21, 7859.35]
  - - [5888, 2944, 1, 3328]
    - [21, 10008.4]
  - - [2368, 1408, 1, 3328]
    - [21, 9644.69]
  - - [5888, 704, 1, 32]
    - [33, 2772.68]
  - - [2944, 704, 1, 1]
    - [45, 122.783]
  - - [6784, 1856, 1, 256]
    - [21, 9453.67]
  - - [1, 704, 1, 256]
    - [55, 4.58819]
  - - [1856, 1856, 1, 1]
    - [40, 161.27]
  - - [5888, 32, 1, 256]
    - [38, 1118.61]
  - - [128, 704, 1, 256]
    - [12, 2135.99]
  - - [256, 1408, 1, 3328]
    - [16, 5242.88]
  - - [2944, 128, 1, 1]
    - [55, 30.7869]
  - - [32, 256, 1, 3328]
    - [38, 95.2452]
  - - [2944, 704, 1, 3328]
    - [21, 9391.04]
  - - [704, 1024, 1, 32]
    - [34, 1304.79]
  - - [2368, 1856, 1, 32]
    - [25, 2872.55]
  - - [5056, 4288, 1, 3328]
    - [19, 9931.21]
  - - [3584, 448, 1, 3328]
    - [21, 8223.87]
  - - [256, 32, 1, 32]
    - [34, 23.7449]
  - - [64, 256, 1, 3328]
    - [12, 739.235]
  - - [256, 6784, 1, 1]
    - [40, 114.861]
  - - [1024, 3584, 1, 32]
    - [25, 2796.2]
  - - [256, 6784, 1, 32]
    - [33, 2111.49]
  - - [2944, 1408, 1, 32]
    - [25, 2898.71]
  - - [4288, 3584, 1, 1]
    - [45, 240.128]
  - - [1, 704, 1, 1]
    - [47, 0.0633094]
  - - [5056, 448, 1, 3328]
    - [21, 9062.96]
  - - [3584, 64, 1, 256]
    - [9, 3989.15]
  - - [64, 1856, 1, 32]
    - [27, 241.186]
  - - [64, 1856, 1, 3328]
    - [14, 4252.51]
  - - [6784, 3584, 1, 32]
    - [25, 3756.49]
  - - [4288, 1856, 1, 256]
    - [21, 9439.32]
  - - [1856, 2944, 1, 256]
    - [21, 9385.4]
  - - [128, 448, 1, 1]
    - [47, 4.81074]
  - - [64, 128, 1, 32]
    - [27, 16.5495]
  - - [704, 1, 1, 1280]
    - [56, 6.37823]
  - - [2944, 5888, 1, 1]
    - [44, 240.487]
  - - [1024, 1856, 1, 3328]
    - [23, 8678.66]
  - - [5888, 1024, 1, 32]
    - [25, 3164.99]
  - - [3584, 256, 1, 1280]
    - [21, 7459.38]
  - - [1024, 1, 1, 1]
    - [50, 0.0941176]
  - - [1408, 5056, 1, 1280]
    - [21, 9815.72]
  - - [3584, 128, 1, 1280]
    - [16, 6416.11]
  - - [5056, 6784, 1, 256]
    - [21, 9751.21]
  - - [256, 1856, 1, 256]
    - [21, 5589.84]
  - - [5888, 32, 1, 1280]
    - [38, 1354.9]
  - - [256, 128, 1, 32]
    - [29, 64.251]
  - - [32, 1856, 1, 1280]
    - [38, 614.268]
  - - [2944, 5056, 1, 1]
    - [39, 240.078]
  - - [448, 128, 1, 1]
    - [47, 4.84324]
  - - [256, 704, 1, 32]
    - [30, 309.397]
  - - [256, 704, 1, 1280]
    - [16, 4004.98]
  - - [1, 2368, 1, 1]
    - [51, 0.20274]
  - - [5888, 5888, 1, 1280]
    - [21, 10089.1]
  - - [256, 2944, 1, 1280]
    - [21, 7710.12]
  - - [2944, 256, 1, 3328]
    - [21, 7893.36]
  - - [5056, 2944, 1, 1280]
    - [21, 10012.9]
  - - [704, 1024, 1, 3328]
    - [21, 7553.97]
  - - [2368, 1856, 1, 1280]
    - [21, 9772.11]
  - - [448, 2944, 1, 1]
    - [41, 96.4117]
  - - [6784, 2944, 1, 1]
    - [39, 249.651]
  - - [2944, 1024, 1, 32]
    - [25, 2661.95]
  - - [2944, 1024, 1, 1280]
    - [21, 9302.7]
  - - [1408, 64, 1, 32]
    - [29, 182.969]
  - - [5056, 5056, 1, 1]
    - [40, 248.281]
  - - [2368, 4288, 1, 256]
    - [21, 9656.07]
  - - [448, 1856, 1, 1280]
    - [21, 6756.63]
  - - [2368, 448, 1, 1]
    - [49, 76.2115]
  - - [448, 2944, 1, 32]
    - [33, 1838.2]
  - - [448, 2944, 1, 1280]
    - [21, 7643.1]
  - - [2944, 6784, 1, 1280]
    - [21, 10191.5]
  - - [256, 6784, 1, 1280]
    - [21, 8776.77]
  - - [128, 2368, 1, 1280]
    - [0, 4685.67]
  - - [3584, 2368, 1, 32]
    - [25, 3328.2]
  - - [704, 32, 1, 32]
    - [29, 46.9333]
  - - [6784, 3584, 1, 3328]
    - [19, 9976.77]
  - - [128, 32, 1, 256]
    - [34, 28.556]
  - - [128, 1408, 1, 1280]
    - [12, 4526.82]
  - - [64, 32, 1, 1280]
    - [38, 21.2366]
  - - [128, 1856, 1, 3328]
    - [13, 5570.93]
  - - [2944, 2944, 1, 256]
    - [21, 9456.13]
  - - [1408, 1024, 1, 3328]
    - [21, 8453.64]
  - - [5056, 2368, 1, 1280]
    - [21, 9949.7]
  - - [448, 128, 1, 32]
    - [27, 112.439]
  - - [2368, 64, 1, 3328]
    - [14, 4271.38]
  - - [32, 5056, 1, 3328]
    - [38, 1211.4]
  - - [448, 2944, 1, 3328]
    - [21, 7758.31]
  - - [2944, 1024, 1, 1]
    - [40, 151.948]
  - - [2368, 128, 1, 1280]
    - [11, 4445.16]
  - - [3584, 704, 1, 256]
    - [21, 8580.27]
  - - [2368, 5888, 1, 3328]
    - [21, 10162.4]
  - - [4288, 2368, 1, 1]
    - [40, 223.853]
  - - [1408, 3584, 1, 32]
    - [25, 3044.51]
  - - [2944, 4288, 1, 32]
    - [29, 3306.84]
  - - [5888, 1408, 1, 1280]
    - [23, 9867.2]
  - - [3584, 5056, 1, 1280]
    - [21, 10154.9]
  - - [5888, 6784, 1, 1280]
    - [20, 10023.6]
  - - [64, 1856, 1, 1]
    - [47, 10.1007]
  - - [704, 128, 1, 32]
    - [27, 183.902]
  - - [3584, 2944, 1, 1]
    - [41, 227.791]
  - - [128, 3584, 1, 3328]
    - [13, 6729.23]
  - - [256, 4288, 1, 3328]
    - [21, 7543.03]
  - - [4288, 64, 1, 1]
    - [40, 26.8]
  - - [1, 1408, 1, 1280]
    - [56, 12.8658]
  - - [5056, 32, 1, 1280]
    - [38, 1186.38]
  - - [1856, 704, 1, 32]
    - [33, 1866.61]
  - - [1024, 1856, 1, 1]
    - [40, 119.984]
  - - [704, 5056, 1, 3328]
    - [21, 9610.08]
  - - [1024, 3584, 1, 3328]
    - [21, 9909.31]
  - - [5888, 256, 1, 3328]
    - [21, 8696.92]
  - - [1856, 1408, 1, 1]
    - [45, 142.024]
  - - [2944, 448, 1, 32]
    - [33, 1851.1]
  - - [128, 448, 1, 256]
    - [3, 1609.66]
  - - [128, 1024, 1, 1]
    - [47, 10.996]
  - - [32, 32, 1, 256]
    - [34, 7.15459]
  - - [4288, 5056, 1, 1280]
    - [21, 10262.2]
  - - [1856, 1856, 1, 3328]
    - [21, 9300.43]
  - - [1024, 2368, 1, 256]
    - [21, 8316.68]
  - - [4288, 2368, 1, 3328]
    - [21, 10180.2]
  - - [256, 64, 1, 32]
    - [34, 43.9839]
  - - [1, 1024, 1, 1280]
    - [56, 9.53112]
  - - [5056, 128, 1, 32]
    - [27, 1262.77]
  - - [5888, 3584, 1, 256]
    - [21, 9660.69]
  - - [1024, 5056, 1, 32]
    - [25, 2941.67]
  - - [5888, 448, 1, 1280]
    - [21, 8691.35]
  - - [704, 5888, 1, 3328]
    - [21, 9854.19]
  - - [1024, 1408, 1, 256]
    - [21, 7588.38]
  - - [3584, 2944, 1, 1280]
    - [21, 10010.1]
  - - [1, 5056, 1, 256]
    - [55, 28.6865]
  - - [256, 1024, 1, 1]
    - [45, 23.2397]
  - - [32, 32, 1, 3328]
    - [38, 11.6964]
  - - [2368, 1, 1, 3328]
    - [56, 23.3988]
  - - [4288, 1856, 1, 1280]
    - [21, 9912.53]
  - - [3584, 5888, 1, 1]
    - [39, 246.987]
  - - [5888, 4288, 1, 256]
    - [21, 9675.77]
  - - [1024, 2944, 1, 1280]
    - [21, 9313.48]
  - - [6784, 1, 1, 1]
    - [53, 0.695082]
  - - [1408, 64, 1, 1280]
    - [14, 3203.98]
  - - [1, 256, 1, 1280]
    - [56, 2.47043]
  - - [2944, 3584, 1, 256]
    - [21, 9586.64]
  - - [1, 128, 1, 1280]
    - [56, 1.18519]
  - - [1024, 256, 1, 32]
    - [34, 606.113]
  - - [5888, 1, 1, 1280]
    - [55, 38.9934]
  - - [2368, 32, 1, 1280]
    - [38, 798.167]
  - - [5888, 1856, 1, 1]
    - [39, 202.974]
  - - [6784, 128, 1, 1280]
    - [11, 7132.25]
  - - [6784, 2368, 1, 3328]
    - [21, 10011.6]
  - - [1, 64, 1, 256]
    - [55, 0.415416]
  - - [704, 128, 1, 1]
    - [47, 7.76828]
  - - [1408, 4288, 1, 32]
    - [25, 3152.74]
  - - [256, 64, 1, 1280]
    - [12, 680.894]
  - - [256, 448, 1, 256]
    - [1, 2678.84]
  - - [1856, 1024, 1, 1280]
    - [23, 8544.17]
  - - [5888, 1856, 1, 256]
    - [21, 9505.3]
  - - [5056, 1856, 1, 1]
    - [40, 220.074]
  - - [5888, 2368, 1, 256]
    - [21, 9513.2]
  - - [1408, 1024, 1, 32]
    - [29, 1948.37]
  - - [32, 704, 1, 256]
    - [38, 156.377]
  - - [2944, 1, 1, 256]
    - [55, 18.6921]
  - - [32, 4288, 1, 256]
    - [34, 792.583]
  - - [5056, 1856, 1, 32]
    - [25, 3255.49]
  - - [5056, 1856, 1, 1280]
    - [21, 9913.69]
  - - [1, 64, 1, 1]
    - [40, 0.00571429]
  - - [1408, 5888, 1, 3328]
    - [21, 10099.2]
  - - [1408, 704, 1, 3328]
    - [17, 8212.56]
  - - [5056, 704, 1, 3328]
    - [21, 9429.53]
  - - [704, 64, 1, 1280]
    - [14, 1839.02]
  - - [1, 704, 1, 1280]
    - [56, 6.44394]
  - - [5888, 6784, 1, 1]
    - [39, 264.46]
  - - [5888, 4288, 1, 32]
    - [25, 3715.64]
  - - [1408, 3584, 1, 256]
    - [21, 9138.69]
  - - [1856, 704, 1, 1]
    - [42, 92.8]
  - - [6784, 256, 1, 1]
    - [45, 114.257]
  - - [2944, 1, 1, 1]
    - [40, 0.245333]
  - - [256, 1856, 1, 3328]
    - [16, 6954.84]
  - - [4288, 128, 1, 1280]
    - [9, 5669.35]
  - - [6784, 256, 1, 1280]
    - [21, 8618.88]
  - - [128, 4288, 1, 256]
    - [11, 5105.71]
  - - [128, 128, 1, 32]
    - [34, 43.4013]
  - - [128, 1408, 1, 32]
    - [33, 332.21]
  - - [6784, 128, 1, 32]
    - [33, 1516.77]
  - - [1408, 448, 1, 1]
    - [42, 53.6381]
  - - [2368, 704, 1, 3328]
    - [21, 8539.61]
  - - [704, 128, 1, 3328]
    - [14, 3458.17]
  - - [2944, 1856, 1, 32]
    - [25, 2977.69]
  - - [1024, 64, 1, 1]
    - [40, 5.53514]
  - - [1408, 32, 1, 1280]
    - [38, 470.559]
  - - [704, 1, 1, 256]
    - [55, 4.59755]
  - - [2368, 1408, 1, 256]
    - [21, 8965.77]
  - - [2368, 1856, 1, 1]
    - [40, 176.082]
  - - [4288, 1408, 1, 1]
    - [53, 186.343]
  - - [3584, 2368, 1, 1280]
    - [21, 9953.86]
  - - [64, 5056, 1, 1280]
    - [7, 4921.43]
  - - [1408, 2944, 1, 1]
    - [39, 173.874]
  - - [4288, 1408, 1, 32]
    - [25, 3169.29]
  - - [5888, 2944, 1, 256]
    - [21, 9570.34]
  - - [128, 64, 1, 1280]
    - [3, 326.05]
  - - [1408, 2944, 1, 32]
    - [25, 2893.65]
  - - [1, 3584, 1, 1280]
    - [56, 34.0319]
  - - [64, 64, 1, 32]
    - [27, 8.15124]
  - - [448, 1408, 1, 32]
    - [34, 1201.49]
  - - [128, 5056, 1, 256]
    - [21, 5916.96]
  - - [1, 1, 1, 1280]
    - [56, 0.00913242]
  - - [64, 704, 1, 256]
    - [3, 1264.73]
  - - [5888, 6784, 1, 256]
    - [21, 9743.22]
  - - [6784, 5888, 1, 1]
    - [39, 263.763]
  - - [64, 4288, 1, 256]
    - [1, 3769.02]
  - - [1, 448, 1, 1280]
    - [56, 4.15777]
  - - [1024, 1024, 1, 1]
    - [40, 78.4862]
  - - [6784, 5888, 1, 1280]
    - [19, 9977.93]
  - - [1024, 4288, 1, 32]
    - [33, 2828.28]
  - - [1856, 1, 1, 1280]
    - [56, 16.9982]
  - - [3584, 5888, 1, 256]
    - [21, 9822.3]
  - - [5056, 2368, 1, 1]
    - [46, 214.102]
  - - [256, 1408, 1, 1280]
    - [16, 5117.27]
  - - [64, 256, 1, 32]
    - [27, 33.6082]
  - - [64, 5888, 1, 3328]
    - [5, 5661.33]
  - - [6784, 64, 1, 3328]
    - [16, 6344.12]
  - - [5056, 448, 1, 1]
    - [40, 131.081]
  - - [2944, 448, 1, 3328]
    - [21, 7768.19]
  - - [2368, 1024, 1, 1280]
    - [21, 8869.98]
  - - [1856, 6784, 1, 256]
    - [21, 9639.12]
  - - [4288, 32, 1, 1280]
    - [38, 993.869]
  - - [448, 1408, 1, 1280]
    - [21, 6486.21]
  - - [5056, 448, 1, 32]
    - [33, 2305.43]
  - - [3584, 2944, 1, 32]
    - [25, 3493.81]
  - - [2368, 128, 1, 1]
    - [47, 25.9507]
  - - [32, 128, 1, 1280]
    - [38, 42.4729]
  - - [3584, 1856, 1, 32]
    - [25, 3133.99]
  - - [128, 128, 1, 3328]
    - [12, 732.876]
  - - [5056, 64, 1, 256]
    - [5, 4013.44]
  - - [64, 448, 1, 3328]
    - [12, 1295.07]
  - - [4288, 1408, 1, 1280]
    - [21, 9645.54]
  - - [6784, 2368, 1, 1]
    - [49, 233.768]
  - - [32, 5056, 1, 256]
    - [38, 960.546]
  - - [704, 128, 1, 256]
    - [8, 2135.99]
  - - [704, 5056, 1, 1]
    - [45, 163.576]
  - - [256, 1024, 1, 32]
    - [36, 548.993]
  - - [256, 1024, 1, 1280]
    - [16, 5809.29]
  - - [2368, 128, 1, 256]
    - [11, 3759.43]
  - - [32, 64, 1, 256]
    - [34, 14.2161]
  - - [2368, 1408, 1, 1280]
    - [21, 9536.34]
  - - [128, 256, 1, 32]
    - [27, 66.198]
  - - [64, 6784, 1, 32]
    - [34, 909.269]
  - - [6784, 32, 1, 256]
    - [38, 1265.36]
  - - [256, 4288, 1, 1]
    - [41, 82.1653]
  - - [5888, 1408, 1, 1]
    - [44, 189.449]
  - - [1024, 4288, 1, 1280]
    - [21, 9769.79]
  - - [1856, 4288, 1, 1]
    - [40, 211.663]
  - - [128, 2944, 1, 256]
    - [11, 4567.66]
  - - [3584, 4288, 1, 256]
    - [21, 9736.33]
  - - [2368, 2944, 1, 256]
    - [21, 9448.71]
  - - [3584, 128, 1, 32]
    - [29, 950.781]
  - - [3584, 128, 1, 3328]
    - [16, 6696.17]
  - - [704, 5056, 1, 256]
    - [21, 8891.61]
  - - [1856, 4288, 1, 32]
    - [25, 3292.05]
  - - [64, 256, 1, 1280]
    - [12, 684.449]
  - - [4288, 1024, 1, 1280]
    - [21, 9752.16]
  - - [1, 4288, 1, 256]
    - [55, 24.1577]
  - - [64, 2368, 1, 1]
    - [47, 12.3817]
  - - [4288, 6784, 1, 32]
    - [25, 3693.94]
  - - [704, 704, 1, 3328]
    - [21, 7109.53]
  - - [128, 2944, 1, 1]
    - [53, 36.2338]
  - - [3584, 1408, 1, 256]
    - [23, 9087.27]
  - - [704, 3584, 1, 3328]
    - [21, 9327.51]
  - - [5056, 448, 1, 1280]
    - [21, 8939.67]
  - - [1408, 2944, 1, 1280]
    - [21, 9760.48]
  - - [5888, 704, 1, 1280]
    - [21, 9570.33]
  - - [64, 64, 1, 256]
    - [3, 104.025]
  - - [704, 1408, 1, 1280]
    - [10, 8067.0]
  - - [4288, 5888, 1, 256]
    - [21, 9808.52]
  - - [6784, 64, 1, 32]
    - [30, 918.891]
  - - [3584, 3584, 1, 3328]
    - [21, 10292.5]
  - - [2944, 6784, 1, 32]
    - [25, 3654.55]
  - - [448, 64, 1, 32]
    - [27, 56.7762]
  - - [5056, 256, 1, 1]
    - [41, 94.0651]
  - - [64, 6784, 1, 1280]
    - [16, 6109.78]
  - - [2944, 2368, 1, 3328]
    - [21, 10014.8]
  - - [1, 4288, 1, 1]
    - [53, 0.397037]
  - - [1408, 128, 1, 256]
    - [9, 3134.33]
  - - [1024, 1856, 1, 1280]
    - [23, 8548.98]
  - - [448, 5888, 1, 256]
    - [21, 8235.16]
  - - [1024, 5888, 1, 256]
    - [21, 9467.03]
  - - [704, 1408, 1, 256]
    - [21, 7111.98]
  - - [6784, 2944, 1, 3328]
    - [21, 10044.1]
  - - [1408, 2368, 1, 256]
    - [21, 8905.89]
  - - [64, 128, 1, 1280]
    - [3, 327.675]
  - - [5888, 32, 1, 3328]
    - [38, 1415.33]
  - - [1408, 5056, 1, 256]
    - [21, 9366.9]
  - - [1024, 1408, 1, 32]
    - [33, 1884.7]
  - - [4288, 128, 1, 32]
    - [27, 1081.51]
  - - [6784, 704, 1, 1]
    - [40, 180.907]
  - - [448, 704, 1, 256]
    - [21, 3866.87]
  - - [704, 3584, 1, 32]
    - [25, 2449.65]
  - - [1856, 256, 1, 3328]
    - [16, 6964.64]
  - - [448, 1024, 1, 1280]
    - [21, 6393.76]
  - - [4288, 4288, 1, 1]
    - [40, 239.164]
  - - [5056, 2944, 1, 1]
    - [40, 238.539]
  - - [64, 2368, 1, 3328]
    - [12, 4306.4]
  - - [256, 704, 1, 3328]
    - [16, 4235.77]
  - - [1, 2944, 1, 1]
    - [45, 0.242105]
  - - [1024, 1024, 1, 256]
    - [21, 7557.3]
  - - [3584, 1, 1, 1]
    - [40, 0.367213]
  - - [256, 2944, 1, 32]
    - [33, 1328.04]
  - - [6784, 4288, 1, 3328]
    - [20, 10071.9]
  - - [5056, 2944, 1, 3328]
    - [20, 9797.94]
  - - [704, 1024, 1, 1280]
    - [21, 7398.55]
  - - [256, 3584, 1, 1280]
    - [21, 7444.25]
  - - [2368, 1856, 1, 3328]
    - [21, 9854.59]
  - - [1856, 4288, 1, 1280]
    - [21, 9934.97]
  - - [1, 1024, 1, 256]
    - [55, 6.68735]
  - - [3584, 448, 1, 1]
    - [51, 104.533]
  - - [2944, 1024, 1, 3328]
    - [21, 9404.55]
  - - [32, 1408, 1, 3328]
    - [38, 506.576]
  - - [128, 1, 1, 3328]
    - [56, 1.27114]
  - - [5888, 5056, 1, 32]
    - [25, 3705.01]
  - - [704, 2944, 1, 1]
    - [47, 123.958]
  - - [3584, 448, 1, 32]
    - [33, 2013.33]
  - - [3584, 448, 1, 1280]
    - [21, 8093.92]
  - - [2944, 6784, 1, 3328]
    - [21, 10252.2]
  - - [1856, 2368, 1, 1280]
    - [21, 9769.4]
  - - [6784, 1024, 1, 1280]
    - [21, 9720.91]
  - - [6784, 3584, 1, 1280]
    - [21, 10084.8]
  - - [1, 5056, 1, 3328]
    - [55, 34.1666]
  - - [128, 128, 1, 1]
    - [55, 1.8789]
  - - [128, 2368, 1, 32]
    - [34, 688.873]
  - - [128, 1408, 1, 3328]
    - [12, 4691.69]
  - - [2944, 32, 1, 3328]
    - [38, 1055.5]
  - - [704, 1856, 1, 256]
    - [21, 7844.65]
  - - [1408, 1408, 1, 1]
    - [40, 119.714]
  - - [1408, 4288, 1, 256]
    - [21, 9204.39]
  - - [256, 5056, 1, 3328]
    - [21, 8876.42]
  - - [2368, 64, 1, 1280]
    - [14, 4054.9]
  - - [1856, 448, 1, 32]
    - [33, 1433.6]
  - - [1408, 448, 1, 256]
    - [21, 5718.16]
  - - [32, 128, 1, 256]
    - [34, 26.859]
  - - [448, 1024, 1, 1]
    - [45, 39.0095]
  - - [128, 1024, 1, 1280]
    - [12, 4378.19]
  - - [448, 6784, 1, 1]
    - [40, 153.187]
  - - [704, 2944, 1, 256]
    - [21, 8427.25]
  - - [1408, 1408, 1, 256]
    - [23, 8303.51]
  - - [448, 6784, 1, 32]
    - [33, 2475.95]
  - - [1, 64, 1, 1280]
    - [56, 0.584141]
  - - [1408, 1856, 1, 1]
    - [45, 140.8]
  - - [4288, 448, 1, 32]
    - [33, 2134.47]
  - - [4288, 448, 1, 1280]
    - [21, 8561.67]
  - - [2944, 704, 1, 32]
    - [29, 2240.62]
  - - [1024, 704, 1, 256]
    - [21, 6372.56]
  - - [448, 4288, 1, 1]
    - [40, 120.064]
  - - [3584, 5056, 1, 1]
    - [40, 244.346]
  - - [1408, 3584, 1, 1280]
    - [21, 9607.37]
  - - [6784, 448, 1, 1280]
    - [21, 9201.07]
  - - [3584, 5056, 1, 3328]
    - [21, 10224.4]
  - - [2368, 2368, 1, 32]
    - [25, 3115.24]
  - - [64, 5888, 1, 32]
    - [34, 823.677]
  - - [1856, 448, 1, 256]
    - [21, 6173.46]
  - - [128, 1024, 1, 256]
    - [12, 2853.27]
  - - [3584, 64, 1, 3328]
    - [16, 5369.75]
  - - [5888, 2944, 1, 32]
    - [25, 3628.31]
  - - [2944, 1, 1, 1280]
    - [56, 27.1024]
  - - [1856, 2944, 1, 32]
    - [25, 3069.7]
  - - [5056, 1408, 1, 1]
    - [45, 204.095]
  - - [5888, 1408, 1, 3328]
    - [21, 9895.17]
  - - [448, 4288, 1, 256]
    - [21, 7911.55]
  - - [6784, 1024, 1, 1]
    - [46, 205.284]
  - - [256, 448, 1, 1]
    - [47, 9.49404]
  - - [128, 5888, 1, 3328]
    - [21, 7903.31]
  - - [6784, 1024, 1, 32]
    - [25, 3246.18]
  - - [256, 448, 1, 32]
    - [29, 224.878]
  - - [6784, 3584, 1, 1]
    - [45, 252.638]
  - - [2944, 2368, 1, 32]
    - [25, 3150.91]
  - - [3584, 6784, 1, 3328]
    - [21, 10349.4]
  - - [448, 128, 1, 1280]
    - [14, 2328.69]
  - - [64, 3584, 1, 32]
    - [27, 397.188]
  - - [64, 3584, 1, 1280]
    - [16, 5111.44]
  - - [6784, 1408, 1, 256]
    - [21, 9410.71]
  - - [5056, 1024, 1, 32]
    - [29, 2962.71]
  - - [1024, 5056, 1, 1280]
    - [21, 9865.13]
  - - [4288, 3584, 1, 256]
    - [21, 9765.33]
  - - [2368, 256, 1, 3328]
    - [21, 6361.82]
  - - [448, 6784, 1, 1280]
    - [21, 9369.5]
  - - [1856, 5888, 1, 1]
    - [45, 226.162]
  - - [256, 5888, 1, 32]
    - [25, 1976.82]
  - - [3584, 1, 1, 3328]
    - [56, 35.6259]
  - - [4288, 32, 1, 256]
    - [38, 831.612]
  - - [256, 64, 1, 1]
    - [47, 1.86182]
  - - [4288, 5056, 1, 32]
    - [25, 3676.16]
  - - [4288, 5056, 1, 3328]
    - [21, 10318.7]
  - - [1856, 5888, 1, 32]
    - [25, 3458.27]
  - - [1856, 5888, 1, 1280]
    - [21, 10133.3]
  - - [256, 256, 1, 1280]
    - [12, 2595.49]
  - - [704, 2368, 1, 1280]
    - [21, 8419.56]
  - - [4288, 2368, 1, 1280]
    - [21, 10112.3]
  - - [2944, 5056, 1, 256]
    - [21, 9790.66]
  - - [32, 1856, 1, 256]
    - [34, 391.058]
  - - [64, 5888, 1, 1280]
    - [11, 5506.22]
  - - [1, 1856, 1, 1280]
    - [56, 16.9691]
  - - [2944, 4288, 1, 1]
    - [46, 232.741]
  - - [5056, 5888, 1, 32]
    - [25, 3723.54]
  - - [704, 1, 1, 3328]
    - [56, 6.99459]
  - - [448, 256, 1, 1280]
    - [14, 3791.34]
  - - [1408, 256, 1, 1]
    - [47, 32.4144]
  - - [2368, 5056, 1, 3328]
    - [21, 10218.7]
  - - [1024, 5056, 1, 3328]
    - [21, 9952.29]
  - - [704, 704, 1, 1280]
    - [21, 6895.53]
  - - [128, 32, 1, 3328]
    - [38, 46.5556]
  - - [1024, 6784, 1, 32]
    - [25, 3104.72]
  - - [3584, 2944, 1, 3328]
    - [21, 10082.8]
  - - [128, 1856, 1, 256]
    - [4, 4131.62]
  - - [32, 32, 1, 1280]
    - [38, 10.8288]
  - - [1408, 5888, 1, 1]
    - [44, 198.143]
  - - [1, 3584, 1, 256]
    - [56, 26.244]
  - - [704, 4288, 1, 32]
    - [25, 2630.72]
  - - [1408, 5888, 1, 32]
    - [25, 3376.91]
  - - [6784, 1024, 1, 3328]
    - [21, 9789.87]
  - - [1856, 1, 1, 3328]
    - [56, 18.4579]
  - - [5056, 1408, 1, 256]
    - [21, 9200.45]
  - - [1, 1, 1, 256]
    - [55, 0.00650406]
  - - [2944, 1408, 1, 256]
    - [21, 9185.93]
  - - [4288, 1, 1, 1]
    - [47, 0.4288]
  - - [2368, 2368, 1, 256]
    - [21, 9263.68]
  - - [1, 448, 1, 256]
    - [55, 2.90791]
  - - [1408, 6784, 1, 1]
    - [39, 209.104]
  - - [3584, 32, 1, 3328]
    - [38, 1332.32]
  - - [128, 3584, 1, 1]
    - [47, 42.1647]
  - - [1856, 1, 1, 256]
    - [55, 12.1207]
  - - [6784, 6784, 1, 1280]
    - [21, 10129.9]
  - - [1024, 5888, 1, 1]
    - [39, 168.983]
  - - [6784, 32, 1, 3328]
    - [38, 1615.83]
  - - [1408, 32, 1, 256]
    - [34, 316.182]
  - - [128, 3584, 1, 32]
    - [33, 945.88]
  - - [1856, 3584, 1, 256]
    - [21, 9368.88]
  - - [2944, 64, 1, 256]
    - [4, 3276.8]
  - - [2368, 704, 1, 32]
    - [29, 2014.59]
  - - [256, 5888, 1, 1280]
    - [21, 8719.18]
  - - [448, 2368, 1, 32]
    - [33, 1478.56]
  - - [448, 2368, 1, 3328]
    - [21, 7299.36]
  - - [64, 1408, 1, 256]
    - [3, 2235.34]
  - - [5056, 32, 1, 32]
    - [27, 399.486]
  - - [1024, 704, 1, 3328]
    - [21, 7553.97]
  - - [32, 5888, 1, 3328]
    - [38, 1408.97]
  - - [256, 64, 1, 3328]
    - [12, 738.434]
  - - [32, 1408, 1, 1280]
    - [38, 477.099]
  - - [64, 32, 1, 256]
    - [34, 14.3092]
  - - [1856, 1024, 1, 3328]
    - [23, 8677.71]
  - - [2368, 1, 1, 1]
    - [45, 0.208451]
  - - [5056, 2368, 1, 3328]
    - [21, 10011.7]
  - - [128, 1, 1, 1280]
    - [56, 1.17029]
  - - [704, 4288, 1, 1280]
    - [21, 9320.73]
  - - [704, 256, 1, 256]
    - [9, 3019.46]
  - - [512, 128, 1, 784]
    - [57, 2335.46]
  - - [1024, 256, 1, 196]
    - [61, 6422.53]
  - - [256, 64, 1, 3136]
    - [59, 699.622]
  - - [256, 1024, 1, 196]
    - [58, 6553.6]
  - - [64, 256, 1, 3136]
    - [62, 745.938]
  - - [128, 512, 1, 784]
    - [60, 2343.99]
  - - [64, 64, 1, 3136]
    - [61, 173.394]
  - - [2560, 7000, 1, 2560]
    - [78, 16137.8]
  - - [7680, 12000, 1, 2560]
    - [78, 17417.3]
  - - [5124, 9124, 1, 1760]
    - [74, 16765.5]
  - - [1760, 32, 1, 1760]
    - [64, 2058.21]
  - - [512, 24000, 1, 1536]
    - [78, 15627.6]
  - - [3072, 24000, 1, 1024]
    - [78, 15979.2]
  - - [2048, 400, 1, 512]
    - [79, 8566.8]
  - - [2560, 128, 1, 2560]
    - [68, 6425.1]
  - - [3072, 16, 1, 1024]
    - [69, 1388.84]
  - - [512, 48000, 1, 2816]
    - [78, 17041.1]
  - - [512, 48000, 1, 2048]
    - [79, 13666.4]
  - - [1760, 64, 1, 1760]
    - [64, 3977.66]
  - - [2048, 1600, 1, 2048]
    - [79, 8132.44]
  - - [512, 48000, 1, 1536]
    - [78, 16411.9]
  - - [2560, 32, 1, 2560]
    - [64, 2919.2]
  - - [8448, 5984, 1, 2816]
    - [78, 17042.5]
  - - [4096, 3200, 1, 1024]
    - [79, 13560.6]
  - - [1024, 24000, 1, 2560]
    - [78, 16564.8]
  - - [1760, 6400, 1, 1760]
    - [74, 16926.8]
  - - [5124, 9124, 1, 2048]
    - [79, 13714.0]
  - - [1024, 700, 1, 512]
    - [73, 7304.97]
  - - [4608, 32, 1, 1536]
    - [64, 4437.55]
  - - [3072, 64, 1, 1024]
    - [69, 4026.53]
  - - [16384, 3200, 1, 4096]
    - [79, 14198.9]
  - - [2560, 16, 1, 2560]
    - [68, 1508.31]
  - - [1024, 48000, 1, 2560]
    - [78, 17206.1]
  - - [8448, 48000, 1, 2816]
    - [78, 15639.3]
  - - [2048, 32, 1, 2048]
    - [66, 1622.55]
  - - [2560, 3200, 1, 2560]
    - [78, 15546.4]
  - - [16384, 800, 1, 4096]
    - [79, 11602.3]
  - - [4608, 24000, 1, 1536]
    - [78, 17258.8]
  - - [7680, 48000, 1, 2560]
    - [78, 16396.9]
  - - [3072, 48000, 1, 1024]
    - [78, 16635.3]
  - - [1760, 16, 1, 1760]
    - [66, 980.253]
  - - [8192, 3200, 1, 2048]
    - [79, 13580.9]
  - - [512, 24000, 1, 2816]
    - [78, 16863.1]
  - - [4096, 400, 1, 1024]
    - [79, 10185.3]
  - - [6144, 48000, 1, 2560]
    - [78, 17453.5]
  - - [4608, 48000, 1, 1536]
    - [78, 17440.2]
  - - [4096, 128, 1, 4096]
    - [69, 4579.25]
  - - [2048, 800, 1, 512]
    - [78, 10402.5]
  - - [4608, 5984, 1, 1536]
    - [78, 16367.1]
  - - [4096, 1600, 1, 1024]
    - [79, 12198.1]
  - - [6144, 5984, 1, 2048]
    - [79, 13951.2]
  - - [7680, 24000, 1, 2560]
    - [78, 17331.0]
  - - [6144, 48000, 1, 2048]
    - [79, 14769.8]
  - - [2048, 3200, 1, 2048]
    - [79, 11336.0]
  - - [5124, 9124, 1, 2560]
    - [78, 16462.5]
  - - [1024, 24000, 1, 1536]
    - [78, 16343.1]
  - - [7680, 16, 1, 2560]
    - [66, 2919.2]
  - - [2560, 6400, 1, 2560]
    - [78, 16353.8]
  - - [2048, 128, 1, 2048]
    - [66, 3513.55]
  - - [512, 16, 1, 500000]
    - [66, 307.342]
  - - [1024, 8, 1, 500000]
    - [64, 308.821]
  - - [512, 24000, 1, 2560]
    - [78, 16086.4]
  - - [1024, 24000, 1, 2816]
    - [78, 17012.3]
  - - [7680, 5984, 1, 2560]
    - [78, 17049.2]
  - - [2048, 1600, 1, 512]
    - [79, 10506.8]
  - - [2048, 7000, 1, 2048]
    - [79, 12810.7]
  - - [1760, 800, 1, 1760]
    - [71, 11553.9]
  - - [4096, 64, 1, 4096]
    - [66, 3569.62]
  - - [7680, 32, 1, 2560]
    - [66, 5765.63]
  - - [2560, 64, 1, 2560]
    - [68, 5253.39]
  - - [3072, 128, 1, 1024]
    - [69, 5130.65]
  - - [7680, 64, 1, 2560]
    - [73, 6667.5]
  - - [1760, 128, 1, 1760]
    - [64, 6931.69]
  - - [2560, 1600, 1, 2560]
    - [78, 12198.4]
  - - [2048, 3200, 1, 512]
    - [79, 12372.6]
  - - [2560, 800, 1, 2560]
    - [78, 10495.8]
  - - [3072, 32, 1, 1024]
    - [66, 2677.22]
  - - [6144, 32, 1, 2560]
    - [64, 5354.43]
  - - [4608, 12000, 1, 1536]
    - [78, 16965.2]
  - - [4096, 32, 1, 4096]
    - [70, 2331.79]
  - - [6144, 24000, 1, 2048]
    - [79, 14617.2]
  - - [8192, 800, 1, 2048]
    - [79, 10239.4]
  - - [5124, 9124, 1, 4096]
    - [79, 13825.1]
  - - [8448, 24000, 1, 2816]
    - [78, 17284.5]
  - - [1024, 48000, 1, 1536]
    - [78, 16922.2]
  - - [7680, 128, 1, 2560]
    - [73, 11685.5]
  - - [8192, 1600, 1, 2048]
    - [79, 12203.4]
  - - [4096, 800, 1, 1024]
    - [79, 10420.6]
  - - [1024, 16, 1, 500000]
    - [66, 614.679]
  - - [2048, 800, 1, 2048]
    - [77, 7507.26]
  - - [1760, 3200, 1, 1760]
    - [74, 15165.7]
  - - [512, 48000, 1, 2560]
    - [78, 16707.7]
  - - [8448, 16, 1, 2816]
    - [65, 3408.25]
  - - [2048, 64, 1, 2048]
    - [66, 2897.62]
  - - [512, 24000, 1, 2048]
    - [79, 12518.3]
  - - [16384, 1600, 1, 4096]
    - [79, 13160.1]
  - - [4608, 16, 1, 1536]
    - [64, 2250.52]
  - - [1024, 24000, 1, 2048]
    - [79, 13613.5]
  - - [8192, 400, 1, 2048]
    - [79, 8130.86]
  - - [2048, 6400, 1, 2048]
    - [79, 12671.6]
  - - [6144, 12000, 1, 2048]
    - [79, 14419.8]
  - - [512, 8, 1, 500000]
    - [64, 154.817]
  - - [1760, 7000, 1, 1760]
    - [74, 15775.6]
  - - [1024, 48000, 1, 2816]
    - [78, 17431.7]
  - - [6144, 16, 1, 2560]
    - [68, 2774.01]
  - - [8448, 32, 1, 2816]
    - [68, 6068.77]
  - - [4096, 7000, 1, 4096]
    - [79, 13834.0]
  - - [4096, 16, 1, 4096]
    - [67, 1181.49]
  - - [6144, 24000, 1, 2560]
    - [78, 17224.4]
  - - [1024, 1024, 1, 1024]
    - [79, 10502.2]
  - - [2048, 16, 1, 2048]
    - [69, 858.609]
  - - [8448, 12000, 1, 2816]
    - [78, 17285.6]
  - - [16384, 400, 1, 4096]
    - [79, 9542.53]
  - - [1760, 1600, 1, 1760]
    - [72, 14824.6]
  - - [1024, 48000, 1, 2048]
    - [79, 14216.2]
  - - [512, 512, 64, 64]
    - [95, 12135.4]
  - - [512, 512, 256, 64]
    - [96, 12755.3]
  - - [512, 512, 128, 64]
    - [97, 12596.7]
  - - [512, 512, 40, 64]
    - [97, 12035.3]
  - - [1024, 1024, 64, 96]
    - [96, 13355.0]
  - - [1024, 1024, 128, 96]
    - [96, 13489.2]
  - - [1024, 1024, 256, 64]
    - [96, 12996.2]
  - - [1024, 1024, 32, 64]
    - [95, 12608.5]
  - - [1024, 1024, 64, 64]
    - [96, 12734.1]
  - - [64, 512, 64, 512]
    - [98, 10222.2]
  - - [64, 512, 256, 512]
    - [97, 12644.2]
  - - [64, 512, 128, 512]
    - [97, 11101.5]
  - - [64, 512, 40, 512]
    - [98, 9372.75]
  - - [96, 1024, 64, 1024]
    - [99, 10856.1]
  - - [96, 1024, 128, 1024]
    - [100, 12126.3]
  - - [64, 1024, 256, 1024]
    - [97, 12270.6]
  - - [64, 1024, 32, 1024]
    - [98, 9953.11]
  - - [64, 1024, 64, 1024]
    - [98, 10841.5]
- null
