library/src/blas3/Tensile/Logic/asm_ci/vega20_Cijk_Alik_Bljk_SB_Winograd.yaml
- {MinimumRequiredVersion: 4.12.0}
- vega20
- gfx906
- [Device 66a0, Device 66a1, Device 66a7, Vega 20]
    SolutionIndex: 0
    SolutionNameMin: Cijk_Alik_Bljk_SB_MT64x64x32_SE_EPS1_FL0_GRVW1_LPA4_LPB4_PGR1_PLR1_TT4_4_USFGRO1_VW4_WG16_16_1_WGM8
    SolutionIndex: 1
    SolutionNameMin: Cijk_Alik_Bljk_SB_MT64x64x16_SE_EPS0_FL0_GRVW2_LPA4_LPB4_PGR0_PLR1_TT4_4_USFGRO1_VW4_WG16_16_1_WGM1
    SolutionIndex: 2
    SolutionNameMin: Cijk_Alik_Bljk_SB_MT64x64x16_SE_EPS1_FL0_GRVW2_LPA4_LPB4_PGR1_PLR1_TT4_4_USFGRO1_VW4_WG16_16_1_WGM1
    SolutionIndex: 3
    SolutionNameMin: Cijk_Alik_Bljk_SB_MT64x64x16_SE_EPS0_FL0_GRVW2_LPA4_LPB4_PGR0_PLR1_TT4_4_USFGRO1_VW4_WG16_16_1_WGM8
    SolutionIndex: 4
    SolutionNameMin: Cijk_Alik_Bljk_SB_MT64x64x16_SE_EPS1_FL0_GRVW2_LPA4_LPB4_PGR1_PLR1_TT4_4_USFGRO1_VW4_WG16_16_1_WGM8
    SolutionIndex: 5
    SolutionNameMin: Cijk_Alik_Bljk_SB_MT64x64x32_SE_EPS0_FL0_GRVW4_LPA2_LPB2_PGR0_PLR1_TT4_4_USFGRO1_VW2_WG16_16_1_WGM1
    SolutionIndex: 6
    SolutionNameMin: Cijk_Alik_Bljk_SB_MT64x64x16_SE_EPS0_FL1_GRVW2_LPA4_LPB4_PGR0_PLR1_TT4_4_USFGRO1_VW4_WG16_16_1_WGM1
    SolutionIndex: 7
    SolutionNameMin: Cijk_Alik_Bljk_SB_MT64x64x16_SE_EPS1_FL1_GRVW2_LPA4_LPB4_PGR1_PLR1_TT4_4_USFGRO1_VW4_WG16_16_1_WGM1
    SolutionIndex: 8
    SolutionNameMin: Cijk_Alik_Bljk_SB_MT64x64x16_SE_EPS0_FL1_GRVW2_LPA4_LPB4_PGR0_PLR1_TT4_4_USFGRO1_VW4_WG16_16_1_WGM8
    SolutionIndex: 9
    SolutionNameMin: Cijk_Alik_Bljk_SB_MT64x32x32_SE_EPS1_FL0_GRVW4_LPA2_LPB2_PGR1_PLR1_TT4_2_USFGRO1_VW2_WG16_16_1_WGM8
    SolutionIndex: 10
    SolutionNameMin: Cijk_Alik_Bljk_SB_MT64x128x8_SE_EPS1_FL0_GRVW2_LPA0_LPB0_PGR1_PLR1_TT4_8_USFGRO1_VW4_WG16_16_1_WGM8
    SolutionIndex: 11
    SolutionNameMin: Cijk_Alik_Bljk_SB_MT64x128x16_SE_EPS1_FL1_GRVW2_LPA4_LPB4_PGR1_PLR1_TT4_8_USFGRO1_VW4_WG16_16_1_WGM8
    SolutionIndex: 12
    SolutionNameMin: Cijk_Alik_Bljk_SB_MT64x128x16_SE_EPS1_FL1_GRVW4_LPA4_LPB4_PGR1_PLR1_TT4_8_USFGRO1_VW4_WG16_16_1_WGM1
    SolutionIndex: 13
    SolutionNameMin: Cijk_Alik_Bljk_SB_MT128x64x32_SE_EPS1_FL1_GRVW2_LPA4_LPB4_PGR1_PLR1_TT8_4_USFGRO1_VW4_WG16_16_1_WGM1
    SolutionIndex: 14
    SolutionNameMin: Cijk_Alik_Bljk_SB_MT64x32x16_SE_EPS1_FL0_GRVW1_LPA2_LPB2_PGR1_PLR1_TT4_4_USFGRO1_VW2_WG16_8_1_WGM1
    SolutionIndex: 15
    SolutionNameMin: Cijk_Alik_Bljk_SB_MT64x32x16_SE_EPS1_FL0_GRVW1_LPA4_LPB4_PGR1_PLR1_TT4_4_USFGRO1_VW4_WG16_8_1_WGM8
    SolutionIndex: 16
    SolutionNameMin: Cijk_Alik_Bljk_SB_MT64x32x32_SE_EPS0_FL0_GRVW2_LPA2_LPB2_PGR0_PLR1_TT4_4_USFGRO1_VW2_WG16_8_1_WGM1
    SolutionIndex: 17
    SolutionNameMin: Cijk_Alik_Bljk_SB_MT64x32x16_SE_EPS1_FL0_GRVW2_LPA4_LPB4_PGR1_PLR1_TT4_4_USFGRO1_VW4_WG16_8_1_WGM1
    SolutionIndex: 18
    SolutionNameMin: Cijk_Alik_Bljk_SB_MT64x32x16_SE_EPS1_FL0_GRVW2_LPA4_LPB4_PGR1_PLR1_TT4_4_USFGRO1_VW4_WG16_8_1_WGM8
    SolutionIndex: 19
    SolutionNameMin: Cijk_Alik_Bljk_SB_MT64x32x32_SE_EPS0_FL0_GRVW4_LPA2_LPB2_PGR0_PLR1_TT4_4_USFGRO1_VW2_WG16_8_1_WGM1
    SolutionIndex: 20
    SolutionNameMin: Cijk_Alik_Bljk_SB_MT64x32x16_SE_EPS1_FL0_GRVW4_LPA4_LPB4_PGR1_PLR1_TT4_4_USFGRO1_VW4_WG16_8_1_WGM1
    SolutionIndex: 21
    SolutionNameMin: Cijk_Alik_Bljk_SB_MT64x32x32_SE_EPS0_FL1_GRVW2_LPA2_LPB2_PGR0_PLR1_TT4_4_USFGRO1_VW2_WG16_8_1_WGM1
    SolutionIndex: 22
    SolutionNameMin: Cijk_Alik_Bljk_SB_MT64x32x32_SE_EPS0_FL1_GRVW2_LPA2_LPB2_PGR0_PLR1_TT4_4_USFGRO1_VW2_WG16_8_1_WGM8
    SolutionIndex: 23
    SolutionNameMin: Cijk_Alik_Bljk_SB_MT64x32x16_SE_EPS1_FL1_GRVW2_LPA4_LPB4_PGR1_PLR1_TT4_4_USFGRO1_VW4_WG16_8_1_WGM1
    SolutionIndex: 24
    SolutionNameMin: Cijk_Alik_Bljk_SB_MT64x32x16_SE_EPS1_FL1_GRVW2_LPA4_LPB4_PGR1_PLR1_TT4_4_USFGRO1_VW4_WG16_8_1_WGM8
    SolutionIndex: 25
    SolutionNameMin: Cijk_Alik_Bljk_SB_MT64x32x32_SE_EPS0_FL1_GRVW4_LPA2_LPB2_PGR0_PLR1_TT4_4_USFGRO1_VW2_WG16_8_1_WGM1
    SolutionIndex: 26
    SolutionNameMin: Cijk_Alik_Bljk_SB_MT64x32x32_SE_EPS0_FL1_GRVW4_LPA2_LPB2_PGR0_PLR1_TT4_4_USFGRO1_VW2_WG16_8_1_WGM8
    SolutionIndex: 27
    SolutionNameMin: Cijk_Alik_Bljk_SB_MT32x32x16_SE_EPS1_FL0_GRVW1_LPA2_LPB2_PGR1_PLR1_TT2_4_USFGRO1_VW2_WG16_8_1_WGM8
    SolutionIndex: 28
    SolutionNameMin: Cijk_Alik_Bljk_SB_MT32x32x32_SE_EPS0_FL0_GRVW1_LPA2_LPB2_PGR0_PLR1_TT2_4_USFGRO1_VW2_WG16_8_1_WGM8
    SolutionIndex: 29
    SolutionNameMin: Cijk_Alik_Bljk_SB_MT32x32x32_SE_EPS0_FL0_GRVW4_LPA2_LPB2_PGR0_PLR1_TT2_4_USFGRO1_VW2_WG16_8_1_WGM1
    SolutionIndex: 30
    SolutionNameMin: Cijk_Alik_Bljk_SB_MT32x32x32_SE_EPS1_FL0_GRVW4_LPA2_LPB2_PGR1_PLR1_TT2_4_USFGRO1_VW2_WG16_8_1_WGM1
    SolutionIndex: 31
    SolutionNameMin: Cijk_Alik_Bljk_SB_MT32x32x32_SE_EPS1_FL1_GRVW4_LPA2_LPB2_PGR1_PLR1_TT2_4_USFGRO1_VW2_WG16_8_1_WGM1
    SolutionIndex: 32
    SolutionNameMin: Cijk_Alik_Bljk_SB_MT32x64x16_SE_EPS1_FL0_GRVW1_LPA2_LPB2_PGR1_PLR1_TT4_4_USFGRO1_VW2_WG8_16_1_WGM8
    SolutionIndex: 33
    SolutionNameMin: Cijk_Alik_Bljk_SB_MT32x64x16_SE_EPS1_FL0_GRVW1_LPA4_LPB4_PGR1_PLR1_TT4_4_USFGRO1_VW4_WG8_16_1_WGM1
    SolutionIndex: 34
    SolutionNameMin: Cijk_Alik_Bljk_SB_MT32x64x16_SE_EPS1_FL0_GRVW1_LPA4_LPB4_PGR1_PLR1_TT4_4_USFGRO1_VW4_WG8_16_1_WGM8
    SolutionIndex: 35
    SolutionNameMin: Cijk_Alik_Bljk_SB_MT32x64x32_SE_EPS0_FL0_GRVW2_LPA2_LPB2_PGR0_PLR1_TT4_4_USFGRO1_VW2_WG8_16_1_WGM1
    SolutionIndex: 36
    SolutionNameMin: Cijk_Alik_Bljk_SB_MT32x64x16_SE_EPS1_FL0_GRVW2_LPA4_LPB4_PGR1_PLR1_TT4_4_USFGRO1_VW4_WG8_16_1_WGM1
    SolutionIndex: 37
    SolutionNameMin: Cijk_Alik_Bljk_SB_MT32x32x16_SE_EPS1_FL0_GRVW1_LPA2_LPB2_PGR1_PLR1_TT4_2_USFGRO1_VW2_WG8_16_1_WGM8
    SolutionIndex: 38
    SolutionNameMin: Cijk_Alik_Bljk_SB_MT32x32x32_SE_EPS0_FL0_GRVW1_LPA2_LPB2_PGR0_PLR1_TT4_2_USFGRO1_VW2_WG8_16_1_WGM1
    SolutionIndex: 39
    SolutionNameMin: Cijk_Alik_Bljk_SB_MT32x32x32_SE_EPS1_FL0_GRVW4_LPA2_LPB2_PGR1_PLR1_TT4_2_USFGRO1_VW2_WG8_16_1_WGM1
    SolutionIndex: 40
    SolutionNameMin: Cijk_Alik_Bljk_SB_MT64x64x32_SE_EPS1_FL0_GRVW1_LPA4_LPB4_PGR1_PLR1_TT4_4_USFGRO1_VW4_WG16_16_1_WGM8
    SolutionIndex: 41
    SolutionNameMin: Cijk_Alik_Bljk_SB_MT64x64x16_SE_EPS0_FL0_GRVW2_LPA4_LPB4_PGR0_PLR1_TT4_4_USFGRO1_VW4_WG16_16_1_WGM1
    SolutionIndex: 42
    SolutionNameMin: Cijk_Alik_Bljk_SB_MT64x64x16_SE_EPS1_FL0_GRVW2_LPA4_LPB4_PGR1_PLR1_TT4_4_USFGRO1_VW4_WG16_16_1_WGM1
    SolutionIndex: 43
    SolutionNameMin: Cijk_Alik_Bljk_SB_MT64x64x16_SE_EPS0_FL0_GRVW2_LPA4_LPB4_PGR0_PLR1_TT4_4_USFGRO1_VW4_WG16_16_1_WGM8
    SolutionIndex: 44
    SolutionNameMin: Cijk_Alik_Bljk_SB_MT64x64x16_SE_EPS1_FL0_GRVW2_LPA4_LPB4_PGR1_PLR1_TT4_4_USFGRO1_VW4_WG16_16_1_WGM8
    SolutionIndex: 45
    SolutionNameMin: Cijk_Alik_Bljk_SB_MT64x64x32_SE_EPS0_FL0_GRVW4_LPA2_LPB2_PGR0_PLR1_TT4_4_USFGRO1_VW2_WG16_16_1_WGM1
    SolutionIndex: 46
    SolutionNameMin: Cijk_Alik_Bljk_SB_MT64x64x16_SE_EPS0_FL1_GRVW2_LPA4_LPB4_PGR0_PLR1_TT4_4_USFGRO1_VW4_WG16_16_1_WGM1
    SolutionIndex: 47
    SolutionNameMin: Cijk_Alik_Bljk_SB_MT64x64x16_SE_EPS1_FL1_GRVW2_LPA4_LPB4_PGR1_PLR1_TT4_4_USFGRO1_VW4_WG16_16_1_WGM1
    SolutionIndex: 48
    SolutionNameMin: Cijk_Alik_Bljk_SB_MT64x64x16_SE_EPS0_FL1_GRVW2_LPA4_LPB4_PGR0_PLR1_TT4_4_USFGRO1_VW4_WG16_16_1_WGM8
    SolutionIndex: 49
    SolutionNameMin: Cijk_Alik_Bljk_SB_MT64x32x32_SE_EPS1_FL0_GRVW4_LPA2_LPB2_PGR1_PLR1_TT4_2_USFGRO1_VW2_WG16_16_1_WGM8
    SolutionIndex: 50
    SolutionNameMin: Cijk_Alik_Bljk_SB_MT64x128x8_SE_EPS1_FL0_GRVW2_LPA0_LPB0_PGR1_PLR1_TT4_8_USFGRO1_VW4_WG16_16_1_WGM8
    SolutionIndex: 51
    SolutionNameMin: Cijk_Alik_Bljk_SB_MT64x128x16_SE_EPS1_FL1_GRVW2_LPA4_LPB4_PGR1_PLR1_TT4_8_USFGRO1_VW4_WG16_16_1_WGM8
    SolutionIndex: 52
    SolutionNameMin: Cijk_Alik_Bljk_SB_MT64x128x16_SE_EPS1_FL1_GRVW4_LPA4_LPB4_PGR1_PLR1_TT4_8_USFGRO1_VW4_WG16_16_1_WGM1
    SolutionIndex: 53
    SolutionNameMin: Cijk_Alik_Bljk_SB_MT128x64x32_SE_EPS1_FL1_GRVW2_LPA4_LPB4_PGR1_PLR1_TT8_4_USFGRO1_VW4_WG16_16_1_WGM1
    SolutionIndex: 54
    SolutionNameMin: Cijk_Alik_Bljk_SB_MT64x32x16_SE_EPS1_FL0_GRVW1_LPA2_LPB2_PGR1_PLR1_TT4_4_USFGRO1_VW2_WG16_8_1_WGM1
    SolutionIndex: 55
    SolutionNameMin: Cijk_Alik_Bljk_SB_MT64x32x16_SE_EPS1_FL0_GRVW1_LPA4_LPB4_PGR1_PLR1_TT4_4_USFGRO1_VW4_WG16_8_1_WGM8
    SolutionIndex: 56
    SolutionNameMin: Cijk_Alik_Bljk_SB_MT64x32x32_SE_EPS0_FL0_GRVW2_LPA2_LPB2_PGR0_PLR1_TT4_4_USFGRO1_VW2_WG16_8_1_WGM1
    SolutionIndex: 57
    SolutionNameMin: Cijk_Alik_Bljk_SB_MT64x32x16_SE_EPS1_FL0_GRVW2_LPA4_LPB4_PGR1_PLR1_TT4_4_USFGRO1_VW4_WG16_8_1_WGM1
    SolutionIndex: 58
    SolutionNameMin: Cijk_Alik_Bljk_SB_MT64x32x16_SE_EPS1_FL0_GRVW2_LPA4_LPB4_PGR1_PLR1_TT4_4_USFGRO1_VW4_WG16_8_1_WGM8
    SolutionIndex: 59
    SolutionNameMin: Cijk_Alik_Bljk_SB_MT64x32x32_SE_EPS0_FL0_GRVW4_LPA2_LPB2_PGR0_PLR1_TT4_4_USFGRO1_VW2_WG16_8_1_WGM1
    SolutionIndex: 60
    SolutionNameMin: Cijk_Alik_Bljk_SB_MT64x32x16_SE_EPS1_FL0_GRVW4_LPA4_LPB4_PGR1_PLR1_TT4_4_USFGRO1_VW4_WG16_8_1_WGM1
    SolutionIndex: 61
    SolutionNameMin: Cijk_Alik_Bljk_SB_MT64x32x32_SE_EPS0_FL1_GRVW2_LPA2_LPB2_PGR0_PLR1_TT4_4_USFGRO1_VW2_WG16_8_1_WGM1
    SolutionIndex: 62
    SolutionNameMin: Cijk_Alik_Bljk_SB_MT64x32x32_SE_EPS0_FL1_GRVW2_LPA2_LPB2_PGR0_PLR1_TT4_4_USFGRO1_VW2_WG16_8_1_WGM8
    SolutionIndex: 63
    SolutionNameMin: Cijk_Alik_Bljk_SB_MT64x32x16_SE_EPS1_FL1_GRVW2_LPA4_LPB4_PGR1_PLR1_TT4_4_USFGRO1_VW4_WG16_8_1_WGM1
    SolutionIndex: 64
    SolutionNameMin: Cijk_Alik_Bljk_SB_MT64x32x16_SE_EPS1_FL1_GRVW2_LPA4_LPB4_PGR1_PLR1_TT4_4_USFGRO1_VW4_WG16_8_1_WGM8
    SolutionIndex: 65
    SolutionNameMin: Cijk_Alik_Bljk_SB_MT64x32x32_SE_EPS0_FL1_GRVW4_LPA2_LPB2_PGR0_PLR1_TT4_4_USFGRO1_VW2_WG16_8_1_WGM1
    SolutionIndex: 66
    SolutionNameMin: Cijk_Alik_Bljk_SB_MT64x32x32_SE_EPS0_FL1_GRVW4_LPA2_LPB2_PGR0_PLR1_TT4_4_USFGRO1_VW2_WG16_8_1_WGM8
    SolutionIndex: 67
    SolutionNameMin: Cijk_Alik_Bljk_SB_MT32x32x16_SE_EPS1_FL0_GRVW1_LPA2_LPB2_PGR1_PLR1_TT2_4_USFGRO1_VW2_WG16_8_1_WGM8
    SolutionIndex: 68
    SolutionNameMin: Cijk_Alik_Bljk_SB_MT32x32x32_SE_EPS0_FL0_GRVW1_LPA2_LPB2_PGR0_PLR1_TT2_4_USFGRO1_VW2_WG16_8_1_WGM8
    SolutionIndex: 69
    SolutionNameMin: Cijk_Alik_Bljk_SB_MT32x32x32_SE_EPS0_FL0_GRVW4_LPA2_LPB2_PGR0_PLR1_TT2_4_USFGRO1_VW2_WG16_8_1_WGM1
    SolutionIndex: 70
    SolutionNameMin: Cijk_Alik_Bljk_SB_MT32x32x32_SE_EPS1_FL0_GRVW4_LPA2_LPB2_PGR1_PLR1_TT2_4_USFGRO1_VW2_WG16_8_1_WGM1
    SolutionIndex: 71
    SolutionNameMin: Cijk_Alik_Bljk_SB_MT32x32x32_SE_EPS1_FL1_GRVW4_LPA2_LPB2_PGR1_PLR1_TT2_4_USFGRO1_VW2_WG16_8_1_WGM1
    SolutionIndex: 72
    SolutionNameMin: Cijk_Alik_Bljk_SB_MT32x64x16_SE_EPS1_FL0_GRVW1_LPA2_LPB2_PGR1_PLR1_TT4_4_USFGRO1_VW2_WG8_16_1_WGM8
    SolutionIndex: 73
    SolutionNameMin: Cijk_Alik_Bljk_SB_MT32x64x16_SE_EPS1_FL0_GRVW1_LPA4_LPB4_PGR1_PLR1_TT4_4_USFGRO1_VW4_WG8_16_1_WGM1
    SolutionIndex: 74
    SolutionNameMin: Cijk_Alik_Bljk_SB_MT32x64x16_SE_EPS1_FL0_GRVW1_LPA4_LPB4_PGR1_PLR1_TT4_4_USFGRO1_VW4_WG8_16_1_WGM8
    SolutionIndex: 75
    SolutionNameMin: Cijk_Alik_Bljk_SB_MT32x64x32_SE_EPS0_FL0_GRVW2_LPA2_LPB2_PGR0_PLR1_TT4_4_USFGRO1_VW2_WG8_16_1_WGM1
    SolutionIndex: 76
    SolutionNameMin: Cijk_Alik_Bljk_SB_MT32x64x16_SE_EPS1_FL0_GRVW2_LPA4_LPB4_PGR1_PLR1_TT4_4_USFGRO1_VW4_WG8_16_1_WGM1
    SolutionIndex: 77
    SolutionNameMin: Cijk_Alik_Bljk_SB_MT32x32x16_SE_EPS1_FL0_GRVW1_LPA2_LPB2_PGR1_PLR1_TT4_2_USFGRO1_VW2_WG8_16_1_WGM8
    SolutionIndex: 78
    SolutionNameMin: Cijk_Alik_Bljk_SB_MT32x32x32_SE_EPS0_FL0_GRVW1_LPA2_LPB2_PGR0_PLR1_TT4_2_USFGRO1_VW2_WG8_16_1_WGM1
    SolutionIndex: 79
    SolutionNameMin: Cijk_Alik_Bljk_SB_MT32x32x32_SE_EPS1_FL0_GRVW4_LPA2_LPB2_PGR1_PLR1_TT4_2_USFGRO1_VW2_WG8_16_1_WGM1
- - - [64, 64, 11, 233600]
    - [30, 1694.16]
  - - [320, 256, 9, 19584]
    - [6, 7802.45]
  - - [256, 224, 9, 9792]
    - [21, 7100.97]
  - - [256, 256, 9, 4896]
    - [19, 6163.1]
  - - [320, 256, 9, 4896]
    - [5, 7515.25]
  - - [224, 192, 9, 19584]
    - [13, 5761.25]
  - - [192, 192, 11, 3264]
    - [2, 6814.07]
  - - [64, 64, 11, 116800]
    - [39, 1692.18]
  - - [64, 64, 9, 172864]
    - [31, 1385.54]
  - - [192, 128, 11, 6528]
    - [23, 5057.19]
  - - [64, 64, 11, 58400]
    - [39, 1688.53]
  - - [192, 160, 9, 19584]
    - [15, 4940.68]
  - - [128, 128, 9, 9792]
    - [37, 4094.51]
  - - [192, 192, 11, 6528]
    - [2, 6918.07]
  - - [160, 160, 9, 4896]
    - [28, 4545.61]
  - - [192, 192, 9, 4896]
    - [18, 6156.67]
  - - [256, 256, 11, 13056]
    - [8, 7526.25]
  - - [224, 192, 11, 6528]
    - [32, 7333.58]
  - - [256, 224, 11, 13056]
    - [6, 6512.15]
  - - [224, 192, 11, 13056]
    - [35, 6429.18]
  - - [256, 256, 11, 3264]
    - [3, 7366.03]
  - - [192, 160, 11, 13056]
    - [15, 5994.41]
  - - [320, 256, 11, 6528]
    - [12, 8725.7]
  - - [192, 192, 9, 9792]
    - [15, 5843.92]
  - - [192, 160, 11, 6528]
    - [24, 6308.46]
  - - [224, 224, 9, 9792]
    - [25, 6268.31]
  - - [64, 64, 9, 86432]
    - [30, 1382.91]
  - - [224, 192, 11, 3264]
    - [33, 7336.37]
  - - [224, 224, 11, 6528]
    - [22, 5718.39]
  - - [160, 160, 11, 13056]
    - [34, 5005.14]
  - - [160, 160, 9, 19584]
    - [29, 4564.74]
  - - [192, 128, 9, 19584]
    - [0, 5444.53]
  - - [192, 160, 9, 9792]
    - [17, 5209.54]
  - - [224, 224, 9, 19584]
    - [25, 5549.59]
  - - [192, 192, 11, 13056]
    - [7, 7053.75]
  - - [192, 128, 9, 4896]
    - [7, 5314.67]
  - - [320, 256, 9, 9792]
    - [1, 7770.2]
  - - [320, 256, 11, 13056]
    - [11, 8806.16]
  - - [128, 128, 9, 4896]
    - [37, 4041.34]
  - - [256, 256, 9, 9792]
    - [22, 6138.47]
  - - [224, 224, 9, 4896]
    - [14, 6936.98]
  - - [320, 256, 11, 3264]
    - [10, 8630.45]
  - - [224, 192, 9, 4896]
    - [34, 6747.03]
  - - [256, 224, 9, 19584]
    - [9, 5923.69]
  - - [192, 128, 11, 3264]
    - [20, 4952.72]
  - - [224, 224, 11, 13056]
    - [22, 5747.58]
  - - [224, 224, 11, 3264]
    - [25, 5738.78]
  - - [160, 160, 11, 3264]
    - [23, 5133.73]
  - - [256, 224, 11, 6528]
    - [16, 6509.68]
  - - [192, 160, 9, 4896]
    - [36, 5118.14]
  - - [256, 224, 11, 3264]
    - [26, 6508.85]
  - - [160, 160, 9, 9792]
    - [38, 4552.22]
  - - [192, 160, 11, 3264]
    - [17, 6185.35]
  - - [256, 256, 9, 19584]
    - [6, 6147.61]
  - - [224, 192, 9, 9792]
    - [4, 6657.91]
  - - [160, 160, 11, 6528]
    - [23, 5254.64]
  - - [256, 224, 9, 4896]
    - [16, 7023.59]
  - - [192, 128, 9, 9792]
    - [7, 5400.54]
  - - [64, 64, 11, 233600]
    - [70, 1694.16]
  - - [320, 256, 9, 19584]
    - [46, 7802.45]
  - - [256, 224, 9, 9792]
    - [61, 7100.97]
  - - [256, 256, 9, 4896]
    - [59, 6163.1]
  - - [320, 256, 9, 4896]
    - [45, 7515.25]
  - - [224, 192, 9, 19584]
    - [53, 5761.25]
  - - [192, 192, 11, 3264]
    - [42, 6814.07]
  - - [64, 64, 11, 116800]
    - [79, 1692.18]
  - - [64, 64, 9, 172864]
    - [71, 1385.54]
  - - [192, 128, 11, 6528]
    - [63, 5057.19]
  - - [64, 64, 11, 58400]
    - [79, 1688.53]
  - - [192, 160, 9, 19584]
    - [55, 4940.68]
  - - [128, 128, 9, 9792]
    - [77, 4094.51]
  - - [192, 192, 11, 6528]
    - [42, 6918.07]
  - - [160, 160, 9, 4896]
    - [68, 4545.61]
  - - [192, 192, 9, 4896]
    - [58, 6156.67]
  - - [256, 256, 11, 13056]
    - [48, 7526.25]
  - - [224, 192, 11, 6528]
    - [72, 7333.58]
  - - [256, 224, 11, 13056]
    - [46, 6512.15]
  - - [224, 192, 11, 13056]
    - [75, 6429.18]
  - - [256, 256, 11, 3264]
    - [43, 7366.03]
  - - [192, 160, 11, 13056]
    - [55, 5994.41]
  - - [320, 256, 11, 6528]
    - [52, 8725.7]
  - - [192, 192, 9, 9792]
    - [55, 5843.92]
  - - [192, 160, 11, 6528]
    - [64, 6308.46]
  - - [224, 224, 9, 9792]
    - [65, 6268.31]
  - - [64, 64, 9, 86432]
    - [70, 1382.91]
  - - [224, 192, 11, 3264]
    - [73, 7336.37]
  - - [224, 224, 11, 6528]
    - [62, 5718.39]
  - - [160, 160, 11, 13056]
    - [74, 5005.14]
  - - [160, 160, 9, 19584]
    - [69, 4564.74]
  - - [192, 128, 9, 19584]
    - [40, 5444.53]
  - - [192, 160, 9, 9792]
    - [57, 5209.54]
  - - [224, 224, 9, 19584]
    - [65, 5549.59]
  - - [192, 192, 11, 13056]
    - [47, 7053.75]
  - - [192, 128, 9, 4896]
    - [47, 5314.67]
  - - [320, 256, 9, 9792]
    - [41, 7770.2]
  - - [320, 256, 11, 13056]
    - [51, 8806.16]
  - - [128, 128, 9, 4896]
    - [77, 4041.34]
  - - [256, 256, 9, 9792]
    - [62, 6138.47]
  - - [224, 224, 9, 4896]
    - [54, 6936.98]
  - - [320, 256, 11, 3264]
    - [50, 8630.45]
  - - [224, 192, 9, 4896]
    - [74, 6747.03]
  - - [256, 224, 9, 19584]
    - [49, 5923.69]
  - - [192, 128, 11, 3264]
    - [60, 4952.72]
  - - [224, 224, 11, 13056]
    - [62, 5747.58]
  - - [224, 224, 11, 3264]
    - [65, 5738.78]
  - - [160, 160, 11, 3264]
    - [63, 5133.73]
  - - [256, 224, 11, 6528]
    - [56, 6509.68]
  - - [192, 160, 9, 4896]
    - [76, 5118.14]
  - - [256, 224, 11, 3264]
    - [66, 6508.85]
  - - [160, 160, 9, 9792]
    - [78, 4552.22]
  - - [192, 160, 11, 3264]
    - [57, 6185.35]
  - - [256, 256, 9, 19584]
    - [46, 6147.61]
  - - [224, 192, 9, 9792]
    - [44, 6657.91]
  - - [160, 160, 11, 6528]
    - [63, 5254.64]
  - - [256, 224, 9, 4896]
    - [56, 7023.59]
  - - [192, 128, 9, 9792]
    - [47, 5400.54]
- null
