library/src/blas3/Tensile/Logic/asm_full/row/fp16altimpl/aldebaran_Cijk_Ailk_Bjlk_HBHR.yaml
- {MinimumRequiredVersion: 4.32.1}
- aldebaran
- {Architecture: gfx90a, CUCount: 104}
- [Device 7400, Device 7408, Device 740c]
    SolutionIndex: 0
    SolutionNameMin: Cijk_Ailk_Bjlk_HBH_MT064x064x04_PGR0_PLR1_TT04_04
    SolutionIndex: 1
    SolutionNameMin: Cijk_Ailk_Bjlk_HBH_MT064x064x04_PGR1_PLR1_TT04_04
    SolutionIndex: 2
    SolutionNameMin: Cijk_Ailk_Bjlk_HBH_MT064x064x08_PGR0_PLR1_TT04_04
    SolutionIndex: 3
    SolutionNameMin: Cijk_Ailk_Bjlk_HBH_MT064x064x16_PGR1_PLR1_TT04_04
    SolutionIndex: 4
    SolutionNameMin: Cijk_Ailk_Bjlk_HBH_MT32x32x16_MI16x16x16x1_SE_AF0EM8_GRVW2_SU0_SUS256_SRVW4_TT1_16_WG32_8_1_WGM1
    SolutionIndex: 5
    SolutionNameMin: Cijk_Ailk_Bjlk_HBH_MT16x64x32_MI16x16x16x1_SE_AF0EM8_GRVW8_SU0_SUS256_SRVW0_TT1_16_WG16_16_1_WGM2
    SolutionIndex: 6
    SolutionNameMin: Cijk_Ailk_Bjlk_HBH_MT32x32x16_MI16x16x16x1_SE_AF0EM1_GRVW2_SU0_SUS256_SRVW4_TT1_16_WG32_8_1_WGM1
    SolutionIndex: 7
    SolutionNameMin: Cijk_Ailk_Bjlk_HBH_MT32x32x16_MI16x16x16x1_SE_AF0EM1_GRVW2_SU32_SUS256_SRVW4_TT1_16_WG32_8_1_WGM1
    SolutionIndex: 8
    SolutionNameMin: Cijk_Ailk_Bjlk_HBH_MT32x32x64_MI16x16x16x1_SE_1LDSB0_AF0EM8_AF1EM1_EPS0_GRVW8_GSU1_GSUAMB_NLCA1_NLCB1_PGR2_SU0_SUS0_SRVW4_TT1_16_VAW2_WSGRA1_WSGRB1_WG32_8_1_WGM1
    SolutionIndex: 9
    SolutionNameMin: Cijk_Ailk_Bjlk_HBH_MT64x64x64_MI32x32x8x1_SE_1LDSB0_AF0EM8_AF1EM1_EPS0_GRVW8_GSU1_GSUAMB_NLCA1_NLCB1_PGR2_SU0_SUS0_SRVW4_TT1_32_VAW2_WSGRA1_WSGRB1_WG64_4_1_WGM15
    SolutionIndex: 10
    SolutionNameMin: Cijk_Ailk_Bjlk_HBH_MT64x16x32_MI16x16x16x1_SE_1LDSB0_AF0EM1_AF1EM1_EPS0_GRVW8_GSU1_GSUAMB_NLCA1_NLCB1_PGR2_SU0_SUS0_SRVW0_TT1_16_VAW2_WSGRA1_WSGRB1_WG64_4_1_WGM1
    SolutionIndex: 11
    SolutionNameMin: Cijk_Ailk_Bjlk_HBH_MT64x64x32_MI32x32x8x1_SE_1LDSB0_AF0EM8_AF1EM1_EPS0_GRVW8_GSU1_GSUAMB_NLCA1_NLCB1_PGR2_SU0_SUS0_SRVW4_TT1_32_VAW2_WSGRA1_WSGRB1_WG64_4_1_WGM15
    SolutionIndex: 12
    SolutionNameMin: Cijk_Ailk_Bjlk_HBH_MT32x32x64_MI16x16x16x1_SE_1LDSB0_AF0EM8_AF1EM1_EPS0_GRVW8_GSU1_GSUAMB_NLCA1_NLCB1_PGR2_SU0_SUS0_SRVW4_TT1_16_VAW2_WSGRA1_WSGRB1_WG32_8_1_WGM15
    SolutionIndex: 13
    SolutionNameMin: Cijk_Ailk_Bjlk_HBH_MT64x64x64_MI32x32x8x1_SE_1LDSB0_AF0EM8_AF1EM1_EPS1_GRVW8_GSU7_GSUAMB_NLCA1_NLCB1_PGR1_SU0_SUS0_SRVW0_TT1_32_VAW1_WSGRA1_WSGRB1_WG64_4_1_WGM1
    SolutionIndex: 14
    SolutionNameMin: Cijk_Ailk_Bjlk_HBH_MT32x32x64_MI16x16x16x1_SE_1LDSB0_AF0EM8_AF1EM1_EPS0_GRVW4_GSU1_GSUAMB_NLCA1_NLCB1_PGR2_SU0_SUS0_SRVW4_TT1_16_VAW2_WSGRA1_WSGRB1_WG32_8_1_WGM2
    SolutionIndex: 15
    SolutionNameMin: Cijk_Ailk_Bjlk_HBH_MT32x64x64_MI16x16x16x1_SE_1LDSB0_AF0EM8_AF1EM1_EPS0_GRVW8_GSU1_GSUAMB_NLCA1_NLCB1_PGR2_SU0_SUS0_SRVW4_TT1_32_VAW2_WSGRA1_WSGRB1_WG32_8_1_WGM1
    SolutionIndex: 16
    SolutionNameMin: Cijk_Ailk_Bjlk_HBH_MT32x32x64_MI16x16x16x1_SE_1LDSB0_AF0EM1_AF1EM1_EPS0_GRVW8_GSU1_GSUAMB_NLCA1_NLCB1_PGR2_SU0_SUS0_SRVW4_TT1_16_VAW2_WSGRA1_WSGRB1_WG32_8_1_WGM1
    SolutionIndex: 17
    SolutionNameMin: Cijk_Ailk_Bjlk_HBH_MT64x64x64_MI32x32x8x1_SE_1LDSB0_AF0EM8_AF1EM1_EPS0_GRVW8_GSU1_GSUAMB_NLCA1_NLCB1_PGR2_SU0_SUS0_SRVW4_TT1_32_VAW2_WSGRA1_WSGRB1_WG64_4_1_WGM2
    SolutionIndex: 18
    SolutionNameMin: Cijk_Ailk_Bjlk_HBH_MT64x16x64_MI16x16x16x1_SE_1LDSB0_AF0EM8_AF1EM1_EPS0_GRVW2_GSU7_GSUAMB_NLCA1_NLCB1_PGR2_SU0_SUS0_SRVW0_TT1_16_VAW1_WSGRA1_WSGRB1_WG64_4_1_WGM1
    SolutionIndex: 19
    SolutionNameMin: Cijk_Ailk_Bjlk_HBH_MT32x32x64_MI16x16x16x1_SE_1LDSB0_AF0EM8_AF1EM1_EPS0_GRVW4_GSU1_GSUAMB_NLCA1_NLCB1_PGR2_SU32_SUS128_SRVW4_TT1_16_VAW2_WSGRA1_WSGRB1_WG32_8_1_WGM1
    SolutionIndex: 20
    SolutionNameMin: Cijk_Ailk_Bjlk_HBH_MT64x64x32_MI32x32x8x1_SE_1LDSB0_AF0EM8_AF1EM1_EPS0_GRVW8_GSU1_GSUAMB_NLCA1_NLCB1_PGR2_SU0_SUS0_SRVW4_TT1_32_VAW2_WSGRA1_WSGRB1_WG64_4_1_WGM1
    SolutionIndex: 21
    SolutionNameMin: Cijk_Ailk_Bjlk_HBH_MT64x64x32_MI32x32x8x1_SE_1LDSB0_AF0EM8_AF1EM1_EPS0_GRVW8_GSU1_GSUAMB_NLCA1_NLCB1_PGR2_SU32_SUS128_SRVW4_TT1_32_VAW2_WSGRA1_WSGRB1_WG64_4_1_WGM15
    SolutionIndex: 22
    SolutionNameMin: Cijk_Ailk_Bjlk_HBH_MT32x32x32_MI16x16x16x1_SE_1LDSB0_AF0EM1_AF1EM1_EPS0_GRVW4_GSU1_GSUAMB_NLCA1_NLCB1_PGR2_SU0_SUS0_SRVW4_TT1_16_VAW2_WSGRA1_WSGRB1_WG32_8_1_WGM1
    SolutionIndex: 23
    SolutionNameMin: Cijk_Ailk_Bjlk_HBH_MT64x64x32_MI32x32x8x1_SE_1LDSB0_AF0EM8_AF1EM1_EPS0_GRVW4_GSU1_GSUAMB_NLCA1_NLCB1_PGR2_SU0_SUS0_SRVW4_TT1_32_VAW2_WSGRA1_WSGRB1_WG64_4_1_WGM1
    SolutionIndex: 24
    SolutionNameMin: Cijk_Ailk_Bjlk_HBH_MT32x32x32_MI16x16x16x1_SE_1LDSB0_AF0EM8_AF1EM1_EPS0_GRVW4_GSU1_GSUAMB_NLCA1_NLCB1_PGR2_SU0_SUS0_SRVW4_TT1_16_VAW2_WSGRA1_WSGRB1_WG32_8_1_WGM1
    SolutionIndex: 25
    SolutionNameMin: Cijk_Ailk_Bjlk_HBH_MT16x16x32_MI16x16x16x1_SE_1LDSB0_AF0EM1_AF1EM1_EPS0_GRVW4_GSU1_GSUAMB_NLCA1_NLCB1_PGR2_SU32_SUS128_SRVW0_TT1_16_VAW2_WSGRA1_WSGRB1_WG16_4_1_WGM1
    SolutionIndex: 26
    SolutionNameMin: Cijk_Ailk_Bjlk_HBH_MT64x16x64_MI16x16x16x1_SE_1LDSB0_AF0EM8_AF1EM1_EPS0_GRVW2_GSU7_GSUAMB_NLCA1_NLCB1_PGR2_SU32_SUS128_SRVW0_TT1_16_VAW1_WSGRA1_WSGRB1_WG64_4_1_WGM1
    SolutionIndex: 27
    SolutionNameMin: Cijk_Ailk_Bjlk_HBH_MT128x128x32_MI32x32x8x1_SE_1LDSB0_AF0EM8_AF1EM1_EPS0_GRVW8_GSU1_GSUAMB_NLCA1_NLCB1_PGR2_SU0_SUS0_SRVW4_TT2_64_VAW2_WSGRA1_WSGRB1_WG64_4_1_WGM1
    SolutionIndex: 28
    SolutionNameMin: Cijk_Ailk_Bjlk_HBH_MT128x192x16_MI32x32x8x1_SE_1LDSB0_AF0EM8_AF1EM1_EPS0_GRVW4_GSU1_GSUAMB_NLCA1_NLCB3_PGR2_SU0_SUS0_SRVW4_TT2_96_VAW2_WSGRA1_WSGRB1_WG64_4_1_WGM15
    SolutionIndex: 29
    SolutionNameMin: Cijk_Ailk_Bjlk_HBH_MT128x128x16_MI32x32x8x1_SE_1LDSB0_AF0EM8_AF1EM1_EPS0_GRVW8_GSU1_GSUAMB_NLCA1_NLCB1_PGR2_SU0_SUS0_SRVW4_TT2_64_VAW2_WSGRA1_WSGRB1_WG64_4_1_WGM2
    SolutionIndex: 30
    SolutionNameMin: Cijk_Ailk_Bjlk_HBH_MT128x256x16_MI32x32x8x1_SE_1LDSB0_AF0EM8_AF1EM1_EPS0_GRVW8_GSU1_GSUAMB_NLCA1_NLCB1_PGR2_SU0_SUS0_SRVW4_TT2_128_VAW2_WSGRA1_WSGRB1_WG64_4_1_WGM1
    SolutionIndex: 31
    SolutionNameMin: Cijk_Ailk_Bjlk_HBH_MT128x64x16_MI32x32x8x1_SE_1LDSB0_AF0EM8_AF1EM1_EPS0_GRVW8_GSU1_GSUAMB_NLCA1_NLCB1_PGR2_SU32_SUS128_SRVW4_TT2_32_VAW2_WSGRA1_WSGRB1_WG64_4_1_WGM1
    SolutionIndex: 32
    SolutionNameMin: Cijk_Ailk_Bjlk_HBH_MT128x128x16_MI32x32x8x1_SE_1LDSB0_AF0EM8_AF1EM1_EPS0_GRVW8_GSU1_GSUAMB_NLCA1_NLCB1_PGR2_SU32_SUS256_SRVW4_TT2_64_VAW2_WSGRA1_WSGRB1_WG64_4_1_WGM2
    SolutionIndex: 33
    SolutionNameMin: Cijk_Ailk_Bjlk_HBH_MT64x64x32_MI32x32x8x1_SE_1LDSB0_AF0EM8_AF1EM1_EPS0_GRVW8_GSU1_GSUAMB_NLCA1_NLCB1_PGR2_SU32_SUS128_SRVW4_TT1_32_VAW2_WSGRA1_WSGRB1_WG64_4_1_WGM1
    SolutionIndex: 34
    SolutionNameMin: Cijk_Ailk_Bjlk_HBH_MT128x128x32_MI32x32x8x1_SE_1LDSB0_AF0EM1_AF1EM1_EPS0_GRVW8_GSU1_GSUAMB_NLCA1_NLCB1_PGR2_SU0_SUS0_SRVW4_TT2_64_VAW2_WSGRA1_WSGRB1_WG64_4_1_WGM15
    SolutionIndex: 35
    SolutionNameMin: Cijk_Ailk_Bjlk_HBH_MT64x128x16_MI32x32x8x1_SE_1LDSB0_AF0EM1_AF1EM1_EPS0_GRVW4_GSU1_GSUAMB_NLCA1_NLCB1_PGR2_SU0_SUS0_SRVW4_TT1_64_VAW2_WSGRA1_WSGRB1_WG64_4_1_WGM15
    SolutionIndex: 36
    SolutionNameMin: Cijk_Ailk_Bjlk_HBH_MT64x128x16_MI32x32x8x1_SE_1LDSB0_AF0EM1_AF1EM1_EPS0_GRVW8_GSU1_GSUAMB_NLCA1_NLCB1_PGR2_SU0_SUS0_SRVW4_TT1_64_VAW2_WSGRA1_WSGRB1_WG64_4_1_WGM1
    SolutionIndex: 37
    SolutionNameMin: Cijk_Ailk_Bjlk_HBH_MT128x128x32_MI32x32x8x1_SE_1LDSB0_AF0EM8_AF1EM1_EPS1_GRVW8_GSU1_GSUAMB_NLCA1_NLCB1_PGR1_SU0_SUS0_SRVW4_TT2_64_VAW2_WSGRA1_WSGRB1_WG64_4_1_WGM1
    SolutionIndex: 38
    SolutionNameMin: Cijk_Ailk_Bjlk_HBH_MT128x64x16_MI32x32x8x1_SE_1LDSB0_AF0EM8_AF1EM1_EPS0_GRVW4_GSU1_GSUAMB_NLCA1_NLCB1_PGR2_SU0_SUS0_SRVW4_TT2_32_VAW2_WSGRA1_WSGRB1_WG64_4_1_WGM15
    SolutionIndex: 39
    SolutionNameMin: Cijk_Ailk_Bjlk_HBH_MT128x64x16_MI32x32x8x1_SE_1LDSB0_AF0EM8_AF1EM1_EPS0_GRVW4_GSU1_GSUAMB_NLCA1_NLCB1_PGR2_SU0_SUS0_SRVW4_TT2_32_VAW2_WSGRA1_WSGRB1_WG64_4_1_WGM2
    SolutionIndex: 40
    SolutionNameMin: Cijk_Ailk_Bjlk_HBH_MT128x128x16_MI32x32x8x1_SE_1LDSB0_AF0EM8_AF1EM1_EPS0_GRVW4_GSU1_GSUAMB_NLCA1_NLCB1_PGR2_SU0_SUS0_SRVW4_TT2_64_VAW2_WSGRA1_WSGRB1_WG64_4_1_WGM1
    SolutionIndex: 41
    SolutionNameMin: Cijk_Ailk_Bjlk_HBH_MT128x128x16_MI32x32x8x1_SE_1LDSB0_AF0EM8_AF1EM1_EPS0_GRVW8_GSU1_GSUAMB_NLCA1_NLCB1_PGR2_SU0_SUS0_SRVW4_TT2_64_VAW2_WSGRA1_WSGRB1_WG64_4_1_WGM1
    SolutionIndex: 42
    SolutionNameMin: Cijk_Ailk_Bjlk_HBH_MT64x64x32_MI32x32x8x1_SE_1LDSB0_AF0EM8_AF1EM1_EPS0_GRVW8_GSU1_GSUAMB_NLCA1_NLCB1_PGR2_SU32_SUS128_SRVW4_TT1_32_VAW2_WSGRA1_WSGRB1_WG64_4_1_WGM2
    SolutionIndex: 43
    SolutionNameMin: Cijk_Ailk_Bjlk_HBH_MT16x16x16_MI16x16x16x1_SE_1LDSB0_AF0EM1_AF1EM1_EPS1_GRVW2_GSU1_GSUAMB_NLCA1_NLCB1_PGR1_SU0_SUS0_SRVW0_TT1_16_VAW2_WSGRA1_WSGRB1_WG16_4_1_WGM1
    SolutionIndex: 44
    SolutionNameMin: Cijk_Ailk_Bjlk_HBH_MT16x16x16_MI16x16x16x1_SE_1LDSB0_AF0EM1_AF1EM1_EPS1_GRVW2_GSU1_GSUAMB_NLCA1_NLCB1_PGR1_SU32_SUS128_SRVW0_TT1_16_VAW2_WSGRA1_WSGRB1_WG16_4_1_WGM15
    SolutionIndex: 45
    SolutionNameMin: Cijk_Ailk_Bjlk_HBH_MT16x16x16_MI16x16x16x1_SE_1LDSB0_AF0EM8_AF1EM1_EPS1_GRVW2_GSU1_GSUAMB_NLCA1_NLCB1_PGR1_SU0_SUS0_SRVW0_TT1_16_VAW2_WSGRA1_WSGRB1_WG16_4_1_WGM1
    SolutionIndex: 46
    SolutionNameMin: Cijk_Ailk_Bjlk_HBH_MT16x16x16_MI16x16x16x1_SE_1LDSB0_AF0EM1_AF1EM1_EPS1_GRVW4_GSU1_GSUAMB_NLCA1_NLCB1_PGR1_SU0_SUS0_SRVW0_TT1_16_VAW2_WSGRA1_WSGRB1_WG16_4_1_WGM1
    SolutionIndex: 47
    SolutionNameMin: Cijk_Ailk_Bjlk_HBH_MT16x16x16_MI16x16x16x1_SE_1LDSB0_AF0EM1_AF1EM1_EPS1_GRVW2_GSU1_GSUAMB_NLCA1_NLCB1_PGR1_SU0_SUS0_SRVW4_TT1_16_VAW2_WSGRA1_WSGRB1_WG16_4_1_WGM1
    SolutionIndex: 48
    SolutionNameMin: Cijk_Ailk_Bjlk_HBH_MT16x16x16_MI16x16x16x1_SE_1LDSB0_AF0EM8_AF1EM1_EPS0_GRVW2_GSU1_GSUAMB_NLCA1_NLCB1_PGR2_SU0_SUS0_SRVW0_TT1_16_VAW2_WSGRA1_WSGRB1_WG16_4_1_WGM1
    SolutionIndex: 49
    SolutionNameMin: Cijk_Ailk_Bjlk_HBH_MT16x16x32_MI16x16x16x1_SE_1LDSB0_AF0EM1_AF1EM1_EPS0_GRVW8_GSU1_GSUAMB_NLCA1_NLCB1_PGR2_SU0_SUS0_SRVW0_TT1_16_VAW2_WSGRA1_WSGRB1_WG16_4_1_WGM1
    SolutionIndex: 50
    SolutionNameMin: Cijk_Ailk_Bjlk_HBH_MT32x32x16_MI16x16x16x1_SE_1LDSB0_AF0EM8_AF1EM1_EPS1_GRVW2_GSU1_GSUAMB_NLCA1_NLCB1_PGR1_SU0_SUS0_SRVW4_TT1_16_VAW2_WSGRA1_WSGRB1_WG32_8_1_WGM1
    SolutionIndex: 51
    SolutionNameMin: Cijk_Ailk_Bjlk_HBH_MT64x128x16_MI32x32x8x1_SE_1LDSB0_AF0EM8_AF1EM1_EPS0_GRVW2_GSU1_GSUAMB_NLCA1_NLCB1_PGR2_SU32_SUS128_SRVW4_TT1_64_VAW2_WSGRA1_WSGRB1_WG64_4_1_WGM1
    SolutionIndex: 52
    SolutionNameMin: Cijk_Ailk_Bjlk_HBH_MT64x128x16_MI32x32x8x1_SE_1LDSB0_AF0EM8_AF1EM1_EPS0_GRVW8_GSU1_GSUAMB_NLCA1_NLCB1_PGR2_SU32_SUS256_SRVW4_TT1_64_VAW2_WSGRA1_WSGRB1_WG64_4_1_WGM1
    SolutionIndex: 53
    SolutionNameMin: Cijk_Ailk_Bjlk_HBH_MT128x64x16_MI32x32x8x1_SE_1LDSB0_AF0EM8_AF1EM1_EPS0_GRVW2_GSU1_GSUAMB_NLCA1_NLCB1_PGR2_SU32_SUS256_SRVW4_TT2_32_VAW2_WSGRA1_WSGRB1_WG64_4_1_WGM15
    SolutionIndex: 54
    SolutionNameMin: Cijk_Ailk_Bjlk_HBH_MT16x64x32_MI16x16x16x1_SE_1LDSB0_AF0EM8_AF1EM1_EPS1_GRVW2_GSU1_GSUAMB_NLCA1_NLCB1_PGR1_SU0_SUS0_SRVW0_TT1_16_VAW2_WSGRA1_WSGRB1_WG16_16_1_WGM1
    SolutionIndex: 55
    SolutionNameMin: Cijk_Ailk_Bjlk_HBH_MT32x32x32_MI16x16x16x1_SE_1LDSB0_AF0EM1_AF1EM1_EPS0_GRVW2_GSU1_GSUAMB_NLCA1_NLCB1_PGR2_SU0_SUS0_SRVW4_TT1_16_VAW2_WSGRA1_WSGRB1_WG32_8_1_WGM1
    SolutionIndex: 56
    SolutionNameMin: Cijk_Ailk_Bjlk_HBH_MT64x32x16_MI16x16x16x1_SE_1LDSB0_AF0EM1_AF1EM1_EPS0_GRVW2_GSU1_GSUAMB_NLCA1_NLCB1_PGR2_SU0_SUS0_SRVW4_TT2_16_VAW2_WSGRA1_WSGRB1_WG32_8_1_WGM1
    SolutionIndex: 57
    SolutionNameMin: Cijk_Ailk_Bjlk_HBH_MT64x32x16_MI16x16x16x1_SE_1LDSB0_AF0EM8_AF1EM1_EPS0_GRVW4_GSU1_GSUAMB_NLCA1_NLCB1_PGR2_SU0_SUS0_SRVW4_TT2_16_VAW2_WSGRA1_WSGRB1_WG32_8_1_WGM1
    SolutionIndex: 58
    SolutionNameMin: Cijk_Ailk_Bjlk_HBH_MT128x96x32_MI32x32x8x1_SE_1LDSB0_AF0EM8_AF1EM1_EPS0_GRVW4_GSU1_GSUAMB_NLCA1_NLCB3_PGR2_SU0_SUS0_SRVW4_TT1_96_VAW2_WSGRA1_WSGRB1_WG128_2_1_WGM2
    SolutionIndex: 59
    SolutionNameMin: Cijk_Ailk_Bjlk_HBH_MT128x96x64_MI32x32x8x1_SE_1LDSB0_AF0EM8_AF1EM1_EPS0_GRVW4_GSU1_GSUAMB_NLCA1_NLCB3_PGR2_SU0_SUS0_SRVW4_TT1_96_VAW2_WSGRA1_WSGRB1_WG128_2_1_WGM2
    SolutionIndex: 60
    SolutionNameMin: Cijk_Ailk_Bjlk_HBH_MT256x160x32_MI32x32x8x1_SE_1LDSB0_AF0EM8_AF1EM1_EPS1_GRVW4_GSU1_GSUAMB_NLCA1_NLCB5_PGR1_SU0_SUS0_SRVW4_TT2_160_VAW2_WSGRA1_WSGRB1_WG128_2_1_WGM15
    SolutionIndex: 61
    SolutionNameMin: Cijk_Ailk_Bjlk_HBH_MT128x256x16_MI32x32x8x1_SE_1LDSB1_AF0EM8_AF1EM1_EPS0_GRVW8_GSU1_GSUAMB_NLCA1_NLCB1_PGR2_SU0_SUS0_SRVW4_TT2_128_VAW2_WSGRA1_WSGRB1_WG64_4_1_WGM1
    SolutionIndex: 62
    SolutionNameMin: Cijk_Ailk_Bjlk_HBH_MT128x128x32_MI32x32x8x1_SE_1LDSB0_AF0EM8_AF1EM1_EPS0_GRVW4_GSU1_GSUAMB_NLCA1_NLCB1_PGR2_SU0_SUS0_SRVW4_TT2_64_VAW2_WSGRA1_WSGRB1_WG64_4_1_WGM1
    SolutionIndex: 63
    SolutionNameMin: Cijk_Ailk_Bjlk_HBH_MT160x256x32_MI32x32x8x1_SE_1LDSB0_AF0EM8_AF1EM1_EPS1_GRVW4_GSU1_GSUAMB_NLCA5_NLCB1_PGR1_SU32_SUS128_SRVW0_TT5_64_VAW2_WSGRA1_WSGRB1_WG32_8_1_WGM1
    SolutionIndex: 64
    SolutionNameMin: Cijk_Ailk_Bjlk_HBH_MT16x64x64_MI16x16x16x1_SE_1LDSB0_AF0EM1_AF1EM1_EPS0_GRVW8_GSU15_GSUAMB_NLCA1_NLCB1_PGR2_SU32_SUS256_SRVW0_TT1_16_VAW1_WSGRA1_WSGRB1_WG16_16_1_WGM1
    SolutionIndex: 65
    SolutionNameMin: Cijk_Ailk_Bjlk_HBH_MT32x64x16_MI16x16x16x1_SE_1LDSB0_AF0EM1_AF1EM1_EPS1_GRVW2_GSU1_GSUAMB_NLCA1_NLCB1_PGR1_SU32_SUS128_SRVW4_TT1_32_VAW2_WSGRA1_WSGRB1_WG32_8_1_WGM2
    SolutionIndex: 66
    SolutionNameMin: Cijk_Ailk_Bjlk_HBH_MT32x32x16_MI16x16x16x1_SE_1LDSB0_AF0EM1_AF1EM1_EPS0_GRVW4_GSU1_GSUAMB_NLCA1_NLCB1_PGR2_SU0_SUS0_SRVW4_TT1_16_VAW2_WSGRA1_WSGRB1_WG32_8_1_WGM1
    SolutionIndex: 67
    SolutionNameMin: Cijk_Ailk_Bjlk_HBH_MT64x64x32_MI32x32x8x1_SE_1LDSB0_AF0EM8_AF1EM1_EPS0_GRVW8_GSU15_GSUAMB_NLCA1_NLCB1_PGR2_SU0_SUS0_SRVW4_TT1_32_VAW1_WSGRA1_WSGRB1_WG64_4_1_WGM15
    SolutionIndex: 68
    SolutionNameMin: Cijk_Ailk_Bjlk_HBH_MT64x128x32_MI32x32x8x1_SE_1LDSB0_AF0EM8_AF1EM1_EPS0_GRVW4_GSU7_GSUAMB_NLCA1_NLCB1_PGR2_SU32_SUS256_SRVW4_TT1_64_VAW1_WSGRA1_WSGRB1_WG64_4_1_WGM2
    SolutionIndex: 69
    SolutionNameMin: Cijk_Ailk_Bjlk_HBH_MT128x256x16_MI32x32x8x1_SE_1LDSB0_AF0EM8_AF1EM1_EPS0_GRVW4_GSU5_GSUAMB_NLCA1_NLCB1_PGR2_SU0_SUS0_SRVW4_TT2_128_VAW1_WSGRA1_WSGRB1_WG64_4_1_WGM15
    SolutionIndex: 70
    SolutionNameMin: Cijk_Ailk_Bjlk_HBH_MT128x128x32_MI32x32x8x1_SE_1LDSB0_AF0EM8_AF1EM1_EPS0_GRVW4_GSU2_GSUAMB_NLCA1_NLCB1_PGR2_SU0_SUS0_SRVW4_TT2_64_VAW1_WSGRA1_WSGRB1_WG64_4_1_WGM15
    SolutionIndex: 71
    SolutionNameMin: Cijk_Ailk_Bjlk_HBH_MT128x160x32_MI32x32x8x1_SE_1LDSB0_AF0EM8_AF1EM1_EPS0_GRVW4_GSU2_GSUAMB_NLCA1_NLCB5_PGR2_SU0_SUS0_SRVW4_TT1_160_VAW1_WSGRA1_WSGRB1_WG128_2_1_WGM2
    SolutionIndex: 72
    SolutionNameMin: Cijk_Ailk_Bjlk_HBH_MT128x256x16_MI32x32x8x1_SE_1LDSB0_AF0EM8_AF1EM1_EPS0_GRVW4_GSU3_GSUAMB_NLCA1_NLCB1_PGR2_SU0_SUS0_SRVW4_TT2_128_VAW1_WSGRA1_WSGRB1_WG64_4_1_WGM2
    SolutionIndex: 73
    SolutionNameMin: Cijk_Ailk_Bjlk_HBH_MT128x160x32_MI32x32x8x1_SE_1LDSB0_AF0EM8_AF1EM1_EPS0_GRVW4_GSU1_GSUAMB_NLCA1_NLCB5_PGR2_SU0_SUS0_SRVW4_TT1_160_VAW2_WSGRA1_WSGRB1_WG128_2_1_WGM2
    SolutionIndex: 74
    SolutionNameMin: Cijk_Ailk_Bjlk_HBH_MT128x160x32_MI32x32x8x1_SE_1LDSB0_AF0EM8_AF1EM1_EPS0_GRVW4_GSU1_GSUAMB_NLCA1_NLCB5_PGR2_SU0_SUS0_SRVW4_TT1_160_VAW2_WSGRA1_WSGRB1_WG128_2_1_WGM15
    SolutionIndex: 75
    SolutionNameMin: Cijk_Ailk_Bjlk_HBH_MT128x192x32_MI32x32x8x1_SE_1LDSB0_AF0EM8_AF1EM1_EPS0_GRVW4_GSU1_GSUAMB_NLCA1_NLCB3_PGR2_SU0_SUS0_SRVW4_TT2_96_VAW2_WSGRA1_WSGRB1_WG64_4_1_WGM2
    SolutionIndex: 76
    SolutionNameMin: Cijk_Ailk_Bjlk_HBH_MT128x256x16_MI32x32x8x1_SE_1LDSB1_AF0EM8_AF1EM1_EPS0_GRVW8_GSU1_GSUAMB_NLCA1_NLCB1_PGR2_SU0_SUS0_SRVW4_TT2_128_VAW2_WSGRA1_WSGRB1_WG64_4_1_WGM2
    SolutionIndex: 77
    SolutionNameMin: Cijk_Ailk_Bjlk_HBH_MT128x256x16_MI32x32x8x1_SE_1LDSB0_AF0EM1_AF1EM1_EPS0_GRVW8_GSU1_GSUAMB_NLCA1_NLCB1_PGR2_SU0_SUS0_SRVW4_TT2_128_VAW2_WSGRA1_WSGRB1_WG64_4_1_WGM1
    SolutionIndex: 78
    SolutionNameMin: Cijk_Ailk_Bjlk_HBH_MT128x288x32_MI32x32x8x1_SE_1LDSB0_AF0EM8_AF1EM1_EPS0_GRVW4_GSU1_GSUAMB_NLCA1_NLCB9_PGR2_SU0_SUS0_SRVW4_TT1_288_VAW2_WSGRA1_WSGRB1_WG128_2_1_WGM15
    SolutionIndex: 79
    SolutionNameMin: Cijk_Ailk_Bjlk_HBH_MT256x160x32_MI32x32x8x1_SE_1LDSB0_AF0EM8_AF1EM1_EPS0_GRVW2_GSU1_GSUAMB_NLCA2_NLCB5_PGR2_SU0_SUS0_SRVW4_TT2_160_VAW2_WSGRA1_WSGRB1_WG128_2_1_WGM15
    SolutionIndex: 80
    SolutionNameMin: Cijk_Ailk_Bjlk_HBH_MT128x128x32_MI32x32x8x1_SE_1LDSB0_AF0EM1_AF1EM1_EPS0_GRVW4_GSU1_GSUAMB_NLCA1_NLCB1_PGR2_SU0_SUS0_SRVW4_TT2_64_VAW2_WSGRA1_WSGRB1_WG64_4_1_WGM2
    SolutionIndex: 81
    SolutionNameMin: Cijk_Ailk_Bjlk_HBH_MT128x256x16_MI32x32x8x1_SE_1LDSB1_AF0EM1_AF1EM1_EPS0_GRVW8_GSU1_GSUAMB_NLCA1_NLCB1_PGR2_SU0_SUS0_SRVW4_TT2_128_VAW2_WSGRA1_WSGRB1_WG64_4_1_WGM1
    SolutionIndex: 82
    SolutionNameMin: Cijk_Ailk_Bjlk_HBH_MT128x256x16_MI32x32x8x1_SE_1LDSB0_AF0EM8_AF1EM1_EPS0_GRVW4_GSU1_GSUAMB_NLCA1_NLCB1_PGR2_SU0_SUS0_SRVW4_TT2_128_VAW2_WSGRA1_WSGRB1_WG64_4_1_WGM15
    SolutionIndex: 83
    SolutionNameMin: Cijk_Ailk_Bjlk_HBH_MT128x256x16_MI32x32x8x1_SE_1LDSB0_AF0EM1_AF1EM1_EPS0_GRVW8_GSU1_GSUAMB_NLCA1_NLCB1_PGR2_SU0_SUS0_SRVW4_TT2_128_VAW2_WSGRA1_WSGRB1_WG64_4_1_WGM15
    SolutionIndex: 84
    SolutionNameMin: Cijk_Ailk_Bjlk_HBH_MT128x128x32_MI32x32x8x1_SE_1LDSB0_AF0EM1_AF1EM1_EPS0_GRVW4_GSU1_GSUAMB_NLCA1_NLCB1_PGR2_SU0_SUS0_SRVW4_TT2_64_VAW2_WSGRA1_WSGRB1_WG64_4_1_WGM1
    SolutionIndex: 85
    SolutionNameMin: Cijk_Ailk_Bjlk_HBH_MT64x32x16_MI16x16x16x1_SE_1LDSB0_AF0EM8_AF1EM1_EPS1_GRVW8_GSU1_GSUAMB_NLCA1_NLCB1_PGR1_SU32_SUS128_SRVW4_TT2_16_VAW2_WSGRA1_WSGRB1_WG32_8_1_WGM2
    SolutionIndex: 86
    SolutionNameMin: Cijk_Ailk_Bjlk_HBH_MT128x128x32_MI32x32x8x1_SE_1LDSB0_AF0EM1_AF1EM1_EPS0_GRVW8_GSU1_GSUAMB_NLCA1_NLCB1_PGR2_SU0_SUS0_SRVW4_TT2_64_VAW2_WSGRA1_WSGRB1_WG64_4_1_WGM2
    SolutionIndex: 87
    SolutionNameMin: Cijk_Ailk_Bjlk_HBH_MT64x64x32_MI32x32x8x1_SE_1LDSB0_AF0EM1_AF1EM1_EPS0_GRVW8_GSU1_GSUAMB_NLCA1_NLCB1_PGR2_SU0_SUS0_SRVW4_TT1_32_VAW2_WSGRA1_WSGRB1_WG64_4_1_WGM1
    SolutionIndex: 88
    SolutionNameMin: Cijk_Ailk_Bjlk_HBH_MT128x128x32_MI32x32x8x1_SE_1LDSB0_AF0EM8_AF1EM1_EPS0_GRVW8_GSU3_GSUAMB_NLCA1_NLCB1_PGR2_SU0_SUS0_SRVW4_TT2_64_VAW1_WSGRA1_WSGRB1_WG64_4_1_WGM1
    SolutionIndex: 89
    SolutionNameMin: Cijk_Ailk_Bjlk_HBH_MT128x64x64_MI32x32x8x1_SE_1LDSB0_AF0EM8_AF1EM1_EPS1_GRVW8_GSU5_GSUAMB_NLCA1_NLCB1_PGR1_SU0_SUS0_SRVW0_TT2_32_VAW1_WSGRA1_WSGRB1_WG64_4_1_WGM2
    SolutionIndex: 90
    SolutionNameMin: Cijk_Ailk_Bjlk_HBH_MT32x32x32_MI16x16x16x1_SE_1LDSB0_AF0EM8_AF1EM1_EPS1_GRVW2_GSU1_GSUAMB_NLCA1_NLCB1_PGR1_SU0_SUS0_SRVW4_TT1_16_VAW2_WSGRA1_WSGRB1_WG32_8_1_WGM1
    SolutionIndex: 91
    SolutionNameMin: Cijk_Ailk_Bjlk_HBH_MT128x64x16_MI32x32x8x1_SE_1LDSB0_AF0EM8_AF1EM1_EPS0_GRVW4_GSU1_GSUAMB_NLCA1_NLCB1_PGR2_SU0_SUS0_SRVW4_TT2_32_VAW2_WSGRA1_WSGRB1_WG64_4_1_WGM1
    SolutionIndex: 92
    SolutionNameMin: Cijk_Ailk_Bjlk_HBH_MT64x128x64_MI32x32x8x1_SE_1LDSB0_AF0EM8_AF1EM1_EPS1_GRVW8_GSU3_GSUAMB_NLCA1_NLCB1_PGR1_SU32_SUS128_SRVW0_TT1_64_VAW1_WSGRA1_WSGRB1_WG64_4_1_WGM2
    SolutionIndex: 93
    SolutionNameMin: Cijk_Ailk_Bjlk_HBH_MT128x64x64_MI32x32x8x1_SE_1LDSB0_AF0EM8_AF1EM1_EPS1_GRVW8_GSU3_GSUAMB_NLCA1_NLCB1_PGR1_SU0_SUS0_SRVW0_TT2_32_VAW1_WSGRA1_WSGRB1_WG64_4_1_WGM1
    SolutionIndex: 94
    SolutionNameMin: Cijk_Ailk_Bjlk_HBH_MT128x128x64_MI32x32x8x1_SE_1LDSB0_AF0EM8_AF1EM1_EPS0_GRVW8_GSU15_GSUAMB_NLCA1_NLCB1_PGR2_SU0_SUS0_SRVW4_TT2_64_VAW1_WSGRA1_WSGRB1_WG64_4_1_WGM2
    SolutionIndex: 95
    SolutionNameMin: Cijk_Ailk_Bjlk_HBH_MT128x128x32_MI32x32x8x1_SE_1LDSB0_AF0EM8_AF1EM1_EPS0_GRVW4_GSU3_GSUAMB_NLCA1_NLCB1_PGR2_SU0_SUS0_SRVW4_TT2_64_VAW1_WSGRA1_WSGRB1_WG64_4_1_WGM15
    SolutionIndex: 96
    SolutionNameMin: Cijk_Ailk_Bjlk_HBH_MT64x64x16_MI32x32x8x1_SE_1LDSB0_AF0EM8_AF1EM1_EPS0_GRVW2_GSU1_GSUAMB_NLCA1_NLCB1_PGR2_SU32_SUS256_SRVW4_TT1_32_VAW2_WSGRA1_WSGRB1_WG64_4_1_WGM1
    SolutionIndex: 97
    SolutionNameMin: Cijk_Ailk_Bjlk_HBH_MT128x256x32_MI32x32x8x1_SE_1LDSB0_AF0EM8_AF1EM1_EPS1_GRVW8_GSU3_GSUAMB_NLCA1_NLCB1_PGR1_SU0_SUS0_SRVW4_TT2_128_VAW1_WSGRA1_WSGRB1_WG64_4_1_WGM15
    SolutionIndex: 98
    SolutionNameMin: Cijk_Ailk_Bjlk_HBH_MT128x64x32_MI32x32x8x1_SE_1LDSB0_AF0EM8_AF1EM1_EPS0_GRVW8_GSU1_GSUAMB_NLCA1_NLCB1_PGR2_SU0_SUS0_SRVW4_TT2_32_VAW2_WSGRA1_WSGRB1_WG64_4_1_WGM2
    SolutionIndex: 99
    SolutionNameMin: Cijk_Ailk_Bjlk_HBH_MT64x128x32_MI32x32x8x1_SE_1LDSB0_AF0EM1_AF1EM1_EPS0_GRVW4_GSU1_GSUAMB_NLCA1_NLCB1_PGR2_SU0_SUS0_SRVW4_TT1_64_VAW2_WSGRA1_WSGRB1_WG64_4_1_WGM2
    SolutionIndex: 100
    SolutionNameMin: Cijk_Ailk_Bjlk_HBH_MT64x128x16_MI32x32x8x1_SE_1LDSB0_AF0EM8_AF1EM1_EPS0_GRVW8_GSU1_GSUAMB_NLCA1_NLCB1_PGR2_SU32_SUS128_SRVW4_TT1_64_VAW2_WSGRA1_WSGRB1_WG64_4_1_WGM2
    SolutionIndex: 101
    SolutionNameMin: Cijk_Ailk_Bjlk_HBH_MT16x16x16_MI16x16x16x1_SE_1LDSB0_AF0EM1_AF1EM1_EPS0_GRVW2_GSU1_GSUAMB_NLCA1_NLCB1_PGR2_SU32_SUS256_SRVW4_TT1_16_VAW2_WSGRA1_WSGRB1_WG16_4_1_WGM1
    SolutionIndex: 102
    SolutionNameMin: Cijk_Ailk_Bjlk_HBH_MT32x64x16_MI16x16x16x1_SE_1LDSB1_AF0EM1_AF1EM1_EPS0_GRVW8_GSU1_GSUAMB_NLCA1_NLCB1_PGR2_SU0_SUS0_SRVW4_TT1_32_VAW2_WSGRA1_WSGRB1_WG32_8_1_WGM2
    SolutionIndex: 103
    SolutionNameMin: Cijk_Ailk_Bjlk_HBH_MT32x64x16_MI16x16x16x1_SE_1LDSB1_AF0EM1_AF1EM1_EPS1_GRVW2_GSU1_GSUAMB_NLCA1_NLCB1_PGR1_SU0_SUS0_SRVW4_TT1_32_VAW2_WSGRA1_WSGRB1_WG32_8_1_WGM15
    SolutionIndex: 104
    SolutionNameMin: Cijk_Ailk_Bjlk_HBH_MT32x64x16_MI16x16x16x1_SE_1LDSB0_AF0EM1_AF1EM1_EPS1_GRVW2_GSU1_GSUAMB_NLCA1_NLCB1_PGR1_SU0_SUS0_SRVW4_TT1_32_VAW2_WSGRA1_WSGRB1_WG32_8_1_WGM1
    SolutionIndex: 105
    SolutionNameMin: Cijk_Ailk_Bjlk_HBH_MT32x64x16_MI16x16x16x1_SE_1LDSB0_AF0EM8_AF1EM1_EPS1_GRVW2_GSU1_GSUAMB_NLCA1_NLCB1_PGR1_SU0_SUS0_SRVW4_TT1_32_VAW2_WSGRA1_WSGRB1_WG32_8_1_WGM15
    SolutionIndex: 106
    SolutionNameMin: Cijk_Ailk_Bjlk_HBH_MT32x64x16_MI16x16x16x1_SE_1LDSB0_AF0EM1_AF1EM1_EPS1_GRVW2_GSU1_GSUAMB_NLCA1_NLCB1_PGR1_SU32_SUS256_SRVW4_TT1_32_VAW2_WSGRA1_WSGRB1_WG32_8_1_WGM2
    SolutionIndex: 107
    SolutionNameMin: Cijk_Ailk_Bjlk_HBH_MT32x64x16_MI16x16x16x1_SE_1LDSB0_AF0EM1_AF1EM1_EPS0_GRVW2_GSU1_GSUAMB_NLCA1_NLCB1_PGR2_SU32_SUS256_SRVW4_TT1_32_VAW2_WSGRA1_WSGRB1_WG32_8_1_WGM15
    SolutionIndex: 108
    SolutionNameMin: Cijk_Ailk_Bjlk_HBH_MT32x64x16_MI16x16x16x1_SE_1LDSB0_AF0EM8_AF1EM1_EPS0_GRVW8_GSU1_GSUAMB_NLCA1_NLCB1_PGR2_SU32_SUS256_SRVW4_TT1_32_VAW2_WSGRA1_WSGRB1_WG32_8_1_WGM2
    SolutionIndex: 109
    SolutionNameMin: Cijk_Ailk_Bjlk_HBH_MT64x32x16_MI16x16x16x1_SE_1LDSB1_AF0EM8_AF1EM1_EPS1_GRVW2_GSU1_GSUAMB_NLCA1_NLCB1_PGR1_SU0_SUS0_SRVW4_TT2_16_VAW2_WSGRA1_WSGRB1_WG32_8_1_WGM1
    SolutionIndex: 110
    SolutionNameMin: Cijk_Ailk_Bjlk_HBH_MT64x32x16_MI16x16x16x1_SE_1LDSB0_AF0EM8_AF1EM1_EPS0_GRVW8_GSU1_GSUAMB_NLCA1_NLCB1_PGR2_SU32_SUS128_SRVW4_TT2_16_VAW2_WSGRA1_WSGRB1_WG32_8_1_WGM2
    SolutionIndex: 111
    SolutionNameMin: Cijk_Ailk_Bjlk_HBH_MT64x32x16_MI16x16x16x1_SE_1LDSB0_AF0EM8_AF1EM1_EPS0_GRVW2_GSU1_GSUAMB_NLCA1_NLCB1_PGR2_SU32_SUS128_SRVW4_TT2_16_VAW2_WSGRA1_WSGRB1_WG32_8_1_WGM1
    SolutionIndex: 112
    SolutionNameMin: Cijk_Ailk_Bjlk_HBH_MT64x64x16_MI32x32x8x1_SE_1LDSB0_AF0EM8_AF1EM1_EPS1_GRVW2_GSU1_GSUAMB_NLCA1_NLCB1_PGR1_SU32_SUS256_SRVW4_TT1_32_VAW2_WSGRA1_WSGRB1_WG64_4_1_WGM1
    SolutionIndex: 113
    SolutionNameMin: Cijk_Ailk_Bjlk_HBH_MT64x64x16_MI32x32x8x1_SE_1LDSB0_AF0EM8_AF1EM1_EPS0_GRVW8_GSU1_GSUAMB_NLCA1_NLCB1_PGR2_SU32_SUS256_SRVW4_TT1_32_VAW2_WSGRA1_WSGRB1_WG64_4_1_WGM1
    SolutionIndex: 114
    SolutionNameMin: Cijk_Ailk_Bjlk_HBH_MT64x64x16_MI32x32x8x1_SE_1LDSB0_AF0EM8_AF1EM1_EPS0_GRVW2_GSU1_GSUAMB_NLCA1_NLCB1_PGR2_SU0_SUS0_SRVW4_TT1_32_VAW2_WSGRA1_WSGRB1_WG64_4_1_WGM2
    SolutionIndex: 115
    SolutionNameMin: Cijk_Ailk_Bjlk_HBH_MT128x96x32_MI32x32x8x1_SE_1LDSB0_AF0EM8_AF1EM1_EPS0_GRVW4_GSU1_GSUAMB_NLCA1_NLCB3_PGR2_SU0_SUS0_SRVW4_TT1_96_VAW2_WSGRA1_WSGRB1_WG128_2_1_WGM15
    SolutionIndex: 116
    SolutionNameMin: Cijk_Ailk_Bjlk_HBH_MT32x64x16_MI16x16x16x1_SE_1LDSB0_AF0EM1_AF1EM1_EPS0_GRVW8_GSU1_GSUAMB_NLCA1_NLCB1_PGR2_SU32_SUS256_SRVW4_TT1_32_VAW2_WSGRA1_WSGRB1_WG32_8_1_WGM2
    SolutionIndex: 117
    SolutionNameMin: Cijk_Ailk_Bjlk_HBH_MT64x192x32_MI32x32x8x1_SE_1LDSB0_AF0EM8_AF1EM1_EPS0_GRVW4_GSU1_GSUAMB_NLCA1_NLCB3_PGR2_SU0_SUS0_SRVW4_TT1_96_VAW2_WSGRA1_WSGRB1_WG64_4_1_WGM1
    SolutionIndex: 118
    SolutionNameMin: Cijk_Ailk_Bjlk_HBH_MT64x128x16_MI32x32x8x1_SE_1LDSB0_AF0EM8_AF1EM1_EPS0_GRVW2_GSU1_GSUAMB_NLCA1_NLCB1_PGR2_SU0_SUS0_SRVW4_TT1_64_VAW2_WSGRA1_WSGRB1_WG64_4_1_WGM2
    SolutionIndex: 119
    SolutionNameMin: Cijk_Ailk_Bjlk_HBH_MT64x128x16_MI32x32x8x1_SE_1LDSB0_AF0EM8_AF1EM1_EPS0_GRVW4_GSU1_GSUAMB_NLCA1_NLCB1_PGR2_SU32_SUS128_SRVW4_TT1_64_VAW2_WSGRA1_WSGRB1_WG64_4_1_WGM1
    SolutionIndex: 120
    SolutionNameMin: Cijk_Ailk_Bjlk_HBH_MT64x128x16_MI32x32x8x1_SE_1LDSB0_AF0EM8_AF1EM1_EPS0_GRVW4_GSU1_GSUAMB_NLCA1_NLCB1_PGR2_SU0_SUS0_SRVW4_TT1_64_VAW2_WSGRA1_WSGRB1_WG64_4_1_WGM2
    SolutionIndex: 121
    SolutionNameMin: Cijk_Ailk_Bjlk_HBH_MT64x64x16_MI32x32x8x1_SE_1LDSB0_AF0EM1_AF1EM1_EPS0_GRVW2_GSU1_GSUAMB_NLCA1_NLCB1_PGR2_SU32_SUS128_SRVW4_TT1_32_VAW2_WSGRA1_WSGRB1_WG64_4_1_WGM15
    SolutionIndex: 122
    SolutionNameMin: Cijk_Ailk_Bjlk_HBH_MT64x64x16_MI32x32x8x1_SE_1LDSB0_AF0EM1_AF1EM1_EPS1_GRVW2_GSU1_GSUAMB_NLCA1_NLCB1_PGR1_SU0_SUS0_SRVW4_TT1_32_VAW2_WSGRA1_WSGRB1_WG64_4_1_WGM2
    SolutionIndex: 123
    SolutionNameMin: Cijk_Ailk_Bjlk_HBH_MT64x64x16_MI32x32x8x1_SE_1LDSB0_AF0EM1_AF1EM1_EPS0_GRVW2_GSU1_GSUAMB_NLCA1_NLCB1_PGR2_SU32_SUS128_SRVW4_TT1_32_VAW2_WSGRA1_WSGRB1_WG64_4_1_WGM2
    SolutionIndex: 124
    SolutionNameMin: Cijk_Ailk_Bjlk_HBH_MT64x64x16_MI32x32x8x1_SE_1LDSB0_AF0EM1_AF1EM1_EPS1_GRVW8_GSU1_GSUAMB_NLCA1_NLCB1_PGR1_SU0_SUS0_SRVW4_TT1_32_VAW2_WSGRA1_WSGRB1_WG64_4_1_WGM1
    SolutionIndex: 125
    SolutionNameMin: Cijk_Ailk_Bjlk_HBH_MT128x96x16_MI32x32x8x1_SE_1LDSB0_AF0EM1_AF1EM1_EPS1_GRVW2_GSU1_GSUAMB_NLCA1_NLCB3_PGR1_SU32_SUS256_SRVW4_TT1_96_VAW2_WSGRA1_WSGRB1_WG128_2_1_WGM15
    SolutionIndex: 126
    SolutionNameMin: Cijk_Ailk_Bjlk_HBH_MT128x96x16_MI32x32x8x1_SE_1LDSB0_AF0EM1_AF1EM1_EPS1_GRVW2_GSU1_GSUAMB_NLCA1_NLCB3_PGR1_SU0_SUS0_SRVW4_TT1_96_VAW2_WSGRA1_WSGRB1_WG128_2_1_WGM15
    SolutionIndex: 127
    SolutionNameMin: Cijk_Ailk_Bjlk_HBH_MT64x128x16_MI32x32x8x1_SE_1LDSB0_AF0EM1_AF1EM1_EPS0_GRVW8_GSU1_GSUAMB_NLCA1_NLCB1_PGR2_SU32_SUS128_SRVW4_TT1_64_VAW2_WSGRA1_WSGRB1_WG64_4_1_WGM2
    SolutionIndex: 128
    SolutionNameMin: Cijk_Ailk_Bjlk_HBH_MT64x128x16_MI32x32x8x1_SE_1LDSB0_AF0EM8_AF1EM1_EPS0_GRVW4_GSU1_GSUAMB_NLCA1_NLCB1_PGR2_SU0_SUS0_SRVW4_TT1_64_VAW2_WSGRA1_WSGRB1_WG64_4_1_WGM1
    SolutionIndex: 129
    SolutionNameMin: Cijk_Ailk_Bjlk_HBH_MT64x64x16_MI32x32x8x1_SE_1LDSB0_AF0EM1_AF1EM1_EPS0_GRVW4_GSU1_GSUAMB_NLCA1_NLCB1_PGR2_SU0_SUS0_SRVW4_TT1_32_VAW2_WSGRA1_WSGRB1_WG64_4_1_WGM1
    SolutionIndex: 130
    SolutionNameMin: Cijk_Ailk_Bjlk_HBH_MT64x64x16_MI32x32x8x1_SE_1LDSB0_AF0EM8_AF1EM1_EPS0_GRVW2_GSU1_GSUAMB_NLCA1_NLCB1_PGR2_SU0_SUS0_SRVW4_TT1_32_VAW2_WSGRA1_WSGRB1_WG64_4_1_WGM1
    SolutionIndex: 131
    SolutionNameMin: Cijk_Ailk_Bjlk_HBH_MT96x128x32_MI32x32x8x1_SE_1LDSB0_AF0EM1_AF1EM1_EPS0_GRVW4_GSU1_GSUAMB_NLCA3_NLCB1_PGR2_SU0_SUS0_SRVW0_TT3_32_VAW2_WSGRA1_WSGRB1_WG32_8_1_WGM1
    SolutionIndex: 132
    SolutionNameMin: Cijk_Ailk_Bjlk_HBH_MT64x128x32_MI32x32x8x1_SE_1LDSB0_AF0EM1_AF1EM1_EPS0_GRVW8_GSU1_GSUAMB_NLCA1_NLCB1_PGR2_SU32_SUS256_SRVW4_TT1_64_VAW2_WSGRA1_WSGRB1_WG64_4_1_WGM15
    SolutionIndex: 133
    SolutionNameMin: Cijk_Ailk_Bjlk_HBH_MT128x64x16_MI32x32x8x1_SE_1LDSB0_AF0EM8_AF1EM1_EPS0_GRVW8_GSU1_GSUAMB_NLCA1_NLCB1_PGR2_SU32_SUS256_SRVW4_TT2_32_VAW2_WSGRA1_WSGRB1_WG64_4_1_WGM1
    SolutionIndex: 134
    SolutionNameMin: Cijk_Ailk_Bjlk_HBH_MT128x128x16_MI32x32x8x1_SE_1LDSB0_AF0EM8_AF1EM1_EPS0_GRVW4_GSU1_GSUAMB_NLCA1_NLCB1_PGR2_SU0_SUS0_SRVW4_TT2_64_VAW2_WSGRA1_WSGRB1_WG64_4_1_WGM15
    SolutionIndex: 135
    SolutionNameMin: Cijk_Ailk_Bjlk_HBH_MT128x128x16_MI32x32x8x1_SE_1LDSB0_AF0EM8_AF1EM1_EPS0_GRVW8_GSU1_GSUAMB_NLCA1_NLCB1_PGR2_SU0_SUS0_SRVW4_TT2_64_VAW2_WSGRA1_WSGRB1_WG64_4_1_WGM15
    SolutionIndex: 136
    SolutionNameMin: Cijk_Ailk_Bjlk_HBH_MT128x128x16_MI32x32x8x1_SE_1LDSB0_AF0EM1_AF1EM1_EPS0_GRVW8_GSU1_GSUAMB_NLCA1_NLCB1_PGR2_SU0_SUS0_SRVW4_TT2_64_VAW2_WSGRA1_WSGRB1_WG64_4_1_WGM2
    SolutionIndex: 137
    SolutionNameMin: Cijk_Ailk_Bjlk_HBH_MT64x128x16_MI32x32x8x1_SE_1LDSB0_AF0EM1_AF1EM1_EPS0_GRVW8_GSU1_GSUAMB_NLCA1_NLCB1_PGR2_SU32_SUS128_SRVW4_TT1_64_VAW2_WSGRA1_WSGRB1_WG64_4_1_WGM1
    SolutionIndex: 138
    SolutionNameMin: Cijk_Ailk_Bjlk_HBH_MT128x256x16_MI32x32x8x1_SE_1LDSB1_AF0EM1_AF1EM1_EPS0_GRVW8_GSU1_GSUAMB_NLCA1_NLCB1_PGR2_SU0_SUS0_SRVW4_TT2_128_VAW2_WSGRA1_WSGRB1_WG64_4_1_WGM2
    SolutionIndex: 139
    SolutionNameMin: Cijk_Ailk_Bjlk_HBH_MT64x32x16_MI16x16x16x1_SE_1LDSB0_AF0EM8_AF1EM1_EPS0_GRVW2_GSU1_GSUAMB_NLCA1_NLCB1_PGR2_SU32_SUS256_SRVW4_TT2_16_VAW2_WSGRA1_WSGRB1_WG32_8_1_WGM2
    SolutionIndex: 140
    SolutionNameMin: Cijk_Ailk_Bjlk_HBH_MT128x96x16_MI32x32x8x1_SE_1LDSB0_AF0EM8_AF1EM1_EPS0_GRVW2_GSU1_GSUAMB_NLCA1_NLCB3_PGR2_SU0_SUS0_SRVW4_TT1_96_VAW2_WSGRA1_WSGRB1_WG128_2_1_WGM15
    SolutionIndex: 141
    SolutionNameMin: Cijk_Ailk_Bjlk_HBH_MT64x128x16_MI32x32x8x1_SE_1LDSB0_AF0EM8_AF1EM1_EPS1_GRVW2_GSU1_GSUAMB_NLCA1_NLCB1_PGR1_SU32_SUS128_SRVW4_TT1_64_VAW2_WSGRA1_WSGRB1_WG64_4_1_WGM15
    SolutionIndex: 142
    SolutionNameMin: Cijk_Ailk_Bjlk_HBH_MT64x16x32_MI16x16x16x1_SE_1LDSB0_AF0EM8_AF1EM1_EPS0_GRVW8_GSU15_GSUAMB_NLCA1_NLCB1_PGR2_SU32_SUS128_SRVW0_TT1_16_VAW1_WSGRA1_WSGRB1_WG64_4_1_WGM2
    SolutionIndex: 143
    SolutionNameMin: Cijk_Ailk_Bjlk_HBH_MT64x64x16_MI32x32x8x1_SE_1LDSB0_AF0EM8_AF1EM1_EPS0_GRVW8_GSU1_GSUAMB_NLCA1_NLCB1_PGR2_SU0_SUS0_SRVW4_TT1_32_VAW2_WSGRA1_WSGRB1_WG64_4_1_WGM1
    SolutionIndex: 144
    SolutionNameMin: Cijk_Ailk_Bjlk_HBH_MT64x128x16_MI32x32x8x1_SE_1LDSB0_AF0EM8_AF1EM1_EPS0_GRVW2_GSU1_GSUAMB_NLCA1_NLCB1_PGR2_SU32_SUS256_SRVW4_TT1_64_VAW2_WSGRA1_WSGRB1_WG64_4_1_WGM2
    SolutionIndex: 145
    SolutionNameMin: Cijk_Ailk_Bjlk_HBH_MT16x16x32_MI16x16x16x1_SE_1LDSB0_AF0EM8_AF1EM1_EPS0_GRVW2_GSU5_GSUAMB_NLCA1_NLCB1_PGR2_SU0_SUS0_SRVW0_TT1_16_VAW1_WSGRA1_WSGRB1_WG16_4_1_WGM1
    SolutionIndex: 146
    SolutionNameMin: Cijk_Ailk_Bjlk_HBH_MT64x32x16_MI16x16x16x1_SE_1LDSB0_AF0EM8_AF1EM1_EPS1_GRVW2_GSU1_GSUAMB_NLCA1_NLCB1_PGR1_SU0_SUS0_SRVW4_TT2_16_VAW2_WSGRA1_WSGRB1_WG32_8_1_WGM15
    SolutionIndex: 147
    SolutionNameMin: Cijk_Ailk_Bjlk_HBH_MT64x64x32_MI32x32x8x1_SE_1LDSB0_AF0EM1_AF1EM1_EPS0_GRVW4_GSU1_GSUAMB_NLCA1_NLCB1_PGR2_SU0_SUS0_SRVW4_TT1_32_VAW2_WSGRA1_WSGRB1_WG64_4_1_WGM1
    SolutionIndex: 148
    SolutionNameMin: Cijk_Ailk_Bjlk_HBH_MT128x128x16_MI32x32x8x1_SE_1LDSB0_AF0EM8_AF1EM1_EPS0_GRVW8_GSU1_GSUAMB_NLCA1_NLCB1_PGR2_SU32_SUS128_SRVW4_TT2_64_VAW2_WSGRA1_WSGRB1_WG64_4_1_WGM1
    SolutionIndex: 149
    SolutionNameMin: Cijk_Ailk_Bjlk_HBH_MT128x64x64_MI32x32x8x1_SE_1LDSB0_AF0EM1_AF1EM1_EPS0_GRVW8_GSU1_GSUAMB_NLCA1_NLCB1_PGR2_SU32_SUS256_SRVW4_TT2_32_VAW2_WSGRA1_WSGRB1_WG64_4_1_WGM15
    SolutionIndex: 150
    SolutionNameMin: Cijk_Ailk_Bjlk_HBH_MT128x64x16_MI32x32x8x1_SE_1LDSB0_AF0EM8_AF1EM1_EPS0_GRVW2_GSU1_GSUAMB_NLCA1_NLCB1_PGR2_SU0_SUS0_SRVW4_TT2_32_VAW2_WSGRA1_WSGRB1_WG64_4_1_WGM1
    SolutionIndex: 151
    SolutionNameMin: Cijk_Ailk_Bjlk_HBH_MT128x64x16_MI32x32x8x1_SE_1LDSB0_AF0EM1_AF1EM1_EPS0_GRVW8_GSU1_GSUAMB_NLCA1_NLCB1_PGR2_SU0_SUS0_SRVW4_TT2_32_VAW2_WSGRA1_WSGRB1_WG64_4_1_WGM2
    SolutionIndex: 152
    SolutionNameMin: Cijk_Ailk_Bjlk_HBH_MT256x128x32_MI32x32x8x1_SE_1LDSB0_AF0EM8_AF1EM1_EPS1_GRVW8_GSU1_GSUAMB_NLCA1_NLCB1_PGR1_SU0_SUS0_SRVW4_TT4_64_VAW2_WSGRA1_WSGRB1_WG64_4_1_WGM15
    SolutionIndex: 153
    SolutionNameMin: Cijk_Ailk_Bjlk_HBH_MT128x256x16_MI32x32x8x1_SE_1LDSB0_AF0EM8_AF1EM1_EPS0_GRVW4_GSU1_GSUAMB_NLCA1_NLCB1_PGR2_SU0_SUS0_SRVW4_TT2_128_VAW2_WSGRA1_WSGRB1_WG64_4_1_WGM1
    SolutionIndex: 154
    SolutionNameMin: Cijk_Ailk_Bjlk_HBH_MT128x256x16_MI32x32x8x1_SE_1LDSB0_AF0EM8_AF1EM1_EPS0_GRVW8_GSU1_GSUAMB_NLCA1_NLCB1_PGR2_SU0_SUS0_SRVW4_TT2_128_VAW2_WSGRA1_WSGRB1_WG64_4_1_WGM2
    SolutionIndex: 155
    SolutionNameMin: Cijk_Ailk_Bjlk_HBH_MT128x192x32_MI32x32x8x1_SE_1LDSB0_AF0EM8_AF1EM1_EPS0_GRVW4_GSU1_GSUAMB_NLCA1_NLCB3_PGR2_SU0_SUS0_SRVW4_TT2_96_VAW2_WSGRA1_WSGRB1_WG64_4_1_WGM15
    SolutionIndex: 156
    SolutionNameMin: Cijk_Ailk_Bjlk_HBH_MT128x96x16_MI32x32x8x1_SE_1LDSB0_AF0EM1_AF1EM1_EPS0_GRVW2_GSU1_GSUAMB_NLCA1_NLCB3_PGR2_SU0_SUS0_SRVW4_TT1_96_VAW2_WSGRA1_WSGRB1_WG128_2_1_WGM1
    SolutionIndex: 157
    SolutionNameMin: Cijk_Ailk_Bjlk_HBH_MT64x128x32_MI32x32x8x1_SE_1LDSB0_AF0EM8_AF1EM1_EPS0_GRVW4_GSU1_GSUAMB_NLCA1_NLCB1_PGR2_SU32_SUS256_SRVW4_TT1_64_VAW2_WSGRA1_WSGRB1_WG64_4_1_WGM15
    SolutionIndex: 158
    SolutionNameMin: Cijk_Ailk_Bjlk_HBH_MT64x128x16_MI32x32x8x1_SE_1LDSB0_AF0EM8_AF1EM1_EPS0_GRVW2_GSU1_GSUAMB_NLCA1_NLCB1_PGR2_SU0_SUS0_SRVW4_TT1_64_VAW2_WSGRA1_WSGRB1_WG64_4_1_WGM1
    SolutionIndex: 159
    SolutionNameMin: Cijk_Ailk_Bjlk_HBH_MT96x128x32_MI32x32x8x1_SE_1LDSB0_AF0EM8_AF1EM1_EPS0_GRVW4_GSU1_GSUAMB_NLCA3_NLCB1_PGR2_SU0_SUS0_SRVW0_TT3_32_VAW2_WSGRA1_WSGRB1_WG32_8_1_WGM1
    SolutionIndex: 160
    SolutionNameMin: Cijk_Ailk_Bjlk_HBH_MT128x64x16_MI32x32x8x1_SE_1LDSB0_AF0EM8_AF1EM1_EPS0_GRVW8_GSU1_GSUAMB_NLCA1_NLCB1_PGR2_SU0_SUS0_SRVW4_TT2_32_VAW2_WSGRA1_WSGRB1_WG64_4_1_WGM15
    SolutionIndex: 161
    SolutionNameMin: Cijk_Ailk_Bjlk_HBH_MT128x64x64_MI32x32x8x1_SE_1LDSB0_AF0EM8_AF1EM1_EPS0_GRVW8_GSU1_GSUAMB_NLCA1_NLCB1_PGR2_SU0_SUS0_SRVW4_TT2_32_VAW2_WSGRA1_WSGRB1_WG64_4_1_WGM2
    SolutionIndex: 162
    SolutionNameMin: Cijk_Ailk_Bjlk_HBH_MT64x64x64_MI32x32x8x1_SE_1LDSB0_AF0EM8_AF1EM1_EPS0_GRVW8_GSU15_GSUAMB_NLCA1_NLCB1_PGR2_SU32_SUS128_SRVW4_TT1_32_VAW1_WSGRA1_WSGRB1_WG64_4_1_WGM1
    SolutionIndex: 163
    SolutionNameMin: Cijk_Ailk_Bjlk_HBH_MT64x64x32_MI32x32x8x1_SE_1LDSB0_AF0EM8_AF1EM1_EPS0_GRVW4_GSU15_GSUAMB_NLCA1_NLCB1_PGR2_SU32_SUS256_SRVW4_TT1_32_VAW1_WSGRA1_WSGRB1_WG64_4_1_WGM1
    SolutionIndex: 164
    SolutionNameMin: Cijk_Ailk_Bjlk_HBH_MT64x64x64_MI32x32x8x1_SE_1LDSB0_AF0EM8_AF1EM1_EPS1_GRVW8_GSU5_GSUAMB_NLCA1_NLCB1_PGR1_SU0_SUS0_SRVW0_TT1_32_VAW1_WSGRA1_WSGRB1_WG64_4_1_WGM2
    SolutionIndex: 165
    SolutionNameMin: Cijk_Ailk_Bjlk_HBH_MT64x64x64_MI32x32x8x1_SE_1LDSB0_AF0EM8_AF1EM1_EPS1_GRVW8_GSU5_GSUAMB_NLCA1_NLCB1_PGR1_SU0_SUS0_SRVW0_TT1_32_VAW1_WSGRA1_WSGRB1_WG64_4_1_WGM1
    SolutionIndex: 166
    SolutionNameMin: Cijk_Ailk_Bjlk_HBH_MT128x256x16_MI32x32x8x1_SE_1LDSB0_AF0EM8_AF1EM1_EPS0_GRVW8_GSU15_GSUAMB_NLCA1_NLCB1_PGR2_SU0_SUS0_SRVW4_TT2_128_VAW1_WSGRA1_WSGRB1_WG64_4_1_WGM2
    SolutionIndex: 167
    SolutionNameMin: Cijk_Ailk_Bjlk_HBH_MT128x128x32_MI32x32x8x1_SE_1LDSB0_AF0EM8_AF1EM1_EPS0_GRVW8_GSU1_GSUAMB_NLCA1_NLCB1_PGR2_SU0_SUS0_SRVW4_TT2_64_VAW2_WSGRA1_WSGRB1_WG64_4_1_WGM15
    SolutionIndex: 168
    SolutionNameMin: Cijk_Ailk_Bjlk_HBH_MT64x128x32_MI32x32x8x1_SE_1LDSB0_AF0EM8_AF1EM1_EPS0_GRVW2_GSU1_GSUAMB_NLCA1_NLCB1_PGR2_SU0_SUS0_SRVW4_TT1_64_VAW2_WSGRA1_WSGRB1_WG64_4_1_WGM2
    SolutionIndex: 169
    SolutionNameMin: Cijk_Ailk_Bjlk_HBH_MT128x64x32_MI32x32x8x1_SE_1LDSB0_AF0EM8_AF1EM1_EPS0_GRVW2_GSU1_GSUAMB_NLCA1_NLCB1_PGR2_SU0_SUS0_SRVW4_TT2_32_VAW2_WSGRA1_WSGRB1_WG64_4_1_WGM1
    SolutionIndex: 170
    SolutionNameMin: Cijk_Ailk_Bjlk_HBH_MT32x32x64_MI16x16x16x1_SE_1LDSB0_AF0EM1_AF1EM1_EPS0_GRVW8_GSU7_GSUAMB_NLCA1_NLCB1_PGR2_SU32_SUS256_SRVW4_TT1_16_VAW1_WSGRA1_WSGRB1_WG32_8_1_WGM1
    SolutionIndex: 171
    SolutionNameMin: Cijk_Ailk_Bjlk_HBH_MT128x256x32_MI32x32x8x1_SE_1LDSB0_AF0EM8_AF1EM1_EPS1_GRVW8_GSU1_GSUAMB_NLCA1_NLCB1_PGR1_SU0_SUS0_SRVW4_TT2_128_VAW2_WSGRA1_WSGRB1_WG64_4_1_WGM2
    SolutionIndex: 172
    SolutionNameMin: Cijk_Ailk_Bjlk_HBH_MT64x32x16_MI16x16x16x1_SE_1LDSB1_AF0EM8_AF1EM1_EPS0_GRVW2_GSU1_GSUAMB_NLCA1_NLCB1_PGR2_SU0_SUS0_SRVW4_TT2_16_VAW2_WSGRA1_WSGRB1_WG32_8_1_WGM15
    SolutionIndex: 173
    SolutionNameMin: Cijk_Ailk_Bjlk_HBH_MT128x256x16_MI32x32x8x1_SE_1LDSB0_AF0EM8_AF1EM1_EPS0_GRVW8_GSU1_GSUAMB_NLCA1_NLCB1_PGR2_SU0_SUS0_SRVW4_TT2_128_VAW2_WSGRA1_WSGRB1_WG64_4_1_WGM15
    SolutionIndex: 174
    SolutionNameMin: Cijk_Ailk_Bjlk_HBH_MT128x256x16_MI32x32x8x1_SE_1LDSB0_AF0EM8_AF1EM1_EPS0_GRVW8_GSU1_GSUAMB_NLCA1_NLCB1_PGR2_SU32_SUS256_SRVW4_TT2_128_VAW2_WSGRA1_WSGRB1_WG64_4_1_WGM2
    SolutionIndex: 175
    SolutionNameMin: Cijk_Ailk_Bjlk_HBH_MT64x64x16_MI32x32x8x1_SE_1LDSB0_AF0EM8_AF1EM1_EPS0_GRVW4_GSU1_GSUAMB_NLCA1_NLCB1_PGR2_SU0_SUS0_SRVW4_TT1_32_VAW2_WSGRA1_WSGRB1_WG64_4_1_WGM1
    SolutionIndex: 176
    SolutionNameMin: Cijk_Ailk_Bjlk_HBH_MT128x128x16_MI32x32x8x1_SE_1LDSB0_AF0EM1_AF1EM1_EPS0_GRVW8_GSU1_GSUAMB_NLCA1_NLCB1_PGR2_SU0_SUS0_SRVW4_TT2_64_VAW2_WSGRA1_WSGRB1_WG64_4_1_WGM15
    SolutionIndex: 177
    SolutionNameMin: Cijk_Ailk_Bjlk_HBH_MT128x256x16_MI32x32x8x1_SE_1LDSB1_AF0EM8_AF1EM1_EPS0_GRVW8_GSU1_GSUAMB_NLCA1_NLCB1_PGR2_SU0_SUS0_SRVW4_TT2_128_VAW2_WSGRA1_WSGRB1_WG64_4_1_WGM15
    SolutionIndex: 178
    SolutionNameMin: Cijk_Ailk_Bjlk_HBH_MT128x64x16_MI32x32x8x1_SE_1LDSB0_AF0EM8_AF1EM1_EPS0_GRVW2_GSU1_GSUAMB_NLCA1_NLCB1_PGR2_SU32_SUS256_SRVW4_TT2_32_VAW2_WSGRA1_WSGRB1_WG64_4_1_WGM2
    SolutionIndex: 179
    SolutionNameMin: Cijk_Ailk_Bjlk_HBH_MT128x128x16_MI32x32x8x1_SE_1LDSB0_AF0EM8_AF1EM1_EPS0_GRVW2_GSU1_GSUAMB_NLCA1_NLCB1_PGR2_SU0_SUS0_SRVW4_TT2_64_VAW2_WSGRA1_WSGRB1_WG64_4_1_WGM1
    SolutionIndex: 180
    SolutionNameMin: Cijk_Ailk_Bjlk_HBH_MT128x128x16_MI32x32x8x1_SE_1LDSB0_AF0EM8_AF1EM1_EPS0_GRVW2_GSU1_GSUAMB_NLCA1_NLCB1_PGR2_SU32_SUS256_SRVW4_TT2_64_VAW2_WSGRA1_WSGRB1_WG64_4_1_WGM1
    SolutionIndex: 181
    SolutionNameMin: Cijk_Ailk_Bjlk_HBH_MT128x128x16_MI32x32x8x1_SE_1LDSB0_AF0EM1_AF1EM1_EPS0_GRVW8_GSU1_GSUAMB_NLCA1_NLCB1_PGR2_SU0_SUS0_SRVW4_TT2_64_VAW2_WSGRA1_WSGRB1_WG64_4_1_WGM1
    SolutionIndex: 182
    SolutionNameMin: Cijk_Ailk_Bjlk_HBH_MT128x64x32_MI32x32x8x1_SE_1LDSB0_AF0EM8_AF1EM1_EPS1_GRVW8_GSU1_GSUAMB_NLCA1_NLCB1_PGR1_SU0_SUS0_SRVW4_TT2_32_VAW2_WSGRA1_WSGRB1_WG64_4_1_WGM15
    SolutionIndex: 183
    SolutionNameMin: Cijk_Ailk_Bjlk_HBH_MT128x128x32_MI32x32x8x1_SE_1LDSB0_AF0EM8_AF1EM1_EPS0_GRVW8_GSU3_GSUAMB_NLCA1_NLCB1_PGR2_SU0_SUS0_SRVW4_TT2_64_VAW1_WSGRA1_WSGRB1_WG64_4_1_WGM15
    SolutionIndex: 184
    SolutionNameMin: Cijk_Ailk_Bjlk_HBH_MT128x64x16_MI32x32x8x1_SE_1LDSB0_AF0EM8_AF1EM1_EPS1_GRVW8_GSU1_GSUAMB_NLCA1_NLCB1_PGR1_SU0_SUS0_SRVW4_TT2_32_VAW2_WSGRA1_WSGRB1_WG64_4_1_WGM1
    SolutionIndex: 185
    SolutionNameMin: Cijk_Ailk_Bjlk_HBH_MT64x128x64_MI32x32x8x1_SE_1LDSB0_AF0EM8_AF1EM1_EPS0_GRVW8_GSU1_GSUAMB_NLCA1_NLCB1_PGR2_SU0_SUS0_SRVW4_TT1_64_VAW2_WSGRA1_WSGRB1_WG64_4_1_WGM15
    SolutionIndex: 186
    SolutionNameMin: Cijk_Ailk_Bjlk_HBH_MT128x128x32_MI32x32x8x1_SE_1LDSB0_AF0EM8_AF1EM1_EPS0_GRVW4_GSU1_GSUAMB_NLCA1_NLCB1_PGR2_SU0_SUS0_SRVW4_TT2_64_VAW2_WSGRA1_WSGRB1_WG64_4_1_WGM2
    SolutionIndex: 187
    SolutionNameMin: Cijk_Ailk_Bjlk_HBH_MT128x128x32_MI32x32x8x1_SE_1LDSB0_AF0EM8_AF1EM1_EPS0_GRVW8_GSU1_GSUAMB_NLCA1_NLCB1_PGR2_SU32_SUS256_SRVW4_TT2_64_VAW2_WSGRA1_WSGRB1_WG64_4_1_WGM15
    SolutionIndex: 188
    SolutionNameMin: Cijk_Ailk_Bjlk_HBH_MT128x64x16_MI32x32x8x1_SE_1LDSB0_AF0EM8_AF1EM1_EPS0_GRVW8_GSU1_GSUAMB_NLCA1_NLCB1_PGR2_SU0_SUS0_SRVW4_TT2_32_VAW2_WSGRA1_WSGRB1_WG64_4_1_WGM2
    SolutionIndex: 189
    SolutionNameMin: Cijk_Ailk_Bjlk_HBH_MT64x192x16_MI32x32x8x1_SE_1LDSB0_AF0EM8_AF1EM1_EPS0_GRVW4_GSU1_GSUAMB_NLCA1_NLCB3_PGR2_SU0_SUS0_SRVW4_TT1_96_VAW2_WSGRA1_WSGRB1_WG64_4_1_WGM15
    SolutionIndex: 190
    SolutionNameMin: Cijk_Ailk_Bjlk_HBH_MT128x128x32_MI32x32x8x1_SE_1LDSB0_AF0EM8_AF1EM1_EPS0_GRVW8_GSU1_GSUAMB_NLCA1_NLCB1_PGR2_SU0_SUS0_SRVW4_TT2_64_VAW2_WSGRA1_WSGRB1_WG64_4_1_WGM2
    SolutionIndex: 191
    SolutionNameMin: Cijk_Ailk_Bjlk_HBH_MT32x32x16_MI16x16x16x1_SE_1LDSB0_AF0EM8_AF1EM1_EPS0_GRVW4_GSU1_GSUAMB_NLCA1_NLCB1_PGR2_SU0_SUS0_SRVW4_TT1_16_VAW2_WSGRA1_WSGRB1_WG32_8_1_WGM1
    SolutionIndex: 192
    SolutionNameMin: Cijk_Ailk_Bjlk_HBH_MT32x32x16_MI16x16x16x1_SE_1LDSB0_AF0EM8_AF1EM1_EPS1_GRVW4_GSU1_GSUAMB_NLCA1_NLCB1_PGR1_SU0_SUS0_SRVW4_TT1_16_VAW2_WSGRA1_WSGRB1_WG32_8_1_WGM15
    SolutionIndex: 193
    SolutionNameMin: Cijk_Ailk_Bjlk_HBH_MT64x32x16_MI16x16x16x1_SE_1LDSB1_AF0EM8_AF1EM1_EPS1_GRVW2_GSU1_GSUAMB_NLCA1_NLCB1_PGR1_SU32_SUS256_SRVW4_TT2_16_VAW2_WSGRA1_WSGRB1_WG32_8_1_WGM2
    SolutionIndex: 194
    SolutionNameMin: Cijk_Ailk_Bjlk_HBH_MT64x64x32_MI32x32x8x1_SE_1LDSB0_AF0EM8_AF1EM1_EPS0_GRVW8_GSU1_GSUAMB_NLCA1_NLCB1_PGR2_SU0_SUS0_SRVW4_TT1_32_VAW2_WSGRA1_WSGRB1_WG64_4_1_WGM2
    SolutionIndex: 195
    SolutionNameMin: Cijk_Ailk_Bjlk_HBH_MT64x128x16_MI32x32x8x1_SE_1LDSB0_AF0EM8_AF1EM1_EPS0_GRVW8_GSU1_GSUAMB_NLCA1_NLCB1_PGR2_SU32_SUS256_SRVW4_TT1_64_VAW2_WSGRA1_WSGRB1_WG64_4_1_WGM2
    SolutionIndex: 196
    SolutionNameMin: Cijk_Ailk_Bjlk_HBH_MT128x128x16_MI32x32x8x1_SE_1LDSB0_AF0EM1_AF1EM1_EPS0_GRVW8_GSU1_GSUAMB_NLCA1_NLCB1_PGR2_SU32_SUS128_SRVW4_TT2_64_VAW2_WSGRA1_WSGRB1_WG64_4_1_WGM1
    SolutionIndex: 197
    SolutionNameMin: Cijk_Ailk_Bjlk_HBH_MT64x32x16_MI16x16x16x1_SE_1LDSB0_AF0EM8_AF1EM1_EPS1_GRVW2_GSU1_GSUAMB_NLCA1_NLCB1_PGR1_SU32_SUS128_SRVW4_TT2_16_VAW2_WSGRA1_WSGRB1_WG32_8_1_WGM1
    SolutionIndex: 198
    SolutionNameMin: Cijk_Ailk_Bjlk_HBH_MT128x128x32_MI32x32x8x1_SE_1LDSB0_AF0EM8_AF1EM1_EPS0_GRVW8_GSU1_GSUAMB_NLCA1_NLCB1_PGR2_SU32_SUS128_SRVW4_TT2_64_VAW2_WSGRA1_WSGRB1_WG64_4_1_WGM1
    SolutionIndex: 199
    SolutionNameMin: Cijk_Ailk_Bjlk_HBH_MT128x128x32_MI32x32x8x1_SE_1LDSB0_AF0EM1_AF1EM1_EPS0_GRVW8_GSU1_GSUAMB_NLCA1_NLCB1_PGR2_SU0_SUS0_SRVW4_TT2_64_VAW2_WSGRA1_WSGRB1_WG64_4_1_WGM1
    SolutionIndex: 200
    SolutionNameMin: Cijk_Ailk_Bjlk_HBH_MT64x192x16_MI32x32x8x1_SE_1LDSB0_AF0EM1_AF1EM1_EPS1_GRVW2_GSU1_GSUAMB_NLCA1_NLCB3_PGR1_SU0_SUS0_SRVW4_TT1_96_VAW2_WSGRA1_WSGRB1_WG64_4_1_WGM2
    SolutionIndex: 201
    SolutionNameMin: Cijk_Ailk_Bjlk_HBH_MT32x32x16_MI16x16x16x1_SE_1LDSB0_AF0EM1_AF1EM1_EPS1_GRVW8_GSU1_GSUAMB_NLCA1_NLCB1_PGR1_SU0_SUS0_SRVW4_TT1_16_VAW2_WSGRA1_WSGRB1_WG32_8_1_WGM1
    SolutionIndex: 202
    SolutionNameMin: Cijk_Ailk_Bjlk_HBH_MT64x192x32_MI32x32x8x1_SE_1LDSB0_AF0EM1_AF1EM1_EPS0_GRVW4_GSU1_GSUAMB_NLCA1_NLCB3_PGR2_SU0_SUS0_SRVW4_TT1_96_VAW2_WSGRA1_WSGRB1_WG64_4_1_WGM2
    SolutionIndex: 203
    SolutionNameMin: Cijk_Ailk_Bjlk_HBH_MT64x128x32_MI32x32x8x1_SE_1LDSB0_AF0EM1_AF1EM1_EPS0_GRVW4_GSU1_GSUAMB_NLCA1_NLCB1_PGR2_SU0_SUS0_SRVW4_TT1_64_VAW2_WSGRA1_WSGRB1_WG64_4_1_WGM15
    SolutionIndex: 204
    SolutionNameMin: Cijk_Ailk_Bjlk_HBH_MT128x64x32_MI32x32x8x1_SE_1LDSB0_AF0EM1_AF1EM1_EPS0_GRVW8_GSU1_GSUAMB_NLCA1_NLCB1_PGR2_SU32_SUS256_SRVW4_TT2_32_VAW2_WSGRA1_WSGRB1_WG64_4_1_WGM1
    SolutionIndex: 205
    SolutionNameMin: Cijk_Ailk_Bjlk_HBH_MT128x128x16_MI32x32x8x1_SE_1LDSB0_AF0EM1_AF1EM1_EPS0_GRVW4_GSU1_GSUAMB_NLCA1_NLCB1_PGR2_SU0_SUS0_SRVW4_TT2_64_VAW2_WSGRA1_WSGRB1_WG64_4_1_WGM15
    SolutionIndex: 206
    SolutionNameMin: Cijk_Ailk_Bjlk_HBH_MT128x128x16_MI32x32x8x1_SE_1LDSB0_AF0EM1_AF1EM1_EPS0_GRVW2_GSU1_GSUAMB_NLCA1_NLCB1_PGR2_SU0_SUS0_SRVW4_TT2_64_VAW2_WSGRA1_WSGRB1_WG64_4_1_WGM1
    SolutionIndex: 207
    SolutionNameMin: Cijk_Ailk_Bjlk_HBH_MT16x64x32_MI16x16x16x1_SE_1LDSB0_AF0EM1_AF1EM1_EPS1_GRVW8_GSU1_GSUAMB_NLCA1_NLCB1_PGR1_SU0_SUS0_SRVW0_TT1_16_VAW2_WSGRA1_WSGRB1_WG16_16_1_WGM1
    SolutionIndex: 208
    SolutionNameMin: Cijk_Ailk_Bjlk_HBH_MT128x128x32_MI32x32x8x1_SN_1LDSB0_EPS0_GRVW4_GSU1_NLCA1_NLCB1_PGR2_SU0_SUS0_SRVW4_TT2_64_VAW2_WG64_4_1_WGM1
    SolutionIndex: 209
    SolutionNameMin: Cijk_Ailk_Bjlk_HBH_MT128x128x32_MI32x32x8x1_SN_1LDSB0_EPS0_GRVW4_GSU1_NLCA1_NLCB1_PGR2_SU0_SUS0_SRVW4_TT2_64_VAW2_WG64_4_1_WGM15
    SolutionIndex: 210
    SolutionNameMin: Cijk_Ailk_Bjlk_HBH_MT128x256x16_MI32x32x8x1_SN_1LDSB1_EPS0_GRVW8_NLCA1_NLCB1_PGR2_SU0_SUS0_SRVW4_TT2_128_WG64_4_1_WGM2
    SolutionIndex: 211
    SolutionNameMin: Cijk_Ailk_Bjlk_HBH_MT64x64x64_MI32x32x8x1_SE_1LDSB0_AF0EM8_AMAS3_BL1_EPS1_GRVW8_GSU7_GSUAMB_ISA90a_KLA_LRVW4_MAC_NLCA1_NLCB1_PGR1_SIA3_SU0_SUS0_SRVW0_TT1_32_USFGROn1_VAW1_VSn1_VW2_WSGRA1_WSGRB1_WG64_4_1_WGM1
    SolutionIndex: 212
    SolutionNameMin: Cijk_Ailk_Bjlk_HBH_MT32x64x64_MI16x16x16x1_SE_1LDSB0_AF0EM8_AMAS3_BL1_EPS0_GRVW8_GSU1_GSUAMB_ISA90a_KLA_LRVW4_MAC_NLCA1_NLCB1_PGR2_SIA3_SU0_SUS0_SRVW4_TT1_32_USFGROn1_VAW2_VSn1_VW2_WSGRA1_WSGRB1_WG32_8_1_WGM1
    SolutionIndex: 213
    SolutionNameMin: Cijk_Ailk_Bjlk_HBH_MT64x64x64_MI32x32x8x1_SE_1LDSB0_AF0EM8_AMAS3_BL1_EPS1_GRVW8_GSU5_GSUAMB_ISA90a_KLA_LRVW4_MAC_NLCA1_NLCB1_PGR1_SIA3_SU0_SUS0_SRVW0_TT1_32_USFGROn1_VAW1_VSn1_VW2_WSGRA1_WSGRB1_WG64_4_1_WGM2
    SolutionIndex: 214
    SolutionNameMin: Cijk_Ailk_Bjlk_HBH_MT32x32x64_MI16x16x16x1_SE_1LDSB0_AF0EM1_AMAS3_BL1_EPS0_GRVW8_GSU7_GSUAMB_ISA90a_KLA_LRVW4_MAC_NLCA1_NLCB1_PGR2_SIA3_SU32_SUS256_SRVW4_TT1_16_USFGROn1_VAW1_VSn1_VW2_WSGRA1_WSGRB1_WG32_8_1_WGM1
    SolutionIndex: 215
    SolutionNameMin: Cijk_Ailk_Bjlk_HBH_MT64x64x32_MI32x32x8x1_SE_1LDSB0_AF0EM8_AMAS3_BL1_EPS0_GRVW8_GSU1_GSUAMB_ISA90a_KLA_LRVW4_MAC_NLCA1_NLCB1_PGR2_SIA3_SU0_SUS0_SRVW4_TT1_32_USFGROn1_VAW2_VSn1_VW2_WSGRA1_WSGRB1_WG64_4_1_WGM2
    SolutionIndex: 216
    SolutionNameMin: Cijk_Ailk_Bjlk_HBH_MT64x128x32_MI32x32x8x1_SE_1LDSB0_AF0EM8_AMAS3_BL1_EPS0_GRVW4_GSU7_GSUAMB_ISA90a_KLA_LRVW4_MAC_NLCA1_NLCB1_PGR2_SIA3_SU32_SUS256_SRVW4_TT1_64_USFGROn1_VAW1_VSn1_VW2_WSGRA1_WSGRB1_WG64_4_1_WGM2
    SolutionIndex: 217
    SolutionNameMin: Cijk_Ailk_Bjlk_HBH_MT64x64x64_MI32x32x8x1_SE_1LDSB0_AF0EM8_AMAS3_BL1_EPS0_GRVW8_GSU1_GSUAMB_ISA90a_KLA_LRVW4_MAC_NLCA1_NLCB1_PGR2_SIA3_SU0_SUS0_SRVW4_TT1_32_USFGROn1_VAW2_VSn1_VW2_WSGRA1_WSGRB1_WG64_4_1_WGM2
    SolutionIndex: 218
    SolutionNameMin: Cijk_Ailk_Bjlk_HBH_MT64x16x32_MI16x16x16x1_SE_1LDSB0_AF0EM1_AMAS3_BL1_EPS0_GRVW8_GSU1_GSUAMB_ISA90a_KLA_LRVW4_MAC_NLCA1_NLCB1_PGR2_SIA3_SU0_SUS0_SRVW0_TT1_16_USFGROn1_VAW2_VSn1_VW2_WSGRA1_WSGRB1_WG64_4_1_WGM1
    SolutionIndex: 219
    SolutionNameMin: Cijk_Ailk_Bjlk_HBH_MT64x64x8_SN_1LDSB0_AF0EM1_AMAS0_BL0_EPS0_GRVW1_GSU1_GSUASB_ISA000_KLS_LRVW1_FMA_NLCA1_NLCB1_PGR0_SIA1_SU32_SUS256_SRVW0_TT4_4_USFGRO0_VAW2_VS1_VW1_WSGRA0_WSGRB0_WG16_16_1_WGM8
    SolutionIndex: 220
    SolutionNameMin: Cijk_Ailk_Bjlk_HBH_MT128x64x64_MI32x32x8x1_SE_1LDSB0_AF0EM1_AMAS3_BL1_EPS0_GRVW8_GSU1_GSUAMB_ISA90a_KLA_LRVW4_MAC_NLCA1_NLCB1_PGR2_SIA3_SU32_SUS256_SRVW4_TT2_32_USFGROn1_VAW2_VSn1_VW2_WSGRA1_WSGRB1_WG64_4_1_WGM15
    SolutionIndex: 221
    SolutionNameMin: Cijk_Ailk_Bjlk_HBH_MT64x64x64_MI32x32x8x1_SE_1LDSB0_AF0EM8_AMAS3_BL1_EPS0_GRVW8_GSU1_GSUAMB_ISA90a_KLA_LRVW4_MAC_NLCA1_NLCB1_PGR2_SIA3_SU0_SUS0_SRVW4_TT1_32_USFGROn1_VAW2_VSn1_VW2_WSGRA1_WSGRB1_WG64_4_1_WGM15
    SolutionIndex: 222
    SolutionNameMin: Cijk_Ailk_Bjlk_HBH_MT32x32x64_MI16x16x16x1_SE_1LDSB0_AF0EM8_AMAS3_BL1_EPS0_GRVW8_GSU1_GSUAMB_ISA90a_KLA_LRVW4_MAC_NLCA1_NLCB1_PGR2_SIA3_SU0_SUS0_SRVW4_TT1_16_USFGROn1_VAW2_VSn1_VW2_WSGRA1_WSGRB1_WG32_8_1_WGM15
    SolutionIndex: 223
    SolutionNameMin: Cijk_Ailk_Bjlk_HBH_MT128x128x32_MI32x32x8x1_SE_1LDSB0_AF0EM8_AMAS3_BL1_EPS0_GRVW8_GSU1_GSUAMB_ISA90a_KLA_LRVW4_MAC_NLCA1_NLCB1_PGR2_SIA3_SU0_SUS0_SRVW4_TT2_64_USFGROn1_VAW2_VSn1_VW2_WSGRA1_WSGRB1_WG64_4_1_WGM1
    SolutionIndex: 224
    SolutionNameMin: Cijk_Ailk_Bjlk_HBH_MT128x128x32_MI32x32x8x1_SE_1LDSB0_AF0EM8_AMAS3_BL1_EPS0_GRVW8_GSU1_GSUAMB_ISA90a_KLA_LRVW4_MAC_NLCA1_NLCB1_PGR2_SIA3_SU0_SUS0_SRVW4_TT2_64_USFGROn1_VAW2_VSn1_VW2_WSGRA1_WSGRB1_WG64_4_1_WGM2
    SolutionIndex: 225
    SolutionNameMin: Cijk_Ailk_Bjlk_HBH_MT128x128x16_MI32x32x8x1_SE_1LDSB0_AF0EM8_AMAS3_BL1_EPS0_GRVW8_GSU1_GSUAMB_ISA90a_KLA_LRVW4_MAC_NLCA1_NLCB1_PGR2_SIA3_SU0_SUS0_SRVW4_TT2_64_USFGROn1_VAW2_VSn1_VW2_WSGRA1_WSGRB1_WG64_4_1_WGM2
    SolutionIndex: 226
    SolutionNameMin: Cijk_Ailk_Bjlk_HBH_MT16x16x16_MI16x16x16x1_SE_1LDSB0_AF0EM1_AMAS3_BL1_EPS1_GRVW2_GSU1_GSUAMB_ISA90a_KLA_LRVW4_MAC_NLCA1_NLCB1_PGR1_SIA3_SU32_SUS128_SRVW0_TT1_16_USFGROn1_VAW2_VSn1_VW2_WSGRA1_WSGRB1_WG16_4_1_WGM15
    SolutionIndex: 227
    SolutionNameMin: Cijk_Ailk_Bjlk_HBH_MT32x32x16_MI16x16x16x1_SE_1LDSB0_AF0EM8_AMAS3_BL1_EPS1_GRVW2_GSU1_GSUAMB_ISA90a_KLA_LRVW4_MAC_NLCA1_NLCB1_PGR1_SIA3_SU0_SUS0_SRVW4_TT1_16_USFGROn1_VAW2_VSn1_VW2_WSGRA1_WSGRB1_WG32_8_1_WGM1
    SolutionIndex: 228
    SolutionNameMin: Cijk_Ailk_Bjlk_HBH_MT16x16x16_MI16x16x16x1_SE_1LDSB0_AF0EM8_AMAS3_BL1_EPS1_GRVW2_GSU1_GSUAMB_ISA90a_KLA_LRVW4_MAC_NLCA1_NLCB1_PGR1_SIA3_SU0_SUS0_SRVW0_TT1_16_USFGROn1_VAW2_VSn1_VW2_WSGRA1_WSGRB1_WG16_4_1_WGM1
    SolutionIndex: 229
    SolutionNameMin: Cijk_Ailk_Bjlk_HBH_MT16x16x16_MI16x16x16x1_SE_1LDSB0_AF0EM8_AMAS3_BL1_EPS0_GRVW2_GSU1_GSUAMB_ISA90a_KLA_LRVW4_MAC_NLCA1_NLCB1_PGR2_SIA3_SU0_SUS0_SRVW0_TT1_16_USFGROn1_VAW2_VSn1_VW2_WSGRA1_WSGRB1_WG16_4_1_WGM1
    SolutionIndex: 230
    SolutionNameMin: Cijk_Ailk_Bjlk_HBH_MT16x16x32_MI16x16x16x1_SE_1LDSB0_AF0EM1_AMAS3_BL1_EPS0_GRVW8_GSU1_GSUAMB_ISA90a_KLA_LRVW4_MAC_NLCA1_NLCB1_PGR2_SIA3_SU0_SUS0_SRVW0_TT1_16_USFGROn1_VAW2_VSn1_VW2_WSGRA1_WSGRB1_WG16_4_1_WGM1
    SolutionIndex: 231
    SolutionNameMin: Cijk_Ailk_Bjlk_HBH_MT16x16x16_MI16x16x16x1_SE_1LDSB0_AF0EM1_AMAS3_BL1_EPS1_GRVW4_GSU1_GSUAMB_ISA90a_KLA_LRVW4_MAC_NLCA1_NLCB1_PGR1_SIA3_SU0_SUS0_SRVW0_TT1_16_USFGROn1_VAW2_VSn1_VW2_WSGRA1_WSGRB1_WG16_4_1_WGM1
    SolutionIndex: 232
    SolutionNameMin: Cijk_Ailk_Bjlk_HBH_MT64x128x16_MI32x32x8x1_SE_1LDSB0_AF0EM8_AMAS3_BL1_EPS0_GRVW2_GSU1_GSUAMB_ISA90a_KLA_LRVW4_MAC_NLCA1_NLCB1_PGR2_SIA3_SU0_SUS0_SRVW4_TT1_64_USFGROn1_VAW2_VSn1_VW2_WSGRA1_WSGRB1_WG64_4_1_WGM1
    SolutionIndex: 233
    SolutionNameMin: Cijk_Ailk_Bjlk_HBH_MT64x16x64_MI16x16x16x1_SE_1LDSB0_AF0EM8_AMAS3_BL1_EPS0_GRVW2_GSU7_GSUAMB_ISA90a_KLA_LRVW4_MAC_NLCA1_NLCB1_PGR2_SIA3_SU32_SUS128_SRVW0_TT1_16_USFGROn1_VAW1_VSn1_VW2_WSGRA1_WSGRB1_WG64_4_1_WGM1
    SolutionIndex: 234
    SolutionNameMin: Cijk_Ailk_Bjlk_HBH_MT64x64x16_MI32x32x8x1_SE_1LDSB0_AF0EM8_AMAS3_BL1_EPS0_GRVW8_GSU1_GSUAMB_ISA90a_KLA_LRVW4_MAC_NLCA1_NLCB1_PGR2_SIA3_SU0_SUS0_SRVW4_TT1_32_USFGROn1_VAW2_VSn1_VW2_WSGRA1_WSGRB1_WG64_4_1_WGM1
    SolutionIndex: 235
    SolutionNameMin: Cijk_Ailk_Bjlk_HBH_MT256x160x32_MI32x32x8x1_SE_1LDSB0_AF0EM8_AMAS3_BL1_EPS1_GRVW4_GSU1_GSUAMB_ISA90a_KLA_LRVW4_MAC_NLCA1_NLCB5_PGR1_SIA3_SU0_SUS0_SRVW4_TT2_160_USFGROn1_VAW2_VSn1_VW2_WSGRA1_WSGRB1_WG128_2_1_WGM15
    SolutionIndex: 236
    SolutionNameMin: Cijk_Ailk_Bjlk_HBH_MT128x128x32_MI32x32x8x1_SE_1LDSB0_AF0EM8_AMAS3_BL1_EPS0_GRVW4_GSU2_GSUAMB_ISA90a_KLA_LRVW4_MAC_NLCA1_NLCB1_PGR2_SIA3_SU0_SUS0_SRVW4_TT2_64_USFGROn1_VAW1_VSn1_VW2_WSGRA1_WSGRB1_WG64_4_1_WGM15
    SolutionIndex: 237
    SolutionNameMin: Cijk_Ailk_Bjlk_HBH_MT128x256x16_MI32x32x8x1_SE_1LDSB0_AF0EM8_AMAS3_BL1_EPS0_GRVW4_GSU5_GSUAMB_ISA90a_KLA_LRVW4_MAC_NLCA1_NLCB1_PGR2_SIA3_SU0_SUS0_SRVW4_TT2_128_USFGROn1_VAW1_VSn1_VW2_WSGRA1_WSGRB1_WG64_4_1_WGM15
    SolutionIndex: 238
    SolutionNameMin: Cijk_Ailk_Bjlk_HBH_MT128x128x32_MI32x32x8x1_SE_1LDSB0_AF0EM8_AMAS3_BL1_EPS0_GRVW4_GSU1_GSUAMB_ISA90a_KLA_LRVW4_MAC_NLCA1_NLCB1_PGR2_SIA3_SU0_SUS0_SRVW4_TT2_64_USFGROn1_VAW2_VSn1_VW2_WSGRA1_WSGRB1_WG64_4_1_WGM2
    SolutionIndex: 239
    SolutionNameMin: Cijk_Ailk_Bjlk_HBH_MT128x128x32_MI32x32x8x1_SE_1LDSB0_AF0EM1_AMAS3_BL1_EPS0_GRVW8_GSU1_GSUAMB_ISA90a_KLA_LRVW4_MAC_NLCA1_NLCB1_PGR2_SIA3_SU0_SUS0_SRVW4_TT2_64_USFGROn1_VAW2_VSn1_VW2_WSGRA1_WSGRB1_WG64_4_1_WGM1
    SolutionIndex: 240
    SolutionNameMin: Cijk_Ailk_Bjlk_HBH_MT128x288x32_MI32x32x8x1_SE_1LDSB0_AF0EM8_AMAS3_BL1_EPS0_GRVW4_GSU1_GSUAMB_ISA90a_KLA_LRVW4_MAC_NLCA1_NLCB9_PGR2_SIA3_SU0_SUS0_SRVW4_TT1_288_USFGROn1_VAW2_VSn1_VW2_WSGRA1_WSGRB1_WG128_2_1_WGM15
    SolutionIndex: 241
    SolutionNameMin: Cijk_Ailk_Bjlk_HBH_MT256x160x32_MI32x32x8x1_SE_1LDSB0_AF0EM8_AMAS3_BL1_EPS0_GRVW2_GSU1_GSUAMB_ISA90a_KLA_LRVW4_MAC_NLCA2_NLCB5_PGR2_SIA3_SU0_SUS0_SRVW4_TT2_160_USFGROn1_VAW2_VSn1_VW2_WSGRA1_WSGRB1_WG128_2_1_WGM15
    SolutionIndex: 242
    SolutionNameMin: Cijk_Ailk_Bjlk_HBH_MT128x128x32_MI32x32x8x1_SE_1LDSB0_AF0EM1_AMAS3_BL1_EPS0_GRVW4_GSU1_GSUAMB_ISA90a_KLA_LRVW4_MAC_NLCA1_NLCB1_PGR2_SIA3_SU0_SUS0_SRVW4_TT2_64_USFGROn1_VAW2_VSn1_VW2_WSGRA1_WSGRB1_WG64_4_1_WGM1
    SolutionIndex: 243
    SolutionNameMin: Cijk_Ailk_Bjlk_HBH_MT128x128x32_MI32x32x8x1_SE_1LDSB0_AF0EM1_AMAS3_BL1_EPS0_GRVW4_GSU1_GSUAMB_ISA90a_KLA_LRVW4_MAC_NLCA1_NLCB1_PGR2_SIA3_SU0_SUS0_SRVW4_TT2_64_USFGROn1_VAW2_VSn1_VW2_WSGRA1_WSGRB1_WG64_4_1_WGM2
    SolutionIndex: 244
    SolutionNameMin: Cijk_Ailk_Bjlk_HBH_MT128x128x32_MI32x32x8x1_SE_1LDSB0_AF0EM8_AMAS3_BL1_EPS0_GRVW8_GSU1_GSUAMB_ISA90a_KLA_LRVW4_MAC_NLCA1_NLCB1_PGR2_SIA3_SU0_SUS0_SRVW4_TT2_64_USFGROn1_VAW2_VSn1_VW2_WSGRA1_WSGRB1_WG64_4_1_WGM15
    SolutionIndex: 245
    SolutionNameMin: Cijk_Ailk_Bjlk_HBH_MT64x128x32_MI32x32x8x1_SE_1LDSB0_AF0EM1_AMAS3_BL1_EPS0_GRVW4_GSU1_GSUAMB_ISA90a_KLA_LRVW4_MAC_NLCA1_NLCB1_PGR2_SIA3_SU0_SUS0_SRVW4_TT1_64_USFGROn1_VAW2_VSn1_VW2_WSGRA1_WSGRB1_WG64_4_1_WGM15
    SolutionIndex: 246
    SolutionNameMin: Cijk_Ailk_Bjlk_HBH_MT64x64x32_MI32x32x8x1_SE_1LDSB0_AF0EM8_AMAS3_BL1_EPS0_GRVW8_GSU1_GSUAMB_ISA90a_KLA_LRVW4_MAC_NLCA1_NLCB1_PGR2_SIA3_SU0_SUS0_SRVW4_TT1_32_USFGROn1_VAW2_VSn1_VW2_WSGRA1_WSGRB1_WG64_4_1_WGM1
    SolutionIndex: 247
    SolutionNameMin: Cijk_Ailk_Bjlk_HBH_MT128x64x64_MI32x32x8x1_SE_1LDSB0_AF0EM8_AMAS3_BL1_EPS1_GRVW8_GSU3_GSUAMB_ISA90a_KLA_LRVW4_MAC_NLCA1_NLCB1_PGR1_SIA3_SU0_SUS0_SRVW0_TT2_32_USFGROn1_VAW1_VSn1_VW2_WSGRA1_WSGRB1_WG64_4_1_WGM1
    SolutionIndex: 248
    SolutionNameMin: Cijk_Ailk_Bjlk_HBH_MT64x128x64_MI32x32x8x1_SE_1LDSB0_AF0EM8_AMAS3_BL1_EPS1_GRVW8_GSU3_GSUAMB_ISA90a_KLA_LRVW4_MAC_NLCA1_NLCB1_PGR1_SIA3_SU32_SUS128_SRVW0_TT1_64_USFGROn1_VAW1_VSn1_VW2_WSGRA1_WSGRB1_WG64_4_1_WGM2
    SolutionIndex: 249
    SolutionNameMin: Cijk_Ailk_Bjlk_HBH_MT128x96x32_MI32x32x8x1_SE_1LDSB0_AF0EM8_AMAS3_BL1_EPS0_GRVW4_GSU1_GSUAMB_ISA90a_KLA_LRVW4_MAC_NLCA1_NLCB3_PGR2_SIA3_SU0_SUS0_SRVW4_TT1_96_USFGROn1_VAW2_VSn1_VW2_WSGRA1_WSGRB1_WG128_2_1_WGM15
    SolutionIndex: 250
    SolutionNameMin: Cijk_Ailk_Bjlk_HBH_MT128x128x32_MI32x32x8x1_SE_1LDSB0_AF0EM8_AMAS3_BL1_EPS0_GRVW8_GSU1_GSUAMB_ISA90a_KLA_LRVW4_MAC_NLCA1_NLCB1_PGR2_SIA3_SU32_SUS128_SRVW4_TT2_64_USFGROn1_VAW2_VSn1_VW2_WSGRA1_WSGRB1_WG64_4_1_WGM1
    SolutionIndex: 251
    SolutionNameMin: Cijk_Ailk_Bjlk_HBH_MT128x256x32_MI32x32x8x1_SE_1LDSB0_AF0EM8_AMAS3_BL1_EPS1_GRVW8_GSU3_GSUAMB_ISA90a_KLA_LRVW4_MAC_NLCA1_NLCB1_PGR1_SIA3_SU0_SUS0_SRVW4_TT2_128_USFGROn1_VAW1_VSn1_VW2_WSGRA1_WSGRB1_WG64_4_1_WGM15
    SolutionIndex: 252
    SolutionNameMin: Cijk_Ailk_Bjlk_HBH_MT128x256x16_MI32x32x8x1_SE_1LDSB0_AF0EM8_AMAS3_BL1_EPS0_GRVW4_GSU3_GSUAMB_ISA90a_KLA_LRVW4_MAC_NLCA1_NLCB1_PGR2_SIA3_SU0_SUS0_SRVW4_TT2_128_USFGROn1_VAW1_VSn1_VW2_WSGRA1_WSGRB1_WG64_4_1_WGM2
    SolutionIndex: 253
    SolutionNameMin: Cijk_Ailk_Bjlk_HBH_MT64x32x16_MI16x16x16x1_SE_1LDSB1_AF0EM8_AMAS3_BL1_EPS0_GRVW2_GSU1_GSUAMB_ISA90a_KLA_LRVW4_MAC_NLCA1_NLCB1_PGR2_SIA3_SU0_SUS0_SRVW4_TT2_16_USFGROn1_VAW2_VSn1_VW2_WSGRA1_WSGRB1_WG32_8_1_WGM15
    SolutionIndex: 254
    SolutionNameMin: Cijk_Ailk_Bjlk_HBH_MT128x64x16_MI32x32x8x1_SE_1LDSB0_AF0EM1_AMAS3_BL1_EPS0_GRVW8_GSU1_GSUAMB_ISA90a_KLA_LRVW4_MAC_NLCA1_NLCB1_PGR2_SIA3_SU0_SUS0_SRVW4_TT2_32_USFGROn1_VAW2_VSn1_VW2_WSGRA1_WSGRB1_WG64_4_1_WGM2
    SolutionIndex: 255
    SolutionNameMin: Cijk_Ailk_Bjlk_HBH_MT64x128x16_MI32x32x8x1_SE_1LDSB0_AF0EM8_AMAS3_BL1_EPS0_GRVW4_GSU1_GSUAMB_ISA90a_KLA_LRVW4_MAC_NLCA1_NLCB1_PGR2_SIA3_SU0_SUS0_SRVW4_TT1_64_USFGROn1_VAW2_VSn1_VW2_WSGRA1_WSGRB1_WG64_4_1_WGM2
    SolutionIndex: 256
    SolutionNameMin: Cijk_Ailk_Bjlk_HBH_MT64x128x16_MI32x32x8x1_SE_1LDSB0_AF0EM1_AMAS3_BL1_EPS0_GRVW8_GSU1_GSUAMB_ISA90a_KLA_LRVW4_MAC_NLCA1_NLCB1_PGR2_SIA3_SU0_SUS0_SRVW4_TT1_64_USFGROn1_VAW2_VSn1_VW2_WSGRA1_WSGRB1_WG64_4_1_WGM1
    SolutionIndex: 257
    SolutionNameMin: Cijk_Ailk_Bjlk_HBH_MT256x160x32_MI32x32x8x1_SE_1LDSB0_AF0EM8_AMAS3_BL1_EPS1_GRVW4_GSU1_GSUAMB_ISA90a_KLA_LRVW4_MAC_NLCA1_NLCB5_PGR1_SIA3_SU0_SUS0_SRVW4_TT2_160_USFGROn1_VAW2_VSn1_VW2_WSGRA1_WSGRB1_WG128_2_1_WGM2
    SolutionIndex: 258
    SolutionNameMin: Cijk_Ailk_Bjlk_HBH_MT32x32x32_MI16x16x16x1_SE_1LDSB0_AF0EM1_AMAS3_BL1_EPS0_GRVW2_GSU1_GSUAMB_ISA90a_KLA_LRVW4_MAC_NLCA1_NLCB1_PGR2_SIA3_SU0_SUS0_SRVW4_TT1_16_USFGROn1_VAW2_VSn1_VW2_WSGRA1_WSGRB1_WG32_8_1_WGM1
    SolutionIndex: 259
    SolutionNameMin: Cijk_Ailk_Bjlk_HBH_MT128x192x16_MI32x32x8x1_SE_1LDSB0_AF0EM8_AMAS3_BL1_EPS0_GRVW4_GSU1_GSUAMB_ISA90a_KLA_LRVW4_MAC_NLCA1_NLCB3_PGR2_SIA3_SU0_SUS0_SRVW4_TT2_96_USFGROn1_VAW2_VSn1_VW2_WSGRA1_WSGRB1_WG64_4_1_WGM15
    SolutionIndex: 260
    SolutionNameMin: Cijk_Ailk_Bjlk_HBH_MT128x192x32_MI32x32x8x1_SE_1LDSB0_AF0EM8_AMAS3_BL1_EPS0_GRVW4_GSU1_GSUAMB_ISA90a_KLA_LRVW4_MAC_NLCA1_NLCB3_PGR2_SIA3_SU0_SUS0_SRVW4_TT2_96_USFGROn1_VAW2_VSn1_VW2_WSGRA1_WSGRB1_WG64_4_1_WGM2
    SolutionIndex: 261
    SolutionNameMin: Cijk_Ailk_Bjlk_HBH_MT128x128x32_MI32x32x8x1_SE_1LDSB0_AF0EM8_AMAS3_BL1_EPS0_GRVW4_GSU1_GSUAMB_ISA90a_KLA_LRVW4_MAC_NLCA1_NLCB1_PGR2_SIA3_SU0_SUS0_SRVW4_TT2_64_USFGROn1_VAW2_VSn1_VW2_WSGRA1_WSGRB1_WG64_4_1_WGM1
    SolutionIndex: 262
    SolutionNameMin: Cijk_Ailk_Bjlk_HBH_MT128x128x32_MI32x32x8x1_SE_1LDSB0_AF0EM8_AMAS3_BL1_EPS0_GRVW8_GSU3_GSUAMB_ISA90a_KLA_LRVW4_MAC_NLCA1_NLCB1_PGR2_SIA3_SU0_SUS0_SRVW4_TT2_64_USFGROn1_VAW1_VSn1_VW2_WSGRA1_WSGRB1_WG64_4_1_WGM1
    SolutionIndex: 263
    SolutionNameMin: Cijk_Ailk_Bjlk_HBH_MT64x64x32_MI32x32x8x1_SE_1LDSB0_AF0EM8_AMAS3_BL1_EPS0_GRVW8_GSU15_GSUAMB_ISA90a_KLA_LRVW4_MAC_NLCA1_NLCB1_PGR2_SIA3_SU0_SUS0_SRVW4_TT1_32_USFGROn1_VAW1_VSn1_VW2_WSGRA1_WSGRB1_WG64_4_1_WGM15
    SolutionIndex: 264
    SolutionNameMin: Cijk_Ailk_Bjlk_HBH_MT64x64x16_MI32x32x8x1_SE_1LDSB0_AF0EM1_AMAS3_BL1_EPS1_GRVW8_GSU1_GSUAMB_ISA90a_KLA_LRVW4_MAC_NLCA1_NLCB1_PGR1_SIA3_SU0_SUS0_SRVW4_TT1_32_USFGROn1_VAW2_VSn1_VW2_WSGRA1_WSGRB1_WG64_4_1_WGM1
    SolutionIndex: 265
    SolutionNameMin: Cijk_Ailk_Bjlk_HBH_MT128x64x16_MI32x32x8x1_SE_1LDSB0_AF0EM8_AMAS3_BL1_EPS0_GRVW4_GSU1_GSUAMB_ISA90a_KLA_LRVW4_MAC_NLCA1_NLCB1_PGR2_SIA3_SU0_SUS0_SRVW4_TT2_32_USFGROn1_VAW2_VSn1_VW2_WSGRA1_WSGRB1_WG64_4_1_WGM2
    SolutionIndex: 266
    SolutionNameMin: Cijk_Ailk_Bjlk_HBH_MT32x32x16_MI16x16x16x1_SE_1LDSB0_AF0EM8_AMAS3_BL1_EPS0_GRVW4_GSU1_GSUAMB_ISA90a_KLA_LRVW4_MAC_NLCA1_NLCB1_PGR2_SIA3_SU0_SUS0_SRVW4_TT1_16_USFGROn1_VAW2_VSn1_VW2_WSGRA1_WSGRB1_WG32_8_1_WGM1
    SolutionIndex: 267
    SolutionNameMin: Cijk_Ailk_Bjlk_HBH_MT128x64x16_MI32x32x8x1_SE_1LDSB0_AF0EM8_AMAS3_BL1_EPS0_GRVW8_GSU1_GSUAMB_ISA90a_KLA_LRVW4_MAC_NLCA1_NLCB1_PGR2_SIA3_SU0_SUS0_SRVW4_TT2_32_USFGROn1_VAW2_VSn1_VW2_WSGRA1_WSGRB1_WG64_4_1_WGM2
    SolutionIndex: 268
    SolutionNameMin: Cijk_Ailk_Bjlk_HBH_MT128x64x16_MI32x32x8x1_SE_1LDSB0_AF0EM8_AMAS3_BL1_EPS0_GRVW4_GSU1_GSUAMB_ISA90a_KLA_LRVW4_MAC_NLCA1_NLCB1_PGR2_SIA3_SU0_SUS0_SRVW4_TT2_32_USFGROn1_VAW2_VSn1_VW2_WSGRA1_WSGRB1_WG64_4_1_WGM15
    SolutionIndex: 269
    SolutionNameMin: Cijk_Ailk_Bjlk_HBH_MT16x64x64_MI16x16x16x1_SE_1LDSB0_AF0EM1_AMAS3_BL1_EPS0_GRVW8_GSU15_GSUAMB_ISA90a_KLA_LRVW4_MAC_NLCA1_NLCB1_PGR2_SIA3_SU32_SUS256_SRVW0_TT1_16_USFGROn1_VAW1_VSn1_VW2_WSGRA1_WSGRB1_WG16_16_1_WGM1
    SolutionIndex: 270
    SolutionNameMin: Cijk_Ailk_Bjlk_HBH_MT16x16x32_MI16x16x16x1_SE_1LDSB0_AF0EM1_AMAS3_BL1_EPS0_GRVW4_GSU1_GSUAMB_ISA90a_KLA_LRVW4_MAC_NLCA1_NLCB1_PGR2_SIA3_SU32_SUS128_SRVW0_TT1_16_USFGROn1_VAW2_VSn1_VW2_WSGRA1_WSGRB1_WG16_4_1_WGM1
    SolutionIndex: 271
    SolutionNameMin: Cijk_Ailk_Bjlk_HBH_MT64x64x32_MI32x32x8x1_SE_1LDSB0_AF0EM8_AMAS3_BL1_EPS0_GRVW8_GSU1_GSUAMB_ISA90a_KLA_LRVW4_MAC_NLCA1_NLCB1_PGR2_SIA3_SU32_SUS128_SRVW4_TT1_32_USFGROn1_VAW2_VSn1_VW2_WSGRA1_WSGRB1_WG64_4_1_WGM15
    SolutionIndex: 272
    SolutionNameMin: Cijk_Ailk_Bjlk_HBH_MT64x64x32_MI32x32x8x1_SE_1LDSB0_AF0EM8_AMAS3_BL1_EPS0_GRVW8_GSU1_GSUAMB_ISA90a_KLA_LRVW4_MAC_NLCA1_NLCB1_PGR2_SIA3_SU32_SUS128_SRVW4_TT1_32_USFGROn1_VAW2_VSn1_VW2_WSGRA1_WSGRB1_WG64_4_1_WGM2
    SolutionIndex: 273
    SolutionNameMin: Cijk_Ailk_Bjlk_HBH_MT128x128x32_MI32x32x8x1_SE_1LDSB0_AF0EM8_AMAS3_BL1_EPS0_GRVW4_GSU3_GSUAMB_ISA90a_KLA_LRVW4_MAC_NLCA1_NLCB1_PGR2_SIA3_SU0_SUS0_SRVW4_TT2_64_USFGROn1_VAW1_VSn1_VW2_WSGRA1_WSGRB1_WG64_4_1_WGM15
    SolutionIndex: 274
    SolutionNameMin: Cijk_Ailk_Bjlk_HBH_MT64x16x64_MI16x16x16x1_SE_1LDSB0_AF0EM8_AMAS3_BL1_EPS0_GRVW2_GSU7_GSUAMB_ISA90a_KLA_LRVW4_MAC_NLCA1_NLCB1_PGR2_SIA3_SU32_SUS256_SRVW4_TT1_16_USFGROn1_VAW1_VSn1_VW2_WSGRA1_WSGRB1_WG64_4_1_WGM1
    SolutionIndex: 275
    SolutionNameMin: Cijk_Ailk_Bjlk_HBH_MT128x192x32_MI32x32x8x1_SE_1LDSB0_AF0EM8_AMAS3_BL1_EPS0_GRVW4_GSU1_GSUAMB_ISA90a_KLA_LRVW4_MAC_NLCA1_NLCB3_PGR2_SIA3_SU0_SUS0_SRVW4_TT2_96_USFGROn1_VAW2_VSn1_VW2_WSGRA1_WSGRB1_WG64_4_1_WGM15
    SolutionIndex: 276
    SolutionNameMin: Cijk_Ailk_Bjlk_HBH_MT64x64x32_MI32x32x8x1_SE_1LDSB0_AF0EM1_AMAS3_BL1_EPS0_GRVW4_GSU1_GSUAMB_ISA90a_KLA_LRVW4_MAC_NLCA1_NLCB1_PGR2_SIA3_SU0_SUS0_SRVW4_TT1_32_USFGROn1_VAW2_VSn1_VW2_WSGRA1_WSGRB1_WG64_4_1_WGM1
    SolutionIndex: 277
    SolutionNameMin: Cijk_Ailk_Bjlk_HBH_MT128x64x64_MI32x32x8x1_SE_1LDSB0_AF0EM8_AMAS3_BL1_EPS0_GRVW8_GSU1_GSUAMB_ISA90a_KLA_LRVW4_MAC_NLCA1_NLCB1_PGR2_SIA3_SU0_SUS0_SRVW4_TT2_32_USFGROn1_VAW2_VSn1_VW2_WSGRA1_WSGRB1_WG64_4_1_WGM2
    SolutionIndex: 278
    SolutionNameMin: Cijk_Ailk_Bjlk_HBH_MT128x128x16_MI32x32x8x1_SE_1LDSB0_AF0EM1_AMAS3_BL1_EPS0_GRVW8_GSU1_GSUAMB_ISA90a_KLA_LRVW4_MAC_NLCA1_NLCB1_PGR2_SIA3_SU0_SUS0_SRVW4_TT2_64_USFGROn1_VAW2_VSn1_VW2_WSGRA1_WSGRB1_WG64_4_1_WGM1
    SolutionIndex: 279
    SolutionNameMin: Cijk_Ailk_Bjlk_HBH_MT128x128x16_MI32x32x8x1_SE_1LDSB0_AF0EM8_AMAS3_BL1_EPS0_GRVW8_GSU1_GSUAMB_ISA90a_KLA_LRVW4_MAC_NLCA1_NLCB1_PGR2_SIA3_SU0_SUS0_SRVW4_TT2_64_USFGROn1_VAW2_VSn1_VW2_WSGRA1_WSGRB1_WG64_4_1_WGM1
    SolutionIndex: 280
    SolutionNameMin: Cijk_Ailk_Bjlk_HBH_MT128x128x16_MI32x32x8x1_SE_1LDSB0_AF0EM8_AMAS3_BL1_EPS0_GRVW8_GSU1_GSUAMB_ISA90a_KLA_LRVW4_MAC_NLCA1_NLCB1_PGR2_SIA3_SU32_SUS128_SRVW4_TT2_64_USFGROn1_VAW2_VSn1_VW2_WSGRA1_WSGRB1_WG64_4_1_WGM1
    SolutionIndex: 281
    SolutionNameMin: Cijk_Ailk_Bjlk_HBH_MT128x128x16_MI32x32x8x1_SE_1LDSB0_AF0EM8_AMAS3_BL1_EPS0_GRVW4_GSU1_GSUAMB_ISA90a_KLA_LRVW4_MAC_NLCA1_NLCB1_PGR2_SIA3_SU0_SUS0_SRVW4_TT2_64_USFGROn1_VAW2_VSn1_VW2_WSGRA1_WSGRB1_WG64_4_1_WGM1
    SolutionIndex: 282
    SolutionNameMin: Cijk_Ailk_Bjlk_HBH_MT64x64x16_MI32x32x8x1_SE_1LDSB0_AF0EM8_AMAS3_BL1_EPS0_GRVW2_GSU1_GSUAMB_ISA90a_KLA_LRVW4_MAC_NLCA1_NLCB1_PGR2_SIA3_SU0_SUS0_SRVW4_TT1_32_USFGROn1_VAW2_VSn1_VW2_WSGRA1_WSGRB1_WG64_4_1_WGM2
    SolutionIndex: 283
    SolutionNameMin: Cijk_Ailk_Bjlk_HBH_MT128x128x32_MI32x32x8x1_SE_1LDSB0_AF0EM1_AMAS3_BL1_EPS0_GRVW8_GSU1_GSUAMB_ISA90a_KLA_LRVW4_MAC_NLCA1_NLCB1_PGR2_SIA3_SU0_SUS0_SRVW4_TT2_64_USFGROn1_VAW2_VSn1_VW2_WSGRA1_WSGRB1_WG64_4_1_WGM15
    SolutionIndex: 284
    SolutionNameMin: Cijk_Ailk_Bjlk_HBH_MT64x32x16_MI16x16x16x1_SE_1LDSB0_AF0EM8_AMAS3_BL1_EPS1_GRVW2_GSU1_GSUAMB_ISA90a_KLA_LRVW4_MAC_NLCA1_NLCB1_PGR1_SIA3_SU32_SUS128_SRVW4_TT2_16_USFGROn1_VAW2_VSn1_VW2_WSGRA1_WSGRB1_WG32_8_1_WGM1
    SolutionIndex: 285
    SolutionNameMin: Cijk_Ailk_Bjlk_HBH_MT128x128x16_MI32x32x8x1_SE_1LDSB0_AF0EM8_AMAS3_BL1_EPS0_GRVW2_GSU1_GSUAMB_ISA90a_KLA_LRVW4_MAC_NLCA1_NLCB1_PGR2_SIA3_SU0_SUS0_SRVW4_TT2_64_USFGROn1_VAW2_VSn1_VW2_WSGRA1_WSGRB1_WG64_4_1_WGM1
    SolutionIndex: 286
    SolutionNameMin: Cijk_Ailk_Bjlk_HBH_MT64x32x16_MI16x16x16x1_SE_1LDSB1_AF0EM8_AMAS3_BL1_EPS1_GRVW2_GSU1_GSUAMB_ISA90a_KLA_LRVW4_MAC_NLCA1_NLCB1_PGR1_SIA3_SU0_SUS0_SRVW4_TT2_16_USFGROn1_VAW2_VSn1_VW2_WSGRA1_WSGRB1_WG32_8_1_WGM1
    SolutionIndex: 287
    SolutionNameMin: Cijk_Ailk_Bjlk_HBH_MT96x128x32_MI32x32x8x1_SE_1LDSB0_AF0EM1_AMAS3_BL1_EPS0_GRVW4_GSU1_GSUAMB_ISA90a_KLA_LRVW4_MAC_NLCA3_NLCB1_PGR2_SIA3_SU0_SUS0_SRVW0_TT3_32_USFGROn1_VAW2_VSn1_VW2_WSGRA1_WSGRB1_WG32_8_1_WGM1
    SolutionIndex: 288
    SolutionNameMin: Cijk_Ailk_Bjlk_HBH_MT96x128x32_MI32x32x8x1_SE_1LDSB0_AF0EM8_AMAS3_BL1_EPS0_GRVW4_GSU1_GSUAMB_ISA90a_KLA_LRVW4_MAC_NLCA3_NLCB1_PGR2_SIA3_SU0_SUS0_SRVW0_TT3_32_USFGROn1_VAW2_VSn1_VW2_WSGRA1_WSGRB1_WG32_8_1_WGM1
    SolutionIndex: 289
    SolutionNameMin: Cijk_Ailk_Bjlk_HBH_MT128x128x16_MI32x32x8x1_SE_1LDSB0_AF0EM8_AMAS3_BL1_EPS0_GRVW8_GSU1_GSUAMB_ISA90a_KLA_LRVW4_MAC_NLCA1_NLCB1_PGR2_SIA3_SU32_SUS256_SRVW4_TT2_64_USFGROn1_VAW2_VSn1_VW2_WSGRA1_WSGRB1_WG64_4_1_WGM1
    SolutionIndex: 290
    SolutionNameMin: Cijk_Ailk_Bjlk_HBH_MT128x128x32_MI32x32x8x1_SE_1LDSB0_AF0EM8_AMAS3_BL1_EPS0_GRVW8_GSU1_GSUAMB_ISA90a_KLA_LRVW4_MAC_NLCA1_NLCB1_PGR2_SIA3_SU32_SUS256_SRVW4_TT2_64_USFGROn1_VAW2_VSn1_VW2_WSGRA1_WSGRB1_WG64_4_1_WGM15
    SolutionIndex: 291
    SolutionNameMin: Cijk_Ailk_Bjlk_HBH_MT128x96x32_MI32x32x8x1_SE_1LDSB0_AF0EM8_AMAS3_BL1_EPS0_GRVW4_GSU1_GSUAMB_ISA90a_KLA_LRVW4_MAC_NLCA1_NLCB3_PGR2_SIA3_SU0_SUS0_SRVW4_TT1_96_USFGROn1_VAW2_VSn1_VW2_WSGRA1_WSGRB1_WG128_2_1_WGM2
    SolutionIndex: 292
    SolutionNameMin: Cijk_Ailk_Bjlk_HBH_MT128x128x32_MI32x32x8x1_SE_1LDSB0_AF0EM1_AMAS3_BL1_EPS0_GRVW8_GSU1_GSUAMB_ISA90a_KLA_LRVW4_MAC_NLCA1_NLCB1_PGR2_SIA3_SU0_SUS0_SRVW4_TT2_64_USFGROn1_VAW2_VSn1_VW2_WSGRA1_WSGRB1_WG64_4_1_WGM2
    SolutionIndex: 293
    SolutionNameMin: Cijk_Ailk_Bjlk_HBH_MT128x160x32_MI32x32x8x1_SE_1LDSB0_AF0EM8_AMAS3_BL1_EPS0_GRVW4_GSU1_GSUAMB_ISA90a_KLA_LRVW4_MAC_NLCA1_NLCB5_PGR2_SIA3_SU0_SUS0_SRVW4_TT1_160_USFGROn1_VAW2_VSn1_VW2_WSGRA1_WSGRB1_WG128_2_1_WGM2
    SolutionIndex: 294
    SolutionNameMin: Cijk_Ailk_Bjlk_HBH_MT64x128x16_MI32x32x8x1_SE_1LDSB0_AF0EM1_AMAS3_BL1_EPS0_GRVW8_GSU1_GSUAMB_ISA90a_KLA_LRVW4_MAC_NLCA1_NLCB1_PGR2_SIA3_SU32_SUS128_SRVW4_TT1_64_USFGROn1_VAW2_VSn1_VW2_WSGRA1_WSGRB1_WG64_4_1_WGM1
    SolutionIndex: 295
    SolutionNameMin: Cijk_Ailk_Bjlk_HBH_MT64x128x32_MI32x32x8x1_SE_1LDSB0_AF0EM1_AMAS3_BL1_EPS0_GRVW4_GSU1_GSUAMB_ISA90a_KLA_LRVW4_MAC_NLCA1_NLCB1_PGR2_SIA3_SU0_SUS0_SRVW4_TT1_64_USFGROn1_VAW2_VSn1_VW2_WSGRA1_WSGRB1_WG64_4_1_WGM2
    SolutionIndex: 296
    SolutionNameMin: Cijk_Ailk_Bjlk_HBH_MT64x32x16_MI16x16x16x1_SE_1LDSB0_AF0EM1_AMAS3_BL1_EPS0_GRVW2_GSU1_GSUAMB_ISA90a_KLA_LRVW4_MAC_NLCA1_NLCB1_PGR2_SIA3_SU0_SUS0_SRVW4_TT2_16_USFGROn1_VAW2_VSn1_VW2_WSGRA1_WSGRB1_WG32_8_1_WGM1
    SolutionIndex: 297
    SolutionNameMin: Cijk_Ailk_Bjlk_HBH_MT64x64x16_MI32x32x8x1_SE_1LDSB0_AF0EM1_AMAS3_BL1_EPS0_GRVW4_GSU1_GSUAMB_ISA90a_KLA_LRVW4_MAC_NLCA1_NLCB1_PGR2_SIA3_SU0_SUS0_SRVW4_TT1_32_USFGROn1_VAW2_VSn1_VW2_WSGRA1_WSGRB1_WG64_4_1_WGM1
    SolutionIndex: 298
    SolutionNameMin: Cijk_Ailk_Bjlk_HBH_MT32x32x16_MI16x16x16x1_SE_1LDSB0_AF0EM1_AMAS3_BL1_EPS0_GRVW4_GSU1_GSUAMB_ISA90a_KLA_LRVW4_MAC_NLCA1_NLCB1_PGR2_SIA3_SU0_SUS0_SRVW4_TT1_16_USFGROn1_VAW2_VSn1_VW2_WSGRA1_WSGRB1_WG32_8_1_WGM1
    SolutionIndex: 299
    SolutionNameMin: Cijk_Ailk_Bjlk_HBH_MT32x32x32_MI16x16x16x1_SE_1LDSB0_AF0EM1_AMAS3_BL1_EPS0_GRVW4_GSU1_GSUAMB_ISA90a_KLA_LRVW4_MAC_NLCA1_NLCB1_PGR2_SIA3_SU0_SUS0_SRVW4_TT1_16_USFGROn1_VAW2_VSn1_VW2_WSGRA1_WSGRB1_WG32_8_1_WGM1
    SolutionIndex: 300
    SolutionNameMin: Cijk_Ailk_Bjlk_HBH_MT64x64x16_MI32x32x8x1_SE_1LDSB0_AF0EM1_AMAS3_BL1_EPS0_GRVW2_GSU1_GSUAMB_ISA90a_KLA_LRVW4_MAC_NLCA1_NLCB1_PGR2_SIA3_SU32_SUS128_SRVW4_TT1_32_USFGROn1_VAW2_VSn1_VW2_WSGRA1_WSGRB1_WG64_4_1_WGM15
    SolutionIndex: 301
    SolutionNameMin: Cijk_Ailk_Bjlk_HBH_MT32x32x32_MI16x16x16x1_SE_1LDSB0_AF0EM8_AMAS3_BL1_EPS0_GRVW4_GSU1_GSUAMB_ISA90a_KLA_LRVW4_MAC_NLCA1_NLCB1_PGR2_SIA3_SU0_SUS0_SRVW4_TT1_16_USFGROn1_VAW2_VSn1_VW2_WSGRA1_WSGRB1_WG32_8_1_WGM1
    SolutionIndex: 302
    SolutionNameMin: Cijk_Ailk_Bjlk_HBH_MT16x64x32_MI16x16x16x1_SE_1LDSB0_AF0EM8_AMAS3_BL1_EPS1_GRVW2_GSU1_GSUAMB_ISA90a_KLA_LRVW4_MAC_NLCA1_NLCB1_PGR1_SIA3_SU0_SUS0_SRVW0_TT1_16_USFGROn1_VAW2_VSn1_VW2_WSGRA1_WSGRB1_WG16_16_1_WGM1
    SolutionIndex: 303
    SolutionNameMin: Cijk_Ailk_Bjlk_HBH_MT64x32x16_MI16x16x16x1_SE_1LDSB0_AF0EM8_AMAS3_BL1_EPS0_GRVW4_GSU1_GSUAMB_ISA90a_KLA_LRVW4_MAC_NLCA1_NLCB1_PGR2_SIA3_SU0_SUS0_SRVW4_TT2_16_USFGROn1_VAW2_VSn1_VW2_WSGRA1_WSGRB1_WG32_8_1_WGM1
    SolutionIndex: 304
    SolutionNameMin: Cijk_Ailk_Bjlk_HBH_MT64x64x16_MI32x32x8x1_SE_1LDSB0_AF0EM8_AMAS3_BL1_EPS0_GRVW4_GSU1_GSUAMB_ISA90a_KLA_LRVW4_MAC_NLCA1_NLCB1_PGR2_SIA3_SU0_SUS0_SRVW4_TT1_32_USFGROn1_VAW2_VSn1_VW2_WSGRA1_WSGRB1_WG64_4_1_WGM1
    SolutionIndex: 305
    SolutionNameMin: Cijk_Ailk_Bjlk_HBH_MT64x64x32_MI32x32x8x1_SE_1LDSB0_AF0EM8_AMAS3_BL1_EPS0_GRVW8_GSU1_GSUAMB_ISA90a_KLA_LRVW4_MAC_NLCA1_NLCB1_PGR2_SIA3_SU32_SUS128_SRVW4_TT1_32_USFGROn1_VAW2_VSn1_VW2_WSGRA1_WSGRB1_WG64_4_1_WGM1
    SolutionIndex: 306
    SolutionNameMin: Cijk_Ailk_Bjlk_HBH_MT64x64x32_MI32x32x8x1_SE_1LDSB0_AF0EM8_AMAS3_BL1_EPS0_GRVW8_GSU1_GSUAMB_ISA90a_KLA_LRVW4_MAC_NLCA1_NLCB1_PGR2_SIA3_SU0_SUS0_SRVW4_TT1_32_USFGROn1_VAW2_VSn1_VW2_WSGRA1_WSGRB1_WG64_4_1_WGM15
    SolutionIndex: 307
    SolutionNameMin: Cijk_Ailk_Bjlk_HBH_MT256x128x32_MI32x32x8x1_SE_1LDSB0_AF0EM8_AMAS3_BL1_EPS1_GRVW8_GSU1_GSUAMB_ISA90a_KLA_LRVW4_MAC_NLCA1_NLCB1_PGR1_SIA3_SU0_SUS0_SRVW4_TT4_64_USFGROn1_VAW2_VSn1_VW2_WSGRA1_WSGRB1_WG64_4_1_WGM15
    SolutionIndex: 308
    SolutionNameMin: Cijk_Ailk_Bjlk_HBH_MT128x128x32_MI32x32x8x1_SE_1LDSB0_AF0EM8_AMAS3_BL1_EPS0_GRVW8_GSU3_GSUAMB_ISA90a_KLA_LRVW4_MAC_NLCA1_NLCB1_PGR2_SIA3_SU0_SUS0_SRVW4_TT2_64_USFGROn1_VAW1_VSn1_VW2_WSGRA1_WSGRB1_WG64_4_1_WGM15
- - - [64, 448, 1, 3328]
    - [211, 2.674]
  - - [1, 64, 1, 256]
    - [1, 0.0]
  - - [3584, 64, 1, 1280]
    - [9, 11.899]
  - - [64, 128, 1, 256]
    - [10, 0.183]
  - - [64, 5888, 1, 1280]
    - [11, 20.278]
  - - [64, 4288, 1, 1280]
    - [9, 14.497]
  - - [3584, 64, 1, 3328]
    - [9, 18.068]
  - - [64, 1024, 1, 3328]
    - [211, 5.812]
  - - [1, 64, 1, 1280]
    - [3, 0.001]
  - - [704, 64, 1, 3328]
    - [12, 4.841]
  - - [64, 448, 1, 1280]
    - [12, 2.067]
  - - [64, 704, 1, 3328]
    - [211, 4.377]
  - - [64, 64, 1, 1280]
    - [8, 0.295]
  - - [64, 5056, 1, 256]
    - [212, 3.156]
  - - [64, 4288, 1, 3328]
    - [9, 21.709]
  - - [1856, 64, 1, 3328]
    - [13, 9.81]
  - - [1, 64, 1, 1]
    - [0, 0.0]
  - - [448, 64, 1, 1280]
    - [12, 2.027]
  - - [5888, 64, 1, 1280]
    - [9, 19.689]
  - - [2944, 64, 1, 256]
    - [14, 3.882]
  - - [64, 1856, 1, 256]
    - [10, 2.501]
  - - [64, 1024, 1, 1280]
    - [12, 4.773]
  - - [64, 256, 1, 1280]
    - [8, 1.176]
  - - [704, 64, 1, 1280]
    - [12, 3.185]
  - - [64, 128, 1, 1280]
    - [12, 0.588]
  - - [2368, 64, 1, 256]
    - [8, 3.191]
  - - [2368, 64, 1, 3328]
    - [213, 12.446]
  - - [64, 1408, 1, 3328]
    - [8, 9.599]
  - - [1856, 64, 1, 1280]
    - [16, 6.907]
  - - [64, 3584, 1, 1280]
    - [17, 12.206]
  - - [448, 64, 1, 3328]
    - [211, 2.549]
  - - [5888, 64, 1, 3328]
    - [9, 29.497]
  - - [128, 64, 1, 256]
    - [8, 0.176]
  - - [64, 128, 1, 3328]
    - [18, 0.934]
  - - [64, 256, 1, 3328]
    - [214, 1.779]
  - - [4288, 64, 1, 3328]
    - [9, 21.893]
  - - [64, 2944, 1, 256]
    - [215, 1.894]
  - - [6784, 64, 1, 256]
    - [11, 7.826]
  - - [1024, 64, 1, 1280]
    - [8, 4.633]
  - - [64, 2368, 1, 1280]
    - [16, 8.604]
  - - [64, 3584, 1, 3328]
    - [216, 17.398]
  - - [64, 6784, 1, 3328]
    - [216, 23.553]
  - - [3584, 64, 1, 256]
    - [14, 4.531]
  - - [64, 1856, 1, 3328]
    - [216, 10.181]
  - - [448, 64, 1, 256]
    - [19, 0.627]
  - - [64, 5056, 1, 3328]
    - [17, 25.33]
  - - [256, 64, 1, 256]
    - [10, 0.363]
  - - [4288, 64, 1, 1280]
    - [217, 9.574]
  - - [1, 1, 1, 1]
    - [2, 0.0]
  - - [5056, 64, 1, 1280]
    - [217, 11.233]
  - - [1024, 64, 1, 3328]
    - [8, 6.902]
  - - [1408, 64, 1, 256]
    - [10, 1.984]
  - - [64, 1408, 1, 256]
    - [19, 1.925]
  - - [64, 2368, 1, 3328]
    - [216, 11.996]
  - - [64, 448, 1, 256]
    - [10, 0.622]
  - - [64, 6784, 1, 1280]
    - [11, 23.104]
  - - [64, 1856, 1, 1280]
    - [16, 6.798]
  - - [64, 6784, 1, 256]
    - [21, 7.976]
  - - [64, 5056, 1, 1280]
    - [217, 11.185]
  - - [64, 4288, 1, 256]
    - [215, 2.681]
  - - [128, 64, 1, 1280]
    - [8, 0.588]
  - - [5888, 64, 1, 256]
    - [23, 6.879]
  - - [64, 5888, 1, 3328]
    - [17, 29.253]
  - - [64, 1024, 1, 256]
    - [12, 1.443]
  - - [5056, 64, 1, 3328]
    - [9, 25.597]
  - - [256, 64, 1, 1280]
    - [8, 1.164]
  - - [64, 256, 1, 256]
    - [218, 0.195]
  - - [704, 64, 1, 256]
    - [10, 1.015]
  - - [64, 1408, 1, 1280]
    - [8, 6.278]
  - - [1, 1, 1, 256]
    - [219, 0.0]
  - - [64, 704, 1, 256]
    - [10, 0.985]
  - - [64, 2944, 1, 3328]
    - [216, 15.261]
  - - [64, 64, 1, 256]
    - [25, 0.092]
  - - [1856, 64, 1, 256]
    - [10, 2.576]
  - - [128, 64, 1, 3328]
    - [26, 0.92]
  - - [2944, 64, 1, 1280]
    - [16, 10.451]
  - - [4288, 64, 1, 256]
    - [22, 5.497]
  - - [1, 1, 1, 1280]
    - [3, 0.0]
  - - [64, 2944, 1, 1280]
    - [217, 6.811]
  - - [1408, 64, 1, 1280]
    - [8, 6.465]
  - - [6784, 64, 1, 3328]
    - [220, 21.94]
  - - [1024, 64, 1, 256]
    - [10, 1.465]
  - - [64, 2368, 1, 256]
    - [24, 3.145]
  - - [64, 3584, 1, 256]
    - [221, 2.242]
  - - [2944, 64, 1, 3328]
    - [15, 15.031]
  - - [2368, 64, 1, 1280]
    - [221, 5.637]
  - - [256, 64, 1, 3328]
    - [214, 1.682]
  - - [64, 64, 1, 3328]
    - [214, 0.461]
  - - [1, 1, 1, 3328]
    - [3, 0.0]
  - - [64, 5888, 1, 256]
    - [23, 7.012]
  - - [64, 704, 1, 1280]
    - [8, 3.249]
  - - [6784, 64, 1, 1280]
    - [11, 22.852]
  - - [5056, 64, 1, 256]
    - [217, 3.105]
  - - [1408, 64, 1, 3328]
    - [211, 7.605]
  - - [4096, 7133, 1, 4096]
    - [27, 88.148]
  - - [512, 16, 1, 512]
    - [222, 0.173]
  - - [2048, 7133, 1, 2048]
    - [27, 77.864]
  - - [2560, 7133, 1, 2560]
    - [223, 85.749]
  - - [1024, 1024, 1, 1024]
    - [21, 31.586]
  - - [3072, 7435, 1, 1024]
    - [29, 76.645]
  - - [1024, 32, 1, 512]
    - [19, 1.26]
  - - [1760, 7133, 1, 1760]
    - [224, 77.287]
  - - [7680, 5481, 1, 2560]
    - [30, 88.821]
  - - [1024, 16, 1, 512]
    - [10, 0.622]
  - - [512, 32, 1, 512]
    - [8, 0.618]
  - - [3136, 256, 64, 64]
    - [31, 19.633]
  - - [784, 512, 64, 128]
    - [32, 33.741]
  - - [784, 128, 64, 512]
    - [27, 43.534]
  - - [3136, 64, 128, 64]
    - [33, 15.86]
  - - [196, 256, 128, 1024]
    - [34, 46.137]
  - - [196, 256, 64, 1024]
    - [35, 40.534]
  - - [196, 1024, 128, 256]
    - [36, 36.233]
  - - [784, 128, 256, 512]
    - [37, 50.681]
  - - [3136, 64, 64, 256]
    - [38, 31.938]
  - - [3136, 64, 256, 256]
    - [39, 32.917]
  - - [3136, 256, 256, 64]
    - [31, 20.735]
  - - [3136, 64, 128, 256]
    - [38, 32.699]
  - - [784, 128, 128, 512]
    - [225, 50.084]
  - - [784, 512, 128, 128]
    - [41, 36.18]
  - - [784, 512, 256, 128]
    - [41, 37.422]
  - - [196, 1024, 64, 256]
    - [36, 33.049]
  - - [3136, 64, 64, 64]
    - [42, 14.563]
  - - [196, 1024, 256, 256]
    - [36, 37.911]
  - - [196, 256, 256, 1024]
    - [36, 50.048]
  - - [3136, 256, 128, 64]
    - [31, 20.373]
  - - [3136, 64, 256, 64]
    - [11, 16.517]
  - - [14, 64, 1, 14]
    - [10, 0.001]
  - - [15, 64, 1, 14]
    - [218, 0.001]
  - - [15, 64, 1, 15]
    - [6, 0.001]
  - - [15, 64, 1, 15]
    - [10, 0.001]
  - - [17, 64, 1, 15]
    - [43, 0.002]
  - - [17, 64, 1, 17]
    - [7, 0.002]
  - - [17, 64, 1, 17]
    - [43, 0.002]
  - - [21, 64, 1, 17]
    - [226, 0.001]
  - - [21, 64, 1, 21]
    - [44, 0.003]
  - - [24, 64, 1, 24]
    - [45, 0.004]
  - - [30, 64, 1, 30]
    - [25, 0.006]
  - - [30, 64, 1, 31]
    - [44, 0.007]
  - - [31, 64, 1, 31]
    - [226, 0.003]
  - - [32, 64, 1, 32]
    - [47, 0.008]
  - - [32, 64, 1, 35]
    - [227, 0.003]
  - - [34, 64, 1, 24]
    - [49, 0.005]
  - - [34, 64, 1, 34]
    - [46, 0.008]
  - - [35, 64, 1, 35]
    - [46, 0.008]
  - - [64, 14, 1, 14]
    - [48, 0.001]
  - - [64, 15, 1, 14]
    - [50, 0.001]
  - - [64, 15, 1, 15]
    - [5, 0.002]
  - - [64, 15, 1, 15]
    - [50, 0.001]
  - - [64, 17, 1, 15]
    - [48, 0.002]
  - - [64, 17, 1, 17]
    - [4, 0.002]
  - - [64, 17, 1, 17]
    - [45, 0.002]
  - - [64, 21, 1, 17]
    - [45, 0.002]
  - - [64, 21, 1, 21]
    - [45, 0.003]
  - - [64, 24, 1, 24]
    - [228, 0.002]
  - - [64, 30, 1, 30]
    - [45, 0.006]
  - - [64, 30, 1, 31]
    - [45, 0.006]
  - - [64, 31, 1, 31]
    - [45, 0.006]
  - - [64, 32, 1, 32]
    - [45, 0.007]
  - - [64, 32, 1, 35]
    - [229, 0.004]
  - - [64, 34, 1, 24]
    - [230, 0.003]
  - - [64, 34, 1, 34]
    - [24, 0.007]
  - - [64, 35, 1, 35]
    - [231, 0.004]
  - - [64, 128, 512, 128]
    - [51, 16.709]
  - - [64, 512, 1, 512]
    - [12, 1.252]
  - - [64, 512, 64, 512]
    - [232, 25.632]
  - - [128, 64, 512, 128]
    - [53, 16.572]
  - - [512, 64, 1, 512]
    - [19, 1.244]
  - - [512, 64, 64, 512]
    - [31, 30.704]
  - - [1024, 2, 1, 4]
    - [45, 0.001]
  - - [1024, 2, 1, 32]
    - [218, 0.003]
  - - [1024, 2, 1, 2048]
    - [233, 0.152]
  - - [1024, 1024, 1, 4]
    - [56, 0.34]
  - - [1024, 1024, 1, 32]
    - [234, 1.382]
  - - [1024, 1024, 1, 2048]
    - [58, 40.595]
  - - [1024, 1024, 1, 4096]
    - [59, 50.405]
  - - [1024, 4096, 1, 2048]
    - [235, 68.777]
  - - [1024, 4096, 1, 4096]
    - [60, 75.168]
  - - [1024, 30528, 1, 2048]
    - [61, 86.633]
  - - [1024, 30528, 1, 4096]
    - [30, 91.49]
  - - [4096, 1024, 1, 2048]
    - [62, 64.134]
  - - [4096, 1024, 1, 4096]
    - [63, 72.848]
  - - [3, 64, 512, 3]
    - [43, 0.025]
  - - [5, 64, 512, 5]
    - [46, 0.067]
  - - [5, 64, 960, 5]
    - [43, 0.104]
  - - [9, 64, 512, 9]
    - [43, 0.215]
  - - [13, 512, 1, 32768]
    - [64, 3.432]
  - - [27, 128, 32768, 27]
    - [65, 4.111]
  - - [33, 32, 200, 33]
    - [66, 0.599]
  - - [33, 32, 1600, 33]
    - [46, 2.02]
  - - [67, 2048, 1, 512]
    - [16, 4.629]
  - - [74, 2048, 1, 512]
    - [16, 4.967]
  - - [74, 2048, 1, 960]
    - [16, 7.253]
  - - [100, 2048, 1, 512]
    - [22, 6.153]
  - - [256, 128, 1, 32768]
    - [67, 16.37]
  - - [256, 1280, 1, 8976]
    - [68, 32.777]
  - - [256, 2560, 1, 8976]
    - [69, 51.576]
  - - [256, 2816, 1, 8976]
    - [236, 54.283]
  - - [256, 3328, 1, 8976]
    - [70, 60.293]
  - - [256, 3584, 1, 8976]
    - [71, 52.93]
  - - [256, 3840, 1, 8976]
    - [71, 56.485]
  - - [256, 4096, 1, 8976]
    - [72, 58.651]
  - - [256, 4352, 1, 8976]
    - [72, 61.567]
  - - [256, 4864, 1, 8976]
    - [59, 66.171]
  - - [256, 5120, 1, 8976]
    - [237, 64.857]
  - - [256, 5632, 1, 8976]
    - [62, 68.841]
  - - [256, 5888, 1, 8976]
    - [62, 71.971]
  - - [256, 6144, 1, 8976]
    - [62, 75.064]
  - - [256, 7168, 1, 8976]
    - [73, 64.953]
  - - [256, 8192, 1, 8976]
    - [74, 73.922]
  - - [256, 8960, 1, 8976]
    - [75, 74.134]
  - - [256, 9728, 1, 8976]
    - [75, 80.206]
  - - [256, 9984, 1, 8976]
    - [75, 83.893]
  - - [256, 10240, 1, 8976]
    - [238, 68.883]
  - - [256, 10496, 1, 8976]
    - [239, 70.29]
  - - [256, 11008, 1, 8976]
    - [76, 72.46]
  - - [256, 11264, 1, 8976]
    - [61, 74.183]
  - - [256, 11520, 1, 8976]
    - [76, 75.676]
  - - [256, 11776, 1, 8976]
    - [76, 77.338]
  - - [256, 12544, 1, 8976]
    - [76, 82.236]
  - - [256, 12800, 1, 8976]
    - [76, 83.66]
  - - [256, 13312, 1, 8976]
    - [61, 86.765]
  - - [256, 13568, 1, 8976]
    - [240, 78.335]
  - - [256, 14336, 1, 8976]
    - [78, 77.661]
  - - [256, 14848, 1, 8976]
    - [240, 87.108]
  - - [256, 15104, 1, 8976]
    - [241, 79.652]
  - - [256, 15872, 1, 8976]
    - [60, 80.302]
  - - [256, 16128, 1, 8976]
    - [60, 81.201]
  - - [256, 17152, 1, 8976]
    - [242, 78.555]
  - - [256, 17408, 1, 8976]
    - [243, 79.449]
  - - [256, 18688, 1, 8976]
    - [62, 82.253]
  - - [256, 19968, 1, 8976]
    - [62, 87.901]
  - - [256, 20480, 1, 8976]
    - [80, 89.865]
  - - [256, 20992, 1, 8976]
    - [27, 91.925]
  - - [256, 21248, 1, 8976]
    - [81, 71.729]
  - - [256, 22016, 1, 8976]
    - [82, 74.311]
  - - [256, 26112, 1, 8976]
    - [83, 88.091]
  - - [256, 32512, 1, 8976]
    - [84, 86.827]
  - - [256, 32768, 1, 1]
    - [85, 0.231]
  - - [256, 33536, 1, 8976]
    - [86, 89.598]
  - - [256, 44505, 1, 8976]
    - [244, 89.049]
  - - [257, 4096, 1, 1024]
    - [245, 21.855]
  - - [480, 1024, 1, 32768]
    - [88, 52.904]
  - - [512, 32, 1, 200]
    - [10, 0.264]
  - - [512, 32, 1, 1600]
    - [12, 1.307]
  - - [512, 256, 1, 32768]
    - [89, 34.989]
  - - [512, 512, 1, 200]
    - [90, 4.018]
  - - [512, 512, 1, 1600]
    - [11, 16.019]
  - - [512, 2048, 1, 256]
    - [20, 15.589]
  - - [560, 1024, 1, 200]
    - [246, 4.524]
  - - [560, 1024, 1, 1600]
    - [9, 26.711]
  - - [768, 2048, 1, 256]
    - [91, 21.603]
  - - [1024, 64, 1, 512]
    - [8, 2.52]
  - - [1024, 64, 1, 960]
    - [19, 3.96]
  - - [1024, 256, 1, 1024]
    - [9, 12.601]
  - - [1024, 256, 1, 1280]
    - [9, 14.159]
  - - [1024, 256, 1, 2304]
    - [17, 18.391]
  - - [1024, 256, 1, 2816]
    - [9, 19.208]
  - - [1024, 256, 1, 3072]
    - [9, 20.073]
  - - [1024, 256, 1, 3328]
    - [247, 20.981]
  - - [1024, 256, 1, 3584]
    - [247, 21.922]
  - - [1024, 256, 1, 4096]
    - [248, 24.128]
  - - [1024, 256, 1, 4352]
    - [247, 24.75]
  - - [1024, 256, 1, 4608]
    - [247, 26.429]
  - - [1024, 256, 1, 5120]
    - [248, 26.471]
  - - [1024, 256, 1, 5376]
    - [248, 26.363]
  - - [1024, 256, 1, 5632]
    - [247, 26.158]
  - - [1024, 256, 1, 6144]
    - [247, 27.47]
  - - [1024, 256, 1, 6400]
    - [93, 26.072]
  - - [1024, 256, 1, 7680]
    - [92, 28.496]
  - - [1024, 256, 1, 7936]
    - [93, 28.794]
  - - [1024, 256, 1, 8192]
    - [93, 30.056]
  - - [1024, 256, 1, 8448]
    - [93, 30.098]
  - - [1024, 256, 1, 9728]
    - [93, 32.21]
  - - [1024, 256, 1, 9984]
    - [93, 32.984]
  - - [1024, 256, 1, 10496]
    - [93, 33.549]
  - - [1024, 256, 1, 11520]
    - [93, 34.264]
  - - [1024, 256, 1, 12032]
    - [93, 35.43]
  - - [1024, 256, 1, 13568]
    - [93, 37.07]
  - - [1024, 256, 1, 14336]
    - [93, 37.536]
  - - [1024, 256, 1, 14848]
    - [93, 37.87]
  - - [1024, 256, 1, 15104]
    - [93, 37.965]
  - - [1024, 256, 1, 15872]
    - [93, 38.205]
  - - [1024, 256, 1, 16128]
    - [247, 43.243]
  - - [1024, 256, 1, 17152]
    - [93, 39.392]
  - - [1024, 256, 1, 17408]
    - [93, 39.917]
  - - [1024, 256, 1, 18944]
    - [93, 40.544]
  - - [1024, 256, 1, 19712]
    - [93, 41.231]
  - - [1024, 256, 1, 19968]
    - [93, 41.097]
  - - [1024, 256, 1, 21248]
    - [93, 41.67]
  - - [1024, 256, 1, 21504]
    - [93, 41.949]
  - - [1024, 256, 1, 22016]
    - [93, 42.25]
  - - [1024, 256, 1, 28672]
    - [94, 45.067]
  - - [1024, 256, 1, 33536]
    - [94, 47.436]
  - - [1024, 512, 1, 32768]
    - [95, 57.249]
  - - [1024, 1024, 1, 200]
    - [96, 11.814]
  - - [1024, 1024, 1, 512]
    - [21, 24.389]
  - - [1024, 1024, 1, 960]
    - [249, 24.563]
  - - [1024, 1024, 1, 1600]
    - [58, 37.356]
  - - [1024, 1024, 1, 32768]
    - [97, 68.25]
  - - [1600, 1024, 1, 512]
    - [250, 22.841]
  - - [1600, 1024, 1, 960]
    - [223, 38.028]
  - - [2048, 256, 1, 1024]
    - [9, 20.366]
  - - [2048, 960, 1, 1]
    - [57, 0.126]
  - - [2048, 2048, 1, 512]
    - [91, 44.15]
  - - [2048, 2048, 1, 960]
    - [235, 51.617]
  - - [2048, 2048, 1, 1024]
    - [235, 54.457]
  - - [3200, 2048, 1, 1024]
    - [30, 67.507]
  - - [4096, 4096, 1, 1024]
    - [61, 74.331]
  - - [14, 64, 10880, 14]
    - [47, 1.684]
  - - [15, 64, 10880, 14]
    - [47, 1.742]
  - - [15, 64, 7680, 15]
    - [47, 1.762]
  - - [15, 64, 10880, 15]
    - [101, 1.86]
  - - [17, 64, 7680, 15]
    - [65, 1.555]
  - - [17, 64, 6144, 17]
    - [102, 1.629]
  - - [17, 64, 7680, 17]
    - [103, 1.688]
  - - [21, 64, 6144, 17]
    - [104, 1.997]
  - - [21, 64, 6144, 21]
    - [104, 2.467]
  - - [24, 64, 4736, 24]
    - [105, 4.106]
  - - [30, 64, 2048, 30]
    - [106, 3.098]
  - - [30, 64, 2048, 31]
    - [104, 3.239]
  - - [31, 64, 2048, 31]
    - [107, 2.844]
  - - [32, 64, 4608, 32]
    - [108, 7.595]
  - - [32, 64, 4608, 35]
    - [108, 6.598]
  - - [34, 64, 4736, 24]
    - [104, 2.751]
  - - [34, 64, 4736, 34]
    - [102, 3.728]
  - - [35, 64, 4608, 35]
    - [102, 3.822]
  - - [64, 14, 10880, 14]
    - [48, 2.034]
  - - [64, 15, 10880, 14]
    - [45, 2.145]
  - - [64, 15, 7680, 15]
    - [48, 2.167]
  - - [64, 15, 10880, 15]
    - [45, 2.292]
  - - [64, 17, 7680, 15]
    - [109, 2.319]
  - - [64, 17, 6144, 17]
    - [57, 2.345]
  - - [64, 17, 7680, 17]
    - [57, 2.44]
  - - [64, 21, 6144, 17]
    - [57, 2.839]
  - - [64, 21, 6144, 21]
    - [109, 3.428]
  - - [64, 24, 4736, 24]
    - [57, 4.203]
  - - [64, 30, 2048, 30]
    - [57, 4.764]
  - - [64, 30, 2048, 31]
    - [109, 4.819]
  - - [64, 31, 2048, 31]
    - [57, 4.962]
  - - [64, 32, 4608, 32]
    - [110, 7.912]
  - - [64, 32, 4608, 35]
    - [111, 6.879]
  - - [64, 34, 4736, 24]
    - [112, 4.675]
  - - [64, 34, 4736, 34]
    - [113, 6.027]
  - - [64, 35, 4608, 35]
    - [114, 6.148]
  - - [1024, 1024, 1, 3840]
    - [59, 49.633]
  - - [1024, 1024, 1, 3968]
    - [59, 49.922]
  - - [1024, 1024, 1, 6528]
    - [59, 55.323]
  - - [1024, 1024, 1, 7104]
    - [251, 60.49]
  - - [1024, 1024, 1, 7200]
    - [252, 60.228]
  - - [1024, 1024, 1, 8064]
    - [251, 63.188]
  - - [1024, 1024, 1, 8160]
    - [251, 63.658]
  - - [1024, 1024, 1, 9216]
    - [72, 59.789]
  - - [1024, 1024, 1, 9520]
    - [72, 60.143]
  - - [1024, 1024, 1, 10064]
    - [72, 61.507]
  - - [1024, 1024, 1, 10080]
    - [97, 61.257]
  - - [1024, 1024, 1, 10200]
    - [72, 61.511]
  - - [1024, 4096, 1, 3840]
    - [60, 74.89]
  - - [1024, 4096, 1, 3968]
    - [60, 74.764]
  - - [1024, 4096, 1, 6528]
    - [79, 80.776]
  - - [1024, 4096, 1, 7104]
    - [60, 81.52]
  - - [1024, 4096, 1, 7200]
    - [79, 81.788]
  - - [1024, 4096, 1, 8064]
    - [79, 82.769]
  - - [1024, 4096, 1, 8160]
    - [60, 82.323]
  - - [1024, 4096, 1, 9216]
    - [79, 83.51]
  - - [1024, 4096, 1, 9520]
    - [60, 82.168]
  - - [1024, 4096, 1, 10064]
    - [79, 83.245]
  - - [1024, 4096, 1, 10080]
    - [79, 84.847]
  - - [1024, 4096, 1, 10200]
    - [79, 83.637]
  - - [1024, 42720, 1, 3968]
    - [27, 91.037]
  - - [1024, 42720, 1, 6528]
    - [27, 92.695]
  - - [1024, 42720, 1, 7104]
    - [27, 92.931]
  - - [1024, 42720, 1, 7200]
    - [27, 92.86]
  - - [1024, 42720, 1, 9520]
    - [27, 93.151]
  - - [1024, 42720, 1, 10080]
    - [27, 93.556]
  - - [4096, 1024, 1, 3840]
    - [63, 71.105]
  - - [4096, 1024, 1, 3968]
    - [63, 71.842]
  - - [4096, 1024, 1, 6528]
    - [63, 76.947]
  - - [4096, 1024, 1, 7104]
    - [63, 78.729]
  - - [4096, 1024, 1, 7200]
    - [63, 78.668]
  - - [4096, 1024, 1, 8064]
    - [63, 80.208]
  - - [4096, 1024, 1, 8160]
    - [63, 80.184]
  - - [4096, 1024, 1, 9216]
    - [63, 81.236]
  - - [4096, 1024, 1, 9520]
    - [63, 80.119]
  - - [4096, 1024, 1, 10064]
    - [63, 80.144]
  - - [4096, 1024, 1, 10080]
    - [63, 81.816]
  - - [4096, 1024, 1, 10200]
    - [63, 80.001]
  - - [27, 64, 1920, 27]
    - [102, 2.78]
  - - [27, 64, 1920, 33]
    - [116, 3.316]
  - - [33, 64, 1920, 33]
    - [102, 2.991]
  - - [64, 27, 1920, 27]
    - [253, 2.612]
  - - [64, 27, 1920, 33]
    - [57, 4.486]
  - - [64, 33, 1920, 33]
    - [114, 4.46]
  - - [1024, 1024, 1, 3240]
    - [117, 44.716]
  - - [1024, 1024, 1, 3960]
    - [58, 47.884]
  - - [1024, 4096, 1, 3240]
    - [60, 69.657]
  - - [1024, 4096, 1, 3960]
    - [60, 72.307]
  - - [1024, 42720, 1, 3960]
    - [27, 90.024]
  - - [4096, 1024, 1, 3240]
    - [63, 67.389]
  - - [4096, 1024, 1, 3960]
    - [63, 70.509]
  - - [64, 1280, 64, 192]
    - [52, 27.262]
  - - [64, 1280, 64, 320]
    - [118, 36.35]
  - - [64, 1280, 64, 384]
    - [100, 39.517]
  - - [64, 1280, 64, 448]
    - [118, 42.408]
  - - [64, 2048, 64, 192]
    - [118, 30.143]
  - - [64, 2048, 64, 320]
    - [119, 38.429]
  - - [64, 2048, 64, 384]
    - [36, 41.477]
  - - [64, 2048, 64, 448]
    - [120, 43.967]
  - - [1225, 192, 64, 32]
    - [121, 8.349]
  - - [1225, 192, 64, 48]
    - [122, 11.849]
  - - [1225, 192, 64, 64]
    - [123, 15.012]
  - - [1225, 256, 64, 48]
    - [124, 12.376]
  - - [1225, 256, 64, 64]
    - [123, 15.578]
  - - [1225, 288, 64, 48]
    - [125, 10.951]
  - - [1225, 288, 64, 64]
    - [126, 14.011]
  - - [5329, 64, 64, 80]
    - [254, 15.285]
  - - [289, 768, 64, 128]
    - [36, 21.14]
  - - [289, 768, 64, 160]
    - [36, 24.598]
  - - [289, 768, 64, 192]
    - [127, 27.583]
  - - [64, 1280, 32, 192]
    - [36, 23.826]
  - - [64, 1280, 32, 320]
    - [52, 31.504]
  - - [64, 1280, 32, 384]
    - [52, 34.472]
  - - [64, 1280, 32, 448]
    - [52, 36.856]
  - - [64, 2048, 32, 192]
    - [119, 24.926]
  - - [64, 2048, 32, 320]
    - [36, 33.017]
  - - [64, 2048, 32, 384]
    - [36, 34.173]
  - - [64, 2048, 32, 448]
    - [128, 38.007]
  - - [1225, 192, 32, 32]
    - [121, 7.16]
  - - [1225, 192, 32, 48]
    - [129, 10.15]
  - - [1225, 192, 32, 64]
    - [123, 13.109]
  - - [1225, 256, 32, 48]
    - [129, 11.121]
  - - [1225, 256, 32, 64]
    - [123, 13.915]
  - - [1225, 288, 32, 48]
    - [56, 10.472]
  - - [1225, 288, 32, 64]
    - [125, 12.68]
  - - [5329, 64, 32, 80]
    - [123, 14.318]
  - - [289, 768, 32, 128]
    - [36, 18.161]
  - - [289, 768, 32, 160]
    - [36, 21.268]
  - - [289, 768, 32, 192]
    - [36, 24.387]
  - - [49, 512, 64, 2048]
    - [36, 33.108]
  - - [49, 2048, 64, 512]
    - [36, 28.433]
  - - [3136, 64, 32, 256]
    - [91, 28.764]
  - - [3136, 64, 32, 64]
    - [96, 12.758]
  - - [3136, 256, 32, 64]
    - [130, 18.561]
  - - [784, 128, 32, 512]
    - [255, 32.0]
  - - [784, 512, 32, 128]
    - [52, 29.497]
  - - [196, 256, 32, 1024]
    - [131, 32.961]
  - - [196, 1024, 32, 256]
    - [35, 29.734]
  - - [49, 512, 32, 2048]
    - [132, 24.246]
  - - [49, 2048, 32, 512]
    - [36, 24.864]
  - - [3136, 64, 64, 128]
    - [133, 22.841]
  - - [3136, 128, 64, 256]
    - [134, 41.187]
  - - [784, 256, 64, 512]
    - [29, 56.347]
  - - [3136, 256, 64, 128]
    - [41, 33.212]
  - - [3136, 256, 64, 256]
    - [41, 50.595]
  - - [196, 512, 64, 1024]
    - [80, 47.406]
  - - [784, 512, 64, 256]
    - [41, 50.543]
  - - [784, 512, 64, 512]
    - [135, 64.628]
  - - [196, 1024, 64, 512]
    - [36, 44.825]
  - - [196, 1024, 64, 1024]
    - [136, 53.097]
  - - [49, 1024, 64, 2048]
    - [132, 39.773]
  - - [49, 2048, 64, 1024]
    - [36, 36.809]
  - - [3136, 64, 32, 128]
    - [91, 19.875]
  - - [3136, 128, 32, 256]
    - [29, 39.163]
  - - [784, 256, 32, 512]
    - [128, 49.332]
  - - [3136, 256, 32, 128]
    - [41, 31.477]
  - - [3136, 256, 32, 256]
    - [135, 48.146]
  - - [196, 512, 32, 1024]
    - [36, 42.004]
  - - [784, 512, 32, 256]
    - [135, 44.105]
  - - [784, 512, 32, 512]
    - [29, 57.35]
  - - [196, 1024, 32, 512]
    - [36, 40.139]
  - - [196, 1024, 32, 1024]
    - [80, 48.303]
  - - [49, 1024, 32, 2048]
    - [256, 32.121]
  - - [49, 2048, 32, 1024]
    - [137, 32.786]
  - - [7680, 8192, 1, 8192]
    - [34, 95.68]
  - - [3840, 4096, 1, 4096]
    - [27, 89.599]
  - - [1920, 2048, 1, 2048]
    - [235, 64.866]
  - - [960, 1024, 1, 1024]
    - [21, 30.57]
  - - [480, 512, 1, 512]
    - [16, 7.501]
  - - [8192, 7680, 1, 8192]
    - [34, 95.639]
  - - [4096, 3840, 1, 4096]
    - [62, 89.854]
  - - [2048, 1920, 1, 2048]
    - [241, 63.508]
  - - [1024, 960, 1, 1024]
    - [115, 29.612]
  - - [512, 480, 1, 512]
    - [215, 4.586]
  - - [8192, 8192, 1, 8192]
    - [138, 95.786]
  - - [4096, 4096, 1, 4096]
    - [61, 87.563]
  - - [2048, 2048, 1, 2048]
    - [60, 64.996]
  - - [512, 512, 1, 512]
    - [215, 5.0]
  - - [64, 512, 16, 512]
    - [21, 15.275]
  - - [1024, 2, 1, 1]
    - [48, 0.0]
  - - [1024, 2, 1, 512]
    - [10, 0.073]
  - - [1024, 1024, 1, 1]
    - [139, 0.083]
  - - [1024, 1024, 1, 77]
    - [57, 5.65]
  - - [1024, 4096, 1, 512]
    - [91, 43.99]
  - - [1024, 30522, 1, 77]
    - [140, 19.001]
  - - [4096, 1024, 1, 512]
    - [91, 44.475]
  - - [64, 128, 160, 128]
    - [113, 11.456]
  - - [1024, 2, 1, 10]
    - [45, 0.002]
  - - [1024, 2, 1, 1280]
    - [10, 0.128]
  - - [1024, 1024, 1, 10]
    - [57, 0.856]
  - - [1024, 1024, 1, 1280]
    - [249, 27.79]
  - - [1024, 4096, 1, 1280]
    - [257, 58.619]
  - - [1024, 30522, 1, 200]
    - [140, 41.089]
  - - [4096, 1024, 1, 1280]
    - [86, 58.442]
  - - [64, 128, 624, 128]
    - [141, 18.113]
  - - [1024, 2, 1, 39]
    - [54, 0.008]
  - - [1024, 2, 1, 4992]
    - [142, 0.295]
  - - [1024, 1024, 1, 39]
    - [57, 3.2]
  - - [1024, 1024, 1, 780]
    - [21, 26.479]
  - - [1024, 1024, 1, 4992]
    - [59, 53.274]
  - - [1024, 4096, 1, 4992]
    - [60, 77.675]
  - - [1024, 30522, 1, 780]
    - [41, 73.184]
  - - [4096, 1024, 1, 4992]
    - [63, 75.247]
  - - [1024, 1024, 1, 308]
    - [143, 16.029]
  - - [1024, 30522, 1, 308]
    - [29, 53.321]
  - - [64, 128, 640, 128]
    - [144, 18.263]
  - - [1024, 2, 1, 40]
    - [45, 0.008]
  - - [1024, 2, 1, 5120]
    - [142, 0.296]
  - - [1024, 1024, 1, 40]
    - [57, 3.259]
  - - [1024, 1024, 1, 800]
    - [23, 28.382]
  - - [1024, 1024, 1, 5120]
    - [59, 53.152]
  - - [1024, 4096, 1, 5120]
    - [60, 77.972]
  - - [1024, 30522, 1, 800]
    - [41, 75.524]
  - - [4096, 1024, 1, 5120]
    - [63, 75.49]
  - - [64, 128, 656, 128]
    - [118, 18.365]
  - - [1024, 2, 1, 41]
    - [45, 0.009]
  - - [1024, 2, 1, 5248]
    - [142, 0.302]
  - - [1024, 1024, 1, 41]
    - [57, 3.364]
  - - [1024, 1024, 1, 820]
    - [21, 26.541]
  - - [1024, 1024, 1, 5248]
    - [59, 53.081]
  - - [1024, 4096, 1, 5248]
    - [60, 78.356]
  - - [1024, 30522, 1, 820]
    - [29, 74.592]
  - - [4096, 1024, 1, 5248]
    - [63, 75.562]
  - - [64, 512, 80, 512]
    - [255, 28.861]
  - - [1024, 2, 1, 5]
    - [45, 0.001]
  - - [1024, 2, 1, 2560]
    - [145, 0.176]
  - - [1024, 1024, 1, 5]
    - [146, 0.434]
  - - [1024, 1024, 1, 385]
    - [147, 19.191]
  - - [1024, 1024, 1, 2560]
    - [58, 43.704]
  - - [1024, 4096, 1, 2560]
    - [60, 68.54]
  - - [1024, 30522, 1, 385]
    - [148, 59.591]
  - - [4096, 1024, 1, 2560]
    - [62, 66.106]
  - - [64, 512, 96, 512]
    - [51, 34.896]
  - - [1024, 2, 1, 6]
    - [48, 0.001]
  - - [1024, 2, 1, 3072]
    - [145, 0.201]
  - - [1024, 1024, 1, 6]
    - [85, 0.506]
  - - [1024, 1024, 1, 462]
    - [23, 20.442]
  - - [1024, 1024, 1, 3072]
    - [115, 46.468]
  - - [1024, 4096, 1, 3072]
    - [60, 71.056]
  - - [1024, 30522, 1, 462]
    - [148, 63.08]
  - - [4096, 1024, 1, 3072]
    - [63, 68.476]
  - - [64, 128, 128, 128]
    - [96, 9.819]
  - - [1024, 2, 1, 8]
    - [45, 0.002]
  - - [1024, 2, 1, 1024]
    - [10, 0.114]
  - - [1024, 1024, 1, 8]
    - [57, 0.695]
  - - [1024, 1024, 1, 160]
    - [113, 10.619]
  - - [1024, 4096, 1, 1024]
    - [27, 55.684]
  - - [1024, 30522, 1, 160]
    - [32, 38.017]
  - - [4096, 1024, 1, 1024]
    - [27, 55.748]
  - - [64, 128, 144, 128]
    - [96, 10.699]
  - - [1024, 2, 1, 9]
    - [45, 0.002]
  - - [1024, 2, 1, 1152]
    - [258, 0.075]
  - - [1024, 1024, 1, 9]
    - [57, 0.782]
  - - [1024, 1024, 1, 180]
    - [96, 11.018]
  - - [1024, 1024, 1, 1152]
    - [249, 27.169]
  - - [1024, 4096, 1, 1152]
    - [27, 57.243]
  - - [1024, 30522, 1, 180]
    - [148, 38.275]
  - - [4096, 1024, 1, 1152]
    - [27, 57.545]
  - - [479, 1024, 1, 32768]
    - [149, 36.91]
  - - [4, 64, 32768, 4]
    - [43, 0.199]
  - - [4, 64, 38400, 4]
    - [43, 0.2]
  - - [64, 4, 32768, 4]
    - [45, 0.207]
  - - [64, 4, 38400, 4]
    - [45, 0.209]
  - - [1024, 1024, 1, 8192]
    - [97, 57.538]
  - - [1024, 1024, 1, 9600]
    - [97, 60.616]
  - - [1024, 4096, 1, 8192]
    - [79, 83.358]
  - - [1024, 4096, 1, 9600]
    - [79, 84.243]
  - - [1024, 33712, 1, 8192]
    - [28, 93.449]
  - - [1024, 33712, 1, 9600]
    - [28, 93.917]
  - - [4096, 1024, 1, 8192]
    - [63, 79.604]
  - - [4096, 1024, 1, 9600]
    - [63, 79.421]
  - - [64, 128, 1, 128]
    - [48, 0.104]
  - - [128, 64, 1, 128]
    - [49, 0.103]
  - - [5, 64, 1, 5]
    - [55, 0.0]
  - - [2048, 512, 1, 1]
    - [57, 0.084]
  - - [33, 32, 1, 33]
    - [10, 0.003]
  - - [1024, 1600, 1, 1]
    - [57, 0.112]
  - - [64, 1024, 32, 1024]
    - [36, 41.572]
  - - [2560, 1920, 1, 2048]
    - [27, 75.058]
  - - [1024, 3072, 1, 4096]
    - [62, 76.808]
  - - [2560, 2560, 1, 2048]
    - [27, 76.877]
  - - [2048, 2, 1, 2]
    - [45, 0.001]
  - - [1024, 64, 128, 1024]
    - [150, 51.314]
  - - [2048, 2048, 1, 2]
    - [139, 0.369]
  - - [1024, 64, 32, 1024]
    - [151, 40.459]
  - - [1024, 96, 64, 1024]
    - [115, 59.495]
  - - [1024, 30592, 1, 2048]
    - [30, 86.658]
  - - [1024, 3072, 1, 16384]
    - [152, 76.941]
  - - [6144, 1536, 1, 4096]
    - [115, 83.414]
  - - [1024, 1024, 1, 16]
    - [57, 1.477]
  - - [1536, 4608, 1, 8192]
    - [259, 85.19]
  - - [640, 2560, 1, 2048]
    - [27, 59.254]
  - - [1024, 4096, 1, 16384]
    - [79, 86.924]
  - - [64, 512, 40, 512]
    - [36, 26.436]
  - - [1024, 1024, 1, 16384]
    - [251, 74.905]
  - - [1536, 6144, 1, 4096]
    - [242, 83.438]
  - - [1024, 30592, 1, 4096]
    - [154, 91.705]
  - - [2560, 2560, 1, 4]
    - [146, 0.849]
  - - [1536, 1536, 1, 4096]
    - [155, 71.771]
  - - [2560, 7680, 1, 2048]
    - [27, 87.073]
  - - [64, 1024, 256, 1024]
    - [120, 56.006]
  - - [96, 1024, 64, 1024]
    - [131, 54.086]
  - - [1536, 50304, 1, 4096]
    - [27, 93.774]
  - - [2048, 8192, 1, 1024]
    - [41, 75.139]
  - - [1024, 30592, 1, 8192]
    - [154, 94.034]
  - - [512, 64, 256, 512]
    - [150, 39.599]
  - - [1024, 96, 128, 1024]
    - [156, 63.254]
  - - [64, 512, 128, 512]
    - [157, 36.493]
  - - [4096, 1024, 1, 16384]
    - [63, 83.529]
  - - [8192, 2048, 1, 1024]
    - [61, 74.589]
  - - [64, 1024, 64, 1024]
    - [99, 48.389]
  - - [1024, 50304, 1, 4096]
    - [86, 92.715]
  - - [1536, 4608, 1, 4096]
    - [260, 78.875]
  - - [512, 64, 128, 512]
    - [31, 36.438]
  - - [6144, 1536, 1, 8192]
    - [261, 87.167]
  - - [1024, 3072, 1, 8192]
    - [62, 80.739]
  - - [1536, 1536, 1, 8192]
    - [75, 78.526]
  - - [1536, 50304, 1, 8192]
    - [27, 95.815]
  - - [2560, 2, 1, 4]
    - [54, 0.002]
  - - [2048, 6144, 1, 1024]
    - [27, 77.34]
  - - [64, 1024, 128, 1024]
    - [158, 53.088]
  - - [1024, 64, 64, 1024]
    - [151, 49.126]
  - - [1024, 2, 1, 16]
    - [45, 0.004]
  - - [96, 1024, 128, 1024]
    - [159, 57.629]
  - - [2048, 30592, 1, 1024]
    - [41, 83.447]
  - - [64, 512, 256, 512]
    - [99, 40.904]
  - - [1536, 6144, 1, 8192]
    - [261, 87.294]
  - - [1024, 50304, 1, 2048]
    - [41, 88.871]
  - - [1024, 50304, 1, 8192]
    - [27, 94.691]
  - - [1024, 3072, 1, 2048]
    - [27, 69.927]
  - - [1024, 64, 256, 1024]
    - [150, 54.006]
  - - [1024, 50304, 1, 16384]
    - [242, 95.616]
  - - [512, 64, 40, 512]
    - [160, 25.982]
  - - [1024, 2, 1, 64]
    - [45, 0.014]
  - - [1024, 30528, 1, 8192]
    - [30, 93.709]
  - - [1024, 1024, 1, 64]
    - [234, 2.723]
  - - [64, 128, 1024, 128]
    - [51, 20.196]
  - - [128, 64, 1024, 128]
    - [150, 19.202]
  - - [1024, 1024, 1, 3456]
    - [115, 48.147]
  - - [1024, 1024, 1, 6912]
    - [59, 55.776]
  - - [1024, 1024, 1, 864]
    - [20, 29.845]
  - - [1024, 512, 1, 3456]
    - [262, 33.377]
  - - [1024, 512, 1, 4096]
    - [88, 33.604]
  - - [1024, 512, 1, 6912]
    - [88, 43.854]
  - - [1024, 512, 1, 864]
    - [21, 18.972]
  - - [256, 128, 1, 3456]
    - [211, 2.979]
  - - [256, 128, 1, 4096]
    - [67, 3.838]
  - - [256, 128, 1, 55296]
    - [162, 20.517]
  - - [256, 128, 1, 6912]
    - [263, 6.061]
  - - [256, 128, 1, 864]
    - [24, 1.706]
  - - [256, 3456, 1, 1]
    - [264, 0.037]
  - - [256, 4096, 1, 1]
    - [265, 0.042]
  - - [256, 6912, 1, 1]
    - [57, 0.122]
  - - [256, 864, 1, 1]
    - [50, 0.022]
  - - [480, 1024, 1, 3456]
    - [262, 30.784]
  - - [480, 1024, 1, 4096]
    - [88, 30.987]
  - - [480, 1024, 1, 6912]
    - [88, 40.633]
  - - [480, 1024, 1, 864]
    - [21, 17.787]
  - - [512, 256, 1, 3456]
    - [164, 10.744]
  - - [512, 256, 1, 4096]
    - [165, 12.319]
  - - [512, 256, 1, 55296]
    - [166, 40.89]
  - - [512, 256, 1, 6912]
    - [164, 17.448]
  - - [512, 256, 1, 864]
    - [10, 5.962]
  - - [30528, 1024, 1, 640]
    - [135, 70.242]
  - - [30528, 1024, 1, 1280]
    - [135, 81.714]
  - - [4096, 1024, 1, 10240]
    - [63, 82.03]
  - - [1024, 4096, 1, 10240]
    - [79, 84.983]
  - - [30528, 1024, 1, 1600]
    - [167, 83.645]
  - - [1024, 2, 1, 80]
    - [266, 0.008]
  - - [1024, 1024, 1, 10240]
    - [97, 61.911]
  - - [1024, 1024, 1, 80]
    - [267, 3.228]
  - - [64, 128, 1280, 128]
    - [118, 21.664]
  - - [128, 64, 1280, 128]
    - [53, 19.767]
  - - [1024, 4096, 1, 10496]
    - [79, 85.236]
  - - [30528, 1024, 1, 1640]
    - [135, 83.253]
  - - [4096, 1024, 1, 10496]
    - [63, 80.257]
  - - [1024, 1024, 1, 10496]
    - [97, 62.092]
  - - [1024, 1024, 1, 82]
    - [268, 3.287]
  - - [1024, 2, 1, 82]
    - [218, 0.007]
  - - [128, 64, 1312, 128]
    - [150, 20.0]
  - - [64, 128, 1312, 128]
    - [118, 21.831]
  - - [30528, 1024, 1, 160]
    - [140, 35.11]
  - - [1024, 4096, 1, 6144]
    - [60, 79.828]
  - - [30528, 1024, 1, 240]
    - [140, 46.367]
  - - [4096, 1024, 1, 6144]
    - [63, 76.808]
  - - [1024, 1024, 1, 12]
    - [57, 1.02]
  - - [1024, 2, 1, 12]
    - [266, 0.001]
  - - [1024, 1024, 1, 6144]
    - [59, 55.535]
  - - [64, 512, 192, 512]
    - [168, 40.823]
  - - [512, 64, 192, 512]
    - [169, 38.857]
  - - [13, 512, 1, 3456]
    - [170, 0.73]
  - - [13, 512, 1, 4096]
    - [170, 0.873]
  - - [13, 512, 1, 55296]
    - [64, 4.397]
  - - [13, 512, 1, 6912]
    - [269, 1.395]
  - - [13, 512, 1, 864]
    - [270, 0.212]
  - - [1024, 1024, 1, 10224]
    - [72, 61.437]
  - - [1024, 1024, 1, 10192]
    - [72, 61.874]
  - - [1024, 1024, 1, 10208]
    - [97, 61.56]
  - - [1024, 4096, 1, 10224]
    - [79, 83.17]
  - - [4096, 1024, 1, 10224]
    - [63, 81.063]
  - - [1024, 3072, 1, 10224]
    - [76, 81.538]
  - - [1024, 3072, 1, 10240]
    - [62, 81.555]
  - - [4096, 1024, 1, 10192]
    - [63, 80.512]
  - - [1024, 3072, 1, 10192]
    - [76, 81.558]
  - - [1024, 4096, 1, 10192]
    - [79, 83.558]
  - - [1024, 3072, 1, 10200]
    - [76, 80.873]
  - - [1024, 1024, 1, 10184]
    - [72, 61.352]
  - - [4096, 1024, 1, 10208]
    - [63, 80.585]
  - - [1024, 3072, 1, 10208]
    - [152, 81.667]
  - - [1024, 4096, 1, 10208]
    - [79, 84.185]
  - - [1024, 2048, 1, 10224]
    - [74, 74.766]
  - - [1024, 2048, 1, 10240]
    - [74, 76.59]
  - - [1024, 1024, 1, 10120]
    - [72, 61.342]
  - - [1024, 2048, 1, 10192]
    - [73, 75.23]
  - - [64, 24, 6816, 24]
    - [146, 4.515]
  - - [1024, 1024, 1, 10152]
    - [72, 61.504]
  - - [1024, 3072, 1, 10080]
    - [171, 81.508]
  - - [64, 26, 6272, 26]
    - [172, 5.07]
  - - [100352, 256, 1, 512]
    - [32, 61.695]
  - - [12544, 1024, 1, 2048]
    - [173, 78.099]
  - - [12544, 147, 1, 64]
    - [38, 7.306]
  - - [200704, 256, 1, 512]
    - [174, 60.822]
  - - [25088, 512, 1, 1024]
    - [34, 69.672]
  - - [3136, 576, 1, 64]
    - [175, 8.09]
  - - [50176, 512, 1, 1024]
    - [176, 76.447]
  - - [6272, 1024, 1, 2048]
    - [138, 75.531]
  - - [784, 1152, 1, 128]
    - [113, 8.403]
  - - [3136, 256, 128, 128]
    - [41, 34.225]
  - - [3136, 256, 256, 128]
    - [41, 34.75]
  - - [784, 512, 128, 256]
    - [29, 55.11]
  - - [784, 512, 256, 256]
    - [41, 57.584]
  - - [64, 128, 2048, 128]
    - [118, 22.912]
  - - [128, 64, 2048, 128]
    - [53, 20.626]
  - - [30528, 1024, 1, 2560]
    - [177, 87.571]
  - - [1024, 1024, 1, 128]
    - [271, 5.345]
  - - [1024, 2, 1, 128]
    - [218, 0.012]
  - - [128, 64, 1536, 128]
    - [178, 20.229]
  - - [64, 128, 1536, 128]
    - [118, 21.995]
  - - [1024, 4096, 1, 12288]
    - [79, 85.217]
  - - [30528, 1024, 1, 1920]
    - [167, 85.522]
  - - [1024, 1024, 1, 96]
    - [272, 4.114]
  - - [1024, 1024, 1, 12288]
    - [273, 68.473]
  - - [4096, 1024, 1, 12288]
    - [63, 82.074]
  - - [1024, 2, 1, 96]
    - [266, 0.009]
  - - [25600, 128, 25, 128]
    - [179, 29.005]
  - - [12544, 128, 36, 128]
    - [180, 30.072]
  - - [9216, 128, 49, 128]
    - [180, 30.851]
  - - [6400, 128, 64, 128]
    - [40, 30.748]
  - - [6400, 256, 25, 256]
    - [181, 51.009]
  - - [4096, 256, 36, 256]
    - [29, 52.269]
  - - [2304, 256, 49, 256]
    - [181, 50.216]
  - - [2304, 256, 64, 256]
    - [181, 51.502]
  - - [2304, 512, 25, 512]
    - [41, 68.735]
  - - [1024, 512, 36, 512]
    - [41, 65.273]
  - - [1024, 512, 49, 512]
    - [41, 67.637]
  - - [1024, 512, 64, 512]
    - [41, 69.801]
  - - [92416, 64, 25, 64]
    - [140, 15.488]
  - - [50176, 64, 36, 64]
    - [140, 15.814]
  - - [36864, 64, 49, 64]
    - [140, 16.152]
  - - [25600, 64, 64, 64]
    - [140, 16.253]
  - - [64, 128, 192, 128]
    - [21, 12.395]
  - - [128, 64, 192, 128]
    - [182, 11.938]
  - - [768, 2, 1, 2048]
    - [274, 0.112]
  - - [3072, 768, 1, 2048]
    - [75, 62.215]
  - - [768, 3072, 1, 2048]
    - [275, 58.838]
  - - [768, 768, 1, 2048]
    - [161, 29.977]
  - - [64, 384, 144, 384]
    - [232, 28.067]
  - - [384, 64, 144, 384]
    - [182, 32.855]
  - - [768, 2, 1, 4608]
    - [18, 0.232]
  - - [3072, 768, 1, 4608]
    - [75, 73.609]
  - - [768, 3072, 1, 4608]
    - [155, 73.433]
  - - [768, 768, 1, 4608]
    - [236, 36.417]
  - - [64, 512, 48, 512]
    - [168, 29.845]
  - - [512, 64, 48, 512]
    - [150, 29.845]
  - - [64, 128, 256, 128]
    - [113, 13.747]
  - - [128, 64, 256, 128]
    - [184, 13.623]
  - - [64, 384, 192, 384]
    - [120, 35.503]
  - - [384, 64, 192, 384]
    - [38, 34.367]
  - - [1024, 2, 1, 4608]
    - [142, 0.269]
  - - [4096, 1024, 1, 4608]
    - [63, 73.515]
  - - [1024, 4096, 1, 4608]
    - [60, 76.646]
  - - [1024, 1024, 1, 4608]
    - [251, 51.681]
  - - [196, 2304, 1, 256]
    - [276, 4.056]
  - - [49, 4608, 1, 512]
    - [22, 6.512]
  - - [196, 1024, 128, 512]
    - [36, 47.045]
  - - [196, 1024, 256, 512]
    - [36, 48.828]
  - - [49, 2048, 128, 512]
    - [36, 31.146]
  - - [49, 2048, 256, 512]
    - [36, 32.606]
  - - [49, 512, 128, 2048]
    - [99, 37.593]
  - - [49, 512, 256, 2048]
    - [36, 41.302]
  - - [4880, 256, 49, 256]
    - [41, 53.308]
  - - [3128, 256, 64, 256]
    - [41, 52.64]
  - - [4680, 256, 49, 256]
    - [29, 53.145]
  - - [5280, 256, 36, 256]
    - [41, 51.166]
  - - [2640, 256, 64, 256]
    - [41, 52.286]
  - - [5304, 256, 49, 256]
    - [27, 52.26]
  - - [2760, 256, 64, 256]
    - [41, 52.464]
  - - [6440, 256, 36, 256]
    - [29, 51.826]
  - - [5704, 256, 36, 256]
    - [135, 51.853]
  - - [2128, 256, 64, 256]
    - [41, 51.915]
  - - [1160, 256, 49, 256]
    - [135, 44.505]
  - - [4056, 256, 49, 256]
    - [41, 51.817]
  - - [6144, 256, 36, 256]
    - [135, 52.58]
  - - [6336, 256, 36, 256]
    - [135, 50.229]
  - - [13600, 512, 2, 128]
    - [41, 29.149]
  - - [15200, 512, 2, 128]
    - [41, 29.38]
  - - [15200, 128, 2, 512]
    - [29, 41.035]
  - - [13600, 128, 2, 512]
    - [27, 46.924]
  - - [5632, 256, 36, 256]
    - [181, 52.271]
  - - [12288, 128, 2, 512]
    - [27, 45.365]
  - - [12880, 128, 2, 512]
    - [27, 45.071]
  - - [768, 512, 2, 2048]
    - [185, 39.363]
  - - [11408, 128, 2, 512]
    - [238, 33.703]
  - - [13824, 512, 2, 128]
    - [41, 29.039]
  - - [13824, 128, 2, 512]
    - [27, 48.956]
  - - [10560, 128, 2, 512]
    - [36, 39.579]
  - - [10752, 128, 2, 512]
    - [27, 39.497]
  - - [13600, 512, 2, 256]
    - [29, 44.58]
  - - [15200, 512, 2, 256]
    - [29, 44.448]
  - - [768, 2048, 2, 512]
    - [27, 44.694]
  - - [12880, 512, 2, 128]
    - [40, 29.307]
  - - [11616, 128, 2, 512]
    - [187, 41.037]
  - - [14208, 512, 2, 128]
    - [40, 28.781]
  - - [11408, 512, 2, 128]
    - [41, 29.298]
  - - [6912, 256, 36, 256]
    - [181, 52.449]
  - - [672, 512, 2, 2048]
    - [277, 30.253]
  - - [13824, 512, 2, 256]
    - [278, 41.944]
  - - [11616, 512, 2, 128]
    - [41, 28.447]
  - - [12288, 512, 2, 128]
    - [40, 28.758]
  - - [14208, 128, 2, 512]
    - [188, 38.783]
  - - [11968, 128, 2, 512]
    - [27, 43.424]
  - - [864, 2048, 2, 512]
    - [189, 41.832]
  - - [1008, 512, 2, 2048]
    - [159, 42.153]
  - - [10560, 512, 2, 128]
    - [130, 27.552]
  - - [672, 2048, 2, 512]
    - [27, 39.994]
  - - [9408, 128, 2, 512]
    - [38, 37.147]
  - - [10752, 512, 2, 128]
    - [41, 26.288]
  - - [11968, 512, 2, 128]
    - [41, 28.878]
  - - [1240, 256, 49, 256]
    - [135, 46.684]
  - - [4032, 256, 2, 1024]
    - [58, 45.713]
  - - [888, 2048, 2, 512]
    - [140, 44.358]
  - - [12880, 512, 2, 256]
    - [29, 43.376]
  - - [12288, 512, 2, 256]
    - [40, 44.972]
  - - [13440, 128, 2, 512]
    - [27, 47.143]
  - - [864, 2048, 2, 256]
    - [140, 29.933]
  - - [12672, 128, 2, 512]
    - [27, 45.866]
  - - [11264, 128, 2, 512]
    - [27, 41.689]
  - - [11776, 128, 2, 512]
    - [27, 43.151]
  - - [16128, 128, 2, 512]
    - [29, 43.382]
  - - [4032, 1024, 2, 256]
    - [41, 41.348]
  - - [14000, 128, 2, 512]
    - [190, 50.548]
  - - [13440, 512, 2, 128]
    - [279, 25.236]
  - - [864, 512, 2, 2048]
    - [159, 36.26]
  - - [768, 2048, 2, 256]
    - [190, 30.446]
  - - [3264, 1024, 2, 256]
    - [41, 40.0]
  - - [888, 512, 2, 2048]
    - [159, 37.135]
  - - [4200, 256, 2, 1024]
    - [115, 47.71]
  - - [2352, 1024, 2, 256]
    - [29, 37.347]
  - - [56, 512, 64, 512]
    - [119, 28.003]
  - - [2400, 1024, 2, 256]
    - [280, 28.923]
  - - [15200, 256, 2, 12]
    - [130, 2.956]
  - - [840, 512, 2, 2048]
    - [159, 34.517]
  - - [12880, 256, 2, 12]
    - [96, 2.914]
  - - [2520, 1024, 2, 256]
    - [29, 38.865]
  - - [13600, 256, 2, 12]
    - [130, 2.81]
  - - [15200, 256, 2, 3]
    - [113, 0.756]
  - - [12880, 256, 2, 3]
    - [130, 0.75]
  - - [4200, 1024, 2, 256]
    - [148, 43.601]
  - - [12288, 256, 2, 12]
    - [139, 2.532]
  - - [768, 256, 2, 12]
    - [50, 0.462]
  - - [13824, 256, 2, 12]
    - [281, 1.979]
  - - [864, 256, 2, 3]
    - [282, 0.057]
  - - [176, 256, 2, 3]
    - [45, 0.029]
  - - [864, 256, 2, 12]
    - [191, 0.507]
  - - [13600, 256, 2, 3]
    - [96, 0.731]
  - - [768, 256, 2, 3]
    - [50, 0.117]
  - - [7600, 512, 1, 256]
    - [119, 31.437]
  - - [6144, 512, 1, 256]
    - [86, 30.861]
  - - [12544, 1024, 1, 1024]
    - [283, 70.245]
  - - [1024, 81, 1, 1024]
    - [19, 4.882]
  - - [176, 256, 2, 12]
    - [48, 0.109]
  - - [216, 256, 2, 3]
    - [45, 0.034]
  - - [192, 256, 2, 12]
    - [284, 0.056]
  - - [3800, 256, 2, 3]
    - [114, 0.414]
  - - [13824, 256, 2, 3]
    - [285, 0.514]
  - - [12288, 256, 2, 3]
    - [193, 0.641]
  - - [192, 256, 2, 3]
    - [45, 0.031]
  - - [216, 256, 2, 12]
    - [286, 0.056]
  - - [2688, 256, 2, 1024]
    - [27, 38.168]
  - - [3072, 256, 2, 12]
    - [57, 1.337]
  - - [3800, 256, 2, 12]
    - [96, 1.575]
  - - [3072, 256, 2, 3]
    - [57, 0.332]
  - - [2520, 256, 2, 1024]
    - [194, 39.07]
  - - [16128, 512, 2, 128]
    - [40, 28.152]
  - - [2400, 256, 2, 1024]
    - [287, 29.846]
  - - [2352, 256, 2, 1024]
    - [288, 30.687]
  - - [2944, 256, 2, 1024]
    - [27, 41.802]
  - - [2992, 1024, 2, 256]
    - [281, 33.28]
  - - [2816, 256, 2, 1024]
    - [27, 39.89]
  - - [2904, 1024, 2, 256]
    - [280, 33.566]
  - - [3456, 256, 2, 3]
    - [286, 0.2]
  - - [3400, 256, 2, 3]
    - [114, 0.387]
  - - [2816, 1024, 2, 256]
    - [40, 33.604]
  - - [3456, 256, 2, 12]
    - [139, 1.433]
  - - [2944, 1024, 2, 256]
    - [196, 34.99]
  - - [3168, 256, 2, 1024]
    - [238, 37.291]
  - - [2992, 256, 2, 1024]
    - [223, 35.56]
  - - [51520, 256, 2, 12]
    - [109, 3.29]
  - - [3072, 256, 2, 1024]
    - [27, 43.411]
  - - [2640, 1024, 2, 256]
    - [289, 30.992]
  - - [2688, 1024, 2, 256]
    - [225, 29.919]
  - - [2904, 256, 2, 1024]
    - [238, 33.477]
  - - [3264, 256, 2, 1024]
    - [290, 40.455]
  - - [54400, 256, 2, 12]
    - [197, 2.917]
  - - [55296, 256, 2, 3]
    - [140, 0.761]
  - - [60800, 256, 2, 12]
    - [140, 2.989]
  - - [51520, 256, 2, 3]
    - [112, 0.862]
  - - [55296, 256, 2, 12]
    - [109, 2.931]
  - - [3600, 1024, 2, 256]
    - [225, 35.872]
  - - [60800, 256, 2, 3]
    - [57, 0.764]
  - - [952, 256, 64, 256]
    - [29, 44.586]
  - - [49152, 256, 2, 12]
    - [111, 2.992]
  - - [3360, 256, 2, 1024]
    - [288, 32.639]
  - - [736, 256, 64, 256]
    - [40, 43.584]
  - - [600, 256, 64, 256]
    - [135, 42.005]
  - - [1440, 256, 49, 256]
    - [135, 45.862]
  - - [3168, 1024, 2, 256]
    - [40, 38.583]
  - - [1368, 256, 49, 256]
    - [29, 47.408]
  - - [49152, 256, 2, 3]
    - [109, 0.757]
  - - [3600, 256, 2, 1024]
    - [58, 41.291]
  - - [3360, 1024, 2, 256]
    - [148, 41.262]
  - - [54400, 256, 2, 3]
    - [197, 0.75]
  - - [3072, 1024, 2, 256]
    - [29, 36.659]
  - - [2640, 256, 2, 1024]
    - [98, 38.599]
  - - [616, 256, 64, 256]
    - [29, 42.372]
  - - [3008, 256, 64, 256]
    - [135, 49.91]
  - - [896, 256, 64, 256]
    - [135, 44.336]
  - - [768, 256, 64, 256]
    - [29, 45.252]
  - - [3552, 256, 2, 1024]
    - [291, 35.468]
  - - [3552, 1024, 2, 256]
    - [52, 38.854]
  - - [800, 256, 64, 256]
    - [52, 41.181]
  - - [1120, 256, 49, 256]
    - [40, 43.618]
  - - [2408, 256, 64, 256]
    - [41, 51.489]
  - - [3456, 256, 2, 1024]
    - [291, 33.175]
  - - [672, 256, 64, 256]
    - [41, 41.295]
  - - [3456, 1024, 2, 256]
    - [41, 41.075]
  - - [1064, 256, 49, 256]
    - [135, 43.596]
  - - [3400, 256, 2, 1024]
    - [288, 33.637]
  - - [704, 256, 64, 256]
    - [40, 40.719]
  - - [3400, 1024, 2, 256]
    - [41, 40.987]
  - - [3264, 256, 64, 256]
    - [41, 50.013]
  - - [3800, 1024, 2, 256]
    - [280, 36.86]
  - - [3800, 256, 2, 1024]
    - [58, 43.84]
  - - [6440, 512, 1, 256]
    - [148, 31.49]
  - - [6912, 512, 1, 256]
    - [190, 33.911]
  - - [6800, 512, 1, 256]
    - [148, 32.924]
  - - [6800, 512, 1, 1024]
    - [27, 63.255]
  - - [6440, 512, 1, 1024]
    - [198, 61.455]
  - - [6912, 512, 1, 1024]
    - [27, 66.173]
  - - [1728, 1024, 1, 512]
    - [271, 24.144]
  - - [1536, 1024, 1, 512]
    - [292, 21.673]
  - - [7600, 512, 1, 1024]
    - [224, 49.383]
  - - [6144, 512, 1, 1024]
    - [190, 58.915]
  - - [1728, 1024, 1, 2048]
    - [293, 47.154]
  - - [1536, 1024, 1, 2048]
    - [27, 57.333]
  - - [1024, 320, 1, 1024]
    - [20, 15.686]
  - - [173280, 64, 1, 128]
    - [150, 19.315]
  - - [25992, 64, 1, 128]
    - [113, 13.254]
  - - [4524, 256, 49, 256]
    - [176, 49.049]
  - - [2666, 256, 64, 256]
    - [199, 46.539]
  - - [950, 2048, 2, 512]
    - [292, 33.864]
  - - [3220, 1024, 2, 256]
    - [137, 36.092]
  - - [782, 128, 64, 128]
    - [36, 19.953]
  - - [850, 2048, 2, 512]
    - [294, 33.228]
  - - [713, 512, 2, 2048]
    - [87, 34.311]
  - - [805, 2048, 2, 512]
    - [127, 39.543]
  - - [713, 2048, 2, 512]
    - [36, 37.107]
  - - [660, 512, 2, 2048]
    - [87, 32.42]
  - - [726, 512, 2, 2048]
    - [87, 34.654]
  - - [660, 2048, 2, 512]
    - [35, 34.123]
  - - [726, 2048, 2, 512]
    - [36, 36.889]
  - - [748, 512, 2, 2048]
    - [87, 35.995]
  - - [805, 2048, 2, 256]
    - [36, 28.22]
  - - [1251, 256, 49, 256]
    - [36, 38.163]
  - - [805, 512, 2, 2048]
    - [295, 31.167]
  - - [850, 512, 2, 2048]
    - [87, 31.185]
  - - [850, 256, 2, 3]
    - [66, 0.117]
  - - [805, 256, 2, 12]
    - [66, 0.442]
  - - [228, 256, 2, 12]
    - [10, 0.129]
  - - [228, 256, 2, 3]
    - [10, 0.033]
  - - [805, 256, 2, 3]
    - [66, 0.114]
  - - [850, 256, 2, 12]
    - [66, 0.471]
  - - [187, 256, 2, 12]
    - [296, 0.048]
  - - [247, 256, 2, 12]
    - [43, 0.144]
  - - [950, 256, 2, 12]
    - [66, 0.491]
  - - [950, 256, 2, 3]
    - [201, 0.129]
  - - [1900, 1024, 1, 2048]
    - [202, 46.763]
  - - [1610, 1024, 1, 2048]
    - [243, 49.825]
  - - [1900, 1024, 1, 512]
    - [36, 29.534]
  - - [3220, 256, 2, 12]
    - [56, 1.351]
  - - [187, 256, 2, 3]
    - [46, 0.027]
  - - [221, 256, 2, 3]
    - [10, 0.032]
  - - [221, 256, 2, 12]
    - [43, 0.13]
  - - [247, 256, 2, 3]
    - [43, 0.037]
  - - [3220, 256, 2, 3]
    - [264, 0.175]
  - - [3036, 1024, 2, 256]
    - [137, 36.824]
  - - [3036, 256, 2, 1024]
    - [203, 39.852]
  - - [850, 2048, 2, 256]
    - [137, 27.971]
  - - [2852, 1024, 2, 256]
    - [137, 33.693]
  - - [950, 2048, 2, 256]
    - [151, 27.109]
  - - [3700, 1024, 2, 256]
    - [137, 36.548]
  - - [2852, 256, 2, 1024]
    - [204, 37.604]
  - - [3700, 256, 2, 1024]
    - [36, 37.233]
  - - [1269, 256, 49, 256]
    - [36, 35.426]
  - - [1467, 256, 49, 256]
    - [176, 39.199]
  - - [3500, 256, 2, 1024]
    - [99, 43.071]
  - - [1449, 256, 49, 256]
    - [136, 39.211]
  - - [1278, 256, 49, 256]
    - [86, 36.931]
  - - [1413, 256, 49, 256]
    - [176, 37.37]
  - - [1341, 256, 49, 256]
    - [176, 37.465]
  - - [1287, 256, 49, 256]
    - [176, 38.011]
  - - [1332, 256, 49, 256]
    - [181, 40.193]
  - - [1359, 256, 49, 256]
    - [36, 38.056]
  - - [1395, 256, 49, 256]
    - [176, 37.248]
  - - [1323, 256, 49, 256]
    - [205, 37.719]
  - - [1404, 256, 49, 256]
    - [206, 38.164]
  - - [1386, 256, 49, 256]
    - [36, 39.547]
  - - [1350, 256, 49, 256]
    - [36, 40.635]
  - - [3500, 1024, 2, 256]
    - [137, 35.16]
  - - [3220, 256, 2, 1024]
    - [292, 37.488]
  - - [690, 256, 64, 256]
    - [86, 35.136]
  - - [660, 256, 64, 256]
    - [36, 37.804]
  - - [782, 256, 64, 256]
    - [36, 38.981]
  - - [884, 256, 64, 256]
    - [35, 37.365]
  - - [1610, 1024, 1, 512]
    - [87, 29.172]
  - - [1700, 1024, 1, 512]
    - [297, 21.602]
  - - [1700, 1024, 1, 2048]
    - [287, 40.517]
  - - [100, 512, 120, 128]
    - [122, 14.694]
  - - [100, 512, 18, 128]
    - [116, 6.712]
  - - [100, 512, 19, 128]
    - [116, 7.158]
  - - [1444, 128, 120, 256]
    - [36, 36.43]
  - - [1444, 128, 18, 256]
    - [36, 28.14]
  - - [1444, 128, 19, 256]
    - [36, 29.19]
  - - [1444, 256, 120, 256]
    - [176, 47.264]
  - - [1444, 256, 18, 256]
    - [36, 34.393]
  - - [1444, 256, 19, 256]
    - [36, 36.369]
  - - [25, 256, 120, 128]
    - [258, 3.39]
  - - [25, 256, 18, 128]
    - [298, 0.627]
  - - [25, 256, 19, 128]
    - [299, 0.638]
  - - [361, 512, 120, 256]
    - [35, 36.871]
  - - [361, 512, 18, 256]
    - [35, 27.03]
  - - [361, 512, 19, 256]
    - [36, 24.525]
  - - [9, 256, 120, 128]
    - [207, 2.088]
  - - [9, 256, 18, 128]
    - [49, 0.475]
  - - [9, 256, 19, 128]
    - [49, 0.493]
  - - [100, 2304, 1, 512]
    - [22, 6.816]
  - - [1444, 576, 1, 128]
    - [300, 4.049]
  - - [25, 1152, 1, 256]
    - [10, 0.602]
  - - [27436, 64, 1, 128]
    - [300, 7.283]
  - - [361, 2304, 1, 512]
    - [147, 19.346]
  - - [9, 1152, 1, 256]
    - [10, 0.215]
  - - [3840, 4224, 1, 4096]
    - [208, 91.01]
  - - [3840, 4224, 1, 4224]
    - [208, 91.201]
  - - [3840, 4224, 1, 4320]
    - [208, 91.395]
  - - [7680, 8448, 1, 8192]
    - [209, 96.064]
  - - [7680, 8448, 1, 8448]
    - [209, 96.086]
  - - [7680, 8448, 1, 8640]
    - [209, 96.079]
  - - [64, 32, 16, 32]
    - [301, 0.048]
  - - [64, 48, 16, 48]
    - [302, 0.103]
  - - [64, 64, 16, 64]
    - [303, 0.202]
  - - [64, 80, 16, 80]
    - [48, 0.637]
  - - [64, 96, 16, 96]
    - [230, 0.39]
  - - [64, 112, 16, 112]
    - [48, 1.113]
  - - [64, 128, 16, 128]
    - [24, 1.36]
  - - [64, 144, 16, 144]
    - [304, 0.845]
  - - [64, 160, 16, 160]
    - [24, 2.272]
  - - [64, 176, 16, 176]
    - [24, 2.448]
  - - [64, 192, 16, 192]
    - [305, 1.607]
  - - [64, 208, 16, 208]
    - [191, 3.284]
  - - [64, 224, 16, 224]
    - [55, 4.077]
  - - [64, 240, 16, 240]
    - [57, 4.179]
  - - [64, 256, 16, 256]
    - [12, 4.974]
  - - [64, 272, 16, 272]
    - [57, 5.111]
  - - [64, 288, 16, 288]
    - [24, 5.765]
  - - [64, 304, 16, 304]
    - [57, 6.127]
  - - [64, 320, 16, 320]
    - [276, 4.128]
  - - [64, 336, 16, 336]
    - [143, 6.385]
  - - [64, 352, 16, 352]
    - [20, 8.168]
  - - [64, 368, 16, 368]
    - [143, 8.012]
  - - [64, 384, 16, 384]
    - [194, 8.86]
  - - [64, 400, 16, 400]
    - [305, 5.936]
  - - [64, 416, 16, 416]
    - [11, 10.676]
  - - [64, 448, 16, 448]
    - [20, 12.187]
  - - [64, 464, 16, 464]
    - [215, 7.398]
  - - [64, 480, 16, 480]
    - [42, 13.094]
  - - [64, 496, 16, 496]
    - [306, 8.387]
  - - [1024, 3072, 1, 4896]
    - [186, 78.73]
  - - [1024, 3072, 1, 5552]
    - [186, 78.238]
  - - [1024, 3072, 1, 5888]
    - [186, 80.076]
  - - [1024, 3072, 1, 6128]
    - [186, 78.861]
  - - [1024, 1024, 1, 6128]
    - [72, 52.346]
  - - [1024, 3072, 1, 6688]
    - [186, 80.377]
  - - [1024, 3072, 1, 5664]
    - [186, 79.595]
  - - [1024, 3072, 1, 6048]
    - [186, 80.041]
  - - [1024, 3072, 1, 5984]
    - [186, 80.0]
  - - [1024, 1024, 1, 7872]
    - [72, 57.477]
  - - [1024, 3072, 1, 5920]
    - [186, 79.959]
  - - [1024, 1024, 1, 7344]
    - [72, 55.759]
  - - [1024, 1024, 1, 7760]
    - [72, 57.476]
  - - [1024, 3072, 1, 5136]
    - [186, 77.59]
  - - [1024, 3072, 1, 6336]
    - [186, 80.084]
  - - [1024, 1024, 1, 7184]
    - [252, 59.928]
  - - [1024, 3072, 1, 5936]
    - [186, 78.705]
  - - [1024, 1024, 1, 5936]
    - [72, 51.945]
  - - [1024, 3072, 1, 6608]
    - [261, 80.467]
  - - [1024, 3072, 1, 5616]
    - [84, 78.361]
  - - [1024, 3072, 1, 5904]
    - [80, 78.575]
  - - [1024, 3072, 1, 6624]
    - [186, 80.288]
  - - [1024, 1024, 1, 6624]
    - [72, 53.931]
  - - [1024, 3072, 1, 6416]
    - [80, 79.12]
  - - [1024, 3072, 1, 5344]
    - [186, 79.048]
  - - [1024, 3072, 1, 7024]
    - [186, 79.814]
  - - [1024, 1024, 1, 7024]
    - [72, 54.342]
  - - [1024, 3072, 1, 5776]
    - [186, 78.432]
  - - [1024, 1024, 1, 7536]
    - [72, 56.598]
  - - [1024, 3072, 1, 7040]
    - [80, 80.694]
  - - [1024, 3072, 1, 6512]
    - [80, 79.179]
  - - [1024, 1024, 1, 6512]
    - [72, 53.573]
  - - [1024, 3072, 1, 6544]
    - [186, 79.183]
  - - [1024, 3072, 1, 5472]
    - [307, 79.505]
  - - [1024, 1024, 1, 7232]
    - [251, 61.167]
  - - [1024, 3072, 1, 6368]
    - [186, 80.003]
  - - [1024, 3072, 1, 6736]
    - [186, 79.524]
  - - [1024, 3072, 1, 7152]
    - [238, 80.259]
  - - [1024, 1024, 1, 7152]
    - [72, 55.368]
  - - [1024, 3072, 1, 5296]
    - [186, 77.721]
  - - [1024, 3072, 1, 5312]
    - [186, 79.136]
  - - [1024, 3072, 1, 5872]
    - [62, 78.622]
  - - [1024, 3072, 1, 6080]
    - [186, 79.897]
  - - [1024, 3072, 1, 6000]
    - [186, 78.817]
  - - [1024, 3072, 1, 6960]
    - [186, 79.571]
  - - [1024, 1024, 1, 6960]
    - [72, 53.917]
  - - [1024, 3072, 1, 6848]
    - [186, 80.525]
  - - [4096, 1024, 1, 6848]
    - [63, 78.089]
  - - [1024, 3072, 1, 5056]
    - [84, 78.8]
  - - [1024, 1024, 1, 8016]
    - [72, 56.808]
  - - [1024, 3072, 1, 6976]
    - [186, 80.639]
  - - [1024, 4096, 1, 6976]
    - [79, 81.738]
  - - [1024, 3072, 1, 5744]
    - [84, 78.388]
  - - [1024, 3072, 1, 5728]
    - [186, 79.642]
  - - [1024, 3072, 1, 5632]
    - [186, 79.714]
  - - [1024, 3072, 1, 6176]
    - [186, 79.943]
  - - [1024, 3072, 1, 5504]
    - [80, 79.458]
  - - [1024, 3072, 1, 5488]
    - [186, 78.239]
  - - [1024, 3072, 1, 5456]
    - [186, 78.128]
  - - [1024, 3072, 1, 6640]
    - [186, 79.209]
  - - [1024, 1024, 1, 6640]
    - [72, 53.987]
  - - [1024, 3072, 1, 6432]
    - [186, 80.38]
  - - [1024, 3072, 1, 6288]
    - [80, 79.308]
  - - [1024, 1024, 1, 6288]
    - [72, 52.947]
  - - [1024, 3072, 1, 4704]
    - [186, 78.454]
  - - [1024, 3072, 1, 6256]
    - [186, 78.904]
  - - [1024, 1024, 1, 7264]
    - [97, 55.833]
  - - [1024, 3072, 1, 6672]
    - [186, 79.43]
  - - [1024, 3072, 1, 6304]
    - [186, 80.022]
  - - [1024, 1024, 1, 6304]
    - [308, 56.766]
  - - [1024, 3072, 1, 5520]
    - [186, 78.192]
  - - [1024, 3072, 1, 6208]
    - [186, 79.978]
  - - [1024, 3072, 1, 4976]
    - [186, 77.587]
  - - [1024, 3072, 1, 5360]
    - [186, 78.272]
  - - [1024, 3072, 1, 5392]
    - [186, 78.032]
  - - [1024, 3072, 1, 5376]
    - [80, 79.19]
  - - [1024, 3072, 1, 5328]
    - [186, 77.804]
  - - [1024, 3072, 1, 6448]
    - [186, 79.184]
  - - [1024, 1024, 1, 6448]
    - [72, 53.569]
  - - [1024, 3072, 1, 5424]
    - [62, 78.08]
  - - [1024, 3072, 1, 6464]
    - [186, 80.214]
  - - [1024, 1024, 1, 7376]
    - [72, 56.037]
  - - [1024, 3072, 1, 5104]
    - [80, 77.636]
  - - [1024, 3072, 1, 6224]
    - [62, 78.865]
  - - [1024, 3072, 1, 6320]
    - [186, 78.981]
  - - [1024, 1024, 1, 6320]
    - [72, 52.952]
  - - [1024, 4096, 1, 6320]
    - [79, 78.987]
  - - [1024, 3072, 1, 6560]
    - [80, 80.309]
  - - [1024, 1024, 1, 6560]
    - [72, 54.006]
  - - [1024, 3072, 1, 5856]
    - [84, 79.763]
  - - [1024, 3072, 1, 6496]
    - [186, 80.442]
  - - [1024, 3072, 1, 5696]
    - [186, 79.322]
  - - [1024, 3072, 1, 6144]
    - [80, 79.85]
  - - [1024, 1024, 1, 7504]
    - [72, 55.337]
  - - [4096, 1024, 1, 7504]
    - [63, 77.475]
  - - [1024, 3072, 1, 6096]
    - [80, 78.592]
  - - [1024, 1024, 1, 6096]
    - [72, 52.338]
  - - [1024, 3072, 1, 4880]
    - [186, 77.35]
  - - [1024, 1024, 1, 7168]
    - [251, 60.347]
  - - [1024, 1024, 1, 7776]
    - [72, 56.811]
  - - [1024, 3072, 1, 6384]
    - [186, 79.194]
  - - [1024, 1024, 1, 6384]
    - [72, 53.262]
  - - [1024, 3072, 1, 5712]
    - [186, 78.405]
  - - [1024, 3072, 1, 4624]
    - [186, 76.867]
  - - [1024, 1024, 1, 7488]
    - [251, 61.632]
  - - [1024, 3072, 1, 7472]
    - [80, 79.933]
  - - [1024, 1024, 1, 7472]
    - [72, 56.082]
  - - [1024, 3072, 1, 6576]
    - [186, 79.192]
  - - [1024, 3072, 1, 6928]
    - [80, 79.591]
  - - [1024, 3072, 1, 6864]
    - [186, 79.604]
  - - [1024, 1024, 1, 6864]
    - [72, 54.132]
  - - [1024, 3072, 1, 5792]
    - [186, 79.688]
  - - [1024, 3072, 1, 6704]
    - [186, 79.358]
  - - [1024, 1024, 1, 6704]
    - [72, 54.172]
  - - [1024, 3072, 1, 6800]
    - [186, 79.512]
  - - [1024, 3072, 1, 6016]
    - [80, 79.976]
  - - [1024, 3072, 1, 6880]
    - [80, 80.474]
  - - [1024, 1024, 1, 6880]
    - [72, 54.623]
  - - [1024, 1024, 1, 27]
    - [57, 2.278]
  - - [16384, 16384, 1, 16384]
    - [210, 99.058]
  - - [16896, 16384, 1, 16384]
    - [210, 99.487]
  - - [1280, 100, 1, 1792]
    - [15, 7.578]
  - - [1280, 1280, 1, 1792]
    - [199, 51.364]
  - - [2048, 1000, 1, 32]
    - [57, 3.692]
  - - [224, 4000, 1, 224]
    - [194, 11.656]
  - - [25088, 4096, 1, 32]
    - [41, 10.051]
  - - [3072, 768, 1, 7168]
    - [75, 70.646]
  - - [4096, 4096, 1, 32]
    - [148, 8.507]
  - - [768, 100, 1, 32]
    - [54, 0.231]
  - - [768, 3072, 1, 7168]
    - [75, 70.359]
  - - [768, 768, 1, 32]
    - [146, 1.497]
  - - [768, 768, 1, 7168]
    - [183, 49.412]
  - - [196, 1632, 32, 128]
    - [36, 17.98]
  - - [196, 1664, 32, 128]
    - [127, 19.988]
  - - [196, 1696, 32, 128]
    - [36, 18.639]
  - - [196, 1728, 32, 128]
    - [121, 19.084]
  - - [196, 1760, 32, 128]
    - [36, 18.597]
  - - [196, 1792, 32, 896]
    - [176, 46.443]
  - - [196, 288, 32, 128]
    - [129, 8.83]
  - - [196, 320, 32, 128]
    - [129, 11.047]
  - - [196, 512, 32, 128]
    - [129, 13.269]
  - - [224, 64, 160, 224]
    - [133, 18.918]
  - - [224, 64, 384, 224]
    - [194, 23.311]
  - - [224, 64, 512, 224]
    - [194, 24.438]
  - - [3136, 192, 32, 128]
    - [140, 29.034]
  - - [3136, 96, 32, 128]
    - [140, 22.775]
  - - [49, 1024, 32, 128]
    - [102, 7.421]
  - - [49, 1056, 32, 128]
    - [121, 7.37]
  - - [49, 1088, 32, 128]
    - [102, 7.501]
  - - [49, 1120, 32, 128]
    - [102, 7.537]
  - - [49, 1152, 32, 128]
    - [36, 7.707]
  - - [49, 1600, 32, 128]
    - [102, 9.0]
  - - [49, 1632, 32, 128]
    - [35, 8.957]
  - - [49, 1664, 32, 128]
    - [35, 9.155]
  - - [49, 1696, 32, 128]
    - [116, 8.776]
  - - [49, 1728, 32, 128]
    - [102, 8.84]
  - - [49, 1824, 32, 128]
    - [102, 9.085]
  - - [49, 1856, 32, 128]
    - [102, 9.244]
  - - [49, 1888, 32, 128]
    - [123, 9.083]
  - - [49, 672, 32, 128]
    - [102, 5.778]
  - - [49, 704, 32, 128]
    - [102, 6.03]
  - - [49, 736, 32, 128]
    - [102, 6.328]
  - - [49, 768, 32, 128]
    - [102, 6.603]
  - - [49, 800, 32, 128]
    - [102, 6.651]
  - - [49, 832, 32, 128]
    - [102, 6.767]
  - - [64, 224, 160, 224]
    - [158, 19.105]
  - - [64, 224, 384, 224]
    - [158, 24.162]
  - - [64, 224, 512, 224]
    - [128, 24.965]
  - - [784, 128, 32, 128]
    - [195, 17.215]
  - - [784, 224, 32, 128]
    - [158, 20.21]
  - - [784, 288, 32, 128]
    - [140, 22.17]
  - - [784, 320, 32, 128]
    - [52, 23.202]
  - - [784, 352, 32, 128]
    - [52, 24.211]
  - - [1024, 1024, 1, 14080]
    - [72, 63.853]
  - - [1024, 1024, 1, 14400]
    - [72, 64.147]
  - - [1024, 1024, 1, 15168]
    - [72, 64.737]
  - - [4096, 1024, 1, 15136]
    - [63, 77.847]
  - - [4096, 1024, 1, 28672]
    - [63, 79.879]
  - - [1024, 1024, 1, 12112]
    - [72, 61.809]
  - - [1024, 1024, 1, 12192]
    - [72, 61.95]
  - - [1024, 1024, 1, 12272]
    - [72, 61.957]
  - - [1024, 1024, 1, 12304]
    - [72, 62.012]
  - - [1024, 1024, 1, 12368]
    - [72, 62.017]
  - - [1024, 1024, 1, 12416]
    - [97, 62.1]
  - - [1024, 1024, 1, 13024]
    - [97, 62.955]
  - - [1024, 1024, 1, 13056]
    - [72, 62.751]
  - - [1024, 1024, 1, 13072]
    - [72, 62.7]
  - - [1024, 1024, 1, 13088]
    - [97, 62.956]
  - - [1024, 1024, 1, 13168]
    - [72, 62.88]
  - - [1024, 1024, 1, 13184]
    - [72, 62.88]
  - - [1024, 1024, 1, 13216]
    - [97, 63.185]
  - - [1024, 1024, 1, 13232]
    - [72, 62.83]
  - - [1024, 1024, 1, 13248]
    - [72, 62.981]
  - - [1024, 1024, 1, 13280]
    - [97, 63.134]
  - - [1024, 1024, 1, 13296]
    - [72, 62.855]
  - - [1024, 1024, 1, 13312]
    - [72, 63.133]
  - - [1024, 1024, 1, 13328]
    - [72, 62.982]
  - - [1024, 1024, 1, 13344]
    - [72, 62.781]
  - - [1024, 1024, 1, 13360]
    - [72, 63.133]
  - - [1024, 1024, 1, 13376]
    - [72, 63.108]
  - - [1024, 1024, 1, 13392]
    - [72, 62.757]
  - - [1024, 1024, 1, 13408]
    - [97, 63.233]
  - - [1024, 1024, 1, 13424]
    - [72, 63.057]
  - - [1024, 1024, 1, 13440]
    - [72, 62.758]
  - - [1024, 1024, 1, 13456]
    - [72, 63.409]
  - - [1024, 1024, 1, 13472]
    - [72, 63.283]
  - - [1024, 1024, 1, 13488]
    - [72, 62.513]
  - - [1024, 1024, 1, 13504]
    - [72, 62.809]
  - - [1024, 1024, 1, 13520]
    - [72, 63.357]
  - - [1024, 1024, 1, 13536]
    - [72, 63.131]
  - - [1024, 1024, 1, 13552]
    - [72, 63.181]
  - - [1024, 1024, 1, 13600]
    - [97, 63.205]
  - - [1024, 1024, 1, 13616]
    - [72, 63.454]
  - - [1024, 1024, 1, 13632]
    - [72, 63.254]
  - - [1024, 1024, 1, 13648]
    - [72, 63.18]
  - - [1024, 1024, 1, 13680]
    - [72, 63.378]
  - - [1024, 1024, 1, 13696]
    - [97, 63.802]
  - - [1024, 1024, 1, 13712]
    - [72, 63.278]
  - - [1024, 1024, 1, 13728]
    - [72, 63.351]
  - - [1024, 1024, 1, 13760]
    - [72, 63.524]
  - - [1024, 1024, 1, 13776]
    - [72, 63.326]
  - - [1024, 1024, 1, 13792]
    - [72, 63.771]
  - - [1024, 1024, 1, 13808]
    - [72, 63.129]
  - - [1024, 1024, 1, 13824]
    - [72, 63.472]
  - - [1024, 1024, 1, 13840]
    - [72, 63.202]
  - - [1024, 1024, 1, 13856]
    - [97, 63.619]
  - - [1024, 1024, 1, 13872]
    - [72, 63.544]
  - - [1024, 1024, 1, 13888]
    - [97, 64.015]
  - - [1024, 1024, 1, 13904]
    - [72, 63.445]
  - - [1024, 1024, 1, 13920]
    - [97, 63.567]
  - - [1024, 1024, 1, 13936]
    - [72, 63.371]
  - - [1024, 1024, 1, 13952]
    - [97, 63.787]
  - - [1024, 1024, 1, 13968]
    - [72, 63.541]
  - - [1024, 1024, 1, 13984]
    - [97, 63.958]
  - - [1024, 1024, 1, 14000]
    - [72, 63.662]
  - - [1024, 1024, 1, 14016]
    - [72, 63.808]
  - - [1024, 1024, 1, 14032]
    - [72, 63.807]
  - - [1024, 1024, 1, 14048]
    - [97, 63.929]
  - - [1024, 1024, 1, 14064]
    - [72, 62.959]
  - - [1024, 1024, 1, 14096]
    - [72, 63.804]
  - - [1024, 1024, 1, 14112]
    - [97, 63.949]
  - - [1024, 1024, 1, 14128]
    - [72, 63.486]
  - - [1024, 1024, 1, 14144]
    - [97, 63.728]
  - - [1024, 1024, 1, 14176]
    - [97, 64.141]
  - - [1024, 1024, 1, 14192]
    - [72, 63.944]
  - - [1024, 1024, 1, 14208]
    - [72, 64.237]
  - - [1024, 1024, 1, 14224]
    - [72, 63.7]
  - - [1024, 1024, 1, 14240]
    - [97, 64.063]
  - - [1024, 1024, 1, 14256]
    - [72, 63.794]
  - - [1024, 1024, 1, 14272]
    - [72, 64.011]
  - - [1024, 1024, 1, 14288]
    - [72, 63.793]
  - - [1024, 1024, 1, 14304]
    - [97, 64.179]
  - - [1024, 1024, 1, 14320]
    - [72, 64.008]
  - - [1024, 1024, 1, 14336]
    - [97, 64.177]
  - - [1024, 1024, 1, 14352]
    - [72, 63.885]
  - - [1024, 1024, 1, 14384]
    - [72, 63.668]
  - - [1024, 1024, 1, 14416]
    - [72, 63.833]
  - - [1024, 1024, 1, 14432]
    - [97, 64.314]
  - - [1024, 1024, 1, 14448]
    - [72, 63.784]
  - - [1024, 1024, 1, 14464]
    - [72, 64.118]
  - - [1024, 1024, 1, 14480]
    - [72, 63.877]
  - - [1024, 1024, 1, 14496]
    - [97, 64.164]
  - - [1024, 1024, 1, 14512]
    - [72, 64.042]
  - - [1024, 1024, 1, 14528]
    - [97, 64.137]
  - - [1024, 1024, 1, 14544]
    - [72, 63.731]
  - - [1024, 1024, 1, 14560]
    - [97, 64.399]
  - - [1024, 1024, 1, 14576]
    - [72, 64.157]
  - - [1024, 1024, 1, 14608]
    - [72, 63.261]
  - - [1024, 1024, 1, 14624]
    - [97, 64.416]
  - - [1024, 1024, 1, 14640]
    - [72, 63.915]
  - - [1024, 1024, 1, 14656]
    - [97, 64.413]
  - - [1024, 1024, 1, 14672]
    - [97, 63.585]
  - - [1024, 1024, 1, 14688]
    - [72, 64.148]
  - - [1024, 1024, 1, 14704]
    - [72, 64.313]
  - - [1024, 1024, 1, 14720]
    - [97, 64.431]
  - - [1024, 1024, 1, 14736]
    - [72, 64.215]
  - - [1024, 1024, 1, 14752]
    - [97, 64.523]
  - - [1024, 1024, 1, 14784]
    - [97, 64.448]
  - - [1024, 1024, 1, 14800]
    - [72, 64.328]
  - - [1024, 1024, 1, 14816]
    - [97, 64.445]
  - - [1024, 1024, 1, 14848]
    - [97, 64.442]
  - - [1024, 1024, 1, 14864]
    - [72, 64.088]
  - - [1024, 1024, 1, 14880]
    - [72, 64.557]
  - - [1024, 1024, 1, 14896]
    - [72, 64.508]
  - - [1024, 1024, 1, 14912]
    - [72, 64.672]
  - - [1024, 1024, 1, 14928]
    - [72, 64.037]
  - - [1024, 1024, 1, 14944]
    - [97, 64.527]
  - - [1024, 1024, 1, 14960]
    - [72, 63.573]
  - - [1024, 1024, 1, 14976]
    - [72, 64.429]
  - - [1024, 1024, 1, 14992]
    - [72, 64.522]
  - - [1024, 1024, 1, 15008]
    - [97, 64.708]
  - - [1024, 1024, 1, 15024]
    - [72, 64.401]
  - - [1024, 1024, 1, 15040]
    - [97, 64.634]
  - - [1024, 1024, 1, 15056]
    - [72, 64.445]
  - - [1024, 1024, 1, 15072]
    - [72, 64.49]
  - - [1024, 1024, 1, 15088]
    - [72, 64.535]
  - - [1024, 1024, 1, 15104]
    - [97, 64.604]
  - - [1024, 1024, 1, 15120]
    - [72, 64.462]
  - - [1024, 1024, 1, 15136]
    - [97, 64.741]
  - - [1024, 1024, 1, 15152]
    - [72, 64.739]
  - - [1024, 1024, 1, 15184]
    - [72, 64.41]
  - - [1024, 1024, 1, 15200]
    - [72, 64.663]
  - - [1024, 1024, 1, 15216]
    - [72, 64.592]
  - - [1024, 1024, 1, 15232]
    - [97, 65.034]
  - - [1024, 1024, 1, 15248]
    - [72, 64.588]
  - - [1024, 1024, 1, 15264]
    - [97, 64.54]
  - - [1024, 1024, 1, 15280]
    - [72, 64.793]
  - - [1024, 1024, 1, 15312]
    - [97, 64.375]
  - - [1024, 1024, 1, 15328]
    - [72, 64.997]
  - - [1024, 1024, 1, 15344]
    - [72, 64.463]
  - - [1024, 1024, 1, 15360]
    - [97, 64.761]
  - - [1024, 1024, 1, 15376]
    - [72, 64.805]
  - - [1024, 1024, 1, 15408]
    - [72, 64.824]
  - - [1024, 1024, 1, 15424]
    - [97, 64.938]
  - - [1024, 1024, 1, 15440]
    - [72, 64.431]
  - - [1024, 1024, 1, 15456]
    - [97, 64.865]
  - - [1024, 1024, 1, 15472]
    - [72, 64.817]
  - - [1024, 1024, 1, 15504]
    - [72, 64.199]
  - - [1024, 1024, 1, 15520]
    - [97, 65.11]
  - - [1024, 1024, 1, 15536]
    - [72, 64.13]
  - - [1024, 1024, 1, 15568]
    - [72, 64.851]
  - - [1024, 1024, 1, 15584]
    - [97, 65.032]
  - - [1024, 1024, 1, 15600]
    - [72, 64.147]
  - - [1024, 1024, 1, 15616]
    - [72, 65.235]
  - - [1024, 1024, 1, 15632]
    - [72, 64.707]
  - - [1024, 1024, 1, 15648]
    - [97, 65.207]
  - - [1024, 1024, 1, 15664]
    - [72, 65.044]
  - - [1024, 1024, 1, 15696]
    - [72, 64.722]
  - - [1024, 1024, 1, 15712]
    - [97, 65.451]
  - - [1024, 1024, 1, 15728]
    - [97, 64.271]
  - - [1024, 1024, 1, 15744]
    - [97, 65.102]
  - - [1024, 1024, 1, 15760]
    - [72, 64.76]
  - - [1024, 1024, 1, 15776]
    - [97, 65.28]
  - - [1024, 1024, 1, 15792]
    - [97, 64.244]
  - - [1024, 1024, 1, 15808]
    - [97, 65.367]
  - - [1024, 1024, 1, 15856]
    - [72, 64.951]
  - - [1024, 1024, 1, 15888]
    - [72, 65.218]
  - - [1024, 1024, 1, 15904]
    - [97, 64.945]
  - - [1024, 1024, 1, 15920]
    - [72, 65.101]
  - - [1024, 1024, 1, 15936]
    - [97, 65.506]
  - - [1024, 1024, 1, 15952]
    - [72, 64.583]
  - - [1024, 1024, 1, 15968]
    - [97, 65.524]
  - - [1024, 1024, 1, 15984]
    - [72, 65.047]
  - - [1024, 1024, 1, 16000]
    - [97, 65.609]
  - - [1024, 1024, 1, 16016]
    - [72, 64.423]
  - - [1024, 1024, 1, 16032]
    - [97, 65.018]
  - - [1024, 1024, 1, 16064]
    - [97, 65.395]
  - - [1024, 1024, 1, 16080]
    - [72, 65.325]
  - - [1024, 1024, 1, 16096]
    - [97, 65.798]
  - - [1024, 1024, 1, 16112]
    - [72, 65.142]
  - - [1024, 1024, 1, 16128]
    - [97, 65.251]
  - - [1024, 1024, 1, 16160]
    - [97, 65.492]
  - - [1024, 1024, 1, 16176]
    - [72, 65.222]
  - - [1024, 1024, 1, 16192]
    - [97, 65.286]
  - - [1024, 1024, 1, 16224]
    - [72, 65.415]
  - - [1024, 1024, 1, 16240]
    - [72, 65.191]
  - - [1024, 1024, 1, 16256]
    - [97, 65.433]
  - - [1024, 1024, 1, 16272]
    - [97, 64.922]
  - - [1024, 1024, 1, 16288]
    - [97, 65.472]
  - - [1024, 1024, 1, 16304]
    - [97, 64.678]
  - - [1024, 1024, 1, 16320]
    - [97, 65.489]
  - - [1024, 1024, 1, 16336]
    - [72, 65.354]
  - - [1024, 1024, 1, 16352]
    - [97, 65.662]
  - - [1024, 1024, 1, 16400]
    - [97, 64.863]
  - - [1024, 1024, 1, 16432]
    - [72, 65.494]
  - - [1024, 1024, 1, 16448]
    - [97, 65.735]
  - - [1024, 1024, 1, 16464]
    - [72, 65.313]
  - - [1024, 1024, 1, 16480]
    - [97, 65.819]
  - - [1024, 1024, 1, 16496]
    - [72, 65.33]
  - - [1024, 1024, 1, 16512]
    - [97, 65.569]
  - - [1024, 1024, 1, 16544]
    - [97, 65.874]
  - - [1024, 1024, 1, 16576]
    - [97, 66.135]
  - - [1024, 1024, 1, 16608]
    - [97, 65.554]
  - - [1024, 1024, 1, 16656]
    - [72, 65.113]
  - - [1024, 1024, 1, 16704]
    - [97, 65.955]
  - - [1024, 1024, 1, 16736]
    - [97, 65.621]
  - - [1024, 1024, 1, 16768]
    - [97, 66.097]
  - - [1024, 1024, 1, 16880]
    - [97, 65.148]
  - - [1024, 1024, 1, 16928]
    - [97, 66.088]
  - - [1024, 1024, 1, 17024]
    - [97, 66.179]
  - - [1024, 1024, 1, 2004]
    - [58, 34.97]
  - - [1024, 1024, 1, 2072]
    - [58, 35.271]
  - - [1024, 1024, 1, 2307]
    - [115, 37.696]
  - - [1024, 30528, 1, 2231]
    - [61, 80.138]
  - - [1024, 30528, 1, 2256]
    - [154, 80.707]
  - - [1024, 30528, 1, 2322]
    - [154, 80.421]
  - - [1024, 3072, 1, 11984]
    - [77, 75.293]
  - - [1024, 3072, 1, 12064]
    - [152, 75.608]
  - - [1024, 3072, 1, 12112]
    - [152, 74.889]
  - - [1024, 3072, 1, 12192]
    - [152, 75.661]
  - - [1024, 3072, 1, 12272]
    - [138, 75.002]
  - - [1024, 3072, 1, 12304]
    - [83, 75.667]
  - - [1024, 3072, 1, 12368]
    - [83, 75.785]
  - - [1024, 3072, 1, 12416]
    - [171, 75.974]
  - - [1024, 3072, 1, 13024]
    - [152, 75.982]
  - - [1024, 3072, 1, 13056]
    - [81, 76.256]
  - - [1024, 3072, 1, 13072]
    - [77, 75.763]
  - - [1024, 3072, 1, 13088]
    - [61, 76.129]
  - - [1024, 3072, 1, 13168]
    - [81, 76.058]
  - - [1024, 3072, 1, 13184]
    - [152, 76.026]
  - - [1024, 3072, 1, 13216]
    - [61, 76.199]
  - - [1024, 3072, 1, 13232]
    - [83, 76.08]
  - - [1024, 3072, 1, 13248]
    - [81, 76.123]
  - - [1024, 3072, 1, 13280]
    - [152, 76.22]
  - - [1024, 3072, 1, 13296]
    - [61, 76.078]
  - - [1024, 3072, 1, 13312]
    - [171, 76.096]
  - - [1024, 3072, 1, 13328]
    - [81, 76.188]
  - - [1024, 3072, 1, 13344]
    - [171, 76.267]
  - - [1024, 3072, 1, 13360]
    - [171, 75.182]
  - - [1024, 3072, 1, 13376]
    - [152, 76.314]
  - - [1024, 3072, 1, 13392]
    - [152, 75.302]
  - - [1024, 3072, 1, 13408]
    - [152, 76.239]
  - - [1024, 3072, 1, 13424]
    - [152, 75.244]
  - - [1024, 3072, 1, 13440]
    - [152, 76.152]
  - - [1024, 3072, 1, 13456]
    - [77, 75.614]
  - - [1024, 3072, 1, 13472]
    - [138, 75.969]
  - - [1024, 3072, 1, 13488]
    - [81, 76.011]
  - - [1024, 3072, 1, 13504]
    - [152, 76.138]
  - - [1024, 3072, 1, 13520]
    - [152, 75.282]
  - - [1024, 3072, 1, 13536]
    - [171, 76.173]
  - - [1024, 3072, 1, 13552]
    - [171, 75.306]
  - - [1024, 3072, 1, 13568]
    - [81, 76.063]
  - - [1024, 3072, 1, 13584]
    - [61, 76.394]
  - - [1024, 3072, 1, 13600]
    - [81, 76.351]
  - - [1024, 3072, 1, 13616]
    - [186, 75.178]
  - - [1024, 3072, 1, 13632]
    - [83, 76.181]
  - - [1024, 3072, 1, 13648]
    - [171, 75.367]
  - - [1024, 3072, 1, 13664]
    - [171, 76.191]
  - - [1024, 3072, 1, 13680]
    - [81, 76.376]
  - - [1024, 3072, 1, 13696]
    - [83, 76.226]
  - - [1024, 3072, 1, 13712]
    - [77, 75.803]
  - - [1024, 3072, 1, 13728]
    - [152, 76.153]
  - - [1024, 3072, 1, 13744]
    - [77, 75.921]
  - - [1024, 3072, 1, 13760]
    - [61, 76.294]
  - - [1024, 3072, 1, 13776]
    - [81, 76.323]
  - - [1024, 3072, 1, 13792]
    - [152, 76.221]
  - - [1024, 3072, 1, 13808]
    - [81, 76.322]
  - - [1024, 3072, 1, 13824]
    - [171, 76.327]
  - - [1024, 3072, 1, 13840]
    - [77, 75.731]
  - - [1024, 3072, 1, 13856]
    - [152, 76.278]
  - - [1024, 3072, 1, 13872]
    - [152, 75.417]
  - - [1024, 3072, 1, 13888]
    - [152, 76.276]
  - - [1024, 3072, 1, 13904]
    - [61, 76.34]
  - - [1024, 3072, 1, 13920]
    - [171, 76.369]
  - - [1024, 3072, 1, 13936]
    - [152, 75.452]
  - - [1024, 3072, 1, 13952]
    - [152, 76.285]
  - - [1024, 3072, 1, 13984]
    - [171, 76.236]
  - - [1024, 3072, 1, 14000]
    - [153, 75.868]
  - - [1024, 3072, 1, 14016]
    - [152, 76.282]
  - - [1024, 3072, 1, 14032]
    - [138, 76.147]
  - - [1024, 3072, 1, 14048]
    - [171, 76.562]
  - - [1024, 3072, 1, 14064]
    - [152, 75.431]
  - - [1024, 3072, 1, 14080]
    - [152, 76.349]
  - - [1024, 3072, 1, 14096]
    - [152, 75.488]
  - - [1024, 3072, 1, 14112]
    - [152, 76.149]
  - - [1024, 3072, 1, 14128]
    - [138, 76.212]
  - - [1024, 3072, 1, 14144]
    - [152, 76.462]
  - - [1024, 3072, 1, 14176]
    - [171, 76.32]
  - - [1024, 3072, 1, 14192]
    - [171, 75.466]
  - - [1024, 3072, 1, 14208]
    - [171, 76.353]
  - - [1024, 3072, 1, 15008]
    - [152, 76.445]
  - - [1024, 3072, 1, 15040]
    - [152, 76.564]
  - - [1024, 3072, 1, 15072]
    - [152, 76.584]
  - - [1024, 3072, 1, 16144]
    - [61, 76.914]
  - - [1024, 3072, 1, 16176]
    - [81, 76.839]
  - - [1024, 3072, 1, 16464]
    - [152, 76.166]
  - - [1024, 3072, 1, 28672]
    - [171, 78.354]
  - - [1024, 4096, 1, 13488]
    - [79, 78.446]
  - - [1024, 4096, 1, 14080]
    - [79, 79.483]
  - - [1024, 4096, 1, 14240]
    - [79, 79.569]
  - - [1024, 4096, 1, 15248]
    - [79, 79.19]
  - - [1024, 4096, 1, 15312]
    - [79, 79.174]
  - - [1024, 4096, 1, 15328]
    - [79, 79.904]
  - - [1024, 4096, 1, 15792]
    - [79, 79.128]
  - - [1024, 4096, 1, 15984]
    - [79, 79.449]
  - - [1024, 4096, 1, 16192]
    - [60, 79.762]
  - - [1024, 4096, 1, 16336]
    - [79, 79.542]
  - - [1024, 4096, 1, 28672]
    - [79, 81.788]
  - - [4096, 1024, 1, 13312]
    - [63, 76.102]
  - - [4096, 1024, 1, 15664]
    - [63, 76.02]
  - - [4096, 1024, 1, 15680]
    - [63, 77.726]
  - - [4096, 1024, 1, 15776]
    - [63, 77.022]
  - - [4096, 1024, 1, 15792]
    - [63, 77.172]
  - - [4096, 1024, 1, 16032]
    - [63, 77.87]
  - - [4096, 1024, 1, 16112]
    - [63, 77.281]
  - - [4096, 1024, 1, 16464]
    - [63, 77.646]
  - - [4096, 1024, 1, 16576]
    - [63, 76.779]
  - - [1000, 100, 1, 1024]
    - [12, 4.807]
  - - [1000, 100, 1, 256]
    - [12, 1.803]
  - - [1000, 4000, 1, 256]
    - [188, 27.8]
  - - [1000, 4000, 1, 31744]
    - [60, 78.702]
  - - [1000, 4000, 1, 32768]
    - [60, 78.637]
  - - [1000, 4000, 1, 7936]
    - [60, 72.884]
  - - [1280, 100, 1, 5376]
    - [165, 14.41]
  - - [1280, 1280, 1, 224]
    - [188, 17.595]
  - - [1280, 1280, 1, 5376]
    - [84, 67.187]
  - - [1280, 1280, 1, 896]
    - [27, 38.109]
  - - [1280, 5120, 1, 224]
    - [181, 31.929]
  - - [1280, 5120, 1, 5376]
    - [138, 77.316]
  - - [1664, 1000, 1, 256]
    - [91, 18.97]
  - - [1920, 1000, 1, 256]
    - [115, 19.162]
  - - [1920, 1000, 1, 64]
    - [175, 6.35]
  - - [2048, 1000, 1, 256]
    - [140, 19.559]
  - - [2048, 1000, 1, 96]
    - [175, 9.426]
  - - [224, 4000, 1, 32768]
    - [97, 61.268]
  - - [2304, 768, 1, 5376]
    - [84, 72.123]
  - - [2304, 768, 1, 896]
    - [27, 40.969]
  - - [25088, 4096, 1, 256]
    - [174, 52.052]
  - - [3072, 768, 1, 10752]
    - [155, 72.871]
  - - [3072, 768, 1, 224]
    - [188, 20.892]
  - - [3072, 768, 1, 3584]
    - [75, 63.98]
  - - [3072, 768, 1, 896]
    - [58, 44.768]
  - - [3840, 1280, 1, 5376]
    - [27, 75.656]
  - - [5120, 1280, 1, 5376]
    - [210, 77.362]
  - - [768, 100, 1, 16]
    - [45, 0.117]
  - - [768, 100, 1, 48]
    - [192, 0.322]
  - - [768, 100, 1, 5376]
    - [163, 9.651]
  - - [768, 100, 1, 896]
    - [8, 3.876]
  - - [768, 3072, 1, 10752]
    - [155, 72.852]
  - - [768, 3072, 1, 224]
    - [188, 20.819]
  - - [768, 3072, 1, 3584]
    - [75, 64.066]
  - - [768, 3072, 1, 5376]
    - [155, 68.275]
  - - [768, 3072, 1, 896]
    - [58, 44.601]
  - - [768, 768, 1, 10752]
    - [95, 57.023]
  - - [768, 768, 1, 224]
    - [194, 7.834]
  - - [768, 768, 1, 3584]
    - [95, 34.617]
  - - [768, 768, 1, 5376]
    - [95, 42.99]
  - - [196, 1024, 16, 128]
    - [129, 13.231]
  - - [196, 1120, 256, 128]
    - [36, 22.363]
  - - [196, 1120, 64, 128]
    - [36, 19.006]
  - - [196, 1280, 256, 640]
    - [136, 50.767]
  - - [196, 1344, 256, 128]
    - [200, 25.045]
  - - [196, 1408, 16, 128]
    - [121, 15.053]
  - - [196, 1472, 256, 128]
    - [36, 23.502]
  - - [196, 1504, 256, 128]
    - [36, 23.121]
  - - [196, 384, 256, 128]
    - [35, 21.965]
  - - [196, 384, 64, 128]
    - [129, 15.54]
  - - [196, 416, 256, 128]
    - [36, 18.445]
  - - [196, 480, 256, 128]
    - [36, 18.583]
  - - [196, 512, 256, 128]
    - [35, 23.184]
  - - [196, 512, 64, 128]
    - [121, 16.995]
  - - [196, 544, 256, 128]
    - [127, 20.104]
  - - [196, 544, 64, 128]
    - [36, 15.821]
  - - [196, 576, 256, 128]
    - [200, 21.629]
  - - [196, 608, 256, 128]
    - [36, 20.116]
  - - [196, 640, 256, 128]
    - [35, 23.749]
  - - [196, 640, 64, 128]
    - [35, 18.465]
  - - [196, 704, 16, 128]
    - [123, 11.452]
  - - [196, 960, 256, 128]
    - [200, 23.838]
  - - [196, 960, 64, 128]
    - [123, 19.425]
  - - [224, 64, 480, 224]
    - [133, 24.774]
  - - [3136, 128, 16, 128]
    - [158, 21.896]
  - - [3136, 128, 256, 128]
    - [41, 32.88]
  - - [3136, 128, 64, 128]
    - [41, 29.781]
  - - [49, 1024, 64, 128]
    - [35, 9.356]
  - - [49, 1152, 16, 128]
    - [102, 5.614]
  - - [49, 1184, 16, 128]
    - [102, 5.398]
  - - [49, 1440, 256, 128]
    - [36, 12.428]
  - - [49, 1472, 256, 128]
    - [200, 12.519]
  - - [49, 1504, 256, 128]
    - [36, 12.943]
  - - [49, 1536, 256, 128]
    - [36, 13.728]
  - - [49, 1568, 256, 128]
    - [36, 12.858]
  - - [49, 1696, 64, 128]
    - [123, 10.565]
  - - [49, 1760, 16, 128]
    - [102, 6.677]
  - - [49, 1760, 64, 128]
    - [123, 10.501]
  - - [49, 1824, 64, 128]
    - [121, 10.658]
  - - [49, 640, 256, 128]
    - [36, 11.936]
  - - [49, 640, 64, 128]
    - [35, 8.199]
  - - [49, 672, 64, 128]
    - [116, 7.894]
  - - [49, 768, 64, 128]
    - [107, 8.576]
  - - [49, 928, 256, 128]
    - [200, 11.839]
  - - [49, 960, 256, 128]
    - [200, 12.102]
  - - [49, 992, 256, 128]
    - [36, 12.419]
  - - [784, 160, 16, 128]
    - [175, 12.422]
  - - [784, 160, 256, 128]
    - [140, 28.359]
  - - [784, 160, 64, 128]
    - [189, 21.088]
  - - [784, 192, 16, 128]
    - [143, 14.594]
  - - [784, 192, 256, 128]
    - [140, 31.993]
  - - [784, 192, 64, 128]
    - [189, 24.589]
  - - [784, 224, 256, 128]
    - [41, 32.466]
  - - [784, 224, 64, 128]
    - [158, 24.822]
  - - [784, 256, 16, 128]
    - [195, 17.475]
  - - [784, 320, 64, 128]
    - [41, 27.697]
  - - [784, 352, 64, 128]
    - [41, 29.209]
  - - [784, 384, 256, 128]
    - [41, 37.765]
  - - [784, 384, 64, 128]
    - [41, 30.908]
  - - [784, 416, 256, 128]
    - [41, 34.235]
  - - [784, 416, 64, 128]
    - [41, 29.112]
- null
- null
- DeviceEfficiency
- Fp16AltImpl
