library/src/blas3/Tensile/Logic/FijiROCm15/Fiji_Cijk_Ailk_Bljk_SB.yaml
- {MinimumRequiredVersion: 3.0.0}
- Fiji
- [R9 Nano]
- AssignedDerivedParameters: true
- - - [4096, 7000, 1, 4096]
    - [562, 4822.59]
  - - [7680, 64, 1, 2560]
    - [627, 2988.87]
  - - [7680, 128, 1, 2560]
    - [42, 3618.75]
  - - [2048, 7000, 1, 2048]
    - [7, 4550.09]
  - - [3072, 32, 1, 1024]
    - [456, 1477.76]
  - - [5124, 9124, 1, 4096]
    - [562, 4733.2]
  - - [5124, 9124, 1, 1760]
    - [5, 5552.11]
  - - [4096, 32, 1, 4096]
    - [0, 2470.01]
  - - [1760, 64, 1, 1760]
    - [94, 2246.72]
  - - [4096, 128, 1, 4096]
    - [35, 3094.95]
  - - [2560, 16, 1, 2560]
    - [1, 1266.42]
  - - [3072, 16, 1, 1024]
    - [170, 1159.73]
  - - [2560, 64, 1, 2560]
    - [2, 2620.83]
  - - [2560, 7000, 1, 2560]
    - [38, 5174.49]
  - - [1760, 32, 1, 1760]
    - [49, 1957.44]
  - - [2048, 64, 1, 2048]
    - [0, 2096.54]
  - - [1760, 128, 1, 1760]
    - [35, 2901.78]
  - - [2560, 128, 1, 2560]
    - [59, 2847.89]
  - - [35, 8457, 1, 1760]
    - [170, 1599.82]
  - - [4096, 16, 1, 4096]
    - [170, 1560.34]
  - - [35, 8457, 1, 2048]
    - [384, 1224.57]
  - - [3072, 128, 1, 1024]
    - [94, 2123.3]
  - - [1760, 7000, 1, 1760]
    - [538, 5192.21]
  - - [1760, 16, 1, 1760]
    - [384, 1114.27]
  - - [2560, 32, 1, 2560]
    - [61, 2139.99]
  - - [2048, 32, 1, 2048]
    - [40, 1661.14]
  - - [35, 8457, 1, 2560]
    - [65, 1393.15]
  - - [5124, 9124, 1, 2560]
    - [5, 5346.92]
  - - [3072, 64, 1, 1024]
    - [49, 1758.04]
  - - [5124, 9124, 1, 2048]
    - [7, 4741.45]
  - - [2048, 16, 1, 2048]
    - [384, 1182.35]
  - - [7680, 16, 1, 2560]
    - [0, 1438.27]
  - - [2048, 128, 1, 2048]
    - [52, 2328.19]
  - - [4096, 64, 1, 4096]
    - [52, 2752.39]
  - - [35, 8457, 1, 4096]
    - [3, 1314.59]
  - - [7680, 32, 1, 2560]
    - [100, 2717.04]
- - - -1
    - - - -1
        - - - 32
            - - [64, 0]
              - [224, 44]
              - [352, 72]
              - [512, 35]
              - [704, 19]
              - [1792, 42]
              - [2144, 46]
              - [-1, 38]
          - - 64
            - - [128, 25]
              - [224, 77]
              - [704, 0]
              - [928, 61]
              - [1184, 0]
              - [1472, 29]
              - [1792, 48]
              - [2528, 76]
              - [2944, 65]
              - [3392, 50]
              - [-1, 17]
          - - 128
            - - [32, 25]
              - [64, 1]
              - [128, 77]
              - [352, 0]
              - [512, 61]
              - [704, 44]
              - [928, 2]
              - [1184, 72]
              - [1472, 48]
              - [1792, 35]
              - [2144, 4]
              - [2528, 59]
              - [2944, 75]
              - [-1, 42]
          - - 224
            - - [32, 62]
              - [64, 77]
              - [128, 0]
              - [224, 52]
              - [352, 0]
              - [512, 44]
              - [704, 0]
              - [928, 35]
              - [1184, 59]
              - [1472, 75]
              - [1792, 42]
              - [2144, 4]
              - [2528, 46]
              - [2944, 19]
              - [-1, 38]
          - - 352
            - - [32, 25]
              - [224, 0]
              - [352, 57]
              - [512, 48]
              - [704, 4]
              - [928, 75]
              - [1184, 42]
              - [1472, 75]
              - [1792, 46]
              - [2144, 75]
              - [2528, 38]
              - [3392, 46]
              - [-1, 38]
          - - 512
            - - [32, 77]
              - [64, 52]
              - [128, 61]
              - [224, 44]
              - [352, 48]
              - [512, 35]
              - [704, 75]
              - [928, 42]
              - [1184, 46]
              - [1472, 42]
              - [1792, 38]
              - [2528, 42]
              - [2944, 38]
              - [3392, 42]
              - [-1, 38]
          - - 704
            - - [64, 0]
              - [224, 44]
              - [352, 4]
              - [512, 75]
              - [704, 19]
              - [928, 42]
              - [1184, 38]
              - [1472, 19]
              - [2144, 46]
              - [2528, 38]
              - [2944, 42]
              - [3392, 46]
              - [-1, 38]
          - - 928
            - - [32, 0]
              - [64, 49]
              - [128, 44]
              - [224, 35]
              - [352, 75]
              - [704, 42]
              - [928, 38]
              - [1184, 42]
              - [1472, 38]
              - [2144, 42]
              - [-1, 38]
          - - 1184
            - - [64, 0]
              - [128, 72]
              - [224, 59]
              - [352, 42]
              - [512, 46]
              - [704, 38]
              - [928, 42]
              - [1184, 19]
              - [1472, 38]
              - [1792, 42]
              - [2144, 46]
              - [2528, 19]
              - [2944, 46]
              - [-1, 38]
          - - 1472
            - - [32, 0]
              - [64, 61]
              - [128, 48]
              - [224, 75]
              - [352, 4]
              - [512, 42]
              - [704, 19]
              - [1184, 38]
              - [1472, 42]
              - [1792, 46]
              - [2144, 42]
              - [-1, 38]
          - - 1792
            - - [32, 49]
              - [64, 44]
              - [128, 35]
              - [224, 42]
              - [352, 46]
              - [512, 38]
              - [704, 46]
              - [1184, 42]
              - [1472, 46]
              - [1792, 42]
              - [2944, 38]
              - [-1, 5]
          - - 2144
            - - [32, 40]
              - [64, 57]
              - [224, 4]
              - [352, 75]
              - [704, 19]
              - [928, 42]
              - [1472, 46]
              - [1792, 38]
              - [2144, 46]
              - [-1, 38]
          - - 2528
            - - [32, 61]
              - [64, 2]
              - [128, 59]
              - [224, 46]
              - [352, 38]
              - [512, 42]
              - [704, 19]
              - [928, 38]
              - [1184, 42]
              - [3392, 38]
              - [-1, 5]
          - - 2944
            - - [32, 61]
              - [64, 22]
              - [128, 75]
              - [352, 42]
              - [512, 38]
              - [704, 19]
              - [928, 38]
              - [1184, 46]
              - [2944, 38]
              - [3392, 5]
              - [-1, 38]
          - - 3392
            - - [32, 52]
              - [64, 57]
              - [128, 4]
              - [224, 38]
              - [352, 46]
              - [512, 42]
              - [704, 19]
              - [2528, 38]
              - [2944, 5]
              - [-1, 38]
          - - -1
            - - [32, 0]
              - [64, 22]
              - [128, 42]
              - [1184, 38]
              - [1792, 5]
              - [-1, 38]
