library/src/blas3/Tensile/Logic/FijiROCm15/Fiji_Cijk_Alik_Bljk_SB.yaml
- {MinimumRequiredVersion: 3.0.0}
- Fiji
- [R9 Nano]
- AssignedDerivedParameters: true
- - - [4096, 7000, 1, 4096]
    - [82, 3062.3]
  - - [7680, 64, 1, 2560]
    - [14, 2336.27]
  - - [7680, 128, 1, 2560]
    - [59, 3031.93]
  - - [2048, 7000, 1, 2048]
    - [8, 3110.41]
  - - [3072, 32, 1, 1024]
    - [75, 971.297]
  - - [5124, 9124, 1, 4096]
    - [88, 3103.14]
  - - [5124, 9124, 1, 1760]
    - [88, 4963.63]
  - - [4096, 32, 1, 4096]
    - [75, 1359.19]
  - - [1760, 64, 1, 1760]
    - [19, 1786.68]
  - - [4096, 128, 1, 4096]
    - [46, 2030.1]
  - - [2560, 16, 1, 2560]
    - [2, 977.803]
  - - [3072, 16, 1, 1024]
    - [33, 632.001]
  - - [2560, 64, 1, 2560]
    - [53, 1895.17]
  - - [2560, 7000, 1, 2560]
    - [88, 3947.42]
  - - [1760, 32, 1, 1760]
    - [75, 1223.16]
  - - [2048, 64, 1, 2048]
    - [18, 1401.34]
  - - [1760, 128, 1, 1760]
    - [12, 2616.81]
  - - [2560, 128, 1, 2560]
    - [59, 2615.28]
  - - [35, 8457, 1, 1760]
    - [10, 1292.58]
  - - [4096, 16, 1, 4096]
    - [2, 869.414]
  - - [35, 8457, 1, 2048]
    - [75, 1177.47]
  - - [3072, 128, 1, 1024]
    - [46, 1663.89]
  - - [1760, 7000, 1, 1760]
    - [88, 4837.09]
  - - [1760, 16, 1, 1760]
    - [13, 869.513]
  - - [2560, 32, 1, 2560]
    - [77, 1376.83]
  - - [2048, 32, 1, 2048]
    - [44, 1070.33]
  - - [35, 8457, 1, 2560]
    - [53, 1344.88]
  - - [5124, 9124, 1, 2560]
    - [88, 4109.71]
  - - [3072, 64, 1, 1024]
    - [3, 1324.19]
  - - [5124, 9124, 1, 2048]
    - [88, 3650.36]
  - - [2048, 16, 1, 2048]
    - [13, 643.803]
  - - [7680, 16, 1, 2560]
    - [57, 1159.78]
  - - [2048, 128, 1, 2048]
    - [46, 1829.36]
  - - [4096, 64, 1, 4096]
    - [18, 1798.23]
  - - [35, 8457, 1, 4096]
    - [75, 1241.26]
  - - [7680, 32, 1, 2560]
    - [38, 1638.26]
- - - -1
    - - - -1
        - - - 32
            - - [32, 7]
              - [64, 24]
              - [512, 25]
              - [704, 5]
              - [928, 16]
              - [1184, 32]
              - [1472, 16]
              - [-1, 41]
          - - 64
            - - [32, 73]
              - [64, 81]
              - [128, 78]
              - [224, 7]
              - [352, 38]
              - [512, 75]
              - [704, 42]
              - [928, 24]
              - [1184, 19]
              - [1472, 24]
              - [2144, 51]
              - [2528, 12]
              - [2944, 25]
              - [3392, 19]
              - [-1, 12]
          - - 128
            - - [32, 78]
              - [64, 56]
              - [128, 7]
              - [224, 75]
              - [352, 43]
              - [704, 24]
              - [928, 25]
              - [1184, 12]
              - [1472, 25]
              - [1792, 12]
              - [2144, 27]
              - [2528, 59]
              - [2944, 5]
              - [-1, 16]
          - - 224
            - - [32, 78]
              - [64, 7]
              - [128, 72]
              - [352, 24]
              - [512, 51]
              - [704, 25]
              - [928, 12]
              - [1184, 59]
              - [1472, 60]
              - [1792, 16]
              - [2144, 51]
              - [2528, 32]
              - [2944, 5]
              - [3392, 51]
              - [-1, 54]
          - - 352
            - - [32, 7]
              - [64, 38]
              - [128, 43]
              - [224, 24]
              - [352, 51]
              - [512, 25]
              - [704, 27]
              - [928, 5]
              - [1184, 16]
              - [1472, 51]
              - [1792, 32]
              - [2144, 5]
              - [2528, 54]
              - [2944, 12]
              - [3392, 32]
              - [-1, 16]
          - - 512
            - - [32, 7]
              - [64, 42]
              - [128, 24]
              - [224, 51]
              - [352, 25]
              - [512, 12]
              - [704, 5]
              - [928, 16]
              - [1184, 32]
              - [1472, 12]
              - [1792, 54]
              - [2144, 12]
              - [2528, 32]
              - [2944, 62]
              - [-1, 41]
          - - 704
            - - [32, 38]
              - [64, 42]
              - [128, 24]
              - [224, 25]
              - [352, 27]
              - [704, 51]
              - [928, 12]
              - [1184, 54]
              - [1472, 51]
              - [1792, 32]
              - [2144, 12]
              - [2528, 41]
              - [2944, 12]
              - [-1, 41]
          - - 928
            - - [32, 75]
              - [64, 24]
              - [128, 51]
              - [224, 12]
              - [352, 51]
              - [512, 16]
              - [704, 5]
              - [928, 54]
              - [1472, 16]
              - [1792, 41]
              - [2144, 5]
              - [2528, 54]
              - [-1, 41]
          - - 1184
            - - [32, 65]
              - [64, 19]
              - [128, 12]
              - [224, 59]
              - [352, 16]
              - [512, 32]
              - [704, 54]
              - [928, 16]
              - [1184, 12]
              - [1472, 41]
              - [1792, 16]
              - [-1, 41]
          - - 1472
            - - [32, 7]
              - [64, 24]
              - [128, 25]
              - [224, 5]
              - [352, 51]
              - [512, 5]
              - [704, 59]
              - [928, 16]
              - [1184, 41]
              - [1472, 16]
              - [-1, 41]
          - - 1792
            - - [32, 75]
              - [64, 19]
              - [128, 12]
              - [224, 25]
              - [352, 32]
              - [512, 54]
              - [704, 32]
              - [928, 41]
              - [1184, 16]
              - [-1, 41]
          - - 2144
            - - [32, 4]
              - [64, 46]
              - [128, 27]
              - [224, 25]
              - [352, 5]
              - [512, 59]
              - [704, 32]
              - [928, 16]
              - [1184, 41]
              - [1472, 32]
              - [-1, 41]
          - - 2528
            - - [32, 7]
              - [64, 24]
              - [128, 59]
              - [224, 32]
              - [352, 54]
              - [512, 32]
              - [704, 41]
              - [928, 16]
              - [1184, 32]
              - [-1, 41]
          - - 2944
            - - [32, 48]
              - [64, 14]
              - [128, 5]
              - [224, 0]
              - [352, 59]
              - [704, 16]
              - [-1, 41]
          - - 3392
            - - [32, 65]
              - [64, 19]
              - [128, 12]
              - [224, 25]
              - [352, 32]
              - [512, 41]
              - [704, 32]
              - [-1, 41]
          - - -1
            - - [32, 48]
              - [64, 80]
              - [128, 16]
              - [224, 54]
              - [352, 16]
              - [-1, 41]
