library/src/blas3/Tensile/Logic/asm_full/aldebaran_104cu/equality/aldebaran_Cijk_Alik_Bljk_HHS_BH.yaml
- {MinimumRequiredVersion: 4.35.0}
- aldebaran
- {Architecture: gfx90a, CUCount: 104}
- [Device 0050, Device 0051, Device 0052, Device 0054, Device 0062, Device 7400, Device
    SolutionIndex: 0
    SolutionNameMin: Cijk_Alik_Bljk_HHS_BH_MT64x64x32_MI32x32x8x1_SE_1LDSB1_AF0EM8_AF1EM1_AMAS3_EPS0_GRVW8_GSU1_GSUAMB_LBSPP128_LPA8_LPB8_LRVW8_LDW0_MAC_PGR2_PLR5_SIA3_SS0_SU0_SUS0_SRVW4_SVW4_TT1_32_VAW2_VW2_WSGRA1_WSGRB1_WG64_4_1_WGM1
    SolutionIndex: 1
    SolutionNameMin: Cijk_Alik_Bljk_HHS_BH_MT16x16x32_MI16x16x16x1_SE_1LDSB1_AF0EM1_AF1EM1_AMAS3_EPS0_GRVW8_GSU1_GSUAMB_LBSPP128_LPA16_LPB16_LRVW8_LDW0_MAC_PGR2_PLR2_SIA3_SS0_SU0_SUS0_SRVW0_SVW4_TT1_16_VAW2_VW2_WSGRA1_WSGRB1_WG16_4_1_WGM1
    SolutionIndex: 2
    SolutionNameMin: Cijk_Alik_Bljk_HHS_BH_MT16x16x128_MI16x16x16x1_SE_1LDSB0_AF0EM8_AF1EM1_AMAS3_EPS0_GRVW8_GSU1_GSUAMB_LBSPP256_LPA16_LPB16_LRVW8_LDW0_MAC_PGR2_PLR9_SIA3_SS0_SU0_SUS0_SRVW0_SVW4_TT1_16_VAW2_VW2_WSGRA1_WSGRB1_WG16_4_1_WGM15
    SolutionIndex: 3
    SolutionNameMin: Cijk_Alik_Bljk_HHS_BH_MT64x64x32_MI32x32x8x1_SE_1LDSB1_AF0EM8_AF1EM1_AMAS3_EPS1_GRVW8_GSU1_GSUAMB_LBSPP128_LPA8_LPB8_LRVW8_LDW0_MAC_PGR1_PLR5_SIA3_SS0_SU0_SUS0_SRVW4_SVW4_TT1_32_VAW2_VW2_WSGRA1_WSGRB1_WG64_4_1_WGM1
    SolutionIndex: 4
    SolutionNameMin: Cijk_Alik_Bljk_HHS_BH_MT64x32x64_MI16x16x16x1_SE_1LDSB0_AF0EM8_AF1EM1_AMAS3_EPS0_GRVW8_GSU1_GSUAMB_LBSPP128_LPA16_LPB16_LRVW8_LDW0_MAC_PGR2_PLR5_SIA3_SS0_SU32_SUS128_SRVW4_SVW4_TT2_16_VAW2_VW2_WSGRA1_WSGRB1_WG32_8_1_WGM1
    SolutionIndex: 5
    SolutionNameMin: Cijk_Alik_Bljk_HHS_BH_MT64x32x32_MI16x16x16x1_SE_1LDSB1_AF0EM8_AF1EM1_AMAS3_EPS1_GRVW8_GSU1_GSUAMB_LBSPP128_LPA16_LPB16_LRVW8_LDW0_MAC_PGR1_PLR2_SIA3_SS0_SU0_SUS0_SRVW4_SVW4_TT2_16_VAW2_VW2_WSGRA1_WSGRB1_WG32_8_1_WGM15
    SolutionIndex: 6
    SolutionNameMin: Cijk_Alik_Bljk_HHS_BH_MT16x16x32_MI16x16x16x1_SE_1LDSB1_AF0EM1_AF1EM1_AMAS3_EPS0_GRVW2_GSU1_GSUAMB_LBSPP128_LPA16_LPB16_LRVW8_LDW0_MAC_PGR2_PLR2_SIA3_SS0_SU0_SUS0_SRVW0_SVW4_TT1_16_VAW2_VW2_WSGRA1_WSGRB1_WG16_4_1_WGM2
    SolutionIndex: 7
    SolutionNameMin: Cijk_Alik_Bljk_HHS_BH_MT64x32x32_MI16x16x16x1_SE_1LDSB1_AF0EM8_AF1EM1_AMAS3_EPS1_GRVW8_GSU1_GSUAMB_LBSPP128_LPA16_LPB16_LRVW8_LDW0_MAC_PGR1_PLR2_SIA3_SS0_SU0_SUS0_SRVW4_SVW4_TT2_16_VAW2_VW2_WSGRA1_WSGRB1_WG32_8_1_WGM1
    SolutionIndex: 8
    SolutionNameMin: Cijk_Alik_Bljk_HHS_BH_MT16x16x128_MI16x16x16x1_SE_1LDSB1_AF0EM1_AF1EM1_AMAS3_EPS1_GRVW8_GSU1_GSUAMB_LBSPP256_LPA16_LPB16_LRVW8_LDW0_MAC_PGR1_PLR9_SIA3_SS0_SU0_SUS0_SRVW0_SVW4_TT1_16_VAW2_VW2_WSGRA1_WSGRB1_WG16_4_1_WGM2
    SolutionIndex: 9
    SolutionNameMin: Cijk_Alik_Bljk_HHS_BH_MT64x64x32_MI32x32x8x1_SE_1LDSB1_AF0EM8_AF1EM1_AMAS3_EPS0_GRVW2_GSU1_GSUAMB_LBSPP128_LPA8_LPB8_LRVW8_LDW0_MAC_PGR2_PLR5_SIA3_SS0_SU0_SUS0_SRVW4_SVW4_TT1_32_VAW2_VW2_WSGRA1_WSGRB1_WG64_4_1_WGM1
    SolutionIndex: 10
    SolutionNameMin: Cijk_Alik_Bljk_HHS_BH_MT64x32x32_MI16x16x16x1_SE_1LDSB1_AF0EM8_AF1EM1_AMAS3_EPS1_GRVW2_GSU1_GSUAMB_LBSPP128_LPA16_LPB16_LRVW8_LDW0_MAC_PGR1_PLR2_SIA3_SS0_SU0_SUS0_SRVW4_SVW4_TT2_16_VAW2_VW2_WSGRA1_WSGRB1_WG32_8_1_WGM1
    SolutionIndex: 11
    SolutionNameMin: Cijk_Alik_Bljk_HHS_BH_MT16x16x128_MI16x16x16x1_SE_1LDSB1_AF0EM1_AF1EM1_AMAS3_EPS1_GRVW8_GSU5_GSUAMB_LBSPP256_LPA16_LPB16_LRVW8_LDW0_MAC_PGR1_PLR9_SIA3_SS0_SU0_SUS0_SRVW0_SVW4_TT1_16_VAW1_VW2_WSGRA1_WSGRB1_WG16_4_1_WGM2
    SolutionIndex: 12
    SolutionNameMin: Cijk_Alik_Bljk_HHS_BH_MT64x32x64_MI16x16x16x1_SE_1LDSB1_AF0EM1_AF1EM1_AMAS3_EPS1_GRVW8_GSU1_GSUAMB_LBSPP128_LPA16_LPB16_LRVW8_LDW0_MAC_PGR1_PLR5_SIA3_SS0_SU0_SUS0_SRVW4_SVW4_TT2_16_VAW2_VW2_WSGRA1_WSGRB1_WG32_8_1_WGM1
    SolutionIndex: 13
    SolutionNameMin: Cijk_Alik_Bljk_HHS_BH_MT64x32x32_MI16x16x16x1_SE_1LDSB1_AF0EM8_AF1EM1_AMAS3_EPS0_GRVW2_GSU1_GSUAMB_LBSPP128_LPA16_LPB16_LRVW8_LDW0_MAC_PGR2_PLR2_SIA3_SS0_SU0_SUS0_SRVW4_SVW4_TT2_16_VAW2_VW2_WSGRA1_WSGRB1_WG32_8_1_WGM2
    SolutionIndex: 14
    SolutionNameMin: Cijk_Alik_Bljk_HHS_BH_MT32x32x32_MI16x16x16x1_SE_1LDSB1_AF0EM8_AF1EM1_AMAS3_EPS0_GRVW2_GSU1_GSUAMB_LBSPP128_LPA16_LPB16_LRVW8_LDW0_MAC_PGR2_PLR2_SIA3_SS0_SU0_SUS0_SRVW4_SVW4_TT1_16_VAW2_VW2_WSGRA1_WSGRB1_WG32_8_1_WGM1
- - - [9, 1, 2048, 144]
    - [6, 102.282]
  - - [9, 1, 1024, 576]
    - [1, 202.033]
  - - [9, 1, 512, 2304]
    - [8, 337.101]
  - - [9, 1, 256, 9216]
    - [11, 461.958]
  - - [32, 32, 4096, 144]
    - [14, 7263.39]
  - - [32, 32, 2048, 576]
    - [4, 11388.5]
  - - [32, 32, 1024, 2304]
    - [8, 16726.3]
  - - [32, 32, 512, 9216]
    - [2, 17631.7]
  - - [32, 144, 32768, 144]
    - [14, 13464.3]
  - - [32, 144, 8192, 144]
    - [14, 13010.3]
  - - [32, 144, 16384, 144]
    - [14, 13328.7]
  - - [32, 144, 4096, 144]
    - [14, 12563.3]
  - - [64, 147, 768, 147]
    - [9, 12214.8]
  - - [144, 32, 4096, 32]
    - [7, 8663.68]
  - - [144, 144, 32768, 32]
    - [0, 12430.5]
  - - [144, 144, 16384, 32]
    - [0, 12312.9]
  - - [144, 144, 4096, 32]
    - [0, 11567.2]
  - - [144, 144, 8192, 32]
    - [3, 12074.1]
  - - [147, 147, 768, 64]
    - [12, 10017.3]
  - - [576, 32, 2048, 32]
    - [13, 10425.7]
  - - [2304, 32, 1024, 32]
    - [10, 9690.91]
  - - [9216, 32, 512, 32]
    - [5, 9935.83]
- null
- null
- DeviceEfficiency
- null
- Equality
