library/src/blas3/Tensile/Logic/asm_miopen/vega10_Cijk_Ailk_Bljk_HB.yaml
- {MinimumRequiredVersion: 4.4.0}
- vega10
- gfx900
- [Device 6863, Device 6862, Device 687f, Device 6860, Device 6861, 'Vega 10 XTX [Radeon
    SolutionIndex: 0
    SolutionNameMin: Cijk_Ailk_Bljk_HB_MT032x128x32_GRVW02_TT04_04_VW04_WGM08
    SolutionIndex: 1
    SolutionNameMin: Cijk_Ailk_Bljk_HB_MT128x032x32_GRVW08_TT04_04_VW04_WGM08
    SolutionIndex: 2
    SolutionNameMin: Cijk_Ailk_Bljk_HB_MT128x032x32_GRVW02_TT04_04_VW04_WGM01
    SolutionIndex: 3
    SolutionNameMin: Cijk_Ailk_Bljk_HB_MT064x064x32_GRVW08_TT04_04_VW04_WGM64
    SolutionIndex: 4
    SolutionNameMin: Cijk_Ailk_Bljk_HB_MT256x064x08_GRVW02_TT08_08_VW08_WGM01
    SolutionIndex: 5
    SolutionNameMin: Cijk_Ailk_Bljk_HB_MT128x064x16_GRVW08_TT08_04_VW04_WGM08
    SolutionIndex: 6
    SolutionNameMin: Cijk_Ailk_Bljk_HB_MT128x064x16_GRVW08_TT08_04_VW04_WGM01
    SolutionIndex: 7
    SolutionNameMin: Cijk_Ailk_Bljk_HB_MT256x032x08_GRVW08_TT08_04_VW04_WGM08
    SolutionIndex: 8
    SolutionNameMin: Cijk_Ailk_Bljk_HB_MT128x032x16_GRVW08_TT04_04_VW04_WGM64
    SolutionIndex: 9
    SolutionNameMin: Cijk_Ailk_Bljk_HB_MT128x064x16_GRVW08_TT08_04_VW04_WGM01
    SolutionIndex: 10
    SolutionNameMin: Cijk_Ailk_Bljk_HB_MT064x128x16_GRVW08_TT08_04_VW04_WGM08
    SolutionIndex: 11
    SolutionNameMin: Cijk_Ailk_Bljk_HB_MT128x064x32_GRVW08_TT08_04_VW04_WGM64
    SolutionIndex: 12
    SolutionNameMin: Cijk_Ailk_Bljk_HB_MT064x064x16_GRVW08_TT04_04_VW04_WGM01
    SolutionIndex: 13
    SolutionNameMin: Cijk_Ailk_Bljk_HB_MT128x032x16_GRVW08_TT04_04_VW04_WGM64
    SolutionIndex: 14
    SolutionNameMin: Cijk_Ailk_Bljk_HB_MT128x064x16_GRVW08_TT08_04_VW04_WGM01
    SolutionIndex: 15
    SolutionNameMin: Cijk_Ailk_Bljk_HB_MT128x032x16_GRVW08_TT04_04_VW04_WGM01
    SolutionIndex: 16
    SolutionNameMin: Cijk_Ailk_Bljk_HB_MT064x128x32_GRVW08_TT08_04_VW04_WGM01
    SolutionIndex: 17
    SolutionNameMin: Cijk_Ailk_Bljk_HB_MT064x032x16_GRVW08_TT04_04_VW04_WGM64
    SolutionIndex: 18
    SolutionNameMin: Cijk_Ailk_Bljk_HB_MT256x032x16_GRVW08_TT08_04_VW04_WGM01
    SolutionIndex: 19
    SolutionNameMin: Cijk_Ailk_Bljk_HB_MT064x064x32_GRVW08_TT04_04_VW04_WGM01
    SolutionIndex: 20
    SolutionNameMin: Cijk_Ailk_Bljk_HB_MT128x032x32_GRVW08_TT04_04_VW04_WGM64
    SolutionIndex: 21
    SolutionNameMin: Cijk_Ailk_Bljk_HB_MT128x128x16_GRVW08_TT08_08_VW08_WGM64
    SolutionIndex: 22
    SolutionNameMin: Cijk_Ailk_Bljk_HB_MT064x032x16_GRVW08_TT04_04_VW04_WGM08
    SolutionIndex: 23
    SolutionNameMin: Cijk_Ailk_Bljk_HB_MT064x064x32_GRVW02_TT04_04_VW02_WGM01
    SolutionIndex: 24
    SolutionNameMin: Cijk_Ailk_Bljk_HB_MT064x064x32_GRVW02_TT04_04_VW04_WGM01
    SolutionIndex: 25
    SolutionNameMin: Cijk_Ailk_Bljk_HB_MT256x064x08_GRVW08_TT08_08_VW08_WGM01
    SolutionIndex: 26
    SolutionNameMin: Cijk_Ailk_Bljk_HB_MT128x064x32_GRVW08_TT08_04_VW04_WGM01
    SolutionIndex: 27
    SolutionNameMin: Cijk_Ailk_Bljk_HB_MT064x064x32_GRVW08_TT04_04_VW04_WGM64
    SolutionIndex: 28
    SolutionNameMin: Cijk_Ailk_Bljk_HB_MT128x032x32_GRVW02_TT04_04_VW04_WGM01
    SolutionIndex: 29
    SolutionNameMin: Cijk_Ailk_Bljk_HB_MT064x032x32_GRVW02_TT04_04_VW04_WGM01
    SolutionIndex: 30
    SolutionNameMin: Cijk_Ailk_Bljk_HB_MT256x064x08_GRVW08_TT08_08_VW08_WGM08
    SolutionIndex: 31
    SolutionNameMin: Cijk_Ailk_Bljk_HB_MT256x064x08_GRVW08_TT08_08_VW08_WGM01
    SolutionIndex: 32
    SolutionNameMin: Cijk_Ailk_Bljk_HB_MT128x064x16_GRVW08_TT08_04_VW04_WGM64
    SolutionIndex: 33
    SolutionNameMin: Cijk_Ailk_Bljk_HB_MT064x064x32_GRVW02_TT04_04_VW04_WGM64
    SolutionIndex: 34
    SolutionNameMin: Cijk_Ailk_Bljk_HB_MT256x064x08_GRVW08_TT08_08_VW08_WGM08
    SolutionIndex: 35
    SolutionNameMin: Cijk_Ailk_Bljk_HB_MT064x064x32_GRVW02_TT04_04_VW04_WGM64
    SolutionIndex: 36
    SolutionNameMin: Cijk_Ailk_Bljk_HB_MT128x064x16_GRVW08_TT08_04_VW04_WGM64
    SolutionIndex: 37
    SolutionNameMin: Cijk_Ailk_Bljk_HB_MT128x128x16_GRVW08_TT08_08_VW08_WGM01
    SolutionIndex: 38
    SolutionNameMin: Cijk_Ailk_Bljk_HB_MT256x064x08_GRVW02_TT08_08_VW08_WGM01
    SolutionIndex: 39
    SolutionNameMin: Cijk_Ailk_Bljk_HB_MT064x032x08_GRVW08_TT04_04_VW04_WGM64
    SolutionIndex: 40
    SolutionNameMin: Cijk_Ailk_Bljk_HB_MT256x064x08_GRVW08_TT08_08_VW08_WGM08
    SolutionIndex: 41
    SolutionNameMin: Cijk_Ailk_Bljk_HB_MT064x032x32_GRVW08_TT04_04_VW04_WGM01
    SolutionIndex: 42
    SolutionNameMin: Cijk_Ailk_Bljk_HB_MT128x032x32_GRVW08_TT04_04_VW04_WGM01
    SolutionIndex: 43
    SolutionNameMin: Cijk_Ailk_Bljk_HB_MT128x032x32_GRVW08_TT04_04_VW04_WGM08
    SolutionIndex: 44
    SolutionNameMin: Cijk_Ailk_Bljk_HB_MT128x032x32_GRVW02_TT04_04_VW04_WGM08
    SolutionIndex: 45
    SolutionNameMin: Cijk_Ailk_Bljk_HB_MT064x064x16_GRVW02_TT04_04_VW04_WGM64
    SolutionIndex: 46
    SolutionNameMin: Cijk_Ailk_Bljk_HB_MT128x064x16_GRVW08_TT08_04_VW04_WGM01
    SolutionIndex: 47
    SolutionNameMin: Cijk_Ailk_Bljk_HB_MT064x128x08_GRVW04_TT04_08_VW04_WGM08
    SolutionIndex: 48
    SolutionNameMin: Cijk_Ailk_Bljk_HB_MT128x128x16_GRVW08_TT08_08_VW08_WGM08
    SolutionIndex: 49
    SolutionNameMin: Cijk_Ailk_Bljk_HB_MT128x064x08_GRVW04_TT08_04_VW04_WGM08
- - - [196, 192, 16, 512]
    - [15, 9763.8]
  - - [6272, 512, 1, 128]
    - [9, 13287.7]
  - - [784, 128, 8, 512]
    - [15, 10988.8]
  - - [784, 512, 16, 128]
    - [10, 15131.2]
  - - [3136, 256, 1, 1024]
    - [18, 12155.9]
  - - [12544, 512, 1, 128]
    - [5, 15857.7]
  - - [100352, 64, 1, 64]
    - [30, 10222.8]
  - - [3136, 64, 16, 256]
    - [20, 13778.6]
  - - [784, 128, 16, 512]
    - [3, 13426.6]
  - - [3136, 256, 8, 64]
    - [6, 13047.8]
  - - [784, 2048, 1, 512]
    - [13, 13828.1]
  - - [3136, 64, 8, 256]
    - [15, 12324.4]
  - - [2048, 512, 64, 49]
    - [4, 14935.7]
  - - [784, 256, 1, 832]
    - [45, 5797.92]
  - - [512, 1024, 64, 196]
    - [31, 21343.7]
  - - [49, 512, 16, 512]
    - [29, 4865.44]
  - - [200704, 64, 1, 64]
    - [7, 10988.9]
  - - [128, 512, 64, 784]
    - [32, 20000.5]
  - - [49, 256, 16, 832]
    - [45, 5288.72]
  - - [3136, 2048, 1, 512]
    - [5, 19068.5]
  - - [196, 256, 16, 256]
    - [15, 8811.14]
  - - [3136, 256, 1, 256]
    - [39, 9965.75]
  - - [3136, 1024, 1, 256]
    - [6, 15111.5]
  - - [64, 256, 64, 3136]
    - [45, 15728.3]
  - - [3025, 64, 64, 64]
    - [43, 10630.2]
  - - [784, 512, 1, 2048]
    - [42, 10158.4]
  - - [196, 1024, 64, 256]
    - [6, 15483.5]
  - - [12544, 64, 8, 64]
    - [6, 11137.0]
  - - [784, 512, 64, 128]
    - [16, 17703.3]
  - - [128, 256, 64, 3136]
    - [46, 19871.6]
  - - [49, 512, 8, 2048]
    - [33, 3245.46]
  - - [1024, 256, 64, 196]
    - [25, 20236.8]
  - - [256, 1024, 64, 196]
    - [4, 20122.3]
  - - [256, 64, 64, 3136]
    - [11, 17222.0]
  - - [784, 512, 8, 128]
    - [6, 12989.0]
  - - [784, 64, 16, 192]
    - [22, 9184.49]
  - - [196, 1024, 16, 256]
    - [6, 12592.9]
  - - [50176, 64, 1, 256]
    - [8, 13894.6]
  - - [196, 256, 64, 1024]
    - [20, 13204.2]
  - - [512, 128, 64, 784]
    - [21, 20113.6]
  - - [196, 256, 8, 1024]
    - [2, 8537.93]
  - - [392, 2048, 1, 512]
    - [15, 11180.2]
  - - [196, 1024, 8, 256]
    - [14, 10804.0]
  - - [256, 512, 64, 784]
    - [37, 21889.3]
  - - [49, 512, 64, 2048]
    - [23, 5866.68]
  - - [1568, 256, 1, 256]
    - [15, 7153.79]
  - - [196, 256, 16, 1024]
    - [28, 9888.99]
  - - [49, 512, 16, 2048]
    - [42, 3712.36]
  - - [512, 2048, 64, 49]
    - [38, 15501.6]
  - - [196, 256, 8, 256]
    - [15, 6881.08]
  - - [12544, 128, 1, 512]
    - [13, 14149.7]
  - - [784, 512, 1, 512]
    - [15, 8550.54]
  - - [1568, 256, 1, 1024]
    - [13, 9730.88]
  - - [6272, 128, 1, 512]
    - [17, 11468.4]
  - - [49, 2048, 16, 512]
    - [0, 7816.29]
  - - [392, 512, 1, 2048]
    - [1, 6181.96]
  - - [392, 512, 1, 512]
    - [13, 4737.84]
  - - [49, 512, 8, 512]
    - [41, 4036.43]
  - - [50176, 256, 1, 64]
    - [36, 14764.2]
  - - [3136, 256, 16, 64]
    - [6, 14801.8]
  - - [3136, 192, 1, 512]
    - [15, 10321.8]
  - - [1568, 1024, 1, 256]
    - [19, 12648.1]
  - - [12544, 64, 16, 64]
    - [40, 12541.2]
  - - [64, 64, 64, 3136]
    - [27, 9406.27]
  - - [3025, 256, 64, 64]
    - [26, 16314.7]
  - - [25088, 64, 1, 256]
    - [13, 12246.2]
  - - [49, 2048, 64, 512]
    - [35, 11548.7]
  - - [3136, 512, 1, 2048]
    - [44, 13882.1]
  - - [12544, 64, 1, 192]
    - [12, 9342.95]
  - - [25088, 256, 1, 64]
    - [34, 12844.8]
  - - [49, 2048, 8, 512]
    - [24, 6110.06]
- - - -1
    - - - -1
        - - - 64
            - - [128, 47]
              - [3584, 49]
              - [-1, 47]
          - - 128
            - - [-1, 49]
          - - 256
            - - [5888, 49]
              - [-1, 48]
          - - 448
            - - [128, 47]
              - [448, 49]
              - [704, 47]
              - [2944, 49]
              - [3584, 48]
              - [4288, 47]
              - [5056, 49]
              - [5888, 48]
              - [-1, 49]
          - - 704
            - - [1024, 49]
              - [1408, 47]
              - [1856, 49]
              - [2368, 48]
              - [5888, 47]
              - [-1, 48]
          - - 1024
            - - [1408, 49]
              - [1856, 48]
              - [2368, 49]
              - [3584, 48]
              - [4288, 49]
              - [-1, 48]
          - - 1408
            - - [1024, 49]
              - [1408, 48]
              - [2368, 49]
              - [5888, 48]
              - [-1, 49]
          - - 1856
            - - [704, 49]
              - [1024, 48]
              - [1408, 47]
              - [2944, 49]
              - [4288, 48]
              - [5056, 49]
              - [5888, 48]
              - [-1, 49]
          - - 2368
            - - [64, 49]
              - [128, 47]
              - [448, 49]
              - [704, 48]
              - [2368, 49]
              - [2944, 48]
              - [4288, 49]
              - [-1, 48]
          - - 2944
            - - [704, 49]
              - [1408, 48]
              - [1856, 49]
              - [2368, 48]
              - [5056, 49]
              - [-1, 48]
          - - 3584
            - - [256, 49]
              - [448, 48]
              - [1024, 49]
              - [1408, 48]
              - [3584, 49]
              - [4288, 48]
              - [5056, 49]
              - [-1, 48]
          - - 4288
            - - [1024, 49]
              - [1856, 48]
              - [2368, 49]
              - [3584, 48]
              - [5056, 49]
              - [-1, 48]
          - - 5056
            - - [704, 49]
              - [1408, 48]
              - [1856, 49]
              - [2368, 48]
              - [2944, 49]
              - [3584, 48]
              - [4288, 49]
              - [-1, 48]
          - - 5888
            - - [256, 49]
              - [448, 48]
              - [704, 49]
              - [1408, 48]
              - [2368, 49]
              - [-1, 48]
          - - -1
            - - [128, 49]
              - [256, 48]
              - [448, 49]
              - [1024, 48]
              - [1856, 49]
              - [-1, 48]
