library/src/blas3/Tensile/Logic/asm_miopen/vega10_Cijk_Alik_Bljk_SB.yaml
- {MinimumRequiredVersion: 4.4.0}
- vega10
- gfx900
- [Device 6863, Device 6862, Device 687f, Device 6860, Device 6861, 'Vega 10 XTX [Radeon
    SolutionIndex: 0
    SolutionNameMin: Cijk_Alik_Bljk_SB_MT032x032x32_GSU01
    SolutionIndex: 1
    SolutionNameMin: Cijk_Alik_Bljk_SB_MT064x064x16_GSU04
    SolutionIndex: 2
    SolutionNameMin: Cijk_Alik_Bljk_SB_MT064x032x16_GSU01
    SolutionIndex: 3
    SolutionNameMin: Cijk_Alik_Bljk_SB_MT064x064x16_GSU01
    SolutionIndex: 4
    SolutionNameMin: Cijk_Alik_Bljk_SB_MT128x064x08_GSU01
    SolutionIndex: 5
    SolutionNameMin: Cijk_Alik_Bljk_SB_MT064x128x08_GSU01
    SolutionIndex: 6
    SolutionNameMin: Cijk_Alik_Bljk_SB_MT032x032x32_GSU02
    SolutionIndex: 7
    SolutionNameMin: Cijk_Alik_Bljk_SB_MT064x064x16_GSU02
    SolutionIndex: 8
    SolutionNameMin: Cijk_Alik_Bljk_SB_MT128x128x08_GSU01
    SolutionIndex: 9
    SolutionNameMin: Cijk_Alik_Bljk_SB_MT008x008x08_GSU08
- - - [256, 3136, 64, 128]
    - [3, 9959.89]
  - - [128, 784, 64, 512]
    - [2, 5997.78]
  - - [1024, 196, 64, 512]
    - [3, 6718.63]
  - - [2048, 49, 64, 512]
    - [0, 4096.48]
  - - [64, 3136, 64, 256]
    - [0, 5606.42]
  - - [256, 3136, 64, 64]
    - [3, 8401.01]
  - - [1024, 196, 64, 256]
    - [3, 7459.93]
  - - [512, 784, 64, 256]
    - [3, 9267.83]
  - - [64, 3136, 64, 64]
    - [3, 4835.92]
  - - [512, 784, 64, 128]
    - [3, 9226.43]
  - - [512, 49, 64, 2048]
    - [1, 3400.1]
  - - [256, 196, 64, 1024]
    - [6, 4175.23]
- - - -1
    - - - -1
        - - - 4
            - - [-1, 9]
          - - 64
            - - [4, 9]
              - [1024, 6]
              - [2944, 1]
              - [5888, 7]
              - [-1, 3]
          - - 128
            - - [4, 9]
              - [704, 6]
              - [1408, 1]
              - [1856, 2]
              - [2368, 1]
              - [2944, 7]
              - [3584, 3]
              - [5056, 7]
              - [5888, 3]
              - [-1, 7]
          - - 256
            - - [4, 9]
              - [256, 6]
              - [448, 0]
              - [1408, 2]
              - [1856, 3]
              - [2368, 7]
              - [2944, 3]
              - [3584, 4]
              - [5056, 3]
              - [5888, 4]
              - [-1, 8]
          - - 448
            - - [4, 9]
              - [128, 6]
              - [704, 1]
              - [1024, 3]
              - [2368, 7]
              - [2944, 4]
              - [4288, 7]
              - [5056, 4]
              - [5888, 8]
              - [-1, 3]
          - - 704
            - - [4, 9]
              - [448, 1]
              - [1024, 3]
              - [1408, 5]
              - [1856, 3]
              - [2368, 7]
              - [4288, 3]
              - [5056, 8]
              - [5888, 3]
              - [-1, 8]
          - - 1024
            - - [4, 9]
              - [64, 0]
              - [128, 7]
              - [256, 2]
              - [704, 3]
              - [1408, 4]
              - [1856, 8]
              - [2368, 4]
              - [2944, 8]
              - [4288, 4]
              - [-1, 8]
          - - 1408
            - - [4, 9]
              - [128, 1]
              - [448, 7]
              - [704, 4]
              - [1024, 7]
              - [1408, 8]
              - [2368, 3]
              - [-1, 8]
          - - 1856
            - - [4, 9]
              - [128, 1]
              - [256, 3]
              - [448, 1]
              - [704, 3]
              - [1024, 8]
              - [1408, 3]
              - [2944, 4]
              - [-1, 8]
          - - 2368
            - - [4, 9]
              - [448, 1]
              - [704, 7]
              - [1408, 4]
              - [1856, 3]
              - [3584, 8]
              - [4288, 4]
              - [-1, 8]
          - - 2944
            - - [4, 9]
              - [64, 1]
              - [128, 7]
              - [256, 3]
              - [448, 1]
              - [704, 4]
              - [1408, 8]
              - [1856, 4]
              - [2368, 8]
              - [2944, 4]
              - [-1, 8]
          - - 3584
            - - [4, 9]
              - [64, 2]
              - [128, 3]
              - [256, 4]
              - [448, 3]
              - [1024, 4]
              - [-1, 8]
          - - 4288
            - - [4, 9]
              - [64, 7]
              - [704, 1]
              - [1024, 4]
              - [1856, 8]
              - [2368, 4]
              - [-1, 8]
          - - 5056
            - - [4, 9]
              - [64, 7]
              - [128, 1]
              - [256, 3]
              - [448, 1]
              - [704, 4]
              - [2368, 8]
              - [2944, 5]
              - [3584, 8]
              - [4288, 5]
              - [5888, 8]
              - [-1, 5]
          - - 5888
            - - [4, 9]
              - [64, 7]
              - [128, 3]
              - [256, 5]
              - [448, 8]
              - [704, 4]
              - [2368, 8]
              - [2944, 5]
              - [-1, 8]
          - - -1
            - - [4, 9]
              - [64, 3]
              - [128, 7]
              - [256, 8]
              - [448, 3]
              - [1024, 8]
              - [1408, 5]
              - [4288, 8]
              - [5056, 5]
              - [5888, 8]
              - [-1, 5]
