library/src/blas3/Tensile/Logic/asm_miopen/vega10_Cijk_Ailk_Bljk_SB.yaml
- {MinimumRequiredVersion: 4.1.1}
- vega10
- gfx900
- [Device 6863, Device 6862, Device 687f, Device 6860]
- - - [3025, 64, 64, 64]
    - [7, 5392.21]
  - - [784, 512, 64, 128]
    - [7, 9115.14]
  - - [3136, 2048, 1, 512]
    - [2, 9577.7]
  - - [3025, 256, 64, 64]
    - [7, 8360.71]
  - - [196, 1024, 64, 256]
    - [7, 7676.14]
  - - [50176, 512, 1, 128]
    - [1, 9908.1]
  - - [193600, 64, 1, 64]
    - [5, 5890.68]
  - - [49, 512, 64, 2048]
    - [7, 3422.99]
  - - [12544, 256, 1, 1024]
    - [4, 8964.93]
  - - [196, 256, 64, 1024]
    - [7, 6089.97]
  - - [49, 2048, 64, 512]
    - [7, 5027.85]
  - - [12544, 1024, 1, 256]
    - [0, 10255.3]
  - - [3136, 512, 1, 2048]
    - [3, 8095.44]
  - - [193600, 256, 1, 64]
    - [6, 8829.03]
- null
