library/src/blas3/Tensile/Logic/asm_miopen/vega10_Cijk_Ailk_Bljk_SB.yaml
- {MinimumRequiredVersion: 4.1.1}
- vega10
- gfx900
- [Device 6863, Device 6862, Device 687f, Device 6860]
    SolutionIndex: 0
    SolutionNameMin: Cijk_Ailk_Bljk_SB_MT032x032x32_DTL0_GRVW04_LPB00_PBC0_PGR1_TT04_04_USFGRO00_VW04_WG08_08_04
    SolutionIndex: 1
    SolutionNameMin: Cijk_Ailk_Bljk_SB_MT064x128x08_DTL0_GRVW04_LPB00_PBC0_PGR1_TT04_08_USFGRO00_VW04_WG16_16_01
    SolutionIndex: 2
    SolutionNameMin: Cijk_Ailk_Bljk_SB_MT064x064x16_DTL0_GRVW04_LPB00_PBC0_PGR1_TT04_04_USFGRO00_VW04_WG16_16_01
    SolutionIndex: 3
    SolutionNameMin: Cijk_Ailk_Bljk_SB_MT064x064x16_DTL0_GRVW04_LPB00_PBC0_PGR1_TT04_04_USFGRO00_VW04_WG16_16_01
    SolutionIndex: 4
    SolutionNameMin: Cijk_Ailk_Bljk_SB_MT064x032x32_DTL0_GRVW04_LPB00_PBC0_PGR1_TT08_04_USFGRO00_VW04_WG08_08_04
    SolutionIndex: 5
    SolutionNameMin: Cijk_Ailk_Bljk_SB_MT128x064x08_DTL0_GRVW04_LPB00_PBC0_PGR1_TT08_04_USFGRO00_VW04_WG16_16_01
    SolutionIndex: 6
    SolutionNameMin: Cijk_Ailk_Bljk_SB_MT064x064x16_DTL0_GRVW04_LPB00_PBC0_PGR1_TT04_04_USFGRO00_VW04_WG16_16_01
    SolutionIndex: 7
    SolutionNameMin: Cijk_Ailk_Bljk_SB_MT064x032x32_DTL0_GRVW04_LPB00_PBC0_PGR1_TT08_04_USFGRO00_VW04_WG08_08_04
    SolutionIndex: 8
    SolutionNameMin: Cijk_Ailk_Bljk_SB_MT064x064x16_DTL0_GRVW04_LPB00_PBC0_PGR0_TT04_04_USFGRO00_VW04_WG16_16_01
    SolutionIndex: 9
    SolutionNameMin: Cijk_Ailk_Bljk_SB_MT128x064x16_DTL0_GRVW04_LPB04_PBC0_PGR0_TT08_04_USFGRO00_VW04_WG16_16_01
    SolutionIndex: 10
    SolutionNameMin: Cijk_Ailk_Bljk_SB_MT128x032x16_DTL1_GRVW01_LPB02_PBC1_PGR0_TT04_04_USFGRO01_VW01_WG32_08_01
    SolutionIndex: 11
    SolutionNameMin: Cijk_Ailk_Bljk_SB_MT128x032x16_DTL1_GRVW01_LPB04_PBC1_PGR0_TT04_04_USFGRO01_VW01_WG32_08_01
    SolutionIndex: 12
    SolutionNameMin: Cijk_Ailk_Bljk_SB_MT064x064x16_DTL0_GRVW04_LPB02_PBC0_PGR0_TT04_04_USFGRO00_VW02_WG16_16_01
    SolutionIndex: 13
    SolutionNameMin: Cijk_Ailk_Bljk_SB_MT064x032x16_DTL1_GRVW01_LPB02_PBC1_PGR0_TT04_04_USFGRO01_VW01_WG16_08_01
    SolutionIndex: 14
    SolutionNameMin: Cijk_Ailk_Bljk_SB_MT064x032x16_DTL0_GRVW04_LPB02_PBC0_PGR0_TT04_04_USFGRO00_VW02_WG16_08_01
    SolutionIndex: 15
    SolutionNameMin: Cijk_Ailk_Bljk_SB_MT064x064x16_DTL1_GRVW01_LPB04_PBC1_PGR0_TT04_04_USFGRO01_VW04_WG16_16_01
    SolutionIndex: 16
    SolutionNameMin: Cijk_Ailk_Bljk_SB_MT128x032x16_DTL1_GRVW01_LPB04_PBC1_PGR0_TT04_04_USFGRO01_VW04_WG32_08_01
    SolutionIndex: 17
    SolutionNameMin: Cijk_Ailk_Bljk_SB_MT128x064x16_DTL1_GRVW01_LPB01_PBC1_PGR0_TT08_04_USFGRO01_VW01_WG16_16_01
    SolutionIndex: 18
    SolutionNameMin: Cijk_Ailk_Bljk_SB_MT128x064x16_DTL0_GRVW04_LPB04_PBC0_PGR0_TT08_04_USFGRO00_VW01_WG16_16_01
    SolutionIndex: 19
    SolutionNameMin: Cijk_Ailk_Bljk_SB_MT128x032x16_DTL1_GRVW01_LPB02_PBC1_PGR0_TT04_04_USFGRO01_VW02_WG32_08_01
    SolutionIndex: 20
    SolutionNameMin: Cijk_Ailk_Bljk_SB_MT064x064x16_DTL0_GRVW04_LPB04_PBC0_PGR0_TT04_04_USFGRO00_VW04_WG16_16_01
    SolutionIndex: 21
    SolutionNameMin: Cijk_Ailk_Bljk_SB_MT128x032x16_DTL0_GRVW04_LPB04_PBC0_PGR0_TT04_04_USFGRO00_VW04_WG32_08_01
    SolutionIndex: 22
    SolutionNameMin: Cijk_Ailk_Bljk_SB_MT256x032x16_DTL1_GRVW01_LPB02_PBC1_PGR0_TT08_04_USFGRO01_VW02_WG32_08_01
    SolutionIndex: 23
    SolutionNameMin: Cijk_Ailk_Bljk_SB_MT064x032x16_DTL0_GRVW04_LPB04_PBC0_PGR1_TT04_04_USFGRO00_VW04_WG16_08_01
    SolutionIndex: 24
    SolutionNameMin: Cijk_Ailk_Bljk_SB_MT128x064x16_DTL1_GRVW01_LPB02_PBC1_PGR0_TT04_08_USFGRO01_VW02_WG32_08_01
- - - [2048, 512, 64, 49]
    - [17, 7394.66]
  - - [256, 64, 64, 3136]
    - [14, 7491.19]
  - - [128, 512, 64, 784]
    - [15, 10222.7]
  - - [64, 256, 64, 3136]
    - [8, 7628.89]
  - - [512, 1024, 64, 196]
    - [20, 10707.9]
  - - [3136, 2048, 1, 512]
    - [21, 10313.5]
  - - [784, 512, 64, 128]
    - [20, 10083.0]
  - - [3025, 256, 64, 64]
    - [19, 7994.9]
  - - [196, 1024, 64, 256]
    - [20, 8313.86]
  - - [512, 128, 64, 784]
    - [12, 10249.8]
  - - [256, 1024, 64, 196]
    - [20, 10547.5]
  - - [64, 64, 64, 3136]
    - [23, 3744.99]
  - - [49, 2048, 64, 512]
    - [13, 4343.37]
  - - [3136, 512, 1, 2048]
    - [16, 7510.81]
  - - [196, 256, 64, 1024]
    - [11, 5696.42]
  - - [3025, 64, 64, 64]
    - [22, 4402.75]
  - - [49, 512, 64, 2048]
    - [10, 3081.6]
  - - [512, 2048, 64, 49]
    - [24, 7748.43]
  - - [128, 256, 64, 3136]
    - [21, 9691.99]
  - - [256, 512, 64, 784]
    - [9, 11060.7]
  - - [1024, 256, 64, 196]
    - [18, 10013.5]
- - - -1
    - - - -1
        - - - 64
            - - [704, 0]
              - [1024, 4]
              - [1408, 0]
              - [1856, 4]
              - [2368, 2]
              - [3584, 7]
              - [4288, 6]
              - [5056, 4]
              - [5888, 7]
              - [-1, 3]
          - - 128
            - - [256, 0]
              - [1408, 4]
              - [1856, 7]
              - [2368, 4]
              - [2944, 7]
              - [3584, 3]
              - [4288, 4]
              - [5056, 7]
              - [5888, 3]
              - [-1, 6]
          - - 256
            - - [128, 0]
              - [704, 4]
              - [1408, 7]
              - [1856, 3]
              - [2368, 7]
              - [2944, 3]
              - [4288, 7]
              - [5056, 3]
              - [5888, 5]
              - [-1, 3]
          - - 448
            - - [64, 0]
              - [256, 4]
              - [448, 2]
              - [704, 4]
              - [1024, 3]
              - [3584, 6]
              - [4288, 1]
              - [5056, 3]
              - [5888, 6]
              - [-1, 1]
          - - 704
            - - [128, 0]
              - [256, 2]
              - [448, 4]
              - [1024, 3]
              - [1408, 1]
              - [1856, 3]
              - [2368, 6]
              - [5888, 1]
              - [-1, 5]
          - - 1024
            - - [64, 4]
              - [128, 6]
              - [256, 7]
              - [704, 3]
              - [-1, 5]
          - - 1408
            - - [64, 0]
              - [128, 2]
              - [448, 7]
              - [-1, 5]
          - - 1856
            - - [64, 4]
              - [128, 7]
              - [256, 3]
              - [448, 2]
              - [704, 3]
              - [1024, 2]
              - [1408, 1]
              - [2944, 5]
              - [3584, 1]
              - [5056, 5]
              - [5888, 1]
              - [-1, 5]
          - - 2368
            - - [128, 2]
              - [256, 6]
              - [448, 2]
              - [704, 6]
              - [5056, 5]
              - [-1, 1]
          - - 2944
            - - [128, 7]
              - [256, 3]
              - [448, 2]
              - [-1, 5]
          - - 3584
            - - [128, 3]
              - [256, 5]
              - [448, 3]
              - [-1, 5]
          - - 4288
            - - [64, 0]
              - [256, 2]
              - [5888, 5]
              - [-1, 1]
          - - 5056
            - - [128, 6]
              - [256, 3]
              - [448, 2]
              - [5056, 5]
              - [-1, 1]
          - - 5888
            - - [64, 7]
              - [128, 3]
              - [256, 5]
              - [448, 3]
              - [-1, 5]
          - - -1
            - - [64, 3]
              - [128, 6]
              - [256, 3]
              - [-1, 5]
