library/src/blas3/Tensile/Logic/asm_miopen/vega10_Cijk_Ailk_Bljk_SB.yaml
- {MinimumRequiredVersion: 4.4.0}
- vega10
- gfx900
- [Device 6863, Device 6862, Device 687f, Device 6860, Device 6861, 'Vega 10 XTX [Radeon
    SolutionIndex: 0
    SolutionNameMin: Cijk_Ailk_Bljk_SB_MT128x032x16_GSU03
    SolutionIndex: 1
    SolutionNameMin: Cijk_Ailk_Bljk_SB_MT064x064x16_GSU05
    SolutionIndex: 2
    SolutionNameMin: Cijk_Ailk_Bljk_SB_MT128x016x16_GSU01
    SolutionIndex: 3
    SolutionNameMin: Cijk_Ailk_Bljk_SB_MT128x064x16_GSU01
    SolutionIndex: 4
    SolutionNameMin: Cijk_Ailk_Bljk_SB_MT064x064x16_GSU01
    SolutionIndex: 5
    SolutionNameMin: Cijk_Ailk_Bljk_SB_MT064x064x16_GSU01
    SolutionIndex: 6
    SolutionNameMin: Cijk_Ailk_Bljk_SB_MT128x064x08_GSU01
    SolutionIndex: 7
    SolutionNameMin: Cijk_Ailk_Bljk_SB_MT128x032x08_GSU01
    SolutionIndex: 8
    SolutionNameMin: Cijk_Ailk_Bljk_SB_MT064x032x16_GSU01
    SolutionIndex: 9
    SolutionNameMin: Cijk_Ailk_Bljk_SB_MT064x064x16_GSU01
    SolutionIndex: 10
    SolutionNameMin: Cijk_Ailk_Bljk_SB_MT128x064x16_GSU01
    SolutionIndex: 11
    SolutionNameMin: Cijk_Ailk_Bljk_SB_MT064x064x16_GSU01
    SolutionIndex: 12
    SolutionNameMin: Cijk_Ailk_Bljk_SB_MT064x064x16_GSU01
    SolutionIndex: 13
    SolutionNameMin: Cijk_Ailk_Bljk_SB_MT064x032x16_GSU01
    SolutionIndex: 14
    SolutionNameMin: Cijk_Ailk_Bljk_SB_MT128x064x08_GSU01
    SolutionIndex: 15
    SolutionNameMin: Cijk_Ailk_Bljk_SB_MT064x064x16_GSU01
    SolutionIndex: 16
    SolutionNameMin: Cijk_Ailk_Bljk_SB_MT128x032x16_GSU05
    SolutionIndex: 17
    SolutionNameMin: Cijk_Ailk_Bljk_SB_MT064x032x16_GSU01
    SolutionIndex: 18
    SolutionNameMin: Cijk_Ailk_Bljk_SB_MT128x032x08_GSU01
    SolutionIndex: 19
    SolutionNameMin: Cijk_Ailk_Bljk_SB_MT128x064x08_GSU01
    SolutionIndex: 20
    SolutionNameMin: Cijk_Ailk_Bljk_SB_MT128x032x08_GSU01
    SolutionIndex: 21
    SolutionNameMin: Cijk_Ailk_Bljk_SB_MT064x064x16_GSU01
    SolutionIndex: 22
    SolutionNameMin: Cijk_Ailk_Bljk_SB_MT128x032x16_GSU01
    SolutionIndex: 23
    SolutionNameMin: Cijk_Ailk_Bljk_SB_MT064x032x16_GSU03
    SolutionIndex: 24
    SolutionNameMin: Cijk_Ailk_Bljk_SB_MT128x032x16_GSU05
    SolutionIndex: 25
    SolutionNameMin: Cijk_Ailk_Bljk_SB_MT064x032x16_GSU01
    SolutionIndex: 26
    SolutionNameMin: Cijk_Ailk_Bljk_SB_MT064x032x32_GSU01
    SolutionIndex: 27
    SolutionNameMin: Cijk_Ailk_Bljk_SB_MT256x032x08_GSU01
    SolutionIndex: 28
    SolutionNameMin: Cijk_Ailk_Bljk_SB_MT128x032x16_GSU01
    SolutionIndex: 29
    SolutionNameMin: Cijk_Ailk_Bljk_SB_MT128x032x08_GSU01
    SolutionIndex: 30
    SolutionNameMin: Cijk_Ailk_Bljk_SB_MT064x032x32_GSU05
    SolutionIndex: 31
    SolutionNameMin: Cijk_Ailk_Bljk_SB_MT064x032x32_GSU05
    SolutionIndex: 32
    SolutionNameMin: Cijk_Ailk_Bljk_SB_MT128x032x16_GSU01
    SolutionIndex: 33
    SolutionNameMin: Cijk_Ailk_Bljk_SB_MT064x016x32_GSU03
    SolutionIndex: 34
    SolutionNameMin: Cijk_Ailk_Bljk_SB_MT032x128x16_GSU01
    SolutionIndex: 35
    SolutionNameMin: Cijk_Ailk_Bljk_SB_MT128x064x16_GSU01
    SolutionIndex: 36
    SolutionNameMin: Cijk_Ailk_Bljk_SB_MT256x032x08_GSU01
    SolutionIndex: 37
    SolutionNameMin: Cijk_Ailk_Bljk_SB_MT064x064x16_GSU01
    SolutionIndex: 38
    SolutionNameMin: Cijk_Ailk_Bljk_SB_MT064x032x32_GSU03
    SolutionIndex: 39
    SolutionNameMin: Cijk_Ailk_Bljk_SB_MT064x032x16_GSU01
    SolutionIndex: 40
    SolutionNameMin: Cijk_Ailk_Bljk_SB_MT128x032x16_GSU05
    SolutionIndex: 41
    SolutionNameMin: Cijk_Ailk_Bljk_SB_MT128x032x08_GSU01
    SolutionIndex: 42
    SolutionNameMin: Cijk_Ailk_Bljk_SB_MT064x032x32_GSU01
    SolutionIndex: 43
    SolutionNameMin: Cijk_Ailk_Bljk_SB_MT064x016x32_GSU03
    SolutionIndex: 44
    SolutionNameMin: Cijk_Ailk_Bljk_SB_MT128x032x16_GSU01
    SolutionIndex: 45
    SolutionNameMin: Cijk_Ailk_Bljk_SB_MT128x032x32_GSU01
    SolutionIndex: 46
    SolutionNameMin: Cijk_Ailk_Bljk_SB_MT064x032x16_GSU01
    SolutionIndex: 47
    SolutionNameMin: Cijk_Ailk_Bljk_SB_MT064x128x16_GSU01
    SolutionIndex: 48
    SolutionNameMin: Cijk_Ailk_Bljk_SB_MT064x032x32_GSU01
    SolutionIndex: 49
    SolutionNameMin: Cijk_Ailk_Bljk_SB_MT128x064x16_GSU01
    SolutionIndex: 50
    SolutionNameMin: Cijk_Ailk_Bljk_SB_MT128x032x16_GSU03
    SolutionIndex: 51
    SolutionNameMin: Cijk_Ailk_Bljk_SB_MT128x032x16_GSU01
    SolutionIndex: 52
    SolutionNameMin: Cijk_Ailk_Bljk_SB_MT064x032x16_GSU05
    SolutionIndex: 53
    SolutionNameMin: Cijk_Ailk_Bljk_SB_MT032x064x16_GSU01
    SolutionIndex: 54
    SolutionNameMin: Cijk_Ailk_Bljk_SB_MT064x032x32_GSU01
    SolutionIndex: 55
    SolutionNameMin: Cijk_Ailk_Bljk_SB_MT032x032x32_GSU01
    SolutionIndex: 56
    SolutionNameMin: Cijk_Ailk_Bljk_SB_MT128x064x08_GSU01
    SolutionIndex: 57
    SolutionNameMin: Cijk_Ailk_Bljk_SB_MT032x032x32_GSU04
    SolutionIndex: 58
    SolutionNameMin: Cijk_Ailk_Bljk_SB_MT032x032x32_GSU08
    SolutionIndex: 59
    SolutionNameMin: Cijk_Ailk_Bljk_SB_MT064x128x08_GSU01
    SolutionIndex: 60
    SolutionNameMin: Cijk_Ailk_Bljk_SB_MT064x064x16_GSU01
    SolutionIndex: 61
    SolutionNameMin: Cijk_Ailk_Bljk_SB_MT064x032x32_GSU02
    SolutionIndex: 62
    SolutionNameMin: Cijk_Ailk_Bljk_SB_MT064x064x16_GSU04
    SolutionIndex: 63
    SolutionNameMin: Cijk_Ailk_Bljk_SB_MT064x064x16_GSU02
    SolutionIndex: 64
    SolutionNameMin: Cijk_Ailk_Bljk_SB_MT128x064x08_GSU02
    SolutionIndex: 65
    SolutionNameMin: Cijk_Ailk_Bljk_SB_MT032x032x32_GSU02
    SolutionIndex: 66
    SolutionNameMin: Cijk_Ailk_Bljk_SB_MT008x008x08_GSU04
    SolutionIndex: 67
    SolutionNameMin: Cijk_Ailk_Bljk_SB_MT008x008x08_GSU02
    SolutionIndex: 68
    SolutionNameMin: Cijk_Ailk_Bljk_SB_MT008x008x08_GSU08
- - - [196, 192, 16, 512]
    - [51, 4790.18]
  - - [6272, 512, 1, 128]
    - [9, 7961.56]
  - - [784, 128, 8, 512]
    - [27, 6195.19]
  - - [784, 512, 16, 128]
    - [15, 8665.89]
  - - [3136, 256, 1, 1024]
    - [40, 7189.22]
  - - [12544, 512, 1, 128]
    - [4, 8872.03]
  - - [100352, 64, 1, 64]
    - [29, 5371.85]
  - - [3136, 64, 16, 256]
    - [4, 7565.62]
  - - [784, 128, 16, 512]
    - [28, 7453.44]
  - - [3136, 256, 8, 64]
    - [37, 7605.46]
  - - [784, 2048, 1, 512]
    - [51, 7600.43]
  - - [3136, 64, 8, 256]
    - [17, 6705.48]
  - - [2048, 512, 64, 49]
    - [36, 7714.57]
  - - [784, 256, 1, 832]
    - [46, 5060.76]
  - - [512, 1024, 64, 196]
    - [35, 10520.1]
  - - [49, 512, 16, 512]
    - [43, 2982.53]
  - - [200704, 64, 1, 64]
    - [18, 5409.58]
  - - [128, 512, 64, 784]
    - [6, 10457.1]
  - - [49, 256, 16, 832]
    - [48, 4696.35]
  - - [3136, 2048, 1, 512]
    - [51, 9776.14]
  - - [196, 256, 16, 256]
    - [15, 5322.37]
  - - [3136, 256, 1, 256]
    - [13, 5996.0]
  - - [3136, 1024, 1, 256]
    - [5, 8678.89]
  - - [64, 256, 64, 3136]
    - [5, 8118.17]
  - - [3025, 64, 64, 64]
    - [45, 5460.88]
  - - [784, 512, 1, 2048]
    - [1, 6909.9]
  - - [196, 1024, 64, 256]
    - [34, 8266.19]
  - - [12544, 64, 8, 64]
    - [5, 5622.7]
  - - [784, 512, 64, 128]
    - [47, 9669.81]
  - - [128, 256, 64, 3136]
    - [7, 10052.4]
  - - [49, 512, 8, 2048]
    - [31, 4185.48]
  - - [1024, 256, 64, 196]
    - [49, 10045.9]
  - - [256, 1024, 64, 196]
    - [35, 10273.5]
  - - [256, 64, 64, 3136]
    - [21, 8880.56]
  - - [784, 512, 8, 128]
    - [15, 7789.91]
  - - [784, 64, 16, 192]
    - [8, 5185.56]
  - - [196, 1024, 16, 256]
    - [5, 7031.81]
  - - [50176, 64, 1, 256]
    - [41, 7358.52]
  - - [196, 256, 64, 1024]
    - [50, 6888.29]
  - - [512, 128, 64, 784]
    - [14, 10538.1]
  - - [196, 256, 8, 1024]
    - [0, 4650.16]
  - - [392, 2048, 1, 512]
    - [3, 6058.83]
  - - [196, 1024, 8, 256]
    - [15, 6149.11]
  - - [256, 512, 64, 784]
    - [19, 11138.4]
  - - [49, 512, 64, 2048]
    - [23, 5828.23]
  - - [1568, 256, 1, 256]
    - [44, 4646.43]
  - - [196, 256, 16, 1024]
    - [16, 5677.93]
  - - [49, 512, 16, 2048]
    - [30, 4871.6]
  - - [512, 2048, 64, 49]
    - [22, 7774.23]
  - - [196, 256, 8, 256]
    - [11, 4473.79]
  - - [12544, 128, 1, 512]
    - [41, 7842.78]
  - - [784, 512, 1, 512]
    - [44, 5515.36]
  - - [1568, 256, 1, 1024]
    - [40, 6065.18]
  - - [6272, 128, 1, 512]
    - [39, 6736.76]
  - - [49, 2048, 16, 512]
    - [26, 4420.76]
  - - [392, 512, 1, 2048]
    - [52, 5489.23]
  - - [392, 512, 1, 512]
    - [2, 4116.93]
  - - [49, 512, 8, 512]
    - [33, 2613.08]
  - - [50176, 256, 1, 64]
    - [10, 8011.31]
  - - [3136, 256, 16, 64]
    - [12, 8322.76]
  - - [3136, 192, 1, 512]
    - [51, 5564.97]
  - - [1568, 1024, 1, 256]
    - [20, 7382.02]
  - - [12544, 64, 16, 64]
    - [5, 5859.24]
  - - [64, 64, 64, 3136]
    - [25, 6065.2]
  - - [3025, 256, 64, 64]
    - [32, 8381.13]
  - - [25088, 64, 1, 256]
    - [5, 6881.08]
  - - [49, 2048, 64, 512]
    - [42, 5780.87]
  - - [3136, 512, 1, 2048]
    - [24, 8902.79]
  - - [12544, 64, 1, 192]
    - [20, 5273.88]
  - - [25088, 256, 1, 64]
    - [9, 7458.21]
  - - [49, 2048, 8, 512]
    - [38, 3667.6]
- - - -1
    - - - -1
        - - - 4
            - - [-1, 68]
          - - 64
            - - [4, 68]
              - [64, 58]
              - [704, 57]
              - [1408, 65]
              - [1856, 61]
              - [2368, 65]
              - [2944, 61]
              - [3584, 54]
              - [5056, 62]
              - [-1, 63]
          - - 128
            - - [4, 68]
              - [128, 57]
              - [704, 65]
              - [1408, 61]
              - [1856, 54]
              - [2368, 61]
              - [2944, 54]
              - [3584, 60]
              - [4288, 62]
              - [5056, 63]
              - [5888, 60]
              - [-1, 63]
          - - 256
            - - [4, 68]
              - [128, 57]
              - [256, 65]
              - [704, 61]
              - [1408, 54]
              - [1856, 60]
              - [2368, 54]
              - [2944, 60]
              - [3584, 54]
              - [4288, 63]
              - [5056, 60]
              - [5888, 56]
              - [-1, 60]
          - - 448
            - - [4, 68]
              - [128, 57]
              - [256, 61]
              - [448, 63]
              - [704, 62]
              - [1408, 63]
              - [3584, 62]
              - [4288, 63]
              - [5056, 60]
              - [5888, 63]
              - [-1, 60]
          - - 704
            - - [4, 68]
              - [64, 57]
              - [128, 65]
              - [256, 61]
              - [448, 62]
              - [704, 60]
              - [1024, 62]
              - [1856, 60]
              - [2368, 63]
              - [4288, 60]
              - [5888, 59]
              - [-1, 56]
          - - 1024
            - - [4, 68]
              - [64, 65]
              - [128, 55]
              - [256, 54]
              - [1024, 60]
              - [-1, 56]
          - - 1408
            - - [4, 68]
              - [64, 65]
              - [128, 57]
              - [448, 63]
              - [704, 60]
              - [-1, 56]
          - - 1856
            - - [4, 68]
              - [64, 61]
              - [128, 54]
              - [256, 63]
              - [448, 62]
              - [704, 60]
              - [1024, 56]
              - [1408, 60]
              - [2944, 56]
              - [3584, 59]
              - [5056, 56]
              - [5888, 59]
              - [-1, 56]
          - - 2368
            - - [4, 66]
              - [64, 57]
              - [128, 62]
              - [256, 63]
              - [448, 62]
              - [704, 63]
              - [-1, 56]
          - - 2944
            - - [4, 66]
              - [64, 61]
              - [128, 63]
              - [256, 60]
              - [448, 62]
              - [-1, 56]
          - - 3584
            - - [4, 67]
              - [64, 53]
              - [128, 60]
              - [448, 63]
              - [-1, 56]
          - - 4288
            - - [4, 67]
              - [256, 62]
              - [-1, 56]
          - - 5056
            - - [4, 67]
              - [64, 62]
              - [128, 63]
              - [256, 60]
              - [448, 64]
              - [-1, 56]
          - - 5888
            - - [4, 67]
              - [64, 54]
              - [128, 60]
              - [256, 56]
              - [448, 63]
              - [-1, 56]
          - - -1
            - - [4, 67]
              - [64, 60]
              - [128, 63]
              - [256, 60]
              - [-1, 56]
