library/src/blas3/Tensile/Logic/asm_full/aldebaran_Cijk_Alik_Bjlk_BSS_BH.yaml
- {MinimumRequiredVersion: 4.34.0}
- aldebaran
- gfx90a
- [Device 7400, Device 7408, Device 740c]
    SolutionIndex: 0
    SolutionNameMin: Cijk_Alik_Bjlk_BSS_BH_MT128x128x32_MI32x32x8x1_SN_AMAS3_IU4_LBSPP0_LPA2_LPB8_NEPBS4_PLR1_SPO1_SSO0_SVW2_TT2_64_VW2_WGM8
    SolutionIndex: 1
    SolutionNameMin: Cijk_Alik_Bjlk_BSS_BH_MT64x64x32_MI32x32x8x1_SN_AMAS0_IU2_LBSPP64_LPA2_LPB0_NEPBS4_PLR2_SPO0_SSO2_SVW1_TT1_32_VW1_WGM8
    SolutionIndex: 2
    SolutionNameMin: Cijk_Alik_Bjlk_BSS_BH_MT128x128x32_MI32x32x8x1_SN_AMAS3_IU4_LBSPP0_LPA2_LPB0_NEPBS4_PLR1_SPO1_SSO4_SVW2_TT2_64_VW2_WGM16
    SolutionIndex: 3
    SolutionNameMin: Cijk_Alik_Bjlk_BSS_BH_MT128x128x32_MI32x32x8x1_SN_AMAS3_IU4_LBSPP128_LPA2_LPB0_NEPBS2_PLR1_SPO1_SSO4_SVW2_TT2_64_VW2_WGM8
    SolutionIndex: 4
    SolutionNameMin: Cijk_Alik_Bjlk_BSS_BH_MT128x128x32_MI32x32x8x1_SN_AMAS3_IU4_LBSPP64_LPA2_LPB0_NEPBS2_PLR1_SPO1_SSO4_SVW2_TT2_64_VW2_WGM16
    SolutionIndex: 5
    SolutionNameMin: Cijk_Alik_Bjlk_BSS_BH_MT128x128x32_MI32x32x8x1_SN_AMAS0_IU2_LBSPP64_LPA2_LPB0_NEPBS1_PLR1_SPO0_SSO2_SVW1_TT2_64_VW1_WGM8
    SolutionIndex: 6
    SolutionNameMin: Cijk_Alik_Bjlk_BSS_BH_MT128x128x32_MI32x32x8x1_SN_AMAS3_IU4_LBSPP0_LPA2_LPB0_NEPBS2_PLR1_SPO1_SSO4_SVW2_TT2_64_VW2_WGM16
    SolutionIndex: 7
    SolutionNameMin: Cijk_Alik_Bjlk_BSS_BH_MT128x128x32_MI32x32x8x1_SN_AMAS3_IU4_LBSPP0_LPA2_LPB0_NEPBS2_PLR1_SPO1_SSO4_SVW2_TT2_64_VW2_WGM8
    SolutionIndex: 8
    SolutionNameMin: Cijk_Alik_Bjlk_BSS_BH_MT128x128x32_MI32x32x8x1_SN_AMAS0_IU4_LBSPP64_LPA2_LPB8_NEPBS4_PLR1_SPO1_SSO2_SVW1_TT2_64_VW1_WGM16
    SolutionIndex: 9
    SolutionNameMin: Cijk_Alik_Bjlk_BSS_BH_MT128x128x32_MI32x32x8x1_SN_AMAS0_IU2_LBSPP128_LPA0_LPB8_NEPBS1_PLR1_SPO0_SSO4_SVW1_TT2_64_VW1_WGM8
    SolutionIndex: 10
    SolutionNameMin: Cijk_Alik_Bjlk_BSS_BH_MT128x128x32_MI32x32x8x1_SN_AMAS0_IU4_LBSPP0_LPA2_LPB8_NEPBS4_PLR1_SPO1_SSO4_SVW1_TT2_64_VW1_WGM16
    SolutionIndex: 11
    SolutionNameMin: Cijk_Alik_Bjlk_BSS_BH_MT128x128x32_MI32x32x8x1_SN_AMAS0_IU4_LBSPP64_LPA2_LPB0_NEPBS4_PLR1_SPO1_SSO4_SVW1_TT2_64_VW1_WGM16
    SolutionIndex: 12
    SolutionNameMin: Cijk_Alik_Bjlk_BSS_BH_MT128x128x32_MI32x32x8x1_SN_AMAS3_IU2_LBSPP128_LPA2_LPB8_NEPBS1_PLR1_SPO1_SSO4_SVW2_TT2_64_VW2_WGM8
    SolutionIndex: 13
    SolutionNameMin: Cijk_Alik_Bjlk_BSS_BH_MT128x128x32_MI32x32x8x1_SN_AMAS3_IU2_LBSPP0_LPA2_LPB0_NEPBS2_PLR1_SPO1_SSO4_SVW2_TT2_64_VW2_WGM8
    SolutionIndex: 14
    SolutionNameMin: Cijk_Alik_Bjlk_BSS_BH_MT128x128x32_MI32x32x8x1_SN_AMAS0_IU4_LBSPP128_LPA2_LPB8_NEPBS4_PLR1_SPO1_SSO4_SVW1_TT2_64_VW1_WGM16
    SolutionIndex: 15
    SolutionNameMin: Cijk_Alik_Bjlk_BSS_BH_MT128x128x32_MI32x32x8x1_SN_AMAS0_IU2_LBSPP128_LPA2_LPB0_NEPBS1_PLR1_SPO0_SSO4_SVW1_TT2_64_VW1_WGM8
    SolutionIndex: 16
    SolutionNameMin: Cijk_Alik_Bjlk_BSS_BH_MT128x128x32_MI32x32x8x1_SN_AMAS3_IU2_LBSPP128_LPA2_LPB0_NEPBS2_PLR1_SPO1_SSO4_SVW2_TT2_64_VW2_WGM8
    SolutionIndex: 17
    SolutionNameMin: Cijk_Alik_Bjlk_BSS_BH_MT128x128x32_MI32x32x8x1_SN_AMAS0_IU2_LBSPP64_LPA2_LPB0_NEPBS4_PLR1_SPO1_SSO4_SVW1_TT2_64_VW1_WGM16
    SolutionIndex: 18
    SolutionNameMin: Cijk_Alik_Bjlk_BSS_BH_MT256x256x32_MI32x32x8x1_SN_AMAS3_IU2_LBSPP128_LPA8_LPB2_NEPBS4_PLR1_SPO1_SSO0_SVW4_TT4_128_VW4_WGM8
    SolutionIndex: 19
    SolutionNameMin: Cijk_Alik_Bjlk_BSS_BH_MT64x64x32_MI32x32x8x1_SN_1LDSB1_AMAS0_IU2_LBSPP128_LPA2_LPB0_NEPBS4_PLR2_SPO0_SSO2_SVW1_TT1_32_VW1
    SolutionIndex: 20
    SolutionNameMin: Cijk_Alik_Bjlk_BSS_BH_MT128x128x32_MI32x32x8x1_SN_1LDSB1_AMAS3_IU1_LBSPP64_LPA2_LPB0_NEPBS4_PLR5_SPO1_SSO2_SVW2_TT2_64_VW2
    SolutionIndex: 21
    SolutionNameMin: Cijk_Alik_Bjlk_BSS_BH_MT128x128x32_MI32x32x8x1_SN_1LDSB1_AMAS0_IU1_LBSPP128_LPA2_LPB0_NEPBS4_PLR5_SPO1_SSO4_SVW1_TT2_64_VW1
    SolutionIndex: 22
    SolutionNameMin: Cijk_Alik_Bjlk_BSS_BH_MT128x128x32_MI32x32x8x1_SN_1LDSB1_AMAS0_IU2_LBSPP128_LPA2_LPB0_NEPBS2_PLR1_SPO1_SSO4_SVW1_TT2_64_VW1
    SolutionIndex: 23
    SolutionNameMin: Cijk_Alik_Bjlk_BSS_BH_MT128x128x32_MI32x32x8x1_SN_1LDSB1_AMAS3_IU2_LBSPP64_LPA2_LPB0_NEPBS1_PLR1_SPO1_SSO4_SVW2_TT2_64_VW2
    SolutionIndex: 24
    SolutionNameMin: Cijk_Alik_Bjlk_BSS_BH_MT128x128x32_MI32x32x8x1_SN_1LDSB1_AMAS0_IU2_LBSPP0_LPA2_LPB0_NEPBS1_PLR1_SPO1_SSO4_SVW1_TT2_64_VW1
    SolutionIndex: 25
    SolutionNameMin: Cijk_Alik_Bjlk_BSS_BH_MT128x128x32_MI32x32x8x1_SN_1LDSB1_AMAS0_IU2_LBSPP0_LPA2_LPB0_NEPBS4_PLR1_SPO1_SSO4_SVW1_TT2_64_VW1
    SolutionIndex: 26
    SolutionNameMin: Cijk_Alik_Bjlk_BSS_BH_MT128x128x32_MI32x32x8x1_SN_1LDSB1_AMAS0_IU2_LBSPP0_LPA2_LPB0_NEPBS1_PLR1_SPO1_SSO2_SVW1_TT2_64_VW1
    SolutionIndex: 27
    SolutionNameMin: Cijk_Alik_Bjlk_BSS_BH_MT128x128x32_MI32x32x8x1_SN_1LDSB1_AMAS0_IU2_LBSPP0_LPA2_LPB0_NEPBS2_PLR1_SPO1_SSO2_SVW1_TT2_64_VW1
    SolutionIndex: 28
    SolutionNameMin: Cijk_Alik_Bjlk_BSS_BH_MT128x128x32_MI32x32x8x1_SN_1LDSB1_AMAS3_IU2_LBSPP64_LPA2_LPB8_NEPBS1_PLR1_SPO1_SSO0_SVW2_TT2_64_VW2
    SolutionIndex: 29
    SolutionNameMin: Cijk_Alik_Bjlk_BSS_BH_MT128x128x32_MI32x32x8x1_SN_1LDSB1_AMAS0_IU2_LBSPP128_LPA2_LPB0_NEPBS1_PLR1_SPO1_SSO2_SVW1_TT2_64_VW1
    SolutionIndex: 30
    SolutionNameMin: Cijk_Alik_Bjlk_BSS_BH_MT128x128x32_MI32x32x8x1_SN_1LDSB1_AMAS0_IU1_LBSPP0_LPA2_LPB0_NEPBS1_PLR5_SPO1_SSO4_SVW1_TT2_64_VW1
    SolutionIndex: 31
    SolutionNameMin: Cijk_Alik_Bjlk_BSS_BH_MT128x128x32_MI32x32x8x1_SN_1LDSB1_AMAS0_IU2_LBSPP64_LPA2_LPB0_NEPBS2_PLR1_SPO1_SSO2_SVW1_TT2_64_VW1
    SolutionIndex: 32
    SolutionNameMin: Cijk_Alik_Bjlk_BSS_BH_MT128x128x32_MI32x32x8x1_SN_1LDSB1_AMAS0_IU2_LBSPP128_LPA2_LPB0_NEPBS2_PLR1_SPO1_SSO2_SVW1_TT2_64_VW1
    SolutionIndex: 33
    SolutionNameMin: Cijk_Alik_Bjlk_BSS_BH_MT128x128x32_MI32x32x8x1_SN_1LDSB1_AMAS0_IU2_LBSPP128_LPA2_LPB8_NEPBS2_PLR1_SPO1_SSO4_SVW1_TT2_64_VW1
    SolutionIndex: 34
    SolutionNameMin: Cijk_Alik_Bjlk_BSS_BH_MT128x128x32_MI32x32x8x1_SN_1LDSB1_AMAS0_IU2_LBSPP64_LPA2_LPB0_NEPBS1_PLR1_SPO1_SSO2_SVW1_TT2_64_VW1
- - - [1024, 1024, 1, 1024]
    - [1, 25.959]
  - - [2048, 2048, 1, 1024]
    - [0, 48.196]
  - - [4096, 4096, 1, 1024]
    - [2, 62.08]
  - - [8192, 8192, 1, 1024]
    - [3, 67.169]
  - - [12288, 12288, 1, 1024]
    - [4, 70.664]
  - - [16384, 16384, 1, 1024]
    - [5, 61.785]
  - - [20480, 20480, 1, 1024]
    - [6, 71.497]
  - - [24576, 24576, 1, 1024]
    - [7, 68.842]
  - - [28672, 28672, 1, 1024]
    - [8, 71.483]
  - - [32768, 32768, 1, 1024]
    - [9, 49.072]
  - - [36864, 36864, 1, 1024]
    - [10, 71.551]
  - - [40960, 40960, 1, 1024]
    - [6, 67.895]
  - - [45056, 45056, 1, 1024]
    - [11, 71.133]
  - - [49152, 49152, 1, 1024]
    - [12, 60.816]
  - - [53248, 53248, 1, 1024]
    - [10, 70.547]
  - - [57344, 57344, 1, 1024]
    - [13, 67.482]
  - - [61440, 61440, 1, 1024]
    - [14, 70.22]
  - - [65536, 65536, 1, 1024]
    - [15, 45.641]
  - - [69632, 69632, 1, 1024]
    - [10, 69.629]
  - - [73728, 73728, 1, 1024]
    - [16, 66.744]
  - - [77824, 77824, 1, 1024]
    - [14, 68.965]
  - - [81920, 81920, 1, 1024]
    - [5, 60.183]
  - - [86016, 86016, 1, 1024]
    - [17, 68.487]
  - - [90112, 90112, 1, 1024]
    - [18, 65.825]
  - - [1024, 1024, 1, 2048]
    - [19, 29.185]
  - - [2048, 2048, 1, 2048]
    - [20, 56.005]
  - - [4096, 4096, 1, 2048]
    - [21, 67.692]
  - - [8192, 8192, 1, 2048]
    - [22, 73.327]
  - - [12288, 12288, 1, 2048]
    - [23, 76.218]
  - - [16384, 16384, 1, 2048]
    - [24, 73.259]
  - - [20480, 20480, 1, 2048]
    - [25, 76.445]
  - - [24576, 24576, 1, 2048]
    - [26, 76.088]
  - - [28672, 28672, 1, 2048]
    - [27, 77.068]
  - - [32768, 32768, 1, 2048]
    - [24, 68.06]
  - - [36864, 36864, 1, 2048]
    - [28, 75.361]
  - - [40960, 40960, 1, 2048]
    - [29, 74.39]
  - - [45056, 45056, 1, 2048]
    - [27, 77.021]
  - - [49152, 49152, 1, 2048]
    - [24, 74.536]
  - - [53248, 53248, 1, 2048]
    - [26, 76.413]
  - - [57344, 57344, 1, 2048]
    - [24, 75.692]
  - - [61440, 61440, 1, 2048]
    - [26, 76.244]
  - - [65536, 65536, 1, 2048]
    - [30, 64.762]
  - - [69632, 69632, 1, 2048]
    - [31, 75.197]
  - - [73728, 73728, 1, 2048]
    - [32, 75.667]
  - - [77824, 77824, 1, 2048]
    - [31, 76.658]
  - - [81920, 81920, 1, 2048]
    - [29, 73.49]
  - - [86016, 86016, 1, 2048]
    - [33, 75.99]
  - - [90112, 90112, 1, 2048]
    - [34, 74.933]
- null
- null
- DeviceEfficiency
