library/src/blas3/Tensile/Logic/asm_full/aldebaran_Cijk_Ailk_Bjlk_I8II_BH.yaml
- {MinimumRequiredVersion: 4.25.0}
- aldebaran
- gfx90a
- [Device 7400, Device 7408, Device 740c]
    SolutionIndex: 0
    SolutionNameMin: Cijk_Ailk_Bjlk_I8II_BH_MT64x64x16_MI32x32x8x1_SE_1LDSB0_EPS1_GRVW4_NLCA1_NLCB1_OPLV0_PK0_PAP0_PGR1_SU32_SUS256_SRVW0_TT1_32_WG64_4_1_WGM8
    SolutionIndex: 1
    SolutionNameMin: Cijk_Ailk_Bjlk_I8II_BH_MT64x64x64_MI32x32x8x1_SE_1LDSB0_EPS1_GRVW4_NLCA1_NLCB1_OPLV0_PK0_PAP0_PGR1_SU32_SUS256_SRVW0_TT1_32_WG64_4_1_WGM8
    SolutionIndex: 2
    SolutionNameMin: Cijk_Ailk_Bjlk_I8II_BH_MT64x128x32_MI32x32x8x1_SE_1LDSB0_EPS0_GRVW16_NLCA1_NLCB1_OPLV0_PKn1_PAP0_PGR2_SU0_SUS256_SRVW4_TT1_64_WG64_4_1_WGM1
    SolutionIndex: 3
    SolutionNameMin: Cijk_Ailk_Bjlk_I8II_BH_MT160x128x64_MI32x32x8x1_SE_1LDSB0_EPS1_GRVW8_NLCA5_NLCB1_OPLV0_PK0_PAP0_PGR1_SU0_SUS128_SRVW0_TT5_32_WG32_8_1_WGM1
    SolutionIndex: 4
    SolutionNameMin: Cijk_Ailk_Bjlk_I8II_BH_MT32x32x128_MI16x16x16x1_SE_1LDSB0_EPS0_GRVW4_NLCA1_NLCB1_OPLV0_PK0_PAP0_PGR2_SU0_SUS128_SRVW0_TT1_16_WG32_8_1_WGM1
    SolutionIndex: 5
    SolutionNameMin: Cijk_Ailk_Bjlk_I8II_BH_MT256x160x32_MI32x32x8x1_SE_1LDSB0_EPS1_GRVW4_NLCA1_NLCB5_OPLV0_PK0_PAP0_PGR1_SU0_SUS128_SRVW4_TT2_160_WG128_2_1_WGM1
    SolutionIndex: 6
    SolutionNameMin: Cijk_Ailk_Bjlk_I8II_BH_MT64x64x32_MI32x32x8x1_SE_1LDSB0_EPS0_GRVW16_NLCA1_NLCB1_OPLV0_PK0_PAP0_PGR2_SU0_SUS128_SRVW4_TT1_32_WG64_4_1_WGM1
    SolutionIndex: 7
    SolutionNameMin: Cijk_Ailk_Bjlk_I8II_BH_MT32x32x32_MI16x16x16x1_SE_1LDSB0_EPS0_GRVW4_NLCA1_NLCB1_OPLV0_PK0_PAP0_PGR2_SU0_SUS256_SRVW0_TT1_16_WG32_8_1_WGM1
    SolutionIndex: 8
    SolutionNameMin: Cijk_Ailk_Bjlk_I8II_BH_MT32x32x64_MI16x16x16x1_SE_1LDSB0_EPS0_GRVW4_NLCA1_NLCB1_OPLV0_PK0_PAP0_PGR2_SU0_SUS256_SRVW0_TT1_16_WG32_8_1_WGM1
    SolutionIndex: 9
    SolutionNameMin: Cijk_Ailk_Bjlk_I8II_BH_MT32x32x128_MI16x16x16x1_SE_1LDSB0_EPS0_GRVW4_NLCA1_NLCB1_OPLV0_PK0_PAP0_PGR2_SU0_SUS256_SRVW0_TT1_16_WG32_8_1_WGM1
    SolutionIndex: 10
    SolutionNameMin: Cijk_Ailk_Bjlk_I8II_BH_MT32x32x32_MI16x16x16x1_SE_1LDSB0_EPS0_GRVW8_NLCA1_NLCB1_OPLV0_PK0_PAP0_PGR2_SU0_SUS256_SRVW0_TT1_16_WG32_8_1_WGM1
    SolutionIndex: 11
    SolutionNameMin: Cijk_Ailk_Bjlk_I8II_BH_MT32x32x32_MI16x16x16x1_SE_1LDSB0_EPS0_GRVW16_NLCA1_NLCB1_OPLV0_PK0_PAP0_PGR2_SU0_SUS256_SRVW0_TT1_16_WG32_8_1_WGM1
    SolutionIndex: 12
    SolutionNameMin: Cijk_Ailk_Bjlk_I8II_BH_MT32x32x64_MI16x16x16x1_SE_1LDSB0_EPS0_GRVW16_NLCA1_NLCB1_OPLV0_PK0_PAP0_PGR2_SU0_SUS256_SRVW0_TT1_16_WG32_8_1_WGM1
    SolutionIndex: 13
    SolutionNameMin: Cijk_Ailk_Bjlk_I8II_BH_MT64x64x32_MI32x32x8x1_SE_1LDSB0_EPS0_GRVW8_NLCA1_NLCB1_OPLV0_PK0_PAP0_PGR2_SU0_SUS256_SRVW4_TT1_32_WG64_4_1_WGM1
    SolutionIndex: 14
    SolutionNameMin: Cijk_Ailk_Bjlk_I8II_BH_MT64x128x32_MI32x32x8x1_SE_1LDSB0_EPS0_GRVW16_NLCA1_NLCB1_OPLV0_PK0_PAP0_PGR2_SU0_SUS256_SRVW4_TT1_64_WG64_4_1_WGM1
    SolutionIndex: 15
    SolutionNameMin: Cijk_Ailk_Bjlk_I8II_BH_MT128x128x64_MI32x32x8x1_SE_1LDSB0_EPS1_GRVW16_NLCA1_NLCB1_OPLV0_PK0_PAP0_PGR1_SU32_SUS128_SRVW4_TT2_64_WG64_4_1_WGM1
    SolutionIndex: 16
    SolutionNameMin: Cijk_Ailk_Bjlk_I8II_BH_MT64x128x32_MI32x32x8x1_SE_1LDSB0_EPS0_GRVW16_NLCA1_NLCB1_OPLV0_PK0_PAP0_PGR2_SU32_SUS256_SRVW4_TT1_64_WG64_4_1_WGM1
    SolutionIndex: 17
    SolutionNameMin: Cijk_Ailk_Bjlk_I8II_BH_MT32x32x128_MI16x16x16x1_SE_1LDSB0_EPS0_GRVW16_NLCA1_NLCB1_OPLV0_PK0_PAP0_PGR2_SU0_SUS128_SRVW0_TT1_16_WG32_8_1_WGM2
    SolutionIndex: 18
    SolutionNameMin: Cijk_Ailk_Bjlk_I8II_BH_MT128x256x32_MI32x32x8x1_SE_1LDSB0_EPS1_GRVW4_NLCA1_NLCB1_OPLV0_PK0_PAP0_PGR1_SU0_SUS128_SRVW4_TT2_128_WG64_4_1_WGM2
    SolutionIndex: 19
    SolutionNameMin: Cijk_Ailk_Bjlk_I8II_BH_MT128x256x32_MI32x32x8x1_SE_1LDSB0_EPS1_GRVW8_NLCA1_NLCB1_OPLV0_PK0_PAP0_PGR1_SU0_SUS128_SRVW4_TT2_128_WG64_4_1_WGM2
    SolutionIndex: 20
    SolutionNameMin: Cijk_Ailk_Bjlk_I8II_BH_MT64x64x128_MI32x32x8x1_SE_1LDSB0_EPS1_GRVW8_NLCA1_NLCB1_OPLV0_PK0_PAP0_PGR1_SU0_SUS128_SRVW4_TT1_32_WG64_4_1_WGM2
    SolutionIndex: 21
    SolutionNameMin: Cijk_Ailk_Bjlk_I8II_BH_MT128x256x32_MI32x32x8x1_SE_1LDSB0_EPS1_GRVW16_NLCA1_NLCB1_OPLV0_PK0_PAP0_PGR1_SU0_SUS128_SRVW4_TT2_128_WG64_4_1_WGM2
    SolutionIndex: 22
    SolutionNameMin: Cijk_Ailk_Bjlk_I8II_BH_MT64x64x64_MI32x32x8x1_SE_1LDSB0_EPS1_GRVW16_NLCA1_NLCB1_OPLV0_PK0_PAP0_PGR1_SU0_SUS128_SRVW4_TT1_32_WG64_4_1_WGM2
    SolutionIndex: 23
    SolutionNameMin: Cijk_Ailk_Bjlk_I8II_BH_MT128x128x64_MI32x32x8x1_SE_1LDSB0_EPS1_GRVW16_NLCA1_NLCB1_OPLV0_PK0_PAP0_PGR1_SU0_SUS128_SRVW4_TT2_64_WG64_4_1_WGM2
    SolutionIndex: 24
    SolutionNameMin: Cijk_Ailk_Bjlk_I8II_BH_MT128x96x32_MI32x32x8x1_SE_1LDSB0_EPS0_GRVW4_NLCA1_NLCB3_OPLV0_PK0_PAP0_PGR2_SU0_SUS128_SRVW4_TT1_96_WG128_2_1_WGM2
    SolutionIndex: 25
    SolutionNameMin: Cijk_Ailk_Bjlk_I8II_BH_MT64x192x32_MI32x32x8x1_SE_1LDSB0_EPS0_GRVW8_NLCA1_NLCB3_OPLV0_PK0_PAP0_PGR2_SU0_SUS128_SRVW4_TT1_96_WG64_4_1_WGM2
    SolutionIndex: 26
    SolutionNameMin: Cijk_Ailk_Bjlk_I8II_BH_MT64x64x128_MI32x32x8x1_SE_1LDSB0_EPS0_GRVW8_NLCA1_NLCB1_OPLV0_PK0_PAP0_PGR2_SU0_SUS128_SRVW4_TT1_32_WG64_4_1_WGM2
    SolutionIndex: 27
    SolutionNameMin: Cijk_Ailk_Bjlk_I8II_BH_MT64x128x32_MI32x32x8x1_SE_1LDSB0_EPS0_GRVW16_NLCA1_NLCB1_OPLV0_PK0_PAP0_PGR2_SU0_SUS128_SRVW4_TT1_64_WG64_4_1_WGM2
    SolutionIndex: 28
    SolutionNameMin: Cijk_Ailk_Bjlk_I8II_BH_MT32x32x64_MI16x16x16x1_SE_1LDSB0_EPS0_GRVW8_NLCA1_NLCB1_OPLV0_PK0_PAP0_PGR2_SU0_SUS256_SRVW0_TT1_16_WG32_8_1_WGM2
    SolutionIndex: 29
    SolutionNameMin: Cijk_Ailk_Bjlk_I8II_BH_MT128x96x64_MI32x32x8x1_SE_1LDSB0_EPS1_GRVW8_NLCA1_NLCB3_OPLV0_PK0_PAP0_PGR1_SU0_SUS256_SRVW4_TT1_96_WG128_2_1_WGM2
    SolutionIndex: 30
    SolutionNameMin: Cijk_Ailk_Bjlk_I8II_BH_MT32x32x64_MI16x16x16x1_SE_1LDSB0_EPS0_GRVW8_NLCA1_NLCB1_OPLV0_PK0_PAP0_PGR2_SU0_SUS128_SRVW0_TT1_16_WG32_8_1_WGM15
    SolutionIndex: 31
    SolutionNameMin: Cijk_Ailk_Bjlk_I8II_BH_MT128x256x32_MI32x32x8x1_SE_1LDSB0_EPS1_GRVW4_NLCA1_NLCB1_OPLV0_PK0_PAP0_PGR1_SU0_SUS128_SRVW4_TT2_128_WG64_4_1_WGM15
    SolutionIndex: 32
    SolutionNameMin: Cijk_Ailk_Bjlk_I8II_BH_MT64x64x128_MI32x32x8x1_SE_1LDSB0_EPS1_GRVW8_NLCA1_NLCB1_OPLV0_PK0_PAP0_PGR1_SU0_SUS128_SRVW4_TT1_32_WG64_4_1_WGM15
    SolutionIndex: 33
    SolutionNameMin: Cijk_Ailk_Bjlk_I8II_BH_MT128x96x32_MI32x32x8x1_SE_1LDSB0_EPS0_GRVW4_NLCA1_NLCB3_OPLV0_PK0_PAP0_PGR2_SU0_SUS128_SRVW4_TT1_96_WG128_2_1_WGM15
    SolutionIndex: 34
    SolutionNameMin: Cijk_Ailk_Bjlk_I8II_BH_MT128x160x32_MI32x32x8x1_SE_1LDSB0_EPS0_GRVW4_NLCA1_NLCB5_OPLV0_PK0_PAP0_PGR2_SU0_SUS128_SRVW4_TT1_160_WG128_2_1_WGM15
    SolutionIndex: 35
    SolutionNameMin: Cijk_Ailk_Bjlk_I8II_BH_MT64x64x32_MI32x32x8x1_SE_1LDSB0_EPS0_GRVW8_NLCA1_NLCB1_OPLV0_PK0_PAP0_PGR2_SU0_SUS128_SRVW4_TT1_32_WG64_4_1_WGM15
    SolutionIndex: 36
    SolutionNameMin: Cijk_Ailk_Bjlk_I8II_BH_MT64x192x32_MI32x32x8x1_SE_1LDSB0_EPS0_GRVW8_NLCA1_NLCB3_OPLV0_PK0_PAP0_PGR2_SU0_SUS128_SRVW4_TT1_96_WG64_4_1_WGM15
    SolutionIndex: 37
    SolutionNameMin: Cijk_Ailk_Bjlk_I8II_BH_MT64x64x32_MI32x32x8x1_SE_1LDSB0_EPS0_GRVW16_NLCA1_NLCB1_OPLV0_PK0_PAP0_PGR2_SU0_SUS128_SRVW4_TT1_32_WG64_4_1_WGM15
    SolutionIndex: 38
    SolutionNameMin: Cijk_Ailk_Bjlk_I8II_BH_MT64x128x32_MI32x32x8x1_SE_1LDSB0_EPS0_GRVW16_NLCA1_NLCB1_OPLV0_PK0_PAP0_PGR2_SU0_SUS128_SRVW4_TT1_64_WG64_4_1_WGM15
    SolutionIndex: 39
    SolutionNameMin: Cijk_Ailk_Bjlk_I8II_BH_MT32x32x128_MI16x16x16x1_SE_1LDSB0_EPS0_GRVW4_NLCA1_NLCB1_OPLV0_PK0_PAP0_PGR2_SU0_SUS256_SRVW0_TT1_16_WG32_8_1_WGM15
    SolutionIndex: 40
    SolutionNameMin: Cijk_Ailk_Bjlk_I8II_BH_MT32x32x32_MI16x16x16x1_SE_1LDSB0_EPS0_GRVW16_NLCA1_NLCB1_OPLV0_PK0_PAP0_PGR2_SU0_SUS256_SRVW0_TT1_16_WG32_8_1_WGM15
    SolutionIndex: 41
    SolutionNameMin: Cijk_Ailk_Bjlk_I8II_BH_MT64x64x128_MI32x32x8x1_SE_1LDSB0_EPS1_GRVW8_NLCA1_NLCB1_OPLV0_PK0_PAP0_PGR1_SU0_SUS256_SRVW4_TT1_32_WG64_4_1_WGM15
    SolutionIndex: 42
    SolutionNameMin: Cijk_Ailk_Bjlk_I8II_BH_MT128x96x32_MI32x32x8x1_SE_1LDSB0_EPS0_GRVW4_NLCA1_NLCB3_OPLV0_PK0_PAP0_PGR2_SU0_SUS256_SRVW4_TT1_96_WG128_2_1_WGM15
    SolutionIndex: 43
    SolutionNameMin: Cijk_Ailk_Bjlk_I8II_BH_MT128x160x32_MI32x32x8x1_SE_1LDSB0_EPS0_GRVW4_NLCA1_NLCB5_OPLV0_PK0_PAP0_PGR2_SU0_SUS256_SRVW4_TT1_160_WG128_2_1_WGM15
    SolutionIndex: 44
    SolutionNameMin: Cijk_Ailk_Bjlk_I8II_BH_MT64x64x32_MI32x32x8x1_SE_1LDSB0_EPS0_GRVW8_NLCA1_NLCB1_OPLV0_PK0_PAP0_PGR2_SU0_SUS256_SRVW4_TT1_32_WG64_4_1_WGM15
    SolutionIndex: 45
    SolutionNameMin: Cijk_Ailk_Bjlk_I8II_BH_MT64x192x32_MI32x32x8x1_SE_1LDSB0_EPS0_GRVW8_NLCA1_NLCB3_OPLV0_PK0_PAP0_PGR2_SU0_SUS256_SRVW4_TT1_96_WG64_4_1_WGM15
    SolutionIndex: 46
    SolutionNameMin: Cijk_Ailk_Bjlk_I8II_BH_MT64x64x64_MI32x32x8x1_SE_1LDSB0_EPS0_GRVW8_NLCA1_NLCB1_OPLV0_PK0_PAP0_PGR2_SU0_SUS256_SRVW4_TT1_32_WG64_4_1_WGM15
    SolutionIndex: 47
    SolutionNameMin: Cijk_Ailk_Bjlk_I8II_BH_MT64x64x128_MI32x32x8x1_SE_1LDSB0_EPS0_GRVW8_NLCA1_NLCB1_OPLV0_PK0_PAP0_PGR2_SU0_SUS256_SRVW4_TT1_32_WG64_4_1_WGM15
    SolutionIndex: 48
    SolutionNameMin: Cijk_Ailk_Bjlk_I8II_BH_MT64x128x32_MI32x32x8x1_SE_1LDSB0_EPS0_GRVW16_NLCA1_NLCB1_OPLV0_PK0_PAP0_PGR2_SU0_SUS256_SRVW4_TT1_64_WG64_4_1_WGM15
    SolutionIndex: 49
    SolutionNameMin: Cijk_Ailk_Bjlk_I8II_BH_MT128x256x32_MI32x32x8x1_SE_1LDSB0_EPS1_GRVW8_NLCA1_NLCB1_OPLV0_PK0_PAP0_PGR1_SU32_SUS128_SRVW4_TT2_128_WG64_4_1_WGM15
    SolutionIndex: 50
    SolutionNameMin: Cijk_Ailk_Bjlk_I8II_BH_MT64x128x128_MI32x32x8x1_SE_1LDSB0_EPS1_GRVW16_NLCA1_NLCB1_OPLV0_PK0_PAP0_PGR1_SU32_SUS256_SRVW4_TT1_64_WG64_4_1_WGM15
    SolutionIndex: 51
    SolutionNameMin: Cijk_Ailk_Bjlk_I8II_BH_MT64x128x64_MI32x32x8x1_SE_1LDSB0_EPS0_GRVW4_NLCA1_NLCB1_OPLV0_PK0_PAP0_PGR2_SU32_SUS256_SRVW4_TT1_64_WG64_4_1_WGM15
    SolutionIndex: 52
    SolutionNameMin: Cijk_Ailk_Bjlk_I8II_BH_MT32x64x64_MI16x16x16x1_SE_1LDSB0_EPS0_GRVW16_NLCA1_NLCB1_OPLV0_PK0_PAP0_PGR2_SU0_SUS256_SRVW0_TT1_32_WG32_8_1_WGM2
    SolutionIndex: 53
    SolutionNameMin: Cijk_Ailk_Bjlk_I8II_BH_MT64x128x128_MI32x32x8x1_SE_1LDSB0_EPS1_GRVW8_NLCA1_NLCB1_OPLV0_PK0_PAP0_PGR1_SU0_SUS256_SRVW4_TT1_64_WG64_4_1_WGM2
    SolutionIndex: 54
    SolutionNameMin: Cijk_Ailk_Bjlk_I8II_BH_MT256x256x32_MI32x32x8x1_SE_1LDSB0_EPS1_GRVW16_NLCA1_NLCB1_OPLV0_PKn1_PAP0_PGR1_SU0_SUS128_SRVW4_TT2_256_WG128_2_1_WGM2
    SolutionIndex: 55
    SolutionNameMin: Cijk_Ailk_Bjlk_I8II_BH_MT256x256x32_MI32x32x8x1_SE_1LDSB0_EPS1_GRVW8_NLCA1_NLCB1_OPLV0_PK0_PAP0_PGR1_SU0_SUS256_SRVW4_TT2_256_WG128_2_1_WGM1
    SolutionIndex: 56
    SolutionNameMin: Cijk_Ailk_Bjlk_I8II_BH_MT32x64x128_MI16x16x16x1_SE_1LDSB0_EPS0_GRVW8_NLCA1_NLCB1_OPLV0_PK0_PAP0_PGR2_SU0_SUS256_SRVW0_TT1_32_WG32_8_1_WGM1
    SolutionIndex: 57
    SolutionNameMin: Cijk_Ailk_Bjlk_I8II_BH_MT128x128x32_MI32x32x8x1_SE_1LDSB0_EPS0_GRVW16_NLCA1_NLCB1_OPLV0_PK0_PAP0_PGR2_SU0_SUS256_SRVW4_TT1_128_WG128_2_1_WGM2
    SolutionIndex: 58
    SolutionNameMin: Cijk_Ailk_Bjlk_I8II_BH_MT64x128x128_MI32x32x8x1_SE_1LDSB0_EPS1_GRVW8_NLCA1_NLCB1_OPLV0_PK0_PAP0_PGR1_SU0_SUS128_SRVW4_TT1_64_WG64_4_1_WGM15
    SolutionIndex: 59
    SolutionNameMin: Cijk_Ailk_Bjlk_I8II_BH_MT256x128x32_MI32x32x8x1_SE_1LDSB0_EPS1_GRVW8_NLCA1_NLCB1_OPLV1_PKn1_PAP1_PGR1_SU32_SUS128_SRVW4_TT2_128_WG128_2_1_WGM15
    SolutionIndex: 60
    SolutionNameMin: Cijk_Ailk_Bjlk_I8II_BH_MT128x128x32_MI32x32x8x1_SE_1LDSB0_EPS0_GRVW8_NLCA1_NLCB1_OPLV0_PK0_PAP0_PGR2_SU32_SUS256_SRVW4_TT1_128_WG128_2_1_WGM1
    SolutionIndex: 61
    SolutionNameMin: Cijk_Ailk_Bjlk_I8II_BH_MT128x64x32_MI32x32x8x1_SE_1LDSB0_EPS0_GRVW8_NLCA1_NLCB1_OPLV0_PK0_PAP0_PGR2_SU32_SUS128_SRVW4_TT1_64_WG128_2_1_WGM1
    SolutionIndex: 62
    SolutionNameMin: Cijk_Ailk_Bjlk_I8II_BH_MT128x96x128_MI32x32x8x1_SE_1LDSB0_EPS1_GRVW8_NLCA1_NLCB3_OPLV0_PK0_PAP0_PGR1_SU0_SUS256_SRVW4_TT1_96_WG128_2_1_WGM1
    SolutionIndex: 63
    SolutionNameMin: Cijk_Ailk_Bjlk_I8II_BH_MT128x160x32_MI32x32x8x1_SE_1LDSB0_EPS0_GRVW4_NLCA1_NLCB5_OPLV0_PK0_PAP0_PGR2_SU0_SUS256_SRVW4_TT1_160_WG128_2_1_WGM1
    SolutionIndex: 64
    SolutionNameMin: Cijk_Ailk_Bjlk_I8II_BH_MT128x96x64_MI32x32x8x1_SE_1LDSB0_EPS1_GRVW8_NLCA1_NLCB3_OPLV0_PK0_PAP0_PGR1_SU0_SUS128_SRVW4_TT1_96_WG128_2_1_WGM1
    SolutionIndex: 65
    SolutionNameMin: Cijk_Ailk_Bjlk_I8II_BH_MT64x64x64_MI32x32x8x1_SE_1LDSB0_EPS1_GRVW8_NLCA1_NLCB1_OPLV0_PK0_PAP0_PGR1_SU0_SUS128_SRVW4_TT1_32_WG64_4_1_WGM1
    SolutionIndex: 66
    SolutionNameMin: Cijk_Ailk_Bjlk_I8II_BH_MT64x64x32_MI32x32x8x1_SE_1LDSB0_EPS0_GRVW16_NLCA1_NLCB1_OPLV0_PK0_PAP0_PGR2_SU0_SUS256_SRVW4_TT1_32_WG64_4_1_WGM1
    SolutionIndex: 67
    SolutionNameMin: Cijk_Ailk_Bjlk_I8II_BH_MT128x64x32_MI32x32x8x1_SE_1LDSB0_EPS0_GRVW8_NLCA1_NLCB1_OPLV0_PK0_PAP0_PGR2_SU32_SUS256_SRVW4_TT1_64_WG128_2_1_WGM1
    SolutionIndex: 68
    SolutionNameMin: Cijk_Ailk_Bjlk_I8II_BH_MT256x64x64_MI32x32x8x1_SE_1LDSB0_EPS1_GRVW8_NLCA1_NLCB1_OPLV0_PK0_PAP0_PGR1_SU0_SUS256_SRVW4_TT2_64_WG128_2_1_WGM1
    SolutionIndex: 69
    SolutionNameMin: Cijk_Ailk_Bjlk_I8II_BH_MT64x192x64_MI32x32x8x1_SE_1LDSB0_EPS0_GRVW16_NLCA1_NLCB3_OPLV0_PK0_PAP0_PGR2_SU32_SUS256_SRVW4_TT1_96_WG64_4_1_WGM2
    SolutionIndex: 70
    SolutionNameMin: Cijk_Ailk_Bjlk_I8II_BH_MT64x64x128_MI32x32x8x1_SE_1LDSB0_EPS0_GRVW8_NLCA1_NLCB1_OPLV0_PK0_PAP0_PGR2_SU0_SUS256_SRVW4_TT1_32_WG64_4_1_WGM2
    SolutionIndex: 71
    SolutionNameMin: Cijk_Ailk_Bjlk_I8II_BH_MT128x128x32_MI32x32x8x1_SE_1LDSB0_EPS0_GRVW16_NLCA1_NLCB1_OPLV0_PK0_PAP0_PGR2_SU0_SUS128_SRVW4_TT1_128_WG128_2_1_WGM15
    SolutionIndex: 72
    SolutionNameMin: Cijk_Ailk_Bjlk_I8II_BH_MT128x128x32_MI32x32x8x1_SE_1LDSB0_EPS0_GRVW8_NLCA1_NLCB1_OPLV0_PK0_PAP0_PGR2_SU0_SUS256_SRVW4_TT1_128_WG128_2_1_WGM1
    SolutionIndex: 73
    SolutionNameMin: Cijk_Ailk_Bjlk_I8II_BH_MT128x128x64_MI32x32x8x1_SE_1LDSB0_EPS1_GRVW8_NLCA1_NLCB1_OPLV0_PK0_PAP0_PGR1_SU0_SUS128_SRVW4_TT1_128_WG128_2_1_WGM15
    SolutionIndex: 74
    SolutionNameMin: Cijk_Ailk_Bjlk_I8II_BH_MT128x128x32_MI32x32x8x1_SE_1LDSB0_EPS0_GRVW8_NLCA1_NLCB1_OPLV0_PK0_PAP0_PGR2_SU0_SUS128_SRVW4_TT1_128_WG128_2_1_WGM15
    SolutionIndex: 75
    SolutionNameMin: Cijk_Ailk_Bjlk_I8II_BH_MT32x32x64_MI16x16x16x1_SE_1LDSB0_EPS0_GRVW16_NLCA1_NLCB1_OPLV0_PK0_PAP0_PGR2_SU0_SUS128_SRVW0_TT1_16_WG32_8_1_WGM2
    SolutionIndex: 76
    SolutionNameMin: Cijk_Ailk_Bjlk_I8II_BH_MT64x32x64_MI16x16x16x1_SE_1LDSB0_EPS1_GRVW8_NLCA1_NLCB1_OPLV0_PK0_PAP0_PGR1_SU0_SUS256_SRVW0_TT2_16_WG32_8_1_WGM15
    SolutionIndex: 77
    SolutionNameMin: Cijk_Ailk_Bjlk_I8II_BH_MT64x128x64_MI32x32x8x1_SE_1LDSB0_EPS0_GRVW8_NLCA1_NLCB1_OPLV0_PKn1_PAP0_PGR2_SU32_SUS256_SRVW4_TT1_64_WG64_4_1_WGM2
    SolutionIndex: 78
    SolutionNameMin: Cijk_Ailk_Bjlk_I8II_BH_MT128x128x32_MI32x32x8x1_SE_1LDSB0_EPS0_GRVW16_NLCA1_NLCB1_OPLV0_PK0_PAP0_PGR2_SU0_SUS128_SRVW4_TT1_128_WG128_2_1_WGM1
    SolutionIndex: 79
    SolutionNameMin: Cijk_Ailk_Bjlk_I8II_BH_MT64x64x128_MI32x32x8x1_SE_1LDSB0_EPS1_GRVW8_NLCA1_NLCB1_OPLV0_PK0_PAP0_PGR1_SU0_SUS128_SRVW4_TT1_32_WG64_4_1_WGM1
    SolutionIndex: 80
    SolutionNameMin: Cijk_Ailk_Bjlk_I8II_BH_MT128x128x32_MI32x32x8x1_SE_1LDSB0_EPS0_GRVW16_NLCA1_NLCB1_OPLV0_PK0_PAP0_PGR2_SU32_SUS256_SRVW4_TT1_128_WG128_2_1_WGM15
    SolutionIndex: 81
    SolutionNameMin: Cijk_Ailk_Bjlk_I8II_BH_MT32x32x64_MI16x16x16x1_SE_1LDSB0_EPS0_GRVW16_NLCA1_NLCB1_OPLV0_PK0_PAP0_PGR2_SU0_SUS256_SRVW0_TT1_16_WG32_8_1_WGM2
    SolutionIndex: 82
    SolutionNameMin: Cijk_Ailk_Bjlk_I8II_BH_MT128x64x32_MI32x32x8x1_SE_1LDSB0_EPS0_GRVW8_NLCA1_NLCB1_OPLV0_PK0_PAP0_PGR2_SU32_SUS128_SRVW4_TT1_64_WG128_2_1_WGM2
    SolutionIndex: 83
    SolutionNameMin: Cijk_Ailk_Bjlk_I8II_BH_MT96x96x128_MI16x16x16x1_SE_1LDSB0_EPS1_GRVW16_NLCA3_NLCB3_OPLV0_PK0_PAP0_PGR1_SU0_SUS128_SRVW0_TT3_48_WG32_8_1_WGM1
    SolutionIndex: 84
    SolutionNameMin: Cijk_Ailk_Bjlk_I8II_BH_MT128x96x32_MI32x32x8x1_SE_1LDSB0_EPS0_GRVW4_NLCA1_NLCB3_OPLV0_PK0_PAP0_PGR2_SU0_SUS128_SRVW4_TT1_96_WG128_2_1_WGM1
    SolutionIndex: 85
    SolutionNameMin: Cijk_Ailk_Bjlk_I8II_BH_MT64x192x32_MI32x32x8x1_SE_1LDSB0_EPS0_GRVW8_NLCA1_NLCB3_OPLV0_PK0_PAP0_PGR2_SU32_SUS256_SRVW4_TT1_96_WG64_4_1_WGM15
    SolutionIndex: 86
    SolutionNameMin: Cijk_Ailk_Bjlk_I8II_BH_MT64x128x32_MI32x32x8x1_SE_1LDSB0_EPS0_GRVW16_NLCA1_NLCB1_OPLV0_PK0_PAP0_PGR2_SU32_SUS128_SRVW4_TT1_64_WG64_4_1_WGM1
    SolutionIndex: 87
    SolutionNameMin: Cijk_Ailk_Bjlk_I8II_BH_MT64x64x64_MI32x32x8x1_SE_1LDSB0_EPS0_GRVW16_NLCA1_NLCB1_OPLV0_PK0_PAP0_PGR2_SU0_SUS128_SRVW4_TT1_32_WG64_4_1_WGM1
    SolutionIndex: 88
    SolutionNameMin: Cijk_Ailk_Bjlk_I8II_BH_MT64x192x32_MI32x32x8x1_SN_1LDSB0_EPS0_GRVW8_NLCA1_NLCB3_OPLV0_PK0_PAP0_PGR2_SU0_SUS128_SRVW4_TT1_96_WG64_4_1_WGM1
    SolutionIndex: 89
    SolutionNameMin: Cijk_Ailk_Bjlk_I8II_BH_MT64x192x32_MI32x32x8x1_SN_1LDSB0_EPS0_GRVW8_NLCA1_NLCB3_OPLV0_PK0_PAP0_PGR2_SU0_SUS128_SRVW4_TT1_96_WG64_4_1_WGM15
    SolutionIndex: 90
    SolutionNameMin: Cijk_Ailk_Bjlk_I8II_BH_MT64x192x32_MI32x32x8x1_SN_1LDSB0_EPS0_GRVW8_NLCA1_NLCB3_OPLV0_PK0_PAP0_PGR2_SU0_SUS256_SRVW4_TT1_96_WG64_4_1_WGM2
    SolutionIndex: 91
    SolutionNameMin: Cijk_Ailk_Bjlk_I8II_BH_MT64x192x32_MI32x32x8x1_SN_1LDSB0_EPS0_GRVW8_NLCA1_NLCB3_OPLV0_PKn1_PAP0_PGR2_SU0_SUS256_SRVW4_TT1_96_WG64_4_1_WGM15
- - - [35, 35, 1, 512]
    - [1, 0.037]
  - - [4, 64, 1, 128]
    - [0, 0.004]
  - - [480, 512, 1, 512]
    - [52, 14.598]
  - - [960, 1024, 1, 1024]
    - [53, 51.572]
  - - [1920, 2048, 1, 2048]
    - [21, 82.334]
  - - [3840, 4096, 1, 4096]
    - [54, 90.932]
  - - [7680, 8192, 1, 8192]
    - [55, 94.24]
  - - [1024, 128, 1, 128]
    - [10, 3.489]
  - - [1856, 448, 1, 3328]
    - [50, 55.02]
  - - [2944, 4288, 1, 1280]
    - [45, 79.337]
  - - [2368, 64, 1, 3328]
    - [56, 14.361]
  - - [2368, 5888, 1, 256]
    - [57, 55.243]
  - - [128, 64, 1, 256]
    - [28, 0.373]
  - - [5888, 1024, 1, 1280]
    - [48, 68.827]
  - - [128, 6784, 1, 3328]
    - [58, 56.539]
  - - [64, 4, 1, 256]
    - [8, 0.01]
  - - [5888, 1856, 1, 3328]
    - [59, 82.516]
  - - [5056, 704, 1, 256]
    - [60, 41.665]
  - - [5888, 2944, 1, 3328]
    - [42, 86.407]
  - - [1856, 4288, 1, 256]
    - [61, 48.639]
  - - [1024, 5056, 1, 128]
    - [33, 30.204]
  - - [5056, 5056, 1, 3328]
    - [36, 86.613]
  - - [1408, 5888, 1, 1280]
    - [2, 74.592]
  - - [2368, 448, 1, 128]
    - [44, 17.815]
  - - [1024, 3584, 1, 3328]
    - [19, 81.411]
  - - [1408, 64, 1, 128]
    - [7, 2.53]
  - - [256, 4288, 1, 3328]
    - [29, 51.67]
  - - [5888, 1408, 1, 1280]
    - [27, 74.686]
  - - [704, 1856, 1, 3328]
    - [62, 67.189]
  - - [1024, 2368, 1, 256]
    - [63, 36.46]
  - - [1408, 1856, 1, 1280]
    - [36, 65.948]
  - - [1408, 64, 1, 1280]
    - [17, 9.226]
  - - [448, 1024, 1, 1280]
    - [41, 36.799]
  - - [256, 1408, 1, 3328]
    - [26, 32.665]
  - - [5056, 5056, 1, 1280]
    - [36, 82.271]
  - - [448, 5056, 1, 256]
    - [46, 34.345]
  - - [704, 1856, 1, 1280]
    - [64, 57.332]
  - - [128, 5056, 1, 128]
    - [65, 13.066]
  - - [2368, 128, 1, 256]
    - [13, 10.275]
  - - [1856, 1408, 1, 128]
    - [14, 26.755]
  - - [64, 5056, 1, 256]
    - [66, 10.97]
  - - [6784, 256, 1, 3328]
    - [15, 70.951]
  - - [6784, 4288, 1, 3328]
    - [42, 88.183]
  - - [4288, 448, 1, 256]
    - [67, 33.924]
  - - [64, 704, 1, 128]
    - [11, 1.246]
  - - [1856, 2368, 1, 3328]
    - [5, 78.472]
  - - [4288, 2944, 1, 1280]
    - [16, 79.379]
  - - [704, 5056, 1, 1280]
    - [18, 70.127]
  - - [2368, 704, 1, 3328]
    - [68, 66.112]
  - - [256, 5888, 1, 256]
    - [48, 30.177]
  - - [1856, 4288, 1, 3328]
    - [45, 79.089]
  - - [256, 2944, 1, 256]
    - [22, 22.855]
  - - [5888, 1024, 1, 256]
    - [48, 44.537]
  - - [448, 64, 1, 1280]
    - [30, 2.886]
  - - [448, 5056, 1, 3328]
    - [3, 71.838]
  - - [3584, 4, 1, 1280]
    - [9, 1.58]
  - - [2944, 64, 1, 256]
    - [12, 7.127]
  - - [128, 4, 1, 1280]
    - [4, 0.048]
  - - [1408, 2944, 1, 256]
    - [69, 43.052]
  - - [256, 1856, 1, 1280]
    - [70, 37.362]
  - - [6784, 5056, 1, 3328]
    - [42, 87.24]
  - - [5056, 5056, 1, 256]
    - [71, 58.493]
  - - [1408, 6784, 1, 128]
    - [72, 36.439]
  - - [64, 1024, 1, 1280]
    - [28, 6.906]
  - - [2944, 4, 1, 256]
    - [40, 0.523]
  - - [704, 5056, 1, 128]
    - [73, 28.809]
  - - [2368, 2944, 1, 1280]
    - [25, 75.527]
  - - [128, 3584, 1, 1280]
    - [47, 35.839]
  - - [6784, 6784, 1, 1280]
    - [24, 84.424]
  - - [1024, 256, 1, 3328]
    - [32, 24.155]
  - - [1408, 4288, 1, 1280]
    - [38, 68.573]
  - - [3584, 4288, 1, 1280]
    - [74, 80.005]
  - - [2368, 704, 1, 1280]
    - [51, 56.893]
  - - [5056, 4288, 1, 3328]
    - [33, 87.001]
  - - [3584, 2368, 1, 3328]
    - [42, 82.712]
  - - [64, 704, 1, 1280]
    - [75, 4.639]
  - - [4288, 256, 1, 256]
    - [66, 25.953]
  - - [2944, 128, 1, 128]
    - [76, 8.257]
  - - [6784, 448, 1, 1280]
    - [49, 60.375]
  - - [1408, 2944, 1, 128]
    - [77, 28.702]
  - - [4288, 2944, 1, 256]
    - [78, 53.687]
  - - [5888, 704, 1, 1280]
    - [43, 64.625]
  - - [1856, 64, 1, 1280]
    - [4, 12.819]
  - - [448, 5888, 1, 128]
    - [38, 27.556]
  - - [5888, 64, 1, 3328]
    - [70, 33.564]
  - - [2944, 256, 1, 3328]
    - [79, 48.001]
  - - [1024, 64, 1, 128]
    - [7, 1.915]
  - - [5056, 2368, 1, 1280]
    - [34, 77.578]
  - - [448, 3584, 1, 1280]
    - [23, 56.792]
  - - [6784, 5888, 1, 256]
    - [80, 61.819]
  - - [704, 1024, 1, 128]
    - [35, 14.554]
  - - [704, 128, 1, 1280]
    - [81, 9.359]
  - - [5888, 2944, 1, 128]
    - [72, 37.481]
  - - [1408, 448, 1, 1280]
    - [20, 35.363]
  - - [1024, 1408, 1, 256]
    - [37, 32.282]
  - - [2368, 2368, 1, 3328]
    - [42, 79.538]
  - - [1856, 6784, 1, 128]
    - [2, 36.697]
  - - [5056, 704, 1, 3328]
    - [31, 79.221]
  - - [1408, 1856, 1, 256]
    - [82, 38.806]
  - - [1408, 704, 1, 3328]
    - [83, 50.915]
  - - [2368, 5056, 1, 256]
    - [84, 53.348]
  - - [5888, 1856, 1, 256]
    - [85, 51.571]
  - - [4288, 64, 1, 3328]
    - [70, 24.991]
  - - [2368, 4, 1, 1280]
    - [39, 0.954]
  - - [704, 5888, 1, 256]
    - [86, 42.5]
  - - [4288, 64, 1, 256]
    - [6, 9.26]
  - - [6784, 64, 1, 256]
    - [87, 16.003]
  - - [3840, 4224, 1, 4096]
    - [88, 95.344]
  - - [3840, 4224, 1, 4224]
    - [88, 95.441]
  - - [3840, 4224, 1, 4320]
    - [88, 95.601]
  - - [7680, 8448, 1, 8192]
    - [89, 98.344]
  - - [7680, 8448, 1, 8448]
    - [90, 98.363]
  - - [7680, 8448, 1, 8640]
    - [91, 98.406]
- null
