library/src/blas3/Tensile/Logic/asm_full/aldebaran_Cijk_Alik_Bljk_BSS_BH.yaml
- {MinimumRequiredVersion: 4.24.0}
- aldebaran
- gfx90a
- [Device 0050, Device 0051, Device 0052, Device 0054, Device 0062, Device 7400, Device 740c]
    SolutionIndex: 0
    SolutionNameMin: Cijk_Alik_Bljk_BSS_BH_MT32x32x64_MI16x16x8x1_SE_1LDSB0_AF0EM8_GRVW4_LBSPP128_LPA4_LPB4_PLR9_SU0_SUS128_SRVW4_TT1_16_WG32_8_1_WGM1
    SolutionIndex: 1
    SolutionNameMin: Cijk_Alik_Bljk_BSS_BH_MT32x32x64_MI16x16x8x1_SE_1LDSB0_AF0EM8_GRVW8_LBSPP128_LPA8_LPB8_PLR9_SU0_SUS128_SRVW4_TT1_16_WG32_8_1_WGM1
    SolutionIndex: 2
    SolutionNameMin: Cijk_Alik_Bljk_BSS_BH_MT96x96x32_MI16x16x8x1_SE_1LDSB0_AF0EM8_GRVW4_LBSPP128_LPA4_LPB4_PLR5_SU0_SUS256_SRVW0_TT3_48_WG32_8_1_WGM1
    SolutionIndex: 3
    SolutionNameMin: Cijk_Alik_Bljk_BSS_BH_MT32x32x64_MI16x16x8x1_SE_1LDSB0_AF0EM8_GRVW8_LBSPP128_LPA8_LPB8_PLR9_SU32_SUS128_SRVW4_TT1_16_WG32_8_1_WGM1
    SolutionIndex: 4
    SolutionNameMin: Cijk_Alik_Bljk_BSS_BH_MT32x32x64_MI16x16x8x1_SE_1LDSB0_AF0EM8_GRVW8_LBSPP128_LPA8_LPB8_PLR9_SU32_SUS256_SRVW4_TT1_16_WG32_8_1_WGM1
    SolutionIndex: 5
    SolutionNameMin: Cijk_Alik_Bljk_BSS_BH_MT32x32x32_MI16x16x8x1_SE_1LDSB0_AF0EM8_GRVW4_LBSPP128_LPA4_LPB4_PLR5_SU0_SUS128_SRVW4_TT1_16_WG32_8_1_WGM2
    SolutionIndex: 6
    SolutionNameMin: Cijk_Alik_Bljk_BSS_BH_MT64x128x32_MI32x32x4x1_SE_1LDSB0_AF0EM8_GRVW8_LBSPP128_LPA8_LPB8_PLR9_SU0_SUS128_SRVW4_TT1_64_WG64_4_1_WGM2
    SolutionIndex: 7
    SolutionNameMin: Cijk_Alik_Bljk_BSS_BH_MT128x64x64_MI32x32x4x1_SE_1LDSB0_AF0EM8_GRVW8_LBSPP128_LPA8_LPB8_PLR17_SU0_SUS128_SRVW4_TT2_32_WG64_4_1_WGM2
    SolutionIndex: 8
    SolutionNameMin: Cijk_Alik_Bljk_BSS_BH_MT32x32x64_MI16x16x8x1_SE_1LDSB0_AF0EM8_GRVW8_LBSPP128_LPA8_LPB8_PLR9_SU0_SUS256_SRVW4_TT1_16_WG32_8_1_WGM2
    SolutionIndex: 9
    SolutionNameMin: Cijk_Alik_Bljk_BSS_BH_MT32x32x64_MI16x16x8x1_SE_1LDSB0_AF0EM8_GRVW8_LBSPP128_LPA8_LPB8_PLR9_SU32_SUS128_SRVW4_TT1_16_WG32_8_1_WGM2
    SolutionIndex: 10
    SolutionNameMin: Cijk_Alik_Bljk_BSS_BH_MT32x64x64_MI16x16x8x1_SE_1LDSB0_AF0EM8_GRVW8_LBSPP128_LPA8_LPB8_PLR9_SU32_SUS256_SRVW4_TT1_32_WG32_8_1_WGM2
    SolutionIndex: 11
    SolutionNameMin: Cijk_Alik_Bljk_BSS_BH_MT32x32x32_MI16x16x8x1_SE_1LDSB0_AF0EM8_GRVW4_LBSPP128_LPA4_LPB4_PLR5_SU0_SUS128_SRVW4_TT1_16_WG32_8_1_WGM15
    SolutionIndex: 12
    SolutionNameMin: Cijk_Alik_Bljk_BSS_BH_MT32x64x32_MI16x16x8x1_SE_1LDSB0_AF0EM8_GRVW4_LBSPP128_LPA4_LPB4_PLR5_SU0_SUS128_SRVW4_TT1_32_WG32_8_1_WGM15
    SolutionIndex: 13
    SolutionNameMin: Cijk_Alik_Bljk_BSS_BH_MT128x128x32_MI32x32x4x1_SE_1LDSB0_AF0EM8_GRVW8_LBSPP128_LPA8_LPB8_PLR9_SU0_SUS128_SRVW4_TT2_64_WG64_4_1_WGM15
    SolutionIndex: 14
    SolutionNameMin: Cijk_Alik_Bljk_BSS_BH_MT32x32x64_MI16x16x8x1_SE_1LDSB0_AF0EM8_GRVW8_LBSPP128_LPA8_LPB8_PLR9_SU0_SUS128_SRVW4_TT1_16_WG32_8_1_WGM15
    SolutionIndex: 15
    SolutionNameMin: Cijk_Alik_Bljk_BSS_BH_MT128x64x64_MI32x32x4x1_SE_1LDSB0_AF0EM8_GRVW8_LBSPP128_LPA8_LPB8_PLR17_SU0_SUS128_SRVW4_TT2_32_WG64_4_1_WGM15
    SolutionIndex: 16
    SolutionNameMin: Cijk_Alik_Bljk_BSS_BH_MT64x32x64_MI16x16x8x1_SE_1LDSB0_AF0EM8_GRVW4_LBSPP128_LPA4_LPB4_PLR9_SU0_SUS256_SRVW4_TT2_16_WG32_8_1_WGM15
    SolutionIndex: 17
    SolutionNameMin: Cijk_Alik_Bljk_BSS_BH_MT32x32x32_MI16x16x8x1_SE_1LDSB0_AF0EM8_GRVW8_LBSPP128_LPA8_LPB8_PLR5_SU0_SUS256_SRVW4_TT1_16_WG32_8_1_WGM15
    SolutionIndex: 18
    SolutionNameMin: Cijk_Alik_Bljk_BSS_BH_MT32x64x32_MI16x16x8x1_SE_1LDSB0_AF0EM8_GRVW8_LBSPP128_LPA8_LPB8_PLR5_SU0_SUS256_SRVW4_TT1_32_WG32_8_1_WGM15
    SolutionIndex: 19
    SolutionNameMin: Cijk_Alik_Bljk_BSS_BH_MT128x128x32_MI32x32x4x1_SE_1LDSB0_AF0EM8_GRVW8_LBSPP128_LPA8_LPB8_PLR9_SU0_SUS256_SRVW4_TT2_64_WG64_4_1_WGM15
    SolutionIndex: 20
    SolutionNameMin: Cijk_Alik_Bljk_BSS_BH_MT32x32x64_MI16x16x8x1_SE_1LDSB0_AF0EM8_GRVW8_LBSPP128_LPA8_LPB8_PLR9_SU0_SUS256_SRVW4_TT1_16_WG32_8_1_WGM15
    SolutionIndex: 21
    SolutionNameMin: Cijk_Alik_Bljk_BSS_BH_MT64x32x64_MI16x16x8x1_SE_1LDSB0_AF0EM8_GRVW8_LBSPP128_LPA8_LPB8_PLR9_SU0_SUS256_SRVW4_TT2_16_WG32_8_1_WGM15
    SolutionIndex: 22
    SolutionNameMin: Cijk_Alik_Bljk_BSS_BH_MT128x64x64_MI32x32x4x1_SE_1LDSB0_AF0EM8_GRVW8_LBSPP128_LPA8_LPB8_PLR17_SU0_SUS256_SRVW4_TT2_32_WG64_4_1_WGM15
    SolutionIndex: 23
    SolutionNameMin: Cijk_Alik_Bljk_BSS_BH_MT32x32x64_MI16x16x8x1_SE_1LDSB0_AF0EM8_GRVW8_LBSPP128_LPA8_LPB8_PLR9_SU32_SUS128_SRVW4_TT1_16_WG32_8_1_WGM15
    SolutionIndex: 24
    SolutionNameMin: Cijk_Alik_Bljk_BSS_BH_MT32x32x64_MI16x16x8x1_SE_1LDSB0_AF0EM8_GRVW4_LBSPP128_LPA4_LPB4_PLR9_SU32_SUS256_SRVW4_TT1_16_WG32_8_1_WGM15
    SolutionIndex: 25
    SolutionNameMin: Cijk_Alik_Bljk_BSS_BH_MT32x32x64_MI16x16x8x1_SE_1LDSB0_AF0EM8_GRVW8_LBSPP128_LPA8_LPB8_PLR9_SU32_SUS256_SRVW4_TT1_16_WG32_8_1_WGM15
    SolutionIndex: 26
    SolutionNameMin: Cijk_Alik_Bljk_BSS_BH_MT64x64x64_MI32x32x4x1_SE_1LDSB0_AF0EM8_GRVW8_LBSPP128_LPA8_LPB8_PLR17_SU32_SUS256_SRVW4_TT1_32_WG64_4_1_WGM15
    SolutionIndex: 27
    SolutionNameMin: Cijk_Alik_Bljk_BSS_BH_MT32x64x32_MI16x16x8x1_SE_1LDSB1_AF0EM8_GRVW2_LBSPP128_LPA4_LPB4_PLR5_SU0_SUS128_SRVW4_TT1_32_WG32_8_1_WGM1
    SolutionIndex: 28
    SolutionNameMin: Cijk_Alik_Bljk_BSS_BH_MT64x256x32_MI32x32x4x1_SE_1LDSB1_AF0EM8_GRVW2_LBSPP128_LPA4_LPB4_PLR9_SU0_SUS128_SRVW4_TT1_128_WG64_4_1_WGM1
    SolutionIndex: 29
    SolutionNameMin: Cijk_Alik_Bljk_BSS_BH_MT128x96x32_MI32x32x4x1_SE_1LDSB1_AF0EM8_GRVW2_LBSPP128_LPA4_LPB4_PLR9_SU0_SUS128_SRVW4_TT1_96_WG128_2_1_WGM1
    SolutionIndex: 30
    SolutionNameMin: Cijk_Alik_Bljk_BSS_BH_MT128x160x32_MI32x32x4x1_SE_1LDSB1_AF0EM8_GRVW2_LBSPP128_LPA4_LPB4_PLR9_SU0_SUS128_SRVW4_TT1_160_WG128_2_1_WGM1
    SolutionIndex: 31
    SolutionNameMin: Cijk_Alik_Bljk_BSS_BH_MT64x32x64_MI16x16x8x1_SE_1LDSB1_AF0EM8_GRVW2_LBSPP128_LPA4_LPB4_PLR9_SU0_SUS128_SRVW4_TT2_16_WG32_8_1_WGM1
    SolutionIndex: 32
    SolutionNameMin: Cijk_Alik_Bljk_BSS_BH_MT64x64x64_MI32x32x4x1_SE_1LDSB1_AF0EM8_GRVW2_LBSPP128_LPA4_LPB4_PLR17_SU0_SUS128_SRVW4_TT1_32_WG64_4_1_WGM1
    SolutionIndex: 33
    SolutionNameMin: Cijk_Alik_Bljk_BSS_BH_MT128x96x32_MI32x32x4x1_SE_1LDSB1_AF0EM8_GRVW4_LBSPP128_LPA4_LPB4_PLR9_SU0_SUS128_SRVW4_TT1_96_WG128_2_1_WGM1
    SolutionIndex: 34
    SolutionNameMin: Cijk_Alik_Bljk_BSS_BH_MT32x32x64_MI16x16x8x1_SE_1LDSB1_AF0EM8_GRVW4_LBSPP128_LPA4_LPB4_PLR9_SU0_SUS128_SRVW4_TT1_16_WG32_8_1_WGM1
    SolutionIndex: 35
    SolutionNameMin: Cijk_Alik_Bljk_BSS_BH_MT64x32x64_MI16x16x8x1_SE_1LDSB1_AF0EM8_GRVW4_LBSPP128_LPA4_LPB4_PLR9_SU0_SUS128_SRVW4_TT2_16_WG32_8_1_WGM1
    SolutionIndex: 36
    SolutionNameMin: Cijk_Alik_Bljk_BSS_BH_MT64x256x32_MI32x32x4x1_SE_1LDSB1_AF0EM8_GRVW8_LBSPP128_LPA8_LPB8_PLR9_SU0_SUS128_SRVW4_TT1_128_WG64_4_1_WGM1
    SolutionIndex: 37
    SolutionNameMin: Cijk_Alik_Bljk_BSS_BH_MT32x32x64_MI16x16x8x1_SE_1LDSB1_AF0EM8_GRVW8_LBSPP128_LPA8_LPB8_PLR9_SU0_SUS128_SRVW4_TT1_16_WG32_8_1_WGM1
    SolutionIndex: 38
    SolutionNameMin: Cijk_Alik_Bljk_BSS_BH_MT64x32x64_MI16x16x8x1_SE_1LDSB1_AF0EM8_GRVW8_LBSPP128_LPA8_LPB8_PLR9_SU0_SUS128_SRVW4_TT2_16_WG32_8_1_WGM1
    SolutionIndex: 39
    SolutionNameMin: Cijk_Alik_Bljk_BSS_BH_MT96x96x64_MI16x16x8x1_SE_1LDSB1_AF0EM8_GRVW8_LBSPP128_LPA8_LPB8_PLR9_SU0_SUS128_SRVW0_TT3_48_WG32_8_1_WGM1
    SolutionIndex: 40
    SolutionNameMin: Cijk_Alik_Bljk_BSS_BH_MT64x64x64_MI32x32x4x1_SE_1LDSB1_AF0EM8_GRVW8_LBSPP128_LPA8_LPB8_PLR17_SU0_SUS128_SRVW4_TT1_32_WG64_4_1_WGM1
    SolutionIndex: 41
    SolutionNameMin: Cijk_Alik_Bljk_BSS_BH_MT64x128x64_MI32x32x4x1_SE_1LDSB1_AF0EM8_GRVW8_LBSPP128_LPA8_LPB8_PLR17_SU0_SUS128_SRVW4_TT1_64_WG64_4_1_WGM1
    SolutionIndex: 42
    SolutionNameMin: Cijk_Alik_Bljk_BSS_BH_MT128x96x64_MI32x32x4x1_SE_1LDSB1_AF0EM8_GRVW8_LBSPP128_LPA8_LPB8_PLR17_SU0_SUS128_SRVW4_TT1_96_WG128_2_1_WGM1
    SolutionIndex: 43
    SolutionNameMin: Cijk_Alik_Bljk_BSS_BH_MT64x128x32_MI32x32x4x1_SE_1LDSB1_AF0EM8_GRVW2_LBSPP128_LPA4_LPB4_PLR9_SU0_SUS256_SRVW4_TT1_64_WG64_4_1_WGM1
    SolutionIndex: 44
    SolutionNameMin: Cijk_Alik_Bljk_BSS_BH_MT128x96x32_MI32x32x4x1_SE_1LDSB1_AF0EM8_GRVW2_LBSPP128_LPA4_LPB4_PLR9_SU0_SUS256_SRVW4_TT1_96_WG128_2_1_WGM1
    SolutionIndex: 45
    SolutionNameMin: Cijk_Alik_Bljk_BSS_BH_MT128x160x32_MI32x32x4x1_SE_1LDSB1_AF0EM8_GRVW2_LBSPP128_LPA4_LPB4_PLR9_SU0_SUS256_SRVW4_TT1_160_WG128_2_1_WGM1
    SolutionIndex: 46
    SolutionNameMin: Cijk_Alik_Bljk_BSS_BH_MT64x64x64_MI32x32x4x1_SE_1LDSB1_AF0EM8_GRVW2_LBSPP128_LPA4_LPB4_PLR17_SU0_SUS256_SRVW4_TT1_32_WG64_4_1_WGM1
    SolutionIndex: 47
    SolutionNameMin: Cijk_Alik_Bljk_BSS_BH_MT128x96x64_MI32x32x4x1_SE_1LDSB1_AF0EM8_GRVW2_LBSPP128_LPA4_LPB4_PLR17_SU0_SUS256_SRVW4_TT1_96_WG128_2_1_WGM1
    SolutionIndex: 48
    SolutionNameMin: Cijk_Alik_Bljk_BSS_BH_MT96x96x32_MI16x16x8x1_SE_1LDSB1_AF0EM8_GRVW4_LBSPP128_LPA4_LPB4_PLR5_SU0_SUS256_SRVW0_TT3_48_WG32_8_1_WGM1
    SolutionIndex: 49
    SolutionNameMin: Cijk_Alik_Bljk_BSS_BH_MT64x256x32_MI32x32x4x1_SE_1LDSB1_AF0EM8_GRVW4_LBSPP128_LPA4_LPB4_PLR9_SU0_SUS256_SRVW4_TT1_128_WG64_4_1_WGM1
    SolutionIndex: 50
    SolutionNameMin: Cijk_Alik_Bljk_BSS_BH_MT128x96x32_MI32x32x4x1_SE_1LDSB1_AF0EM8_GRVW4_LBSPP128_LPA4_LPB4_PLR9_SU0_SUS256_SRVW4_TT1_96_WG128_2_1_WGM1
    SolutionIndex: 51
    SolutionNameMin: Cijk_Alik_Bljk_BSS_BH_MT64x32x64_MI16x16x8x1_SE_1LDSB1_AF0EM8_GRVW4_LBSPP128_LPA4_LPB4_PLR9_SU0_SUS256_SRVW4_TT2_16_WG32_8_1_WGM1
    SolutionIndex: 52
    SolutionNameMin: Cijk_Alik_Bljk_BSS_BH_MT64x256x32_MI32x32x4x1_SE_1LDSB1_AF0EM8_GRVW8_LBSPP128_LPA8_LPB8_PLR9_SU0_SUS256_SRVW4_TT1_128_WG64_4_1_WGM1
    SolutionIndex: 53
    SolutionNameMin: Cijk_Alik_Bljk_BSS_BH_MT32x32x64_MI16x16x8x1_SE_1LDSB1_AF0EM8_GRVW8_LBSPP128_LPA8_LPB8_PLR9_SU0_SUS256_SRVW4_TT1_16_WG32_8_1_WGM1
    SolutionIndex: 54
    SolutionNameMin: Cijk_Alik_Bljk_BSS_BH_MT64x32x64_MI16x16x8x1_SE_1LDSB1_AF0EM8_GRVW8_LBSPP128_LPA8_LPB8_PLR9_SU0_SUS256_SRVW4_TT2_16_WG32_8_1_WGM1
    SolutionIndex: 55
    SolutionNameMin: Cijk_Alik_Bljk_BSS_BH_MT96x96x64_MI16x16x8x1_SE_1LDSB1_AF0EM8_GRVW8_LBSPP128_LPA8_LPB8_PLR9_SU0_SUS256_SRVW0_TT3_48_WG32_8_1_WGM1
    SolutionIndex: 56
    SolutionNameMin: Cijk_Alik_Bljk_BSS_BH_MT64x64x64_MI32x32x4x1_SE_1LDSB1_AF0EM8_GRVW8_LBSPP128_LPA8_LPB8_PLR17_SU0_SUS256_SRVW4_TT1_32_WG64_4_1_WGM1
    SolutionIndex: 57
    SolutionNameMin: Cijk_Alik_Bljk_BSS_BH_MT64x128x64_MI32x32x4x1_SE_1LDSB1_AF0EM8_GRVW8_LBSPP128_LPA8_LPB8_PLR17_SU0_SUS256_SRVW4_TT1_64_WG64_4_1_WGM1
    SolutionIndex: 58
    SolutionNameMin: Cijk_Alik_Bljk_BSS_BH_MT128x96x64_MI32x32x4x1_SE_1LDSB1_AF0EM8_GRVW8_LBSPP128_LPA8_LPB8_PLR17_SU0_SUS256_SRVW4_TT1_96_WG128_2_1_WGM1
    SolutionIndex: 59
    SolutionNameMin: Cijk_Alik_Bljk_BSS_BH_MT64x256x32_MI32x32x4x1_SE_1LDSB1_AF0EM8_GRVW2_LBSPP128_LPA4_LPB4_PLR9_SU32_SUS128_SRVW4_TT1_128_WG64_4_1_WGM1
    SolutionIndex: 60
    SolutionNameMin: Cijk_Alik_Bljk_BSS_BH_MT128x96x32_MI32x32x4x1_SE_1LDSB1_AF0EM8_GRVW2_LBSPP128_LPA4_LPB4_PLR9_SU32_SUS128_SRVW4_TT1_96_WG128_2_1_WGM1
    SolutionIndex: 61
    SolutionNameMin: Cijk_Alik_Bljk_BSS_BH_MT128x160x32_MI32x32x4x1_SE_1LDSB1_AF0EM8_GRVW2_LBSPP128_LPA4_LPB4_PLR9_SU32_SUS128_SRVW4_TT1_160_WG128_2_1_WGM1
    SolutionIndex: 62
    SolutionNameMin: Cijk_Alik_Bljk_BSS_BH_MT64x128x64_MI32x32x4x1_SE_1LDSB1_AF0EM8_GRVW2_LBSPP128_LPA4_LPB4_PLR17_SU32_SUS128_SRVW4_TT1_64_WG64_4_1_WGM1
    SolutionIndex: 63
    SolutionNameMin: Cijk_Alik_Bljk_BSS_BH_MT128x96x64_MI32x32x4x1_SE_1LDSB1_AF0EM8_GRVW2_LBSPP128_LPA4_LPB4_PLR17_SU32_SUS128_SRVW4_TT1_96_WG128_2_1_WGM1
    SolutionIndex: 64
    SolutionNameMin: Cijk_Alik_Bljk_BSS_BH_MT64x32x64_MI16x16x8x1_SE_1LDSB1_AF0EM8_GRVW4_LBSPP128_LPA4_LPB4_PLR9_SU32_SUS128_SRVW4_TT2_16_WG32_8_1_WGM1
    SolutionIndex: 65
    SolutionNameMin: Cijk_Alik_Bljk_BSS_BH_MT64x128x32_MI32x32x4x1_SE_1LDSB1_AF0EM8_GRVW8_LBSPP128_LPA8_LPB8_PLR9_SU32_SUS128_SRVW4_TT1_64_WG64_4_1_WGM1
    SolutionIndex: 66
    SolutionNameMin: Cijk_Alik_Bljk_BSS_BH_MT32x32x64_MI16x16x8x1_SE_1LDSB1_AF0EM8_GRVW8_LBSPP128_LPA8_LPB8_PLR9_SU32_SUS128_SRVW4_TT1_16_WG32_8_1_WGM1
    SolutionIndex: 67
    SolutionNameMin: Cijk_Alik_Bljk_BSS_BH_MT64x64x64_MI32x32x4x1_SE_1LDSB1_AF0EM8_GRVW8_LBSPP128_LPA8_LPB8_PLR17_SU32_SUS128_SRVW4_TT1_32_WG64_4_1_WGM1
    SolutionIndex: 68
    SolutionNameMin: Cijk_Alik_Bljk_BSS_BH_MT64x128x64_MI32x32x4x1_SE_1LDSB1_AF0EM8_GRVW8_LBSPP128_LPA8_LPB8_PLR17_SU32_SUS128_SRVW4_TT1_64_WG64_4_1_WGM1
    SolutionIndex: 69
    SolutionNameMin: Cijk_Alik_Bljk_BSS_BH_MT128x96x64_MI32x32x4x1_SE_1LDSB1_AF0EM8_GRVW8_LBSPP128_LPA8_LPB8_PLR17_SU32_SUS128_SRVW4_TT1_96_WG128_2_1_WGM1
    SolutionIndex: 70
    SolutionNameMin: Cijk_Alik_Bljk_BSS_BH_MT128x96x32_MI32x32x4x1_SE_1LDSB1_AF0EM8_GRVW2_LBSPP128_LPA4_LPB4_PLR9_SU32_SUS256_SRVW4_TT1_96_WG128_2_1_WGM1
    SolutionIndex: 71
    SolutionNameMin: Cijk_Alik_Bljk_BSS_BH_MT64x64x64_MI32x32x4x1_SE_1LDSB1_AF0EM8_GRVW8_LBSPP128_LPA8_LPB8_PLR17_SU32_SUS256_SRVW4_TT1_32_WG64_4_1_WGM1
    SolutionIndex: 72
    SolutionNameMin: Cijk_Alik_Bljk_BSS_BH_MT32x64x32_MI16x16x8x1_SE_1LDSB1_AF0EM8_GRVW2_LBSPP128_LPA4_LPB4_PLR5_SU0_SUS128_SRVW4_TT1_32_WG32_8_1_WGM2
    SolutionIndex: 73
    SolutionNameMin: Cijk_Alik_Bljk_BSS_BH_MT64x256x32_MI32x32x4x1_SE_1LDSB1_AF0EM8_GRVW2_LBSPP128_LPA4_LPB4_PLR9_SU0_SUS128_SRVW4_TT1_128_WG64_4_1_WGM2
    SolutionIndex: 74
    SolutionNameMin: Cijk_Alik_Bljk_BSS_BH_MT128x160x32_MI32x32x4x1_SE_1LDSB1_AF0EM8_GRVW2_LBSPP128_LPA4_LPB4_PLR9_SU0_SUS128_SRVW4_TT1_160_WG128_2_1_WGM2
    SolutionIndex: 75
    SolutionNameMin: Cijk_Alik_Bljk_BSS_BH_MT32x32x64_MI16x16x8x1_SE_1LDSB1_AF0EM8_GRVW2_LBSPP128_LPA4_LPB4_PLR9_SU0_SUS128_SRVW4_TT1_16_WG32_8_1_WGM2
    SolutionIndex: 76
    SolutionNameMin: Cijk_Alik_Bljk_BSS_BH_MT64x64x64_MI32x32x4x1_SE_1LDSB1_AF0EM8_GRVW2_LBSPP128_LPA4_LPB4_PLR17_SU0_SUS128_SRVW4_TT1_32_WG64_4_1_WGM2
    SolutionIndex: 77
    SolutionNameMin: Cijk_Alik_Bljk_BSS_BH_MT128x96x64_MI32x32x4x1_SE_1LDSB1_AF0EM8_GRVW2_LBSPP128_LPA4_LPB4_PLR17_SU0_SUS128_SRVW4_TT1_96_WG128_2_1_WGM2
    SolutionIndex: 78
    SolutionNameMin: Cijk_Alik_Bljk_BSS_BH_MT64x64x64_MI32x32x4x1_SE_1LDSB1_AF0EM8_GRVW4_LBSPP128_LPA4_LPB4_PLR17_SU0_SUS128_SRVW4_TT1_32_WG64_4_1_WGM2
    SolutionIndex: 79
    SolutionNameMin: Cijk_Alik_Bljk_BSS_BH_MT64x128x32_MI32x32x4x1_SE_1LDSB1_AF0EM8_GRVW8_LBSPP128_LPA8_LPB8_PLR9_SU0_SUS128_SRVW4_TT1_64_WG64_4_1_WGM2
    SolutionIndex: 80
    SolutionNameMin: Cijk_Alik_Bljk_BSS_BH_MT64x64x64_MI32x32x4x1_SE_1LDSB1_AF0EM8_GRVW8_LBSPP128_LPA8_LPB8_PLR17_SU0_SUS128_SRVW4_TT1_32_WG64_4_1_WGM2
    SolutionIndex: 81
    SolutionNameMin: Cijk_Alik_Bljk_BSS_BH_MT64x128x64_MI32x32x4x1_SE_1LDSB1_AF0EM8_GRVW8_LBSPP128_LPA8_LPB8_PLR17_SU0_SUS128_SRVW4_TT1_64_WG64_4_1_WGM2
    SolutionIndex: 82
    SolutionNameMin: Cijk_Alik_Bljk_BSS_BH_MT128x64x64_MI32x32x4x1_SE_1LDSB1_AF0EM8_GRVW8_LBSPP128_LPA8_LPB8_PLR17_SU0_SUS128_SRVW4_TT2_32_WG64_4_1_WGM2
    SolutionIndex: 83
    SolutionNameMin: Cijk_Alik_Bljk_BSS_BH_MT128x96x64_MI32x32x4x1_SE_1LDSB1_AF0EM8_GRVW8_LBSPP128_LPA8_LPB8_PLR17_SU0_SUS128_SRVW4_TT1_96_WG128_2_1_WGM2
    SolutionIndex: 84
    SolutionNameMin: Cijk_Alik_Bljk_BSS_BH_MT128x96x32_MI32x32x4x1_SE_1LDSB1_AF0EM8_GRVW2_LBSPP128_LPA4_LPB4_PLR9_SU0_SUS256_SRVW4_TT1_96_WG128_2_1_WGM2
    SolutionIndex: 85
    SolutionNameMin: Cijk_Alik_Bljk_BSS_BH_MT128x160x32_MI32x32x4x1_SE_1LDSB1_AF0EM8_GRVW2_LBSPP128_LPA4_LPB4_PLR9_SU0_SUS256_SRVW4_TT1_160_WG128_2_1_WGM2
    SolutionIndex: 86
    SolutionNameMin: Cijk_Alik_Bljk_BSS_BH_MT32x32x64_MI16x16x8x1_SE_1LDSB1_AF0EM8_GRVW2_LBSPP128_LPA4_LPB4_PLR9_SU0_SUS256_SRVW4_TT1_16_WG32_8_1_WGM2
    SolutionIndex: 87
    SolutionNameMin: Cijk_Alik_Bljk_BSS_BH_MT96x96x64_MI16x16x8x1_SE_1LDSB1_AF0EM8_GRVW2_LBSPP128_LPA4_LPB4_PLR9_SU0_SUS256_SRVW0_TT3_48_WG32_8_1_WGM2
    SolutionIndex: 88
    SolutionNameMin: Cijk_Alik_Bljk_BSS_BH_MT128x96x64_MI32x32x4x1_SE_1LDSB1_AF0EM8_GRVW2_LBSPP128_LPA4_LPB4_PLR17_SU0_SUS256_SRVW4_TT1_96_WG128_2_1_WGM2
    SolutionIndex: 89
    SolutionNameMin: Cijk_Alik_Bljk_BSS_BH_MT64x64x64_MI32x32x4x1_SE_1LDSB1_AF0EM8_GRVW4_LBSPP128_LPA4_LPB4_PLR17_SU0_SUS256_SRVW4_TT1_32_WG64_4_1_WGM2
    SolutionIndex: 90
    SolutionNameMin: Cijk_Alik_Bljk_BSS_BH_MT64x128x32_MI32x32x4x1_SE_1LDSB1_AF0EM8_GRVW8_LBSPP128_LPA8_LPB8_PLR9_SU0_SUS256_SRVW4_TT1_64_WG64_4_1_WGM2
    SolutionIndex: 91
    SolutionNameMin: Cijk_Alik_Bljk_BSS_BH_MT64x256x32_MI32x32x4x1_SE_1LDSB1_AF0EM8_GRVW8_LBSPP128_LPA8_LPB8_PLR9_SU0_SUS256_SRVW4_TT1_128_WG64_4_1_WGM2
    SolutionIndex: 92
    SolutionNameMin: Cijk_Alik_Bljk_BSS_BH_MT32x32x64_MI16x16x8x1_SE_1LDSB1_AF0EM8_GRVW8_LBSPP128_LPA8_LPB8_PLR9_SU0_SUS256_SRVW4_TT1_16_WG32_8_1_WGM2
    SolutionIndex: 93
    SolutionNameMin: Cijk_Alik_Bljk_BSS_BH_MT64x64x64_MI32x32x4x1_SE_1LDSB1_AF0EM8_GRVW8_LBSPP128_LPA8_LPB8_PLR17_SU0_SUS256_SRVW4_TT1_32_WG64_4_1_WGM2
    SolutionIndex: 94
    SolutionNameMin: Cijk_Alik_Bljk_BSS_BH_MT64x128x64_MI32x32x4x1_SE_1LDSB1_AF0EM8_GRVW8_LBSPP128_LPA8_LPB8_PLR17_SU0_SUS256_SRVW4_TT1_64_WG64_4_1_WGM2
    SolutionIndex: 95
    SolutionNameMin: Cijk_Alik_Bljk_BSS_BH_MT128x96x64_MI32x32x4x1_SE_1LDSB1_AF0EM8_GRVW8_LBSPP128_LPA8_LPB8_PLR17_SU0_SUS256_SRVW4_TT1_96_WG128_2_1_WGM2
    SolutionIndex: 96
    SolutionNameMin: Cijk_Alik_Bljk_BSS_BH_MT160x128x32_MI32x32x4x1_SE_1LDSB1_AF0EM8_GRVW2_LBSPP128_LPA4_LPB4_PLR9_SU32_SUS128_SRVW0_TT5_32_WG32_8_1_WGM2
    SolutionIndex: 97
    SolutionNameMin: Cijk_Alik_Bljk_BSS_BH_MT128x96x64_MI32x32x4x1_SE_1LDSB1_AF0EM8_GRVW2_LBSPP128_LPA4_LPB4_PLR17_SU32_SUS128_SRVW4_TT1_96_WG128_2_1_WGM2
    SolutionIndex: 98
    SolutionNameMin: Cijk_Alik_Bljk_BSS_BH_MT64x64x64_MI32x32x4x1_SE_1LDSB1_AF0EM8_GRVW4_LBSPP128_LPA4_LPB4_PLR17_SU32_SUS128_SRVW4_TT1_32_WG64_4_1_WGM2
    SolutionIndex: 99
    SolutionNameMin: Cijk_Alik_Bljk_BSS_BH_MT64x128x32_MI32x32x4x1_SE_1LDSB1_AF0EM8_GRVW8_LBSPP128_LPA8_LPB8_PLR9_SU32_SUS128_SRVW4_TT1_64_WG64_4_1_WGM2
    SolutionIndex: 100
    SolutionNameMin: Cijk_Alik_Bljk_BSS_BH_MT32x32x64_MI16x16x8x1_SE_1LDSB1_AF0EM8_GRVW8_LBSPP128_LPA8_LPB8_PLR9_SU32_SUS128_SRVW4_TT1_16_WG32_8_1_WGM2
    SolutionIndex: 101
    SolutionNameMin: Cijk_Alik_Bljk_BSS_BH_MT64x64x64_MI32x32x4x1_SE_1LDSB1_AF0EM8_GRVW8_LBSPP128_LPA8_LPB8_PLR17_SU32_SUS128_SRVW4_TT1_32_WG64_4_1_WGM2
    SolutionIndex: 102
    SolutionNameMin: Cijk_Alik_Bljk_BSS_BH_MT64x128x64_MI32x32x4x1_SE_1LDSB1_AF0EM8_GRVW8_LBSPP128_LPA8_LPB8_PLR17_SU32_SUS128_SRVW4_TT1_64_WG64_4_1_WGM2
    SolutionIndex: 103
    SolutionNameMin: Cijk_Alik_Bljk_BSS_BH_MT128x96x64_MI32x32x4x1_SE_1LDSB1_AF0EM8_GRVW8_LBSPP128_LPA8_LPB8_PLR17_SU32_SUS128_SRVW4_TT1_96_WG128_2_1_WGM2
    SolutionIndex: 104
    SolutionNameMin: Cijk_Alik_Bljk_BSS_BH_MT128x96x64_MI32x32x4x1_SE_1LDSB1_AF0EM8_GRVW2_LBSPP128_LPA4_LPB4_PLR17_SU32_SUS256_SRVW4_TT1_96_WG128_2_1_WGM2
    SolutionIndex: 105
    SolutionNameMin: Cijk_Alik_Bljk_BSS_BH_MT128x96x32_MI32x32x4x1_SE_1LDSB1_AF0EM8_GRVW4_LBSPP128_LPA4_LPB4_PLR9_SU32_SUS256_SRVW4_TT1_96_WG128_2_1_WGM2
    SolutionIndex: 106
    SolutionNameMin: Cijk_Alik_Bljk_BSS_BH_MT64x64x64_MI32x32x4x1_SE_1LDSB1_AF0EM8_GRVW8_LBSPP128_LPA8_LPB8_PLR17_SU32_SUS256_SRVW4_TT1_32_WG64_4_1_WGM2
    SolutionIndex: 107
    SolutionNameMin: Cijk_Alik_Bljk_BSS_BH_MT64x128x64_MI32x32x4x1_SE_1LDSB1_AF0EM8_GRVW8_LBSPP128_LPA8_LPB8_PLR17_SU32_SUS256_SRVW4_TT1_64_WG64_4_1_WGM2
    SolutionIndex: 108
    SolutionNameMin: Cijk_Alik_Bljk_BSS_BH_MT128x96x64_MI32x32x4x1_SE_1LDSB1_AF0EM8_GRVW8_LBSPP128_LPA8_LPB8_PLR17_SU32_SUS256_SRVW4_TT1_96_WG128_2_1_WGM2
    SolutionIndex: 109
    SolutionNameMin: Cijk_Alik_Bljk_BSS_BH_MT32x64x32_MI16x16x8x1_SE_1LDSB1_AF0EM8_GRVW2_LBSPP128_LPA4_LPB4_PLR5_SU0_SUS128_SRVW4_TT1_32_WG32_8_1_WGM15
    SolutionIndex: 110
    SolutionNameMin: Cijk_Alik_Bljk_BSS_BH_MT128x160x32_MI32x32x4x1_SE_1LDSB1_AF0EM8_GRVW2_LBSPP128_LPA4_LPB4_PLR9_SU0_SUS128_SRVW4_TT1_160_WG128_2_1_WGM15
    SolutionIndex: 111
    SolutionNameMin: Cijk_Alik_Bljk_BSS_BH_MT128x144x64_MI16x16x8x1_SE_1LDSB1_AF0EM8_GRVW2_LBSPP128_LPA4_LPB4_PLR9_SU0_SUS128_SRVW4_TT2_144_WG64_4_1_WGM15
    SolutionIndex: 112
    SolutionNameMin: Cijk_Alik_Bljk_BSS_BH_MT128x128x64_MI32x32x4x1_SE_1LDSB1_AF0EM8_GRVW2_LBSPP128_LPA4_LPB4_PLR17_SU0_SUS128_SRVW4_TT2_64_WG64_4_1_WGM15
    SolutionIndex: 113
    SolutionNameMin: Cijk_Alik_Bljk_BSS_BH_MT128x96x64_MI32x32x4x1_SE_1LDSB1_AF0EM8_GRVW2_LBSPP128_LPA4_LPB4_PLR17_SU0_SUS128_SRVW4_TT1_96_WG128_2_1_WGM15
    SolutionIndex: 114
    SolutionNameMin: Cijk_Alik_Bljk_BSS_BH_MT96x128x64_MI32x32x4x1_SE_1LDSB1_AF0EM8_GRVW2_LBSPP128_LPA4_LPB4_PLR17_SU0_SUS128_SRVW0_TT3_32_WG32_8_1_WGM15
    SolutionIndex: 115
    SolutionNameMin: Cijk_Alik_Bljk_BSS_BH_MT128x96x32_MI32x32x4x1_SE_1LDSB1_AF0EM8_GRVW4_LBSPP128_LPA4_LPB4_PLR9_SU0_SUS128_SRVW4_TT1_96_WG128_2_1_WGM15
    SolutionIndex: 116
    SolutionNameMin: Cijk_Alik_Bljk_BSS_BH_MT32x64x64_MI16x16x8x1_SE_1LDSB1_AF0EM8_GRVW4_LBSPP128_LPA4_LPB4_PLR9_SU0_SUS128_SRVW4_TT1_32_WG32_8_1_WGM15
    SolutionIndex: 117
    SolutionNameMin: Cijk_Alik_Bljk_BSS_BH_MT64x64x64_MI32x32x4x1_SE_1LDSB1_AF0EM8_GRVW4_LBSPP128_LPA4_LPB4_PLR17_SU0_SUS128_SRVW4_TT1_32_WG64_4_1_WGM15
    SolutionIndex: 118
    SolutionNameMin: Cijk_Alik_Bljk_BSS_BH_MT32x64x32_MI16x16x8x1_SE_1LDSB1_AF0EM8_GRVW8_LBSPP128_LPA8_LPB8_PLR5_SU0_SUS128_SRVW4_TT1_32_WG32_8_1_WGM15
    SolutionIndex: 119
    SolutionNameMin: Cijk_Alik_Bljk_BSS_BH_MT64x64x32_MI32x32x4x1_SE_1LDSB1_AF0EM8_GRVW8_LBSPP128_LPA8_LPB8_PLR9_SU0_SUS128_SRVW4_TT1_32_WG64_4_1_WGM15
    SolutionIndex: 120
    SolutionNameMin: Cijk_Alik_Bljk_BSS_BH_MT64x128x32_MI32x32x4x1_SE_1LDSB1_AF0EM8_GRVW8_LBSPP128_LPA8_LPB8_PLR9_SU0_SUS128_SRVW4_TT1_64_WG64_4_1_WGM15
    SolutionIndex: 121
    SolutionNameMin: Cijk_Alik_Bljk_BSS_BH_MT32x32x64_MI16x16x8x1_SE_1LDSB1_AF0EM8_GRVW8_LBSPP128_LPA8_LPB8_PLR9_SU0_SUS128_SRVW4_TT1_16_WG32_8_1_WGM15
    SolutionIndex: 122
    SolutionNameMin: Cijk_Alik_Bljk_BSS_BH_MT32x64x64_MI16x16x8x1_SE_1LDSB1_AF0EM8_GRVW8_LBSPP128_LPA8_LPB8_PLR9_SU0_SUS128_SRVW4_TT1_32_WG32_8_1_WGM15
    SolutionIndex: 123
    SolutionNameMin: Cijk_Alik_Bljk_BSS_BH_MT64x32x64_MI16x16x8x1_SE_1LDSB1_AF0EM8_GRVW8_LBSPP128_LPA8_LPB8_PLR9_SU0_SUS128_SRVW4_TT2_16_WG32_8_1_WGM15
    SolutionIndex: 124
    SolutionNameMin: Cijk_Alik_Bljk_BSS_BH_MT96x96x64_MI16x16x8x1_SE_1LDSB1_AF0EM8_GRVW8_LBSPP128_LPA8_LPB8_PLR9_SU0_SUS128_SRVW0_TT3_48_WG32_8_1_WGM15
    SolutionIndex: 125
    SolutionNameMin: Cijk_Alik_Bljk_BSS_BH_MT64x64x64_MI32x32x4x1_SE_1LDSB1_AF0EM8_GRVW8_LBSPP128_LPA8_LPB8_PLR17_SU0_SUS128_SRVW4_TT1_32_WG64_4_1_WGM15
    SolutionIndex: 126
    SolutionNameMin: Cijk_Alik_Bljk_BSS_BH_MT64x128x64_MI32x32x4x1_SE_1LDSB1_AF0EM8_GRVW8_LBSPP128_LPA8_LPB8_PLR17_SU0_SUS128_SRVW4_TT1_64_WG64_4_1_WGM15
    SolutionIndex: 127
    SolutionNameMin: Cijk_Alik_Bljk_BSS_BH_MT128x64x64_MI32x32x4x1_SE_1LDSB1_AF0EM8_GRVW8_LBSPP128_LPA8_LPB8_PLR17_SU0_SUS128_SRVW4_TT2_32_WG64_4_1_WGM15
    SolutionIndex: 128
    SolutionNameMin: Cijk_Alik_Bljk_BSS_BH_MT128x96x64_MI32x32x4x1_SE_1LDSB1_AF0EM8_GRVW8_LBSPP128_LPA8_LPB8_PLR17_SU0_SUS128_SRVW4_TT1_96_WG128_2_1_WGM15
    SolutionIndex: 129
    SolutionNameMin: Cijk_Alik_Bljk_BSS_BH_MT32x64x32_MI16x16x8x1_SE_1LDSB1_AF0EM8_GRVW2_LBSPP128_LPA4_LPB4_PLR5_SU0_SUS256_SRVW4_TT1_32_WG32_8_1_WGM15
    SolutionIndex: 130
    SolutionNameMin: Cijk_Alik_Bljk_BSS_BH_MT64x256x32_MI32x32x4x1_SE_1LDSB1_AF0EM8_GRVW2_LBSPP128_LPA4_LPB4_PLR9_SU0_SUS256_SRVW4_TT1_128_WG64_4_1_WGM15
    SolutionIndex: 131
    SolutionNameMin: Cijk_Alik_Bljk_BSS_BH_MT128x160x32_MI32x32x4x1_SE_1LDSB1_AF0EM8_GRVW2_LBSPP128_LPA4_LPB4_PLR9_SU0_SUS256_SRVW4_TT1_160_WG128_2_1_WGM15
    SolutionIndex: 132
    SolutionNameMin: Cijk_Alik_Bljk_BSS_BH_MT96x96x64_MI16x16x8x1_SE_1LDSB1_AF0EM8_GRVW2_LBSPP128_LPA4_LPB4_PLR9_SU0_SUS256_SRVW0_TT3_48_WG32_8_1_WGM15
    SolutionIndex: 133
    SolutionNameMin: Cijk_Alik_Bljk_BSS_BH_MT64x128x64_MI32x32x4x1_SE_1LDSB1_AF0EM8_GRVW2_LBSPP128_LPA4_LPB4_PLR17_SU0_SUS256_SRVW4_TT1_64_WG64_4_1_WGM15
    SolutionIndex: 134
    SolutionNameMin: Cijk_Alik_Bljk_BSS_BH_MT128x96x64_MI32x32x4x1_SE_1LDSB1_AF0EM8_GRVW2_LBSPP128_LPA4_LPB4_PLR17_SU0_SUS256_SRVW4_TT1_96_WG128_2_1_WGM15
    SolutionIndex: 135
    SolutionNameMin: Cijk_Alik_Bljk_BSS_BH_MT64x128x32_MI32x32x4x1_SE_1LDSB1_AF0EM8_GRVW4_LBSPP128_LPA4_LPB4_PLR9_SU0_SUS256_SRVW4_TT1_64_WG64_4_1_WGM15
    SolutionIndex: 136
    SolutionNameMin: Cijk_Alik_Bljk_BSS_BH_MT128x160x32_MI32x32x4x1_SE_1LDSB1_AF0EM8_GRVW4_LBSPP128_LPA4_LPB4_PLR9_SU0_SUS256_SRVW4_TT1_160_WG128_2_1_WGM15
    SolutionIndex: 137
    SolutionNameMin: Cijk_Alik_Bljk_BSS_BH_MT64x32x64_MI16x16x8x1_SE_1LDSB1_AF0EM8_GRVW4_LBSPP128_LPA4_LPB4_PLR9_SU0_SUS256_SRVW4_TT2_16_WG32_8_1_WGM15
    SolutionIndex: 138
    SolutionNameMin: Cijk_Alik_Bljk_BSS_BH_MT64x64x64_MI32x32x4x1_SE_1LDSB1_AF0EM8_GRVW4_LBSPP128_LPA4_LPB4_PLR17_SU0_SUS256_SRVW4_TT1_32_WG64_4_1_WGM15
    SolutionIndex: 139
    SolutionNameMin: Cijk_Alik_Bljk_BSS_BH_MT32x64x32_MI16x16x8x1_SE_1LDSB1_AF0EM8_GRVW8_LBSPP128_LPA8_LPB8_PLR5_SU0_SUS256_SRVW4_TT1_32_WG32_8_1_WGM15
    SolutionIndex: 140
    SolutionNameMin: Cijk_Alik_Bljk_BSS_BH_MT64x128x32_MI32x32x4x1_SE_1LDSB1_AF0EM8_GRVW8_LBSPP128_LPA8_LPB8_PLR9_SU0_SUS256_SRVW4_TT1_64_WG64_4_1_WGM15
    SolutionIndex: 141
    SolutionNameMin: Cijk_Alik_Bljk_BSS_BH_MT32x32x64_MI16x16x8x1_SE_1LDSB1_AF0EM8_GRVW8_LBSPP128_LPA8_LPB8_PLR9_SU0_SUS256_SRVW4_TT1_16_WG32_8_1_WGM15
    SolutionIndex: 142
    SolutionNameMin: Cijk_Alik_Bljk_BSS_BH_MT96x96x64_MI16x16x8x1_SE_1LDSB1_AF0EM8_GRVW8_LBSPP128_LPA8_LPB8_PLR9_SU0_SUS256_SRVW0_TT3_48_WG32_8_1_WGM15
    SolutionIndex: 143
    SolutionNameMin: Cijk_Alik_Bljk_BSS_BH_MT64x64x64_MI32x32x4x1_SE_1LDSB1_AF0EM8_GRVW8_LBSPP128_LPA8_LPB8_PLR17_SU0_SUS256_SRVW4_TT1_32_WG64_4_1_WGM15
    SolutionIndex: 144
    SolutionNameMin: Cijk_Alik_Bljk_BSS_BH_MT64x128x64_MI32x32x4x1_SE_1LDSB1_AF0EM8_GRVW8_LBSPP128_LPA8_LPB8_PLR17_SU0_SUS256_SRVW4_TT1_64_WG64_4_1_WGM15
    SolutionIndex: 145
    SolutionNameMin: Cijk_Alik_Bljk_BSS_BH_MT128x64x64_MI32x32x4x1_SE_1LDSB1_AF0EM8_GRVW8_LBSPP128_LPA8_LPB8_PLR17_SU0_SUS256_SRVW4_TT2_32_WG64_4_1_WGM15
    SolutionIndex: 146
    SolutionNameMin: Cijk_Alik_Bljk_BSS_BH_MT128x160x32_MI32x32x4x1_SE_1LDSB1_AF0EM8_GRVW2_LBSPP128_LPA4_LPB4_PLR9_SU32_SUS128_SRVW4_TT1_160_WG128_2_1_WGM15
    SolutionIndex: 147
    SolutionNameMin: Cijk_Alik_Bljk_BSS_BH_MT128x96x64_MI32x32x4x1_SE_1LDSB1_AF0EM8_GRVW2_LBSPP128_LPA4_LPB4_PLR17_SU32_SUS128_SRVW4_TT1_96_WG128_2_1_WGM15
    SolutionIndex: 148
    SolutionNameMin: Cijk_Alik_Bljk_BSS_BH_MT64x64x64_MI32x32x4x1_SE_1LDSB1_AF0EM8_GRVW4_LBSPP128_LPA4_LPB4_PLR17_SU32_SUS128_SRVW4_TT1_32_WG64_4_1_WGM15
    SolutionIndex: 149
    SolutionNameMin: Cijk_Alik_Bljk_BSS_BH_MT64x128x32_MI32x32x4x1_SE_1LDSB1_AF0EM8_GRVW8_LBSPP128_LPA8_LPB8_PLR9_SU32_SUS128_SRVW4_TT1_64_WG64_4_1_WGM15
    SolutionIndex: 150
    SolutionNameMin: Cijk_Alik_Bljk_BSS_BH_MT64x64x64_MI32x32x4x1_SE_1LDSB1_AF0EM8_GRVW8_LBSPP128_LPA8_LPB8_PLR17_SU32_SUS128_SRVW4_TT1_32_WG64_4_1_WGM15
    SolutionIndex: 151
    SolutionNameMin: Cijk_Alik_Bljk_BSS_BH_MT64x128x64_MI32x32x4x1_SE_1LDSB1_AF0EM8_GRVW8_LBSPP128_LPA8_LPB8_PLR17_SU32_SUS128_SRVW4_TT1_64_WG64_4_1_WGM15
    SolutionIndex: 152
    SolutionNameMin: Cijk_Alik_Bljk_BSS_BH_MT128x96x64_MI32x32x4x1_SE_1LDSB1_AF0EM8_GRVW8_LBSPP128_LPA8_LPB8_PLR17_SU32_SUS128_SRVW4_TT1_96_WG128_2_1_WGM15
    SolutionIndex: 153
    SolutionNameMin: Cijk_Alik_Bljk_BSS_BH_MT128x96x64_MI32x32x4x1_SE_1LDSB1_AF0EM8_GRVW2_LBSPP128_LPA4_LPB4_PLR17_SU32_SUS256_SRVW4_TT1_96_WG128_2_1_WGM15
    SolutionIndex: 154
    SolutionNameMin: Cijk_Alik_Bljk_BSS_BH_MT64x64x32_MI32x32x4x1_SE_1LDSB1_AF0EM8_GRVW8_LBSPP128_LPA8_LPB8_PLR9_SU32_SUS256_SRVW4_TT1_32_WG64_4_1_WGM15
    SolutionIndex: 155
    SolutionNameMin: Cijk_Alik_Bljk_BSS_BH_MT64x64x64_MI32x32x4x1_SE_1LDSB1_AF0EM8_GRVW8_LBSPP128_LPA8_LPB8_PLR17_SU32_SUS256_SRVW4_TT1_32_WG64_4_1_WGM15
    SolutionIndex: 156
    SolutionNameMin: Cijk_Alik_Bljk_BSS_BH_MT64x128x64_MI32x32x4x1_SE_1LDSB1_AF0EM8_GRVW8_LBSPP128_LPA8_LPB8_PLR17_SU32_SUS256_SRVW4_TT1_64_WG64_4_1_WGM15
    SolutionIndex: 157
    SolutionNameMin: Cijk_Alik_Bljk_BSS_BH_MT128x96x64_MI32x32x4x1_SE_1LDSB1_AF0EM8_GRVW8_LBSPP128_LPA8_LPB8_PLR17_SU32_SUS256_SRVW4_TT1_96_WG128_2_1_WGM15
    SolutionIndex: 158
    SolutionNameMin: Cijk_Alik_Bljk_BSS_BH_MT128x64x64_MI32x32x4x1_SE_1LDSB1_AF0EM8_GRVW8_LBSPP128_LPA8_LPB8_PLR17_SU0_SUS256_SRVW0_TT2_32_WG64_4_1_WGM1
    SolutionIndex: 159
    SolutionNameMin: Cijk_Alik_Bljk_BSS_BH_MT128x64x64_MI32x32x4x1_SE_1LDSB1_AF0EM8_GRVW2_LBSPP128_LPA4_LPB4_PLR17_SU32_SUS128_SRVW0_TT2_32_WG64_4_1_WGM1
    SolutionIndex: 160
    SolutionNameMin: Cijk_Alik_Bljk_BSS_BH_MT64x32x64_MI16x16x8x1_SE_1LDSB1_AF0EM8_GRVW2_LBSPP128_LPA4_LPB4_PLR9_SU32_SUS256_SRVW0_TT2_16_WG32_8_1_WGM2
    SolutionIndex: 161
    SolutionNameMin: Cijk_Alik_Bljk_BSS_BH_MT64x32x64_MI16x16x8x1_SE_1LDSB0_AF0EM8_GRVW2_LBSPP128_LPA4_LPB4_PLR9_SU0_SUS256_SRVW0_TT2_16_WG32_8_1_WGM1
    SolutionIndex: 162
    SolutionNameMin: Cijk_Alik_Bljk_BSS_BH_MT128x128x32_MI32x32x4x1_SE_1LDSB0_AF0EM8_GRVW8_LBSPP128_LPA8_LPB8_PLR9_SU0_SUS256_SRVW0_TT2_64_WG64_4_1_WGM15
    SolutionIndex: 163
    SolutionNameMin: Cijk_Alik_Bljk_BSS_BH_MT128x128x64_MI32x32x4x1_SE_1LDSB1_AF0EM8_GRVW2_LBSPP128_LPA4_LPB4_PLR17_SU0_SUS256_SRVW0_TT2_64_WG64_4_1_WGM1
    SolutionIndex: 164
    SolutionNameMin: Cijk_Alik_Bljk_BSS_BH_MT128x64x64_MI32x32x4x1_SE_1LDSB1_AF0EM8_GRVW8_LBSPP128_LPA8_LPB8_PLR17_SU0_SUS256_SRVW0_TT2_32_WG64_4_1_WGM1
    SolutionIndex: 165
    SolutionNameMin: Cijk_Alik_Bljk_BSS_BH_MT128x64x64_MI32x32x4x1_SE_1LDSB1_AF0EM8_GRVW8_LBSPP128_LPA8_LPB8_PLR17_SU0_SUS128_SRVW0_TT2_32_WG64_4_1_WGM15
    SolutionIndex: 166
    SolutionNameMin: Cijk_Alik_Bljk_BSS_BH_MT64x32x64_MI16x16x8x1_SE_1LDSB0_AF0EM8_GRVW2_LBSPP128_LPA4_LPB4_PLR9_SU0_SUS256_SRVW0_TT2_16_WG32_8_1_WGM2
    SolutionIndex: 167
    SolutionNameMin: Cijk_Alik_Bljk_BSS_BH_MT32x32x64_MI16x16x8x1_SE_1LDSB0_AF0EM8_GRVW4_LBSPP128_LPA4_LPB4_PLR9_SU0_SUS256_SRVW0_TT1_16_WG32_8_1_WGM1
    SolutionIndex: 168
    SolutionNameMin: Cijk_Alik_Bljk_BSS_BH_MT32x32x64_MI16x16x8x1_SE_1LDSB0_AF0EM8_GRVW8_LBSPP128_LPA8_LPB8_PLR9_SU0_SUS128_SRVW0_TT1_16_WG32_8_1_WGM2
    SolutionIndex: 169
    SolutionNameMin: Cijk_Alik_Bljk_BSS_BH_MT32x32x64_MI16x16x8x1_SE_1LDSB0_AF0EM8_GRVW8_LBSPP128_LPA8_LPB8_PLR9_SU0_SUS256_SRVW0_TT1_16_WG32_8_1_WGM15
    SolutionIndex: 170
    SolutionNameMin: Cijk_Alik_Bljk_BSS_BH_MT32x32x64_MI16x16x8x1_SE_1LDSB1_AF0EM8_GRVW8_LBSPP128_LPA8_LPB8_PLR9_SU0_SUS128_SRVW0_TT1_16_WG32_8_1_WGM1
    SolutionIndex: 171
    SolutionNameMin: Cijk_Alik_Bljk_BSS_BH_MT32x32x64_MI16x16x8x1_SE_1LDSB1_AF0EM8_GRVW8_LBSPP128_LPA8_LPB8_PLR9_SU0_SUS256_SRVW0_TT1_16_WG32_8_1_WGM2
    SolutionIndex: 172
    SolutionNameMin: Cijk_Alik_Bljk_BSS_BH_MT128x64x64_MI32x32x4x1_SE_1LDSB1_AF0EM8_GRVW2_LBSPP128_LPA4_LPB4_PLR17_SU0_SUS128_SRVW0_TT2_32_WG64_4_1_WGM15
    SolutionIndex: 173
    SolutionNameMin: Cijk_Alik_Bljk_BSS_BH_MT32x32x64_MI16x16x8x1_SE_1LDSB1_AF0EM8_GRVW8_LBSPP128_LPA8_LPB8_PLR9_SU0_SUS256_SRVW0_TT1_16_WG32_8_1_WGM15
    SolutionIndex: 174
    SolutionNameMin: Cijk_Alik_Bljk_BSS_BH_MT32x32x32_MI16x16x8x1_SE_1LDSB0_AF0EM1_GRVW2_LBSPP128_LPA4_LPB4_PLR5_SU0_SUS128_SRVW4_TT1_16_WG32_8_1_WGM1
    SolutionIndex: 175
    SolutionNameMin: Cijk_Alik_Bljk_BSS_BH_MT32x32x64_MI16x16x8x1_SE_1LDSB0_AF0EM1_GRVW2_LBSPP128_LPA4_LPB4_PLR9_SU0_SUS128_SRVW4_TT1_16_WG32_8_1_WGM1
    SolutionIndex: 176
    SolutionNameMin: Cijk_Alik_Bljk_BSS_BH_MT32x32x64_MI16x16x8x1_SE_1LDSB0_AF0EM1_GRVW8_LBSPP128_LPA8_LPB8_PLR9_SU0_SUS128_SRVW4_TT1_16_WG32_8_1_WGM1
    SolutionIndex: 177
    SolutionNameMin: Cijk_Alik_Bljk_BSS_BH_MT64x32x32_MI16x16x8x1_SE_1LDSB1_AF0EM1_GRVW2_LBSPP128_LPA4_LPB4_PLR5_SU0_SUS128_SRVW4_TT2_16_WG32_8_1_WGM1
    SolutionIndex: 178
    SolutionNameMin: Cijk_Alik_Bljk_BSS_BH_MT128x160x32_MI32x32x4x1_SE_1LDSB1_AF0EM1_GRVW2_LBSPP128_LPA4_LPB4_PLR9_SU0_SUS128_SRVW4_TT1_160_WG128_2_1_WGM1
    SolutionIndex: 179
    SolutionNameMin: Cijk_Alik_Bljk_BSS_BH_MT32x32x64_MI16x16x8x1_SE_1LDSB1_AF0EM1_GRVW4_LBSPP128_LPA4_LPB4_PLR9_SU0_SUS128_SRVW4_TT1_16_WG32_8_1_WGM1
    SolutionIndex: 180
    SolutionNameMin: Cijk_Alik_Bljk_BSS_BH_MT32x32x64_MI16x16x8x1_SE_1LDSB1_AF0EM1_GRVW2_LBSPP128_LPA4_LPB4_PLR9_SU0_SUS256_SRVW4_TT1_16_WG32_8_1_WGM1
    SolutionIndex: 181
    SolutionNameMin: Cijk_Alik_Bljk_BSS_BH_MT64x32x32_MI16x16x8x1_SE_1LDSB1_AF0EM1_GRVW4_LBSPP128_LPA4_LPB4_PLR5_SU0_SUS256_SRVW4_TT2_16_WG32_8_1_WGM1
    SolutionIndex: 182
    SolutionNameMin: Cijk_Alik_Bljk_BSS_BH_MT64x64x64_MI32x32x4x1_SE_1LDSB1_AF0EM1_GRVW8_LBSPP128_LPA8_LPB8_PLR17_SU0_SUS256_SRVW4_TT1_32_WG64_4_1_WGM1
    SolutionIndex: 183
    SolutionNameMin: Cijk_Alik_Bljk_BSS_BH_MT64x128x64_MI32x32x4x1_SE_1LDSB1_AF0EM1_GRVW8_LBSPP128_LPA8_LPB8_PLR17_SU0_SUS256_SRVW4_TT1_64_WG64_4_1_WGM1
    SolutionIndex: 184
    SolutionNameMin: Cijk_Alik_Bljk_BSS_BH_MT128x96x32_MI32x32x4x1_SE_1LDSB1_AF0EM1_GRVW2_LBSPP128_LPA4_LPB4_PLR9_SU32_SUS128_SRVW4_TT1_96_WG128_2_1_WGM1
    SolutionIndex: 185
    SolutionNameMin: Cijk_Alik_Bljk_BSS_BH_MT64x64x32_MI32x32x4x1_SE_1LDSB1_AF0EM1_GRVW8_LBSPP128_LPA8_LPB8_PLR9_SU32_SUS128_SRVW4_TT1_32_WG64_4_1_WGM1
    SolutionIndex: 186
    SolutionNameMin: Cijk_Alik_Bljk_BSS_BH_MT32x64x64_MI16x16x8x1_SE_1LDSB1_AF0EM1_GRVW8_LBSPP128_LPA8_LPB8_PLR9_SU32_SUS128_SRVW4_TT1_32_WG32_8_1_WGM1
    SolutionIndex: 187
    SolutionNameMin: Cijk_Alik_Bljk_BSS_BH_MT64x128x64_MI32x32x4x1_SE_1LDSB1_AF0EM1_GRVW8_LBSPP128_LPA8_LPB8_PLR17_SU32_SUS128_SRVW4_TT1_64_WG64_4_1_WGM1
    SolutionIndex: 188
    SolutionNameMin: Cijk_Alik_Bljk_BSS_BH_MT32x32x64_MI16x16x8x1_SE_1LDSB1_AF0EM1_GRVW2_LBSPP128_LPA4_LPB4_PLR9_SU32_SUS256_SRVW4_TT1_16_WG32_8_1_WGM1
    SolutionIndex: 189
    SolutionNameMin: Cijk_Alik_Bljk_BSS_BH_MT128x96x64_MI32x32x4x1_SE_1LDSB1_AF0EM1_GRVW8_LBSPP128_LPA8_LPB8_PLR17_SU32_SUS256_SRVW4_TT1_96_WG128_2_1_WGM1
    SolutionIndex: 190
    SolutionNameMin: Cijk_Alik_Bljk_BSS_BH_MT32x32x64_MI16x16x8x1_SE_1LDSB1_AF0EM1_GRVW2_LBSPP128_LPA4_LPB4_PLR9_SU0_SUS128_SRVW4_TT1_16_WG32_8_1_WGM2
    SolutionIndex: 191
    SolutionNameMin: Cijk_Alik_Bljk_BSS_BH_MT64x32x64_MI16x16x8x1_SE_1LDSB1_AF0EM1_GRVW8_LBSPP128_LPA8_LPB8_PLR9_SU0_SUS256_SRVW4_TT2_16_WG32_8_1_WGM2
    SolutionIndex: 192
    SolutionNameMin: Cijk_Alik_Bljk_BSS_BH_MT128x96x64_MI32x32x4x1_SE_1LDSB1_AF0EM1_GRVW8_LBSPP128_LPA8_LPB8_PLR17_SU32_SUS128_SRVW4_TT1_96_WG128_2_1_WGM2
    SolutionIndex: 193
    SolutionNameMin: Cijk_Alik_Bljk_BSS_BH_MT128x96x64_MI32x32x4x1_SE_1LDSB1_AF0EM1_GRVW2_LBSPP128_LPA4_LPB4_PLR17_SU0_SUS128_SRVW4_TT1_96_WG128_2_1_WGM15
    SolutionIndex: 194
    SolutionNameMin: Cijk_Alik_Bljk_BSS_BH_MT64x128x32_MI32x32x4x1_SE_1LDSB1_AF0EM1_GRVW8_LBSPP128_LPA8_LPB8_PLR9_SU0_SUS128_SRVW4_TT1_64_WG64_4_1_WGM15
    SolutionIndex: 195
    SolutionNameMin: Cijk_Alik_Bljk_BSS_BH_MT128x160x32_MI32x32x4x1_SE_1LDSB1_AF0EM1_GRVW2_LBSPP128_LPA4_LPB4_PLR9_SU0_SUS256_SRVW4_TT1_160_WG128_2_1_WGM15
    SolutionIndex: 196
    SolutionNameMin: Cijk_Alik_Bljk_BSS_BH_MT32x32x64_MI16x16x8x1_SE_1LDSB1_AF0EM1_GRVW2_LBSPP128_LPA4_LPB4_PLR9_SU0_SUS256_SRVW4_TT1_16_WG32_8_1_WGM15
    SolutionIndex: 197
    SolutionNameMin: Cijk_Alik_Bljk_BSS_BH_MT128x96x64_MI32x32x4x1_SE_1LDSB1_AF0EM1_GRVW2_LBSPP128_LPA4_LPB4_PLR17_SU0_SUS256_SRVW4_TT1_96_WG128_2_1_WGM15
    SolutionIndex: 198
    SolutionNameMin: Cijk_Alik_Bljk_BSS_BH_MT32x32x64_MI16x16x8x1_SE_1LDSB1_AF0EM1_GRVW8_LBSPP128_LPA8_LPB8_PLR9_SU0_SUS256_SRVW4_TT1_16_WG32_8_1_WGM15
    SolutionIndex: 199
    SolutionNameMin: Cijk_Alik_Bljk_BSS_BH_MT128x160x32_MI32x32x4x1_SE_1LDSB1_AF0EM1_GRVW2_LBSPP128_LPA4_LPB4_PLR9_SU32_SUS128_SRVW4_TT1_160_WG128_2_1_WGM15
    SolutionIndex: 200
    SolutionNameMin: Cijk_Alik_Bljk_BSS_BH_MT128x96x32_MI32x32x4x1_SE_1LDSB1_AF0EM1_GRVW2_LBSPP128_LPA4_LPB4_PLR9_SU32_SUS256_SRVW4_TT1_96_WG128_2_1_WGM15
    SolutionIndex: 201
    SolutionNameMin: Cijk_Alik_Bljk_BSS_BH_MT128x96x64_MI32x32x4x1_SE_1LDSB1_AF0EM1_GRVW2_LBSPP128_LPA4_LPB4_PLR17_SU32_SUS256_SRVW4_TT1_96_WG128_2_1_WGM15
    SolutionIndex: 202
    SolutionNameMin: Cijk_Alik_Bljk_BSS_BH_MT32x32x64_MI16x16x8x1_SE_1LDSB0_AF0EM1_GRVW8_LBSPP128_LPA8_LPB8_PLR9_SU0_SUS128_SRVW0_TT1_16_WG32_8_1_WGM2
    SolutionIndex: 203
    SolutionNameMin: Cijk_Alik_Bljk_BSS_BH_MT32x32x64_MI16x16x8x1_SE_1LDSB0_AF0EM1_GRVW2_LBSPP128_LPA4_LPB4_PLR9_SU0_SUS128_SRVW0_TT1_16_WG32_8_1_WGM1
    SolutionIndex: 204
    SolutionNameMin: Cijk_Alik_Bljk_BSS_BH_MT32x32x64_MI16x16x8x1_SE_1LDSB0_AF0EM1_GRVW4_LBSPP128_LPA4_LPB4_PLR9_SU0_SUS256_SRVW0_TT1_16_WG32_8_1_WGM1
    SolutionIndex: 205
    SolutionNameMin: Cijk_Alik_Bljk_BSS_BH_MT32x32x64_MI16x16x8x1_SE_1LDSB0_AF0EM1_GRVW8_LBSPP128_LPA8_LPB8_PLR9_SU0_SUS128_SRVW0_TT1_16_WG32_8_1_WGM1
    SolutionIndex: 206
    SolutionNameMin: Cijk_Alik_Bljk_BSS_BH_MT32x32x64_MI16x16x8x1_SE_1LDSB1_AF0EM1_GRVW8_LBSPP128_LPA8_LPB8_PLR9_SU0_SUS256_SRVW0_TT1_16_WG32_8_1_WGM2
    SolutionIndex: 207
    SolutionNameMin: Cijk_Alik_Bljk_BSS_BH_MT16x16x64_MI16x16x8x1_SE_1LDSB0_AF0EM1_GRVW4_LBSPP128_LPA4_LPB4_PLR9_SU0_SUS128_SRVW0_TT1_16_WG16_4_1_WGM1
    SolutionIndex: 208
    SolutionNameMin: Cijk_Alik_Bljk_BSS_BH_MT16x16x64_MI16x16x8x1_SE_1LDSB0_AF0EM1_GRVW8_LBSPP128_LPA8_LPB8_PLR9_SU0_SUS128_SRVW0_TT1_16_WG16_4_1_WGM1
    SolutionIndex: 209
    SolutionNameMin: Cijk_Alik_Bljk_BSS_BH_MT16x16x64_MI16x16x8x1_SE_1LDSB0_AF0EM8_GRVW4_LBSPP128_LPA4_LPB4_PLR9_SU0_SUS256_SRVW0_TT1_16_WG16_4_1_WGM1
    SolutionIndex: 210
    SolutionNameMin: Cijk_Alik_Bljk_BSS_BH_MT16x16x128_MI16x16x8x1_SE_1LDSB0_AF0EM1_GRVW4_LBSPP256_LPA4_LPB4_PLR17_SU0_SUS256_SRVW0_TT1_16_WG16_4_1_WGM1
    SolutionIndex: 211
    SolutionNameMin: Cijk_Alik_Bljk_BSS_BH_MT16x16x128_MI16x16x8x1_SE_1LDSB0_AF0EM1_GRVW8_LBSPP256_LPA8_LPB8_PLR17_SU0_SUS256_SRVW0_TT1_16_WG16_4_1_WGM1
    SolutionIndex: 212
    SolutionNameMin: Cijk_Alik_Bljk_BSS_BH_MT16x16x128_MI16x16x8x1_SE_1LDSB0_AF0EM8_GRVW8_LBSPP256_LPA8_LPB8_PLR17_SU0_SUS256_SRVW0_TT1_16_WG16_4_1_WGM1
    SolutionIndex: 213
    SolutionNameMin: Cijk_Alik_Bljk_BSS_BH_MT16x16x128_MI16x16x8x1_SE_1LDSB0_AF0EM8_GRVW8_LBSPP256_LPA8_LPB8_PLR17_SU32_SUS256_SRVW0_TT1_16_WG16_4_1_WGM1
    SolutionIndex: 214
    SolutionNameMin: Cijk_Alik_Bljk_BSS_BH_MT16x16x128_MI16x16x8x1_SE_1LDSB0_AF0EM1_GRVW8_LBSPP256_LPA8_LPB8_PLR17_SU0_SUS256_SRVW0_TT1_16_WG16_4_1_WGM2
    SolutionIndex: 215
    SolutionNameMin: Cijk_Alik_Bljk_BSS_BH_MT16x16x64_MI16x16x8x1_SE_1LDSB0_AF0EM1_GRVW8_LBSPP128_LPA8_LPB8_PLR9_SU0_SUS256_SRVW0_TT1_16_WG16_4_1_WGM15
    SolutionIndex: 216
    SolutionNameMin: Cijk_Alik_Bljk_BSS_BH_MT16x16x128_MI16x16x8x1_SE_1LDSB0_AF0EM1_GRVW8_LBSPP256_LPA8_LPB8_PLR17_SU0_SUS256_SRVW0_TT1_16_WG16_4_1_WGM15
    SolutionIndex: 217
    SolutionNameMin: Cijk_Alik_Bljk_BSS_BH_MT16x16x128_MI16x16x8x1_SE_1LDSB0_AF0EM8_GRVW8_LBSPP256_LPA8_LPB8_PLR17_SU0_SUS256_SRVW0_TT1_16_WG16_4_1_WGM15
    SolutionIndex: 218
    SolutionNameMin: Cijk_Alik_Bljk_BSS_BH_MT16x16x64_MI16x16x8x1_SE_1LDSB1_AF0EM1_GRVW4_LBSPP128_LPA4_LPB4_PLR9_SU0_SUS128_SRVW0_TT1_16_WG16_4_1_WGM1
    SolutionIndex: 219
    SolutionNameMin: Cijk_Alik_Bljk_BSS_BH_MT16x16x64_MI16x16x8x1_SE_1LDSB1_AF0EM1_GRVW8_LBSPP128_LPA8_LPB8_PLR9_SU0_SUS128_SRVW0_TT1_16_WG16_4_1_WGM1
    SolutionIndex: 220
    SolutionNameMin: Cijk_Alik_Bljk_BSS_BH_MT16x16x64_MI16x16x8x1_SE_1LDSB1_AF0EM8_GRVW8_LBSPP128_LPA8_LPB8_PLR9_SU0_SUS128_SRVW0_TT1_16_WG16_4_1_WGM1
    SolutionIndex: 221
    SolutionNameMin: Cijk_Alik_Bljk_BSS_BH_MT16x16x64_MI16x16x8x1_SE_1LDSB1_AF0EM8_GRVW8_LBSPP128_LPA8_LPB8_PLR9_SU0_SUS256_SRVW0_TT1_16_WG16_4_1_WGM1
    SolutionIndex: 222
    SolutionNameMin: Cijk_Alik_Bljk_BSS_BH_MT16x16x128_MI16x16x8x1_SE_1LDSB1_AF0EM1_GRVW8_LBSPP256_LPA8_LPB8_PLR17_SU0_SUS256_SRVW0_TT1_16_WG16_4_1_WGM1
    SolutionIndex: 223
    SolutionNameMin: Cijk_Alik_Bljk_BSS_BH_MT16x16x128_MI16x16x8x1_SE_1LDSB1_AF0EM8_GRVW8_LBSPP256_LPA8_LPB8_PLR17_SU0_SUS256_SRVW0_TT1_16_WG16_4_1_WGM1
    SolutionIndex: 224
    SolutionNameMin: Cijk_Alik_Bljk_BSS_BH_MT16x16x128_MI16x16x8x1_SE_1LDSB1_AF0EM8_GRVW8_LBSPP256_LPA8_LPB8_PLR17_SU32_SUS256_SRVW0_TT1_16_WG16_4_1_WGM1
    SolutionIndex: 225
    SolutionNameMin: Cijk_Alik_Bljk_BSS_BH_MT16x16x64_MI16x16x8x1_SE_1LDSB1_AF0EM1_GRVW8_LBSPP128_LPA8_LPB8_PLR9_SU0_SUS128_SRVW4_TT1_16_WG16_4_1_WGM2
    SolutionIndex: 226
    SolutionNameMin: Cijk_Alik_Bljk_BSS_BH_MT16x16x128_MI16x16x8x1_SE_1LDSB1_AF0EM1_GRVW8_LBSPP256_LPA8_LPB8_PLR17_SU0_SUS256_SRVW0_TT1_16_WG16_4_1_WGM2
    SolutionIndex: 227
    SolutionNameMin: Cijk_Alik_Bljk_BSS_BH_MT16x16x64_MI16x16x8x1_SE_1LDSB1_AF0EM1_GRVW8_LBSPP128_LPA8_LPB8_PLR9_SU0_SUS128_SRVW0_TT1_16_WG16_4_1_WGM15
    SolutionIndex: 228
    SolutionNameMin: Cijk_Alik_Bljk_BSS_BH_MT16x16x128_MI16x16x8x1_SE_1LDSB1_AF0EM1_GRVW8_LBSPP256_LPA8_LPB8_PLR17_SU0_SUS256_SRVW0_TT1_16_WG16_4_1_WGM15
    SolutionIndex: 229
    SolutionNameMin: Cijk_Alik_Bljk_BSS_BH_MT16x16x64_MI16x16x8x1_SE_1LDSB1_AF0EM1_GRVW8_LBSPP128_LPA8_LPB8_PLR9_SU0_SUS256_SRVW4_TT1_16_WG16_4_1_WGM15
    SolutionIndex: 230
    SolutionNameMin: Cijk_Alik_Bljk_BSS_BH_MT16x16x64_MI16x16x8x1_SE_1LDSB1_AF0EM1_GRVW4_LBSPP128_LPA4_LPB4_PLR9_SU32_SUS128_SRVW0_TT1_16_WG16_4_1_WGM15
- - - [7680, 8192, 1, 8192, 8384, 8384, 8384, 8384]
    - [144, 96.401]
  - - [3840, 4096, 1, 4096, 4192, 4192, 4192, 4192]
    - [28, 95.111]
  - - [1920, 2048, 1, 2048, 2080, 2080, 2080, 2080]
    - [49, 89.559]
  - - [960, 1024, 1, 1024, 1056, 1056, 1056, 1056]
    - [40, 64.745]
  - - [480, 512, 1, 512, 544, 544, 544, 544]
    - [66, 20.302]
  - - [8192, 7680, 1, 8192, 8384, 8384, 8384, 8384]
    - [73, 96.223]
  - - [4096, 3840, 1, 4096, 4192, 4192, 4192, 4192]
    - [130, 95.096]
  - - [2048, 1920, 1, 2048, 2080, 2080, 2080, 2080]
    - [120, 87.991]
  - - [1024, 960, 1, 1024, 1056, 1056, 1056, 1056]
    - [143, 65.193]
  - - [512, 480, 1, 512, 544, 544, 544, 544]
    - [24, 19.304]
  - - [8192, 8192, 1, 8192, 8384, 8384, 8384, 8384]
    - [157, 95.651]
  - - [4096, 4096, 1, 4096, 4192, 4192, 4192, 4192]
    - [136, 93.211]
  - - [2048, 2048, 1, 2048, 2080, 2080, 2080, 2080]
    - [50, 85.474]
  - - [1024, 1024, 1, 1024, 1056, 1056, 1056, 1056]
    - [143, 52.748]
  - - [512, 512, 1, 512, 544, 544, 544, 544]
    - [10, 19.78]
  - - [512, 512, 16, 64, 512, 512, 64, 64]
    - [143, 24.872]
  - - [512, 512, 128, 64, 512, 512, 64, 64]
    - [46, 36.842]
  - - [1024, 1, 1, 1024, 1024, 1024, 1024, 1024]
    - [212, 0.177]
  - - [1024, 77, 1, 1024, 1024, 1024, 1024, 1024]
    - [66, 9.565]
  - - [1024, 512, 1, 1024, 1024, 1024, 1024, 1024]
    - [106, 36.942]
  - - [1024, 512, 1, 4096, 1024, 1024, 4096, 4096]
    - [162, 49.869]
  - - [4096, 512, 1, 1024, 4096, 4096, 1024, 1024]
    - [148, 65.038]
  - - [128, 128, 128, 64, 128, 128, 64, 64]
    - [90, 18.747]
  - - [128, 128, 160, 64, 128, 128, 64, 64]
    - [120, 22.27]
  - - [1024, 10, 1, 1024, 1024, 1024, 1024, 1024]
    - [223, 1.622]
  - - [1024, 200, 1, 1024, 1024, 1024, 1024, 1024]
    - [21, 21.333]
  - - [1024, 1280, 1, 1024, 1024, 1024, 1024, 1024]
    - [60, 57.749]
  - - [1024, 1280, 1, 4096, 1024, 1024, 4096, 4096]
    - [97, 75.78]
  - - [4096, 1280, 1, 1024, 4096, 4096, 1024, 1024]
    - [57, 75.837]
  - - [128, 128, 624, 64, 128, 128, 64, 64]
    - [51, 26.337]
  - - [1024, 39, 1, 1024, 1024, 1024, 1024, 1024]
    - [9, 4.907]
  - - [1024, 780, 1, 1024, 1024, 1024, 1024, 1024]
    - [149, 50.859]
  - - [1024, 4992, 1, 1024, 1024, 1024, 1024, 1024]
    - [39, 76.303]
  - - [1024, 4992, 1, 4096, 1024, 1024, 4096, 4096]
    - [55, 84.168]
  - - [4096, 4992, 1, 1024, 4096, 4096, 1024, 1024]
    - [88, 88.263]
  - - [512, 512, 64, 64, 512, 512, 64, 64]
    - [93, 34.004]
  - - [1024, 4, 1, 1024, 1024, 1024, 1024, 1024]
    - [217, 0.654]
  - - [1024, 308, 1, 1024, 1024, 1024, 1024, 1024]
    - [150, 30.376]
  - - [1024, 2048, 1, 1024, 1024, 1024, 1024, 1024]
    - [138, 65.145]
  - - [1024, 2048, 1, 4096, 1024, 1024, 4096, 4096]
    - [111, 76.053]
  - - [4096, 2048, 1, 1024, 4096, 4096, 1024, 1024]
    - [134, 81.737]
  - - [128, 128, 640, 64, 128, 128, 64, 64]
    - [31, 26.388]
  - - [1024, 40, 1, 1024, 1024, 1024, 1024, 1024]
    - [23, 5.0]
  - - [1024, 800, 1, 1024, 1024, 1024, 1024, 1024]
    - [99, 51.309]
  - - [1024, 5120, 1, 1024, 1024, 1024, 1024, 1024]
    - [57, 76.999]
  - - [1024, 5120, 1, 4096, 1024, 1024, 4096, 4096]
    - [55, 84.869]
  - - [4096, 5120, 1, 1024, 4096, 4096, 1024, 1024]
    - [88, 86.551]
  - - [128, 128, 656, 64, 128, 128, 64, 64]
    - [51, 26.383]
  - - [1024, 41, 1, 1024, 1024, 1024, 1024, 1024]
    - [3, 5.191]
  - - [1024, 820, 1, 1024, 1024, 1024, 1024, 1024]
    - [126, 53.114]
  - - [1024, 5248, 1, 1024, 1024, 1024, 1024, 1024]
    - [57, 78.564]
  - - [1024, 5248, 1, 4096, 1024, 1024, 4096, 4096]
    - [134, 85.457]
  - - [4096, 5248, 1, 1024, 4096, 4096, 1024, 1024]
    - [77, 87.937]
  - - [512, 512, 80, 64, 512, 512, 64, 64]
    - [46, 34.939]
  - - [1024, 5, 1, 1024, 1024, 1024, 1024, 1024]
    - [226, 0.798]
  - - [1024, 385, 1, 1024, 1024, 1024, 1024, 1024]
    - [143, 37.592]
  - - [1024, 2560, 1, 1024, 1024, 1024, 1024, 1024]
    - [144, 71.98]
  - - [1024, 2560, 1, 4096, 1024, 1024, 4096, 4096]
    - [144, 81.629]
  - - [4096, 2560, 1, 1024, 4096, 4096, 1024, 1024]
    - [120, 83.703]
  - - [512, 512, 96, 64, 512, 512, 64, 64]
    - [125, 35.759]
  - - [1024, 6, 1, 1024, 1024, 1024, 1024, 1024]
    - [212, 0.99]
  - - [1024, 462, 1, 1024, 1024, 1024, 1024, 1024]
    - [123, 34.346]
  - - [1024, 3072, 1, 1024, 1024, 1024, 1024, 1024]
    - [124, 73.525]
  - - [1024, 3072, 1, 4096, 1024, 1024, 4096, 4096]
    - [55, 84.029]
  - - [4096, 3072, 1, 1024, 4096, 4096, 1024, 1024]
    - [120, 85.127]
  - - [1024, 8, 1, 1024, 1024, 1024, 1024, 1024]
    - [212, 1.277]
  - - [1024, 160, 1, 1024, 1024, 1024, 1024, 1024]
    - [20, 19.031]
  - - [1024, 1024, 1, 1024, 1024, 1024, 1024, 1024]
    - [155, 49.5]
  - - [1024, 1024, 1, 4096, 1024, 1024, 4096, 4096]
    - [113, 61.317]
  - - [4096, 1024, 1, 1024, 4096, 4096, 1024, 1024]
    - [134, 77.295]
  - - [128, 128, 144, 64, 128, 128, 64, 64]
    - [135, 20.78]
  - - [1024, 9, 1, 1024, 1024, 1024, 1024, 1024]
    - [213, 1.448]
  - - [1024, 180, 1, 1024, 1024, 1024, 1024, 1024]
    - [14, 20.187]
  - - [1024, 1152, 1, 1024, 1024, 1024, 1024, 1024]
    - [98, 55.415]
  - - [1024, 1152, 1, 4096, 1024, 1024, 4096, 4096]
    - [147, 69.834]
  - - [4096, 1152, 1, 1024, 4096, 4096, 1024, 1024]
    - [126, 79.052]
  - - [128, 32768, 1, 256, 128, 128, 256, 256]
    - [126, 53.735]
  - - [256, 32768, 1, 512, 256, 256, 512, 512]
    - [140, 75.481]
  - - [512, 32768, 1, 13, 512, 512, 13, 13]
    - [115, 6.177]
  - - [512, 32768, 1, 1024, 512, 512, 1024, 1024]
    - [57, 85.953]
  - - [1024, 32768, 1, 479, 1024, 1024, 479, 479]
    - [45, 75.641]
  - - [1024, 32768, 1, 1024, 1024, 1024, 1024, 1024]
    - [88, 89.894]
  - - [32768, 1, 1, 256, 32768, 32768, 256, 256]
    - [221, 0.913]
  - - [64, 128, 512, 128, 64, 64, 128, 128]
    - [89, 33.054]
  - - [128, 128, 512, 64, 128, 128, 64, 64]
    - [35, 25.504]
  - - [1024, 32, 1, 1024, 1024, 1024, 1024, 131072]
    - [3, 4.104]
  - - [1024, 4096, 1, 1024, 1024, 1024, 1024, 1024]
    - [77, 76.999]
  - - [1024, 4096, 1, 4096, 1024, 1024, 4096, 4096]
    - [147, 87.521]
  - - [4096, 4096, 1, 1024, 4096, 4096, 1024, 1024]
    - [88, 85.61]
  - - [30528, 4096, 1, 1024, 30528, 30528, 1024, 1024]
    - [149, 91.76]
  - - [64, 512, 64, 512, 64, 64, 512, 512]
    - [93, 50.369]
  - - [1024, 4, 1, 1024, 1024, 1024, 1024, 524288]
    - [212, 0.644]
  - - [30528, 2048, 1, 1024, 30528, 30528, 1024, 1024]
    - [149, 90.607]
  - - [1024, 8192, 1, 1024, 1024, 1024, 1024, 1024]
    - [41, 82.577]
  - - [1024, 8192, 1, 4096, 1024, 1024, 4096, 4096]
    - [113, 89.419]
  - - [1024, 9600, 1, 1024, 1024, 1024, 1024, 1024]
    - [85, 85.875]
  - - [1024, 9600, 1, 4096, 1024, 1024, 4096, 4096]
    - [74, 93.805]
  - - [4096, 8192, 1, 1024, 4096, 4096, 1024, 1024]
    - [104, 88.803]
  - - [4096, 9600, 1, 1024, 4096, 4096, 1024, 1024]
    - [77, 90.472]
  - - [33712, 8192, 1, 1024, 33712, 33712, 1024, 1024]
    - [88, 92.426]
  - - [33712, 9600, 1, 1024, 33712, 33712, 1024, 1024]
    - [88, 93.182]
  - - [1024, 10064, 1, 1024, 1024, 1024, 1024, 1024]
    - [147, 84.808]
  - - [1024, 10064, 1, 4096, 1024, 1024, 4096, 4096]
    - [147, 93.455]
  - - [1024, 10080, 1, 1024, 1024, 1024, 1024, 1024]
    - [77, 85.198]
  - - [1024, 10080, 1, 4096, 1024, 1024, 4096, 4096]
    - [147, 93.536]
  - - [1024, 10200, 1, 1024, 1024, 1024, 1024, 1024]
    - [144, 84.075]
  - - [1024, 10200, 1, 4096, 1024, 1024, 4096, 4096]
    - [126, 87.916]
  - - [1024, 3840, 1, 1024, 1024, 1024, 1024, 1024]
    - [91, 79.163]
  - - [1024, 3840, 1, 4096, 1024, 1024, 4096, 4096]
    - [13, 91.183]
  - - [1024, 3968, 1, 1024, 1024, 1024, 1024, 1024]
    - [134, 74.88]
  - - [1024, 3968, 1, 4096, 1024, 1024, 4096, 4096]
    - [77, 85.086]
  - - [1024, 6528, 1, 1024, 1024, 1024, 1024, 1024]
    - [144, 82.391]
  - - [1024, 6528, 1, 4096, 1024, 1024, 4096, 4096]
    - [62, 86.086]
  - - [1024, 7104, 1, 1024, 1024, 1024, 1024, 1024]
    - [88, 83.939]
  - - [1024, 7104, 1, 4096, 1024, 1024, 4096, 4096]
    - [131, 92.149]
  - - [1024, 7200, 1, 1024, 1024, 1024, 1024, 1024]
    - [74, 85.227]
  - - [1024, 7200, 1, 4096, 1024, 1024, 4096, 4096]
    - [74, 93.985]
  - - [1024, 8064, 1, 1024, 1024, 1024, 1024, 1024]
    - [88, 82.214]
  - - [1024, 8064, 1, 4096, 1024, 1024, 4096, 4096]
    - [88, 88.341]
  - - [1024, 8160, 1, 1024, 1024, 1024, 1024, 1024]
    - [113, 82.934]
  - - [1024, 8160, 1, 4096, 1024, 1024, 4096, 4096]
    - [113, 89.306]
  - - [1024, 9216, 1, 1024, 1024, 1024, 1024, 1024]
    - [57, 83.429]
  - - [1024, 9216, 1, 4096, 1024, 1024, 4096, 4096]
    - [85, 90.436]
  - - [1024, 9520, 1, 1024, 1024, 1024, 1024, 1024]
    - [110, 84.011]
  - - [1024, 9520, 1, 4096, 1024, 1024, 4096, 4096]
    - [74, 93.256]
  - - [4096, 10064, 1, 1024, 4096, 4096, 1024, 1024]
    - [97, 89.923]
  - - [4096, 10080, 1, 1024, 4096, 4096, 1024, 1024]
    - [97, 89.952]
  - - [4096, 10200, 1, 1024, 4096, 4096, 1024, 1024]
    - [77, 89.94]
  - - [4096, 3840, 1, 1024, 4096, 4096, 1024, 1024]
    - [77, 86.774]
  - - [4096, 3968, 1, 1024, 4096, 4096, 1024, 1024]
    - [102, 85.577]
  - - [4096, 6528, 1, 1024, 4096, 4096, 1024, 1024]
    - [77, 88.22]
  - - [4096, 7104, 1, 1024, 4096, 4096, 1024, 1024]
    - [77, 89.878]
  - - [4096, 7200, 1, 1024, 4096, 4096, 1024, 1024]
    - [97, 89.294]
  - - [4096, 8064, 1, 1024, 4096, 4096, 1024, 1024]
    - [77, 89.617]
  - - [4096, 8160, 1, 1024, 4096, 4096, 1024, 1024]
    - [88, 90.186]
  - - [4096, 9216, 1, 1024, 4096, 4096, 1024, 1024]
    - [88, 90.436]
  - - [4096, 9520, 1, 1024, 4096, 4096, 1024, 1024]
    - [88, 89.632]
  - - [42720, 10080, 1, 1024, 42720, 42720, 1024, 1024]
    - [77, 93.437]
  - - [42720, 3968, 1, 1024, 42720, 42720, 1024, 1024]
    - [149, 91.742]
  - - [42720, 6528, 1, 1024, 42720, 42720, 1024, 1024]
    - [88, 93.182]
  - - [42720, 7104, 1, 1024, 42720, 42720, 1024, 1024]
    - [77, 93.321]
  - - [42720, 7200, 1, 1024, 42720, 42720, 1024, 1024]
    - [88, 93.245]
  - - [42720, 9520, 1, 1024, 42720, 42720, 1024, 1024]
    - [88, 92.806]
  - - [24, 24, 4736, 64, 24, 24, 303104, 303104]
    - [34, 9.842]
  - - [32, 32, 4608, 64, 32, 32, 294912, 294912]
    - [72, 11.727]
  - - [32, 35, 4608, 64, 32, 32, 294912, 294912]
    - [72, 12.194]
  - - [64, 512, 1, 512, 64, 64, 512, 512]
    - [66, 3.019]
  - - [512, 512, 1, 64, 512, 512, 64, 64]
    - [121, 4.362]
  - - [128, 128, 1, 64, 128, 128, 64, 64]
    - [0, 0.307]
  - - [1024, 8, 1, 1024, 1024, 1024, 1024, 131072]
    - [212, 1.309]
  - - [64, 128, 1, 128, 64, 64, 128, 128]
    - [92, 0.27]
  - - [2048, 512, 1, 2048, 2048, 2048, 2048, 2048]
    - [98, 55.288]
  - - [1024, 512, 1, 1600, 1024, 1024, 1600, 1600]
    - [116, 43.857]
  - - [2048, 512, 1, 74, 2048, 2048, 74, 74]
    - [129, 11.002]
  - - [512, 1, 1, 2048, 512, 512, 2048, 2048]
    - [168, 0.124]
  - - [64, 512, 1, 1024, 64, 64, 1024, 1024]
    - [25, 4.026]
  - - [1024, 1600, 1, 560, 1024, 1024, 560, 560]
    - [2, 45.55]
  - - [1600, 1, 1, 1024, 1600, 1600, 1024, 1024]
    - [214, 0.253]
  - - [512, 1600, 1, 512, 512, 512, 512, 512]
    - [7, 39.251]
  - - [1024, 1600, 1, 1024, 1024, 1024, 1024, 1024]
    - [144, 63.182]
  - - [32, 1600, 1, 512, 32, 32, 512, 512]
    - [1, 4.381]
  - - [64, 960, 1, 1024, 64, 64, 1024, 1024]
    - [14, 7.314]
  - - [200, 1, 1, 1024, 200, 200, 1024, 1024]
    - [212, 0.034]
  - - [256, 684, 1, 1024, 256, 256, 1024, 1024]
    - [121, 19.287]
  - - [256, 1280, 1, 1024, 256, 256, 1024, 1024]
    - [122, 30.339]
  - - [256, 1536, 1, 1024, 256, 256, 1024, 1024]
    - [125, 36.233]
  - - [256, 2304, 1, 1024, 256, 256, 1024, 1024]
    - [125, 40.958]
  - - [256, 2560, 1, 1024, 256, 256, 1024, 1024]
    - [143, 45.51]
  - - [256, 2816, 1, 1024, 256, 256, 1024, 1024]
    - [143, 47.808]
  - - [256, 3328, 1, 1024, 256, 256, 1024, 1024]
    - [144, 55.165]
  - - [256, 3584, 1, 1024, 256, 256, 1024, 1024]
    - [126, 59.813]
  - - [256, 4608, 1, 1024, 256, 256, 1024, 1024]
    - [42, 54.479]
  - - [256, 4864, 1, 1024, 256, 256, 1024, 1024]
    - [63, 54.239]
  - - [256, 5376, 1, 1024, 256, 256, 1024, 1024]
    - [152, 62.952]
  - - [256, 5888, 1, 1024, 256, 256, 1024, 1024]
    - [126, 58.838]
  - - [256, 6144, 1, 1024, 256, 256, 1024, 1024]
    - [126, 61.521]
  - - [256, 6400, 1, 1024, 256, 256, 1024, 1024]
    - [126, 63.309]
  - - [256, 6656, 1, 1024, 256, 256, 1024, 1024]
    - [126, 65.842]
  - - [256, 7168, 1, 1024, 256, 256, 1024, 1024]
    - [126, 70.198]
  - - [256, 7424, 1, 1024, 256, 256, 1024, 1024]
    - [144, 71.845]
  - - [256, 7936, 1, 1024, 256, 256, 1024, 1024]
    - [125, 63.833]
  - - [256, 8192, 1, 1024, 256, 256, 1024, 1024]
    - [138, 64.207]
  - - [256, 8448, 1, 1024, 256, 256, 1024, 1024]
    - [143, 66.747]
  - - [256, 8960, 1, 1024, 256, 256, 1024, 1024]
    - [45, 69.014]
  - - [256, 9984, 1, 1024, 256, 256, 1024, 1024]
    - [126, 69.385]
  - - [256, 10496, 1, 1024, 256, 256, 1024, 1024]
    - [126, 72.227]
  - - [256, 11264, 1, 1024, 256, 256, 1024, 1024]
    - [144, 76.547]
  - - [256, 11520, 1, 1024, 256, 256, 1024, 1024]
    - [88, 77.962]
  - - [256, 11776, 1, 1024, 256, 256, 1024, 1024]
    - [138, 68.865]
  - - [256, 12544, 1, 1024, 256, 256, 1024, 1024]
    - [117, 68.999]
  - - [256, 13312, 1, 1024, 256, 256, 1024, 1024]
    - [41, 72.411]
  - - [256, 14336, 1, 1024, 256, 256, 1024, 1024]
    - [144, 76.706]
  - - [256, 14592, 1, 1024, 256, 256, 1024, 1024]
    - [126, 77.905]
  - - [256, 14848, 1, 1024, 256, 256, 1024, 1024]
    - [126, 78.335]
  - - [256, 15104, 1, 1024, 256, 256, 1024, 1024]
    - [144, 79.857]
  - - [256, 16128, 1, 1024, 256, 256, 1024, 1024]
    - [128, 77.429]
  - - [256, 18176, 1, 1024, 256, 256, 1024, 1024]
    - [144, 78.99]
  - - [256, 18944, 1, 1024, 256, 256, 1024, 1024]
    - [144, 81.036]
  - - [256, 19200, 1, 1024, 256, 256, 1024, 1024]
    - [74, 82.13]
  - - [256, 20480, 1, 1024, 256, 256, 1024, 1024]
    - [126, 76.647]
  - - [256, 20992, 1, 1024, 256, 256, 1024, 1024]
    - [126, 77.733]
  - - [256, 21248, 1, 1024, 256, 256, 1024, 1024]
    - [144, 78.682]
  - - [256, 21504, 1, 1024, 256, 256, 1024, 1024]
    - [144, 79.69]
  - - [256, 22016, 1, 1024, 256, 256, 1024, 1024]
    - [126, 80.855]
  - - [256, 22344, 1, 1024, 256, 256, 1024, 1024]
    - [134, 81.813]
  - - [256, 23296, 1, 1024, 256, 256, 1024, 1024]
    - [126, 75.746]
  - - [256, 23552, 1, 1024, 256, 256, 1024, 1024]
    - [144, 76.578]
  - - [256, 31488, 1, 1024, 256, 256, 1024, 1024]
    - [77, 80.718]
  - - [256, 33536, 1, 1024, 256, 256, 1024, 1024]
    - [126, 83.441]
  - - [256, 44505, 1, 1024, 256, 256, 1024, 1024]
    - [77, 84.933]
  - - [960, 1, 1, 2048, 960, 960, 2048, 2048]
    - [212, 0.229]
  - - [1024, 200, 1, 560, 1024, 1024, 560, 560]
    - [141, 13.169]
  - - [1024, 960, 1, 1024, 1024, 1024, 1024, 1024]
    - [22, 61.773]
  - - [1024, 960, 1, 1600, 1024, 1024, 1600, 1600]
    - [15, 72.332]
  - - [1024, 32768, 1, 480, 1024, 1024, 480, 480]
    - [79, 86.625]
  - - [1280, 8976, 1, 256, 1280, 1280, 256, 256]
    - [126, 68.386]
  - - [1792, 8976, 1, 256, 1792, 1792, 256, 256]
    - [65, 71.76]
  - - [2048, 114, 1, 512, 2048, 2048, 512, 512]
    - [123, 17.344]
  - - [2048, 114, 1, 768, 2048, 2048, 768, 768]
    - [141, 22.373]
  - - [2048, 215, 1, 512, 2048, 2048, 512, 512]
    - [137, 25.887]
  - - [2048, 215, 1, 768, 2048, 2048, 768, 768]
    - [16, 30.284]
  - - [2048, 256, 1, 512, 2048, 2048, 512, 512]
    - [143, 28.875]
  - - [2048, 256, 1, 768, 2048, 2048, 768, 768]
    - [101, 33.795]
  - - [2048, 512, 1, 67, 2048, 2048, 67, 67]
    - [109, 10.038]
  - - [2048, 512, 1, 100, 2048, 2048, 100, 100]
    - [109, 14.222]
  - - [2048, 684, 1, 512, 2048, 2048, 512, 512]
    - [138, 45.973]
  - - [2048, 684, 1, 768, 2048, 2048, 768, 768]
    - [138, 52.574]
  - - [2048, 960, 1, 74, 2048, 2048, 74, 74]
    - [48, 16.113]
  - - [2048, 960, 1, 2048, 2048, 2048, 2048, 2048]
    - [145, 76.589]
  - - [2048, 1536, 1, 512, 2048, 2048, 512, 512]
    - [48, 63.331]
  - - [2048, 1536, 1, 768, 2048, 2048, 768, 768]
    - [55, 69.352]
  - - [2048, 8976, 1, 256, 2048, 2048, 256, 256]
    - [103, 70.691]
  - - [2304, 8976, 1, 256, 2304, 2304, 256, 256]
    - [68, 73.949]
  - - [2560, 8976, 1, 256, 2560, 2560, 256, 256]
    - [68, 73.844]
  - - [2816, 8976, 1, 256, 2816, 2816, 256, 256]
    - [68, 75.178]
  - - [3072, 8976, 1, 256, 3072, 3072, 256, 256]
    - [69, 73.769]
  - - [3328, 8976, 1, 256, 3328, 3328, 256, 256]
    - [68, 75.371]
  - - [3840, 8976, 1, 256, 3840, 3840, 256, 256]
    - [103, 75.931]
  - - [4096, 8976, 1, 256, 4096, 4096, 256, 256]
    - [103, 74.457]
  - - [4352, 8976, 1, 256, 4352, 4352, 256, 256]
    - [103, 75.809]
  - - [4608, 8976, 1, 256, 4608, 4608, 256, 256]
    - [126, 75.961]
  - - [4864, 8976, 1, 256, 4864, 4864, 256, 256]
    - [103, 76.432]
  - - [5120, 8976, 1, 256, 5120, 5120, 256, 256]
    - [103, 75.593]
  - - [5376, 8976, 1, 256, 5376, 5376, 256, 256]
    - [108, 76.713]
  - - [5632, 8976, 1, 256, 5632, 5632, 256, 256]
    - [103, 77.388]
  - - [5888, 8976, 1, 256, 5888, 5888, 256, 256]
    - [126, 76.668]
  - - [6144, 8976, 1, 256, 6144, 6144, 256, 256]
    - [103, 77.514]
  - - [6400, 8976, 1, 256, 6400, 6400, 256, 256]
    - [103, 77.015]
  - - [7168, 8976, 1, 256, 7168, 7168, 256, 256]
    - [83, 78.185]
  - - [7936, 8976, 1, 256, 7936, 7936, 256, 256]
    - [95, 78.14]
  - - [8192, 8976, 1, 256, 8192, 8192, 256, 256]
    - [103, 78.538]
  - - [8448, 8976, 1, 256, 8448, 8448, 256, 256]
    - [95, 79.158]
  - - [8960, 8976, 1, 256, 8960, 8960, 256, 256]
    - [103, 78.74]
  - - [9472, 8976, 1, 256, 9472, 9472, 256, 256]
    - [83, 79.675]
  - - [9728, 8976, 1, 256, 9728, 9728, 256, 256]
    - [103, 79.45]
  - - [9984, 8976, 1, 256, 9984, 9984, 256, 256]
    - [83, 79.724]
  - - [10240, 8976, 1, 256, 10240, 10240, 256, 256]
    - [95, 79.582]
  - - [10496, 8976, 1, 256, 10496, 10496, 256, 256]
    - [103, 79.628]
  - - [11264, 8976, 1, 256, 11264, 11264, 256, 256]
    - [95, 79.613]
  - - [11776, 8976, 1, 256, 11776, 11776, 256, 256]
    - [95, 80.443]
  - - [12544, 8976, 1, 256, 12544, 12544, 256, 256]
    - [103, 80.175]
  - - [13312, 8976, 1, 256, 13312, 13312, 256, 256]
    - [95, 79.807]
  - - [13568, 8976, 1, 256, 13568, 13568, 256, 256]
    - [83, 80.145]
  - - [13824, 8976, 1, 256, 13824, 13824, 256, 256]
    - [95, 80.639]
  - - [15104, 8976, 1, 256, 15104, 15104, 256, 256]
    - [95, 80.685]
  - - [15360, 8976, 1, 256, 15360, 15360, 256, 256]
    - [95, 80.055]
  - - [15872, 8976, 1, 256, 15872, 15872, 256, 256]
    - [83, 80.47]
  - - [16128, 8976, 1, 256, 16128, 16128, 256, 256]
    - [83, 81.461]
  - - [17152, 8976, 1, 256, 17152, 17152, 256, 256]
    - [83, 80.621]
  - - [18176, 8976, 1, 256, 18176, 18176, 256, 256]
    - [83, 81.126]
  - - [18688, 8976, 1, 256, 18688, 18688, 256, 256]
    - [83, 81.055]
  - - [18944, 8976, 1, 256, 18944, 18944, 256, 256]
    - [83, 80.437]
  - - [19712, 8976, 1, 256, 19712, 19712, 256, 256]
    - [95, 80.903]
  - - [19968, 8976, 1, 256, 19968, 19968, 256, 256]
    - [83, 80.585]
  - - [20480, 8976, 1, 256, 20480, 20480, 256, 256]
    - [95, 80.506]
  - - [20992, 8976, 1, 256, 20992, 20992, 256, 256]
    - [95, 80.452]
  - - [21248, 8976, 1, 256, 21248, 21248, 256, 256]
    - [83, 80.657]
  - - [23552, 8976, 1, 256, 23552, 23552, 256, 256]
    - [95, 81.126]
  - - [28672, 8976, 1, 256, 28672, 28672, 256, 256]
    - [83, 80.877]
  - - [31488, 8976, 1, 256, 31488, 31488, 256, 256]
    - [95, 81.764]
  - - [33536, 8976, 1, 256, 33536, 33536, 256, 256]
    - [95, 81.984]
  - - [2048, 1024, 1, 2048, 2048, 2048, 2048, 2048]
    - [61, 69.902]
  - - [2048, 1024, 1, 8192, 2048, 2048, 8192, 8192]
    - [45, 79.142]
  - - [2048, 2, 1, 2048, 2048, 2048, 2048, 1048576]
    - [212, 0.94]
  - - [30592, 1024, 1, 2048, 30592, 30592, 2048, 2048]
    - [59, 90.156]
  - - [6144, 1024, 1, 2048, 6144, 6144, 2048, 2048]
    - [142, 83.246]
  - - [8192, 1024, 1, 2048, 8192, 8192, 2048, 2048]
    - [107, 85.61]
  - - [1024, 16, 1, 1024, 1024, 1024, 1024, 524288]
    - [222, 2.553]
  - - [30592, 8192, 1, 1024, 30592, 30592, 1024, 1024]
    - [153, 92.369]
  - - [3072, 8192, 1, 1024, 3072, 3072, 1024, 1024]
    - [149, 88.193]
  - - [512, 512, 256, 64, 512, 512, 64, 64]
    - [93, 38.61]
  - - [64, 512, 256, 512, 64, 64, 512, 512]
    - [107, 60.126]
  - - [30592, 2048, 1, 1024, 30592, 30592, 1024, 1024]
    - [149, 89.954]
  - - [3072, 2048, 1, 1024, 3072, 3072, 1024, 1024]
    - [124, 78.967]
  - - [1024, 8, 1, 1024, 1024, 1024, 1024, 524288]
    - [212, 1.267]
  - - [30592, 4096, 1, 1024, 30592, 30592, 1024, 1024]
    - [153, 91.625]
  - - [3072, 4096, 1, 1024, 3072, 3072, 1024, 1024]
    - [99, 85.127]
  - - [64, 512, 128, 512, 64, 64, 512, 512]
    - [67, 55.211]
  - - [1920, 2048, 1, 2560, 1920, 1920, 2560, 2560]
    - [107, 88.955]
  - - [2560, 2048, 1, 2560, 2560, 2560, 2560, 2560]
    - [87, 84.668]
  - - [2560, 2048, 1, 640, 2560, 2560, 640, 640]
    - [81, 72.772]
  - - [2560, 4, 1, 2560, 2560, 2560, 2560, 1310720]
    - [212, 2.556]
  - - [7680, 2048, 1, 2560, 7680, 7680, 2560, 2560]
    - [151, 92.709]
  - - [512, 512, 40, 64, 512, 512, 64, 64]
    - [71, 30.862]
  - - [64, 512, 40, 512, 64, 64, 512, 512]
    - [150, 45.675]
  - - [1536, 4096, 1, 1536, 1536, 1536, 1536, 1536]
    - [124, 83.083]
  - - [1536, 4096, 1, 6144, 1536, 1536, 6144, 6144]
    - [132, 88.533]
  - - [4608, 4096, 1, 1536, 4608, 4608, 1536, 1536]
    - [88, 90.542]
  - - [50304, 4096, 1, 1536, 50304, 50304, 1536, 1536]
    - [156, 93.491]
  - - [6144, 4096, 1, 1536, 6144, 6144, 1536, 1536]
    - [151, 90.617]
  - - [1024, 1024, 64, 96, 1024, 1024, 96, 96]
    - [52, 54.097]
  - - [96, 1024, 64, 1024, 96, 96, 1024, 1024]
    - [39, 74.203]
  - - [1536, 8192, 1, 1536, 1536, 1536, 1536, 1536]
    - [81, 89.165]
  - - [1536, 8192, 1, 6144, 1536, 1536, 6144, 6144]
    - [57, 93.619]
  - - [4608, 8192, 1, 1536, 4608, 4608, 1536, 1536]
    - [151, 91.775]
  - - [50304, 8192, 1, 1536, 50304, 50304, 1536, 1536]
    - [88, 93.798]
  - - [6144, 8192, 1, 1536, 6144, 6144, 1536, 1536]
    - [151, 92.294]
  - - [1024, 1024, 128, 96, 1024, 1024, 96, 96]
    - [36, 55.89]
  - - [96, 1024, 128, 1024, 96, 96, 1024, 1024]
    - [124, 76.975]
  - - [1024, 16384, 1, 1024, 1024, 1024, 1024, 1024]
    - [29, 85.931]
  - - [1024, 16384, 1, 4096, 1024, 1024, 4096, 4096]
    - [131, 92.565]
  - - [3072, 16384, 1, 1024, 3072, 3072, 1024, 1024]
    - [77, 90.408]
  - - [4096, 16384, 1, 1024, 4096, 4096, 1024, 1024]
    - [88, 91.194]
  - - [50304, 16384, 1, 1024, 50304, 50304, 1024, 1024]
    - [88, 93.712]
  - - [1024, 1024, 256, 64, 1024, 1024, 64, 64]
    - [70, 40.29]
  - - [64, 1024, 256, 1024, 64, 64, 1024, 1024]
    - [126, 70.254]
  - - [50304, 2048, 1, 1024, 50304, 50304, 1024, 1024]
    - [149, 91.092]
  - - [1024, 1024, 32, 64, 1024, 1024, 64, 64]
    - [84, 37.182]
  - - [64, 1024, 32, 1024, 64, 64, 1024, 1024]
    - [71, 58.167]
  - - [50304, 4096, 1, 1024, 50304, 50304, 1024, 1024]
    - [88, 92.291]
  - - [1024, 1024, 64, 64, 1024, 1024, 64, 64]
    - [33, 38.929]
  - - [64, 1024, 64, 1024, 64, 64, 1024, 1024]
    - [94, 63.951]
  - - [50304, 8192, 1, 1024, 50304, 50304, 1024, 1024]
    - [88, 92.853]
  - - [1024, 1024, 128, 64, 1024, 1024, 64, 64]
    - [44, 39.766]
  - - [64, 1024, 128, 1024, 64, 64, 1024, 1024]
    - [68, 69.36]
  - - [1024, 64, 1, 1024, 1024, 1024, 1024, 131072]
    - [3, 8.104]
  - - [30528, 8192, 1, 1024, 30528, 30528, 1024, 1024]
    - [88, 92.426]
  - - [128, 128, 1024, 64, 128, 128, 64, 64]
    - [35, 27.797]
  - - [64, 128, 1024, 128, 64, 64, 128, 128]
    - [89, 32.838]
  - - [1024, 3456, 1, 1024, 1024, 1024, 1024, 1024]
    - [57, 74.699]
  - - [1024, 3456, 1, 480, 1024, 1024, 480, 480]
    - [65, 67.361]
  - - [1024, 4096, 1, 480, 1024, 1024, 480, 480]
    - [33, 67.409]
  - - [1024, 6912, 1, 1024, 1024, 1024, 1024, 1024]
    - [88, 83.173]
  - - [1024, 6912, 1, 480, 1024, 1024, 480, 480]
    - [105, 75.972]
  - - [1024, 864, 1, 1024, 1024, 1024, 1024, 1024]
    - [57, 54.524]
  - - [1024, 864, 1, 480, 1024, 1024, 480, 480]
    - [154, 41.184]
  - - [128, 3456, 1, 256, 128, 128, 256, 256]
    - [125, 19.626]
  - - [128, 4096, 1, 256, 128, 128, 256, 256]
    - [143, 21.111]
  - - [128, 55296, 1, 256, 128, 128, 256, 256]
    - [95, 61.773]
  - - [128, 6912, 1, 256, 128, 128, 256, 256]
    - [41, 30.281]
  - - [128, 864, 1, 256, 128, 128, 256, 256]
    - [14, 6.162]
  - - [256, 3456, 1, 512, 256, 256, 512, 512]
    - [119, 43.703]
  - - [256, 4096, 1, 512, 256, 256, 512, 512]
    - [119, 41.014]
  - - [256, 55296, 1, 512, 256, 256, 512, 512]
    - [58, 81.328]
  - - [256, 6912, 1, 512, 256, 256, 512, 512]
    - [140, 57.481]
  - - [256, 864, 1, 512, 256, 256, 512, 512]
    - [53, 17.517]
  - - [3456, 1, 1, 256, 3456, 3456, 256, 256]
    - [212, 0.202]
  - - [4096, 1, 1, 256, 4096, 4096, 256, 256]
    - [220, 0.243]
  - - [512, 3456, 1, 1024, 512, 512, 1024, 1024]
    - [19, 66.759]
  - - [512, 3456, 1, 13, 512, 512, 13, 13]
    - [140, 2.969]
  - - [512, 4096, 1, 1024, 512, 512, 1024, 1024]
    - [138, 65.784]
  - - [512, 4096, 1, 13, 512, 512, 13, 13]
    - [135, 3.251]
  - - [512, 55296, 1, 13, 512, 512, 13, 13]
    - [33, 6.766]
  - - [512, 6912, 1, 1024, 512, 512, 1024, 1024]
    - [57, 75.03]
  - - [512, 6912, 1, 13, 512, 512, 13, 13]
    - [33, 4.263]
  - - [512, 864, 1, 1024, 512, 512, 1024, 1024]
    - [26, 39.618]
  - - [512, 864, 1, 13, 512, 512, 13, 13]
    - [12, 1.267]
  - - [6912, 1, 1, 256, 6912, 6912, 256, 256]
    - [209, 0.398]
  - - [864, 1, 1, 256, 864, 864, 256, 256]
    - [212, 0.052]
  - - [1024, 32, 1, 1024, 1024, 1024, 1024, 1024]
    - [3, 4.052]
  - - [30528, 640, 1, 1024, 30528, 30528, 1024, 1024]
    - [144, 87.389]
  - - [30528, 1280, 1, 1024, 30528, 30528, 1024, 1024]
    - [102, 89.147]
  - - [1024, 64, 1, 1024, 1024, 1024, 1024, 1024]
    - [100, 8.156]
  - - [30528, 1600, 1, 1024, 30528, 30528, 1024, 1024]
    - [147, 88.972]
  - - [1024, 10240, 1, 1024, 1024, 1024, 1024, 1024]
    - [126, 84.477]
  - - [1024, 80, 1, 1024, 1024, 1024, 1024, 1024]
    - [9, 9.814]
  - - [4096, 10240, 1, 1024, 4096, 4096, 1024, 1024]
    - [77, 90.131]
  - - [1024, 10240, 1, 4096, 1024, 1024, 4096, 4096]
    - [156, 88.445]
  - - [64, 128, 1280, 128, 64, 64, 128, 128]
    - [138, 33.994]
  - - [128, 128, 1280, 64, 128, 128, 64, 64]
    - [35, 28.354]
  - - [1024, 10496, 1, 4096, 1024, 1024, 4096, 4096]
    - [133, 88.371]
  - - [30528, 1640, 1, 1024, 30528, 30528, 1024, 1024]
    - [149, 89.345]
  - - [1024, 82, 1, 1024, 1024, 1024, 1024, 1024]
    - [9, 10.185]
  - - [4096, 10496, 1, 1024, 4096, 4096, 1024, 1024]
    - [88, 89.866]
  - - [1024, 10496, 1, 1024, 1024, 1024, 1024, 1024]
    - [144, 84.493]
  - - [64, 128, 1312, 128, 64, 64, 128, 128]
    - [78, 34.015]
  - - [128, 128, 1312, 64, 128, 128, 64, 64]
    - [54, 28.452]
  - - [30528, 160, 1, 1024, 30528, 30528, 1024, 1024]
    - [146, 78.405]
  - - [1024, 12, 1, 1024, 1024, 1024, 1024, 1024]
    - [212, 1.899]
  - - [30528, 240, 1, 1024, 30528, 30528, 1024, 1024]
    - [149, 79.157]
  - - [1024, 6144, 1, 1024, 1024, 1024, 1024, 1024]
    - [41, 79.486]
  - - [4096, 6144, 1, 1024, 4096, 4096, 1024, 1024]
    - [77, 87.552]
  - - [1024, 6144, 1, 4096, 1024, 1024, 4096, 4096]
    - [124, 86.161]
  - - [64, 512, 192, 512, 64, 64, 512, 512]
    - [144, 57.915]
  - - [512, 512, 192, 64, 512, 512, 64, 64]
    - [32, 37.942]
  - - [1024, 10224, 1, 1024, 1024, 1024, 1024, 1024]
    - [144, 84.062]
  - - [1024, 10192, 1, 1024, 1024, 1024, 1024, 1024]
    - [126, 83.975]
  - - [1024, 10208, 1, 1024, 1024, 1024, 1024, 1024]
    - [144, 84.107]
  - - [1024, 10224, 1, 4096, 1024, 1024, 4096, 4096]
    - [151, 88.726]
  - - [4096, 10224, 1, 1024, 4096, 4096, 1024, 1024]
    - [88, 89.92]
  - - [3072, 10224, 1, 1024, 3072, 3072, 1024, 1024]
    - [77, 88.838]
  - - [3072, 10240, 1, 1024, 3072, 3072, 1024, 1024]
    - [77, 88.859]
  - - [1024, 10192, 1, 4096, 1024, 1024, 4096, 4096]
    - [144, 87.665]
  - - [4096, 10192, 1, 1024, 4096, 4096, 1024, 1024]
    - [88, 90.051]
  - - [3072, 10192, 1, 1024, 3072, 3072, 1024, 1024]
    - [77, 88.665]
  - - [3072, 10200, 1, 1024, 3072, 3072, 1024, 1024]
    - [77, 88.695]
  - - [1024, 10184, 1, 1024, 1024, 1024, 1024, 1024]
    - [126, 84.014]
  - - [3072, 10208, 1, 1024, 3072, 3072, 1024, 1024]
    - [77, 88.672]
  - - [1024, 10208, 1, 4096, 1024, 1024, 4096, 4096]
    - [126, 87.831]
  - - [4096, 10208, 1, 1024, 4096, 4096, 1024, 1024]
    - [77, 89.849]
  - - [2048, 10224, 1, 1024, 2048, 2048, 1024, 1024]
    - [151, 86.341]
  - - [2048, 10240, 1, 1024, 2048, 2048, 1024, 1024]
    - [151, 86.513]
  - - [1024, 10120, 1, 1024, 1024, 1024, 1024, 1024]
    - [41, 83.381]
  - - [2048, 10192, 1, 1024, 2048, 2048, 1024, 1024]
    - [134, 86.163]
  - - [24, 24, 6816, 64, 24, 24, 1308672, 1308672]
    - [86, 9.463]
  - - [24, 24, 6816, 64, 24, 24, 1308672, 436224]
    - [75, 10.049]
  - - [1024, 10152, 1, 1024, 1024, 1024, 1024, 1024]
    - [144, 83.785]
  - - [3072, 10080, 1, 1024, 3072, 3072, 1024, 1024]
    - [147, 90.539]
  - - [1024, 2048, 1, 49, 1024, 1024, 49, 49]
    - [43, 11.946]
  - - [1024, 256, 1, 196, 1024, 1024, 196, 196]
    - [11, 8.664]
  - - [1024, 512, 1, 196, 1024, 1024, 196, 196]
    - [139, 14.795]
  - - [1152, 128, 1, 784, 1152, 1152, 784, 784]
    - [121, 13.193]
  - - [128, 512, 1, 784, 128, 128, 784, 784]
    - [8, 5.937]
  - - [2048, 512, 1, 49, 2048, 2048, 49, 49]
    - [118, 7.948]
  - - [2304, 256, 1, 196, 2304, 2304, 196, 196]
    - [18, 16.644]
  - - [256, 1024, 1, 196, 256, 256, 196, 196]
    - [5, 8.822]
  - - [256, 128, 1, 3136, 256, 256, 3136, 3136]
    - [167, 9.863]
  - - [256, 512, 1, 784, 256, 256, 784, 784]
    - [53, 11.657]
  - - [256, 64, 1, 3136, 256, 256, 3136, 3136]
    - [170, 5.342]
  - - [4608, 512, 1, 49, 4608, 4608, 49, 49]
    - [43, 13.356]
  - - [512, 1024, 1, 196, 512, 512, 196, 196]
    - [17, 15.264]
  - - [512, 128, 1, 784, 512, 512, 784, 784]
    - [4, 5.864]
  - - [512, 2048, 1, 49, 512, 512, 49, 49]
    - [27, 8.511]
  - - [512, 256, 1, 784, 512, 512, 784, 784]
    - [37, 11.586]
  - - [576, 64, 1, 3136, 576, 576, 3136, 3136]
    - [171, 10.874]
  - - [64, 256, 1, 3136, 64, 64, 3136, 3136]
    - [169, 5.495]
  - - [64, 64, 1, 3136, 64, 64, 3136, 3136]
    - [173, 1.39]
  - - [128, 128, 49, 12800, 128, 128, 12800, 12800]
    - [127, 73.41]
  - - [128, 128, 25, 25088, 128, 128, 25088, 25088]
    - [158, 69.914]
  - - [128, 128, 49, 25600, 128, 128, 25600, 25600]
    - [82, 74.925]
  - - [128, 128, 25, 50176, 128, 128, 50176, 50176]
    - [172, 72.992]
  - - [256, 256, 25, 12544, 256, 256, 12544, 12544]
    - [165, 82.759]
  - - [256, 256, 49, 3200, 256, 256, 3200, 3200]
    - [126, 75.13]
  - - [256, 256, 25, 6272, 256, 256, 6272, 6272]
    - [94, 77.336]
  - - [256, 256, 49, 6400, 256, 256, 6400, 6400]
    - [126, 77.227]
  - - [512, 512, 49, 1152, 512, 512, 1152, 1152]
    - [144, 84.775]
  - - [512, 512, 25, 2048, 512, 512, 2048, 2048]
    - [57, 85.884]
  - - [512, 512, 49, 2304, 512, 512, 2304, 2304]
    - [81, 87.411]
  - - [512, 512, 25, 4096, 512, 512, 4096, 4096]
    - [57, 86.401]
  - - [64, 128, 2048, 128, 64, 64, 128, 128]
    - [89, 35.042]
  - - [128, 128, 2048, 64, 128, 128, 64, 64]
    - [64, 29.253]
  - - [30528, 2560, 1, 1024, 30528, 30528, 1024, 1024]
    - [149, 91.272]
  - - [1024, 128, 1, 1024, 1024, 1024, 1024, 1024]
    - [23, 15.412]
  - - [64, 128, 1536, 128, 64, 64, 128, 128]
    - [89, 34.412]
  - - [128, 128, 1536, 64, 128, 128, 64, 64]
    - [35, 28.71]
  - - [1024, 12288, 1, 1024, 1024, 1024, 1024, 1024]
    - [113, 85.156]
  - - [1024, 12288, 1, 4096, 1024, 1024, 4096, 4096]
    - [77, 90.238]
  - - [30528, 1920, 1, 1024, 30528, 30528, 1024, 1024]
    - [147, 91.14]
  - - [1024, 96, 1, 1024, 1024, 1024, 1024, 1024]
    - [9, 11.775]
  - - [4096, 12288, 1, 1024, 4096, 4096, 1024, 1024]
    - [77, 90.68]
  - - [128, 128, 36, 12544, 128, 128, 12544, 12544]
    - [163, 70.294]
  - - [128, 128, 49, 9216, 128, 128, 9216, 9216]
    - [143, 72.088]
  - - [128, 128, 64, 6400, 128, 128, 6400, 6400]
    - [56, 59.164]
  - - [128, 128, 81, 12544, 128, 128, 12544, 12544]
    - [159, 73.055]
  - - [128, 128, 121, 9216, 128, 128, 9216, 9216]
    - [164, 65.459]
  - - [128, 128, 169, 6400, 128, 128, 6400, 6400]
    - [41, 78.859]
  - - [256, 256, 36, 4096, 256, 256, 4096, 4096]
    - [88, 73.645]
  - - [256, 256, 49, 2304, 256, 256, 2304, 2304]
    - [93, 77.278]
  - - [256, 256, 64, 2304, 256, 256, 2304, 2304]
    - [76, 77.728]
  - - [256, 256, 81, 4096, 256, 256, 4096, 4096]
    - [112, 81.933]
  - - [256, 256, 121, 2304, 256, 256, 2304, 2304]
    - [57, 82.599]
  - - [256, 256, 169, 2304, 256, 256, 2304, 2304]
    - [126, 86.462]
  - - [512, 512, 81, 1024, 512, 512, 1024, 1024]
    - [41, 86.828]
  - - [512, 512, 121, 1024, 512, 512, 1024, 1024]
    - [41, 88.145]
  - - [512, 512, 169, 1024, 512, 512, 1024, 1024]
    - [57, 88.808]
  - - [512, 512, 36, 1024, 512, 512, 1024, 1024]
    - [41, 83.006]
  - - [512, 512, 49, 1024, 512, 512, 1024, 1024]
    - [41, 83.426]
  - - [512, 512, 64, 1024, 512, 512, 1024, 1024]
    - [41, 85.201]
  - - [64, 64, 36, 50176, 64, 64, 50176, 50176]
    - [161, 40.91]
  - - [64, 64, 49, 36864, 64, 64, 36864, 36864]
    - [160, 44.628]
  - - [64, 64, 64, 25600, 64, 64, 25600, 25600]
    - [166, 41.592]
  - - [128, 128, 192, 64, 128, 128, 64, 64]
    - [35, 20.259]
  - - [64, 128, 192, 128, 64, 64, 128, 128]
    - [6, 25.634]
  - - [768, 2048, 1, 768, 768, 768, 768, 768]
    - [125, 58.422]
  - - [3072, 2048, 1, 768, 3072, 3072, 768, 768]
    - [81, 77.295]
  - - [768, 2048, 1, 3072, 768, 768, 3072, 3072]
    - [126, 71.266]
  - - [768, 16, 1, 768, 768, 768, 768, 768]
    - [212, 1.635]
  - - [384, 384, 144, 64, 384, 384, 64, 64]
    - [125, 35.623]
  - - [64, 384, 144, 384, 64, 64, 384, 384]
    - [71, 48.819]
  - - [768, 4608, 1, 768, 768, 768, 768, 768]
    - [41, 72.88]
  - - [3072, 4608, 1, 768, 3072, 3072, 768, 768]
    - [81, 83.98]
  - - [768, 4608, 1, 3072, 768, 768, 3072, 3072]
    - [94, 82.885]
  - - [768, 12, 1, 768, 768, 768, 768, 768]
    - [212, 1.172]
  - - [512, 512, 48, 64, 512, 512, 64, 64]
    - [32, 32.555]
  - - [64, 512, 48, 512, 64, 64, 512, 512]
    - [90, 48.002]
  - - [768, 4, 1, 768, 768, 768, 768, 768]
    - [212, 0.401]
  - - [128, 128, 256, 64, 128, 128, 64, 64]
    - [143, 22.43]
  - - [64, 128, 256, 128, 64, 64, 128, 128]
    - [38, 24.628]
  - - [1024, 16, 1, 1024, 1024, 1024, 1024, 1024]
    - [224, 2.617]
  - - [384, 384, 192, 64, 384, 384, 64, 64]
    - [125, 36.703]
  - - [64, 384, 192, 384, 64, 64, 384, 384]
    - [80, 50.466]
  - - [1024, 4608, 1, 1024, 1024, 1024, 1024, 1024]
    - [41, 78.504]
  - - [4096, 4608, 1, 1024, 4096, 4096, 1024, 1024]
    - [88, 88.016]
  - - [1024, 4608, 1, 4096, 1024, 1024, 4096, 4096]
    - [110, 88.75]
  - - [2880, 3072, 1, 3072, 2880, 2880, 3072, 3072]
    - [126, 91.974]
  - - [3072, 3072, 1, 3072, 3072, 3072, 3072, 3072]
    - [126, 89.659]
  - - [3072, 512, 1, 3072, 3072, 3072, 3072, 3072]
    - [107, 71.209]
  - - [4096, 512, 1, 4096, 4096, 4096, 4096, 4096]
    - [96, 75.34]
  - - [512, 1024, 1, 1024, 512, 512, 1024, 1024]
    - [125, 36.408]
  - - [512, 2048, 1, 2048, 512, 512, 2048, 2048]
    - [147, 55.135]
  - - [512, 3072, 1, 3072, 512, 512, 3072, 3072]
    - [144, 71.378]
  - - [512, 4096, 1, 4096, 512, 512, 4096, 4096]
    - [30, 75.909]
  - - [512, 8192, 1, 8192, 512, 512, 8192, 8192]
    - [47, 90.008]
  - - [64, 1024, 1, 1024, 64, 64, 1024, 1024]
    - [20, 7.659]
  - - [8192, 512, 1, 8192, 8192, 8192, 8192, 8192]
    - [114, 88.642]
  - - [2, 1, 1, 1024, 2, 2, 1024, 1024]
    - [211, 0.0]
  - - [2, 8, 1, 1024, 2, 2, 1024, 1024]
    - [211, 0.003]
  - - [30522, 77, 1, 1024, 30522, 30522, 1024, 1024]
    - [189, 50.159]
  - - [30522, 616, 1, 1024, 30522, 30522, 1024, 1024]
    - [194, 81.031]
  - - [2, 10, 1, 1024, 2, 2, 1024, 1024]
    - [176, 0.003]
  - - [30522, 160, 1, 1024, 30522, 30522, 1024, 1024]
    - [199, 72.726]
  - - [30522, 200, 1, 1024, 30522, 30522, 1024, 1024]
    - [187, 61.127]
  - - [2, 39, 1, 1024, 2, 2, 1024, 1024]
    - [211, 0.012]
  - - [30522, 780, 1, 1024, 30522, 30522, 1024, 1024]
    - [197, 80.802]
  - - [2, 4, 1, 1024, 2, 2, 1024, 1024]
    - [175, 0.001]
  - - [30522, 308, 1, 1024, 30522, 30522, 1024, 1024]
    - [178, 72.243]
  - - [2, 40, 1, 1024, 2, 2, 1024, 1024]
    - [211, 0.012]
  - - [30522, 800, 1, 1024, 30522, 30522, 1024, 1024]
    - [195, 85.399]
  - - [2, 41, 1, 1024, 2, 2, 1024, 1024]
    - [216, 0.013]
  - - [30522, 820, 1, 1024, 30522, 30522, 1024, 1024]
    - [193, 83.963]
  - - [2, 5, 1, 1024, 2, 2, 1024, 1024]
    - [174, 0.001]
  - - [30522, 385, 1, 1024, 30522, 30522, 1024, 1024]
    - [200, 70.935]
  - - [2, 6, 1, 1024, 2, 2, 1024, 1024]
    - [174, 0.001]
  - - [30522, 462, 1, 1024, 30522, 30522, 1024, 1024]
    - [201, 79.326]
  - - [2, 9, 1, 1024, 2, 2, 1024, 1024]
    - [204, 0.003]
  - - [30522, 180, 1, 1024, 30522, 30522, 1024, 1024]
    - [184, 65.687]
  - - [2, 32, 1, 1024, 2, 2, 1024, 1024]
    - [210, 0.009]
  - - [4, 4, 32768, 64, 4, 4, 2097152, 2097152]
    - [219, 1.289]
  - - [4, 4, 38400, 64, 4, 4, 2457600, 2457600]
    - [219, 1.351]
  - - [14, 14, 10880, 64, 14, 14, 696320, 696320]
    - [229, 6.126]
  - - [15, 14, 10880, 64, 15, 15, 696320, 696320]
    - [225, 6.365]
  - - [15, 15, 7680, 64, 15, 15, 491520, 491520]
    - [230, 6.07]
  - - [15, 15, 10880, 64, 15, 15, 696320, 696320]
    - [229, 6.575]
  - - [17, 15, 7680, 64, 17, 17, 491520, 491520]
    - [179, 4.817]
  - - [17, 17, 6144, 64, 17, 17, 393216, 393216]
    - [196, 4.314]
  - - [17, 17, 7680, 64, 17, 17, 491520, 491520]
    - [198, 5.528]
  - - [21, 17, 6144, 64, 21, 21, 393216, 393216]
    - [181, 4.929]
  - - [21, 21, 6144, 64, 21, 21, 393216, 393216]
    - [177, 5.694]
  - - [30, 30, 2048, 64, 30, 30, 131072, 131072]
    - [196, 7.434]
  - - [30, 31, 2048, 64, 30, 30, 131072, 131072]
    - [190, 7.53]
  - - [31, 31, 2048, 64, 31, 31, 131072, 131072]
    - [188, 7.654]
  - - [34, 24, 4736, 64, 34, 34, 303104, 303104]
    - [191, 9.131]
  - - [34, 34, 4736, 64, 34, 34, 303104, 303104]
    - [182, 8.815]
  - - [35, 35, 4608, 64, 35, 35, 294912, 294912]
    - [182, 7.746]
  - - [2, 2048, 1, 1024, 2, 2, 1024, 1024]
    - [214, 0.66]
  - - [2, 1024, 1, 1024, 2, 2, 1024, 1024]
    - [226, 0.325]
  - - [5, 5, 1, 64, 5, 5, 64, 64]
    - [207, 0.0]
  - - [33, 33, 1, 32, 33, 33, 32, 32]
    - [174, 0.009]
  - - [3, 3, 512, 64, 3, 3, 64, 64]
    - [227, 0.087]
  - - [5, 5, 512, 64, 5, 5, 64, 64]
    - [215, 0.237]
  - - [5, 5, 960, 64, 5, 5, 64, 64]
    - [218, 0.404]
  - - [9, 9, 512, 64, 9, 9, 64, 64]
    - [208, 0.699]
  - - [27, 27, 32768, 128, 27, 27, 128, 128]
    - [186, 15.225]
  - - [33, 33, 1600, 32, 33, 33, 32, 32]
    - [185, 3.674]
  - - [684, 8976, 1, 256, 684, 684, 256, 256]
    - [183, 53.293]
  - - [44505, 8976, 1, 256, 44505, 44505, 256, 256]
    - [192, 78.791]
  - - [2, 2, 1, 2048, 2, 2, 2048, 2048]
    - [202, 0.001]
  - - [2, 16, 1, 1024, 2, 2, 1024, 1024]
    - [203, 0.004]
  - - [2, 4, 1, 2560, 2, 2, 2560, 2560]
    - [205, 0.003]
  - - [2, 64, 1, 1024, 2, 2, 1024, 1024]
    - [211, 0.019]
  - - [2, 80, 1, 1024, 2, 2, 1024, 1024]
    - [216, 0.025]
  - - [2, 82, 1, 1024, 2, 2, 1024, 1024]
    - [211, 0.025]
  - - [2, 12, 1, 1024, 2, 2, 1024, 1024]
    - [175, 0.003]
  - - [1, 4096, 1, 256, 1, 1, 256, 256]
    - [226, 0.228]
  - - [1, 6912, 1, 256, 1, 1, 256, 256]
    - [208, 0.364]
  - - [26, 26, 6272, 64, 26, 26, 1204224, 1204224]
    - [180, 9.301]
  - - [26, 26, 6272, 64, 26, 26, 1204224, 401408]
    - [180, 9.619]
  - - [147, 64, 1, 12544, 147, 147, 12544, 12544]
    - [206, 9.646]
  - - [2, 128, 1, 1024, 2, 2, 1024, 1024]
    - [228, 0.04]
  - - [2, 96, 1, 1024, 2, 2, 1024, 1024]
    - [214, 0.03]
  - - [2, 2048, 1, 768, 2, 2, 768, 768]
    - [226, 0.517]
  - - [2, 4608, 1, 768, 2, 2, 768, 768]
    - [228, 1.113]
  - - [2, 4608, 1, 1024, 2, 2, 1024, 1024]
    - [222, 1.328]
- null
