library/src/blas3/Tensile/Logic/asm_full/aldebaran_Cijk_Alik_Bljk_4xi8BH.yaml
- {MinimumRequiredVersion: 4.6.0}
- aldebaran
- gfx90a
- [Device 0050, Device 0051, Device 0052, Device 0054, Device 0062, Device 7400, Device
    SolutionIndex: 0
    SolutionNameMin: Cijk_Alik_Bljk_4xi8BH_MT64x16x16_SN_AMAS3_BL1_EPS1_GRVW4_GSU1_ISA90a_KLA_LRVW4_MAC_PGR1_SNLL1_TT4_4_USFGRO1_VW4_WG16_4_4_WGM1
    SolutionIndex: 1
    SolutionNameMin: Cijk_Alik_Bljk_4xi8BH_MT16x16x16_SN_AMAS3_BL1_EPS1_GRVW2_GSU8_ISA90a_KLA_LRVW2_MAC_PGR1_SNLL0_TT2_2_USFGRO1_VW2_WG8_8_4_WGM1
    SolutionIndex: 2
    SolutionNameMin: Cijk_Alik_Bljk_4xi8BH_MT16x16x16_SN_AMAS3_BL1_EPS1_GRVW2_GSU16_ISA90a_KLA_LRVW2_MAC_PGR1_SNLL0_TT2_2_USFGRO1_VW2_WG8_8_4_WGM1
    SolutionIndex: 3
    SolutionNameMin: Cijk_Alik_Bljk_4xi8BH_MT64x64x16_SN_AMAS3_BL1_EPS1_GRVW4_GSU1_ISA90a_KLA_LRVW4_MAC_PGR1_SNLL1_TT4_4_USFGRO1_VW4_WG16_16_1_WGM1
    SolutionIndex: 4
    SolutionNameMin: Cijk_Alik_Bljk_4xi8BH_MT128x64x8_SN_AMAS3_BL1_EPS1_GRVW4_GSU1_ISA90a_KLA_LRVW4_MAC_PGR1_SNLL1_TT8_4_USFGRO1_VW4_WG16_16_1_WGM8
    SolutionIndex: 5
    SolutionNameMin: Cijk_Alik_Bljk_4xi8BH_MT64x32x16_SN_AMAS3_BL1_EPS1_GRVW4_GSU4_ISA90a_KLA_LRVW4_MAC_PGR1_SNLL0_TT4_4_USFGRO1_VW4_WG16_8_2_WGM8
    SolutionIndex: 6
    SolutionNameMin: Cijk_Alik_Bljk_4xi8BH_MT32x32x32_SN_AMAS3_BL1_EPS1_GRVW4_GSU4_ISA90a_KLA_LRVW4_MAC_PGR1_SNLL0_TT4_4_USFGRO1_VW4_WG8_8_4_WGM1
    SolutionIndex: 7
    SolutionNameMin: Cijk_Alik_Bljk_4xi8BH_MT64x128x8_SN_AMAS3_BL1_EPS1_GRVW4_GSU1_ISA90a_KLA_LRVW4_MAC_PGR1_SNLL1_TT4_8_USFGRO1_VW4_WG16_16_1_WGM1
    SolutionIndex: 8
    SolutionNameMin: Cijk_Alik_Bljk_4xi8BH_MT128x64x8_SN_AMAS3_BL1_EPS1_GRVW4_GSU1_ISA90a_KLA_LRVW4_MAC_PGR1_SNLL1_TT8_4_USFGRO1_VW4_WG16_16_1_WGM1
    SolutionIndex: 9
    SolutionNameMin: Cijk_Alik_Bljk_4xi8BH_MT16x16x16_SN_AMAS3_BL1_EPS1_GRVW2_GSU4_ISA90a_KLA_LRVW2_MAC_PGR1_SNLL0_TT2_2_USFGRO1_VW2_WG8_8_4_WGM1
    SolutionIndex: 10
    SolutionNameMin: Cijk_Alik_Bljk_4xi8BH_MT64x64x16_SN_AMAS3_BL1_EPS1_GRVW4_GSU1_ISA90a_KLA_LRVW4_MAC_PGR1_SNLL1_TT4_4_USFGRO1_VW4_WG16_16_1_WGM8
    SolutionIndex: 11
    SolutionNameMin: Cijk_Alik_Bljk_4xi8BH_MT32x32x32_SN_AMAS3_BL1_EPS1_GRVW4_GSU4_ISA90a_KLA_LRVW4_MAC_PGR1_SNLL0_TT4_4_USFGRO1_VW4_WG8_8_4_WGM8
    SolutionIndex: 12
    SolutionNameMin: Cijk_Alik_Bljk_4xi8BH_MT128x32x16_SN_AMAS3_BL1_EPS1_GRVW4_GSU2_ISA90a_KLA_LRVW4_MAC_PGR1_SNLL0_TT8_4_USFGRO1_VW4_WG16_8_2_WGM8
    SolutionIndex: 13
    SolutionNameMin: Cijk_Alik_Bljk_4xi8BH_MT64x128x8_SN_AMAS3_BL1_EPS1_GRVW4_GSU1_ISA90a_KLA_LRVW4_MAC_PGR1_SNLL1_TT4_8_USFGRO1_VW4_WG16_16_1_WGM8
    SolutionIndex: 14
    SolutionNameMin: Cijk_Alik_Bljk_4xi8BH_MT32x8x32_SN_AMAS3_BL1_EPS1_GRVW4_GSU1_ISA90a_KLA_LRVW4_MAC_PGR1_SNLL1_TT4_4_USFGRO1_VW4_WG8_2_16_WGM1
    SolutionIndex: 15
    SolutionNameMin: Cijk_Alik_Bljk_4xi8BH_MT8x8x8_SN_AMAS3_BL1_EPS1_GRVW2_GSU16_ISA90a_KLA_LRVW2_MAC_PGR1_SNLL0_TT2_2_USFGRO1_VW2_WG4_4_4_WGM1
    SolutionIndex: 16
    SolutionNameMin: Cijk_Alik_Bljk_4xi8BH_MT32x32x16_SN_AMAS3_BL1_EPS1_GRVW4_GSU2_ISA90a_KLA_LRVW4_MAC_PGR1_SNLL0_TT4_4_USFGRO1_VW4_WG8_8_2_WGM8
    SolutionIndex: 17
    SolutionNameMin: Cijk_Alik_Bljk_4xi8BH_MT32x32x16_SN_AMAS3_BL1_EPS1_GRVW4_GSU4_ISA90a_KLA_LRVW4_MAC_PGR1_SNLL0_TT4_4_USFGRO1_VW4_WG8_8_2_WGM1
    SolutionIndex: 18
    SolutionNameMin: Cijk_Alik_Bljk_4xi8BH_MT128x32x16_SN_AMAS3_BL1_EPS1_GRVW4_GSU2_ISA90a_KLA_LRVW4_MAC_PGR1_SNLL0_TT8_4_USFGRO1_VW4_WG16_8_2_WGM1
    SolutionIndex: 19
    SolutionNameMin: Cijk_Alik_Bljk_4xi8BH_MT32x32x32_SN_AMAS3_BL1_EPS1_GRVW4_GSU1_ISA90a_KLA_LRVW4_MAC_PGR1_SNLL1_TT4_8_USFGRO1_VW4_WG8_4_8_WGM1
    SolutionIndex: 20
    SolutionNameMin: Cijk_Alik_Bljk_4xi8BH_MT128x64x16_SN_AMAS3_BL1_EPS1_GRVW4_GSU1_ISA90a_KLA_LRVW4_MAC_PGR1_SNLL1_TT8_4_USFGRO1_VW4_WG16_16_1_WGM8
    SolutionIndex: 21
    SolutionNameMin: Cijk_Alik_Bljk_4xi8BH_MT32x16x16_SN_AMAS3_BL1_EPS1_GRVW2_GSU8_ISA90a_KLA_LRVW2_MAC_PGR1_SNLL0_TT4_2_USFGRO1_VW2_WG8_8_4_WGM1
    SolutionIndex: 22
    SolutionNameMin: Cijk_Alik_Bljk_4xi8BH_MT64x8x32_SN_AMAS3_BL1_EPS1_GRVW4_GSU16_ISA90a_KLA_LRVW4_MAC_PGR1_SNLL0_TT4_4_USFGRO1_VW4_WG16_2_8_WGM1
    SolutionIndex: 23
    SolutionNameMin: Cijk_Alik_Bljk_4xi8BH_MT16x16x16_SN_AMAS3_BL1_EPS1_GRVW2_GSU8_ISA90a_KLA_LRVW2_MAC_PGR1_SNLL0_TT2_2_USFGRO1_VW2_WG8_8_4_WGM8
    SolutionIndex: 24
    SolutionNameMin: Cijk_Alik_Bljk_4xi8BH_MT64x32x16_SN_AMAS3_BL1_EPS1_GRVW4_GSU2_ISA90a_KLA_LRVW4_MAC_PGR1_SNLL0_TT4_4_USFGRO1_VW4_WG16_8_2_WGM8
    SolutionIndex: 25
    SolutionNameMin: Cijk_Alik_Bljk_4xi8BH_MT16x16x16_SN_AMAS3_BL1_EPS1_GRVW2_GSU4_ISA90a_KLA_LRVW2_MAC_PGR1_SNLL0_TT2_2_USFGRO1_VW2_WG8_8_4_WGM8
    SolutionIndex: 26
    SolutionNameMin: Cijk_Alik_Bljk_4xi8BH_MT8x8x8_SN_AMAS3_BL1_EPS1_GRVW2_GSU8_ISA90a_KLA_LRVW2_MAC_PGR1_SNLL0_TT2_2_USFGRO1_VW2_WG4_4_4_WGM1
    SolutionIndex: 27
    SolutionNameMin: Cijk_Alik_Bljk_4xi8BH_MT32x32x16_SN_AMAS3_BL1_EPS1_GRVW4_GSU2_ISA90a_KLA_LRVW4_MAC_PGR1_SNLL0_TT4_4_USFGRO1_VW4_WG8_8_2_WGM1
    SolutionIndex: 28
    SolutionNameMin: Cijk_Alik_Bljk_4xi8BH_MT128x128x16_SN_AMAS3_BL1_EPS1_GRVW4_GSU1_ISA90a_KLA_LRVW4_MAC_PGR1_SNLL1_TT8_8_USFGRO1_VW4_WG16_16_1_WGM8
    SolutionIndex: 29
    SolutionNameMin: Cijk_Alik_Bljk_4xi8BH_MT128x32x16_SN_AMAS3_BL1_EPS1_GRVW4_GSU4_ISA90a_KLA_LRVW4_MAC_PGR1_SNLL0_TT8_4_USFGRO1_VW4_WG16_8_2_WGM8
    SolutionIndex: 30
    SolutionNameMin: Cijk_Alik_Bljk_4xi8BH_MT128x8x32_SN_AMAS3_BL1_EPS0_GRVW4_GSU16_ISA90a_KLA_LRVW4_MAC_PGR0_SNLL0_TT4_4_USFGRO1_VW4_WG32_2_4_WGM1
    SolutionIndex: 31
    SolutionNameMin: Cijk_Alik_Bljk_4xi8BH_MT64x64x8_SN_AMAS3_BL1_EPS1_GRVW4_GSU1_ISA90a_KLA_LRVW4_MAC_PGR1_SNLL1_TT4_4_USFGRO1_VW4_WG16_16_1_WGM8
    SolutionIndex: 32
    SolutionNameMin: Cijk_Alik_Bljk_4xi8BH_MT32x32x32_SN_AMAS3_BL1_EPS1_GRVW4_GSU2_ISA90a_KLA_LRVW4_MAC_PGR1_SNLL0_TT4_4_USFGRO1_VW4_WG8_8_4_WGM1
    SolutionIndex: 33
    SolutionNameMin: Cijk_Alik_Bljk_4xi8BH_MT8x8x8_SN_AMAS3_BL1_EPS1_GRVW2_GSU1_ISA90a_KLA_LRVW2_MAC_PGR1_SNLL1_TT2_2_USFGRO1_VW2_WG4_4_4_WGM1
    SolutionIndex: 34
    SolutionNameMin: Cijk_Alik_Bljk_4xi8BH_MT32x64x8_SN_AMAS3_BL1_EPS1_GRVW4_GSU1_ISA90a_KLA_LRVW4_MAC_PGR1_SNLL1_TT4_4_USFGRO1_VW4_WG8_16_2_WGM1
    SolutionIndex: 35
    SolutionNameMin: Cijk_Alik_Bljk_4xi8BH_MT64x128x16_SN_AMAS3_BL1_EPS1_GRVW4_GSU1_ISA90a_KLA_LRVW4_MAC_PGR1_SNLL1_TT4_8_USFGRO1_VW4_WG16_16_1_WGM1
    SolutionIndex: 36
    SolutionNameMin: Cijk_Alik_Bljk_4xi8BH_MT32x32x16_SN_AMAS3_BL1_EPS1_GRVW4_GSU4_ISA90a_KLA_LRVW4_MAC_PGR1_SNLL0_TT4_4_USFGRO1_VW4_WG8_8_2_WGM8
    SolutionIndex: 37
    SolutionNameMin: Cijk_Alik_Bljk_4xi8BH_MT64x32x16_SN_AMAS3_BL1_EPS1_GRVW4_GSU2_ISA90a_KLA_LRVW4_MAC_PGR1_SNLL0_TT4_4_USFGRO1_VW4_WG16_8_2_WGM1
    SolutionIndex: 38
    SolutionNameMin: Cijk_Alik_Bljk_4xi8BH_MT16x16x16_SN_AMAS3_BL1_EPS1_GRVW2_GSU1_ISA90a_KLA_LRVW2_MAC_PGR1_SNLL1_TT2_2_USFGRO1_VW2_WG8_8_4_WGM1
    SolutionIndex: 39
    SolutionNameMin: Cijk_Alik_Bljk_4xi8BH_MT128x128x16_SN_AMAS3_BL1_EPS1_GRVW4_GSU1_ISA90a_KLA_LRVW4_MAC_PGR1_SNLL1_TT8_8_USFGRO1_VW4_WG16_16_1_WGM1
    SolutionIndex: 40
    SolutionNameMin: Cijk_Alik_Bljk_4xi8BH_MT32x16x16_SN_AMAS3_BL1_EPS1_GRVW4_GSU1_ISA90a_KLA_LRVW4_MAC_PGR1_SNLL1_TT4_4_USFGRO1_VW4_WG8_4_8_WGM8
    SolutionIndex: 41
    SolutionNameMin: Cijk_Alik_Bljk_4xi8BH_MT64x32x16_SN_AMAS3_BL1_EPS1_GRVW4_GSU4_ISA90a_KLA_LRVW4_MAC_PGR1_SNLL0_TT4_4_USFGRO1_VW4_WG16_8_2_WGM1
    SolutionIndex: 42
    SolutionNameMin: Cijk_Alik_Bljk_4xi8BH_MT32x32x32_SN_AMAS3_BL1_EPS1_GRVW4_GSU4_ISA90a_KLA_LRVW4_MAC_PGR1_SNLL0_TT4_8_USFGRO1_VW4_WG8_4_8_WGM8
    SolutionIndex: 43
    SolutionNameMin: Cijk_Alik_Bljk_4xi8BH_MT36x48x16_SN_AMAS0_BL1_EPS1_GRVW1_GSU8_ISA90a_KLA_LRVW1_MAC_PGR1_SNLL0_TT3_3_USFGRO1_VW1_WG12_16_1_WGM1
    SolutionIndex: 44
    SolutionNameMin: Cijk_Alik_Bljk_4xi8BH_MT64x64x8_SN_AMAS3_BL1_EPS1_GRVW4_GSU1_ISA90a_KLA_LRVW4_MAC_PGR1_SNLL1_TT4_4_USFGRO1_VW4_WG16_16_1_WGM1
    SolutionIndex: 45
    SolutionNameMin: Cijk_Alik_Bljk_4xi8BH_MT64x128x16_SN_AMAS3_BL1_EPS1_GRVW4_GSU1_ISA90a_KLA_LRVW4_MAC_PGR1_SNLL1_TT4_8_USFGRO1_VW4_WG16_16_1_WGM8
    SolutionIndex: 46
    SolutionNameMin: Cijk_Alik_Bljk_4xi8BH_MT64x16x16_SN_AMAS3_BL1_EPS1_GRVW4_GSU2_ISA90a_KLA_LRVW4_MAC_PGR1_SNLL0_TT4_4_USFGRO1_VW4_WG16_4_4_WGM8
    SolutionIndex: 47
    SolutionNameMin: Cijk_Alik_Bljk_4xi8BH_MT32x8x32_SN_AMAS3_BL1_EPS1_GRVW2_GSU4_ISA90a_KLA_LRVW2_MAC_PGR1_SNLL0_TT2_2_USFGRO1_VW2_WG16_4_4_WGM8
    SolutionIndex: 48
    SolutionNameMin: Cijk_Alik_Bljk_4xi8BH_MT64x32x8_SN_AMAS3_BL1_EPS1_GRVW4_GSU1_ISA90a_KLA_LRVW4_MAC_PGR1_SNLL1_TT4_4_USFGRO1_VW4_WG16_8_2_WGM1
    SolutionIndex: 49
    SolutionNameMin: Cijk_Alik_Bljk_4xi8BH_MT64x64x32_SN_AMAS3_BL1_EPS1_GRVW4_GSU1_ISA90a_KLA_LRVW4_MAC_PGR1_SNLL1_TT4_4_USFGRO1_VW4_WG16_16_1_WGM8
    SolutionIndex: 50
    SolutionNameMin: Cijk_Alik_Bljk_4xi8BH_MT32x16x16_SN_AMAS3_BL1_EPS1_GRVW2_GSU4_ISA90a_KLA_LRVW2_MAC_PGR1_SNLL0_TT2_2_USFGRO1_VW2_WG16_8_2_WGM1
    SolutionIndex: 51
    SolutionNameMin: Cijk_Alik_Bljk_4xi8BH_MT32x16x16_SN_AMAS3_BL1_EPS1_GRVW2_GSU2_ISA90a_KLA_LRVW2_MAC_PGR1_SNLL0_TT4_2_USFGRO1_VW2_WG8_8_4_WGM8
    SolutionIndex: 52
    SolutionNameMin: Cijk_Alik_Bljk_4xi8BH_MT64x32x16_SN_AMAS3_BL1_EPS1_GRVW4_GSU2_ISA90a_KLA_LRVW4_MAC_PGR1_SNLL0_TT8_4_USFGRO1_VW4_WG8_8_2_WGM1
    SolutionIndex: 53
    SolutionNameMin: Cijk_Alik_Bljk_4xi8BH_MT128x16x32_SN_AMAS3_BL1_EPS0_GRVW4_GSU32_ISA90a_KLA_LRVW4_MAC_PGR0_SNLL0_TT4_4_USFGRO1_VW4_WG32_4_2_WGM1
    SolutionIndex: 54
    SolutionNameMin: Cijk_Alik_Bljk_4xi8BH_MT32x16x8_SN_AMAS2_BL0_EPS0_GRVW2_GSU1_ISA000_KLS_LRVW2_FMA_PGR1_SNLL0_TT2_2_USFGRO0_VW2_WG16_8_1_WGM1
    SolutionIndex: 55
    SolutionNameMin: Cijk_Alik_Bljk_4xi8BH_MT64x16x16_SN_AMAS3_BL1_EPS1_GRVW4_GSU2_ISA90a_KLA_LRVW4_MAC_PGR1_SNLL0_TT4_4_USFGRO1_VW4_WG16_4_4_WGM1
    SolutionIndex: 56
    SolutionNameMin: Cijk_Alik_Bljk_4xi8BH_MT32x8x32_SN_AMAS3_BL1_EPS1_GRVW2_GSU2_ISA90a_KLA_LRVW2_MAC_PGR1_SNLL0_TT2_2_USFGRO1_VW2_WG16_4_4_WGM1
    SolutionIndex: 57
    SolutionNameMin: Cijk_Alik_Bljk_4xi8BH_MT32x16x16_SN_AMAS3_BL1_EPS1_GRVW2_GSU2_ISA90a_KLA_LRVW2_MAC_PGR1_SNLL0_TT2_2_USFGRO1_VW2_WG16_8_2_WGM1
    SolutionIndex: 58
    SolutionNameMin: Cijk_Alik_Bljk_4xi8BH_MT16x16x8_SN_AMAS2_BL0_EPS0_GRVW2_GSU1_ISA000_KLS_LRVW2_FMA_PGR1_SNLL0_TT2_2_USFGRO0_VW2_WG8_8_1_WGM1
    SolutionIndex: 59
    SolutionNameMin: Cijk_Alik_Bljk_4xi8BH_MT32x8x32_SN_AMAS3_BL1_EPS1_GRVW2_GSU2_ISA90a_KLA_LRVW2_MAC_PGR1_SNLL0_TT2_2_USFGRO1_VW2_WG16_4_4_WGM8
    SolutionIndex: 60
    SolutionNameMin: Cijk_Alik_Bljk_4xi8BH_MT32x16x16_SN_AMAS3_BL1_EPS1_GRVW2_GSU4_ISA90a_KLA_LRVW2_MAC_PGR1_SNLL0_TT4_2_USFGRO1_VW2_WG8_8_4_WGM1
    SolutionIndex: 61
    SolutionNameMin: Cijk_Alik_Bljk_4xi8BH_MT16x16x32_SN_AMAS3_BL1_EPS1_GRVW2_GSU2_ISA90a_KLA_LRVW2_MAC_PGR1_SNLL0_TT2_2_USFGRO1_VW2_WG8_8_4_WGM1
- - - [1024, 128, 1, 128]
    - [0, 6.111]
  - - [4, 704, 1, 1280]
    - [1, 1.098]
  - - [4, 1856, 1, 3328]
    - [2, 3.263]
  - - [1856, 448, 1, 3328]
    - [3, 49.767]
  - - [2944, 4288, 1, 1280]
    - [4, 69.596]
  - - [2368, 64, 1, 3328]
    - [5, 33.449]
  - - [1760, 32, 1, 1760]
    - [6, 17.645]
  - - [2368, 5888, 1, 256]
    - [7, 62.545]
  - - [5888, 1856, 1, 256]
    - [8, 60.164]
  - - [128, 64, 1, 256]
    - [9, 0.758]
  - - [512, 24000, 1, 1536]
    - [8, 73.152]
  - - [128, 6784, 1, 3328]
    - [3, 52.044]
  - - [5888, 1408, 1, 256]
    - [7, 57.79]
  - - [5888, 1856, 1, 3328]
    - [4, 72.09]
  - - [5056, 704, 1, 256]
    - [4, 52.793]
  - - [2048, 400, 1, 512]
    - [3, 31.39]
  - - [5888, 2944, 1, 3328]
    - [4, 73.738]
  - - [1856, 4288, 1, 256]
    - [7, 54.636]
  - - [1024, 5056, 1, 128]
    - [8, 48.006]
  - - [5056, 5056, 1, 3328]
    - [7, 75.11]
  - - [1408, 5888, 1, 1280]
    - [4, 69.434]
  - - [2368, 448, 1, 128]
    - [10, 21.797]
  - - [2368, 6784, 1, 128]
    - [7, 61.428]
  - - [1024, 3584, 1, 3328]
    - [4, 60.762]
  - - [512, 48000, 1, 2048]
    - [4, 74.755]
  - - [128, 448, 1, 1280]
    - [11, 13.42]
  - - [256, 4288, 1, 3328]
    - [12, 51.67]
  - - [5888, 1408, 1, 1280]
    - [13, 67.368]
  - - [704, 1856, 1, 3328]
    - [10, 54.891]
  - - [4, 1408, 1, 128]
    - [14, 0.25]
  - - [1024, 2368, 1, 256]
    - [8, 52.384]
  - - [64, 4, 1, 256]
    - [15, 0.026]
  - - [1408, 1856, 1, 1280]
    - [4, 65.802]
  - - [1408, 64, 1, 1280]
    - [6, 18.28]
  - - [448, 1024, 1, 1280]
    - [16, 34.618]
  - - [6144, 24000, 1, 2048]
    - [4, 78.157]
  - - [4096, 32, 1, 4096]
    - [17, 34.761]
  - - [256, 1408, 1, 3328]
    - [18, 40.257]
  - - [5056, 5056, 1, 1280]
    - [4, 75.273]
  - - [448, 5056, 1, 256]
    - [7, 45.694]
  - - [704, 1856, 1, 1280]
    - [3, 52.941]
  - - [128, 5056, 1, 128]
    - [3, 20.661]
  - - [2368, 128, 1, 256]
    - [19, 17.378]
  - - [1760, 6400, 1, 1760]
    - [4, 71.836]
  - - [1856, 1408, 1, 128]
    - [7, 44.289]
  - - [64, 5056, 1, 256]
    - [19, 18.187]
  - - [6784, 256, 1, 3328]
    - [20, 60.783]
  - - [6784, 4288, 1, 3328]
    - [4, 75.652]
  - - [4288, 448, 1, 256]
    - [3, 43.531]
  - - [64, 704, 1, 128]
    - [14, 2.45]
  - - [1856, 2368, 1, 3328]
    - [10, 61.318]
  - - [4288, 2944, 1, 1280]
    - [7, 69.942]
  - - [704, 5056, 1, 1280]
    - [13, 63.016]
  - - [2368, 704, 1, 3328]
    - [20, 58.351]
  - - [256, 5888, 1, 256]
    - [4, 42.138]
  - - [1856, 4288, 1, 3328]
    - [13, 71.877]
  - - [256, 2944, 1, 256]
    - [10, 30.884]
  - - [5888, 1024, 1, 256]
    - [7, 60.29]
  - - [448, 64, 1, 1280]
    - [21, 8.043]
  - - [3072, 64, 1, 1024]
    - [19, 27.578]
  - - [3584, 4, 1, 1280]
    - [22, 3.708]
  - - [16384, 3200, 1, 4096]
    - [4, 76.291]
  - - [2944, 64, 1, 256]
    - [0, 13.234]
  - - [128, 4, 1, 1280]
    - [23, 0.189]
  - - [1408, 2944, 1, 256]
    - [8, 57.327]
  - - [256, 1856, 1, 1280]
    - [24, 32.874]
  - - [6784, 5056, 1, 3328]
    - [4, 76.367]
  - - [5056, 5056, 1, 256]
    - [7, 67.306]
  - - [1408, 6784, 1, 128]
    - [7, 56.456]
  - - [64, 1024, 1, 1280]
    - [6, 14.205]
  - - [2944, 4, 1, 256]
    - [25, 1.02]
  - - [704, 5056, 1, 128]
    - [7, 47.809]
  - - [4, 2368, 1, 1280]
    - [26, 2.847]
  - - [2368, 2944, 1, 1280]
    - [7, 71.23]
  - - [128, 3584, 1, 1280]
    - [16, 34.455]
  - - [6784, 6784, 1, 1280]
    - [4, 76.119]
  - - [1024, 256, 1, 3328]
    - [27, 37.028]
  - - [1408, 4288, 1, 1280]
    - [7, 66.72]
  - - [3584, 4288, 1, 1280]
    - [4, 72.969]
  - - [2368, 704, 1, 1280]
    - [20, 55.965]
  - - [5056, 4288, 1, 3328]
    - [4, 74.99]
  - - [3584, 2368, 1, 3328]
    - [28, 70.155]
  - - [64, 704, 1, 1280]
    - [6, 11.407]
  - - [4288, 256, 1, 256]
    - [3, 34.587]
  - - [2944, 128, 1, 128]
    - [0, 12.857]
  - - [6144, 32, 1, 2560]
    - [29, 33.811]
  - - [6784, 448, 1, 1280]
    - [4, 60.741]
  - - [1408, 2944, 1, 128]
    - [7, 48.877]
  - - [4288, 2944, 1, 256]
    - [7, 65.089]
  - - [5888, 704, 1, 1280]
    - [4, 62.735]
  - - [5056, 4, 1, 3328]
    - [30, 7.057]
  - - [1856, 64, 1, 1280]
    - [6, 20.584]
  - - [1760, 16, 1, 1760]
    - [21, 10.762]
  - - [448, 5888, 1, 128]
    - [13, 39.149]
  - - [5888, 64, 1, 3328]
    - [18, 42.474]
  - - [2944, 256, 1, 3328]
    - [3, 44.754]
  - - [1024, 64, 1, 128]
    - [14, 3.019]
  - - [5056, 2368, 1, 1280]
    - [4, 71.947]
  - - [448, 3584, 1, 1280]
    - [7, 52.176]
  - - [6784, 5888, 1, 256]
    - [13, 72.386]
  - - [704, 1024, 1, 128]
    - [31, 19.064]
  - - [704, 128, 1, 1280]
    - [32, 18.08]
  - - [4, 3584, 1, 128]
    - [33, 0.607]
  - - [1408, 448, 1, 1280]
    - [34, 41.386]
  - - [1024, 1408, 1, 256]
    - [35, 40.72]
  - - [2368, 2368, 1, 3328]
    - [4, 67.348]
  - - [1856, 6784, 1, 128]
    - [20, 50.248]
  - - [5056, 704, 1, 3328]
    - [8, 68.809]
  - - [1408, 1856, 1, 256]
    - [8, 55.176]
  - - [1408, 704, 1, 3328]
    - [12, 47.764]
  - - [2368, 5056, 1, 256]
    - [8, 64.61]
  - - [1408, 256, 1, 1280]
    - [12, 32.928]
  - - [3072, 128, 1, 1024]
    - [34, 32.465]
  - - [3584, 2368, 1, 1280]
    - [4, 70.758]
  - - [4288, 64, 1, 3328]
    - [16, 38.346]
  - - [2368, 4, 1, 1280]
    - [26, 2.852]
  - - [704, 5888, 1, 256]
    - [13, 51.614]
  - - [6784, 2944, 1, 128]
    - [7, 61.457]
  - - [2560, 1600, 1, 2560]
    - [8, 66.147]
  - - [4288, 6784, 1, 3328]
    - [4, 75.965]
  - - [2944, 256, 1, 256]
    - [10, 32.072]
  - - [2944, 6784, 1, 3328]
    - [4, 74.521]
  - - [704, 1408, 1, 3328]
    - [12, 47.525]
  - - [6144, 5984, 1, 2048]
    - [4, 75.946]
  - - [3584, 704, 1, 3328]
    - [8, 66.659]
  - - [2944, 256, 1, 128]
    - [3, 23.965]
  - - [6784, 4, 1, 1280]
    - [14, 5.161]
  - - [1024, 64, 1, 1280]
    - [6, 13.648]
  - - [2048, 1600, 1, 512]
    - [8, 52.1]
  - - [448, 4288, 1, 256]
    - [10, 42.415]
  - - [64, 3584, 1, 3328]
    - [36, 35.419]
  - - [1856, 4288, 1, 128]
    - [7, 51.893]
  - - [704, 2368, 1, 1280]
    - [35, 50.835]
  - - [1856, 2368, 1, 1280]
    - [10, 57.467]
  - - [2368, 128, 1, 3328]
    - [37, 37.676]
  - - [2944, 128, 1, 256]
    - [34, 18.907]
  - - [448, 1408, 1, 256]
    - [34, 28.649]
  - - [1856, 4288, 1, 1280]
    - [7, 69.71]
  - - [64, 5056, 1, 3328]
    - [27, 39.09]
  - - [4, 704, 1, 256]
    - [14, 0.244]
  - - [1024, 448, 1, 128]
    - [31, 12.999]
  - - [704, 4, 1, 1280]
    - [22, 0.97]
  - - [704, 256, 1, 128]
    - [0, 8.203]
  - - [704, 2944, 1, 128]
    - [3, 38.281]
  - - [1408, 1024, 1, 1280]
    - [20, 48.322]
  - - [704, 6784, 1, 256]
    - [7, 57.668]
  - - [6784, 704, 1, 256]
    - [4, 54.701]
  - - [5056, 1408, 1, 128]
    - [7, 53.514]
  - - [2048, 7000, 1, 2048]
    - [4, 75.463]
  - - [256, 3584, 1, 3328]
    - [29, 45.334]
  - - [4, 5888, 1, 3328]
    - [17, 5.003]
  - - [128, 1408, 1, 128]
    - [19, 7.976]
  - - [3584, 4288, 1, 3328]
    - [4, 72.267]
  - - [5888, 1856, 1, 1280]
    - [7, 69.217]
  - - [256, 1408, 1, 256]
    - [34, 19.483]
  - - [5056, 64, 1, 1280]
    - [37, 32.556]
  - - [1024, 704, 1, 256]
    - [10, 30.432]
  - - [448, 128, 1, 128]
    - [38, 2.768]
  - - [2368, 3584, 1, 1280]
    - [7, 68.447]
  - - [2368, 6784, 1, 1280]
    - [7, 75.022]
  - - [1024, 256, 1, 256]
    - [19, 14.902]
  - - [1856, 4, 1, 1280]
    - [22, 2.409]
  - - [448, 448, 1, 256]
    - [19, 13.852]
  - - [2944, 3584, 1, 3328]
    - [4, 73.342]
  - - [7680, 32, 1, 2560]
    - [36, 34.508]
  - - [128, 4288, 1, 128]
    - [3, 18.247]
  - - [256, 256, 1, 3328]
    - [36, 23.493]
  - - [128, 1024, 1, 3328]
    - [36, 32.369]
  - - [4, 1408, 1, 3328]
    - [15, 3.13]
  - - [6784, 2944, 1, 256]
    - [13, 64.441]
  - - [64, 1856, 1, 1280]
    - [6, 18.968]
  - - [6784, 64, 1, 128]
    - [3, 16.193]
  - - [4288, 2368, 1, 3328]
    - [4, 72.107]
  - - [1856, 2368, 1, 256]
    - [10, 54.06]
  - - [3584, 256, 1, 128]
    - [3, 24.973]
  - - [3584, 6784, 1, 3328]
    - [4, 77.082]
  - - [256, 1024, 1, 256]
    - [19, 13.953]
  - - [4, 6784, 1, 3328]
    - [17, 5.231]
  - - [1024, 5888, 1, 3328]
    - [8, 70.306]
  - - [1024, 128, 1, 1280]
    - [6, 20.621]
  - - [3072, 32, 1, 1024]
    - [6, 17.237]
  - - [6144, 24000, 1, 2560]
    - [4, 78.327]
  - - [5056, 4288, 1, 1280]
    - [4, 72.519]
  - - [5888, 64, 1, 256]
    - [34, 20.115]
  - - [6784, 1856, 1, 3328]
    - [4, 74.031]
  - - [1408, 5056, 1, 1280]
    - [8, 70.706]
  - - [1856, 256, 1, 1280]
    - [16, 34.304]
  - - [64, 5888, 1, 3328]
    - [27, 39.356]
  - - [2368, 2368, 1, 1280]
    - [8, 64.528]
  - - [2944, 5888, 1, 128]
    - [39, 59.13]
  - - [704, 5888, 1, 1280]
    - [7, 61.945]
  - - [2368, 3584, 1, 128]
    - [7, 53.408]
  - - [1856, 5056, 1, 128]
    - [7, 55.337]
  - - [704, 1024, 1, 1280]
    - [3, 43.627]
  - - [448, 256, 1, 3328]
    - [17, 29.806]
  - - [448, 1856, 1, 128]
    - [10, 25.947]
  - - [8192, 3200, 1, 2048]
    - [4, 74.375]
  - - [128, 1024, 1, 128]
    - [40, 5.952]
  - - [2944, 4, 1, 128]
    - [38, 0.557]
  - - [1024, 704, 1, 1280]
    - [3, 44.452]
  - - [128, 5888, 1, 256]
    - [31, 28.674]
  - - [1024, 5056, 1, 1280]
    - [8, 69.117]
  - - [4288, 1024, 1, 256]
    - [7, 56.801]
  - - [2944, 2368, 1, 128]
    - [8, 55.696]
  - - [704, 704, 1, 3328]
    - [41, 41.241]
  - - [704, 1408, 1, 1280]
    - [10, 42.58]
  - - [5888, 448, 1, 1280]
    - [8, 66.099]
  - - [3584, 256, 1, 3328]
    - [12, 44.96]
  - - [704, 5888, 1, 3328]
    - [13, 62.75]
  - - [704, 1856, 1, 128]
    - [10, 32.331]
  - - [448, 448, 1, 3328]
    - [37, 36.361]
  - - [4, 4288, 1, 128]
    - [38, 0.803]
  - - [128, 704, 1, 1280]
    - [32, 17.515]
  - - [3584, 2944, 1, 256]
    - [8, 65.346]
  - - [3584, 4, 1, 128]
    - [33, 0.605]
  - - [1856, 128, 1, 3328]
    - [36, 34.581]
  - - [4, 64, 1, 1280]
    - [23, 0.105]
  - - [2944, 448, 1, 128]
    - [3, 33.37]
  - - [128, 2944, 1, 1280]
    - [16, 33.3]
  - - [64, 64, 1, 3328]
    - [2, 3.808]
  - - [448, 2944, 1, 1280]
    - [10, 47.966]
  - - [512, 24000, 1, 2048]
    - [4, 74.472]
  - - [128, 256, 1, 3328]
    - [21, 14.859]
  - - [1408, 5056, 1, 3328]
    - [39, 71.354]
  - - [1856, 1856, 1, 3328]
    - [4, 65.456]
  - - [3584, 128, 1, 256]
    - [34, 20.562]
  - - [2560, 800, 1, 2560]
    - [8, 53.722]
  - - [448, 1408, 1, 3328]
    - [5, 42.557]
  - - [2368, 2368, 1, 256]
    - [8, 46.951]
  - - [4288, 4288, 1, 1280]
    - [4, 74.159]
  - - [64, 448, 1, 1280]
    - [42, 8.113]
  - - [5888, 1024, 1, 1280]
    - [4, 70.023]
  - - [1408, 4288, 1, 256]
    - [8, 60.582]
  - - [448, 4, 1, 256]
    - [1, 0.165]
  - - [5888, 448, 1, 128]
    - [4, 45.192]
  - - [512, 48000, 1, 2560]
    - [4, 75.844]
  - - [35, 8457, 1, 1760]
    - [43, 28.537]
  - - [704, 6784, 1, 3328]
    - [4, 62.969]
  - - [2560, 6400, 1, 2560]
    - [4, 73.467]
  - - [5056, 1024, 1, 1280]
    - [7, 66.436]
  - - [448, 5888, 1, 3328]
    - [13, 68.604]
  - - [128, 4, 1, 128]
    - [26, 0.027]
  - - [1024, 2944, 1, 1280]
    - [4, 57.461]
  - - [5056, 5888, 1, 1280]
    - [13, 75.328]
  - - [4288, 5888, 1, 128]
    - [7, 60.034]
  - - [256, 3584, 1, 256]
    - [10, 31.846]
  - - [1408, 3584, 1, 128]
    - [7, 47.931]
  - - [256, 2944, 1, 3328]
    - [44, 45.886]
  - - [448, 3584, 1, 128]
    - [45, 35.369]
  - - [5888, 2944, 1, 1280]
    - [7, 72.809]
  - - [4, 6784, 1, 1280]
    - [16, 4.004]
  - - [2368, 5888, 1, 128]
    - [7, 53.345]
  - - [8448, 16, 1, 2816]
    - [46, 26.357]
  - - [64, 2944, 1, 128]
    - [0, 8.735]
  - - [2368, 4, 1, 256]
    - [47, 0.902]
  - - [3584, 5888, 1, 256]
    - [4, 69.619]
  - - [2368, 1024, 1, 128]
    - [7, 42.087]
  - - [2368, 704, 1, 128]
    - [3, 36.63]
  - - [3584, 2944, 1, 1280]
    - [8, 73.441]
  - - [3584, 2368, 1, 128]
    - [8, 55.958]
  - - [5056, 704, 1, 128]
    - [8, 46.725]
  - - [448, 2368, 1, 128]
    - [0, 23.903]
  - - [5056, 1408, 1, 3328]
    - [7, 72.935]
  - - [1408, 704, 1, 256]
    - [10, 32.811]
  - - [6784, 1024, 1, 3328]
    - [28, 71.097]
  - - [6784, 2944, 1, 3328]
    - [4, 75.032]
  - - [2944, 5056, 1, 3328]
    - [4, 74.557]
  - - [1856, 1856, 1, 256]
    - [4, 56.442]
  - - [1024, 5888, 1, 128]
    - [13, 50.287]
  - - [6784, 2368, 1, 1280]
    - [4, 72.818]
  - - [256, 4, 1, 128]
    - [14, 0.049]
  - - [4288, 5888, 1, 1280]
    - [7, 73.947]
  - - [4288, 4288, 1, 256]
    - [8, 64.443]
  - - [8448, 32, 1, 2816]
    - [27, 38.457]
  - - [448, 2944, 1, 3328]
    - [3, 57.996]
  - - [5888, 4, 1, 128]
    - [14, 1.12]
  - - [4288, 1856, 1, 1280]
    - [8, 71.514]
  - - [1856, 2944, 1, 3328]
    - [4, 66.075]
  - - [256, 6784, 1, 3328]
    - [20, 62.907]
  - - [64, 5888, 1, 256]
    - [34, 20.289]
  - - [256, 5056, 1, 128]
    - [10, 32.887]
  - - [5056, 1024, 1, 256]
    - [7, 58.885]
  - - [704, 64, 1, 3328]
    - [11, 19.783]
  - - [5056, 1856, 1, 3328]
    - [4, 71.561]
  - - [4, 2944, 1, 3328]
    - [15, 4.016]
  - - [4, 5056, 1, 256]
    - [38, 1.631]
  - - [1856, 1408, 1, 256]
    - [8, 49.114]
  - - [8448, 12000, 1, 2816]
    - [4, 77.821]
  - - [6784, 128, 1, 3328]
    - [3, 54.515]
  - - [4288, 1408, 1, 128]
    - [7, 54.812]
  - - [1856, 5888, 1, 3328]
    - [8, 71.745]
  - - [4288, 5056, 1, 256]
    - [4, 65.207]
  - - [1408, 128, 1, 1280]
    - [19, 25.468]
  - - [4096, 800, 1, 1024]
    - [8, 61.73]
  - - [5056, 256, 1, 3328]
    - [10, 54.71]
  - - [704, 704, 1, 256]
    - [34, 22.318]
  - - [1024, 5888, 1, 1280]
    - [4, 67.673]
  - - [6784, 2368, 1, 128]
    - [4, 53.292]
  - - [4, 5056, 1, 1280]
    - [26, 3.896]
  - - [256, 64, 1, 1280]
    - [1, 5.843]
  - - [128, 1856, 1, 1280]
    - [16, 28.555]
  - - [1856, 1024, 1, 1280]
    - [10, 50.317]
  - - [6784, 4288, 1, 1280]
    - [13, 74.272]
  - - [2560, 64, 1, 2560]
    - [5, 32.927]
  - - [1856, 1856, 1, 1280]
    - [7, 62.744]
  - - [4096, 400, 1, 1024]
    - [48, 39.374]
  - - [3072, 24000, 1, 1024]
    - [8, 76.834]
  - - [128, 4288, 1, 3328]
    - [24, 43.826]
  - - [4, 2368, 1, 3328]
    - [15, 4.054]
  - - [5888, 1856, 1, 128]
    - [8, 56.068]
  - - [448, 704, 1, 1280]
    - [0, 33.438]
  - - [128, 5056, 1, 1280]
    - [3, 39.921]
  - - [1024, 448, 1, 3328]
    - [5, 40.725]
  - - [1856, 704, 1, 1280]
    - [3, 53.534]
  - - [5056, 3584, 1, 128]
    - [13, 62.417]
  - - [5888, 5888, 1, 3328]
    - [4, 76.989]
  - - [6784, 1024, 1, 256]
    - [7, 56.252]
  - - [2944, 2368, 1, 256]
    - [8, 61.061]
  - - [256, 448, 1, 256]
    - [19, 8.812]
  - - [5056, 5888, 1, 3328]
    - [4, 75.611]
  - - [1856, 1024, 1, 256]
    - [10, 41.842]
  - - [512, 48000, 1, 1536]
    - [8, 74.864]
  - - [3584, 448, 1, 1280]
    - [20, 50.284]
  - - [8448, 5984, 1, 2816]
    - [4, 77.041]
  - - [1024, 1024, 1, 1280]
    - [44, 43.732]
  - - [448, 5888, 1, 256]
    - [13, 52.034]
  - - [704, 64, 1, 128]
    - [38, 2.264]
  - - [1408, 6784, 1, 3328]
    - [8, 73.114]
  - - [448, 1024, 1, 128]
    - [34, 15.918]
  - - [4288, 704, 1, 128]
    - [10, 41.33]
  - - [128, 1856, 1, 128]
    - [0, 9.905]
  - - [448, 2368, 1, 3328]
    - [17, 46.045]
  - - [5056, 64, 1, 128]
    - [0, 10.357]
  - - [5056, 2944, 1, 256]
    - [4, 61.901]
  - - [6784, 5888, 1, 128]
    - [7, 63.641]
  - - [1024, 700, 1, 512]
    - [10, 36.918]
  - - [704, 1024, 1, 256]
    - [49, 27.439]
  - - [1024, 4, 1, 256]
    - [50, 0.361]
  - - [2944, 704, 1, 128]
    - [3, 36.443]
  - - [128, 6784, 1, 1280]
    - [3, 51.755]
  - - [1408, 3584, 1, 3328]
    - [8, 68.512]
  - - [2368, 6784, 1, 256]
    - [7, 59.446]
  - - [5056, 1408, 1, 1280]
    - [7, 72.526]
  - - [256, 256, 1, 128]
    - [14, 3.345]
  - - [5056, 4288, 1, 128]
    - [7, 60.717]
  - - [1408, 1856, 1, 128]
    - [7, 41.834]
  - - [1408, 5888, 1, 3328]
    - [4, 69.507]
  - - [1856, 256, 1, 256]
    - [34, 20.276]
  - - [6784, 6784, 1, 256]
    - [13, 69.975]
  - - [64, 256, 1, 128]
    - [38, 0.739]
  - - [4288, 2368, 1, 128]
    - [4, 52.457]
  - - [1024, 1024, 1, 128]
    - [10, 25.629]
  - - [256, 4288, 1, 1280]
    - [10, 46.266]
  - - [2368, 2944, 1, 256]
    - [7, 60.983]
  - - [4, 1856, 1, 256]
    - [32, 0.655]
  - - [3584, 1856, 1, 1280]
    - [8, 66.569]
  - - [6784, 6784, 1, 128]
    - [13, 64.457]
  - - [256, 1856, 1, 128]
    - [48, 14.825]
  - - [704, 64, 1, 1280]
    - [42, 12.375]
  - - [5888, 5056, 1, 256]
    - [4, 68.863]
  - - [8448, 48000, 1, 2816]
    - [4, 78.41]
  - - [3584, 448, 1, 256]
    - [20, 42.91]
  - - [448, 4288, 1, 128]
    - [3, 34.045]
  - - [7680, 64, 1, 2560]
    - [5, 39.388]
  - - [256, 6784, 1, 256]
    - [4, 45.874]
  - - [1408, 4288, 1, 128]
    - [7, 51.576]
  - - [2944, 704, 1, 3328]
    - [4, 55.557]
  - - [128, 448, 1, 256]
    - [51, 4.576]
  - - [5056, 256, 1, 1280]
    - [3, 49.046]
  - - [2560, 32, 1, 2560]
    - [17, 24.696]
  - - [3584, 3584, 1, 256]
    - [7, 66.42]
  - - [448, 1408, 1, 128]
    - [10, 19.061]
  - - [128, 256, 1, 1280]
    - [42, 8.726]
  - - [3584, 5056, 1, 256]
    - [4, 68.617]
  - - [6784, 128, 1, 256]
    - [10, 35.783]
  - - [4288, 4, 1, 256]
    - [14, 1.626]
  - - [704, 448, 1, 256]
    - [0, 16.84]
  - - [2944, 2368, 1, 1280]
    - [4, 70.858]
  - - [448, 64, 1, 3328]
    - [42, 13.014]
  - - [1408, 3584, 1, 256]
    - [8, 56.622]
  - - [3584, 4, 1, 3328]
    - [22, 5.32]
  - - [6784, 3584, 1, 256]
    - [7, 70.108]
  - - [256, 128, 1, 128]
    - [14, 1.796]
  - - [704, 1408, 1, 128]
    - [10, 26.323]
  - - [4, 2368, 1, 256]
    - [38, 0.827]
  - - [4288, 128, 1, 1280]
    - [24, 37.176]
  - - [128, 1408, 1, 256]
    - [19, 13.376]
  - - [4, 2944, 1, 256]
    - [38, 0.995]
  - - [64, 128, 1, 3328]
    - [1, 6.539]
  - - [5056, 2368, 1, 128]
    - [4, 48.641]
  - - [2944, 2944, 1, 3328]
    - [8, 72.298]
  - - [5056, 6784, 1, 256]
    - [4, 67.703]
  - - [1856, 3584, 1, 128]
    - [7, 54.891]
  - - [128, 2944, 1, 128]
    - [34, 13.844]
  - - [35, 8457, 1, 2560]
    - [43, 29.413]
  - - [1024, 704, 1, 3328]
    - [12, 43.48]
  - - [6784, 448, 1, 256]
    - [4, 52.403]
  - - [3584, 6784, 1, 128]
    - [7, 57.37]
  - - [128, 4288, 1, 256]
    - [10, 23.974]
  - - [704, 448, 1, 3328]
    - [24, 38.409]
  - - [1024, 1024, 1, 3328]
    - [18, 49.739]
  - - [128, 128, 1, 3328]
    - [21, 9.799]
  - - [5056, 1856, 1, 256]
    - [4, 62.011]
  - - [4608, 5984, 1, 1536]
    - [4, 76.004]
  - - [256, 128, 1, 256]
    - [14, 3.275]
  - - [1760, 3200, 1, 1760]
    - [13, 63.791]
  - - [1024, 1856, 1, 256]
    - [3, 41.302]
  - - [4096, 1600, 1, 1024]
    - [8, 64.248]
  - - [4288, 64, 1, 128]
    - [0, 10.248]
  - - [256, 448, 1, 3328]
    - [36, 29.285]
  - - [1408, 6784, 1, 1280]
    - [4, 72.356]
  - - [3584, 3584, 1, 1280]
    - [7, 70.486]
  - - [7680, 24000, 1, 2560]
    - [4, 78.256]
  - - [64, 2368, 1, 1280]
    - [19, 22.851]
  - - [448, 2368, 1, 1280]
    - [10, 40.2]
  - - [4608, 48000, 1, 1536]
    - [4, 78.057]
  - - [5888, 5888, 1, 128]
    - [4, 62.493]
  - - [64, 6784, 1, 3328]
    - [52, 42.613]
  - - [2944, 256, 1, 1280]
    - [3, 45.323]
  - - [2048, 16, 1, 2048]
    - [21, 12.392]
  - - [256, 2368, 1, 128]
    - [10, 18.202]
  - - [5056, 2368, 1, 3328]
    - [4, 72.659]
  - - [2944, 4288, 1, 256]
    - [8, 58.235]
  - - [1408, 3584, 1, 1280]
    - [4, 67.623]
  - - [2368, 64, 1, 256]
    - [19, 10.411]
  - - [64, 448, 1, 3328]
    - [42, 14.162]
  - - [704, 128, 1, 3328]
    - [17, 28.012]
  - - [8192, 1600, 1, 2048]
    - [4, 74.104]
  - - [1856, 704, 1, 256]
    - [3, 40.545]
  - - [4, 4288, 1, 1280]
    - [26, 3.39]
  - - [1408, 448, 1, 3328]
    - [18, 46.136]
  - - [1024, 4, 1, 3328]
    - [15, 2.816]
  - - [512, 24000, 1, 2560]
    - [8, 73.633]
  - - [2368, 6784, 1, 3328]
    - [13, 75.337]
  - - [1856, 1408, 1, 1280]
    - [13, 65.293]
  - - [1856, 448, 1, 1280]
    - [3, 49.954]
  - - [6784, 704, 1, 128]
    - [3, 44.184]
  - - [4, 4, 1, 256]
    - [26, 0.001]
  - - [128, 5888, 1, 128]
    - [3, 23.765]
  - - [1408, 5888, 1, 256]
    - [4, 55.876]
  - - [704, 2944, 1, 1280]
    - [10, 50.618]
  - - [4288, 64, 1, 1280]
    - [5, 29.494]
  - - [256, 64, 1, 256]
    - [14, 1.564]
  - - [1024, 1024, 1, 256]
    - [3, 35.802]
  - - [704, 1856, 1, 256]
    - [10, 42.327]
  - - [704, 6784, 1, 128]
    - [7, 46.468]
  - - [3584, 704, 1, 1280]
    - [4, 59.172]
  - - [256, 128, 1, 1280]
    - [6, 9.151]
  - - [5888, 2368, 1, 256]
    - [7, 58.742]
  - - [256, 2368, 1, 1280]
    - [34, 39.396]
  - - [2944, 6784, 1, 128]
    - [13, 56.935]
  - - [3584, 448, 1, 3328]
    - [20, 56.859]
  - - [1408, 4, 1, 256]
    - [47, 0.545]
  - - [704, 2368, 1, 3328]
    - [35, 58.326]
  - - [2944, 448, 1, 256]
    - [3, 40.94]
  - - [1856, 448, 1, 128]
    - [31, 23.539]
  - - [4288, 4, 1, 3328]
    - [22, 6.091]
  - - [2368, 128, 1, 1280]
    - [0, 31.385]
  - - [256, 5888, 1, 128]
    - [13, 33.427]
  - - [64, 6784, 1, 256]
    - [10, 20.872]
  - - [64, 5056, 1, 1280]
    - [0, 32.989]
  - - [4, 6784, 1, 128]
    - [33, 1.075]
  - - [2048, 3200, 1, 512]
    - [7, 59.948]
  - - [2944, 2944, 1, 1280]
    - [28, 68.783]
  - - [5056, 448, 1, 3328]
    - [7, 58.19]
  - - [4, 3584, 1, 1280]
    - [36, 2.999]
  - - [1408, 128, 1, 128]
    - [0, 7.548]
  - - [6784, 704, 1, 3328]
    - [4, 66.604]
  - - [128, 64, 1, 1280]
    - [1, 3.41]
  - - [2368, 256, 1, 1280]
    - [48, 40.978]
  - - [4, 448, 1, 3328]
    - [1, 1.368]
  - - [5888, 4288, 1, 128]
    - [8, 57.473]
  - - [4, 5888, 1, 256]
    - [33, 1.802]
  - - [1408, 2944, 1, 3328]
    - [7, 65.108]
  - - [3584, 704, 1, 128]
    - [8, 41.64]
  - - [4608, 12000, 1, 1536]
    - [4, 76.578]
  - - [64, 1024, 1, 256]
    - [14, 4.616]
  - - [5056, 5056, 1, 128]
    - [7, 54.932]
  - - [2368, 448, 1, 1280]
    - [3, 40.158]
  - - [128, 3584, 1, 256]
    - [34, 19.457]
  - - [704, 448, 1, 1280]
    - [0, 31.831]
  - - [8192, 800, 1, 2048]
    - [4, 65.008]
  - - [448, 5056, 1, 128]
    - [7, 37.502]
  - - [256, 4, 1, 1280]
    - [2, 0.43]
  - - [5056, 3584, 1, 256]
    - [4, 63.886]
  - - [2368, 4, 1, 3328]
    - [22, 4.722]
  - - [1408, 5056, 1, 128]
    - [8, 55.914]
  - - [2944, 3584, 1, 128]
    - [39, 52.695]
  - - [3584, 2368, 1, 256]
    - [8, 57.226]
  - - [128, 3584, 1, 3328]
    - [36, 40.252]
  - - [128, 1024, 1, 1280]
    - [27, 22.011]
  - - [8448, 24000, 1, 2816]
    - [4, 78.396]
  - - [64, 704, 1, 256]
    - [14, 3.62]
  - - [4288, 256, 1, 1280]
    - [3, 42.932]
  - - [3584, 3584, 1, 3328]
    - [4, 72.853]
  - - [1024, 256, 1, 128]
    - [0, 9.745]
  - - [4, 704, 1, 128]
    - [38, 0.131]
  - - [5888, 6784, 1, 256]
    - [4, 68.894]
  - - [4288, 2944, 1, 3328]
    - [4, 71.391]
  - - [2944, 64, 1, 128]
    - [0, 7.538]
  - - [1024, 128, 1, 3328]
    - [36, 32.885]
  - - [1024, 16, 1, 500000]
    - [53, 18.183]
  - - [4288, 128, 1, 3328]
    - [24, 43.884]
  - - [7680, 128, 1, 2560]
    - [12, 45.428]
  - - [256, 5056, 1, 1280]
    - [31, 45.706]
  - - [1408, 256, 1, 128]
    - [54, 10.03]
  - - [2944, 5888, 1, 3328]
    - [4, 74.218]
  - - [6784, 5888, 1, 1280]
    - [4, 76.162]
  - - [2048, 800, 1, 512]
    - [20, 51.402]
  - - [704, 128, 1, 256]
    - [40, 7.458]
  - - [5888, 4288, 1, 1280]
    - [4, 74.035]
  - - [1024, 24000, 1, 2048]
    - [8, 75.251]
  - - [448, 256, 1, 1280]
    - [17, 18.28]
  - - [5888, 3584, 1, 128]
    - [7, 62.447]
  - - [1024, 2944, 1, 128]
    - [10, 39.642]
  - - [5056, 4, 1, 1280]
    - [47, 4.08]
  - - [256, 1408, 1, 1280]
    - [18, 33.271]
  - - [3072, 16, 1, 1024]
    - [21, 8.857]
  - - [704, 3584, 1, 128]
    - [10, 38.126]
  - - [5888, 448, 1, 3328]
    - [4, 68.664]
  - - [2368, 4288, 1, 1280]
    - [7, 70.796]
  - - [4288, 2944, 1, 128]
    - [7, 52.228]
  - - [1024, 6784, 1, 3328]
    - [4, 72.154]
  - - [128, 2368, 1, 256]
    - [0, 15.338]
  - - [6784, 64, 1, 3328]
    - [12, 46.957]
  - - [5056, 2944, 1, 3328]
    - [4, 74.353]
  - - [448, 128, 1, 256]
    - [14, 5.052]
  - - [2944, 3584, 1, 256]
    - [7, 59.663]
  - - [1408, 1408, 1, 3328]
    - [4, 52.862]
  - - [1856, 128, 1, 1280]
    - [16, 29.403]
  - - [3584, 3584, 1, 128]
    - [7, 59.544]
  - - [64, 3584, 1, 256]
    - [0, 14.064]
  - - [1408, 4, 1, 3328]
    - [21, 3.283]
  - - [128, 2944, 1, 3328]
    - [18, 42.193]
  - - [3584, 704, 1, 256]
    - [8, 50.623]
  - - [2944, 448, 1, 3328]
    - [3, 55.101]
  - - [3584, 1408, 1, 3328]
    - [4, 68.339]
  - - [704, 3584, 1, 1280]
    - [7, 58.891]
  - - [2944, 6784, 1, 1280]
    - [4, 73.43]
  - - [1856, 6784, 1, 256]
    - [7, 61.983]
  - - [4288, 448, 1, 3328]
    - [12, 51.701]
  - - [6784, 4288, 1, 128]
    - [7, 58.871]
  - - [6784, 704, 1, 1280]
    - [4, 62.675]
  - - [256, 4288, 1, 256]
    - [3, 35.641]
  - - [3584, 6784, 1, 256]
    - [7, 68.305]
  - - [6144, 12000, 1, 2048]
    - [4, 77.038]
  - - [6144, 16, 1, 2560]
    - [55, 21.443]
  - - [3584, 64, 1, 128]
    - [0, 8.517]
  - - [5888, 1024, 1, 3328]
    - [4, 71.456]
  - - [448, 64, 1, 128]
    - [14, 1.471]
  - - [704, 6784, 1, 1280]
    - [7, 61.562]
  - - [4, 1024, 1, 1280]
    - [25, 1.447]
  - - [5888, 128, 1, 256]
    - [3, 30.922]
  - - [4096, 16, 1, 4096]
    - [21, 20.313]
  - - [1856, 5056, 1, 3328]
    - [4, 71.614]
  - - [4, 6784, 1, 256]
    - [33, 1.882]
  - - [1024, 3584, 1, 128]
    - [7, 42.899]
  - - [1024, 1408, 1, 128]
    - [7, 30.449]
  - - [2368, 2944, 1, 128]
    - [13, 52.231]
  - - [5056, 64, 1, 256]
    - [0, 17.114]
  - - [4, 448, 1, 1280]
    - [1, 0.593]
  - - [5056, 2944, 1, 128]
    - [7, 51.149]
  - - [5888, 5056, 1, 3328]
    - [4, 75.993]
  - - [1024, 704, 1, 128]
    - [10, 22.623]
  - - [5888, 2368, 1, 128]
    - [8, 49.954]
  - - [128, 5056, 1, 3328]
    - [12, 47.293]
  - - [3584, 6784, 1, 1280]
    - [4, 75.053]
  - - [448, 4, 1, 1280]
    - [2, 0.657]
  - - [1856, 5888, 1, 256]
    - [8, 57.526]
  - - [256, 256, 1, 256]
    - [14, 5.013]
  - - [256, 64, 1, 128]
    - [33, 0.858]
  - - [4288, 4288, 1, 3328]
    - [4, 75.138]
  - - [4288, 1408, 1, 1280]
    - [7, 69.721]
  - - [3584, 5056, 1, 128]
    - [4, 60.667]
  - - [4, 1024, 1, 3328]
    - [9, 2.345]
  - - [4288, 2368, 1, 256]
    - [8, 62.726]
  - - [2944, 5056, 1, 1280]
    - [8, 72.587]
  - - [448, 6784, 1, 256]
    - [10, 48.193]
  - - [64, 128, 1, 128]
    - [38, 0.401]
  - - [1856, 2368, 1, 128]
    - [10, 44.577]
  - - [6784, 2368, 1, 3328]
    - [4, 75.658]
  - - [256, 1024, 1, 1280]
    - [16, 30.186]
  - - [704, 4, 1, 128]
    - [38, 0.128]
  - - [256, 4, 1, 256]
    - [23, 0.096]
  - - [4288, 128, 1, 256]
    - [19, 19.991]
  - - [4288, 1856, 1, 3328]
    - [4, 71.663]
  - - [3584, 448, 1, 128]
    - [3, 34.627]
  - - [2048, 1600, 1, 2048]
    - [7, 65.13]
  - - [256, 4, 1, 3328]
    - [2, 0.907]
  - - [4, 1408, 1, 1280]
    - [15, 1.81]
  - - [3584, 64, 1, 1280]
    - [27, 27.311]
  - - [1408, 448, 1, 128]
    - [48, 19.379]
  - - [3584, 1024, 1, 1280]
    - [4, 56.486]
  - - [1856, 5056, 1, 256]
    - [13, 59.016]
  - - [4, 3584, 1, 256]
    - [38, 1.214]
  - - [4, 2944, 1, 1280]
    - [26, 2.848]
  - - [1024, 4288, 1, 256]
    - [8, 56.937]
  - - [5888, 3584, 1, 3328]
    - [4, 75.781]
  - - [1856, 4, 1, 256]
    - [56, 0.612]
  - - [4, 256, 1, 256]
    - [14, 0.096]
  - - [5056, 3584, 1, 3328]
    - [4, 74.18]
  - - [704, 448, 1, 128]
    - [34, 11.338]
  - - [2368, 1408, 1, 1280]
    - [7, 61.983]
  - - [5056, 2944, 1, 1280]
    - [4, 73.566]
  - - [4, 4, 1, 128]
    - [22, 0.001]
  - - [3584, 256, 1, 256]
    - [3, 31.873]
  - - [1024, 6784, 1, 256]
    - [13, 54.756]
  - - [4, 128, 1, 256]
    - [14, 0.048]
  - - [64, 64, 1, 1280]
    - [1, 1.72]
  - - [5124, 9124, 1, 2048]
    - [4, 74.87]
  - - [6784, 4, 1, 128]
    - [14, 1.28]
  - - [2944, 1408, 1, 128]
    - [13, 44.826]
  - - [448, 128, 1, 3328]
    - [17, 21.291]
  - - [3584, 1408, 1, 1280]
    - [8, 65.235]
  - - [64, 4288, 1, 3328]
    - [27, 37.882]
  - - [5056, 6784, 1, 3328]
    - [4, 75.895]
  - - [128, 2944, 1, 256]
    - [34, 18.16]
  - - [128, 6784, 1, 128]
    - [3, 24.116]
  - - [3584, 4288, 1, 256]
    - [8, 61.137]
  - - [448, 1856, 1, 256]
    - [10, 32.224]
  - - [1856, 6784, 1, 3328]
    - [13, 74.977]
  - - [3584, 128, 1, 3328]
    - [36, 40.89]
  - - [64, 1856, 1, 256]
    - [57, 7.773]
  - - [64, 448, 1, 256]
    - [14, 2.836]
  - - [5888, 4288, 1, 256]
    - [4, 70.194]
  - - [4, 448, 1, 128]
    - [14, 0.094]
  - - [5056, 1408, 1, 256]
    - [7, 56.195]
  - - [35, 8457, 1, 2048]
    - [43, 28.799]
  - - [64, 256, 1, 1280]
    - [9, 5.514]
  - - [3584, 1024, 1, 256]
    - [7, 49.429]
  - - [256, 704, 1, 256]
    - [19, 11.199]
  - - [5888, 5888, 1, 256]
    - [13, 69.543]
  - - [4288, 1024, 1, 1280]
    - [7, 63.574]
  - - [5888, 128, 1, 3328]
    - [10, 44.803]
  - - [448, 6784, 1, 3328]
    - [7, 62.316]
  - - [2944, 1408, 1, 1280]
    - [7, 62.554]
  - - [64, 128, 1, 1280]
    - [26, 2.718]
  - - [2944, 1856, 1, 3328]
    - [8, 64.211]
  - - [2368, 64, 1, 128]
    - [19, 6.65]
  - - [256, 1024, 1, 128]
    - [0, 10.324]
  - - [3584, 5888, 1, 1280]
    - [4, 74.232]
  - - [64, 4, 1, 128]
    - [9, 0.012]
  - - [6784, 1856, 1, 1280]
    - [4, 72.533]
  - - [2944, 5056, 1, 256]
    - [8, 62.372]
  - - [4288, 4, 1, 128]
    - [14, 0.817]
  - - [5888, 256, 1, 3328]
    - [35, 56.206]
  - - [2944, 4288, 1, 128]
    - [8, 58.287]
  - - [3584, 1408, 1, 256]
    - [4, 58.673]
  - - [704, 3584, 1, 3328]
    - [13, 64.461]
  - - [4096, 3200, 1, 1024]
    - [7, 70.789]
  - - [5056, 448, 1, 1280]
    - [4, 53.64]
  - - [3584, 1856, 1, 3328]
    - [4, 69.017]
  - - [4288, 6784, 1, 1280]
    - [4, 74.143]
  - - [2560, 7000, 1, 2560]
    - [4, 75.95]
  - - [1408, 704, 1, 1280]
    - [10, 40.335]
  - - [2944, 1024, 1, 256]
    - [8, 48.858]
  - - [6784, 64, 1, 256]
    - [3, 21.215]
  - - [2368, 4288, 1, 3328]
    - [4, 71.121]
  - - [4, 1408, 1, 256]
    - [14, 0.519]
  - - [1024, 1408, 1, 1280]
    - [7, 47.161]
  - - [64, 64, 1, 256]
    - [1, 0.368]
  - - [704, 256, 1, 3328]
    - [36, 35.616]
  - - [6784, 5056, 1, 256]
    - [4, 71.337]
  - - [1856, 1856, 1, 128]
    - [7, 41.376]
  - - [3584, 5056, 1, 3328]
    - [4, 74.081]
  - - [448, 6784, 1, 128]
    - [7, 45.092]
  - - [4, 704, 1, 3328]
    - [15, 2.066]
  - - [35, 8457, 1, 4096]
    - [43, 33.19]
  - - [448, 2944, 1, 256]
    - [10, 42.808]
  - - [4, 4288, 1, 3328]
    - [17, 4.708]
  - - [2944, 6784, 1, 256]
    - [13, 66.019]
  - - [2944, 2944, 1, 128]
    - [7, 54.778]
  - - [4, 4, 1, 1280]
    - [15, 0.006]
  - - [1856, 3584, 1, 1280]
    - [7, 66.301]
  - - [64, 2944, 1, 256]
    - [19, 12.714]
  - - [448, 256, 1, 128]
    - [0, 4.871]
  - - [4288, 448, 1, 128]
    - [10, 34.476]
  - - [4608, 24000, 1, 1536]
    - [4, 77.739]
  - - [1856, 1408, 1, 3328]
    - [4, 68.38]
  - - [128, 128, 1, 128]
    - [38, 0.911]
  - - [1024, 4288, 1, 3328]
    - [4, 69.284]
  - - [448, 2368, 1, 256]
    - [3, 36.062]
  - - [1024, 4, 1, 128]
    - [40, 0.209]
  - - [64, 1408, 1, 1280]
    - [32, 17.707]
  - - [64, 6784, 1, 1280]
    - [3, 38.777]
  - - [5056, 448, 1, 256]
    - [4, 46.064]
  - - [2944, 2368, 1, 3328]
    - [4, 71.522]
  - - [704, 4288, 1, 3328]
    - [7, 60.439]
  - - [1408, 128, 1, 256]
    - [19, 12.439]
  - - [1024, 1856, 1, 1280]
    - [10, 46.958]
  - - [2048, 6400, 1, 2048]
    - [4, 73.196]
  - - [512, 48000, 1, 2816]
    - [8, 75.306]
  - - [5124, 9124, 1, 2560]
    - [4, 74.864]
  - - [128, 2368, 1, 3328]
    - [41, 36.303]
  - - [1024, 5888, 1, 256]
    - [8, 52.628]
  - - [64, 2944, 1, 1280]
    - [19, 27.464]
  - - [5056, 64, 1, 3328]
    - [24, 39.17]
  - - [128, 704, 1, 128]
    - [40, 4.485]
  - - [1408, 2368, 1, 256]
    - [8, 54.244]
  - - [1408, 1408, 1, 256]
    - [8, 43.858]
  - - [4, 64, 1, 128]
    - [14, 0.013]
  - - [64, 1024, 1, 128]
    - [58, 2.726]
  - - [1024, 8, 1, 500000]
    - [22, 11.314]
  - - [2368, 2368, 1, 128]
    - [10, 50.45]
  - - [64, 5888, 1, 128]
    - [34, 14.422]
  - - [5888, 4, 1, 3328]
    - [14, 7.283]
  - - [6784, 1408, 1, 128]
    - [7, 58.803]
  - - [4288, 5888, 1, 256]
    - [7, 67.735]
  - - [1408, 5056, 1, 256]
    - [8, 55.689]
  - - [5056, 128, 1, 3328]
    - [12, 47.146]
  - - [128, 128, 1, 1280]
    - [1, 5.164]
  - - [448, 704, 1, 256]
    - [34, 18.032]
  - - [4288, 3584, 1, 128]
    - [7, 54.485]
  - - [2944, 128, 1, 3328]
    - [12, 41.944]
  - - [64, 1408, 1, 3328]
    - [41, 26.242]
  - - [3584, 5056, 1, 1280]
    - [4, 72.596]
  - - [256, 448, 1, 1280]
    - [6, 19.835]
  - - [704, 704, 1, 128]
    - [0, 14.526]
  - - [5056, 4, 1, 128]
    - [14, 1.103]
  - - [704, 256, 1, 1280]
    - [19, 27.239]
  - - [64, 2368, 1, 3328]
    - [27, 33.364]
  - - [1856, 1024, 1, 128]
    - [3, 29.961]
  - - [1856, 64, 1, 128]
    - [19, 4.711]
  - - [4096, 64, 1, 4096]
    - [27, 36.341]
  - - [1024, 24000, 1, 1536]
    - [4, 74.555]
  - - [704, 4288, 1, 256]
    - [10, 48.267]
  - - [5888, 2368, 1, 1280]
    - [4, 71.743]
  - - [128, 256, 1, 256]
    - [14, 3.189]
  - - [64, 128, 1, 256]
    - [9, 0.803]
  - - [2368, 5888, 1, 1280]
    - [13, 71.915]
  - - [5888, 256, 1, 1280]
    - [20, 46.977]
  - - [1760, 128, 1, 1760]
    - [19, 33.872]
  - - [4, 5888, 1, 1280]
    - [26, 4.28]
  - - [704, 128, 1, 128]
    - [40, 3.612]
  - - [1024, 4, 1, 1280]
    - [21, 1.433]
  - - [2368, 1856, 1, 3328]
    - [4, 60.236]
  - - [2368, 128, 1, 128]
    - [0, 11.422]
  - - [2944, 704, 1, 256]
    - [3, 46.423]
  - - [5056, 128, 1, 128]
    - [10, 20.223]
  - - [2368, 1024, 1, 3328]
    - [13, 62.707]
  - - [256, 704, 1, 3328]
    - [36, 33.807]
  - - [704, 3584, 1, 256]
    - [7, 47.696]
  - - [1024, 1024, 1, 1024]
    - [10, 42.216]
  - - [704, 2944, 1, 3328]
    - [13, 56.185]
  - - [6784, 1024, 1, 128]
    - [7, 52.238]
  - - [256, 448, 1, 128]
    - [40, 5.215]
  - - [448, 1024, 1, 3328]
    - [36, 40.721]
  - - [2944, 1024, 1, 3328]
    - [28, 61.322]
  - - [2944, 5056, 1, 128]
    - [7, 49.352]
  - - [2368, 256, 1, 256]
    - [34, 28.176]
  - - [1408, 6784, 1, 256]
    - [13, 58.419]
  - - [6784, 1408, 1, 3328]
    - [4, 72.714]
  - - [4288, 6784, 1, 128]
    - [7, 65.873]
  - - [704, 64, 1, 256]
    - [14, 3.453]
  - - [5888, 4, 1, 1280]
    - [14, 4.919]
  - - [256, 2368, 1, 3328]
    - [12, 44.44]
  - - [6784, 2944, 1, 1280]
    - [4, 72.659]
  - - [4288, 1856, 1, 128]
    - [8, 52.546]
  - - [1856, 2944, 1, 128]
    - [13, 46.721]
  - - [6784, 448, 1, 128]
    - [3, 44.9]
  - - [64, 3584, 1, 128]
    - [0, 9.767]
  - - [448, 5056, 1, 1280]
    - [13, 53.308]
  - - [2368, 1856, 1, 128]
    - [10, 44.44]
  - - [64, 2944, 1, 3328]
    - [17, 35.967]
  - - [4288, 704, 1, 256]
    - [8, 49.899]
  - - [256, 3584, 1, 128]
    - [3, 22.077]
  - - [5888, 704, 1, 256]
    - [4, 57.168]
  - - [3584, 1024, 1, 128]
    - [44, 44.119]
  - - [256, 5888, 1, 3328]
    - [35, 52.707]
  - - [1408, 4288, 1, 3328]
    - [8, 71.082]
  - - [6784, 4288, 1, 256]
    - [4, 67.996]
  - - [4288, 256, 1, 128]
    - [3, 28.704]
  - - [5888, 256, 1, 256]
    - [8, 43.17]
  - - [6784, 1024, 1, 1280]
    - [7, 68.828]
  - - [5888, 1024, 1, 128]
    - [7, 51.055]
  - - [1024, 128, 1, 256]
    - [19, 10.274]
  - - [512, 16, 1, 500000]
    - [53, 15.51]
  - - [128, 64, 1, 3328]
    - [23, 6.64]
  - - [448, 64, 1, 256]
    - [14, 2.686]
  - - [2368, 256, 1, 128]
    - [10, 20.066]
  - - [6784, 3584, 1, 1280]
    - [4, 75.635]
  - - [1024, 6784, 1, 1280]
    - [8, 68.961]
  - - [2944, 64, 1, 1280]
    - [19, 26.64]
  - - [1408, 2944, 1, 1280]
    - [8, 62.582]
  - - [256, 1856, 1, 256]
    - [34, 22.796]
  - - [2048, 800, 1, 2048]
    - [20, 54.716]
  - - [1408, 2368, 1, 3328]
    - [4, 66.135]
  - - [2944, 4, 1, 3328]
    - [22, 5.323]
  - - [128, 1408, 1, 3328]
    - [29, 34.192]
  - - [2944, 1856, 1, 128]
    - [4, 47.583]
  - - [256, 2944, 1, 128]
    - [3, 24.344]
  - - [256, 6784, 1, 128]
    - [10, 35.15]
  - - [2368, 4, 1, 128]
    - [59, 0.466]
  - - [1408, 256, 1, 3328]
    - [18, 40.55]
  - - [1856, 4, 1, 128]
    - [60, 0.31]
  - - [5056, 6784, 1, 128]
    - [13, 61.012]
  - - [4288, 5056, 1, 128]
    - [13, 58.389]
  - - [1856, 5888, 1, 128]
    - [13, 50.813]
  - - [2944, 5888, 1, 256]
    - [7, 63.75]
  - - [3584, 1856, 1, 256]
    - [4, 61.029]
  - - [4288, 3584, 1, 1280]
    - [4, 72.564]
  - - [2368, 448, 1, 256]
    - [3, 34.532]
  - - [4288, 256, 1, 3328]
    - [18, 50.884]
  - - [1856, 704, 1, 128]
    - [3, 27.481]
  - - [1408, 64, 1, 256]
    - [40, 5.592]
  - - [64, 1856, 1, 128]
    - [19, 5.182]
  - - [4, 256, 1, 128]
    - [25, 0.051]
  - - [2560, 16, 1, 2560]
    - [60, 15.735]
  - - [704, 5888, 1, 128]
    - [13, 47.574]
  - - [6784, 3584, 1, 128]
    - [7, 64.035]
  - - [1024, 64, 1, 256]
    - [25, 4.635]
  - - [64, 2368, 1, 256]
    - [19, 11.986]
  - - [4288, 5056, 1, 3328]
    - [4, 74.376]
  - - [4, 1856, 1, 1280]
    - [26, 2.299]
  - - [4288, 128, 1, 128]
    - [3, 18.217]
  - - [1408, 1408, 1, 128]
    - [31, 37.059]
  - - [7680, 16, 1, 2560]
    - [55, 24.592]
  - - [1856, 128, 1, 128]
    - [0, 10.151]
  - - [5056, 2368, 1, 256]
    - [8, 60.609]
  - - [4288, 704, 1, 3328]
    - [4, 60.22]
  - - [448, 3584, 1, 256]
    - [45, 43.129]
  - - [2368, 64, 1, 1280]
    - [6, 22.795]
  - - [2368, 1024, 1, 1280]
    - [7, 57.398]
  - - [2944, 1408, 1, 3328]
    - [8, 65.779]
  - - [1408, 448, 1, 256]
    - [34, 28.221]
  - - [1024, 1408, 1, 3328]
    - [20, 53.961]
  - - [2944, 5888, 1, 1280]
    - [8, 73.28]
  - - [1408, 4, 1, 1280]
    - [15, 1.999]
  - - [5888, 3584, 1, 256]
    - [13, 67.313]
  - - [2368, 5056, 1, 128]
    - [13, 56.257]
  - - [1408, 1856, 1, 3328]
    - [8, 68.885]
  - - [4, 4, 1, 3328]
    - [2, 0.015]
  - - [6784, 1408, 1, 1280]
    - [4, 72.37]
  - - [4096, 7000, 1, 4096]
    - [4, 77.024]
  - - [704, 2944, 1, 256]
    - [3, 44.727]
  - - [4288, 64, 1, 256]
    - [0, 17.62]
  - - [6784, 5888, 1, 3328]
    - [4, 76.765]
  - - [2368, 4288, 1, 128]
    - [8, 47.726]
  - - [64, 4288, 1, 1280]
    - [27, 31.436]
  - - [6784, 64, 1, 1280]
    - [3, 38.161]
  - - [3584, 128, 1, 128]
    - [10, 11.806]
  - - [1024, 6784, 1, 128]
    - [28, 54.175]
  - - [4, 1856, 1, 128]
    - [14, 0.355]
  - - [1408, 64, 1, 3328]
    - [17, 26.948]
  - - [6784, 4, 1, 256]
    - [14, 2.425]
  - - [1408, 1408, 1, 1280]
    - [4, 52.584]
  - - [16384, 400, 1, 4096]
    - [4, 61.752]
  - - [256, 2368, 1, 256]
    - [34, 26.745]
  - - [448, 4288, 1, 3328]
    - [3, 51.601]
  - - [2368, 1408, 1, 256]
    - [7, 52.454]
  - - [5888, 5056, 1, 128]
    - [8, 62.574]
  - - [704, 2368, 1, 256]
    - [7, 41.244]
  - - [1024, 24000, 1, 2560]
    - [4, 75.535]
  - - [2944, 448, 1, 1280]
    - [31, 48.488]
  - - [5888, 2368, 1, 3328]
    - [4, 73.913]
  - - [5124, 9124, 1, 1760]
    - [4, 74.802]
  - - [448, 1408, 1, 1280]
    - [3, 40.006]
  - - [448, 1856, 1, 1280]
    - [3, 50.708]
  - - [4288, 448, 1, 1280]
    - [3, 49.318]
  - - [5888, 704, 1, 3328]
    - [4, 67.0]
  - - [5056, 256, 1, 128]
    - [10, 32.269]
  - - [1856, 256, 1, 128]
    - [34, 16.142]
  - - [64, 1408, 1, 128]
    - [40, 4.363]
  - - [704, 4, 1, 256]
    - [26, 0.272]
  - - [1408, 5888, 1, 128]
    - [13, 56.335]
  - - [7680, 12000, 1, 2560]
    - [4, 77.675]
  - - [1408, 1024, 1, 256]
    - [7, 41.296]
  - - [8192, 400, 1, 2048]
    - [4, 52.288]
  - - [1024, 1856, 1, 128]
    - [10, 36.211]
  - - [256, 704, 1, 128]
    - [0, 8.007]
  - - [2560, 128, 1, 2560]
    - [24, 39.89]
  - - [448, 1024, 1, 256]
    - [10, 19.871]
  - - [128, 4, 1, 3328]
    - [2, 0.409]
  - - [5056, 6784, 1, 1280]
    - [13, 74.732]
  - - [1408, 64, 1, 128]
    - [38, 3.416]
  - - [1024, 448, 1, 1280]
    - [16, 34.467]
  - - [704, 5056, 1, 3328]
    - [7, 68.649]
  - - [128, 5056, 1, 256]
    - [10, 27.062]
  - - [64, 1024, 1, 3328]
    - [17, 22.718]
  - - [1856, 4, 1, 3328]
    - [22, 4.177]
  - - [4, 2944, 1, 128]
    - [38, 0.591]
  - - [2368, 2944, 1, 3328]
    - [8, 71.598]
  - - [448, 448, 1, 1280]
    - [19, 29.932]
  - - [2368, 3584, 1, 256]
    - [13, 62.426]
  - - [1024, 256, 1, 1280]
    - [0, 28.08]
  - - [5056, 3584, 1, 1280]
    - [13, 72.582]
  - - [5124, 9124, 1, 4096]
    - [4, 75.291]
  - - [7680, 48000, 1, 2560]
    - [4, 78.431]
  - - [448, 4, 1, 3328]
    - [23, 1.49]
  - - [1856, 2944, 1, 1280]
    - [8, 62.094]
  - - [1024, 48000, 1, 2816]
    - [8, 77.498]
  - - [128, 1024, 1, 256]
    - [19, 10.318]
  - - [2944, 1408, 1, 256]
    - [8, 54.204]
  - - [4288, 1408, 1, 3328]
    - [13, 69.561]
  - - [3584, 64, 1, 3328]
    - [36, 36.159]
  - - [5888, 2944, 1, 128]
    - [7, 53.458]
  - - [2944, 1024, 1, 128]
    - [7, 43.952]
  - - [4288, 5056, 1, 1280]
    - [4, 73.973]
  - - [5888, 6784, 1, 1280]
    - [4, 76.149]
  - - [6784, 5056, 1, 128]
    - [8, 61.517]
  - - [256, 1024, 1, 3328]
    - [27, 36.953]
  - - [3584, 4, 1, 256]
    - [14, 1.164]
  - - [1760, 1600, 1, 1760]
    - [8, 55.038]
  - - [1856, 64, 1, 3328]
    - [36, 30.469]
  - - [4, 128, 1, 3328]
    - [2, 0.469]
  - - [5888, 1408, 1, 3328]
    - [4, 69.819]
  - - [448, 2944, 1, 128]
    - [10, 29.978]
  - - [2368, 1856, 1, 256]
    - [3, 52.098]
  - - [256, 5056, 1, 256]
    - [3, 41.542]
  - - [128, 3584, 1, 128]
    - [34, 15.047]
  - - [448, 3584, 1, 3328]
    - [35, 57.169]
  - - [4, 5056, 1, 3328]
    - [17, 4.801]
  - - [704, 2368, 1, 128]
    - [31, 31.486]
  - - [5888, 256, 1, 128]
    - [10, 31.133]
  - - [4, 5056, 1, 128]
    - [38, 0.782]
  - - [448, 256, 1, 256]
    - [40, 8.948]
  - - [704, 4, 1, 3328]
    - [23, 2.168]
  - - [1408, 256, 1, 256]
    - [34, 20.185]
  - - [3584, 1856, 1, 128]
    - [8, 50.357]
  - - [4288, 4288, 1, 128]
    - [8, 55.022]
  - - [1856, 1024, 1, 3328]
    - [10, 51.147]
  - - [128, 5888, 1, 3328]
    - [3, 48.336]
  - - [1024, 5056, 1, 256]
    - [8, 58.677]
  - - [5888, 5888, 1, 1280]
    - [4, 75.4]
  - - [5056, 5888, 1, 128]
    - [7, 59.633]
  - - [2368, 1408, 1, 3328]
    - [4, 65.061]
  - - [1024, 48000, 1, 1536]
    - [4, 77.179]
  - - [5888, 448, 1, 256]
    - [8, 56.178]
  - - [2560, 3200, 1, 2560]
    - [4, 69.779]
  - - [5888, 6784, 1, 128]
    - [8, 62.748]
  - - [6144, 48000, 1, 2048]
    - [4, 78.322]
  - - [6784, 5056, 1, 1280]
    - [4, 74.875]
  - - [5056, 704, 1, 1280]
    - [8, 65.016]
  - - [1024, 48000, 1, 2560]
    - [8, 77.264]
  - - [4608, 32, 1, 1536]
    - [27, 25.485]
  - - [1024, 2368, 1, 128]
    - [8, 39.543]
  - - [128, 704, 1, 256]
    - [40, 6.778]
  - - [2368, 448, 1, 3328]
    - [18, 49.711]
  - - [128, 5888, 1, 1280]
    - [10, 44.442]
  - - [16384, 800, 1, 4096]
    - [4, 70.101]
  - - [448, 128, 1, 1280]
    - [11, 13.705]
  - - [6784, 4, 1, 3328]
    - [14, 7.688]
  - - [5888, 5056, 1, 1280]
    - [4, 74.806]
  - - [1024, 64, 1, 3328]
    - [17, 24.246]
  - - [3072, 48000, 1, 1024]
    - [4, 77.576]
  - - [64, 3584, 1, 1280]
    - [27, 27.798]
  - - [6784, 1408, 1, 256]
    - [13, 60.105]
  - - [3584, 5888, 1, 128]
    - [7, 59.51]
  - - [5056, 5888, 1, 256]
    - [7, 68.916]
  - - [2368, 1024, 1, 256]
    - [7, 50.025]
  - - [2944, 1856, 1, 256]
    - [8, 49.9]
  - - [1856, 6784, 1, 1280]
    - [7, 73.226]
  - - [64, 5056, 1, 128]
    - [48, 10.392]
  - - [64, 6784, 1, 128]
    - [10, 16.345]
  - - [448, 704, 1, 128]
    - [34, 13.046]
  - - [4, 1024, 1, 128]
    - [61, 0.181]
  - - [4288, 3584, 1, 256]
    - [7, 62.259]
  - - [1408, 704, 1, 128]
    - [10, 23.714]
  - - [64, 256, 1, 3328]
    - [21, 9.791]
  - - [6784, 448, 1, 3328]
    - [4, 61.135]
  - - [5056, 1856, 1, 1280]
    - [4, 68.33]
  - - [1408, 1024, 1, 3328]
    - [20, 51.943]
  - - [2368, 256, 1, 3328]
    - [18, 44.06]
  - - [5888, 3584, 1, 1280]
    - [4, 73.634]
  - - [1856, 3584, 1, 3328]
    - [8, 69.097]
  - - [5888, 128, 1, 1280]
    - [3, 45.133]
  - - [1024, 2944, 1, 256]
    - [4, 50.28]
  - - [448, 6784, 1, 1280]
    - [7, 57.509]
  - - [256, 3584, 1, 1280]
    - [16, 37.958]
  - - [704, 5056, 1, 256]
    - [7, 51.402]
  - - [3584, 1024, 1, 3328]
    - [4, 59.27]
  - - [2944, 1856, 1, 1280]
    - [4, 62.432]
  - - [128, 256, 1, 128]
    - [38, 1.392]
  - - [5056, 256, 1, 256]
    - [3, 41.29]
  - - [2944, 4288, 1, 3328]
    - [4, 71.685]
  - - [2368, 3584, 1, 3328]
    - [4, 70.64]
  - - [2944, 704, 1, 1280]
    - [4, 50.152]
  - - [128, 4, 1, 256]
    - [23, 0.045]
  - - [2944, 3584, 1, 1280]
    - [4, 70.885]
  - - [1856, 5888, 1, 1280]
    - [4, 69.029]
  - - [256, 256, 1, 1280]
    - [6, 14.147]
  - - [2048, 3200, 1, 2048]
    - [13, 67.035]
  - - [4288, 1408, 1, 256]
    - [13, 51.788]
  - - [3584, 64, 1, 256]
    - [0, 14.818]
  - - [64, 1856, 1, 3328]
    - [17, 30.299]
  - - [256, 1408, 1, 128]
    - [19, 12.609]
  - - [5888, 1408, 1, 128]
    - [8, 53.066]
  - - [4288, 2368, 1, 1280]
    - [4, 69.725]
  - - [4, 4288, 1, 256]
    - [38, 1.518]
  - - [256, 4288, 1, 128]
    - [10, 28.938]
  - - [2048, 128, 1, 2048]
    - [27, 34.633]
  - - [256, 128, 1, 3328]
    - [42, 15.363]
  - - [512, 8, 1, 500000]
    - [22, 9.148]
  - - [6784, 2368, 1, 256]
    - [8, 63.075]
  - - [5888, 128, 1, 128]
    - [3, 23.809]
  - - [1024, 24000, 1, 2816]
    - [8, 75.535]
  - - [7680, 5984, 1, 2560]
    - [4, 76.558]
  - - [4288, 1856, 1, 256]
    - [8, 57.744]
  - - [1856, 256, 1, 3328]
    - [36, 41.156]
  - - [1856, 2944, 1, 256]
    - [7, 49.38]
  - - [5056, 1024, 1, 128]
    - [13, 47.914]
  - - [64, 5888, 1, 1280]
    - [27, 33.116]
  - - [1760, 800, 1, 1760]
    - [35, 46.718]
  - - [6784, 256, 1, 128]
    - [35, 30.987]
  - - [5888, 704, 1, 128]
    - [44, 43.648]
  - - [1408, 2368, 1, 128]
    - [4, 41.857]
  - - [1024, 4288, 1, 1280]
    - [8, 65.529]
  - - [2368, 5056, 1, 3328]
    - [4, 72.426]
  - - [448, 4, 1, 128]
    - [25, 0.083]
  - - [4, 256, 1, 3328]
    - [2, 0.94]
  - - [4288, 1024, 1, 3328]
    - [7, 68.683]
  - - [6144, 48000, 1, 2560]
    - [13, 78.142]
  - - [1024, 5056, 1, 3328]
    - [4, 69.932]
  - - [1024, 1856, 1, 3328]
    - [3, 51.002]
  - - [704, 704, 1, 1280]
    - [24, 34.043]
  - - [128, 2368, 1, 1280]
    - [0, 32.847]
  - - [1408, 128, 1, 3328]
    - [17, 35.957]
  - - [3584, 256, 1, 1280]
    - [27, 38.876]
  - - [4, 128, 1, 128]
    - [2, 0.027]
  - - [5888, 64, 1, 1280]
    - [16, 34.622]
  - - [3584, 128, 1, 1280]
    - [16, 34.802]
  - - [4, 256, 1, 1280]
    - [1, 0.374]
  - - [128, 704, 1, 3328]
    - [36, 26.672]
  - - [4288, 6784, 1, 256]
    - [13, 68.252]
  - - [3584, 2944, 1, 3328]
    - [4, 74.61]
  - - [128, 1856, 1, 256]
    - [0, 13.913]
  - - [64, 4288, 1, 256]
    - [0, 15.815]
  - - [4, 3584, 1, 3328]
    - [36, 4.117]
  - - [64, 4, 1, 3328]
    - [2, 0.24]
  - - [4, 64, 1, 3328]
    - [22, 0.229]
  - - [5888, 2944, 1, 256]
    - [4, 63.555]
  - - [1856, 64, 1, 256]
    - [40, 8.648]
  - - [5056, 128, 1, 1280]
    - [3, 40.704]
  - - [448, 4288, 1, 1280]
    - [3, 47.06]
  - - [448, 1856, 1, 3328]
    - [3, 52.464]
  - - [1024, 4288, 1, 128]
    - [8, 44.765]
  - - [4, 1024, 1, 256]
    - [14, 0.371]
  - - [5056, 4288, 1, 256]
    - [7, 64.723]
  - - [1024, 448, 1, 256]
    - [34, 22.014]
  - - [1024, 3584, 1, 256]
    - [4, 48.526]
  - - [2944, 128, 1, 1280]
    - [16, 32.909]
  - - [2048, 32, 1, 2048]
    - [17, 17.491]
  - - [64, 256, 1, 256]
    - [38, 1.281]
  - - [1408, 4, 1, 128]
    - [47, 0.237]
  - - [128, 2368, 1, 128]
    - [0, 10.625]
  - - [256, 704, 1, 1280]
    - [19, 25.23]
  - - [64, 2368, 1, 128]
    - [19, 7.245]
  - - [6784, 6784, 1, 3328]
    - [4, 76.653]
  - - [448, 5888, 1, 1280]
    - [7, 62.853]
  - - [5056, 448, 1, 128]
    - [3, 38.059]
  - - [4288, 704, 1, 1280]
    - [4, 56.721]
  - - [3584, 2944, 1, 128]
    - [7, 50.251]
  - - [6784, 256, 1, 1280]
    - [20, 54.494]
  - - [256, 2944, 1, 1280]
    - [3, 46.179]
  - - [64, 4288, 1, 128]
    - [0, 10.558]
  - - [2368, 5888, 1, 3328]
    - [8, 73.962]
  - - [4, 64, 1, 256]
    - [1, 0.025]
  - - [704, 1024, 1, 3328]
    - [12, 43.481]
  - - [2368, 1856, 1, 1280]
    - [4, 56.438]
  - - [448, 5056, 1, 3328]
    - [7, 57.801]
  - - [128, 448, 1, 128]
    - [14, 2.896]
  - - [128, 6784, 1, 256]
    - [3, 36.597]
  - - [3584, 4288, 1, 128]
    - [8, 47.96]
  - - [64, 448, 1, 128]
    - [14, 1.549]
  - - [5888, 4288, 1, 3328]
    - [4, 75.199]
  - - [2368, 704, 1, 256]
    - [10, 44.646]
  - - [256, 1856, 1, 3328]
    - [17, 40.834]
  - - [1856, 128, 1, 256]
    - [0, 12.898]
  - - [6784, 128, 1, 128]
    - [44, 24.377]
  - - [3584, 1408, 1, 128]
    - [7, 47.343]
  - - [1856, 5056, 1, 1280]
    - [4, 70.451]
  - - [2944, 1024, 1, 1280]
    - [4, 55.664]
  - - [5056, 4, 1, 256]
    - [14, 1.791]
  - - [3584, 5888, 1, 3328]
    - [4, 75.614]
  - - [2368, 4288, 1, 256]
    - [4, 62.848]
  - - [1024, 2368, 1, 3328]
    - [4, 62.927]
  - - [64, 704, 1, 3328]
    - [11, 18.69]
  - - [704, 1408, 1, 256]
    - [3, 32.726]
  - - [4096, 128, 1, 4096]
    - [29, 44.074]
  - - [1024, 3584, 1, 1280]
    - [4, 56.487]
  - - [4288, 5888, 1, 3328]
    - [4, 74.904]
  - - [4288, 4, 1, 1280]
    - [14, 4.077]
  - - [4608, 16, 1, 1536]
    - [46, 14.525]
  - - [5888, 64, 1, 128]
    - [48, 12.016]
  - - [4, 5888, 1, 128]
    - [33, 1.099]
  - - [1024, 2944, 1, 3328]
    - [4, 60.505]
  - - [6784, 1856, 1, 256]
    - [4, 61.892]
  - - [2048, 64, 1, 2048]
    - [17, 26.49]
  - - [256, 6784, 1, 1280]
    - [35, 54.34]
  - - [1856, 3584, 1, 256]
    - [7, 51.694]
  - - [128, 448, 1, 3328]
    - [17, 20.641]
  - - [6784, 1856, 1, 128]
    - [4, 48.709]
  - - [4, 448, 1, 256]
    - [14, 0.152]
  - - [5056, 128, 1, 256]
    - [34, 27.989]
  - - [512, 24000, 1, 2816]
    - [4, 74.108]
  - - [256, 5888, 1, 1280]
    - [35, 48.102]
  - - [4, 128, 1, 1280]
    - [2, 0.211]
  - - [16384, 1600, 1, 4096]
    - [4, 75.136]
  - - [6784, 128, 1, 1280]
    - [3, 52.418]
  - - [64, 1408, 1, 256]
    - [40, 7.422]
  - - [2368, 1408, 1, 128]
    - [7, 48.014]
  - - [1856, 448, 1, 256]
    - [3, 35.185]
  - - [1408, 1024, 1, 128]
    - [8, 32.582]
  - - [128, 64, 1, 128]
    - [14, 0.43]
  - - [6784, 3584, 1, 3328]
    - [4, 77.139]
  - - [1760, 7000, 1, 1760]
    - [4, 72.803]
  - - [2944, 64, 1, 3328]
    - [36, 36.485]
  - - [64, 64, 1, 128]
    - [14, 0.221]
  - - [2368, 5056, 1, 1280]
    - [7, 70.064]
  - - [64, 4, 1, 1280]
    - [21, 0.101]
  - - [1408, 2368, 1, 1280]
    - [39, 62.682]
  - - [128, 1408, 1, 1280]
    - [19, 26.884]
  - - [256, 64, 1, 3328]
    - [21, 10.61]
  - - [704, 4288, 1, 128]
    - [3, 43.367]
  - - [128, 1856, 1, 3328]
    - [27, 36.269]
  - - [2944, 2944, 1, 256]
    - [8, 57.492]
  - - [2944, 4, 1, 1280]
    - [22, 2.973]
  - - [5888, 4, 1, 256]
    - [14, 1.766]
  - - [6784, 256, 1, 256]
    - [8, 46.115]
  - - [256, 5056, 1, 3328]
    - [3, 55.317]
  - - [128, 4288, 1, 1280]
    - [48, 37.253]
  - - [5056, 1856, 1, 128]
    - [8, 54.848]
  - - [5056, 1024, 1, 3328]
    - [13, 70.623]
  - - [128, 128, 1, 256]
    - [1, 1.383]
  - - [1760, 64, 1, 1760]
    - [19, 24.561]
  - - [4288, 3584, 1, 3328]
    - [4, 73.079]
  - - [448, 704, 1, 3328]
    - [37, 38.958]
  - - [448, 448, 1, 128]
    - [0, 9.258]
  - - [1024, 2368, 1, 1280]
    - [4, 57.825]
  - - [1856, 704, 1, 3328]
    - [10, 54.858]
  - - [4, 2368, 1, 128]
    - [38, 0.443]
  - - [5888, 6784, 1, 3328]
    - [4, 76.735]
  - - [704, 4288, 1, 1280]
    - [7, 56.124]
  - - [704, 256, 1, 256]
    - [0, 11.647]
  - - [1024, 48000, 1, 2048]
    - [4, 77.028]
  - - [4288, 1024, 1, 128]
    - [7, 45.187]
  - - [3136, 2048, 1, 128]
    - [7, 49.008]
  - - [3025, 64, 1, 144]
    - [0, 8.339]
  - - [3025, 256, 1, 64]
    - [3, 14.118]
  - - [196, 256, 1, 2304]
    - [11, 16.201]
  - - [784, 128, 1, 512]
    - [19, 11.13]
  - - [49, 512, 1, 4608]
    - [42, 13.814]
  - - [3025, 64, 1, 256]
    - [19, 13.15]
  - - [50176, 63, 1, 784]
    - [8, 52.457]
  - - [784, 512, 1, 128]
    - [48, 14.51]
  - - [3025, 64, 1, 64]
    - [0, 5.059]
  - - [49, 512, 1, 1024]
    - [11, 6.088]
  - - [196, 256, 1, 576]
    - [14, 7.254]
  - - [784, 512, 1, 32]
    - [48, 5.119]
  - - [784, 128, 1, 128]
    - [19, 4.724]
  - - [50176, 63, 1, 196]
    - [4, 40.485]
- null
