library/src/blas3/Tensile/Logic/asm_full/aldebaran_Cijk_Alik_Bjlk_HSS_BH.yaml
- {MinimumRequiredVersion: 4.23.0}
- aldebaran
- gfx90a
- [Device 0050, Device 0051, Device 0052, Device 0054, Device 0062, Device 7400, Device 740c]
    SolutionIndex: 0
    SolutionNameMin: Cijk_Alik_Bjlk_HSS_BH_MT16x32x8_SE_PGR1_PLR1_TT2_4
    SolutionIndex: 1
    SolutionNameMin: Cijk_Alik_Bjlk_HSS_BH_MT16x16x8_SE_PGR1_PLR1_TT2_2
    SolutionIndex: 2
    SolutionNameMin: Cijk_Alik_Bjlk_HSS_BH_MT16x16x16_SE_PGR1_PLR1_TT2_2
    SolutionIndex: 3
    SolutionNameMin: Cijk_Alik_Bjlk_HSS_BH_MT16x32x16_SE_PGR1_PLR1_TT2_4
    SolutionIndex: 4
    SolutionNameMin: Cijk_Alik_Bjlk_HSS_BH_MT32x32x16_SE_PGR1_PLR1_TT4_4
    SolutionIndex: 5
    SolutionNameMin: Cijk_Alik_Bjlk_HSS_BH_MT16x32x16_SE_PGR1_PLR1_TT2_2
    SolutionIndex: 6
    SolutionNameMin: Cijk_Alik_Bjlk_HSS_BH_MT16x64x16_SE_PGR1_PLR1_TT2_4
    SolutionIndex: 7
    SolutionNameMin: Cijk_Alik_Bjlk_HSS_BH_MT64x64x16_SE_PGR1_PLR1_TT4_4
    SolutionIndex: 8
    SolutionNameMin: Cijk_Alik_Bjlk_HSS_BH_MT64x128x16_SE_PGR1_PLR1_TT4_8
    SolutionIndex: 9
    SolutionNameMin: Cijk_Alik_Bjlk_HSS_BH_MT16x16x16_SE_PGR1_PLR1_TT2_2
    SolutionIndex: 10
    SolutionNameMin: Cijk_Alik_Bjlk_HSS_BH_MT32x32x16_SE_PGR1_PLR1_TT4_4
    SolutionIndex: 11
    SolutionNameMin: Cijk_Alik_Bjlk_HSS_BH_MT16x64x16_SE_PGR1_PLR1_TT2_4
    SolutionIndex: 12
    SolutionNameMin: Cijk_Alik_Bjlk_HSS_BH_MT32x64x16_SE_PGR1_PLR1_TT2_4
    SolutionIndex: 13
    SolutionNameMin: Cijk_Alik_Bjlk_HSS_BH_MT64x64x16_SE_PGR1_PLR1_TT4_4
    SolutionIndex: 14
    SolutionNameMin: Cijk_Alik_Bjlk_HSS_BH_MT64x128x16_SE_PGR1_PLR1_TT4_8
    SolutionIndex: 15
    SolutionNameMin: Cijk_Alik_Bjlk_HSS_BH_MT16x16x24_SE_PGR1_PLR1_TT2_2
    SolutionIndex: 16
    SolutionNameMin: Cijk_Alik_Bjlk_HSS_BH_MT16x32x24_SE_PGR1_PLR1_TT2_4
    SolutionIndex: 17
    SolutionNameMin: Cijk_Alik_Bjlk_HSS_BH_MT32x32x24_SE_PGR1_PLR1_TT4_4
    SolutionIndex: 18
    SolutionNameMin: Cijk_Alik_Bjlk_HSS_BH_MT32x32x24_SE_PGR1_PLR1_TT4_4
    SolutionIndex: 19
    SolutionNameMin: Cijk_Alik_Bjlk_HSS_BH_MT8x64x32_SE_PGR1_PLR1_TT2_2
    SolutionIndex: 20
    SolutionNameMin: Cijk_Alik_Bjlk_HSS_BH_MT16x16x32_SE_PGR1_PLR1_TT2_2
    SolutionIndex: 21
    SolutionNameMin: Cijk_Alik_Bjlk_HSS_BH_MT32x32x32_SE_PGR1_PLR1_TT4_4
    SolutionIndex: 22
    SolutionNameMin: Cijk_Alik_Bjlk_HSS_BH_MT16x64x32_SE_PGR1_PLR1_TT2_4
    SolutionIndex: 23
    SolutionNameMin: Cijk_Alik_Bjlk_HSS_BH_MT16x64x32_SE_PGR1_PLR1_TT2_2
    SolutionIndex: 24
    SolutionNameMin: Cijk_Alik_Bjlk_HSS_BH_MT16x128x32_SE_PGR1_PLR1_TT2_4
    SolutionIndex: 25
    SolutionNameMin: Cijk_Alik_Bjlk_HSS_BH_MT8x64x32_SE_PGR1_PLR1_TT2_2
    SolutionIndex: 26
    SolutionNameMin: Cijk_Alik_Bjlk_HSS_BH_MT16x16x32_SE_PGR1_PLR1_TT2_2
    SolutionIndex: 27
    SolutionNameMin: Cijk_Alik_Bjlk_HSS_BH_MT16x32x32_SE_PGR1_PLR1_TT2_2
    SolutionIndex: 28
    SolutionNameMin: Cijk_Alik_Bjlk_HSS_BH_MT16x64x32_SE_PGR1_PLR1_TT2_2
    SolutionIndex: 29
    SolutionNameMin: Cijk_Alik_Bjlk_HSS_BH_MT16x128x32_SE_PGR1_PLR1_TT2_4
    SolutionIndex: 30
    SolutionNameMin: Cijk_Alik_Bjlk_HSS_BH_MT8x64x64_SE_PGR1_PLR1_TT2_2
    SolutionIndex: 31
    SolutionNameMin: Cijk_Alik_Bjlk_HSS_BH_MT8x64x64_SE_PGR1_PLR1_TT2_2
    SolutionIndex: 32
    SolutionNameMin: Cijk_Alik_Bjlk_HSS_BH_MT16x64x64_SE_PGR1_PLR1_TT2_2
    SolutionIndex: 33
    SolutionNameMin: Cijk_Alik_Bjlk_HSS_BH_MT128x64x16_SE_PGR1_PLR1_TT8_4
    SolutionIndex: 34
    SolutionNameMin: Cijk_Alik_Bjlk_HSS_BH_MT128x64x16_SE_PGR1_PLR1_TT8_4
    SolutionIndex: 35
    SolutionNameMin: Cijk_Alik_Bjlk_HSS_BH_MT64x128x4_SE_PGR0_PLR0_TT4_8
    SolutionIndex: 36
    SolutionNameMin: Cijk_Alik_Bjlk_HSS_BH_MT64x64x4_SE_PGR0_PLR0_TT4_4
    SolutionIndex: 37
    SolutionNameMin: Cijk_Alik_Bjlk_HSS_BH_MT128x128x4_SE_PGR1_PLR0_TT8_8
    SolutionIndex: 38
    SolutionNameMin: Cijk_Alik_Bjlk_HSS_BH_MT64x128x4_SE_PGR1_PLR0_TT4_8
    SolutionIndex: 39
    SolutionNameMin: Cijk_Alik_Bjlk_HSS_BH_MT64x64x4_SE_PGR0_PLR1_TT4_4
    SolutionIndex: 40
    SolutionNameMin: Cijk_Alik_Bjlk_HSS_BH_MT64x64x8_SE_PGR0_PLR0_TT4_4
    SolutionIndex: 41
    SolutionNameMin: Cijk_Alik_Bjlk_HSS_BH_MT64x128x8_SE_PGR1_PLR0_TT4_8
    SolutionIndex: 42
    SolutionNameMin: Cijk_Alik_Bjlk_HSS_BH_MT64x128x8_SE_PGR0_PLR1_TT4_8
    SolutionIndex: 43
    SolutionNameMin: Cijk_Alik_Bjlk_HSS_BH_MT64x64x8_SE_PGR0_PLR1_TT4_4
    SolutionIndex: 44
    SolutionNameMin: Cijk_Alik_Bjlk_HSS_BH_MT64x128x8_SE_PGR1_PLR1_TT4_8
    SolutionIndex: 45
    SolutionNameMin: Cijk_Alik_Bjlk_HSS_BH_MT64x64x16_SE_PGR0_PLR0_TT4_4
    SolutionIndex: 46
    SolutionNameMin: Cijk_Alik_Bjlk_HSS_BH_MT64x64x16_SE_PGR1_PLR0_TT4_4
    SolutionIndex: 47
    SolutionNameMin: Cijk_Alik_Bjlk_HSS_BH_MT64x64x16_SE_PGR0_PLR1_TT4_4
    SolutionIndex: 48
    SolutionNameMin: Cijk_Alik_Bjlk_HSS_BH_MT64x128x16_SE_PGR1_PLR1_TT4_8
    SolutionIndex: 49
    SolutionNameMin: Cijk_Alik_Bjlk_HSS_BH_MT64x64x16_SE_PGR1_PLR1_TT4_4
    SolutionIndex: 50
    SolutionNameMin: Cijk_Alik_Bjlk_HSS_BH_MT128x128x4_SE_PGR0_PLR0_TT8_8
    SolutionIndex: 51
    SolutionNameMin: Cijk_Alik_Bjlk_HSS_BH_MT64x128x4_SE_PGR0_PLR0_TT4_8
    SolutionIndex: 52
    SolutionNameMin: Cijk_Alik_Bjlk_HSS_BH_MT64x64x4_SE_PGR0_PLR0_TT4_4
    SolutionIndex: 53
    SolutionNameMin: Cijk_Alik_Bjlk_HSS_BH_MT64x128x4_SE_PGR1_PLR0_TT4_8
    SolutionIndex: 54
    SolutionNameMin: Cijk_Alik_Bjlk_HSS_BH_MT64x64x4_SE_PGR1_PLR0_TT4_4
    SolutionIndex: 55
    SolutionNameMin: Cijk_Alik_Bjlk_HSS_BH_MT64x128x4_SE_PGR0_PLR1_TT4_8
    SolutionIndex: 56
    SolutionNameMin: Cijk_Alik_Bjlk_HSS_BH_MT64x64x4_SE_PGR0_PLR1_TT4_4
    SolutionIndex: 57
    SolutionNameMin: Cijk_Alik_Bjlk_HSS_BH_MT64x64x4_SE_PGR1_PLR1_TT4_4
    SolutionIndex: 58
    SolutionNameMin: Cijk_Alik_Bjlk_HSS_BH_MT64x128x8_SE_PGR0_PLR0_TT4_8
    SolutionIndex: 59
    SolutionNameMin: Cijk_Alik_Bjlk_HSS_BH_MT64x64x8_SE_PGR0_PLR0_TT4_4
    SolutionIndex: 60
    SolutionNameMin: Cijk_Alik_Bjlk_HSS_BH_MT64x64x8_SE_PGR1_PLR0_TT4_4
    SolutionIndex: 61
    SolutionNameMin: Cijk_Alik_Bjlk_HSS_BH_MT64x128x8_SE_PGR0_PLR1_TT4_8
    SolutionIndex: 62
    SolutionNameMin: Cijk_Alik_Bjlk_HSS_BH_MT64x64x8_SE_PGR0_PLR1_TT4_4
    SolutionIndex: 63
    SolutionNameMin: Cijk_Alik_Bjlk_HSS_BH_MT64x64x8_SE_PGR1_PLR1_TT4_4
    SolutionIndex: 64
    SolutionNameMin: Cijk_Alik_Bjlk_HSS_BH_MT64x64x16_SE_PGR1_PLR0_TT4_4
    SolutionIndex: 65
    SolutionNameMin: Cijk_Alik_Bjlk_HSS_BH_MT64x64x16_SE_PGR1_PLR1_TT4_4
- - - [64, 64, 1, 256, 64, 64, 256, 64]
    - [25, 0.323]
  - - [128, 64, 1, 256, 128, 128, 256, 64]
    - [32, 0.599]
  - - [64, 128, 1, 256, 64, 64, 256, 128]
    - [22, 0.497]
  - - [128, 128, 1, 256, 128, 128, 256, 128]
    - [1, 0.934]
  - - [64, 256, 1, 256, 64, 64, 256, 256]
    - [2, 0.97]
  - - [128, 256, 1, 256, 128, 128, 256, 256]
    - [20, 2.533]
  - - [64, 448, 1, 256, 64, 64, 256, 448]
    - [20, 2.252]
  - - [128, 448, 1, 256, 128, 128, 256, 448]
    - [19, 4.504]
  - - [64, 704, 1, 256, 64, 64, 256, 704]
    - [26, 3.483]
  - - [128, 704, 1, 256, 128, 128, 256, 704]
    - [25, 6.801]
  - - [64, 1024, 1, 256, 64, 64, 256, 1024]
    - [19, 4.944]
  - - [128, 1024, 1, 256, 128, 128, 256, 1024]
    - [19, 9.373]
  - - [64, 1408, 1, 256, 64, 64, 256, 1408]
    - [25, 6.747]
  - - [128, 1408, 1, 256, 128, 128, 256, 1408]
    - [19, 12.515]
  - - [64, 1856, 1, 256, 64, 64, 256, 1856]
    - [23, 8.756]
  - - [128, 1856, 1, 256, 128, 128, 256, 1856]
    - [23, 15.701]
  - - [64, 2368, 1, 256, 64, 64, 256, 2368]
    - [25, 10.448]
  - - [128, 2368, 1, 256, 128, 128, 256, 2368]
    - [5, 16.596]
  - - [64, 2944, 1, 256, 64, 64, 256, 2944]
    - [25, 12.626]
  - - [128, 2944, 1, 256, 128, 128, 256, 2944]
    - [6, 17.965]
  - - [64, 3584, 1, 256, 64, 64, 256, 3584]
    - [19, 15.159]
  - - [128, 3584, 1, 256, 128, 128, 256, 3584]
    - [24, 21.34]
  - - [64, 4288, 1, 256, 64, 64, 256, 4288]
    - [5, 15.291]
  - - [128, 4288, 1, 256, 128, 128, 256, 4288]
    - [6, 22.574]
  - - [64, 5056, 1, 256, 64, 64, 256, 5056]
    - [28, 16.944]
  - - [128, 5056, 1, 256, 128, 128, 256, 5056]
    - [6, 24.709]
  - - [64, 5888, 1, 256, 64, 64, 256, 5888]
    - [6, 17.702]
  - - [128, 5888, 1, 256, 128, 128, 256, 5888]
    - [6, 25.164]
  - - [64, 6784, 1, 256, 64, 64, 256, 6784]
    - [6, 20.496]
  - - [128, 6784, 1, 256, 128, 128, 256, 6784]
    - [0, 27.829]
  - - [64, 64, 1, 1280, 64, 64, 1280, 64]
    - [2, 0.398]
  - - [128, 64, 1, 1280, 128, 128, 1280, 64]
    - [15, 0.77]
  - - [64, 128, 1, 1280, 64, 64, 1280, 128]
    - [15, 0.77]
  - - [128, 128, 1, 1280, 128, 128, 1280, 128]
    - [9, 1.524]
  - - [64, 256, 1, 1280, 64, 64, 1280, 256]
    - [2, 1.566]
  - - [128, 256, 1, 1280, 128, 128, 1280, 256]
    - [26, 3.474]
  - - [64, 448, 1, 1280, 64, 64, 1280, 448]
    - [26, 3.073]
  - - [128, 448, 1, 1280, 128, 128, 1280, 448]
    - [30, 6.244]
  - - [64, 704, 1, 1280, 64, 64, 1280, 704]
    - [15, 4.744]
  - - [128, 704, 1, 1280, 128, 128, 1280, 704]
    - [25, 9.427]
  - - [64, 1024, 1, 1280, 64, 64, 1280, 1024]
    - [25, 6.903]
  - - [128, 1024, 1, 1280, 128, 128, 1280, 1024]
    - [19, 12.817]
  - - [64, 1408, 1, 1280, 64, 64, 1280, 1408]
    - [25, 9.385]
  - - [128, 1408, 1, 1280, 128, 128, 1280, 1408]
    - [19, 17.552]
  - - [64, 1856, 1, 1280, 64, 64, 1280, 1856]
    - [25, 12.32]
  - - [128, 1856, 1, 1280, 128, 128, 1280, 1856]
    - [25, 21.765]
  - - [64, 2368, 1, 1280, 64, 64, 1280, 2368]
    - [19, 14.761]
  - - [128, 2368, 1, 1280, 128, 128, 1280, 2368]
    - [19, 23.499]
  - - [64, 2944, 1, 1280, 64, 64, 1280, 2944]
    - [19, 17.294]
  - - [128, 2944, 1, 1280, 128, 128, 1280, 2944]
    - [6, 23.511]
  - - [64, 3584, 1, 1280, 64, 64, 1280, 3584]
    - [19, 20.777]
  - - [128, 3584, 1, 1280, 128, 128, 1280, 3584]
    - [6, 28.072]
  - - [64, 4288, 1, 1280, 64, 64, 1280, 4288]
    - [25, 21.005]
  - - [128, 4288, 1, 1280, 128, 128, 1280, 4288]
    - [6, 27.77]
  - - [64, 5056, 1, 1280, 64, 64, 1280, 5056]
    - [23, 22.667]
  - - [128, 5056, 1, 1280, 128, 128, 1280, 5056]
    - [6, 31.133]
  - - [64, 5888, 1, 1280, 64, 64, 1280, 5888]
    - [6, 23.478]
  - - [128, 5888, 1, 1280, 128, 128, 1280, 5888]
    - [6, 30.423]
  - - [64, 6784, 1, 1280, 64, 64, 1280, 6784]
    - [29, 26.602]
  - - [128, 6784, 1, 1280, 128, 128, 1280, 6784]
    - [6, 33.205]
  - - [64, 64, 1, 3328, 64, 64, 3328, 64]
    - [20, 0.44]
  - - [128, 64, 1, 3328, 128, 128, 3328, 64]
    - [23, 0.904]
  - - [64, 128, 1, 3328, 64, 64, 3328, 128]
    - [15, 0.886]
  - - [128, 128, 1, 3328, 128, 128, 3328, 128]
    - [15, 1.731]
  - - [64, 256, 1, 3328, 64, 64, 3328, 256]
    - [15, 1.767]
  - - [128, 256, 1, 3328, 128, 128, 3328, 256]
    - [15, 3.71]
  - - [64, 448, 1, 3328, 64, 64, 3328, 448]
    - [26, 3.285]
  - - [128, 448, 1, 3328, 128, 128, 3328, 448]
    - [30, 6.708]
  - - [64, 704, 1, 3328, 64, 64, 3328, 704]
    - [15, 5.094]
  - - [128, 704, 1, 3328, 128, 128, 3328, 704]
    - [25, 10.068]
  - - [64, 1024, 1, 3328, 64, 64, 3328, 1024]
    - [30, 7.376]
  - - [128, 1024, 1, 3328, 128, 128, 3328, 1024]
    - [19, 13.758]
  - - [64, 1408, 1, 3328, 64, 64, 3328, 1408]
    - [30, 10.077]
  - - [128, 1408, 1, 3328, 128, 128, 3328, 1408]
    - [19, 18.711]
  - - [64, 1856, 1, 3328, 64, 64, 3328, 1856]
    - [25, 13.236]
  - - [128, 1856, 1, 3328, 128, 128, 3328, 1856]
    - [25, 23.05]
  - - [64, 2368, 1, 3328, 64, 64, 3328, 2368]
    - [19, 15.812]
  - - [128, 2368, 1, 3328, 128, 128, 3328, 2368]
    - [25, 25.056]
  - - [64, 2944, 1, 3328, 64, 64, 3328, 2944]
    - [25, 18.54]
  - - [128, 2944, 1, 3328, 128, 128, 3328, 2944]
    - [16, 24.97]
  - - [64, 3584, 1, 3328, 64, 64, 3328, 3584]
    - [25, 22.343]
  - - [128, 3584, 1, 3328, 128, 128, 3328, 3584]
    - [16, 29.812]
  - - [64, 4288, 1, 3328, 64, 64, 3328, 4288]
    - [25, 22.733]
  - - [128, 4288, 1, 3328, 128, 128, 3328, 4288]
    - [6, 28.985]
  - - [64, 5056, 1, 3328, 64, 64, 3328, 5056]
    - [28, 24.08]
  - - [128, 5056, 1, 3328, 128, 128, 3328, 5056]
    - [6, 32.39]
  - - [64, 5888, 1, 3328, 64, 64, 3328, 5888]
    - [16, 24.904]
  - - [128, 5888, 1, 3328, 128, 128, 3328, 5888]
    - [6, 31.39]
  - - [64, 6784, 1, 3328, 64, 64, 3328, 6784]
    - [16, 28.318]
  - - [128, 6784, 1, 3328, 128, 128, 3328, 6784]
    - [6, 34.66]
  - - [256, 64, 1, 256, 256, 256, 256, 64]
    - [2, 0.964]
  - - [448, 64, 1, 256, 448, 448, 256, 64]
    - [20, 2.234]
  - - [704, 64, 1, 256, 704, 704, 256, 64]
    - [20, 3.426]
  - - [1024, 64, 1, 256, 1024, 1024, 256, 64]
    - [25, 4.944]
  - - [1408, 64, 1, 256, 1408, 1408, 256, 64]
    - [25, 6.693]
  - - [1856, 64, 1, 256, 1856, 1856, 256, 64]
    - [25, 8.825]
  - - [2368, 64, 1, 256, 2368, 2368, 256, 64]
    - [19, 10.838]
  - - [2944, 64, 1, 256, 2944, 2944, 256, 64]
    - [25, 12.898]
  - - [3584, 64, 1, 256, 3584, 3584, 256, 64]
    - [25, 15.479]
  - - [4288, 64, 1, 256, 4288, 4288, 256, 64]
    - [19, 15.381]
  - - [5056, 64, 1, 256, 5056, 5056, 256, 64]
    - [28, 17.037]
  - - [5888, 64, 1, 256, 5888, 5888, 256, 64]
    - [3, 17.195]
  - - [6784, 64, 1, 256, 6784, 6784, 256, 64]
    - [6, 19.813]
  - - [256, 128, 1, 256, 256, 256, 256, 128]
    - [20, 2.554]
  - - [448, 128, 1, 256, 448, 448, 256, 128]
    - [27, 4.504]
  - - [704, 128, 1, 256, 704, 704, 256, 128]
    - [25, 6.855]
  - - [1024, 128, 1, 256, 1024, 1024, 256, 128]
    - [19, 9.373]
  - - [1408, 128, 1, 256, 1408, 1408, 256, 128]
    - [25, 12.889]
  - - [1856, 128, 1, 256, 1856, 1856, 256, 128]
    - [25, 16.261]
  - - [2368, 128, 1, 256, 2368, 2368, 256, 128]
    - [19, 16.887]
  - - [2944, 128, 1, 256, 2944, 2944, 256, 128]
    - [6, 17.878]
  - - [3584, 128, 1, 256, 3584, 3584, 256, 128]
    - [6, 21.238]
  - - [4288, 128, 1, 256, 4288, 4288, 256, 128]
    - [6, 21.915]
  - - [5056, 128, 1, 256, 5056, 5056, 256, 128]
    - [6, 24.808]
  - - [5888, 128, 1, 256, 5888, 5888, 256, 128]
    - [6, 24.991]
  - - [6784, 128, 1, 256, 6784, 6784, 256, 128]
    - [11, 27.554]
  - - [256, 64, 1, 1280, 256, 256, 1280, 64]
    - [2, 1.566]
  - - [448, 64, 1, 1280, 448, 448, 1280, 64]
    - [26, 3.093]
  - - [704, 64, 1, 1280, 704, 704, 1280, 64]
    - [26, 4.735]
  - - [1024, 64, 1, 1280, 1024, 1024, 1280, 64]
    - [31, 6.918]
  - - [1408, 64, 1, 1280, 1408, 1408, 1280, 64]
    - [30, 9.448]
  - - [1856, 64, 1, 1280, 1856, 1856, 1280, 64]
    - [30, 12.401]
  - - [2368, 64, 1, 1280, 2368, 2368, 1280, 64]
    - [19, 14.94]
  - - [2944, 64, 1, 1280, 2944, 2944, 1280, 64]
    - [25, 17.669]
  - - [3584, 64, 1, 1280, 3584, 3584, 1280, 64]
    - [25, 21.217]
  - - [4288, 64, 1, 1280, 4288, 4288, 1280, 64]
    - [25, 21.451]
  - - [5056, 64, 1, 1280, 5056, 5056, 1280, 64]
    - [28, 22.768]
  - - [5888, 64, 1, 1280, 5888, 5888, 1280, 64]
    - [3, 23.269]
  - - [6784, 64, 1, 1280, 6784, 6784, 1280, 64]
    - [16, 26.5]
  - - [256, 128, 1, 1280, 256, 256, 1280, 128]
    - [26, 3.474]
  - - [448, 128, 1, 1280, 448, 448, 1280, 128]
    - [30, 6.274]
  - - [704, 128, 1, 1280, 704, 704, 1280, 128]
    - [30, 9.448]
  - - [1024, 128, 1, 1280, 1024, 1024, 1280, 128]
    - [19, 12.868]
  - - [1408, 128, 1, 1280, 1408, 1408, 1280, 128]
    - [19, 17.624]
  - - [1856, 128, 1, 1280, 1856, 1856, 1280, 128]
    - [19, 21.933]
  - - [2368, 128, 1, 1280, 2368, 2368, 1280, 128]
    - [25, 23.652]
  - - [2944, 128, 1, 1280, 2944, 2944, 1280, 128]
    - [6, 23.541]
  - - [3584, 128, 1, 1280, 3584, 3584, 1280, 128]
    - [16, 28.473]
  - - [4288, 128, 1, 1280, 4288, 4288, 1280, 128]
    - [6, 27.566]
  - - [5056, 128, 1, 1280, 5056, 5056, 1280, 128]
    - [11, 30.135]
  - - [5888, 128, 1, 1280, 5888, 5888, 1280, 128]
    - [6, 30.372]
  - - [6784, 128, 1, 1280, 6784, 6784, 1280, 128]
    - [6, 32.995]
  - - [256, 64, 1, 3328, 256, 256, 3328, 64]
    - [15, 1.764]
  - - [448, 64, 1, 3328, 448, 448, 3328, 64]
    - [26, 3.282]
  - - [704, 64, 1, 3328, 704, 704, 3328, 64]
    - [15, 5.088]
  - - [1024, 64, 1, 3328, 1024, 1024, 3328, 64]
    - [30, 7.415]
  - - [1408, 64, 1, 3328, 1408, 1408, 3328, 64]
    - [30, 10.113]
  - - [1856, 64, 1, 3328, 1856, 1856, 3328, 64]
    - [25, 13.296]
  - - [2368, 64, 1, 3328, 2368, 2368, 3328, 64]
    - [19, 15.827]
  - - [2944, 64, 1, 3328, 2944, 2944, 3328, 64]
    - [19, 18.717]
  - - [3584, 64, 1, 3328, 3584, 3584, 3328, 64]
    - [25, 22.484]
  - - [4288, 64, 1, 3328, 4288, 4288, 3328, 64]
    - [25, 22.583]
  - - [5056, 64, 1, 3328, 5056, 5056, 3328, 64]
    - [28, 23.894]
  - - [5888, 64, 1, 3328, 5888, 5888, 3328, 64]
    - [16, 24.682]
  - - [6784, 64, 1, 3328, 6784, 6784, 3328, 64]
    - [6, 27.853]
  - - [256, 128, 1, 3328, 256, 256, 3328, 128]
    - [15, 3.704]
  - - [448, 128, 1, 3328, 448, 448, 3328, 128]
    - [30, 6.708]
  - - [704, 128, 1, 3328, 704, 704, 3328, 128]
    - [30, 10.14]
  - - [1024, 128, 1, 3328, 1024, 1024, 3328, 128]
    - [19, 13.722]
  - - [1408, 128, 1, 3328, 1408, 1408, 3328, 128]
    - [19, 18.804]
  - - [1856, 128, 1, 3328, 1856, 1856, 3328, 128]
    - [25, 23.34]
  - - [2368, 128, 1, 3328, 2368, 2368, 3328, 128]
    - [19, 24.958]
  - - [2944, 128, 1, 3328, 2944, 2944, 3328, 128]
    - [16, 24.814]
  - - [3584, 128, 1, 3328, 3584, 3584, 3328, 128]
    - [24, 29.905]
  - - [4288, 128, 1, 3328, 4288, 4288, 3328, 128]
    - [6, 28.875]
  - - [5056, 128, 1, 3328, 5056, 5056, 3328, 128]
    - [12, 29.456]
  - - [5888, 128, 1, 3328, 5888, 5888, 3328, 128]
    - [6, 31.285]
  - - [6784, 128, 1, 3328, 6784, 6784, 3328, 128]
    - [6, 34.376]
  - - [256, 256, 1, 256, 256, 256, 256, 256]
    - [25, 4.983]
  - - [448, 256, 1, 256, 448, 448, 256, 256]
    - [23, 8.723]
  - - [256, 448, 1, 256, 256, 256, 256, 448]
    - [23, 8.655]
  - - [448, 448, 1, 256, 448, 448, 256, 448]
    - [25, 13.545]
  - - [256, 256, 1, 1280, 256, 256, 1280, 256]
    - [25, 6.903]
  - - [448, 256, 1, 1280, 448, 448, 1280, 256]
    - [25, 12.024]
  - - [256, 448, 1, 1280, 256, 256, 1280, 448]
    - [25, 12.0]
  - - [448, 448, 1, 1280, 448, 448, 1280, 448]
    - [25, 18.636]
  - - [256, 256, 1, 3328, 256, 256, 3328, 256]
    - [30, 7.37]
  - - [448, 256, 1, 3328, 448, 448, 3328, 256]
    - [30, 12.826]
  - - [256, 448, 1, 3328, 256, 256, 3328, 448]
    - [31, 12.838]
  - - [448, 448, 1, 3328, 448, 448, 3328, 448]
    - [25, 19.876]
  - - [704, 256, 1, 256, 704, 704, 256, 256]
    - [10, 8.032]
  - - [1024, 256, 1, 256, 1024, 1024, 256, 256]
    - [10, 11.419]
  - - [1408, 256, 1, 256, 1408, 1408, 256, 256]
    - [21, 14.512]
  - - [1856, 256, 1, 256, 1856, 1856, 256, 256]
    - [10, 18.585]
  - - [2368, 256, 1, 256, 2368, 2368, 256, 256]
    - [13, 18.801]
  - - [2944, 256, 1, 256, 2944, 2944, 256, 256]
    - [13, 23.299]
  - - [3584, 256, 1, 256, 3584, 3584, 256, 256]
    - [10, 27.913]
  - - [4288, 256, 1, 256, 4288, 4288, 256, 256]
    - [13, 27.183]
  - - [5056, 256, 1, 256, 5056, 5056, 256, 256]
    - [13, 32.217]
  - - [5888, 256, 1, 256, 5888, 5888, 256, 256]
    - [13, 29.968]
  - - [6784, 256, 1, 256, 6784, 6784, 256, 256]
    - [13, 34.175]
  - - [704, 448, 1, 256, 704, 704, 256, 448]
    - [10, 12.488]
  - - [1024, 448, 1, 256, 1024, 1024, 256, 448]
    - [13, 17.872]
  - - [1408, 448, 1, 256, 1408, 1408, 256, 448]
    - [13, 19.498]
  - - [1856, 448, 1, 256, 1856, 1856, 256, 448]
    - [13, 25.622]
  - - [2368, 448, 1, 256, 2368, 2368, 256, 448]
    - [7, 26.269]
  - - [2944, 448, 1, 256, 2944, 2944, 256, 448]
    - [13, 32.576]
  - - [3584, 448, 1, 256, 3584, 3584, 256, 448]
    - [13, 31.923]
  - - [4288, 448, 1, 256, 4288, 4288, 256, 448]
    - [13, 37.802]
  - - [5056, 448, 1, 256, 5056, 5056, 256, 448]
    - [13, 35.702]
  - - [5888, 448, 1, 256, 5888, 5888, 256, 448]
    - [13, 36.164]
  - - [6784, 448, 1, 256, 6784, 6784, 256, 448]
    - [13, 36.544]
  - - [256, 704, 1, 256, 256, 256, 256, 704]
    - [4, 7.921]
  - - [448, 704, 1, 256, 448, 448, 256, 704]
    - [4, 12.646]
  - - [704, 704, 1, 256, 704, 704, 256, 704]
    - [13, 15.42]
  - - [1024, 704, 1, 256, 1024, 1024, 256, 704]
    - [13, 22.002]
  - - [1408, 704, 1, 256, 1408, 1408, 256, 704]
    - [7, 24.736]
  - - [1856, 704, 1, 256, 1856, 1856, 256, 704]
    - [7, 32.106]
  - - [2368, 704, 1, 256, 2368, 2368, 256, 704]
    - [13, 33.007]
  - - [2944, 704, 1, 256, 2944, 2944, 256, 704]
    - [13, 32.884]
  - - [3584, 704, 1, 256, 3584, 3584, 256, 704]
    - [13, 34.741]
  - - [4288, 704, 1, 256, 4288, 4288, 256, 704]
    - [13, 36.481]
  - - [5056, 704, 1, 256, 5056, 5056, 256, 704]
    - [13, 38.239]
  - - [5888, 704, 1, 256, 5888, 5888, 256, 704]
    - [13, 39.682]
  - - [6784, 704, 1, 256, 6784, 6784, 256, 704]
    - [13, 41.494]
  - - [256, 1024, 1, 256, 256, 256, 256, 1024]
    - [4, 11.317]
  - - [448, 1024, 1, 256, 448, 448, 256, 1024]
    - [13, 18.241]
  - - [704, 1024, 1, 256, 704, 704, 256, 1024]
    - [13, 22.358]
  - - [1024, 1024, 1, 256, 1024, 1024, 256, 1024]
    - [13, 26.099]
  - - [1408, 1024, 1, 256, 1408, 1408, 256, 1024]
    - [13, 35.337]
  - - [1856, 1024, 1, 256, 1856, 1856, 256, 1024]
    - [13, 37.709]
  - - [2368, 1024, 1, 256, 2368, 2368, 256, 1024]
    - [13, 38.155]
  - - [2944, 1024, 1, 256, 2944, 2944, 256, 1024]
    - [13, 36.385]
  - - [3584, 1024, 1, 256, 3584, 3584, 256, 1024]
    - [13, 39.296]
  - - [4288, 1024, 1, 256, 4288, 4288, 256, 1024]
    - [13, 42.12]
  - - [5056, 1024, 1, 256, 5056, 5056, 256, 1024]
    - [13, 41.554]
  - - [5888, 1024, 1, 256, 5888, 5888, 256, 1024]
    - [13, 41.479]
  - - [6784, 1024, 1, 256, 6784, 6784, 256, 1024]
    - [13, 41.815]
  - - [256, 1408, 1, 256, 256, 256, 256, 1408]
    - [4, 14.216]
  - - [448, 1408, 1, 256, 448, 448, 256, 1408]
    - [13, 19.627]
  - - [704, 1408, 1, 256, 704, 704, 256, 1408]
    - [13, 24.736]
  - - [1024, 1408, 1, 256, 1024, 1024, 256, 1408]
    - [13, 35.068]
  - - [1408, 1408, 1, 256, 1408, 1408, 256, 1408]
    - [7, 31.717]
  - - [1856, 1408, 1, 256, 1856, 1856, 256, 1408]
    - [13, 35.93]
  - - [2368, 1408, 1, 256, 2368, 2368, 256, 1408]
    - [13, 39.94]
  - - [2944, 1408, 1, 256, 2944, 2944, 256, 1408]
    - [13, 39.802]
  - - [3584, 1408, 1, 256, 3584, 3584, 256, 1408]
    - [7, 40.467]
  - - [4288, 1408, 1, 256, 4288, 4288, 256, 1408]
    - [7, 41.593]
  - - [5056, 1408, 1, 256, 5056, 5056, 256, 1408]
    - [7, 42.851]
  - - [5888, 1408, 1, 256, 5888, 5888, 256, 1408]
    - [13, 44.285]
  - - [6784, 1408, 1, 256, 6784, 6784, 256, 1408]
    - [13, 43.923]
  - - [256, 1856, 1, 256, 256, 256, 256, 1856]
    - [10, 18.435]
  - - [448, 1856, 1, 256, 448, 448, 256, 1856]
    - [13, 25.703]
  - - [704, 1856, 1, 256, 704, 704, 256, 1856]
    - [13, 32.19]
  - - [1024, 1856, 1, 256, 1024, 1024, 256, 1856]
    - [13, 37.17]
  - - [1408, 1856, 1, 256, 1408, 1408, 256, 1856]
    - [13, 36.032]
  - - [1856, 1856, 1, 256, 1856, 1856, 256, 1856]
    - [13, 37.257]
  - - [2368, 1856, 1, 256, 2368, 2368, 256, 1856]
    - [13, 42.033]
  - - [2944, 1856, 1, 256, 2944, 2944, 256, 1856]
    - [13, 40.686]
  - - [3584, 1856, 1, 256, 3584, 3584, 256, 1856]
    - [13, 42.752]
  - - [4288, 1856, 1, 256, 4288, 4288, 256, 1856]
    - [7, 42.629]
  - - [5056, 1856, 1, 256, 5056, 5056, 256, 1856]
    - [13, 43.069]
  - - [5888, 1856, 1, 256, 5888, 5888, 256, 1856]
    - [7, 43.854]
  - - [6784, 1856, 1, 256, 6784, 6784, 256, 1856]
    - [13, 45.007]
  - - [256, 2368, 1, 256, 256, 256, 256, 2368]
    - [13, 18.501]
  - - [448, 2368, 1, 256, 448, 448, 256, 2368]
    - [7, 26.269]
  - - [704, 2368, 1, 256, 704, 704, 256, 2368]
    - [13, 33.145]
  - - [1024, 2368, 1, 256, 1024, 1024, 256, 2368]
    - [7, 38.092]
  - - [1408, 2368, 1, 256, 1408, 1408, 256, 2368]
    - [7, 39.94]
  - - [1856, 2368, 1, 256, 1856, 1856, 256, 2368]
    - [13, 42.159]
  - - [2368, 2368, 1, 256, 2368, 2368, 256, 2368]
    - [13, 41.623]
  - - [2944, 2368, 1, 256, 2944, 2944, 256, 2368]
    - [13, 41.991]
  - - [3584, 2368, 1, 256, 3584, 3584, 256, 2368]
    - [13, 43.078]
  - - [4288, 2368, 1, 256, 4288, 4288, 256, 2368]
    - [13, 44.411]
  - - [5056, 2368, 1, 256, 5056, 5056, 256, 2368]
    - [13, 44.453]
  - - [5888, 2368, 1, 256, 5888, 5888, 256, 2368]
    - [13, 44.761]
  - - [6784, 2368, 1, 256, 6784, 6784, 256, 2368]
    - [13, 45.465]
  - - [256, 2944, 1, 256, 256, 256, 256, 2944]
    - [10, 22.783]
  - - [448, 2944, 1, 256, 448, 448, 256, 2944]
    - [13, 32.079]
  - - [704, 2944, 1, 256, 704, 704, 256, 2944]
    - [7, 32.938]
  - - [1024, 2944, 1, 256, 1024, 1024, 256, 2944]
    - [13, 36.568]
  - - [1408, 2944, 1, 256, 1408, 1408, 256, 2944]
    - [7, 39.802]
  - - [1856, 2944, 1, 256, 1856, 1856, 256, 2944]
    - [13, 40.653]
  - - [2368, 2944, 1, 256, 2368, 2368, 256, 2944]
    - [13, 42.15]
  - - [2944, 2944, 1, 256, 2944, 2944, 256, 2944]
    - [13, 44.016]
  - - [3584, 2944, 1, 256, 3584, 3584, 256, 2944]
    - [13, 44.213]
  - - [4288, 2944, 1, 256, 4288, 4288, 256, 2944]
    - [13, 45.139]
  - - [5056, 2944, 1, 256, 5056, 5056, 256, 2944]
    - [13, 44.8]
  - - [5888, 2944, 1, 256, 5888, 5888, 256, 2944]
    - [13, 45.163]
  - - [6784, 2944, 1, 256, 6784, 6784, 256, 2944]
    - [13, 45.887]
  - - [256, 3584, 1, 256, 256, 256, 256, 3584]
    - [10, 27.389]
  - - [448, 3584, 1, 256, 448, 448, 256, 3584]
    - [13, 31.857]
  - - [704, 3584, 1, 256, 704, 704, 256, 3584]
    - [13, 34.541]
  - - [1024, 3584, 1, 256, 1024, 1024, 256, 3584]
    - [13, 39.383]
  - - [1408, 3584, 1, 256, 1408, 1408, 256, 3584]
    - [13, 40.602]
  - - [1856, 3584, 1, 256, 1856, 1856, 256, 3584]
    - [13, 42.668]
  - - [2368, 3584, 1, 256, 2368, 2368, 256, 3584]
    - [13, 43.078]
  - - [2944, 3584, 1, 256, 2944, 2944, 256, 3584]
    - [13, 44.348]
  - - [3584, 3584, 1, 256, 3584, 3584, 256, 3584]
    - [13, 44.327]
  - - [4288, 3584, 1, 256, 4288, 4288, 256, 3584]
    - [7, 44.872]
  - - [5056, 3584, 1, 256, 5056, 5056, 256, 3584]
    - [7, 45.974]
  - - [5888, 3584, 1, 256, 5888, 5888, 256, 3584]
    - [13, 46.211]
  - - [6784, 3584, 1, 256, 6784, 6784, 256, 3584]
    - [14, 46.094]
  - - [256, 4288, 1, 256, 256, 256, 256, 4288]
    - [13, 27.042]
  - - [448, 4288, 1, 256, 448, 448, 256, 4288]
    - [13, 37.493]
  - - [704, 4288, 1, 256, 704, 704, 256, 4288]
    - [13, 36.526]
  - - [1024, 4288, 1, 256, 1024, 1024, 256, 4288]
    - [13, 41.994]
  - - [1408, 4288, 1, 256, 1408, 1408, 256, 4288]
    - [13, 41.653]
  - - [1856, 4288, 1, 256, 1856, 1856, 256, 4288]
    - [13, 42.584]
  - - [2368, 4288, 1, 256, 2368, 2368, 256, 4288]
    - [13, 44.471]
  - - [2944, 4288, 1, 256, 2944, 2944, 256, 4288]
    - [13, 45.055]
  - - [3584, 4288, 1, 256, 3584, 3584, 256, 4288]
    - [13, 44.926]
  - - [4288, 4288, 1, 256, 4288, 4288, 256, 4288]
    - [13, 45.495]
  - - [5056, 4288, 1, 256, 5056, 5056, 256, 4288]
    - [7, 45.45]
  - - [5888, 4288, 1, 256, 5888, 5888, 256, 4288]
    - [13, 45.98]
  - - [6784, 4288, 1, 256, 6784, 6784, 256, 4288]
    - [33, 46.1]
  - - [256, 5056, 1, 256, 256, 256, 256, 5056]
    - [4, 31.321]
  - - [448, 5056, 1, 256, 448, 448, 256, 5056]
    - [13, 35.819]
  - - [704, 5056, 1, 256, 704, 704, 256, 5056]
    - [7, 38.026]
  - - [1024, 5056, 1, 256, 1024, 1024, 256, 5056]
    - [7, 41.587]
  - - [1408, 5056, 1, 256, 1408, 1408, 256, 5056]
    - [13, 42.851]
  - - [1856, 5056, 1, 256, 1856, 1856, 256, 5056]
    - [7, 43.15]
  - - [2368, 5056, 1, 256, 2368, 2368, 256, 5056]
    - [13, 44.384]
  - - [2944, 5056, 1, 256, 2944, 2944, 256, 5056]
    - [13, 44.827]
  - - [3584, 5056, 1, 256, 3584, 3584, 256, 5056]
    - [13, 45.914]
  - - [4288, 5056, 1, 256, 4288, 4288, 256, 5056]
    - [7, 45.441]
  - - [5056, 5056, 1, 256, 5056, 5056, 256, 5056]
    - [7, 45.696]
  - - [5888, 5056, 1, 256, 5888, 5888, 256, 5056]
    - [7, 46.328]
  - - [6784, 5056, 1, 256, 6784, 6784, 256, 5056]
    - [33, 46.624]
  - - [256, 5888, 1, 256, 256, 256, 256, 5888]
    - [13, 30.031]
  - - [448, 5888, 1, 256, 448, 448, 256, 5888]
    - [13, 36.215]
  - - [704, 5888, 1, 256, 704, 704, 256, 5888]
    - [13, 39.883]
  - - [1024, 5888, 1, 256, 1024, 1024, 256, 5888]
    - [13, 41.419]
  - - [1408, 5888, 1, 256, 1408, 1408, 256, 5888]
    - [13, 44.384]
  - - [1856, 5888, 1, 256, 1856, 1856, 256, 5888]
    - [7, 43.836]
  - - [2368, 5888, 1, 256, 2368, 2368, 256, 5888]
    - [13, 44.791]
  - - [2944, 5888, 1, 256, 2944, 2944, 256, 5888]
    - [13, 45.127]
  - - [3584, 5888, 1, 256, 3584, 3584, 256, 5888]
    - [13, 46.148]
  - - [4288, 5888, 1, 256, 4288, 4288, 256, 5888]
    - [13, 45.953]
  - - [5056, 5888, 1, 256, 5056, 5056, 256, 5888]
    - [13, 46.298]
  - - [5888, 5888, 1, 256, 5888, 5888, 256, 5888]
    - [13, 46.399]
  - - [6784, 5888, 1, 256, 6784, 6784, 256, 5888]
    - [14, 46.63]
  - - [256, 6784, 1, 256, 256, 256, 256, 6784]
    - [13, 34.316]
  - - [448, 6784, 1, 256, 448, 448, 256, 6784]
    - [13, 36.775]
  - - [704, 6784, 1, 256, 704, 704, 256, 6784]
    - [13, 41.722]
  - - [1024, 6784, 1, 256, 1024, 1024, 256, 6784]
    - [7, 41.764]
  - - [1408, 6784, 1, 256, 1408, 1408, 256, 6784]
    - [7, 43.734]
  - - [1856, 6784, 1, 256, 1856, 1856, 256, 6784]
    - [13, 44.923]
  - - [2368, 6784, 1, 256, 2368, 2368, 256, 6784]
    - [13, 45.504]
  - - [2944, 6784, 1, 256, 2944, 2944, 256, 6784]
    - [13, 45.896]
  - - [3584, 6784, 1, 256, 3584, 3584, 256, 6784]
    - [8, 46.064]
  - - [4288, 6784, 1, 256, 4288, 4288, 256, 6784]
    - [14, 46.115]
  - - [5056, 6784, 1, 256, 5056, 5056, 256, 6784]
    - [8, 46.696]
  - - [5888, 6784, 1, 256, 5888, 5888, 256, 6784]
    - [8, 46.636]
  - - [6784, 6784, 1, 256, 6784, 6784, 256, 6784]
    - [14, 46.9]
  - - [704, 256, 1, 1280, 704, 704, 1280, 256]
    - [21, 9.562]
  - - [1024, 256, 1, 1280, 1024, 1024, 1280, 256]
    - [10, 13.772]
  - - [1408, 256, 1, 1280, 1408, 1408, 1280, 256]
    - [18, 18.471]
  - - [1856, 256, 1, 1280, 1856, 1856, 1280, 256]
    - [10, 24.374]
  - - [2368, 256, 1, 1280, 2368, 2368, 1280, 256]
    - [4, 22.622]
  - - [2944, 256, 1, 1280, 2944, 2944, 1280, 256]
    - [4, 27.841]
  - - [3584, 256, 1, 1280, 3584, 3584, 1280, 256]
    - [13, 33.609]
  - - [4288, 256, 1, 1280, 4288, 4288, 1280, 256]
    - [4, 31.234]
  - - [5056, 256, 1, 1280, 5056, 5056, 1280, 256]
    - [7, 36.742]
  - - [5888, 256, 1, 1280, 5888, 5888, 1280, 256]
    - [4, 33.609]
  - - [6784, 256, 1, 1280, 6784, 6784, 1280, 256]
    - [7, 38.491]
  - - [704, 448, 1, 1280, 704, 704, 1280, 448]
    - [10, 16.213]
  - - [1024, 448, 1, 1280, 1024, 1024, 1280, 448]
    - [10, 23.26]
  - - [1408, 448, 1, 1280, 1408, 1408, 1280, 448]
    - [4, 23.502]
  - - [1856, 448, 1, 1280, 1856, 1856, 1280, 448]
    - [4, 30.624]
  - - [2368, 448, 1, 1280, 2368, 2368, 1280, 448]
    - [13, 30.402]
  - - [2944, 448, 1, 1280, 2944, 2944, 1280, 448]
    - [13, 37.526]
  - - [3584, 448, 1, 1280, 3584, 3584, 1280, 448]
    - [13, 35.984]
  - - [4288, 448, 1, 1280, 4288, 4288, 1280, 448]
    - [13, 42.614]
  - - [5056, 448, 1, 1280, 5056, 5056, 1280, 448]
    - [7, 39.637]
  - - [5888, 448, 1, 1280, 5888, 5888, 1280, 448]
    - [13, 39.548]
  - - [6784, 448, 1, 1280, 6784, 6784, 1280, 448]
    - [7, 39.754]
  - - [256, 704, 1, 1280, 256, 256, 1280, 704]
    - [21, 9.574]
  - - [448, 704, 1, 1280, 448, 448, 1280, 704]
    - [18, 16.144]
  - - [704, 704, 1, 1280, 704, 704, 1280, 704]
    - [4, 18.537]
  - - [1024, 704, 1, 1280, 1024, 1024, 1280, 704]
    - [4, 26.88]
  - - [1408, 704, 1, 1280, 1408, 1408, 1280, 704]
    - [4, 28.524]
  - - [1856, 704, 1, 1280, 1856, 1856, 1280, 704]
    - [13, 37.332]
  - - [2368, 704, 1, 1280, 2368, 2368, 1280, 704]
    - [13, 37.394]
  - - [2944, 704, 1, 1280, 2944, 2944, 1280, 704]
    - [7, 36.256]
  - - [3584, 704, 1, 1280, 3584, 3584, 1280, 704]
    - [13, 38.113]
  - - [4288, 704, 1, 1280, 4288, 4288, 1280, 704]
    - [13, 39.368]
  - - [5056, 704, 1, 1280, 5056, 5056, 1280, 704]
    - [13, 41.335]
  - - [5888, 704, 1, 1280, 5888, 5888, 1280, 704]
    - [13, 42.656]
  - - [6784, 704, 1, 1280, 6784, 6784, 1280, 704]
    - [13, 44.564]
  - - [256, 1024, 1, 1280, 256, 256, 1280, 1024]
    - [17, 13.802]
  - - [448, 1024, 1, 1280, 448, 448, 1280, 1024]
    - [10, 23.433]
  - - [704, 1024, 1, 1280, 704, 704, 1280, 1024]
    - [10, 26.838]
  - - [1024, 1024, 1, 1280, 1024, 1024, 1280, 1024]
    - [4, 29.995]
  - - [1408, 1024, 1, 1280, 1408, 1408, 1280, 1024]
    - [13, 40.734]
  - - [1856, 1024, 1, 1280, 1856, 1856, 1280, 1024]
    - [13, 42.375]
  - - [2368, 1024, 1, 1280, 2368, 2368, 1280, 1024]
    - [7, 42.405]
  - - [2944, 1024, 1, 1280, 2944, 2944, 1280, 1024]
    - [13, 39.434]
  - - [3584, 1024, 1, 1280, 3584, 3584, 1280, 1024]
    - [13, 42.515]
  - - [4288, 1024, 1, 1280, 4288, 4288, 1280, 1024]
    - [7, 45.139]
  - - [5056, 1024, 1, 1280, 5056, 5056, 1280, 1024]
    - [7, 44.126]
  - - [5888, 1024, 1, 1280, 5888, 5888, 1280, 1024]
    - [13, 43.839]
  - - [6784, 1024, 1, 1280, 6784, 6784, 1280, 1024]
    - [13, 43.995]
  - - [256, 1408, 1, 1280, 256, 256, 1280, 1408]
    - [10, 18.453]
  - - [448, 1408, 1, 1280, 448, 448, 1280, 1408]
    - [10, 23.376]
  - - [704, 1408, 1, 1280, 704, 704, 1280, 1408]
    - [13, 28.542]
  - - [1024, 1408, 1, 1280, 1024, 1024, 1280, 1408]
    - [13, 40.901]
  - - [1408, 1408, 1, 1280, 1408, 1408, 1280, 1408]
    - [7, 34.834]
  - - [1856, 1408, 1, 1280, 1856, 1856, 1280, 1408]
    - [13, 39.227]
  - - [2368, 1408, 1, 1280, 2368, 2368, 1280, 1408]
    - [13, 43.602]
  - - [2944, 1408, 1, 1280, 2944, 2944, 1280, 1408]
    - [7, 42.668]
  - - [3584, 1408, 1, 1280, 3584, 3584, 1280, 1408]
    - [13, 43.129]
  - - [4288, 1408, 1, 1280, 4288, 4288, 1280, 1408]
    - [13, 43.824]
  - - [5056, 1408, 1, 1280, 5056, 5056, 1280, 1408]
    - [13, 45.148]
  - - [5888, 1408, 1, 1280, 5888, 5888, 1280, 1408]
    - [13, 46.513]
  - - [6784, 1408, 1, 1280, 6784, 6784, 1280, 1408]
    - [7, 45.786]
  - - [256, 1856, 1, 1280, 256, 256, 1280, 1856]
    - [10, 24.218]
  - - [448, 1856, 1, 1280, 448, 448, 1280, 1856]
    - [4, 30.483]
  - - [704, 1856, 1, 1280, 704, 704, 1280, 1856]
    - [13, 37.2]
  - - [1024, 1856, 1, 1280, 1024, 1024, 1280, 1856]
    - [13, 42.357]
  - - [1408, 1856, 1, 1280, 1408, 1408, 1280, 1856]
    - [13, 39.251]
  - - [1856, 1856, 1, 1280, 1856, 1856, 1280, 1856]
    - [13, 39.937]
  - - [2368, 1856, 1, 1280, 2368, 2368, 1280, 1856]
    - [7, 45.199]
  - - [2944, 1856, 1, 1280, 2944, 2944, 1280, 1856]
    - [13, 43.045]
  - - [3584, 1856, 1, 1280, 3584, 3584, 1280, 1856]
    - [13, 45.196]
  - - [4288, 1856, 1, 1280, 4288, 4288, 1280, 1856]
    - [7, 44.752]
  - - [5056, 1856, 1, 1280, 5056, 5056, 1280, 1856]
    - [13, 45.118]
  - - [5888, 1856, 1, 1280, 5888, 5888, 1280, 1856]
    - [13, 45.83]
  - - [6784, 1856, 1, 1280, 6784, 6784, 1280, 1856]
    - [13, 46.735]
  - - [256, 2368, 1, 1280, 256, 256, 1280, 2368]
    - [4, 22.568]
  - - [448, 2368, 1, 1280, 448, 448, 1280, 2368]
    - [13, 30.348]
  - - [704, 2368, 1, 1280, 704, 704, 1280, 2368]
    - [13, 37.29]
  - - [1024, 2368, 1, 1280, 1024, 1024, 1280, 2368]
    - [7, 42.342]
  - - [1408, 2368, 1, 1280, 1408, 1408, 1280, 2368]
    - [13, 43.602]
  - - [1856, 2368, 1, 1280, 1856, 1856, 1280, 2368]
    - [13, 45.19]
  - - [2368, 2368, 1, 1280, 2368, 2368, 1280, 2368]
    - [13, 44.162]
  - - [2944, 2368, 1, 1280, 2944, 2944, 1280, 2368]
    - [13, 44.225]
  - - [3584, 2368, 1, 1280, 3584, 3584, 1280, 2368]
    - [13, 45.154]
  - - [4288, 2368, 1, 1280, 4288, 4288, 1280, 2368]
    - [13, 46.459]
  - - [5056, 2368, 1, 1280, 5056, 5056, 1280, 2368]
    - [13, 46.274]
  - - [5888, 2368, 1, 1280, 5888, 5888, 1280, 2368]
    - [13, 46.552]
  - - [6784, 2368, 1, 1280, 6784, 6784, 1280, 2368]
    - [13, 47.163]
  - - [256, 2944, 1, 1280, 256, 256, 1280, 2944]
    - [4, 27.8]
  - - [448, 2944, 1, 1280, 448, 448, 1280, 2944]
    - [7, 37.415]
  - - [704, 2944, 1, 1280, 704, 704, 1280, 2944]
    - [7, 36.256]
  - - [1024, 2944, 1, 1280, 1024, 1024, 1280, 2944]
    - [7, 39.422]
  - - [1408, 2944, 1, 1280, 1408, 1408, 1280, 2944]
    - [7, 42.677]
  - - [1856, 2944, 1, 1280, 1856, 1856, 1280, 2944]
    - [13, 43.123]
  - - [2368, 2944, 1, 1280, 2368, 2368, 1280, 2944]
    - [13, 44.243]
  - - [2944, 2944, 1, 1280, 2944, 2944, 1280, 2944]
    - [13, 46.091]
  - - [3584, 2944, 1, 1280, 3584, 3584, 1280, 2944]
    - [13, 46.166]
  - - [4288, 2944, 1, 1280, 4288, 4288, 1280, 2944]
    - [13, 46.828]
  - - [5056, 2944, 1, 1280, 5056, 5056, 1280, 2944]
    - [13, 46.504]
  - - [5888, 2944, 1, 1280, 5888, 5888, 1280, 2944]
    - [13, 46.831]
  - - [6784, 2944, 1, 1280, 6784, 6784, 1280, 2944]
    - [13, 47.382]
  - - [256, 3584, 1, 1280, 256, 256, 1280, 3584]
    - [4, 33.456]
  - - [448, 3584, 1, 1280, 448, 448, 1280, 3584]
    - [13, 35.816]
  - - [704, 3584, 1, 1280, 704, 704, 1280, 3584]
    - [13, 37.945]
  - - [1024, 3584, 1, 1280, 1024, 1024, 1280, 3584]
    - [13, 42.506]
  - - [1408, 3584, 1, 1280, 1408, 1408, 1280, 3584]
    - [13, 43.114]
  - - [1856, 3584, 1, 1280, 1856, 1856, 1280, 3584]
    - [13, 45.07]
  - - [2368, 3584, 1, 1280, 2368, 2368, 1280, 3584]
    - [13, 45.163]
  - - [2944, 3584, 1, 1280, 2944, 2944, 1280, 3584]
    - [13, 46.187]
  - - [3584, 3584, 1, 1280, 3584, 3584, 1280, 3584]
    - [13, 46.016]
  - - [4288, 3584, 1, 1280, 4288, 4288, 1280, 3584]
    - [13, 46.582]
  - - [5056, 3584, 1, 1280, 5056, 5056, 1280, 3584]
    - [13, 47.594]
  - - [5888, 3584, 1, 1280, 5888, 5888, 1280, 3584]
    - [13, 47.78]
  - - [6784, 3584, 1, 1280, 6784, 6784, 1280, 3584]
    - [8, 47.43]
  - - [256, 4288, 1, 1280, 256, 256, 1280, 4288]
    - [4, 31.327]
  - - [448, 4288, 1, 1280, 448, 448, 1280, 4288]
    - [13, 42.692]
  - - [704, 4288, 1, 1280, 704, 704, 1280, 4288]
    - [13, 39.5]
  - - [1024, 4288, 1, 1280, 1024, 1024, 1280, 4288]
    - [7, 45.139]
  - - [1408, 4288, 1, 1280, 1408, 1408, 1280, 4288]
    - [13, 43.95]
  - - [1856, 4288, 1, 1280, 1856, 1856, 1280, 4288]
    - [13, 44.752]
  - - [2368, 4288, 1, 1280, 2368, 2368, 1280, 4288]
    - [13, 46.585]
  - - [2944, 4288, 1, 1280, 2944, 2944, 1280, 4288]
    - [13, 46.915]
  - - [3584, 4288, 1, 1280, 3584, 3584, 1280, 4288]
    - [13, 46.684]
  - - [4288, 4288, 1, 1280, 4288, 4288, 1280, 4288]
    - [13, 47.091]
  - - [5056, 4288, 1, 1280, 5056, 5056, 1280, 4288]
    - [13, 46.962]
  - - [5888, 4288, 1, 1280, 5888, 5888, 1280, 4288]
    - [7, 47.394]
  - - [6784, 4288, 1, 1280, 6784, 6784, 1280, 4288]
    - [13, 47.439]
  - - [256, 5056, 1, 1280, 256, 256, 1280, 5056]
    - [13, 36.763]
  - - [448, 5056, 1, 1280, 448, 448, 1280, 5056]
    - [7, 39.625]
  - - [704, 5056, 1, 1280, 704, 704, 1280, 5056]
    - [13, 41.297]
  - - [1024, 5056, 1, 1280, 1024, 1024, 1280, 5056]
    - [13, 44.126]
  - - [1408, 5056, 1, 1280, 1408, 1408, 1280, 5056]
    - [13, 45.22]
  - - [1856, 5056, 1, 1280, 1856, 1856, 1280, 5056]
    - [13, 45.139]
  - - [2368, 5056, 1, 1280, 2368, 2368, 1280, 5056]
    - [13, 46.268]
  - - [2944, 5056, 1, 1280, 2944, 2944, 1280, 5056]
    - [13, 46.606]
  - - [3584, 5056, 1, 1280, 3584, 3584, 1280, 5056]
    - [7, 47.561]
  - - [4288, 5056, 1, 1280, 4288, 4288, 1280, 5056]
    - [13, 46.932]
  - - [5056, 5056, 1, 1280, 5056, 5056, 1280, 5056]
    - [13, 47.091]
  - - [5888, 5056, 1, 1280, 5888, 5888, 1280, 5056]
    - [13, 47.705]
  - - [6784, 5056, 1, 1280, 6784, 6784, 1280, 5056]
    - [34, 47.93]
  - - [256, 5888, 1, 1280, 256, 256, 1280, 5888]
    - [13, 33.732]
  - - [448, 5888, 1, 1280, 448, 448, 1280, 5888]
    - [13, 39.682]
  - - [704, 5888, 1, 1280, 704, 704, 1280, 5888]
    - [13, 42.677]
  - - [1024, 5888, 1, 1280, 1024, 1024, 1280, 5888]
    - [13, 43.818]
  - - [1408, 5888, 1, 1280, 1408, 1408, 1280, 5888]
    - [13, 46.612]
  - - [1856, 5888, 1, 1280, 1856, 1856, 1280, 5888]
    - [13, 45.798]
  - - [2368, 5888, 1, 1280, 2368, 2368, 1280, 5888]
    - [13, 46.582]
  - - [2944, 5888, 1, 1280, 2944, 2944, 1280, 5888]
    - [13, 46.795]
  - - [3584, 5888, 1, 1280, 3584, 3584, 1280, 5888]
    - [13, 47.768]
  - - [4288, 5888, 1, 1280, 4288, 4288, 1280, 5888]
    - [8, 47.388]
  - - [5056, 5888, 1, 1280, 5056, 5056, 1280, 5888]
    - [13, 47.708]
  - - [5888, 5888, 1, 1280, 5888, 5888, 1280, 5888]
    - [13, 47.813]
  - - [6784, 5888, 1, 1280, 6784, 6784, 1280, 5888]
    - [8, 47.708]
  - - [256, 6784, 1, 1280, 256, 256, 1280, 6784]
    - [13, 38.667]
  - - [448, 6784, 1, 1280, 448, 448, 1280, 6784]
    - [13, 39.637]
  - - [704, 6784, 1, 1280, 704, 704, 1280, 6784]
    - [13, 44.591]
  - - [1024, 6784, 1, 1280, 1024, 1024, 1280, 6784]
    - [13, 44.07]
  - - [1408, 6784, 1, 1280, 1408, 1408, 1280, 6784]
    - [13, 45.869]
  - - [1856, 6784, 1, 1280, 1856, 1856, 1280, 6784]
    - [7, 46.783]
  - - [2368, 6784, 1, 1280, 2368, 2368, 1280, 6784]
    - [13, 47.223]
  - - [2944, 6784, 1, 1280, 2944, 2944, 1280, 6784]
    - [13, 47.403]
  - - [3584, 6784, 1, 1280, 3584, 3584, 1280, 6784]
    - [13, 47.436]
  - - [4288, 6784, 1, 1280, 4288, 4288, 1280, 6784]
    - [13, 47.469]
  - - [5056, 6784, 1, 1280, 5056, 5056, 1280, 6784]
    - [14, 48.041]
  - - [5888, 6784, 1, 1280, 5888, 5888, 1280, 6784]
    - [14, 47.78]
  - - [6784, 6784, 1, 1280, 6784, 6784, 1280, 6784]
    - [14, 48.115]
  - - [704, 256, 1, 3328, 704, 704, 3328, 256]
    - [18, 9.912]
  - - [1024, 256, 1, 3328, 1024, 1024, 3328, 256]
    - [18, 14.243]
  - - [1408, 256, 1, 3328, 1408, 1408, 3328, 256]
    - [10, 19.364]
  - - [1856, 256, 1, 3328, 1856, 1856, 3328, 256]
    - [18, 25.449]
  - - [2368, 256, 1, 3328, 2368, 2368, 3328, 256]
    - [4, 23.379]
  - - [2944, 256, 1, 3328, 2944, 2944, 3328, 256]
    - [4, 28.791]
  - - [3584, 256, 1, 3328, 3584, 3584, 3328, 256]
    - [4, 34.573]
  - - [4288, 256, 1, 3328, 4288, 4288, 3328, 256]
    - [13, 32.094]
  - - [5056, 256, 1, 3328, 5056, 5056, 3328, 256]
    - [7, 37.658]
  - - [5888, 256, 1, 3328, 5888, 5888, 3328, 256]
    - [13, 34.172]
  - - [6784, 256, 1, 3328, 6784, 6784, 3328, 256]
    - [13, 39.272]
  - - [704, 448, 1, 3328, 704, 704, 3328, 448]
    - [10, 16.986]
  - - [1024, 448, 1, 3328, 1024, 1024, 3328, 448]
    - [18, 24.58]
  - - [1408, 448, 1, 3328, 1408, 1408, 3328, 448]
    - [4, 24.275]
  - - [1856, 448, 1, 3328, 1856, 1856, 3328, 448]
    - [4, 31.621]
  - - [2368, 448, 1, 3328, 2368, 2368, 3328, 448]
    - [13, 31.118]
  - - [2944, 448, 1, 3328, 2944, 2944, 3328, 448]
    - [7, 38.425]
  - - [3584, 448, 1, 3328, 3584, 3584, 3328, 448]
    - [13, 36.595]
  - - [4288, 448, 1, 3328, 4288, 4288, 3328, 448]
    - [13, 43.566]
  - - [5056, 448, 1, 3328, 5056, 5056, 3328, 448]
    - [7, 40.248]
  - - [5888, 448, 1, 3328, 5888, 5888, 3328, 448]
    - [13, 40.174]
  - - [6784, 448, 1, 3328, 6784, 6784, 3328, 448]
    - [7, 40.177]
  - - [256, 704, 1, 3328, 256, 256, 3328, 704]
    - [18, 9.912]
  - - [448, 704, 1, 3328, 448, 448, 3328, 704]
    - [21, 16.98]
  - - [704, 704, 1, 3328, 704, 704, 3328, 704]
    - [4, 19.223]
  - - [1024, 704, 1, 3328, 1024, 1024, 3328, 704]
    - [4, 27.719]
  - - [1408, 704, 1, 3328, 1408, 1408, 3328, 704]
    - [4, 29.228]
  - - [1856, 704, 1, 3328, 1856, 1856, 3328, 704]
    - [13, 38.176]
  - - [2368, 704, 1, 3328, 2368, 2368, 3328, 704]
    - [13, 37.987]
  - - [2944, 704, 1, 3328, 2944, 2944, 3328, 704]
    - [7, 36.996]
  - - [3584, 704, 1, 3328, 3584, 3584, 3328, 704]
    - [13, 38.449]
  - - [4288, 704, 1, 3328, 4288, 4288, 3328, 704]
    - [7, 39.949]
  - - [5056, 704, 1, 3328, 5056, 5056, 3328, 704]
    - [13, 41.734]
  - - [5888, 704, 1, 3328, 5888, 5888, 3328, 704]
    - [7, 43.111]
  - - [6784, 704, 1, 3328, 6784, 6784, 3328, 704]
    - [13, 45.049]
  - - [256, 1024, 1, 3328, 256, 256, 3328, 1024]
    - [17, 14.341]
  - - [448, 1024, 1, 3328, 448, 448, 3328, 1024]
    - [10, 24.559]
  - - [704, 1024, 1, 3328, 704, 704, 3328, 1024]
    - [4, 27.677]
  - - [1024, 1024, 1, 3328, 1024, 1024, 3328, 1024]
    - [4, 30.896]
  - - [1408, 1024, 1, 3328, 1408, 1408, 3328, 1024]
    - [13, 41.985]
  - - [1856, 1024, 1, 3328, 1856, 1856, 3328, 1024]
    - [13, 43.261]
  - - [2368, 1024, 1, 3328, 2368, 2368, 3328, 1024]
    - [7, 43.186]
  - - [2944, 1024, 1, 3328, 2944, 2944, 3328, 1024]
    - [13, 39.961]
  - - [3584, 1024, 1, 3328, 3584, 3584, 3328, 1024]
    - [13, 43.084]
  - - [4288, 1024, 1, 3328, 4288, 4288, 3328, 1024]
    - [7, 45.66]
  - - [5056, 1024, 1, 3328, 5056, 5056, 3328, 1024]
    - [7, 44.576]
  - - [5888, 1024, 1, 3328, 5888, 5888, 3328, 1024]
    - [13, 44.264]
  - - [6784, 1024, 1, 3328, 6784, 6784, 3328, 1024]
    - [13, 44.402]
  - - [256, 1408, 1, 3328, 256, 256, 3328, 1408]
    - [17, 19.456]
  - - [448, 1408, 1, 3328, 448, 448, 3328, 1408]
    - [4, 24.305]
  - - [704, 1408, 1, 3328, 704, 704, 3328, 1408]
    - [4, 29.24]
  - - [1024, 1408, 1, 3328, 1024, 1024, 3328, 1408]
    - [13, 41.889]
  - - [1408, 1408, 1, 3328, 1408, 1408, 3328, 1408]
    - [7, 35.394]
  - - [1856, 1408, 1, 3328, 1856, 1856, 3328, 1408]
    - [13, 39.892]
  - - [2368, 1408, 1, 3328, 2368, 2368, 3328, 1408]
    - [13, 44.1]
  - - [2944, 1408, 1, 3328, 2944, 2944, 3328, 1408]
    - [7, 43.156]
  - - [3584, 1408, 1, 3328, 3584, 3584, 3328, 1408]
    - [7, 43.51]
  - - [4288, 1408, 1, 3328, 4288, 4288, 3328, 1408]
    - [7, 44.276]
  - - [5056, 1408, 1, 3328, 5056, 5056, 3328, 1408]
    - [13, 45.498]
  - - [5888, 1408, 1, 3328, 5888, 5888, 3328, 1408]
    - [13, 46.861]
  - - [6784, 1408, 1, 3328, 6784, 6784, 3328, 1408]
    - [13, 46.157]
  - - [256, 1856, 1, 3328, 256, 256, 3328, 1856]
    - [17, 25.515]
  - - [448, 1856, 1, 3328, 448, 448, 3328, 1856]
    - [4, 31.621]
  - - [704, 1856, 1, 3328, 704, 704, 3328, 1856]
    - [13, 38.023]
  - - [1024, 1856, 1, 3328, 1024, 1024, 3328, 1856]
    - [13, 43.213]
  - - [1408, 1856, 1, 3328, 1408, 1408, 3328, 1856]
    - [13, 39.907]
  - - [1856, 1856, 1, 3328, 1856, 1856, 3328, 1856]
    - [13, 40.488]
  - - [2368, 1856, 1, 3328, 2368, 2368, 3328, 1856]
    - [7, 45.666]
  - - [2944, 1856, 1, 3328, 2944, 2944, 3328, 1856]
    - [13, 43.426]
  - - [3584, 1856, 1, 3328, 3584, 3584, 3328, 1856]
    - [13, 45.483]
  - - [4288, 1856, 1, 3328, 4288, 4288, 3328, 1856]
    - [13, 45.058]
  - - [5056, 1856, 1, 3328, 5056, 5056, 3328, 1856]
    - [13, 45.375]
  - - [5888, 1856, 1, 3328, 5888, 5888, 3328, 1856]
    - [7, 46.031]
  - - [6784, 1856, 1, 3328, 6784, 6784, 3328, 1856]
    - [7, 47.007]
  - - [256, 2368, 1, 3328, 256, 256, 3328, 2368]
    - [4, 23.388]
  - - [448, 2368, 1, 3328, 448, 448, 3328, 2368]
    - [4, 31.148]
  - - [704, 2368, 1, 3328, 704, 704, 3328, 2368]
    - [13, 38.008]
  - - [1024, 2368, 1, 3328, 1024, 1024, 3328, 2368]
    - [7, 42.989]
  - - [1408, 2368, 1, 3328, 1408, 1408, 3328, 2368]
    - [13, 44.07]
  - - [1856, 2368, 1, 3328, 1856, 1856, 3328, 2368]
    - [7, 45.699]
  - - [2368, 2368, 1, 3328, 2368, 2368, 3328, 2368]
    - [13, 44.516]
  - - [2944, 2368, 1, 3328, 2944, 2944, 3328, 2368]
    - [13, 44.561]
  - - [3584, 2368, 1, 3328, 3584, 3584, 3328, 2368]
    - [13, 45.495]
  - - [4288, 2368, 1, 3328, 4288, 4288, 3328, 2368]
    - [13, 46.717]
  - - [5056, 2368, 1, 3328, 5056, 5056, 3328, 2368]
    - [13, 46.513]
  - - [5888, 2368, 1, 3328, 5888, 5888, 3328, 2368]
    - [13, 46.801]
  - - [6784, 2368, 1, 3328, 6784, 6784, 3328, 2368]
    - [13, 47.463]
  - - [256, 2944, 1, 3328, 256, 256, 3328, 2944]
    - [4, 28.818]
  - - [448, 2944, 1, 3328, 448, 448, 3328, 2944]
    - [13, 38.425]
  - - [704, 2944, 1, 3328, 704, 704, 3328, 2944]
    - [7, 36.852]
  - - [1024, 2944, 1, 3328, 1024, 1024, 3328, 2944]
    - [13, 39.844]
  - - [1408, 2944, 1, 3328, 1408, 1408, 3328, 2944]
    - [7, 43.066]
  - - [1856, 2944, 1, 3328, 1856, 1856, 3328, 2944]
    - [13, 43.408]
  - - [2368, 2944, 1, 3328, 2368, 2368, 3328, 2944]
    - [7, 44.51]
  - - [2944, 2944, 1, 3328, 2944, 2944, 3328, 2944]
    - [13, 46.369]
  - - [3584, 2944, 1, 3328, 3584, 3584, 3328, 2944]
    - [13, 46.426]
  - - [4288, 2944, 1, 3328, 4288, 4288, 3328, 2944]
    - [13, 47.121]
  - - [5056, 2944, 1, 3328, 5056, 5056, 3328, 2944]
    - [13, 46.792]
  - - [5888, 2944, 1, 3328, 5888, 5888, 3328, 2944]
    - [7, 46.995]
  - - [6784, 2944, 1, 3328, 6784, 6784, 3328, 2944]
    - [13, 47.579]
  - - [256, 3584, 1, 3328, 256, 256, 3328, 3584]
    - [17, 34.699]
  - - [448, 3584, 1, 3328, 448, 448, 3328, 3584]
    - [13, 36.556]
  - - [704, 3584, 1, 3328, 704, 704, 3328, 3584]
    - [13, 38.488]
  - - [1024, 3584, 1, 3328, 1024, 1024, 3328, 3584]
    - [13, 43.03]
  - - [1408, 3584, 1, 3328, 1408, 1408, 3328, 3584]
    - [7, 43.435]
  - - [1856, 3584, 1, 3328, 1856, 1856, 3328, 3584]
    - [13, 45.468]
  - - [2368, 3584, 1, 3328, 2368, 2368, 3328, 3584]
    - [13, 45.471]
  - - [2944, 3584, 1, 3328, 2944, 2944, 3328, 3584]
    - [13, 46.45]
  - - [3584, 3584, 1, 3328, 3584, 3584, 3328, 3584]
    - [13, 46.235]
  - - [4288, 3584, 1, 3328, 4288, 4288, 3328, 3584]
    - [13, 46.816]
  - - [5056, 3584, 1, 3328, 5056, 5056, 3328, 3584]
    - [13, 47.852]
  - - [5888, 3584, 1, 3328, 5888, 5888, 3328, 3584]
    - [13, 48.005]
  - - [6784, 3584, 1, 3328, 6784, 6784, 3328, 3584]
    - [13, 47.669]
  - - [256, 4288, 1, 3328, 256, 256, 3328, 4288]
    - [4, 32.292]
  - - [448, 4288, 1, 3328, 448, 448, 3328, 4288]
    - [13, 43.59]
  - - [704, 4288, 1, 3328, 704, 704, 3328, 4288]
    - [13, 39.958]
  - - [1024, 4288, 1, 3328, 1024, 1024, 3328, 4288]
    - [7, 45.585]
  - - [1408, 4288, 1, 3328, 1408, 1408, 3328, 4288]
    - [7, 44.258]
  - - [1856, 4288, 1, 3328, 1856, 1856, 3328, 4288]
    - [13, 45.049]
  - - [2368, 4288, 1, 3328, 2368, 2368, 3328, 4288]
    - [7, 46.732]
  - - [2944, 4288, 1, 3328, 2944, 2944, 3328, 4288]
    - [13, 47.145]
  - - [3584, 4288, 1, 3328, 3584, 3584, 3328, 4288]
    - [13, 46.825]
  - - [4288, 4288, 1, 3328, 4288, 4288, 3328, 4288]
    - [13, 47.271]
  - - [5056, 4288, 1, 3328, 5056, 5056, 3328, 4288]
    - [13, 47.187]
  - - [5888, 4288, 1, 3328, 5888, 5888, 3328, 4288]
    - [13, 47.636]
  - - [6784, 4288, 1, 3328, 6784, 6784, 3328, 4288]
    - [13, 47.6]
  - - [256, 5056, 1, 3328, 256, 256, 3328, 5056]
    - [13, 37.868]
  - - [448, 5056, 1, 3328, 448, 448, 3328, 5056]
    - [7, 40.293]
  - - [704, 5056, 1, 3328, 704, 704, 3328, 5056]
    - [13, 41.749]
  - - [1024, 5056, 1, 3328, 1024, 1024, 3328, 5056]
    - [13, 44.513]
  - - [1408, 5056, 1, 3328, 1408, 1408, 3328, 5056]
    - [13, 45.426]
  - - [1856, 5056, 1, 3328, 1856, 1856, 3328, 5056]
    - [13, 45.366]
  - - [2368, 5056, 1, 3328, 2368, 2368, 3328, 5056]
    - [13, 46.51]
  - - [2944, 5056, 1, 3328, 2944, 2944, 3328, 5056]
    - [13, 46.789]
  - - [3584, 5056, 1, 3328, 3584, 3584, 3328, 5056]
    - [13, 47.798]
  - - [4288, 5056, 1, 3328, 4288, 4288, 3328, 5056]
    - [13, 47.148]
  - - [5056, 5056, 1, 3328, 5056, 5056, 3328, 5056]
    - [13, 47.292]
  - - [5888, 5056, 1, 3328, 5888, 5888, 3328, 5056]
    - [13, 47.888]
  - - [6784, 5056, 1, 3328, 6784, 6784, 3328, 5056]
    - [13, 48.13]
  - - [256, 5888, 1, 3328, 256, 256, 3328, 5888]
    - [4, 34.454]
  - - [448, 5888, 1, 3328, 448, 448, 3328, 5888]
    - [13, 40.197]
  - - [704, 5888, 1, 3328, 704, 704, 3328, 5888]
    - [7, 43.087]
  - - [1024, 5888, 1, 3328, 1024, 1024, 3328, 5888]
    - [13, 44.165]
  - - [1408, 5888, 1, 3328, 1408, 1408, 3328, 5888]
    - [13, 46.87]
  - - [1856, 5888, 1, 3328, 1856, 1856, 3328, 5888]
    - [7, 46.064]
  - - [2368, 5888, 1, 3328, 2368, 2368, 3328, 5888]
    - [13, 46.813]
  - - [2944, 5888, 1, 3328, 2944, 2944, 3328, 5888]
    - [7, 46.998]
  - - [3584, 5888, 1, 3328, 3584, 3584, 3328, 5888]
    - [13, 47.972]
  - - [4288, 5888, 1, 3328, 4288, 4288, 3328, 5888]
    - [13, 47.609]
  - - [5056, 5888, 1, 3328, 5056, 5056, 3328, 5888]
    - [13, 47.912]
  - - [5888, 5888, 1, 3328, 5888, 5888, 3328, 5888]
    - [13, 47.969]
  - - [6784, 5888, 1, 3328, 6784, 6784, 3328, 5888]
    - [13, 47.882]
  - - [256, 6784, 1, 3328, 256, 256, 3328, 6784]
    - [13, 39.509]
  - - [448, 6784, 1, 3328, 448, 448, 3328, 6784]
    - [13, 40.209]
  - - [704, 6784, 1, 3328, 704, 704, 3328, 6784]
    - [13, 45.064]
  - - [1024, 6784, 1, 3328, 1024, 1024, 3328, 6784]
    - [13, 44.339]
  - - [1408, 6784, 1, 3328, 1408, 1408, 3328, 6784]
    - [13, 46.127]
  - - [1856, 6784, 1, 3328, 1856, 1856, 3328, 6784]
    - [13, 47.028]
  - - [2368, 6784, 1, 3328, 2368, 2368, 3328, 6784]
    - [7, 47.436]
  - - [2944, 6784, 1, 3328, 2944, 2944, 3328, 6784]
    - [13, 47.612]
  - - [3584, 6784, 1, 3328, 3584, 3584, 3328, 6784]
    - [13, 47.636]
  - - [4288, 6784, 1, 3328, 4288, 4288, 3328, 6784]
    - [13, 47.579]
  - - [5056, 6784, 1, 3328, 5056, 5056, 3328, 6784]
    - [13, 48.121]
  - - [5888, 6784, 1, 3328, 5888, 5888, 3328, 6784]
    - [13, 47.912]
  - - [6784, 6784, 1, 3328, 6784, 6784, 3328, 6784]
    - [13, 48.172]
  - - [1024, 1024, 1, 1024, 1024, 1024, 1024, 1024]
    - [13, 29.662]
  - - [32, 32, 1, 32, 32, 32, 32, 32]
    - [35, 0.006]
  - - [32, 64, 1, 256, 32, 32, 256, 64]
    - [40, 0.039]
  - - [32, 128, 1, 256, 32, 32, 256, 128]
    - [40, 0.078]
  - - [32, 256, 1, 256, 32, 32, 256, 256]
    - [40, 0.159]
  - - [32, 448, 1, 256, 32, 32, 256, 448]
    - [40, 0.281]
  - - [32, 704, 1, 256, 32, 32, 256, 704]
    - [43, 0.452]
  - - [32, 1024, 1, 256, 32, 32, 256, 1024]
    - [43, 0.665]
  - - [32, 1408, 1, 256, 32, 32, 256, 1408]
    - [40, 0.895]
  - - [32, 1856, 1, 256, 32, 32, 256, 1856]
    - [40, 1.198]
  - - [32, 2368, 1, 256, 32, 32, 256, 2368]
    - [40, 1.533]
  - - [32, 2944, 1, 256, 32, 32, 256, 2944]
    - [40, 1.905]
  - - [32, 3584, 1, 256, 32, 32, 256, 3584]
    - [40, 2.294]
  - - [32, 4288, 1, 256, 32, 32, 256, 4288]
    - [43, 2.734]
  - - [32, 5056, 1, 256, 32, 32, 256, 5056]
    - [43, 3.052]
  - - [32, 5888, 1, 256, 32, 32, 256, 5888]
    - [43, 3.438]
  - - [32, 6784, 1, 256, 32, 32, 256, 6784]
    - [40, 4.342]
  - - [32, 64, 1, 1280, 32, 32, 1280, 64]
    - [40, 0.051]
  - - [32, 128, 1, 1280, 32, 32, 1280, 128]
    - [40, 0.102]
  - - [32, 256, 1, 1280, 32, 32, 1280, 256]
    - [40, 0.204]
  - - [32, 448, 1, 1280, 32, 32, 1280, 448]
    - [40, 0.359]
  - - [32, 704, 1, 1280, 32, 32, 1280, 704]
    - [43, 0.569]
  - - [32, 1024, 1, 1280, 32, 32, 1280, 1024]
    - [43, 0.83]
  - - [32, 1408, 1, 1280, 32, 32, 1280, 1408]
    - [43, 1.138]
  - - [32, 1856, 1, 1280, 32, 32, 1280, 1856]
    - [40, 1.491]
  - - [32, 2368, 1, 1280, 32, 32, 1280, 2368]
    - [40, 1.893]
  - - [32, 2944, 1, 1280, 32, 32, 1280, 2944]
    - [40, 2.363]
  - - [32, 3584, 1, 1280, 32, 32, 1280, 3584]
    - [40, 2.869]
  - - [32, 4288, 1, 1280, 32, 32, 1280, 4288]
    - [43, 3.432]
  - - [32, 5056, 1, 1280, 32, 32, 1280, 5056]
    - [40, 4.088]
  - - [32, 5888, 1, 1280, 32, 32, 1280, 5888]
    - [40, 4.738]
  - - [32, 6784, 1, 1280, 32, 32, 1280, 6784]
    - [45, 5.513]
  - - [32, 64, 1, 3328, 32, 32, 3328, 64]
    - [40, 0.051]
  - - [32, 128, 1, 3328, 32, 32, 3328, 128]
    - [40, 0.105]
  - - [32, 256, 1, 3328, 32, 32, 3328, 256]
    - [43, 0.213]
  - - [32, 448, 1, 3328, 32, 32, 3328, 448]
    - [40, 0.377]
  - - [32, 704, 1, 3328, 32, 32, 3328, 704]
    - [40, 0.593]
  - - [32, 1024, 1, 3328, 32, 32, 3328, 1024]
    - [43, 0.862]
  - - [32, 1408, 1, 3328, 32, 32, 3328, 1408]
    - [40, 1.168]
  - - [32, 1856, 1, 3328, 32, 32, 3328, 1856]
    - [40, 1.542]
  - - [32, 2368, 1, 3328, 32, 32, 3328, 2368]
    - [43, 1.97]
  - - [32, 2944, 1, 3328, 32, 32, 3328, 2944]
    - [40, 2.462]
  - - [32, 3584, 1, 3328, 32, 32, 3328, 3584]
    - [43, 2.98]
  - - [32, 4288, 1, 3328, 32, 32, 3328, 4288]
    - [43, 3.636]
  - - [32, 5056, 1, 3328, 32, 32, 3328, 5056]
    - [43, 4.273]
  - - [32, 5888, 1, 3328, 32, 32, 3328, 5888]
    - [43, 5.067]
  - - [32, 6784, 1, 3328, 32, 32, 3328, 6784]
    - [43, 5.935]
  - - [64, 32, 1, 256, 64, 64, 256, 32]
    - [49, 0.039]
  - - [128, 32, 1, 256, 128, 128, 256, 32]
    - [46, 0.081]
  - - [256, 32, 1, 256, 256, 256, 256, 32]
    - [43, 0.156]
  - - [448, 32, 1, 256, 448, 448, 256, 32]
    - [43, 0.311]
  - - [704, 32, 1, 256, 704, 704, 256, 32]
    - [43, 0.467]
  - - [1024, 32, 1, 256, 1024, 1024, 256, 32]
    - [40, 0.653]
  - - [1408, 32, 1, 256, 1408, 1408, 256, 32]
    - [40, 0.919]
  - - [1856, 32, 1, 256, 1856, 1856, 256, 32]
    - [40, 1.213]
  - - [2368, 32, 1, 256, 2368, 2368, 256, 32]
    - [43, 1.593]
  - - [2944, 32, 1, 256, 2944, 2944, 256, 32]
    - [43, 1.956]
  - - [3584, 32, 1, 256, 3584, 3584, 256, 32]
    - [40, 2.318]
  - - [4288, 32, 1, 256, 4288, 4288, 256, 32]
    - [43, 2.773]
  - - [5056, 32, 1, 256, 5056, 5056, 256, 32]
    - [43, 3.171]
  - - [5888, 32, 1, 256, 5888, 5888, 256, 32]
    - [40, 3.507]
  - - [6784, 32, 1, 256, 6784, 6784, 256, 32]
    - [39, 4.001]
  - - [64, 32, 1, 1280, 64, 64, 1280, 32]
    - [45, 0.048]
  - - [128, 32, 1, 1280, 128, 128, 1280, 32]
    - [45, 0.099]
  - - [256, 32, 1, 1280, 256, 256, 1280, 32]
    - [45, 0.201]
  - - [448, 32, 1, 1280, 448, 448, 1280, 32]
    - [40, 0.359]
  - - [704, 32, 1, 1280, 704, 704, 1280, 32]
    - [40, 0.572]
  - - [1024, 32, 1, 1280, 1024, 1024, 1280, 32]
    - [40, 0.836]
  - - [1408, 32, 1, 1280, 1408, 1408, 1280, 32]
    - [40, 1.156]
  - - [1856, 32, 1, 1280, 1856, 1856, 1280, 32]
    - [40, 1.536]
  - - [2368, 32, 1, 1280, 2368, 2368, 1280, 32]
    - [40, 1.944]
  - - [2944, 32, 1, 1280, 2944, 2944, 1280, 32]
    - [43, 2.414]
  - - [3584, 32, 1, 1280, 3584, 3584, 1280, 32]
    - [40, 2.944]
  - - [4288, 32, 1, 1280, 4288, 4288, 1280, 32]
    - [40, 3.567]
  - - [5056, 32, 1, 1280, 5056, 5056, 1280, 32]
    - [40, 4.166]
  - - [5888, 32, 1, 1280, 5888, 5888, 1280, 32]
    - [43, 4.818]
  - - [6784, 32, 1, 1280, 6784, 6784, 1280, 32]
    - [43, 5.477]
  - - [64, 32, 1, 3328, 64, 64, 3328, 32]
    - [45, 0.051]
  - - [128, 32, 1, 3328, 128, 128, 3328, 32]
    - [47, 0.105]
  - - [256, 32, 1, 3328, 256, 256, 3328, 32]
    - [45, 0.207]
  - - [448, 32, 1, 3328, 448, 448, 3328, 32]
    - [47, 0.368]
  - - [704, 32, 1, 3328, 704, 704, 3328, 32]
    - [45, 0.581]
  - - [1024, 32, 1, 3328, 1024, 1024, 3328, 32]
    - [45, 0.853]
  - - [1408, 32, 1, 3328, 1408, 1408, 3328, 32]
    - [45, 1.171]
  - - [1856, 32, 1, 3328, 1856, 1856, 3328, 32]
    - [47, 1.548]
  - - [2368, 32, 1, 3328, 2368, 2368, 3328, 32]
    - [45, 1.965]
  - - [2944, 32, 1, 3328, 2944, 2944, 3328, 32]
    - [47, 2.429]
  - - [3584, 32, 1, 3328, 3584, 3584, 3328, 32]
    - [47, 2.968]
  - - [4288, 32, 1, 3328, 4288, 4288, 3328, 32]
    - [45, 3.6]
  - - [5056, 32, 1, 3328, 5056, 5056, 3328, 32]
    - [45, 4.27]
  - - [5888, 32, 1, 3328, 5888, 5888, 3328, 32]
    - [45, 4.959]
  - - [6784, 32, 1, 3328, 6784, 6784, 3328, 32]
    - [45, 5.72]
  - - [64, 64, 1, 32, 64, 64, 32, 64]
    - [49, 0.03]
  - - [128, 64, 1, 32, 128, 128, 32, 64]
    - [36, 0.045]
  - - [256, 64, 1, 32, 256, 256, 32, 64]
    - [36, 0.102]
  - - [448, 64, 1, 32, 448, 448, 32, 64]
    - [43, 0.189]
  - - [704, 64, 1, 32, 704, 704, 32, 64]
    - [43, 0.27]
  - - [1024, 64, 1, 32, 1024, 1024, 32, 64]
    - [37, 0.425]
  - - [1408, 64, 1, 32, 1408, 1408, 32, 64]
    - [40, 0.542]
  - - [1856, 64, 1, 32, 1856, 1856, 32, 64]
    - [36, 0.719]
  - - [2368, 64, 1, 32, 2368, 2368, 32, 64]
    - [39, 0.931]
  - - [2944, 64, 1, 32, 2944, 2944, 32, 64]
    - [40, 1.156]
  - - [3584, 64, 1, 32, 3584, 3584, 32, 64]
    - [36, 1.381]
  - - [4288, 64, 1, 32, 4288, 4288, 32, 64]
    - [39, 1.581]
  - - [5056, 64, 1, 32, 5056, 5056, 32, 64]
    - [36, 1.761]
  - - [5888, 64, 1, 32, 5888, 5888, 32, 64]
    - [36, 1.938]
  - - [6784, 64, 1, 32, 6784, 6784, 32, 64]
    - [43, 2.89]
  - - [64, 128, 1, 32, 64, 64, 32, 128]
    - [49, 0.09]
  - - [128, 128, 1, 32, 128, 128, 32, 128]
    - [40, 0.102]
  - - [256, 128, 1, 32, 256, 256, 32, 128]
    - [36, 0.198]
  - - [448, 128, 1, 32, 448, 448, 32, 128]
    - [40, 0.353]
  - - [704, 128, 1, 32, 704, 704, 32, 128]
    - [43, 0.527]
  - - [1024, 128, 1, 32, 1024, 1024, 32, 128]
    - [40, 0.788]
  - - [1408, 128, 1, 32, 1408, 1408, 32, 128]
    - [36, 1.096]
  - - [1856, 128, 1, 32, 1856, 1856, 32, 128]
    - [36, 1.407]
  - - [2368, 128, 1, 32, 2368, 2368, 32, 128]
    - [36, 1.659]
  - - [2944, 128, 1, 32, 2944, 2944, 32, 128]
    - [45, 2.024]
  - - [3584, 128, 1, 32, 3584, 3584, 32, 128]
    - [36, 3.477]
  - - [4288, 128, 1, 32, 4288, 4288, 32, 128]
    - [36, 4.058]
  - - [5056, 128, 1, 32, 5056, 5056, 32, 128]
    - [36, 4.756]
  - - [5888, 128, 1, 32, 5888, 5888, 32, 128]
    - [36, 5.438]
  - - [6784, 128, 1, 32, 6784, 6784, 32, 128]
    - [36, 6.501]
  - - [64, 256, 1, 32, 64, 64, 32, 256]
    - [43, 0.093]
  - - [128, 256, 1, 32, 128, 128, 32, 256]
    - [39, 0.216]
  - - [256, 256, 1, 32, 256, 256, 32, 256]
    - [39, 0.41]
  - - [448, 256, 1, 32, 448, 448, 32, 256]
    - [40, 0.716]
  - - [704, 256, 1, 32, 704, 704, 32, 256]
    - [36, 1.12]
  - - [1024, 256, 1, 32, 1024, 1024, 32, 256]
    - [36, 1.518]
  - - [1408, 256, 1, 32, 1408, 1408, 32, 256]
    - [47, 1.953]
  - - [1856, 256, 1, 32, 1856, 1856, 32, 256]
    - [36, 3.534]
  - - [2368, 256, 1, 32, 2368, 2368, 32, 256]
    - [36, 4.624]
  - - [2944, 256, 1, 32, 2944, 2944, 32, 256]
    - [36, 5.75]
  - - [3584, 256, 1, 32, 3584, 3584, 32, 256]
    - [36, 6.352]
  - - [4288, 256, 1, 32, 4288, 4288, 32, 256]
    - [40, 6.921]
  - - [5056, 256, 1, 32, 5056, 5056, 32, 256]
    - [40, 7.993]
  - - [5888, 256, 1, 32, 5888, 5888, 32, 256]
    - [43, 8.478]
  - - [6784, 256, 1, 32, 6784, 6784, 32, 256]
    - [40, 9.631]
  - - [64, 448, 1, 32, 64, 64, 32, 448]
    - [40, 0.171]
  - - [128, 448, 1, 32, 128, 128, 32, 448]
    - [42, 0.422]
  - - [256, 448, 1, 32, 256, 256, 32, 448]
    - [43, 0.713]
  - - [448, 448, 1, 32, 448, 448, 32, 448]
    - [39, 1.234]
  - - [704, 448, 1, 32, 704, 704, 32, 448]
    - [47, 1.71]
  - - [1024, 448, 1, 32, 1024, 1024, 32, 448]
    - [40, 3.177]
  - - [1408, 448, 1, 32, 1408, 1408, 32, 448]
    - [36, 4.693]
  - - [1856, 448, 1, 32, 1856, 1856, 32, 448]
    - [36, 6.265]
  - - [2368, 448, 1, 32, 2368, 2368, 32, 448]
    - [36, 7.304]
  - - [2944, 448, 1, 32, 2944, 2944, 32, 448]
    - [36, 8.271]
  - - [3584, 448, 1, 32, 3584, 3584, 32, 448]
    - [36, 8.987]
  - - [4288, 448, 1, 32, 4288, 4288, 32, 448]
    - [36, 9.67]
  - - [5056, 448, 1, 32, 5056, 5056, 32, 448]
    - [40, 10.517]
  - - [5888, 448, 1, 32, 5888, 5888, 32, 448]
    - [40, 11.206]
  - - [6784, 448, 1, 32, 6784, 6784, 32, 448]
    - [40, 12.218]
  - - [64, 704, 1, 32, 64, 64, 32, 704]
    - [36, 0.276]
  - - [128, 704, 1, 32, 128, 128, 32, 704]
    - [39, 0.587]
  - - [256, 704, 1, 32, 256, 256, 32, 704]
    - [39, 1.174]
  - - [448, 704, 1, 32, 448, 448, 32, 704]
    - [36, 1.818]
  - - [704, 704, 1, 32, 704, 704, 32, 704]
    - [36, 4.04]
  - - [1024, 704, 1, 32, 1024, 1024, 32, 704]
    - [36, 5.396]
  - - [1408, 704, 1, 32, 1408, 1408, 32, 704]
    - [36, 6.669]
  - - [1856, 704, 1, 32, 1856, 1856, 32, 704]
    - [36, 7.711]
  - - [2368, 704, 1, 32, 2368, 2368, 32, 704]
    - [36, 9.601]
  - - [2944, 704, 1, 32, 2944, 2944, 32, 704]
    - [43, 9.814]
  - - [3584, 704, 1, 32, 3584, 3584, 32, 704]
    - [40, 11.071]
  - - [4288, 704, 1, 32, 4288, 4288, 32, 704]
    - [43, 11.739]
  - - [5056, 704, 1, 32, 5056, 5056, 32, 704]
    - [40, 12.961]
  - - [5888, 704, 1, 32, 5888, 5888, 32, 704]
    - [40, 13.494]
  - - [6784, 704, 1, 32, 6784, 6784, 32, 704]
    - [40, 14.021]
  - - [64, 1024, 1, 32, 64, 64, 32, 1024]
    - [40, 0.395]
  - - [128, 1024, 1, 32, 128, 128, 32, 1024]
    - [36, 0.844]
  - - [256, 1024, 1, 32, 256, 256, 32, 1024]
    - [36, 1.611]
  - - [448, 1024, 1, 32, 448, 448, 32, 1024]
    - [36, 3.522]
  - - [704, 1024, 1, 32, 704, 704, 32, 1024]
    - [36, 4.905]
  - - [1024, 1024, 1, 32, 1024, 1024, 32, 1024]
    - [36, 6.903]
  - - [1408, 1024, 1, 32, 1408, 1408, 32, 1024]
    - [36, 8.304]
  - - [1856, 1024, 1, 32, 1856, 1856, 32, 1024]
    - [36, 9.897]
  - - [2368, 1024, 1, 32, 2368, 2368, 32, 1024]
    - [43, 11.002]
  - - [2944, 1024, 1, 32, 2944, 2944, 32, 1024]
    - [40, 12.326]
  - - [3584, 1024, 1, 32, 3584, 3584, 32, 1024]
    - [40, 13.045]
  - - [4288, 1024, 1, 32, 4288, 4288, 32, 1024]
    - [40, 13.988]
  - - [5056, 1024, 1, 32, 5056, 5056, 32, 1024]
    - [43, 14.389]
  - - [5888, 1024, 1, 32, 5888, 5888, 32, 1024]
    - [40, 14.83]
  - - [6784, 1024, 1, 32, 6784, 6784, 32, 1024]
    - [40, 15.186]
  - - [64, 1408, 1, 32, 64, 64, 32, 1408]
    - [48, 0.719]
  - - [128, 1408, 1, 32, 128, 128, 32, 1408]
    - [36, 1.129]
  - - [256, 1408, 1, 32, 256, 256, 32, 1408]
    - [45, 2.009]
  - - [448, 1408, 1, 32, 448, 448, 32, 1408]
    - [36, 4.812]
  - - [704, 1408, 1, 32, 704, 704, 32, 1408]
    - [43, 6.184]
  - - [1024, 1408, 1, 32, 1024, 1024, 32, 1408]
    - [36, 8.262]
  - - [1408, 1408, 1, 32, 1408, 1408, 32, 1408]
    - [36, 10.062]
  - - [1856, 1408, 1, 32, 1856, 1856, 32, 1408]
    - [36, 11.221]
  - - [2368, 1408, 1, 32, 2368, 2368, 32, 1408]
    - [43, 12.76]
  - - [2944, 1408, 1, 32, 2944, 2944, 32, 1408]
    - [43, 13.641]
  - - [3584, 1408, 1, 32, 3584, 3584, 32, 1408]
    - [40, 14.53]
  - - [4288, 1408, 1, 32, 4288, 4288, 32, 1408]
    - [40, 14.851]
  - - [5056, 1408, 1, 32, 5056, 5056, 32, 1408]
    - [43, 15.476]
  - - [5888, 1408, 1, 32, 5888, 5888, 32, 1408]
    - [40, 16.018]
  - - [6784, 1408, 1, 32, 6784, 6784, 32, 1408]
    - [40, 16.231]
  - - [64, 1856, 1, 32, 64, 64, 32, 1856]
    - [39, 0.734]
  - - [128, 1856, 1, 32, 128, 128, 32, 1856]
    - [39, 1.539]
  - - [256, 1856, 1, 32, 256, 256, 32, 1856]
    - [36, 3.408]
  - - [448, 1856, 1, 32, 448, 448, 32, 1856]
    - [36, 6.037]
  - - [704, 1856, 1, 32, 704, 704, 32, 1856]
    - [36, 8.238]
  - - [1024, 1856, 1, 32, 1024, 1024, 32, 1856]
    - [36, 9.406]
  - - [1408, 1856, 1, 32, 1408, 1408, 32, 1856]
    - [43, 11.14]
  - - [1856, 1856, 1, 32, 1856, 1856, 32, 1856]
    - [40, 12.934]
  - - [2368, 1856, 1, 32, 2368, 2368, 32, 1856]
    - [40, 13.569]
  - - [2944, 1856, 1, 32, 2944, 2944, 32, 1856]
    - [43, 14.644]
  - - [3584, 1856, 1, 32, 3584, 3584, 32, 1856]
    - [40, 15.294]
  - - [4288, 1856, 1, 32, 4288, 4288, 32, 1856]
    - [40, 16.129]
  - - [5056, 1856, 1, 32, 5056, 5056, 32, 1856]
    - [40, 16.483]
  - - [5888, 1856, 1, 32, 5888, 5888, 32, 1856]
    - [40, 16.782]
  - - [6784, 1856, 1, 32, 6784, 6784, 32, 1856]
    - [43, 17.061]
  - - [64, 2368, 1, 32, 64, 64, 32, 2368]
    - [39, 0.94]
  - - [128, 2368, 1, 32, 128, 128, 32, 2368]
    - [36, 1.713]
  - - [256, 2368, 1, 32, 256, 256, 32, 2368]
    - [36, 4.777]
  - - [448, 2368, 1, 32, 448, 448, 32, 2368]
    - [43, 6.585]
  - - [704, 2368, 1, 32, 704, 704, 32, 2368]
    - [36, 9.119]
  - - [1024, 2368, 1, 32, 1024, 1024, 32, 2368]
    - [43, 11.215]
  - - [1408, 2368, 1, 32, 1408, 1408, 32, 2368]
    - [40, 12.521]
  - - [1856, 2368, 1, 32, 1856, 1856, 32, 2368]
    - [40, 13.964]
  - - [2368, 2368, 1, 32, 2368, 2368, 32, 2368]
    - [40, 14.635]
  - - [2944, 2368, 1, 32, 2944, 2944, 32, 2368]
    - [40, 15.24]
  - - [3584, 2368, 1, 32, 3584, 3584, 32, 2368]
    - [43, 16.111]
  - - [4288, 2368, 1, 32, 4288, 4288, 32, 2368]
    - [43, 16.483]
  - - [5056, 2368, 1, 32, 5056, 5056, 32, 2368]
    - [40, 16.992]
  - - [5888, 2368, 1, 32, 5888, 5888, 32, 2368]
    - [43, 17.061]
  - - [6784, 2368, 1, 32, 6784, 6784, 32, 2368]
    - [40, 17.213]
  - - [64, 2944, 1, 32, 64, 64, 32, 2944]
    - [39, 1.168]
  - - [128, 2944, 1, 32, 128, 128, 32, 2944]
    - [45, 2.108]
  - - [256, 2944, 1, 32, 256, 256, 32, 2944]
    - [36, 5.405]
  - - [448, 2944, 1, 32, 448, 448, 32, 2944]
    - [36, 7.669]
  - - [704, 2944, 1, 32, 704, 704, 32, 2944]
    - [36, 9.852]
  - - [1024, 2944, 1, 32, 1024, 1024, 32, 2944]
    - [43, 11.841]
  - - [1408, 2944, 1, 32, 1408, 1408, 32, 2944]
    - [40, 13.102]
  - - [1856, 2944, 1, 32, 1856, 1856, 32, 2944]
    - [40, 14.324]
  - - [2368, 2944, 1, 32, 2368, 2368, 32, 2944]
    - [38, 15.018]
  - - [2944, 2944, 1, 32, 2944, 2944, 32, 2944]
    - [43, 16.072]
  - - [3584, 2944, 1, 32, 3584, 3584, 32, 2944]
    - [40, 16.564]
  - - [4288, 2944, 1, 32, 4288, 4288, 32, 2944]
    - [40, 16.971]
  - - [5056, 2944, 1, 32, 5056, 5056, 32, 2944]
    - [40, 17.228]
  - - [5888, 2944, 1, 32, 5888, 5888, 32, 2944]
    - [40, 17.522]
  - - [6784, 2944, 1, 32, 6784, 6784, 32, 2944]
    - [41, 17.947]
  - - [64, 3584, 1, 32, 64, 64, 32, 3584]
    - [36, 1.396]
  - - [128, 3584, 1, 32, 128, 128, 32, 3584]
    - [43, 3.896]
  - - [256, 3584, 1, 32, 256, 256, 32, 3584]
    - [43, 7.229]
  - - [448, 3584, 1, 32, 448, 448, 32, 3584]
    - [40, 10.122]
  - - [704, 3584, 1, 32, 704, 704, 32, 3584]
    - [40, 11.76]
  - - [1024, 3584, 1, 32, 1024, 1024, 32, 3584]
    - [43, 13.695]
  - - [1408, 3584, 1, 32, 1408, 1408, 32, 3584]
    - [40, 14.961]
  - - [1856, 3584, 1, 32, 1856, 1856, 32, 3584]
    - [40, 15.842]
  - - [2368, 3584, 1, 32, 2368, 2368, 32, 3584]
    - [43, 16.45]
  - - [2944, 3584, 1, 32, 2944, 2944, 32, 3584]
    - [43, 16.965]
  - - [3584, 3584, 1, 32, 3584, 3584, 32, 3584]
    - [43, 17.309]
  - - [4288, 3584, 1, 32, 4288, 4288, 32, 3584]
    - [41, 17.719]
  - - [5056, 3584, 1, 32, 5056, 5056, 32, 3584]
    - [40, 17.851]
  - - [5888, 3584, 1, 32, 5888, 5888, 32, 3584]
    - [41, 18.109]
  - - [6784, 3584, 1, 32, 6784, 6784, 32, 3584]
    - [41, 18.399]
  - - [64, 4288, 1, 32, 64, 64, 32, 4288]
    - [39, 1.635]
  - - [128, 4288, 1, 32, 128, 128, 32, 4288]
    - [43, 4.597]
  - - [256, 4288, 1, 32, 256, 256, 32, 4288]
    - [43, 8.376]
  - - [448, 4288, 1, 32, 448, 448, 32, 4288]
    - [40, 10.46]
  - - [704, 4288, 1, 32, 704, 704, 32, 4288]
    - [40, 12.47]
  - - [1024, 4288, 1, 32, 1024, 1024, 32, 4288]
    - [40, 13.913]
  - - [1408, 4288, 1, 32, 1408, 1408, 32, 4288]
    - [40, 15.291]
  - - [1856, 4288, 1, 32, 1856, 1856, 32, 4288]
    - [43, 16.102]
  - - [2368, 4288, 1, 32, 2368, 2368, 32, 4288]
    - [43, 16.617]
  - - [2944, 4288, 1, 32, 2944, 2944, 32, 4288]
    - [40, 17.127]
  - - [3584, 4288, 1, 32, 3584, 3584, 32, 4288]
    - [40, 17.666]
  - - [4288, 4288, 1, 32, 4288, 4288, 32, 4288]
    - [43, 17.893]
  - - [5056, 4288, 1, 32, 5056, 5056, 32, 4288]
    - [41, 17.998]
  - - [5888, 4288, 1, 32, 5888, 5888, 32, 4288]
    - [40, 18.208]
  - - [6784, 4288, 1, 32, 6784, 6784, 32, 4288]
    - [41, 18.312]
  - - [64, 5056, 1, 32, 64, 64, 32, 5056]
    - [40, 1.821]
  - - [128, 5056, 1, 32, 128, 128, 32, 5056]
    - [43, 5.133]
  - - [256, 5056, 1, 32, 256, 256, 32, 5056]
    - [40, 8.712]
  - - [448, 5056, 1, 32, 448, 448, 32, 5056]
    - [43, 11.167]
  - - [704, 5056, 1, 32, 704, 704, 32, 5056]
    - [43, 13.281]
  - - [1024, 5056, 1, 32, 1024, 1024, 32, 5056]
    - [40, 14.291]
  - - [1408, 5056, 1, 32, 1408, 1408, 32, 5056]
    - [40, 15.791]
  - - [1856, 5056, 1, 32, 1856, 1856, 32, 5056]
    - [43, 16.602]
  - - [2368, 5056, 1, 32, 2368, 2368, 32, 5056]
    - [43, 17.136]
  - - [2944, 5056, 1, 32, 2944, 2944, 32, 5056]
    - [43, 17.69]
  - - [3584, 5056, 1, 32, 3584, 3584, 32, 5056]
    - [40, 17.908]
  - - [4288, 5056, 1, 32, 4288, 4288, 32, 5056]
    - [40, 18.187]
  - - [5056, 5056, 1, 32, 5056, 5056, 32, 5056]
    - [43, 18.282]
  - - [5888, 5056, 1, 32, 5888, 5888, 32, 5056]
    - [41, 18.411]
  - - [6784, 5056, 1, 32, 6784, 6784, 32, 5056]
    - [44, 18.375]
  - - [64, 5888, 1, 32, 64, 64, 32, 5888]
    - [40, 2.06]
  - - [128, 5888, 1, 32, 128, 128, 32, 5888]
    - [43, 6.184]
  - - [256, 5888, 1, 32, 256, 256, 32, 5888]
    - [43, 9.553]
  - - [448, 5888, 1, 32, 448, 448, 32, 5888]
    - [40, 12.152]
  - - [704, 5888, 1, 32, 704, 704, 32, 5888]
    - [43, 13.988]
  - - [1024, 5888, 1, 32, 1024, 1024, 32, 5888]
    - [40, 15.237]
  - - [1408, 5888, 1, 32, 1408, 1408, 32, 5888]
    - [41, 16.225]
  - - [1856, 5888, 1, 32, 1856, 1856, 32, 5888]
    - [40, 17.112]
  - - [2368, 5888, 1, 32, 2368, 2368, 32, 5888]
    - [41, 17.507]
  - - [2944, 5888, 1, 32, 2944, 2944, 32, 5888]
    - [41, 17.977]
  - - [3584, 5888, 1, 32, 3584, 3584, 32, 5888]
    - [41, 18.211]
  - - [4288, 5888, 1, 32, 4288, 4288, 32, 5888]
    - [40, 18.375]
  - - [5056, 5888, 1, 32, 5056, 5056, 32, 5888]
    - [41, 18.582]
  - - [5888, 5888, 1, 32, 5888, 5888, 32, 5888]
    - [41, 18.723]
  - - [6784, 5888, 1, 32, 6784, 6784, 32, 5888]
    - [41, 18.905]
  - - [64, 6784, 1, 32, 64, 64, 32, 6784]
    - [43, 3.333]
  - - [128, 6784, 1, 32, 128, 128, 32, 6784]
    - [40, 6.501]
  - - [256, 6784, 1, 32, 256, 256, 32, 6784]
    - [43, 9.858]
  - - [448, 6784, 1, 32, 448, 448, 32, 6784]
    - [43, 12.641]
  - - [704, 6784, 1, 32, 704, 704, 32, 6784]
    - [43, 14.41]
  - - [1024, 6784, 1, 32, 1024, 1024, 32, 6784]
    - [40, 15.761]
  - - [1408, 6784, 1, 32, 1408, 1408, 32, 6784]
    - [41, 16.752]
  - - [1856, 6784, 1, 32, 1856, 1856, 32, 6784]
    - [41, 17.456]
  - - [2368, 6784, 1, 32, 2368, 2368, 32, 6784]
    - [38, 17.672]
  - - [2944, 6784, 1, 32, 2944, 2944, 32, 6784]
    - [41, 18.097]
  - - [3584, 6784, 1, 32, 3584, 3584, 32, 6784]
    - [41, 18.399]
  - - [4288, 6784, 1, 32, 4288, 4288, 32, 6784]
    - [41, 18.645]
  - - [5056, 6784, 1, 32, 5056, 5056, 32, 6784]
    - [41, 18.762]
  - - [5888, 6784, 1, 32, 5888, 5888, 32, 6784]
    - [41, 18.905]
  - - [6784, 6784, 1, 32, 6784, 6784, 32, 6784]
    - [41, 19.043]
  - - [32, 32, 1, 256, 32, 32, 256, 32]
    - [40, 0.021]
  - - [32, 32, 1, 1280, 32, 32, 1280, 32]
    - [40, 0.027]
  - - [32, 32, 1, 3328, 32, 32, 3328, 32]
    - [40, 0.027]
  - - [32, 64, 1, 32, 32, 32, 32, 64]
    - [36, 0.012]
  - - [32, 128, 1, 32, 32, 32, 32, 128]
    - [39, 0.027]
  - - [32, 256, 1, 32, 32, 32, 32, 256]
    - [39, 0.078]
  - - [32, 448, 1, 32, 32, 32, 32, 448]
    - [39, 0.114]
  - - [32, 704, 1, 32, 32, 32, 32, 704]
    - [43, 0.198]
  - - [32, 1024, 1, 32, 32, 32, 32, 1024]
    - [36, 0.243]
  - - [32, 1408, 1, 32, 32, 32, 32, 1408]
    - [43, 0.347]
  - - [32, 1856, 1, 32, 32, 32, 32, 1856]
    - [40, 0.446]
  - - [32, 2368, 1, 32, 32, 32, 32, 2368]
    - [39, 0.578]
  - - [32, 2944, 1, 32, 32, 32, 32, 2944]
    - [39, 0.716]
  - - [32, 3584, 1, 32, 32, 32, 32, 3584]
    - [39, 0.886]
  - - [32, 4288, 1, 32, 32, 32, 32, 4288]
    - [43, 1.021]
  - - [32, 5056, 1, 32, 32, 32, 32, 5056]
    - [43, 1.147]
  - - [32, 5888, 1, 32, 32, 32, 32, 5888]
    - [36, 1.195]
  - - [32, 6784, 1, 32, 32, 32, 32, 6784]
    - [47, 1.857]
  - - [64, 32, 1, 32, 64, 64, 32, 32]
    - [36, 0.012]
  - - [128, 32, 1, 32, 128, 128, 32, 32]
    - [43, 0.03]
  - - [256, 32, 1, 32, 256, 256, 32, 32]
    - [36, 0.063]
  - - [448, 32, 1, 32, 448, 448, 32, 32]
    - [40, 0.108]
  - - [704, 32, 1, 32, 704, 704, 32, 32]
    - [40, 0.165]
  - - [1024, 32, 1, 32, 1024, 1024, 32, 32]
    - [40, 0.234]
  - - [1408, 32, 1, 32, 1408, 1408, 32, 32]
    - [39, 0.326]
  - - [1856, 32, 1, 32, 1856, 1856, 32, 32]
    - [39, 0.44]
  - - [2368, 32, 1, 32, 2368, 2368, 32, 32]
    - [39, 0.542]
  - - [2944, 32, 1, 32, 2944, 2944, 32, 32]
    - [36, 0.683]
  - - [3584, 32, 1, 32, 3584, 3584, 32, 32]
    - [39, 0.859]
  - - [4288, 32, 1, 32, 4288, 4288, 32, 32]
    - [43, 0.985]
  - - [5056, 32, 1, 32, 5056, 5056, 32, 32]
    - [43, 1.09]
  - - [5888, 32, 1, 32, 5888, 5888, 32, 32]
    - [43, 1.141]
  - - [6784, 32, 1, 32, 6784, 6784, 32, 32]
    - [39, 1.794]
  - - [1, 1, 1, 1, 1, 1, 1, 1]
    - [52, 0.0]
  - - [1, 64, 1, 256, 1, 1, 256, 64]
    - [60, 0.001]
  - - [1, 128, 1, 256, 1, 1, 256, 128]
    - [52, 0.003]
  - - [1, 256, 1, 256, 1, 1, 256, 256]
    - [60, 0.006]
  - - [1, 448, 1, 256, 1, 1, 256, 448]
    - [60, 0.009]
  - - [1, 704, 1, 256, 1, 1, 256, 704]
    - [60, 0.015]
  - - [1, 1024, 1, 256, 1, 1, 256, 1024]
    - [60, 0.021]
  - - [1, 1408, 1, 256, 1, 1, 256, 1408]
    - [60, 0.03]
  - - [1, 1856, 1, 256, 1, 1, 256, 1856]
    - [63, 0.039]
  - - [1, 2368, 1, 256, 1, 1, 256, 2368]
    - [60, 0.048]
  - - [1, 2944, 1, 256, 1, 1, 256, 2944]
    - [60, 0.06]
  - - [1, 3584, 1, 256, 1, 1, 256, 3584]
    - [60, 0.072]
  - - [1, 4288, 1, 256, 1, 1, 256, 4288]
    - [60, 0.087]
  - - [1, 5056, 1, 256, 1, 1, 256, 5056]
    - [60, 0.096]
  - - [1, 5888, 1, 256, 1, 1, 256, 5888]
    - [60, 0.108]
  - - [1, 6784, 1, 256, 1, 1, 256, 6784]
    - [60, 0.147]
  - - [1, 64, 1, 1280, 1, 1, 1280, 64]
    - [60, 0.003]
  - - [1, 128, 1, 1280, 1, 1, 1280, 128]
    - [52, 0.003]
  - - [1, 256, 1, 1280, 1, 1, 1280, 256]
    - [54, 0.006]
  - - [1, 448, 1, 1280, 1, 1, 1280, 448]
    - [60, 0.012]
  - - [1, 704, 1, 1280, 1, 1, 1280, 704]
    - [60, 0.021]
  - - [1, 1024, 1, 1280, 1, 1, 1280, 1024]
    - [60, 0.03]
  - - [1, 1408, 1, 1280, 1, 1, 1280, 1408]
    - [60, 0.039]
  - - [1, 1856, 1, 1280, 1, 1, 1280, 1856]
    - [60, 0.051]
  - - [1, 2368, 1, 1280, 1, 1, 1280, 2368]
    - [60, 0.066]
  - - [1, 2944, 1, 1280, 1, 1, 1280, 2944]
    - [60, 0.081]
  - - [1, 3584, 1, 1280, 1, 1, 1280, 3584]
    - [60, 0.099]
  - - [1, 4288, 1, 1280, 1, 1, 1280, 4288]
    - [60, 0.12]
  - - [1, 5056, 1, 1280, 1, 1, 1280, 5056]
    - [60, 0.141]
  - - [1, 5888, 1, 1280, 1, 1, 1280, 5888]
    - [60, 0.162]
  - - [1, 6784, 1, 1280, 1, 1, 1280, 6784]
    - [63, 0.195]
  - - [1, 64, 1, 3328, 1, 1, 3328, 64]
    - [60, 0.003]
  - - [1, 128, 1, 3328, 1, 1, 3328, 128]
    - [52, 0.003]
  - - [1, 256, 1, 3328, 1, 1, 3328, 256]
    - [60, 0.009]
  - - [1, 448, 1, 3328, 1, 1, 3328, 448]
    - [60, 0.012]
  - - [1, 704, 1, 3328, 1, 1, 3328, 704]
    - [60, 0.021]
  - - [1, 1024, 1, 3328, 1, 1, 3328, 1024]
    - [60, 0.03]
  - - [1, 1408, 1, 3328, 1, 1, 3328, 1408]
    - [60, 0.042]
  - - [1, 1856, 1, 3328, 1, 1, 3328, 1856]
    - [60, 0.054]
  - - [1, 2368, 1, 3328, 1, 1, 3328, 2368]
    - [60, 0.069]
  - - [1, 2944, 1, 3328, 1, 1, 3328, 2944]
    - [60, 0.087]
  - - [1, 3584, 1, 3328, 1, 1, 3328, 3584]
    - [60, 0.108]
  - - [1, 4288, 1, 3328, 1, 1, 3328, 4288]
    - [60, 0.126]
  - - [1, 5056, 1, 3328, 1, 1, 3328, 5056]
    - [60, 0.15]
  - - [1, 5888, 1, 3328, 1, 1, 3328, 5888]
    - [60, 0.174]
  - - [1, 6784, 1, 3328, 1, 1, 3328, 6784]
    - [60, 0.201]
  - - [64, 1, 1, 256, 64, 64, 256, 1]
    - [65, 0.003]
  - - [128, 1, 1, 256, 128, 128, 256, 1]
    - [52, 0.003]
  - - [256, 1, 1, 256, 256, 256, 256, 1]
    - [54, 0.006]
  - - [448, 1, 1, 256, 448, 448, 256, 1]
    - [54, 0.009]
  - - [704, 1, 1, 256, 704, 704, 256, 1]
    - [60, 0.015]
  - - [1024, 1, 1, 256, 1024, 1024, 256, 1]
    - [60, 0.021]
  - - [1408, 1, 1, 256, 1408, 1408, 256, 1]
    - [60, 0.03]
  - - [1856, 1, 1, 256, 1856, 1856, 256, 1]
    - [60, 0.039]
  - - [2368, 1, 1, 256, 2368, 2368, 256, 1]
    - [63, 0.051]
  - - [2944, 1, 1, 256, 2944, 2944, 256, 1]
    - [63, 0.063]
  - - [3584, 1, 1, 256, 3584, 3584, 256, 1]
    - [60, 0.075]
  - - [4288, 1, 1, 256, 4288, 4288, 256, 1]
    - [60, 0.09]
  - - [5056, 1, 1, 256, 5056, 5056, 256, 1]
    - [60, 0.105]
  - - [5888, 1, 1, 256, 5888, 5888, 256, 1]
    - [63, 0.12]
  - - [6784, 1, 1, 256, 6784, 6784, 256, 1]
    - [63, 0.156]
  - - [64, 1, 1, 1280, 64, 64, 1280, 1]
    - [60, 0.003]
  - - [128, 1, 1, 1280, 128, 128, 1280, 1]
    - [52, 0.003]
  - - [256, 1, 1, 1280, 256, 256, 1280, 1]
    - [54, 0.006]
  - - [448, 1, 1, 1280, 448, 448, 1280, 1]
    - [60, 0.012]
  - - [704, 1, 1, 1280, 704, 704, 1280, 1]
    - [60, 0.021]
  - - [1024, 1, 1, 1280, 1024, 1024, 1280, 1]
    - [60, 0.03]
  - - [1408, 1, 1, 1280, 1408, 1408, 1280, 1]
    - [60, 0.039]
  - - [1856, 1, 1, 1280, 1856, 1856, 1280, 1]
    - [60, 0.051]
  - - [2368, 1, 1, 1280, 2368, 2368, 1280, 1]
    - [60, 0.066]
  - - [2944, 1, 1, 1280, 2944, 2944, 1280, 1]
    - [60, 0.084]
  - - [3584, 1, 1, 1280, 3584, 3584, 1280, 1]
    - [60, 0.102]
  - - [4288, 1, 1, 1280, 4288, 4288, 1280, 1]
    - [60, 0.12]
  - - [5056, 1, 1, 1280, 5056, 5056, 1280, 1]
    - [60, 0.141]
  - - [5888, 1, 1, 1280, 5888, 5888, 1280, 1]
    - [60, 0.165]
  - - [6784, 1, 1, 1280, 6784, 6784, 1280, 1]
    - [64, 0.192]
  - - [64, 1, 1, 3328, 64, 64, 3328, 1]
    - [60, 0.003]
  - - [128, 1, 1, 3328, 128, 128, 3328, 1]
    - [52, 0.003]
  - - [256, 1, 1, 3328, 256, 256, 3328, 1]
    - [60, 0.009]
  - - [448, 1, 1, 3328, 448, 448, 3328, 1]
    - [60, 0.012]
  - - [704, 1, 1, 3328, 704, 704, 3328, 1]
    - [60, 0.021]
  - - [1024, 1, 1, 3328, 1024, 1024, 3328, 1]
    - [60, 0.03]
  - - [1408, 1, 1, 3328, 1408, 1408, 3328, 1]
    - [60, 0.042]
  - - [1856, 1, 1, 3328, 1856, 1856, 3328, 1]
    - [60, 0.054]
  - - [2368, 1, 1, 3328, 2368, 2368, 3328, 1]
    - [60, 0.069]
  - - [2944, 1, 1, 3328, 2944, 2944, 3328, 1]
    - [60, 0.087]
  - - [3584, 1, 1, 3328, 3584, 3584, 3328, 1]
    - [60, 0.108]
  - - [4288, 1, 1, 3328, 4288, 4288, 3328, 1]
    - [60, 0.129]
  - - [5056, 1, 1, 3328, 5056, 5056, 3328, 1]
    - [60, 0.15]
  - - [5888, 1, 1, 3328, 5888, 5888, 3328, 1]
    - [60, 0.174]
  - - [6784, 1, 1, 3328, 6784, 6784, 3328, 1]
    - [60, 0.204]
  - - [64, 64, 1, 1, 64, 64, 1, 64]
    - [65, 0.001]
  - - [128, 64, 1, 1, 128, 128, 1, 64]
    - [51, 0.003]
  - - [256, 64, 1, 1, 256, 256, 1, 64]
    - [52, 0.006]
  - - [448, 64, 1, 1, 448, 448, 1, 64]
    - [50, 0.006]
  - - [704, 64, 1, 1, 704, 704, 1, 64]
    - [52, 0.012]
  - - [1024, 64, 1, 1, 1024, 1024, 1, 64]
    - [54, 0.018]
  - - [1408, 64, 1, 1, 1408, 1408, 1, 64]
    - [54, 0.024]
  - - [1856, 64, 1, 1, 1856, 1856, 1, 64]
    - [54, 0.03]
  - - [2368, 64, 1, 1, 2368, 2368, 1, 64]
    - [52, 0.039]
  - - [2944, 64, 1, 1, 2944, 2944, 1, 64]
    - [52, 0.048]
  - - [3584, 64, 1, 1, 3584, 3584, 1, 64]
    - [54, 0.06]
  - - [4288, 64, 1, 1, 4288, 4288, 1, 64]
    - [52, 0.066]
  - - [5056, 64, 1, 1, 5056, 5056, 1, 64]
    - [62, 0.075]
  - - [5888, 64, 1, 1, 5888, 5888, 1, 64]
    - [52, 0.084]
  - - [6784, 64, 1, 1, 6784, 6784, 1, 64]
    - [52, 0.159]
  - - [64, 128, 1, 1, 64, 64, 1, 128]
    - [65, 0.006]
  - - [128, 128, 1, 1, 128, 128, 1, 128]
    - [57, 0.009]
  - - [256, 128, 1, 1, 256, 256, 1, 128]
    - [52, 0.009]
  - - [448, 128, 1, 1, 448, 448, 1, 128]
    - [52, 0.015]
  - - [704, 128, 1, 1, 704, 704, 1, 128]
    - [52, 0.021]
  - - [1024, 128, 1, 1, 1024, 1024, 1, 128]
    - [54, 0.033]
  - - [1408, 128, 1, 1, 1408, 1408, 1, 128]
    - [52, 0.045]
  - - [1856, 128, 1, 1, 1856, 1856, 1, 128]
    - [54, 0.06]
  - - [2368, 128, 1, 1, 2368, 2368, 1, 128]
    - [52, 0.078]
  - - [2944, 128, 1, 1, 2944, 2944, 1, 128]
    - [56, 0.099]
  - - [3584, 128, 1, 1, 3584, 3584, 1, 128]
    - [54, 0.165]
  - - [4288, 128, 1, 1, 4288, 4288, 1, 128]
    - [52, 0.201]
  - - [5056, 128, 1, 1, 5056, 5056, 1, 128]
    - [54, 0.234]
  - - [5888, 128, 1, 1, 5888, 5888, 1, 128]
    - [54, 0.273]
  - - [6784, 128, 1, 1, 6784, 6784, 1, 128]
    - [57, 0.311]
  - - [64, 256, 1, 1, 64, 64, 1, 256]
    - [50, 0.003]
  - - [128, 256, 1, 1, 128, 128, 1, 256]
    - [56, 0.012]
  - - [256, 256, 1, 1, 256, 256, 1, 256]
    - [59, 0.021]
  - - [448, 256, 1, 1, 448, 448, 1, 256]
    - [56, 0.03]
  - - [704, 256, 1, 1, 704, 704, 1, 256]
    - [52, 0.045]
  - - [1024, 256, 1, 1, 1024, 1024, 1, 256]
    - [52, 0.066]
  - - [1408, 256, 1, 1, 1408, 1408, 1, 256]
    - [56, 0.09]
  - - [1856, 256, 1, 1, 1856, 1856, 1, 256]
    - [63, 0.168]
  - - [2368, 256, 1, 1, 2368, 2368, 1, 256]
    - [54, 0.219]
  - - [2944, 256, 1, 1, 2944, 2944, 1, 256]
    - [52, 0.273]
  - - [3584, 256, 1, 1, 3584, 3584, 1, 256]
    - [52, 0.314]
  - - [4288, 256, 1, 1, 4288, 4288, 1, 256]
    - [52, 0.344]
  - - [5056, 256, 1, 1, 5056, 5056, 1, 256]
    - [57, 0.422]
  - - [5888, 256, 1, 1, 5888, 5888, 1, 256]
    - [55, 0.461]
  - - [6784, 256, 1, 1, 6784, 6784, 1, 256]
    - [57, 0.512]
  - - [64, 448, 1, 1, 64, 64, 1, 448]
    - [52, 0.006]
  - - [128, 448, 1, 1, 128, 128, 1, 448]
    - [59, 0.018]
  - - [256, 448, 1, 1, 256, 256, 1, 448]
    - [56, 0.03]
  - - [448, 448, 1, 1, 448, 448, 1, 448]
    - [52, 0.048]
  - - [704, 448, 1, 1, 704, 704, 1, 448]
    - [56, 0.078]
  - - [1024, 448, 1, 1, 1024, 1024, 1, 448]
    - [52, 0.168]
  - - [1408, 448, 1, 1, 1408, 1408, 1, 448]
    - [54, 0.231]
  - - [1856, 448, 1, 1, 1856, 1856, 1, 448]
    - [52, 0.287]
  - - [2368, 448, 1, 1, 2368, 2368, 1, 448]
    - [54, 0.35]
  - - [2944, 448, 1, 1, 2944, 2944, 1, 448]
    - [52, 0.425]
  - - [3584, 448, 1, 1, 3584, 3584, 1, 448]
    - [54, 0.461]
  - - [4288, 448, 1, 1, 4288, 4288, 1, 448]
    - [55, 0.518]
  - - [5056, 448, 1, 1, 5056, 5056, 1, 448]
    - [54, 0.578]
  - - [5888, 448, 1, 1, 5888, 5888, 1, 448]
    - [57, 0.662]
  - - [6784, 448, 1, 1, 6784, 6784, 1, 448]
    - [52, 0.689]
  - - [64, 704, 1, 1, 64, 64, 1, 704]
    - [52, 0.012]
  - - [128, 704, 1, 1, 128, 128, 1, 704]
    - [52, 0.024]
  - - [256, 704, 1, 1, 256, 256, 1, 704]
    - [52, 0.045]
  - - [448, 704, 1, 1, 448, 448, 1, 704]
    - [57, 0.084]
  - - [704, 704, 1, 1, 704, 704, 1, 704]
    - [52, 0.174]
  - - [1024, 704, 1, 1, 1024, 1024, 1, 704]
    - [56, 0.261]
  - - [1408, 704, 1, 1, 1408, 1408, 1, 704]
    - [54, 0.329]
  - - [1856, 704, 1, 1, 1856, 1856, 1, 704]
    - [56, 0.425]
  - - [2368, 704, 1, 1, 2368, 2368, 1, 704]
    - [54, 0.494]
  - - [2944, 704, 1, 1, 2944, 2944, 1, 704]
    - [54, 0.542]
  - - [3584, 704, 1, 1, 3584, 3584, 1, 704]
    - [54, 0.662]
  - - [4288, 704, 1, 1, 4288, 4288, 1, 704]
    - [57, 0.707]
  - - [5056, 704, 1, 1, 5056, 5056, 1, 704]
    - [54, 0.767]
  - - [5888, 704, 1, 1, 5888, 5888, 1, 704]
    - [52, 0.809]
  - - [6784, 704, 1, 1, 6784, 6784, 1, 704]
    - [57, 0.839]
  - - [64, 1024, 1, 1, 64, 64, 1, 1024]
    - [52, 0.015]
  - - [128, 1024, 1, 1, 128, 128, 1, 1024]
    - [57, 0.036]
  - - [256, 1024, 1, 1, 256, 256, 1, 1024]
    - [52, 0.069]
  - - [448, 1024, 1, 1, 448, 448, 1, 1024]
    - [54, 0.171]
  - - [704, 1024, 1, 1, 704, 704, 1, 1024]
    - [57, 0.264]
  - - [1024, 1024, 1, 1, 1024, 1024, 1, 1024]
    - [54, 0.35]
  - - [1408, 1024, 1, 1, 1408, 1408, 1, 1024]
    - [53, 0.431]
  - - [1856, 1024, 1, 1, 1856, 1856, 1, 1024]
    - [60, 0.536]
  - - [2368, 1024, 1, 1, 2368, 2368, 1, 1024]
    - [55, 0.638]
  - - [2944, 1024, 1, 1, 2944, 2944, 1, 1024]
    - [54, 0.725]
  - - [3584, 1024, 1, 1, 3584, 3584, 1, 1024]
    - [54, 0.785]
  - - [4288, 1024, 1, 1, 4288, 4288, 1, 1024]
    - [56, 0.827]
  - - [5056, 1024, 1, 1, 5056, 5056, 1, 1024]
    - [55, 0.898]
  - - [5888, 1024, 1, 1, 5888, 5888, 1, 1024]
    - [51, 0.913]
  - - [6784, 1024, 1, 1, 6784, 6784, 1, 1024]
    - [51, 0.967]
  - - [64, 1408, 1, 1, 64, 64, 1, 1408]
    - [52, 0.024]
  - - [128, 1408, 1, 1, 128, 128, 1, 1408]
    - [62, 0.048]
  - - [256, 1408, 1, 1, 256, 256, 1, 1408]
    - [52, 0.093]
  - - [448, 1408, 1, 1, 448, 448, 1, 1408]
    - [54, 0.231]
  - - [704, 1408, 1, 1, 704, 704, 1, 1408]
    - [54, 0.317]
  - - [1024, 1408, 1, 1, 1024, 1024, 1, 1408]
    - [55, 0.434]
  - - [1408, 1408, 1, 1, 1408, 1408, 1, 1408]
    - [52, 0.518]
  - - [1856, 1408, 1, 1, 1856, 1856, 1, 1408]
    - [56, 0.662]
  - - [2368, 1408, 1, 1, 2368, 2368, 1, 1408]
    - [52, 0.743]
  - - [2944, 1408, 1, 1, 2944, 2944, 1, 1408]
    - [54, 0.827]
  - - [3584, 1408, 1, 1, 3584, 3584, 1, 1408]
    - [52, 0.853]
  - - [4288, 1408, 1, 1, 4288, 4288, 1, 1408]
    - [55, 0.904]
  - - [5056, 1408, 1, 1, 5056, 5056, 1, 1408]
    - [51, 0.952]
  - - [5888, 1408, 1, 1, 5888, 5888, 1, 1408]
    - [51, 1.006]
  - - [6784, 1408, 1, 1, 6784, 6784, 1, 1408]
    - [55, 0.997]
  - - [64, 1856, 1, 1, 64, 64, 1, 1856]
    - [52, 0.033]
  - - [128, 1856, 1, 1, 128, 128, 1, 1856]
    - [52, 0.066]
  - - [256, 1856, 1, 1, 256, 256, 1, 1856]
    - [52, 0.174]
  - - [448, 1856, 1, 1, 448, 448, 1, 1856]
    - [52, 0.299]
  - - [704, 1856, 1, 1, 704, 704, 1, 1856]
    - [52, 0.422]
  - - [1024, 1856, 1, 1, 1024, 1024, 1, 1856]
    - [60, 0.524]
  - - [1408, 1856, 1, 1, 1408, 1408, 1, 1856]
    - [56, 0.674]
  - - [1856, 1856, 1, 1, 1856, 1856, 1, 1856]
    - [52, 0.746]
  - - [2368, 1856, 1, 1, 2368, 2368, 1, 1856]
    - [52, 0.815]
  - - [2944, 1856, 1, 1, 2944, 2944, 1, 1856]
    - [56, 0.871]
  - - [3584, 1856, 1, 1, 3584, 3584, 1, 1856]
    - [61, 0.883]
  - - [4288, 1856, 1, 1, 4288, 4288, 1, 1856]
    - [51, 0.931]
  - - [5056, 1856, 1, 1, 5056, 5056, 1, 1856]
    - [55, 0.991]
  - - [5888, 1856, 1, 1, 5888, 5888, 1, 1856]
    - [55, 1.03]
  - - [6784, 1856, 1, 1, 6784, 6784, 1, 1856]
    - [51, 1.036]
  - - [64, 2368, 1, 1, 64, 64, 1, 2368]
    - [52, 0.042]
  - - [128, 2368, 1, 1, 128, 128, 1, 2368]
    - [52, 0.078]
  - - [256, 2368, 1, 1, 256, 256, 1, 2368]
    - [56, 0.216]
  - - [448, 2368, 1, 1, 448, 448, 1, 2368]
    - [54, 0.35]
  - - [704, 2368, 1, 1, 704, 704, 1, 2368]
    - [54, 0.5]
  - - [1024, 2368, 1, 1, 1024, 1024, 1, 2368]
    - [56, 0.635]
  - - [1408, 2368, 1, 1, 1408, 1408, 1, 2368]
    - [56, 0.731]
  - - [1856, 2368, 1, 1, 1856, 1856, 1, 2368]
    - [57, 0.815]
  - - [2368, 2368, 1, 1, 2368, 2368, 1, 2368]
    - [55, 0.889]
  - - [2944, 2368, 1, 1, 2944, 2944, 1, 2368]
    - [54, 0.913]
  - - [3584, 2368, 1, 1, 3584, 3584, 1, 2368]
    - [54, 0.952]
  - - [4288, 2368, 1, 1, 4288, 4288, 1, 2368]
    - [51, 0.994]
  - - [5056, 2368, 1, 1, 5056, 5056, 1, 2368]
    - [51, 1.015]
  - - [5888, 2368, 1, 1, 5888, 5888, 1, 2368]
    - [51, 1.045]
  - - [6784, 2368, 1, 1, 6784, 6784, 1, 2368]
    - [55, 1.081]
  - - [64, 2944, 1, 1, 64, 64, 1, 2944]
    - [52, 0.054]
  - - [128, 2944, 1, 1, 128, 128, 1, 2944]
    - [52, 0.096]
  - - [256, 2944, 1, 1, 256, 256, 1, 2944]
    - [54, 0.281]
  - - [448, 2944, 1, 1, 448, 448, 1, 2944]
    - [54, 0.425]
  - - [704, 2944, 1, 1, 704, 704, 1, 2944]
    - [63, 0.554]
  - - [1024, 2944, 1, 1, 1024, 1024, 1, 2944]
    - [56, 0.698]
  - - [1408, 2944, 1, 1, 1408, 1408, 1, 2944]
    - [54, 0.809]
  - - [1856, 2944, 1, 1, 1856, 1856, 1, 2944]
    - [51, 0.886]
  - - [2368, 2944, 1, 1, 2368, 2368, 1, 2944]
    - [51, 0.943]
  - - [2944, 2944, 1, 1, 2944, 2944, 1, 2944]
    - [56, 0.961]
  - - [3584, 2944, 1, 1, 3584, 3584, 1, 2944]
    - [57, 0.979]
  - - [4288, 2944, 1, 1, 4288, 4288, 1, 2944]
    - [58, 1.027]
  - - [5056, 2944, 1, 1, 5056, 5056, 1, 2944]
    - [58, 1.081]
  - - [5888, 2944, 1, 1, 5888, 5888, 1, 2944]
    - [58, 1.075]
  - - [6784, 2944, 1, 1, 6784, 6784, 1, 2944]
    - [51, 1.111]
  - - [64, 3584, 1, 1, 64, 64, 1, 3584]
    - [52, 0.06]
  - - [128, 3584, 1, 1, 128, 128, 1, 3584]
    - [57, 0.168]
  - - [256, 3584, 1, 1, 256, 256, 1, 3584]
    - [54, 0.308]
  - - [448, 3584, 1, 1, 448, 448, 1, 3584]
    - [54, 0.476]
  - - [704, 3584, 1, 1, 704, 704, 1, 3584]
    - [57, 0.665]
  - - [1024, 3584, 1, 1, 1024, 1024, 1, 3584]
    - [56, 0.752]
  - - [1408, 3584, 1, 1, 1408, 1408, 1, 3584]
    - [51, 0.871]
  - - [1856, 3584, 1, 1, 1856, 1856, 1, 3584]
    - [56, 0.898]
  - - [2368, 3584, 1, 1, 2368, 2368, 1, 3584]
    - [61, 0.976]
  - - [2944, 3584, 1, 1, 2944, 2944, 1, 3584]
    - [56, 0.979]
  - - [3584, 3584, 1, 1, 3584, 3584, 1, 3584]
    - [55, 1.012]
  - - [4288, 3584, 1, 1, 4288, 4288, 1, 3584]
    - [51, 1.072]
  - - [5056, 3584, 1, 1, 5056, 5056, 1, 3584]
    - [51, 1.081]
  - - [5888, 3584, 1, 1, 5888, 5888, 1, 3584]
    - [51, 1.09]
  - - [6784, 3584, 1, 1, 6784, 6784, 1, 3584]
    - [51, 1.108]
  - - [64, 4288, 1, 1, 64, 64, 1, 4288]
    - [57, 0.075]
  - - [128, 4288, 1, 1, 128, 128, 1, 4288]
    - [54, 0.189]
  - - [256, 4288, 1, 1, 256, 256, 1, 4288]
    - [54, 0.368]
  - - [448, 4288, 1, 1, 448, 448, 1, 4288]
    - [60, 0.515]
  - - [704, 4288, 1, 1, 704, 704, 1, 4288]
    - [56, 0.692]
  - - [1024, 4288, 1, 1, 1024, 1024, 1, 4288]
    - [54, 0.803]
  - - [1408, 4288, 1, 1, 1408, 1408, 1, 4288]
    - [51, 0.871]
  - - [1856, 4288, 1, 1, 1856, 1856, 1, 4288]
    - [51, 0.946]
  - - [2368, 4288, 1, 1, 2368, 2368, 1, 4288]
    - [51, 1.018]
  - - [2944, 4288, 1, 1, 2944, 2944, 1, 4288]
    - [51, 1.012]
  - - [3584, 4288, 1, 1, 3584, 3584, 1, 4288]
    - [61, 1.006]
  - - [4288, 4288, 1, 1, 4288, 4288, 1, 4288]
    - [58, 1.078]
  - - [5056, 4288, 1, 1, 5056, 5056, 1, 4288]
    - [55, 1.084]
  - - [5888, 4288, 1, 1, 5888, 5888, 1, 4288]
    - [51, 1.135]
  - - [6784, 4288, 1, 1, 6784, 6784, 1, 4288]
    - [51, 1.12]
  - - [64, 5056, 1, 1, 64, 64, 1, 5056]
    - [52, 0.087]
  - - [128, 5056, 1, 1, 128, 128, 1, 5056]
    - [54, 0.228]
  - - [256, 5056, 1, 1, 256, 256, 1, 5056]
    - [54, 0.413]
  - - [448, 5056, 1, 1, 448, 448, 1, 5056]
    - [54, 0.59]
  - - [704, 5056, 1, 1, 704, 704, 1, 5056]
    - [54, 0.761]
  - - [1024, 5056, 1, 1, 1024, 1024, 1, 5056]
    - [58, 0.85]
  - - [1408, 5056, 1, 1, 1408, 1408, 1, 5056]
    - [55, 0.922]
  - - [1856, 5056, 1, 1, 1856, 1856, 1, 5056]
    - [51, 0.997]
  - - [2368, 5056, 1, 1, 2368, 2368, 1, 5056]
    - [51, 1.048]
  - - [2944, 5056, 1, 1, 2944, 2944, 1, 5056]
    - [54, 1.042]
  - - [3584, 5056, 1, 1, 3584, 3584, 1, 5056]
    - [55, 1.042]
  - - [4288, 5056, 1, 1, 4288, 4288, 1, 5056]
    - [51, 1.096]
  - - [5056, 5056, 1, 1, 5056, 5056, 1, 5056]
    - [51, 1.132]
  - - [5888, 5056, 1, 1, 5888, 5888, 1, 5056]
    - [51, 1.108]
  - - [6784, 5056, 1, 1, 6784, 6784, 1, 5056]
    - [55, 1.126]
  - - [64, 5888, 1, 1, 64, 64, 1, 5888]
    - [52, 0.099]
  - - [128, 5888, 1, 1, 128, 128, 1, 5888]
    - [57, 0.273]
  - - [256, 5888, 1, 1, 256, 256, 1, 5888]
    - [51, 0.443]
  - - [448, 5888, 1, 1, 448, 448, 1, 5888]
    - [52, 0.677]
  - - [704, 5888, 1, 1, 704, 704, 1, 5888]
    - [52, 0.818]
  - - [1024, 5888, 1, 1, 1024, 1024, 1, 5888]
    - [51, 0.871]
  - - [1408, 5888, 1, 1, 1408, 1408, 1, 5888]
    - [58, 0.961]
  - - [1856, 5888, 1, 1, 1856, 1856, 1, 5888]
    - [55, 1.009]
  - - [2368, 5888, 1, 1, 2368, 2368, 1, 5888]
    - [51, 1.045]
  - - [2944, 5888, 1, 1, 2944, 2944, 1, 5888]
    - [57, 1.042]
  - - [3584, 5888, 1, 1, 3584, 3584, 1, 5888]
    - [51, 1.09]
  - - [4288, 5888, 1, 1, 4288, 4288, 1, 5888]
    - [55, 1.126]
  - - [5056, 5888, 1, 1, 5056, 5056, 1, 5888]
    - [51, 1.126]
  - - [5888, 5888, 1, 1, 5888, 5888, 1, 5888]
    - [51, 1.144]
  - - [6784, 5888, 1, 1, 6784, 6784, 1, 5888]
    - [55, 1.171]
  - - [64, 6784, 1, 1, 64, 64, 1, 6784]
    - [59, 0.153]
  - - [128, 6784, 1, 1, 128, 128, 1, 6784]
    - [54, 0.302]
  - - [256, 6784, 1, 1, 256, 256, 1, 6784]
    - [54, 0.521]
  - - [448, 6784, 1, 1, 448, 448, 1, 6784]
    - [52, 0.71]
  - - [704, 6784, 1, 1, 704, 704, 1, 6784]
    - [58, 0.824]
  - - [1024, 6784, 1, 1, 1024, 1024, 1, 6784]
    - [51, 0.886]
  - - [1408, 6784, 1, 1, 1408, 1408, 1, 6784]
    - [55, 0.958]
  - - [1856, 6784, 1, 1, 1856, 1856, 1, 6784]
    - [51, 1.018]
  - - [2368, 6784, 1, 1, 2368, 2368, 1, 6784]
    - [55, 1.048]
  - - [2944, 6784, 1, 1, 2944, 2944, 1, 6784]
    - [55, 1.06]
  - - [3584, 6784, 1, 1, 3584, 3584, 1, 6784]
    - [61, 1.114]
  - - [4288, 6784, 1, 1, 4288, 4288, 1, 6784]
    - [51, 1.141]
  - - [5056, 6784, 1, 1, 5056, 5056, 1, 6784]
    - [55, 1.147]
  - - [5888, 6784, 1, 1, 5888, 5888, 1, 6784]
    - [50, 1.132]
  - - [6784, 6784, 1, 1, 6784, 6784, 1, 6784]
    - [55, 1.159]
  - - [1, 1, 1, 256, 1, 1, 256, 1]
    - [60, 0.0]
  - - [1, 1, 1, 1280, 1, 1, 1280, 1]
    - [63, 0.0]
  - - [1, 1, 1, 3328, 1, 1, 3328, 1]
    - [60, 0.0]
  - - [1, 64, 1, 1, 1, 1, 1, 64]
    - [52, 0.0]
  - - [1, 128, 1, 1, 1, 1, 1, 128]
    - [63, 0.0]
  - - [1, 256, 1, 1, 1, 1, 1, 256]
    - [56, 0.0]
  - - [1, 448, 1, 1, 1, 1, 1, 448]
    - [56, 0.0]
  - - [1, 704, 1, 1, 1, 1, 1, 704]
    - [60, 0.0]
  - - [1, 1024, 1, 1, 1, 1, 1, 1024]
    - [54, 0.0]
  - - [1, 1408, 1, 1, 1, 1, 1, 1408]
    - [56, 0.001]
  - - [1, 1856, 1, 1, 1, 1, 1, 1856]
    - [63, 0.001]
  - - [1, 2368, 1, 1, 1, 1, 1, 2368]
    - [63, 0.001]
  - - [1, 2944, 1, 1, 1, 1, 1, 2944]
    - [52, 0.001]
  - - [1, 3584, 1, 1, 1, 1, 1, 3584]
    - [56, 0.001]
  - - [1, 4288, 1, 1, 1, 1, 1, 4288]
    - [52, 0.003]
  - - [1, 5056, 1, 1, 1, 1, 1, 5056]
    - [51, 0.003]
  - - [1, 5888, 1, 1, 1, 1, 1, 5888]
    - [51, 0.003]
  - - [1, 6784, 1, 1, 1, 1, 1, 6784]
    - [50, 0.003]
  - - [64, 1, 1, 1, 64, 64, 1, 1]
    - [65, 0.0]
  - - [128, 1, 1, 1, 128, 128, 1, 1]
    - [65, 0.0]
  - - [256, 1, 1, 1, 256, 256, 1, 1]
    - [65, 0.0]
  - - [448, 1, 1, 1, 448, 448, 1, 1]
    - [62, 0.0]
  - - [704, 1, 1, 1, 704, 704, 1, 1]
    - [54, 0.0]
  - - [1024, 1, 1, 1, 1024, 1024, 1, 1]
    - [52, 0.001]
  - - [1408, 1, 1, 1, 1408, 1408, 1, 1]
    - [56, 0.001]
  - - [1856, 1, 1, 1, 1856, 1856, 1, 1]
    - [54, 0.001]
  - - [2368, 1, 1, 1, 2368, 2368, 1, 1]
    - [52, 0.001]
  - - [2944, 1, 1, 1, 2944, 2944, 1, 1]
    - [54, 0.001]
  - - [3584, 1, 1, 1, 3584, 3584, 1, 1]
    - [52, 0.003]
  - - [4288, 1, 1, 1, 4288, 4288, 1, 1]
    - [51, 0.003]
  - - [5056, 1, 1, 1, 5056, 5056, 1, 1]
    - [51, 0.003]
  - - [5888, 1, 1, 1, 5888, 5888, 1, 1]
    - [50, 0.003]
  - - [6784, 1, 1, 1, 6784, 6784, 1, 1]
    - [50, 0.003]
- null
