library/src/blas3/Tensile/Logic/asm_full/aldebaran_Cijk_Ailk_Bljk_BBH.yaml
- {MinimumRequiredVersion: 4.14.0}
- aldebaran
- gfx90a
- [Device 0050, Device 0051, Device 0052, Device 0054, Device 0062, Device 7400, Device 740c]
    SolutionIndex: 0
    SolutionNameMin: Cijk_Ailk_Bljk_BBH_MT64x128x8_MI32x32x2x2_SE_AF0EM1_ASEM1_GRVW2_ONLL0_SNLL1
    SolutionIndex: 1
    SolutionIndex: 2
    SolutionIndex: 3
    SolutionIndex: 4
    SolutionIndex: 5
    SolutionIndex: 6
    SolutionIndex: 7
    SolutionIndex: 8
    SolutionIndex: 9
    SolutionIndex: 10
    SolutionIndex: 11
    SolutionIndex: 12
    SolutionIndex: 13
    SolutionIndex: 14
    SolutionIndex: 15
    SolutionIndex: 16
    SolutionIndex: 17
    SolutionIndex: 18
    SolutionIndex: 19
    SolutionIndex: 20
    SolutionIndex: 21
    SolutionIndex: 22
    SolutionIndex: 23
    SolutionIndex: 24
    SolutionIndex: 25
    SolutionIndex: 26
    SolutionIndex: 27
    SolutionIndex: 28
    SolutionIndex: 29
    SolutionIndex: 30
    SolutionIndex: 31
    SolutionIndex: 32
    SolutionIndex: 33
    SolutionIndex: 34
    SolutionIndex: 35
    SolutionIndex: 36
    SolutionIndex: 37
    SolutionIndex: 38
    SolutionIndex: 39
    SolutionIndex: 40
    SolutionIndex: 41
    SolutionIndex: 42
    SolutionIndex: 43
    SolutionIndex: 44
    SolutionIndex: 45
    SolutionIndex: 46
    SolutionIndex: 47
    SolutionIndex: 48
    SolutionIndex: 49
    SolutionNameMin: Cijk_Ailk_Bljk_BBH_MT64x32x32_MI16x16x8x1_SE_AF0EM4_GRVW2_LBSPP128_LPB2_NLCA1_SU0_SUS256_SRVW4_TT2_16_WG32_8_1_WGM1
    SolutionIndex: 50
    SolutionNameMin: Cijk_Ailk_Bljk_BBH_MT64x128x32_MI32x32x4x1_SE_AF0EM4_GRVW4_LBSPP128_LPB4_NLCA1_SU0_SUS256_SRVW4_TT1_64_WG64_4_1_WGM15
    SolutionIndex: 51
    SolutionNameMin: Cijk_Ailk_Bljk_BBH_MT128x160x32_MI32x32x4x1_SE_AF0EM4_GRVW4_LBSPP128_LPB4_NLCA1_SU0_SUS256_SRVW0_TT1_160_WG128_2_1_WGM2
    SolutionIndex: 52
    SolutionNameMin: Cijk_Ailk_Bljk_BBH_MT64x128x32_MI32x32x4x1_SE_AF0EM4_GRVW8_LBSPP128_LPB8_NLCA1_SU0_SUS256_SRVW4_TT1_64_WG64_4_1_WGM1
    SolutionIndex: 53
    SolutionNameMin: Cijk_Ailk_Bljk_BBH_MT32x32x64_MI16x16x8x1_SE_AF0EM4_GRVW4_LBSPP128_LPB4_NLCA1_SU16_SUS256_SRVW0_TT1_16_WG32_8_1_WGM1
    SolutionIndex: 54
    SolutionNameMin: Cijk_Ailk_Bljk_BBH_MT32x32x128_MI16x16x8x1_SE_AF0EM1_GRVW8_LBSPP256_LPB8_NLCA1_SU32_SUS256_SRVW0_TT1_16_WG32_8_1_WGM1
    SolutionIndex: 55
    SolutionNameMin: Cijk_Ailk_Bljk_BBH_MT64x80x32_MI16x16x8x1_SE_AF0EM4_GRVW2_LBSPP128_LPB2_NLCA1_SU32_SUS256_SRVW0_TT1_80_WG64_4_1_WGM2
    SolutionIndex: 56
    SolutionNameMin: Cijk_Ailk_Bljk_BBH_MT64x32x32_MI16x16x8x1_SE_AF0EM4_GRVW2_LBSPP128_LPB2_NLCA1_SU0_SUS256_SRVW0_TT2_16_WG32_8_1_WGM1
    SolutionIndex: 57
    SolutionNameMin: Cijk_Ailk_Bljk_BBH_MT128x96x32_MI32x32x4x1_SE_AF0EM4_GRVW4_LBSPP128_LPB4_NLCA1_SU16_SUS128_SRVW4_TT1_96_WG128_2_1_WGM2
    SolutionIndex: 58
    SolutionNameMin: Cijk_Ailk_Bljk_BBH_MT128x96x32_MI32x32x4x1_SE_AF0EM4_GRVW4_LBSPP128_LPB4_NLCA1_SU0_SUS256_SRVW4_TT1_96_WG128_2_1_WGM2
    SolutionIndex: 59
    SolutionNameMin: Cijk_Ailk_Bljk_BBH_MT128x160x32_MI32x32x4x1_SE_AF0EM4_GRVW4_LBSPP128_LPB4_NLCA1_SU0_SUS256_SRVW4_TT1_160_WG128_2_1_WGM15
    SolutionIndex: 60
    SolutionNameMin: Cijk_Ailk_Bljk_BBH_MT64x128x32_MI32x32x4x1_SE_AF0EM4_GRVW8_LBSPP128_LPB8_NLCA1_SU32_SUS128_SRVW4_TT1_64_WG64_4_1_WGM1
    SolutionIndex: 61
    SolutionNameMin: Cijk_Ailk_Bljk_BBH_MT128x80x32_MI16x16x8x1_SE_AF0EM4_GRVW2_LBSPP128_LPB2_NLCA1_SU16_SUS256_SRVW4_TT2_80_WG64_4_1_WGM1
    SolutionIndex: 62
    SolutionNameMin: Cijk_Ailk_Bljk_BBH_MT128x80x64_MI16x16x8x1_SE_AF0EM4_GRVW2_LBSPP128_LPB2_NLCA1_SU32_SUS256_SRVW0_TT2_80_WG64_4_1_WGM2
    SolutionIndex: 63
    SolutionNameMin: Cijk_Ailk_Bljk_BBH_MT128x160x32_MI32x32x4x1_SE_AF0EM4_GRVW4_LBSPP128_LPB4_NLCA1_SU0_SUS256_SRVW0_TT1_160_WG128_2_1_WGM15
    SolutionIndex: 64
    SolutionNameMin: Cijk_Ailk_Bljk_BBH_MT32x32x32_MI16x16x8x1_SE_AF0EM4_GRVW2_LBSPP128_LPB2_NLCA1_SU0_SUS256_SRVW0_TT1_16_WG32_8_1_WGM15
    SolutionIndex: 65
    SolutionNameMin: Cijk_Ailk_Bljk_BBH_MT128x96x32_MI32x32x4x1_SE_AF0EM4_GRVW4_LBSPP128_LPB4_NLCA1_SU0_SUS256_SRVW4_TT1_96_WG128_2_1_WGM15
    SolutionIndex: 66
    SolutionNameMin: Cijk_Ailk_Bljk_BBH_MT32x32x32_MI16x16x8x1_SE_AF0EM4_GRVW4_LBSPP128_LPB4_NLCA1_SU0_SUS256_SRVW0_TT1_16_WG32_8_1_WGM2
    SolutionIndex: 67
    SolutionNameMin: Cijk_Ailk_Bljk_BBH_MT128x96x32_MI32x32x4x1_SE_AF0EM4_GRVW4_LBSPP128_LPB4_NLCA1_SU16_SUS256_SRVW4_TT1_96_WG128_2_1_WGM2
    SolutionIndex: 68
    SolutionNameMin: Cijk_Ailk_Bljk_BBH_MT128x160x32_MI32x32x4x1_SE_AF0EM4_GRVW4_LBSPP128_LPB4_NLCA1_SU0_SUS256_SRVW0_TT1_160_WG128_2_1_WGM1
    SolutionIndex: 69
    SolutionNameMin: Cijk_Ailk_Bljk_BBH_MT32x32x128_MI16x16x8x1_SE_AF0EM4_GRVW8_LBSPP256_LPB8_NLCA1_SU16_SUS256_SRVW0_TT1_16_WG32_8_1_WGM2
    SolutionIndex: 70
    SolutionNameMin: Cijk_Ailk_Bljk_BBH_MT128x96x32_MI32x32x4x1_SE_AF0EM4_GRVW4_LBSPP128_LPB4_NLCA1_SU16_SUS256_SRVW4_TT1_96_WG128_2_1_WGM15
    SolutionIndex: 71
    SolutionNameMin: Cijk_Ailk_Bljk_BBH_MT128x96x32_MI32x32x4x1_SE_AF0EM4_GRVW4_LBSPP128_LPB4_NLCA1_SU16_SUS128_SRVW4_TT1_96_WG128_2_1_WGM15
    SolutionIndex: 72
    SolutionNameMin: Cijk_Ailk_Bljk_BBH_MT128x96x32_MI32x32x4x1_SE_AF0EM4_GRVW4_LBSPP128_LPB4_NLCA1_SU32_SUS128_SRVW4_TT1_96_WG128_2_1_WGM2
    SolutionIndex: 73
    SolutionNameMin: Cijk_Ailk_Bljk_BBH_MT128x256x32_MI32x32x4x1_SE_AF0EM1_GRVW8_LBSPP128_LPB8_NLCA1_SU0_SUS256_SRVW4_TT2_128_WG64_4_1_WGM15
    SolutionIndex: 74
    SolutionNameMin: Cijk_Ailk_Bljk_BBH_MT32x32x32_MI16x16x8x1_SE_AF0EM4_GRVW4_LBSPP128_LPB4_NLCA1_SU0_SUS256_SRVW0_TT1_16_WG32_8_1_WGM1
    SolutionIndex: 75
    SolutionNameMin: Cijk_Ailk_Bljk_BBH_MT64x80x32_MI16x16x8x1_SE_AF0EM4_GRVW2_LBSPP128_LPB2_NLCA1_SU16_SUS128_SRVW0_TT1_80_WG64_4_1_WGM15
    SolutionIndex: 76
    SolutionNameMin: Cijk_Ailk_Bljk_BBH_MT64x128x32_MI32x32x4x1_SE_AF0EM4_GRVW8_LBSPP128_LPB8_NLCA1_SU32_SUS256_SRVW4_TT1_64_WG64_4_1_WGM2
    SolutionIndex: 77
    SolutionNameMin: Cijk_Ailk_Bljk_BBH_MT32x32x32_MI16x16x8x1_SE_AF0EM4_GRVW2_LBSPP128_LPB2_NLCA1_SU0_SUS256_SRVW0_TT1_16_WG32_8_1_WGM1
    SolutionIndex: 78
    SolutionNameMin: Cijk_Ailk_Bljk_BBH_MT32x32x128_MI16x16x8x1_SE_AF0EM1_GRVW4_LBSPP256_LPB4_NLCA1_SU0_SUS256_SRVW0_TT1_16_WG32_8_1_WGM1
    SolutionIndex: 79
    SolutionNameMin: Cijk_Ailk_Bljk_BBH_MT32x64x32_MI16x16x8x1_SE_AF0EM4_GRVW2_LBSPP128_LPB2_NLCA1_SU0_SUS256_SRVW0_TT1_32_WG32_8_1_WGM1
    SolutionIndex: 80
    SolutionNameMin: Cijk_Ailk_Bljk_BBH_MT64x80x64_MI16x16x8x1_SE_AF0EM4_GRVW2_LBSPP128_LPB2_NLCA1_SU0_SUS256_SRVW0_TT1_80_WG64_4_1_WGM15
    SolutionIndex: 81
    SolutionNameMin: Cijk_Ailk_Bljk_BBH_MT128x288x32_MI32x32x4x1_SE_AF0EM4_GRVW2_LBSPP128_LPB2_NLCA1_SU0_SUS256_SRVW0_TT1_288_WG128_2_1_WGM2
    SolutionIndex: 82
    SolutionNameMin: Cijk_Ailk_Bljk_BBH_MT64x64x32_MI32x32x4x1_SE_AF0EM4_GRVW8_LBSPP128_LPB8_NLCA1_SU16_SUS128_SRVW4_TT1_32_WG64_4_1_WGM1
    SolutionIndex: 83
    SolutionNameMin: Cijk_Ailk_Bljk_BBH_MT128x80x64_MI16x16x8x1_SE_AF0EM4_GRVW2_LBSPP128_LPB2_NLCA1_SU32_SUS256_SRVW0_TT2_80_WG64_4_1_WGM15
    SolutionIndex: 84
    SolutionNameMin: Cijk_Ailk_Bljk_BBH_MT128x64x32_MI32x32x4x1_SE_AF0EM4_GRVW8_LBSPP128_LPB8_NLCA1_SU0_SUS256_SRVW4_TT2_32_WG64_4_1_WGM15
    SolutionIndex: 85
    SolutionNameMin: Cijk_Ailk_Bljk_BBH_MT32x32x32_MI16x16x8x1_SE_AF0EM4_GRVW2_LBSPP128_LPB2_NLCA1_SU16_SUS256_SRVW0_TT1_16_WG32_8_1_WGM2
    SolutionIndex: 86
    SolutionNameMin: Cijk_Ailk_Bljk_BBH_MT64x64x32_MI32x32x4x1_SE_AF0EM4_GRVW8_LBSPP128_LPB8_NLCA1_SU32_SUS128_SRVW0_TT1_32_WG64_4_1_WGM1
    SolutionIndex: 87
    SolutionNameMin: Cijk_Ailk_Bljk_BBH_MT64x32x32_MI16x16x8x1_SE_AF0EM4_GRVW2_LBSPP128_LPB2_NLCA1_SU0_SUS256_SRVW0_TT2_16_WG32_8_1_WGM2
    SolutionIndex: 88
    SolutionNameMin: Cijk_Ailk_Bljk_BBH_MT128x96x32_MI32x32x4x1_SE_AF0EM4_GRVW4_LBSPP128_LPB4_NLCA1_SU16_SUS128_SRVW4_TT1_96_WG128_2_1_WGM1
    SolutionIndex: 89
    SolutionNameMin: Cijk_Ailk_Bljk_BBH_MT128x80x64_MI16x16x8x1_SE_AF0EM4_GRVW2_LBSPP128_LPB2_NLCA1_SU0_SUS256_SRVW0_TT2_80_WG64_4_1_WGM1
    SolutionIndex: 90
    SolutionNameMin: Cijk_Ailk_Bljk_BBH_MT128x96x32_MI32x32x4x1_SE_AF0EM4_GRVW2_LBSPP128_LPB2_NLCA1_SU16_SUS256_SRVW4_TT1_96_WG128_2_1_WGM2
    SolutionIndex: 91
    SolutionNameMin: Cijk_Ailk_Bljk_BBH_MT128x96x32_MI32x32x4x1_SE_AF0EM4_GRVW4_LBSPP128_LPB4_NLCA1_SU32_SUS256_SRVW4_TT1_96_WG128_2_1_WGM2
    SolutionIndex: 92
    SolutionNameMin: Cijk_Ailk_Bljk_BBH_MT64x64x32_MI32x32x4x1_SE_AF0EM4_GRVW2_LBSPP128_LPB2_NLCA1_SU0_SUS256_SRVW0_TT1_32_WG64_4_1_WGM15
    SolutionIndex: 93
    SolutionNameMin: Cijk_Ailk_Bljk_BBH_MT64x80x32_MI16x16x8x1_SE_AF0EM4_GRVW2_LBSPP128_LPB2_NLCA1_SU0_SUS256_SRVW0_TT1_80_WG64_4_1_WGM2
    SolutionIndex: 94
    SolutionNameMin: Cijk_Ailk_Bljk_BBH_MT128x96x32_MI32x32x4x1_SE_AF0EM4_GRVW4_LBSPP128_LPB4_NLCA1_SU32_SUS128_SRVW4_TT1_96_WG128_2_1_WGM1
    SolutionIndex: 95
    SolutionNameMin: Cijk_Ailk_Bljk_BBH_MT64x64x32_MI32x32x4x1_SE_AF0EM4_GRVW8_LBSPP128_LPB8_NLCA1_SU32_SUS256_SRVW0_TT1_32_WG64_4_1_WGM15
    SolutionIndex: 96
    SolutionNameMin: Cijk_Ailk_Bljk_BBH_MT64x128x32_MI32x32x4x1_SE_AF0EM4_GRVW2_LBSPP128_LPB2_NLCA1_SU16_SUS128_SRVW4_TT1_64_WG64_4_1_WGM2
    SolutionIndex: 97
    SolutionNameMin: Cijk_Ailk_Bljk_BBH_MT64x80x64_MI16x16x8x1_SE_AF0EM4_GRVW4_LBSPP128_LPB4_NLCA1_SU32_SUS256_SRVW0_TT1_80_WG64_4_1_WGM15
    SolutionIndex: 98
    SolutionNameMin: Cijk_Ailk_Bljk_BBH_MT128x80x32_MI16x16x8x1_SE_AF0EM4_GRVW2_LBSPP128_LPB2_NLCA1_SU0_SUS256_SRVW0_TT2_80_WG64_4_1_WGM15
    SolutionIndex: 99
    SolutionNameMin: Cijk_Ailk_Bljk_BBH_MT32x32x64_MI16x16x8x1_SE_AF0EM4_GRVW8_LBSPP128_LPB8_NLCA1_SU16_SUS128_SRVW0_TT1_16_WG32_8_1_WGM2
    SolutionIndex: 100
    SolutionNameMin: Cijk_Ailk_Bljk_BBH_MT128x64x32_MI32x32x2x2_SE_AF0EM4_GRVW8_LBSPP128_LPB8_NLCA1_SU0_SUS256_SRVW4_TT1_32_WG128_2_1_WGM15
    SolutionIndex: 101
    SolutionNameMin: Cijk_Ailk_Bljk_BBH_MT64x128x32_MI32x32x4x1_SE_AF0EM4_GRVW2_LBSPP128_LPB2_NLCA1_SU16_SUS256_SRVW4_TT1_64_WG64_4_1_WGM1
    SolutionIndex: 102
    SolutionNameMin: Cijk_Ailk_Bljk_BBH_MT32x32x128_MI16x16x8x1_SE_AF0EM4_GRVW4_LBSPP256_LPB4_NLCA1_SU0_SUS256_SRVW0_TT1_16_WG32_8_1_WGM1
    SolutionIndex: 103
    SolutionNameMin: Cijk_Ailk_Bljk_BBH_MT128x80x64_MI16x16x8x1_SE_AF0EM4_GRVW2_LBSPP128_LPB2_NLCA1_SU0_SUS256_SRVW0_TT2_80_WG64_4_1_WGM2
    SolutionIndex: 104
    SolutionNameMin: Cijk_Ailk_Bljk_BBH_MT128x96x32_MI32x32x4x1_SE_AF0EM4_GRVW4_LBSPP128_LPB4_NLCA1_SU0_SUS256_SRVW4_TT1_96_WG128_2_1_WGM1
    SolutionIndex: 105
    SolutionNameMin: Cijk_Ailk_Bljk_BBH_MT32x32x32_MI16x16x8x1_SE_AF0EM4_GRVW4_LBSPP128_LPB4_NLCA1_SU32_SUS128_SRVW0_TT1_16_WG32_8_1_WGM2
    SolutionIndex: 106
    SolutionNameMin: Cijk_Ailk_Bljk_BBH_MT128x96x32_MI32x32x4x1_SE_AF0EM4_GRVW2_LBSPP128_LPB2_NLCA1_SU0_SUS256_SRVW4_TT1_96_WG128_2_1_WGM15
    SolutionIndex: 107
    SolutionNameMin: Cijk_Ailk_Bljk_BBH_MT128x96x64_MI32x32x4x1_SE_AF0EM4_GRVW4_LBSPP128_LPB4_NLCA1_SU32_SUS256_SRVW0_TT1_96_WG128_2_1_WGM15
    SolutionIndex: 108
    SolutionNameMin: Cijk_Ailk_Bljk_BBH_MT64x64x32_MI32x32x4x1_SE_AF0EM4_GRVW8_LBSPP128_LPB8_NLCA1_SU16_SUS256_SRVW4_TT1_32_WG64_4_1_WGM15
    SolutionIndex: 109
    SolutionNameMin: Cijk_Ailk_Bljk_BBH_MT128x64x64_MI32x32x4x1_SE_AF0EM4_GRVW8_LBSPP128_LPB8_NLCA1_SU16_SUS256_SRVW4_TT2_32_WG64_4_1_WGM2
    SolutionIndex: 110
    SolutionNameMin: Cijk_Ailk_Bljk_BBH_MT128x160x32_MI32x32x4x1_SE_AF0EM4_GRVW4_LBSPP128_LPB4_NLCA1_SU32_SUS128_SRVW0_TT1_160_WG128_2_1_WGM1
    SolutionIndex: 111
    SolutionNameMin: Cijk_Ailk_Bljk_BBH_MT64x128x64_MI32x32x4x1_SE_AF0EM4_GRVW4_LBSPP128_LPB4_NLCA1_SU0_SUS256_SRVW4_TT1_64_WG64_4_1_WGM1
    SolutionIndex: 112
    SolutionNameMin: Cijk_Ailk_Bljk_BBH_MT128x160x32_MI32x32x4x1_SE_AF0EM4_GRVW4_LBSPP128_LPB4_NLCA1_SU32_SUS256_SRVW0_TT1_160_WG128_2_1_WGM1
    SolutionIndex: 113
    SolutionNameMin: Cijk_Ailk_Bljk_BBH_MT64x128x64_MI32x32x4x1_SE_AF0EM4_GRVW4_LBSPP128_LPB4_NLCA1_SU0_SUS256_SRVW0_TT1_64_WG64_4_1_WGM1
    SolutionIndex: 114
    SolutionNameMin: Cijk_Ailk_Bljk_BBH_MT32x64x128_MI16x16x8x1_SE_AF0EM4_GRVW8_LBSPP256_LPB8_NLCA1_SU0_SUS256_SRVW0_TT1_32_WG32_8_1_WGM15
    SolutionIndex: 115
    SolutionNameMin: Cijk_Ailk_Bljk_BBH_MT128x80x32_MI16x16x8x1_SE_AF0EM1_GRVW2_LBSPP128_LPB2_NLCA1_SU0_SUS256_SRVW4_TT2_80_WG64_4_1_WGM15
    SolutionIndex: 116
    SolutionNameMin: Cijk_Ailk_Bljk_BBH_MT32x32x64_MI16x16x8x1_SE_AF0EM4_GRVW8_LBSPP128_LPB8_NLCA1_SU16_SUS256_SRVW0_TT1_16_WG32_8_1_WGM2
    SolutionIndex: 117
    SolutionNameMin: Cijk_Ailk_Bljk_BBH_MT32x32x128_MI16x16x8x1_SE_AF0EM4_GRVW8_LBSPP256_LPB8_NLCA1_SU32_SUS256_SRVW0_TT1_16_WG32_8_1_WGM15
    SolutionIndex: 118
    SolutionNameMin: Cijk_Ailk_Bljk_BBH_MT128x96x32_MI32x32x4x1_SE_AF0EM1_GRVW2_LBSPP128_LPB2_NLCA1_SU0_SUS256_SRVW4_TT1_96_WG128_2_1_WGM15
    SolutionIndex: 119
    SolutionNameMin: Cijk_Ailk_Bljk_BBH_MT64x128x32_MI32x32x4x1_SE_AF0EM1_GRVW8_LBSPP128_LPB8_NLCA1_SU16_SUS128_SRVW4_TT1_64_WG64_4_1_WGM15
    SolutionIndex: 120
    SolutionNameMin: Cijk_Ailk_Bljk_BBH_MT32x64x128_MI16x16x8x1_SE_AF0EM1_GRVW8_LBSPP256_LPB8_NLCA1_SU32_SUS256_SRVW0_TT1_32_WG32_8_1_WGM15
    SolutionIndex: 121
    SolutionNameMin: Cijk_Ailk_Bljk_BBH_MT64x64x64_MI32x32x4x1_SE_AF0EM4_GRVW8_LBSPP128_LPB8_NLCA1_SU0_SUS256_SRVW4_TT1_32_WG64_4_1_WGM15
    SolutionIndex: 122
    SolutionNameMin: Cijk_Ailk_Bljk_BBH_MT32x32x128_MI16x16x8x1_SE_AF0EM4_GRVW2_LBSPP256_LPB2_NLCA1_SU16_SUS256_SRVW0_TT1_16_WG32_8_1_WGM2
    SolutionIndex: 123
    SolutionNameMin: Cijk_Ailk_Bljk_BBH_MT64x64x32_MI32x32x4x1_SE_AF0EM4_GRVW8_LBSPP128_LPB8_NLCA1_SU0_SUS256_SRVW4_TT1_32_WG64_4_1_WGM2
    SolutionIndex: 124
    SolutionNameMin: Cijk_Ailk_Bljk_BBH_MT64x80x64_MI16x16x8x1_SE_AF0EM4_GRVW2_LBSPP128_LPB2_NLCA1_SU16_SUS256_SRVW0_TT1_80_WG64_4_1_WGM15
    SolutionIndex: 125
    SolutionNameMin: Cijk_Ailk_Bljk_BBH_MT64x128x32_MI32x32x4x1_SE_AF0EM4_GRVW4_LBSPP128_LPB4_NLCA1_SU0_SUS256_SRVW4_TT1_64_WG64_4_1_WGM2
    SolutionIndex: 126
    SolutionNameMin: Cijk_Ailk_Bljk_BBH_MT128x64x32_MI32x32x2x2_SE_AF0EM4_GRVW4_LBSPP128_LPB4_NLCA1_SU0_SUS256_SRVW4_TT1_32_WG128_2_1_WGM1
    SolutionIndex: 127
    SolutionNameMin: Cijk_Ailk_Bljk_BBH_MT32x32x128_MI16x16x8x1_SE_AF0EM4_GRVW8_LBSPP256_LPB8_NLCA1_SU0_SUS256_SRVW0_TT1_16_WG32_8_1_WGM1
    SolutionIndex: 128
    SolutionNameMin: Cijk_Ailk_Bljk_BBH_MT64x64x32_MI32x32x4x1_SE_AF0EM1_ASBE01_GRVW4_LPB4_PBD0_SRVW4_TT1_32_WG64_4_1_WGM1
    SolutionIndex: 129
    SolutionNameMin: Cijk_Ailk_Bljk_BBH_MT128x64x32_MI32x32x2x2_SE_AF0EM1_ASBE01_GRVW4_LPB4_PBD0_SRVW4_TT1_32_WG128_2_1_WGM1
    SolutionIndex: 130
    SolutionNameMin: Cijk_Ailk_Bljk_BBH_MT128x64x32_MI16x16x8x1_SE_AF0EM8_ASBE01_GRVW8_LPB8_PBD0_SRVW4_TT2_64_WG128_2_1_WGM1
    SolutionIndex: 131
    SolutionNameMin: Cijk_Ailk_Bljk_BBH_MT64x32x32_MI16x16x8x1_SE_AF0EM1_ASBE01_GRVW4_LPB4_PBD0_SRVW4_TT1_32_WG64_4_1_WGM1
    SolutionIndex: 132
    SolutionNameMin: Cijk_Ailk_Bljk_BBH_MT128x64x32_MI32x32x4x1_SE_AF0EM8_ASBE01_GRVW8_LPB8_PBD0_SRVW4_TT2_32_WG64_4_1_WGM1
    SolutionIndex: 133
    SolutionNameMin: Cijk_Ailk_Bljk_BBH_MT64x32x32_MI16x16x8x1_SE_AF0EM1_ASBE01_GRVW2_LPB2_PBD0_SRVW4_TT1_32_WG64_4_1_WGM1
    SolutionIndex: 134
    SolutionNameMin: Cijk_Ailk_Bljk_BBH_MT128x64x32_MI32x32x4x1_SE_AF0EM4_ASBE01_GRVW4_LPB4_PBD0_SRVW4_TT2_32_WG64_4_1_WGM1
    SolutionIndex: 135
    SolutionNameMin: Cijk_Ailk_Bljk_BBH_MT64x64x32_MI32x32x4x1_SE_AF0EM1_ASBE01_GRVW2_LPB2_PBD0_SRVW4_TT1_32_WG64_4_1_WGM1
    SolutionIndex: 136
    SolutionNameMin: Cijk_Ailk_Bljk_BBH_MT64x128x32_MI32x32x4x1_SE_AF0EM8_ASBE01_GRVW8_LPB8_PBD0_SRVW4_TT2_32_WG32_8_1_WGM1
    SolutionIndex: 137
    SolutionNameMin: Cijk_Ailk_Bljk_BBH_MT128x64x32_MI32x32x4x1_SE_AF0EM8_ASBE01_GRVW8_LPB8_PBD0_SRVW4_TT2_32_WG64_4_1_WGM4
    SolutionIndex: 138
    SolutionNameMin: Cijk_Ailk_Bljk_BBH_MT128x64x32_MI32x32x4x1_SE_AF0EM8_ASBE01_GRVW4_LPB4_PBD0_SRVW4_TT2_32_WG64_4_1_WGM1
    SolutionIndex: 139
    SolutionNameMin: Cijk_Ailk_Bljk_BBH_MT128x64x32_MI32x32x2x2_SE_AF0EM8_ASBE01_GRVW8_LPB8_PBD0_SRVW4_TT1_32_WG128_2_1_WGM1
    SolutionIndex: 140
    SolutionNameMin: Cijk_Ailk_Bljk_BBH_MT128x32x32_MI32x32x4x1_SE_AF0EM1_ASBE01_GRVW4_LPB4_PBD0_SRVW4_TT1_32_WG128_2_1_WGM1
    SolutionIndex: 141
    SolutionNameMin: Cijk_Ailk_Bljk_BBH_MT128x64x32_MI32x32x2x2_SE_AF0EM1_ASBE01_GRVW4_LPB4_PBD0_SRVW4_TT1_32_WG128_2_1_WGM4
    SolutionIndex: 142
    SolutionNameMin: Cijk_Ailk_Bljk_BBH_MT128x64x32_MI32x32x2x2_SE_AF0EM4_ASBE01_GRVW4_LPB4_PBD0_SRVW4_TT1_32_WG128_2_1_WGM4
    SolutionIndex: 143
    SolutionNameMin: Cijk_Ailk_Bljk_BBH_MT128x64x32_MI32x32x4x1_SE_AF0EM1_ASBE01_GRVW4_LPB4_PBD0_SRVW4_TT2_32_WG64_4_1_WGM1
    SolutionIndex: 144
    SolutionNameMin: Cijk_Ailk_Bljk_BBH_MT128x64x32_MI32x32x2x2_SE_AF0EM4_ASBE01_GRVW4_LPB4_PBD0_SRVW4_TT1_32_WG128_2_1_WGM10
    SolutionIndex: 145
    SolutionNameMin: Cijk_Ailk_Bljk_BBH_MT128x64x32_MI16x16x8x1_SE_AF0EM1_ASBE01_GRVW4_LPB4_PBD0_SRVW4_TT2_64_WG64_4_1_WGM4
    SolutionIndex: 146
    SolutionNameMin: Cijk_Ailk_Bljk_BBH_MT64x128x32_MI16x16x2x4_SE_AF0EM4_ASBE01_GRVW2_LPB2_PBD0_SRVW4_TT1_32_WG64_4_1_WGM4
    SolutionIndex: 147
    SolutionNameMin: Cijk_Ailk_Bljk_BBH_MT64x64x32_MI32x32x4x1_SE_AF0EM4_ASBE01_GRVW2_LPB2_PBD0_SRVW4_TT1_32_WG64_4_1_WGM10
    SolutionIndex: 148
    SolutionNameMin: Cijk_Ailk_Bljk_BBH_MT64x128x32_MI32x32x4x1_SE_AF0EM1_ASBE01_GRVW2_LPB2_PBD0_SRVW4_TT2_32_WG32_8_1_WGM10
    SolutionIndex: 149
    SolutionNameMin: Cijk_Ailk_Bljk_BBH_MT64x128x64_MI32x32x4x1_SE_AF0EM8_ASBE01_GRVW8_LPB8_PBD0_SRVW0_TT2_32_WG32_8_1_WGM4
    SolutionIndex: 150
    SolutionNameMin: Cijk_Ailk_Bljk_BBH_MT64x32x64_MI16x16x8x1_SE_AF0EM1_ASBE01_GRVW2_LPB2_PBD0_SRVW4_TT1_32_WG128_2_1_WGM10
    SolutionIndex: 151
    SolutionNameMin: Cijk_Ailk_Bljk_BBH_MT64x128x32_MI32x32x2x2_SE_AF0EM8_ASBE01_GRVW8_LPB8_PBD0_SRVW4_TT1_32_WG64_4_1_WGM1
    SolutionIndex: 152
    SolutionNameMin: Cijk_Ailk_Bljk_BBH_MT128x64x32_MI32x32x4x1_SE_AF0EM4_ASBE01_GRVW4_LPB4_PBD0_SRVW4_TT2_32_WG64_4_1_WGM4
    SolutionIndex: 153
    SolutionNameMin: Cijk_Ailk_Bljk_BBH_MT64x32x32_MI16x16x8x1_SE_AF0EM1_ASBE01_GRVW4_LPB4_PBD0_SRVW4_TT1_32_WG128_2_1_WGM1
    SolutionIndex: 154
    SolutionNameMin: Cijk_Ailk_Bljk_BBH_MT64x32x32_MI16x16x8x1_SE_AF0EM4_ASBE01_GRVW2_LPB2_PBD0_SRVW0_TT1_32_WG128_2_1_WGM1
    SolutionIndex: 155
    SolutionNameMin: Cijk_Ailk_Bljk_BBH_MT128x256x32_MI32x32x4x1_SE_GRVW8_GSU1_LPB8_PLR9_SU0_SUS256_SRVW4_WGM15
    SolutionIndex: 156
    SolutionNameMin: Cijk_Ailk_Bljk_BBH_MT128x256x32_MI32x32x4x1_SE_GRVW8_GSU1_LPB8_PLR9_SU0_SUS256_SRVW4_WGM2
    SolutionIndex: 157
    SolutionNameMin: Cijk_Ailk_Bljk_BBH_MT128x256x32_MI32x32x4x1_SE_GRVW8_GSU1_LPB8_PLR9_SU32_SUS128_SRVW4_WGM15
    SolutionIndex: 158
    SolutionNameMin: Cijk_Ailk_Bljk_BBH_MT128x96x32_MI32x32x4x1_SE_GRVW4_GSU1_LPB4_PLR9_SU32_SUS128_SRVW4_WGM15
    SolutionIndex: 159
    SolutionNameMin: Cijk_Ailk_Bljk_BBH_MT128x144x32_MI16x16x8x1_SE_GRVW2_GSU1_LPB4_PLR5_SU0_SUS256_SRVW4_WGM15
    SolutionIndex: 160
    SolutionNameMin: Cijk_Ailk_Bljk_BBH_MT32x32x64_MI16x16x8x1_SE_GRVW2_GSU7_LPB4_PLR9_SU0_SUS256_SRVW0_WGM1
    SolutionIndex: 161
    SolutionNameMin: Cijk_Ailk_Bljk_BBH_MT128x96x32_MI32x32x4x1_SE_GRVW4_GSU1_LPB4_PLR9_SU0_SUS256_SRVW4_WGM15
    SolutionIndex: 162
    SolutionNameMin: Cijk_Ailk_Bljk_BBH_MT128x160x32_MI32x32x4x1_SE_GRVW2_GSU3_LPB4_PLR9_SU0_SUS256_SRVW0_WGM2
    SolutionIndex: 163
    SolutionNameMin: Cijk_Ailk_Bljk_BBH_MT128x96x32_MI32x32x4x1_SE_GRVW4_GSU1_LPB4_PLR9_SU0_SUS256_SRVW4_WGM2
    SolutionIndex: 164
    SolutionNameMin: Cijk_Ailk_Bljk_BBH_MT96x96x64_MI16x16x8x1_SE_GRVW8_GSU1_LPB8_PLR9_SU0_SUS256_SRVW0_WGM1
    SolutionIndex: 165
    SolutionNameMin: Cijk_Ailk_Bljk_BBH_MT128x96x32_MI32x32x4x1_SE_GRVW4_GSU1_LPB4_PLR9_SU32_SUS128_SRVW4_WGM2
    SolutionIndex: 166
    SolutionNameMin: Cijk_Ailk_Bljk_BBH_MT128x160x32_MI32x32x4x1_SE_GRVW2_GSU3_LPB4_PLR9_SU0_SUS256_SRVW0_WGM15
    SolutionIndex: 167
    SolutionNameMin: Cijk_Ailk_Bljk_BBH_MT128x96x32_MI32x32x4x1_SE_GRVW4_GSU1_LPB4_PLR9_SU32_SUS256_SRVW4_WGM15
    SolutionIndex: 168
    SolutionNameMin: Cijk_Ailk_Bljk_BBH_MT128x144x32_MI16x16x8x1_SE_GRVW2_GSU5_LPB4_PLR5_SU0_SUS256_SRVW0_WGM15
    SolutionIndex: 169
    SolutionNameMin: Cijk_Ailk_Bljk_BBH_MT96x96x32_MI16x16x8x1_SE_GRVW4_GSU1_LPB4_PLR5_SU0_SUS256_SRVW0_WGM1
    SolutionIndex: 170
    SolutionNameMin: Cijk_Ailk_Bljk_BBH_MT128x96x32_MI32x32x4x1_SE_GRVW4_GSU1_LPB4_PLR9_SU0_SUS256_SRVW4_WGM1
    SolutionIndex: 171
    SolutionNameMin: Cijk_Ailk_Bljk_BBH_MT96x96x64_MI16x16x8x1_SE_GRVW2_GSU5_LPB4_PLR9_SU0_SUS256_SRVW0_WGM2
    SolutionIndex: 172
    SolutionNameMin: Cijk_Ailk_Bljk_BBH_MT128x144x32_MI16x16x8x1_SE_GRVW2_GSU1_LPB4_PLR5_SU0_SUS256_SRVW4_WGM2
    SolutionIndex: 173
    SolutionNameMin: Cijk_Ailk_Bljk_BBH_MT128x160x32_MI32x32x4x1_SE_GRVW2_GSU1_LPB4_PLR9_SU32_SUS256_SRVW4_WGM15
    SolutionIndex: 174
    SolutionNameMin: Cijk_Ailk_Bljk_BBH_MT128x96x32_MI32x32x4x1_SE_GRVW2_GSU1_LPB4_PLR9_SU32_SUS256_SRVW4_WGM2
    SolutionIndex: 175
    SolutionNameMin: Cijk_Ailk_Bljk_BBH_MT128x144x32_MI16x16x8x1_SE_GRVW2_GSU1_LPB4_PLR5_SU32_SUS256_SRVW4_WGM15
    SolutionIndex: 176
    SolutionNameMin: Cijk_Ailk_Bljk_BBH_MT128x96x32_MI32x32x4x1_SE_GRVW2_GSU1_LPB4_PLR9_SU0_SUS256_SRVW4_WGM15
    SolutionIndex: 177
    SolutionNameMin: Cijk_Ailk_Bljk_BBH_MT64x128x64_MI32x32x4x1_SE_GRVW8_GSU1_LPB8_PLR17_SU0_SUS256_SRVW4_WGM2
    SolutionIndex: 178
    SolutionNameMin: Cijk_Ailk_Bljk_BBH_MT128x160x32_MI32x32x4x1_SE_GRVW2_GSU1_LPB4_PLR9_SU32_SUS128_SRVW4_WGM15
    SolutionIndex: 179
    SolutionNameMin: Cijk_Ailk_Bljk_BBH_MT128x144x32_MI16x16x8x1_SE_GRVW2_GSU1_LPB4_PLR5_SU32_SUS128_SRVW4_WGM15
    SolutionIndex: 180
    SolutionNameMin: Cijk_Ailk_Bljk_BBH_MT128x144x32_MI16x16x8x1_SE_GRVW2_GSU1_LPB4_PLR5_SU0_SUS256_SRVW4_WGM1
    SolutionIndex: 181
    SolutionNameMin: Cijk_Ailk_Bljk_BBH_MT128x256x32_MI32x32x4x1_SE_GRVW8_GSU1_LPB8_PLR9_SU32_SUS256_SRVW4_WGM2
    SolutionIndex: 182
    SolutionNameMin: Cijk_Ailk_Bljk_BBH_MT128x96x32_MI32x32x4x1_SE_GRVW4_GSU1_LPB4_PLR9_SU32_SUS256_SRVW4_WGM2
    SolutionIndex: 183
    SolutionNameMin: Cijk_Ailk_Bljk_BBH_MT128x160x32_MI32x32x4x1_SE_GRVW2_GSU1_LPB4_PLR9_SU32_SUS256_SRVW4_WGM2
    SolutionIndex: 184
    SolutionNameMin: Cijk_Ailk_Bljk_BBH_MT32x32x32_MI16x16x8x1_SE_GRVW4_GSU1_LPB4_PLR5_SU0_SUS256_SRVW4_WGM1
    SolutionIndex: 185
    SolutionNameMin: Cijk_Ailk_Bljk_BBH_MT128x256x32_MI32x32x4x1_SE_GRVW8_GSU1_LPB8_PLR9_SU32_SUS256_SRVW4_WGM15
    SolutionIndex: 186
    SolutionNameMin: Cijk_Ailk_Bljk_BBH_MT256x64x32_MI32x32x4x1_SE_GRVW8_GSU1_LPB8_PLR9_SU0_SUS256_SRVW4_WGM15
    SolutionIndex: 187
    SolutionNameMin: Cijk_Ailk_Bljk_BBH_MT144x128x32_MI16x16x8x1_SE_GRVW2_GSU1_LPB4_PLR5_SU0_SUS256_SRVW0_WGM15
    SolutionIndex: 188
    SolutionNameMin: Cijk_Ailk_Bljk_BBH_MT144x128x32_MI16x16x8x1_SE_GRVW2_GSU1_LPB4_PLR5_SU0_SUS256_SRVW0_WGM2
    SolutionIndex: 189
    SolutionNameMin: Cijk_Ailk_Bljk_BBH_MT128x144x32_MI16x16x8x1_SE_GRVW2_GSU1_LPB4_PLR5_SU32_SUS128_SRVW4_WGM1
    SolutionIndex: 190
    SolutionNameMin: Cijk_Ailk_Bljk_BBH_MT96x96x64_MI16x16x8x1_SE_GRVW8_GSU1_LPB8_PLR9_SU0_SUS256_SRVW0_WGM15
    SolutionIndex: 191
    SolutionNameMin: Cijk_Ailk_Bljk_BBH_MT128x256x32_MI32x32x4x1_SE_GRVW8_GSU1_LPB8_PLR9_SU0_SUS256_SRVW4_WGM1
    SolutionIndex: 192
    SolutionNameMin: Cijk_Ailk_Bljk_BBH_MT128x64x32_MI32x32x4x1_SE_GRVW8_GSU1_LPB8_PLR9_SU0_SUS256_SRVW4_WGM15
    SolutionIndex: 193
    SolutionNameMin: Cijk_Ailk_Bljk_BBH_MT128x64x64_MI32x32x4x1_SE_GRVW8_GSU1_LPB8_PLR17_SU0_SUS256_SRVW4_WGM1
    SolutionIndex: 194
    SolutionNameMin: Cijk_Ailk_Bljk_BBH_MT128x160x32_MI32x32x4x1_SE_GRVW2_GSU1_LPB4_PLR9_SU32_SUS128_SRVW4_WGM2
    SolutionIndex: 195
    SolutionNameMin: Cijk_Ailk_Bljk_BBH_MT128x96x64_MI32x32x4x1_SE_GRVW2_GSU1_LPB4_PLR17_SU32_SUS256_SRVW4_WGM15
    SolutionIndex: 196
    SolutionNameMin: Cijk_Ailk_Bljk_BBH_MT128x96x64_MI32x32x4x1_SE_GRVW2_GSU1_LPB4_PLR17_SU0_SUS256_SRVW4_WGM2
    SolutionIndex: 197
    SolutionNameMin: Cijk_Ailk_Bljk_BBH_MT64x32x32_MI16x16x8x1_SE_GRVW8_GSU1_LPB8_PLR5_SU32_SUS256_SRVW4_WGM1
    SolutionIndex: 198
    SolutionNameMin: Cijk_Ailk_Bljk_BBH_MT32x32x64_MI16x16x8x1_SE_GRVW8_GSU1_LPB8_PLR9_SU32_SUS128_SRVW4_WGM2
    SolutionIndex: 199
    SolutionNameMin: Cijk_Ailk_Bljk_BBH_MT64x128x32_MI32x32x4x1_SE_GRVW8_GSU1_LPB8_PLR9_SU32_SUS128_SRVW4_WGM2
    SolutionIndex: 200
    SolutionNameMin: Cijk_Ailk_Bljk_BBH_MT64x64x32_MI32x32x4x1_SE_GRVW8_GSU1_LPB8_PLR9_SU32_SUS256_SRVW4_WGM15
    SolutionIndex: 201
    SolutionNameMin: Cijk_Ailk_Bljk_BBH_MT32x64x32_MI16x16x8x1_SE_GRVW8_GSU1_LPB8_PLR5_SU0_SUS256_SRVW4_WGM1
    SolutionIndex: 202
    SolutionNameMin: Cijk_Ailk_Bljk_BBH_MT32x32x64_MI16x16x8x1_SE_GRVW8_GSU1_LPB8_PLR9_SU32_SUS256_SRVW4_WGM1
    SolutionIndex: 203
    SolutionNameMin: Cijk_Ailk_Bljk_BBH_MT64x32x64_MI16x16x8x1_SE_GRVW4_GSU1_LPB4_PLR9_SU0_SUS256_SRVW4_WGM1
    SolutionIndex: 204
    SolutionNameMin: Cijk_Ailk_Bljk_BBH_MT256x64x32_MI32x32x4x1_SE_GRVW8_GSU3_LPB8_PLR9_SU0_SUS256_SRVW0_WGM15
    SolutionIndex: 205
    SolutionNameMin: Cijk_Ailk_Bljk_BBH_MT32x32x32_MI16x16x8x1_SE_GRVW8_GSU1_LPB8_PLR5_SU0_SUS256_SRVW4_WGM1
    SolutionIndex: 206
    SolutionNameMin: Cijk_Ailk_Bljk_BBH_MT128x128x32_MI32x32x4x1_SE_GRVW8_GSU1_LPB8_PLR9_SU0_SUS256_SRVW4_WGM1
    SolutionIndex: 207
    SolutionNameMin: Cijk_Ailk_Bljk_BBH_MT128x64x64_MI32x32x4x1_SE_GRVW8_GSU5_LPB8_PLR17_SU0_SUS256_SRVW0_WGM15
    SolutionIndex: 208
    SolutionNameMin: Cijk_Ailk_Bljk_BBH_MT64x128x32_MI32x32x4x1_SE_GRVW2_GSU1_LPB4_PLR9_SU0_SUS256_SRVW4_WGM1
    SolutionIndex: 209
    SolutionNameMin: Cijk_Ailk_Bljk_BBH_MT128x96x32_MI32x32x4x1_SE_GRVW4_GSU1_LPB4_PLR9_SU0_SUS256_SRVW4_WGM15
    SolutionIndex: 210
    SolutionNameMin: Cijk_Ailk_Bljk_BBH_MT32x32x64_MI16x16x8x1_SE_GRVW8_GSU5_LPB8_PLR9_SU0_SUS256_SRVW0_WGM1
    SolutionIndex: 211
    SolutionNameMin: Cijk_Ailk_Bljk_BBH_MT128x144x32_MI16x16x8x1_SE_1LDSB1_GRVW2_LPB4_NLCA1_PLR5_SU32_SUS256_SRVW4_TT2_144_WG64_4_1_WGM1
    SolutionIndex: 212
    SolutionNameMin: Cijk_Ailk_Bljk_BBH_MT64x128x32_MI32x32x4x1_SE_1LDSB0_GRVW8_LPB8_NLCA1_PLR9_SU32_SUS128_SRVW4_TT1_64_WG64_4_1_WGM1
    SolutionIndex: 213
    SolutionNameMin: Cijk_Ailk_Bljk_BBH_MT64x128x32_MI32x32x4x1_SE_1LDSB0_GRVW8_LPB8_NLCA1_PLR9_SU0_SUS256_SRVW4_TT1_64_WG64_4_1_WGM1
    SolutionIndex: 214
    SolutionNameMin: Cijk_Ailk_Bljk_BBH_MT64x128x32_MI32x32x4x1_SE_1LDSB0_GRVW8_LPB8_NLCA1_PLR9_SU32_SUS256_SRVW4_TT1_64_WG64_4_1_WGM1
    SolutionIndex: 215
    SolutionNameMin: Cijk_Ailk_Bljk_BBH_MT64x128x32_MI32x32x4x1_SE_1LDSB0_GRVW8_LPB8_NLCA1_PLR9_SU0_SUS256_SRVW4_TT1_64_WG64_4_1_WGM15
    SolutionIndex: 216
    SolutionNameMin: Cijk_Ailk_Bljk_BBH_MT128x96x32_MI32x32x4x1_SE_1LDSB0_GRVW4_LPB4_NLCA1_PLR9_SU0_SUS256_SRVW4_TT1_96_WG128_2_1_WGM15
    SolutionIndex: 217
    SolutionNameMin: Cijk_Ailk_Bljk_BBH_MT64x128x32_MI32x32x4x1_SE_1LDSB0_GRVW2_LPB4_NLCA1_PLR9_SU0_SUS256_SRVW4_TT1_64_WG64_4_1_WGM1
    SolutionIndex: 218
    SolutionNameMin: Cijk_Ailk_Bljk_BBH_MT64x128x32_MI32x32x4x1_SE_1LDSB0_GRVW8_LPB8_NLCA1_PLR9_SU0_SUS256_SRVW4_TT1_64_WG64_4_1_WGM15
    SolutionIndex: 219
    SolutionNameMin: Cijk_Ailk_Bljk_BBH_MT128x256x32_MI32x32x4x1_SE_GRVW2_LPB4_PLR9_SU0_SUS256_SRVW4_WGM1
    SolutionIndex: 220
    SolutionNameMin: Cijk_Ailk_Bljk_BBH_MT64x128x64_MI32x32x4x1_SE_GRVW8_LPB8_PLR17_SU0_SUS256_SRVW4_WGM1
    SolutionIndex: 221
    SolutionNameMin: Cijk_Ailk_Bljk_BBH_MT32x64x64_MI16x16x8x1_SE_GRVW8_LPB8_PLR9_SU32_SUS128_SRVW4_WGM1
    SolutionIndex: 222
    SolutionNameMin: Cijk_Ailk_Bljk_BBH_MT256x128x32_MI32x32x4x1_SE_GRVW8_LPB8_PLR9_SU0_SUS256_SRVW4_WGM15
    SolutionIndex: 223
    SolutionNameMin: Cijk_Ailk_Bljk_BBH_MT128x64x64_MI32x32x4x1_SE_GRVW8_LPB8_PLR17_SU0_SUS256_SRVW4_WGM2
    SolutionIndex: 224
    SolutionNameMin: Cijk_Ailk_Bljk_BBH_MT32x32x64_MI16x16x8x1_SE_GRVW8_LPB8_PLR9_SU0_SUS256_SRVW4_WGM15
    SolutionIndex: 225
    SolutionNameMin: Cijk_Ailk_Bljk_BBH_MT128x160x32_MI32x32x4x1_SE_GRVW2_LPB4_PLR9_SU0_SUS256_SRVW4_WGM15
    SolutionIndex: 226
    SolutionNameMin: Cijk_Ailk_Bljk_BBH_MT128x144x32_MI16x16x8x1_SE_GRVW2_LPB4_PLR5_SU0_SUS256_SRVW4_WGM15
    SolutionIndex: 227
    SolutionNameMin: Cijk_Ailk_Bljk_BBH_MT32x64x64_MI16x16x8x1_SE_GRVW4_LPB4_PLR9_SU32_SUS256_SRVW4_WGM2
    SolutionIndex: 228
    SolutionNameMin: Cijk_Ailk_Bljk_BBH_MT64x64x32_MI32x32x4x1_SE_GRVW8_LPB8_PLR9_SU32_SUS256_SRVW4_WGM2
    SolutionIndex: 229
    SolutionNameMin: Cijk_Ailk_Bljk_BBH_MT64x128x32_MI32x32x4x1_SE_GRVW2_LPB4_PLR9_SU32_SUS128_SRVW4_WGM1
    SolutionIndex: 230
    SolutionNameMin: Cijk_Ailk_Bljk_BBH_MT32x32x32_MI16x16x8x1_SE_GRVW2_LPB4_PLR5_SU0_SUS256_SRVW4_WGM1
    SolutionIndex: 231
    SolutionNameMin: Cijk_Ailk_Bljk_BBH_MT32x32x64_MI16x16x8x1_SE_GRVW8_LPB8_PLR9_SU0_SUS256_SRVW0_WGM2
    SolutionIndex: 232
    SolutionNameMin: Cijk_Ailk_Bljk_BBH_MT128x96x32_MI32x32x4x1_SE_GRVW4_LPB4_PLR9_SU0_SUS256_SRVW0_WGM1
    SolutionIndex: 233
    SolutionNameMin: Cijk_Ailk_Bljk_BBH_MT64x64x32_MI32x32x4x1_SE_GRVW2_LPB4_PLR9_SU0_SUS256_SRVW4_WGM2
    SolutionIndex: 234
    SolutionNameMin: Cijk_Ailk_Bljk_BBH_MT64x64x32_MI32x32x4x1_SE_GRVW8_LPB8_PLR9_SU32_SUS256_SRVW4_WGM15
    SolutionIndex: 235
    SolutionNameMin: Cijk_Ailk_Bljk_BBH_MT128x256x32_MI32x32x4x1_SE_GRVW8_LPB8_PLR9_SU32_SUS256_SRVW4_WGM1
    SolutionIndex: 236
    SolutionNameMin: Cijk_Ailk_Bljk_BBH_MT144x128x32_MI16x16x8x1_SE_GRVW2_LPB4_PLR5_SU32_SUS128_SRVW0_WGM2
    SolutionIndex: 237
    SolutionNameMin: Cijk_Ailk_Bljk_BBH_MT128x96x32_MI32x32x4x1_SE_GRVW4_LPB4_PLR9_SU0_SUS256_SRVW4_WGM1
    SolutionIndex: 238
    SolutionNameMin: Cijk_Ailk_Bljk_BBH_MT64x128x32_MI32x32x4x1_SE_GRVW8_LPB8_PLR9_SU32_SUS128_SRVW4_WGM15
    SolutionIndex: 239
    SolutionNameMin: Cijk_Ailk_Bljk_BBH_MT64x128x32_MI32x32x4x1_SE_GRVW8_LPB8_PLR9_SU0_SUS256_SRVW4_WGM1
    SolutionIndex: 240
    SolutionNameMin: Cijk_Ailk_Bljk_BBH_MT32x32x64_MI16x16x8x1_SE_GRVW4_LPB4_PLR9_SU0_SUS256_SRVW0_WGM1
    SolutionIndex: 241
    SolutionNameMin: Cijk_Ailk_Bljk_BBH_MT32x32x64_MI16x16x8x1_SE_GRVW8_LPB8_PLR9_SU32_SUS128_SRVW4_WGM15
    SolutionIndex: 242
    SolutionNameMin: Cijk_Ailk_Bljk_BBH_MT128x128x32_MI32x32x4x1_SE_GRVW4_LPB4_PLR9_SU0_SUS256_SRVW0_WGM1
    SolutionIndex: 243
    SolutionNameMin: Cijk_Ailk_Bljk_BBH_MT64x128x32_MI32x32x4x1_SE_GRVW4_LPB4_PLR9_SU32_SUS256_SRVW4_WGM15
    SolutionIndex: 244
    SolutionNameMin: Cijk_Ailk_Bljk_BBH_MT64x128x32_MI32x32x4x1_SE_GRVW4_LPB4_PLR9_SU0_SUS256_SRVW4_WGM1
    SolutionIndex: 245
    SolutionNameMin: Cijk_Ailk_Bljk_BBH_MT128x96x32_MI32x32x4x1_SE_GRVW2_LPB4_PLR9_SU32_SUS128_SRVW4_WGM15
    SolutionIndex: 246
    SolutionNameMin: Cijk_Ailk_Bljk_BBH_MT128x96x64_MI32x32x4x1_SE_GRVW4_LPB4_PLR17_SU32_SUS256_SRVW4_WGM2
    SolutionIndex: 247
    SolutionNameMin: Cijk_Ailk_Bljk_BBH_MT64x128x32_MI32x32x4x1_SE_GRVW2_LPB4_PLR9_SU0_SUS256_SRVW4_WGM15
    SolutionIndex: 248
    SolutionNameMin: Cijk_Ailk_Bljk_BBH_MT32x32x64_MI16x16x8x1_SE_GRVW4_LPB4_PLR9_SU32_SUS128_SRVW0_WGM1
    SolutionIndex: 249
    SolutionNameMin: Cijk_Ailk_Bljk_BBH_MT64x128x64_MI32x32x4x1_SE_GRVW8_LPB8_PLR17_SU0_SUS256_SRVW4_WGM15
    SolutionIndex: 250
    SolutionNameMin: Cijk_Ailk_Bljk_BBH_MT128x160x32_MI32x32x4x1_SE_GRVW2_LPB4_PLR9_SU0_SUS256_SRVW0_WGM15
    SolutionIndex: 251
    SolutionNameMin: Cijk_Ailk_Bljk_BBH_MT128x96x32_MI32x32x4x1_SE_GRVW4_LPB4_PLR9_SU0_SUS256_SRVW4_WGM2
    SolutionIndex: 252
    SolutionNameMin: Cijk_Ailk_Bljk_BBH_MT32x32x64_MI16x16x8x1_SE_GRVW8_LPB8_PLR9_SU0_SUS256_SRVW4_WGM2
    SolutionIndex: 253
    SolutionNameMin: Cijk_Ailk_Bljk_BBH_MT32x32x64_MI16x16x8x1_SE_GRVW8_LPB8_PLR9_SU0_SUS256_SRVW0_WGM1
    SolutionIndex: 254
    SolutionNameMin: Cijk_Ailk_Bljk_BBH_MT32x64x64_MI16x16x8x1_SE_GRVW4_LPB4_PLR9_SU32_SUS256_SRVW4_WGM15
    SolutionIndex: 255
    SolutionNameMin: Cijk_Ailk_Bljk_BBH_MT128x160x32_MI32x32x4x1_SE_GRVW2_LPB4_PLR9_SU32_SUS128_SRVW0_WGM15
    SolutionIndex: 256
    SolutionNameMin: Cijk_Ailk_Bljk_BBH_MT128x144x32_MI16x16x8x1_SE_GRVW2_LPB4_PLR5_SU0_SUS256_SRVW4_WGM2
    SolutionIndex: 257
    SolutionNameMin: Cijk_Ailk_Bljk_BBH_MT128x144x32_MI16x16x8x1_SE_GRVW2_LPB4_PLR5_SU0_SUS256_SRVW4_WGM15
    SolutionIndex: 258
    SolutionNameMin: Cijk_Ailk_Bljk_BBH_MT128x96x32_MI32x32x4x1_SE_GRVW4_LPB4_PLR9_SU32_SUS128_SRVW4_WGM2
    SolutionIndex: 259
    SolutionNameMin: Cijk_Ailk_Bljk_BBH_MT32x32x64_MI16x16x8x1_SE_GRVW2_LPB4_PLR9_SU32_SUS128_SRVW0_WGM1
    SolutionIndex: 260
    SolutionNameMin: Cijk_Ailk_Bljk_BBH_MT128x256x32_MI32x32x4x1_SE_GRVW8_LPB8_PLR9_SU0_SUS256_SRVW4_WGM15
    SolutionIndex: 261
    SolutionNameMin: Cijk_Ailk_Bljk_BBH_MT128x64x32_MI32x32x4x1_SE_GRVW8_LPB8_PLR9_SU0_SUS256_SRVW4_WGM2
    SolutionIndex: 262
    SolutionNameMin: Cijk_Ailk_Bljk_BBH_MT128x96x32_MI32x32x4x1_SE_GRVW4_LPB4_PLR9_SU32_SUS256_SRVW4_WGM15
    SolutionIndex: 263
    SolutionNameMin: Cijk_Ailk_Bljk_BBH_MT32x32x64_MI16x16x8x1_SE_GRVW8_LPB8_PLR9_SU32_SUS128_SRVW0_WGM1
    SolutionIndex: 264
    SolutionNameMin: Cijk_Ailk_Bljk_BBH_MT64x128x64_MI32x32x4x1_SE_GRVW4_LPB4_PLR17_SU0_SUS256_SRVW4_WGM15
    SolutionIndex: 265
    SolutionNameMin: Cijk_Ailk_Bljk_BBH_MT128x144x32_MI16x16x8x1_SE_GRVW2_LPB4_PLR5_SU0_SUS256_SRVW0_WGM15
    SolutionIndex: 266
    SolutionNameMin: Cijk_Ailk_Bljk_BBH_MT64x128x32_MI32x32x4x1_SE_GRVW4_LPB4_PLR9_SU0_SUS256_SRVW4_WGM2
    SolutionIndex: 267
    SolutionNameMin: Cijk_Ailk_Bljk_BBH_MT128x64x32_MI32x32x4x1_SE_GRVW8_LPB8_PLR9_SU0_SUS256_SRVW4_WGM15
    SolutionIndex: 268
    SolutionNameMin: Cijk_Ailk_Bljk_BBH_MT64x128x64_MI32x32x4x1_SE_GRVW8_LPB8_PLR17_SU32_SUS128_SRVW4_WGM2
    SolutionIndex: 269
    SolutionNameMin: Cijk_Ailk_Bljk_BBH_MT32x64x32_MI16x16x8x1_SE_GRVW2_LPB4_PLR5_SU0_SUS256_SRVW4_WGM1
    SolutionIndex: 270
    SolutionNameMin: Cijk_Ailk_Bljk_BBH_MT32x64x64_MI16x16x8x1_SE_GRVW2_LPB4_PLR9_SU0_SUS256_SRVW0_WGM1
    SolutionIndex: 271
    SolutionNameMin: Cijk_Ailk_Bljk_BBH_MT64x64x64_MI32x32x4x1_SE_GRVW8_LPB8_PLR17_SU32_SUS256_SRVW4_WGM2
    SolutionIndex: 272
    SolutionNameMin: Cijk_Ailk_Bljk_BBH_MT128x144x32_MI16x16x8x1_SE_GRVW2_LPB4_PLR5_SU0_SUS256_SRVW0_WGM1
    SolutionIndex: 273
    SolutionNameMin: Cijk_Ailk_Bljk_BBH_MT64x128x32_MI32x32x4x1_SE_GRVW8_LPB8_PLR9_SU0_SUS256_SRVW4_WGM15
    SolutionIndex: 274
    SolutionNameMin: Cijk_Ailk_Bljk_BBH_MT128x96x64_MI32x32x4x1_SE_GRVW2_LPB4_PLR17_SU0_SUS256_SRVW4_WGM15
    SolutionIndex: 275
    SolutionNameMin: Cijk_Ailk_Bljk_BBH_MT64x16x32_MI16x16x8x1_SE_GRVW8_LPB8_PLR5_SU0_SUS256_SRVW0_WGM2
    SolutionIndex: 276
    SolutionNameMin: Cijk_Ailk_Bljk_BBH_MT128x96x64_MI32x32x4x1_SE_GRVW2_LPB4_PLR17_SU32_SUS128_SRVW0_WGM2
    SolutionIndex: 277
    SolutionNameMin: Cijk_Ailk_Bljk_BBH_MT96x96x64_MI16x16x8x1_SE_GRVW8_LPB8_PLR9_SU0_SUS256_SRVW0_WGM1
    SolutionIndex: 278
    SolutionNameMin: Cijk_Ailk_Bljk_BBH_MT128x160x32_MI32x32x4x1_SE_GRVW4_LPB4_PLR9_SU0_SUS256_SRVW0_WGM1
    SolutionIndex: 279
    SolutionNameMin: Cijk_Ailk_Bljk_BBH_MT64x128x32_MI32x32x4x1_SE_GRVW8_LPB8_PLR9_SU32_SUS128_SRVW4_WGM1
    SolutionIndex: 280
    SolutionNameMin: Cijk_Ailk_Bljk_BBH_MT32x32x32_MI16x16x8x1_SE_GRVW8_LPB8_PLR5_SU0_SUS256_SRVW4_WGM15
    SolutionIndex: 281
    SolutionNameMin: Cijk_Ailk_Bljk_BBH_MT32x32x64_MI16x16x8x1_SE_GRVW8_LPB8_PLR9_SU32_SUS256_SRVW4_WGM15
    SolutionIndex: 282
    SolutionNameMin: Cijk_Ailk_Bljk_BBH_MT128x96x64_MI32x32x4x1_SE_GRVW8_LPB8_PLR17_SU32_SUS128_SRVW0_WGM15
    SolutionIndex: 283
    SolutionNameMin: Cijk_Ailk_Bljk_BBH_MT64x128x32_MI32x32x4x1_SE_GRVW2_LPB4_PLR9_SU0_SUS256_SRVW4_WGM1
    SolutionIndex: 284
    SolutionNameMin: Cijk_Ailk_Bljk_BBH_MT64x128x32_MI32x32x4x1_SE_GRVW8_LPB8_PLR9_SU32_SUS256_SRVW4_WGM1
    SolutionIndex: 285
    SolutionNameMin: Cijk_Ailk_Bljk_BBH_MT128x144x32_MI16x16x8x1_SE_GRVW2_LPB4_PLR5_SU32_SUS256_SRVW4_WGM1
    SolutionIndex: 286
    SolutionNameMin: Cijk_Ailk_Bljk_BBH_MT64x128x32_MI32x32x4x1_SE_GRVW8_LPB8_PLR9_SU32_SUS128_SRVW4_WGM2
    SolutionIndex: 287
    SolutionNameMin: Cijk_Ailk_Bljk_BBH_MT64x16x32_MI16x16x8x1_SE_GRVW2_LPB4_PLR5_SU0_SUS256_SRVW0_WGM1
    SolutionIndex: 288
    SolutionNameMin: Cijk_Ailk_Bljk_BBH_MT128x96x32_MI32x32x4x1_SE_GRVW2_LPB4_PLR9_SU0_SUS256_SRVW4_WGM2
    SolutionIndex: 289
    SolutionNameMin: Cijk_Ailk_Bljk_BBH_MT256x160x32_MI32x32x4x1_SE_GRVW2_LPB4_PLR9_SU0_SUS256_SRVW4_WGM15
    SolutionIndex: 290
    SolutionNameMin: Cijk_Ailk_Bljk_BBH_MT256x160x32_MI32x32x4x1_SE_GRVW2_LPB4_PLR9_SU0_SUS256_SRVW4_WGM15
    SolutionIndex: 291
    SolutionNameMin: Cijk_Ailk_Bljk_BBH_MT64x128x32_MI32x32x4x1_SE_GRVW8_LPB8_PLR9_SU32_SUS256_SRVW4_WGM2
    SolutionIndex: 292
    SolutionNameMin: Cijk_Ailk_Bljk_BBH_MT128x256x32_MI32x32x4x1_SE_GRVW2_LPB4_PLR9_SU0_SUS256_SRVW4_WGM2
    SolutionIndex: 293
    SolutionNameMin: Cijk_Ailk_Bljk_BBH_MT256x128x32_MI32x32x4x1_SE_GRVW8_LPB8_PLR9_SU0_SUS256_SRVW4_WGM15
    SolutionIndex: 294
    SolutionNameMin: Cijk_Ailk_Bljk_BBH_MT128x64x64_MI32x32x4x1_SE_GRVW8_LPB8_PLR17_SU0_SUS256_SRVW4_WGM1
    SolutionIndex: 295
    SolutionNameMin: Cijk_Ailk_Bljk_BBH_MT128x96x32_MI32x32x4x1_SE_GRVW4_LPB4_PLR9_SU0_SUS256_SRVW4_WGM15
    SolutionIndex: 296
    SolutionNameMin: Cijk_Ailk_Bljk_BBH_MT256x160x32_MI32x32x4x1_SE_GRVW4_LPB4_PLR9_SU0_SUS256_SRVW4_WGM2
    SolutionIndex: 297
    SolutionNameMin: Cijk_Ailk_Bljk_BBH_MT128x160x32_MI32x32x4x1_SE_GRVW4_LPB4_PLR9_SU0_SUS256_SRVW4_WGM2
    SolutionIndex: 298
    SolutionNameMin: Cijk_Ailk_Bljk_BBH_MT128x160x32_MI32x32x4x1_SE_GRVW2_LPB4_PLR9_SU0_SUS256_SRVW4_WGM2
    SolutionIndex: 299
    SolutionNameMin: Cijk_Ailk_Bljk_BBH_MT128x96x32_MI32x32x4x1_SE_GRVW4_LPB4_PLR9_SU32_SUS256_SRVW4_WGM2
    SolutionIndex: 300
    SolutionNameMin: Cijk_Ailk_Bljk_BBH_MT128x144x32_MI16x16x8x1_SE_GRVW2_LPB4_PLR5_SU0_SUS256_SRVW4_WGM1
    SolutionIndex: 301
    SolutionNameMin: Cijk_Ailk_Bljk_BBH_MT64x32x32_MI16x16x8x1_SE_GRVW4_LPB4_PLR5_SU0_SUS256_SRVW4_WGM1
    SolutionIndex: 302
    SolutionNameMin: Cijk_Ailk_Bljk_BBH_MT32x64x64_MI16x16x8x1_SE_GRVW8_LPB8_PLR9_SU32_SUS256_SRVW4_WGM2
    SolutionIndex: 303
    SolutionNameMin: Cijk_Ailk_Bljk_BBH_MT64x32x64_MI16x16x8x1_SE_GRVW4_LPB4_PLR9_SU32_SUS128_SRVW4_WGM1
    SolutionIndex: 304
    SolutionNameMin: Cijk_Ailk_Bljk_BBH_MT32x32x64_MI16x16x8x1_SE_GRVW4_LPB4_PLR9_SU0_SUS256_SRVW4_WGM2
    SolutionIndex: 305
    SolutionNameMin: Cijk_Ailk_Bljk_BBH_MT64x64x32_MI32x32x4x1_SE_GRVW8_LPB8_PLR9_SU0_SUS256_SRVW4_WGM2
    SolutionIndex: 306
    SolutionNameMin: Cijk_Ailk_Bljk_BBH_MT128x64x64_MI32x32x4x1_SE_GRVW4_LPB4_PLR17_SU32_SUS256_SRVW4_WGM1
    SolutionIndex: 307
    SolutionNameMin: Cijk_Ailk_Bljk_BBH_MT64x64x32_MI32x32x4x1_SE_GRVW4_LPB4_PLR9_SU0_SUS256_SRVW4_WGM1
    SolutionIndex: 308
    SolutionNameMin: Cijk_Ailk_Bljk_BBH_MT64x16x32_MI16x16x8x1_SE_GRVW4_LPB4_PLR5_SU0_SUS256_SRVW0_WGM2
    SolutionIndex: 309
    SolutionNameMin: Cijk_Ailk_Bljk_BBH_MT64x32x32_MI16x16x8x1_SE_GRVW2_LPB4_PLR5_SU0_SUS256_SRVW4_WGM1
    SolutionIndex: 310
    SolutionNameMin: Cijk_Ailk_Bljk_BBH_MT96x96x64_MI16x16x8x1_SE_GRVW8_LPB8_PLR9_SU0_SUS256_SRVW0_WGM15
    SolutionIndex: 311
    SolutionNameMin: Cijk_Ailk_Bljk_BBH_MT32x32x32_MI16x16x8x1_SE_GRVW2_LPB4_PLR5_SU0_SUS256_SRVW4_WGM2
    SolutionIndex: 312
    SolutionNameMin: Cijk_Ailk_Bljk_BBH_MT32x32x32_MI16x16x8x1_SE_GRVW4_LPB4_PLR5_SU0_SUS256_SRVW4_WGM2
    SolutionIndex: 313
    SolutionNameMin: Cijk_Ailk_Bljk_BBH_MT64x32x32_MI16x16x8x1_SE_GRVW8_LPB8_PLR5_SU32_SUS256_SRVW0_WGM1
    SolutionIndex: 314
    SolutionNameMin: Cijk_Ailk_Bljk_BBH_MT64x64x64_MI32x32x4x1_SE_GRVW8_LPB8_PLR17_SU0_SUS256_SRVW0_WGM1
    SolutionIndex: 315
    SolutionNameMin: Cijk_Ailk_Bljk_BBH_MT96x96x64_MI16x16x8x1_SE_GRVW8_LPB8_PLR9_SU0_SUS256_SRVW0_WGM1
    SolutionIndex: 316
    SolutionNameMin: Cijk_Ailk_Bljk_BBH_MT96x96x64_MI16x16x8x1_SE_GRVW8_LPB8_PLR9_SU32_SUS128_SRVW0_WGM1
    SolutionIndex: 317
    SolutionNameMin: Cijk_Ailk_Bljk_BBH_MT64x16x32_MI16x16x8x1_SE_GRVW8_LPB8_PLR5_SU0_SUS256_SRVW0_WGM1
    SolutionIndex: 318
    SolutionNameMin: Cijk_Ailk_Bljk_BBH_MT32x32x64_MI16x16x8x1_SE_GRVW8_LPB8_PLR9_SU32_SUS256_SRVW0_WGM2
    SolutionIndex: 319
    SolutionNameMin: Cijk_Ailk_Bljk_BBH_MT64x64x32_MI32x32x4x1_SE_GRVW8_LPB8_PLR9_SU32_SUS128_SRVW4_WGM1
    SolutionIndex: 320
    SolutionNameMin: Cijk_Ailk_Bljk_BBH_MT64x64x32_MI32x32x4x1_SE_GRVW8_LPB8_PLR9_SU32_SUS128_SRVW4_WGM15
    SolutionIndex: 321
    SolutionNameMin: Cijk_Ailk_Bljk_BBH_MT128x64x32_MI32x32x4x1_SE_GRVW2_LPB4_PLR9_SU0_SUS256_SRVW4_WGM1
    SolutionIndex: 322
    SolutionNameMin: Cijk_Ailk_Bljk_BBH_MT128x128x32_MI32x32x4x1_SE_GRVW8_LPB8_PLR9_SU32_SUS256_SRVW4_WGM15
    SolutionIndex: 323
    SolutionNameMin: Cijk_Ailk_Bljk_BBH_MT128x256x32_MI32x32x4x1_SE_GRVW8_LPB8_PLR9_SU32_SUS256_SRVW4_WGM2
    SolutionIndex: 324
    SolutionNameMin: Cijk_Ailk_Bljk_BBH_MT128x144x32_MI16x16x8x1_SE_GRVW2_LPB4_PLR5_SU32_SUS256_SRVW4_WGM15
    SolutionIndex: 325
    SolutionNameMin: Cijk_Ailk_Bljk_BBH_MT128x256x32_MI32x32x4x1_SE_GRVW8_LPB8_PLR9_SU32_SUS256_SRVW4_WGM15
    SolutionIndex: 326
    SolutionNameMin: Cijk_Ailk_Bljk_BBH_MT128x96x32_MI32x32x4x1_SE_GRVW4_LPB4_PLR9_SU32_SUS128_SRVW4_WGM15
    SolutionIndex: 327
    SolutionNameMin: Cijk_Ailk_Bljk_BBH_MT128x96x32_MI32x32x4x1_SE_GRVW2_LPB4_PLR9_SU32_SUS128_SRVW4_WGM2
    SolutionIndex: 328
    SolutionNameMin: Cijk_Ailk_Bljk_BBH_MT64x64x32_MI32x32x4x1_SE_GRVW8_LPB8_PLR9_SU0_SUS256_SRVW4_WGM1
    SolutionIndex: 329
    SolutionNameMin: Cijk_Ailk_Bljk_BBH_MT32x32x64_MI16x16x8x1_SE_GRVW2_LPB4_PLR9_SU0_SUS256_SRVW0_WGM15
    SolutionIndex: 330
    SolutionNameMin: Cijk_Ailk_Bljk_BBH_MT256x64x32_MI32x32x4x1_SE_GRVW4_LPB4_PLR9_SU0_SUS256_SRVW4_WGM15
    SolutionIndex: 331
    SolutionNameMin: Cijk_Ailk_Bljk_BBH_MT128x128x32_MI32x32x4x1_SE_GRVW8_LPB8_PLR9_SU0_SUS256_SRVW4_WGM1
    SolutionIndex: 332
    SolutionNameMin: Cijk_Ailk_Bljk_BBH_MT128x96x32_MI32x32x4x1_SE_GRVW2_LPB4_PLR9_SU32_SUS256_SRVW4_WGM15
    SolutionIndex: 333
    SolutionNameMin: Cijk_Ailk_Bljk_BBH_MT144x128x32_MI16x16x8x1_SE_GRVW2_LPB4_PLR5_SU0_SUS256_SRVW0_WGM2
    SolutionIndex: 334
    SolutionNameMin: Cijk_Ailk_Bljk_BBH_MT144x128x32_MI16x16x8x1_SE_GRVW2_LPB4_PLR5_SU0_SUS256_SRVW0_WGM15
    SolutionIndex: 335
    SolutionNameMin: Cijk_Ailk_Bljk_BBH_MT32x32x32_MI16x16x8x1_SE_GRVW4_LPB4_PLR5_SU0_SUS256_SRVW4_WGM1
    SolutionIndex: 336
    SolutionNameMin: Cijk_Ailk_Bljk_BBH_MT64x32x64_MI16x16x8x1_SE_GRVW8_LPB8_PLR9_SU0_SUS256_SRVW0_WGM1
    SolutionIndex: 337
    SolutionNameMin: Cijk_Ailk_Bljk_BBH_MT96x96x32_MI16x16x8x1_SE_GRVW4_LPB4_PLR5_SU32_SUS128_SRVW0_WGM15
    SolutionIndex: 338
    SolutionNameMin: Cijk_Ailk_Bljk_BBH_MT128x96x64_MI32x32x4x1_SE_GRVW2_LPB4_PLR17_SU32_SUS128_SRVW4_WGM2
    SolutionIndex: 339
    SolutionNameMin: Cijk_Ailk_Bljk_BBH_MT128x256x32_MI32x32x4x1_SE_GRVW8_LPB8_PLR9_SU32_SUS128_SRVW4_WGM1
    SolutionIndex: 340
    SolutionNameMin: Cijk_Ailk_Bljk_BBH_MT128x64x32_MI32x32x4x1_SE_GRVW8_LPB8_PLR9_SU0_SUS256_SRVW4_WGM1
    SolutionIndex: 341
    SolutionNameMin: Cijk_Ailk_Bljk_BBH_MT128x256x32_MI32x32x4x1_SE_GRVW8_LPB8_PLR9_SU0_SUS256_SRVW4_WGM1
    SolutionIndex: 342
    SolutionNameMin: Cijk_Ailk_Bljk_BBH_MT96x96x64_MI16x16x8x1_SE_GRVW8_LPB8_PLR9_SU32_SUS128_SRVW0_WGM15
    SolutionIndex: 343
    SolutionNameMin: Cijk_Ailk_Bljk_BBH_MT128x256x32_MI32x32x4x1_SE_GRVW8_LPB8_PLR9_SU0_SUS256_SRVW4_WGM2
    SolutionIndex: 344
    SolutionNameMin: Cijk_Ailk_Bljk_BBH_MT64x128x64_MI32x32x4x1_SE_GRVW8_LPB8_PLR17_SU0_SUS256_SRVW4_WGM2
    SolutionIndex: 345
    SolutionNameMin: Cijk_Ailk_Bljk_BBH_MT64x128x64_MI32x32x4x1_SE_GRVW8_LPB8_PLR17_SU32_SUS256_SRVW4_WGM15
    SolutionIndex: 346
    SolutionNameMin: Cijk_Ailk_Bljk_BBH_MT128x144x32_MI16x16x8x1_SE_GRVW2_LPB4_PLR5_SU32_SUS256_SRVW4_WGM2
    SolutionIndex: 347
    SolutionNameMin: Cijk_Ailk_Bljk_BBH_MT64x32x32_MI16x16x8x1_SE_GRVW8_LPB8_PLR5_SU32_SUS128_SRVW4_WGM1
    SolutionIndex: 348
    SolutionNameMin: Cijk_Ailk_Bljk_BBH_MT32x32x64_MI16x16x8x1_SE_GRVW4_LPB4_PLR9_SU32_SUS256_SRVW0_WGM2
    SolutionIndex: 349
    SolutionNameMin: Cijk_Ailk_Bljk_BBH_MT256x128x32_MI32x32x4x1_SE_GRVW4_LPB4_PLR9_SU32_SUS256_SRVW4_WGM15
    SolutionIndex: 350
    SolutionNameMin: Cijk_Ailk_Bljk_BBH_MT128x96x32_MI32x32x4x1_SE_GRVW4_LPB4_PLR9_SU32_SUS128_SRVW4_WGM1
    SolutionIndex: 351
    SolutionNameMin: Cijk_Ailk_Bljk_BBH_MT128x64x64_MI32x32x4x1_SE_GRVW4_LPB4_PLR17_SU32_SUS128_SRVW4_WGM2
    SolutionIndex: 352
    SolutionNameMin: Cijk_Ailk_Bljk_BBH_MT64x64x32_MI32x32x4x1_SE_GRVW8_LPB8_PLR9_SU32_SUS128_SRVW4_WGM2
    SolutionIndex: 353
    SolutionNameMin: Cijk_Ailk_Bljk_BBH_MT64x64x32_MI32x32x4x1_SE_GRVW8_LPB8_PLR9_SU0_SUS256_SRVW4_WGM15
    SolutionIndex: 354
    SolutionNameMin: Cijk_Ailk_Bljk_BBH_MT64x128x32_MI32x32x4x1_SE_GRVW8_LPB8_PLR9_SU32_SUS256_SRVW4_WGM15
    SolutionIndex: 355
    SolutionNameMin: Cijk_Ailk_Bljk_BBH_MT64x32x64_MI16x16x8x1_SE_GRVW4_LPB4_PLR9_SU0_SUS256_SRVW4_WGM1
    SolutionIndex: 356
    SolutionNameMin: Cijk_Ailk_Bljk_BBH_MT128x128x32_MI32x32x4x1_SE_GRVW4_LPB4_PLR9_SU0_SUS256_SRVW4_WGM1
    SolutionIndex: 357
    SolutionNameMin: Cijk_Ailk_Bljk_BBH_MT96x96x32_MI16x16x8x1_SE_GRVW4_LPB4_PLR5_SU0_SUS256_SRVW0_WGM15
    SolutionIndex: 358
    SolutionNameMin: Cijk_Ailk_Bljk_BBH_MT64x64x64_MI32x32x4x1_SE_GRVW8_LPB8_PLR17_SU32_SUS128_SRVW4_WGM15
    SolutionIndex: 359
    SolutionNameMin: Cijk_Ailk_Bljk_BBH_MT64x64x64_MI32x32x4x1_SE_GRVW4_LPB4_PLR17_SU0_SUS256_SRVW4_WGM2
    SolutionIndex: 360
    SolutionNameMin: Cijk_Ailk_Bljk_BBH_MT128x128x32_MI32x32x4x1_SE_GRVW2_LPB4_PLR9_SU0_SUS256_SRVW0_WGM15
    SolutionIndex: 361
    SolutionNameMin: Cijk_Ailk_Bljk_BBH_MT256x128x32_MI32x32x4x1_SE_GRVW8_LPB8_PLR9_SU32_SUS256_SRVW0_WGM15
    SolutionIndex: 362
    SolutionNameMin: Cijk_Ailk_Bljk_BBH_MT256x160x32_MI32x32x4x1_SE_GRVW2_LPB4_PLR9_SU0_SUS256_SRVW0_WGM1
    SolutionIndex: 363
    SolutionNameMin: Cijk_Ailk_Bljk_BBH_MT32x32x64_MI16x16x8x1_SE_GRVW8_LPB8_PLR9_SU32_SUS128_SRVW4_WGM2
    SolutionIndex: 364
    SolutionNameMin: Cijk_Ailk_Bljk_BBH_MT32x32x32_MI16x16x8x1_SE_GRVW8_LPB8_PLR5_SU0_SUS256_SRVW4_WGM1
    SolutionIndex: 365
    SolutionNameMin: Cijk_Ailk_Bljk_BBH_MT128x144x32_MI16x16x8x1_SE_GRVW2_LPB4_PLR5_SU32_SUS128_SRVW4_WGM1
    SolutionIndex: 366
    SolutionNameMin: Cijk_Ailk_Bljk_BBH_MT64x32x32_MI16x16x8x1_SE_GRVW8_LPB8_PLR5_SU32_SUS128_SRVW4_WGM15
    SolutionIndex: 367
    SolutionNameMin: Cijk_Ailk_Bljk_BBH_MT32x32x64_MI16x16x8x1_SE_GRVW8_LPB8_PLR9_SU32_SUS256_SRVW4_WGM1
    SolutionIndex: 368
    SolutionNameMin: Cijk_Ailk_Bljk_BBH_MT32x32x64_MI16x16x8x1_SE_GRVW2_LPB4_PLR9_SU32_SUS128_SRVW4_WGM1
    SolutionIndex: 369
    SolutionNameMin: Cijk_Ailk_Bljk_BBH_MT256x64x32_MI32x32x4x1_SE_GRVW8_LPB8_PLR9_SU0_SUS256_SRVW0_WGM15
    SolutionIndex: 370
    SolutionNameMin: Cijk_Ailk_Bljk_BBH_MT128x64x32_MI32x32x4x1_SE_GRVW4_LPB4_PLR9_SU0_SUS256_SRVW4_WGM1
    SolutionIndex: 371
    SolutionNameMin: Cijk_Ailk_Bljk_BBH_MT32x64x64_MI16x16x8x1_SE_GRVW8_LPB8_PLR9_SU0_SUS256_SRVW4_WGM1
    SolutionIndex: 372
    SolutionNameMin: Cijk_Ailk_Bljk_BBH_MT64x128x64_MI32x32x4x1_SE_GRVW8_LPB8_PLR17_SU32_SUS256_SRVW4_WGM1
    SolutionIndex: 373
    SolutionNameMin: Cijk_Ailk_Bljk_BBH_MT64x64x64_MI32x32x4x1_SE_GRVW8_LPB8_PLR17_SU32_SUS256_SRVW4_WGM15
    SolutionIndex: 374
    SolutionNameMin: Cijk_Ailk_Bljk_BBH_MT64x128x64_MI32x32x4x1_SE_GRVW8_LPB8_PLR17_SU32_SUS128_SRVW4_WGM1
    SolutionIndex: 375
    SolutionNameMin: Cijk_Ailk_Bljk_BBH_MT128x144x32_MI16x16x8x1_SE_GRVW2_LPB4_PLR5_SU0_SUS256_SRVW4_WGM2
    SolutionIndex: 376
    SolutionNameMin: Cijk_Ailk_Bljk_BBH_MT32x32x64_MI16x16x8x1_SE_GRVW4_LPB4_PLR9_SU32_SUS256_SRVW4_WGM2
    SolutionIndex: 377
    SolutionNameMin: Cijk_Ailk_Bljk_BBH_MT32x64x64_MI16x16x8x1_SE_GRVW4_LPB4_PLR9_SU32_SUS128_SRVW0_WGM1
    SolutionIndex: 378
    SolutionNameMin: Cijk_Ailk_Bljk_BBH_MT128x64x32_MI32x32x4x1_SE_GRVW8_LPB8_PLR9_SU32_SUS128_SRVW4_WGM1
    SolutionIndex: 379
    SolutionNameMin: Cijk_Ailk_Bljk_BBH_MT64x128x32_MI32x32x4x1_SE_GRVW8_LPB8_PLR9_SU0_SUS256_SRVW4_WGM2
    SolutionIndex: 380
    SolutionNameMin: Cijk_Ailk_Bljk_BBH_MT256x128x32_MI32x32x4x1_SE_GRVW4_LPB4_PLR9_SU0_SUS256_SRVW0_WGM1
    SolutionIndex: 381
    SolutionNameMin: Cijk_Ailk_Bljk_BBH_MT64x32x32_MI16x16x8x1_SE_GRVW8_LPB8_PLR5_SU0_SUS256_SRVW4_WGM1
    SolutionIndex: 382
    SolutionNameMin: Cijk_Ailk_Bljk_BBH_MT32x32x64_MI16x16x8x1_SE_GRVW8_LPB8_PLR9_SU32_SUS128_SRVW4_WGM1
    SolutionIndex: 383
    SolutionNameMin: Cijk_Ailk_Bljk_BBH_MT128x64x32_MI32x32x4x1_SE_GRVW8_LPB8_PLR9_SU32_SUS256_SRVW4_WGM1
    SolutionIndex: 384
    SolutionNameMin: Cijk_Ailk_Bljk_BBH_MT128x256x32_MI32x32x4x1_SE_GRVW8_LPB8_PLR9_SU32_SUS128_SRVW4_WGM1
    SolutionIndex: 385
    SolutionNameMin: Cijk_Ailk_Bljk_BBH_MT256x128x32_MI32x32x4x1_SE_GRVW8_LPB8_PLR9_SU0_SUS256_SRVW4_WGM1
    SolutionIndex: 386
    SolutionNameMin: Cijk_Ailk_Bljk_BBH_MT128x96x32_MI32x32x4x1_SE_GRVW4_LPB4_PLR9_SU32_SUS256_SRVW4_WGM1
    SolutionIndex: 387
    SolutionNameMin: Cijk_Ailk_Bljk_BBH_MT256x160x32_MI32x32x4x1_SE_GRVW4_LPB4_PLR9_SU0_SUS256_SRVW4_WGM1
    SolutionIndex: 388
    SolutionNameMin: Cijk_Ailk_Bljk_BBH_MT32x32x64_MI16x16x8x1_SE_GRVW2_LPB4_PLR9_SU0_SUS256_SRVW0_WGM1
    SolutionIndex: 389
    SolutionNameMin: Cijk_Ailk_Bljk_BBH_MT32x32x64_MI16x16x8x1_SE_GRVW4_LPB4_PLR9_SU0_SUS256_SRVW0_WGM1
    SolutionIndex: 390
    SolutionNameMin: Cijk_Ailk_Bljk_BBH_MT32x64x64_MI16x16x8x1_SE_GRVW4_LPB4_PLR9_SU0_SUS256_SRVW0_WGM1
    SolutionIndex: 391
    SolutionNameMin: Cijk_Ailk_Bljk_BBH_MT64x128x64_MI32x32x4x1_SE_GRVW2_LPB4_PLR17_SU0_SUS256_SRVW0_WGM1
    SolutionIndex: 392
    SolutionNameMin: Cijk_Ailk_Bljk_BBH_MT128x96x32_MI32x32x4x1_SE_GRVW4_LPB4_PLR9_SU0_SUS256_SRVW4_WGM2
    SolutionIndex: 393
    SolutionNameMin: Cijk_Ailk_Bljk_BBH_MT64x128x32_MI32x32x4x1_SE_GRVW4_LPB4_PLR9_SU0_SUS256_SRVW4_WGM2
    SolutionIndex: 394
    SolutionNameMin: Cijk_Ailk_Bljk_BBH_MT64x128x64_MI32x32x4x1_SE_GRVW4_LPB4_PLR17_SU0_SUS256_SRVW4_WGM1
    SolutionIndex: 395
    SolutionNameMin: Cijk_Ailk_Bljk_BBH_MT64x128x64_MI32x32x4x1_SE_GRVW8_LPB8_PLR17_SU32_SUS128_SRVW4_WGM1
    SolutionIndex: 396
    SolutionNameMin: Cijk_Ailk_Bljk_BBH_MT64x128x64_MI32x32x4x1_SE_GRVW8_LPB8_PLR17_SU0_SUS256_SRVW4_WGM1
    SolutionIndex: 397
    SolutionNameMin: Cijk_Ailk_Bljk_BBH_MT128x96x32_MI32x32x4x1_SE_GRVW4_LPB4_PLR9_SU0_SUS256_SRVW4_WGM15
    SolutionIndex: 398
    SolutionNameMin: Cijk_Ailk_Bljk_BBH_MT64x128x32_MI32x32x4x1_SE_GRVW4_LPB4_PLR9_SU0_SUS256_SRVW4_WGM15
    SolutionIndex: 399
    SolutionNameMin: Cijk_Ailk_Bljk_BBH_MT64x128x64_MI32x32x4x1_SE_GRVW8_LPB8_PLR17_SU0_SUS256_SRVW4_WGM15
    SolutionIndex: 400
    SolutionNameMin: Cijk_Ailk_Bljk_BBH_MT64x32x32_MI16x16x8x1_SE_GRVW2_LPB4_PLR5_SU32_SUS256_SRVW4_WGM1
    SolutionIndex: 401
    SolutionNameMin: Cijk_Ailk_Bljk_BBH_MT128x64x32_MI32x32x4x1_SE_GRVW2_LPB4_PLR9_SU0_SUS256_SRVW4_WGM15
    SolutionIndex: 402
    SolutionNameMin: Cijk_Ailk_Bljk_BBH_MT128x64x32_MI32x32x4x1_SE_GRVW8_LPB8_PLR9_SU0_SUS256_SRVW4_WGM15
    SolutionIndex: 403
    SolutionNameMin: Cijk_Ailk_Bljk_BBH_MT128x64x32_MI32x32x4x1_SE_GRVW4_LPB4_PLR9_SU0_SUS256_SRVW4_WGM2
    SolutionIndex: 404
    SolutionNameMin: Cijk_Ailk_Bljk_BBH_MT128x64x32_MI32x32x4x1_SE_GRVW4_LPB4_PLR9_SU0_SUS256_SRVW4_WGM1
    SolutionIndex: 405
    SolutionNameMin: Cijk_Ailk_Bljk_BBH_MT128x64x32_MI32x32x4x1_SE_GRVW8_LPB8_PLR9_SU0_SUS256_SRVW4_WGM1
    SolutionIndex: 406
    SolutionNameMin: Cijk_Ailk_Bljk_BBH_MT64x128x32_MI32x32x4x1_SE_GRVW8_LPB8_PLR9_SU0_SUS256_SRVW4_WGM15
    SolutionIndex: 407
    SolutionNameMin: Cijk_Ailk_Bljk_BBH_MT128x64x32_MI32x32x4x1_SE_GRVW8_LPB8_PLR9_SU0_SUS256_SRVW4_WGM2
    SolutionIndex: 408
    SolutionNameMin: Cijk_Ailk_Bljk_BBH_MT64x32x32_MI16x16x8x1_SE_GRVW4_LPB4_PLR5_SU32_SUS256_SRVW4_WGM1
    SolutionIndex: 409
    SolutionNameMin: Cijk_Ailk_Bljk_BBH_MT128x64x32_MI32x32x4x1_SE_GRVW8_LPB8_PLR9_SU32_SUS256_SRVW4_WGM15
    SolutionIndex: 410
    SolutionNameMin: Cijk_Ailk_Bljk_BBH_MT64x64x32_MI32x32x4x1_SE_GRVW2_LPB4_PLR9_SU0_SUS256_SRVW4_WGM15
    SolutionIndex: 411
    SolutionNameMin: Cijk_Ailk_Bljk_BBH_MT64x64x32_MI32x32x4x1_SE_GRVW8_LPB8_PLR9_SU0_SUS256_SRVW4_WGM1
    SolutionIndex: 412
    SolutionNameMin: Cijk_Ailk_Bljk_BBH_MT64x64x64_MI32x32x4x1_SE_GRVW4_LPB4_PLR17_SU32_SUS256_SRVW0_WGM1
    SolutionIndex: 413
    SolutionNameMin: Cijk_Ailk_Bljk_BBH_MT32x64x64_MI16x16x8x1_SE_GRVW2_LPB4_PLR9_SU0_SUS256_SRVW0_WGM15
    SolutionIndex: 414
    SolutionNameMin: Cijk_Ailk_Bljk_BBH_MT128x256x32_MI32x32x4x1_SE_GRVW8_LPB8_PLR9_SU0_SUS256_SRVW4_WGM2
    SolutionIndex: 415
    SolutionNameMin: Cijk_Ailk_Bljk_BBH_MT64x128x32_MI32x32x4x1_SE_GRVW8_LPB8_PLR9_SU0_SUS256_SRVW4_WGM1
    SolutionIndex: 416
    SolutionNameMin: Cijk_Ailk_Bljk_BBH_MT64x128x32_MI32x32x4x1_SE_GRVW8_LPB8_PLR9_SU32_SUS128_SRVW4_WGM1
    SolutionIndex: 417
    SolutionNameMin: Cijk_Ailk_Bljk_BBH_MT64x128x32_MI32x32x4x1_SE_GRVW8_LPB8_PLR9_SU32_SUS256_SRVW4_WGM15
    SolutionIndex: 418
    SolutionNameMin: Cijk_Ailk_Bljk_BBH_MT64x128x64_MI32x32x4x1_SE_GRVW4_LPB4_PLR17_SU32_SUS128_SRVW4_WGM15
    SolutionIndex: 419
    SolutionNameMin: Cijk_Ailk_Bljk_BBH_MT64x128x64_MI32x32x4x1_SE_GRVW4_LPB4_PLR17_SU32_SUS256_SRVW4_WGM15
- - - [64, 35, 1, 35]
    - [3, 0.005]
  - - [64, 35, 1, 32]
    - [2, 0.005]
  - - [64, 15, 1, 15]
    - [1, 0.001]
  - - [64, 15, 1, 17]
    - [4, 0.001]
  - - [64, 17, 1, 17]
    - [2, 0.001]
  - - [64, 30, 1, 30]
    - [1, 0.004]
  - - [64, 32, 1, 32]
    - [9, 0.005]
  - - [64, 31, 1, 31]
    - [6, 0.004]
  - - [64, 24, 1, 24]
    - [4, 0.003]
  - - [64, 15, 1, 15]
    - [5, 0.001]
  - - [64, 17, 1, 17]
    - [2, 0.001]
  - - [64, 34, 1, 34]
    - [2, 0.004]
  - - [64, 14, 1, 15]
    - [1, 0.001]
  - - [64, 17, 1, 21]
    - [1, 0.001]
  - - [64, 14, 1, 14]
    - [1, 0.001]
  - - [64, 24, 1, 34]
    - [10, 0.004]
  - - [64, 21, 1, 21]
    - [3, 0.002]
  - - [64, 31, 1, 30]
    - [8, 0.004]
  - - [64, 128, 512, 128]
    - [284, 30.267]
  - - [64, 512, 1, 512]
    - [127, 3.237]
  - - [64, 512, 64, 512]
    - [75, 44.66]
  - - [128, 128, 512, 64]
    - [239, 34.412]
  - - [512, 512, 1, 64]
    - [302, 5.608]
  - - [512, 512, 64, 64]
    - [235, 45.675]
  - - [1024, 4, 1, 2]
    - [252, 0.003]
  - - [1024, 4, 1, 1024]
    - [253, 0.66]
  - - [1024, 32, 1, 2]
    - [74, 0.022]
  - - [1024, 32, 1, 1024]
    - [54, 4.759]
  - - [1024, 2048, 1, 2]
    - [256, 0.818]
  - - [1024, 2048, 1, 1024]
    - [226, 76.414]
  - - [1024, 2048, 1, 4096]
    - [257, 86.253]
  - - [1024, 2048, 1, 30528]
    - [172, 89.711]
  - - [1024, 4096, 1, 1024]
    - [65, 80.307]
  - - [1024, 4096, 1, 4096]
    - [161, 89.047]
  - - [1024, 4096, 1, 30528]
    - [163, 92.724]
  - - [4096, 2048, 1, 1024]
    - [258, 84.707]
  - - [4096, 4096, 1, 1024]
    - [237, 87.974]
  - - [32, 33, 1600, 33]
    - [79, 4.517]
  - - [32, 200, 1, 1]
    - [230, 0.001]
  - - [64, 3, 512, 3]
    - [287, 0.069]
  - - [64, 5, 512, 5]
    - [308, 0.184]
  - - [64, 5, 960, 5]
    - [287, 0.281]
  - - [64, 9, 512, 9]
    - [287, 0.547]
  - - [64, 512, 1, 1]
    - [74, 0.012]
  - - [67, 512, 1, 2048]
    - [389, 9.006]
  - - [74, 512, 1, 2048]
    - [388, 9.617]
  - - [74, 960, 1, 2048]
    - [390, 14.719]
  - - [100, 512, 1, 2048]
    - [390, 11.753]
  - - [128, 27, 32768, 27]
    - [56, 7.871]
  - - [256, 1024, 1, 1]
    - [309, 0.106]
  - - [256, 8976, 1, 1536]
    - [68, 76.37]
  - - [256, 8976, 1, 2048]
    - [68, 79.784]
  - - [256, 8976, 1, 2304]
    - [68, 81.09]
  - - [256, 8976, 1, 2560]
    - [112, 81.921]
  - - [256, 8976, 1, 2816]
    - [68, 82.557]
  - - [256, 8976, 1, 3072]
    - [68, 83.199]
  - - [256, 8976, 1, 4352]
    - [110, 85.155]
  - - [256, 8976, 1, 4864]
    - [68, 86.052]
  - - [256, 8976, 1, 5376]
    - [51, 86.694]
  - - [256, 8976, 1, 5632]
    - [51, 86.848]
  - - [256, 8976, 1, 5888]
    - [68, 87.17]
  - - [256, 8976, 1, 6144]
    - [51, 87.325]
  - - [256, 8976, 1, 6656]
    - [51, 87.462]
  - - [256, 8976, 1, 7168]
    - [51, 87.73]
  - - [256, 8976, 1, 7424]
    - [51, 87.79]
  - - [256, 8976, 1, 8192]
    - [51, 88.28]
  - - [256, 8976, 1, 8448]
    - [51, 88.359]
  - - [256, 8976, 1, 8960]
    - [51, 88.546]
  - - [256, 8976, 1, 9472]
    - [63, 88.597]
  - - [256, 8976, 1, 9728]
    - [51, 88.716]
  - - [256, 8976, 1, 9984]
    - [51, 88.864]
  - - [256, 8976, 1, 10240]
    - [51, 89.06]
  - - [256, 8976, 1, 10496]
    - [51, 88.966]
  - - [256, 8976, 1, 11008]
    - [51, 89.091]
  - - [256, 8976, 1, 11520]
    - [51, 89.142]
  - - [256, 8976, 1, 12288]
    - [51, 89.361]
  - - [256, 8976, 1, 14336]
    - [63, 89.604]
  - - [256, 8976, 1, 14848]
    - [51, 89.701]
  - - [256, 8976, 1, 15104]
    - [51, 89.834]
  - - [256, 8976, 1, 15872]
    - [63, 89.855]
  - - [256, 8976, 1, 17152]
    - [51, 89.939]
  - - [256, 8976, 1, 19712]
    - [63, 90.15]
  - - [256, 8976, 1, 19968]
    - [51, 90.191]
  - - [256, 8976, 1, 20480]
    - [173, 90.164]
  - - [256, 8976, 1, 20992]
    - [51, 90.319]
  - - [256, 8976, 1, 22016]
    - [63, 90.307]
  - - [256, 8976, 1, 26112]
    - [51, 90.515]
  - - [256, 8976, 1, 33536]
    - [178, 91.004]
  - - [256, 8976, 1, 44505]
    - [183, 90.671]
  - - [256, 32768, 1, 128]
    - [285, 54.761]
  - - [257, 1024, 1, 4096]
    - [391, 44.245]
  - - [480, 32768, 1, 1024]
    - [310, 85.787]
  - - [512, 200, 1, 1]
    - [311, 0.046]
  - - [512, 200, 1, 32]
    - [312, 1.136]
  - - [512, 215, 1, 2048]
    - [313, 20.584]
  - - [512, 256, 1, 2048]
    - [314, 23.812]
  - - [512, 1600, 1, 32]
    - [307, 8.46]
  - - [512, 1600, 1, 512]
    - [306, 44.353]
  - - [512, 32768, 1, 256]
    - [286, 74.71]
  - - [560, 200, 1, 1024]
    - [241, 14.123]
  - - [560, 1600, 1, 1024]
    - [113, 57.626]
  - - [768, 215, 1, 2048]
    - [315, 27.639]
  - - [768, 256, 1, 2048]
    - [316, 32.206]
  - - [1024, 200, 1, 1]
    - [280, 0.09]
  - - [1024, 512, 1, 1]
    - [319, 0.186]
  - - [1024, 512, 1, 64]
    - [305, 10.129]
  - - [1024, 512, 1, 1024]
    - [97, 39.561]
  - - [1024, 960, 1, 64]
    - [320, 17.317]
  - - [1024, 960, 1, 1024]
    - [223, 71.911]
  - - [1024, 1600, 1, 1]
    - [321, 0.409]
  - - [1024, 1600, 1, 1024]
    - [273, 65.284]
  - - [1024, 1792, 1, 256]
    - [322, 51.417]
  - - [1024, 2048, 1, 256]
    - [257, 52.064]
  - - [1024, 2560, 1, 256]
    - [291, 55.578]
  - - [1024, 3072, 1, 256]
    - [273, 54.611]
  - - [1024, 3328, 1, 256]
    - [279, 58.317]
  - - [1024, 3840, 1, 256]
    - [323, 64.303]
  - - [1024, 4096, 1, 256]
    - [286, 60.352]
  - - [1024, 4608, 1, 256]
    - [291, 63.688]
  - - [1024, 4864, 1, 256]
    - [286, 62.148]
  - - [1024, 5120, 1, 256]
    - [286, 63.76]
  - - [1024, 5632, 1, 256]
    - [237, 65.327]
  - - [1024, 6144, 1, 256]
    - [258, 65.82]
  - - [1024, 6400, 1, 256]
    - [324, 68.713]
  - - [1024, 7168, 1, 256]
    - [299, 69.369]
  - - [1024, 7424, 1, 256]
    - [155, 70.456]
  - - [1024, 7680, 1, 256]
    - [325, 72.326]
  - - [1024, 7936, 1, 256]
    - [326, 70.924]
  - - [1024, 8192, 1, 256]
    - [251, 70.64]
  - - [1024, 8448, 1, 256]
    - [258, 71.712]
  - - [1024, 8704, 1, 256]
    - [291, 68.88]
  - - [1024, 8960, 1, 256]
    - [279, 70.003]
  - - [1024, 9728, 1, 256]
    - [327, 71.992]
  - - [1024, 9984, 1, 256]
    - [251, 72.573]
  - - [1024, 10240, 1, 256]
    - [279, 70.565]
  - - [1024, 10496, 1, 256]
    - [279, 70.837]
  - - [1024, 11008, 1, 256]
    - [260, 73.483]
  - - [1024, 11264, 1, 256]
    - [260, 75.193]
  - - [1024, 11520, 1, 256]
    - [325, 76.692]
  - - [1024, 12288, 1, 256]
    - [326, 75.175]
  - - [1024, 13312, 1, 256]
    - [286, 73.14]
  - - [1024, 13568, 1, 256]
    - [286, 73.396]
  - - [1024, 14336, 1, 256]
    - [299, 74.12]
  - - [1024, 14592, 1, 256]
    - [260, 75.364]
  - - [1024, 14848, 1, 256]
    - [260, 76.767]
  - - [1024, 15104, 1, 256]
    - [325, 77.844]
  - - [1024, 16128, 1, 256]
    - [258, 76.752]
  - - [1024, 17152, 1, 256]
    - [251, 76.297]
  - - [1024, 18944, 1, 256]
    - [260, 79.579]
  - - [1024, 19712, 1, 256]
    - [72, 77.373]
  - - [1024, 19968, 1, 256]
    - [258, 78.504]
  - - [1024, 20480, 1, 256]
    - [88, 76.298]
  - - [1024, 20992, 1, 256]
    - [57, 77.616]
  - - [1024, 21504, 1, 256]
    - [251, 79.151]
  - - [1024, 22016, 1, 256]
    - [325, 78.39]
  - - [1024, 23552, 1, 256]
    - [258, 77.659]
  - - [1024, 28672, 1, 256]
    - [326, 78.591]
  - - [1024, 32768, 1, 512]
    - [58, 87.497]
  - - [1024, 32768, 1, 1024]
    - [251, 92.465]
  - - [1024, 33536, 1, 256]
    - [260, 81.337]
  - - [1024, 40448, 1, 256]
    - [72, 80.937]
  - - [1600, 512, 1, 1024]
    - [328, 54.141]
  - - [2048, 512, 1, 1]
    - [266, 0.28]
  - - [2048, 512, 1, 2048]
    - [89, 62.219]
  - - [2048, 960, 1, 2048]
    - [330, 81.386]
  - - [2048, 1024, 1, 1]
    - [244, 0.382]
  - - [2048, 1024, 1, 256]
    - [236, 48.779]
  - - [3200, 1024, 1, 2048]
    - [331, 76.125]
  - - [4096, 1024, 1, 1]
    - [332, 0.52]
  - - [64, 14, 10880, 14]
    - [287, 2.825]
  - - [64, 14, 10880, 15]
    - [287, 3.008]
  - - [64, 15, 7680, 15]
    - [287, 3.113]
  - - [64, 15, 10880, 15]
    - [287, 3.209]
  - - [64, 15, 7680, 17]
    - [287, 3.327]
  - - [64, 17, 6144, 17]
    - [56, 3.203]
  - - [64, 17, 7680, 17]
    - [56, 3.303]
  - - [64, 17, 6144, 21]
    - [56, 3.853]
  - - [64, 21, 6144, 21]
    - [56, 4.718]
  - - [64, 24, 4736, 24]
    - [56, 6.007]
  - - [64, 24, 4736, 34]
    - [56, 7.407]
  - - [64, 30, 2048, 30]
    - [87, 6.987]
  - - [64, 31, 2048, 30]
    - [56, 7.198]
  - - [64, 31, 2048, 31]
    - [56, 7.344]
  - - [64, 32, 4608, 32]
    - [301, 13.236]
  - - [64, 34, 4736, 34]
    - [92, 6.754]
  - - [64, 35, 4608, 32]
    - [56, 10.252]
  - - [64, 35, 4608, 35]
    - [86, 6.714]
  - - [1024, 3840, 1, 1024]
    - [292, 86.624]
  - - [1024, 3840, 1, 4096]
    - [293, 94.826]
  - - [1024, 3968, 1, 1024]
    - [65, 78.032]
  - - [1024, 3968, 1, 4096]
    - [161, 86.217]
  - - [1024, 3968, 1, 42720]
    - [161, 89.943]
  - - [1024, 6528, 1, 1024]
    - [239, 83.247]
  - - [1024, 6528, 1, 4096]
    - [294, 87.289]
  - - [1024, 6528, 1, 42720]
    - [177, 93.413]
  - - [1024, 7104, 1, 1024]
    - [295, 87.576]
  - - [1024, 7104, 1, 4096]
    - [161, 93.682]
  - - [1024, 7104, 1, 42720]
    - [178, 96.572]
  - - [1024, 7200, 1, 1024]
    - [225, 87.226]
  - - [1024, 7200, 1, 4096]
    - [225, 94.804]
  - - [1024, 7200, 1, 42720]
    - [178, 97.776]
  - - [1024, 8064, 1, 1024]
    - [295, 85.779]
  - - [1024, 8064, 1, 4096]
    - [161, 89.948]
  - - [1024, 8160, 1, 1024]
    - [295, 86.565]
  - - [1024, 8160, 1, 4096]
    - [161, 90.812]
  - - [1024, 9216, 1, 1024]
    - [239, 85.236]
  - - [1024, 9216, 1, 4096]
    - [296, 90.971]
  - - [1024, 9520, 1, 1024]
    - [297, 85.666]
  - - [1024, 9520, 1, 4096]
    - [298, 93.747]
  - - [1024, 9520, 1, 42720]
    - [173, 97.056]
  - - [1024, 10064, 1, 1024]
    - [258, 87.823]
  - - [1024, 10064, 1, 4096]
    - [176, 92.817]
  - - [1024, 10080, 1, 1024]
    - [161, 88.991]
  - - [1024, 10080, 1, 4096]
    - [274, 92.976]
  - - [1024, 10080, 1, 42720]
    - [167, 97.243]
  - - [1024, 10200, 1, 1024]
    - [291, 85.257]
  - - [1024, 10200, 1, 4096]
    - [159, 90.509]
  - - [4096, 3840, 1, 1024]
    - [181, 92.612]
  - - [4096, 3968, 1, 1024]
    - [60, 85.955]
  - - [4096, 6528, 1, 1024]
    - [158, 90.113]
  - - [4096, 7104, 1, 1024]
    - [299, 91.755]
  - - [4096, 7200, 1, 1024]
    - [90, 90.277]
  - - [4096, 8064, 1, 1024]
    - [180, 93.48]
  - - [4096, 8160, 1, 1024]
    - [182, 91.999]
  - - [4096, 9216, 1, 1024]
    - [170, 92.14]
  - - [4096, 9520, 1, 1024]
    - [300, 91.778]
  - - [4096, 10064, 1, 1024]
    - [179, 92.103]
  - - [4096, 10080, 1, 1024]
    - [180, 93.009]
  - - [4096, 10200, 1, 1024]
    - [180, 93.043]
  - - [64, 27, 1920, 27]
    - [11, 2.212]
  - - [64, 33, 1920, 27]
    - [14, 2.176]
  - - [64, 33, 1920, 33]
    - [15, 2.734]
  - - [1024, 3240, 1, 1024]
    - [16, 34.747]
  - - [1024, 3240, 1, 4096]
    - [21, 38.008]
  - - [1024, 3960, 1, 1024]
    - [18, 34.758]
  - - [1024, 3960, 1, 4096]
    - [19, 37.079]
  - - [1024, 3960, 1, 42720]
    - [17, 39.481]
  - - [4096, 3240, 1, 1024]
    - [22, 40.489]
  - - [4096, 3960, 1, 1024]
    - [13, 41.988]
  - - [64, 192, 64, 1280]
    - [305, 50.511]
  - - [64, 320, 64, 1280]
    - [136, 52.865]
  - - [64, 384, 64, 1280]
    - [279, 61.672]
  - - [64, 448, 64, 1280]
    - [305, 61.058]
  - - [64, 192, 64, 2048]
    - [135, 48.544]
  - - [64, 320, 64, 2048]
    - [146, 52.446]
  - - [64, 384, 64, 2048]
    - [354, 59.634]
  - - [64, 448, 64, 2048]
    - [147, 59.408]
  - - [1225, 32, 64, 192]
    - [400, 27.238]
  - - [1225, 48, 64, 192]
    - [401, 27.265]
  - - [1225, 64, 64, 192]
    - [402, 43.033]
  - - [1225, 48, 64, 256]
    - [403, 31.523]
  - - [1225, 64, 64, 256]
    - [404, 47.233]
  - - [1225, 48, 64, 288]
    - [405, 33.979]
  - - [1225, 64, 64, 288]
    - [404, 51.42]
  - - [5329, 80, 64, 64]
    - [153, 22.903]
  - - [289, 128, 64, 768]
    - [406, 55.698]
  - - [289, 160, 64, 768]
    - [405, 47.476]
  - - [289, 192, 64, 768]
    - [407, 56.972]
  - - [64, 192, 32, 1280]
    - [371, 40.781]
  - - [64, 320, 32, 1280]
    - [372, 44.987]
  - - [64, 384, 32, 1280]
    - [353, 52.923]
  - - [64, 448, 32, 1280]
    - [320, 59.408]
  - - [64, 192, 32, 2048]
    - [373, 42.102]
  - - [64, 320, 32, 2048]
    - [374, 50.343]
  - - [64, 384, 32, 2048]
    - [374, 57.093]
  - - [64, 448, 32, 2048]
    - [328, 58.714]
  - - [1225, 32, 32, 192]
    - [408, 23.478]
  - - [1225, 48, 32, 192]
    - [402, 24.499]
  - - [1225, 64, 32, 192]
    - [409, 37.255]
  - - [1225, 48, 32, 256]
    - [404, 28.896]
  - - [1225, 64, 32, 256]
    - [405, 41.885]
  - - [1225, 48, 32, 288]
    - [402, 30.736]
  - - [1225, 64, 32, 288]
    - [407, 45.381]
  - - [5329, 80, 32, 64]
    - [133, 21.759]
  - - [289, 128, 32, 768]
    - [406, 43.408]
  - - [289, 160, 32, 768]
    - [410, 41.38]
  - - [289, 192, 32, 768]
    - [411, 47.796]
  - - [3136, 256, 64, 64]
    - [339, 53.706]
  - - [3136, 64, 64, 64]
    - [261, 32.669]
  - - [3136, 64, 64, 256]
    - [370, 58.118]
  - - [784, 512, 64, 128]
    - [343, 59.465]
  - - [784, 128, 64, 512]
    - [273, 68.921]
  - - [196, 1024, 64, 256]
    - [397, 52.604]
  - - [196, 256, 64, 1024]
    - [142, 54.226]
  - - [49, 2048, 64, 512]
    - [398, 42.92]
  - - [49, 512, 64, 2048]
    - [399, 39.53]
  - - [3136, 256, 32, 64]
    - [285, 45.793]
  - - [3136, 64, 32, 64]
    - [154, 26.9]
  - - [3136, 64, 32, 256]
    - [138, 52.336]
  - - [784, 512, 32, 128]
    - [137, 49.002]
  - - [784, 128, 32, 512]
    - [139, 60.817]
  - - [196, 1024, 32, 256]
    - [142, 48.692]
  - - [196, 256, 32, 1024]
    - [144, 42.8]
  - - [49, 2048, 32, 512]
    - [148, 35.577]
  - - [49, 512, 32, 2048]
    - [150, 32.983]
  - - [3136, 128, 64, 64]
    - [365, 44.535]
  - - [3136, 256, 64, 128]
    - [343, 72.112]
  - - [784, 512, 64, 256]
    - [279, 70.743]
  - - [3136, 128, 64, 256]
    - [340, 74.197]
  - - [3136, 256, 64, 256]
    - [235, 79.007]
  - - [196, 1024, 64, 512]
    - [392, 61.088]
  - - [784, 256, 64, 512]
    - [213, 75.425]
  - - [784, 512, 64, 512]
    - [239, 79.621]
  - - [196, 512, 64, 1024]
    - [152, 62.231]
  - - [196, 1024, 64, 1024]
    - [216, 65.615]
  - - [49, 2048, 64, 1024]
    - [393, 48.577]
  - - [49, 1024, 64, 2048]
    - [394, 47.527]
  - - [3136, 128, 32, 64]
    - [365, 39.862]
  - - [3136, 256, 32, 128]
    - [339, 63.581]
  - - [784, 512, 32, 256]
    - [279, 67.485]
  - - [3136, 128, 32, 256]
    - [340, 70.099]
  - - [3136, 256, 32, 256]
    - [339, 76.078]
  - - [196, 1024, 32, 512]
    - [392, 58.282]
  - - [784, 256, 32, 512]
    - [284, 71.483]
  - - [784, 512, 32, 512]
    - [354, 76.598]
  - - [196, 512, 32, 1024]
    - [134, 54.178]
  - - [196, 1024, 32, 1024]
    - [392, 63.812]
  - - [49, 2048, 32, 1024]
    - [395, 43.806]
  - - [49, 1024, 32, 2048]
    - [396, 40.174]
  - - [64, 128, 624, 128]
    - [247, 31.242]
  - - [1024, 10, 1, 1024]
    - [240, 1.677]
  - - [2048, 2048, 1, 2048]
    - [226, 86.765]
  - - [1024, 10, 1, 2]
    - [105, 0.007]
  - - [1024, 5, 1, 2]
    - [269, 0.003]
  - - [1024, 5, 1, 1024]
    - [270, 0.846]
  - - [64, 512, 16, 512]
    - [228, 29.906]
  - - [1024, 1024, 1, 1024]
    - [55, 54.463]
  - - [1024, 9600, 1, 4096]
    - [290, 95.433]
  - - [1024, 8192, 1, 1024]
    - [288, 85.156]
  - - [1024, 1280, 1, 4096]
    - [246, 78.504]
  - - [512, 512, 1, 512]
    - [227, 21.111]
  - - [1024, 1152, 1, 1024]
    - [62, 57.676]
  - - [1024, 5248, 1, 2]
    - [266, 1.124]
  - - [1024, 820, 1, 1024]
    - [264, 52.765]
  - - [4096, 1152, 1, 1024]
    - [284, 80.103]
  - - [1024, 308, 1, 30522]
    - [255, 75.671]
  - - [1024, 39, 1, 1024]
    - [248, 5.843]
  - - [1024, 616, 1, 1024]
    - [234, 41.689]
  - - [64, 512, 96, 512]
    - [239, 53.639]
  - - [1024, 39, 1, 2]
    - [64, 0.028]
  - - [128, 128, 1, 64]
    - [303, 0.409]
  - - [1024, 160, 1, 30522]
    - [278, 72.669]
  - - [1024, 2560, 1, 1024]
    - [267, 73.453]
  - - [4096, 9600, 1, 1024]
    - [175, 92.595]
  - - [1024, 8, 1, 2]
    - [66, 0.006]
  - - [1024, 800, 1, 1024]
    - [238, 50.977]
  - - [64, 128, 640, 128]
    - [244, 31.718]
  - - [4096, 1024, 1, 1024]
    - [67, 80.307]
  - - [1024, 8, 1, 1024]
    - [231, 1.39]
  - - [1024, 1024, 1, 2]
    - [243, 0.545]
  - - [4096, 5248, 1, 1024]
    - [158, 90.071]
  - - [4096, 4096, 1, 4096]
    - [225, 92.002]
  - - [1024, 77, 1, 30522]
    - [232, 54.009]
  - - [1024, 9, 1, 2]
    - [280, 0.006]
  - - [1024, 1024, 1, 4096]
    - [83, 69.78]
  - - [1024, 9, 1, 1024]
    - [253, 1.497]
  - - [1024, 780, 1, 1024]
    - [249, 50.859]
  - - [64, 4, 38400, 4]
    - [287, 0.271]
  - - [1024, 4096, 1, 2]
    - [235, 1.047]
  - - [4096, 2560, 1, 1024]
    - [60, 84.37]
  - - [64, 128, 144, 128]
    - [279, 22.791]
  - - [1024, 780, 1, 30522]
    - [250, 88.633]
  - - [8192, 7680, 1, 8192]
    - [157, 98.227]
  - - [1024, 3072, 1, 2]
    - [244, 0.942]
  - - [8192, 8192, 1, 8192]
    - [158, 96.611]
  - - [1024, 180, 1, 1024]
    - [281, 22.358]
  - - [1024, 180, 1, 30522]
    - [282, 68.508]
  - - [1024, 512, 1, 2]
    - [233, 0.344]
  - - [1024, 8192, 1, 4096]
    - [161, 90.757]
  - - [1024, 385, 1, 30522]
    - [272, 76.866]
  - - [4096, 512, 1, 1024]
    - [236, 67.102]
  - - [1024, 160, 1, 1024]
    - [116, 20.524]
  - - [1024, 5120, 1, 4096]
    - [164, 85.92]
  - - [2048, 1920, 1, 2048]
    - [222, 92.131]
  - - [1024, 462, 1, 1024]
    - [80, 35.418]
  - - [1024, 462, 1, 30522]
    - [276, 84.695]
  - - [1024, 77, 1, 1024]
    - [69, 10.872]
  - - [960, 1024, 1, 1024]
    - [220, 73.027]
  - - [1024, 40, 1, 2]
    - [64, 0.028]
  - - [64, 5, 1, 5]
    - [230, 0.0]
  - - [1024, 40, 1, 1024]
    - [259, 5.947]
  - - [4096, 5120, 1, 1024]
    - [262, 88.338]
  - - [1024, 200, 1, 30522]
    - [242, 61.223]
  - - [1024, 41, 1, 2]
    - [74, 0.028]
  - - [1024, 200, 1, 1024]
    - [241, 22.559]
  - - [4096, 8192, 1, 1024]
    - [174, 90.718]
  - - [1024, 41, 1, 1024]
    - [263, 6.19]
  - - [1024, 4992, 1, 4096]
    - [164, 84.897]
  - - [4096, 1280, 1, 1024]
    - [158, 78.688]
  - - [1024, 2560, 1, 4096]
    - [274, 82.771]
  - - [1024, 4992, 1, 2]
    - [237, 1.25]
  - - [32, 33, 1, 33]
    - [77, 0.01]
  - - [7680, 8192, 1, 8192]
    - [155, 98.453]
  - - [4096, 3072, 1, 1024]
    - [170, 87.983]
  - - [1024, 9600, 1, 1024]
    - [289, 88.704]
  - - [1024, 385, 1, 1024]
    - [271, 38.55]
  - - [64, 4, 32768, 4]
    - [287, 0.27]
  - - [64, 128, 656, 128]
    - [238, 32.268]
  - - [64, 512, 128, 512]
    - [229, 52.268]
  - - [1024, 4992, 1, 1024]
    - [251, 78.63]
  - - [1024, 1152, 1, 2]
    - [283, 0.605]
  - - [1024, 5248, 1, 4096]
    - [65, 86.57]
  - - [1024, 9600, 1, 33712]
    - [289, 97.574]
  - - [1024, 3072, 1, 4096]
    - [164, 84.917]
  - - [4096, 3840, 1, 4096]
    - [155, 97.456]
  - - [1024, 6, 1, 1024]
    - [231, 1.101]
  - - [1024, 5120, 1, 1024]
    - [261, 78.258]
  - - [1024, 8192, 1, 33712]
    - [161, 92.582]
  - - [1024, 308, 1, 1024]
    - [254, 31.158]
  - - [3840, 4096, 1, 4096]
    - [156, 97.55]
  - - [1024, 2560, 1, 2]
    - [273, 0.876]
  - - [1024, 6, 1, 2]
    - [275, 0.004]
  - - [64, 128, 160, 128]
    - [239, 24.922]
  - - [1024, 512, 1, 4096]
    - [124, 54.389]
  - - [64, 128, 128, 128]
    - [238, 20.761]
  - - [1024, 5248, 1, 1024]
    - [267, 80.028]
  - - [1024, 820, 1, 30522]
    - [265, 84.243]
  - - [1024, 1280, 1, 2]
    - [244, 0.672]
  - - [1024, 1280, 1, 1024]
    - [245, 64.084]
  - - [1920, 2048, 1, 2048]
    - [219, 92.528]
  - - [1024, 3072, 1, 1024]
    - [277, 74.617]
  - - [1024, 800, 1, 30522]
    - [250, 90.554]
  - - [64, 128, 1, 128]
    - [304, 0.377]
  - - [64, 512, 80, 512]
    - [268, 51.69]
  - - [480, 512, 1, 512]
    - [221, 22.646]
  - - [512, 480, 1, 512]
    - [224, 22.646]
  - - [4096, 4992, 1, 1024]
    - [165, 90.947]
  - - [479, 32768, 1, 1024]
    - [209, 81.129]
  - - [1024, 1152, 1, 4096]
    - [103, 78.504]
  - - [1024, 5120, 1, 2]
    - [260, 1.243]
  - - [1024, 1024, 64, 64]
    - [339, 55.864]
  - - [64, 1024, 32, 1024]
    - [344, 52.404]
  - - [1024, 16384, 1, 3072]
    - [170, 91.074]
  - - [1024, 2048, 1, 30592]
    - [172, 89.946]
  - - [640, 2048, 1, 2560]
    - [338, 78.601]
  - - [1024, 1024, 64, 96]
    - [341, 70.351]
  - - [2048, 2, 1, 2048]
    - [336, 1.129]
  - - [2048, 2, 1, 2]
    - [335, 0.003]
  - - [1536, 4096, 1, 4608]
    - [159, 89.584]
  - - [512, 512, 256, 64]
    - [235, 56.891]
  - - [2048, 1024, 1, 8192]
    - [334, 87.118]
  - - [4096, 16384, 1, 1024]
    - [179, 93.047]
  - - [1024, 8192, 1, 50304]
    - [196, 92.721]
  - - [1536, 8192, 1, 50304]
    - [193, 95.659]
  - - [6144, 8192, 1, 1536]
    - [159, 95.165]
  - - [1024, 4096, 1, 30592]
    - [81, 92.103]
  - - [1536, 4096, 1, 6144]
    - [180, 90.436]
  - - [1024, 16384, 1, 4096]
    - [225, 92.022]
  - - [1024, 16384, 1, 50304]
    - [194, 95.813]
  - - [1024, 4096, 1, 3072]
    - [65, 87.951]
  - - [1536, 8192, 1, 1536]
    - [340, 90.64]
  - - [1024, 2048, 1, 3072]
    - [226, 84.917]
  - - [2560, 2048, 1, 7680]
    - [190, 88.496]
  - - [96, 1024, 64, 1024]
    - [277, 76.902]
  - - [2048, 1024, 1, 2048]
    - [333, 80.955]
  - - [2048, 1024, 1, 30592]
    - [187, 88.593]
  - - [64, 1024, 256, 1024]
    - [249, 69.948]
  - - [8192, 1024, 1, 2048]
    - [158, 88.217]
  - - [2560, 2048, 1, 2560]
    - [310, 85.041]
  - - [1536, 8192, 1, 4608]
    - [192, 93.369]
  - - [64, 512, 256, 512]
    - [283, 58.634]
  - - [1024, 2048, 1, 50304]
    - [159, 90.637]
  - - [1024, 1024, 32, 64]
    - [343, 52.956]
  - - [1536, 8192, 1, 6144]
    - [192, 93.667]
  - - [1024, 1024, 256, 64]
    - [339, 58.699]
  - - [512, 512, 40, 64]
    - [339, 40.388]
  - - [1536, 4096, 1, 50304]
    - [159, 92.186]
  - - [1024, 1024, 128, 96]
    - [341, 73.39]
  - - [1024, 8192, 1, 3072]
    - [65, 90.069]
  - - [64, 1024, 64, 1024]
    - [345, 62.219]
  - - [1024, 1024, 128, 64]
    - [339, 57.875]
  - - [64, 1024, 128, 1024]
    - [249, 68.795]
  - - [1024, 4096, 1, 50304]
    - [195, 92.544]
  - - [96, 1024, 128, 1024]
    - [342, 81.254]
  - - [6144, 4096, 1, 1536]
    - [119, 91.719]
  - - [1024, 16, 1, 2]
    - [64, 0.012]
  - - [1024, 16, 1, 1024]
    - [231, 2.661]
  - - [2560, 4, 1, 2]
    - [230, 0.006]
  - - [1024, 16384, 1, 1024]
    - [104, 87.639]
  - - [2560, 2048, 1, 1920]
    - [337, 83.589]
  - - [2048, 1024, 1, 6144]
    - [333, 86.16]
  - - [2560, 4, 1, 2560]
    - [231, 2.887]
  - - [512, 512, 128, 64]
    - [235, 53.308]
  - - [1024, 8192, 1, 30592]
    - [159, 92.799]
  - - [1536, 4096, 1, 1536]
    - [340, 83.815]
  - - [64, 512, 40, 512]
    - [239, 46.693]
  - - [1024, 1, 1, 2]
    - [230, 0.0]
  - - [1024, 1, 1, 1024]
    - [231, 0.166]
  - - [1024, 1, 1, 200]
    - [317, 0.04]
  - - [1024, 1, 1, 1600]
    - [318, 0.286]
  - - [2048, 1, 1, 512]
    - [329, 0.207]
  - - [128, 128, 1024, 64]
    - [346, 37.634]
  - - [64, 128, 1024, 128]
    - [347, 33.606]
  - - [1024, 64, 1, 2]
    - [230, 0.037]
  - - [1024, 8192, 1, 30528]
    - [161, 92.851]
  - - [1024, 64, 1, 1024]
    - [348, 9.168]
  - - [1024, 3456, 1, 1024]
    - [349, 77.517]
  - - [1024, 3456, 1, 512]
    - [284, 69.638]
  - - [1024, 4096, 1, 512]
    - [350, 69.661]
  - - [1024, 6912, 1, 1024]
    - [161, 86.57]
  - - [1024, 6912, 1, 512]
    - [251, 79.796]
  - - [1024, 864, 1, 1024]
    - [351, 60.777]
  - - [1024, 864, 1, 512]
    - [352, 42.393]
  - - [256, 3456, 1, 128]
    - [353, 26.167]
  - - [256, 4096, 1, 128]
    - [239, 23.26]
  - - [256, 55296, 1, 128]
    - [326, 63.036]
  - - [256, 6912, 1, 128]
    - [354, 36.863]
  - - [256, 864, 1, 128]
    - [355, 8.547]
  - - [480, 3456, 1, 1024]
    - [356, 68.967]
  - - [480, 4096, 1, 1024]
    - [277, 67.289]
  - - [480, 6912, 1, 1024]
    - [357, 80.187]
  - - [480, 864, 1, 1024]
    - [358, 39.742]
  - - [512, 3456, 1, 256]
    - [267, 50.168]
  - - [512, 4096, 1, 256]
    - [286, 46.955]
  - - [512, 55296, 1, 256]
    - [324, 80.316]
  - - [512, 6912, 1, 256]
    - [279, 60.13]
  - - [512, 864, 1, 256]
    - [359, 23.552]
  - - [1024, 640, 1, 30528]
    - [360, 91.087]
  - - [1024, 1280, 1, 30528]
    - [361, 93.266]
  - - [1024, 1600, 1, 30528]
    - [362, 93.494]
  - - [1024, 10240, 1, 1024]
    - [239, 86.104]
  - - [1024, 10240, 1, 4096]
    - [159, 90.659]
  - - [4096, 10240, 1, 1024]
    - [156, 92.687]
  - - [1024, 80, 1, 1024]
    - [363, 11.136]
  - - [1024, 80, 1, 2]
    - [364, 0.051]
  - - [128, 128, 1280, 64]
    - [365, 39.498]
  - - [64, 128, 1280, 128]
    - [366, 34.225]
  - - [1024, 1640, 1, 30528]
    - [206, 82.942]
  - - [1024, 10496, 1, 1024]
    - [226, 85.652]
  - - [1024, 10496, 1, 4096]
    - [159, 92.832]
  - - [4096, 10496, 1, 1024]
    - [156, 94.513]
  - - [1024, 82, 1, 1024]
    - [367, 11.254]
  - - [1024, 82, 1, 2]
    - [368, 0.063]
  - - [128, 128, 1312, 64]
    - [300, 39.432]
  - - [64, 128, 1312, 128]
    - [347, 34.15]
  - - [1024, 160, 1, 30528]
    - [278, 75.741]
  - - [1024, 240, 1, 30528]
    - [369, 75.012]
  - - [1024, 6144, 1, 4096]
    - [159, 89.237]
  - - [1024, 12, 1, 1024]
    - [240, 1.947]
  - - [4096, 6144, 1, 1024]
    - [158, 89.518]
  - - [1024, 6144, 1, 1024]
    - [267, 80.765]
  - - [1024, 12, 1, 2]
    - [252, 0.007]
  - - [512, 512, 192, 64]
    - [235, 54.96]
  - - [64, 512, 192, 512]
    - [247, 56.399]
  - - [256, 4096, 1, 1]
    - [370, 0.255]
  - - [256, 6912, 1, 1]
    - [321, 0.413]
  - - [1024, 10224, 1, 1024]
    - [226, 86.826]
  - - [1024, 10192, 1, 1024]
    - [239, 85.372]
  - - [1024, 10208, 1, 1024]
    - [239, 85.288]
  - - [1024, 10224, 1, 4096]
    - [226, 90.866]
  - - [1024, 10224, 1, 3072]
    - [226, 90.345]
  - - [4096, 10224, 1, 1024]
    - [300, 93.437]
  - - [1024, 10240, 1, 3072]
    - [239, 89.584]
  - - [1024, 10192, 1, 3072]
    - [239, 89.298]
  - - [4096, 10192, 1, 1024]
    - [300, 92.392]
  - - [1024, 10192, 1, 4096]
    - [375, 89.638]
  - - [1024, 10200, 1, 3072]
    - [239, 89.568]
  - - [1024, 10184, 1, 1024]
    - [239, 84.835]
  - - [4096, 10208, 1, 1024]
    - [365, 92.408]
  - - [1024, 10208, 1, 3072]
    - [239, 89.478]
  - - [1024, 10208, 1, 4096]
    - [375, 89.648]
  - - [1024, 10224, 1, 2048]
    - [226, 89.439]
  - - [1024, 10240, 1, 2048]
    - [226, 87.682]
  - - [1024, 10120, 1, 1024]
    - [239, 85.095]
  - - [1024, 10192, 1, 2048]
    - [239, 87.347]
  - - [64, 24, 6816, 24]
    - [309, 5.208]
  - - [1024, 10152, 1, 1024]
    - [239, 85.696]
  - - [1024, 10080, 1, 3072]
    - [251, 92.501]
  - - [64, 26, 6272, 26]
    - [309, 5.706]
  - - [100352, 512, 1, 256]
    - [235, 81.41]
  - - [12544, 2048, 1, 1024]
    - [326, 90.08]
  - - [12544, 64, 1, 147]
    - [307, 18.407]
  - - [200704, 512, 1, 256]
    - [260, 84.805]
  - - [25088, 1024, 1, 512]
    - [295, 85.869]
  - - [3136, 64, 1, 576]
    - [376, 19.494]
  - - [50176, 1024, 1, 512]
    - [262, 87.007]
  - - [6272, 2048, 1, 1024]
    - [295, 88.747]
  - - [784, 128, 1, 1152]
    - [377, 13.96]
  - - [3136, 128, 128, 256]
    - [340, 76.101]
  - - [3136, 128, 256, 256]
    - [340, 77.198]
  - - [3136, 256, 128, 64]
    - [339, 56.387]
  - - [3136, 256, 256, 64]
    - [339, 58.393]
  - - [3136, 64, 128, 256]
    - [370, 60.907]
  - - [3136, 64, 256, 256]
    - [340, 62.803]
  - - [3136, 64, 128, 64]
    - [267, 36.766]
  - - [3136, 64, 256, 64]
    - [378, 39.077]
  - - [784, 128, 128, 512]
    - [379, 73.009]
  - - [784, 128, 256, 512]
    - [273, 75.704]
  - - [784, 256, 128, 512]
    - [239, 78.303]
  - - [784, 256, 256, 512]
    - [239, 80.308]
  - - [784, 512, 128, 128]
    - [343, 66.003]
  - - [784, 512, 256, 128]
    - [339, 68.082]
  - - [128, 128, 2048, 64]
    - [300, 42.175]
  - - [64, 128, 2048, 128]
    - [366, 35.319]
  - - [1024, 2560, 1, 30528]
    - [380, 93.359]
  - - [1024, 128, 1, 1024]
    - [363, 17.206]
  - - [1024, 128, 1, 2]
    - [311, 0.114]
  - - [128, 128, 1536, 64]
    - [346, 40.518]
  - - [64, 128, 1536, 128]
    - [381, 34.65]
  - - [1024, 12288, 1, 4096]
    - [237, 91.203]
  - - [1024, 12288, 1, 1024]
    - [295, 88.015]
  - - [4096, 12288, 1, 1024]
    - [343, 93.347]
  - - [1024, 1920, 1, 30528]
    - [330, 96.544]
  - - [1024, 96, 1, 1024]
    - [382, 13.458]
  - - [1024, 96, 1, 2]
    - [230, 0.06]
  - - [128, 128, 192, 64]
    - [261, 24.79]
  - - [64, 128, 192, 128]
    - [239, 28.12]
  - - [768, 2048, 1, 2]
    - [244, 0.795]
  - - [3072, 2048, 1, 768]
    - [226, 81.843]
  - - [768, 2048, 1, 3072]
    - [220, 72.176]
  - - [768, 2048, 1, 768]
    - [383, 62.629]
  - - [384, 384, 144, 64]
    - [237, 47.102]
  - - [64, 384, 144, 384]
    - [354, 51.384]
  - - [768, 4608, 1, 2]
    - [384, 1.104]
  - - [3072, 4608, 1, 768]
    - [251, 88.202]
  - - [768, 4608, 1, 3072]
    - [385, 84.924]
  - - [768, 4608, 1, 768]
    - [341, 75.925]
  - - [512, 512, 48, 64]
    - [365, 41.07]
  - - [64, 512, 48, 512]
    - [239, 54.415]
  - - [128, 128, 256, 64]
    - [279, 25.765]
  - - [64, 128, 256, 128]
    - [273, 26.443]
  - - [384, 384, 192, 64]
    - [386, 48.241]
  - - [64, 384, 192, 384]
    - [279, 50.093]
  - - [1024, 4608, 1, 2]
    - [226, 1.201]
  - - [4096, 4608, 1, 1024]
    - [299, 90.685]
  - - [1024, 4608, 1, 4096]
    - [298, 88.359]
  - - [1024, 4608, 1, 1024]
    - [291, 80.891]
  - - [8192, 1024, 1, 1024]
    - [245, 84.842]
  - - [8192, 4096, 1, 1024]
    - [326, 91.622]
  - - [16384, 16384, 1, 16384]
    - [387, 96.857]
  - - [196, 256, 1, 2304]
    - [412, 13.524]
  - - [49, 512, 1, 4608]
    - [413, 11.889]
  - - [196, 1024, 128, 256]
    - [414, 56.7]
  - - [196, 1024, 256, 256]
    - [414, 59.08]
  - - [196, 256, 128, 1024]
    - [415, 61.362]
  - - [196, 256, 256, 1024]
    - [415, 63.303]
  - - [196, 512, 128, 1024]
    - [415, 63.763]
  - - [196, 512, 256, 1024]
    - [414, 66.582]
  - - [49, 2048, 128, 512]
    - [416, 44.892]
  - - [49, 2048, 256, 512]
    - [417, 45.666]
  - - [49, 512, 128, 2048]
    - [418, 46.432]
  - - [49, 512, 256, 2048]
    - [419, 50.686]
- null
