library/src/blas3/Tensile/Logic/asm_full/aldebaran_Cijk_Ailk_Bljk_HHS_BH.yaml
- {MinimumRequiredVersion: 4.31.0}
- aldebaran
- gfx90a
- [Device 0050, Device 0051, Device 0052, Device 0054, Device 0062, Device 7400, Device
    SolutionIndex: 0
    SolutionNameMin: Cijk_Ailk_Bljk_HHS_BH_MT064x064x04_PGR1_PLR1_TT04_04
    SolutionIndex: 1
    SolutionNameMin: Cijk_Ailk_Bljk_HHS_BH_MT064x064x08_PGR1_PLR1_TT04_04
    SolutionIndex: 2
    SolutionNameMin: Cijk_Ailk_Bljk_HHS_BH_MT064x064x16_PGR1_PLR1_TT04_04
    SolutionIndex: 3
    SolutionNameMin: Cijk_Ailk_Bljk_HHS_BH_MT32x32x32_MI16x16x16x1_SE_GRVW2_LPB16_PLR2_SU0_SUS256_SRVW4_TT1_16_WG32_8_1_WGM1
    SolutionIndex: 4
    SolutionNameMin: Cijk_Ailk_Bljk_HHS_BH_MT128x96x64_MI32x32x8x1_SE_1LDSB0_AF0EM8_EPS0_GRVW8_GSU1_GSUAMB_LBSPP128_LPB8_LRVW8_NLCA1_PGR2_PLR9_SU0_SUS0_SRVW4_TT1_96_TLDS1_VAW2_WSGRA1_WSGRB1_WG128_2_1_WGM15
    SolutionIndex: 5
    SolutionNameMin: Cijk_Ailk_Bljk_HHS_BH_MT128x96x32_MI32x32x8x1_SE_1LDSB0_AF0EM8_EPS0_GRVW4_GSU1_GSUAMB_LBSPP128_LPB8_LRVW8_NLCA1_PGR2_PLR5_SU32_SUS128_SRVW4_TT1_96_TLDS1_VAW2_WSGRA1_WSGRB1_WG128_2_1_WGM1
    SolutionIndex: 6
    SolutionNameMin: Cijk_Ailk_Bljk_HHS_BH_MT32x64x64_MI16x16x16x1_SE_1LDSB0_AF0EM8_EPS0_GRVW8_GSU1_GSUAMB_LBSPP128_LPB16_LRVW8_NLCA1_PGR2_PLR5_SU32_SUS256_SRVW4_TT1_32_TLDS1_VAW2_WSGRA1_WSGRB1_WG32_8_1_WGM15
    SolutionIndex: 7
    SolutionNameMin: Cijk_Ailk_Bljk_HHS_BH_MT128x96x32_MI32x32x8x1_SE_1LDSB1_AF0EM8_EPS1_GRVW2_GSU1_GSUAMB_LBSPP128_LPB8_LRVW8_NLCA1_PGR1_PLR5_SU32_SUS128_SRVW4_TT1_96_TLDS1_VAW2_WSGRA1_WSGRB1_WG128_2_1_WGM2
    SolutionIndex: 8
    SolutionNameMin: Cijk_Ailk_Bljk_HHS_BH_MT32x64x64_MI16x16x16x1_SE_1LDSB0_AF0EM8_EPS0_GRVW8_GSU1_GSUAMB_LBSPP128_LPB16_LRVW8_NLCA1_PGR2_PLR5_SU32_SUS256_SRVW4_TT1_32_TLDS1_VAW2_WSGRA1_WSGRB1_WG32_8_1_WGM1
    SolutionIndex: 9
    SolutionNameMin: Cijk_Ailk_Bljk_HHS_BH_MT64x128x64_MI32x32x8x1_SE_1LDSB0_AF0EM8_EPS0_GRVW8_GSU1_GSUAMB_LBSPP128_LPB8_LRVW8_NLCA1_PGR2_PLR9_SU32_SUS128_SRVW4_TT1_64_TLDS1_VAW2_WSGRA1_WSGRB1_WG64_4_1_WGM1
    SolutionIndex: 10
    SolutionNameMin: Cijk_Ailk_Bljk_HHS_BH_MT128x96x32_MI32x32x8x1_SE_1LDSB0_AF0EM1_EPS0_GRVW4_GSU1_GSUAMB_LBSPP128_LPB8_LRVW8_NLCA1_PGR2_PLR5_SU0_SUS0_SRVW4_TT1_96_TLDS1_VAW2_WSGRA1_WSGRB1_WG128_2_1_WGM15
    SolutionIndex: 11
    SolutionNameMin: Cijk_Ailk_Bljk_HHS_BH_MT256x128x32_MI32x32x8x1_SE_1LDSB0_AF0EM8_EPS0_GRVW8_GSU1_GSUAMB_LBSPP128_LPB8_LRVW8_NLCA1_PGR2_PLR5_SU0_SUS0_SRVW4_TT4_64_TLDS1_VAW2_WSGRA1_WSGRB1_WG64_4_1_WGM1
    SolutionIndex: 12
    SolutionNameMin: Cijk_Ailk_Bljk_HHS_BH_MT128x160x32_MI32x32x8x1_SE_1LDSB1_AF0EM8_EPS1_GRVW2_GSU1_GSUAMB_LBSPP128_LPB8_LRVW8_NLCA1_PGR1_PLR5_SU32_SUS128_SRVW4_TT1_160_TLDS1_VAW2_WSGRA1_WSGRB1_WG128_2_1_WGM2
    SolutionIndex: 13
    SolutionNameMin: Cijk_Ailk_Bljk_HHS_BH_MT256x160x32_MI32x32x8x1_SE_1LDSB0_AF0EM8_EPS0_GRVW4_GSU1_GSUAMB_LBSPP128_LPB8_LRVW8_NLCA1_PGR2_PLR5_SU0_SUS0_SRVW4_TT2_160_TLDS1_VAW2_WSGRA1_WSGRB1_WG128_2_1_WGM2
    SolutionIndex: 14
    SolutionNameMin: Cijk_Ailk_Bljk_HHS_BH_MT128x160x32_MI32x32x8x1_SE_1LDSB1_AF0EM8_EPS1_GRVW2_GSU1_GSUAMB_LBSPP128_LPB8_LRVW8_NLCA1_PGR1_PLR5_SU0_SUS0_SRVW4_TT1_160_TLDS1_VAW2_WSGRA1_WSGRB1_WG128_2_1_WGM1
    SolutionIndex: 15
    SolutionNameMin: Cijk_Ailk_Bljk_HHS_BH_MT64x128x64_MI32x32x8x1_SE_1LDSB0_AF0EM8_EPS0_GRVW8_GSU1_GSUAMB_LBSPP128_LPB8_LRVW8_NLCA1_PGR2_PLR9_SU0_SUS0_SRVW4_TT1_64_TLDS1_VAW2_WSGRA1_WSGRB1_WG64_4_1_WGM15
    SolutionIndex: 16
    SolutionNameMin: Cijk_Ailk_Bljk_HHS_BH_MT128x160x32_MI32x32x8x1_SE_1LDSB1_AF0EM8_EPS1_GRVW2_GSU1_GSUAMB_LBSPP128_LPB8_LRVW8_NLCA1_PGR1_PLR5_SU32_SUS128_SRVW4_TT1_160_TLDS1_VAW2_WSGRA1_WSGRB1_WG128_2_1_WGM1
    SolutionIndex: 17
    SolutionNameMin: Cijk_Ailk_Bljk_HHS_BH_MT128x128x32_MI32x32x8x1_SE_1LDSB0_AF0EM8_EPS0_GRVW8_GSU1_GSUAMB_LBSPP128_LPB8_LRVW8_NLCA1_PGR2_PLR5_SU32_SUS128_SRVW4_TT2_64_TLDS1_VAW2_WSGRA1_WSGRB1_WG64_4_1_WGM15
    SolutionIndex: 18
    SolutionNameMin: Cijk_Ailk_Bljk_HHS_BH_MT128x256x32_MI32x32x8x1_SE_1LDSB1_AF0EM8_EPS0_GRVW8_GSU1_GSUAMB_LBSPP128_LPB8_LRVW8_NLCA1_PGR2_PLR5_SU0_SUS0_SRVW4_TT2_128_TLDS1_VAW2_WSGRA1_WSGRB1_WG64_4_1_WGM1
    SolutionIndex: 19
    SolutionNameMin: Cijk_Ailk_Bljk_HHS_BH_MT64x16x64_MI16x16x16x1_SE_1LDSB0_AF0EM8_EPS0_GRVW8_GSU1_GSUAMB_LBSPP128_LPB16_LRVW8_NLCA1_PGR2_PLR5_SU0_SUS0_SRVW0_TT1_16_TLDS1_VAW2_WSGRA1_WSGRB1_WG64_4_1_WGM1
    SolutionIndex: 20
    SolutionNameMin: Cijk_Ailk_Bljk_HHS_BH_MT64x128x64_MI32x32x8x1_SE_1LDSB0_AF0EM8_EPS0_GRVW8_GSU1_GSUAMB_LBSPP128_LPB8_LRVW8_NLCA1_PGR2_PLR9_SU0_SUS0_SRVW4_TT1_64_TLDS1_VAW2_WSGRA1_WSGRB1_WG64_4_1_WGM1
    SolutionIndex: 21
    SolutionNameMin: Cijk_Ailk_Bljk_HHS_BH_MT128x96x32_MI32x32x8x1_SE_1LDSB1_AF0EM8_EPS1_GRVW2_GSU1_GSUAMB_LBSPP128_LPB8_LRVW8_NLCA1_PGR1_PLR5_SU32_SUS128_SRVW4_TT1_96_TLDS1_VAW2_WSGRA1_WSGRB1_WG128_2_1_WGM15
    SolutionIndex: 22
    SolutionNameMin: Cijk_Ailk_Bljk_HHS_BH_MT128x64x32_MI32x32x8x1_SE_1LDSB0_AF0EM8_EPS0_GRVW8_GSU1_GSUAMB_LBSPP128_LPB8_LRVW8_NLCA1_PGR2_PLR5_SU0_SUS0_SRVW4_TT2_32_TLDS1_VAW2_WSGRA1_WSGRB1_WG64_4_1_WGM1
    SolutionIndex: 23
    SolutionNameMin: Cijk_Ailk_Bljk_HHS_BH_MT96x128x32_MI32x32x8x1_SE_1LDSB0_AF0EM8_EPS0_GRVW4_GSU1_GSUAMB_LBSPP128_LPB8_LRVW8_NLCA3_PGR2_PLR5_SU32_SUS128_SRVW0_TT3_32_TLDS1_VAW2_WSGRA1_WSGRB1_WG32_8_1_WGM1
    SolutionIndex: 24
    SolutionNameMin: Cijk_Ailk_Bljk_HHS_BH_MT128x192x32_MI32x32x8x1_SE_1LDSB0_AF0EM8_EPS0_GRVW8_GSU1_GSUAMB_LBSPP128_LPB8_LRVW8_NLCA1_PGR2_PLR5_SU0_SUS0_SRVW4_TT2_96_TLDS1_VAW2_WSGRA1_WSGRB1_WG64_4_1_WGM15
    SolutionIndex: 25
    SolutionNameMin: Cijk_Ailk_Bljk_HHS_BH_MT128x96x32_MI32x32x8x1_SE_1LDSB1_AF0EM8_EPS1_GRVW2_GSU1_GSUAMB_LBSPP128_LPB8_LRVW8_NLCA1_PGR1_PLR5_SU0_SUS0_SRVW4_TT1_96_TLDS1_VAW2_WSGRA1_WSGRB1_WG128_2_1_WGM1
    SolutionIndex: 26
    SolutionNameMin: Cijk_Ailk_Bljk_HHS_BH_MT64x64x32_MI32x32x8x1_SE_1LDSB0_AF0EM8_EPS0_GRVW8_GSU1_GSUAMB_LBSPP128_LPB8_LRVW8_NLCA1_PGR2_PLR5_SU0_SUS0_SRVW4_TT1_32_TLDS1_VAW2_WSGRA1_WSGRB1_WG64_4_1_WGM1
    SolutionIndex: 27
    SolutionNameMin: Cijk_Ailk_Bljk_HHS_BH_MT128x256x32_MI32x32x8x1_SE_1LDSB1_AF0EM8_EPS0_GRVW8_GSU1_GSUAMB_LBSPP128_LPB8_LRVW8_NLCA1_PGR2_PLR5_SU0_SUS0_SRVW4_TT2_128_TLDS1_VAW2_WSGRA1_WSGRB1_WG64_4_1_WGM2
    SolutionIndex: 28
    SolutionNameMin: Cijk_Ailk_Bljk_HHS_BH_MT16x64x64_MI16x16x16x1_SE_1LDSB0_AF0EM8_EPS0_GRVW8_GSU1_GSUAMB_LBSPP128_LPB16_LRVW8_NLCA1_PGR2_PLR5_SU0_SUS0_SRVW0_TT1_16_TLDS1_VAW2_WSGRA1_WSGRB1_WG16_16_1_WGM15
    SolutionIndex: 29
    SolutionNameMin: Cijk_Ailk_Bljk_HHS_BH_MT128x128x32_MI32x32x8x1_SE_1LDSB0_AF0EM8_EPS0_GRVW8_GSU1_GSUAMB_LBSPP128_LPB8_LRVW8_NLCA1_PGR2_PLR5_SU32_SUS256_SRVW4_TT2_64_TLDS1_VAW2_WSGRA1_WSGRB1_WG64_4_1_WGM1
    SolutionIndex: 30
    SolutionNameMin: Cijk_Ailk_Bljk_HHS_BH_MT64x64x64_MI32x32x8x1_SE_1LDSB0_AF0EM8_EPS0_GRVW8_GSU1_GSUAMB_LBSPP128_LPB8_LRVW8_NLCA1_PGR2_PLR9_SU0_SUS0_SRVW4_TT1_32_TLDS1_VAW2_WSGRA1_WSGRB1_WG64_4_1_WGM2
    SolutionIndex: 31
    SolutionNameMin: Cijk_Ailk_Bljk_HHS_BH_MT256x160x32_MI32x32x8x1_SE_1LDSB0_AF0EM8_EPS0_GRVW4_GSU1_GSUAMB_LBSPP128_LPB8_LRVW8_NLCA1_PGR2_PLR5_SU0_SUS0_SRVW4_TT2_160_TLDS1_VAW2_WSGRA1_WSGRB1_WG128_2_1_WGM15
    SolutionIndex: 32
    SolutionNameMin: Cijk_Ailk_Bljk_HHS_BH_MT16x64x64_MI16x16x16x1_SE_1LDSB0_AF0EM8_EPS0_GRVW8_GSU1_GSUAMB_LBSPP128_LPB16_LRVW8_NLCA1_PGR2_PLR5_SU0_SUS0_SRVW0_TT1_16_TLDS1_VAW2_WSGRA1_WSGRB1_WG16_16_1_WGM1
    SolutionIndex: 33
    SolutionNameMin: Cijk_Ailk_Bljk_HHS_BH_MT128x128x32_MI32x32x8x1_SE_1LDSB0_AF0EM8_EPS0_GRVW8_GSU1_GSUAMB_LBSPP128_LPB8_LRVW8_NLCA1_PGR2_PLR5_SU0_SUS0_SRVW4_TT2_64_TLDS1_VAW2_WSGRA1_WSGRB1_WG64_4_1_WGM15
    SolutionIndex: 34
    SolutionNameMin: Cijk_Ailk_Bljk_HHS_BH_MT64x64x64_MI32x32x8x1_SE_1LDSB0_AF0EM1_EPS0_GRVW8_GSU1_GSUAMB_LBSPP128_LPB8_LRVW8_NLCA1_PGR2_PLR9_SU0_SUS0_SRVW4_TT1_32_TLDS1_VAW2_WSGRA1_WSGRB1_WG64_4_1_WGM1
    SolutionIndex: 35
    SolutionNameMin: Cijk_Ailk_Bljk_HHS_BH_MT128x128x32_MI32x32x8x1_SE_1LDSB1_AF0EM8_EPS1_GRVW2_GSU1_GSUAMB_LBSPP128_LPB8_LRVW8_NLCA1_PGR1_PLR5_SU32_SUS128_SRVW4_TT2_64_TLDS1_VAW2_WSGRA1_WSGRB1_WG64_4_1_WGM15
    SolutionIndex: 36
    SolutionNameMin: Cijk_Ailk_Bljk_HHS_BH_MT128x144x32_MI16x16x16x1_SE_1LDSB1_AF0EM8_EPS1_GRVW2_GSU1_GSUAMB_LBSPP128_LPB16_LRVW8_NLCA1_PGR1_PLR2_SU32_SUS256_SRVW4_TT2_144_TLDS1_VAW2_WSGRA1_WSGRB1_WG64_4_1_WGM1
    SolutionIndex: 37
    SolutionNameMin: Cijk_Ailk_Bljk_HHS_BH_MT128x64x32_MI32x32x8x1_SE_1LDSB0_AF0EM8_EPS0_GRVW8_GSU1_GSUAMB_LBSPP128_LPB8_LRVW8_NLCA1_PGR2_PLR5_SU0_SUS0_SRVW4_TT2_32_TLDS1_VAW2_WSGRA1_WSGRB1_WG64_4_1_WGM15
    SolutionIndex: 38
    SolutionNameMin: Cijk_Ailk_Bljk_HHS_BH_MT128x96x32_MI32x32x8x1_SE_1LDSB1_AF0EM8_EPS1_GRVW2_GSU1_GSUAMB_LBSPP128_LPB8_LRVW8_NLCA1_PGR1_PLR5_SU32_SUS128_SRVW4_TT1_96_TLDS1_VAW2_WSGRA1_WSGRB1_WG128_2_1_WGM1
    SolutionIndex: 39
    SolutionNameMin: Cijk_Ailk_Bljk_HHS_BH_MT64x64x32_MI32x32x8x1_SE_1LDSB0_AF0EM8_EPS0_GRVW8_GSU1_GSUAMB_LBSPP128_LPB8_LRVW8_NLCA1_PGR2_PLR5_SU0_SUS0_SRVW4_TT1_32_TLDS1_VAW2_WSGRA1_WSGRB1_WG64_4_1_WGM2
    SolutionIndex: 40
    SolutionNameMin: Cijk_Ailk_Bljk_HHS_BH_MT128x96x32_MI32x32x8x1_SE_1LDSB0_AF0EM8_EPS1_GRVW4_GSU1_GSUAMB_LBSPP128_LPB8_LRVW8_NLCA1_PGR1_PLR5_SU0_SUS0_SRVW4_TT1_96_TLDS1_VAW2_WSGRA1_WSGRB1_WG128_2_1_WGM1
    SolutionIndex: 41
    SolutionNameMin: Cijk_Ailk_Bljk_HHS_BH_MT128x96x32_MI32x32x8x1_SE_1LDSB0_AF0EM8_EPS1_GRVW4_GSU1_GSUAMB_LBSPP128_LPB8_LRVW8_NLCA1_PGR1_PLR5_SU32_SUS256_SRVW4_TT1_96_TLDS1_VAW2_WSGRA1_WSGRB1_WG128_2_1_WGM2
    SolutionIndex: 42
    SolutionNameMin: Cijk_Ailk_Bljk_HHS_BH_MT64x64x64_MI32x32x8x1_SE_1LDSB0_AF0EM8_EPS0_GRVW8_GSU1_GSUAMB_LBSPP128_LPB8_LRVW8_NLCA1_PGR2_PLR9_SU0_SUS0_SRVW4_TT1_32_TLDS1_VAW2_WSGRA1_WSGRB1_WG64_4_1_WGM15
    SolutionIndex: 43
    SolutionNameMin: Cijk_Ailk_Bljk_HHS_BH_MT64x128x32_MI32x32x8x1_SE_1LDSB0_AF0EM8_EPS1_GRVW8_GSU1_GSUAMB_LBSPP128_LPB8_LRVW8_NLCA1_PGR1_PLR5_SU0_SUS0_SRVW4_TT1_64_TLDS1_VAW2_WSGRA1_WSGRB1_WG64_4_1_WGM1
    SolutionIndex: 44
    SolutionNameMin: Cijk_Ailk_Bljk_HHS_BH_MT64x64x64_MI32x32x8x1_SE_1LDSB0_AF0EM8_EPS0_GRVW8_GSU1_GSUAMB_LBSPP128_LPB8_LRVW8_NLCA1_PGR2_PLR9_SU0_SUS0_SRVW4_TT1_32_TLDS1_VAW2_WSGRA1_WSGRB1_WG64_4_1_WGM1
    SolutionIndex: 45
    SolutionNameMin: Cijk_Ailk_Bljk_HHS_BH_MT128x160x32_MI32x32x8x1_SE_1LDSB0_AF0EM8_EPS0_GRVW4_GSU1_GSUAMB_LBSPP128_LPB8_LRVW8_NLCA1_PGR2_PLR5_SU32_SUS128_SRVW4_TT1_160_TLDS1_VAW2_WSGRA1_WSGRB1_WG128_2_1_WGM2
    SolutionIndex: 46
    SolutionNameMin: Cijk_Ailk_Bljk_HHS_BH_MT32x64x64_MI16x16x16x1_SE_1LDSB0_AF0EM8_EPS1_GRVW8_GSU1_GSUAMB_LBSPP128_LPB16_LRVW8_NLCA1_PGR1_PLR5_SU0_SUS0_SRVW4_TT1_32_TLDS1_VAW2_WSGRA1_WSGRB1_WG32_8_1_WGM1
    SolutionIndex: 47
    SolutionNameMin: Cijk_Ailk_Bljk_HHS_BH_MT128x128x32_MI32x32x8x1_SE_1LDSB0_AF0EM8_EPS0_GRVW8_GSU1_GSUAMB_LBSPP128_LPB8_LRVW8_NLCA1_PGR2_PLR5_SU32_SUS128_SRVW4_TT2_64_TLDS1_VAW2_WSGRA1_WSGRB1_WG64_4_1_WGM2
    SolutionIndex: 48
    SolutionNameMin: Cijk_Ailk_Bljk_HHS_BH_MT128x96x32_MI32x32x8x1_SE_1LDSB1_AF0EM8_EPS1_GRVW2_GSU1_GSUAMB_LBSPP128_LPB8_LRVW8_NLCA1_PGR1_PLR5_SU32_SUS256_SRVW4_TT1_96_TLDS1_VAW2_WSGRA1_WSGRB1_WG128_2_1_WGM1
    SolutionIndex: 49
    SolutionNameMin: Cijk_Ailk_Bljk_HHS_BH_MT128x96x64_MI32x32x8x1_SE_1LDSB0_AF0EM8_EPS0_GRVW8_GSU1_GSUAMB_LBSPP128_LPB8_LRVW8_NLCA1_PGR2_PLR9_SU0_SUS0_SRVW4_TT1_96_TLDS1_VAW2_WSGRA1_WSGRB1_WG128_2_1_WGM1
    SolutionIndex: 50
    SolutionNameMin: Cijk_Ailk_Bljk_HHS_BH_MT32x32x32_MI16x16x16x1_SE_1LDSB0_AF0EM8_EPS0_GRVW8_GSU1_GSUAMB_LBSPP128_LPB16_LRVW8_NLCA1_PGR2_PLR2_SU0_SUS0_SRVW4_TT1_16_TLDS1_VAW2_WSGRA1_WSGRB1_WG32_8_1_WGM1
    SolutionIndex: 51
    SolutionNameMin: Cijk_Ailk_Bljk_HHS_BH_MT64x16x32_MI16x16x16x1_SE_1LDSB0_AF0EM8_EPS0_GRVW8_GSU1_GSUAMB_LBSPP128_LPB16_LRVW8_NLCA1_PGR2_PLR2_SU0_SUS0_SRVW0_TT1_16_TLDS1_VAW2_WSGRA1_WSGRB1_WG64_4_1_WGM15
    SolutionIndex: 52
    SolutionNameMin: Cijk_Ailk_Bljk_HHS_BH_MT64x16x32_MI16x16x16x1_SE_1LDSB0_AF0EM8_EPS0_GRVW2_GSU1_GSUAMB_LBSPP128_LPB16_LRVW8_NLCA1_PGR2_PLR2_SU0_SUS0_SRVW0_TT1_16_TLDS1_VAW2_WSGRA1_WSGRB1_WG64_4_1_WGM1
    SolutionIndex: 53
    SolutionNameMin: Cijk_Ailk_Bljk_HHS_BH_MT32x32x64_MI16x16x16x1_SE_1LDSB0_AF0EM8_EPS0_GRVW8_GSU1_GSUAMB_LBSPP128_LPB16_LRVW8_NLCA1_PGR2_PLR5_SU32_SUS128_SRVW4_TT1_16_TLDS1_VAW2_WSGRA1_WSGRB1_WG32_8_1_WGM2
    SolutionIndex: 54
    SolutionNameMin: Cijk_Ailk_Bljk_HHS_BH_MT32x64x64_MI16x16x16x1_SE_1LDSB0_AF0EM8_EPS0_GRVW8_GSU1_GSUAMB_LBSPP128_LPB16_LRVW8_NLCA1_PGR2_PLR5_SU32_SUS128_SRVW4_TT1_32_TLDS1_VAW2_WSGRA1_WSGRB1_WG32_8_1_WGM1
    SolutionIndex: 55
    SolutionNameMin: Cijk_Ailk_Bljk_HHS_BH_MT16x16x64_MI16x16x16x1_SE_1LDSB0_AF0EM8_EPS0_GRVW8_GSU1_GSUAMB_LBSPP128_LPB16_LRVW8_NLCA1_PGR2_PLR5_SU32_SUS128_SRVW0_TT1_16_TLDS1_VAW2_WSGRA1_WSGRB1_WG16_4_1_WGM2
    SolutionIndex: 56
    SolutionNameMin: Cijk_Ailk_Bljk_HHS_BH_MT128x256x32_MI32x32x8x1_SE_1LDSB1_AF0EM8_EPS0_GRVW8_GSU1_GSUAMB_LBSPP128_LPB8_LRVW8_NLCA1_PGR2_PLR5_SU0_SUS0_SRVW4_TT2_128_TLDS1_VAW2_WSGRA1_WSGRB1_WG64_4_1_WGM15
    SolutionIndex: 57
    SolutionNameMin: Cijk_Ailk_Bljk_HHS_BH_MT64x128x64_MI32x32x8x1_SE_1LDSB0_AF0EM8_EPS0_GRVW8_GSU1_GSUAMB_LBSPP128_LPB8_LRVW8_NLCA1_PGR2_PLR9_SU0_SUS0_SRVW4_TT1_64_TLDS1_VAW2_WSGRA1_WSGRB1_WG64_4_1_WGM2
    SolutionIndex: 58
    SolutionNameMin: Cijk_Ailk_Bljk_HHS_BH_MT128x128x32_MI32x32x8x1_SE_1LDSB1_AF0EM8_EPS1_GRVW2_GSU1_GSUAMB_LBSPP128_LPB8_LRVW8_NLCA1_PGR1_PLR5_SU0_SUS0_SRVW4_TT2_64_TLDS1_VAW2_WSGRA1_WSGRB1_WG64_4_1_WGM1
    SolutionIndex: 59
    SolutionNameMin: Cijk_Ailk_Bljk_HHS_BH_MT64x128x64_MI32x32x8x1_SE_1LDSB0_AF0EM8_EPS0_GRVW8_GSU1_GSUAMB_LBSPP128_LPB8_LRVW8_NLCA1_PGR2_PLR9_SU32_SUS256_SRVW4_TT1_64_TLDS1_VAW2_WSGRA1_WSGRB1_WG64_4_1_WGM2
    SolutionIndex: 60
    SolutionNameMin: Cijk_Ailk_Bljk_HHS_BH_MT128x96x32_MI32x32x8x1_SE_1LDSB1_AF0EM8_EPS1_GRVW2_GSU1_GSUAMB_LBSPP128_LPB8_LRVW8_NLCA1_PGR1_PLR5_SU0_SUS0_SRVW4_TT1_96_TLDS1_VAW2_WSGRA1_WSGRB1_WG128_2_1_WGM15
    SolutionIndex: 61
    SolutionNameMin: Cijk_Ailk_Bljk_HHS_BH_MT16x16x64_MI16x16x16x1_SE_1LDSB0_AF0EM8_EPS0_GRVW8_GSU1_GSUAMB_LBSPP128_LPB16_LRVW8_NLCA1_PGR2_PLR5_SU32_SUS256_SRVW0_TT1_16_TLDS1_VAW2_WSGRA1_WSGRB1_WG16_4_1_WGM1
    SolutionIndex: 62
    SolutionNameMin: Cijk_Ailk_Bljk_HHS_BH_MT128x256x32_MI32x32x8x1_SE_1LDSB1_AF0EM1_EPS0_GRVW8_GSU1_GSUAMB_LBSPP128_LPB8_LRVW8_NLCA1_PGR2_PLR5_SU32_SUS128_SRVW4_TT2_128_TLDS1_VAW2_WSGRA1_WSGRB1_WG64_4_1_WGM2
    SolutionIndex: 63
    SolutionNameMin: Cijk_Ailk_Bljk_HHS_BH_MT128x96x32_MI32x32x8x1_SE_1LDSB1_AF0EM8_EPS1_GRVW2_GSU1_GSUAMB_LBSPP128_LPB8_LRVW8_NLCA1_PGR1_PLR5_SU32_SUS256_SRVW4_TT1_96_TLDS1_VAW2_WSGRA1_WSGRB1_WG128_2_1_WGM15
    SolutionIndex: 64
    SolutionNameMin: Cijk_Ailk_Bljk_HHS_BH_MT128x128x32_MI32x32x8x1_SE_1LDSB0_AF0EM8_EPS0_GRVW8_GSU1_GSUAMB_LBSPP128_LPB8_LRVW8_NLCA1_PGR2_PLR5_SU0_SUS0_SRVW4_TT2_64_TLDS1_VAW2_WSGRA1_WSGRB1_WG64_4_1_WGM1
    SolutionIndex: 65
    SolutionNameMin: Cijk_Ailk_Bljk_HHS_BH_MT128x64x32_MI32x32x8x1_SE_1LDSB0_AF0EM8_EPS0_GRVW8_GSU1_GSUAMB_LBSPP128_LPB8_LRVW8_NLCA1_PGR2_PLR5_SU32_SUS256_SRVW4_TT2_32_TLDS1_VAW2_WSGRA1_WSGRB1_WG64_4_1_WGM15
    SolutionIndex: 66
    SolutionNameMin: Cijk_Ailk_Bljk_HHS_BH_MT16x16x64_MI16x16x16x1_SE_1LDSB0_AF0EM8_EPS0_GRVW4_GSU1_GSUAMB_LBSPP128_LPB16_LRVW8_NLCA1_PGR2_PLR5_SU0_SUS0_SRVW0_TT1_16_TLDS1_VAW2_WSGRA1_WSGRB1_WG16_4_1_WGM1
    SolutionIndex: 67
    SolutionNameMin: Cijk_Ailk_Bljk_HHS_BH_MT128x96x32_MI32x32x8x1_SE_1LDSB1_AF0EM8_EPS1_GRVW2_GSU1_GSUAMB_LBSPP128_LPB8_LRVW8_NLCA1_PGR1_PLR5_SU32_SUS256_SRVW4_TT1_96_TLDS1_VAW2_WSGRA1_WSGRB1_WG128_2_1_WGM2
    SolutionIndex: 68
    SolutionNameMin: Cijk_Ailk_Bljk_HHS_BH_MT96x128x64_MI32x32x8x1_SE_1LDSB0_AF0EM8_EPS0_GRVW2_GSU1_GSUAMB_LBSPP128_LPB8_LRVW8_NLCA3_PGR2_PLR9_SU0_SUS0_SRVW0_TT3_32_TLDS1_VAW2_WSGRA1_WSGRB1_WG32_8_1_WGM1
    SolutionIndex: 69
    SolutionNameMin: Cijk_Ailk_Bljk_HHS_BH_MT128x160x32_MI32x32x8x1_SE_1LDSB0_AF0EM8_EPS0_GRVW4_GSU1_GSUAMB_LBSPP128_LPB8_LRVW8_NLCA1_PGR2_PLR5_SU0_SUS0_SRVW4_TT1_160_TLDS1_VAW2_WSGRA1_WSGRB1_WG128_2_1_WGM2
    SolutionIndex: 70
    SolutionNameMin: Cijk_Ailk_Bljk_HHS_BH_MT32x64x32_MI16x16x16x1_SE_1LDSB1_AF0EM8_EPS1_GRVW2_GSU1_GSUAMB_LBSPP128_LPB16_LRVW8_NLCA1_PGR1_PLR2_SU0_SUS0_SRVW4_TT1_32_TLDS1_VAW2_WSGRA1_WSGRB1_WG32_8_1_WGM15
    SolutionIndex: 71
    SolutionNameMin: Cijk_Ailk_Bljk_HHS_BH_MT128x256x32_MI32x32x8x1_SE_1LDSB1_AF0EM8_EPS1_GRVW8_GSU1_GSUAMB_LBSPP128_LPB8_LRVW8_NLCA1_PGR1_PLR5_SU0_SUS0_SRVW4_TT2_128_TLDS1_VAW2_WSGRA1_WSGRB1_WG64_4_1_WGM1
    SolutionIndex: 72
    SolutionNameMin: Cijk_Ailk_Bljk_HHS_BH_MT256x128x32_MI32x32x8x1_SE_1LDSB0_AF0EM8_EPS0_GRVW8_GSU1_GSUAMB_LBSPP128_LPB8_LRVW8_NLCA1_PGR2_PLR5_SU0_SUS0_SRVW4_TT4_64_TLDS1_VAW2_WSGRA1_WSGRB1_WG64_4_1_WGM2
    SolutionIndex: 73
    SolutionNameMin: Cijk_Ailk_Bljk_HHS_BH_MT64x192x32_MI32x32x8x1_SE_1LDSB1_AF0EM8_EPS1_GRVW4_GSU1_GSUAMB_LBSPP128_LPB8_LRVW8_NLCA1_PGR1_PLR5_SU0_SUS0_SRVW4_TT1_96_TLDS1_VAW2_WSGRA1_WSGRB1_WG64_4_1_WGM15
    SolutionIndex: 74
    SolutionNameMin: Cijk_Ailk_Bljk_HHS_BH_MT128x160x32_MI32x32x8x1_SE_1LDSB0_AF0EM8_EPS0_GRVW4_GSU1_GSUAMB_LBSPP128_LPB8_LRVW8_NLCA1_PGR2_PLR5_SU32_SUS256_SRVW4_TT1_160_TLDS1_VAW2_WSGRA1_WSGRB1_WG128_2_1_WGM1
    SolutionIndex: 75
    SolutionNameMin: Cijk_Ailk_Bljk_HHS_BH_MT128x96x32_MI32x32x8x1_SE_1LDSB1_AF0EM8_EPS1_GRVW2_GSU1_GSUAMB_LBSPP128_LPB8_LRVW8_NLCA1_PGR1_PLR5_SU0_SUS0_SRVW4_TT1_96_TLDS1_VAW2_WSGRA1_WSGRB1_WG128_2_1_WGM2
    SolutionIndex: 76
    SolutionNameMin: Cijk_Ailk_Bljk_HHS_BH_MT128x192x32_MI32x32x8x1_SE_1LDSB0_AF0EM8_EPS0_GRVW8_GSU1_GSUAMB_LBSPP128_LPB8_LRVW8_NLCA1_PGR2_PLR5_SU32_SUS128_SRVW4_TT2_96_TLDS1_VAW2_WSGRA1_WSGRB1_WG64_4_1_WGM15
    SolutionIndex: 77
    SolutionNameMin: Cijk_Ailk_Bljk_HHS_BH_MT256x128x32_MI32x32x8x1_SE_1LDSB1_AF0EM8_EPS0_GRVW8_GSU1_GSUAMB_LBSPP128_LPB8_LRVW8_NLCA1_PGR2_PLR5_SU0_SUS0_SRVW4_TT4_64_TLDS1_VAW2_WSGRA1_WSGRB1_WG64_4_1_WGM15
    SolutionIndex: 78
    SolutionNameMin: Cijk_Ailk_Bljk_HHS_BH_MT128x64x32_MI32x32x8x1_SE_1LDSB0_AF0EM8_EPS0_GRVW8_GSU1_GSUAMB_LBSPP128_LPB8_LRVW8_NLCA1_PGR2_PLR5_SU32_SUS256_SRVW4_TT2_32_TLDS1_VAW2_WSGRA1_WSGRB1_WG64_4_1_WGM2
    SolutionIndex: 79
    SolutionNameMin: Cijk_Ailk_Bljk_HHS_BH_MT64x64x32_MI32x32x8x1_SE_1LDSB0_AF0EM8_EPS0_GRVW2_GSU1_GSUAMB_LBSPP128_LPB8_LRVW8_NLCA1_PGR2_PLR5_SU0_SUS0_SRVW4_TT1_32_TLDS1_VAW2_WSGRA1_WSGRB1_WG64_4_1_WGM2
    SolutionIndex: 80
    SolutionNameMin: Cijk_Ailk_Bljk_HHS_BH_MT128x256x32_MI32x32x8x1_SE_1LDSB1_AF0EM8_EPS1_GRVW8_GSU1_GSUAMB_LBSPP128_LPB8_LRVW8_NLCA1_PGR1_PLR5_SU32_SUS128_SRVW4_TT2_128_TLDS1_VAW2_WSGRA1_WSGRB1_WG64_4_1_WGM1
    SolutionIndex: 81
    SolutionNameMin: Cijk_Ailk_Bljk_HHS_BH_MT256x64x32_MI32x32x8x1_SE_1LDSB0_AF0EM1_EPS0_GRVW8_GSU1_GSUAMB_LBSPP128_LPB8_LRVW8_NLCA1_PGR2_PLR5_SU0_SUS0_SRVW4_TT4_32_TLDS1_VAW2_WSGRA1_WSGRB1_WG64_4_1_WGM1
    SolutionIndex: 82
    SolutionNameMin: Cijk_Ailk_Bljk_HHS_BH_MT64x32x64_MI16x16x16x1_SE_1LDSB0_AF0EM8_EPS0_GRVW8_GSU1_GSUAMB_LBSPP128_LPB16_LRVW8_NLCA1_PGR2_PLR5_SU0_SUS0_SRVW4_TT2_16_TLDS1_VAW2_WSGRA1_WSGRB1_WG32_8_1_WGM1
    SolutionIndex: 83
    SolutionNameMin: Cijk_Ailk_Bljk_HHS_BH_MT32x64x32_MI16x16x16x1_SE_1LDSB0_AF0EM8_EPS1_GRVW8_GSU1_GSUAMB_LBSPP128_LPB16_LRVW8_NLCA1_PGR1_PLR2_SU32_SUS256_SRVW4_TT1_32_TLDS1_VAW2_WSGRA1_WSGRB1_WG32_8_1_WGM15
    SolutionIndex: 84
    SolutionNameMin: Cijk_Ailk_Bljk_HHS_BH_MT128x64x64_MI32x32x8x1_SE_1LDSB0_AF0EM8_EPS0_GRVW8_GSU1_GSUAMB_LBSPP128_LPB8_LRVW8_NLCA1_PGR2_PLR9_SU0_SUS0_SRVW4_TT2_32_TLDS1_VAW2_WSGRA1_WSGRB1_WG64_4_1_WGM15
    SolutionIndex: 85
    SolutionNameMin: Cijk_Ailk_Bljk_HHS_BH_MT64x64x64_MI32x32x8x1_SE_1LDSB0_AF0EM8_EPS0_GRVW8_GSU1_GSUAMB_LBSPP128_LPB8_LRVW8_NLCA1_PGR2_PLR9_SU32_SUS256_SRVW4_TT1_32_TLDS1_VAW2_WSGRA1_WSGRB1_WG64_4_1_WGM1
    SolutionIndex: 86
    SolutionNameMin: Cijk_Ailk_Bljk_HHS_BH_MT128x160x32_MI32x32x8x1_SE_1LDSB0_AF0EM8_EPS0_GRVW4_GSU1_GSUAMB_LBSPP128_LPB8_LRVW8_NLCA1_PGR2_PLR5_SU32_SUS256_SRVW4_TT1_160_TLDS1_VAW2_WSGRA1_WSGRB1_WG128_2_1_WGM2
    SolutionIndex: 87
    SolutionNameMin: Cijk_Ailk_Bljk_HHS_BH_MT64x64x64_MI32x32x8x1_SE_1LDSB0_AF0EM8_EPS0_GRVW8_GSU1_GSUAMB_LBSPP128_LPB8_LRVW8_NLCA1_PGR2_PLR9_SU32_SUS128_SRVW4_TT1_32_TLDS1_VAW2_WSGRA1_WSGRB1_WG64_4_1_WGM1
    SolutionIndex: 88
    SolutionNameMin: Cijk_Ailk_Bljk_HHS_BH_MT128x160x32_MI32x32x8x1_SE_1LDSB0_AF0EM8_EPS0_GRVW4_GSU1_GSUAMB_LBSPP128_LPB8_LRVW8_NLCA1_PGR2_PLR5_SU0_SUS0_SRVW4_TT1_160_TLDS1_VAW2_WSGRA1_WSGRB1_WG128_2_1_WGM15
    SolutionIndex: 89
    SolutionNameMin: Cijk_Ailk_Bljk_HHS_BH_MT32x32x64_MI16x16x16x1_SE_1LDSB0_AF0EM8_EPS0_GRVW8_GSU1_GSUAMB_LBSPP128_LPB16_LRVW8_NLCA1_PGR2_PLR5_SU0_SUS0_SRVW4_TT1_16_TLDS1_VAW2_WSGRA1_WSGRB1_WG32_8_1_WGM1
    SolutionIndex: 90
    SolutionNameMin: Cijk_Ailk_Bljk_HHS_BH_MT128x256x32_MI32x32x8x1_SE_1LDSB1_AF0EM8_EPS0_GRVW8_GSU1_GSUAMB_LBSPP128_LPB8_LRVW8_NLCA1_PGR2_PLR5_SU32_SUS256_SRVW4_TT2_128_TLDS1_VAW2_WSGRA1_WSGRB1_WG64_4_1_WGM1
    SolutionIndex: 91
    SolutionNameMin: Cijk_Ailk_Bljk_HHS_BH_MT16x16x64_MI16x16x16x1_SE_1LDSB0_AF0EM8_EPS0_GRVW8_GSU1_GSUAMB_LBSPP128_LPB16_LRVW8_NLCA1_PGR2_PLR5_SU0_SUS0_SRVW0_TT1_16_TLDS1_VAW2_WSGRA1_WSGRB1_WG16_4_1_WGM1
    SolutionIndex: 92
    SolutionNameMin: Cijk_Ailk_Bljk_HHS_BH_MT128x128x32_MI32x32x8x1_SE_1LDSB1_AF0EM8_EPS1_GRVW2_GSU1_GSUAMB_LBSPP128_LPB8_LRVW8_NLCA1_PGR1_PLR5_SU32_SUS128_SRVW4_TT2_64_TLDS1_VAW2_WSGRA1_WSGRB1_WG64_4_1_WGM1
    SolutionIndex: 93
    SolutionNameMin: Cijk_Ailk_Bljk_HHS_BH_MT128x256x32_MI32x32x8x1_SE_1LDSB0_AF0EM8_EPS0_GRVW8_GSU1_GSUAMB_LBSPP128_LPB8_LRVW8_NLCA1_PGR2_PLR5_SU0_SUS0_SRVW4_TT2_128_TLDS1_VAW2_WSGRA1_WSGRB1_WG64_4_1_WGM15
    SolutionIndex: 94
    SolutionNameMin: Cijk_Ailk_Bljk_HHS_BH_MT192x192x32_MI32x32x8x1_SE_1LDSB0_AF0EM8_EPS0_GRVW8_GSU1_GSUAMB_LBSPP128_LPB8_LRVW8_NLCA3_PGR2_PLR5_SU0_SUS0_SRVW0_TT3_96_TLDS1_VAW2_WSGRA1_WSGRB1_WG64_4_1_WGM1
    SolutionIndex: 95
    SolutionNameMin: Cijk_Ailk_Bljk_HHS_BH_MT64x144x64_MI16x16x16x1_SE_1LDSB0_AF0EM8_EPS0_GRVW4_GSU1_GSUAMB_LBSPP128_LPB16_LRVW8_NLCA1_PGR2_PLR5_SU0_SUS0_SRVW4_TT1_144_TLDS1_VAW2_WSGRA1_WSGRB1_WG64_4_1_WGM1
    SolutionIndex: 96
    SolutionNameMin: Cijk_Ailk_Bljk_HHS_BH_MT64x128x32_MI32x32x8x1_SE_1LDSB0_AF0EM8_EPS1_GRVW8_GSU1_GSUAMB_LBSPP128_LPB8_LRVW8_NLCA1_PGR1_PLR5_SU32_SUS128_SRVW4_TT1_64_TLDS1_VAW2_WSGRA1_WSGRB1_WG64_4_1_WGM1
    SolutionIndex: 97
    SolutionNameMin: Cijk_Ailk_Bljk_HHS_BH_MT64x16x32_MI16x16x16x1_SE_1LDSB0_AF0EM8_EPS0_GRVW4_GSU1_GSUAMB_LBSPP128_LPB16_LRVW8_NLCA1_PGR2_PLR2_SU0_SUS0_SRVW0_TT1_16_TLDS1_VAW2_WSGRA1_WSGRB1_WG64_4_1_WGM1
    SolutionIndex: 98
    SolutionNameMin: Cijk_Ailk_Bljk_HHS_BH_MT128x64x32_MI32x32x8x1_SE_1LDSB0_AF0EM1_EPS0_GRVW8_GSU1_GSUAMB_LBSPP128_LPB8_LRVW8_NLCA1_PGR2_PLR5_SU0_SUS0_SRVW4_TT2_32_TLDS1_VAW2_WSGRA1_WSGRB1_WG64_4_1_WGM1
    SolutionIndex: 99
    SolutionNameMin: Cijk_Ailk_Bljk_HHS_BH_MT192x128x32_MI32x32x8x1_SE_1LDSB0_AF0EM8_EPS0_GRVW4_GSU1_GSUAMB_LBSPP128_LPB8_LRVW8_NLCA3_PGR2_PLR5_SU32_SUS128_SRVW0_TT3_64_TLDS1_VAW2_WSGRA1_WSGRB1_WG64_4_1_WGM1
    SolutionIndex: 100
    SolutionNameMin: Cijk_Ailk_Bljk_HHS_BH_MT256x160x32_MI32x32x8x1_SE_1LDSB0_AF0EM8_EPS1_GRVW4_GSU1_GSUAMB_LBSPP128_LPB8_LRVW8_NLCA1_PGR1_PLR5_SU32_SUS256_SRVW4_TT2_160_TLDS1_VAW2_WSGRA1_WSGRB1_WG128_2_1_WGM15
    SolutionIndex: 101
    SolutionNameMin: Cijk_Ailk_Bljk_HHS_BH_MT128x144x32_MI16x16x16x1_SE_1LDSB1_AF0EM8_EPS1_GRVW2_GSU1_GSUAMB_LBSPP128_LPB16_LRVW8_NLCA1_PGR1_PLR2_SU32_SUS128_SRVW4_TT2_144_TLDS1_VAW2_WSGRA1_WSGRB1_WG64_4_1_WGM2
    SolutionIndex: 102
    SolutionNameMin: Cijk_Ailk_Bljk_HHS_BH_MT128x128x32_MI32x32x8x1_SE_1LDSB0_AF0EM8_EPS0_GRVW8_GSU1_GSUAMB_LBSPP128_LPB8_LRVW8_NLCA1_PGR2_PLR5_SU32_SUS256_SRVW4_TT2_64_TLDS1_VAW2_WSGRA1_WSGRB1_WG64_4_1_WGM15
    SolutionIndex: 103
    SolutionNameMin: Cijk_Ailk_Bljk_HHS_BH_MT64x16x32_MI16x16x16x1_SE_1LDSB0_AF0EM8_EPS1_GRVW2_GSU1_GSUAMB_LBSPP128_LPB16_LRVW8_NLCA1_PGR1_PLR2_SU0_SUS0_SRVW0_TT1_16_TLDS1_VAW2_WSGRA1_WSGRB1_WG64_4_1_WGM1
    SolutionIndex: 104
    SolutionNameMin: Cijk_Ailk_Bljk_HHS_BH_MT128x144x32_MI16x16x16x1_SE_1LDSB1_AF0EM8_EPS0_GRVW2_GSU1_GSUAMB_LBSPP128_LPB16_LRVW8_NLCA1_PGR2_PLR2_SU0_SUS0_SRVW4_TT2_144_TLDS1_VAW2_WSGRA1_WSGRB1_WG64_4_1_WGM15
    SolutionIndex: 105
    SolutionNameMin: Cijk_Ailk_Bljk_HHS_BH_MT192x256x32_MI32x32x8x1_SE_1LDSB0_AF0EM8_EPS1_GRVW8_GSU1_GSUAMB_LBSPP128_LPB8_LRVW8_NLCA3_PGR1_PLR5_SU32_SUS256_SRVW0_TT3_128_TLDS1_VAW2_WSGRA1_WSGRB1_WG64_4_1_WGM1
    SolutionIndex: 106
    SolutionNameMin: Cijk_Ailk_Bljk_HHS_BH_MT128x256x32_MI32x32x8x1_SE_1LDSB0_AF0EM8_EPS0_GRVW8_GSU1_GSUAMB_LBSPP128_LPB8_LRVW8_NLCA1_PGR2_PLR5_SU32_SUS128_SRVW4_TT2_128_TLDS1_VAW2_WSGRA1_WSGRB1_WG64_4_1_WGM2
    SolutionIndex: 107
    SolutionNameMin: Cijk_Ailk_Bljk_HHS_BH_MT128x128x32_MI32x32x8x1_SE_1LDSB1_AF0EM8_EPS1_GRVW2_GSU1_GSUAMB_LBSPP128_LPB8_LRVW8_NLCA1_PGR1_PLR5_SU32_SUS256_SRVW4_TT2_64_TLDS1_VAW2_WSGRA1_WSGRB1_WG64_4_1_WGM1
    SolutionIndex: 108
    SolutionNameMin: Cijk_Ailk_Bljk_HHS_BH_MT64x128x32_MI32x32x8x1_SE_1LDSB0_AF0EM8_EPS1_GRVW8_GSU1_GSUAMB_LBSPP128_LPB8_LRVW8_NLCA1_PGR1_PLR5_SU32_SUS256_SRVW4_TT1_64_TLDS1_VAW2_WSGRA1_WSGRB1_WG64_4_1_WGM2
    SolutionIndex: 109
    SolutionNameMin: Cijk_Ailk_Bljk_HHS_BH_MT64x128x32_MI32x32x8x1_SE_1LDSB0_AF0EM8_EPS0_GRVW8_GSU1_GSUAMB_LBSPP128_LPB8_LRVW8_NLCA1_PGR2_PLR5_SU32_SUS256_SRVW4_TT1_64_TLDS1_VAW2_WSGRA1_WSGRB1_WG64_4_1_WGM15
    SolutionIndex: 110
    SolutionNameMin: Cijk_Ailk_Bljk_HHS_BH_MT128x256x32_MI32x32x8x1_SE_1LDSB1_AF0EM8_EPS0_GRVW8_GSU1_GSUAMB_LBSPP128_LPB8_LRVW8_NLCA1_PGR2_PLR5_SU32_SUS128_SRVW4_TT2_128_TLDS1_VAW2_WSGRA1_WSGRB1_WG64_4_1_WGM1
    SolutionIndex: 111
    SolutionNameMin: Cijk_Ailk_Bljk_HHS_BH_MT64x128x32_MI32x32x8x1_SE_1LDSB0_AF0EM8_EPS0_GRVW8_GSU1_GSUAMB_LBSPP128_LPB8_LRVW8_NLCA1_PGR2_PLR5_SU32_SUS256_SRVW4_TT1_64_TLDS1_VAW2_WSGRA1_WSGRB1_WG64_4_1_WGM2
    SolutionIndex: 112
    SolutionNameMin: Cijk_Ailk_Bljk_HHS_BH_MT256x192x32_MI32x32x8x1_SE_1LDSB1_AF0EM8_EPS0_GRVW8_GSU1_GSUAMB_LBSPP128_LPB8_LRVW8_NLCA1_PGR2_PLR5_SU0_SUS0_SRVW4_TT4_96_TLDS1_VAW2_WSGRA1_WSGRB1_WG64_4_1_WGM1
    SolutionIndex: 113
    SolutionNameMin: Cijk_Ailk_Bljk_HHS_BH_MT32x64x32_MI16x16x16x1_SE_1LDSB0_AF0EM8_EPS0_GRVW8_GSU1_GSUAMB_LBSPP128_LPB16_LRVW8_NLCA1_PGR2_PLR2_SU32_SUS128_SRVW4_TT1_32_TLDS1_VAW2_WSGRA1_WSGRB1_WG32_8_1_WGM15
    SolutionIndex: 114
    SolutionNameMin: Cijk_Ailk_Bljk_HHS_BH_MT64x16x32_MI16x16x16x1_SE_1LDSB0_AF0EM8_EPS0_GRVW8_GSU1_GSUAMB_LBSPP128_LPB16_LRVW8_NLCA1_PGR2_PLR2_SU0_SUS0_SRVW0_TT1_16_TLDS1_VAW2_WSGRA1_WSGRB1_WG64_4_1_WGM1
    SolutionIndex: 115
    SolutionNameMin: Cijk_Ailk_Bljk_HHS_BH_MT128x144x32_MI16x16x16x1_SE_1LDSB1_AF0EM8_EPS1_GRVW2_GSU1_GSUAMB_LBSPP128_LPB16_LRVW8_NLCA1_PGR1_PLR2_SU32_SUS256_SRVW4_TT2_144_TLDS1_VAW2_WSGRA1_WSGRB1_WG64_4_1_WGM15
    SolutionIndex: 116
    SolutionNameMin: Cijk_Ailk_Bljk_HHS_BH_MT128x128x32_MI32x32x8x1_SE_1LDSB0_AF0EM1_EPS0_GRVW8_GSU1_GSUAMB_LBSPP128_LPB8_LRVW8_NLCA1_PGR2_PLR5_SU32_SUS128_SRVW4_TT2_64_TLDS1_VAW2_WSGRA1_WSGRB1_WG64_4_1_WGM2
    SolutionIndex: 117
    SolutionNameMin: Cijk_Ailk_Bljk_HHS_BH_MT128x256x32_MI32x32x8x1_SE_1LDSB1_AF0EM1_EPS0_GRVW8_GSU1_GSUAMB_LBSPP128_LPB8_LRVW8_NLCA1_PGR2_PLR5_SU0_SUS0_SRVW4_TT2_128_TLDS1_VAW2_WSGRA1_WSGRB1_WG64_4_1_WGM1
    SolutionIndex: 118
    SolutionNameMin: Cijk_Ailk_Bljk_HHS_BH_MT64x128x32_MI32x32x8x1_SE_1LDSB0_AF0EM8_EPS0_GRVW8_GSU1_GSUAMB_LBSPP128_LPB8_LRVW8_NLCA1_PGR2_PLR5_SU32_SUS128_SRVW4_TT1_64_TLDS1_VAW2_WSGRA1_WSGRB1_WG64_4_1_WGM1
    SolutionIndex: 119
    SolutionNameMin: Cijk_Ailk_Bljk_HHS_BH_MT160x128x32_MI32x32x8x1_SE_1LDSB0_AF0EM8_EPS0_GRVW4_GSU1_GSUAMB_LBSPP128_LPB8_LRVW8_NLCA5_PGR2_PLR5_SU32_SUS256_SRVW0_TT5_32_TLDS1_VAW2_WSGRA1_WSGRB1_WG32_8_1_WGM15
    SolutionIndex: 120
    SolutionNameMin: Cijk_Ailk_Bljk_HHS_BH_MT32x32x64_MI16x16x16x1_SE_1LDSB0_AF0EM8_EPS0_GRVW8_GSU1_GSUAMB_LBSPP128_LPB16_LRVW8_NLCA1_PGR2_PLR5_SU0_SUS0_SRVW4_TT1_16_TLDS1_VAW2_WSGRA1_WSGRB1_WG32_8_1_WGM2
    SolutionIndex: 121
    SolutionNameMin: Cijk_Ailk_Bljk_HHS_BH_MT128x160x32_MI32x32x8x1_SE_1LDSB1_AF0EM8_EPS1_GRVW2_GSU1_GSUAMB_LBSPP128_LPB8_LRVW8_NLCA1_PGR1_PLR5_SU32_SUS256_SRVW4_TT1_160_TLDS1_VAW2_WSGRA1_WSGRB1_WG128_2_1_WGM15
    SolutionIndex: 122
    SolutionNameMin: Cijk_Ailk_Bljk_HHS_BH_MT128x256x32_MI32x32x8x1_SE_1LDSB1_AF0EM8_EPS1_GRVW8_GSU1_GSUAMB_LBSPP128_LPB8_LRVW8_NLCA1_PGR1_PLR5_SU32_SUS128_SRVW4_TT2_128_TLDS1_VAW2_WSGRA1_WSGRB1_WG64_4_1_WGM2
    SolutionIndex: 123
    SolutionNameMin: Cijk_Ailk_Bljk_HHS_BH_MT32x32x64_MI16x16x16x1_SE_1LDSB0_AF0EM8_EPS0_GRVW8_GSU1_GSUAMB_LBSPP128_LPB16_LRVW8_NLCA1_PGR2_PLR5_SU32_SUS256_SRVW4_TT1_16_TLDS1_VAW2_WSGRA1_WSGRB1_WG32_8_1_WGM2
    SolutionIndex: 124
    SolutionNameMin: Cijk_Ailk_Bljk_HHS_BH_MT64x32x32_MI16x16x16x1_SE_1LDSB1_AF0EM8_EPS1_GRVW2_GSU1_GSUAMB_LBSPP128_LPB16_LRVW8_NLCA1_PGR1_PLR2_SU0_SUS0_SRVW4_TT2_16_TLDS1_VAW2_WSGRA1_WSGRB1_WG32_8_1_WGM15
    SolutionIndex: 125
    SolutionNameMin: Cijk_Ailk_Bljk_HHS_BH_MT64x16x64_MI16x16x16x1_SE_1LDSB0_AF0EM8_EPS0_GRVW2_GSU1_GSUAMB_LBSPP128_LPB16_LRVW8_NLCA1_PGR2_PLR5_SU0_SUS0_SRVW0_TT1_16_TLDS1_VAW2_WSGRA1_WSGRB1_WG64_4_1_WGM2
    SolutionIndex: 126
    SolutionNameMin: Cijk_Ailk_Bljk_HHS_BH_MT128x64x64_MI32x32x8x1_SE_1LDSB0_AF0EM8_EPS1_GRVW8_GSU15_GSUAMB_LBSPP128_LPB8_LRVW8_NLCA1_PGR1_PLR9_SU0_SUS0_SRVW0_TT2_32_TLDS1_VAW1_WSGRA1_WSGRB1_WG64_4_1_WGM1
    SolutionIndex: 127
    SolutionNameMin: Cijk_Ailk_Bljk_HHS_BH_MT16x64x64_MI16x16x16x1_SE_1LDSB0_AF0EM8_EPS0_GRVW8_GSU1_GSUAMB_LBSPP128_LPB16_LRVW8_NLCA1_PGR2_PLR5_SU32_SUS256_SRVW0_TT1_16_TLDS1_VAW2_WSGRA1_WSGRB1_WG16_16_1_WGM1
    SolutionIndex: 128
    SolutionNameMin: Cijk_Ailk_Bljk_HHS_BH_MT64x128x32_MI32x32x8x1_SE_1LDSB0_AF0EM8_EPS1_GRVW8_GSU1_GSUAMB_LBSPP128_LPB8_LRVW8_NLCA1_PGR1_PLR5_SU0_SUS0_SRVW4_TT1_64_TLDS1_VAW2_WSGRA1_WSGRB1_WG64_4_1_WGM15
    SolutionIndex: 129
    SolutionNameMin: Cijk_Ailk_Bljk_HHS_BH_MT128x128x32_MI32x32x8x1_SE_1LDSB1_AF0EM8_EPS1_GRVW2_GSU1_GSUAMB_LBSPP128_LPB8_LRVW8_NLCA1_PGR1_PLR5_SU0_SUS0_SRVW4_TT2_64_TLDS1_VAW2_WSGRA1_WSGRB1_WG64_4_1_WGM2
    SolutionIndex: 130
    SolutionNameMin: Cijk_Ailk_Bljk_HHS_BH_MT256x192x32_MI32x32x8x1_SE_1LDSB1_AF0EM8_EPS1_GRVW8_GSU1_GSUAMB_LBSPP128_LPB8_LRVW8_NLCA1_PGR1_PLR5_SU0_SUS0_SRVW4_TT4_96_TLDS1_VAW2_WSGRA1_WSGRB1_WG64_4_1_WGM1
    SolutionIndex: 131
    SolutionNameMin: Cijk_Ailk_Bljk_HHS_BH_MT128x64x64_MI32x32x8x1_SE_1LDSB0_AF0EM1_EPS0_GRVW8_GSU1_GSUAMB_LBSPP128_LPB8_LRVW8_NLCA1_PGR2_PLR9_SU32_SUS256_SRVW4_TT2_32_TLDS1_VAW2_WSGRA1_WSGRB1_WG64_4_1_WGM15
    SolutionIndex: 132
    SolutionNameMin: Cijk_Ailk_Bljk_HHS_BH_MT64x128x32_MI32x32x8x1_SE_1LDSB0_AF0EM1_EPS0_GRVW4_GSU1_GSUAMB_LBSPP128_LPB8_LRVW8_NLCA1_PGR2_PLR5_SU0_SUS0_SRVW4_TT1_64_TLDS1_VAW2_WSGRA1_WSGRB1_WG64_4_1_WGM15
    SolutionIndex: 133
    SolutionNameMin: Cijk_Ailk_Bljk_HHS_BH_MT96x128x64_MI32x32x8x1_SE_1LDSB0_AF0EM1_EPS0_GRVW8_GSU1_GSUAMB_LBSPP128_LPB8_LRVW8_NLCA3_PGR2_PLR9_SU0_SUS0_SRVW0_TT3_32_TLDS1_VAW2_WSGRA1_WSGRB1_WG32_8_1_WGM1
    SolutionIndex: 134
    SolutionNameMin: Cijk_Ailk_Bljk_HHS_BH_MT128x64x64_MI32x32x8x1_SE_1LDSB0_AF0EM8_EPS1_GRVW8_GSU15_GSUAMB_LBSPP128_LPB8_LRVW8_NLCA1_PGR1_PLR9_SU32_SUS256_SRVW0_TT2_32_TLDS1_VAW1_WSGRA1_WSGRB1_WG64_4_1_WGM2
    SolutionIndex: 135
    SolutionNameMin: Cijk_Ailk_Bljk_HHS_BH_MT64x16x64_MI16x16x16x1_SE_1LDSB0_AF0EM8_EPS0_GRVW2_GSU1_GSUAMB_LBSPP128_LPB16_LRVW8_NLCA1_PGR2_PLR5_SU0_SUS0_SRVW0_TT1_16_TLDS1_VAW2_WSGRA1_WSGRB1_WG64_4_1_WGM1
    SolutionIndex: 136
    SolutionNameMin: Cijk_Ailk_Bljk_HHS_BH_MT128x64x64_MI32x32x8x1_SE_1LDSB0_AF0EM8_EPS1_GRVW8_GSU7_GSUAMB_LBSPP128_LPB8_LRVW8_NLCA1_PGR1_PLR9_SU0_SUS0_SRVW0_TT2_32_TLDS1_VAW1_WSGRA1_WSGRB1_WG64_4_1_WGM15
    SolutionIndex: 137
    SolutionNameMin: Cijk_Ailk_Bljk_HHS_BH_MT128x128x32_MI32x32x8x1_SE_1LDSB1_AF0EM8_EPS1_GRVW2_GSU1_GSUAMB_LBSPP128_LPB8_LRVW8_NLCA1_PGR1_PLR5_SU32_SUS128_SRVW4_TT2_64_TLDS1_VAW2_WSGRA1_WSGRB1_WG64_4_1_WGM2
    SolutionIndex: 138
    SolutionNameMin: Cijk_Ailk_Bljk_HHS_BH_MT64x32x32_MI16x16x16x1_SE_1LDSB1_AF0EM8_EPS1_GRVW2_GSU1_GSUAMB_LBSPP128_LPB16_LRVW8_NLCA1_PGR1_PLR2_SU0_SUS0_SRVW4_TT2_16_TLDS1_VAW2_WSGRA1_WSGRB1_WG32_8_1_WGM1
    SolutionIndex: 139
    SolutionNameMin: Cijk_Ailk_Bljk_HHS_BH_MT128x64x32_MI32x32x8x1_SE_1LDSB0_AF0EM8_EPS1_GRVW8_GSU1_GSUAMB_LBSPP128_LPB8_LRVW8_NLCA1_PGR1_PLR5_SU0_SUS0_SRVW4_TT2_32_TLDS1_VAW2_WSGRA1_WSGRB1_WG64_4_1_WGM2
    SolutionIndex: 140
    SolutionNameMin: Cijk_Ailk_Bljk_HHS_BH_MT128x64x32_MI32x32x8x1_SE_1LDSB0_AF0EM8_EPS1_GRVW8_GSU1_GSUAMB_LBSPP128_LPB8_LRVW8_NLCA1_PGR1_PLR5_SU0_SUS0_SRVW4_TT2_32_TLDS1_VAW2_WSGRA1_WSGRB1_WG64_4_1_WGM15
    SolutionIndex: 141
    SolutionNameMin: Cijk_Ailk_Bljk_HHS_BH_MT64x32x32_MI16x16x16x1_SE_1LDSB1_AF0EM8_EPS1_GRVW2_GSU1_GSUAMB_LBSPP128_LPB16_LRVW8_NLCA1_PGR1_PLR2_SU32_SUS256_SRVW4_TT2_16_TLDS1_VAW2_WSGRA1_WSGRB1_WG32_8_1_WGM1
    SolutionIndex: 142
    SolutionNameMin: Cijk_Ailk_Bljk_HHS_BH_MT128x128x32_MI32x32x8x1_SE_1LDSB1_AF0EM8_EPS1_GRVW2_GSU1_GSUAMB_LBSPP128_LPB8_LRVW8_NLCA1_PGR1_PLR5_SU0_SUS0_SRVW4_TT2_64_TLDS1_VAW2_WSGRA1_WSGRB1_WG64_4_1_WGM15
    SolutionIndex: 143
    SolutionNameMin: Cijk_Ailk_Bljk_HHS_BH_MT16x64x32_MI16x16x16x1_SE_1LDSB0_AF0EM8_EPS0_GRVW8_GSU1_GSUAMB_LBSPP128_LPB16_LRVW8_NLCA1_PGR2_PLR2_SU0_SUS0_SRVW0_TT1_16_TLDS1_VAW2_WSGRA1_WSGRB1_WG16_16_1_WGM1
    SolutionIndex: 144
    SolutionNameMin: Cijk_Ailk_Bljk_HHS_BH_MT32x32x32_MI16x16x16x1_SE_1LDSB0_AF0EM8_EPS1_GRVW8_GSU1_GSUAMB_LBSPP128_LPB16_LRVW8_NLCA1_PGR1_PLR2_SU0_SUS0_SRVW4_TT1_16_TLDS1_VAW2_WSGRA1_WSGRB1_WG32_8_1_WGM1
    SolutionIndex: 145
    SolutionNameMin: Cijk_Ailk_Bljk_HHS_BH_MT64x16x32_MI16x16x16x1_SE_1LDSB0_AF0EM8_EPS1_GRVW4_GSU1_GSUAMB_LBSPP128_LPB16_LRVW8_NLCA1_PGR1_PLR2_SU0_SUS0_SRVW0_TT1_16_TLDS1_VAW2_WSGRA1_WSGRB1_WG64_4_1_WGM1
    SolutionIndex: 146
    SolutionNameMin: Cijk_Ailk_Bljk_HHS_BH_MT64x64x32_MI32x32x8x1_SE_1LDSB0_AF0EM8_EPS0_GRVW2_GSU1_GSUAMB_LBSPP128_LPB8_LRVW8_NLCA1_PGR2_PLR5_SU0_SUS0_SRVW4_TT1_32_TLDS1_VAW2_WSGRA1_WSGRB1_WG64_4_1_WGM15
    SolutionIndex: 147
    SolutionNameMin: Cijk_Ailk_Bljk_HHS_BH_MT256x160x32_MI32x32x8x1_SE_1LDSB0_AF0EM8_EPS0_GRVW4_GSU1_GSUAMB_LBSPP128_LPB8_LRVW8_NLCA1_PGR2_PLR5_SU32_SUS256_SRVW4_TT2_160_TLDS1_VAW2_WSGRA1_WSGRB1_WG128_2_1_WGM15
    SolutionIndex: 148
    SolutionNameMin: Cijk_Ailk_Bljk_HHS_BH_MT256x160x32_MI32x32x8x1_SE_1LDSB0_AF0EM8_EPS0_GRVW4_GSU1_GSUAMB_LBSPP128_LPB8_LRVW8_NLCA1_PGR2_PLR5_SU32_SUS128_SRVW4_TT2_160_TLDS1_VAW2_WSGRA1_WSGRB1_WG128_2_1_WGM2
    SolutionIndex: 149
    SolutionNameMin: Cijk_Ailk_Bljk_HHS_BH_MT32x64x32_MI16x16x16x1_SE_1LDSB1_AF0EM8_EPS1_GRVW2_GSU1_GSUAMB_LBSPP128_LPB16_LRVW8_NLCA1_PGR1_PLR2_SU0_SUS0_SRVW4_TT1_32_TLDS1_VAW2_WSGRA1_WSGRB1_WG32_8_1_WGM1
    SolutionIndex: 150
    SolutionNameMin: Cijk_Ailk_Bljk_HHS_BH_MT64x4x32_MI4x4x4x16_SE_1LDSB0_AF0EM8_EPS1_GRVW4_GSU1_GSUAMB_LBSPP128_LPB8_LRVW8_NLCA1_PGR1_PLR9_SU0_SUS0_SRVW0_TT1_4_TLDS1_VAW2_WSGRA1_WSGRB1_WG64_1_1_WGM15
    SolutionIndex: 151
    SolutionNameMin: Cijk_Ailk_Bljk_HHS_BH_MT32x32x64_MI16x16x16x1_SE_1LDSB0_AF0EM1_EPS0_GRVW8_GSU1_GSUAMB_LBSPP128_LPB16_LRVW8_NLCA1_PGR2_PLR5_SU0_SUS0_SRVW4_TT1_16_TLDS1_VAW2_WSGRA1_WSGRB1_WG32_8_1_WGM2
    SolutionIndex: 152
    SolutionNameMin: Cijk_Ailk_Bljk_HHS_BH_MT32x32x64_MI16x16x16x1_SE_1LDSB0_AF0EM1_EPS0_GRVW8_GSU1_GSUAMB_LBSPP128_LPB16_LRVW8_NLCA1_PGR2_PLR5_SU0_SUS0_SRVW4_TT1_16_TLDS1_VAW2_WSGRA1_WSGRB1_WG32_8_1_WGM1
    SolutionIndex: 153
    SolutionNameMin: Cijk_Ailk_Bljk_HHS_BH_MT32x32x64_MI16x16x16x1_SE_1LDSB0_AF0EM1_EPS0_GRVW4_GSU1_GSUAMB_LBSPP128_LPB16_LRVW8_NLCA1_PGR2_PLR5_SU0_SUS0_SRVW4_TT1_16_TLDS1_VAW2_WSGRA1_WSGRB1_WG32_8_1_WGM1
    SolutionIndex: 154
    SolutionNameMin: Cijk_Ailk_Bljk_HHS_BH_MT64x32x32_MI16x16x16x1_SE_1LDSB1_AF0EM8_EPS1_GRVW2_GSU1_GSUAMB_LBSPP128_LPB16_LRVW8_NLCA1_PGR1_PLR2_SU0_SUS0_SRVW4_TT2_16_TLDS1_VAW2_WSGRA1_WSGRB1_WG32_8_1_WGM2
    SolutionIndex: 155
    SolutionNameMin: Cijk_Ailk_Bljk_HHS_BH_MT128x192x32_MI32x32x8x1_SE_1LDSB0_AF0EM8_EPS0_GRVW8_GSU1_GSUAMB_LBSPP128_LPB8_LRVW8_NLCA1_PGR2_PLR5_SU0_SUS0_SRVW4_TT2_96_TLDS1_VAW2_WSGRA1_WSGRB1_WG64_4_1_WGM2
    SolutionIndex: 156
    SolutionNameMin: Cijk_Ailk_Bljk_HHS_BH_MT128x192x32_MI32x32x8x1_SE_1LDSB0_AF0EM8_EPS0_GRVW4_GSU1_GSUAMB_LBSPP128_LPB8_LRVW8_NLCA1_PGR2_PLR5_SU0_SUS0_SRVW4_TT2_96_TLDS1_VAW2_WSGRA1_WSGRB1_WG64_4_1_WGM15
    SolutionIndex: 157
    SolutionNameMin: Cijk_Ailk_Bljk_HHS_BH_MT64x64x64_MI32x32x8x1_SE_1LDSB0_AF0EM1_EPS0_GRVW8_GSU1_GSUAMB_LBSPP128_LPB8_LRVW8_NLCA1_PGR2_PLR9_SU32_SUS128_SRVW4_TT1_32_TLDS1_VAW2_WSGRA1_WSGRB1_WG64_4_1_WGM2
    SolutionIndex: 158
    SolutionNameMin: Cijk_Ailk_Bljk_HHS_BH_MT96x96x64_MI16x16x16x1_SE_1LDSB0_AF0EM8_EPS0_GRVW8_GSU1_GSUAMB_LBSPP128_LPB16_LRVW8_NLCA3_PGR2_PLR5_SU0_SUS0_SRVW0_TT3_48_TLDS1_VAW2_WSGRA1_WSGRB1_WG32_8_1_WGM1
    SolutionIndex: 159
    SolutionNameMin: Cijk_Ailk_Bljk_HHS_BH_MT128x64x32_MI32x32x8x1_SE_1LDSB0_AF0EM8_EPS1_GRVW2_GSU1_GSUAMB_LBSPP128_LPB8_LRVW8_NLCA1_PGR1_PLR5_SU0_SUS0_SRVW4_TT2_32_TLDS1_VAW2_WSGRA1_WSGRB1_WG64_4_1_WGM1
    SolutionIndex: 160
    SolutionNameMin: Cijk_Ailk_Bljk_HHS_BH_MT128x192x32_MI32x32x8x1_SE_1LDSB0_AF0EM1_EPS0_GRVW8_GSU1_GSUAMB_LBSPP128_LPB8_LRVW8_NLCA1_PGR2_PLR5_SU0_SUS0_SRVW4_TT2_96_TLDS1_VAW2_WSGRA1_WSGRB1_WG64_4_1_WGM1
    SolutionIndex: 161
    SolutionNameMin: Cijk_Ailk_Bljk_HHS_BH_MT256x160x32_MI32x32x8x1_SE_1LDSB0_AF0EM8_EPS0_GRVW4_GSU3_GSUAMB_LBSPP128_LPB8_LRVW8_NLCA1_PGR2_PLR5_SU0_SUS0_SRVW4_TT2_160_TLDS1_VAW1_WSGRA1_WSGRB1_WG128_2_1_WGM15
    SolutionIndex: 162
    SolutionNameMin: Cijk_Ailk_Bljk_HHS_BH_MT256x160x32_MI32x32x8x1_SE_1LDSB0_AF0EM8_EPS0_GRVW4_GSU5_GSUAMB_LBSPP128_LPB8_LRVW8_NLCA1_PGR2_PLR5_SU0_SUS0_SRVW4_TT2_160_TLDS1_VAW1_WSGRA1_WSGRB1_WG128_2_1_WGM2
    SolutionIndex: 163
    SolutionNameMin: Cijk_Ailk_Bljk_HHS_BH_MT256x192x32_MI32x32x8x1_SE_1LDSB0_AF0EM8_EPS0_GRVW8_GSU1_GSUAMB_LBSPP128_LPB8_LRVW8_NLCA1_PGR2_PLR5_SU32_SUS256_SRVW4_TT4_96_TLDS1_VAW2_WSGRA1_WSGRB1_WG64_4_1_WGM15
    SolutionIndex: 164
    SolutionNameMin: Cijk_Ailk_Bljk_HHS_BH_MT64x64x32_MI32x32x8x1_SE_1LDSB0_AF0EM1_EPS0_GRVW2_GSU1_GSUAMB_LBSPP128_LPB8_LRVW8_NLCA1_PGR2_PLR5_SU32_SUS256_SRVW4_TT1_32_TLDS1_VAW2_WSGRA1_WSGRB1_WG64_4_1_WGM15
    SolutionIndex: 165
    SolutionNameMin: Cijk_Ailk_Bljk_HHS_BH_MT64x32x32_MI16x16x16x1_SE_1LDSB0_AF0EM1_EPS0_GRVW2_GSU1_GSUAMB_LBSPP128_LPB16_LRVW8_NLCA1_PGR2_PLR2_SU0_SUS0_SRVW4_TT2_16_TLDS1_VAW2_WSGRA1_WSGRB1_WG32_8_1_WGM1
    SolutionIndex: 166
    SolutionNameMin: Cijk_Ailk_Bljk_HHS_BH_MT64x32x32_MI16x16x16x1_SE_1LDSB1_AF0EM1_EPS1_GRVW2_GSU1_GSUAMB_LBSPP128_LPB16_LRVW8_NLCA1_PGR1_PLR2_SU0_SUS0_SRVW4_TT2_16_TLDS1_VAW2_WSGRA1_WSGRB1_WG32_8_1_WGM15
    SolutionIndex: 167
    SolutionNameMin: Cijk_Ailk_Bljk_HHS_BH_MT128x64x32_MI32x32x8x1_SE_1LDSB0_AF0EM1_EPS0_GRVW4_GSU1_GSUAMB_LBSPP128_LPB8_LRVW8_NLCA1_PGR2_PLR5_SU0_SUS0_SRVW4_TT2_32_TLDS1_VAW2_WSGRA1_WSGRB1_WG64_4_1_WGM1
    SolutionIndex: 168
    SolutionNameMin: Cijk_Ailk_Bljk_HHS_BH_MT64x128x32_MI32x32x8x1_SE_1LDSB0_AF0EM1_EPS0_GRVW4_GSU1_GSUAMB_LBSPP128_LPB8_LRVW8_NLCA1_PGR2_PLR5_SU0_SUS0_SRVW4_TT1_64_TLDS1_VAW2_WSGRA1_WSGRB1_WG64_4_1_WGM2
    SolutionIndex: 169
    SolutionNameMin: Cijk_Ailk_Bljk_HHS_BH_MT128x96x32_MI32x32x8x1_SE_1LDSB1_AF0EM1_EPS1_GRVW2_GSU1_GSUAMB_LBSPP128_LPB8_LRVW8_NLCA1_PGR1_PLR5_SU0_SUS0_SRVW4_TT1_96_TLDS1_VAW2_WSGRA1_WSGRB1_WG128_2_1_WGM15
    SolutionIndex: 170
    SolutionNameMin: Cijk_Ailk_Bljk_HHS_BH_MT64x192x64_MI32x32x8x1_SE_1LDSB1_AF0EM8_EPS1_GRVW2_GSU1_GSUAMB_LBSPP128_LPB8_LRVW8_NLCA1_PGR1_PLR9_SU0_SUS0_SRVW4_TT1_96_TLDS1_VAW2_WSGRA1_WSGRB1_WG64_4_1_WGM2
    SolutionIndex: 171
    SolutionNameMin: Cijk_Ailk_Bljk_HHS_BH_MT128x96x32_MI32x32x8x1_SE_1LDSB0_AF0EM1_EPS1_GRVW4_GSU1_GSUAMB_LBSPP128_LPB8_LRVW8_NLCA1_PGR1_PLR5_SU0_SUS0_SRVW4_TT1_96_TLDS1_VAW2_WSGRA1_WSGRB1_WG128_2_1_WGM1
    SolutionIndex: 172
    SolutionNameMin: Cijk_Ailk_Bljk_HHS_BH_MT128x96x32_MI32x32x8x1_SE_1LDSB0_AF0EM1_EPS1_GRVW4_GSU1_GSUAMB_LBSPP128_LPB8_LRVW8_NLCA1_PGR1_PLR5_SU0_SUS0_SRVW4_TT1_96_TLDS1_VAW2_WSGRA1_WSGRB1_WG128_2_1_WGM2
    SolutionIndex: 173
    SolutionNameMin: Cijk_Ailk_Bljk_HHS_BH_MT64x128x32_MI32x32x8x1_SE_1LDSB0_AF0EM1_EPS0_GRVW2_GSU1_GSUAMB_LBSPP128_LPB8_LRVW8_NLCA1_PGR2_PLR5_SU0_SUS0_SRVW4_TT1_64_TLDS1_VAW2_WSGRA1_WSGRB1_WG64_4_1_WGM15
    SolutionIndex: 174
    SolutionNameMin: Cijk_Ailk_Bljk_HHS_BH_MT32x64x64_MI16x16x16x1_SE_1LDSB0_AF0EM1_EPS0_GRVW4_GSU1_GSUAMB_LBSPP128_LPB16_LRVW8_NLCA1_PGR2_PLR5_SU0_SUS0_SRVW4_TT1_32_TLDS1_VAW2_WSGRA1_WSGRB1_WG32_8_1_WGM1
    SolutionIndex: 175
    SolutionNameMin: Cijk_Ailk_Bljk_HHS_BH_MT128x128x32_MI32x32x8x1_SE_1LDSB1_AF0EM1_EPS1_GRVW2_GSU1_GSUAMB_LBSPP128_LPB8_LRVW8_NLCA1_PGR1_PLR5_SU0_SUS0_SRVW4_TT2_64_TLDS1_VAW2_WSGRA1_WSGRB1_WG64_4_1_WGM1
    SolutionIndex: 176
    SolutionNameMin: Cijk_Ailk_Bljk_HHS_BH_MT128x96x32_MI32x32x8x1_SE_1LDSB1_AF0EM1_EPS1_GRVW2_GSU1_GSUAMB_LBSPP128_LPB8_LRVW8_NLCA1_PGR1_PLR5_SU0_SUS0_SRVW4_TT1_96_TLDS1_VAW2_WSGRA1_WSGRB1_WG128_2_1_WGM2
    SolutionIndex: 177
    SolutionNameMin: Cijk_Ailk_Bljk_HHS_BH_MT64x128x64_MI32x32x8x1_SE_1LDSB0_AF0EM1_EPS0_GRVW8_GSU1_GSUAMB_LBSPP128_LPB8_LRVW8_NLCA1_PGR2_PLR9_SU0_SUS0_SRVW4_TT1_64_TLDS1_VAW2_WSGRA1_WSGRB1_WG64_4_1_WGM15
    SolutionIndex: 178
    SolutionNameMin: Cijk_Ailk_Bljk_HHS_BH_MT128x128x32_MI32x32x8x1_SE_1LDSB1_AF0EM8_EPS1_GRVW2_GSU1_GSUAMB_LBSPP128_LPB8_LRVW8_NLCA1_PGR1_PLR5_SU32_SUS256_SRVW4_TT2_64_TLDS1_VAW2_WSGRA1_WSGRB1_WG64_4_1_WGM15
    SolutionIndex: 179
    SolutionNameMin: Cijk_Ailk_Bljk_HHS_BH_MT128x128x32_MI32x32x8x1_SE_1LDSB1_AF0EM8_EPS1_GRVW2_GSU1_GSUAMB_LBSPP128_LPB8_LRVW8_NLCA1_PGR1_PLR5_SU32_SUS256_SRVW4_TT2_64_TLDS1_VAW2_WSGRA1_WSGRB1_WG64_4_1_WGM2
    SolutionIndex: 180
    SolutionNameMin: Cijk_Ailk_Bljk_HHS_BH_MT128x64x32_MI32x32x8x1_SE_1LDSB0_AF0EM1_EPS0_GRVW2_GSU1_GSUAMB_LBSPP128_LPB8_LRVW8_NLCA1_PGR2_PLR5_SU0_SUS0_SRVW4_TT2_32_TLDS1_VAW2_WSGRA1_WSGRB1_WG64_4_1_WGM15
    SolutionIndex: 181
    SolutionNameMin: Cijk_Ailk_Bljk_HHS_BH_MT64x128x32_MI32x32x8x1_SE_1LDSB0_AF0EM1_EPS0_GRVW4_GSU1_GSUAMB_LBSPP128_LPB8_LRVW8_NLCA1_PGR2_PLR5_SU32_SUS128_SRVW4_TT1_64_TLDS1_VAW2_WSGRA1_WSGRB1_WG64_4_1_WGM1
    SolutionIndex: 182
    SolutionNameMin: Cijk_Ailk_Bljk_HHS_BH_MT128x256x32_MI32x32x8x1_SE_1LDSB1_AF0EM1_EPS0_GRVW8_GSU1_GSUAMB_LBSPP128_LPB8_LRVW8_NLCA1_PGR2_PLR5_SU0_SUS0_SRVW4_TT2_128_TLDS1_VAW2_WSGRA1_WSGRB1_WG64_4_1_WGM2
    SolutionIndex: 183
    SolutionNameMin: Cijk_Ailk_Bljk_HHS_BH_MT128x96x64_MI32x32x8x1_SE_1LDSB0_AF0EM8_EPS0_GRVW8_GSU15_GSUAMB_LBSPP128_LPB8_LRVW8_NLCA1_PGR2_PLR9_SU0_SUS0_SRVW4_TT1_96_TLDS1_VAW1_WSGRA1_WSGRB1_WG128_2_1_WGM15
    SolutionIndex: 184
    SolutionNameMin: Cijk_Ailk_Bljk_HHS_BH_MT128x128x32_MI32x32x8x1_SE_1LDSB0_AF0EM1_EPS0_GRVW8_GSU5_GSUAMB_LBSPP128_LPB8_LRVW8_NLCA1_PGR2_PLR5_SU0_SUS0_SRVW4_TT2_64_TLDS1_VAW1_WSGRA1_WSGRB1_WG64_4_1_WGM2
    SolutionIndex: 185
    SolutionNameMin: Cijk_Ailk_Bljk_HHS_BH_MT128x96x64_MI32x32x8x1_SE_1LDSB0_AF0EM8_EPS1_GRVW8_GSU3_GSUAMB_LBSPP128_LPB8_LRVW8_NLCA1_PGR1_PLR9_SU0_SUS0_SRVW0_TT1_96_TLDS1_VAW1_WSGRA1_WSGRB1_WG128_2_1_WGM2
    SolutionIndex: 186
    SolutionNameMin: Cijk_Ailk_Bljk_HHS_BH_MT128x96x64_MI32x32x8x1_SE_1LDSB0_AF0EM8_EPS1_GRVW8_GSU5_GSUAMB_LBSPP128_LPB8_LRVW8_NLCA1_PGR1_PLR9_SU0_SUS0_SRVW0_TT1_96_TLDS1_VAW1_WSGRA1_WSGRB1_WG128_2_1_WGM1
    SolutionIndex: 187
    SolutionNameMin: Cijk_Ailk_Bljk_HHS_BH_MT128x128x32_MI32x32x8x1_SE_1LDSB1_AF0EM1_EPS1_GRVW2_GSU1_GSUAMB_LBSPP128_LPB8_LRVW8_NLCA1_PGR1_PLR5_SU32_SUS256_SRVW4_TT2_64_TLDS1_VAW2_WSGRA1_WSGRB1_WG64_4_1_WGM2
    SolutionIndex: 188
    SolutionNameMin: Cijk_Ailk_Bljk_HHS_BH_MT256x160x32_MI32x32x8x1_SE_1LDSB0_AF0EM8_EPS0_GRVW4_GSU5_GSUAMB_LBSPP128_LPB8_LRVW8_NLCA1_PGR2_PLR5_SU0_SUS0_SRVW4_TT2_160_TLDS1_VAW1_WSGRA1_WSGRB1_WG128_2_1_WGM1
    SolutionIndex: 189
    SolutionNameMin: Cijk_Ailk_Bljk_HHS_BH_MT16x64x32_MI16x16x16x1_SE_1LDSB0_AF0EM8_EPS1_GRVW2_GSU1_GSUAMB_LBSPP128_LPB16_LRVW8_NLCA1_PGR1_PLR2_SU0_SUS0_SRVW0_TT1_16_TLDS1_VAW2_WSGRA1_WSGRB1_WG16_16_1_WGM1
    SolutionIndex: 190
    SolutionNameMin: Cijk_Ailk_Bljk_HHS_BH_MT160x128x32_MI32x32x8x1_SE_1LDSB0_AF0EM8_EPS0_GRVW4_GSU1_GSUAMB_LBSPP128_LPB8_LRVW8_NLCA5_PGR2_PLR5_SU0_SUS0_SRVW0_TT5_32_TLDS1_VAW2_WSGRA1_WSGRB1_WG32_8_1_WGM1
    SolutionIndex: 191
    SolutionNameMin: Cijk_Ailk_Bljk_HHS_BH_MT256x128x32_MI32x32x8x1_SE_1LDSB0_AF0EM8_EPS0_GRVW4_GSU2_GSUAMB_LBSPP128_LPB8_LRVW8_NLCA1_PGR2_PLR5_SU0_SUS0_SRVW0_TT4_64_TLDS1_VAW1_WSGRA1_WSGRB1_WG64_4_1_WGM2
    SolutionIndex: 192
    SolutionNameMin: Cijk_Ailk_Bljk_HHS_BH_MT256x128x32_MI32x32x8x1_SE_1LDSB0_AF0EM8_EPS0_GRVW4_GSU3_GSUAMB_LBSPP128_LPB8_LRVW8_NLCA1_PGR2_PLR5_SU0_SUS0_SRVW0_TT4_64_TLDS1_VAW1_WSGRA1_WSGRB1_WG64_4_1_WGM15
    SolutionIndex: 193
    SolutionNameMin: Cijk_Ailk_Bljk_HHS_BH_MT64x128x64_MI32x32x8x1_SE_1LDSB0_AF0EM8_EPS0_GRVW8_GSU1_GSUAMB_LBSPP128_LPB8_LRVW8_NLCA1_PGR2_PLR9_SU32_SUS128_SRVW4_TT1_64_TLDS1_VAW2_WSGRA1_WSGRB1_WG64_4_1_WGM2
    SolutionIndex: 194
    SolutionNameMin: Cijk_Ailk_Bljk_HHS_BH_MT64x128x64_MI32x32x8x1_SE_1LDSB0_AF0EM8_EPS0_GRVW8_GSU1_GSUAMB_LBSPP128_LPB8_LRVW8_NLCA1_PGR2_PLR9_SU32_SUS256_SRVW4_TT1_64_TLDS1_VAW2_WSGRA1_WSGRB1_WG64_4_1_WGM1
    SolutionIndex: 195
    SolutionNameMin: Cijk_Ailk_Bljk_HHS_BH_MT256x128x32_MI32x32x8x1_SE_1LDSB0_AF0EM8_EPS1_GRVW8_GSU1_GSUAMB_LBSPP128_LPB8_LRVW8_NLCA1_PGR1_PLR5_SU32_SUS128_SRVW4_TT4_64_TLDS1_VAW2_WSGRA1_WSGRB1_WG64_4_1_WGM1
    SolutionIndex: 196
    SolutionNameMin: Cijk_Ailk_Bljk_HHS_BH_MT64x128x32_MI32x32x8x1_SE_1LDSB0_AF0EM8_EPS0_GRVW4_GSU1_GSUAMB_LBSPP128_LPB8_LRVW8_NLCA1_PGR2_PLR5_SU0_SUS0_SRVW4_TT1_64_TLDS1_VAW2_WSGRA1_WSGRB1_WG64_4_1_WGM1
    SolutionIndex: 197
    SolutionNameMin: Cijk_Ailk_Bljk_HHS_BH_MT128x96x64_MI32x32x8x1_SE_1LDSB0_AF0EM8_EPS1_GRVW8_GSU5_GSUAMB_LBSPP128_LPB8_LRVW8_NLCA1_PGR1_PLR9_SU0_SUS0_SRVW0_TT1_96_TLDS1_VAW1_WSGRA1_WSGRB1_WG128_2_1_WGM2
    SolutionIndex: 198
    SolutionNameMin: Cijk_Ailk_Bljk_HHS_BH_MT96x128x64_MI32x32x8x1_SE_1LDSB0_AF0EM8_EPS1_GRVW8_GSU5_GSUAMB_LBSPP128_LPB8_LRVW8_NLCA3_PGR1_PLR9_SU32_SUS256_SRVW0_TT3_32_TLDS1_VAW1_WSGRA1_WSGRB1_WG32_8_1_WGM15
    SolutionIndex: 199
    SolutionNameMin: Cijk_Ailk_Bljk_HHS_BH_MT128x64x32_MI32x32x8x1_SE_1LDSB0_AF0EM8_EPS0_GRVW4_GSU1_GSUAMB_LBSPP128_LPB8_LRVW8_NLCA1_PGR2_PLR5_SU0_SUS0_SRVW4_TT2_32_TLDS1_VAW2_WSGRA1_WSGRB1_WG64_4_1_WGM15
    SolutionIndex: 200
    SolutionNameMin: Cijk_Ailk_Bljk_HHS_BH_MT128x256x32_MI32x32x8x1_SE_1LDSB1_AF0EM8_EPS1_GRVW8_GSU1_GSUAMB_LBSPP128_LPB8_LRVW8_NLCA1_PGR1_PLR5_SU32_SUS128_SRVW4_TT2_128_TLDS1_VAW2_WSGRA1_WSGRB1_WG64_4_1_WGM15
    SolutionIndex: 201
    SolutionNameMin: Cijk_Ailk_Bljk_HHS_BH_MT128x256x32_MI32x32x8x1_SE_1LDSB1_AF0EM8_EPS0_GRVW8_GSU1_GSUAMB_LBSPP128_LPB8_LRVW8_NLCA1_PGR2_PLR5_SU32_SUS128_SRVW4_TT2_128_TLDS1_VAW2_WSGRA1_WSGRB1_WG64_4_1_WGM15
    SolutionIndex: 202
    SolutionNameMin: Cijk_Ailk_Bljk_HHS_BH_MT128x96x64_MI32x32x8x1_SE_1LDSB0_AF0EM8_EPS0_GRVW4_GSU1_GSUAMB_LBSPP128_LPB8_LRVW8_NLCA1_PGR2_PLR9_SU32_SUS256_SRVW4_TT1_96_TLDS1_VAW2_WSGRA1_WSGRB1_WG128_2_1_WGM2
    SolutionIndex: 203
    SolutionNameMin: Cijk_Ailk_Bljk_HHS_BH_MT128x128x32_MI32x32x8x1_SE_1LDSB1_AF0EM1_EPS1_GRVW2_GSU1_GSUAMB_LBSPP128_LPB8_LRVW8_NLCA1_PGR1_PLR5_SU32_SUS128_SRVW4_TT2_64_TLDS1_VAW2_WSGRA1_WSGRB1_WG64_4_1_WGM1
    SolutionIndex: 204
    SolutionNameMin: Cijk_Ailk_Bljk_HHS_BH_MT64x128x32_MI32x32x8x1_SE_1LDSB0_AF0EM8_EPS0_GRVW2_GSU1_GSUAMB_LBSPP128_LPB8_LRVW8_NLCA1_PGR2_PLR5_SU0_SUS0_SRVW4_TT1_64_TLDS1_VAW2_WSGRA1_WSGRB1_WG64_4_1_WGM1
    SolutionIndex: 205
    SolutionNameMin: Cijk_Ailk_Bljk_HHS_BH_MT128x128x32_MI32x32x8x1_SE_1LDSB1_AF0EM1_EPS1_GRVW2_GSU1_GSUAMB_LBSPP128_LPB8_LRVW8_NLCA1_PGR1_PLR5_SU0_SUS0_SRVW4_TT2_64_TLDS1_VAW2_WSGRA1_WSGRB1_WG64_4_1_WGM2
    SolutionIndex: 206
    SolutionNameMin: Cijk_Ailk_Bljk_HHS_BH_MT128x256x32_MI32x32x8x1_SE_1LDSB0_AF0EM1_EPS0_GRVW8_GSU1_GSUAMB_LBSPP128_LPB8_LRVW8_NLCA1_PGR2_PLR5_SU0_SUS0_SRVW4_TT2_128_TLDS1_VAW2_WSGRA1_WSGRB1_WG64_4_1_WGM15
    SolutionIndex: 207
    SolutionNameMin: Cijk_Ailk_Bljk_HHS_BH_MT32x32x64_MI16x16x16x1_SE_1LDSB0_AF0EM1_EPS0_GRVW8_GSU1_GSUAMB_LBSPP128_LPB16_LRVW8_NLCA1_PGR2_PLR5_SU0_SUS0_SRVW4_TT1_16_TLDS1_VAW2_WSGRA1_WSGRB1_WG32_8_1_WGM15
    SolutionIndex: 208
    SolutionNameMin: Cijk_Ailk_Bljk_HHS_BH_MT32x64x64_MI16x16x16x1_SE_1LDSB0_AF0EM1_EPS0_GRVW8_GSU7_GSUAMB_LBSPP128_LPB16_LRVW8_NLCA1_PGR2_PLR5_SU32_SUS128_SRVW4_TT1_32_TLDS1_VAW1_WSGRA1_WSGRB1_WG32_8_1_WGM15
    SolutionIndex: 209
    SolutionNameMin: Cijk_Ailk_Bljk_HHS_BH_MT128x256x32_MI32x32x8x1_SE_1LDSB1_AF0EM1_EPS0_GRVW8_GSU1_GSUAMB_LBSPP128_LPB8_LRVW8_NLCA1_PGR2_PLR5_SU0_SUS0_SRVW4_TT2_128_TLDS1_VAW2_WSGRA1_WSGRB1_WG64_4_1_WGM15
    SolutionIndex: 210
    SolutionNameMin: Cijk_Ailk_Bljk_HHS_BH_MT128x256x32_MI32x32x8x1_SE_1LDSB1_AF0EM8_EPS1_GRVW8_GSU1_GSUAMB_LBSPP128_LPB8_LRVW8_NLCA1_PGR1_PLR5_SU32_SUS256_SRVW4_TT2_128_TLDS1_VAW2_WSGRA1_WSGRB1_WG64_4_1_WGM2
    SolutionIndex: 211
    SolutionNameMin: Cijk_Ailk_Bljk_HHS_BH_MT128x256x32_MI32x32x8x1_SE_1LDSB1_AF0EM8_EPS1_GRVW8_GSU1_GSUAMB_LBSPP128_LPB8_LRVW8_NLCA1_PGR1_PLR5_SU32_SUS256_SRVW4_TT2_128_TLDS1_VAW2_WSGRA1_WSGRB1_WG64_4_1_WGM15
    SolutionIndex: 212
    SolutionNameMin: Cijk_Ailk_Bljk_HHS_BH_MT64x4x32_MI4x4x4x16_SE_1LDSB0_AF0EM8_EPS0_GRVW8_GSU1_GSUAMB_LBSPP128_LPB8_LRVW8_NLCA1_PGR2_PLR9_SU0_SUS0_SRVW0_TT1_4_TLDS1_VAW2_WSGRA1_WSGRB1_WG64_1_1_WGM1
    SolutionIndex: 213
    SolutionNameMin: Cijk_Ailk_Bljk_HHS_BH_MT64x32x32_MI16x16x16x1_SE_1LDSB0_AF0EM8_EPS1_GRVW2_GSU1_GSUAMB_LBSPP128_LPB16_LRVW8_NLCA1_PGR1_PLR2_SU0_SUS0_SRVW4_TT2_16_TLDS1_VAW2_WSGRA1_WSGRB1_WG32_8_1_WGM1
    SolutionIndex: 214
    SolutionNameMin: Cijk_Ailk_Bljk_HHS_BH_MT64x4x32_MI4x4x4x16_SE_1LDSB0_AF0EM8_EPS1_GRVW4_GSU1_GSUAMB_LBSPP128_LPB8_LRVW8_NLCA1_PGR1_PLR9_SU0_SUS0_SRVW0_TT1_4_TLDS1_VAW2_WSGRA1_WSGRB1_WG64_1_1_WGM1
    SolutionIndex: 215
    SolutionNameMin: Cijk_Ailk_Bljk_HHS_BH_MT128x256x32_MI32x32x8x1_SE_1LDSB1_AF0EM8_EPS0_GRVW8_GSU1_GSUAMB_LBSPP128_LPB8_LRVW8_NLCA1_PGR2_PLR5_SU32_SUS128_SRVW4_TT2_128_TLDS1_VAW2_WSGRA1_WSGRB1_WG64_4_1_WGM2
    SolutionIndex: 216
    SolutionNameMin: Cijk_Ailk_Bljk_HHS_BH_MT128x256x32_MI32x32x8x1_SE_1LDSB1_AF0EM8_EPS1_GRVW8_GSU1_GSUAMB_LBSPP128_LPB8_LRVW8_NLCA1_PGR1_PLR5_SU0_SUS0_SRVW4_TT2_128_TLDS1_VAW2_WSGRA1_WSGRB1_WG64_4_1_WGM15
    SolutionIndex: 217
    SolutionNameMin: Cijk_Ailk_Bljk_HHS_BH_MT128x256x32_MI32x32x8x1_SE_1LDSB1_AF0EM8_EPS1_GRVW8_GSU1_GSUAMB_LBSPP128_LPB8_LRVW8_NLCA1_PGR1_PLR5_SU32_SUS256_SRVW4_TT2_128_TLDS1_VAW2_WSGRA1_WSGRB1_WG64_4_1_WGM1
    SolutionIndex: 218
    SolutionNameMin: Cijk_Ailk_Bljk_HHS_BH_MT96x96x64_MI16x16x16x1_SE_1LDSB0_AF0EM1_EPS0_GRVW8_GSU1_GSUAMB_LBSPP128_LPB16_LRVW8_NLCA3_PGR2_PLR5_SU0_SUS0_SRVW0_TT3_48_TLDS1_VAW2_WSGRA1_WSGRB1_WG32_8_1_WGM1
    SolutionIndex: 219
    SolutionNameMin: Cijk_Ailk_Bljk_HHS_BH_MT64x128x64_MI32x32x8x1_SE_1LDSB0_AF0EM1_EPS0_GRVW8_GSU1_GSUAMB_LBSPP128_LPB8_LRVW8_NLCA1_PGR2_PLR9_SU0_SUS0_SRVW4_TT1_64_TLDS1_VAW2_WSGRA1_WSGRB1_WG64_4_1_WGM2
    SolutionIndex: 220
    SolutionNameMin: Cijk_Ailk_Bljk_HHS_BH_MT32x32x64_MI16x16x16x1_SE_1LDSB0_AF0EM1_EPS0_GRVW4_GSU1_GSUAMB_LBSPP128_LPB16_LRVW8_NLCA1_PGR2_PLR5_SU0_SUS0_SRVW4_TT1_16_TLDS1_VAW2_WSGRA1_WSGRB1_WG32_8_1_WGM2
    SolutionIndex: 221
    SolutionNameMin: Cijk_Ailk_Bljk_HHS_BH_MT32x32x32_MI16x16x16x1_SE_1LDSB0_AF0EM1_EPS0_GRVW8_GSU1_GSUAMB_LBSPP128_LPB16_LRVW8_NLCA1_PGR2_PLR2_SU0_SUS0_SRVW4_TT1_16_TLDS1_VAW2_WSGRA1_WSGRB1_WG32_8_1_WGM1
    SolutionIndex: 222
    SolutionNameMin: Cijk_Ailk_Bljk_HHS_BH_MT64x64x64_MI32x32x8x1_SE_1LDSB0_AF0EM1_EPS0_GRVW8_GSU1_GSUAMB_LBSPP128_LPB8_LRVW8_NLCA1_PGR2_PLR9_SU0_SUS0_SRVW4_TT1_32_TLDS1_VAW2_WSGRA1_WSGRB1_WG64_4_1_WGM15
    SolutionIndex: 223
    SolutionNameMin: Cijk_Ailk_Bljk_HHS_BH_MT32x64x64_MI16x16x16x1_SE_1LDSB0_AF0EM1_EPS0_GRVW8_GSU1_GSUAMB_LBSPP128_LPB16_LRVW8_NLCA1_PGR2_PLR5_SU32_SUS256_SRVW4_TT1_32_TLDS1_VAW2_WSGRA1_WSGRB1_WG32_8_1_WGM15
    SolutionIndex: 224
    SolutionNameMin: Cijk_Ailk_Bljk_HHS_BH_MT128x128x32_MI32x32x8x1_SE_1LDSB1_AF0EM1_EPS1_GRVW2_GSU1_GSUAMB_LBSPP128_LPB8_LRVW8_NLCA1_PGR1_PLR5_SU32_SUS256_SRVW4_TT2_64_TLDS1_VAW2_WSGRA1_WSGRB1_WG64_4_1_WGM15
    SolutionIndex: 225
    SolutionNameMin: Cijk_Ailk_Bljk_HHS_BH_MT128x128x32_MI32x32x8x1_SE_1LDSB1_AF0EM1_EPS1_GRVW2_GSU1_GSUAMB_LBSPP128_LPB8_LRVW8_NLCA1_PGR1_PLR5_SU0_SUS0_SRVW4_TT2_64_TLDS1_VAW2_WSGRA1_WSGRB1_WG64_4_1_WGM15
    SolutionIndex: 226
    SolutionNameMin: Cijk_Ailk_Bljk_HHS_BH_MT32x64x32_MI16x16x16x1_SE_1LDSB0_AF0EM1_EPS0_GRVW2_GSU1_GSUAMB_LBSPP128_LPB16_LRVW8_NLCA1_PGR2_PLR2_SU0_SUS0_SRVW4_TT1_32_TLDS1_VAW2_WSGRA1_WSGRB1_WG32_8_1_WGM1
    SolutionIndex: 227
    SolutionNameMin: Cijk_Ailk_Bljk_HHS_BH_MT32x32x32_MI16x16x16x1_SE_1LDSB0_AF0EM1_EPS0_GRVW4_GSU1_GSUAMB_LBSPP128_LPB16_LRVW8_NLCA1_PGR2_PLR2_SU0_SUS0_SRVW4_TT1_16_TLDS1_VAW2_WSGRA1_WSGRB1_WG32_8_1_WGM15
    SolutionIndex: 228
    SolutionNameMin: Cijk_Ailk_Bljk_HHS_BH_MT32x64x32_MI16x16x16x1_SE_1LDSB1_AF0EM1_EPS1_GRVW2_GSU1_GSUAMB_LBSPP128_LPB16_LRVW8_NLCA1_PGR1_PLR2_SU32_SUS128_SRVW4_TT1_32_TLDS1_VAW2_WSGRA1_WSGRB1_WG32_8_1_WGM1
    SolutionIndex: 229
    SolutionNameMin: Cijk_Ailk_Bljk_HBH_MT4x16x64_SN_LDL4_PGR0
    SolutionIndex: 230
    SolutionNameMin: Cijk_Ailk_Bljk_HBH_MT4x16x64_SN_LDL1_PGR0
    SolutionIndex: 231
    SolutionNameMin: Cijk_Ailk_Bljk_HBH_MT4x16x64_SN_ETSP_LDL4_PGR0
- - - [1024, 1024, 1, 3328]
    - [4, 56.086]
  - - [2944, 4288, 1, 1280]
    - [5, 70.453]
  - - [2368, 64, 1, 3328]
    - [6, 16.098]
  - - [2368, 5888, 1, 256]
    - [7, 45.134]
  - - [256, 704, 1, 1280]
    - [8, 12.495]
  - - [128, 6784, 1, 3328]
    - [9, 59.741]
  - - [5888, 1856, 1, 3328]
    - [10, 77.137]
  - - [5888, 2944, 1, 3328]
    - [11, 85.689]
  - - [1856, 4288, 1, 256]
    - [12, 38.067]
  - - [5056, 5056, 1, 3328]
    - [13, 84.672]
  - - [1408, 5888, 1, 1280]
    - [14, 65.618]
  - - [1024, 3584, 1, 3328]
    - [4, 73.547]
  - - [448, 3584, 1, 3328]
    - [15, 64.114]
  - - [256, 4288, 1, 3328]
    - [4, 58.883]
  - - [5888, 1408, 1, 1280]
    - [16, 67.241]
  - - [704, 1856, 1, 3328]
    - [17, 56.183]
  - - [1024, 2368, 1, 256]
    - [5, 27.213]
  - - [5056, 6784, 1, 1280]
    - [18, 81.023]
  - - [1408, 64, 1, 1280]
    - [19, 7.384]
  - - [448, 1024, 1, 1280]
    - [20, 23.46]
  - - [5056, 5056, 1, 1280]
    - [21, 75.682]
  - - [4288, 6784, 1, 256]
    - [7, 50.665]
  - - [6784, 448, 1, 256]
    - [22, 27.056]
  - - [5056, 256, 1, 1280]
    - [23, 41.946]
  - - [5888, 704, 1, 1280]
    - [22, 59.011]
  - - [3584, 1024, 1, 256]
    - [7, 30.33]
  - - [6784, 4288, 1, 3328]
    - [10, 84.5]
  - - [1856, 2368, 1, 3328]
    - [24, 68.549]
  - - [5888, 2944, 1, 1280]
    - [21, 74.643]
  - - [5888, 1024, 1, 256]
    - [25, 35.49]
  - - [448, 64, 1, 1280]
    - [19, 2.349]
  - - [1024, 704, 1, 256]
    - [26, 13.243]
  - - [1408, 2944, 1, 256]
    - [22, 30.115]
  - - [256, 1856, 1, 1280]
    - [20, 22.764]
  - - [6784, 5056, 1, 3328]
    - [27, 88.628]
  - - [5056, 5056, 1, 256]
    - [7, 49.219]
  - - [256, 2944, 1, 3328]
    - [20, 54.239]
  - - [64, 1024, 1, 1280]
    - [28, 5.222]
  - - [1024, 3584, 1, 1280]
    - [5, 61.829]
  - - [2368, 2944, 1, 1280]
    - [29, 67.474]
  - - [128, 3584, 1, 1280]
    - [15, 22.426]
  - - [6784, 6784, 1, 1280]
    - [21, 79.428]
  - - [1024, 256, 1, 3328]
    - [30, 25.464]
  - - [1408, 4288, 1, 1280]
    - [5, 65.073]
  - - [3584, 4288, 1, 1280]
    - [14, 73.581]
  - - [2368, 704, 1, 1280]
    - [22, 52.721]
  - - [5056, 4288, 1, 3328]
    - [13, 85.46]
  - - [3584, 2368, 1, 3328]
    - [31, 80.075]
  - - [5888, 6784, 1, 1280]
    - [21, 79.279]
  - - [64, 704, 1, 1280]
    - [32, 3.692]
  - - [4288, 256, 1, 256]
    - [22, 16.237]
  - - [6784, 448, 1, 1280]
    - [33, 55.062]
  - - [2944, 5888, 1, 256]
    - [7, 47.033]
  - - [256, 128, 1, 256]
    - [32, 0.822]
  - - [4288, 2944, 1, 256]
    - [25, 44.08]
  - - [5888, 64, 1, 3328]
    - [34, 35.148]
  - - [2944, 256, 1, 3328]
    - [9, 54.239]
  - - [5056, 2368, 1, 1280]
    - [35, 70.272]
  - - [448, 3584, 1, 1280]
    - [15, 47.94]
  - - [6784, 5888, 1, 256]
    - [36, 51.709]
  - - [64, 1024, 1, 3328]
    - [19, 8.358]
  - - [704, 128, 1, 1280]
    - [19, 7.26]
  - - [1408, 448, 1, 1280]
    - [20, 30.322]
  - - [1024, 1408, 1, 256]
    - [22, 21.436]
  - - [2368, 2368, 1, 3328]
    - [10, 69.596]
  - - [5056, 704, 1, 3328]
    - [37, 72.849]
  - - [1408, 1856, 1, 256]
    - [5, 29.91]
  - - [1408, 256, 1, 1280]
    - [30, 22.899]
  - - [5888, 1856, 1, 256]
    - [38, 41.527]
  - - [704, 5888, 1, 256]
    - [25, 31.297]
  - - [6784, 64, 1, 256]
    - [39, 8.577]
  - - [3584, 704, 1, 3328]
    - [22, 67.239]
  - - [1408, 1408, 1, 256]
    - [40, 22.781]
  - - [1024, 64, 1, 1280]
    - [19, 5.495]
  - - [448, 4288, 1, 256]
    - [41, 22.707]
  - - [64, 3584, 1, 3328]
    - [42, 21.773]
  - - [704, 2368, 1, 1280]
    - [43, 48.864]
  - - [1856, 2368, 1, 1280]
    - [5, 58.578]
  - - [2368, 128, 1, 3328]
    - [44, 29.366]
  - - [1408, 1408, 1, 3328]
    - [45, 68.763]
  - - [2944, 128, 1, 256]
    - [46, 7.548]
  - - [448, 1408, 1, 256]
    - [39, 11.737]
  - - [64, 5056, 1, 3328]
    - [44, 28.683]
  - - [1408, 1024, 1, 1280]
    - [47, 47.908]
  - - [704, 6784, 1, 256]
    - [48, 34.698]
  - - [6784, 704, 1, 256]
    - [25, 34.266]
  - - [256, 3584, 1, 3328]
    - [49, 48.936]
  - - [5056, 704, 1, 256]
    - [22, 31.11]
  - - [1408, 3584, 1, 256]
    - [38, 35.156]
  - - [3584, 4288, 1, 3328]
    - [45, 83.186]
  - - [5888, 1856, 1, 1280]
    - [21, 68.639]
  - - [256, 1408, 1, 256]
    - [50, 7.534]
  - - [5056, 64, 1, 1280]
    - [44, 20.557]
  - - [2368, 128, 1, 256]
    - [51, 6.83]
  - - [2368, 3584, 1, 1280]
    - [14, 67.211]
  - - [1024, 256, 1, 256]
    - [50, 5.861]
  - - [448, 448, 1, 256]
    - [52, 4.488]
  - - [2944, 3584, 1, 3328]
    - [18, 87.955]
  - - [256, 256, 1, 3328]
    - [53, 8.387]
  - - [128, 1024, 1, 3328]
    - [54, 13.922]
  - - [6784, 2944, 1, 256]
    - [25, 47.333]
  - - [64, 1856, 1, 1280]
    - [6, 8.275]
  - - [448, 256, 1, 256]
    - [55, 2.605]
  - - [1856, 2368, 1, 256]
    - [25, 32.255]
  - - [3584, 6784, 1, 3328]
    - [18, 89.246]
  - - [256, 1024, 1, 256]
    - [50, 5.861]
  - - [1024, 128, 1, 1280]
    - [6, 9.132]
  - - [4288, 128, 1, 1280]
    - [9, 27.2]
  - - [5056, 4288, 1, 1280]
    - [21, 75.338]
  - - [5888, 64, 1, 256]
    - [50, 7.548]
  - - [6784, 1856, 1, 3328]
    - [13, 80.826]
  - - [1408, 5056, 1, 1280]
    - [56, 71.342]
  - - [1856, 256, 1, 1280]
    - [57, 23.958]
  - - [64, 5888, 1, 3328]
    - [44, 31.823]
  - - [6784, 5888, 1, 3328]
    - [18, 86.189]
  - - [448, 256, 1, 3328]
    - [8, 12.148]
  - - [2368, 5056, 1, 1280]
    - [58, 69.036]
  - - [1024, 704, 1, 1280]
    - [15, 35.241]
  - - [256, 1408, 1, 3328]
    - [44, 35.013]
  - - [6784, 128, 1, 3328]
    - [9, 58.876]
  - - [1024, 5056, 1, 1280]
    - [5, 67.814]
  - - [4288, 1024, 1, 256]
    - [22, 32.556]
  - - [2368, 1408, 1, 256]
    - [58, 29.68]
  - - [704, 704, 1, 3328]
    - [9, 35.875]
  - - [5888, 448, 1, 1280]
    - [22, 58.255]
  - - [3584, 256, 1, 3328]
    - [4, 48.522]
  - - [704, 5888, 1, 3328]
    - [57, 70.55]
  - - [1024, 6784, 1, 1280]
    - [18, 71.712]
  - - [128, 3584, 1, 3328]
    - [57, 33.206]
  - - [128, 704, 1, 1280]
    - [19, 7.18]
  - - [3584, 2944, 1, 1280]
    - [5, 72.562]
  - - [1856, 128, 1, 3328]
    - [44, 23.503]
  - - [128, 2944, 1, 1280]
    - [44, 23.939]
  - - [448, 1856, 1, 1280]
    - [20, 39.444]
  - - [1408, 5056, 1, 3328]
    - [27, 86.55]
  - - [1856, 1856, 1, 3328]
    - [20, 72.359]
  - - [3584, 128, 1, 256]
    - [39, 8.375]
  - - [448, 1408, 1, 3328]
    - [59, 46.194]
  - - [2368, 2368, 1, 256]
    - [36, 34.484]
  - - [4288, 4288, 1, 1280]
    - [60, 74.421]
  - - [64, 448, 1, 1280]
    - [61, 2.31]
  - - [5888, 1024, 1, 1280]
    - [62, 65.033]
  - - [704, 1024, 1, 256]
    - [26, 13.329]
  - - [704, 6784, 1, 3328]
    - [24, 74.15]
  - - [5888, 5888, 1, 3328]
    - [18, 89.759]
  - - [5056, 1024, 1, 1280]
    - [63, 65.552]
  - - [448, 5888, 1, 3328]
    - [20, 71.619]
  - - [1024, 2944, 1, 1280]
    - [64, 55.101]
  - - [5056, 5888, 1, 1280]
    - [18, 78.6]
  - - [448, 6784, 1, 256]
    - [58, 28.006]
  - - [256, 3584, 1, 256]
    - [37, 13.855]
  - - [256, 448, 1, 256]
    - [55, 2.625]
  - - [3584, 5888, 1, 256]
    - [38, 48.344]
  - - [2944, 3584, 1, 256]
    - [38, 43.544]
  - - [1408, 704, 1, 256]
    - [65, 14.586]
  - - [6784, 1024, 1, 3328]
    - [18, 86.077]
  - - [6784, 2944, 1, 3328]
    - [27, 85.378]
  - - [64, 64, 1, 3328]
    - [66, 0.55]
  - - [6784, 2368, 1, 1280]
    - [18, 73.059]
  - - [4288, 3584, 1, 256]
    - [25, 45.933]
  - - [4288, 5888, 1, 1280]
    - [21, 74.672]
  - - [448, 2944, 1, 3328]
    - [47, 55.069]
  - - [4288, 1856, 1, 1280]
    - [22, 66.303]
  - - [1856, 2944, 1, 3328]
    - [18, 68.02]
  - - [256, 6784, 1, 3328]
    - [33, 74.42]
  - - [64, 5888, 1, 256]
    - [50, 7.708]
  - - [5056, 1024, 1, 256]
    - [67, 36.962]
  - - [704, 64, 1, 3328]
    - [19, 5.825]
  - - [5056, 1856, 1, 3328]
    - [18, 79.389]
  - - [448, 448, 1, 3328]
    - [8, 20.904]
  - - [448, 2368, 1, 1280]
    - [5, 38.536]
  - - [1408, 128, 1, 1280]
    - [54, 12.495]
  - - [5056, 256, 1, 3328]
    - [68, 56.563]
  - - [704, 704, 1, 256]
    - [26, 9.405]
  - - [1024, 5888, 1, 1280]
    - [5, 64.455]
  - - [64, 128, 1, 256]
    - [66, 0.205]
  - - [128, 1856, 1, 1280]
    - [34, 15.026]
  - - [5056, 3584, 1, 256]
    - [38, 47.556]
  - - [1856, 1024, 1, 1280]
    - [69, 48.084]
  - - [1856, 1856, 1, 1280]
    - [22, 61.634]
  - - [128, 4288, 1, 3328]
    - [20, 39.729]
  - - [1856, 1024, 1, 3328]
    - [69, 66.661]
  - - [256, 2368, 1, 256]
    - [70, 10.996]
  - - [1024, 448, 1, 3328]
    - [9, 33.079]
  - - [1856, 704, 1, 1280]
    - [22, 42.155]
  - - [6784, 1024, 1, 256]
    - [71, 38.237]
  - - [5056, 5888, 1, 3328]
    - [27, 86.128]
  - - [1856, 1024, 1, 256]
    - [41, 22.283]
  - - [5056, 1408, 1, 3328]
    - [72, 82.92]
  - - [1024, 1024, 1, 1280]
    - [4, 38.478]
  - - [448, 5888, 1, 256]
    - [73, 26.695]
  - - [1408, 6784, 1, 3328]
    - [27, 79.979]
  - - [2944, 1408, 1, 3328]
    - [74, 75.448]
  - - [2944, 4288, 1, 3328]
    - [13, 80.981]
  - - [256, 2944, 1, 256]
    - [39, 13.336]
  - - [5056, 2944, 1, 256]
    - [16, 45.526]
  - - [2368, 1856, 1, 256]
    - [75, 31.93]
  - - [128, 6784, 1, 1280]
    - [20, 42.45]
  - - [1408, 3584, 1, 3328]
    - [76, 78.38]
  - - [2368, 6784, 1, 256]
    - [7, 46.103]
  - - [4288, 2368, 1, 3328]
    - [77, 81.074]
  - - [704, 3584, 1, 1280]
    - [20, 53.431]
  - - [1408, 5888, 1, 3328]
    - [47, 78.2]
  - - [1856, 5056, 1, 256]
    - [25, 40.396]
  - - [6784, 6784, 1, 256]
    - [36, 51.71]
  - - [1408, 704, 1, 3328]
    - [4, 53.17]
  - - [128, 5888, 1, 1280]
    - [15, 37.222]
  - - [2368, 4288, 1, 1280]
    - [27, 73.326]
  - - [3584, 1856, 1, 1280]
    - [47, 64.598]
  - - [704, 1408, 1, 3328]
    - [4, 53.17]
  - - [704, 64, 1, 1280]
    - [19, 3.756]
  - - [3584, 448, 1, 256]
    - [78, 23.272]
  - - [3584, 3584, 1, 1280]
    - [18, 72.586]
  - - [256, 6784, 1, 256]
    - [37, 25.556]
  - - [1856, 3584, 1, 3328]
    - [27, 80.638]
  - - [128, 448, 1, 256]
    - [32, 1.402]
  - - [3584, 3584, 1, 256]
    - [48, 44.21]
  - - [6784, 4288, 1, 1280]
    - [21, 77.045]
  - - [448, 704, 1, 1280]
    - [30, 20.396]
  - - [3584, 5056, 1, 256]
    - [38, 46.706]
  - - [6784, 128, 1, 256]
    - [79, 14.646]
  - - [64, 1408, 1, 3328]
    - [53, 11.263]
  - - [704, 448, 1, 256]
    - [50, 6.788]
  - - [2944, 2368, 1, 1280]
    - [47, 66.89]
  - - [448, 64, 1, 3328]
    - [55, 3.785]
  - - [6784, 3584, 1, 256]
    - [80, 48.297]
  - - [256, 1856, 1, 3328]
    - [57, 34.326]
  - - [256, 704, 1, 256]
    - [50, 4.093]
  - - [128, 1408, 1, 256]
    - [50, 3.999]
  - - [64, 128, 1, 3328]
    - [66, 1.074]
  - - [1856, 1408, 1, 256]
    - [22, 27.408]
  - - [2944, 2944, 1, 3328]
    - [47, 81.305]
  - - [5056, 6784, 1, 256]
    - [38, 51.714]
  - - [1408, 4288, 1, 3328]
    - [45, 74.86]
  - - [6784, 256, 1, 1280]
    - [29, 56.535]
  - - [1024, 704, 1, 3328]
    - [15, 52.793]
  - - [2368, 704, 1, 3328]
    - [22, 65.589]
  - - [128, 4288, 1, 256]
    - [39, 9.956]
  - - [3584, 6784, 1, 256]
    - [16, 48.733]
  - - [128, 128, 1, 3328]
    - [19, 2.14]
  - - [5056, 1856, 1, 256]
    - [25, 40.639]
  - - [704, 4288, 1, 256]
    - [37, 27.294]
  - - [256, 448, 1, 3328]
    - [54, 12.182]
  - - [1408, 6784, 1, 1280]
    - [18, 69.186]
  - - [64, 2368, 1, 1280]
    - [6, 10.558]
  - - [64, 6784, 1, 3328]
    - [30, 34.711]
  - - [2944, 256, 1, 1280]
    - [57, 37.739]
  - - [5056, 2368, 1, 3328]
    - [29, 80.783]
  - - [2944, 4288, 1, 256]
    - [38, 43.762]
  - - [1408, 3584, 1, 1280]
    - [5, 66.097]
  - - [2368, 64, 1, 256]
    - [52, 3.497]
  - - [256, 256, 1, 256]
    - [32, 1.644]
  - - [704, 128, 1, 3328]
    - [19, 11.453]
  - - [1856, 704, 1, 256]
    - [37, 19.227]
  - - [2368, 6784, 1, 3328]
    - [18, 82.523]
  - - [5056, 704, 1, 1280]
    - [22, 61.474]
  - - [1856, 4288, 1, 3328]
    - [20, 75.93]
  - - [1408, 5888, 1, 256]
    - [7, 38.442]
  - - [704, 2944, 1, 1280]
    - [5, 48.6]
  - - [4288, 64, 1, 1280]
    - [34, 17.59]
  - - [704, 1856, 1, 256]
    - [22, 19.834]
  - - [3584, 704, 1, 1280]
    - [22, 55.807]
  - - [5888, 5056, 1, 256]
    - [7, 49.574]
  - - [3584, 448, 1, 3328]
    - [81, 63.439]
  - - [704, 2368, 1, 3328]
    - [20, 66.215]
  - - [2944, 448, 1, 256]
    - [22, 19.609]
  - - [448, 5056, 1, 3328]
    - [76, 66.979]
  - - [2368, 128, 1, 1280]
    - [44, 19.256]
  - - [4288, 448, 1, 256]
    - [5, 22.801]
  - - [64, 6784, 1, 256]
    - [82, 8.757]
  - - [64, 5056, 1, 1280]
    - [30, 19.942]
  - - [5888, 2368, 1, 256]
    - [38, 44.338]
  - - [704, 448, 1, 3328]
    - [44, 30.716]
  - - [6784, 704, 1, 3328]
    - [47, 74.459]
  - - [128, 64, 1, 1280]
    - [55, 0.667]
  - - [2368, 256, 1, 1280]
    - [15, 30.461]
  - - [1408, 2944, 1, 3328]
    - [69, 75.448]
  - - [64, 1024, 1, 256]
    - [32, 1.602]
  - - [2368, 448, 1, 1280]
    - [49, 38.152]
  - - [128, 3584, 1, 256]
    - [83, 8.537]
  - - [1856, 448, 1, 3328]
    - [84, 51.447]
  - - [128, 5056, 1, 256]
    - [39, 11.965]
  - - [4288, 4288, 1, 256]
    - [38, 48.036]
  - - [2368, 704, 1, 256]
    - [22, 24.162]
  - - [3584, 2368, 1, 256]
    - [38, 39.165]
  - - [5888, 5056, 1, 1280]
    - [21, 77.368]
  - - [128, 1024, 1, 1280]
    - [54, 9.311]
  - - [64, 704, 1, 256]
    - [19, 1.101]
  - - [4288, 256, 1, 1280]
    - [49, 39.875]
  - - [3584, 3584, 1, 3328]
    - [31, 82.231]
  - - [128, 1024, 1, 256]
    - [66, 2.931]
  - - [5888, 6784, 1, 256]
    - [38, 51.318]
  - - [4288, 2944, 1, 3328]
    - [13, 81.078]
  - - [1856, 64, 1, 256]
    - [52, 2.719]
  - - [4288, 128, 1, 3328]
    - [9, 40.591]
  - - [256, 5056, 1, 1280]
    - [4, 45.975]
  - - [6784, 5888, 1, 1280]
    - [21, 78.673]
  - - [704, 128, 1, 256]
    - [19, 2.221]
  - - [5888, 4288, 1, 1280]
    - [21, 77.206]
  - - [448, 256, 1, 1280]
    - [6, 8.068]
  - - [448, 2368, 1, 3328]
    - [4, 56.988]
  - - [1, 1, 1, 1280]
    - [2, 0.0]
  - - [256, 1408, 1, 1280]
    - [85, 22.699]
  - - [1408, 1856, 1, 1280]
    - [5, 61.079]
  - - [5888, 448, 1, 3328]
    - [37, 69.947]
  - - [704, 5888, 1, 1280]
    - [20, 56.986]
  - - [256, 64, 1, 3328]
    - [66, 2.171]
  - - [128, 2368, 1, 256]
    - [51, 6.777]
  - - [6784, 64, 1, 3328]
    - [42, 39.039]
  - - [5056, 2944, 1, 3328]
    - [86, 80.419]
  - - [448, 128, 1, 256]
    - [32, 1.39]
  - - [1856, 128, 1, 1280]
    - [87, 15.159]
  - - [448, 4288, 1, 1280]
    - [88, 48.264]
  - - [64, 3584, 1, 256]
    - [50, 5.012]
  - - [128, 2944, 1, 3328]
    - [44, 35.952]
  - - [3584, 704, 1, 256]
    - [78, 25.445]
  - - [2944, 448, 1, 3328]
    - [17, 56.646]
  - - [3584, 1408, 1, 3328]
    - [47, 77.8]
  - - [2368, 1024, 1, 1280]
    - [5, 58.673]
  - - [2944, 6784, 1, 1280]
    - [14, 75.955]
  - - [1856, 6784, 1, 256]
    - [38, 44.18]
  - - [4288, 448, 1, 3328]
    - [86, 66.081]
  - - [6784, 704, 1, 1280]
    - [5, 62.899]
  - - [5888, 1024, 1, 3328]
    - [18, 75.181]
  - - [704, 6784, 1, 1280]
    - [5, 63.014]
  - - [5888, 128, 1, 256]
    - [26, 13.017]
  - - [5056, 1024, 1, 3328]
    - [4, 79.009]
  - - [704, 5056, 1, 1280]
    - [5, 60.461]
  - - [64, 704, 1, 3328]
    - [89, 5.825]
  - - [2944, 1856, 1, 256]
    - [25, 33.389]
  - - [5056, 64, 1, 256]
    - [52, 6.763]
  - - [5888, 5056, 1, 3328]
    - [18, 85.377]
  - - [128, 5056, 1, 3328]
    - [15, 46.755]
  - - [3584, 6784, 1, 1280]
    - [18, 78.883]
  - - [1856, 5888, 1, 256]
    - [38, 42.536]
  - - [64, 448, 1, 3328]
    - [53, 3.733]
  - - [4288, 4288, 1, 3328]
    - [10, 83.616]
  - - [4288, 1408, 1, 1280]
    - [90, 64.542]
  - - [64, 1856, 1, 256]
    - [66, 2.785]
  - - [4288, 2368, 1, 256]
    - [25, 42.506]
  - - [2944, 5056, 1, 1280]
    - [14, 71.864]
  - - [256, 4288, 1, 1280]
    - [49, 39.876]
  - - [6784, 2368, 1, 3328]
    - [27, 82.219]
  - - [256, 1024, 1, 1280]
    - [30, 16.654]
  - - [4288, 128, 1, 256]
    - [26, 10.28]
  - - [4288, 1856, 1, 3328]
    - [37, 76.279]
  - - [1856, 2944, 1, 1280]
    - [22, 59.515]
  - - [3584, 64, 1, 1280]
    - [44, 14.572]
  - - [4288, 6784, 1, 3328]
    - [10, 84.802]
  - - [3584, 1024, 1, 1280]
    - [5, 62.634]
  - - [1024, 4288, 1, 256]
    - [38, 31.661]
  - - [5888, 3584, 1, 3328]
    - [18, 89.761]
  - - [5056, 3584, 1, 3328]
    - [24, 83.142]
  - - [1408, 128, 1, 3328]
    - [54, 18.363]
  - - [2368, 1408, 1, 1280]
    - [22, 59.655]
  - - [5056, 2944, 1, 1280]
    - [12, 72.202]
  - - [3584, 256, 1, 256]
    - [37, 14.024]
  - - [1024, 6784, 1, 256]
    - [21, 36.831]
  - - [2944, 5056, 1, 3328]
    - [45, 80.663]
  - - [3584, 2944, 1, 256]
    - [48, 43.289]
  - - [448, 128, 1, 3328]
    - [19, 7.466]
  - - [64, 2944, 1, 3328]
    - [6, 19.355]
  - - [64, 4288, 1, 3328]
    - [44, 25.22]
  - - [5056, 6784, 1, 3328]
    - [18, 89.336]
  - - [128, 2944, 1, 256]
    - [82, 7.654]
  - - [3584, 4288, 1, 256]
    - [7, 45.184]
  - - [1856, 6784, 1, 3328]
    - [18, 80.646]
  - - [3584, 128, 1, 3328]
    - [9, 33.142]
  - - [128, 256, 1, 1280]
    - [66, 2.685]
  - - [64, 448, 1, 256]
    - [91, 0.713]
  - - [64, 256, 1, 1280]
    - [55, 1.366]
  - - [5056, 1408, 1, 1280]
    - [92, 67.898]
  - - [5888, 5888, 1, 256]
    - [38, 50.706]
  - - [4288, 1024, 1, 1280]
    - [22, 62.633]
  - - [5888, 128, 1, 3328]
    - [9, 53.018]
  - - [448, 6784, 1, 3328]
    - [93, 68.483]
  - - [2944, 1408, 1, 1280]
    - [22, 60.078]
  - - [64, 128, 1, 1280]
    - [61, 0.691]
  - - [2944, 1856, 1, 3328]
    - [10, 68.36]
  - - [448, 5056, 1, 256]
    - [40, 25.822]
  - - [64, 64, 1, 256]
    - [91, 0.101]
  - - [3584, 5888, 1, 1280]
    - [27, 80.254]
  - - [6784, 1856, 1, 1280]
    - [12, 71.319]
  - - [5888, 256, 1, 3328]
    - [29, 64.739]
  - - [1856, 5888, 1, 3328]
    - [94, 77.472]
  - - [3584, 1408, 1, 256]
    - [7, 35.413]
  - - [704, 3584, 1, 3328]
    - [20, 69.665]
  - - [5056, 448, 1, 1280]
    - [5, 53.55]
  - - [3584, 1856, 1, 3328]
    - [47, 78.259]
  - - [1408, 704, 1, 1280]
    - [4, 35.826]
  - - [2944, 1024, 1, 256]
    - [22, 26.509]
  - - [448, 1408, 1, 1280]
    - [57, 32.03]
  - - [2368, 4288, 1, 3328]
    - [27, 85.192]
  - - [1024, 1408, 1, 1280]
    - [29, 47.798]
  - - [256, 128, 1, 1280]
    - [66, 2.764]
  - - [704, 1408, 1, 1280]
    - [95, 37.226]
  - - [6784, 5056, 1, 256]
    - [36, 50.397]
  - - [4288, 5888, 1, 256]
    - [7, 49.236]
  - - [448, 2944, 1, 256]
    - [96, 19.212]
  - - [2944, 6784, 1, 256]
    - [38, 47.844]
  - - [2368, 2368, 1, 1280]
    - [22, 61.123]
  - - [1856, 3584, 1, 1280]
    - [27, 67.318]
  - - [64, 2944, 1, 256]
    - [97, 4.213]
  - - [3584, 1408, 1, 1280]
    - [5, 66.581]
  - - [5056, 3584, 1, 1280]
    - [60, 74.155]
  - - [256, 5888, 1, 256]
    - [98, 21.522]
  - - [128, 256, 1, 3328]
    - [55, 4.237]
  - - [1856, 1408, 1, 3328]
    - [99, 76.252]
  - - [1024, 4288, 1, 3328]
    - [100, 79.153]
  - - [448, 2368, 1, 256]
    - [22, 16.02]
  - - [64, 1408, 1, 1280]
    - [19, 7.063]
  - - [64, 6784, 1, 1280]
    - [44, 24.946]
  - - [2944, 2368, 1, 3328]
    - [29, 80.726]
  - - [704, 4288, 1, 3328]
    - [27, 68.227]
  - - [1024, 1856, 1, 1280]
    - [69, 48.0]
  - - [6784, 1856, 1, 256]
    - [12, 43.44]
  - - [128, 2368, 1, 3328]
    - [44, 29.291]
  - - [1024, 5888, 1, 256]
    - [101, 36.229]
  - - [64, 2944, 1, 1280]
    - [6, 12.877]
  - - [5056, 64, 1, 3328]
    - [44, 31.596]
  - - [1408, 2368, 1, 256]
    - [22, 28.535]
  - - [2944, 704, 1, 3328]
    - [76, 61.432]
  - - [256, 64, 1, 256]
    - [66, 0.407]
  - - [2944, 2944, 1, 1280]
    - [47, 69.131]
  - - [6784, 256, 1, 3328]
    - [102, 74.762]
  - - [1408, 5056, 1, 256]
    - [21, 36.797]
  - - [5056, 128, 1, 3328]
    - [9, 48.051]
  - - [128, 128, 1, 1280]
    - [55, 1.335]
  - - [448, 704, 1, 256]
    - [103, 6.544]
  - - [1856, 256, 1, 3328]
    - [57, 34.932]
  - - [2944, 128, 1, 3328]
    - [34, 37.182]
  - - [704, 256, 1, 256]
    - [51, 3.998]
  - - [256, 448, 1, 1280]
    - [6, 8.068]
  - - [704, 256, 1, 1280]
    - [6, 12.678]
  - - [64, 2368, 1, 3328]
    - [8, 15.829]
  - - [256, 704, 1, 3328]
    - [54, 19.036]
  - - [1024, 1024, 1, 256]
    - [22, 15.67]
  - - [1408, 4288, 1, 256]
    - [104, 36.354]
  - - [5888, 2368, 1, 1280]
    - [21, 71.53]
  - - [128, 256, 1, 256]
    - [66, 0.801]
  - - [256, 64, 1, 1280]
    - [66, 1.382]
  - - [2368, 5888, 1, 1280]
    - [27, 77.009]
  - - [5888, 256, 1, 1280]
    - [47, 50.087]
  - - [704, 1024, 1, 1280]
    - [57, 37.396]
  - - [2368, 1856, 1, 3328]
    - [105, 68.663]
  - - [2944, 704, 1, 256]
    - [40, 23.911]
  - - [2368, 6784, 1, 1280]
    - [18, 73.663]
  - - [2368, 1024, 1, 3328]
    - [99, 71.646]
  - - [1856, 4288, 1, 1280]
    - [14, 64.118]
  - - [704, 3584, 1, 256]
    - [73, 25.445]
  - - [704, 2944, 1, 3328]
    - [76, 61.383]
  - - [1856, 5056, 1, 3328]
    - [27, 79.174]
  - - [3584, 5056, 1, 1280]
    - [21, 74.008]
  - - [2944, 1024, 1, 3328]
    - [106, 70.077]
  - - [256, 4288, 1, 256]
    - [98, 16.404]
  - - [2368, 256, 1, 256]
    - [26, 11.428]
  - - [1408, 6784, 1, 256]
    - [101, 40.336]
  - - [6784, 1408, 1, 3328]
    - [27, 80.212]
  - - [1024, 2368, 1, 1280]
    - [5, 57.8]
  - - [704, 64, 1, 256]
    - [19, 1.101]
  - - [256, 2368, 1, 3328]
    - [57, 43.796]
  - - [6784, 2944, 1, 1280]
    - [27, 76.055]
  - - [3584, 448, 1, 1280]
    - [98, 51.228]
  - - [2944, 6784, 1, 3328]
    - [18, 85.213]
  - - [448, 5056, 1, 1280]
    - [5, 53.814]
  - - [4288, 5056, 1, 1280]
    - [14, 74.547]
  - - [128, 448, 1, 1280]
    - [19, 4.646]
  - - [4288, 704, 1, 256]
    - [22, 27.38]
  - - [64, 64, 1, 1280]
    - [61, 0.35]
  - - [5888, 704, 1, 256]
    - [48, 30.267]
  - - [256, 5888, 1, 3328]
    - [64, 65.037]
  - - [6784, 4288, 1, 256]
    - [101, 49.412]
  - - [5888, 256, 1, 256]
    - [22, 21.957]
  - - [6784, 1024, 1, 1280]
    - [18, 73.608]
  - - [704, 448, 1, 1280]
    - [87, 20.037]
  - - [128, 64, 1, 3328]
    - [91, 1.059]
  - - [448, 64, 1, 256]
    - [55, 0.701]
  - - [2944, 704, 1, 1280]
    - [5, 50.065]
  - - [6784, 3584, 1, 1280]
    - [18, 80.347]
  - - [2944, 64, 1, 1280]
    - [54, 12.58]
  - - [1408, 2944, 1, 1280]
    - [98, 59.599]
  - - [256, 1856, 1, 256]
    - [83, 8.841]
  - - [1408, 2368, 1, 3328]
    - [47, 75.309]
  - - [128, 1408, 1, 3328]
    - [54, 18.667]
  - - [2368, 2944, 1, 256]
    - [107, 37.938]
  - - [64, 5056, 1, 256]
    - [50, 6.813]
  - - [1408, 256, 1, 3328]
    - [30, 35.195]
  - - [3584, 1856, 1, 256]
    - [67, 35.463]
  - - [4288, 3584, 1, 1280]
    - [21, 72.427]
  - - [2368, 448, 1, 256]
    - [108, 15.772]
  - - [4288, 256, 1, 3328]
    - [49, 58.465]
  - - [1408, 64, 1, 256]
    - [19, 2.166]
  - - [4288, 2944, 1, 1280]
    - [18, 71.169]
  - - [5056, 448, 1, 3328]
    - [99, 66.611]
  - - [1024, 64, 1, 256]
    - [19, 1.629]
  - - [64, 2368, 1, 256]
    - [52, 3.312]
  - - [4288, 5056, 1, 3328]
    - [13, 85.586]
  - - [2944, 256, 1, 256]
    - [39, 13.845]
  - - [1024, 128, 1, 3328]
    - [6, 13.766]
  - - [256, 5056, 1, 3328]
    - [4, 69.628]
  - - [5056, 2368, 1, 256]
    - [38, 42.95]
  - - [4288, 704, 1, 3328]
    - [106, 68.557]
  - - [448, 3584, 1, 256]
    - [109, 23.039]
  - - [2368, 64, 1, 1280]
    - [8, 10.661]
  - - [1024, 1408, 1, 3328]
    - [47, 61.995]
  - - [2944, 5888, 1, 1280]
    - [18, 78.216]
  - - [5888, 3584, 1, 256]
    - [38, 48.038]
  - - [1408, 1856, 1, 3328]
    - [24, 76.371]
  - - [6784, 1408, 1, 1280]
    - [110, 69.746]
  - - [704, 2944, 1, 256]
    - [40, 24.3]
  - - [4288, 64, 1, 256]
    - [52, 6.089]
  - - [2944, 5888, 1, 3328]
    - [27, 88.513]
  - - [64, 4288, 1, 1280]
    - [44, 17.207]
  - - [6784, 64, 1, 1280]
    - [44, 26.088]
  - - [704, 1856, 1, 1280]
    - [22, 42.535]
  - - [1408, 64, 1, 3328]
    - [19, 11.114]
  - - [1408, 1408, 1, 1280]
    - [88, 49.377]
  - - [448, 1024, 1, 3328]
    - [57, 33.794]
  - - [448, 4288, 1, 3328]
    - [86, 66.325]
  - - [704, 2368, 1, 256]
    - [111, 23.454]
  - - [2944, 448, 1, 1280]
    - [98, 43.032]
  - - [5888, 2368, 1, 3328]
    - [11, 84.334]
  - - [4288, 5056, 1, 256]
    - [25, 48.473]
  - - [4288, 448, 1, 1280]
    - [88, 48.517]
  - - [5888, 704, 1, 3328]
    - [37, 69.447]
  - - [4288, 3584, 1, 3328]
    - [112, 82.923]
  - - [2944, 64, 1, 256]
    - [51, 4.279]
  - - [1024, 6784, 1, 3328]
    - [18, 84.816]
  - - [1408, 1024, 1, 256]
    - [65, 21.217]
  - - [448, 1024, 1, 256]
    - [113, 8.705]
  - - [6784, 6784, 1, 3328]
    - [47, 86.463]
  - - [1024, 448, 1, 1280]
    - [39, 22.657]
  - - [704, 5056, 1, 3328]
    - [57, 74.434]
  - - [256, 2368, 1, 1280]
    - [20, 29.044]
  - - [3584, 5056, 1, 3328]
    - [24, 82.676]
  - - [2368, 2944, 1, 3328]
    - [29, 80.132]
  - - [448, 448, 1, 1280]
    - [6, 14.119]
  - - [2368, 3584, 1, 256]
    - [38, 40.797]
  - - [1024, 256, 1, 1280]
    - [30, 16.802]
  - - [128, 5056, 1, 1280]
    - [59, 31.11]
  - - [3584, 2368, 1, 1280]
    - [14, 67.507]
  - - [1856, 1856, 1, 256]
    - [25, 30.383]
  - - [4288, 1408, 1, 3328]
    - [27, 75.158]
  - - [3584, 64, 1, 3328]
    - [44, 22.223]
  - - [1, 1, 1, 1]
    - [0, 0.0]
  - - [256, 1024, 1, 3328]
    - [44, 25.464]
  - - [1856, 64, 1, 3328]
    - [8, 12.617]
  - - [5888, 1408, 1, 3328]
    - [29, 78.595]
  - - [256, 5056, 1, 256]
    - [37, 19.243]
  - - [1856, 64, 1, 1280]
    - [6, 8.316]
  - - [1408, 256, 1, 256]
    - [50, 7.479]
  - - [2368, 5056, 1, 256]
    - [38, 43.219]
  - - [128, 5888, 1, 3328]
    - [15, 54.448]
  - - [1024, 5056, 1, 256]
    - [7, 36.422]
  - - [2368, 1408, 1, 3328]
    - [29, 74.948]
  - - [5888, 448, 1, 256]
    - [37, 26.326]
  - - [6784, 5056, 1, 1280]
    - [27, 79.333]
  - - [4288, 6784, 1, 1280]
    - [60, 76.735]
  - - [2368, 448, 1, 3328]
    - [49, 56.502]
  - - [1024, 128, 1, 256]
    - [114, 2.977]
  - - [448, 128, 1, 1280]
    - [19, 4.699]
  - - [1024, 64, 1, 3328]
    - [19, 8.415]
  - - [64, 3584, 1, 1280]
    - [44, 14.445]
  - - [6784, 1408, 1, 256]
    - [115, 40.814]
  - - [5888, 4288, 1, 256]
    - [38, 49.004]
  - - [5056, 5888, 1, 256]
    - [25, 50.507]
  - - [2368, 1024, 1, 256]
    - [41, 27.864]
  - - [1856, 6784, 1, 1280]
    - [18, 71.263]
  - - [3584, 128, 1, 1280]
    - [57, 22.657]
  - - [128, 64, 1, 256]
    - [66, 0.204]
  - - [1408, 448, 1, 256]
    - [39, 11.231]
  - - [64, 256, 1, 3328]
    - [19, 2.148]
  - - [6784, 448, 1, 3328]
    - [29, 69.358]
  - - [5056, 1856, 1, 1280]
    - [27, 69.577]
  - - [1408, 1024, 1, 3328]
    - [116, 61.854]
  - - [2368, 256, 1, 3328]
    - [9, 45.099]
  - - [5888, 3584, 1, 1280]
    - [117, 80.551]
  - - [5888, 128, 1, 1280]
    - [20, 36.109]
  - - [1024, 2944, 1, 256]
    - [22, 26.754]
  - - [448, 6784, 1, 1280]
    - [22, 54.379]
  - - [256, 3584, 1, 1280]
    - [5, 33.245]
  - - [704, 5056, 1, 256]
    - [63, 31.204]
  - - [3584, 1024, 1, 3328]
    - [49, 73.391]
  - - [2944, 1856, 1, 1280]
    - [5, 59.923]
  - - [5056, 256, 1, 256]
    - [118, 19.047]
  - - [128, 5888, 1, 256]
    - [39, 13.758]
  - - [2368, 3584, 1, 3328]
    - [47, 79.139]
  - - [3584, 5888, 1, 3328]
    - [18, 90.252]
  - - [2944, 3584, 1, 1280]
    - [18, 76.811]
  - - [1856, 5888, 1, 1280]
    - [5, 67.812]
  - - [256, 256, 1, 1280]
    - [19, 5.37]
  - - [4288, 1408, 1, 256]
    - [25, 36.507]
  - - [3584, 64, 1, 256]
    - [51, 5.209]
  - - [64, 1856, 1, 3328]
    - [8, 12.441]
  - - [1408, 128, 1, 256]
    - [52, 4.125]
  - - [4288, 2368, 1, 1280]
    - [60, 69.399]
  - - [2944, 5056, 1, 256]
    - [7, 45.191]
  - - [256, 128, 1, 3328]
    - [19, 4.281]
  - - [6784, 2368, 1, 256]
    - [38, 45.16]
  - - [1408, 448, 1, 3328]
    - [15, 46.014]
  - - [4288, 1856, 1, 256]
    - [25, 38.257]
  - - [1856, 2944, 1, 256]
    - [14, 33.531]
  - - [64, 5888, 1, 1280]
    - [85, 22.364]
  - - [1856, 1408, 1, 1280]
    - [22, 57.536]
  - - [128, 704, 1, 256]
    - [32, 2.203]
  - - [1024, 4288, 1, 1280]
    - [37, 62.819]
  - - [2368, 5056, 1, 3328]
    - [29, 80.537]
  - - [4288, 1024, 1, 3328]
    - [119, 74.598]
  - - [1024, 5056, 1, 3328]
    - [76, 79.952]
  - - [1024, 1856, 1, 3328]
    - [69, 66.661]
  - - [704, 704, 1, 1280]
    - [39, 24.311]
  - - [128, 2368, 1, 1280]
    - [44, 19.602]
  - - [3584, 256, 1, 1280]
    - [49, 33.583]
  - - [5888, 64, 1, 1280]
    - [44, 23.424]
  - - [128, 704, 1, 3328]
    - [120, 11.3]
  - - [3584, 2944, 1, 3328]
    - [11, 85.595]
  - - [128, 1856, 1, 256]
    - [52, 5.271]
  - - [64, 4288, 1, 256]
    - [51, 5.82]
  - - [5888, 2944, 1, 256]
    - [38, 47.345]
  - - [5056, 128, 1, 1280]
    - [9, 31.962]
  - - [448, 1856, 1, 3328]
    - [9, 59.84]
  - - [5056, 4288, 1, 256]
    - [14, 48.7]
  - - [1024, 448, 1, 256]
    - [83, 8.482]
  - - [1024, 3584, 1, 256]
    - [38, 31.318]
  - - [2944, 128, 1, 1280]
    - [44, 23.834]
  - - [64, 256, 1, 256]
    - [91, 0.407]
  - - [704, 256, 1, 3328]
    - [6, 19.197]
  - - [5056, 1408, 1, 256]
    - [25, 38.023]
  - - [5888, 5888, 1, 1280]
    - [18, 80.678]
  - - [448, 5888, 1, 1280]
    - [57, 55.533]
  - - [1, 1, 1, 256]
    - [1, 0.0]
  - - [4288, 704, 1, 1280]
    - [33, 54.281]
  - - [2944, 1408, 1, 256]
    - [121, 31.053]
  - - [256, 2944, 1, 1280]
    - [57, 37.739]
  - - [2368, 5888, 1, 3328]
    - [27, 87.804]
  - - [704, 1024, 1, 3328]
    - [9, 53.419]
  - - [2368, 1856, 1, 1280]
    - [5, 58.523]
  - - [1856, 448, 1, 1280]
    - [39, 38.188]
  - - [128, 6784, 1, 256]
    - [39, 15.272]
  - - [5888, 4288, 1, 3328]
    - [10, 84.728]
  - - [1856, 128, 1, 256]
    - [51, 5.353]
  - - [5056, 448, 1, 256]
    - [5, 26.775]
  - - [1856, 5056, 1, 1280]
    - [27, 68.764]
  - - [2944, 1024, 1, 1280]
    - [122, 55.666]
  - - [2368, 4288, 1, 256]
    - [25, 42.754]
  - - [1024, 2368, 1, 3328]
    - [76, 71.646]
  - - [4288, 64, 1, 3328]
    - [44, 26.796]
  - - [704, 1408, 1, 256]
    - [111, 15.047]
  - - [4288, 5888, 1, 3328]
    - [112, 83.768]
  - - [448, 2944, 1, 1280]
    - [22, 42.838]
  - - [1024, 2944, 1, 3328]
    - [11, 69.904]
  - - [256, 6784, 1, 1280]
    - [64, 56.922]
  - - [1856, 3584, 1, 256]
    - [110, 37.038]
  - - [128, 448, 1, 3328]
    - [120, 7.389]
  - - [1856, 256, 1, 256]
    - [39, 8.957]
  - - [5056, 128, 1, 256]
    - [39, 11.965]
  - - [256, 5888, 1, 1280]
    - [64, 50.086]
  - - [6784, 128, 1, 1280]
    - [57, 41.193]
  - - [64, 1408, 1, 256]
    - [32, 2.26]
  - - [2944, 2368, 1, 256]
    - [38, 36.164]
  - - [1856, 448, 1, 256]
    - [39, 15.674]
  - - [1024, 1856, 1, 256]
    - [40, 22.193]
  - - [6784, 3584, 1, 3328]
    - [18, 89.641]
  - - [2944, 64, 1, 3328]
    - [54, 18.739]
  - - [1024, 5888, 1, 3328]
    - [117, 74.463]
  - - [1408, 2368, 1, 1280]
    - [47, 59.36]
  - - [128, 1408, 1, 1280]
    - [54, 12.616]
  - - [128, 1856, 1, 3328]
    - [44, 22.958]
  - - [2944, 2944, 1, 256]
    - [7, 39.617]
  - - [6784, 256, 1, 256]
    - [65, 24.921]
  - - [128, 4288, 1, 1280]
    - [9, 26.209]
  - - [5888, 1408, 1, 256]
    - [38, 38.381]
  - - [128, 128, 1, 256]
    - [66, 0.404]
  - - [448, 704, 1, 3328]
    - [30, 30.796]
  - - [448, 1856, 1, 256]
    - [39, 15.473]
  - - [1856, 704, 1, 3328]
    - [64, 56.119]
  - - [5888, 6784, 1, 3328]
    - [13, 87.167]
  - - [704, 4288, 1, 1280]
    - [33, 54.012]
  - - [4096, 7000, 1, 4096]
    - [11, 90.447]
  - - [5124, 9124, 1, 1760]
    - [117, 82.228]
  - - [1760, 32, 1, 1760]
    - [123, 4.596]
  - - [1024, 1500, 1, 1536]
    - [22, 51.414]
  - - [512, 24000, 1, 2048]
    - [64, 76.672]
  - - [3072, 24000, 1, 1024]
    - [18, 79.673]
  - - [1024, 3000, 1, 2560]
    - [47, 66.519]
  - - [512, 3136, 1, 2048]
    - [29, 59.088]
  - - [7680, 4, 1, 2560]
    - [51, 2.307]
  - - [64, 193600, 1, 64]
    - [124, 16.215]
  - - [8448, 1500, 1, 2816]
    - [56, 79.47]
  - - [2560, 7000, 1, 2560]
    - [11, 84.508]
  - - [3072, 16, 1, 1024]
    - [19, 3.396]
  - - [512, 48000, 1, 2048]
    - [27, 84.788]
  - - [1760, 64, 1, 1760]
    - [89, 8.97]
  - - [1024, 16, 1, 512]
    - [55, 0.733]
  - - [196, 256, 64, 1024]
    - [98, 35.589]
  - - [512, 48000, 1, 1536]
    - [18, 80.427]
  - - [2560, 32, 1, 2560]
    - [19, 9.158]
  - - [4608, 1500, 1, 1536]
    - [110, 74.619]
  - - [2048, 128, 1, 2048]
    - [44, 21.075]
  - - [1024, 24000, 1, 2560]
    - [27, 87.813]
  - - [4608, 3000, 1, 1536]
    - [18, 79.215]
  - - [5124, 9124, 1, 2048]
    - [117, 81.927]
  - - [2048, 16, 1, 2048]
    - [19, 3.331]
  - - [1024, 700, 1, 512]
    - [39, 21.649]
  - - [3072, 1, 1, 128]
    - [103, 0.043]
  - - [5124, 700, 1, 2560]
    - [10, 64.336]
  - - [8448, 16, 1, 2816]
    - [97, 9.746]
  - - [6144, 6000, 1, 2560]
    - [18, 85.271]
  - - [4608, 32, 1, 1536]
    - [82, 10.207]
  - - [3072, 64, 1, 1024]
    - [54, 11.632]
  - - [512, 16, 1, 512]
    - [19, 0.355]
  - - [7680, 2, 1, 2560]
    - [51, 1.166]
  - - [4224, 1, 1, 128]
    - [51, 0.057]
  - - [7680, 1, 1, 2560]
    - [52, 0.58]
  - - [128, 1500, 1, 1280]
    - [54, 13.506]
  - - [1024, 1500, 1, 2816]
    - [102, 62.638]
  - - [6144, 2, 1, 2560]
    - [125, 1.279]
  - - [8448, 48000, 1, 2816]
    - [18, 92.737]
  - - [512, 6000, 1, 2048]
    - [102, 61.961]
  - - [4224, 1500, 1, 176]
    - [12, 24.208]
  - - [1024, 6000, 1, 2816]
    - [18, 74.315]
  - - [1024, 48000, 1, 1536]
    - [18, 83.844]
  - - [1024, 48000, 1, 2560]
    - [18, 89.066]
  - - [4096, 32, 1, 4096]
    - [44, 13.382]
  - - [512, 16, 1, 500000]
    - [126, 7.954]
  - - [2560, 128, 1, 2560]
    - [44, 29.08]
  - - [4608, 24000, 1, 1536]
    - [18, 86.741]
  - - [512, 2, 1, 500000]
    - [126, 1.043]
  - - [7680, 48000, 1, 2560]
    - [18, 92.056]
  - - [3072, 48000, 1, 1024]
    - [21, 80.713]
  - - [1760, 16, 1, 1760]
    - [127, 2.386]
  - - [1024, 1500, 1, 2048]
    - [29, 56.797]
  - - [1024, 16, 1, 500000]
    - [126, 8.536]
  - - [64, 193600, 1, 256]
    - [128, 26.355]
  - - [1024, 3000, 1, 2048]
    - [17, 63.007]
  - - [6144, 4, 1, 2560]
    - [125, 2.55]
  - - [1024, 6000, 1, 2048]
    - [5, 71.096]
  - - [512, 24000, 1, 2816]
    - [64, 80.366]
  - - [6144, 48000, 1, 2560]
    - [18, 91.507]
  - - [1760, 7000, 1, 1760]
    - [129, 77.382]
  - - [8448, 3000, 1, 2816]
    - [130, 81.541]
  - - [3072, 4, 1, 1024]
    - [19, 0.875]
  - - [4608, 48000, 1, 1536]
    - [18, 87.129]
  - - [2048, 32, 1, 2048]
    - [19, 6.691]
  - - [7680, 1500, 1, 2560]
    - [10, 77.577]
  - - [4096, 128, 1, 4096]
    - [9, 39.729]
  - - [4608, 16, 1, 1536]
    - [19, 6.412]
  - - [512, 3000, 1, 1536]
    - [64, 52.018]
  - - [3072, 2, 1, 1024]
    - [19, 0.432]
  - - [8448, 1, 1, 2816]
    - [51, 0.641]
  - - [1024, 3000, 1, 2816]
    - [90, 67.309]
  - - [128, 1, 1, 1408]
    - [127, 0.011]
  - - [64, 1, 1, 1216]
    - [61, 0.005]
  - - [1024, 2, 1, 512]
    - [55, 0.095]
  - - [1024, 4, 1, 500000]
    - [126, 2.171]
  - - [6144, 1, 1, 2560]
    - [125, 0.631]
  - - [5124, 9124, 1, 2560]
    - [117, 84.008]
  - - [512, 48000, 1, 2816]
    - [18, 87.206]
  - - [512, 3000, 1, 2816]
    - [17, 63.124]
  - - [1024, 24000, 1, 1536]
    - [27, 81.945]
  - - [7680, 6000, 1, 2560]
    - [11, 86.207]
  - - [1760, 128, 1, 1760]
    - [54, 15.246]
  - - [512, 1500, 1, 2816]
    - [15, 52.513]
  - - [512, 1, 1, 512]
    - [91, 0.023]
  - - [512, 6000, 1, 2560]
    - [17, 65.342]
  - - [512, 8, 1, 500000]
    - [126, 3.973]
  - - [512, 24000, 1, 2560]
    - [64, 79.447]
  - - [6144, 3000, 1, 2560]
    - [10, 81.114]
  - - [1024, 24000, 1, 2816]
    - [18, 88.573]
  - - [2048, 7000, 1, 2048]
    - [11, 80.23]
  - - [7680, 3000, 1, 2560]
    - [18, 83.035]
  - - [1024, 4, 1, 512]
    - [32, 0.18]
  - - [5124, 700, 1, 2048]
    - [10, 60.321]
  - - [5124, 9124, 1, 4096]
    - [117, 87.121]
  - - [4096, 64, 1, 4096]
    - [44, 25.849]
  - - [256, 193600, 1, 64]
    - [104, 19.898]
  - - [7680, 32, 1, 2560]
    - [51, 15.082]
  - - [2560, 64, 1, 2560]
    - [6, 15.244]
  - - [3072, 128, 1, 1024]
    - [30, 21.5]
  - - [8448, 6000, 1, 2816]
    - [18, 86.698]
  - - [7680, 64, 1, 2560]
    - [131, 29.972]
  - - [5124, 1500, 1, 2560]
    - [10, 71.719]
  - - [1024, 1500, 1, 2560]
    - [29, 61.53]
  - - [512, 4, 1, 512]
    - [32, 0.093]
  - - [1024, 6000, 1, 2560]
    - [18, 73.256]
  - - [3072, 32, 1, 1024]
    - [19, 6.751]
  - - [6144, 32, 1, 2560]
    - [44, 17.08]
  - - [196, 1024, 64, 256]
    - [132, 26.219]
  - - [512, 50176, 1, 128]
    - [7, 29.901]
  - - [4608, 1, 1, 1536]
    - [19, 0.409]
  - - [1024, 32, 1, 512]
    - [19, 1.432]
  - - [7680, 24000, 1, 2560]
    - [18, 91.084]
  - - [8448, 4, 1, 2816]
    - [51, 2.553]
  - - [512, 1, 1, 500000]
    - [126, 0.516]
  - - [176, 1500, 1, 1408]
    - [44, 17.234]
  - - [512, 3000, 1, 2560]
    - [64, 61.701]
  - - [8448, 24000, 1, 2816]
    - [18, 91.791]
  - - [4608, 2, 1, 1536]
    - [19, 0.814]
  - - [512, 6000, 1, 1536]
    - [47, 57.349]
  - - [7680, 128, 1, 2560]
    - [133, 41.452]
  - - [3072, 6000, 1, 1024]
    - [21, 72.502]
  - - [3072, 1500, 1, 128]
    - [38, 20.384]
  - - [2048, 3136, 1, 512]
    - [48, 52.625]
  - - [1024, 3000, 1, 1536]
    - [47, 58.484]
  - - [512, 4, 1, 500000]
    - [134, 2.037]
  - - [512, 6000, 1, 2816]
    - [110, 67.17]
  - - [128, 50176, 1, 512]
    - [80, 44.21]
  - - [256, 12544, 1, 1024]
    - [22, 53.46]
  - - [1024, 12544, 1, 256]
    - [7, 43.948]
  - - [512, 48000, 1, 2560]
    - [18, 86.717]
  - - [2560, 16, 1, 2560]
    - [19, 4.509]
  - - [2048, 64, 1, 2048]
    - [8, 11.456]
  - - [512, 2, 1, 512]
    - [55, 0.045]
  - - [1024, 1, 1, 512]
    - [19, 0.047]
  - - [512, 1500, 1, 2560]
    - [15, 51.039]
  - - [512, 24000, 1, 1536]
    - [64, 72.182]
  - - [1024, 1, 1, 500000]
    - [134, 0.547]
  - - [6144, 16, 1, 2560]
    - [135, 9.743]
  - - [1024, 24000, 1, 2048]
    - [18, 85.893]
  - - [4096, 16, 1, 4096]
    - [19, 7.815]
  - - [512, 32, 1, 512]
    - [61, 0.721]
  - - [5124, 1500, 1, 2048]
    - [10, 69.276]
  - - [3072, 1500, 1, 1024]
    - [5, 57.911]
  - - [1024, 2, 1, 500000]
    - [136, 1.061]
  - - [1024, 8, 1, 500000]
    - [126, 4.324]
  - - [7680, 16, 1, 2560]
    - [51, 9.064]
  - - [6144, 1500, 1, 2560]
    - [10, 78.272]
  - - [3072, 1, 1, 1024]
    - [19, 0.216]
  - - [1024, 48000, 1, 2816]
    - [18, 89.529]
  - - [8448, 2, 1, 2816]
    - [51, 1.285]
  - - [4608, 4, 1, 1536]
    - [19, 1.603]
  - - [1024, 6000, 1, 1536]
    - [5, 67.766]
  - - [8448, 32, 1, 2816]
    - [51, 16.752]
  - - [512, 3000, 1, 2048]
    - [64, 57.072]
  - - [6144, 24000, 1, 2560]
    - [18, 90.22]
  - - [4608, 6000, 1, 1536]
    - [18, 82.139]
  - - [1024, 1024, 1, 1024]
    - [49, 35.167]
  - - [512, 1500, 1, 2048]
    - [15, 45.672]
  - - [512, 1500, 1, 1536]
    - [20, 39.911]
  - - [128, 1, 1, 1024]
    - [55, 0.009]
  - - [3072, 3000, 1, 1024]
    - [5, 69.538]
  - - [1024, 48000, 1, 2048]
    - [18, 87.274]
  - - [3136, 64, 128, 64]
    - [124, 15.698]
  - - [784, 512, 64, 128]
    - [137, 30.467]
  - - [3136, 256, 64, 64]
    - [138, 18.902]
  - - [12544, 1024, 1, 256]
    - [63, 42.438]
  - - [784, 128, 128, 512]
    - [129, 43.896]
  - - [784, 512, 256, 128]
    - [137, 33.46]
  - - [3136, 64, 64, 256]
    - [139, 28.586]
  - - [3136, 512, 1, 2048]
    - [64, 57.618]
  - - [12544, 256, 1, 1024]
    - [62, 54.724]
  - - [3136, 2048, 1, 512]
    - [5, 53.23]
  - - [3136, 256, 256, 64]
    - [138, 19.512]
  - - [3136, 64, 128, 256]
    - [140, 29.65]
  - - [784, 128, 64, 512]
    - [22, 38.794]
  - - [3136, 64, 256, 64]
    - [141, 16.129]
  - - [784, 512, 128, 128]
    - [137, 32.328]
  - - [3136, 64, 64, 64]
    - [138, 14.404]
  - - [784, 128, 256, 512]
    - [142, 46.704]
  - - [3136, 64, 256, 256]
    - [140, 29.462]
  - - [3136, 256, 128, 64]
    - [58, 19.251]
  - - [64, 14, 1, 14]
    - [143, 0.001]
  - - [64, 14, 1, 15]
    - [143, 0.001]
  - - [64, 15, 1, 15]
    - [3, 0.001]
  - - [64, 15, 1, 15]
    - [97, 0.001]
  - - [64, 15, 1, 17]
    - [143, 0.002]
  - - [64, 17, 1, 17]
    - [3, 0.002]
  - - [64, 17, 1, 17]
    - [97, 0.002]
  - - [64, 17, 1, 21]
    - [97, 0.002]
  - - [64, 21, 1, 21]
    - [50, 0.003]
  - - [64, 24, 1, 24]
    - [144, 0.004]
  - - [64, 24, 1, 34]
    - [103, 0.005]
  - - [64, 30, 1, 30]
    - [97, 0.005]
  - - [64, 31, 1, 30]
    - [97, 0.006]
  - - [64, 31, 1, 31]
    - [143, 0.006]
  - - [64, 32, 1, 32]
    - [145, 0.008]
  - - [64, 34, 1, 34]
    - [103, 0.008]
  - - [64, 35, 1, 32]
    - [103, 0.009]
  - - [64, 35, 1, 35]
    - [145, 0.008]
  - - [64, 128, 512, 128]
    - [141, 15.67]
  - - [64, 512, 1, 512]
    - [61, 1.432]
  - - [64, 512, 64, 512]
    - [146, 24.943]
  - - [128, 128, 512, 64]
    - [124, 13.178]
  - - [512, 512, 1, 64]
    - [103, 1.688]
  - - [512, 512, 64, 64]
    - [25, 16.709]
  - - [1024, 4, 1, 2]
    - [103, 0.001]
  - - [1024, 4, 1, 1024]
    - [55, 0.295]
  - - [1024, 32, 1, 2]
    - [103, 0.007]
  - - [1024, 32, 1, 1024]
    - [19, 2.408]
  - - [1024, 2048, 1, 2]
    - [138, 0.226]
  - - [1024, 2048, 1, 1024]
    - [88, 48.005]
  - - [1024, 2048, 1, 4096]
    - [69, 74.964]
  - - [1024, 2048, 1, 30528]
    - [88, 89.792]
  - - [1024, 4096, 1, 1024]
    - [37, 56.861]
  - - [1024, 4096, 1, 4096]
    - [147, 78.331]
  - - [1024, 4096, 1, 30528]
    - [148, 91.327]
  - - [4096, 2048, 1, 1024]
    - [16, 66.06]
  - - [4096, 4096, 1, 1024]
    - [117, 73.596]
  - - [32, 33, 1600, 33]
    - [149, 2.379]
  - - [32, 200, 1, 1]
    - [50, 0.001]
  - - [64, 3, 512, 3]
    - [150, 0.027]
  - - [64, 5, 512, 5]
    - [138, 0.063]
  - - [64, 5, 960, 5]
    - [52, 0.091]
  - - [64, 9, 512, 9]
    - [138, 0.198]
  - - [64, 512, 1, 1]
    - [143, 0.003]
  - - [67, 512, 1, 2048]
    - [151, 3.244]
  - - [74, 512, 1, 2048]
    - [152, 3.736]
  - - [74, 960, 1, 2048]
    - [153, 6.691]
  - - [100, 512, 1, 2048]
    - [153, 4.822]
  - - [128, 27, 32768, 27]
    - [154, 4.511]
  - - [256, 1024, 1, 1]
    - [144, 0.025]
  - - [256, 8976, 1, 1536]
    - [5, 56.807]
  - - [256, 8976, 1, 2048]
    - [5, 60.182]
  - - [256, 8976, 1, 2304]
    - [24, 61.875]
  - - [256, 8976, 1, 2560]
    - [155, 63.24]
  - - [256, 8976, 1, 2816]
    - [24, 64.918]
  - - [256, 8976, 1, 3072]
    - [24, 66.609]
  - - [256, 8976, 1, 4352]
    - [155, 71.535]
  - - [256, 8976, 1, 4864]
    - [76, 72.746]
  - - [256, 8976, 1, 5376]
    - [156, 73.213]
  - - [256, 8976, 1, 5632]
    - [155, 73.751]
  - - [256, 8976, 1, 5888]
    - [24, 74.54]
  - - [256, 8976, 1, 6144]
    - [76, 75.029]
  - - [256, 8976, 1, 6656]
    - [76, 75.445]
  - - [256, 8976, 1, 7168]
    - [24, 76.493]
  - - [256, 8976, 1, 7424]
    - [155, 76.451]
  - - [256, 8976, 1, 8192]
    - [24, 77.177]
  - - [256, 8976, 1, 8448]
    - [155, 77.501]
  - - [256, 8976, 1, 8960]
    - [76, 77.736]
  - - [256, 8976, 1, 9472]
    - [76, 78.245]
  - - [256, 8976, 1, 9728]
    - [76, 78.432]
  - - [256, 8976, 1, 9984]
    - [24, 78.397]
  - - [256, 8976, 1, 10240]
    - [24, 79.088]
  - - [256, 8976, 1, 10496]
    - [155, 78.785]
  - - [256, 8976, 1, 11008]
    - [76, 79.228]
  - - [256, 8976, 1, 11520]
    - [76, 79.425]
  - - [256, 8976, 1, 12288]
    - [76, 79.991]
  - - [256, 8976, 1, 14336]
    - [76, 80.806]
  - - [256, 8976, 1, 14848]
    - [76, 80.722]
  - - [256, 8976, 1, 15104]
    - [24, 80.807]
  - - [256, 8976, 1, 15872]
    - [76, 81.031]
  - - [256, 8976, 1, 17152]
    - [76, 81.387]
  - - [256, 8976, 1, 19712]
    - [76, 82.019]
  - - [256, 8976, 1, 19968]
    - [24, 81.925]
  - - [256, 8976, 1, 20480]
    - [24, 81.897]
  - - [256, 8976, 1, 20992]
    - [24, 82.131]
  - - [256, 8976, 1, 22016]
    - [76, 82.294]
  - - [256, 8976, 1, 26112]
    - [76, 82.844]
  - - [256, 8976, 1, 33536]
    - [76, 83.345]
  - - [256, 8976, 1, 44505]
    - [76, 83.214]
  - - [256, 32768, 1, 128]
    - [129, 23.444]
  - - [257, 1024, 1, 4096]
    - [157, 23.628]
  - - [480, 32768, 1, 1024]
    - [27, 69.712]
  - - [512, 200, 1, 1]
    - [52, 0.01]
  - - [512, 200, 1, 32]
    - [103, 0.352]
  - - [512, 215, 1, 2048]
    - [8, 9.961]
  - - [512, 256, 1, 2048]
    - [54, 11.814]
  - - [512, 1600, 1, 32]
    - [124, 2.441]
  - - [512, 1600, 1, 512]
    - [39, 24.233]
  - - [512, 32768, 1, 256]
    - [60, 43.673]
  - - [560, 200, 1, 1024]
    - [8, 6.91]
  - - [560, 1600, 1, 1024]
    - [158, 34.116]
  - - [768, 215, 1, 2048]
    - [54, 14.825]
  - - [768, 256, 1, 2048]
    - [54, 17.583]
  - - [1024, 200, 1, 1]
    - [103, 0.021]
  - - [1024, 512, 1, 1]
    - [83, 0.042]
  - - [1024, 512, 1, 64]
    - [124, 3.024]
  - - [1024, 512, 1, 1024]
    - [15, 23.354]
  - - [1024, 960, 1, 64]
    - [124, 5.137]
  - - [1024, 960, 1, 1024]
    - [158, 36.119]
  - - [1024, 1600, 1, 1]
    - [159, 0.106]
  - - [1024, 1600, 1, 1024]
    - [98, 48.591]
  - - [1024, 1792, 1, 256]
    - [40, 20.594]
  - - [1024, 2048, 1, 256]
    - [40, 24.689]
  - - [1024, 2560, 1, 256]
    - [5, 29.65]
  - - [1024, 3072, 1, 256]
    - [142, 27.831]
  - - [1024, 3328, 1, 256]
    - [142, 29.606]
  - - [1024, 3840, 1, 256]
    - [25, 33.357]
  - - [1024, 4096, 1, 256]
    - [63, 30.782]
  - - [1024, 4608, 1, 256]
    - [67, 34.195]
  - - [1024, 4864, 1, 256]
    - [7, 35.21]
  - - [1024, 5120, 1, 256]
    - [48, 36.614]
  - - [1024, 5632, 1, 256]
    - [36, 35.391]
  - - [1024, 6144, 1, 256]
    - [38, 37.725]
  - - [1024, 6400, 1, 256]
    - [14, 38.497]
  - - [1024, 7168, 1, 256]
    - [21, 38.352]
  - - [1024, 7424, 1, 256]
    - [38, 39.365]
  - - [1024, 7680, 1, 256]
    - [38, 40.723]
  - - [1024, 7936, 1, 256]
    - [38, 38.361]
  - - [1024, 8192, 1, 256]
    - [21, 39.405]
  - - [1024, 8448, 1, 256]
    - [38, 39.73]
  - - [1024, 8704, 1, 256]
    - [16, 40.611]
  - - [1024, 8960, 1, 256]
    - [7, 41.284]
  - - [1024, 9728, 1, 256]
    - [38, 41.459]
  - - [1024, 9984, 1, 256]
    - [38, 42.125]
  - - [1024, 10240, 1, 256]
    - [38, 42.838]
  - - [1024, 10496, 1, 256]
    - [38, 43.784]
  - - [1024, 11008, 1, 256]
    - [7, 42.278]
  - - [1024, 11264, 1, 256]
    - [38, 42.871]
  - - [1024, 11520, 1, 256]
    - [38, 43.901]
  - - [1024, 12288, 1, 256]
    - [38, 43.884]
  - - [1024, 13312, 1, 256]
    - [101, 43.929]
  - - [1024, 13568, 1, 256]
    - [101, 44.328]
  - - [1024, 14336, 1, 256]
    - [7, 45.774]
  - - [1024, 14592, 1, 256]
    - [38, 45.222]
  - - [1024, 14848, 1, 256]
    - [12, 44.793]
  - - [1024, 15104, 1, 256]
    - [38, 45.334]
  - - [1024, 16128, 1, 256]
    - [38, 45.626]
  - - [1024, 17152, 1, 256]
    - [12, 46.052]
  - - [1024, 18944, 1, 256]
    - [7, 46.82]
  - - [1024, 19712, 1, 256]
    - [38, 47.102]
  - - [1024, 19968, 1, 256]
    - [38, 47.029]
  - - [1024, 20480, 1, 256]
    - [38, 47.218]
  - - [1024, 20992, 1, 256]
    - [38, 47.691]
  - - [1024, 21504, 1, 256]
    - [101, 48.371]
  - - [1024, 22016, 1, 256]
    - [38, 47.881]
  - - [1024, 23552, 1, 256]
    - [7, 48.339]
  - - [1024, 28672, 1, 256]
    - [7, 49.119]
  - - [1024, 32768, 1, 512]
    - [60, 64.508]
  - - [1024, 32768, 1, 1024]
    - [14, 77.346]
  - - [1024, 33536, 1, 256]
    - [101, 49.898]
  - - [1024, 40448, 1, 256]
    - [101, 50.835]
  - - [1600, 512, 1, 1024]
    - [20, 35.8]
  - - [2048, 512, 1, 1]
    - [70, 0.074]
  - - [2048, 512, 1, 2048]
    - [49, 48.584]
  - - [2048, 960, 1, 2048]
    - [45, 62.314]
  - - [2048, 1024, 1, 1]
    - [138, 0.114]
  - - [2048, 1024, 1, 256]
    - [40, 24.588]
  - - [3200, 1024, 1, 2048]
    - [93, 68.672]
  - - [4096, 1024, 1, 1]
    - [124, 0.159]
  - - [64, 14, 10880, 14]
    - [124, 1.567]
  - - [64, 14, 10880, 15]
    - [124, 1.651]
  - - [64, 15, 7680, 15]
    - [124, 1.672]
  - - [64, 15, 10880, 15]
    - [124, 1.739]
  - - [64, 15, 7680, 17]
    - [124, 1.776]
  - - [64, 17, 6144, 17]
    - [154, 1.92]
  - - [64, 17, 7680, 17]
    - [154, 1.973]
  - - [64, 17, 6144, 21]
    - [124, 2.336]
  - - [64, 21, 6144, 21]
    - [154, 2.779]
  - - [64, 24, 4736, 24]
    - [124, 3.563]
  - - [64, 24, 4736, 34]
    - [138, 4.66]
  - - [64, 30, 2048, 30]
    - [154, 4.14]
  - - [64, 31, 2048, 30]
    - [124, 4.265]
  - - [64, 31, 2048, 31]
    - [124, 4.211]
  - - [64, 32, 4608, 32]
    - [138, 7.913]
  - - [64, 34, 4736, 34]
    - [70, 3.984]
  - - [64, 35, 4608, 32]
    - [138, 6.461]
  - - [64, 35, 4608, 35]
    - [124, 4.026]
  - - [1024, 3840, 1, 1024]
    - [10, 62.659]
  - - [1024, 3840, 1, 4096]
    - [49, 81.226]
  - - [1024, 3968, 1, 1024]
    - [22, 54.763]
  - - [1024, 3968, 1, 4096]
    - [13, 76.13]
  - - [1024, 3968, 1, 42720]
    - [13, 89.08]
  - - [1024, 6528, 1, 1024]
    - [10, 68.491]
  - - [1024, 6528, 1, 4096]
    - [49, 84.701]
  - - [1024, 6528, 1, 42720]
    - [88, 96.494]
  - - [1024, 7104, 1, 1024]
    - [10, 63.388]
  - - [1024, 7104, 1, 4096]
    - [160, 79.948]
  - - [1024, 7104, 1, 42720]
    - [161, 90.787]
  - - [1024, 7200, 1, 1024]
    - [10, 64.341]
  - - [1024, 7200, 1, 4096]
    - [76, 80.358]
  - - [1024, 7200, 1, 42720]
    - [161, 92.008]
  - - [1024, 8064, 1, 1024]
    - [14, 63.809]
  - - [1024, 8064, 1, 4096]
    - [31, 80.428]
  - - [1024, 8160, 1, 1024]
    - [14, 64.525]
  - - [1024, 8160, 1, 4096]
    - [13, 82.588]
  - - [1024, 9216, 1, 1024]
    - [10, 70.653]
  - - [1024, 9216, 1, 4096]
    - [49, 86.085]
  - - [1024, 9520, 1, 1024]
    - [18, 66.588]
  - - [1024, 9520, 1, 4096]
    - [18, 83.572]
  - - [1024, 9520, 1, 42720]
    - [162, 91.728]
  - - [1024, 10064, 1, 1024]
    - [71, 70.686]
  - - [1024, 10064, 1, 4096]
    - [18, 87.777]
  - - [1024, 10080, 1, 1024]
    - [27, 70.38]
  - - [1024, 10080, 1, 4096]
    - [18, 88.03]
  - - [1024, 10080, 1, 42720]
    - [163, 94.503]
  - - [1024, 10200, 1, 1024]
    - [18, 70.551]
  - - [1024, 10200, 1, 4096]
    - [18, 88.718]
  - - [4096, 3840, 1, 1024]
    - [14, 73.199]
  - - [4096, 3968, 1, 1024]
    - [21, 69.914]
  - - [4096, 6528, 1, 1024]
    - [14, 75.405]
  - - [4096, 7104, 1, 1024]
    - [21, 75.252]
  - - [4096, 7200, 1, 1024]
    - [21, 75.424]
  - - [4096, 8064, 1, 1024]
    - [14, 75.879]
  - - [4096, 8160, 1, 1024]
    - [14, 76.63]
  - - [4096, 9216, 1, 1024]
    - [18, 77.547]
  - - [4096, 9520, 1, 1024]
    - [21, 76.184]
  - - [4096, 10064, 1, 1024]
    - [18, 77.531]
  - - [4096, 10080, 1, 1024]
    - [18, 77.415]
  - - [4096, 10200, 1, 1024]
    - [18, 78.082]
  - - [64, 27, 1920, 27]
    - [124, 3.287]
  - - [64, 33, 1920, 27]
    - [138, 2.687]
  - - [64, 33, 1920, 33]
    - [154, 3.134]
  - - [1024, 3240, 1, 1024]
    - [17, 54.216]
  - - [1024, 3240, 1, 4096]
    - [90, 77.249]
  - - [1024, 3960, 1, 1024]
    - [88, 54.589]
  - - [1024, 3960, 1, 4096]
    - [13, 75.792]
  - - [1024, 3960, 1, 42720]
    - [31, 88.908]
  - - [4096, 3240, 1, 1024]
    - [21, 71.08]
  - - [4096, 3960, 1, 1024]
    - [18, 70.06]
  - - [64, 192, 64, 1280]
    - [164, 26.498]
  - - [64, 320, 64, 1280]
    - [15, 30.635]
  - - [64, 384, 64, 1280]
    - [15, 34.109]
  - - [64, 448, 64, 1280]
    - [9, 30.487]
  - - [64, 192, 64, 2048]
    - [30, 27.917]
  - - [64, 320, 64, 2048]
    - [34, 33.271]
  - - [64, 384, 64, 2048]
    - [9, 35.546]
  - - [64, 448, 64, 2048]
    - [158, 33.156]
  - - [1225, 32, 64, 192]
    - [165, 12.983]
  - - [1225, 48, 64, 192]
    - [165, 13.004]
  - - [1225, 64, 64, 192]
    - [164, 18.15]
  - - [1225, 48, 64, 256]
    - [166, 14.828]
  - - [1225, 64, 64, 256]
    - [167, 21.408]
  - - [1225, 48, 64, 288]
    - [98, 15.555]
  - - [1225, 64, 64, 288]
    - [98, 23.093]
  - - [5329, 80, 64, 64]
    - [166, 10.757]
  - - [289, 128, 64, 768]
    - [168, 28.771]
  - - [289, 160, 64, 768]
    - [98, 27.241]
  - - [289, 192, 64, 768]
    - [169, 34.066]
  - - [64, 192, 32, 1280]
    - [87, 22.592]
  - - [64, 320, 32, 1280]
    - [20, 27.716]
  - - [64, 384, 32, 1280]
    - [15, 30.652]
  - - [64, 448, 32, 1280]
    - [170, 25.944]
  - - [64, 192, 32, 2048]
    - [34, 25.849]
  - - [64, 320, 32, 2048]
    - [15, 29.65]
  - - [64, 384, 32, 2048]
    - [57, 32.873]
  - - [64, 448, 32, 2048]
    - [74, 27.423]
  - - [1225, 32, 32, 192]
    - [166, 10.641]
  - - [1225, 48, 32, 192]
    - [165, 10.971]
  - - [1225, 64, 32, 192]
    - [164, 15.461]
  - - [1225, 48, 32, 256]
    - [165, 12.306]
  - - [1225, 64, 32, 256]
    - [98, 17.606]
  - - [1225, 48, 32, 288]
    - [166, 13.448]
  - - [1225, 64, 32, 288]
    - [98, 19.199]
  - - [5329, 80, 32, 64]
    - [166, 10.058]
  - - [289, 128, 32, 768]
    - [98, 26.673]
  - - [289, 160, 32, 768]
    - [171, 23.842]
  - - [289, 192, 32, 768]
    - [172, 30.008]
  - - [49, 2048, 64, 512]
    - [168, 20.435]
  - - [49, 512, 64, 2048]
    - [34, 24.12]
  - - [3136, 256, 32, 64]
    - [178, 17.88]
  - - [3136, 64, 32, 64]
    - [138, 12.723]
  - - [3136, 64, 32, 256]
    - [139, 26.924]
  - - [784, 512, 32, 128]
    - [25, 27.443]
  - - [784, 128, 32, 512]
    - [43, 33.927]
  - - [196, 1024, 32, 256]
    - [173, 23.301]
  - - [196, 256, 32, 1024]
    - [10, 31.397]
  - - [49, 2048, 32, 512]
    - [132, 19.665]
  - - [49, 512, 32, 2048]
    - [174, 20.651]
  - - [3136, 128, 64, 64]
    - [179, 17.393]
  - - [3136, 256, 64, 128]
    - [58, 31.107]
  - - [784, 512, 64, 256]
    - [142, 43.306]
  - - [3136, 128, 64, 256]
    - [129, 39.392]
  - - [3136, 256, 64, 256]
    - [18, 45.5]
  - - [196, 1024, 64, 512]
    - [10, 36.465]
  - - [784, 256, 64, 512]
    - [58, 48.271]
  - - [784, 512, 64, 512]
    - [175, 54.988]
  - - [196, 512, 64, 1024]
    - [176, 42.389]
  - - [196, 1024, 64, 1024]
    - [10, 48.224]
  - - [49, 2048, 64, 1024]
    - [132, 24.865]
  - - [49, 1024, 64, 2048]
    - [177, 27.961]
  - - [3136, 128, 32, 64]
    - [138, 15.259]
  - - [3136, 256, 32, 128]
    - [178, 29.103]
  - - [784, 512, 32, 256]
    - [58, 38.632]
  - - [3136, 128, 32, 256]
    - [178, 34.754]
  - - [3136, 256, 32, 256]
    - [179, 42.979]
  - - [196, 1024, 32, 512]
    - [169, 34.02]
  - - [784, 256, 32, 512]
    - [25, 42.148]
  - - [784, 512, 32, 512]
    - [58, 50.405]
  - - [196, 512, 32, 1024]
    - [180, 36.074]
  - - [196, 1024, 32, 1024]
    - [169, 44.475]
  - - [49, 2048, 32, 1024]
    - [181, 24.089]
  - - [49, 1024, 32, 2048]
    - [34, 24.47]
  - - [7680, 8192, 1, 8192]
    - [182, 94.708]
  - - [3840, 4096, 1, 4096]
    - [24, 86.647]
  - - [1920, 2048, 1, 2048]
    - [5, 72.934]
  - - [960, 1024, 1, 1024]
    - [158, 36.703]
  - - [480, 512, 1, 512]
    - [50, 8.86]
  - - [8192, 7680, 1, 8192]
    - [13, 95.389]
  - - [4096, 3840, 1, 4096]
    - [130, 88.077]
  - - [2048, 1920, 1, 2048]
    - [49, 71.78]
  - - [512, 480, 1, 512]
    - [51, 8.861]
  - - [8192, 8192, 1, 8192]
    - [117, 95.699]
  - - [4096, 4096, 1, 4096]
    - [18, 87.751]
  - - [2048, 2048, 1, 2048]
    - [88, 68.443]
  - - [512, 512, 1, 512]
    - [51, 9.165]
  - - [64, 512, 16, 512]
    - [26, 12.815]
  - - [64, 512, 128, 512]
    - [20, 29.687]
  - - [1024, 8, 1, 1024]
    - [55, 0.594]
  - - [1024, 77, 1, 1024]
    - [19, 5.65]
  - - [1024, 77, 1, 30522]
    - [183, 24.852]
  - - [1024, 512, 1, 2]
    - [124, 0.086]
  - - [1024, 512, 1, 4096]
    - [9, 40.527]
  - - [1024, 616, 1, 1024]
    - [39, 27.358]
  - - [1024, 4096, 1, 2]
    - [179, 0.32]
  - - [4096, 512, 1, 1024]
    - [5, 48.005]
  - - [64, 128, 128, 128]
    - [124, 9.22]
  - - [64, 128, 160, 128]
    - [124, 10.501]
  - - [1024, 10, 1, 2]
    - [51, 0.002]
  - - [1024, 10, 1, 1024]
    - [66, 0.734]
  - - [1024, 160, 1, 1024]
    - [54, 10.054]
  - - [1024, 200, 1, 1024]
    - [44, 11.582]
  - - [1024, 200, 1, 30522]
    - [184, 40.083]
  - - [1024, 1024, 1, 2]
    - [124, 0.154]
  - - [1024, 1024, 1, 4096]
    - [49, 57.675]
  - - [1024, 1280, 1, 2]
    - [124, 0.181]
  - - [1024, 1280, 1, 1024]
    - [98, 39.482]
  - - [1024, 1280, 1, 4096]
    - [64, 59.301]
  - - [4096, 1024, 1, 1024]
    - [22, 56.398]
  - - [4096, 1280, 1, 1024]
    - [137, 62.941]
  - - [64, 128, 624, 128]
    - [154, 15.326]
  - - [1024, 39, 1, 2]
    - [50, 0.008]
  - - [1024, 39, 1, 1024]
    - [19, 2.844]
  - - [1024, 780, 1, 1024]
    - [39, 32.677]
  - - [1024, 780, 1, 30522]
    - [84, 68.717]
  - - [1024, 4992, 1, 2]
    - [137, 0.372]
  - - [1024, 4992, 1, 1024]
    - [10, 64.312]
  - - [1024, 4992, 1, 4096]
    - [160, 82.713]
  - - [4096, 4992, 1, 1024]
    - [18, 74.182]
  - - [1024, 308, 1, 1024]
    - [30, 17.494]
  - - [1024, 308, 1, 30522]
    - [185, 42.005]
  - - [64, 128, 640, 128]
    - [43, 15.654]
  - - [1024, 40, 1, 2]
    - [51, 0.009]
  - - [1024, 40, 1, 1024]
    - [19, 2.917]
  - - [1024, 800, 1, 1024]
    - [39, 33.278]
  - - [1024, 800, 1, 30522]
    - [84, 70.514]
  - - [1024, 5120, 1, 2]
    - [137, 0.381]
  - - [1024, 5120, 1, 1024]
    - [5, 64.83]
  - - [1024, 5120, 1, 4096]
    - [76, 83.864]
  - - [4096, 5120, 1, 1024]
    - [18, 76.906]
  - - [64, 128, 656, 128]
    - [96, 15.913]
  - - [1024, 41, 1, 2]
    - [51, 0.009]
  - - [1024, 41, 1, 1024]
    - [127, 2.99]
  - - [1024, 820, 1, 1024]
    - [39, 33.29]
  - - [1024, 820, 1, 30522]
    - [84, 72.007]
  - - [1024, 5248, 1, 2]
    - [92, 0.381]
  - - [1024, 5248, 1, 1024]
    - [5, 65.956]
  - - [1024, 5248, 1, 4096]
    - [64, 83.726]
  - - [4096, 5248, 1, 1024]
    - [21, 73.83]
  - - [64, 512, 80, 512]
    - [173, 27.494]
  - - [1024, 5, 1, 2]
    - [103, 0.001]
  - - [1024, 5, 1, 1024]
    - [55, 0.369]
  - - [1024, 385, 1, 1024]
    - [39, 18.565]
  - - [1024, 385, 1, 30522]
    - [186, 40.982]
  - - [1024, 2560, 1, 2]
    - [40, 0.266]
  - - [1024, 2560, 1, 1024]
    - [5, 58.384]
  - - [1024, 2560, 1, 4096]
    - [49, 77.947]
  - - [4096, 2560, 1, 1024]
    - [117, 73.629]
  - - [64, 512, 96, 512]
    - [43, 28.895]
  - - [1024, 6, 1, 2]
    - [103, 0.001]
  - - [1024, 6, 1, 1024]
    - [55, 0.451]
  - - [1024, 462, 1, 1024]
    - [39, 21.155]
  - - [1024, 462, 1, 30522]
    - [186, 48.117]
  - - [1024, 3072, 1, 2]
    - [137, 0.295]
  - - [1024, 3072, 1, 1024]
    - [110, 53.449]
  - - [1024, 3072, 1, 4096]
    - [18, 75.412]
  - - [4096, 3072, 1, 1024]
    - [187, 70.676]
  - - [1024, 8, 1, 2]
    - [143, 0.002]
  - - [1024, 160, 1, 30522]
    - [183, 38.275]
  - - [64, 128, 144, 128]
    - [124, 9.89]
  - - [1024, 9, 1, 2]
    - [51, 0.002]
  - - [1024, 9, 1, 1024]
    - [55, 0.669]
  - - [1024, 180, 1, 1024]
    - [54, 11.371]
  - - [1024, 180, 1, 30522]
    - [183, 42.856]
  - - [1024, 1152, 1, 2]
    - [124, 0.158]
  - - [1024, 1152, 1, 1024]
    - [49, 41.492]
  - - [1024, 1152, 1, 4096]
    - [4, 67.042]
  - - [4096, 1152, 1, 1024]
    - [5, 58.915]
  - - [479, 32768, 1, 1024]
    - [176, 56.606]
  - - [64, 4, 32768, 4]
    - [124, 0.148]
  - - [64, 4, 38400, 4]
    - [124, 0.149]
  - - [1024, 8192, 1, 1024]
    - [14, 65.127]
  - - [1024, 8192, 1, 4096]
    - [13, 81.601]
  - - [1024, 8192, 1, 33712]
    - [31, 91.443]
  - - [1024, 9600, 1, 1024]
    - [18, 67.307]
  - - [1024, 9600, 1, 4096]
    - [18, 84.009]
  - - [1024, 9600, 1, 33712]
    - [188, 90.325]
  - - [4096, 8192, 1, 1024]
    - [18, 75.756]
  - - [4096, 9600, 1, 1024]
    - [21, 76.591]
  - - [128, 128, 1, 64]
    - [66, 0.123]
  - - [64, 128, 1, 128]
    - [145, 0.111]
  - - [64, 5, 1, 5]
    - [189, 0.0]
  - - [32, 33, 1, 33]
    - [97, 0.004]
  - - [1024, 1024, 64, 64]
    - [36, 20.323]
  - - [64, 1024, 32, 1024]
    - [57, 31.504]
  - - [1024, 16384, 1, 3072]
    - [18, 85.531]
  - - [1024, 2048, 1, 30592]
    - [69, 87.065]
  - - [640, 2048, 1, 2560]
    - [4, 62.902]
  - - [1024, 1024, 64, 96]
    - [36, 28.298]
  - - [2048, 2, 1, 2048]
    - [19, 0.428]
  - - [2048, 2, 1, 2]
    - [51, 0.001]
  - - [1536, 4096, 1, 4608]
    - [49, 80.689]
  - - [512, 512, 256, 64]
    - [36, 19.488]
  - - [2048, 1024, 1, 8192]
    - [190, 75.875]
  - - [4096, 16384, 1, 1024]
    - [18, 80.809]
  - - [1024, 8192, 1, 50304]
    - [31, 92.459]
  - - [1536, 8192, 1, 50304]
    - [191, 94.441]
  - - [6144, 8192, 1, 1536]
    - [18, 87.083]
  - - [1024, 4096, 1, 30592]
    - [148, 91.23]
  - - [1536, 4096, 1, 6144]
    - [49, 82.717]
  - - [1024, 16384, 1, 4096]
    - [18, 87.602]
  - - [1024, 16384, 1, 50304]
    - [192, 93.29]
  - - [1024, 4096, 1, 3072]
    - [148, 74.56]
  - - [1536, 8192, 1, 1536]
    - [64, 74.573]
  - - [1024, 2048, 1, 3072]
    - [74, 70.744]
  - - [2560, 2048, 1, 7680]
    - [24, 88.69]
  - - [96, 1024, 64, 1024]
    - [133, 45.111]
  - - [2048, 1024, 1, 2048]
    - [5, 56.728]
  - - [2048, 1024, 1, 30592]
    - [190, 83.302]
  - - [64, 1024, 256, 1024]
    - [20, 40.358]
  - - [8192, 1024, 1, 2048]
    - [47, 74.103]
  - - [2560, 2048, 1, 2560]
    - [64, 77.388]
  - - [1536, 8192, 1, 4608]
    - [47, 86.432]
  - - [64, 512, 256, 512]
    - [96, 31.627]
  - - [1024, 2048, 1, 50304]
    - [88, 87.788]
  - - [1024, 1024, 32, 64]
    - [36, 18.991]
  - - [1536, 8192, 1, 6144]
    - [64, 89.188]
  - - [1024, 1024, 256, 64]
    - [36, 21.357]
  - - [512, 512, 40, 64]
    - [142, 14.913]
  - - [1536, 4096, 1, 50304]
    - [4, 89.472]
  - - [1024, 1024, 128, 96]
    - [36, 29.226]
  - - [1024, 8192, 1, 3072]
    - [31, 78.532]
  - - [64, 1024, 64, 1024]
    - [193, 37.08]
  - - [1024, 1024, 128, 64]
    - [36, 20.934]
  - - [64, 1024, 128, 1024]
    - [194, 38.836]
  - - [1024, 4096, 1, 50304]
    - [13, 92.166]
  - - [96, 1024, 128, 1024]
    - [133, 48.373]
  - - [6144, 4096, 1, 1536]
    - [18, 85.712]
  - - [1024, 16, 1, 2]
    - [51, 0.003]
  - - [1024, 16, 1, 1024]
    - [66, 1.189]
  - - [2560, 4, 1, 2]
    - [51, 0.002]
  - - [1024, 16384, 1, 1024]
    - [18, 73.289]
  - - [2560, 2048, 1, 1920]
    - [5, 74.126]
  - - [2048, 1024, 1, 6144]
    - [190, 72.295]
  - - [2560, 4, 1, 2560]
    - [19, 1.154]
  - - [512, 512, 128, 64]
    - [36, 17.975]
  - - [1024, 8192, 1, 30592]
    - [31, 91.705]
  - - [1536, 4096, 1, 1536]
    - [18, 69.703]
  - - [64, 512, 40, 512]
    - [43, 24.156]
  - - [1024, 1, 1, 2]
    - [103, 0.0]
  - - [1024, 1, 1, 1024]
    - [66, 0.075]
  - - [1024, 1, 1, 200]
    - [51, 0.018]
  - - [1024, 1, 1, 1600]
    - [91, 0.097]
  - - [2048, 1, 1, 512]
    - [19, 0.088]
  - - [128, 128, 1024, 64]
    - [129, 13.794]
  - - [64, 128, 1024, 128]
    - [141, 17.869]
  - - [1024, 64, 1, 2]
    - [103, 0.014]
  - - [1024, 8192, 1, 30528]
    - [31, 91.767]
  - - [1024, 64, 1, 1024]
    - [19, 4.639]
  - - [1024, 3456, 1, 1024]
    - [195, 58.577]
  - - [1024, 3456, 1, 512]
    - [22, 45.264]
  - - [1024, 4096, 1, 512]
    - [37, 44.639]
  - - [1024, 6912, 1, 1024]
    - [27, 70.515]
  - - [1024, 6912, 1, 512]
    - [18, 55.025]
  - - [1024, 864, 1, 1024]
    - [158, 33.248]
  - - [1024, 864, 1, 512]
    - [158, 21.81]
  - - [256, 3456, 1, 128]
    - [39, 8.68]
  - - [256, 4096, 1, 128]
    - [124, 9.334]
  - - [256, 55296, 1, 128]
    - [104, 26.005]
  - - [256, 6912, 1, 128]
    - [140, 14.176]
  - - [256, 864, 1, 128]
    - [51, 2.874]
  - - [480, 3456, 1, 1024]
    - [37, 48.574]
  - - [480, 4096, 1, 1024]
    - [86, 45.916]
  - - [480, 6912, 1, 1024]
    - [37, 54.838]
  - - [480, 864, 1, 1024]
    - [54, 20.985]
  - - [512, 3456, 1, 256]
    - [37, 25.518]
  - - [512, 4096, 1, 256]
    - [5, 23.353]
  - - [512, 55296, 1, 256]
    - [75, 46.715]
  - - [512, 6912, 1, 256]
    - [142, 30.288]
  - - [512, 864, 1, 256]
    - [82, 8.621]
  - - [1024, 640, 1, 30528]
    - [20, 66.141]
  - - [1024, 1280, 1, 30528]
    - [133, 82.506]
  - - [1024, 1600, 1, 30528]
    - [102, 87.762]
  - - [1024, 10240, 1, 1024]
    - [117, 73.184]
  - - [1024, 10240, 1, 4096]
    - [117, 89.926]
  - - [4096, 10240, 1, 1024]
    - [18, 78.939]
  - - [1024, 80, 1, 1024]
    - [19, 5.87]
  - - [1024, 80, 1, 2]
    - [103, 0.017]
  - - [128, 128, 1280, 64]
    - [115, 14.199]
  - - [64, 128, 1280, 128]
    - [196, 16.636]
  - - [1024, 1640, 1, 30528]
    - [17, 89.956]
  - - [1024, 10496, 1, 1024]
    - [117, 74.653]
  - - [1024, 10496, 1, 4096]
    - [18, 92.157]
  - - [4096, 10496, 1, 1024]
    - [18, 80.952]
  - - [1024, 82, 1, 1024]
    - [19, 5.943]
  - - [1024, 82, 1, 2]
    - [103, 0.018]
  - - [128, 128, 1312, 64]
    - [142, 14.285]
  - - [64, 128, 1312, 128]
    - [196, 16.829]
  - - [1024, 160, 1, 30528]
    - [197, 40.717]
  - - [1024, 240, 1, 30528]
    - [198, 50.105]
  - - [1024, 6144, 1, 4096]
    - [18, 80.403]
  - - [1024, 12, 1, 1024]
    - [55, 0.875]
  - - [4096, 6144, 1, 1024]
    - [18, 79.916]
  - - [1024, 6144, 1, 1024]
    - [10, 64.923]
  - - [1024, 12, 1, 2]
    - [103, 0.003]
  - - [512, 512, 192, 64]
    - [187, 18.678]
  - - [64, 512, 192, 512]
    - [59, 30.834]
  - - [256, 4096, 1, 1]
    - [154, 0.08]
  - - [256, 6912, 1, 1]
    - [199, 0.116]
  - - [1024, 10224, 1, 1024]
    - [18, 70.142]
  - - [1024, 10192, 1, 1024]
    - [18, 70.208]
  - - [1024, 10208, 1, 1024]
    - [56, 70.073]
  - - [1024, 10224, 1, 4096]
    - [18, 89.09]
  - - [1024, 10224, 1, 3072]
    - [18, 86.07]
  - - [4096, 10224, 1, 1024]
    - [18, 78.419]
  - - [1024, 10240, 1, 3072]
    - [18, 87.556]
  - - [1024, 10192, 1, 3072]
    - [27, 86.251]
  - - [4096, 10192, 1, 1024]
    - [18, 77.92]
  - - [1024, 10192, 1, 4096]
    - [18, 88.681]
  - - [1024, 10200, 1, 3072]
    - [18, 86.298]
  - - [1024, 10184, 1, 1024]
    - [18, 70.317]
  - - [4096, 10208, 1, 1024]
    - [18, 77.942]
  - - [1024, 10208, 1, 3072]
    - [27, 85.935]
  - - [1024, 10208, 1, 4096]
    - [18, 88.836]
  - - [1024, 10224, 1, 2048]
    - [18, 81.86]
  - - [1024, 10240, 1, 2048]
    - [18, 83.719]
  - - [1024, 10120, 1, 1024]
    - [18, 70.701]
  - - [1024, 10192, 1, 2048]
    - [18, 81.301]
  - - [64, 24, 6816, 24]
    - [124, 3.805]
  - - [1024, 10152, 1, 1024]
    - [27, 69.973]
  - - [1024, 10080, 1, 3072]
    - [18, 85.63]
  - - [64, 26, 6272, 26]
    - [124, 4.294]
  - - [100352, 512, 1, 256]
    - [200, 46.252]
  - - [12544, 2048, 1, 1024]
    - [21, 73.127]
  - - [12544, 64, 1, 147]
    - [124, 7.821]
  - - [200704, 512, 1, 256]
    - [200, 43.382]
  - - [25088, 1024, 1, 512]
    - [63, 60.561]
  - - [3136, 64, 1, 576]
    - [54, 8.192]
  - - [50176, 1024, 1, 512]
    - [201, 64.334]
  - - [6272, 2048, 1, 1024]
    - [16, 69.902]
  - - [784, 128, 1, 1152]
    - [127, 7.485]
  - - [3136, 128, 128, 256]
    - [77, 38.018]
  - - [3136, 128, 256, 256]
    - [58, 43.123]
  - - [784, 256, 128, 512]
    - [129, 52.644]
  - - [784, 256, 256, 512]
    - [142, 55.029]
  - - [128, 128, 2048, 64]
    - [121, 14.825]
  - - [64, 128, 2048, 128]
    - [141, 17.003]
  - - [1024, 2560, 1, 30528]
    - [202, 91.993]
  - - [1024, 128, 1, 1024]
    - [54, 8.174]
  - - [1024, 128, 1, 2]
    - [103, 0.027]
  - - [128, 128, 1536, 64]
    - [203, 14.563]
  - - [64, 128, 1536, 128]
    - [204, 17.055]
  - - [1024, 12288, 1, 4096]
    - [33, 85.393]
  - - [1024, 12288, 1, 1024]
    - [205, 69.259]
  - - [4096, 12288, 1, 1024]
    - [18, 81.201]
  - - [1024, 1920, 1, 30528]
    - [88, 84.899]
  - - [1024, 96, 1, 1024]
    - [19, 7.088]
  - - [1024, 96, 1, 2]
    - [145, 0.02]
  - - [128, 128, 192, 64]
    - [124, 9.652]
  - - [64, 128, 192, 128]
    - [43, 11.938]
  - - [768, 2048, 1, 2]
    - [159, 0.201]
  - - [3072, 2048, 1, 768]
    - [5, 59.625]
  - - [768, 2048, 1, 3072]
    - [47, 66.469]
  - - [768, 2048, 1, 768]
    - [98, 41.241]
  - - [384, 384, 144, 64]
    - [115, 17.107]
  - - [64, 384, 144, 384]
    - [43, 25.819]
  - - [768, 4608, 1, 2]
    - [179, 0.315]
  - - [3072, 4608, 1, 768]
    - [18, 69.952]
  - - [768, 4608, 1, 3072]
    - [206, 80.477]
  - - [768, 4608, 1, 768]
    - [22, 52.887]
  - - [512, 512, 48, 64]
    - [137, 15.697]
  - - [64, 512, 48, 512]
    - [43, 27.494]
  - - [128, 128, 256, 64]
    - [124, 10.429]
  - - [64, 128, 256, 128]
    - [124, 12.395]
  - - [384, 384, 192, 64]
    - [36, 17.389]
  - - [64, 384, 192, 384]
    - [96, 24.536]
  - - [1024, 4608, 1, 2]
    - [137, 0.352]
  - - [4096, 4608, 1, 1024]
    - [21, 73.466]
  - - [1024, 4608, 1, 4096]
    - [155, 76.836]
  - - [1024, 4608, 1, 1024]
    - [10, 59.822]
  - - [8192, 1024, 1, 1024]
    - [137, 64.39]
  - - [8192, 4096, 1, 1024]
    - [18, 75.92]
  - - [196, 256, 1, 2304]
    - [207, 5.088]
  - - [49, 512, 1, 4608]
    - [208, 3.323]
  - - [196, 1024, 128, 256]
    - [176, 27.783]
  - - [196, 1024, 256, 256]
    - [169, 28.848]
  - - [196, 256, 128, 1024]
    - [10, 40.824]
  - - [196, 256, 256, 1024]
    - [10, 42.719]
  - - [196, 512, 128, 1024]
    - [209, 44.69]
  - - [196, 512, 256, 1024]
    - [205, 47.331]
  - - [49, 2048, 128, 512]
    - [168, 21.602]
  - - [49, 2048, 256, 512]
    - [132, 21.883]
  - - [49, 512, 128, 2048]
    - [177, 27.392]
  - - [49, 512, 256, 2048]
    - [177, 28.184]
  - - [3072, 256, 2, 1024]
    - [22, 47.01]
  - - [768, 2048, 2, 512]
    - [22, 41.715]
  - - [2904, 256, 2, 1024]
    - [22, 45.141]
  - - [864, 2048, 2, 512]
    - [5, 42.707]
  - - [2992, 256, 2, 1024]
    - [37, 46.265]
  - - [3400, 256, 2, 1024]
    - [37, 49.466]
  - - [4032, 256, 2, 1024]
    - [5, 47.443]
  - - [3400, 256, 1, 1024]
    - [59, 35.736]
  - - [15200, 128, 2, 512]
    - [78, 38.902]
  - - [12288, 128, 2, 512]
    - [78, 39.62]
  - - [888, 2048, 2, 512]
    - [5, 44.546]
  - - [13600, 128, 2, 512]
    - [78, 41.495]
  - - [12880, 128, 2, 512]
    - [35, 40.127]
  - - [3456, 256, 2, 1024]
    - [37, 51.681]
  - - [2944, 256, 2, 1024]
    - [98, 45.052]
  - - [2688, 256, 2, 1024]
    - [98, 41.348]
  - - [13824, 128, 2, 512]
    - [78, 43.434]
  - - [3800, 256, 1, 1024]
    - [49, 32.437]
  - - [3168, 256, 2, 1024]
    - [22, 48.229]
  - - [3360, 256, 2, 1024]
    - [22, 49.743]
  - - [3552, 256, 2, 1024]
    - [190, 40.427]
  - - [11616, 128, 2, 512]
    - [65, 37.209]
  - - [4200, 256, 2, 1024]
    - [5, 49.42]
  - - [840, 2048, 2, 512]
    - [5, 42.409]
  - - [14208, 128, 2, 512]
    - [65, 38.01]
  - - [11968, 128, 2, 512]
    - [22, 38.505]
  - - [3264, 256, 2, 1024]
    - [22, 50.078]
  - - [13600, 256, 2, 512]
    - [90, 50.908]
  - - [12880, 256, 2, 512]
    - [210, 48.707]
  - - [12288, 256, 2, 512]
    - [200, 50.972]
  - - [2816, 256, 2, 1024]
    - [98, 42.981]
  - - [672, 2048, 2, 512]
    - [22, 36.925]
  - - [13440, 128, 2, 512]
    - [78, 42.408]
  - - [13824, 256, 2, 512]
    - [211, 56.393]
  - - [15200, 256, 2, 512]
    - [60, 47.555]
  - - [864, 512, 2, 2048]
    - [158, 45.874]
  - - [3600, 256, 2, 1024]
    - [5, 41.943]
  - - [888, 512, 2, 2048]
    - [4, 42.301]
  - - [4032, 1024, 2, 256]
    - [25, 38.853]
  - - [16128, 128, 2, 512]
    - [65, 41.784]
  - - [51520, 64, 2, 256]
    - [140, 26.751]
  - - [46464, 64, 2, 256]
    - [199, 28.121]
  - - [768, 3, 2, 256]
    - [66, 0.112]
  - - [768, 12, 2, 256]
    - [66, 0.439]
  - - [49152, 64, 2, 256]
    - [199, 28.621]
  - - [864, 12, 2, 256]
    - [55, 0.494]
  - - [864, 3, 2, 256]
    - [19, 0.125]
  - - [15200, 128, 1, 512]
    - [65, 29.849]
  - - [12288, 12, 2, 256]
    - [124, 4.674]
  - - [12288, 3, 2, 256]
    - [212, 1.215]
  - - [13600, 128, 1, 512]
    - [65, 37.191]
  - - [216, 3, 2, 256]
    - [32, 0.033]
  - - [51520, 12, 2, 256]
    - [154, 7.161]
  - - [2904, 1024, 2, 256]
    - [12, 37.209]
  - - [176, 12, 2, 256]
    - [32, 0.105]
  - - [51520, 3, 2, 256]
    - [150, 2.148]
  - - [176, 3, 2, 256]
    - [32, 0.027]
  - - [2992, 1024, 2, 256]
    - [48, 38.337]
  - - [192, 12, 2, 256]
    - [19, 0.114]
  - - [15200, 12, 2, 256]
    - [51, 5.235]
  - - [1536, 512, 1, 1024]
    - [20, 34.368]
  - - [1728, 512, 1, 1024]
    - [9, 39.717]
  - - [1536, 2048, 1, 1024]
    - [22, 53.136]
  - - [24576, 128, 1, 256]
    - [107, 27.577]
  - - [24576, 512, 1, 256]
    - [115, 41.763]
  - - [25760, 128, 1, 256]
    - [37, 27.094]
  - - [25760, 512, 1, 256]
    - [21, 39.584]
  - - [6144, 256, 1, 512]
    - [98, 34.896]
  - - [6440, 256, 1, 512]
    - [22, 37.149]
  - - [1024, 1024, 1, 320]
    - [167, 18.088]
  - - [15200, 3, 2, 256]
    - [150, 1.445]
  - - [51520, 64, 2, 64]
    - [25, 11.458]
  - - [3456, 3, 2, 256]
    - [19, 0.478]
  - - [13600, 12, 2, 256]
    - [124, 4.878]
  - - [12880, 3, 2, 256]
    - [212, 1.274]
  - - [3400, 3, 2, 256]
    - [66, 0.474]
  - - [12880, 12, 2, 256]
    - [124, 4.926]
  - - [13824, 12, 2, 256]
    - [213, 4.833]
  - - [13824, 3, 2, 256]
    - [150, 1.322]
  - - [13600, 3, 2, 256]
    - [212, 1.3]
  - - [13600, 512, 1, 128]
    - [25, 23.462]
  - - [9408, 512, 2, 128]
    - [25, 26.164]
  - - [3456, 12, 2, 256]
    - [135, 1.826]
  - - [56000, 256, 2, 64]
    - [63, 15.475]
  - - [3800, 3, 2, 256]
    - [66, 0.514]
  - - [2816, 1024, 2, 256]
    - [12, 35.618]
  - - [60800, 256, 1, 64]
    - [36, 16.079]
  - - [3400, 12, 2, 256]
    - [66, 1.839]
  - - [3800, 12, 2, 256]
    - [66, 2.023]
  - - [192, 3, 2, 256]
    - [66, 0.028]
  - - [216, 12, 2, 256]
    - [32, 0.127]
  - - [2944, 1024, 2, 256]
    - [16, 36.304]
  - - [55296, 64, 2, 64]
    - [67, 11.924]
  - - [55296, 3, 2, 256]
    - [214, 1.925]
  - - [49152, 64, 2, 64]
    - [48, 11.814]
  - - [11776, 512, 2, 128]
    - [38, 25.955]
  - - [54400, 64, 2, 64]
    - [25, 11.87]
  - - [42240, 64, 2, 256]
    - [78, 30.222]
  - - [3072, 3, 2, 256]
    - [19, 0.439]
  - - [11616, 512, 2, 128]
    - [25, 26.149]
  - - [4200, 1024, 2, 256]
    - [7, 40.406]
  - - [3072, 12, 2, 256]
    - [55, 1.688]
  - - [672, 512, 2, 2048]
    - [9, 40.401]
  - - [54400, 256, 1, 64]
    - [36, 14.877]
  - - [54400, 64, 2, 256]
    - [22, 29.753]
  - - [15200, 512, 1, 128]
    - [25, 23.879]
  - - [56832, 64, 2, 256]
    - [22, 28.315]
  - - [2688, 1024, 2, 256]
    - [12, 33.427]
  - - [54400, 3, 2, 256]
    - [150, 1.937]
  - - [12672, 512, 2, 128]
    - [25, 26.964]
  - - [11968, 512, 2, 128]
    - [137, 26.737]
  - - [46464, 256, 2, 64]
    - [115, 16.306]
  - - [55296, 64, 2, 256]
    - [65, 30.11]
  - - [60800, 64, 2, 64]
    - [63, 12.042]
  - - [2400, 256, 2, 1024]
    - [22, 37.014]
  - - [2520, 256, 2, 1024]
    - [37, 39.589]
  - - [768, 512, 2, 2048]
    - [57, 47.878]
  - - [2400, 1024, 2, 256]
    - [67, 35.53]
  - - [10752, 128, 2, 512]
    - [37, 36.333]
  - - [45632, 256, 2, 64]
    - [36, 15.441]
  - - [2520, 1024, 2, 256]
    - [25, 37.78]
  - - [53760, 256, 2, 64]
    - [115, 16.539]
  - - [43008, 64, 2, 256]
    - [78, 27.71]
  - - [2352, 256, 2, 1024]
    - [22, 37.247]
  - - [47872, 256, 2, 64]
    - [104, 16.517]
  - - [47104, 256, 2, 64]
    - [115, 16.593]
  - - [50688, 256, 2, 64]
    - [36, 17.012]
  - - [45056, 256, 2, 64]
    - [115, 16.308]
  - - [13440, 512, 2, 128]
    - [71, 28.152]
  - - [2352, 1024, 2, 256]
    - [7, 35.9]
  - - [11264, 512, 2, 128]
    - [25, 25.789]
  - - [10560, 128, 2, 512]
    - [99, 36.52]
  - - [16128, 512, 2, 128]
    - [25, 27.157]
  - - [864, 256, 2, 2048]
    - [6, 29.331]
  - - [37632, 256, 2, 64]
    - [36, 16.287]
  - - [51520, 256, 2, 64]
    - [104, 15.59]
  - - [14000, 512, 2, 128]
    - [18, 28.714]
  - - [768, 256, 2, 2048]
    - [34, 31.947]
  - - [60800, 12, 2, 256]
    - [25, 7.05]
  - - [10560, 512, 2, 128]
    - [25, 26.297]
  - - [60800, 3, 2, 256]
    - [150, 2.035]
  - - [64512, 256, 2, 64]
    - [115, 18.167]
  - - [54400, 256, 2, 64]
    - [115, 16.667]
  - - [45632, 64, 2, 256]
    - [140, 24.847]
  - - [3264, 1024, 2, 256]
    - [215, 37.006]
  - - [60800, 64, 2, 256]
    - [199, 28.814]
  - - [10752, 512, 2, 128]
    - [25, 26.115]
  - - [3168, 1024, 2, 256]
    - [5, 36.477]
  - - [55296, 256, 2, 256]
    - [115, 44.306]
  - - [51520, 256, 2, 256]
    - [129, 39.441]
  - - [11408, 128, 2, 512]
    - [178, 37.271]
  - - [60800, 256, 2, 256]
    - [122, 44.251]
  - - [54400, 256, 2, 256]
    - [101, 44.14]
  - - [60800, 256, 2, 64]
    - [104, 17.4]
  - - [3800, 1024, 1, 256]
    - [75, 33.804]
  - - [3400, 1024, 1, 256]
    - [75, 31.089]
  - - [3072, 1024, 2, 256]
    - [67, 37.726]
  - - [3600, 1024, 2, 256]
    - [38, 39.897]
  - - [12288, 512, 2, 128]
    - [25, 26.764]
  - - [49152, 256, 2, 256]
    - [122, 44.53]
  - - [12880, 512, 2, 128]
    - [48, 26.979]
  - - [11408, 512, 2, 128]
    - [58, 26.447]
  - - [42240, 256, 2, 64]
    - [36, 17.08]
  - - [1008, 2048, 2, 512]
    - [14, 45.365]
  - - [3360, 1024, 2, 256]
    - [58, 38.241]
  - - [14208, 512, 2, 128]
    - [25, 27.426]
  - - [56832, 256, 2, 64]
    - [104, 16.92]
  - - [43008, 256, 2, 64]
    - [36, 16.103]
  - - [13600, 512, 2, 128]
    - [18, 27.778]
  - - [2640, 1024, 2, 256]
    - [16, 34.198]
  - - [13824, 512, 2, 128]
    - [71, 28.793]
  - - [3800, 256, 2, 1024]
    - [5, 43.585]
  - - [55296, 256, 2, 64]
    - [115, 16.706]
  - - [2640, 256, 2, 1024]
    - [22, 41.696]
  - - [15200, 512, 2, 128]
    - [137, 26.564]
  - - [3552, 1024, 2, 256]
    - [25, 38.569]
  - - [3456, 1024, 2, 256]
    - [216, 38.301]
  - - [49152, 256, 2, 64]
    - [36, 16.927]
  - - [3400, 1024, 2, 256]
    - [137, 38.327]
  - - [3800, 1024, 2, 256]
    - [48, 41.414]
  - - [6912, 256, 1, 512]
    - [98, 38.373]
  - - [6800, 256, 1, 512]
    - [22, 38.327]
  - - [27648, 128, 1, 256]
    - [187, 29.672]
  - - [27200, 128, 1, 256]
    - [37, 28.207]
  - - [30400, 128, 1, 256]
    - [199, 25.86]
  - - [7600, 256, 1, 512]
    - [5, 33.402]
  - - [6144, 1024, 1, 512]
    - [63, 51.478]
  - - [6912, 1024, 1, 512]
    - [122, 56.16]
  - - [6440, 1024, 1, 512]
    - [90, 54.813]
  - - [27648, 512, 1, 256]
    - [217, 43.159]
  - - [1728, 2048, 1, 1024]
    - [5, 57.103]
  - - [27200, 512, 1, 256]
    - [63, 39.418]
  - - [6800, 1024, 1, 512]
    - [137, 51.895]
  - - [7600, 1024, 1, 512]
    - [60, 54.087]
  - - [30400, 512, 1, 256]
    - [63, 39.976]
  - - [1024, 1024, 1, 81]
    - [124, 5.696]
  - - [12544, 1024, 1, 1024]
    - [63, 70.167]
  - - [173280, 128, 1, 64]
    - [58, 13.53]
  - - [231040, 128, 1, 64]
    - [104, 14.169]
  - - [25992, 128, 1, 64]
    - [25, 10.662]
  - - [950, 512, 2, 2048]
    - [10, 35.182]
  - - [2852, 256, 2, 1024]
    - [98, 40.594]
  - - [3220, 256, 2, 1024]
    - [98, 45.942]
  - - [850, 2048, 2, 512]
    - [169, 38.109]
  - - [805, 2048, 2, 512]
    - [10, 36.092]
  - - [3036, 256, 2, 1024]
    - [98, 41.802]
  - - [713, 2048, 2, 512]
    - [169, 31.197]
  - - [850, 512, 2, 2048]
    - [218, 38.622]
  - - [850, 2048, 1, 512]
    - [10, 25.551]
  - - [660, 2048, 2, 512]
    - [98, 32.286]
  - - [726, 2048, 2, 512]
    - [169, 32.488]
  - - [805, 512, 2, 2048]
    - [218, 37.368]
  - - [3500, 256, 2, 1024]
    - [181, 38.643]
  - - [3700, 256, 2, 1024]
    - [10, 36.305]
  - - [748, 2048, 2, 512]
    - [169, 32.668]
  - - [950, 256, 2, 2048]
    - [219, 22.673]
  - - [850, 3, 2, 256]
    - [152, 0.105]
  - - [850, 12, 2, 256]
    - [220, 0.411]
  - - [805, 12, 2, 256]
    - [207, 0.392]
  - - [805, 3, 2, 256]
    - [153, 0.1]
  - - [247, 3, 2, 256]
    - [207, 0.03]
  - - [950, 3, 2, 256]
    - [153, 0.116]
  - - [187, 12, 2, 256]
    - [152, 0.092]
  - - [247, 12, 2, 256]
    - [152, 0.121]
  - - [187, 3, 2, 256]
    - [152, 0.023]
  - - [228, 12, 2, 256]
    - [152, 0.113]
  - - [221, 12, 2, 256]
    - [207, 0.108]
  - - [950, 12, 2, 256]
    - [207, 0.46]
  - - [228, 3, 2, 256]
    - [152, 0.028]
  - - [1900, 512, 1, 1024]
    - [98, 26.722]
  - - [1700, 512, 1, 1024]
    - [164, 28.049]
  - - [1610, 512, 1, 1024]
    - [164, 27.565]
  - - [3036, 1024, 2, 256]
    - [98, 30.499]
  - - [221, 3, 2, 256]
    - [153, 0.027]
  - - [2852, 1024, 2, 256]
    - [167, 30.854]
  - - [3220, 3, 2, 256]
    - [221, 0.379]
  - - [3220, 12, 2, 256]
    - [221, 1.527]
  - - [660, 512, 2, 2048]
    - [219, 31.064]
  - - [726, 512, 2, 2048]
    - [219, 35.151]
  - - [713, 512, 2, 2048]
    - [177, 33.828]
  - - [805, 256, 2, 2048]
    - [222, 25.984]
  - - [950, 2048, 1, 512]
    - [10, 29.075]
  - - [850, 256, 2, 2048]
    - [223, 25.748]
  - - [3700, 1024, 2, 256]
    - [169, 32.965]
  - - [3500, 1024, 2, 256]
    - [176, 34.004]
  - - [3220, 1024, 2, 256]
    - [203, 32.238]
  - - [950, 2048, 2, 512]
    - [98, 36.797]
  - - [1610, 2048, 1, 1024]
    - [98, 49.988]
  - - [1700, 2048, 1, 1024]
    - [10, 52.713]
  - - [1900, 2048, 1, 1024]
    - [10, 52.753]
  - - [100, 128, 120, 512]
    - [164, 17.205]
  - - [100, 128, 139, 512]
    - [167, 19.292]
  - - [100, 128, 160, 512]
    - [175, 20.299]
  - - [100, 128, 18, 512]
    - [174, 7.262]
  - - [100, 128, 19, 512]
    - [174, 7.583]
  - - [1444, 256, 120, 128]
    - [224, 27.96]
  - - [1444, 256, 139, 128]
    - [205, 28.467]
  - - [1444, 256, 160, 128]
    - [205, 28.787]
  - - [1444, 256, 18, 128]
    - [205, 18.927]
  - - [1444, 256, 19, 128]
    - [98, 20.217]
  - - [1444, 256, 120, 256]
    - [225, 41.907]
  - - [1444, 256, 139, 256]
    - [225, 42.127]
  - - [1444, 256, 160, 256]
    - [225, 42.467]
  - - [1444, 256, 18, 256]
    - [175, 30.657]
  - - [1444, 256, 19, 256]
    - [167, 30.787]
  - - [25, 128, 120, 256]
    - [226, 5.829]
  - - [25, 128, 139, 256]
    - [226, 6.414]
  - - [25, 128, 160, 256]
    - [226, 7.032]
  - - [25, 128, 18, 256]
    - [152, 1.195]
  - - [25, 128, 19, 256]
    - [153, 1.244]
  - - [361, 256, 120, 512]
    - [169, 37.454]
  - - [361, 256, 139, 512]
    - [225, 38.177]
  - - [361, 256, 160, 512]
    - [98, 38.948]
  - - [361, 256, 18, 512]
    - [98, 28.559]
  - - [361, 256, 19, 512]
    - [10, 23.338]
  - - [9, 128, 120, 256]
    - [226, 2.144]
  - - [9, 128, 139, 256]
    - [226, 2.356]
  - - [9, 128, 160, 256]
    - [226, 2.712]
  - - [9, 128, 18, 256]
    - [153, 0.437]
  - - [9, 128, 19, 256]
    - [152, 0.457]
  - - [100, 512, 1, 2304]
    - [153, 5.112]
  - - [1444, 128, 1, 576]
    - [227, 6.59]
  - - [200716, 128, 1, 64]
    - [180, 12.654]
  - - [22500, 64, 1, 147]
    - [166, 9.578]
  - - [25, 256, 1, 1152]
    - [152, 0.422]
  - - [27436, 128, 1, 64]
    - [228, 9.208]
  - - [361, 512, 1, 2304]
    - [223, 15.088]
  - - [9, 256, 1, 1152]
    - [207, 0.157]
  - - [64, 16, 16, 16]
    - [52, 0.026]
  - - [64, 32, 16, 32]
    - [103, 0.127]
  - - [64, 48, 16, 48]
    - [145, 0.242]
  - - [64, 64, 16, 64]
    - [103, 0.468]
  - - [64, 80, 16, 80]
    - [145, 0.6]
  - - [64, 96, 16, 96]
    - [97, 0.886]
  - - [64, 112, 16, 112]
    - [103, 1.08]
  - - [64, 128, 16, 128]
    - [61, 1.562]
  - - [64, 144, 16, 144]
    - [143, 1.721]
  - - [64, 160, 16, 160]
    - [97, 2.326]
  - - [64, 176, 16, 176]
    - [143, 2.499]
  - - [64, 208, 16, 208]
    - [97, 3.241]
  - - [64, 224, 16, 224]
    - [50, 4.048]
  - - [64, 240, 16, 240]
    - [145, 4.077]
  - - [64, 256, 16, 256]
    - [26, 5.143]
  - - [64, 272, 16, 272]
    - [145, 5.081]
  - - [64, 288, 16, 288]
    - [26, 6.214]
  - - [64, 304, 16, 304]
    - [145, 6.235]
  - - [64, 320, 16, 320]
    - [26, 7.573]
  - - [64, 336, 16, 336]
    - [26, 7.236]
  - - [64, 352, 16, 352]
    - [26, 8.56]
  - - [64, 368, 16, 368]
    - [26, 8.137]
  - - [64, 384, 16, 384]
    - [54, 9.347]
  - - [64, 400, 16, 400]
    - [79, 8.352]
  - - [64, 416, 16, 416]
    - [26, 10.792]
  - - [64, 432, 16, 432]
    - [26, 10.302]
  - - [64, 448, 16, 448]
    - [26, 12.317]
  - - [64, 464, 16, 464]
    - [39, 10.57]
  - - [64, 480, 16, 480]
    - [26, 13.224]
  - - [64, 496, 16, 496]
    - [39, 11.777]
  - - [1024, 4896, 1, 4096]
    - [24, 80.782]
  - - [1024, 5552, 1, 3072]
    - [18, 69.653]
  - - [1024, 5552, 1, 4096]
    - [45, 72.596]
  - - [1024, 6128, 1, 1024]
    - [5, 63.784]
  - - [1024, 6688, 1, 1024]
    - [56, 67.53]
  - - [1024, 6688, 1, 4096]
    - [27, 86.185]
  - - [4096, 6688, 1, 1024]
    - [18, 76.784]
  - - [1024, 5664, 1, 3072]
    - [10, 72.996]
  - - [1024, 5664, 1, 4096]
    - [10, 74.431]
  - - [1024, 5984, 1, 1024]
    - [5, 62.45]
  - - [1024, 7872, 1, 3072]
    - [10, 84.698]
  - - [1024, 7872, 1, 1024]
    - [10, 69.298]
  - - [1024, 7872, 1, 4096]
    - [24, 88.443]
  - - [1024, 5920, 1, 3072]
    - [18, 74.507]
  - - [1024, 5920, 1, 1024]
    - [5, 62.222]
  - - [1024, 7760, 1, 3072]
    - [24, 82.714]
  - - [1024, 7760, 1, 1024]
    - [5, 68.109]
  - - [1024, 7760, 1, 4096]
    - [155, 86.588]
  - - [4096, 5136, 1, 1024]
    - [21, 73.39]
  - - [1024, 7184, 1, 3072]
    - [24, 76.921]
  - - [1024, 5936, 1, 3072]
    - [18, 74.709]
  - - [1024, 5936, 1, 1024]
    - [5, 62.114]
  - - [1024, 6608, 1, 1024]
    - [110, 64.946]
  - - [1024, 6608, 1, 4096]
    - [18, 84.854]
  - - [1024, 5616, 1, 3072]
    - [10, 71.648]
  - - [1024, 5616, 1, 4096]
    - [45, 73.554]
  - - [1024, 6624, 1, 1024]
    - [56, 64.996]
  - - [1024, 6624, 1, 4096]
    - [18, 84.921]
  - - [1024, 6416, 1, 1024]
    - [5, 66.43]
  - - [1024, 5344, 1, 3072]
    - [10, 67.618]
  - - [1024, 5344, 1, 4096]
    - [45, 70.089]
  - - [1024, 7024, 1, 3072]
    - [77, 82.43]
  - - [1024, 7024, 1, 4096]
    - [77, 86.325]
  - - [1024, 5776, 1, 3072]
    - [10, 72.721]
  - - [1024, 7536, 1, 3072]
    - [24, 80.206]
  - - [1024, 7536, 1, 1024]
    - [5, 66.242]
  - - [1024, 7040, 1, 3072]
    - [77, 85.36]
  - - [1024, 7040, 1, 1024]
    - [11, 65.59]
  - - [1024, 7040, 1, 4096]
    - [72, 88.595]
  - - [1024, 6512, 1, 1024]
    - [5, 66.781]
  - - [1024, 6544, 1, 1024]
    - [14, 64.748]
  - - [1024, 6544, 1, 4096]
    - [56, 84.055]
  - - [1024, 5472, 1, 3072]
    - [10, 70.063]
  - - [1024, 5472, 1, 4096]
    - [10, 71.848]
  - - [1024, 7232, 1, 3072]
    - [76, 77.295]
  - - [1024, 7232, 1, 1024]
    - [5, 63.902]
  - - [1024, 6368, 1, 1024]
    - [5, 66.165]
  - - [1024, 6736, 1, 4096]
    - [27, 86.544]
  - - [4096, 6736, 1, 1024]
    - [18, 76.738]
  - - [1024, 7152, 1, 3072]
    - [76, 76.533]
  - - [1024, 5296, 1, 3072]
    - [10, 67.932]
  - - [1024, 5296, 1, 4096]
    - [10, 69.344]
  - - [1024, 5312, 1, 3072]
    - [10, 67.382]
  - - [1024, 8736, 1, 4096]
    - [148, 86.836]
  - - [1024, 5872, 1, 3072]
    - [10, 73.956]
  - - [1024, 6000, 1, 1024]
    - [5, 62.728]
  - - [1024, 6960, 1, 3072]
    - [11, 82.416]
  - - [1024, 6960, 1, 1024]
    - [58, 63.395]
  - - [1024, 6960, 1, 4096]
    - [11, 86.008]
  - - [1024, 6848, 1, 4096]
    - [27, 87.888]
  - - [1024, 6976, 1, 3072]
    - [77, 82.468]
  - - [1024, 6976, 1, 1024]
    - [98, 63.787]
  - - [1024, 6976, 1, 4096]
    - [77, 85.824]
  - - [1024, 5744, 1, 3072]
    - [18, 72.164]
  - - [1024, 5728, 1, 3072]
    - [18, 71.937]
  - - [1024, 5632, 1, 4096]
    - [18, 73.948]
  - - [1024, 6176, 1, 1024]
    - [5, 64.17]
  - - [1024, 5504, 1, 3072]
    - [10, 70.498]
  - - [1024, 5504, 1, 4096]
    - [45, 71.789]
  - - [1024, 5488, 1, 3072]
    - [10, 70.344]
  - - [1024, 5488, 1, 4096]
    - [10, 72.339]
  - - [1024, 5456, 1, 3072]
    - [18, 68.667]
  - - [1024, 5456, 1, 4096]
    - [45, 71.006]
  - - [1024, 6640, 1, 1024]
    - [18, 64.669]
  - - [1024, 6640, 1, 4096]
    - [18, 84.941]
  - - [1024, 7440, 1, 3072]
    - [24, 79.47]
  - - [1024, 7440, 1, 1024]
    - [5, 65.691]
  - - [1024, 6288, 1, 1024]
    - [5, 65.623]
  - - [1024, 4704, 1, 3072]
    - [10, 75.063]
  - - [1024, 7264, 1, 3072]
    - [76, 77.731]
  - - [1024, 7264, 1, 1024]
    - [5, 64.233]
  - - [1024, 6672, 1, 1024]
    - [18, 66.516]
  - - [1024, 6672, 1, 4096]
    - [18, 86.356]
  - - [4096, 6672, 1, 1024]
    - [18, 76.285]
  - - [1024, 6304, 1, 1024]
    - [5, 65.732]
  - - [1024, 5520, 1, 3072]
    - [10, 69.97]
  - - [1024, 5520, 1, 4096]
    - [49, 71.76]
  - - [1024, 6208, 1, 1024]
    - [5, 64.788]
  - - [1024, 4976, 1, 1024]
    - [5, 62.405]
  - - [1024, 4976, 1, 4096]
    - [24, 82.045]
  - - [1024, 5360, 1, 3072]
    - [45, 67.387]
  - - [1024, 5360, 1, 4096]
    - [45, 70.397]
  - - [1024, 5392, 1, 3072]
    - [10, 68.939]
  - - [1024, 5392, 1, 4096]
    - [45, 70.386]
  - - [1024, 5376, 1, 3072]
    - [10, 68.884]
  - - [1024, 5376, 1, 4096]
    - [117, 70.567]
  - - [1024, 5328, 1, 3072]
    - [10, 67.657]
  - - [1024, 5424, 1, 3072]
    - [10, 69.0]
  - - [1024, 5424, 1, 4096]
    - [10, 70.961]
  - - [1024, 7376, 1, 3072]
    - [24, 78.953]
  - - [1024, 7376, 1, 1024]
    - [5, 64.932]
  - - [1024, 6224, 1, 1024]
    - [5, 64.783]
  - - [1024, 6320, 1, 1024]
    - [5, 65.379]
  - - [1024, 6560, 1, 1024]
    - [14, 65.565]
  - - [1024, 6560, 1, 4096]
    - [27, 84.49]
  - - [1024, 5856, 1, 3072]
    - [10, 75.774]
  - - [1024, 5696, 1, 3072]
    - [10, 72.695]
  - - [1024, 5696, 1, 4096]
    - [45, 74.293]
  - - [1024, 7504, 1, 3072]
    - [24, 80.372]
  - - [1024, 7504, 1, 1024]
    - [5, 66.256]
  - - [1024, 6096, 1, 1024]
    - [5, 63.788]
  - - [1024, 4880, 1, 1024]
    - [5, 61.659]
  - - [1024, 4880, 1, 4096]
    - [24, 80.8]
  - - [1024, 7168, 1, 3072]
    - [24, 77.24]
  - - [1024, 7776, 1, 3072]
    - [10, 83.868]
  - - [1024, 7776, 1, 1024]
    - [10, 68.863]
  - - [1024, 7776, 1, 4096]
    - [24, 86.828]
  - - [1024, 6384, 1, 1024]
    - [5, 66.215]
  - - [1024, 5712, 1, 3072]
    - [10, 72.352]
  - - [1024, 4624, 1, 3072]
    - [76, 73.194]
  - - [1024, 4624, 1, 1024]
    - [5, 58.739]
  - - [1024, 7488, 1, 3072]
    - [10, 80.934]
  - - [1024, 7472, 1, 3072]
    - [76, 79.788]
  - - [1024, 7472, 1, 1024]
    - [5, 65.973]
  - - [1024, 6576, 1, 1024]
    - [18, 64.739]
  - - [1024, 6576, 1, 4096]
    - [27, 84.834]
  - - [1024, 6928, 1, 3072]
    - [11, 81.846]
  - - [1024, 6928, 1, 1024]
    - [58, 63.348]
  - - [1024, 6928, 1, 4096]
    - [11, 85.345]
  - - [1024, 6864, 1, 3072]
    - [27, 85.029]
  - - [1024, 6864, 1, 4096]
    - [56, 88.165]
  - - [1024, 5792, 1, 3072]
    - [10, 72.715]
  - - [1024, 6704, 1, 1024]
    - [71, 67.005]
  - - [1024, 6704, 1, 4096]
    - [18, 86.652]
  - - [4096, 6704, 1, 1024]
    - [18, 76.227]
  - - [1024, 6800, 1, 4096]
    - [18, 87.438]
  - - [4096, 6800, 1, 1024]
    - [18, 77.561]
  - - [1024, 6016, 1, 1024]
    - [5, 62.784]
  - - [1024, 6880, 1, 4096]
    - [18, 88.155]
  - - [1024, 11248, 1, 3072]
    - [10, 81.256]
  - - [1024, 11248, 1, 1024]
    - [60, 68.319]
  - - [1024, 11248, 1, 4096]
    - [49, 82.496]
  - - [1024, 27, 1, 1024]
    - [61, 1.957]
  - - [1024, 27, 1, 2]
    - [145, 0.006]
  - - [1000, 224, 1, 4000]
    - [44, 19.376]
  - - [1280, 1792, 1, 5120]
    - [24, 67.096]
  - - [1664, 32, 1, 1000]
    - [32, 2.752]
  - - [1920, 32, 1, 1000]
    - [19, 3.235]
  - - [2048, 32, 1, 1000]
    - [19, 3.418]
  - - [25088, 32, 1, 4096]
    - [78, 28.854]
  - - [4096, 32, 1, 1000]
    - [97, 6.205]
  - - [768, 32, 1, 100]
    - [51, 0.204]
  - - [768, 32, 1, 768]
    - [19, 1.305]
  - - [768, 7168, 1, 3072]
    - [18, 63.873]
  - - [196, 128, 32, 1024]
    - [133, 19.664]
  - - [196, 128, 32, 1056]
    - [132, 21.085]
  - - [196, 128, 32, 1088]
    - [98, 20.502]
  - - [196, 128, 32, 1152]
    - [133, 20.633]
  - - [196, 128, 32, 1184]
    - [168, 22.035]
  - - [196, 128, 32, 1216]
    - [98, 21.823]
  - - [196, 128, 32, 1760]
    - [168, 24.604]
  - - [196, 128, 32, 288]
    - [228, 9.72]
  - - [196, 128, 32, 352]
    - [166, 10.829]
  - - [196, 128, 32, 416]
    - [168, 12.06]
  - - [196, 128, 32, 544]
    - [132, 14.688]
  - - [196, 128, 32, 576]
    - [168, 15.189]
  - - [196, 128, 32, 768]
    - [98, 17.068]
  - - [196, 128, 32, 928]
    - [168, 20.129]
  - - [196, 128, 32, 960]
    - [98, 19.339]
  - - [196, 128, 32, 992]
    - [168, 21.013]
  - - [196, 896, 32, 1792]
    - [10, 45.713]
  - - [224, 224, 384, 64]
    - [7, 15.25]
  - - [224, 224, 512, 64]
    - [67, 16.108]
  - - [3136, 128, 32, 160]
    - [58, 28.516]
  - - [3136, 128, 32, 224]
    - [178, 34.97]
  - - [49, 128, 32, 1056]
    - [227, 8.683]
  - - [49, 128, 32, 1088]
    - [174, 9.39]
  - - [49, 128, 32, 1120]
    - [227, 8.673]
  - - [49, 128, 32, 1152]
    - [223, 9.172]
  - - [49, 128, 32, 640]
    - [174, 6.762]
  - - [49, 128, 32, 736]
    - [227, 7.205]
  - - [49, 128, 32, 832]
    - [174, 8.109]
  - - [64, 224, 160, 224]
    - [138, 16.976]
  - - [64, 224, 384, 224]
    - [124, 21.573]
  - - [64, 224, 512, 224]
    - [138, 22.757]
  - - [784, 128, 32, 128]
    - [128, 15.385]
  - - [1024, 14080, 1, 1024]
    - [18, 71.605]
  - - [1024, 2092, 1, 1024]
    - [5, 43.359]
  - - [1024, 2098, 1, 30528]
    - [185, 74.45]
  - - [1024, 2100, 1, 30528]
    - [192, 74.386]
  - - [1024, 2106, 1, 1024]
    - [5, 42.97]
  - - [1024, 2107, 1, 30528]
    - [185, 74.769]
  - - [1024, 2112, 1, 30528]
    - [185, 74.924]
  - - [1024, 2121, 1, 30528]
    - [192, 75.258]
  - - [1024, 2146, 1, 30528]
    - [192, 75.794]
  - - [1024, 2147, 1, 1024]
    - [5, 43.883]
  - - [1024, 2158, 1, 30528]
    - [192, 76.302]
  - - [1024, 2182, 1, 30528]
    - [192, 77.011]
  - - [1024, 2217, 1, 30528]
    - [192, 77.911]
  - - [1024, 2220, 1, 1024]
    - [5, 46.092]
  - - [1024, 2243, 1, 30528]
    - [192, 78.833]
  - - [1024, 2274, 1, 1024]
    - [5, 46.966]
  - - [1024, 2182, 1, 1024]
    - [5, 44.83]
  - - [1024, 2251, 1, 30528]
    - [192, 79.248]
  - - [1024, 12368, 1, 1024]
    - [14, 63.61]
  - - [1024, 13024, 1, 1024]
    - [14, 66.781]
  - - [1024, 13088, 1, 1024]
    - [14, 66.332]
  - - [1024, 13168, 1, 1024]
    - [18, 65.861]
  - - [1024, 13184, 1, 1024]
    - [71, 65.913]
  - - [1024, 13216, 1, 1024]
    - [18, 65.99]
  - - [1024, 13232, 1, 1024]
    - [18, 66.014]
  - - [1024, 13248, 1, 1024]
    - [27, 66.205]
  - - [1024, 13280, 1, 1024]
    - [18, 66.309]
  - - [1024, 13296, 1, 1024]
    - [18, 65.943]
  - - [1024, 13312, 1, 1024]
    - [27, 68.169]
  - - [1024, 13328, 1, 1024]
    - [18, 67.288]
  - - [1024, 13344, 1, 1024]
    - [27, 67.225]
  - - [1024, 13360, 1, 1024]
    - [18, 67.45]
  - - [1024, 13376, 1, 1024]
    - [27, 67.329]
  - - [1024, 13392, 1, 1024]
    - [27, 67.467]
  - - [1024, 13392, 1, 3072]
    - [18, 79.85]
  - - [1024, 13408, 1, 1024]
    - [71, 67.375]
  - - [1024, 13424, 1, 1024]
    - [18, 67.227]
  - - [1024, 13440, 1, 1024]
    - [27, 67.279]
  - - [1024, 13456, 1, 1024]
    - [27, 67.103]
  - - [1024, 13472, 1, 1024]
    - [18, 67.211]
  - - [1024, 13488, 1, 1024]
    - [18, 67.092]
  - - [1024, 13504, 1, 3072]
    - [18, 80.127]
  - - [1024, 13520, 1, 1024]
    - [27, 67.28]
  - - [1024, 13536, 1, 1024]
    - [18, 67.303]
  - - [1024, 13552, 1, 1024]
    - [18, 67.297]
  - - [1024, 13568, 1, 1024]
    - [182, 69.001]
  - - [1024, 13584, 1, 1024]
    - [27, 68.202]
  - - [1024, 13600, 1, 1024]
    - [27, 68.253]
  - - [1024, 13616, 1, 1024]
    - [18, 68.596]
  - - [1024, 13632, 1, 1024]
    - [18, 67.98]
  - - [1024, 13648, 1, 1024]
    - [18, 68.61]
  - - [1024, 13664, 1, 1024]
    - [71, 68.054]
  - - [1024, 13680, 1, 1024]
    - [18, 68.364]
  - - [1024, 13696, 1, 1024]
    - [27, 67.558]
  - - [1024, 13712, 1, 1024]
    - [27, 68.408]
  - - [1024, 13728, 1, 1024]
    - [27, 68.257]
  - - [1024, 13744, 1, 1024]
    - [27, 68.626]
  - - [1024, 13760, 1, 1024]
    - [27, 67.874]
  - - [1024, 13776, 1, 1024]
    - [27, 68.41]
  - - [1024, 13792, 1, 1024]
    - [27, 67.721]
  - - [1024, 13808, 1, 1024]
    - [18, 67.63]
  - - [1024, 13824, 1, 1024]
    - [27, 70.394]
  - - [1024, 13840, 1, 1024]
    - [27, 69.134]
  - - [1024, 13856, 1, 1024]
    - [27, 68.952]
  - - [1024, 13872, 1, 1024]
    - [18, 69.206]
  - - [1024, 13888, 1, 1024]
    - [27, 69.374]
  - - [1024, 13904, 1, 1024]
    - [18, 69.191]
  - - [1024, 13920, 1, 1024]
    - [27, 69.009]
  - - [1024, 13936, 1, 1024]
    - [18, 69.321]
  - - [1024, 13952, 1, 1024]
    - [18, 69.255]
  - - [1024, 13968, 1, 1024]
    - [27, 69.247]
  - - [1024, 14000, 1, 1024]
    - [27, 68.742]
  - - [1024, 14016, 1, 1024]
    - [18, 69.165]
  - - [1024, 14032, 1, 1024]
    - [27, 69.506]
  - - [1024, 14064, 1, 3072]
    - [27, 82.511]
  - - [1024, 14208, 1, 3072]
    - [10, 77.481]
  - - [1024, 14224, 1, 3072]
    - [10, 76.894]
  - - [1024, 14240, 1, 3072]
    - [10, 76.981]
  - - [1024, 14256, 1, 3072]
    - [10, 77.091]
  - - [1024, 14272, 1, 3072]
    - [10, 76.989]
  - - [1024, 14304, 1, 3072]
    - [10, 77.885]
  - - [1024, 14320, 1, 3072]
    - [10, 77.46]
  - - [1024, 14352, 1, 3072]
    - [10, 77.456]
  - - [1024, 14496, 1, 3072]
    - [10, 78.604]
  - - [1024, 14496, 1, 4096]
    - [49, 79.708]
  - - [1024, 14576, 1, 3072]
    - [155, 74.202]
  - - [1024, 15104, 1, 1024]
    - [14, 67.131]
  - - [1024, 15440, 1, 4096]
    - [24, 80.612]
  - - [1024, 1751, 1, 1024]
    - [158, 37.679]
  - - [1024, 1751, 1, 30528]
    - [86, 71.139]
  - - [1024, 1759, 1, 1024]
    - [158, 37.99]
  - - [1024, 1759, 1, 30528]
    - [69, 71.687]
  - - [1024, 1768, 1, 1024]
    - [158, 37.976]
  - - [1024, 1768, 1, 30528]
    - [86, 71.573]
  - - [1024, 1783, 1, 1024]
    - [69, 38.091]
  - - [1024, 1788, 1, 1024]
    - [158, 37.991]
  - - [1024, 1799, 1, 1024]
    - [158, 38.783]
  - - [1024, 1808, 1, 1024]
    - [158, 38.835]
  - - [1024, 1818, 1, 1024]
    - [158, 38.909]
  - - [1024, 1912, 1, 30528]
    - [86, 76.913]
  - - [1024, 1916, 1, 30528]
    - [69, 77.404]
  - - [1024, 1942, 1, 1024]
    - [86, 41.487]
  - - [1024, 1982, 1, 30528]
    - [69, 79.271]
  - - [1024, 1995, 1, 30528]
    - [86, 79.718]
  - - [1024, 2013, 1, 30528]
    - [86, 80.529]
  - - [1024, 2029, 1, 1024]
    - [69, 42.35]
  - - [1024, 2032, 1, 30528]
    - [88, 81.206]
  - - [1024, 2033, 1, 1024]
    - [69, 42.584]
  - - [1024, 2035, 1, 1024]
    - [69, 42.702]
  - - [1024, 2069, 1, 30528]
    - [69, 82.61]
  - - [1024, 2081, 1, 1024]
    - [5, 43.131]
  - - [1024, 2081, 1, 30528]
    - [192, 74.04]
  - - [1024, 2082, 1, 1024]
    - [5, 43.001]
  - - [1024, 2082, 1, 30528]
    - [185, 73.845]
  - - [1024, 2083, 1, 1024]
    - [5, 42.946]
  - - [1024, 2083, 1, 30528]
    - [185, 73.895]
  - - [1024, 2084, 1, 1024]
    - [5, 42.892]
  - - [1024, 2084, 1, 30528]
    - [185, 73.841]
  - - [1024, 2085, 1, 1024]
    - [5, 43.289]
  - - [1024, 2085, 1, 30528]
    - [192, 74.078]
  - - [1024, 2086, 1, 1024]
    - [5, 42.71]
  - - [1024, 2086, 1, 30528]
    - [185, 74.016]
  - - [1024, 2087, 1, 1024]
    - [5, 43.561]
  - - [1024, 2087, 1, 30528]
    - [192, 73.851]
  - - [1024, 2088, 1, 1024]
    - [5, 42.974]
  - - [1024, 2088, 1, 30528]
    - [185, 73.931]
  - - [1024, 2089, 1, 1024]
    - [40, 40.792]
  - - [1024, 2089, 1, 30528]
    - [192, 74.213]
  - - [1024, 2090, 1, 1024]
    - [5, 43.547]
  - - [1024, 2090, 1, 30528]
    - [185, 74.241]
  - - [1024, 2091, 1, 1024]
    - [5, 43.262]
  - - [1024, 2091, 1, 30528]
    - [185, 74.171]
  - - [1024, 2092, 1, 30528]
    - [192, 74.237]
  - - [1024, 2093, 1, 1024]
    - [5, 42.705]
  - - [1024, 2093, 1, 30528]
    - [185, 74.026]
  - - [1024, 2094, 1, 1024]
    - [5, 42.432]
  - - [1024, 2094, 1, 30528]
    - [192, 74.33]
  - - [1024, 2095, 1, 1024]
    - [5, 43.651]
  - - [1024, 2095, 1, 30528]
    - [192, 74.388]
  - - [1024, 2096, 1, 1024]
    - [5, 43.063]
  - - [1024, 2096, 1, 30528]
    - [185, 74.154]
  - - [1024, 2097, 1, 1024]
    - [5, 42.566]
  - - [1024, 2097, 1, 30528]
    - [192, 74.227]
  - - [1024, 2098, 1, 1024]
    - [5, 42.733]
  - - [1024, 2099, 1, 1024]
    - [5, 42.827]
  - - [1024, 2099, 1, 30528]
    - [185, 74.613]
  - - [1024, 2100, 1, 1024]
    - [5, 42.774]
  - - [1024, 2101, 1, 1024]
    - [5, 42.868]
  - - [1024, 2101, 1, 30528]
    - [185, 74.526]
  - - [1024, 2102, 1, 1024]
    - [5, 42.963]
  - - [1024, 2102, 1, 30528]
    - [185, 74.524]
  - - [1024, 2103, 1, 1024]
    - [5, 42.109]
  - - [1024, 2103, 1, 30528]
    - [185, 74.74]
  - - [1024, 2104, 1, 1024]
    - [5, 43.379]
  - - [1024, 2104, 1, 30528]
    - [185, 74.678]
  - - [1024, 2105, 1, 1024]
    - [5, 41.655]
  - - [1024, 2105, 1, 30528]
    - [185, 74.69]
  - - [1024, 2106, 1, 30528]
    - [192, 74.546]
  - - [1024, 2107, 1, 1024]
    - [5, 43.365]
  - - [1024, 2108, 1, 1024]
    - [5, 43.311]
  - - [1024, 2108, 1, 30528]
    - [192, 74.632]
  - - [1024, 2109, 1, 1024]
    - [5, 41.319]
  - - [1024, 2109, 1, 30528]
    - [185, 74.584]
  - - [1024, 2110, 1, 1024]
    - [37, 40.664]
  - - [1024, 2110, 1, 30528]
    - [185, 74.86]
  - - [1024, 2111, 1, 1024]
    - [5, 43.147]
  - - [1024, 2111, 1, 30528]
    - [192, 74.663]
  - - [1024, 2112, 1, 1024]
    - [10, 44.396]
  - - [1024, 2113, 1, 1024]
    - [5, 43.413]
  - - [1024, 2113, 1, 30528]
    - [192, 74.763]
  - - [1024, 2114, 1, 1024]
    - [5, 44.36]
  - - [1024, 2114, 1, 30528]
    - [192, 74.98]
  - - [1024, 2115, 1, 1024]
    - [5, 43.08]
  - - [1024, 2115, 1, 30528]
    - [192, 74.632]
  - - [1024, 2116, 1, 1024]
    - [5, 44.088]
  - - [1024, 2116, 1, 30528]
    - [192, 74.802]
  - - [1024, 2117, 1, 1024]
    - [5, 42.972]
  - - [1024, 2117, 1, 30528]
    - [192, 74.875]
  - - [1024, 2118, 1, 1024]
    - [5, 43.82]
  - - [1024, 2118, 1, 30528]
    - [192, 74.963]
  - - [1024, 2119, 1, 1024]
    - [5, 43.996]
  - - [1024, 2119, 1, 30528]
    - [192, 74.886]
  - - [1024, 2120, 1, 1024]
    - [5, 42.886]
  - - [1024, 2120, 1, 30528]
    - [192, 75.155]
  - - [1024, 2121, 1, 1024]
    - [5, 43.883]
  - - [1024, 2122, 1, 1024]
    - [5, 43.447]
  - - [1024, 2122, 1, 30528]
    - [192, 75.074]
  - - [1024, 2123, 1, 1024]
    - [5, 43.924]
  - - [1024, 2123, 1, 30528]
    - [192, 74.757]
  - - [1024, 2124, 1, 1024]
    - [5, 42.602]
  - - [1024, 2124, 1, 30528]
    - [192, 75.258]
  - - [1024, 2125, 1, 1024]
    - [5, 44.197]
  - - [1024, 2125, 1, 30528]
    - [192, 75.188]
  - - [1024, 2126, 1, 1024]
    - [40, 41.514]
  - - [1024, 2126, 1, 30528]
    - [192, 75.36]
  - - [1024, 2127, 1, 1024]
    - [5, 44.553]
  - - [1024, 2127, 1, 30528]
    - [192, 75.183]
  - - [1024, 2128, 1, 1024]
    - [5, 42.828]
  - - [1024, 2128, 1, 30528]
    - [192, 75.514]
  - - [1024, 2129, 1, 1024]
    - [5, 42.486]
  - - [1024, 2129, 1, 30528]
    - [192, 75.231]
  - - [1024, 2130, 1, 1024]
    - [5, 44.458]
  - - [1024, 2130, 1, 30528]
    - [192, 75.41]
  - - [1024, 2131, 1, 1024]
    - [5, 42.961]
  - - [1024, 2131, 1, 30528]
    - [192, 75.476]
  - - [1024, 2132, 1, 1024]
    - [5, 43.88]
  - - [1024, 2132, 1, 30528]
    - [192, 75.315]
  - - [1024, 2133, 1, 1024]
    - [5, 44.521]
  - - [1024, 2133, 1, 30528]
    - [192, 75.395]
  - - [1024, 2134, 1, 1024]
    - [5, 43.466]
  - - [1024, 2134, 1, 30528]
    - [192, 75.643]
  - - [1024, 2135, 1, 1024]
    - [5, 44.72]
  - - [1024, 2135, 1, 30528]
    - [192, 75.496]
  - - [1024, 2136, 1, 1024]
    - [5, 43.886]
  - - [1024, 2136, 1, 30528]
    - [192, 75.729]
  - - [1024, 2137, 1, 1024]
    - [5, 44.213]
  - - [1024, 2137, 1, 30528]
    - [192, 75.704]
  - - [1024, 2138, 1, 1024]
    - [5, 44.625]
  - - [1024, 2138, 1, 30528]
    - [192, 75.565]
  - - [1024, 2139, 1, 1024]
    - [5, 44.411]
  - - [1024, 2139, 1, 30528]
    - [192, 75.328]
  - - [1024, 2140, 1, 1024]
    - [5, 43.664]
  - - [1024, 2140, 1, 30528]
    - [192, 75.81]
  - - [1024, 2141, 1, 1024]
    - [5, 43.912]
  - - [1024, 2141, 1, 30528]
    - [192, 75.663]
  - - [1024, 2142, 1, 1024]
    - [5, 44.009]
  - - [1024, 2142, 1, 30528]
    - [192, 75.973]
  - - [1024, 2143, 1, 1024]
    - [5, 43.801]
  - - [1024, 2143, 1, 30528]
    - [192, 75.665]
  - - [1024, 2144, 1, 1024]
    - [5, 44.437]
  - - [1024, 2144, 1, 30528]
    - [192, 75.739]
  - - [1024, 2145, 1, 1024]
    - [5, 44.614]
  - - [1024, 2145, 1, 30528]
    - [192, 75.964]
  - - [1024, 2146, 1, 1024]
    - [5, 43.938]
  - - [1024, 2147, 1, 30528]
    - [192, 75.799]
  - - [1024, 2148, 1, 1024]
    - [5, 44.598]
  - - [1024, 2148, 1, 30528]
    - [192, 75.88]
  - - [1024, 2149, 1, 1024]
    - [5, 44.384]
  - - [1024, 2149, 1, 30528]
    - [192, 75.915]
  - - [1024, 2150, 1, 1024]
    - [5, 43.27]
  - - [1024, 2150, 1, 30528]
    - [192, 76.004]
  - - [1024, 2151, 1, 1024]
    - [5, 44.66]
  - - [1024, 2151, 1, 30528]
    - [192, 76.055]
  - - [1024, 2152, 1, 1024]
    - [5, 44.759]
  - - [1024, 2152, 1, 30528]
    - [192, 75.93]
  - - [1024, 2153, 1, 1024]
    - [5, 44.544]
  - - [1024, 2153, 1, 30528]
    - [192, 76.11]
  - - [1024, 2154, 1, 1024]
    - [5, 44.644]
  - - [1024, 2154, 1, 30528]
    - [192, 76.016]
  - - [1024, 2155, 1, 1024]
    - [5, 43.297]
  - - [1024, 2155, 1, 30528]
    - [192, 76.158]
  - - [1024, 2156, 1, 1024]
    - [5, 45.161]
  - - [1024, 2156, 1, 30528]
    - [192, 76.109]
  - - [1024, 2157, 1, 1024]
    - [5, 43.634]
  - - [1024, 2157, 1, 30528]
    - [192, 76.114]
  - - [1024, 2158, 1, 1024]
    - [5, 44.493]
  - - [1024, 2159, 1, 1024]
    - [5, 44.358]
  - - [1024, 2159, 1, 30528]
    - [192, 76.468]
  - - [1024, 2160, 1, 1024]
    - [5, 45.325]
  - - [1024, 2160, 1, 30528]
    - [192, 76.296]
  - - [1024, 2161, 1, 1024]
    - [5, 44.867]
  - - [1024, 2161, 1, 30528]
    - [192, 76.347]
  - - [1024, 2162, 1, 1024]
    - [5, 44.731]
  - - [1024, 2162, 1, 30528]
    - [192, 76.321]
  - - [1024, 2163, 1, 1024]
    - [5, 44.44]
  - - [1024, 2163, 1, 30528]
    - [192, 76.486]
  - - [1024, 2164, 1, 1024]
    - [5, 45.088]
  - - [1024, 2164, 1, 30528]
    - [192, 76.284]
  - - [1024, 2165, 1, 1024]
    - [5, 44.327]
  - - [1024, 2165, 1, 30528]
    - [192, 76.419]
  - - [1024, 2166, 1, 1024]
    - [40, 41.406]
  - - [1024, 2166, 1, 30528]
    - [192, 76.47]
  - - [1024, 2167, 1, 1024]
    - [5, 45.071]
  - - [1024, 2167, 1, 30528]
    - [192, 76.559]
  - - [1024, 2168, 1, 1024]
    - [5, 44.62]
  - - [1024, 2168, 1, 30528]
    - [192, 76.586]
  - - [1024, 2169, 1, 1024]
    - [5, 45.034]
  - - [1024, 2169, 1, 30528]
    - [192, 76.53]
  - - [1024, 2170, 1, 1024]
    - [5, 45.213]
  - - [1024, 2170, 1, 30528]
    - [192, 76.534]
  - - [1024, 2171, 1, 1024]
    - [5, 44.45]
  - - [1024, 2171, 1, 30528]
    - [192, 76.615]
  - - [1024, 2172, 1, 1024]
    - [5, 45.255]
  - - [1024, 2172, 1, 30528]
    - [192, 76.612]
  - - [1024, 2173, 1, 1024]
    - [5, 44.109]
  - - [1024, 2173, 1, 30528]
    - [192, 76.648]
  - - [1024, 2174, 1, 1024]
    - [5, 44.512]
  - - [1024, 2174, 1, 30528]
    - [192, 76.821]
  - - [1024, 2175, 1, 1024]
    - [5, 45.398]
  - - [1024, 2175, 1, 30528]
    - [192, 76.711]
  - - [1024, 2176, 1, 1024]
    - [5, 43.571]
  - - [1024, 2176, 1, 30528]
    - [192, 76.792]
  - - [1024, 2177, 1, 1024]
    - [5, 43.665]
  - - [1024, 2177, 1, 30528]
    - [192, 76.605]
  - - [1024, 2178, 1, 1024]
    - [5, 45.46]
  - - [1024, 2178, 1, 30528]
    - [192, 76.625]
  - - [1024, 2179, 1, 1024]
    - [5, 43.779]
  - - [1024, 2179, 1, 30528]
    - [192, 76.782]
  - - [1024, 2180, 1, 1024]
    - [5, 44.789]
  - - [1024, 2180, 1, 30528]
    - [192, 76.726]
  - - [1024, 2181, 1, 1024]
    - [5, 44.655]
  - - [1024, 2181, 1, 30528]
    - [192, 76.868]
  - - [1024, 2183, 1, 1024]
    - [5, 44.774]
  - - [1024, 2183, 1, 30528]
    - [192, 76.77]
  - - [1024, 2184, 1, 1024]
    - [5, 44.716]
  - - [1024, 2184, 1, 30528]
    - [192, 77.005]
  - - [1024, 2185, 1, 1024]
    - [5, 44.582]
  - - [1024, 2185, 1, 30528]
    - [192, 76.901]
  - - [1024, 2186, 1, 1024]
    - [5, 44.913]
  - - [1024, 2186, 1, 30528]
    - [192, 76.875]
  - - [1024, 2187, 1, 1024]
    - [5, 45.169]
  - - [1024, 2187, 1, 30528]
    - [192, 77.034]
  - - [1024, 2188, 1, 1024]
    - [5, 45.19]
  - - [1024, 2188, 1, 30528]
    - [192, 76.938]
  - - [1024, 2189, 1, 1024]
    - [5, 44.897]
  - - [1024, 2189, 1, 30528]
    - [192, 77.073]
  - - [1024, 2190, 1, 1024]
    - [5, 45.231]
  - - [1024, 2190, 1, 30528]
    - [192, 76.993]
  - - [1024, 2191, 1, 1024]
    - [5, 43.576]
  - - [1024, 2191, 1, 30528]
    - [192, 77.036]
  - - [1024, 2192, 1, 1024]
    - [5, 44.191]
  - - [1024, 2192, 1, 30528]
    - [192, 77.071]
  - - [1024, 2193, 1, 1024]
    - [5, 44.287]
  - - [1024, 2193, 1, 30528]
    - [192, 77.014]
  - - [1024, 2194, 1, 1024]
    - [5, 42.913]
  - - [1024, 2194, 1, 30528]
    - [192, 77.11]
  - - [1024, 2195, 1, 1024]
    - [5, 44.555]
  - - [1024, 2195, 1, 30528]
    - [192, 76.931]
  - - [1024, 2196, 1, 1024]
    - [5, 44.807]
  - - [1024, 2196, 1, 30528]
    - [192, 77.15]
  - - [1024, 2197, 1, 1024]
    - [5, 43.549]
  - - [1024, 2197, 1, 30528]
    - [192, 77.27]
  - - [1024, 2198, 1, 1024]
    - [5, 43.789]
  - - [1024, 2198, 1, 30528]
    - [192, 77.259]
  - - [1024, 2199, 1, 1024]
    - [5, 45.338]
  - - [1024, 2199, 1, 30528]
    - [192, 77.348]
  - - [1024, 2200, 1, 1024]
    - [5, 45.201]
  - - [1024, 2200, 1, 30528]
    - [192, 77.314]
  - - [1024, 2201, 1, 1024]
    - [5, 45.142]
  - - [1024, 2201, 1, 30528]
    - [192, 77.465]
  - - [1024, 2202, 1, 1024]
    - [5, 45.163]
  - - [1024, 2202, 1, 30528]
    - [192, 77.43]
  - - [1024, 2203, 1, 1024]
    - [5, 45.262]
  - - [1024, 2203, 1, 30528]
    - [192, 77.357]
  - - [1024, 2204, 1, 1024]
    - [5, 45.126]
  - - [1024, 2204, 1, 30528]
    - [192, 77.462]
  - - [1024, 2205, 1, 1024]
    - [5, 45.068]
  - - [1024, 2205, 1, 30528]
    - [192, 77.466]
  - - [1024, 2206, 1, 1024]
    - [5, 44.097]
  - - [1024, 2206, 1, 30528]
    - [192, 77.61]
  - - [1024, 2207, 1, 1024]
    - [5, 45.344]
  - - [1024, 2207, 1, 30528]
    - [192, 77.606]
  - - [1024, 2208, 1, 1024]
    - [10, 47.774]
  - - [1024, 2208, 1, 30528]
    - [192, 77.595]
  - - [1024, 2209, 1, 1024]
    - [5, 45.864]
  - - [1024, 2209, 1, 30528]
    - [192, 77.653]
  - - [1024, 2210, 1, 1024]
    - [5, 44.176]
  - - [1024, 2210, 1, 30528]
    - [192, 77.618]
  - - [1024, 2211, 1, 1024]
    - [5, 45.348]
  - - [1024, 2211, 1, 30528]
    - [192, 77.607]
  - - [1024, 2212, 1, 1024]
    - [5, 45.686]
  - - [1024, 2212, 1, 30528]
    - [192, 78.031]
  - - [1024, 2213, 1, 1024]
    - [5, 45.468]
  - - [1024, 2213, 1, 30528]
    - [192, 77.802]
  - - [1024, 2214, 1, 1024]
    - [5, 45.968]
  - - [1024, 2214, 1, 30528]
    - [192, 77.759]
  - - [1024, 2215, 1, 1024]
    - [5, 46.07]
  - - [1024, 2215, 1, 30528]
    - [192, 77.431]
  - - [1024, 2216, 1, 1024]
    - [5, 43.272]
  - - [1024, 2216, 1, 30528]
    - [192, 77.868]
  - - [1024, 2217, 1, 1024]
    - [5, 45.788]
  - - [1024, 2218, 1, 1024]
    - [5, 43.965]
  - - [1024, 2218, 1, 30528]
    - [192, 77.915]
  - - [1024, 2219, 1, 1024]
    - [5, 45.991]
  - - [1024, 2219, 1, 30528]
    - [192, 77.834]
  - - [1024, 2220, 1, 30528]
    - [192, 78.009]
  - - [1024, 2221, 1, 1024]
    - [5, 46.032]
  - - [1024, 2221, 1, 30528]
    - [192, 78.044]
  - - [1024, 2222, 1, 1024]
    - [5, 45.973]
  - - [1024, 2222, 1, 30528]
    - [192, 78.157]
  - - [1024, 2223, 1, 1024]
    - [5, 45.124]
  - - [1024, 2223, 1, 30528]
    - [192, 78.091]
  - - [1024, 2224, 1, 1024]
    - [5, 45.615]
  - - [1024, 2224, 1, 30528]
    - [192, 78.345]
  - - [1024, 2225, 1, 1024]
    - [5, 44.628]
  - - [1024, 2225, 1, 30528]
    - [192, 78.052]
  - - [1024, 2226, 1, 1024]
    - [5, 44.8]
  - - [1024, 2226, 1, 30528]
    - [192, 78.087]
  - - [1024, 2227, 1, 1024]
    - [5, 45.755]
  - - [1024, 2227, 1, 30528]
    - [192, 78.184]
  - - [1024, 2228, 1, 1024]
    - [5, 46.178]
  - - [1024, 2228, 1, 30528]
    - [192, 78.235]
  - - [1024, 2229, 1, 1024]
    - [5, 44.937]
  - - [1024, 2229, 1, 30528]
    - [192, 78.301]
  - - [1024, 2230, 1, 1024]
    - [5, 46.057]
  - - [1024, 2230, 1, 30528]
    - [192, 78.266]
  - - [1024, 2231, 1, 1024]
    - [5, 44.748]
  - - [1024, 2231, 1, 30528]
    - [192, 78.325]
  - - [1024, 2232, 1, 1024]
    - [5, 46.505]
  - - [1024, 2232, 1, 30528]
    - [192, 78.352]
  - - [1024, 2233, 1, 1024]
    - [5, 46.119]
  - - [1024, 2233, 1, 30528]
    - [192, 78.442]
  - - [1024, 2234, 1, 1024]
    - [5, 45.899]
  - - [1024, 2234, 1, 30528]
    - [192, 78.438]
  - - [1024, 2235, 1, 1024]
    - [5, 46.241]
  - - [1024, 2235, 1, 30528]
    - [192, 78.364]
  - - [1024, 2236, 1, 1024]
    - [5, 45.94]
  - - [1024, 2236, 1, 30528]
    - [192, 78.414]
  - - [1024, 2237, 1, 30528]
    - [192, 78.834]
  - - [1024, 2238, 1, 1024]
    - [5, 46.062]
  - - [1024, 2238, 1, 30528]
    - [192, 78.539]
  - - [1024, 2239, 1, 1024]
    - [5, 46.082]
  - - [1024, 2239, 1, 30528]
    - [192, 78.582]
  - - [1024, 2240, 1, 1024]
    - [5, 45.784]
  - - [1024, 2240, 1, 30528]
    - [192, 78.437]
  - - [1024, 2241, 1, 1024]
    - [5, 44.949]
  - - [1024, 2241, 1, 30528]
    - [192, 78.621]
  - - [1024, 2242, 1, 1024]
    - [5, 45.667]
  - - [1024, 2242, 1, 30528]
    - [192, 78.586]
  - - [1024, 2243, 1, 1024]
    - [37, 43.087]
  - - [1024, 2244, 1, 1024]
    - [5, 46.428]
  - - [1024, 2244, 1, 30528]
    - [192, 78.75]
  - - [1024, 2245, 1, 1024]
    - [5, 46.045]
  - - [1024, 2245, 1, 30528]
    - [192, 78.753]
  - - [1024, 2246, 1, 1024]
    - [5, 45.827]
  - - [1024, 2246, 1, 30528]
    - [192, 78.726]
  - - [1024, 2247, 1, 1024]
    - [5, 45.454]
  - - [1024, 2247, 1, 30528]
    - [192, 78.761]
  - - [1024, 2248, 1, 1024]
    - [5, 46.348]
  - - [1024, 2248, 1, 30528]
    - [192, 78.772]
  - - [1024, 2249, 1, 1024]
    - [5, 45.652]
  - - [1024, 2249, 1, 30528]
    - [192, 79.17]
  - - [1024, 2250, 1, 1024]
    - [5, 46.067]
  - - [1024, 2250, 1, 30528]
    - [192, 78.945]
  - - [1024, 2251, 1, 1024]
    - [5, 44.619]
  - - [1024, 2252, 1, 1024]
    - [5, 46.511]
  - - [1024, 2252, 1, 30528]
    - [192, 78.795]
  - - [1024, 2253, 1, 1024]
    - [5, 46.614]
  - - [1024, 2253, 1, 30528]
    - [192, 78.877]
  - - [1024, 2254, 1, 1024]
    - [5, 43.582]
  - - [1024, 2254, 1, 30528]
    - [192, 79.362]
  - - [1024, 2255, 1, 1024]
    - [5, 46.655]
  - - [1024, 2255, 1, 30528]
    - [192, 78.869]
  - - [1024, 2256, 1, 1024]
    - [5, 44.793]
  - - [1024, 2256, 1, 30528]
    - [192, 79.092]
  - - [1024, 2257, 1, 1024]
    - [5, 44.662]
  - - [1024, 2257, 1, 30528]
    - [192, 79.301]
  - - [1024, 2258, 1, 1024]
    - [5, 46.717]
  - - [1024, 2258, 1, 30528]
    - [192, 79.178]
  - - [1024, 2259, 1, 1024]
    - [5, 46.494]
  - - [1024, 2259, 1, 30528]
    - [192, 78.727]
  - - [1024, 2260, 1, 1024]
    - [5, 45.024]
  - - [1024, 2260, 1, 30528]
    - [192, 79.256]
  - - [1024, 2261, 1, 1024]
    - [5, 45.66]
  - - [1024, 2261, 1, 30528]
    - [192, 79.189]
  - - [1024, 2262, 1, 1024]
    - [5, 45.916]
  - - [1024, 2262, 1, 30528]
    - [192, 79.334]
  - - [1024, 2263, 1, 1024]
    - [5, 46.576]
  - - [1024, 2263, 1, 30528]
    - [192, 79.204]
  - - [1024, 2264, 1, 1024]
    - [5, 46.516]
  - - [1024, 2264, 1, 30528]
    - [192, 79.381]
  - - [1024, 2265, 1, 1024]
    - [5, 46.536]
  - - [1024, 2265, 1, 30528]
    - [192, 79.447]
  - - [1024, 2266, 1, 1024]
    - [5, 45.296]
  - - [1024, 2266, 1, 30528]
    - [192, 79.482]
  - - [1024, 2267, 1, 1024]
    - [5, 46.986]
  - - [1024, 2267, 1, 30528]
    - [192, 79.351]
  - - [1024, 2268, 1, 1024]
    - [5, 46.276]
  - - [1024, 2268, 1, 30528]
    - [192, 79.719]
  - - [1024, 2269, 1, 1024]
    - [5, 46.945]
  - - [1024, 2269, 1, 30528]
    - [192, 79.453]
  - - [1024, 2270, 1, 1024]
    - [5, 47.214]
  - - [1024, 2270, 1, 30528]
    - [192, 79.67]
  - - [1024, 2271, 1, 1024]
    - [5, 46.986]
  - - [1024, 2271, 1, 30528]
    - [192, 79.531]
  - - [1024, 2272, 1, 1024]
    - [5, 45.961]
  - - [1024, 2272, 1, 30528]
    - [192, 79.661]
  - - [1024, 2273, 1, 1024]
    - [5, 46.297]
  - - [1024, 2273, 1, 30528]
    - [192, 79.72]
  - - [1024, 2274, 1, 30528]
    - [192, 79.668]
  - - [1024, 2275, 1, 1024]
    - [5, 46.339]
  - - [1024, 2275, 1, 30528]
    - [192, 79.822]
  - - [1024, 2276, 1, 1024]
    - [5, 47.007]
  - - [1024, 2276, 1, 30528]
    - [192, 79.73]
  - - [1024, 2277, 1, 1024]
    - [5, 46.701]
  - - [1024, 2277, 1, 30528]
    - [192, 79.868]
  - - [1024, 2278, 1, 1024]
    - [5, 46.803]
  - - [1024, 2278, 1, 30528]
    - [192, 79.911]
  - - [1024, 2279, 1, 1024]
    - [5, 45.556]
  - - [1024, 2279, 1, 30528]
    - [192, 79.97]
  - - [1024, 2280, 1, 1024]
    - [5, 46.52]
  - - [1024, 2280, 1, 30528]
    - [192, 79.981]
  - - [1024, 2281, 1, 1024]
    - [5, 44.912]
  - - [1024, 2281, 1, 30528]
    - [192, 79.818]
  - - [1024, 2282, 1, 1024]
    - [5, 45.849]
  - - [1024, 2282, 1, 30528]
    - [192, 79.948]
  - - [1024, 2283, 1, 1024]
    - [5, 45.713]
  - - [1024, 2283, 1, 30528]
    - [192, 79.999]
  - - [1024, 2284, 1, 1024]
    - [5, 46.442]
  - - [1024, 2284, 1, 30528]
    - [192, 79.962]
  - - [1024, 2285, 1, 1024]
    - [5, 46.703]
  - - [1024, 2285, 1, 30528]
    - [192, 80.165]
  - - [1024, 2286, 1, 1024]
    - [5, 47.131]
  - - [1024, 2286, 1, 30528]
    - [192, 80.128]
  - - [1024, 2287, 1, 1024]
    - [5, 46.907]
  - - [1024, 2287, 1, 30528]
    - [192, 80.099]
  - - [1024, 2288, 1, 1024]
    - [5, 46.845]
  - - [1024, 2288, 1, 30528]
    - [192, 80.094]
  - - [1024, 2289, 1, 1024]
    - [5, 47.111]
  - - [1024, 2289, 1, 30528]
    - [192, 80.329]
  - - [1024, 2290, 1, 1024]
    - [5, 47.297]
  - - [1024, 2290, 1, 30528]
    - [192, 80.26]
  - - [1024, 2291, 1, 1024]
    - [5, 47.235]
  - - [1024, 2291, 1, 30528]
    - [192, 80.08]
  - - [1024, 2292, 1, 1024]
    - [5, 46.766]
  - - [1024, 2292, 1, 30528]
    - [192, 80.314]
  - - [1024, 2293, 1, 1024]
    - [5, 46.465]
  - - [1024, 2293, 1, 30528]
    - [192, 80.309]
  - - [1024, 2294, 1, 1024]
    - [5, 44.573]
  - - [1024, 2294, 1, 30528]
    - [192, 80.257]
  - - [1024, 2295, 1, 1024]
    - [5, 45.798]
  - - [1024, 2295, 1, 30528]
    - [192, 80.459]
  - - [1024, 2296, 1, 1024]
    - [5, 46.052]
  - - [1024, 2296, 1, 30528]
    - [192, 80.406]
  - - [1024, 2297, 1, 1024]
    - [5, 44.928]
  - - [1024, 2297, 1, 30528]
    - [192, 80.489]
  - - [1024, 2298, 1, 1024]
    - [5, 45.781]
  - - [1024, 2298, 1, 30528]
    - [192, 80.373]
  - - [1024, 2299, 1, 1024]
    - [5, 46.587]
  - - [1024, 2299, 1, 30528]
    - [192, 80.648]
  - - [1024, 2300, 1, 1024]
    - [5, 46.929]
  - - [1024, 2300, 1, 30528]
    - [192, 80.635]
  - - [1024, 2301, 1, 1024]
    - [5, 46.627]
  - - [1024, 2301, 1, 30528]
    - [192, 80.71]
  - - [1024, 2302, 1, 1024]
    - [5, 46.808]
  - - [1024, 2302, 1, 30528]
    - [192, 80.545]
  - - [1024, 2303, 1, 1024]
    - [5, 47.153]
  - - [1024, 2303, 1, 30528]
    - [192, 80.428]
  - - [1024, 2312, 1, 30528]
    - [24, 78.379]
  - - [1024, 2356, 1, 30528]
    - [24, 79.786]
  - - [1024, 2364, 1, 30528]
    - [24, 80.088]
  - - [1024, 2374, 1, 30528]
    - [24, 80.443]
  - - [1024, 2377, 1, 30528]
    - [24, 80.467]
  - - [1024, 2386, 1, 1024]
    - [5, 48.349]
  - - [1024, 2405, 1, 30528]
    - [24, 81.36]
  - - [1024, 2492, 1, 30528]
    - [24, 84.206]
  - - [4096, 12192, 1, 1024]
    - [18, 75.115]
  - - [4096, 13536, 1, 1024]
    - [18, 73.337]
  - - [4096, 14224, 1, 1024]
    - [27, 73.076]
  - - [1000, 1024, 1, 100]
    - [138, 5.416]
  - - [1024, 10752, 1, 1024]
    - [14, 64.511]
  - - [1024, 10752, 1, 4096]
    - [45, 77.405]
  - - [1024, 3584, 1, 1024]
    - [5, 52.992]
  - - [1024, 896, 1, 4096]
    - [158, 51.635]
  - - [1280, 224, 1, 100]
    - [51, 2.197]
  - - [1280, 224, 1, 5120]
    - [30, 29.377]
  - - [1280, 896, 1, 1280]
    - [5, 37.419]
  - - [1280, 896, 1, 5120]
    - [49, 61.313]
  - - [1664, 256, 1, 1000]
    - [26, 16.959]
  - - [1664, 64, 1, 1000]
    - [89, 5.581]
  - - [18816, 1024, 1, 512]
    - [21, 56.619]
  - - [1920, 256, 1, 1000]
    - [26, 17.414]
  - - [1920, 64, 1, 1000]
    - [50, 5.842]
  - - [2048, 256, 1, 1000]
    - [39, 18.812]
  - - [2048, 96, 1, 1000]
    - [51, 9.004]
  - - [224, 32768, 1, 4000]
    - [33, 65.776]
  - - [224, 8192, 1, 4000]
    - [86, 59.366]
  - - [2304, 896, 1, 768]
    - [5, 37.136]
  - - [25088, 256, 1, 4096]
    - [18, 75.053]
  - - [25088, 96, 1, 4096]
    - [49, 66.354]
  - - [3072, 3584, 1, 768]
    - [38, 57.702]
  - - [3072, 5376, 1, 768]
    - [27, 63.398]
  - - [3072, 896, 1, 768]
    - [37, 38.727]
  - - [3840, 5376, 1, 1280]
    - [18, 73.399]
  - - [3840, 896, 1, 1280]
    - [29, 57.097]
  - - [4096, 256, 1, 4096]
    - [49, 53.587]
  - - [4096, 896, 1, 1024]
    - [5, 52.728]
  - - [4096, 96, 1, 1000]
    - [26, 14.337]
  - - [768, 10752, 1, 3072]
    - [13, 71.378]
  - - [768, 10752, 1, 768]
    - [14, 54.5]
  - - [768, 224, 1, 100]
    - [51, 1.375]
  - - [768, 224, 1, 768]
    - [8, 7.753]
  - - [768, 3584, 1, 3072]
    - [93, 59.135]
  - - [768, 5376, 1, 3072]
    - [13, 67.95]
  - - [768, 5376, 1, 768]
    - [37, 46.517]
  - - [768, 896, 1, 768]
    - [20, 23.078]
  - - [196, 128, 64, 1088]
    - [180, 26.741]
  - - [196, 128, 64, 1760]
    - [180, 30.941]
  - - [196, 128, 16, 320]
    - [226, 7.025]
  - - [196, 128, 64, 384]
    - [180, 16.345]
  - - [196, 128, 64, 512]
    - [180, 19.019]
  - - [196, 128, 64, 544]
    - [180, 20.166]
  - - [196, 128, 16, 672]
    - [164, 10.516]
  - - [196, 128, 16, 704]
    - [164, 10.829]
  - - [196, 128, 16, 736]
    - [164, 11.132]
  - - [196, 128, 16, 800]
    - [164, 12.02]
  - - [196, 128, 16, 832]
    - [164, 12.217]
  - - [196, 128, 64, 896]
    - [180, 24.301]
  - - [3136, 128, 16, 256]
    - [58, 31.185]
  - - [3136, 128, 96, 256]
    - [142, 40.832]
  - - [3136, 128, 16, 64]
    - [138, 12.483]
  - - [3136, 128, 16, 96]
    - [37, 16.539]
  - - [3136, 128, 64, 96]
    - [142, 23.35]
  - - [3136, 256, 96, 64]
    - [107, 20.208]
  - - [49, 128, 16, 1760]
    - [221, 6.357]
  - - [49, 128, 16, 1792]
    - [174, 7.011]
  - - [49, 128, 64, 1792]
    - [177, 15.148]
  - - [49, 128, 16, 1824]
    - [221, 6.193]
  - - [49, 128, 16, 1856]
    - [223, 7.211]
  - - [49, 128, 64, 1888]
    - [164, 16.233]
  - - [49, 128, 64, 672]
    - [226, 10.063]
  - - [49, 128, 64, 704]
    - [164, 10.205]
  - - [49, 128, 64, 736]
    - [226, 10.807]
  - - [49, 128, 64, 768]
    - [174, 10.246]
  - - [49, 128, 64, 832]
    - [164, 11.299]
  - - [64, 224, 192, 224]
    - [138, 17.996]
  - - [64, 224, 256, 224]
    - [118, 19.582]
  - - [64, 224, 288, 224]
    - [128, 19.961]
  - - [64, 224, 480, 224]
    - [138, 22.495]
  - - [64, 224, 576, 224]
    - [138, 22.75]
  - - [64, 224, 64, 224]
    - [138, 10.43]
  - - [64, 224, 768, 224]
    - [43, 23.81]
  - - [64, 224, 80, 224]
    - [196, 12.476]
  - - [1, 256, 1, 2200]
    - [229, 0.06]
  - - [1, 256, 1, 4000]
    - [230, 0.065]
  - - [1, 256, 1, 1024]
    - [231, 0.054]
- null
