library/src/blas3/Tensile/Logic/asm_full/aldebaran_Cijk_Ailk_Bljk_BSS_BH.yaml
- {MinimumRequiredVersion: 4.23.0}
- aldebaran
- gfx90a
- [Device 0050, Device 0051, Device 0052, Device 0054, Device 0062, Device 7400, Device 740c]
    SolutionIndex: 0
    SolutionNameMin: Cijk_Ailk_Bljk_BSS_BH_MT32x32x32_MI16x16x8x1_SE_AF0EM4_GRVW2_LBSPP128_LPB2_NLCA1_SU0_SUS128_SRVW0_TT1_16_WG32_8_1_WGM1
    SolutionIndex: 1
    SolutionNameMin: Cijk_Ailk_Bljk_BSS_BH_MT64x80x64_MI16x16x8x1_SE_AF0EM4_GRVW2_LBSPP128_LPB2_NLCA1_SU0_SUS128_SRVW0_TT1_80_WG64_4_1_WGM1
    SolutionIndex: 2
    SolutionNameMin: Cijk_Ailk_Bljk_BSS_BH_MT32x32x32_MI16x16x8x1_SE_AF0EM4_GRVW4_LBSPP128_LPB4_NLCA1_SU0_SUS128_SRVW0_TT1_16_WG32_8_1_WGM1
    SolutionIndex: 3
    SolutionNameMin: Cijk_Ailk_Bljk_BSS_BH_MT128x288x32_MI32x32x4x1_SE_AF0EM4_GRVW2_LBSPP128_LPB2_NLCA1_SU0_SUS128_SRVW4_TT1_288_WG128_2_1_WGM1
    SolutionIndex: 4
    SolutionNameMin: Cijk_Ailk_Bljk_BSS_BH_MT64x128x32_MI32x32x4x1_SE_AF0EM4_GRVW4_LBSPP128_LPB4_NLCA1_SU0_SUS128_SRVW4_TT1_64_WG64_4_1_WGM1
    SolutionIndex: 5
    SolutionNameMin: Cijk_Ailk_Bljk_BSS_BH_MT128x64x64_MI32x32x4x1_SE_AF0EM4_GRVW8_LBSPP128_LPB8_NLCA1_SU0_SUS128_SRVW4_TT2_32_WG64_4_1_WGM1
    SolutionIndex: 6
    SolutionNameMin: Cijk_Ailk_Bljk_BSS_BH_MT32x32x32_MI16x16x8x1_SE_AF0EM4_GRVW2_LBSPP128_LPB2_NLCA1_SU0_SUS256_SRVW0_TT1_16_WG32_8_1_WGM1
    SolutionIndex: 7
    SolutionNameMin: Cijk_Ailk_Bljk_BSS_BH_MT32x32x128_MI16x16x8x1_SE_AF0EM4_GRVW8_LBSPP256_LPB8_NLCA1_SU0_SUS256_SRVW0_TT1_16_WG32_8_1_WGM1
    SolutionIndex: 8
    SolutionNameMin: Cijk_Ailk_Bljk_BSS_BH_MT64x64x32_MI32x32x4x1_SE_AF0EM4_GRVW2_LBSPP128_LPB2_NLCA1_SU0_SUS256_SRVW4_TT1_32_WG64_4_1_WGM1
    SolutionIndex: 9
    SolutionNameMin: Cijk_Ailk_Bljk_BSS_BH_MT64x128x64_MI32x32x4x1_SE_AF0EM4_GRVW4_LBSPP128_LPB4_NLCA1_SU0_SUS256_SRVW4_TT1_64_WG64_4_1_WGM1
    SolutionIndex: 10
    SolutionNameMin: Cijk_Ailk_Bljk_BSS_BH_MT64x128x32_MI32x32x4x1_SE_AF0EM4_GRVW8_LBSPP128_LPB8_NLCA1_SU0_SUS256_SRVW4_TT1_64_WG64_4_1_WGM1
    SolutionIndex: 11
    SolutionNameMin: Cijk_Ailk_Bljk_BSS_BH_MT64x64x64_MI32x32x4x1_SE_AF0EM4_GRVW8_LBSPP128_LPB8_NLCA1_SU0_SUS256_SRVW4_TT1_32_WG64_4_1_WGM1
    SolutionIndex: 12
    SolutionNameMin: Cijk_Ailk_Bljk_BSS_BH_MT128x96x32_MI32x32x4x1_SE_AF0EM1_GRVW4_LBSPP128_LPB4_NLCA1_SU16_SUS128_SRVW4_TT1_96_WG128_2_1_WGM1
    SolutionIndex: 13
    SolutionNameMin: Cijk_Ailk_Bljk_BSS_BH_MT128x256x32_MI32x32x4x1_SE_AF0EM4_GRVW4_LBSPP128_LPB4_NLCA1_SU16_SUS128_SRVW4_TT2_128_WG64_4_1_WGM1
    SolutionIndex: 14
    SolutionNameMin: Cijk_Ailk_Bljk_BSS_BH_MT128x288x32_MI32x32x4x1_SE_AF0EM4_GRVW4_LBSPP128_LPB4_NLCA1_SU16_SUS128_SRVW4_TT1_288_WG128_2_1_WGM1
    SolutionIndex: 15
    SolutionNameMin: Cijk_Ailk_Bljk_BSS_BH_MT64x128x64_MI32x32x2x2_SE_AF0EM4_GRVW8_LBSPP128_LPB8_NLCA1_SU16_SUS128_SRVW4_TT1_32_WG64_4_1_WGM1
    SolutionIndex: 16
    SolutionNameMin: Cijk_Ailk_Bljk_BSS_BH_MT32x32x128_MI16x16x8x1_SE_AF0EM4_GRVW8_LBSPP256_LPB8_NLCA1_SU16_SUS256_SRVW0_TT1_16_WG32_8_1_WGM1
    SolutionIndex: 17
    SolutionNameMin: Cijk_Ailk_Bljk_BSS_BH_MT128x80x32_MI16x16x8x1_SE_AF0EM4_GRVW2_LBSPP128_LPB2_NLCA1_SU16_SUS256_SRVW4_TT2_80_WG64_4_1_WGM1
    SolutionIndex: 18
    SolutionNameMin: Cijk_Ailk_Bljk_BSS_BH_MT32x64x64_MI16x16x8x1_SE_AF0EM4_GRVW8_LBSPP128_LPB8_NLCA1_SU32_SUS128_SRVW0_TT1_32_WG32_8_1_WGM1
    SolutionIndex: 19
    SolutionNameMin: Cijk_Ailk_Bljk_BSS_BH_MT64x128x32_MI32x32x4x1_SE_AF0EM4_GRVW8_LBSPP128_LPB8_NLCA1_SU32_SUS128_SRVW4_TT1_64_WG64_4_1_WGM1
    SolutionIndex: 20
    SolutionNameMin: Cijk_Ailk_Bljk_BSS_BH_MT64x80x32_MI16x16x8x1_SE_AF0EM4_GRVW2_LBSPP128_LPB2_NLCA1_SU32_SUS256_SRVW4_TT1_80_WG64_4_1_WGM1
    SolutionIndex: 21
    SolutionNameMin: Cijk_Ailk_Bljk_BSS_BH_MT128x256x32_MI32x32x4x1_SE_AF0EM1_GRVW4_LBSPP128_LPB4_NLCA1_SU32_SUS256_SRVW4_TT2_128_WG64_4_1_WGM1
    SolutionIndex: 22
    SolutionNameMin: Cijk_Ailk_Bljk_BSS_BH_MT128x80x32_MI16x16x8x1_SE_AF0EM4_GRVW2_LBSPP128_LPB2_NLCA1_SU0_SUS128_SRVW0_TT2_80_WG64_4_1_WGM2
    SolutionIndex: 23
    SolutionNameMin: Cijk_Ailk_Bljk_BSS_BH_MT128x96x32_MI32x32x4x1_SE_AF0EM4_GRVW4_LBSPP128_LPB4_NLCA1_SU0_SUS128_SRVW4_TT1_96_WG128_2_1_WGM2
    SolutionIndex: 24
    SolutionNameMin: Cijk_Ailk_Bljk_BSS_BH_MT128x64x64_MI32x32x4x1_SE_AF0EM1_GRVW8_LBSPP128_LPB8_NLCA1_SU0_SUS128_SRVW4_TT2_32_WG64_4_1_WGM2
    SolutionIndex: 25
    SolutionNameMin: Cijk_Ailk_Bljk_BSS_BH_MT64x80x64_MI16x16x8x1_SE_AF0EM4_GRVW2_LBSPP128_LPB2_NLCA1_SU0_SUS256_SRVW0_TT1_80_WG64_4_1_WGM2
    SolutionIndex: 26
    SolutionNameMin: Cijk_Ailk_Bljk_BSS_BH_MT32x32x128_MI16x16x8x1_SE_AF0EM4_GRVW8_LBSPP256_LPB8_NLCA1_SU0_SUS256_SRVW0_TT1_16_WG32_8_1_WGM2
    SolutionIndex: 27
    SolutionNameMin: Cijk_Ailk_Bljk_BSS_BH_MT64x128x32_MI32x32x4x1_SE_AF0EM1_GRVW2_LBSPP128_LPB2_NLCA1_SU0_SUS256_SRVW4_TT1_64_WG64_4_1_WGM2
    SolutionIndex: 28
    SolutionNameMin: Cijk_Ailk_Bljk_BSS_BH_MT64x128x32_MI32x32x4x1_SE_AF0EM4_GRVW4_LBSPP128_LPB4_NLCA1_SU0_SUS256_SRVW4_TT1_64_WG64_4_1_WGM2
    SolutionIndex: 29
    SolutionNameMin: Cijk_Ailk_Bljk_BSS_BH_MT128x64x64_MI32x32x4x1_SE_AF0EM4_GRVW4_LBSPP128_LPB4_NLCA1_SU0_SUS256_SRVW4_TT2_32_WG64_4_1_WGM2
    SolutionIndex: 30
    SolutionNameMin: Cijk_Ailk_Bljk_BSS_BH_MT64x128x32_MI32x32x4x1_SE_AF0EM4_GRVW8_LBSPP128_LPB8_NLCA1_SU0_SUS256_SRVW4_TT1_64_WG64_4_1_WGM2
    SolutionIndex: 31
    SolutionNameMin: Cijk_Ailk_Bljk_BSS_BH_MT128x128x32_MI32x32x4x1_SE_AF0EM4_GRVW8_LBSPP128_LPB8_NLCA1_SU0_SUS256_SRVW4_TT2_64_WG64_4_1_WGM2
    SolutionIndex: 32
    SolutionNameMin: Cijk_Ailk_Bljk_BSS_BH_MT128x96x32_MI32x32x4x1_SE_AF0EM4_GRVW4_LBSPP128_LPB4_NLCA1_SU16_SUS128_SRVW4_TT1_96_WG128_2_1_WGM2
    SolutionIndex: 33
    SolutionNameMin: Cijk_Ailk_Bljk_BSS_BH_MT64x32x128_MI16x16x8x1_SE_AF0EM4_GRVW2_LBSPP256_LPB2_NLCA1_SU16_SUS256_SRVW0_TT2_16_WG32_8_1_WGM2
    SolutionIndex: 34
    SolutionNameMin: Cijk_Ailk_Bljk_BSS_BH_MT64x128x64_MI32x32x4x1_SE_AF0EM4_GRVW4_LBSPP128_LPB4_NLCA1_SU16_SUS256_SRVW4_TT1_64_WG64_4_1_WGM2
    SolutionIndex: 35
    SolutionNameMin: Cijk_Ailk_Bljk_BSS_BH_MT64x64x64_MI32x32x4x1_SE_AF0EM4_GRVW8_LBSPP128_LPB8_NLCA1_SU16_SUS256_SRVW4_TT1_32_WG64_4_1_WGM2
    SolutionIndex: 36
    SolutionNameMin: Cijk_Ailk_Bljk_BSS_BH_MT32x32x128_MI16x16x8x1_SE_AF0EM4_GRVW8_LBSPP256_LPB8_NLCA1_SU32_SUS256_SRVW0_TT1_16_WG32_8_1_WGM2
    SolutionIndex: 37
    SolutionNameMin: Cijk_Ailk_Bljk_BSS_BH_MT128x96x32_MI32x32x4x1_SE_AF0EM1_GRVW4_LBSPP128_LPB4_NLCA1_SU32_SUS256_SRVW4_TT1_96_WG128_2_1_WGM2
    SolutionIndex: 38
    SolutionNameMin: Cijk_Ailk_Bljk_BSS_BH_MT64x128x32_MI32x32x4x1_SE_AF0EM1_GRVW2_LBSPP128_LPB2_NLCA1_SU0_SUS128_SRVW4_TT1_64_WG64_4_1_WGM15
    SolutionIndex: 39
    SolutionNameMin: Cijk_Ailk_Bljk_BSS_BH_MT128x144x32_MI16x16x8x1_SE_AF0EM4_GRVW2_LBSPP128_LPB2_NLCA1_SU0_SUS128_SRVW4_TT2_144_WG64_4_1_WGM15
    SolutionIndex: 40
    SolutionNameMin: Cijk_Ailk_Bljk_BSS_BH_MT128x64x64_MI32x32x4x1_SE_AF0EM4_GRVW8_LBSPP128_LPB8_NLCA1_SU0_SUS128_SRVW4_TT2_32_WG64_4_1_WGM15
    SolutionIndex: 41
    SolutionNameMin: Cijk_Ailk_Bljk_BSS_BH_MT128x80x64_MI16x16x8x1_SE_AF0EM4_GRVW2_LBSPP128_LPB2_NLCA1_SU0_SUS256_SRVW0_TT2_80_WG64_4_1_WGM15
    SolutionIndex: 42
    SolutionNameMin: Cijk_Ailk_Bljk_BSS_BH_MT64x32x128_MI16x16x8x1_SE_AF0EM4_GRVW2_LBSPP256_LPB2_NLCA1_SU0_SUS256_SRVW0_TT2_16_WG32_8_1_WGM15
    SolutionIndex: 43
    SolutionNameMin: Cijk_Ailk_Bljk_BSS_BH_MT128x96x64_MI32x32x4x1_SE_AF0EM4_GRVW8_LBSPP128_LPB8_NLCA1_SU0_SUS256_SRVW0_TT1_96_WG128_2_1_WGM15
    SolutionIndex: 44
    SolutionNameMin: Cijk_Ailk_Bljk_BSS_BH_MT32x32x128_MI16x16x8x1_SE_AF0EM4_GRVW8_LBSPP256_LPB8_NLCA1_SU0_SUS256_SRVW0_TT1_16_WG32_8_1_WGM15
    SolutionIndex: 45
    SolutionNameMin: Cijk_Ailk_Bljk_BSS_BH_MT128x144x32_MI16x16x8x1_SE_AF0EM4_GRVW2_LBSPP128_LPB2_NLCA1_SU0_SUS256_SRVW4_TT2_144_WG64_4_1_WGM15
    SolutionIndex: 46
    SolutionNameMin: Cijk_Ailk_Bljk_BSS_BH_MT64x128x32_MI32x32x4x1_SE_AF0EM4_GRVW4_LBSPP128_LPB4_NLCA1_SU0_SUS256_SRVW4_TT1_64_WG64_4_1_WGM15
    SolutionIndex: 47
    SolutionNameMin: Cijk_Ailk_Bljk_BSS_BH_MT128x96x32_MI32x32x4x1_SE_AF0EM4_GRVW4_LBSPP128_LPB4_NLCA1_SU0_SUS256_SRVW4_TT1_96_WG128_2_1_WGM15
    SolutionIndex: 48
    SolutionNameMin: Cijk_Ailk_Bljk_BSS_BH_MT64x128x32_MI32x32x4x1_SE_AF0EM4_GRVW2_LBSPP128_LPB2_NLCA1_SU16_SUS128_SRVW4_TT1_64_WG64_4_1_WGM15
    SolutionIndex: 49
    SolutionNameMin: Cijk_Ailk_Bljk_BSS_BH_MT128x96x32_MI32x32x4x1_SE_AF0EM1_GRVW4_LBSPP128_LPB4_NLCA1_SU16_SUS128_SRVW4_TT1_96_WG128_2_1_WGM15
    SolutionIndex: 50
    SolutionNameMin: Cijk_Ailk_Bljk_BSS_BH_MT128x96x64_MI32x32x4x1_SE_AF0EM1_GRVW8_LBSPP128_LPB8_NLCA1_SU16_SUS128_SRVW4_TT1_96_WG128_2_1_WGM15
    SolutionIndex: 51
    SolutionNameMin: Cijk_Ailk_Bljk_BSS_BH_MT64x80x64_MI16x16x8x1_SE_AF0EM4_GRVW2_LBSPP128_LPB2_NLCA1_SU16_SUS256_SRVW0_TT1_80_WG64_4_1_WGM15
    SolutionIndex: 52
    SolutionNameMin: Cijk_Ailk_Bljk_BSS_BH_MT32x64x64_MI16x16x8x1_SE_AF0EM1_GRVW8_LBSPP128_LPB8_NLCA1_SU16_SUS256_SRVW0_TT1_32_WG32_8_1_WGM15
    SolutionIndex: 53
    SolutionNameMin: Cijk_Ailk_Bljk_BSS_BH_MT32x64x128_MI16x16x8x1_SE_AF0EM1_GRVW8_LBSPP256_LPB8_NLCA1_SU16_SUS256_SRVW0_TT1_32_WG32_8_1_WGM15
    SolutionIndex: 54
    SolutionNameMin: Cijk_Ailk_Bljk_BSS_BH_MT32x32x128_MI16x16x8x1_SE_AF0EM4_GRVW8_LBSPP256_LPB8_NLCA1_SU16_SUS256_SRVW0_TT1_16_WG32_8_1_WGM15
    SolutionIndex: 55
    SolutionNameMin: Cijk_Ailk_Bljk_BSS_BH_MT64x80x64_MI16x16x8x1_SE_AF0EM4_GRVW2_LBSPP128_LPB2_NLCA1_SU16_SUS256_SRVW4_TT1_80_WG64_4_1_WGM15
    SolutionIndex: 56
    SolutionNameMin: Cijk_Ailk_Bljk_BSS_BH_MT64x128x32_MI32x32x4x1_SE_AF0EM4_GRVW8_LBSPP128_LPB8_NLCA1_SU16_SUS256_SRVW4_TT1_64_WG64_4_1_WGM15
    SolutionIndex: 57
    SolutionNameMin: Cijk_Ailk_Bljk_BSS_BH_MT128x80x32_MI16x16x8x1_SE_AF0EM1_GRVW2_LBSPP128_LPB2_NLCA1_SU32_SUS128_SRVW4_TT2_80_WG64_4_1_WGM15
    SolutionIndex: 58
    SolutionNameMin: Cijk_Ailk_Bljk_BSS_BH_MT32x32x128_MI16x16x8x1_SE_AF0EM4_GRVW4_LBSPP256_LPB4_NLCA1_SU32_SUS256_SRVW0_TT1_16_WG32_8_1_WGM15
    SolutionIndex: 59
    SolutionNameMin: Cijk_Ailk_Bljk_BSS_BH_MT64x128x32_MI32x32x4x1_SE_AF0EM1_GRVW2_LBSPP128_LPB2_NLCA1_SU32_SUS256_SRVW4_TT1_64_WG64_4_1_WGM15
    SolutionIndex: 60
    SolutionNameMin: Cijk_Ailk_Bljk_BSS_BH_MT128x96x32_MI32x32x4x1_SE_AF0EM4_GRVW4_LBSPP128_LPB4_NLCA1_SU0_SUS256_SRVW4_TT1_96_WG128_2_1_WGM1
    SolutionIndex: 61
    SolutionNameMin: Cijk_Ailk_Bljk_BSS_BH_MT64x32x128_MI16x16x8x1_SE_AF0EM1_GRVW8_LBSPP256_LPB8_NLCA1_SU0_SUS256_SRVW4_TT2_16_WG32_8_1_WGM1
    SolutionIndex: 62
    SolutionNameMin: Cijk_Ailk_Bljk_BSS_BH_MT64x128x32_MI32x32x4x1_SE_AF0EM4_GRVW8_LBSPP128_LPB8_NLCA1_SU16_SUS128_SRVW4_TT1_64_WG64_4_1_WGM1
    SolutionIndex: 63
    SolutionNameMin: Cijk_Ailk_Bljk_BSS_BH_MT32x32x128_MI16x16x8x1_SE_AF0EM4_GRVW8_LBSPP256_LPB8_NLCA1_SU0_SUS256_SRVW0_TT1_16_WG32_8_1_WGM15
    SolutionIndex: 64
    SolutionNameMin: Cijk_Ailk_Bljk_BSS_BH_MT32x64x128_MI16x16x8x1_SE_AF0EM4_GRVW8_LBSPP256_LPB8_NLCA1_SU32_SUS256_SRVW4_TT1_32_WG32_8_1_WGM1
    SolutionIndex: 65
    SolutionNameMin: Cijk_Ailk_Bljk_BSS_BH_MT128x80x32_MI16x16x8x1_SE_AF0EM4_GRVW2_LBSPP128_LPB2_NLCA1_SU0_SUS256_SRVW4_TT2_80_WG64_4_1_WGM2
    SolutionIndex: 66
    SolutionNameMin: Cijk_Ailk_Bljk_BSS_BH_MT128x80x64_MI16x16x8x1_SE_AF0EM4_GRVW2_LBSPP128_LPB2_NLCA1_SU32_SUS128_SRVW4_TT2_80_WG64_4_1_WGM2
    SolutionIndex: 67
    SolutionNameMin: Cijk_Ailk_Bljk_BSS_BH_MT128x80x64_MI16x16x8x1_SE_AF0EM4_GRVW2_LBSPP128_LPB2_NLCA1_SU0_SUS128_SRVW4_TT2_80_WG64_4_1_WGM15
    SolutionIndex: 68
    SolutionNameMin: Cijk_Ailk_Bljk_BSS_BH_MT128x96x32_MI32x32x4x1_SE_AF0EM1_GRVW4_LBSPP128_LPB4_NLCA1_SU0_SUS128_SRVW4_TT1_96_WG128_2_1_WGM15
    SolutionIndex: 69
    SolutionNameMin: Cijk_Ailk_Bljk_BSS_BH_MT128x96x32_MI32x32x4x1_SE_AF0EM4_GRVW4_LBSPP128_LPB4_NLCA1_SU0_SUS128_SRVW4_TT1_96_WG128_2_1_WGM2
    SolutionIndex: 70
    SolutionNameMin: Cijk_Ailk_Bljk_BSS_BH_MT128x96x32_MI32x32x4x1_SE_AF0EM4_GRVW4_LBSPP128_LPB4_NLCA1_SU16_SUS128_SRVW4_TT1_96_WG128_2_1_WGM2
    SolutionIndex: 71
    SolutionNameMin: Cijk_Ailk_Bljk_BSS_BH_MT64x128x32_MI32x32x4x1_SE_AF0EM4_GRVW8_LBSPP128_LPB8_NLCA1_SU0_SUS256_SRVW4_TT1_64_WG64_4_1_WGM1
    SolutionIndex: 72
    SolutionNameMin: Cijk_Ailk_Bljk_BSS_BH_MT32x32x32_MI16x16x8x1_SE_AF0EM4_GRVW2_LBSPP128_LPB2_NLCA1_SU0_SUS256_SRVW0_TT1_16_WG32_8_1_WGM1
    SolutionIndex: 73
    SolutionNameMin: Cijk_Ailk_Bljk_BSS_BH_MT32x32x128_MI16x16x8x1_SE_AF0EM4_GRVW8_LBSPP256_LPB8_NLCA1_SU0_SUS256_SRVW4_TT1_16_WG32_8_1_WGM1
    SolutionIndex: 74
    SolutionNameMin: Cijk_Ailk_Bljk_BSS_BH_MT128x96x32_MI32x32x4x1_SE_AF0EM4_GRVW2_LBSPP128_LPB2_NLCA1_SU0_SUS128_SRVW4_TT1_96_WG128_2_1_WGM2
    SolutionIndex: 75
    SolutionNameMin: Cijk_Ailk_Bljk_BSS_BH_MT64x32x32_MI16x16x8x1_SE_AF0EM4_GRVW4_LBSPP128_LPB4_NLCA1_SU16_SUS128_SRVW0_TT2_16_WG32_8_1_WGM2
    SolutionIndex: 76
    SolutionNameMin: Cijk_Ailk_Bljk_BSS_BH_MT128x96x32_MI32x32x4x1_SE_AF0EM1_GRVW4_LBSPP128_LPB4_NLCA1_SU0_SUS256_SRVW4_TT1_96_WG128_2_1_WGM2
    SolutionIndex: 77
    SolutionNameMin: Cijk_Ailk_Bljk_BSS_BH_MT128x128x32_MI32x32x4x1_SE_AF0EM1_GRVW8_LBSPP128_LPB8_NLCA1_SU0_SUS256_SRVW4_TT2_64_WG64_4_1_WGM15
    SolutionIndex: 78
    SolutionNameMin: Cijk_Ailk_Bljk_BSS_BH_MT128x96x32_MI32x32x4x1_SE_AF0EM4_GRVW4_LBSPP128_LPB4_NLCA1_SU16_SUS256_SRVW4_TT1_96_WG128_2_1_WGM2
    SolutionIndex: 79
    SolutionNameMin: Cijk_Ailk_Bljk_BSS_BH_MT128x96x64_MI32x32x4x1_SE_AF0EM4_GRVW8_LBSPP128_LPB8_NLCA1_SU16_SUS128_SRVW4_TT1_96_WG128_2_1_WGM2
    SolutionIndex: 80
    SolutionNameMin: Cijk_Ailk_Bljk_BSS_BH_MT128x256x32_MI32x32x4x1_SE_AF0EM4_GRVW8_LBSPP128_LPB8_NLCA1_SU0_SUS128_SRVW4_TT2_128_WG64_4_1_WGM15
    SolutionIndex: 81
    SolutionNameMin: Cijk_Ailk_Bljk_BSS_BH_MT128x64x64_MI32x32x4x1_SE_AF0EM1_GRVW8_LBSPP128_LPB8_NLCA1_SU0_SUS128_SRVW4_TT2_32_WG64_4_1_WGM15
    SolutionIndex: 82
    SolutionNameMin: Cijk_Ailk_Bljk_BSS_BH_MT128x160x32_MI32x32x4x1_SE_AF0EM4_GRVW2_LBSPP128_LPB2_NLCA1_SU16_SUS128_SRVW4_TT1_160_WG128_2_1_WGM15
    SolutionIndex: 83
    SolutionNameMin: Cijk_Ailk_Bljk_BSS_BH_MT128x160x32_MI32x32x4x1_SE_AF0EM4_GRVW2_LBSPP128_LPB2_NLCA1_SU0_SUS256_SRVW4_TT1_160_WG128_2_1_WGM2
    SolutionIndex: 84
    SolutionNameMin: Cijk_Ailk_Bljk_BSS_BH_MT128x160x32_MI32x32x4x1_SE_AF0EM1_GRVW2_LBSPP128_LPB2_NLCA1_SU0_SUS128_SRVW4_TT1_160_WG128_2_1_WGM15
    SolutionIndex: 85
    SolutionNameMin: Cijk_Ailk_Bljk_BSS_BH_MT128x96x32_MI32x32x4x1_SE_AF0EM4_GRVW4_LBSPP128_LPB4_NLCA1_SU0_SUS256_SRVW4_TT1_96_WG128_2_1_WGM15
    SolutionIndex: 86
    SolutionNameMin: Cijk_Ailk_Bljk_BSS_BH_MT128x128x32_MI32x32x4x1_SE_AF0EM4_GRVW8_LBSPP128_LPB8_NLCA1_SU0_SUS256_SRVW4_TT2_64_WG64_4_1_WGM15
    SolutionIndex: 87
    SolutionNameMin: Cijk_Ailk_Bljk_BSS_BH_MT128x80x32_MI16x16x8x1_SE_AF0EM4_GRVW2_LBSPP128_LPB2_NLCA1_SU0_SUS128_SRVW4_TT2_80_WG64_4_1_WGM1
    SolutionIndex: 88
    SolutionNameMin: Cijk_Ailk_Bljk_BSS_BH_MT128x96x32_MI32x32x4x1_SE_AF0EM4_GRVW4_LBSPP128_LPB4_NLCA1_SU32_SUS256_SRVW4_TT1_96_WG128_2_1_WGM2
    SolutionIndex: 89
    SolutionNameMin: Cijk_Ailk_Bljk_BSS_BH_MT128x96x32_MI32x32x4x1_SE_AF0EM1_GRVW4_LBSPP128_LPB4_NLCA1_SU16_SUS256_SRVW4_TT1_96_WG128_2_1_WGM1
    SolutionIndex: 90
    SolutionNameMin: Cijk_Ailk_Bljk_BSS_BH_MT64x32x32_MI16x16x8x1_SE_AF0EM4_GRVW2_LBSPP128_LPB2_NLCA1_SU0_SUS128_SRVW0_TT2_16_WG32_8_1_WGM1
    SolutionIndex: 91
    SolutionNameMin: Cijk_Ailk_Bljk_BSS_BH_MT64x32x32_MI16x16x8x1_SE_AF0EM4_GRVW2_LBSPP128_LPB2_NLCA1_SU0_SUS256_SRVW0_TT2_16_WG32_8_1_WGM15
    SolutionIndex: 92
    SolutionNameMin: Cijk_Ailk_Bljk_BSS_BH_MT64x32x32_MI16x16x8x1_SE_AF0EM4_GRVW2_LBSPP128_LPB2_NLCA1_SU0_SUS256_SRVW0_TT2_16_WG32_8_1_WGM2
    SolutionIndex: 93
    SolutionNameMin: Cijk_Ailk_Bljk_BSS_BH_MT64x32x32_MI16x16x8x1_SE_AF0EM4_GRVW2_LBSPP128_LPB2_NLCA1_SU32_SUS256_SRVW0_TT2_16_WG32_8_1_WGM1
    SolutionIndex: 94
    SolutionNameMin: Cijk_Ailk_Bljk_BSS_BH_MT64x32x32_MI16x16x8x1_SE_AF0EM4_GRVW2_LBSPP128_LPB2_NLCA1_SU0_SUS128_SRVW0_TT2_16_WG32_8_1_WGM2
    SolutionIndex: 95
    SolutionNameMin: Cijk_Ailk_Bljk_BSS_BH_MT64x64x32_MI32x32x4x1_SE_AF0EM4_GRVW2_LBSPP128_LPB2_NLCA1_SU0_SUS256_SRVW4_TT1_32_WG64_4_1_WGM2
    SolutionIndex: 96
    SolutionNameMin: Cijk_Ailk_Bljk_BSS_BH_MT64x64x32_MI32x32x4x1_SE_AF0EM4_GRVW8_LBSPP128_LPB8_NLCA1_SU0_SUS256_SRVW4_TT1_32_WG64_4_1_WGM2
    SolutionIndex: 97
    SolutionNameMin: Cijk_Ailk_Bljk_BSS_BH_MT32x32x64_MI16x16x8x1_SE_AF0EM1_GRVW8_LBSPP128_LPB8_NLCA1_SU0_SUS128_SRVW0_TT1_16_WG32_8_1_WGM1
    SolutionIndex: 98
    SolutionNameMin: Cijk_Ailk_Bljk_BSS_BH_MT32x32x32_MI16x16x8x1_SE_AF0EM4_GRVW2_LBSPP128_LPB2_NLCA1_SU16_SUS256_SRVW0_TT1_16_WG32_8_1_WGM1
    SolutionIndex: 99
    SolutionNameMin: Cijk_Ailk_Bljk_BSS_BH_MT64x32x64_MI16x16x8x1_SE_AF0EM1_GRVW4_LBSPP128_LPB4_NLCA1_SU32_SUS128_SRVW0_TT2_16_WG32_8_1_WGM1
    SolutionIndex: 100
    SolutionNameMin: Cijk_Ailk_Bljk_BSS_BH_MT32x32x128_MI16x16x8x1_SE_AF0EM4_GRVW4_LBSPP256_LPB4_NLCA1_SU32_SUS256_SRVW0_TT1_16_WG32_8_1_WGM1
    SolutionIndex: 101
    SolutionNameMin: Cijk_Ailk_Bljk_BSS_BH_MT32x32x32_MI16x16x8x1_SE_AF0EM4_GRVW4_LBSPP128_LPB4_NLCA1_SU16_SUS128_SRVW0_TT1_16_WG32_8_1_WGM15
    SolutionIndex: 102
    SolutionNameMin: Cijk_Ailk_Bljk_BSS_BH_MT32x32x32_MI16x16x8x1_SE_AF0EM4_GRVW8_LBSPP128_LPB8_NLCA1_SU0_SUS128_SRVW0_TT1_16_WG32_8_1_WGM2
    SolutionIndex: 103
    SolutionNameMin: Cijk_Ailk_Bljk_BSS_BH_MT128x80x64_MI16x16x8x1_SE_AF0EM4_GRVW2_LBSPP128_LPB2_NLCA1_SU16_SUS128_SRVW0_TT2_80_WG64_4_1_WGM15
    SolutionIndex: 104
    SolutionNameMin: Cijk_Ailk_Bljk_BSS_BH_MT64x64x32_MI32x32x4x1_SE_AF0EM1_GRVW8_LBSPP128_LPB8_NLCA1_SU0_SUS128_SRVW4_TT1_32_WG64_4_1_WGM15
    SolutionIndex: 105
    SolutionNameMin: Cijk_Ailk_Bljk_BSS_BH_MT32x32x32_MI16x16x8x1_SE_AF0EM4_GRVW4_LBSPP128_LPB4_NLCA1_SU0_SUS128_SRVW0_TT1_16_WG32_8_1_WGM1
    SolutionIndex: 106
    SolutionNameMin: Cijk_Ailk_Bljk_BSS_BH_MT64x128x64_MI32x32x4x1_SE_AF0EM4_GRVW4_LBSPP128_LPB4_NLCA1_SU0_SUS128_SRVW0_TT1_64_WG64_4_1_WGM15
    SolutionIndex: 107
    SolutionNameMin: Cijk_Ailk_Bljk_BSS_BH_MT64x32x32_MI16x16x8x1_SE_AF0EM4_GRVW4_LBSPP128_LPB4_NLCA1_SU0_SUS128_SRVW0_TT2_16_WG32_8_1_WGM1
    SolutionIndex: 108
    SolutionNameMin: Cijk_Ailk_Bljk_BSS_BH_MT32x64x32_MI16x16x8x1_SE_AF0EM4_GRVW2_LBSPP128_LPB2_NLCA1_SU0_SUS256_SRVW0_TT1_32_WG32_8_1_WGM15
    SolutionIndex: 109
    SolutionNameMin: Cijk_Ailk_Bljk_BSS_BH_MT64x32x32_MI16x16x8x1_SE_AF0EM4_GRVW4_LBSPP128_LPB4_NLCA1_SU32_SUS256_SRVW0_TT2_16_WG32_8_1_WGM1
    SolutionIndex: 110
    SolutionNameMin: Cijk_Ailk_Bljk_BSS_BH_MT64x32x32_MI16x16x8x1_SE_AF0EM4_GRVW8_LBSPP128_LPB8_NLCA1_SU0_SUS128_SRVW0_TT2_16_WG32_8_1_WGM1
    SolutionIndex: 111
    SolutionNameMin: Cijk_Ailk_Bljk_BSS_BH_MT32x32x32_MI16x16x8x1_SE_AF0EM4_GRVW8_LBSPP128_LPB8_NLCA1_SU0_SUS128_SRVW0_TT1_16_WG32_8_1_WGM1
    SolutionIndex: 112
    SolutionNameMin: Cijk_Ailk_Bljk_BSS_BH_MT32x32x128_MI16x16x8x1_SE_AF0EM1_GRVW8_LBSPP256_LPB8_NLCA1_SU16_SUS256_SRVW0_TT1_16_WG32_8_1_WGM1
    SolutionIndex: 113
    SolutionNameMin: Cijk_Ailk_Bljk_BSS_BH_MT32x32x128_MI16x16x8x1_SE_AF0EM1_GRVW8_LBSPP256_LPB8_NLCA1_SU0_SUS256_SRVW0_TT1_16_WG32_8_1_WGM1
    SolutionIndex: 114
    SolutionNameMin: Cijk_Ailk_Bljk_BSS_BH_MT64x32x32_MI16x16x8x1_SE_AF0EM4_GRVW2_LBSPP128_LPB2_NLCA1_SU0_SUS128_SRVW0_TT2_16_WG32_8_1_WGM2
    SolutionIndex: 115
    SolutionNameMin: Cijk_Ailk_Bljk_BSS_BH_MT32x32x32_MI16x16x8x1_SE_AF0EM4_GRVW4_LBSPP128_LPB4_NLCA1_SU0_SUS256_SRVW0_TT1_16_WG32_8_1_WGM1
    SolutionIndex: 116
    SolutionNameMin: Cijk_Ailk_Bljk_BSS_BH_MT128x160x32_MI32x32x4x1_SE_AF0EM4_GRVW2_LBSPP128_LPB2_NLCA1_SU0_SUS128_SRVW0_TT1_160_WG128_2_1_WGM2
    SolutionIndex: 117
    SolutionNameMin: Cijk_Ailk_Bljk_BSS_BH_MT128x160x32_MI32x32x4x1_SE_AF0EM4_GRVW2_LBSPP128_LPB2_NLCA1_SU0_SUS128_SRVW0_TT1_160_WG128_2_1_WGM1
    SolutionIndex: 118
    SolutionNameMin: Cijk_Ailk_Bljk_BSS_BH_MT128x160x32_MI32x32x4x1_SE_AF0EM4_GRVW2_LBSPP128_LPB2_NLCA1_SU32_SUS128_SRVW0_TT1_160_WG128_2_1_WGM2
    SolutionIndex: 119
    SolutionNameMin: Cijk_Ailk_Bljk_BSS_BH_MT128x160x32_MI32x32x4x1_SE_AF0EM4_GRVW4_LBSPP128_LPB4_NLCA1_SU0_SUS128_SRVW0_TT1_160_WG128_2_1_WGM1
    SolutionIndex: 120
    SolutionNameMin: Cijk_Ailk_Bljk_BSS_BH_MT128x160x32_MI32x32x4x1_SE_AF0EM4_GRVW2_LBSPP128_LPB2_NLCA1_SU16_SUS128_SRVW0_TT1_160_WG128_2_1_WGM2
    SolutionIndex: 121
    SolutionNameMin: Cijk_Ailk_Bljk_BSS_BH_MT128x160x32_MI32x32x4x1_SE_AF0EM4_GRVW2_LBSPP128_LPB2_NLCA1_SU32_SUS256_SRVW0_TT1_160_WG128_2_1_WGM2
    SolutionIndex: 122
    SolutionNameMin: Cijk_Ailk_Bljk_BSS_BH_MT128x160x32_MI32x32x4x1_SE_AF0EM4_GRVW2_LBSPP128_LPB2_NLCA1_SU16_SUS256_SRVW0_TT1_160_WG128_2_1_WGM2
    SolutionIndex: 123
    SolutionNameMin: Cijk_Ailk_Bljk_BSS_BH_MT128x160x32_MI32x32x4x1_SE_AF0EM4_GRVW2_LBSPP128_LPB2_NLCA1_SU0_SUS256_SRVW0_TT1_160_WG128_2_1_WGM1
    SolutionIndex: 124
    SolutionNameMin: Cijk_Ailk_Bljk_BSS_BH_MT128x160x32_MI32x32x4x1_SE_AF0EM4_GRVW2_LBSPP128_LPB2_NLCA1_SU16_SUS128_SRVW0_TT1_160_WG128_2_1_WGM15
    SolutionIndex: 125
    SolutionNameMin: Cijk_Ailk_Bljk_BSS_BH_MT128x160x32_MI32x32x4x1_SE_AF0EM4_GRVW2_LBSPP128_LPB2_NLCA1_SU16_SUS256_SRVW0_TT1_160_WG128_2_1_WGM15
    SolutionIndex: 126
    SolutionNameMin: Cijk_Ailk_Bljk_BSS_BH_MT128x160x32_MI32x32x4x1_SE_AF0EM4_GRVW2_LBSPP128_LPB2_NLCA1_SU0_SUS128_SRVW4_TT1_160_WG128_2_1_WGM1
    SolutionIndex: 127
    SolutionNameMin: Cijk_Ailk_Bljk_BSS_BH_MT128x160x32_MI32x32x4x1_SE_AF0EM4_GRVW2_LBSPP128_LPB2_NLCA1_SU32_SUS128_SRVW4_TT1_160_WG128_2_1_WGM15
    SolutionIndex: 128
    SolutionNameMin: Cijk_Ailk_Bljk_BSS_BH_MT128x160x32_MI32x32x4x1_SE_AF0EM4_GRVW2_LBSPP128_LPB2_NLCA1_SU16_SUS256_SRVW4_TT1_160_WG128_2_1_WGM15
    SolutionIndex: 129
    SolutionNameMin: Cijk_Ailk_Bljk_BSS_BH_MT128x80x32_MI16x16x8x1_SE_AF0EM4_GRVW2_LBSPP128_LPB2_NLCA1_SU0_SUS128_SRVW4_TT2_80_WG64_4_1_WGM1
    SolutionIndex: 130
    SolutionNameMin: Cijk_Ailk_Bljk_BSS_BH_MT32x32x32_MI16x16x8x1_SE_AF0EM4_GRVW8_LBSPP128_LPB8_NLCA1_SU32_SUS128_SRVW0_TT1_16_WG32_8_1_WGM15
    SolutionIndex: 131
    SolutionNameMin: Cijk_Ailk_Bljk_BSS_BH_MT32x32x128_MI16x16x8x1_SE_AF0EM4_GRVW4_LBSPP256_LPB4_NLCA1_SU16_SUS256_SRVW0_TT1_16_WG32_8_1_WGM15
    SolutionIndex: 132
    SolutionNameMin: Cijk_Ailk_Bljk_BSS_BH_MT32x64x128_MI16x16x8x1_SE_AF0EM4_GRVW8_LBSPP256_LPB8_NLCA1_SU0_SUS256_SRVW0_TT1_32_WG32_8_1_WGM1
    SolutionIndex: 133
    SolutionNameMin: Cijk_Ailk_Bljk_BSS_BH_MT32x64x128_MI16x16x8x1_SE_AF0EM4_GRVW8_LBSPP256_LPB8_NLCA1_SU32_SUS256_SRVW0_TT1_32_WG32_8_1_WGM2
    SolutionIndex: 134
    SolutionNameMin: Cijk_Ailk_Bljk_BSS_BH_MT32x64x128_MI16x16x8x1_SE_AF0EM4_GRVW8_LBSPP256_LPB8_NLCA1_SU16_SUS256_SRVW4_TT1_32_WG32_8_1_WGM1
    SolutionIndex: 135
    SolutionNameMin: Cijk_Ailk_Bljk_BSS_BH_MT32x32x64_MI16x16x8x1_SE_AF0EM4_GRVW4_LBSPP128_LPB4_NLCA1_SU0_SUS128_SRVW0_TT1_16_WG32_8_1_WGM1
    SolutionIndex: 136
    SolutionNameMin: Cijk_Ailk_Bljk_BSS_BH_MT32x32x32_MI16x16x8x1_SE_AF0EM4_GRVW8_LBSPP128_LPB8_NLCA1_SU0_SUS128_SRVW0_TT1_16_WG32_8_1_WGM15
    SolutionIndex: 137
    SolutionNameMin: Cijk_Ailk_Bljk_BSS_BH_MT64x64x32_MI32x32x4x1_SE_AF0EM4_GRVW4_LBSPP128_LPB4_NLCA1_SU16_SUS256_SRVW4_TT1_32_WG64_4_1_WGM15
    SolutionIndex: 138
    SolutionNameMin: Cijk_Ailk_Bljk_BSS_BH_MT64x128x32_MI32x32x4x1_SE_AF0EM4_GRVW4_LBSPP128_LPB4_NLCA1_SU0_SUS256_SRVW4_TT1_64_WG64_4_1_WGM15
    SolutionIndex: 139
    SolutionNameMin: Cijk_Ailk_Bljk_BSS_BH_MT128x128x32_MI32x32x4x1_SE_AF0EM1_GRVW8_LBSPP128_LPB8_NLCA1_SU16_SUS256_SRVW4_TT2_64_WG64_4_1_WGM15
    SolutionIndex: 140
    SolutionNameMin: Cijk_Ailk_Bljk_BSS_BH_MT128x144x32_MI16x16x8x1_SE_AF0EM4_GRVW2_LBSPP128_LPB2_NLCA1_SU0_SUS128_SRVW4_TT2_144_WG64_4_1_WGM15
    SolutionIndex: 141
    SolutionNameMin: Cijk_Ailk_Bljk_BSS_BH_MT64x128x32_MI32x32x4x1_SE_AF0EM4_GRVW8_LBSPP128_LPB8_NLCA1_SU16_SUS256_SRVW4_TT1_64_WG64_4_1_WGM2
    SolutionIndex: 142
    SolutionNameMin: Cijk_Ailk_Bljk_BSS_BH_MT64x128x32_MI32x32x4x1_SE_AF0EM1_GRVW8_LBSPP128_LPB8_NLCA1_SU16_SUS128_SRVW4_TT1_64_WG64_4_1_WGM1
    SolutionIndex: 143
    SolutionNameMin: Cijk_Ailk_Bljk_BSS_BH_MT64x128x32_MI32x32x4x1_SE_AF0EM1_GRVW8_LBSPP128_LPB8_NLCA1_SU32_SUS128_SRVW4_TT1_64_WG64_4_1_WGM2
    SolutionIndex: 144
    SolutionNameMin: Cijk_Ailk_Bljk_BSS_BH_MT64x128x32_MI32x32x4x1_SE_AF0EM4_GRVW8_LBSPP128_LPB8_NLCA1_SU32_SUS128_SRVW4_TT1_64_WG64_4_1_WGM1
    SolutionIndex: 145
    SolutionNameMin: Cijk_Ailk_Bljk_BSS_BH_MT64x128x32_MI32x32x4x1_SE_AF0EM1_GRVW8_LBSPP128_LPB8_NLCA1_SU32_SUS256_SRVW4_TT1_64_WG64_4_1_WGM2
    SolutionIndex: 146
    SolutionNameMin: Cijk_Ailk_Bljk_BSS_BH_MT128x96x32_MI32x32x4x1_SE_AF0EM4_GRVW4_LBSPP128_LPB4_NLCA1_SU0_SUS128_SRVW4_TT1_96_WG128_2_1_WGM1
    SolutionIndex: 147
    SolutionNameMin: Cijk_Ailk_Bljk_BSS_BH_MT128x96x32_MI32x32x4x1_SE_AF0EM4_GRVW4_LBSPP128_LPB4_NLCA1_SU32_SUS128_SRVW4_TT1_96_WG128_2_1_WGM15
    SolutionIndex: 148
    SolutionNameMin: Cijk_Ailk_Bljk_BSS_BH_MT64x128x32_MI32x32x4x1_SE_AF0EM1_GRVW8_LBSPP128_LPB8_NLCA1_SU16_SUS128_SRVW4_TT1_64_WG64_4_1_WGM2
    SolutionIndex: 149
    SolutionNameMin: Cijk_Ailk_Bljk_BSS_BH_MT128x96x32_MI32x32x4x1_SE_AF0EM1_GRVW4_LBSPP128_LPB4_NLCA1_SU32_SUS128_SRVW4_TT1_96_WG128_2_1_WGM15
    SolutionIndex: 150
    SolutionNameMin: Cijk_Ailk_Bljk_BSS_BH_MT64x128x32_MI32x32x4x1_SE_AF0EM4_GRVW8_LBSPP128_LPB8_NLCA1_SU16_SUS128_SRVW4_TT1_64_WG64_4_1_WGM2
    SolutionIndex: 151
    SolutionNameMin: Cijk_Ailk_Bljk_BSS_BH_MT128x80x32_MI16x16x8x1_SE_AF0EM4_GRVW2_LBSPP128_LPB2_NLCA1_SU32_SUS128_SRVW4_TT2_80_WG64_4_1_WGM2
    SolutionIndex: 152
    SolutionNameMin: Cijk_Ailk_Bljk_BSS_BH_MT128x96x32_MI32x32x4x1_SE_AF0EM4_GRVW4_LBSPP128_LPB4_NLCA1_SU32_SUS128_SRVW4_TT1_96_WG128_2_1_WGM2
    SolutionIndex: 153
    SolutionNameMin: Cijk_Ailk_Bljk_BSS_BH_MT128x96x32_MI32x32x4x1_SE_AF0EM4_GRVW4_LBSPP128_LPB4_NLCA1_SU32_SUS256_SRVW4_TT1_96_WG128_2_1_WGM2
    SolutionIndex: 154
    SolutionNameMin: Cijk_Ailk_Bljk_BSS_BH_MT128x80x32_MI16x16x8x1_SE_AF0EM4_GRVW2_LBSPP128_LPB2_NLCA1_SU32_SUS128_SRVW4_TT2_80_WG64_4_1_WGM15
    SolutionIndex: 155
    SolutionNameMin: Cijk_Ailk_Bljk_BSS_BH_MT128x96x32_MI32x32x4x1_SE_AF0EM4_GRVW4_LBSPP128_LPB4_NLCA1_SU16_SUS128_SRVW4_TT1_96_WG128_2_1_WGM2
    SolutionIndex: 156
    SolutionNameMin: Cijk_Ailk_Bljk_BSS_BH_MT128x96x32_MI32x32x4x1_SE_AF0EM4_GRVW4_LBSPP128_LPB4_NLCA1_SU16_SUS256_SRVW4_TT1_96_WG128_2_1_WGM2
    SolutionIndex: 157
    SolutionNameMin: Cijk_Ailk_Bljk_BSS_BH_MT128x96x32_MI32x32x4x1_SE_AF0EM1_GRVW4_LBSPP128_LPB4_NLCA1_SU32_SUS128_SRVW4_TT1_96_WG128_2_1_WGM2
    SolutionIndex: 158
    SolutionNameMin: Cijk_Ailk_Bljk_BSS_BH_MT128x96x32_MI32x32x4x1_SE_AF0EM4_GRVW4_LBSPP128_LPB4_NLCA1_SU32_SUS128_SRVW4_TT1_96_WG128_2_1_WGM2
    SolutionIndex: 159
    SolutionNameMin: Cijk_Ailk_Bljk_BSS_BH_MT128x96x32_MI32x32x4x1_SE_AF0EM4_GRVW4_LBSPP128_LPB4_NLCA1_SU16_SUS128_SRVW4_TT1_96_WG128_2_1_WGM2
    SolutionIndex: 160
    SolutionNameMin: Cijk_Ailk_Bljk_BSS_BH_MT64x128x64_MI32x32x4x1_SE_AF0EM1_GRVW2_LBSPP128_LPB2_NLCA1_SU16_SUS256_SRVW4_TT1_64_WG64_4_1_WGM15
    SolutionIndex: 161
    SolutionNameMin: Cijk_Ailk_Bljk_BSS_BH_MT32x32x64_MI16x16x8x1_SE_AF0EM4_GRVW8_LBSPP128_LPB8_NLCA1_SU0_SUS256_SRVW0_TT1_16_WG32_8_1_WGM1
    SolutionIndex: 162
    SolutionNameMin: Cijk_Ailk_Bljk_BSS_BH_MT64x80x32_MI16x16x8x1_SE_AF0EM4_GRVW2_LBSPP128_LPB2_NLCA1_SU0_SUS128_SRVW0_TT1_80_WG64_4_1_WGM1
    SolutionIndex: 163
    SolutionNameMin: Cijk_Ailk_Bljk_BSS_BH_MT128x64x64_MI32x32x2x2_SE_AF0EM4_GRVW4_LBSPP128_LPB4_NLCA1_SU16_SUS128_SRVW4_TT1_32_WG128_2_1_WGM2
    SolutionIndex: 164
    SolutionNameMin: Cijk_Ailk_Bljk_BSS_BH_MT128x80x32_MI16x16x8x1_SE_AF0EM4_GRVW2_LBSPP128_LPB2_NLCA1_SU32_SUS256_SRVW4_TT2_80_WG64_4_1_WGM15
    SolutionIndex: 165
    SolutionNameMin: Cijk_Ailk_Bljk_BSS_BH_MT128x80x32_MI16x16x8x1_SE_AF0EM4_GRVW2_LBSPP128_LPB2_NLCA1_SU16_SUS128_SRVW4_TT2_80_WG64_4_1_WGM15
    SolutionIndex: 166
    SolutionNameMin: Cijk_Ailk_Bljk_BSS_BH_MT128x80x32_MI16x16x8x1_SE_AF0EM4_GRVW2_LBSPP128_LPB2_NLCA1_SU16_SUS256_SRVW4_TT2_80_WG64_4_1_WGM2
    SolutionIndex: 167
    SolutionNameMin: Cijk_Ailk_Bljk_BSS_BH_MT128x80x32_MI16x16x8x1_SE_AF0EM4_GRVW2_LBSPP128_LPB2_NLCA1_SU0_SUS128_SRVW4_TT2_80_WG64_4_1_WGM15
    SolutionIndex: 168
    SolutionNameMin: Cijk_Ailk_Bljk_BSS_BH_MT128x160x32_MI32x32x4x1_SE_AF0EM4_GRVW4_LBSPP128_LPB4_NLCA1_SU32_SUS256_SRVW4_TT1_160_WG128_2_1_WGM1
    SolutionIndex: 169
    SolutionNameMin: Cijk_Ailk_Bljk_BSS_BH_MT128x160x32_MI32x32x4x1_SE_AF0EM4_GRVW2_LBSPP128_LPB2_NLCA1_SU16_SUS256_SRVW4_TT1_160_WG128_2_1_WGM2
    SolutionIndex: 170
    SolutionNameMin: Cijk_Ailk_Bljk_BSS_BH_MT32x32x32_MI16x16x8x1_SE_AF0EM4_GRVW2_LBSPP128_LPB2_NLCA1_SU0_SUS128_SRVW0_TT1_16_WG32_8_1_WGM1
    SolutionIndex: 171
    SolutionNameMin: Cijk_Ailk_Bljk_BSS_BH_MT128x96x32_MI32x32x4x1_SE_AF0EM4_GRVW4_LBSPP128_LPB4_NLCA1_SU16_SUS128_SRVW4_TT1_96_WG128_2_1_WGM1
    SolutionIndex: 172
    SolutionNameMin: Cijk_Ailk_Bljk_BSS_BH_MT32x32x128_MI16x16x8x1_SE_AF0EM4_GRVW8_LBSPP256_LPB8_NLCA1_SU16_SUS256_SRVW0_TT1_16_WG32_8_1_WGM1
    SolutionIndex: 173
    SolutionNameMin: Cijk_Ailk_Bljk_BSS_BH_MT128x96x32_MI32x32x4x1_SE_AF0EM4_GRVW4_LBSPP128_LPB4_NLCA1_SU0_SUS128_SRVW4_TT1_96_WG128_2_1_WGM15
    SolutionIndex: 174
    SolutionNameMin: Cijk_Ailk_Bljk_BSS_BH_MT128x96x32_MI32x32x4x1_SE_AF0EM4_GRVW2_LBSPP128_LPB2_NLCA1_SU0_SUS128_SRVW4_TT1_96_WG128_2_1_WGM2
    SolutionIndex: 175
    SolutionNameMin: Cijk_Ailk_Bljk_BSS_BH_MT128x144x32_MI16x16x8x1_SE_AF0EM1_GRVW2_LBSPP128_LPB2_NLCA1_SU0_SUS256_SRVW0_TT2_144_WG64_4_1_WGM15
    SolutionIndex: 176
    SolutionNameMin: Cijk_Ailk_Bljk_BSS_BH_MT128x144x32_MI16x16x8x1_SE_AF0EM4_GRVW2_LBSPP128_LPB2_NLCA1_SU0_SUS256_SRVW4_TT2_144_WG64_4_1_WGM15
    SolutionIndex: 177
    SolutionNameMin: Cijk_Ailk_Bljk_BSS_BH_MT128x96x32_MI32x32x4x1_SE_AF0EM4_GRVW4_LBSPP128_LPB4_NLCA1_SU0_SUS256_SRVW4_TT1_96_WG128_2_1_WGM15
    SolutionIndex: 178
    SolutionNameMin: Cijk_Ailk_Bljk_BSS_BH_MT128x96x32_MI32x32x4x1_SE_AF0EM4_GRVW2_LBSPP128_LPB2_NLCA1_SU16_SUS128_SRVW4_TT1_96_WG128_2_1_WGM2
    SolutionIndex: 179
    SolutionNameMin: Cijk_Ailk_Bljk_BSS_BH_MT128x96x32_MI32x32x4x1_SE_AF0EM4_GRVW4_LBSPP128_LPB4_NLCA1_SU16_SUS128_SRVW4_TT1_96_WG128_2_1_WGM15
    SolutionIndex: 180
    SolutionNameMin: Cijk_Ailk_Bljk_BSS_BH_MT32x32x32_MI16x16x8x1_SE_AF0EM4_GRVW8_LBSPP128_LPB8_NLCA1_SU0_SUS256_SRVW0_TT1_16_WG32_8_1_WGM1
    SolutionIndex: 181
    SolutionNameMin: Cijk_Ailk_Bljk_BSS_BH_MT128x96x32_MI32x32x4x1_SE_AF0EM4_GRVW4_LBSPP128_LPB4_NLCA1_SU16_SUS128_SRVW4_TT1_96_WG128_2_1_WGM1
    SolutionIndex: 182
    SolutionNameMin: Cijk_Ailk_Bljk_BSS_BH_MT128x96x32_MI32x32x4x1_SE_AF0EM4_GRVW4_LBSPP128_LPB4_NLCA1_SU0_SUS128_SRVW4_TT1_96_WG128_2_1_WGM1
    SolutionIndex: 183
    SolutionNameMin: Cijk_Ailk_Bljk_BSS_BH_MT64x128x32_MI32x32x4x1_SE_AF0EM1_GRVW8_LBSPP128_LPB8_NLCA1_SU32_SUS256_SRVW4_TT1_64_WG64_4_1_WGM2
    SolutionIndex: 184
    SolutionNameMin: Cijk_Ailk_Bljk_BSS_BH_MT128x144x32_MI16x16x8x1_SE_AF0EM1_GRVW2_LBSPP128_LPB2_NLCA1_SU0_SUS128_SRVW4_TT2_144_WG64_4_1_WGM15
    SolutionIndex: 185
    SolutionNameMin: Cijk_Ailk_Bljk_BSS_BH_MT64x128x32_MI32x32x4x1_SE_AF0EM1_GRVW8_LBSPP128_LPB8_NLCA1_SU32_SUS128_SRVW4_TT1_64_WG64_4_1_WGM15
    SolutionIndex: 186
    SolutionNameMin: Cijk_Ailk_Bljk_BSS_BH_MT64x128x32_MI32x32x4x1_SE_AF0EM4_GRVW8_LBSPP128_LPB8_NLCA1_SU0_SUS128_SRVW4_TT1_64_WG64_4_1_WGM1
    SolutionIndex: 187
    SolutionNameMin: Cijk_Ailk_Bljk_BSS_BH_MT128x64x64_MI32x32x4x1_SE_AF0EM4_GRVW4_LBSPP128_LPB4_NLCA1_SU0_SUS256_SRVW4_TT2_32_WG64_4_1_WGM1
    SolutionIndex: 188
    SolutionNameMin: Cijk_Ailk_Bljk_BSS_BH_MT128x96x32_MI32x32x4x1_SE_AF0EM4_GRVW4_LBSPP128_LPB4_NLCA1_SU0_SUS256_SRVW4_TT1_96_WG128_2_1_WGM2
    SolutionIndex: 189
    SolutionNameMin: Cijk_Ailk_Bljk_BSS_BH_MT128x160x32_MI32x32x4x1_SE_AF0EM4_GRVW2_LBSPP128_LPB2_NLCA1_SU0_SUS256_SRVW4_TT1_160_WG128_2_1_WGM1
    SolutionIndex: 190
    SolutionNameMin: Cijk_Ailk_Bljk_BSS_BH_MT128x96x32_MI32x32x4x1_SE_AF0EM4_GRVW4_LBSPP128_LPB4_NLCA1_SU0_SUS128_SRVW4_TT1_96_WG128_2_1_WGM2
    SolutionIndex: 191
    SolutionNameMin: Cijk_Ailk_Bljk_BSS_BH_MT128x144x32_MI16x16x8x1_SE_AF0EM1_GRVW2_LBSPP128_LPB2_NLCA1_SU0_SUS128_SRVW0_TT2_144_WG64_4_1_WGM15
    SolutionIndex: 192
    SolutionNameMin: Cijk_Ailk_Bljk_BSS_BH_MT128x96x32_MI32x32x4x1_SE_AF0EM4_GRVW2_LBSPP128_LPB2_NLCA1_SU0_SUS256_SRVW4_TT1_96_WG128_2_1_WGM2
    SolutionIndex: 193
    SolutionNameMin: Cijk_Ailk_Bljk_BSS_BH_MT64x80x32_MI16x16x8x1_SE_AF0EM4_GRVW2_LBSPP128_LPB2_NLCA1_SU0_SUS256_SRVW4_TT1_80_WG64_4_1_WGM1
    SolutionIndex: 194
    SolutionNameMin: Cijk_Ailk_Bljk_BSS_BH_MT64x128x64_MI32x32x4x1_SE_AF0EM4_GRVW8_LBSPP128_LPB8_NLCA1_SU0_SUS128_SRVW4_TT1_64_WG64_4_1_WGM2
    SolutionIndex: 195
    SolutionNameMin: Cijk_Ailk_Bljk_BSS_BH_MT64x128x64_MI32x32x4x1_SE_AF0EM1_GRVW8_LBSPP128_LPB8_NLCA1_SU0_SUS128_SRVW4_TT1_64_WG64_4_1_WGM2
    SolutionIndex: 196
    SolutionNameMin: Cijk_Ailk_Bljk_BSS_BH_MT128x256x32_MI32x32x4x1_SE_GRVW8_LPB8_PLR9_SU32_SUS128_SRVW4_WGM2
    SolutionIndex: 197
    SolutionNameMin: Cijk_Ailk_Bljk_BSS_BH_MT64x128x32_MI32x32x4x1_SE_GRVW8_LPB8_PLR9_SU32_SUS128_SRVW4_WGM15
    SolutionIndex: 198
    SolutionNameMin: Cijk_Ailk_Bljk_BSS_BH_MT128x256x32_MI32x32x4x1_SE_GRVW8_LPB8_PLR9_SU32_SUS128_SRVW4_WGM15
    SolutionIndex: 199
    SolutionNameMin: Cijk_Ailk_Bljk_BSS_BH_MT128x144x32_MI16x16x8x1_SE_GRVW2_LPB4_PLR5_SU0_SUS256_SRVW4_WGM15
    SolutionIndex: 200
    SolutionNameMin: Cijk_Ailk_Bljk_BSS_BH_MT64x16x32_MI16x16x8x1_SE_GRVW2_LPB4_PLR5_SU32_SUS256_SRVW0_WGM15
    SolutionIndex: 201
    SolutionNameMin: Cijk_Ailk_Bljk_BSS_BH_MT128x96x32_MI32x32x4x1_SE_GRVW4_LPB4_PLR9_SU0_SUS256_SRVW0_WGM15
    SolutionIndex: 202
    SolutionNameMin: Cijk_Ailk_Bljk_BSS_BH_MT128x96x32_MI32x32x4x1_SE_GRVW4_LPB4_PLR9_SU0_SUS128_SRVW4_WGM15
    SolutionIndex: 203
    SolutionNameMin: Cijk_Ailk_Bljk_BSS_BH_MT128x144x32_MI16x16x8x1_SE_GRVW2_LPB4_PLR5_SU0_SUS128_SRVW4_WGM2
    SolutionIndex: 204
    SolutionNameMin: Cijk_Ailk_Bljk_BSS_BH_MT32x32x32_MI16x16x8x1_SE_GRVW2_LPB4_PLR5_SU0_SUS128_SRVW4_WGM1
    SolutionIndex: 205
    SolutionNameMin: Cijk_Ailk_Bljk_BSS_BH_MT128x128x32_MI32x32x4x1_SE_GRVW4_LPB4_PLR9_SU0_SUS256_SRVW0_WGM1
    SolutionIndex: 206
    SolutionNameMin: Cijk_Ailk_Bljk_BSS_BH_MT128x96x32_MI32x32x4x1_SE_GRVW4_LPB4_PLR9_SU32_SUS128_SRVW4_WGM1
    SolutionIndex: 207
    SolutionNameMin: Cijk_Ailk_Bljk_BSS_BH_MT128x96x32_MI32x32x4x1_SE_GRVW4_LPB4_PLR9_SU0_SUS128_SRVW4_WGM1
    SolutionIndex: 208
    SolutionNameMin: Cijk_Ailk_Bljk_BSS_BH_MT128x160x32_MI32x32x4x1_SE_GRVW4_LPB4_PLR9_SU0_SUS128_SRVW0_WGM15
    SolutionIndex: 209
    SolutionNameMin: Cijk_Ailk_Bljk_BSS_BH_MT128x96x32_MI32x32x4x1_SE_GRVW4_LPB4_PLR9_SU0_SUS128_SRVW4_WGM2
    SolutionIndex: 210
    SolutionNameMin: Cijk_Ailk_Bljk_BSS_BH_MT96x96x64_MI16x16x8x1_SE_GRVW8_LPB8_PLR9_SU0_SUS128_SRVW0_WGM1
    SolutionIndex: 211
    SolutionNameMin: Cijk_Ailk_Bljk_BSS_BH_MT64x16x32_MI16x16x8x1_SE_GRVW4_LPB4_PLR5_SU0_SUS256_SRVW0_WGM2
    SolutionIndex: 212
    SolutionNameMin: Cijk_Ailk_Bljk_BSS_BH_MT128x160x32_MI32x32x4x1_SE_GRVW4_LPB4_PLR9_SU0_SUS128_SRVW0_WGM15
    SolutionIndex: 213
    SolutionNameMin: Cijk_Ailk_Bljk_BSS_BH_MT128x160x32_MI32x32x4x1_SE_GRVW4_LPB4_PLR9_SU0_SUS256_SRVW0_WGM15
    SolutionIndex: 214
    SolutionNameMin: Cijk_Ailk_Bljk_BSS_BH_MT96x96x32_MI16x16x8x1_SE_GRVW4_LPB4_PLR5_SU0_SUS256_SRVW0_WGM1
    SolutionIndex: 215
    SolutionNameMin: Cijk_Ailk_Bljk_BSS_BH_MT96x96x64_MI16x16x8x1_SE_GRVW8_LPB8_PLR9_SU0_SUS256_SRVW0_WGM1
    SolutionIndex: 216
    SolutionNameMin: Cijk_Ailk_Bljk_BSS_BH_MT128x144x32_MI16x16x8x1_SE_GRVW2_LPB4_PLR5_SU0_SUS256_SRVW4_WGM2
    SolutionIndex: 217
    SolutionNameMin: Cijk_Ailk_Bljk_BSS_BH_MT128x144x32_MI16x16x8x1_SE_GRVW2_LPB4_PLR5_SU0_SUS128_SRVW0_WGM15
    SolutionIndex: 218
    SolutionNameMin: Cijk_Ailk_Bljk_BSS_BH_MT128x144x32_MI16x16x8x1_SE_GRVW2_LPB4_PLR5_SU0_SUS256_SRVW4_WGM1
    SolutionIndex: 219
    SolutionNameMin: Cijk_Ailk_Bljk_BSS_BH_MT128x144x32_MI16x16x8x1_SE_GRVW2_LPB4_PLR5_SU0_SUS128_SRVW0_WGM15
    SolutionIndex: 220
    SolutionNameMin: Cijk_Ailk_Bljk_BSS_BH_MT128x144x32_MI16x16x8x1_SE_GRVW2_LPB4_PLR5_SU0_SUS128_SRVW4_WGM1
    SolutionIndex: 221
    SolutionNameMin: Cijk_Ailk_Bljk_BSS_BH_MT64x128x32_MI32x32x4x1_SE_GRVW8_LPB8_PLR9_SU0_SUS128_SRVW4_WGM1
    SolutionIndex: 222
    SolutionNameMin: Cijk_Ailk_Bljk_BSS_BH_MT128x96x64_MI32x32x4x1_SE_GRVW8_LPB8_PLR17_SU32_SUS128_SRVW0_WGM2
    SolutionIndex: 223
    SolutionNameMin: Cijk_Ailk_Bljk_BSS_BH_MT96x96x64_MI16x16x8x1_SE_GRVW8_LPB8_PLR9_SU0_SUS128_SRVW0_WGM2
    SolutionIndex: 224
    SolutionNameMin: Cijk_Ailk_Bljk_BSS_BH_MT128x96x32_MI32x32x4x1_SE_GRVW4_LPB4_PLR9_SU0_SUS256_SRVW4_WGM1
    SolutionIndex: 225
    SolutionNameMin: Cijk_Ailk_Bljk_BSS_BH_MT128x160x32_MI32x32x4x1_SE_GRVW4_LPB4_PLR9_SU0_SUS256_SRVW0_WGM1
    SolutionIndex: 226
    SolutionNameMin: Cijk_Ailk_Bljk_BSS_BH_MT64x16x32_MI16x16x8x1_SE_GRVW4_LPB4_PLR5_SU32_SUS128_SRVW4_WGM2
    SolutionIndex: 227
    SolutionNameMin: Cijk_Ailk_Bljk_BSS_BH_MT128x96x64_MI32x32x4x1_SE_GRVW8_LPB8_PLR17_SU32_SUS128_SRVW0_WGM15
    SolutionIndex: 228
    SolutionNameMin: Cijk_Ailk_Bljk_BSS_BH_MT96x96x32_MI16x16x8x1_SE_GRVW4_LPB4_PLR5_SU0_SUS256_SRVW0_WGM2
    SolutionIndex: 229
    SolutionNameMin: Cijk_Ailk_Bljk_BSS_BH_MT128x96x32_MI32x32x4x1_SE_GRVW4_LPB4_PLR9_SU32_SUS128_SRVW4_WGM2
    SolutionIndex: 230
    SolutionNameMin: Cijk_Ailk_Bljk_BSS_BH_MT128x144x32_MI16x16x8x1_SE_GRVW2_LPB4_PLR5_SU32_SUS256_SRVW4_WGM2
    SolutionIndex: 231
    SolutionNameMin: Cijk_Ailk_Bljk_BSS_BH_MT64x32x32_MI16x16x8x1_SE_GRVW2_LPB4_PLR5_SU0_SUS128_SRVW4_WGM1
    SolutionIndex: 232
    SolutionNameMin: Cijk_Ailk_Bljk_BSS_BH_MT64x128x32_MI32x32x4x1_SE_GRVW8_LPB8_PLR9_SU0_SUS256_SRVW4_WGM2
    SolutionIndex: 233
    SolutionNameMin: Cijk_Ailk_Bljk_BSS_BH_MT128x96x32_MI32x32x4x1_SE_GRVW4_LPB4_PLR9_SU0_SUS256_SRVW4_WGM15
    SolutionIndex: 234
    SolutionNameMin: Cijk_Ailk_Bljk_BSS_BH_MT128x144x32_MI16x16x8x1_SE_GRVW2_LPB4_PLR5_SU0_SUS128_SRVW4_WGM2
    SolutionIndex: 235
    SolutionNameMin: Cijk_Ailk_Bljk_BSS_BH_MT64x16x32_MI16x16x8x1_SE_GRVW2_LPB4_PLR5_SU0_SUS128_SRVW0_WGM1
    SolutionIndex: 236
    SolutionNameMin: Cijk_Ailk_Bljk_BSS_BH_MT128x96x32_MI32x32x4x1_SE_GRVW4_LPB4_PLR9_SU0_SUS256_SRVW4_WGM2
    SolutionIndex: 237
    SolutionNameMin: Cijk_Ailk_Bljk_BSS_BH_MT256x160x32_MI32x32x4x1_SE_GRVW2_LPB4_PLR9_SU0_SUS128_SRVW4_WGM1
    SolutionIndex: 238
    SolutionNameMin: Cijk_Ailk_Bljk_BSS_BH_MT256x160x32_MI32x32x4x1_SE_GRVW4_LPB4_PLR9_SU0_SUS256_SRVW4_WGM15
    SolutionIndex: 239
    SolutionNameMin: Cijk_Ailk_Bljk_BSS_BH_MT128x96x64_MI32x32x4x1_SE_GRVW8_LPB8_PLR17_SU0_SUS128_SRVW4_WGM2
    SolutionIndex: 240
    SolutionNameMin: Cijk_Ailk_Bljk_BSS_BH_MT128x96x64_MI32x32x4x1_SE_GRVW8_LPB8_PLR17_SU0_SUS256_SRVW4_WGM2
    SolutionIndex: 241
    SolutionNameMin: Cijk_Ailk_Bljk_BSS_BH_MT128x144x32_MI16x16x8x1_SE_GRVW2_LPB4_PLR5_SU0_SUS128_SRVW4_WGM15
    SolutionIndex: 242
    SolutionNameMin: Cijk_Ailk_Bljk_BSS_BH_MT64x128x64_MI32x32x4x1_SE_GRVW8_LPB8_PLR17_SU0_SUS256_SRVW4_WGM1
    SolutionIndex: 243
    SolutionNameMin: Cijk_Ailk_Bljk_BSS_BH_MT128x160x32_MI32x32x4x1_SE_GRVW2_LPB4_PLR9_SU32_SUS128_SRVW4_WGM2
    SolutionIndex: 244
    SolutionNameMin: Cijk_Ailk_Bljk_BSS_BH_MT128x160x32_MI32x32x4x1_SE_GRVW2_LPB4_PLR9_SU0_SUS128_SRVW4_WGM15
    SolutionIndex: 245
    SolutionNameMin: Cijk_Ailk_Bljk_BSS_BH_MT128x128x32_MI32x32x4x1_SE_GRVW8_LPB8_PLR9_SU0_SUS128_SRVW4_WGM15
    SolutionIndex: 246
    SolutionNameMin: Cijk_Ailk_Bljk_BSS_BH_MT256x160x32_MI32x32x4x1_SE_GRVW2_LPB4_PLR9_SU0_SUS256_SRVW4_WGM1
    SolutionIndex: 247
    SolutionNameMin: Cijk_Ailk_Bljk_BSS_BH_MT128x96x32_MI32x32x4x1_SE_GRVW4_LPB4_PLR9_SU32_SUS256_SRVW4_WGM2
    SolutionIndex: 248
    SolutionNameMin: Cijk_Ailk_Bljk_BSS_BH_MT64x16x32_MI16x16x8x1_SE_GRVW2_LPB4_PLR5_SU0_SUS256_SRVW0_WGM1
    SolutionIndex: 249
    SolutionNameMin: Cijk_Ailk_Bljk_BSS_BH_MT64x32x32_MI16x16x8x1_SE_GRVW2_LPB4_PLR5_SU0_SUS256_SRVW4_WGM2
    SolutionIndex: 250
    SolutionNameMin: Cijk_Ailk_Bljk_BSS_BH_MT64x16x32_MI16x16x8x1_SE_GRVW8_LPB8_PLR5_SU32_SUS256_SRVW4_WGM15
    SolutionIndex: 251
    SolutionNameMin: Cijk_Ailk_Bljk_BSS_BH_MT64x128x32_MI32x32x4x1_SE_GRVW8_LPB8_PLR9_SU0_SUS128_SRVW4_WGM15
    SolutionIndex: 252
    SolutionNameMin: Cijk_Ailk_Bljk_BSS_BH_MT64x16x32_MI16x16x8x1_SE_GRVW2_LPB4_PLR5_SU0_SUS256_SRVW0_WGM2
    SolutionIndex: 253
    SolutionNameMin: Cijk_Ailk_Bljk_BSS_BH_MT64x16x32_MI16x16x8x1_SE_GRVW4_LPB4_PLR5_SU0_SUS256_SRVW0_WGM1
    SolutionIndex: 254
    SolutionNameMin: Cijk_Ailk_Bljk_BSS_BH_MT128x160x32_MI32x32x4x1_SE_GRVW2_LPB4_PLR9_SU0_SUS128_SRVW4_WGM1
    SolutionIndex: 255
    SolutionNameMin: Cijk_Ailk_Bljk_BSS_BH_MT32x32x64_MI16x16x8x1_SE_GRVW8_LPB8_PLR9_SU0_SUS128_SRVW0_WGM1
    SolutionIndex: 256
    SolutionNameMin: Cijk_Ailk_Bljk_BSS_BH_MT96x96x32_MI16x16x8x1_SE_GRVW4_LPB4_PLR5_SU0_SUS128_SRVW0_WGM1
    SolutionIndex: 257
    SolutionNameMin: Cijk_Ailk_Bljk_BSS_BH_MT64x128x32_MI32x32x4x1_SE_GRVW8_LPB8_PLR9_SU0_SUS256_SRVW4_WGM15
    SolutionIndex: 258
    SolutionNameMin: Cijk_Ailk_Bljk_BSS_BH_MT96x96x32_MI16x16x8x1_SE_GRVW4_LPB4_PLR5_SU0_SUS256_SRVW0_WGM2
    SolutionIndex: 259
    SolutionNameMin: Cijk_Ailk_Bljk_BSS_BH_MT64x128x32_MI32x32x4x1_SE_GRVW8_LPB8_PLR9_SU32_SUS256_SRVW4_WGM2
    SolutionIndex: 260
    SolutionNameMin: Cijk_Ailk_Bljk_BSS_BH_MT96x96x32_MI16x16x8x1_SE_GRVW4_LPB4_PLR5_SU0_SUS128_SRVW0_WGM2
    SolutionIndex: 261
    SolutionNameMin: Cijk_Ailk_Bljk_BSS_BH_MT64x128x32_MI32x32x4x1_SE_GRVW8_LPB8_PLR9_SU0_SUS256_SRVW4_WGM1
    SolutionIndex: 262
    SolutionNameMin: Cijk_Ailk_Bljk_BSS_BH_MT64x128x32_MI32x32x4x1_SE_GRVW8_LPB8_PLR9_SU32_SUS128_SRVW4_WGM1
    SolutionIndex: 263
    SolutionNameMin: Cijk_Ailk_Bljk_BSS_BH_MT64x128x32_MI32x32x4x1_SE_GRVW8_LPB8_PLR9_SU32_SUS128_SRVW4_WGM2
    SolutionIndex: 264
    SolutionNameMin: Cijk_Ailk_Bljk_BSS_BH_MT128x144x32_MI16x16x8x1_SE_GRVW2_LPB4_PLR5_SU32_SUS128_SRVW4_WGM2
    SolutionIndex: 265
    SolutionNameMin: Cijk_Ailk_Bljk_BSS_BH_MT128x144x32_MI16x16x8x1_SE_GRVW2_LPB4_PLR5_SU32_SUS128_SRVW4_WGM1
    SolutionIndex: 266
    SolutionNameMin: Cijk_Ailk_Bljk_BSS_BH_MT128x96x64_MI32x32x4x1_SE_GRVW2_LPB4_PLR17_SU0_SUS128_SRVW0_WGM1
    SolutionIndex: 267
    SolutionNameMin: Cijk_Ailk_Bljk_BSS_BH_MT144x128x32_MI16x16x8x1_SE_GRVW2_LPB4_PLR5_SU0_SUS256_SRVW0_WGM2
    SolutionIndex: 268
    SolutionNameMin: Cijk_Ailk_Bljk_BSS_BH_MT64x32x64_MI16x16x8x1_SE_GRVW8_LPB8_PLR9_SU0_SUS128_SRVW0_WGM1
    SolutionIndex: 269
    SolutionNameMin: Cijk_Ailk_Bljk_BSS_BH_MT64x128x32_MI32x32x4x1_SE_GRVW2_LPB4_PLR9_SU0_SUS128_SRVW4_WGM1
    SolutionIndex: 270
    SolutionNameMin: Cijk_Ailk_Bljk_BSS_BH_MT128x96x64_MI32x32x4x1_SE_GRVW2_LPB4_PLR17_SU0_SUS128_SRVW4_WGM15
    SolutionIndex: 271
    SolutionNameMin: Cijk_Ailk_Bljk_BSS_BH_MT96x96x32_MI16x16x8x1_SE_GRVW4_LPB4_PLR5_SU0_SUS256_SRVW0_WGM15
    SolutionIndex: 272
    SolutionNameMin: Cijk_Ailk_Bljk_BSS_BH_MT32x32x64_MI16x16x8x1_SE_GRVW8_LPB8_PLR9_SU0_SUS128_SRVW0_WGM1
    SolutionIndex: 273
    SolutionNameMin: Cijk_Ailk_Bljk_BSS_BH_MT96x96x32_MI16x16x8x1_SE_GRVW4_LPB4_PLR5_SU32_SUS128_SRVW0_WGM15
    SolutionIndex: 274
    SolutionNameMin: Cijk_Ailk_Bljk_BSS_BH_MT64x128x64_MI32x32x4x1_SE_GRVW8_LPB8_PLR17_SU0_SUS256_SRVW4_WGM15
    SolutionIndex: 275
    SolutionNameMin: Cijk_Ailk_Bljk_BSS_BH_MT128x64x64_MI32x32x4x1_SE_GRVW8_LPB8_PLR17_SU0_SUS256_SRVW4_WGM1
    SolutionIndex: 276
    SolutionNameMin: Cijk_Ailk_Bljk_BSS_BH_MT96x96x64_MI16x16x8x1_SE_GRVW8_LPB8_PLR9_SU32_SUS256_SRVW0_WGM15
    SolutionIndex: 277
    SolutionNameMin: Cijk_Ailk_Bljk_BSS_BH_MT128x160x32_MI32x32x4x1_SE_GRVW2_LPB4_PLR9_SU0_SUS128_SRVW4_WGM2
    SolutionIndex: 278
    SolutionNameMin: Cijk_Ailk_Bljk_BSS_BH_MT128x160x32_MI32x32x4x1_SE_GRVW2_LPB4_PLR9_SU32_SUS128_SRVW4_WGM15
    SolutionIndex: 279
    SolutionNameMin: Cijk_Ailk_Bljk_BSS_BH_MT64x128x64_MI32x32x4x1_SE_GRVW8_LPB8_PLR17_SU0_SUS128_SRVW4_WGM1
    SolutionIndex: 280
    SolutionNameMin: Cijk_Ailk_Bljk_BSS_BH_MT128x96x64_MI32x32x4x1_SE_GRVW8_LPB8_PLR17_SU0_SUS128_SRVW0_WGM2
    SolutionIndex: 281
    SolutionNameMin: Cijk_Ailk_Bljk_BSS_BH_MT128x96x64_MI32x32x4x1_SE_GRVW2_LPB4_PLR17_SU0_SUS256_SRVW4_WGM15
    SolutionIndex: 282
    SolutionNameMin: Cijk_Ailk_Bljk_BSS_BH_MT128x96x64_MI32x32x4x1_SE_GRVW2_LPB4_PLR17_SU32_SUS128_SRVW4_WGM1
    SolutionIndex: 283
    SolutionNameMin: Cijk_Ailk_Bljk_BSS_BH_MT64x32x32_MI16x16x8x1_SE_GRVW8_LPB8_PLR5_SU0_SUS128_SRVW4_WGM1
    SolutionIndex: 284
    SolutionNameMin: Cijk_Ailk_Bljk_BSS_BH_MT64x32x32_MI16x16x8x1_SE_GRVW8_LPB8_PLR5_SU32_SUS128_SRVW4_WGM1
    SolutionIndex: 285
    SolutionNameMin: Cijk_Ailk_Bljk_BSS_BH_MT32x32x32_MI16x16x8x1_SE_GRVW4_LPB4_PLR5_SU0_SUS128_SRVW4_WGM2
    SolutionIndex: 286
    SolutionNameMin: Cijk_Ailk_Bljk_BSS_BH_MT32x32x64_MI16x16x8x1_SE_GRVW8_LPB8_PLR9_SU32_SUS128_SRVW4_WGM15
    SolutionIndex: 287
    SolutionNameMin: Cijk_Ailk_Bljk_BSS_BH_MT128x96x32_MI32x32x4x1_SE_GRVW4_LPB4_PLR9_SU32_SUS128_SRVW4_WGM15
    SolutionIndex: 288
    SolutionNameMin: Cijk_Ailk_Bljk_BSS_BH_MT64x64x32_MI32x32x4x1_SE_GRVW8_LPB8_PLR9_SU32_SUS256_SRVW4_WGM15
    SolutionIndex: 289
    SolutionNameMin: Cijk_Ailk_Bljk_BSS_BH_MT64x64x32_MI32x32x4x1_SE_GRVW8_LPB8_PLR9_SU32_SUS256_SRVW4_WGM2
    SolutionIndex: 290
    SolutionNameMin: Cijk_Ailk_Bljk_BSS_BH_MT64x128x32_MI32x32x4x1_SE_GRVW4_LPB4_PLR9_SU0_SUS256_SRVW4_WGM15
    SolutionIndex: 291
    SolutionNameMin: Cijk_Ailk_Bljk_BSS_BH_MT32x32x64_MI16x16x8x1_SE_GRVW8_LPB8_PLR9_SU0_SUS128_SRVW4_WGM2
    SolutionIndex: 292
    SolutionNameMin: Cijk_Ailk_Bljk_BSS_BH_MT96x96x64_MI16x16x8x1_SE_GRVW8_LPB8_PLR9_SU0_SUS256_SRVW0_WGM15
    SolutionIndex: 293
    SolutionNameMin: Cijk_Ailk_Bljk_BSS_BH_MT96x96x64_MI16x16x8x1_SE_GRVW8_LPB8_PLR9_SU0_SUS256_SRVW0_WGM2
    SolutionIndex: 294
    SolutionNameMin: Cijk_Ailk_Bljk_BSS_BH_MT64x64x64_MI32x32x4x1_SE_GRVW8_LPB8_PLR17_SU0_SUS128_SRVW4_WGM1
    SolutionIndex: 295
    SolutionNameMin: Cijk_Ailk_Bljk_BSS_BH_MT64x128x32_MI32x32x4x1_SE_GRVW8_LPB8_PLR9_SU32_SUS256_SRVW4_WGM1
    SolutionIndex: 296
    SolutionNameMin: Cijk_Ailk_Bljk_BSS_BH_MT128x144x32_MI16x16x8x1_SE_GRVW2_LPB4_PLR5_SU32_SUS256_SRVW4_WGM1
    SolutionIndex: 297
    SolutionNameMin: Cijk_Ailk_Bljk_BSS_BH_MT32x32x32_MI16x16x8x1_SE_GRVW4_LPB4_PLR5_SU0_SUS256_SRVW4_WGM15
    SolutionIndex: 298
    SolutionNameMin: Cijk_Ailk_Bljk_BSS_BH_MT128x128x32_MI32x32x4x1_SE_GRVW4_LPB4_PLR9_SU0_SUS256_SRVW0_WGM2
    SolutionIndex: 299
    SolutionNameMin: Cijk_Ailk_Bljk_BSS_BH_MT256x128x32_MI32x32x4x1_SE_GRVW8_LPB8_PLR9_SU32_SUS256_SRVW0_WGM15
    SolutionIndex: 300
    SolutionNameMin: Cijk_Ailk_Bljk_BSS_BH_MT256x160x32_MI32x32x4x1_SE_GRVW4_LPB4_PLR9_SU0_SUS256_SRVW0_WGM2
    SolutionIndex: 301
    SolutionNameMin: Cijk_Ailk_Bljk_BSS_BH_MT32x32x64_MI16x16x8x1_SE_GRVW8_LPB8_PLR9_SU32_SUS128_SRVW4_WGM1
    SolutionIndex: 302
    SolutionNameMin: Cijk_Ailk_Bljk_BSS_BH_MT128x128x32_MI32x32x4x1_SE_GRVW2_LPB4_PLR9_SU0_SUS128_SRVW4_WGM1
    SolutionIndex: 303
    SolutionNameMin: Cijk_Ailk_Bljk_BSS_BH_MT32x32x64_MI16x16x8x1_SE_GRVW8_LPB8_PLR9_SU32_SUS256_SRVW4_WGM2
    SolutionIndex: 304
    SolutionNameMin: Cijk_Ailk_Bljk_BSS_BH_MT32x32x32_MI16x16x8x1_SE_GRVW4_LPB4_PLR5_SU0_SUS128_SRVW4_WGM15
    SolutionIndex: 305
    SolutionNameMin: Cijk_Ailk_Bljk_BSS_BH_MT64x32x32_MI16x16x8x1_SE_GRVW2_LPB4_PLR5_SU0_SUS256_SRVW4_WGM1
    SolutionIndex: 306
    SolutionNameMin: Cijk_Ailk_Bljk_BSS_BH_MT128x160x32_MI32x32x4x1_SE_GRVW4_LPB4_PLR9_SU0_SUS256_SRVW0_WGM2
    SolutionIndex: 307
    SolutionNameMin: Cijk_Ailk_Bljk_BSS_BH_MT64x256x32_MI32x32x4x1_SE_GRVW8_LPB8_PLR9_SU0_SUS256_SRVW0_WGM15
    SolutionIndex: 308
    SolutionNameMin: Cijk_Ailk_Bljk_BSS_BH_MT128x96x32_MI32x32x4x1_SE_GRVW2_LPB4_PLR9_SU0_SUS256_SRVW4_WGM2
    SolutionIndex: 309
    SolutionNameMin: Cijk_Ailk_Bljk_BSS_BH_MT64x128x32_MI32x32x4x1_SE_GRVW2_LPB4_PLR9_SU0_SUS256_SRVW4_WGM2
    SolutionIndex: 310
    SolutionNameMin: Cijk_Ailk_Bljk_BSS_BH_MT64x32x32_MI16x16x8x1_SE_GRVW8_LPB8_PLR5_SU32_SUS128_SRVW4_WGM15
    SolutionIndex: 311
    SolutionNameMin: Cijk_Ailk_Bljk_BSS_BH_MT64x64x32_MI32x32x4x1_SE_GRVW8_LPB8_PLR9_SU0_SUS256_SRVW4_WGM1
    SolutionIndex: 312
    SolutionNameMin: Cijk_Ailk_Bljk_BSS_BH_MT64x64x32_MI32x32x4x1_SE_GRVW4_LPB4_PLR9_SU0_SUS256_SRVW4_WGM15
    SolutionIndex: 313
    SolutionNameMin: Cijk_Ailk_Bljk_BSS_BH_MT64x64x32_MI32x32x4x1_SE_GRVW8_LPB8_PLR9_SU32_SUS128_SRVW4_WGM1
    SolutionIndex: 314
    SolutionNameMin: Cijk_Ailk_Bljk_BSS_BH_MT32x64x64_MI16x16x8x1_SE_GRVW8_LPB8_PLR9_SU0_SUS256_SRVW4_WGM15
    SolutionIndex: 315
    SolutionNameMin: Cijk_Ailk_Bljk_BSS_BH_MT64x128x64_MI32x32x4x1_SE_GRVW8_LPB8_PLR17_SU0_SUS256_SRVW4_WGM2
    SolutionIndex: 316
    SolutionNameMin: Cijk_Ailk_Bljk_BSS_BH_MT64x64x32_MI32x32x4x1_SE_GRVW8_LPB8_PLR9_SU0_SUS128_SRVW4_WGM1
    SolutionIndex: 317
    SolutionNameMin: Cijk_Ailk_Bljk_BSS_BH_MT64x64x32_MI32x32x4x1_SE_GRVW8_LPB8_PLR9_SU0_SUS128_SRVW4_WGM2
    SolutionIndex: 318
    SolutionNameMin: Cijk_Ailk_Bljk_BSS_BH_MT32x64x64_MI16x16x8x1_SE_GRVW4_LPB4_PLR9_SU0_SUS128_SRVW4_WGM15
    SolutionIndex: 319
    SolutionNameMin: Cijk_Ailk_Bljk_BSS_BH_MT64x128x64_MI32x32x4x1_SE_GRVW8_LPB8_PLR17_SU0_SUS128_SRVW4_WGM2
    SolutionIndex: 320
    SolutionNameMin: Cijk_Ailk_Bljk_BSS_BH_MT64x64x32_MI32x32x4x1_SE_GRVW8_LPB8_PLR9_SU0_SUS128_SRVW4_WGM15
    SolutionIndex: 321
    SolutionNameMin: Cijk_Ailk_Bljk_BSS_BH_MT128x96x64_MI32x32x4x1_SE_GRVW8_LPB8_PLR17_SU0_SUS256_SRVW4_WGM15
    SolutionIndex: 322
    SolutionNameMin: Cijk_Ailk_Bljk_BSS_BH_MT128x144x32_MI16x16x8x1_SE_GRVW2_LPB4_PLR5_SU32_SUS128_SRVW4_WGM15
    SolutionIndex: 323
    SolutionNameMin: Cijk_Ailk_Bljk_BSS_BH_MT128x96x32_MI32x32x4x1_SE_GRVW2_LPB4_PLR9_SU32_SUS256_SRVW4_WGM2
    SolutionIndex: 324
    SolutionNameMin: Cijk_Ailk_Bljk_BSS_BH_MT32x64x32_MI16x16x8x1_SE_GRVW2_LPB4_PLR5_SU0_SUS256_SRVW4_WGM2
    SolutionIndex: 325
    SolutionNameMin: Cijk_Ailk_Bljk_BSS_BH_MT128x96x32_MI32x32x4x1_SE_GRVW2_LPB4_PLR9_SU32_SUS128_SRVW4_WGM2
    SolutionIndex: 326
    SolutionNameMin: Cijk_Ailk_Bljk_BSS_BH_MT128x96x32_MI32x32x4x1_SE_GRVW2_LPB4_PLR9_SU0_SUS128_SRVW4_WGM15
    SolutionIndex: 327
    SolutionNameMin: Cijk_Ailk_Bljk_BSS_BH_MT64x32x32_MI16x16x8x1_SE_GRVW8_LPB8_PLR5_SU0_SUS256_SRVW4_WGM1
    SolutionIndex: 328
    SolutionNameMin: Cijk_Ailk_Bljk_BSS_BH_MT256x128x32_MI32x32x4x1_SE_GRVW8_LPB8_PLR9_SU0_SUS256_SRVW0_WGM1
    SolutionIndex: 329
    SolutionNameMin: Cijk_Ailk_Bljk_BSS_BH_MT128x128x32_MI32x32x4x1_SE_GRVW8_LPB8_PLR9_SU0_SUS128_SRVW4_WGM1
    SolutionIndex: 330
    SolutionNameMin: Cijk_Ailk_Bljk_BSS_BH_MT128x128x32_MI32x32x4x1_SE_GRVW8_LPB8_PLR9_SU0_SUS128_SRVW4_WGM2
    SolutionIndex: 331
    SolutionNameMin: Cijk_Ailk_Bljk_BSS_BH_MT32x64x32_MI16x16x8x1_SE_GRVW2_LPB4_PLR5_SU0_SUS256_SRVW4_WGM1
    SolutionIndex: 332
    SolutionNameMin: Cijk_Ailk_Bljk_BSS_BH_MT128x96x32_MI32x32x4x1_SE_GRVW2_LPB4_PLR9_SU0_SUS128_SRVW4_WGM2
    SolutionIndex: 333
    SolutionNameMin: Cijk_Ailk_Bljk_BSS_BH_MT128x160x32_MI32x32x4x1_SE_GRVW4_LPB4_PLR9_SU0_SUS256_SRVW4_WGM2
    SolutionIndex: 334
    SolutionNameMin: Cijk_Ailk_Bljk_BSS_BH_MT96x96x32_MI16x16x8x1_SE_GRVW4_LPB4_PLR5_SU0_SUS128_SRVW0_WGM1
    SolutionIndex: 335
    SolutionNameMin: Cijk_Ailk_Bljk_BSS_BH_MT32x32x64_MI16x16x8x1_SE_GRVW4_LPB4_PLR9_SU0_SUS128_SRVW0_WGM1
    SolutionIndex: 336
    SolutionNameMin: Cijk_Ailk_Bljk_BSS_BH_MT32x32x64_MI16x16x8x1_SE_GRVW8_LPB8_PLR9_SU0_SUS256_SRVW0_WGM1
    SolutionIndex: 337
    SolutionNameMin: Cijk_Ailk_Bljk_BSS_BH_MT64x128x64_MI32x32x4x1_SE_GRVW8_LPB8_PLR17_SU0_SUS128_SRVW0_WGM1
    SolutionIndex: 338
    SolutionNameMin: Cijk_Ailk_Bljk_BSS_BH_MT128x96x32_MI32x32x4x1_SE_GRVW4_LPB4_PLR9_SU0_SUS128_SRVW4_WGM2
    SolutionIndex: 339
    SolutionNameMin: Cijk_Ailk_Bljk_BSS_BH_MT64x128x32_MI32x32x4x1_SE_GRVW8_LPB8_PLR9_SU0_SUS256_SRVW4_WGM15
    SolutionIndex: 340
    SolutionNameMin: Cijk_Ailk_Bljk_BSS_BH_MT128x96x32_MI32x32x4x1_SE_GRVW4_LPB4_PLR9_SU0_SUS128_SRVW4_WGM15
    SolutionIndex: 341
    SolutionNameMin: Cijk_Ailk_Bljk_BSS_BH_MT64x128x32_MI32x32x4x1_SE_GRVW4_LPB4_PLR9_SU0_SUS256_SRVW4_WGM15
    SolutionIndex: 342
    SolutionNameMin: Cijk_Ailk_Bljk_BSS_BH_MT64x128x64_MI32x32x4x1_SE_GRVW8_LPB8_PLR17_SU32_SUS256_SRVW4_WGM2
    SolutionIndex: 343
    SolutionNameMin: Cijk_Ailk_Bljk_BSS_BH_MT128x96x32_MI32x32x4x1_SE_GRVW4_LPB4_PLR9_SU0_SUS256_SRVW4_WGM2
    SolutionIndex: 344
    SolutionNameMin: Cijk_Ailk_Bljk_BSS_BH_MT64x128x32_MI32x32x4x1_SE_GRVW4_LPB4_PLR9_SU0_SUS128_SRVW4_WGM1
    SolutionIndex: 345
    SolutionNameMin: Cijk_Ailk_Bljk_BSS_BH_MT64x128x32_MI32x32x4x1_SE_GRVW4_LPB4_PLR9_SU32_SUS128_SRVW4_WGM2
    SolutionIndex: 346
    SolutionNameMin: Cijk_Ailk_Bljk_BSS_BH_MT96x96x32_MI16x16x8x1_SE_GRVW4_LPB4_PLR5_SU0_SUS256_SRVW0_WGM2
    SolutionIndex: 347
    SolutionNameMin: Cijk_Ailk_Bljk_BSS_BH_MT64x128x32_MI32x32x4x1_SE_GRVW8_LPB8_PLR9_SU32_SUS256_SRVW4_WGM15
    SolutionIndex: 348
    SolutionNameMin: Cijk_Ailk_Bljk_BSS_BH_MT64x128x32_MI32x32x4x1_SE_GRVW8_LPB8_PLR9_SU0_SUS256_SRVW4_WGM2
    SolutionIndex: 349
    SolutionNameMin: Cijk_Ailk_Bljk_BSS_BH_MT64x128x32_MI32x32x4x1_SE_GRVW4_LPB4_PLR9_SU0_SUS256_SRVW4_WGM1
    SolutionIndex: 350
    SolutionNameMin: Cijk_Ailk_Bljk_BSS_BH_MT64x32x32_MI16x16x8x1_SE_GRVW4_LPB4_PLR5_SU0_SUS128_SRVW4_WGM15
    SolutionIndex: 351
    SolutionNameMin: Cijk_Ailk_Bljk_BSS_BH_MT64x32x32_MI16x16x8x1_SE_GRVW8_LPB8_PLR5_SU0_SUS128_SRVW4_WGM1
    SolutionIndex: 352
    SolutionNameMin: Cijk_Ailk_Bljk_BSS_BH_MT64x32x32_MI16x16x8x1_SE_GRVW4_LPB4_PLR5_SU0_SUS128_SRVW4_WGM1
    SolutionIndex: 353
    SolutionNameMin: Cijk_Ailk_Bljk_BSS_BH_MT64x64x32_MI32x32x4x1_SE_GRVW8_LPB8_PLR9_SU0_SUS128_SRVW4_WGM1
    SolutionIndex: 354
    SolutionNameMin: Cijk_Ailk_Bljk_BSS_BH_MT64x32x32_MI16x16x8x1_SE_GRVW4_LPB4_PLR5_SU0_SUS256_SRVW4_WGM1
    SolutionIndex: 355
    SolutionNameMin: Cijk_Ailk_Bljk_BSS_BH_MT64x64x32_MI32x32x4x1_SE_GRVW8_LPB8_PLR9_SU0_SUS256_SRVW4_WGM1
    SolutionIndex: 356
    SolutionNameMin: Cijk_Ailk_Bljk_BSS_BH_MT64x128x32_MI32x32x4x1_SE_GRVW8_LPB8_PLR9_SU0_SUS128_SRVW4_WGM1
    SolutionIndex: 357
    SolutionNameMin: Cijk_Ailk_Bljk_BSS_BH_MT64x32x32_MI16x16x8x1_SE_GRVW4_LPB4_PLR5_SU0_SUS256_SRVW4_WGM15
    SolutionIndex: 358
    SolutionNameMin: Cijk_Ailk_Bljk_BSS_BH_MT64x32x32_MI16x16x8x1_SE_GRVW8_LPB8_PLR5_SU0_SUS256_SRVW4_WGM1
    SolutionIndex: 359
    SolutionNameMin: Cijk_Ailk_Bljk_BSS_BH_MT64x32x32_MI16x16x8x1_SE_GRVW4_LPB4_PLR5_SU0_SUS128_SRVW4_WGM2
    SolutionIndex: 360
    SolutionNameMin: Cijk_Ailk_Bljk_BSS_BH_MT64x64x32_MI32x32x4x1_SE_GRVW4_LPB4_PLR9_SU0_SUS128_SRVW4_WGM1
    SolutionIndex: 361
    SolutionNameMin: Cijk_Ailk_Bljk_BSS_BH_MT32x64x64_MI16x16x8x1_SE_GRVW4_LPB4_PLR9_SU0_SUS128_SRVW0_WGM1
    SolutionIndex: 362
    SolutionNameMin: Cijk_Ailk_Bljk_BSS_BH_MT32x64x64_MI16x16x8x1_SE_GRVW8_LPB8_PLR9_SU0_SUS256_SRVW0_WGM15
    SolutionIndex: 363
    SolutionNameMin: Cijk_Ailk_Bljk_BSS_BH_MT64x128x32_MI32x32x4x1_SE_GRVW8_LPB8_PLR9_SU32_SUS128_SRVW4_WGM15
    SolutionIndex: 364
    SolutionNameMin: Cijk_Ailk_Bljk_BSS_BH_MT64x128x32_MI32x32x4x1_SE_GRVW8_LPB8_PLR9_SU0_SUS128_SRVW4_WGM2
    SolutionIndex: 365
    SolutionNameMin: Cijk_Ailk_Bljk_BSS_BH_MT64x128x32_MI32x32x4x1_SE_GRVW8_LPB8_PLR9_SU32_SUS256_SRVW4_WGM2
    SolutionIndex: 366
    SolutionNameMin: Cijk_Ailk_Bljk_BSS_BH_MT64x128x64_MI32x32x4x1_SE_GRVW8_LPB8_PLR17_SU0_SUS128_SRVW4_WGM15
    SolutionIndex: 367
    SolutionNameMin: Cijk_Ailk_Bljk_BSS_BH_MT64x128x64_MI32x32x4x1_SE_GRVW2_LPB4_PLR17_SU0_SUS128_SRVW4_WGM2
- - - [7680, 8192, 1, 8192]
    - [196, 96.67]
  - - [3840, 4096, 1, 4096]
    - [197, 94.507]
  - - [1920, 2048, 1, 2048]
    - [21, 88.819]
  - - [960, 1024, 1, 1024]
    - [9, 67.772]
  - - [480, 512, 1, 512]
    - [53, 20.302]
  - - [8192, 7680, 1, 8192]
    - [198, 96.62]
  - - [4096, 3840, 1, 4096]
    - [13, 94.359]
  - - [2048, 1920, 1, 2048]
    - [31, 88.611]
  - - [1024, 960, 1, 1024]
    - [24, 66.811]
  - - [512, 480, 1, 512]
    - [42, 22.43]
  - - [8192, 8192, 1, 8192]
    - [49, 96.193]
  - - [4096, 4096, 1, 4096]
    - [57, 92.26]
  - - [2048, 2048, 1, 2048]
    - [199, 85.564]
  - - [1024, 1024, 1, 1024]
    - [41, 55.825]
  - - [512, 512, 1, 512]
    - [52, 19.78]
  - - [64, 512, 16, 512]
    - [25, 31.402]
  - - [64, 512, 128, 512]
    - [48, 48.544]
  - - [1024, 1, 1, 2]
    - [200, 0.001]
  - - [1024, 1, 1, 1024]
    - [26, 0.135]
  - - [1024, 8, 1, 1024]
    - [58, 1.09]
  - - [1024, 77, 1, 1024]
    - [36, 11.899]
  - - [1024, 77, 1, 30522]
    - [201, 49.718]
  - - [1024, 512, 1, 2]
    - [8, 0.27]
  - - [1024, 512, 1, 1024]
    - [51, 42.22]
  - - [1024, 512, 1, 4096]
    - [55, 57.42]
  - - [1024, 616, 1, 1024]
    - [5, 40.982]
  - - [1024, 4096, 1, 2]
    - [14, 0.818]
  - - [1024, 4096, 1, 1024]
    - [202, 78.046]
  - - [1024, 4096, 1, 4096]
    - [3, 88.654]
  - - [4096, 512, 1, 1024]
    - [17, 64.933]
  - - [4096, 4096, 1, 1024]
    - [203, 85.838]
  - - [64, 128, 128, 128]
    - [4, 18.609]
  - - [64, 128, 160, 128]
    - [10, 22.59]
  - - [1024, 10, 1, 2]
    - [204, 0.006]
  - - [1024, 10, 1, 1024]
    - [16, 1.363]
  - - [1024, 160, 1, 1024]
    - [18, 19.874]
  - - [1024, 200, 1, 1024]
    - [33, 24.38]
  - - [1024, 200, 1, 30522]
    - [205, 59.239]
  - - [1024, 1024, 1, 2]
    - [19, 0.446]
  - - [1024, 1024, 1, 4096]
    - [41, 71.519]
  - - [1024, 1280, 1, 2]
    - [30, 0.545]
  - - [1024, 1280, 1, 1024]
    - [50, 62.96]
  - - [1024, 1280, 1, 4096]
    - [43, 78.381]
  - - [4096, 1024, 1, 1024]
    - [206, 78.275]
  - - [4096, 1280, 1, 1024]
    - [207, 76.357]
  - - [64, 128, 624, 128]
    - [27, 28.024]
  - - [1024, 39, 1, 2]
    - [6, 0.027]
  - - [1024, 39, 1, 1024]
    - [26, 5.587]
  - - [1024, 780, 1, 1024]
    - [40, 51.369]
  - - [1024, 780, 1, 30522]
    - [208, 87.444]
  - - [1024, 4992, 1, 2]
    - [12, 0.882]
  - - [1024, 4992, 1, 1024]
    - [209, 76.363]
  - - [1024, 4992, 1, 4096]
    - [210, 84.405]
  - - [4096, 4992, 1, 1024]
    - [37, 88.304]
  - - [64, 512, 64, 512]
    - [20, 44.462]
  - - [1024, 4, 1, 2]
    - [211, 0.003]
  - - [1024, 4, 1, 1024]
    - [44, 0.535]
  - - [1024, 308, 1, 1024]
    - [35, 29.778]
  - - [1024, 308, 1, 30522]
    - [212, 73.843]
  - - [1024, 2048, 1, 2]
    - [22, 0.665]
  - - [1024, 2048, 1, 1024]
    - [39, 73.48]
  - - [1024, 2048, 1, 4096]
    - [45, 85.564]
  - - [4096, 2048, 1, 1024]
    - [32, 82.491]
  - - [64, 128, 640, 128]
    - [38, 28.226]
  - - [1024, 40, 1, 2]
    - [2, 0.027]
  - - [1024, 40, 1, 1024]
    - [36, 5.73]
  - - [1024, 800, 1, 1024]
    - [29, 52.161]
  - - [1024, 800, 1, 30522]
    - [213, 89.31]
  - - [1024, 5120, 1, 2]
    - [46, 0.853]
  - - [1024, 5120, 1, 1024]
    - [214, 77.059]
  - - [1024, 5120, 1, 4096]
    - [215, 84.959]
  - - [4096, 5120, 1, 1024]
    - [216, 87.379]
  - - [64, 128, 656, 128]
    - [59, 28.234]
  - - [1024, 41, 1, 2]
    - [2, 0.028]
  - - [1024, 41, 1, 1024]
    - [26, 5.831]
  - - [1024, 820, 1, 1024]
    - [34, 54.368]
  - - [1024, 820, 1, 30522]
    - [217, 83.453]
  - - [1024, 5248, 1, 2]
    - [56, 0.849]
  - - [1024, 5248, 1, 1024]
    - [202, 78.088]
  - - [1024, 5248, 1, 4096]
    - [202, 86.353]
  - - [4096, 5248, 1, 1024]
    - [218, 88.409]
  - - [64, 512, 80, 512]
    - [15, 48.124]
  - - [1024, 5, 1, 2]
    - [204, 0.003]
  - - [1024, 5, 1, 1024]
    - [54, 0.663]
  - - [1024, 385, 1, 1024]
    - [11, 36.858]
  - - [1024, 385, 1, 30522]
    - [219, 74.798]
  - - [1024, 2560, 1, 2]
    - [23, 0.705]
  - - [1024, 2560, 1, 1024]
    - [32, 70.764]
  - - [1024, 2560, 1, 4096]
    - [47, 82.229]
  - - [4096, 2560, 1, 1024]
    - [220, 83.598]
  - - [64, 512, 96, 512]
    - [221, 49.909]
  - - [1024, 6, 1, 2]
    - [2, 0.004]
  - - [1024, 6, 1, 1024]
    - [7, 0.801]
  - - [1024, 462, 1, 1024]
    - [1, 37.008]
  - - [1024, 462, 1, 30522]
    - [222, 83.056]
  - - [1024, 3072, 1, 2]
    - [28, 0.719]
  - - [1024, 3072, 1, 1024]
    - [223, 72.552]
  - - [1024, 3072, 1, 4096]
    - [215, 83.533]
  - - [4096, 3072, 1, 1024]
    - [224, 85.216]
  - - [1024, 8, 1, 2]
    - [204, 0.004]
  - - [1024, 160, 1, 30522]
    - [225, 69.126]
  - - [64, 128, 144, 128]
    - [221, 20.629]
  - - [1024, 9, 1, 2]
    - [226, 0.006]
  - - [1024, 9, 1, 1024]
    - [63, 1.193]
  - - [1024, 180, 1, 1024]
    - [64, 21.807]
  - - [1024, 180, 1, 30522]
    - [227, 65.362]
  - - [1024, 1152, 1, 2]
    - [65, 0.464]
  - - [1024, 1152, 1, 1024]
    - [66, 65.344]
  - - [1024, 1152, 1, 4096]
    - [67, 80.891]
  - - [4096, 1152, 1, 1024]
    - [62, 77.032]
  - - [256, 32768, 1, 128]
    - [228, 43.033]
  - - [479, 32768, 1, 1024]
    - [334, 79.815]
  - - [512, 32768, 1, 256]
    - [229, 67.214]
  - - [1024, 32768, 1, 512]
    - [230, 83.737]
  - - [1024, 32768, 1, 1024]
    - [220, 89.011]
  - - [64, 128, 512, 128]
    - [231, 26.584]
  - - [128, 128, 512, 64]
    - [232, 25.898]
  - - [1024, 32, 1, 2]
    - [72, 0.022]
  - - [1024, 32, 1, 1024]
    - [73, 4.423]
  - - [1024, 4096, 1, 30528]
    - [233, 92.378]
  - - [512, 512, 64, 64]
    - [207, 32.259]
  - - [1024, 2048, 1, 30528]
    - [234, 89.464]
  - - [64, 4, 32768, 4]
    - [235, 0.284]
  - - [64, 4, 38400, 4]
    - [235, 0.281]
  - - [1024, 8192, 1, 1024]
    - [202, 83.089]
  - - [1024, 8192, 1, 4096]
    - [236, 90.095]
  - - [1024, 8192, 1, 33712]
    - [202, 92.303]
  - - [1024, 9600, 1, 1024]
    - [236, 85.061]
  - - [1024, 9600, 1, 4096]
    - [237, 93.583]
  - - [1024, 9600, 1, 33712]
    - [238, 97.553]
  - - [4096, 8192, 1, 1024]
    - [220, 88.838]
  - - [4096, 9600, 1, 1024]
    - [220, 91.829]
  - - [1024, 10064, 1, 1024]
    - [78, 83.27]
  - - [1024, 10064, 1, 4096]
    - [239, 92.189]
  - - [1024, 10080, 1, 1024]
    - [70, 83.578]
  - - [1024, 10080, 1, 4096]
    - [240, 92.639]
  - - [1024, 10080, 1, 42720]
    - [76, 96.771]
  - - [1024, 10200, 1, 1024]
    - [199, 82.893]
  - - [1024, 10200, 1, 4096]
    - [241, 89.96]
  - - [1024, 3840, 1, 1024]
    - [77, 81.123]
  - - [1024, 3840, 1, 4096]
    - [80, 92.67]
  - - [1024, 3968, 1, 1024]
    - [233, 76.953]
  - - [1024, 3968, 1, 4096]
    - [202, 86.122]
  - - [1024, 3968, 1, 42720]
    - [202, 89.738]
  - - [1024, 6528, 1, 1024]
    - [236, 80.578]
  - - [1024, 6528, 1, 4096]
    - [236, 86.494]
  - - [1024, 6528, 1, 42720]
    - [242, 92.967]
  - - [1024, 7104, 1, 1024]
    - [233, 83.039]
  - - [1024, 7104, 1, 4096]
    - [82, 91.155]
  - - [1024, 7104, 1, 42720]
    - [243, 96.051]
  - - [1024, 7200, 1, 1024]
    - [83, 83.024]
  - - [1024, 7200, 1, 4096]
    - [84, 93.317]
  - - [1024, 7200, 1, 42720]
    - [244, 97.424]
  - - [1024, 8064, 1, 1024]
    - [209, 83.252]
  - - [1024, 8064, 1, 4096]
    - [233, 89.087]
  - - [1024, 8160, 1, 1024]
    - [209, 83.584]
  - - [1024, 8160, 1, 4096]
    - [233, 90.033]
  - - [1024, 9216, 1, 1024]
    - [207, 82.478]
  - - [1024, 9216, 1, 4096]
    - [245, 90.065]
  - - [1024, 9520, 1, 1024]
    - [69, 83.897]
  - - [1024, 9520, 1, 4096]
    - [245, 92.335]
  - - [1024, 9520, 1, 42720]
    - [246, 97.092]
  - - [4096, 10064, 1, 1024]
    - [216, 91.463]
  - - [4096, 10080, 1, 1024]
    - [218, 91.65]
  - - [4096, 10200, 1, 1024]
    - [218, 92.272]
  - - [4096, 3840, 1, 1024]
    - [224, 87.402]
  - - [4096, 3968, 1, 1024]
    - [216, 84.258]
  - - [4096, 6528, 1, 1024]
    - [207, 87.422]
  - - [4096, 7104, 1, 1024]
    - [88, 88.975]
  - - [4096, 7200, 1, 1024]
    - [203, 89.223]
  - - [4096, 8064, 1, 1024]
    - [218, 91.721]
  - - [4096, 8160, 1, 1024]
    - [247, 89.331]
  - - [4096, 9216, 1, 1024]
    - [207, 90.12]
  - - [4096, 9520, 1, 1024]
    - [220, 90.819]
  - - [64, 14, 10880, 14]
    - [235, 2.673]
  - - [64, 14, 10880, 15]
    - [235, 2.851]
  - - [64, 15, 7680, 15]
    - [248, 2.927]
  - - [64, 15, 10880, 15]
    - [235, 3.026]
  - - [64, 15, 7680, 17]
    - [248, 3.192]
  - - [64, 17, 6144, 17]
    - [90, 3.026]
  - - [64, 17, 7680, 17]
    - [90, 3.183]
  - - [64, 17, 6144, 21]
    - [90, 3.797]
  - - [64, 21, 6144, 21]
    - [91, 4.404]
  - - [64, 24, 4736, 24]
    - [92, 5.654]
  - - [64, 24, 4736, 34]
    - [93, 7.222]
  - - [64, 30, 2048, 30]
    - [92, 6.751]
  - - [64, 31, 2048, 30]
    - [94, 6.892]
  - - [64, 31, 2048, 31]
    - [92, 7.058]
  - - [64, 32, 4608, 32]
    - [249, 10.221]
  - - [64, 34, 4736, 34]
    - [95, 6.474]
  - - [64, 35, 4608, 32]
    - [214, 9.511]
  - - [64, 35, 4608, 35]
    - [96, 6.597]
  - - [64, 512, 1, 512]
    - [97, 2.99]
  - - [512, 512, 1, 64]
    - [98, 5.509]
  - - [128, 128, 1, 64]
    - [99, 0.385]
  - - [64, 128, 1, 128]
    - [100, 0.37]
  - - [1024, 512, 1, 64]
    - [101, 7.753]
  - - [74, 512, 1, 2048]
    - [335, 7.19]
  - - [64, 5, 1, 5]
    - [250, 0.001]
  - - [2048, 512, 1, 2048]
    - [103, 66.217]
  - - [512, 1600, 1, 512]
    - [104, 38.672]
  - - [32, 33, 1, 33]
    - [105, 0.009]
  - - [560, 1600, 1, 1024]
    - [106, 56.676]
  - - [512, 1600, 1, 32]
    - [107, 6.63]
  - - [1024, 1600, 1, 1024]
    - [251, 62.929]
  - - [32, 33, 1600, 33]
    - [108, 4.498]
  - - [32, 200, 1, 1]
    - [204, 0.001]
  - - [64, 3, 512, 3]
    - [109, 0.063]
  - - [64, 5, 512, 5]
    - [110, 0.169]
  - - [64, 5, 960, 5]
    - [252, 0.238]
  - - [64, 9, 512, 9]
    - [253, 0.448]
  - - [64, 512, 1, 1]
    - [111, 0.01]
  - - [67, 512, 1, 2048]
    - [336, 6.509]
  - - [74, 960, 1, 2048]
    - [112, 12.549]
  - - [100, 512, 1, 2048]
    - [113, 9.528]
  - - [128, 27, 32768, 27]
    - [114, 7.512]
  - - [256, 1024, 1, 1]
    - [115, 0.111]
  - - [256, 8976, 1, 1536]
    - [116, 75.758]
  - - [256, 8976, 1, 2048]
    - [117, 79.353]
  - - [256, 8976, 1, 2304]
    - [118, 80.236]
  - - [256, 8976, 1, 2560]
    - [119, 81.136]
  - - [256, 8976, 1, 2816]
    - [120, 81.943]
  - - [256, 8976, 1, 3072]
    - [118, 82.991]
  - - [256, 8976, 1, 4352]
    - [121, 85.079]
  - - [256, 8976, 1, 4864]
    - [122, 85.525]
  - - [256, 8976, 1, 5376]
    - [123, 86.145]
  - - [256, 8976, 1, 5632]
    - [117, 86.323]
  - - [256, 8976, 1, 5888]
    - [123, 86.753]
  - - [256, 8976, 1, 6144]
    - [120, 86.78]
  - - [256, 8976, 1, 6656]
    - [124, 87.063]
  - - [256, 8976, 1, 7168]
    - [123, 87.482]
  - - [256, 8976, 1, 7424]
    - [120, 87.647]
  - - [256, 8976, 1, 8192]
    - [117, 87.862]
  - - [256, 8976, 1, 8448]
    - [117, 87.91]
  - - [256, 8976, 1, 8960]
    - [124, 88.262]
  - - [256, 8976, 1, 9472]
    - [118, 88.406]
  - - [256, 8976, 1, 9728]
    - [120, 88.528]
  - - [256, 8976, 1, 9984]
    - [117, 88.499]
  - - [256, 8976, 1, 10240]
    - [118, 88.56]
  - - [256, 8976, 1, 10496]
    - [123, 88.6]
  - - [256, 8976, 1, 11008]
    - [125, 88.825]
  - - [256, 8976, 1, 11520]
    - [122, 88.982]
  - - [256, 8976, 1, 12288]
    - [122, 89.075]
  - - [256, 8976, 1, 14336]
    - [121, 89.345]
  - - [256, 8976, 1, 14848]
    - [122, 89.451]
  - - [256, 8976, 1, 15104]
    - [121, 89.452]
  - - [256, 8976, 1, 15872]
    - [123, 89.536]
  - - [256, 8976, 1, 17152]
    - [118, 89.786]
  - - [256, 8976, 1, 19712]
    - [126, 89.94]
  - - [256, 8976, 1, 19968]
    - [127, 89.945]
  - - [256, 8976, 1, 20480]
    - [128, 90.081]
  - - [256, 8976, 1, 20992]
    - [128, 90.075]
  - - [256, 8976, 1, 22016]
    - [128, 90.188]
  - - [256, 8976, 1, 26112]
    - [128, 90.4]
  - - [256, 8976, 1, 33536]
    - [254, 90.581]
  - - [256, 8976, 1, 44505]
    - [127, 90.491]
  - - [257, 1024, 1, 4096]
    - [337, 37.571]
  - - [480, 32768, 1, 1024]
    - [210, 84.677]
  - - [512, 200, 1, 1]
    - [105, 0.049]
  - - [512, 200, 1, 32]
    - [130, 1.252]
  - - [512, 215, 1, 2048]
    - [131, 20.286]
  - - [512, 256, 1, 2048]
    - [132, 20.508]
  - - [560, 200, 1, 1024]
    - [132, 13.5]
  - - [768, 215, 1, 2048]
    - [133, 25.729]
  - - [768, 256, 1, 2048]
    - [134, 30.267]
  - - [1024, 1, 1, 200]
    - [135, 0.042]
  - - [1024, 1, 1, 1600]
    - [255, 0.187]
  - - [1024, 200, 1, 1]
    - [111, 0.093]
  - - [1024, 512, 1, 1]
    - [136, 0.133]
  - - [1024, 960, 1, 64]
    - [137, 13.23]
  - - [1024, 1600, 1, 1]
    - [138, 0.301]
  - - [1024, 1792, 1, 256]
    - [139, 45.556]
  - - [1024, 2048, 1, 256]
    - [140, 46.955]
  - - [1024, 2560, 1, 256]
    - [141, 47.398]
  - - [1024, 3072, 1, 256]
    - [256, 49.096]
  - - [1024, 3328, 1, 256]
    - [257, 50.397]
  - - [1024, 3840, 1, 256]
    - [209, 53.985]
  - - [1024, 4096, 1, 256]
    - [258, 52.064]
  - - [1024, 4608, 1, 256]
    - [259, 55.687]
  - - [1024, 4864, 1, 256]
    - [260, 54.611]
  - - [1024, 5120, 1, 256]
    - [261, 55.825]
  - - [1024, 5632, 1, 256]
    - [145, 58.053]
  - - [1024, 6144, 1, 256]
    - [262, 58.308]
  - - [1024, 6400, 1, 256]
    - [263, 58.914]
  - - [1024, 7168, 1, 256]
    - [263, 60.12]
  - - [1024, 7424, 1, 256]
    - [259, 60.307]
  - - [1024, 7680, 1, 256]
    - [146, 61.572]
  - - [1024, 7936, 1, 256]
    - [147, 61.708]
  - - [1024, 8192, 1, 256]
    - [148, 61.552]
  - - [1024, 8448, 1, 256]
    - [149, 64.065]
  - - [1024, 8704, 1, 256]
    - [150, 60.662]
  - - [1024, 8960, 1, 256]
    - [151, 62.358]
  - - [1024, 9728, 1, 256]
    - [152, 64.24]
  - - [1024, 9984, 1, 256]
    - [153, 65.754]
  - - [1024, 10240, 1, 256]
    - [154, 63.517]
  - - [1024, 10496, 1, 256]
    - [152, 64.373]
  - - [1024, 11008, 1, 256]
    - [155, 64.146]
  - - [1024, 11264, 1, 256]
    - [147, 64.189]
  - - [1024, 11520, 1, 256]
    - [156, 65.42]
  - - [1024, 12288, 1, 256]
    - [152, 66.989]
  - - [1024, 13312, 1, 256]
    - [229, 66.175]
  - - [1024, 13568, 1, 256]
    - [152, 66.771]
  - - [1024, 14336, 1, 256]
    - [259, 65.432]
  - - [1024, 14592, 1, 256]
    - [155, 67.226]
  - - [1024, 14848, 1, 256]
    - [264, 66.591]
  - - [1024, 15104, 1, 256]
    - [155, 67.802]
  - - [1024, 16128, 1, 256]
    - [218, 68.452]
  - - [1024, 17152, 1, 256]
    - [155, 67.65]
  - - [1024, 18944, 1, 256]
    - [152, 69.056]
  - - [1024, 19712, 1, 256]
    - [152, 69.231]
  - - [1024, 19968, 1, 256]
    - [157, 69.141]
  - - [1024, 20480, 1, 256]
    - [264, 69.204]
  - - [1024, 20992, 1, 256]
    - [158, 69.358]
  - - [1024, 21504, 1, 256]
    - [157, 70.764]
  - - [1024, 22016, 1, 256]
    - [229, 69.111]
  - - [1024, 23552, 1, 256]
    - [159, 70.162]
  - - [1024, 28672, 1, 256]
    - [264, 71.338]
  - - [1024, 33536, 1, 256]
    - [265, 72.2]
  - - [1024, 40448, 1, 256]
    - [264, 73.666]
  - - [1600, 512, 1, 1024]
    - [160, 51.143]
  - - [2048, 1, 1, 512]
    - [161, 0.181]
  - - [2048, 512, 1, 1]
    - [162, 0.228]
  - - [2048, 960, 1, 2048]
    - [163, 78.914]
  - - [2048, 1024, 1, 1]
    - [164, 0.319]
  - - [2048, 1024, 1, 256]
    - [165, 40.847]
  - - [3200, 1024, 1, 2048]
    - [166, 77.059]
  - - [4096, 1024, 1, 1]
    - [167, 0.391]
  - - [2048, 1024, 1, 2048]
    - [168, 74.09]
  - - [2048, 1024, 1, 30592]
    - [266, 88.527]
  - - [2048, 1024, 1, 6144]
    - [267, 83.679]
  - - [2048, 1024, 1, 8192]
    - [267, 84.977]
  - - [2048, 2, 1, 2]
    - [170, 0.003]
  - - [2048, 2, 1, 2048]
    - [268, 0.827]
  - - [8192, 1024, 1, 2048]
    - [171, 87.283]
  - - [1024, 16, 1, 1024]
    - [172, 2.107]
  - - [1024, 16, 1, 2]
    - [211, 0.01]
  - - [1024, 8192, 1, 30592]
    - [199, 92.254]
  - - [1024, 8192, 1, 3072]
    - [202, 89.319]
  - - [512, 512, 256, 64]
    - [207, 36.656]
  - - [64, 512, 256, 512]
    - [269, 54.537]
  - - [1024, 2048, 1, 30592]
    - [199, 89.418]
  - - [1024, 2048, 1, 3072]
    - [176, 83.045]
  - - [1024, 4096, 1, 30592]
    - [270, 91.996]
  - - [1024, 4096, 1, 3072]
    - [202, 87.6]
  - - [512, 512, 128, 64]
    - [178, 35.042]
  - - [2560, 2048, 1, 1920]
    - [271, 82.671]
  - - [2560, 2048, 1, 2560]
    - [210, 84.697]
  - - [2560, 2048, 1, 7680]
    - [215, 88.455]
  - - [2560, 4, 1, 2]
    - [180, 0.007]
  - - [2560, 4, 1, 2560]
    - [272, 2.271]
  - - [640, 2048, 1, 2560]
    - [181, 75.123]
  - - [512, 512, 40, 64]
    - [182, 30.267]
  - - [64, 512, 40, 512]
    - [232, 43.766]
  - - [1536, 4096, 1, 1536]
    - [218, 84.048]
  - - [1536, 4096, 1, 4608]
    - [220, 89.526]
  - - [1536, 4096, 1, 50304]
    - [220, 92.133]
  - - [1536, 4096, 1, 6144]
    - [216, 90.244]
  - - [6144, 4096, 1, 1536]
    - [273, 90.053]
  - - [1024, 1024, 64, 96]
    - [218, 53.096]
  - - [96, 1024, 64, 1024]
    - [215, 75.27]
  - - [1536, 8192, 1, 1536]
    - [261, 87.888]
  - - [1536, 8192, 1, 4608]
    - [274, 91.519]
  - - [1536, 8192, 1, 50304]
    - [275, 95.301]
  - - [1536, 8192, 1, 6144]
    - [275, 92.529]
  - - [6144, 8192, 1, 1536]
    - [216, 94.376]
  - - [1024, 1024, 128, 96]
    - [220, 54.34]
  - - [96, 1024, 128, 1024]
    - [276, 78.122]
  - - [1024, 16384, 1, 1024]
    - [224, 86.462]
  - - [1024, 16384, 1, 3072]
    - [218, 90.697]
  - - [1024, 16384, 1, 4096]
    - [277, 91.343]
  - - [1024, 16384, 1, 50304]
    - [278, 95.193]
  - - [4096, 16384, 1, 1024]
    - [203, 92.446]
  - - [1024, 1024, 256, 64]
    - [209, 40.647]
  - - [64, 1024, 256, 1024]
    - [279, 66.657]
  - - [1024, 2048, 1, 50304]
    - [280, 90.177]
  - - [1024, 1024, 32, 64]
    - [192, 37.564]
  - - [64, 1024, 32, 1024]
    - [193, 51.203]
  - - [1024, 4096, 1, 50304]
    - [281, 92.303]
  - - [1024, 1024, 64, 64]
    - [209, 38.89]
  - - [64, 1024, 64, 1024]
    - [194, 58.848]
  - - [1024, 8192, 1, 50304]
    - [282, 92.481]
  - - [1024, 1024, 128, 64]
    - [209, 39.983]
  - - [64, 1024, 128, 1024]
    - [195, 64.933]
  - - [128, 128, 1024, 64]
    - [283, 26.066]
  - - [64, 128, 1024, 128]
    - [284, 29.818]
  - - [1024, 64, 1, 2]
    - [285, 0.034]
  - - [1024, 8192, 1, 30528]
    - [233, 92.55]
  - - [1024, 64, 1, 1024]
    - [286, 7.851]
  - - [1024, 3456, 1, 1024]
    - [257, 72.619]
  - - [1024, 3456, 1, 512]
    - [259, 64.23]
  - - [1024, 4096, 1, 512]
    - [287, 67.214]
  - - [1024, 6912, 1, 1024]
    - [202, 83.173]
  - - [1024, 6912, 1, 512]
    - [202, 75.532]
  - - [1024, 864, 1, 1024]
    - [242, 52.498]
  - - [1024, 864, 1, 512]
    - [288, 39.805]
  - - [256, 3456, 1, 128]
    - [289, 19.626]
  - - [256, 4096, 1, 128]
    - [251, 19.626]
  - - [256, 55296, 1, 128]
    - [224, 49.653]
  - - [256, 6912, 1, 128]
    - [290, 31.17]
  - - [256, 864, 1, 128]
    - [291, 6.624]
  - - [480, 3456, 1, 1024]
    - [221, 63.843]
  - - [480, 4096, 1, 1024]
    - [292, 66.693]
  - - [480, 6912, 1, 1024]
    - [293, 77.926]
  - - [480, 864, 1, 1024]
    - [294, 34.559]
  - - [512, 3456, 1, 256]
    - [221, 42.821]
  - - [512, 4096, 1, 256]
    - [295, 38.208]
  - - [512, 55296, 1, 256]
    - [296, 71.36]
  - - [512, 6912, 1, 256]
    - [263, 50.316]
  - - [512, 864, 1, 256]
    - [297, 18.272]
  - - [1024, 640, 1, 30528]
    - [298, 89.563]
  - - [1024, 1280, 1, 30528]
    - [299, 91.757]
  - - [1024, 1600, 1, 30528]
    - [300, 92.441]
  - - [1024, 10240, 1, 1024]
    - [241, 84.053]
  - - [1024, 10240, 1, 4096]
    - [241, 90.598]
  - - [4096, 10240, 1, 1024]
    - [207, 89.659]
  - - [1024, 80, 1, 1024]
    - [301, 9.291]
  - - [1024, 80, 1, 2]
    - [285, 0.045]
  - - [128, 128, 1280, 64]
    - [231, 26.555]
  - - [64, 128, 1280, 128]
    - [283, 30.673]
  - - [1024, 1640, 1, 30528]
    - [302, 83.078]
  - - [1024, 10496, 1, 1024]
    - [216, 84.77]
  - - [1024, 10496, 1, 4096]
    - [199, 92.487]
  - - [4096, 10496, 1, 1024]
    - [216, 91.026]
  - - [1024, 82, 1, 1024]
    - [303, 9.58]
  - - [1024, 82, 1, 2]
    - [304, 0.046]
  - - [128, 128, 1312, 64]
    - [305, 26.683]
  - - [64, 128, 1312, 128]
    - [283, 30.874]
  - - [1024, 160, 1, 30528]
    - [306, 72.458]
  - - [1024, 240, 1, 30528]
    - [307, 72.308]
  - - [1024, 6144, 1, 4096]
    - [199, 89.105]
  - - [1024, 12, 1, 1024]
    - [303, 1.419]
  - - [4096, 6144, 1, 1024]
    - [203, 88.015]
  - - [1024, 6144, 1, 1024]
    - [216, 80.067]
  - - [1024, 12, 1, 2]
    - [304, 0.007]
  - - [512, 512, 192, 64]
    - [308, 35.994]
  - - [64, 512, 192, 512]
    - [309, 52.426]
  - - [256, 4096, 1, 1]
    - [290, 0.18]
  - - [256, 6912, 1, 1]
    - [221, 0.286]
  - - [3136, 128, 64, 64]
    - [257, 32.224]
  - - [3136, 256, 64, 64]
    - [202, 37.12]
  - - [3136, 256, 64, 128]
    - [206, 56.83]
  - - [784, 512, 64, 256]
    - [262, 65.198]
  - - [3136, 128, 64, 256]
    - [203, 65.267]
  - - [3136, 256, 64, 256]
    - [241, 71.194]
  - - [784, 256, 64, 512]
    - [261, 71.359]
  - - [784, 512, 64, 512]
    - [221, 75.843]
  - - [3136, 128, 32, 64]
    - [257, 29.819]
  - - [3136, 256, 32, 64]
    - [236, 34.773]
  - - [3136, 256, 32, 128]
    - [207, 54.322]
  - - [784, 512, 32, 256]
    - [262, 61.058]
  - - [3136, 128, 32, 256]
    - [262, 60.998]
  - - [3136, 256, 32, 256]
    - [262, 68.614]
  - - [784, 256, 32, 512]
    - [221, 66.109]
  - - [784, 512, 32, 512]
    - [221, 72.494]
  - - [3136, 64, 64, 64]
    - [310, 25.991]
  - - [3136, 64, 64, 256]
    - [256, 45.931]
  - - [784, 512, 64, 128]
    - [287, 49.159]
  - - [784, 128, 64, 512]
    - [261, 62.548]
  - - [64, 192, 64, 1280]
    - [311, 48.063]
  - - [64, 320, 64, 1280]
    - [221, 50.811]
  - - [64, 384, 64, 1280]
    - [221, 59.341]
  - - [64, 448, 64, 1280]
    - [311, 58.46]
  - - [64, 192, 64, 2048]
    - [312, 46.521]
  - - [64, 320, 64, 2048]
    - [232, 50.393]
  - - [64, 384, 64, 2048]
    - [232, 58.083]
  - - [64, 448, 64, 2048]
    - [313, 57.845]
  - - [64, 192, 32, 1280]
    - [314, 38.294]
  - - [64, 320, 32, 1280]
    - [315, 42.665]
  - - [64, 384, 32, 1280]
    - [316, 50.376]
  - - [64, 448, 32, 1280]
    - [317, 56.652]
  - - [64, 192, 32, 2048]
    - [318, 39.664]
  - - [64, 320, 32, 2048]
    - [319, 48.124]
  - - [64, 384, 32, 2048]
    - [274, 52.886]
  - - [64, 448, 32, 2048]
    - [320, 57.093]
  - - [1024, 10224, 1, 1024]
    - [218, 84.844]
  - - [1024, 10192, 1, 1024]
    - [241, 83.45]
  - - [1024, 10208, 1, 1024]
    - [199, 83.06]
  - - [1024, 10224, 1, 4096]
    - [199, 90.447]
  - - [1024, 10224, 1, 3072]
    - [203, 90.02]
  - - [4096, 10224, 1, 1024]
    - [220, 92.51]
  - - [1024, 10240, 1, 3072]
    - [241, 89.625]
  - - [1024, 10192, 1, 3072]
    - [216, 89.112]
  - - [4096, 10192, 1, 1024]
    - [218, 92.242]
  - - [1024, 10192, 1, 4096]
    - [241, 89.911]
  - - [1024, 10200, 1, 3072]
    - [220, 89.09]
  - - [1024, 10184, 1, 1024]
    - [220, 83.107]
  - - [4096, 10208, 1, 1024]
    - [218, 92.26]
  - - [1024, 10208, 1, 3072]
    - [241, 89.238]
  - - [1024, 10208, 1, 4096]
    - [199, 90.132]
  - - [1024, 10224, 1, 2048]
    - [216, 88.609]
  - - [1024, 10240, 1, 2048]
    - [241, 88.202]
  - - [1024, 10120, 1, 1024]
    - [220, 83.033]
  - - [1024, 10192, 1, 2048]
    - [220, 87.769]
  - - [64, 24, 6816, 24]
    - [231, 5.046]
  - - [1024, 10152, 1, 1024]
    - [218, 83.261]
  - - [1024, 10080, 1, 3072]
    - [321, 90.789]
  - - [64, 26, 6272, 26]
    - [231, 5.408]
  - - [100352, 512, 1, 256]
    - [322, 70.138]
  - - [12544, 2048, 1, 1024]
    - [323, 87.269]
  - - [12544, 64, 1, 147]
    - [324, 15.665]
  - - [200704, 512, 1, 256]
    - [296, 67.913]
  - - [25088, 1024, 1, 512]
    - [325, 81.169]
  - - [3136, 64, 1, 576]
    - [286, 17.173]
  - - [50176, 1024, 1, 512]
    - [229, 82.988]
  - - [6272, 2048, 1, 1024]
    - [207, 85.779]
  - - [784, 128, 1, 1152]
    - [286, 11.154]
  - - [3136, 128, 128, 256]
    - [220, 69.565]
  - - [3136, 128, 256, 256]
    - [218, 71.806]
  - - [3136, 256, 128, 64]
    - [326, 38.502]
  - - [3136, 256, 256, 64]
    - [202, 39.146]
  - - [3136, 64, 128, 256]
    - [207, 50.078]
  - - [3136, 64, 256, 256]
    - [224, 51.961]
  - - [3136, 64, 128, 64]
    - [231, 28.002]
  - - [3136, 64, 256, 64]
    - [283, 29.101]
  - - [784, 128, 128, 512]
    - [232, 67.191]
  - - [784, 128, 256, 512]
    - [261, 69.939]
  - - [784, 256, 128, 512]
    - [261, 74.355]
  - - [784, 256, 256, 512]
    - [261, 75.889]
  - - [784, 512, 128, 128]
    - [203, 52.627]
  - - [784, 512, 256, 128]
    - [220, 54.635]
  - - [128, 128, 2048, 64]
    - [283, 27.567]
  - - [64, 128, 2048, 128]
    - [327, 31.976]
  - - [1024, 2560, 1, 30528]
    - [328, 93.476]
  - - [1024, 128, 1, 1024]
    - [286, 15.225]
  - - [1024, 128, 1, 2]
    - [285, 0.07]
  - - [128, 128, 1536, 64]
    - [231, 26.94]
  - - [64, 128, 1536, 128]
    - [231, 31.206]
  - - [1024, 12288, 1, 4096]
    - [209, 90.902]
  - - [1024, 12288, 1, 1024]
    - [209, 85.946]
  - - [4096, 12288, 1, 1024]
    - [220, 92.24]
  - - [1024, 1920, 1, 30528]
    - [245, 96.586]
  - - [1024, 96, 1, 1024]
    - [286, 11.63]
  - - [1024, 96, 1, 2]
    - [204, 0.052]
  - - [128, 128, 192, 64]
    - [257, 18.935]
  - - [64, 128, 192, 128]
    - [221, 24.955]
  - - [768, 2048, 1, 2]
    - [221, 0.499]
  - - [3072, 2048, 1, 768]
    - [241, 79.191]
  - - [768, 2048, 1, 3072]
    - [329, 71.321]
  - - [768, 2048, 1, 768]
    - [261, 56.523]
  - - [384, 384, 144, 64]
    - [326, 33.512]
  - - [64, 384, 144, 384]
    - [295, 47.72]
  - - [768, 4608, 1, 2]
    - [221, 0.69]
  - - [3072, 4608, 1, 768]
    - [207, 83.909]
  - - [768, 4608, 1, 3072]
    - [330, 81.916]
  - - [768, 4608, 1, 768]
    - [295, 70.554]
  - - [512, 512, 48, 64]
    - [220, 30.267]
  - - [64, 512, 48, 512]
    - [221, 50.921]
  - - [128, 128, 256, 64]
    - [331, 19.859]
  - - [64, 128, 256, 128]
    - [284, 22.33]
  - - [384, 384, 192, 64]
    - [332, 34.43]
  - - [64, 384, 192, 384]
    - [257, 45.892]
  - - [1024, 4608, 1, 2]
    - [241, 0.749]
  - - [4096, 4608, 1, 1024]
    - [229, 88.015]
  - - [1024, 4608, 1, 4096]
    - [333, 87.59]
  - - [1024, 4608, 1, 1024]
    - [261, 77.694]
  - - [8192, 1024, 1, 1024]
    - [207, 82.07]
  - - [8192, 4096, 1, 1024]
    - [229, 89.097]
  - - [16384, 16384, 1, 16384]
    - [216, 97.203]
  - - [196, 1024, 64, 512]
    - [338, 55.174]
  - - [196, 512, 64, 1024]
    - [339, 56.439]
  - - [196, 1024, 64, 1024]
    - [340, 62.012]
  - - [49, 2048, 64, 1024]
    - [341, 44.892]
  - - [49, 1024, 64, 2048]
    - [342, 44.183]
  - - [196, 1024, 32, 512]
    - [343, 52.115]
  - - [196, 512, 32, 1024]
    - [344, 49.957]
  - - [196, 1024, 32, 1024]
    - [343, 60.016]
  - - [49, 2048, 32, 1024]
    - [345, 39.127]
  - - [49, 1024, 32, 2048]
    - [346, 36.788]
  - - [196, 1024, 64, 256]
    - [347, 46.069]
  - - [196, 256, 64, 1024]
    - [348, 49.876]
  - - [49, 2048, 64, 512]
    - [349, 36.987]
  - - [49, 512, 64, 2048]
    - [350, 36.333]
  - - [1225, 32, 64, 192]
    - [351, 24.769]
  - - [1225, 48, 64, 192]
    - [352, 22.17]
  - - [1225, 64, 64, 192]
    - [353, 34.542]
  - - [1225, 48, 64, 256]
    - [352, 24.041]
  - - [1225, 64, 64, 256]
    - [353, 36.316]
  - - [1225, 48, 64, 288]
    - [354, 25.167]
  - - [1225, 64, 64, 288]
    - [355, 40.611]
  - - [5329, 80, 64, 64]
    - [350, 19.489]
  - - [289, 128, 64, 768]
    - [356, 49.536]
  - - [289, 160, 64, 768]
    - [353, 40.747]
  - - [289, 192, 64, 768]
    - [334, 49.273]
  - - [1225, 32, 32, 192]
    - [357, 20.967]
  - - [1225, 48, 32, 192]
    - [358, 19.771]
  - - [1225, 64, 32, 192]
    - [355, 30.254]
  - - [1225, 48, 32, 256]
    - [359, 21.936]
  - - [1225, 64, 32, 256]
    - [353, 32.934]
  - - [1225, 48, 32, 288]
    - [358, 22.999]
  - - [1225, 64, 32, 288]
    - [355, 37.05]
  - - [5329, 80, 32, 64]
    - [357, 18.57]
  - - [289, 128, 32, 768]
    - [356, 40.132]
  - - [289, 160, 32, 768]
    - [360, 37.381]
  - - [289, 192, 32, 768]
    - [353, 44.234]
  - - [196, 256, 1, 2304]
    - [361, 10.255]
  - - [49, 512, 1, 4608]
    - [362, 9.327]
  - - [196, 1024, 128, 256]
    - [363, 48.481]
  - - [196, 1024, 256, 256]
    - [363, 49.674]
  - - [196, 256, 128, 1024]
    - [364, 55.749]
  - - [196, 256, 256, 1024]
    - [364, 56.921]
  - - [196, 512, 128, 1024]
    - [339, 58.118]
  - - [196, 512, 256, 1024]
    - [364, 59.215]
  - - [49, 2048, 128, 512]
    - [349, 39.314]
  - - [49, 2048, 256, 512]
    - [365, 40.412]
  - - [49, 512, 128, 2048]
    - [366, 43.146]
  - - [49, 512, 256, 2048]
    - [367, 48.102]
- null
