library/src/blas3/Tensile/Logic/asm_full/aldebaran_Cijk_Ailk_Bljk_I8II_BH.yaml
- {MinimumRequiredVersion: 4.25.0}
- aldebaran
- gfx90a
- [Device 7400, Device 7408, Device 740c]
    SolutionIndex: 0
    SolutionNameMin: Cijk_Ailk_Bljk_I8II_BH_MT64x64x32_MI32x32x8x1_SE_1LDSB0_EPS1_GRVW4_LPB4_NLCA1_OPLV0_PK0_PAP0_PGR1_PLR1_SU32_SUS256_SRVW0_TT1_32_WG64_4_1_WGM8
    SolutionIndex: 1
    SolutionNameMin: Cijk_Ailk_Bljk_I8II_BH_MT64x64x64_MI32x32x8x1_SE_1LDSB0_EPS1_GRVW4_LPB4_NLCA1_OPLV0_PK0_PAP0_PGR1_PLR1_SU32_SUS256_SRVW0_TT1_32_WG64_4_1_WGM8
    SolutionIndex: 2
    SolutionNameMin: Cijk_Ailk_Bljk_I8II_BH_MT64x128x64_MI32x32x8x1_SE_1LDSB0_EPS1_GRVW16_LPB16_NLCA1_OPLV1_PKn1_PAP1_PGR1_PLR9_SU32_SUS128_SRVW4_TT1_64_WG64_4_1_WGM1
    SolutionIndex: 3
    SolutionNameMin: Cijk_Ailk_Bljk_I8II_BH_MT64x128x128_MI32x32x8x1_SE_1LDSB0_EPS1_GRVW16_LPB16_NLCA1_OPLV1_PKn1_PAP1_PGR1_PLR17_SU32_SUS128_SRVW4_TT1_64_WG64_4_1_WGM1
    SolutionIndex: 4
    SolutionNameMin: Cijk_Ailk_Bljk_I8II_BH_MT128x96x64_MI32x32x8x1_SE_1LDSB0_EPS0_GRVW4_LPB16_NLCA1_OPLV0_PKn1_PAP0_PGR2_PLR9_SU32_SUS256_SRVW4_TT1_96_WG128_2_1_WGM2
    SolutionIndex: 5
    SolutionNameMin: Cijk_Ailk_Bljk_I8II_BH_MT128x96x64_MI32x32x8x1_SE_1LDSB0_EPS1_GRVW8_LPB16_NLCA1_OPLV1_PKn1_PAP1_PGR1_PLR9_SU32_SUS128_SRVW4_TT1_96_WG128_2_1_WGM15
    SolutionIndex: 6
    SolutionNameMin: Cijk_Ailk_Bljk_I8II_BH_MT32x32x128_MI16x16x16x1_SE_1LDSB0_EPS1_GRVW8_LPB32_NLCA1_OPLV0_PK0_PAP0_PGR1_PLR9_SU0_SUS128_SRVW0_TT1_16_WG32_8_1_WGM1
    SolutionIndex: 7
    SolutionNameMin: Cijk_Ailk_Bljk_I8II_BH_MT32x32x128_MI16x16x16x1_SE_1LDSB0_EPS1_GRVW16_LPB32_NLCA1_OPLV0_PK0_PAP0_PGR1_PLR9_SU0_SUS128_SRVW0_TT1_16_WG32_8_1_WGM1
    SolutionIndex: 8
    SolutionNameMin: Cijk_Ailk_Bljk_I8II_BH_MT32x32x128_MI16x16x16x1_SE_1LDSB0_EPS0_GRVW8_LPB32_NLCA1_OPLV0_PK0_PAP0_PGR2_PLR9_SU0_SUS128_SRVW0_TT1_16_WG32_8_1_WGM1
    SolutionIndex: 9
    SolutionNameMin: Cijk_Ailk_Bljk_I8II_BH_MT32x32x128_MI16x16x16x1_SE_1LDSB0_EPS1_GRVW8_LPB32_NLCA1_OPLV0_PK0_PAP0_PGR1_PLR9_SU0_SUS256_SRVW0_TT1_16_WG32_8_1_WGM1
    SolutionIndex: 10
    SolutionNameMin: Cijk_Ailk_Bljk_I8II_BH_MT32x64x128_MI16x16x16x1_SE_1LDSB0_EPS1_GRVW8_LPB32_NLCA1_OPLV0_PK0_PAP0_PGR1_PLR9_SU0_SUS256_SRVW0_TT1_32_WG32_8_1_WGM1
    SolutionIndex: 11
    SolutionNameMin: Cijk_Ailk_Bljk_I8II_BH_MT32x32x128_MI16x16x16x1_SE_1LDSB0_EPS0_GRVW8_LPB32_NLCA1_OPLV0_PK0_PAP0_PGR2_PLR9_SU0_SUS256_SRVW0_TT1_16_WG32_8_1_WGM1
    SolutionIndex: 12
    SolutionNameMin: Cijk_Ailk_Bljk_I8II_BH_MT32x64x128_MI16x16x16x1_SE_1LDSB0_EPS0_GRVW8_LPB32_NLCA1_OPLV0_PK0_PAP0_PGR2_PLR9_SU0_SUS256_SRVW0_TT1_32_WG32_8_1_WGM1
    SolutionIndex: 13
    SolutionNameMin: Cijk_Ailk_Bljk_I8II_BH_MT32x32x128_MI16x16x16x1_SE_1LDSB0_EPS0_GRVW16_LPB32_NLCA1_OPLV0_PK0_PAP0_PGR2_PLR9_SU0_SUS256_SRVW0_TT1_16_WG32_8_1_WGM1
    SolutionIndex: 14
    SolutionNameMin: Cijk_Ailk_Bljk_I8II_BH_MT32x64x128_MI16x16x16x1_SE_1LDSB0_EPS0_GRVW16_LPB32_NLCA1_OPLV0_PK0_PAP0_PGR2_PLR9_SU0_SUS256_SRVW0_TT1_32_WG32_8_1_WGM1
    SolutionIndex: 15
    SolutionNameMin: Cijk_Ailk_Bljk_I8II_BH_MT64x64x64_MI32x32x8x1_SE_1LDSB0_EPS1_GRVW8_LPB16_NLCA1_OPLV0_PK0_PAP0_PGR1_PLR9_SU0_SUS256_SRVW4_TT1_32_WG64_4_1_WGM1
    SolutionIndex: 16
    SolutionNameMin: Cijk_Ailk_Bljk_I8II_BH_MT64x64x64_MI32x32x8x1_SE_1LDSB0_EPS0_GRVW8_LPB16_NLCA1_OPLV0_PK0_PAP0_PGR2_PLR9_SU0_SUS256_SRVW4_TT1_32_WG64_4_1_WGM1
    SolutionIndex: 17
    SolutionNameMin: Cijk_Ailk_Bljk_I8II_BH_MT64x128x64_MI32x32x8x1_SE_1LDSB0_EPS0_GRVW8_LPB16_NLCA1_OPLV0_PK0_PAP0_PGR2_PLR9_SU0_SUS256_SRVW4_TT1_64_WG64_4_1_WGM1
    SolutionIndex: 18
    SolutionNameMin: Cijk_Ailk_Bljk_I8II_BH_MT128x96x64_MI32x32x8x1_SE_1LDSB0_EPS0_GRVW8_LPB16_NLCA1_OPLV0_PK0_PAP0_PGR2_PLR9_SU0_SUS256_SRVW4_TT1_96_WG128_2_1_WGM1
    SolutionIndex: 19
    SolutionNameMin: Cijk_Ailk_Bljk_I8II_BH_MT64x128x64_MI32x32x8x1_SE_1LDSB0_EPS0_GRVW16_LPB16_NLCA1_OPLV0_PK0_PAP0_PGR2_PLR9_SU0_SUS256_SRVW4_TT1_64_WG64_4_1_WGM1
    SolutionIndex: 20
    SolutionNameMin: Cijk_Ailk_Bljk_I8II_BH_MT128x96x64_MI32x32x8x1_SE_1LDSB0_EPS0_GRVW8_LPB16_NLCA1_OPLV0_PK0_PAP0_PGR2_PLR9_SU32_SUS128_SRVW4_TT1_96_WG128_2_1_WGM1
    SolutionIndex: 21
    SolutionNameMin: Cijk_Ailk_Bljk_I8II_BH_MT32x32x128_MI16x16x16x1_SE_1LDSB0_EPS0_GRVW16_LPB32_NLCA1_OPLV0_PK0_PAP0_PGR2_PLR9_SU0_SUS128_SRVW0_TT1_16_WG32_8_1_WGM2
    SolutionIndex: 22
    SolutionNameMin: Cijk_Ailk_Bljk_I8II_BH_MT128x160x64_MI32x32x8x1_SE_1LDSB0_EPS1_GRVW4_LPB16_NLCA1_OPLV0_PK0_PAP0_PGR1_PLR9_SU0_SUS128_SRVW4_TT1_160_WG128_2_1_WGM2
    SolutionIndex: 23
    SolutionNameMin: Cijk_Ailk_Bljk_I8II_BH_MT64x64x64_MI32x32x8x1_SE_1LDSB0_EPS0_GRVW16_LPB16_NLCA1_OPLV0_PK0_PAP0_PGR2_PLR9_SU0_SUS128_SRVW4_TT1_32_WG64_4_1_WGM2
    SolutionIndex: 24
    SolutionNameMin: Cijk_Ailk_Bljk_I8II_BH_MT32x64x128_MI16x16x16x1_SE_1LDSB0_EPS1_GRVW8_LPB32_NLCA1_OPLV0_PK0_PAP0_PGR1_PLR9_SU0_SUS256_SRVW0_TT1_32_WG32_8_1_WGM2
    SolutionIndex: 25
    SolutionNameMin: Cijk_Ailk_Bljk_I8II_BH_MT32x32x128_MI16x16x16x1_SE_1LDSB0_EPS0_GRVW16_LPB32_NLCA1_OPLV0_PK0_PAP0_PGR2_PLR9_SU0_SUS256_SRVW0_TT1_16_WG32_8_1_WGM2
    SolutionIndex: 26
    SolutionNameMin: Cijk_Ailk_Bljk_I8II_BH_MT128x96x64_MI32x32x8x1_SE_1LDSB0_EPS0_GRVW4_LPB16_NLCA1_OPLV0_PK0_PAP0_PGR2_PLR9_SU0_SUS256_SRVW4_TT1_96_WG128_2_1_WGM2
    SolutionIndex: 27
    SolutionNameMin: Cijk_Ailk_Bljk_I8II_BH_MT128x96x64_MI32x32x8x1_SE_1LDSB0_EPS0_GRVW8_LPB16_NLCA1_OPLV0_PK0_PAP0_PGR2_PLR9_SU0_SUS256_SRVW4_TT1_96_WG128_2_1_WGM2
    SolutionIndex: 28
    SolutionNameMin: Cijk_Ailk_Bljk_I8II_BH_MT128x96x64_MI32x32x8x1_SE_1LDSB0_EPS0_GRVW8_LPB16_NLCA1_OPLV0_PK0_PAP0_PGR2_PLR9_SU32_SUS128_SRVW4_TT1_96_WG128_2_1_WGM2
    SolutionIndex: 29
    SolutionNameMin: Cijk_Ailk_Bljk_I8II_BH_MT32x64x128_MI16x16x16x1_SE_1LDSB0_EPS1_GRVW16_LPB32_NLCA1_OPLV0_PK0_PAP0_PGR1_PLR9_SU32_SUS256_SRVW0_TT1_32_WG32_8_1_WGM2
    SolutionIndex: 30
    SolutionNameMin: Cijk_Ailk_Bljk_I8II_BH_MT32x32x128_MI16x16x16x1_SE_1LDSB0_EPS0_GRVW16_LPB32_NLCA1_OPLV0_PK0_PAP0_PGR2_PLR9_SU0_SUS128_SRVW0_TT1_16_WG32_8_1_WGM15
    SolutionIndex: 31
    SolutionNameMin: Cijk_Ailk_Bljk_I8II_BH_MT64x128x64_MI32x32x8x1_SE_1LDSB0_EPS1_GRVW16_LPB16_NLCA1_OPLV0_PK0_PAP0_PGR1_PLR9_SU0_SUS128_SRVW4_TT1_64_WG64_4_1_WGM15
    SolutionIndex: 32
    SolutionNameMin: Cijk_Ailk_Bljk_I8II_BH_MT128x96x64_MI32x32x8x1_SE_1LDSB0_EPS0_GRVW4_LPB16_NLCA1_OPLV0_PK0_PAP0_PGR2_PLR9_SU0_SUS128_SRVW4_TT1_96_WG128_2_1_WGM15
    SolutionIndex: 33
    SolutionNameMin: Cijk_Ailk_Bljk_I8II_BH_MT128x96x128_MI32x32x8x1_SE_1LDSB0_EPS1_GRVW16_LPB16_NLCA1_OPLV0_PK0_PAP0_PGR1_PLR17_SU0_SUS128_SRVW4_TT1_96_WG128_2_1_WGM15
    SolutionIndex: 34
    SolutionNameMin: Cijk_Ailk_Bljk_I8II_BH_MT32x64x128_MI16x16x16x1_SE_1LDSB0_EPS0_GRVW8_LPB32_NLCA1_OPLV0_PK0_PAP0_PGR2_PLR9_SU0_SUS256_SRVW0_TT1_32_WG32_8_1_WGM15
    SolutionIndex: 35
    SolutionNameMin: Cijk_Ailk_Bljk_I8II_BH_MT32x32x128_MI16x16x16x1_SE_1LDSB0_EPS0_GRVW16_LPB32_NLCA1_OPLV0_PK0_PAP0_PGR2_PLR9_SU0_SUS256_SRVW0_TT1_16_WG32_8_1_WGM15
    SolutionIndex: 36
    SolutionNameMin: Cijk_Ailk_Bljk_I8II_BH_MT64x64x64_MI32x32x8x1_SE_1LDSB0_EPS1_GRVW8_LPB16_NLCA1_OPLV0_PK0_PAP0_PGR1_PLR9_SU0_SUS256_SRVW4_TT1_32_WG64_4_1_WGM15
    SolutionIndex: 37
    SolutionNameMin: Cijk_Ailk_Bljk_I8II_BH_MT128x96x64_MI32x32x8x1_SE_1LDSB0_EPS1_GRVW8_LPB16_NLCA1_OPLV0_PK0_PAP0_PGR1_PLR9_SU0_SUS256_SRVW4_TT1_96_WG128_2_1_WGM15
    SolutionIndex: 38
    SolutionNameMin: Cijk_Ailk_Bljk_I8II_BH_MT128x96x64_MI32x32x8x1_SE_1LDSB0_EPS0_GRVW4_LPB16_NLCA1_OPLV0_PK0_PAP0_PGR2_PLR9_SU0_SUS256_SRVW4_TT1_96_WG128_2_1_WGM15
    SolutionIndex: 39
    SolutionNameMin: Cijk_Ailk_Bljk_I8II_BH_MT64x128x64_MI32x32x8x1_SE_1LDSB0_EPS0_GRVW16_LPB16_NLCA1_OPLV0_PK0_PAP0_PGR2_PLR9_SU0_SUS256_SRVW4_TT1_64_WG64_4_1_WGM15
    SolutionIndex: 40
    SolutionNameMin: Cijk_Ailk_Bljk_I8II_BH_MT64x64x128_MI32x32x8x1_SE_1LDSB0_EPS0_GRVW8_LPB16_NLCA1_OPLV0_PK0_PAP0_PGR2_PLR17_SU0_SUS256_SRVW4_TT1_32_WG64_4_1_WGM15
    SolutionIndex: 41
    SolutionNameMin: Cijk_Ailk_Bljk_I8II_BH_MT64x64x128_MI32x32x8x1_SE_1LDSB0_EPS0_GRVW8_LPB16_NLCA1_OPLV0_PK0_PAP0_PGR2_PLR17_SU32_SUS128_SRVW4_TT1_32_WG64_4_1_WGM15
    SolutionIndex: 42
    SolutionNameMin: Cijk_Ailk_Bljk_I8II_BH_MT64x128x128_MI32x32x8x1_SE_1LDSB0_EPS1_GRVW8_LPB16_NLCA1_OPLV0_PK0_PAP0_PGR1_PLR17_SU32_SUS256_SRVW4_TT1_64_WG64_4_1_WGM15
    SolutionIndex: 43
    SolutionNameMin: Cijk_Ailk_Bljk_I8II_BH_MT128x256x64_MI32x32x8x1_SE_1LDSB0_EPS1_GRVW4_LPB16_NLCA1_OPLV0_PK0_PAP0_PGR1_PLR9_SU0_SUS128_SRVW4_TT1_256_WG128_2_1_WGM15
    SolutionIndex: 44
    SolutionNameMin: Cijk_Ailk_Bljk_I8II_BH_MT128x256x64_MI32x32x8x1_SE_1LDSB1_EPS1_GRVW16_LPB16_NLCA1_OPLV0_PK0_PAP0_PGR1_PLR9_SU0_SUS256_SRVW4_TT1_256_WG128_2_1_WGM1
    SolutionIndex: 45
    SolutionNameMin: Cijk_Ailk_Bljk_I8II_BH_MT128x256x64_MI32x32x8x1_SE_1LDSB1_EPS1_GRVW16_LPB16_NLCA1_OPLV0_PKn1_PAP0_PGR1_PLR9_SU0_SUS256_SRVW4_TT1_256_WG128_2_1_WGM2
    SolutionIndex: 46
    SolutionNameMin: Cijk_Ailk_Bljk_I8II_BH_MT64x192x64_MI32x32x8x1_SE_1LDSB0_EPS0_GRVW4_LPB16_NLCA1_OPLV0_PK0_PAP0_PGR2_PLR9_SU0_SUS128_SRVW4_TT1_96_WG64_4_1_WGM15
    SolutionIndex: 47
    SolutionNameMin: Cijk_Ailk_Bljk_I8II_BH_MT128x64x64_MI32x32x8x1_SE_1LDSB0_EPS0_GRVW16_LPB16_NLCA1_OPLV0_PK0_PAP0_PGR2_PLR9_SU0_SUS256_SRVW4_TT1_64_WG128_2_1_WGM1
    SolutionIndex: 48
    SolutionNameMin: Cijk_Ailk_Bljk_I8II_BH_MT128x64x64_MI32x32x8x1_SE_1LDSB0_EPS0_GRVW16_LPB16_NLCA1_OPLV0_PK0_PAP0_PGR2_PLR9_SU0_SUS128_SRVW4_TT1_64_WG128_2_1_WGM1
    SolutionIndex: 49
    SolutionNameMin: Cijk_Ailk_Bljk_I8II_BH_MT128x64x64_MI32x32x8x1_SE_1LDSB0_EPS0_GRVW8_LPB16_NLCA1_OPLV0_PK0_PAP0_PGR2_PLR9_SU0_SUS128_SRVW4_TT1_64_WG128_2_1_WGM2
    SolutionIndex: 50
    SolutionNameMin: Cijk_Ailk_Bljk_I8II_BH_MT128x64x128_MI32x32x8x1_SE_1LDSB0_EPS0_GRVW8_LPB16_NLCA1_OPLV0_PK0_PAP0_PGR2_PLR17_SU0_SUS128_SRVW4_TT1_64_WG128_2_1_WGM2
    SolutionIndex: 51
    SolutionNameMin: Cijk_Ailk_Bljk_I8II_BH_MT128x64x64_MI32x32x8x1_SE_1LDSB0_EPS0_GRVW16_LPB16_NLCA1_OPLV0_PK0_PAP0_PGR2_PLR9_SU32_SUS256_SRVW4_TT1_64_WG128_2_1_WGM2
    SolutionIndex: 52
    SolutionNameMin: Cijk_Ailk_Bljk_I8II_BH_MT128x64x64_MI32x32x8x1_SE_1LDSB0_EPS0_GRVW16_LPB16_NLCA1_OPLV0_PK0_PAP0_PGR2_PLR9_SU0_SUS128_SRVW4_TT1_64_WG128_2_1_WGM15
    SolutionIndex: 53
    SolutionNameMin: Cijk_Ailk_Bljk_I8II_BH_MT128x64x64_MI32x32x8x1_SE_1LDSB0_EPS0_GRVW16_LPB16_NLCA1_OPLV0_PK0_PAP0_PGR2_PLR9_SU0_SUS256_SRVW4_TT1_64_WG128_2_1_WGM2
    SolutionIndex: 54
    SolutionNameMin: Cijk_Ailk_Bljk_I8II_BH_MT64x144x128_MI16x16x16x1_SE_1LDSB0_EPS1_GRVW4_LPB32_NLCA1_OPLV0_PK0_PAP0_PGR1_PLR9_SU0_SUS256_SRVW0_TT1_144_WG64_4_1_WGM1
    SolutionIndex: 55
    SolutionNameMin: Cijk_Ailk_Bljk_I8II_BH_MT128x64x64_MI32x32x8x1_SE_1LDSB0_EPS0_GRVW16_LPB16_NLCA1_OPLV0_PK0_PAP0_PGR2_PLR9_SU32_SUS128_SRVW4_TT1_64_WG128_2_1_WGM2
    SolutionIndex: 56
    SolutionNameMin: Cijk_Ailk_Bljk_I8II_BH_MT64x32x128_MI16x16x16x1_SE_1LDSB0_EPS0_GRVW8_LPB32_NLCA1_OPLV0_PK0_PAP0_PGR2_PLR9_SU32_SUS256_SRVW0_TT2_16_WG32_8_1_WGM1
    SolutionIndex: 57
    SolutionNameMin: Cijk_Ailk_Bljk_I8II_BH_MT64x64x128_MI32x32x8x1_SE_1LDSB0_EPS0_GRVW8_LPB16_NLCA1_OPLV0_PK0_PAP0_PGR2_PLR17_SU0_SUS256_SRVW4_TT1_32_WG64_4_1_WGM2
    SolutionIndex: 58
    SolutionNameMin: Cijk_Ailk_Bljk_I8II_BH_MT64x64x64_MI32x32x8x1_SE_1LDSB0_EPS1_GRVW8_LPB16_NLCA1_OPLV1_PKn1_PAP1_PGR1_PLR9_SU32_SUS128_SRVW4_TT1_32_WG64_4_1_WGM15
    SolutionIndex: 59
    SolutionNameMin: Cijk_Ailk_Bljk_I8II_BH_MT128x128x64_MI32x32x8x1_SE_1LDSB0_EPS0_GRVW8_LPB16_NLCA1_OPLV0_PK0_PAP0_PGR2_PLR9_SU0_SUS128_SRVW4_TT1_128_WG128_2_1_WGM15
    SolutionIndex: 60
    SolutionNameMin: Cijk_Ailk_Bljk_I8II_BH_MT128x64x64_MI32x32x8x1_SE_1LDSB0_EPS1_GRVW16_LPB16_NLCA1_OPLV0_PK0_PAP0_PGR1_PLR9_SU0_SUS128_SRVW4_TT1_64_WG128_2_1_WGM1
    SolutionIndex: 61
    SolutionNameMin: Cijk_Ailk_Bljk_I8II_BH_MT128x64x64_MI32x32x8x1_SE_1LDSB0_EPS0_GRVW4_LPB16_NLCA1_OPLV0_PK0_PAP0_PGR2_PLR9_SU0_SUS256_SRVW4_TT1_64_WG128_2_1_WGM1
    SolutionIndex: 62
    SolutionNameMin: Cijk_Ailk_Bljk_I8II_BH_MT128x96x64_MI32x32x8x1_SE_1LDSB0_EPS0_GRVW4_LPB16_NLCA1_OPLV0_PK0_PAP0_PGR2_PLR9_SU0_SUS128_SRVW4_TT1_96_WG128_2_1_WGM1
    SolutionIndex: 63
    SolutionNameMin: Cijk_Ailk_Bljk_I8II_BH_MT128x64x64_MI32x32x8x1_SE_1LDSB0_EPS0_GRVW8_LPB16_NLCA1_OPLV0_PK0_PAP0_PGR2_PLR9_SU32_SUS256_SRVW4_TT1_64_WG128_2_1_WGM2
    SolutionIndex: 64
    SolutionNameMin: Cijk_Ailk_Bljk_I8II_BH_MT32x32x128_MI16x16x16x1_SE_1LDSB0_EPS0_GRVW8_LPB32_NLCA1_OPLV0_PK0_PAP0_PGR2_PLR9_SU32_SUS128_SRVW0_TT1_16_WG32_8_1_WGM15
    SolutionIndex: 65
    SolutionNameMin: Cijk_Ailk_Bljk_I8II_BH_MT128x64x64_MI32x32x8x1_SE_1LDSB0_EPS0_GRVW16_LPB16_NLCA1_OPLV0_PK0_PAP0_PGR2_PLR9_SU32_SUS128_SRVW4_TT1_64_WG128_2_1_WGM15
    SolutionIndex: 66
    SolutionNameMin: Cijk_Ailk_Bljk_I8II_BH_MT32x64x128_MI16x16x16x1_SE_1LDSB0_EPS0_GRVW8_LPB32_NLCA1_OPLV0_PK0_PAP0_PGR2_PLR9_SU32_SUS128_SRVW0_TT1_32_WG32_8_1_WGM1
    SolutionIndex: 67
    SolutionNameMin: Cijk_Ailk_Bljk_I8II_BH_MT128x64x64_MI32x32x8x1_SE_1LDSB0_EPS0_GRVW16_LPB16_NLCA1_OPLV0_PK0_PAP0_PGR2_PLR9_SU0_SUS256_SRVW4_TT1_64_WG128_2_1_WGM15
    SolutionIndex: 68
    SolutionNameMin: Cijk_Ailk_Bljk_I8II_BH_MT64x64x64_MI32x32x8x1_SE_1LDSB0_EPS0_GRVW8_LPB16_NLCA1_OPLV0_PK0_PAP0_PGR2_PLR9_SU0_SUS256_SRVW4_TT1_32_WG64_4_1_WGM2
    SolutionIndex: 69
    SolutionNameMin: Cijk_Ailk_Bljk_I8II_BH_MT128x64x64_MI32x32x8x1_SE_1LDSB0_EPS0_GRVW8_LPB16_NLCA1_OPLV0_PK0_PAP0_PGR2_PLR9_SU0_SUS256_SRVW4_TT1_64_WG128_2_1_WGM1
    SolutionIndex: 70
    SolutionNameMin: Cijk_Ailk_Bljk_I8II_BH_MT64x64x64_MI32x32x8x1_SE_1LDSB0_EPS0_GRVW16_LPB16_NLCA1_OPLV0_PK0_PAP0_PGR2_PLR9_SU0_SUS256_SRVW4_TT1_32_WG64_4_1_WGM2
    SolutionIndex: 71
    SolutionNameMin: Cijk_Ailk_Bljk_I8II_BH_MT64x32x128_MI16x16x16x1_SE_1LDSB0_EPS0_GRVW16_LPB32_NLCA1_OPLV0_PK0_PAP0_PGR2_PLR9_SU0_SUS256_SRVW0_TT2_16_WG32_8_1_WGM2
    SolutionIndex: 72
    SolutionNameMin: Cijk_Ailk_Bljk_I8II_BH_MT32x32x128_MI16x16x16x1_SE_1LDSB0_EPS0_GRVW8_LPB32_NLCA1_OPLV0_PK0_PAP0_PGR2_PLR9_SU0_SUS128_SRVW0_TT1_16_WG32_8_1_WGM2
    SolutionIndex: 73
    SolutionNameMin: Cijk_Ailk_Bljk_I8II_BH_MT32x32x128_MI16x16x16x1_SE_1LDSB0_EPS0_GRVW4_LPB32_NLCA1_OPLV0_PK0_PAP0_PGR2_PLR9_SU32_SUS256_SRVW4_TT1_16_WG32_8_1_WGM1
    SolutionIndex: 74
    SolutionNameMin: Cijk_Ailk_Bljk_I8II_BH_MT64x64x128_MI32x32x8x1_SE_1LDSB0_EPS0_GRVW16_LPB16_NLCA1_OPLV0_PK0_PAP0_PGR2_PLR17_SU32_SUS128_SRVW4_TT1_32_WG64_4_1_WGM2
- - - [35, 35, 1, 512]
    - [1, 0.043]
  - - [4, 64, 1, 128]
    - [0, 0.004]
  - - [480, 512, 1, 512]
    - [12, 17.842]
  - - [960, 1024, 1, 1024]
    - [17, 60.516]
  - - [1920, 2048, 1, 2048]
    - [43, 84.205]
  - - [3840, 4096, 1, 4096]
    - [44, 93.315]
  - - [7680, 8192, 1, 8192]
    - [45, 96.074]
  - - [704, 1024, 1, 128]
    - [15, 15.512]
  - - [1024, 1024, 1, 3328]
    - [46, 59.198]
  - - [1856, 448, 1, 3328]
    - [42, 66.801]
  - - [2944, 4288, 1, 1280]
    - [47, 82.678]
  - - [2368, 64, 1, 3328]
    - [14, 23.138]
  - - [1760, 32, 1, 1760]
    - [25, 6.957]
  - - [2368, 5888, 1, 256]
    - [28, 58.398]
  - - [5888, 1856, 1, 256]
    - [48, 51.436]
  - - [64, 3584, 1, 1280]
    - [12, 25.285]
  - - [512, 24000, 1, 1536]
    - [49, 82.629]
  - - [128, 6784, 1, 3328]
    - [50, 69.702]
  - - [5888, 1408, 1, 256]
    - [51, 49.243]
  - - [5888, 1856, 1, 3328]
    - [52, 85.266]
  - - [512, 4, 1, 512]
    - [25, 0.153]
  - - [1856, 4288, 1, 256]
    - [20, 50.352]
  - - [1024, 5056, 1, 128]
    - [37, 29.208]
  - - [5056, 5056, 1, 3328]
    - [38, 90.107]
  - - [1408, 5888, 1, 1280]
    - [53, 79.066]
  - - [2368, 448, 1, 128]
    - [31, 16.869]
  - - [6144, 6000, 1, 2560]
    - [52, 90.405]
  - - [2368, 6784, 1, 128]
    - [4, 37.03]
  - - [1024, 3584, 1, 3328]
    - [43, 83.007]
  - - [512, 48000, 1, 2048]
    - [26, 89.124]
  - - [1408, 64, 1, 128]
    - [11, 2.768]
  - - [256, 4288, 1, 3328]
    - [54, 69.3]
  - - [5888, 1408, 1, 1280]
    - [38, 79.192]
  - - [704, 1856, 1, 3328]
    - [33, 75.128]
  - - [1408, 4288, 1, 256]
    - [55, 47.737]
  - - [1024, 2368, 1, 256]
    - [22, 37.239]
  - - [64, 4, 1, 256]
    - [6, 0.01]
  - - [1408, 1856, 1, 1280]
    - [47, 69.926]
  - - [1408, 64, 1, 1280]
    - [8, 12.455]
  - - [448, 1024, 1, 1280]
    - [41, 45.541]
  - - [4096, 32, 1, 4096]
    - [56, 16.6]
  - - [256, 1408, 1, 3328]
    - [57, 44.371]
  - - [5056, 5056, 1, 1280]
    - [18, 84.086]
  - - [448, 5056, 1, 256]
    - [58, 35.467]
  - - [704, 1856, 1, 1280]
    - [18, 63.539]
  - - [128, 5056, 1, 128]
    - [36, 13.761]
  - - [2368, 128, 1, 256]
    - [10, 12.448]
  - - [1856, 1408, 1, 128]
    - [3, 23.131]
  - - [64, 5056, 1, 256]
    - [24, 12.778]
  - - [6784, 256, 1, 3328]
    - [59, 76.325]
  - - [1408, 3584, 1, 256]
    - [55, 45.678]
  - - [4288, 448, 1, 256]
    - [60, 36.818]
  - - [64, 704, 1, 128]
    - [6, 1.384]
  - - [1024, 1856, 1, 128]
    - [39, 23.964]
  - - [4288, 2944, 1, 1280]
    - [19, 81.975]
  - - [704, 5056, 1, 1280]
    - [61, 70.983]
  - - [2368, 704, 1, 3328]
    - [61, 72.212]
  - - [256, 5888, 1, 256]
    - [49, 31.957]
  - - [1856, 4288, 1, 3328]
    - [62, 83.065]
  - - [256, 2944, 1, 256]
    - [16, 24.962]
  - - [5888, 1024, 1, 256]
    - [63, 46.949]
  - - [448, 64, 1, 1280]
    - [13, 3.978]
  - - [3072, 64, 1, 1024]
    - [29, 16.974]
  - - [3584, 4, 1, 1280]
    - [13, 2.086]
  - - [2560, 16, 1, 2560]
    - [21, 7.06]
  - - [2944, 64, 1, 256]
    - [9, 8.517]
  - - [128, 4, 1, 1280]
    - [64, 0.07]
  - - [1408, 2944, 1, 256]
    - [2, 42.621]
  - - [256, 1856, 1, 1280]
    - [23, 45.291]
  - - [6784, 5056, 1, 3328]
    - [65, 91.659]
  - - [5056, 5056, 1, 256]
    - [28, 55.625]
  - - [128, 256, 1, 256]
    - [13, 1.58]
  - - [64, 1024, 1, 1280]
    - [11, 9.535]
  - - [2944, 4, 1, 256]
    - [7, 0.576]
  - - [704, 5056, 1, 128]
    - [60, 26.76]
  - - [2368, 2944, 1, 1280]
    - [27, 78.98]
  - - [448, 448, 1, 3328]
    - [66, 30.641]
  - - [6784, 6784, 1, 1280]
    - [5, 87.197]
  - - [1024, 256, 1, 3328]
    - [40, 33.01]
  - - [1408, 4288, 1, 1280]
    - [52, 73.572]
  - - [3584, 4288, 1, 1280]
    - [67, 82.466]
  - - [512, 6000, 1, 2560]
    - [68, 69.192]
  - - [2368, 704, 1, 1280]
    - [69, 62.929]
  - - [5056, 4288, 1, 3328]
    - [32, 91.0]
  - - [3584, 2368, 1, 3328]
    - [32, 88.176]
  - - [5888, 6784, 1, 1280]
    - [5, 85.734]
  - - [64, 704, 1, 1280]
    - [21, 6.425]
  - - [4288, 256, 1, 256]
    - [70, 25.369]
  - - [2944, 128, 1, 128]
    - [34, 9.212]
  - - [6144, 32, 1, 2560]
    - [71, 22.149]
  - - [6784, 448, 1, 1280]
    - [52, 63.278]
  - - [2944, 5888, 1, 256]
    - [28, 56.707]
  - - [64, 64, 1, 1280]
    - [72, 0.55]
  - - [4288, 2944, 1, 256]
    - [28, 54.329]
  - - [5888, 704, 1, 1280]
    - [39, 69.22]
  - - [5056, 4, 1, 3328]
    - [35, 2.596]
  - - [1856, 64, 1, 1280]
    - [73, 14.669]
  - - [1760, 16, 1, 1760]
    - [30, 3.614]
  - - [448, 5888, 1, 128]
    - [3, 23.522]
  - - [5888, 64, 1, 3328]
    - [74, 44.011]
  - - [2944, 256, 1, 3328]
    - [69, 59.524]
  - - [1024, 64, 1, 128]
    - [13, 2.048]
  - - [5056, 2368, 1, 1280]
    - [53, 80.45]
  - - [448, 3584, 1, 1280]
    - [39, 61.91]
  - - [6784, 5888, 1, 256]
    - [20, 58.221]
  - - [64, 1024, 1, 3328]
    - [72, 13.668]
  - - [704, 128, 1, 1280]
    - [21, 12.649]
- null
