library/src/blas3/Tensile/Logic/asm_full/aldebaran_Cijk_Alik_Bjlk_I8II_BH.yaml
- {MinimumRequiredVersion: 4.25.0}
- aldebaran
- gfx90a
- [Device 7400, Device 7408, Device 740c]
    SolutionIndex: 0
    SolutionNameMin: Cijk_Alik_Bjlk_I8II_BH_MT64x64x64_MI32x32x8x1_SE_1LDSB0_AF0EM1_EPS1_GRVW4_LPA4_LRVW4_NLCB1_OPLV0_PK0_PAP0_PGR1_PLR1_SU32_SUS256_SRVW0_TT1_32_WG64_4_1_WGM8
    SolutionIndex: 1
    SolutionNameMin: Cijk_Alik_Bjlk_I8II_BH_MT64x32x128_MI16x16x16x1_SE_1LDSB0_AF0EM8_EPS0_GRVW16_LPA32_LRVW16_NLCB1_OPLV0_PK0_PAP0_PGR2_PLR9_SU0_SUS0_SRVW0_TT2_16_WG32_8_1_WGM1
    SolutionIndex: 2
    SolutionNameMin: Cijk_Alik_Bjlk_I8II_BH_MT64x64x64_MI32x32x8x1_SE_1LDSB0_AF0EM8_EPS0_GRVW8_LPA16_LRVW16_NLCB1_OPLV0_PK0_PAP0_PGR2_PLR9_SU0_SUS0_SRVW4_TT1_32_WG64_4_1_WGM15
    SolutionIndex: 3
    SolutionNameMin: Cijk_Alik_Bjlk_I8II_BH_MT128x96x64_MI32x32x8x1_SE_1LDSB0_AF0EM8_EPS0_GRVW8_LPA16_LRVW16_NLCB3_OPLV0_PK0_PAP0_PGR2_PLR9_SU0_SUS0_SRVW4_TT1_96_WG128_2_1_WGM15
    SolutionIndex: 4
    SolutionNameMin: Cijk_Alik_Bjlk_I8II_BH_MT64x128x64_MI32x32x8x1_SE_1LDSB0_AF0EM8_EPS0_GRVW16_LPA16_LRVW16_NLCB1_OPLV0_PK0_PAP0_PGR2_PLR9_SU0_SUS0_SRVW4_TT1_64_WG64_4_1_WGM2
    SolutionIndex: 5
    SolutionNameMin: Cijk_Alik_Bjlk_I8II_BH_MT128x128x64_MI32x32x8x1_SE_1LDSB0_AF0EM8_EPS0_GRVW4_LPA16_LRVW16_NLCB1_OPLV0_PK0_PAP0_PGR2_PLR9_SU0_SUS0_SRVW4_TT2_64_WG64_4_1_WGM2
    SolutionIndex: 6
    SolutionNameMin: Cijk_Alik_Bjlk_I8II_BH_MT64x32x128_MI16x16x16x1_SE_1LDSB0_AF0EM8_EPS1_GRVW16_LPA32_LRVW16_NLCB1_OPLV0_PK0_PAP0_PGR1_PLR9_SU0_SUS0_SRVW0_TT2_16_WG32_8_1_WGM1
    SolutionIndex: 7
    SolutionNameMin: Cijk_Alik_Bjlk_I8II_BH_MT64x64x64_MI32x32x8x1_SE_1LDSB0_AF0EM8_EPS0_GRVW16_LPA16_LRVW16_NLCB1_OPLV0_PK0_PAP0_PGR2_PLR9_SU0_SUS0_SRVW4_TT1_32_WG64_4_1_WGM15
    SolutionIndex: 8
    SolutionNameMin: Cijk_Alik_Bjlk_I8II_BH_MT64x128x64_MI32x32x8x1_SE_1LDSB0_AF0EM8_EPS0_GRVW16_LPA16_LRVW16_NLCB1_OPLV0_PK0_PAP0_PGR2_PLR9_SU0_SUS0_SRVW4_TT1_64_WG64_4_1_WGM1
    SolutionIndex: 9
    SolutionNameMin: Cijk_Alik_Bjlk_I8II_BH_MT32x32x128_MI16x16x16x1_SE_1LDSB0_AF0EM8_EPS0_GRVW4_LPA32_LRVW16_NLCB1_OPLV0_PK0_PAP0_PGR2_PLR9_SU0_SUS0_SRVW0_TT1_16_WG32_8_1_WGM15
    SolutionIndex: 10
    SolutionNameMin: Cijk_Alik_Bjlk_I8II_BH_MT64x128x64_MI32x32x8x1_SE_1LDSB0_AF0EM8_EPS0_GRVW16_LPA16_LRVW16_NLCB1_OPLV0_PK0_PAP0_PGR2_PLR9_SU0_SUS0_SRVW4_TT1_64_WG64_4_1_WGM15
    SolutionIndex: 11
    SolutionNameMin: Cijk_Alik_Bjlk_I8II_BH_MT128x64x64_MI32x32x8x1_SE_1LDSB0_AF0EM8_EPS0_GRVW16_LPA16_LRVW16_NLCB1_OPLV0_PKn1_PAP0_PGR2_PLR9_SU0_SUS0_SRVW4_TT1_64_WG128_2_1_WGM1
    SolutionIndex: 12
    SolutionNameMin: Cijk_Alik_Bjlk_I8II_BH_MT128x64x64_MI32x32x8x1_SE_1LDSB0_AF0EM8_EPS0_GRVW16_LPA16_LRVW16_NLCB1_OPLV0_PK0_PAP0_PGR2_PLR9_SU0_SUS0_SRVW4_TT1_64_WG128_2_1_WGM1
    SolutionIndex: 13
    SolutionNameMin: Cijk_Alik_Bjlk_I8II_BH_MT128x96x64_MI32x32x8x1_SE_1LDSB0_AF0EM8_EPS0_GRVW8_LPA16_LRVW16_NLCB3_OPLV0_PK0_PAP0_PGR2_PLR9_SU0_SUS0_SRVW4_TT1_96_WG128_2_1_WGM1
    SolutionIndex: 14
    SolutionNameMin: Cijk_Alik_Bjlk_I8II_BH_MT32x32x128_MI16x16x16x1_SE_1LDSB0_AF0EM8_EPS0_GRVW16_LPA32_LRVW16_NLCB1_OPLV0_PK0_PAP0_PGR2_PLR9_SU0_SUS0_SRVW0_TT1_16_WG32_8_1_WGM2
    SolutionIndex: 15
    SolutionNameMin: Cijk_Alik_Bjlk_I8II_BH_MT96x128x64_MI32x32x8x1_SE_1LDSB0_AF0EM8_EPS0_GRVW8_LPA16_LRVW16_NLCB1_OPLV0_PK0_PAP0_PGR2_PLR9_SU0_SUS0_SRVW0_TT3_32_WG32_8_1_WGM1
    SolutionIndex: 16
    SolutionNameMin: Cijk_Alik_Bjlk_I8II_BH_MT64x64x64_MI32x32x8x1_SE_1LDSB0_AF0EM8_EPS0_GRVW8_LPA16_LRVW16_NLCB1_OPLV0_PK0_PAP0_PGR2_PLR9_SU0_SUS0_SRVW4_TT1_32_WG64_4_1_WGM2
    SolutionIndex: 17
    SolutionNameMin: Cijk_Alik_Bjlk_I8II_BH_MT32x32x128_MI16x16x16x1_SE_1LDSB0_AF0EM8_EPS0_GRVW16_LPA32_LRVW16_NLCB1_OPLV0_PK0_PAP0_PGR2_PLR9_SU0_SUS0_SRVW0_TT1_16_WG32_8_1_WGM15
    SolutionIndex: 18
    SolutionNameMin: Cijk_Alik_Bjlk_I8II_BH_MT64x64x128_MI32x32x8x1_SE_1LDSB0_AF0EM8_EPS0_GRVW16_LPA16_LRVW16_NLCB1_OPLV0_PK0_PAP0_PGR2_PLR17_SU0_SUS0_SRVW4_TT1_32_WG64_4_1_WGM1
    SolutionIndex: 19
    SolutionNameMin: Cijk_Alik_Bjlk_I8II_BH_MT64x64x64_MI32x32x8x1_SE_1LDSB0_AF0EM8_EPS1_GRVW16_LPA16_LRVW16_NLCB1_OPLV0_PK0_PAP0_PGR1_PLR9_SU0_SUS0_SRVW4_TT1_32_WG64_4_1_WGM2
    SolutionIndex: 20
    SolutionNameMin: Cijk_Alik_Bjlk_I8II_BH_MT64x64x64_MI32x32x8x1_SE_1LDSB0_AF0EM8_EPS0_GRVW16_LPA16_LRVW16_NLCB1_OPLV0_PK0_PAP0_PGR2_PLR9_SU32_SUS256_SRVW4_TT1_32_WG64_4_1_WGM1
    SolutionIndex: 21
    SolutionNameMin: Cijk_Alik_Bjlk_I8II_BH_MT64x64x64_MI32x32x8x1_SE_1LDSB0_AF0EM8_EPS0_GRVW16_LPA16_LRVW16_NLCB1_OPLV0_PK0_PAP0_PGR2_PLR9_SU32_SUS256_SRVW4_TT1_32_WG64_4_1_WGM2
    SolutionIndex: 22
    SolutionNameMin: Cijk_Alik_Bjlk_I8II_BH_MT32x32x128_MI16x16x16x1_SE_1LDSB0_AF0EM8_EPS0_GRVW4_LPA32_LRVW16_NLCB1_OPLV0_PK0_PAP0_PGR2_PLR9_SU0_SUS0_SRVW0_TT1_16_WG32_8_1_WGM2
    SolutionIndex: 23
    SolutionNameMin: Cijk_Alik_Bjlk_I8II_BH_MT64x64x64_MI32x32x8x1_SE_1LDSB0_AF0EM8_EPS0_GRVW8_LPA16_LRVW16_NLCB1_OPLV0_PK0_PAP0_PGR2_PLR9_SU0_SUS0_SRVW4_TT1_32_WG64_4_1_WGM1
    SolutionIndex: 24
    SolutionNameMin: Cijk_Alik_Bjlk_I8II_BH_MT64x64x128_MI32x32x8x1_SE_1LDSB0_AF0EM8_EPS0_GRVW16_LPA16_LRVW16_NLCB1_OPLV0_PK0_PAP0_PGR2_PLR17_SU0_SUS0_SRVW4_TT1_32_WG64_4_1_WGM15
    SolutionIndex: 25
    SolutionNameMin: Cijk_Alik_Bjlk_I8II_BH_MT32x32x128_MI16x16x16x1_SE_1LDSB0_AF0EM8_EPS0_GRVW16_LPA32_LRVW16_NLCB1_OPLV0_PK0_PAP0_PGR2_PLR9_SU0_SUS0_SRVW0_TT1_16_WG32_8_1_WGM1
    SolutionIndex: 26
    SolutionNameMin: Cijk_Alik_Bjlk_I8II_BH_MT64x128x64_MI32x32x8x1_SE_1LDSB0_AF0EM8_EPS1_GRVW16_LPA16_LRVW16_NLCB1_OPLV1_PKn1_PAP1_PGR1_PLR9_SU32_SUS128_SRVW4_TT1_64_WG64_4_1_WGM1
    SolutionIndex: 27
    SolutionNameMin: Cijk_Alik_Bjlk_I8II_BH_MT144x64x128_MI16x16x16x1_SE_1LDSB0_AF0EM8_EPS1_GRVW8_LPA32_LRVW16_NLCB1_OPLV0_PK0_PAP0_PGR1_PLR9_SU0_SUS0_SRVW0_TT9_16_WG16_16_1_WGM2
    SolutionIndex: 28
    SolutionNameMin: Cijk_Alik_Bjlk_I8II_BH_MT64x64x64_MI32x32x8x1_SE_GRVW8_LBSPP128_LPB0_LRVW16_NTD0_NEPBS4_SU32_SUS128_TT1_32_VW4_WGM1
    SolutionIndex: 29
    SolutionNameMin: Cijk_Alik_Bjlk_I8II_BH_MT64x128x64_MI32x32x8x1_SE_GRVW16_LBSPP128_LPB0_LRVW16_NTD3_NEPBS0_SU0_SUS0_TT1_64_VW8_WGM1
    SolutionIndex: 30
    SolutionNameMin: Cijk_Alik_Bjlk_I8II_BH_MT64x128x64_MI32x32x8x1_SE_GRVW16_LBSPP128_LPB0_LRVW16_NTD0_NEPBS0_SU0_SUS0_TT1_64_VW8_WGM1
    SolutionIndex: 31
    SolutionNameMin: Cijk_Alik_Bjlk_I8II_BH_MT64x128x64_MI32x32x8x1_SE_GRVW16_LBSPP128_LPB0_LRVW16_NTD0_NEPBS1_SU0_SUS0_TT1_64_VW8_WGM2
    SolutionIndex: 32
    SolutionNameMin: Cijk_Alik_Bjlk_I8II_BH_MT64x128x64_MI32x32x8x1_SE_GRVW16_LBSPP0_LPB16_LRVW8_NTD0_NEPBS0_SU32_SUS128_TT1_64_VW4_WGM1
    SolutionIndex: 33
    SolutionNameMin: Cijk_Alik_Bjlk_I8II_BH_MT64x128x64_MI32x32x8x1_SE_GRVW16_LBSPP0_LPB16_LRVW16_NTD0_NEPBS4_SU32_SUS128_TT1_64_VW8_WGM1
    SolutionIndex: 34
    SolutionNameMin: Cijk_Alik_Bjlk_I8II_BH_MT64x128x64_MI32x32x8x1_SE_GRVW16_LBSPP128_LPB16_LRVW16_NTD0_NEPBS1_SU32_SUS128_TT1_64_VW4_WGM15
    SolutionIndex: 35
    SolutionNameMin: Cijk_Alik_Bjlk_I8II_BH_MT64x128x64_MI32x32x8x1_SE_GRVW16_LBSPP0_LPB0_LRVW8_NTD0_NEPBS0_SU32_SUS128_TT1_64_VW4_WGM1
    SolutionIndex: 36
    SolutionNameMin: Cijk_Alik_Bjlk_I8II_BH_MT64x128x64_MI32x32x8x1_SE_GRVW16_LBSPP128_LPB0_LRVW16_NTD0_NEPBS1_SU32_SUS128_TT1_64_VW4_WGM15
    SolutionIndex: 37
    SolutionNameMin: Cijk_Alik_Bjlk_I8II_BH_MT64x128x64_MI32x32x8x1_SE_GRVW16_LBSPP128_LPB0_LRVW16_NTD0_NEPBS4_SU32_SUS128_TT1_64_VW4_WGM1
    SolutionIndex: 38
    SolutionNameMin: Cijk_Alik_Bjlk_I8II_BH_MT64x128x64_MI32x32x8x1_SE_GRVW16_LBSPP0_LPB16_LRVW16_NTD3_NEPBS1_SU32_SUS128_TT1_64_VW4_WGM1
    SolutionIndex: 39
    SolutionNameMin: Cijk_Alik_Bjlk_I8II_BH_MT64x128x64_MI32x32x8x1_SE_GRVW16_LBSPP128_LPB16_LRVW16_NTD0_NEPBS1_SU32_SUS128_TT1_64_VW8_WGM15
    SolutionIndex: 40
    SolutionNameMin: Cijk_Alik_Bjlk_I8II_BH_MT64x128x64_MI32x32x8x1_SE_GRVW16_LBSPP128_LPB16_LRVW8_NTD3_NEPBS4_SU0_SUS0_TT1_64_VW4_WGM1
    SolutionIndex: 41
    SolutionNameMin: Cijk_Alik_Bjlk_I8II_BH_MT64x128x64_MI32x32x8x1_SE_GRVW16_LBSPP0_LPB0_LRVW16_NTD0_NEPBS1_SU0_SUS0_TT1_64_VW8_WGM15
    SolutionIndex: 42
    SolutionNameMin: Cijk_Alik_Bjlk_I8II_BH_MT128x256x64_MI32x32x8x1_SE_GRVW8_LBSPP128_LPB0_LRVW16_NTC0_NTD0_PGR2_SU32_SUM2_SUS128_TT1_256_VW4_WG128_2_1_WGM1
    SolutionIndex: 43
    SolutionNameMin: Cijk_Alik_Bjlk_I8II_BH_MT64x128x64_MI32x32x8x1_SE_GRVW16_LBSPP128_LPB0_LRVW8_NTD0_NEPBS1_SU32_SUS128_TT1_64_VW4_WGM15
    SolutionIndex: 44
    SolutionNameMin: Cijk_Alik_Bjlk_I8II_BH_MT64x128x64_MI32x32x8x1_SE_GRVW16_LBSPP128_LPB0_LRVW16_NTD3_NEPBS4_SU0_SUS0_TT1_64_VW8_WGM1
    SolutionIndex: 45
    SolutionNameMin: Cijk_Alik_Bjlk_I8II_BH_MT64x128x64_MI32x32x8x1_SE_GRVW16_LBSPP0_LPB0_LRVW16_NTD3_NEPBS4_SU0_SUS0_TT1_64_VW4_WGM2
    SolutionIndex: 46
    SolutionNameMin: Cijk_Alik_Bjlk_I8II_BH_MT64x128x64_MI32x32x8x1_SE_GRVW16_LBSPP128_LPB0_LRVW16_NTD0_NEPBS0_SU32_SUS128_TT1_64_VW4_WGM1
    SolutionIndex: 47
    SolutionNameMin: Cijk_Alik_Bjlk_I8II_BH_MT64x128x64_MI32x32x8x1_SE_GRVW16_LBSPP128_LPB16_LRVW16_NTD3_NEPBS0_SU0_SUS0_TT1_64_VW4_WGM2
    SolutionIndex: 48
    SolutionNameMin: Cijk_Alik_Bjlk_I8II_BH_MT64x128x64_MI32x32x8x1_SE_GRVW16_LBSPP128_LPB0_LRVW16_NTD3_NEPBS0_SU32_SUS128_TT1_64_VW8_WGM1
    SolutionIndex: 49
    SolutionNameMin: Cijk_Alik_Bjlk_I8II_BH_MT64x64x64_MI32x32x8x1_SE_GRVW16_LBSPP128_LPB0_LRVW16_NTD0_NEPBS0_SU32_SUS128_TT1_32_VW4_WGM1
    SolutionIndex: 50
    SolutionNameMin: Cijk_Alik_Bjlk_I8II_BH_MT64x128x64_MI32x32x8x1_SE_GRVW16_LBSPP128_LPB0_LRVW16_NTD3_NEPBS1_SU0_SUS0_TT1_64_VW4_WGM2
    SolutionIndex: 51
    SolutionNameMin: Cijk_Alik_Bjlk_I8II_BH_MT64x128x64_MI32x32x8x1_SE_GRVW16_LBSPP128_LPB16_LRVW16_NTD0_NEPBS1_SU0_SUS0_TT1_64_VW8_WGM2
    SolutionIndex: 52
    SolutionNameMin: Cijk_Alik_Bjlk_I8II_BH_MT64x128x64_MI32x32x8x1_SE_GRVW16_LBSPP0_LPB0_LRVW16_NTD0_NEPBS1_SU32_SUS128_TT1_64_VW4_WGM1
    SolutionIndex: 53
    SolutionNameMin: Cijk_Alik_Bjlk_I8II_BH_MT64x128x64_MI32x32x8x1_SE_GRVW16_LBSPP128_LPB0_LRVW16_NTD0_NEPBS1_SU0_SUS0_TT1_64_VW4_WGM2
    SolutionIndex: 54
    SolutionNameMin: Cijk_Alik_Bjlk_I8II_BH_MT64x128x64_MI32x32x8x1_SE_GRVW16_LBSPP128_LPB16_LRVW16_NTD0_NEPBS1_SU32_SUS128_TT1_64_VW4_WGM1
    SolutionIndex: 55
    SolutionNameMin: Cijk_Alik_Bjlk_I8II_BH_MT64x128x64_MI32x32x8x1_SE_GRVW16_LBSPP128_LPB0_LRVW16_NTD0_NEPBS1_SU32_SUS128_TT1_64_VW8_WGM1
    SolutionIndex: 56
    SolutionNameMin: Cijk_Alik_Bjlk_I8II_BH_MT64x128x64_MI32x32x8x1_SE_GRVW16_LBSPP128_LPB16_LRVW16_NTD3_NEPBS1_SU32_SUS128_TT1_64_VW8_WGM2
    SolutionIndex: 57
    SolutionNameMin: Cijk_Alik_Bjlk_I8II_BH_MT64x128x64_MI32x32x8x1_SE_GRVW16_LBSPP128_LPB0_LRVW16_NTD3_NEPBS1_SU0_SUS0_TT1_64_VW8_WGM15
    SolutionIndex: 58
    SolutionNameMin: Cijk_Alik_Bjlk_I8II_BH_MT128x256x64_MI32x32x8x1_SE_GRVW8_LBSPP128_LPB0_LRVW16_NTC0_NTD0_NEPBS4_SUM4_SUS128_TT1_256_VW8_WG128_2_1_WGM1
    SolutionIndex: 59
    SolutionNameMin: Cijk_Alik_Bjlk_I8II_BH_MT64x128x64_MI32x32x8x1_SE_GRVW16_LBSPP128_LPB16_LRVW16_NTD3_NEPBS1_SU32_SUS128_TT1_64_VW4_WGM15
    SolutionIndex: 60
    SolutionNameMin: Cijk_Alik_Bjlk_I8II_BH_MT64x128x64_MI32x32x8x1_SE_GRVW16_LBSPP0_LPB16_LRVW16_NTD0_NEPBS4_SU0_SUS0_TT1_64_VW4_WGM2
    SolutionIndex: 61
    SolutionNameMin: Cijk_Alik_Bjlk_I8II_BH_MT64x128x64_MI32x32x8x1_SE_GRVW16_LBSPP0_LPB16_LRVW16_NTD3_NEPBS4_SU32_SUS128_TT1_64_VW8_WGM1
    SolutionIndex: 62
    SolutionNameMin: Cijk_Alik_Bjlk_I8II_BH_MT64x128x64_MI32x32x8x1_SE_GRVW16_LBSPP128_LPB16_LRVW16_NTD3_NEPBS4_SU32_SUS128_TT1_64_VW4_WGM2
    SolutionIndex: 63
    SolutionNameMin: Cijk_Alik_Bjlk_I8II_BH_MT64x128x64_MI32x32x8x1_SE_GRVW16_LBSPP0_LPB16_LRVW16_NTD0_NEPBS0_SU0_SUS0_TT1_64_VW4_WGM2
- - - [35, 35, 1, 512]
    - [0, 0.029]
  - - [4, 64, 1, 128]
    - [0, 0.002]
  - - [480, 512, 1, 512]
    - [1, 8.54]
  - - [960, 1024, 1, 1024]
    - [2, 30.083]
  - - [1920, 2048, 1, 2048]
    - [3, 61.679]
  - - [3840, 4096, 1, 4096]
    - [4, 72.751]
  - - [7680, 8192, 1, 8192]
    - [5, 77.416]
  - - [1024, 128, 1, 128]
    - [6, 1.703]
  - - [1856, 448, 1, 3328]
    - [7, 52.663]
  - - [2944, 4288, 1, 1280]
    - [4, 61.566]
  - - [2368, 64, 1, 3328]
    - [1, 18.57]
  - - [2368, 5888, 1, 256]
    - [8, 30.396]
  - - [128, 64, 1, 256]
    - [9, 0.244]
  - - [5888, 1024, 1, 1280]
    - [8, 58.394]
  - - [128, 6784, 1, 3328]
    - [2, 53.816]
  - - [64, 4, 1, 256]
    - [9, 0.008]
  - - [5888, 1856, 1, 3328]
    - [10, 68.258]
  - - [5056, 704, 1, 256]
    - [11, 24.042]
  - - [5888, 2944, 1, 3328]
    - [3, 72.402]
  - - [1856, 4288, 1, 256]
    - [12, 27.392]
  - - [1024, 5056, 1, 128]
    - [8, 15.176]
  - - [5056, 5056, 1, 3328]
    - [10, 72.235]
  - - [1408, 5888, 1, 1280]
    - [4, 59.303]
  - - [2368, 448, 1, 128]
    - [6, 7.727]
  - - [1024, 3584, 1, 3328]
    - [13, 64.123]
  - - [1408, 64, 1, 128]
    - [14, 1.262]
  - - [256, 4288, 1, 3328]
    - [15, 49.116]
  - - [5888, 1408, 1, 1280]
    - [8, 59.011]
  - - [704, 1856, 1, 3328]
    - [16, 55.421]
  - - [1024, 2368, 1, 256]
    - [7, 19.59]
  - - [1408, 1856, 1, 1280]
    - [8, 51.981]
  - - [1408, 64, 1, 1280]
    - [17, 7.555]
  - - [448, 1024, 1, 1280]
    - [16, 22.892]
  - - [256, 1408, 1, 3328]
    - [18, 33.536]
  - - [5056, 5056, 1, 1280]
    - [4, 64.314]
  - - [448, 5056, 1, 256]
    - [7, 19.215]
  - - [704, 1856, 1, 1280]
    - [8, 39.013]
  - - [128, 5056, 1, 128]
    - [6, 5.945]
  - - [2368, 128, 1, 256]
    - [1, 6.071]
  - - [1856, 1408, 1, 128]
    - [19, 12.397]
  - - [64, 5056, 1, 256]
    - [1, 6.812]
  - - [6784, 256, 1, 3328]
    - [8, 62.734]
  - - [6784, 4288, 1, 3328]
    - [3, 72.729]
  - - [4288, 448, 1, 256]
    - [20, 17.645]
  - - [64, 704, 1, 128]
    - [14, 0.619]
  - - [1856, 2368, 1, 3328]
    - [21, 63.09]
  - - [4288, 2944, 1, 1280]
    - [10, 62.006]
  - - [704, 5056, 1, 1280]
    - [8, 55.613]
  - - [2368, 704, 1, 3328]
    - [12, 60.218]
  - - [256, 5888, 1, 256]
    - [8, 17.673]
  - - [1856, 4288, 1, 3328]
    - [10, 70.312]
  - - [256, 2944, 1, 256]
    - [7, 12.712]
  - - [5888, 1024, 1, 256]
    - [8, 26.469]
  - - [448, 64, 1, 1280]
    - [9, 2.537]
  - - [448, 5056, 1, 3328]
    - [3, 57.893]
  - - [3584, 4, 1, 1280]
    - [9, 0.869]
  - - [2944, 64, 1, 256]
    - [6, 4.148]
  - - [128, 4, 1, 1280]
    - [9, 0.049]
  - - [1408, 2944, 1, 256]
    - [12, 23.627]
  - - [256, 1856, 1, 1280]
    - [2, 23.466]
  - - [6784, 5056, 1, 3328]
    - [3, 72.874]
  - - [5056, 5056, 1, 256]
    - [11, 32.225]
  - - [1408, 6784, 1, 128]
    - [20, 16.477]
  - - [64, 1024, 1, 1280]
    - [17, 5.626]
  - - [2944, 4, 1, 256]
    - [22, 0.283]
  - - [704, 5056, 1, 128]
    - [7, 13.438]
  - - [2368, 2944, 1, 1280]
    - [8, 60.201]
  - - [128, 3584, 1, 1280]
    - [23, 23.295]
  - - [6784, 6784, 1, 1280]
    - [4, 66.476]
  - - [1024, 256, 1, 3328]
    - [18, 25.138]
  - - [1408, 4288, 1, 1280]
    - [4, 58.75]
  - - [3584, 4288, 1, 1280]
    - [4, 62.731]
  - - [2368, 704, 1, 1280]
    - [12, 47.418]
  - - [5056, 4288, 1, 3328]
    - [10, 71.426]
  - - [3584, 2368, 1, 3328]
    - [10, 68.272]
  - - [64, 704, 1, 1280]
    - [14, 3.778]
  - - [4288, 256, 1, 256]
    - [2, 13.886]
  - - [2944, 128, 1, 128]
    - [6, 4.18]
  - - [6784, 448, 1, 1280]
    - [7, 49.357]
  - - [1408, 2944, 1, 128]
    - [20, 13.837]
  - - [4288, 2944, 1, 256]
    - [4, 29.82]
  - - [5888, 704, 1, 1280]
    - [11, 53.613]
  - - [1856, 64, 1, 1280]
    - [1, 8.83]
  - - [448, 5888, 1, 128]
    - [7, 13.072]
  - - [5888, 64, 1, 3328]
    - [24, 34.546]
  - - [2944, 256, 1, 3328]
    - [21, 47.896]
  - - [1024, 64, 1, 128]
    - [25, 0.875]
  - - [5056, 2368, 1, 1280]
    - [4, 60.689]
  - - [448, 3584, 1, 1280]
    - [8, 46.496]
  - - [6784, 5888, 1, 256]
    - [8, 33.452]
  - - [64, 1024, 1, 3328]
    - [25, 9.751]
  - - [704, 128, 1, 1280]
    - [25, 7.469]
  - - [5888, 2944, 1, 128]
    - [26, 17.945]
  - - [1408, 448, 1, 1280]
    - [16, 30.121]
  - - [1024, 1408, 1, 256]
    - [8, 16.502]
  - - [2368, 2368, 1, 3328]
    - [4, 64.454]
  - - [1856, 6784, 1, 128]
    - [11, 17.228]
  - - [5056, 704, 1, 3328]
    - [12, 67.099]
  - - [1408, 1856, 1, 256]
    - [20, 20.481]
  - - [1408, 704, 1, 3328]
    - [27, 50.982]
  - - [2368, 5056, 1, 256]
    - [12, 29.641]
  - - [5888, 1856, 1, 256]
    - [8, 28.706]
  - - [4288, 64, 1, 3328]
    - [16, 26.05]
  - - [2368, 4, 1, 1280]
    - [9, 0.865]
  - - [704, 5888, 1, 256]
    - [8, 23.816]
  - - [4288, 64, 1, 256]
    - [1, 5.614]
  - - [6784, 64, 1, 256]
    - [6, 8.881]
  - - [1024, 1024, 1, 1024]
    - [28, 31.178]
  - - [2048, 2048, 1, 1024]
    - [29, 51.808]
  - - [4096, 4096, 1, 1024]
    - [30, 63.211]
  - - [8192, 8192, 1, 1024]
    - [29, 65.274]
  - - [12288, 12288, 1, 1024]
    - [31, 66.417]
  - - [16384, 16384, 1, 1024]
    - [32, 62.789]
  - - [20480, 20480, 1, 1024]
    - [31, 65.721]
  - - [24576, 24576, 1, 1024]
    - [33, 63.491]
  - - [28672, 28672, 1, 1024]
    - [34, 65.611]
  - - [32768, 32768, 1, 1024]
    - [35, 55.132]
  - - [36864, 36864, 1, 1024]
    - [36, 65.374]
  - - [40960, 40960, 1, 1024]
    - [37, 62.605]
  - - [45056, 45056, 1, 1024]
    - [31, 64.723]
  - - [49152, 49152, 1, 1024]
    - [38, 58.897]
  - - [53248, 53248, 1, 1024]
    - [39, 64.639]
  - - [57344, 57344, 1, 1024]
    - [40, 61.353]
  - - [61440, 61440, 1, 1024]
    - [41, 64.296]
  - - [65536, 65536, 1, 1024]
    - [42, 52.775]
  - - [69632, 69632, 1, 1024]
    - [43, 62.742]
  - - [73728, 73728, 1, 1024]
    - [44, 60.307]
  - - [77824, 77824, 1, 1024]
    - [45, 61.173]
  - - [81920, 81920, 1, 1024]
    - [46, 57.113]
  - - [86016, 86016, 1, 1024]
    - [47, 60.841]
  - - [90112, 90112, 1, 1024]
    - [48, 58.944]
  - - [1024, 1024, 1, 2048]
    - [49, 40.594]
  - - [2048, 2048, 1, 2048]
    - [30, 63.129]
  - - [4096, 4096, 1, 2048]
    - [50, 71.873]
  - - [8192, 8192, 1, 2048]
    - [51, 74.322]
  - - [12288, 12288, 1, 2048]
    - [50, 75.171]
  - - [16384, 16384, 1, 2048]
    - [52, 72.977]
  - - [20480, 20480, 1, 2048]
    - [53, 75.15]
  - - [24576, 24576, 1, 2048]
    - [31, 73.675]
  - - [28672, 28672, 1, 2048]
    - [34, 75.025]
  - - [32768, 32768, 1, 2048]
    - [54, 69.862]
  - - [36864, 36864, 1, 2048]
    - [34, 74.843]
  - - [40960, 40960, 1, 2048]
    - [50, 73.203]
  - - [45056, 45056, 1, 2048]
    - [39, 74.526]
  - - [49152, 49152, 1, 2048]
    - [55, 70.687]
  - - [53248, 53248, 1, 2048]
    - [39, 74.266]
  - - [57344, 57344, 1, 2048]
    - [56, 72.353]
  - - [61440, 61440, 1, 2048]
    - [57, 73.792]
  - - [65536, 65536, 1, 2048]
    - [58, 66.666]
  - - [69632, 69632, 1, 2048]
    - [59, 72.276]
  - - [73728, 73728, 1, 2048]
    - [60, 70.753]
  - - [77824, 77824, 1, 2048]
    - [60, 71.116]
  - - [81920, 81920, 1, 2048]
    - [61, 69.137]
  - - [86016, 86016, 1, 2048]
    - [62, 70.719]
  - - [90112, 90112, 1, 2048]
    - [63, 69.831]
- null
