library/src/blas3/Tensile/Logic/asm_full/aldebaran_Cijk_Ailk_Bjlk_HSS_BH.yaml
- {MinimumRequiredVersion: 4.23.0}
- aldebaran
- gfx90a
- [Device 0050, Device 0051, Device 0052, Device 0054, Device 0062, Device 7400, Device
    SolutionIndex: 0
    SolutionNameMin: Cijk_Ailk_Bjlk_HSS_BH_MT128x128x4_SE_PGR0_PLR0_TT8_8
    SolutionIndex: 1
    SolutionNameMin: Cijk_Ailk_Bjlk_HSS_BH_MT64x128x4_SE_PGR0_PLR0_TT4_8
    SolutionIndex: 2
    SolutionNameMin: Cijk_Ailk_Bjlk_HSS_BH_MT64x64x4_SE_PGR0_PLR0_TT4_4
    SolutionIndex: 3
    SolutionNameMin: Cijk_Ailk_Bjlk_HSS_BH_MT64x64x4_SE_PGR1_PLR0_TT4_4
    SolutionIndex: 4
    SolutionNameMin: Cijk_Ailk_Bjlk_HSS_BH_MT64x64x4_SE_PGR0_PLR1_TT4_4
    SolutionIndex: 5
    SolutionNameMin: Cijk_Ailk_Bjlk_HSS_BH_MT64x64x4_SE_PGR1_PLR1_TT4_4
    SolutionIndex: 6
    SolutionNameMin: Cijk_Ailk_Bjlk_HSS_BH_MT64x64x8_SE_PGR0_PLR0_TT4_4
    SolutionIndex: 7
    SolutionNameMin: Cijk_Ailk_Bjlk_HSS_BH_MT64x64x8_SE_PGR1_PLR0_TT4_4
    SolutionIndex: 8
    SolutionNameMin: Cijk_Ailk_Bjlk_HSS_BH_MT64x64x8_SE_PGR0_PLR1_TT4_4
    SolutionIndex: 9
    SolutionNameMin: Cijk_Ailk_Bjlk_HSS_BH_MT64x64x8_SE_PGR1_PLR1_TT4_4
    SolutionIndex: 10
    SolutionNameMin: Cijk_Ailk_Bjlk_HSS_BH_MT64x64x16_SE_PGR0_PLR0_TT4_4
    SolutionIndex: 11
    SolutionNameMin: Cijk_Ailk_Bjlk_HSS_BH_MT64x64x16_SE_PGR1_PLR0_TT4_4
    SolutionIndex: 12
    SolutionNameMin: Cijk_Ailk_Bjlk_HSS_BH_MT64x128x16_SE_PGR1_PLR1_TT4_8
    SolutionIndex: 13
    SolutionNameMin: Cijk_Ailk_Bjlk_HSS_BH_MT64x64x16_SE_PGR1_PLR1_TT4_4
    SolutionIndex: 14
    SolutionNameMin: Cijk_Ailk_Bjlk_HSS_BH_MT32x32x64_MI16x16x16x1_SE_1LDSB0_AF0EM8_GRVW8_GSU1_NLCA1_NLCB1_SU0_SUS0_SRVW4_TT1_16_VAW2_WG32_8_1_WGM1
    SolutionIndex: 15
    SolutionNameMin: Cijk_Ailk_Bjlk_HSS_BH_MT32x32x128_MI16x16x16x1_SE_1LDSB0_AF0EM4_GRVW2_GSU1_NLCA1_NLCB1_SU0_SUS0_SRVW0_TT1_16_VAW2_WG32_8_1_WGM1
    SolutionIndex: 16
    SolutionNameMin: Cijk_Ailk_Bjlk_HSS_BH_MT32x32x64_MI16x16x16x1_SE_1LDSB0_AF0EM4_GRVW4_GSU1_NLCA1_NLCB1_SU32_SUS128_SRVW0_TT1_16_VAW2_WG32_8_1_WGM1
    SolutionIndex: 17
    SolutionNameMin: Cijk_Ailk_Bjlk_HSS_BH_MT32x32x32_MI16x16x16x1_SE_1LDSB0_AF0EM4_GRVW4_GSU1_NLCA1_NLCB1_SU0_SUS0_SRVW0_TT1_16_VAW2_WG32_8_1_WGM15
    SolutionIndex: 18
    SolutionNameMin: Cijk_Ailk_Bjlk_HSS_BH_MT32x32x32_MI16x16x16x1_SE_1LDSB0_AF0EM4_GRVW8_GSU1_NLCA1_NLCB1_SU0_SUS0_SRVW0_TT1_16_VAW2_WG32_8_1_WGM1
    SolutionIndex: 19
    SolutionNameMin: Cijk_Ailk_Bjlk_HSS_BH_MT32x32x64_MI16x16x16x1_SE_1LDSB0_AF0EM4_GRVW4_GSU1_NLCA1_NLCB1_SU32_SUS128_SRVW0_TT1_16_VAW2_WG32_8_1_WGM15
    SolutionIndex: 20
    SolutionNameMin: Cijk_Ailk_Bjlk_HSS_BH_MT32x32x64_MI16x16x16x1_SE_1LDSB0_AF0EM4_GRVW8_GSU1_NLCA1_NLCB1_SU0_SUS0_SRVW0_TT1_16_VAW2_WG32_8_1_WGM15
    SolutionIndex: 21
    SolutionNameMin: Cijk_Ailk_Bjlk_HSS_BH_MT64x64x64_MI32x32x8x1_SE_1LDSB0_AF0EM8_GRVW8_GSU1_NLCA1_NLCB1_SU0_SUS0_SRVW4_TT1_32_VAW2_WG64_4_1_WGM2
    SolutionIndex: 22
    SolutionNameMin: Cijk_Ailk_Bjlk_HSS_BH_MT32x32x64_MI16x16x16x1_SE_1LDSB0_AF0EM4_GRVW8_GSU1_NLCA1_NLCB1_SU32_SUS128_SRVW0_TT1_16_VAW2_WG32_8_1_WGM1
    SolutionIndex: 23
    SolutionNameMin: Cijk_Ailk_Bjlk_HSS_BH_MT64x64x32_MI32x32x8x1_SE_1LDSB0_AF0EM8_GRVW8_GSU1_NLCA1_NLCB1_SU0_SUS0_SRVW4_TT1_32_VAW2_WG64_4_1_WGM1
    SolutionIndex: 24
    SolutionNameMin: Cijk_Ailk_Bjlk_HSS_BH_MT32x32x128_MI16x16x16x1_SE_1LDSB0_AF0EM1_GRVW8_GSU1_NLCA1_NLCB1_SU0_SUS0_SRVW0_TT1_16_VAW2_WG32_8_1_WGM2
    SolutionIndex: 25
    SolutionNameMin: Cijk_Ailk_Bjlk_HSS_BH_MT32x32x128_MI16x16x16x1_SE_1LDSB0_AF0EM4_GRVW2_GSU1_NLCA1_NLCB1_SU32_SUS256_SRVW0_TT1_16_VAW2_WG32_8_1_WGM1
    SolutionIndex: 26
    SolutionNameMin: Cijk_Ailk_Bjlk_HSS_BH_MT32x64x128_MI16x16x16x1_SE_1LDSB0_AF0EM1_GRVW8_GSU1_NLCA1_NLCB1_SU32_SUS256_SRVW0_TT1_32_VAW2_WG32_8_1_WGM15
    SolutionIndex: 27
    SolutionNameMin: Cijk_Ailk_Bjlk_HSS_BH_MT32x32x128_MI16x16x16x1_SE_1LDSB0_AF0EM4_GRVW2_GSU1_NLCA1_NLCB1_SU16_SUS256_SRVW0_TT1_16_VAW2_WG32_8_1_WGM1
    SolutionIndex: 28
    SolutionNameMin: Cijk_Ailk_Bjlk_HSS_BH_MT32x32x64_MI16x16x16x1_SE_1LDSB0_AF0EM1_GRVW4_GSU1_NLCA1_NLCB1_SU0_SUS0_SRVW0_TT1_16_VAW2_WG32_8_1_WGM2
    SolutionIndex: 29
    SolutionNameMin: Cijk_Ailk_Bjlk_HSS_BH_MT64x64x64_MI32x32x8x1_SE_1LDSB0_AF0EM8_GRVW8_GSU1_NLCA1_NLCB1_SU0_SUS0_SRVW4_TT1_32_VAW2_WG64_4_1_WGM15
    SolutionIndex: 30
    SolutionNameMin: Cijk_Ailk_Bjlk_HSS_BH_MT64x64x64_MI32x32x8x1_SE_1LDSB0_AF0EM4_GRVW8_GSU1_NLCA1_NLCB1_SU0_SUS0_SRVW4_TT1_32_VAW2_WG64_4_1_WGM1
    SolutionIndex: 31
    SolutionNameMin: Cijk_Ailk_Bjlk_HSS_BH_MT64x64x64_MI32x32x8x1_SE_1LDSB0_AF0EM8_GRVW8_GSU1_NLCA1_NLCB1_SU0_SUS0_SRVW4_TT1_32_VAW2_WG64_4_1_WGM1
    SolutionIndex: 32
    SolutionNameMin: Cijk_Ailk_Bjlk_HSS_BH_MT32x32x64_MI16x16x16x1_SE_1LDSB0_AF0EM8_GRVW4_GSU5_NLCA1_NLCB1_SU0_SUS0_SRVW0_TT1_16_VAW1_WG32_8_1_WGM1
    SolutionIndex: 33
    SolutionNameMin: Cijk_Ailk_Bjlk_HSS_BH_MT64x16x32_MI16x16x16x1_SE_1LDSB0_AF0EM8_GRVW8_GSU7_NLCA1_NLCB1_SU0_SUS0_SRVW0_TT1_16_VAW1_WG64_4_1_WGM1
    SolutionIndex: 34
    SolutionNameMin: Cijk_Ailk_Bjlk_HSS_BH_MT64x32x64_MI16x16x16x1_SE_1LDSB0_AF0EM8_GRVW8_GSU5_NLCA1_NLCB1_SU32_SUS128_SRVW0_TT2_16_VAW1_WG32_8_1_WGM15
    SolutionIndex: 35
    SolutionNameMin: Cijk_Ailk_Bjlk_HSS_BH_MT32x32x64_MI16x16x16x1_SE_1LDSB0_AF0EM8_GRVW2_GSU7_NLCA1_NLCB1_SU0_SUS0_SRVW0_TT1_16_VAW1_WG32_8_1_WGM15
    SolutionIndex: 36
    SolutionNameMin: Cijk_Ailk_Bjlk_HSS_BH_MT64x64x64_MI32x32x8x1_SE_1LDSB0_AF0EM8_GRVW4_GSU7_NLCA1_NLCB1_SU0_SUS0_SRVW0_TT1_32_VAW1_WG64_4_1_WGM1
    SolutionIndex: 37
    SolutionNameMin: Cijk_Ailk_Bjlk_HSS_BH_MT64x64x128_MI32x32x8x1_SE_1LDSB0_AF0EM4_GRVW8_GSU1_NLCA1_NLCB1_SU32_SUS256_SRVW4_TT1_32_VAW2_WG64_4_1_WGM15
    SolutionIndex: 38
    SolutionNameMin: Cijk_Ailk_Bjlk_HSS_BH_MT64x64x128_MI32x32x8x1_SE_1LDSB0_AF0EM4_GRVW8_GSU1_NLCA1_NLCB1_SU16_SUS256_SRVW4_TT1_32_VAW2_WG64_4_1_WGM2
    SolutionIndex: 39
    SolutionNameMin: Cijk_Ailk_Bjlk_HSS_BH_MT32x64x128_MI16x16x16x1_SE_1LDSB0_AF0EM1_GRVW8_GSU1_NLCA1_NLCB1_SU16_SUS256_SRVW0_TT1_32_VAW2_WG32_8_1_WGM15
    SolutionIndex: 40
    SolutionNameMin: Cijk_Ailk_Bjlk_HSS_BH_MT64x128x64_MI32x32x8x1_SE_1LDSB0_AF0EM1_GRVW8_GSU1_NLCA1_NLCB1_SU16_SUS256_SRVW4_TT1_64_VAW2_WG64_4_1_WGM15
    SolutionIndex: 41
    SolutionNameMin: Cijk_Ailk_Bjlk_HSS_BH_MT64x64x128_MI32x32x8x1_SE_1LDSB0_AF0EM4_GRVW8_GSU1_NLCA1_NLCB1_SU16_SUS256_SRVW4_TT1_32_VAW2_WG64_4_1_WGM1
    SolutionIndex: 42
    SolutionNameMin: Cijk_Ailk_Bjlk_HSS_BH_MT128x64x64_MI32x32x8x1_SE_1LDSB0_AF0EM4_GRVW8_GSU1_NLCA1_NLCB1_SU0_SUS0_SRVW4_TT2_32_VAW2_WG64_4_1_WGM15
    SolutionIndex: 43
    SolutionNameMin: Cijk_Ailk_Bjlk_HSS_BH_MT64x64x128_MI32x32x8x1_SE_1LDSB0_AF0EM4_GRVW8_GSU1_NLCA1_NLCB1_SU16_SUS256_SRVW4_TT1_32_VAW2_WG64_4_1_WGM15
    SolutionIndex: 44
    SolutionNameMin: Cijk_Ailk_Bjlk_HSS_BH_MT64x128x64_MI32x32x8x1_SE_1LDSB0_AF0EM4_GRVW8_GSU1_NLCA1_NLCB1_SU16_SUS256_SRVW4_TT1_64_VAW2_WG64_4_1_WGM15
    SolutionIndex: 45
    SolutionNameMin: Cijk_Ailk_Bjlk_HSS_BH_MT64x32x128_MI16x16x16x1_SE_1LDSB0_AF0EM4_GRVW8_GSU1_NLCA1_NLCB1_SU0_SUS0_SRVW4_TT2_16_VAW2_WG32_8_1_WGM1
    SolutionIndex: 46
    SolutionNameMin: Cijk_Ailk_Bjlk_HSS_BH_MT64x64x64_MI32x32x8x1_SE_1LDSB0_AF0EM4_GRVW8_GSU1_NLCA1_NLCB1_SU16_SUS256_SRVW4_TT1_32_VAW2_WG64_4_1_WGM2
    SolutionIndex: 47
    SolutionNameMin: Cijk_Ailk_Bjlk_HSS_BH_MT64x64x64_MI32x32x8x1_SE_1LDSB0_AF0EM4_GRVW8_GSU1_NLCA1_NLCB1_SU16_SUS128_SRVW4_TT1_32_VAW2_WG64_4_1_WGM1
    SolutionIndex: 48
    SolutionNameMin: Cijk_Ailk_Bjlk_HSS_BH_MT64x64x32_MI32x32x8x1_SE_1LDSB0_AF0EM8_GRVW8_GSU7_NLCA1_NLCB1_SU0_SUS0_SRVW0_TT1_32_VAW1_WG64_4_1_WGM1
    SolutionIndex: 49
    SolutionNameMin: Cijk_Ailk_Bjlk_HSS_BH_MT64x64x32_MI32x32x8x1_SE_1LDSB0_AF0EM8_GRVW8_GSU1_NLCA1_NLCB1_SU0_SUS0_SRVW4_TT1_32_VAW2_WG64_4_1_WGM15
    SolutionIndex: 50
    SolutionNameMin: Cijk_Ailk_Bjlk_HSS_BH_MT64x64x32_MI32x32x8x1_SE_1LDSB0_AF0EM8_GRVW8_GSU1_NLCA1_NLCB1_SU32_SUS128_SRVW4_TT1_32_VAW2_WG64_4_1_WGM1
    SolutionIndex: 51
    SolutionNameMin: Cijk_Ailk_Bjlk_HSS_BH_MT64x128x32_MI32x32x8x1_SE_1LDSB0_AF0EM8_GRVW8_GSU1_NLCA1_NLCB1_SU0_SUS0_SRVW4_TT1_64_VAW2_WG64_4_1_WGM1
    SolutionIndex: 52
    SolutionNameMin: Cijk_Ailk_Bjlk_HSS_BH_MT64x128x16_MI32x32x8x1_SE_1LDSB0_AF0EM8_GRVW8_GSU1_NLCA1_NLCB1_SU0_SUS0_SRVW4_TT1_64_VAW2_WG64_4_1_WGM2
    SolutionIndex: 53
    SolutionNameMin: Cijk_Ailk_Bjlk_HSS_BH_MT128x96x32_MI32x32x8x1_SE_1LDSB0_AF0EM8_GRVW4_GSU1_NLCA1_NLCB3_SU0_SUS0_SRVW4_TT1_96_VAW2_WG128_2_1_WGM2
    SolutionIndex: 54
    SolutionNameMin: Cijk_Ailk_Bjlk_HSS_BH_MT64x128x32_MI32x32x8x1_SE_1LDSB0_AF0EM4_GRVW8_GSU1_NLCA1_NLCB1_SU0_SUS0_SRVW4_TT1_64_VAW2_WG64_4_1_WGM1
    SolutionIndex: 55
    SolutionNameMin: Cijk_Ailk_Bjlk_HSS_BH_MT128x96x32_MI32x32x8x1_SE_1LDSB0_AF0EM8_GRVW4_GSU1_NLCA1_NLCB3_SU0_SUS0_SRVW4_TT1_96_VAW2_WG128_2_1_WGM1
    SolutionIndex: 56
    SolutionNameMin: Cijk_Ailk_Bjlk_HSS_BH_MT128x96x32_MI32x32x8x1_SE_1LDSB0_AF0EM4_GRVW4_GSU1_NLCA1_NLCB3_SU0_SUS0_SRVW4_TT1_96_VAW2_WG128_2_1_WGM2
    SolutionIndex: 57
    SolutionNameMin: Cijk_Ailk_Bjlk_HSS_BH_MT128x96x16_MI32x32x8x1_SE_1LDSB0_AF0EM4_GRVW2_GSU1_NLCA1_NLCB3_SU0_SUS0_SRVW4_TT1_96_VAW2_WG128_2_1_WGM2
    SolutionIndex: 58
    SolutionNameMin: Cijk_Ailk_Bjlk_HSS_BH_MT64x128x16_MI32x32x8x1_SE_1LDSB0_AF0EM4_GRVW8_GSU1_NLCA1_NLCB1_SU0_SUS0_SRVW4_TT1_64_VAW2_WG64_4_1_WGM1
    SolutionIndex: 59
    SolutionNameMin: Cijk_Ailk_Bjlk_HSS_BH_MT128x96x16_MI32x32x8x1_SE_1LDSB0_AF0EM8_GRVW2_GSU1_NLCA1_NLCB3_SU0_SUS0_SRVW4_TT1_96_VAW2_WG128_2_1_WGM1
    SolutionIndex: 60
    SolutionNameMin: Cijk_Ailk_Bjlk_HSS_BH_MT64x256x16_MI32x32x8x1_SE_1LDSB0_AF0EM8_GRVW8_GSU1_NLCA1_NLCB1_SU0_SUS0_SRVW4_TT1_128_VAW2_WG64_4_1_WGM1
    SolutionIndex: 61
    SolutionNameMin: Cijk_Ailk_Bjlk_HSS_BH_MT64x64x32_MI32x32x8x1_SE_1LDSB0_AF0EM8_GRVW8_GSU1_NLCA1_NLCB1_SU0_SUS0_SRVW4_TT1_32_VAW2_WG64_4_1_WGM2
    SolutionIndex: 62
    SolutionNameMin: Cijk_Ailk_Bjlk_HSS_BH_MT64x128x16_MI32x32x8x1_SE_1LDSB0_AF0EM8_GRVW8_GSU1_NLCA1_NLCB1_SU0_SUS0_SRVW4_TT1_64_VAW2_WG64_4_1_WGM1
    SolutionIndex: 63
    SolutionNameMin: Cijk_Ailk_Bjlk_HSS_BH_MT128x96x32_MI32x32x8x1_SE_1LDSB0_AF0EM8_GRVW4_GSU1_NLCA1_NLCB3_SU0_SUS0_SRVW4_TT1_96_VAW2_WG128_2_1_WGM15
    SolutionIndex: 64
    SolutionNameMin: Cijk_Ailk_Bjlk_HSS_BH_MT64x128x16_MI32x32x8x1_SE_1LDSB0_AF0EM4_GRVW8_GSU1_NLCA1_NLCB1_SU0_SUS0_SRVW4_TT1_64_VAW2_WG64_4_1_WGM2
    SolutionIndex: 65
    SolutionNameMin: Cijk_Ailk_Bjlk_HSS_BH_MT64x128x32_MI32x32x8x1_SE_1LDSB0_AF0EM1_GRVW8_GSU1_NLCA1_NLCB1_SU0_SUS0_SRVW4_TT1_64_VAW2_WG64_4_1_WGM1
    SolutionIndex: 66
    SolutionNameMin: Cijk_Ailk_Bjlk_HSS_BH_MT128x96x16_MI32x32x8x1_SE_1LDSB0_AF0EM4_GRVW2_GSU1_NLCA1_NLCB3_SU32_SUS128_SRVW4_TT1_96_VAW2_WG128_2_1_WGM2
    SolutionIndex: 67
    SolutionNameMin: Cijk_Ailk_Bjlk_HSS_BH_MT128x96x16_MI32x32x8x1_SE_1LDSB0_AF0EM8_GRVW2_GSU1_NLCA1_NLCB3_SU0_SUS0_SRVW4_TT1_96_VAW2_WG128_2_1_WGM2
    SolutionIndex: 68
    SolutionNameMin: Cijk_Ailk_Bjlk_HSS_BH_MT128x96x64_MI32x32x8x1_SE_1LDSB0_AF0EM4_GRVW8_GSU1_NLCA1_NLCB3_SU16_SUS128_SRVW4_TT1_96_VAW2_WG128_2_1_WGM2
    SolutionIndex: 69
    SolutionNameMin: Cijk_Ailk_Bjlk_HSS_BH_MT128x96x64_MI32x32x8x1_SE_1LDSB0_AF0EM8_GRVW8_GSU1_NLCA1_NLCB3_SU32_SUS128_SRVW4_TT1_96_VAW2_WG128_2_1_WGM15
    SolutionIndex: 70
    SolutionNameMin: Cijk_Ailk_Bjlk_HSS_BH_MT64x64x32_MI32x32x8x1_SE_1LDSB0_AF0EM1_GRVW4_GSU1_NLCA1_NLCB1_SU16_SUS128_SRVW4_TT1_32_VAW2_WG64_4_1_WGM15
    SolutionIndex: 71
    SolutionNameMin: Cijk_Ailk_Bjlk_HSS_BH_MT64x128x32_MI32x32x8x1_SE_1LDSB0_AF0EM8_GRVW8_GSU1_NLCA1_NLCB1_SU32_SUS128_SRVW4_TT1_64_VAW2_WG64_4_1_WGM1
    SolutionIndex: 72
    SolutionNameMin: Cijk_Ailk_Bjlk_HSS_BH_MT128x96x64_MI32x32x8x1_SE_1LDSB0_AF0EM4_GRVW4_GSU1_NLCA1_NLCB3_SU0_SUS0_SRVW4_TT1_96_VAW2_WG128_2_1_WGM2
    SolutionIndex: 73
    SolutionNameMin: Cijk_Ailk_Bjlk_HSS_BH_MT64x64x32_MI32x32x8x1_SE_1LDSB0_AF0EM4_GRVW4_GSU1_NLCA1_NLCB1_SU0_SUS0_SRVW4_TT1_32_VAW2_WG64_4_1_WGM1
    SolutionIndex: 74
    SolutionNameMin: Cijk_Ailk_Bjlk_HSS_BH_MT128x160x32_MI32x32x8x1_SE_1LDSB0_AF0EM4_GRVW4_GSU1_NLCA1_NLCB5_SU16_SUS128_SRVW4_TT1_160_VAW2_WG128_2_1_WGM1
    SolutionIndex: 75
    SolutionNameMin: Cijk_Ailk_Bjlk_HSS_BH_MT128x128x32_MI32x32x8x1_SE_1LDSB0_AF0EM4_GRVW8_GSU1_NLCA1_NLCB1_SU0_SUS0_SRVW0_TT2_64_VAW2_WG64_4_1_WGM2
    SolutionIndex: 76
    SolutionNameMin: Cijk_Ailk_Bjlk_HSS_BH_MT144x256x32_MI16x16x16x1_SE_1LDSB0_AF0EM8_GRVW2_GSU1_NLCA9_NLCB2_SU0_SUS0_SRVW0_TT9_64_VAW2_WG16_16_1_WGM1
    SolutionIndex: 77
    SolutionNameMin: Cijk_Ailk_Bjlk_HSS_BH_MT128x96x64_MI32x32x8x1_SE_1LDSB0_AF0EM4_GRVW4_GSU1_NLCA1_NLCB3_SU0_SUS0_SRVW0_TT1_96_VAW2_WG128_2_1_WGM15
    SolutionIndex: 78
    SolutionNameMin: Cijk_Ailk_Bjlk_HSS_BH_MT64x128x32_MI32x32x8x1_SE_1LDSB0_AF0EM4_GRVW8_GSU1_NLCA1_NLCB1_SU0_SUS0_SRVW4_TT1_64_VAW2_WG64_4_1_WGM2
    SolutionIndex: 79
    SolutionNameMin: Cijk_Ailk_Bjlk_HSS_BH_MT128x160x32_MI32x32x8x1_SE_1LDSB0_AF0EM8_GRVW4_GSU1_NLCA1_NLCB5_SU32_SUS128_SRVW4_TT1_160_VAW2_WG128_2_1_WGM2
    SolutionIndex: 80
    SolutionNameMin: Cijk_Ailk_Bjlk_HSS_BH_MT128x256x32_MI32x32x8x1_SE_1LDSB0_AF0EM8_GRVW8_GSU1_NLCA1_NLCB1_SU32_SUS128_SRVW4_TT2_128_VAW2_WG64_4_1_WGM15
    SolutionIndex: 81
    SolutionNameMin: Cijk_Ailk_Bjlk_HSS_BH_MT160x256x32_MI32x32x8x1_SE_1LDSB0_AF0EM8_GRVW4_GSU1_NLCA5_NLCB1_SU0_SUS0_SRVW0_TT5_64_VAW2_WG32_8_1_WGM1
    SolutionIndex: 82
    SolutionNameMin: Cijk_Ailk_Bjlk_HSS_BH_MT128x256x32_MI32x32x8x1_SE_1LDSB0_AF0EM8_GRVW8_GSU1_NLCA1_NLCB1_SU0_SUS0_SRVW4_TT2_128_VAW2_WG64_4_1_WGM1
    SolutionIndex: 83
    SolutionNameMin: Cijk_Ailk_Bjlk_HSS_BH_MT128x256x32_MI32x32x8x1_SE_1LDSB0_AF0EM8_GRVW8_GSU1_NLCA1_NLCB1_SU0_SUS0_SRVW4_TT2_128_VAW2_WG64_4_1_WGM2
    SolutionIndex: 84
    SolutionNameMin: Cijk_Ailk_Bjlk_HSS_BH_MT96x128x32_MI32x32x8x1_SE_1LDSB0_AF0EM8_GRVW4_GSU1_NLCA3_NLCB1_SU0_SUS0_SRVW0_TT3_32_VAW2_WG32_8_1_WGM1
    SolutionIndex: 85
    SolutionNameMin: Cijk_Ailk_Bjlk_HSS_BH_MT256x160x32_MI32x32x8x1_SE_1LDSB0_AF0EM8_GRVW4_GSU1_NLCA1_NLCB5_SU32_SUS256_SRVW4_TT2_160_VAW2_WG128_2_1_WGM15
    SolutionIndex: 86
    SolutionNameMin: Cijk_Ailk_Bjlk_HSS_BH_MT128x128x32_MI32x32x8x1_SE_1LDSB0_AF0EM4_GRVW8_GSU1_NLCA1_NLCB1_SU0_SUS0_SRVW0_TT2_64_VAW2_WG64_4_1_WGM15
    SolutionIndex: 87
    SolutionNameMin: Cijk_Ailk_Bjlk_HSS_BH_MT64x64x32_MI32x32x8x1_SE_1LDSB0_AF0EM1_GRVW8_GSU1_NLCA1_NLCB1_SU0_SUS0_SRVW4_TT1_32_VAW2_WG64_4_1_WGM2
    SolutionIndex: 88
    SolutionNameMin: Cijk_Ailk_Bjlk_HSS_BH_MT256x160x32_MI32x32x8x1_SE_1LDSB0_AF0EM8_GRVW4_GSU1_NLCA1_NLCB5_SU0_SUS0_SRVW4_TT2_160_VAW2_WG128_2_1_WGM2
    SolutionIndex: 89
    SolutionNameMin: Cijk_Ailk_Bjlk_HSS_BH_MT128x96x64_MI32x32x8x1_SE_1LDSB0_AF0EM4_GRVW8_GSU1_NLCA1_NLCB3_SU0_SUS0_SRVW4_TT1_96_VAW2_WG128_2_1_WGM2
    SolutionIndex: 90
    SolutionNameMin: Cijk_Ailk_Bjlk_HSS_BH_MT128x256x32_MI32x32x8x1_SE_1LDSB0_AF0EM8_GRVW8_GSU1_NLCA1_NLCB1_SU32_SUS128_SRVW4_TT2_128_VAW2_WG64_4_1_WGM1
    SolutionIndex: 91
    SolutionNameMin: Cijk_Ailk_Bjlk_HSS_BH_MT160x256x32_MI32x32x8x1_SE_1LDSB0_AF0EM8_GRVW4_GSU1_NLCA5_NLCB1_SU32_SUS128_SRVW0_TT5_64_VAW2_WG32_8_1_WGM1
    SolutionIndex: 92
    SolutionNameMin: Cijk_Ailk_Bjlk_HSS_BH_MT64x128x16_MI32x32x8x1_SE_1LDSB0_AF0EM8_GRVW4_GSU1_NLCA1_NLCB1_SU0_SUS0_SRVW4_TT1_64_VAW2_WG64_4_1_WGM15
    SolutionIndex: 93
    SolutionNameMin: Cijk_Ailk_Bjlk_HSS_BH_MT128x256x32_MI32x32x8x1_SE_1LDSB0_AF0EM4_GRVW8_GSU1_NLCA1_NLCB1_SU0_SUS0_SRVW4_TT2_128_VAW2_WG64_4_1_WGM1
    SolutionIndex: 94
    SolutionNameMin: Cijk_Ailk_Bjlk_HSS_BH_MT128x96x64_MI32x32x8x1_SE_1LDSB0_AF0EM8_GRVW8_GSU1_NLCA1_NLCB3_SU0_SUS0_SRVW4_TT1_96_VAW2_WG128_2_1_WGM2
    SolutionIndex: 95
    SolutionNameMin: Cijk_Ailk_Bjlk_HSS_BH_MT128x160x16_MI32x32x8x1_SE_1LDSB0_AF0EM4_GRVW2_GSU1_NLCA1_NLCB5_SU0_SUS0_SRVW4_TT1_160_VAW2_WG128_2_1_WGM1
    SolutionIndex: 96
    SolutionNameMin: Cijk_Ailk_Bjlk_HSS_BH_MT64x128x16_MI32x32x8x1_SE_1LDSB0_AF0EM8_GRVW4_GSU1_NLCA1_NLCB1_SU0_SUS0_SRVW4_TT1_64_VAW2_WG64_4_1_WGM1
    SolutionIndex: 97
    SolutionNameMin: Cijk_Ailk_Bjlk_HSS_BH_MT128x256x32_MI32x32x8x1_SE_1LDSB0_AF0EM8_GRVW8_GSU1_NLCA1_NLCB1_SU32_SUS128_SRVW4_TT2_128_VAW2_WG64_4_1_WGM2
    SolutionIndex: 98
    SolutionNameMin: Cijk_Ailk_Bjlk_HSS_BH_MT64x128x64_MI32x32x8x1_SE_1LDSB0_AF0EM4_GRVW8_GSU1_NLCA1_NLCB1_SU32_SUS128_SRVW4_TT1_64_VAW2_WG64_4_1_WGM15
    SolutionIndex: 99
    SolutionNameMin: Cijk_Ailk_Bjlk_HSS_BH_MT128x128x64_MI32x32x8x1_SE_1LDSB0_AF0EM8_GRVW4_GSU1_NLCA1_NLCB1_SU32_SUS256_SRVW4_TT2_64_VAW2_WG64_4_1_WGM1
    SolutionIndex: 100
    SolutionNameMin: Cijk_Ailk_Bjlk_HSS_BH_MT128x128x64_MI32x32x8x1_SE_1LDSB0_AF0EM8_GRVW8_GSU1_NLCA1_NLCB1_SU0_SUS0_SRVW4_TT2_64_VAW2_WG64_4_1_WGM2
    SolutionIndex: 101
    SolutionNameMin: Cijk_Ailk_Bjlk_HSS_BH_MT128x256x32_MI32x32x8x1_SE_1LDSB0_AF0EM4_GRVW4_GSU1_NLCA1_NLCB1_SU16_SUS128_SRVW4_TT2_128_VAW2_WG64_4_1_WGM1
    SolutionIndex: 102
    SolutionNameMin: Cijk_Ailk_Bjlk_HSS_BH_MT128x96x64_MI32x32x8x1_SE_1LDSB0_AF0EM4_GRVW8_GSU1_NLCA1_NLCB3_SU0_SUS0_SRVW4_TT1_96_VAW2_WG128_2_1_WGM1
    SolutionIndex: 103
    SolutionNameMin: Cijk_Ailk_Bjlk_HSS_BH_MT128x128x64_MI32x32x8x1_SE_1LDSB0_AF0EM8_GRVW4_GSU1_NLCA1_NLCB1_SU0_SUS0_SRVW4_TT2_64_VAW2_WG64_4_1_WGM1
    SolutionIndex: 104
    SolutionNameMin: Cijk_Ailk_Bjlk_HSS_BH_MT128x256x32_MI32x32x8x1_SE_1LDSB0_AF0EM8_GRVW8_GSU1_NLCA1_NLCB1_SU0_SUS0_SRVW4_TT2_128_VAW2_WG64_4_1_WGM15
    SolutionIndex: 105
    SolutionNameMin: Cijk_Ailk_Bjlk_HSS_BH_MT128x96x64_MI32x32x8x1_SE_1LDSB0_AF0EM4_GRVW8_GSU1_NLCA1_NLCB3_SU32_SUS256_SRVW4_TT1_96_VAW2_WG128_2_1_WGM15
    SolutionIndex: 106
    SolutionNameMin: Cijk_Ailk_Bjlk_HSS_BH_MT128x96x32_MI32x32x8x1_SE_1LDSB0_AF0EM4_GRVW4_GSU1_NLCA1_NLCB3_SU0_SUS0_SRVW4_TT1_96_VAW2_WG128_2_1_WGM15
    SolutionIndex: 107
    SolutionNameMin: Cijk_Ailk_Bjlk_HSS_BH_MT128x160x32_MI32x32x8x1_SE_1LDSB0_AF0EM8_GRVW4_GSU1_NLCA1_NLCB5_SU32_SUS128_SRVW4_TT1_160_VAW2_WG128_2_1_WGM15
    SolutionIndex: 108
    SolutionNameMin: Cijk_Ailk_Bjlk_HSS_BH_MT128x288x32_MI32x32x8x1_SE_1LDSB0_AF0EM8_GRVW4_GSU1_NLCA1_NLCB9_SU32_SUS128_SRVW4_TT1_288_VAW2_WG128_2_1_WGM15
    SolutionIndex: 109
    SolutionNameMin: Cijk_Ailk_Bjlk_HSS_BH_MT128x288x32_MI32x32x8x1_SE_1LDSB0_AF0EM4_GRVW4_GSU1_NLCA1_NLCB9_SU0_SUS0_SRVW4_TT1_288_VAW2_WG128_2_1_WGM2
    SolutionIndex: 110
    SolutionNameMin: Cijk_Ailk_Bjlk_HSS_BH_MT256x128x32_MI32x32x8x1_SE_1LDSB0_AF0EM1_GRVW8_GSU1_NLCA1_NLCB1_SU0_SUS0_SRVW0_TT4_64_VAW2_WG64_4_1_WGM15
    SolutionIndex: 111
    SolutionNameMin: Cijk_Ailk_Bjlk_HSS_BH_MT160x256x32_MI32x32x8x1_SE_1LDSB0_AF0EM8_GRVW4_GSU1_NLCA5_NLCB1_SU0_SUS0_SRVW0_TT5_64_VAW2_WG32_8_1_WGM2
    SolutionIndex: 112
    SolutionNameMin: Cijk_Ailk_Bjlk_HSS_BH_MT128x288x32_MI32x32x8x1_SE_1LDSB0_AF0EM8_GRVW4_GSU1_NLCA1_NLCB9_SU32_SUS128_SRVW4_TT1_288_VAW2_WG128_2_1_WGM2
    SolutionIndex: 113
    SolutionNameMin: Cijk_Ailk_Bjlk_HSS_BH_MT128x288x32_MI32x32x8x1_SE_1LDSB0_AF0EM4_GRVW4_GSU1_NLCA1_NLCB9_SU32_SUS128_SRVW4_TT1_288_VAW2_WG128_2_1_WGM15
    SolutionIndex: 114
    SolutionNameMin: Cijk_Ailk_Bjlk_HSS_BH_MT128x256x32_MI32x32x8x1_SE_1LDSB0_AF0EM8_GRVW8_GSU1_NLCA1_NLCB1_SU32_SUS256_SRVW4_TT2_128_VAW2_WG64_4_1_WGM1
    SolutionIndex: 115
    SolutionNameMin: Cijk_Ailk_Bjlk_HSS_BH_MT16x16x64_MI16x16x16x1_SE_1LDSB0_AF0EM1_GRVW4_GSU7_NLCA1_NLCB1_SU0_SUS0_SRVW0_TT1_16_VAW1_WG16_4_1_WGM15
    SolutionIndex: 116
    SolutionNameMin: Cijk_Ailk_Bjlk_HSS_BH_MT64x16x32_MI16x16x16x1_SE_1LDSB0_AF0EM8_GRVW8_GSU1_NLCA1_NLCB1_SU0_SUS0_SRVW0_TT1_16_VAW2_WG64_4_1_WGM2
    SolutionIndex: 117
    SolutionNameMin: Cijk_Ailk_Bjlk_HSS_BH_MT32x32x32_MI16x16x16x1_SE_1LDSB0_AF0EM8_GRVW2_GSU1_NLCA1_NLCB1_SU0_SUS0_SRVW4_TT1_16_VAW2_WG32_8_1_WGM1
    SolutionIndex: 118
    SolutionNameMin: Cijk_Ailk_Bjlk_HSS_BH_MT64x16x32_MI16x16x16x1_SE_1LDSB0_AF0EM8_GRVW2_GSU7_NLCA1_NLCB1_SU0_SUS0_SRVW0_TT1_16_VAW1_WG64_4_1_WGM2
    SolutionIndex: 119
    SolutionNameMin: Cijk_Ailk_Bjlk_HSS_BH_MT64x16x64_MI16x16x16x1_SE_1LDSB0_AF0EM8_GRVW2_GSU7_NLCA1_NLCB1_SU0_SUS0_SRVW4_TT1_16_VAW1_WG64_4_1_WGM1
    SolutionIndex: 120
    SolutionNameMin: Cijk_Ailk_Bjlk_HSS_BH_MT32x32x32_MI16x16x16x1_SE_1LDSB0_AF0EM4_GRVW8_GSU1_NLCA1_NLCB1_SU0_SUS0_SRVW0_TT1_16_VAW2_WG32_8_1_WGM15
    SolutionIndex: 121
    SolutionNameMin: Cijk_Ailk_Bjlk_HSS_BH_MT16x16x16_MI16x16x16x1_SE_1LDSB0_AF0EM1_GRVW8_GSU1_NLCA1_NLCB1_SU0_SUS0_SRVW4_TT1_16_VAW2_WG16_4_1_WGM1
    SolutionIndex: 122
    SolutionNameMin: Cijk_Ailk_Bjlk_HSS_BH_MT16x16x16_MI16x16x16x1_SE_1LDSB0_AF0EM8_GRVW2_GSU1_NLCA1_NLCB1_SU0_SUS0_SRVW0_TT1_16_VAW2_WG16_4_1_WGM1
    SolutionIndex: 123
    SolutionNameMin: Cijk_Ailk_Bjlk_HSS_BH_MT64x16x32_MI16x16x16x1_SE_1LDSB0_AF0EM8_GRVW4_GSU1_NLCA1_NLCB1_SU0_SUS0_SRVW0_TT1_16_VAW2_WG64_4_1_WGM15
    SolutionIndex: 124
    SolutionNameMin: Cijk_Ailk_Bjlk_HSS_BH_MT32x64x16_MI16x16x16x1_SE_1LDSB0_AF0EM4_GRVW2_GSU1_NLCA1_NLCB1_SU0_SUS0_SRVW0_TT1_32_VAW2_WG32_8_1_WGM1
    SolutionIndex: 125
    SolutionNameMin: Cijk_Ailk_Bjlk_HSS_BH_MT32x32x16_MI16x16x16x1_SE_1LDSB0_AF0EM4_GRVW4_GSU1_NLCA1_NLCB1_SU0_SUS0_SRVW0_TT1_16_VAW2_WG32_8_1_WGM15
    SolutionIndex: 126
    SolutionNameMin: Cijk_Ailk_Bjlk_HSS_BH_MT64x32x16_MI16x16x16x1_SE_1LDSB0_AF0EM4_GRVW2_GSU1_NLCA1_NLCB1_SU0_SUS0_SRVW0_TT2_16_VAW2_WG32_8_1_WGM1
    SolutionIndex: 127
    SolutionNameMin: Cijk_Ailk_Bjlk_HSS_BH_MT32x32x16_MI16x16x16x1_SE_1LDSB0_AF0EM4_GRVW4_GSU1_NLCA1_NLCB1_SU0_SUS0_SRVW0_TT1_16_VAW2_WG32_8_1_WGM1
    SolutionIndex: 128
    SolutionNameMin: Cijk_Ailk_Bjlk_HSS_BH_MT32x32x16_MI16x16x16x1_SE_1LDSB0_AF0EM4_GRVW8_GSU1_NLCA1_NLCB1_SU0_SUS0_SRVW0_TT1_16_VAW2_WG32_8_1_WGM2
    SolutionIndex: 129
    SolutionNameMin: Cijk_Ailk_Bjlk_HSS_BH_MT64x32x16_MI16x16x16x1_SE_1LDSB0_AF0EM4_GRVW2_GSU1_NLCA1_NLCB1_SU16_SUS128_SRVW0_TT2_16_VAW2_WG32_8_1_WGM1
    SolutionIndex: 130
    SolutionNameMin: Cijk_Ailk_Bjlk_HSS_BH_MT32x64x16_MI16x16x16x1_SE_1LDSB0_AF0EM4_GRVW2_GSU1_NLCA1_NLCB1_SU0_SUS0_SRVW0_TT1_32_VAW2_WG32_8_1_WGM2
    SolutionIndex: 131
    SolutionNameMin: Cijk_Ailk_Bjlk_HSS_BH_MT64x32x16_MI16x16x16x1_SE_1LDSB0_AF0EM8_GRVW2_GSU1_NLCA1_NLCB1_SU0_SUS0_SRVW4_TT2_16_VAW2_WG32_8_1_WGM2
    SolutionIndex: 132
    SolutionNameMin: Cijk_Ailk_Bjlk_HSS_BH_MT64x32x16_MI16x16x16x1_SE_1LDSB0_AF0EM8_GRVW2_GSU1_NLCA1_NLCB1_SU0_SUS0_SRVW4_TT2_16_VAW2_WG32_8_1_WGM1
    SolutionIndex: 133
    SolutionNameMin: Cijk_Ailk_Bjlk_HSS_BH_MT32x64x16_MI16x16x16x1_SE_1LDSB0_AF0EM4_GRVW2_GSU1_NLCA1_NLCB1_SU0_SUS0_SRVW0_TT1_32_VAW2_WG32_8_1_WGM15
    SolutionIndex: 134
    SolutionNameMin: Cijk_Ailk_Bjlk_HSS_BH_MT64x32x16_MI16x16x16x1_SE_1LDSB0_AF0EM4_GRVW2_GSU1_NLCA1_NLCB1_SU32_SUS128_SRVW0_TT2_16_VAW2_WG32_8_1_WGM1
    SolutionIndex: 135
    SolutionNameMin: Cijk_Ailk_Bjlk_HSS_BH_MT64x32x16_MI16x16x16x1_SE_1LDSB1_AF0EM8_GRVW2_GSU1_NLCA1_NLCB1_SU0_SUS0_SRVW4_TT2_16_VAW2_WG32_8_1_WGM15
    SolutionIndex: 136
    SolutionNameMin: Cijk_Ailk_Bjlk_HSS_BH_MT64x32x16_MI16x16x16x1_SE_1LDSB1_AF0EM8_GRVW2_GSU1_NLCA1_NLCB1_SU0_SUS0_SRVW4_TT2_16_VAW2_WG32_8_1_WGM1
    SolutionIndex: 137
    SolutionNameMin: Cijk_Ailk_Bjlk_HSS_BH_MT64x32x16_MI16x16x16x1_SE_1LDSB0_AF0EM4_GRVW2_GSU1_NLCA1_NLCB1_SU16_SUS128_SRVW0_TT2_16_VAW2_WG32_8_1_WGM15
    SolutionIndex: 138
    SolutionNameMin: Cijk_Ailk_Bjlk_HSS_BH_MT64x32x16_MI16x16x16x1_SE_1LDSB0_AF0EM4_GRVW4_GSU1_NLCA1_NLCB1_SU0_SUS0_SRVW4_TT2_16_VAW2_WG32_8_1_WGM1
    SolutionIndex: 139
    SolutionNameMin: Cijk_Ailk_Bjlk_HSS_BH_MT64x32x16_MI16x16x16x1_SE_1LDSB0_AF0EM4_GRVW2_GSU1_NLCA1_NLCB1_SU0_SUS0_SRVW4_TT2_16_VAW2_WG32_8_1_WGM1
    SolutionIndex: 140
    SolutionNameMin: Cijk_Ailk_Bjlk_HSS_BH_MT64x32x16_MI16x16x16x1_SE_1LDSB1_AF0EM8_GRVW2_GSU1_NLCA1_NLCB1_SU0_SUS0_SRVW4_TT2_16_VAW2_WG32_8_1_WGM2
    SolutionIndex: 141
    SolutionNameMin: Cijk_Ailk_Bjlk_HSS_BH_MT64x32x16_MI16x16x16x1_SE_1LDSB0_AF0EM8_GRVW4_GSU1_NLCA1_NLCB1_SU0_SUS0_SRVW4_TT2_16_VAW2_WG32_8_1_WGM1
    SolutionIndex: 142
    SolutionNameMin: Cijk_Ailk_Bjlk_HSS_BH_MT32x32x16_MI16x16x16x1_SE_1LDSB0_AF0EM8_GRVW8_GSU1_NLCA1_NLCB1_SU0_SUS0_SRVW4_TT1_16_VAW2_WG32_8_1_WGM2
    SolutionIndex: 143
    SolutionNameMin: Cijk_Ailk_Bjlk_HSS_BH_MT32x32x16_MI16x16x16x1_SE_1LDSB0_AF0EM4_GRVW2_GSU1_NLCA1_NLCB1_SU0_SUS0_SRVW0_TT1_16_VAW2_WG32_8_1_WGM1
    SolutionIndex: 144
    SolutionNameMin: Cijk_Ailk_Bjlk_HSS_BH_MT16x16x16_MI16x16x16x1_SE_1LDSB0_AF0EM1_GRVW4_GSU1_NLCA1_NLCB1_SU0_SUS0_SRVW0_TT1_16_VAW2_WG16_4_1_WGM2
    SolutionIndex: 145
    SolutionNameMin: Cijk_Ailk_Bjlk_HSS_BH_MT64x32x16_MI16x16x16x1_SE_1LDSB0_AF0EM4_GRVW2_GSU1_NLCA1_NLCB1_SU16_SUS256_SRVW0_TT2_16_VAW2_WG32_8_1_WGM2
    SolutionIndex: 146
    SolutionNameMin: Cijk_Ailk_Bjlk_HSS_BH_MT32x32x16_MI16x16x16x1_SE_1LDSB0_AF0EM4_GRVW8_GSU1_NLCA1_NLCB1_SU0_SUS0_SRVW0_TT1_16_VAW2_WG32_8_1_WGM1
    SolutionIndex: 147
    SolutionNameMin: Cijk_Ailk_Bjlk_HSS_BH_MT64x32x16_MI16x16x16x1_SE_1LDSB0_AF0EM4_GRVW4_GSU1_NLCA1_NLCB1_SU16_SUS128_SRVW4_TT2_16_VAW2_WG32_8_1_WGM1
    SolutionIndex: 148
    SolutionNameMin: Cijk_Ailk_Bjlk_HSS_BH_MT64x32x16_MI16x16x16x1_SE_1LDSB1_AF0EM8_GRVW4_GSU1_NLCA1_NLCB1_SU0_SUS0_SRVW4_TT2_16_VAW2_WG32_8_1_WGM2
    SolutionIndex: 149
    SolutionNameMin: Cijk_Ailk_Bjlk_HSS_BH_MT64x64x16_MI32x32x8x1_SE_1LDSB0_AF0EM4_GRVW2_GSU1_NLCA1_NLCB1_SU0_SUS0_SRVW4_TT1_32_VAW2_WG64_4_1_WGM15
    SolutionIndex: 150
    SolutionNameMin: Cijk_Ailk_Bjlk_HSS_BH_MT128x160x16_MI32x32x8x1_SE_1LDSB0_AF0EM4_GRVW2_GSU1_NLCA1_NLCB5_SU32_SUS128_SRVW4_TT1_160_VAW2_WG128_2_1_WGM1
    SolutionIndex: 151
    SolutionNameMin: Cijk_Ailk_Bjlk_HSS_BH_MT64x128x32_MI32x32x8x1_SE_1LDSB0_AF0EM8_GRVW8_GSU1_NLCA1_NLCB1_SU32_SUS128_SRVW4_TT1_64_VAW2_WG64_4_1_WGM2
    SolutionIndex: 152
    SolutionNameMin: Cijk_Ailk_Bjlk_HSS_BH_MT64x16x32_MI16x16x16x1_SE_1LDSB0_AF0EM8_GRVW8_GSU15_NLCA1_NLCB1_SU0_SUS0_SRVW0_TT1_16_VAW1_WG64_4_1_WGM15
    SolutionIndex: 153
    SolutionNameMin: Cijk_Ailk_Bjlk_HSS_BH_MT64x128x16_MI32x32x8x1_SE_1LDSB0_AF0EM1_GRVW2_GSU1_NLCA1_NLCB1_SU0_SUS0_SRVW4_TT1_64_VAW2_WG64_4_1_WGM2
    SolutionIndex: 154
    SolutionNameMin: Cijk_Ailk_Bjlk_HSS_BH_MT64x16x32_MI16x16x16x1_SE_1LDSB0_AF0EM8_GRVW8_GSU15_NLCA1_NLCB1_SU0_SUS0_SRVW0_TT1_16_VAW1_WG64_4_1_WGM2
    SolutionIndex: 155
    SolutionNameMin: Cijk_Ailk_Bjlk_HSS_BH_MT256x160x32_MI32x32x8x1_SE_1LDSB0_AF0EM8_GRVW4_GSU1_NLCA1_NLCB5_SU0_SUS0_SRVW4_TT2_160_VAW2_WG128_2_1_WGM15
    SolutionIndex: 156
    SolutionNameMin: Cijk_Ailk_Bjlk_HSS_BH_MT64x16x32_MI16x16x16x1_SE_1LDSB0_AF0EM8_GRVW2_GSU15_NLCA1_NLCB1_SU0_SUS0_SRVW0_TT1_16_VAW1_WG64_4_1_WGM2
    SolutionIndex: 157
    SolutionNameMin: Cijk_Ailk_Bjlk_HSS_BH_MT128x160x16_MI32x32x8x1_SE_1LDSB0_AF0EM4_GRVW2_GSU1_NLCA1_NLCB5_SU16_SUS128_SRVW4_TT1_160_VAW2_WG128_2_1_WGM1
    SolutionIndex: 158
    SolutionNameMin: Cijk_Ailk_Bjlk_HSS_BH_MT16x16x32_MI16x16x16x1_SE_1LDSB0_AF0EM1_GRVW4_GSU15_NLCA1_NLCB1_SU0_SUS0_SRVW0_TT1_16_VAW1_WG16_4_1_WGM1
    SolutionIndex: 159
    SolutionNameMin: Cijk_Ailk_Bjlk_HSS_BH_MT64x64x64_MI32x32x8x1_SE_1LDSB0_AF0EM8_GRVW8_GSU15_NLCA1_NLCB1_SU0_SUS0_SRVW0_TT1_32_VAW1_WG64_4_1_WGM1
    SolutionIndex: 160
    SolutionNameMin: Cijk_Ailk_Bjlk_HSS_BH_MT128x256x32_MI32x32x8x1_SE_1LDSB0_AF0EM1_GRVW8_GSU7_NLCA1_NLCB1_SU32_SUS128_SRVW0_TT2_128_VAW1_WG64_4_1_WGM2
    SolutionIndex: 161
    SolutionNameMin: Cijk_Ailk_Bjlk_HSS_BH_MT128x128x32_MI32x32x8x1_SE_1LDSB0_AF0EM8_GRVW8_GSU15_NLCA1_NLCB1_SU0_SUS0_SRVW0_TT2_64_VAW1_WG64_4_1_WGM1
    SolutionIndex: 162
    SolutionNameMin: Cijk_Ailk_Bjlk_HSS_BH_MT128x128x64_MI32x32x8x1_SE_1LDSB0_AF0EM8_GRVW8_GSU3_NLCA1_NLCB1_SU0_SUS0_SRVW0_TT2_64_VAW1_WG64_4_1_WGM1
    SolutionIndex: 163
    SolutionNameMin: Cijk_Ailk_Bjlk_HSS_BH_MT256x128x32_MI32x32x8x1_SE_1LDSB0_AF0EM8_GRVW8_GSU3_NLCA1_NLCB1_SU0_SUS0_SRVW0_TT4_64_VAW1_WG64_4_1_WGM1
    SolutionIndex: 164
    SolutionNameMin: Cijk_Ailk_Bjlk_HSS_BH_MT64x128x16_MI32x32x8x1_SE_1LDSB0_AF0EM1_GRVW2_GSU1_NLCA1_NLCB1_SU0_SUS0_SRVW4_TT1_64_VAW2_WG64_4_1_WGM15
    SolutionIndex: 165
    SolutionNameMin: Cijk_Ailk_Bjlk_HSS_BH_MT128x256x32_MI32x32x8x1_SE_1LDSB0_AF0EM8_GRVW8_GSU3_NLCA1_NLCB1_SU0_SUS0_SRVW0_TT2_128_VAW1_WG64_4_1_WGM1
    SolutionIndex: 166
    SolutionNameMin: Cijk_Ailk_Bjlk_HSS_BH_MT128x256x32_MI32x32x8x1_SE_1LDSB0_AF0EM8_GRVW8_GSU3_NLCA1_NLCB1_SU0_SUS0_SRVW0_TT2_128_VAW1_WG64_4_1_WGM15
    SolutionIndex: 167
    SolutionNameMin: Cijk_Ailk_Bjlk_HSS_BH_MT256x128x32_MI32x32x8x1_SE_1LDSB0_AF0EM8_GRVW8_GSU3_NLCA1_NLCB1_SU0_SUS0_SRVW0_TT4_64_VAW1_WG64_4_1_WGM15
    SolutionIndex: 168
    SolutionNameMin: Cijk_Ailk_Bjlk_HSS_BH_MT32x64x16_MI16x16x16x1_SE_1LDSB1_AF0EM1_GRVW2_GSU1_NLCA1_NLCB1_SU32_SUS256_SRVW4_TT1_32_VAW2_WG32_8_1_WGM15
    SolutionIndex: 169
    SolutionNameMin: Cijk_Ailk_Bjlk_HSS_BH_MT32x64x16_MI16x16x16x1_SE_1LDSB0_AF0EM1_GRVW2_GSU1_NLCA1_NLCB1_SU0_SUS0_SRVW4_TT1_32_VAW2_WG32_8_1_WGM1
    SolutionIndex: 170
    SolutionNameMin: Cijk_Ailk_Bjlk_HSS_BH_MT32x64x16_MI16x16x16x1_SE_1LDSB0_AF0EM1_GRVW2_GSU1_NLCA1_NLCB1_SU32_SUS128_SRVW4_TT1_32_VAW2_WG32_8_1_WGM15
    SolutionIndex: 171
    SolutionNameMin: Cijk_Ailk_Bjlk_HSS_BH_MT32x64x16_MI16x16x16x1_SE_1LDSB0_AF0EM1_GRVW8_GSU1_NLCA1_NLCB1_SU0_SUS0_SRVW4_TT1_32_VAW2_WG32_8_1_WGM1
    SolutionIndex: 172
    SolutionNameMin: Cijk_Ailk_Bjlk_HSS_BH_MT32x64x16_MI16x16x16x1_SE_1LDSB0_AF0EM1_GRVW8_GSU1_NLCA1_NLCB1_SU16_SUS128_SRVW4_TT1_32_VAW2_WG32_8_1_WGM2
    SolutionIndex: 173
    SolutionNameMin: Cijk_Ailk_Bjlk_HSS_BH_MT32x64x16_MI16x16x16x1_SE_1LDSB0_AF0EM1_GRVW2_GSU1_NLCA1_NLCB1_SU16_SUS256_SRVW4_TT1_32_VAW2_WG32_8_1_WGM2
    SolutionIndex: 174
    SolutionNameMin: Cijk_Ailk_Bjlk_HSS_BH_MT32x32x64_MI16x16x16x1_SE_1LDSB0_AF0EM1_GRVW8_GSU1_NLCA1_NLCB1_SU0_SUS0_SRVW0_TT1_16_VAW2_WG32_8_1_WGM2
    SolutionIndex: 175
    SolutionNameMin: Cijk_Ailk_Bjlk_HSS_BH_MT32x64x16_MI16x16x16x1_SE_1LDSB0_AF0EM1_GRVW2_GSU1_NLCA1_NLCB1_SU0_SUS0_SRVW0_TT1_32_VAW2_WG32_8_1_WGM1
    SolutionIndex: 176
    SolutionNameMin: Cijk_Ailk_Bjlk_HSS_BH_MT32x32x16_MI16x16x16x1_SE_1LDSB0_AF0EM1_GRVW2_GSU1_NLCA1_NLCB1_SU0_SUS0_SRVW0_TT1_16_VAW2_WG32_8_1_WGM1
    SolutionIndex: 177
    SolutionNameMin: Cijk_Ailk_Bjlk_HSS_BH_MT128x128x64_MI32x32x8x1_SE_1LDSB0_AF0EM8_GRVW8_GSU5_NLCA1_NLCB1_SU0_SUS0_SRVW0_TT2_64_VAW1_WG64_4_1_WGM1
    SolutionIndex: 178
    SolutionNameMin: Cijk_Ailk_Bjlk_HSS_BH_MT256x128x32_MI32x32x8x1_SE_1LDSB0_AF0EM8_GRVW8_GSU5_NLCA1_NLCB1_SU0_SUS0_SRVW0_TT4_64_VAW1_WG64_4_1_WGM1
    SolutionIndex: 179
    SolutionNameMin: Cijk_Ailk_Bjlk_HSS_BH_MT128x128x64_MI32x32x8x1_SE_1LDSB0_AF0EM8_GRVW8_GSU2_NLCA1_NLCB1_SU0_SUS0_SRVW0_TT2_64_VAW1_WG64_4_1_WGM15
    SolutionIndex: 180
    SolutionNameMin: Cijk_Ailk_Bjlk_HSS_BH_MT256x160x32_MI32x32x8x1_SE_1LDSB0_AF0EM8_GRVW4_GSU2_NLCA1_NLCB5_SU0_SUS0_SRVW0_TT2_160_VAW1_WG128_2_1_WGM15
    SolutionIndex: 181
    SolutionNameMin: Cijk_Ailk_Bjlk_HSS_BH_MT256x256x16_MI32x32x8x1_SE_1LDSB0_AF0EM8_GRVW8_GSU3_NLCA1_NLCB1_SU0_SUS0_SRVW0_TT4_128_VAW1_WG64_4_1_WGM1
    SolutionIndex: 182
    SolutionNameMin: Cijk_Ailk_Bjlk_HSS_BH_MT128x96x32_MI32x32x8x1_SE_1LDSB0_AF0EM4_GRVW4_GSU1_NLCA1_NLCB3_SU32_SUS128_SRVW4_TT1_96_VAW2_WG128_2_1_WGM2
    SolutionIndex: 183
    SolutionNameMin: Cijk_Ailk_Bjlk_HSS_BH_MT128x256x32_MI32x32x8x1_SE_1LDSB0_AF0EM4_GRVW4_GSU1_NLCA1_NLCB1_SU0_SUS0_SRVW4_TT2_128_VAW2_WG64_4_1_WGM15
    SolutionIndex: 184
    SolutionNameMin: Cijk_Ailk_Bjlk_HSS_BH_MT128x288x32_MI32x32x8x1_SE_1LDSB0_AF0EM8_GRVW4_GSU1_NLCA1_NLCB9_SU0_SUS0_SRVW4_TT1_288_VAW2_WG128_2_1_WGM2
    SolutionIndex: 185
    SolutionNameMin: Cijk_Ailk_Bjlk_HSS_BH_MT128x288x32_MI32x32x8x1_SE_1LDSB0_AF0EM4_GRVW4_GSU1_NLCA1_NLCB9_SU32_SUS256_SRVW4_TT1_288_VAW2_WG128_2_1_WGM15
    SolutionIndex: 186
    SolutionNameMin: Cijk_Ailk_Bjlk_HSS_BH_MT256x256x16_MI32x32x8x1_SE_1LDSB0_AF0EM4_GRVW4_GSU1_NLCA1_NLCB1_SU16_SUS256_SRVW0_TT4_128_VAW2_WG64_4_1_WGM1
    SolutionIndex: 187
    SolutionNameMin: Cijk_Ailk_Bjlk_HSS_BH_MT64x64x32_MI32x32x8x1_SE_1LDSB0_AF0EM1_GRVW8_GSU1_NLCA1_NLCB1_SU0_SUS0_SRVW4_TT1_32_VAW2_WG64_4_1_WGM1
    SolutionIndex: 188
    SolutionNameMin: Cijk_Ailk_Bjlk_HSS_BH_MT64x64x128_MI32x32x8x1_SE_1LDSB0_AF0EM1_GRVW8_GSU1_NLCA1_NLCB1_SU32_SUS256_SRVW4_TT1_32_VAW2_WG64_4_1_WGM1
    SolutionIndex: 189
    SolutionNameMin: Cijk_Ailk_Bjlk_HSS_BH_MT96x128x64_MI32x32x8x1_SE_1LDSB0_AF0EM8_GRVW8_GSU5_NLCA3_NLCB1_SU32_SUS256_SRVW0_TT3_32_VAW1_WG32_8_1_WGM2
    SolutionIndex: 190
    SolutionNameMin: Cijk_Ailk_Bjlk_HSS_BH_MT96x128x64_MI32x32x8x1_SE_1LDSB0_AF0EM8_GRVW4_GSU5_NLCA3_NLCB1_SU32_SUS256_SRVW0_TT3_32_VAW1_WG32_8_1_WGM15
    SolutionIndex: 191
    SolutionNameMin: Cijk_Ailk_Bjlk_HSS_BH_MT64x128x32_MI32x32x8x1_SE_1LDSB0_AF0EM1_GRVW8_GSU1_NLCA1_NLCB1_SU32_SUS256_SRVW4_TT1_64_VAW2_WG64_4_1_WGM15
    SolutionIndex: 192
    SolutionNameMin: Cijk_Ailk_Bjlk_HSS_BH_MT96x128x16_MI32x32x8x1_SE_1LDSB0_AF0EM8_GRVW2_GSU1_NLCA3_NLCB1_SU0_SUS0_SRVW0_TT3_32_VAW2_WG32_8_1_WGM2
    SolutionIndex: 193
    SolutionNameMin: Cijk_Ailk_Bjlk_HSS_BH_MT128x64x16_MI32x32x8x1_SE_1LDSB0_AF0EM4_GRVW4_GSU1_NLCA1_NLCB1_SU0_SUS0_SRVW0_TT2_32_VAW2_WG64_4_1_WGM15
    SolutionIndex: 194
    SolutionNameMin: Cijk_Ailk_Bjlk_HSS_BH_MT64x128x16_MI32x32x8x1_SE_1LDSB0_AF0EM8_GRVW8_GSU1_NLCA1_NLCB1_SU0_SUS0_SRVW4_TT1_64_VAW2_WG64_4_1_WGM15
    SolutionIndex: 195
    SolutionNameMin: Cijk_Ailk_Bjlk_HSS_BH_MT128x128x64_MI32x32x8x1_SE_1LDSB0_AF0EM8_GRVW8_GSU3_NLCA1_NLCB1_SU32_SUS256_SRVW0_TT2_64_VAW1_WG64_4_1_WGM15
    SolutionIndex: 196
    SolutionNameMin: Cijk_Ailk_Bjlk_HSS_BH_MT128x128x64_MI32x32x8x1_SE_1LDSB0_AF0EM8_GRVW8_GSU3_NLCA1_NLCB1_SU0_SUS0_SRVW0_TT2_64_VAW1_WG64_4_1_WGM2
    SolutionIndex: 197
    SolutionNameMin: Cijk_Ailk_Bjlk_HSS_BH_MT256x128x32_MI32x32x8x1_SE_1LDSB0_AF0EM8_GRVW8_GSU15_NLCA1_NLCB1_SU0_SUS0_SRVW0_TT4_64_VAW1_WG64_4_1_WGM1
    SolutionIndex: 198
    SolutionNameMin: Cijk_Ailk_Bjlk_HSS_BH_MT128x96x16_MI32x32x8x1_SE_1LDSB0_AF0EM4_GRVW2_GSU1_NLCA1_NLCB3_SU16_SUS256_SRVW4_TT1_96_VAW2_WG128_2_1_WGM15
    SolutionIndex: 199
    SolutionNameMin: Cijk_Ailk_Bjlk_HSS_BH_MT128x256x32_MI32x32x8x1_SE_1LDSB0_AF0EM8_GRVW8_GSU3_NLCA1_NLCB1_SU0_SUS0_SRVW0_TT2_128_VAW1_WG64_4_1_WGM2
    SolutionIndex: 200
    SolutionNameMin: Cijk_Ailk_Bjlk_HSS_BH_MT64x128x16_MI32x32x8x1_SE_1LDSB0_AF0EM4_GRVW2_GSU1_NLCA1_NLCB1_SU0_SUS0_SRVW4_TT1_64_VAW2_WG64_4_1_WGM15
    SolutionIndex: 201
    SolutionNameMin: Cijk_Ailk_Bjlk_HSS_BH_MT64x128x32_MI32x32x8x1_SE_1LDSB0_AF0EM8_GRVW8_GSU1_NLCA1_NLCB1_SU0_SUS0_SRVW4_TT1_64_VAW2_WG64_4_1_WGM2
    SolutionIndex: 202
    SolutionNameMin: Cijk_Ailk_Bjlk_HSS_BH_MT64x128x32_MI32x32x8x1_SE_1LDSB0_AF0EM8_GRVW8_GSU1_NLCA1_NLCB1_SU32_SUS256_SRVW4_TT1_64_VAW2_WG64_4_1_WGM1
    SolutionIndex: 203
    SolutionNameMin: Cijk_Ailk_Bjlk_HSS_BH_MT64x128x16_MI32x32x8x1_SE_1LDSB0_AF0EM8_GRVW4_GSU1_NLCA1_NLCB1_SU0_SUS0_SRVW4_TT1_64_VAW2_WG64_4_1_WGM2
    SolutionIndex: 204
    SolutionNameMin: Cijk_Ailk_Bjlk_HSS_BH_MT256x128x32_MI32x32x8x1_SE_1LDSB0_AF0EM8_GRVW8_GSU3_NLCA1_NLCB1_SU32_SUS256_SRVW0_TT4_64_VAW1_WG64_4_1_WGM1
    SolutionIndex: 205
    SolutionNameMin: Cijk_Ailk_Bjlk_HSS_BH_MT256x160x32_MI32x32x8x1_SE_1LDSB0_AF0EM8_GRVW4_GSU2_NLCA1_NLCB5_SU0_SUS0_SRVW0_TT2_160_VAW1_WG128_2_1_WGM2
    SolutionIndex: 206
    SolutionNameMin: Cijk_Ailk_Bjlk_HSS_BH_MT160x128x16_MI32x32x8x1_SE_1LDSB0_AF0EM8_GRVW2_GSU1_NLCA5_NLCB1_SU0_SUS0_SRVW0_TT5_32_VAW2_WG32_8_1_WGM1
    SolutionIndex: 207
    SolutionNameMin: Cijk_Ailk_Bjlk_HSS_BH_MT64x128x16_MI32x32x8x1_SE_1LDSB0_AF0EM4_GRVW2_GSU1_NLCA1_NLCB1_SU0_SUS0_SRVW4_TT1_64_VAW2_WG64_4_1_WGM1
    SolutionIndex: 208
    SolutionNameMin: Cijk_Ailk_Bjlk_HSS_BH_MT256x144x32_MI16x16x16x1_SE_1LDSB0_AF0EM4_GRVW2_GSU1_NLCA2_NLCB9_SU0_SUS0_SRVW4_TT4_144_VAW2_WG64_4_1_WGM15
    SolutionIndex: 209
    SolutionNameMin: Cijk_Ailk_Bjlk_HSS_BH_MT64x32x16_MI16x16x16x1_SE_1LDSB0_AF0EM1_GRVW2_GSU1_NLCA1_NLCB1_SU0_SUS0_SRVW4_TT2_16_VAW2_WG32_8_1_WGM2
    SolutionIndex: 210
    SolutionNameMin: Cijk_Ailk_Bjlk_HSS_BH_MT64x16x32_MI16x16x16x1_SE_1LDSB0_AF0EM8_GRVW8_GSU15_NLCA1_NLCB1_SU0_SUS0_SRVW4_TT1_16_VAW1_WG64_4_1_WGM1
    SolutionIndex: 211
    SolutionNameMin: Cijk_Ailk_Bjlk_HSS_BH_MT64x256x16_MI32x32x8x1_SE_1LDSB0_AF0EM1_GRVW8_GSU1_NLCA1_NLCB1_SU0_SUS0_SRVW4_TT1_128_VAW2_WG64_4_1_WGM15
    SolutionIndex: 212
    SolutionNameMin: Cijk_Ailk_Bjlk_HSS_BH_MT64x128x16_MI32x32x8x1_SE_1LDSB0_AF0EM1_GRVW8_GSU1_NLCA1_NLCB1_SU0_SUS0_SRVW4_TT1_64_VAW2_WG64_4_1_WGM1
    SolutionIndex: 213
    SolutionNameMin: Cijk_Ailk_Bjlk_HSS_BH_MT64x128x32_MI32x32x8x1_SE_1LDSB0_AF0EM4_GRVW8_GSU1_NLCA1_NLCB1_SU0_SUS0_SRVW4_TT1_64_VAW2_WG64_4_1_WGM15
    SolutionIndex: 214
    SolutionNameMin: Cijk_Ailk_Bjlk_HSS_BH_MT64x128x16_MI32x32x8x1_SE_1LDSB0_AF0EM1_GRVW8_GSU1_NLCA1_NLCB1_SU32_SUS256_SRVW4_TT1_64_VAW2_WG64_4_1_WGM15
    SolutionIndex: 215
    SolutionNameMin: Cijk_Ailk_Bjlk_HSS_BH_MT64x64x16_MI32x32x8x1_SE_1LDSB0_AF0EM1_GRVW4_GSU1_NLCA1_NLCB1_SU0_SUS0_SRVW4_TT1_32_VAW2_WG64_4_1_WGM2
    SolutionIndex: 216
    SolutionNameMin: Cijk_Ailk_Bjlk_HSS_BH_MT64x32x16_MI16x16x16x1_SE_1LDSB0_AF0EM1_GRVW4_GSU1_NLCA1_NLCB1_SU0_SUS0_SRVW4_TT2_16_VAW2_WG32_8_1_WGM1
    SolutionIndex: 217
    SolutionNameMin: Cijk_Ailk_Bjlk_HSS_BH_MT64x128x16_MI32x32x8x1_SE_1LDSB0_AF0EM1_GRVW8_GSU1_NLCA1_NLCB1_SU16_SUS256_SRVW4_TT1_64_VAW2_WG64_4_1_WGM2
    SolutionIndex: 218
    SolutionNameMin: Cijk_Ailk_Bjlk_HSS_BH_MT64x64x32_MI32x32x8x1_SE_1LDSB0_AF0EM4_GRVW8_GSU1_NLCA1_NLCB1_SU16_SUS256_SRVW4_TT1_32_VAW2_WG64_4_1_WGM15
    SolutionIndex: 219
    SolutionNameMin: Cijk_Ailk_Bjlk_HSS_BH_MT32x32x64_MI16x16x16x1_SE_1LDSB0_AF0EM1_GRVW8_GSU1_NLCA1_NLCB1_SU0_SUS0_SRVW4_TT1_16_VAW2_WG32_8_1_WGM2
    SolutionIndex: 220
    SolutionNameMin: Cijk_Ailk_Bjlk_HSS_BH_MT64x256x16_MI32x32x8x1_SE_1LDSB0_AF0EM1_GRVW8_GSU1_NLCA1_NLCB1_SU0_SUS0_SRVW4_TT1_128_VAW2_WG64_4_1_WGM1
    SolutionIndex: 221
    SolutionNameMin: Cijk_Ailk_Bjlk_HSS_BH_MT128x64x32_MI32x32x8x1_SN_1LDSB0_GRVW8_NLCA1_NLCB1_PLR1_SS1_SU0_SUS0_SRVW0_SVW2_TT2_32_VW2_WG64_4_1
    SolutionIndex: 222
    SolutionNameMin: Cijk_Ailk_Bjlk_HSS_BH_MT128x128x32_MI32x32x8x1_SN_1LDSB0_GRVW8_NLCA1_NLCB1_PLR1_SS1_SU32_SUS256_SRVW0_SVW2_TT2_64_VW2_WG64_4_1
    SolutionIndex: 223
    SolutionNameMin: Cijk_Ailk_Bjlk_HSS_BH_MT256x128x32_MI32x32x8x1_SN_1LDSB1_GRVW8_NLCA1_NLCB1_PLR1_SS1_SU0_SUS0_SRVW0_SVW2_TT4_64_VW2_WG64_4_1
    SolutionIndex: 224
    SolutionNameMin: Cijk_Ailk_Bjlk_HSS_BH_MT256x128x32_MI32x32x8x1_SN_1LDSB1_GRVW8_NLCA1_NLCB1_PLR1_SS1_SU0_SUS0_SRVW0_SVW4_TT4_64_VW4_WG64_4_1
    SolutionIndex: 225
    SolutionNameMin: Cijk_Ailk_Bjlk_HSS_BH_MT256x128x32_MI32x32x8x1_SN_1LDSB1_GRVW8_NLCA1_NLCB1_PLR1_SS1_SU32_SUS128_SRVW0_SVW4_TT4_64_VW4_WG64_4_1
    SolutionIndex: 226
    SolutionNameMin: Cijk_Ailk_Bjlk_HSS_BH_MT256x128x32_MI32x32x8x1_SN_1LDSB1_GRVW8_NLCA1_NLCB1_PLR1_SS1_SU32_SUS256_SRVW0_SVW4_TT4_64_VW4_WG64_4_1
    SolutionIndex: 227
    SolutionNameMin: Cijk_Ailk_Bjlk_HSS_BH_MT256x128x32_MI32x32x8x1_SN_1LDSB1_GRVW8_NLCA1_NLCB1_PLR1_SS1_SU32_SUS256_SRVW0_SVW2_TT4_64_VW2_WG64_4_1
- - - [64, 64, 1, 256]
    - [14, 0.083]
  - - [128, 64, 1, 256]
    - [15, 0.172]
  - - [64, 128, 1, 256]
    - [16, 0.165]
  - - [128, 128, 1, 256]
    - [17, 0.33]
  - - [64, 256, 1, 256]
    - [18, 0.333]
  - - [128, 256, 1, 256]
    - [14, 0.68]
  - - [64, 448, 1, 256]
    - [14, 0.587]
  - - [128, 448, 1, 256]
    - [16, 1.165]
  - - [64, 704, 1, 256]
    - [16, 0.935]
  - - [128, 704, 1, 256]
    - [14, 1.83]
  - - [64, 1024, 1, 256]
    - [14, 1.341]
  - - [128, 1024, 1, 256]
    - [16, 2.589]
  - - [64, 1408, 1, 256]
    - [19, 1.805]
  - - [128, 1408, 1, 256]
    - [14, 3.585]
  - - [64, 1856, 1, 256]
    - [20, 2.447]
  - - [128, 1856, 1, 256]
    - [17, 4.538]
  - - [64, 2368, 1, 256]
    - [14, 3.078]
  - - [128, 2368, 1, 256]
    - [20, 5.828]
  - - [64, 2944, 1, 256]
    - [16, 3.748]
  - - [128, 2944, 1, 256]
    - [17, 6.508]
  - - [64, 3584, 1, 256]
    - [20, 4.411]
  - - [128, 3584, 1, 256]
    - [21, 7.561]
  - - [64, 4288, 1, 256]
    - [20, 5.385]
  - - [128, 4288, 1, 256]
    - [21, 8.995]
  - - [64, 5056, 1, 256]
    - [22, 5.983]
  - - [128, 5056, 1, 256]
    - [21, 10.37]
  - - [64, 5888, 1, 256]
    - [17, 6.548]
  - - [128, 5888, 1, 256]
    - [23, 11.814]
  - - [64, 6784, 1, 256]
    - [21, 7.197]
  - - [128, 6784, 1, 256]
    - [23, 13.393]
  - - [64, 64, 1, 1280]
    - [24, 0.252]
  - - [128, 64, 1, 1280]
    - [24, 0.532]
  - - [64, 128, 1, 1280]
    - [24, 0.503]
  - - [128, 128, 1, 1280]
    - [24, 0.949]
  - - [64, 256, 1, 1280]
    - [25, 0.964]
  - - [128, 256, 1, 1280]
    - [24, 1.905]
  - - [64, 448, 1, 1280]
    - [24, 1.752]
  - - [128, 448, 1, 1280]
    - [24, 3.269]
  - - [64, 704, 1, 1280]
    - [24, 2.765]
  - - [128, 704, 1, 1280]
    - [24, 5.116]
  - - [64, 1024, 1, 1280]
    - [25, 3.826]
  - - [128, 1024, 1, 1280]
    - [26, 6.751]
  - - [64, 1408, 1, 1280]
    - [27, 5.24]
  - - [128, 1408, 1, 1280]
    - [20, 9.216]
  - - [64, 1856, 1, 1280]
    - [26, 6.118]
  - - [128, 1856, 1, 1280]
    - [21, 10.981]
  - - [64, 2368, 1, 1280]
    - [28, 7.834]
  - - [128, 2368, 1, 1280]
    - [21, 13.921]
  - - [64, 2944, 1, 1280]
    - [28, 9.568]
  - - [128, 2944, 1, 1280]
    - [21, 17.935]
  - - [64, 3584, 1, 1280]
    - [29, 10.468]
  - - [128, 3584, 1, 1280]
    - [21, 19.232]
  - - [64, 4288, 1, 1280]
    - [30, 12.934]
  - - [128, 4288, 1, 1280]
    - [21, 22.297]
  - - [64, 5056, 1, 1280]
    - [21, 15.819]
  - - [128, 5056, 1, 1280]
    - [29, 26.069]
  - - [64, 5888, 1, 1280]
    - [21, 17.143]
  - - [128, 5888, 1, 1280]
    - [21, 30.444]
  - - [64, 6784, 1, 1280]
    - [21, 19.148]
  - - [128, 6784, 1, 1280]
    - [31, 34.785]
  - - [64, 64, 1, 3328]
    - [32, 0.428]
  - - [128, 64, 1, 3328]
    - [33, 0.851]
  - - [64, 128, 1, 3328]
    - [33, 0.844]
  - - [128, 128, 1, 3328]
    - [34, 1.563]
  - - [64, 256, 1, 3328]
    - [35, 1.579]
  - - [128, 256, 1, 3328]
    - [33, 2.925]
  - - [64, 448, 1, 3328]
    - [24, 2.749]
  - - [128, 448, 1, 3328]
    - [36, 5.059]
  - - [64, 704, 1, 3328]
    - [24, 4.354]
  - - [128, 704, 1, 3328]
    - [25, 7.61]
  - - [64, 1024, 1, 3328]
    - [27, 5.662]
  - - [128, 1024, 1, 3328]
    - [26, 10.03]
  - - [64, 1408, 1, 3328]
    - [25, 7.969]
  - - [128, 1408, 1, 3328]
    - [26, 13.707]
  - - [64, 1856, 1, 3328]
    - [36, 9.436]
  - - [128, 1856, 1, 3328]
    - [37, 16.807]
  - - [64, 2368, 1, 3328]
    - [26, 11.888]
  - - [128, 2368, 1, 3328]
    - [38, 21.046]
  - - [64, 2944, 1, 3328]
    - [39, 14.657]
  - - [128, 2944, 1, 3328]
    - [37, 26.069]
  - - [64, 3584, 1, 3328]
    - [38, 16.076]
  - - [128, 3584, 1, 3328]
    - [40, 24.75]
  - - [64, 4288, 1, 3328]
    - [41, 19.788]
  - - [128, 4288, 1, 3328]
    - [42, 29.358]
  - - [64, 5056, 1, 3328]
    - [37, 23.288]
  - - [128, 5056, 1, 3328]
    - [31, 34.177]
  - - [64, 5888, 1, 3328]
    - [37, 25.367]
  - - [128, 5888, 1, 3328]
    - [40, 39.522]
  - - [64, 6784, 1, 3328]
    - [43, 28.865]
  - - [128, 6784, 1, 3328]
    - [44, 45.6]
  - - [256, 64, 1, 256]
    - [19, 0.338]
  - - [448, 64, 1, 256]
    - [16, 0.587]
  - - [704, 64, 1, 256]
    - [20, 0.909]
  - - [1024, 64, 1, 256]
    - [14, 1.313]
  - - [1408, 64, 1, 256]
    - [19, 1.83]
  - - [1856, 64, 1, 256]
    - [20, 2.331]
  - - [2368, 64, 1, 256]
    - [20, 3.035]
  - - [2944, 64, 1, 256]
    - [20, 3.8]
  - - [3584, 64, 1, 256]
    - [28, 4.381]
  - - [4288, 64, 1, 256]
    - [16, 5.173]
  - - [5056, 64, 1, 256]
    - [28, 5.726]
  - - [5888, 64, 1, 256]
    - [17, 6.431]
  - - [6784, 64, 1, 256]
    - [21, 7.239]
  - - [256, 128, 1, 256]
    - [16, 0.69]
  - - [448, 128, 1, 256]
    - [16, 1.157]
  - - [704, 128, 1, 256]
    - [16, 1.818]
  - - [1024, 128, 1, 256]
    - [22, 2.607]
  - - [1408, 128, 1, 256]
    - [17, 3.489]
  - - [1856, 128, 1, 256]
    - [20, 4.538]
  - - [2368, 128, 1, 256]
    - [22, 5.751]
  - - [2944, 128, 1, 256]
    - [17, 6.431]
  - - [3584, 128, 1, 256]
    - [23, 7.351]
  - - [4288, 128, 1, 256]
    - [23, 8.795]
  - - [5056, 128, 1, 256]
    - [21, 10.313]
  - - [5888, 128, 1, 256]
    - [21, 11.879]
  - - [6784, 128, 1, 256]
    - [21, 13.686]
  - - [256, 64, 1, 1280]
    - [24, 0.96]
  - - [448, 64, 1, 1280]
    - [24, 1.73]
  - - [704, 64, 1, 1280]
    - [24, 2.599]
  - - [1024, 64, 1, 1280]
    - [24, 3.78]
  - - [1408, 64, 1, 1280]
    - [24, 5.116]
  - - [1856, 64, 1, 1280]
    - [22, 6.229]
  - - [2368, 64, 1, 1280]
    - [45, 7.806]
  - - [2944, 64, 1, 1280]
    - [45, 9.636]
  - - [3584, 64, 1, 1280]
    - [46, 10.369]
  - - [4288, 64, 1, 1280]
    - [21, 12.726]
  - - [5056, 64, 1, 1280]
    - [21, 15.053]
  - - [5888, 64, 1, 1280]
    - [47, 17.53]
  - - [6784, 64, 1, 1280]
    - [47, 19.941]
  - - [256, 128, 1, 1280]
    - [24, 1.89]
  - - [448, 128, 1, 1280]
    - [24, 3.348]
  - - [704, 128, 1, 1280]
    - [25, 5.057]
  - - [1024, 128, 1, 1280]
    - [16, 6.949]
  - - [1408, 128, 1, 1280]
    - [16, 9.316]
  - - [1856, 128, 1, 1280]
    - [21, 11.196]
  - - [2368, 128, 1, 1280]
    - [21, 14.146]
  - - [2944, 128, 1, 1280]
    - [21, 17.818]
  - - [3584, 128, 1, 1280]
    - [31, 18.531]
  - - [4288, 128, 1, 1280]
    - [21, 21.987]
  - - [5056, 128, 1, 1280]
    - [31, 26.589]
  - - [5888, 128, 1, 1280]
    - [21, 29.696]
  - - [6784, 128, 1, 1280]
    - [30, 33.573]
  - - [256, 64, 1, 3328]
    - [33, 1.587]
  - - [448, 64, 1, 3328]
    - [24, 2.661]
  - - [704, 64, 1, 3328]
    - [27, 4.151]
  - - [1024, 64, 1, 3328]
    - [25, 5.585]
  - - [1408, 64, 1, 3328]
    - [24, 7.662]
  - - [1856, 64, 1, 3328]
    - [45, 9.164]
  - - [2368, 64, 1, 3328]
    - [26, 11.573]
  - - [2944, 64, 1, 3328]
    - [26, 13.989]
  - - [3584, 64, 1, 3328]
    - [43, 15.956]
  - - [4288, 64, 1, 3328]
    - [43, 19.75]
  - - [5056, 64, 1, 3328]
    - [38, 22.763]
  - - [5888, 64, 1, 3328]
    - [38, 24.832]
  - - [6784, 64, 1, 3328]
    - [41, 27.042]
  - - [256, 128, 1, 3328]
    - [34, 3.064]
  - - [448, 128, 1, 3328]
    - [25, 5.132]
  - - [704, 128, 1, 3328]
    - [27, 7.969]
  - - [1024, 128, 1, 3328]
    - [26, 9.969]
  - - [1408, 128, 1, 3328]
    - [39, 13.542]
  - - [1856, 128, 1, 3328]
    - [43, 17.364]
  - - [2368, 128, 1, 3328]
    - [38, 21.898]
  - - [2944, 128, 1, 3328]
    - [41, 27.383]
  - - [3584, 128, 1, 3328]
    - [40, 24.433]
  - - [4288, 128, 1, 3328]
    - [40, 29.316]
  - - [5056, 128, 1, 3328]
    - [40, 34.37]
  - - [5888, 128, 1, 3328]
    - [40, 40.027]
  - - [6784, 128, 1, 3328]
    - [42, 46.38]
  - - [256, 256, 1, 256]
    - [28, 1.36]
  - - [448, 256, 1, 256]
    - [19, 2.281]
  - - [256, 448, 1, 256]
    - [28, 2.297]
  - - [448, 448, 1, 256]
    - [16, 3.938]
  - - [256, 256, 1, 1280]
    - [24, 3.889]
  - - [448, 256, 1, 1280]
    - [16, 6.014]
  - - [256, 448, 1, 1280]
    - [22, 5.993]
  - - [448, 448, 1, 1280]
    - [20, 10.411]
  - - [256, 256, 1, 3328]
    - [36, 5.701]
  - - [448, 256, 1, 3328]
    - [48, 9.43]
  - - [256, 448, 1, 3328]
    - [36, 9.41]
  - - [448, 448, 1, 3328]
    - [45, 15.81]
  - - [512, 16, 1, 512]
    - [16, 0.28]
  - - [512, 32, 1, 512]
    - [22, 0.573]
  - - [1024, 16, 1, 512]
    - [19, 0.546]
  - - [1024, 32, 1, 512]
    - [16, 1.146]
  - - [704, 256, 1, 256]
    - [14, 3.585]
  - - [1024, 256, 1, 256]
    - [20, 4.974]
  - - [1408, 256, 1, 256]
    - [17, 6.08]
  - - [1856, 256, 1, 256]
    - [17, 7.328]
  - - [2368, 256, 1, 256]
    - [49, 9.4]
  - - [2944, 256, 1, 256]
    - [49, 11.814]
  - - [3584, 256, 1, 256]
    - [49, 12.784]
  - - [4288, 256, 1, 256]
    - [49, 15.222]
  - - [5056, 256, 1, 256]
    - [50, 16.741]
  - - [5888, 256, 1, 256]
    - [51, 17.673]
  - - [6784, 256, 1, 256]
    - [51, 20.198]
  - - [704, 448, 1, 256]
    - [20, 5.794]
  - - [1024, 448, 1, 256]
    - [17, 7.27]
  - - [1408, 448, 1, 256]
    - [29, 9.476]
  - - [1856, 448, 1, 256]
    - [49, 12.689]
  - - [2368, 448, 1, 256]
    - [49, 14.926]
  - - [2944, 448, 1, 256]
    - [49, 17.135]
  - - [3584, 448, 1, 256]
    - [21, 16.364]
  - - [4288, 448, 1, 256]
    - [52, 17.931]
  - - [5056, 448, 1, 256]
    - [53, 19.857]
  - - [5888, 448, 1, 256]
    - [50, 20.731]
  - - [6784, 448, 1, 256]
    - [54, 21.072]
  - - [256, 704, 1, 256]
    - [28, 3.585]
  - - [448, 704, 1, 256]
    - [16, 5.869]
  - - [704, 704, 1, 256]
    - [23, 7.727]
  - - [1024, 704, 1, 256]
    - [50, 11.239]
  - - [1408, 704, 1, 256]
    - [23, 13.55]
  - - [1856, 704, 1, 256]
    - [23, 16.749]
  - - [2368, 704, 1, 256]
    - [49, 16.299]
  - - [2944, 704, 1, 256]
    - [55, 18.858]
  - - [3584, 704, 1, 256]
    - [23, 20.328]
  - - [4288, 704, 1, 256]
    - [51, 20.584]
  - - [5056, 704, 1, 256]
    - [23, 22.613]
  - - [5888, 704, 1, 256]
    - [23, 21.937]
  - - [6784, 704, 1, 256]
    - [56, 23.547]
  - - [256, 1024, 1, 256]
    - [17, 5.074]
  - - [448, 1024, 1, 256]
    - [17, 7.27]
  - - [704, 1024, 1, 256]
    - [21, 10.829]
  - - [1024, 1024, 1, 256]
    - [23, 14.067]
  - - [1408, 1024, 1, 256]
    - [51, 16.768]
  - - [1856, 1024, 1, 256]
    - [52, 17.626]
  - - [2368, 1024, 1, 256]
    - [52, 20.877]
  - - [2944, 1024, 1, 256]
    - [23, 20.604]
  - - [3584, 1024, 1, 256]
    - [57, 22.285]
  - - [4288, 1024, 1, 256]
    - [50, 22.535]
  - - [5056, 1024, 1, 256]
    - [58, 24.124]
  - - [5888, 1024, 1, 256]
    - [59, 24.459]
  - - [6784, 1024, 1, 256]
    - [60, 25.459]
  - - [256, 1408, 1, 256]
    - [17, 6.225]
  - - [448, 1408, 1, 256]
    - [21, 10.052]
  - - [704, 1408, 1, 256]
    - [49, 13.679]
  - - [1024, 1408, 1, 256]
    - [51, 16.973]
  - - [1408, 1408, 1, 256]
    - [52, 18.445]
  - - [1856, 1408, 1, 256]
    - [23, 21.172]
  - - [2368, 1408, 1, 256]
    - [54, 21.955]
  - - [2944, 1408, 1, 256]
    - [23, 23.08]
  - - [3584, 1408, 1, 256]
    - [23, 24.421]
  - - [4288, 1408, 1, 256]
    - [23, 24.877]
  - - [5056, 1408, 1, 256]
    - [51, 25.925]
  - - [5888, 1408, 1, 256]
    - [23, 25.991]
  - - [6784, 1408, 1, 256]
    - [59, 26.114]
  - - [256, 1856, 1, 256]
    - [17, 7.613]
  - - [448, 1856, 1, 256]
    - [31, 12.825]
  - - [704, 1856, 1, 256]
    - [61, 17.208]
  - - [1024, 1856, 1, 256]
    - [52, 17.855]
  - - [1408, 1856, 1, 256]
    - [62, 21.659]
  - - [1856, 1856, 1, 256]
    - [23, 22.377]
  - - [2368, 1856, 1, 256]
    - [23, 23.518]
  - - [2944, 1856, 1, 256]
    - [23, 25.215]
  - - [3584, 1856, 1, 256]
    - [23, 25.822]
  - - [4288, 1856, 1, 256]
    - [23, 26.445]
  - - [5056, 1856, 1, 256]
    - [50, 26.931]
  - - [5888, 1856, 1, 256]
    - [23, 27.242]
  - - [6784, 1856, 1, 256]
    - [55, 27.533]
  - - [256, 2368, 1, 256]
    - [21, 9.66]
  - - [448, 2368, 1, 256]
    - [49, 14.64]
  - - [704, 2368, 1, 256]
    - [51, 19.08]
  - - [1024, 2368, 1, 256]
    - [52, 21.129]
  - - [1408, 2368, 1, 256]
    - [61, 22.158]
  - - [1856, 2368, 1, 256]
    - [23, 24.054]
  - - [2368, 2368, 1, 256]
    - [50, 24.997]
  - - [2944, 2368, 1, 256]
    - [23, 26.012]
  - - [3584, 2368, 1, 256]
    - [61, 26.87]
  - - [4288, 2368, 1, 256]
    - [23, 27.499]
  - - [5056, 2368, 1, 256]
    - [50, 27.603]
  - - [5888, 2368, 1, 256]
    - [59, 28.122]
  - - [6784, 2368, 1, 256]
    - [55, 28.287]
  - - [256, 2944, 1, 256]
    - [49, 11.814]
  - - [448, 2944, 1, 256]
    - [49, 17.135]
  - - [704, 2944, 1, 256]
    - [63, 19.098]
  - - [1024, 2944, 1, 256]
    - [23, 21.683]
  - - [1408, 2944, 1, 256]
    - [64, 22.903]
  - - [1856, 2944, 1, 256]
    - [50, 25.175]
  - - [2368, 2944, 1, 256]
    - [50, 26.457]
  - - [2944, 2944, 1, 256]
    - [50, 27.561]
  - - [3584, 2944, 1, 256]
    - [50, 27.818]
  - - [4288, 2944, 1, 256]
    - [50, 28.16]
  - - [5056, 2944, 1, 256]
    - [50, 28.244]
  - - [5888, 2944, 1, 256]
    - [59, 29.619]
  - - [6784, 2944, 1, 256]
    - [59, 29.893]
  - - [256, 3584, 1, 256]
    - [49, 13.365]
  - - [448, 3584, 1, 256]
    - [65, 18.232]
  - - [704, 3584, 1, 256]
    - [52, 21.723]
  - - [1024, 3584, 1, 256]
    - [23, 22.862]
  - - [1408, 3584, 1, 256]
    - [23, 24.544]
  - - [1856, 3584, 1, 256]
    - [50, 26.536]
  - - [2368, 3584, 1, 256]
    - [23, 27.411]
  - - [2944, 3584, 1, 256]
    - [50, 28.656]
  - - [3584, 3584, 1, 256]
    - [23, 28.433]
  - - [4288, 3584, 1, 256]
    - [50, 29.028]
  - - [5056, 3584, 1, 256]
    - [57, 28.971]
  - - [5888, 3584, 1, 256]
    - [59, 29.924]
  - - [6784, 3584, 1, 256]
    - [59, 29.841]
  - - [256, 4288, 1, 256]
    - [49, 15.005]
  - - [448, 4288, 1, 256]
    - [23, 17.816]
  - - [704, 4288, 1, 256]
    - [49, 20.98]
  - - [1024, 4288, 1, 256]
    - [50, 24.169]
  - - [1408, 4288, 1, 256]
    - [50, 25.384]
  - - [1856, 4288, 1, 256]
    - [23, 27.229]
  - - [2368, 4288, 1, 256]
    - [50, 27.945]
  - - [2944, 4288, 1, 256]
    - [50, 28.851]
  - - [3584, 4288, 1, 256]
    - [50, 29.335]
  - - [4288, 4288, 1, 256]
    - [23, 29.365]
  - - [5056, 4288, 1, 256]
    - [23, 29.44]
  - - [5888, 4288, 1, 256]
    - [59, 30.674]
  - - [6784, 4288, 1, 256]
    - [59, 30.733]
  - - [256, 5056, 1, 256]
    - [49, 17.125]
  - - [448, 5056, 1, 256]
    - [52, 20.226]
  - - [704, 5056, 1, 256]
    - [23, 23.07]
  - - [1024, 5056, 1, 256]
    - [52, 25.182]
  - - [1408, 5056, 1, 256]
    - [23, 26.324]
  - - [1856, 5056, 1, 256]
    - [23, 27.931]
  - - [2368, 5056, 1, 256]
    - [50, 28.978]
  - - [2944, 5056, 1, 256]
    - [50, 29.669]
  - - [3584, 5056, 1, 256]
    - [50, 30.037]
  - - [4288, 5056, 1, 256]
    - [50, 29.607]
  - - [5056, 5056, 1, 256]
    - [53, 29.79]
  - - [5888, 5056, 1, 256]
    - [66, 30.786]
  - - [6784, 5056, 1, 256]
    - [59, 30.867]
  - - [256, 5888, 1, 256]
    - [51, 17.818]
  - - [448, 5888, 1, 256]
    - [52, 22.116]
  - - [704, 5888, 1, 256]
    - [50, 22.903]
  - - [1024, 5888, 1, 256]
    - [23, 25.878]
  - - [1408, 5888, 1, 256]
    - [50, 27.484]
  - - [1856, 5888, 1, 256]
    - [50, 28.654]
  - - [2368, 5888, 1, 256]
    - [50, 29.268]
  - - [2944, 5888, 1, 256]
    - [50, 29.992]
  - - [3584, 5888, 1, 256]
    - [59, 30.176]
  - - [4288, 5888, 1, 256]
    - [57, 30.342]
  - - [5056, 5888, 1, 256]
    - [67, 30.191]
  - - [5888, 5888, 1, 256]
    - [59, 31.316]
  - - [6784, 5888, 1, 256]
    - [59, 31.443]
  - - [256, 6784, 1, 256]
    - [51, 19.721]
  - - [448, 6784, 1, 256]
    - [23, 21.538]
  - - [704, 6784, 1, 256]
    - [50, 24.167]
  - - [1024, 6784, 1, 256]
    - [50, 26.751]
  - - [1408, 6784, 1, 256]
    - [50, 27.386]
  - - [1856, 6784, 1, 256]
    - [50, 28.776]
  - - [2368, 6784, 1, 256]
    - [50, 29.931]
  - - [2944, 6784, 1, 256]
    - [50, 30.286]
  - - [3584, 6784, 1, 256]
    - [50, 30.49]
  - - [4288, 6784, 1, 256]
    - [67, 30.655]
  - - [5056, 6784, 1, 256]
    - [57, 30.685]
  - - [5888, 6784, 1, 256]
    - [67, 31.478]
  - - [6784, 6784, 1, 256]
    - [59, 31.233]
  - - [704, 256, 1, 1280]
    - [20, 9.451]
  - - [1024, 256, 1, 1280]
    - [21, 12.729]
  - - [1408, 256, 1, 1280]
    - [21, 17.043]
  - - [1856, 256, 1, 1280]
    - [31, 19.086]
  - - [2368, 256, 1, 1280]
    - [21, 24.352]
  - - [2944, 256, 1, 1280]
    - [21, 30.359]
  - - [3584, 256, 1, 1280]
    - [68, 26.569]
  - - [4288, 256, 1, 1280]
    - [69, 32.176]
  - - [5056, 256, 1, 1280]
    - [70, 35.285]
  - - [5888, 256, 1, 1280]
    - [65, 40.106]
  - - [6784, 256, 1, 1280]
    - [71, 45.127]
  - - [704, 448, 1, 1280]
    - [21, 15.161]
  - - [1024, 448, 1, 1280]
    - [21, 18.956]
  - - [1408, 448, 1, 1280]
    - [30, 25.481]
  - - [1856, 448, 1, 1280]
    - [31, 32.942]
  - - [2368, 448, 1, 1280]
    - [72, 31.544]
  - - [2944, 448, 1, 1280]
    - [73, 36.299]
  - - [3584, 448, 1, 1280]
    - [31, 36.465]
  - - [4288, 448, 1, 1280]
    - [74, 39.747]
  - - [5056, 448, 1, 1280]
    - [55, 44.747]
  - - [5888, 448, 1, 1280]
    - [75, 43.13]
  - - [6784, 448, 1, 1280]
    - [75, 48.377]
  - - [256, 704, 1, 1280]
    - [20, 9.486]
  - - [448, 704, 1, 1280]
    - [21, 15.212]
  - - [704, 704, 1, 1280]
    - [31, 20.134]
  - - [1024, 704, 1, 1280]
    - [31, 29.368]
  - - [1408, 704, 1, 1280]
    - [69, 29.534]
  - - [1856, 704, 1, 1280]
    - [23, 36.306]
  - - [2368, 704, 1, 1280]
    - [21, 38.1]
  - - [2944, 704, 1, 1280]
    - [63, 41.803]
  - - [3584, 704, 1, 1280]
    - [75, 41.302]
  - - [4288, 704, 1, 1280]
    - [75, 47.945]
  - - [5056, 704, 1, 1280]
    - [76, 47.661]
  - - [5888, 704, 1, 1280]
    - [75, 46.448]
  - - [6784, 704, 1, 1280]
    - [75, 52.456]
  - - [256, 1024, 1, 1280]
    - [21, 12.859]
  - - [448, 1024, 1, 1280]
    - [31, 18.795]
  - - [704, 1024, 1, 1280]
    - [21, 28.878]
  - - [1024, 1024, 1, 1280]
    - [77, 30.244]
  - - [1408, 1024, 1, 1280]
    - [78, 38.221]
  - - [1856, 1024, 1, 1280]
    - [79, 39.838]
  - - [2368, 1024, 1, 1280]
    - [53, 47.448]
  - - [2944, 1024, 1, 1280]
    - [80, 48.959]
  - - [3584, 1024, 1, 1280]
    - [57, 48.071]
  - - [4288, 1024, 1, 1280]
    - [81, 50.456]
  - - [5056, 1024, 1, 1280]
    - [75, 56.478]
  - - [5888, 1024, 1, 1280]
    - [82, 53.939]
  - - [6784, 1024, 1, 1280]
    - [83, 60.533]
  - - [256, 1408, 1, 1280]
    - [21, 16.932]
  - - [448, 1408, 1, 1280]
    - [31, 26.065]
  - - [704, 1408, 1, 1280]
    - [69, 29.657]
  - - [1024, 1408, 1, 1280]
    - [51, 39.379]
  - - [1408, 1408, 1, 1280]
    - [55, 39.217]
  - - [1856, 1408, 1, 1280]
    - [84, 45.959]
  - - [2368, 1408, 1, 1280]
    - [75, 52.549]
  - - [2944, 1408, 1, 1280]
    - [85, 50.531]
  - - [3584, 1408, 1, 1280]
    - [75, 55.637]
  - - [4288, 1408, 1, 1280]
    - [83, 52.514]
  - - [5056, 1408, 1, 1280]
    - [86, 59.171]
  - - [5888, 1408, 1, 1280]
    - [75, 56.742]
  - - [6784, 1408, 1, 1280]
    - [83, 57.516]
  - - [256, 1856, 1, 1280]
    - [30, 19.747]
  - - [448, 1856, 1, 1280]
    - [21, 33.495]
  - - [704, 1856, 1, 1280]
    - [87, 36.731]
  - - [1024, 1856, 1, 1280]
    - [56, 38.822]
  - - [1408, 1856, 1, 1280]
    - [55, 50.181]
  - - [1856, 1856, 1, 1280]
    - [78, 49.137]
  - - [2368, 1856, 1, 1280]
    - [75, 48.68]
  - - [2944, 1856, 1, 1280]
    - [83, 48.165]
  - - [3584, 1856, 1, 1280]
    - [75, 56.628]
  - - [4288, 1856, 1, 1280]
    - [86, 55.285]
  - - [5056, 1856, 1, 1280]
    - [82, 56.836]
  - - [5888, 1856, 1, 1280]
    - [75, 55.767]
  - - [6784, 1856, 1, 1280]
    - [88, 59.281]
  - - [256, 2368, 1, 1280]
    - [31, 24.557]
  - - [448, 2368, 1, 1280]
    - [89, 31.675]
  - - [704, 2368, 1, 1280]
    - [78, 43.474]
  - - [1024, 2368, 1, 1280]
    - [53, 47.128]
  - - [1408, 2368, 1, 1280]
    - [75, 52.093]
  - - [1856, 2368, 1, 1280]
    - [75, 48.383]
  - - [2368, 2368, 1, 1280]
    - [90, 49.338]
  - - [2944, 2368, 1, 1280]
    - [75, 59.348]
  - - [3584, 2368, 1, 1280]
    - [75, 58.757]
  - - [4288, 2368, 1, 1280]
    - [75, 58.856]
  - - [5056, 2368, 1, 1280]
    - [75, 59.476]
  - - [5888, 2368, 1, 1280]
    - [75, 61.452]
  - - [6784, 2368, 1, 1280]
    - [82, 59.925]
  - - [256, 2944, 1, 1280]
    - [31, 30.616]
  - - [448, 2944, 1, 1280]
    - [49, 36.79]
  - - [704, 2944, 1, 1280]
    - [56, 42.336]
  - - [1024, 2944, 1, 1280]
    - [75, 47.513]
  - - [1408, 2944, 1, 1280]
    - [91, 48.958]
  - - [1856, 2944, 1, 1280]
    - [82, 48.018]
  - - [2368, 2944, 1, 1280]
    - [75, 59.104]
  - - [2944, 2944, 1, 1280]
    - [75, 60.207]
  - - [3584, 2944, 1, 1280]
    - [75, 61.604]
  - - [4288, 2944, 1, 1280]
    - [88, 58.556]
  - - [5056, 2944, 1, 1280]
    - [86, 58.778]
  - - [5888, 2944, 1, 1280]
    - [75, 62.448]
  - - [6784, 2944, 1, 1280]
    - [82, 61.927]
  - - [256, 3584, 1, 1280]
    - [70, 26.784]
  - - [448, 3584, 1, 1280]
    - [51, 42.801]
  - - [704, 3584, 1, 1280]
    - [92, 44.482]
  - - [1024, 3584, 1, 1280]
    - [67, 48.735]
  - - [1408, 3584, 1, 1280]
    - [86, 54.923]
  - - [1856, 3584, 1, 1280]
    - [75, 57.033]
  - - [2368, 3584, 1, 1280]
    - [75, 59.126]
  - - [2944, 3584, 1, 1280]
    - [93, 62.67]
  - - [3584, 3584, 1, 1280]
    - [93, 59.697]
  - - [4288, 3584, 1, 1280]
    - [75, 60.554]
  - - [5056, 3584, 1, 1280]
    - [86, 59.786]
  - - [5888, 3584, 1, 1280]
    - [82, 65.096]
  - - [6784, 3584, 1, 1280]
    - [82, 64.419]
  - - [256, 4288, 1, 1280]
    - [94, 32.506]
  - - [448, 4288, 1, 1280]
    - [74, 39.52]
  - - [704, 4288, 1, 1280]
    - [75, 48.425]
  - - [1024, 4288, 1, 1280]
    - [95, 52.032]
  - - [1408, 4288, 1, 1280]
    - [86, 51.857]
  - - [1856, 4288, 1, 1280]
    - [75, 55.526]
  - - [2368, 4288, 1, 1280]
    - [75, 59.72]
  - - [2944, 4288, 1, 1280]
    - [88, 58.219]
  - - [3584, 4288, 1, 1280]
    - [75, 61.325]
  - - [4288, 4288, 1, 1280]
    - [75, 60.182]
  - - [5056, 4288, 1, 1280]
    - [88, 62.034]
  - - [5888, 4288, 1, 1280]
    - [55, 62.165]
  - - [6784, 4288, 1, 1280]
    - [75, 62.698]
  - - [256, 5056, 1, 1280]
    - [89, 36.6]
  - - [448, 5056, 1, 1280]
    - [53, 45.18]
  - - [704, 5056, 1, 1280]
    - [51, 50.473]
  - - [1024, 5056, 1, 1280]
    - [75, 56.223]
  - - [1408, 5056, 1, 1280]
    - [86, 59.722]
  - - [1856, 5056, 1, 1280]
    - [75, 55.622]
  - - [2368, 5056, 1, 1280]
    - [75, 60.476]
  - - [2944, 5056, 1, 1280]
    - [75, 59.478]
  - - [3584, 5056, 1, 1280]
    - [53, 60.005]
  - - [4288, 5056, 1, 1280]
    - [88, 62.393]
  - - [5056, 5056, 1, 1280]
    - [88, 62.042]
  - - [5888, 5056, 1, 1280]
    - [75, 63.302]
  - - [6784, 5056, 1, 1280]
    - [82, 64.466]
  - - [256, 5888, 1, 1280]
    - [51, 40.479]
  - - [448, 5888, 1, 1280]
    - [96, 45.722]
  - - [704, 5888, 1, 1280]
    - [75, 46.556]
  - - [1024, 5888, 1, 1280]
    - [83, 52.697]
  - - [1408, 5888, 1, 1280]
    - [86, 57.286]
  - - [1856, 5888, 1, 1280]
    - [75, 55.826]
  - - [2368, 5888, 1, 1280]
    - [82, 62.29]
  - - [2944, 5888, 1, 1280]
    - [82, 63.673]
  - - [3584, 5888, 1, 1280]
    - [82, 65.11]
  - - [4288, 5888, 1, 1280]
    - [75, 61.307]
  - - [5056, 5888, 1, 1280]
    - [86, 63.48]
  - - [5888, 5888, 1, 1280]
    - [82, 65.44]
  - - [6784, 5888, 1, 1280]
    - [97, 64.855]
  - - [256, 6784, 1, 1280]
    - [51, 45.955]
  - - [448, 6784, 1, 1280]
    - [86, 48.537]
  - - [704, 6784, 1, 1280]
    - [75, 52.496]
  - - [1024, 6784, 1, 1280]
    - [75, 58.792]
  - - [1408, 6784, 1, 1280]
    - [86, 55.792]
  - - [1856, 6784, 1, 1280]
    - [53, 57.571]
  - - [2368, 6784, 1, 1280]
    - [82, 59.586]
  - - [2944, 6784, 1, 1280]
    - [83, 61.701]
  - - [3584, 6784, 1, 1280]
    - [93, 63.985]
  - - [4288, 6784, 1, 1280]
    - [86, 62.455]
  - - [5056, 6784, 1, 1280]
    - [82, 64.483]
  - - [5888, 6784, 1, 1280]
    - [88, 64.892]
  - - [6784, 6784, 1, 1280]
    - [97, 65.209]
  - - [704, 256, 1, 3328]
    - [39, 13.904]
  - - [1024, 256, 1, 3328]
    - [43, 19.012]
  - - [1408, 256, 1, 3328]
    - [43, 26.141]
  - - [1856, 256, 1, 3328]
    - [40, 25.782]
  - - [2368, 256, 1, 3328]
    - [98, 32.425]
  - - [2944, 256, 1, 3328]
    - [40, 40.254]
  - - [3584, 256, 1, 3328]
    - [69, 39.049]
  - - [4288, 256, 1, 3328]
    - [68, 47.093]
  - - [5056, 256, 1, 3328]
    - [99, 47.164]
  - - [5888, 256, 1, 3328]
    - [100, 54.871]
  - - [6784, 256, 1, 3328]
    - [100, 62.493]
  - - [704, 448, 1, 3328]
    - [37, 23.417]
  - - [1024, 448, 1, 3328]
    - [42, 25.184]
  - - [1408, 448, 1, 3328]
    - [44, 34.477]
  - - [1856, 448, 1, 3328]
    - [42, 45.249]
  - - [2368, 448, 1, 3328]
    - [89, 45.932]
  - - [2944, 448, 1, 3328]
    - [99, 48.294]
  - - [3584, 448, 1, 3328]
    - [42, 47.33]
  - - [4288, 448, 1, 3328]
    - [74, 54.9]
  - - [5056, 448, 1, 3328]
    - [63, 55.51]
  - - [5888, 448, 1, 3328]
    - [90, 56.777]
  - - [6784, 448, 1, 3328]
    - [101, 64.638]
  - - [256, 704, 1, 3328]
    - [45, 13.679]
  - - [448, 704, 1, 3328]
    - [41, 22.962]
  - - [704, 704, 1, 3328]
    - [42, 27.208]
  - - [1024, 704, 1, 3328]
    - [42, 39.634]
  - - [1408, 704, 1, 3328]
    - [102, 42.72]
  - - [1856, 704, 1, 3328]
    - [103, 48.221]
  - - [2368, 704, 1, 3328]
    - [42, 49.257]
  - - [2944, 704, 1, 3328]
    - [53, 51.912]
  - - [3584, 704, 1, 3328]
    - [104, 54.06]
  - - [4288, 704, 1, 3328]
    - [82, 64.753]
  - - [5056, 704, 1, 3328]
    - [76, 63.013]
  - - [5888, 704, 1, 3328]
    - [86, 58.672]
  - - [6784, 704, 1, 3328]
    - [86, 66.496]
  - - [256, 1024, 1, 3328]
    - [41, 18.939]
  - - [448, 1024, 1, 3328]
    - [31, 25.038]
  - - [704, 1024, 1, 3328]
    - [40, 38.78]
  - - [1024, 1024, 1, 3328]
    - [105, 44.325]
  - - [1408, 1024, 1, 3328]
    - [103, 53.157]
  - - [1856, 1024, 1, 3328]
    - [79, 53.18]
  - - [2368, 1024, 1, 3328]
    - [106, 59.039]
  - - [2944, 1024, 1, 3328]
    - [83, 65.528]
  - - [3584, 1024, 1, 3328]
    - [88, 61.958]
  - - [4288, 1024, 1, 3328]
    - [81, 70.66]
  - - [5056, 1024, 1, 3328]
    - [86, 71.659]
  - - [5888, 1024, 1, 3328]
    - [83, 68.568]
  - - [6784, 1024, 1, 3328]
    - [82, 78.267]
  - - [256, 1408, 1, 3328]
    - [38, 25.792]
  - - [448, 1408, 1, 3328]
    - [42, 34.031]
  - - [704, 1408, 1, 3328]
    - [69, 42.671]
  - - [1024, 1408, 1, 3328]
    - [103, 53.261]
  - - [1408, 1408, 1, 3328]
    - [74, 54.818]
  - - [1856, 1408, 1, 3328]
    - [84, 60.484]
  - - [2368, 1408, 1, 3328]
    - [75, 67.942]
  - - [2944, 1408, 1, 3328]
    - [88, 69.416]
  - - [3584, 1408, 1, 3328]
    - [75, 70.156]
  - - [4288, 1408, 1, 3328]
    - [82, 68.063]
  - - [5056, 1408, 1, 3328]
    - [86, 75.701]
  - - [5888, 1408, 1, 3328]
    - [88, 72.866]
  - - [6784, 1408, 1, 3328]
    - [83, 72.928]
  - - [256, 1856, 1, 3328]
    - [42, 26.046]
  - - [448, 1856, 1, 3328]
    - [21, 44.348]
  - - [704, 1856, 1, 3328]
    - [103, 48.221]
  - - [1024, 1856, 1, 3328]
    - [107, 51.639]
  - - [1408, 1856, 1, 3328]
    - [56, 63.256]
  - - [1856, 1856, 1, 3328]
    - [108, 62.669]
  - - [2368, 1856, 1, 3328]
    - [86, 62.209]
  - - [2944, 1856, 1, 3328]
    - [93, 61.896]
  - - [3584, 1856, 1, 3328]
    - [75, 71.547]
  - - [4288, 1856, 1, 3328]
    - [88, 71.066]
  - - [5056, 1856, 1, 3328]
    - [82, 71.704]
  - - [5888, 1856, 1, 3328]
    - [109, 71.1]
  - - [6784, 1856, 1, 3328]
    - [88, 76.331]
  - - [256, 2368, 1, 3328]
    - [44, 32.658]
  - - [448, 2368, 1, 3328]
    - [89, 45.879]
  - - [704, 2368, 1, 3328]
    - [51, 54.831]
  - - [1024, 2368, 1, 3328]
    - [55, 59.58]
  - - [1408, 2368, 1, 3328]
    - [90, 69.84]
  - - [1856, 2368, 1, 3328]
    - [75, 61.697]
  - - [2368, 2368, 1, 3328]
    - [83, 63.597]
  - - [2944, 2368, 1, 3328]
    - [75, 74.62]
  - - [3584, 2368, 1, 3328]
    - [88, 74.35]
  - - [4288, 2368, 1, 3328]
    - [86, 73.627]
  - - [5056, 2368, 1, 3328]
    - [86, 75.183]
  - - [5888, 2368, 1, 3328]
    - [75, 76.7]
  - - [6784, 2368, 1, 3328]
    - [82, 74.695]
  - - [256, 2944, 1, 3328]
    - [40, 41.014]
  - - [448, 2944, 1, 3328]
    - [103, 48.722]
  - - [704, 2944, 1, 3328]
    - [56, 52.086]
  - - [1024, 2944, 1, 3328]
    - [110, 64.042]
  - - [1408, 2944, 1, 3328]
    - [111, 68.108]
  - - [1856, 2944, 1, 3328]
    - [93, 61.84]
  - - [2368, 2944, 1, 3328]
    - [75, 74.577]
  - - [2944, 2944, 1, 3328]
    - [86, 75.278]
  - - [3584, 2944, 1, 3328]
    - [110, 78.325]
  - - [4288, 2944, 1, 3328]
    - [88, 75.396]
  - - [5056, 2944, 1, 3328]
    - [86, 73.844]
  - - [5888, 2944, 1, 3328]
    - [110, 78.544]
  - - [6784, 2944, 1, 3328]
    - [93, 77.473]
  - - [256, 3584, 1, 3328]
    - [69, 38.96]
  - - [448, 3584, 1, 3328]
    - [65, 53.089]
  - - [704, 3584, 1, 3328]
    - [83, 54.122]
  - - [1024, 3584, 1, 3328]
    - [112, 65.715]
  - - [1408, 3584, 1, 3328]
    - [75, 70.417]
  - - [1856, 3584, 1, 3328]
    - [82, 73.879]
  - - [2368, 3584, 1, 3328]
    - [86, 74.09]
  - - [2944, 3584, 1, 3328]
    - [83, 80.232]
  - - [3584, 3584, 1, 3328]
    - [88, 76.267]
  - - [4288, 3584, 1, 3328]
    - [86, 76.151]
  - - [5056, 3584, 1, 3328]
    - [86, 73.764]
  - - [5888, 3584, 1, 3328]
    - [93, 81.765]
  - - [6784, 3584, 1, 3328]
    - [82, 80.799]
  - - [256, 4288, 1, 3328]
    - [69, 46.04]
  - - [448, 4288, 1, 3328]
    - [107, 52.157]
  - - [704, 4288, 1, 3328]
    - [82, 63.876]
  - - [1024, 4288, 1, 3328]
    - [88, 72.052]
  - - [1408, 4288, 1, 3328]
    - [83, 66.798]
  - - [1856, 4288, 1, 3328]
    - [85, 70.44]
  - - [2368, 4288, 1, 3328]
    - [93, 76.389]
  - - [2944, 4288, 1, 3328]
    - [88, 75.336]
  - - [3584, 4288, 1, 3328]
    - [75, 76.1]
  - - [4288, 4288, 1, 3328]
    - [86, 74.791]
  - - [5056, 4288, 1, 3328]
    - [88, 79.014]
  - - [5888, 4288, 1, 3328]
    - [88, 77.64]
  - - [6784, 4288, 1, 3328]
    - [75, 77.209]
  - - [256, 5056, 1, 3328]
    - [69, 54.225]
  - - [448, 5056, 1, 3328]
    - [56, 55.801]
  - - [704, 5056, 1, 3328]
    - [113, 64.319]
  - - [1024, 5056, 1, 3328]
    - [75, 72.139]
  - - [1408, 5056, 1, 3328]
    - [82, 77.458]
  - - [1856, 5056, 1, 3328]
    - [83, 71.442]
  - - [2368, 5056, 1, 3328]
    - [86, 75.881]
  - - [2944, 5056, 1, 3328]
    - [75, 74.197]
  - - [3584, 5056, 1, 3328]
    - [75, 73.948]
  - - [4288, 5056, 1, 3328]
    - [88, 79.245]
  - - [5056, 5056, 1, 3328]
    - [88, 78.449]
  - - [5888, 5056, 1, 3328]
    - [88, 78.835]
  - - [6784, 5056, 1, 3328]
    - [93, 80.105]
  - - [256, 5888, 1, 3328]
    - [100, 54.659]
  - - [448, 5888, 1, 3328]
    - [101, 56.388]
  - - [704, 5888, 1, 3328]
    - [75, 58.872]
  - - [1024, 5888, 1, 3328]
    - [83, 68.114]
  - - [1408, 5888, 1, 3328]
    - [75, 72.156]
  - - [1856, 5888, 1, 3328]
    - [113, 69.615]
  - - [2368, 5888, 1, 3328]
    - [82, 79.705]
  - - [2944, 5888, 1, 3328]
    - [82, 80.172]
  - - [3584, 5888, 1, 3328]
    - [93, 81.583]
  - - [4288, 5888, 1, 3328]
    - [88, 77.027]
  - - [5056, 5888, 1, 3328]
    - [86, 78.824]
  - - [5888, 5888, 1, 3328]
    - [93, 81.198]
  - - [6784, 5888, 1, 3328]
    - [81, 79.177]
  - - [256, 6784, 1, 3328]
    - [100, 62.254]
  - - [448, 6784, 1, 3328]
    - [83, 64.092]
  - - [704, 6784, 1, 3328]
    - [75, 68.193]
  - - [1024, 6784, 1, 3328]
    - [104, 76.228]
  - - [1408, 6784, 1, 3328]
    - [104, 72.295]
  - - [1856, 6784, 1, 3328]
    - [111, 74.265]
  - - [2368, 6784, 1, 3328]
    - [82, 74.704]
  - - [2944, 6784, 1, 3328]
    - [82, 77.313]
  - - [3584, 6784, 1, 3328]
    - [82, 80.684]
  - - [4288, 6784, 1, 3328]
    - [86, 77.4]
  - - [5056, 6784, 1, 3328]
    - [82, 80.355]
  - - [5888, 6784, 1, 3328]
    - [88, 81.495]
  - - [6784, 6784, 1, 3328]
    - [86, 79.886]
  - - [1024, 1024, 1, 1024]
    - [221, 25.63]
  - - [1760, 7133, 1, 1760]
    - [88, 65.909]
  - - [2048, 7133, 1, 2048]
    - [53, 65.426]
  - - [2560, 7133, 1, 2560]
    - [75, 69.731]
  - - [3072, 7435, 1, 1024]
    - [75, 57.61]
  - - [4096, 7133, 1, 4096]
    - [88, 80.394]
  - - [7680, 5481, 1, 2560]
    - [114, 77.218]
  - - [32, 32, 1, 32]
    - [18, 0.004]
  - - [32, 64, 1, 256]
    - [16, 0.042]
  - - [32, 128, 1, 256]
    - [14, 0.084]
  - - [32, 256, 1, 256]
    - [16, 0.168]
  - - [32, 448, 1, 256]
    - [16, 0.293]
  - - [32, 704, 1, 256]
    - [16, 0.464]
  - - [32, 1024, 1, 256]
    - [16, 0.685]
  - - [32, 1408, 1, 256]
    - [16, 0.935]
  - - [32, 1856, 1, 256]
    - [14, 1.224]
  - - [32, 2368, 1, 256]
    - [16, 1.561]
  - - [32, 2944, 1, 256]
    - [16, 1.914]
  - - [32, 3584, 1, 256]
    - [16, 2.281]
  - - [32, 4288, 1, 256]
    - [16, 2.748]
  - - [32, 5056, 1, 256]
    - [16, 3.218]
  - - [32, 5888, 1, 256]
    - [16, 3.697]
  - - [32, 6784, 1, 256]
    - [16, 4.092]
  - - [32, 64, 1, 1280]
    - [24, 0.129]
  - - [32, 128, 1, 1280]
    - [24, 0.227]
  - - [32, 256, 1, 1280]
    - [24, 0.488]
  - - [32, 448, 1, 1280]
    - [24, 0.911]
  - - [32, 704, 1, 1280]
    - [24, 1.394]
  - - [32, 1024, 1, 1280]
    - [24, 1.945]
  - - [32, 1408, 1, 1280]
    - [24, 2.589]
  - - [32, 1856, 1, 1280]
    - [24, 3.629]
  - - [32, 2368, 1, 1280]
    - [24, 4.67]
  - - [32, 2944, 1, 1280]
    - [24, 5.391]
  - - [32, 3584, 1, 1280]
    - [22, 5.928]
  - - [32, 4288, 1, 1280]
    - [20, 7.017]
  - - [32, 5056, 1, 1280]
    - [20, 8.245]
  - - [32, 5888, 1, 1280]
    - [39, 9.305]
  - - [32, 6784, 1, 1280]
    - [16, 10.577]
  - - [32, 64, 1, 3328]
    - [115, 0.224]
  - - [32, 128, 1, 3328]
    - [35, 0.438]
  - - [32, 256, 1, 3328]
    - [35, 0.849]
  - - [32, 448, 1, 3328]
    - [35, 1.473]
  - - [32, 704, 1, 3328]
    - [35, 2.177]
  - - [32, 1024, 1, 3328]
    - [32, 3.004]
  - - [32, 1408, 1, 3328]
    - [24, 3.822]
  - - [32, 1856, 1, 3328]
    - [15, 5.581]
  - - [32, 2368, 1, 3328]
    - [24, 7.193]
  - - [32, 2944, 1, 3328]
    - [24, 8.028]
  - - [32, 3584, 1, 3328]
    - [26, 8.758]
  - - [32, 4288, 1, 3328]
    - [39, 10.719]
  - - [32, 5056, 1, 3328]
    - [39, 12.665]
  - - [32, 5888, 1, 3328]
    - [26, 14.017]
  - - [32, 6784, 1, 3328]
    - [26, 15.805]
  - - [64, 32, 1, 256]
    - [116, 0.041]
  - - [128, 32, 1, 256]
    - [19, 0.083]
  - - [256, 32, 1, 256]
    - [16, 0.17]
  - - [448, 32, 1, 256]
    - [14, 0.297]
  - - [704, 32, 1, 256]
    - [14, 0.458]
  - - [1024, 32, 1, 256]
    - [19, 0.67]
  - - [1408, 32, 1, 256]
    - [116, 0.909]
  - - [1856, 32, 1, 256]
    - [19, 1.224]
  - - [2368, 32, 1, 256]
    - [22, 1.595]
  - - [2944, 32, 1, 256]
    - [22, 1.887]
  - - [3584, 32, 1, 256]
    - [16, 2.33]
  - - [4288, 32, 1, 256]
    - [117, 2.692]
  - - [5056, 32, 1, 256]
    - [22, 3.175]
  - - [5888, 32, 1, 256]
    - [20, 3.672]
  - - [6784, 32, 1, 256]
    - [16, 4.348]
  - - [64, 32, 1, 1280]
    - [24, 0.121]
  - - [128, 32, 1, 1280]
    - [24, 0.229]
  - - [256, 32, 1, 1280]
    - [24, 0.469]
  - - [448, 32, 1, 1280]
    - [24, 0.858]
  - - [704, 32, 1, 1280]
    - [24, 1.342]
  - - [1024, 32, 1, 1280]
    - [24, 1.883]
  - - [1408, 32, 1, 1280]
    - [24, 2.538]
  - - [1856, 32, 1, 1280]
    - [24, 3.554]
  - - [2368, 32, 1, 1280]
    - [24, 4.354]
  - - [2944, 32, 1, 1280]
    - [15, 5.37]
  - - [3584, 32, 1, 1280]
    - [16, 5.907]
  - - [4288, 32, 1, 1280]
    - [20, 6.943]
  - - [5056, 32, 1, 1280]
    - [16, 8.245]
  - - [5888, 32, 1, 1280]
    - [45, 9.601]
  - - [6784, 32, 1, 1280]
    - [45, 10.577]
  - - [64, 32, 1, 3328]
    - [35, 0.218]
  - - [128, 32, 1, 3328]
    - [35, 0.435]
  - - [256, 32, 1, 3328]
    - [118, 0.839]
  - - [448, 32, 1, 3328]
    - [119, 1.389]
  - - [704, 32, 1, 3328]
    - [24, 2.155]
  - - [1024, 32, 1, 3328]
    - [34, 2.844]
  - - [1408, 32, 1, 3328]
    - [36, 3.893]
  - - [1856, 32, 1, 3328]
    - [27, 5.315]
  - - [2368, 32, 1, 3328]
    - [27, 6.654]
  - - [2944, 32, 1, 3328]
    - [24, 7.815]
  - - [3584, 32, 1, 3328]
    - [45, 8.848]
  - - [4288, 32, 1, 3328]
    - [45, 10.674]
  - - [5056, 32, 1, 3328]
    - [45, 12.56]
  - - [5888, 32, 1, 3328]
    - [45, 14.272]
  - - [6784, 32, 1, 3328]
    - [45, 16.247]
  - - [64, 64, 1, 32]
    - [120, 0.014]
  - - [128, 64, 1, 32]
    - [121, 0.031]
  - - [256, 64, 1, 32]
    - [122, 0.062]
  - - [448, 64, 1, 32]
    - [18, 0.103]
  - - [704, 64, 1, 32]
    - [18, 0.166]
  - - [1024, 64, 1, 32]
    - [17, 0.244]
  - - [1408, 64, 1, 32]
    - [123, 0.319]
  - - [1856, 64, 1, 32]
    - [124, 0.412]
  - - [2368, 64, 1, 32]
    - [125, 0.515]
  - - [2944, 64, 1, 32]
    - [126, 0.635]
  - - [3584, 64, 1, 32]
    - [17, 0.773]
  - - [4288, 64, 1, 32]
    - [117, 0.883]
  - - [5056, 64, 1, 32]
    - [17, 1.08]
  - - [5888, 64, 1, 32]
    - [17, 1.161]
  - - [6784, 64, 1, 32]
    - [127, 1.338]
  - - [64, 128, 1, 32]
    - [128, 0.03]
  - - [128, 128, 1, 32]
    - [125, 0.063]
  - - [256, 128, 1, 32]
    - [116, 0.119]
  - - [448, 128, 1, 32]
    - [18, 0.213]
  - - [704, 128, 1, 32]
    - [18, 0.315]
  - - [1024, 128, 1, 32]
    - [129, 0.446]
  - - [1408, 128, 1, 32]
    - [124, 0.602]
  - - [1856, 128, 1, 32]
    - [18, 0.779]
  - - [2368, 128, 1, 32]
    - [18, 0.967]
  - - [2944, 128, 1, 32]
    - [129, 1.181]
  - - [3584, 128, 1, 32]
    - [122, 1.367]
  - - [4288, 128, 1, 32]
    - [130, 1.635]
  - - [5056, 128, 1, 32]
    - [131, 1.867]
  - - [5888, 128, 1, 32]
    - [132, 2.013]
  - - [6784, 128, 1, 32]
    - [132, 2.427]
  - - [64, 256, 1, 32]
    - [116, 0.06]
  - - [128, 256, 1, 32]
    - [116, 0.119]
  - - [256, 256, 1, 32]
    - [17, 0.249]
  - - [448, 256, 1, 32]
    - [129, 0.394]
  - - [704, 256, 1, 32]
    - [133, 0.625]
  - - [1024, 256, 1, 32]
    - [17, 0.844]
  - - [1408, 256, 1, 32]
    - [130, 1.13]
  - - [1856, 256, 1, 32]
    - [17, 1.416]
  - - [2368, 256, 1, 32]
    - [134, 1.763]
  - - [2944, 256, 1, 32]
    - [131, 2.074]
  - - [3584, 256, 1, 32]
    - [135, 2.363]
  - - [4288, 256, 1, 32]
    - [129, 2.604]
  - - [5056, 256, 1, 32]
    - [131, 2.972]
  - - [5888, 256, 1, 32]
    - [132, 3.235]
  - - [6784, 256, 1, 32]
    - [132, 3.578]
  - - [64, 448, 1, 32]
    - [125, 0.108]
  - - [128, 448, 1, 32]
    - [116, 0.213]
  - - [256, 448, 1, 32]
    - [124, 0.398]
  - - [448, 448, 1, 32]
    - [17, 0.646]
  - - [704, 448, 1, 32]
    - [17, 0.98]
  - - [1024, 448, 1, 32]
    - [17, 1.356]
  - - [1408, 448, 1, 32]
    - [136, 1.866]
  - - [1856, 448, 1, 32]
    - [132, 2.237]
  - - [2368, 448, 1, 32]
    - [137, 2.652]
  - - [2944, 448, 1, 32]
    - [132, 2.935]
  - - [3584, 448, 1, 32]
    - [132, 3.366]
  - - [4288, 448, 1, 32]
    - [138, 3.626]
  - - [5056, 448, 1, 32]
    - [131, 4.043]
  - - [5888, 448, 1, 32]
    - [136, 4.171]
  - - [6784, 448, 1, 32]
    - [139, 4.509]
  - - [64, 704, 1, 32]
    - [117, 0.166]
  - - [128, 704, 1, 32]
    - [134, 0.315]
  - - [256, 704, 1, 32]
    - [17, 0.607]
  - - [448, 704, 1, 32]
    - [130, 0.989]
  - - [704, 704, 1, 32]
    - [17, 1.489]
  - - [1024, 704, 1, 32]
    - [131, 1.984]
  - - [1408, 704, 1, 32]
    - [17, 2.448]
  - - [1856, 704, 1, 32]
    - [132, 2.963]
  - - [2368, 704, 1, 32]
    - [131, 3.396]
  - - [2944, 704, 1, 32]
    - [132, 3.812]
  - - [3584, 704, 1, 32]
    - [131, 4.154]
  - - [4288, 704, 1, 32]
    - [131, 4.573]
  - - [5056, 704, 1, 32]
    - [139, 4.806]
  - - [5888, 704, 1, 32]
    - [131, 5.066]
  - - [6784, 704, 1, 32]
    - [136, 5.298]
  - - [64, 1024, 1, 32]
    - [120, 0.246]
  - - [128, 1024, 1, 32]
    - [129, 0.459]
  - - [256, 1024, 1, 32]
    - [17, 0.829]
  - - [448, 1024, 1, 32]
    - [17, 1.39]
  - - [704, 1024, 1, 32]
    - [132, 1.984]
  - - [1024, 1024, 1, 32]
    - [132, 2.589]
  - - [1408, 1024, 1, 32]
    - [131, 3.131]
  - - [1856, 1024, 1, 32]
    - [135, 3.587]
  - - [2368, 1024, 1, 32]
    - [132, 4.244]
  - - [2944, 1024, 1, 32]
    - [131, 4.51]
  - - [3584, 1024, 1, 32]
    - [131, 4.901]
  - - [4288, 1024, 1, 32]
    - [140, 5.173]
  - - [5056, 1024, 1, 32]
    - [132, 5.41]
  - - [5888, 1024, 1, 32]
    - [131, 5.602]
  - - [6784, 1024, 1, 32]
    - [131, 5.771]
  - - [64, 1408, 1, 32]
    - [129, 0.315]
  - - [128, 1408, 1, 32]
    - [124, 0.575]
  - - [256, 1408, 1, 32]
    - [134, 1.111]
  - - [448, 1408, 1, 32]
    - [130, 1.763]
  - - [704, 1408, 1, 32]
    - [129, 2.482]
  - - [1024, 1408, 1, 32]
    - [129, 3.15]
  - - [1408, 1408, 1, 32]
    - [129, 3.742]
  - - [1856, 1408, 1, 32]
    - [132, 4.225]
  - - [2368, 1408, 1, 32]
    - [134, 4.677]
  - - [2944, 1408, 1, 32]
    - [131, 5.207]
  - - [3584, 1408, 1, 32]
    - [131, 5.431]
  - - [4288, 1408, 1, 32]
    - [139, 5.743]
  - - [5056, 1408, 1, 32]
    - [131, 5.969]
  - - [5888, 1408, 1, 32]
    - [132, 6.175]
  - - [6784, 1408, 1, 32]
    - [132, 6.284]
  - - [64, 1856, 1, 32]
    - [124, 0.412]
  - - [128, 1856, 1, 32]
    - [17, 0.745]
  - - [256, 1856, 1, 32]
    - [17, 1.404]
  - - [448, 1856, 1, 32]
    - [132, 2.221]
  - - [704, 1856, 1, 32]
    - [132, 2.926]
  - - [1024, 1856, 1, 32]
    - [141, 3.606]
  - - [1408, 1856, 1, 32]
    - [132, 4.322]
  - - [1856, 1856, 1, 32]
    - [132, 4.814]
  - - [2368, 1856, 1, 32]
    - [131, 5.264]
  - - [2944, 1856, 1, 32]
    - [132, 5.457]
  - - [3584, 1856, 1, 32]
    - [131, 5.907]
  - - [4288, 1856, 1, 32]
    - [132, 6.184]
  - - [5056, 1856, 1, 32]
    - [131, 6.469]
  - - [5888, 1856, 1, 32]
    - [131, 6.448]
  - - [6784, 1856, 1, 32]
    - [132, 6.637]
  - - [64, 2368, 1, 32]
    - [124, 0.515]
  - - [128, 2368, 1, 32]
    - [142, 0.942]
  - - [256, 2368, 1, 32]
    - [130, 1.777]
  - - [448, 2368, 1, 32]
    - [131, 2.638]
  - - [704, 2368, 1, 32]
    - [131, 3.454]
  - - [1024, 2368, 1, 32]
    - [136, 4.085]
  - - [1408, 2368, 1, 32]
    - [136, 4.789]
  - - [1856, 2368, 1, 32]
    - [132, 5.371]
  - - [2368, 2368, 1, 32]
    - [139, 5.524]
  - - [2944, 2368, 1, 32]
    - [132, 5.999]
  - - [3584, 2368, 1, 32]
    - [132, 6.244]
  - - [4288, 2368, 1, 32]
    - [139, 6.502]
  - - [5056, 2368, 1, 32]
    - [132, 6.661]
  - - [5888, 2368, 1, 32]
    - [131, 6.811]
  - - [6784, 2368, 1, 32]
    - [136, 6.806]
  - - [64, 2944, 1, 32]
    - [17, 0.618]
  - - [128, 2944, 1, 32]
    - [17, 1.181]
  - - [256, 2944, 1, 32]
    - [132, 2.074]
  - - [448, 2944, 1, 32]
    - [134, 2.935]
  - - [704, 2944, 1, 32]
    - [136, 3.852]
  - - [1024, 2944, 1, 32]
    - [139, 4.436]
  - - [1408, 2944, 1, 32]
    - [132, 5.101]
  - - [1856, 2944, 1, 32]
    - [132, 5.694]
  - - [2368, 2944, 1, 32]
    - [136, 5.942]
  - - [2944, 2944, 1, 32]
    - [131, 6.25]
  - - [3584, 2944, 1, 32]
    - [136, 6.393]
  - - [4288, 2944, 1, 32]
    - [132, 6.713]
  - - [5056, 2944, 1, 32]
    - [132, 6.889]
  - - [5888, 2944, 1, 32]
    - [132, 6.936]
  - - [6784, 2944, 1, 32]
    - [132, 6.964]
  - - [64, 3584, 1, 32]
    - [17, 0.701]
  - - [128, 3584, 1, 32]
    - [17, 1.323]
  - - [256, 3584, 1, 32]
    - [17, 2.363]
  - - [448, 3584, 1, 32]
    - [129, 3.308]
  - - [704, 3584, 1, 32]
    - [132, 4.332]
  - - [1024, 3584, 1, 32]
    - [136, 4.865]
  - - [1408, 3584, 1, 32]
    - [140, 5.431]
  - - [1856, 3584, 1, 32]
    - [131, 5.981]
  - - [2368, 3584, 1, 32]
    - [136, 6.27]
  - - [2944, 3584, 1, 32]
    - [132, 6.536]
  - - [3584, 3584, 1, 32]
    - [139, 6.663]
  - - [4288, 3584, 1, 32]
    - [132, 6.866]
  - - [5056, 3584, 1, 32]
    - [132, 7.101]
  - - [5888, 3584, 1, 32]
    - [132, 7.051]
  - - [6784, 3584, 1, 32]
    - [132, 7.069]
  - - [64, 4288, 1, 32]
    - [49, 0.846]
  - - [128, 4288, 1, 32]
    - [132, 1.546]
  - - [256, 4288, 1, 32]
    - [130, 2.553]
  - - [448, 4288, 1, 32]
    - [132, 3.785]
  - - [704, 4288, 1, 32]
    - [136, 4.497]
  - - [1024, 4288, 1, 32]
    - [138, 5.107]
  - - [1408, 4288, 1, 32]
    - [131, 5.789]
  - - [1856, 4288, 1, 32]
    - [131, 6.197]
  - - [2368, 4288, 1, 32]
    - [132, 6.572]
  - - [2944, 4288, 1, 32]
    - [139, 6.625]
  - - [3584, 4288, 1, 32]
    - [131, 6.857]
  - - [4288, 4288, 1, 32]
    - [132, 7.136]
  - - [5056, 4288, 1, 32]
    - [132, 7.204]
  - - [5888, 4288, 1, 32]
    - [132, 7.179]
  - - [6784, 4288, 1, 32]
    - [132, 7.169]
  - - [64, 5056, 1, 32]
    - [125, 1.032]
  - - [128, 5056, 1, 32]
    - [130, 1.867]
  - - [256, 5056, 1, 32]
    - [130, 3.03]
  - - [448, 5056, 1, 32]
    - [132, 4.063]
  - - [704, 5056, 1, 32]
    - [136, 4.898]
  - - [1024, 5056, 1, 32]
    - [132, 5.303]
  - - [1408, 5056, 1, 32]
    - [131, 6.039]
  - - [1856, 5056, 1, 32]
    - [132, 6.557]
  - - [2368, 5056, 1, 32]
    - [139, 6.724]
  - - [2944, 5056, 1, 32]
    - [131, 6.862]
  - - [3584, 5056, 1, 32]
    - [132, 7.017]
  - - [4288, 5056, 1, 32]
    - [132, 7.244]
  - - [5056, 5056, 1, 32]
    - [139, 7.344]
  - - [5888, 5056, 1, 32]
    - [132, 7.291]
  - - [6784, 5056, 1, 32]
    - [139, 7.249]
  - - [64, 5888, 1, 32]
    - [17, 1.161]
  - - [128, 5888, 1, 32]
    - [132, 2.074]
  - - [256, 5888, 1, 32]
    - [134, 3.254]
  - - [448, 5888, 1, 32]
    - [132, 4.303]
  - - [704, 5888, 1, 32]
    - [132, 5.244]
  - - [1024, 5888, 1, 32]
    - [136, 5.617]
  - - [1408, 5888, 1, 32]
    - [139, 6.201]
  - - [1856, 5888, 1, 32]
    - [131, 6.545]
  - - [2368, 5888, 1, 32]
    - [131, 6.905]
  - - [2944, 5888, 1, 32]
    - [131, 7.006]
  - - [3584, 5888, 1, 32]
    - [132, 7.097]
  - - [4288, 5888, 1, 32]
    - [132, 7.236]
  - - [5056, 5888, 1, 32]
    - [139, 7.412]
  - - [5888, 5888, 1, 32]
    - [132, 7.28]
  - - [6784, 5888, 1, 32]
    - [132, 7.288]
  - - [64, 6784, 1, 32]
    - [17, 1.338]
  - - [128, 6784, 1, 32]
    - [132, 2.302]
  - - [256, 6784, 1, 32]
    - [130, 3.498]
  - - [448, 6784, 1, 32]
    - [132, 4.585]
  - - [704, 6784, 1, 32]
    - [131, 5.364]
  - - [1024, 6784, 1, 32]
    - [131, 5.879]
  - - [1408, 6784, 1, 32]
    - [132, 6.366]
  - - [1856, 6784, 1, 32]
    - [132, 6.755]
  - - [2368, 6784, 1, 32]
    - [139, 6.97]
  - - [2944, 6784, 1, 32]
    - [136, 7.059]
  - - [3584, 6784, 1, 32]
    - [139, 7.191]
  - - [4288, 6784, 1, 32]
    - [139, 7.37]
  - - [5056, 6784, 1, 32]
    - [132, 7.396]
  - - [5888, 6784, 1, 32]
    - [132, 7.366]
  - - [6784, 6784, 1, 32]
    - [132, 7.335]
  - - [32, 32, 1, 256]
    - [14, 0.02]
  - - [32, 32, 1, 1280]
    - [24, 0.063]
  - - [32, 32, 1, 3328]
    - [115, 0.111]
  - - [32, 64, 1, 32]
    - [18, 0.007]
  - - [32, 128, 1, 32]
    - [125, 0.015]
  - - [32, 256, 1, 32]
    - [125, 0.031]
  - - [32, 448, 1, 32]
    - [122, 0.054]
  - - [32, 704, 1, 32]
    - [18, 0.084]
  - - [32, 1024, 1, 32]
    - [17, 0.128]
  - - [32, 1408, 1, 32]
    - [120, 0.166]
  - - [32, 1856, 1, 32]
    - [127, 0.214]
  - - [32, 2368, 1, 32]
    - [18, 0.271]
  - - [32, 2944, 1, 32]
    - [124, 0.336]
  - - [32, 3584, 1, 32]
    - [124, 0.405]
  - - [32, 4288, 1, 32]
    - [130, 0.476]
  - - [32, 5056, 1, 32]
    - [124, 0.53]
  - - [32, 5888, 1, 32]
    - [17, 0.606]
  - - [32, 6784, 1, 32]
    - [17, 0.693]
  - - [64, 32, 1, 32]
    - [116, 0.007]
  - - [128, 32, 1, 32]
    - [122, 0.015]
  - - [256, 32, 1, 32]
    - [143, 0.033]
  - - [448, 32, 1, 32]
    - [144, 0.053]
  - - [704, 32, 1, 32]
    - [127, 0.083]
  - - [1024, 32, 1, 32]
    - [116, 0.121]
  - - [1408, 32, 1, 32]
    - [125, 0.167]
  - - [1856, 32, 1, 32]
    - [17, 0.214]
  - - [2368, 32, 1, 32]
    - [17, 0.268]
  - - [2944, 32, 1, 32]
    - [129, 0.323]
  - - [3584, 32, 1, 32]
    - [129, 0.386]
  - - [4288, 32, 1, 32]
    - [129, 0.458]
  - - [5056, 32, 1, 32]
    - [129, 0.516]
  - - [5888, 32, 1, 32]
    - [17, 0.596]
  - - [6784, 32, 1, 32]
    - [17, 0.675]
  - - [1, 1, 1, 1]
    - [2, 0.0]
  - - [1, 64, 1, 256]
    - [7, 0.001]
  - - [1, 128, 1, 256]
    - [2, 0.003]
  - - [1, 256, 1, 256]
    - [6, 0.006]
  - - [1, 448, 1, 256]
    - [6, 0.009]
  - - [1, 704, 1, 256]
    - [7, 0.015]
  - - [1, 1024, 1, 256]
    - [7, 0.021]
  - - [1, 1408, 1, 256]
    - [6, 0.027]
  - - [1, 1856, 1, 256]
    - [7, 0.036]
  - - [1, 2368, 1, 256]
    - [7, 0.048]
  - - [1, 2944, 1, 256]
    - [7, 0.06]
  - - [1, 3584, 1, 256]
    - [7, 0.072]
  - - [1, 4288, 1, 256]
    - [7, 0.084]
  - - [1, 5056, 1, 256]
    - [7, 0.099]
  - - [1, 5888, 1, 256]
    - [9, 0.111]
  - - [1, 6784, 1, 256]
    - [9, 0.156]
  - - [1, 64, 1, 1280]
    - [7, 0.003]
  - - [1, 128, 1, 1280]
    - [1, 0.003]
  - - [1, 256, 1, 1280]
    - [2, 0.006]
  - - [1, 448, 1, 1280]
    - [7, 0.012]
  - - [1, 704, 1, 1280]
    - [11, 0.021]
  - - [1, 1024, 1, 1280]
    - [11, 0.03]
  - - [1, 1408, 1, 1280]
    - [7, 0.039]
  - - [1, 1856, 1, 1280]
    - [7, 0.051]
  - - [1, 2368, 1, 1280]
    - [11, 0.066]
  - - [1, 2944, 1, 1280]
    - [13, 0.084]
  - - [1, 3584, 1, 1280]
    - [13, 0.102]
  - - [1, 4288, 1, 1280]
    - [11, 0.12]
  - - [1, 5056, 1, 1280]
    - [11, 0.141]
  - - [1, 5888, 1, 1280]
    - [11, 0.162]
  - - [1, 6784, 1, 1280]
    - [7, 0.189]
  - - [1, 64, 1, 3328]
    - [6, 0.003]
  - - [1, 128, 1, 3328]
    - [1, 0.003]
  - - [1, 256, 1, 3328]
    - [11, 0.009]
  - - [1, 448, 1, 3328]
    - [11, 0.015]
  - - [1, 704, 1, 3328]
    - [7, 0.021]
  - - [1, 1024, 1, 3328]
    - [7, 0.03]
  - - [1, 1408, 1, 3328]
    - [9, 0.042]
  - - [1, 1856, 1, 3328]
    - [11, 0.057]
  - - [1, 2368, 1, 3328]
    - [11, 0.072]
  - - [1, 2944, 1, 3328]
    - [11, 0.09]
  - - [1, 3584, 1, 3328]
    - [13, 0.111]
  - - [1, 4288, 1, 3328]
    - [13, 0.132]
  - - [1, 5056, 1, 3328]
    - [13, 0.156]
  - - [1, 5888, 1, 3328]
    - [13, 0.18]
  - - [1, 6784, 1, 3328]
    - [13, 0.207]
  - - [64, 1, 1, 256]
    - [9, 0.001]
  - - [128, 1, 1, 256]
    - [2, 0.003]
  - - [256, 1, 1, 256]
    - [6, 0.006]
  - - [448, 1, 1, 256]
    - [2, 0.009]
  - - [704, 1, 1, 256]
    - [7, 0.015]
  - - [1024, 1, 1, 256]
    - [6, 0.021]
  - - [1408, 1, 1, 256]
    - [7, 0.03]
  - - [1856, 1, 1, 256]
    - [7, 0.039]
  - - [2368, 1, 1, 256]
    - [7, 0.048]
  - - [2944, 1, 1, 256]
    - [7, 0.06]
  - - [3584, 1, 1, 256]
    - [9, 0.075]
  - - [4288, 1, 1, 256]
    - [7, 0.087]
  - - [5056, 1, 1, 256]
    - [7, 0.102]
  - - [5888, 1, 1, 256]
    - [7, 0.114]
  - - [6784, 1, 1, 256]
    - [11, 0.165]
  - - [64, 1, 1, 1280]
    - [7, 0.003]
  - - [128, 1, 1, 1280]
    - [1, 0.003]
  - - [256, 1, 1, 1280]
    - [2, 0.006]
  - - [448, 1, 1, 1280]
    - [7, 0.012]
  - - [704, 1, 1, 1280]
    - [11, 0.021]
  - - [1024, 1, 1, 1280]
    - [11, 0.03]
  - - [1408, 1, 1, 1280]
    - [7, 0.039]
  - - [1856, 1, 1, 1280]
    - [13, 0.054]
  - - [2368, 1, 1, 1280]
    - [7, 0.066]
  - - [2944, 1, 1, 1280]
    - [11, 0.084]
  - - [3584, 1, 1, 1280]
    - [11, 0.102]
  - - [4288, 1, 1, 1280]
    - [13, 0.123]
  - - [5056, 1, 1, 1280]
    - [13, 0.144]
  - - [5888, 1, 1, 1280]
    - [11, 0.165]
  - - [6784, 1, 1, 1280]
    - [13, 0.207]
  - - [64, 1, 1, 3328]
    - [6, 0.003]
  - - [128, 1, 1, 3328]
    - [1, 0.003]
  - - [256, 1, 1, 3328]
    - [11, 0.009]
  - - [448, 1, 1, 3328]
    - [11, 0.015]
  - - [704, 1, 1, 3328]
    - [7, 0.021]
  - - [1024, 1, 1, 3328]
    - [7, 0.03]
  - - [1408, 1, 1, 3328]
    - [7, 0.042]
  - - [1856, 1, 1, 3328]
    - [11, 0.057]
  - - [2368, 1, 1, 3328]
    - [11, 0.072]
  - - [2944, 1, 1, 3328]
    - [11, 0.09]
  - - [3584, 1, 1, 3328]
    - [13, 0.111]
  - - [4288, 1, 1, 3328]
    - [13, 0.132]
  - - [5056, 1, 1, 3328]
    - [13, 0.156]
  - - [5888, 1, 1, 3328]
    - [11, 0.18]
  - - [6784, 1, 1, 3328]
    - [13, 0.207]
  - - [64, 64, 1, 1]
    - [128, 0.0]
  - - [128, 64, 1, 1]
    - [17, 0.001]
  - - [256, 64, 1, 1]
    - [125, 0.002]
  - - [448, 64, 1, 1]
    - [17, 0.003]
  - - [704, 64, 1, 1]
    - [128, 0.005]
  - - [1024, 64, 1, 1]
    - [127, 0.007]
  - - [1408, 64, 1, 1]
    - [126, 0.009]
  - - [1856, 64, 1, 1]
    - [130, 0.012]
  - - [2368, 64, 1, 1]
    - [130, 0.016]
  - - [2944, 64, 1, 1]
    - [126, 0.019]
  - - [3584, 64, 1, 1]
    - [126, 0.022]
  - - [4288, 64, 1, 1]
    - [130, 0.026]
  - - [5056, 64, 1, 1]
    - [17, 0.031]
  - - [5888, 64, 1, 1]
    - [145, 0.036]
  - - [6784, 64, 1, 1]
    - [142, 0.04]
  - - [64, 128, 1, 1]
    - [125, 0.001]
  - - [128, 128, 1, 1]
    - [133, 0.002]
  - - [256, 128, 1, 1]
    - [146, 0.003]
  - - [448, 128, 1, 1]
    - [127, 0.006]
  - - [704, 128, 1, 1]
    - [127, 0.009]
  - - [1024, 128, 1, 1]
    - [126, 0.013]
  - - [1408, 128, 1, 1]
    - [126, 0.018]
  - - [1856, 128, 1, 1]
    - [142, 0.023]
  - - [2368, 128, 1, 1]
    - [130, 0.029]
  - - [2944, 128, 1, 1]
    - [134, 0.035]
  - - [3584, 128, 1, 1]
    - [142, 0.042]
  - - [4288, 128, 1, 1]
    - [145, 0.049]
  - - [5056, 128, 1, 1]
    - [132, 0.056]
  - - [5888, 128, 1, 1]
    - [145, 0.062]
  - - [6784, 128, 1, 1]
    - [132, 0.071]
  - - [64, 256, 1, 1]
    - [116, 0.002]
  - - [128, 256, 1, 1]
    - [125, 0.003]
  - - [256, 256, 1, 1]
    - [125, 0.007]
  - - [448, 256, 1, 1]
    - [130, 0.011]
  - - [704, 256, 1, 1]
    - [126, 0.018]
  - - [1024, 256, 1, 1]
    - [130, 0.025]
  - - [1408, 256, 1, 1]
    - [126, 0.033]
  - - [1856, 256, 1, 1]
    - [142, 0.043]
  - - [2368, 256, 1, 1]
    - [130, 0.053]
  - - [2944, 256, 1, 1]
    - [135, 0.064]
  - - [3584, 256, 1, 1]
    - [129, 0.072]
  - - [4288, 256, 1, 1]
    - [131, 0.082]
  - - [5056, 256, 1, 1]
    - [141, 0.087]
  - - [5888, 256, 1, 1]
    - [129, 0.098]
  - - [6784, 256, 1, 1]
    - [126, 0.106]
  - - [64, 448, 1, 1]
    - [116, 0.003]
  - - [128, 448, 1, 1]
    - [146, 0.006]
  - - [256, 448, 1, 1]
    - [124, 0.012]
  - - [448, 448, 1, 1]
    - [126, 0.019]
  - - [704, 448, 1, 1]
    - [130, 0.029]
  - - [1024, 448, 1, 1]
    - [142, 0.041]
  - - [1408, 448, 1, 1]
    - [131, 0.054]
  - - [1856, 448, 1, 1]
    - [130, 0.067]
  - - [2368, 448, 1, 1]
    - [131, 0.08]
  - - [2944, 448, 1, 1]
    - [132, 0.091]
  - - [3584, 448, 1, 1]
    - [131, 0.1]
  - - [4288, 448, 1, 1]
    - [132, 0.113]
  - - [5056, 448, 1, 1]
    - [132, 0.124]
  - - [5888, 448, 1, 1]
    - [132, 0.129]
  - - [6784, 448, 1, 1]
    - [147, 0.139]
  - - [64, 704, 1, 1]
    - [126, 0.005]
  - - [128, 704, 1, 1]
    - [125, 0.009]
  - - [256, 704, 1, 1]
    - [130, 0.018]
  - - [448, 704, 1, 1]
    - [142, 0.03]
  - - [704, 704, 1, 1]
    - [142, 0.044]
  - - [1024, 704, 1, 1]
    - [135, 0.059]
  - - [1408, 704, 1, 1]
    - [135, 0.073]
  - - [1856, 704, 1, 1]
    - [138, 0.087]
  - - [2368, 704, 1, 1]
    - [140, 0.102]
  - - [2944, 704, 1, 1]
    - [131, 0.116]
  - - [3584, 704, 1, 1]
    - [148, 0.124]
  - - [4288, 704, 1, 1]
    - [147, 0.137]
  - - [5056, 704, 1, 1]
    - [126, 0.143]
  - - [5888, 704, 1, 1]
    - [131, 0.156]
  - - [6784, 704, 1, 1]
    - [136, 0.164]
  - - [64, 1024, 1, 1]
    - [127, 0.007]
  - - [128, 1024, 1, 1]
    - [124, 0.014]
  - - [256, 1024, 1, 1]
    - [126, 0.025]
  - - [448, 1024, 1, 1]
    - [142, 0.042]
  - - [704, 1024, 1, 1]
    - [132, 0.059]
  - - [1024, 1024, 1, 1]
    - [131, 0.077]
  - - [1408, 1024, 1, 1]
    - [132, 0.095]
  - - [1856, 1024, 1, 1]
    - [132, 0.112]
  - - [2368, 1024, 1, 1]
    - [132, 0.125]
  - - [2944, 1024, 1, 1]
    - [131, 0.138]
  - - [3584, 1024, 1, 1]
    - [148, 0.147]
  - - [4288, 1024, 1, 1]
    - [132, 0.16]
  - - [5056, 1024, 1, 1]
    - [136, 0.17]
  - - [5888, 1024, 1, 1]
    - [131, 0.173]
  - - [6784, 1024, 1, 1]
    - [138, 0.178]
  - - [64, 1408, 1, 1]
    - [127, 0.009]
  - - [128, 1408, 1, 1]
    - [130, 0.018]
  - - [256, 1408, 1, 1]
    - [130, 0.034]
  - - [448, 1408, 1, 1]
    - [130, 0.053]
  - - [704, 1408, 1, 1]
    - [134, 0.075]
  - - [1024, 1408, 1, 1]
    - [132, 0.093]
  - - [1408, 1408, 1, 1]
    - [132, 0.115]
  - - [1856, 1408, 1, 1]
    - [148, 0.125]
  - - [2368, 1408, 1, 1]
    - [131, 0.141]
  - - [2944, 1408, 1, 1]
    - [136, 0.155]
  - - [3584, 1408, 1, 1]
    - [147, 0.168]
  - - [4288, 1408, 1, 1]
    - [147, 0.172]
  - - [5056, 1408, 1, 1]
    - [132, 0.182]
  - - [5888, 1408, 1, 1]
    - [132, 0.188]
  - - [6784, 1408, 1, 1]
    - [139, 0.192]
  - - [64, 1856, 1, 1]
    - [126, 0.013]
  - - [128, 1856, 1, 1]
    - [127, 0.023]
  - - [256, 1856, 1, 1]
    - [142, 0.043]
  - - [448, 1856, 1, 1]
    - [131, 0.069]
  - - [704, 1856, 1, 1]
    - [131, 0.087]
  - - [1024, 1856, 1, 1]
    - [132, 0.11]
  - - [1408, 1856, 1, 1]
    - [132, 0.125]
  - - [1856, 1856, 1, 1]
    - [132, 0.142]
  - - [2368, 1856, 1, 1]
    - [132, 0.159]
  - - [2944, 1856, 1, 1]
    - [147, 0.167]
  - - [3584, 1856, 1, 1]
    - [147, 0.177]
  - - [4288, 1856, 1, 1]
    - [132, 0.185]
  - - [5056, 1856, 1, 1]
    - [132, 0.193]
  - - [5888, 1856, 1, 1]
    - [132, 0.197]
  - - [6784, 1856, 1, 1]
    - [136, 0.2]
  - - [64, 2368, 1, 1]
    - [126, 0.016]
  - - [128, 2368, 1, 1]
    - [130, 0.03]
  - - [256, 2368, 1, 1]
    - [134, 0.054]
  - - [448, 2368, 1, 1]
    - [126, 0.08]
  - - [704, 2368, 1, 1]
    - [131, 0.104]
  - - [1024, 2368, 1, 1]
    - [131, 0.124]
  - - [1408, 2368, 1, 1]
    - [131, 0.143]
  - - [1856, 2368, 1, 1]
    - [139, 0.157]
  - - [2368, 2368, 1, 1]
    - [139, 0.167]
  - - [2944, 2368, 1, 1]
    - [139, 0.179]
  - - [3584, 2368, 1, 1]
    - [131, 0.189]
  - - [4288, 2368, 1, 1]
    - [136, 0.196]
  - - [5056, 2368, 1, 1]
    - [141, 0.201]
  - - [5888, 2368, 1, 1]
    - [136, 0.206]
  - - [6784, 2368, 1, 1]
    - [138, 0.205]
  - - [64, 2944, 1, 1]
    - [124, 0.018]
  - - [128, 2944, 1, 1]
    - [145, 0.035]
  - - [256, 2944, 1, 1]
    - [131, 0.064]
  - - [448, 2944, 1, 1]
    - [132, 0.092]
  - - [704, 2944, 1, 1]
    - [132, 0.119]
  - - [1024, 2944, 1, 1]
    - [131, 0.135]
  - - [1408, 2944, 1, 1]
    - [131, 0.155]
  - - [1856, 2944, 1, 1]
    - [147, 0.169]
  - - [2368, 2944, 1, 1]
    - [132, 0.181]
  - - [2944, 2944, 1, 1]
    - [139, 0.191]
  - - [3584, 2944, 1, 1]
    - [131, 0.196]
  - - [4288, 2944, 1, 1]
    - [141, 0.201]
  - - [5056, 2944, 1, 1]
    - [141, 0.208]
  - - [5888, 2944, 1, 1]
    - [132, 0.21]
  - - [6784, 2944, 1, 1]
    - [147, 0.211]
  - - [64, 3584, 1, 1]
    - [126, 0.022]
  - - [128, 3584, 1, 1]
    - [142, 0.042]
  - - [256, 3584, 1, 1]
    - [134, 0.072]
  - - [448, 3584, 1, 1]
    - [131, 0.102]
  - - [704, 3584, 1, 1]
    - [131, 0.127]
  - - [1024, 3584, 1, 1]
    - [135, 0.147]
  - - [1408, 3584, 1, 1]
    - [139, 0.163]
  - - [1856, 3584, 1, 1]
    - [132, 0.175]
  - - [2368, 3584, 1, 1]
    - [147, 0.189]
  - - [2944, 3584, 1, 1]
    - [136, 0.197]
  - - [3584, 3584, 1, 1]
    - [131, 0.204]
  - - [4288, 3584, 1, 1]
    - [147, 0.207]
  - - [5056, 3584, 1, 1]
    - [132, 0.212]
  - - [5888, 3584, 1, 1]
    - [141, 0.215]
  - - [6784, 3584, 1, 1]
    - [141, 0.215]
  - - [64, 4288, 1, 1]
    - [134, 0.026]
  - - [128, 4288, 1, 1]
    - [130, 0.049]
  - - [256, 4288, 1, 1]
    - [135, 0.083]
  - - [448, 4288, 1, 1]
    - [131, 0.114]
  - - [704, 4288, 1, 1]
    - [131, 0.141]
  - - [1024, 4288, 1, 1]
    - [131, 0.159]
  - - [1408, 4288, 1, 1]
    - [131, 0.174]
  - - [1856, 4288, 1, 1]
    - [139, 0.184]
  - - [2368, 4288, 1, 1]
    - [138, 0.194]
  - - [2944, 4288, 1, 1]
    - [147, 0.202]
  - - [3584, 4288, 1, 1]
    - [140, 0.208]
  - - [4288, 4288, 1, 1]
    - [136, 0.213]
  - - [5056, 4288, 1, 1]
    - [132, 0.215]
  - - [5888, 4288, 1, 1]
    - [147, 0.219]
  - - [6784, 4288, 1, 1]
    - [138, 0.217]
  - - [64, 5056, 1, 1]
    - [128, 0.032]
  - - [128, 5056, 1, 1]
    - [131, 0.056]
  - - [256, 5056, 1, 1]
    - [132, 0.092]
  - - [448, 5056, 1, 1]
    - [131, 0.122]
  - - [704, 5056, 1, 1]
    - [132, 0.145]
  - - [1024, 5056, 1, 1]
    - [131, 0.168]
  - - [1408, 5056, 1, 1]
    - [132, 0.179]
  - - [1856, 5056, 1, 1]
    - [136, 0.192]
  - - [2368, 5056, 1, 1]
    - [131, 0.201]
  - - [2944, 5056, 1, 1]
    - [131, 0.207]
  - - [3584, 5056, 1, 1]
    - [138, 0.213]
  - - [4288, 5056, 1, 1]
    - [147, 0.215]
  - - [5056, 5056, 1, 1]
    - [147, 0.217]
  - - [5888, 5056, 1, 1]
    - [147, 0.22]
  - - [6784, 5056, 1, 1]
    - [138, 0.22]
  - - [64, 5888, 1, 1]
    - [130, 0.036]
  - - [128, 5888, 1, 1]
    - [149, 0.063]
  - - [256, 5888, 1, 1]
    - [132, 0.1]
  - - [448, 5888, 1, 1]
    - [132, 0.128]
  - - [704, 5888, 1, 1]
    - [147, 0.157]
  - - [1024, 5888, 1, 1]
    - [139, 0.171]
  - - [1408, 5888, 1, 1]
    - [131, 0.187]
  - - [1856, 5888, 1, 1]
    - [131, 0.194]
  - - [2368, 5888, 1, 1]
    - [147, 0.207]
  - - [2944, 5888, 1, 1]
    - [147, 0.21]
  - - [3584, 5888, 1, 1]
    - [140, 0.215]
  - - [4288, 5888, 1, 1]
    - [136, 0.218]
  - - [5056, 5888, 1, 1]
    - [147, 0.22]
  - - [5888, 5888, 1, 1]
    - [147, 0.223]
  - - [6784, 5888, 1, 1]
    - [141, 0.222]
  - - [64, 6784, 1, 1]
    - [142, 0.04]
  - - [128, 6784, 1, 1]
    - [132, 0.07]
  - - [256, 6784, 1, 1]
    - [131, 0.107]
  - - [448, 6784, 1, 1]
    - [131, 0.141]
  - - [704, 6784, 1, 1]
    - [132, 0.164]
  - - [1024, 6784, 1, 1]
    - [131, 0.178]
  - - [1408, 6784, 1, 1]
    - [147, 0.193]
  - - [1856, 6784, 1, 1]
    - [140, 0.201]
  - - [2368, 6784, 1, 1]
    - [138, 0.208]
  - - [2944, 6784, 1, 1]
    - [147, 0.214]
  - - [3584, 6784, 1, 1]
    - [138, 0.22]
  - - [4288, 6784, 1, 1]
    - [138, 0.219]
  - - [5056, 6784, 1, 1]
    - [141, 0.222]
  - - [5888, 6784, 1, 1]
    - [132, 0.224]
  - - [6784, 6784, 1, 1]
    - [147, 0.224]
  - - [1, 1, 1, 256]
    - [2, 0.0]
  - - [1, 1, 1, 1280]
    - [10, 0.0]
  - - [1, 1, 1, 3328]
    - [11, 0.0]
  - - [1, 64, 1, 1]
    - [2, 0.0]
  - - [1, 128, 1, 1]
    - [9, 0.0]
  - - [1, 256, 1, 1]
    - [4, 0.0]
  - - [1, 448, 1, 1]
    - [4, 0.0]
  - - [1, 704, 1, 1]
    - [8, 0.0]
  - - [1, 1024, 1, 1]
    - [4, 0.0]
  - - [1, 1408, 1, 1]
    - [4, 0.001]
  - - [1, 1856, 1, 1]
    - [2, 0.001]
  - - [1, 2368, 1, 1]
    - [2, 0.001]
  - - [1, 2944, 1, 1]
    - [4, 0.001]
  - - [1, 3584, 1, 1]
    - [2, 0.003]
  - - [1, 4288, 1, 1]
    - [4, 0.003]
  - - [1, 5056, 1, 1]
    - [1, 0.003]
  - - [1, 5888, 1, 1]
    - [1, 0.003]
  - - [1, 6784, 1, 1]
    - [0, 0.003]
  - - [64, 1, 1, 1]
    - [12, 0.0]
  - - [128, 1, 1, 1]
    - [11, 0.0]
  - - [256, 1, 1, 1]
    - [5, 0.0]
  - - [448, 1, 1, 1]
    - [8, 0.0]
  - - [704, 1, 1, 1]
    - [3, 0.0]
  - - [1024, 1, 1, 1]
    - [3, 0.001]
  - - [1408, 1, 1, 1]
    - [4, 0.001]
  - - [1856, 1, 1, 1]
    - [4, 0.001]
  - - [2368, 1, 1, 1]
    - [2, 0.001]
  - - [2944, 1, 1, 1]
    - [4, 0.001]
  - - [3584, 1, 1, 1]
    - [2, 0.003]
  - - [4288, 1, 1, 1]
    - [2, 0.003]
  - - [5056, 1, 1, 1]
    - [2, 0.003]
  - - [5888, 1, 1, 1]
    - [0, 0.003]
  - - [6784, 1, 1, 1]
    - [0, 0.003]
  - - [7680, 8192, 1, 8192]
    - [83, 90.736]
  - - [3840, 4096, 1, 4096]
    - [75, 79.992]
  - - [1920, 2048, 1, 2048]
    - [88, 57.534]
  - - [960, 1024, 1, 1024]
    - [61, 26.436]
  - - [480, 512, 1, 512]
    - [20, 7.124]
  - - [8192, 7680, 1, 8192]
    - [88, 92.167]
  - - [4096, 3840, 1, 4096]
    - [75, 79.842]
  - - [2048, 1920, 1, 2048]
    - [85, 59.928]
  - - [1024, 960, 1, 1024]
    - [49, 26.253]
  - - [512, 480, 1, 512]
    - [28, 7.196]
  - - [8192, 8192, 1, 8192]
    - [93, 91.424]
  - - [4096, 4096, 1, 4096]
    - [82, 80.86]
  - - [2048, 2048, 1, 2048]
    - [88, 60.525]
  - - [512, 512, 1, 512]
    - [22, 7.599]
  - - [64, 512, 16, 512]
    - [29, 13.562]
  - - [1024, 2, 1, 1]
    - [127, 0.0]
  - - [1024, 2, 1, 512]
    - [116, 0.065]
  - - [1024, 1024, 1, 77]
    - [132, 5.11]
  - - [1024, 1024, 1, 512]
    - [49, 21.602]
  - - [1024, 4096, 1, 512]
    - [150, 34.029]
  - - [1024, 30522, 1, 77]
    - [131, 12.73]
  - - [4096, 1024, 1, 512]
    - [151, 33.418]
  - - [64, 128, 160, 128]
    - [49, 9.845]
  - - [1024, 2, 1, 10]
    - [146, 0.002]
  - - [1024, 2, 1, 1280]
    - [15, 0.12]
  - - [1024, 1024, 1, 10]
    - [126, 0.772]
  - - [1024, 1024, 1, 200]
    - [49, 10.548]
  - - [1024, 4096, 1, 1280]
    - [95, 50.196]
  - - [1024, 30522, 1, 200]
    - [57, 26.426]
  - - [4096, 1024, 1, 1280]
    - [91, 49.498]
  - - [64, 128, 624, 128]
    - [52, 13.211]
  - - [1024, 2, 1, 39]
    - [125, 0.008]
  - - [1024, 2, 1, 4992]
    - [152, 0.301]
  - - [1024, 1024, 1, 39]
    - [135, 2.916]
  - - [1024, 1024, 1, 780]
    - [73, 23.997]
  - - [1024, 1024, 1, 4992]
    - [69, 49.227]
  - - [1024, 4096, 1, 4992]
    - [85, 74.534]
  - - [1024, 30522, 1, 780]
    - [57, 51.99]
  - - [4096, 1024, 1, 4992]
    - [111, 74.51]
  - - [64, 512, 64, 512]
    - [153, 25.203]
  - - [1024, 2, 1, 4]
    - [143, 0.001]
  - - [1024, 2, 1, 2048]
    - [15, 0.149]
  - - [1024, 1024, 1, 4]
    - [132, 0.311]
  - - [1024, 1024, 1, 308]
    - [73, 14.326]
  - - [1024, 1024, 1, 2048]
    - [89, 37.863]
  - - [1024, 4096, 1, 2048]
    - [88, 59.704]
  - - [1024, 30522, 1, 308]
    - [59, 34.751]
  - - [4096, 1024, 1, 2048]
    - [91, 60.449]
  - - [64, 128, 640, 128]
    - [52, 13.672]
  - - [1024, 2, 1, 40]
    - [127, 0.008]
  - - [1024, 2, 1, 5120]
    - [154, 0.302]
  - - [1024, 1024, 1, 40]
    - [132, 2.935]
  - - [1024, 1024, 1, 800]
    - [23, 25.682]
  - - [1024, 1024, 1, 5120]
    - [69, 49.702]
  - - [1024, 4096, 1, 5120]
    - [155, 75.139]
  - - [1024, 30522, 1, 800]
    - [56, 55.927]
  - - [4096, 1024, 1, 5120]
    - [81, 75.491]
  - - [64, 128, 656, 128]
    - [64, 13.455]
  - - [1024, 2, 1, 41]
    - [146, 0.009]
  - - [1024, 2, 1, 5248]
    - [156, 0.301]
  - - [1024, 1024, 1, 41]
    - [129, 2.9]
  - - [1024, 1024, 1, 820]
    - [49, 24.098]
  - - [1024, 1024, 1, 5248]
    - [69, 50.121]
  - - [1024, 4096, 1, 5248]
    - [155, 75.447]
  - - [1024, 30522, 1, 820]
    - [59, 53.147]
  - - [4096, 1024, 1, 5248]
    - [91, 75.77]
  - - [64, 512, 80, 512]
    - [52, 28.694]
  - - [1024, 2, 1, 5]
    - [127, 0.001]
  - - [1024, 2, 1, 2560]
    - [35, 0.17]
  - - [1024, 1024, 1, 5]
    - [132, 0.389]
  - - [1024, 1024, 1, 385]
    - [49, 17.427]
  - - [1024, 1024, 1, 2560]
    - [69, 41.204]
  - - [1024, 4096, 1, 2560]
    - [88, 64.211]
  - - [1024, 30522, 1, 385]
    - [57, 38.503]
  - - [4096, 1024, 1, 2560]
    - [91, 64.727]
  - - [64, 512, 96, 512]
    - [65, 29.458]
  - - [1024, 2, 1, 6]
    - [143, 0.001]
  - - [1024, 2, 1, 3072]
    - [33, 0.18]
  - - [1024, 1024, 1, 6]
    - [131, 0.479]
  - - [1024, 1024, 1, 462]
    - [49, 18.756]
  - - [1024, 1024, 1, 3072]
    - [69, 43.051]
  - - [1024, 4096, 1, 3072]
    - [155, 66.867]
  - - [1024, 30522, 1, 462]
    - [59, 42.322]
  - - [4096, 1024, 1, 3072]
    - [81, 67.995]
  - - [64, 128, 128, 128]
    - [50, 8.087]
  - - [1024, 2, 1, 8]
    - [146, 0.002]
  - - [1024, 2, 1, 1024]
    - [15, 0.101]
  - - [1024, 1024, 1, 8]
    - [131, 0.622]
  - - [1024, 1024, 1, 160]
    - [49, 9.794]
  - - [1024, 4096, 1, 1024]
    - [157, 45.65]
  - - [1024, 30522, 1, 160]
    - [67, 23.554]
  - - [4096, 1024, 1, 1024]
    - [111, 44.517]
  - - [64, 128, 144, 128]
    - [23, 9.001]
  - - [1024, 2, 1, 9]
    - [127, 0.002]
  - - [1024, 2, 1, 1152]
    - [15, 0.112]
  - - [1024, 1024, 1, 9]
    - [131, 0.695]
  - - [1024, 1024, 1, 180]
    - [149, 9.493]
  - - [1024, 1024, 1, 1152]
    - [23, 29.143]
  - - [1024, 4096, 1, 1152]
    - [95, 47.837]
  - - [1024, 30522, 1, 180]
    - [57, 24.294]
  - - [4096, 1024, 1, 1152]
    - [91, 46.648]
  - - [13, 512, 1, 32768]
    - [158, 3.154]
  - - [256, 128, 1, 32768]
    - [159, 15.352]
  - - [256, 32768, 1, 1]
    - [135, 0.192]
  - - [479, 1024, 1, 32768]
    - [160, 32.394]
  - - [512, 256, 1, 32768]
    - [161, 32.873]
  - - [1024, 512, 1, 32768]
    - [162, 53.543]
  - - [1024, 1024, 1, 32768]
    - [163, 68.046]
  - - [64, 128, 512, 128]
    - [164, 12.319]
  - - [128, 64, 512, 128]
    - [135, 11.86]
  - - [1024, 2, 1, 32]
    - [122, 0.007]
  - - [1024, 1024, 1, 4096]
    - [69, 47.255]
  - - [1024, 4096, 1, 4096]
    - [85, 72.196]
  - - [1024, 30528, 1, 4096]
    - [88, 84.724]
  - - [4096, 1024, 1, 4096]
    - [91, 72.739]
  - - [512, 64, 64, 512]
    - [50, 22.57]
  - - [1024, 30528, 1, 2048]
    - [88, 74.193]
  - - [4, 64, 32768, 4]
    - [124, 0.22]
  - - [4, 64, 38400, 4]
    - [124, 0.222]
  - - [64, 4, 32768, 4]
    - [126, 0.225]
  - - [64, 4, 38400, 4]
    - [126, 0.228]
  - - [1024, 1024, 1, 8192]
    - [163, 55.556]
  - - [1024, 1024, 1, 9600]
    - [163, 58.131]
  - - [1024, 4096, 1, 8192]
    - [155, 80.448]
  - - [1024, 4096, 1, 9600]
    - [155, 81.724]
  - - [1024, 33712, 1, 8192]
    - [83, 88.773]
  - - [1024, 33712, 1, 9600]
    - [82, 89.83]
  - - [4096, 1024, 1, 8192]
    - [81, 79.116]
  - - [4096, 1024, 1, 9600]
    - [91, 80.349]
  - - [1024, 1024, 1, 10064]
    - [165, 57.604]
  - - [1024, 1024, 1, 10080]
    - [166, 58.836]
  - - [1024, 1024, 1, 10200]
    - [163, 56.975]
  - - [1024, 1024, 1, 3840]
    - [69, 46.576]
  - - [1024, 1024, 1, 3968]
    - [69, 46.831]
  - - [1024, 1024, 1, 6528]
    - [69, 51.968]
  - - [1024, 1024, 1, 7104]
    - [69, 53.151]
  - - [1024, 1024, 1, 7200]
    - [163, 52.799]
  - - [1024, 1024, 1, 8064]
    - [163, 54.657]
  - - [1024, 1024, 1, 8160]
    - [167, 55.149]
  - - [1024, 1024, 1, 9216]
    - [163, 57.607]
  - - [1024, 1024, 1, 9520]
    - [163, 56.659]
  - - [1024, 4096, 1, 10064]
    - [155, 81.282]
  - - [1024, 4096, 1, 10080]
    - [155, 82.155]
  - - [1024, 4096, 1, 10200]
    - [155, 81.269]
  - - [1024, 4096, 1, 3840]
    - [85, 71.022]
  - - [1024, 4096, 1, 3968]
    - [155, 71.76]
  - - [1024, 4096, 1, 6528]
    - [85, 78.176]
  - - [1024, 4096, 1, 7104]
    - [155, 79.381]
  - - [1024, 4096, 1, 7200]
    - [85, 79.088]
  - - [1024, 4096, 1, 8064]
    - [155, 80.275]
  - - [1024, 4096, 1, 8160]
    - [155, 80.318]
  - - [1024, 4096, 1, 9216]
    - [155, 81.693]
  - - [1024, 4096, 1, 9520]
    - [155, 80.752]
  - - [1024, 42720, 1, 10080]
    - [88, 91.07]
  - - [1024, 42720, 1, 3968]
    - [88, 83.815]
  - - [1024, 42720, 1, 6528]
    - [88, 88.363]
  - - [1024, 42720, 1, 7104]
    - [88, 88.998]
  - - [1024, 42720, 1, 7200]
    - [88, 89.113]
  - - [1024, 42720, 1, 9520]
    - [88, 89.757]
  - - [4096, 1024, 1, 10064]
    - [81, 79.969]
  - - [4096, 1024, 1, 10080]
    - [111, 81.051]
  - - [4096, 1024, 1, 10200]
    - [91, 80.307]
  - - [4096, 1024, 1, 3840]
    - [91, 71.951]
  - - [4096, 1024, 1, 3968]
    - [91, 72.147]
  - - [4096, 1024, 1, 6528]
    - [91, 78.554]
  - - [4096, 1024, 1, 7104]
    - [111, 78.07]
  - - [4096, 1024, 1, 7200]
    - [91, 78.668]
  - - [4096, 1024, 1, 8064]
    - [111, 79.389]
  - - [4096, 1024, 1, 8160]
    - [91, 79.736]
  - - [4096, 1024, 1, 9216]
    - [91, 80.263]
  - - [4096, 1024, 1, 9520]
    - [91, 79.963]
  - - [14, 64, 10880, 14]
    - [168, 1.241]
  - - [15, 64, 10880, 14]
    - [169, 1.185]
  - - [15, 64, 7680, 15]
    - [169, 1.231]
  - - [15, 64, 10880, 15]
    - [170, 1.258]
  - - [17, 64, 7680, 15]
    - [170, 1.309]
  - - [17, 64, 6144, 17]
    - [144, 1.431]
  - - [17, 64, 7680, 17]
    - [144, 1.47]
  - - [21, 64, 6144, 17]
    - [171, 1.668]
  - - [21, 64, 6144, 21]
    - [172, 2.031]
  - - [24, 64, 4736, 24]
    - [124, 3.732]
  - - [30, 64, 2048, 30]
    - [173, 2.596]
  - - [30, 64, 2048, 31]
    - [168, 2.646]
  - - [31, 64, 2048, 31]
    - [168, 2.566]
  - - [32, 64, 4608, 32]
    - [124, 5.614]
  - - [32, 64, 4608, 35]
    - [130, 5.441]
  - - [34, 64, 4736, 24]
    - [171, 2.762]
  - - [34, 64, 4736, 34]
    - [171, 3.71]
  - - [35, 64, 4608, 35]
    - [171, 3.762]
  - - [64, 14, 10880, 14]
    - [126, 1.959]
  - - [64, 15, 10880, 14]
    - [126, 1.971]
  - - [64, 15, 7680, 15]
    - [129, 1.968]
  - - [64, 15, 10880, 15]
    - [126, 2.048]
  - - [64, 17, 7680, 15]
    - [126, 2.14]
  - - [64, 17, 6144, 17]
    - [126, 2.227]
  - - [64, 17, 7680, 17]
    - [137, 2.257]
  - - [64, 21, 6144, 17]
    - [138, 2.433]
  - - [64, 21, 6144, 21]
    - [138, 2.925]
  - - [64, 24, 4736, 24]
    - [131, 3.445]
  - - [64, 30, 2048, 30]
    - [135, 3.898]
  - - [64, 30, 2048, 31]
    - [135, 3.924]
  - - [64, 31, 2048, 31]
    - [132, 4.009]
  - - [64, 32, 4608, 32]
    - [132, 5.392]
  - - [64, 32, 4608, 35]
    - [131, 5.205]
  - - [64, 34, 4736, 24]
    - [124, 3.039]
  - - [64, 34, 4736, 34]
    - [124, 3.886]
  - - [64, 35, 4608, 35]
    - [132, 3.921]
  - - [512, 64, 1, 512]
    - [19, 1.112]
  - - [64, 512, 1, 512]
    - [16, 1.105]
  - - [64, 128, 1, 128]
    - [18, 0.099]
  - - [128, 64, 1, 128]
    - [18, 0.097]
  - - [74, 2048, 1, 512]
    - [174, 4.577]
  - - [2048, 2048, 1, 512]
    - [150, 34.813]
  - - [1024, 64, 1, 512]
    - [19, 2.211]
  - - [5, 64, 1, 5]
    - [144, 0.0]
  - - [2048, 512, 1, 1]
    - [136, 0.078]
  - - [1600, 1024, 1, 512]
    - [65, 30.389]
  - - [512, 32, 1, 1600]
    - [22, 0.972]
  - - [33, 32, 1, 33]
    - [144, 0.004]
  - - [560, 1024, 1, 1600]
    - [31, 24.969]
  - - [1024, 1600, 1, 1]
    - [135, 0.098]
  - - [1024, 1024, 1, 1600]
    - [89, 33.936]
  - - [512, 512, 1, 1600]
    - [21, 14.451]
  - - [3, 64, 512, 3]
    - [175, 0.022]
  - - [5, 64, 512, 5]
    - [144, 0.065]
  - - [5, 64, 960, 5]
    - [144, 0.102]
  - - [9, 64, 512, 9]
    - [175, 0.19]
  - - [27, 128, 32768, 27]
    - [169, 3.038]
  - - [33, 32, 200, 33]
    - [144, 0.609]
  - - [33, 32, 1600, 33]
    - [176, 2.06]
  - - [67, 2048, 1, 512]
    - [174, 4.21]
  - - [74, 2048, 1, 960]
    - [174, 6.583]
  - - [100, 2048, 1, 512]
    - [17, 5.937]
  - - [256, 1280, 1, 8976]
    - [177, 33.883]
  - - [256, 2560, 1, 8976]
    - [178, 46.805]
  - - [256, 2816, 1, 8976]
    - [178, 49.729]
  - - [256, 3328, 1, 8976]
    - [179, 53.648]
  - - [256, 3584, 1, 8976]
    - [163, 48.886]
  - - [256, 3840, 1, 8976]
    - [163, 52.544]
  - - [256, 4096, 1, 8976]
    - [163, 55.606]
  - - [256, 4352, 1, 8976]
    - [163, 58.804]
  - - [256, 4864, 1, 8976]
    - [89, 59.231]
  - - [256, 5120, 1, 8976]
    - [89, 63.24]
  - - [256, 5632, 1, 8976]
    - [103, 61.678]
  - - [256, 5888, 1, 8976]
    - [103, 63.94]
  - - [256, 6144, 1, 8976]
    - [103, 67.171]
  - - [256, 7168, 1, 8976]
    - [180, 54.757]
  - - [256, 8192, 1, 8976]
    - [107, 63.422]
  - - [256, 8960, 1, 8976]
    - [181, 64.274]
  - - [256, 9728, 1, 8976]
    - [182, 65.06]
  - - [256, 9984, 1, 8976]
    - [182, 66.963]
  - - [256, 10240, 1, 8976]
    - [55, 68.045]
  - - [256, 10496, 1, 8976]
    - [55, 69.514]
  - - [256, 11008, 1, 8976]
    - [83, 69.339]
  - - [256, 11264, 1, 8976]
    - [104, 70.814]
  - - [256, 11520, 1, 8976]
    - [104, 72.336]
  - - [256, 11776, 1, 8976]
    - [183, 73.782]
  - - [256, 12544, 1, 8976]
    - [82, 78.348]
  - - [256, 12800, 1, 8976]
    - [82, 79.985]
  - - [256, 13312, 1, 8976]
    - [183, 82.885]
  - - [256, 13568, 1, 8976]
    - [110, 84.195]
  - - [256, 14336, 1, 8976]
    - [109, 74.229]
  - - [256, 14848, 1, 8976]
    - [184, 76.941]
  - - [256, 15104, 1, 8976]
    - [185, 80.063]
  - - [256, 15872, 1, 8976]
    - [88, 78.628]
  - - [256, 16128, 1, 8976]
    - [155, 78.974]
  - - [256, 17152, 1, 8976]
    - [85, 84.629]
  - - [256, 17408, 1, 8976]
    - [88, 85.113]
  - - [256, 18688, 1, 8976]
    - [75, 74.87]
  - - [256, 19968, 1, 8976]
    - [86, 79.606]
  - - [256, 20480, 1, 8976]
    - [75, 81.495]
  - - [256, 20992, 1, 8976]
    - [86, 83.455]
  - - [256, 21248, 1, 8976]
    - [186, 68.942]
  - - [256, 22016, 1, 8976]
    - [186, 71.415]
  - - [256, 26112, 1, 8976]
    - [186, 83.893]
  - - [256, 32512, 1, 8976]
    - [85, 82.222]
  - - [256, 33536, 1, 8976]
    - [85, 84.415]
  - - [256, 44505, 1, 8976]
    - [75, 76.889]
  - - [257, 4096, 1, 1024]
    - [187, 26.061]
  - - [480, 1024, 1, 32768]
    - [162, 54.476]
  - - [512, 32, 1, 200]
    - [18, 0.249]
  - - [512, 512, 1, 200]
    - [17, 3.861]
  - - [512, 2048, 1, 256]
    - [49, 14.133]
  - - [560, 1024, 1, 200]
    - [17, 6.661]
  - - [768, 2048, 1, 256]
    - [51, 18.219]
  - - [1024, 64, 1, 960]
    - [19, 3.207]
  - - [1024, 256, 1, 1024]
    - [21, 11.37]
  - - [1024, 256, 1, 2304]
    - [37, 16.202]
  - - [1024, 256, 1, 2816]
    - [38, 17.809]
  - - [1024, 256, 1, 3072]
    - [43, 18.366]
  - - [1024, 256, 1, 3584]
    - [43, 19.422]
  - - [1024, 256, 1, 4096]
    - [41, 20.062]
  - - [1024, 256, 1, 4352]
    - [41, 20.698]
  - - [1024, 256, 1, 4608]
    - [188, 21.166]
  - - [1024, 256, 1, 5120]
    - [189, 22.503]
  - - [1024, 256, 1, 5376]
    - [189, 23.35]
  - - [1024, 256, 1, 5632]
    - [189, 24.319]
  - - [1024, 256, 1, 6144]
    - [189, 25.666]
  - - [1024, 256, 1, 6400]
    - [189, 25.682]
  - - [1024, 256, 1, 7680]
    - [190, 28.895]
  - - [1024, 256, 1, 7936]
    - [189, 30.05]
  - - [1024, 256, 1, 8192]
    - [189, 30.94]
  - - [1024, 256, 1, 8448]
    - [189, 30.88]
  - - [1024, 256, 1, 9728]
    - [189, 34.326]
  - - [1024, 256, 1, 9984]
    - [189, 34.732]
  - - [1024, 256, 1, 10496]
    - [189, 35.469]
  - - [1024, 256, 1, 11520]
    - [189, 37.103]
  - - [1024, 256, 1, 12032]
    - [189, 37.724]
  - - [1024, 256, 1, 13568]
    - [189, 40.073]
  - - [1024, 256, 1, 14336]
    - [189, 41.389]
  - - [1024, 256, 1, 14848]
    - [189, 42.166]
  - - [1024, 256, 1, 15104]
    - [189, 40.739]
  - - [1024, 256, 1, 15872]
    - [189, 43.046]
  - - [1024, 256, 1, 16128]
    - [189, 42.721]
  - - [1024, 256, 1, 17152]
    - [189, 44.05]
  - - [1024, 256, 1, 17408]
    - [189, 44.246]
  - - [1024, 256, 1, 18944]
    - [189, 44.618]
  - - [1024, 256, 1, 19712]
    - [189, 46.132]
  - - [1024, 256, 1, 19968]
    - [190, 46.146]
  - - [1024, 256, 1, 21248]
    - [189, 46.972]
  - - [1024, 256, 1, 21504]
    - [189, 47.503]
  - - [1024, 256, 1, 22016]
    - [189, 47.601]
  - - [1024, 256, 1, 28672]
    - [189, 51.478]
  - - [1024, 256, 1, 33536]
    - [189, 54.753]
  - - [1024, 1024, 1, 960]
    - [23, 27.865]
  - - [1600, 1024, 1, 960]
    - [54, 39.119]
  - - [2048, 256, 1, 1024]
    - [21, 20.029]
  - - [2048, 960, 1, 1]
    - [139, 0.111]
  - - [2048, 2048, 1, 960]
    - [150, 46.103]
  - - [2048, 2048, 1, 1024]
    - [222, 44.722]
  - - [3200, 2048, 1, 1024]
    - [82, 52.33]
  - - [4096, 4096, 1, 1024]
    - [223, 64.113]
  - - [2048, 2, 1, 2]
    - [127, 0.001]
  - - [2048, 2048, 1, 2]
    - [138, 0.306]
  - - [2048, 30592, 1, 1024]
    - [82, 64.803]
  - - [2048, 6144, 1, 1024]
    - [75, 58.16]
  - - [2048, 8192, 1, 1024]
    - [82, 58.108]
  - - [8192, 2048, 1, 1024]
    - [90, 58.53]
  - - [1024, 1024, 1, 16]
    - [129, 1.341]
  - - [1024, 2, 1, 16]
    - [125, 0.004]
  - - [1024, 30592, 1, 8192]
    - [155, 90.522]
  - - [1024, 3072, 1, 8192]
    - [82, 78.258]
  - - [512, 64, 256, 512]
    - [42, 28.633]
  - - [64, 512, 256, 512]
    - [191, 32.74]
  - - [1024, 30592, 1, 2048]
    - [83, 74.074]
  - - [1024, 3072, 1, 2048]
    - [82, 59.839]
  - - [1024, 30592, 1, 4096]
    - [155, 84.363]
  - - [1024, 3072, 1, 4096]
    - [104, 70.918]
  - - [512, 64, 128, 512]
    - [42, 26.156]
  - - [64, 512, 128, 512]
    - [51, 29.363]
  - - [2560, 1920, 1, 2048]
    - [75, 61.94]
  - - [2560, 2, 1, 4]
    - [127, 0.002]
  - - [2560, 2560, 1, 2048]
    - [82, 66.12]
  - - [2560, 2560, 1, 4]
    - [132, 0.705]
  - - [2560, 7680, 1, 2048]
    - [75, 72.817]
  - - [640, 2560, 1, 2048]
    - [99, 51.156]
  - - [512, 64, 40, 512]
    - [49, 23.336]
  - - [64, 512, 40, 512]
    - [65, 23.702]
  - - [1536, 1536, 1, 4096]
    - [56, 60.086]
  - - [1536, 4608, 1, 4096]
    - [82, 81.739]
  - - [1536, 50304, 1, 4096]
    - [83, 86.574]
  - - [1536, 6144, 1, 4096]
    - [82, 74.573]
  - - [6144, 1536, 1, 4096]
    - [93, 74.932]
  - - [1024, 96, 64, 1024]
    - [53, 47.627]
  - - [96, 1024, 64, 1024]
    - [84, 46.558]
  - - [1536, 1536, 1, 8192]
    - [181, 63.838]
  - - [1536, 4608, 1, 8192]
    - [82, 89.085]
  - - [1536, 50304, 1, 8192]
    - [93, 91.473]
  - - [1536, 6144, 1, 8192]
    - [82, 80.196]
  - - [6144, 1536, 1, 8192]
    - [82, 80.56]
  - - [1024, 96, 128, 1024]
    - [53, 50.006]
  - - [96, 1024, 128, 1024]
    - [192, 49.92]
  - - [1024, 1024, 1, 16384]
    - [69, 58.213]
  - - [1024, 3072, 1, 16384]
    - [83, 82.459]
  - - [1024, 4096, 1, 16384]
    - [155, 85.475]
  - - [1024, 50304, 1, 16384]
    - [93, 91.972]
  - - [4096, 1024, 1, 16384]
    - [111, 83.746]
  - - [1024, 64, 256, 1024]
    - [42, 42.151]
  - - [64, 1024, 256, 1024]
    - [65, 43.584]
  - - [1024, 50304, 1, 2048]
    - [83, 75.961]
  - - [1024, 64, 32, 1024]
    - [193, 30.206]
  - - [64, 1024, 32, 1024]
    - [194, 33.144]
  - - [1024, 50304, 1, 4096]
    - [82, 84.34]
  - - [1024, 64, 64, 1024]
    - [42, 36.939]
  - - [64, 1024, 64, 1024]
    - [71, 39.534]
  - - [1024, 50304, 1, 8192]
    - [82, 89.465]
  - - [1024, 64, 128, 1024]
    - [42, 39.729]
  - - [64, 1024, 128, 1024]
    - [78, 42.709]
  - - [1024, 2, 1, 64]
    - [116, 0.014]
  - - [1024, 30528, 1, 8192]
    - [155, 90.853]
  - - [1024, 1024, 1, 64]
    - [132, 4.755]
  - - [64, 128, 1024, 128]
    - [52, 13.532]
  - - [128, 64, 1024, 128]
    - [135, 13.064]
  - - [1024, 1024, 1, 3456]
    - [69, 45.265]
  - - [1024, 1024, 1, 6912]
    - [69, 52.716]
  - - [1024, 1024, 1, 864]
    - [49, 26.581]
  - - [1024, 512, 1, 3456]
    - [42, 29.415]
  - - [1024, 512, 1, 4096]
    - [42, 30.704]
  - - [1024, 512, 1, 6912]
    - [195, 39.717]
  - - [1024, 512, 1, 864]
    - [23, 16.678]
  - - [256, 128, 1, 3456]
    - [35, 3.174]
  - - [256, 128, 1, 4096]
    - [34, 3.558]
  - - [256, 128, 1, 55296]
    - [159, 19.61]
  - - [256, 128, 1, 6912]
    - [159, 5.608]
  - - [256, 128, 1, 864]
    - [16, 1.375]
  - - [256, 3456, 1, 1]
    - [132, 0.071]
  - - [256, 4096, 1, 1]
    - [135, 0.08]
  - - [256, 6912, 1, 1]
    - [132, 0.11]
  - - [256, 864, 1, 1]
    - [125, 0.021]
  - - [480, 1024, 1, 3456]
    - [42, 26.508]
  - - [480, 1024, 1, 4096]
    - [196, 28.822]
  - - [480, 1024, 1, 6912]
    - [162, 38.354]
  - - [480, 1024, 1, 864]
    - [23, 15.238]
  - - [512, 256, 1, 3456]
    - [39, 10.352]
  - - [512, 256, 1, 4096]
    - [48, 11.391]
  - - [512, 256, 1, 55296]
    - [197, 39.089]
  - - [512, 256, 1, 6912]
    - [48, 14.945]
  - - [512, 256, 1, 864]
    - [28, 5.316]
  - - [30528, 1024, 1, 640]
    - [198, 46.639]
  - - [30528, 1024, 1, 1280]
    - [83, 62.518]
  - - [4096, 1024, 1, 10240]
    - [111, 81.464]
  - - [1024, 4096, 1, 10240]
    - [85, 82.463]
  - - [30528, 1024, 1, 1600]
    - [104, 67.31]
  - - [1024, 2, 1, 80]
    - [122, 0.016]
  - - [1024, 1024, 1, 10240]
    - [199, 59.243]
  - - [1024, 1024, 1, 80]
    - [130, 5.659]
  - - [64, 128, 1280, 128]
    - [200, 13.924]
  - - [128, 64, 1280, 128]
    - [21, 13.311]
  - - [1024, 4096, 1, 10496]
    - [155, 82.186]
  - - [30528, 1024, 1, 1640]
    - [86, 64.878]
  - - [4096, 1024, 1, 10496]
    - [91, 80.676]
  - - [1024, 1024, 1, 10496]
    - [199, 59.586]
  - - [1024, 1024, 1, 82]
    - [135, 5.236]
  - - [1024, 2, 1, 82]
    - [127, 0.015]
  - - [128, 64, 1312, 128]
    - [135, 13.214]
  - - [64, 128, 1312, 128]
    - [52, 13.852]
  - - [30528, 1024, 1, 160]
    - [76, 19.594]
  - - [1024, 4096, 1, 6144]
    - [155, 77.135]
  - - [30528, 1024, 1, 240]
    - [198, 26.267]
  - - [4096, 1024, 1, 6144]
    - [91, 77.341]
  - - [1024, 1024, 1, 12]
    - [130, 0.927]
  - - [1024, 2, 1, 12]
    - [127, 0.003]
  - - [1024, 1024, 1, 6144]
    - [69, 51.772]
  - - [64, 512, 192, 512]
    - [65, 32.117]
  - - [512, 64, 192, 512]
    - [42, 28.826]
  - - [3136, 64, 64, 128]
    - [141, 14.951]
  - - [3136, 64, 64, 256]
    - [31, 20.721]
  - - [3136, 128, 64, 256]
    - [65, 25.143]
  - - [784, 256, 64, 512]
    - [86, 41.981]
  - - [3136, 256, 64, 128]
    - [126, 18.763]
  - - [3136, 256, 64, 256]
    - [76, 30.822]
  - - [784, 512, 64, 256]
    - [75, 32.556]
  - - [784, 512, 64, 512]
    - [75, 48.588]
  - - [3136, 64, 32, 128]
    - [132, 13.803]
  - - [3136, 64, 32, 256]
    - [49, 20.356]
  - - [3136, 128, 32, 256]
    - [201, 24.487]
  - - [784, 256, 32, 512]
    - [60, 37.123]
  - - [3136, 256, 32, 128]
    - [23, 18.295]
  - - [3136, 256, 32, 256]
    - [76, 27.814]
  - - [784, 512, 32, 256]
    - [75, 29.544]
  - - [784, 512, 32, 512]
    - [75, 43.896]
  - - [3136, 256, 32, 64]
    - [139, 12.06]
  - - [3136, 64, 32, 64]
    - [132, 9.432]
  - - [784, 512, 32, 128]
    - [23, 18.999]
  - - [784, 128, 32, 512]
    - [51, 32.272]
  - - [3136, 64, 64, 64]
    - [136, 10.383]
  - - [3136, 256, 64, 64]
    - [141, 12.546]
  - - [784, 128, 64, 512]
    - [78, 34.625]
  - - [784, 512, 64, 128]
    - [202, 20.674]
  - - [64, 1280, 64, 192]
    - [52, 19.42]
  - - [64, 1280, 64, 320]
    - [96, 26.217]
  - - [64, 1280, 64, 384]
    - [52, 28.785]
  - - [64, 1280, 64, 448]
    - [65, 31.504]
  - - [64, 2048, 64, 192]
    - [51, 19.575]
  - - [64, 2048, 64, 320]
    - [51, 27.027]
  - - [64, 2048, 64, 384]
    - [65, 29.104]
  - - [64, 2048, 64, 448]
    - [65, 31.907]
  - - [64, 1280, 32, 192]
    - [52, 17.502]
  - - [64, 1280, 32, 320]
    - [96, 23.987]
  - - [64, 1280, 32, 384]
    - [52, 26.623]
  - - [64, 1280, 32, 448]
    - [52, 28.701]
  - - [64, 2048, 32, 192]
    - [62, 17.931]
  - - [64, 2048, 32, 320]
    - [203, 23.965]
  - - [64, 2048, 32, 384]
    - [62, 26.529]
  - - [64, 2048, 32, 448]
    - [62, 28.493]
  - - [1024, 1024, 1, 10224]
    - [163, 57.654]
  - - [1024, 1024, 1, 10192]
    - [163, 58.111]
  - - [1024, 1024, 1, 10208]
    - [163, 59.73]
  - - [1024, 4096, 1, 10224]
    - [155, 81.378]
  - - [4096, 1024, 1, 10224]
    - [91, 80.604]
  - - [1024, 3072, 1, 10224]
    - [82, 78.636]
  - - [1024, 3072, 1, 10240]
    - [104, 79.956]
  - - [4096, 1024, 1, 10192]
    - [111, 80.621]
  - - [1024, 3072, 1, 10192]
    - [82, 78.526]
  - - [1024, 4096, 1, 10192]
    - [155, 81.687]
  - - [1024, 3072, 1, 10200]
    - [101, 78.502]
  - - [1024, 1024, 1, 10184]
    - [204, 57.676]
  - - [4096, 1024, 1, 10208]
    - [111, 80.653]
  - - [1024, 3072, 1, 10208]
    - [83, 79.918]
  - - [1024, 4096, 1, 10208]
    - [155, 82.276]
  - - [1024, 2048, 1, 10224]
    - [205, 66.603]
  - - [1024, 2048, 1, 10240]
    - [205, 66.763]
  - - [1024, 1024, 1, 10120]
    - [163, 58.235]
  - - [1024, 2048, 1, 10192]
    - [205, 64.475]
  - - [64, 24, 6816, 24]
    - [132, 3.639]
  - - [1024, 1024, 1, 10152]
    - [199, 57.827]
  - - [1024, 3072, 1, 10080]
    - [82, 79.815]
  - - [64, 26, 6272, 26]
    - [131, 3.976]
  - - [100352, 256, 1, 512]
    - [90, 39.163]
  - - [12544, 1024, 1, 2048]
    - [82, 67.637]
  - - [12544, 147, 1, 64]
    - [132, 6.213]
  - - [200704, 256, 1, 512]
    - [90, 37.333]
  - - [25088, 512, 1, 1024]
    - [82, 53.987]
  - - [3136, 576, 1, 64]
    - [126, 6.545]
  - - [50176, 512, 1, 1024]
    - [75, 56.616]
  - - [6272, 1024, 1, 2048]
    - [83, 65.572]
  - - [784, 1152, 1, 128]
    - [73, 7.617]
  - - [3136, 256, 128, 128]
    - [126, 18.975]
  - - [3136, 256, 256, 128]
    - [76, 19.514]
  - - [3136, 256, 128, 64]
    - [139, 12.612]
  - - [3136, 256, 256, 64]
    - [138, 12.641]
  - - [3136, 64, 128, 256]
    - [31, 21.195]
  - - [3136, 64, 256, 256]
    - [29, 21.053]
  - - [3136, 64, 128, 64]
    - [136, 10.814]
  - - [3136, 64, 256, 64]
    - [138, 11.003]
  - - [784, 128, 128, 512]
    - [206, 37.593]
  - - [784, 128, 256, 512]
    - [206, 39.06]
  - - [784, 512, 128, 128]
    - [58, 21.515]
  - - [784, 512, 256, 128]
    - [51, 21.929]
  - - [784, 512, 128, 256]
    - [86, 34.407]
  - - [784, 512, 256, 256]
    - [75, 35.611]
  - - [64, 128, 2048, 128]
    - [207, 14.075]
  - - [128, 64, 2048, 128]
    - [23, 13.57]
  - - [30528, 1024, 1, 2560]
    - [104, 75.78]
  - - [1024, 1024, 1, 128]
    - [132, 8.087]
  - - [1024, 2, 1, 128]
    - [116, 0.025]
  - - [128, 64, 1536, 128]
    - [23, 13.274]
  - - [64, 128, 1536, 128]
    - [52, 13.737]
  - - [1024, 4096, 1, 12288]
    - [155, 83.43]
  - - [30528, 1024, 1, 1920]
    - [104, 70.891]
  - - [1024, 1024, 1, 96]
    - [134, 6.481]
  - - [1024, 1024, 1, 12288]
    - [163, 59.544]
  - - [4096, 1024, 1, 12288]
    - [111, 81.521]
  - - [1024, 2, 1, 96]
    - [116, 0.02]
  - - [25600, 128, 25, 128]
    - [208, 17.664]
  - - [12544, 128, 36, 128]
    - [208, 16.953]
  - - [9216, 128, 49, 128]
    - [208, 17.096]
  - - [6400, 128, 64, 128]
    - [208, 17.133]
  - - [6400, 256, 25, 256]
    - [59, 29.432]
  - - [4096, 256, 36, 256]
    - [83, 31.001]
  - - [2304, 256, 49, 256]
    - [59, 28.864]
  - - [2304, 256, 64, 256]
    - [59, 29.57]
  - - [2304, 512, 25, 512]
    - [59, 44.198]
  - - [1024, 512, 36, 512]
    - [59, 42.882]
  - - [1024, 512, 49, 512]
    - [55, 44.026]
  - - [1024, 512, 64, 512]
    - [59, 45.108]
  - - [92416, 64, 25, 64]
    - [209, 8.362]
  - - [50176, 64, 36, 64]
    - [131, 8.681]
  - - [36864, 64, 49, 64]
    - [140, 8.723]
  - - [25600, 64, 64, 64]
    - [140, 8.988]
  - - [64, 128, 192, 128]
    - [51, 9.862]
  - - [128, 64, 192, 128]
    - [135, 9.412]
  - - [768, 2, 1, 2048]
    - [27, 0.11]
  - - [3072, 768, 1, 2048]
    - [55, 53.007]
  - - [768, 3072, 1, 2048]
    - [63, 53.319]
  - - [768, 768, 1, 2048]
    - [31, 28.413]
  - - [64, 384, 144, 384]
    - [54, 27.195]
  - - [384, 64, 144, 384]
    - [193, 24.655]
  - - [768, 2, 1, 4608]
    - [210, 0.213]
  - - [3072, 768, 1, 4608]
    - [55, 60.908]
  - - [768, 3072, 1, 4608]
    - [56, 60.757]
  - - [768, 768, 1, 4608]
    - [162, 35.773]
  - - [64, 512, 48, 512]
    - [65, 26.452]
  - - [512, 64, 48, 512]
    - [63, 21.1]
  - - [64, 128, 256, 128]
    - [52, 10.84]
  - - [128, 64, 256, 128]
    - [49, 10.465]
  - - [64, 384, 192, 384]
    - [52, 27.439]
  - - [384, 64, 192, 384]
    - [193, 23.251]
  - - [1024, 2, 1, 4608]
    - [154, 0.287]
  - - [4096, 1024, 1, 4608]
    - [111, 73.69]
  - - [1024, 4096, 1, 4608]
    - [155, 73.515]
  - - [1024, 1024, 1, 4608]
    - [69, 48.389]
  - - [13, 512, 1, 3456]
    - [115, 0.706]
  - - [13, 512, 1, 4096]
    - [158, 0.832]
  - - [13, 512, 1, 55296]
    - [158, 4.057]
  - - [13, 512, 1, 6912]
    - [158, 1.343]
  - - [13, 512, 1, 864]
    - [28, 0.262]
  - - [196, 512, 64, 1024]
    - [75, 45.126]
  - - [196, 1024, 64, 512]
    - [86, 37.998]
  - - [196, 1024, 64, 1024]
    - [86, 49.679]
  - - [49, 1024, 64, 2048]
    - [65, 32.456]
  - - [49, 2048, 64, 1024]
    - [211, 28.379]
  - - [196, 512, 32, 1024]
    - [75, 36.322]
  - - [196, 1024, 32, 512]
    - [75, 33.927]
  - - [196, 1024, 32, 1024]
    - [75, 45.514]
  - - [49, 1024, 32, 2048]
    - [212, 26.788]
  - - [49, 2048, 32, 1024]
    - [65, 26.257]
  - - [196, 1024, 32, 256]
    - [213, 22.535]
  - - [196, 256, 32, 1024]
    - [106, 31.504]
  - - [49, 2048, 32, 512]
    - [214, 18.806]
  - - [49, 512, 32, 2048]
    - [65, 20.837]
  - - [196, 256, 64, 1024]
    - [75, 35.217]
  - - [196, 1024, 64, 256]
    - [106, 25.8]
  - - [49, 512, 64, 2048]
    - [212, 26.257]
  - - [49, 2048, 64, 512]
    - [65, 20.582]
  - - [1225, 192, 64, 32]
    - [187, 5.931]
  - - [1225, 192, 64, 48]
    - [209, 7.934]
  - - [1225, 192, 64, 64]
    - [187, 10.387]
  - - [1225, 256, 64, 48]
    - [215, 8.198]
  - - [1225, 256, 64, 64]
    - [187, 10.849]
  - - [1225, 288, 64, 48]
    - [209, 8.497]
  - - [1225, 288, 64, 64]
    - [209, 10.477]
  - - [5329, 64, 64, 80]
    - [216, 11.053]
  - - [289, 768, 64, 128]
    - [187, 15.578]
  - - [289, 768, 64, 160]
    - [217, 18.109]
  - - [289, 768, 64, 192]
    - [65, 20.678]
  - - [1225, 192, 32, 32]
    - [187, 5.289]
  - - [1225, 192, 32, 48]
    - [209, 7.128]
  - - [1225, 192, 32, 64]
    - [87, 9.183]
  - - [1225, 256, 32, 48]
    - [216, 7.537]
  - - [1225, 256, 32, 64]
    - [187, 9.792]
  - - [1225, 288, 32, 48]
    - [209, 7.719]
  - - [1225, 288, 32, 64]
    - [209, 9.703]
  - - [5329, 64, 32, 80]
    - [216, 10.454]
  - - [289, 768, 32, 128]
    - [187, 13.879]
  - - [289, 768, 32, 160]
    - [187, 16.393]
  - - [289, 768, 32, 192]
    - [65, 18.247]
  - - [196, 2304, 1, 256]
    - [218, 7.196]
  - - [49, 4608, 1, 512]
    - [219, 6.058]
  - - [196, 1024, 128, 256]
    - [57, 27.638]
  - - [196, 1024, 256, 256]
    - [57, 28.417]
  - - [196, 1024, 128, 512]
    - [86, 40.858]
  - - [196, 1024, 256, 512]
    - [75, 42.719]
  - - [196, 256, 128, 1024]
    - [86, 43.922]
  - - [196, 256, 256, 1024]
    - [75, 47.075]
  - - [49, 2048, 128, 512]
    - [211, 22.072]
  - - [49, 2048, 256, 512]
    - [220, 23.275]
  - - [49, 512, 128, 2048]
    - [65, 31.625]
  - - [49, 512, 256, 2048]
    - [65, 34.592]
  - - [3072, 3072, 1, 1024]
    - [223, 58.662]
  - - [5120, 5120, 1, 1024]
    - [223, 65.222]
  - - [6144, 6144, 1, 1024]
    - [223, 68.941]
  - - [7168, 7168, 1, 1024]
    - [223, 70.383]
  - - [8192, 8192, 1, 1024]
    - [223, 72.419]
  - - [9216, 9216, 1, 1024]
    - [224, 72.557]
  - - [10240, 10240, 1, 1024]
    - [225, 72.985]
  - - [11264, 11264, 1, 1024]
    - [223, 73.999]
  - - [12288, 12288, 1, 1024]
    - [223, 74.315]
  - - [13312, 13312, 1, 1024]
    - [223, 74.732]
  - - [14336, 14336, 1, 1024]
    - [223, 74.424]
  - - [15360, 15360, 1, 1024]
    - [223, 74.975]
  - - [16384, 16384, 1, 1024]
    - [223, 75.19]
  - - [17408, 17408, 1, 1024]
    - [223, 75.08]
  - - [18432, 18432, 1, 1024]
    - [223, 74.957]
  - - [19456, 19456, 1, 1024]
    - [223, 75.3]
  - - [20480, 20480, 1, 1024]
    - [226, 75.324]
  - - [21504, 21504, 1, 1024]
    - [223, 75.443]
  - - [22528, 22528, 1, 1024]
    - [223, 75.604]
  - - [23552, 23552, 1, 1024]
    - [223, 75.397]
  - - [24576, 24576, 1, 1024]
    - [223, 75.484]
  - - [25600, 25600, 1, 1024]
    - [223, 75.533]
  - - [26624, 26624, 1, 1024]
    - [223, 75.633]
  - - [27648, 27648, 1, 1024]
    - [223, 75.488]
  - - [28672, 28672, 1, 1024]
    - [223, 75.514]
  - - [29696, 29696, 1, 1024]
    - [223, 75.618]
  - - [30720, 30720, 1, 1024]
    - [223, 75.669]
  - - [31744, 31744, 1, 1024]
    - [223, 75.686]
  - - [32768, 32768, 1, 1024]
    - [223, 75.721]
  - - [33792, 33792, 1, 1024]
    - [223, 75.719]
  - - [34816, 34816, 1, 1024]
    - [223, 75.71]
  - - [35840, 35840, 1, 1024]
    - [223, 75.702]
  - - [36864, 36864, 1, 1024]
    - [223, 75.755]
  - - [37888, 37888, 1, 1024]
    - [223, 75.721]
  - - [38912, 38912, 1, 1024]
    - [223, 75.834]
  - - [39936, 39936, 1, 1024]
    - [223, 75.792]
  - - [40960, 40960, 1, 1024]
    - [226, 75.679]
  - - [41984, 41984, 1, 1024]
    - [223, 75.716]
  - - [43008, 43008, 1, 1024]
    - [223, 75.774]
  - - [44032, 44032, 1, 1024]
    - [223, 75.826]
  - - [45056, 45056, 1, 1024]
    - [223, 75.828]
  - - [46080, 46080, 1, 1024]
    - [223, 75.867]
  - - [47104, 47104, 1, 1024]
    - [223, 75.873]
  - - [48128, 48128, 1, 1024]
    - [223, 75.879]
  - - [49152, 49152, 1, 1024]
    - [223, 75.836]
  - - [50176, 50176, 1, 1024]
    - [223, 75.808]
  - - [51200, 51200, 1, 1024]
    - [223, 75.879]
  - - [52224, 52224, 1, 1024]
    - [223, 75.878]
  - - [53248, 53248, 1, 1024]
    - [223, 75.839]
  - - [54272, 54272, 1, 1024]
    - [223, 75.9]
  - - [55296, 55296, 1, 1024]
    - [223, 75.824]
  - - [56320, 56320, 1, 1024]
    - [223, 75.796]
  - - [57344, 57344, 1, 1024]
    - [223, 75.862]
  - - [58368, 58368, 1, 1024]
    - [223, 75.825]
  - - [59392, 59392, 1, 1024]
    - [223, 75.913]
  - - [60416, 60416, 1, 1024]
    - [223, 75.899]
  - - [61440, 61440, 1, 1024]
    - [223, 75.888]
  - - [62464, 62464, 1, 1024]
    - [223, 75.915]
  - - [63488, 63488, 1, 1024]
    - [223, 75.869]
  - - [64512, 64512, 1, 1024]
    - [223, 75.947]
  - - [65536, 65536, 1, 1024]
    - [223, 75.943]
  - - [66560, 66560, 1, 1024]
    - [223, 75.952]
  - - [67584, 67584, 1, 1024]
    - [223, 75.949]
  - - [68608, 68608, 1, 1024]
    - [223, 75.958]
  - - [69632, 69632, 1, 1024]
    - [223, 75.957]
  - - [70656, 70656, 1, 1024]
    - [223, 75.959]
  - - [71680, 71680, 1, 1024]
    - [223, 75.916]
  - - [72704, 72704, 1, 1024]
    - [223, 75.92]
  - - [73728, 73728, 1, 1024]
    - [223, 75.953]
  - - [74752, 74752, 1, 1024]
    - [223, 75.94]
  - - [75776, 75776, 1, 1024]
    - [223, 75.945]
  - - [76800, 76800, 1, 1024]
    - [223, 75.949]
  - - [77824, 77824, 1, 1024]
    - [223, 75.934]
  - - [78848, 78848, 1, 1024]
    - [223, 75.948]
  - - [79872, 79872, 1, 1024]
    - [223, 75.969]
  - - [80896, 80896, 1, 1024]
    - [226, 75.765]
  - - [81920, 81920, 1, 1024]
    - [223, 75.976]
  - - [82944, 82944, 1, 1024]
    - [223, 75.953]
  - - [83968, 83968, 1, 1024]
    - [223, 75.944]
  - - [84992, 84992, 1, 1024]
    - [223, 75.953]
  - - [86016, 86016, 1, 1024]
    - [223, 75.969]
  - - [87040, 87040, 1, 1024]
    - [223, 75.986]
  - - [88064, 88064, 1, 1024]
    - [223, 75.978]
  - - [89088, 89088, 1, 1024]
    - [227, 75.82]
  - - [90112, 90112, 1, 1024]
    - [223, 75.934]
- null
