library/src/blas3/Tensile/Logic/asm_full/aldebaran_Cijk_Ailk_Bjlk_4xi8BH.yaml
- {MinimumRequiredVersion: 4.6.0}
- aldebaran
- gfx90a
- [Device 0050, Device 0051, Device 0052, Device 0054, Device 0062, Device 7400, Device
    SolutionIndex: 0
    SolutionNameMin: Cijk_Ailk_Bjlk_4xi8BH_MT16x16x16_SN_AMAS3_BL1_EPS1_GRVW2_GSU1_ISA90a_KLA_LRVW2_MAC_NLCA1_SNLL1_TT2_2_USFGRO1_VW2_WG8_8_4_WGM1
    SolutionIndex: 1
    SolutionNameMin: Cijk_Ailk_Bjlk_4xi8BH_MT16x16x32_SN_AMAS3_BL1_EPS1_GRVW2_GSU4_ISA90a_KLA_LRVW2_MAC_NLCA1_SNLL0_TT2_2_USFGRO0_VW2_WG8_8_4_WGM1
    SolutionIndex: 2
    SolutionNameMin: Cijk_Ailk_Bjlk_4xi8BH_MT64x64x16_SN_AMAS3_BL1_EPS1_GRVW4_GSU1_ISA90a_KLA_LRVW4_MAC_NLCA1_SNLL1_TT4_4_USFGRO0_VW4_WG16_16_1_WGM1
    SolutionIndex: 3
    SolutionNameMin: Cijk_Ailk_Bjlk_4xi8BH_MT64x64x16_SN_AMAS3_BL1_EPS1_GRVW4_GSU1_ISA90a_KLA_LRVW4_MAC_NLCA1_SNLL1_TT4_4_USFGRO0_VW4_WG16_16_1_WGM8
    SolutionIndex: 4
    SolutionNameMin: Cijk_Ailk_Bjlk_4xi8BH_MT32x32x32_SN_AMAS3_BL1_EPS1_GRVW4_GSU2_ISA90a_KLA_LRVW4_MAC_NLCA1_SNLL0_TT4_4_USFGRO0_VW4_WG8_8_4_WGM8
    SolutionIndex: 5
    SolutionNameMin: Cijk_Ailk_Bjlk_4xi8BH_MT128x64x16_SN_AMAS3_BL1_EPS1_GRVW4_GSU1_ISA90a_KLA_LRVW4_MAC_NLCA1_SNLL1_TT8_4_USFGRO0_VW4_WG16_16_1_WGM1
    SolutionIndex: 6
    SolutionNameMin: Cijk_Ailk_Bjlk_4xi8BH_MT16x16x32_SN_AMAS3_BL1_EPS1_GRVW2_GSU4_ISA90a_KLA_LRVW2_MAC_NLCA1_SNLL0_TT2_2_USFGRO0_VW2_WG8_8_4_WGM8
    SolutionIndex: 7
    SolutionNameMin: Cijk_Ailk_Bjlk_4xi8BH_MT128x128x16_SN_AMAS3_BL1_EPS1_GRVW4_GSU1_ISA90a_KLA_LRVW4_MAC_NLCA1_SNLL1_TT8_8_USFGRO0_VW4_WG16_16_1_WGM1
    SolutionIndex: 8
    SolutionNameMin: Cijk_Ailk_Bjlk_4xi8BH_MT128x128x16_SN_AMAS3_BL1_EPS1_GRVW4_GSU1_ISA90a_KLA_LRVW4_MAC_NLCA1_SNLL1_TT8_8_USFGRO0_VW4_WG16_16_1_WGM8
    SolutionIndex: 9
    SolutionNameMin: Cijk_Ailk_Bjlk_4xi8BH_MT16x16x8_SN_AMAS3_BL1_EPS1_GRVW2_GSU4_ISA90a_KLA_LRVW2_MAC_NLCA1_SNLL0_TT2_2_USFGRO1_VW2_WG8_8_2_WGM1
    SolutionIndex: 10
    SolutionNameMin: Cijk_Ailk_Bjlk_4xi8BH_MT16x16x32_SN_AMAS3_BL1_EPS1_GRVW2_GSU2_ISA90a_KLA_LRVW2_MAC_NLCA1_SNLL0_TT2_2_USFGRO0_VW2_WG8_8_4_WGM1
    SolutionIndex: 11
    SolutionNameMin: Cijk_Ailk_Bjlk_4xi8BH_MT32x32x32_SN_AMAS3_BL1_EPS1_GRVW4_GSU2_ISA90a_KLA_LRVW4_MAC_NLCA1_SNLL0_TT4_4_USFGRO0_VW4_WG8_8_4_WGM1
    SolutionIndex: 12
    SolutionNameMin: Cijk_Ailk_Bjlk_4xi8BH_MT32x16x32_SN_AMAS3_BL1_EPS1_GRVW2_GSU2_ISA90a_KLA_LRVW2_MAC_NLCA1_SNLL0_TT4_2_USFGRO0_VW2_WG8_8_4_WGM1
    SolutionIndex: 13
    SolutionNameMin: Cijk_Ailk_Bjlk_4xi8BH_MT32x16x8_SN_AMAS3_BL1_EPS1_GRVW2_GSU2_ISA90a_KLA_LRVW2_MAC_NLCA1_SNLL0_TT4_2_USFGRO0_VW2_WG8_8_2_WGM1
    SolutionIndex: 14
    SolutionNameMin: Cijk_Ailk_Bjlk_4xi8BH_MT32x16x32_SN_AMAS3_BL1_EPS1_GRVW2_GSU4_ISA90a_KLA_LRVW2_MAC_NLCA1_SNLL0_TT4_2_USFGRO0_VW2_WG8_8_4_WGM1
    SolutionIndex: 15
    SolutionNameMin: Cijk_Ailk_Bjlk_4xi8BH_MT32x8x32_SN_AMAS3_BL1_EPS1_GRVW2_GSU2_ISA90a_KLA_LRVW2_MAC_NLCA1_SNLL0_TT2_2_USFGRO0_VW2_WG16_4_4_WGM1
    SolutionIndex: 16
    SolutionNameMin: Cijk_Ailk_Bjlk_4xi8BH_MT16x16x16_SN_AMAS3_BL1_EPS1_GRVW2_GSU16_ISA90a_KLA_LRVW2_MAC_NLCA1_SNLL0_TT2_2_USFGRO1_VW2_WG8_8_4_WGM1
    SolutionIndex: 17
    SolutionNameMin: Cijk_Ailk_Bjlk_4xi8BH_MT8x8x8_SN_AMAS3_BL1_EPS1_GRVW2_GSU8_ISA90a_KLA_LRVW2_MAC_NLCA1_SNLL0_TT2_2_USFGRO1_VW2_WG4_4_4_WGM1
    SolutionIndex: 18
    SolutionNameMin: Cijk_Ailk_Bjlk_4xi8BH_MT16x16x8_SN_AMAS3_BL1_EPS1_GRVW2_GSU1_ISA90a_KLA_LRVW2_MAC_NLCA1_SNLL1_TT2_2_USFGRO1_VW2_WG8_8_2_WGM1
    SolutionIndex: 19
    SolutionNameMin: Cijk_Ailk_Bjlk_4xi8BH_MT32x16x8_SN_AMAS2_BL0_EPS0_GRVW2_GSU1_ISA000_KLS_LRVW2_FMA_NLCA1_SNLL0_TT2_2_USFGRO0_VW2_WG16_8_1_WGM1
    SolutionIndex: 20
    SolutionNameMin: Cijk_Ailk_Bjlk_4xi8BH_MT16x16x8_SN_AMAS3_BL1_EPS1_GRVW2_GSU8_ISA90a_KLA_LRVW2_MAC_NLCA1_SNLL0_TT2_2_USFGRO1_VW2_WG8_8_2_WGM1
    SolutionIndex: 21
    SolutionNameMin: Cijk_Ailk_Bjlk_4xi8BH_MT32x16x16_SN_AMAS2_BL0_EPS0_GRVW2_GSU1_ISA000_KLS_LRVW2_FMA_NLCA1_SNLL0_TT2_2_USFGRO0_VW2_WG16_8_1_WGM1
    SolutionIndex: 22
    SolutionNameMin: Cijk_Ailk_Bjlk_4xi8BH_MT32x32x32_SN_AMAS3_BL1_EPS1_GRVW4_GSU4_ISA90a_KLA_LRVW4_MAC_NLCA1_SNLL0_TT4_4_USFGRO0_VW4_WG8_8_4_WGM8
    SolutionIndex: 23
    SolutionNameMin: Cijk_Ailk_Bjlk_4xi8BH_MT16x16x16_SN_AMAS3_BL1_EPS1_GRVW2_GSU8_ISA90a_KLA_LRVW2_MAC_NLCA1_SNLL0_TT2_2_USFGRO1_VW2_WG8_8_4_WGM1
    SolutionIndex: 24
    SolutionNameMin: Cijk_Ailk_Bjlk_4xi8BH_MT16x16x32_SN_AMAS3_BL1_EPS1_GRVW2_GSU8_ISA90a_KLA_LRVW2_MAC_NLCA1_SNLL0_TT2_2_USFGRO0_VW2_WG8_8_4_WGM1
    SolutionIndex: 25
    SolutionNameMin: Cijk_Ailk_Bjlk_4xi8BH_MT16x16x8_SN_AMAS2_BL0_EPS0_GRVW2_GSU1_ISA000_KLS_LRVW2_FMA_NLCA1_SNLL0_TT2_2_USFGRO0_VW2_WG8_8_1_WGM1
    SolutionIndex: 26
    SolutionNameMin: Cijk_Ailk_Bjlk_4xi8BH_MT32x8x32_SN_AMAS3_BL1_EPS1_GRVW2_GSU4_ISA90a_KLA_LRVW2_MAC_NLCA1_SNLL0_TT2_2_USFGRO0_VW2_WG16_4_4_WGM8
    SolutionIndex: 27
    SolutionNameMin: Cijk_Ailk_Bjlk_4xi8BH_MT32x16x16_SN_AMAS3_BL1_EPS1_GRVW2_GSU2_ISA90a_KLA_LRVW2_MAC_NLCA1_SNLL0_TT4_2_USFGRO0_VW2_WG8_8_4_WGM1
    SolutionIndex: 28
    SolutionNameMin: Cijk_Ailk_Bjlk_4xi8BH_MT8x8x8_SN_AMAS3_BL1_EPS1_GRVW2_GSU16_ISA90a_KLA_LRVW2_MAC_NLCA1_SNLL0_TT2_2_USFGRO1_VW2_WG4_4_4_WGM1
    SolutionIndex: 29
    SolutionNameMin: Cijk_Ailk_Bjlk_4xi8BH_MT32x16x16_SN_AMAS3_BL1_EPS1_GRVW2_GSU8_ISA90a_KLA_LRVW2_MAC_NLCA1_SNLL0_TT4_2_USFGRO0_VW2_WG8_8_4_WGM8
    SolutionIndex: 30
    SolutionNameMin: Cijk_Ailk_Bjlk_4xi8BH_MT32x32x32_SN_AMAS3_BL1_EPS1_GRVW4_GSU4_ISA90a_KLA_LRVW4_MAC_NLCA1_SNLL0_TT4_4_USFGRO0_VW4_WG8_8_4_WGM1
    SolutionIndex: 31
    SolutionNameMin: Cijk_Ailk_Bjlk_4xi8BH_MT16x16x16_SN_AMAS3_BL1_EPS1_GRVW2_GSU2_ISA90a_KLA_LRVW2_MAC_NLCA1_SNLL0_TT2_2_USFGRO1_VW2_WG8_8_4_WGM1
    SolutionIndex: 32
    SolutionNameMin: Cijk_Ailk_Bjlk_4xi8BH_MT32x16x16_SN_AMAS3_BL1_EPS1_GRVW2_GSU4_ISA90a_KLA_LRVW2_MAC_NLCA1_SNLL0_TT4_2_USFGRO0_VW2_WG8_8_4_WGM1
    SolutionIndex: 33
    SolutionNameMin: Cijk_Ailk_Bjlk_4xi8BH_MT32x16x32_SN_AMAS3_BL1_EPS1_GRVW2_GSU2_ISA90a_KLA_LRVW2_MAC_NLCA1_SNLL0_TT4_2_USFGRO0_VW2_WG8_8_4_WGM8
    SolutionIndex: 34
    SolutionNameMin: Cijk_Ailk_Bjlk_4xi8BH_MT16x16x16_SN_AMAS2_BL0_EPS0_GRVW2_GSU1_ISA000_KLS_LRVW2_FMA_NLCA1_SNLL0_TT2_2_USFGRO0_VW2_WG8_8_1_WGM1
    SolutionIndex: 35
    SolutionNameMin: Cijk_Ailk_Bjlk_4xi8BH_MT16x16x4_SN_AMAS3_BL1_EPS1_GRVW2_GSU8_ISA90a_KLA_LRVW2_MAC_NLCA1_SNLL0_TT2_2_USFGRO1_VW2_WG8_8_1_WGM1
    SolutionIndex: 36
    SolutionNameMin: Cijk_Ailk_Bjlk_4xi8BH_MT128x64x16_SN_AMAS3_BL1_EPS1_GRVW4_GSU1_ISA90a_KLA_LRVW4_MAC_NLCA1_SNLL1_TT8_4_USFGRO0_VW4_WG16_16_1_WGM8
    SolutionIndex: 37
    SolutionNameMin: Cijk_Ailk_Bjlk_4xi8BH_MT64x32x32_SN_AMAS3_BL1_EPS1_GRVW4_GSU2_ISA90a_KLA_LRVW4_MAC_NLCA1_SNLL0_TT8_4_USFGRO0_VW4_WG8_8_4_WGM1
    SolutionIndex: 38
    SolutionNameMin: Cijk_Ailk_Bjlk_4xi8BH_MT16x16x8_SN_AMAS3_BL1_EPS1_GRVW2_GSU16_ISA90a_KLA_LRVW2_MAC_NLCA1_SNLL0_TT2_2_USFGRO1_VW2_WG8_8_2_WGM1
    SolutionIndex: 39
    SolutionNameMin: Cijk_Ailk_Bjlk_4xi8BH_MT32x32x16_SN_AMAS3_BL1_EPS1_GRVW4_GSU2_ISA90a_KLA_LRVW4_MAC_NLCA1_SNLL0_TT4_4_USFGRO0_VW4_WG8_8_2_WGM1
    SolutionIndex: 40
    SolutionNameMin: Cijk_Ailk_Bjlk_4xi8BH_MT16x16x16_SN_AMAS3_BL1_EPS1_GRVW2_GSU4_ISA90a_KLA_LRVW2_MAC_NLCA1_SNLL0_TT2_2_USFGRO1_VW2_WG8_8_4_WGM1
    SolutionIndex: 41
    SolutionNameMin: Cijk_Ailk_Bjlk_4xi8BH_MT8x8x8_SN_AMAS3_BL1_EPS1_GRVW2_GSU1_ISA90a_KLA_LRVW2_MAC_NLCA1_SNLL1_TT2_2_USFGRO1_VW2_WG4_4_4_WGM1
    SolutionIndex: 42
    SolutionNameMin: Cijk_Ailk_Bjlk_4xi8BH_MT64x16x16_SN_AMAS3_BL1_EPS1_GRVW4_GSU2_ISA90a_KLA_LRVW4_MAC_NLCA1_SNLL0_TT4_4_USFGRO0_VW4_WG16_4_4_WGM1
- - - [1024, 128, 1, 128]
    - [0, 5.973]
  - - [4, 704, 1, 1280]
    - [1, 1.139]
  - - [4, 1856, 1, 3328]
    - [1, 4.157]
  - - [1856, 448, 1, 3328]
    - [2, 58.734]
  - - [2944, 4288, 1, 1280]
    - [3, 69.773]
  - - [2368, 64, 1, 3328]
    - [4, 40.669]
  - - [2368, 5888, 1, 256]
    - [2, 62.533]
  - - [128, 64, 1, 256]
    - [1, 0.784]
  - - [5888, 1024, 1, 1280]
    - [5, 66.623]
  - - [128, 6784, 1, 3328]
    - [3, 60.361]
  - - [64, 4, 1, 256]
    - [6, 0.02]
  - - [5888, 1856, 1, 3328]
    - [3, 71.779]
  - - [5056, 704, 1, 256]
    - [3, 60.322]
  - - [5888, 2944, 1, 3328]
    - [7, 74.927]
  - - [1856, 4288, 1, 256]
    - [2, 63.994]
  - - [1024, 5056, 1, 128]
    - [3, 55.685]
  - - [5056, 5056, 1, 3328]
    - [8, 74.032]
  - - [1408, 5888, 1, 1280]
    - [7, 67.053]
  - - [2368, 448, 1, 128]
    - [2, 28.529]
  - - [1024, 3584, 1, 3328]
    - [3, 64.473]
  - - [4, 2944, 1, 1280]
    - [9, 3.002]
  - - [1408, 64, 1, 128]
    - [0, 3.838]
  - - [256, 4288, 1, 3328]
    - [4, 58.289]
  - - [5888, 1408, 1, 1280]
    - [3, 70.188]
  - - [704, 1856, 1, 3328]
    - [3, 66.033]
  - - [4, 1408, 1, 128]
    - [10, 0.29]
  - - [1024, 2368, 1, 256]
    - [3, 49.609]
  - - [1408, 1856, 1, 1280]
    - [3, 65.448]
  - - [1408, 64, 1, 1280]
    - [11, 21.768]
  - - [448, 1024, 1, 1280]
    - [11, 41.214]
  - - [256, 1408, 1, 3328]
    - [11, 48.513]
  - - [5056, 5056, 1, 1280]
    - [3, 71.969]
  - - [448, 5056, 1, 256]
    - [3, 47.11]
  - - [704, 1856, 1, 1280]
    - [3, 59.833]
  - - [128, 5056, 1, 128]
    - [2, 17.946]
  - - [2368, 128, 1, 256]
    - [0, 13.679]
  - - [1856, 1408, 1, 128]
    - [2, 43.782]
  - - [64, 5056, 1, 256]
    - [0, 15.601]
  - - [6784, 256, 1, 3328]
    - [5, 64.466]
  - - [6784, 4288, 1, 3328]
    - [8, 74.575]
  - - [4288, 448, 1, 256]
    - [3, 45.361]
  - - [64, 704, 1, 128]
    - [12, 1.95]
  - - [1856, 2368, 1, 3328]
    - [2, 70.445]
  - - [4288, 2944, 1, 1280]
    - [3, 70.888]
  - - [704, 5056, 1, 1280]
    - [3, 68.256]
  - - [2368, 704, 1, 3328]
    - [2, 64.359]
  - - [256, 5888, 1, 256]
    - [13, 25.112]
  - - [1856, 4288, 1, 3328]
    - [2, 71.316]
  - - [256, 2944, 1, 256]
    - [2, 35.591]
  - - [5888, 1024, 1, 256]
    - [3, 60.872]
  - - [448, 64, 1, 1280]
    - [14, 9.568]
  - - [448, 5056, 1, 3328]
    - [4, 61.308]
  - - [3584, 4, 1, 1280]
    - [15, 3.584]
  - - [2944, 64, 1, 256]
    - [0, 11.05]
  - - [128, 4, 1, 1280]
    - [16, 0.169]
  - - [1408, 2944, 1, 256]
    - [3, 58.336]
  - - [256, 1856, 1, 1280]
    - [11, 41.682]
  - - [6784, 5056, 1, 3328]
    - [8, 74.899]
  - - [5056, 5056, 1, 256]
    - [2, 69.846]
  - - [1408, 6784, 1, 128]
    - [3, 60.147]
  - - [64, 1024, 1, 1280]
    - [14, 13.657]
  - - [2944, 4, 1, 256]
    - [15, 0.927]
  - - [704, 5056, 1, 128]
    - [2, 50.391]
  - - [4, 2368, 1, 1280]
    - [17, 2.64]
  - - [2368, 2944, 1, 1280]
    - [2, 68.373]
  - - [128, 3584, 1, 1280]
    - [11, 42.987]
  - - [6784, 6784, 1, 1280]
    - [7, 75.852]
  - - [1024, 256, 1, 3328]
    - [4, 45.438]
  - - [1408, 4288, 1, 1280]
    - [5, 69.332]
  - - [3584, 4288, 1, 1280]
    - [8, 72.303]
  - - [2368, 704, 1, 1280]
    - [2, 60.757]
  - - [5056, 4288, 1, 3328]
    - [3, 73.012]
  - - [3584, 2368, 1, 3328]
    - [3, 70.468]
  - - [64, 704, 1, 1280]
    - [12, 13.698]
  - - [4288, 256, 1, 256]
    - [3, 36.752]
  - - [2944, 128, 1, 128]
    - [18, 11.447]
  - - [6784, 448, 1, 1280]
    - [2, 66.54]
  - - [1408, 2944, 1, 128]
    - [2, 50.043]
  - - [4288, 2944, 1, 256]
    - [2, 61.394]
  - - [5888, 704, 1, 1280]
    - [2, 64.111]
  - - [1856, 64, 1, 1280]
    - [11, 23.03]
  - - [448, 5888, 1, 128]
    - [2, 44.29]
  - - [5888, 64, 1, 3328]
    - [3, 34.703]
  - - [2944, 256, 1, 3328]
    - [4, 56.226]
  - - [1024, 64, 1, 128]
    - [0, 2.912]
  - - [5056, 2368, 1, 1280]
    - [8, 70.912]
  - - [448, 3584, 1, 1280]
    - [3, 58.974]
  - - [6784, 5888, 1, 256]
    - [2, 70.294]
  - - [704, 1024, 1, 128]
    - [19, 14.794]
  - - [704, 128, 1, 1280]
    - [11, 18.482]
  - - [5888, 2944, 1, 128]
    - [3, 56.004]
  - - [4, 3584, 1, 128]
    - [0, 0.692]
  - - [1408, 448, 1, 1280]
    - [4, 44.486]
  - - [1024, 1408, 1, 256]
    - [0, 24.738]
  - - [2368, 2368, 1, 3328]
    - [2, 68.844]
  - - [1856, 6784, 1, 128]
    - [3, 61.279]
  - - [5056, 704, 1, 3328]
    - [3, 70.578]
  - - [1408, 1856, 1, 256]
    - [3, 52.302]
  - - [1408, 704, 1, 3328]
    - [4, 57.995]
  - - [2368, 5056, 1, 256]
    - [3, 65.995]
  - - [5888, 1856, 1, 256]
    - [2, 65.485]
  - - [4288, 64, 1, 3328]
    - [4, 47.58]
  - - [2368, 4, 1, 1280]
    - [20, 2.7]
  - - [704, 5888, 1, 256]
    - [3, 58.955]
  - - [4288, 64, 1, 256]
    - [21, 13.987]
  - - [6784, 64, 1, 256]
    - [3, 23.527]
  - - [2944, 256, 1, 256]
    - [2, 27.033]
  - - [2944, 6784, 1, 3328]
    - [2, 73.119]
  - - [704, 1408, 1, 3328]
    - [4, 57.995]
  - - [3584, 704, 1, 3328]
    - [2, 66.429]
  - - [2944, 256, 1, 128]
    - [2, 24.602]
  - - [6784, 4, 1, 1280]
    - [15, 6.339]
  - - [1024, 64, 1, 1280]
    - [11, 16.183]
  - - [448, 4288, 1, 256]
    - [2, 47.761]
  - - [64, 3584, 1, 3328]
    - [22, 42.144]
  - - [704, 2368, 1, 1280]
    - [3, 60.643]
  - - [448, 2944, 1, 128]
    - [2, 29.014]
  - - [1856, 2368, 1, 1280]
    - [2, 67.998]
  - - [2368, 128, 1, 3328]
    - [22, 49.484]
  - - [2944, 128, 1, 256]
    - [3, 17.107]
  - - [448, 1408, 1, 256]
    - [3, 29.182]
  - - [1856, 4288, 1, 1280]
    - [2, 70.819]
  - - [64, 5056, 1, 3328]
    - [4, 48.425]
  - - [4, 704, 1, 256]
    - [1, 0.188]
  - - [1024, 448, 1, 128]
    - [3, 14.756]
  - - [704, 4, 1, 1280]
    - [23, 0.819]
  - - [704, 256, 1, 128]
    - [0, 6.52]
  - - [704, 2944, 1, 128]
    - [3, 36.685]
  - - [1408, 1024, 1, 1280]
    - [5, 54.041]
  - - [704, 6784, 1, 256]
    - [2, 61.958]
  - - [6784, 704, 1, 256]
    - [3, 62.1]
  - - [5056, 1408, 1, 128]
    - [3, 58.8]
  - - [256, 3584, 1, 3328]
    - [4, 56.674]
  - - [4, 5888, 1, 3328]
    - [24, 6.06]
  - - [128, 1408, 1, 128]
    - [18, 7.296]
  - - [3584, 4288, 1, 3328]
    - [7, 72.077]
  - - [5888, 1856, 1, 1280]
    - [2, 70.859]
  - - [5056, 1024, 1, 3328]
    - [8, 69.819]
  - - [5056, 64, 1, 1280]
    - [4, 39.009]
  - - [1024, 704, 1, 256]
    - [25, 20.036]
  - - [1024, 4288, 1, 128]
    - [2, 50.332]
  - - [4288, 64, 1, 1280]
    - [4, 35.99]
  - - [2368, 3584, 1, 1280]
    - [3, 71.504]
  - - [2368, 6784, 1, 1280]
    - [2, 71.647]
  - - [1024, 256, 1, 256]
    - [0, 12.474]
  - - [1856, 4, 1, 1280]
    - [26, 2.79]
  - - [448, 448, 1, 256]
    - [0, 11.525]
  - - [2944, 3584, 1, 3328]
    - [7, 74.71]
  - - [128, 4288, 1, 128]
    - [3, 17.62]
  - - [64, 448, 1, 256]
    - [10, 2.188]
  - - [128, 1024, 1, 3328]
    - [22, 36.553]
  - - [4, 1408, 1, 3328]
    - [24, 3.037]
  - - [6784, 2944, 1, 256]
    - [3, 68.753]
  - - [64, 1856, 1, 1280]
    - [11, 22.723]
  - - [64, 1024, 1, 128]
    - [0, 3.219]
  - - [4288, 2368, 1, 3328]
    - [3, 71.949]
  - - [1856, 2368, 1, 256]
    - [2, 61.739]
  - - [3584, 256, 1, 128]
    - [2, 24.305]
  - - [3584, 6784, 1, 3328]
    - [8, 75.048]
  - - [256, 1024, 1, 256]
    - [0, 13.272]
  - - [4, 6784, 1, 3328]
    - [11, 5.876]
  - - [1024, 5888, 1, 3328]
    - [5, 69.864]
  - - [1024, 128, 1, 1280]
    - [4, 23.848]
  - - [4288, 128, 1, 1280]
    - [11, 43.213]
  - - [5056, 4288, 1, 1280]
    - [5, 69.081]
  - - [5888, 64, 1, 256]
    - [27, 16.625]
  - - [1856, 256, 1, 1280]
    - [4, 40.69]
  - - [64, 5888, 1, 3328]
    - [11, 50.521]
  - - [2944, 5888, 1, 128]
    - [2, 63.071]
  - - [704, 5888, 1, 1280]
    - [3, 65.523]
  - - [2368, 3584, 1, 128]
    - [3, 61.25]
  - - [6784, 5888, 1, 3328]
    - [7, 75.642]
  - - [704, 1024, 1, 1280]
    - [2, 49.24]
  - - [448, 256, 1, 3328]
    - [22, 33.23]
  - - [448, 1856, 1, 128]
    - [2, 22.328]
  - - [128, 1024, 1, 128]
    - [0, 5.338]
  - - [2944, 4, 1, 128]
    - [0, 0.507]
  - - [1024, 704, 1, 1280]
    - [2, 48.641]
  - - [128, 5888, 1, 256]
    - [3, 30.404]
  - - [1024, 5056, 1, 1280]
    - [5, 67.2]
  - - [4288, 1024, 1, 256]
    - [3, 62.347]
  - - [2944, 2368, 1, 128]
    - [2, 58.797]
  - - [704, 704, 1, 3328]
    - [4, 54.18]
  - - [704, 1408, 1, 1280]
    - [2, 48.969]
  - - [5888, 448, 1, 1280]
    - [3, 66.362]
  - - [3584, 256, 1, 3328]
    - [4, 57.362]
  - - [704, 5888, 1, 3328]
    - [2, 65.233]
  - - [704, 1856, 1, 128]
    - [3, 28.655]
  - - [128, 3584, 1, 3328]
    - [11, 51.062]
  - - [6784, 2368, 1, 1280]
    - [5, 73.007]
  - - [4, 4288, 1, 128]
    - [0, 0.811]
  - - [128, 704, 1, 1280]
    - [11, 20.071]
  - - [3584, 2944, 1, 256]
    - [7, 65.379]
  - - [1856, 128, 1, 3328]
    - [22, 46.016]
  - - [4, 64, 1, 1280]
    - [28, 0.092]
  - - [4, 5056, 1, 3328]
    - [24, 5.871]
  - - [128, 2944, 1, 1280]
    - [4, 38.756]
  - - [2368, 1024, 1, 3328]
    - [3, 64.448]
  - - [128, 256, 1, 3328]
    - [14, 17.257]
  - - [1408, 5056, 1, 3328]
    - [7, 73.246]
  - - [1856, 1856, 1, 3328]
    - [5, 67.453]
  - - [3584, 128, 1, 256]
    - [2, 20.844]
  - - [448, 1408, 1, 3328]
    - [11, 54.7]
  - - [2368, 2368, 1, 256]
    - [2, 59.95]
  - - [4288, 4288, 1, 1280]
    - [3, 73.063]
  - - [64, 448, 1, 1280]
    - [6, 9.109]
  - - [1408, 4288, 1, 256]
    - [2, 61.346]
  - - [448, 4, 1, 256]
    - [29, 0.171]
  - - [5888, 448, 1, 128]
    - [2, 43.342]
  - - [448, 4, 1, 1280]
    - [16, 0.742]
  - - [704, 6784, 1, 3328]
    - [3, 70.124]
  - - [5888, 5888, 1, 1280]
    - [8, 75.2]
  - - [5056, 1024, 1, 1280]
    - [3, 68.35]
  - - [448, 5888, 1, 3328]
    - [2, 66.924]
  - - [128, 4, 1, 128]
    - [0, 0.021]
  - - [1024, 2944, 1, 1280]
    - [3, 66.257]
  - - [5056, 5888, 1, 1280]
    - [8, 75.107]
  - - [4288, 5888, 1, 128]
    - [2, 61.579]
  - - [256, 3584, 1, 256]
    - [3, 31.151]
  - - [1408, 3584, 1, 128]
    - [3, 53.891]
  - - [256, 2944, 1, 3328]
    - [11, 56.408]
  - - [448, 3584, 1, 128]
    - [3, 32.373]
  - - [5888, 2944, 1, 1280]
    - [7, 73.62]
  - - [4, 6784, 1, 1280]
    - [10, 4.596]
  - - [2368, 5888, 1, 128]
    - [3, 58.637]
  - - [64, 2944, 1, 128]
    - [0, 6.886]
  - - [3584, 5888, 1, 256]
    - [3, 65.44]
  - - [2368, 704, 1, 128]
    - [19, 19.716]
  - - [3584, 2944, 1, 1280]
    - [7, 71.01]
  - - [3584, 2368, 1, 128]
    - [2, 60.011]
  - - [5056, 704, 1, 128]
    - [2, 46.852]
  - - [448, 2368, 1, 128]
    - [2, 23.839]
  - - [5056, 1408, 1, 3328]
    - [8, 73.358]
  - - [1408, 704, 1, 256]
    - [2, 37.674]
  - - [6784, 1024, 1, 3328]
    - [8, 73.086]
  - - [6784, 2944, 1, 3328]
    - [5, 72.83]
  - - [2944, 5056, 1, 3328]
    - [5, 73.398]
  - - [1856, 1856, 1, 256]
    - [3, 57.823]
  - - [1024, 5888, 1, 128]
    - [3, 54.933]
  - - [2048, 7133, 1, 2048]
    - [2, 72.13]
  - - [256, 4, 1, 128]
    - [0, 0.043]
  - - [4288, 5888, 1, 1280]
    - [3, 72.613]
  - - [4288, 4288, 1, 256]
    - [2, 67.032]
  - - [448, 2944, 1, 3328]
    - [2, 66.506]
  - - [4288, 1856, 1, 1280]
    - [5, 69.042]
  - - [1856, 2944, 1, 3328]
    - [2, 68.654]
  - - [256, 6784, 1, 3328]
    - [5, 66.356]
  - - [64, 5888, 1, 256]
    - [3, 17.273]
  - - [256, 5056, 1, 128]
    - [2, 32.143]
  - - [5056, 1024, 1, 256]
    - [3, 62.304]
  - - [704, 64, 1, 3328]
    - [30, 24.828]
  - - [5056, 1856, 1, 3328]
    - [3, 72.856]
  - - [4, 2944, 1, 3328]
    - [17, 5.346]
  - - [4, 5056, 1, 256]
    - [10, 1.587]
  - - [1856, 1408, 1, 256]
    - [2, 54.088]
  - - [3584, 4, 1, 128]
    - [0, 0.671]
  - - [448, 448, 1, 3328]
    - [4, 44.948]
  - - [6784, 128, 1, 3328]
    - [3, 61.01]
  - - [4288, 1408, 1, 128]
    - [3, 57.149]
  - - [4288, 5056, 1, 256]
    - [3, 68.621]
  - - [1408, 128, 1, 1280]
    - [11, 30.643]
  - - [5056, 256, 1, 3328]
    - [3, 65.514]
  - - [704, 704, 1, 256]
    - [2, 22.636]
  - - [1024, 5888, 1, 1280]
    - [5, 68.761]
  - - [6784, 2368, 1, 128]
    - [2, 63.122]
  - - [4, 5056, 1, 1280]
    - [6, 4.003]
  - - [64, 128, 1, 256]
    - [6, 0.617]
  - - [128, 1856, 1, 1280]
    - [11, 30.163]
  - - [5056, 3584, 1, 256]
    - [3, 68.211]
  - - [1856, 1024, 1, 1280]
    - [2, 57.005]
  - - [6784, 4288, 1, 1280]
    - [5, 73.543]
  - - [1856, 1856, 1, 1280]
    - [3, 66.752]
  - - [6784, 2944, 1, 128]
    - [3, 59.145]
  - - [1408, 5056, 1, 1280]
    - [8, 69.681]
  - - [4, 2368, 1, 3328]
    - [24, 4.309]
  - - [5888, 1856, 1, 128]
    - [2, 59.635]
  - - [448, 704, 1, 1280]
    - [4, 38.396]
  - - [2368, 1024, 1, 128]
    - [2, 44.334]
  - - [1024, 448, 1, 3328]
    - [4, 50.444]
  - - [1856, 704, 1, 1280]
    - [3, 60.995]
  - - [5056, 3584, 1, 128]
    - [2, 63.186]
  - - [5888, 5888, 1, 3328]
    - [7, 75.627]
  - - [6784, 1024, 1, 256]
    - [3, 62.332]
  - - [2944, 2368, 1, 256]
    - [3, 61.904]
  - - [256, 448, 1, 256]
    - [0, 8.565]
  - - [5056, 5888, 1, 3328]
    - [8, 75.735]
  - - [1856, 1024, 1, 256]
    - [2, 46.092]
  - - [448, 1408, 1, 1280]
    - [11, 44.996]
  - - [3584, 448, 1, 1280]
    - [3, 58.742]
  - - [1024, 1024, 1, 1280]
    - [3, 51.431]
  - - [448, 5888, 1, 256]
    - [2, 52.677]
  - - [704, 64, 1, 128]
    - [0, 2.029]
  - - [1408, 6784, 1, 3328]
    - [5, 70.44]
  - - [448, 1024, 1, 128]
    - [3, 13.435]
  - - [4288, 704, 1, 128]
    - [3, 43.608]
  - - [128, 1856, 1, 128]
    - [0, 7.323]
  - - [448, 2368, 1, 3328]
    - [11, 58.886]
  - - [5056, 64, 1, 128]
    - [0, 11.081]
  - - [5056, 2944, 1, 256]
    - [3, 64.13]
  - - [6784, 5888, 1, 128]
    - [3, 67.445]
  - - [704, 1024, 1, 256]
    - [2, 34.276]
  - - [1024, 4, 1, 256]
    - [26, 0.415]
  - - [2368, 1856, 1, 256]
    - [3, 61.503]
  - - [128, 6784, 1, 1280]
    - [3, 55.04]
  - - [1408, 3584, 1, 3328]
    - [3, 67.304]
  - - [2368, 6784, 1, 256]
    - [2, 60.787]
  - - [5056, 1408, 1, 1280]
    - [7, 69.335]
  - - [256, 256, 1, 128]
    - [0, 2.837]
  - - [5056, 4288, 1, 128]
    - [2, 57.671]
  - - [1408, 1856, 1, 128]
    - [3, 44.123]
  - - [1408, 5888, 1, 3328]
    - [3, 71.336]
  - - [1856, 256, 1, 256]
    - [2, 20.358]
  - - [6784, 6784, 1, 256]
    - [8, 72.502]
  - - [64, 256, 1, 128]
    - [31, 0.793]
  - - [4288, 2368, 1, 128]
    - [2, 62.32]
  - - [1856, 4288, 1, 128]
    - [3, 60.262]
  - - [256, 4288, 1, 1280]
    - [3, 52.926]
  - - [2368, 2944, 1, 256]
    - [3, 61.974]
  - - [4, 1856, 1, 256]
    - [6, 0.668]
  - - [3584, 1856, 1, 1280]
    - [2, 68.076]
  - - [6784, 6784, 1, 128]
    - [3, 68.098]
  - - [256, 1856, 1, 128]
    - [2, 16.116]
  - - [704, 64, 1, 1280]
    - [14, 11.621]
  - - [5888, 5056, 1, 256]
    - [2, 69.815]
  - - [3584, 448, 1, 256]
    - [2, 45.96]
  - - [448, 4288, 1, 128]
    - [2, 37.959]
  - - [2944, 4288, 1, 3328]
    - [3, 71.21]
  - - [256, 6784, 1, 256]
    - [2, 50.086]
  - - [1408, 4288, 1, 128]
    - [2, 56.983]
  - - [2944, 704, 1, 3328]
    - [3, 64.327]
  - - [128, 448, 1, 256]
    - [0, 4.673]
  - - [512, 32, 1, 512]
    - [15, 2.793]
  - - [3584, 3584, 1, 256]
    - [2, 65.696]
  - - [448, 1408, 1, 128]
    - [3, 21.915]
  - - [128, 256, 1, 1280]
    - [32, 9.587]
  - - [3584, 5056, 1, 256]
    - [2, 65.842]
  - - [6784, 128, 1, 256]
    - [3, 35.839]
  - - [4288, 4, 1, 256]
    - [33, 1.319]
  - - [64, 1408, 1, 3328]
    - [22, 32.339]
  - - [704, 448, 1, 256]
    - [18, 14.523]
  - - [2944, 2368, 1, 1280]
    - [8, 69.333]
  - - [448, 64, 1, 3328]
    - [30, 16.648]
  - - [1408, 3584, 1, 256]
    - [3, 61.494]
  - - [3584, 4, 1, 3328]
    - [15, 6.058]
  - - [6784, 3584, 1, 256]
    - [2, 69.631]
  - - [256, 128, 1, 128]
    - [0, 1.358]
  - - [704, 1408, 1, 128]
    - [27, 14.037]
  - - [4, 2368, 1, 256]
    - [0, 0.725]
  - - [2944, 448, 1, 128]
    - [3, 30.152]
  - - [128, 1408, 1, 256]
    - [0, 10.993]
  - - [4, 2944, 1, 256]
    - [4, 0.841]
  - - [64, 128, 1, 3328]
    - [24, 6.167]
  - - [5056, 2368, 1, 128]
    - [2, 60.051]
  - - [2944, 2944, 1, 3328]
    - [7, 73.269]
  - - [5056, 6784, 1, 256]
    - [3, 67.969]
  - - [1856, 3584, 1, 128]
    - [2, 58.83]
  - - [128, 2944, 1, 128]
    - [34, 9.452]
  - - [1024, 704, 1, 3328]
    - [11, 56.255]
  - - [6784, 448, 1, 256]
    - [3, 55.304]
  - - [3584, 6784, 1, 128]
    - [8, 58.375]
  - - [128, 4288, 1, 256]
    - [2, 23.547]
  - - [704, 448, 1, 3328]
    - [4, 49.548]
  - - [1024, 1024, 1, 3328]
    - [4, 58.308]
  - - [128, 128, 1, 3328]
    - [24, 11.144]
  - - [5056, 1856, 1, 256]
    - [3, 65.149]
  - - [256, 128, 1, 256]
    - [0, 2.722]
  - - [1024, 1856, 1, 256]
    - [2, 46.644]
  - - [4288, 64, 1, 128]
    - [0, 8.281]
  - - [256, 448, 1, 3328]
    - [30, 34.212]
  - - [1408, 6784, 1, 1280]
    - [5, 68.593]
  - - [3584, 3584, 1, 1280]
    - [2, 71.113]
  - - [64, 2368, 1, 1280]
    - [11, 27.808]
  - - [448, 2368, 1, 1280]
    - [2, 49.842]
  - - [5888, 5888, 1, 128]
    - [2, 66.774]
  - - [64, 6784, 1, 3328]
    - [4, 52.242]
  - - [2944, 256, 1, 1280]
    - [2, 51.048]
  - - [5056, 5888, 1, 128]
    - [2, 60.95]
  - - [256, 2368, 1, 128]
    - [2, 17.468]
  - - [5056, 2368, 1, 3328]
    - [8, 72.362]
  - - [2944, 4288, 1, 256]
    - [2, 62.553]
  - - [1408, 3584, 1, 1280]
    - [7, 65.029]
  - - [2368, 64, 1, 256]
    - [0, 8.525]
  - - [64, 448, 1, 3328]
    - [30, 14.661]
  - - [256, 256, 1, 3328]
    - [30, 25.369]
  - - [5888, 4, 1, 128]
    - [0, 0.813]
  - - [1856, 704, 1, 256]
    - [2, 44.925]
  - - [4, 4288, 1, 1280]
    - [10, 3.849]
  - - [1408, 448, 1, 3328]
    - [22, 53.679]
  - - [1024, 4, 1, 3328]
    - [26, 3.176]
  - - [2368, 256, 1, 256]
    - [3, 27.128]
  - - [2368, 6784, 1, 3328]
    - [3, 73.319]
  - - [1856, 1408, 1, 1280]
    - [3, 65.439]
  - - [1856, 448, 1, 1280]
    - [3, 54.983]
  - - [6784, 704, 1, 128]
    - [2, 51.861]
  - - [4, 4, 1, 256]
    - [35, 0.001]
  - - [128, 5888, 1, 128]
    - [3, 20.429]
  - - [1408, 5888, 1, 256]
    - [3, 62.789]
  - - [704, 2944, 1, 1280]
    - [2, 60.775]
  - - [1856, 2368, 1, 128]
    - [2, 51.704]
  - - [4096, 7133, 1, 4096]
    - [8, 74.69]
  - - [256, 64, 1, 256]
    - [10, 1.334]
  - - [1024, 1024, 1, 256]
    - [27, 22.277]
  - - [704, 1856, 1, 256]
    - [13, 24.495]
  - - [128, 4288, 1, 3328]
    - [11, 54.264]
  - - [3584, 704, 1, 1280]
    - [3, 63.781]
  - - [256, 128, 1, 1280]
    - [14, 9.204]
  - - [2368, 4, 1, 256]
    - [0, 0.724]
  - - [256, 2368, 1, 1280]
    - [11, 44.188]
  - - [2944, 6784, 1, 128]
    - [36, 56.389]
  - - [3584, 448, 1, 3328]
    - [3, 61.539]
  - - [1408, 4, 1, 256]
    - [26, 0.455]
  - - [704, 2368, 1, 3328]
    - [2, 64.147]
  - - [2944, 448, 1, 256]
    - [3, 44.133]
  - - [1856, 448, 1, 128]
    - [2, 19.615]
  - - [2368, 128, 1, 1280]
    - [11, 34.926]
  - - [256, 5888, 1, 128]
    - [25, 18.632]
  - - [64, 6784, 1, 256]
    - [3, 20.965]
  - - [64, 5056, 1, 1280]
    - [11, 35.503]
  - - [4, 6784, 1, 128]
    - [0, 1.063]
  - - [2944, 2944, 1, 1280]
    - [8, 70.208]
  - - [5888, 2368, 1, 256]
    - [3, 67.949]
  - - [4, 3584, 1, 1280]
    - [10, 3.284]
  - - [1408, 128, 1, 128]
    - [0, 6.119]
  - - [6784, 704, 1, 3328]
    - [3, 68.038]
  - - [128, 64, 1, 1280]
    - [1, 3.185]
  - - [2368, 256, 1, 1280]
    - [4, 45.09]
  - - [4, 448, 1, 3328]
    - [16, 1.38]
  - - [5888, 4288, 1, 128]
    - [2, 65.214]
  - - [4, 5888, 1, 256]
    - [0, 1.725]
  - - [1408, 2944, 1, 3328]
    - [5, 67.362]
  - - [3584, 704, 1, 128]
    - [2, 40.276]
  - - [64, 1024, 1, 256]
    - [0, 4.983]
  - - [5056, 5056, 1, 128]
    - [3, 65.804]
  - - [2368, 448, 1, 1280]
    - [3, 50.795]
  - - [128, 3584, 1, 256]
    - [3, 21.049]
  - - [704, 448, 1, 1280]
    - [11, 34.512]
  - - [448, 5056, 1, 128]
    - [2, 39.942]
  - - [256, 4, 1, 1280]
    - [24, 0.362]
  - - [128, 5056, 1, 256]
    - [2, 26.909]
  - - [1408, 5056, 1, 128]
    - [2, 59.558]
  - - [2944, 3584, 1, 128]
    - [3, 58.229]
  - - [3584, 2368, 1, 256]
    - [2, 64.38]
  - - [5888, 5056, 1, 1280]
    - [8, 75.075]
  - - [2368, 5056, 1, 128]
    - [3, 60.504]
  - - [64, 704, 1, 256]
    - [0, 3.43]
  - - [4288, 256, 1, 1280]
    - [2, 52.749]
  - - [3584, 3584, 1, 3328]
    - [3, 72.455]
  - - [1024, 256, 1, 128]
    - [21, 7.357]
  - - [4, 704, 1, 128]
    - [14, 0.115]
  - - [5888, 6784, 1, 256]
    - [7, 71.242]
  - - [4288, 2944, 1, 3328]
    - [3, 70.164]
  - - [2944, 64, 1, 128]
    - [0, 6.921]
  - - [1856, 64, 1, 256]
    - [0, 7.823]
  - - [4288, 128, 1, 3328]
    - [4, 53.255]
  - - [4288, 704, 1, 1280]
    - [3, 66.107]
  - - [256, 5056, 1, 1280]
    - [3, 61.291]
  - - [1408, 256, 1, 128]
    - [21, 11.006]
  - - [2944, 5888, 1, 3328]
    - [8, 75.023]
  - - [6784, 5888, 1, 1280]
    - [8, 74.615]
  - - [704, 128, 1, 256]
    - [31, 5.967]
  - - [5888, 4288, 1, 1280]
    - [5, 72.858]
  - - [448, 256, 1, 1280]
    - [11, 22.422]
  - - [5888, 3584, 1, 128]
    - [3, 65.243]
  - - [1856, 1856, 1, 128]
    - [2, 50.155]
  - - [5056, 4, 1, 1280]
    - [15, 5.193]
  - - [256, 1408, 1, 1280]
    - [11, 36.515]
  - - [512, 16, 1, 512]
    - [16, 1.056]
  - - [704, 3584, 1, 128]
    - [2, 39.838]
  - - [5888, 448, 1, 3328]
    - [3, 69.229]
  - - [2368, 4288, 1, 1280]
    - [3, 71.456]
  - - [4288, 2944, 1, 128]
    - [3, 59.151]
  - - [1024, 6784, 1, 3328]
    - [8, 72.406]
  - - [128, 2368, 1, 256]
    - [27, 12.807]
  - - [6784, 64, 1, 3328]
    - [37, 51.487]
  - - [5056, 2944, 1, 3328]
    - [5, 72.551]
  - - [448, 128, 1, 256]
    - [0, 4.288]
  - - [2944, 3584, 1, 256]
    - [7, 66.305]
  - - [1408, 1408, 1, 3328]
    - [3, 61.643]
  - - [1856, 128, 1, 1280]
    - [11, 30.423]
  - - [3584, 3584, 1, 128]
    - [3, 61.408]
  - - [64, 3584, 1, 256]
    - [0, 12.125]
  - - [1408, 4, 1, 3328]
    - [26, 3.41]
  - - [128, 2944, 1, 3328]
    - [11, 49.157]
  - - [3584, 704, 1, 256]
    - [2, 51.315]
  - - [2944, 448, 1, 3328]
    - [2, 66.385]
  - - [3584, 1408, 1, 3328]
    - [8, 68.158]
  - - [704, 3584, 1, 1280]
    - [3, 63.975]
  - - [2944, 6784, 1, 1280]
    - [8, 72.132]
  - - [1856, 6784, 1, 256]
    - [2, 66.888]
  - - [4288, 448, 1, 3328]
    - [4, 60.555]
  - - [6784, 4288, 1, 128]
    - [3, 66.053]
  - - [6784, 704, 1, 1280]
    - [3, 67.014]
  - - [256, 4288, 1, 256]
    - [3, 38.953]
  - - [3584, 64, 1, 128]
    - [0, 7.31]
  - - [5888, 1024, 1, 3328]
    - [3, 68.875]
  - - [448, 64, 1, 128]
    - [0, 1.426]
  - - [704, 6784, 1, 1280]
    - [2, 67.068]
  - - [5888, 128, 1, 256]
    - [2, 29.858]
  - - [2368, 448, 1, 3328]
    - [4, 58.984]
  - - [1856, 5056, 1, 3328]
    - [2, 72.807]
  - - [4, 6784, 1, 256]
    - [0, 1.811]
  - - [1024, 3584, 1, 128]
    - [2, 45.864]
  - - [1024, 1408, 1, 128]
    - [3, 31.786]
  - - [2368, 2944, 1, 128]
    - [3, 58.492]
  - - [5056, 64, 1, 256]
    - [0, 16.181]
  - - [4, 448, 1, 1280]
    - [24, 0.745]
  - - [5056, 2944, 1, 128]
    - [2, 61.96]
  - - [5888, 5056, 1, 3328]
    - [8, 76.084]
  - - [1024, 704, 1, 128]
    - [3, 21.791]
  - - [1408, 2368, 1, 128]
    - [2, 47.256]
  - - [5888, 2368, 1, 128]
    - [2, 60.045]
  - - [128, 5056, 1, 3328]
    - [11, 54.244]
  - - [3584, 6784, 1, 1280]
    - [8, 74.872]
  - - [3072, 7435, 1, 1024]
    - [7, 73.273]
  - - [1856, 5888, 1, 256]
    - [3, 62.414]
  - - [256, 256, 1, 256]
    - [0, 5.007]
  - - [256, 64, 1, 128]
    - [0, 0.723]
  - - [4288, 4288, 1, 3328]
    - [3, 73.218]
  - - [4288, 1408, 1, 1280]
    - [3, 66.491]
  - - [3584, 5056, 1, 128]
    - [36, 52.651]
  - - [4, 1024, 1, 3328]
    - [24, 2.694]
  - - [4288, 2368, 1, 256]
    - [3, 65.02]
  - - [2944, 5056, 1, 1280]
    - [5, 70.853]
  - - [448, 6784, 1, 256]
    - [3, 56.291]
  - - [64, 1024, 1, 3328]
    - [30, 25.753]
  - - [6784, 2368, 1, 3328]
    - [5, 74.544]
  - - [256, 1024, 1, 1280]
    - [11, 33.933]
  - - [704, 4, 1, 128]
    - [0, 0.109]
  - - [256, 4, 1, 256]
    - [20, 0.071]
  - - [4288, 128, 1, 256]
    - [3, 24.963]
  - - [4288, 1856, 1, 3328]
    - [5, 72.491]
  - - [3584, 448, 1, 128]
    - [3, 33.287]
  - - [256, 4, 1, 3328]
    - [24, 0.988]
  - - [4, 1408, 1, 1280]
    - [38, 1.59]
  - - [3584, 64, 1, 1280]
    - [39, 30.484]
  - - [1408, 448, 1, 128]
    - [3, 19.775]
  - - [3584, 1024, 1, 1280]
    - [2, 63.288]
  - - [1856, 5056, 1, 256]
    - [3, 65.311]
  - - [4, 3584, 1, 256]
    - [9, 1.219]
  - - [1024, 4288, 1, 256]
    - [3, 61.496]
  - - [5888, 3584, 1, 3328]
    - [7, 76.104]
  - - [4, 256, 1, 256]
    - [20, 0.088]
  - - [5056, 3584, 1, 3328]
    - [5, 71.969]
  - - [128, 5888, 1, 1280]
    - [2, 50.567]
  - - [704, 448, 1, 128]
    - [18, 9.786]
  - - [2368, 1408, 1, 1280]
    - [3, 64.834]
  - - [5056, 2944, 1, 1280]
    - [36, 69.78]
  - - [4, 4, 1, 128]
    - [0, 0.001]
  - - [3584, 256, 1, 256]
    - [2, 31.579]
  - - [128, 1856, 1, 3328]
    - [22, 44.405]
  - - [1024, 6784, 1, 256]
    - [2, 62.17]
  - - [4, 128, 1, 256]
    - [40, 0.05]
  - - [64, 64, 1, 1280]
    - [16, 1.344]
  - - [6784, 4, 1, 128]
    - [0, 1.082]
  - - [2944, 1408, 1, 128]
    - [3, 47.717]
  - - [448, 128, 1, 3328]
    - [22, 25.56]
  - - [64, 2944, 1, 3328]
    - [30, 41.658]
  - - [64, 4288, 1, 3328]
    - [11, 46.9]
  - - [5056, 6784, 1, 3328]
    - [7, 74.707]
  - - [128, 2944, 1, 256]
    - [27, 15.688]
  - - [128, 6784, 1, 128]
    - [3, 23.366]
  - - [3584, 4288, 1, 256]
    - [3, 66.676]
  - - [448, 1856, 1, 256]
    - [3, 36.698]
  - - [1856, 6784, 1, 3328]
    - [3, 73.469]
  - - [3584, 128, 1, 3328]
    - [22, 50.158]
  - - [64, 1856, 1, 256]
    - [0, 8.114]
  - - [1024, 448, 1, 1280]
    - [11, 42.409]
  - - [5888, 4288, 1, 256]
    - [3, 69.454]
  - - [4, 448, 1, 128]
    - [0, 0.077]
  - - [5056, 1408, 1, 256]
    - [2, 63.184]
  - - [64, 256, 1, 1280]
    - [6, 5.498]
  - - [3584, 1024, 1, 256]
    - [2, 55.778]
  - - [256, 704, 1, 256]
    - [27, 10.779]
  - - [5888, 5888, 1, 256]
    - [2, 69.647]
  - - [4288, 1024, 1, 1280]
    - [3, 67.566]
  - - [5888, 128, 1, 3328]
    - [4, 55.64]
  - - [448, 6784, 1, 3328]
    - [2, 67.531]
  - - [2944, 1408, 1, 1280]
    - [2, 64.821]
  - - [1024, 32, 1, 512]
    - [14, 5.199]
  - - [2944, 1856, 1, 3328]
    - [3, 66.255]
  - - [2368, 64, 1, 128]
    - [19, 6.244]
  - - [2944, 2944, 1, 128]
    - [2, 60.844]
  - - [4, 128, 1, 3328]
    - [16, 0.398]
  - - [3584, 5888, 1, 1280]
    - [8, 74.392]
  - - [64, 4, 1, 128]
    - [16, 0.012]
  - - [6784, 1856, 1, 1280]
    - [2, 69.676]
  - - [2944, 5056, 1, 256]
    - [3, 61.192]
  - - [2944, 5888, 1, 1280]
    - [8, 73.667]
  - - [5888, 256, 1, 3328]
    - [4, 60.215]
  - - [1856, 5888, 1, 3328]
    - [3, 71.079]
  - - [3584, 1408, 1, 256]
    - [3, 61.417]
  - - [704, 3584, 1, 3328]
    - [3, 65.144]
  - - [5056, 448, 1, 1280]
    - [3, 58.358]
  - - [3584, 1856, 1, 3328]
    - [3, 71.13]
  - - [64, 1408, 1, 128]
    - [0, 4.024]
  - - [1408, 704, 1, 1280]
    - [3, 48.542]
  - - [2944, 1024, 1, 256]
    - [3, 54.24]
  - - [1024, 2368, 1, 128]
    - [2, 44.028]
  - - [2368, 4288, 1, 3328]
    - [3, 72.32]
  - - [4, 1408, 1, 256]
    - [9, 0.464]
  - - [1024, 1408, 1, 1280]
    - [5, 53.106]
  - - [64, 64, 1, 256]
    - [23, 0.339]
  - - [704, 256, 1, 3328]
    - [30, 42.482]
  - - [6784, 5056, 1, 256]
    - [2, 70.094]
  - - [4, 4288, 1, 3328]
    - [6, 5.41]
  - - [448, 6784, 1, 128]
    - [3, 44.455]
  - - [4, 704, 1, 3328]
    - [28, 1.719]
  - - [448, 2944, 1, 256]
    - [3, 42.441]
  - - [2944, 6784, 1, 256]
    - [3, 64.144]
  - - [2368, 2368, 1, 1280]
    - [2, 66.006]
  - - [4, 4, 1, 1280]
    - [24, 0.007]
  - - [1856, 3584, 1, 1280]
    - [3, 70.579]
  - - [64, 2944, 1, 256]
    - [18, 10.316]
  - - [3584, 1408, 1, 1280]
    - [7, 65.833]
  - - [448, 256, 1, 128]
    - [0, 4.971]
  - - [4288, 448, 1, 128]
    - [2, 35.15]
  - - [5056, 256, 1, 1280]
    - [2, 60.363]
  - - [1856, 1408, 1, 3328]
    - [3, 68.515]
  - - [128, 128, 1, 128]
    - [41, 0.719]
  - - [1024, 4288, 1, 3328]
    - [5, 69.301]
  - - [448, 2368, 1, 256]
    - [3, 39.339]
  - - [1024, 4, 1, 128]
    - [23, 0.183]
  - - [5056, 448, 1, 256]
    - [2, 48.529]
  - - [2944, 2368, 1, 3328]
    - [8, 72.641]
  - - [704, 128, 1, 3328]
    - [11, 33.647]
  - - [64, 64, 1, 3328]
    - [24, 3.44]
  - - [1024, 1856, 1, 1280]
    - [3, 56.982]
  - - [6784, 1856, 1, 256]
    - [3, 66.069]
  - - [128, 2368, 1, 3328]
    - [11, 49.264]
  - - [1024, 5888, 1, 256]
    - [3, 59.986]
  - - [5056, 128, 1, 1280]
    - [4, 45.213]
  - - [5056, 64, 1, 3328]
    - [22, 49.319]
  - - [128, 704, 1, 128]
    - [0, 4.192]
  - - [1408, 2368, 1, 256]
    - [3, 56.081]
  - - [1408, 1408, 1, 256]
    - [2, 48.762]
  - - [4, 64, 1, 128]
    - [0, 0.011]
  - - [64, 128, 1, 1280]
    - [6, 2.395]
  - - [2368, 2368, 1, 128]
    - [3, 56.436]
  - - [64, 5888, 1, 128]
    - [18, 11.317]
  - - [5888, 4, 1, 3328]
    - [15, 8.386]
  - - [6784, 1408, 1, 128]
    - [2, 60.36]
  - - [4288, 5888, 1, 256]
    - [3, 66.824]
  - - [1408, 5056, 1, 256]
    - [2, 63.264]
  - - [5056, 128, 1, 3328]
    - [4, 55.431]
  - - [128, 128, 1, 1280]
    - [26, 6.483]
  - - [448, 704, 1, 256]
    - [18, 13.311]
  - - [4288, 3584, 1, 128]
    - [3, 62.046]
  - - [2944, 128, 1, 3328]
    - [4, 50.605]
  - - [128, 5056, 1, 1280]
    - [11, 46.156]
  - - [3584, 5056, 1, 1280]
    - [36, 69.838]
  - - [256, 448, 1, 1280]
    - [11, 23.601]
  - - [704, 704, 1, 128]
    - [3, 15.585]
  - - [5056, 4, 1, 128]
    - [41, 0.826]
  - - [704, 256, 1, 1280]
    - [11, 28.719]
  - - [64, 2368, 1, 3328]
    - [11, 39.972]
  - - [1856, 1024, 1, 128]
    - [2, 34.202]
  - - [1856, 64, 1, 128]
    - [0, 4.303]
  - - [64, 6784, 1, 1280]
    - [4, 39.656]
  - - [704, 4288, 1, 256]
    - [2, 53.948]
  - - [5888, 2368, 1, 1280]
    - [7, 71.628]
  - - [128, 256, 1, 256]
    - [15, 2.742]
  - - [256, 64, 1, 1280]
    - [26, 6.255]
  - - [2368, 5888, 1, 1280]
    - [7, 72.111]
  - - [5888, 256, 1, 1280]
    - [5, 56.457]
  - - [4, 5888, 1, 1280]
    - [17, 4.533]
  - - [704, 128, 1, 128]
    - [34, 3.807]
  - - [1024, 4, 1, 1280]
    - [24, 1.26]
  - - [2368, 1856, 1, 3328]
    - [2, 70.642]
  - - [2368, 128, 1, 128]
    - [18, 11.083]
  - - [2944, 704, 1, 256]
    - [2, 47.321]
  - - [5056, 128, 1, 128]
    - [2, 19.203]
  - - [256, 704, 1, 3328]
    - [22, 39.834]
  - - [704, 3584, 1, 256]
    - [2, 51.914]
  - - [1024, 1024, 1, 1024]
    - [2, 51.363]
  - - [704, 2944, 1, 3328]
    - [2, 64.1]
  - - [6784, 1024, 1, 128]
    - [2, 58.285]
  - - [256, 448, 1, 128]
    - [33, 4.092]
  - - [448, 1024, 1, 3328]
    - [4, 51.414]
  - - [2944, 1024, 1, 3328]
    - [2, 68.433]
  - - [2944, 5056, 1, 128]
    - [3, 62.03]
  - - [1408, 6784, 1, 256]
    - [3, 64.304]
  - - [6784, 1408, 1, 3328]
    - [5, 72.133]
  - - [4288, 6784, 1, 128]
    - [3, 66.469]
  - - [704, 64, 1, 256]
    - [0, 3.818]
  - - [5888, 4, 1, 1280]
    - [15, 4.959]
  - - [256, 2368, 1, 3328]
    - [11, 55.514]
  - - [6784, 2944, 1, 1280]
    - [2, 71.115]
  - - [4288, 1856, 1, 128]
    - [2, 60.291]
  - - [1856, 2944, 1, 128]
    - [3, 55.527]
  - - [6784, 448, 1, 128]
    - [2, 46.102]
  - - [64, 3584, 1, 128]
    - [0, 7.655]
  - - [448, 5056, 1, 1280]
    - [3, 58.373]
  - - [2368, 1856, 1, 128]
    - [2, 51.863]
  - - [128, 448, 1, 1280]
    - [14, 13.538]
  - - [4288, 704, 1, 256]
    - [3, 55.355]
  - - [256, 3584, 1, 128]
    - [19, 17.341]
  - - [5888, 704, 1, 256]
    - [3, 57.918]
  - - [3584, 1024, 1, 128]
    - [3, 49.083]
  - - [256, 5888, 1, 3328]
    - [11, 60.137]
  - - [1408, 4288, 1, 3328]
    - [5, 69.356]
  - - [6784, 4288, 1, 256]
    - [3, 69.07]
  - - [4288, 256, 1, 128]
    - [2, 26.486]
  - - [5888, 256, 1, 256]
    - [2, 41.714]
  - - [6784, 1024, 1, 1280]
    - [7, 67.503]
  - - [5888, 1024, 1, 128]
    - [2, 55.709]
  - - [1024, 128, 1, 256]
    - [0, 8.609]
  - - [128, 64, 1, 3328]
    - [16, 5.866]
  - - [448, 64, 1, 256]
    - [0, 1.911]
  - - [2368, 256, 1, 128]
    - [2, 18.538]
  - - [6784, 3584, 1, 1280]
    - [8, 73.494]
  - - [1024, 6784, 1, 1280]
    - [2, 67.283]
  - - [2944, 64, 1, 1280]
    - [11, 28.393]
  - - [1408, 2944, 1, 1280]
    - [3, 65.231]
  - - [256, 1856, 1, 256]
    - [3, 24.092]
  - - [1408, 2368, 1, 3328]
    - [2, 64.83]
  - - [2944, 4, 1, 3328]
    - [26, 6.084]
  - - [128, 1408, 1, 3328]
    - [22, 39.439]
  - - [2944, 1856, 1, 128]
    - [2, 52.139]
  - - [256, 2944, 1, 128]
    - [2, 22.128]
  - - [256, 6784, 1, 128]
    - [25, 19.481]
  - - [2368, 4, 1, 128]
    - [0, 0.41]
  - - [1408, 256, 1, 3328]
    - [42, 42.221]
  - - [1856, 4, 1, 128]
    - [33, 0.289]
  - - [1024, 16, 1, 512]
    - [1, 2.118]
  - - [5056, 6784, 1, 128]
    - [2, 60.403]
  - - [4288, 5056, 1, 128]
    - [2, 56.482]
  - - [1856, 5888, 1, 128]
    - [3, 58.592]
  - - [2944, 5888, 1, 256]
    - [2, 65.815]
  - - [3584, 1856, 1, 256]
    - [2, 62.611]
  - - [4288, 3584, 1, 1280]
    - [7, 70.851]
  - - [2368, 448, 1, 256]
    - [3, 35.54]
  - - [4288, 256, 1, 3328]
    - [4, 58.707]
  - - [1856, 704, 1, 128]
    - [25, 18.637]
  - - [1408, 64, 1, 256]
    - [0, 6.465]
  - - [64, 1856, 1, 128]
    - [0, 4.089]
  - - [4, 256, 1, 128]
    - [0, 0.04]
  - - [704, 4288, 1, 3328]
    - [3, 68.009]
  - - [704, 5888, 1, 128]
    - [3, 48.123]
  - - [6784, 3584, 1, 128]
    - [2, 62.619]
  - - [1024, 64, 1, 256]
    - [0, 4.719]
  - - [64, 2368, 1, 256]
    - [0, 8.643]
  - - [4288, 5056, 1, 3328]
    - [3, 73.054]
  - - [4, 1856, 1, 1280]
    - [1, 2.553]
  - - [4288, 128, 1, 128]
    - [2, 15.136]
  - - [1408, 1408, 1, 128]
    - [2, 35.568]
  - - [1024, 128, 1, 3328]
    - [30, 36.134]
  - - [1856, 128, 1, 128]
    - [18, 6.899]
  - - [5056, 2368, 1, 256]
    - [3, 61.306]
  - - [4288, 704, 1, 3328]
    - [3, 66.554]
  - - [448, 3584, 1, 256]
    - [3, 43.881]
  - - [64, 128, 1, 128]
    - [0, 0.325]
  - - [2368, 64, 1, 1280]
    - [11, 26.694]
  - - [2368, 1024, 1, 1280]
    - [2, 61.739]
  - - [2944, 1408, 1, 3328]
    - [3, 65.865]
  - - [1408, 448, 1, 256]
    - [2, 21.967]
  - - [1024, 1408, 1, 3328]
    - [4, 59.961]
  - - [2560, 7133, 1, 2560]
    - [3, 72.634]
  - - [1408, 4, 1, 1280]
    - [26, 1.994]
  - - [5888, 3584, 1, 256]
    - [8, 63.493]
  - - [128, 1024, 1, 1280]
    - [4, 23.278]
  - - [1408, 1856, 1, 3328]
    - [5, 65.069]
  - - [4, 4, 1, 3328]
    - [24, 0.014]
  - - [6784, 1408, 1, 1280]
    - [5, 70.194]
  - - [4, 1024, 1, 1280]
    - [12, 1.379]
  - - [704, 2944, 1, 256]
    - [3, 47.524]
  - - [704, 4288, 1, 128]
    - [3, 46.39]
  - - [2368, 4288, 1, 128]
    - [3, 62.169]
  - - [64, 4288, 1, 1280]
    - [11, 36.831]
  - - [6784, 64, 1, 1280]
    - [4, 41.46]
  - - [3584, 128, 1, 128]
    - [3, 14.813]
  - - [1024, 6784, 1, 128]
    - [2, 58.649]
  - - [4, 1856, 1, 128]
    - [0, 0.315]
  - - [1408, 64, 1, 3328]
    - [22, 32.6]
  - - [6784, 4, 1, 256]
    - [0, 1.911]
  - - [1408, 1408, 1, 1280]
    - [2, 58.464]
  - - [256, 2368, 1, 256]
    - [3, 24.28]
  - - [448, 4288, 1, 3328]
    - [4, 60.656]
  - - [2368, 1408, 1, 256]
    - [2, 57.85]
  - - [5888, 5056, 1, 128]
    - [3, 62.078]
  - - [704, 2368, 1, 256]
    - [19, 25.309]
  - - [2944, 448, 1, 1280]
    - [4, 51.155]
  - - [5888, 2368, 1, 3328]
    - [8, 73.751]
  - - [64, 2944, 1, 1280]
    - [4, 30.042]
  - - [448, 1856, 1, 1280]
    - [2, 52.829]
  - - [4288, 448, 1, 1280]
    - [3, 58.029]
  - - [5888, 704, 1, 3328]
    - [2, 67.209]
  - - [5056, 256, 1, 128]
    - [3, 32.605]
  - - [1856, 256, 1, 128]
    - [3, 13.001]
  - - [5056, 128, 1, 256]
    - [3, 28.082]
  - - [704, 4, 1, 256]
    - [0, 0.212]
  - - [1408, 5888, 1, 128]
    - [2, 59.979]
  - - [4288, 4, 1, 128]
    - [0, 0.783]
  - - [1408, 1024, 1, 256]
    - [2, 43.036]
  - - [1024, 1856, 1, 128]
    - [3, 33.878]
  - - [256, 704, 1, 128]
    - [0, 5.694]
  - - [256, 1024, 1, 128]
    - [18, 7.54]
  - - [448, 1024, 1, 256]
    - [2, 20.693]
  - - [128, 4, 1, 3328]
    - [24, 0.438]
  - - [5056, 6784, 1, 1280]
    - [8, 74.016]
  - - [704, 5056, 1, 3328]
    - [3, 70.705]
  - - [64, 1408, 1, 1280]
    - [11, 21.247]
  - - [3584, 5056, 1, 3328]
    - [3, 72.233]
  - - [1856, 4, 1, 3328]
    - [26, 4.214]
  - - [4, 2944, 1, 128]
    - [0, 0.449]
  - - [2368, 2944, 1, 3328]
    - [7, 70.18]
  - - [448, 448, 1, 1280]
    - [11, 30.241]
  - - [2368, 3584, 1, 256]
    - [2, 64.488]
  - - [1024, 256, 1, 1280]
    - [4, 32.746]
  - - [5056, 3584, 1, 1280]
    - [2, 72.131]
  - - [448, 4, 1, 3328]
    - [24, 1.655]
  - - [1856, 2944, 1, 1280]
    - [2, 64.682]
  - - [3584, 2368, 1, 1280]
    - [3, 67.671]
  - - [128, 1024, 1, 256]
    - [0, 9.623]
  - - [2944, 1408, 1, 256]
    - [2, 57.854]
  - - [4288, 1408, 1, 3328]
    - [2, 67.139]
  - - [3584, 64, 1, 3328]
    - [22, 46.669]
  - - [1408, 128, 1, 256]
    - [0, 11.893]
  - - [2944, 1024, 1, 128]
    - [2, 44.032]
  - - [4288, 5056, 1, 1280]
    - [3, 72.432]
  - - [5888, 6784, 1, 1280]
    - [8, 74.796]
  - - [6784, 5056, 1, 128]
    - [3, 63.359]
  - - [256, 1024, 1, 3328]
    - [4, 46.776]
  - - [3584, 4, 1, 256]
    - [26, 1.213]
  - - [1856, 64, 1, 3328]
    - [30, 34.514]
  - - [64, 6784, 1, 128]
    - [2, 11.802]
  - - [5888, 1408, 1, 3328]
    - [3, 70.896]
  - - [5888, 64, 1, 1280]
    - [4, 38.139]
  - - [256, 5056, 1, 256]
    - [3, 45.815]
  - - [128, 3584, 1, 128]
    - [3, 15.965]
  - - [448, 3584, 1, 3328]
    - [2, 62.305]
  - - [704, 2368, 1, 128]
    - [3, 35.677]
  - - [5888, 256, 1, 128]
    - [3, 31.221]
  - - [4, 5056, 1, 128]
    - [0, 0.691]
  - - [448, 256, 1, 256]
    - [0, 6.718]
  - - [704, 4, 1, 3328]
    - [16, 2.273]
  - - [1408, 256, 1, 256]
    - [18, 15.821]
  - - [3584, 1856, 1, 128]
    - [2, 58.87]
  - - [4288, 4288, 1, 128]
    - [3, 63.971]
  - - [1856, 1024, 1, 3328]
    - [4, 61.476]
  - - [128, 5888, 1, 3328]
    - [4, 55.361]
  - - [1024, 5056, 1, 256]
    - [3, 62.584]
  - - [2368, 1408, 1, 3328]
    - [2, 65.557]
  - - [5888, 448, 1, 256]
    - [2, 52.617]
  - - [5888, 6784, 1, 128]
    - [2, 62.747]
  - - [2368, 4, 1, 3328]
    - [26, 5.569]
  - - [6784, 5056, 1, 1280]
    - [5, 73.029]
  - - [5056, 704, 1, 1280]
    - [2, 68.018]
  - - [1408, 256, 1, 1280]
    - [4, 36.331]
  - - [4288, 6784, 1, 1280]
    - [2, 72.954]
  - - [128, 704, 1, 256]
    - [0, 6.495]
  - - [1024, 1024, 1, 128]
    - [3, 25.416]
  - - [448, 128, 1, 1280]
    - [11, 13.169]
  - - [6784, 4, 1, 3328]
    - [26, 8.014]
  - - [4288, 4, 1, 1280]
    - [28, 3.365]
  - - [1024, 64, 1, 3328]
    - [30, 25.097]
  - - [1856, 4, 1, 256]
    - [26, 0.724]
  - - [64, 3584, 1, 1280]
    - [11, 28.548]
  - - [6784, 1408, 1, 256]
    - [2, 64.121]
  - - [3584, 5888, 1, 128]
    - [3, 57.189]
  - - [5056, 5888, 1, 256]
    - [2, 66.672]
  - - [2368, 1024, 1, 256]
    - [3, 51.389]
  - - [2944, 1856, 1, 256]
    - [3, 59.253]
  - - [1856, 6784, 1, 1280]
    - [2, 71.227]
  - - [64, 5056, 1, 128]
    - [34, 9.577]
  - - [5888, 64, 1, 128]
    - [18, 9.688]
  - - [448, 704, 1, 128]
    - [0, 11.128]
  - - [4, 1024, 1, 128]
    - [0, 0.2]
  - - [4288, 3584, 1, 256]
    - [3, 63.544]
  - - [1408, 704, 1, 128]
    - [19, 16.068]
  - - [64, 256, 1, 3328]
    - [24, 10.876]
  - - [5056, 1856, 1, 1280]
    - [3, 69.124]
  - - [1408, 1024, 1, 3328]
    - [4, 60.217]
  - - [2368, 256, 1, 3328]
    - [4, 55.411]
  - - [5888, 3584, 1, 1280]
    - [7, 75.169]
  - - [1856, 3584, 1, 3328]
    - [3, 70.782]
  - - [5888, 128, 1, 1280]
    - [2, 51.082]
  - - [1024, 2944, 1, 256]
    - [2, 56.958]
  - - [448, 6784, 1, 1280]
    - [2, 66.465]
  - - [256, 3584, 1, 1280]
    - [11, 46.808]
  - - [448, 128, 1, 128]
    - [0, 2.531]
  - - [704, 5056, 1, 256]
    - [3, 57.302]
  - - [3584, 1024, 1, 3328]
    - [3, 66.06]
  - - [2944, 1856, 1, 1280]
    - [3, 67.14]
  - - [128, 256, 1, 128]
    - [0, 1.433]
  - - [5056, 256, 1, 256]
    - [3, 43.756]
  - - [2368, 3584, 1, 3328]
    - [2, 71.67]
  - - [2944, 704, 1, 1280]
    - [3, 60.783]
  - - [128, 4, 1, 256]
    - [40, 0.042]
  - - [2944, 3584, 1, 1280]
    - [7, 71.454]
  - - [1856, 5888, 1, 1280]
    - [2, 70.788]
  - - [256, 256, 1, 1280]
    - [11, 14.25]
  - - [5056, 448, 1, 3328]
    - [4, 61.195]
  - - [4288, 1408, 1, 256]
    - [3, 60.839]
  - - [3584, 64, 1, 256]
    - [18, 12.209]
  - - [64, 1856, 1, 3328]
    - [22, 32.195]
  - - [256, 1408, 1, 128]
    - [0, 10.828]
  - - [5888, 1408, 1, 128]
    - [2, 60.236]
  - - [4288, 2368, 1, 1280]
    - [2, 71.197]
  - - [4, 4288, 1, 256]
    - [0, 1.356]
  - - [256, 4288, 1, 128]
    - [3, 26.042]
  - - [256, 128, 1, 3328]
    - [14, 17.849]
  - - [6784, 2368, 1, 256]
    - [2, 67.755]
  - - [5888, 128, 1, 128]
    - [2, 20.514]
  - - [4288, 1856, 1, 256]
    - [3, 62.595]
  - - [1856, 256, 1, 3328]
    - [39, 46.874]
  - - [1856, 2944, 1, 256]
    - [2, 59.037]
  - - [5056, 1024, 1, 128]
    - [2, 54.764]
  - - [64, 5888, 1, 1280]
    - [4, 36.612]
  - - [1760, 7133, 1, 1760]
    - [2, 68.878]
  - - [6784, 256, 1, 128]
    - [2, 33.438]
  - - [5888, 704, 1, 128]
    - [3, 48.171]
  - - [6784, 64, 1, 128]
    - [2, 12.786]
  - - [1024, 4288, 1, 1280]
    - [2, 67.16]
  - - [2368, 5056, 1, 3328]
    - [2, 72.69]
  - - [448, 4, 1, 128]
    - [24, 0.078]
  - - [4, 256, 1, 3328]
    - [24, 0.863]
  - - [4288, 1024, 1, 3328]
    - [2, 70.395]
  - - [1024, 5056, 1, 3328]
    - [8, 70.459]
  - - [1024, 1856, 1, 3328]
    - [4, 60.856]
  - - [704, 704, 1, 1280]
    - [11, 42.103]
  - - [128, 2368, 1, 1280]
    - [11, 33.53]
  - - [1408, 128, 1, 3328]
    - [30, 41.999]
  - - [3584, 256, 1, 1280]
    - [4, 47.897]
  - - [4, 128, 1, 128]
    - [0, 0.022]
  - - [704, 6784, 1, 128]
    - [3, 53.624]
  - - [3584, 128, 1, 1280]
    - [4, 42.337]
  - - [4, 256, 1, 1280]
    - [16, 0.334]
  - - [128, 704, 1, 3328]
    - [11, 30.016]
  - - [4288, 6784, 1, 256]
    - [8, 68.237]
  - - [3584, 2944, 1, 3328]
    - [7, 74.857]
  - - [128, 1856, 1, 256]
    - [18, 13.408]
  - - [64, 4288, 1, 256]
    - [0, 14.66]
  - - [4, 3584, 1, 3328]
    - [24, 5.211]
  - - [64, 4, 1, 3328]
    - [16, 0.222]
  - - [4, 64, 1, 3328]
    - [16, 0.184]
  - - [5888, 2944, 1, 256]
    - [8, 64.383]
  - - [2368, 6784, 1, 128]
    - [2, 54.994]
  - - [448, 4288, 1, 1280]
    - [2, 56.989]
  - - [448, 1856, 1, 3328]
    - [3, 58.55]
  - - [4, 1024, 1, 256]
    - [10, 0.381]
  - - [5056, 4288, 1, 256]
    - [3, 65.446]
  - - [1024, 448, 1, 256]
    - [2, 20.916]
  - - [1024, 3584, 1, 256]
    - [2, 55.911]
  - - [2944, 128, 1, 1280]
    - [4, 39.823]
  - - [1856, 5056, 1, 128]
    - [2, 61.422]
  - - [64, 256, 1, 256]
    - [0, 1.302]
  - - [1408, 4, 1, 128]
    - [0, 0.277]
  - - [128, 2368, 1, 128]
    - [18, 10.434]
  - - [256, 704, 1, 1280]
    - [11, 26.172]
  - - [64, 2368, 1, 128]
    - [0, 4.877]
  - - [6784, 6784, 1, 3328]
    - [8, 77.306]
  - - [448, 5888, 1, 1280]
    - [3, 65.792]
  - - [5056, 448, 1, 128]
    - [2, 37.378]
  - - [3584, 2944, 1, 128]
    - [3, 59.17]
  - - [6784, 256, 1, 1280]
    - [5, 62.745]
  - - [256, 2944, 1, 1280]
    - [3, 51.199]
  - - [64, 4288, 1, 128]
    - [0, 9.029]
  - - [2368, 5888, 1, 3328]
    - [8, 73.952]
  - - [4, 64, 1, 256]
    - [28, 0.023]
  - - [704, 1024, 1, 3328]
    - [4, 56.925]
  - - [2368, 1856, 1, 1280]
    - [2, 68.638]
  - - [128, 448, 1, 128]
    - [21, 2.384]
  - - [128, 6784, 1, 256]
    - [3, 36.394]
  - - [3584, 4288, 1, 128]
    - [2, 57.722]
  - - [64, 448, 1, 128]
    - [31, 1.146]
  - - [5888, 4288, 1, 3328]
    - [5, 73.511]
  - - [2368, 704, 1, 256]
    - [3, 44.718]
  - - [256, 1856, 1, 3328]
    - [37, 46.16]
  - - [1856, 128, 1, 256]
    - [18, 14.213]
  - - [6784, 128, 1, 128]
    - [3, 28.181]
  - - [3584, 1408, 1, 128]
    - [2, 54.683]
  - - [1856, 5056, 1, 1280]
    - [3, 71.721]
  - - [2944, 1024, 1, 1280]
    - [3, 66.153]
  - - [5056, 4, 1, 256]
    - [15, 1.42]
  - - [3584, 5888, 1, 3328]
    - [8, 75.094]
  - - [2368, 4288, 1, 256]
    - [2, 64.527]
  - - [1024, 2368, 1, 3328]
    - [2, 63.286]
  - - [64, 704, 1, 3328]
    - [30, 22.801]
  - - [704, 1408, 1, 256]
    - [2, 35.286]
  - - [6784, 1856, 1, 3328]
    - [5, 74.135]
  - - [1024, 2944, 1, 128]
    - [2, 47.44]
  - - [1024, 3584, 1, 1280]
    - [3, 64.225]
  - - [4288, 5888, 1, 3328]
    - [8, 73.131]
  - - [4288, 4, 1, 3328]
    - [15, 6.735]
  - - [256, 1408, 1, 256]
    - [3, 16.281]
  - - [448, 2944, 1, 1280]
    - [3, 59.959]
  - - [4, 5888, 1, 128]
    - [0, 0.926]
  - - [1024, 2944, 1, 3328]
    - [3, 68.427]
  - - [3584, 6784, 1, 256]
    - [3, 69.813]
  - - [256, 6784, 1, 1280]
    - [3, 62.858]
  - - [1856, 3584, 1, 256]
    - [2, 62.691]
  - - [128, 448, 1, 3328]
    - [22, 24.478]
  - - [6784, 1856, 1, 128]
    - [2, 61.15]
  - - [4, 448, 1, 256]
    - [1, 0.166]
  - - [2944, 704, 1, 128]
    - [3, 36.657]
  - - [256, 5888, 1, 1280]
    - [2, 55.057]
  - - [4, 128, 1, 1280]
    - [16, 0.16]
  - - [4288, 6784, 1, 3328]
    - [8, 74.298]
  - - [6784, 128, 1, 1280]
    - [3, 55.603]
  - - [64, 1408, 1, 256]
    - [12, 6.571]
  - - [7680, 5481, 1, 2560]
    - [8, 75.911]
  - - [2368, 1408, 1, 128]
    - [2, 48.127]
  - - [1856, 448, 1, 256]
    - [2, 34.948]
  - - [1408, 1024, 1, 128]
    - [2, 31.981]
  - - [128, 64, 1, 128]
    - [41, 0.374]
  - - [6784, 3584, 1, 3328]
    - [7, 75.458]
  - - [2944, 64, 1, 3328]
    - [22, 42.33]
  - - [64, 64, 1, 128]
    - [0, 0.205]
  - - [2368, 5056, 1, 1280]
    - [2, 70.004]
  - - [64, 4, 1, 1280]
    - [16, 0.107]
  - - [1408, 2368, 1, 1280]
    - [5, 64.947]
  - - [128, 1408, 1, 1280]
    - [11, 29.227]
  - - [256, 64, 1, 3328]
    - [24, 11.866]
  - - [2944, 4288, 1, 128]
    - [2, 59.079]
  - - [2944, 2944, 1, 256]
    - [8, 63.871]
  - - [2944, 4, 1, 1280]
    - [17, 3.169]
  - - [5888, 4, 1, 256]
    - [0, 1.883]
  - - [6784, 256, 1, 256]
    - [3, 50.247]
  - - [256, 5056, 1, 3328]
    - [2, 64.479]
  - - [128, 4288, 1, 1280]
    - [4, 44.999]
  - - [5056, 1856, 1, 128]
    - [2, 61.813]
  - - [5888, 1408, 1, 256]
    - [2, 63.274]
  - - [128, 128, 1, 256]
    - [31, 1.311]
  - - [5056, 4, 1, 3328]
    - [15, 7.75]
  - - [4288, 3584, 1, 3328]
    - [8, 73.067]
  - - [448, 704, 1, 3328]
    - [11, 50.06]
  - - [448, 448, 1, 128]
    - [0, 7.773]
  - - [1024, 2368, 1, 1280]
    - [3, 61.26]
  - - [1856, 704, 1, 3328]
    - [2, 65.607]
  - - [4, 2368, 1, 128]
    - [0, 0.449]
  - - [5888, 6784, 1, 3328]
    - [8, 75.734]
  - - [704, 4288, 1, 1280]
    - [3, 65.814]
  - - [704, 256, 1, 256]
    - [0, 11.066]
  - - [6784, 448, 1, 3328]
    - [3, 67.704]
  - - [4288, 1024, 1, 128]
    - [3, 54.005]
- null
