library/src/blas3/Tensile/Logic/asm_full/aldebaran_Cijk_Ailk_Bjlk_BBH.yaml
- {MinimumRequiredVersion: 4.14.0}
- aldebaran
- gfx90a
- [Device 0050, Device 0051, Device 0052, Device 0054, Device 0062, Device 7400, Device
    SolutionIndex: 0
    SolutionIndex: 1
    SolutionIndex: 2
    SolutionIndex: 3
    SolutionIndex: 4
    SolutionIndex: 5
    SolutionIndex: 6
    SolutionIndex: 7
    SolutionIndex: 8
    SolutionIndex: 9
    SolutionIndex: 10
    SolutionIndex: 11
    SolutionIndex: 12
    SolutionIndex: 13
    SolutionIndex: 14
    SolutionIndex: 15
    SolutionIndex: 16
    SolutionIndex: 17
    SolutionIndex: 18
    SolutionIndex: 19
    SolutionIndex: 20
    SolutionIndex: 21
    SolutionIndex: 22
    SolutionIndex: 23
    SolutionIndex: 24
    SolutionIndex: 25
    SolutionNameMin: Cijk_Ailk_Bjlk_BBH_MT128x96x32_MI32x32x4x1_SE_AF0EM4_GRVW4_NLCA1_NLCB3_SU16_SUS128_SRVW4_TT1_96_WG128_2_1_WGM15
    SolutionIndex: 26
    SolutionNameMin: Cijk_Ailk_Bjlk_BBH_MT128x80x64_MI16x16x8x1_SE_AF0EM4_GRVW2_NLCA1_NLCB5_SU32_SUS128_SRVW0_TT2_80_WG64_4_1_WGM2
    SolutionIndex: 27
    SolutionNameMin: Cijk_Ailk_Bjlk_BBH_MT128x96x32_MI32x32x4x1_SE_AF0EM4_GRVW4_NLCA1_NLCB3_SU32_SUS128_SRVW4_TT1_96_WG128_2_1_WGM15
    SolutionIndex: 28
    SolutionNameMin: Cijk_Ailk_Bjlk_BBH_MT32x32x16_MI16x16x8x1_SE_AF0EM4_GRVW4_NLCA1_NLCB1_SU0_SUS256_SRVW0_TT1_16_WG32_8_1_WGM2
    SolutionIndex: 29
    SolutionNameMin: Cijk_Ailk_Bjlk_BBH_MT32x32x64_MI16x16x8x1_SE_AF0EM1_GRVW8_NLCA1_NLCB1_SU0_SUS256_SRVW0_TT1_16_WG32_8_1_WGM2
    SolutionIndex: 30
    SolutionNameMin: Cijk_Ailk_Bjlk_BBH_MT32x32x16_MI16x16x8x1_SE_AF0EM4_GRVW2_NLCA1_NLCB1_SU0_SUS256_SRVW0_TT1_16_WG32_8_1_WGM1
    SolutionIndex: 31
    SolutionNameMin: Cijk_Ailk_Bjlk_BBH_MT64x32x16_MI16x16x8x1_SE_AF0EM4_GRVW2_NLCA1_NLCB1_SU32_SUS256_SRVW0_TT2_16_WG32_8_1_WGM2
    SolutionIndex: 32
    SolutionNameMin: Cijk_Ailk_Bjlk_BBH_MT128x80x64_MI16x16x8x1_SE_AF0EM4_GRVW2_NLCA1_NLCB5_SU32_SUS256_SRVW0_TT2_80_WG64_4_1_WGM2
    SolutionIndex: 33
    SolutionNameMin: Cijk_Ailk_Bjlk_BBH_MT32x32x64_MI16x16x8x1_SE_AF0EM4_GRVW8_NLCA1_NLCB1_SU16_SUS128_SRVW0_TT1_16_WG32_8_1_WGM1
    SolutionIndex: 34
    SolutionNameMin: Cijk_Ailk_Bjlk_BBH_MT64x128x32_MI32x32x4x1_SE_AF0EM4_GRVW8_NLCA1_NLCB1_SU0_SUS256_SRVW4_TT1_64_WG64_4_1_WGM15
    SolutionIndex: 35
    SolutionNameMin: Cijk_Ailk_Bjlk_BBH_MT64x32x16_MI16x16x8x1_SE_AF0EM4_GRVW2_NLCA1_NLCB1_SU16_SUS256_SRVW0_TT2_16_WG32_8_1_WGM2
    SolutionIndex: 36
    SolutionNameMin: Cijk_Ailk_Bjlk_BBH_MT128x96x32_MI32x32x4x1_SE_AF0EM4_GRVW4_NLCA1_NLCB3_SU16_SUS256_SRVW4_TT1_96_WG128_2_1_WGM2
    SolutionIndex: 37
    SolutionNameMin: Cijk_Ailk_Bjlk_BBH_MT32x32x16_MI16x16x8x1_SE_AF0EM1_GRVW2_NLCA1_NLCB1_SU0_SUS256_SRVW0_TT1_16_WG32_8_1_WGM1
    SolutionIndex: 38
    SolutionNameMin: Cijk_Ailk_Bjlk_BBH_MT128x96x32_MI32x32x4x1_SE_AF0EM4_GRVW4_NLCA1_NLCB3_SU0_SUS256_SRVW4_TT1_96_WG128_2_1_WGM2
    SolutionIndex: 39
    SolutionNameMin: Cijk_Ailk_Bjlk_BBH_MT32x64x16_MI16x16x8x1_SE_AF0EM4_GRVW4_NLCA1_NLCB1_SU0_SUS256_SRVW0_TT1_32_WG32_8_1_WGM1
    SolutionIndex: 40
    SolutionNameMin: Cijk_Ailk_Bjlk_BBH_MT32x32x64_MI16x16x8x1_SE_AF0EM4_GRVW8_NLCA1_NLCB1_SU32_SUS128_SRVW0_TT1_16_WG32_8_1_WGM1
    SolutionIndex: 41
    SolutionNameMin: Cijk_Ailk_Bjlk_BBH_MT128x96x32_MI32x32x4x1_SE_AF0EM4_GRVW4_NLCA1_NLCB3_SU0_SUS256_SRVW4_TT1_96_WG128_2_1_WGM15
    SolutionIndex: 42
    SolutionNameMin: Cijk_Ailk_Bjlk_BBH_MT32x64x16_MI16x16x8x1_SE_AF0EM1_GRVW2_NLCA1_NLCB1_SU0_SUS256_SRVW0_TT1_32_WG32_8_1_WGM1
    SolutionIndex: 43
    SolutionNameMin: Cijk_Ailk_Bjlk_BBH_MT32x32x16_MI16x16x8x1_SE_AF0EM4_GRVW4_NLCA1_NLCB1_SU0_SUS256_SRVW0_TT1_16_WG32_8_1_WGM15
    SolutionIndex: 44
    SolutionNameMin: Cijk_Ailk_Bjlk_BBH_MT64x64x32_MI32x32x4x1_SE_AF0EM1_GRVW8_NLCA1_NLCB1_SU32_SUS128_SRVW4_TT1_32_WG64_4_1_WGM1
    SolutionIndex: 45
    SolutionNameMin: Cijk_Ailk_Bjlk_BBH_MT128x96x32_MI32x32x4x1_SE_AF0EM1_GRVW4_NLCA1_NLCB3_SU0_SUS256_SRVW4_TT1_96_WG128_2_1_WGM1
    SolutionIndex: 46
    SolutionNameMin: Cijk_Ailk_Bjlk_BBH_MT32x64x16_MI16x16x8x1_SE_AF0EM1_GRVW8_NLCA1_NLCB1_SU16_SUS128_SRVW0_TT1_32_WG32_8_1_WGM2
    SolutionIndex: 47
    SolutionNameMin: Cijk_Ailk_Bjlk_BBH_MT128x96x32_MI32x32x4x1_SE_AF0EM1_GRVW4_NLCA1_NLCB3_SU0_SUS256_SRVW4_TT1_96_WG128_2_1_WGM15
    SolutionIndex: 48
    SolutionNameMin: Cijk_Ailk_Bjlk_BBH_MT128x96x32_MI32x32x4x1_SE_AF0EM4_GRVW4_NLCA1_NLCB3_SU0_SUS256_SRVW4_TT1_96_WG128_2_1_WGM1
    SolutionIndex: 49
    SolutionNameMin: Cijk_Ailk_Bjlk_BBH_MT128x96x32_MI32x32x4x1_SE_AF0EM4_GRVW4_NLCA1_NLCB3_SU16_SUS128_SRVW4_TT1_96_WG128_2_1_WGM2
    SolutionIndex: 50
    SolutionNameMin: Cijk_Ailk_Bjlk_BBH_MT128x288x32_MI32x32x4x1_SE_AF0EM4_GRVW2_NLCA1_NLCB9_SU0_SUS256_SRVW0_TT1_288_WG128_2_1_WGM2
    SolutionIndex: 51
    SolutionNameMin: Cijk_Ailk_Bjlk_BBH_MT128x80x64_MI16x16x8x1_SE_AF0EM4_GRVW2_NLCA1_NLCB5_SU16_SUS128_SRVW0_TT2_80_WG64_4_1_WGM2
    SolutionIndex: 52
    SolutionNameMin: Cijk_Ailk_Bjlk_BBH_MT128x128x32_MI32x32x4x1_SE_AF0EM4_GRVW4_NLCA1_NLCB1_SU0_SUS256_SRVW4_TT2_64_WG64_4_1_WGM2
    SolutionIndex: 53
    SolutionNameMin: Cijk_Ailk_Bjlk_BBH_MT128x96x32_MI32x32x4x1_SE_AF0EM4_GRVW4_NLCA1_NLCB3_SU0_SUS256_SRVW0_TT1_96_WG128_2_1_WGM2
    SolutionIndex: 54
    SolutionNameMin: Cijk_Ailk_Bjlk_BBH_MT64x64x16_MI32x32x4x1_SE_AF0EM4_GRVW4_NLCA1_NLCB1_SU32_SUS256_SRVW0_TT1_32_WG64_4_1_WGM2
    SolutionIndex: 55
    SolutionNameMin: Cijk_Ailk_Bjlk_BBH_MT32x64x16_MI16x16x8x1_SE_AF0EM1_GRVW2_NLCA1_NLCB1_SU32_SUS256_SRVW0_TT1_32_WG32_8_1_WGM1
    SolutionIndex: 56
    SolutionNameMin: Cijk_Ailk_Bjlk_BBH_MT64x32x16_MI16x16x8x1_SE_AF0EM4_GRVW2_NLCA1_NLCB1_SU0_SUS256_SRVW0_TT2_16_WG32_8_1_WGM1
    SolutionIndex: 57
    SolutionNameMin: Cijk_Ailk_Bjlk_BBH_MT128x96x32_MI32x32x4x1_SE_AF0EM4_GRVW4_NLCA1_NLCB3_SU32_SUS128_SRVW4_TT1_96_WG128_2_1_WGM2
    SolutionIndex: 58
    SolutionNameMin: Cijk_Ailk_Bjlk_BBH_MT64x32x16_MI16x16x8x1_SE_AF0EM4_GRVW4_NLCA1_NLCB1_SU0_SUS256_SRVW0_TT2_16_WG32_8_1_WGM1
    SolutionIndex: 59
    SolutionNameMin: Cijk_Ailk_Bjlk_BBH_MT64x64x16_MI32x32x4x1_SE_AF0EM4_GRVW8_NLCA1_NLCB1_SU32_SUS256_SRVW0_TT1_32_WG64_4_1_WGM2
    SolutionIndex: 60
    SolutionNameMin: Cijk_Ailk_Bjlk_BBH_MT128x96x32_MI32x32x4x1_SE_AF0EM1_GRVW4_NLCA1_NLCB3_SU0_SUS256_SRVW4_TT1_96_WG128_2_1_WGM2
    SolutionIndex: 61
    SolutionNameMin: Cijk_Ailk_Bjlk_BBH_MT128x288x16_MI32x32x4x1_SE_AF0EM4_GRVW2_NLCA1_NLCB9_SU0_SUS256_SRVW0_TT1_288_WG128_2_1_WGM15
    SolutionIndex: 62
    SolutionNameMin: Cijk_Ailk_Bjlk_BBH_MT128x96x32_MI32x32x4x1_SE_AF0EM4_GRVW4_NLCA1_NLCB3_SU0_SUS256_SRVW0_TT1_96_WG128_2_1_WGM1
    SolutionIndex: 63
    SolutionNameMin: Cijk_Ailk_Bjlk_BBH_MT128x128x16_MI32x32x4x1_SE_AF0EM4_GRVW8_NLCA1_NLCB1_SU16_SUS256_SRVW4_TT2_64_WG64_4_1_WGM15
    SolutionIndex: 64
    SolutionNameMin: Cijk_Ailk_Bjlk_BBH_MT128x128x16_MI32x32x4x1_SE_AF0EM4_GRVW8_NLCA1_NLCB1_SU16_SUS128_SRVW4_TT2_64_WG64_4_1_WGM15
    SolutionIndex: 65
    SolutionNameMin: Cijk_Ailk_Bjlk_BBH_MT128x128x16_MI32x32x4x1_SE_AF0EM4_GRVW8_NLCA1_NLCB1_SU32_SUS256_SRVW4_TT2_64_WG64_4_1_WGM15
    SolutionIndex: 66
    SolutionNameMin: Cijk_Ailk_Bjlk_BBH_MT128x96x32_MI32x32x4x1_SE_AF0EM4_GRVW4_NLCA1_NLCB3_SU32_SUS256_SRVW4_TT1_96_WG128_2_1_WGM2
    SolutionIndex: 67
    SolutionNameMin: Cijk_Ailk_Bjlk_BBH_MT32x64x16_MI16x16x8x1_SE_AF0EM4_GRVW2_NLCA1_NLCB1_SU32_SUS256_SRVW0_TT1_32_WG32_8_1_WGM2
    SolutionIndex: 68
    SolutionNameMin: Cijk_Ailk_Bjlk_BBH_MT64x64x32_MI32x32x4x1_SE_AF0EM1_GRVW8_NLCA1_NLCB1_SU0_SUS256_SRVW4_TT1_32_WG64_4_1_WGM2
    SolutionIndex: 69
    SolutionNameMin: Cijk_Ailk_Bjlk_BBH_MT128x96x32_MI32x32x4x1_SE_AF0EM4_GRVW4_NLCA1_NLCB3_SU32_SUS128_SRVW4_TT1_96_WG128_2_1_WGM1
    SolutionIndex: 70
    SolutionNameMin: Cijk_Ailk_Bjlk_BBH_MT32x32x64_MI16x16x8x1_SE_AF0EM4_GRVW8_NLCA1_NLCB1_SU0_SUS256_SRVW0_TT1_16_WG32_8_1_WGM15
    SolutionIndex: 71
    SolutionNameMin: Cijk_Ailk_Bjlk_BBH_MT32x64x16_MI16x16x8x1_SE_AF0EM1_GRVW4_NLCA1_NLCB1_SU0_SUS256_SRVW0_TT1_32_WG32_8_1_WGM1
    SolutionIndex: 72
    SolutionNameMin: Cijk_Ailk_Bjlk_BBH_MT128x96x32_MI32x32x4x1_SE_AF0EM4_GRVW4_NLCA1_NLCB3_SU32_SUS256_SRVW4_TT1_96_WG128_2_1_WGM15
    SolutionIndex: 73
    SolutionNameMin: Cijk_Ailk_Bjlk_BBH_MT128x96x32_MI32x32x4x1_SE_AF0EM4_GRVW4_NLCA1_NLCB3_SU16_SUS128_SRVW4_TT1_96_WG128_2_1_WGM1
    SolutionIndex: 74
    SolutionNameMin: Cijk_Ailk_Bjlk_BBH_MT64x32x16_MI16x16x8x1_SE_AF0EM4_GRVW8_NLCA1_NLCB1_SU16_SUS128_SRVW0_TT2_16_WG32_8_1_WGM1
    SolutionIndex: 75
    SolutionNameMin: Cijk_Ailk_Bjlk_BBH_MT128x96x32_MI32x32x4x1_SE_AF0EM1_GRVW4_NLCA1_NLCB3_SU16_SUS128_SRVW4_TT1_96_WG128_2_1_WGM15
    SolutionIndex: 76
    SolutionNameMin: Cijk_Ailk_Bjlk_BBH_MT64x32x16_MI16x16x8x1_SE_AF0EM4_GRVW2_NLCA1_NLCB1_SU16_SUS256_SRVW0_TT2_16_WG32_8_1_WGM1
    SolutionIndex: 77
    SolutionNameMin: Cijk_Ailk_Bjlk_BBH_MT32x32x16_MI16x16x8x1_SE_AF0EM4_GRVW2_NLCA1_NLCB1_SU16_SUS128_SRVW0_TT1_16_WG32_8_1_WGM2
    SolutionIndex: 78
    SolutionNameMin: Cijk_Ailk_Bjlk_BBH_MT32x64x16_MI16x16x8x1_SE_AF0EM1_GRVW4_NLCA1_NLCB1_SU16_SUS256_SRVW0_TT1_32_WG32_8_1_WGM2
    SolutionIndex: 79
    SolutionNameMin: Cijk_Ailk_Bjlk_BBH_MT32x32x16_MI16x16x8x1_SE_AF0EM4_GRVW2_NLCA1_NLCB1_SU16_SUS256_SRVW0_TT1_16_WG32_8_1_WGM15
    SolutionIndex: 80
    SolutionNameMin: Cijk_Ailk_Bjlk_BBH_MT64x64x32_MI32x32x4x1_SE_AF0EM1_GRVW8_NLCA1_NLCB1_SU0_SUS256_SRVW4_TT1_32_WG64_4_1_WGM15
    SolutionIndex: 81
    SolutionNameMin: Cijk_Ailk_Bjlk_BBH_MT128x96x32_MI32x32x4x1_SE_AF0EM1_GRVW4_NLCA1_NLCB3_SU32_SUS128_SRVW4_TT1_96_WG128_2_1_WGM15
    SolutionIndex: 82
    SolutionNameMin: Cijk_Ailk_Bjlk_BBH_MT128x96x32_MI32x32x4x1_SE_AF0EM1_GRVW4_NLCA1_NLCB3_SU32_SUS128_SRVW4_TT1_96_WG128_2_1_WGM2
    SolutionIndex: 83
    SolutionNameMin: Cijk_Ailk_Bjlk_BBH_MT32x32x16_MI16x16x8x1_SE_AF0EM4_GRVW2_NLCA1_NLCB1_SU16_SUS256_SRVW0_TT1_16_WG32_8_1_WGM2
    SolutionIndex: 84
    SolutionNameMin: Cijk_Ailk_Bjlk_BBH_MT64x64x32_MI32x32x4x1_SE_AF0EM1_GRVW4_NLCA1_NLCB1_SU32_SUS256_SRVW4_TT1_32_WG64_4_1_WGM2
    SolutionIndex: 85
    SolutionNameMin: Cijk_Ailk_Bjlk_BBH_MT128x96x32_MI32x32x4x1_SE_AF0EM1_GRVW4_NLCA1_NLCB3_SU16_SUS256_SRVW4_TT1_96_WG128_2_1_WGM15
    SolutionIndex: 86
    SolutionNameMin: Cijk_Ailk_Bjlk_BBH_MT128x96x16_MI32x32x4x1_SE_AF0EM4_GRVW2_NLCA1_NLCB3_SU16_SUS128_SRVW4_TT1_96_WG128_2_1_WGM2
    SolutionIndex: 87
    SolutionNameMin: Cijk_Ailk_Bjlk_BBH_MT64x64x32_MI32x32x4x1_SE_AF0EM1_ASBE01_GRVW4_PBD0_SRVW4_TT1_32_WG64_4_1_WGM10
    SolutionIndex: 88
    SolutionNameMin: Cijk_Ailk_Bjlk_BBH_MT128x128x32_MI32x32x4x1_SE_AF0EM4_ASBE01_GRVW4_PBD0_SRVW4_TT2_64_WG64_4_1_WGM10
    SolutionIndex: 89
    SolutionNameMin: Cijk_Ailk_Bjlk_BBH_MT128x128x32_MI32x32x4x1_SE_AF0EM4_ASBE01_GRVW4_PBD0_SRVW4_TT2_64_WG64_4_1_WGM4
    SolutionIndex: 90
    SolutionNameMin: Cijk_Ailk_Bjlk_BBH_MT128x256x32_MI32x32x4x1_SE_AF0EM8_GRVW8_GSU1_SU32_SUS128_SRVW4_WG64_4_1_WGM15
    SolutionIndex: 91
    SolutionNameMin: Cijk_Ailk_Bjlk_BBH_MT128x256x16_MI32x32x4x1_SE_AF0EM8_GRVW8_GSU1_SU0_SUS256_SRVW4_WG64_4_1_WGM1
    SolutionIndex: 92
    SolutionNameMin: Cijk_Ailk_Bjlk_BBH_MT128x256x16_MI32x32x4x1_SE_AF0EM8_GRVW8_GSU1_SU0_SUS256_SRVW4_WG64_4_1_WGM15
    SolutionIndex: 93
    SolutionNameMin: Cijk_Ailk_Bjlk_BBH_MT128x160x16_MI32x32x4x1_SE_AF0EM8_GRVW2_GSU1_SU32_SUS128_SRVW4_WG128_2_1_WGM1
    SolutionIndex: 94
    SolutionNameMin: Cijk_Ailk_Bjlk_BBH_MT128x128x16_MI32x32x4x1_SE_AF0EM8_GRVW8_GSU1_SU32_SUS256_SRVW4_WG64_4_1_WGM15
    SolutionIndex: 95
    SolutionNameMin: Cijk_Ailk_Bjlk_BBH_MT128x256x32_MI32x32x4x1_SE_AF0EM8_GRVW8_GSU1_SU0_SUS256_SRVW4_WG64_4_1_WGM1
    SolutionIndex: 96
    SolutionNameMin: Cijk_Ailk_Bjlk_BBH_MT128x128x16_MI32x32x4x1_SE_AF0EM8_GRVW8_GSU1_SU32_SUS128_SRVW4_WG64_4_1_WGM15
    SolutionIndex: 97
    SolutionNameMin: Cijk_Ailk_Bjlk_BBH_MT128x96x32_MI32x32x4x1_SE_AF0EM8_GRVW4_GSU1_SU32_SUS128_SRVW4_WG128_2_1_WGM15
    SolutionIndex: 98
    SolutionNameMin: Cijk_Ailk_Bjlk_BBH_MT128x96x32_MI32x32x4x1_SE_AF0EM8_GRVW4_GSU1_SU32_SUS256_SRVW4_WG128_2_1_WGM2
    SolutionIndex: 99
    SolutionNameMin: Cijk_Ailk_Bjlk_BBH_MT64x64x64_MI32x32x4x1_SE_AF0EM8_GRVW8_GSU1_SU0_SUS256_SRVW4_WG64_4_1_WGM1
    SolutionIndex: 100
    SolutionNameMin: Cijk_Ailk_Bjlk_BBH_MT128x128x32_MI32x32x4x1_SE_AF0EM8_GRVW8_GSU1_SU32_SUS128_SRVW4_WG64_4_1_WGM15
    SolutionIndex: 101
    SolutionNameMin: Cijk_Ailk_Bjlk_BBH_MT128x128x16_MI32x32x4x1_SE_AF0EM8_GRVW8_GSU1_SU0_SUS256_SRVW4_WG64_4_1_WGM1
    SolutionIndex: 102
    SolutionNameMin: Cijk_Ailk_Bjlk_BBH_MT128x128x16_MI32x32x4x1_SE_AF0EM8_GRVW8_GSU1_SU0_SUS256_SRVW4_WG64_4_1_WGM1
    SolutionIndex: 103
    SolutionNameMin: Cijk_Ailk_Bjlk_BBH_MT128x128x32_MI32x32x4x1_SE_AF0EM8_GRVW8_GSU1_SU32_SUS256_SRVW4_WG64_4_1_WGM15
    SolutionIndex: 104
    SolutionNameMin: Cijk_Ailk_Bjlk_BBH_MT128x128x16_MI32x32x4x1_SE_AF0EM8_GRVW8_GSU1_SU32_SUS128_SRVW4_WG64_4_1_WGM15
    SolutionIndex: 105
    SolutionNameMin: Cijk_Ailk_Bjlk_BBH_MT128x128x32_MI32x32x4x1_SE_AF0EM8_GRVW8_GSU1_SU32_SUS128_SRVW4_WG64_4_1_WGM2
    SolutionIndex: 106
    SolutionNameMin: Cijk_Ailk_Bjlk_BBH_MT128x160x32_MI32x32x4x1_SE_AF0EM8_GRVW2_GSU1_SU0_SUS256_SRVW4_WG128_2_1_WGM2
    SolutionIndex: 107
    SolutionNameMin: Cijk_Ailk_Bjlk_BBH_MT128x96x32_MI32x32x4x1_SE_AF0EM8_GRVW4_GSU1_SU32_SUS128_SRVW4_WG128_2_1_WGM1
    SolutionIndex: 108
    SolutionNameMin: Cijk_Ailk_Bjlk_BBH_MT128x96x32_MI32x32x4x1_SE_AF0EM8_GRVW4_GSU1_SU32_SUS256_SRVW4_WG128_2_1_WGM15
    SolutionIndex: 109
    SolutionNameMin: Cijk_Ailk_Bjlk_BBH_MT32x64x16_MI16x16x8x1_SE_AF0EM1_GRVW2_GSU1_SU32_SUS128_SRVW4_WG32_8_1_WGM2
    SolutionIndex: 110
    SolutionNameMin: Cijk_Ailk_Bjlk_BBH_MT128x256x16_MI32x32x4x1_SE_AF0EM8_GRVW8_GSU1_SU0_SUS256_SRVW4_WG64_4_1_WGM2
    SolutionIndex: 111
    SolutionNameMin: Cijk_Ailk_Bjlk_BBH_MT64x128x64_MI32x32x4x1_SE_AF0EM8_GRVW8_GSU1_SU0_SUS256_SRVW4_WG64_4_1_WGM2
    SolutionIndex: 112
    SolutionNameMin: Cijk_Ailk_Bjlk_BBH_MT32x32x64_MI16x16x8x1_SE_AF0EM8_GRVW8_GSU1_SU0_SUS256_SRVW4_WG32_8_1_WGM1
    SolutionIndex: 113
    SolutionNameMin: Cijk_Ailk_Bjlk_BBH_MT256x128x32_MI32x32x4x1_SE_AF0EM8_GRVW8_GSU1_SU32_SUS256_SRVW4_WG64_4_1_WGM15
    SolutionIndex: 114
    SolutionNameMin: Cijk_Ailk_Bjlk_BBH_MT128x64x64_MI32x32x4x1_SE_AF0EM8_GRVW4_GSU1_SU0_SUS256_SRVW4_WG64_4_1_WGM2
    SolutionIndex: 115
    SolutionNameMin: Cijk_Ailk_Bjlk_BBH_MT64x32x64_MI16x16x8x1_SE_AF0EM8_GRVW8_GSU1_SU0_SUS256_SRVW4_WG32_8_1_WGM1
    SolutionIndex: 116
    SolutionNameMin: Cijk_Ailk_Bjlk_BBH_MT64x64x64_MI32x32x4x1_SE_AF0EM8_GRVW4_GSU1_SU0_SUS256_SRVW4_WG64_4_1_WGM2
    SolutionIndex: 117
    SolutionNameMin: Cijk_Ailk_Bjlk_BBH_MT64x64x32_MI32x32x4x1_SE_AF0EM8_GRVW8_GSU1_SU0_SUS256_SRVW4_WG64_4_1_WGM15
    SolutionIndex: 118
    SolutionNameMin: Cijk_Ailk_Bjlk_BBH_MT64x64x16_MI32x32x4x1_SE_AF0EM8_GRVW2_GSU1_SU0_SUS256_SRVW4_WG64_4_1_WGM1
    SolutionIndex: 119
    SolutionNameMin: Cijk_Ailk_Bjlk_BBH_MT16x64x64_MI16x16x8x1_SE_AF0EM1_GRVW2_GSU2_SU32_SUS256_SRVW0_WG16_16_1_WGM1
    SolutionIndex: 120
    SolutionNameMin: Cijk_Ailk_Bjlk_BBH_MT64x64x16_MI32x32x4x1_SE_AF0EM8_GRVW2_GSU1_SU0_SUS256_SRVW4_WG64_4_1_WGM2
    SolutionIndex: 121
    SolutionNameMin: Cijk_Ailk_Bjlk_BBH_MT64x64x64_MI32x32x4x1_SE_AF0EM8_GRVW8_GSU1_SU32_SUS256_SRVW4_WG64_4_1_WGM2
    SolutionIndex: 122
    SolutionNameMin: Cijk_Ailk_Bjlk_BBH_MT128x96x32_MI32x32x4x1_SE_AF0EM8_GRVW4_GSU1_SU32_SUS128_SRVW4_WG128_2_1_WGM15
    SolutionIndex: 123
    SolutionNameMin: Cijk_Ailk_Bjlk_BBH_MT64x64x32_MI32x32x4x1_SE_AF0EM8_GRVW8_GSU1_SU0_SUS256_SRVW4_WG64_4_1_WGM1
    SolutionIndex: 124
    SolutionNameMin: Cijk_Ailk_Bjlk_BBH_MT32x32x16_MI16x16x8x1_SE_AF0EM8_GRVW2_GSU1_SU0_SUS256_SRVW4_WG32_8_1_WGM1
    SolutionIndex: 125
    SolutionNameMin: Cijk_Ailk_Bjlk_BBH_MT32x32x64_MI16x16x8x1_SE_AF0EM8_GRVW2_GSU5_SU32_SUS128_SRVW0_WG32_8_1_WGM1
    SolutionIndex: 126
    SolutionNameMin: Cijk_Ailk_Bjlk_BBH_MT64x64x16_MI32x32x4x1_SE_AF0EM8_GRVW2_GSU1_SU32_SUS256_SRVW4_WG64_4_1_WGM2
    SolutionIndex: 127
    SolutionNameMin: Cijk_Ailk_Bjlk_BBH_MT64x64x32_MI32x32x4x1_SE_AF0EM8_GRVW8_GSU1_SU32_SUS256_SRVW4_WG64_4_1_WGM15
    SolutionIndex: 128
    SolutionNameMin: Cijk_Ailk_Bjlk_BBH_MT128x256x16_MI32x32x4x1_SE_AF0EM8_GRVW4_GSU1_SU32_SUS256_SRVW4_WG64_4_1_WGM2
    SolutionIndex: 129
    SolutionNameMin: Cijk_Ailk_Bjlk_BBH_MT64x128x16_MI32x32x4x1_SE_AF0EM8_GRVW2_GSU1_SU32_SUS256_SRVW4_WG64_4_1_WGM15
    SolutionIndex: 130
    SolutionNameMin: Cijk_Ailk_Bjlk_BBH_MT64x16x64_MI16x16x8x1_SE_AF0EM8_GRVW2_GSU7_SU0_SUS256_SRVW0_WG64_4_1_WGM1
    SolutionIndex: 131
    SolutionNameMin: Cijk_Ailk_Bjlk_BBH_MT64x32x16_MI16x16x8x1_SE_AF0EM8_GRVW2_GSU1_SU0_SUS256_SRVW4_WG32_8_1_WGM15
    SolutionIndex: 132
    SolutionNameMin: Cijk_Ailk_Bjlk_BBH_MT128x160x32_MI32x32x4x1_SE_AF0EM8_GRVW2_GSU2_SU0_SUS256_SRVW0_WG128_2_1_WGM15
    SolutionIndex: 133
    SolutionNameMin: Cijk_Ailk_Bjlk_BBH_MT64x64x64_MI32x32x4x1_SE_AF0EM8_GRVW8_GSU1_SU0_SUS256_SRVW4_WG64_4_1_WGM2
    SolutionIndex: 134
    SolutionNameMin: Cijk_Ailk_Bjlk_BBH_MT32x32x16_MI16x16x8x1_SE_AF0EM8_GRVW4_GSU1_SU0_SUS256_SRVW4_WG32_8_1_WGM1
    SolutionIndex: 135
    SolutionNameMin: Cijk_Ailk_Bjlk_BBH_MT64x16x64_MI16x16x8x1_SE_AF0EM8_GRVW2_GSU7_SU32_SUS128_SRVW0_WG64_4_1_WGM1
    SolutionIndex: 136
    SolutionNameMin: Cijk_Ailk_Bjlk_BBH_MT64x64x16_MI32x32x4x1_SE_AF0EM8_GRVW2_GSU1_SU0_SUS256_SRVW4_WG64_4_1_WGM15
    SolutionIndex: 137
    SolutionNameMin: Cijk_Ailk_Bjlk_BBH_MT64x64x32_MI32x32x4x1_SE_AF0EM8_GRVW4_GSU1_SU0_SUS256_SRVW4_WG64_4_1_WGM15
    SolutionIndex: 138
    SolutionNameMin: Cijk_Ailk_Bjlk_BBH_MT128x256x16_MI32x32x4x1_SE_AF0EM8_GRVW4_GSU1_SU32_SUS256_SRVW4_WG64_4_1_WGM2
    SolutionIndex: 139
    SolutionNameMin: Cijk_Ailk_Bjlk_BBH_MT64x16x64_MI16x16x8x1_SE_AF0EM1_GRVW2_GSU15_SU32_SUS128_SRVW0_WG64_4_1_WGM2
    SolutionIndex: 140
    SolutionNameMin: Cijk_Ailk_Bjlk_BBH_MT160x128x32_MI32x32x4x1_SE_AF0EM8_GRVW2_GSU2_SU0_SUS256_SRVW0_WG32_8_1_WGM1
    SolutionIndex: 141
    SolutionNameMin: Cijk_Ailk_Bjlk_BBH_MT128x128x16_MI32x32x4x1_SE_AF0EM8_GRVW8_GSU1_SU0_SUS256_SRVW4_WG64_4_1_WGM2
    SolutionIndex: 142
    SolutionNameMin: Cijk_Ailk_Bjlk_BBH_MT64x128x16_MI32x32x4x1_SE_AF0EM8_GRVW2_GSU1_SU32_SUS256_SRVW4_WG64_4_1_WGM1
    SolutionIndex: 143
    SolutionNameMin: Cijk_Ailk_Bjlk_BBH_MT64x16x64_MI16x16x8x1_SE_AF0EM8_GRVW2_GSU15_SU32_SUS128_SRVW0_WG64_4_1_WGM2
    SolutionIndex: 144
    SolutionNameMin: Cijk_Ailk_Bjlk_BBH_MT64x32x16_MI16x16x8x1_SE_AF0EM8_GRVW2_GSU1_SU32_SUS256_SRVW4_WG32_8_1_WGM15
    SolutionIndex: 145
    SolutionNameMin: Cijk_Ailk_Bjlk_BBH_MT128x160x32_MI32x32x4x1_SE_AF0EM8_GRVW2_GSU2_SU0_SUS256_SRVW0_WG128_2_1_WGM2
    SolutionIndex: 146
    SolutionNameMin: Cijk_Ailk_Bjlk_BBH_MT64x128x32_MI32x32x4x1_SE_AF0EM8_GRVW8_GSU1_SU32_SUS256_SRVW4_WG64_4_1_WGM15
    SolutionIndex: 147
    SolutionNameMin: Cijk_Ailk_Bjlk_BBH_MT64x16x64_MI16x16x8x1_SE_AF0EM8_GRVW2_GSU7_SU0_SUS256_SRVW0_WG64_4_1_WGM15
    SolutionIndex: 148
    SolutionNameMin: Cijk_Ailk_Bjlk_BBH_MT64x128x32_MI32x32x4x1_SE_AF0EM8_GRVW8_GSU1_SU32_SUS128_SRVW4_WG64_4_1_WGM1
    SolutionIndex: 149
    SolutionNameMin: Cijk_Ailk_Bjlk_BBH_MT16x64x32_MI16x16x8x1_SE_AF0EM8_GRVW2_GSU1_SU0_SUS256_SRVW0_WG16_16_1_WGM2
    SolutionIndex: 150
    SolutionNameMin: Cijk_Ailk_Bjlk_BBH_MT64x16x64_MI16x16x8x1_SE_AF0EM8_GRVW2_GSU7_SU32_SUS128_SRVW0_WG64_4_1_WGM2
    SolutionIndex: 151
    SolutionNameMin: Cijk_Ailk_Bjlk_BBH_MT64x64x32_MI32x32x4x1_SE_AF0EM8_GRVW8_GSU1_SU32_SUS128_SRVW4_WG64_4_1_WGM1
    SolutionIndex: 152
    SolutionNameMin: Cijk_Ailk_Bjlk_BBH_MT16x16x64_MI16x16x8x1_SE_AF0EM8_GRVW2_GSU3_SU32_SUS128_SRVW0_WG16_4_1_WGM1
    SolutionIndex: 153
    SolutionNameMin: Cijk_Ailk_Bjlk_BBH_MT128x256x16_MI32x32x4x1_SE_AF0EM8_GRVW4_GSU1_SU32_SUS128_SRVW4_WG64_4_1_WGM2
    SolutionIndex: 154
    SolutionNameMin: Cijk_Ailk_Bjlk_BBH_MT64x64x32_MI32x32x4x1_SE_AF0EM8_GRVW8_GSU1_SU0_SUS256_SRVW4_WG64_4_1_WGM2
    SolutionIndex: 155
    SolutionNameMin: Cijk_Ailk_Bjlk_BBH_MT16x16x64_MI16x16x8x1_SE_AF0EM8_GRVW2_GSU3_SU0_SUS256_SRVW0_WG16_4_1_WGM1
    SolutionIndex: 156
    SolutionNameMin: Cijk_Ailk_Bjlk_BBH_MT64x64x16_MI32x32x4x1_SE_AF0EM8_GRVW4_GSU1_SU0_SUS256_SRVW4_WG64_4_1_WGM2
    SolutionIndex: 157
    SolutionNameMin: Cijk_Ailk_Bjlk_BBH_MT64x64x64_MI32x32x4x1_SE_AF0EM8_GRVW4_GSU1_SU32_SUS256_SRVW4_WG64_4_1_WGM2
    SolutionIndex: 158
    SolutionNameMin: Cijk_Ailk_Bjlk_BBH_MT128x256x16_MI32x32x4x1_SE_AF0EM8_GRVW4_GSU1_SU32_SUS128_SRVW4_WG64_4_1_WGM2
    SolutionIndex: 159
    SolutionNameMin: Cijk_Ailk_Bjlk_BBH_MT64x64x64_MI32x32x4x1_SE_AF0EM8_GRVW8_GSU15_SU0_SUS256_SRVW0_WG64_4_1_WGM1
    SolutionIndex: 160
    SolutionNameMin: Cijk_Ailk_Bjlk_BBH_MT128x128x16_MI32x32x4x1_SE_AF0EM8_GRVW4_GSU1_SU32_SUS128_SRVW4_WG64_4_1_WGM1
    SolutionIndex: 161
    SolutionNameMin: Cijk_Ailk_Bjlk_BBH_MT128x128x32_MI32x32x4x1_SE_AF0EM8_GRVW8_GSU15_SU0_SUS256_SRVW0_WG64_4_1_WGM15
    SolutionIndex: 162
    SolutionNameMin: Cijk_Ailk_Bjlk_BBH_MT256x128x16_MI32x32x4x1_SE_AF0EM8_GRVW8_GSU7_SU0_SUS256_SRVW0_WG64_4_1_WGM15
    SolutionIndex: 163
    SolutionNameMin: Cijk_Ailk_Bjlk_BBH_MT256x128x16_MI32x32x4x1_SE_AF0EM8_GRVW8_GSU7_SU32_SUS256_SRVW0_WG64_4_1_WGM15
    SolutionIndex: 164
    SolutionNameMin: Cijk_Ailk_Bjlk_BBH_MT64x128x16_MI32x32x4x1_SE_AF0EM8_GRVW2_GSU1_SU32_SUS128_SRVW4_WG64_4_1_WGM1
    SolutionIndex: 165
    SolutionNameMin: Cijk_Ailk_Bjlk_BBH_MT64x64x32_MI32x32x4x1_SE_AF0EM8_GRVW4_GSU1_SU0_SUS256_SRVW4_WG64_4_1_WGM1
    SolutionIndex: 166
    SolutionNameMin: Cijk_Ailk_Bjlk_BBH_MT16x16x32_MI16x16x8x1_SE_AF0EM8_GRVW2_GSU1_SU0_SUS256_SRVW0_WG16_4_1_WGM1
    SolutionIndex: 167
    SolutionNameMin: Cijk_Ailk_Bjlk_BBH_MT64x64x64_MI32x32x4x1_SE_AF0EM8_GRVW8_GSU1_SU32_SUS128_SRVW4_WG64_4_1_WGM1
    SolutionIndex: 168
    SolutionNameMin: Cijk_Ailk_Bjlk_BBH_MT128x160x32_MI32x32x4x1_SE_AF0EM8_GRVW2_GSU2_SU32_SUS128_SRVW0_WG128_2_1_WGM2
    SolutionIndex: 169
    SolutionNameMin: Cijk_Ailk_Bjlk_BBH_MT128x160x32_MI32x32x4x1_SE_AF0EM8_GRVW2_GSU2_SU32_SUS256_SRVW0_WG128_2_1_WGM15
    SolutionIndex: 170
    SolutionNameMin: Cijk_Ailk_Bjlk_BBH_MT160x128x32_MI32x32x4x1_SE_AF0EM8_GRVW2_GSU2_SU32_SUS256_SRVW0_WG32_8_1_WGM15
    SolutionIndex: 171
    SolutionNameMin: Cijk_Ailk_Bjlk_BBH_MT128x160x32_MI32x32x4x1_SE_AF0EM8_GRVW2_GSU2_SU32_SUS256_SRVW0_WG128_2_1_WGM2
    SolutionIndex: 172
    SolutionNameMin: Cijk_Ailk_Bjlk_BBH_MT128x160x32_MI32x32x4x1_SE_AF0EM8_GRVW2_GSU2_SU0_SUS256_SRVW0_WG128_2_1_WGM1
    SolutionIndex: 173
    SolutionNameMin: Cijk_Ailk_Bjlk_BBH_MT160x128x32_MI32x32x4x1_SE_AF0EM8_GRVW2_GSU2_SU0_SUS256_SRVW0_WG32_8_1_WGM15
    SolutionIndex: 174
    SolutionNameMin: Cijk_Ailk_Bjlk_BBH_MT32x64x16_MI16x16x8x1_SE_AF0EM8_GRVW2_GSU1_SU32_SUS256_SRVW4_WG32_8_1_WGM2
    SolutionIndex: 175
    SolutionNameMin: Cijk_Ailk_Bjlk_BBH_MT16x16x16_MI16x16x8x1_SE_AF0EM8_GRVW2_GSU1_SU0_SUS256_SRVW0_WG16_4_1_WGM1
    SolutionIndex: 176
    SolutionNameMin: Cijk_Ailk_Bjlk_BBH_MT64x32x16_MI16x16x8x1_SE_AF0EM8_GRVW2_GSU1_SU32_SUS128_SRVW4_WG32_8_1_WGM2
    SolutionIndex: 177
    SolutionNameMin: Cijk_Ailk_Bjlk_BBH_MT64x64x16_MI32x32x4x1_SE_AF0EM8_GRVW2_GSU1_SU32_SUS128_SRVW4_WG64_4_1_WGM15
    SolutionIndex: 178
    SolutionNameMin: Cijk_Ailk_Bjlk_BBH_MT32x32x64_MI16x16x8x1_SE_AF0EM8_GRVW2_GSU1_SU32_SUS128_SRVW4_WG32_8_1_WGM2
    SolutionIndex: 179
    SolutionNameMin: Cijk_Ailk_Bjlk_BBH_MT32x32x64_MI16x16x8x1_SE_AF0EM8_GRVW8_GSU1_SU0_SUS256_SRVW4_WG32_8_1_WGM2
    SolutionIndex: 180
    SolutionNameMin: Cijk_Ailk_Bjlk_BBH_MT64x64x16_MI32x32x4x1_SE_AF0EM8_GRVW4_GSU1_SU32_SUS128_SRVW4_WG64_4_1_WGM2
    SolutionIndex: 181
    SolutionNameMin: Cijk_Ailk_Bjlk_BBH_MT128x64x32_MI32x32x4x1_SE_AF0EM8_GRVW8_GSU1_SU32_SUS256_SRVW4_WG64_4_1_WGM2
    SolutionIndex: 182
    SolutionNameMin: Cijk_Ailk_Bjlk_BBH_MT32x32x64_MI16x16x8x1_SE_AF0EM8_GRVW8_GSU5_SU32_SUS256_SRVW0_WG32_8_1_WGM1
    SolutionIndex: 183
    SolutionNameMin: Cijk_Ailk_Bjlk_BBH_MT64x64x16_MI32x32x4x1_SE_AF0EM8_GRVW2_GSU1_SU32_SUS128_SRVW4_WG64_4_1_WGM1
    SolutionIndex: 184
    SolutionNameMin: Cijk_Ailk_Bjlk_BBH_MT64x64x32_MI32x32x4x1_SE_AF0EM8_GRVW8_GSU3_SU0_SUS256_SRVW0_WG64_4_1_WGM15
    SolutionIndex: 185
    SolutionNameMin: Cijk_Ailk_Bjlk_BBH_MT64x128x64_MI32x32x4x1_SE_AF0EM8_GRVW4_GSU3_SU0_SUS256_SRVW0_WG64_4_1_WGM1
    SolutionIndex: 186
    SolutionNameMin: Cijk_Ailk_Bjlk_BBH_MT128x128x16_MI32x32x4x1_SE_AF0EM8_GRVW8_GSU3_SU0_SUS256_SRVW0_WG64_4_1_WGM2
    SolutionIndex: 187
    SolutionNameMin: Cijk_Ailk_Bjlk_BBH_MT128x96x32_MI32x32x4x1_SE_AF0EM8_GRVW4_GSU2_SU0_SUS256_SRVW0_WG128_2_1_WGM1
    SolutionIndex: 188
    SolutionNameMin: Cijk_Ailk_Bjlk_BBH_MT128x64x64_MI32x32x4x1_SE_AF0EM8_GRVW4_GSU1_SU0_SUS256_SRVW4_WG64_4_1_WGM15
    SolutionIndex: 189
    SolutionNameMin: Cijk_Ailk_Bjlk_BBH_MT64x128x64_MI32x32x4x1_SE_AF0EM8_GRVW4_GSU1_SU0_SUS256_SRVW4_WG64_4_1_WGM1
    SolutionIndex: 190
    SolutionNameMin: Cijk_Ailk_Bjlk_BBH_MT64x128x64_MI32x32x4x1_SE_AF0EM8_GRVW8_GSU1_SU0_SUS256_SRVW4_WG64_4_1_WGM15
    SolutionIndex: 191
    SolutionNameMin: Cijk_Ailk_Bjlk_BBH_MT128x144x32_MI16x16x8x1_SE_AF0EM8_GRVW2_GSU2_SU0_SUS256_SRVW0_WG64_4_1_WGM15
    SolutionIndex: 192
    SolutionNameMin: Cijk_Ailk_Bjlk_BBH_MT128x256x16_MI32x32x4x1_SE_AF0EM8_GRVW8_GSU3_SU0_SUS256_SRVW0_WG64_4_1_WGM2
    SolutionIndex: 193
    SolutionNameMin: Cijk_Ailk_Bjlk_BBH_MT128x256x16_MI32x32x4x1_SE_AF0EM8_GRVW8_GSU3_SU0_SUS256_SRVW0_WG64_4_1_WGM15
    SolutionIndex: 194
    SolutionNameMin: Cijk_Ailk_Bjlk_BBH_MT128x96x32_MI32x32x4x1_SE_AF0EM8_GRVW4_GSU1_SU0_SUS256_SRVW4_WG128_2_1_WGM2
    SolutionIndex: 195
    SolutionNameMin: Cijk_Ailk_Bjlk_BBH_MT256x160x16_MI32x32x4x1_SE_AF0EM8_GRVW2_GSU3_SU32_SUS128_SRVW0_WG128_2_1_WGM2
    SolutionIndex: 196
    SolutionNameMin: Cijk_Ailk_Bjlk_BBH_MT64x256x32_MI32x32x4x1_SE_AF0EM8_GRVW8_GSU1_SU0_SUS256_SRVW4_WG64_4_1_WGM15
    SolutionIndex: 197
    SolutionNameMin: Cijk_Ailk_Bjlk_BBH_MT128x144x32_MI16x16x8x1_SE_AF0EM8_GRVW2_GSU1_SU0_SUS256_SRVW4_WG64_4_1_WGM1
    SolutionIndex: 198
    SolutionNameMin: Cijk_Ailk_Bjlk_BBH_MT128x160x32_MI32x32x4x1_SE_AF0EM8_GRVW4_GSU1_SU0_SUS256_SRVW4_WG128_2_1_WGM1
    SolutionIndex: 199
    SolutionNameMin: Cijk_Ailk_Bjlk_BBH_MT64x64x64_MI32x32x4x1_SE_AF0EM8_GRVW8_GSU1_SU0_SUS256_SRVW4_WG64_4_1_WGM1
    SolutionIndex: 200
    SolutionNameMin: Cijk_Ailk_Bjlk_BBH_MT256x128x16_MI32x32x4x1_SE_AF0EM8_GRVW4_GSU1_SU0_SUS256_SRVW4_WG64_4_1_WGM15
    SolutionIndex: 201
    SolutionNameMin: Cijk_Ailk_Bjlk_BBH_MT128x256x16_MI32x32x4x1_SE_AF0EM8_GRVW4_GSU1_SU0_SUS256_SRVW4_WG64_4_1_WGM15
    SolutionIndex: 202
    SolutionNameMin: Cijk_Ailk_Bjlk_BBH_MT128x256x16_MI32x32x4x1_SE_AF0EM8_GRVW4_GSU1_SU0_SUS256_SRVW4_WG64_4_1_WGM2
    SolutionIndex: 203
    SolutionNameMin: Cijk_Ailk_Bjlk_BBH_MT256x160x32_MI32x32x4x1_SE_AF0EM8_GRVW4_GSU1_SU32_SUS128_SRVW4_WG128_2_1_WGM2
    SolutionIndex: 204
    SolutionNameMin: Cijk_Ailk_Bjlk_BBH_MT256x160x16_MI32x32x4x1_SE_AF0EM8_GRVW2_GSU1_SU32_SUS256_SRVW4_WG128_2_1_WGM2
    SolutionIndex: 205
    SolutionNameMin: Cijk_Ailk_Bjlk_BBH_MT128x64x32_MI32x32x4x1_SE_AF0EM8_GRVW8_GSU1_SU32_SUS128_SRVW4_WG64_4_1_WGM2
    SolutionIndex: 206
    SolutionNameMin: Cijk_Ailk_Bjlk_BBH_MT96x128x64_MI32x32x4x1_SE_AF0EM8_GRVW8_GSU3_SU0_SUS256_SRVW0_WG32_8_1_WGM1
    SolutionIndex: 207
    SolutionNameMin: Cijk_Ailk_Bjlk_BBH_MT32x32x32_MI16x16x8x1_SE_AF0EM8_GRVW8_GSU1_SU0_SUS256_SRVW4_WG32_8_1_WGM2
    SolutionIndex: 208
    SolutionNameMin: Cijk_Ailk_Bjlk_BBH_MT64x32x32_MI16x16x8x1_SE_AF0EM8_GRVW4_GSU1_SU0_SUS256_SRVW4_WG32_8_1_WGM15
    SolutionIndex: 209
    SolutionNameMin: Cijk_Ailk_Bjlk_BBH_MT32x32x64_MI16x16x8x1_SE_AF0EM8_GRVW8_GSU3_SU0_SUS256_SRVW0_WG32_8_1_WGM15
    SolutionIndex: 210
    SolutionNameMin: Cijk_Ailk_Bjlk_BBH_MT64x64x64_MI32x32x4x1_SE_AF0EM8_GRVW8_GSU1_SU32_SUS256_SRVW4_WG64_4_1_WGM1
    SolutionIndex: 211
    SolutionNameMin: Cijk_Ailk_Bjlk_BBH_MT64x64x32_MI32x32x4x1_SE_AF0EM8_GRVW8_GSU3_SU32_SUS128_SRVW0_WG64_4_1_WGM15
    SolutionIndex: 212
    SolutionNameMin: Cijk_Ailk_Bjlk_BBH_MT96x128x32_MI32x32x4x1_SE_AF0EM8_GRVW4_GSU5_SU32_SUS128_SRVW0_WG32_8_1_WGM1
    SolutionIndex: 213
    SolutionNameMin: Cijk_Ailk_Bjlk_BBH_MT64x128x64_MI32x32x4x1_SE_AF0EM8_GRVW8_GSU3_SU32_SUS256_SRVW0_WG64_4_1_WGM2
    SolutionIndex: 214
    SolutionNameMin: Cijk_Ailk_Bjlk_BBH_MT96x128x32_MI32x32x4x1_SE_AF0EM8_GRVW4_GSU5_SU32_SUS256_SRVW0_WG32_8_1_WGM2
    SolutionIndex: 215
    SolutionNameMin: Cijk_Ailk_Bjlk_BBH_MT96x128x32_MI32x32x4x1_SE_AF0EM8_GRVW4_GSU5_SU0_SUS256_SRVW0_WG32_8_1_WGM2
    SolutionIndex: 216
    SolutionNameMin: Cijk_Ailk_Bjlk_BBH_MT128x64x64_MI32x32x4x1_SE_AF0EM8_GRVW4_GSU3_SU0_SUS256_SRVW0_WG64_4_1_WGM15
    SolutionIndex: 217
    SolutionNameMin: Cijk_Ailk_Bjlk_BBH_MT96x128x32_MI32x32x4x1_SE_AF0EM8_GRVW4_GSU5_SU32_SUS256_SRVW0_WG32_8_1_WGM15
    SolutionIndex: 218
    SolutionNameMin: Cijk_Ailk_Bjlk_BBH_MT96x128x64_MI32x32x4x1_SE_AF0EM8_GRVW8_GSU5_SU0_SUS256_SRVW0_WG32_8_1_WGM15
    SolutionIndex: 219
    SolutionNameMin: Cijk_Ailk_Bjlk_BBH_MT96x128x32_MI32x32x4x1_SE_AF0EM8_GRVW4_GSU5_SU32_SUS256_SRVW0_WG32_8_1_WGM1
    SolutionIndex: 220
    SolutionNameMin: Cijk_Ailk_Bjlk_BBH_MT96x128x32_MI32x32x4x1_SE_AF0EM8_GRVW4_GSU5_SU32_SUS128_SRVW0_WG32_8_1_WGM2
    SolutionIndex: 221
    SolutionNameMin: Cijk_Ailk_Bjlk_BBH_MT96x128x64_MI32x32x4x1_SE_AF0EM8_GRVW8_GSU5_SU0_SUS256_SRVW0_WG32_8_1_WGM1
    SolutionIndex: 222
    SolutionNameMin: Cijk_Ailk_Bjlk_BBH_MT96x128x32_MI32x32x4x1_SE_AF0EM8_GRVW4_GSU5_SU0_SUS256_SRVW0_WG32_8_1_WGM1
    SolutionIndex: 223
    SolutionNameMin: Cijk_Ailk_Bjlk_BBH_MT128x128x16_MI32x32x4x1_SE_AF0EM8_GRVW8_GSU7_SU0_SUS256_SRVW0_WG64_4_1_WGM1
    SolutionIndex: 224
    SolutionNameMin: Cijk_Ailk_Bjlk_BBH_MT256x64x32_MI32x32x4x1_SE_AF0EM8_GRVW8_GSU7_SU0_SUS256_SRVW0_WG64_4_1_WGM15
    SolutionIndex: 225
    SolutionNameMin: Cijk_Ailk_Bjlk_BBH_MT256x64x32_MI32x32x4x1_SE_AF0EM8_GRVW8_GSU7_SU32_SUS256_SRVW0_WG64_4_1_WGM2
    SolutionIndex: 226
    SolutionNameMin: Cijk_Ailk_Bjlk_BBH_MT256x64x32_MI32x32x4x1_SE_AF0EM8_GRVW4_GSU7_SU0_SUS256_SRVW0_WG64_4_1_WGM1
    SolutionIndex: 227
    SolutionNameMin: Cijk_Ailk_Bjlk_BBH_MT256x64x32_MI32x32x4x1_SE_AF0EM8_GRVW8_GSU7_SU0_SUS256_SRVW0_WG64_4_1_WGM2
    SolutionIndex: 228
    SolutionNameMin: Cijk_Ailk_Bjlk_BBH_MT256x64x32_MI32x32x4x1_SE_AF0EM8_GRVW8_GSU7_SU32_SUS256_SRVW0_WG64_4_1_WGM15
    SolutionIndex: 229
    SolutionNameMin: Cijk_Ailk_Bjlk_BBH_MT256x64x32_MI32x32x4x1_SE_AF0EM8_GRVW8_GSU7_SU0_SUS256_SRVW0_WG64_4_1_WGM1
    SolutionIndex: 230
    SolutionNameMin: Cijk_Ailk_Bjlk_BBH_MT256x64x32_MI32x32x4x1_SE_AF0EM8_GRVW8_GSU7_SU32_SUS128_SRVW0_WG64_4_1_WGM15
    SolutionIndex: 231
    SolutionNameMin: Cijk_Ailk_Bjlk_BBH_MT64x256x32_MI32x32x4x1_SE_AF0EM8_GRVW8_GSU7_SU0_SUS256_SRVW0_WG64_4_1_WGM1
    SolutionIndex: 232
    SolutionNameMin: Cijk_Ailk_Bjlk_BBH_MT64x64x64_MI32x32x4x1_SE_AF0EM8_GRVW4_GSU1_SU32_SUS128_SRVW4_WG64_4_1_WGM2
    SolutionIndex: 233
    SolutionNameMin: Cijk_Ailk_Bjlk_BBH_MT128x64x32_MI32x32x4x1_SE_AF0EM8_GRVW8_GSU1_SU32_SUS256_SRVW4_WG64_4_1_WGM1
    SolutionIndex: 234
    SolutionNameMin: Cijk_Ailk_Bjlk_BBH_MT64x64x16_MI32x32x4x1_SE_AF0EM8_GRVW4_GSU1_SU0_SUS256_SRVW4_WG64_4_1_WGM15
    SolutionIndex: 235
    SolutionNameMin: Cijk_Ailk_Bjlk_BBH_MT128x128x16_MI32x32x4x1_SE_AF0EM8_GRVW8_GSU1_SU32_SUS128_SRVW4_WG64_4_1_WGM15
    SolutionIndex: 236
    SolutionNameMin: Cijk_Ailk_Bjlk_BBH_MT128x128x16_MI32x32x4x1_SE_AF0EM8_GRVW2_GSU1_SU32_SUS256_SRVW4_WG64_4_1_WGM1
    SolutionIndex: 237
    SolutionNameMin: Cijk_Ailk_Bjlk_BBH_MT128x128x16_MI32x32x4x1_SE_AF0EM8_GRVW8_GSU1_SU32_SUS256_SRVW4_WG64_4_1_WGM2
    SolutionIndex: 238
    SolutionNameMin: Cijk_Ailk_Bjlk_BBH_MT96x96x64_MI16x16x8x1_SE_AF0EM8_GRVW2_GSU1_SU0_SUS256_SRVW0_WG32_8_1_WGM1
    SolutionIndex: 239
    SolutionNameMin: Cijk_Ailk_Bjlk_BBH_MT128x64x32_MI32x32x4x1_SE_AF0EM8_GRVW8_GSU1_SU0_SUS256_SRVW4_WG64_4_1_WGM15
    SolutionIndex: 240
    SolutionNameMin: Cijk_Ailk_Bjlk_BBH_MT64x128x32_MI32x32x4x1_SE_AF0EM8_GRVW8_GSU1_SU32_SUS128_SRVW4_WG64_4_1_WGM2
    SolutionIndex: 241
    SolutionNameMin: Cijk_Ailk_Bjlk_BBH_MT96x96x32_MI16x16x8x1_SE_AF0EM8_GRVW2_GSU1_SU0_SUS256_SRVW0_WG32_8_1_WGM2
    SolutionIndex: 242
    SolutionNameMin: Cijk_Ailk_Bjlk_BBH_MT96x96x32_MI16x16x8x1_SE_AF0EM8_GRVW2_GSU1_SU0_SUS256_SRVW0_WG32_8_1_WGM1
    SolutionIndex: 243
    SolutionNameMin: Cijk_Ailk_Bjlk_BBH_MT128x64x32_MI32x32x4x1_SE_AF0EM8_GRVW8_GSU1_SU0_SUS256_SRVW4_WG64_4_1_WGM2
    SolutionIndex: 244
    SolutionNameMin: Cijk_Ailk_Bjlk_BBH_MT64x128x32_MI32x32x4x1_SE_AF0EM8_GRVW8_GSU1_SU0_SUS256_SRVW4_WG64_4_1_WGM1
    SolutionIndex: 245
    SolutionNameMin: Cijk_Ailk_Bjlk_BBH_MT256x160x16_MI32x32x4x1_SE_AF0EM8_GRVW2_GSU1_SU32_SUS128_SRVW4_WG128_2_1_WGM15
    SolutionIndex: 246
    SolutionNameMin: Cijk_Ailk_Bjlk_BBH_MT128x256x16_MI32x32x4x1_SE_AF0EM8_GRVW4_GSU1_SU32_SUS256_SRVW4_WG64_4_1_WGM15
    SolutionIndex: 247
    SolutionNameMin: Cijk_Ailk_Bjlk_BBH_MT256x64x32_MI32x32x4x1_SE_AF0EM8_GRVW4_GSU1_SU0_SUS256_SRVW4_WG64_4_1_WGM1
    SolutionIndex: 248
    SolutionNameMin: Cijk_Ailk_Bjlk_BBH_MT128x160x32_MI32x32x4x1_SE_AF0EM8_GRVW2_GSU1_SU0_SUS256_SRVW4_WG128_2_1_WGM1
    SolutionIndex: 249
    SolutionNameMin: Cijk_Ailk_Bjlk_BBH_MT128x96x32_MI32x32x4x1_SE_AF0EM8_GRVW4_GSU1_SU0_SUS256_SRVW4_WG128_2_1_WGM15
    SolutionIndex: 250
    SolutionNameMin: Cijk_Ailk_Bjlk_BBH_MT96x96x32_MI16x16x8x1_SE_AF0EM8_GRVW4_GSU1_SU0_SUS256_SRVW0_WG32_8_1_WGM1
    SolutionIndex: 251
    SolutionNameMin: Cijk_Ailk_Bjlk_BBH_MT128x160x32_MI32x32x4x1_SE_AF0EM8_GRVW2_GSU1_SU0_SUS256_SRVW4_WG128_2_1_WGM15
    SolutionIndex: 252
    SolutionNameMin: Cijk_Ailk_Bjlk_BBH_MT96x128x32_MI32x32x4x1_SE_AF0EM8_GRVW4_GSU1_SU32_SUS256_SRVW0_WG32_8_1_WGM1
    SolutionIndex: 253
    SolutionNameMin: Cijk_Ailk_Bjlk_BBH_MT256x128x16_MI32x32x4x1_SE_AF0EM8_GRVW8_GSU7_SU32_SUS128_SRVW0_WG64_4_1_WGM15
    SolutionIndex: 254
    SolutionNameMin: Cijk_Ailk_Bjlk_BBH_MT64x128x32_MI32x32x4x1_SE_AF0EM8_GRVW8_GSU1_SU32_SUS128_SRVW4_WG64_4_1_WGM15
    SolutionIndex: 255
    SolutionNameMin: Cijk_Ailk_Bjlk_BBH_MT64x128x32_MI32x32x4x1_SE_AF0EM8_GRVW8_GSU1_SU32_SUS256_SRVW4_WG64_4_1_WGM1
    SolutionIndex: 256
    SolutionNameMin: Cijk_Ailk_Bjlk_BBH_MT128x64x32_MI32x32x4x1_SE_AF0EM8_GRVW8_GSU1_SU0_SUS256_SRVW4_WG64_4_1_WGM1
    SolutionIndex: 257
    SolutionNameMin: Cijk_Ailk_Bjlk_BBH_MT64x16x32_MI16x16x8x1_SE_AF0EM8_GRVW2_GSU1_SU0_SUS256_SRVW0_WG64_4_1_WGM1
    SolutionIndex: 258
    SolutionNameMin: Cijk_Ailk_Bjlk_BBH_MT64x64x32_MI32x32x4x1_SE_AF0EM8_GRVW8_GSU1_SU32_SUS128_SRVW4_WG64_4_1_WGM2
    SolutionIndex: 259
    SolutionNameMin: Cijk_Ailk_Bjlk_BBH_MT64x128x16_MI32x32x4x1_SE_AF0EM8_GRVW2_GSU1_SU0_SUS256_SRVW4_WG64_4_1_WGM2
    SolutionIndex: 260
    SolutionNameMin: Cijk_Ailk_Bjlk_BBH_MT128x64x16_MI32x32x4x1_SE_AF0EM8_GRVW2_GSU1_SU0_SUS256_SRVW4_WG64_4_1_WGM2
    SolutionIndex: 261
    SolutionNameMin: Cijk_Ailk_Bjlk_BBH_MT128x128x16_MI32x32x4x1_SE_AF0EM8_GRVW8_GSU3_SU0_SUS256_SRVW0_WG64_4_1_WGM1
    SolutionIndex: 262
    SolutionNameMin: Cijk_Ailk_Bjlk_BBH_MT96x128x32_MI32x32x4x1_SE_AF0EM8_GRVW4_GSU5_SU0_SUS256_SRVW0_WG32_8_1_WGM15
    SolutionIndex: 263
    SolutionNameMin: Cijk_Ailk_Bjlk_BBH_MT64x32x64_MI16x16x8x1_SE_AF0EM8_GRVW8_GSU7_SU32_SUS256_SRVW0_WG32_8_1_WGM15
    SolutionIndex: 264
    SolutionNameMin: Cijk_Ailk_Bjlk_BBH_MT32x64x64_MI16x16x8x1_SE_AF0EM8_GRVW8_GSU7_SU32_SUS128_SRVW0_WG32_8_1_WGM2
    SolutionIndex: 265
    SolutionNameMin: Cijk_Ailk_Bjlk_BBH_MT64x64x64_MI32x32x4x1_SE_AF0EM8_GRVW8_GSU15_SU32_SUS128_SRVW0_WG64_4_1_WGM1
    SolutionIndex: 266
    SolutionNameMin: Cijk_Ailk_Bjlk_BBH_MT64x64x64_MI32x32x4x1_SE_AF0EM8_GRVW8_GSU15_SU0_SUS256_SRVW0_WG64_4_1_WGM2
    SolutionIndex: 267
    SolutionNameMin: Cijk_Ailk_Bjlk_BBH_MT32x32x32_MI16x16x8x1_SE_AF0EM8_GRVW8_GSU3_SU0_SUS256_SRVW0_WG32_8_1_WGM2
    SolutionIndex: 268
    SolutionNameMin: Cijk_Ailk_Bjlk_BBH_MT64x32x16_MI16x16x8x1_SE_AF0EM8_GRVW8_GSU1_SU0_SUS256_SRVW4_WG32_8_1_WGM1
    SolutionIndex: 269
    SolutionNameMin: Cijk_Ailk_Bjlk_BBH_MT64x32x16_MI16x16x8x1_SE_AF0EM8_GRVW4_GSU1_SU0_SUS256_SRVW4_WG32_8_1_WGM1
    SolutionIndex: 270
    SolutionNameMin: Cijk_Ailk_Bjlk_BBH_MT64x64x16_MI32x32x4x1_SE_AF0EM8_GRVW2_GSU1_SU32_SUS128_SRVW4_WG64_4_1_WGM2
    SolutionIndex: 271
    SolutionNameMin: Cijk_Ailk_Bjlk_BBH_MT32x32x16_MI16x16x8x1_SE_AF0EM8_GRVW2_GSU1_SU32_SUS256_SRVW4_WG32_8_1_WGM1
    SolutionIndex: 272
    SolutionNameMin: Cijk_Ailk_Bjlk_BBH_MT96x128x32_MI32x32x4x1_SE_AF0EM8_GRVW4_GSU3_SU0_SUS256_SRVW0_WG32_8_1_WGM1
    SolutionIndex: 273
    SolutionNameMin: Cijk_Ailk_Bjlk_BBH_MT32x64x32_MI16x16x8x1_SE_AF0EM8_GRVW8_GSU1_SU32_SUS256_SRVW4_WG32_8_1_WGM15
    SolutionIndex: 274
    SolutionNameMin: Cijk_Ailk_Bjlk_BBH_MT128x64x64_MI32x32x4x1_SE_AF0EM8_GRVW4_GSU7_SU0_SUS256_SRVW0_WG64_4_1_WGM2
    SolutionIndex: 275
    SolutionNameMin: Cijk_Ailk_Bjlk_BBH_MT64x128x32_MI32x32x4x1_SE_AF0EM8_GRVW8_GSU7_SU32_SUS256_SRVW0_WG64_4_1_WGM2
    SolutionIndex: 276
    SolutionNameMin: Cijk_Ailk_Bjlk_BBH_MT256x64x32_MI32x32x4x1_SE_AF0EM8_GRVW8_GSU15_SU32_SUS256_SRVW0_WG64_4_1_WGM1
    SolutionIndex: 277
    SolutionNameMin: Cijk_Ailk_Bjlk_BBH_MT128x64x64_MI32x32x4x1_SE_AF0EM8_GRVW8_GSU7_SU0_SUS256_SRVW0_WG64_4_1_WGM15
    SolutionIndex: 278
    SolutionNameMin: Cijk_Ailk_Bjlk_BBH_MT64x32x32_MI16x16x8x1_SE_AF0EM8_GRVW8_GSU3_SU32_SUS256_SRVW0_WG32_8_1_WGM1
    SolutionIndex: 279
    SolutionNameMin: Cijk_Ailk_Bjlk_BBH_MT128x128x16_MI32x32x4x1_SE_AF0EM8_GRVW8_GSU1_SU32_SUS128_SRVW4_WG64_4_1_WGM2
    SolutionIndex: 280
    SolutionNameMin: Cijk_Ailk_Bjlk_BBH_MT16x16x16_MI16x16x8x1_SE_AF0EM8_GRVW2_GSU1_SU32_SUS128_SRVW0_WG16_4_1_WGM1
    SolutionIndex: 281
    SolutionNameMin: Cijk_Ailk_Bjlk_BBH_MT64x64x16_MI32x32x4x1_SE_AF0EM8_GRVW8_GSU1_SU0_SUS256_SRVW4_WG64_4_1_WGM2
    SolutionIndex: 282
    SolutionNameMin: Cijk_Ailk_Bjlk_BBH_MT128x64x16_MI32x32x4x1_SE_AF0EM8_GRVW2_GSU1_SU32_SUS256_SRVW4_WG64_4_1_WGM1
    SolutionIndex: 283
    SolutionNameMin: Cijk_Ailk_Bjlk_BBH_MT128x64x16_MI32x32x4x1_SE_AF0EM8_GRVW4_GSU1_SU32_SUS256_SRVW4_WG64_4_1_WGM1
    SolutionIndex: 284
    SolutionNameMin: Cijk_Ailk_Bjlk_BBH_MT128x128x16_MI32x32x4x1_SE_AF0EM8_GRVW2_GSU1_SU32_SUS256_SRVW4_WG64_4_1_WGM15
    SolutionIndex: 285
    SolutionNameMin: Cijk_Ailk_Bjlk_BBH_MT128x64x16_MI32x32x4x1_SE_AF0EM8_GRVW8_GSU1_SU0_SUS256_SRVW4_WG64_4_1_WGM1
    SolutionIndex: 286
    SolutionNameMin: Cijk_Ailk_Bjlk_BBH_MT128x128x16_MI32x32x4x1_SE_AF0EM8_GRVW8_GSU1_SU0_SUS256_SRVW4_WG64_4_1_WGM1
    SolutionIndex: 287
    SolutionNameMin: Cijk_Ailk_Bjlk_BBH_MT64x256x16_MI32x32x4x1_SE_AF0EM8_GRVW8_GSU1_SU0_SUS256_SRVW4_WG64_4_1_WGM15
    SolutionIndex: 288
    SolutionNameMin: Cijk_Ailk_Bjlk_BBH_MT128x128x16_MI32x32x4x1_SE_AF0EM8_GRVW8_GSU1_SU32_SUS128_SRVW4_WG64_4_1_WGM15
    SolutionIndex: 289
    SolutionNameMin: Cijk_Ailk_Bjlk_BBH_MT128x128x16_MI32x32x4x1_SE_AF0EM8_GRVW8_GSU1_SU32_SUS256_SRVW4_WG64_4_1_WGM15
    SolutionIndex: 290
    SolutionNameMin: Cijk_Ailk_Bjlk_BBH_MT64x128x16_MI32x32x4x1_SE_AF0EM8_GRVW8_GSU1_SU32_SUS256_SRVW4_WG64_4_1_WGM1
    SolutionIndex: 291
    SolutionNameMin: Cijk_Ailk_Bjlk_BBH_MT64x128x16_MI32x32x4x1_SE_AF0EM8_GRVW8_GSU1_SU32_SUS128_SRVW4_WG64_4_1_WGM15
    SolutionIndex: 292
    SolutionNameMin: Cijk_Ailk_Bjlk_BBH_MT128x128x16_MI32x32x4x1_SE_AF0EM8_GRVW8_GSU1_SU0_SUS256_SRVW4_WG64_4_1_WGM15
    SolutionIndex: 293
    SolutionNameMin: Cijk_Ailk_Bjlk_BBH_MT64x128x16_MI32x32x4x1_SE_AF0EM8_GRVW8_GSU1_SU0_SUS256_SRVW4_WG64_4_1_WGM1
    SolutionIndex: 294
    SolutionNameMin: Cijk_Ailk_Bjlk_BBH_MT128x128x16_MI32x32x4x1_SE_AF0EM8_GRVW8_GSU1_SU32_SUS256_SRVW4_WG64_4_1_WGM2
    SolutionIndex: 295
    SolutionNameMin: Cijk_Ailk_Bjlk_BBH_MT128x128x16_MI32x32x4x1_SE_AF0EM8_GRVW8_GSU1_SU32_SUS128_SRVW4_WG64_4_1_WGM2
    SolutionIndex: 296
    SolutionNameMin: Cijk_Ailk_Bjlk_BBH_MT64x64x32_MI32x32x4x1_SE_AF0EM8_GRVW8_GSU1_SU32_SUS256_SRVW4_WG64_4_1_WGM1
    SolutionIndex: 297
    SolutionNameMin: Cijk_Ailk_Bjlk_BBH_MT64x128x32_MI32x32x4x1_SE_AF0EM8_GRVW8_GSU1_SU0_SUS256_SRVW4_WG64_4_1_WGM2
    SolutionIndex: 298
    SolutionNameMin: Cijk_Ailk_Bjlk_BBH_MT128x128x16_MI32x32x4x1_SE_AF0EM8_GRVW8_GSU1_SU0_SUS256_SRVW4_WG64_4_1_WGM1
    SolutionIndex: 299
    SolutionNameMin: Cijk_Ailk_Bjlk_BBH_MT64x128x16_MI32x32x4x1_SE_AF0EM8_GRVW8_GSU1_SU0_SUS256_SRVW4_WG64_4_1_WGM15
    SolutionIndex: 300
    SolutionNameMin: Cijk_Ailk_Bjlk_BBH_MT64x256x16_MI32x32x4x1_SE_AF0EM8_GRVW8_GSU1_SU32_SUS256_SRVW4_WG64_4_1_WGM1
    SolutionIndex: 301
    SolutionNameMin: Cijk_Ailk_Bjlk_BBH_MT64x128x16_MI32x32x4x1_SE_AF0EM8_GRVW8_GSU1_SU32_SUS256_SRVW4_WG64_4_1_WGM15
    SolutionIndex: 302
    SolutionNameMin: Cijk_Ailk_Bjlk_BBH_MT64x128x16_MI32x32x4x1_SE_AF0EM8_GRVW4_GSU1_SU32_SUS256_SRVW4_WG64_4_1_WGM1
    SolutionIndex: 303
    SolutionNameMin: Cijk_Ailk_Bjlk_BBH_MT64x128x32_MI32x32x4x1_SE_AF0EM8_GRVW8_GSU1_SU32_SUS256_SRVW4_WG64_4_1_WGM2
    SolutionIndex: 304
    SolutionNameMin: Cijk_Ailk_Bjlk_BBH_MT128x96x32_MI32x32x4x1_SE_AF0EM8_GRVW4_GSU1_SU32_SUS256_SRVW4_WG128_2_1_WGM15
    SolutionIndex: 305
    SolutionNameMin: Cijk_Ailk_Bjlk_BBH_MT160x128x32_MI32x32x4x1_SE_AF0EM8_GRVW2_GSU2_SU32_SUS256_SRVW0_WG32_8_1_WGM1
    SolutionIndex: 306
    SolutionNameMin: Cijk_Ailk_Bjlk_BBH_MT128x96x32_MI32x32x4x1_SE_AF0EM8_GRVW4_GSU1_SU32_SUS128_SRVW4_WG128_2_1_WGM2
    SolutionIndex: 307
    SolutionNameMin: Cijk_Ailk_Bjlk_BBH_MT128x144x32_MI16x16x8x1_SE_AF0EM8_GRVW2_GSU1_SU0_SUS256_SRVW4_WG64_4_1_WGM15
    SolutionIndex: 308
    SolutionNameMin: Cijk_Ailk_Bjlk_BBH_MT128x144x32_MI16x16x8x1_SE_AF0EM8_GRVW2_GSU1_SU0_SUS256_SRVW4_WG64_4_1_WGM2
    SolutionIndex: 309
    SolutionNameMin: Cijk_Ailk_Bjlk_BBH_MT64x32x16_MI16x16x8x1_SE_AF0EM8_GRVW2_GSU1_SU32_SUS256_SRVW4_WG32_8_1_WGM2
    SolutionIndex: 310
    SolutionNameMin: Cijk_Ailk_Bjlk_BBH_MT64x128x64_MI32x32x4x1_SE_AF0EM8_GRVW8_GSU1_SU32_SUS128_SRVW4_WG64_4_1_WGM15
    SolutionIndex: 311
    SolutionNameMin: Cijk_Ailk_Bjlk_BBH_MT128x256x16_MI32x32x4x1_SE_AF0EM8_GRVW8_GSU1_SU32_SUS256_SRVW4_WG64_4_1_WGM2
    SolutionIndex: 312
    SolutionNameMin: Cijk_Ailk_Bjlk_BBH_MT128x64x16_MI32x32x4x1_SE_AF0EM8_GRVW8_GSU1_SU0_SUS256_SRVW4_WG64_4_1_WGM15
    SolutionIndex: 313
    SolutionNameMin: Cijk_Ailk_Bjlk_BBH_MT128x64x16_MI32x32x4x1_SE_AF0EM8_GRVW8_GSU1_SU0_SUS256_SRVW4_WG64_4_1_WGM2
    SolutionIndex: 314
    SolutionNameMin: Cijk_Ailk_Bjlk_BBH_MT64x128x16_MI32x32x4x1_SE_AF0EM8_GRVW8_GSU1_SU0_SUS256_SRVW4_WG64_4_1_WGM2
    SolutionIndex: 315
    SolutionNameMin: Cijk_Ailk_Bjlk_BBH_MT128x256x16_MI32x32x4x1_SE_AF0EM8_GRVW8_GSU1_SU32_SUS128_SRVW4_WG64_4_1_WGM15
    SolutionIndex: 316
    SolutionNameMin: Cijk_Ailk_Bjlk_BBH_MT64x128x16_MI32x32x4x1_SE_AF0EM8_GRVW2_GSU1_SU32_SUS128_SRVW4_WG64_4_1_WGM2
    SolutionIndex: 317
    SolutionNameMin: Cijk_Ailk_Bjlk_BBH_MT64x64x32_MI32x32x4x1_SE_AF0EM8_GRVW8_GSU1_SU32_SUS128_SRVW4_WG64_4_1_WGM15
    SolutionIndex: 318
    SolutionNameMin: Cijk_Ailk_Bjlk_BBH_MT64x16x32_MI16x16x8x1_SE_AF0EM8_GRVW8_GSU1_SU0_SUS256_SRVW0_WG64_4_1_WGM15
    SolutionIndex: 319
    SolutionNameMin: Cijk_Ailk_Bjlk_BBH_MT128x64x16_MI32x32x4x1_SE_AF0EM8_GRVW2_GSU1_SU0_SUS256_SRVW4_WG64_4_1_WGM1
    SolutionIndex: 320
    SolutionNameMin: Cijk_Ailk_Bjlk_BBH_MT128x128x32_MI32x32x4x1_SE_AF0EM8_GRVW8_GSU1_SU32_SUS128_SRVW4_WG64_4_1_WGM15
    SolutionIndex: 321
    SolutionNameMin: Cijk_Ailk_Bjlk_BBH_MT128x96x64_MI32x32x4x1_SE_AF0EM8_GRVW8_GSU1_SU32_SUS128_SRVW4_WG128_2_1_WGM15
    SolutionIndex: 322
    SolutionNameMin: Cijk_Ailk_Bjlk_BBH_MT64x16x32_MI16x16x8x1_SE_AF0EM8_GRVW4_GSU1_SU0_SUS256_SRVW0_WG64_4_1_WGM1
    SolutionIndex: 323
    SolutionNameMin: Cijk_Ailk_Bjlk_BBH_MT64x128x16_MI32x32x4x1_SE_AF0EM8_GRVW8_GSU1_SU32_SUS128_SRVW4_WG64_4_1_WGM1
    SolutionIndex: 324
    SolutionNameMin: Cijk_Ailk_Bjlk_BBH_MT128x64x16_MI32x32x4x1_SE_AF0EM8_GRVW8_GSU1_SU32_SUS128_SRVW4_WG64_4_1_WGM1
    SolutionIndex: 325
    SolutionNameMin: Cijk_Ailk_Bjlk_BBH_MT32x32x64_MI16x16x8x1_SE_AF0EM8_GRVW2_GSU5_SU0_SUS256_SRVW0_WG32_8_1_WGM1
    SolutionIndex: 326
    SolutionNameMin: Cijk_Ailk_Bjlk_BBH_MT128x160x32_MI32x32x4x1_SE_AF0EM8_GRVW4_GSU1_SU0_SUS256_SRVW4_WG128_2_1_WGM15
    SolutionIndex: 327
    SolutionNameMin: Cijk_Ailk_Bjlk_BBH_MT64x64x64_MI32x32x4x1_SE_AF0EM8_GRVW8_GSU1_SU0_SUS256_SRVW4_WG64_4_1_WGM15
    SolutionIndex: 328
    SolutionNameMin: Cijk_Ailk_Bjlk_BBH_MT64x16x64_MI16x16x8x1_SE_AF0EM1_GRVW2_GSU15_SU0_SUS256_SRVW0_WG64_4_1_WGM1
    SolutionIndex: 329
    SolutionNameMin: Cijk_Ailk_Bjlk_BBH_MT128x160x32_MI32x32x4x1_SE_AF0EM8_GRVW2_GSU1_SU0_SUS256_SRVW4_WG128_2_1_WGM2
    SolutionIndex: 330
    SolutionNameMin: Cijk_Ailk_Bjlk_BBH_MT64x256x32_MI32x32x4x1_SE_AF0EM8_GRVW8_GSU3_SU0_SUS256_SRVW0_WG64_4_1_WGM1
    SolutionIndex: 331
    SolutionNameMin: Cijk_Ailk_Bjlk_BBH_MT64x64x16_MI32x32x4x1_SE_AF0EM8_GRVW8_GSU1_SU0_SUS256_SRVW4_WG64_4_1_WGM1
    SolutionIndex: 332
    SolutionNameMin: Cijk_Ailk_Bjlk_BBH_MT64x128x32_MI32x32x4x1_SE_AF0EM8_GRVW4_GSU1_SU32_SUS128_SRVW4_WG64_4_1_WGM15
    SolutionIndex: 333
    SolutionNameMin: Cijk_Ailk_Bjlk_BBH_MT64x16x64_MI16x16x8x1_SE_AF0EM8_GRVW2_GSU15_SU0_SUS256_SRVW0_WG64_4_1_WGM2
    SolutionIndex: 334
    SolutionNameMin: Cijk_Ailk_Bjlk_BBH_MT128x160x32_MI32x32x4x1_SE_AF0EM8_GRVW4_GSU2_SU0_SUS256_SRVW0_WG128_2_1_WGM1
    SolutionIndex: 335
    SolutionNameMin: Cijk_Ailk_Bjlk_BBH_MT16x64x64_MI16x16x8x1_SE_AF0EM1_GRVW8_GSU15_SU32_SUS128_SRVW0_WG16_16_1_WGM15
    SolutionIndex: 336
    SolutionNameMin: Cijk_Ailk_Bjlk_BBH_MT96x128x64_MI32x32x4x1_SE_AF0EM1_GRVW8_GSU3_SU32_SUS128_SRVW0_WG32_8_1_WGM1
    SolutionIndex: 337
    SolutionNameMin: Cijk_Ailk_Bjlk_BBH_MT16x16x16_MI16x16x8x1_SE_AF0EM1_GRVW2_GSU1_SU32_SUS256_SRVW0_WG16_4_1_WGM1
    SolutionIndex: 338
    SolutionNameMin: Cijk_Ailk_Bjlk_BBH_MT16x16x16_MI16x16x8x1_SE_AF0EM1_GRVW2_GSU1_SU32_SUS128_SRVW0_WG16_4_1_WGM1
    SolutionIndex: 339
    SolutionNameMin: Cijk_Ailk_Bjlk_BBH_MT16x16x16_MI16x16x8x1_SE_AF0EM1_GRVW2_GSU1_SU32_SUS256_SRVW0_WG16_4_1_WGM15
    SolutionIndex: 340
    SolutionNameMin: Cijk_Ailk_Bjlk_BBH_MT32x64x16_MI16x16x8x1_SE_AF0EM1_GRVW8_GSU1_SU32_SUS256_SRVW4_WG32_8_1_WGM2
    SolutionIndex: 341
    SolutionNameMin: Cijk_Ailk_Bjlk_BBH_MT32x64x16_MI16x16x8x1_SE_AF0EM1_GRVW2_GSU1_SU32_SUS128_SRVW4_WG32_8_1_WGM2
    SolutionIndex: 342
    SolutionNameMin: Cijk_Ailk_Bjlk_BBH_MT32x64x16_MI16x16x8x1_SE_AF0EM1_GRVW2_GSU1_SU32_SUS256_SRVW4_WG32_8_1_WGM2
    SolutionIndex: 343
    SolutionNameMin: Cijk_Ailk_Bjlk_BBH_MT32x32x64_MI16x16x8x1_SE_AF0EM1_GRVW4_GSU1_SU32_SUS256_SRVW4_WG32_8_1_WGM1
    SolutionIndex: 344
    SolutionNameMin: Cijk_Ailk_Bjlk_BBH_MT64x64x16_MI32x32x4x1_SE_AF0EM1_GRVW2_GSU1_SU0_SUS256_SRVW4_WG64_4_1_WGM1
    SolutionIndex: 345
    SolutionNameMin: Cijk_Ailk_Bjlk_BBH_MT16x16x16_MI16x16x8x1_SE_AF0EM1_GRVW2_GSU1_SU0_SUS256_SRVW0_WG16_4_1_WGM1
    SolutionIndex: 346
    SolutionNameMin: Cijk_Ailk_Bjlk_BBH_MT16x16x16_MI16x16x8x1_SE_AF0EM1_GRVW4_GSU1_SU32_SUS128_SRVW0_WG16_4_1_WGM1
    SolutionIndex: 347
    SolutionNameMin: Cijk_Ailk_Bjlk_BBH_MT64x32x16_MI16x16x8x1_SE_AF0EM1_GRVW2_GSU1_SU0_SUS256_SRVW4_WG32_8_1_WGM1
    SolutionIndex: 348
    SolutionNameMin: Cijk_Ailk_Bjlk_BBH_MT32x32x64_MI16x16x8x1_SE_AF0EM1_GRVW8_GSU1_SU32_SUS256_SRVW4_WG32_8_1_WGM1
    SolutionIndex: 349
    SolutionNameMin: Cijk_Ailk_Bjlk_BBH_MT32x32x64_MI16x16x8x1_SE_AF0EM1_GRVW8_GSU1_SU32_SUS256_SRVW4_WG32_8_1_WGM2
    SolutionIndex: 350
    SolutionNameMin: Cijk_Ailk_Bjlk_BBH_MT64x64x64_MI32x32x4x1_SE_AF0EM1_GRVW4_GSU1_SU32_SUS128_SRVW4_WG64_4_1_WGM1
    SolutionIndex: 351
    SolutionNameMin: Cijk_Ailk_Bjlk_BBH_MT16x16x64_MI16x16x8x1_SE_AF0EM1_GRVW2_GSU7_SU0_SUS256_SRVW0_WG16_4_1_WGM15
    SolutionIndex: 352
    SolutionNameMin: Cijk_Ailk_Bjlk_BBH_MT16x64x64_MI16x16x8x1_SE_AF0EM1_GRVW8_GSU15_SU0_SUS256_SRVW0_WG16_16_1_WGM1
    SolutionIndex: 353
    SolutionNameMin: Cijk_Ailk_Bjlk_BBH_MT16x16x32_MI16x16x8x1_SE_AF0EM1_GRVW4_GSU3_SU32_SUS128_SRVW0_WG16_4_1_WGM1
    SolutionIndex: 354
    SolutionNameMin: Cijk_Ailk_Bjlk_BBH_MT64x128x32_MI32x32x4x1_SE_AF0EM1_GRVW8_GSU1_SU0_SUS256_SRVW4_WG64_4_1_WGM15
    SolutionIndex: 355
    SolutionNameMin: Cijk_Ailk_Bjlk_BBH_MT64x64x64_MI32x32x4x1_SE_AF0EM1_GRVW8_GSU1_SU0_SUS256_SRVW4_WG64_4_1_WGM1
    SolutionIndex: 356
    SolutionNameMin: Cijk_Ailk_Bjlk_BBH_MT64x128x32_MI32x32x4x1_SE_AF0EM1_GRVW8_GSU1_SU0_SUS256_SRVW4_WG64_4_1_WGM2
    SolutionIndex: 357
    SolutionNameMin: Cijk_Ailk_Bjlk_BBH_MT128x96x32_MI32x32x4x1_SE_AF0EM1_GRVW4_GSU1_SU32_SUS128_SRVW4_WG128_2_1_WGM15
    SolutionIndex: 358
    SolutionNameMin: Cijk_Ailk_Bjlk_BBH_MT128x96x32_MI32x32x4x1_SE_AF0EM1_GRVW4_GSU1_SU0_SUS256_SRVW4_WG128_2_1_WGM1
    SolutionIndex: 359
    SolutionNameMin: Cijk_Ailk_Bjlk_BBH_MT64x128x16_MI32x32x4x1_SE_AF0EM1_GRVW8_GSU1_SU32_SUS256_SRVW4_WG64_4_1_WGM1
    SolutionIndex: 360
    SolutionNameMin: Cijk_Ailk_Bjlk_BBH_MT64x64x32_MI32x32x4x1_SE_AF0EM1_GRVW8_GSU1_SU0_SUS256_SRVW4_WG64_4_1_WGM2
    SolutionIndex: 361
    SolutionNameMin: Cijk_Ailk_Bjlk_BBH_MT64x128x16_MI32x32x4x1_SE_AF0EM1_GRVW8_GSU1_SU32_SUS128_SRVW4_WG64_4_1_WGM1
    SolutionIndex: 362
    SolutionNameMin: Cijk_Ailk_Bjlk_BBH_MT64x64x32_MI32x32x4x1_SE_AF0EM1_GRVW8_GSU1_SU0_SUS256_SRVW4_WG64_4_1_WGM15
    SolutionIndex: 363
    SolutionNameMin: Cijk_Ailk_Bjlk_BBH_MT64x64x64_MI32x32x4x1_SE_AF0EM1_GRVW4_GSU1_SU0_SUS256_SRVW4_WG64_4_1_WGM1
    SolutionIndex: 364
    SolutionNameMin: Cijk_Ailk_Bjlk_BBH_MT64x128x32_MI32x32x4x1_SE_AF0EM1_GRVW8_GSU1_SU0_SUS256_SRVW4_WG64_4_1_WGM1
    SolutionIndex: 365
    SolutionNameMin: Cijk_Ailk_Bjlk_BBH_MT128x96x16_MI32x32x4x1_SE_AF0EM1_GRVW2_GSU1_SU32_SUS256_SRVW4_WG128_2_1_WGM15
    SolutionIndex: 366
    SolutionNameMin: Cijk_Ailk_Bjlk_BBH_MT128x96x16_MI32x32x4x1_SE_AF0EM1_GRVW2_GSU1_SU32_SUS128_SRVW4_WG128_2_1_WGM15
    SolutionIndex: 367
    SolutionNameMin: Cijk_Ailk_Bjlk_BBH_MT128x96x16_MI32x32x4x1_SE_AF0EM1_GRVW2_GSU1_SU0_SUS256_SRVW4_WG128_2_1_WGM15
    SolutionIndex: 368
    SolutionNameMin: Cijk_Ailk_Bjlk_BBH_MT128x128x16_MI32x32x4x1_SE_AF0EM1_GRVW8_GSU1_SU32_SUS256_SRVW4_WG64_4_1_WGM15
    SolutionIndex: 369
    SolutionNameMin: Cijk_Ailk_Bjlk_BBH_MT128x128x16_MI32x32x4x1_SE_AF0EM1_GRVW8_GSU1_SU0_SUS256_SRVW4_WG64_4_1_WGM15
    SolutionIndex: 370
    SolutionNameMin: Cijk_Ailk_Bjlk_BBH_MT128x64x16_MI32x32x4x1_SE_AF0EM1_GRVW4_GSU1_SU0_SUS256_SRVW4_WG64_4_1_WGM1
    SolutionIndex: 371
    SolutionNameMin: Cijk_Ailk_Bjlk_BBH_MT64x256x16_MI32x32x4x1_SE_AF0EM1_GRVW8_GSU1_SU32_SUS128_SRVW4_WG64_4_1_WGM1
    SolutionIndex: 372
    SolutionNameMin: Cijk_Ailk_Bjlk_BBH_MT64x256x16_MI32x32x4x1_SE_AF0EM1_GRVW8_GSU1_SU32_SUS256_SRVW4_WG64_4_1_WGM15
    SolutionIndex: 373
    SolutionNameMin: Cijk_Ailk_Bjlk_BBH_MT64x256x16_MI32x32x4x1_SE_AF0EM1_GRVW8_GSU1_SU0_SUS256_SRVW4_WG64_4_1_WGM1
    SolutionIndex: 374
    SolutionNameMin: Cijk_Ailk_Bjlk_BBH_MT128x64x16_MI32x32x4x1_SE_AF0EM1_GRVW8_GSU1_SU0_SUS256_SRVW4_WG64_4_1_WGM15
    SolutionIndex: 375
    SolutionNameMin: Cijk_Ailk_Bjlk_BBH_MT128x96x16_MI32x32x4x1_SE_AF0EM1_GRVW2_GSU1_SU32_SUS256_SRVW4_WG128_2_1_WGM1
    SolutionIndex: 376
    SolutionNameMin: Cijk_Ailk_Bjlk_BBH_MT128x96x16_MI32x32x4x1_SE_AF0EM1_GRVW2_GSU1_SU0_SUS256_SRVW4_WG128_2_1_WGM1
    SolutionIndex: 377
    SolutionNameMin: Cijk_Ailk_Bjlk_BBH_MT64x128x16_MI32x32x4x1_SE_AF0EM1_GRVW8_GSU1_SU0_SUS256_SRVW4_WG64_4_1_WGM2
    SolutionIndex: 378
    SolutionNameMin: Cijk_Ailk_Bjlk_BBH_MT64x128x16_MI32x32x4x1_SE_AF0EM1_GRVW8_GSU1_SU0_SUS256_SRVW4_WG64_4_1_WGM1
    SolutionIndex: 379
    SolutionNameMin: Cijk_Ailk_Bjlk_BBH_MT128x96x16_MI32x32x4x1_SE_AF0EM1_GRVW2_GSU1_SU32_SUS128_SRVW4_WG128_2_1_WGM1
    SolutionIndex: 380
    SolutionNameMin: Cijk_Ailk_Bjlk_BBH_MT128x64x16_MI32x32x4x1_SE_AF0EM1_GRVW2_GSU1_SU32_SUS128_SRVW4_WG64_4_1_WGM2
    SolutionIndex: 381
    SolutionNameMin: Cijk_Ailk_Bjlk_BBH_MT64x128x16_MI32x32x4x1_SE_AF0EM1_GRVW8_GSU1_SU0_SUS256_SRVW4_WG64_4_1_WGM15
    SolutionIndex: 382
    SolutionNameMin: Cijk_Ailk_Bjlk_BBH_MT64x256x16_MI32x32x4x1_SE_AF0EM1_GRVW8_GSU1_SU0_SUS256_SRVW4_WG64_4_1_WGM15
    SolutionIndex: 383
    SolutionNameMin: Cijk_Ailk_Bjlk_BBH_MT64x64x32_MI32x32x4x1_SE_AF0EM1_GRVW8_GSU1_SU32_SUS128_SRVW4_WG64_4_1_WGM1
    SolutionIndex: 384
    SolutionNameMin: Cijk_Ailk_Bjlk_BBH_MT32x32x64_MI16x16x8x1_SE_AF0EM1_GRVW8_GSU1_SU0_SUS256_SRVW4_WG32_8_1_WGM15
    SolutionIndex: 385
    SolutionNameMin: Cijk_Ailk_Bjlk_BBH_MT128x128x16_MI32x32x4x1_SE_AF0EM1_GRVW8_GSU1_SU32_SUS128_SRVW4_WG64_4_1_WGM15
    SolutionIndex: 386
    SolutionNameMin: Cijk_Ailk_Bjlk_BBH_MT64x128x32_MI32x32x4x1_SE_AF0EM1_GRVW8_GSU1_SU32_SUS128_SRVW4_WG64_4_1_WGM1
    SolutionIndex: 387
    SolutionNameMin: Cijk_Ailk_Bjlk_BBH_MT64x128x32_MI32x32x4x1_SE_AF0EM1_GRVW8_GSU1_SU32_SUS256_SRVW4_WG64_4_1_WGM1
    SolutionIndex: 388
    SolutionNameMin: Cijk_Ailk_Bjlk_BBH_MT128x128x16_MI32x32x4x1_SE_AF0EM4_GRVW8_NLCA1_NLCB1_SU0_SUS128_SRVW4_TT2_64_WG64_4_1_WGM1
    SolutionIndex: 389
    SolutionNameMin: Cijk_Ailk_Bjlk_BBH_MT128x128x16_MI32x32x4x1_SE_AF0EM4_GRVW8_NLCA1_NLCB1_SU0_SUS128_SRVW4_TT2_64_WG64_4_1_WGM2
    SolutionIndex: 390
    SolutionNameMin: Cijk_Ailk_Bjlk_BBH_MT128x128x16_MI32x32x4x1_SE_AF0EM1_GRVW8_NLCA1_NLCB1_SU0_SUS128_SRVW4_TT2_64_WG64_4_1_WGM2
    SolutionIndex: 391
    SolutionNameMin: Cijk_Ailk_Bjlk_BBH_MT128x128x16_MI32x32x4x1_SE_AF0EM1_GRVW8_NLCA1_NLCB1_SU0_SUS256_SRVW4_TT2_64_WG64_4_1_WGM15
    SolutionIndex: 392
    SolutionNameMin: Cijk_Ailk_Bjlk_BBH_MT128x128x16_MI32x32x4x1_SE_AF0EM1_GRVW8_NLCA1_NLCB1_SU0_SUS128_SRVW4_TT2_64_WG64_4_1_WGM15
- - - [34, 64, 1, 34]
    - [8, 0.008]
  - - [32, 64, 1, 35]
    - [7, 0.006]
  - - [64, 21, 1, 17]
    - [4, 0.002]
  - - [64, 32, 1, 35]
    - [7, 0.006]
  - - [21, 64, 1, 21]
    - [6, 0.003]
  - - [64, 30, 1, 31]
    - [7, 0.005]
  - - [15, 64, 1, 15]
    - [0, 0.001]
  - - [64, 24, 1, 24]
    - [7, 0.004]
  - - [17, 64, 1, 15]
    - [9, 0.002]
  - - [64, 35, 1, 35]
    - [4, 0.006]
  - - [32, 64, 1, 32]
    - [8, 0.007]
  - - [64, 34, 1, 24]
    - [7, 0.005]
  - - [64, 15, 1, 15]
    - [2, 0.001]
  - - [30, 64, 1, 30]
    - [10, 0.006]
  - - [30, 64, 1, 31]
    - [9, 0.007]
  - - [34, 64, 1, 24]
    - [11, 0.007]
  - - [64, 30, 1, 30]
    - [7, 0.005]
  - - [14, 64, 1, 14]
    - [0, 0.001]
  - - [64, 17, 1, 17]
    - [1, 0.001]
  - - [64, 17, 1, 15]
    - [1, 0.001]
  - - [64, 32, 1, 32]
    - [5, 0.007]
  - - [64, 31, 1, 31]
    - [7, 0.005]
  - - [17, 64, 1, 17]
    - [6, 0.002]
  - - [64, 21, 1, 21]
    - [1, 0.002]
  - - [35, 64, 1, 35]
    - [8, 0.008]
  - - [31, 64, 1, 31]
    - [9, 0.007]
  - - [21, 64, 1, 17]
    - [8, 0.003]
  - - [64, 15, 1, 15]
    - [2, 0.001]
  - - [64, 17, 1, 17]
    - [1, 0.001]
  - - [17, 64, 1, 17]
    - [6, 0.002]
  - - [64, 34, 1, 34]
    - [12, 0.007]
  - - [15, 64, 1, 14]
    - [3, 0.001]
  - - [24, 64, 1, 24]
    - [8, 0.004]
  - - [64, 14, 1, 14]
    - [3, 0.001]
  - - [15, 64, 1, 15]
    - [0, 0.001]
  - - [64, 15, 1, 14]
    - [4, 0.001]
  - - [64, 128, 512, 128]
    - [164, 35.258]
  - - [64, 512, 1, 512]
    - [29, 3.108]
  - - [64, 512, 64, 512]
    - [133, 49.622]
  - - [128, 64, 512, 128]
    - [165, 34.178]
  - - [512, 64, 1, 512]
    - [40, 3.171]
  - - [512, 64, 64, 512]
    - [167, 49.992]
  - - [1024, 2, 1, 4]
    - [134, 0.003]
  - - [1024, 2, 1, 32]
    - [166, 0.021]
  - - [1024, 2, 1, 2048]
    - [135, 0.66]
  - - [1024, 1024, 1, 4]
    - [136, 1.286]
  - - [1024, 1024, 1, 32]
    - [151, 9.969]
  - - [1024, 1024, 1, 2048]
    - [62, 57.174]
  - - [1024, 1024, 1, 4096]
    - [51, 64.004]
  - - [1024, 4096, 1, 2048]
    - [25, 84.977]
  - - [1024, 4096, 1, 4096]
    - [72, 87.401]
  - - [1024, 30528, 1, 2048]
    - [96, 95.283]
  - - [1024, 30528, 1, 4096]
    - [95, 96.795]
  - - [4096, 1024, 1, 2048]
    - [66, 84.797]
  - - [4096, 1024, 1, 4096]
    - [66, 87.952]
  - - [3, 64, 512, 3]
    - [345, 0.088]
  - - [5, 64, 512, 5]
    - [345, 0.226]
  - - [5, 64, 960, 5]
    - [346, 0.323]
  - - [9, 64, 512, 9]
    - [337, 0.671]
  - - [13, 512, 1, 32768]
    - [335, 11.004]
  - - [27, 128, 32768, 27]
    - [109, 9.875]
  - - [33, 32, 200, 33]
    - [347, 1.74]
  - - [33, 32, 1600, 33]
    - [347, 5.351]
  - - [67, 2048, 1, 512]
    - [348, 10.868]
  - - [74, 2048, 1, 512]
    - [343, 11.435]
  - - [74, 2048, 1, 960]
    - [349, 14.961]
  - - [100, 2048, 1, 512]
    - [70, 13.919]
  - - [256, 128, 1, 32768]
    - [159, 49.744]
  - - [256, 1280, 1, 8976]
    - [185, 68.985]
  - - [256, 2560, 1, 8976]
    - [186, 78.531]
  - - [256, 2816, 1, 8976]
    - [187, 78.592]
  - - [256, 3328, 1, 8976]
    - [188, 76.828]
  - - [256, 3584, 1, 8976]
    - [189, 82.693]
  - - [256, 3840, 1, 8976]
    - [190, 87.151]
  - - [256, 4096, 1, 8976]
    - [191, 76.86]
  - - [256, 4352, 1, 8976]
    - [132, 75.656]
  - - [256, 4864, 1, 8976]
    - [192, 79.631]
  - - [256, 5120, 1, 8976]
    - [193, 83.409]
  - - [256, 5632, 1, 8976]
    - [194, 89.118]
  - - [256, 5888, 1, 8976]
    - [195, 76.83]
  - - [256, 6144, 1, 8976]
    - [195, 80.709]
  - - [256, 7168, 1, 8976]
    - [196, 87.581]
  - - [256, 8192, 1, 8976]
    - [197, 83.707]
  - - [256, 8960, 1, 8976]
    - [198, 87.7]
  - - [256, 9728, 1, 8976]
    - [192, 80.956]
  - - [256, 9984, 1, 8976]
    - [192, 82.783]
  - - [256, 10240, 1, 8976]
    - [192, 84.579]
  - - [256, 10496, 1, 8976]
    - [53, 85.952]
  - - [256, 11008, 1, 8976]
    - [62, 90.092]
  - - [256, 11264, 1, 8976]
    - [38, 92.134]
  - - [256, 11520, 1, 8976]
    - [47, 94.698]
  - - [256, 11776, 1, 8976]
    - [199, 78.327]
  - - [256, 12544, 1, 8976]
    - [99, 81.494]
  - - [256, 12800, 1, 8976]
    - [191, 81.352]
  - - [256, 13312, 1, 8976]
    - [200, 83.629]
  - - [256, 13568, 1, 8976]
    - [201, 85.287]
  - - [256, 14336, 1, 8976]
    - [202, 89.984]
  - - [256, 14848, 1, 8976]
    - [110, 93.047]
  - - [256, 15104, 1, 8976]
    - [201, 94.666]
  - - [256, 15872, 1, 8976]
    - [41, 87.561]
  - - [256, 16128, 1, 8976]
    - [47, 89.225]
  - - [256, 17152, 1, 8976]
    - [48, 94.368]
  - - [256, 17408, 1, 8976]
    - [203, 85.146]
  - - [256, 18688, 1, 8976]
    - [204, 91.314]
  - - [256, 19968, 1, 8976]
    - [101, 83.833]
  - - [256, 20480, 1, 8976]
    - [52, 85.874]
  - - [256, 20992, 1, 8976]
    - [102, 87.961]
  - - [256, 21248, 1, 8976]
    - [101, 88.981]
  - - [256, 22016, 1, 8976]
    - [103, 92.046]
  - - [256, 26112, 1, 8976]
    - [205, 91.007]
  - - [256, 32512, 1, 8976]
    - [41, 90.393]
  - - [256, 32768, 1, 1]
    - [160, 0.892]
  - - [256, 33536, 1, 8976]
    - [48, 93.155]
  - - [256, 44505, 1, 8976]
    - [91, 93.75]
  - - [257, 4096, 1, 1024]
    - [350, 43.388]
  - - [480, 1024, 1, 32768]
    - [206, 90.635]
  - - [512, 32, 1, 200]
    - [40, 0.681]
  - - [512, 32, 1, 1600]
    - [182, 3.775]
  - - [512, 256, 1, 32768]
    - [161, 75.058]
  - - [512, 512, 1, 200]
    - [207, 10.222]
  - - [512, 512, 1, 1600]
    - [184, 29.623]
  - - [512, 2048, 1, 256]
    - [117, 36.146]
  - - [560, 1024, 1, 200]
    - [208, 17.595]
  - - [560, 1024, 1, 1600]
    - [121, 43.366]
  - - [768, 2048, 1, 256]
    - [181, 46.235]
  - - [1024, 64, 1, 512]
    - [33, 6.28]
  - - [1024, 64, 1, 960]
    - [209, 8.989]
  - - [1024, 256, 1, 1024]
    - [210, 23.26]
  - - [1024, 256, 1, 1280]
    - [211, 25.324]
  - - [1024, 256, 1, 2304]
    - [212, 35.548]
  - - [1024, 256, 1, 2816]
    - [213, 40.048]
  - - [1024, 256, 1, 3072]
    - [214, 41.638]
  - - [1024, 256, 1, 3328]
    - [215, 43.427]
  - - [1024, 256, 1, 3584]
    - [216, 44.859]
  - - [1024, 256, 1, 4096]
    - [217, 48.079]
  - - [1024, 256, 1, 4352]
    - [218, 48.53]
  - - [1024, 256, 1, 4608]
    - [219, 50.466]
  - - [1024, 256, 1, 5120]
    - [220, 52.119]
  - - [1024, 256, 1, 5376]
    - [221, 52.754]
  - - [1024, 256, 1, 5632]
    - [215, 53.552]
  - - [1024, 256, 1, 6144]
    - [222, 55.825]
  - - [1024, 256, 1, 6400]
    - [222, 56.99]
  - - [1024, 256, 1, 7680]
    - [217, 59.907]
  - - [1024, 256, 1, 7936]
    - [214, 60.745]
  - - [1024, 256, 1, 8192]
    - [223, 61.085]
  - - [1024, 256, 1, 8448]
    - [215, 61.681]
  - - [1024, 256, 1, 9728]
    - [224, 64.24]
  - - [1024, 256, 1, 9984]
    - [225, 64.625]
  - - [1024, 256, 1, 10496]
    - [226, 65.94]
  - - [1024, 256, 1, 11520]
    - [223, 67.37]
  - - [1024, 256, 1, 12032]
    - [224, 68.169]
  - - [1024, 256, 1, 13568]
    - [227, 70.0]
  - - [1024, 256, 1, 14336]
    - [224, 71.05]
  - - [1024, 256, 1, 14848]
    - [227, 71.423]
  - - [1024, 256, 1, 15104]
    - [224, 71.601]
  - - [1024, 256, 1, 15872]
    - [224, 72.645]
  - - [1024, 256, 1, 16128]
    - [228, 72.932]
  - - [1024, 256, 1, 17152]
    - [227, 73.434]
  - - [1024, 256, 1, 17408]
    - [224, 73.694]
  - - [1024, 256, 1, 18944]
    - [227, 74.777]
  - - [1024, 256, 1, 19712]
    - [228, 75.56]
  - - [1024, 256, 1, 19968]
    - [227, 75.247]
  - - [1024, 256, 1, 21248]
    - [227, 76.319]
  - - [1024, 256, 1, 21504]
    - [227, 76.734]
  - - [1024, 256, 1, 22016]
    - [229, 76.611]
  - - [1024, 256, 1, 28672]
    - [230, 79.66]
  - - [1024, 256, 1, 33536]
    - [231, 81.016]
  - - [1024, 512, 1, 32768]
    - [162, 82.937]
  - - [1024, 1024, 1, 200]
    - [127, 27.838]
  - - [1024, 1024, 1, 512]
    - [121, 45.061]
  - - [1024, 1024, 1, 960]
    - [232, 51.198]
  - - [1024, 1024, 1, 1600]
    - [68, 54.802]
  - - [1024, 1024, 1, 32768]
    - [163, 83.879]
  - - [1600, 1024, 1, 512]
    - [181, 56.682]
  - - [1600, 1024, 1, 960]
    - [233, 64.844]
  - - [2048, 256, 1, 1024]
    - [199, 38.797]
  - - [2048, 960, 1, 1]
    - [234, 0.575]
  - - [2048, 2048, 1, 512]
    - [41, 69.419]
  - - [2048, 2048, 1, 960]
    - [27, 78.832]
  - - [2048, 2048, 1, 1024]
    - [41, 79.908]
  - - [3200, 2048, 1, 1024]
    - [205, 83.348]
  - - [4096, 4096, 1, 1024]
    - [235, 88.85]
  - - [14, 64, 10880, 14]
    - [337, 3.701]
  - - [15, 64, 10880, 14]
    - [338, 3.806]
  - - [15, 64, 7680, 15]
    - [339, 3.898]
  - - [15, 64, 10880, 15]
    - [339, 4.034]
  - - [17, 64, 7680, 15]
    - [55, 3.871]
  - - [17, 64, 6144, 17]
    - [46, 3.839]
  - - [17, 64, 7680, 17]
    - [78, 4.053]
  - - [21, 64, 6144, 17]
    - [340, 4.342]
  - - [21, 64, 6144, 21]
    - [341, 5.244]
  - - [24, 64, 4736, 24]
    - [67, 8.785]
  - - [30, 64, 2048, 30]
    - [341, 7.83]
  - - [30, 64, 2048, 31]
    - [342, 8.09]
  - - [31, 64, 2048, 31]
    - [342, 7.833]
  - - [32, 64, 4608, 32]
    - [174, 14.455]
  - - [32, 64, 4608, 35]
    - [28, 11.687]
  - - [34, 64, 4736, 24]
    - [71, 7.024]
  - - [34, 64, 4736, 34]
    - [42, 8.851]
  - - [35, 64, 4608, 35]
    - [42, 8.816]
  - - [64, 14, 10880, 14]
    - [175, 4.236]
  - - [64, 15, 10880, 14]
    - [175, 4.386]
  - - [64, 15, 7680, 15]
    - [56, 4.443]
  - - [64, 15, 10880, 15]
    - [56, 4.663]
  - - [64, 17, 7680, 15]
    - [56, 4.98]
  - - [64, 17, 6144, 17]
    - [35, 4.727]
  - - [64, 17, 7680, 17]
    - [74, 5.275]
  - - [64, 21, 6144, 17]
    - [31, 5.651]
  - - [64, 21, 6144, 21]
    - [35, 6.804]
  - - [64, 24, 4736, 24]
    - [31, 8.599]
  - - [64, 30, 2048, 30]
    - [56, 9.316]
  - - [64, 30, 2048, 31]
    - [56, 9.546]
  - - [64, 31, 2048, 31]
    - [76, 9.583]
  - - [64, 32, 4608, 32]
    - [176, 14.681]
  - - [64, 32, 4608, 35]
    - [43, 11.513]
  - - [64, 34, 4736, 24]
    - [177, 8.222]
  - - [64, 34, 4736, 34]
    - [59, 10.167]
  - - [64, 35, 4608, 35]
    - [54, 10.418]
  - - [1024, 1024, 1, 3840]
    - [32, 63.49]
  - - [1024, 1024, 1, 3968]
    - [26, 63.885]
  - - [1024, 1024, 1, 6528]
    - [145, 69.515]
  - - [1024, 1024, 1, 7104]
    - [145, 70.309]
  - - [1024, 1024, 1, 7200]
    - [172, 70.231]
  - - [1024, 1024, 1, 8064]
    - [171, 71.547]
  - - [1024, 1024, 1, 8160]
    - [173, 71.558]
  - - [1024, 1024, 1, 9216]
    - [168, 72.756]
  - - [1024, 1024, 1, 9520]
    - [145, 72.139]
  - - [1024, 1024, 1, 10064]
    - [170, 72.589]
  - - [1024, 1024, 1, 10080]
    - [140, 73.298]
  - - [1024, 1024, 1, 10200]
    - [171, 72.452]
  - - [1024, 4096, 1, 3840]
    - [27, 87.1]
  - - [1024, 4096, 1, 3968]
    - [25, 87.822]
  - - [1024, 4096, 1, 6528]
    - [25, 88.97]
  - - [1024, 4096, 1, 7104]
    - [25, 89.373]
  - - [1024, 4096, 1, 7200]
    - [27, 89.138]
  - - [1024, 4096, 1, 8064]
    - [27, 89.389]
  - - [1024, 4096, 1, 8160]
    - [27, 89.355]
  - - [1024, 4096, 1, 9216]
    - [27, 89.74]
  - - [1024, 4096, 1, 9520]
    - [61, 89.097]
  - - [1024, 4096, 1, 10064]
    - [61, 89.535]
  - - [1024, 4096, 1, 10080]
    - [50, 89.728]
  - - [1024, 4096, 1, 10200]
    - [25, 89.228]
  - - [1024, 42720, 1, 3968]
    - [38, 95.377]
  - - [1024, 42720, 1, 6528]
    - [47, 95.744]
  - - [1024, 42720, 1, 7104]
    - [47, 95.8]
  - - [1024, 42720, 1, 7200]
    - [47, 95.812]
  - - [1024, 42720, 1, 9520]
    - [47, 95.729]
  - - [1024, 42720, 1, 10080]
    - [47, 95.96]
  - - [4096, 1024, 1, 3840]
    - [66, 87.377]
  - - [4096, 1024, 1, 3968]
    - [97, 87.549]
  - - [4096, 1024, 1, 6528]
    - [69, 88.894]
  - - [4096, 1024, 1, 7104]
    - [25, 89.074]
  - - [4096, 1024, 1, 7200]
    - [27, 89.026]
  - - [4096, 1024, 1, 8064]
    - [27, 89.439]
  - - [4096, 1024, 1, 8160]
    - [25, 89.33]
  - - [4096, 1024, 1, 9216]
    - [36, 89.541]
  - - [4096, 1024, 1, 9520]
    - [98, 88.77]
  - - [4096, 1024, 1, 10064]
    - [36, 89.192]
  - - [4096, 1024, 1, 10080]
    - [27, 89.494]
  - - [4096, 1024, 1, 10200]
    - [49, 88.921]
  - - [27, 64, 1920, 27]
    - [22, 3.275]
  - - [27, 64, 1920, 33]
    - [20, 3.57]
  - - [33, 64, 1920, 33]
    - [14, 3.548]
  - - [64, 27, 1920, 27]
    - [16, 2.525]
  - - [64, 27, 1920, 33]
    - [19, 2.903]
  - - [64, 33, 1920, 33]
    - [13, 3.716]
  - - [1024, 1024, 1, 3240]
    - [23, 26.989]
  - - [1024, 1024, 1, 3960]
    - [18, 27.424]
  - - [1024, 4096, 1, 3240]
    - [24, 38.306]
  - - [1024, 4096, 1, 3960]
    - [17, 38.342]
  - - [1024, 42720, 1, 3960]
    - [21, 45.984]
  - - [4096, 1024, 1, 3240]
    - [15, 38.398]
  - - [4096, 1024, 1, 3960]
    - [15, 38.589]
  - - [64, 1280, 64, 192]
    - [299, 53.525]
  - - [64, 1280, 64, 320]
    - [293, 60.738]
  - - [64, 1280, 64, 384]
    - [293, 62.698]
  - - [64, 1280, 64, 448]
    - [300, 64.936]
  - - [64, 2048, 64, 192]
    - [301, 54.71]
  - - [64, 2048, 64, 320]
    - [302, 62.49]
  - - [64, 2048, 64, 384]
    - [297, 65.892]
  - - [64, 2048, 64, 448]
    - [244, 67.633]
  - - [1225, 192, 64, 32]
    - [365, 24.106]
  - - [1225, 192, 64, 48]
    - [366, 33.227]
  - - [1225, 192, 64, 64]
    - [367, 39.98]
  - - [1225, 256, 64, 48]
    - [368, 35.635]
  - - [1225, 256, 64, 64]
    - [369, 43.555]
  - - [1225, 288, 64, 48]
    - [366, 36.159]
  - - [1225, 288, 64, 64]
    - [365, 42.728]
  - - [5329, 64, 64, 80]
    - [370, 38.815]
  - - [289, 768, 64, 128]
    - [371, 51.022]
  - - [289, 768, 64, 160]
    - [372, 55.607]
  - - [289, 768, 64, 192]
    - [373, 59.151]
  - - [64, 1280, 32, 192]
    - [293, 46.868]
  - - [64, 1280, 32, 320]
    - [244, 55.285]
  - - [64, 1280, 32, 384]
    - [244, 57.794]
  - - [64, 1280, 32, 448]
    - [240, 60.388]
  - - [64, 2048, 32, 192]
    - [290, 49.418]
  - - [64, 2048, 32, 320]
    - [303, 56.2]
  - - [64, 2048, 32, 384]
    - [240, 59.109]
  - - [64, 2048, 32, 448]
    - [254, 61.165]
  - - [1225, 192, 32, 32]
    - [374, 20.214]
  - - [1225, 192, 32, 48]
    - [375, 28.174]
  - - [1225, 192, 32, 64]
    - [376, 32.548]
  - - [1225, 256, 32, 48]
    - [377, 30.153]
  - - [1225, 256, 32, 64]
    - [378, 36.427]
  - - [1225, 288, 32, 48]
    - [379, 30.459]
  - - [1225, 288, 32, 64]
    - [379, 37.05]
  - - [5329, 64, 32, 80]
    - [380, 36.155]
  - - [289, 768, 32, 128]
    - [381, 44.778]
  - - [289, 768, 32, 160]
    - [382, 49.349]
  - - [289, 768, 32, 192]
    - [361, 51.983]
  - - [3136, 64, 64, 256]
    - [243, 59.58]
  - - [3136, 64, 64, 64]
    - [123, 37.992]
  - - [3136, 256, 64, 64]
    - [298, 61.485]
  - - [784, 128, 64, 512]
    - [299, 72.237]
  - - [784, 512, 64, 128]
    - [295, 65.967]
  - - [196, 256, 64, 1024]
    - [356, 55.448]
  - - [196, 1024, 64, 256]
    - [88, 57.682]
  - - [49, 512, 64, 2048]
    - [363, 45.862]
  - - [49, 2048, 64, 512]
    - [364, 47.199]
  - - [3136, 64, 32, 256]
    - [123, 55.749]
  - - [3136, 64, 32, 64]
    - [296, 32.738]
  - - [3136, 256, 32, 64]
    - [279, 56.361]
  - - [784, 128, 32, 512]
    - [297, 61.794]
  - - [784, 512, 32, 128]
    - [237, 59.293]
  - - [196, 256, 32, 1024]
    - [360, 47.271]
  - - [196, 1024, 32, 256]
    - [359, 50.038]
  - - [49, 512, 32, 2048]
    - [362, 39.101]
  - - [49, 2048, 32, 512]
    - [361, 42.156]
  - - [3136, 64, 64, 128]
    - [285, 47.416]
  - - [3136, 128, 64, 256]
    - [286, 80.191]
  - - [784, 256, 64, 512]
    - [287, 79.109]
  - - [3136, 256, 64, 128]
    - [288, 77.957]
  - - [3136, 256, 64, 256]
    - [289, 86.624]
  - - [196, 512, 64, 1024]
    - [354, 63.68]
  - - [784, 512, 64, 256]
    - [290, 75.704]
  - - [784, 512, 64, 512]
    - [291, 82.309]
  - - [196, 1024, 64, 512]
    - [89, 64.111]
  - - [196, 1024, 64, 1024]
    - [88, 67.209]
  - - [49, 1024, 64, 2048]
    - [355, 54.732]
  - - [49, 2048, 64, 1024]
    - [356, 55.223]
  - - [3136, 64, 32, 128]
    - [285, 43.099]
  - - [3136, 128, 32, 256]
    - [292, 74.966]
  - - [784, 256, 32, 512]
    - [293, 73.974]
  - - [3136, 256, 32, 128]
    - [294, 72.579]
  - - [3136, 256, 32, 256]
    - [295, 82.226]
  - - [196, 512, 32, 1024]
    - [354, 56.105]
  - - [784, 512, 32, 256]
    - [290, 71.234]
  - - [784, 512, 32, 512]
    - [293, 79.16]
  - - [196, 1024, 32, 512]
    - [357, 57.36]
  - - [196, 1024, 32, 1024]
    - [358, 63.255]
  - - [49, 1024, 32, 2048]
    - [87, 48.121]
  - - [49, 2048, 32, 1024]
    - [356, 49.041]
  - - [64, 128, 624, 128]
    - [129, 35.914]
  - - [1024, 1024, 1, 1024]
    - [116, 53.027]
  - - [1024, 1024, 1, 1280]
    - [121, 53.223]
  - - [1024, 1024, 1, 39]
    - [131, 10.071]
  - - [1024, 4096, 1, 2560]
    - [25, 85.737]
  - - [1024, 4096, 1, 1024]
    - [27, 79.2]
  - - [33, 32, 1, 33]
    - [37, 0.009]
  - - [1024, 2, 1, 4992]
    - [130, 1.132]
  - - [64, 128, 144, 128]
    - [154, 26.167]
  - - [512, 512, 1, 512]
    - [115, 18.609]
  - - [1024, 2, 1, 39]
    - [30, 0.022]
  - - [1024, 1024, 1, 8192]
    - [168, 71.679]
  - - [1024, 960, 1, 1024]
    - [114, 70.301]
  - - [1024, 1024, 1, 308]
    - [137, 33.397]
  - - [1024, 2, 1, 5]
    - [124, 0.003]
  - - [1024, 1024, 1, 4992]
    - [132, 65.974]
  - - [4096, 3840, 1, 4096]
    - [92, 97.18]
  - - [4096, 1024, 1, 3072]
    - [49, 86.407]
  - - [64, 512, 96, 512]
    - [148, 56.453]
  - - [1024, 1024, 1, 5248]
    - [145, 66.882]
  - - [4096, 1024, 1, 4992]
    - [36, 88.362]
  - - [1024, 1024, 1, 180]
    - [156, 26.364]
  - - [5, 64, 1, 5]
    - [344, 0.0]
  - - [4096, 1024, 1, 2560]
    - [36, 85.994]
  - - [1024, 33712, 1, 9600]
    - [95, 95.931]
  - - [64, 128, 640, 128]
    - [129, 35.683]
  - - [1024, 1024, 1, 5]
    - [131, 1.557]
  - - [4, 64, 32768, 4]
    - [39, 0.418]
  - - [1024, 2, 1, 40]
    - [30, 0.024]
  - - [1024, 30522, 1, 160]
    - [153, 77.803]
  - - [1024, 1024, 1, 800]
    - [84, 48.759]
  - - [1024, 1024, 1, 41]
    - [144, 9.695]
  - - [1024, 2, 1, 5248]
    - [143, 1.177]
  - - [4096, 4096, 1, 4096]
    - [93, 92.432]
  - - [1024, 30522, 1, 385]
    - [138, 86.224]
  - - [1024, 4096, 1, 9600]
    - [75, 89.717]
  - - [2048, 512, 1, 1]
    - [180, 0.356]
  - - [1024, 4096, 1, 1152]
    - [27, 80.245]
  - - [1024, 2, 1, 512]
    - [119, 0.196]
  - - [64, 4, 38400, 4]
    - [58, 0.437]
  - - [1024, 30522, 1, 180]
    - [158, 76.858]
  - - [4096, 1024, 1, 512]
    - [122, 71.266]
  - - [4096, 1024, 1, 1024]
    - [72, 78.967]
  - - [4, 64, 38400, 4]
    - [39, 0.421]
  - - [1024, 2, 1, 9]
    - [124, 0.006]
  - - [8192, 8192, 1, 8192]
    - [41, 95.991]
  - - [4096, 1024, 1, 1280]
    - [73, 80.97]
  - - [1024, 1024, 1, 3072]
    - [32, 61.647]
  - - [64, 128, 656, 128]
    - [142, 36.369]
  - - [1024, 4096, 1, 4992]
    - [27, 88.064]
  - - [1024, 1024, 1, 9]
    - [118, 2.637]
  - - [1024, 4096, 1, 512]
    - [27, 68.59]
  - - [64, 512, 16, 512]
    - [117, 30.824]
  - - [1024, 2, 1, 6]
    - [149, 0.004]
  - - [2048, 1920, 1, 2048]
    - [113, 91.906]
  - - [1024, 30522, 1, 780]
    - [65, 91.111]
  - - [64, 128, 128, 128]
    - [151, 23.478]
  - - [1024, 30522, 1, 800]
    - [141, 92.505]
  - - [960, 1024, 1, 1024]
    - [111, 71.368]
  - - [1024, 1024, 1, 6]
    - [136, 1.84]
  - - [8192, 7680, 1, 8192]
    - [91, 98.372]
  - - [1024, 2, 1, 1152]
    - [155, 0.391]
  - - [1024, 1024, 1, 2560]
    - [26, 59.318]
  - - [1024, 1024, 1, 77]
    - [120, 15.741]
  - - [1024, 1024, 1, 160]
    - [117, 29.623]
  - - [1024, 4096, 1, 8192]
    - [81, 89.419]
  - - [1024, 2, 1, 41]
    - [77, 0.024]
  - - [128, 64, 1, 128]
    - [179, 0.37]
  - - [480, 512, 1, 512]
    - [112, 21.41]
  - - [1024, 1024, 1, 462]
    - [127, 38.748]
  - - [1024, 1024, 1, 780]
    - [80, 45.696]
  - - [1024, 4096, 1, 5248]
    - [27, 88.371]
  - - [1024, 4096, 1, 1280]
    - [25, 81.036]
  - - [4096, 1024, 1, 9600]
    - [27, 89.644]
  - - [64, 512, 80, 512]
    - [146, 56.965]
  - - [4096, 1024, 1, 1152]
    - [57, 80.387]
  - - [1024, 1600, 1, 1]
    - [183, 0.503]
  - - [1024, 1024, 1, 820]
    - [68, 46.112]
  - - [1024, 2, 1, 2560]
    - [147, 0.773]
  - - [4096, 1024, 1, 5248]
    - [66, 88.334]
  - - [1024, 33712, 1, 8192]
    - [91, 95.838]
  - - [1024, 1024, 1, 385]
    - [117, 37.779]
  - - [1024, 1024, 1, 1]
    - [118, 0.37]
  - - [1024, 2, 1, 10]
    - [124, 0.006]
  - - [64, 4, 32768, 4]
    - [58, 0.433]
  - - [1024, 1024, 1, 10]
    - [126, 2.929]
  - - [1024, 2, 1, 5120]
    - [139, 1.183]
  - - [1920, 2048, 1, 2048]
    - [110, 92.357]
  - - [2048, 2048, 1, 2048]
    - [38, 85.428]
  - - [3840, 4096, 1, 4096]
    - [91, 97.18]
  - - [1024, 4096, 1, 5120]
    - [25, 88.416]
  - - [64, 128, 160, 128]
    - [123, 28.038]
  - - [1024, 30522, 1, 308]
    - [138, 84.114]
  - - [1024, 30522, 1, 820]
    - [63, 91.736]
  - - [1024, 30522, 1, 200]
    - [128, 77.43]
  - - [1024, 30522, 1, 462]
    - [64, 87.293]
  - - [1024, 2, 1, 1024]
    - [152, 0.356]
  - - [1024, 30522, 1, 77]
    - [86, 47.767]
  - - [1024, 1024, 1, 40]
    - [120, 9.938]
  - - [1024, 2, 1, 1]
    - [118, 0.0]
  - - [1024, 2, 1, 8]
    - [83, 0.006]
  - - [1024, 1024, 1, 8]
    - [120, 2.453]
  - - [1024, 1024, 1, 9600]
    - [169, 73.14]
  - - [4096, 1024, 1, 5120]
    - [27, 88.26]
  - - [1024, 4096, 1, 3072]
    - [72, 86.16]
  - - [1024, 1024, 1, 1152]
    - [157, 52.458]
  - - [512, 480, 1, 512]
    - [115, 21.607]
  - - [64, 128, 1, 128]
    - [178, 0.37]
  - - [1024, 1024, 1, 5120]
    - [140, 66.371]
  - - [1024, 2, 1, 3072]
    - [150, 0.879]
  - - [7680, 8192, 1, 8192]
    - [90, 98.329]
  - - [4096, 1024, 1, 8192]
    - [75, 89.431]
  - - [1024, 2, 1, 1280]
    - [125, 0.43]
  - - [479, 1024, 1, 32768]
    - [336, 86.444]
  - - [64, 1024, 32, 1024]
    - [133, 60.808]
  - - [2560, 1920, 1, 2048]
    - [245, 92.721]
  - - [1024, 3072, 1, 4096]
    - [242, 81.199]
  - - [2560, 2560, 1, 2048]
    - [34, 87.928]
  - - [2048, 2, 1, 2]
    - [124, 0.003]
  - - [1024, 64, 128, 1024]
    - [256, 75.623]
  - - [2048, 2048, 1, 2]
    - [236, 1.467]
  - - [1024, 64, 32, 1024]
    - [133, 61.178]
  - - [1024, 96, 64, 1024]
    - [194, 74.71]
  - - [1024, 30592, 1, 2048]
    - [96, 95.704]
  - - [1024, 3072, 1, 16384]
    - [238, 85.338]
  - - [6144, 1536, 1, 4096]
    - [100, 92.529]
  - - [1024, 1024, 1, 16]
    - [131, 5.709]
  - - [1536, 4608, 1, 8192]
    - [45, 92.604]
  - - [640, 2560, 1, 2048]
    - [247, 73.712]
  - - [1024, 4096, 1, 16384]
    - [50, 90.968]
  - - [64, 512, 40, 512]
    - [44, 46.868]
  - - [1024, 1024, 1, 16384]
    - [253, 77.745]
  - - [1536, 6144, 1, 4096]
    - [105, 92.708]
  - - [1024, 30592, 1, 4096]
    - [95, 96.779]
  - - [2560, 2560, 1, 4]
    - [246, 3.384]
  - - [1536, 1536, 1, 4096]
    - [248, 89.056]
  - - [2560, 7680, 1, 2048]
    - [95, 96.719]
  - - [64, 1024, 256, 1024]
    - [254, 78.198]
  - - [96, 1024, 64, 1024]
    - [250, 75.41]
  - - [1536, 50304, 1, 4096]
    - [95, 96.387]
  - - [2048, 8192, 1, 1024]
    - [101, 89.023]
  - - [1024, 30592, 1, 8192]
    - [95, 97.758]
  - - [512, 64, 256, 512]
    - [239, 64.465]
  - - [1024, 96, 128, 1024]
    - [60, 83.912]
  - - [64, 512, 128, 512]
    - [244, 58.252]
  - - [4096, 1024, 1, 16384]
    - [97, 90.171]
  - - [8192, 2048, 1, 1024]
    - [237, 88.9]
  - - [64, 1024, 64, 1024]
    - [255, 68.648]
  - - [1024, 50304, 1, 4096]
    - [38, 95.695]
  - - [1536, 4608, 1, 4096]
    - [249, 91.565]
  - - [512, 64, 128, 512]
    - [243, 58.763]
  - - [6144, 1536, 1, 8192]
    - [100, 93.353]
  - - [1024, 3072, 1, 8192]
    - [238, 83.78]
  - - [1536, 1536, 1, 8192]
    - [251, 90.914]
  - - [1536, 50304, 1, 8192]
    - [95, 96.756]
  - - [2560, 2, 1, 4]
    - [175, 0.009]
  - - [2048, 6144, 1, 1024]
    - [194, 87.377]
  - - [64, 1024, 128, 1024]
    - [146, 75.623]
  - - [1024, 64, 64, 1024]
    - [243, 68.707]
  - - [1024, 2, 1, 16]
    - [79, 0.012]
  - - [96, 1024, 128, 1024]
    - [252, 80.2]
  - - [2048, 30592, 1, 1024]
    - [104, 94.796]
  - - [64, 512, 256, 512]
    - [240, 65.356]
  - - [1536, 6144, 1, 8192]
    - [105, 93.462]
  - - [1024, 50304, 1, 2048]
    - [82, 94.519]
  - - [1024, 50304, 1, 8192]
    - [85, 96.213]
  - - [1024, 3072, 1, 2048]
    - [241, 77.544]
  - - [1024, 64, 256, 1024]
    - [239, 78.046]
  - - [1024, 50304, 1, 16384]
    - [106, 96.681]
  - - [512, 64, 40, 512]
    - [167, 47.22]
  - - [1024, 2, 1, 64]
    - [257, 0.036]
  - - [1024, 30528, 1, 8192]
    - [95, 97.49]
  - - [1024, 1024, 1, 64]
    - [258, 16.748]
  - - [64, 128, 1024, 128]
    - [259, 38.872]
  - - [128, 64, 1024, 128]
    - [260, 38.279]
  - - [1024, 1024, 1, 3456]
    - [194, 61.16]
  - - [1024, 1024, 1, 6912]
    - [171, 70.215]
  - - [1024, 1024, 1, 864]
    - [117, 49.15]
  - - [1024, 512, 1, 3456]
    - [261, 49.947]
  - - [1024, 512, 1, 4096]
    - [261, 53.236]
  - - [1024, 512, 1, 6912]
    - [262, 61.829]
  - - [1024, 512, 1, 864]
    - [258, 35.774]
  - - [256, 128, 1, 3456]
    - [263, 13.587]
  - - [256, 128, 1, 4096]
    - [264, 15.134]
  - - [256, 128, 1, 55296]
    - [265, 56.334]
  - - [256, 128, 1, 6912]
    - [266, 21.629]
  - - [256, 128, 1, 864]
    - [267, 3.812]
  - - [256, 3456, 1, 1]
    - [268, 0.325]
  - - [256, 4096, 1, 1]
    - [269, 0.344]
  - - [256, 6912, 1, 1]
    - [270, 0.494]
  - - [256, 864, 1, 1]
    - [271, 0.109]
  - - [480, 1024, 1, 3456]
    - [272, 60.792]
  - - [480, 1024, 1, 4096]
    - [272, 65.193]
  - - [480, 1024, 1, 6912]
    - [272, 74.722]
  - - [480, 1024, 1, 864]
    - [273, 35.015]
  - - [512, 256, 1, 3456]
    - [274, 33.778]
  - - [512, 256, 1, 4096]
    - [275, 37.079]
  - - [512, 256, 1, 55296]
    - [276, 82.818]
  - - [512, 256, 1, 6912]
    - [277, 49.008]
  - - [512, 256, 1, 864]
    - [278, 13.331]
  - - [30528, 1024, 1, 640]
    - [279, 91.622]
  - - [30528, 1024, 1, 1280]
    - [235, 94.003]
  - - [4096, 1024, 1, 10240]
    - [107, 89.21]
  - - [1024, 4096, 1, 10240]
    - [108, 89.648]
  - - [30528, 1024, 1, 1600]
    - [94, 94.437]
  - - [1024, 2, 1, 80]
    - [280, 0.042]
  - - [1024, 1024, 1, 10240]
    - [145, 73.534]
  - - [1024, 1024, 1, 80]
    - [281, 19.148]
  - - [64, 128, 1280, 128]
    - [164, 40.194]
  - - [128, 64, 1280, 128]
    - [282, 38.947]
  - - [1024, 4096, 1, 10496]
    - [98, 89.494]
  - - [30528, 1024, 1, 1640]
    - [94, 94.093]
  - - [4096, 1024, 1, 10496]
    - [97, 89.174]
  - - [1024, 1024, 1, 10496]
    - [172, 73.965]
  - - [1024, 1024, 1, 82]
    - [136, 17.121]
  - - [1024, 2, 1, 82]
    - [149, 0.04]
  - - [128, 64, 1312, 128]
    - [283, 39.191]
  - - [64, 128, 1312, 128]
    - [142, 40.108]
  - - [30528, 1024, 1, 160]
    - [284, 74.298]
  - - [1024, 4096, 1, 6144]
    - [97, 88.695]
  - - [30528, 1024, 1, 240]
    - [235, 82.943]
  - - [4096, 1024, 1, 6144]
    - [97, 88.647]
  - - [1024, 1024, 1, 12]
    - [131, 3.516]
  - - [1024, 2, 1, 12]
    - [124, 0.007]
  - - [1024, 1024, 1, 6144]
    - [145, 68.825]
  - - [64, 512, 192, 512]
    - [148, 62.803]
  - - [512, 64, 192, 512]
    - [239, 62.413]
  - - [13, 512, 1, 3456]
    - [351, 3.053]
  - - [13, 512, 1, 4096]
    - [352, 3.645]
  - - [13, 512, 1, 55296]
    - [335, 12.709]
  - - [13, 512, 1, 6912]
    - [352, 5.283]
  - - [13, 512, 1, 864]
    - [353, 0.882]
  - - [1024, 1024, 1, 10224]
    - [168, 72.886]
  - - [1024, 1024, 1, 10192]
    - [171, 72.552]
  - - [1024, 1024, 1, 10208]
    - [132, 73.492]
  - - [1024, 4096, 1, 10224]
    - [304, 88.687]
  - - [4096, 1024, 1, 10224]
    - [122, 88.57]
  - - [1024, 3072, 1, 10224]
    - [241, 82.484]
  - - [1024, 3072, 1, 10240]
    - [238, 84.417]
  - - [4096, 1024, 1, 10192]
    - [122, 88.743]
  - - [1024, 3072, 1, 10192]
    - [241, 82.621]
  - - [1024, 4096, 1, 10192]
    - [304, 88.714]
  - - [1024, 3072, 1, 10200]
    - [241, 82.368]
  - - [1024, 1024, 1, 10184]
    - [305, 72.759]
  - - [4096, 1024, 1, 10208]
    - [122, 89.12]
  - - [1024, 3072, 1, 10208]
    - [242, 83.279]
  - - [1024, 4096, 1, 10208]
    - [306, 88.972]
  - - [1024, 2048, 1, 10224]
    - [307, 85.805]
  - - [1024, 2048, 1, 10240]
    - [307, 86.308]
  - - [1024, 1024, 1, 10120]
    - [145, 72.699]
  - - [1024, 2048, 1, 10192]
    - [308, 85.757]
  - - [64, 24, 6816, 24]
    - [176, 8.123]
  - - [1024, 1024, 1, 10152]
    - [305, 72.69]
  - - [1024, 3072, 1, 10080]
    - [241, 83.285]
  - - [64, 26, 6272, 26]
    - [309, 8.258]
  - - [100352, 256, 1, 512]
    - [235, 86.109]
  - - [12544, 1024, 1, 2048]
    - [249, 90.626]
  - - [12544, 147, 1, 64]
    - [270, 21.238]
  - - [200704, 256, 1, 512]
    - [288, 89.948]
  - - [25088, 512, 1, 1024]
    - [289, 87.208]
  - - [3136, 576, 1, 64]
    - [234, 23.519]
  - - [50176, 512, 1, 1024]
    - [291, 89.005]
  - - [6272, 1024, 1, 2048]
    - [254, 85.809]
  - - [784, 1152, 1, 128]
    - [310, 23.266]
  - - [3136, 256, 128, 128]
    - [138, 80.876]
  - - [3136, 256, 256, 128]
    - [311, 82.433]
  - - [3136, 256, 128, 64]
    - [286, 64.447]
  - - [3136, 256, 256, 64]
    - [286, 65.756]
  - - [3136, 64, 128, 256]
    - [312, 61.825]
  - - [3136, 64, 256, 256]
    - [313, 63.697]
  - - [3136, 64, 128, 64]
    - [151, 41.698]
  - - [3136, 64, 256, 64]
    - [123, 43.867]
  - - [784, 128, 128, 512]
    - [299, 77.957]
  - - [784, 128, 256, 512]
    - [314, 81.789]
  - - [784, 512, 128, 128]
    - [138, 70.46]
  - - [784, 512, 256, 128]
    - [315, 72.772]
  - - [784, 512, 128, 256]
    - [290, 78.478]
  - - [784, 512, 256, 256]
    - [290, 79.801]
  - - [64, 128, 2048, 128]
    - [316, 40.889]
  - - [128, 64, 2048, 128]
    - [260, 40.314]
  - - [30528, 1024, 1, 2560]
    - [294, 95.04]
  - - [1024, 1024, 1, 128]
    - [317, 25.898]
  - - [1024, 2, 1, 128]
    - [318, 0.064]
  - - [128, 64, 1536, 128]
    - [319, 39.304]
  - - [64, 128, 1536, 128]
    - [142, 39.876]
  - - [1024, 4096, 1, 12288]
    - [304, 89.253]
  - - [30528, 1024, 1, 1920]
    - [320, 94.657]
  - - [1024, 1024, 1, 96]
    - [137, 22.43]
  - - [1024, 1024, 1, 12288]
    - [173, 75.082]
  - - [4096, 1024, 1, 12288]
    - [321, 89.006]
  - - [1024, 2, 1, 96]
    - [322, 0.049]
  - - [25600, 128, 25, 128]
    - [237, 80.401]
  - - [12544, 128, 36, 128]
    - [294, 78.952]
  - - [9216, 128, 49, 128]
    - [289, 78.952]
  - - [6400, 128, 64, 128]
    - [294, 78.601]
  - - [6400, 256, 25, 256]
    - [295, 87.498]
  - - [4096, 256, 36, 256]
    - [294, 85.721]
  - - [2304, 256, 49, 256]
    - [288, 86.227]
  - - [2304, 256, 64, 256]
    - [289, 85.6]
  - - [2304, 512, 25, 512]
    - [288, 91.698]
  - - [1024, 512, 36, 512]
    - [289, 87.293]
  - - [1024, 512, 49, 512]
    - [323, 86.961]
  - - [1024, 512, 64, 512]
    - [289, 88.241]
  - - [92416, 64, 25, 64]
    - [324, 44.841]
  - - [50176, 64, 36, 64]
    - [283, 44.158]
  - - [36864, 64, 49, 64]
    - [285, 44.902]
  - - [25600, 64, 64, 64]
    - [313, 44.748]
  - - [64, 128, 192, 128]
    - [323, 29.439]
  - - [128, 64, 192, 128]
    - [118, 29.21]
  - - [768, 2, 1, 2048]
    - [325, 0.494]
  - - [3072, 768, 1, 2048]
    - [326, 85.317]
  - - [768, 3072, 1, 2048]
    - [198, 85.64]
  - - [768, 768, 1, 2048]
    - [327, 48.726]
  - - [64, 384, 144, 384]
    - [301, 59.29]
  - - [384, 64, 144, 384]
    - [243, 56.273]
  - - [768, 2, 1, 4608]
    - [328, 0.907]
  - - [3072, 768, 1, 4608]
    - [251, 89.403]
  - - [768, 3072, 1, 4608]
    - [329, 89.482]
  - - [768, 768, 1, 4608]
    - [330, 63.194]
  - - [64, 512, 48, 512]
    - [303, 53.449]
  - - [512, 64, 48, 512]
    - [239, 52.702]
  - - [64, 128, 256, 128]
    - [331, 31.799]
  - - [128, 64, 256, 128]
    - [285, 31.799]
  - - [64, 384, 192, 384]
    - [332, 58.98]
  - - [384, 64, 192, 384]
    - [313, 62.226]
  - - [1024, 2, 1, 4608]
    - [333, 1.098]
  - - [4096, 1024, 1, 4608]
    - [122, 87.377]
  - - [1024, 4096, 1, 4608]
    - [122, 87.504]
  - - [1024, 1024, 1, 4608]
    - [334, 65.109]
  - - [196, 2304, 1, 256]
    - [383, 18.336]
  - - [49, 4608, 1, 512]
    - [384, 14.62]
  - - [196, 1024, 128, 256]
    - [368, 58.422]
  - - [196, 1024, 256, 256]
    - [382, 60.997]
  - - [196, 1024, 128, 512]
    - [385, 64.195]
  - - [196, 1024, 256, 512]
    - [368, 66.762]
  - - [196, 256, 128, 1024]
    - [364, 63.222]
  - - [196, 256, 256, 1024]
    - [373, 65.233]
  - - [49, 2048, 128, 512]
    - [371, 50.222]
  - - [49, 2048, 256, 512]
    - [354, 52.435]
  - - [49, 512, 128, 2048]
    - [386, 53.334]
  - - [49, 512, 256, 2048]
    - [387, 59.884]
  - - [3840, 4224, 1, 4096]
    - [388, 99.187]
  - - [3840, 4224, 1, 4224]
    - [389, 99.173]
  - - [3840, 4224, 1, 4320]
    - [389, 99.194]
  - - [7680, 8448, 1, 8192]
    - [390, 99.798]
  - - [7680, 8448, 1, 8448]
    - [391, 99.808]
  - - [7680, 8448, 1, 8640]
    - [392, 99.801]
- null
