library/src/blas3/Tensile/Logic/asm_full/aldebaran_Cijk_Alik_Bljk_DB.yaml
- {MinimumRequiredVersion: 4.7.2}
- aldebaran
- gfx90a
- [Device 0050, Device 0051, Device 0052, Device 0054, Device 0062, Device 7400, Device
    SolutionIndex: 0
    SolutionNameMin: Cijk_Alik_Bljk_DB_MT064x064x08_
    SolutionIndex: 1
    SolutionNameMin: Cijk_Alik_Bljk_DB_MT064x064x04_
    SolutionIndex: 2
    SolutionNameMin: Cijk_Alik_Bljk_DB_MT64x32x8_SE_AMAS1_GRVW1_VW1
    SolutionIndex: 3
    SolutionIndex: 4
    SolutionIndex: 5
    SolutionNameMin: Cijk_Alik_Bljk_DB_MT64x64x32_MI16x16x4x1_SN_EPS0_GSU55_IU2_PGR2_TT2_32_TLDS0_WG32_8_1_WGM8
    SolutionIndex: 6
    SolutionNameMin: Cijk_Alik_Bljk_DB_MT64x16x32_MI16x16x4x1_SN_EPS0_GSU55_IU1_PGR2_TT2_16_TLDS0_WG32_4_1_WGM8
    SolutionIndex: 7
    SolutionNameMin: Cijk_Alik_Bljk_DB_MT32x32x32_MI16x16x4x1_SN_EPS0_GSU55_IU1_PGR2_TT1_16_TLDS0_WG32_8_1_WGM1
    SolutionIndex: 8
    SolutionNameMin: Cijk_Alik_Bljk_DB_MT32x32x32_MI16x16x4x1_SN_EPS0_GSU110_IU1_PGR2_TT1_16_TLDS1_WG32_8_1_WGM8
    SolutionIndex: 9
    SolutionNameMin: Cijk_Alik_Bljk_DB_MT32x16x32_MI16x16x4x1_SN_EPS0_GSU55_IU1_PGR2_TT2_16_TLDS0_WG16_4_1_WGM8
    SolutionIndex: 10
    SolutionNameMin: Cijk_Alik_Bljk_DB_MT32x16x32_MI16x16x4x1_SN_EPS0_GSU110_IU1_PGR2_TT2_16_TLDS1_WG16_4_1_WGM8
- - - [1, 64, 1, 64]
    - [1, 0.0]
  - - [64, 1, 1, 64]
    - [1, 0.0]
  - - [1, 1, 1, 64]
    - [1, 0.0]
  - - [64, 64, 1, 64]
    - [0, 0.0]
  - - [128, 1, 1, 128]
    - [2, 0.0]
  - - [250, 9, 1, 500000]
    - [3, 8.904]
  - - [250, 250, 1, 500000]
    - [4, 46.335]
  - - [250, 250, 1, 8000000]
    - [5, 19.292]
  - - [250, 9, 1, 8000000]
    - [6, 4.763]
  - - [250, 250, 1, 12000000]
    - [7, 6.011]
  - - [250, 250, 1, 16000000]
    - [8, 5.751]
  - - [250, 9, 1, 12000000]
    - [9, 4.162]
  - - [250, 9, 1, 16000000]
    - [10, 4.172]
- null
