library/src/blas3/Tensile/Logic/asm_full/aldebaran_Cijk_Ailk_Bljk_ZB.yaml
- {MinimumRequiredVersion: 4.28.0}
- aldebaran
- gfx90a
- [Device 7400, Device 7408, Device 740c]
    SolutionIndex: 0
    SolutionNameMin: Cijk_Ailk_Bljk_ZB_MT32x32x8_MI16x16x4x1_SN_1LDSB1_IU2_NLCA1_SIA2_TT1_16_WG32_8_1
    SolutionIndex: 1
    SolutionNameMin: Cijk_Ailk_Bljk_ZB_MT64x32x8_MI16x16x4x1_SN_1LDSB1_IU1_NLCA1_SIA3_TT1_32_WG64_4_1
    SolutionIndex: 2
    SolutionNameMin: Cijk_Ailk_Bljk_ZB_MT64x64x8_MI16x16x4x1_SN_1LDSB1_IU1_NLCA1_SIA3_TT2_32_WG32_8_1
    SolutionIndex: 3
    SolutionNameMin: Cijk_Ailk_Bljk_ZB_MT64x64x8_MI16x16x4x1_SN_1LDSB1_IU1_NLCA1_SIA3_TT2_32_WG32_8_1
    SolutionIndex: 4
    SolutionNameMin: Cijk_Ailk_Bljk_ZB_MT64x64x8_MI16x16x4x1_SN_1LDSB1_IU1_NLCA1_SIA3_TT2_32_WG32_8_1
    SolutionIndex: 5
    SolutionNameMin: Cijk_Ailk_Bljk_ZB_MT16x16x16_MI16x16x4x1_SN_1LDSB0_IU1_NLCA1_SIA3_TT1_16_WG16_4_1
    SolutionIndex: 6
    SolutionNameMin: Cijk_Ailk_Bljk_ZB_MT32x32x16_MI16x16x4x1_SN_1LDSB0_IU1_NLCA1_SIA3_TT1_16_WG32_8_1
    SolutionIndex: 7
    SolutionNameMin: Cijk_Ailk_Bljk_ZB_MT16x16x16_MI16x16x4x1_SN_1LDSB0_GSUAMB_IU1_NLCA1_SIA3_TT1_16_WG16_4_1
    SolutionIndex: 8
    SolutionNameMin: Cijk_Ailk_Bljk_ZB_MT64x64x8_MI16x16x4x1_SN_1LDSB0_EPS0_IU1_NEPBS0_PGR2_PLR3_SIA3_SU32_SUS256_SPO1_SSO0_TT1_64_WG64_4_1_WGM5
    SolutionIndex: 9
    SolutionNameMin: Cijk_Ailk_Bljk_ZB_MT32x32x8_MI16x16x4x1_SN_1LDSB0_EPS0_IU1_NEPBS0_PGR2_PLR3_SIA3_SU0_SUS0_SPO1_SSO0_TT1_16_WG32_8_1_WGM1
    SolutionIndex: 10
    SolutionNameMin: Cijk_Ailk_Bljk_ZB_MT32x32x8_MI16x16x4x1_SN_1LDSB1_EPS1_IU2_NEPBS0_PGR1_PLR1_SIA2_SU0_SUS0_SPO0_SSO0_TT1_16_WG32_8_1_WGM10
    SolutionIndex: 11
    SolutionNameMin: Cijk_Ailk_Bljk_ZB_MT32x32x8_MI16x16x4x1_SN_1LDSB1_EPS0_IU2_NEPBS0_PGR2_PLR1_SIA2_SU0_SUS0_SPO1_SSO0_TT1_16_WG32_8_1_WGM10
    SolutionIndex: 12
    SolutionNameMin: Cijk_Ailk_Bljk_ZB_MT32x32x8_MI16x16x4x1_SN_1LDSB1_EPS0_IU2_NEPBS0_PGR2_PLR1_SIA2_SU0_SUS0_SPO0_SSO0_TT1_16_WG32_8_1_WGM10
    SolutionIndex: 13
    SolutionNameMin: Cijk_Ailk_Bljk_ZB_MT32x32x8_MI16x16x4x1_SN_1LDSB1_EPS1_IU2_NEPBS0_PGR1_PLR1_SIA2_SU0_SUS0_SPO0_SSO0_TT1_16_WG32_8_1_WGM5
    SolutionIndex: 14
    SolutionNameMin: Cijk_Ailk_Bljk_ZB_MT32x16x16_MI16x16x4x1_SN_1LDSB0_EPS0_IU1_NEPBS0_PGR2_PLR5_SIA3_SU0_SUS0_SPO0_SSO0_TT1_16_WG32_4_1_WGM1
    SolutionIndex: 15
    SolutionNameMin: Cijk_Ailk_Bljk_ZB_MT64x64x8_MI16x16x4x1_SN_1LDSB0_EPS0_IU1_NEPBS0_PGR2_PLR3_SIA3_SU0_SUS0_SPO1_SSO4_TT1_64_WG64_4_1_WGM8
    SolutionIndex: 16
    SolutionNameMin: Cijk_Ailk_Bljk_ZB_MT32x32x8_MI16x16x4x1_SN_1LDSB0_EPS0_IU1_NEPBS0_PGR2_PLR3_SIA3_SU0_SUS0_SPO1_SSO0_TT1_16_WG32_8_1_WGM1
    SolutionIndex: 17
    SolutionNameMin: Cijk_Ailk_Bljk_ZB_MT32x32x8_MI16x16x4x1_SN_1LDSB1_EPS1_IU2_NEPBS0_PGR1_PLR1_SIA2_SU0_SUS0_SPO0_SSO0_TT1_16_WG32_8_1_WGM10
    SolutionIndex: 18
    SolutionNameMin: Cijk_Ailk_Bljk_ZB_MT64x32x8_MI16x16x4x1_SN_1LDSB1_EPS0_IU2_NEPBS0_PGR2_PLR1_SIA2_SU0_SUS0_SPO0_SSO8_TT2_16_WG32_8_1_WGM1
    SolutionIndex: 19
    SolutionNameMin: Cijk_Ailk_Bljk_ZB_MT64x32x8_MI16x16x4x1_SN_1LDSB1_EPS0_IU2_NEPBS0_PGR2_PLR1_SIA2_SU0_SUS0_SPO0_SSO6_TT2_16_WG32_8_1_WGM1
    SolutionIndex: 20
    SolutionNameMin: Cijk_Ailk_Bljk_ZB_MT32x32x8_MI16x16x4x1_SN_1LDSB1_EPS0_IU2_NEPBS0_PGR2_PLR1_SIA2_SU0_SUS0_SPO0_SSO0_TT1_16_WG32_8_1_WGM10
    SolutionIndex: 21
    SolutionNameMin: Cijk_Ailk_Bljk_ZB_MT64x64x8_MI16x16x4x1_SN_1LDSB1_EPS0_IU2_NEPBS0_PGR2_PLR1_SIA2_SU32_SUS128_SPO1_SSO6_TT1_64_WG64_4_1_WGM1
    SolutionIndex: 22
    SolutionNameMin: Cijk_Ailk_Bljk_ZB_MT32x32x8_MI16x16x4x1_SN_1LDSB1_EPS1_IU2_NEPBS0_PGR1_PLR1_SIA2_SU0_SUS0_SPO0_SSO0_TT1_16_WG32_8_1_WGM5
    SolutionIndex: 23
    SolutionNameMin: Cijk_Ailk_Bljk_ZB_MT64x32x8_MI16x16x4x1_SN_1LDSB1_EPS0_IU2_NEPBS0_PGR2_PLR1_SIA2_SU32_SUS128_SPO1_SSO0_TT2_16_WG32_8_1_WGM10
    SolutionIndex: 24
    SolutionNameMin: Cijk_Ailk_Bljk_ZB_MT32x32x8_MI16x16x4x1_SN_1LDSB1_EPS0_IU2_NEPBS0_PGR2_PLR1_SIA2_SU32_SUS256_SPO0_SSO8_TT1_16_WG32_8_1_WGM1
    SolutionIndex: 25
    SolutionNameMin: Cijk_Ailk_Bljk_ZB_MT64x64x8_MI16x16x4x1_SN_1LDSB1_EPS0_IU2_NEPBS0_PGR2_PLR1_SIA2_SU0_SUS0_SPO1_SSO4_TT1_64_WG64_4_1_WGM1
    SolutionIndex: 26
    SolutionNameMin: Cijk_Ailk_Bljk_ZB_MT32x32x8_MI16x16x4x1_SN_1LDSB1_EPS0_IU2_NEPBS0_PGR2_PLR1_SIA2_SU0_SUS0_SPO0_SSO4_TT1_16_WG32_8_1_WGM5
    SolutionIndex: 27
    SolutionNameMin: Cijk_Ailk_Bljk_ZB_MT32x16x16_MI16x16x4x1_SN_1LDSB1_EPS1_IU4_NEPBS0_PGR1_PLR1_SIA2_SU0_SUS0_SPO1_SSO0_TT1_16_WG32_4_1_WGM1
    SolutionIndex: 28
    SolutionNameMin: Cijk_Ailk_Bljk_ZB_MT32x32x8_MI16x16x4x1_SN_1LDSB0_EPS0_IU1_NEPBS0_PGR2_PLR3_SIA3_SU0_SUS0_SPO1_SSO4_TT1_16_WG32_8_1_WGM1
    SolutionIndex: 29
    SolutionNameMin: Cijk_Ailk_Bljk_ZB_MT32x32x8_MI16x16x4x1_SN_1LDSB1_EPS0_IU2_NEPBS0_PGR2_PLR1_SIA2_SU0_SUS0_SPO0_SSO4_TT1_16_WG32_8_1_WGM1
    SolutionIndex: 30
    SolutionNameMin: Cijk_Ailk_Bljk_ZB_MT32x32x8_MI16x16x4x1_SN_1LDSB1_EPS0_IU2_NEPBS0_PGR2_PLR1_SIA2_SU32_SUS128_SPO0_SSO0_TT1_16_WG32_8_1_WGM10
    SolutionIndex: 31
    SolutionNameMin: Cijk_Ailk_Bljk_ZB_MT32x32x8_MI16x16x4x1_SN_1LDSB1_EPS1_IU2_NEPBS0_PGR1_PLR1_SIA2_SU32_SUS128_SPO1_SSO0_TT1_16_WG32_8_1_WGM10
    SolutionIndex: 32
    SolutionNameMin: Cijk_Ailk_Bljk_ZB_MT32x32x8_MI16x16x4x1_SN_1LDSB1_EPS0_IU2_NEPBS0_PGR2_PLR1_SIA2_SU0_SUS0_SPO0_SSO0_TT1_16_WG32_8_1_WGM10
    SolutionIndex: 33
    SolutionNameMin: Cijk_Ailk_Bljk_ZB_MT32x32x8_MI16x16x4x1_SN_1LDSB1_EPS1_IU2_NEPBS0_PGR1_PLR1_SIA2_SU0_SUS0_SPO0_SSO0_TT1_16_WG32_8_1_WGM10
    SolutionIndex: 34
    SolutionNameMin: Cijk_Ailk_Bljk_ZB_MT32x32x8_MI16x16x4x1_SN_1LDSB1_EPS0_IU2_NEPBS0_PGR2_PLR1_SIA2_SU0_SUS0_SPO0_SSO6_TT1_16_WG32_8_1_WGM10
    SolutionIndex: 35
    SolutionNameMin: Cijk_Ailk_Bljk_ZB_MT16x16x16_MI16x16x4x1_SN_1LDSB0_IU1_NLCA1_SIA3_TT1_16_WG16_4_1
    SolutionIndex: 36
    SolutionNameMin: Cijk_Ailk_Bljk_ZB_MT64x32x8_MI16x16x4x1_SN_1LDSB1_IU1_NLCA1_SIA3_TT1_32_WG64_4_1
    SolutionIndex: 37
    SolutionNameMin: Cijk_Ailk_Bljk_ZB_MT96x64x8_MI16x16x4x1_SN_1LDSB1_IU1_NLCA3_SIA3_TT3_32_WG32_8_1
    SolutionIndex: 38
    SolutionNameMin: Cijk_Ailk_Bljk_ZB_MT96x64x8_MI16x16x4x1_SN_1LDSB1_IU1_NLCA3_SIA3_TT3_32_WG32_8_1
    SolutionIndex: 39
    SolutionNameMin: Cijk_Ailk_Bljk_ZB_MT96x64x8_MI16x16x4x1_SN_1LDSB1_IU1_NLCA3_SIA3_TT3_32_WG32_8_1
    SolutionIndex: 40
    SolutionNameMin: Cijk_Ailk_Bljk_ZB_MT96x64x8_MI16x16x4x1_SN_1LDSB1_IU1_NLCA3_SIA3_TT3_32_WG32_8_1
    SolutionIndex: 41
    SolutionNameMin: Cijk_Ailk_Bljk_ZB_MT96x64x8_MI16x16x4x1_SN_1LDSB1_IU1_NLCA3_SIA3_TT3_32_WG32_8_1
    SolutionIndex: 42
    SolutionNameMin: Cijk_Ailk_Bljk_ZB_MT96x64x8_MI16x16x4x1_SN_1LDSB1_IU1_NLCA3_SIA3_TT3_32_WG32_8_1
    SolutionIndex: 43
    SolutionNameMin: Cijk_Ailk_Bljk_ZB_MT96x64x8_MI16x16x4x1_SN_1LDSB1_IU1_NLCA3_SIA3_TT3_32_WG32_8_1
    SolutionIndex: 44
    SolutionNameMin: Cijk_Ailk_Bljk_ZB_MT96x64x8_MI16x16x4x1_SN_1LDSB1_IU1_NLCA3_SIA3_TT3_32_WG32_8_1
    SolutionIndex: 45
    SolutionNameMin: Cijk_Ailk_Bljk_ZB_MT96x64x8_MI16x16x4x1_SN_1LDSB1_IU1_NLCA3_SIA3_TT3_32_WG32_8_1
    SolutionIndex: 46
    SolutionNameMin: Cijk_Ailk_Bljk_ZB_MT16x16x8_MI16x16x4x1_SN_1LDSB0_GSUAMB_IU1_NLCA1_SIA3_TT1_16_WG16_4_1
    SolutionIndex: 47
    SolutionNameMin: Cijk_Ailk_Bljk_ZB_MT16x16x16_MI16x16x4x1_SN_1LDSB0_GSUASB_IU1_NLCA1_SIA3_TT1_16_WG16_4_1
    SolutionIndex: 48
    SolutionNameMin: Cijk_Ailk_Bljk_ZB_MT16x16x8_MI16x16x4x1_SN_1LDSB1_GSUASB_IU2_NLCA1_SIA2_TT1_16_WG16_4_1
    SolutionIndex: 49
    SolutionNameMin: Cijk_Ailk_Bljk_ZB_MT16x16x16_MI16x16x4x1_SN_1LDSB0_GSUAMB_IU1_NLCA1_SIA3_TT1_16_WG16_4_1
    SolutionIndex: 50
    SolutionNameMin: Cijk_Ailk_Bljk_ZB_MT16x16x16_MI16x16x4x1_SN_1LDSB0_GSUAMB_IU1_NLCA1_SIA3_TT1_16_WG16_4_1
    SolutionIndex: 51
    SolutionNameMin: Cijk_Ailk_Bljk_ZB_MT16x16x16_MI16x16x4x1_SN_1LDSB0_GSUASB_IU1_NLCA1_SIA3_TT1_16_WG16_4_1
    SolutionIndex: 52
    SolutionNameMin: Cijk_Ailk_Bljk_ZB_MT16x16x8_MI16x16x4x1_SN_1LDSB0_GSUASB_IU1_NLCA1_SIA3_TT1_16_WG16_4_1
    SolutionIndex: 53
    SolutionNameMin: Cijk_Ailk_Bljk_ZB_MT16x16x8_MI16x16x4x1_SN_1LDSB0_GSUASB_IU1_NLCA1_SIA3_TT1_16_WG16_4_1
    SolutionIndex: 54
    SolutionNameMin: Cijk_Ailk_Bljk_ZB_MT64x64x8_MI16x16x4x1_SN_1LDSB1_EPS0_IU1_NEPBS1_PGR2_PLR3_SIA3_SU32_SUS256_SPO0_SSO4_TT2_32_WG32_8_1_WGM10
    SolutionIndex: 55
    SolutionNameMin: Cijk_Ailk_Bljk_ZB_MT64x32x8_MI16x16x4x1_SN_1LDSB1_EPS0_IU1_NEPBS0_PGR2_PLR1_SIA3_SU0_SUS0_SPO0_SSO6_TT1_32_WG64_4_1_WGM1
    SolutionIndex: 56
    SolutionNameMin: Cijk_Ailk_Bljk_ZB_MT64x32x8_MI16x16x4x1_SN_1LDSB1_EPS0_IU1_NEPBS0_PGR2_PLR3_SIA3_SU0_SUS0_SPO0_SSO4_TT1_32_WG64_4_1_WGM1
    SolutionIndex: 57
    SolutionNameMin: Cijk_Ailk_Bljk_ZB_MT64x32x8_MI16x16x4x1_SN_1LDSB1_EPS0_IU1_NEPBS1_PGR2_PLR3_SIA3_SU0_SUS0_SPO0_SSO4_TT1_32_WG64_4_1_WGM1
    SolutionIndex: 58
    SolutionNameMin: Cijk_Ailk_Bljk_ZB_MT64x32x8_MI16x16x4x1_SN_1LDSB1_EPS0_IU1_NEPBS0_PGR2_PLR3_SIA3_SU0_SUS0_SPO0_SSO0_TT1_32_WG64_4_1_WGM5
    SolutionIndex: 59
    SolutionNameMin: Cijk_Ailk_Bljk_ZB_MT64x32x8_MI16x16x4x1_SN_1LDSB1_EPS0_IU1_NEPBS0_PGR2_PLR1_SIA3_SU0_SUS0_SPO0_SSO6_TT1_32_WG64_4_1_WGM4
    SolutionIndex: 60
    SolutionNameMin: Cijk_Ailk_Bljk_ZB_MT64x64x8_MI16x16x4x1_SN_1LDSB1_EPS0_IU1_NEPBS1_PGR2_PLR3_SIA3_SU32_SUS128_SPO0_SSO4_TT1_64_WG64_4_1_WGM1
    SolutionIndex: 61
    SolutionNameMin: Cijk_Ailk_Bljk_ZB_MT64x32x8_MI16x16x4x1_SN_1LDSB1_EPS0_IU1_NEPBS1_PGR2_PLR3_SIA3_SU32_SUS256_SPO0_SSO4_TT1_32_WG64_4_1_WGM10
    SolutionIndex: 62
    SolutionNameMin: Cijk_Ailk_Bljk_ZB_MT64x32x8_MI16x16x4x1_SN_1LDSB1_EPS0_IU1_NEPBS0_PGR2_PLR3_SIA3_SU32_SUS128_SPO0_SSO4_TT2_16_WG32_8_1_WGM5
    SolutionIndex: 63
    SolutionNameMin: Cijk_Ailk_Bljk_ZB_MT64x32x8_MI16x16x4x1_SN_1LDSB1_EPS0_IU1_NEPBS0_PGR2_PLR3_SIA3_SU0_SUS0_SPO0_SSO8_TT1_32_WG64_4_1_WGM1
    SolutionIndex: 64
    SolutionNameMin: Cijk_Ailk_Bljk_ZB_MT64x64x8_MI16x16x4x1_SN_1LDSB1_EPS0_IU1_NEPBS1_PGR2_PLR3_SIA3_SU32_SUS128_SPO0_SSO4_TT1_64_WG64_4_1_WGM10
    SolutionIndex: 65
    SolutionNameMin: Cijk_Ailk_Bljk_ZB_MT64x32x8_MI16x16x4x1_SN_1LDSB1_EPS0_IU1_NEPBS1_PGR2_PLR1_SIA3_SU32_SUS256_SPO0_SSO4_TT1_32_WG64_4_1_WGM10
    SolutionIndex: 66
    SolutionNameMin: Cijk_Ailk_Bljk_ZB_MT64x96x8_MI16x16x4x1_SN_1LDSB1_EPS0_IU1_NEPBS1_PGR2_PLR3_SIA3_SU32_SUS128_SPO0_SSO4_TT2_48_WG32_8_1_WGM1
    SolutionIndex: 67
    SolutionNameMin: Cijk_Ailk_Bljk_ZB_MT64x64x8_MI16x16x4x1_SN_1LDSB1_EPS0_IU1_NEPBS1_PGR2_PLR3_SIA3_SU32_SUS256_SPO0_SSO4_TT1_64_WG64_4_1_WGM8
    SolutionIndex: 68
    SolutionNameMin: Cijk_Ailk_Bljk_ZB_MT64x64x16_MI16x16x4x1_SN_1LDSB1_EPS0_IU1_NEPBS0_PGR2_PLR5_SIA3_SU0_SUS0_SPO1_SSO4_TT1_64_WG64_4_1_WGM10
    SolutionIndex: 69
    SolutionNameMin: Cijk_Ailk_Bljk_ZB_MT64x64x8_MI16x16x4x1_SN_1LDSB1_EPS0_IU1_NEPBS1_PGR2_PLR3_SIA3_SU32_SUS256_SPO0_SSO4_TT1_64_WG64_4_1_WGM10
    SolutionIndex: 70
    SolutionNameMin: Cijk_Ailk_Bljk_ZB_MT64x64x16_MI16x16x4x1_SN_1LDSB1_EPS0_IU1_NEPBS0_PGR2_PLR5_SIA3_SU0_SUS0_SPO1_SSO0_TT2_32_WG32_8_1_WGM5
    SolutionIndex: 71
    SolutionNameMin: Cijk_Ailk_Bljk_ZB_MT64x32x8_MI16x16x4x1_SN_1LDSB1_EPS0_IU1_NEPBS0_PGR2_PLR1_SIA3_SU0_SUS0_SPO0_SSO8_TT1_32_WG64_4_1_WGM1
    SolutionIndex: 72
    SolutionNameMin: Cijk_Ailk_Bljk_ZB_MT64x64x8_MI16x16x4x1_SN_1LDSB1_EPS0_IU1_NEPBS1_PGR2_PLR1_SIA3_SU32_SUS256_SPO0_SSO4_TT1_64_WG64_4_1_WGM8
    SolutionIndex: 73
    SolutionNameMin: Cijk_Ailk_Bljk_ZB_MT64x32x8_MI16x16x4x1_SN_1LDSB1_EPS0_IU1_NEPBS0_PGR2_PLR3_SIA3_SU0_SUS0_SPO0_SSO6_TT1_32_WG64_4_1_WGM1
    SolutionIndex: 74
    SolutionNameMin: Cijk_Ailk_Bljk_ZB_MT64x32x8_MI16x16x4x1_SN_1LDSB1_EPS0_IU1_NEPBS0_PGR2_PLR1_SIA3_SU0_SUS0_SPO0_SSO0_TT2_16_WG32_8_1_WGM1
    SolutionIndex: 75
    SolutionNameMin: Cijk_Ailk_Bljk_ZB_MT64x32x8_MI16x16x4x1_SN_1LDSB1_EPS0_IU1_NEPBS0_PGR2_PLR1_SIA3_SU0_SUS0_SPO0_SSO4_TT1_32_WG64_4_1_WGM1
    SolutionIndex: 76
    SolutionNameMin: Cijk_Ailk_Bljk_ZB_MT64x96x8_MI16x16x4x1_SN_1LDSB1_EPS0_IU1_NEPBS1_PGR2_PLR3_SIA3_SU32_SUS128_SPO0_SSO4_TT2_48_WG32_8_1_WGM5
    SolutionIndex: 77
    SolutionNameMin: Cijk_Ailk_Bljk_ZB_MT64x32x8_MI16x16x4x1_SN_1LDSB1_EPS0_IU1_NEPBS1_PGR2_PLR1_SIA3_SU32_SUS128_SPO0_SSO4_TT1_32_WG64_4_1_WGM1
    SolutionIndex: 78
    SolutionNameMin: Cijk_Ailk_Bljk_ZB_MT64x32x8_MI16x16x4x1_SN_1LDSB1_EPS1_IU1_NEPBS0_PGR1_PLR3_SIA3_SU0_SUS0_SPO1_SSO8_TT1_32_WG64_4_1_WGM1
    SolutionIndex: 79
    SolutionNameMin: Cijk_Ailk_Bljk_ZB_MT64x32x8_MI16x16x4x1_SN_1LDSB1_EPS0_IU1_NEPBS0_PGR2_PLR3_SIA3_SU0_SUS0_SPO0_SSO0_TT2_16_WG32_8_1_WGM1
    SolutionIndex: 80
    SolutionNameMin: Cijk_Ailk_Bljk_ZB_MT64x64x8_MI16x16x4x1_SN_1LDSB1_EPS0_IU1_NEPBS1_PGR2_PLR1_SIA3_SU32_SUS256_SPO0_SSO4_TT1_64_WG64_4_1_WGM10
    SolutionIndex: 81
    SolutionNameMin: Cijk_Ailk_Bljk_ZB_MT64x96x8_MI16x16x4x1_SN_1LDSB1_EPS0_IU1_NEPBS1_PGR2_PLR1_SIA3_SU32_SUS256_SPO0_SSO4_TT2_48_WG32_8_1_WGM8
    SolutionIndex: 82
    SolutionNameMin: Cijk_Ailk_Bljk_ZB_MT64x96x8_MI16x16x4x1_SN_1LDSB1_EPS0_IU1_NEPBS1_PGR2_PLR1_SIA3_SU32_SUS128_SPO0_SSO4_TT2_48_WG32_8_1_WGM5
    SolutionIndex: 83
    SolutionNameMin: Cijk_Ailk_Bljk_ZB_MT64x96x8_MI16x16x4x1_SN_1LDSB1_EPS0_IU1_NEPBS1_PGR2_PLR1_SIA3_SU32_SUS256_SPO0_SSO6_TT2_48_WG32_8_1_WGM8
    SolutionIndex: 84
    SolutionNameMin: Cijk_Ailk_Bljk_ZB_MT64x96x8_MI16x16x4x1_SN_1LDSB1_EPS0_IU1_NEPBS1_PGR2_PLR3_SIA3_SU32_SUS256_SPO0_SSO8_TT2_48_WG32_8_1_WGM8
    SolutionIndex: 85
    SolutionNameMin: Cijk_Ailk_Bljk_ZB_MT64x96x8_MI16x16x4x1_SN_1LDSB1_EPS0_IU1_NEPBS1_PGR2_PLR3_SIA3_SU32_SUS256_SPO1_SSO4_TT2_48_WG32_8_1_WGM8
    SolutionIndex: 86
    SolutionNameMin: Cijk_Ailk_Bljk_ZB_MT64x96x8_MI16x16x4x1_SN_1LDSB1_EPS0_IU1_NEPBS1_PGR2_PLR3_SIA3_SU32_SUS256_SPO0_SSO6_TT2_48_WG32_8_1_WGM8
    SolutionIndex: 87
    SolutionNameMin: Cijk_Ailk_Bljk_ZB_MT64x96x8_MI16x16x4x1_SN_1LDSB1_EPS0_IU1_NEPBS1_PGR2_PLR1_SIA3_SU32_SUS256_SPO1_SSO4_TT2_48_WG32_8_1_WGM8
    SolutionIndex: 88
    SolutionNameMin: Cijk_Ailk_Bljk_ZB_MT64x96x8_MI16x16x4x1_SN_1LDSB1_EPS0_IU1_NEPBS1_PGR2_PLR3_SIA3_SU32_SUS256_SPO1_SSO6_TT2_48_WG32_8_1_WGM8
    SolutionIndex: 89
    SolutionNameMin: Cijk_Ailk_Bljk_ZB_MT64x64x8_MI16x16x4x1_SN_1LDSB1_EPS0_GSUASB_GLS1_LPB1_PGR2_SS1_SU0_SUS0_SSO4
    SolutionIndex: 90
    SolutionNameMin: Cijk_Ailk_Bljk_ZB_MT16x16x16_MI16x16x4x1_SN_1LDSB0_EPS0_GSUAMB_GLS0_LPB1_PGR2_SS0_SU0_SUS0_SSO0
- - - [364, 364, 1, 364, 364, 364, 364, 364]
    - [0, 24.353]
  - - [364, 364, 1024, 364, 364, 364, 364, 364]
    - [4, 75.792]
  - - [364, 364, 128, 364, 364, 364, 364, 364]
    - [3, 74.754]
  - - [364, 364, 16, 364, 364, 364, 364, 364]
    - [1, 61.716]
  - - [364, 364, 256, 364, 364, 364, 364, 364]
    - [4, 75.336]
  - - [364, 364, 32, 364, 364, 364, 364, 364]
    - [2, 68.848]
  - - [364, 364, 512, 364, 364, 364, 364, 364]
    - [4, 75.642]
  - - [364, 364, 64, 364, 364, 364, 364, 364]
    - [3, 73.67]
  - - [64, 1, 1, 256, 64, 64, 64, 256]
    - [5, 0.017]
  - - [64, 64, 1, 256, 64, 64, 64, 256]
    - [5, 1.146]
  - - [1, 1, 1, 256, 1, 1, 1, 256]
    - [6, 0.0]
  - - [1, 64, 1, 256, 1, 1, 1, 256]
    - [5, 0.014]
  - - [32, 32, 1, 64, 3296, 3296, 3296, 3296]
    - [46, 0.097]
  - - [48, 16, 1, 16, 3296, 3296, 3296, 3296]
    - [47, 0.023]
  - - [64, 32, 1, 16, 3296, 3296, 3296, 3296]
    - [48, 0.062]
  - - [80, 48, 1, 16, 3296, 3296, 3296, 3296]
    - [49, 0.124]
  - - [96, 96, 1, 64, 3296, 3296, 3296, 3296]
    - [7, 0.941]
  - - [106, 106, 1, 128, 7146, 7146, 7146, 7146]
    - [35, 1.74]
  - - [128, 128, 1, 128, 13184, 13184, 13184, 13184]
    - [90, 2.7]
  - - [160, 160, 1, 64, 3296, 3296, 3296, 3296]
    - [50, 2.363]
  - - [224, 224, 1, 64, 3296, 3296, 3296, 3296]
    - [51, 4.523]
  - - [234, 234, 1, 128, 7146, 7146, 7146, 7146]
    - [52, 7.566]
  - - [256, 256, 1, 128, 13184, 13184, 13184, 13184]
    - [53, 9.11]
  - - [288, 288, 1, 64, 3296, 3296, 3296, 3296]
    - [14, 7.25]
  - - [352, 352, 1, 64, 3296, 3296, 3296, 3296]
    - [27, 10.359]
  - - [362, 362, 1, 128, 7146, 7146, 7146, 7146]
    - [16, 17.279]
  - - [384, 384, 1, 128, 13184, 13184, 13184, 13184]
    - [28, 18.799]
  - - [416, 416, 1, 64, 3296, 3296, 3296, 3296]
    - [9, 14.061]
  - - [480, 480, 1, 64, 3296, 3296, 3296, 3296]
    - [29, 17.375]
  - - [490, 490, 1, 128, 7146, 7146, 7146, 7146]
    - [10, 26.383]
  - - [512, 512, 1, 128, 13184, 13184, 13184, 13184]
    - [30, 28.267]
  - - [544, 544, 1, 64, 3296, 3296, 3296, 3296]
    - [22, 21.207]
  - - [608, 608, 1, 64, 3296, 3296, 3296, 3296]
    - [17, 24.233]
  - - [618, 618, 1, 128, 7146, 7146, 7146, 7146]
    - [18, 33.895]
  - - [640, 640, 1, 128, 13184, 13184, 13184, 13184]
    - [31, 36.352]
  - - [672, 672, 1, 64, 3296, 3296, 3296, 3296]
    - [11, 25.792]
  - - [736, 736, 1, 64, 3296, 3296, 3296, 3296]
    - [32, 27.532]
  - - [746, 746, 1, 128, 7146, 7146, 7146, 7146]
    - [19, 36.378]
  - - [768, 768, 1, 128, 13184, 13184, 13184, 13184]
    - [23, 38.123]
  - - [800, 800, 1, 64, 3296, 3296, 3296, 3296]
    - [33, 30.138]
  - - [864, 864, 1, 64, 3296, 3296, 3296, 3296]
    - [20, 31.781]
  - - [874, 874, 1, 128, 7146, 7146, 7146, 7146]
    - [15, 39.789]
  - - [896, 896, 1, 128, 13184, 13184, 13184, 13184]
    - [8, 42.102]
  - - [928, 928, 1, 64, 3296, 3296, 3296, 3296]
    - [34, 31.643]
  - - [992, 992, 1, 64, 3296, 3296, 3296, 3296]
    - [24, 32.909]
  - - [1002, 1002, 1, 128, 7146, 7146, 7146, 7146]
    - [19, 41.37]
  - - [1024, 1024, 1, 128, 13184, 13184, 13184, 13184]
    - [21, 43.284]
  - - [1056, 1056, 1, 64, 3296, 3296, 3296, 3296]
    - [17, 34.217]
  - - [1120, 1120, 1, 64, 3296, 3296, 3296, 3296]
    - [13, 36.182]
  - - [1130, 1130, 1, 128, 7146, 7146, 7146, 7146]
    - [25, 45.823]
  - - [1152, 1152, 1, 128, 13184, 13184, 13184, 13184]
    - [36, 47.477]
  - - [1184, 1184, 1, 64, 3296, 3296, 3296, 3296]
    - [26, 37.181]
  - - [1248, 1248, 1, 64, 3296, 3296, 3296, 3296]
    - [12, 38.233]
  - - [1258, 1258, 1, 128, 7146, 7146, 7146, 7146]
    - [89, 46.46]
  - - [1280, 1280, 1, 128, 13184, 13184, 13184, 13184]
    - [54, 48.908]
  - - [1312, 1312, 1, 64, 3296, 3296, 3296, 3296]
    - [55, 39.483]
  - - [1376, 1376, 1, 64, 3296, 3296, 3296, 3296]
    - [56, 39.574]
  - - [1386, 1386, 1, 128, 7146, 7146, 7146, 7146]
    - [57, 48.392]
  - - [1408, 1408, 1, 128, 13184, 13184, 13184, 13184]
    - [37, 52.042]
  - - [1440, 1440, 1, 64, 3296, 3296, 3296, 3296]
    - [58, 39.94]
  - - [1504, 1504, 1, 64, 3296, 3296, 3296, 3296]
    - [59, 40.275]
  - - [1514, 1514, 1, 128, 7146, 7146, 7146, 7146]
    - [60, 49.02]
  - - [1536, 1536, 1, 128, 13184, 13184, 13184, 13184]
    - [61, 51.701]
  - - [1568, 1568, 1, 64, 3296, 3296, 3296, 3296]
    - [62, 41.593]
  - - [1632, 1632, 1, 64, 3296, 3296, 3296, 3296]
    - [63, 43.774]
  - - [1642, 1642, 1, 128, 7146, 7146, 7146, 7146]
    - [64, 50.953]
  - - [1664, 1664, 1, 128, 13184, 13184, 13184, 13184]
    - [65, 52.803]
  - - [1696, 1696, 1, 64, 3296, 3296, 3296, 3296]
    - [55, 44.073]
  - - [1760, 1760, 1, 64, 3296, 3296, 3296, 3296]
    - [55, 45.067]
  - - [1770, 1770, 1, 128, 7146, 7146, 7146, 7146]
    - [66, 53.039]
  - - [1792, 1792, 1, 128, 13184, 13184, 13184, 13184]
    - [37, 56.435]
  - - [1824, 1824, 1, 64, 3296, 3296, 3296, 3296]
    - [56, 45.0]
  - - [1888, 1888, 1, 64, 3296, 3296, 3296, 3296]
    - [63, 45.393]
  - - [1898, 1898, 1, 128, 7146, 7146, 7146, 7146]
    - [64, 54.012]
  - - [1920, 1920, 1, 128, 13184, 13184, 13184, 13184]
    - [37, 56.822]
  - - [1952, 1952, 1, 64, 3296, 3296, 3296, 3296]
    - [55, 46.081]
  - - [2016, 2016, 1, 64, 3296, 3296, 3296, 3296]
    - [63, 45.57]
  - - [2026, 2026, 1, 128, 7146, 7146, 7146, 7146]
    - [67, 55.813]
  - - [2048, 2048, 1, 128, 13184, 13184, 13184, 13184]
    - [68, 57.541]
  - - [2080, 2080, 1, 64, 3296, 3296, 3296, 3296]
    - [56, 46.433]
  - - [2144, 2144, 1, 64, 3296, 3296, 3296, 3296]
    - [56, 47.437]
  - - [2154, 2154, 1, 128, 7146, 7146, 7146, 7146]
    - [69, 57.313]
  - - [2176, 2176, 1, 128, 13184, 13184, 13184, 13184]
    - [70, 59.316]
  - - [2208, 2208, 1, 64, 3296, 3296, 3296, 3296]
    - [63, 47.668]
  - - [2272, 2272, 1, 64, 3296, 3296, 3296, 3296]
    - [56, 47.645]
  - - [2282, 2282, 1, 128, 7146, 7146, 7146, 7146]
    - [69, 58.875]
  - - [2304, 2304, 1, 128, 13184, 13184, 13184, 13184]
    - [37, 62.752]
  - - [2336, 2336, 1, 64, 3296, 3296, 3296, 3296]
    - [71, 47.914]
  - - [2400, 2400, 1, 64, 3296, 3296, 3296, 3296]
    - [55, 48.331]
  - - [2410, 2410, 1, 128, 7146, 7146, 7146, 7146]
    - [69, 58.885]
  - - [2432, 2432, 1, 128, 13184, 13184, 13184, 13184]
    - [37, 63.039]
  - - [2464, 2464, 1, 64, 3296, 3296, 3296, 3296]
    - [55, 48.61]
  - - [2528, 2528, 1, 64, 3296, 3296, 3296, 3296]
    - [55, 48.83]
  - - [2538, 2538, 1, 128, 7146, 7146, 7146, 7146]
    - [72, 60.055]
  - - [2560, 2560, 1, 128, 13184, 13184, 13184, 13184]
    - [38, 63.406]
  - - [2592, 2592, 1, 64, 3296, 3296, 3296, 3296]
    - [63, 48.477]
  - - [2656, 2656, 1, 64, 3296, 3296, 3296, 3296]
    - [73, 48.794]
  - - [2666, 2666, 1, 128, 7146, 7146, 7146, 7146]
    - [69, 60.274]
  - - [2688, 2688, 1, 128, 13184, 13184, 13184, 13184]
    - [38, 63.977]
  - - [2720, 2720, 1, 64, 3296, 3296, 3296, 3296]
    - [74, 49.057]
  - - [2784, 2784, 1, 64, 3296, 3296, 3296, 3296]
    - [75, 49.134]
  - - [2794, 2794, 1, 128, 7146, 7146, 7146, 7146]
    - [76, 61.291]
  - - [2816, 2816, 1, 128, 13184, 13184, 13184, 13184]
    - [37, 63.601]
  - - [2848, 2848, 1, 64, 3296, 3296, 3296, 3296]
    - [77, 48.513]
  - - [2912, 2912, 1, 64, 3296, 3296, 3296, 3296]
    - [57, 48.869]
  - - [2922, 2922, 1, 128, 7146, 7146, 7146, 7146]
    - [69, 61.819]
  - - [2944, 2944, 1, 128, 13184, 13184, 13184, 13184]
    - [39, 65.081]
  - - [2976, 2976, 1, 64, 3296, 3296, 3296, 3296]
    - [55, 49.388]
  - - [3040, 3040, 1, 64, 3296, 3296, 3296, 3296]
    - [78, 48.554]
  - - [3050, 3050, 1, 128, 7146, 7146, 7146, 7146]
    - [69, 62.783]
  - - [3072, 3072, 1, 128, 13184, 13184, 13184, 13184]
    - [39, 66.737]
  - - [3104, 3104, 1, 64, 3296, 3296, 3296, 3296]
    - [55, 48.691]
  - - [3168, 3168, 1, 64, 3296, 3296, 3296, 3296]
    - [79, 49.169]
  - - [3178, 3178, 1, 128, 7146, 7146, 7146, 7146]
    - [69, 63.157]
  - - [3200, 3200, 1, 128, 13184, 13184, 13184, 13184]
    - [37, 64.772]
  - - [3232, 3232, 1, 64, 3296, 3296, 3296, 3296]
    - [56, 49.191]
  - - [3306, 3306, 1, 128, 7146, 7146, 7146, 7146]
    - [80, 62.94]
  - - [3328, 3328, 1, 128, 13184, 13184, 13184, 13184]
    - [37, 65.733]
  - - [3434, 3434, 1, 128, 7146, 7146, 7146, 7146]
    - [81, 63.696]
  - - [3456, 3456, 1, 128, 13184, 13184, 13184, 13184]
    - [39, 66.603]
  - - [3562, 3562, 1, 128, 7146, 7146, 7146, 7146]
    - [69, 63.591]
  - - [3584, 3584, 1, 128, 13184, 13184, 13184, 13184]
    - [68, 65.344]
  - - [3690, 3690, 1, 128, 7146, 7146, 7146, 7146]
    - [80, 64.134]
  - - [3712, 3712, 1, 128, 13184, 13184, 13184, 13184]
    - [37, 66.212]
  - - [3818, 3818, 1, 128, 7146, 7146, 7146, 7146]
    - [81, 64.624]
  - - [3840, 3840, 1, 128, 13184, 13184, 13184, 13184]
    - [39, 67.537]
  - - [3946, 3946, 1, 128, 7146, 7146, 7146, 7146]
    - [69, 64.413]
  - - [3968, 3968, 1, 128, 13184, 13184, 13184, 13184]
    - [70, 66.688]
  - - [4074, 4074, 1, 128, 7146, 7146, 7146, 7146]
    - [80, 65.289]
  - - [4096, 4096, 1, 128, 13184, 13184, 13184, 13184]
    - [41, 67.539]
  - - [4202, 4202, 1, 128, 7146, 7146, 7146, 7146]
    - [82, 65.514]
  - - [4224, 4224, 1, 128, 13184, 13184, 13184, 13184]
    - [41, 69.381]
  - - [4330, 4330, 1, 128, 7146, 7146, 7146, 7146]
    - [69, 65.54]
  - - [4352, 4352, 1, 128, 13184, 13184, 13184, 13184]
    - [41, 67.716]
  - - [4458, 4458, 1, 128, 7146, 7146, 7146, 7146]
    - [83, 65.851]
  - - [4480, 4480, 1, 128, 13184, 13184, 13184, 13184]
    - [42, 67.976]
  - - [4586, 4586, 1, 128, 7146, 7146, 7146, 7146]
    - [84, 66.198]
  - - [4608, 4608, 1, 128, 13184, 13184, 13184, 13184]
    - [41, 68.555]
  - - [4714, 4714, 1, 128, 7146, 7146, 7146, 7146]
    - [80, 65.706]
  - - [4736, 4736, 1, 128, 13184, 13184, 13184, 13184]
    - [41, 68.898]
  - - [4842, 4842, 1, 128, 7146, 7146, 7146, 7146]
    - [81, 66.461]
  - - [4864, 4864, 1, 128, 13184, 13184, 13184, 13184]
    - [41, 68.859]
  - - [4970, 4970, 1, 128, 7146, 7146, 7146, 7146]
    - [85, 66.813]
  - - [4992, 4992, 1, 128, 13184, 13184, 13184, 13184]
    - [41, 69.406]
  - - [5098, 5098, 1, 128, 7146, 7146, 7146, 7146]
    - [69, 66.619]
  - - [5120, 5120, 1, 128, 13184, 13184, 13184, 13184]
    - [43, 68.863]
  - - [5226, 5226, 1, 128, 7146, 7146, 7146, 7146]
    - [86, 67.114]
  - - [5248, 5248, 1, 128, 13184, 13184, 13184, 13184]
    - [40, 70.519]
  - - [5354, 5354, 1, 128, 7146, 7146, 7146, 7146]
    - [83, 67.399]
  - - [5376, 5376, 1, 128, 13184, 13184, 13184, 13184]
    - [43, 69.439]
  - - [5482, 5482, 1, 128, 7146, 7146, 7146, 7146]
    - [85, 66.929]
  - - [5504, 5504, 1, 128, 13184, 13184, 13184, 13184]
    - [44, 69.314]
  - - [5610, 5610, 1, 128, 7146, 7146, 7146, 7146]
    - [85, 67.467]
  - - [5632, 5632, 1, 128, 13184, 13184, 13184, 13184]
    - [41, 69.967]
  - - [5738, 5738, 1, 128, 7146, 7146, 7146, 7146]
    - [85, 67.803]
  - - [5760, 5760, 1, 128, 13184, 13184, 13184, 13184]
    - [41, 70.462]
  - - [5866, 5866, 1, 128, 7146, 7146, 7146, 7146]
    - [83, 67.592]
  - - [5888, 5888, 1, 128, 13184, 13184, 13184, 13184]
    - [41, 70.185]
  - - [5994, 5994, 1, 128, 7146, 7146, 7146, 7146]
    - [85, 67.948]
  - - [6016, 6016, 1, 128, 13184, 13184, 13184, 13184]
    - [41, 70.762]
  - - [6122, 6122, 1, 128, 7146, 7146, 7146, 7146]
    - [85, 68.317]
  - - [6144, 6144, 1, 128, 13184, 13184, 13184, 13184]
    - [41, 70.84]
  - - [6250, 6250, 1, 128, 7146, 7146, 7146, 7146]
    - [87, 67.655]
  - - [6272, 6272, 1, 128, 13184, 13184, 13184, 13184]
    - [45, 71.91]
  - - [6378, 6378, 1, 128, 7146, 7146, 7146, 7146]
    - [87, 68.296]
  - - [6400, 6400, 1, 128, 13184, 13184, 13184, 13184]
    - [41, 71.064]
  - - [6506, 6506, 1, 128, 7146, 7146, 7146, 7146]
    - [85, 68.638]
  - - [6528, 6528, 1, 128, 13184, 13184, 13184, 13184]
    - [44, 71.583]
  - - [6634, 6634, 1, 128, 7146, 7146, 7146, 7146]
    - [85, 68.427]
  - - [6656, 6656, 1, 128, 13184, 13184, 13184, 13184]
    - [44, 70.927]
  - - [6762, 6762, 1, 128, 7146, 7146, 7146, 7146]
    - [88, 68.731]
  - - [6784, 6784, 1, 128, 13184, 13184, 13184, 13184]
    - [44, 71.326]
  - - [6890, 6890, 1, 128, 7146, 7146, 7146, 7146]
    - [85, 69.081]
  - - [6912, 6912, 1, 128, 13184, 13184, 13184, 13184]
    - [41, 71.553]
  - - [7018, 7018, 1, 128, 7146, 7146, 7146, 7146]
    - [87, 68.625]
  - - [7040, 7040, 1, 128, 13184, 13184, 13184, 13184]
    - [44, 71.073]
  - - [7168, 7168, 1, 128, 13184, 13184, 13184, 13184]
    - [44, 71.477]
  - - [7296, 7296, 1, 128, 13184, 13184, 13184, 13184]
    - [41, 71.705]
  - - [7424, 7424, 1, 128, 13184, 13184, 13184, 13184]
    - [44, 71.796]
  - - [7552, 7552, 1, 128, 13184, 13184, 13184, 13184]
    - [41, 71.871]
  - - [7680, 7680, 1, 128, 13184, 13184, 13184, 13184]
    - [44, 72.314]
  - - [7808, 7808, 1, 128, 13184, 13184, 13184, 13184]
    - [44, 71.755]
  - - [7936, 7936, 1, 128, 13184, 13184, 13184, 13184]
    - [41, 72.068]
  - - [8064, 8064, 1, 128, 13184, 13184, 13184, 13184]
    - [44, 72.398]
  - - [8192, 8192, 1, 128, 13184, 13184, 13184, 13184]
    - [44, 72.341]
  - - [8320, 8320, 1, 128, 13184, 13184, 13184, 13184]
    - [41, 72.43]
  - - [8448, 8448, 1, 128, 13184, 13184, 13184, 13184]
    - [45, 73.066]
  - - [8576, 8576, 1, 128, 13184, 13184, 13184, 13184]
    - [41, 72.125]
  - - [8704, 8704, 1, 128, 13184, 13184, 13184, 13184]
    - [44, 72.327]
  - - [8832, 8832, 1, 128, 13184, 13184, 13184, 13184]
    - [41, 72.769]
  - - [8960, 8960, 1, 128, 13184, 13184, 13184, 13184]
    - [41, 72.402]
  - - [9088, 9088, 1, 128, 13184, 13184, 13184, 13184]
    - [44, 72.801]
  - - [9216, 9216, 1, 128, 13184, 13184, 13184, 13184]
    - [44, 72.982]
  - - [9344, 9344, 1, 128, 13184, 13184, 13184, 13184]
    - [44, 72.614]
  - - [9472, 9472, 1, 128, 13184, 13184, 13184, 13184]
    - [44, 72.689]
  - - [9600, 9600, 1, 128, 13184, 13184, 13184, 13184]
    - [44, 72.936]
  - - [9728, 9728, 1, 128, 13184, 13184, 13184, 13184]
    - [44, 72.714]
  - - [9856, 9856, 1, 128, 13184, 13184, 13184, 13184]
    - [44, 72.94]
  - - [9984, 9984, 1, 128, 13184, 13184, 13184, 13184]
    - [44, 73.054]
  - - [10112, 10112, 1, 128, 13184, 13184, 13184, 13184]
    - [41, 72.816]
  - - [10240, 10240, 1, 128, 13184, 13184, 13184, 13184]
    - [41, 73.106]
  - - [10368, 10368, 1, 128, 13184, 13184, 13184, 13184]
    - [41, 73.275]
  - - [10496, 10496, 1, 128, 13184, 13184, 13184, 13184]
    - [45, 73.292]
  - - [10624, 10624, 1, 128, 13184, 13184, 13184, 13184]
    - [41, 73.005]
  - - [10752, 10752, 1, 128, 13184, 13184, 13184, 13184]
    - [41, 73.364]
  - - [10880, 10880, 1, 128, 13184, 13184, 13184, 13184]
    - [41, 73.181]
  - - [11008, 11008, 1, 128, 13184, 13184, 13184, 13184]
    - [44, 73.354]
  - - [11136, 11136, 1, 128, 13184, 13184, 13184, 13184]
    - [41, 73.516]
  - - [11264, 11264, 1, 128, 13184, 13184, 13184, 13184]
    - [44, 73.209]
  - - [11392, 11392, 1, 128, 13184, 13184, 13184, 13184]
    - [44, 73.368]
  - - [11520, 11520, 1, 128, 13184, 13184, 13184, 13184]
    - [41, 73.452]
  - - [11648, 11648, 1, 128, 13184, 13184, 13184, 13184]
    - [45, 73.411]
  - - [11776, 11776, 1, 128, 13184, 13184, 13184, 13184]
    - [45, 73.717]
  - - [11904, 11904, 1, 128, 13184, 13184, 13184, 13184]
    - [45, 73.764]
  - - [12032, 12032, 1, 128, 13184, 13184, 13184, 13184]
    - [41, 73.646]
  - - [12160, 12160, 1, 128, 13184, 13184, 13184, 13184]
    - [41, 73.695]
  - - [12288, 12288, 1, 128, 13184, 13184, 13184, 13184]
    - [41, 73.833]
  - - [12416, 12416, 1, 128, 13184, 13184, 13184, 13184]
    - [44, 73.442]
  - - [12544, 12544, 1, 128, 13184, 13184, 13184, 13184]
    - [44, 73.646]
  - - [12672, 12672, 1, 128, 13184, 13184, 13184, 13184]
    - [41, 73.986]
  - - [12800, 12800, 1, 128, 13184, 13184, 13184, 13184]
    - [44, 73.506]
  - - [12928, 12928, 1, 128, 13184, 13184, 13184, 13184]
    - [44, 73.631]
  - - [13056, 13056, 1, 128, 13184, 13184, 13184, 13184]
    - [44, 74.02]
- null
- null
- DeviceEfficiency
