library/src/blas3/Tensile/Logic/asm_full/aldebaran_Cijk_Alik_Bjlk_4xi8II_BH.yaml
- {MinimumRequiredVersion: 4.6.0}
- aldebaran
- gfx90a
- [Device 0050, Device 0051, Device 0052, Device 0054, Device 0062, Device 7400, Device
    SolutionIndex: 0
    SolutionNameMin: Cijk_Alik_Bjlk_4xi8II_BH_MT16x16x16_SN_AMAS3_BL1_EPS1_GRVW2_GSU1_ISA90a_KLA_LRVW2_MAC_PGR1_SNLL1_TT2_2_USFGRO1_VW2_WG8_8_4_WGM1
    SolutionIndex: 1
    SolutionNameMin: Cijk_Alik_Bjlk_4xi8II_BH_MT8x16x32_SN_AMAS3_BL1_EPS1_GRVW2_GSU8_ISA90a_KLA_LRVW2_MAC_PGR1_SNLL0_TT2_2_USFGRO0_VW2_WG4_8_4_WGM1
    SolutionIndex: 2
    SolutionNameMin: Cijk_Alik_Bjlk_4xi8II_BH_MT64x64x16_SN_AMAS3_BL1_EPS1_GRVW4_GSU1_ISA90a_KLA_LRVW4_MAC_PGR1_SNLL1_TT4_4_USFGRO0_VW4_WG16_16_1_WGM1
    SolutionIndex: 3
    SolutionNameMin: Cijk_Alik_Bjlk_4xi8II_BH_MT64x128x8_SN_AMAS3_BL1_EPS1_GRVW4_GSU1_ISA90a_KLA_LRVW4_MAC_PGR1_SNLL1_TT4_8_USFGRO0_VW4_WG16_16_1_WGM1
    SolutionIndex: 4
    SolutionNameMin: Cijk_Alik_Bjlk_4xi8II_BH_MT32x64x16_SN_AMAS3_BL1_EPS1_GRVW4_GSU4_ISA90a_KLA_LRVW4_MAC_PGR1_SNLL0_TT4_4_USFGRO0_VW4_WG8_16_2_WGM1
    SolutionIndex: 5
    SolutionNameMin: Cijk_Alik_Bjlk_4xi8II_BH_MT64x128x16_SN_AMAS3_BL1_EPS0_GRVW4_GSU1_ISA90a_KLA_LRVW4_MAC_PGR0_SNLL0_TT4_8_USFGRO0_VW4_WG16_16_1_WGM4
    SolutionIndex: 6
    SolutionNameMin: Cijk_Alik_Bjlk_4xi8II_BH_MT16x16x8_SN_AMAS3_BL1_EPS1_GRVW2_GSU8_ISA90a_KLA_LRVW2_MAC_PGR1_SNLL0_TT2_2_USFGRO1_VW2_WG8_8_2_WGM1
    SolutionIndex: 7
    SolutionNameMin: Cijk_Alik_Bjlk_4xi8II_BH_MT64x128x8_SN_AMAS3_BL1_EPS1_GRVW4_GSU1_ISA90a_KLA_LRVW4_MAC_PGR1_SNLL1_TT4_8_USFGRO0_VW4_WG16_16_1_WGM4
    SolutionIndex: 8
    SolutionNameMin: Cijk_Alik_Bjlk_4xi8II_BH_MT64x64x16_SN_AMAS3_BL1_EPS1_GRVW4_GSU1_ISA90a_KLA_LRVW4_MAC_PGR1_SNLL1_TT4_4_USFGRO0_VW4_WG16_16_1_WGM4
    SolutionIndex: 9
    SolutionNameMin: Cijk_Alik_Bjlk_4xi8II_BH_MT32x64x8_SN_AMAS2_BL0_EPS0_GRVW2_GSU1_ISA000_KLS_LRVW2_FMA_PGR1_SNLL0_TT2_4_USFGRO0_VW2_WG16_16_1_WGM1
    SolutionIndex: 10
    SolutionNameMin: Cijk_Alik_Bjlk_4xi8II_BH_MT8x16x32_SN_AMAS3_BL1_EPS1_GRVW2_GSU2_ISA90a_KLA_LRVW2_MAC_PGR1_SNLL0_TT2_2_USFGRO0_VW2_WG4_8_4_WGM1
    SolutionIndex: 11
    SolutionNameMin: Cijk_Alik_Bjlk_4xi8II_BH_MT8x16x16_SN_AMAS3_BL1_EPS1_GRVW2_GSU4_ISA90a_KLA_LRVW2_MAC_PGR1_SNLL0_TT2_2_USFGRO0_VW2_WG4_8_4_WGM1
    SolutionIndex: 12
    SolutionNameMin: Cijk_Alik_Bjlk_4xi8II_BH_MT16x32x16_SN_AMAS3_BL1_EPS1_GRVW4_GSU2_ISA90a_KLA_LRVW4_MAC_PGR1_SNLL0_TT4_4_USFGRO0_VW4_WG4_8_4_WGM1
    SolutionIndex: 13
    SolutionNameMin: Cijk_Alik_Bjlk_4xi8II_BH_MT32x32x16_SN_AMAS3_BL1_EPS1_GRVW4_GSU2_ISA90a_KLA_LRVW4_MAC_PGR1_SNLL0_TT4_4_USFGRO0_VW4_WG8_8_2_WGM4
    SolutionIndex: 14
    SolutionNameMin: Cijk_Alik_Bjlk_4xi8II_BH_MT32x32x16_SN_AMAS3_BL1_EPS1_GRVW4_GSU2_ISA90a_KLA_LRVW4_MAC_PGR1_SNLL0_TT4_4_USFGRO0_VW4_WG8_8_2_WGM1
    SolutionIndex: 15
    SolutionNameMin: Cijk_Alik_Bjlk_4xi8II_BH_MT16x16x8_SN_AMAS3_BL1_EPS1_GRVW2_GSU1_ISA90a_KLA_LRVW2_MAC_PGR1_SNLL1_TT2_2_USFGRO1_VW2_WG8_8_2_WGM1
    SolutionIndex: 16
    SolutionNameMin: Cijk_Alik_Bjlk_4xi8II_BH_MT16x32x16_SN_AMAS3_BL1_EPS1_GRVW2_GSU2_ISA90a_KLA_LRVW2_MAC_PGR1_SNLL0_TT2_4_USFGRO0_VW2_WG8_8_2_WGM4
    SolutionIndex: 17
    SolutionNameMin: Cijk_Alik_Bjlk_4xi8II_BH_MT64x128x16_SN_AMAS3_BL1_EPS1_GRVW4_GSU1_ISA90a_KLA_LRVW4_MAC_PGR1_SNLL1_TT4_8_USFGRO0_VW4_WG16_16_1_WGM4
    SolutionIndex: 18
    SolutionNameMin: Cijk_Alik_Bjlk_4xi8II_BH_MT16x32x32_SN_AMAS3_BL1_EPS1_GRVW4_GSU4_ISA90a_KLA_LRVW4_MAC_PGR1_SNLL0_TT4_4_USFGRO0_VW4_WG4_8_4_WGM4
    SolutionIndex: 19
    SolutionNameMin: Cijk_Alik_Bjlk_4xi8II_BH_MT16x32x32_SN_AMAS3_BL1_EPS1_GRVW4_GSU2_ISA90a_KLA_LRVW4_MAC_PGR1_SNLL0_TT4_4_USFGRO0_VW4_WG4_8_4_WGM4
    SolutionIndex: 20
    SolutionNameMin: Cijk_Alik_Bjlk_4xi8II_BH_MT8x16x32_SN_AMAS3_BL1_EPS1_GRVW2_GSU4_ISA90a_KLA_LRVW2_MAC_PGR1_SNLL0_TT2_2_USFGRO0_VW2_WG4_8_4_WGM1
    SolutionIndex: 21
    SolutionNameMin: Cijk_Alik_Bjlk_4xi8II_BH_MT16x64x16_SN_AMAS3_BL1_EPS1_GRVW2_GSU4_ISA90a_KLA_LRVW2_MAC_PGR1_SNLL0_TT2_4_USFGRO0_VW2_WG8_16_2_WGM1
    SolutionIndex: 22
    SolutionNameMin: Cijk_Alik_Bjlk_4xi8II_BH_MT64x64x16_SN_AMAS3_BL1_EPS0_GRVW4_GSU1_ISA90a_KLA_LRVW4_MAC_PGR0_SNLL0_TT4_4_USFGRO0_VW4_WG16_16_1_WGM1
    SolutionIndex: 23
    SolutionNameMin: Cijk_Alik_Bjlk_4xi8II_BH_MT64x128x16_SN_AMAS3_BL1_EPS0_GRVW4_GSU1_ISA90a_KLA_LRVW4_MAC_PGR0_SNLL0_TT4_8_USFGRO0_VW4_WG16_16_1_WGM1
    SolutionIndex: 24
    SolutionNameMin: Cijk_Alik_Bjlk_4xi8II_BH_MT128x64x16_SN_AMAS3_BL1_EPS0_GRVW4_GSU1_ISA90a_KLA_LRVW4_MAC_PGR0_SNLL0_TT8_4_USFGRO0_VW4_WG16_16_1_WGM4
    SolutionIndex: 25
    SolutionNameMin: Cijk_Alik_Bjlk_4xi8II_BH_MT16x32x16_SN_AMAS3_BL1_EPS1_GRVW4_GSU2_ISA90a_KLA_LRVW4_MAC_PGR1_SNLL0_TT4_4_USFGRO0_VW4_WG4_8_4_WGM4
    SolutionIndex: 26
    SolutionNameMin: Cijk_Alik_Bjlk_4xi8II_BH_MT16x32x16_SN_AMAS3_BL1_EPS1_GRVW4_GSU4_ISA90a_KLA_LRVW4_MAC_PGR1_SNLL0_TT4_4_USFGRO0_VW4_WG4_8_4_WGM1
    SolutionIndex: 27
    SolutionNameMin: Cijk_Alik_Bjlk_4xi8II_BH_MT64x64x16_SN_AMAS3_BL1_EPS0_GRVW4_GSU1_ISA90a_KLA_LRVW4_MAC_PGR0_SNLL0_TT4_4_USFGRO0_VW4_WG16_16_1_WGM4
    SolutionIndex: 28
    SolutionNameMin: Cijk_Alik_Bjlk_4xi8II_BH_MT32x64x16_SN_AMAS3_BL1_EPS1_GRVW4_GSU2_ISA90a_KLA_LRVW4_MAC_PGR1_SNLL0_TT4_4_USFGRO0_VW4_WG8_16_2_WGM4
    SolutionIndex: 29
    SolutionNameMin: Cijk_Alik_Bjlk_4xi8II_BH_MT32x64x16_SN_AMAS3_BL1_EPS1_GRVW4_GSU2_ISA90a_KLA_LRVW4_MAC_PGR1_SNLL0_TT4_4_USFGRO0_VW4_WG8_16_2_WGM1
    SolutionIndex: 30
    SolutionNameMin: Cijk_Alik_Bjlk_4xi8II_BH_MT16x32x8_SN_AMAS2_BL0_EPS0_GRVW2_GSU1_ISA000_KLS_LRVW2_FMA_PGR1_SNLL0_TT2_2_USFGRO0_VW2_WG8_16_1_WGM1
    SolutionIndex: 31
    SolutionNameMin: Cijk_Alik_Bjlk_4xi8II_BH_MT32x32x16_SN_AMAS3_BL1_EPS1_GRVW4_GSU4_ISA90a_KLA_LRVW4_MAC_PGR1_SNLL0_TT4_4_USFGRO0_VW4_WG8_8_2_WGM1
    SolutionIndex: 32
    SolutionNameMin: Cijk_Alik_Bjlk_4xi8II_BH_MT16x16x16_SN_AMAS3_BL1_EPS1_GRVW2_GSU8_ISA90a_KLA_LRVW2_MAC_PGR1_SNLL0_TT2_2_USFGRO1_VW2_WG8_8_4_WGM1
    SolutionIndex: 33
    SolutionNameMin: Cijk_Alik_Bjlk_4xi8II_BH_MT8x32x16_SN_AMAS3_BL1_EPS1_GRVW2_GSU4_ISA90a_KLA_LRVW2_MAC_PGR1_SNLL0_TT2_4_USFGRO0_VW2_WG4_8_4_WGM4
    SolutionIndex: 34
    SolutionNameMin: Cijk_Alik_Bjlk_4xi8II_BH_MT32x32x8_SN_AMAS2_BL0_EPS0_GRVW2_GSU1_ISA000_KLS_LRVW2_FMA_PGR1_SNLL0_TT2_2_USFGRO0_VW2_WG16_16_1_WGM1
    SolutionIndex: 35
    SolutionNameMin: Cijk_Alik_Bjlk_4xi8II_BH_MT16x16x16_SN_AMAS3_BL1_EPS1_GRVW2_GSU16_ISA90a_KLA_LRVW2_MAC_PGR1_SNLL0_TT2_2_USFGRO1_VW2_WG8_8_4_WGM1
    SolutionIndex: 36
    SolutionNameMin: Cijk_Alik_Bjlk_4xi8II_BH_MT8x32x16_SN_AMAS3_BL1_EPS1_GRVW2_GSU4_ISA90a_KLA_LRVW2_MAC_PGR1_SNLL0_TT2_4_USFGRO0_VW2_WG4_8_4_WGM1
    SolutionIndex: 37
    SolutionNameMin: Cijk_Alik_Bjlk_4xi8II_BH_MT32x16x32_SN_AMAS3_BL1_EPS1_GRVW2_GSU2_ISA90a_KLA_LRVW2_MAC_PGR1_SNLL0_TT2_2_USFGRO1_VW2_WG16_8_4_WGM1
    SolutionIndex: 38
    SolutionNameMin: Cijk_Alik_Bjlk_4xi8II_BH_MT128x128x16_SN_AMAS3_BL1_EPS1_GRVW4_GSU1_ISA90a_KLA_LRVW4_MAC_PGR1_SNLL1_TT8_8_USFGRO0_VW4_WG16_16_1_WGM4
    SolutionIndex: 39
    SolutionNameMin: Cijk_Alik_Bjlk_4xi8II_BH_MT128x64x16_SN_AMAS3_BL1_EPS0_GRVW4_GSU1_ISA90a_KLA_LRVW4_MAC_PGR0_SNLL0_TT8_4_USFGRO0_VW4_WG16_16_1_WGM1
    SolutionIndex: 40
    SolutionNameMin: Cijk_Alik_Bjlk_4xi8II_BH_MT8x16x16_SN_AMAS3_BL1_EPS1_GRVW2_GSU8_ISA90a_KLA_LRVW2_MAC_PGR1_SNLL0_TT2_2_USFGRO0_VW2_WG4_8_4_WGM1
    SolutionIndex: 41
    SolutionNameMin: Cijk_Alik_Bjlk_4xi8II_BH_MT64x64x32_SN_AMAS3_BL1_EPS1_GRVW4_GSU2_ISA90a_KLA_LRVW4_MAC_PGR1_SNLL0_TT4_8_USFGRO0_VW4_WG16_8_4_WGM1
    SolutionIndex: 42
    SolutionNameMin: Cijk_Alik_Bjlk_4xi8II_BH_MT64x64x32_SN_AMAS3_BL1_EPS1_GRVW4_GSU1_ISA90a_KLA_LRVW4_MAC_PGR1_SNLL1_TT4_4_USFGRO0_VW4_WG16_16_1_WGM4
    SolutionIndex: 43
    SolutionNameMin: Cijk_Alik_Bjlk_4xi8II_BH_MT16x64x16_SN_AMAS3_BL1_EPS1_GRVW2_GSU4_ISA90a_KLA_LRVW2_MAC_PGR1_SNLL0_TT2_4_USFGRO0_VW2_WG8_16_2_WGM4
    SolutionIndex: 44
    SolutionNameMin: Cijk_Alik_Bjlk_4xi8II_BH_MT8x32x16_SN_AMAS3_BL1_EPS1_GRVW2_GSU2_ISA90a_KLA_LRVW2_MAC_PGR1_SNLL0_TT2_4_USFGRO0_VW2_WG4_8_4_WGM4
    SolutionIndex: 45
    SolutionNameMin: Cijk_Alik_Bjlk_4xi8II_BH_MT16x32x16_SN_AMAS3_BL1_EPS1_GRVW4_GSU4_ISA90a_KLA_LRVW4_MAC_PGR1_SNLL0_TT4_4_USFGRO0_VW4_WG4_8_4_WGM4
    SolutionIndex: 46
    SolutionNameMin: Cijk_Alik_Bjlk_4xi8II_BH_MT32x16x32_SN_AMAS3_BL1_EPS1_GRVW2_GSU4_ISA90a_KLA_LRVW2_MAC_PGR1_SNLL0_TT2_2_USFGRO1_VW2_WG16_8_4_WGM1
    SolutionIndex: 47
    SolutionNameMin: Cijk_Alik_Bjlk_4xi8II_BH_MT16x16x16_SN_AMAS3_BL1_EPS1_GRVW2_GSU4_ISA90a_KLA_LRVW2_MAC_PGR1_SNLL0_TT2_2_USFGRO0_VW2_WG8_8_2_WGM1
    SolutionIndex: 48
    SolutionNameMin: Cijk_Alik_Bjlk_4xi8II_BH_MT8x8x8_SN_AMAS3_BL1_EPS1_GRVW2_GSU16_ISA90a_KLA_LRVW2_MAC_PGR1_SNLL0_TT2_2_USFGRO1_VW2_WG4_4_4_WGM1
    SolutionIndex: 49
    SolutionNameMin: Cijk_Alik_Bjlk_4xi8II_BH_MT8x16x16_SN_AMAS3_BL1_EPS1_GRVW2_GSU4_ISA90a_KLA_LRVW2_MAC_PGR1_SNLL0_TT2_2_USFGRO0_VW2_WG4_8_4_WGM4
    SolutionIndex: 50
    SolutionNameMin: Cijk_Alik_Bjlk_4xi8II_BH_MT16x64x16_SN_AMAS3_BL1_EPS1_GRVW2_GSU2_ISA90a_KLA_LRVW2_MAC_PGR1_SNLL0_TT2_4_USFGRO0_VW2_WG8_16_2_WGM1
    SolutionIndex: 51
    SolutionNameMin: Cijk_Alik_Bjlk_4xi8II_BH_MT16x64x16_SN_AMAS3_BL1_EPS1_GRVW4_GSU2_ISA90a_KLA_LRVW4_MAC_PGR1_SNLL0_TT4_8_USFGRO0_VW4_WG4_8_4_WGM4
    SolutionIndex: 52
    SolutionNameMin: Cijk_Alik_Bjlk_4xi8II_BH_MT64x64x32_SN_AMAS3_BL1_EPS1_GRVW4_GSU2_ISA90a_KLA_LRVW4_MAC_PGR1_SNLL0_TT4_8_USFGRO0_VW4_WG16_8_4_WGM4
    SolutionIndex: 53
    SolutionNameMin: Cijk_Alik_Bjlk_4xi8II_BH_MT64x64x32_SN_AMAS3_BL1_EPS1_GRVW4_GSU1_ISA90a_KLA_LRVW4_MAC_PGR1_SNLL1_TT4_4_USFGRO0_VW4_WG16_16_1_WGM1
    SolutionIndex: 54
    SolutionNameMin: Cijk_Alik_Bjlk_4xi8II_BH_MT64x128x16_SN_AMAS3_BL1_EPS1_GRVW4_GSU1_ISA90a_KLA_LRVW4_MAC_PGR1_SNLL1_TT4_8_USFGRO0_VW4_WG16_16_1_WGM1
    SolutionIndex: 55
    SolutionNameMin: Cijk_Alik_Bjlk_4xi8II_BH_MT8x8x8_SN_AMAS3_BL1_EPS1_GRVW2_GSU1_ISA90a_KLA_LRVW2_MAC_PGR1_SNLL1_TT2_2_USFGRO1_VW2_WG4_4_4_WGM1
    SolutionIndex: 56
    SolutionNameMin: Cijk_Alik_Bjlk_4xi8II_BH_MT16x32x16_SN_AMAS3_BL1_EPS1_GRVW2_GSU8_ISA90a_KLA_LRVW2_MAC_PGR1_SNLL0_TT2_2_USFGRO0_VW2_WG8_16_2_WGM1
    SolutionIndex: 57
    SolutionNameMin: Cijk_Alik_Bjlk_4xi8II_BH_MT8x32x16_SN_AMAS3_BL1_EPS1_GRVW2_GSU2_ISA90a_KLA_LRVW2_MAC_PGR1_SNLL0_TT2_4_USFGRO0_VW2_WG4_8_4_WGM1
    SolutionIndex: 58
    SolutionNameMin: Cijk_Alik_Bjlk_4xi8II_BH_MT16x16x16_SN_AMAS3_BL1_EPS1_GRVW2_GSU4_ISA90a_KLA_LRVW2_MAC_PGR1_SNLL0_TT2_2_USFGRO1_VW2_WG8_8_4_WGM1
    SolutionIndex: 59
    SolutionNameMin: Cijk_Alik_Bjlk_4xi8II_BH_MT32x32x8_SN_AMAS2_BL0_EPS0_GRVW2_GSU1_ISA000_KLS_LRVW2_FMA_PGR1_SNLL0_TT2_2_USFGRO0_VW2_WG16_16_1_WGM4
    SolutionIndex: 60
    SolutionNameMin: Cijk_Alik_Bjlk_4xi8II_BH_MT8x8x8_SN_AMAS3_BL1_EPS1_GRVW2_GSU8_ISA90a_KLA_LRVW2_MAC_PGR1_SNLL0_TT2_2_USFGRO1_VW2_WG4_4_4_WGM1
- - - [1024, 128, 1, 128]
    - [0, 6.0]
  - - [4, 704, 1, 1280]
    - [1, 1.266]
  - - [4, 1856, 1, 3328]
    - [1, 5.42]
  - - [1856, 448, 1, 3328]
    - [2, 51.221]
  - - [2944, 4288, 1, 1280]
    - [3, 70.408]
  - - [2368, 64, 1, 3328]
    - [4, 35.384]
  - - [2368, 5888, 1, 256]
    - [5, 62.667]
  - - [128, 64, 1, 256]
    - [6, 0.656]
  - - [5888, 1024, 1, 1280]
    - [7, 71.197]
  - - [128, 6784, 1, 3328]
    - [8, 55.575]
  - - [64, 4, 1, 256]
    - [1, 0.026]
  - - [5888, 1856, 1, 3328]
    - [7, 71.617]
  - - [5056, 704, 1, 256]
    - [8, 56.705]
  - - [5888, 2944, 1, 3328]
    - [7, 75.591]
  - - [1856, 4288, 1, 256]
    - [7, 60.133]
  - - [1024, 5056, 1, 128]
    - [7, 53.197]
  - - [5056, 5056, 1, 3328]
    - [7, 76.72]
  - - [1408, 5888, 1, 1280]
    - [3, 68.991]
  - - [2368, 448, 1, 128]
    - [9, 16.779]
  - - [1024, 3584, 1, 3328]
    - [7, 59.749]
  - - [4, 2944, 1, 1280]
    - [10, 2.992]
  - - [1408, 64, 1, 128]
    - [0, 3.89]
  - - [256, 4288, 1, 3328]
    - [8, 51.475]
  - - [5888, 1408, 1, 1280]
    - [7, 69.048]
  - - [704, 1856, 1, 3328]
    - [8, 58.024]
  - - [4, 1408, 1, 128]
    - [11, 0.275]
  - - [1024, 2368, 1, 256]
    - [7, 51.257]
  - - [1408, 1856, 1, 1280]
    - [3, 66.272]
  - - [1408, 64, 1, 1280]
    - [12, 19.059]
  - - [448, 1024, 1, 1280]
    - [13, 34.462]
  - - [256, 1408, 1, 3328]
    - [14, 40.0]
  - - [5056, 5056, 1, 1280]
    - [7, 75.247]
  - - [448, 5056, 1, 256]
    - [7, 45.006]
  - - [704, 1856, 1, 1280]
    - [2, 57.017]
  - - [128, 5056, 1, 128]
    - [9, 15.564]
  - - [2368, 128, 1, 256]
    - [15, 14.134]
  - - [1856, 1408, 1, 128]
    - [3, 45.981]
  - - [64, 5056, 1, 256]
    - [16, 13.376]
  - - [6784, 256, 1, 3328]
    - [17, 63.985]
  - - [6784, 4288, 1, 3328]
    - [3, 76.905]
  - - [4288, 448, 1, 256]
    - [8, 44.68]
  - - [64, 704, 1, 128]
    - [0, 1.693]
  - - [1856, 2368, 1, 3328]
    - [2, 63.611]
  - - [4288, 2944, 1, 1280]
    - [7, 72.699]
  - - [704, 5056, 1, 1280]
    - [3, 65.478]
  - - [2368, 704, 1, 3328]
    - [2, 59.716]
  - - [256, 5888, 1, 256]
    - [7, 44.036]
  - - [1856, 4288, 1, 3328]
    - [7, 74.868]
  - - [256, 2944, 1, 256]
    - [2, 31.746]
  - - [5888, 1024, 1, 256]
    - [7, 61.875]
  - - [448, 64, 1, 1280]
    - [18, 9.368]
  - - [448, 5056, 1, 3328]
    - [7, 61.189]
  - - [3584, 4, 1, 1280]
    - [6, 3.337]
  - - [2944, 64, 1, 256]
    - [15, 11.864]
  - - [128, 4, 1, 1280]
    - [1, 0.257]
  - - [1408, 2944, 1, 256]
    - [3, 58.587]
  - - [256, 1856, 1, 1280]
    - [14, 36.569]
  - - [6784, 5056, 1, 3328]
    - [7, 76.997]
  - - [5056, 5056, 1, 256]
    - [5, 67.399]
  - - [1408, 6784, 1, 128]
    - [7, 62.254]
  - - [64, 1024, 1, 1280]
    - [19, 14.959]
  - - [2944, 4, 1, 256]
    - [0, 0.892]
  - - [704, 5056, 1, 128]
    - [7, 49.185]
  - - [4, 2368, 1, 1280]
    - [20, 3.332]
  - - [2368, 2944, 1, 1280]
    - [7, 72.66]
  - - [128, 3584, 1, 1280]
    - [14, 34.616]
  - - [6784, 6784, 1, 1280]
    - [7, 77.358]
  - - [1024, 256, 1, 3328]
    - [14, 42.319]
  - - [1408, 4288, 1, 1280]
    - [3, 70.96]
  - - [3584, 4288, 1, 1280]
    - [3, 72.067]
  - - [2368, 704, 1, 1280]
    - [2, 55.959]
  - - [5056, 4288, 1, 3328]
    - [7, 75.725]
  - - [3584, 2368, 1, 3328]
    - [7, 70.979]
  - - [64, 704, 1, 1280]
    - [21, 10.389]
  - - [4288, 256, 1, 256]
    - [2, 38.174]
  - - [2944, 128, 1, 128]
    - [22, 10.043]
  - - [6784, 448, 1, 1280]
    - [8, 61.625]
  - - [1408, 2944, 1, 128]
    - [7, 51.539]
  - - [4288, 2944, 1, 256]
    - [23, 59.892]
  - - [5888, 704, 1, 1280]
    - [24, 61.968]
  - - [1856, 64, 1, 1280]
    - [25, 20.783]
  - - [448, 5888, 1, 128]
    - [7, 42.891]
  - - [5888, 64, 1, 3328]
    - [14, 41.504]
  - - [2944, 256, 1, 3328]
    - [2, 51.047]
  - - [1024, 64, 1, 128]
    - [15, 3.016]
  - - [5056, 2368, 1, 1280]
    - [7, 72.852]
  - - [448, 3584, 1, 1280]
    - [17, 57.382]
  - - [6784, 5888, 1, 256]
    - [3, 73.603]
  - - [64, 1024, 1, 3328]
    - [26, 23.447]
  - - [704, 128, 1, 1280]
    - [21, 16.882]
  - - [5888, 2944, 1, 128]
    - [27, 54.567]
  - - [4, 3584, 1, 128]
    - [10, 0.548]
  - - [1408, 448, 1, 1280]
    - [2, 41.22]
  - - [1024, 1408, 1, 256]
    - [17, 38.593]
  - - [2368, 2368, 1, 3328]
    - [3, 65.496]
  - - [1856, 6784, 1, 128]
    - [3, 53.442]
  - - [5056, 704, 1, 3328]
    - [2, 65.494]
  - - [1408, 1856, 1, 256]
    - [7, 53.381]
  - - [1408, 704, 1, 3328]
    - [28, 51.443]
  - - [2368, 5056, 1, 256]
    - [7, 66.352]
  - - [5888, 1856, 1, 256]
    - [7, 63.299]
  - - [4288, 64, 1, 3328]
    - [14, 43.302]
  - - [2368, 4, 1, 1280]
    - [6, 2.533]
  - - [704, 5888, 1, 256]
    - [3, 58.994]
  - - [4288, 64, 1, 256]
    - [15, 13.442]
  - - [6784, 64, 1, 256]
    - [8, 22.363]
  - - [2944, 256, 1, 256]
    - [2, 31.946]
  - - [2944, 6784, 1, 3328]
    - [3, 74.849]
  - - [704, 1408, 1, 3328]
    - [29, 50.988]
  - - [3584, 704, 1, 3328]
    - [2, 59.461]
  - - [2944, 256, 1, 128]
    - [30, 15.435]
  - - [6784, 4, 1, 1280]
    - [31, 4.061]
  - - [1024, 64, 1, 1280]
    - [19, 14.016]
  - - [448, 4288, 1, 256]
    - [8, 43.008]
  - - [64, 3584, 1, 3328]
    - [31, 37.127]
  - - [704, 2368, 1, 1280]
    - [17, 58.396]
  - - [448, 2944, 1, 128]
    - [27, 32.74]
  - - [1856, 2368, 1, 1280]
    - [2, 63.767]
  - - [2368, 128, 1, 3328]
    - [29, 42.368]
  - - [2944, 128, 1, 256]
    - [15, 16.829]
  - - [448, 1408, 1, 256]
    - [8, 24.63]
  - - [1856, 4288, 1, 1280]
    - [7, 73.414]
  - - [64, 5056, 1, 3328]
    - [29, 42.042]
  - - [4, 704, 1, 256]
    - [11, 0.287]
  - - [1024, 448, 1, 128]
    - [8, 13.151]
  - - [704, 4, 1, 1280]
    - [32, 0.842]
  - - [704, 256, 1, 128]
    - [30, 5.663]
  - - [704, 2944, 1, 128]
    - [2, 35.416]
  - - [1408, 1024, 1, 1280]
    - [17, 52.288]
  - - [704, 6784, 1, 256]
    - [3, 59.94]
  - - [6784, 704, 1, 256]
    - [2, 58.161]
  - - [5056, 1408, 1, 128]
    - [3, 58.736]
  - - [256, 3584, 1, 3328]
    - [31, 49.044]
  - - [4, 5888, 1, 3328]
    - [33, 8.965]
  - - [128, 1408, 1, 128]
    - [34, 5.522]
  - - [3584, 4288, 1, 3328]
    - [3, 74.204]
  - - [5888, 1856, 1, 1280]
    - [7, 68.914]
  - - [5056, 1024, 1, 3328]
    - [3, 70.554]
  - - [5056, 64, 1, 1280]
    - [29, 34.04]
  - - [1024, 704, 1, 256]
    - [8, 32.101]
  - - [1024, 4288, 1, 128]
    - [2, 49.61]
  - - [4288, 64, 1, 1280]
    - [14, 32.007]
  - - [2368, 3584, 1, 1280]
    - [7, 71.884]
  - - [2368, 6784, 1, 1280]
    - [7, 76.462]
  - - [1024, 256, 1, 256]
    - [15, 13.778]
  - - [1856, 4, 1, 1280]
    - [35, 1.918]
  - - [448, 448, 1, 256]
    - [15, 11.111]
  - - [2944, 3584, 1, 3328]
    - [7, 75.123]
  - - [128, 4288, 1, 128]
    - [8, 14.797]
  - - [64, 448, 1, 256]
    - [0, 2.264]
  - - [128, 1024, 1, 3328]
    - [31, 32.561]
  - - [4, 1408, 1, 3328]
    - [20, 4.371]
  - - [6784, 2944, 1, 256]
    - [7, 66.816]
  - - [64, 1856, 1, 1280]
    - [12, 18.283]
  - - [64, 1024, 1, 128]
    - [0, 2.846]
  - - [4288, 2368, 1, 3328]
    - [7, 72.336]
  - - [1856, 2368, 1, 256]
    - [8, 57.488]
  - - [3584, 256, 1, 128]
    - [2, 23.198]
  - - [3584, 6784, 1, 3328]
    - [7, 78.438]
  - - [256, 1024, 1, 256]
    - [0, 12.24]
  - - [4, 6784, 1, 3328]
    - [36, 9.132]
  - - [1024, 5888, 1, 3328]
    - [7, 71.629]
  - - [1024, 128, 1, 1280]
    - [25, 22.771]
  - - [4288, 128, 1, 1280]
    - [28, 40.648]
  - - [5056, 4288, 1, 1280]
    - [3, 73.832]
  - - [5888, 64, 1, 256]
    - [2, 14.778]
  - - [1408, 5056, 1, 1280]
    - [7, 71.71]
  - - [1856, 256, 1, 1280]
    - [14, 36.247]
  - - [64, 5888, 1, 3328]
    - [13, 42.728]
  - - [2944, 5888, 1, 128]
    - [3, 60.268]
  - - [704, 5888, 1, 1280]
    - [7, 65.697]
  - - [2368, 3584, 1, 128]
    - [3, 58.601]
  - - [6784, 5888, 1, 3328]
    - [3, 77.48]
  - - [704, 1024, 1, 1280]
    - [2, 46.793]
  - - [448, 256, 1, 3328]
    - [31, 30.632]
  - - [448, 1856, 1, 128]
    - [2, 20.96]
  - - [128, 1024, 1, 128]
    - [37, 4.328]
  - - [2944, 4, 1, 128]
    - [15, 0.475]
  - - [1024, 704, 1, 1280]
    - [2, 46.15]
  - - [128, 5888, 1, 256]
    - [23, 22.027]
  - - [1024, 5056, 1, 1280]
    - [3, 69.778]
  - - [4288, 1024, 1, 256]
    - [3, 62.366]
  - - [2944, 2368, 1, 128]
    - [3, 56.592]
  - - [704, 704, 1, 3328]
    - [4, 46.239]
  - - [704, 1408, 1, 1280]
    - [8, 45.428]
  - - [5888, 448, 1, 1280]
    - [2, 61.649]
  - - [3584, 256, 1, 3328]
    - [4, 49.614]
  - - [704, 5888, 1, 3328]
    - [3, 67.283]
  - - [704, 1856, 1, 128]
    - [2, 32.021]
  - - [128, 3584, 1, 3328]
    - [31, 44.012]
  - - [4, 4288, 1, 128]
    - [0, 0.903]
  - - [128, 704, 1, 1280]
    - [19, 19.845]
  - - [3584, 2944, 1, 256]
    - [7, 67.174]
  - - [1856, 128, 1, 3328]
    - [14, 37.861]
  - - [4, 64, 1, 1280]
    - [32, 0.111]
  - - [4, 5056, 1, 3328]
    - [36, 8.088]
  - - [128, 2944, 1, 1280]
    - [14, 36.042]
  - - [2368, 1024, 1, 3328]
    - [3, 63.557]
  - - [128, 256, 1, 3328]
    - [33, 16.055]
  - - [1408, 5056, 1, 3328]
    - [7, 74.181]
  - - [1856, 1856, 1, 3328]
    - [7, 70.145]
  - - [3584, 128, 1, 256]
    - [8, 19.109]
  - - [448, 1408, 1, 3328]
    - [29, 46.914]
  - - [2368, 2368, 1, 256]
    - [3, 56.636]
  - - [4288, 4288, 1, 1280]
    - [3, 75.404]
  - - [64, 448, 1, 1280]
    - [11, 8.896]
  - - [1408, 4288, 1, 256]
    - [3, 59.657]
  - - [448, 4, 1, 256]
    - [32, 0.15]
  - - [5888, 448, 1, 128]
    - [8, 40.402]
  - - [448, 4, 1, 1280]
    - [6, 0.644]
  - - [704, 6784, 1, 3328]
    - [3, 67.705]
  - - [5888, 5888, 1, 1280]
    - [7, 77.405]
  - - [5056, 1024, 1, 1280]
    - [7, 67.546]
  - - [448, 5888, 1, 3328]
    - [3, 65.238]
  - - [128, 4, 1, 128]
    - [0, 0.022]
  - - [1024, 2944, 1, 1280]
    - [7, 61.241]
  - - [5056, 5888, 1, 1280]
    - [7, 76.413]
  - - [4288, 5888, 1, 128]
    - [23, 65.565]
  - - [256, 3584, 1, 256]
    - [2, 29.548]
  - - [1408, 3584, 1, 128]
    - [7, 54.523]
  - - [256, 2944, 1, 3328]
    - [2, 51.012]
  - - [448, 3584, 1, 128]
    - [2, 32.015]
  - - [5888, 2944, 1, 1280]
    - [3, 73.446]
  - - [4, 6784, 1, 1280]
    - [33, 6.475]
  - - [2368, 5888, 1, 128]
    - [3, 57.509]
  - - [64, 2944, 1, 128]
    - [15, 6.878]
  - - [3584, 5888, 1, 256]
    - [7, 67.612]
  - - [2368, 704, 1, 128]
    - [2, 36.643]
  - - [3584, 2944, 1, 1280]
    - [7, 74.583]
  - - [3584, 2368, 1, 128]
    - [22, 57.82]
  - - [5056, 704, 1, 128]
    - [2, 48.954]
  - - [448, 2368, 1, 128]
    - [2, 29.146]
  - - [5056, 1408, 1, 3328]
    - [7, 74.794]
  - - [1408, 704, 1, 256]
    - [8, 35.96]
  - - [6784, 1024, 1, 3328]
    - [38, 70.613]
  - - [6784, 2944, 1, 3328]
    - [7, 75.687]
  - - [2944, 5056, 1, 3328]
    - [3, 75.904]
  - - [1856, 1856, 1, 256]
    - [8, 54.783]
  - - [1024, 5888, 1, 128]
    - [7, 57.953]
  - - [6784, 2368, 1, 1280]
    - [7, 72.984]
  - - [256, 4, 1, 128]
    - [6, 0.045]
  - - [4288, 5888, 1, 1280]
    - [7, 75.438]
  - - [4288, 4288, 1, 256]
    - [3, 68.993]
  - - [448, 2944, 1, 3328]
    - [2, 58.769]
  - - [4288, 1856, 1, 1280]
    - [39, 68.525]
  - - [1856, 2944, 1, 3328]
    - [7, 67.376]
  - - [256, 6784, 1, 3328]
    - [17, 65.534]
  - - [64, 5888, 1, 256]
    - [2, 17.427]
  - - [256, 5056, 1, 128]
    - [8, 29.368]
  - - [5056, 1024, 1, 256]
    - [7, 63.324]
  - - [704, 64, 1, 3328]
    - [18, 22.426]
  - - [5056, 1856, 1, 3328]
    - [3, 72.688]
  - - [4, 2944, 1, 3328]
    - [40, 6.88]
  - - [4, 5056, 1, 256]
    - [10, 1.472]
  - - [1856, 1408, 1, 256]
    - [7, 55.9]
  - - [3584, 4, 1, 128]
    - [0, 0.624]
  - - [448, 448, 1, 3328]
    - [41, 39.651]
  - - [6784, 128, 1, 3328]
    - [2, 57.366]
  - - [4288, 1408, 1, 128]
    - [7, 55.141]
  - - [4288, 5056, 1, 256]
    - [3, 69.747]
  - - [1408, 128, 1, 1280]
    - [13, 27.055]
  - - [5056, 256, 1, 3328]
    - [8, 60.738]
  - - [704, 704, 1, 256]
    - [42, 21.574]
  - - [1024, 5888, 1, 1280]
    - [3, 69.283]
  - - [6784, 2368, 1, 128]
    - [24, 58.126]
  - - [4, 5056, 1, 1280]
    - [10, 5.05]
  - - [64, 128, 1, 256]
    - [0, 0.608]
  - - [128, 1856, 1, 1280]
    - [14, 27.854]
  - - [5056, 3584, 1, 256]
    - [7, 64.781]
  - - [1856, 1024, 1, 1280]
    - [2, 52.805]
  - - [6784, 4288, 1, 1280]
    - [7, 76.372]
  - - [1856, 1856, 1, 1280]
    - [7, 67.434]
  - - [6784, 2944, 1, 128]
    - [3, 64.619]
  - - [128, 4288, 1, 3328]
    - [29, 47.5]
  - - [4, 2368, 1, 3328]
    - [40, 6.149]
  - - [5888, 1856, 1, 128]
    - [39, 55.411]
  - - [448, 704, 1, 1280]
    - [14, 33.811]
  - - [2368, 1024, 1, 128]
    - [3, 39.158]
  - - [1024, 448, 1, 3328]
    - [13, 43.039]
  - - [1856, 704, 1, 1280]
    - [2, 57.065]
  - - [5056, 3584, 1, 128]
    - [3, 64.337]
  - - [5888, 5888, 1, 3328]
    - [3, 77.447]
  - - [6784, 1024, 1, 256]
    - [5, 56.935]
  - - [2944, 2368, 1, 256]
    - [3, 57.4]
  - - [256, 448, 1, 256]
    - [0, 6.58]
  - - [5056, 5888, 1, 3328]
    - [7, 76.861]
  - - [1856, 1024, 1, 256]
    - [2, 44.109]
  - - [448, 1408, 1, 1280]
    - [29, 40.33]
  - - [3584, 448, 1, 1280]
    - [8, 54.759]
  - - [1024, 1024, 1, 1280]
    - [8, 47.065]
  - - [448, 5888, 1, 256]
    - [3, 57.089]
  - - [704, 64, 1, 128]
    - [0, 2.025]
  - - [1408, 6784, 1, 3328]
    - [7, 74.763]
  - - [448, 1024, 1, 128]
    - [8, 11.924]
  - - [4288, 704, 1, 128]
    - [2, 41.104]
  - - [128, 1856, 1, 128]
    - [15, 8.905]
  - - [448, 2368, 1, 3328]
    - [2, 50.509]
  - - [5056, 64, 1, 128]
    - [34, 9.126]
  - - [5056, 2944, 1, 256]
    - [3, 63.771]
  - - [6784, 5888, 1, 128]
    - [3, 69.038]
  - - [704, 1024, 1, 256]
    - [2, 28.335]
  - - [1024, 4, 1, 256]
    - [33, 0.259]
  - - [2368, 1856, 1, 256]
    - [2, 57.426]
  - - [128, 6784, 1, 1280]
    - [2, 52.42]
  - - [1408, 3584, 1, 3328]
    - [7, 68.946]
  - - [2368, 6784, 1, 256]
    - [7, 64.534]
  - - [5056, 1408, 1, 1280]
    - [3, 70.481]
  - - [256, 256, 1, 128]
    - [10, 2.787]
  - - [5056, 4288, 1, 128]
    - [3, 61.004]
  - - [1408, 1856, 1, 128]
    - [2, 45.281]
  - - [1408, 5888, 1, 3328]
    - [3, 70.451]
  - - [1856, 256, 1, 256]
    - [2, 23.205]
  - - [6784, 6784, 1, 256]
    - [3, 74.223]
  - - [64, 256, 1, 128]
    - [20, 0.75]
  - - [4288, 2368, 1, 128]
    - [3, 51.914]
  - - [1856, 4288, 1, 128]
    - [3, 58.513]
  - - [256, 4288, 1, 1280]
    - [2, 49.63]
  - - [2368, 2944, 1, 256]
    - [7, 64.01]
  - - [4, 1856, 1, 256]
    - [11, 0.694]
  - - [3584, 1856, 1, 1280]
    - [3, 67.447]
  - - [6784, 6784, 1, 128]
    - [24, 67.205]
  - - [256, 1856, 1, 128]
    - [2, 12.463]
  - - [704, 64, 1, 1280]
    - [43, 12.446]
  - - [5888, 5056, 1, 256]
    - [7, 67.014]
  - - [3584, 448, 1, 256]
    - [2, 43.516]
  - - [448, 4288, 1, 128]
    - [8, 37.477]
  - - [2944, 4288, 1, 3328]
    - [7, 73.277]
  - - [256, 6784, 1, 256]
    - [17, 46.79]
  - - [1408, 4288, 1, 128]
    - [7, 53.791]
  - - [2944, 704, 1, 3328]
    - [8, 57.691]
  - - [128, 448, 1, 256]
    - [44, 4.477]
  - - [3584, 3584, 1, 256]
    - [5, 63.112]
  - - [448, 1408, 1, 128]
    - [8, 21.626]
  - - [128, 256, 1, 1280]
    - [32, 9.011]
  - - [3584, 5056, 1, 256]
    - [3, 64.834]
  - - [6784, 128, 1, 256]
    - [2, 38.62]
  - - [4288, 4, 1, 256]
    - [0, 1.381]
  - - [64, 1408, 1, 3328]
    - [45, 27.793]
  - - [704, 448, 1, 256]
    - [15, 14.542]
  - - [2944, 2368, 1, 1280]
    - [7, 70.215]
  - - [448, 64, 1, 3328]
    - [18, 16.921]
  - - [1408, 3584, 1, 256]
    - [3, 62.358]
  - - [3584, 4, 1, 3328]
    - [40, 4.706]
  - - [6784, 3584, 1, 256]
    - [7, 71.771]
  - - [256, 128, 1, 128]
    - [0, 1.605]
  - - [704, 1408, 1, 128]
    - [2, 24.616]
  - - [4, 2368, 1, 256]
    - [0, 0.807]
  - - [2944, 448, 1, 128]
    - [22, 27.408]
  - - [128, 1408, 1, 256]
    - [15, 10.372]
  - - [4, 2944, 1, 256]
    - [20, 0.944]
  - - [64, 128, 1, 3328]
    - [20, 6.172]
  - - [5056, 2368, 1, 128]
    - [3, 58.532]
  - - [2944, 2944, 1, 3328]
    - [3, 72.123]
  - - [5056, 6784, 1, 256]
    - [7, 70.758]
  - - [1856, 3584, 1, 128]
    - [3, 56.707]
  - - [128, 2944, 1, 128]
    - [15, 11.848]
  - - [1024, 704, 1, 3328]
    - [2, 48.766]
  - - [6784, 448, 1, 256]
    - [8, 53.101]
  - - [3584, 6784, 1, 128]
    - [3, 66.698]
  - - [128, 4288, 1, 256]
    - [8, 21.55]
  - - [704, 448, 1, 3328]
    - [29, 42.84]
  - - [1024, 1024, 1, 3328]
    - [2, 50.799]
  - - [128, 128, 1, 3328]
    - [40, 11.018]
  - - [5056, 1856, 1, 256]
    - [3, 63.87]
  - - [256, 128, 1, 256]
    - [46, 2.905]
  - - [1024, 1856, 1, 256]
    - [8, 44.001]
  - - [4288, 64, 1, 128]
    - [30, 9.14]
  - - [256, 448, 1, 3328]
    - [31, 29.903]
  - - [1408, 6784, 1, 1280]
    - [7, 73.556]
  - - [3584, 3584, 1, 1280]
    - [3, 73.684]
  - - [64, 2368, 1, 1280]
    - [13, 23.753]
  - - [448, 2368, 1, 1280]
    - [2, 47.995]
  - - [5888, 5888, 1, 128]
    - [3, 68.556]
  - - [64, 6784, 1, 3328]
    - [29, 45.998]
  - - [2944, 256, 1, 1280]
    - [2, 48.207]
  - - [5056, 5888, 1, 128]
    - [7, 67.453]
  - - [256, 2368, 1, 128]
    - [2, 20.633]
  - - [5056, 2368, 1, 3328]
    - [7, 73.662]
  - - [2944, 4288, 1, 256]
    - [3, 58.906]
  - - [1408, 3584, 1, 1280]
    - [7, 66.357]
  - - [2368, 64, 1, 256]
    - [16, 9.058]
  - - [64, 448, 1, 3328]
    - [18, 14.488]
  - - [256, 256, 1, 3328]
    - [26, 22.662]
  - - [5888, 4, 1, 128]
    - [47, 0.87]
  - - [1856, 704, 1, 256]
    - [8, 39.345]
  - - [4, 4288, 1, 1280]
    - [33, 3.979]
  - - [1408, 448, 1, 3328]
    - [29, 46.996]
  - - [1024, 4, 1, 3328]
    - [48, 2.878]
  - - [2368, 256, 1, 256]
    - [2, 27.773]
  - - [2368, 6784, 1, 3328]
    - [3, 76.833]
  - - [1856, 1408, 1, 1280]
    - [3, 66.749]
  - - [1856, 448, 1, 1280]
    - [2, 51.64]
  - - [6784, 704, 1, 128]
    - [2, 51.971]
  - - [4, 4, 1, 256]
    - [1, 0.002]
  - - [128, 5888, 1, 128]
    - [9, 14.155]
  - - [1408, 5888, 1, 256]
    - [24, 58.574]
  - - [704, 2944, 1, 1280]
    - [8, 57.479]
  - - [1856, 2368, 1, 128]
    - [2, 51.088]
  - - [256, 64, 1, 256]
    - [20, 1.568]
  - - [1024, 1024, 1, 256]
    - [8, 34.004]
  - - [704, 1856, 1, 256]
    - [8, 40.361]
  - - [64, 6784, 1, 256]
    - [2, 22.677]
  - - [3584, 704, 1, 1280]
    - [2, 59.381]
  - - [256, 128, 1, 1280]
    - [36, 9.25]
  - - [2368, 4, 1, 256]
    - [0, 0.733]
  - - [256, 2368, 1, 1280]
    - [8, 39.808]
  - - [2944, 6784, 1, 128]
    - [3, 65.427]
  - - [3584, 448, 1, 3328]
    - [8, 56.326]
  - - [1408, 4, 1, 256]
    - [46, 0.531]
  - - [704, 2368, 1, 3328]
    - [17, 59.993]
  - - [2944, 448, 1, 256]
    - [22, 40.737]
  - - [1856, 448, 1, 128]
    - [2, 24.645]
  - - [2368, 128, 1, 1280]
    - [29, 32.001]
  - - [256, 5888, 1, 128]
    - [2, 30.534]
  - - [2368, 256, 1, 128]
    - [8, 17.013]
  - - [64, 5056, 1, 1280]
    - [29, 32.47]
  - - [4, 6784, 1, 128]
    - [0, 1.119]
  - - [2944, 2944, 1, 1280]
    - [7, 71.007]
  - - [5888, 2368, 1, 256]
    - [3, 66.422]
  - - [4, 3584, 1, 1280]
    - [49, 4.623]
  - - [1408, 128, 1, 128]
    - [15, 7.379]
  - - [6784, 704, 1, 3328]
    - [7, 65.875]
  - - [128, 64, 1, 1280]
    - [1, 2.81]
  - - [2368, 256, 1, 1280]
    - [2, 39.64]
  - - [4, 448, 1, 3328]
    - [35, 1.562]
  - - [5888, 4288, 1, 128]
    - [5, 58.618]
  - - [4, 5888, 1, 256]
    - [25, 1.727]
  - - [1408, 2944, 1, 3328]
    - [7, 68.808]
  - - [3584, 704, 1, 128]
    - [8, 43.934]
  - - [64, 1024, 1, 256]
    - [0, 5.563]
  - - [5056, 5056, 1, 128]
    - [7, 60.946]
  - - [2368, 448, 1, 1280]
    - [2, 48.065]
  - - [128, 3584, 1, 256]
    - [50, 16.982]
  - - [704, 448, 1, 1280]
    - [29, 32.254]
  - - [448, 5056, 1, 128]
    - [8, 37.89]
  - - [256, 4, 1, 1280]
    - [1, 0.456]
  - - [128, 5056, 1, 256]
    - [8, 28.175]
  - - [1408, 5056, 1, 128]
    - [3, 56.352]
  - - [2944, 3584, 1, 128]
    - [3, 60.568]
  - - [3584, 2368, 1, 256]
    - [3, 59.748]
  - - [5888, 5056, 1, 1280]
    - [7, 74.033]
  - - [2368, 5056, 1, 128]
    - [8, 48.964]
  - - [64, 704, 1, 256]
    - [0, 3.486]
  - - [4288, 256, 1, 1280]
    - [8, 49.168]
  - - [3584, 3584, 1, 3328]
    - [7, 74.169]
  - - [1024, 256, 1, 128]
    - [15, 7.535]
  - - [4, 704, 1, 128]
    - [0, 0.101]
  - - [5888, 6784, 1, 256]
    - [3, 73.965]
  - - [4288, 2944, 1, 3328]
    - [3, 72.023]
  - - [2944, 64, 1, 128]
    - [30, 7.029]
  - - [1856, 64, 1, 256]
    - [0, 6.546]
  - - [4288, 128, 1, 3328]
    - [29, 47.324]
  - - [4288, 704, 1, 1280]
    - [2, 59.775]
  - - [256, 5056, 1, 1280]
    - [2, 56.105]
  - - [1408, 256, 1, 128]
    - [51, 7.339]
  - - [2944, 5888, 1, 3328]
    - [7, 74.776]
  - - [6784, 5888, 1, 1280]
    - [7, 77.14]
  - - [704, 128, 1, 256]
    - [0, 6.652]
  - - [5888, 4288, 1, 1280]
    - [3, 74.556]
  - - [448, 256, 1, 1280]
    - [21, 19.352]
  - - [5888, 3584, 1, 128]
    - [7, 65.12]
  - - [1856, 1856, 1, 128]
    - [2, 47.472]
  - - [5056, 4, 1, 1280]
    - [11, 3.952]
  - - [256, 1408, 1, 1280]
    - [13, 31.946]
  - - [3584, 1024, 1, 3328]
    - [3, 61.082]
  - - [704, 3584, 1, 128]
    - [7, 40.272]
  - - [5888, 448, 1, 3328]
    - [8, 64.098]
  - - [2368, 4288, 1, 1280]
    - [5, 67.308]
  - - [4288, 2944, 1, 128]
    - [3, 61.351]
  - - [1024, 6784, 1, 3328]
    - [7, 73.805]
  - - [128, 2368, 1, 256]
    - [15, 13.799]
  - - [6784, 64, 1, 3328]
    - [52, 46.892]
  - - [5056, 2944, 1, 3328]
    - [3, 75.645]
  - - [448, 128, 1, 256]
    - [12, 3.89]
  - - [2944, 3584, 1, 256]
    - [7, 67.179]
  - - [1408, 1408, 1, 3328]
    - [8, 56.551]
  - - [1856, 128, 1, 1280]
    - [14, 30.739]
  - - [3584, 3584, 1, 128]
    - [3, 61.279]
  - - [64, 3584, 1, 256]
    - [16, 11.284]
  - - [1408, 4, 1, 3328]
    - [35, 3.346]
  - - [128, 2944, 1, 3328]
    - [14, 42.773]
  - - [3584, 704, 1, 256]
    - [2, 51.821]
  - - [2944, 448, 1, 3328]
    - [8, 61.697]
  - - [3584, 1408, 1, 3328]
    - [7, 69.204]
  - - [704, 3584, 1, 1280]
    - [7, 63.916]
  - - [2944, 6784, 1, 1280]
    - [3, 75.293]
  - - [1856, 6784, 1, 256]
    - [3, 61.195]
  - - [4288, 448, 1, 3328]
    - [8, 56.22]
  - - [6784, 4288, 1, 128]
    - [3, 61.177]
  - - [6784, 704, 1, 1280]
    - [7, 64.745]
  - - [256, 4288, 1, 256]
    - [2, 35.118]
  - - [3584, 64, 1, 128]
    - [15, 8.788]
  - - [5888, 1024, 1, 3328]
    - [7, 72.871]
  - - [448, 64, 1, 128]
    - [20, 1.134]
  - - [704, 6784, 1, 1280]
    - [7, 66.212]
  - - [5888, 128, 1, 256]
    - [53, 32.386]
  - - [2368, 448, 1, 3328]
    - [8, 51.356]
  - - [1856, 5056, 1, 3328]
    - [7, 73.368]
  - - [4, 6784, 1, 256]
    - [36, 2.129]
  - - [1024, 3584, 1, 128]
    - [2, 48.034]
  - - [1024, 1408, 1, 128]
    - [54, 27.871]
  - - [2368, 2944, 1, 128]
    - [3, 58.425]
  - - [5056, 64, 1, 256]
    - [15, 13.975]
  - - [4, 448, 1, 1280]
    - [32, 0.632]
  - - [5056, 2944, 1, 128]
    - [24, 60.391]
  - - [5888, 5056, 1, 3328]
    - [3, 75.802]
  - - [1024, 704, 1, 128]
    - [42, 20.225]
  - - [1408, 2368, 1, 128]
    - [7, 45.839]
  - - [5888, 2368, 1, 128]
    - [5, 58.712]
  - - [128, 5056, 1, 3328]
    - [29, 47.771]
  - - [3584, 6784, 1, 1280]
    - [7, 77.718]
  - - [1856, 5888, 1, 256]
    - [7, 63.637]
  - - [256, 256, 1, 256]
    - [10, 5.046]
  - - [256, 64, 1, 128]
    - [55, 0.592]
  - - [4288, 4288, 1, 3328]
    - [7, 76.096]
  - - [4288, 1408, 1, 1280]
    - [7, 71.537]
  - - [3584, 5056, 1, 128]
    - [3, 54.141]
  - - [4, 1024, 1, 3328]
    - [1, 3.344]
  - - [4288, 2368, 1, 256]
    - [23, 56.711]
  - - [2944, 5056, 1, 1280]
    - [5, 70.048]
  - - [448, 6784, 1, 256]
    - [2, 54.776]
  - - [704, 1024, 1, 128]
    - [2, 19.544]
  - - [6784, 2368, 1, 3328]
    - [7, 73.843]
  - - [256, 1024, 1, 1280]
    - [14, 29.819]
  - - [704, 4, 1, 128]
    - [0, 0.129]
  - - [256, 4, 1, 256]
    - [20, 0.087]
  - - [4288, 128, 1, 256]
    - [8, 24.279]
  - - [4288, 1856, 1, 3328]
    - [39, 68.721]
  - - [3584, 448, 1, 128]
    - [3, 25.161]
  - - [256, 4, 1, 3328]
    - [1, 0.841]
  - - [4, 1408, 1, 1280]
    - [10, 1.886]
  - - [3584, 64, 1, 1280]
    - [14, 28.529]
  - - [1408, 448, 1, 128]
    - [2, 19.247]
  - - [3584, 1024, 1, 1280]
    - [3, 58.02]
  - - [1856, 5056, 1, 256]
    - [5, 59.192]
  - - [4, 3584, 1, 256]
    - [10, 1.229]
  - - [1024, 4288, 1, 256]
    - [7, 59.71]
  - - [5888, 3584, 1, 3328]
    - [3, 76.261]
  - - [4, 256, 1, 256]
    - [0, 0.065]
  - - [5056, 3584, 1, 3328]
    - [7, 75.332]
  - - [128, 5888, 1, 1280]
    - [2, 48.599]
  - - [704, 448, 1, 128]
    - [15, 9.991]
  - - [2368, 1408, 1, 1280]
    - [3, 63.022]
  - - [5056, 2944, 1, 1280]
    - [7, 73.87]
  - - [4, 4, 1, 128]
    - [40, 0.001]
  - - [3584, 256, 1, 256]
    - [2, 28.869]
  - - [128, 1856, 1, 3328]
    - [31, 38.454]
  - - [1024, 6784, 1, 256]
    - [3, 62.632]
  - - [4, 128, 1, 256]
    - [0, 0.038]
  - - [64, 64, 1, 1280]
    - [35, 1.267]
  - - [6784, 4, 1, 128]
    - [55, 1.092]
  - - [2944, 1408, 1, 128]
    - [3, 50.718]
  - - [448, 128, 1, 3328]
    - [45, 22.821]
  - - [64, 2944, 1, 3328]
    - [31, 38.584]
  - - [64, 4288, 1, 3328]
    - [13, 42.442]
  - - [5056, 6784, 1, 3328]
    - [3, 76.919]
  - - [128, 2944, 1, 256]
    - [2, 16.568]
  - - [128, 6784, 1, 128]
    - [9, 17.466]
  - - [3584, 4288, 1, 256]
    - [7, 62.722]
  - - [448, 1856, 1, 256]
    - [2, 32.685]
  - - [1856, 6784, 1, 3328]
    - [7, 77.472]
  - - [3584, 128, 1, 3328]
    - [4, 44.428]
  - - [64, 1856, 1, 256]
    - [16, 7.137]
  - - [1024, 448, 1, 1280]
    - [14, 35.829]
  - - [5888, 4288, 1, 256]
    - [7, 66.851]
  - - [4, 448, 1, 128]
    - [56, 0.081]
  - - [5056, 1408, 1, 256]
    - [7, 63.911]
  - - [64, 256, 1, 1280]
    - [1, 5.179]
  - - [3584, 1024, 1, 256]
    - [2, 54.308]
  - - [256, 704, 1, 256]
    - [15, 11.492]
  - - [5888, 5888, 1, 256]
    - [3, 72.316]
  - - [4288, 1024, 1, 1280]
    - [7, 69.915]
  - - [5888, 128, 1, 3328]
    - [8, 51.003]
  - - [448, 6784, 1, 3328]
    - [2, 62.171]
  - - [2944, 1408, 1, 1280]
    - [7, 66.388]
  - - [2944, 1856, 1, 3328]
    - [3, 65.646]
  - - [2368, 64, 1, 128]
    - [10, 4.496]
  - - [2944, 2944, 1, 128]
    - [5, 59.406]
  - - [4, 128, 1, 3328]
    - [1, 0.471]
  - - [3584, 5888, 1, 1280]
    - [3, 74.948]
  - - [64, 4, 1, 128]
    - [44, 0.012]
  - - [6784, 1856, 1, 1280]
    - [7, 71.801]
  - - [2944, 5056, 1, 256]
    - [3, 68.48]
  - - [5888, 256, 1, 3328]
    - [17, 55.654]
  - - [1856, 5888, 1, 3328]
    - [7, 71.354]
  - - [3584, 1408, 1, 256]
    - [3, 62.499]
  - - [704, 3584, 1, 3328]
    - [7, 66.071]
  - - [5056, 448, 1, 1280]
    - [3, 58.107]
  - - [3584, 1856, 1, 3328]
    - [7, 70.855]
  - - [64, 1408, 1, 128]
    - [0, 3.08]
  - - [1408, 704, 1, 1280]
    - [2, 45.038]
  - - [2944, 1024, 1, 256]
    - [8, 52.747]
  - - [1024, 2368, 1, 128]
    - [2, 40.8]
  - - [2368, 4288, 1, 3328]
    - [3, 70.79]
  - - [4, 1408, 1, 256]
    - [11, 0.488]
  - - [1024, 1408, 1, 1280]
    - [17, 52.174]
  - - [64, 64, 1, 256]
    - [11, 0.398]
  - - [704, 256, 1, 3328]
    - [31, 37.297]
  - - [6784, 5056, 1, 256]
    - [3, 72.186]
  - - [4, 4288, 1, 3328]
    - [36, 7.813]
  - - [448, 6784, 1, 128]
    - [2, 46.342]
  - - [4, 704, 1, 3328]
    - [1, 2.584]
  - - [448, 2944, 1, 256]
    - [8, 44.254]
  - - [2944, 6784, 1, 256]
    - [3, 70.316]
  - - [2368, 2368, 1, 1280]
    - [3, 64.158]
  - - [4, 4, 1, 1280]
    - [1, 0.007]
  - - [1856, 3584, 1, 1280]
    - [7, 68.697]
  - - [64, 2944, 1, 256]
    - [50, 10.258]
  - - [3584, 1408, 1, 1280]
    - [7, 66.262]
  - - [448, 256, 1, 128]
    - [16, 4.012]
  - - [4288, 448, 1, 128]
    - [2, 33.621]
  - - [5056, 256, 1, 1280]
    - [2, 56.364]
  - - [1856, 1408, 1, 3328]
    - [3, 68.316]
  - - [128, 128, 1, 128]
    - [0, 0.823]
  - - [1024, 4288, 1, 3328]
    - [7, 71.862]
  - - [448, 2368, 1, 256]
    - [8, 37.443]
  - - [1024, 4, 1, 128]
    - [46, 0.189]
  - - [5056, 448, 1, 256]
    - [8, 46.312]
  - - [2944, 2368, 1, 3328]
    - [3, 72.967]
  - - [704, 128, 1, 3328]
    - [31, 27.968]
  - - [64, 64, 1, 3328]
    - [1, 3.988]
  - - [1024, 1856, 1, 1280]
    - [8, 53.291]
  - - [6784, 1856, 1, 256]
    - [24, 61.874]
  - - [128, 2368, 1, 3328]
    - [29, 41.309]
  - - [1024, 5888, 1, 256]
    - [3, 62.234]
  - - [5056, 128, 1, 1280]
    - [8, 42.109]
  - - [5056, 64, 1, 3328]
    - [29, 44.057]
  - - [128, 704, 1, 128]
    - [30, 3.601]
  - - [1408, 2368, 1, 256]
    - [3, 56.23]
  - - [1408, 1408, 1, 256]
    - [8, 46.17]
  - - [4, 64, 1, 128]
    - [6, 0.012]
  - - [64, 128, 1, 1280]
    - [32, 2.863]
  - - [2368, 2368, 1, 128]
    - [2, 49.652]
  - - [64, 5888, 1, 128]
    - [15, 11.001]
  - - [5888, 4, 1, 3328]
    - [40, 5.52]
  - - [6784, 1408, 1, 128]
    - [5, 60.977]
  - - [4288, 5888, 1, 256]
    - [23, 69.685]
  - - [1408, 5056, 1, 256]
    - [3, 63.024]
  - - [5056, 128, 1, 3328]
    - [29, 48.146]
  - - [128, 128, 1, 1280]
    - [20, 5.793]
  - - [448, 704, 1, 256]
    - [2, 13.449]
  - - [4288, 3584, 1, 128]
    - [3, 62.596]
  - - [2944, 128, 1, 3328]
    - [8, 36.487]
  - - [128, 5056, 1, 1280]
    - [8, 41.993]
  - - [3584, 5056, 1, 1280]
    - [7, 72.872]
  - - [256, 448, 1, 1280]
    - [12, 21.254]
  - - [704, 704, 1, 128]
    - [8, 15.43]
  - - [5056, 4, 1, 128]
    - [0, 0.851]
  - - [704, 256, 1, 1280]
    - [13, 23.895]
  - - [64, 2368, 1, 3328]
    - [4, 34.602]
  - - [1856, 1024, 1, 128]
    - [8, 38.177]
  - - [1856, 64, 1, 128]
    - [0, 4.895]
  - - [64, 6784, 1, 1280]
    - [8, 38.726]
  - - [704, 4288, 1, 256]
    - [2, 54.444]
  - - [5888, 2368, 1, 1280]
    - [3, 73.393]
  - - [128, 256, 1, 256]
    - [49, 2.687]
  - - [256, 64, 1, 1280]
    - [49, 4.427]
  - - [2368, 5888, 1, 1280]
    - [3, 74.885]
  - - [5888, 256, 1, 1280]
    - [17, 54.282]
  - - [4, 5888, 1, 1280]
    - [33, 6.617]
  - - [704, 128, 1, 128]
    - [0, 4.004]
  - - [1024, 4, 1, 1280]
    - [20, 1.289]
  - - [2368, 1856, 1, 3328]
    - [2, 63.853]
  - - [2368, 128, 1, 128]
    - [15, 11.08]
  - - [2944, 704, 1, 256]
    - [8, 45.491]
  - - [5056, 128, 1, 128]
    - [2, 17.23]
  - - [256, 704, 1, 3328]
    - [31, 36.609]
  - - [704, 3584, 1, 256]
    - [3, 52.264]
  - - [1024, 1024, 1, 1024]
    - [8, 45.977]
  - - [704, 2944, 1, 3328]
    - [8, 58.323]
  - - [6784, 1024, 1, 128]
    - [3, 58.973]
  - - [256, 448, 1, 128]
    - [0, 5.188]
  - - [448, 1024, 1, 3328]
    - [4, 44.069]
  - - [2944, 1024, 1, 3328]
    - [2, 62.608]
  - - [2944, 5056, 1, 128]
    - [3, 52.493]
  - - [1408, 6784, 1, 256]
    - [3, 66.59]
  - - [6784, 1408, 1, 3328]
    - [7, 73.882]
  - - [4288, 6784, 1, 128]
    - [3, 67.544]
  - - [704, 64, 1, 256]
    - [57, 3.795]
  - - [5888, 4, 1, 1280]
    - [58, 3.739]
  - - [256, 2368, 1, 3328]
    - [4, 46.846]
  - - [6784, 2944, 1, 1280]
    - [7, 73.161]
  - - [4288, 1856, 1, 128]
    - [39, 57.581]
  - - [1856, 2944, 1, 128]
    - [7, 51.676]
  - - [6784, 448, 1, 128]
    - [2, 47.051]
  - - [64, 3584, 1, 128]
    - [30, 8.298]
  - - [448, 5056, 1, 1280]
    - [7, 59.165]
  - - [2368, 1856, 1, 128]
    - [8, 49.833]
  - - [128, 448, 1, 1280]
    - [19, 13.805]
  - - [4288, 704, 1, 256]
    - [8, 54.493]
  - - [256, 3584, 1, 128]
    - [8, 25.859]
  - - [5888, 704, 1, 256]
    - [24, 56.358]
  - - [3584, 1024, 1, 128]
    - [8, 47.89]
  - - [256, 5888, 1, 3328]
    - [7, 55.059]
  - - [1408, 4288, 1, 3328]
    - [7, 71.584]
  - - [6784, 4288, 1, 256]
    - [5, 70.843]
  - - [4288, 256, 1, 128]
    - [8, 24.503]
  - - [5888, 256, 1, 256]
    - [17, 41.783]
  - - [6784, 1024, 1, 1280]
    - [3, 69.357]
  - - [5888, 1024, 1, 128]
    - [3, 57.515]
  - - [1024, 128, 1, 256]
    - [0, 8.646]
  - - [128, 64, 1, 3328]
    - [20, 6.384]
  - - [448, 64, 1, 256]
    - [0, 2.703]
  - - [2944, 704, 1, 1280]
    - [8, 57.255]
  - - [6784, 3584, 1, 1280]
    - [7, 76.174]
  - - [1024, 6784, 1, 1280]
    - [7, 69.621]
  - - [2944, 64, 1, 1280]
    - [28, 27.807]
  - - [1408, 2944, 1, 1280]
    - [3, 63.771]
  - - [256, 1856, 1, 256]
    - [42, 21.31]
  - - [1408, 2368, 1, 3328]
    - [7, 68.5]
  - - [2944, 4, 1, 3328]
    - [40, 4.61]
  - - [128, 1408, 1, 3328]
    - [31, 37.544]
  - - [2944, 1856, 1, 128]
    - [2, 52.569]
  - - [256, 2944, 1, 128]
    - [2, 25.297]
  - - [256, 6784, 1, 128]
    - [2, 33.913]
  - - [2368, 4, 1, 128]
    - [58, 0.462]
  - - [1408, 256, 1, 3328]
    - [14, 43.079]
  - - [1856, 4, 1, 128]
    - [0, 0.374]
  - - [5056, 6784, 1, 128]
    - [3, 64.7]
  - - [4288, 5056, 1, 128]
    - [7, 64.03]
  - - [1856, 5888, 1, 128]
    - [3, 59.756]
  - - [2944, 5888, 1, 256]
    - [7, 69.631]
  - - [3584, 1856, 1, 256]
    - [3, 60.166]
  - - [4288, 3584, 1, 1280]
    - [3, 73.877]
  - - [2368, 448, 1, 256]
    - [8, 35.434]
  - - [4288, 256, 1, 3328]
    - [2, 52.201]
  - - [1856, 704, 1, 128]
    - [42, 28.628]
  - - [1408, 64, 1, 256]
    - [50, 6.056]
  - - [64, 1856, 1, 128]
    - [0, 3.942]
  - - [4, 256, 1, 128]
    - [0, 0.044]
  - - [704, 4288, 1, 3328]
    - [2, 63.55]
  - - [704, 5888, 1, 128]
    - [7, 51.57]
  - - [6784, 3584, 1, 128]
    - [7, 67.048]
  - - [1024, 64, 1, 256]
    - [0, 5.037]
  - - [64, 2368, 1, 256]
    - [10, 8.064]
  - - [4288, 5056, 1, 3328]
    - [7, 75.862]
  - - [4, 1856, 1, 1280]
    - [40, 2.046]
  - - [4288, 128, 1, 128]
    - [2, 16.695]
  - - [1408, 1408, 1, 128]
    - [2, 38.5]
  - - [1024, 128, 1, 3328]
    - [31, 32.945]
  - - [1856, 128, 1, 128]
    - [59, 7.248]
  - - [5056, 2368, 1, 256]
    - [5, 57.006]
  - - [4288, 704, 1, 3328]
    - [2, 61.338]
  - - [448, 3584, 1, 256]
    - [3, 43.16]
  - - [64, 128, 1, 128]
    - [0, 0.416]
  - - [2368, 64, 1, 1280]
    - [14, 24.594]
  - - [2368, 1024, 1, 1280]
    - [7, 62.827]
  - - [2944, 1408, 1, 3328]
    - [3, 67.767]
  - - [1408, 448, 1, 256]
    - [50, 19.166]
  - - [1024, 1408, 1, 3328]
    - [17, 53.592]
  - - [2944, 5888, 1, 1280]
    - [3, 74.228]
  - - [1408, 4, 1, 1280]
    - [48, 2.115]
  - - [5888, 3584, 1, 256]
    - [7, 67.61]
  - - [128, 1024, 1, 1280]
    - [12, 21.615]
  - - [1408, 1856, 1, 3328]
    - [3, 68.718]
  - - [4, 4, 1, 3328]
    - [35, 0.015]
  - - [6784, 1408, 1, 1280]
    - [7, 73.549]
  - - [4, 1024, 1, 1280]
    - [1, 1.67]
  - - [704, 2944, 1, 256]
    - [7, 47.282]
  - - [704, 4288, 1, 128]
    - [2, 46.718]
  - - [2368, 4288, 1, 128]
    - [3, 58.902]
  - - [64, 4288, 1, 1280]
    - [14, 32.18]
  - - [6784, 64, 1, 1280]
    - [8, 38.592]
  - - [3584, 128, 1, 128]
    - [8, 14.153]
  - - [1024, 6784, 1, 128]
    - [7, 58.748]
  - - [4, 1856, 1, 128]
    - [0, 0.274]
  - - [1408, 64, 1, 3328]
    - [4, 26.972]
  - - [6784, 4, 1, 256]
    - [0, 1.773]
  - - [1408, 1408, 1, 1280]
    - [8, 55.538]
  - - [256, 2368, 1, 256]
    - [8, 24.354]
  - - [448, 4288, 1, 3328]
    - [8, 54.536]
  - - [2368, 1408, 1, 256]
    - [7, 58.674]
  - - [5888, 5056, 1, 128]
    - [3, 61.081]
  - - [704, 2368, 1, 256]
    - [2, 46.978]
  - - [2944, 448, 1, 1280]
    - [2, 57.528]
  - - [5888, 2368, 1, 3328]
    - [7, 75.001]
  - - [64, 2944, 1, 1280]
    - [14, 27.323]
  - - [448, 1856, 1, 1280]
    - [2, 52.157]
  - - [4288, 448, 1, 1280]
    - [8, 53.821]
  - - [5888, 704, 1, 3328]
    - [24, 63.176]
  - - [5056, 256, 1, 128]
    - [2, 34.601]
  - - [1856, 256, 1, 128]
    - [2, 15.699]
  - - [5056, 128, 1, 256]
    - [39, 20.677]
  - - [704, 4, 1, 256]
    - [0, 0.248]
  - - [1408, 5888, 1, 128]
    - [7, 59.576]
  - - [4288, 4, 1, 128]
    - [0, 0.897]
  - - [1408, 1024, 1, 256]
    - [3, 42.669]
  - - [1024, 1856, 1, 128]
    - [2, 37.211]
  - - [256, 704, 1, 128]
    - [15, 7.863]
  - - [256, 1024, 1, 128]
    - [30, 9.194]
  - - [448, 1024, 1, 256]
    - [2, 20.836]
  - - [128, 4, 1, 3328]
    - [1, 0.425]
  - - [5056, 6784, 1, 1280]
    - [3, 76.128]
  - - [704, 5056, 1, 3328]
    - [7, 69.98]
  - - [64, 1408, 1, 1280]
    - [19, 18.311]
  - - [3584, 5056, 1, 3328]
    - [7, 74.808]
  - - [1856, 4, 1, 3328]
    - [35, 3.857]
  - - [4, 2944, 1, 128]
    - [0, 0.454]
  - - [2368, 2944, 1, 3328]
    - [7, 74.137]
  - - [448, 448, 1, 1280]
    - [14, 27.192]
  - - [2368, 3584, 1, 256]
    - [7, 61.198]
  - - [1024, 256, 1, 1280]
    - [13, 30.97]
  - - [5056, 3584, 1, 1280]
    - [7, 74.859]
  - - [448, 4, 1, 3328]
    - [35, 1.689]
  - - [1856, 2944, 1, 1280]
    - [7, 63.791]
  - - [3584, 2368, 1, 1280]
    - [7, 68.612]
  - - [128, 1024, 1, 256]
    - [50, 7.789]
  - - [2944, 1408, 1, 256]
    - [3, 58.837]
  - - [4288, 1408, 1, 3328]
    - [7, 72.463]
  - - [3584, 64, 1, 3328]
    - [31, 38.431]
  - - [1408, 128, 1, 256]
    - [50, 10.964]
  - - [2944, 1024, 1, 128]
    - [3, 43.403]
  - - [4288, 5056, 1, 1280]
    - [3, 73.993]
  - - [5888, 6784, 1, 1280]
    - [3, 75.573]
  - - [6784, 5056, 1, 128]
    - [3, 66.766]
  - - [256, 1024, 1, 3328]
    - [14, 40.435]
  - - [3584, 4, 1, 256]
    - [0, 1.217]
  - - [1856, 64, 1, 3328]
    - [31, 33.196]
  - - [64, 6784, 1, 128]
    - [2, 14.899]
  - - [5888, 1408, 1, 3328]
    - [7, 70.493]
  - - [5888, 64, 1, 1280]
    - [4, 33.551]
  - - [256, 5056, 1, 256]
    - [8, 42.103]
  - - [128, 3584, 1, 128]
    - [8, 14.2]
  - - [448, 3584, 1, 3328]
    - [17, 57.648]
  - - [704, 2368, 1, 128]
    - [9, 23.46]
  - - [5888, 256, 1, 128]
    - [17, 32.083]
  - - [4, 5056, 1, 128]
    - [0, 0.86]
  - - [448, 256, 1, 256]
    - [0, 7.842]
  - - [704, 4, 1, 3328]
    - [1, 1.924]
  - - [1408, 256, 1, 256]
    - [22, 15.466]
  - - [3584, 1856, 1, 128]
    - [2, 55.674]
  - - [4288, 4288, 1, 128]
    - [7, 57.378]
  - - [1856, 1024, 1, 3328]
    - [29, 54.611]
  - - [128, 5888, 1, 3328]
    - [2, 49.217]
  - - [1024, 5056, 1, 256]
    - [3, 61.358]
  - - [2368, 1408, 1, 3328]
    - [7, 65.547]
  - - [5888, 448, 1, 256]
    - [2, 53.406]
  - - [5888, 6784, 1, 128]
    - [5, 64.003]
  - - [2368, 4, 1, 3328]
    - [35, 4.09]
  - - [6784, 5056, 1, 1280]
    - [7, 75.503]
  - - [5056, 704, 1, 1280]
    - [8, 60.16]
  - - [1408, 256, 1, 1280]
    - [14, 33.442]
  - - [4288, 6784, 1, 1280]
    - [3, 75.911]
  - - [128, 704, 1, 256]
    - [0, 7.236]
  - - [1024, 1024, 1, 128]
    - [8, 26.446]
  - - [448, 128, 1, 1280]
    - [19, 13.243]
  - - [6784, 4, 1, 3328]
    - [31, 5.602]
  - - [4288, 4, 1, 1280]
    - [40, 3.54]
  - - [1024, 64, 1, 3328]
    - [19, 23.337]
  - - [1856, 4, 1, 256]
    - [47, 0.667]
  - - [64, 3584, 1, 1280]
    - [14, 28.999]
  - - [6784, 1408, 1, 256]
    - [5, 61.821]
  - - [3584, 5888, 1, 128]
    - [7, 57.698]
  - - [5056, 5888, 1, 256]
    - [7, 69.068]
  - - [2368, 1024, 1, 256]
    - [3, 51.535]
  - - [2944, 1856, 1, 256]
    - [8, 54.752]
  - - [1856, 6784, 1, 1280]
    - [3, 72.14]
  - - [64, 5056, 1, 128]
    - [15, 9.743]
  - - [5888, 64, 1, 128]
    - [15, 10.819]
  - - [448, 704, 1, 128]
    - [15, 9.362]
  - - [4, 1024, 1, 128]
    - [0, 0.163]
  - - [4288, 3584, 1, 256]
    - [7, 62.174]
  - - [1408, 704, 1, 128]
    - [2, 22.147]
  - - [64, 256, 1, 3328]
    - [1, 9.144]
  - - [5056, 1856, 1, 1280]
    - [5, 67.616]
  - - [1408, 1024, 1, 3328]
    - [29, 53.461]
  - - [2368, 256, 1, 3328]
    - [4, 47.271]
  - - [5888, 3584, 1, 1280]
    - [7, 74.978]
  - - [1856, 3584, 1, 3328]
    - [7, 70.672]
  - - [5888, 128, 1, 1280]
    - [2, 47.514]
  - - [1024, 2944, 1, 256]
    - [3, 53.304]
  - - [448, 6784, 1, 1280]
    - [2, 60.121]
  - - [256, 3584, 1, 1280]
    - [8, 41.728]
  - - [448, 128, 1, 128]
    - [30, 2.408]
  - - [704, 5056, 1, 256]
    - [3, 59.006]
  - - [2944, 1856, 1, 1280]
    - [7, 62.92]
  - - [128, 256, 1, 128]
    - [0, 1.634]
  - - [5056, 256, 1, 256]
    - [2, 39.948]
  - - [2368, 3584, 1, 3328]
    - [3, 71.874]
  - - [3584, 5888, 1, 3328]
    - [3, 75.911]
  - - [128, 4, 1, 256]
    - [1, 0.049]
  - - [2944, 3584, 1, 1280]
    - [7, 71.062]
  - - [1856, 5888, 1, 1280]
    - [7, 70.449]
  - - [256, 256, 1, 1280]
    - [43, 14.101]
  - - [5056, 448, 1, 3328]
    - [7, 59.208]
  - - [4288, 1408, 1, 256]
    - [7, 62.169]
  - - [3584, 64, 1, 256]
    - [15, 12.312]
  - - [64, 1856, 1, 3328]
    - [31, 31.648]
  - - [256, 1408, 1, 128]
    - [15, 9.437]
  - - [5888, 1408, 1, 128]
    - [3, 59.714]
  - - [4288, 2368, 1, 1280]
    - [7, 69.766]
  - - [4, 4288, 1, 256]
    - [10, 1.402]
  - - [256, 4288, 1, 128]
    - [2, 25.472]
  - - [256, 128, 1, 3328]
    - [18, 17.587]
  - - [6784, 2368, 1, 256]
    - [39, 62.133]
  - - [5888, 128, 1, 128]
    - [8, 19.1]
  - - [4288, 1856, 1, 256]
    - [39, 58.563]
  - - [1856, 256, 1, 3328]
    - [4, 44.746]
  - - [1856, 2944, 1, 256]
    - [3, 57.823]
  - - [5056, 1024, 1, 128]
    - [3, 54.748]
  - - [64, 5888, 1, 1280]
    - [14, 36.8]
  - - [6784, 256, 1, 128]
    - [3, 33.791]
  - - [5888, 704, 1, 128]
    - [8, 49.469]
  - - [6784, 64, 1, 128]
    - [2, 13.985]
  - - [1024, 4288, 1, 1280]
    - [7, 66.248]
  - - [2368, 5056, 1, 3328]
    - [7, 72.392]
  - - [448, 4, 1, 128]
    - [11, 0.097]
  - - [4, 256, 1, 3328]
    - [1, 0.826]
  - - [4288, 1024, 1, 3328]
    - [7, 70.827]
  - - [1024, 5056, 1, 3328]
    - [3, 69.878]
  - - [1024, 1856, 1, 3328]
    - [28, 54.388]
  - - [704, 704, 1, 1280]
    - [14, 37.773]
  - - [128, 2368, 1, 1280]
    - [28, 30.621]
  - - [1408, 128, 1, 3328]
    - [31, 37.414]
  - - [3584, 256, 1, 1280]
    - [8, 42.168]
  - - [4, 128, 1, 128]
    - [1, 0.028]
  - - [704, 6784, 1, 128]
    - [7, 52.358]
  - - [3584, 128, 1, 1280]
    - [13, 36.135]
  - - [4, 256, 1, 1280]
    - [32, 0.388]
  - - [128, 704, 1, 3328]
    - [31, 27.63]
  - - [4288, 6784, 1, 256]
    - [3, 68.859]
  - - [3584, 2944, 1, 3328]
    - [7, 74.928]
  - - [128, 1856, 1, 256]
    - [16, 12.155]
  - - [64, 4288, 1, 256]
    - [50, 12.93]
  - - [4, 3584, 1, 3328]
    - [11, 6.352]
  - - [64, 4, 1, 3328]
    - [1, 0.247]
  - - [4, 64, 1, 3328]
    - [1, 0.245]
  - - [5888, 2944, 1, 256]
    - [3, 65.161]
  - - [2368, 6784, 1, 128]
    - [5, 56.857]
  - - [448, 4288, 1, 1280]
    - [2, 53.452]
  - - [448, 1856, 1, 3328]
    - [8, 55.225]
  - - [4, 1024, 1, 256]
    - [49, 0.335]
  - - [5056, 4288, 1, 256]
    - [3, 65.762]
  - - [1024, 448, 1, 256]
    - [2, 22.348]
  - - [1024, 3584, 1, 256]
    - [2, 54.429]
  - - [2944, 128, 1, 1280]
    - [13, 35.091]
  - - [1856, 5056, 1, 128]
    - [7, 59.48]
  - - [64, 256, 1, 256]
    - [10, 1.479]
  - - [1408, 4, 1, 128]
    - [55, 0.189]
  - - [128, 2368, 1, 128]
    - [15, 8.026]
  - - [256, 704, 1, 1280]
    - [29, 23.22]
  - - [64, 2368, 1, 128]
    - [0, 5.54]
  - - [6784, 6784, 1, 3328]
    - [7, 77.754]
  - - [448, 5888, 1, 1280]
    - [7, 67.551]
  - - [5056, 448, 1, 128]
    - [8, 40.027]
  - - [3584, 2944, 1, 128]
    - [3, 60.267]
  - - [6784, 256, 1, 1280]
    - [17, 61.535]
  - - [256, 2944, 1, 1280]
    - [2, 48.886]
  - - [64, 4288, 1, 128]
    - [15, 9.906]
  - - [2368, 5888, 1, 3328]
    - [7, 75.125]
  - - [4, 64, 1, 256]
    - [20, 0.022]
  - - [704, 1024, 1, 3328]
    - [2, 49.21]
  - - [2368, 1856, 1, 1280]
    - [2, 61.288]
  - - [128, 448, 1, 128]
    - [0, 2.852]
  - - [128, 6784, 1, 256]
    - [2, 37.524]
  - - [3584, 4288, 1, 128]
    - [3, 58.986]
  - - [64, 448, 1, 128]
    - [57, 1.075]
  - - [5888, 4288, 1, 3328]
    - [3, 75.532]
  - - [2368, 704, 1, 256]
    - [2, 42.257]
  - - [256, 1856, 1, 3328]
    - [4, 44.148]
  - - [1856, 128, 1, 256]
    - [50, 12.992]
  - - [6784, 128, 1, 128]
    - [3, 22.205]
  - - [3584, 1408, 1, 128]
    - [7, 54.139]
  - - [1856, 5056, 1, 1280]
    - [3, 69.245]
  - - [2944, 1024, 1, 1280]
    - [2, 60.435]
  - - [5056, 4, 1, 256]
    - [47, 1.513]
  - - [2368, 4288, 1, 256]
    - [3, 58.195]
  - - [1024, 2368, 1, 3328]
    - [7, 65.455]
  - - [64, 704, 1, 3328]
    - [18, 18.984]
  - - [704, 1408, 1, 256]
    - [8, 32.255]
  - - [6784, 1856, 1, 3328]
    - [7, 71.782]
  - - [1024, 2944, 1, 128]
    - [8, 45.812]
  - - [1024, 3584, 1, 1280]
    - [7, 57.939]
  - - [4288, 5888, 1, 3328]
    - [3, 75.697]
  - - [4288, 4, 1, 3328]
    - [31, 5.335]
  - - [256, 1408, 1, 256]
    - [2, 16.827]
  - - [448, 2944, 1, 1280]
    - [8, 57.04]
  - - [4, 5888, 1, 128]
    - [0, 0.971]
  - - [1024, 2944, 1, 3328]
    - [2, 61.31]
  - - [3584, 6784, 1, 256]
    - [3, 68.74]
  - - [256, 6784, 1, 1280]
    - [17, 61.129]
  - - [1856, 3584, 1, 256]
    - [3, 60.512]
  - - [128, 448, 1, 3328]
    - [26, 21.521]
  - - [6784, 1856, 1, 128]
    - [39, 53.639]
  - - [4, 448, 1, 256]
    - [20, 0.139]
  - - [2944, 704, 1, 128]
    - [8, 36.308]
  - - [256, 5888, 1, 1280]
    - [17, 53.795]
  - - [4, 128, 1, 1280]
    - [1, 0.186]
  - - [4288, 6784, 1, 3328]
    - [7, 76.843]
  - - [6784, 128, 1, 1280]
    - [8, 53.532]
  - - [64, 1408, 1, 256]
    - [16, 5.921]
  - - [2368, 1408, 1, 128]
    - [5, 46.81]
  - - [1856, 448, 1, 256]
    - [2, 36.076]
  - - [1408, 1024, 1, 128]
    - [2, 28.677]
  - - [128, 64, 1, 128]
    - [55, 0.311]
  - - [6784, 3584, 1, 3328]
    - [7, 77.978]
  - - [2944, 64, 1, 3328]
    - [31, 38.004]
  - - [64, 64, 1, 128]
    - [0, 0.208]
  - - [2368, 5056, 1, 1280]
    - [7, 71.104]
  - - [64, 4, 1, 1280]
    - [1, 0.079]
  - - [1408, 2368, 1, 1280]
    - [7, 64.053]
  - - [128, 1408, 1, 1280]
    - [14, 25.285]
  - - [256, 64, 1, 3328]
    - [40, 10.707]
  - - [2944, 4288, 1, 128]
    - [24, 51.986]
  - - [2944, 2944, 1, 256]
    - [5, 59.749]
  - - [2944, 4, 1, 1280]
    - [60, 3.62]
  - - [5888, 4, 1, 256]
    - [0, 1.889]
  - - [6784, 256, 1, 256]
    - [7, 48.283]
  - - [256, 5056, 1, 3328]
    - [2, 57.256]
  - - [128, 4288, 1, 1280]
    - [28, 38.648]
  - - [5056, 1856, 1, 128]
    - [8, 57.143]
  - - [5888, 1408, 1, 256]
    - [23, 57.399]
  - - [128, 128, 1, 256]
    - [20, 1.348]
  - - [5056, 4, 1, 3328]
    - [40, 5.346]
  - - [4288, 3584, 1, 3328]
    - [7, 73.995]
  - - [448, 704, 1, 3328]
    - [29, 42.743]
  - - [448, 448, 1, 128]
    - [15, 8.074]
  - - [1024, 2368, 1, 1280]
    - [7, 62.377]
  - - [1856, 704, 1, 3328]
    - [8, 59.857]
  - - [4, 2368, 1, 128]
    - [0, 0.476]
  - - [5888, 6784, 1, 3328]
    - [7, 77.524]
  - - [704, 4288, 1, 1280]
    - [2, 60.15]
  - - [704, 256, 1, 256]
    - [15, 10.66]
  - - [6784, 448, 1, 3328]
    - [2, 62.215]
  - - [4288, 1024, 1, 128]
    - [7, 51.577]
- null
