library/src/blas3/Tensile/Logic/asm_full/aldebaran_Cijk_Ailk_Bjlk_BBH.yaml
- {MinimumRequiredVersion: 4.31.0}
- aldebaran
- gfx90a
- [Device 0050, Device 0051, Device 0052, Device 0054, Device 0062, Device 7400, Device
    SolutionIndex: 0
    SolutionIndex: 1
    SolutionIndex: 2
    SolutionIndex: 3
    SolutionIndex: 4
    SolutionNameMin: Cijk_Ailk_Bjlk_BBH_MT256x192x32_MI32x32x8x1_SE_1LDSB1_EPS1_GRVW8_NLCA1_NLCB3_PGR1_SU0_SUS128_SRVW4_TT4_96_WG64_4_1_WGM1
    SolutionIndex: 5
    SolutionNameMin: Cijk_Ailk_Bjlk_BBH_MT256x192x32_MI32x32x8x1_SE_1LDSB0_EPS1_GRVW8_NLCA1_NLCB3_PGR1_SU32_SUS128_SRVW4_TT4_96_WG64_4_1_WGM2
    SolutionIndex: 6
    SolutionNameMin: Cijk_Ailk_Bjlk_BBH_MT256x192x32_MI32x32x8x1_SE_1LDSB1_EPS1_GRVW8_NLCA1_NLCB3_PGR1_SU0_SUS256_SRVW4_TT4_96_WG64_4_1_WGM15
    SolutionIndex: 7
    SolutionNameMin: Cijk_Ailk_Bjlk_BBH_MT128x256x32_MI32x32x8x1_SE_1LDSB1_EPS1_GRVW8_NLCA1_NLCB1_PGR1_SU0_SUS128_SRVW4_TT2_128_WG64_4_1_WGM15
    SolutionIndex: 8
    SolutionNameMin: Cijk_Ailk_Bjlk_BBH_MT128x256x32_MI32x32x8x1_SE_1LDSB1_EPS1_GRVW8_NLCA1_NLCB1_PGR1_SU0_SUS256_SRVW4_TT2_128_WG64_4_1_WGM15
    SolutionIndex: 9
    SolutionNameMin: Cijk_Ailk_Bjlk_BBH_MT128x128x16_MI32x32x4x1_SE_AF0EM4_GRVW8_NLCA1_NLCB1_SU0_SUS0_SRVW4_TT2_64_WG64_4_1_WGM1
    SolutionIndex: 10
    SolutionNameMin: Cijk_Ailk_Bjlk_BBH_MT128x128x16_MI32x32x4x1_SE_AF0EM1_GRVW8_NLCA1_NLCB1_SU0_SUS0_SRVW4_TT2_64_WG64_4_1_WGM2
    SolutionIndex: 11
    SolutionNameMin: Cijk_Ailk_Bjlk_BBH_MT128x128x16_MI32x32x4x1_SE_AF0EM1_GRVW8_NLCA1_NLCB1_SU0_SUS0_SRVW4_TT2_64_WG64_4_1_WGM15
    SolutionIndex: 12
    SolutionNameMin: Cijk_Ailk_Bjlk_BBH_MT128x128x16_MI32x32x4x1_SE_AF0EM4_GRVW8_NLCA1_NLCB1_SU0_SUS0_SRVW4_TT2_64_WG64_4_1_WGM15
    SolutionIndex: 13
    SolutionNameMin: Cijk_Ailk_Bjlk_BBH_MT16x64x32_MI16x16x16x1_SE_1LDSB0_AF0EM1_EPS1_GRVW8_GSU1_NLCA1_NLCB1_PGR1_SU0_SUS0_SRVW0_TT1_16_VAW2_WG16_16_1_WGM1
    SolutionIndex: 14
    SolutionNameMin: Cijk_Ailk_Bjlk_BBH_MT16x16x16_MI16x16x16x1_SE_1LDSB0_AF0EM8_EPS0_GRVW2_GSU1_NLCA1_NLCB1_PGR2_SU0_SUS0_SRVW0_TT1_16_VAW2_WG16_4_1_WGM1
    SolutionIndex: 15
    SolutionNameMin: Cijk_Ailk_Bjlk_BBH_MT16x16x16_MI16x16x16x1_SE_1LDSB0_AF0EM8_EPS1_GRVW2_GSU1_NLCA1_NLCB1_PGR1_SU0_SUS0_SRVW0_TT1_16_VAW2_WG16_4_1_WGM1
    SolutionIndex: 16
    SolutionNameMin: Cijk_Ailk_Bjlk_BBH_MT16x16x32_MI16x16x16x1_SE_1LDSB0_AF0EM1_EPS0_GRVW8_GSU1_NLCA1_NLCB1_PGR2_SU0_SUS0_SRVW0_TT1_16_VAW2_WG16_4_1_WGM1
    SolutionIndex: 17
    SolutionNameMin: Cijk_Ailk_Bjlk_BBH_MT16x16x16_MI16x16x16x1_SE_1LDSB0_AF0EM1_EPS1_GRVW2_GSU1_NLCA1_NLCB1_PGR1_SU0_SUS0_SRVW4_TT1_16_VAW2_WG16_4_1_WGM1
    SolutionIndex: 18
    SolutionNameMin: Cijk_Ailk_Bjlk_BBH_MT64x16x32_MI16x16x16x1_SE_1LDSB0_AF0EM1_EPS0_GRVW8_GSU1_NLCA1_NLCB1_PGR2_SU0_SUS0_SRVW0_TT1_16_VAW2_WG64_4_1_WGM1
    SolutionIndex: 19
    SolutionNameMin: Cijk_Ailk_Bjlk_BBH_MT16x16x16_MI16x16x16x1_SE_1LDSB0_AF0EM1_EPS1_GRVW4_GSU1_NLCA1_NLCB1_PGR1_SU0_SUS0_SRVW0_TT1_16_VAW2_WG16_4_1_WGM1
    SolutionIndex: 20
    SolutionNameMin: Cijk_Ailk_Bjlk_BBH_MT16x16x16_MI16x16x16x1_SE_1LDSB0_AF0EM1_EPS1_GRVW2_GSU1_NLCA1_NLCB1_PGR1_SU0_SUS0_SRVW0_TT1_16_VAW2_WG16_4_1_WGM1
    SolutionIndex: 21
    SolutionNameMin: Cijk_Ailk_Bjlk_BBH_MT16x64x32_MI16x16x16x1_SE_1LDSB0_AF0EM8_EPS1_GRVW8_GSU1_NLCA1_NLCB1_PGR1_SU0_SUS0_SRVW0_TT1_16_VAW2_WG16_16_1_WGM2
    SolutionIndex: 22
    SolutionNameMin: Cijk_Ailk_Bjlk_BBH_MT16x16x16_MI16x16x16x1_SE_1LDSB0_AF0EM1_EPS0_GRVW2_GSU1_NLCA1_NLCB1_PGR2_SU32_SUS256_SRVW4_TT1_16_VAW2_WG16_4_1_WGM1
    SolutionIndex: 23
    SolutionNameMin: Cijk_Ailk_Bjlk_BBH_MT32x32x16_MI16x16x16x1_SE_1LDSB0_AF0EM8_EPS1_GRVW2_GSU1_NLCA1_NLCB1_PGR1_SU0_SUS0_SRVW4_TT1_16_VAW2_WG32_8_1_WGM1
    SolutionIndex: 24
    SolutionNameMin: Cijk_Ailk_Bjlk_BBH_MT64x128x16_MI32x32x8x1_SE_1LDSB0_AF0EM8_EPS0_GRVW4_GSU1_NLCA1_NLCB1_PGR2_SU0_SUS0_SRVW4_TT1_64_VAW2_WG64_4_1_WGM2
    SolutionIndex: 25
    SolutionNameMin: Cijk_Ailk_Bjlk_BBH_MT32x32x64_MI16x16x16x1_SE_1LDSB0_AF0EM8_EPS0_GRVW8_GSU1_NLCA1_NLCB1_PGR2_SU0_SUS0_SRVW4_TT1_16_VAW2_WG32_8_1_WGM1
    SolutionIndex: 26
    SolutionNameMin: Cijk_Ailk_Bjlk_BBH_MT64x128x16_MI32x32x8x1_SE_1LDSB0_AF0EM8_EPS0_GRVW4_GSU1_NLCA1_NLCB1_PGR2_SU0_SUS0_SRVW4_TT1_64_VAW2_WG64_4_1_WGM1
    SolutionIndex: 27
    SolutionNameMin: Cijk_Ailk_Bjlk_BBH_MT128x64x16_MI32x32x8x1_SE_1LDSB0_AF0EM8_EPS0_GRVW4_GSU1_NLCA1_NLCB1_PGR2_SU0_SUS0_SRVW4_TT2_32_VAW2_WG64_4_1_WGM1
    SolutionIndex: 28
    SolutionNameMin: Cijk_Ailk_Bjlk_BBH_MT128x64x16_MI32x32x8x1_SE_1LDSB0_AF0EM8_EPS0_GRVW8_GSU1_NLCA1_NLCB1_PGR2_SU0_SUS0_SRVW4_TT2_32_VAW2_WG64_4_1_WGM2
    SolutionIndex: 29
    SolutionNameMin: Cijk_Ailk_Bjlk_BBH_MT16x64x32_MI16x16x16x1_SE_1LDSB0_AF0EM8_EPS1_GRVW2_GSU1_NLCA1_NLCB1_PGR1_SU0_SUS0_SRVW0_TT1_16_VAW2_WG16_16_1_WGM1
    SolutionIndex: 30
    SolutionNameMin: Cijk_Ailk_Bjlk_BBH_MT64x32x16_MI16x16x16x1_SE_1LDSB0_AF0EM1_EPS0_GRVW2_GSU1_NLCA1_NLCB1_PGR2_SU0_SUS0_SRVW4_TT2_16_VAW2_WG32_8_1_WGM1
    SolutionIndex: 31
    SolutionNameMin: Cijk_Ailk_Bjlk_BBH_MT128x96x32_MI32x32x8x1_SE_1LDSB0_AF0EM8_EPS0_GRVW4_GSU1_NLCA1_NLCB3_PGR2_SU0_SUS0_SRVW4_TT1_96_VAW2_WG128_2_1_WGM2
    SolutionIndex: 32
    SolutionNameMin: Cijk_Ailk_Bjlk_BBH_MT128x128x32_MI32x32x8x1_SE_1LDSB0_AF0EM8_EPS0_GRVW8_GSU1_NLCA1_NLCB1_PGR2_SU0_SUS0_SRVW4_TT2_64_VAW2_WG64_4_1_WGM15
    SolutionIndex: 33
    SolutionNameMin: Cijk_Ailk_Bjlk_BBH_MT256x160x32_MI32x32x8x1_SE_1LDSB0_AF0EM8_EPS0_GRVW2_GSU1_NLCA2_NLCB5_PGR2_SU0_SUS0_SRVW4_TT2_160_VAW2_WG128_2_1_WGM15
    SolutionIndex: 34
    SolutionNameMin: Cijk_Ailk_Bjlk_BBH_MT128x256x16_MI32x32x8x1_SE_1LDSB0_AF0EM8_EPS0_GRVW8_GSU1_NLCA1_NLCB1_PGR2_SU0_SUS0_SRVW4_TT2_128_VAW2_WG64_4_1_WGM15
    SolutionIndex: 35
    SolutionNameMin: Cijk_Ailk_Bjlk_BBH_MT128x256x16_MI32x32x8x1_SE_1LDSB1_AF0EM8_EPS0_GRVW8_GSU1_NLCA1_NLCB1_PGR2_SU0_SUS0_SRVW4_TT2_128_VAW2_WG64_4_1_WGM1
    SolutionIndex: 36
    SolutionNameMin: Cijk_Ailk_Bjlk_BBH_MT128x128x32_MI32x32x8x1_SE_1LDSB0_AF0EM8_EPS0_GRVW8_GSU1_NLCA1_NLCB1_PGR2_SU0_SUS0_SRVW4_TT2_64_VAW2_WG64_4_1_WGM2
    SolutionIndex: 37
    SolutionNameMin: Cijk_Ailk_Bjlk_BBH_MT160x256x32_MI32x32x8x1_SE_1LDSB0_AF0EM8_EPS1_GRVW4_GSU1_NLCA5_NLCB1_PGR1_SU32_SUS128_SRVW0_TT5_64_VAW2_WG32_8_1_WGM1
    SolutionIndex: 38
    SolutionNameMin: Cijk_Ailk_Bjlk_BBH_MT16x64x64_MI16x16x16x1_SE_1LDSB0_AF0EM1_EPS0_GRVW8_GSU15_NLCA1_NLCB1_PGR2_SU32_SUS256_SRVW0_TT1_16_VAW1_WG16_16_1_WGM1
    SolutionIndex: 39
    SolutionNameMin: Cijk_Ailk_Bjlk_BBH_MT32x64x16_MI16x16x16x1_SE_1LDSB0_AF0EM1_EPS1_GRVW2_GSU1_NLCA1_NLCB1_PGR1_SU0_SUS0_SRVW4_TT1_32_VAW2_WG32_8_1_WGM1
    SolutionIndex: 40
    SolutionNameMin: Cijk_Ailk_Bjlk_BBH_MT32x32x64_MI16x16x16x1_SE_1LDSB0_AF0EM1_EPS0_GRVW8_GSU1_NLCA1_NLCB1_PGR2_SU0_SUS0_SRVW4_TT1_16_VAW2_WG32_8_1_WGM1
    SolutionIndex: 41
    SolutionNameMin: Cijk_Ailk_Bjlk_BBH_MT32x32x32_MI16x16x16x1_SE_1LDSB0_AF0EM1_EPS0_GRVW4_GSU1_NLCA1_NLCB1_PGR2_SU0_SUS0_SRVW4_TT1_16_VAW2_WG32_8_1_WGM1
    SolutionIndex: 42
    SolutionNameMin: Cijk_Ailk_Bjlk_BBH_MT64x64x32_MI32x32x8x1_SE_1LDSB0_AF0EM8_EPS0_GRVW8_GSU15_NLCA1_NLCB1_PGR2_SU0_SUS0_SRVW4_TT1_32_VAW1_WG64_4_1_WGM15
    SolutionIndex: 43
    SolutionNameMin: Cijk_Ailk_Bjlk_BBH_MT64x128x32_MI32x32x8x1_SE_1LDSB0_AF0EM8_EPS0_GRVW4_GSU7_NLCA1_NLCB1_PGR2_SU32_SUS256_SRVW4_TT1_64_VAW1_WG64_4_1_WGM2
    SolutionIndex: 44
    SolutionNameMin: Cijk_Ailk_Bjlk_BBH_MT128x256x16_MI32x32x8x1_SE_1LDSB0_AF0EM8_EPS0_GRVW4_GSU5_NLCA1_NLCB1_PGR2_SU0_SUS0_SRVW4_TT2_128_VAW1_WG64_4_1_WGM15
    SolutionIndex: 45
    SolutionNameMin: Cijk_Ailk_Bjlk_BBH_MT128x128x32_MI32x32x8x1_SE_1LDSB0_AF0EM8_EPS0_GRVW4_GSU2_NLCA1_NLCB1_PGR2_SU0_SUS0_SRVW4_TT2_64_VAW1_WG64_4_1_WGM15
    SolutionIndex: 46
    SolutionNameMin: Cijk_Ailk_Bjlk_BBH_MT128x256x32_MI32x32x8x1_SE_1LDSB0_AF0EM8_EPS1_GRVW8_GSU3_NLCA1_NLCB1_PGR1_SU0_SUS0_SRVW4_TT2_128_VAW1_WG64_4_1_WGM15
    SolutionIndex: 47
    SolutionNameMin: Cijk_Ailk_Bjlk_BBH_MT128x256x16_MI32x32x8x1_SE_1LDSB0_AF0EM8_EPS0_GRVW4_GSU3_NLCA1_NLCB1_PGR2_SU0_SUS0_SRVW4_TT2_128_VAW1_WG64_4_1_WGM2
    SolutionIndex: 48
    SolutionNameMin: Cijk_Ailk_Bjlk_BBH_MT128x96x64_MI32x32x8x1_SE_1LDSB0_AF0EM8_EPS0_GRVW4_GSU1_NLCA1_NLCB3_PGR2_SU0_SUS0_SRVW4_TT1_96_VAW2_WG128_2_1_WGM2
    SolutionIndex: 49
    SolutionNameMin: Cijk_Ailk_Bjlk_BBH_MT128x128x32_MI32x32x8x1_SE_1LDSB0_AF0EM8_EPS0_GRVW4_GSU1_NLCA1_NLCB1_PGR2_SU0_SUS0_SRVW4_TT2_64_VAW2_WG64_4_1_WGM2
    SolutionIndex: 50
    SolutionNameMin: Cijk_Ailk_Bjlk_BBH_MT128x128x32_MI32x32x8x1_SE_1LDSB0_AF0EM1_EPS0_GRVW4_GSU1_NLCA1_NLCB1_PGR2_SU0_SUS0_SRVW4_TT2_64_VAW2_WG64_4_1_WGM1
    SolutionIndex: 51
    SolutionNameMin: Cijk_Ailk_Bjlk_BBH_MT128x160x32_MI32x32x8x1_SE_1LDSB0_AF0EM8_EPS0_GRVW4_GSU1_NLCA1_NLCB5_PGR2_SU0_SUS0_SRVW4_TT1_160_VAW2_WG128_2_1_WGM15
    SolutionIndex: 52
    SolutionNameMin: Cijk_Ailk_Bjlk_BBH_MT128x192x32_MI32x32x8x1_SE_1LDSB0_AF0EM8_EPS0_GRVW4_GSU1_NLCA1_NLCB3_PGR2_SU0_SUS0_SRVW4_TT2_96_VAW2_WG64_4_1_WGM15
    SolutionIndex: 53
    SolutionNameMin: Cijk_Ailk_Bjlk_BBH_MT128x192x32_MI32x32x8x1_SE_1LDSB0_AF0EM8_EPS0_GRVW4_GSU1_NLCA1_NLCB3_PGR2_SU0_SUS0_SRVW4_TT2_96_VAW2_WG64_4_1_WGM2
    SolutionIndex: 54
    SolutionNameMin: Cijk_Ailk_Bjlk_BBH_MT128x128x32_MI32x32x8x1_SE_1LDSB0_AF0EM8_EPS0_GRVW8_GSU1_NLCA1_NLCB1_PGR2_SU0_SUS0_SRVW4_TT2_64_VAW2_WG64_4_1_WGM1
    SolutionIndex: 55
    SolutionNameMin: Cijk_Ailk_Bjlk_BBH_MT128x128x32_MI32x32x8x1_SE_1LDSB0_AF0EM8_EPS0_GRVW4_GSU1_NLCA1_NLCB1_PGR2_SU0_SUS0_SRVW4_TT2_64_VAW2_WG64_4_1_WGM1
    SolutionIndex: 56
    SolutionNameMin: Cijk_Ailk_Bjlk_BBH_MT128x288x32_MI32x32x8x1_SE_1LDSB0_AF0EM8_EPS0_GRVW4_GSU1_NLCA1_NLCB9_PGR2_SU0_SUS0_SRVW4_TT1_288_VAW2_WG128_2_1_WGM15
    SolutionIndex: 57
    SolutionNameMin: Cijk_Ailk_Bjlk_BBH_MT256x160x32_MI32x32x8x1_SE_1LDSB0_AF0EM8_EPS1_GRVW4_GSU1_NLCA1_NLCB5_PGR1_SU0_SUS0_SRVW4_TT2_160_VAW2_WG128_2_1_WGM15
    SolutionIndex: 58
    SolutionNameMin: Cijk_Ailk_Bjlk_BBH_MT256x160x32_MI32x32x8x1_SE_1LDSB0_AF0EM8_EPS1_GRVW4_GSU1_NLCA1_NLCB5_PGR1_SU0_SUS0_SRVW4_TT2_160_VAW2_WG128_2_1_WGM2
    SolutionIndex: 59
    SolutionNameMin: Cijk_Ailk_Bjlk_BBH_MT128x256x16_MI32x32x8x1_SE_1LDSB0_AF0EM8_EPS0_GRVW8_GSU1_NLCA1_NLCB1_PGR2_SU0_SUS0_SRVW4_TT2_128_VAW2_WG64_4_1_WGM1
    SolutionIndex: 60
    SolutionNameMin: Cijk_Ailk_Bjlk_BBH_MT128x256x16_MI32x32x8x1_SE_1LDSB1_AF0EM8_EPS0_GRVW8_GSU1_NLCA1_NLCB1_PGR2_SU0_SUS0_SRVW4_TT2_128_VAW2_WG64_4_1_WGM2
    SolutionIndex: 61
    SolutionNameMin: Cijk_Ailk_Bjlk_BBH_MT64x32x16_MI16x16x16x1_SE_1LDSB0_AF0EM8_EPS1_GRVW2_GSU1_NLCA1_NLCB1_PGR1_SU0_SUS0_SRVW4_TT2_16_VAW2_WG32_8_1_WGM15
    SolutionIndex: 62
    SolutionNameMin: Cijk_Ailk_Bjlk_BBH_MT64x64x32_MI32x32x8x1_SE_1LDSB0_AF0EM1_EPS0_GRVW8_GSU1_NLCA1_NLCB1_PGR2_SU0_SUS0_SRVW4_TT1_32_VAW2_WG64_4_1_WGM1
    SolutionIndex: 63
    SolutionNameMin: Cijk_Ailk_Bjlk_BBH_MT128x128x32_MI32x32x8x1_SE_1LDSB0_AF0EM8_EPS0_GRVW4_GSU3_NLCA1_NLCB1_PGR2_SU0_SUS0_SRVW4_TT2_64_VAW1_WG64_4_1_WGM15
    SolutionIndex: 64
    SolutionNameMin: Cijk_Ailk_Bjlk_BBH_MT32x32x32_MI16x16x16x1_SE_1LDSB0_AF0EM8_EPS0_GRVW4_GSU1_NLCA1_NLCB1_PGR2_SU0_SUS0_SRVW4_TT1_16_VAW2_WG32_8_1_WGM1
    SolutionIndex: 65
    SolutionNameMin: Cijk_Ailk_Bjlk_BBH_MT32x32x64_MI16x16x16x1_SE_1LDSB0_AF0EM8_EPS0_GRVW8_GSU1_NLCA1_NLCB1_PGR2_SU0_SUS0_SRVW4_TT1_16_VAW2_WG32_8_1_WGM15
    SolutionIndex: 66
    SolutionNameMin: Cijk_Ailk_Bjlk_BBH_MT64x64x32_MI32x32x8x1_SE_1LDSB0_AF0EM8_EPS0_GRVW8_GSU1_NLCA1_NLCB1_PGR2_SU0_SUS0_SRVW4_TT1_32_VAW2_WG64_4_1_WGM1
    SolutionIndex: 67
    SolutionNameMin: Cijk_Ailk_Bjlk_BBH_MT64x64x32_MI32x32x8x1_SE_1LDSB0_AF0EM8_EPS0_GRVW4_GSU1_NLCA1_NLCB1_PGR2_SU0_SUS0_SRVW4_TT1_32_VAW2_WG64_4_1_WGM1
    SolutionIndex: 68
    SolutionNameMin: Cijk_Ailk_Bjlk_BBH_MT64x64x16_MI32x32x8x1_SE_1LDSB0_AF0EM8_EPS0_GRVW4_GSU1_NLCA1_NLCB1_PGR2_SU0_SUS0_SRVW4_TT1_32_VAW2_WG64_4_1_WGM1
    SolutionIndex: 69
    SolutionNameMin: Cijk_Ailk_Bjlk_BBH_MT64x64x64_MI32x32x8x1_SE_1LDSB0_AF0EM8_EPS0_GRVW8_GSU1_NLCA1_NLCB1_PGR2_SU0_SUS0_SRVW4_TT1_32_VAW2_WG64_4_1_WGM15
    SolutionIndex: 70
    SolutionNameMin: Cijk_Ailk_Bjlk_BBH_MT128x64x32_MI32x32x8x1_SE_1LDSB0_AF0EM8_EPS0_GRVW8_GSU1_NLCA1_NLCB1_PGR2_SU0_SUS0_SRVW4_TT2_32_VAW2_WG64_4_1_WGM2
    SolutionIndex: 71
    SolutionNameMin: Cijk_Ailk_Bjlk_BBH_MT64x64x32_MI32x32x8x1_SE_1LDSB0_AF0EM8_EPS0_GRVW8_GSU1_NLCA1_NLCB1_PGR2_SU0_SUS0_SRVW4_TT1_32_VAW2_WG64_4_1_WGM15
    SolutionIndex: 72
    SolutionNameMin: Cijk_Ailk_Bjlk_BBH_MT64x64x64_MI32x32x8x1_SE_1LDSB0_AF0EM8_EPS0_GRVW8_GSU1_NLCA1_NLCB1_PGR2_SU0_SUS0_SRVW4_TT1_32_VAW2_WG64_4_1_WGM2
    SolutionIndex: 73
    SolutionNameMin: Cijk_Ailk_Bjlk_BBH_MT128x64x64_MI32x32x8x1_SE_1LDSB0_AF0EM8_EPS1_GRVW8_GSU3_NLCA1_NLCB1_PGR1_SU0_SUS0_SRVW0_TT2_32_VAW1_WG64_4_1_WGM1
    SolutionIndex: 74
    SolutionNameMin: Cijk_Ailk_Bjlk_BBH_MT64x64x64_MI32x32x8x1_SE_1LDSB0_AF0EM8_EPS1_GRVW8_GSU3_NLCA1_NLCB1_PGR1_SU0_SUS0_SRVW0_TT1_32_VAW1_WG64_4_1_WGM2
    SolutionIndex: 75
    SolutionNameMin: Cijk_Ailk_Bjlk_BBH_MT64x128x64_MI32x32x8x1_SE_1LDSB0_AF0EM8_EPS1_GRVW8_GSU3_NLCA1_NLCB1_PGR1_SU32_SUS128_SRVW0_TT1_64_VAW1_WG64_4_1_WGM2
    SolutionIndex: 76
    SolutionNameMin: Cijk_Ailk_Bjlk_BBH_MT128x128x64_MI32x32x8x1_SE_1LDSB0_AF0EM8_EPS0_GRVW8_GSU15_NLCA1_NLCB1_PGR2_SU0_SUS0_SRVW4_TT2_64_VAW1_WG64_4_1_WGM2
    SolutionIndex: 77
    SolutionNameMin: Cijk_Ailk_Bjlk_BBH_MT64x128x32_MI32x32x8x1_SE_1LDSB0_AF0EM1_EPS0_GRVW8_GSU1_NLCA1_NLCB1_PGR2_SU32_SUS256_SRVW4_TT1_64_VAW2_WG64_4_1_WGM15
    SolutionIndex: 78
    SolutionNameMin: Cijk_Ailk_Bjlk_BBH_MT128x128x16_MI32x32x8x1_SE_1LDSB0_AF0EM8_EPS0_GRVW8_GSU1_NLCA1_NLCB1_PGR2_SU0_SUS0_SRVW4_TT2_64_VAW2_WG64_4_1_WGM2
    SolutionIndex: 79
    SolutionNameMin: Cijk_Ailk_Bjlk_BBH_MT32x64x16_MI16x16x16x1_SE_1LDSB1_AF0EM1_EPS1_GRVW2_GSU1_NLCA1_NLCB1_PGR1_SU0_SUS0_SRVW4_TT1_32_VAW2_WG32_8_1_WGM15
    SolutionIndex: 80
    SolutionNameMin: Cijk_Ailk_Bjlk_BBH_MT32x64x16_MI16x16x16x1_SE_1LDSB0_AF0EM8_EPS1_GRVW2_GSU1_NLCA1_NLCB1_PGR1_SU0_SUS0_SRVW4_TT1_32_VAW2_WG32_8_1_WGM15
    SolutionIndex: 81
    SolutionNameMin: Cijk_Ailk_Bjlk_BBH_MT32x64x16_MI16x16x16x1_SE_1LDSB0_AF0EM1_EPS1_GRVW2_GSU1_NLCA1_NLCB1_PGR1_SU32_SUS128_SRVW4_TT1_32_VAW2_WG32_8_1_WGM2
    SolutionIndex: 82
    SolutionNameMin: Cijk_Ailk_Bjlk_BBH_MT32x64x16_MI16x16x16x1_SE_1LDSB0_AF0EM8_EPS0_GRVW8_GSU1_NLCA1_NLCB1_PGR2_SU32_SUS256_SRVW4_TT1_32_VAW2_WG32_8_1_WGM2
    SolutionIndex: 83
    SolutionNameMin: Cijk_Ailk_Bjlk_BBH_MT32x64x16_MI16x16x16x1_SE_1LDSB0_AF0EM1_EPS0_GRVW2_GSU1_NLCA1_NLCB1_PGR2_SU32_SUS256_SRVW4_TT1_32_VAW2_WG32_8_1_WGM15
    SolutionIndex: 84
    SolutionNameMin: Cijk_Ailk_Bjlk_BBH_MT32x64x16_MI16x16x16x1_SE_1LDSB1_AF0EM1_EPS0_GRVW8_GSU1_NLCA1_NLCB1_PGR2_SU0_SUS0_SRVW4_TT1_32_VAW2_WG32_8_1_WGM2
    SolutionIndex: 85
    SolutionNameMin: Cijk_Ailk_Bjlk_BBH_MT64x32x16_MI16x16x16x1_SE_1LDSB1_AF0EM8_EPS1_GRVW2_GSU1_NLCA1_NLCB1_PGR1_SU0_SUS0_SRVW4_TT2_16_VAW2_WG32_8_1_WGM1
    SolutionIndex: 86
    SolutionNameMin: Cijk_Ailk_Bjlk_BBH_MT64x32x16_MI16x16x16x1_SE_1LDSB0_AF0EM8_EPS0_GRVW4_GSU1_NLCA1_NLCB1_PGR2_SU0_SUS0_SRVW4_TT2_16_VAW2_WG32_8_1_WGM1
    SolutionIndex: 87
    SolutionNameMin: Cijk_Ailk_Bjlk_BBH_MT64x32x16_MI16x16x16x1_SE_1LDSB1_AF0EM8_EPS0_GRVW2_GSU1_NLCA1_NLCB1_PGR2_SU0_SUS0_SRVW4_TT2_16_VAW2_WG32_8_1_WGM15
    SolutionIndex: 88
    SolutionNameMin: Cijk_Ailk_Bjlk_BBH_MT64x64x16_MI32x32x8x1_SE_1LDSB0_AF0EM8_EPS1_GRVW2_GSU1_NLCA1_NLCB1_PGR1_SU32_SUS256_SRVW4_TT1_32_VAW2_WG64_4_1_WGM1
    SolutionIndex: 89
    SolutionNameMin: Cijk_Ailk_Bjlk_BBH_MT64x64x16_MI32x32x8x1_SE_1LDSB0_AF0EM8_EPS0_GRVW8_GSU1_NLCA1_NLCB1_PGR2_SU32_SUS256_SRVW4_TT1_32_VAW2_WG64_4_1_WGM1
    SolutionIndex: 90
    SolutionNameMin: Cijk_Ailk_Bjlk_BBH_MT64x64x16_MI32x32x8x1_SE_1LDSB0_AF0EM8_EPS0_GRVW2_GSU1_NLCA1_NLCB1_PGR2_SU0_SUS0_SRVW4_TT1_32_VAW2_WG64_4_1_WGM1
    SolutionIndex: 91
    SolutionNameMin: Cijk_Ailk_Bjlk_BBH_MT64x128x16_MI32x32x8x1_SE_1LDSB0_AF0EM8_EPS0_GRVW2_GSU1_NLCA1_NLCB1_PGR2_SU0_SUS0_SRVW4_TT1_64_VAW2_WG64_4_1_WGM2
    SolutionIndex: 92
    SolutionNameMin: Cijk_Ailk_Bjlk_BBH_MT64x128x16_MI32x32x8x1_SE_1LDSB0_AF0EM8_EPS0_GRVW8_GSU1_NLCA1_NLCB1_PGR2_SU32_SUS256_SRVW4_TT1_64_VAW2_WG64_4_1_WGM1
    SolutionIndex: 93
    SolutionNameMin: Cijk_Ailk_Bjlk_BBH_MT64x128x16_MI32x32x8x1_SE_1LDSB0_AF0EM8_EPS0_GRVW2_GSU1_NLCA1_NLCB1_PGR2_SU0_SUS0_SRVW4_TT1_64_VAW2_WG64_4_1_WGM1
    SolutionIndex: 94
    SolutionNameMin: Cijk_Ailk_Bjlk_BBH_MT64x64x16_MI32x32x8x1_SE_1LDSB0_AF0EM1_EPS0_GRVW2_GSU1_NLCA1_NLCB1_PGR2_SU32_SUS128_SRVW4_TT1_32_VAW2_WG64_4_1_WGM2
    SolutionIndex: 95
    SolutionNameMin: Cijk_Ailk_Bjlk_BBH_MT64x64x16_MI32x32x8x1_SE_1LDSB0_AF0EM1_EPS0_GRVW2_GSU1_NLCA1_NLCB1_PGR2_SU32_SUS128_SRVW4_TT1_32_VAW2_WG64_4_1_WGM15
    SolutionIndex: 96
    SolutionNameMin: Cijk_Ailk_Bjlk_BBH_MT64x128x16_MI32x32x8x1_SE_1LDSB0_AF0EM1_EPS0_GRVW8_GSU1_NLCA1_NLCB1_PGR2_SU32_SUS128_SRVW4_TT1_64_VAW2_WG64_4_1_WGM2
    SolutionIndex: 97
    SolutionNameMin: Cijk_Ailk_Bjlk_BBH_MT128x96x16_MI32x32x8x1_SE_1LDSB0_AF0EM1_EPS1_GRVW2_GSU1_NLCA1_NLCB3_PGR1_SU0_SUS0_SRVW4_TT1_96_VAW2_WG128_2_1_WGM15
    SolutionIndex: 98
    SolutionNameMin: Cijk_Ailk_Bjlk_BBH_MT128x96x16_MI32x32x8x1_SE_1LDSB0_AF0EM1_EPS1_GRVW2_GSU1_NLCA1_NLCB3_PGR1_SU32_SUS256_SRVW4_TT1_96_VAW2_WG128_2_1_WGM15
    SolutionIndex: 99
    SolutionNameMin: Cijk_Ailk_Bjlk_BBH_MT64x128x16_MI32x32x8x1_SE_1LDSB0_AF0EM1_EPS0_GRVW8_GSU1_NLCA1_NLCB1_PGR2_SU0_SUS0_SRVW4_TT1_64_VAW2_WG64_4_1_WGM1
    SolutionIndex: 100
    SolutionNameMin: Cijk_Ailk_Bjlk_BBH_MT64x128x16_MI32x32x8x1_SE_1LDSB0_AF0EM1_EPS0_GRVW8_GSU1_NLCA1_NLCB1_PGR2_SU32_SUS128_SRVW4_TT1_64_VAW2_WG64_4_1_WGM1
    SolutionIndex: 101
    SolutionNameMin: Cijk_Ailk_Bjlk_BBH_MT64x128x16_MI32x32x8x1_SE_1LDSB0_AF0EM8_EPS0_GRVW4_GSU1_NLCA1_NLCB1_PGR2_SU32_SUS128_SRVW4_TT1_64_VAW2_WG64_4_1_WGM1
    SolutionIndex: 102
    SolutionNameMin: Cijk_Ailk_Bjlk_BBH_MT64x128x16_MI32x32x8x1_SE_1LDSB0_AF0EM8_EPS0_GRVW2_GSU1_NLCA1_NLCB1_PGR2_SU32_SUS128_SRVW4_TT1_64_VAW2_WG64_4_1_WGM1
    SolutionIndex: 103
    SolutionNameMin: Cijk_Ailk_Bjlk_BBH_MT64x64x16_MI32x32x8x1_SE_1LDSB0_AF0EM1_EPS1_GRVW2_GSU1_NLCA1_NLCB1_PGR1_SU0_SUS0_SRVW4_TT1_32_VAW2_WG64_4_1_WGM2
    SolutionIndex: 104
    SolutionNameMin: Cijk_Ailk_Bjlk_BBH_MT64x64x16_MI32x32x8x1_SE_1LDSB0_AF0EM1_EPS0_GRVW4_GSU1_NLCA1_NLCB1_PGR2_SU0_SUS0_SRVW4_TT1_32_VAW2_WG64_4_1_WGM1
    SolutionIndex: 105
    SolutionNameMin: Cijk_Ailk_Bjlk_BBH_MT128x64x16_MI32x32x8x1_SE_1LDSB0_AF0EM8_EPS0_GRVW8_GSU1_NLCA1_NLCB1_PGR2_SU0_SUS0_SRVW4_TT2_32_VAW2_WG64_4_1_WGM15
    SolutionIndex: 106
    SolutionNameMin: Cijk_Ailk_Bjlk_BBH_MT128x128x16_MI32x32x8x1_SE_1LDSB0_AF0EM1_EPS0_GRVW8_GSU1_NLCA1_NLCB1_PGR2_SU0_SUS0_SRVW4_TT2_64_VAW2_WG64_4_1_WGM15
    SolutionIndex: 107
    SolutionNameMin: Cijk_Ailk_Bjlk_BBH_MT64x128x16_MI32x32x8x1_SE_1LDSB0_AF0EM1_EPS0_GRVW4_GSU1_NLCA1_NLCB1_PGR2_SU0_SUS0_SRVW4_TT1_64_VAW2_WG64_4_1_WGM15
    SolutionIndex: 108
    SolutionNameMin: Cijk_Ailk_Bjlk_BBH_MT96x128x32_MI32x32x8x1_SE_1LDSB0_AF0EM1_EPS0_GRVW4_GSU1_NLCA3_NLCB1_PGR2_SU0_SUS0_SRVW0_TT3_32_VAW2_WG32_8_1_WGM1
    SolutionIndex: 109
    SolutionNameMin: Cijk_Ailk_Bjlk_BBH_MT128x128x16_MI32x32x8x1_SE_1LDSB0_AF0EM8_EPS0_GRVW8_GSU1_NLCA1_NLCB1_PGR2_SU0_SUS0_SRVW4_TT2_64_VAW2_WG64_4_1_WGM1
    SolutionIndex: 110
    SolutionNameMin: Cijk_Ailk_Bjlk_BBH_MT128x128x16_MI32x32x8x1_SE_1LDSB0_AF0EM8_EPS0_GRVW8_GSU1_NLCA1_NLCB1_PGR2_SU0_SUS0_SRVW4_TT2_64_VAW2_WG64_4_1_WGM15
    SolutionIndex: 111
    SolutionNameMin: Cijk_Ailk_Bjlk_BBH_MT128x128x16_MI32x32x8x1_SE_1LDSB0_AF0EM1_EPS0_GRVW8_GSU1_NLCA1_NLCB1_PGR2_SU0_SUS0_SRVW4_TT2_64_VAW2_WG64_4_1_WGM2
    SolutionIndex: 112
    SolutionNameMin: Cijk_Ailk_Bjlk_BBH_MT16x16x32_MI16x16x16x1_SE_1LDSB0_AF0EM8_EPS0_GRVW2_GSU5_NLCA1_NLCB1_PGR2_SU0_SUS0_SRVW0_TT1_16_VAW1_WG16_4_1_WGM1
    SolutionIndex: 113
    SolutionNameMin: Cijk_Ailk_Bjlk_BBH_MT64x64x32_MI32x32x8x1_SE_1LDSB0_AF0EM8_EPS0_GRVW8_GSU1_NLCA1_NLCB1_PGR2_SU32_SUS128_SRVW4_TT1_32_VAW2_WG64_4_1_WGM2
    SolutionIndex: 114
    SolutionNameMin: Cijk_Ailk_Bjlk_BBH_MT64x16x32_MI16x16x16x1_SE_1LDSB0_AF0EM8_EPS0_GRVW8_GSU15_NLCA1_NLCB1_PGR2_SU32_SUS128_SRVW0_TT1_16_VAW1_WG64_4_1_WGM2
    SolutionIndex: 115
    SolutionNameMin: Cijk_Ailk_Bjlk_BBH_MT128x256x16_MI32x32x8x1_SE_1LDSB0_AF0EM8_EPS0_GRVW8_GSU1_NLCA1_NLCB1_PGR2_SU0_SUS0_SRVW4_TT2_128_VAW2_WG64_4_1_WGM2
    SolutionIndex: 116
    SolutionNameMin: Cijk_Ailk_Bjlk_BBH_MT128x128x32_MI32x32x8x1_SE_1LDSB0_AF0EM1_EPS0_GRVW8_GSU1_NLCA1_NLCB1_PGR2_SU0_SUS0_SRVW4_TT2_64_VAW2_WG64_4_1_WGM15
    SolutionIndex: 117
    SolutionNameMin: Cijk_Ailk_Bjlk_BBH_MT32x64x64_MI16x16x16x1_SE_1LDSB0_AF0EM8_EPS0_GRVW8_GSU1_NLCA1_NLCB1_PGR2_SU0_SUS0_SRVW4_TT1_32_VAW2_WG32_8_1_WGM1
    SolutionIndex: 118
    SolutionNameMin: Cijk_Ailk_Bjlk_BBH_MT128x128x32_MI32x32x8x1_SE_1LDSB0_AF0EM1_EPS0_GRVW8_GSU1_NLCA1_NLCB1_PGR2_SU0_SUS0_SRVW4_TT2_64_VAW2_WG64_4_1_WGM2
    SolutionIndex: 119
    SolutionNameMin: Cijk_Ailk_Bjlk_BBH_MT128x96x32_MI32x32x8x1_SE_1LDSB0_AF0EM8_EPS0_GRVW4_GSU1_NLCA1_NLCB3_PGR2_SU0_SUS0_SRVW4_TT1_96_VAW2_WG128_2_1_WGM15
    SolutionIndex: 120
    SolutionNameMin: Cijk_Ailk_Bjlk_BBH_MT64x64x32_MI32x32x8x1_SE_1LDSB0_AF0EM8_EPS0_GRVW8_GSU1_NLCA1_NLCB1_PGR2_SU32_SUS128_SRVW4_TT1_32_VAW2_WG64_4_1_WGM1
    SolutionIndex: 121
    SolutionNameMin: Cijk_Ailk_Bjlk_BBH_MT128x96x16_MI32x32x8x1_SE_1LDSB0_AF0EM8_EPS0_GRVW2_GSU1_NLCA1_NLCB3_PGR2_SU0_SUS0_SRVW4_TT1_96_VAW2_WG128_2_1_WGM15
    SolutionIndex: 122
    SolutionNameMin: Cijk_Ailk_Bjlk_BBH_MT128x64x64_MI32x32x8x1_SE_1LDSB0_AF0EM1_EPS0_GRVW8_GSU1_NLCA1_NLCB1_PGR2_SU32_SUS256_SRVW4_TT2_32_VAW2_WG64_4_1_WGM15
    SolutionIndex: 123
    SolutionNameMin: Cijk_Ailk_Bjlk_BBH_MT128x64x16_MI32x32x8x1_SE_1LDSB0_AF0EM8_EPS0_GRVW4_GSU1_NLCA1_NLCB1_PGR2_SU0_SUS0_SRVW4_TT2_32_VAW2_WG64_4_1_WGM15
    SolutionIndex: 124
    SolutionNameMin: Cijk_Ailk_Bjlk_BBH_MT128x96x16_MI32x32x8x1_SE_1LDSB0_AF0EM1_EPS0_GRVW2_GSU1_NLCA1_NLCB3_PGR2_SU0_SUS0_SRVW4_TT1_96_VAW2_WG128_2_1_WGM1
    SolutionIndex: 125
    SolutionNameMin: Cijk_Ailk_Bjlk_BBH_MT256x128x32_MI32x32x8x1_SE_1LDSB0_AF0EM8_EPS1_GRVW8_GSU1_NLCA1_NLCB1_PGR1_SU0_SUS0_SRVW4_TT4_64_VAW2_WG64_4_1_WGM15
    SolutionIndex: 126
    SolutionNameMin: Cijk_Ailk_Bjlk_BBH_MT96x128x32_MI32x32x8x1_SE_1LDSB0_AF0EM8_EPS0_GRVW4_GSU1_NLCA3_NLCB1_PGR2_SU0_SUS0_SRVW0_TT3_32_VAW2_WG32_8_1_WGM1
    SolutionIndex: 127
    SolutionNameMin: Cijk_Ailk_Bjlk_BBH_MT128x256x16_MI32x32x8x1_SE_1LDSB1_AF0EM1_EPS0_GRVW8_GSU1_NLCA1_NLCB1_PGR2_SU0_SUS0_SRVW4_TT2_128_VAW2_WG64_4_1_WGM1
    SolutionIndex: 128
    SolutionNameMin: Cijk_Ailk_Bjlk_BBH_MT64x128x32_MI32x32x8x1_SE_1LDSB0_AF0EM8_EPS0_GRVW4_GSU1_NLCA1_NLCB1_PGR2_SU32_SUS256_SRVW4_TT1_64_VAW2_WG64_4_1_WGM15
    SolutionIndex: 129
    SolutionNameMin: Cijk_Ailk_Bjlk_BBH_MT128x256x16_MI32x32x8x1_SE_1LDSB0_AF0EM1_EPS0_GRVW8_GSU1_NLCA1_NLCB1_PGR2_SU0_SUS0_SRVW4_TT2_128_VAW2_WG64_4_1_WGM1
    SolutionIndex: 130
    SolutionNameMin: Cijk_Ailk_Bjlk_BBH_MT128x256x16_MI32x32x8x1_SE_1LDSB0_AF0EM1_EPS0_GRVW8_GSU1_NLCA1_NLCB1_PGR2_SU0_SUS0_SRVW4_TT2_128_VAW2_WG64_4_1_WGM15
    SolutionIndex: 131
    SolutionNameMin: Cijk_Ailk_Bjlk_BBH_MT128x64x16_MI32x32x8x1_SE_1LDSB0_AF0EM8_EPS0_GRVW8_GSU1_NLCA1_NLCB1_PGR2_SU32_SUS128_SRVW4_TT2_32_VAW2_WG64_4_1_WGM1
    SolutionIndex: 132
    SolutionNameMin: Cijk_Ailk_Bjlk_BBH_MT96x128x32_MI32x32x8x1_SE_1LDSB0_AF0EM8_EPS0_GRVW4_GSU1_NLCA3_NLCB1_PGR2_SU32_SUS256_SRVW0_TT3_32_VAW2_WG32_8_1_WGM2
    SolutionIndex: 133
    SolutionNameMin: Cijk_Ailk_Bjlk_BBH_MT128x64x16_MI32x32x8x1_SE_1LDSB0_AF0EM8_EPS0_GRVW4_GSU1_NLCA1_NLCB1_PGR2_SU0_SUS0_SRVW4_TT2_32_VAW2_WG64_4_1_WGM2
    SolutionIndex: 134
    SolutionNameMin: Cijk_Ailk_Bjlk_BBH_MT64x128x64_MI32x32x8x1_SE_1LDSB0_AF0EM8_EPS0_GRVW8_GSU1_NLCA1_NLCB1_PGR2_SU0_SUS0_SRVW4_TT1_64_VAW2_WG64_4_1_WGM15
    SolutionIndex: 135
    SolutionNameMin: Cijk_Ailk_Bjlk_BBH_MT128x128x32_MI32x32x8x1_SE_1LDSB0_AF0EM8_EPS0_GRVW8_GSU3_NLCA1_NLCB1_PGR2_SU0_SUS0_SRVW4_TT2_64_VAW1_WG64_4_1_WGM1
    SolutionIndex: 136
    SolutionNameMin: Cijk_Ailk_Bjlk_BBH_MT128x128x32_MI32x32x8x1_SE_1LDSB0_AF0EM8_EPS0_GRVW8_GSU3_NLCA1_NLCB1_PGR2_SU0_SUS0_SRVW4_TT2_64_VAW1_WG64_4_1_WGM15
    SolutionIndex: 137
    SolutionNameMin: Cijk_Ailk_Bjlk_BBH_MT64x64x64_MI32x32x8x1_SE_1LDSB0_AF0EM8_EPS1_GRVW8_GSU5_NLCA1_NLCB1_PGR1_SU0_SUS0_SRVW0_TT1_32_VAW1_WG64_4_1_WGM2
    SolutionIndex: 138
    SolutionNameMin: Cijk_Ailk_Bjlk_BBH_MT64x64x64_MI32x32x8x1_SE_1LDSB0_AF0EM8_EPS1_GRVW8_GSU5_NLCA1_NLCB1_PGR1_SU0_SUS0_SRVW0_TT1_32_VAW1_WG64_4_1_WGM1
    SolutionIndex: 139
    SolutionNameMin: Cijk_Ailk_Bjlk_BBH_MT128x256x16_MI32x32x8x1_SE_1LDSB0_AF0EM8_EPS0_GRVW8_GSU15_NLCA1_NLCB1_PGR2_SU0_SUS0_SRVW4_TT2_128_VAW1_WG64_4_1_WGM2
    SolutionIndex: 140
    SolutionNameMin: Cijk_Ailk_Bjlk_BBH_MT64x64x16_MI32x32x8x1_SE_1LDSB0_AF0EM8_EPS0_GRVW8_GSU1_NLCA1_NLCB1_PGR2_SU0_SUS0_SRVW4_TT1_32_VAW2_WG64_4_1_WGM1
    SolutionIndex: 141
    SolutionNameMin: Cijk_Ailk_Bjlk_BBH_MT64x128x16_MI32x32x8x1_SE_1LDSB0_AF0EM8_EPS1_GRVW2_GSU1_NLCA1_NLCB1_PGR1_SU32_SUS128_SRVW4_TT1_64_VAW2_WG64_4_1_WGM15
    SolutionIndex: 142
    SolutionNameMin: Cijk_Ailk_Bjlk_BBH_MT128x64x16_MI32x32x8x1_SE_1LDSB0_AF0EM8_EPS0_GRVW8_GSU1_NLCA1_NLCB1_PGR2_SU32_SUS256_SRVW4_TT2_32_VAW2_WG64_4_1_WGM1
    SolutionIndex: 143
    SolutionNameMin: Cijk_Ailk_Bjlk_BBH_MT128x64x16_MI32x32x8x1_SE_1LDSB0_AF0EM8_EPS0_GRVW2_GSU1_NLCA1_NLCB1_PGR2_SU0_SUS0_SRVW4_TT2_32_VAW2_WG64_4_1_WGM1
    SolutionIndex: 144
    SolutionNameMin: Cijk_Ailk_Bjlk_BBH_MT32x32x64_MI16x16x16x1_SE_1LDSB0_AF0EM1_EPS0_GRVW8_GSU7_NLCA1_NLCB1_PGR2_SU32_SUS256_SRVW4_TT1_16_VAW1_WG32_8_1_WGM1
    SolutionIndex: 145
    SolutionNameMin: Cijk_Ailk_Bjlk_BBH_MT16x16x32_MI16x16x16x1_SE_1LDSB0_AF0EM1_EPS0_GRVW4_GSU1_NLCA1_NLCB1_PGR2_SU32_SUS128_SRVW0_TT1_16_VAW2_WG16_4_1_WGM1
    SolutionIndex: 146
    SolutionNameMin: Cijk_Ailk_Bjlk_BBH_MT128x160x32_MI32x32x8x1_SE_1LDSB0_AF0EM8_EPS0_GRVW4_GSU1_NLCA1_NLCB5_PGR2_SU0_SUS0_SRVW4_TT1_160_VAW2_WG128_2_1_WGM2
    SolutionIndex: 147
    SolutionNameMin: Cijk_Ailk_Bjlk_BBH_MT64x32x16_MI16x16x16x1_SE_1LDSB0_AF0EM8_EPS1_GRVW2_GSU1_NLCA1_NLCB1_PGR1_SU32_SUS128_SRVW4_TT2_16_VAW2_WG32_8_1_WGM1
    SolutionIndex: 148
    SolutionNameMin: Cijk_Ailk_Bjlk_BBH_MT64x64x16_MI32x32x8x1_SE_1LDSB0_AF0EM8_EPS0_GRVW2_GSU1_NLCA1_NLCB1_PGR2_SU0_SUS0_SRVW4_TT1_32_VAW2_WG64_4_1_WGM2
    SolutionIndex: 149
    SolutionNameMin: Cijk_Ailk_Bjlk_BBH_MT128x128x16_MI32x32x8x1_SE_1LDSB0_AF0EM8_EPS0_GRVW8_GSU1_NLCA1_NLCB1_PGR2_SU32_SUS256_SRVW4_TT2_64_VAW2_WG64_4_1_WGM1
    SolutionIndex: 150
    SolutionNameMin: Cijk_Ailk_Bjlk_BBH_MT128x128x16_MI32x32x8x1_SE_1LDSB0_AF0EM1_EPS0_GRVW8_GSU1_NLCA1_NLCB1_PGR2_SU0_SUS0_SRVW4_TT2_64_VAW2_WG64_4_1_WGM1
    SolutionIndex: 151
    SolutionNameMin: Cijk_Ailk_Bjlk_BBH_MT32x32x32_MI16x16x16x1_SE_1LDSB0_AF0EM1_EPS0_GRVW2_GSU1_NLCA1_NLCB1_PGR2_SU0_SUS0_SRVW4_TT1_16_VAW2_WG32_8_1_WGM1
    SolutionIndex: 152
    SolutionNameMin: Cijk_Ailk_Bjlk_BBH_MT128x64x64_MI32x32x8x1_SE_1LDSB0_AF0EM8_EPS0_GRVW8_GSU1_NLCA1_NLCB1_PGR2_SU0_SUS0_SRVW4_TT2_32_VAW2_WG64_4_1_WGM2
    SolutionIndex: 153
    SolutionNameMin: Cijk_Ailk_Bjlk_BBH_MT64x128x32_MI32x32x8x1_SE_1LDSB0_AF0EM1_EPS0_GRVW4_GSU1_NLCA1_NLCB1_PGR2_SU0_SUS0_SRVW4_TT1_64_VAW2_WG64_4_1_WGM15
    SolutionIndex: 154
    SolutionNameMin: Cijk_Ailk_Bjlk_BBH_MT64x64x64_MI32x32x8x1_SE_1LDSB0_AF0EM8_EPS1_GRVW8_GSU7_NLCA1_NLCB1_PGR1_SU0_SUS0_SRVW0_TT1_32_VAW1_WG64_4_1_WGM1
    SolutionIndex: 155
    SolutionNameMin: Cijk_Ailk_Bjlk_BBH_MT32x32x64_MI16x16x16x1_SE_1LDSB0_AF0EM8_EPS0_GRVW4_GSU1_NLCA1_NLCB1_PGR2_SU0_SUS0_SRVW4_TT1_16_VAW2_WG32_8_1_WGM2
    SolutionIndex: 156
    SolutionNameMin: Cijk_Ailk_Bjlk_BBH_MT128x192x16_MI32x32x8x1_SE_1LDSB0_AF0EM8_EPS0_GRVW4_GSU1_NLCA1_NLCB3_PGR2_SU0_SUS0_SRVW4_TT2_96_VAW2_WG64_4_1_WGM15
    SolutionIndex: 157
    SolutionNameMin: Cijk_Ailk_Bjlk_BBH_MT128x128x16_MI32x32x8x1_SE_1LDSB0_AF0EM8_EPS0_GRVW4_GSU1_NLCA1_NLCB1_PGR2_SU0_SUS0_SRVW4_TT2_64_VAW2_WG64_4_1_WGM1
    SolutionIndex: 158
    SolutionNameMin: Cijk_Ailk_Bjlk_BBH_MT64x192x16_MI32x32x8x1_SE_1LDSB0_AF0EM8_EPS0_GRVW4_GSU1_NLCA1_NLCB3_PGR2_SU0_SUS0_SRVW4_TT1_96_VAW2_WG64_4_1_WGM15
    SolutionIndex: 159
    SolutionNameMin: Cijk_Ailk_Bjlk_BBH_MT128x128x32_MI32x32x8x1_SE_1LDSB0_AF0EM8_EPS1_GRVW8_GSU1_NLCA1_NLCB1_PGR1_SU0_SUS0_SRVW4_TT2_64_VAW2_WG64_4_1_WGM1
    SolutionIndex: 160
    SolutionNameMin: Cijk_Ailk_Bjlk_BBH_MT32x32x16_MI16x16x16x1_SE_1LDSB0_AF0EM8_EPS1_GRVW4_GSU1_NLCA1_NLCB1_PGR1_SU0_SUS0_SRVW4_TT1_16_VAW2_WG32_8_1_WGM15
    SolutionIndex: 161
    SolutionNameMin: Cijk_Ailk_Bjlk_BBH_MT32x32x16_MI16x16x16x1_SE_1LDSB0_AF0EM8_EPS0_GRVW4_GSU1_NLCA1_NLCB1_PGR2_SU0_SUS0_SRVW4_TT1_16_VAW2_WG32_8_1_WGM1
    SolutionIndex: 162
    SolutionNameMin: Cijk_Ailk_Bjlk_BBH_MT32x32x64_MI16x16x16x1_SE_1LDSB0_AF0EM8_EPS0_GRVW4_GSU1_NLCA1_NLCB1_PGR2_SU32_SUS128_SRVW4_TT1_16_VAW2_WG32_8_1_WGM1
    SolutionIndex: 163
    SolutionNameMin: Cijk_Ailk_Bjlk_BBH_MT64x32x16_MI16x16x16x1_SE_1LDSB0_AF0EM8_EPS0_GRVW8_GSU1_NLCA1_NLCB1_PGR2_SU32_SUS128_SRVW4_TT2_16_VAW2_WG32_8_1_WGM2
    SolutionIndex: 164
    SolutionNameMin: Cijk_Ailk_Bjlk_BBH_MT64x128x16_MI32x32x8x1_SE_1LDSB0_AF0EM8_EPS0_GRVW8_GSU1_NLCA1_NLCB1_PGR2_SU32_SUS256_SRVW4_TT1_64_VAW2_WG64_4_1_WGM2
    SolutionIndex: 165
    SolutionNameMin: Cijk_Ailk_Bjlk_BBH_MT64x128x16_MI32x32x8x1_SE_1LDSB0_AF0EM8_EPS0_GRVW8_GSU1_NLCA1_NLCB1_PGR2_SU32_SUS128_SRVW4_TT1_64_VAW2_WG64_4_1_WGM2
    SolutionIndex: 166
    SolutionNameMin: Cijk_Ailk_Bjlk_BBH_MT64x32x16_MI16x16x16x1_SE_1LDSB0_AF0EM8_EPS0_GRVW2_GSU1_NLCA1_NLCB1_PGR2_SU32_SUS128_SRVW4_TT2_16_VAW2_WG32_8_1_WGM1
    SolutionIndex: 167
    SolutionNameMin: Cijk_Ailk_Bjlk_BBH_MT128x128x32_MI32x32x8x1_SE_1LDSB0_AF0EM1_EPS0_GRVW8_GSU1_NLCA1_NLCB1_PGR2_SU0_SUS0_SRVW4_TT2_64_VAW2_WG64_4_1_WGM1
    SolutionIndex: 168
    SolutionNameMin: Cijk_Ailk_Bjlk_BBH_MT64x64x32_MI32x32x8x1_SE_1LDSB0_AF0EM1_EPS0_GRVW4_GSU1_NLCA1_NLCB1_PGR2_SU0_SUS0_SRVW4_TT1_32_VAW2_WG64_4_1_WGM1
    SolutionIndex: 169
    SolutionNameMin: Cijk_Ailk_Bjlk_BBH_MT32x32x16_MI16x16x16x1_SE_1LDSB0_AF0EM1_EPS0_GRVW4_GSU1_NLCA1_NLCB1_PGR2_SU0_SUS0_SRVW4_TT1_16_VAW2_WG32_8_1_WGM1
    SolutionIndex: 170
    SolutionNameMin: Cijk_Ailk_Bjlk_BBH_MT32x32x16_MI16x16x16x1_SE_1LDSB0_AF0EM1_EPS1_GRVW2_GSU1_NLCA1_NLCB1_PGR1_SU0_SUS0_SRVW4_TT1_16_VAW2_WG32_8_1_WGM1
    SolutionIndex: 171
    SolutionNameMin: Cijk_Ailk_Bjlk_BBH_MT64x128x32_MI32x32x8x1_SE_1LDSB0_AF0EM1_EPS0_GRVW4_GSU1_NLCA1_NLCB1_PGR2_SU0_SUS0_SRVW4_TT1_64_VAW2_WG64_4_1_WGM2
    SolutionIndex: 172
    SolutionNameMin: Cijk_Ailk_Bjlk_BBH_MT128x128x16_MI32x32x8x1_SE_1LDSB0_AF0EM1_EPS0_GRVW8_GSU1_NLCA1_NLCB1_PGR2_SU32_SUS128_SRVW4_TT2_64_VAW2_WG64_4_1_WGM1
    SolutionIndex: 173
    SolutionNameMin: Cijk_Ailk_Bjlk_BBH_MT32x64x16_MI16x16x16x1_SE_1LDSB0_AF0EM1_EPS0_GRVW8_GSU1_NLCA1_NLCB1_PGR2_SU32_SUS256_SRVW4_TT1_32_VAW2_WG32_8_1_WGM2
    SolutionIndex: 174
    SolutionNameMin: Cijk_Ailk_Bjlk_BBH_MT16x16x16_MI16x16x16x1_SE_1LDSB0_AF0EM1_EPS1_GRVW2_GSU1_NLCA1_NLCB1_PGR1_SU32_SUS128_SRVW0_TT1_16_VAW2_WG16_4_1_WGM15
    SolutionIndex: 175
    SolutionNameMin: Cijk_Ailk_Bjlk_BBH_MT128x128x32_MI32x32x8x1_SE_1LDSB0_EPS1_GRVW8_NLCA1_NLCB1_PGR1_SU16_SUS128_SRVW4_TT2_64_WG64_4_1_WGM15
    SolutionIndex: 176
    SolutionNameMin: Cijk_Ailk_Bjlk_BBH_MT128x256x32_MI32x32x8x1_SE_1LDSB1_EPS1_GRVW8_NLCA1_NLCB1_PGR1_SU16_SUS128_SRVW4_TT2_128_WG64_4_1_WGM1
    SolutionIndex: 177
    SolutionNameMin: Cijk_Ailk_Bjlk_BBH_MT128x256x32_MI32x32x8x1_SE_1LDSB1_EPS1_GRVW8_NLCA1_NLCB1_PGR1_SU0_SUS0_SRVW4_TT2_128_WG64_4_1_WGM2
    SolutionIndex: 178
    SolutionNameMin: Cijk_Ailk_Bjlk_BBH_MT128x256x32_MI32x32x8x1_SE_1LDSB1_EPS1_GRVW8_NLCA1_NLCB1_PGR1_SU0_SUS0_SRVW4_TT2_128_WG64_4_1_WGM1
- - - [34, 64, 1, 34]
    - [13, 0.007]
  - - [32, 64, 1, 35]
    - [14, 0.007]
  - - [64, 21, 1, 17]
    - [15, 0.002]
  - - [64, 32, 1, 35]
    - [14, 0.007]
  - - [21, 64, 1, 21]
    - [16, 0.003]
  - - [64, 30, 1, 31]
    - [17, 0.006]
  - - [15, 64, 1, 15]
    - [0, 0.001]
  - - [64, 24, 1, 24]
    - [18, 0.004]
  - - [17, 64, 1, 15]
    - [19, 0.002]
  - - [64, 35, 1, 35]
    - [18, 0.008]
  - - [32, 64, 1, 32]
    - [14, 0.007]
  - - [64, 34, 1, 24]
    - [15, 0.006]
  - - [64, 15, 1, 15]
    - [2, 0.001]
  - - [30, 64, 1, 30]
    - [19, 0.006]
  - - [30, 64, 1, 31]
    - [18, 0.006]
  - - [34, 64, 1, 24]
    - [19, 0.005]
  - - [64, 30, 1, 30]
    - [20, 0.007]
  - - [14, 64, 1, 14]
    - [13, 0.002]
  - - [64, 17, 1, 17]
    - [1, 0.001]
  - - [64, 17, 1, 15]
    - [14, 0.002]
  - - [64, 32, 1, 32]
    - [16, 0.008]
  - - [64, 31, 1, 31]
    - [21, 0.006]
  - - [17, 64, 1, 17]
    - [3, 0.002]
  - - [64, 21, 1, 21]
    - [21, 0.003]
  - - [35, 64, 1, 35]
    - [22, 0.008]
  - - [31, 64, 1, 31]
    - [19, 0.006]
  - - [21, 64, 1, 17]
    - [18, 0.002]
  - - [64, 15, 1, 15]
    - [15, 0.002]
  - - [64, 17, 1, 17]
    - [14, 0.002]
  - - [17, 64, 1, 17]
    - [16, 0.002]
  - - [64, 34, 1, 34]
    - [14, 0.007]
  - - [15, 64, 1, 14]
    - [13, 0.002]
  - - [24, 64, 1, 24]
    - [14, 0.004]
  - - [64, 14, 1, 14]
    - [23, 0.001]
  - - [15, 64, 1, 15]
    - [16, 0.002]
  - - [64, 15, 1, 14]
    - [15, 0.001]
  - - [64, 128, 512, 128]
    - [24, 16.044]
  - - [64, 512, 1, 512]
    - [25, 1.212]
  - - [64, 512, 64, 512]
    - [26, 29.011]
  - - [128, 64, 512, 128]
    - [27, 15.391]
  - - [512, 64, 1, 512]
    - [25, 1.227]
  - - [512, 64, 64, 512]
    - [28, 28.199]
  - - [1024, 2, 1, 4]
    - [14, 0.001]
  - - [1024, 2, 1, 32]
    - [29, 0.008]
  - - [1024, 2, 1, 2048]
    - [18, 0.151]
  - - [1024, 1024, 1, 4]
    - [30, 0.342]
  - - [1024, 1024, 1, 32]
    - [30, 2.681]
  - - [1024, 1024, 1, 2048]
    - [31, 35.373]
  - - [1024, 1024, 1, 4096]
    - [31, 43.166]
  - - [1024, 4096, 1, 2048]
    - [32, 56.169]
  - - [1024, 4096, 1, 4096]
    - [33, 63.483]
  - - [1024, 30528, 1, 2048]
    - [34, 73.851]
  - - [1024, 30528, 1, 4096]
    - [35, 77.929]
  - - [4096, 1024, 1, 2048]
    - [36, 56.464]
  - - [4096, 1024, 1, 4096]
    - [37, 63.65]
  - - [3, 64, 512, 3]
    - [20, 0.024]
  - - [5, 64, 512, 5]
    - [19, 0.062]
  - - [5, 64, 960, 5]
    - [20, 0.098]
  - - [9, 64, 512, 9]
    - [20, 0.202]
  - - [13, 512, 1, 32768]
    - [38, 3.389]
  - - [27, 128, 32768, 27]
    - [39, 3.725]
  - - [33, 32, 200, 33]
    - [19, 0.582]
  - - [33, 32, 1600, 33]
    - [19, 1.848]
  - - [67, 2048, 1, 512]
    - [40, 4.397]
  - - [74, 2048, 1, 512]
    - [40, 4.751]
  - - [74, 2048, 1, 960]
    - [40, 6.83]
  - - [100, 2048, 1, 512]
    - [41, 5.521]
  - - [256, 128, 1, 32768]
    - [42, 15.63]
  - - [256, 1280, 1, 8976]
    - [43, 30.626]
  - - [256, 2560, 1, 8976]
    - [44, 46.121]
  - - [256, 2816, 1, 8976]
    - [44, 49.866]
  - - [256, 3328, 1, 8976]
    - [45, 52.955]
  - - [256, 3584, 1, 8976]
    - [46, 46.416]
  - - [256, 3840, 1, 8976]
    - [47, 49.386]
  - - [256, 4096, 1, 8976]
    - [47, 51.879]
  - - [256, 4352, 1, 8976]
    - [47, 54.246]
  - - [256, 4864, 1, 8976]
    - [48, 56.266]
  - - [256, 5120, 1, 8976]
    - [48, 59.307]
  - - [256, 5632, 1, 8976]
    - [49, 59.271]
  - - [256, 5888, 1, 8976]
    - [49, 61.739]
  - - [256, 6144, 1, 8976]
    - [50, 63.778]
  - - [256, 7168, 1, 8976]
    - [51, 55.912]
  - - [256, 8192, 1, 8976]
    - [51, 63.101]
  - - [256, 8960, 1, 8976]
    - [52, 63.431]
  - - [256, 9728, 1, 8976]
    - [53, 67.884]
  - - [256, 9984, 1, 8976]
    - [52, 70.506]
  - - [256, 10240, 1, 8976]
    - [52, 71.092]
  - - [256, 10496, 1, 8976]
    - [52, 72.558]
  - - [256, 11008, 1, 8976]
    - [32, 62.511]
  - - [256, 11264, 1, 8976]
    - [36, 63.894]
  - - [256, 11520, 1, 8976]
    - [54, 65.132]
  - - [256, 11776, 1, 8976]
    - [54, 66.391]
  - - [256, 12544, 1, 8976]
    - [54, 70.11]
  - - [256, 12800, 1, 8976]
    - [55, 71.234]
  - - [256, 13312, 1, 8976]
    - [36, 73.624]
  - - [256, 13568, 1, 8976]
    - [36, 74.816]
  - - [256, 14336, 1, 8976]
    - [56, 65.864]
  - - [256, 14848, 1, 8976]
    - [56, 67.855]
  - - [256, 15104, 1, 8976]
    - [56, 68.916]
  - - [256, 15872, 1, 8976]
    - [33, 68.077]
  - - [256, 16128, 1, 8976]
    - [33, 68.787]
  - - [256, 17152, 1, 8976]
    - [57, 72.866]
  - - [256, 17408, 1, 8976]
    - [58, 73.64]
  - - [256, 18688, 1, 8976]
    - [55, 70.537]
  - - [256, 19968, 1, 8976]
    - [32, 74.65]
  - - [256, 20480, 1, 8976]
    - [49, 76.234]
  - - [256, 20992, 1, 8976]
    - [55, 77.938]
  - - [256, 21248, 1, 8976]
    - [59, 63.258]
  - - [256, 22016, 1, 8976]
    - [59, 65.522]
  - - [256, 26112, 1, 8976]
    - [60, 75.414]
  - - [256, 32512, 1, 8976]
    - [32, 74.178]
  - - [256, 32768, 1, 1]
    - [61, 0.218]
  - - [256, 33536, 1, 8976]
    - [32, 76.219]
  - - [256, 44505, 1, 8976]
    - [54, 72.219]
  - - [257, 4096, 1, 1024]
    - [62, 26.459]
  - - [480, 1024, 1, 32768]
    - [63, 47.728]
  - - [512, 32, 1, 200]
    - [64, 0.251]
  - - [512, 32, 1, 1600]
    - [65, 1.284]
  - - [512, 256, 1, 32768]
    - [42, 32.873]
  - - [512, 512, 1, 200]
    - [41, 3.669]
  - - [512, 512, 1, 1600]
    - [66, 14.63]
  - - [512, 2048, 1, 256]
    - [67, 15.047]
  - - [560, 1024, 1, 200]
    - [68, 6.695]
  - - [560, 1024, 1, 1600]
    - [69, 24.152]
  - - [768, 2048, 1, 256]
    - [70, 19.639]
  - - [1024, 64, 1, 512]
    - [25, 2.378]
  - - [1024, 64, 1, 960]
    - [25, 3.79]
  - - [1024, 256, 1, 1024]
    - [71, 11.677]
  - - [1024, 256, 1, 1280]
    - [69, 12.991]
  - - [1024, 256, 1, 2304]
    - [69, 16.719]
  - - [1024, 256, 1, 2816]
    - [69, 17.696]
  - - [1024, 256, 1, 3072]
    - [69, 18.63]
  - - [1024, 256, 1, 3328]
    - [69, 19.198]
  - - [1024, 256, 1, 3584]
    - [69, 19.639]
  - - [1024, 256, 1, 4096]
    - [69, 20.264]
  - - [1024, 256, 1, 4352]
    - [69, 20.338]
  - - [1024, 256, 1, 4608]
    - [72, 20.496]
  - - [1024, 256, 1, 5120]
    - [73, 21.633]
  - - [1024, 256, 1, 5376]
    - [74, 22.176]
  - - [1024, 256, 1, 5632]
    - [73, 22.693]
  - - [1024, 256, 1, 6144]
    - [73, 24.066]
  - - [1024, 256, 1, 6400]
    - [73, 24.327]
  - - [1024, 256, 1, 7680]
    - [73, 26.812]
  - - [1024, 256, 1, 7936]
    - [73, 27.254]
  - - [1024, 256, 1, 8192]
    - [73, 27.557]
  - - [1024, 256, 1, 8448]
    - [75, 27.449]
  - - [1024, 256, 1, 9728]
    - [73, 30.085]
  - - [1024, 256, 1, 9984]
    - [73, 30.12]
  - - [1024, 256, 1, 10496]
    - [73, 30.876]
  - - [1024, 256, 1, 11520]
    - [73, 31.888]
  - - [1024, 256, 1, 12032]
    - [73, 32.394]
  - - [1024, 256, 1, 13568]
    - [73, 34.309]
  - - [1024, 256, 1, 14336]
    - [73, 34.706]
  - - [1024, 256, 1, 14848]
    - [73, 34.998]
  - - [1024, 256, 1, 15104]
    - [73, 35.517]
  - - [1024, 256, 1, 15872]
    - [73, 36.227]
  - - [1024, 256, 1, 16128]
    - [73, 36.168]
  - - [1024, 256, 1, 17152]
    - [73, 36.497]
  - - [1024, 256, 1, 17408]
    - [73, 36.83]
  - - [1024, 256, 1, 18944]
    - [73, 37.5]
  - - [1024, 256, 1, 19712]
    - [73, 37.804]
  - - [1024, 256, 1, 19968]
    - [73, 38.073]
  - - [1024, 256, 1, 21248]
    - [73, 38.103]
  - - [1024, 256, 1, 21504]
    - [73, 38.609]
  - - [1024, 256, 1, 22016]
    - [73, 38.959]
  - - [1024, 256, 1, 28672]
    - [76, 41.552]
  - - [1024, 256, 1, 33536]
    - [76, 35.59]
  - - [1024, 512, 1, 32768]
    - [63, 51.287]
  - - [1024, 1024, 1, 200]
    - [67, 11.305]
  - - [1024, 1024, 1, 512]
    - [71, 21.995]
  - - [1024, 1024, 1, 960]
    - [66, 28.353]
  - - [1024, 1024, 1, 1600]
    - [67, 32.534]
  - - [1024, 1024, 1, 32768]
    - [46, 60.781]
  - - [1600, 1024, 1, 512]
    - [26, 30.785]
  - - [1600, 1024, 1, 960]
    - [77, 39.205]
  - - [2048, 256, 1, 1024]
    - [69, 19.512]
  - - [2048, 960, 1, 1]
    - [61, 0.118]
  - - [2048, 2048, 1, 512]
    - [78, 39.277]
  - - [2048, 2048, 1, 960]
    - [78, 48.416]
  - - [2048, 2048, 1, 1024]
    - [36, 49.027]
  - - [3200, 2048, 1, 1024]
    - [59, 58.657]
  - - [4096, 4096, 1, 1024]
    - [59, 64.606]
  - - [14, 64, 10880, 14]
    - [17, 1.484]
  - - [15, 64, 10880, 14]
    - [17, 1.554]
  - - [15, 64, 7680, 15]
    - [17, 1.583]
  - - [15, 64, 10880, 15]
    - [17, 1.653]
  - - [17, 64, 7680, 15]
    - [39, 1.376]
  - - [17, 64, 6144, 17]
    - [39, 1.447]
  - - [17, 64, 7680, 17]
    - [39, 1.499]
  - - [21, 64, 6144, 17]
    - [39, 1.779]
  - - [21, 64, 6144, 21]
    - [79, 2.159]
  - - [24, 64, 4736, 24]
    - [80, 3.544]
  - - [30, 64, 2048, 30]
    - [79, 2.896]
  - - [30, 64, 2048, 31]
    - [39, 2.999]
  - - [31, 64, 2048, 31]
    - [81, 2.708]
  - - [32, 64, 4608, 32]
    - [82, 7.044]
  - - [32, 64, 4608, 35]
    - [83, 6.071]
  - - [34, 64, 4736, 24]
    - [84, 2.301]
  - - [34, 64, 4736, 34]
    - [39, 3.141]
  - - [35, 64, 4608, 35]
    - [79, 3.243]
  - - [64, 14, 10880, 14]
    - [14, 1.855]
  - - [64, 15, 10880, 14]
    - [15, 1.947]
  - - [64, 15, 7680, 15]
    - [15, 1.968]
  - - [64, 15, 10880, 15]
    - [15, 2.084]
  - - [64, 17, 7680, 15]
    - [85, 1.978]
  - - [64, 17, 6144, 17]
    - [86, 2.029]
  - - [64, 17, 7680, 17]
    - [61, 2.098]
  - - [64, 21, 6144, 17]
    - [87, 2.479]
  - - [64, 21, 6144, 21]
    - [85, 3.02]
  - - [64, 24, 4736, 24]
    - [85, 3.704]
  - - [64, 30, 2048, 30]
    - [85, 4.372]
  - - [64, 30, 2048, 31]
    - [85, 4.518]
  - - [64, 31, 2048, 31]
    - [85, 4.52]
  - - [64, 32, 4608, 32]
    - [87, 7.578]
  - - [64, 32, 4608, 35]
    - [87, 6.438]
  - - [64, 34, 4736, 24]
    - [88, 3.87]
  - - [64, 34, 4736, 34]
    - [89, 5.048]
  - - [64, 35, 4608, 35]
    - [90, 5.218]
  - - [1024, 1024, 1, 3840]
    - [31, 42.677]
  - - [1024, 1024, 1, 3968]
    - [31, 43.567]
  - - [1024, 1024, 1, 6528]
    - [47, 48.904]
  - - [1024, 1024, 1, 7104]
    - [47, 49.31]
  - - [1024, 1024, 1, 7200]
    - [46, 50.421]
  - - [1024, 1024, 1, 8064]
    - [46, 51.246]
  - - [1024, 1024, 1, 8160]
    - [47, 51.579]
  - - [1024, 1024, 1, 9216]
    - [47, 53.74]
  - - [1024, 1024, 1, 9520]
    - [47, 53.89]
  - - [1024, 1024, 1, 10064]
    - [48, 49.914]
  - - [1024, 1024, 1, 10080]
    - [48, 49.701]
  - - [1024, 1024, 1, 10200]
    - [48, 49.753]
  - - [1024, 4096, 1, 3840]
    - [58, 62.508]
  - - [1024, 4096, 1, 3968]
    - [57, 63.284]
  - - [1024, 4096, 1, 6528]
    - [58, 68.4]
  - - [1024, 4096, 1, 7104]
    - [58, 68.777]
  - - [1024, 4096, 1, 7200]
    - [33, 69.168]
  - - [1024, 4096, 1, 8064]
    - [33, 70.101]
  - - [1024, 4096, 1, 8160]
    - [33, 70.225]
  - - [1024, 4096, 1, 9216]
    - [33, 71.184]
  - - [1024, 4096, 1, 9520]
    - [58, 70.128]
  - - [1024, 4096, 1, 10064]
    - [33, 70.792]
  - - [1024, 4096, 1, 10080]
    - [57, 71.619]
  - - [1024, 4096, 1, 10200]
    - [33, 70.967]
  - - [1024, 42720, 1, 3968]
    - [54, 76.964]
  - - [1024, 42720, 1, 6528]
    - [54, 78.492]
  - - [1024, 42720, 1, 7104]
    - [54, 78.695]
  - - [1024, 42720, 1, 7200]
    - [54, 78.716]
  - - [1024, 42720, 1, 9520]
    - [54, 78.891]
  - - [1024, 42720, 1, 10080]
    - [54, 79.278]
  - - [4096, 1024, 1, 3840]
    - [37, 63.293]
  - - [4096, 1024, 1, 3968]
    - [37, 63.113]
  - - [4096, 1024, 1, 6528]
    - [37, 68.552]
  - - [4096, 1024, 1, 7104]
    - [37, 68.721]
  - - [4096, 1024, 1, 7200]
    - [37, 68.541]
  - - [4096, 1024, 1, 8064]
    - [37, 69.869]
  - - [4096, 1024, 1, 8160]
    - [37, 69.704]
  - - [4096, 1024, 1, 9216]
    - [37, 69.748]
  - - [4096, 1024, 1, 9520]
    - [37, 69.532]
  - - [4096, 1024, 1, 10064]
    - [37, 69.6]
  - - [4096, 1024, 1, 10080]
    - [37, 70.862]
  - - [4096, 1024, 1, 10200]
    - [37, 69.735]
  - - [27, 64, 1920, 27]
    - [79, 2.608]
  - - [27, 64, 1920, 33]
    - [39, 3.046]
  - - [33, 64, 1920, 33]
    - [84, 2.599]
  - - [64, 27, 1920, 27]
    - [61, 3.433]
  - - [64, 27, 1920, 33]
    - [86, 4.018]
  - - [64, 33, 1920, 33]
    - [68, 3.926]
  - - [1024, 1024, 1, 3240]
    - [31, 39.502]
  - - [1024, 1024, 1, 3960]
    - [31, 41.291]
  - - [1024, 4096, 1, 3240]
    - [33, 58.729]
  - - [1024, 4096, 1, 3960]
    - [57, 61.455]
  - - [1024, 42720, 1, 3960]
    - [54, 76.299]
  - - [4096, 1024, 1, 3240]
    - [37, 58.978]
  - - [4096, 1024, 1, 3960]
    - [37, 61.923]
  - - [64, 1280, 64, 192]
    - [91, 26.132]
  - - [64, 1280, 64, 320]
    - [26, 34.875]
  - - [64, 1280, 64, 384]
    - [24, 37.679]
  - - [64, 1280, 64, 448]
    - [26, 40.34]
  - - [64, 2048, 64, 192]
    - [92, 28.667]
  - - [64, 2048, 64, 320]
    - [93, 36.526]
  - - [64, 2048, 64, 384]
    - [26, 39.277]
  - - [64, 2048, 64, 448]
    - [91, 41.228]
  - - [1225, 192, 64, 32]
    - [94, 7.82]
  - - [1225, 192, 64, 48]
    - [94, 11.06]
  - - [1225, 192, 64, 64]
    - [95, 13.705]
  - - [1225, 256, 64, 48]
    - [95, 11.51]
  - - [1225, 256, 64, 64]
    - [96, 14.692]
  - - [1225, 288, 64, 48]
    - [97, 10.508]
  - - [1225, 288, 64, 64]
    - [98, 13.466]
  - - [5329, 64, 64, 80]
    - [94, 15.263]
  - - [289, 768, 64, 128]
    - [99, 19.074]
  - - [289, 768, 64, 160]
    - [99, 22.462]
  - - [289, 768, 64, 192]
    - [100, 24.982]
  - - [64, 1280, 32, 192]
    - [101, 21.979]
  - - [64, 1280, 32, 320]
    - [93, 28.64]
  - - [64, 1280, 32, 384]
    - [100, 31.158]
  - - [64, 1280, 32, 448]
    - [26, 33.668]
  - - [64, 2048, 32, 192]
    - [91, 22.796]
  - - [64, 2048, 32, 320]
    - [100, 29.944]
  - - [64, 2048, 32, 384]
    - [92, 31.287]
  - - [64, 2048, 32, 448]
    - [102, 35.225]
  - - [1225, 192, 32, 32]
    - [103, 6.618]
  - - [1225, 192, 32, 48]
    - [104, 9.51]
  - - [1225, 192, 32, 64]
    - [95, 12.251]
  - - [1225, 256, 32, 48]
    - [94, 10.377]
  - - [1225, 256, 32, 64]
    - [104, 13.061]
  - - [1225, 288, 32, 48]
    - [30, 9.279]
  - - [1225, 288, 32, 64]
    - [97, 11.596]
  - - [5329, 64, 32, 80]
    - [95, 13.993]
  - - [289, 768, 32, 128]
    - [99, 16.93]
  - - [289, 768, 32, 160]
    - [96, 19.637]
  - - [289, 768, 32, 192]
    - [99, 22.267]
  - - [3136, 64, 64, 256]
    - [105, 29.902]
  - - [3136, 64, 64, 64]
    - [90, 14.271]
  - - [3136, 256, 64, 64]
    - [92, 18.854]
  - - [784, 128, 64, 512]
    - [24, 40.937]
  - - [784, 512, 64, 128]
    - [78, 30.194]
  - - [196, 256, 64, 1024]
    - [106, 34.432]
  - - [196, 1024, 64, 256]
    - [107, 28.764]
  - - [49, 512, 64, 2048]
    - [99, 29.71]
  - - [49, 2048, 64, 512]
    - [99, 26.294]
  - - [3136, 64, 32, 256]
    - [27, 27.043]
  - - [3136, 64, 32, 64]
    - [68, 12.219]
  - - [3136, 256, 32, 64]
    - [92, 17.795]
  - - [784, 128, 32, 512]
    - [24, 37.048]
  - - [784, 512, 32, 128]
    - [26, 26.501]
  - - [196, 256, 32, 1024]
    - [108, 29.497]
  - - [196, 1024, 32, 256]
    - [99, 25.8]
  - - [49, 512, 32, 2048]
    - [77, 22.238]
  - - [49, 2048, 32, 512]
    - [99, 23.448]
  - - [3136, 64, 64, 128]
    - [27, 21.793]
  - - [3136, 128, 64, 256]
    - [109, 39.987]
  - - [784, 256, 64, 512]
    - [110, 49.431]
  - - [3136, 256, 64, 128]
    - [109, 31.584]
  - - [3136, 256, 64, 256]
    - [110, 47.82]
  - - [196, 512, 64, 1024]
    - [99, 41.096]
  - - [784, 512, 64, 256]
    - [78, 44.449]
  - - [784, 512, 64, 512]
    - [109, 54.886]
  - - [196, 1024, 64, 512]
    - [99, 38.612]
  - - [196, 1024, 64, 1024]
    - [106, 46.354]
  - - [49, 1024, 64, 2048]
    - [99, 36.772]
  - - [49, 2048, 64, 1024]
    - [99, 34.304]
  - - [3136, 64, 32, 128]
    - [27, 19.097]
  - - [3136, 128, 32, 256]
    - [110, 36.573]
  - - [784, 256, 32, 512]
    - [26, 43.844]
  - - [3136, 256, 32, 128]
    - [109, 29.287]
  - - [3136, 256, 32, 256]
    - [78, 44.663]
  - - [196, 512, 32, 1024]
    - [111, 34.951]
  - - [784, 512, 32, 256]
    - [109, 38.713]
  - - [784, 512, 32, 512]
    - [109, 49.663]
  - - [196, 1024, 32, 512]
    - [99, 34.754]
  - - [196, 1024, 32, 1024]
    - [111, 42.756]
  - - [49, 1024, 32, 2048]
    - [99, 30.543]
  - - [49, 2048, 32, 1024]
    - [99, 31.238]
  - - [64, 128, 624, 128]
    - [101, 17.184]
  - - [1024, 1024, 1, 1024]
    - [71, 28.532]
  - - [1024, 1024, 1, 1280]
    - [66, 30.611]
  - - [1024, 1024, 1, 39]
    - [86, 3.011]
  - - [1024, 4096, 1, 2560]
    - [36, 57.993]
  - - [1024, 4096, 1, 1024]
    - [36, 48.977]
  - - [33, 32, 1, 33]
    - [13, 0.004]
  - - [1024, 2, 1, 4992]
    - [112, 0.282]
  - - [64, 128, 144, 128]
    - [68, 10.126]
  - - [512, 512, 1, 512]
    - [113, 7.835]
  - - [1024, 2, 1, 39]
    - [14, 0.008]
  - - [1024, 1024, 1, 8192]
    - [47, 51.506]
  - - [1024, 960, 1, 1024]
    - [62, 27.263]
  - - [1024, 1024, 1, 308]
    - [27, 15.036]
  - - [1024, 2, 1, 5]
    - [14, 0.001]
  - - [1024, 1024, 1, 4992]
    - [48, 44.985]
  - - [4096, 3840, 1, 4096]
    - [36, 76.252]
  - - [4096, 1024, 1, 3072]
    - [37, 60.211]
  - - [64, 512, 96, 512]
    - [26, 33.855]
  - - [1024, 1024, 1, 5248]
    - [48, 45.891]
  - - [4096, 1024, 1, 4992]
    - [37, 65.747]
  - - [1024, 1024, 1, 180]
    - [104, 10.527]
  - - [5, 64, 1, 5]
    - [13, 0.0]
  - - [4096, 1024, 1, 2560]
    - [36, 58.021]
  - - [1024, 33712, 1, 9600]
    - [60, 79.673]
  - - [64, 128, 640, 128]
    - [101, 17.262]
  - - [1024, 1024, 1, 5]
    - [85, 0.431]
  - - [4, 64, 32768, 4]
    - [20, 0.172]
  - - [1024, 2, 1, 40]
    - [14, 0.008]
  - - [1024, 30522, 1, 160]
    - [110, 33.879]
  - - [1024, 1024, 1, 800]
    - [67, 26.85]
  - - [1024, 1024, 1, 41]
    - [86, 3.105]
  - - [1024, 2, 1, 5248]
    - [114, 0.303]
  - - [4096, 4096, 1, 4096]
    - [115, 75.322]
  - - [1024, 30522, 1, 385]
    - [110, 51.217]
  - - [1024, 4096, 1, 9600]
    - [57, 71.408]
  - - [2048, 512, 1, 1]
    - [87, 0.082]
  - - [1024, 4096, 1, 1152]
    - [116, 50.313]
  - - [1024, 2, 1, 512]
    - [18, 0.072]
  - - [64, 4, 38400, 4]
    - [15, 0.19]
  - - [1024, 30522, 1, 180]
    - [110, 34.448]
  - - [4096, 1024, 1, 512]
    - [78, 39.213]
  - - [4096, 1024, 1, 1024]
    - [54, 49.176]
  - - [4, 64, 38400, 4]
    - [20, 0.173]
  - - [1024, 2, 1, 9]
    - [14, 0.002]
  - - [8192, 8192, 1, 8192]
    - [60, 81.541]
  - - [4096, 1024, 1, 1280]
    - [54, 51.876]
  - - [1024, 1024, 1, 3072]
    - [31, 40.102]
  - - [64, 128, 656, 128]
    - [93, 17.534]
  - - [1024, 4096, 1, 4992]
    - [58, 65.546]
  - - [1024, 1024, 1, 9]
    - [85, 0.738]
  - - [1024, 4096, 1, 512]
    - [78, 39.47]
  - - [64, 512, 16, 512]
    - [67, 14.825]
  - - [1024, 2, 1, 6]
    - [15, 0.001]
  - - [2048, 1920, 1, 2048]
    - [31, 60.608]
  - - [1024, 30522, 1, 780]
    - [110, 62.551]
  - - [64, 128, 128, 128]
    - [66, 8.948]
  - - [1024, 30522, 1, 800]
    - [110, 64.79]
  - - [960, 1024, 1, 1024]
    - [67, 27.797]
  - - [1024, 1024, 1, 6]
    - [87, 0.499]
  - - [8192, 7680, 1, 8192]
    - [32, 80.804]
  - - [1024, 2, 1, 1152]
    - [18, 0.119]
  - - [1024, 1024, 1, 2560]
    - [31, 38.283]
  - - [1024, 1024, 1, 77]
    - [30, 5.198]
  - - [1024, 1024, 1, 160]
    - [67, 10.273]
  - - [1024, 4096, 1, 8192]
    - [33, 70.487]
  - - [1024, 2, 1, 41]
    - [14, 0.008]
  - - [128, 64, 1, 128]
    - [14, 0.098]
  - - [480, 512, 1, 512]
    - [117, 6.949]
  - - [1024, 1024, 1, 462]
    - [67, 19.563]
  - - [1024, 1024, 1, 780]
    - [67, 24.442]
  - - [1024, 4096, 1, 5248]
    - [57, 65.956]
  - - [1024, 4096, 1, 1280]
    - [32, 51.698]
  - - [4096, 1024, 1, 9600]
    - [37, 69.739]
  - - [64, 512, 80, 512]
    - [91, 31.97]
  - - [4096, 1024, 1, 1152]
    - [118, 50.22]
  - - [1024, 1600, 1, 1]
    - [86, 0.105]
  - - [1024, 1024, 1, 820]
    - [67, 24.776]
  - - [1024, 2, 1, 2560]
    - [112, 0.173]
  - - [4096, 1024, 1, 5248]
    - [37, 66.611]
  - - [1024, 33712, 1, 8192]
    - [35, 79.495]
  - - [1024, 1024, 1, 385]
    - [71, 18.34]
  - - [1024, 1024, 1, 1]
    - [61, 0.082]
  - - [1024, 2, 1, 10]
    - [14, 0.002]
  - - [64, 4, 32768, 4]
    - [14, 0.189]
  - - [1024, 1024, 1, 10]
    - [87, 0.838]
  - - [1024, 2, 1, 5120]
    - [114, 0.295]
  - - [1920, 2048, 1, 2048]
    - [119, 58.423]
  - - [2048, 2048, 1, 2048]
    - [55, 56.169]
  - - [3840, 4096, 1, 4096]
    - [54, 76.092]
  - - [1024, 4096, 1, 5120]
    - [33, 65.89]
  - - [64, 128, 160, 128]
    - [120, 10.863]
  - - [1024, 30522, 1, 308]
    - [110, 46.829]
  - - [1024, 30522, 1, 820]
    - [110, 63.925]
  - - [1024, 30522, 1, 200]
    - [110, 36.623]
  - - [1024, 30522, 1, 462]
    - [110, 54.41]
  - - [1024, 2, 1, 1024]
    - [18, 0.113]
  - - [1024, 30522, 1, 77]
    - [121, 17.664]
  - - [1024, 1024, 1, 40]
    - [30, 3.029]
  - - [1024, 2, 1, 1]
    - [14, 0.0]
  - - [1024, 2, 1, 8]
    - [29, 0.002]
  - - [1024, 1024, 1, 8]
    - [30, 0.652]
  - - [1024, 1024, 1, 9600]
    - [46, 53.572]
  - - [4096, 1024, 1, 5120]
    - [37, 65.818]
  - - [1024, 4096, 1, 3072]
    - [55, 59.204]
  - - [1024, 1024, 1, 1152]
    - [67, 29.977]
  - - [512, 480, 1, 512]
    - [113, 6.915]
  - - [64, 128, 1, 128]
    - [13, 0.104]
  - - [1024, 1024, 1, 5120]
    - [48, 45.309]
  - - [1024, 2, 1, 3072]
    - [112, 0.197]
  - - [7680, 8192, 1, 8192]
    - [32, 80.829]
  - - [4096, 1024, 1, 8192]
    - [37, 78.649]
  - - [1024, 2, 1, 1280]
    - [18, 0.126]
  - - [479, 1024, 1, 32768]
    - [122, 32.96]
  - - [64, 1024, 32, 1024]
    - [26, 37.337]
  - - [2560, 1920, 1, 2048]
    - [36, 64.77]
  - - [1024, 3072, 1, 4096]
    - [36, 66.136]
  - - [2560, 2560, 1, 2048]
    - [59, 66.733]
  - - [2048, 2, 1, 2]
    - [14, 0.001]
  - - [1024, 64, 128, 1024]
    - [123, 47.792]
  - - [2048, 2048, 1, 2]
    - [61, 0.351]
  - - [1024, 64, 32, 1024]
    - [123, 36.995]
  - - [1024, 96, 64, 1024]
    - [124, 52.674]
  - - [1024, 30592, 1, 2048]
    - [35, 74.143]
  - - [1024, 3072, 1, 16384]
    - [125, 71.618]
  - - [6144, 1536, 1, 4096]
    - [119, 70.505]
  - - [1024, 1024, 1, 16]
    - [30, 1.421]
  - - [1536, 4608, 1, 8192]
    - [35, 79.183]
  - - [640, 2560, 1, 2048]
    - [55, 51.087]
  - - [1024, 4096, 1, 16384]
    - [33, 74.274]
  - - [64, 512, 40, 512]
    - [77, 24.469]
  - - [1024, 1024, 1, 16384]
    - [48, 53.796]
  - - [1536, 6144, 1, 4096]
    - [119, 70.585]
  - - [1024, 30592, 1, 4096]
    - [60, 78.075]
  - - [2560, 2560, 1, 4]
    - [87, 0.809]
  - - [1536, 1536, 1, 4096]
    - [52, 60.554]
  - - [2560, 7680, 1, 2048]
    - [36, 74.235]
  - - [64, 1024, 256, 1024]
    - [91, 52.856]
  - - [96, 1024, 64, 1024]
    - [126, 48.878]
  - - [1536, 50304, 1, 4096]
    - [115, 79.654]
  - - [2048, 8192, 1, 1024]
    - [127, 64.822]
  - - [1024, 30592, 1, 8192]
    - [60, 80.173]
  - - [512, 64, 256, 512]
    - [123, 37.366]
  - - [1024, 96, 128, 1024]
    - [124, 56.996]
  - - [64, 512, 128, 512]
    - [128, 33.604]
  - - [4096, 1024, 1, 16384]
    - [37, 73.207]
  - - [8192, 2048, 1, 1024]
    - [129, 64.909]
  - - [64, 1024, 64, 1024]
    - [92, 44.972]
  - - [1024, 50304, 1, 4096]
    - [54, 78.376]
  - - [1536, 4608, 1, 4096]
    - [130, 76.262]
  - - [512, 64, 128, 512]
    - [131, 33.886]
  - - [6144, 1536, 1, 8192]
    - [119, 72.937]
  - - [1024, 3072, 1, 8192]
    - [36, 69.277]
  - - [1536, 1536, 1, 8192]
    - [53, 66.55]
  - - [1536, 50304, 1, 8192]
    - [60, 81.186]
  - - [2560, 2, 1, 4]
    - [14, 0.002]
  - - [2048, 6144, 1, 1024]
    - [36, 66.408]
  - - [64, 1024, 128, 1024]
    - [26, 49.963]
  - - [1024, 64, 64, 1024]
    - [28, 45.055]
  - - [1024, 2, 1, 16]
    - [15, 0.004]
  - - [96, 1024, 128, 1024]
    - [132, 51.387]
  - - [2048, 30592, 1, 1024]
    - [78, 70.678]
  - - [64, 512, 256, 512]
    - [93, 39.631]
  - - [1536, 6144, 1, 8192]
    - [31, 72.998]
  - - [1024, 50304, 1, 2048]
    - [36, 75.131]
  - - [1024, 50304, 1, 8192]
    - [54, 80.129]
  - - [1024, 3072, 1, 2048]
    - [54, 60.588]
  - - [1024, 64, 256, 1024]
    - [105, 50.99]
  - - [1024, 50304, 1, 16384]
    - [54, 80.918]
  - - [512, 64, 40, 512]
    - [70, 24.548]
  - - [1024, 2, 1, 64]
    - [14, 0.014]
  - - [1024, 30528, 1, 8192]
    - [35, 79.988]
  - - [1024, 1024, 1, 64]
    - [86, 4.942]
  - - [64, 128, 1024, 128]
    - [101, 19.735]
  - - [128, 64, 1024, 128]
    - [133, 18.083]
  - - [1024, 1024, 1, 3456]
    - [31, 41.919]
  - - [1024, 1024, 1, 6912]
    - [47, 48.955]
  - - [1024, 1024, 1, 864]
    - [67, 27.512]
  - - [1024, 512, 1, 3456]
    - [134, 28.08]
  - - [1024, 512, 1, 4096]
    - [135, 31.422]
  - - [1024, 512, 1, 6912]
    - [136, 39.989]
  - - [1024, 512, 1, 864]
    - [67, 17.782]
  - - [256, 128, 1, 3456]
    - [65, 3.525]
  - - [256, 128, 1, 4096]
    - [65, 3.743]
  - - [256, 128, 1, 55296]
    - [42, 19.223]
  - - [256, 128, 1, 6912]
    - [42, 6.018]
  - - [256, 128, 1, 864]
    - [41, 1.636]
  - - [256, 3456, 1, 1]
    - [30, 0.073]
  - - [256, 4096, 1, 1]
    - [30, 0.085]
  - - [256, 6912, 1, 1]
    - [30, 0.117]
  - - [256, 864, 1, 1]
    - [23, 0.021]
  - - [480, 1024, 1, 3456]
    - [63, 26.11]
  - - [480, 1024, 1, 4096]
    - [135, 28.969]
  - - [480, 1024, 1, 6912]
    - [135, 37.234]
  - - [480, 1024, 1, 864]
    - [66, 16.788]
  - - [512, 256, 1, 3456]
    - [137, 10.437]
  - - [512, 256, 1, 4096]
    - [138, 11.814]
  - - [512, 256, 1, 55296]
    - [139, 31.262]
  - - [512, 256, 1, 6912]
    - [42, 17.04]
  - - [512, 256, 1, 864]
    - [64, 5.646]
  - - [30528, 1024, 1, 640]
    - [110, 61.153]
  - - [30528, 1024, 1, 1280]
    - [32, 69.797]
  - - [4096, 1024, 1, 10240]
    - [37, 71.498]
  - - [1024, 4096, 1, 10240]
    - [33, 72.105]
  - - [30528, 1024, 1, 1600]
    - [32, 71.722]
  - - [1024, 2, 1, 80]
    - [14, 0.017]
  - - [1024, 1024, 1, 10240]
    - [48, 51.304]
  - - [1024, 1024, 1, 80]
    - [140, 5.87]
  - - [64, 128, 1280, 128]
    - [141, 20.829]
  - - [128, 64, 1280, 128]
    - [142, 19.437]
  - - [1024, 4096, 1, 10496]
    - [33, 72.334]
  - - [30528, 1024, 1, 1640]
    - [60, 71.143]
  - - [4096, 1024, 1, 10496]
    - [37, 70.544]
  - - [1024, 1024, 1, 10496]
    - [48, 51.388]
  - - [1024, 1024, 1, 82]
    - [30, 5.504]
  - - [1024, 2, 1, 82]
    - [14, 0.015]
  - - [128, 64, 1312, 128]
    - [123, 19.278]
  - - [64, 128, 1312, 128]
    - [26, 21.06]
  - - [30528, 1024, 1, 160]
    - [121, 33.148]
  - - [1024, 4096, 1, 6144]
    - [57, 67.868]
  - - [30528, 1024, 1, 240]
    - [110, 42.18]
  - - [4096, 1024, 1, 6144]
    - [37, 67.458]
  - - [1024, 1024, 1, 12]
    - [85, 0.998]
  - - [1024, 2, 1, 12]
    - [14, 0.003]
  - - [1024, 1024, 1, 6144]
    - [48, 47.784]
  - - [64, 512, 192, 512]
    - [102, 38.445]
  - - [512, 64, 192, 512]
    - [143, 36.585]
  - - [13, 512, 1, 3456]
    - [144, 0.704]
  - - [13, 512, 1, 4096]
    - [144, 0.826]
  - - [13, 512, 1, 55296]
    - [38, 4.379]
  - - [13, 512, 1, 6912]
    - [38, 1.231]
  - - [13, 512, 1, 864]
    - [145, 0.345]
  - - [1024, 1024, 1, 10224]
    - [48, 49.644]
  - - [1024, 1024, 1, 10192]
    - [48, 49.837]
  - - [1024, 1024, 1, 10208]
    - [47, 53.432]
  - - [1024, 4096, 1, 10224]
    - [33, 71.176]
  - - [4096, 1024, 1, 10224]
    - [37, 69.828]
  - - [1024, 3072, 1, 10224]
    - [60, 69.43]
  - - [1024, 3072, 1, 10240]
    - [36, 70.022]
  - - [4096, 1024, 1, 10192]
    - [37, 69.339]
  - - [1024, 3072, 1, 10192]
    - [60, 69.412]
  - - [1024, 4096, 1, 10192]
    - [33, 70.901]
  - - [1024, 3072, 1, 10200]
    - [54, 69.24]
  - - [1024, 1024, 1, 10184]
    - [48, 50.298]
  - - [4096, 1024, 1, 10208]
    - [37, 70.226]
  - - [1024, 3072, 1, 10208]
    - [36, 69.87]
  - - [1024, 4096, 1, 10208]
    - [33, 72.019]
  - - [1024, 2048, 1, 10224]
    - [51, 63.638]
  - - [1024, 2048, 1, 10240]
    - [146, 64.348]
  - - [1024, 1024, 1, 10120]
    - [48, 50.255]
  - - [1024, 2048, 1, 10192]
    - [51, 63.59]
  - - [64, 24, 6816, 24]
    - [85, 3.987]
  - - [1024, 1024, 1, 10152]
    - [48, 49.601]
  - - [1024, 3072, 1, 10080]
    - [36, 69.83]
  - - [64, 26, 6272, 26]
    - [147, 4.489]
  - - [100352, 256, 1, 512]
    - [110, 54.423]
  - - [12544, 1024, 1, 2048]
    - [60, 67.947]
  - - [12544, 147, 1, 64]
    - [123, 6.715]
  - - [200704, 256, 1, 512]
    - [35, 54.016]
  - - [25088, 512, 1, 1024]
    - [35, 60.71]
  - - [3136, 576, 1, 64]
    - [148, 7.846]
  - - [50176, 512, 1, 1024]
    - [110, 65.312]
  - - [6272, 1024, 1, 2048]
    - [127, 65.485]
  - - [784, 1152, 1, 128]
    - [140, 7.662]
  - - [3136, 256, 128, 128]
    - [149, 32.888]
  - - [3136, 256, 256, 128]
    - [149, 33.577]
  - - [3136, 256, 128, 64]
    - [92, 19.412]
  - - [3136, 256, 256, 64]
    - [92, 19.582]
  - - [3136, 64, 128, 256]
    - [27, 31.212]
  - - [3136, 64, 256, 256]
    - [27, 32.028]
  - - [3136, 64, 128, 64]
    - [27, 15.373]
  - - [3136, 64, 256, 64]
    - [27, 16.437]
  - - [784, 128, 128, 512]
    - [78, 45.795]
  - - [784, 128, 256, 512]
    - [78, 49.103]
  - - [784, 512, 128, 128]
    - [78, 33.108]
  - - [784, 512, 256, 128]
    - [109, 34.673]
  - - [784, 512, 128, 256]
    - [109, 47.712]
  - - [784, 512, 256, 256]
    - [59, 49.713]
  - - [64, 128, 2048, 128]
    - [101, 22.136]
  - - [128, 64, 2048, 128]
    - [143, 20.129]
  - - [30528, 1024, 1, 2560]
    - [34, 75.205]
  - - [1024, 1024, 1, 128]
    - [120, 8.355]
  - - [1024, 2, 1, 128]
    - [14, 0.024]
  - - [128, 64, 1536, 128]
    - [28, 19.789]
  - - [64, 128, 1536, 128]
    - [26, 21.125]
  - - [1024, 4096, 1, 12288]
    - [33, 72.903]
  - - [30528, 1024, 1, 1920]
    - [34, 73.153]
  - - [1024, 1024, 1, 96]
    - [68, 6.711]
  - - [1024, 1024, 1, 12288]
    - [48, 52.294]
  - - [4096, 1024, 1, 12288]
    - [37, 72.143]
  - - [1024, 2, 1, 96]
    - [14, 0.019]
  - - [25600, 128, 25, 128]
    - [109, 28.412]
  - - [12544, 128, 36, 128]
    - [110, 29.3]
  - - [9216, 128, 49, 128]
    - [109, 29.803]
  - - [6400, 128, 64, 128]
    - [109, 29.65]
  - - [6400, 256, 25, 256]
    - [150, 46.42]
  - - [4096, 256, 36, 256]
    - [78, 46.509]
  - - [2304, 256, 49, 256]
    - [109, 44.649]
  - - [2304, 256, 64, 256]
    - [109, 46.568]
  - - [2304, 512, 25, 512]
    - [109, 58.784]
  - - [1024, 512, 36, 512]
    - [78, 56.648]
  - - [1024, 512, 49, 512]
    - [110, 58.299]
  - - [1024, 512, 64, 512]
    - [78, 60.074]
  - - [92416, 64, 25, 64]
    - [121, 14.672]
  - - [50176, 64, 36, 64]
    - [121, 14.899]
  - - [36864, 64, 49, 64]
    - [121, 15.151]
  - - [25600, 64, 64, 64]
    - [121, 15.204]
  - - [64, 128, 192, 128]
    - [66, 11.814]
  - - [128, 64, 192, 128]
    - [27, 11.572]
  - - [768, 2, 1, 2048]
    - [151, 0.112]
  - - [3072, 768, 1, 2048]
    - [31, 54.167]
  - - [768, 3072, 1, 2048]
    - [31, 54.114]
  - - [768, 768, 1, 2048]
    - [152, 26.685]
  - - [64, 384, 144, 384]
    - [26, 34.483]
  - - [384, 64, 144, 384]
    - [70, 29.787]
  - - [768, 2, 1, 4608]
    - [114, 0.216]
  - - [3072, 768, 1, 4608]
    - [53, 61.737]
  - - [768, 3072, 1, 4608]
    - [53, 61.582]
  - - [768, 768, 1, 4608]
    - [135, 36.541]
  - - [64, 512, 48, 512]
    - [26, 28.09]
  - - [512, 64, 48, 512]
    - [70, 27.578]
  - - [64, 128, 256, 128]
    - [68, 13.502]
  - - [128, 64, 256, 128]
    - [27, 12.98]
  - - [64, 384, 192, 384]
    - [24, 34.024]
  - - [384, 64, 192, 384]
    - [123, 31.798]
  - - [1024, 2, 1, 4608]
    - [114, 0.269]
  - - [4096, 1024, 1, 4608]
    - [37, 65.196]
  - - [1024, 4096, 1, 4608]
    - [58, 64.634]
  - - [1024, 1024, 1, 4608]
    - [119, 44.695]
  - - [196, 2304, 1, 256]
    - [30, 6.448]
  - - [49, 4608, 1, 512]
    - [40, 6.115]
  - - [196, 1024, 128, 256]
    - [107, 31.544]
  - - [196, 1024, 256, 256]
    - [107, 32.699]
  - - [196, 1024, 128, 512]
    - [111, 41.222]
  - - [196, 1024, 256, 512]
    - [106, 42.849]
  - - [196, 256, 128, 1024]
    - [106, 40.892]
  - - [196, 256, 256, 1024]
    - [99, 44.583]
  - - [49, 2048, 128, 512]
    - [99, 28.477]
  - - [49, 2048, 256, 512]
    - [99, 29.526]
  - - [49, 512, 128, 2048]
    - [153, 34.836]
  - - [49, 512, 256, 2048]
    - [107, 37.785]
  - - [3840, 4224, 1, 4096]
    - [4, 96.011]
  - - [3840, 4224, 1, 4224]
    - [5, 96.012]
  - - [3840, 4224, 1, 4320]
    - [6, 96.079]
  - - [7680, 8448, 1, 8192]
    - [7, 99.155]
  - - [7680, 8448, 1, 8448]
    - [8, 99.224]
  - - [7680, 8448, 1, 8640]
    - [8, 99.272]
  - - [3840, 4224, 1, 3712]
    - [9, 99.158]
  - - [3840, 4224, 1, 3840]
    - [10, 99.108]
  - - [3840, 4224, 1, 3968]
    - [9, 99.164]
  - - [7680, 8448, 1, 7424]
    - [11, 99.813]
  - - [7680, 8448, 1, 7680]
    - [12, 99.823]
  - - [7680, 8448, 1, 7936]
    - [12, 99.828]
  - - [1024, 1024, 1, 10032]
    - [47, 53.652]
  - - [1024, 1024, 1, 11304]
    - [48, 50.623]
  - - [1024, 1024, 1, 13200]
    - [48, 51.722]
  - - [1024, 1024, 1, 1640]
    - [67, 31.71]
  - - [1024, 1024, 1, 1960]
    - [126, 33.317]
  - - [1024, 1024, 1, 2320]
    - [119, 35.274]
  - - [1024, 1024, 1, 256]
    - [67, 14.972]
  - - [1024, 1024, 1, 2832]
    - [31, 37.55]
  - - [1024, 1024, 1, 288]
    - [67, 15.825]
  - - [1024, 1024, 1, 304]
    - [27, 16.177]
  - - [1024, 1024, 1, 312]
    - [27, 15.045]
  - - [1024, 1024, 1, 3304]
    - [126, 39.789]
  - - [1024, 1024, 1, 3400]
    - [31, 39.888]
  - - [1024, 1024, 1, 352]
    - [67, 18.08]
  - - [1024, 1024, 1, 3520]
    - [31, 42.175]
  - - [1024, 1024, 1, 3696]
    - [126, 40.769]
  - - [1024, 1024, 1, 384]
    - [67, 18.902]
  - - [1024, 1024, 1, 3872]
    - [31, 42.711]
  - - [1024, 1024, 1, 392]
    - [67, 17.676]
  - - [1024, 1024, 1, 432]
    - [27, 18.763]
  - - [1024, 1024, 1, 448]
    - [66, 20.837]
  - - [1024, 1024, 1, 456]
    - [67, 19.378]
  - - [1024, 1024, 1, 480]
    - [67, 21.727]
  - - [1024, 1024, 1, 4896]
    - [31, 45.224]
  - - [1024, 1024, 1, 4968]
    - [119, 43.8]
  - - [1024, 1024, 1, 5280]
    - [31, 45.798]
  - - [1024, 1024, 1, 648]
    - [66, 23.059]
  - - [1024, 1024, 1, 7040]
    - [47, 48.866]
  - - [1024, 1024, 1, 7144]
    - [47, 49.327]
  - - [1024, 1024, 1, 720]
    - [140, 24.096]
  - - [1024, 1024, 1, 760]
    - [67, 24.398]
  - - [1024, 2048, 1, 1280]
    - [119, 40.595]
  - - [1024, 2048, 1, 144]
    - [27, 15.465]
  - - [1024, 2048, 1, 1960]
    - [119, 44.701]
  - - [1024, 2048, 1, 3400]
    - [51, 52.199]
  - - [1024, 2048, 1, 4176]
    - [146, 55.184]
  - - [1024, 2048, 1, 504]
    - [105, 29.331]
  - - [1024, 2048, 1, 7448]
    - [146, 61.146]
  - - [1024, 2048, 1, 8192]
    - [146, 63.275]
  - - [1024, 2048, 1, 9152]
    - [146, 63.638]
  - - [1024, 3072, 1, 1280]
    - [54, 54.988]
  - - [1024, 3072, 1, 144]
    - [78, 18.227]
  - - [1024, 3072, 1, 1960]
    - [49, 57.985]
  - - [1024, 3072, 1, 2320]
    - [55, 59.67]
  - - [1024, 3072, 1, 4480]
    - [118, 66.658]
  - - [1024, 3072, 1, 4896]
    - [54, 67.075]
  - - [1024, 3072, 1, 6880]
    - [54, 68.629]
  - - [1024, 3072, 1, 9016]
    - [55, 68.867]
  - - [1024, 33712, 1, 160]
    - [121, 34.668]
  - - [1024, 33712, 1, 3408]
    - [35, 76.885]
  - - [1024, 4096, 1, 10032]
    - [33, 70.979]
  - - [1024, 4096, 1, 1960]
    - [55, 54.515]
  - - [1024, 4096, 1, 2320]
    - [78, 55.907]
  - - [1024, 4096, 1, 2832]
    - [49, 57.387]
  - - [1024, 4096, 1, 3304]
    - [58, 58.985]
  - - [1024, 4096, 1, 3584]
    - [58, 62.061]
  - - [1024, 4096, 1, 3872]
    - [58, 62.363]
  - - [1024, 4096, 1, 4896]
    - [57, 65.653]
  - - [1024, 4096, 1, 4968]
    - [57, 64.284]
  - - [1024, 4096, 1, 5280]
    - [58, 66.148]
  - - [1024, 4096, 1, 6880]
    - [33, 68.939]
  - - [1024, 4096, 1, 7040]
    - [58, 69.049]
  - - [1024, 4096, 1, 7144]
    - [58, 67.94]
  - - [1024, 4096, 1, 864]
    - [78, 46.715]
  - - [4096, 1024, 1, 10032]
    - [37, 70.284]
  - - [4096, 1024, 1, 1960]
    - [36, 54.579]
  - - [4096, 1024, 1, 2320]
    - [109, 55.736]
  - - [4096, 1024, 1, 2832]
    - [49, 57.461]
  - - [4096, 1024, 1, 3304]
    - [37, 59.388]
  - - [4096, 1024, 1, 3584]
    - [37, 61.632]
  - - [4096, 1024, 1, 3872]
    - [37, 62.598]
  - - [4096, 1024, 1, 4896]
    - [37, 65.766]
  - - [4096, 1024, 1, 4968]
    - [37, 64.62]
  - - [4096, 1024, 1, 5280]
    - [37, 65.643]
  - - [4096, 1024, 1, 6880]
    - [37, 68.895]
  - - [4096, 1024, 1, 7040]
    - [37, 68.978]
  - - [4096, 1024, 1, 7144]
    - [37, 67.749]
  - - [4096, 1024, 1, 864]
    - [78, 46.983]
  - - [64, 448, 1, 3328]
    - [25, 3.063]
  - - [3584, 64, 1, 1280]
    - [69, 11.367]
  - - [64, 5888, 1, 1280]
    - [69, 17.876]
  - - [64, 4288, 1, 1280]
    - [69, 13.507]
  - - [3584, 64, 1, 3328]
    - [72, 16.765]
  - - [64, 1024, 1, 3328]
    - [25, 6.845]
  - - [704, 64, 1, 3328]
    - [25, 4.654]
  - - [64, 448, 1, 1280]
    - [25, 2.037]
  - - [64, 704, 1, 3328]
    - [65, 4.719]
  - - [64, 64, 1, 1280]
    - [25, 0.29]
  - - [64, 5056, 1, 256]
    - [25, 5.945]
  - - [64, 4288, 1, 3328]
    - [69, 20.019]
  - - [1856, 64, 1, 3328]
    - [154, 9.183]
  - - [448, 64, 1, 1280]
    - [25, 1.978]
  - - [5888, 64, 1, 1280]
    - [69, 18.297]
  - - [2944, 64, 1, 256]
    - [65, 3.91]
  - - [64, 1856, 1, 256]
    - [65, 2.501]
  - - [64, 1024, 1, 1280]
    - [25, 4.61]
  - - [64, 256, 1, 1280]
    - [25, 1.147]
  - - [704, 64, 1, 1280]
    - [25, 3.079]
  - - [2368, 64, 1, 256]
    - [64, 3.078]
  - - [2368, 64, 1, 3328]
    - [117, 11.365]
  - - [64, 1408, 1, 3328]
    - [65, 9.156]
  - - [1856, 64, 1, 1280]
    - [117, 6.464]
  - - [64, 3584, 1, 1280]
    - [66, 11.29]
  - - [448, 64, 1, 3328]
    - [25, 2.978]
  - - [5888, 64, 1, 3328]
    - [69, 26.71]
  - - [64, 256, 1, 3328]
    - [25, 1.775]
  - - [4288, 64, 1, 3328]
    - [69, 19.942]
  - - [64, 2944, 1, 256]
    - [25, 3.854]
  - - [6784, 64, 1, 256]
    - [117, 7.683]
  - - [64, 2368, 1, 1280]
    - [117, 8.035]
  - - [64, 3584, 1, 3328]
    - [69, 16.798]
  - - [64, 6784, 1, 3328]
    - [69, 30.543]
  - - [3584, 64, 1, 256]
    - [65, 4.411]
  - - [64, 1856, 1, 3328]
    - [154, 9.337]
  - - [448, 64, 1, 256]
    - [145, 0.599]
  - - [64, 5056, 1, 3328]
    - [69, 23.243]
  - - [256, 64, 1, 256]
    - [18, 0.353]
  - - [4288, 64, 1, 1280]
    - [66, 13.6]
  - - [5056, 64, 1, 1280]
    - [113, 15.765]
  - - [1408, 64, 1, 256]
    - [25, 1.883]
  - - [64, 1408, 1, 256]
    - [25, 1.911]
  - - [64, 2368, 1, 3328]
    - [69, 11.457]
  - - [64, 448, 1, 256]
    - [64, 0.604]
  - - [64, 6784, 1, 1280]
    - [69, 20.665]
  - - [64, 1856, 1, 1280]
    - [117, 6.489]
  - - [64, 6784, 1, 256]
    - [117, 7.544]
  - - [64, 5056, 1, 1280]
    - [69, 16.036]
  - - [64, 4288, 1, 256]
    - [25, 5.042]
  - - [5888, 64, 1, 256]
    - [117, 6.709]
  - - [64, 5888, 1, 3328]
    - [69, 26.559]
  - - [64, 1024, 1, 256]
    - [25, 1.37]
  - - [5056, 64, 1, 3328]
    - [69, 23.468]
  - - [256, 64, 1, 1280]
    - [25, 1.136]
  - - [64, 256, 1, 256]
    - [64, 0.347]
  - - [704, 64, 1, 256]
    - [64, 0.949]
  - - [64, 1408, 1, 1280]
    - [25, 6.13]
  - - [64, 704, 1, 256]
    - [64, 0.935]
  - - [64, 2944, 1, 3328]
    - [117, 14.073]
  - - [64, 64, 1, 256]
    - [64, 0.089]
  - - [1856, 64, 1, 256]
    - [65, 2.501]
  - - [2944, 64, 1, 1280]
    - [117, 10.064]
  - - [4288, 64, 1, 256]
    - [155, 5.074]
  - - [64, 2944, 1, 1280]
    - [40, 9.881]
  - - [1408, 64, 1, 1280]
    - [65, 6.016]
  - - [6784, 64, 1, 3328]
    - [69, 30.486]
  - - [64, 2368, 1, 256]
    - [25, 3.1]
  - - [64, 3584, 1, 256]
    - [64, 4.594]
  - - [2944, 64, 1, 3328]
    - [117, 14.045]
  - - [2368, 64, 1, 1280]
    - [117, 8.186]
  - - [256, 64, 1, 3328]
    - [25, 1.755]
  - - [64, 64, 1, 3328]
    - [144, 0.474]
  - - [64, 5888, 1, 256]
    - [117, 6.751]
  - - [64, 704, 1, 1280]
    - [65, 3.233]
  - - [6784, 64, 1, 1280]
    - [69, 20.871]
  - - [5056, 64, 1, 256]
    - [117, 5.833]
  - - [1408, 64, 1, 3328]
    - [25, 9.181]
  - - [4096, 7133, 1, 4096]
    - [54, 74.889]
  - - [512, 16, 1, 512]
    - [18, 0.301]
  - - [2048, 7133, 1, 2048]
    - [36, 66.999]
  - - [2560, 7133, 1, 2560]
    - [156, 71.182]
  - - [3072, 7435, 1, 1024]
    - [110, 65.549]
  - - [1024, 32, 1, 512]
    - [25, 1.252]
  - - [1760, 7133, 1, 1760]
    - [156, 64.642]
  - - [7680, 5481, 1, 2560]
    - [60, 75.957]
  - - [1024, 16, 1, 512]
    - [18, 0.591]
  - - [4880, 256, 49, 256]
    - [78, 50.073]
  - - [3128, 256, 64, 256]
    - [109, 49.141]
  - - [4680, 256, 49, 256]
    - [110, 49.889]
  - - [5280, 256, 36, 256]
    - [109, 48.48]
  - - [2640, 256, 64, 256]
    - [78, 49.077]
  - - [5304, 256, 49, 256]
    - [78, 49.831]
  - - [2760, 256, 64, 256]
    - [78, 48.431]
  - - [6440, 256, 36, 256]
    - [78, 48.77]
  - - [5704, 256, 36, 256]
    - [110, 48.752]
  - - [2128, 256, 64, 256]
    - [110, 47.84]
  - - [1160, 256, 49, 256]
    - [109, 40.085]
  - - [4056, 256, 49, 256]
    - [109, 48.72]
  - - [6144, 256, 36, 256]
    - [109, 47.781]
  - - [6336, 256, 36, 256]
    - [109, 47.724]
  - - [13600, 512, 2, 128]
    - [109, 26.85]
  - - [15200, 512, 2, 128]
    - [109, 26.882]
  - - [15200, 128, 2, 512]
    - [26, 36.677]
  - - [13600, 128, 2, 512]
    - [49, 41.155]
  - - [5632, 256, 36, 256]
    - [150, 47.571]
  - - [12288, 128, 2, 512]
    - [54, 39.448]
  - - [12880, 128, 2, 512]
    - [32, 39.461]
  - - [768, 512, 2, 2048]
    - [69, 34.498]
  - - [11408, 128, 2, 512]
    - [54, 37.604]
  - - [13824, 512, 2, 128]
    - [78, 26.206]
  - - [13824, 128, 2, 512]
    - [54, 43.343]
  - - [10560, 128, 2, 512]
    - [26, 35.932]
  - - [10752, 128, 2, 512]
    - [54, 35.442]
  - - [13600, 512, 2, 256]
    - [78, 39.848]
  - - [15200, 512, 2, 256]
    - [78, 40.444]
  - - [768, 2048, 2, 512]
    - [36, 39.534]
  - - [12880, 512, 2, 128]
    - [157, 25.984]
  - - [11616, 128, 2, 512]
    - [54, 36.575]
  - - [14208, 512, 2, 128]
    - [78, 25.935]
  - - [11408, 512, 2, 128]
    - [26, 25.219]
  - - [6912, 256, 36, 256]
    - [35, 48.046]
  - - [672, 512, 2, 2048]
    - [69, 30.771]
  - - [13824, 512, 2, 256]
    - [78, 40.747]
  - - [11616, 512, 2, 128]
    - [109, 25.795]
  - - [12288, 512, 2, 128]
    - [78, 26.414]
  - - [14208, 128, 2, 512]
    - [109, 35.382]
  - - [11968, 128, 2, 512]
    - [54, 38.008]
  - - [864, 2048, 2, 512]
    - [121, 36.454]
  - - [1008, 512, 2, 2048]
    - [126, 36.196]
  - - [10560, 512, 2, 128]
    - [92, 25.193]
  - - [672, 2048, 2, 512]
    - [54, 35.051]
  - - [9408, 128, 2, 512]
    - [27, 34.052]
  - - [10752, 512, 2, 128]
    - [109, 24.241]
  - - [11968, 512, 2, 128]
    - [101, 25.838]
  - - [1240, 256, 49, 256]
    - [78, 42.404]
  - - [4032, 256, 2, 1024]
    - [119, 39.431]
  - - [888, 2048, 2, 512]
    - [158, 38.01]
  - - [12880, 512, 2, 256]
    - [109, 40.86]
  - - [12288, 512, 2, 256]
    - [78, 40.505]
  - - [13440, 128, 2, 512]
    - [54, 42.408]
  - - [864, 2048, 2, 256]
    - [101, 26.443]
  - - [12672, 128, 2, 512]
    - [118, 40.33]
  - - [11264, 128, 2, 512]
    - [54, 36.801]
  - - [11776, 128, 2, 512]
    - [36, 38.136]
  - - [16128, 128, 2, 512]
    - [78, 38.853]
  - - [4032, 1024, 2, 256]
    - [101, 36.032]
  - - [14000, 128, 2, 512]
    - [55, 44.847]
  - - [13440, 512, 2, 128]
    - [78, 25.776]
  - - [864, 512, 2, 2048]
    - [126, 32.048]
  - - [768, 2048, 2, 256]
    - [159, 27.084]
  - - [3264, 1024, 2, 256]
    - [100, 35.248]
  - - [888, 512, 2, 2048]
    - [126, 31.838]
  - - [4200, 256, 2, 1024]
    - [31, 41.28]
  - - [2352, 1024, 2, 256]
    - [78, 32.085]
  - - [56, 512, 64, 512]
    - [26, 26.397]
  - - [2400, 1024, 2, 256]
    - [78, 31.858]
  - - [15200, 256, 2, 12]
    - [90, 2.776]
  - - [840, 512, 2, 2048]
    - [126, 30.394]
  - - [12880, 256, 2, 12]
    - [90, 2.702]
  - - [2520, 1024, 2, 256]
    - [109, 35.025]
  - - [13600, 256, 2, 12]
    - [90, 2.63]
  - - [15200, 256, 2, 3]
    - [90, 0.739]
  - - [12880, 256, 2, 3]
    - [140, 0.703]
  - - [4200, 1024, 2, 256]
    - [109, 38.051]
  - - [12288, 256, 2, 12]
    - [85, 2.363]
  - - [768, 256, 2, 12]
    - [160, 0.439]
  - - [13824, 256, 2, 12]
    - [30, 2.398]
  - - [864, 256, 2, 3]
    - [160, 0.127]
  - - [176, 256, 2, 3]
    - [14, 0.028]
  - - [864, 256, 2, 12]
    - [161, 0.494]
  - - [13600, 256, 2, 3]
    - [140, 0.696]
  - - [768, 256, 2, 3]
    - [160, 0.114]
  - - [7600, 512, 1, 256]
    - [142, 27.849]
  - - [6144, 512, 1, 256]
    - [116, 27.494]
  - - [1024, 81, 1, 1024]
    - [162, 4.668]
  - - [176, 256, 2, 12]
    - [14, 0.109]
  - - [216, 256, 2, 3]
    - [14, 0.034]
  - - [192, 256, 2, 12]
    - [160, 0.124]
  - - [3800, 256, 2, 3]
    - [90, 0.387]
  - - [13824, 256, 2, 3]
    - [121, 0.615]
  - - [12288, 256, 2, 3]
    - [87, 0.596]
  - - [192, 256, 2, 3]
    - [14, 0.03]
  - - [216, 256, 2, 12]
    - [161, 0.13]
  - - [2688, 256, 2, 1024]
    - [70, 34.293]
  - - [3072, 256, 2, 12]
    - [86, 1.266]
  - - [3800, 256, 2, 12]
    - [148, 1.486]
  - - [3072, 256, 2, 3]
    - [86, 0.318]
  - - [2520, 256, 2, 1024]
    - [66, 34.457]
  - - [16128, 512, 2, 128]
    - [109, 26.317]
  - - [2400, 256, 2, 1024]
    - [71, 33.515]
  - - [2352, 256, 2, 1024]
    - [66, 32.767]
  - - [2944, 256, 2, 1024]
    - [70, 36.922]
  - - [2992, 1024, 2, 256]
    - [101, 34.251]
  - - [2816, 256, 2, 1024]
    - [70, 35.391]
  - - [2904, 1024, 2, 256]
    - [101, 33.569]
  - - [3456, 256, 2, 3]
    - [163, 0.344]
  - - [3400, 256, 2, 3]
    - [140, 0.357]
  - - [2816, 1024, 2, 256]
    - [100, 30.298]
  - - [3456, 256, 2, 12]
    - [87, 1.344]
  - - [2944, 1024, 2, 256]
    - [164, 31.221]
  - - [3168, 256, 2, 1024]
    - [70, 38.744]
  - - [2992, 256, 2, 1024]
    - [70, 37.524]
  - - [51520, 256, 2, 12]
    - [90, 3.184]
  - - [3072, 256, 2, 1024]
    - [70, 38.527]
  - - [2640, 1024, 2, 256]
    - [101, 32.087]
  - - [2688, 1024, 2, 256]
    - [165, 29.568]
  - - [2904, 256, 2, 1024]
    - [128, 36.189]
  - - [3264, 256, 2, 1024]
    - [70, 40.935]
  - - [54400, 256, 2, 12]
    - [85, 2.899]
  - - [55296, 256, 2, 3]
    - [109, 0.744]
  - - [60800, 256, 2, 12]
    - [147, 2.919]
  - - [51520, 256, 2, 3]
    - [88, 0.843]
  - - [55296, 256, 2, 12]
    - [166, 2.863]
  - - [3600, 1024, 2, 256]
    - [121, 34.521]
  - - [60800, 256, 2, 3]
    - [85, 0.751]
  - - [952, 256, 64, 256]
    - [110, 40.384]
  - - [49152, 256, 2, 12]
    - [85, 2.938]
  - - [3360, 256, 2, 1024]
    - [70, 41.349]
  - - [736, 256, 64, 256]
    - [109, 39.748]
  - - [600, 256, 64, 256]
    - [110, 37.754]
  - - [1440, 256, 49, 256]
    - [109, 42.083]
  - - [3168, 1024, 2, 256]
    - [101, 33.416]
  - - [1368, 256, 49, 256]
    - [78, 42.964]
  - - [49152, 256, 2, 3]
    - [85, 0.743]
  - - [3600, 256, 2, 1024]
    - [126, 36.982]
  - - [3360, 1024, 2, 256]
    - [101, 35.632]
  - - [54400, 256, 2, 3]
    - [85, 0.735]
  - - [3072, 1024, 2, 256]
    - [100, 32.346]
  - - [2640, 256, 2, 1024]
    - [70, 33.321]
  - - [616, 256, 64, 256]
    - [110, 38.251]
  - - [3008, 256, 64, 256]
    - [78, 47.651]
  - - [896, 256, 64, 256]
    - [110, 40.096]
  - - [768, 256, 64, 256]
    - [78, 40.55]
  - - [3552, 256, 2, 1024]
    - [126, 35.866]
  - - [3552, 1024, 2, 256]
    - [92, 34.172]
  - - [800, 256, 64, 256]
    - [92, 37.918]
  - - [1120, 256, 49, 256]
    - [110, 39.533]
  - - [2408, 256, 64, 256]
    - [109, 47.932]
  - - [3456, 256, 2, 1024]
    - [70, 42.708]
  - - [672, 256, 64, 256]
    - [109, 37.36]
  - - [3456, 1024, 2, 256]
    - [78, 35.442]
  - - [1064, 256, 49, 256]
    - [78, 38.611]
  - - [3400, 256, 2, 1024]
    - [70, 41.239]
  - - [704, 256, 64, 256]
    - [109, 37.804]
  - - [3400, 1024, 2, 256]
    - [165, 34.567]
  - - [3264, 256, 64, 256]
    - [109, 47.783]
  - - [3800, 1024, 2, 256]
    - [109, 36.087]
  - - [3800, 256, 2, 1024]
    - [126, 38.045]
  - - [6440, 512, 1, 256]
    - [93, 27.726]
  - - [6912, 512, 1, 256]
    - [167, 30.469]
  - - [6800, 512, 1, 256]
    - [24, 29.192]
  - - [6800, 512, 1, 1024]
    - [54, 53.699]
  - - [6440, 512, 1, 1024]
    - [49, 53.882]
  - - [6912, 512, 1, 1024]
    - [36, 57.344]
  - - [1728, 1024, 1, 512]
    - [77, 31.998]
  - - [1536, 1024, 1, 512]
    - [77, 29.08]
  - - [7600, 512, 1, 1024]
    - [126, 47.455]
  - - [6144, 512, 1, 1024]
    - [54, 52.069]
  - - [1728, 1024, 1, 2048]
    - [153, 50.972]
  - - [1536, 1024, 1, 2048]
    - [55, 48.78]
  - - [1024, 320, 1, 1024]
    - [66, 14.54]
  - - [173280, 64, 1, 128]
    - [27, 18.236]
  - - [25992, 64, 1, 128]
    - [66, 12.626]
  - - [4524, 256, 49, 256]
    - [111, 46.913]
  - - [2666, 256, 64, 256]
    - [106, 43.866]
  - - [950, 2048, 2, 512]
    - [100, 34.64]
  - - [3220, 1024, 2, 256]
    - [100, 33.021]
  - - [782, 128, 64, 128]
    - [104, 18.701]
  - - [850, 2048, 2, 512]
    - [100, 34.39]
  - - [713, 512, 2, 2048]
    - [62, 30.299]
  - - [805, 2048, 2, 512]
    - [100, 34.52]
  - - [713, 2048, 2, 512]
    - [100, 32.15]
  - - [660, 512, 2, 2048]
    - [62, 29.423]
  - - [726, 512, 2, 2048]
    - [168, 30.852]
  - - [660, 2048, 2, 512]
    - [99, 30.163]
  - - [726, 2048, 2, 512]
    - [100, 33.179]
  - - [748, 512, 2, 2048]
    - [62, 31.673]
  - - [805, 2048, 2, 256]
    - [100, 24.138]
  - - [1251, 256, 49, 256]
    - [96, 34.289]
  - - [805, 512, 2, 2048]
    - [62, 33.844]
  - - [850, 512, 2, 2048]
    - [62, 28.367]
  - - [850, 256, 2, 3]
    - [20, 0.111]
  - - [805, 256, 2, 12]
    - [20, 0.398]
  - - [228, 256, 2, 12]
    - [19, 0.126]
  - - [228, 256, 2, 3]
    - [19, 0.032]
  - - [805, 256, 2, 3]
    - [19, 0.106]
  - - [850, 256, 2, 12]
    - [169, 0.417]
  - - [187, 256, 2, 12]
    - [19, 0.1]
  - - [247, 256, 2, 12]
    - [18, 0.134]
  - - [950, 256, 2, 12]
    - [170, 0.466]
  - - [950, 256, 2, 3]
    - [169, 0.121]
  - - [1900, 1024, 1, 2048]
    - [108, 41.645]
  - - [1610, 1024, 1, 2048]
    - [171, 44.912]
  - - [1900, 1024, 1, 512]
    - [100, 26.47]
  - - [3220, 256, 2, 12]
    - [30, 1.303]
  - - [187, 256, 2, 3]
    - [13, 0.027]
  - - [221, 256, 2, 3]
    - [18, 0.031]
  - - [221, 256, 2, 12]
    - [18, 0.12]
  - - [247, 256, 2, 3]
    - [19, 0.035]
  - - [3220, 256, 2, 3]
    - [30, 0.332]
  - - [3036, 1024, 2, 256]
    - [99, 30.761]
  - - [3036, 256, 2, 1024]
    - [171, 35.512]
  - - [850, 2048, 2, 256]
    - [100, 24.433]
  - - [2852, 1024, 2, 256]
    - [96, 30.464]
  - - [950, 2048, 2, 256]
    - [94, 24.188]
  - - [3700, 1024, 2, 256]
    - [100, 32.718]
  - - [2852, 256, 2, 1024]
    - [153, 33.492]
  - - [3700, 256, 2, 1024]
    - [108, 33.573]
  - - [1269, 256, 49, 256]
    - [106, 32.936]
  - - [1467, 256, 49, 256]
    - [106, 35.935]
  - - [3500, 256, 2, 1024]
    - [77, 38.935]
  - - [1449, 256, 49, 256]
    - [106, 35.663]
  - - [1278, 256, 49, 256]
    - [96, 33.775]
  - - [1413, 256, 49, 256]
    - [150, 33.789]
  - - [1341, 256, 49, 256]
    - [99, 34.264]
  - - [1287, 256, 49, 256]
    - [106, 33.475]
  - - [1332, 256, 49, 256]
    - [106, 36.648]
  - - [1359, 256, 49, 256]
    - [99, 34.216]
  - - [1395, 256, 49, 256]
    - [150, 33.919]
  - - [1323, 256, 49, 256]
    - [111, 34.387]
  - - [1404, 256, 49, 256]
    - [172, 35.597]
  - - [1386, 256, 49, 256]
    - [111, 36.469]
  - - [1350, 256, 49, 256]
    - [99, 36.946]
  - - [3500, 1024, 2, 256]
    - [100, 31.709]
  - - [3220, 256, 2, 1024]
    - [153, 37.222]
  - - [690, 256, 64, 256]
    - [107, 31.873]
  - - [660, 256, 64, 256]
    - [99, 33.393]
  - - [782, 256, 64, 256]
    - [100, 34.994]
  - - [884, 256, 64, 256]
    - [96, 33.88]
  - - [1610, 1024, 1, 512]
    - [62, 27.018]
  - - [1700, 1024, 1, 512]
    - [62, 26.288]
  - - [1700, 1024, 1, 2048]
    - [171, 47.311]
  - - [100, 512, 120, 128]
    - [107, 13.695]
  - - [100, 512, 18, 128]
    - [173, 6.097]
  - - [100, 512, 19, 128]
    - [84, 6.348]
  - - [1444, 128, 120, 256]
    - [99, 35.285]
  - - [1444, 128, 18, 256]
    - [99, 25.186]
  - - [1444, 128, 19, 256]
    - [99, 25.643]
  - - [1444, 256, 120, 256]
    - [111, 44.164]
  - - [1444, 256, 18, 256]
    - [99, 30.756]
  - - [1444, 256, 19, 256]
    - [99, 32.104]
  - - [25, 256, 120, 128]
    - [79, 5.128]
  - - [25, 256, 18, 128]
    - [13, 1.204]
  - - [25, 256, 19, 128]
    - [13, 1.28]
  - - [361, 512, 120, 256]
    - [107, 33.336]
  - - [361, 512, 18, 256]
    - [96, 23.811]
  - - [361, 512, 19, 256]
    - [94, 21.83]
  - - [9, 256, 120, 128]
    - [174, 2.088]
  - - [9, 256, 18, 128]
    - [13, 0.457]
  - - [9, 256, 19, 128]
    - [16, 0.471]
  - - [100, 2304, 1, 512]
    - [40, 5.987]
  - - [1444, 576, 1, 128]
    - [30, 6.484]
  - - [25, 1152, 1, 256]
    - [18, 0.569]
  - - [27436, 64, 1, 128]
    - [104, 11.254]
  - - [361, 2304, 1, 512]
    - [62, 17.836]
  - - [9, 1152, 1, 256]
    - [18, 0.208]
  - - [3840, 4223, 1, 3712]
    - [175, 89.228]
  - - [3840, 4225, 1, 3712]
    - [176, 84.24]
  - - [3840, 4223, 1, 3840]
    - [175, 89.252]
  - - [3840, 4225, 1, 3840]
    - [177, 84.44]
  - - [3840, 4223, 1, 3968]
    - [175, 89.639]
  - - [3840, 4225, 1, 3968]
    - [177, 84.658]
  - - [7680, 8447, 1, 7424]
    - [177, 98.336]
  - - [7680, 8449, 1, 7424]
    - [178, 93.336]
  - - [7680, 8447, 1, 7680]
    - [178, 98.413]
  - - [7680, 8449, 1, 7680]
    - [178, 93.338]
  - - [7680, 8447, 1, 7936]
    - [178, 98.414]
  - - [7680, 8449, 1, 7936]
    - [178, 93.378]
  - - [3840, 4224, 1, 3711]
    - [175, 89.143]
  - - [3840, 4224, 1, 3713]
    - [175, 90.451]
  - - [3840, 4224, 1, 3839]
    - [175, 89.092]
  - - [3840, 4224, 1, 3841]
    - [175, 90.634]
  - - [3840, 4224, 1, 3967]
    - [175, 89.516]
  - - [3840, 4224, 1, 3969]
    - [175, 90.738]
  - - [7680, 8448, 1, 7423]
    - [178, 98.274]
  - - [7680, 8448, 1, 7425]
    - [178, 98.522]
  - - [7680, 8448, 1, 7679]
    - [178, 98.312]
  - - [7680, 8448, 1, 7681]
    - [178, 98.551]
  - - [7680, 8448, 1, 7935]
    - [178, 98.35]
  - - [7680, 8448, 1, 7937]
    - [178, 98.578]
  - - [64, 32, 16, 32]
    - [14, 0.122]
  - - [64, 48, 16, 48]
    - [15, 0.261]
  - - [64, 80, 16, 80]
    - [14, 0.631]
  - - [64, 96, 16, 96]
    - [18, 0.901]
  - - [64, 160, 16, 160]
    - [64, 2.344]
  - - [64, 192, 16, 192]
    - [18, 3.198]
  - - [64, 240, 16, 240]
    - [161, 4.206]
  - - [64, 304, 16, 304]
    - [161, 6.128]
  - - [64, 320, 16, 320]
    - [41, 7.671]
  - - [64, 384, 16, 384]
    - [117, 9.666]
  - - [64, 416, 16, 416]
    - [67, 10.453]
  - - [64, 432, 16, 432]
    - [120, 9.876]
  - - [64, 448, 16, 448]
    - [71, 11.997]
  - - [64, 464, 16, 464]
    - [67, 11.342]
  - - [64, 480, 16, 480]
    - [67, 13.159]
  - - [64, 496, 16, 496]
    - [67, 12.503]
  - - [1024, 1024, 1, 5552]
    - [47, 50.299]
  - - [1024, 1024, 1, 6128]
    - [47, 52.422]
  - - [1024, 3072, 1, 7344]
    - [55, 79.791]
  - - [1024, 1024, 1, 7760]
    - [47, 56.764]
  - - [1024, 1024, 1, 5936]
    - [47, 51.945]
  - - [1024, 4096, 1, 5936]
    - [57, 75.567]
  - - [1024, 1024, 1, 5616]
    - [47, 51.272]
  - - [1024, 1024, 1, 5904]
    - [47, 51.935]
  - - [1024, 1024, 1, 5776]
    - [47, 51.812]
  - - [4096, 1024, 1, 7232]
    - [37, 78.131]
  - - [1024, 1024, 1, 5312]
    - [48, 52.078]
  - - [1024, 1024, 1, 5872]
    - [47, 51.769]
  - - [1024, 1024, 1, 6000]
    - [47, 52.196]
  - - [1024, 4096, 1, 8016]
    - [57, 79.279]
  - - [1024, 1024, 1, 5744]
    - [47, 51.603]
  - - [1024, 1024, 1, 5728]
    - [47, 51.735]
  - - [1024, 1024, 1, 5632]
    - [48, 52.514]
  - - [1024, 1024, 1, 5504]
    - [48, 52.185]
  - - [1024, 1024, 1, 5488]
    - [47, 49.987]
  - - [1024, 1024, 1, 5456]
    - [48, 50.199]
  - - [1024, 1024, 1, 6288]
    - [47, 52.647]
  - - [1024, 1024, 1, 6256]
    - [47, 53.018]
  - - [1024, 4096, 1, 7264]
    - [33, 79.22]
  - - [1024, 1024, 1, 6304]
    - [47, 53.272]
  - - [1024, 1024, 1, 5520]
    - [47, 50.201]
  - - [1024, 1024, 1, 5360]
    - [47, 49.664]
  - - [1024, 1024, 1, 5392]
    - [47, 49.688]
  - - [1024, 1024, 1, 5376]
    - [48, 52.229]
  - - [1024, 1024, 1, 5328]
    - [48, 49.836]
  - - [1024, 1024, 1, 6224]
    - [47, 52.52]
  - - [1024, 1024, 1, 6320]
    - [47, 52.691]
  - - [1024, 1024, 1, 5696]
    - [48, 52.407]
  - - [1024, 1024, 1, 6096]
    - [47, 52.376]
  - - [1024, 1024, 1, 5712]
    - [47, 51.355]
  - - [1024, 4096, 1, 6016]
    - [57, 76.813]
  - - [1024, 1024, 1, 11248]
    - [47, 63.007]
- null
