library/src/blas3/Tensile/Logic/asm_full/aldebaran_Cijk_Ailk_Bljk_HSS_BH.yaml
- {MinimumRequiredVersion: 4.23.0}
- aldebaran
- gfx90a
- [Device 0050, Device 0051, Device 0052, Device 0054, Device 0062, Device 7400, Device
    SolutionIndex: 0
    SolutionNameMin: Cijk_Ailk_Bljk_HSS_BH_MT128x128x4_SE_PGR0_PLR0_TT8_8
    SolutionIndex: 1
    SolutionNameMin: Cijk_Ailk_Bljk_HSS_BH_MT64x128x4_SE_PGR0_PLR0_TT4_8
    SolutionIndex: 2
    SolutionNameMin: Cijk_Ailk_Bljk_HSS_BH_MT64x64x4_SE_PGR0_PLR0_TT4_4
    SolutionIndex: 3
    SolutionNameMin: Cijk_Ailk_Bljk_HSS_BH_MT64x64x4_SE_PGR1_PLR0_TT4_4
    SolutionIndex: 4
    SolutionNameMin: Cijk_Ailk_Bljk_HSS_BH_MT64x64x4_SE_PGR0_PLR1_TT4_4
    SolutionIndex: 5
    SolutionNameMin: Cijk_Ailk_Bljk_HSS_BH_MT64x64x8_SE_PGR1_PLR0_TT4_4
    SolutionIndex: 6
    SolutionNameMin: Cijk_Ailk_Bljk_HSS_BH_MT64x64x8_SE_PGR0_PLR1_TT4_4
    SolutionIndex: 7
    SolutionNameMin: Cijk_Ailk_Bljk_HSS_BH_MT64x64x8_SE_PGR1_PLR1_TT4_4
    SolutionIndex: 8
    SolutionNameMin: Cijk_Ailk_Bljk_HSS_BH_MT128x96x64_MI32x32x8x1_SE_1LDSB0_AF0EM8_GRVW8_GSU15_LBSPP128_LPB8_LRVW8_NLCA1_PLR9_SU32_SUS128_SRVW0_TT1_96_VAW1_WG128_2_1_WGM1
    SolutionIndex: 9
    SolutionNameMin: Cijk_Ailk_Bljk_HSS_BH_MT32x32x64_MI16x16x16x1_SE_1LDSB0_AF0EM8_GRVW8_GSU1_LBSPP128_LPB8_LRVW8_NLCA1_PLR5_SU0_SUS0_SRVW4_TT1_16_VAW2_WG32_8_1_WGM15
    SolutionIndex: 10
    SolutionNameMin: Cijk_Ailk_Bljk_HSS_BH_MT32x32x128_MI16x16x16x1_SE_1LDSB0_AF0EM4_GRVW8_GSU1_LBSPP256_LPB8_LRVW4_NLCA1_PLR1_SU0_SUS0_SRVW0_TT1_16_VAW2_WG32_8_1_WGM15
    SolutionIndex: 11
    SolutionNameMin: Cijk_Ailk_Bljk_HSS_BH_MT32x32x128_MI16x16x16x1_SE_1LDSB0_AF0EM4_GRVW8_GSU1_LBSPP256_LPB8_LRVW4_NLCA1_PLR1_SU0_SUS0_SRVW0_TT1_16_VAW2_WG32_8_1_WGM2
    SolutionIndex: 12
    SolutionNameMin: Cijk_Ailk_Bljk_HSS_BH_MT32x32x64_MI16x16x16x1_SE_1LDSB0_AF0EM4_GRVW4_GSU1_LBSPP128_LPB4_LRVW4_NLCA1_PLR1_SU0_SUS0_SRVW0_TT1_16_VAW2_WG32_8_1_WGM15
    SolutionIndex: 13
    SolutionNameMin: Cijk_Ailk_Bljk_HSS_BH_MT64x16x32_MI16x16x16x1_SE_1LDSB0_AF0EM8_GRVW4_GSU1_LBSPP128_LPB8_LRVW8_NLCA1_PLR2_SU0_SUS0_SRVW0_TT1_16_VAW2_WG64_4_1_WGM2
    SolutionIndex: 14
    SolutionNameMin: Cijk_Ailk_Bljk_HSS_BH_MT32x32x64_MI16x16x16x1_SE_1LDSB0_AF0EM8_GRVW8_GSU1_LBSPP128_LPB8_LRVW8_NLCA1_PLR5_SU32_SUS128_SRVW4_TT1_16_VAW2_WG32_8_1_WGM1
    SolutionIndex: 15
    SolutionNameMin: Cijk_Ailk_Bljk_HSS_BH_MT32x32x128_MI16x16x16x1_SE_1LDSB0_AF0EM4_GRVW8_GSU1_LBSPP256_LPB8_LRVW4_NLCA1_PLR1_SU32_SUS256_SRVW0_TT1_16_VAW2_WG32_8_1_WGM2
    SolutionIndex: 16
    SolutionNameMin: Cijk_Ailk_Bljk_HSS_BH_MT32x32x64_MI16x16x16x1_SE_1LDSB0_AF0EM8_GRVW8_GSU1_LBSPP128_LPB8_LRVW8_NLCA1_PLR5_SU32_SUS256_SRVW4_TT1_16_VAW2_WG32_8_1_WGM15
    SolutionIndex: 17
    SolutionNameMin: Cijk_Ailk_Bljk_HSS_BH_MT32x32x128_MI16x16x16x1_SE_1LDSB0_AF0EM4_GRVW8_GSU1_LBSPP256_LPB8_LRVW4_NLCA1_PLR1_SU0_SUS0_SRVW0_TT1_16_VAW2_WG32_8_1_WGM1
    SolutionIndex: 18
    SolutionNameMin: Cijk_Ailk_Bljk_HSS_BH_MT64x32x128_MI16x16x16x1_SE_1LDSB0_AF0EM4_GRVW8_GSU1_LBSPP256_LPB8_LRVW4_NLCA1_PLR1_SU0_SUS0_SRVW0_TT2_16_VAW2_WG32_8_1_WGM15
    SolutionIndex: 19
    SolutionNameMin: Cijk_Ailk_Bljk_HSS_BH_MT32x32x128_MI16x16x16x1_SE_1LDSB0_AF0EM4_GRVW8_GSU1_LBSPP256_LPB8_LRVW4_NLCA1_PLR1_SU32_SUS256_SRVW0_TT1_16_VAW2_WG32_8_1_WGM1
    SolutionIndex: 20
    SolutionNameMin: Cijk_Ailk_Bljk_HSS_BH_MT32x32x32_MI16x16x16x1_SE_1LDSB0_AF0EM8_GRVW4_GSU1_LBSPP128_LPB8_LRVW8_NLCA1_PLR2_SU0_SUS0_SRVW4_TT1_16_VAW2_WG32_8_1_WGM1
    SolutionIndex: 21
    SolutionNameMin: Cijk_Ailk_Bljk_HSS_BH_MT32x32x32_MI16x16x16x1_SE_1LDSB0_AF0EM4_GRVW8_GSU1_LBSPP128_LPB8_LRVW4_NLCA1_PLR1_SU0_SUS0_SRVW0_TT1_16_VAW2_WG32_8_1_WGM15
    SolutionIndex: 22
    SolutionNameMin: Cijk_Ailk_Bljk_HSS_BH_MT32x32x128_MI16x16x16x1_SE_1LDSB0_AF0EM4_GRVW4_GSU1_LBSPP256_LPB4_LRVW4_NLCA1_PLR1_SU32_SUS256_SRVW0_TT1_16_VAW2_WG32_8_1_WGM15
    SolutionIndex: 23
    SolutionNameMin: Cijk_Ailk_Bljk_HSS_BH_MT32x32x64_MI16x16x16x1_SE_1LDSB0_AF0EM8_GRVW4_GSU1_LBSPP128_LPB8_LRVW8_NLCA1_PLR5_SU0_SUS0_SRVW4_TT1_16_VAW2_WG32_8_1_WGM2
    SolutionIndex: 24
    SolutionNameMin: Cijk_Ailk_Bljk_HSS_BH_MT32x32x32_MI16x16x16x1_SE_1LDSB0_AF0EM4_GRVW8_GSU1_LBSPP128_LPB8_LRVW4_NLCA1_PLR1_SU0_SUS0_SRVW0_TT1_16_VAW2_WG32_8_1_WGM1
    SolutionIndex: 25
    SolutionNameMin: Cijk_Ailk_Bljk_HSS_BH_MT32x32x32_MI16x16x16x1_SE_1LDSB0_AF0EM4_GRVW2_GSU1_LBSPP128_LPB4_LRVW4_NLCA1_PLR1_SU0_SUS0_SRVW0_TT1_16_VAW2_WG32_8_1_WGM1
    SolutionIndex: 26
    SolutionNameMin: Cijk_Ailk_Bljk_HSS_BH_MT32x32x32_MI16x16x16x1_SE_1LDSB0_AF0EM4_GRVW4_GSU1_LBSPP128_LPB4_LRVW4_NLCA1_PLR1_SU0_SUS0_SRVW0_TT1_16_VAW2_WG32_8_1_WGM1
    SolutionIndex: 27
    SolutionNameMin: Cijk_Ailk_Bljk_HSS_BH_MT32x32x32_MI16x16x16x1_SE_1LDSB0_AF0EM4_GRVW2_GSU1_LBSPP128_LPB4_LRVW4_NLCA1_PLR1_SU0_SUS0_SRVW0_TT1_16_VAW2_WG32_8_1_WGM15
    SolutionIndex: 28
    SolutionNameMin: Cijk_Ailk_Bljk_HSS_BH_MT32x64x64_MI16x16x16x1_SE_1LDSB0_AF0EM8_GRVW8_GSU1_LBSPP128_LPB8_LRVW8_NLCA1_PLR5_SU0_SUS0_SRVW4_TT1_32_VAW2_WG32_8_1_WGM2
    SolutionIndex: 29
    SolutionNameMin: Cijk_Ailk_Bljk_HSS_BH_MT64x16x32_MI16x16x16x1_SE_1LDSB0_AF0EM8_GRVW4_GSU1_LBSPP128_LPB8_LRVW8_NLCA1_PLR2_SU32_SUS256_SRVW4_TT1_16_VAW2_WG64_4_1_WGM15
    SolutionIndex: 30
    SolutionNameMin: Cijk_Ailk_Bljk_HSS_BH_MT32x64x32_MI16x16x16x1_SE_1LDSB1_AF0EM8_GRVW2_GSU1_LBSPP128_LPB8_LRVW8_NLCA1_PLR2_SU0_SUS0_SRVW4_TT1_32_VAW2_WG32_8_1_WGM15
    SolutionIndex: 31
    SolutionNameMin: Cijk_Ailk_Bljk_HSS_BH_MT32x64x32_MI16x16x16x1_SE_1LDSB0_AF0EM8_GRVW8_GSU1_LBSPP128_LPB8_LRVW8_NLCA1_PLR2_SU0_SUS0_SRVW4_TT1_32_VAW2_WG32_8_1_WGM1
    SolutionIndex: 32
    SolutionNameMin: Cijk_Ailk_Bljk_HSS_BH_MT32x64x64_MI16x16x16x1_SE_1LDSB0_AF0EM8_GRVW8_GSU1_LBSPP128_LPB8_LRVW8_NLCA1_PLR5_SU0_SUS0_SRVW4_TT1_32_VAW2_WG32_8_1_WGM15
    SolutionIndex: 33
    SolutionNameMin: Cijk_Ailk_Bljk_HSS_BH_MT64x64x32_MI32x32x8x1_SE_1LDSB0_AF0EM8_GRVW8_GSU1_LBSPP128_LPB8_LRVW8_NLCA1_PLR5_SU0_SUS0_SRVW4_TT1_32_VAW2_WG64_4_1_WGM1
    SolutionIndex: 34
    SolutionNameMin: Cijk_Ailk_Bljk_HSS_BH_MT32x32x128_MI16x16x16x1_SE_1LDSB0_AF0EM4_GRVW8_GSU1_LBSPP256_LPB8_LRVW4_NLCA1_PLR1_SU16_SUS256_SRVW0_TT1_16_VAW2_WG32_8_1_WGM1
    SolutionIndex: 35
    SolutionNameMin: Cijk_Ailk_Bljk_HSS_BH_MT32x32x128_MI16x16x16x1_SE_1LDSB0_AF0EM1_GRVW8_GSU1_LBSPP256_LPB8_LRVW4_NLCA1_PLR1_SU16_SUS256_SRVW0_TT1_16_VAW2_WG32_8_1_WGM1
    SolutionIndex: 36
    SolutionNameMin: Cijk_Ailk_Bljk_HSS_BH_MT32x32x128_MI16x16x16x1_SE_1LDSB0_AF0EM1_GRVW8_GSU1_LBSPP256_LPB8_LRVW4_NLCA1_PLR1_SU16_SUS256_SRVW0_TT1_16_VAW2_WG32_8_1_WGM2
    SolutionIndex: 37
    SolutionNameMin: Cijk_Ailk_Bljk_HSS_BH_MT32x64x128_MI16x16x16x1_SE_1LDSB0_AF0EM4_GRVW8_GSU1_LBSPP256_LPB8_LRVW4_NLCA1_PLR1_SU16_SUS256_SRVW0_TT1_32_VAW2_WG32_8_1_WGM1
    SolutionIndex: 38
    SolutionNameMin: Cijk_Ailk_Bljk_HSS_BH_MT32x64x128_MI16x16x16x1_SE_1LDSB0_AF0EM4_GRVW8_GSU1_LBSPP256_LPB8_LRVW4_NLCA1_PLR1_SU16_SUS256_SRVW0_TT1_32_VAW2_WG32_8_1_WGM2
    SolutionIndex: 39
    SolutionNameMin: Cijk_Ailk_Bljk_HSS_BH_MT64x64x64_MI32x32x8x1_SE_1LDSB0_AF0EM8_GRVW8_GSU1_LBSPP128_LPB8_LRVW8_NLCA1_PLR9_SU0_SUS0_SRVW4_TT1_32_VAW2_WG64_4_1_WGM1
    SolutionIndex: 40
    SolutionNameMin: Cijk_Ailk_Bljk_HSS_BH_MT64x64x64_MI32x32x8x1_SE_1LDSB0_AF0EM8_GRVW8_GSU1_LBSPP128_LPB8_LRVW8_NLCA1_PLR9_SU32_SUS256_SRVW4_TT1_32_VAW2_WG64_4_1_WGM15
    SolutionIndex: 41
    SolutionNameMin: Cijk_Ailk_Bljk_HSS_BH_MT64x80x64_MI16x16x16x1_SE_1LDSB0_AF0EM4_GRVW2_GSU1_LBSPP128_LPB4_LRVW4_NLCA1_PLR1_SU16_SUS256_SRVW0_TT1_80_VAW2_WG64_4_1_WGM15
    SolutionIndex: 42
    SolutionNameMin: Cijk_Ailk_Bljk_HSS_BH_MT64x128x64_MI32x32x8x1_SE_1LDSB0_AF0EM8_GRVW8_GSU1_LBSPP128_LPB8_LRVW8_NLCA1_PLR9_SU0_SUS0_SRVW4_TT1_64_VAW2_WG64_4_1_WGM15
    SolutionIndex: 43
    SolutionNameMin: Cijk_Ailk_Bljk_HSS_BH_MT32x64x64_MI16x16x16x1_SE_1LDSB0_AF0EM1_GRVW8_GSU7_LBSPP128_LPB8_LRVW8_NLCA1_PLR5_SU0_SUS0_SRVW0_TT1_32_VAW1_WG32_8_1_WGM2
    SolutionIndex: 44
    SolutionNameMin: Cijk_Ailk_Bljk_HSS_BH_MT64x32x64_MI16x16x16x1_SE_1LDSB0_AF0EM8_GRVW8_GSU7_LBSPP128_LPB8_LRVW8_NLCA1_PLR5_SU0_SUS0_SRVW0_TT2_16_VAW1_WG32_8_1_WGM1
    SolutionIndex: 45
    SolutionNameMin: Cijk_Ailk_Bljk_HSS_BH_MT32x32x128_MI16x16x16x1_SE_1LDSB0_AF0EM4_GRVW8_GSU1_LBSPP256_LPB8_LRVW4_NLCA1_PLR1_SU16_SUS256_SRVW0_TT1_16_VAW2_WG32_8_1_WGM2
    SolutionIndex: 46
    SolutionNameMin: Cijk_Ailk_Bljk_HSS_BH_MT32x64x128_MI16x16x16x1_SE_1LDSB0_AF0EM4_GRVW8_GSU1_LBSPP256_LPB8_LRVW4_NLCA1_PLR1_SU16_SUS256_SRVW0_TT1_32_VAW2_WG32_8_1_WGM15
    SolutionIndex: 47
    SolutionNameMin: Cijk_Ailk_Bljk_HSS_BH_MT32x64x128_MI16x16x16x1_SE_1LDSB0_AF0EM4_GRVW8_GSU1_LBSPP256_LPB8_LRVW4_NLCA1_PLR1_SU32_SUS256_SRVW0_TT1_32_VAW2_WG32_8_1_WGM1
    SolutionIndex: 48
    SolutionNameMin: Cijk_Ailk_Bljk_HSS_BH_MT64x128x64_MI32x32x8x1_SE_1LDSB0_AF0EM8_GRVW8_GSU1_LBSPP128_LPB8_LRVW8_NLCA1_PLR9_SU0_SUS0_SRVW4_TT1_64_VAW2_WG64_4_1_WGM1
    SolutionIndex: 49
    SolutionNameMin: Cijk_Ailk_Bljk_HSS_BH_MT32x32x64_MI16x16x16x1_SE_1LDSB0_AF0EM8_GRVW8_GSU1_LBSPP128_LPB8_LRVW8_NLCA1_PLR5_SU0_SUS0_SRVW4_TT1_16_VAW2_WG32_8_1_WGM2
    SolutionIndex: 50
    SolutionNameMin: Cijk_Ailk_Bljk_HSS_BH_MT64x32x32_MI16x16x16x1_SE_1LDSB0_AF0EM8_GRVW8_GSU1_LBSPP128_LPB8_LRVW8_NLCA1_PLR2_SU0_SUS0_SRVW4_TT2_16_VAW2_WG32_8_1_WGM1
    SolutionIndex: 51
    SolutionNameMin: Cijk_Ailk_Bljk_HSS_BH_MT64x32x32_MI16x16x16x1_SE_1LDSB0_AF0EM8_GRVW8_GSU1_LBSPP128_LPB8_LRVW8_NLCA1_PLR2_SU0_SUS0_SRVW4_TT2_16_VAW2_WG32_8_1_WGM15
    SolutionIndex: 52
    SolutionNameMin: Cijk_Ailk_Bljk_HSS_BH_MT64x32x32_MI16x16x16x1_SE_1LDSB1_AF0EM8_GRVW2_GSU1_LBSPP128_LPB8_LRVW8_NLCA1_PLR2_SU0_SUS0_SRVW4_TT2_16_VAW2_WG32_8_1_WGM15
    SolutionIndex: 53
    SolutionNameMin: Cijk_Ailk_Bljk_HSS_BH_MT64x32x32_MI16x16x16x1_SE_1LDSB0_AF0EM4_GRVW4_GSU1_LBSPP128_LPB4_LRVW4_NLCA1_PLR1_SU0_SUS0_SRVW0_TT2_16_VAW2_WG32_8_1_WGM2
    SolutionIndex: 54
    SolutionNameMin: Cijk_Ailk_Bljk_HSS_BH_MT64x64x32_MI32x32x8x1_SE_1LDSB0_AF0EM4_GRVW4_GSU1_LBSPP128_LPB4_LRVW4_NLCA1_PLR1_SU32_SUS128_SRVW4_TT1_32_VAW2_WG64_4_1_WGM15
    SolutionIndex: 55
    SolutionNameMin: Cijk_Ailk_Bljk_HSS_BH_MT64x128x64_MI32x32x8x1_SE_1LDSB0_AF0EM8_GRVW8_GSU1_LBSPP128_LPB8_LRVW8_NLCA1_PLR9_SU32_SUS128_SRVW4_TT1_64_VAW2_WG64_4_1_WGM15
    SolutionIndex: 56
    SolutionNameMin: Cijk_Ailk_Bljk_HSS_BH_MT64x128x64_MI32x32x8x1_SE_1LDSB0_AF0EM1_GRVW8_GSU1_LBSPP128_LPB8_LRVW8_NLCA1_PLR9_SU32_SUS128_SRVW4_TT1_64_VAW2_WG64_4_1_WGM1
    SolutionIndex: 57
    SolutionNameMin: Cijk_Ailk_Bljk_HSS_BH_MT64x64x64_MI32x32x8x1_SE_1LDSB0_AF0EM4_GRVW8_GSU1_LBSPP128_LPB8_LRVW4_NLCA1_PLR1_SU16_SUS128_SRVW4_TT1_32_VAW2_WG64_4_1_WGM2
    SolutionIndex: 58
    SolutionNameMin: Cijk_Ailk_Bljk_HSS_BH_MT64x128x64_MI32x32x8x1_SE_1LDSB0_AF0EM4_GRVW8_GSU1_LBSPP128_LPB8_LRVW4_NLCA1_PLR1_SU32_SUS256_SRVW4_TT1_64_VAW2_WG64_4_1_WGM15
    SolutionIndex: 59
    SolutionNameMin: Cijk_Ailk_Bljk_HSS_BH_MT64x128x64_MI32x32x8x1_SE_1LDSB0_AF0EM4_GRVW8_GSU1_LBSPP128_LPB8_LRVW4_NLCA1_PLR1_SU32_SUS256_SRVW4_TT1_64_VAW2_WG64_4_1_WGM2
    SolutionIndex: 60
    SolutionNameMin: Cijk_Ailk_Bljk_HSS_BH_MT128x64x64_MI32x32x8x1_SE_1LDSB0_AF0EM4_GRVW8_GSU1_LBSPP128_LPB8_LRVW4_NLCA1_PLR1_SU0_SUS0_SRVW4_TT2_32_VAW2_WG64_4_1_WGM15
    SolutionIndex: 61
    SolutionNameMin: Cijk_Ailk_Bljk_HSS_BH_MT64x128x64_MI32x32x8x1_SE_1LDSB0_AF0EM1_GRVW8_GSU1_LBSPP128_LPB8_LRVW8_NLCA1_PLR9_SU32_SUS256_SRVW4_TT1_64_VAW2_WG64_4_1_WGM2
    SolutionIndex: 62
    SolutionNameMin: Cijk_Ailk_Bljk_HSS_BH_MT64x128x32_MI32x32x8x1_SE_1LDSB0_AF0EM8_GRVW8_GSU1_LBSPP128_LPB8_LRVW8_NLCA1_PLR5_SU32_SUS128_SRVW4_TT1_64_VAW2_WG64_4_1_WGM2
    SolutionIndex: 63
    SolutionNameMin: Cijk_Ailk_Bljk_HSS_BH_MT64x128x32_MI32x32x8x1_SE_1LDSB0_AF0EM8_GRVW8_GSU1_LBSPP128_LPB8_LRVW8_NLCA1_PLR5_SU32_SUS128_SRVW4_TT1_64_VAW2_WG64_4_1_WGM1
    SolutionIndex: 64
    SolutionNameMin: Cijk_Ailk_Bljk_HSS_BH_MT64x128x32_MI32x32x8x1_SE_1LDSB0_AF0EM8_GRVW4_GSU1_LBSPP128_LPB8_LRVW8_NLCA1_PLR5_SU32_SUS128_SRVW4_TT1_64_VAW2_WG64_4_1_WGM2
    SolutionIndex: 65
    SolutionNameMin: Cijk_Ailk_Bljk_HSS_BH_MT64x128x32_MI32x32x8x1_SE_1LDSB0_AF0EM8_GRVW8_GSU1_LBSPP128_LPB8_LRVW8_NLCA1_PLR5_SU0_SUS0_SRVW4_TT1_64_VAW2_WG64_4_1_WGM2
    SolutionIndex: 66
    SolutionNameMin: Cijk_Ailk_Bljk_HSS_BH_MT128x80x32_MI16x16x16x1_SE_1LDSB0_AF0EM4_GRVW2_GSU1_LBSPP128_LPB4_LRVW4_NLCA1_PLR1_SU0_SUS0_SRVW4_TT2_80_VAW2_WG64_4_1_WGM1
    SolutionIndex: 67
    SolutionNameMin: Cijk_Ailk_Bljk_HSS_BH_MT128x80x32_MI16x16x16x1_SE_1LDSB0_AF0EM4_GRVW2_GSU1_LBSPP128_LPB4_LRVW4_NLCA1_PLR1_SU16_SUS256_SRVW0_TT2_80_VAW2_WG64_4_1_WGM1
    SolutionIndex: 68
    SolutionNameMin: Cijk_Ailk_Bljk_HSS_BH_MT128x96x32_MI32x32x8x1_SE_1LDSB0_AF0EM4_GRVW4_GSU1_LBSPP128_LPB4_LRVW4_NLCA1_PLR1_SU0_SUS0_SRVW4_TT1_96_VAW2_WG128_2_1_WGM15
    SolutionIndex: 69
    SolutionNameMin: Cijk_Ailk_Bljk_HSS_BH_MT96x96x32_MI16x16x16x1_SE_1LDSB1_AF0EM8_GRVW4_GSU1_LBSPP128_LPB8_LRVW8_NLCA3_PLR2_SU0_SUS0_SRVW0_TT3_48_VAW2_WG32_8_1_WGM1
    SolutionIndex: 70
    SolutionNameMin: Cijk_Ailk_Bljk_HSS_BH_MT128x96x32_MI32x32x8x1_SE_1LDSB1_AF0EM8_GRVW2_GSU1_LBSPP128_LPB8_LRVW8_NLCA1_PLR5_SU0_SUS0_SRVW4_TT1_96_VAW2_WG128_2_1_WGM1
    SolutionIndex: 71
    SolutionNameMin: Cijk_Ailk_Bljk_HSS_BH_MT64x128x32_MI32x32x8x1_SE_1LDSB0_AF0EM8_GRVW8_GSU1_LBSPP128_LPB8_LRVW8_NLCA1_PLR5_SU0_SUS0_SRVW4_TT1_64_VAW2_WG64_4_1_WGM15
    SolutionIndex: 72
    SolutionNameMin: Cijk_Ailk_Bljk_HSS_BH_MT128x96x32_MI32x32x8x1_SE_1LDSB0_AF0EM4_GRVW4_GSU1_LBSPP128_LPB4_LRVW4_NLCA1_PLR1_SU32_SUS256_SRVW4_TT1_96_VAW2_WG128_2_1_WGM1
    SolutionIndex: 73
    SolutionNameMin: Cijk_Ailk_Bljk_HSS_BH_MT128x144x32_MI16x16x16x1_SE_1LDSB1_AF0EM8_GRVW2_GSU1_LBSPP128_LPB8_LRVW8_NLCA1_PLR2_SU0_SUS0_SRVW4_TT2_144_VAW2_WG64_4_1_WGM1
    SolutionIndex: 74
    SolutionNameMin: Cijk_Ailk_Bljk_HSS_BH_MT128x160x32_MI32x32x8x1_SE_1LDSB1_AF0EM8_GRVW2_GSU1_LBSPP128_LPB8_LRVW8_NLCA1_PLR5_SU0_SUS0_SRVW4_TT1_160_VAW2_WG128_2_1_WGM1
    SolutionIndex: 75
    SolutionNameMin: Cijk_Ailk_Bljk_HSS_BH_MT64x32x32_MI16x16x16x1_SE_1LDSB1_AF0EM1_GRVW2_GSU1_LBSPP128_LPB8_LRVW8_NLCA1_PLR2_SU0_SUS0_SRVW4_TT2_16_VAW2_WG32_8_1_WGM1
    SolutionIndex: 76
    SolutionNameMin: Cijk_Ailk_Bljk_HSS_BH_MT128x96x32_MI32x32x8x1_SE_1LDSB1_AF0EM8_GRVW2_GSU1_LBSPP128_LPB8_LRVW8_NLCA1_PLR5_SU0_SUS0_SRVW4_TT1_96_VAW2_WG128_2_1_WGM2
    SolutionIndex: 77
    SolutionNameMin: Cijk_Ailk_Bljk_HSS_BH_MT32x64x32_MI16x16x16x1_SE_1LDSB0_AF0EM4_GRVW2_GSU1_LBSPP128_LPB4_LRVW4_NLCA1_PLR1_SU0_SUS0_SRVW0_TT1_32_VAW2_WG32_8_1_WGM15
    SolutionIndex: 78
    SolutionNameMin: Cijk_Ailk_Bljk_HSS_BH_MT128x96x32_MI32x32x8x1_SE_1LDSB0_AF0EM8_GRVW4_GSU1_LBSPP128_LPB8_LRVW8_NLCA1_PLR5_SU0_SUS0_SRVW4_TT1_96_VAW2_WG128_2_1_WGM2
    SolutionIndex: 79
    SolutionNameMin: Cijk_Ailk_Bljk_HSS_BH_MT128x96x32_MI32x32x8x1_SE_1LDSB0_AF0EM8_GRVW4_GSU1_LBSPP128_LPB8_LRVW8_NLCA1_PLR5_SU0_SUS0_SRVW4_TT1_96_VAW2_WG128_2_1_WGM15
    SolutionIndex: 80
    SolutionNameMin: Cijk_Ailk_Bljk_HSS_BH_MT64x128x32_MI32x32x8x1_SE_1LDSB0_AF0EM8_GRVW8_GSU1_LBSPP128_LPB8_LRVW8_NLCA1_PLR5_SU0_SUS0_SRVW4_TT1_64_VAW2_WG64_4_1_WGM1
    SolutionIndex: 81
    SolutionNameMin: Cijk_Ailk_Bljk_HSS_BH_MT128x96x64_MI32x32x8x1_SE_1LDSB0_AF0EM4_GRVW8_GSU1_LBSPP128_LPB8_LRVW4_NLCA1_PLR1_SU0_SUS0_SRVW4_TT1_96_VAW2_WG128_2_1_WGM15
    SolutionIndex: 82
    SolutionNameMin: Cijk_Ailk_Bljk_HSS_BH_MT128x96x64_MI32x32x8x1_SE_1LDSB0_AF0EM4_GRVW8_GSU1_LBSPP128_LPB8_LRVW4_NLCA1_PLR1_SU16_SUS128_SRVW4_TT1_96_VAW2_WG128_2_1_WGM15
    SolutionIndex: 83
    SolutionNameMin: Cijk_Ailk_Bljk_HSS_BH_MT64x128x32_MI32x32x8x1_SE_1LDSB0_AF0EM4_GRVW8_GSU1_LBSPP128_LPB8_LRVW4_NLCA1_PLR1_SU0_SUS0_SRVW4_TT1_64_VAW2_WG64_4_1_WGM15
    SolutionIndex: 84
    SolutionNameMin: Cijk_Ailk_Bljk_HSS_BH_MT128x160x32_MI32x32x8x1_SE_1LDSB0_AF0EM4_GRVW4_GSU1_LBSPP128_LPB4_LRVW4_NLCA1_PLR1_SU32_SUS128_SRVW4_TT1_160_VAW2_WG128_2_1_WGM2
    SolutionIndex: 85
    SolutionNameMin: Cijk_Ailk_Bljk_HSS_BH_MT128x256x32_MI32x32x8x1_SE_1LDSB1_AF0EM8_GRVW8_GSU1_LBSPP128_LPB8_LRVW8_NLCA1_PLR5_SU32_SUS128_SRVW4_TT2_128_VAW2_WG64_4_1_WGM2
    SolutionIndex: 86
    SolutionNameMin: Cijk_Ailk_Bljk_HSS_BH_MT128x256x32_MI32x32x8x1_SE_1LDSB0_AF0EM8_GRVW8_GSU1_LBSPP128_LPB8_LRVW8_NLCA1_PLR5_SU32_SUS128_SRVW4_TT2_128_VAW2_WG64_4_1_WGM15
    SolutionIndex: 87
    SolutionNameMin: Cijk_Ailk_Bljk_HSS_BH_MT64x128x64_MI32x32x8x1_SE_1LDSB0_AF0EM8_GRVW8_GSU1_LBSPP128_LPB8_LRVW8_NLCA1_PLR9_SU0_SUS0_SRVW4_TT1_64_VAW2_WG64_4_1_WGM2
    SolutionIndex: 88
    SolutionNameMin: Cijk_Ailk_Bljk_HSS_BH_MT128x160x32_MI32x32x8x1_SE_1LDSB0_AF0EM4_GRVW4_GSU1_LBSPP128_LPB4_LRVW4_NLCA1_PLR1_SU16_SUS128_SRVW4_TT1_160_VAW2_WG128_2_1_WGM2
    SolutionIndex: 89
    SolutionNameMin: Cijk_Ailk_Bljk_HSS_BH_MT128x256x32_MI32x32x8x1_SE_1LDSB1_AF0EM8_GRVW8_GSU1_LBSPP128_LPB8_LRVW8_NLCA1_PLR5_SU32_SUS128_SRVW4_TT2_128_VAW2_WG64_4_1_WGM15
    SolutionIndex: 90
    SolutionNameMin: Cijk_Ailk_Bljk_HSS_BH_MT128x96x32_MI32x32x8x1_SE_1LDSB1_AF0EM8_GRVW2_GSU1_LBSPP128_LPB8_LRVW8_NLCA1_PLR5_SU32_SUS128_SRVW4_TT1_96_VAW2_WG128_2_1_WGM15
    SolutionIndex: 91
    SolutionNameMin: Cijk_Ailk_Bljk_HSS_BH_MT64x80x64_MI16x16x16x1_SE_1LDSB0_AF0EM4_GRVW2_GSU1_LBSPP128_LPB4_LRVW4_NLCA1_PLR1_SU16_SUS128_SRVW0_TT1_80_VAW2_WG64_4_1_WGM2
    SolutionIndex: 92
    SolutionNameMin: Cijk_Ailk_Bljk_HSS_BH_MT64x128x32_MI32x32x8x1_SE_1LDSB0_AF0EM4_GRVW8_GSU1_LBSPP128_LPB8_LRVW4_NLCA1_PLR1_SU16_SUS256_SRVW4_TT1_64_VAW2_WG64_4_1_WGM15
    SolutionIndex: 93
    SolutionNameMin: Cijk_Ailk_Bljk_HSS_BH_MT128x256x32_MI32x32x8x1_SE_1LDSB0_AF0EM1_GRVW8_GSU1_LBSPP128_LPB8_LRVW4_NLCA1_PLR1_SU16_SUS256_SRVW4_TT2_128_VAW2_WG64_4_1_WGM2
    SolutionIndex: 94
    SolutionNameMin: Cijk_Ailk_Bljk_HSS_BH_MT128x256x32_MI32x32x8x1_SE_1LDSB0_AF0EM1_GRVW8_GSU1_LBSPP128_LPB8_LRVW4_NLCA1_PLR1_SU16_SUS128_SRVW4_TT2_128_VAW2_WG64_4_1_WGM2
    SolutionIndex: 95
    SolutionNameMin: Cijk_Ailk_Bljk_HSS_BH_MT160x160x64_MI16x16x16x1_SE_1LDSB1_AF0EM8_GRVW8_GSU1_LBSPP128_LPB8_LRVW8_NLCA5_PLR5_SU0_SUS0_SRVW0_TT5_80_VAW2_WG32_8_1_WGM15
    SolutionIndex: 96
    SolutionNameMin: Cijk_Ailk_Bljk_HSS_BH_MT256x128x32_MI32x32x8x1_SE_1LDSB0_AF0EM4_GRVW8_GSU1_LBSPP128_LPB8_LRVW4_NLCA1_PLR1_SU0_SUS0_SRVW0_TT4_64_VAW2_WG64_4_1_WGM15
    SolutionIndex: 97
    SolutionNameMin: Cijk_Ailk_Bljk_HSS_BH_MT256x160x32_MI32x32x8x1_SE_1LDSB0_AF0EM8_GRVW4_GSU1_LBSPP128_LPB8_LRVW8_NLCA1_PLR5_SU32_SUS128_SRVW4_TT2_160_VAW2_WG128_2_1_WGM15
    SolutionIndex: 98
    SolutionNameMin: Cijk_Ailk_Bljk_HSS_BH_MT128x96x32_MI32x32x8x1_SE_1LDSB0_AF0EM4_GRVW4_GSU1_LBSPP128_LPB4_LRVW4_NLCA1_PLR1_SU0_SUS0_SRVW4_TT1_96_VAW2_WG128_2_1_WGM2
    SolutionIndex: 99
    SolutionNameMin: Cijk_Ailk_Bljk_HSS_BH_MT128x160x32_MI32x32x8x1_SE_1LDSB1_AF0EM8_GRVW2_GSU1_LBSPP128_LPB8_LRVW8_NLCA1_PLR5_SU32_SUS256_SRVW4_TT1_160_VAW2_WG128_2_1_WGM1
    SolutionIndex: 100
    SolutionNameMin: Cijk_Ailk_Bljk_HSS_BH_MT128x256x32_MI32x32x8x1_SE_1LDSB0_AF0EM8_GRVW8_GSU1_LBSPP128_LPB8_LRVW8_NLCA1_PLR5_SU0_SUS0_SRVW4_TT2_128_VAW2_WG64_4_1_WGM15
    SolutionIndex: 101
    SolutionNameMin: Cijk_Ailk_Bljk_HSS_BH_MT128x160x32_MI32x32x8x1_SE_1LDSB1_AF0EM8_GRVW2_GSU1_LBSPP128_LPB8_LRVW8_NLCA1_PLR5_SU32_SUS128_SRVW4_TT1_160_VAW2_WG128_2_1_WGM2
    SolutionIndex: 102
    SolutionNameMin: Cijk_Ailk_Bljk_HSS_BH_MT128x160x32_MI32x32x8x1_SE_1LDSB1_AF0EM8_GRVW2_GSU1_LBSPP128_LPB8_LRVW8_NLCA1_PLR5_SU0_SUS0_SRVW4_TT1_160_VAW2_WG128_2_1_WGM2
    SolutionIndex: 103
    SolutionNameMin: Cijk_Ailk_Bljk_HSS_BH_MT128x256x32_MI32x32x8x1_SE_1LDSB0_AF0EM8_GRVW8_GSU1_LBSPP128_LPB8_LRVW8_NLCA1_PLR5_SU0_SUS0_SRVW4_TT2_128_VAW2_WG64_4_1_WGM1
    SolutionIndex: 104
    SolutionNameMin: Cijk_Ailk_Bljk_HSS_BH_MT128x96x64_MI32x32x8x1_SE_1LDSB0_AF0EM4_GRVW8_GSU1_LBSPP128_LPB8_LRVW4_NLCA1_PLR1_SU32_SUS128_SRVW4_TT1_96_VAW2_WG128_2_1_WGM2
    SolutionIndex: 105
    SolutionNameMin: Cijk_Ailk_Bljk_HSS_BH_MT64x128x32_MI32x32x8x1_SE_1LDSB0_AF0EM1_GRVW8_GSU1_LBSPP128_LPB8_LRVW8_NLCA1_PLR5_SU0_SUS0_SRVW4_TT1_64_VAW2_WG64_4_1_WGM15
    SolutionIndex: 106
    SolutionNameMin: Cijk_Ailk_Bljk_HSS_BH_MT128x256x32_MI32x32x8x1_SE_1LDSB0_AF0EM4_GRVW8_GSU1_LBSPP128_LPB8_LRVW4_NLCA1_PLR1_SU32_SUS256_SRVW4_TT2_128_VAW2_WG64_4_1_WGM1
    SolutionIndex: 107
    SolutionNameMin: Cijk_Ailk_Bljk_HSS_BH_MT128x256x32_MI32x32x8x1_SE_1LDSB1_AF0EM8_GRVW8_GSU1_LBSPP128_LPB8_LRVW8_NLCA1_PLR5_SU0_SUS0_SRVW4_TT2_128_VAW2_WG64_4_1_WGM1
    SolutionIndex: 108
    SolutionNameMin: Cijk_Ailk_Bljk_HSS_BH_MT128x256x32_MI32x32x8x1_SE_1LDSB0_AF0EM4_GRVW8_GSU1_LBSPP128_LPB8_LRVW4_NLCA1_PLR1_SU0_SUS0_SRVW4_TT2_128_VAW2_WG64_4_1_WGM1
    SolutionIndex: 109
    SolutionNameMin: Cijk_Ailk_Bljk_HSS_BH_MT64x128x64_MI32x32x8x1_SE_1LDSB0_AF0EM4_GRVW8_GSU1_LBSPP128_LPB8_LRVW4_NLCA1_PLR1_SU16_SUS128_SRVW4_TT1_64_VAW2_WG64_4_1_WGM1
    SolutionIndex: 110
    SolutionNameMin: Cijk_Ailk_Bljk_HSS_BH_MT128x128x64_MI32x32x8x1_SE_1LDSB1_AF0EM8_GRVW2_GSU1_LBSPP128_LPB8_LRVW8_NLCA1_PLR9_SU0_SUS0_SRVW4_TT2_64_VAW2_WG64_4_1_WGM1
    SolutionIndex: 111
    SolutionNameMin: Cijk_Ailk_Bljk_HSS_BH_MT128x160x64_MI32x32x8x1_SE_1LDSB1_AF0EM8_GRVW2_GSU1_LBSPP128_LPB8_LRVW8_NLCA1_PLR9_SU32_SUS128_SRVW4_TT1_160_VAW2_WG128_2_1_WGM1
    SolutionIndex: 112
    SolutionNameMin: Cijk_Ailk_Bljk_HSS_BH_MT256x144x32_MI16x16x16x1_SE_1LDSB0_AF0EM4_GRVW2_GSU1_LBSPP128_LPB4_LRVW4_NLCA2_PLR1_SU0_SUS0_SRVW0_TT4_144_VAW2_WG64_4_1_WGM15
    SolutionIndex: 113
    SolutionNameMin: Cijk_Ailk_Bljk_HSS_BH_MT128x160x64_MI32x32x8x1_SE_1LDSB1_AF0EM8_GRVW2_GSU1_LBSPP128_LPB8_LRVW8_NLCA1_PLR9_SU0_SUS0_SRVW4_TT1_160_VAW2_WG128_2_1_WGM15
    SolutionIndex: 114
    SolutionNameMin: Cijk_Ailk_Bljk_HSS_BH_MT256x128x32_MI32x32x4x2_SE_1LDSB0_AF0EM4_GRVW8_GSU1_LBSPP128_LPB8_LRVW4_NLCA1_PLR1_SU0_SUS0_SRVW0_TT2_64_VAW2_WG128_2_1_WGM1
    SolutionIndex: 115
    SolutionNameMin: Cijk_Ailk_Bljk_HSS_BH_MT256x160x32_MI32x32x8x1_SE_1LDSB0_AF0EM8_GRVW4_GSU1_LBSPP128_LPB8_LRVW8_NLCA1_PLR5_SU0_SUS0_SRVW4_TT2_160_VAW2_WG128_2_1_WGM2
    SolutionIndex: 116
    SolutionNameMin: Cijk_Ailk_Bljk_HSS_BH_MT256x160x32_MI32x32x8x1_SE_1LDSB0_AF0EM8_GRVW4_GSU1_LBSPP128_LPB8_LRVW8_NLCA1_PLR5_SU0_SUS0_SRVW4_TT2_160_VAW2_WG128_2_1_WGM1
    SolutionIndex: 117
    SolutionNameMin: Cijk_Ailk_Bljk_HSS_BH_MT256x144x32_MI16x16x16x1_SE_1LDSB0_AF0EM4_GRVW2_GSU1_LBSPP128_LPB4_LRVW4_NLCA2_PLR1_SU32_SUS128_SRVW4_TT4_144_VAW2_WG64_4_1_WGM2
    SolutionIndex: 118
    SolutionNameMin: Cijk_Ailk_Bljk_HSS_BH_MT256x144x32_MI16x16x16x1_SE_1LDSB0_AF0EM4_GRVW2_GSU1_LBSPP128_LPB4_LRVW4_NLCA2_PLR1_SU32_SUS128_SRVW4_TT4_144_VAW2_WG64_4_1_WGM15
    SolutionIndex: 119
    SolutionNameMin: Cijk_Ailk_Bljk_HSS_BH_MT256x160x32_MI32x32x8x1_SE_1LDSB0_AF0EM8_GRVW4_GSU1_LBSPP128_LPB8_LRVW8_NLCA1_PLR5_SU32_SUS128_SRVW4_TT2_160_VAW2_WG128_2_1_WGM2
    SolutionIndex: 120
    SolutionNameMin: Cijk_Ailk_Bljk_HSS_BH_MT256x128x32_MI32x32x8x1_SE_1LDSB0_AF0EM1_GRVW8_GSU1_LBSPP128_LPB8_LRVW4_NLCA1_PLR1_SU0_SUS0_SRVW0_TT4_64_VAW2_WG64_4_1_WGM15
    SolutionIndex: 121
    SolutionNameMin: Cijk_Ailk_Bljk_HSS_BH_MT256x144x32_MI16x16x16x1_SE_1LDSB0_AF0EM4_GRVW2_GSU1_LBSPP128_LPB4_LRVW4_NLCA2_PLR1_SU16_SUS128_SRVW4_TT4_144_VAW2_WG64_4_1_WGM2
    SolutionIndex: 122
    SolutionNameMin: Cijk_Ailk_Bljk_HSS_BH_MT128x96x32_MI32x32x8x1_SE_1LDSB1_AF0EM1_GRVW2_GSU1_LBSPP128_LPB8_LRVW8_NLCA1_PLR5_SU0_SUS0_SRVW4_TT1_96_VAW2_WG128_2_1_WGM1
    SolutionIndex: 123
    SolutionNameMin: Cijk_Ailk_Bljk_HSS_BH_MT128x256x32_MI32x32x8x1_SE_1LDSB0_AF0EM4_GRVW8_GSU1_LBSPP128_LPB8_LRVW4_NLCA1_PLR1_SU32_SUS128_SRVW4_TT2_128_VAW2_WG64_4_1_WGM1
    SolutionIndex: 124
    SolutionNameMin: Cijk_Ailk_Bljk_HSS_BH_MT128x256x32_MI32x32x8x1_SE_1LDSB0_AF0EM4_GRVW8_GSU1_LBSPP128_LPB8_LRVW4_NLCA1_PLR1_SU32_SUS128_SRVW4_TT2_128_VAW2_WG64_4_1_WGM15
    SolutionIndex: 125
    SolutionNameMin: Cijk_Ailk_Bljk_HSS_BH_MT64x32x32_MI16x16x16x1_SE_1LDSB1_AF0EM8_GRVW2_GSU1_LBSPP128_LPB8_LRVW8_NLCA1_PLR2_SU0_SUS0_SRVW4_TT2_16_VAW2_WG32_8_1_WGM2
    SolutionIndex: 126
    SolutionNameMin: Cijk_Ailk_Bljk_HSS_BH_MT128x256x32_MI32x32x8x1_SE_1LDSB0_AF0EM4_GRVW8_GSU1_LBSPP128_LPB8_LRVW4_NLCA1_PLR1_SU0_SUS0_SRVW4_TT2_128_VAW2_WG64_4_1_WGM15
    SolutionIndex: 127
    SolutionNameMin: Cijk_Ailk_Bljk_HSS_BH_MT256x144x32_MI16x16x16x1_SE_1LDSB0_AF0EM4_GRVW2_GSU1_LBSPP128_LPB4_LRVW4_NLCA2_PLR1_SU16_SUS128_SRVW4_TT4_144_VAW2_WG64_4_1_WGM15
    SolutionIndex: 128
    SolutionNameMin: Cijk_Ailk_Bljk_HSS_BH_MT128x288x32_MI32x32x8x1_SE_1LDSB0_AF0EM4_GRVW4_GSU1_LBSPP128_LPB4_LRVW4_NLCA1_PLR1_SU0_SUS0_SRVW4_TT1_288_VAW2_WG128_2_1_WGM1
    SolutionIndex: 129
    SolutionNameMin: Cijk_Ailk_Bljk_HSS_BH_MT128x256x32_MI32x32x8x1_SE_1LDSB0_AF0EM4_GRVW8_GSU1_LBSPP128_LPB8_LRVW4_NLCA1_PLR1_SU32_SUS128_SRVW4_TT2_128_VAW2_WG64_4_1_WGM2
    SolutionIndex: 130
    SolutionNameMin: Cijk_Ailk_Bljk_HSS_BH_MT256x128x32_MI32x32x4x2_SE_1LDSB0_AF0EM4_GRVW8_GSU1_LBSPP128_LPB8_LRVW4_NLCA1_PLR1_SU16_SUS128_SRVW0_TT2_64_VAW2_WG128_2_1_WGM15
    SolutionIndex: 131
    SolutionNameMin: Cijk_Ailk_Bljk_HSS_BH_MT128x96x32_MI32x32x8x1_SE_1LDSB1_AF0EM8_GRVW2_GSU1_LBSPP128_LPB8_LRVW8_NLCA1_PLR5_SU32_SUS256_SRVW4_TT1_96_VAW2_WG128_2_1_WGM15
    SolutionIndex: 132
    SolutionNameMin: Cijk_Ailk_Bljk_HSS_BH_MT64x32x32_MI16x16x16x1_SE_1LDSB1_AF0EM8_GRVW2_GSU1_LBSPP128_LPB8_LRVW8_NLCA1_PLR2_SU32_SUS128_SRVW4_TT2_16_VAW2_WG32_8_1_WGM2
    SolutionIndex: 133
    SolutionNameMin: Cijk_Ailk_Bljk_HSS_BH_MT128x160x32_MI32x32x8x1_SE_1LDSB1_AF0EM8_GRVW2_GSU1_LBSPP128_LPB8_LRVW8_NLCA1_PLR5_SU32_SUS256_SRVW4_TT1_160_VAW2_WG128_2_1_WGM15
    SolutionIndex: 134
    SolutionNameMin: Cijk_Ailk_Bljk_HSS_BH_MT128x256x32_MI32x32x8x1_SE_1LDSB0_AF0EM4_GRVW8_GSU1_LBSPP128_LPB8_LRVW4_NLCA1_PLR1_SU16_SUS128_SRVW4_TT2_128_VAW2_WG64_4_1_WGM15
    SolutionIndex: 135
    SolutionNameMin: Cijk_Ailk_Bljk_HSS_BH_MT32x32x128_MI16x16x16x1_SE_1LDSB0_AF0EM1_GRVW8_GSU1_LBSPP256_LPB8_LRVW4_NLCA1_PLR1_SU0_SUS0_SRVW0_TT1_16_VAW2_WG32_8_1_WGM15
    SolutionIndex: 136
    SolutionNameMin: Cijk_Ailk_Bljk_HSS_BH_MT32x32x64_MI16x16x16x1_SE_1LDSB0_AF0EM8_GRVW4_GSU5_LBSPP128_LPB8_LRVW8_NLCA1_PLR5_SU0_SUS0_SRVW0_TT1_16_VAW1_WG32_8_1_WGM2
    SolutionIndex: 137
    SolutionNameMin: Cijk_Ailk_Bljk_HSS_BH_MT64x32x32_MI16x16x16x1_SE_1LDSB0_AF0EM4_GRVW2_GSU1_LBSPP128_LPB4_LRVW4_NLCA1_PLR1_SU0_SUS0_SRVW0_TT2_16_VAW2_WG32_8_1_WGM1
    SolutionIndex: 138
    SolutionNameMin: Cijk_Ailk_Bljk_HSS_BH_MT64x32x32_MI16x16x16x1_SE_1LDSB1_AF0EM8_GRVW2_GSU1_LBSPP128_LPB8_LRVW8_NLCA1_PLR2_SU0_SUS0_SRVW4_TT2_16_VAW2_WG32_8_1_WGM1
    SolutionIndex: 139
    SolutionNameMin: Cijk_Ailk_Bljk_HSS_BH_MT64x32x32_MI16x16x16x1_SE_1LDSB1_AF0EM8_GRVW2_GSU1_LBSPP128_LPB8_LRVW8_NLCA1_PLR2_SU32_SUS128_SRVW4_TT2_16_VAW2_WG32_8_1_WGM1
    SolutionIndex: 140
    SolutionNameMin: Cijk_Ailk_Bljk_HSS_BH_MT64x32x32_MI16x16x16x1_SE_1LDSB0_AF0EM4_GRVW2_GSU1_LBSPP128_LPB4_LRVW4_NLCA1_PLR1_SU16_SUS256_SRVW0_TT2_16_VAW2_WG32_8_1_WGM1
    SolutionIndex: 141
    SolutionNameMin: Cijk_Ailk_Bljk_HSS_BH_MT64x32x32_MI16x16x16x1_SE_1LDSB1_AF0EM8_GRVW2_GSU1_LBSPP128_LPB8_LRVW8_NLCA1_PLR2_SU32_SUS256_SRVW4_TT2_16_VAW2_WG32_8_1_WGM2
    SolutionIndex: 142
    SolutionNameMin: Cijk_Ailk_Bljk_HSS_BH_MT64x32x32_MI16x16x16x1_SE_1LDSB0_AF0EM4_GRVW2_GSU1_LBSPP128_LPB4_LRVW4_NLCA1_PLR1_SU0_SUS0_SRVW4_TT2_16_VAW2_WG32_8_1_WGM1
    SolutionIndex: 143
    SolutionNameMin: Cijk_Ailk_Bljk_HSS_BH_MT256x160x32_MI32x32x8x1_SE_1LDSB0_AF0EM8_GRVW4_GSU1_LBSPP128_LPB8_LRVW8_NLCA1_PLR5_SU32_SUS256_SRVW4_TT2_160_VAW2_WG128_2_1_WGM15
    SolutionIndex: 144
    SolutionNameMin: Cijk_Ailk_Bljk_HSS_BH_MT128x96x64_MI32x32x8x1_SE_1LDSB0_AF0EM8_GRVW8_GSU2_LBSPP128_LPB8_LRVW8_NLCA1_PLR9_SU32_SUS256_SRVW0_TT1_96_VAW1_WG128_2_1_WGM1
    SolutionIndex: 145
    SolutionNameMin: Cijk_Ailk_Bljk_HSS_BH_MT256x128x32_MI32x32x8x1_SE_1LDSB1_AF0EM8_GRVW8_GSU15_LBSPP128_LPB8_LRVW8_NLCA1_PLR5_SU0_SUS0_SRVW0_TT4_64_VAW1_WG64_4_1_WGM1
    SolutionIndex: 146
    SolutionNameMin: Cijk_Ailk_Bljk_HSS_BH_MT256x160x32_MI32x32x8x1_SE_1LDSB0_AF0EM8_GRVW4_GSU5_LBSPP128_LPB8_LRVW8_NLCA1_PLR5_SU0_SUS0_SRVW0_TT2_160_VAW1_WG128_2_1_WGM15
    SolutionIndex: 147
    SolutionNameMin: Cijk_Ailk_Bljk_HSS_BH_MT256x160x32_MI32x32x8x1_SE_1LDSB0_AF0EM8_GRVW4_GSU7_LBSPP128_LPB8_LRVW8_NLCA1_PLR5_SU0_SUS0_SRVW0_TT2_160_VAW1_WG128_2_1_WGM2
    SolutionIndex: 148
    SolutionNameMin: Cijk_Ailk_Bljk_HSS_BH_MT64x128x32_MI32x32x8x1_SE_1LDSB0_AF0EM8_GRVW2_GSU1_LBSPP128_LPB8_LRVW8_NLCA1_PLR5_SU32_SUS256_SRVW4_TT1_64_VAW2_WG64_4_1_WGM1
    SolutionIndex: 149
    SolutionNameMin: Cijk_Ailk_Bljk_HSS_BH_MT256x160x32_MI32x32x8x1_SE_1LDSB0_AF0EM8_GRVW4_GSU15_LBSPP128_LPB8_LRVW8_NLCA1_PLR5_SU32_SUS128_SRVW0_TT2_160_VAW1_WG128_2_1_WGM1
    SolutionIndex: 150
    SolutionNameMin: Cijk_Ailk_Bljk_HSS_BH_MT128x96x64_MI32x32x8x1_SE_1LDSB0_AF0EM1_GRVW8_GSU1_LBSPP128_LPB8_LRVW4_NLCA1_PLR1_SU0_SUS0_SRVW4_TT1_96_VAW2_WG128_2_1_WGM1
    SolutionIndex: 151
    SolutionNameMin: Cijk_Ailk_Bljk_HSS_BH_MT128x96x32_MI32x32x8x1_SE_1LDSB1_AF0EM1_GRVW2_GSU1_LBSPP128_LPB8_LRVW8_NLCA1_PLR5_SU0_SUS0_SRVW4_TT1_96_VAW2_WG128_2_1_WGM2
    SolutionIndex: 152
    SolutionNameMin: Cijk_Ailk_Bljk_HSS_BH_MT256x160x32_MI32x32x8x1_SE_1LDSB0_AF0EM8_GRVW4_GSU2_LBSPP128_LPB8_LRVW8_NLCA1_PLR5_SU0_SUS0_SRVW0_TT2_160_VAW1_WG128_2_1_WGM1
    SolutionIndex: 153
    SolutionNameMin: Cijk_Ailk_Bljk_HSS_BH_MT256x160x32_MI32x32x8x1_SE_1LDSB0_AF0EM8_GRVW4_GSU1_LBSPP128_LPB8_LRVW8_NLCA1_PLR5_SU0_SUS0_SRVW4_TT2_160_VAW2_WG128_2_1_WGM15
    SolutionIndex: 154
    SolutionNameMin: Cijk_Ailk_Bljk_HSS_BH_MT256x160x32_MI32x32x8x1_SE_1LDSB0_AF0EM8_GRVW4_GSU2_LBSPP128_LPB8_LRVW8_NLCA1_PLR5_SU0_SUS0_SRVW0_TT2_160_VAW1_WG128_2_1_WGM15
    SolutionIndex: 155
    SolutionNameMin: Cijk_Ailk_Bljk_HSS_BH_MT256x160x32_MI32x32x8x1_SE_1LDSB0_AF0EM8_GRVW4_GSU3_LBSPP128_LPB8_LRVW8_NLCA1_PLR5_SU0_SUS0_SRVW0_TT2_160_VAW1_WG128_2_1_WGM15
    SolutionIndex: 156
    SolutionNameMin: Cijk_Ailk_Bljk_HSS_BH_MT32x64x32_MI16x16x16x1_SE_1LDSB1_AF0EM8_GRVW2_GSU1_LBSPP128_LPB8_LRVW8_NLCA1_PLR2_SU0_SUS0_SRVW4_TT1_32_VAW2_WG32_8_1_WGM1
    SolutionIndex: 157
    SolutionNameMin: Cijk_Ailk_Bljk_HSS_BH_MT256x256x32_MI32x32x8x1_SE_1LDSB1_AF0EM8_GRVW8_GSU3_LBSPP128_LPB8_LRVW8_NLCA1_PLR5_SU0_SUS0_SRVW0_TT4_128_VAW1_WG64_4_1_WGM15
    SolutionIndex: 158
    SolutionNameMin: Cijk_Ailk_Bljk_HSS_BH_MT256x256x32_MI32x32x8x1_SE_1LDSB1_AF0EM8_GRVW8_GSU3_LBSPP128_LPB8_LRVW8_NLCA1_PLR5_SU32_SUS128_SRVW0_TT4_128_VAW1_WG64_4_1_WGM1
    SolutionIndex: 159
    SolutionNameMin: Cijk_Ailk_Bljk_HSS_BH_MT64x64x64_MI32x32x8x1_SE_1LDSB0_AF0EM1_GRVW2_GSU1_LBSPP128_LPB4_LRVW4_NLCA1_PLR1_SU32_SUS256_SRVW0_TT1_32_VAW2_WG64_4_1_WGM15
    SolutionIndex: 160
    SolutionNameMin: Cijk_Ailk_Bljk_HSS_BH_MT128x160x32_MI32x32x8x1_SE_1LDSB0_AF0EM1_GRVW4_GSU1_LBSPP128_LPB4_LRVW4_NLCA1_PLR1_SU16_SUS256_SRVW4_TT1_160_VAW2_WG128_2_1_WGM15
    SolutionIndex: 161
    SolutionNameMin: Cijk_Ailk_Bljk_HSS_BH_MT128x256x32_MI32x32x8x1_SE_1LDSB0_AF0EM4_GRVW8_GSU1_LBSPP128_LPB8_LRVW4_NLCA1_PLR1_SU16_SUS256_SRVW4_TT2_128_VAW2_WG64_4_1_WGM15
    SolutionIndex: 162
    SolutionNameMin: Cijk_Ailk_Bljk_HSS_BH_MT64x128x32_MI32x32x8x1_SE_1LDSB0_AF0EM4_GRVW4_GSU1_LBSPP128_LPB4_LRVW4_NLCA1_PLR1_SU0_SUS0_SRVW4_TT1_64_VAW2_WG64_4_1_WGM2
    SolutionIndex: 163
    SolutionNameMin: Cijk_Ailk_Bljk_HSS_BH_MT64x128x32_MI32x32x8x1_SE_1LDSB0_AF0EM4_GRVW2_GSU1_LBSPP128_LPB4_LRVW4_NLCA1_PLR1_SU16_SUS128_SRVW4_TT1_64_VAW2_WG64_4_1_WGM15
    SolutionIndex: 164
    SolutionNameMin: Cijk_Ailk_Bljk_HSS_BH_MT96x128x32_MI32x32x8x1_SE_1LDSB0_AF0EM8_GRVW4_GSU1_LBSPP128_LPB8_LRVW8_NLCA3_PLR5_SU32_SUS128_SRVW0_TT3_32_VAW2_WG32_8_1_WGM15
    SolutionIndex: 165
    SolutionNameMin: Cijk_Ailk_Bljk_HSS_BH_MT256x128x32_MI32x32x8x1_SE_1LDSB1_AF0EM8_GRVW8_GSU2_LBSPP128_LPB8_LRVW8_NLCA1_PLR5_SU0_SUS0_SRVW0_TT4_64_VAW1_WG64_4_1_WGM15
    SolutionIndex: 166
    SolutionNameMin: Cijk_Ailk_Bljk_HSS_BH_MT64x128x64_MI32x32x4x2_SE_1LDSB0_AF0EM4_GRVW8_GSU1_LBSPP128_LPB8_LRVW4_NLCA1_PLR1_SU16_SUS256_SRVW4_TT1_32_VAW2_WG64_4_1_WGM1
    SolutionIndex: 167
    SolutionNameMin: Cijk_Ailk_Bljk_HSS_BH_MT256x160x32_MI32x32x8x1_SE_1LDSB0_AF0EM8_GRVW4_GSU2_LBSPP128_LPB8_LRVW8_NLCA1_PLR5_SU32_SUS128_SRVW0_TT2_160_VAW1_WG128_2_1_WGM15
    SolutionIndex: 168
    SolutionNameMin: Cijk_Ailk_Bljk_HSS_BH_MT64x32x32_MI16x16x16x1_SE_1LDSB0_AF0EM8_GRVW8_GSU1_LBSPP128_LPB8_LRVW8_NLCA1_PLR2_SU0_SUS0_SRVW4_TT2_16_VAW2_WG32_8_1_WGM2
    SolutionIndex: 169
    SolutionNameMin: Cijk_Ailk_Bljk_HSS_BH_MT256x128x32_MI32x32x8x1_SE_1LDSB0_AF0EM8_GRVW8_GSU2_LBSPP128_LPB8_LRVW8_NLCA1_PLR5_SU0_SUS0_SRVW0_TT4_64_VAW1_WG64_4_1_WGM2
    SolutionIndex: 170
    SolutionNameMin: Cijk_Ailk_Bljk_HSS_BH_MT64x128x64_MI32x32x8x1_SE_1LDSB0_AF0EM1_GRVW8_GSU3_LBSPP128_LPB8_LRVW8_NLCA1_PLR9_SU0_SUS0_SRVW0_TT1_64_VAW1_WG64_4_1_WGM1
    SolutionIndex: 171
    SolutionNameMin: Cijk_Ailk_Bljk_HSS_BH_MT128x96x64_MI32x32x8x1_SE_1LDSB1_AF0EM8_GRVW2_GSU1_LBSPP128_LPB8_LRVW8_NLCA1_PLR9_SU0_SUS0_SRVW4_TT1_96_VAW2_WG128_2_1_WGM1
    SolutionIndex: 172
    SolutionNameMin: Cijk_Ailk_Bljk_HSS_BH_MT64x64x32_MI32x32x8x1_SE_1LDSB0_AF0EM8_GRVW2_GSU1_LBSPP128_LPB8_LRVW8_NLCA1_PLR5_SU0_SUS0_SRVW4_TT1_32_VAW2_WG64_4_1_WGM1
    SolutionIndex: 173
    SolutionNameMin: Cijk_Ailk_Bljk_HSS_BH_MT128x96x64_MI32x32x8x1_SE_1LDSB1_AF0EM8_GRVW2_GSU1_LBSPP128_LPB8_LRVW8_NLCA1_PLR9_SU0_SUS0_SRVW4_TT1_96_VAW2_WG128_2_1_WGM2
    SolutionIndex: 174
    SolutionNameMin: Cijk_Ailk_Bljk_HSS_BH_MT128x256x32_MI32x32x8x1_SE_1LDSB0_AF0EM1_GRVW8_GSU1_LBSPP128_LPB8_LRVW4_NLCA1_PLR1_SU32_SUS128_SRVW4_TT2_128_VAW2_WG64_4_1_WGM1
    SolutionIndex: 175
    SolutionNameMin: Cijk_Ailk_Bljk_HSS_BH_MT64x128x32_MI32x32x8x1_SE_1LDSB0_AF0EM1_GRVW4_GSU1_LBSPP128_LPB8_LRVW8_NLCA1_PLR5_SU0_SUS0_SRVW4_TT1_64_VAW2_WG64_4_1_WGM2
    SolutionIndex: 176
    SolutionNameMin: Cijk_Ailk_Bljk_HSS_BH_MT128x96x32_MI32x32x8x1_SE_1LDSB0_AF0EM4_GRVW2_GSU1_LBSPP128_LPB4_LRVW4_NLCA1_PLR1_SU0_SUS0_SRVW4_TT1_96_VAW2_WG128_2_1_WGM2
    SolutionIndex: 177
    SolutionNameMin: Cijk_Ailk_Bljk_HSS_BH_MT64x128x64_MI32x32x8x1_SE_1LDSB0_AF0EM1_GRVW8_GSU1_LBSPP128_LPB8_LRVW8_NLCA1_PLR9_SU0_SUS0_SRVW4_TT1_64_VAW2_WG64_4_1_WGM15
    SolutionIndex: 178
    SolutionNameMin: Cijk_Ailk_Bljk_HSS_BH_MT64x32x32_MI16x16x16x1_SE_1LDSB0_AF0EM1_GRVW8_GSU1_LBSPP128_LPB8_LRVW8_NLCA1_PLR2_SU0_SUS0_SRVW4_TT2_16_VAW2_WG32_8_1_WGM1
    SolutionIndex: 179
    SolutionNameMin: Cijk_Ailk_Bljk_HSS_BH_MT64x64x32_MI32x32x8x1_SE_1LDSB0_AF0EM1_GRVW8_GSU1_LBSPP128_LPB8_LRVW8_NLCA1_PLR5_SU0_SUS0_SRVW4_TT1_32_VAW2_WG64_4_1_WGM1
    SolutionIndex: 180
    SolutionNameMin: Cijk_Ailk_Bljk_HSS_BH_MT64x128x32_MI32x32x8x1_SE_1LDSB0_AF0EM1_GRVW8_GSU1_LBSPP128_LPB8_LRVW8_NLCA1_PLR5_SU0_SUS0_SRVW4_TT1_64_VAW2_WG64_4_1_WGM1
    SolutionIndex: 181
    SolutionNameMin: Cijk_Ailk_Bljk_HSS_BH_MT128x160x32_MI32x32x8x1_SE_1LDSB1_AF0EM1_GRVW2_GSU1_LBSPP128_LPB8_LRVW8_NLCA1_PLR5_SU0_SUS0_SRVW4_TT1_160_VAW2_WG128_2_1_WGM2
    SolutionIndex: 182
    SolutionNameMin: Cijk_Ailk_Bljk_HSS_BH_MT64x64x32_MI32x32x8x1_SE_1LDSB0_AF0EM1_GRVW8_GSU1_LBSPP128_LPB8_LRVW4_NLCA1_PLR1_SU0_SUS0_SRVW4_TT1_32_VAW2_WG64_4_1_WGM1
    SolutionIndex: 183
    SolutionNameMin: Cijk_Ailk_Bljk_HSS_BH_MT128x96x32_MI32x32x8x1_SE_1LDSB0_AF0EM1_GRVW4_GSU1_LBSPP128_LPB8_LRVW8_NLCA1_PLR5_SU0_SUS0_SRVW4_TT1_96_VAW2_WG128_2_1_WGM1
    SolutionIndex: 184
    SolutionNameMin: Cijk_Ailk_Bljk_HSS_BH_MT128x96x32_MI32x32x8x1_SE_1LDSB0_AF0EM1_GRVW4_GSU1_LBSPP128_LPB8_LRVW8_NLCA1_PLR5_SU0_SUS0_SRVW4_TT1_96_VAW2_WG128_2_1_WGM15
    SolutionIndex: 185
    SolutionNameMin: Cijk_Ailk_Bljk_HSS_BH_MT128x96x32_MI16x16x16x1_SN_1LDSB1_GRVW2_LPB16_NLCA1_SS0_SU0_SUS0_SRVW2_SVW4_TT4_48_VW8_WG32_8_1
    SolutionIndex: 186
    SolutionNameMin: Cijk_Ailk_Bljk_HSS_BH_MT128x128x32_MI16x16x16x1_SN_1LDSB1_GRVW2_LPB16_NLCA1_SS1_SU0_SUS0_SRVW0_SVW4_TT4_64_VW4_WG32_8_1
    SolutionIndex: 187
    SolutionNameMin: Cijk_Ailk_Bljk_HSS_BH_MT256x128x32_MI16x16x16x1_SN_1LDSB1_GRVW8_LPB16_NLCA1_SS1_SU0_SUS0_SRVW0_SVW4_TT8_64_VW4_WG32_8_1
    SolutionIndex: 188
    SolutionNameMin: Cijk_Ailk_Bljk_HSS_BH_MT256x128x32_MI16x16x16x1_SN_1LDSB1_GRVW8_LPB16_NLCA1_SS1_SU32_SUS128_SRVW0_SVW4_TT8_64_VW4_WG32_8_1
    SolutionIndex: 189
    SolutionNameMin: Cijk_Ailk_Bljk_HSS_BH_MT256x128x32_MI16x16x16x1_SN_1LDSB1_GRVW8_LPB16_NLCA1_SS1_SU32_SUS256_SRVW0_SVW4_TT8_64_VW4_WG32_8_1
    SolutionIndex: 190
    SolutionNameMin: Cijk_Ailk_Bljk_HSS_BH_MT256x128x32_MI16x16x16x1_SN_1LDSB1_GRVW8_LPB16_NLCA1_SS1_SU0_SUS0_SRVW0_SVW2_TT8_64_VW2_WG32_8_1
- - - [512, 1, 1, 500000]
    - [8, 0.45]
  - - [512, 2, 1, 500000]
    - [8, 0.883]
  - - [512, 4, 1, 500000]
    - [8, 1.725]
  - - [512, 8, 1, 500000]
    - [8, 3.749]
  - - [512, 16, 1, 500000]
    - [8, 7.218]
  - - [1024, 1, 1, 500000]
    - [8, 0.494]
  - - [1024, 2, 1, 500000]
    - [8, 0.987]
  - - [1024, 4, 1, 500000]
    - [8, 2.008]
  - - [1024, 8, 1, 500000]
    - [8, 3.945]
  - - [1024, 16, 1, 500000]
    - [8, 7.714]
  - - [64, 1, 1, 1216]
    - [9, 0.004]
  - - [128, 1, 1, 1024]
    - [10, 0.007]
  - - [128, 1, 1, 1408]
    - [11, 0.009]
  - - [512, 1, 1, 512]
    - [12, 0.02]
  - - [3072, 1, 1, 128]
    - [13, 0.04]
  - - [512, 2, 1, 512]
    - [12, 0.038]
  - - [1024, 1, 1, 512]
    - [9, 0.04]
  - - [4224, 1, 1, 128]
    - [13, 0.053]
  - - [512, 4, 1, 512]
    - [9, 0.075]
  - - [1024, 2, 1, 512]
    - [12, 0.078]
  - - [1024, 4, 1, 512]
    - [14, 0.15]
  - - [3072, 1, 1, 1024]
    - [15, 0.178]
  - - [512, 16, 1, 512]
    - [16, 0.303]
  - - [3072, 2, 1, 1024]
    - [17, 0.362]
  - - [4608, 1, 1, 1536]
    - [18, 0.294]
  - - [1024, 16, 1, 512]
    - [19, 0.602]
  - - [3072, 4, 1, 1024]
    - [19, 0.723]
  - - [4608, 2, 1, 1536]
    - [18, 0.584]
  - - [6144, 1, 1, 2560]
    - [18, 0.482]
  - - [7680, 1, 1, 2560]
    - [20, 0.436]
  - - [8448, 1, 1, 2816]
    - [20, 0.479]
  - - [4608, 4, 1, 1536]
    - [18, 1.143]
  - - [6144, 2, 1, 2560]
    - [18, 0.93]
  - - [7680, 2, 1, 2560]
    - [20, 0.891]
  - - [8448, 2, 1, 2816]
    - [20, 0.957]
  - - [1760, 16, 1, 1760]
    - [19, 1.906]
  - - [3072, 16, 1, 1024]
    - [19, 2.864]
  - - [6144, 4, 1, 2560]
    - [18, 1.856]
  - - [2048, 16, 1, 2048]
    - [19, 2.71]
  - - [7680, 4, 1, 2560]
    - [20, 1.794]
  - - [8448, 4, 1, 2816]
    - [13, 1.908]
  - - [2560, 16, 1, 2560]
    - [19, 3.646]
  - - [4608, 16, 1, 1536]
    - [18, 4.573]
  - - [6144, 16, 1, 2560]
    - [18, 7.541]
  - - [4096, 16, 1, 4096]
    - [18, 5.717]
  - - [7680, 16, 1, 2560]
    - [20, 6.803]
  - - [8448, 16, 1, 2816]
    - [20, 7.577]
  - - [64, 64, 1, 256]
    - [12, 0.09]
  - - [128, 64, 1, 256]
    - [21, 0.189]
  - - [64, 128, 1, 256]
    - [12, 0.183]
  - - [128, 128, 1, 256]
    - [10, 0.384]
  - - [64, 256, 1, 256]
    - [9, 0.375]
  - - [128, 256, 1, 256]
    - [12, 0.733]
  - - [64, 448, 1, 256]
    - [22, 0.631]
  - - [128, 448, 1, 256]
    - [16, 1.282]
  - - [64, 704, 1, 256]
    - [9, 1.007]
  - - [128, 704, 1, 256]
    - [23, 1.984]
  - - [64, 1024, 1, 256]
    - [9, 1.454]
  - - [128, 1024, 1, 256]
    - [24, 2.78]
  - - [64, 1408, 1, 256]
    - [12, 2.047]
  - - [128, 1408, 1, 256]
    - [25, 3.713]
  - - [64, 1856, 1, 256]
    - [21, 2.447]
  - - [128, 1856, 1, 256]
    - [26, 4.792]
  - - [64, 2368, 1, 256]
    - [24, 3.122]
  - - [128, 2368, 1, 256]
    - [26, 5.988]
  - - [64, 2944, 1, 256]
    - [27, 3.938]
  - - [128, 2944, 1, 256]
    - [28, 7.198]
  - - [64, 3584, 1, 256]
    - [29, 4.563]
  - - [128, 3584, 1, 256]
    - [30, 8.068]
  - - [64, 4288, 1, 256]
    - [26, 5.574]
  - - [128, 4288, 1, 256]
    - [30, 9.312]
  - - [64, 5056, 1, 256]
    - [24, 6.393]
  - - [128, 5056, 1, 256]
    - [31, 10.728]
  - - [64, 5888, 1, 256]
    - [32, 7.394]
  - - [128, 5888, 1, 256]
    - [33, 11.879]
  - - [64, 6784, 1, 256]
    - [28, 8.079]
  - - [128, 6784, 1, 256]
    - [33, 13.837]
  - - [64, 64, 1, 1280]
    - [19, 0.298]
  - - [128, 64, 1, 1280]
    - [19, 0.56]
  - - [64, 128, 1, 1280]
    - [19, 0.588]
  - - [128, 128, 1, 1280]
    - [19, 1.125]
  - - [64, 256, 1, 1280]
    - [19, 1.199]
  - - [128, 256, 1, 1280]
    - [19, 2.328]
  - - [64, 448, 1, 1280]
    - [34, 2.067]
  - - [128, 448, 1, 1280]
    - [35, 4.034]
  - - [64, 704, 1, 1280]
    - [19, 3.315]
  - - [128, 704, 1, 1280]
    - [36, 6.339]
  - - [64, 1024, 1, 1280]
    - [36, 4.702]
  - - [128, 1024, 1, 1280]
    - [37, 7.843]
  - - [64, 1408, 1, 1280]
    - [36, 6.465]
  - - [128, 1408, 1, 1280]
    - [38, 10.522]
  - - [64, 1856, 1, 1280]
    - [37, 7.448]
  - - [128, 1856, 1, 1280]
    - [39, 12.596]
  - - [64, 2368, 1, 1280]
    - [38, 9.628]
  - - [128, 2368, 1, 1280]
    - [40, 15.953]
  - - [64, 2944, 1, 1280]
    - [38, 11.762]
  - - [128, 2944, 1, 1280]
    - [40, 19.271]
  - - [64, 3584, 1, 1280]
    - [32, 11.73]
  - - [128, 3584, 1, 1280]
    - [41, 20.419]
  - - [64, 4288, 1, 1280]
    - [39, 13.461]
  - - [128, 4288, 1, 1280]
    - [41, 24.506]
  - - [64, 5056, 1, 1280]
    - [32, 16.091]
  - - [128, 5056, 1, 1280]
    - [42, 28.541]
  - - [64, 5888, 1, 1280]
    - [32, 18.422]
  - - [128, 5888, 1, 1280]
    - [42, 31.412]
  - - [64, 6784, 1, 1280]
    - [32, 21.297]
  - - [128, 6784, 1, 1280]
    - [42, 35.576]
  - - [64, 64, 1, 3328]
    - [43, 0.453]
  - - [128, 64, 1, 3328]
    - [44, 0.906]
  - - [64, 128, 1, 3328]
    - [43, 0.917]
  - - [128, 128, 1, 3328]
    - [43, 1.726]
  - - [64, 256, 1, 3328]
    - [36, 1.834]
  - - [128, 256, 1, 3328]
    - [19, 3.366]
  - - [64, 448, 1, 3328]
    - [45, 3.209]
  - - [128, 448, 1, 3328]
    - [19, 6.006]
  - - [64, 704, 1, 3328]
    - [19, 5.135]
  - - [128, 704, 1, 3328]
    - [36, 9.334]
  - - [64, 1024, 1, 3328]
    - [36, 7.27]
  - - [128, 1024, 1, 3328]
    - [46, 11.324]
  - - [64, 1408, 1, 3328]
    - [36, 9.88]
  - - [128, 1408, 1, 3328]
    - [47, 15.463]
  - - [64, 1856, 1, 3328]
    - [47, 11.391]
  - - [128, 1856, 1, 3328]
    - [39, 17.709]
  - - [64, 2368, 1, 3328]
    - [38, 14.57]
  - - [128, 2368, 1, 3328]
    - [40, 22.416]
  - - [64, 2944, 1, 3328]
    - [38, 18.068]
  - - [128, 2944, 1, 3328]
    - [39, 27.705]
  - - [64, 3584, 1, 3328]
    - [39, 15.358]
  - - [128, 3584, 1, 3328]
    - [41, 27.39]
  - - [64, 4288, 1, 3328]
    - [39, 17.559]
  - - [128, 4288, 1, 3328]
    - [48, 32.563]
  - - [64, 5056, 1, 3328]
    - [32, 20.255]
  - - [128, 5056, 1, 3328]
    - [48, 38.639]
  - - [64, 5888, 1, 3328]
    - [28, 23.787]
  - - [128, 5888, 1, 3328]
    - [48, 43.408]
  - - [64, 6784, 1, 3328]
    - [32, 27.734]
  - - [128, 6784, 1, 3328]
    - [48, 49.709]
  - - [256, 64, 1, 256]
    - [13, 0.364]
  - - [448, 64, 1, 256]
    - [14, 0.636]
  - - [704, 64, 1, 256]
    - [49, 1.0]
  - - [1024, 64, 1, 256]
    - [9, 1.465]
  - - [1408, 64, 1, 256]
    - [22, 1.954]
  - - [1856, 64, 1, 256]
    - [13, 2.447]
  - - [2368, 64, 1, 256]
    - [13, 3.057]
  - - [2944, 64, 1, 256]
    - [13, 3.882]
  - - [3584, 64, 1, 256]
    - [27, 4.501]
  - - [4288, 64, 1, 256]
    - [24, 5.385]
  - - [5056, 64, 1, 256]
    - [26, 6.306]
  - - [5888, 64, 1, 256]
    - [50, 6.967]
  - - [6784, 64, 1, 256]
    - [51, 8.027]
  - - [256, 128, 1, 256]
    - [16, 0.756]
  - - [448, 128, 1, 256]
    - [14, 1.263]
  - - [704, 128, 1, 256]
    - [36, 2.015]
  - - [1024, 128, 1, 256]
    - [13, 2.8]
  - - [1408, 128, 1, 256]
    - [27, 3.713]
  - - [1856, 128, 1, 256]
    - [27, 4.726]
  - - [2368, 128, 1, 256]
    - [27, 6.071]
  - - [2944, 128, 1, 256]
    - [32, 7.294]
  - - [3584, 128, 1, 256]
    - [51, 8.592]
  - - [4288, 128, 1, 256]
    - [52, 9.479]
  - - [5056, 128, 1, 256]
    - [53, 10.728]
  - - [5888, 128, 1, 256]
    - [54, 12.076]
  - - [6784, 128, 1, 256]
    - [33, 13.686]
  - - [256, 64, 1, 1280]
    - [22, 1.141]
  - - [448, 64, 1, 1280]
    - [36, 1.998]
  - - [704, 64, 1, 1280]
    - [19, 3.265]
  - - [1024, 64, 1, 1280]
    - [45, 4.501]
  - - [1408, 64, 1, 1280]
    - [22, 6.159]
  - - [1856, 64, 1, 1280]
    - [38, 7.167]
  - - [2368, 64, 1, 1280]
    - [38, 9.261]
  - - [2944, 64, 1, 1280]
    - [38, 11.136]
  - - [3584, 64, 1, 1280]
    - [39, 11.73]
  - - [4288, 64, 1, 1280]
    - [40, 14.134]
  - - [5056, 64, 1, 1280]
    - [40, 17.093]
  - - [5888, 64, 1, 1280]
    - [39, 18.739]
  - - [6784, 64, 1, 1280]
    - [39, 21.443]
  - - [256, 128, 1, 1280]
    - [19, 2.316]
  - - [448, 128, 1, 1280]
    - [19, 3.976]
  - - [704, 128, 1, 1280]
    - [19, 6.218]
  - - [1024, 128, 1, 1280]
    - [38, 7.942]
  - - [1408, 128, 1, 1280]
    - [38, 11.06]
  - - [1856, 128, 1, 1280]
    - [40, 12.413]
  - - [2368, 128, 1, 1280]
    - [40, 15.446]
  - - [2944, 128, 1, 1280]
    - [40, 19.619]
  - - [3584, 128, 1, 1280]
    - [55, 19.515]
  - - [4288, 128, 1, 1280]
    - [55, 24.206]
  - - [5056, 128, 1, 1280]
    - [56, 28.454]
  - - [5888, 128, 1, 1280]
    - [55, 30.789]
  - - [6784, 128, 1, 1280]
    - [56, 34.497]
  - - [256, 64, 1, 3328]
    - [44, 1.74]
  - - [448, 64, 1, 3328]
    - [19, 3.248]
  - - [704, 64, 1, 3328]
    - [19, 4.969]
  - - [1024, 64, 1, 3328]
    - [36, 6.399]
  - - [1408, 64, 1, 3328]
    - [19, 8.776]
  - - [1856, 64, 1, 3328]
    - [37, 11.247]
  - - [2368, 64, 1, 3328]
    - [47, 14.066]
  - - [2944, 64, 1, 3328]
    - [18, 16.241]
  - - [3584, 64, 1, 3328]
    - [39, 16.351]
  - - [4288, 64, 1, 3328]
    - [57, 18.574]
  - - [5056, 64, 1, 3328]
    - [40, 22.51]
  - - [5888, 64, 1, 3328]
    - [39, 25.55]
  - - [6784, 64, 1, 3328]
    - [39, 28.312]
  - - [256, 128, 1, 3328]
    - [45, 3.394]
  - - [448, 128, 1, 3328]
    - [35, 6.457]
  - - [704, 128, 1, 3328]
    - [15, 9.938]
  - - [1024, 128, 1, 3328]
    - [38, 11.842]
  - - [1408, 128, 1, 3328]
    - [18, 15.788]
  - - [1856, 128, 1, 3328]
    - [39, 16.807]
  - - [2368, 128, 1, 3328]
    - [40, 21.124]
  - - [2944, 128, 1, 3328]
    - [39, 27.068]
  - - [3584, 128, 1, 3328]
    - [55, 25.789]
  - - [4288, 128, 1, 3328]
    - [58, 30.354]
  - - [5056, 128, 1, 3328]
    - [59, 35.896]
  - - [5888, 128, 1, 3328]
    - [60, 41.193]
  - - [6784, 128, 1, 3328]
    - [60, 46.183]
  - - [256, 256, 1, 256]
    - [12, 1.524]
  - - [448, 256, 1, 256]
    - [24, 2.397]
  - - [256, 448, 1, 256]
    - [24, 2.45]
  - - [448, 448, 1, 256]
    - [13, 4.048]
  - - [256, 256, 1, 1280]
    - [36, 4.797]
  - - [448, 256, 1, 1280]
    - [47, 7.038]
  - - [256, 448, 1, 1280]
    - [37, 7.16]
  - - [448, 448, 1, 1280]
    - [38, 12.213]
  - - [256, 256, 1, 3328]
    - [36, 6.922]
  - - [448, 256, 1, 3328]
    - [37, 11.257]
  - - [256, 448, 1, 3328]
    - [46, 10.362]
  - - [448, 448, 1, 3328]
    - [38, 19.346]
  - - [512, 32, 1, 512]
    - [9, 0.618]
  - - [1024, 32, 1, 512]
    - [9, 1.212]
  - - [1760, 32, 1, 1760]
    - [19, 3.71]
  - - [3072, 32, 1, 1024]
    - [36, 5.587]
  - - [2048, 32, 1, 2048]
    - [36, 5.325]
  - - [1760, 64, 1, 1760]
    - [22, 7.597]
  - - [3072, 64, 1, 1024]
    - [38, 10.172]
  - - [2560, 32, 1, 2560]
    - [19, 7.095]
  - - [4608, 32, 1, 1536]
    - [18, 9.313]
  - - [128, 1500, 1, 1280]
    - [47, 11.348]
  - - [2048, 64, 1, 2048]
    - [37, 9.662]
  - - [176, 1500, 1, 1408]
    - [39, 14.148]
  - - [1760, 128, 1, 1760]
    - [37, 12.041]
  - - [3072, 128, 1, 1024]
    - [40, 17.515]
  - - [2560, 64, 1, 2560]
    - [18, 12.876]
  - - [6144, 32, 1, 2560]
    - [18, 14.141]
  - - [2048, 128, 1, 2048]
    - [40, 16.13]
  - - [4096, 32, 1, 4096]
    - [18, 11.7]
  - - [7680, 32, 1, 2560]
    - [29, 13.45]
  - - [8448, 32, 1, 2816]
    - [13, 15.021]
  - - [2560, 128, 1, 2560]
    - [39, 22.186]
  - - [4096, 64, 1, 4096]
    - [40, 18.498]
  - - [7680, 64, 1, 2560]
    - [60, 23.707]
  - - [4096, 128, 1, 4096]
    - [61, 31.919]
  - - [7680, 128, 1, 2560]
    - [62, 32.665]
  - - [704, 256, 1, 256]
    - [13, 3.661]
  - - [1024, 256, 1, 256]
    - [26, 5.25]
  - - [1408, 256, 1, 256]
    - [20, 6.795]
  - - [1856, 256, 1, 256]
    - [52, 8.256]
  - - [2368, 256, 1, 256]
    - [31, 10.049]
  - - [2944, 256, 1, 256]
    - [33, 12.212]
  - - [3584, 256, 1, 256]
    - [52, 12.029]
  - - [4288, 256, 1, 256]
    - [63, 14.135]
  - - [5056, 256, 1, 256]
    - [64, 15.886]
  - - [5888, 256, 1, 256]
    - [63, 18.5]
  - - [6784, 256, 1, 256]
    - [65, 20.445]
  - - [704, 448, 1, 256]
    - [26, 6.23]
  - - [1024, 448, 1, 256]
    - [30, 8.019]
  - - [1408, 448, 1, 256]
    - [33, 10.337]
  - - [1856, 448, 1, 256]
    - [33, 13.105]
  - - [2368, 448, 1, 256]
    - [65, 14.036]
  - - [2944, 448, 1, 256]
    - [65, 16.832]
  - - [3584, 448, 1, 256]
    - [66, 17.216]
  - - [4288, 448, 1, 256]
    - [67, 20.37]
  - - [5056, 448, 1, 256]
    - [68, 20.94]
  - - [5888, 448, 1, 256]
    - [69, 20.397]
  - - [6784, 448, 1, 256]
    - [70, 21.328]
  - - [256, 704, 1, 256]
    - [24, 3.851]
  - - [448, 704, 1, 256]
    - [27, 6.188]
  - - [704, 704, 1, 256]
    - [50, 8.879]
  - - [1024, 704, 1, 256]
    - [33, 11.881]
  - - [1408, 704, 1, 256]
    - [71, 13.055]
  - - [1856, 704, 1, 256]
    - [71, 16.675]
  - - [2368, 704, 1, 256]
    - [67, 17.808]
  - - [2944, 704, 1, 256]
    - [67, 20.975]
  - - [3584, 704, 1, 256]
    - [69, 19.775]
  - - [4288, 704, 1, 256]
    - [63, 21.392]
  - - [5056, 704, 1, 256]
    - [70, 24.042]
  - - [5888, 704, 1, 256]
    - [67, 24.804]
  - - [6784, 704, 1, 256]
    - [72, 25.045]
  - - [256, 1024, 1, 256]
    - [13, 5.287]
  - - [448, 1024, 1, 256]
    - [51, 8.118]
  - - [704, 1024, 1, 256]
    - [33, 11.681]
  - - [1024, 1024, 1, 256]
    - [63, 13.562]
  - - [1408, 1024, 1, 256]
    - [62, 17.255]
  - - [1856, 1024, 1, 256]
    - [66, 19.37]
  - - [2368, 1024, 1, 256]
    - [68, 22.063]
  - - [2944, 1024, 1, 256]
    - [62, 20.902]
  - - [3584, 1024, 1, 256]
    - [70, 23.787]
  - - [4288, 1024, 1, 256]
    - [69, 22.737]
  - - [5056, 1024, 1, 256]
    - [73, 26.43]
  - - [5888, 1024, 1, 256]
    - [74, 27.003]
  - - [6784, 1024, 1, 256]
    - [73, 28.34]
  - - [256, 1408, 1, 256]
    - [32, 6.931]
  - - [448, 1408, 1, 256]
    - [31, 10.516]
  - - [704, 1408, 1, 256]
    - [75, 12.82]
  - - [1024, 1408, 1, 256]
    - [62, 17.621]
  - - [1408, 1408, 1, 256]
    - [67, 20.276]
  - - [1856, 1408, 1, 256]
    - [69, 20.764]
  - - [2368, 1408, 1, 256]
    - [76, 22.158]
  - - [2944, 1408, 1, 256]
    - [67, 24.399]
  - - [3584, 1408, 1, 256]
    - [73, 25.138]
  - - [4288, 1408, 1, 256]
    - [70, 26.304]
  - - [5056, 1408, 1, 256]
    - [73, 27.973]
  - - [5888, 1408, 1, 256]
    - [73, 28.331]
  - - [6784, 1408, 1, 256]
    - [73, 31.558]
  - - [256, 1856, 1, 256]
    - [77, 8.306]
  - - [448, 1856, 1, 256]
    - [33, 13.324]
  - - [704, 1856, 1, 256]
    - [71, 16.105]
  - - [1024, 1856, 1, 256]
    - [67, 19.234]
  - - [1408, 1856, 1, 256]
    - [78, 22.84]
  - - [1856, 1856, 1, 256]
    - [70, 22.58]
  - - [2368, 1856, 1, 256]
    - [69, 23.006]
  - - [2944, 1856, 1, 256]
    - [73, 26.576]
  - - [3584, 1856, 1, 256]
    - [73, 25.962]
  - - [4288, 1856, 1, 256]
    - [74, 27.523]
  - - [5056, 1856, 1, 256]
    - [73, 31.398]
  - - [5888, 1856, 1, 256]
    - [73, 30.811]
  - - [6784, 1856, 1, 256]
    - [73, 31.334]
  - - [256, 2368, 1, 256]
    - [33, 10.107]
  - - [448, 2368, 1, 256]
    - [52, 13.362]
  - - [704, 2368, 1, 256]
    - [63, 19.31]
  - - [1024, 2368, 1, 256]
    - [79, 22.202]
  - - [1408, 2368, 1, 256]
    - [67, 22.521]
  - - [1856, 2368, 1, 256]
    - [76, 23.048]
  - - [2368, 2368, 1, 256]
    - [73, 27.552]
  - - [2944, 2368, 1, 256]
    - [73, 27.696]
  - - [3584, 2368, 1, 256]
    - [73, 29.671]
  - - [4288, 2368, 1, 256]
    - [73, 30.603]
  - - [5056, 2368, 1, 256]
    - [73, 30.212]
  - - [5888, 2368, 1, 256]
    - [73, 32.379]
  - - [6784, 2368, 1, 256]
    - [73, 33.334]
  - - [256, 2944, 1, 256]
    - [33, 12.422]
  - - [448, 2944, 1, 256]
    - [80, 16.051]
  - - [704, 2944, 1, 256]
    - [68, 20.06]
  - - [1024, 2944, 1, 256]
    - [80, 20.952]
  - - [1408, 2944, 1, 256]
    - [66, 24.104]
  - - [1856, 2944, 1, 256]
    - [73, 26.802]
  - - [2368, 2944, 1, 256]
    - [73, 27.172]
  - - [2944, 2944, 1, 256]
    - [73, 29.341]
  - - [3584, 2944, 1, 256]
    - [73, 30.494]
  - - [4288, 2944, 1, 256]
    - [73, 31.497]
  - - [5056, 2944, 1, 256]
    - [73, 32.847]
  - - [5888, 2944, 1, 256]
    - [73, 34.719]
  - - [6784, 2944, 1, 256]
    - [73, 33.885]
  - - [256, 3584, 1, 256]
    - [30, 12.084]
  - - [448, 3584, 1, 256]
    - [62, 18.98]
  - - [704, 3584, 1, 256]
    - [69, 20.048]
  - - [1024, 3584, 1, 256]
    - [70, 24.334]
  - - [1408, 3584, 1, 256]
    - [70, 25.225]
  - - [1856, 3584, 1, 256]
    - [69, 26.427]
  - - [2368, 3584, 1, 256]
    - [73, 28.832]
  - - [2944, 3584, 1, 256]
    - [73, 29.719]
  - - [3584, 3584, 1, 256]
    - [73, 31.774]
  - - [4288, 3584, 1, 256]
    - [73, 33.682]
  - - [5056, 3584, 1, 256]
    - [73, 33.037]
  - - [5888, 3584, 1, 256]
    - [73, 34.86]
  - - [6784, 3584, 1, 256]
    - [73, 34.326]
  - - [256, 4288, 1, 256]
    - [71, 13.766]
  - - [448, 4288, 1, 256]
    - [67, 19.859]
  - - [704, 4288, 1, 256]
    - [67, 21.288]
  - - [1024, 4288, 1, 256]
    - [66, 25.329]
  - - [1408, 4288, 1, 256]
    - [73, 28.361]
  - - [1856, 4288, 1, 256]
    - [73, 27.262]
  - - [2368, 4288, 1, 256]
    - [76, 29.025]
  - - [2944, 4288, 1, 256]
    - [73, 30.291]
  - - [3584, 4288, 1, 256]
    - [73, 33.403]
  - - [4288, 4288, 1, 256]
    - [73, 32.939]
  - - [5056, 4288, 1, 256]
    - [73, 35.031]
  - - [5888, 4288, 1, 256]
    - [73, 35.908]
  - - [6784, 4288, 1, 256]
    - [73, 35.627]
  - - [256, 5056, 1, 256]
    - [65, 16.022]
  - - [448, 5056, 1, 256]
    - [79, 20.74]
  - - [704, 5056, 1, 256]
    - [70, 23.439]
  - - [1024, 5056, 1, 256]
    - [76, 25.702]
  - - [1408, 5056, 1, 256]
    - [73, 27.935]
  - - [1856, 5056, 1, 256]
    - [73, 30.073]
  - - [2368, 5056, 1, 256]
    - [73, 29.641]
  - - [2944, 5056, 1, 256]
    - [73, 32.722]
  - - [3584, 5056, 1, 256]
    - [73, 34.071]
  - - [4288, 5056, 1, 256]
    - [73, 34.188]
  - - [5056, 5056, 1, 256]
    - [73, 34.357]
  - - [5888, 5056, 1, 256]
    - [73, 36.138]
  - - [6784, 5056, 1, 256]
    - [73, 36.106]
  - - [256, 5888, 1, 256]
    - [65, 18.039]
  - - [448, 5888, 1, 256]
    - [69, 20.787]
  - - [704, 5888, 1, 256]
    - [79, 22.431]
  - - [1024, 5888, 1, 256]
    - [73, 28.322]
  - - [1408, 5888, 1, 256]
    - [73, 27.548]
  - - [1856, 5888, 1, 256]
    - [73, 30.811]
  - - [2368, 5888, 1, 256]
    - [76, 30.958]
  - - [2944, 5888, 1, 256]
    - [73, 33.577]
  - - [3584, 5888, 1, 256]
    - [73, 34.681]
  - - [4288, 5888, 1, 256]
    - [73, 35.47]
  - - [5056, 5888, 1, 256]
    - [73, 36.032]
  - - [5888, 5888, 1, 256]
    - [73, 36.361]
  - - [6784, 5888, 1, 256]
    - [73, 36.843]
  - - [256, 6784, 1, 256]
    - [65, 19.643]
  - - [448, 6784, 1, 256]
    - [70, 20.921]
  - - [704, 6784, 1, 256]
    - [73, 24.294]
  - - [1024, 6784, 1, 256]
    - [73, 27.076]
  - - [1408, 6784, 1, 256]
    - [73, 30.109]
  - - [1856, 6784, 1, 256]
    - [73, 31.066]
  - - [2368, 6784, 1, 256]
    - [73, 32.401]
  - - [2944, 6784, 1, 256]
    - [73, 34.045]
  - - [3584, 6784, 1, 256]
    - [73, 35.169]
  - - [4288, 6784, 1, 256]
    - [73, 35.718]
  - - [5056, 6784, 1, 256]
    - [73, 35.395]
  - - [5888, 6784, 1, 256]
    - [73, 37.021]
  - - [6784, 6784, 1, 256]
    - [73, 36.588]
  - - [704, 256, 1, 1280]
    - [47, 11.06]
  - - [1024, 256, 1, 1280]
    - [39, 13.798]
  - - [1408, 256, 1, 1280]
    - [40, 18.902]
  - - [1856, 256, 1, 1280]
    - [61, 20.764]
  - - [2368, 256, 1, 1280]
    - [61, 26.253]
  - - [2944, 256, 1, 1280]
    - [55, 31.504]
  - - [3584, 256, 1, 1280]
    - [81, 30.629]
  - - [4288, 256, 1, 1280]
    - [81, 36.987]
  - - [5056, 256, 1, 1280]
    - [63, 38.25]
  - - [5888, 256, 1, 1280]
    - [63, 43.045]
  - - [6784, 256, 1, 1280]
    - [63, 46.726]
  - - [704, 448, 1, 1280]
    - [40, 15.848]
  - - [1024, 448, 1, 1280]
    - [41, 21.834]
  - - [1408, 448, 1, 1280]
    - [55, 28.163]
  - - [1856, 448, 1, 1280]
    - [60, 31.473]
  - - [2368, 448, 1, 1280]
    - [82, 36.513]
  - - [2944, 448, 1, 1280]
    - [83, 39.217]
  - - [3584, 448, 1, 1280]
    - [84, 37.468]
  - - [4288, 448, 1, 1280]
    - [84, 44.255]
  - - [5056, 448, 1, 1280]
    - [68, 46.865]
  - - [5888, 448, 1, 1280]
    - [85, 43.625]
  - - [6784, 448, 1, 1280]
    - [86, 49.806]
  - - [256, 704, 1, 1280]
    - [38, 10.875]
  - - [448, 704, 1, 1280]
    - [40, 15.959]
  - - [704, 704, 1, 1280]
    - [41, 22.547]
  - - [1024, 704, 1, 1280]
    - [87, 31.696]
  - - [1408, 704, 1, 1280]
    - [82, 33.167]
  - - [1856, 704, 1, 1280]
    - [83, 38.067]
  - - [2368, 704, 1, 1280]
    - [88, 40.338]
  - - [2944, 704, 1, 1280]
    - [66, 45.493]
  - - [3584, 704, 1, 1280]
    - [86, 41.443]
  - - [4288, 704, 1, 1280]
    - [89, 49.924]
  - - [5056, 704, 1, 1280]
    - [70, 50.424]
  - - [5888, 704, 1, 1280]
    - [66, 48.443]
  - - [6784, 704, 1, 1280]
    - [90, 52.697]
  - - [256, 1024, 1, 1280]
    - [39, 14.054]
  - - [448, 1024, 1, 1280]
    - [91, 21.003]
  - - [704, 1024, 1, 1280]
    - [61, 30.758]
  - - [1024, 1024, 1, 1280]
    - [81, 35.414]
  - - [1408, 1024, 1, 1280]
    - [92, 40.69]
  - - [1856, 1024, 1, 1280]
    - [88, 44.566]
  - - [2368, 1024, 1, 1280]
    - [68, 49.252]
  - - [2944, 1024, 1, 1280]
    - [93, 50.202]
  - - [3584, 1024, 1, 1280]
    - [70, 51.535]
  - - [4288, 1024, 1, 1280]
    - [79, 48.044]
  - - [5056, 1024, 1, 1280]
    - [68, 55.677]
  - - [5888, 1024, 1, 1280]
    - [74, 56.719]
  - - [6784, 1024, 1, 1280]
    - [94, 59.881]
  - - [256, 1408, 1, 1280]
    - [40, 18.766]
  - - [448, 1408, 1, 1280]
    - [61, 26.755]
  - - [704, 1408, 1, 1280]
    - [82, 33.874]
  - - [1024, 1408, 1, 1280]
    - [92, 40.062]
  - - [1408, 1408, 1, 1280]
    - [66, 43.782]
  - - [1856, 1408, 1, 1280]
    - [95, 46.297]
  - - [2368, 1408, 1, 1280]
    - [96, 51.152]
  - - [2944, 1408, 1, 1280]
    - [97, 53.373]
  - - [3584, 1408, 1, 1280]
    - [98, 54.349]
  - - [4288, 1408, 1, 1280]
    - [74, 56.064]
  - - [5056, 1408, 1, 1280]
    - [96, 58.232]
  - - [5888, 1408, 1, 1280]
    - [99, 59.245]
  - - [6784, 1408, 1, 1280]
    - [90, 56.945]
  - - [256, 1856, 1, 1280]
    - [41, 21.892]
  - - [448, 1856, 1, 1280]
    - [48, 36.782]
  - - [704, 1856, 1, 1280]
    - [83, 38.299]
  - - [1024, 1856, 1, 1280]
    - [66, 42.892]
  - - [1408, 1856, 1, 1280]
    - [68, 52.269]
  - - [1856, 1856, 1, 1280]
    - [71, 49.578]
  - - [2368, 1856, 1, 1280]
    - [98, 48.568]
  - - [2944, 1856, 1, 1280]
    - [74, 51.739]
  - - [3584, 1856, 1, 1280]
    - [96, 55.514]
  - - [4288, 1856, 1, 1280]
    - [74, 57.243]
  - - [5056, 1856, 1, 1280]
    - [90, 56.293]
  - - [5888, 1856, 1, 1280]
    - [70, 57.812]
  - - [6784, 1856, 1, 1280]
    - [74, 62.917]
  - - [256, 2368, 1, 1280]
    - [48, 27.066]
  - - [448, 2368, 1, 1280]
    - [81, 36.426]
  - - [704, 2368, 1, 1280]
    - [80, 44.853]
  - - [1024, 2368, 1, 1280]
    - [68, 48.839]
  - - [1408, 2368, 1, 1280]
    - [100, 52.78]
  - - [1856, 2368, 1, 1280]
    - [98, 48.643]
  - - [2368, 2368, 1, 1280]
    - [74, 52.579]
  - - [2944, 2368, 1, 1280]
    - [90, 52.803]
  - - [3584, 2368, 1, 1280]
    - [101, 59.587]
  - - [4288, 2368, 1, 1280]
    - [102, 58.456]
  - - [5056, 2368, 1, 1280]
    - [74, 58.848]
  - - [5888, 2368, 1, 1280]
    - [90, 60.949]
  - - [6784, 2368, 1, 1280]
    - [90, 62.613]
  - - [256, 2944, 1, 1280]
    - [55, 31.412]
  - - [448, 2944, 1, 1280]
    - [71, 36.092]
  - - [704, 2944, 1, 1280]
    - [68, 43.444]
  - - [1024, 2944, 1, 1280]
    - [103, 49.013]
  - - [1408, 2944, 1, 1280]
    - [74, 52.437]
  - - [1856, 2944, 1, 1280]
    - [102, 50.903]
  - - [2368, 2944, 1, 1280]
    - [90, 52.83]
  - - [2944, 2944, 1, 1280]
    - [74, 60.705]
  - - [3584, 2944, 1, 1280]
    - [74, 61.53]
  - - [4288, 2944, 1, 1280]
    - [74, 62.346]
  - - [5056, 2944, 1, 1280]
    - [102, 63.246]
  - - [5888, 2944, 1, 1280]
    - [74, 66.133]
  - - [6784, 2944, 1, 1280]
    - [90, 64.233]
  - - [256, 3584, 1, 1280]
    - [104, 31.28]
  - - [448, 3584, 1, 1280]
    - [105, 43.2]
  - - [704, 3584, 1, 1280]
    - [56, 42.458]
  - - [1024, 3584, 1, 1280]
    - [70, 51.585]
  - - [1408, 3584, 1, 1280]
    - [98, 53.866]
  - - [1856, 3584, 1, 1280]
    - [106, 54.319]
  - - [2368, 3584, 1, 1280]
    - [74, 60.351]
  - - [2944, 3584, 1, 1280]
    - [74, 61.208]
  - - [3584, 3584, 1, 1280]
    - [74, 63.701]
  - - [4288, 3584, 1, 1280]
    - [90, 60.753]
  - - [5056, 3584, 1, 1280]
    - [90, 63.213]
  - - [5888, 3584, 1, 1280]
    - [90, 65.096]
  - - [6784, 3584, 1, 1280]
    - [90, 65.503]
  - - [256, 4288, 1, 1280]
    - [104, 36.061]
  - - [448, 4288, 1, 1280]
    - [66, 42.36]
  - - [704, 4288, 1, 1280]
    - [100, 47.735]
  - - [1024, 4288, 1, 1280]
    - [74, 54.214]
  - - [1408, 4288, 1, 1280]
    - [74, 54.967]
  - - [1856, 4288, 1, 1280]
    - [74, 56.233]
  - - [2368, 4288, 1, 1280]
    - [74, 59.189]
  - - [2944, 4288, 1, 1280]
    - [74, 61.691]
  - - [3584, 4288, 1, 1280]
    - [74, 65.032]
  - - [4288, 4288, 1, 1280]
    - [90, 63.179]
  - - [5056, 4288, 1, 1280]
    - [74, 66.24]
  - - [5888, 4288, 1, 1280]
    - [90, 66.588]
  - - [6784, 4288, 1, 1280]
    - [90, 67.143]
  - - [256, 5056, 1, 1280]
    - [104, 42.135]
  - - [448, 5056, 1, 1280]
    - [98, 45.495]
  - - [704, 5056, 1, 1280]
    - [80, 50.573]
  - - [1024, 5056, 1, 1280]
    - [98, 55.224]
  - - [1408, 5056, 1, 1280]
    - [107, 56.008]
  - - [1856, 5056, 1, 1280]
    - [90, 56.387]
  - - [2368, 5056, 1, 1280]
    - [74, 58.808]
  - - [2944, 5056, 1, 1280]
    - [74, 63.791]
  - - [3584, 5056, 1, 1280]
    - [90, 64.381]
  - - [4288, 5056, 1, 1280]
    - [74, 66.254]
  - - [5056, 5056, 1, 1280]
    - [90, 65.772]
  - - [5888, 5056, 1, 1280]
    - [90, 67.249]
  - - [6784, 5056, 1, 1280]
    - [90, 68.002]
  - - [256, 5888, 1, 1280]
    - [65, 39.812]
  - - [448, 5888, 1, 1280]
    - [56, 42.551]
  - - [704, 5888, 1, 1280]
    - [68, 45.877]
  - - [1024, 5888, 1, 1280]
    - [74, 55.701]
  - - [1408, 5888, 1, 1280]
    - [102, 57.868]
  - - [1856, 5888, 1, 1280]
    - [90, 58.175]
  - - [2368, 5888, 1, 1280]
    - [90, 60.655]
  - - [2944, 5888, 1, 1280]
    - [74, 64.998]
  - - [3584, 5888, 1, 1280]
    - [90, 65.096]
  - - [4288, 5888, 1, 1280]
    - [74, 64.984]
  - - [5056, 5888, 1, 1280]
    - [90, 66.171]
  - - [5888, 5888, 1, 1280]
    - [90, 68.078]
  - - [6784, 5888, 1, 1280]
    - [74, 69.087]
  - - [256, 6784, 1, 1280]
    - [65, 44.645]
  - - [448, 6784, 1, 1280]
    - [108, 48.592]
  - - [704, 6784, 1, 1280]
    - [68, 52.138]
  - - [1024, 6784, 1, 1280]
    - [96, 57.675]
  - - [1408, 6784, 1, 1280]
    - [90, 57.324]
  - - [1856, 6784, 1, 1280]
    - [74, 61.846]
  - - [2368, 6784, 1, 1280]
    - [90, 61.353]
  - - [2944, 6784, 1, 1280]
    - [74, 66.687]
  - - [3584, 6784, 1, 1280]
    - [74, 67.404]
  - - [4288, 6784, 1, 1280]
    - [90, 65.579]
  - - [5056, 6784, 1, 1280]
    - [90, 67.695]
  - - [5888, 6784, 1, 1280]
    - [74, 69.487]
  - - [6784, 6784, 1, 1280]
    - [90, 69.049]
  - - [704, 256, 1, 3328]
    - [47, 17.238]
  - - [1024, 256, 1, 3328]
    - [39, 19.464]
  - - [1408, 256, 1, 3328]
    - [39, 25.262]
  - - [1856, 256, 1, 3328]
    - [60, 26.511]
  - - [2368, 256, 1, 3328]
    - [109, 33.774]
  - - [2944, 256, 1, 3328]
    - [55, 41.557]
  - - [3584, 256, 1, 3328]
    - [82, 44.562]
  - - [4288, 256, 1, 3328]
    - [82, 53.384]
  - - [5056, 256, 1, 3328]
    - [80, 46.353]
  - - [5888, 256, 1, 3328]
    - [80, 53.168]
  - - [6784, 256, 1, 3328]
    - [110, 57.121]
  - - [704, 448, 1, 3328]
    - [39, 22.145]
  - - [1024, 448, 1, 3328]
    - [91, 28.198]
  - - [1408, 448, 1, 3328]
    - [48, 38.086]
  - - [1856, 448, 1, 3328]
    - [60, 45.514]
  - - [2368, 448, 1, 3328]
    - [82, 51.726]
  - - [2944, 448, 1, 3328]
    - [83, 48.247]
  - - [3584, 448, 1, 3328]
    - [60, 48.009]
  - - [4288, 448, 1, 3328]
    - [111, 53.001]
  - - [5056, 448, 1, 3328]
    - [82, 59.102]
  - - [5888, 448, 1, 3328]
    - [96, 56.324]
  - - [6784, 448, 1, 3328]
    - [96, 65.043]
  - - [256, 704, 1, 3328]
    - [38, 15.975]
  - - [448, 704, 1, 3328]
    - [39, 22.611]
  - - [704, 704, 1, 3328]
    - [91, 30.315]
  - - [1024, 704, 1, 3328]
    - [48, 42.973]
  - - [1408, 704, 1, 3328]
    - [81, 48.52]
  - - [1856, 704, 1, 3328]
    - [71, 47.844]
  - - [2368, 704, 1, 3328]
    - [60, 50.086]
  - - [2944, 704, 1, 3328]
    - [66, 55.948]
  - - [3584, 704, 1, 3328]
    - [96, 54.812]
  - - [4288, 704, 1, 3328]
    - [96, 64.531]
  - - [5056, 704, 1, 3328]
    - [112, 65.647]
  - - [5888, 704, 1, 3328]
    - [104, 56.252]
  - - [6784, 704, 1, 3328]
    - [104, 64.648]
  - - [256, 1024, 1, 3328]
    - [39, 19.697]
  - - [448, 1024, 1, 3328]
    - [41, 27.969]
  - - [704, 1024, 1, 3328]
    - [60, 39.986]
  - - [1024, 1024, 1, 3328]
    - [82, 50.666]
  - - [1408, 1024, 1, 3328]
    - [80, 49.688]
  - - [1856, 1024, 1, 3328]
    - [113, 52.63]
  - - [2368, 1024, 1, 3328]
    - [104, 62.833]
  - - [2944, 1024, 1, 3328]
    - [96, 62.658]
  - - [3584, 1024, 1, 3328]
    - [104, 64.879]
  - - [4288, 1024, 1, 3328]
    - [82, 59.116]
  - - [5056, 1024, 1, 3328]
    - [82, 68.33]
  - - [5888, 1024, 1, 3328]
    - [74, 66.511]
  - - [6784, 1024, 1, 3328]
    - [114, 73.372]
  - - [256, 1408, 1, 3328]
    - [40, 26.869]
  - - [448, 1408, 1, 3328]
    - [87, 35.406]
  - - [704, 1408, 1, 3328]
    - [82, 48.584]
  - - [1024, 1408, 1, 3328]
    - [65, 49.688]
  - - [1408, 1408, 1, 3328]
    - [111, 53.748]
  - - [1856, 1408, 1, 3328]
    - [95, 59.71]
  - - [2368, 1408, 1, 3328]
    - [96, 70.47]
  - - [2944, 1408, 1, 3328]
    - [115, 71.295]
  - - [3584, 1408, 1, 3328]
    - [104, 67.12]
  - - [4288, 1408, 1, 3328]
    - [102, 66.328]
  - - [5056, 1408, 1, 3328]
    - [96, 76.198]
  - - [5888, 1408, 1, 3328]
    - [116, 73.911]
  - - [6784, 1408, 1, 3328]
    - [96, 70.156]
  - - [256, 1856, 1, 3328]
    - [91, 28.596]
  - - [448, 1856, 1, 3328]
    - [48, 49.487]
  - - [704, 1856, 1, 3328]
    - [71, 47.335]
  - - [1024, 1856, 1, 3328]
    - [66, 52.786]
  - - [1408, 1856, 1, 3328]
    - [104, 67.25]
  - - [1856, 1856, 1, 3328]
    - [112, 64.132]
  - - [2368, 1856, 1, 3328]
    - [104, 59.513]
  - - [2944, 1856, 1, 3328]
    - [96, 61.011]
  - - [3584, 1856, 1, 3328]
    - [96, 73.271]
  - - [4288, 1856, 1, 3328]
    - [116, 71.185]
  - - [5056, 1856, 1, 3328]
    - [96, 70.244]
  - - [5888, 1856, 1, 3328]
    - [117, 70.55]
  - - [6784, 1856, 1, 3328]
    - [115, 76.085]
  - - [256, 2368, 1, 3328]
    - [48, 36.137]
  - - [448, 2368, 1, 3328]
    - [82, 51.996]
  - - [704, 2368, 1, 3328]
    - [80, 56.06]
  - - [1024, 2368, 1, 3328]
    - [82, 62.833]
  - - [1408, 2368, 1, 3328]
    - [108, 69.107]
  - - [1856, 2368, 1, 3328]
    - [82, 59.794]
  - - [2368, 2368, 1, 3328]
    - [74, 62.334]
  - - [2944, 2368, 1, 3328]
    - [118, 66.327]
  - - [3584, 2368, 1, 3328]
    - [119, 74.892]
  - - [4288, 2368, 1, 3328]
    - [96, 74.433]
  - - [5056, 2368, 1, 3328]
    - [116, 72.173]
  - - [5888, 2368, 1, 3328]
    - [96, 76.734]
  - - [6784, 2368, 1, 3328]
    - [116, 73.663]
  - - [256, 2944, 1, 3328]
    - [42, 43.275]
  - - [448, 2944, 1, 3328]
    - [80, 44.352]
  - - [704, 2944, 1, 3328]
    - [81, 54.344]
  - - [1024, 2944, 1, 3328]
    - [120, 63.754]
  - - [1408, 2944, 1, 3328]
    - [102, 63.386]
  - - [1856, 2944, 1, 3328]
    - [74, 60.74]
  - - [2368, 2944, 1, 3328]
    - [121, 66.159]
  - - [2944, 2944, 1, 3328]
    - [74, 72.979]
  - - [3584, 2944, 1, 3328]
    - [120, 75.906]
  - - [4288, 2944, 1, 3328]
    - [116, 75.806]
  - - [5056, 2944, 1, 3328]
    - [74, 74.794]
  - - [5888, 2944, 1, 3328]
    - [119, 78.696]
  - - [6784, 2944, 1, 3328]
    - [122, 75.032]
  - - [256, 3584, 1, 3328]
    - [104, 44.853]
  - - [448, 3584, 1, 3328]
    - [83, 53.849]
  - - [704, 3584, 1, 3328]
    - [96, 54.402]
  - - [1024, 3584, 1, 3328]
    - [112, 67.887]
  - - [1408, 3584, 1, 3328]
    - [104, 67.479]
  - - [1856, 3584, 1, 3328]
    - [123, 65.878]
  - - [2368, 3584, 1, 3328]
    - [74, 71.478]
  - - [2944, 3584, 1, 3328]
    - [74, 72.805]
  - - [3584, 3584, 1, 3328]
    - [119, 76.986]
  - - [4288, 3584, 1, 3328]
    - [117, 74.209]
  - - [5056, 3584, 1, 3328]
    - [90, 73.223]
  - - [5888, 3584, 1, 3328]
    - [96, 78.171]
  - - [6784, 3584, 1, 3328]
    - [96, 77.634]
  - - [256, 4288, 1, 3328]
    - [82, 51.708]
  - - [448, 4288, 1, 3328]
    - [113, 53.002]
  - - [704, 4288, 1, 3328]
    - [96, 64.239]
  - - [1024, 4288, 1, 3328]
    - [119, 74.061]
  - - [1408, 4288, 1, 3328]
    - [74, 66.347]
  - - [1856, 4288, 1, 3328]
    - [97, 70.914]
  - - [2368, 4288, 1, 3328]
    - [74, 70.257]
  - - [2944, 4288, 1, 3328]
    - [119, 75.144]
  - - [3584, 4288, 1, 3328]
    - [74, 77.378]
  - - [4288, 4288, 1, 3328]
    - [90, 73.499]
  - - [5056, 4288, 1, 3328]
    - [116, 78.405]
  - - [5888, 4288, 1, 3328]
    - [116, 76.965]
  - - [6784, 4288, 1, 3328]
    - [116, 76.505]
  - - [256, 5056, 1, 3328]
    - [81, 60.816]
  - - [448, 5056, 1, 3328]
    - [104, 58.815]
  - - [704, 5056, 1, 3328]
    - [118, 66.168]
  - - [1024, 5056, 1, 3328]
    - [104, 69.454]
  - - [1408, 5056, 1, 3328]
    - [124, 70.777]
  - - [1856, 5056, 1, 3328]
    - [96, 69.66]
  - - [2368, 5056, 1, 3328]
    - [116, 72.057]
  - - [2944, 5056, 1, 3328]
    - [74, 75.096]
  - - [3584, 5056, 1, 3328]
    - [90, 73.318]
  - - [4288, 5056, 1, 3328]
    - [116, 78.617]
  - - [5056, 5056, 1, 3328]
    - [115, 77.806]
  - - [5888, 5056, 1, 3328]
    - [119, 77.834]
  - - [6784, 5056, 1, 3328]
    - [116, 78.993]
  - - [256, 5888, 1, 3328]
    - [110, 49.62]
  - - [448, 5888, 1, 3328]
    - [96, 56.582]
  - - [704, 5888, 1, 3328]
    - [104, 56.911]
  - - [1024, 5888, 1, 3328]
    - [74, 67.023]
  - - [1408, 5888, 1, 3328]
    - [74, 69.54]
  - - [1856, 5888, 1, 3328]
    - [112, 69.391]
  - - [2368, 5888, 1, 3328]
    - [122, 70.609]
  - - [2944, 5888, 1, 3328]
    - [74, 76.945]
  - - [3584, 5888, 1, 3328]
    - [120, 77.044]
  - - [4288, 5888, 1, 3328]
    - [119, 76.616]
  - - [5056, 5888, 1, 3328]
    - [115, 77.591]
  - - [5888, 5888, 1, 3328]
    - [119, 79.296]
  - - [6784, 5888, 1, 3328]
    - [74, 80.796]
  - - [256, 6784, 1, 3328]
    - [110, 56.526]
  - - [448, 6784, 1, 3328]
    - [96, 64.056]
  - - [704, 6784, 1, 3328]
    - [104, 64.438]
  - - [1024, 6784, 1, 3328]
    - [96, 75.961]
  - - [1408, 6784, 1, 3328]
    - [96, 71.132]
  - - [1856, 6784, 1, 3328]
    - [74, 73.365]
  - - [2368, 6784, 1, 3328]
    - [119, 73.082]
  - - [2944, 6784, 1, 3328]
    - [74, 79.11]
  - - [3584, 6784, 1, 3328]
    - [74, 79.718]
  - - [4288, 6784, 1, 3328]
    - [74, 76.243]
  - - [5056, 6784, 1, 3328]
    - [116, 78.41]
  - - [5888, 6784, 1, 3328]
    - [116, 81.19]
  - - [6784, 6784, 1, 3328]
    - [74, 80.396]
  - - [1024, 1024, 1, 1024]
    - [81, 31.26]
  - - [1024, 700, 1, 512]
    - [48, 18.967]
  - - [3072, 1500, 1, 128]
    - [125, 16.013]
  - - [4224, 1500, 1, 176]
    - [74, 18.78]
  - - [512, 1500, 1, 1536]
    - [55, 36.018]
  - - [512, 1500, 1, 2048]
    - [48, 39.467]
  - - [512, 1500, 1, 2560]
    - [48, 42.354]
  - - [512, 1500, 1, 2816]
    - [48, 44.464]
  - - [512, 3000, 1, 1536]
    - [71, 44.901]
  - - [1024, 1500, 1, 1536]
    - [71, 45.053]
  - - [512, 3000, 1, 2048]
    - [71, 46.45]
  - - [1024, 1500, 1, 2048]
    - [71, 46.633]
  - - [512, 3000, 1, 2560]
    - [71, 49.279]
  - - [1024, 1500, 1, 2560]
    - [83, 51.454]
  - - [512, 3000, 1, 2816]
    - [65, 50.762]
  - - [1024, 1500, 1, 2816]
    - [83, 51.953]
  - - [512, 6000, 1, 1536]
    - [107, 53.216]
  - - [1024, 3000, 1, 1536]
    - [96, 52.325]
  - - [3072, 1500, 1, 1024]
    - [98, 47.636]
  - - [512, 6000, 1, 2048]
    - [126, 56.616]
  - - [1024, 3000, 1, 2048]
    - [96, 57.535]
  - - [5124, 700, 1, 2048]
    - [121, 59.799]
  - - [512, 6000, 1, 2560]
    - [126, 60.729]
  - - [1024, 3000, 1, 2560]
    - [96, 61.788]
  - - [512, 6000, 1, 2816]
    - [126, 61.843]
  - - [1024, 3000, 1, 2816]
    - [96, 63.165]
  - - [5124, 700, 1, 2560]
    - [127, 63.859]
  - - [1024, 6000, 1, 1536]
    - [74, 59.868]
  - - [3072, 3000, 1, 1024]
    - [90, 56.737]
  - - [4608, 1500, 1, 1536]
    - [96, 60.935]
  - - [1024, 6000, 1, 2048]
    - [74, 63.772]
  - - [1024, 6000, 1, 2560]
    - [74, 65.054]
  - - [5124, 1500, 1, 2048]
    - [122, 62.689]
  - - [1024, 6000, 1, 2816]
    - [74, 66.033]
  - - [512, 24000, 1, 1536]
    - [74, 62.507]
  - - [3072, 6000, 1, 1024]
    - [90, 61.442]
  - - [5124, 1500, 1, 2560]
    - [98, 66.095]
  - - [4608, 3000, 1, 1536]
    - [90, 63.829]
  - - [1760, 7000, 1, 1760]
    - [74, 69.899]
  - - [6144, 1500, 1, 2560]
    - [70, 68.614]
  - - [512, 24000, 1, 2048]
    - [115, 67.14]
  - - [2048, 7000, 1, 2048]
    - [96, 69.786]
  - - [7680, 1500, 1, 2560]
    - [112, 70.891]
  - - [512, 24000, 1, 2560]
    - [119, 70.432]
  - - [512, 24000, 1, 2816]
    - [119, 71.652]
  - - [8448, 1500, 1, 2816]
    - [116, 74.397]
  - - [512, 48000, 1, 1536]
    - [74, 69.95]
  - - [1024, 24000, 1, 1536]
    - [74, 71.239]
  - - [4608, 6000, 1, 1536]
    - [90, 69.584]
  - - [2560, 7000, 1, 2560]
    - [102, 76.447]
  - - [6144, 3000, 1, 2560]
    - [90, 72.379]
  - - [512, 48000, 1, 2048]
    - [102, 74.457]
  - - [1024, 24000, 1, 2048]
    - [74, 75.649]
  - - [7680, 3000, 1, 2560]
    - [74, 73.706]
  - - [512, 48000, 1, 2560]
    - [74, 76.83]
  - - [1024, 24000, 1, 2560]
    - [74, 77.697]
  - - [512, 48000, 1, 2816]
    - [74, 77.668]
  - - [1024, 24000, 1, 2816]
    - [74, 78.688]
  - - [8448, 3000, 1, 2816]
    - [119, 75.197]
  - - [1024, 48000, 1, 1536]
    - [74, 73.094]
  - - [3072, 24000, 1, 1024]
    - [90, 67.604]
  - - [5124, 9124, 1, 1760]
    - [128, 74.181]
  - - [6144, 6000, 1, 2560]
    - [102, 77.047]
  - - [5124, 9124, 1, 2048]
    - [129, 71.988]
  - - [1024, 48000, 1, 2048]
    - [102, 77.394]
  - - [4096, 7000, 1, 4096]
    - [74, 81.985]
  - - [7680, 6000, 1, 2560]
    - [74, 78.212]
  - - [5124, 9124, 1, 2560]
    - [114, 72.998]
  - - [1024, 48000, 1, 2560]
    - [74, 79.774]
  - - [1024, 48000, 1, 2816]
    - [74, 80.395]
  - - [8448, 6000, 1, 2816]
    - [74, 79.041]
  - - [3072, 48000, 1, 1024]
    - [90, 68.849]
  - - [4608, 24000, 1, 1536]
    - [90, 74.844]
  - - [5124, 9124, 1, 4096]
    - [130, 78.028]
  - - [4608, 48000, 1, 1536]
    - [90, 75.985]
  - - [6144, 24000, 1, 2560]
    - [131, 80.569]
  - - [7680, 24000, 1, 2560]
    - [131, 80.681]
  - - [8448, 24000, 1, 2816]
    - [74, 81.069]
  - - [6144, 48000, 1, 2560]
    - [74, 81.181]
  - - [7680, 48000, 1, 2560]
    - [119, 82.233]
  - - [8448, 48000, 1, 2816]
    - [119, 83.297]
  - - [256, 193600, 1, 64]
    - [52, 13.005]
  - - [64, 193600, 1, 64]
    - [125, 10.962]
  - - [64, 193600, 1, 256]
    - [63, 20.317]
  - - [512, 50176, 1, 128]
    - [132, 19.509]
  - - [128, 50176, 1, 512]
    - [133, 35.084]
  - - [256, 12544, 1, 1024]
    - [134, 44.961]
  - - [1024, 12544, 1, 256]
    - [73, 30.745]
  - - [2048, 3136, 1, 512]
    - [74, 42.148]
  - - [512, 3136, 1, 2048]
    - [80, 48.24]
  - - [196, 256, 64, 1024]
    - [68, 35.555]
  - - [784, 512, 64, 128]
    - [70, 19.78]
  - - [3136, 512, 1, 2048]
    - [62, 49.729]
  - - [196, 1024, 64, 256]
    - [68, 24.39]
  - - [3136, 2048, 1, 512]
    - [102, 41.721]
  - - [32, 32, 1, 32]
    - [13, 0.004]
  - - [32, 64, 1, 256]
    - [23, 0.046]
  - - [32, 128, 1, 256]
    - [135, 0.094]
  - - [32, 256, 1, 256]
    - [11, 0.189]
  - - [32, 448, 1, 256]
    - [19, 0.323]
  - - [32, 704, 1, 256]
    - [9, 0.524]
  - - [32, 1024, 1, 256]
    - [12, 0.75]
  - - [32, 1408, 1, 256]
    - [12, 1.015]
  - - [32, 1856, 1, 256]
    - [9, 1.349]
  - - [32, 2368, 1, 256]
    - [9, 1.721]
  - - [32, 2944, 1, 256]
    - [22, 2.09]
  - - [32, 3584, 1, 256]
    - [24, 2.33]
  - - [32, 4288, 1, 256]
    - [27, 2.807]
  - - [32, 5056, 1, 256]
    - [26, 3.241]
  - - [32, 5888, 1, 256]
    - [26, 3.697]
  - - [32, 6784, 1, 256]
    - [26, 4.288]
  - - [32, 64, 1, 1280]
    - [10, 0.146]
  - - [32, 128, 1, 1280]
    - [10, 0.292]
  - - [32, 256, 1, 1280]
    - [19, 0.591]
  - - [32, 448, 1, 1280]
    - [36, 1.039]
  - - [32, 704, 1, 1280]
    - [19, 1.658]
  - - [32, 1024, 1, 1280]
    - [36, 2.399]
  - - [32, 1408, 1, 1280]
    - [135, 3.282]
  - - [32, 1856, 1, 1280]
    - [11, 4.415]
  - - [32, 2368, 1, 1280]
    - [19, 5.519]
  - - [32, 2944, 1, 1280]
    - [10, 6.932]
  - - [32, 3584, 1, 1280]
    - [37, 7.286]
  - - [32, 4288, 1, 1280]
    - [37, 8.603]
  - - [32, 5056, 1, 1280]
    - [47, 9.971]
  - - [32, 5888, 1, 1280]
    - [47, 11.712]
  - - [32, 6784, 1, 1280]
    - [38, 13.21]
  - - [32, 64, 1, 3328]
    - [10, 0.239]
  - - [32, 128, 1, 3328]
    - [17, 0.474]
  - - [32, 256, 1, 3328]
    - [17, 0.957]
  - - [32, 448, 1, 3328]
    - [10, 1.685]
  - - [32, 704, 1, 3328]
    - [10, 2.631]
  - - [32, 1024, 1, 3328]
    - [11, 3.769]
  - - [32, 1408, 1, 3328]
    - [11, 5.23]
  - - [32, 1856, 1, 3328]
    - [11, 7.003]
  - - [32, 2368, 1, 3328]
    - [17, 9.048]
  - - [32, 2944, 1, 3328]
    - [10, 11.143]
  - - [32, 3584, 1, 3328]
    - [37, 11.316]
  - - [32, 4288, 1, 3328]
    - [38, 13.539]
  - - [32, 5056, 1, 3328]
    - [47, 15.881]
  - - [32, 5888, 1, 3328]
    - [47, 18.161]
  - - [32, 6784, 1, 3328]
    - [47, 21.087]
  - - [64, 32, 1, 256]
    - [9, 0.045]
  - - [128, 32, 1, 256]
    - [14, 0.095]
  - - [256, 32, 1, 256]
    - [22, 0.183]
  - - [448, 32, 1, 256]
    - [23, 0.316]
  - - [704, 32, 1, 256]
    - [9, 0.492]
  - - [1024, 32, 1, 256]
    - [9, 0.733]
  - - [1408, 32, 1, 256]
    - [9, 0.985]
  - - [1856, 32, 1, 256]
    - [22, 1.288]
  - - [2368, 32, 1, 256]
    - [23, 1.631]
  - - [2944, 32, 1, 256]
    - [9, 1.998]
  - - [3584, 32, 1, 256]
    - [13, 2.329]
  - - [4288, 32, 1, 256]
    - [13, 2.748]
  - - [5056, 32, 1, 256]
    - [13, 3.263]
  - - [5888, 32, 1, 256]
    - [26, 3.697]
  - - [6784, 32, 1, 256]
    - [26, 4.259]
  - - [64, 32, 1, 1280]
    - [19, 0.145]
  - - [128, 32, 1, 1280]
    - [19, 0.267]
  - - [256, 32, 1, 1280]
    - [45, 0.539]
  - - [448, 32, 1, 1280]
    - [19, 0.999]
  - - [704, 32, 1, 1280]
    - [35, 1.54]
  - - [1024, 32, 1, 1280]
    - [22, 2.178]
  - - [1408, 32, 1, 1280]
    - [19, 2.994]
  - - [1856, 32, 1, 1280]
    - [19, 4.118]
  - - [2368, 32, 1, 1280]
    - [19, 5.437]
  - - [2944, 32, 1, 1280]
    - [19, 6.038]
  - - [3584, 32, 1, 1280]
    - [18, 6.436]
  - - [4288, 32, 1, 1280]
    - [18, 7.582]
  - - [5056, 32, 1, 1280]
    - [18, 8.642]
  - - [5888, 32, 1, 1280]
    - [18, 10.451]
  - - [6784, 32, 1, 1280]
    - [39, 11.468]
  - - [64, 32, 1, 3328]
    - [136, 0.224]
  - - [128, 32, 1, 3328]
    - [44, 0.443]
  - - [256, 32, 1, 3328]
    - [44, 0.89]
  - - [448, 32, 1, 3328]
    - [19, 1.563]
  - - [704, 32, 1, 3328]
    - [36, 2.407]
  - - [1024, 32, 1, 3328]
    - [44, 3.242]
  - - [1408, 32, 1, 3328]
    - [36, 4.234]
  - - [1856, 32, 1, 3328]
    - [19, 6.363]
  - - [2368, 32, 1, 3328]
    - [36, 8.072]
  - - [2944, 32, 1, 3328]
    - [19, 8.787]
  - - [3584, 32, 1, 3328]
    - [18, 9.663]
  - - [4288, 32, 1, 3328]
    - [18, 12.077]
  - - [5056, 32, 1, 3328]
    - [18, 13.362]
  - - [5888, 32, 1, 3328]
    - [18, 15.527]
  - - [6784, 32, 1, 3328]
    - [18, 16.783]
  - - [64, 64, 1, 32]
    - [26, 0.016]
  - - [128, 64, 1, 32]
    - [27, 0.032]
  - - [256, 64, 1, 32]
    - [24, 0.064]
  - - [448, 64, 1, 32]
    - [26, 0.11]
  - - [704, 64, 1, 32]
    - [26, 0.18]
  - - [1024, 64, 1, 32]
    - [26, 0.26]
  - - [1408, 64, 1, 32]
    - [26, 0.328]
  - - [1856, 64, 1, 32]
    - [137, 0.424]
  - - [2368, 64, 1, 32]
    - [137, 0.546]
  - - [2944, 64, 1, 32]
    - [137, 0.641]
  - - [3584, 64, 1, 32]
    - [27, 0.788]
  - - [4288, 64, 1, 32]
    - [27, 0.925]
  - - [5056, 64, 1, 32]
    - [137, 1.061]
  - - [5888, 64, 1, 32]
    - [27, 1.235]
  - - [6784, 64, 1, 32]
    - [27, 1.398]
  - - [64, 128, 1, 32]
    - [21, 0.032]
  - - [128, 128, 1, 32]
    - [21, 0.062]
  - - [256, 128, 1, 32]
    - [26, 0.13]
  - - [448, 128, 1, 32]
    - [26, 0.222]
  - - [704, 128, 1, 32]
    - [27, 0.328]
  - - [1024, 128, 1, 32]
    - [53, 0.473]
  - - [1408, 128, 1, 32]
    - [27, 0.613]
  - - [1856, 128, 1, 32]
    - [26, 0.779]
  - - [2368, 128, 1, 32]
    - [27, 0.976]
  - - [2944, 128, 1, 32]
    - [137, 1.181]
  - - [3584, 128, 1, 32]
    - [24, 1.39]
  - - [4288, 128, 1, 32]
    - [50, 1.635]
  - - [5056, 128, 1, 32]
    - [51, 1.837]
  - - [5888, 128, 1, 32]
    - [52, 2.139]
  - - [6784, 128, 1, 32]
    - [52, 2.336]
  - - [64, 256, 1, 32]
    - [21, 0.064]
  - - [128, 256, 1, 32]
    - [24, 0.123]
  - - [256, 256, 1, 32]
    - [26, 0.254]
  - - [448, 256, 1, 32]
    - [137, 0.401]
  - - [704, 256, 1, 32]
    - [27, 0.607]
  - - [1024, 256, 1, 32]
    - [27, 0.859]
  - - [1408, 256, 1, 32]
    - [27, 1.13]
  - - [1856, 256, 1, 32]
    - [26, 1.416]
  - - [2368, 256, 1, 32]
    - [52, 1.806]
  - - [2944, 256, 1, 32]
    - [50, 2.106]
  - - [3584, 256, 1, 32]
    - [137, 2.415]
  - - [4288, 256, 1, 32]
    - [52, 2.711]
  - - [5056, 256, 1, 32]
    - [52, 2.917]
  - - [5888, 256, 1, 32]
    - [52, 3.274]
  - - [6784, 256, 1, 32]
    - [138, 3.619]
  - - [64, 448, 1, 32]
    - [26, 0.116]
  - - [128, 448, 1, 32]
    - [26, 0.22]
  - - [256, 448, 1, 32]
    - [137, 0.405]
  - - [448, 448, 1, 32]
    - [27, 0.658]
  - - [704, 448, 1, 32]
    - [137, 0.989]
  - - [1024, 448, 1, 32]
    - [26, 1.356]
  - - [1408, 448, 1, 32]
    - [137, 1.819]
  - - [1856, 448, 1, 32]
    - [52, 2.254]
  - - [2368, 448, 1, 32]
    - [52, 2.62]
  - - [2944, 448, 1, 32]
    - [52, 2.917]
  - - [3584, 448, 1, 32]
    - [138, 3.327]
  - - [4288, 448, 1, 32]
    - [138, 3.684]
  - - [5056, 448, 1, 32]
    - [137, 4.043]
  - - [5888, 448, 1, 32]
    - [53, 4.227]
  - - [6784, 448, 1, 32]
    - [75, 4.509]
  - - [64, 704, 1, 32]
    - [26, 0.177]
  - - [128, 704, 1, 32]
    - [27, 0.315]
  - - [256, 704, 1, 32]
    - [137, 0.591]
  - - [448, 704, 1, 32]
    - [27, 0.997]
  - - [704, 704, 1, 32]
    - [26, 1.465]
  - - [1024, 704, 1, 32]
    - [52, 2.015]
  - - [1408, 704, 1, 32]
    - [137, 2.499]
  - - [1856, 704, 1, 32]
    - [52, 2.89]
  - - [2368, 704, 1, 32]
    - [137, 3.434]
  - - [2944, 704, 1, 32]
    - [52, 3.832]
  - - [3584, 704, 1, 32]
    - [139, 4.154]
  - - [4288, 704, 1, 32]
    - [125, 4.573]
  - - [5056, 704, 1, 32]
    - [138, 4.824]
  - - [5888, 704, 1, 32]
    - [138, 5.153]
  - - [6784, 704, 1, 32]
    - [139, 5.298]
  - - [64, 1024, 1, 32]
    - [137, 0.249]
  - - [128, 1024, 1, 32]
    - [137, 0.459]
  - - [256, 1024, 1, 32]
    - [27, 0.836]
  - - [448, 1024, 1, 32]
    - [27, 1.378]
  - - [704, 1024, 1, 32]
    - [138, 1.984]
  - - [1024, 1024, 1, 32]
    - [52, 2.681]
  - - [1408, 1024, 1, 32]
    - [52, 3.15]
  - - [1856, 1024, 1, 32]
    - [52, 3.684]
  - - [2368, 1024, 1, 32]
    - [52, 4.163]
  - - [2944, 1024, 1, 32]
    - [138, 4.491]
  - - [3584, 1024, 1, 32]
    - [138, 4.829]
  - - [4288, 1024, 1, 32]
    - [138, 5.259]
  - - [5056, 1024, 1, 32]
    - [138, 5.458]
  - - [5888, 1024, 1, 32]
    - [125, 5.545]
  - - [6784, 1024, 1, 32]
    - [138, 5.744]
  - - [64, 1408, 1, 32]
    - [137, 0.346]
  - - [128, 1408, 1, 32]
    - [27, 0.596]
  - - [256, 1408, 1, 32]
    - [52, 1.13]
  - - [448, 1408, 1, 32]
    - [137, 1.805]
  - - [704, 1408, 1, 32]
    - [52, 2.59]
  - - [1024, 1408, 1, 32]
    - [52, 3.094]
  - - [1408, 1408, 1, 32]
    - [138, 3.802]
  - - [1856, 1408, 1, 32]
    - [52, 4.302]
  - - [2368, 1408, 1, 32]
    - [140, 4.696]
  - - [2944, 1408, 1, 32]
    - [138, 5.118]
  - - [3584, 1408, 1, 32]
    - [138, 5.415]
  - - [4288, 1408, 1, 32]
    - [137, 5.683]
  - - [5056, 1408, 1, 32]
    - [138, 5.914]
  - - [5888, 1408, 1, 32]
    - [138, 6.063]
  - - [6784, 1408, 1, 32]
    - [138, 6.172]
  - - [64, 1856, 1, 32]
    - [137, 0.446]
  - - [128, 1856, 1, 32]
    - [24, 0.8]
  - - [256, 1856, 1, 32]
    - [24, 1.49]
  - - [448, 1856, 1, 32]
    - [52, 2.324]
  - - [704, 1856, 1, 32]
    - [52, 2.926]
  - - [1024, 1856, 1, 32]
    - [137, 3.704]
  - - [1408, 1856, 1, 32]
    - [139, 4.263]
  - - [1856, 1856, 1, 32]
    - [138, 4.758]
  - - [2368, 1856, 1, 32]
    - [138, 5.229]
  - - [2944, 1856, 1, 32]
    - [75, 5.427]
  - - [3584, 1856, 1, 32]
    - [138, 5.737]
  - - [4288, 1856, 1, 32]
    - [53, 6.041]
  - - [5056, 1856, 1, 32]
    - [138, 6.265]
  - - [5888, 1856, 1, 32]
    - [125, 6.264]
  - - [6784, 1856, 1, 32]
    - [138, 6.457]
  - - [64, 2368, 1, 32]
    - [137, 0.52]
  - - [128, 2368, 1, 32]
    - [27, 0.959]
  - - [256, 2368, 1, 32]
    - [52, 1.763]
  - - [448, 2368, 1, 32]
    - [52, 2.656]
  - - [704, 2368, 1, 32]
    - [132, 3.474]
  - - [1024, 2368, 1, 32]
    - [139, 4.066]
  - - [1408, 2368, 1, 32]
    - [138, 4.677]
  - - [1856, 2368, 1, 32]
    - [137, 5.282]
  - - [2368, 2368, 1, 32]
    - [138, 5.616]
  - - [2944, 2368, 1, 32]
    - [125, 5.845]
  - - [3584, 2368, 1, 32]
    - [125, 6.157]
  - - [4288, 2368, 1, 32]
    - [125, 6.312]
  - - [5056, 2368, 1, 32]
    - [138, 6.423]
  - - [5888, 2368, 1, 32]
    - [138, 6.623]
  - - [6784, 2368, 1, 32]
    - [138, 6.582]
  - - [64, 2944, 1, 32]
    - [27, 0.635]
  - - [128, 2944, 1, 32]
    - [27, 1.202]
  - - [256, 2944, 1, 32]
    - [137, 2.123]
  - - [448, 2944, 1, 32]
    - [137, 2.953]
  - - [704, 2944, 1, 32]
    - [75, 3.872]
  - - [1024, 2944, 1, 32]
    - [138, 4.548]
  - - [1408, 2944, 1, 32]
    - [125, 5.189]
  - - [1856, 2944, 1, 32]
    - [138, 5.628]
  - - [2368, 2944, 1, 32]
    - [137, 5.886]
  - - [2944, 2944, 1, 32]
    - [138, 6.2]
  - - [3584, 2944, 1, 32]
    - [138, 6.34]
  - - [4288, 2944, 1, 32]
    - [138, 6.586]
  - - [5056, 2944, 1, 32]
    - [138, 6.683]
  - - [5888, 2944, 1, 32]
    - [139, 6.764]
  - - [6784, 2944, 1, 32]
    - [139, 6.78]
  - - [64, 3584, 1, 32]
    - [24, 0.766]
  - - [128, 3584, 1, 32]
    - [137, 1.438]
  - - [256, 3584, 1, 32]
    - [137, 2.469]
  - - [448, 3584, 1, 32]
    - [139, 3.446]
  - - [704, 3584, 1, 32]
    - [132, 4.231]
  - - [1024, 3584, 1, 32]
    - [139, 4.882]
  - - [1408, 3584, 1, 32]
    - [139, 5.447]
  - - [1856, 3584, 1, 32]
    - [137, 5.835]
  - - [2368, 3584, 1, 32]
    - [125, 6.181]
  - - [2944, 3584, 1, 32]
    - [138, 6.33]
  - - [3584, 3584, 1, 32]
    - [138, 6.578]
  - - [4288, 3584, 1, 32]
    - [138, 6.7]
  - - [5056, 3584, 1, 32]
    - [139, 6.862]
  - - [5888, 3584, 1, 32]
    - [138, 6.904]
  - - [6784, 3584, 1, 32]
    - [139, 6.87]
  - - [64, 4288, 1, 32]
    - [27, 0.925]
  - - [128, 4288, 1, 32]
    - [52, 1.649]
  - - [256, 4288, 1, 32]
    - [52, 2.711]
  - - [448, 4288, 1, 32]
    - [52, 3.848]
  - - [704, 4288, 1, 32]
    - [52, 4.711]
  - - [1024, 4288, 1, 32]
    - [125, 5.225]
  - - [1408, 4288, 1, 32]
    - [139, 5.654]
  - - [1856, 4288, 1, 32]
    - [138, 6.197]
  - - [2368, 4288, 1, 32]
    - [138, 6.4]
  - - [2944, 4288, 1, 32]
    - [138, 6.549]
  - - [3584, 4288, 1, 32]
    - [125, 6.667]
  - - [4288, 4288, 1, 32]
    - [139, 6.841]
  - - [5056, 4288, 1, 32]
    - [139, 6.96]
  - - [5888, 4288, 1, 32]
    - [138, 6.933]
  - - [6784, 4288, 1, 32]
    - [138, 6.969]
  - - [64, 5056, 1, 32]
    - [27, 1.07]
  - - [128, 5056, 1, 32]
    - [52, 1.882]
  - - [256, 5056, 1, 32]
    - [52, 2.972]
  - - [448, 5056, 1, 32]
    - [125, 4.043]
  - - [704, 5056, 1, 32]
    - [138, 4.843]
  - - [1024, 5056, 1, 32]
    - [52, 5.539]
  - - [1408, 5056, 1, 32]
    - [139, 5.914]
  - - [1856, 5056, 1, 32]
    - [139, 6.288]
  - - [2368, 5056, 1, 32]
    - [138, 6.53]
  - - [2944, 5056, 1, 32]
    - [139, 6.658]
  - - [3584, 5056, 1, 32]
    - [138, 6.891]
  - - [4288, 5056, 1, 32]
    - [139, 6.966]
  - - [5056, 5056, 1, 32]
    - [138, 7.095]
  - - [5888, 5056, 1, 32]
    - [139, 6.983]
  - - [6784, 5056, 1, 32]
    - [138, 7.034]
  - - [64, 5888, 1, 32]
    - [52, 1.202]
  - - [128, 5888, 1, 32]
    - [51, 2.123]
  - - [256, 5888, 1, 32]
    - [52, 3.334]
  - - [448, 5888, 1, 32]
    - [138, 4.323]
  - - [704, 5888, 1, 32]
    - [125, 5.207]
  - - [1024, 5888, 1, 32]
    - [125, 5.574]
  - - [1408, 5888, 1, 32]
    - [132, 6.038]
  - - [1856, 5888, 1, 32]
    - [141, 6.375]
  - - [2368, 5888, 1, 32]
    - [139, 6.693]
  - - [2944, 5888, 1, 32]
    - [139, 6.808]
  - - [3584, 5888, 1, 32]
    - [139, 6.923]
  - - [4288, 5888, 1, 32]
    - [138, 7.002]
  - - [5056, 5888, 1, 32]
    - [138, 7.136]
  - - [5888, 5888, 1, 32]
    - [138, 7.082]
  - - [6784, 5888, 1, 32]
    - [139, 7.087]
  - - [64, 6784, 1, 32]
    - [27, 1.398]
  - - [128, 6784, 1, 32]
    - [52, 2.372]
  - - [256, 6784, 1, 32]
    - [125, 3.619]
  - - [448, 6784, 1, 32]
    - [138, 4.743]
  - - [704, 6784, 1, 32]
    - [137, 5.347]
  - - [1024, 6784, 1, 32]
    - [52, 5.879]
  - - [1408, 6784, 1, 32]
    - [139, 6.239]
  - - [1856, 6784, 1, 32]
    - [138, 6.589]
  - - [2368, 6784, 1, 32]
    - [132, 6.742]
  - - [2944, 6784, 1, 32]
    - [139, 6.858]
  - - [3584, 6784, 1, 32]
    - [138, 7.002]
  - - [4288, 6784, 1, 32]
    - [141, 7.091]
  - - [5056, 6784, 1, 32]
    - [141, 7.127]
  - - [5888, 6784, 1, 32]
    - [141, 7.101]
  - - [6784, 6784, 1, 32]
    - [138, 7.127]
  - - [32, 32, 1, 256]
    - [17, 0.023]
  - - [32, 32, 1, 1280]
    - [10, 0.073]
  - - [32, 32, 1, 3328]
    - [10, 0.119]
  - - [32, 64, 1, 32]
    - [21, 0.008]
  - - [32, 128, 1, 32]
    - [21, 0.016]
  - - [32, 256, 1, 32]
    - [27, 0.032]
  - - [32, 448, 1, 32]
    - [24, 0.059]
  - - [32, 704, 1, 32]
    - [24, 0.093]
  - - [32, 1024, 1, 32]
    - [24, 0.131]
  - - [32, 1408, 1, 32]
    - [21, 0.183]
  - - [32, 1856, 1, 32]
    - [26, 0.238]
  - - [32, 2368, 1, 32]
    - [24, 0.288]
  - - [32, 2944, 1, 32]
    - [27, 0.333]
  - - [32, 3584, 1, 32]
    - [30, 0.394]
  - - [32, 4288, 1, 32]
    - [77, 0.48]
  - - [32, 5056, 1, 32]
    - [27, 0.545]
  - - [32, 5888, 1, 32]
    - [24, 0.629]
  - - [32, 6784, 1, 32]
    - [26, 0.725]
  - - [64, 32, 1, 32]
    - [24, 0.008]
  - - [128, 32, 1, 32]
    - [26, 0.015]
  - - [256, 32, 1, 32]
    - [21, 0.034]
  - - [448, 32, 1, 32]
    - [26, 0.053]
  - - [704, 32, 1, 32]
    - [24, 0.086]
  - - [1024, 32, 1, 32]
    - [24, 0.128]
  - - [1408, 32, 1, 32]
    - [24, 0.177]
  - - [1856, 32, 1, 32]
    - [24, 0.23]
  - - [2368, 32, 1, 32]
    - [26, 0.276]
  - - [2944, 32, 1, 32]
    - [137, 0.347]
  - - [3584, 32, 1, 32]
    - [137, 0.405]
  - - [4288, 32, 1, 32]
    - [53, 0.476]
  - - [5056, 32, 1, 32]
    - [137, 0.545]
  - - [5888, 32, 1, 32]
    - [27, 0.606]
  - - [6784, 32, 1, 32]
    - [24, 0.693]
  - - [1, 1, 1, 1]
    - [2, 0.0]
  - - [1, 64, 1, 256]
    - [5, 0.001]
  - - [1, 128, 1, 256]
    - [2, 0.003]
  - - [1, 256, 1, 256]
    - [5, 0.006]
  - - [1, 448, 1, 256]
    - [3, 0.009]
  - - [1, 704, 1, 256]
    - [5, 0.015]
  - - [1, 1024, 1, 256]
    - [5, 0.021]
  - - [1, 1408, 1, 256]
    - [5, 0.027]
  - - [1, 1856, 1, 256]
    - [5, 0.036]
  - - [1, 2368, 1, 256]
    - [5, 0.048]
  - - [1, 2944, 1, 256]
    - [5, 0.06]
  - - [1, 3584, 1, 256]
    - [5, 0.075]
  - - [1, 4288, 1, 256]
    - [5, 0.084]
  - - [1, 5056, 1, 256]
    - [5, 0.099]
  - - [1, 5888, 1, 256]
    - [5, 0.111]
  - - [1, 6784, 1, 256]
    - [5, 0.147]
  - - [1, 64, 1, 1280]
    - [5, 0.003]
  - - [1, 128, 1, 1280]
    - [2, 0.003]
  - - [1, 256, 1, 1280]
    - [3, 0.006]
  - - [1, 448, 1, 1280]
    - [5, 0.012]
  - - [1, 704, 1, 1280]
    - [5, 0.018]
  - - [1, 1024, 1, 1280]
    - [5, 0.027]
  - - [1, 1408, 1, 1280]
    - [5, 0.039]
  - - [1, 1856, 1, 1280]
    - [5, 0.051]
  - - [1, 2368, 1, 1280]
    - [5, 0.066]
  - - [1, 2944, 1, 1280]
    - [5, 0.081]
  - - [1, 3584, 1, 1280]
    - [5, 0.099]
  - - [1, 4288, 1, 1280]
    - [5, 0.12]
  - - [1, 5056, 1, 1280]
    - [5, 0.141]
  - - [1, 5888, 1, 1280]
    - [5, 0.159]
  - - [1, 6784, 1, 1280]
    - [5, 0.183]
  - - [1, 64, 1, 3328]
    - [5, 0.003]
  - - [1, 128, 1, 3328]
    - [2, 0.003]
  - - [1, 256, 1, 3328]
    - [5, 0.009]
  - - [1, 448, 1, 3328]
    - [5, 0.012]
  - - [1, 704, 1, 3328]
    - [5, 0.021]
  - - [1, 1024, 1, 3328]
    - [5, 0.03]
  - - [1, 1408, 1, 3328]
    - [5, 0.042]
  - - [1, 1856, 1, 3328]
    - [5, 0.054]
  - - [1, 2368, 1, 3328]
    - [5, 0.069]
  - - [1, 2944, 1, 3328]
    - [5, 0.087]
  - - [1, 3584, 1, 3328]
    - [5, 0.105]
  - - [1, 4288, 1, 3328]
    - [5, 0.126]
  - - [1, 5056, 1, 3328]
    - [5, 0.147]
  - - [1, 5888, 1, 3328]
    - [5, 0.171]
  - - [1, 6784, 1, 3328]
    - [5, 0.198]
  - - [64, 1, 1, 256]
    - [19, 0.001]
  - - [128, 1, 1, 256]
    - [17, 0.003]
  - - [256, 1, 1, 256]
    - [26, 0.006]
  - - [448, 1, 1, 256]
    - [12, 0.01]
  - - [704, 1, 1, 256]
    - [45, 0.015]
  - - [1024, 1, 1, 256]
    - [24, 0.024]
  - - [1408, 1, 1, 256]
    - [9, 0.031]
  - - [1856, 1, 1, 256]
    - [12, 0.041]
  - - [2368, 1, 1, 256]
    - [10, 0.052]
  - - [2944, 1, 1, 256]
    - [11, 0.062]
  - - [3584, 1, 1, 256]
    - [13, 0.075]
  - - [4288, 1, 1, 256]
    - [13, 0.087]
  - - [5056, 1, 1, 256]
    - [13, 0.103]
  - - [5888, 1, 1, 256]
    - [27, 0.115]
  - - [6784, 1, 1, 256]
    - [26, 0.131]
  - - [64, 1, 1, 1280]
    - [45, 0.004]
  - - [128, 1, 1, 1280]
    - [10, 0.009]
  - - [256, 1, 1, 1280]
    - [19, 0.018]
  - - [448, 1, 1, 1280]
    - [19, 0.031]
  - - [704, 1, 1, 1280]
    - [19, 0.049]
  - - [1024, 1, 1, 1280]
    - [19, 0.07]
  - - [1408, 1, 1, 1280]
    - [19, 0.093]
  - - [1856, 1, 1, 1280]
    - [19, 0.129]
  - - [2368, 1, 1, 1280]
    - [17, 0.172]
  - - [2944, 1, 1, 1280]
    - [19, 0.197]
  - - [3584, 1, 1, 1280]
    - [18, 0.212]
  - - [4288, 1, 1, 1280]
    - [18, 0.249]
  - - [5056, 1, 1, 1280]
    - [18, 0.289]
  - - [5888, 1, 1, 1280]
    - [18, 0.34]
  - - [6784, 1, 1, 1280]
    - [18, 0.388]
  - - [64, 1, 1, 3328]
    - [10, 0.007]
  - - [128, 1, 1, 3328]
    - [44, 0.014]
  - - [256, 1, 1, 3328]
    - [44, 0.029]
  - - [448, 1, 1, 3328]
    - [44, 0.05]
  - - [704, 1, 1, 3328]
    - [19, 0.079]
  - - [1024, 1, 1, 3328]
    - [44, 0.112]
  - - [1408, 1, 1, 3328]
    - [44, 0.146]
  - - [1856, 1, 1, 3328]
    - [19, 0.21]
  - - [2368, 1, 1, 3328]
    - [10, 0.263]
  - - [2944, 1, 1, 3328]
    - [34, 0.284]
  - - [3584, 1, 1, 3328]
    - [18, 0.315]
  - - [4288, 1, 1, 3328]
    - [18, 0.384]
  - - [5056, 1, 1, 3328]
    - [18, 0.444]
  - - [5888, 1, 1, 3328]
    - [18, 0.515]
  - - [6784, 1, 1, 3328]
    - [18, 0.554]
  - - [64, 64, 1, 1]
    - [24, 0.0]
  - - [128, 64, 1, 1]
    - [25, 0.001]
  - - [256, 64, 1, 1]
    - [25, 0.002]
  - - [448, 64, 1, 1]
    - [26, 0.003]
  - - [704, 64, 1, 1]
    - [26, 0.005]
  - - [1024, 64, 1, 1]
    - [24, 0.007]
  - - [1408, 64, 1, 1]
    - [27, 0.009]
  - - [1856, 64, 1, 1]
    - [27, 0.012]
  - - [2368, 64, 1, 1]
    - [137, 0.015]
  - - [2944, 64, 1, 1]
    - [27, 0.018]
  - - [3584, 64, 1, 1]
    - [27, 0.022]
  - - [4288, 64, 1, 1]
    - [27, 0.026]
  - - [5056, 64, 1, 1]
    - [27, 0.03]
  - - [5888, 64, 1, 1]
    - [27, 0.035]
  - - [6784, 64, 1, 1]
    - [27, 0.039]
  - - [64, 128, 1, 1]
    - [24, 0.001]
  - - [128, 128, 1, 1]
    - [21, 0.002]
  - - [256, 128, 1, 1]
    - [26, 0.004]
  - - [448, 128, 1, 1]
    - [25, 0.006]
  - - [704, 128, 1, 1]
    - [27, 0.009]
  - - [1024, 128, 1, 1]
    - [137, 0.013]
  - - [1408, 128, 1, 1]
    - [137, 0.018]
  - - [1856, 128, 1, 1]
    - [27, 0.022]
  - - [2368, 128, 1, 1]
    - [27, 0.028]
  - - [2944, 128, 1, 1]
    - [27, 0.034]
  - - [3584, 128, 1, 1]
    - [53, 0.039]
  - - [4288, 128, 1, 1]
    - [137, 0.045]
  - - [5056, 128, 1, 1]
    - [52, 0.051]
  - - [5888, 128, 1, 1]
    - [50, 0.057]
  - - [6784, 128, 1, 1]
    - [51, 0.064]
  - - [64, 256, 1, 1]
    - [24, 0.002]
  - - [128, 256, 1, 1]
    - [24, 0.004]
  - - [256, 256, 1, 1]
    - [25, 0.007]
  - - [448, 256, 1, 1]
    - [24, 0.011]
  - - [704, 256, 1, 1]
    - [27, 0.018]
  - - [1024, 256, 1, 1]
    - [27, 0.025]
  - - [1408, 256, 1, 1]
    - [27, 0.033]
  - - [1856, 256, 1, 1]
    - [137, 0.039]
  - - [2368, 256, 1, 1]
    - [137, 0.05]
  - - [2944, 256, 1, 1]
    - [52, 0.058]
  - - [3584, 256, 1, 1]
    - [52, 0.063]
  - - [4288, 256, 1, 1]
    - [75, 0.072]
  - - [5056, 256, 1, 1]
    - [52, 0.08]
  - - [5888, 256, 1, 1]
    - [138, 0.088]
  - - [6784, 256, 1, 1]
    - [137, 0.094]
  - - [64, 448, 1, 1]
    - [24, 0.003]
  - - [128, 448, 1, 1]
    - [24, 0.006]
  - - [256, 448, 1, 1]
    - [27, 0.011]
  - - [448, 448, 1, 1]
    - [24, 0.019]
  - - [704, 448, 1, 1]
    - [26, 0.029]
  - - [1024, 448, 1, 1]
    - [53, 0.039]
  - - [1408, 448, 1, 1]
    - [137, 0.052]
  - - [1856, 448, 1, 1]
    - [142, 0.063]
  - - [2368, 448, 1, 1]
    - [52, 0.069]
  - - [2944, 448, 1, 1]
    - [52, 0.079]
  - - [3584, 448, 1, 1]
    - [141, 0.089]
  - - [4288, 448, 1, 1]
    - [125, 0.097]
  - - [5056, 448, 1, 1]
    - [139, 0.109]
  - - [5888, 448, 1, 1]
    - [132, 0.115]
  - - [6784, 448, 1, 1]
    - [138, 0.122]
  - - [64, 704, 1, 1]
    - [24, 0.005]
  - - [128, 704, 1, 1]
    - [26, 0.009]
  - - [256, 704, 1, 1]
    - [24, 0.018]
  - - [448, 704, 1, 1]
    - [27, 0.029]
  - - [704, 704, 1, 1]
    - [50, 0.04]
  - - [1024, 704, 1, 1]
    - [52, 0.055]
  - - [1408, 704, 1, 1]
    - [52, 0.065]
  - - [1856, 704, 1, 1]
    - [52, 0.078]
  - - [2368, 704, 1, 1]
    - [137, 0.091]
  - - [2944, 704, 1, 1]
    - [138, 0.102]
  - - [3584, 704, 1, 1]
    - [132, 0.114]
  - - [4288, 704, 1, 1]
    - [132, 0.123]
  - - [5056, 704, 1, 1]
    - [138, 0.131]
  - - [5888, 704, 1, 1]
    - [138, 0.139]
  - - [6784, 704, 1, 1]
    - [138, 0.147]
  - - [64, 1024, 1, 1]
    - [25, 0.007]
  - - [128, 1024, 1, 1]
    - [27, 0.013]
  - - [256, 1024, 1, 1]
    - [27, 0.025]
  - - [448, 1024, 1, 1]
    - [53, 0.038]
  - - [704, 1024, 1, 1]
    - [138, 0.054]
  - - [1024, 1024, 1, 1]
    - [52, 0.07]
  - - [1408, 1024, 1, 1]
    - [125, 0.082]
  - - [1856, 1024, 1, 1]
    - [141, 0.096]
  - - [2368, 1024, 1, 1]
    - [125, 0.11]
  - - [2944, 1024, 1, 1]
    - [132, 0.121]
  - - [3584, 1024, 1, 1]
    - [138, 0.133]
  - - [4288, 1024, 1, 1]
    - [138, 0.141]
  - - [5056, 1024, 1, 1]
    - [139, 0.148]
  - - [5888, 1024, 1, 1]
    - [132, 0.154]
  - - [6784, 1024, 1, 1]
    - [132, 0.161]
  - - [64, 1408, 1, 1]
    - [26, 0.01]
  - - [128, 1408, 1, 1]
    - [27, 0.018]
  - - [256, 1408, 1, 1]
    - [24, 0.032]
  - - [448, 1408, 1, 1]
    - [137, 0.051]
  - - [704, 1408, 1, 1]
    - [132, 0.066]
  - - [1024, 1408, 1, 1]
    - [52, 0.083]
  - - [1408, 1408, 1, 1]
    - [52, 0.099]
  - - [1856, 1408, 1, 1]
    - [132, 0.111]
  - - [2368, 1408, 1, 1]
    - [132, 0.126]
  - - [2944, 1408, 1, 1]
    - [132, 0.141]
  - - [3584, 1408, 1, 1]
    - [132, 0.147]
  - - [4288, 1408, 1, 1]
    - [139, 0.153]
  - - [5056, 1408, 1, 1]
    - [139, 0.16]
  - - [5888, 1408, 1, 1]
    - [132, 0.168]
  - - [6784, 1408, 1, 1]
    - [138, 0.168]
  - - [64, 1856, 1, 1]
    - [27, 0.013]
  - - [128, 1856, 1, 1]
    - [24, 0.024]
  - - [256, 1856, 1, 1]
    - [51, 0.04]
  - - [448, 1856, 1, 1]
    - [137, 0.064]
  - - [704, 1856, 1, 1]
    - [52, 0.081]
  - - [1024, 1856, 1, 1]
    - [138, 0.1]
  - - [1408, 1856, 1, 1]
    - [138, 0.114]
  - - [1856, 1856, 1, 1]
    - [125, 0.128]
  - - [2368, 1856, 1, 1]
    - [139, 0.141]
  - - [2944, 1856, 1, 1]
    - [132, 0.149]
  - - [3584, 1856, 1, 1]
    - [125, 0.159]
  - - [4288, 1856, 1, 1]
    - [139, 0.167]
  - - [5056, 1856, 1, 1]
    - [139, 0.173]
  - - [5888, 1856, 1, 1]
    - [139, 0.176]
  - - [6784, 1856, 1, 1]
    - [132, 0.177]
  - - [64, 2368, 1, 1]
    - [27, 0.015]
  - - [128, 2368, 1, 1]
    - [27, 0.029]
  - - [256, 2368, 1, 1]
    - [138, 0.049]
  - - [448, 2368, 1, 1]
    - [52, 0.071]
  - - [704, 2368, 1, 1]
    - [132, 0.09]
  - - [1024, 2368, 1, 1]
    - [132, 0.109]
  - - [1408, 2368, 1, 1]
    - [132, 0.126]
  - - [1856, 2368, 1, 1]
    - [125, 0.142]
  - - [2368, 2368, 1, 1]
    - [132, 0.153]
  - - [2944, 2368, 1, 1]
    - [139, 0.162]
  - - [3584, 2368, 1, 1]
    - [141, 0.172]
  - - [4288, 2368, 1, 1]
    - [132, 0.173]
  - - [5056, 2368, 1, 1]
    - [139, 0.18]
  - - [5888, 2368, 1, 1]
    - [138, 0.182]
  - - [6784, 2368, 1, 1]
    - [138, 0.185]
  - - [64, 2944, 1, 1]
    - [27, 0.019]
  - - [128, 2944, 1, 1]
    - [27, 0.036]
  - - [256, 2944, 1, 1]
    - [52, 0.058]
  - - [448, 2944, 1, 1]
    - [141, 0.08]
  - - [704, 2944, 1, 1]
    - [138, 0.102]
  - - [1024, 2944, 1, 1]
    - [138, 0.123]
  - - [1408, 2944, 1, 1]
    - [141, 0.141]
  - - [1856, 2944, 1, 1]
    - [132, 0.148]
  - - [2368, 2944, 1, 1]
    - [139, 0.163]
  - - [2944, 2944, 1, 1]
    - [132, 0.17]
  - - [3584, 2944, 1, 1]
    - [125, 0.175]
  - - [4288, 2944, 1, 1]
    - [139, 0.18]
  - - [5056, 2944, 1, 1]
    - [138, 0.184]
  - - [5888, 2944, 1, 1]
    - [138, 0.188]
  - - [6784, 2944, 1, 1]
    - [138, 0.189]
  - - [64, 3584, 1, 1]
    - [27, 0.023]
  - - [128, 3584, 1, 1]
    - [24, 0.04]
  - - [256, 3584, 1, 1]
    - [52, 0.068]
  - - [448, 3584, 1, 1]
    - [132, 0.088]
  - - [704, 3584, 1, 1]
    - [132, 0.115]
  - - [1024, 3584, 1, 1]
    - [132, 0.131]
  - - [1408, 3584, 1, 1]
    - [132, 0.145]
  - - [1856, 3584, 1, 1]
    - [132, 0.16]
  - - [2368, 3584, 1, 1]
    - [141, 0.17]
  - - [2944, 3584, 1, 1]
    - [139, 0.177]
  - - [3584, 3584, 1, 1]
    - [139, 0.181]
  - - [4288, 3584, 1, 1]
    - [138, 0.187]
  - - [5056, 3584, 1, 1]
    - [139, 0.187]
  - - [5888, 3584, 1, 1]
    - [139, 0.191]
  - - [6784, 3584, 1, 1]
    - [138, 0.194]
  - - [64, 4288, 1, 1]
    - [27, 0.027]
  - - [128, 4288, 1, 1]
    - [52, 0.046]
  - - [256, 4288, 1, 1]
    - [52, 0.072]
  - - [448, 4288, 1, 1]
    - [52, 0.1]
  - - [704, 4288, 1, 1]
    - [132, 0.121]
  - - [1024, 4288, 1, 1]
    - [132, 0.141]
  - - [1408, 4288, 1, 1]
    - [132, 0.157]
  - - [1856, 4288, 1, 1]
    - [132, 0.167]
  - - [2368, 4288, 1, 1]
    - [138, 0.174]
  - - [2944, 4288, 1, 1]
    - [125, 0.18]
  - - [3584, 4288, 1, 1]
    - [125, 0.186]
  - - [4288, 4288, 1, 1]
    - [139, 0.188]
  - - [5056, 4288, 1, 1]
    - [138, 0.191]
  - - [5888, 4288, 1, 1]
    - [139, 0.195]
  - - [6784, 4288, 1, 1]
    - [139, 0.196]
  - - [64, 5056, 1, 1]
    - [27, 0.031]
  - - [128, 5056, 1, 1]
    - [52, 0.053]
  - - [256, 5056, 1, 1]
    - [75, 0.082]
  - - [448, 5056, 1, 1]
    - [125, 0.111]
  - - [704, 5056, 1, 1]
    - [138, 0.131]
  - - [1024, 5056, 1, 1]
    - [138, 0.15]
  - - [1408, 5056, 1, 1]
    - [132, 0.164]
  - - [1856, 5056, 1, 1]
    - [141, 0.169]
  - - [2368, 5056, 1, 1]
    - [132, 0.179]
  - - [2944, 5056, 1, 1]
    - [132, 0.184]
  - - [3584, 5056, 1, 1]
    - [139, 0.189]
  - - [4288, 5056, 1, 1]
    - [138, 0.191]
  - - [5056, 5056, 1, 1]
    - [138, 0.195]
  - - [5888, 5056, 1, 1]
    - [138, 0.197]
  - - [6784, 5056, 1, 1]
    - [139, 0.198]
  - - [64, 5888, 1, 1]
    - [27, 0.035]
  - - [128, 5888, 1, 1]
    - [52, 0.059]
  - - [256, 5888, 1, 1]
    - [52, 0.093]
  - - [448, 5888, 1, 1]
    - [52, 0.119]
  - - [704, 5888, 1, 1]
    - [52, 0.139]
  - - [1024, 5888, 1, 1]
    - [138, 0.154]
  - - [1408, 5888, 1, 1]
    - [132, 0.169]
  - - [1856, 5888, 1, 1]
    - [132, 0.176]
  - - [2368, 5888, 1, 1]
    - [139, 0.183]
  - - [2944, 5888, 1, 1]
    - [139, 0.187]
  - - [3584, 5888, 1, 1]
    - [141, 0.192]
  - - [4288, 5888, 1, 1]
    - [138, 0.195]
  - - [5056, 5888, 1, 1]
    - [139, 0.198]
  - - [5888, 5888, 1, 1]
    - [139, 0.199]
  - - [6784, 5888, 1, 1]
    - [138, 0.198]
  - - [64, 6784, 1, 1]
    - [21, 0.037]
  - - [128, 6784, 1, 1]
    - [52, 0.066]
  - - [256, 6784, 1, 1]
    - [52, 0.097]
  - - [448, 6784, 1, 1]
    - [132, 0.125]
  - - [704, 6784, 1, 1]
    - [138, 0.144]
  - - [1024, 6784, 1, 1]
    - [52, 0.16]
  - - [1408, 6784, 1, 1]
    - [139, 0.17]
  - - [1856, 6784, 1, 1]
    - [132, 0.181]
  - - [2368, 6784, 1, 1]
    - [139, 0.187]
  - - [2944, 6784, 1, 1]
    - [132, 0.191]
  - - [3584, 6784, 1, 1]
    - [139, 0.194]
  - - [4288, 6784, 1, 1]
    - [139, 0.197]
  - - [5056, 6784, 1, 1]
    - [138, 0.198]
  - - [5888, 6784, 1, 1]
    - [139, 0.201]
  - - [6784, 6784, 1, 1]
    - [138, 0.2]
  - - [1, 1, 1, 256]
    - [7, 0.0]
  - - [1, 1, 1, 1280]
    - [5, 0.0]
  - - [1, 1, 1, 3328]
    - [5, 0.0]
  - - [1, 64, 1, 1]
    - [4, 0.0]
  - - [1, 128, 1, 1]
    - [2, 0.0]
  - - [1, 256, 1, 1]
    - [4, 0.0]
  - - [1, 448, 1, 1]
    - [3, 0.0]
  - - [1, 704, 1, 1]
    - [6, 0.0]
  - - [1, 1024, 1, 1]
    - [4, 0.001]
  - - [1, 1408, 1, 1]
    - [2, 0.001]
  - - [1, 1856, 1, 1]
    - [7, 0.001]
  - - [1, 2368, 1, 1]
    - [2, 0.001]
  - - [1, 2944, 1, 1]
    - [2, 0.001]
  - - [1, 3584, 1, 1]
    - [2, 0.001]
  - - [1, 4288, 1, 1]
    - [2, 0.003]
  - - [1, 5056, 1, 1]
    - [2, 0.003]
  - - [1, 5888, 1, 1]
    - [1, 0.003]
  - - [1, 6784, 1, 1]
    - [0, 0.003]
  - - [64, 1, 1, 1]
    - [25, 0.0]
  - - [128, 1, 1, 1]
    - [24, 0.0]
  - - [256, 1, 1, 1]
    - [24, 0.0]
  - - [448, 1, 1, 1]
    - [24, 0.0]
  - - [704, 1, 1, 1]
    - [24, 0.0]
  - - [1024, 1, 1, 1]
    - [26, 0.0]
  - - [1408, 1, 1, 1]
    - [24, 0.0]
  - - [1856, 1, 1, 1]
    - [24, 0.0]
  - - [2368, 1, 1, 1]
    - [27, 0.0]
  - - [2944, 1, 1, 1]
    - [24, 0.0]
  - - [3584, 1, 1, 1]
    - [13, 0.0]
  - - [4288, 1, 1, 1]
    - [13, 0.0]
  - - [5056, 1, 1, 1]
    - [13, 0.001]
  - - [5888, 1, 1, 1]
    - [27, 0.001]
  - - [6784, 1, 1, 1]
    - [27, 0.001]
  - - [7680, 8192, 1, 8192]
    - [96, 87.816]
  - - [3840, 4096, 1, 4096]
    - [117, 78.853]
  - - [1920, 2048, 1, 2048]
    - [104, 61.057]
  - - [960, 1024, 1, 1024]
    - [81, 30.57]
  - - [480, 512, 1, 512]
    - [32, 7.876]
  - - [8192, 7680, 1, 8192]
    - [116, 92.07]
  - - [4096, 3840, 1, 4096]
    - [74, 80.15]
  - - [2048, 1920, 1, 2048]
    - [115, 61.89]
  - - [1024, 960, 1, 1024]
    - [81, 30.405]
  - - [512, 480, 1, 512]
    - [28, 7.92]
  - - [8192, 8192, 1, 8192]
    - [121, 87.095]
  - - [4096, 4096, 1, 4096]
    - [119, 79.695]
  - - [2048, 2048, 1, 2048]
    - [143, 63.379]
  - - [512, 512, 1, 512]
    - [28, 8.543]
  - - [64, 512, 16, 512]
    - [48, 13.149]
  - - [64, 512, 128, 512]
    - [48, 24.39]
  - - [1024, 1, 1, 2]
    - [25, 0.0]
  - - [1024, 1, 1, 1024]
    - [19, 0.062]
  - - [1024, 8, 1, 1024]
    - [17, 0.492]
  - - [1024, 77, 1, 1024]
    - [19, 4.839]
  - - [1024, 77, 1, 30522]
    - [8, 22.316]
  - - [1024, 512, 1, 2]
    - [137, 0.09]
  - - [1024, 512, 1, 1024]
    - [55, 20.298]
  - - [1024, 512, 1, 4096]
    - [144, 32.963]
  - - [1024, 616, 1, 1024]
    - [48, 23.705]
  - - [1024, 4096, 1, 2]
    - [141, 0.275]
  - - [1024, 4096, 1, 1024]
    - [74, 49.886]
  - - [1024, 4096, 1, 4096]
    - [115, 74.848]
  - - [4096, 512, 1, 1024]
    - [68, 40.8]
  - - [4096, 4096, 1, 1024]
    - [74, 61.486]
  - - [64, 128, 128, 128]
    - [52, 8.592]
  - - [64, 128, 160, 128]
    - [52, 9.644]
  - - [1024, 10, 1, 2]
    - [24, 0.002]
  - - [1024, 10, 1, 1024]
    - [22, 0.6]
  - - [1024, 160, 1, 1024]
    - [38, 8.792]
  - - [1024, 200, 1, 1024]
    - [40, 9.723]
  - - [1024, 200, 1, 30522]
    - [145, 25.978]
  - - [1024, 1024, 1, 2]
    - [52, 0.138]
  - - [1024, 1024, 1, 4096]
    - [82, 53.946]
  - - [1024, 1280, 1, 2]
    - [52, 0.162]
  - - [1024, 1280, 1, 1024]
    - [92, 34.212]
  - - [1024, 1280, 1, 4096]
    - [110, 45.445]
  - - [4096, 1024, 1, 1024]
    - [66, 48.341]
  - - [4096, 1280, 1, 1024]
    - [62, 48.044]
  - - [64, 128, 624, 128]
    - [75, 12.246]
  - - [1024, 39, 1, 2]
    - [26, 0.009]
  - - [1024, 39, 1, 1024]
    - [19, 2.477]
  - - [1024, 780, 1, 1024]
    - [60, 27.923]
  - - [1024, 780, 1, 30522]
    - [146, 60.101]
  - - [1024, 4992, 1, 2]
    - [139, 0.287]
  - - [1024, 4992, 1, 1024]
    - [68, 51.687]
  - - [1024, 4992, 1, 4096]
    - [104, 71.55]
  - - [4096, 4992, 1, 1024]
    - [102, 60.271]
  - - [64, 512, 64, 512]
    - [33, 20.23]
  - - [1024, 4, 1, 2]
    - [26, 0.001]
  - - [1024, 4, 1, 1024]
    - [45, 0.249]
  - - [1024, 308, 1, 1024]
    - [39, 14.852]
  - - [1024, 308, 1, 30522]
    - [145, 38.555]
  - - [1024, 2048, 1, 2]
    - [138, 0.203]
  - - [1024, 2048, 1, 1024]
    - [66, 43.752]
  - - [1024, 2048, 1, 4096]
    - [111, 59.337]
  - - [4096, 2048, 1, 1024]
    - [74, 57.131]
  - - [64, 128, 640, 128]
    - [50, 12.436]
  - - [1024, 40, 1, 2]
    - [26, 0.009]
  - - [1024, 40, 1, 1024]
    - [45, 2.5]
  - - [1024, 800, 1, 1024]
    - [60, 28.212]
  - - [1024, 800, 1, 30522]
    - [146, 61.886]
  - - [1024, 5120, 1, 2]
    - [141, 0.295]
  - - [1024, 5120, 1, 1024]
    - [98, 52.827]
  - - [1024, 5120, 1, 4096]
    - [104, 72.898]
  - - [4096, 5120, 1, 1024]
    - [74, 61.549]
  - - [64, 128, 656, 128]
    - [51, 12.5]
  - - [1024, 41, 1, 2]
    - [24, 0.009]
  - - [1024, 41, 1, 1024]
    - [19, 2.647]
  - - [1024, 820, 1, 1024]
    - [60, 28.832]
  - - [1024, 820, 1, 30522]
    - [60, 57.451]
  - - [1024, 5248, 1, 2]
    - [141, 0.3]
  - - [1024, 5248, 1, 1024]
    - [68, 54.243]
  - - [1024, 5248, 1, 4096]
    - [104, 75.105]
  - - [4096, 5248, 1, 1024]
    - [102, 62.879]
  - - [64, 512, 80, 512]
    - [33, 23.851]
  - - [1024, 5, 1, 2]
    - [27, 0.001]
  - - [1024, 5, 1, 1024]
    - [19, 0.314]
  - - [1024, 385, 1, 1024]
    - [41, 15.959]
  - - [1024, 385, 1, 30522]
    - [147, 38.157]
  - - [1024, 2560, 1, 2]
    - [141, 0.226]
  - - [1024, 2560, 1, 1024]
    - [68, 49.097]
  - - [1024, 2560, 1, 4096]
    - [104, 70.745]
  - - [4096, 2560, 1, 1024]
    - [74, 58.925]
  - - [64, 512, 96, 512]
    - [148, 25.308]
  - - [1024, 6, 1, 2]
    - [24, 0.001]
  - - [1024, 6, 1, 1024]
    - [34, 0.364]
  - - [1024, 462, 1, 1024]
    - [41, 19.423]
  - - [1024, 462, 1, 30522]
    - [147, 45.14]
  - - [1024, 3072, 1, 2]
    - [52, 0.248]
  - - [1024, 3072, 1, 1024]
    - [106, 45.881]
  - - [1024, 3072, 1, 4096]
    - [120, 70.198]
  - - [4096, 3072, 1, 1024]
    - [74, 59.913]
  - - [1024, 8, 1, 2]
    - [24, 0.002]
  - - [1024, 160, 1, 30522]
    - [149, 32.852]
  - - [64, 128, 144, 128]
    - [52, 8.907]
  - - [1024, 9, 1, 2]
    - [24, 0.002]
  - - [1024, 9, 1, 1024]
    - [19, 0.557]
  - - [1024, 180, 1, 1024]
    - [47, 9.666]
  - - [1024, 180, 1, 30522]
    - [8, 35.77]
  - - [1024, 1152, 1, 2]
    - [75, 0.148]
  - - [1024, 1152, 1, 1024]
    - [150, 35.909]
  - - [1024, 1152, 1, 4096]
    - [104, 60.086]
  - - [4096, 1152, 1, 1024]
    - [98, 49.444]
  - - [256, 32768, 1, 128]
    - [132, 17.282]
  - - [479, 32768, 1, 1024]
    - [151, 50.148]
  - - [512, 32768, 1, 256]
    - [73, 30.568]
  - - [1024, 32768, 1, 512]
    - [73, 49.364]
  - - [1024, 32768, 1, 1024]
    - [74, 65.281]
  - - [64, 128, 512, 128]
    - [75, 12.244]
  - - [128, 128, 512, 64]
    - [52, 9.632]
  - - [1024, 32, 1, 2]
    - [25, 0.008]
  - - [1024, 32, 1, 1024]
    - [19, 2.011]
  - - [1024, 4096, 1, 30528]
    - [116, 90.056]
  - - [512, 512, 64, 64]
    - [138, 11.756]
  - - [1024, 2048, 1, 30528]
    - [152, 80.172]
  - - [64, 4, 32768, 4]
    - [139, 0.144]
  - - [64, 4, 38400, 4]
    - [139, 0.145]
  - - [1024, 8192, 1, 1024]
    - [74, 56.169]
  - - [1024, 8192, 1, 4096]
    - [153, 77.47]
  - - [1024, 8192, 1, 33712]
    - [143, 90.477]
  - - [1024, 9600, 1, 1024]
    - [90, 55.108]
  - - [1024, 9600, 1, 4096]
    - [96, 76.04]
  - - [1024, 9600, 1, 33712]
    - [120, 88.396]
  - - [4096, 8192, 1, 1024]
    - [74, 63.828]
  - - [4096, 9600, 1, 1024]
    - [74, 65.785]
  - - [1024, 10064, 1, 1024]
    - [90, 56.697]
  - - [1024, 10064, 1, 4096]
    - [96, 79.118]
  - - [1024, 10080, 1, 1024]
    - [151, 57.279]
  - - [1024, 10080, 1, 4096]
    - [96, 79.389]
  - - [1024, 10080, 1, 42720]
    - [96, 93.722]
  - - [1024, 10200, 1, 1024]
    - [74, 57.739]
  - - [1024, 10200, 1, 4096]
    - [96, 80.12]
  - - [1024, 3840, 1, 1024]
    - [122, 51.552]
  - - [1024, 3840, 1, 4096]
    - [112, 76.02]
  - - [1024, 3968, 1, 1024]
    - [74, 48.377]
  - - [1024, 3968, 1, 4096]
    - [116, 72.036]
  - - [1024, 3968, 1, 42720]
    - [143, 88.16]
  - - [1024, 6528, 1, 1024]
    - [151, 56.047]
  - - [1024, 6528, 1, 4096]
    - [96, 76.623]
  - - [1024, 6528, 1, 42720]
    - [154, 92.204]
  - - [1024, 7104, 1, 1024]
    - [90, 53.017]
  - - [1024, 7104, 1, 4096]
    - [112, 72.07]
  - - [1024, 7104, 1, 42720]
    - [155, 89.645]
  - - [1024, 7200, 1, 1024]
    - [122, 53.665]
  - - [1024, 7200, 1, 4096]
    - [112, 72.654]
  - - [1024, 7200, 1, 42720]
    - [155, 90.782]
  - - [1024, 8064, 1, 1024]
    - [74, 55.259]
  - - [1024, 8064, 1, 4096]
    - [116, 76.305]
  - - [1024, 8160, 1, 1024]
    - [74, 55.885]
  - - [1024, 8160, 1, 4096]
    - [116, 77.633]
  - - [1024, 9216, 1, 1024]
    - [151, 58.725]
  - - [1024, 9216, 1, 4096]
    - [104, 76.378]
  - - [1024, 9520, 1, 1024]
    - [90, 55.158]
  - - [1024, 9520, 1, 4096]
    - [96, 75.242]
  - - [1024, 9520, 1, 42720]
    - [146, 89.08]
  - - [4096, 10064, 1, 1024]
    - [74, 65.192]
  - - [4096, 10080, 1, 1024]
    - [74, 65.557]
  - - [4096, 10200, 1, 1024]
    - [74, 66.337]
  - - [4096, 3840, 1, 1024]
    - [74, 63.917]
  - - [4096, 3968, 1, 1024]
    - [74, 59.64]
  - - [4096, 6528, 1, 1024]
    - [74, 65.901]
  - - [4096, 7104, 1, 1024]
    - [74, 63.043]
  - - [4096, 7200, 1, 1024]
    - [74, 63.277]
  - - [4096, 8064, 1, 1024]
    - [74, 65.849]
  - - [4096, 8160, 1, 1024]
    - [74, 66.461]
  - - [4096, 9216, 1, 1024]
    - [74, 66.693]
  - - [4096, 9520, 1, 1024]
    - [74, 65.464]
  - - [64, 14, 10880, 14]
    - [52, 1.444]
  - - [64, 14, 10880, 15]
    - [52, 1.483]
  - - [64, 15, 7680, 15]
    - [52, 1.514]
  - - [64, 15, 10880, 15]
    - [52, 1.554]
  - - [64, 15, 7680, 17]
    - [52, 1.612]
  - - [64, 17, 6144, 17]
    - [52, 1.751]
  - - [64, 17, 7680, 17]
    - [52, 1.823]
  - - [64, 17, 6144, 21]
    - [52, 2.114]
  - - [64, 21, 6144, 21]
    - [52, 2.486]
  - - [64, 24, 4736, 24]
    - [138, 3.036]
  - - [64, 24, 4736, 34]
    - [141, 3.892]
  - - [64, 30, 2048, 30]
    - [138, 3.621]
  - - [64, 31, 2048, 30]
    - [125, 3.643]
  - - [64, 31, 2048, 31]
    - [52, 3.667]
  - - [64, 32, 4608, 32]
    - [51, 5.341]
  - - [64, 34, 4736, 34]
    - [138, 3.309]
  - - [64, 35, 4608, 32]
    - [138, 4.312]
  - - [64, 35, 4608, 35]
    - [52, 3.378]
  - - [64, 512, 1, 512]
    - [36, 1.235]
  - - [512, 512, 1, 64]
    - [27, 1.673]
  - - [128, 128, 1, 64]
    - [26, 0.121]
  - - [64, 128, 1, 128]
    - [12, 0.111]
  - - [1024, 512, 1, 64]
    - [137, 2.977]
  - - [74, 512, 1, 2048]
    - [35, 3.362]
  - - [64, 5, 1, 5]
    - [24, 0.0]
  - - [2048, 512, 1, 2048]
    - [81, 43.831]
  - - [512, 1600, 1, 512]
    - [87, 20.817]
  - - [32, 33, 1, 33]
    - [21, 0.004]
  - - [560, 1600, 1, 1024]
    - [81, 27.42]
  - - [512, 1600, 1, 32]
    - [52, 2.307]
  - - [1024, 1600, 1, 1024]
    - [71, 42.005]
  - - [32, 33, 1600, 33]
    - [156, 2.301]
  - - [32, 200, 1, 1]
    - [25, 0.001]
  - - [64, 3, 512, 3]
    - [52, 0.023]
  - - [64, 5, 512, 5]
    - [52, 0.063]
  - - [64, 5, 960, 5]
    - [137, 0.087]
  - - [64, 9, 512, 9]
    - [52, 0.195]
  - - [64, 512, 1, 1]
    - [24, 0.004]
  - - [67, 512, 1, 2048]
    - [35, 3.033]
  - - [74, 960, 1, 2048]
    - [135, 6.305]
  - - [100, 512, 1, 2048]
    - [45, 4.597]
  - - [128, 27, 32768, 27]
    - [125, 3.886]
  - - [256, 8976, 1, 1536]
    - [68, 49.215]
  - - [256, 8976, 1, 2048]
    - [98, 51.879]
  - - [256, 8976, 1, 2304]
    - [68, 54.324]
  - - [256, 8976, 1, 2560]
    - [98, 55.23]
  - - [256, 8976, 1, 2816]
    - [78, 55.736]
  - - [256, 8976, 1, 3072]
    - [98, 57.012]
  - - [256, 8976, 1, 4352]
    - [81, 60.347]
  - - [256, 8976, 1, 4864]
    - [98, 61.217]
  - - [256, 8976, 1, 5376]
    - [104, 62.161]
  - - [256, 8976, 1, 5632]
    - [104, 63.202]
  - - [256, 8976, 1, 5888]
    - [104, 62.627]
  - - [256, 8976, 1, 6144]
    - [104, 63.22]
  - - [256, 8976, 1, 6656]
    - [81, 63.963]
  - - [256, 8976, 1, 7168]
    - [104, 64.101]
  - - [256, 8976, 1, 7424]
    - [81, 65.086]
  - - [256, 8976, 1, 8192]
    - [104, 66.069]
  - - [256, 8976, 1, 8448]
    - [81, 65.482]
  - - [256, 8976, 1, 8960]
    - [81, 65.582]
  - - [256, 8976, 1, 9472]
    - [104, 66.115]
  - - [256, 8976, 1, 9728]
    - [81, 66.732]
  - - [256, 8976, 1, 9984]
    - [104, 66.532]
  - - [256, 8976, 1, 10240]
    - [82, 66.226]
  - - [256, 8976, 1, 10496]
    - [81, 66.47]
  - - [256, 8976, 1, 11008]
    - [81, 67.087]
  - - [256, 8976, 1, 11520]
    - [81, 67.445]
  - - [256, 8976, 1, 12288]
    - [81, 68.208]
  - - [256, 8976, 1, 14336]
    - [157, 67.9]
  - - [256, 8976, 1, 14848]
    - [157, 68.63]
  - - [256, 8976, 1, 15104]
    - [158, 69.037]
  - - [256, 8976, 1, 15872]
    - [158, 69.871]
  - - [256, 8976, 1, 17152]
    - [158, 71.505]
  - - [256, 8976, 1, 19712]
    - [157, 73.885]
  - - [256, 8976, 1, 19968]
    - [157, 73.43]
  - - [256, 8976, 1, 20480]
    - [157, 74.624]
  - - [256, 8976, 1, 20992]
    - [158, 74.498]
  - - [256, 8976, 1, 22016]
    - [157, 75.683]
  - - [256, 8976, 1, 26112]
    - [157, 77.774]
  - - [256, 8976, 1, 33536]
    - [157, 81.392]
  - - [256, 8976, 1, 44505]
    - [157, 83.076]
  - - [257, 1024, 1, 4096]
    - [159, 16.821]
  - - [480, 32768, 1, 1024]
    - [102, 56.973]
  - - [512, 200, 1, 1]
    - [24, 0.011]
  - - [512, 200, 1, 32]
    - [137, 0.373]
  - - [512, 215, 1, 2048]
    - [47, 8.581]
  - - [512, 256, 1, 2048]
    - [37, 10.287]
  - - [560, 200, 1, 1024]
    - [37, 5.9]
  - - [768, 215, 1, 2048]
    - [38, 12.492]
  - - [768, 256, 1, 2048]
    - [38, 14.777]
  - - [1024, 1, 1, 200]
    - [26, 0.018]
  - - [1024, 1, 1, 1600]
    - [9, 0.072]
  - - [1024, 200, 1, 1]
    - [24, 0.02]
  - - [1024, 512, 1, 1]
    - [137, 0.043]
  - - [1024, 960, 1, 64]
    - [52, 4.663]
  - - [1024, 1600, 1, 1]
    - [138, 0.09]
  - - [1024, 1792, 1, 256]
    - [66, 19.176]
  - - [1024, 2048, 1, 256]
    - [67, 21.223]
  - - [1024, 2560, 1, 256]
    - [68, 23.481]
  - - [1024, 3072, 1, 256]
    - [70, 21.915]
  - - [1024, 3328, 1, 256]
    - [63, 23.019]
  - - [1024, 3840, 1, 256]
    - [70, 25.372]
  - - [1024, 4096, 1, 256]
    - [67, 24.638]
  - - [1024, 4608, 1, 256]
    - [69, 24.79]
  - - [1024, 4864, 1, 256]
    - [70, 25.336]
  - - [1024, 5120, 1, 256]
    - [73, 26.483]
  - - [1024, 5632, 1, 256]
    - [73, 27.956]
  - - [1024, 6144, 1, 256]
    - [76, 27.328]
  - - [1024, 6400, 1, 256]
    - [70, 28.086]
  - - [1024, 7168, 1, 256]
    - [73, 28.189]
  - - [1024, 7424, 1, 256]
    - [73, 28.737]
  - - [1024, 7680, 1, 256]
    - [73, 29.193]
  - - [1024, 7936, 1, 256]
    - [73, 28.07]
  - - [1024, 8192, 1, 256]
    - [74, 28.003]
  - - [1024, 8448, 1, 256]
    - [73, 28.745]
  - - [1024, 8704, 1, 256]
    - [74, 28.982]
  - - [1024, 8960, 1, 256]
    - [73, 29.469]
  - - [1024, 9728, 1, 256]
    - [73, 31.027]
  - - [1024, 9984, 1, 256]
    - [76, 29.458]
  - - [1024, 10240, 1, 256]
    - [76, 29.563]
  - - [1024, 10496, 1, 256]
    - [70, 30.009]
  - - [1024, 11008, 1, 256]
    - [73, 30.788]
  - - [1024, 11264, 1, 256]
    - [73, 31.474]
  - - [1024, 11520, 1, 256]
    - [73, 32.068]
  - - [1024, 12288, 1, 256]
    - [73, 30.269]
  - - [1024, 13312, 1, 256]
    - [73, 32.28]
  - - [1024, 13568, 1, 256]
    - [73, 32.343]
  - - [1024, 14336, 1, 256]
    - [73, 31.364]
  - - [1024, 14592, 1, 256]
    - [73, 32.186]
  - - [1024, 14848, 1, 256]
    - [73, 32.221]
  - - [1024, 15104, 1, 256]
    - [73, 32.396]
  - - [1024, 16128, 1, 256]
    - [73, 31.379]
  - - [1024, 17152, 1, 256]
    - [73, 33.262]
  - - [1024, 18944, 1, 256]
    - [73, 33.087]
  - - [1024, 19712, 1, 256]
    - [73, 33.421]
  - - [1024, 19968, 1, 256]
    - [73, 32.746]
  - - [1024, 20480, 1, 256]
    - [73, 33.107]
  - - [1024, 20992, 1, 256]
    - [73, 33.495]
  - - [1024, 21504, 1, 256]
    - [73, 34.33]
  - - [1024, 22016, 1, 256]
    - [73, 32.463]
  - - [1024, 23552, 1, 256]
    - [73, 34.3]
  - - [1024, 28672, 1, 256]
    - [73, 34.677]
  - - [1024, 33536, 1, 256]
    - [73, 35.086]
  - - [1024, 40448, 1, 256]
    - [73, 35.291]
  - - [1600, 512, 1, 1024]
    - [55, 30.685]
  - - [2048, 1, 1, 512]
    - [19, 0.08]
  - - [2048, 512, 1, 1]
    - [52, 0.069]
  - - [2048, 960, 1, 2048]
    - [160, 50.575]
  - - [2048, 1024, 1, 1]
    - [138, 0.101]
  - - [2048, 1024, 1, 256]
    - [67, 21.149]
  - - [3200, 1024, 1, 2048]
    - [161, 63.643]
  - - [4096, 1024, 1, 1]
    - [132, 0.14]
  - - [2048, 1024, 1, 2048]
    - [66, 52.597]
  - - [2048, 1024, 1, 30592]
    - [157, 73.48]
  - - [2048, 1024, 1, 6144]
    - [81, 61.072]
  - - [2048, 1024, 1, 8192]
    - [104, 62.418]
  - - [2048, 2, 1, 2]
    - [24, 0.001]
  - - [2048, 2, 1, 2048]
    - [19, 0.345]
  - - [8192, 1024, 1, 2048]
    - [70, 61.272]
  - - [1024, 16, 1, 1024]
    - [19, 0.969]
  - - [1024, 16, 1, 2]
    - [24, 0.004]
  - - [1024, 8192, 1, 30592]
    - [116, 88.847]
  - - [1024, 8192, 1, 3072]
    - [143, 73.84]
  - - [512, 512, 256, 64]
    - [141, 12.641]
  - - [64, 512, 256, 512]
    - [162, 26.928]
  - - [1024, 2048, 1, 30592]
    - [154, 77.84]
  - - [1024, 2048, 1, 3072]
    - [66, 56.84]
  - - [1024, 4096, 1, 30592]
    - [97, 88.979]
  - - [1024, 4096, 1, 3072]
    - [97, 70.3]
  - - [512, 512, 128, 64]
    - [139, 12.319]
  - - [2560, 2048, 1, 1920]
    - [98, 62.178]
  - - [2560, 2048, 1, 2560]
    - [98, 65.861]
  - - [2560, 2048, 1, 7680]
    - [104, 76.734]
  - - [2560, 4, 1, 2]
    - [27, 0.002]
  - - [2560, 4, 1, 2560]
    - [19, 0.935]
  - - [640, 2048, 1, 2560]
    - [82, 58.43]
  - - [512, 512, 40, 64]
    - [52, 11.234]
  - - [64, 512, 40, 512]
    - [163, 21.852]
  - - [1536, 4096, 1, 1536]
    - [74, 61.063]
  - - [1536, 4096, 1, 4608]
    - [96, 73.433]
  - - [1536, 4096, 1, 50304]
    - [154, 86.057]
  - - [1536, 4096, 1, 6144]
    - [120, 76.271]
  - - [6144, 4096, 1, 1536]
    - [90, 70.436]
  - - [1024, 1024, 64, 96]
    - [67, 17.652]
  - - [96, 1024, 64, 1024]
    - [164, 39.192]
  - - [1536, 8192, 1, 1536]
    - [74, 64.386]
  - - [1536, 8192, 1, 4608]
    - [97, 78.877]
  - - [1536, 8192, 1, 50304]
    - [165, 91.792]
  - - [1536, 8192, 1, 6144]
    - [116, 82.024]
  - - [6144, 8192, 1, 1536]
    - [90, 73.379]
  - - [1024, 1024, 128, 96]
    - [67, 18.047]
  - - [96, 1024, 128, 1024]
    - [164, 42.672]
  - - [1024, 16384, 1, 1024]
    - [74, 60.374]
  - - [1024, 16384, 1, 3072]
    - [97, 75.159]
  - - [1024, 16384, 1, 4096]
    - [116, 78.752]
  - - [1024, 16384, 1, 50304]
    - [157, 92.411]
  - - [4096, 16384, 1, 1024]
    - [74, 68.118]
  - - [1024, 1024, 256, 64]
    - [132, 12.992]
  - - [64, 1024, 256, 1024]
    - [166, 34.595]
  - - [1024, 2048, 1, 50304]
    - [167, 82.654]
  - - [1024, 1024, 32, 64]
    - [138, 12.497]
  - - [64, 1024, 32, 1024]
    - [48, 26.617]
  - - [1024, 4096, 1, 50304]
    - [116, 89.578]
  - - [1024, 1024, 64, 64]
    - [139, 12.832]
  - - [64, 1024, 64, 1024]
    - [87, 31.877]
  - - [1024, 8192, 1, 50304]
    - [116, 89.218]
  - - [1024, 1024, 128, 64]
    - [139, 12.982]
  - - [64, 1024, 128, 1024]
    - [63, 32.773]
  - - [128, 128, 1024, 64]
    - [52, 10.269]
  - - [64, 128, 1024, 128]
    - [51, 12.966]
  - - [1024, 64, 1, 2]
    - [25, 0.015]
  - - [1024, 8192, 1, 30528]
    - [143, 90.562]
  - - [1024, 64, 1, 1024]
    - [19, 3.979]
  - - [1024, 3456, 1, 1024]
    - [120, 49.25]
  - - [1024, 3456, 1, 512]
    - [70, 35.503]
  - - [1024, 4096, 1, 512]
    - [74, 37.338]
  - - [1024, 6912, 1, 1024]
    - [96, 53.899]
  - - [1024, 6912, 1, 512]
    - [73, 39.486]
  - - [1024, 864, 1, 1024]
    - [81, 27.512]
  - - [1024, 864, 1, 512]
    - [62, 18.694]
  - - [256, 3456, 1, 128]
    - [33, 7.876]
  - - [256, 4096, 1, 128]
    - [52, 8.843]
  - - [256, 55296, 1, 128]
    - [132, 18.325]
  - - [256, 6912, 1, 128]
    - [65, 11.341]
  - - [256, 864, 1, 128]
    - [26, 2.658]
  - - [480, 3456, 1, 1024]
    - [71, 41.07]
  - - [480, 4096, 1, 1024]
    - [66, 40.65]
  - - [480, 6912, 1, 1024]
    - [130, 48.575]
  - - [480, 864, 1, 1024]
    - [28, 18.545]
  - - [512, 3456, 1, 256]
    - [64, 20.252]
  - - [512, 4096, 1, 256]
    - [67, 20.715]
  - - [512, 55296, 1, 256]
    - [73, 32.715]
  - - [512, 6912, 1, 256]
    - [70, 23.682]
  - - [512, 864, 1, 256]
    - [50, 8.127]
  - - [1024, 640, 1, 30528]
    - [146, 51.404]
  - - [1024, 1280, 1, 30528]
    - [155, 69.538]
  - - [1024, 1600, 1, 30528]
    - [165, 75.156]
  - - [1024, 10240, 1, 1024]
    - [74, 58.105]
  - - [1024, 10240, 1, 4096]
    - [96, 80.395]
  - - [4096, 10240, 1, 1024]
    - [74, 66.442]
  - - [1024, 80, 1, 1024]
    - [19, 4.922]
  - - [1024, 80, 1, 2]
    - [24, 0.017]
  - - [128, 128, 1280, 64]
    - [168, 10.372]
  - - [64, 128, 1280, 128]
    - [168, 13.104]
  - - [1024, 1640, 1, 30528]
    - [169, 76.667]
  - - [1024, 10496, 1, 1024]
    - [102, 58.795]
  - - [1024, 10496, 1, 4096]
    - [120, 82.35]
  - - [4096, 10496, 1, 1024]
    - [74, 65.236]
  - - [1024, 82, 1, 1024]
    - [19, 5.072]
  - - [1024, 82, 1, 2]
    - [26, 0.017]
  - - [128, 128, 1312, 64]
    - [52, 10.375]
  - - [64, 128, 1312, 128]
    - [51, 13.135]
  - - [1024, 160, 1, 30528]
    - [149, 33.947]
  - - [1024, 240, 1, 30528]
    - [170, 41.173]
  - - [1024, 6144, 1, 4096]
    - [120, 72.657]
  - - [1024, 12, 1, 1024]
    - [19, 0.738]
  - - [4096, 6144, 1, 1024]
    - [74, 62.237]
  - - [1024, 6144, 1, 1024]
    - [122, 53.568]
  - - [1024, 12, 1, 2]
    - [24, 0.003]
  - - [512, 512, 192, 64]
    - [52, 12.549]
  - - [64, 512, 192, 512]
    - [65, 26.035]
  - - [256, 4096, 1, 1]
    - [52, 0.073]
  - - [256, 6912, 1, 1]
    - [137, 0.097]
  - - [3136, 128, 64, 64]
    - [139, 11.936]
  - - [3136, 256, 64, 64]
    - [139, 12.977]
  - - [3136, 256, 64, 128]
    - [138, 20.119]
  - - [784, 512, 64, 256]
    - [70, 32.09]
  - - [3136, 128, 64, 256]
    - [73, 27.845]
  - - [3136, 256, 64, 256]
    - [73, 32.237]
  - - [784, 256, 64, 512]
    - [171, 38.432]
  - - [784, 512, 64, 512]
    - [70, 43.637]
  - - [3136, 128, 32, 64]
    - [75, 11.186]
  - - [3136, 256, 32, 64]
    - [138, 12.542]
  - - [3136, 256, 32, 128]
    - [75, 19.571]
  - - [784, 512, 32, 256]
    - [70, 29.734]
  - - [3136, 128, 32, 256]
    - [73, 25.89]
  - - [3136, 256, 32, 256]
    - [73, 30.925]
  - - [784, 256, 32, 512]
    - [70, 35.284]
  - - [784, 512, 32, 512]
    - [70, 40.937]
  - - [3136, 64, 64, 64]
    - [138, 10.201]
  - - [3136, 64, 64, 256]
    - [67, 21.78]
  - - [784, 128, 64, 512]
    - [80, 32.642]
  - - [64, 192, 64, 1280]
    - [33, 25.091]
  - - [64, 320, 64, 1280]
    - [87, 26.773]
  - - [64, 384, 64, 1280]
    - [163, 30.528]
  - - [64, 448, 64, 1280]
    - [90, 25.944]
  - - [64, 192, 64, 2048]
    - [172, 25.486]
  - - [64, 320, 64, 2048]
    - [48, 29.738]
  - - [64, 384, 64, 2048]
    - [42, 31.891]
  - - [64, 448, 64, 2048]
    - [48, 28.862]
  - - [64, 192, 32, 1280]
    - [32, 19.487]
  - - [64, 320, 32, 1280]
    - [48, 25.338]
  - - [64, 384, 32, 1280]
    - [87, 27.866]
  - - [64, 448, 32, 1280]
    - [91, 21.979]
  - - [64, 192, 32, 2048]
    - [39, 21.5]
  - - [64, 320, 32, 2048]
    - [48, 28.532]
  - - [64, 384, 32, 2048]
    - [48, 30.6]
  - - [64, 448, 32, 2048]
    - [91, 24.446]
  - - [1024, 10224, 1, 1024]
    - [70, 57.298]
  - - [1024, 10192, 1, 1024]
    - [74, 57.638]
  - - [1024, 10208, 1, 1024]
    - [74, 57.867]
  - - [1024, 10224, 1, 4096]
    - [96, 79.95]
  - - [1024, 10224, 1, 3072]
    - [96, 76.093]
  - - [4096, 10224, 1, 1024]
    - [74, 66.247]
  - - [1024, 10240, 1, 3072]
    - [120, 76.421]
  - - [1024, 10192, 1, 3072]
    - [96, 76.11]
  - - [4096, 10192, 1, 1024]
    - [74, 66.249]
  - - [1024, 10192, 1, 4096]
    - [96, 80.138]
  - - [1024, 10200, 1, 3072]
    - [96, 75.549]
  - - [1024, 10184, 1, 1024]
    - [74, 57.538]
  - - [4096, 10208, 1, 1024]
    - [74, 66.334]
  - - [1024, 10208, 1, 3072]
    - [96, 76.102]
  - - [1024, 10208, 1, 4096]
    - [96, 80.223]
  - - [1024, 10224, 1, 2048]
    - [96, 68.843]
  - - [1024, 10240, 1, 2048]
    - [120, 69.465]
  - - [1024, 10120, 1, 1024]
    - [74, 57.673]
  - - [1024, 10192, 1, 2048]
    - [96, 69.04]
  - - [64, 24, 6816, 24]
    - [52, 3.239]
  - - [1024, 10152, 1, 1024]
    - [102, 57.33]
  - - [1024, 10080, 1, 3072]
    - [96, 75.084]
  - - [64, 26, 6272, 26]
    - [52, 3.559]
  - - [100352, 512, 1, 256]
    - [73, 28.837]
  - - [12544, 2048, 1, 1024]
    - [74, 60.922]
  - - [12544, 64, 1, 147]
    - [52, 7.428]
  - - [200704, 512, 1, 256]
    - [73, 27.553]
  - - [25088, 1024, 1, 512]
    - [133, 44.556]
  - - [3136, 64, 1, 576]
    - [32, 7.079]
  - - [50176, 1024, 1, 512]
    - [133, 48.099]
  - - [6272, 2048, 1, 1024]
    - [74, 60.388]
  - - [784, 128, 1, 1152]
    - [34, 6.612]
  - - [3136, 128, 128, 256]
    - [73, 28.609]
  - - [3136, 128, 256, 256]
    - [73, 28.967]
  - - [3136, 256, 128, 64]
    - [139, 13.105]
  - - [3136, 256, 256, 64]
    - [139, 13.079]
  - - [3136, 64, 128, 256]
    - [67, 22.191]
  - - [3136, 64, 256, 256]
    - [66, 22.066]
  - - [3136, 64, 128, 64]
    - [67, 10.708]
  - - [3136, 64, 256, 64]
    - [67, 10.968]
  - - [784, 128, 128, 512]
    - [71, 33.317]
  - - [784, 128, 256, 512]
    - [74, 34.256]
  - - [784, 256, 128, 512]
    - [171, 40.971]
  - - [784, 256, 256, 512]
    - [173, 42.035]
  - - [784, 512, 128, 128]
    - [70, 20.295]
  - - [784, 512, 256, 128]
    - [70, 20.709]
  - - [128, 128, 2048, 64]
    - [51, 10.598]
  - - [64, 128, 2048, 128]
    - [168, 13.338]
  - - [1024, 2560, 1, 30528]
    - [81, 85.382]
  - - [1024, 128, 1, 1024]
    - [37, 7.066]
  - - [1024, 128, 1, 2]
    - [27, 0.027]
  - - [128, 128, 1536, 64]
    - [125, 10.483]
  - - [64, 128, 1536, 128]
    - [168, 13.274]
  - - [1024, 12288, 1, 4096]
    - [116, 77.755]
  - - [1024, 12288, 1, 1024]
    - [74, 58.347]
  - - [4096, 12288, 1, 1024]
    - [74, 66.431]
  - - [1024, 1920, 1, 30528]
    - [144, 75.438]
  - - [1024, 96, 1, 1024]
    - [19, 6.065]
  - - [1024, 96, 1, 2]
    - [137, 0.02]
  - - [128, 128, 192, 64]
    - [52, 8.101]
  - - [64, 128, 192, 128]
    - [64, 9.862]
  - - [768, 2048, 1, 2]
    - [52, 0.183]
  - - [3072, 2048, 1, 768]
    - [74, 48.736]
  - - [768, 2048, 1, 3072]
    - [83, 52.445]
  - - [768, 2048, 1, 768]
    - [71, 35.72]
  - - [384, 384, 144, 64]
    - [125, 11.943]
  - - [64, 384, 144, 384]
    - [163, 21.81]
  - - [768, 4608, 1, 2]
    - [141, 0.263]
  - - [3072, 4608, 1, 768]
    - [73, 53.675]
  - - [768, 4608, 1, 3072]
    - [120, 72.908]
  - - [768, 4608, 1, 768]
    - [174, 43.189]
  - - [512, 512, 48, 64]
    - [125, 11.427]
  - - [64, 512, 48, 512]
    - [64, 24.324]
  - - [128, 128, 256, 64]
    - [125, 8.766]
  - - [64, 128, 256, 128]
    - [75, 10.918]
  - - [384, 384, 192, 64]
    - [125, 12.217]
  - - [64, 384, 192, 384]
    - [80, 21.133]
  - - [1024, 4608, 1, 2]
    - [132, 0.291]
  - - [4096, 4608, 1, 1024]
    - [122, 62.483]
  - - [1024, 4608, 1, 4096]
    - [104, 66.489]
  - - [1024, 4608, 1, 1024]
    - [68, 48.78]
  - - [8192, 1024, 1, 1024]
    - [70, 53.088]
  - - [8192, 4096, 1, 1024]
    - [74, 63.817]
  - - [196, 1024, 64, 512]
    - [68, 34.869]
  - - [196, 512, 64, 1024]
    - [98, 38.693]
  - - [196, 1024, 64, 1024]
    - [130, 44.276]
  - - [49, 2048, 64, 1024]
    - [175, 22.426]
  - - [49, 1024, 64, 2048]
    - [56, 23.972]
  - - [196, 1024, 32, 512]
    - [176, 31.003]
  - - [196, 512, 32, 1024]
    - [68, 35.934]
  - - [196, 1024, 32, 1024]
    - [68, 39.666]
  - - [49, 2048, 32, 1024]
    - [175, 20.457]
  - - [49, 1024, 32, 2048]
    - [177, 20.048]
  - - [49, 2048, 64, 512]
    - [175, 17.608]
  - - [49, 512, 64, 2048]
    - [56, 19.833]
  - - [1225, 32, 64, 192]
    - [178, 12.007]
  - - [1225, 48, 64, 192]
    - [75, 11.197]
  - - [1225, 64, 64, 192]
    - [75, 15.244]
  - - [1225, 48, 64, 256]
    - [75, 12.592]
  - - [1225, 64, 64, 256]
    - [178, 16.445]
  - - [1225, 48, 64, 288]
    - [75, 13.705]
  - - [1225, 64, 64, 288]
    - [179, 18.735]
  - - [5329, 80, 64, 64]
    - [75, 8.444]
  - - [289, 128, 64, 768]
    - [180, 25.012]
  - - [289, 160, 64, 768]
    - [181, 27.713]
  - - [289, 192, 64, 768]
    - [122, 30.066]
  - - [1225, 32, 32, 192]
    - [75, 10.477]
  - - [1225, 48, 32, 192]
    - [75, 9.952]
  - - [1225, 64, 32, 192]
    - [75, 13.88]
  - - [1225, 48, 32, 256]
    - [75, 11.213]
  - - [1225, 64, 32, 256]
    - [178, 15.17]
  - - [1225, 48, 32, 288]
    - [75, 12.26]
  - - [1225, 64, 32, 288]
    - [182, 17.247]
  - - [5329, 80, 32, 64]
    - [75, 8.13]
  - - [289, 128, 32, 768]
    - [105, 20.526]
  - - [289, 160, 32, 768]
    - [183, 22.267]
  - - [289, 192, 32, 768]
    - [184, 28.242]
  - - [196, 256, 1, 2304]
    - [19, 4.806]
  - - [49, 512, 1, 4608]
    - [43, 2.987]
  - - [196, 1024, 128, 256]
    - [98, 25.454]
  - - [196, 1024, 256, 256]
    - [68, 25.809]
  - - [196, 256, 128, 1024]
    - [68, 38.352]
  - - [196, 256, 256, 1024]
    - [114, 43.522]
  - - [196, 512, 128, 1024]
    - [114, 44.171]
  - - [196, 512, 256, 1024]
    - [130, 45.746]
  - - [49, 2048, 128, 512]
    - [180, 18.323]
  - - [49, 2048, 256, 512]
    - [180, 18.804]
  - - [49, 512, 128, 2048]
    - [56, 23.628]
  - - [49, 512, 256, 2048]
    - [175, 24.915]
  - - [2048, 2048, 1, 1024]
    - [185, 36.165]
  - - [3072, 3072, 1, 1024]
    - [186, 48.154]
  - - [5120, 5120, 1, 1024]
    - [187, 54.779]
  - - [6144, 6144, 1, 1024]
    - [187, 57.99]
  - - [7168, 7168, 1, 1024]
    - [187, 58.917]
  - - [8192, 8192, 1, 1024]
    - [187, 61.044]
  - - [9216, 9216, 1, 1024]
    - [187, 60.938]
  - - [10240, 10240, 1, 1024]
    - [187, 59.935]
  - - [11264, 11264, 1, 1024]
    - [187, 61.074]
  - - [12288, 12288, 1, 1024]
    - [187, 61.47]
  - - [13312, 13312, 1, 1024]
    - [187, 62.241]
  - - [14336, 14336, 1, 1024]
    - [187, 62.252]
  - - [15360, 15360, 1, 1024]
    - [187, 62.776]
  - - [16384, 16384, 1, 1024]
    - [187, 63.008]
  - - [17408, 17408, 1, 1024]
    - [187, 62.748]
  - - [18432, 18432, 1, 1024]
    - [187, 63.094]
  - - [19456, 19456, 1, 1024]
    - [187, 62.86]
  - - [20480, 20480, 1, 1024]
    - [188, 63.466]
  - - [21504, 21504, 1, 1024]
    - [189, 64.479]
  - - [22528, 22528, 1, 1024]
    - [188, 63.675]
  - - [23552, 23552, 1, 1024]
    - [187, 63.617]
  - - [24576, 24576, 1, 1024]
    - [188, 63.815]
  - - [25600, 25600, 1, 1024]
    - [189, 63.581]
  - - [26624, 26624, 1, 1024]
    - [188, 64.289]
  - - [27648, 27648, 1, 1024]
    - [187, 65.221]
  - - [28672, 28672, 1, 1024]
    - [189, 64.057]
  - - [29696, 29696, 1, 1024]
    - [189, 65.533]
  - - [30720, 30720, 1, 1024]
    - [189, 64.721]
  - - [31744, 31744, 1, 1024]
    - [188, 63.834]
  - - [32768, 32768, 1, 1024]
    - [189, 65.123]
  - - [33792, 33792, 1, 1024]
    - [189, 64.463]
  - - [34816, 34816, 1, 1024]
    - [188, 65.163]
  - - [35840, 35840, 1, 1024]
    - [189, 64.794]
  - - [36864, 36864, 1, 1024]
    - [189, 65.878]
  - - [37888, 37888, 1, 1024]
    - [189, 65.32]
  - - [38912, 38912, 1, 1024]
    - [187, 64.196]
  - - [39936, 39936, 1, 1024]
    - [189, 65.548]
  - - [40960, 40960, 1, 1024]
    - [189, 65.027]
  - - [41984, 41984, 1, 1024]
    - [188, 65.606]
  - - [43008, 43008, 1, 1024]
    - [189, 65.032]
  - - [44032, 44032, 1, 1024]
    - [189, 65.998]
  - - [45056, 45056, 1, 1024]
    - [188, 65.791]
  - - [46080, 46080, 1, 1024]
    - [189, 65.236]
  - - [47104, 47104, 1, 1024]
    - [189, 66.097]
  - - [48128, 48128, 1, 1024]
    - [189, 65.779]
  - - [49152, 49152, 1, 1024]
    - [187, 65.866]
  - - [50176, 50176, 1, 1024]
    - [189, 65.891]
  - - [51200, 51200, 1, 1024]
    - [188, 65.953]
  - - [52224, 52224, 1, 1024]
    - [189, 66.194]
  - - [53248, 53248, 1, 1024]
    - [187, 65.555]
  - - [54272, 54272, 1, 1024]
    - [189, 65.964]
  - - [55296, 55296, 1, 1024]
    - [187, 65.911]
  - - [56320, 56320, 1, 1024]
    - [189, 65.975]
  - - [57344, 57344, 1, 1024]
    - [189, 65.978]
  - - [58368, 58368, 1, 1024]
    - [189, 66.117]
  - - [59392, 59392, 1, 1024]
    - [189, 66.229]
  - - [60416, 60416, 1, 1024]
    - [189, 66.202]
  - - [61440, 61440, 1, 1024]
    - [189, 66.082]
  - - [62464, 62464, 1, 1024]
    - [189, 65.898]
  - - [63488, 63488, 1, 1024]
    - [189, 65.967]
  - - [64512, 64512, 1, 1024]
    - [189, 66.216]
  - - [65536, 65536, 1, 1024]
    - [189, 66.315]
  - - [66560, 66560, 1, 1024]
    - [189, 66.121]
  - - [67584, 67584, 1, 1024]
    - [187, 66.137]
  - - [68608, 68608, 1, 1024]
    - [189, 66.213]
  - - [69632, 69632, 1, 1024]
    - [187, 66.187]
  - - [70656, 70656, 1, 1024]
    - [187, 66.12]
  - - [71680, 71680, 1, 1024]
    - [189, 66.322]
  - - [72704, 72704, 1, 1024]
    - [190, 65.411]
  - - [73728, 73728, 1, 1024]
    - [189, 66.335]
  - - [74752, 74752, 1, 1024]
    - [189, 66.236]
  - - [75776, 75776, 1, 1024]
    - [187, 66.273]
  - - [76800, 76800, 1, 1024]
    - [187, 66.157]
  - - [77824, 77824, 1, 1024]
    - [187, 66.244]
  - - [78848, 78848, 1, 1024]
    - [187, 66.304]
  - - [79872, 79872, 1, 1024]
    - [189, 66.376]
  - - [80896, 80896, 1, 1024]
    - [189, 65.985]
  - - [81920, 81920, 1, 1024]
    - [187, 66.353]
  - - [82944, 82944, 1, 1024]
    - [189, 66.227]
  - - [83968, 83968, 1, 1024]
    - [187, 66.017]
  - - [84992, 84992, 1, 1024]
    - [187, 66.122]
  - - [86016, 86016, 1, 1024]
    - [189, 66.377]
  - - [87040, 87040, 1, 1024]
    - [189, 66.392]
  - - [88064, 88064, 1, 1024]
    - [187, 66.296]
  - - [89088, 89088, 1, 1024]
    - [189, 66.296]
  - - [90112, 90112, 1, 1024]
    - [187, 66.359]
- null
