library/src/blas3/Tensile/Logic/asm_full/aldebaran_Cijk_Alik_Bljk_HBH.yaml
- {MinimumRequiredVersion: 4.31.0}
- aldebaran
- gfx90a
- [Device 0050, Device 0051, Device 0052, Device 0054, Device 0062, Device 7400, Device
    SolutionIndex: 0
    SolutionNameMin: Cijk_Alik_Bljk_HBH_MT16x16x128_MI16x16x16x1_SE_1LDSB0_AF0EM1_EPS0_GRVW8_LBSPP256_LPA16_LPB16_PGR2_PLR9_SU0_SUS256_SRVW0_TT1_16_WG16_4_1_WGM1
    SolutionIndex: 1
    SolutionNameMin: Cijk_Alik_Bljk_HBH_MT128x64x32_MI32x32x8x1_SE_1LDSB1_AF0EM8_EPS1_GRVW8_GSU1_GSUAMB_LBSPP128_LPA8_LPB8_LRVW8_PGR1_PLR5_SU0_SUS0_SRVW4_TT2_32_VAW2_WSGRA1_WSGRB1_WG64_4_1_WGM1
    SolutionIndex: 2
    SolutionNameMin: Cijk_Alik_Bljk_HBH_MT64x16x128_MI16x16x16x1_SE_1LDSB1_AF0EM8_EPS1_GRVW8_GSU1_GSUAMB_LBSPP256_LPA16_LPB16_LRVW8_PGR1_PLR9_SU0_SUS0_SRVW0_TT1_16_VAW2_WSGRA1_WSGRB1_WG64_4_1_WGM1
    SolutionIndex: 3
    SolutionNameMin: Cijk_Alik_Bljk_HBH_MT128x128x64_MI32x32x8x1_SE_1LDSB1_AF0EM8_EPS0_GRVW8_GSU1_GSUAMB_LBSPP128_LPA8_LPB8_LRVW8_PGR2_PLR9_SU0_SUS0_SRVW4_TT2_64_VAW2_WSGRA1_WSGRB1_WG64_4_1_WGM15
    SolutionIndex: 4
    SolutionNameMin: Cijk_Alik_Bljk_HBH_MT128x64x64_MI32x32x8x1_SE_1LDSB1_AF0EM8_EPS0_GRVW8_GSU1_GSUAMB_LBSPP128_LPA8_LPB8_LRVW8_PGR2_PLR9_SU32_SUS128_SRVW4_TT2_32_VAW2_WSGRA1_WSGRB1_WG64_4_1_WGM15
    SolutionIndex: 5
    SolutionNameMin: Cijk_Alik_Bljk_HBH_MT64x64x32_MI32x32x8x1_SE_1LDSB1_AF0EM8_EPS0_GRVW8_GSU1_GSUAMB_LBSPP128_LPA8_LPB8_LRVW8_PGR2_PLR5_SU0_SUS0_SRVW4_TT1_32_VAW2_WSGRA1_WSGRB1_WG64_4_1_WGM1
    SolutionIndex: 6
    SolutionNameMin: Cijk_Alik_Bljk_HBH_MT64x128x64_MI32x32x8x1_SE_1LDSB1_AF0EM8_EPS0_GRVW8_GSU1_GSUAMB_LBSPP128_LPA8_LPB8_LRVW8_PGR2_PLR9_SU0_SUS0_SRVW4_TT1_64_VAW2_WSGRA1_WSGRB1_WG64_4_1_WGM15
    SolutionIndex: 7
    SolutionNameMin: Cijk_Alik_Bljk_HBH_MT64x16x128_MI16x16x16x1_SE_1LDSB0_AF0EM1_EPS0_GRVW8_GSU1_GSUAMB_LBSPP256_LPA16_LPB16_LRVW8_PGR2_PLR9_SU0_SUS0_SRVW0_TT1_16_VAW2_WSGRA1_WSGRB1_WG64_4_1_WGM2
    SolutionIndex: 8
    SolutionNameMin: Cijk_Alik_Bljk_HBH_MT64x64x32_MI32x32x8x1_SE_1LDSB1_AF0EM8_EPS0_GRVW8_GSU1_GSUAMB_LBSPP128_LPA8_LPB8_LRVW8_PGR2_PLR5_SU32_SUS128_SRVW4_TT1_32_VAW2_WSGRA1_WSGRB1_WG64_4_1_WGM1
    SolutionIndex: 9
    SolutionNameMin: Cijk_Alik_Bljk_HBH_MT128x96x64_MI32x32x8x1_SE_1LDSB1_AF0EM8_EPS0_GRVW8_GSU1_GSUAMB_LBSPP128_LPA8_LPB8_LRVW8_PGR2_PLR9_SU0_SUS0_SRVW4_TT1_96_VAW2_WSGRA1_WSGRB1_WG128_2_1_WGM15
    SolutionIndex: 10
    SolutionNameMin: Cijk_Alik_Bljk_HBH_MT16x16x128_MI16x16x16x1_SE_1LDSB1_AF0EM1_EPS1_GRVW8_GSU1_GSUAMB_LBSPP256_LPA16_LPB16_LRVW8_PGR1_PLR9_SU0_SUS0_SRVW0_TT1_16_VAW2_WSGRA1_WSGRB1_WG16_4_1_WGM1
    SolutionIndex: 11
    SolutionNameMin: Cijk_Alik_Bljk_HBH_MT64x16x32_MI16x16x16x1_SE_1LDSB1_AF0EM1_EPS1_GRVW8_GSU1_GSUAMB_LBSPP128_LPA16_LPB16_LRVW8_PGR1_PLR2_SU0_SUS0_SRVW0_TT1_16_VAW2_WSGRA1_WSGRB1_WG64_4_1_WGM1
    SolutionIndex: 12
    SolutionNameMin: Cijk_Alik_Bljk_HBH_MT16x16x32_MI16x16x16x1_SE_1LDSB1_AF0EM1_EPS0_GRVW8_GSU1_GSUAMB_LBSPP128_LPA16_LPB16_LRVW8_PGR2_PLR2_SU0_SUS0_SRVW0_TT1_16_VAW2_WSGRA1_WSGRB1_WG16_4_1_WGM1
    SolutionIndex: 13
    SolutionNameMin: Cijk_Alik_Bljk_HBH_MT128x96x64_MI32x32x8x1_SE_1LDSB1_AF0EM8_EPS0_GRVW8_GSU1_GSUAMB_LBSPP128_LPA8_LPB8_LRVW8_PGR2_PLR9_SU0_SUS0_SRVW4_TT1_96_VAW2_WSGRA1_WSGRB1_WG128_2_1_WGM2
    SolutionIndex: 14
    SolutionNameMin: Cijk_Alik_Bljk_HBH_MT32x64x64_MI16x16x16x1_SE_1LDSB1_AF0EM8_EPS1_GRVW8_GSU1_GSUAMB_LBSPP128_LPA16_LPB16_LRVW8_PGR1_PLR5_SU0_SUS0_SRVW4_TT1_32_VAW2_WSGRA1_WSGRB1_WG32_8_1_WGM2
    SolutionIndex: 15
    SolutionNameMin: Cijk_Alik_Bljk_HBH_MT128x96x64_MI32x32x8x1_SE_1LDSB1_AF0EM8_EPS0_GRVW8_GSU1_GSUAMB_LBSPP128_LPA8_LPB8_LRVW8_PGR2_PLR9_SU0_SUS0_SRVW4_TT1_96_VAW2_WSGRA1_WSGRB1_WG128_2_1_WGM1
    SolutionIndex: 16
    SolutionNameMin: Cijk_Alik_Bljk_HBH_MT64x64x64_MI32x32x8x1_SE_1LDSB0_AF0EM8_EPS0_GRVW8_GSU1_GSUAMB_LBSPP128_LPA8_LPB8_LRVW8_PGR2_PLR9_SU0_SUS0_SRVW4_TT1_32_VAW2_WSGRA1_WSGRB1_WG64_4_1_WGM2
    SolutionIndex: 17
    SolutionNameMin: Cijk_Alik_Bljk_HBH_MT16x64x128_MI16x16x16x1_SE_1LDSB0_AF0EM1_EPS0_GRVW8_GSU1_GSUAMB_LBSPP256_LPA16_LPB16_LRVW8_PGR2_PLR9_SU0_SUS0_SRVW0_TT1_16_VAW2_WSGRA1_WSGRB1_WG16_16_1_WGM1
    SolutionIndex: 18
    SolutionNameMin: Cijk_Alik_Bljk_HBH_MT16x64x32_MI16x16x16x1_SE_1LDSB1_AF0EM8_EPS0_GRVW8_GSU1_GSUAMB_LBSPP128_LPA16_LPB16_LRVW8_PGR2_PLR2_SU0_SUS0_SRVW0_TT1_16_VAW2_WSGRA1_WSGRB1_WG16_16_1_WGM1
    SolutionIndex: 19
    SolutionNameMin: Cijk_Alik_Bljk_HBH_MT16x64x128_MI16x16x16x1_SE_1LDSB0_AF0EM8_EPS0_GRVW8_GSU1_GSUAMB_LBSPP256_LPA16_LPB16_LRVW8_PGR2_PLR9_SU0_SUS0_SRVW0_TT1_16_VAW2_WSGRA1_WSGRB1_WG16_16_1_WGM2
    SolutionIndex: 20
    SolutionNameMin: Cijk_Alik_Bljk_HBH_MT16x16x128_MI16x16x16x1_SE_1LDSB0_AF0EM1_EPS0_GRVW8_GSU1_GSUAMB_LBSPP256_LPA16_LPB16_LRVW8_PGR2_PLR9_SU0_SUS0_SRVW0_TT1_16_VAW2_WSGRA1_WSGRB1_WG16_4_1_WGM1
    SolutionIndex: 21
    SolutionNameMin: Cijk_Alik_Bljk_HBH_MT128x96x64_MI32x32x8x1_SE_1LDSB1_AF0EM8_EPS0_GRVW8_GSU1_GSUAMB_LBSPP128_LPA8_LPB8_LRVW8_PGR2_PLR9_SU32_SUS128_SRVW4_TT1_96_VAW2_WSGRA1_WSGRB1_WG128_2_1_WGM15
    SolutionIndex: 22
    SolutionNameMin: Cijk_Alik_Bljk_HBH_MT16x16x128_MI16x16x16x1_SE_1LDSB0_AF0EM8_EPS0_GRVW8_GSU1_GSUAMB_LBSPP256_LPA16_LPB16_LRVW8_PGR2_PLR9_SU0_SUS0_SRVW0_TT1_16_VAW2_WSGRA1_WSGRB1_WG16_4_1_WGM15
    SolutionIndex: 23
    SolutionNameMin: Cijk_Alik_Bljk_HBH_MT64x16x128_MI16x16x16x1_SE_1LDSB0_AF0EM1_EPS0_GRVW8_GSU1_GSUAMB_LBSPP256_LPA16_LPB16_LRVW8_PGR2_PLR9_SU0_SUS0_SRVW0_TT1_16_VAW2_WSGRA1_WSGRB1_WG64_4_1_WGM1
    SolutionIndex: 24
    SolutionNameMin: Cijk_Alik_Bljk_HBH_MT16x64x128_MI16x16x16x1_SE_1LDSB0_AF0EM1_EPS1_GRVW8_GSU1_GSUAMB_LBSPP256_LPA16_LPB16_LRVW8_PGR1_PLR9_SU0_SUS0_SRVW0_TT1_16_VAW2_WSGRA1_WSGRB1_WG16_16_1_WGM1
    SolutionIndex: 25
    SolutionNameMin: Cijk_Alik_Bljk_HBH_MT64x64x64_MI32x32x8x1_SE_1LDSB0_AF0EM8_EPS0_GRVW8_GSU1_GSUAMB_LBSPP128_LPA8_LPB8_LRVW8_PGR2_PLR9_SU0_SUS0_SRVW4_TT1_32_VAW2_WSGRA1_WSGRB1_WG64_4_1_WGM1
    SolutionIndex: 26
    SolutionNameMin: Cijk_Alik_Bljk_HBH_MT16x16x128_MI16x16x16x1_SE_1LDSB0_AF0EM1_EPS0_GRVW8_GSU1_GSUAMB_LBSPP256_LPA16_LPB16_LRVW8_PGR2_PLR9_SU0_SUS0_SRVW0_TT1_16_VAW2_WSGRA1_WSGRB1_WG16_4_1_WGM15
    SolutionIndex: 27
    SolutionNameMin: Cijk_Alik_Bljk_HBH_MT64x32x64_MI16x16x16x1_SE_1LDSB1_AF0EM8_EPS1_GRVW8_GSU1_GSUAMB_LBSPP128_LPA16_LPB16_LRVW8_PGR1_PLR5_SU0_SUS0_SRVW4_TT2_16_VAW2_WSGRA1_WSGRB1_WG32_8_1_WGM1
    SolutionIndex: 28
    SolutionNameMin: Cijk_Alik_Bljk_HBH_MT128x128x32_MI32x32x8x1_SE_1LDSB1_AF0EM8_EPS1_GRVW8_GSU1_GSUAMB_LBSPP128_LPA8_LPB8_LRVW8_PGR1_PLR5_SU32_SUS256_SRVW4_TT2_64_VAW2_WSGRA1_WSGRB1_WG64_4_1_WGM1
    SolutionIndex: 29
    SolutionNameMin: Cijk_Alik_Bljk_HBH_MT128x64x64_MI32x32x8x1_SE_1LDSB1_AF0EM8_EPS0_GRVW8_GSU1_GSUAMB_LBSPP128_LPA8_LPB8_LRVW8_PGR2_PLR9_SU0_SUS0_SRVW4_TT2_32_VAW2_WSGRA1_WSGRB1_WG64_4_1_WGM1
    SolutionIndex: 30
    SolutionNameMin: Cijk_Alik_Bljk_HBH_MT16x16x128_MI16x16x16x1_SE_1LDSB0_AF0EM1_EPS0_GRVW8_GSU1_GSUAMB_LBSPP256_LPA16_LPB16_LRVW8_PGR2_PLR9_SU0_SUS0_SRVW0_TT1_16_VAW2_WSGRA1_WSGRB1_WG16_4_1_WGM2
    SolutionIndex: 31
    SolutionNameMin: Cijk_Alik_Bljk_HBH_MT64x32x32_MI16x16x16x1_SE_1LDSB1_AF0EM8_EPS1_GRVW2_GSU1_GSUAMB_LBSPP128_LPA16_LPB16_LRVW8_PGR1_PLR2_SU0_SUS0_SRVW4_TT2_16_VAW2_WSGRA1_WSGRB1_WG32_8_1_WGM2
    SolutionIndex: 32
    SolutionNameMin: Cijk_Alik_Bljk_HBH_MT64x64x64_MI32x32x8x1_SE_1LDSB1_AF0EM1_EPS1_GRVW8_GSU1_GSUAMB_LBSPP128_LPA8_LPB8_LRVW8_PGR1_PLR9_SU32_SUS128_SRVW4_TT1_32_VAW2_WSGRA1_WSGRB1_WG64_4_1_WGM1
    SolutionIndex: 33
    SolutionNameMin: Cijk_Alik_Bljk_HBH_MT128x64x64_MI32x32x8x1_SE_1LDSB1_AF0EM8_EPS0_GRVW8_GSU1_GSUAMB_LBSPP128_LPA8_LPB8_LRVW8_PGR2_PLR9_SU0_SUS0_SRVW4_TT2_32_VAW2_WSGRA1_WSGRB1_WG64_4_1_WGM15
    SolutionIndex: 34
    SolutionNameMin: Cijk_Alik_Bljk_HBH_MT64x64x64_MI32x32x8x1_SE_1LDSB1_AF0EM8_EPS1_GRVW8_GSU1_GSUAMB_LBSPP128_LPA8_LPB8_LRVW8_PGR1_PLR9_SU0_SUS0_SRVW4_TT1_32_VAW2_WSGRA1_WSGRB1_WG64_4_1_WGM1
    SolutionIndex: 35
    SolutionNameMin: Cijk_Alik_Bljk_HBH_MT128x96x32_MI32x32x8x1_SE_1LDSB1_AF0EM8_EPS1_GRVW4_GSU1_GSUAMB_LBSPP128_LPA8_LPB8_LRVW8_PGR1_PLR5_SU0_SUS0_SRVW4_TT1_96_VAW2_WSGRA1_WSGRB1_WG128_2_1_WGM2
    SolutionIndex: 36
    SolutionNameMin: Cijk_Alik_Bljk_HBH_MT96x128x64_MI32x32x8x1_SE_1LDSB1_AF0EM8_EPS0_GRVW8_GSU1_GSUAMB_LBSPP128_LPA8_LPB8_LRVW8_PGR2_PLR9_SU0_SUS0_SRVW0_TT3_32_VAW2_WSGRA1_WSGRB1_WG32_8_1_WGM2
    SolutionIndex: 37
    SolutionNameMin: Cijk_Alik_Bljk_HBH_MT64x16x128_MI16x16x16x1_SE_1LDSB0_AF0EM8_EPS0_GRVW8_GSU1_GSUAMB_LBSPP256_LPA16_LPB16_LRVW8_PGR2_PLR9_SU0_SUS0_SRVW0_TT1_16_VAW2_WSGRA1_WSGRB1_WG64_4_1_WGM2
    SolutionIndex: 38
    SolutionNameMin: Cijk_Alik_Bljk_HBH_MT128x64x64_MI32x32x8x1_SE_1LDSB0_AF0EM8_EPS0_GRVW8_GSU1_GSUAMB_LBSPP128_LPA8_LPB8_LRVW8_PGR2_PLR9_SU0_SUS0_SRVW4_TT2_32_VAW2_WSGRA1_WSGRB1_WG64_4_1_WGM1
    SolutionIndex: 39
    SolutionNameMin: Cijk_Alik_Bljk_HBH_MT128x96x32_MI32x32x8x1_SE_1LDSB1_AF0EM8_EPS1_GRVW4_GSU1_GSUAMB_LBSPP128_LPA8_LPB8_LRVW8_PGR1_PLR5_SU32_SUS128_SRVW4_TT1_96_VAW2_WSGRA1_WSGRB1_WG128_2_1_WGM1
    SolutionIndex: 40
    SolutionNameMin: Cijk_Alik_Bljk_HBH_MT64x16x128_MI16x16x16x1_SE_1LDSB0_AF0EM1_EPS0_GRVW8_GSU1_GSUAMB_LBSPP256_LPA16_LPB16_LRVW8_PGR2_PLR9_SU32_SUS256_SRVW0_TT1_16_VAW2_WSGRA1_WSGRB1_WG64_4_1_WGM1
    SolutionIndex: 41
    SolutionNameMin: Cijk_Alik_Bljk_HBH_MT64x64x32_MI32x32x8x1_SE_1LDSB1_AF0EM8_EPS1_GRVW2_GSU1_GSUAMB_LBSPP128_LPA8_LPB8_LRVW8_PGR1_PLR5_SU32_SUS128_SRVW4_TT1_32_VAW2_WSGRA1_WSGRB1_WG64_4_1_WGM1
    SolutionIndex: 42
    SolutionNameMin: Cijk_Alik_Bljk_HBH_MT32x64x64_MI16x16x16x1_SE_1LDSB1_AF0EM1_EPS1_GRVW8_GSU1_GSUAMB_LBSPP128_LPA16_LPB16_LRVW8_PGR1_PLR5_SU32_SUS128_SRVW4_TT1_32_VAW2_WSGRA1_WSGRB1_WG32_8_1_WGM1
    SolutionIndex: 43
    SolutionNameMin: Cijk_Alik_Bljk_HBH_MT128x64x64_MI32x32x8x1_SE_1LDSB1_AF0EM8_EPS0_GRVW8_GSU1_GSUAMB_LBSPP128_LPA8_LPB8_LRVW8_PGR2_PLR9_SU0_SUS0_SRVW4_TT2_32_VAW2_WSGRA1_WSGRB1_WG64_4_1_WGM2
    SolutionIndex: 44
    SolutionNameMin: Cijk_Alik_Bljk_HBH_MT64x32x32_MI16x16x16x1_SE_1LDSB0_AF0EM8_EPS1_GRVW4_GSU1_GSUAMB_LBSPP128_LPA16_LPB16_LRVW8_PGR1_PLR2_SU0_SUS0_SRVW4_TT2_16_VAW2_WSGRA1_WSGRB1_WG32_8_1_WGM1
    SolutionIndex: 45
    SolutionNameMin: Cijk_Alik_Bljk_HBH_MT64x128x64_MI32x32x8x1_SE_1LDSB1_AF0EM8_EPS0_GRVW8_GSU1_GSUAMB_LBSPP128_LPA8_LPB8_LRVW8_PGR2_PLR9_SU0_SUS0_SRVW4_TT1_64_VAW2_WSGRA1_WSGRB1_WG64_4_1_WGM1
    SolutionIndex: 46
    SolutionNameMin: Cijk_Alik_Bljk_HBH_MT128x96x64_MI32x32x8x1_SE_1LDSB1_AF0EM8_EPS1_GRVW8_GSU1_GSUAMB_LBSPP128_LPA8_LPB8_LRVW8_PGR1_PLR9_SU32_SUS128_SRVW4_TT1_96_VAW2_WSGRA1_WSGRB1_WG128_2_1_WGM1
    SolutionIndex: 47
    SolutionNameMin: Cijk_Alik_Bljk_HBH_MT16x16x32_MI16x16x16x1_SE_1LDSB0_AF0EM8_EPS1_GRVW4_GSU1_GSUAMB_LBSPP128_LPA16_LPB16_LRVW8_PGR1_PLR2_SU0_SUS0_SRVW0_TT1_16_VAW2_WSGRA1_WSGRB1_WG16_4_1_WGM1
    SolutionIndex: 48
    SolutionNameMin: Cijk_Alik_Bljk_HBH_MT64x32x32_MI16x16x16x1_SE_1LDSB0_AF0EM8_EPS1_GRVW8_GSU1_GSUAMB_LBSPP128_LPA16_LPB16_LRVW8_PGR1_PLR2_SU0_SUS0_SRVW4_TT2_16_VAW2_WSGRA1_WSGRB1_WG32_8_1_WGM1
    SolutionIndex: 49
    SolutionNameMin: Cijk_Alik_Bljk_HBH_MT128x128x32_MI32x32x8x1_SE_1LDSB1_AF0EM8_EPS1_GRVW8_GSU1_GSUAMB_LBSPP128_LPA8_LPB8_LRVW8_PGR1_PLR5_SU0_SUS0_SRVW4_TT2_64_VAW2_WSGRA1_WSGRB1_WG64_4_1_WGM1
    SolutionIndex: 50
    SolutionNameMin: Cijk_Alik_Bljk_HBH_MT64x64x64_MI32x32x8x1_SE_1LDSB1_AF0EM8_EPS1_GRVW8_GSU1_GSUAMB_LBSPP128_LPA8_LPB8_LRVW8_PGR1_PLR9_SU32_SUS256_SRVW4_TT1_32_VAW2_WSGRA1_WSGRB1_WG64_4_1_WGM2
    SolutionIndex: 51
    SolutionNameMin: Cijk_Alik_Bljk_HBH_MT64x64x32_MI32x32x8x1_SE_1LDSB1_AF0EM8_EPS1_GRVW8_GSU1_GSUAMB_LBSPP128_LPA8_LPB8_LRVW8_PGR1_PLR5_SU0_SUS0_SRVW4_TT1_32_VAW2_WSGRA1_WSGRB1_WG64_4_1_WGM1
    SolutionIndex: 52
    SolutionNameMin: Cijk_Alik_Bljk_HBH_MT64x32x64_MI16x16x16x1_SE_1LDSB0_AF0EM8_EPS0_GRVW8_GSU1_GSUAMB_LBSPP128_LPA16_LPB16_LRVW8_PGR2_PLR5_SU32_SUS128_SRVW4_TT2_16_VAW2_WSGRA1_WSGRB1_WG32_8_1_WGM1
    SolutionIndex: 53
    SolutionNameMin: Cijk_Alik_Bljk_HBH_MT128x128x64_MI32x32x8x1_SE_1LDSB1_AF0EM8_EPS0_GRVW8_GSU1_GSUAMB_LBSPP128_LPA8_LPB8_LRVW8_PGR2_PLR9_SU0_SUS0_SRVW4_TT2_64_VAW2_WSGRA1_WSGRB1_WG64_4_1_WGM2
    SolutionIndex: 54
    SolutionNameMin: Cijk_Alik_Bljk_HBH_MT128x160x64_MI32x32x8x1_SE_1LDSB1_AF0EM8_EPS0_GRVW4_GSU1_GSUAMB_LBSPP128_LPA8_LPB8_LRVW8_PGR2_PLR9_SU0_SUS0_SRVW4_TT1_160_VAW2_WSGRA1_WSGRB1_WG128_2_1_WGM2
    SolutionIndex: 55
    SolutionNameMin: Cijk_Alik_Bljk_HBH_MT16x16x128_MI16x16x16x1_SE_1LDSB1_AF0EM1_EPS1_GRVW8_GSU1_GSUAMB_LBSPP256_LPA16_LPB16_LRVW8_PGR1_PLR9_SU0_SUS0_SRVW0_TT1_16_VAW2_WSGRA1_WSGRB1_WG16_4_1_WGM15
    SolutionIndex: 56
    SolutionNameMin: Cijk_Alik_Bljk_HBH_MT32x32x32_MI16x16x16x1_SE_1LDSB1_AF0EM8_EPS1_GRVW4_GSU1_GSUAMB_LBSPP128_LPA16_LPB16_LRVW8_PGR1_PLR2_SU0_SUS0_SRVW4_TT1_16_VAW2_WSGRA1_WSGRB1_WG32_8_1_WGM2
    SolutionIndex: 57
    SolutionNameMin: Cijk_Alik_Bljk_HBH_MT128x128x32_MI32x32x8x1_SE_1LDSB1_AF0EM8_EPS1_GRVW8_GSU1_GSUAMB_LBSPP128_LPA8_LPB8_LRVW8_PGR1_PLR5_SU0_SUS0_SRVW4_TT2_64_VAW2_WSGRA1_WSGRB1_WG64_4_1_WGM2
    SolutionIndex: 58
    SolutionNameMin: Cijk_Alik_Bljk_HBH_MT32x64x32_MI16x16x16x1_SE_1LDSB0_AF0EM8_EPS1_GRVW4_GSU1_GSUAMB_LBSPP128_LPA16_LPB16_LRVW8_PGR1_PLR2_SU0_SUS0_SRVW4_TT1_32_VAW2_WSGRA1_WSGRB1_WG32_8_1_WGM1
    SolutionIndex: 59
    SolutionNameMin: Cijk_Alik_Bljk_HBH_MT64x32x64_MI16x16x16x1_SE_1LDSB0_AF0EM8_EPS0_GRVW8_GSU1_GSUAMB_LBSPP128_LPA16_LPB16_LRVW8_PGR2_PLR5_SU0_SUS0_SRVW4_TT2_16_VAW2_WSGRA1_WSGRB1_WG32_8_1_WGM15
    SolutionIndex: 60
    SolutionNameMin: Cijk_Alik_Bljk_HBH_MT16x16x128_MI16x16x16x1_SE_1LDSB1_AF0EM8_EPS1_GRVW8_GSU1_GSUAMB_LBSPP256_LPA16_LPB16_LRVW8_PGR1_PLR9_SU0_SUS0_SRVW0_TT1_16_VAW2_WSGRA1_WSGRB1_WG16_4_1_WGM2
    SolutionIndex: 61
    SolutionNameMin: Cijk_Alik_Bljk_HBH_MT64x64x64_MI32x32x8x1_SE_1LDSB0_AF0EM8_EPS0_GRVW8_GSU1_GSUAMB_LBSPP128_LPA8_LPB8_LRVW8_PGR2_PLR9_SU0_SUS0_SRVW4_TT1_32_VAW2_WSGRA1_WSGRB1_WG64_4_1_WGM15
    SolutionIndex: 62
    SolutionNameMin: Cijk_Alik_Bljk_HBH_MT64x128x32_MI32x32x8x1_SE_1LDSB1_AF0EM8_EPS1_GRVW8_GSU1_GSUAMB_LBSPP128_LPA8_LPB8_LRVW8_PGR1_PLR5_SU0_SUS0_SRVW4_TT1_64_VAW2_WSGRA1_WSGRB1_WG64_4_1_WGM2
    SolutionIndex: 63
    SolutionNameMin: Cijk_Alik_Bljk_HBH_MT64x64x32_MI32x32x8x1_SE_1LDSB1_AF0EM8_EPS1_GRVW8_GSU1_GSUAMB_LBSPP128_LPA8_LPB8_LRVW8_PGR1_PLR5_SU32_SUS128_SRVW4_TT1_32_VAW2_WSGRA1_WSGRB1_WG64_4_1_WGM1
    SolutionIndex: 64
    SolutionNameMin: Cijk_Alik_Bljk_HBH_MT64x128x64_MI32x32x8x1_SE_1LDSB0_AF0EM8_EPS0_GRVW8_GSU1_GSUAMB_LBSPP128_LPA8_LPB8_LRVW8_PGR2_PLR9_SU32_SUS128_SRVW4_TT1_64_VAW2_WSGRA1_WSGRB1_WG64_4_1_WGM1
    SolutionIndex: 65
    SolutionNameMin: Cijk_Alik_Bljk_HBH_MT128x64x64_MI32x32x8x1_SE_1LDSB0_AF0EM8_EPS0_GRVW8_GSU1_GSUAMB_LBSPP128_LPA8_LPB8_LRVW8_PGR2_PLR9_SU0_SUS0_SRVW4_TT2_32_VAW2_WSGRA1_WSGRB1_WG64_4_1_WGM15
    SolutionIndex: 66
    SolutionNameMin: Cijk_Alik_Bljk_HBH_MT16x64x32_MI16x16x16x1_SE_1LDSB0_AF0EM1_EPS1_GRVW2_GSU1_GSUAMB_LBSPP128_LPA16_LPB16_LRVW8_PGR1_PLR2_SU0_SUS0_SRVW0_TT1_16_VAW2_WSGRA1_WSGRB1_WG16_16_1_WGM1
    SolutionIndex: 67
    SolutionNameMin: Cijk_Alik_Bljk_HBH_MT128x96x32_MI32x32x8x1_SE_1LDSB1_AF0EM8_EPS1_GRVW2_GSU1_GSUAMB_LBSPP128_LPA8_LPB8_LRVW8_PGR1_PLR5_SU32_SUS256_SRVW4_TT1_96_VAW2_WSGRA1_WSGRB1_WG128_2_1_WGM2
    SolutionIndex: 68
    SolutionNameMin: Cijk_Alik_Bljk_HBH_MT64x64x64_MI32x32x8x1_SE_1LDSB0_AF0EM8_EPS0_GRVW8_GSU1_GSUAMB_LBSPP128_LPA8_LPB8_LRVW8_PGR2_PLR9_SU32_SUS128_SRVW4_TT1_32_VAW2_WSGRA1_WSGRB1_WG64_4_1_WGM15
    SolutionIndex: 69
    SolutionNameMin: Cijk_Alik_Bljk_HBH_MT128x256x32_MI32x32x8x1_SE_1LDSB1_AF0EM8_EPS1_GRVW4_GSU1_GSUAMB_LBSPP128_LPA8_LPB8_LRVW8_PGR1_PLR5_SU0_SUS0_SRVW4_TT2_128_VAW2_WSGRA1_WSGRB1_WG64_4_1_WGM1
    SolutionIndex: 70
    SolutionNameMin: Cijk_Alik_Bljk_HBH_MT128x160x32_MI32x32x8x1_SE_1LDSB1_AF0EM8_EPS1_GRVW4_GSU1_GSUAMB_LBSPP128_LPA8_LPB8_LRVW8_PGR1_PLR5_SU0_SUS0_SRVW4_TT1_160_VAW2_WSGRA1_WSGRB1_WG128_2_1_WGM15
    SolutionIndex: 71
    SolutionNameMin: Cijk_Alik_Bljk_HBH_MT64x32x64_MI16x16x16x1_SE_1LDSB0_AF0EM8_EPS1_GRVW8_GSU1_GSUAMB_LBSPP128_LPA16_LPB16_LRVW8_PGR1_PLR5_SU0_SUS0_SRVW4_TT2_16_VAW2_WSGRA1_WSGRB1_WG32_8_1_WGM2
    SolutionIndex: 72
    SolutionNameMin: Cijk_Alik_Bljk_HBH_MT64x128x64_MI32x32x8x1_SE_1LDSB1_AF0EM8_EPS0_GRVW8_GSU1_GSUAMB_LBSPP128_LPA8_LPB8_LRVW8_PGR2_PLR9_SU32_SUS128_SRVW4_TT1_64_VAW2_WSGRA1_WSGRB1_WG64_4_1_WGM1
    SolutionIndex: 73
    SolutionNameMin: Cijk_Alik_Bljk_HBH_MT128x160x64_MI32x32x8x1_SE_1LDSB1_AF0EM8_EPS0_GRVW8_GSU1_GSUAMB_LBSPP128_LPA8_LPB8_LRVW8_PGR2_PLR9_SU32_SUS128_SRVW4_TT1_160_VAW2_WSGRA1_WSGRB1_WG128_2_1_WGM15
    SolutionIndex: 74
    SolutionNameMin: Cijk_Alik_Bljk_HBH_MT32x32x64_MI16x16x16x1_SE_1LDSB0_AF0EM1_EPS1_GRVW8_GSU1_GSUAMB_LBSPP128_LPA16_LPB16_LRVW8_PGR1_PLR5_SU0_SUS0_SRVW4_TT1_16_VAW2_WSGRA1_WSGRB1_WG32_8_1_WGM1
    SolutionIndex: 75
    SolutionNameMin: Cijk_Alik_Bljk_HBH_MT64x128x64_MI32x32x8x1_SE_1LDSB1_AF0EM8_EPS1_GRVW8_GSU1_GSUAMB_LBSPP128_LPA8_LPB8_LRVW8_PGR1_PLR9_SU32_SUS256_SRVW4_TT1_64_VAW2_WSGRA1_WSGRB1_WG64_4_1_WGM15
    SolutionIndex: 76
    SolutionNameMin: Cijk_Alik_Bljk_HBH_MT16x16x32_MI16x16x16x1_SE_1LDSB1_AF0EM1_EPS1_GRVW8_GSU1_GSUAMB_LBSPP128_LPA16_LPB16_LRVW8_PGR1_PLR2_SU0_SUS0_SRVW0_TT1_16_VAW2_WSGRA1_WSGRB1_WG16_4_1_WGM1
    SolutionIndex: 77
    SolutionNameMin: Cijk_Alik_Bljk_HBH_MT128x64x64_MI32x32x8x1_SE_1LDSB1_AF0EM8_EPS1_GRVW8_GSU1_GSUAMB_LBSPP128_LPA8_LPB8_LRVW8_PGR1_PLR9_SU32_SUS128_SRVW4_TT2_32_VAW2_WSGRA1_WSGRB1_WG64_4_1_WGM1
    SolutionIndex: 78
    SolutionNameMin: Cijk_Alik_Bljk_HBH_MT16x16x128_MI16x16x16x1_SE_1LDSB0_AF0EM8_EPS0_GRVW8_GSU1_GSUAMB_LBSPP256_LPA16_LPB16_LRVW8_PGR2_PLR9_SU0_SUS0_SRVW0_TT1_16_VAW2_WSGRA1_WSGRB1_WG16_4_1_WGM2
    SolutionIndex: 79
    SolutionNameMin: Cijk_Alik_Bljk_HBH_MT16x64x128_MI16x16x16x1_SE_1LDSB0_AF0EM8_EPS0_GRVW8_GSU1_GSUAMB_LBSPP256_LPA16_LPB16_LRVW8_PGR2_PLR9_SU0_SUS0_SRVW4_TT1_16_VAW2_WSGRA1_WSGRB1_WG16_16_1_WGM1
    SolutionIndex: 80
    SolutionNameMin: Cijk_Alik_Bljk_HBH_MT16x16x128_MI16x16x16x1_SE_1LDSB0_AF0EM8_EPS0_GRVW8_GSU1_GSUAMB_LBSPP256_LPA16_LPB16_LRVW8_PGR2_PLR9_SU32_SUS256_SRVW0_TT1_16_VAW2_WSGRA1_WSGRB1_WG16_4_1_WGM1
    SolutionIndex: 81
    SolutionNameMin: Cijk_Alik_Bljk_HBH_MT16x64x128_MI16x16x16x1_SE_1LDSB0_AF0EM8_EPS0_GRVW8_GSU1_GSUAMB_LBSPP256_LPA16_LPB16_LRVW8_PGR2_PLR9_SU0_SUS0_SRVW0_TT1_16_VAW2_WSGRA1_WSGRB1_WG16_16_1_WGM1
    SolutionIndex: 82
    SolutionNameMin: Cijk_Alik_Bljk_HBH_MT64x32x32_MI16x16x16x1_SE_1LDSB1_AF0EM8_EPS1_GRVW8_GSU1_GSUAMB_LBSPP128_LPA16_LPB16_LRVW8_PGR1_PLR2_SU0_SUS0_SRVW4_TT2_16_VAW2_WSGRA1_WSGRB1_WG32_8_1_WGM15
    SolutionIndex: 83
    SolutionNameMin: Cijk_Alik_Bljk_HBH_MT16x64x128_MI16x16x16x1_SE_1LDSB0_AF0EM8_EPS1_GRVW8_GSU1_GSUAMB_LBSPP256_LPA16_LPB16_LRVW8_PGR1_PLR9_SU0_SUS0_SRVW0_TT1_16_VAW2_WSGRA1_WSGRB1_WG16_16_1_WGM2
    SolutionIndex: 84
    SolutionNameMin: Cijk_Alik_Bljk_HBH_MT16x64x32_MI16x16x16x1_SE_1LDSB0_AF0EM8_EPS0_GRVW4_GSU1_GSUAMB_LBSPP128_LPA16_LPB16_LRVW8_PGR2_PLR2_SU0_SUS0_SRVW0_TT1_16_VAW2_WSGRA1_WSGRB1_WG16_16_1_WGM2
    SolutionIndex: 85
    SolutionNameMin: Cijk_Alik_Bljk_HBH_MT16x64x32_MI16x16x16x1_SE_1LDSB0_AF0EM8_EPS0_GRVW4_GSU1_GSUAMB_LBSPP128_LPA16_LPB16_LRVW8_PGR2_PLR2_SU0_SUS0_SRVW0_TT1_16_VAW2_WSGRA1_WSGRB1_WG16_16_1_WGM1
    SolutionIndex: 86
    SolutionNameMin: Cijk_Alik_Bljk_HBH_MT16x16x32_MI16x16x16x1_SE_1LDSB0_AF0EM1_EPS0_GRVW8_GSU1_GSUAMB_LBSPP128_LPA16_LPB16_LRVW8_PGR2_PLR2_SU0_SUS0_SRVW0_TT1_16_VAW2_WSGRA1_WSGRB1_WG16_4_1_WGM15
    SolutionIndex: 87
    SolutionNameMin: Cijk_Alik_Bljk_HBH_MT64x64x32_MI32x32x8x1_SE_1LDSB0_AF0EM8_EPS0_GRVW8_GSU1_GSUAMB_LBSPP128_LPA8_LPB8_LRVW8_PGR2_PLR5_SU0_SUS0_SRVW4_TT1_32_VAW2_WSGRA1_WSGRB1_WG64_4_1_WGM15
    SolutionIndex: 88
    SolutionNameMin: Cijk_Alik_Bljk_HBH_MT32x64x64_MI16x16x16x1_SE_1LDSB0_AF0EM8_EPS0_GRVW8_GSU1_GSUAMB_LBSPP128_LPA16_LPB16_LRVW8_PGR2_PLR5_SU32_SUS256_SRVW4_TT1_32_VAW2_WSGRA1_WSGRB1_WG32_8_1_WGM1
    SolutionIndex: 89
    SolutionNameMin: Cijk_Alik_Bljk_HBH_MT128x64x64_MI32x32x8x1_SE_1LDSB1_AF0EM8_EPS0_GRVW8_GSU1_GSUAMB_LBSPP128_LPA8_LPB8_LRVW8_PGR2_PLR9_SU32_SUS128_SRVW4_TT2_32_VAW2_WSGRA1_WSGRB1_WG64_4_1_WGM2
    SolutionIndex: 90
    SolutionNameMin: Cijk_Alik_Bljk_HBH_MT128x64x64_MI32x32x8x1_SE_1LDSB1_AF0EM1_EPS1_GRVW8_GSU1_GSUAMB_LBSPP128_LPA8_LPB8_LRVW8_PGR1_PLR9_SU0_SUS0_SRVW4_TT2_32_VAW2_WSGRA1_WSGRB1_WG64_4_1_WGM15
    SolutionIndex: 91
    SolutionNameMin: Cijk_Alik_Bljk_HBH_MT32x64x64_MI16x16x16x1_SE_1LDSB1_AF0EM8_EPS1_GRVW8_GSU1_GSUAMB_LBSPP128_LPA16_LPB16_LRVW8_PGR1_PLR5_SU0_SUS0_SRVW4_TT1_32_VAW2_WSGRA1_WSGRB1_WG32_8_1_WGM15
    SolutionIndex: 92
    SolutionNameMin: Cijk_Alik_Bljk_HBH_MT128x128x32_MI32x32x8x1_SE_1LDSB1_AF0EM8_EPS1_GRVW8_GSU1_GSUAMB_LBSPP128_LPA8_LPB8_LRVW8_PGR1_PLR5_SU0_SUS0_SRVW4_TT2_64_VAW2_WSGRA1_WSGRB1_WG64_4_1_WGM15
    SolutionIndex: 93
    SolutionNameMin: Cijk_Alik_Bljk_HBH_MT32x32x32_MI16x16x16x1_SE_1LDSB1_AF0EM1_EPS1_GRVW4_GSU1_GSUAMB_LBSPP128_LPA16_LPB16_LRVW8_PGR1_PLR2_SU0_SUS0_SRVW4_TT1_16_VAW2_WSGRA1_WSGRB1_WG32_8_1_WGM1
    SolutionIndex: 94
    SolutionNameMin: Cijk_Alik_Bljk_HBH_MT64x128x64_MI32x32x8x1_SE_1LDSB1_AF0EM8_EPS0_GRVW8_GSU1_GSUAMB_LBSPP128_LPA8_LPB8_LRVW8_PGR2_PLR9_SU32_SUS256_SRVW4_TT1_64_VAW2_WSGRA1_WSGRB1_WG64_4_1_WGM15
    SolutionIndex: 95
    SolutionNameMin: Cijk_Alik_Bljk_HBH_MT16x16x64_MI16x16x16x1_SE_1LDSB0_AF0EM1_EPS0_GRVW8_GSU1_GSUAMB_LBSPP128_LPA16_LPB16_LRVW8_PGR2_PLR5_SU0_SUS0_SRVW0_TT1_16_VAW2_WSGRA1_WSGRB1_WG16_4_1_WGM1
    SolutionIndex: 96
    SolutionNameMin: Cijk_Alik_Bljk_HBH_MT128x128x32_MI32x32x8x1_SE_1LDSB1_AF0EM8_EPS1_GRVW8_GSU1_GSUAMB_LBSPP128_LPA8_LPB8_LRVW8_PGR1_PLR5_SU32_SUS128_SRVW4_TT2_64_VAW2_WSGRA1_WSGRB1_WG64_4_1_WGM1
    SolutionIndex: 97
    SolutionNameMin: Cijk_Alik_Bljk_HBH_MT64x192x64_MI32x32x8x1_SE_1LDSB1_AF0EM8_EPS0_GRVW8_GSU1_GSUAMB_LBSPP128_LPA8_LPB8_LRVW8_PGR2_PLR9_SU0_SUS0_SRVW4_TT1_96_VAW2_WSGRA1_WSGRB1_WG64_4_1_WGM15
    SolutionIndex: 98
    SolutionNameMin: Cijk_Alik_Bljk_HBH_MT128x64x32_MI32x32x8x1_SE_1LDSB1_AF0EM8_EPS1_GRVW4_GSU1_GSUAMB_LBSPP128_LPA8_LPB8_LRVW8_PGR1_PLR5_SU32_SUS256_SRVW4_TT2_32_VAW2_WSGRA1_WSGRB1_WG64_4_1_WGM1
    SolutionIndex: 99
    SolutionNameMin: Cijk_Alik_Bljk_HBH_MT64x64x32_MI16x16x4x4_SE_1LDSB0_AF0EM1_EPS1_GRVW2_GSU1_GSUASB_LBSPP128_LPA4_LPB4_LRVW4_PGR1_PLR1_SU16_SUS64_SRVW0_TT1_16_VAW2_WSGRA0_WSGRB0_WG64_4_1_WGM1
    SolutionIndex: 100
    SolutionNameMin: Cijk_Alik_Bljk_HBH_MT32x64x32_MI16x16x16x1_SE_1LDSB1_AF0EM1_EPS1_GRVW4_GSU1_GSUAMB_LBSPP128_LPA16_LPB16_LRVW8_PGR1_PLR2_SU0_SUS0_SRVW4_TT1_32_VAW2_WSGRA1_WSGRB1_WG32_8_1_WGM1
    SolutionIndex: 101
    SolutionNameMin: Cijk_Alik_Bljk_HBH_MT128x128x32_MI32x32x8x1_SE_1LDSB1_AF0EM8_EPS0_GRVW8_GSU1_GSUAMB_LBSPP128_LPA8_LPB8_LRVW8_PGR2_PLR5_SU32_SUS128_SRVW4_TT2_64_VAW2_WSGRA1_WSGRB1_WG64_4_1_WGM1
    SolutionIndex: 102
    SolutionNameMin: Cijk_Alik_Bljk_HBH_MT16x16x32_MI16x16x16x1_SE_1LDSB1_AF0EM1_EPS0_GRVW2_GSU1_GSUAMB_LBSPP128_LPA16_LPB16_LRVW8_PGR2_PLR2_SU0_SUS0_SRVW0_TT1_16_VAW2_WSGRA1_WSGRB1_WG16_4_1_WGM2
    SolutionIndex: 103
    SolutionNameMin: Cijk_Alik_Bljk_HBH_MT128x96x64_MI32x32x8x1_SE_1LDSB1_AF0EM8_EPS1_GRVW8_GSU1_GSUAMB_LBSPP128_LPA8_LPB8_LRVW8_PGR1_PLR9_SU0_SUS0_SRVW4_TT1_96_VAW2_WSGRA1_WSGRB1_WG128_2_1_WGM2
    SolutionIndex: 104
    SolutionNameMin: Cijk_Alik_Bljk_HBH_MT16x16x128_MI16x16x16x1_SE_1LDSB0_AF0EM8_EPS1_GRVW8_GSU1_GSUAMB_LBSPP256_LPA16_LPB16_LRVW8_PGR1_PLR9_SU0_SUS0_SRVW0_TT1_16_VAW2_WSGRA1_WSGRB1_WG16_4_1_WGM1
    SolutionIndex: 105
    SolutionNameMin: Cijk_Alik_Bljk_HBH_MT64x64x64_MI32x32x8x1_SE_1LDSB1_AF0EM8_EPS1_GRVW8_GSU1_GSUAMB_LBSPP128_LPA8_LPB8_LRVW8_PGR1_PLR9_SU0_SUS0_SRVW4_TT1_32_VAW2_WSGRA1_WSGRB1_WG64_4_1_WGM15
    SolutionIndex: 106
    SolutionNameMin: Cijk_Alik_Bljk_HBH_MT128x128x32_MI32x32x8x1_SE_1LDSB1_AF0EM8_EPS0_GRVW8_GSU1_GSUAMB_LBSPP128_LPA8_LPB8_LRVW8_PGR2_PLR5_SU32_SUS256_SRVW4_TT2_64_VAW2_WSGRA1_WSGRB1_WG64_4_1_WGM1
    SolutionIndex: 107
    SolutionNameMin: Cijk_Alik_Bljk_HBH_MT64x32x32_MI16x16x16x1_SE_1LDSB1_AF0EM8_EPS1_GRVW8_GSU1_GSUAMB_LBSPP128_LPA16_LPB16_LRVW8_PGR1_PLR2_SU0_SUS0_SRVW4_TT2_16_VAW2_WSGRA1_WSGRB1_WG32_8_1_WGM1
    SolutionIndex: 108
    SolutionNameMin: Cijk_Alik_Bljk_HBH_MT128x96x64_MI32x32x8x1_SE_1LDSB1_AF0EM8_EPS0_GRVW8_GSU1_GSUAMB_LBSPP128_LPA8_LPB8_LRVW8_PGR2_PLR9_SU32_SUS128_SRVW4_TT1_96_VAW2_WSGRA1_WSGRB1_WG128_2_1_WGM1
    SolutionIndex: 109
    SolutionNameMin: Cijk_Alik_Bljk_HBH_MT16x16x128_MI16x16x16x1_SE_1LDSB1_AF0EM1_EPS1_GRVW8_GSU1_GSUAMB_LBSPP256_LPA16_LPB16_LRVW8_PGR1_PLR9_SU0_SUS0_SRVW0_TT1_16_VAW2_WSGRA1_WSGRB1_WG16_4_1_WGM2
    SolutionIndex: 110
    SolutionNameMin: Cijk_Alik_Bljk_HBH_MT64x64x64_MI32x32x8x1_SE_1LDSB1_AF0EM8_EPS1_GRVW8_GSU1_GSUAMB_LBSPP128_LPA8_LPB8_LRVW8_PGR1_PLR9_SU32_SUS128_SRVW4_TT1_32_VAW2_WSGRA1_WSGRB1_WG64_4_1_WGM1
    SolutionIndex: 111
    SolutionNameMin: Cijk_Alik_Bljk_HBH_MT64x128x32_MI32x32x8x1_SE_1LDSB1_AF0EM8_EPS0_GRVW8_GSU1_GSUAMB_LBSPP128_LPA8_LPB8_LRVW8_PGR2_PLR5_SU32_SUS256_SRVW4_TT1_64_VAW2_WSGRA1_WSGRB1_WG64_4_1_WGM1
    SolutionIndex: 112
    SolutionNameMin: Cijk_Alik_Bljk_HBH_MT128x64x64_MI32x32x8x1_SE_1LDSB1_AF0EM8_EPS0_GRVW8_GSU1_GSUAMB_LBSPP128_LPA8_LPB8_LRVW8_PGR2_PLR9_SU32_SUS256_SRVW4_TT2_32_VAW2_WSGRA1_WSGRB1_WG64_4_1_WGM15
    SolutionIndex: 113
    SolutionNameMin: Cijk_Alik_Bljk_HBH_MT128x96x64_MI32x32x8x1_SE_1LDSB1_AF0EM8_EPS1_GRVW8_GSU1_GSUAMB_LBSPP128_LPA8_LPB8_LRVW8_PGR1_PLR9_SU32_SUS256_SRVW4_TT1_96_VAW2_WSGRA1_WSGRB1_WG128_2_1_WGM1
    SolutionIndex: 114
    SolutionNameMin: Cijk_Alik_Bljk_HBH_MT64x128x64_MI32x32x8x1_SE_1LDSB1_AF0EM8_EPS0_GRVW8_GSU1_GSUAMB_LBSPP128_LPA8_LPB8_LRVW8_PGR2_PLR9_SU32_SUS128_SRVW4_TT1_64_VAW2_WSGRA1_WSGRB1_WG64_4_1_WGM2
    SolutionIndex: 115
    SolutionNameMin: Cijk_Alik_Bljk_HBH_MT128x128x64_MI32x32x8x1_SE_1LDSB1_AF0EM8_EPS0_GRVW8_GSU1_GSUAMB_LBSPP128_LPA8_LPB8_LRVW8_PGR2_PLR9_SU0_SUS0_SRVW4_TT2_64_VAW2_WSGRA1_WSGRB1_WG64_4_1_WGM1
    SolutionIndex: 116
    SolutionNameMin: Cijk_Alik_Bljk_HBH_MT128x96x64_MI32x32x8x1_SE_1LDSB1_AF0EM8_EPS1_GRVW8_GSU1_GSUAMB_LBSPP128_LPA8_LPB8_LRVW8_PGR1_PLR9_SU32_SUS256_SRVW4_TT1_96_VAW2_WSGRA1_WSGRB1_WG128_2_1_WGM2
    SolutionIndex: 117
    SolutionNameMin: Cijk_Alik_Bljk_HBH_MT64x32x64_MI16x16x16x1_SE_1LDSB0_AF0EM8_EPS0_GRVW8_GSU1_GSUAMB_LBSPP128_LPA16_LPB16_LRVW8_PGR2_PLR5_SU32_SUS128_SRVW4_TT2_16_VAW2_WSGRA1_WSGRB1_WG32_8_1_WGM2
    SolutionIndex: 118
    SolutionNameMin: Cijk_Alik_Bljk_HBH_MT64x32x32_MI16x16x16x1_SE_1LDSB0_AF0EM8_EPS1_GRVW2_GSU1_GSUAMB_LBSPP128_LPA16_LPB16_LRVW8_PGR1_PLR2_SU32_SUS256_SRVW4_TT2_16_VAW2_WSGRA1_WSGRB1_WG32_8_1_WGM15
    SolutionIndex: 119
    SolutionNameMin: Cijk_Alik_Bljk_HBH_MT128x96x32_MI32x32x8x1_SE_1LDSB1_AF0EM8_EPS1_GRVW2_GSU1_GSUAMB_LBSPP128_LPA8_LPB8_LRVW8_PGR1_PLR5_SU32_SUS128_SRVW4_TT1_96_VAW2_WSGRA1_WSGRB1_WG128_2_1_WGM1
    SolutionIndex: 120
    SolutionNameMin: Cijk_Alik_Bljk_HBH_MT16x64x64_MI16x16x16x1_SE_1LDSB0_AF0EM8_EPS0_GRVW8_GSU1_GSUAMB_LBSPP128_LPA16_LPB16_LRVW8_PGR2_PLR5_SU0_SUS0_SRVW0_TT1_16_VAW2_WSGRA1_WSGRB1_WG16_16_1_WGM1
    SolutionIndex: 121
    SolutionNameMin: Cijk_Alik_Bljk_HBH_MT64x64x64_MI32x32x8x1_SE_1LDSB0_AF0EM8_EPS0_GRVW8_GSU1_GSUAMB_LBSPP128_LPA8_LPB8_LRVW8_PGR2_PLR9_SU32_SUS256_SRVW4_TT1_32_VAW2_WSGRA1_WSGRB1_WG64_4_1_WGM15
    SolutionIndex: 122
    SolutionNameMin: Cijk_Alik_Bljk_HBH_MT128x256x32_MI32x32x8x1_SE_1LDSB1_AF0EM8_EPS1_GRVW8_GSU1_GSUAMB_LBSPP128_LPA8_LPB8_LRVW8_PGR1_PLR5_SU0_SUS0_SRVW4_TT2_128_VAW2_WSGRA1_WSGRB1_WG64_4_1_WGM1
    SolutionIndex: 123
    SolutionNameMin: Cijk_Alik_Bljk_HBH_MT64x64x32_MI32x32x8x1_SE_1LDSB1_AF0EM8_EPS0_GRVW2_GSU1_GSUAMB_LBSPP128_LPA8_LPB8_LRVW8_PGR2_PLR5_SU0_SUS0_SRVW4_TT1_32_VAW2_WSGRA1_WSGRB1_WG64_4_1_WGM1
    SolutionIndex: 124
    SolutionNameMin: Cijk_Alik_Bljk_HBH_MT128x96x64_MI32x32x8x1_SE_1LDSB1_AF0EM8_EPS1_GRVW8_GSU1_GSUAMB_LBSPP128_LPA8_LPB8_LRVW8_PGR1_PLR9_SU0_SUS0_SRVW4_TT1_96_VAW2_WSGRA1_WSGRB1_WG128_2_1_WGM1
    SolutionIndex: 125
    SolutionNameMin: Cijk_Alik_Bljk_HBH_MT128x96x64_MI32x32x8x1_SE_1LDSB1_AF0EM8_EPS0_GRVW8_GSU1_GSUAMB_LBSPP128_LPA8_LPB8_LRVW8_PGR2_PLR9_SU32_SUS256_SRVW4_TT1_96_VAW2_WSGRA1_WSGRB1_WG128_2_1_WGM15
    SolutionIndex: 126
    SolutionNameMin: Cijk_Alik_Bljk_HBH_MT64x64x32_MI32x32x8x1_SE_1LDSB1_AF0EM1_EPS1_GRVW2_GSU1_GSUAMB_LBSPP128_LPA8_LPB8_LRVW8_PGR1_PLR5_SU0_SUS0_SRVW4_TT1_32_VAW2_WSGRA1_WSGRB1_WG64_4_1_WGM1
    SolutionIndex: 127
    SolutionNameMin: Cijk_Alik_Bljk_HBH_MT64x128x64_MI32x32x8x1_SE_1LDSB0_AF0EM8_EPS0_GRVW8_GSU1_GSUAMB_LBSPP128_LPA8_LPB8_LRVW8_PGR2_PLR9_SU32_SUS256_SRVW4_TT1_64_VAW2_WSGRA1_WSGRB1_WG64_4_1_WGM1
    SolutionIndex: 128
    SolutionNameMin: Cijk_Alik_Bljk_HBH_MT128x144x64_MI16x16x16x1_SE_1LDSB1_AF0EM8_EPS0_GRVW4_GSU1_GSUAMB_LBSPP128_LPA16_LPB16_LRVW8_PGR2_PLR5_SU32_SUS128_SRVW4_TT2_144_VAW2_WSGRA1_WSGRB1_WG64_4_1_WGM15
    SolutionIndex: 129
    SolutionNameMin: Cijk_Alik_Bljk_HBH_MT16x64x32_MI16x16x16x1_SE_1LDSB0_AF0EM8_EPS0_GRVW8_GSU1_GSUAMB_LBSPP128_LPA16_LPB16_LRVW8_PGR2_PLR2_SU0_SUS0_SRVW0_TT1_16_VAW2_WSGRA1_WSGRB1_WG16_16_1_WGM1
    SolutionIndex: 130
    SolutionNameMin: Cijk_Alik_Bljk_HBH_MT128x64x64_MI32x32x8x1_SE_1LDSB0_AF0EM8_EPS0_GRVW8_GSU1_GSUAMB_LBSPP128_LPA8_LPB8_LRVW8_PGR2_PLR9_SU32_SUS128_SRVW4_TT2_32_VAW2_WSGRA1_WSGRB1_WG64_4_1_WGM2
    SolutionIndex: 131
    SolutionNameMin: Cijk_Alik_Bljk_HBH_MT64x32x32_MI16x16x16x1_SE_1LDSB1_AF0EM8_EPS1_GRVW4_GSU1_GSUAMB_LBSPP128_LPA16_LPB16_LRVW8_PGR1_PLR2_SU0_SUS0_SRVW4_TT2_16_VAW2_WSGRA1_WSGRB1_WG32_8_1_WGM1
    SolutionIndex: 132
    SolutionNameMin: Cijk_Alik_Bljk_HBH_MT64x32x64_MI16x16x16x1_SE_1LDSB1_AF0EM8_EPS1_GRVW8_GSU1_GSUAMB_LBSPP128_LPA16_LPB16_LRVW8_PGR1_PLR5_SU32_SUS128_SRVW4_TT2_16_VAW2_WSGRA1_WSGRB1_WG32_8_1_WGM15
    SolutionIndex: 133
    SolutionNameMin: Cijk_Alik_Bljk_HBH_MT32x32x32_MI16x16x16x1_SE_1LDSB0_AF0EM8_EPS0_GRVW2_GSU1_GSUAMB_LBSPP128_LPA16_LPB16_LRVW8_PGR2_PLR2_SU0_SUS0_SRVW4_TT1_16_VAW2_WSGRA1_WSGRB1_WG32_8_1_WGM1
    SolutionIndex: 134
    SolutionNameMin: Cijk_Alik_Bljk_HBH_MT64x32x32_MI16x16x16x1_SE_1LDSB1_AF0EM8_EPS1_GRVW2_GSU1_GSUAMB_LBSPP128_LPA16_LPB16_LRVW8_PGR1_PLR2_SU0_SUS0_SRVW4_TT2_16_VAW2_WSGRA1_WSGRB1_WG32_8_1_WGM1
    SolutionIndex: 135
    SolutionNameMin: Cijk_Alik_Bljk_HBH_MT144x64x64_MI16x16x16x1_SE_1LDSB1_AF0EM8_EPS0_GRVW4_GSU1_GSUAMB_LBSPP128_LPA16_LPB16_LRVW8_PGR2_PLR5_SU32_SUS256_SRVW0_TT9_16_VAW2_WSGRA1_WSGRB1_WG16_16_1_WGM1
    SolutionIndex: 136
    SolutionNameMin: Cijk_Alik_Bljk_HBH_MT16x16x128_MI16x16x16x1_SE_1LDSB0_AF0EM1_EPS1_GRVW8_GSU1_GSUAMB_LBSPP256_LPA16_LPB16_LRVW8_PGR1_PLR9_SU0_SUS0_SRVW0_TT1_16_VAW2_WSGRA1_WSGRB1_WG16_4_1_WGM1
    SolutionIndex: 137
    SolutionNameMin: Cijk_Alik_Bljk_HBH_MT64x64x32_MI32x32x8x1_SE_1LDSB1_AF0EM8_EPS1_GRVW4_GSU1_GSUAMB_LBSPP128_LPA8_LPB8_LRVW8_PGR1_PLR5_SU0_SUS0_SRVW4_TT1_32_VAW2_WSGRA1_WSGRB1_WG64_4_1_WGM1
    SolutionIndex: 138
    SolutionNameMin: Cijk_Alik_Bljk_HBH_MT64x64x64_MI32x32x8x1_SE_1LDSB1_AF0EM8_EPS1_GRVW8_GSU1_GSUAMB_LBSPP128_LPA8_LPB8_LRVW8_PGR1_PLR9_SU0_SUS0_SRVW4_TT1_32_VAW2_WSGRA1_WSGRB1_WG64_4_1_WGM2
    SolutionIndex: 139
    SolutionNameMin: Cijk_Alik_Bljk_HBH_MT64x128x32_MI32x32x8x1_SE_1LDSB1_AF0EM8_EPS1_GRVW4_GSU1_GSUAMB_LBSPP128_LPA8_LPB8_LRVW8_PGR1_PLR5_SU0_SUS0_SRVW4_TT1_64_VAW2_WSGRA1_WSGRB1_WG64_4_1_WGM1
    SolutionIndex: 140
    SolutionNameMin: Cijk_Alik_Bljk_HBH_MT64x32x32_MI16x16x16x1_SE_1LDSB0_AF0EM8_EPS1_GRVW2_GSU1_GSUAMB_LBSPP128_LPA16_LPB16_LRVW8_PGR1_PLR2_SU0_SUS0_SRVW4_TT2_16_VAW2_WSGRA1_WSGRB1_WG32_8_1_WGM1
    SolutionIndex: 141
    SolutionNameMin: Cijk_Alik_Bljk_HBH_MT128x128x32_MI32x32x8x1_SE_1LDSB1_AF0EM8_EPS0_GRVW4_GSU1_GSUAMB_LBSPP128_LPA8_LPB8_LRVW8_PGR2_PLR5_SU32_SUS256_SRVW4_TT2_64_VAW2_WSGRA1_WSGRB1_WG64_4_1_WGM1
    SolutionIndex: 142
    SolutionNameMin: Cijk_Alik_Bljk_HBH_MT128x128x32_MI32x32x8x1_SE_1LDSB1_AF0EM8_EPS0_GRVW2_GSU1_GSUAMB_LBSPP128_LPA8_LPB8_LRVW8_PGR2_PLR5_SU0_SUS0_SRVW4_TT2_64_VAW2_WSGRA1_WSGRB1_WG64_4_1_WGM2
    SolutionIndex: 143
    SolutionNameMin: Cijk_Alik_Bljk_HBH_MT128x64x64_MI32x32x8x1_SE_1LDSB0_AF0EM8_EPS0_GRVW8_GSU1_GSUAMB_LBSPP128_LPA8_LPB8_LRVW8_PGR2_PLR9_SU32_SUS256_SRVW4_TT2_32_VAW2_WSGRA1_WSGRB1_WG64_4_1_WGM15
    SolutionIndex: 144
    SolutionNameMin: Cijk_Alik_Bljk_HBH_MT128x96x64_MI32x32x8x1_SE_1LDSB1_AF0EM8_EPS1_GRVW8_GSU1_GSUAMB_LBSPP128_LPA8_LPB8_LRVW8_PGR1_PLR9_SU32_SUS128_SRVW4_TT1_96_VAW2_WSGRA1_WSGRB1_WG128_2_1_WGM2
    SolutionIndex: 145
    SolutionNameMin: Cijk_Alik_Bljk_HBH_MT128x64x32_MI32x32x8x1_SE_1LDSB1_AF0EM8_EPS1_GRVW8_GSU1_GSUAMB_LBSPP128_LPA8_LPB8_LRVW8_PGR1_PLR5_SU32_SUS128_SRVW4_TT2_32_VAW2_WSGRA1_WSGRB1_WG64_4_1_WGM1
    SolutionIndex: 146
    SolutionNameMin: Cijk_Alik_Bljk_HBH_MT128x64x32_MI32x32x8x1_SE_1LDSB0_AF0EM8_EPS0_GRVW8_GSU1_GSUAMB_LBSPP128_LPA8_LPB8_LRVW8_PGR2_PLR5_SU0_SUS0_SRVW4_TT2_32_VAW2_WSGRA1_WSGRB1_WG64_4_1_WGM1
    SolutionIndex: 147
    SolutionNameMin: Cijk_Alik_Bljk_HBH_MT64x64x64_MI32x32x8x1_SE_1LDSB0_AF0EM8_EPS0_GRVW8_GSU1_GSUAMB_LBSPP128_LPA8_LPB8_LRVW8_PGR2_PLR9_SU32_SUS256_SRVW4_TT1_32_VAW2_WSGRA1_WSGRB1_WG64_4_1_WGM2
    SolutionIndex: 148
    SolutionNameMin: Cijk_Alik_Bljk_HBH_MT128x96x64_MI32x32x8x1_SE_1LDSB1_AF0EM8_EPS0_GRVW8_GSU1_GSUAMB_LBSPP128_LPA8_LPB8_LRVW8_PGR2_PLR9_SU32_SUS128_SRVW4_TT1_96_VAW2_WSGRA1_WSGRB1_WG128_2_1_WGM2
    SolutionIndex: 149
    SolutionNameMin: Cijk_Alik_Bljk_HBH_MT64x64x64_MI32x32x8x1_SE_1LDSB1_AF0EM8_EPS1_GRVW8_GSU1_GSUAMB_LBSPP128_LPA8_LPB8_LRVW8_PGR1_PLR9_SU32_SUS256_SRVW4_TT1_32_VAW2_WSGRA1_WSGRB1_WG64_4_1_WGM15
    SolutionIndex: 150
    SolutionNameMin: Cijk_Alik_Bljk_HBH_MT16x16x128_MI16x16x16x1_SE_1LDSB1_AF0EM1_EPS1_GRVW8_GSU1_GSUAMB_LBSPP256_LPA16_LPB16_LRVW8_PGR1_PLR9_SU0_SUS0_SRVW4_TT1_16_VAW2_WSGRA1_WSGRB1_WG16_4_1_WGM1
    SolutionIndex: 151
    SolutionNameMin: Cijk_Alik_Bljk_HBH_MT128x128x32_MI32x32x8x1_SE_1LDSB1_AF0EM8_EPS1_GRVW2_GSU1_GSUAMB_LBSPP128_LPA8_LPB8_LRVW8_PGR1_PLR5_SU32_SUS256_SRVW4_TT2_64_VAW2_WSGRA1_WSGRB1_WG64_4_1_WGM1
    SolutionIndex: 152
    SolutionNameMin: Cijk_Alik_Bljk_HBH_MT32x64x64_MI16x16x16x1_SE_1LDSB0_AF0EM8_EPS1_GRVW8_GSU1_GSUAMB_LBSPP128_LPA16_LPB16_LRVW8_PGR1_PLR5_SU0_SUS0_SRVW4_TT1_32_VAW2_WSGRA1_WSGRB1_WG32_8_1_WGM15
    SolutionIndex: 153
    SolutionNameMin: Cijk_Alik_Bljk_HBH_MT64x32x32_MI16x16x16x1_SE_1LDSB1_AF0EM8_EPS1_GRVW8_GSU1_GSUAMB_LBSPP128_LPA16_LPB16_LRVW8_PGR1_PLR2_SU32_SUS128_SRVW4_TT2_16_VAW2_WSGRA1_WSGRB1_WG32_8_1_WGM2
    SolutionIndex: 154
    SolutionNameMin: Cijk_Alik_Bljk_HBH_MT64x64x32_MI32x32x8x1_SE_1LDSB1_AF0EM8_EPS1_GRVW2_GSU1_GSUAMB_LBSPP128_LPA8_LPB8_LRVW8_PGR1_PLR5_SU32_SUS256_SRVW4_TT1_32_VAW2_WSGRA1_WSGRB1_WG64_4_1_WGM1
    SolutionIndex: 155
    SolutionNameMin: Cijk_Alik_Bljk_HBH_MT128x64x32_MI32x32x8x1_SE_1LDSB0_AF0EM8_EPS1_GRVW8_GSU1_GSUAMB_LBSPP128_LPA8_LPB8_LRVW8_PGR1_PLR5_SU0_SUS0_SRVW4_TT2_32_VAW2_WSGRA1_WSGRB1_WG64_4_1_WGM1
    SolutionIndex: 156
    SolutionNameMin: Cijk_Alik_Bljk_HBH_MT128x128x64_MI32x32x8x1_SE_1LDSB1_AF0EM1_EPS0_GRVW8_GSU1_GSUAMB_LBSPP128_LPA8_LPB8_LRVW8_PGR2_PLR9_SU0_SUS0_SRVW4_TT2_64_VAW2_WSGRA1_WSGRB1_WG64_4_1_WGM15
    SolutionIndex: 157
    SolutionNameMin: Cijk_Alik_Bljk_HBH_MT128x256x32_MI32x32x8x1_SE_1LDSB1_AF0EM8_EPS0_GRVW8_GSU1_GSUAMB_LBSPP128_LPA8_LPB8_LRVW8_PGR2_PLR5_SU32_SUS256_SRVW4_TT2_128_VAW2_WSGRA1_WSGRB1_WG64_4_1_WGM2
    SolutionIndex: 158
    SolutionNameMin: Cijk_Alik_Bljk_HBH_MT128x128x32_MI32x32x8x1_SE_1LDSB1_AF0EM8_EPS0_GRVW2_GSU1_GSUAMB_LBSPP128_LPA8_LPB8_LRVW8_PGR2_PLR5_SU32_SUS128_SRVW4_TT2_64_VAW2_WSGRA1_WSGRB1_WG64_4_1_WGM1
    SolutionIndex: 159
    SolutionNameMin: Cijk_Alik_Bljk_HBH_MT16x16x128_MI16x16x16x1_SE_1LDSB1_AF0EM8_EPS1_GRVW8_GSU1_GSUAMB_LBSPP256_LPA16_LPB16_LRVW8_PGR1_PLR9_SU32_SUS256_SRVW0_TT1_16_VAW2_WSGRA1_WSGRB1_WG16_4_1_WGM1
    SolutionIndex: 160
    SolutionNameMin: Cijk_Alik_Bljk_HBH_MT32x32x32_MI16x16x16x1_SE_1LDSB0_AF0EM1_EPS0_GRVW2_GSU1_GSUAMB_LBSPP128_LPA16_LPB16_LRVW8_PGR2_PLR2_SU0_SUS0_SRVW4_TT1_16_VAW2_WSGRA1_WSGRB1_WG32_8_1_WGM1
    SolutionIndex: 161
    SolutionNameMin: Cijk_Alik_Bljk_HBH_MT16x64x128_MI16x16x16x1_SE_1LDSB1_AF0EM8_EPS1_GRVW8_GSU1_GSUAMB_LBSPP256_LPA16_LPB16_LRVW8_PGR1_PLR9_SU0_SUS0_SRVW0_TT1_16_VAW2_WSGRA1_WSGRB1_WG16_16_1_WGM2
    SolutionIndex: 162
    SolutionNameMin: Cijk_Alik_Bljk_HBH_MT128x160x64_MI32x32x8x1_SE_1LDSB1_AF0EM8_EPS1_GRVW4_GSU1_GSUAMB_LBSPP128_LPA8_LPB8_LRVW8_PGR1_PLR9_SU0_SUS0_SRVW4_TT1_160_VAW2_WSGRA1_WSGRB1_WG128_2_1_WGM2
    SolutionIndex: 163
    SolutionNameMin: Cijk_Alik_Bljk_HBH_MT32x32x64_MI16x16x16x1_SE_1LDSB0_AF0EM8_EPS0_GRVW4_GSU1_GSUAMB_LBSPP128_LPA16_LPB16_LRVW8_PGR2_PLR5_SU0_SUS0_SRVW4_TT1_16_VAW2_WSGRA1_WSGRB1_WG32_8_1_WGM2
    SolutionIndex: 164
    SolutionNameMin: Cijk_Alik_Bljk_HBH_MT128x192x32_MI32x32x8x1_SE_1LDSB1_AF0EM1_EPS0_GRVW8_GSU1_GSUAMB_LBSPP128_LPA8_LPB8_LRVW8_PGR2_PLR5_SU32_SUS128_SRVW4_TT2_96_VAW2_WSGRA1_WSGRB1_WG64_4_1_WGM15
    SolutionIndex: 165
    SolutionNameMin: Cijk_Alik_Bljk_HBH_MT32x32x64_MI16x16x16x1_SE_1LDSB0_AF0EM8_EPS0_GRVW4_GSU1_GSUAMB_LBSPP128_LPA16_LPB16_LRVW8_PGR2_PLR5_SU0_SUS0_SRVW4_TT1_16_VAW2_WSGRA1_WSGRB1_WG32_8_1_WGM1
    SolutionIndex: 166
    SolutionNameMin: Cijk_Alik_Bljk_HBH_MT128x96x64_MI32x32x8x1_SE_1LDSB1_AF0EM1_EPS0_GRVW8_GSU1_GSUAMB_LBSPP128_LPA8_LPB8_LRVW8_PGR2_PLR9_SU0_SUS0_SRVW4_TT1_96_VAW2_WSGRA1_WSGRB1_WG128_2_1_WGM15
    SolutionIndex: 167
    SolutionNameMin: Cijk_Alik_Bljk_HBH_MT64x32x64_MI16x16x16x1_SE_1LDSB0_AF0EM8_EPS0_GRVW4_GSU1_GSUAMB_LBSPP128_LPA16_LPB16_LRVW8_PGR2_PLR5_SU0_SUS0_SRVW4_TT2_16_VAW2_WSGRA1_WSGRB1_WG32_8_1_WGM15
    SolutionIndex: 168
    SolutionNameMin: Cijk_Alik_Bljk_HBH_MT16x16x128_MI16x16x16x1_SE_1LDSB1_AF0EM1_EPS1_GRVW8_GSU7_GSUAMB_LBSPP256_LPA16_LPB16_LRVW8_PGR1_PLR9_SU32_SUS256_SRVW0_TT1_16_VAW1_WSGRA1_WSGRB1_WG16_4_1_WGM2
    SolutionIndex: 169
    SolutionNameMin: Cijk_Alik_Bljk_HBH_MT16x16x128_MI16x16x16x1_SE_1LDSB1_AF0EM1_EPS1_GRVW8_GSU3_GSUAMB_LBSPP256_LPA16_LPB16_LRVW8_PGR1_PLR9_SU32_SUS256_SRVW0_TT1_16_VAW1_WSGRA1_WSGRB1_WG16_4_1_WGM2
    SolutionIndex: 170
    SolutionNameMin: Cijk_Alik_Bljk_HBH_MT128x128x32_MI32x32x8x1_SE_1LDSB0_AF0EM8_EPS0_GRVW8_GSU1_GSUAMB_LBSPP128_LPA8_LPB8_LRVW8_PGR2_PLR5_SU32_SUS128_SRVW4_TT2_64_VAW2_WSGRA1_WSGRB1_WG64_4_1_WGM1
    SolutionIndex: 171
    SolutionNameMin: Cijk_Alik_Bljk_HBH_MT64x64x64_MI32x32x8x1_SE_1LDSB0_AF0EM8_EPS0_GRVW8_GSU1_GSUAMB_LBSPP128_LPA8_LPB8_LRVW8_PGR2_PLR9_SU32_SUS128_SRVW4_TT1_32_VAW2_WSGRA1_WSGRB1_WG64_4_1_WGM2
    SolutionIndex: 172
    SolutionNameMin: Cijk_Alik_Bljk_HBH_MT16x16x128_MI16x16x16x1_SE_1LDSB1_AF0EM1_EPS1_GRVW8_GSU5_GSUAMB_LBSPP256_LPA16_LPB16_LRVW8_PGR1_PLR9_SU0_SUS0_SRVW0_TT1_16_VAW1_WSGRA1_WSGRB1_WG16_4_1_WGM2
    SolutionIndex: 173
    SolutionNameMin: Cijk_Alik_Bljk_HBH_MT128x160x32_MI32x32x8x1_SE_1LDSB1_AF0EM8_EPS0_GRVW2_GSU1_GSUAMB_LBSPP128_LPA8_LPB8_LRVW8_PGR2_PLR5_SU0_SUS0_SRVW4_TT1_160_VAW2_WSGRA1_WSGRB1_WG128_2_1_WGM15
    SolutionIndex: 174
    SolutionNameMin: Cijk_Alik_Bljk_HBH_MT16x16x128_MI16x16x16x1_SE_1LDSB0_AF0EM8_EPS1_GRVW8_GSU5_GSUAMB_LBSPP256_LPA16_LPB16_LRVW8_PGR1_PLR9_SU32_SUS256_SRVW0_TT1_16_VAW1_WSGRA1_WSGRB1_WG16_4_1_WGM1
    SolutionIndex: 175
    SolutionNameMin: Cijk_Alik_Bljk_HBH_MT128x128x32_MI32x32x8x1_SE_1LDSB1_AF0EM8_EPS0_GRVW8_GSU1_GSUAMB_LBSPP128_LPA8_LPB8_LRVW8_PGR2_PLR5_SU0_SUS0_SRVW4_TT2_64_VAW2_WSGRA1_WSGRB1_WG64_4_1_WGM15
    SolutionIndex: 176
    SolutionNameMin: Cijk_Alik_Bljk_HBH_MT160x160x32_MI16x16x16x1_SE_1LDSB1_AF0EM8_EPS1_GRVW2_GSU1_GSUAMB_LBSPP128_LPA16_LPB16_LRVW8_PGR1_PLR2_SU0_SUS0_SRVW0_TT5_80_VAW2_WSGRA1_WSGRB1_WG32_8_1_WGM1
    SolutionIndex: 177
    SolutionNameMin: Cijk_Alik_Bljk_HBH_MT256x160x64_MI32x32x8x1_SE_1LDSB1_AF0EM8_EPS0_GRVW2_GSU1_GSUAMB_LBSPP128_LPA8_LPB8_LRVW8_PGR2_PLR9_SU32_SUS256_SRVW4_TT2_160_VAW2_WSGRA1_WSGRB1_WG128_2_1_WGM2
    SolutionIndex: 178
    SolutionNameMin: Cijk_Alik_Bljk_HBH_MT64x32x64_MI16x16x16x1_SE_1LDSB1_AF0EM1_EPS1_GRVW8_GSU1_GSUAMB_LBSPP128_LPA16_LPB16_LRVW8_PGR1_PLR5_SU0_SUS0_SRVW4_TT2_16_VAW2_WSGRA1_WSGRB1_WG32_8_1_WGM1
    SolutionIndex: 179
    SolutionNameMin: Cijk_Alik_Bljk_HBH_MT128x64x64_MI32x32x8x1_SE_1LDSB0_AF0EM8_EPS0_GRVW4_GSU1_GSUAMB_LBSPP128_LPA8_LPB8_LRVW8_PGR2_PLR9_SU0_SUS0_SRVW4_TT2_32_VAW2_WSGRA1_WSGRB1_WG64_4_1_WGM2
    SolutionIndex: 180
    SolutionNameMin: Cijk_Alik_Bljk_HBH_MT128x96x64_MI32x32x8x1_SE_1LDSB0_AF0EM8_EPS0_GRVW8_GSU1_GSUAMB_LBSPP128_LPA8_LPB8_LRVW8_PGR2_PLR9_SU0_SUS0_SRVW4_TT1_96_VAW2_WSGRA1_WSGRB1_WG128_2_1_WGM2
    SolutionIndex: 181
    SolutionNameMin: Cijk_Alik_Bljk_HBH_MT64x64x32_MI32x32x8x1_SE_1LDSB0_AF0EM8_EPS0_GRVW2_GSU1_GSUAMB_LBSPP128_LPA8_LPB8_LRVW8_PGR2_PLR5_SU0_SUS0_SRVW4_TT1_32_VAW2_WSGRA1_WSGRB1_WG64_4_1_WGM15
    SolutionIndex: 182
    SolutionNameMin: Cijk_Alik_Bljk_HBH_MT256x128x64_MI32x32x8x1_SE_1LDSB1_AF0EM8_EPS0_GRVW2_GSU1_GSUAMB_LBSPP128_LPA8_LPB8_LRVW8_PGR2_PLR9_SU0_SUS0_SRVW4_TT4_64_VAW2_WSGRA1_WSGRB1_WG64_4_1_WGM1
    SolutionIndex: 183
    SolutionNameMin: Cijk_Alik_Bljk_HBH_MT256x160x32_MI32x32x8x1_SE_1LDSB1_AF0EM8_EPS1_GRVW2_GSU1_GSUAMB_LBSPP128_LPA8_LPB8_LRVW8_PGR1_PLR5_SU0_SUS0_SRVW4_TT2_160_VAW2_WSGRA1_WSGRB1_WG128_2_1_WGM1
    SolutionIndex: 184
    SolutionNameMin: Cijk_Alik_Bljk_HBH_MT128x96x64_MI32x32x8x1_SE_1LDSB0_AF0EM8_EPS0_GRVW8_GSU1_GSUAMB_LBSPP128_LPA8_LPB8_LRVW8_PGR2_PLR9_SU0_SUS0_SRVW4_TT1_96_VAW2_WSGRA1_WSGRB1_WG128_2_1_WGM15
    SolutionIndex: 185
    SolutionNameMin: Cijk_Alik_Bljk_HBH_MT128x64x32_MI32x32x8x1_SE_1LDSB0_AF0EM8_EPS0_GRVW2_GSU1_GSUAMB_LBSPP128_LPA8_LPB8_LRVW8_PGR2_PLR5_SU0_SUS0_SRVW4_TT2_32_VAW2_WSGRA1_WSGRB1_WG64_4_1_WGM1
    SolutionIndex: 186
    SolutionNameMin: Cijk_Alik_Bljk_HBH_MT128x96x64_MI32x32x8x1_SE_1LDSB0_AF0EM8_EPS0_GRVW2_GSU1_GSUAMB_LBSPP128_LPA8_LPB8_LRVW8_PGR2_PLR9_SU32_SUS128_SRVW4_TT1_96_VAW2_WSGRA1_WSGRB1_WG128_2_1_WGM15
    SolutionIndex: 187
    SolutionNameMin: Cijk_Alik_Bljk_HBH_MT16x16x64_MI16x16x16x1_SE_1LDSB0_AF0EM8_EPS1_GRVW8_GSU1_GSUAMB_LBSPP128_LPA16_LPB16_LRVW8_PGR1_PLR5_SU0_SUS0_SRVW0_TT1_16_VAW2_WSGRA1_WSGRB1_WG16_4_1_WGM1
    SolutionIndex: 188
    SolutionNameMin: Cijk_Alik_Bljk_HBH_MT16x16x128_MI16x16x16x1_SE_1LDSB0_AF0EM1_EPS1_GRVW8_GSU1_GSUAMB_LBSPP256_LPA16_LPB16_LRVW8_PGR1_PLR9_SU32_SUS256_SRVW0_TT1_16_VAW2_WSGRA1_WSGRB1_WG16_4_1_WGM1
    SolutionIndex: 189
    SolutionNameMin: Cijk_Alik_Bljk_HBH_MT128x128x32_MI32x32x8x1_SE_1LDSB1_AF0EM8_EPS0_GRVW4_GSU1_GSUAMB_LBSPP128_LPA8_LPB8_LRVW8_PGR2_PLR5_SU0_SUS0_SRVW4_TT2_64_VAW2_WSGRA1_WSGRB1_WG64_4_1_WGM15
    SolutionIndex: 190
    SolutionNameMin: Cijk_Alik_Bljk_HBH_MT128x64x64_MI32x32x8x1_SE_1LDSB0_AF0EM8_EPS0_GRVW8_GSU1_GSUAMB_LBSPP128_LPA8_LPB8_LRVW8_PGR2_PLR9_SU0_SUS0_SRVW4_TT2_32_VAW2_WSGRA1_WSGRB1_WG64_4_1_WGM2
    SolutionIndex: 191
    SolutionNameMin: Cijk_Alik_Bljk_HBH_MT96x96x64_MI16x16x16x1_SE_1LDSB1_AF0EM8_EPS1_GRVW8_GSU1_GSUAMB_LBSPP128_LPA16_LPB16_LRVW8_PGR1_PLR5_SU32_SUS128_SRVW0_TT3_48_VAW2_WSGRA1_WSGRB1_WG32_8_1_WGM2
    SolutionIndex: 192
    SolutionNameMin: Cijk_Alik_Bljk_HBH_MT96x96x64_MI16x16x16x1_SE_1LDSB1_AF0EM8_EPS1_GRVW8_GSU1_GSUAMB_LBSPP128_LPA16_LPB16_LRVW8_PGR1_PLR5_SU32_SUS256_SRVW0_TT3_48_VAW2_WSGRA1_WSGRB1_WG32_8_1_WGM1
    SolutionIndex: 193
    SolutionNameMin: Cijk_Alik_Bljk_HBH_MT128x128x32_MI32x32x8x1_SE_1LDSB1_AF0EM8_EPS0_GRVW8_GSU1_GSUAMB_LBSPP128_LPA8_LPB8_LRVW8_PGR2_PLR5_SU32_SUS256_SRVW4_TT2_64_VAW2_WSGRA1_WSGRB1_WG64_4_1_WGM2
    SolutionIndex: 194
    SolutionNameMin: Cijk_Alik_Bljk_HBH_MT128x160x32_MI32x32x8x1_SE_1LDSB1_AF0EM8_EPS1_GRVW4_GSU1_GSUAMB_LBSPP128_LPA8_LPB8_LRVW8_PGR1_PLR5_SU32_SUS128_SRVW4_TT1_160_VAW2_WSGRA1_WSGRB1_WG128_2_1_WGM2
    SolutionIndex: 195
    SolutionNameMin: Cijk_Alik_Bljk_HBH_MT128x96x32_MI32x32x8x1_SE_1LDSB0_AF0EM8_EPS0_GRVW4_GSU1_GSUAMB_LBSPP128_LPA8_LPB8_LRVW8_PGR2_PLR5_SU0_SUS0_SRVW4_TT1_96_VAW2_WSGRA1_WSGRB1_WG128_2_1_WGM1
    SolutionIndex: 196
    SolutionNameMin: Cijk_Alik_Bljk_HBH_MT128x256x32_MI32x32x8x1_SE_1LDSB1_AF0EM8_EPS0_GRVW8_GSU1_GSUAMB_LBSPP128_LPA8_LPB8_LRVW8_PGR2_PLR5_SU32_SUS128_SRVW4_TT2_128_VAW2_WSGRA1_WSGRB1_WG64_4_1_WGM15
    SolutionIndex: 197
    SolutionNameMin: Cijk_Alik_Bljk_HBH_MT32x32x32_MI16x16x16x1_SE_1LDSB1_AF0EM1_EPS0_GRVW8_GSU1_GSUAMB_LBSPP128_LPA16_LPB16_LRVW8_PGR2_PLR2_SU0_SUS0_SRVW4_TT1_16_VAW2_WSGRA1_WSGRB1_WG32_8_1_WGM1
    SolutionIndex: 198
    SolutionNameMin: Cijk_Alik_Bljk_HBH_MT32x64x32_MI16x16x16x1_SE_1LDSB1_AF0EM8_EPS0_GRVW2_GSU1_GSUAMB_LBSPP128_LPA16_LPB16_LRVW8_PGR2_PLR2_SU0_SUS0_SRVW4_TT1_32_VAW2_WSGRA1_WSGRB1_WG32_8_1_WGM15
    SolutionIndex: 199
    SolutionNameMin: Cijk_Alik_Bljk_HBH_MT128x64x64_MI32x32x8x1_SE_1LDSB1_AF0EM8_EPS1_GRVW8_GSU1_GSUAMB_LBSPP128_LPA8_LPB8_LRVW8_PGR1_PLR9_SU0_SUS0_SRVW4_TT2_32_VAW2_WSGRA1_WSGRB1_WG64_4_1_WGM15
    SolutionIndex: 200
    SolutionNameMin: Cijk_Alik_Bljk_HBH_MT128x64x64_MI32x32x8x1_SE_1LDSB0_AF0EM8_EPS0_GRVW8_GSU1_GSUAMB_LBSPP128_LPA8_LPB8_LRVW8_PGR2_PLR9_SU32_SUS128_SRVW4_TT2_32_VAW2_WSGRA1_WSGRB1_WG64_4_1_WGM1
    SolutionIndex: 201
    SolutionNameMin: Cijk_Alik_Bljk_HBH_MT128x128x32_MI32x32x8x1_SE_1LDSB1_AF0EM8_EPS1_GRVW4_GSU1_GSUAMB_LBSPP128_LPA8_LPB8_LRVW8_PGR1_PLR5_SU32_SUS128_SRVW4_TT2_64_VAW2_WSGRA1_WSGRB1_WG64_4_1_WGM1
    SolutionIndex: 202
    SolutionNameMin: Cijk_Alik_Bljk_HBH_MT16x16x128_MI16x16x16x1_SE_1LDSB0_AF0EM1_EPS0_GRVW8_GSU1_GSUAMB_LBSPP256_LPA16_LPB16_LRVW8_PGR2_PLR9_SU32_SUS256_SRVW0_TT1_16_VAW2_WSGRA1_WSGRB1_WG16_4_1_WGM2
    SolutionIndex: 203
    SolutionNameMin: Cijk_Alik_Bljk_HBH_MT128x256x32_MI32x32x8x1_SE_1LDSB1_AF0EM8_EPS0_GRVW2_GSU1_GSUAMB_LBSPP128_LPA8_LPB8_LRVW8_PGR2_PLR5_SU0_SUS0_SRVW4_TT2_128_VAW2_WSGRA1_WSGRB1_WG64_4_1_WGM1
    SolutionIndex: 204
    SolutionNameMin: Cijk_Alik_Bljk_HBH_MT160x128x64_MI32x32x8x1_SE_1LDSB1_AF0EM8_EPS1_GRVW8_GSU1_GSUAMB_LBSPP128_LPA8_LPB8_LRVW8_PGR1_PLR9_SU32_SUS128_SRVW0_TT5_32_VAW2_WSGRA1_WSGRB1_WG32_8_1_WGM2
    SolutionIndex: 205
    SolutionNameMin: Cijk_Alik_Bljk_HBH_MT64x128x64_MI32x32x8x1_SE_1LDSB1_AF0EM8_EPS1_GRVW8_GSU1_GSUAMB_LBSPP128_LPA8_LPB8_LRVW8_PGR1_PLR9_SU32_SUS128_SRVW4_TT1_64_VAW2_WSGRA1_WSGRB1_WG64_4_1_WGM2
    SolutionIndex: 206
    SolutionNameMin: Cijk_Alik_Bljk_HBH_MT128x128x32_MI32x32x8x1_SE_1LDSB1_AF0EM8_EPS0_GRVW8_GSU1_GSUAMB_LBSPP128_LPA8_LPB8_LRVW8_PGR2_PLR5_SU0_SUS0_SRVW4_TT2_64_VAW2_WSGRA1_WSGRB1_WG64_4_1_WGM2
    SolutionIndex: 207
    SolutionNameMin: Cijk_Alik_Bljk_HBH_MT64x64x64_MI32x32x8x1_SE_1LDSB1_AF0EM8_EPS1_GRVW8_GSU1_GSUAMB_LBSPP128_LPA8_LPB8_LRVW8_PGR1_PLR9_SU32_SUS128_SRVW4_TT1_32_VAW2_WSGRA1_WSGRB1_WG64_4_1_WGM15
    SolutionIndex: 208
    SolutionNameMin: Cijk_Alik_Bljk_HBH_MT64x128x64_MI32x32x8x1_SE_1LDSB1_AF0EM8_EPS1_GRVW8_GSU1_GSUAMB_LBSPP128_LPA8_LPB8_LRVW8_PGR1_PLR9_SU32_SUS128_SRVW4_TT1_64_VAW2_WSGRA1_WSGRB1_WG64_4_1_WGM15
    SolutionIndex: 209
    SolutionNameMin: Cijk_Alik_Bljk_HBH_MT128x128x32_MI32x32x8x1_SE_1LDSB1_AF0EM8_EPS1_GRVW4_GSU1_GSUAMB_LBSPP128_LPA8_LPB8_LRVW8_PGR1_PLR5_SU32_SUS256_SRVW4_TT2_64_VAW2_WSGRA1_WSGRB1_WG64_4_1_WGM1
    SolutionIndex: 210
    SolutionNameMin: Cijk_Alik_Bljk_HBH_MT64x128x64_MI32x32x8x1_SE_1LDSB1_AF0EM8_EPS1_GRVW8_GSU1_GSUAMB_LBSPP128_LPA8_LPB8_LRVW8_PGR1_PLR9_SU0_SUS0_SRVW4_TT1_64_VAW2_WSGRA1_WSGRB1_WG64_4_1_WGM1
    SolutionIndex: 211
    SolutionNameMin: Cijk_Alik_Bljk_HBH_MT128x96x32_MI32x32x8x1_SE_1LDSB1_AF0EM8_EPS1_GRVW4_GSU1_GSUAMB_LBSPP128_LPA8_LPB8_LRVW8_PGR1_PLR5_SU32_SUS256_SRVW4_TT1_96_VAW2_WSGRA1_WSGRB1_WG128_2_1_WGM2
    SolutionIndex: 212
    SolutionNameMin: Cijk_Alik_Bljk_HBH_MT128x128x32_MI32x32x8x1_SE_1LDSB1_AF0EM1_EPS1_GRVW8_GSU1_GSUAMB_LBSPP128_LPA8_LPB8_LRVW8_PGR1_PLR5_SU32_SUS256_SRVW4_TT2_64_VAW2_WSGRA1_WSGRB1_WG64_4_1_WGM15
    SolutionIndex: 213
    SolutionNameMin: Cijk_Alik_Bljk_HBH_MT128x160x32_MI32x32x8x1_SE_1LDSB1_AF0EM8_EPS1_GRVW4_GSU1_GSUAMB_LBSPP128_LPA8_LPB8_LRVW8_PGR1_PLR5_SU0_SUS0_SRVW4_TT1_160_VAW2_WSGRA1_WSGRB1_WG128_2_1_WGM1
    SolutionIndex: 214
    SolutionNameMin: Cijk_Alik_Bljk_HBH_MT128x256x32_MI32x32x8x1_SE_1LDSB1_AF0EM1_EPS1_GRVW8_GSU1_GSUAMB_LBSPP128_LPA8_LPB8_LRVW8_PGR1_PLR5_SU32_SUS128_SRVW4_TT2_128_VAW2_WSGRA1_WSGRB1_WG64_4_1_WGM15
    SolutionIndex: 215
    SolutionNameMin: Cijk_Alik_Bljk_HBH_MT96x96x64_MI16x16x16x1_SE_1LDSB0_AF0EM8_EPS1_GRVW8_GSU1_GSUAMB_LBSPP128_LPA16_LPB16_LRVW8_PGR1_PLR5_SU32_SUS256_SRVW0_TT3_48_VAW2_WSGRA1_WSGRB1_WG32_8_1_WGM1
    SolutionIndex: 216
    SolutionNameMin: Cijk_Alik_Bljk_HBH_MT128x128x32_MI32x32x8x1_SE_1LDSB1_AF0EM1_EPS1_GRVW2_GSU1_GSUAMB_LBSPP128_LPA8_LPB8_LRVW8_PGR1_PLR5_SU32_SUS128_SRVW4_TT2_64_VAW2_WSGRA1_WSGRB1_WG64_4_1_WGM1
    SolutionIndex: 217
    SolutionNameMin: Cijk_Alik_Bljk_HBH_MT32x32x64_MI16x16x16x1_SE_1LDSB0_AF0EM8_EPS0_GRVW2_GSU1_GSUAMB_LBSPP128_LPA16_LPB16_LRVW8_PGR2_PLR5_SU32_SUS128_SRVW4_TT1_16_VAW2_WSGRA1_WSGRB1_WG32_8_1_WGM1
    SolutionIndex: 218
    SolutionNameMin: Cijk_Alik_Bljk_HBH_MT128x64x32_MI32x32x8x1_SE_1LDSB1_AF0EM8_EPS1_GRVW2_GSU1_GSUAMB_LBSPP128_LPA8_LPB8_LRVW8_PGR1_PLR5_SU32_SUS128_SRVW4_TT2_32_VAW2_WSGRA1_WSGRB1_WG64_4_1_WGM2
    SolutionIndex: 219
    SolutionNameMin: Cijk_Alik_Bljk_HBH_MT32x32x64_MI16x16x16x1_SE_1LDSB0_AF0EM8_EPS0_GRVW8_GSU1_GSUAMB_LBSPP128_LPA16_LPB16_LRVW8_PGR2_PLR5_SU0_SUS0_SRVW4_TT1_16_VAW2_WSGRA1_WSGRB1_WG32_8_1_WGM2
    SolutionIndex: 220
    SolutionNameMin: Cijk_Alik_Bljk_HBH_MT64x128x64_MI32x32x8x1_SE_1LDSB0_AF0EM8_EPS0_GRVW8_GSU1_GSUAMB_LBSPP128_LPA8_LPB8_LRVW8_PGR2_PLR9_SU32_SUS128_SRVW4_TT1_64_VAW2_WSGRA1_WSGRB1_WG64_4_1_WGM2
    SolutionIndex: 221
    SolutionNameMin: Cijk_Alik_Bljk_HBH_MT256x128x64_MI32x32x8x1_SE_1LDSB1_AF0EM8_EPS0_GRVW4_GSU1_GSUAMB_LBSPP128_LPA8_LPB8_LRVW8_PGR2_PLR9_SU32_SUS128_SRVW4_TT4_64_VAW2_WSGRA1_WSGRB1_WG64_4_1_WGM1
    SolutionIndex: 222
    SolutionNameMin: Cijk_Alik_Bljk_HBH_MT128x128x64_MI32x32x8x1_SE_1LDSB1_AF0EM8_EPS0_GRVW8_GSU1_GSUAMB_LBSPP128_LPA8_LPB8_LRVW8_PGR2_PLR9_SU32_SUS128_SRVW4_TT2_64_VAW2_WSGRA1_WSGRB1_WG64_4_1_WGM15
    SolutionIndex: 223
    SolutionNameMin: Cijk_Alik_Bljk_HBH_MT128x256x32_MI32x32x8x1_SE_1LDSB1_AF0EM8_EPS0_GRVW8_GSU1_GSUAMB_LBSPP128_LPA8_LPB8_LRVW8_PGR2_PLR5_SU0_SUS0_SRVW4_TT2_128_VAW2_WSGRA1_WSGRB1_WG64_4_1_WGM15
    SolutionIndex: 224
    SolutionNameMin: Cijk_Alik_Bljk_HBH_MT128x96x32_MI32x32x8x1_SE_1LDSB1_AF0EM8_EPS1_GRVW4_GSU1_GSUAMB_LBSPP128_LPA8_LPB8_LRVW8_PGR1_PLR5_SU32_SUS256_SRVW4_TT1_96_VAW2_WSGRA1_WSGRB1_WG128_2_1_WGM15
    SolutionIndex: 225
    SolutionNameMin: Cijk_Alik_Bljk_HBH_MT64x128x64_MI32x32x8x1_SE_1LDSB1_AF0EM8_EPS1_GRVW8_GSU1_GSUAMB_LBSPP128_LPA8_LPB8_LRVW8_PGR1_PLR9_SU0_SUS0_SRVW4_TT1_64_VAW2_WSGRA1_WSGRB1_WG64_4_1_WGM2
    SolutionIndex: 226
    SolutionNameMin: Cijk_Alik_Bljk_HBH_MT128x128x32_MI32x32x8x1_SE_1LDSB1_AF0EM8_EPS1_GRVW4_GSU1_GSUAMB_LBSPP128_LPA8_LPB8_LRVW8_PGR1_PLR5_SU0_SUS0_SRVW4_TT2_64_VAW2_WSGRA1_WSGRB1_WG64_4_1_WGM2
    SolutionIndex: 227
    SolutionNameMin: Cijk_Alik_Bljk_HBH_MT64x32x64_MI16x16x16x1_SE_1LDSB0_AF0EM1_EPS0_GRVW8_GSU15_GSUAMB_LBSPP128_LPA16_LPB16_LRVW8_PGR2_PLR5_SU32_SUS128_SRVW4_TT2_16_VAW1_WSGRA1_WSGRB1_WG32_8_1_WGM1
    SolutionIndex: 228
    SolutionNameMin: Cijk_Alik_Bljk_HBH_MT128x128x32_MI32x32x8x1_SE_1LDSB1_AF0EM8_EPS0_GRVW8_GSU1_GSUAMB_LBSPP128_LPA8_LPB8_LRVW8_PGR2_PLR5_SU0_SUS0_SRVW4_TT2_64_VAW2_WSGRA1_WSGRB1_WG64_4_1_WGM1
    SolutionIndex: 229
    SolutionNameMin: Cijk_Alik_Bljk_HBH_MT256x128x32_MI32x32x8x1_SE_1LDSB0_AF0EM8_EPS0_GRVW8_GSU1_GSUAMB_LBSPP128_LPA8_LPB8_LRVW8_PGR2_PLR5_SU32_SUS128_SRVW4_TT4_64_VAW2_WSGRA1_WSGRB1_WG64_4_1_WGM15
    SolutionIndex: 230
    SolutionNameMin: Cijk_Alik_Bljk_HBH_MT256x128x32_MI32x32x8x1_SE_1LDSB0_AF0EM8_EPS0_GRVW8_GSU1_GSUAMB_LBSPP128_LPA8_LPB8_LRVW8_PGR2_PLR5_SU0_SUS0_SRVW4_TT4_64_VAW2_WSGRA1_WSGRB1_WG64_4_1_WGM1
    SolutionIndex: 231
    SolutionNameMin: Cijk_Alik_Bljk_HBH_MT128x128x32_MI32x32x8x1_SE_1LDSB0_AF0EM8_EPS0_GRVW8_GSU1_GSUAMB_LBSPP128_LPA8_LPB8_LRVW8_PGR2_PLR5_SU32_SUS256_SRVW4_TT2_64_VAW2_WSGRA1_WSGRB1_WG64_4_1_WGM1
    SolutionIndex: 232
    SolutionNameMin: Cijk_Alik_Bljk_HBH_MT128x64x32_MI32x32x8x1_SE_1LDSB1_AF0EM8_EPS0_GRVW8_GSU1_GSUAMB_LBSPP128_LPA8_LPB8_LRVW8_PGR2_PLR5_SU0_SUS0_SRVW4_TT2_32_VAW2_WSGRA1_WSGRB1_WG64_4_1_WGM15
    SolutionIndex: 233
    SolutionNameMin: Cijk_Alik_Bljk_HBH_MT128x96x64_MI32x32x8x1_SE_1LDSB0_AF0EM8_EPS0_GRVW4_GSU15_GSUAMB_LBSPP128_LPA8_LPB8_LRVW8_PGR2_PLR9_SU0_SUS0_SRVW4_TT1_96_VAW1_WSGRA1_WSGRB1_WG128_2_1_WGM2
    SolutionIndex: 234
    SolutionNameMin: Cijk_Alik_Bljk_HBH_MT128x96x64_MI32x32x8x1_SE_1LDSB0_AF0EM8_EPS0_GRVW4_GSU15_GSUAMB_LBSPP128_LPA8_LPB8_LRVW8_PGR2_PLR9_SU0_SUS0_SRVW4_TT1_96_VAW1_WSGRA1_WSGRB1_WG128_2_1_WGM1
    SolutionIndex: 235
    SolutionNameMin: Cijk_Alik_Bljk_HBH_MT128x96x64_MI32x32x8x1_SE_1LDSB0_AF0EM8_EPS0_GRVW8_GSU15_GSUAMB_LBSPP128_LPA8_LPB8_LRVW8_PGR2_PLR9_SU32_SUS128_SRVW4_TT1_96_VAW1_WSGRA1_WSGRB1_WG128_2_1_WGM1
    SolutionIndex: 236
    SolutionNameMin: Cijk_Alik_Bljk_HBH_MT128x96x64_MI32x32x8x1_SE_1LDSB0_AF0EM8_EPS0_GRVW2_GSU15_GSUAMB_LBSPP128_LPA8_LPB8_LRVW8_PGR2_PLR9_SU0_SUS0_SRVW4_TT1_96_VAW1_WSGRA1_WSGRB1_WG128_2_1_WGM1
    SolutionIndex: 237
    SolutionNameMin: Cijk_Alik_Bljk_HBH_MT64x64x32_MI32x32x8x1_SE_1LDSB1_AF0EM8_EPS0_GRVW4_GSU15_GSUAMB_LBSPP128_LPA8_LPB8_LRVW8_PGR2_PLR5_SU0_SUS0_SRVW4_TT1_32_VAW1_WSGRA1_WSGRB1_WG64_4_1_WGM1
    SolutionIndex: 238
    SolutionNameMin: Cijk_Alik_Bljk_HBH_MT64x32x64_MI16x16x16x1_SE_1LDSB0_AF0EM8_EPS0_GRVW8_GSU7_GSUAMB_LBSPP128_LPA16_LPB16_LRVW8_PGR2_PLR5_SU0_SUS0_SRVW4_TT2_16_VAW1_WSGRA1_WSGRB1_WG32_8_1_WGM1
    SolutionIndex: 239
    SolutionNameMin: Cijk_Alik_Bljk_HBH_MT128x64x64_MI32x32x8x1_SE_1LDSB0_AF0EM8_EPS0_GRVW8_GSU5_GSUAMB_LBSPP128_LPA8_LPB8_LRVW8_PGR2_PLR9_SU32_SUS128_SRVW4_TT2_32_VAW1_WSGRA1_WSGRB1_WG64_4_1_WGM2
    SolutionIndex: 240
    SolutionNameMin: Cijk_Alik_Bljk_HBH_MT128x96x64_MI32x32x8x1_SE_1LDSB1_AF0EM8_EPS0_GRVW8_GSU15_GSUAMB_LBSPP128_LPA8_LPB8_LRVW8_PGR2_PLR9_SU32_SUS128_SRVW4_TT1_96_VAW1_WSGRA1_WSGRB1_WG128_2_1_WGM1
    SolutionIndex: 241
    SolutionNameMin: Cijk_Alik_Bljk_HBH_MT128x96x32_MI32x32x8x1_SE_1LDSB0_AF0EM8_EPS0_GRVW4_GSU7_GSUAMB_LBSPP128_LPA8_LPB8_LRVW8_PGR2_PLR5_SU32_SUS256_SRVW4_TT1_96_VAW1_WSGRA1_WSGRB1_WG128_2_1_WGM1
    SolutionIndex: 242
    SolutionNameMin: Cijk_Alik_Bljk_HBH_MT64x192x32_MI32x32x8x1_SE_1LDSB0_AF0EM8_EPS0_GRVW8_GSU15_GSUAMB_LBSPP128_LPA8_LPB8_LRVW8_PGR2_PLR5_SU0_SUS0_SRVW4_TT1_96_VAW1_WSGRA1_WSGRB1_WG64_4_1_WGM15
    SolutionIndex: 243
    SolutionNameMin: Cijk_Alik_Bljk_HBH_MT128x128x32_MI32x32x8x1_SE_1LDSB0_AF0EM8_EPS0_GRVW8_GSU15_GSUAMB_LBSPP128_LPA8_LPB8_LRVW8_PGR2_PLR5_SU0_SUS0_SRVW4_TT2_64_VAW1_WSGRA1_WSGRB1_WG64_4_1_WGM2
    SolutionIndex: 244
    SolutionNameMin: Cijk_Alik_Bljk_HBH_MT64x128x64_MI32x32x8x1_SE_1LDSB0_AF0EM8_EPS0_GRVW8_GSU7_GSUAMB_LBSPP128_LPA8_LPB8_LRVW8_PGR2_PLR9_SU32_SUS256_SRVW4_TT1_64_VAW1_WSGRA1_WSGRB1_WG64_4_1_WGM1
    SolutionIndex: 245
    SolutionNameMin: Cijk_Alik_Bljk_HBH_MT128x64x64_MI32x32x8x1_SE_1LDSB1_AF0EM8_EPS0_GRVW8_GSU15_GSUAMB_LBSPP128_LPA8_LPB8_LRVW8_PGR2_PLR9_SU0_SUS0_SRVW4_TT2_32_VAW1_WSGRA1_WSGRB1_WG64_4_1_WGM2
    SolutionIndex: 246
    SolutionNameMin: Cijk_Alik_Bljk_HBH_MT64x64x64_MI32x32x8x1_SE_1LDSB0_AF0EM8_EPS0_GRVW8_GSU3_GSUAMB_LBSPP128_LPA8_LPB8_LRVW8_PGR2_PLR9_SU0_SUS0_SRVW4_TT1_32_VAW1_WSGRA1_WSGRB1_WG64_4_1_WGM2
    SolutionIndex: 247
    SolutionNameMin: Cijk_Alik_Bljk_HBH_MT64x64x64_MI32x32x8x1_SE_1LDSB0_AF0EM8_EPS0_GRVW8_GSU3_GSUAMB_LBSPP128_LPA8_LPB8_LRVW8_PGR2_PLR9_SU32_SUS128_SRVW4_TT1_32_VAW1_WSGRA1_WSGRB1_WG64_4_1_WGM1
    SolutionIndex: 248
    SolutionNameMin: Cijk_Alik_Bljk_HBH_MT128x96x64_MI32x32x8x1_SE_1LDSB0_AF0EM8_EPS0_GRVW8_GSU15_GSUAMB_LBSPP128_LPA8_LPB8_LRVW8_PGR2_PLR9_SU0_SUS0_SRVW4_TT1_96_VAW1_WSGRA1_WSGRB1_WG128_2_1_WGM2
    SolutionIndex: 249
    SolutionNameMin: Cijk_Alik_Bljk_HBH_MT128x64x64_MI32x32x8x1_SE_1LDSB1_AF0EM8_EPS0_GRVW8_GSU7_GSUAMB_LBSPP128_LPA8_LPB8_LRVW8_PGR2_PLR9_SU0_SUS0_SRVW4_TT2_32_VAW1_WSGRA1_WSGRB1_WG64_4_1_WGM2
    SolutionIndex: 250
    SolutionNameMin: Cijk_Alik_Bljk_HBH_MT128x64x64_MI32x32x8x1_SE_1LDSB0_AF0EM8_EPS0_GRVW8_GSU7_GSUAMB_LBSPP128_LPA8_LPB8_LRVW8_PGR2_PLR9_SU0_SUS0_SRVW4_TT2_32_VAW1_WSGRA1_WSGRB1_WG64_4_1_WGM1
    SolutionIndex: 251
    SolutionNameMin: Cijk_Alik_Bljk_HBH_MT32x32x64_MI16x16x16x1_SE_1LDSB0_AF0EM8_EPS0_GRVW8_GSU7_GSUAMB_LBSPP128_LPA16_LPB16_LRVW8_PGR2_PLR5_SU32_SUS256_SRVW4_TT1_16_VAW1_WSGRA1_WSGRB1_WG32_8_1_WGM1
    SolutionIndex: 252
    SolutionNameMin: Cijk_Alik_Bljk_HBH_MT64x64x64_MI32x32x8x1_SE_1LDSB0_AF0EM8_EPS0_GRVW4_GSU1_GSUAMB_LBSPP128_LPA8_LPB8_LRVW8_PGR2_PLR9_SU0_SUS0_SRVW4_TT1_32_VAW2_WSGRA1_WSGRB1_WG64_4_1_WGM1
    SolutionIndex: 253
    SolutionNameMin: Cijk_Alik_Bljk_HBH_MT32x32x64_MI16x16x16x1_SE_1LDSB0_AF0EM8_EPS0_GRVW4_GSU7_GSUAMB_LBSPP128_LPA16_LPB16_LRVW8_PGR2_PLR5_SU0_SUS0_SRVW4_TT1_16_VAW1_WSGRA1_WSGRB1_WG32_8_1_WGM1
    SolutionIndex: 254
    SolutionNameMin: Cijk_Alik_Bljk_HBH_MT128x96x32_MI32x32x8x1_SE_1LDSB0_AF0EM8_EPS0_GRVW2_GSU15_GSUAMB_LBSPP128_LPA8_LPB8_LRVW8_PGR2_PLR5_SU0_SUS0_SRVW4_TT1_96_VAW1_WSGRA1_WSGRB1_WG128_2_1_WGM15
    SolutionIndex: 255
    SolutionNameMin: Cijk_Alik_Bljk_HBH_MT128x96x32_MI32x32x8x1_SE_1LDSB0_AF0EM8_EPS0_GRVW4_GSU1_GSUAMB_LBSPP128_LPA8_LPB8_LRVW8_PGR2_PLR5_SU0_SUS0_SRVW4_TT1_96_VAW2_WSGRA1_WSGRB1_WG128_2_1_WGM15
    SolutionIndex: 256
    SolutionNameMin: Cijk_Alik_Bljk_HBH_MT16x16x128_MI16x16x16x1_SE_1LDSB1_AF0EM8_EPS1_GRVW8_GSU15_GSUAMB_LBSPP256_LPA16_LPB16_LRVW8_PGR1_PLR9_SU32_SUS256_SRVW4_TT1_16_VAW1_WSGRA1_WSGRB1_WG16_4_1_WGM15
    SolutionIndex: 257
    SolutionNameMin: Cijk_Alik_Bljk_HBH_MT128x96x32_MI32x32x8x1_SE_1LDSB0_AF0EM8_EPS0_GRVW4_GSU1_GSUAMB_LBSPP128_LPA8_LPB8_LRVW8_PGR2_PLR5_SU32_SUS128_SRVW4_TT1_96_VAW2_WSGRA1_WSGRB1_WG128_2_1_WGM15
    SolutionIndex: 258
    SolutionNameMin: Cijk_Alik_Bljk_HBH_MT64x192x32_MI32x32x8x1_SE_1LDSB0_AF0EM8_EPS0_GRVW8_GSU1_GSUAMB_LBSPP128_LPA8_LPB8_LRVW8_PGR2_PLR5_SU32_SUS128_SRVW4_TT1_96_VAW2_WSGRA1_WSGRB1_WG64_4_1_WGM15
    SolutionIndex: 259
    SolutionNameMin: Cijk_Alik_Bljk_HBH_MT128x128x32_MI32x32x8x1_SE_1LDSB0_AF0EM8_EPS0_GRVW4_GSU1_GSUAMB_LBSPP128_LPA8_LPB8_LRVW8_PGR2_PLR5_SU32_SUS256_SRVW4_TT2_64_VAW2_WSGRA1_WSGRB1_WG64_4_1_WGM2
    SolutionIndex: 260
    SolutionNameMin: Cijk_Alik_Bljk_HBH_MT16x64x64_MI16x16x16x1_SE_1LDSB0_AF0EM8_EPS0_GRVW8_GSU1_GSUAMB_LBSPP128_LPA16_LPB16_LRVW8_PGR2_PLR5_SU0_SUS0_SRVW0_TT1_16_VAW2_WSGRA1_WSGRB1_WG16_16_1_WGM2
    SolutionIndex: 261
    SolutionNameMin: Cijk_Alik_Bljk_HBH_MT128x64x32_MI32x32x8x1_SE_1LDSB0_AF0EM8_EPS0_GRVW4_GSU1_GSUAMB_LBSPP128_LPA8_LPB8_LRVW8_PGR2_PLR5_SU0_SUS0_SRVW4_TT2_32_VAW2_WSGRA1_WSGRB1_WG64_4_1_WGM15
    SolutionIndex: 262
    SolutionNameMin: Cijk_Alik_Bljk_HBH_MT128x128x32_MI32x32x8x1_SE_1LDSB1_AF0EM8_EPS1_GRVW2_GSU1_GSUAMB_LBSPP128_LPA8_LPB8_LRVW8_PGR1_PLR5_SU0_SUS0_SRVW4_TT2_64_VAW2_WSGRA1_WSGRB1_WG64_4_1_WGM15
    SolutionIndex: 263
    SolutionNameMin: Cijk_Alik_Bljk_HBH_MT128x128x32_MI32x32x8x1_SE_1LDSB1_AF0EM8_EPS0_GRVW2_GSU1_GSUAMB_LBSPP128_LPA8_LPB8_LRVW8_PGR2_PLR5_SU32_SUS256_SRVW4_TT2_64_VAW2_WSGRA1_WSGRB1_WG64_4_1_WGM1
    SolutionIndex: 264
    SolutionNameMin: Cijk_Alik_Bljk_HBH_MT256x128x32_MI32x32x8x1_SE_1LDSB1_AF0EM8_EPS0_GRVW8_GSU1_GSUAMB_LBSPP128_LPA8_LPB8_LRVW8_PGR2_PLR5_SU0_SUS0_SRVW4_TT4_64_VAW2_WSGRA1_WSGRB1_WG64_4_1_WGM15
    SolutionIndex: 265
    SolutionNameMin: Cijk_Alik_Bljk_HBH_MT128x128x32_MI32x32x8x1_SE_1LDSB1_AF0EM8_EPS0_GRVW2_GSU1_GSUAMB_LBSPP128_LPA8_LPB8_LRVW8_PGR2_PLR5_SU0_SUS0_SRVW4_TT2_64_VAW2_WSGRA1_WSGRB1_WG64_4_1_WGM15
    SolutionIndex: 266
    SolutionNameMin: Cijk_Alik_Bljk_HBH_MT128x160x32_MI32x32x8x1_SE_1LDSB0_AF0EM8_EPS0_GRVW4_GSU1_GSUAMB_LBSPP128_LPA8_LPB8_LRVW8_PGR2_PLR5_SU0_SUS0_SRVW4_TT1_160_VAW2_WSGRA1_WSGRB1_WG128_2_1_WGM15
    SolutionIndex: 267
    SolutionNameMin: Cijk_Alik_Bljk_HBH_MT128x96x32_MI32x32x8x1_SE_1LDSB0_AF0EM8_EPS0_GRVW2_GSU1_GSUAMB_LBSPP128_LPA8_LPB8_LRVW8_PGR2_PLR5_SU0_SUS0_SRVW4_TT1_96_VAW2_WSGRA1_WSGRB1_WG128_2_1_WGM15
    SolutionIndex: 268
    SolutionNameMin: Cijk_Alik_Bljk_HBH_MT64x64x64_MI32x32x8x1_SE_1LDSB1_AF0EM8_EPS1_GRVW4_GSU1_GSUAMB_LBSPP128_LPA8_LPB8_LRVW8_PGR1_PLR9_SU0_SUS0_SRVW4_TT1_32_VAW2_WSGRA1_WSGRB1_WG64_4_1_WGM1
    SolutionIndex: 269
    SolutionNameMin: Cijk_Alik_Bljk_HBH_MT128x64x32_MI32x32x8x1_SE_1LDSB1_AF0EM8_EPS1_GRVW2_GSU1_GSUAMB_LBSPP128_LPA8_LPB8_LRVW8_PGR1_PLR5_SU0_SUS0_SRVW4_TT2_32_VAW2_WSGRA1_WSGRB1_WG64_4_1_WGM2
    SolutionIndex: 270
    SolutionNameMin: Cijk_Alik_Bljk_HBH_MT128x64x32_MI32x32x8x1_SE_1LDSB1_AF0EM8_EPS1_GRVW2_GSU1_GSUAMB_LBSPP128_LPA8_LPB8_LRVW8_PGR1_PLR5_SU0_SUS0_SRVW4_TT2_32_VAW2_WSGRA1_WSGRB1_WG64_4_1_WGM15
    SolutionIndex: 271
    SolutionNameMin: Cijk_Alik_Bljk_HBH_MT64x64x32_MI32x32x8x1_SE_1LDSB1_AF0EM8_EPS0_GRVW8_GSU1_GSUAMB_LBSPP128_LPA8_LPB8_LRVW8_PGR2_PLR5_SU0_SUS0_SRVW4_TT1_32_VAW2_WSGRA1_WSGRB1_WG64_4_1_WGM15
    SolutionIndex: 272
    SolutionNameMin: Cijk_Alik_Bljk_HBH_MT64x32x32_MI16x16x16x1_SE_1LDSB1_AF0EM8_EPS0_GRVW2_GSU1_GSUAMB_LBSPP128_LPA16_LPB16_LRVW8_PGR2_PLR2_SU0_SUS0_SRVW4_TT2_16_VAW2_WSGRA1_WSGRB1_WG32_8_1_WGM2
    SolutionIndex: 273
    SolutionNameMin: Cijk_Alik_Bljk_HBH_MT128x128x32_MI32x32x8x1_SE_1LDSB1_AF0EM8_EPS0_GRVW4_GSU1_GSUAMB_LBSPP128_LPA8_LPB8_LRVW8_PGR2_PLR5_SU32_SUS128_SRVW4_TT2_64_VAW2_WSGRA1_WSGRB1_WG64_4_1_WGM15
    SolutionIndex: 274
    SolutionNameMin: Cijk_Alik_Bljk_HBH_MT128x64x32_MI32x32x8x1_SE_1LDSB1_AF0EM8_EPS1_GRVW8_GSU1_GSUAMB_LBSPP128_LPA8_LPB8_LRVW8_PGR1_PLR5_SU0_SUS0_SRVW4_TT2_32_VAW2_WSGRA1_WSGRB1_WG64_4_1_WGM2
    SolutionIndex: 275
    SolutionNameMin: Cijk_Alik_Bljk_HBH_MT256x128x32_MI32x32x8x1_SE_1LDSB0_AF0EM8_EPS0_GRVW8_GSU1_GSUAMB_LBSPP128_LPA8_LPB8_LRVW8_PGR2_PLR5_SU0_SUS0_SRVW4_TT4_64_VAW2_WSGRA1_WSGRB1_WG64_4_1_WGM15
    SolutionIndex: 276
    SolutionNameMin: Cijk_Alik_Bljk_HBH_MT128x64x32_MI32x32x8x1_SE_1LDSB1_AF0EM8_EPS1_GRVW2_GSU1_GSUAMB_LBSPP128_LPA8_LPB8_LRVW8_PGR1_PLR5_SU32_SUS256_SRVW4_TT2_32_VAW2_WSGRA1_WSGRB1_WG64_4_1_WGM1
    SolutionIndex: 277
    SolutionNameMin: Cijk_Alik_Bljk_HBH_MT128x128x64_MI32x32x8x1_SE_1LDSB1_AF0EM8_EPS0_GRVW8_GSU1_GSUAMB_LBSPP128_LPA8_LPB8_LRVW8_PGR2_PLR9_SU32_SUS128_SRVW4_TT2_64_VAW2_WSGRA1_WSGRB1_WG64_4_1_WGM1
    SolutionIndex: 278
    SolutionNameMin: Cijk_Alik_Bljk_HBH_MT128x256x32_MI32x32x8x1_SE_1LDSB1_AF0EM8_EPS0_GRVW4_GSU1_GSUAMB_LBSPP128_LPA8_LPB8_LRVW8_PGR2_PLR5_SU0_SUS0_SRVW4_TT2_128_VAW2_WSGRA1_WSGRB1_WG64_4_1_WGM2
    SolutionIndex: 279
    SolutionNameMin: Cijk_Alik_Bljk_HBH_MT256x128x32_MI32x32x8x1_SE_1LDSB1_AF0EM8_EPS0_GRVW4_GSU1_GSUAMB_LBSPP128_LPA8_LPB8_LRVW8_PGR2_PLR5_SU32_SUS256_SRVW4_TT4_64_VAW2_WSGRA1_WSGRB1_WG64_4_1_WGM1
    SolutionIndex: 280
    SolutionNameMin: Cijk_Alik_Bljk_HBH_MT128x256x32_MI32x32x8x1_SE_1LDSB1_AF0EM8_EPS0_GRVW8_GSU1_GSUAMB_LBSPP128_LPA8_LPB8_LRVW8_PGR2_PLR5_SU0_SUS0_SRVW4_TT2_128_VAW2_WSGRA1_WSGRB1_WG64_4_1_WGM2
    SolutionIndex: 281
    SolutionNameMin: Cijk_Alik_Bljk_HBH_MT128x128x32_MI32x32x8x1_SE_1LDSB1_AF0EM1_EPS0_GRVW8_GSU1_GSUAMB_LBSPP128_LPA8_LPB8_LRVW8_PGR2_PLR5_SU0_SUS0_SRVW4_TT2_64_VAW2_WSGRA1_WSGRB1_WG64_4_1_WGM15
    SolutionIndex: 282
    SolutionNameMin: Cijk_Alik_Bljk_HBH_MT128x256x32_MI32x32x8x1_SE_1LDSB1_AF0EM1_EPS1_GRVW8_GSU1_GSUAMB_LBSPP128_LPA8_LPB8_LRVW8_PGR1_PLR5_SU0_SUS0_SRVW4_TT2_128_VAW2_WSGRA1_WSGRB1_WG64_4_1_WGM2
    SolutionIndex: 283
    SolutionNameMin: Cijk_Alik_Bljk_HBH_MT128x128x32_MI32x32x8x1_SE_1LDSB1_AF0EM8_EPS1_GRVW4_GSU1_GSUAMB_LBSPP128_LPA8_LPB8_LRVW8_PGR1_PLR5_SU0_SUS0_SRVW4_TT2_64_VAW2_WSGRA1_WSGRB1_WG64_4_1_WGM15
    SolutionIndex: 284
    SolutionNameMin: Cijk_Alik_Bljk_HBH_MT256x256x32_MI32x32x8x1_SE_1LDSB1_AF0EM1_EPS1_GRVW2_GSU1_GSUAMB_LBSPP128_LPA8_LPB8_LRVW8_PGR1_PLR5_SU0_SUS0_SRVW4_TT4_128_VAW2_WSGRA1_WSGRB1_WG64_4_1_WGM2
    SolutionIndex: 285
    SolutionNameMin: Cijk_Alik_Bljk_HBH_MT128x256x32_MI32x32x8x1_SE_1LDSB1_AF0EM1_EPS1_GRVW8_GSU1_GSUAMB_LBSPP128_LPA8_LPB8_LRVW8_PGR1_PLR5_SU0_SUS0_SRVW4_TT2_128_VAW2_WSGRA1_WSGRB1_WG64_4_1_WGM1
    SolutionIndex: 286
    SolutionNameMin: Cijk_Alik_Bljk_HBH_MT64x64x32_MI32x32x8x1_SE_1LDSB1_AF0EM1_EPS0_GRVW2_GSU1_GSUAMB_LBSPP128_LPA8_LPB8_LRVW8_PGR2_PLR5_SU32_SUS256_SRVW4_TT1_32_VAW2_WSGRA1_WSGRB1_WG64_4_1_WGM15
    SolutionIndex: 287
    SolutionNameMin: Cijk_Alik_Bljk_HBH_MT64x128x32_MI32x32x8x1_SE_1LDSB1_AF0EM1_EPS1_GRVW2_GSU1_GSUAMB_LBSPP128_LPA8_LPB8_LRVW8_PGR1_PLR5_SU32_SUS128_SRVW4_TT1_64_VAW2_WSGRA1_WSGRB1_WG64_4_1_WGM2
    SolutionIndex: 288
    SolutionNameMin: Cijk_Alik_Bljk_HBH_MT64x128x32_MI32x32x8x1_SE_1LDSB1_AF0EM1_EPS1_GRVW2_GSU1_GSUAMB_LBSPP128_LPA8_LPB8_LRVW8_PGR1_PLR5_SU32_SUS128_SRVW4_TT1_64_VAW2_WSGRA1_WSGRB1_WG64_4_1_WGM15
    SolutionIndex: 289
    SolutionNameMin: Cijk_Alik_Bljk_HBH_MT128x256x32_MI32x32x8x1_SE_1LDSB0_AF0EM1_EPS0_GRVW8_GSU1_GSUAMB_LBSPP128_LPA8_LPB8_LRVW8_PGR2_PLR5_SU0_SUS0_SRVW4_TT2_128_VAW2_WSGRA1_WSGRB1_WG64_4_1_WGM15
    SolutionIndex: 290
    SolutionNameMin: Cijk_Alik_Bljk_HBH_MT64x64x32_MI32x32x8x1_SE_1LDSB1_AF0EM1_EPS1_GRVW8_GSU1_GSUAMB_LBSPP128_LPA8_LPB8_LRVW8_PGR1_PLR5_SU0_SUS0_SRVW4_TT1_32_VAW2_WSGRA1_WSGRB1_WG64_4_1_WGM15
    SolutionIndex: 291
    SolutionNameMin: Cijk_Alik_Bljk_HBH_MT64x64x32_MI32x32x8x1_SE_1LDSB1_AF0EM1_EPS1_GRVW4_GSU1_GSUAMB_LBSPP128_LPA8_LPB8_LRVW8_PGR1_PLR5_SU0_SUS0_SRVW4_TT1_32_VAW2_WSGRA1_WSGRB1_WG64_4_1_WGM2
    SolutionIndex: 292
    SolutionNameMin: Cijk_Alik_Bljk_HBH_MT64x64x32_MI32x32x8x1_SE_1LDSB1_AF0EM1_EPS0_GRVW4_GSU1_GSUAMB_LBSPP128_LPA8_LPB8_LRVW8_PGR2_PLR5_SU32_SUS128_SRVW4_TT1_32_VAW2_WSGRA1_WSGRB1_WG64_4_1_WGM15
    SolutionIndex: 293
    SolutionNameMin: Cijk_Alik_Bljk_HBH_MT128x128x32_MI32x32x8x1_SE_1LDSB1_AF0EM1_EPS1_GRVW8_GSU1_GSUAMB_LBSPP128_LPA8_LPB8_LRVW8_PGR1_PLR5_SU0_SUS0_SRVW4_TT2_64_VAW2_WSGRA1_WSGRB1_WG64_4_1_WGM15
    SolutionIndex: 294
    SolutionNameMin: Cijk_Alik_Bljk_HBH_MT64x128x32_MI32x32x8x1_SE_1LDSB1_AF0EM1_EPS1_GRVW8_GSU1_GSUAMB_LBSPP128_LPA8_LPB8_LRVW8_PGR1_PLR5_SU0_SUS0_SRVW4_TT1_64_VAW2_WSGRA1_WSGRB1_WG64_4_1_WGM2
    SolutionIndex: 295
    SolutionNameMin: Cijk_Alik_Bljk_HBH_MT64x64x32_MI32x32x8x1_SE_1LDSB1_AF0EM1_EPS0_GRVW2_GSU1_GSUAMB_LBSPP128_LPA8_LPB8_LRVW8_PGR2_PLR5_SU32_SUS128_SRVW4_TT1_32_VAW2_WSGRA1_WSGRB1_WG64_4_1_WGM15
    SolutionIndex: 296
    SolutionNameMin: Cijk_Alik_Bljk_HBH_MT64x64x32_MI32x32x8x1_SE_1LDSB1_AF0EM1_EPS1_GRVW2_GSU1_GSUAMB_LBSPP128_LPA8_LPB8_LRVW8_PGR1_PLR5_SU32_SUS256_SRVW4_TT1_32_VAW2_WSGRA1_WSGRB1_WG64_4_1_WGM15
    SolutionIndex: 297
    SolutionNameMin: Cijk_Alik_Bljk_HBH_MT64x64x32_MI32x32x8x1_SE_1LDSB1_AF0EM1_EPS1_GRVW2_GSU1_GSUAMB_LBSPP128_LPA8_LPB8_LRVW8_PGR1_PLR5_SU0_SUS0_SRVW4_TT1_32_VAW2_WSGRA1_WSGRB1_WG64_4_1_WGM2
    SolutionIndex: 298
    SolutionNameMin: Cijk_Alik_Bljk_HBH_MT128x128x32_MI32x32x8x1_SE_1LDSB1_AF0EM1_EPS1_GRVW4_GSU1_GSUAMB_LBSPP128_LPA8_LPB8_LRVW8_PGR1_PLR5_SU0_SUS0_SRVW4_TT2_64_VAW2_WSGRA1_WSGRB1_WG64_4_1_WGM15
    SolutionIndex: 299
    SolutionNameMin: Cijk_Alik_Bljk_HBH_MT128x192x32_MI32x32x8x1_SE_1LDSB1_AF0EM1_EPS0_GRVW2_GSU1_GSUAMB_LBSPP128_LPA8_LPB8_LRVW8_PGR2_PLR5_SU0_SUS0_SRVW4_TT2_96_VAW2_WSGRA1_WSGRB1_WG64_4_1_WGM15
    SolutionIndex: 300
    SolutionNameMin: Cijk_Alik_Bljk_HBH_MT64x128x32_MI32x32x8x1_SE_1LDSB1_AF0EM1_EPS1_GRVW2_GSU1_GSUAMB_LBSPP128_LPA8_LPB8_LRVW8_PGR1_PLR5_SU32_SUS256_SRVW4_TT1_64_VAW2_WSGRA1_WSGRB1_WG64_4_1_WGM2
    SolutionIndex: 301
    SolutionNameMin: Cijk_Alik_Bljk_HBH_MT64x128x32_MI32x32x8x1_SE_1LDSB1_AF0EM1_EPS0_GRVW8_GSU1_GSUAMB_LBSPP128_LPA8_LPB8_LRVW8_PGR2_PLR5_SU0_SUS0_SRVW4_TT1_64_VAW2_WSGRA1_WSGRB1_WG64_4_1_WGM2
    SolutionIndex: 302
    SolutionNameMin: Cijk_Alik_Bljk_HBH_MT128x256x32_MI32x32x8x1_SE_1LDSB1_AF0EM1_EPS1_GRVW2_GSU1_GSUAMB_LBSPP128_LPA8_LPB8_LRVW8_PGR1_PLR5_SU0_SUS0_SRVW4_TT2_128_VAW2_WSGRA1_WSGRB1_WG64_4_1_WGM15
    SolutionIndex: 303
    SolutionNameMin: Cijk_Alik_Bljk_HBH_MT128x128x32_MI32x32x8x1_SE_1LDSB1_AF0EM1_EPS1_GRVW2_GSU1_GSUAMB_LBSPP128_LPA8_LPB8_LRVW8_PGR1_PLR5_SU0_SUS0_SRVW4_TT2_64_VAW2_WSGRA1_WSGRB1_WG64_4_1_WGM15
    SolutionIndex: 304
    SolutionNameMin: Cijk_Alik_Bljk_HBH_MT128x128x32_MI32x32x8x1_SE_1LDSB1_AF0EM1_EPS0_GRVW2_GSU1_GSUAMB_LBSPP128_LPA8_LPB8_LRVW8_PGR2_PLR5_SU32_SUS128_SRVW4_TT2_64_VAW2_WSGRA1_WSGRB1_WG64_4_1_WGM15
    SolutionIndex: 305
    SolutionNameMin: Cijk_Alik_Bljk_HBH_MT64x32x64_MI16x16x16x1_SE_1LDSB0_AF0EM1_EPS0_GRVW8_GSU15_GSUAMB_LBSPP128_LPA16_LPB16_LRVW8_PGR2_PLR5_SU32_SUS128_SRVW4_TT2_16_VAW1_WSGRA1_WSGRB1_WG32_8_1_WGM15
    SolutionIndex: 306
    SolutionNameMin: Cijk_Alik_Bljk_HBH_MT64x64x64_MI32x32x8x1_SE_1LDSB1_AF0EM1_EPS1_GRVW8_GSU1_GSUAMB_LBSPP128_LPA8_LPB8_LRVW8_PGR1_PLR9_SU32_SUS128_SRVW4_TT1_32_VAW2_WSGRA1_WSGRB1_WG64_4_1_WGM1
    SolutionIndex: 307
    SolutionNameMin: Cijk_Alik_Bljk_HBH_MT16x16x32_MI16x16x16x1_SE_1LDSB1_AF0EM1_EPS1_GRVW8_GSU1_GSUAMB_LBSPP128_LPA16_LPB16_LRVW8_PGR1_PLR2_SU0_SUS0_SRVW0_TT1_16_VAW2_WSGRA1_WSGRB1_WG16_4_1_WGM1
    SolutionIndex: 308
    SolutionNameMin: Cijk_Alik_Bljk_HBH_MT16x16x32_MI16x16x16x1_SE_1LDSB1_AF0EM1_EPS0_GRVW8_GSU1_GSUAMB_LBSPP128_LPA16_LPB16_LRVW8_PGR2_PLR2_SU0_SUS0_SRVW0_TT1_16_VAW2_WSGRA1_WSGRB1_WG16_4_1_WGM1
    SolutionIndex: 309
    SolutionNameMin: Cijk_Alik_Bljk_HBH_MT32x32x32_MI16x16x16x1_SE_1LDSB1_AF0EM1_EPS0_GRVW4_GSU1_GSUAMB_LBSPP128_LPA16_LPB16_LRVW8_PGR2_PLR2_SU0_SUS0_SRVW4_TT1_16_VAW2_WSGRA1_WSGRB1_WG32_8_1_WGM1
    SolutionIndex: 310
    SolutionNameMin: Cijk_Alik_Bljk_HBH_MT32x32x32_MI16x16x16x1_SE_1LDSB1_AF0EM1_EPS0_GRVW8_GSU1_GSUAMB_LBSPP128_LPA16_LPB16_LRVW8_PGR2_PLR2_SU0_SUS0_SRVW4_TT1_16_VAW2_WSGRA1_WSGRB1_WG32_8_1_WGM1
    SolutionIndex: 311
    SolutionNameMin: Cijk_Alik_Bljk_HBH_MT32x32x32_MI16x16x16x1_SE_1LDSB0_AF0EM1_EPS0_GRVW2_GSU1_GSUAMB_LBSPP128_LPA16_LPB16_LRVW8_PGR2_PLR2_SU0_SUS0_SRVW4_TT1_16_VAW2_WSGRA1_WSGRB1_WG32_8_1_WGM1
    SolutionIndex: 312
    SolutionNameMin: Cijk_Alik_Bljk_HBH_MT16x16x32_MI16x16x16x1_SE_1LDSB1_AF0EM1_EPS0_GRVW2_GSU1_GSUAMB_LBSPP128_LPA16_LPB16_LRVW8_PGR2_PLR2_SU32_SUS256_SRVW0_TT1_16_VAW2_WSGRA1_WSGRB1_WG16_4_1_WGM2
    SolutionIndex: 313
    SolutionNameMin: Cijk_Alik_Bljk_HBH_MT32x32x32_MI16x16x16x1_SE_1LDSB1_AF0EM8_EPS0_GRVW2_GSU1_GSUAMB_LBSPP128_LPA16_LPB16_LRVW8_PGR2_PLR2_SU0_SUS0_SRVW4_TT1_16_VAW2_WSGRA1_WSGRB1_WG32_8_1_WGM1
    SolutionIndex: 314
    SolutionNameMin: Cijk_Alik_Bljk_HBH_MT16x16x32_MI16x16x16x1_SE_1LDSB1_AF0EM1_EPS0_GRVW2_GSU1_GSUAMB_LBSPP128_LPA16_LPB16_LRVW8_PGR2_PLR2_SU0_SUS0_SRVW0_TT1_16_VAW2_WSGRA1_WSGRB1_WG16_4_1_WGM2
    SolutionIndex: 315
    SolutionNameMin: Cijk_Alik_Bljk_HBH_MT32x32x32_MI16x16x16x1_SE_1LDSB0_AF0EM1_EPS1_GRVW2_GSU1_GSUAMB_LBSPP128_LPA16_LPB16_LRVW8_PGR1_PLR2_SU0_SUS0_SRVW4_TT1_16_VAW2_WSGRA1_WSGRB1_WG32_8_1_WGM1
    SolutionIndex: 316
    SolutionNameMin: Cijk_Alik_Bljk_HBH_MT16x16x32_MI16x16x16x1_SE_1LDSB1_AF0EM1_EPS0_GRVW2_GSU1_GSUAMB_LBSPP128_LPA16_LPB16_LRVW8_PGR2_PLR2_SU0_SUS0_SRVW0_TT1_16_VAW2_WSGRA1_WSGRB1_WG16_4_1_WGM15
    SolutionIndex: 317
    SolutionNameMin: Cijk_Alik_Bljk_HBH_MT64x16x32_MI16x16x16x1_SE_1LDSB1_AF0EM1_EPS1_GRVW8_GSU1_GSUAMB_LBSPP128_LPA16_LPB16_LRVW8_PGR1_PLR2_SU0_SUS0_SRVW0_TT1_16_VAW2_WSGRA1_WSGRB1_WG64_4_1_WGM1
    SolutionIndex: 318
    SolutionNameMin: Cijk_Alik_Bljk_HBH_MT16x64x32_MI16x16x16x1_SE_1LDSB1_AF0EM8_EPS0_GRVW8_GSU1_GSUAMB_LBSPP128_LPA16_LPB16_LRVW8_PGR2_PLR2_SU0_SUS0_SRVW0_TT1_16_VAW2_WSGRA1_WSGRB1_WG16_16_1_WGM1
    SolutionIndex: 319
    SolutionNameMin: Cijk_Alik_Bljk_HBH_MT32x32x32_MI16x16x16x1_SE_1LDSB1_AF0EM1_EPS1_GRVW4_GSU1_GSUAMB_LBSPP128_LPA16_LPB16_LRVW8_PGR1_PLR2_SU0_SUS0_SRVW4_TT1_16_VAW2_WSGRA1_WSGRB1_WG32_8_1_WGM1
    SolutionIndex: 320
    SolutionNameMin: Cijk_Alik_Bljk_HBH_MT32x64x64_MI16x16x16x1_SE_1LDSB1_AF0EM8_EPS1_GRVW8_GSU1_GSUAMB_LBSPP128_LPA16_LPB16_LRVW8_PGR1_PLR5_SU0_SUS0_SRVW4_TT1_32_VAW2_WSGRA1_WSGRB1_WG32_8_1_WGM2
    SolutionIndex: 321
    SolutionNameMin: Cijk_Alik_Bljk_HBH_MT64x32x64_MI16x16x16x1_SE_1LDSB1_AF0EM8_EPS1_GRVW8_GSU1_GSUAMB_LBSPP128_LPA16_LPB16_LRVW8_PGR1_PLR5_SU0_SUS0_SRVW4_TT2_16_VAW2_WSGRA1_WSGRB1_WG32_8_1_WGM1
- - - [2368, 1024, 1, 1]
    - [1, 0.142]
  - - [448, 1, 1, 256]
    - [2, 0.013]
  - - [5056, 1408, 1, 3328]
    - [3, 84.149]
  - - [5056, 1856, 1, 3328]
    - [4, 82.925]
  - - [5888, 128, 1, 1]
    - [5, 0.06]
  - - [448, 3584, 1, 3328]
    - [6, 69.841]
  - - [704, 64, 1, 3328]
    - [7, 8.322]
  - - [5056, 4288, 1, 32]
    - [8, 11.344]
  - - [3584, 1024, 1, 256]
    - [9, 30.771]
  - - [32, 5056, 1, 1280]
    - [10, 12.891]
  - - [1856, 256, 1, 1]
    - [11, 0.04]
  - - [256, 1856, 1, 32]
    - [12, 1.404]
  - - [1408, 3584, 1, 3328]
    - [13, 83.133]
  - - [128, 3584, 1, 1280]
    - [14, 24.594]
  - - [1024, 2368, 1, 3328]
    - [15, 76.403]
  - - [4288, 64, 1, 3328]
    - [16, 27.007]
  - - [1, 4288, 1, 1280]
    - [17, 0.394]
  - - [2368, 64, 1, 1]
    - [11, 0.015]
  - - [256, 128, 1, 256]
    - [2, 0.909]
  - - [448, 64, 1, 1]
    - [18, 0.003]
  - - [32, 1408, 1, 32]
    - [18, 0.185]
  - - [448, 3584, 1, 32]
    - [8, 4.225]
  - - [64, 1024, 1, 1280]
    - [19, 6.563]
  - - [1, 1408, 1, 3328]
    - [20, 0.268]
  - - [1408, 128, 1, 32]
    - [12, 0.619]
  - - [4288, 6784, 1, 3328]
    - [21, 90.464]
  - - [1024, 1, 1, 3328]
    - [22, 0.198]
  - - [2944, 128, 1, 32]
    - [11, 1.132]
  - - [64, 6784, 1, 1]
    - [11, 0.036]
  - - [1024, 64, 1, 1280]
    - [23, 6.609]
  - - [448, 128, 1, 256]
    - [24, 1.606]
  - - [64, 5056, 1, 3328]
    - [25, 29.306]
  - - [5888, 4288, 1, 3328]
    - [21, 90.641]
  - - [1, 2368, 1, 1280]
    - [26, 0.242]
  - - [704, 1024, 1, 1]
    - [5, 0.058]
  - - [2368, 1408, 1, 32]
    - [5, 6.428]
  - - [256, 1856, 1, 1280]
    - [27, 26.558]
  - - [1024, 2944, 1, 1]
    - [28, 0.144]
  - - [2944, 3584, 1, 3328]
    - [21, 87.662]
  - - [2368, 2944, 1, 1280]
    - [29, 72.017]
  - - [256, 1408, 1, 1]
    - [11, 0.034]
  - - [1, 1024, 1, 3328]
    - [30, 0.195]
  - - [6784, 5888, 1, 3328]
    - [21, 90.737]
  - - [3584, 1408, 1, 32]
    - [31, 7.079]
  - - [5056, 256, 1, 256]
    - [32, 21.091]
  - - [1856, 2368, 1, 256]
    - [33, 34.921]
  - - [2368, 1024, 1, 3328]
    - [9, 76.725]
  - - [3584, 4288, 1, 32]
    - [31, 9.143]
  - - [1024, 1024, 1, 1280]
    - [34, 41.203]
  - - [3584, 3584, 1, 1]
    - [35, 0.227]
  - - [32, 2944, 1, 3328]
    - [17, 16.129]
  - - [704, 1408, 1, 3328]
    - [36, 55.973]
  - - [1408, 704, 1, 256]
    - [34, 16.061]
  - - [704, 64, 1, 32]
    - [11, 0.179]
  - - [5888, 1, 1, 3328]
    - [7, 0.783]
  - - [2368, 32, 1, 256]
    - [37, 2.005]
  - - [6784, 128, 1, 3328]
    - [38, 61.431]
  - - [2944, 256, 1, 1]
    - [5, 0.06]
  - - [1408, 2368, 1, 1]
    - [39, 0.147]
  - - [32, 448, 1, 3328]
    - [22, 2.757]
  - - [5056, 1, 1, 3328]
    - [40, 0.738]
  - - [2944, 256, 1, 32]
    - [31, 2.174]
  - - [5056, 6784, 1, 1280]
    - [21, 84.209]
  - - [4288, 5056, 1, 1]
    - [41, 0.27]
  - - [5056, 4288, 1, 1]
    - [41, 0.271]
  - - [128, 4288, 1, 3328]
    - [6, 41.575]
  - - [5056, 128, 1, 256]
    - [42, 12.785]
  - - [1408, 4288, 1, 1280]
    - [43, 71.192]
  - - [1856, 704, 1, 1280]
    - [34, 51.343]
  - - [4288, 1024, 1, 3328]
    - [6, 79.727]
  - - [1, 5888, 1, 3328]
    - [17, 0.769]
  - - [1024, 128, 1, 32]
    - [44, 0.45]
  - - [32, 4288, 1, 1280]
    - [10, 11.308]
  - - [1024, 5056, 1, 1]
    - [39, 0.185]
  - - [704, 3584, 1, 1280]
    - [45, 61.987]
  - - [1856, 5056, 1, 256]
    - [46, 43.029]
  - - [1408, 1024, 1, 1280]
    - [43, 50.345]
  - - [5056, 5888, 1, 3328]
    - [21, 89.02]
  - - [448, 1, 1, 1]
    - [47, 0.0]
  - - [3584, 3584, 1, 1280]
    - [21, 77.312]
  - - [2368, 3584, 1, 32]
    - [8, 9.272]
  - - [2944, 2368, 1, 1]
    - [39, 0.186]
  - - [704, 4288, 1, 1]
    - [5, 0.16]
  - - [2368, 256, 1, 32]
    - [31, 1.748]
  - - [1024, 6784, 1, 1280]
    - [43, 72.753]
  - - [1024, 3584, 1, 1]
    - [39, 0.158]
  - - [32, 5056, 1, 32]
    - [12, 0.545]
  - - [5888, 32, 1, 32]
    - [11, 0.629]
  - - [64, 128, 1, 3328]
    - [20, 1.583]
  - - [256, 5056, 1, 32]
    - [31, 3.31]
  - - [5056, 64, 1, 32]
    - [12, 1.042]
  - - [2368, 5056, 1, 32]
    - [5, 10.157]
  - - [6784, 1856, 1, 32]
    - [31, 8.866]
  - - [64, 128, 1, 1]
    - [12, 0.001]
  - - [64, 2368, 1, 1280]
    - [10, 12.21]
  - - [128, 704, 1, 32]
    - [48, 0.325]
  - - [64, 6784, 1, 3328]
    - [25, 35.085]
  - - [2944, 256, 1, 1280]
    - [6, 40.106]
  - - [5056, 704, 1, 1]
    - [8, 0.164]
  - - [2944, 4288, 1, 256]
    - [46, 45.118]
  - - [1024, 1024, 1, 3328]
    - [9, 58.16]
  - - [5056, 704, 1, 32]
    - [5, 6.649]
  - - [1856, 4288, 1, 3328]
    - [45, 82.569]
  - - [1, 1856, 1, 256]
    - [24, 0.049]
  - - [6784, 4288, 1, 32]
    - [49, 9.756]
  - - [5888, 64, 1, 256]
    - [27, 8.051]
  - - [256, 128, 1, 1]
    - [18, 0.003]
  - - [5888, 5056, 1, 256]
    - [46, 48.075]
  - - [2944, 448, 1, 256]
    - [50, 20.452]
  - - [3584, 2368, 1, 3328]
    - [21, 81.448]
  - - [4288, 1856, 1, 1]
    - [41, 0.222]
  - - [1856, 2944, 1, 1]
    - [51, 0.19]
  - - [32, 4288, 1, 3328]
    - [10, 17.381]
  - - [1, 3584, 1, 3328]
    - [17, 0.614]
  - - [256, 32, 1, 3328]
    - [20, 1.617]
  - - [1856, 2368, 1, 32]
    - [5, 7.336]
  - - [4288, 1856, 1, 32]
    - [5, 9.226]
  - - [5056, 64, 1, 3328]
    - [16, 30.032]
  - - [6784, 1, 1, 1280]
    - [10, 0.535]
  - - [1024, 448, 1, 32]
    - [12, 1.378]
  - - [1408, 64, 1, 1]
    - [18, 0.009]
  - - [1, 1, 1, 3328]
    - [20, 0.0]
  - - [5056, 2368, 1, 256]
    - [43, 44.385]
  - - [1408, 5888, 1, 256]
    - [43, 40.39]
  - - [5056, 6784, 1, 1]
    - [5, 0.287]
  - - [32, 448, 1, 1280]
    - [20, 1.487]
  - - [32, 448, 1, 32]
    - [12, 0.059]
  - - [1856, 64, 1, 256]
    - [52, 2.855]
  - - [1024, 1408, 1, 3328]
    - [53, 64.665]
  - - [256, 5056, 1, 1280]
    - [9, 50.043]
  - - [704, 2368, 1, 1]
    - [41, 0.109]
  - - [64, 1024, 1, 32]
    - [44, 0.246]
  - - [1024, 256, 1, 256]
    - [52, 5.685]
  - - [128, 1, 1, 1]
    - [18, 0.0]
  - - [3584, 4288, 1, 1280]
    - [21, 79.096]
  - - [1856, 128, 1, 32]
    - [5, 0.793]
  - - [1856, 128, 1, 1280]
    - [25, 17.045]
  - - [128, 2944, 1, 3328]
    - [16, 37.379]
  - - [1, 6784, 1, 3328]
    - [17, 0.826]
  - - [3584, 2368, 1, 1]
    - [39, 0.197]
  - - [4288, 448, 1, 3328]
    - [54, 64.542]
  - - [4288, 32, 1, 3328]
    - [55, 17.559]
  - - [256, 1856, 1, 1]
    - [56, 0.039]
  - - [704, 6784, 1, 1280]
    - [13, 69.36]
  - - [2368, 4288, 1, 32]
    - [5, 9.736]
  - - [704, 5056, 1, 1280]
    - [45, 68.994]
  - - [256, 3584, 1, 3328]
    - [15, 51.269]
  - - [1024, 32, 1, 3328]
    - [22, 5.993]
  - - [3584, 6784, 1, 32]
    - [57, 9.591]
  - - [3584, 6784, 1, 1280]
    - [21, 81.905]
  - - [4288, 4288, 1, 3328]
    - [21, 89.349]
  - - [3584, 64, 1, 1280]
    - [52, 16.058]
  - - [64, 1856, 1, 256]
    - [10, 2.903]
  - - [3584, 64, 1, 32]
    - [47, 0.745]
  - - [448, 1, 1, 1280]
    - [19, 0.046]
  - - [256, 4288, 1, 1280]
    - [34, 42.215]
  - - [1408, 3584, 1, 1]
    - [49, 0.188]
  - - [4288, 1856, 1, 3328]
    - [4, 84.295]
  - - [1856, 2944, 1, 1280]
    - [43, 66.778]
  - - [4288, 256, 1, 256]
    - [34, 18.624]
  - - [128, 5888, 1, 32]
    - [58, 2.123]
  - - [128, 5888, 1, 1280]
    - [6, 38.542]
  - - [1408, 128, 1, 3328]
    - [59, 22.525]
  - - [3584, 256, 1, 256]
    - [34, 15.386]
  - - [32, 6784, 1, 3328]
    - [17, 21.706]
  - - [64, 64, 1, 1280]
    - [22, 0.419]
  - - [32, 3584, 1, 256]
    - [60, 2.668]
  - - [704, 256, 1, 32]
    - [5, 0.591]
  - - [448, 128, 1, 3328]
    - [7, 10.488]
  - - [64, 2944, 1, 3328]
    - [59, 20.778]
  - - [64, 4288, 1, 3328]
    - [61, 26.183]
  - - [5056, 1024, 1, 3328]
    - [9, 85.744]
  - - [128, 256, 1, 1280]
    - [20, 3.259]
  - - [1856, 256, 1, 256]
    - [27, 10.003]
  - - [3584, 704, 1, 1]
    - [1, 0.136]
  - - [256, 704, 1, 256]
    - [10, 4.126]
  - - [448, 5056, 1, 1]
    - [62, 0.132]
  - - [5888, 5888, 1, 256]
    - [46, 49.649]
  - - [3584, 704, 1, 32]
    - [31, 5.198]
  - - [448, 6784, 1, 3328]
    - [43, 72.815]
  - - [6784, 4288, 1, 1]
    - [39, 0.26]
  - - [3584, 6784, 1, 1]
    - [49, 0.25]
  - - [1408, 2368, 1, 32]
    - [31, 5.98]
  - - [448, 5056, 1, 32]
    - [62, 5.104]
  - - [4288, 4288, 1, 1280]
    - [21, 80.547]
  - - [6784, 1408, 1, 1]
    - [57, 0.204]
  - - [1856, 5888, 1, 3328]
    - [15, 82.945]
  - - [1024, 704, 1, 1]
    - [31, 0.056]
  - - [3584, 1856, 1, 3328]
    - [4, 79.761]
  - - [5056, 5888, 1, 1]
    - [63, 0.283]
  - - [2944, 1024, 1, 256]
    - [49, 28.508]
  - - [448, 1408, 1, 3328]
    - [64, 49.48]
  - - [5056, 32, 1, 3328]
    - [60, 18.109]
  - - [2368, 4288, 1, 3328]
    - [15, 85.383]
  - - [1024, 704, 1, 32]
    - [5, 2.096]
  - - [448, 2944, 1, 256]
    - [34, 21.371]
  - - [2944, 6784, 1, 256]
    - [46, 48.776]
  - - [2368, 2368, 1, 1280]
    - [29, 66.013]
  - - [5888, 128, 1, 3328]
    - [65, 56.068]
  - - [256, 256, 1, 32]
    - [66, 0.254]
  - - [1024, 1, 1, 256]
    - [2, 0.028]
  - - [3584, 3584, 1, 32]
    - [31, 9.027]
  - - [2944, 448, 1, 1]
    - [5, 0.088]
  - - [128, 32, 1, 32]
    - [12, 0.016]
  - - [5056, 64, 1, 1280]
    - [16, 21.505]
  - - [2944, 2944, 1, 1280]
    - [21, 70.856]
  - - [1, 2368, 1, 256]
    - [24, 0.062]
  - - [1408, 5056, 1, 1]
    - [67, 0.19]
  - - [2944, 32, 1, 1280]
    - [7, 9.057]
  - - [64, 1408, 1, 3328]
    - [17, 15.642]
  - - [256, 448, 1, 1280]
    - [10, 9.729]
  - - [2368, 6784, 1, 1]
    - [41, 0.26]
  - - [6784, 4288, 1, 1280]
    - [21, 82.337]
  - - [2944, 704, 1, 256]
    - [46, 25.546]
  - - [2368, 6784, 1, 1280]
    - [21, 78.134]
  - - [704, 2944, 1, 3328]
    - [13, 65.913]
  - - [5888, 256, 1, 1]
    - [1, 0.099]
  - - [704, 704, 1, 32]
    - [11, 1.502]
  - - [256, 4288, 1, 256]
    - [34, 17.888]
  - - [5056, 6784, 1, 32]
    - [5, 12.112]
  - - [5056, 128, 1, 1]
    - [5, 0.054]
  - - [448, 5056, 1, 1280]
    - [15, 58.54]
  - - [448, 448, 1, 256]
    - [27, 4.386]
  - - [256, 5888, 1, 3328]
    - [53, 67.043]
  - - [704, 448, 1, 1280]
    - [68, 22.629]
  - - [448, 64, 1, 256]
    - [7, 0.78]
  - - [1024, 704, 1, 1280]
    - [33, 38.792]
  - - [5888, 1024, 1, 1]
    - [69, 0.188]
  - - [5888, 448, 1, 32]
    - [1, 5.225]
  - - [6784, 2944, 1, 256]
    - [46, 45.573]
  - - [1024, 256, 1, 1]
    - [11, 0.024]
  - - [2368, 448, 1, 256]
    - [34, 18.322]
  - - [4288, 256, 1, 3328]
    - [9, 61.249]
  - - [4288, 2944, 1, 256]
    - [43, 45.856]
  - - [448, 5888, 1, 3328]
    - [6, 77.33]
  - - [128, 256, 1, 3328]
    - [30, 6.143]
  - - [128, 6784, 1, 32]
    - [31, 2.465]
  - - [1856, 64, 1, 32]
    - [48, 0.428]
  - - [1408, 4288, 1, 1]
    - [70, 0.181]
  - - [1408, 1856, 1, 3328]
    - [15, 82.132]
  - - [4288, 64, 1, 256]
    - [71, 5.907]
  - - [3584, 1024, 1, 3328]
    - [9, 79.588]
  - - [2944, 5888, 1, 3328]
    - [21, 89.451]
  - - [128, 6784, 1, 3328]
    - [72, 59.632]
  - - [448, 4288, 1, 3328]
    - [73, 65.067]
  - - [704, 2368, 1, 256]
    - [6, 25.173]
  - - [1, 64, 1, 3328]
    - [20, 0.012]
  - - [4288, 128, 1, 1]
    - [5, 0.046]
  - - [256, 2368, 1, 32]
    - [31, 1.763]
  - - [4288, 3584, 1, 3328]
    - [21, 86.821]
  - - [1408, 64, 1, 256]
    - [74, 2.26]
  - - [1408, 1024, 1, 1]
    - [1, 0.092]
  - - [64, 1024, 1, 1]
    - [11, 0.007]
  - - [1408, 1024, 1, 256]
    - [75, 21.326]
  - - [5056, 3584, 1, 1]
    - [63, 0.266]
  - - [448, 1024, 1, 256]
    - [27, 9.729]
  - - [6784, 6784, 1, 3328]
    - [21, 90.248]
  - - [6784, 32, 1, 32]
    - [76, 0.745]
  - - [64, 1024, 1, 3328]
    - [37, 11.537]
  - - [2368, 2944, 1, 3328]
    - [53, 83.246]
  - - [448, 448, 1, 1280]
    - [52, 15.478]
  - - [5056, 3584, 1, 32]
    - [5, 10.98]
  - - [5056, 3584, 1, 1280]
    - [21, 80.53]
  - - [1856, 1856, 1, 256]
    - [77, 32.575]
  - - [32, 5888, 1, 256]
    - [10, 4.347]
  - - [256, 1408, 1, 32]
    - [11, 1.101]
  - - [2944, 1, 1, 3328]
    - [78, 0.523]
  - - [32, 704, 1, 3328]
    - [20, 4.377]
  - - [5888, 4288, 1, 1]
    - [39, 0.254]
  - - [1024, 128, 1, 256]
    - [10, 3.231]
  - - [32, 1856, 1, 3328]
    - [79, 10.504]
  - - [5056, 704, 1, 256]
    - [43, 32.904]
  - - [2368, 5056, 1, 256]
    - [46, 45.199]
  - - [1024, 5056, 1, 256]
    - [15, 37.331]
  - - [32, 1024, 1, 3328]
    - [80, 5.993]
  - - [5888, 448, 1, 256]
    - [33, 28.71]
  - - [6784, 5056, 1, 1280]
    - [21, 82.716]
  - - [4288, 6784, 1, 1280]
    - [21, 83.071]
  - - [64, 1, 1, 256]
    - [81, 0.002]
  - - [1856, 64, 1, 1280]
    - [60, 9.733]
  - - [128, 1408, 1, 1]
    - [11, 0.017]
  - - [1024, 64, 1, 32]
    - [66, 0.249]
  - - [1024, 64, 1, 3328]
    - [7, 11.814]
  - - [704, 6784, 1, 3328]
    - [15, 79.659]
  - - [2944, 1856, 1, 1]
    - [82, 0.17]
  - - [5888, 4288, 1, 1280]
    - [21, 82.32]
  - - [5888, 3584, 1, 1280]
    - [21, 80.445]
  - - [32, 2368, 1, 1280]
    - [17, 7.434]
  - - [3584, 1408, 1, 1280]
    - [9, 71.416]
  - - [1024, 2944, 1, 256]
    - [33, 29.474]
  - - [1, 2944, 1, 1280]
    - [17, 0.287]
  - - [32, 1024, 1, 256]
    - [83, 0.9]
  - - [2944, 1856, 1, 1280]
    - [6, 64.43]
  - - [3584, 1, 1, 1280]
    - [37, 0.349]
  - - [256, 3584, 1, 32]
    - [12, 2.469]
  - - [1024, 2368, 1, 1]
    - [1, 0.129]
  - - [2944, 3584, 1, 1280]
    - [9, 76.617]
  - - [64, 1, 1, 1]
    - [84, 0.0]
  - - [1856, 4288, 1, 256]
    - [43, 41.359]
  - - [256, 1, 1, 256]
    - [2, 0.007]
  - - [256, 128, 1, 3328]
    - [20, 6.082]
  - - [1, 1856, 1, 3328]
    - [26, 0.346]
  - - [448, 3584, 1, 1]
    - [5, 0.114]
  - - [2368, 2944, 1, 32]
    - [5, 8.757]
  - - [128, 4288, 1, 32]
    - [31, 1.677]
  - - [448, 256, 1, 256]
    - [10, 2.827]
  - - [64, 64, 1, 1]
    - [85, 0.0]
  - - [1, 1408, 1, 1]
    - [86, 0.0]
  - - [2944, 32, 1, 32]
    - [48, 0.336]
  - - [448, 1856, 1, 1]
    - [51, 0.066]
  - - [4288, 704, 1, 256]
    - [49, 29.615]
  - - [1856, 1024, 1, 256]
    - [34, 23.73]
  - - [448, 1856, 1, 32]
    - [31, 2.417]
  - - [448, 1856, 1, 3328]
    - [72, 63.756]
  - - [448, 448, 1, 32]
    - [87, 0.683]
  - - [1024, 448, 1, 256]
    - [27, 9.729]
  - - [6784, 1, 1, 256]
    - [60, 0.163]
  - - [704, 6784, 1, 32]
    - [5, 7.552]
  - - [1024, 4288, 1, 1]
    - [39, 0.165]
  - - [704, 256, 1, 3328]
    - [88, 22.376]
  - - [704, 1856, 1, 32]
    - [8, 3.464]
  - - [1408, 5888, 1, 1280]
    - [13, 70.038]
  - - [32, 704, 1, 1280]
    - [20, 2.321]
  - - [5056, 1856, 1, 256]
    - [89, 41.768]
  - - [6784, 704, 1, 1280]
    - [9, 67.064]
  - - [704, 1408, 1, 32]
    - [5, 2.707]
  - - [5888, 1024, 1, 256]
    - [43, 36.38]
  - - [64, 2944, 1, 1]
    - [11, 0.018]
  - - [64, 2944, 1, 32]
    - [5, 0.635]
  - - [64, 2944, 1, 1280]
    - [52, 14.006]
  - - [6784, 1856, 1, 3328]
    - [4, 86.497]
  - - [2368, 5888, 1, 1280]
    - [15, 77.664]
  - - [5888, 6784, 1, 32]
    - [49, 10.192]
  - - [1, 6784, 1, 256]
    - [24, 0.16]
  - - [6784, 6784, 1, 32]
    - [49, 10.416]
  - - [256, 1, 1, 1280]
    - [20, 0.026]
  - - [5888, 128, 1, 32]
    - [31, 2.174]
  - - [6784, 256, 1, 256]
    - [90, 25.046]
  - - [2368, 3584, 1, 3328]
    - [4, 82.036]
  - - [128, 4288, 1, 1280]
    - [91, 28.888]
  - - [32, 3584, 1, 1280]
    - [10, 9.786]
  - - [5888, 1024, 1, 1280]
    - [9, 69.951]
  - - [1856, 704, 1, 3328]
    - [34, 62.331]
  - - [5888, 6784, 1, 3328]
    - [21, 91.051]
  - - [6784, 448, 1, 1]
    - [92, 0.139]
  - - [6784, 1856, 1, 1]
    - [39, 0.225]
  - - [128, 32, 1, 1280]
    - [20, 0.428]
  - - [2944, 2368, 1, 1280]
    - [4, 70.206]
  - - [128, 256, 1, 1]
    - [93, 0.003]
  - - [6784, 448, 1, 32]
    - [31, 5.707]
  - - [6784, 448, 1, 3328]
    - [94, 70.17]
  - - [1, 6784, 1, 1]
    - [12, 0.001]
  - - [448, 3584, 1, 1280]
    - [45, 55.395]
  - - [1408, 6784, 1, 1280]
    - [43, 73.232]
  - - [5056, 5888, 1, 1280]
    - [21, 82.719]
  - - [32, 2944, 1, 32]
    - [58, 0.343]
  - - [5888, 704, 1, 1]
    - [1, 0.159]
  - - [3584, 1856, 1, 1]
    - [39, 0.185]
  - - [1, 256, 1, 256]
    - [95, 0.007]
  - - [5056, 2944, 1, 32]
    - [5, 10.669]
  - - [32, 6784, 1, 256]
    - [10, 4.472]
  - - [4288, 6784, 1, 1]
    - [41, 0.28]
  - - [1, 4288, 1, 3328]
    - [17, 0.67]
  - - [1024, 6784, 1, 1]
    - [28, 0.2]
  - - [2368, 5888, 1, 32]
    - [63, 10.451]
  - - [448, 448, 1, 3328]
    - [59, 24.919]
  - - [1, 256, 1, 1]
    - [11, 0.0]
  - - [3584, 4288, 1, 1]
    - [39, 0.234]
  - - [5888, 1024, 1, 3328]
    - [9, 80.166]
  - - [6784, 5888, 1, 256]
    - [13, 47.884]
  - - [704, 128, 1, 1280]
    - [23, 8.84]
  - - [4288, 128, 1, 256]
    - [27, 11.472]
  - - [5056, 1024, 1, 1]
    - [96, 0.199]
  - - [32, 3584, 1, 3328]
    - [10, 15.637]
  - - [1024, 1, 1, 1280]
    - [22, 0.109]
  - - [4288, 2368, 1, 32]
    - [5, 9.841]
  - - [704, 3584, 1, 1]
    - [41, 0.145]
  - - [704, 1856, 1, 3328]
    - [97, 69.003]
  - - [2944, 128, 1, 1280]
    - [16, 26.127]
  - - [1, 2368, 1, 3328]
    - [17, 0.429]
  - - [6784, 704, 1, 32]
    - [31, 6.943]
  - - [4288, 1, 1, 1280]
    - [37, 0.399]
  - - [704, 5888, 1, 256]
    - [34, 33.118]
  - - [2368, 3584, 1, 1280]
    - [15, 72.164]
  - - [64, 448, 1, 256]
    - [24, 0.795]
  - - [1408, 448, 1, 1280]
    - [27, 34.07]
  - - [3584, 5056, 1, 32]
    - [98, 9.189]
  - - [1024, 32, 1, 1280]
    - [22, 3.352]
  - - [128, 2368, 1, 1]
    - [93, 0.028]
  - - [6784, 1856, 1, 1280]
    - [21, 75.281]
  - - [5056, 5056, 1, 3328]
    - [21, 88.024]
  - - [128, 704, 1, 1280]
    - [7, 8.84]
  - - [128, 2944, 1, 1280]
    - [16, 26.771]
  - - [2368, 5056, 1, 1]
    - [5, 0.247]
  - - [5888, 1408, 1, 256]
    - [43, 38.136]
  - - [2368, 1024, 1, 32]
    - [1, 5.43]
  - - [256, 256, 1, 3328]
    - [7, 11.701]
  - - [64, 4288, 1, 1]
    - [99, 0.026]
  - - [4288, 1024, 1, 256]
    - [43, 35.179]
  - - [3584, 32, 1, 32]
    - [48, 0.409]
  - - [3584, 64, 1, 1]
    - [5, 0.021]
  - - [704, 32, 1, 1280]
    - [20, 2.272]
  - - [32, 4288, 1, 32]
    - [100, 0.458]
  - - [64, 64, 1, 3328]
    - [20, 0.784]
  - - [64, 1408, 1, 1]
    - [11, 0.009]
  - - [4288, 5888, 1, 1280]
    - [21, 81.055]
  - - [1856, 2944, 1, 3328]
    - [43, 74.096]
  - - [256, 1024, 1, 256]
    - [27, 5.907]
  - - [5056, 5888, 1, 256]
    - [46, 50.095]
  - - [1408, 128, 1, 1280]
    - [59, 13.973]
  - - [5056, 256, 1, 3328]
    - [36, 71.056]
  - - [1024, 5888, 1, 1280]
    - [43, 71.27]
  - - [1024, 448, 1, 1]
    - [31, 0.038]
  - - [32, 32, 1, 32]
    - [76, 0.004]
  - - [5056, 1, 1, 1280]
    - [7, 0.442]
  - - [5888, 5056, 1, 1280]
    - [21, 82.197]
  - - [5888, 2944, 1, 1]
    - [101, 0.238]
  - - [64, 4288, 1, 1280]
    - [25, 18.581]
  - - [1408, 4288, 1, 3328]
    - [43, 82.199]
  - - [704, 2944, 1, 32]
    - [5, 4.916]
  - - [1, 5888, 1, 1280]
    - [10, 0.472]
  - - [2944, 4288, 1, 3328]
    - [21, 85.086]
  - - [256, 2944, 1, 256]
    - [34, 14.207]
  - - [704, 448, 1, 32]
    - [87, 1.024]
  - - [5056, 2944, 1, 256]
    - [43, 46.362]
  - - [704, 1024, 1, 256]
    - [32, 14.339]
  - - [2368, 1856, 1, 256]
    - [89, 34.825]
  - - [64, 3584, 1, 1]
    - [5, 0.022]
  - - [1024, 128, 1, 1280]
    - [10, 10.679]
  - - [2368, 4288, 1, 1280]
    - [21, 75.871]
  - - [3584, 448, 1, 256]
    - [43, 23.388]
  - - [256, 6784, 1, 256]
    - [90, 25.427]
  - - [1024, 32, 1, 32]
    - [11, 0.131]
  - - [1024, 1408, 1, 1]
    - [31, 0.093]
  - - [128, 64, 1, 32]
    - [102, 0.033]
  - - [64, 1, 1, 1280]
    - [81, 0.006]
  - - [2368, 32, 1, 32]
    - [11, 0.282]
  - - [256, 5888, 1, 1]
    - [1, 0.1]
  - - [2944, 2944, 1, 1]
    - [57, 0.204]
  - - [6784, 3584, 1, 256]
    - [15, 45.272]
  - - [1408, 1856, 1, 256]
    - [103, 30.515]
  - - [128, 1408, 1, 256]
    - [10, 4.296]
  - - [2944, 2944, 1, 32]
    - [1, 8.095]
  - - [2944, 2944, 1, 3328]
    - [53, 83.284]
  - - [1, 2944, 1, 256]
    - [26, 0.079]
  - - [448, 32, 1, 1280]
    - [20, 1.52]
  - - [3584, 1, 1, 256]
    - [2, 0.098]
  - - [704, 32, 1, 3328]
    - [20, 4.399]
  - - [256, 448, 1, 3328]
    - [10, 14.382]
  - - [128, 128, 1, 256]
    - [104, 0.459]
  - - [2368, 64, 1, 256]
    - [10, 3.768]
  - - [64, 448, 1, 1280]
    - [20, 2.954]
  - - [6784, 1408, 1, 32]
    - [31, 8.399]
  - - [1408, 448, 1, 3328]
    - [89, 49.171]
  - - [2368, 6784, 1, 3328]
    - [21, 84.231]
  - - [256, 2368, 1, 1]
    - [31, 0.05]
  - - [4288, 3584, 1, 32]
    - [5, 10.655]
  - - [5888, 64, 1, 3328]
    - [68, 32.859]
  - - [3584, 704, 1, 1280]
    - [4, 61.257]
  - - [448, 5056, 1, 3328]
    - [13, 71.55]
  - - [4288, 448, 1, 256]
    - [34, 24.195]
  - - [5056, 256, 1, 1280]
    - [36, 50.585]
  - - [704, 448, 1, 3328]
    - [25, 34.08]
  - - [2944, 5888, 1, 32]
    - [31, 9.218]
  - - [3584, 5056, 1, 256]
    - [46, 47.905]
  - - [6784, 1, 1, 3328]
    - [23, 0.837]
  - - [32, 2368, 1, 3328]
    - [19, 13.465]
  - - [4288, 256, 1, 1]
    - [5, 0.087]
  - - [64, 256, 1, 1]
    - [47, 0.002]
  - - [1856, 448, 1, 3328]
    - [33, 63.626]
  - - [3584, 2368, 1, 256]
    - [43, 39.481]
  - - [4288, 4288, 1, 256]
    - [46, 48.653]
  - - [4288, 256, 1, 1280]
    - [36, 43.974]
  - - [448, 5056, 1, 256]
    - [9, 27.45]
  - - [128, 1856, 1, 1]
    - [11, 0.022]
  - - [4288, 704, 1, 1280]
    - [6, 60.972]
  - - [128, 1856, 1, 32]
    - [87, 0.779]
  - - [2368, 704, 1, 1]
    - [1, 0.11]
  - - [3584, 32, 1, 256]
    - [60, 2.711]
  - - [448, 2368, 1, 1280]
    - [36, 42.497]
  - - [3584, 256, 1, 1]
    - [31, 0.067]
  - - [1408, 1856, 1, 1280]
    - [15, 65.655]
  - - [3584, 4288, 1, 3328]
    - [21, 87.453]
  - - [448, 4288, 1, 32]
    - [5, 4.776]
  - - [448, 4288, 1, 1280]
    - [105, 50.739]
  - - [64, 3584, 1, 256]
    - [25, 4.9]
  - - [1, 6784, 1, 1280]
    - [17, 0.532]
  - - [5056, 1024, 1, 256]
    - [46, 38.093]
  - - [2368, 448, 1, 32]
    - [5, 3.012]
  - - [4288, 3584, 1, 1280]
    - [21, 78.619]
  - - [32, 2944, 1, 1280]
    - [17, 9.242]
  - - [1408, 704, 1, 1]
    - [31, 0.075]
  - - [2368, 256, 1, 256]
    - [27, 12.489]
  - - [1, 5056, 1, 1]
    - [12, 0.001]
  - - [4288, 32, 1, 32]
    - [44, 0.48]
  - - [1856, 3584, 1, 32]
    - [5, 8.784]
  - - [5056, 3584, 1, 3328]
    - [21, 88.09]
  - - [4288, 5056, 1, 256]
    - [43, 49.353]
  - - [1856, 5888, 1, 256]
    - [46, 44.268]
  - - [256, 256, 1, 256]
    - [37, 1.835]
  - - [2368, 3584, 1, 1]
    - [63, 0.226]
  - - [4288, 2368, 1, 256]
    - [46, 44.306]
  - - [448, 1, 1, 3328]
    - [22, 0.087]
  - - [1856, 256, 1, 1280]
    - [27, 26.661]
  - - [256, 2944, 1, 1]
    - [31, 0.061]
  - - [1408, 2944, 1, 3328]
    - [43, 78.18]
  - - [32, 1856, 1, 32]
    - [85, 0.233]
  - - [5888, 3584, 1, 1]
    - [39, 0.247]
  - - [256, 1, 1, 1]
    - [18, 0.0]
  - - [6784, 5056, 1, 3328]
    - [21, 90.03]
  - - [6784, 5056, 1, 1]
    - [39, 0.263]
  - - [5888, 3584, 1, 32]
    - [96, 9.393]
  - - [5888, 3584, 1, 3328]
    - [21, 89.244]
  - - [32, 1024, 1, 1280]
    - [79, 3.259]
  - - [1, 256, 1, 3328]
    - [26, 0.049]
  - - [1024, 6784, 1, 256]
    - [33, 38.531]
  - - [6784, 5888, 1, 32]
    - [106, 10.272]
  - - [1408, 1, 1, 1280]
    - [22, 0.144]
  - - [2368, 6784, 1, 32]
    - [8, 10.805]
  - - [6784, 64, 1, 1]
    - [93, 0.037]
  - - [5056, 1408, 1, 1280]
    - [6, 75.32]
  - - [3584, 1408, 1, 3328]
    - [9, 82.987]
  - - [2944, 3584, 1, 1]
    - [49, 0.219]
  - - [2944, 1408, 1, 1280]
    - [6, 65.188]
  - - [1856, 64, 1, 1]
    - [107, 0.011]
  - - [3584, 1024, 1, 1]
    - [35, 0.154]
  - - [256, 32, 1, 256]
    - [10, 0.227]
  - - [2944, 1856, 1, 3328]
    - [4, 74.527]
  - - [128, 1024, 1, 3328]
    - [55, 15.905]
  - - [1408, 128, 1, 1]
    - [11, 0.017]
  - - [2944, 3584, 1, 32]
    - [31, 8.606]
  - - [5888, 256, 1, 32]
    - [31, 3.599]
  - - [6784, 64, 1, 256]
    - [59, 8.881]
  - - [256, 128, 1, 1280]
    - [37, 3.259]
  - - [6784, 5056, 1, 256]
    - [108, 47.064]
  - - [1408, 32, 1, 3328]
    - [37, 8.083]
  - - [1856, 3584, 1, 1280]
    - [43, 71.163]
  - - [256, 5888, 1, 256]
    - [6, 21.846]
  - - [5056, 32, 1, 256]
    - [109, 3.733]
  - - [1024, 4288, 1, 3328]
    - [43, 82.649]
  - - [448, 2368, 1, 256]
    - [34, 19.005]
  - - [64, 1408, 1, 1280]
    - [81, 8.721]
  - - [3584, 32, 1, 1280]
    - [10, 9.616]
  - - [128, 2368, 1, 3328]
    - [16, 31.052]
  - - [64, 5056, 1, 256]
    - [68, 6.763]
  - - [256, 64, 1, 256]
    - [24, 0.463]
  - - [32, 1408, 1, 256]
    - [24, 1.274]
  - - [2368, 448, 1, 3328]
    - [15, 59.546]
  - - [2368, 1408, 1, 1]
    - [62, 0.16]
  - - [1, 1, 1, 1]
    - [76, 0.0]
  - - [1024, 1856, 1, 32]
    - [1, 4.283]
  - - [32, 1024, 1, 32]
    - [18, 0.133]
  - - [4288, 1, 1, 256]
    - [37, 0.112]
  - - [1856, 128, 1, 3328]
    - [61, 25.596]
  - - [5888, 2368, 1, 1]
    - [28, 0.228]
  - - [2368, 2368, 1, 1]
    - [5, 0.195]
  - - [704, 256, 1, 1280]
    - [59, 14.049]
  - - [704, 4288, 1, 256]
    - [49, 29.92]
  - - [5888, 2368, 1, 32]
    - [31, 9.09]
  - - [5888, 2368, 1, 1280]
    - [21, 76.921]
  - - [128, 256, 1, 256]
    - [2, 0.909]
  - - [2944, 5056, 1, 3328]
    - [4, 83.989]
  - - [6784, 704, 1, 3328]
    - [9, 78.645]
  - - [1856, 1856, 1, 32]
    - [41, 6.435]
  - - [4288, 2944, 1, 32]
    - [5, 10.32]
  - - [256, 5056, 1, 1]
    - [5, 0.085]
  - - [704, 64, 1, 256]
    - [40, 1.238]
  - - [256, 2368, 1, 3328]
    - [6, 46.387]
  - - [704, 1, 1, 1]
    - [18, 0.0]
  - - [128, 448, 1, 1280]
    - [19, 5.664]
  - - [5056, 5056, 1, 256]
    - [46, 49.351]
  - - [5888, 256, 1, 256]
    - [75, 21.957]
  - - [5888, 64, 1, 1]
    - [56, 0.033]
  - - [6784, 6784, 1, 256]
    - [13, 48.552]
  - - [256, 3584, 1, 1]
    - [31, 0.068]
  - - [2368, 1, 1, 256]
    - [37, 0.064]
  - - [448, 32, 1, 32]
    - [18, 0.059]
  - - [704, 64, 1, 1]
    - [84, 0.005]
  - - [3584, 704, 1, 3328]
    - [33, 75.927]
  - - [4288, 704, 1, 3328]
    - [6, 71.322]
  - - [4288, 2944, 1, 1280]
    - [21, 75.603]
  - - [448, 3584, 1, 256]
    - [6, 24.633]
  - - [704, 32, 1, 256]
    - [2, 0.619]
  - - [6784, 256, 1, 32]
    - [31, 4.202]
  - - [1856, 128, 1, 1]
    - [11, 0.022]
  - - [1856, 32, 1, 32]
    - [11, 0.233]
  - - [6784, 1408, 1, 1280]
    - [21, 72.195]
  - - [2368, 5056, 1, 1280]
    - [21, 75.2]
  - - [704, 1856, 1, 1280]
    - [34, 50.928]
  - - [1408, 1408, 1, 1280]
    - [110, 51.419]
  - - [448, 1024, 1, 3328]
    - [64, 35.613]
  - - [32, 704, 1, 32]
    - [18, 0.093]
  - - [256, 704, 1, 1]
    - [12, 0.017]
  - - [5888, 1856, 1, 32]
    - [31, 8.621]
  - - [5888, 704, 1, 3328]
    - [4, 77.094]
  - - [5056, 1, 1, 256]
    - [2, 0.126]
  - - [448, 6784, 1, 256]
    - [57, 30.123]
  - - [1024, 128, 1, 1]
    - [12, 0.013]
  - - [128, 64, 1, 256]
    - [95, 0.227]
  - - [1856, 128, 1, 256]
    - [52, 5.271]
  - - [2944, 5888, 1, 256]
    - [46, 48.682]
  - - [1024, 256, 1, 1280]
    - [68, 18.808]
  - - [128, 5056, 1, 32]
    - [31, 1.867]
  - - [128, 5056, 1, 1280]
    - [45, 33.693]
  - - [448, 32, 1, 3328]
    - [20, 2.771]
  - - [1856, 1408, 1, 32]
    - [1, 5.575]
  - - [64, 704, 1, 32]
    - [18, 0.185]
  - - [64, 704, 1, 3328]
    - [26, 8.405]
  - - [64, 2368, 1, 32]
    - [31, 0.52]
  - - [5888, 64, 1, 32]
    - [12, 1.192]
  - - [2368, 256, 1, 1]
    - [5, 0.051]
  - - [5888, 64, 1, 1280]
    - [16, 23.027]
  - - [5056, 1, 1, 1]
    - [11, 0.001]
  - - [5888, 2944, 1, 1280]
    - [21, 78.933]
  - - [32, 2368, 1, 256]
    - [24, 1.987]
  - - [256, 1408, 1, 256]
    - [71, 7.936]
  - - [448, 5888, 1, 1]
    - [62, 0.148]
  - - [3584, 1408, 1, 1]
    - [28, 0.185]
  - - [32, 6784, 1, 1280]
    - [79, 13.976]
  - - [32, 6784, 1, 32]
    - [12, 0.705]
  - - [448, 5888, 1, 32]
    - [111, 5.529]
  - - [5056, 704, 1, 1280]
    - [112, 68.442]
  - - [1856, 6784, 1, 1]
    - [8, 0.247]
  - - [5056, 64, 1, 1]
    - [5, 0.029]
  - - [1, 5888, 1, 1]
    - [66, 0.001]
  - - [2368, 1024, 1, 256]
    - [15, 29.263]
  - - [1856, 6784, 1, 32]
    - [5, 10.34]
  - - [1856, 6784, 1, 1280]
    - [15, 77.764]
  - - [64, 3584, 1, 3328]
    - [25, 21.94]
  - - [5888, 5056, 1, 3328]
    - [21, 88.455]
  - - [1, 2944, 1, 3328]
    - [17, 0.523]
  - - [1408, 6784, 1, 32]
    - [1, 8.42]
  - - [32, 5888, 1, 1280]
    - [10, 14.226]
  - - [448, 256, 1, 1]
    - [11, 0.011]
  - - [3584, 5888, 1, 3328]
    - [21, 89.466]
  - - [4288, 1408, 1, 256]
    - [43, 38.272]
  - - [448, 64, 1, 1280]
    - [79, 2.871]
  - - [128, 448, 1, 32]
    - [18, 0.227]
  - - [6784, 2368, 1, 256]
    - [113, 43.262]
  - - [1408, 448, 1, 32]
    - [44, 1.834]
  - - [1856, 1408, 1, 1280]
    - [43, 66.116]
  - - [448, 256, 1, 3328]
    - [52, 14.146]
  - - [1856, 2368, 1, 1]
    - [63, 0.184]
  - - [1408, 5056, 1, 3328]
    - [29, 84.495]
  - - [128, 704, 1, 3328]
    - [81, 15.57]
  - - [5056, 128, 1, 1280]
    - [114, 34.566]
  - - [5056, 4288, 1, 256]
    - [43, 48.548]
  - - [5056, 5056, 1, 32]
    - [5, 11.651]
  - - [1856, 704, 1, 256]
    - [34, 21.783]
  - - [64, 256, 1, 256]
    - [104, 0.463]
  - - [448, 5888, 1, 1280]
    - [45, 63.719]
  - - [128, 6784, 1, 256]
    - [105, 15.46]
  - - [5056, 448, 1, 256]
    - [9, 27.449]
  - - [4288, 5888, 1, 1]
    - [5, 0.275]
  - - [1856, 5056, 1, 1280]
    - [43, 74.478]
  - - [2368, 4288, 1, 1]
    - [5, 0.239]
  - - [2368, 32, 1, 3328]
    - [40, 13.402]
  - - [3584, 1856, 1, 256]
    - [43, 37.109]
  - - [256, 3584, 1, 256]
    - [34, 15.297]
  - - [64, 704, 1, 1]
    - [11, 0.005]
  - - [4288, 5888, 1, 32]
    - [5, 11.596]
  - - [4288, 5888, 1, 3328]
    - [21, 86.501]
  - - [1, 1024, 1, 1]
    - [86, 0.0]
  - - [1024, 2944, 1, 3328]
    - [115, 70.868]
  - - [2944, 2368, 1, 256]
    - [43, 38.593]
  - - [1024, 1856, 1, 256]
    - [116, 22.936]
  - - [2944, 64, 1, 3328]
    - [117, 20.901]
  - - [1024, 5888, 1, 32]
    - [1, 7.627]
  - - [1024, 5888, 1, 3328]
    - [43, 81.761]
  - - [5056, 2368, 1, 32]
    - [63, 10.18]
  - - [1408, 2368, 1, 1280]
    - [43, 64.801]
  - - [256, 1, 1, 3328]
    - [22, 0.05]
  - - [128, 1024, 1, 32]
    - [118, 0.454]
  - - [5056, 6784, 1, 3328]
    - [21, 90.734]
  - - [448, 704, 1, 1]
    - [18, 0.03]
  - - [32, 64, 1, 32]
    - [47, 0.009]
  - - [448, 704, 1, 32]
    - [12, 1.024]
  - - [448, 704, 1, 3328]
    - [16, 33.595]
  - - [1408, 2944, 1, 256]
    - [43, 32.755]
  - - [64, 5888, 1, 1]
    - [93, 0.033]
  - - [2368, 128, 1, 32]
    - [87, 0.984]
  - - [2368, 256, 1, 1280]
    - [114, 32.742]
  - - [2368, 128, 1, 3328]
    - [25, 32.286]
  - - [704, 5056, 1, 32]
    - [63, 6.649]
  - - [32, 2368, 1, 32]
    - [84, 0.276]
  - - [1408, 1, 1, 256]
    - [2, 0.04]
  - - [4288, 256, 1, 32]
    - [8, 3.044]
  - - [448, 1408, 1, 1]
    - [31, 0.051]
  - - [5056, 4288, 1, 1280]
    - [21, 81.462]
  - - [1408, 256, 1, 256]
    - [71, 7.876]
  - - [4288, 448, 1, 1]
    - [41, 0.122]
  - - [256, 4288, 1, 32]
    - [11, 2.868]
  - - [1408, 256, 1, 1280]
    - [68, 25.861]
  - - [256, 256, 1, 1]
    - [18, 0.007]
  - - [1408, 1, 1, 1]
    - [11, 0.0]
  - - [448, 1408, 1, 256]
    - [27, 12.722]
  - - [5888, 5888, 1, 1]
    - [119, 0.264]
  - - [128, 2944, 1, 32]
    - [11, 1.171]
  - - [32, 256, 1, 32]
    - [47, 0.035]
  - - [2944, 704, 1, 1280]
    - [9, 52.994]
  - - [1024, 3584, 1, 1280]
    - [15, 66.323]
  - - [1856, 448, 1, 1]
    - [5, 0.065]
  - - [2368, 2944, 1, 1]
    - [5, 0.215]
  - - [5056, 256, 1, 32]
    - [5, 3.457]
  - - [4288, 1, 1, 3328]
    - [7, 0.69]
  - - [5056, 1024, 1, 1280]
    - [9, 73.487]
  - - [704, 704, 1, 1]
    - [11, 0.041]
  - - [1856, 448, 1, 1280]
    - [33, 43.604]
  - - [3584, 6784, 1, 256]
    - [46, 49.735]
  - - [64, 1856, 1, 1280]
    - [10, 10.382]
  - - [1856, 1408, 1, 256]
    - [45, 28.989]
  - - [4288, 4288, 1, 32]
    - [5, 10.849]
  - - [128, 1, 1, 256]
    - [120, 0.004]
  - - [32, 64, 1, 3328]
    - [20, 0.392]
  - - [5888, 448, 1, 1]
    - [1, 0.14]
  - - [128, 5888, 1, 256]
    - [91, 13.935]
  - - [3584, 256, 1, 3328]
    - [15, 51.269]
  - - [5056, 5056, 1, 1280]
    - [21, 82.325]
  - - [6784, 1408, 1, 3328]
    - [4, 81.881]
  - - [448, 2368, 1, 1]
    - [5, 0.082]
  - - [2368, 1, 1, 1280]
    - [37, 0.234]
  - - [32, 3584, 1, 32]
    - [58, 0.401]
  - - [128, 6784, 1, 1]
    - [31, 0.066]
  - - [1, 3584, 1, 1]
    - [66, 0.0]
  - - [5888, 5888, 1, 3328]
    - [21, 90.563]
  - - [256, 2944, 1, 3328]
    - [64, 57.204]
  - - [1, 128, 1, 3328]
    - [26, 0.024]
  - - [32, 256, 1, 256]
    - [10, 0.232]
  - - [5888, 1408, 1, 32]
    - [31, 8.078]
  - - [704, 256, 1, 1]
    - [11, 0.017]
  - - [1, 448, 1, 1]
    - [76, 0.0]
  - - [256, 6784, 1, 3328]
    - [53, 76.609]
  - - [64, 5888, 1, 256]
    - [71, 7.934]
  - - [1856, 1, 1, 1]
    - [11, 0.0]
  - - [1024, 256, 1, 3328]
    - [121, 28.408]
  - - [704, 704, 1, 256]
    - [27, 10.511]
  - - [448, 1024, 1, 32]
    - [12, 1.414]
  - - [6784, 2368, 1, 1280]
    - [21, 77.017]
  - - [128, 1856, 1, 1280]
    - [16, 16.55]
  - - [256, 2368, 1, 256]
    - [27, 12.313]
  - - [2944, 1408, 1, 1]
    - [1, 0.16]
  - - [6784, 1024, 1, 256]
    - [122, 37.381]
  - - [5056, 1408, 1, 32]
    - [5, 8.912]
  - - [1408, 6784, 1, 3328]
    - [43, 82.904]
  - - [2944, 1408, 1, 3328]
    - [4, 76.942]
  - - [1856, 32, 1, 256]
    - [40, 1.572]
  - - [704, 2368, 1, 32]
    - [5, 4.419]
  - - [448, 256, 1, 32]
    - [44, 0.409]
  - - [704, 6784, 1, 1]
    - [123, 0.191]
  - - [2368, 6784, 1, 256]
    - [46, 47.964]
  - - [1856, 3584, 1, 3328]
    - [29, 80.12]
  - - [1, 704, 1, 3328]
    - [20, 0.137]
  - - [64, 1, 1, 3328]
    - [20, 0.012]
  - - [448, 704, 1, 1280]
    - [25, 22.629]
  - - [704, 1856, 1, 1]
    - [41, 0.095]
  - - [704, 448, 1, 256]
    - [71, 6.944]
  - - [448, 64, 1, 3328]
    - [20, 5.485]
  - - [704, 6784, 1, 256]
    - [124, 35.966]
  - - [256, 32, 1, 1280]
    - [20, 0.875]
  - - [2368, 448, 1, 1280]
    - [36, 42.262]
  - - [6784, 2944, 1, 32]
    - [98, 9.279]
  - - [64, 4288, 1, 32]
    - [87, 0.883]
  - - [128, 704, 1, 1]
    - [85, 0.009]
  - - [128, 448, 1, 3328]
    - [37, 10.288]
  - - [5888, 2368, 1, 3328]
    - [21, 85.787]
  - - [2368, 704, 1, 1280]
    - [33, 56.834]
  - - [1024, 1408, 1, 1280]
    - [33, 49.981]
  - - [4288, 64, 1, 1280]
    - [61, 18.757]
  - - [128, 5056, 1, 1]
    - [31, 0.052]
  - - [2944, 5056, 1, 32]
    - [31, 9.096]
  - - [448, 448, 1, 1]
    - [11, 0.019]
  - - [256, 2368, 1, 1280]
    - [33, 32.259]
  - - [704, 2368, 1, 3328]
    - [45, 73.798]
  - - [3584, 2944, 1, 256]
    - [46, 43.788]
  - - [64, 6784, 1, 256]
    - [91, 8.636]
  - - [3584, 1024, 1, 1280]
    - [125, 65.583]
  - - [64, 1024, 1, 256]
    - [24, 1.8]
  - - [1408, 32, 1, 32]
    - [11, 0.177]
  - - [128, 3584, 1, 256]
    - [27, 9.451]
  - - [704, 1408, 1, 1]
    - [126, 0.075]
  - - [5056, 3584, 1, 256]
    - [46, 47.993]
  - - [2368, 704, 1, 256]
    - [33, 24.531]
  - - [1856, 1856, 1, 1280]
    - [6, 68.52]
  - - [32, 5888, 1, 32]
    - [86, 0.618]
  - - [64, 32, 1, 32]
    - [47, 0.009]
  - - [4288, 704, 1, 1]
    - [63, 0.156]
  - - [1856, 1024, 1, 1]
    - [5, 0.12]
  - - [4288, 2944, 1, 3328]
    - [21, 84.343]
  - - [1024, 128, 1, 3328]
    - [59, 16.113]
  - - [4288, 128, 1, 3328]
    - [127, 42.432]
  - - [4288, 704, 1, 32]
    - [5, 6.046]
  - - [1856, 1024, 1, 32]
    - [5, 4.661]
  - - [1, 448, 1, 3328]
    - [26, 0.087]
  - - [2944, 6784, 1, 1]
    - [39, 0.24]
  - - [6784, 2368, 1, 32]
    - [1, 9.092]
  - - [5888, 5056, 1, 1]
    - [39, 0.257]
  - - [128, 6784, 1, 1280]
    - [6, 42.45]
  - - [704, 5888, 1, 1]
    - [41, 0.181]
  - - [6784, 6784, 1, 1]
    - [39, 0.272]
  - - [1856, 32, 1, 1280]
    - [7, 5.907]
  - - [5888, 448, 1, 3328]
    - [33, 77.451]
  - - [704, 5888, 1, 32]
    - [31, 7.116]
  - - [704, 5888, 1, 1280]
    - [45, 66.567]
  - - [1024, 6784, 1, 3328]
    - [53, 83.404]
  - - [704, 2944, 1, 1280]
    - [32, 53.757]
  - - [4288, 6784, 1, 256]
    - [46, 51.347]
  - - [3584, 256, 1, 32]
    - [12, 2.487]
  - - [1408, 1408, 1, 32]
    - [82, 4.467]
  - - [1408, 1408, 1, 3328]
    - [128, 71.131]
  - - [1024, 64, 1, 256]
    - [7, 1.767]
  - - [4288, 64, 1, 32]
    - [129, 0.933]
  - - [1408, 256, 1, 32]
    - [12, 1.171]
  - - [5888, 128, 1, 256]
    - [50, 14.207]
  - - [64, 704, 1, 1280]
    - [26, 4.512]
  - - [2944, 1856, 1, 256]
    - [43, 34.789]
  - - [128, 5056, 1, 3328]
    - [6, 48.05]
  - - [4288, 2944, 1, 1]
    - [41, 0.247]
  - - [6784, 5056, 1, 32]
    - [106, 9.933]
  - - [1024, 448, 1, 3328]
    - [130, 35.539]
  - - [3584, 128, 1, 1]
    - [31, 0.038]
  - - [2944, 4288, 1, 1280]
    - [21, 76.556]
  - - [64, 32, 1, 3328]
    - [20, 0.392]
  - - [1024, 4288, 1, 256]
    - [33, 34.602]
  - - [128, 2368, 1, 256]
    - [71, 6.623]
  - - [2368, 64, 1, 32]
    - [131, 0.52]
  - - [1408, 1, 1, 3328]
    - [22, 0.265]
  - - [64, 1408, 1, 32]
    - [44, 0.338]
  - - [2368, 5888, 1, 1]
    - [5, 0.254]
  - - [1408, 1856, 1, 32]
    - [1, 5.323]
  - - [448, 1856, 1, 256]
    - [34, 16.204]
  - - [1856, 6784, 1, 3328]
    - [15, 85.978]
  - - [3584, 128, 1, 256]
    - [132, 9.519]
  - - [1024, 448, 1, 1280]
    - [27, 25.944]
  - - [1024, 2368, 1, 32]
    - [1, 5.143]
  - - [32, 2944, 1, 256]
    - [17, 2.405]
  - - [128, 5888, 1, 1]
    - [5, 0.06]
  - - [64, 5056, 1, 1]
    - [5, 0.03]
  - - [1856, 256, 1, 32]
    - [12, 1.428]
  - - [2368, 2368, 1, 3328]
    - [4, 75.439]
  - - [64, 448, 1, 1]
    - [84, 0.003]
  - - [3584, 5888, 1, 32]
    - [49, 9.393]
  - - [3584, 5888, 1, 1280]
    - [21, 79.77]
  - - [64, 5056, 1, 32]
    - [85, 1.111]
  - - [2944, 64, 1, 1]
    - [133, 0.019]
  - - [6784, 704, 1, 256]
    - [116, 35.05]
  - - [3584, 1024, 1, 32]
    - [134, 6.241]
  - - [1408, 704, 1, 32]
    - [31, 2.814]
  - - [1408, 704, 1, 1280]
    - [135, 39.163]
  - - [2368, 5888, 1, 256]
    - [46, 46.924]
  - - [2944, 64, 1, 32]
    - [12, 0.612]
  - - [1, 1408, 1, 256]
    - [136, 0.038]
  - - [64, 2944, 1, 256]
    - [10, 4.606]
  - - [5888, 5888, 1, 32]
    - [106, 10.047]
  - - [1856, 1408, 1, 3328]
    - [36, 78.892]
  - - [1024, 1024, 1, 32]
    - [31, 2.78]
  - - [4288, 1024, 1, 1]
    - [8, 0.186]
  - - [704, 4288, 1, 3328]
    - [29, 72.371]
  - - [2944, 5056, 1, 1280]
    - [21, 75.931]
  - - [6784, 2944, 1, 1280]
    - [21, 79.083]
  - - [6784, 256, 1, 3328]
    - [53, 76.429]
  - - [5056, 128, 1, 3328]
    - [127, 49.22]
  - - [128, 128, 1, 1280]
    - [80, 1.676]
  - - [128, 4288, 1, 1]
    - [31, 0.046]
  - - [1408, 5056, 1, 32]
    - [31, 7.995]
  - - [2944, 128, 1, 3328]
    - [68, 38.817]
  - - [5888, 1856, 1, 1280]
    - [21, 72.86]
  - - [64, 128, 1, 256]
    - [10, 0.229]
  - - [5888, 256, 1, 1280]
    - [33, 51.026]
  - - [1856, 5056, 1, 1]
    - [5, 0.233]
  - - [3584, 1856, 1, 1280]
    - [6, 69.412]
  - - [6784, 448, 1, 256]
    - [57, 29.122]
  - - [704, 3584, 1, 256]
    - [34, 28.764]
  - - [1856, 5056, 1, 32]
    - [5, 9.611]
  - - [1856, 5056, 1, 3328]
    - [29, 82.594]
  - - [1024, 2944, 1, 32]
    - [31, 5.69]
  - - [1408, 6784, 1, 256]
    - [46, 41.869]
  - - [1024, 2368, 1, 1280]
    - [33, 60.605]
  - - [1856, 3584, 1, 1]
    - [137, 0.205]
  - - [5888, 128, 1, 1280]
    - [29, 40.106]
  - - [2944, 5888, 1, 1280]
    - [21, 78.933]
  - - [1, 1856, 1, 1]
    - [11, 0.0]
  - - [3584, 3584, 1, 256]
    - [46, 45.57]
  - - [1856, 2368, 1, 3328]
    - [15, 72.981]
  - - [5888, 704, 1, 256]
    - [29, 31.297]
  - - [64, 448, 1, 32]
    - [84, 0.116]
  - - [6784, 4288, 1, 256]
    - [108, 46.899]
  - - [128, 64, 1, 3328]
    - [20, 1.617]
  - - [1, 5056, 1, 1280]
    - [17, 0.445]
  - - [32, 64, 1, 1280]
    - [20, 0.216]
  - - [1408, 2368, 1, 3328]
    - [29, 77.169]
  - - [1024, 3584, 1, 256]
    - [138, 30.593]
  - - [2944, 128, 1, 256]
    - [59, 8.558]
  - - [6784, 128, 1, 1]
    - [87, 0.07]
  - - [1408, 256, 1, 3328]
    - [61, 38.178]
  - - [448, 32, 1, 256]
    - [120, 0.398]
  - - [1024, 32, 1, 256]
    - [2, 0.892]
  - - [1, 5888, 1, 256]
    - [24, 0.152]
  - - [64, 2368, 1, 256]
    - [10, 3.903]
  - - [2944, 256, 1, 256]
    - [32, 14.301]
  - - [1, 128, 1, 256]
    - [20, 0.004]
  - - [32, 256, 1, 1280]
    - [20, 0.856]
  - - [5888, 1, 1, 256]
    - [10, 0.154]
  - - [32, 128, 1, 3328]
    - [30, 0.796]
  - - [6784, 128, 1, 256]
    - [50, 16.37]
  - - [6784, 64, 1, 1280]
    - [16, 26.308]
  - - [4288, 1024, 1, 32]
    - [51, 7.363]
  - - [1408, 64, 1, 3328]
    - [7, 15.789]
  - - [2944, 448, 1, 1280]
    - [34, 50.72]
  - - [6784, 32, 1, 1280]
    - [7, 14.102]
  - - [2944, 64, 1, 1280]
    - [59, 14.376]
  - - [704, 448, 1, 1]
    - [11, 0.03]
  - - [32, 128, 1, 32]
    - [12, 0.017]
  - - [1, 128, 1, 1]
    - [86, 0.0]
  - - [5888, 1, 1, 1]
    - [11, 0.001]
  - - [5888, 1856, 1, 3328]
    - [21, 81.251]
  - - [2368, 3584, 1, 256]
    - [43, 42.277]
  - - [4288, 1408, 1, 3328]
    - [4, 81.313]
  - - [1856, 32, 1, 3328]
    - [7, 10.706]
  - - [2944, 32, 1, 256]
    - [7, 2.303]
  - - [128, 64, 1, 1]
    - [76, 0.001]
  - - [256, 1024, 1, 3328]
    - [16, 28.083]
  - - [32, 448, 1, 256]
    - [104, 0.401]
  - - [1856, 64, 1, 3328]
    - [60, 14.846]
  - - [256, 5056, 1, 256]
    - [34, 20.071]
  - - [5888, 2944, 1, 3328]
    - [21, 88.694]
  - - [2368, 1408, 1, 3328]
    - [3, 76.555]
  - - [5888, 704, 1, 32]
    - [107, 6.47]
  - - [2944, 704, 1, 1]
    - [1, 0.119]
  - - [6784, 1856, 1, 256]
    - [13, 42.375]
  - - [1, 704, 1, 256]
    - [24, 0.02]
  - - [1856, 1856, 1, 1]
    - [139, 0.162]
  - - [5888, 32, 1, 256]
    - [10, 4.767]
  - - [128, 704, 1, 256]
    - [24, 2.499]
  - - [256, 1408, 1, 3328]
    - [16, 37.438]
  - - [2944, 128, 1, 1]
    - [31, 0.034]
  - - [32, 256, 1, 3328]
    - [26, 1.567]
  - - [2944, 704, 1, 3328]
    - [9, 65.413]
  - - [704, 1024, 1, 32]
    - [5, 2.166]
  - - [2368, 1856, 1, 32]
    - [5, 7.474]
  - - [5056, 4288, 1, 3328]
    - [21, 88.1]
  - - [3584, 448, 1, 3328]
    - [33, 70.085]
  - - [256, 32, 1, 32]
    - [12, 0.033]
  - - [64, 256, 1, 3328]
    - [20, 3.167]
  - - [256, 6784, 1, 1]
    - [1, 0.109]
  - - [1024, 3584, 1, 32]
    - [31, 6.271]
  - - [256, 6784, 1, 32]
    - [31, 4.066]
  - - [2944, 1408, 1, 32]
    - [1, 6.498]
  - - [4288, 3584, 1, 1]
    - [5, 0.255]
  - - [1, 704, 1, 1]
    - [11, 0.0]
  - - [5056, 448, 1, 3328]
    - [9, 71.731]
  - - [3584, 64, 1, 256]
    - [27, 4.974]
  - - [64, 1856, 1, 32]
    - [140, 0.424]
  - - [64, 1856, 1, 3328]
    - [10, 15.627]
  - - [6784, 3584, 1, 32]
    - [141, 9.612]
  - - [4288, 1856, 1, 256]
    - [43, 42.117]
  - - [1856, 2944, 1, 256]
    - [138, 36.565]
  - - [128, 448, 1, 1]
    - [11, 0.006]
  - - [64, 128, 1, 32]
    - [47, 0.035]
  - - [704, 1, 1, 1280]
    - [81, 0.074]
  - - [2944, 5888, 1, 1]
    - [142, 0.236]
  - - [1024, 1856, 1, 3328]
    - [128, 67.418]
  - - [5888, 1024, 1, 32]
    - [1, 7.522]
  - - [3584, 256, 1, 1280]
    - [34, 35.568]
  - - [1024, 1, 1, 1]
    - [18, 0.0]
  - - [1408, 5056, 1, 1280]
    - [43, 73.751]
  - - [3584, 128, 1, 1280]
    - [27, 25.251]
  - - [5056, 6784, 1, 256]
    - [13, 51.073]
  - - [256, 1856, 1, 256]
    - [27, 9.651]
  - - [5888, 32, 1, 1280]
    - [55, 14.152]
  - - [256, 128, 1, 32]
    - [11, 0.131]
  - - [32, 1856, 1, 1280]
    - [17, 5.948]
  - - [2944, 5056, 1, 1]
    - [39, 0.227]
  - - [448, 128, 1, 1]
    - [18, 0.006]
  - - [256, 704, 1, 32]
    - [12, 0.602]
  - - [256, 704, 1, 1280]
    - [52, 14.049]
  - - [1, 2368, 1, 1]
    - [66, 0.0]
  - - [5888, 5888, 1, 1280]
    - [21, 82.995]
  - - [256, 2944, 1, 1280]
    - [143, 39.811]
  - - [2944, 256, 1, 3328]
    - [143, 58.265]
  - - [5056, 2944, 1, 1280]
    - [21, 76.773]
  - - [704, 1024, 1, 3328]
    - [64, 55.503]
  - - [2368, 1856, 1, 1280]
    - [13, 62.753]
  - - [448, 2944, 1, 1]
    - [5, 0.099]
  - - [6784, 2944, 1, 1]
    - [39, 0.242]
  - - [2944, 1024, 1, 32]
    - [31, 5.72]
  - - [2944, 1024, 1, 1280]
    - [57, 57.812]
  - - [1408, 64, 1, 32]
    - [44, 0.328]
  - - [5056, 5056, 1, 1]
    - [123, 0.278]
  - - [2368, 4288, 1, 256]
    - [15, 44.644]
  - - [448, 1856, 1, 1280]
    - [6, 43.446]
  - - [2368, 448, 1, 1]
    - [5, 0.081]
  - - [448, 2944, 1, 32]
    - [5, 3.421]
  - - [448, 2944, 1, 1280]
    - [34, 50.451]
  - - [2944, 6784, 1, 1280]
    - [21, 80.498]
  - - [256, 6784, 1, 1280]
    - [53, 58.109]
  - - [128, 2368, 1, 1280]
    - [16, 21.015]
  - - [3584, 2368, 1, 32]
    - [31, 8.159]
  - - [704, 32, 1, 32]
    - [18, 0.09]
  - - [6784, 3584, 1, 3328]
    - [21, 87.131]
  - - [128, 32, 1, 256]
    - [20, 0.118]
  - - [128, 1408, 1, 1280]
    - [59, 14.202]
  - - [64, 32, 1, 1280]
    - [20, 0.214]
  - - [128, 1856, 1, 3328]
    - [61, 25.092]
  - - [2944, 2944, 1, 256]
    - [43, 40.779]
  - - [1408, 1024, 1, 3328]
    - [115, 64.204]
  - - [5056, 2368, 1, 1280]
    - [21, 74.906]
  - - [448, 128, 1, 32]
    - [11, 0.227]
  - - [2368, 64, 1, 3328]
    - [52, 17.647]
  - - [32, 5056, 1, 3328]
    - [10, 19.444]
  - - [448, 2944, 1, 3328]
    - [34, 63.81]
  - - [2944, 1024, 1, 1]
    - [28, 0.143]
  - - [2368, 128, 1, 1280]
    - [16, 21.639]
  - - [3584, 704, 1, 256]
    - [33, 27.99]
  - - [2368, 5888, 1, 3328]
    - [15, 86.041]
  - - [4288, 2368, 1, 1]
    - [63, 0.237]
  - - [1408, 3584, 1, 32]
    - [31, 7.107]
  - - [2944, 4288, 1, 32]
    - [31, 8.995]
  - - [5888, 1408, 1, 1280]
    - [21, 71.249]
  - - [3584, 5056, 1, 1280]
    - [21, 79.598]
  - - [5888, 6784, 1, 1280]
    - [21, 83.898]
  - - [64, 1856, 1, 1]
    - [12, 0.011]
  - - [704, 128, 1, 32]
    - [134, 0.325]
  - - [3584, 2944, 1, 1]
    - [39, 0.221]
  - - [128, 3584, 1, 3328]
    - [64, 34.471]
  - - [256, 4288, 1, 3328]
    - [125, 60.439]
  - - [4288, 64, 1, 1]
    - [99, 0.026]
  - - [1, 1408, 1, 1280]
    - [20, 0.14]
  - - [5056, 32, 1, 1280]
    - [10, 12.477]
  - - [1856, 704, 1, 32]
    - [8, 3.49]
  - - [1024, 1856, 1, 1]
    - [134, 0.11]
  - - [704, 5056, 1, 3328]
    - [45, 81.827]
  - - [1024, 3584, 1, 3328]
    - [15, 79.542]
  - - [5888, 256, 1, 3328]
    - [115, 66.726]
  - - [1856, 1408, 1, 1]
    - [62, 0.15]
  - - [2944, 448, 1, 32]
    - [1, 3.213]
  - - [128, 448, 1, 256]
    - [24, 1.606]
  - - [128, 1024, 1, 1]
    - [11, 0.013]
  - - [32, 32, 1, 256]
    - [20, 0.028]
  - - [4288, 5056, 1, 1280]
    - [21, 80.622]
  - - [1856, 1856, 1, 3328]
    - [33, 79.975]
  - - [1024, 2368, 1, 256]
    - [13, 28.088]
  - - [4288, 2368, 1, 3328]
    - [9, 85.441]
  - - [256, 64, 1, 32]
    - [11, 0.066]
  - - [1, 1024, 1, 1280]
    - [7, 0.105]
  - - [5056, 128, 1, 32]
    - [5, 1.882]
  - - [5888, 3584, 1, 256]
    - [46, 47.109]
  - - [1024, 5056, 1, 32]
    - [31, 7.152]
  - - [5888, 448, 1, 1280]
    - [33, 62.259]
  - - [704, 5888, 1, 3328]
    - [45, 78.338]
  - - [1024, 1408, 1, 256]
    - [6, 21.659]
  - - [3584, 2944, 1, 1280]
    - [21, 76.157]
  - - [1, 5056, 1, 256]
    - [24, 0.124]
  - - [256, 1024, 1, 1]
    - [12, 0.023]
  - - [32, 32, 1, 3328]
    - [20, 0.198]
  - - [2368, 1, 1, 3328]
    - [20, 0.433]
  - - [4288, 1856, 1, 1280]
    - [4, 72.87]
  - - [3584, 5888, 1, 1]
    - [39, 0.248]
  - - [5888, 4288, 1, 256]
    - [46, 48.035]
  - - [1024, 2944, 1, 1280]
    - [29, 59.555]
  - - [6784, 1, 1, 1]
    - [47, 0.001]
  - - [1408, 64, 1, 1280]
    - [7, 8.962]
  - - [1, 256, 1, 1280]
    - [20, 0.027]
  - - [2944, 3584, 1, 256]
    - [144, 44.753]
  - - [1, 128, 1, 1280]
    - [7, 0.013]
  - - [1024, 256, 1, 32]
    - [12, 0.867]
  - - [5888, 1, 1, 1280]
    - [7, 0.485]
  - - [2368, 32, 1, 1280]
    - [37, 7.695]
  - - [5888, 1856, 1, 1]
    - [145, 0.209]
  - - [6784, 128, 1, 1280]
    - [33, 45.207]
  - - [6784, 2368, 1, 3328]
    - [4, 85.39]
  - - [1, 64, 1, 256]
    - [10, 0.002]
  - - [704, 128, 1, 1]
    - [99, 0.009]
  - - [1408, 4288, 1, 32]
    - [31, 7.532]
  - - [256, 64, 1, 1280]
    - [20, 1.725]
  - - [256, 448, 1, 256]
    - [10, 2.757]
  - - [1856, 1024, 1, 1280]
    - [34, 50.662]
  - - [5888, 1856, 1, 256]
    - [43, 42.251]
  - - [5056, 1856, 1, 1]
    - [63, 0.233]
  - - [5888, 2368, 1, 256]
    - [46, 43.475]
  - - [1408, 1024, 1, 32]
    - [1, 3.56]
  - - [32, 704, 1, 256]
    - [19, 0.643]
  - - [2944, 1, 1, 256]
    - [2, 0.08]
  - - [32, 4288, 1, 256]
    - [60, 3.166]
  - - [5056, 1856, 1, 32]
    - [5, 9.611]
  - - [5056, 1856, 1, 1280]
    - [6, 74.725]
  - - [1, 64, 1, 1]
    - [12, 0.0]
  - - [1408, 5888, 1, 3328]
    - [115, 80.115]
  - - [1408, 704, 1, 3328]
    - [15, 55.889]
  - - [5056, 704, 1, 3328]
    - [4, 82.129]
  - - [704, 64, 1, 1280]
    - [7, 4.608]
  - - [1, 704, 1, 1280]
    - [26, 0.073]
  - - [5888, 6784, 1, 1]
    - [39, 0.266]
  - - [5888, 4288, 1, 32]
    - [1, 9.602]
  - - [1408, 3584, 1, 256]
    - [46, 36.661]
  - - [1856, 704, 1, 1]
    - [5, 0.095]
  - - [6784, 256, 1, 1]
    - [146, 0.107]
  - - [2944, 1, 1, 1]
    - [11, 0.0]
  - - [256, 1856, 1, 3328]
    - [45, 36.507]
  - - [4288, 128, 1, 1280]
    - [27, 30.211]
  - - [6784, 256, 1, 1280]
    - [53, 57.708]
  - - [128, 4288, 1, 256]
    - [132, 10.994]
  - - [128, 128, 1, 32]
    - [11, 0.066]
  - - [128, 1408, 1, 32]
    - [51, 0.602]
  - - [6784, 128, 1, 32]
    - [134, 2.336]
  - - [1408, 448, 1, 1]
    - [31, 0.051]
  - - [2368, 704, 1, 3328]
    - [33, 73.711]
  - - [704, 128, 1, 3328]
    - [7, 15.715]
  - - [2944, 1856, 1, 32]
    - [31, 7.216]
  - - [1024, 64, 1, 1]
    - [18, 0.007]
  - - [1408, 32, 1, 1280]
    - [40, 4.512]
  - - [704, 1, 1, 256]
    - [2, 0.02]
  - - [2368, 1408, 1, 256]
    - [77, 32.162]
  - - [2368, 1856, 1, 1]
    - [5, 0.189]
  - - [4288, 1408, 1, 1]
    - [41, 0.205]
  - - [3584, 2368, 1, 1280]
    - [21, 71.91]
  - - [64, 5056, 1, 1280]
    - [147, 21.02]
  - - [1408, 2944, 1, 1]
    - [28, 0.162]
  - - [4288, 1408, 1, 32]
    - [5, 8.276]
  - - [5888, 2944, 1, 256]
    - [46, 46.638]
  - - [128, 64, 1, 1280]
    - [20, 0.862]
  - - [1408, 2944, 1, 32]
    - [1, 6.497]
  - - [1, 3584, 1, 1280]
    - [17, 0.349]
  - - [64, 64, 1, 32]
    - [47, 0.016]
  - - [448, 1408, 1, 32]
    - [31, 1.88]
  - - [128, 5056, 1, 256]
    - [132, 12.362]
  - - [1, 1, 1, 1280]
    - [17, 0.0]
  - - [64, 704, 1, 256]
    - [37, 1.25]
  - - [5888, 6784, 1, 256]
    - [148, 49.213]
  - - [6784, 5888, 1, 1]
    - [39, 0.267]
  - - [64, 4288, 1, 256]
    - [16, 5.82]
  - - [1, 448, 1, 1280]
    - [30, 0.045]
  - - [1024, 1024, 1, 1]
    - [31, 0.071]
  - - [6784, 5888, 1, 1280]
    - [21, 83.147]
  - - [1024, 4288, 1, 32]
    - [31, 6.736]
  - - [1856, 1, 1, 1280]
    - [7, 0.181]
  - - [3584, 5888, 1, 256]
    - [46, 48.848]
  - - [5056, 2368, 1, 1]
    - [8, 0.25]
  - - [256, 1408, 1, 1280]
    - [16, 25.481]
  - - [64, 256, 1, 32]
    - [12, 0.066]
  - - [64, 5888, 1, 3328]
    - [16, 32.782]
  - - [6784, 64, 1, 3328]
    - [16, 34.785]
  - - [5056, 448, 1, 1]
    - [1, 0.133]
  - - [2944, 448, 1, 3328]
    - [149, 62.44]
  - - [2368, 1024, 1, 1280]
    - [15, 62.333]
  - - [1856, 6784, 1, 256]
    - [124, 46.203]
  - - [4288, 32, 1, 1280]
    - [60, 11.117]
  - - [448, 1408, 1, 1280]
    - [27, 33.817]
  - - [5056, 448, 1, 32]
    - [1, 5.136]
  - - [3584, 2944, 1, 32]
    - [31, 8.705]
  - - [2368, 128, 1, 1]
    - [5, 0.028]
  - - [32, 128, 1, 1280]
    - [20, 0.419]
  - - [3584, 1856, 1, 32]
    - [1, 7.542]
  - - [128, 128, 1, 3328]
    - [30, 3.183]
  - - [5056, 64, 1, 256]
    - [27, 6.965]
  - - [64, 448, 1, 3328]
    - [22, 5.375]
  - - [4288, 1408, 1, 1280]
    - [6, 71.72]
  - - [6784, 2368, 1, 1]
    - [39, 0.234]
  - - [32, 5056, 1, 256]
    - [150, 3.794]
  - - [704, 128, 1, 256]
    - [24, 2.3]
  - - [704, 5056, 1, 1]
    - [62, 0.164]
  - - [256, 1024, 1, 32]
    - [5, 0.844]
  - - [256, 1024, 1, 1280]
    - [16, 18.352]
  - - [2368, 128, 1, 256]
    - [71, 6.673]
  - - [32, 64, 1, 256]
    - [20, 0.06]
  - - [2368, 1408, 1, 1280]
    - [6, 65.956]
  - - [128, 256, 1, 32]
    - [11, 0.131]
  - - [64, 6784, 1, 32]
    - [11, 1.294]
  - - [6784, 32, 1, 256]
    - [10, 4.673]
  - - [256, 4288, 1, 1]
    - [5, 0.075]
  - - [5888, 1408, 1, 1]
    - [151, 0.201]
  - - [1024, 4288, 1, 1280]
    - [43, 70.202]
  - - [1856, 4288, 1, 1]
    - [51, 0.221]
  - - [128, 2944, 1, 256]
    - [152, 7.992]
  - - [3584, 4288, 1, 256]
    - [46, 46.707]
  - - [2368, 2944, 1, 256]
    - [77, 40.457]
  - - [3584, 128, 1, 32]
    - [12, 1.367]
  - - [3584, 128, 1, 3328]
    - [127, 35.32]
  - - [704, 5056, 1, 256]
    - [6, 33.224]
  - - [1856, 4288, 1, 32]
    - [5, 9.346]
  - - [64, 256, 1, 1280]
    - [20, 1.725]
  - - [4288, 1024, 1, 1280]
    - [6, 70.358]
  - - [1, 4288, 1, 256]
    - [24, 0.112]
  - - [64, 2368, 1, 1]
    - [131, 0.014]
  - - [4288, 6784, 1, 32]
    - [8, 11.679]
  - - [704, 704, 1, 3328]
    - [114, 38.554]
  - - [128, 2944, 1, 1]
    - [93, 0.033]
  - - [3584, 1408, 1, 256]
    - [46, 36.026]
  - - [704, 3584, 1, 3328]
    - [45, 76.11]
  - - [5056, 448, 1, 1280]
    - [9, 58.435]
  - - [1408, 2944, 1, 1280]
    - [43, 66.791]
  - - [5888, 704, 1, 1280]
    - [33, 64.976]
  - - [64, 64, 1, 256]
    - [10, 0.114]
  - - [704, 1408, 1, 1280]
    - [36, 40.61]
  - - [4288, 5888, 1, 256]
    - [43, 50.117]
  - - [6784, 64, 1, 32]
    - [11, 1.315]
  - - [3584, 3584, 1, 3328]
    - [21, 86.53]
  - - [2944, 6784, 1, 32]
    - [153, 9.388]
  - - [448, 64, 1, 32]
    - [11, 0.116]
  - - [5056, 256, 1, 1]
    - [5, 0.097]
  - - [64, 6784, 1, 1280]
    - [16, 26.198]
  - - [2944, 2368, 1, 3328]
    - [115, 82.147]
  - - [1, 4288, 1, 1]
    - [66, 0.0]
  - - [1408, 128, 1, 256]
    - [10, 4.192]
  - - [1024, 1856, 1, 1280]
    - [138, 49.833]
  - - [448, 5888, 1, 256]
    - [34, 29.15]
  - - [1024, 5888, 1, 256]
    - [33, 37.64]
  - - [704, 1408, 1, 256]
    - [34, 18.564]
  - - [6784, 2944, 1, 3328]
    - [21, 89.054]
  - - [1408, 2368, 1, 256]
    - [33, 30.822]
  - - [64, 128, 1, 1280]
    - [20, 0.869]
  - - [5888, 32, 1, 3328]
    - [7, 19.145]
  - - [1408, 5056, 1, 256]
    - [43, 39.334]
  - - [1024, 1408, 1, 32]
    - [1, 3.536]
  - - [4288, 128, 1, 32]
    - [12, 1.609]
  - - [6784, 704, 1, 1]
    - [39, 0.173]
  - - [448, 704, 1, 256]
    - [27, 6.944]
  - - [704, 3584, 1, 32]
    - [5, 5.615]
  - - [1856, 256, 1, 3328]
    - [64, 37.038]
  - - [448, 1024, 1, 1280]
    - [27, 26.253]
  - - [4288, 4288, 1, 1]
    - [41, 0.264]
  - - [5056, 2944, 1, 1]
    - [154, 0.255]
  - - [64, 2368, 1, 3328]
    - [10, 18.155]
  - - [256, 704, 1, 3328]
    - [59, 22.083]
  - - [1, 2944, 1, 1]
    - [66, 0.0]
  - - [1024, 1024, 1, 256]
    - [34, 17.381]
  - - [3584, 1, 1, 1]
    - [47, 0.0]
  - - [256, 2944, 1, 32]
    - [58, 2.363]
  - - [6784, 4288, 1, 3328]
    - [21, 89.904]
  - - [5056, 2944, 1, 3328]
    - [21, 84.205]
  - - [704, 1024, 1, 1280]
    - [6, 38.362]
  - - [256, 3584, 1, 1280]
    - [34, 35.857]
  - - [2368, 1856, 1, 3328]
    - [9, 72.404]
  - - [1856, 4288, 1, 1280]
    - [45, 73.571]
  - - [1, 1024, 1, 256]
    - [24, 0.028]
  - - [3584, 448, 1, 1]
    - [155, 0.099]
  - - [2944, 1024, 1, 3328]
    - [156, 70.426]
  - - [32, 1408, 1, 3328]
    - [81, 8.083]
  - - [128, 1, 1, 3328]
    - [22, 0.024]
  - - [5888, 5056, 1, 32]
    - [96, 9.704]
  - - [704, 2944, 1, 1]
    - [63, 0.128]
  - - [3584, 448, 1, 32]
    - [31, 3.759]
  - - [3584, 448, 1, 1280]
    - [33, 54.483]
  - - [2944, 6784, 1, 3328]
    - [21, 90.365]
  - - [1856, 2368, 1, 1280]
    - [34, 63.191]
  - - [6784, 1024, 1, 1280]
    - [157, 71.405]
  - - [6784, 3584, 1, 1280]
    - [21, 80.513]
  - - [1, 5056, 1, 3328]
    - [17, 0.729]
  - - [128, 128, 1, 1]
    - [76, 0.002]
  - - [128, 2368, 1, 32]
    - [12, 1.003]
  - - [128, 1408, 1, 3328]
    - [59, 21.659]
  - - [2944, 32, 1, 3328]
    - [23, 15.912]
  - - [704, 1856, 1, 256]
    - [34, 20.937]
  - - [1408, 1408, 1, 1]
    - [1, 0.112]
  - - [1408, 4288, 1, 256]
    - [33, 37.529]
  - - [256, 5056, 1, 3328]
    - [15, 71.056]
  - - [2368, 64, 1, 1280]
    - [60, 11.687]
  - - [1856, 448, 1, 32]
    - [31, 2.324]
  - - [1408, 448, 1, 256]
    - [27, 12.461]
  - - [32, 128, 1, 256]
    - [20, 0.118]
  - - [448, 1024, 1, 1]
    - [11, 0.038]
  - - [128, 1024, 1, 1280]
    - [10, 10.501]
  - - [448, 6784, 1, 1]
    - [41, 0.16]
  - - [704, 2944, 1, 256]
    - [13, 25.438]
  - - [1408, 1408, 1, 256]
    - [9, 24.228]
  - - [448, 6784, 1, 32]
    - [5, 6.226]
  - - [1, 64, 1, 1280]
    - [30, 0.007]
  - - [1408, 1856, 1, 1]
    - [1, 0.14]
  - - [4288, 448, 1, 32]
    - [5, 4.617]
  - - [4288, 448, 1, 1280]
    - [9, 49.559]
  - - [2944, 704, 1, 32]
    - [1, 4.584]
  - - [1024, 704, 1, 256]
    - [27, 13.769]
  - - [448, 4288, 1, 1]
    - [41, 0.124]
  - - [3584, 5056, 1, 1]
    - [39, 0.243]
  - - [1408, 3584, 1, 1280]
    - [15, 71.137]
  - - [6784, 448, 1, 1280]
    - [6, 58.673]
  - - [3584, 5056, 1, 3328]
    - [21, 88.032]
  - - [2368, 2368, 1, 32]
    - [5, 8.086]
  - - [64, 5888, 1, 32]
    - [12, 1.171]
  - - [1856, 448, 1, 256]
    - [27, 15.572]
  - - [128, 1024, 1, 256]
    - [52, 3.049]
  - - [3584, 64, 1, 3328]
    - [16, 23.119]
  - - [5888, 2944, 1, 32]
    - [31, 9.3]
  - - [2944, 1, 1, 1280]
    - [37, 0.293]
  - - [1856, 2944, 1, 32]
    - [41, 7.842]
  - - [5056, 1408, 1, 1]
    - [5, 0.216]
  - - [5888, 1408, 1, 3328]
    - [21, 79.847]
  - - [448, 4288, 1, 256]
    - [34, 23.985]
  - - [6784, 1024, 1, 1]
    - [69, 0.21]
  - - [256, 448, 1, 1]
    - [12, 0.011]
  - - [128, 5888, 1, 3328]
    - [6, 53.622]
  - - [6784, 1024, 1, 32]
    - [31, 7.901]
  - - [256, 448, 1, 32]
    - [58, 0.405]
  - - [6784, 3584, 1, 1]
    - [158, 0.248]
  - - [2944, 2368, 1, 32]
    - [31, 7.757]
  - - [3584, 6784, 1, 3328]
    - [21, 87.954]
  - - [448, 128, 1, 1280]
    - [7, 5.824]
  - - [64, 3584, 1, 32]
    - [12, 0.773]
  - - [64, 3584, 1, 1280]
    - [61, 15.98]
  - - [6784, 1408, 1, 256]
    - [46, 39.583]
  - - [5056, 1024, 1, 32]
    - [5, 7.745]
  - - [1024, 5056, 1, 1280]
    - [15, 71.93]
  - - [4288, 3584, 1, 256]
    - [46, 46.955]
  - - [2368, 256, 1, 3328]
    - [143, 47.06]
  - - [448, 6784, 1, 1280]
    - [43, 60.874]
  - - [1856, 5888, 1, 1]
    - [41, 0.24]
  - - [256, 5888, 1, 32]
    - [31, 3.697]
  - - [3584, 1, 1, 3328]
    - [37, 0.625]
  - - [4288, 32, 1, 256]
    - [10, 3.326]
  - - [256, 64, 1, 1]
    - [47, 0.002]
  - - [4288, 5056, 1, 32]
    - [5, 11.361]
  - - [4288, 5056, 1, 3328]
    - [21, 87.267]
  - - [1856, 5888, 1, 32]
    - [8, 9.974]
  - - [1856, 5888, 1, 1280]
    - [15, 74.761]
  - - [256, 256, 1, 1280]
    - [37, 6.563]
  - - [704, 2368, 1, 1280]
    - [45, 56.97]
  - - [4288, 2368, 1, 1280]
    - [21, 76.069]
  - - [2944, 5056, 1, 256]
    - [46, 46.463]
  - - [32, 1856, 1, 256]
    - [19, 1.647]
  - - [64, 5888, 1, 1280]
    - [16, 23.835]
  - - [1, 1856, 1, 1280]
    - [17, 0.177]
  - - [2944, 4288, 1, 1]
    - [39, 0.222]
  - - [5056, 5888, 1, 32]
    - [5, 12.005]
  - - [704, 1, 1, 3328]
    - [22, 0.135]
  - - [448, 256, 1, 1280]
    - [159, 9.088]
  - - [1408, 256, 1, 1]
    - [31, 0.032]
  - - [2368, 5056, 1, 3328]
    - [115, 83.055]
  - - [1024, 5056, 1, 3328]
    - [15, 85.105]
  - - [704, 704, 1, 1280]
    - [27, 27.28]
  - - [128, 32, 1, 3328]
    - [30, 0.784]
  - - [1024, 6784, 1, 32]
    - [31, 7.901]
  - - [3584, 2944, 1, 3328]
    - [21, 87.16]
  - - [128, 1856, 1, 256]
    - [160, 5.076]
  - - [32, 32, 1, 1280]
    - [20, 0.107]
  - - [1408, 5888, 1, 1]
    - [49, 0.201]
  - - [1, 3584, 1, 256]
    - [24, 0.096]
  - - [704, 4288, 1, 32]
    - [5, 6.184]
  - - [1408, 5888, 1, 32]
    - [31, 8.144]
  - - [6784, 1024, 1, 3328]
    - [3, 82.349]
  - - [1856, 1, 1, 3328]
    - [22, 0.348]
  - - [5056, 1408, 1, 256]
    - [43, 40.901]
  - - [1, 1, 1, 256]
    - [24, 0.0]
  - - [2944, 1408, 1, 256]
    - [43, 33.026]
  - - [4288, 1, 1, 1]
    - [11, 0.0]
  - - [2368, 2368, 1, 256]
    - [77, 37.351]
  - - [1, 448, 1, 256]
    - [24, 0.013]
  - - [1408, 6784, 1, 1]
    - [39, 0.208]
  - - [3584, 32, 1, 3328]
    - [60, 14.931]
  - - [128, 3584, 1, 1]
    - [93, 0.038]
  - - [1856, 1, 1, 256]
    - [2, 0.051]
  - - [6784, 6784, 1, 1280]
    - [21, 84.472]
  - - [1024, 5888, 1, 1]
    - [122, 0.185]
  - - [6784, 32, 1, 3328]
    - [7, 21.591]
  - - [1408, 32, 1, 256]
    - [37, 1.226]
  - - [128, 3584, 1, 32]
    - [12, 1.402]
  - - [1856, 3584, 1, 256]
    - [43, 39.075]
  - - [2944, 64, 1, 256]
    - [10, 4.418]
  - - [2368, 704, 1, 32]
    - [5, 4.324]
  - - [256, 5888, 1, 1280]
    - [33, 51.755]
  - - [448, 2368, 1, 32]
    - [8, 3.036]
  - - [448, 2368, 1, 3328]
    - [36, 59.636]
  - - [64, 1408, 1, 256]
    - [161, 2.363]
  - - [5056, 32, 1, 32]
    - [47, 0.545]
  - - [1024, 704, 1, 3328]
    - [6, 55.847]
  - - [32, 5888, 1, 3328]
    - [10, 19.789]
  - - [256, 64, 1, 3328]
    - [20, 3.2]
  - - [32, 1408, 1, 1280]
    - [19, 4.481]
  - - [64, 32, 1, 256]
    - [20, 0.058]
  - - [1856, 1024, 1, 3328]
    - [162, 64.665]
  - - [2368, 1, 1, 1]
    - [11, 0.0]
  - - [5056, 2368, 1, 3328]
    - [4, 82.886]
  - - [128, 1, 1, 1280]
    - [19, 0.013]
  - - [704, 4288, 1, 1280]
    - [43, 61.057]
  - - [704, 256, 1, 256]
    - [10, 4.296]
  - - [512, 128, 1, 784]
    - [163, 3.446]
  - - [1024, 256, 1, 196]
    - [133, 3.911]
  - - [256, 64, 1, 3136]
    - [95, 2.27]
  - - [256, 1024, 1, 196]
    - [93, 3.911]
  - - [64, 256, 1, 3136]
    - [95, 2.288]
  - - [128, 512, 1, 784]
    - [120, 3.466]
  - - [64, 64, 1, 3136]
    - [95, 0.563]
  - - [2560, 7000, 1, 2560]
    - [21, 85.501]
  - - [7680, 12000, 1, 2560]
    - [21, 90.91]
  - - [5124, 9124, 1, 1760]
    - [164, 82.513]
  - - [1760, 32, 1, 1760]
    - [165, 5.031]
  - - [512, 24000, 1, 1536]
    - [43, 75.783]
  - - [3072, 24000, 1, 1024]
    - [21, 84.217]
  - - [2048, 400, 1, 512]
    - [27, 23.052]
  - - [2560, 128, 1, 2560]
    - [61, 32.703]
  - - [3072, 16, 1, 1024]
    - [40, 4.08]
  - - [512, 48000, 1, 2816]
    - [15, 86.099]
  - - [512, 48000, 1, 2048]
    - [15, 84.928]
  - - [1760, 64, 1, 1760]
    - [163, 9.927]
  - - [2048, 1600, 1, 2048]
    - [6, 70.53]
  - - [512, 48000, 1, 1536]
    - [15, 78.729]
  - - [2560, 32, 1, 2560]
    - [37, 12.436]
  - - [8448, 5984, 1, 2816]
    - [21, 89.918]
  - - [4096, 3200, 1, 1024]
    - [21, 75.874]
  - - [1024, 24000, 1, 2560]
    - [15, 86.348]
  - - [1760, 6400, 1, 1760]
    - [49, 75.027]
  - - [5124, 9124, 1, 2048]
    - [166, 86.395]
  - - [1024, 700, 1, 512]
    - [34, 23.36]
  - - [4608, 32, 1, 1536]
    - [60, 13.019]
  - - [3072, 64, 1, 1024]
    - [167, 12.815]
  - - [16384, 3200, 1, 4096]
    - [21, 90.007]
  - - [2560, 16, 1, 2560]
    - [22, 6.421]
  - - [1024, 48000, 1, 2560]
    - [15, 89.301]
  - - [8448, 48000, 1, 2816]
    - [21, 92.43]
  - - [2048, 32, 1, 2048]
    - [40, 9.001]
  - - [2560, 3200, 1, 2560]
    - [21, 76.046]
  - - [16384, 800, 1, 4096]
    - [73, 82.553]
  - - [4608, 24000, 1, 1536]
    - [21, 88.587]
  - - [7680, 48000, 1, 2560]
    - [125, 92.503]
  - - [3072, 48000, 1, 1024]
    - [21, 85.508]
  - - [1760, 16, 1, 1760]
    - [165, 2.561]
  - - [8192, 3200, 1, 2048]
    - [21, 86.09]
  - - [512, 24000, 1, 2816]
    - [43, 81.902]
  - - [4096, 400, 1, 1024]
    - [105, 40.132]
  - - [6144, 48000, 1, 2560]
    - [125, 92.037]
  - - [4608, 48000, 1, 1536]
    - [21, 89.677]
  - - [4096, 128, 1, 4096]
    - [127, 42.596]
  - - [2048, 800, 1, 512]
    - [33, 36.918]
  - - [4608, 5984, 1, 1536]
    - [21, 83.775]
  - - [4096, 1600, 1, 1024]
    - [125, 69.493]
  - - [6144, 5984, 1, 2048]
    - [21, 87.592]
  - - [7680, 24000, 1, 2560]
    - [125, 91.956]
  - - [6144, 48000, 1, 2048]
    - [125, 91.957]
  - - [2048, 3200, 1, 2048]
    - [15, 82.094]
  - - [5124, 9124, 1, 2560]
    - [166, 86.576]
  - - [1024, 24000, 1, 1536]
    - [15, 81.568]
  - - [7680, 16, 1, 2560]
    - [10, 12.436]
  - - [2560, 6400, 1, 2560]
    - [21, 84.099]
  - - [2048, 128, 1, 2048]
    - [68, 23.814]
  - - [512, 16, 1, 500000]
    - [168, 6.724]
  - - [1024, 8, 1, 500000]
    - [169, 4.649]
  - - [512, 24000, 1, 2560]
    - [43, 81.157]
  - - [1024, 24000, 1, 2816]
    - [15, 87.245]
  - - [7680, 5984, 1, 2560]
    - [21, 88.811]
  - - [2048, 1600, 1, 512]
    - [43, 45.99]
  - - [2048, 7000, 1, 2048]
    - [21, 84.861]
  - - [1760, 800, 1, 1760]
    - [170, 50.487]
  - - [4096, 64, 1, 4096]
    - [147, 27.494]
  - - [7680, 32, 1, 2560]
    - [7, 16.917]
  - - [2560, 64, 1, 2560]
    - [52, 17.502]
  - - [3072, 128, 1, 1024]
    - [171, 23.505]
  - - [7680, 64, 1, 2560]
    - [43, 30.953]
  - - [1760, 128, 1, 1760]
    - [88, 15.897]
  - - [2560, 1600, 1, 2560]
    - [4, 73.332]
  - - [2048, 3200, 1, 512]
    - [144, 58.071]
  - - [2560, 800, 1, 2560]
    - [73, 67.124]
  - - [3072, 32, 1, 1024]
    - [7, 7.715]
  - - [6144, 32, 1, 2560]
    - [60, 18.117]
  - - [4608, 12000, 1, 1536]
    - [21, 87.052]
  - - [4096, 32, 1, 4096]
    - [52, 15.009]
  - - [6144, 24000, 1, 2048]
    - [125, 91.121]
  - - [8192, 800, 1, 2048]
    - [4, 74.712]
  - - [5124, 9124, 1, 4096]
    - [166, 90.951]
  - - [8448, 24000, 1, 2816]
    - [21, 92.339]
  - - [1024, 48000, 1, 1536]
    - [15, 84.847]
  - - [7680, 128, 1, 2560]
    - [36, 45.953]
  - - [8192, 1600, 1, 2048]
    - [9, 83.132]
  - - [4096, 800, 1, 1024]
    - [33, 60.007]
  - - [1024, 16, 1, 500000]
    - [172, 8.65]
  - - [2048, 800, 1, 2048]
    - [33, 65.405]
  - - [1760, 3200, 1, 1760]
    - [173, 68.809]
  - - [512, 48000, 1, 2560]
    - [15, 85.104]
  - - [8448, 16, 1, 2816]
    - [60, 13.035]
  - - [2048, 64, 1, 2048]
    - [59, 12.707]
  - - [512, 24000, 1, 2048]
    - [15, 79.711]
  - - [16384, 1600, 1, 4096]
    - [9, 88.736]
  - - [4608, 16, 1, 1536]
    - [37, 7.505]
  - - [1024, 24000, 1, 2048]
    - [13, 85.827]
  - - [8192, 400, 1, 2048]
    - [9, 65.746]
  - - [2048, 6400, 1, 2048]
    - [15, 84.715]
  - - [6144, 12000, 1, 2048]
    - [21, 90.029]
  - - [512, 8, 1, 500000]
    - [174, 3.778]
  - - [1760, 7000, 1, 1760]
    - [175, 79.575]
  - - [1024, 48000, 1, 2816]
    - [15, 90.135]
  - - [6144, 16, 1, 2560]
    - [7, 11.525]
  - - [8448, 32, 1, 2816]
    - [7, 19.448]
  - - [4096, 7000, 1, 4096]
    - [21, 91.214]
  - - [4096, 16, 1, 4096]
    - [40, 11.499]
  - - [6144, 24000, 1, 2560]
    - [125, 91.426]
  - - [2048, 16, 1, 2048]
    - [40, 4.37]
  - - [8448, 12000, 1, 2816]
    - [21, 92.008]
  - - [16384, 400, 1, 4096]
    - [9, 74.564]
  - - [1760, 1600, 1, 1760]
    - [176, 60.826]
  - - [1024, 48000, 1, 2048]
    - [13, 88.923]
  - - [4096, 4096, 1, 4096]
    - [9, 89.734]
  - - [512, 512, 1, 512]
    - [25, 10.217]
  - - [1024, 1024, 1, 1024]
    - [34, 39.024]
  - - [2049, 512, 1, 2048]
    - [32, 42.995]
  - - [2048, 2048, 1, 2049]
    - [177, 58.189]
  - - [1023, 512, 1, 1024]
    - [178, 24.268]
  - - [8192, 8191, 1, 8192]
    - [21, 94.348]
  - - [511, 512, 1, 512]
    - [160, 8.983]
  - - [1024, 512, 1, 1025]
    - [179, 18.347]
  - - [8192, 8192, 1, 8192]
    - [21, 94.357]
  - - [1024, 1024, 1, 1023]
    - [180, 27.719]
  - - [1024, 1025, 1, 1024]
    - [34, 38.32]
  - - [512, 512, 1, 511]
    - [181, 7.584]
  - - [2047, 2048, 1, 2048]
    - [90, 62.65]
  - - [1024, 1023, 1, 1024]
    - [34, 38.489]
  - - [2048, 511, 1, 2048]
    - [9, 50.203]
  - - [2048, 2049, 1, 2048]
    - [43, 73.297]
  - - [8192, 8192, 1, 8191]
    - [182, 87.166]
  - - [2047, 512, 1, 2048]
    - [32, 42.878]
  - - [1025, 1024, 1, 1024]
    - [32, 36.473]
  - - [3072, 513, 1, 3072]
    - [33, 69.572]
  - - [512, 513, 1, 512]
    - [25, 10.595]
  - - [512, 511, 1, 512]
    - [52, 10.267]
  - - [8191, 8192, 1, 8192]
    - [166, 92.999]
  - - [8192, 8193, 1, 8192]
    - [21, 94.357]
  - - [4096, 4097, 1, 4096]
    - [9, 89.704]
  - - [8192, 8192, 1, 8193]
    - [182, 87.398]
  - - [4096, 4095, 1, 4096]
    - [9, 89.598]
  - - [4096, 4096, 1, 4097]
    - [183, 76.147]
  - - [1024, 1024, 1, 1025]
    - [184, 28.492]
  - - [513, 512, 1, 512]
    - [178, 9.411]
  - - [2048, 2048, 1, 2048]
    - [43, 73.096]
  - - [4095, 4096, 1, 4096]
    - [166, 86.669]
  - - [8193, 8192, 1, 8192]
    - [166, 93.148]
  - - [4096, 4096, 1, 4095]
    - [183, 75.983]
  - - [1025, 512, 1, 1024]
    - [42, 24.512]
  - - [1024, 512, 1, 1023]
    - [185, 17.617]
  - - [2048, 513, 1, 2048]
    - [15, 51.36]
  - - [3072, 511, 1, 3072]
    - [112, 67.076]
  - - [2049, 2048, 1, 2048]
    - [90, 65.115]
  - - [2048, 2047, 1, 2048]
    - [43, 72.35]
  - - [1024, 511, 1, 1024]
    - [27, 26.362]
  - - [2048, 512, 1, 2047]
    - [186, 37.033]
  - - [2048, 2048, 1, 2047]
    - [183, 56.701]
  - - [4097, 4096, 1, 4096]
    - [166, 86.964]
  - - [1024, 513, 1, 1024]
    - [27, 25.789]
  - - [512, 512, 1, 513]
    - [123, 7.81]
  - - [2048, 512, 1, 2049]
    - [186, 39.169]
  - - [1023, 1024, 1, 1024]
    - [32, 33.948]
  - - [15, 14, 1, 64]
    - [86, 0.002]
  - - [17, 15, 1, 64]
    - [86, 0.002]
  - - [21, 17, 1, 64]
    - [86, 0.003]
  - - [30, 31, 1, 64]
    - [86, 0.007]
  - - [32, 35, 1, 64]
    - [187, 0.009]
  - - [27, 33, 1, 64]
    - [76, 0.007]
  - - [2, 4, 1, 1024]
    - [109, 0.001]
  - - [2, 32, 1, 1024]
    - [188, 0.005]
  - - [2, 2048, 1, 1024]
    - [17, 0.333]
  - - [64, 128, 512, 128]
    - [32, 15.009]
  - - [64, 512, 1, 512]
    - [24, 1.658]
  - - [64, 512, 64, 512]
    - [6, 25.96]
  - - [128, 128, 512, 64]
    - [158, 12.842]
  - - [512, 512, 1, 64]
    - [27, 1.63]
  - - [512, 512, 64, 64]
    - [189, 16.572]
  - - [1024, 4, 1, 1024]
    - [0, 0.462]
  - - [1024, 4, 1, 1024]
    - [80, 0.366]
  - - [1024, 32, 1, 1024]
    - [7, 2.8]
  - - [1024, 2048, 1, 1024]
    - [34, 50.3]
  - - [1024, 2048, 1, 4096]
    - [73, 73.99]
  - - [1024, 4096, 1, 1024]
    - [43, 63.089]
  - - [1024, 4096, 1, 4096]
    - [72, 79.327]
  - - [4096, 2048, 1, 1024]
    - [21, 68.98]
  - - [4096, 4096, 1, 1024]
    - [21, 77.609]
  - - [30528, 2048, 1, 1024]
    - [21, 81.439]
  - - [30528, 4096, 1, 1024]
    - [21, 84.909]
  - - [27, 27, 32768, 128]
    - [10, 7.766]
  - - [32, 1600, 1, 512]
    - [19, 2.546]
  - - [33, 33, 1600, 32]
    - [12, 2.284]
  - - [64, 512, 1, 1024]
    - [7, 2.908]
  - - [64, 960, 1, 1024]
    - [17, 5.251]
  - - [128, 32768, 1, 256]
    - [33, 28.331]
  - - [256, 684, 1, 1024]
    - [59, 12.318]
  - - [256, 1280, 1, 1024]
    - [16, 20.325]
  - - [256, 1536, 1, 1024]
    - [16, 24.131]
  - - [256, 2304, 1, 1024]
    - [33, 28.353]
  - - [256, 2560, 1, 1024]
    - [29, 31.243]
  - - [256, 2816, 1, 1024]
    - [143, 34.226]
  - - [256, 3328, 1, 1024]
    - [190, 39.956]
  - - [256, 3584, 1, 1024]
    - [105, 34.479]
  - - [256, 4608, 1, 1024]
    - [9, 43.342]
  - - [256, 4864, 1, 1024]
    - [34, 43.4]
  - - [256, 5376, 1, 1024]
    - [33, 43.382]
  - - [256, 5888, 1, 1024]
    - [33, 47.384]
  - - [256, 6144, 1, 1024]
    - [43, 48.911]
  - - [256, 6400, 1, 1024]
    - [29, 50.54]
  - - [256, 6656, 1, 1024]
    - [33, 52.703]
  - - [256, 7168, 1, 1024]
    - [138, 43.741]
  - - [256, 7424, 1, 1024]
    - [105, 44.931]
  - - [256, 7936, 1, 1024]
    - [34, 47.447]
  - - [256, 8192, 1, 1024]
    - [105, 48.389]
  - - [256, 8448, 1, 1024]
    - [9, 51.024]
  - - [256, 8960, 1, 1024]
    - [9, 52.506]
  - - [256, 9984, 1, 1024]
    - [13, 58.622]
  - - [256, 10496, 1, 1024]
    - [9, 59.614]
  - - [256, 11264, 1, 1024]
    - [90, 51.339]
  - - [256, 11520, 1, 1024]
    - [43, 52.425]
  - - [256, 11776, 1, 1024]
    - [43, 53.262]
  - - [256, 12544, 1, 1024]
    - [43, 56.39]
  - - [256, 13312, 1, 1024]
    - [33, 58.945]
  - - [256, 14336, 1, 1024]
    - [13, 59.467]
  - - [256, 14592, 1, 1024]
    - [166, 60.786]
  - - [256, 14848, 1, 1024]
    - [13, 60.654]
  - - [256, 15104, 1, 1024]
    - [15, 62.829]
  - - [256, 16128, 1, 1024]
    - [43, 59.246]
  - - [256, 18176, 1, 1024]
    - [15, 59.186]
  - - [256, 18944, 1, 1024]
    - [15, 61.081]
  - - [256, 19200, 1, 1024]
    - [15, 62.109]
  - - [256, 20480, 1, 1024]
    - [13, 64.622]
  - - [256, 20992, 1, 1024]
    - [13, 64.92]
  - - [256, 21248, 1, 1024]
    - [43, 56.74]
  - - [256, 21504, 1, 1024]
    - [43, 58.054]
  - - [256, 22016, 1, 1024]
    - [43, 59.382]
  - - [256, 22344, 1, 1024]
    - [43, 59.667]
  - - [256, 23296, 1, 1024]
    - [43, 61.985]
  - - [256, 23552, 1, 1024]
    - [43, 62.273]
  - - [256, 31488, 1, 1024]
    - [13, 68.331]
  - - [256, 32768, 1, 512]
    - [33, 51.808]
  - - [256, 33536, 1, 1024]
    - [15, 64.526]
  - - [256, 44505, 1, 1024]
    - [15, 67.2]
  - - [512, 1600, 1, 512]
    - [34, 24.871]
  - - [512, 32768, 1, 13]
    - [28, 3.011]
  - - [512, 32768, 1, 1024]
    - [15, 73.905]
  - - [684, 8976, 1, 256]
    - [32, 33.348]
  - - [1024, 200, 1, 560]
    - [133, 7.3]
  - - [1024, 512, 1, 1024]
    - [27, 25.848]
  - - [1024, 512, 1, 1600]
    - [89, 32.146]
  - - [1024, 960, 1, 1024]
    - [191, 37.679]
  - - [1024, 960, 1, 1600]
    - [192, 47.129]
  - - [1024, 1600, 1, 560]
    - [193, 28.794]
  - - [1024, 1600, 1, 1024]
    - [33, 51.786]
  - - [1024, 32768, 1, 480]
    - [194, 66.226]
  - - [1024, 32768, 1, 1024]
    - [15, 80.783]
  - - [1280, 8976, 1, 256]
    - [46, 44.183]
  - - [1792, 8976, 1, 256]
    - [46, 48.732]
  - - [2048, 114, 1, 512]
    - [52, 9.288]
  - - [2048, 114, 1, 768]
    - [52, 12.169]
  - - [2048, 215, 1, 512]
    - [27, 16.282]
  - - [2048, 215, 1, 768]
    - [27, 19.242]
  - - [2048, 256, 1, 512]
    - [27, 18.784]
  - - [2048, 256, 1, 768]
    - [27, 23.145]
  - - [2048, 512, 1, 67]
    - [31, 4.602]
  - - [2048, 512, 1, 74]
    - [31, 5.204]
  - - [2048, 512, 1, 100]
    - [31, 6.284]
  - - [2048, 512, 1, 2048]
    - [15, 49.783]
  - - [2048, 684, 1, 512]
    - [33, 31.939]
  - - [2048, 684, 1, 768]
    - [33, 39.1]
  - - [2048, 960, 1, 74]
    - [195, 7.285]
  - - [2048, 960, 1, 2048]
    - [73, 61.889]
  - - [2048, 1536, 1, 512]
    - [43, 44.151]
  - - [2048, 1536, 1, 768]
    - [43, 51.649]
  - - [2048, 8976, 1, 256]
    - [46, 48.687]
  - - [2304, 8976, 1, 256]
    - [46, 49.377]
  - - [2560, 8976, 1, 256]
    - [46, 50.903]
  - - [2816, 8976, 1, 256]
    - [46, 50.347]
  - - [3072, 8976, 1, 256]
    - [46, 51.211]
  - - [3328, 8976, 1, 256]
    - [46, 51.561]
  - - [3840, 8976, 1, 256]
    - [46, 51.59]
  - - [4096, 8976, 1, 256]
    - [46, 51.079]
  - - [4352, 8976, 1, 256]
    - [46, 51.19]
  - - [4608, 8976, 1, 256]
    - [46, 51.598]
  - - [4864, 8976, 1, 256]
    - [116, 51.126]
  - - [5120, 8976, 1, 256]
    - [144, 51.456]
  - - [5376, 8976, 1, 256]
    - [46, 50.832]
  - - [5632, 8976, 1, 256]
    - [46, 50.609]
  - - [5888, 8976, 1, 256]
    - [144, 49.815]
  - - [6144, 8976, 1, 256]
    - [113, 50.4]
  - - [6400, 8976, 1, 256]
    - [13, 49.356]
  - - [7168, 8976, 1, 256]
    - [108, 48.912]
  - - [7936, 8976, 1, 256]
    - [21, 48.571]
  - - [8192, 8976, 1, 256]
    - [108, 49.402]
  - - [8448, 8976, 1, 256]
    - [21, 48.11]
  - - [8960, 8976, 1, 256]
    - [21, 48.085]
  - - [9472, 8976, 1, 256]
    - [9, 48.655]
  - - [9728, 8976, 1, 256]
    - [9, 48.497]
  - - [9984, 8976, 1, 256]
    - [196, 47.795]
  - - [10240, 8976, 1, 256]
    - [9, 49.248]
  - - [10496, 8976, 1, 256]
    - [9, 48.017]
  - - [11264, 8976, 1, 256]
    - [196, 48.368]
  - - [11776, 8976, 1, 256]
    - [196, 48.826]
  - - [12544, 8976, 1, 256]
    - [196, 48.798]
  - - [13312, 8976, 1, 256]
    - [196, 49.459]
  - - [13568, 8976, 1, 256]
    - [196, 48.403]
  - - [13824, 8976, 1, 256]
    - [196, 49.14]
  - - [15104, 8976, 1, 256]
    - [21, 49.062]
  - - [15360, 8976, 1, 256]
    - [196, 50.773]
  - - [15872, 8976, 1, 256]
    - [21, 48.947]
  - - [16128, 8976, 1, 256]
    - [196, 49.214]
  - - [17152, 8976, 1, 256]
    - [196, 49.548]
  - - [18176, 8976, 1, 256]
    - [196, 49.407]
  - - [18688, 8976, 1, 256]
    - [9, 49.882]
  - - [18944, 8976, 1, 256]
    - [196, 49.529]
  - - [19712, 8976, 1, 256]
    - [196, 49.579]
  - - [19968, 8976, 1, 256]
    - [196, 49.966]
  - - [20480, 8976, 1, 256]
    - [196, 50.703]
  - - [20992, 8976, 1, 256]
    - [196, 49.622]
  - - [21248, 8976, 1, 256]
    - [196, 49.696]
  - - [23552, 8976, 1, 256]
    - [196, 49.693]
  - - [28672, 8976, 1, 256]
    - [196, 50.63]
  - - [31488, 8976, 1, 256]
    - [196, 49.785]
  - - [33536, 8976, 1, 256]
    - [196, 49.989]
  - - [44505, 8976, 1, 256]
    - [166, 47.705]
  - - [15, 14, 10880, 64]
    - [12, 3.787]
  - - [17, 15, 7680, 64]
    - [12, 2.912]
  - - [21, 17, 6144, 64]
    - [197, 3.586]
  - - [30, 31, 2048, 64]
    - [93, 4.719]
  - - [32, 35, 4608, 64]
    - [198, 7.657]
  - - [1024, 3840, 1, 1024]
    - [166, 67.608]
  - - [1024, 3840, 1, 4096]
    - [13, 86.989]
  - - [1024, 3968, 1, 1024]
    - [43, 61.358]
  - - [1024, 3968, 1, 4096]
    - [72, 77.006]
  - - [1024, 6528, 1, 1024]
    - [15, 74.44]
  - - [1024, 6528, 1, 4096]
    - [13, 90.623]
  - - [1024, 7104, 1, 1024]
    - [15, 68.96]
  - - [1024, 7104, 1, 4096]
    - [13, 83.094]
  - - [1024, 7200, 1, 1024]
    - [15, 69.95]
  - - [1024, 7200, 1, 4096]
    - [13, 83.988]
  - - [1024, 8064, 1, 1024]
    - [4, 67.421]
  - - [1024, 8064, 1, 4096]
    - [115, 81.686]
  - - [1024, 8160, 1, 1024]
    - [15, 68.907]
  - - [1024, 8160, 1, 4096]
    - [13, 82.143]
  - - [1024, 9216, 1, 1024]
    - [15, 77.327]
  - - [1024, 9216, 1, 4096]
    - [13, 92.64]
  - - [1024, 9520, 1, 1024]
    - [4, 71.092]
  - - [1024, 9520, 1, 4096]
    - [4, 84.801]
  - - [1024, 10064, 1, 1024]
    - [15, 73.801]
  - - [1024, 10064, 1, 4096]
    - [13, 88.893]
  - - [1024, 10080, 1, 1024]
    - [15, 74.801]
  - - [1024, 10080, 1, 4096]
    - [13, 88.884]
  - - [1024, 10200, 1, 1024]
    - [15, 75.219]
  - - [1024, 10200, 1, 4096]
    - [13, 89.959]
  - - [4096, 3840, 1, 1024]
    - [21, 78.014]
  - - [4096, 3968, 1, 1024]
    - [21, 76.007]
  - - [4096, 6528, 1, 1024]
    - [21, 80.001]
  - - [4096, 7104, 1, 1024]
    - [21, 81.52]
  - - [4096, 7200, 1, 1024]
    - [21, 81.611]
  - - [4096, 8064, 1, 1024]
    - [21, 81.756]
  - - [4096, 8160, 1, 1024]
    - [21, 82.376]
  - - [4096, 9216, 1, 1024]
    - [21, 82.921]
  - - [4096, 9520, 1, 1024]
    - [21, 82.003]
  - - [4096, 10064, 1, 1024]
    - [21, 82.94]
  - - [4096, 10080, 1, 1024]
    - [21, 82.956]
  - - [4096, 10200, 1, 1024]
    - [21, 82.239]
  - - [42720, 3968, 1, 1024]
    - [21, 84.357]
  - - [42720, 6528, 1, 1024]
    - [21, 85.582]
  - - [42720, 7104, 1, 1024]
    - [21, 85.777]
  - - [42720, 7200, 1, 1024]
    - [21, 85.729]
  - - [42720, 9520, 1, 1024]
    - [21, 85.572]
  - - [42720, 10080, 1, 1024]
    - [21, 86.133]
  - - [27, 33, 1920, 64]
    - [100, 3.992]
  - - [1024, 3240, 1, 1024]
    - [33, 60.089]
  - - [1024, 3240, 1, 4096]
    - [53, 79.125]
  - - [1024, 3960, 1, 1024]
    - [4, 60.443]
  - - [1024, 3960, 1, 4096]
    - [4, 76.85]
  - - [4096, 3240, 1, 1024]
    - [21, 76.515]
  - - [4096, 3960, 1, 1024]
    - [21, 75.731]
  - - [42720, 3960, 1, 1024]
    - [21, 84.234]
  - - [7680, 8192, 1, 8192]
    - [21, 96.001]
  - - [3840, 4096, 1, 4096]
    - [9, 90.617]
  - - [1920, 2048, 1, 2048]
    - [9, 78.932]
  - - [480, 512, 1, 512]
    - [71, 9.388]
  - - [8192, 7680, 1, 8192]
    - [166, 95.811]
  - - [4096, 3840, 1, 4096]
    - [9, 91.106]
  - - [2048, 1920, 1, 2048]
    - [13, 79.309]
  - - [512, 480, 1, 512]
    - [71, 9.71]
  - - [2, 8, 1, 1024]
    - [20, 0.001]
  - - [512, 512, 16, 64]
    - [1, 11.722]
  - - [512, 512, 128, 64]
    - [151, 17.949]
  - - [1024, 77, 1, 1024]
    - [37, 6.451]
  - - [1024, 512, 1, 4096]
    - [64, 42.596]
  - - [4096, 512, 1, 1024]
    - [9, 50.093]
  - - [30522, 77, 1, 1024]
    - [166, 28.068]
  - - [30522, 616, 1, 1024]
    - [166, 70.472]
  - - [2, 10, 1, 1024]
    - [40, 0.002]
  - - [128, 128, 128, 64]
    - [1, 8.592]
  - - [128, 128, 160, 64]
    - [1, 9.794]
  - - [1024, 10, 1, 1024]
    - [80, 0.862]
  - - [1024, 200, 1, 1024]
    - [25, 13.2]
  - - [1024, 1280, 1, 1024]
    - [34, 45.274]
  - - [1024, 1280, 1, 4096]
    - [36, 72.613]
  - - [4096, 1280, 1, 1024]
    - [6, 65.462]
  - - [30522, 160, 1, 1024]
    - [90, 45.955]
  - - [30522, 200, 1, 1024]
    - [166, 47.298]
  - - [2, 39, 1, 1024]
    - [23, 0.006]
  - - [128, 128, 624, 64]
    - [90, 13.403]
  - - [1024, 39, 1, 1024]
    - [37, 3.388]
  - - [1024, 780, 1, 1024]
    - [33, 36.422]
  - - [1024, 4992, 1, 1024]
    - [15, 69.875]
  - - [1024, 4992, 1, 4096]
    - [13, 86.22]
  - - [4096, 4992, 1, 1024]
    - [21, 77.983]
  - - [30522, 780, 1, 1024]
    - [166, 73.204]
  - - [1024, 308, 1, 1024]
    - [61, 19.458]
  - - [30522, 308, 1, 1024]
    - [90, 60.187]
  - - [2, 40, 1, 1024]
    - [20, 0.007]
  - - [128, 128, 640, 64]
    - [199, 13.599]
  - - [1024, 40, 1, 1024]
    - [37, 3.475]
  - - [1024, 800, 1, 1024]
    - [200, 37.209]
  - - [1024, 5120, 1, 1024]
    - [15, 70.089]
  - - [1024, 5120, 1, 4096]
    - [13, 88.044]
  - - [4096, 5120, 1, 1024]
    - [21, 79.093]
  - - [30522, 800, 1, 1024]
    - [166, 73.322]
  - - [2, 41, 1, 1024]
    - [20, 0.007]
  - - [128, 128, 656, 64]
    - [90, 13.644]
  - - [1024, 41, 1, 1024]
    - [37, 3.588]
  - - [1024, 820, 1, 1024]
    - [190, 38.442]
  - - [1024, 5248, 1, 1024]
    - [15, 71.675]
  - - [1024, 5248, 1, 4096]
    - [13, 90.115]
  - - [4096, 5248, 1, 1024]
    - [21, 80.05]
  - - [30522, 820, 1, 1024]
    - [166, 75.253]
  - - [2, 5, 1, 1024]
    - [30, 0.001]
  - - [512, 512, 80, 64]
    - [28, 17.203]
  - - [1024, 5, 1, 1024]
    - [40, 0.444]
  - - [1024, 385, 1, 1024]
    - [59, 22.972]
  - - [1024, 2560, 1, 1024]
    - [15, 61.847]
  - - [1024, 2560, 1, 4096]
    - [13, 84.067]
  - - [4096, 2560, 1, 1024]
    - [21, 75.045]
  - - [30522, 385, 1, 1024]
    - [166, 63.35]
  - - [2, 6, 1, 1024]
    - [23, 0.001]
  - - [512, 512, 96, 64]
    - [201, 17.566]
  - - [1024, 6, 1, 1024]
    - [80, 0.545]
  - - [1024, 462, 1, 1024]
    - [27, 24.044]
  - - [1024, 3072, 1, 1024]
    - [43, 57.974]
  - - [1024, 3072, 1, 4096]
    - [53, 76.084]
  - - [4096, 3072, 1, 1024]
    - [21, 74.331]
  - - [30522, 462, 1, 1024]
    - [166, 69.612]
  - - [1024, 8, 1, 1024]
    - [80, 0.695]
  - - [1024, 160, 1, 1024]
    - [52, 11.319]
  - - [1024, 1024, 1, 4096]
    - [13, 60.563]
  - - [4096, 1024, 1, 1024]
    - [6, 61.721]
  - - [2, 9, 1, 1024]
    - [23, 0.001]
  - - [128, 128, 144, 64]
    - [1, 9.246]
  - - [1024, 9, 1, 1024]
    - [202, 0.793]
  - - [1024, 180, 1, 1024]
    - [52, 12.436]
  - - [1024, 1152, 1, 1024]
    - [9, 43.76]
  - - [1024, 1152, 1, 4096]
    - [166, 69.614]
  - - [4096, 1152, 1, 1024]
    - [166, 63.894]
  - - [30522, 180, 1, 1024]
    - [90, 49.326]
  - - [1024, 32768, 1, 479]
    - [203, 51.99]
  - - [1024, 8192, 1, 1024]
    - [15, 67.963]
  - - [1024, 8192, 1, 4096]
    - [53, 83.09]
  - - [1024, 9600, 1, 1024]
    - [43, 72.329]
  - - [1024, 9600, 1, 4096]
    - [33, 85.514]
  - - [4096, 8192, 1, 1024]
    - [21, 81.687]
  - - [4096, 9600, 1, 1024]
    - [21, 82.919]
  - - [33712, 8192, 1, 1024]
    - [21, 87.413]
  - - [33712, 9600, 1, 1024]
    - [21, 87.799]
  - - [128, 128, 1, 64]
    - [18, 0.127]
  - - [64, 128, 1, 128]
    - [10, 0.122]
  - - [2, 1024, 1, 1024]
    - [26, 0.183]
  - - [33, 33, 1, 32]
    - [86, 0.004]
  - - [480, 1024, 1, 1024]
    - [27, 24.763]
  - - [480, 2048, 1, 2048]
    - [36, 48.57]
  - - [1024, 480, 1, 1024]
    - [178, 24.338]
  - - [2048, 480, 1, 2048]
    - [15, 48.99]
  - - [1024, 1024, 128, 96]
    - [101, 27.96]
  - - [30592, 4096, 1, 1024]
    - [21, 84.029]
  - - [64, 1024, 256, 1024]
    - [114, 38.875]
  - - [1536, 8192, 1, 1536]
    - [43, 78.413]
  - - [2048, 2, 1, 2048]
    - [7, 0.559]
  - - [3072, 8192, 1, 1024]
    - [21, 79.414]
  - - [3072, 2048, 1, 1024]
    - [9, 68.54]
  - - [50304, 8192, 1, 1024]
    - [21, 84.539]
  - - [64, 512, 40, 512]
    - [34, 26.344]
  - - [2048, 1024, 1, 8192]
    - [204, 72.985]
  - - [96, 1024, 64, 1024]
    - [36, 46.798]
  - - [1024, 16, 1, 1024]
    - [80, 1.421]
  - - [50304, 2048, 1, 1024]
    - [21, 81.341]
  - - [1536, 8192, 1, 6144]
    - [115, 92.66]
  - - [50304, 4096, 1, 1536]
    - [21, 88.238]
  - - [8192, 1024, 1, 2048]
    - [21, 77.176]
  - - [2, 4, 1, 2560]
    - [30, 0.001]
  - - [2560, 2048, 1, 640]
    - [15, 58.977]
  - - [1024, 1024, 128, 64]
    - [201, 19.52]
  - - [2048, 1024, 1, 2048]
    - [9, 60.944]
  - - [1536, 4096, 1, 1536]
    - [43, 75.819]
  - - [1024, 1024, 64, 64]
    - [57, 19.134]
  - - [30592, 8192, 1, 1024]
    - [21, 84.803]
  - - [50304, 16384, 1, 1024]
    - [21, 85.037]
  - - [4608, 4096, 1, 1536]
    - [21, 80.174]
  - - [2560, 2048, 1, 2560]
    - [15, 82.317]
  - - [7680, 2048, 1, 2560]
    - [9, 85.707]
  - - [2, 16, 1, 1024]
    - [7, 0.003]
  - - [50304, 4096, 1, 1024]
    - [21, 84.012]
  - - [64, 1024, 128, 1024]
    - [205, 39.166]
  - - [1920, 2048, 1, 2560]
    - [9, 80.893]
  - - [1024, 1024, 64, 96]
    - [206, 27.401]
  - - [64, 1024, 32, 1024]
    - [207, 33.144]
  - - [6144, 4096, 1, 1536]
    - [21, 84.009]
  - - [64, 512, 128, 512]
    - [208, 29.65]
  - - [1536, 4096, 1, 6144]
    - [29, 88.212]
  - - [512, 512, 256, 64]
    - [209, 18.939]
  - - [96, 1024, 128, 1024]
    - [36, 47.643]
  - - [50304, 8192, 1, 1536]
    - [21, 88.767]
  - - [6144, 8192, 1, 1536]
    - [21, 86.418]
  - - [4096, 16384, 1, 1024]
    - [21, 84.467]
  - - [30592, 1024, 1, 2048]
    - [9, 86.752]
  - - [2, 2, 1, 2048]
    - [26, 0.001]
  - - [1024, 16384, 1, 4096]
    - [13, 89.797]
  - - [64, 512, 256, 512]
    - [210, 33.008]
  - - [512, 512, 40, 64]
    - [201, 15.621]
  - - [6144, 1024, 1, 2048]
    - [9, 79.457]
  - - [4608, 8192, 1, 1536]
    - [21, 84.4]
  - - [30592, 2048, 1, 1024]
    - [21, 80.816]
  - - [3072, 16384, 1, 1024]
    - [21, 83.036]
  - - [1024, 1024, 256, 64]
    - [201, 19.749]
  - - [64, 1024, 64, 1024]
    - [6, 36.77]
  - - [1024, 16384, 1, 1024]
    - [21, 76.961]
  - - [1024, 1024, 32, 64]
    - [211, 18.246]
  - - [3072, 4096, 1, 1024]
    - [21, 74.445]
  - - [2560, 4, 1, 2560]
    - [37, 1.596]
  - - [960, 1024, 1, 1024]
    - [34, 37.931]
  - - [1024, 1, 1, 1024]
    - [80, 0.09]
  - - [32768, 1, 1, 256]
    - [10, 0.487]
  - - [512, 1, 1, 2048]
    - [22, 0.076]
  - - [1600, 1, 1, 1024]
    - [22, 0.135]
  - - [200, 1, 1, 1024]
    - [37, 0.018]
  - - [960, 1, 1, 2048]
    - [20, 0.14]
  - - [1024, 64, 1, 1024]
    - [7, 5.479]
  - - [30528, 8192, 1, 1024]
    - [21, 85.625]
  - - [128, 128, 1024, 64]
    - [90, 14.367]
  - - [64, 128, 1024, 128]
    - [207, 16.709]
  - - [1024, 3456, 1, 1024]
    - [43, 64.398]
  - - [1024, 3456, 1, 480]
    - [212, 47.024]
  - - [1024, 4096, 1, 480]
    - [213, 44.738]
  - - [1024, 6912, 1, 1024]
    - [43, 69.852]
  - - [1024, 6912, 1, 480]
    - [214, 54.063]
  - - [1024, 864, 1, 1024]
    - [215, 34.367]
  - - [1024, 864, 1, 480]
    - [195, 20.623]
  - - [128, 3456, 1, 256]
    - [152, 9.179]
  - - [128, 4096, 1, 256]
    - [132, 10.801]
  - - [128, 55296, 1, 256]
    - [46, 32.301]
  - - [128, 6912, 1, 256]
    - [33, 15.751]
  - - [128, 864, 1, 256]
    - [95, 2.703]
  - - [256, 3456, 1, 512]
    - [43, 26.581]
  - - [256, 4096, 1, 512]
    - [34, 26.883]
  - - [256, 55296, 1, 512]
    - [33, 55.398]
  - - [256, 6912, 1, 512]
    - [90, 38.959]
  - - [256, 864, 1, 512]
    - [59, 8.922]
  - - [3456, 1, 1, 256]
    - [37, 0.091]
  - - [4096, 1, 1, 256]
    - [37, 0.107]
  - - [512, 3456, 1, 1024]
    - [33, 55.323]
  - - [512, 3456, 1, 13]
    - [1, 1.393]
  - - [512, 4096, 1, 1024]
    - [43, 49.886]
  - - [512, 4096, 1, 13]
    - [5, 1.513]
  - - [512, 55296, 1, 13]
    - [28, 3.336]
  - - [512, 6912, 1, 1024]
    - [43, 64.196]
  - - [512, 6912, 1, 13]
    - [49, 2.025]
  - - [512, 864, 1, 1024]
    - [59, 25.517]
  - - [512, 864, 1, 13]
    - [56, 0.491]
  - - [6912, 1, 1, 256]
    - [60, 0.165]
  - - [864, 1, 1, 256]
    - [2, 0.024]
  - - [30528, 640, 1, 1024]
    - [94, 74.343]
  - - [30528, 1280, 1, 1024]
    - [21, 79.72]
  - - [30528, 1600, 1, 1024]
    - [21, 79.414]
  - - [1024, 10240, 1, 1024]
    - [15, 75.185]
  - - [1024, 80, 1, 1024]
    - [7, 7.214]
  - - [4096, 10240, 1, 1024]
    - [21, 82.225]
  - - [1024, 10240, 1, 4096]
    - [13, 90.346]
  - - [64, 128, 1280, 128]
    - [34, 17.087]
  - - [128, 128, 1280, 64]
    - [90, 14.71]
  - - [1024, 10496, 1, 4096]
    - [13, 92.467]
  - - [30528, 1640, 1, 1024]
    - [21, 79.005]
  - - [1024, 82, 1, 1024]
    - [7, 6.59]
  - - [4096, 10496, 1, 1024]
    - [21, 82.928]
  - - [1024, 10496, 1, 1024]
    - [15, 76.684]
  - - [64, 128, 1312, 128]
    - [110, 17.014]
  - - [128, 128, 1312, 64]
    - [199, 14.918]
  - - [30528, 160, 1, 1024]
    - [9, 49.044]
  - - [1024, 12, 1, 1024]
    - [19, 1.027]
  - - [30528, 240, 1, 1024]
    - [114, 60.55]
  - - [1024, 6144, 1, 1024]
    - [15, 70.062]
  - - [4096, 6144, 1, 1024]
    - [21, 80.381]
  - - [1024, 6144, 1, 4096]
    - [13, 85.62]
  - - [64, 512, 192, 512]
    - [208, 31.863]
  - - [512, 512, 192, 64]
    - [216, 18.583]
  - - [2, 64, 1, 1024]
    - [23, 0.011]
  - - [2, 80, 1, 1024]
    - [7, 0.015]
  - - [2, 82, 1, 1024]
    - [136, 0.015]
  - - [2, 12, 1, 1024]
    - [40, 0.002]
  - - [2, 1, 1, 1024]
    - [20, 0.0]
  - - [1, 4096, 1, 256]
    - [24, 0.109]
  - - [1, 6912, 1, 256]
    - [10, 0.175]
  - - [1024, 10224, 1, 1024]
    - [15, 74.975]
  - - [1024, 10192, 1, 1024]
    - [15, 75.254]
  - - [1024, 10208, 1, 1024]
    - [15, 74.672]
  - - [1024, 10224, 1, 4096]
    - [13, 90.188]
  - - [4096, 10224, 1, 1024]
    - [21, 82.362]
  - - [3072, 10224, 1, 1024]
    - [21, 80.72]
  - - [3072, 10240, 1, 1024]
    - [21, 80.559]
  - - [1024, 10192, 1, 4096]
    - [13, 89.939]
  - - [4096, 10192, 1, 1024]
    - [21, 82.245]
  - - [3072, 10192, 1, 1024]
    - [21, 80.057]
  - - [3072, 10200, 1, 1024]
    - [21, 80.855]
  - - [1024, 10184, 1, 1024]
    - [15, 74.774]
  - - [3072, 10208, 1, 1024]
    - [21, 80.702]
  - - [1024, 10208, 1, 4096]
    - [13, 90.198]
  - - [4096, 10208, 1, 1024]
    - [21, 82.36]
  - - [2048, 10224, 1, 1024]
    - [21, 78.687]
  - - [2048, 10240, 1, 1024]
    - [21, 78.887]
  - - [1024, 10120, 1, 1024]
    - [15, 74.351]
  - - [2048, 10192, 1, 1024]
    - [21, 78.009]
  - - [1024, 10152, 1, 1024]
    - [15, 74.725]
  - - [3072, 10080, 1, 1024]
    - [21, 81.676]
  - - [1024, 2048, 1, 49]
    - [1, 5.385]
  - - [1024, 512, 1, 196]
    - [31, 6.692]
  - - [1152, 128, 1, 784]
    - [52, 7.002]
  - - [2048, 512, 1, 49]
    - [31, 3.618]
  - - [2304, 256, 1, 196]
    - [5, 7.529]
  - - [256, 128, 1, 3136]
    - [217, 4.522]
  - - [256, 512, 1, 784]
    - [133, 6.191]
  - - [4608, 512, 1, 49]
    - [218, 6.03]
  - - [512, 1024, 1, 196]
    - [31, 6.771]
  - - [512, 2048, 1, 49]
    - [31, 3.508]
  - - [512, 256, 1, 784]
    - [59, 6.258]
  - - [576, 64, 1, 3136]
    - [219, 5.088]
  - - [128, 128, 49, 12800]
    - [65, 45.154]
  - - [128, 128, 25, 25088]
    - [16, 43.854]
  - - [128, 128, 49, 25600]
    - [220, 46.107]
  - - [128, 128, 25, 50176]
    - [171, 44.918]
  - - [256, 256, 25, 12544]
    - [115, 83.232]
  - - [256, 256, 49, 3200]
    - [221, 72.044]
  - - [256, 256, 25, 6272]
    - [53, 78.545]
  - - [256, 256, 49, 6400]
    - [221, 78.92]
  - - [512, 512, 49, 1152]
    - [13, 65.482]
  - - [512, 512, 25, 2048]
    - [33, 71.261]
  - - [512, 512, 49, 2304]
    - [15, 74.427]
  - - [512, 512, 25, 4096]
    - [53, 80.093]
  - - [64, 128, 2048, 128]
    - [32, 17.294]
  - - [128, 128, 2048, 64]
    - [90, 15.529]
  - - [30528, 2560, 1, 1024]
    - [21, 83.639]
  - - [1024, 128, 1, 1024]
    - [52, 9.055]
  - - [64, 128, 1536, 128]
    - [32, 17.135]
  - - [128, 128, 1536, 64]
    - [90, 15.185]
  - - [1024, 12288, 1, 1024]
    - [15, 73.764]
  - - [1024, 12288, 1, 4096]
    - [115, 89.568]
  - - [30528, 1920, 1, 1024]
    - [21, 82.891]
  - - [1024, 96, 1, 1024]
    - [7, 7.768]
  - - [4096, 12288, 1, 1024]
    - [21, 83.731]
  - - [128, 128, 36, 12544]
    - [33, 41.888]
  - - [128, 128, 49, 9216]
    - [29, 45.059]
  - - [128, 128, 64, 6400]
    - [222, 43.205]
  - - [128, 128, 81, 12544]
    - [222, 47.16]
  - - [128, 128, 121, 9216]
    - [61, 41.686]
  - - [128, 128, 169, 6400]
    - [3, 46.302]
  - - [256, 256, 36, 4096]
    - [15, 73.071]
  - - [256, 256, 49, 2304]
    - [221, 67.17]
  - - [256, 256, 64, 2304]
    - [33, 63.857]
  - - [256, 256, 81, 4096]
    - [3, 82.649]
  - - [256, 256, 121, 2304]
    - [33, 66.53]
  - - [256, 256, 169, 2304]
    - [115, 66.705]
  - - [512, 512, 81, 1024]
    - [223, 69.299]
  - - [512, 512, 121, 1024]
    - [223, 69.69]
  - - [512, 512, 169, 1024]
    - [13, 71.215]
  - - [512, 512, 36, 1024]
    - [15, 64.271]
  - - [512, 512, 49, 1024]
    - [15, 65.369]
  - - [512, 512, 64, 1024]
    - [13, 66.721]
  - - [64, 64, 36, 50176]
    - [23, 23.008]
  - - [64, 64, 49, 36864]
    - [23, 29.985]
  - - [64, 64, 64, 25600]
    - [37, 26.226]
  - - [128, 128, 192, 64]
    - [49, 9.948]
  - - [64, 128, 192, 128]
    - [75, 11.876]
  - - [768, 2048, 1, 768]
    - [43, 43.76]
  - - [3072, 2048, 1, 768]
    - [15, 63.373]
  - - [768, 2048, 1, 3072]
    - [53, 68.561]
  - - [768, 16, 1, 768]
    - [20, 0.844]
  - - [384, 384, 144, 64]
    - [224, 16.445]
  - - [64, 384, 144, 384]
    - [225, 27.147]
  - - [768, 4608, 1, 768]
    - [33, 57.776]
  - - [3072, 4608, 1, 768]
    - [21, 69.554]
  - - [768, 4608, 1, 3072]
    - [53, 80.795]
  - - [768, 12, 1, 768]
    - [159, 0.628]
  - - [512, 512, 48, 64]
    - [226, 16.173]
  - - [64, 512, 48, 512]
    - [208, 28.803]
  - - [768, 4, 1, 768]
    - [81, 0.209]
  - - [128, 128, 256, 64]
    - [1, 11.327]
  - - [64, 128, 256, 128]
    - [34, 12.344]
  - - [384, 384, 192, 64]
    - [224, 16.802]
  - - [64, 384, 192, 384]
    - [225, 25.972]
  - - [1024, 4608, 1, 1024]
    - [15, 64.272]
  - - [4096, 4608, 1, 1024]
    - [21, 79.762]
  - - [1024, 4608, 1, 4096]
    - [166, 79.472]
  - - [2880, 3072, 1, 3072]
    - [15, 84.078]
  - - [3072, 3072, 1, 3072]
    - [9, 88.278]
  - - [3072, 512, 1, 3072]
    - [156, 68.909]
  - - [4096, 512, 1, 4096]
    - [9, 67.536]
  - - [512, 1024, 1, 1024]
    - [27, 26.646]
  - - [512, 2048, 1, 2048]
    - [9, 50.196]
  - - [512, 3072, 1, 3072]
    - [53, 68.476]
  - - [512, 4096, 1, 4096]
    - [73, 73.206]
  - - [512, 8192, 1, 8192]
    - [73, 84.339]
  - - [64, 1024, 1, 1024]
    - [19, 5.559]
  - - [8192, 512, 1, 8192]
    - [4, 83.001]
  - - [147, 64, 1, 12544]
    - [227, 3.49]
  - - [2, 128, 1, 1024]
    - [20, 0.022]
  - - [2, 96, 1, 1024]
    - [7, 0.017]
  - - [2, 2048, 1, 768]
    - [26, 0.261]
  - - [2, 4608, 1, 768]
    - [24, 0.554]
  - - [2, 4608, 1, 1024]
    - [17, 0.704]
  - - [128, 128, 49, 1120]
    - [5, 29.708]
  - - [256, 256, 36, 432]
    - [39, 28.779]
  - - [128, 128, 49, 1064]
    - [33, 25.801]
  - - [128, 128, 49, 1040]
    - [33, 26.057]
  - - [256, 256, 36, 456]
    - [35, 28.791]
  - - [256, 256, 36, 504]
    - [103, 31.155]
  - - [256, 256, 49, 1120]
    - [175, 57.723]
  - - [256, 256, 36, 442]
    - [46, 28.379]
  - - [128, 128, 64, 600]
    - [1, 20.137]
  - - [128, 128, 64, 616]
    - [228, 20.385]
  - - [256, 256, 49, 950]
    - [229, 46.259]
  - - [256, 256, 64, 616]
    - [49, 36.478]
  - - [256, 256, 64, 660]
    - [49, 35.973]
  - - [128, 128, 49, 950]
    - [34, 23.869]
  - - [256, 256, 36, 408]
    - [67, 26.451]
  - - [128, 128, 49, 972]
    - [72, 24.354]
  - - [128, 128, 64, 560]
    - [1, 19.69]
  - - [256, 256, 49, 1008]
    - [230, 49.216]
  - - [128, 128, 49, 1008]
    - [146, 25.682]
  - - [128, 128, 64, 532]
    - [228, 18.271]
  - - [256, 256, 36, 462]
    - [46, 28.166]
  - - [128, 128, 49, 1080]
    - [33, 26.473]
  - - [128, 128, 64, 588]
    - [231, 18.876]
  - - [256, 256, 36, 468]
    - [144, 28.93]
  - - [256, 256, 36, 494]
    - [103, 30.186]
  - - [128, 128, 49, 1160]
    - [143, 27.042]
  - - [128, 128, 49, 988]
    - [64, 24.551]
  - - [128, 128, 49, 936]
    - [232, 24.539]
  - - [256, 80, 1, 784]
    - [120, 1.09]
  - - [256, 256, 1, 60800]
    - [233, 41.722]
  - - [256, 256, 1, 54400]
    - [233, 40.007]
  - - [256, 256, 1, 51520]
    - [233, 39.75]
  - - [256, 256, 1, 55296]
    - [233, 40.504]
  - - [1024, 256, 1, 3800]
    - [147, 25.565]
  - - [256, 256, 1, 56832]
    - [234, 40.661]
  - - [256, 256, 1, 45632]
    - [235, 37.815]
  - - [256, 256, 1, 49152]
    - [236, 33.113]
  - - [256, 128, 1, 13600]
    - [237, 10.548]
  - - [1024, 256, 1, 3400]
    - [147, 24.492]
  - - [256, 1024, 1, 3400]
    - [16, 24.023]
  - - [256, 128, 1, 12880]
    - [238, 9.886]
  - - [1024, 256, 1, 3220]
    - [68, 23.598]
  - - [256, 512, 1, 13600]
    - [239, 27.74]
  - - [256, 1024, 1, 3220]
    - [61, 23.599]
  - - [256, 256, 1, 43008]
    - [240, 37.625]
  - - [1024, 256, 1, 3456]
    - [121, 28.752]
  - - [256, 1024, 1, 3456]
    - [25, 28.275]
  - - [256, 512, 1, 15200]
    - [241, 30.456]
  - - [1024, 256, 1, 3072]
    - [147, 28.265]
  - - [128, 512, 1, 15200]
    - [242, 19.934]
  - - [256, 1024, 1, 3072]
    - [61, 27.411]
  - - [256, 512, 1, 12880]
    - [239, 28.388]
  - - [512, 128, 1, 15200]
    - [243, 19.054]
  - - [128, 512, 1, 11408]
    - [244, 15.26]
  - - [256, 128, 1, 13824]
    - [245, 11.023]
  - - [1024, 256, 1, 3552]
    - [16, 24.684]
  - - [256, 1024, 1, 3552]
    - [16, 25.463]
  - - [256, 512, 1, 13824]
    - [246, 31.699]
  - - [512, 256, 1, 13824]
    - [239, 32.098]
  - - [256, 1024, 1, 2852]
    - [68, 22.402]
  - - [1024, 256, 1, 2852]
    - [16, 21.993]
  - - [256, 128, 1, 10752]
    - [26, 9.729]
  - - [256, 128, 1, 10560]
    - [238, 9.151]
  - - [256, 512, 1, 10752]
    - [247, 27.375]
  - - [256, 1024, 1, 3800]
    - [61, 25.682]
  - - [256, 512, 1, 10560]
    - [246, 28.825]
  - - [256, 1024, 1, 2992]
    - [16, 23.502]
  - - [128, 512, 1, 11616]
    - [242, 15.972]
  - - [512, 1024, 1, 3800]
    - [143, 37.852]
  - - [256, 128, 1, 14208]
    - [238, 11.329]
  - - [256, 512, 1, 14208]
    - [239, 31.694]
  - - [512, 256, 1, 14208]
    - [239, 32.63]
  - - [128, 512, 1, 14208]
    - [248, 19.499]
  - - [256, 1024, 1, 2688]
    - [61, 26.374]
  - - [1024, 256, 1, 2688]
    - [147, 26.551]
  - - [256, 1024, 1, 2904]
    - [68, 23.307]
  - - [1024, 256, 1, 2904]
    - [16, 22.994]
  - - [256, 1024, 1, 2640]
    - [61, 22.799]
  - - [1024, 256, 1, 2640]
    - [61, 22.47]
  - - [1024, 256, 1, 4032]
    - [25, 32.012]
  - - [512, 1024, 1, 3400]
    - [112, 35.111]
  - - [1024, 256, 1, 2992]
    - [16, 23.377]
  - - [256, 128, 1, 15200]
    - [237, 11.291]
  - - [512, 128, 1, 11408]
    - [244, 15.095]
  - - [256, 1024, 1, 3360]
    - [61, 24.503]
  - - [1024, 256, 1, 3360]
    - [16, 23.798]
  - - [1024, 256, 1, 3500]
    - [68, 23.984]
  - - [256, 1024, 1, 3500]
    - [68, 24.265]
  - - [512, 1024, 1, 3456]
    - [200, 40.91]
  - - [512, 128, 1, 16800]
    - [243, 19.565]
  - - [1024, 256, 1, 3168]
    - [16, 23.392]
  - - [256, 1024, 1, 3168]
    - [16, 23.747]
  - - [256, 1024, 1, 3036]
    - [25, 22.417]
  - - [512, 1024, 1, 3072]
    - [89, 39.62]
  - - [1024, 256, 1, 4200]
    - [61, 26.225]
  - - [512, 256, 1, 15200]
    - [241, 30.456]
  - - [1024, 256, 1, 3600]
    - [61, 25.869]
  - - [128, 512, 1, 11264]
    - [17, 17.695]
  - - [2048, 512, 1, 950]
    - [15, 28.199]
  - - [256, 1024, 1, 3600]
    - [61, 26.253]
  - - [512, 128, 1, 11616]
    - [243, 15.651]
  - - [256, 1024, 1, 2944]
    - [16, 27.087]
  - - [1024, 256, 1, 2944]
    - [61, 27.516]
  - - [1024, 256, 1, 3700]
    - [68, 24.338]
  - - [512, 1024, 1, 3552]
    - [143, 35.203]
  - - [512, 128, 1, 16128]
    - [249, 20.184]
  - - [256, 1024, 1, 2352]
    - [16, 21.178]
  - - [1024, 256, 1, 2352]
    - [61, 21.114]
  - - [1024, 256, 1, 2816]
    - [121, 27.269]
  - - [256, 1024, 1, 3700]
    - [61, 24.779]
  - - [256, 1024, 1, 2816]
    - [16, 27.179]
  - - [256, 512, 1, 11408]
    - [239, 26.405]
  - - [1024, 256, 1, 3036]
    - [68, 22.874]
  - - [512, 1024, 1, 3220]
    - [220, 34.582]
  - - [1024, 256, 1, 3264]
    - [16, 29.212]
  - - [256, 1024, 1, 3264]
    - [25, 29.753]
  - - [2048, 512, 1, 850]
    - [15, 27.436]
  - - [1024, 256, 1, 3864]
    - [16, 25.473]
  - - [256, 1024, 1, 4032]
    - [61, 32.359]
  - - [512, 2048, 1, 864]
    - [195, 32.404]
  - - [512, 128, 1, 11968]
    - [244, 17.533]
  - - [512, 2048, 1, 768]
    - [34, 34.498]
  - - [128, 512, 1, 11968]
    - [250, 17.259]
  - - [1024, 256, 1, 3128]
    - [61, 23.329]
  - - [256, 1024, 1, 3128]
    - [68, 23.568]
  - - [256, 1024, 1, 3200]
    - [25, 27.962]
  - - [256, 512, 1, 11616]
    - [241, 26.39]
  - - [256, 128, 1, 11408]
    - [238, 9.318]
  - - [1024, 256, 1, 3200]
    - [147, 28.297]
  - - [2048, 512, 1, 805]
    - [15, 25.634]
  - - [256, 12, 1, 11408]
    - [251, 1.05]
  - - [1024, 256, 1, 4000]
    - [16, 25.794]
  - - [256, 1024, 1, 2520]
    - [68, 21.955]
  - - [1024, 256, 1, 2520]
    - [16, 21.636]
  - - [256, 1024, 1, 2976]
    - [252, 23.438]
  - - [256, 1024, 1, 2400]
    - [25, 20.726]
  - - [1024, 256, 1, 2400]
    - [252, 20.666]
  - - [512, 128, 1, 12288]
    - [7, 17.756]
  - - [1024, 256, 1, 3696]
    - [61, 25.504]
  - - [512, 1024, 1, 2852]
    - [112, 32.967]
  - - [1024, 256, 1, 3900]
    - [61, 24.665]
  - - [512, 2048, 1, 888]
    - [195, 28.277]
  - - [1024, 256, 1, 3772]
    - [68, 24.166]
  - - [2048, 512, 1, 864]
    - [195, 32.715]
  - - [256, 1024, 1, 3696]
    - [68, 25.625]
  - - [128, 512, 1, 12288]
    - [79, 17.652]
  - - [2048, 512, 1, 768]
    - [34, 33.48]
  - - [256, 1024, 1, 2728]
    - [61, 22.135]
  - - [1024, 256, 1, 2728]
    - [121, 21.954]
  - - [1024, 256, 1, 2480]
    - [16, 21.17]
  - - [256, 1024, 1, 2480]
    - [16, 21.864]
  - - [1024, 256, 1, 2880]
    - [61, 29.331]
  - - [128, 512, 1, 12672]
    - [19, 17.959]
  - - [512, 256, 1, 3220]
    - [117, 13.509]
  - - [256, 1024, 1, 2880]
    - [16, 29.432]
  - - [256, 1024, 1, 4200]
    - [61, 26.06]
  - - [1024, 256, 1, 3648]
    - [61, 31.229]
  - - [1024, 256, 1, 3312]
    - [25, 24.272]
  - - [256, 1024, 1, 3648]
    - [61, 31.782]
  - - [256, 12, 1, 3800]
    - [81, 0.475]
  - - [1024, 256, 1, 3300]
    - [147, 23.317]
  - - [1024, 256, 1, 3528]
    - [147, 24.928]
  - - [256, 1024, 1, 2604]
    - [16, 21.423]
  - - [1024, 256, 1, 2604]
    - [147, 21.187]
  - - [512, 256, 1, 11408]
    - [239, 26.447]
  - - [256, 3, 1, 3800]
    - [79, 0.124]
  - - [256, 128, 1, 11616]
    - [237, 9.105]
  - - [256, 1024, 1, 3312]
    - [25, 24.454]
  - - [256, 1024, 1, 3300]
    - [61, 23.888]
  - - [256, 12, 1, 11616]
    - [253, 1.042]
  - - [512, 256, 1, 3072]
    - [88, 15.643]
  - - [256, 1024, 1, 3528]
    - [16, 24.459]
  - - [512, 128, 1, 11776]
    - [7, 17.891]
  - - [512, 128, 1, 12144]
    - [245, 15.676]
  - - [2048, 512, 1, 888]
    - [195, 28.353]
  - - [2048, 256, 1, 950]
    - [190, 18.044]
  - - [1024, 256, 1, 2976]
    - [252, 22.712]
  - - [2048, 512, 1, 713]
    - [15, 24.486]
  - - [512, 1024, 1, 2688]
    - [29, 37.625]
  - - [1024, 256, 1, 2760]
    - [68, 22.518]
  - - [512, 128, 1, 11264]
    - [7, 17.809]
  - - [512, 256, 1, 3800]
    - [59, 14.885]
  - - [256, 1024, 1, 2760]
    - [68, 22.456]
  - - [512, 1024, 1, 2640]
    - [143, 33.536]
  - - [1024, 256, 1, 2160]
    - [16, 20.252]
  - - [512, 1024, 1, 2904]
    - [220, 34.307]
  - - [256, 1024, 1, 2160]
    - [16, 20.382]
  - - [1024, 512, 1, 950]
    - [127, 18.219]
  - - [128, 512, 1, 12144]
    - [248, 15.486]
  - - [512, 2048, 1, 672]
    - [231, 27.565]
  - - [512, 2048, 1, 660]
    - [13, 23.206]
  - - [512, 2048, 1, 1008]
    - [195, 30.301]
  - - [512, 128, 1, 12672]
    - [37, 18.168]
  - - [512, 256, 1, 11616]
    - [241, 26.309]
  - - [512, 256, 1, 2852]
    - [59, 12.88]
  - - [2048, 256, 1, 850]
    - [33, 17.679]
  - - [128, 512, 1, 12512]
    - [254, 16.982]
  - - [2048, 512, 1, 726]
    - [15, 24.717]
  - - [1024, 512, 1, 850]
    - [112, 17.742]
  - - [2048, 512, 1, 660]
    - [195, 23.206]
  - - [256, 1024, 1, 3864]
    - [61, 25.588]
  - - [2048, 512, 1, 672]
    - [255, 27.566]
  - - [256, 512, 1, 12288]
    - [246, 29.41]
  - - [256, 12, 1, 12288]
    - [256, 1.168]
  - - [128, 512, 1, 11776]
    - [81, 17.709]
  - - [256, 128, 1, 12288]
    - [245, 10.31]
  - - [512, 2048, 1, 840]
    - [257, 27.797]
  - - [512, 256, 1, 2640]
    - [59, 13.49]
  - - [2048, 512, 1, 1008]
    - [255, 30.85]
  - - [256, 1024, 1, 4000]
    - [16, 25.738]
  - - [512, 2048, 1, 792]
    - [180, 26.209]
  - - [1024, 512, 1, 805]
    - [146, 16.34]
  - - [512, 2048, 1, 1050]
    - [15, 29.962]
  - - [2048, 512, 1, 748]
    - [257, 24.478]
  - - [512, 256, 1, 2904]
    - [59, 13.571]
  - - [512, 256, 1, 12288]
    - [239, 29.458]
  - - [256, 1024, 1, 3900]
    - [61, 24.878]
  - - [2048, 256, 1, 864]
    - [5, 21.81]
  - - [256, 12, 1, 950]
    - [120, 0.183]
  - - [512, 256, 1, 2688]
    - [88, 15.267]
  - - [256, 3, 1, 950]
    - [120, 0.048]
  - - [256, 1024, 1, 3772]
    - [68, 24.431]
  - - [1024, 512, 1, 768]
    - [27, 23.146]
  - - [1024, 512, 1, 864]
    - [5, 21.444]
  - - [512, 256, 1, 3400]
    - [59, 14.025]
  - - [2048, 512, 1, 875]
    - [15, 26.711]
  - - [2048, 512, 1, 840]
    - [195, 27.875]
  - - [2048, 512, 1, 792]
    - [13, 26.581]
  - - [512, 2048, 1, 736]
    - [258, 29.276]
  - - [256, 12, 1, 3220]
    - [81, 0.439]
  - - [2048, 256, 1, 888]
    - [43, 17.841]
  - - [512, 2048, 1, 704]
    - [34, 33.947]
  - - [512, 2048, 1, 588]
    - [231, 21.243]
  - - [1024, 512, 1, 888]
    - [64, 17.841]
  - - [512, 2048, 1, 816]
    - [15, 25.775]
  - - [256, 3, 1, 3220]
    - [17, 0.115]
  - - [1024, 512, 1, 713]
    - [43, 15.315]
  - - [256, 12, 1, 3072]
    - [26, 0.563]
  - - [256, 3, 1, 3072]
    - [20, 0.143]
  - - [2048, 512, 1, 736]
    - [257, 28.791]
  - - [2048, 512, 1, 588]
    - [259, 21.243]
  - - [256, 12, 1, 850]
    - [120, 0.172]
  - - [2048, 512, 1, 704]
    - [34, 33.809]
  - - [1024, 512, 1, 660]
    - [146, 14.823]
  - - [256, 3, 1, 850]
    - [120, 0.045]
  - - [2048, 256, 1, 660]
    - [5, 15.052]
  - - [256, 12, 1, 2852]
    - [19, 0.4]
  - - [2048, 256, 1, 672]
    - [5, 18.463]
  - - [1024, 512, 1, 672]
    - [5, 18.992]
  - - [1024, 512, 1, 726]
    - [33, 15.824]
  - - [512, 256, 1, 3456]
    - [59, 16.955]
  - - [512, 256, 1, 3552]
    - [59, 14.177]
  - - [512, 2048, 1, 630]
    - [255, 22.35]
  - - [256, 3, 1, 2852]
    - [19, 0.104]
  - - [512, 2048, 1, 600]
    - [195, 23.089]
  - - [256, 12, 1, 805]
    - [260, 0.161]
  - - [256, 3, 1, 805]
    - [120, 0.042]
  - - [256, 3, 1, 864]
    - [260, 0.045]
  - - [256, 3, 1, 768]
    - [37, 0.053]
  - - [256, 12, 1, 864]
    - [120, 0.172]
  - - [256, 12, 1, 768]
    - [80, 0.213]
  - - [256, 12, 1, 2904]
    - [79, 0.399]
  - - [256, 3, 1, 2904]
    - [79, 0.105]
  - - [256, 3, 1, 713]
    - [260, 0.038]
  - - [256, 12, 1, 888]
    - [120, 0.177]
  - - [256, 3, 1, 888]
    - [120, 0.045]
  - - [256, 12, 1, 713]
    - [120, 0.152]
  - - [2048, 256, 1, 805]
    - [261, 16.229]
  - - [256, 3, 1, 660]
    - [120, 0.037]
  - - [256, 3, 1, 672]
    - [260, 0.037]
  - - [256, 12, 1, 660]
    - [120, 0.146]
  - - [256, 3, 1, 726]
    - [120, 0.04]
  - - [256, 12, 1, 672]
    - [120, 0.144]
  - - [256, 3, 1, 247]
    - [18, 0.016]
  - - [2048, 256, 1, 713]
    - [43, 15.315]
  - - [256, 12, 1, 726]
    - [120, 0.153]
  - - [256, 3, 1, 216]
    - [120, 0.015]
  - - [256, 3, 1, 3400]
    - [81, 0.115]
  - - [2048, 256, 1, 726]
    - [112, 15.709]
  - - [256, 3, 1, 221]
    - [18, 0.015]
  - - [256, 12, 1, 3552]
    - [19, 0.452]
  - - [256, 3, 1, 3456]
    - [20, 0.151]
  - - [256, 3, 1, 204]
    - [120, 0.014]
  - - [256, 12, 1, 3400]
    - [79, 0.441]
  - - [256, 12, 1, 3456]
    - [20, 0.595]
  - - [256, 12, 1, 221]
    - [120, 0.06]
  - - [256, 3, 1, 3552]
    - [81, 0.121]
  - - [256, 3, 1, 228]
    - [120, 0.015]
  - - [256, 3, 1, 234]
    - [120, 0.016]
  - - [256, 12, 1, 234]
    - [120, 0.06]
  - - [1024, 1024, 1, 12544]
    - [148, 71.281]
  - - [1024, 1000, 1, 12544]
    - [15, 69.778]
  - - [320, 1024, 1, 1024]
    - [16, 21.003]
  - - [1024, 1000, 1, 1024]
    - [34, 37.987]
  - - [320, 1000, 1, 1024]
    - [25, 19.848]
  - - [512, 512, 64, 48]
    - [262, 10.453]
  - - [256, 256, 64, 140]
    - [67, 16.097]
  - - [512, 512, 64, 56]
    - [226, 12.153]
  - - [512, 512, 49, 90]
    - [151, 16.261]
  - - [512, 512, 49, 60]
    - [201, 12.077]
  - - [256, 256, 49, 864]
    - [206, 53.434]
  - - [256, 256, 64, 224]
    - [28, 28.152]
  - - [128, 128, 49, 1280]
    - [33, 33.852]
  - - [256, 256, 64, 176]
    - [262, 19.523]
  - - [256, 256, 64, 154]
    - [49, 17.62]
  - - [128, 128, 49, 1360]
    - [64, 28.876]
  - - [512, 512, 49, 80]
    - [263, 15.795]
  - - [128, 128, 49, 1200]
    - [34, 28.119]
  - - [256, 256, 49, 1200]
    - [264, 52.881]
  - - [256, 256, 64, 704]
    - [43, 49.14]
  - - [256, 256, 64, 768]
    - [33, 45.998]
  - - [256, 256, 49, 1160]
    - [264, 51.622]
  - - [256, 256, 49, 320]
    - [49, 35.514]
  - - [128, 128, 49, 1240]
    - [33, 28.251]
  - - [512, 512, 49, 70]
    - [265, 14.089]
  - - [256, 256, 49, 1240]
    - [230, 53.6]
  - - [256, 256, 36, 384]
    - [124, 34.252]
  - - [256, 12, 1, 228]
    - [120, 0.06]
  - - [256, 3, 1, 252]
    - [120, 0.017]
  - - [256, 12, 1, 252]
    - [120, 0.065]
  - - [1024, 2048, 1, 888]
    - [46, 39.365]
  - - [1024, 2048, 1, 713]
    - [266, 33.228]
  - - [2304, 256, 1, 704]
    - [27, 24.494]
  - - [1024, 2048, 1, 660]
    - [266, 33.109]
  - - [1024, 2048, 1, 726]
    - [266, 35.588]
  - - [1024, 2048, 1, 672]
    - [267, 39.497]
  - - [256, 12, 1, 247]
    - [120, 0.063]
  - - [2304, 256, 1, 736]
    - [146, 21.738]
  - - [1024, 2048, 1, 850]
    - [266, 38.327]
  - - [1024, 2048, 1, 805]
    - [266, 37.077]
  - - [2304, 256, 1, 792]
    - [143, 18.932]
  - - [1024, 2048, 1, 864]
    - [255, 44.187]
  - - [2304, 256, 1, 748]
    - [33, 17.319]
  - - [2304, 256, 1, 726]
    - [33, 17.544]
  - - [1024, 2048, 1, 768]
    - [50, 45.252]
  - - [1024, 2048, 1, 950]
    - [266, 40.298]
  - - [2304, 256, 1, 713]
    - [33, 17.043]
  - - [2304, 256, 1, 768]
    - [42, 25.391]
  - - [512, 2048, 1, 759]
    - [255, 25.187]
  - - [512, 2048, 1, 925]
    - [15, 28.237]
  - - [2304, 256, 1, 805]
    - [146, 18.072]
  - - [512, 2048, 1, 900]
    - [195, 27.617]
  - - [512, 2048, 1, 875]
    - [255, 26.642]
  - - [512, 2048, 1, 748]
    - [257, 24.753]
  - - [512, 2048, 1, 726]
    - [195, 24.717]
  - - [512, 2048, 1, 713]
    - [255, 24.345]
  - - [512, 2048, 1, 805]
    - [195, 25.428]
  - - [512, 2048, 1, 850]
    - [15, 27.511]
  - - [512, 2048, 1, 950]
    - [267, 27.849]
  - - [128, 128, 49, 1152]
    - [34, 31.291]
  - - [128, 128, 36, 12000]
    - [179, 46.041]
  - - [128, 128, 49, 1216]
    - [34, 33.842]
  - - [128, 128, 36, 1800]
    - [65, 28.078]
  - - [128, 128, 36, 1900]
    - [29, 27.933]
  - - [128, 128, 64, 5880]
    - [222, 42.383]
  - - [128, 128, 49, 7680]
    - [64, 48.374]
  - - [128, 128, 64, 882]
    - [189, 23.628]
  - - [128, 128, 64, 931]
    - [231, 24.496]
  - - [128, 64, 121, 1152]
    - [34, 22.492]
  - - [128, 64, 81, 12000]
    - [268, 32.765]
  - - [128, 64, 121, 1216]
    - [34, 24.781]
  - - [128, 64, 81, 1800]
    - [43, 24.073]
  - - [128, 64, 81, 1900]
    - [268, 24.322]
  - - [128, 64, 49, 20280]
    - [25, 32.991]
  - - [128, 64, 49, 3042]
    - [68, 25.105]
  - - [128, 64, 49, 3211]
    - [171, 25.388]
  - - [128, 64, 25, 43320]
    - [59, 30.718]
  - - [128, 64, 169, 5880]
    - [65, 30.654]
  - - [128, 64, 25, 6498]
    - [59, 23.427]
  - - [128, 64, 25, 6859]
    - [16, 21.387]
  - - [128, 64, 121, 7680]
    - [23, 30.468]
  - - [128, 64, 169, 882]
    - [199, 20.657]
  - - [128, 64, 169, 931]
    - [33, 21.262]
  - - [256, 128, 25, 1080]
    - [33, 28.48]
  - - [256, 128, 49, 1152]
    - [53, 43.236]
  - - [256, 128, 121, 120]
    - [269, 13.537]
  - - [256, 128, 169, 120]
    - [270, 14.482]
  - - [256, 128, 36, 120]
    - [41, 8.394]
  - - [256, 128, 49, 120]
    - [185, 10.288]
  - - [256, 128, 64, 120]
    - [41, 11.119]
  - - [256, 128, 36, 12000]
    - [36, 62.397]
  - - [256, 128, 49, 1216]
    - [199, 47.614]
  - - [256, 128, 25, 162]
    - [5, 8.306]
  - - [256, 128, 25, 171]
    - [123, 8.672]
  - - [256, 128, 121, 18]
    - [63, 2.689]
  - - [256, 128, 169, 18]
    - [131, 2.995]
  - - [256, 128, 36, 18]
    - [107, 1.468]
  - - [256, 128, 49, 18]
    - [5, 1.77]
  - - [256, 128, 64, 18]
    - [1, 2.045]
  - - [256, 128, 36, 1800]
    - [36, 38.962]
  - - [256, 128, 121, 19]
    - [271, 2.858]
  - - [256, 128, 169, 19]
    - [272, 3.144]
  - - [256, 128, 36, 19]
    - [31, 1.54]
  - - [256, 128, 49, 19]
    - [146, 1.899]
  - - [256, 128, 64, 19]
    - [5, 2.148]
  - - [256, 128, 36, 1900]
    - [273, 39.029]
  - - [256, 128, 49, 480]
    - [232, 31.347]
  - - [256, 128, 81, 480]
    - [274, 36.338]
  - - [256, 128, 64, 5880]
    - [275, 51.247]
  - - [256, 128, 49, 72]
    - [185, 6.784]
  - - [256, 128, 81, 72]
    - [276, 9.085]
  - - [256, 128, 49, 76]
    - [1, 7.015]
  - - [256, 128, 81, 76]
    - [98, 9.47]
  - - [256, 128, 49, 7680]
    - [156, 64.529]
  - - [256, 128, 64, 882]
    - [49, 31.197]
  - - [256, 128, 64, 931]
    - [49, 31.605]
  - - [256, 256, 49, 1152]
    - [221, 54.411]
  - - [256, 256, 36, 12000]
    - [9, 79.564]
  - - [256, 256, 49, 1216]
    - [229, 58.738]
  - - [256, 256, 36, 1800]
    - [124, 53.4]
  - - [256, 256, 36, 1900]
    - [15, 52.227]
  - - [256, 256, 64, 5880]
    - [115, 64.514]
  - - [256, 256, 49, 7680]
    - [277, 80.609]
  - - [256, 256, 64, 882]
    - [103, 38.989]
  - - [256, 256, 64, 931]
    - [189, 38.865]
  - - [512, 256, 81, 1080]
    - [278, 61.516]
  - - [512, 256, 25, 12000]
    - [69, 86.747]
  - - [512, 256, 81, 162]
    - [151, 23.517]
  - - [512, 256, 81, 171]
    - [226, 24.149]
  - - [512, 256, 25, 1800]
    - [279, 62.339]
  - - [512, 256, 25, 1900]
    - [229, 62.797]
  - - [512, 256, 121, 1920]
    - [53, 73.89]
  - - [512, 256, 169, 1920]
    - [156, 72.415]
  - - [512, 256, 49, 1920]
    - [280, 67.837]
  - - [512, 256, 121, 288]
    - [281, 42.884]
  - - [512, 256, 169, 288]
    - [175, 43.667]
  - - [512, 256, 49, 288]
    - [57, 36.884]
  - - [512, 256, 25, 3000]
    - [229, 71.501]
  - - [512, 256, 81, 3000]
    - [264, 77.857]
  - - [512, 256, 121, 304]
    - [262, 38.146]
  - - [512, 256, 169, 304]
    - [265, 38.531]
  - - [512, 256, 49, 304]
    - [282, 33.635]
  - - [512, 256, 25, 450]
    - [226, 33.698]
  - - [512, 256, 81, 450]
    - [69, 41.31]
  - - [512, 256, 25, 475]
    - [28, 34.25]
  - - [512, 256, 81, 475]
    - [203, 42.306]
  - - [512, 256, 121, 480]
    - [283, 52.716]
  - - [512, 256, 169, 480]
    - [49, 53.431]
  - - [512, 256, 49, 5880]
    - [284, 77.94]
  - - [512, 256, 121, 72]
    - [158, 15.047]
  - - [512, 256, 169, 72]
    - [189, 15.437]
  - - [512, 256, 121, 76]
    - [158, 15.502]
  - - [512, 256, 169, 76]
    - [142, 15.767]
  - - [512, 256, 49, 882]
    - [122, 52.355]
  - - [512, 256, 49, 931]
    - [285, 51.98]
  - - [64, 64, 64, 20280]
    - [61, 24.181]
  - - [64, 64, 49, 27000]
    - [59, 24.324]
  - - [64, 64, 64, 3042]
    - [147, 17.756]
  - - [64, 64, 64, 3211]
    - [147, 18.133]
  - - [64, 64, 49, 4050]
    - [52, 16.209]
  - - [64, 64, 49, 4275]
    - [59, 18.171]
  - - [64, 64, 36, 43320]
    - [167, 22.546]
  - - [64, 64, 36, 6498]
    - [167, 17.582]
  - - [64, 64, 36, 6859]
    - [59, 17.37]
  - - [1152, 128, 1, 1444]
    - [52, 10.037]
  - - [1152, 256, 1, 1]
    - [11, 0.026]
  - - [1152, 256, 1, 1444]
    - [16, 17.447]
  - - [1152, 256, 1, 25]
    - [11, 0.639]
  - - [1152, 256, 1, 9]
    - [11, 0.234]
  - - [128, 256, 1, 1444]
    - [120, 2.613]
  - - [2304, 256, 1, 1444]
    - [64, 26.655]
  - - [2304, 340, 1, 1]
    - [31, 0.062]
  - - [2304, 340, 1, 1444]
    - [4, 31.861]
  - - [2304, 340, 1, 9]
    - [31, 0.548]
  - - [2304, 510, 1, 25]
    - [31, 1.97]
  - - [2304, 512, 1, 100]
    - [286, 6.922]
  - - [2304, 512, 1, 361]
    - [255, 17.014]
  - - [256, 128, 1, 25]
    - [11, 0.085]
  - - [256, 128, 1, 9]
    - [18, 0.03]
  - - [256, 256, 1, 1444]
    - [165, 5.176]
  - - [4608, 510, 1, 100]
    - [39, 10.763]
  - - [4608, 510, 1, 361]
    - [39, 24.827]
  - - [512, 128, 1, 100]
    - [18, 0.631]
  - - [512, 256, 1, 361]
    - [160, 3.484]
  - - [576, 128, 1, 1444]
    - [120, 5.795]
  - - [576, 64, 1, 5625]
    - [80, 5.783]
  - - [64, 128, 1, 1444]
    - [120, 0.644]
  - - [81, 1024, 1, 1024]
    - [17, 6.985]
  - - [81, 1000, 1, 1024]
    - [17, 6.535]
  - - [340, 256, 49, 1152]
    - [90, 47.393]
  - - [340, 256, 36, 120]
    - [287, 12.955]
  - - [340, 256, 49, 120]
    - [286, 13.504]
  - - [340, 256, 64, 120]
    - [288, 14.854]
  - - [340, 256, 36, 12000]
    - [289, 77.025]
  - - [340, 256, 49, 1216]
    - [90, 51.075]
  - - [340, 256, 36, 18]
    - [290, 2.319]
  - - [340, 256, 49, 18]
    - [291, 2.703]
  - - [340, 256, 64, 18]
    - [292, 2.95]
  - - [340, 256, 36, 1800]
    - [293, 49.032]
  - - [340, 256, 36, 19]
    - [294, 2.457]
  - - [340, 256, 49, 19]
    - [291, 2.889]
  - - [340, 256, 64, 19]
    - [295, 3.163]
  - - [340, 256, 36, 1900]
    - [293, 48.083]
  - - [340, 256, 64, 5880]
    - [156, 63.67]
  - - [340, 256, 49, 7680]
    - [156, 69.354]
  - - [340, 256, 64, 882]
    - [285, 41.809]
  - - [340, 256, 64, 931]
    - [282, 41.499]
  - - [510, 256, 49, 120]
    - [296, 14.273]
  - - [510, 256, 64, 120]
    - [296, 15.143]
  - - [510, 256, 49, 18]
    - [297, 2.796]
  - - [510, 256, 64, 18]
    - [296, 3.092]
  - - [510, 256, 49, 19]
    - [291, 2.932]
  - - [510, 256, 64, 19]
    - [291, 3.24]
  - - [510, 256, 36, 480]
    - [281, 37.325]
  - - [510, 256, 36, 72]
    - [298, 8.805]
  - - [510, 256, 36, 76]
    - [297, 9.295]
  - - [510, 512, 36, 1080]
    - [299, 48.06]
  - - [510, 512, 36, 162]
    - [300, 17.507]
  - - [510, 512, 36, 171]
    - [288, 18.806]
  - - [510, 512, 49, 1920]
    - [90, 69.717]
  - - [510, 512, 64, 1920]
    - [90, 70.813]
  - - [510, 512, 49, 288]
    - [301, 33.726]
  - - [510, 512, 64, 288]
    - [301, 34.939]
  - - [510, 512, 36, 3000]
    - [302, 65.028]
  - - [510, 512, 49, 304]
    - [298, 29.65]
  - - [510, 512, 64, 304]
    - [303, 31.243]
  - - [510, 512, 36, 450]
    - [298, 31.688]
  - - [510, 512, 36, 475]
    - [304, 31.92]
  - - [510, 512, 49, 480]
    - [281, 42.191]
  - - [510, 512, 64, 480]
    - [301, 43.159]
  - - [510, 512, 49, 72]
    - [286, 11.623]
  - - [510, 512, 64, 72]
    - [297, 12.104]
  - - [510, 512, 49, 76]
    - [297, 11.987]
  - - [510, 512, 64, 76]
    - [288, 12.53]
  - - [147, 64, 1, 22500]
    - [305, 5.031]
  - - [33, 33, 8192, 64]
    - [306, 2.64]
  - - [34, 24, 320, 64]
    - [307, 1.483]
  - - [9, 9, 8192, 64]
    - [308, 1.673]
  - - [17, 17, 8192, 64]
    - [309, 1.692]
  - - [21, 21, 8192, 64]
    - [310, 2.455]
  - - [30, 30, 5248, 64]
    - [311, 3.71]
  - - [15, 15, 8192, 64]
    - [312, 2.723]
  - - [5, 5, 8192, 64]
    - [308, 0.659]
  - - [32, 32, 5248, 64]
    - [313, 5.567]
  - - [34, 34, 5248, 64]
    - [306, 2.793]
  - - [27, 27, 8192, 64]
    - [311, 3.157]
  - - [26, 26, 5248, 64]
    - [308, 3.162]
  - - [14, 14, 5440, 64]
    - [314, 2.496]
  - - [3, 3, 8192, 64]
    - [308, 0.238]
  - - [31, 31, 8192, 64]
    - [315, 3.548]
  - - [24, 24, 5440, 64]
    - [313, 4.239]
  - - [35, 35, 8192, 64]
    - [306, 3.025]
  - - [4, 4, 3456, 64]
    - [308, 0.271]
  - - [10, 44, 3712, 64]
    - [314, 2.886]
  - - [16, 12, 10240, 64]
    - [316, 2.247]
  - - [16, 14, 10240, 64]
    - [314, 2.397]
  - - [16, 32, 5120, 64]
    - [316, 3.788]
  - - [18, 14, 9088, 64]
    - [317, 2.613]
  - - [20, 16, 11008, 64]
    - [308, 3.409]
  - - [20, 18, 8192, 64]
    - [310, 2.776]
  - - [22, 16, 10048, 64]
    - [307, 3.592]
  - - [22, 18, 10048, 64]
    - [307, 3.428]
  - - [22, 32, 5120, 64]
    - [309, 3.724]
  - - [24, 36, 320, 64]
    - [318, 1.634]
  - - [26, 32, 384, 64]
    - [319, 1.786]
  - - [26, 34, 320, 64]
    - [316, 1.534]
  - - [28, 32, 384, 64]
    - [316, 1.908]
  - - [28, 34, 320, 64]
    - [314, 1.639]
  - - [30, 32, 384, 64]
    - [314, 1.926]
  - - [30, 36, 320, 64]
    - [314, 1.78]
  - - [32, 34, 320, 64]
    - [320, 1.977]
  - - [32, 36, 320, 64]
    - [307, 2.077]
  - - [32, 72, 160, 64]
    - [320, 2.161]
  - - [62, 56, 2624, 64]
    - [306, 5.324]
  - - [72, 16, 160, 64]
    - [321, 1.117]
  - - [96, 96, 16, 64]
    - [76, 0.984]
  - - [112, 112, 16, 64]
    - [76, 1.34]
  - - [144, 144, 16, 64]
    - [76, 2.01]
  - - [160, 160, 16, 64]
    - [18, 2.421]
  - - [176, 176, 16, 64]
    - [44, 2.929]
  - - [192, 192, 16, 64]
    - [44, 3.349]
  - - [208, 208, 16, 64]
    - [105, 3.84]
  - - [224, 224, 16, 64]
    - [198, 4.288]
  - - [240, 240, 16, 64]
    - [149, 5.034]
  - - [256, 256, 16, 64]
    - [131, 5.074]
  - - [272, 272, 16, 64]
    - [137, 5.616]
  - - [288, 288, 16, 64]
    - [137, 6.095]
  - - [304, 304, 16, 64]
    - [51, 6.879]
  - - [336, 336, 16, 64]
    - [145, 7.799]
  - - [352, 352, 16, 64]
    - [111, 8.031]
  - - [368, 368, 16, 64]
    - [145, 8.928]
  - - [384, 384, 16, 64]
    - [124, 9.097]
  - - [400, 400, 16, 64]
    - [111, 9.184]
  - - [416, 416, 16, 64]
    - [39, 9.373]
  - - [432, 432, 16, 64]
    - [211, 10.302]
  - - [448, 448, 16, 64]
    - [35, 10.245]
  - - [464, 464, 16, 64]
    - [35, 11.29]
  - - [480, 480, 16, 64]
    - [35, 11.762]
  - - [1024, 4896, 1, 1024]
    - [15, 68.128]
  - - [1024, 6688, 1, 4096]
    - [53, 83.942]
  - - [1024, 7872, 1, 1024]
    - [15, 76.29]
  - - [1024, 7872, 1, 4096]
    - [15, 92.168]
  - - [1024, 7760, 1, 1024]
    - [15, 74.593]
  - - [1024, 7760, 1, 4096]
    - [13, 90.924]
  - - [1024, 6608, 1, 1024]
    - [4, 67.706]
  - - [1024, 6608, 1, 4096]
    - [53, 82.674]
  - - [1024, 6624, 1, 4096]
    - [3, 82.743]
  - - [1024, 7024, 1, 4096]
    - [3, 87.809]
  - - [1024, 7040, 1, 4096]
    - [115, 88.974]
  - - [1024, 6544, 1, 4096]
    - [73, 83.532]
  - - [1024, 6736, 1, 4096]
    - [53, 84.231]
  - - [1024, 6960, 1, 4096]
    - [115, 87.356]
  - - [3072, 6848, 1, 1024]
    - [21, 78.876]
  - - [1024, 6848, 1, 4096]
    - [3, 85.587]
  - - [1024, 6976, 1, 4096]
    - [3, 87.255]
  - - [1024, 6640, 1, 4096]
    - [115, 83.229]
  - - [4096, 7440, 1, 1024]
    - [21, 80.934]
  - - [1024, 6672, 1, 1024]
    - [29, 67.833]
  - - [1024, 6672, 1, 4096]
    - [53, 83.453]
  - - [1024, 5328, 1, 1024]
    - [4, 62.197]
  - - [1024, 6560, 1, 4096]
    - [73, 84.559]
  - - [1024, 7776, 1, 1024]
    - [15, 75.608]
  - - [1024, 7776, 1, 4096]
    - [13, 91.225]
  - - [1024, 6576, 1, 4096]
    - [3, 82.493]
  - - [1024, 6928, 1, 4096]
    - [3, 87.093]
  - - [1024, 6864, 1, 4096]
    - [53, 85.854]
  - - [1024, 6704, 1, 1024]
    - [4, 67.982]
  - - [1024, 6704, 1, 4096]
    - [115, 84.098]
  - - [1024, 6800, 1, 4096]
    - [3, 85.416]
  - - [1024, 6880, 1, 4096]
    - [3, 85.918]
- null
