library/src/blas3/Tensile/Logic/asm_full/aldebaran_Cijk_Ailk_Bjlk_BSS_BH.yaml
- {MinimumRequiredVersion: 4.23.0}
- aldebaran
- gfx90a
- [Device 0050, Device 0051, Device 0052, Device 0054, Device 0062, Device 7400, Device 740c]
    SolutionIndex: 0
    SolutionNameMin: Cijk_Ailk_Bjlk_BSS_BH_MT32x32x16_MI16x16x8x1_SE_AF0EM4_GRVW2_NLCA1_NLCB1_SU0_SUS128_SRVW0_TT1_16_WG32_8_1_WGM1
    SolutionIndex: 1
    SolutionNameMin: Cijk_Ailk_Bjlk_BSS_BH_MT128x256x16_MI32x32x4x1_SE_AF0EM1_GRVW8_NLCA1_NLCB1_SU0_SUS128_SRVW0_TT2_128_WG64_4_1_WGM1
    SolutionIndex: 2
    SolutionNameMin: Cijk_Ailk_Bjlk_BSS_BH_MT32x32x16_MI16x16x8x1_SE_AF0EM4_GRVW8_NLCA1_NLCB1_SU0_SUS128_SRVW0_TT1_16_WG32_8_1_WGM1
    SolutionIndex: 3
    SolutionNameMin: Cijk_Ailk_Bjlk_BSS_BH_MT32x32x16_MI16x16x8x1_SE_AF0EM4_GRVW2_NLCA1_NLCB1_SU0_SUS128_SRVW4_TT1_16_WG32_8_1_WGM1
    SolutionIndex: 4
    SolutionNameMin: Cijk_Ailk_Bjlk_BSS_BH_MT32x32x64_MI16x16x8x1_SE_AF0EM4_GRVW2_NLCA1_NLCB1_SU0_SUS256_SRVW0_TT1_16_WG32_8_1_WGM1
    SolutionIndex: 5
    SolutionNameMin: Cijk_Ailk_Bjlk_BSS_BH_MT32x32x128_MI16x16x8x1_SE_AF0EM4_GRVW2_NLCA1_NLCB1_SU0_SUS256_SRVW0_TT1_16_WG32_8_1_WGM1
    SolutionIndex: 6
    SolutionNameMin: Cijk_Ailk_Bjlk_BSS_BH_MT32x32x16_MI16x16x8x1_SE_AF0EM4_GRVW4_NLCA1_NLCB1_SU0_SUS256_SRVW0_TT1_16_WG32_8_1_WGM1
    SolutionIndex: 7
    SolutionNameMin: Cijk_Ailk_Bjlk_BSS_BH_MT64x64x64_MI32x32x4x1_SE_AF0EM4_GRVW8_NLCA1_NLCB1_SU0_SUS256_SRVW4_TT1_32_WG64_4_1_WGM1
    SolutionIndex: 8
    SolutionNameMin: Cijk_Ailk_Bjlk_BSS_BH_MT128x288x16_MI32x32x4x1_SE_AF0EM4_GRVW2_NLCA1_NLCB9_SU16_SUS128_SRVW4_TT1_288_WG128_2_1_WGM1
    SolutionIndex: 9
    SolutionNameMin: Cijk_Ailk_Bjlk_BSS_BH_MT128x96x16_MI32x32x4x1_SE_AF0EM4_GRVW2_NLCA1_NLCB3_SU16_SUS128_SRVW4_TT1_96_WG128_2_1_WGM1
    SolutionIndex: 10
    SolutionNameMin: Cijk_Ailk_Bjlk_BSS_BH_MT128x96x32_MI32x32x4x1_SE_AF0EM4_GRVW4_NLCA1_NLCB3_SU16_SUS128_SRVW4_TT1_96_WG128_2_1_WGM1
    SolutionIndex: 11
    SolutionNameMin: Cijk_Ailk_Bjlk_BSS_BH_MT128x256x16_MI32x32x4x1_SE_AF0EM4_GRVW8_NLCA1_NLCB1_SU16_SUS128_SRVW4_TT2_128_WG64_4_1_WGM1
    SolutionIndex: 12
    SolutionNameMin: Cijk_Ailk_Bjlk_BSS_BH_MT128x128x32_MI32x32x4x1_SE_AF0EM1_GRVW8_NLCA1_NLCB1_SU16_SUS128_SRVW4_TT2_64_WG64_4_1_WGM1
    SolutionIndex: 13
    SolutionNameMin: Cijk_Ailk_Bjlk_BSS_BH_MT64x64x32_MI32x32x4x1_SE_AF0EM4_GRVW8_NLCA1_NLCB1_SU16_SUS128_SRVW4_TT1_32_WG64_4_1_WGM1
    SolutionIndex: 14
    SolutionNameMin: Cijk_Ailk_Bjlk_BSS_BH_MT64x128x16_MI32x32x4x1_SE_AF0EM1_GRVW2_NLCA1_NLCB1_SU16_SUS256_SRVW4_TT1_64_WG64_4_1_WGM1
    SolutionIndex: 15
    SolutionNameMin: Cijk_Ailk_Bjlk_BSS_BH_MT64x128x16_MI32x32x4x1_SE_AF0EM1_GRVW8_NLCA1_NLCB1_SU16_SUS256_SRVW4_TT1_64_WG64_4_1_WGM1
    SolutionIndex: 16
    SolutionNameMin: Cijk_Ailk_Bjlk_BSS_BH_MT64x32x16_MI16x16x8x1_SE_AF0EM4_GRVW2_NLCA1_NLCB1_SU32_SUS128_SRVW0_TT2_16_WG32_8_1_WGM1
    SolutionIndex: 17
    SolutionNameMin: Cijk_Ailk_Bjlk_BSS_BH_MT128x96x32_MI32x32x4x1_SE_AF0EM4_GRVW4_NLCA1_NLCB3_SU32_SUS128_SRVW4_TT1_96_WG128_2_1_WGM1
    SolutionIndex: 18
    SolutionNameMin: Cijk_Ailk_Bjlk_BSS_BH_MT128x160x16_MI32x32x4x1_SE_AF0EM4_GRVW2_NLCA1_NLCB5_SU32_SUS256_SRVW4_TT1_160_WG128_2_1_WGM1
    SolutionIndex: 19
    SolutionNameMin: Cijk_Ailk_Bjlk_BSS_BH_MT64x128x32_MI32x32x4x1_SE_AF0EM1_GRVW8_NLCA1_NLCB1_SU32_SUS256_SRVW4_TT1_64_WG64_4_1_WGM1
    SolutionIndex: 20
    SolutionNameMin: Cijk_Ailk_Bjlk_BSS_BH_MT64x128x32_MI32x32x4x1_SE_AF0EM4_GRVW8_NLCA1_NLCB1_SU32_SUS256_SRVW4_TT1_64_WG64_4_1_WGM1
    SolutionIndex: 21
    SolutionNameMin: Cijk_Ailk_Bjlk_BSS_BH_MT128x96x16_MI32x32x4x1_SE_AF0EM4_GRVW2_NLCA1_NLCB3_SU0_SUS128_SRVW4_TT1_96_WG128_2_1_WGM2
    SolutionIndex: 22
    SolutionNameMin: Cijk_Ailk_Bjlk_BSS_BH_MT128x80x64_MI16x16x8x1_SE_AF0EM4_GRVW2_NLCA1_NLCB5_SU0_SUS128_SRVW4_TT2_80_WG64_4_1_WGM2
    SolutionIndex: 23
    SolutionNameMin: Cijk_Ailk_Bjlk_BSS_BH_MT128x64x64_MI32x32x4x1_SE_AF0EM4_GRVW4_NLCA1_NLCB1_SU0_SUS128_SRVW4_TT2_32_WG64_4_1_WGM2
    SolutionIndex: 24
    SolutionNameMin: Cijk_Ailk_Bjlk_BSS_BH_MT64x64x32_MI32x32x4x1_SE_AF0EM1_GRVW8_NLCA1_NLCB1_SU0_SUS128_SRVW4_TT1_32_WG64_4_1_WGM2
    SolutionIndex: 25
    SolutionNameMin: Cijk_Ailk_Bjlk_BSS_BH_MT64x64x32_MI32x32x4x1_SE_AF0EM4_GRVW8_NLCA1_NLCB1_SU0_SUS128_SRVW4_TT1_32_WG64_4_1_WGM2
    SolutionIndex: 26
    SolutionNameMin: Cijk_Ailk_Bjlk_BSS_BH_MT32x32x64_MI16x16x8x1_SE_AF0EM4_GRVW2_NLCA1_NLCB1_SU0_SUS256_SRVW0_TT1_16_WG32_8_1_WGM2
    SolutionIndex: 27
    SolutionNameMin: Cijk_Ailk_Bjlk_BSS_BH_MT128x80x64_MI16x16x8x1_SE_AF0EM4_GRVW2_NLCA1_NLCB5_SU0_SUS256_SRVW0_TT2_80_WG64_4_1_WGM2
    SolutionIndex: 28
    SolutionNameMin: Cijk_Ailk_Bjlk_BSS_BH_MT64x128x16_MI32x32x4x1_SE_AF0EM4_GRVW4_NLCA1_NLCB1_SU0_SUS256_SRVW4_TT1_64_WG64_4_1_WGM2
    SolutionIndex: 29
    SolutionNameMin: Cijk_Ailk_Bjlk_BSS_BH_MT128x96x32_MI32x32x4x1_SE_AF0EM4_GRVW4_NLCA1_NLCB3_SU0_SUS256_SRVW4_TT1_96_WG128_2_1_WGM2
    SolutionIndex: 30
    SolutionNameMin: Cijk_Ailk_Bjlk_BSS_BH_MT32x64x128_MI16x16x8x1_SE_AF0EM4_GRVW8_NLCA1_NLCB1_SU0_SUS256_SRVW4_TT1_32_WG32_8_1_WGM2
    SolutionIndex: 31
    SolutionNameMin: Cijk_Ailk_Bjlk_BSS_BH_MT128x288x16_MI32x32x4x1_SE_AF0EM4_GRVW2_NLCA1_NLCB9_SU16_SUS128_SRVW4_TT1_288_WG128_2_1_WGM2
    SolutionIndex: 32
    SolutionNameMin: Cijk_Ailk_Bjlk_BSS_BH_MT128x160x32_MI32x32x4x1_SE_AF0EM4_GRVW2_NLCA1_NLCB5_SU16_SUS128_SRVW4_TT1_160_WG128_2_1_WGM2
    SolutionIndex: 33
    SolutionNameMin: Cijk_Ailk_Bjlk_BSS_BH_MT128x96x32_MI32x32x4x1_SE_AF0EM4_GRVW4_NLCA1_NLCB3_SU16_SUS128_SRVW4_TT1_96_WG128_2_1_WGM2
    SolutionIndex: 34
    SolutionNameMin: Cijk_Ailk_Bjlk_BSS_BH_MT128x256x16_MI32x32x4x1_SE_AF0EM4_GRVW2_NLCA1_NLCB2_SU16_SUS256_SRVW4_TT2_128_WG64_4_1_WGM2
    SolutionIndex: 35
    SolutionNameMin: Cijk_Ailk_Bjlk_BSS_BH_MT128x288x16_MI32x32x4x1_SE_AF0EM4_GRVW2_NLCA1_NLCB9_SU16_SUS256_SRVW4_TT1_288_WG128_2_1_WGM2
    SolutionIndex: 36
    SolutionNameMin: Cijk_Ailk_Bjlk_BSS_BH_MT64x64x32_MI32x32x4x1_SE_AF0EM4_GRVW4_NLCA1_NLCB1_SU16_SUS256_SRVW4_TT1_32_WG64_4_1_WGM2
    SolutionIndex: 37
    SolutionNameMin: Cijk_Ailk_Bjlk_BSS_BH_MT128x96x32_MI32x32x4x1_SE_AF0EM4_GRVW4_NLCA1_NLCB3_SU16_SUS256_SRVW4_TT1_96_WG128_2_1_WGM2
    SolutionIndex: 38
    SolutionNameMin: Cijk_Ailk_Bjlk_BSS_BH_MT64x64x64_MI32x32x4x1_SE_AF0EM1_GRVW8_NLCA1_NLCB1_SU16_SUS256_SRVW4_TT1_32_WG64_4_1_WGM2
    SolutionIndex: 39
    SolutionNameMin: Cijk_Ailk_Bjlk_BSS_BH_MT64x128x64_MI32x32x4x1_SE_AF0EM1_GRVW8_NLCA1_NLCB1_SU16_SUS256_SRVW4_TT1_64_WG64_4_1_WGM2
    SolutionIndex: 40
    SolutionNameMin: Cijk_Ailk_Bjlk_BSS_BH_MT128x80x64_MI16x16x8x1_SE_AF0EM4_GRVW2_NLCA1_NLCB5_SU32_SUS128_SRVW0_TT2_80_WG64_4_1_WGM2
    SolutionIndex: 41
    SolutionNameMin: Cijk_Ailk_Bjlk_BSS_BH_MT128x288x16_MI32x32x4x1_SE_AF0EM4_GRVW2_NLCA1_NLCB9_SU32_SUS128_SRVW4_TT1_288_WG128_2_1_WGM2
    SolutionIndex: 42
    SolutionNameMin: Cijk_Ailk_Bjlk_BSS_BH_MT64x128x16_MI32x32x4x1_SE_AF0EM4_GRVW8_NLCA1_NLCB1_SU32_SUS128_SRVW4_TT1_64_WG64_4_1_WGM2
    SolutionIndex: 43
    SolutionNameMin: Cijk_Ailk_Bjlk_BSS_BH_MT128x80x64_MI16x16x8x1_SE_AF0EM4_GRVW2_NLCA1_NLCB5_SU32_SUS256_SRVW0_TT2_80_WG64_4_1_WGM2
    SolutionIndex: 44
    SolutionNameMin: Cijk_Ailk_Bjlk_BSS_BH_MT128x288x16_MI32x32x4x1_SE_AF0EM4_GRVW2_NLCA1_NLCB9_SU32_SUS256_SRVW4_TT1_288_WG128_2_1_WGM2
    SolutionIndex: 45
    SolutionNameMin: Cijk_Ailk_Bjlk_BSS_BH_MT64x64x32_MI32x32x4x1_SE_AF0EM1_GRVW8_NLCA1_NLCB1_SU32_SUS256_SRVW4_TT1_32_WG64_4_1_WGM2
    SolutionIndex: 46
    SolutionNameMin: Cijk_Ailk_Bjlk_BSS_BH_MT64x64x64_MI32x32x4x1_SE_AF0EM4_GRVW8_NLCA1_NLCB1_SU32_SUS256_SRVW4_TT1_32_WG64_4_1_WGM2
    SolutionIndex: 47
    SolutionNameMin: Cijk_Ailk_Bjlk_BSS_BH_MT32x32x64_MI16x16x8x1_SE_AF0EM4_GRVW2_NLCA1_NLCB1_SU0_SUS128_SRVW0_TT1_16_WG32_8_1_WGM15
    SolutionIndex: 48
    SolutionNameMin: Cijk_Ailk_Bjlk_BSS_BH_MT32x64x64_MI16x16x8x1_SE_AF0EM4_GRVW8_NLCA1_NLCB1_SU0_SUS128_SRVW0_TT1_32_WG32_8_1_WGM15
    SolutionIndex: 49
    SolutionNameMin: Cijk_Ailk_Bjlk_BSS_BH_MT64x64x16_MI32x32x4x1_SE_AF0EM1_GRVW2_NLCA1_NLCB1_SU0_SUS128_SRVW4_TT1_32_WG64_4_1_WGM15
    SolutionIndex: 50
    SolutionNameMin: Cijk_Ailk_Bjlk_BSS_BH_MT64x64x16_MI32x32x4x1_SE_AF0EM4_GRVW2_NLCA1_NLCB1_SU0_SUS128_SRVW4_TT1_32_WG64_4_1_WGM15
    SolutionIndex: 51
    SolutionNameMin: Cijk_Ailk_Bjlk_BSS_BH_MT64x64x32_MI32x32x4x1_SE_AF0EM1_GRVW4_NLCA1_NLCB1_SU0_SUS128_SRVW4_TT1_32_WG64_4_1_WGM15
    SolutionIndex: 52
    SolutionNameMin: Cijk_Ailk_Bjlk_BSS_BH_MT64x64x16_MI32x32x4x1_SE_AF0EM4_GRVW8_NLCA1_NLCB1_SU0_SUS128_SRVW4_TT1_32_WG64_4_1_WGM15
    SolutionIndex: 53
    SolutionNameMin: Cijk_Ailk_Bjlk_BSS_BH_MT64x64x32_MI32x32x4x1_SE_AF0EM1_GRVW8_NLCA1_NLCB1_SU0_SUS128_SRVW4_TT1_32_WG64_4_1_WGM15
    SolutionIndex: 54
    SolutionNameMin: Cijk_Ailk_Bjlk_BSS_BH_MT64x64x32_MI32x32x4x1_SE_AF0EM4_GRVW8_NLCA1_NLCB1_SU0_SUS128_SRVW4_TT1_32_WG64_4_1_WGM15
    SolutionIndex: 55
    SolutionNameMin: Cijk_Ailk_Bjlk_BSS_BH_MT64x32x128_MI16x16x8x1_SE_AF0EM4_GRVW8_NLCA1_NLCB1_SU0_SUS256_SRVW0_TT2_16_WG32_8_1_WGM15
    SolutionIndex: 56
    SolutionNameMin: Cijk_Ailk_Bjlk_BSS_BH_MT64x64x16_MI32x32x4x1_SE_AF0EM4_GRVW4_NLCA1_NLCB1_SU0_SUS256_SRVW4_TT1_32_WG64_4_1_WGM15
    SolutionIndex: 57
    SolutionNameMin: Cijk_Ailk_Bjlk_BSS_BH_MT64x64x32_MI32x32x4x1_SE_AF0EM4_GRVW4_NLCA1_NLCB1_SU0_SUS256_SRVW4_TT1_32_WG64_4_1_WGM15
    SolutionIndex: 58
    SolutionNameMin: Cijk_Ailk_Bjlk_BSS_BH_MT32x64x16_MI16x16x8x1_SE_AF0EM4_GRVW2_NLCA1_NLCB1_SU16_SUS128_SRVW0_TT1_32_WG32_8_1_WGM15
    SolutionIndex: 59
    SolutionNameMin: Cijk_Ailk_Bjlk_BSS_BH_MT128x160x16_MI32x32x4x1_SE_AF0EM4_GRVW2_NLCA1_NLCB5_SU16_SUS128_SRVW4_TT1_160_WG128_2_1_WGM15
    SolutionIndex: 60
    SolutionNameMin: Cijk_Ailk_Bjlk_BSS_BH_MT128x96x32_MI32x32x4x1_SE_AF0EM4_GRVW4_NLCA1_NLCB3_SU16_SUS128_SRVW4_TT1_96_WG128_2_1_WGM15
    SolutionIndex: 61
    SolutionNameMin: Cijk_Ailk_Bjlk_BSS_BH_MT128x80x64_MI16x16x8x1_SE_AF0EM4_GRVW2_NLCA1_NLCB5_SU16_SUS256_SRVW0_TT2_80_WG64_4_1_WGM15
    SolutionIndex: 62
    SolutionNameMin: Cijk_Ailk_Bjlk_BSS_BH_MT32x64x16_MI16x16x8x1_SE_AF0EM4_GRVW8_NLCA1_NLCB1_SU16_SUS256_SRVW0_TT1_32_WG32_8_1_WGM15
    SolutionIndex: 63
    SolutionNameMin: Cijk_Ailk_Bjlk_BSS_BH_MT64x64x32_MI32x32x4x1_SE_AF0EM4_GRVW4_NLCA1_NLCB1_SU16_SUS256_SRVW4_TT1_32_WG64_4_1_WGM15
    SolutionIndex: 64
    SolutionNameMin: Cijk_Ailk_Bjlk_BSS_BH_MT32x32x16_MI16x16x8x1_SE_AF0EM4_GRVW2_NLCA1_NLCB1_SU32_SUS128_SRVW0_TT1_16_WG32_8_1_WGM15
    SolutionIndex: 65
    SolutionNameMin: Cijk_Ailk_Bjlk_BSS_BH_MT128x80x64_MI16x16x8x1_SE_AF0EM4_GRVW2_NLCA1_NLCB5_SU32_SUS128_SRVW0_TT2_80_WG64_4_1_WGM15
    SolutionIndex: 66
    SolutionNameMin: Cijk_Ailk_Bjlk_BSS_BH_MT128x256x16_MI32x32x4x1_SE_AF0EM1_GRVW2_NLCA1_NLCB2_SU32_SUS128_SRVW4_TT2_128_WG64_4_1_WGM15
    SolutionIndex: 67
    SolutionNameMin: Cijk_Ailk_Bjlk_BSS_BH_MT32x64x16_MI16x16x8x1_SE_AF0EM1_GRVW2_NLCA1_NLCB1_SU32_SUS128_SRVW4_TT1_32_WG32_8_1_WGM15
    SolutionIndex: 68
    SolutionNameMin: Cijk_Ailk_Bjlk_BSS_BH_MT128x160x16_MI32x32x4x1_SE_AF0EM4_GRVW2_NLCA1_NLCB5_SU32_SUS128_SRVW4_TT1_160_WG128_2_1_WGM15
    SolutionIndex: 69
    SolutionNameMin: Cijk_Ailk_Bjlk_BSS_BH_MT128x96x32_MI32x32x4x1_SE_AF0EM4_GRVW4_NLCA1_NLCB3_SU32_SUS128_SRVW4_TT1_96_WG128_2_1_WGM15
    SolutionIndex: 70
    SolutionNameMin: Cijk_Ailk_Bjlk_BSS_BH_MT64x64x16_MI32x32x4x1_SE_AF0EM4_GRVW8_NLCA1_NLCB1_SU32_SUS256_SRVW4_TT1_32_WG64_4_1_WGM15
    SolutionIndex: 71
    SolutionNameMin: Cijk_Ailk_Bjlk_BSS_BH_MT128x80x64_MI16x16x8x1_SE_AF0EM4_GRVW2_NLCA1_NLCB5_SU0_SUS256_SRVW0_TT2_80_WG64_4_1_WGM2
    SolutionIndex: 72
    SolutionNameMin: Cijk_Ailk_Bjlk_BSS_BH_MT128x288x16_MI32x32x4x1_SE_AF0EM4_GRVW2_NLCA1_NLCB9_SU32_SUS128_SRVW4_TT1_288_WG128_2_1_WGM2
    SolutionIndex: 73
    SolutionNameMin: Cijk_Ailk_Bjlk_BSS_BH_MT128x96x32_MI32x32x4x1_SE_AF0EM4_GRVW4_NLCA1_NLCB3_SU16_SUS256_SRVW4_TT1_96_WG128_2_1_WGM2
    SolutionIndex: 74
    SolutionNameMin: Cijk_Ailk_Bjlk_BSS_BH_MT32x32x128_MI16x16x8x1_SE_AF0EM4_GRVW2_NLCA1_NLCB1_SU0_SUS256_SRVW0_TT1_16_WG32_8_1_WGM2
    SolutionIndex: 75
    SolutionNameMin: Cijk_Ailk_Bjlk_BSS_BH_MT64x32x16_MI16x16x8x1_SE_AF0EM4_GRVW4_NLCA1_NLCB1_SU16_SUS128_SRVW4_TT2_16_WG32_8_1_WGM1
    SolutionIndex: 76
    SolutionNameMin: Cijk_Ailk_Bjlk_BSS_BH_MT64x32x128_MI16x16x8x1_SE_AF0EM1_GRVW8_NLCA1_NLCB1_SU0_SUS256_SRVW0_TT2_16_WG32_8_1_WGM2
    SolutionIndex: 77
    SolutionNameMin: Cijk_Ailk_Bjlk_BSS_BH_MT128x80x64_MI16x16x8x1_SE_AF0EM4_GRVW2_NLCA1_NLCB5_SU0_SUS256_SRVW0_TT2_80_WG64_4_1_WGM15
    SolutionIndex: 78
    SolutionNameMin: Cijk_Ailk_Bjlk_BSS_BH_MT64x128x16_MI32x32x4x1_SE_AF0EM4_GRVW2_NLCA1_NLCB1_SU0_SUS128_SRVW4_TT1_64_WG64_4_1_WGM1
    SolutionIndex: 79
    SolutionNameMin: Cijk_Ailk_Bjlk_BSS_BH_MT64x64x32_MI32x32x4x1_SE_AF0EM1_GRVW2_NLCA1_NLCB1_SU0_SUS128_SRVW4_TT1_32_WG64_4_1_WGM2
    SolutionIndex: 80
    SolutionNameMin: Cijk_Ailk_Bjlk_BSS_BH_MT128x64x16_MI32x32x4x1_SE_AF0EM4_GRVW2_NLCA1_NLCB1_SU0_SUS256_SRVW0_TT2_32_WG64_4_1_WGM1
    SolutionIndex: 81
    SolutionNameMin: Cijk_Ailk_Bjlk_BSS_BH_MT64x64x32_MI32x32x4x1_SE_AF0EM1_GRVW4_NLCA1_NLCB1_SU0_SUS256_SRVW4_TT1_32_WG64_4_1_WGM15
    SolutionIndex: 82
    SolutionNameMin: Cijk_Ailk_Bjlk_BSS_BH_MT128x80x64_MI16x16x8x1_SE_AF0EM4_GRVW2_NLCA1_NLCB5_SU16_SUS128_SRVW4_TT2_80_WG64_4_1_WGM2
    SolutionIndex: 83
    SolutionNameMin: Cijk_Ailk_Bjlk_BSS_BH_MT128x288x16_MI32x32x4x1_SE_AF0EM4_GRVW2_NLCA1_NLCB9_SU16_SUS128_SRVW4_TT1_288_WG128_2_1_WGM15
    SolutionIndex: 84
    SolutionNameMin: Cijk_Ailk_Bjlk_BSS_BH_MT64x64x64_MI32x32x4x1_SE_AF0EM4_GRVW8_NLCA1_NLCB1_SU32_SUS128_SRVW4_TT1_32_WG64_4_1_WGM1
    SolutionIndex: 85
    SolutionNameMin: Cijk_Ailk_Bjlk_BSS_BH_MT32x64x16_MI16x16x8x1_SE_AF0EM4_GRVW2_NLCA1_NLCB1_SU0_SUS128_SRVW0_TT1_32_WG32_8_1_WGM1
    SolutionIndex: 86
    SolutionNameMin: Cijk_Ailk_Bjlk_BSS_BH_MT32x64x16_MI16x16x8x1_SE_AF0EM4_GRVW2_NLCA1_NLCB1_SU0_SUS256_SRVW0_TT1_32_WG32_8_1_WGM1
    SolutionIndex: 87
    SolutionNameMin: Cijk_Ailk_Bjlk_BSS_BH_MT64x32x16_MI16x16x8x1_SE_AF0EM4_GRVW2_NLCA1_NLCB1_SU0_SUS128_SRVW0_TT2_16_WG32_8_1_WGM1
    SolutionIndex: 88
    SolutionNameMin: Cijk_Ailk_Bjlk_BSS_BH_MT64x32x16_MI16x16x8x1_SE_AF0EM4_GRVW2_NLCA1_NLCB1_SU0_SUS256_SRVW0_TT2_16_WG32_8_1_WGM1
    SolutionIndex: 89
    SolutionNameMin: Cijk_Ailk_Bjlk_BSS_BH_MT128x80x64_MI16x16x8x1_SE_AF0EM4_GRVW2_NLCA1_NLCB5_SU0_SUS128_SRVW0_TT2_80_WG64_4_1_WGM2
    SolutionIndex: 90
    SolutionNameMin: Cijk_Ailk_Bjlk_BSS_BH_MT128x80x64_MI16x16x8x1_SE_AF0EM4_GRVW2_NLCA1_NLCB5_SU16_SUS256_SRVW0_TT2_80_WG64_4_1_WGM15
    SolutionIndex: 91
    SolutionNameMin: Cijk_Ailk_Bjlk_BSS_BH_MT128x288x16_MI32x32x4x1_SE_AF0EM4_GRVW2_NLCA1_NLCB9_SU16_SUS128_SRVW4_TT1_288_WG128_2_1_WGM2
    SolutionIndex: 92
    SolutionNameMin: Cijk_Ailk_Bjlk_BSS_BH_MT128x256x16_MI32x32x4x1_SE_AF0EM4_GRVW2_NLCA1_NLCB2_SU32_SUS256_SRVW4_TT2_128_WG64_4_1_WGM15
    SolutionIndex: 93
    SolutionNameMin: Cijk_Ailk_Bjlk_BSS_BH_MT128x80x64_MI16x16x8x1_SE_AF0EM4_GRVW2_NLCA1_NLCB5_SU0_SUS256_SRVW4_TT2_80_WG64_4_1_WGM15
    SolutionIndex: 94
    SolutionNameMin: Cijk_Ailk_Bjlk_BSS_BH_MT128x80x64_MI16x16x8x1_SE_AF0EM4_GRVW2_NLCA1_NLCB5_SU0_SUS128_SRVW4_TT2_80_WG64_4_1_WGM15
    SolutionIndex: 95
    SolutionNameMin: Cijk_Ailk_Bjlk_BSS_BH_MT128x80x64_MI16x16x8x1_SE_AF0EM4_GRVW2_NLCA1_NLCB5_SU0_SUS128_SRVW4_TT2_80_WG64_4_1_WGM2
    SolutionIndex: 96
    SolutionNameMin: Cijk_Ailk_Bjlk_BSS_BH_MT128x80x64_MI16x16x8x1_SE_AF0EM4_GRVW2_NLCA1_NLCB5_SU16_SUS256_SRVW4_TT2_80_WG64_4_1_WGM2
    SolutionIndex: 97
    SolutionNameMin: Cijk_Ailk_Bjlk_BSS_BH_MT128x80x64_MI16x16x8x1_SE_AF0EM4_GRVW2_NLCA1_NLCB5_SU0_SUS256_SRVW4_TT2_80_WG64_4_1_WGM2
    SolutionIndex: 98
    SolutionNameMin: Cijk_Ailk_Bjlk_BSS_BH_MT128x80x64_MI16x16x8x1_SE_AF0EM4_GRVW2_NLCA1_NLCB5_SU32_SUS256_SRVW0_TT2_80_WG64_4_1_WGM2
    SolutionIndex: 99
    SolutionNameMin: Cijk_Ailk_Bjlk_BSS_BH_MT128x288x16_MI32x32x4x1_SE_AF0EM4_GRVW2_NLCA1_NLCB9_SU16_SUS256_SRVW4_TT1_288_WG128_2_1_WGM2
    SolutionIndex: 100
    SolutionNameMin: Cijk_Ailk_Bjlk_BSS_BH_MT128x288x16_MI32x32x4x1_SE_AF0EM4_GRVW2_NLCA1_NLCB9_SU32_SUS128_SRVW4_TT1_288_WG128_2_1_WGM15
    SolutionIndex: 101
    SolutionNameMin: Cijk_Ailk_Bjlk_BSS_BH_MT128x96x32_MI32x32x4x1_SE_AF0EM4_GRVW4_NLCA1_NLCB3_SU32_SUS256_SRVW4_TT1_96_WG128_2_1_WGM2
    SolutionIndex: 102
    SolutionNameMin: Cijk_Ailk_Bjlk_BSS_BH_MT128x96x32_MI32x32x4x1_SE_AF0EM1_GRVW4_NLCA1_NLCB3_SU32_SUS128_SRVW4_TT1_96_WG128_2_1_WGM15
    SolutionIndex: 103
    SolutionNameMin: Cijk_Ailk_Bjlk_BSS_BH_MT32x64x16_MI16x16x8x1_SE_AF0EM1_GRVW4_NLCA1_NLCB1_SU32_SUS128_SRVW4_TT1_32_WG32_8_1_WGM2
    SolutionIndex: 104
    SolutionNameMin: Cijk_Ailk_Bjlk_BSS_BH_MT32x64x16_MI16x16x8x1_SE_AF0EM1_GRVW4_NLCA1_NLCB1_SU32_SUS256_SRVW4_TT1_32_WG32_8_1_WGM2
    SolutionIndex: 105
    SolutionNameMin: Cijk_Ailk_Bjlk_BSS_BH_MT32x64x16_MI16x16x8x1_SE_AF0EM1_GRVW2_NLCA1_NLCB1_SU32_SUS128_SRVW4_TT1_32_WG32_8_1_WGM2
    SolutionIndex: 106
    SolutionNameMin: Cijk_Ailk_Bjlk_BSS_BH_MT32x64x16_MI16x16x8x1_SE_AF0EM1_GRVW2_NLCA1_NLCB1_SU16_SUS128_SRVW4_TT1_32_WG32_8_1_WGM15
    SolutionIndex: 107
    SolutionNameMin: Cijk_Ailk_Bjlk_BSS_BH_MT32x64x16_MI16x16x8x1_SE_AF0EM1_GRVW2_NLCA1_NLCB1_SU32_SUS256_SRVW4_TT1_32_WG32_8_1_WGM1
    SolutionIndex: 108
    SolutionNameMin: Cijk_Ailk_Bjlk_BSS_BH_MT32x64x16_MI16x16x8x1_SE_AF0EM1_GRVW4_NLCA1_NLCB1_SU32_SUS256_SRVW4_TT1_32_WG32_8_1_WGM1
    SolutionIndex: 109
    SolutionNameMin: Cijk_Ailk_Bjlk_BSS_BH_MT32x64x16_MI16x16x8x1_SE_AF0EM1_GRVW4_NLCA1_NLCB1_SU16_SUS128_SRVW4_TT1_32_WG32_8_1_WGM1
    SolutionIndex: 110
    SolutionNameMin: Cijk_Ailk_Bjlk_BSS_BH_MT32x64x16_MI16x16x8x1_SE_AF0EM4_GRVW2_NLCA1_NLCB1_SU32_SUS128_SRVW0_TT1_32_WG32_8_1_WGM1
    SolutionIndex: 111
    SolutionNameMin: Cijk_Ailk_Bjlk_BSS_BH_MT32x32x16_MI16x16x8x1_SE_AF0EM1_GRVW4_NLCA1_NLCB1_SU16_SUS256_SRVW4_TT1_16_WG32_8_1_WGM15
    SolutionIndex: 112
    SolutionNameMin: Cijk_Ailk_Bjlk_BSS_BH_MT32x32x16_MI16x16x8x1_SE_AF0EM1_GRVW8_NLCA1_NLCB1_SU32_SUS256_SRVW4_TT1_16_WG32_8_1_WGM15
    SolutionIndex: 113
    SolutionNameMin: Cijk_Ailk_Bjlk_BSS_BH_MT32x64x16_MI16x16x8x1_SE_AF0EM1_GRVW4_NLCA1_NLCB1_SU0_SUS256_SRVW4_TT1_32_WG32_8_1_WGM15
    SolutionIndex: 114
    SolutionNameMin: Cijk_Ailk_Bjlk_BSS_BH_MT32x64x16_MI16x16x8x1_SE_AF0EM1_GRVW8_NLCA1_NLCB1_SU16_SUS128_SRVW4_TT1_32_WG32_8_1_WGM2
    SolutionIndex: 115
    SolutionNameMin: Cijk_Ailk_Bjlk_BSS_BH_MT32x64x16_MI16x16x8x1_SE_AF0EM4_GRVW2_NLCA1_NLCB1_SU32_SUS256_SRVW0_TT1_32_WG32_8_1_WGM1
    SolutionIndex: 116
    SolutionNameMin: Cijk_Ailk_Bjlk_BSS_BH_MT32x64x16_MI16x16x8x1_SE_AF0EM1_GRVW8_NLCA1_NLCB1_SU0_SUS128_SRVW4_TT1_32_WG32_8_1_WGM15
    SolutionIndex: 117
    SolutionNameMin: Cijk_Ailk_Bjlk_BSS_BH_MT32x64x16_MI16x16x8x1_SE_AF0EM1_GRVW8_NLCA1_NLCB1_SU32_SUS256_SRVW4_TT1_32_WG32_8_1_WGM2
    SolutionIndex: 118
    SolutionNameMin: Cijk_Ailk_Bjlk_BSS_BH_MT64x32x16_MI16x16x8x1_SE_AF0EM4_GRVW2_NLCA1_NLCB1_SU0_SUS128_SRVW0_TT2_16_WG32_8_1_WGM2
    SolutionIndex: 119
    SolutionNameMin: Cijk_Ailk_Bjlk_BSS_BH_MT64x32x16_MI16x16x8x1_SE_AF0EM4_GRVW2_NLCA1_NLCB1_SU0_SUS256_SRVW0_TT2_16_WG32_8_1_WGM2
    SolutionIndex: 120
    SolutionNameMin: Cijk_Ailk_Bjlk_BSS_BH_MT64x32x16_MI16x16x8x1_SE_AF0EM4_GRVW2_NLCA1_NLCB1_SU16_SUS256_SRVW0_TT2_16_WG32_8_1_WGM2
    SolutionIndex: 121
    SolutionNameMin: Cijk_Ailk_Bjlk_BSS_BH_MT64x32x16_MI16x16x8x1_SE_AF0EM4_GRVW2_NLCA1_NLCB1_SU32_SUS128_SRVW0_TT2_16_WG32_8_1_WGM15
    SolutionIndex: 122
    SolutionNameMin: Cijk_Ailk_Bjlk_BSS_BH_MT64x32x16_MI16x16x8x1_SE_AF0EM4_GRVW2_NLCA1_NLCB1_SU32_SUS256_SRVW0_TT2_16_WG32_8_1_WGM1
    SolutionIndex: 123
    SolutionNameMin: Cijk_Ailk_Bjlk_BSS_BH_MT64x32x16_MI16x16x8x1_SE_AF0EM4_GRVW2_NLCA1_NLCB1_SU32_SUS128_SRVW0_TT2_16_WG32_8_1_WGM1
    SolutionIndex: 124
    SolutionNameMin: Cijk_Ailk_Bjlk_BSS_BH_MT64x32x16_MI16x16x8x1_SE_AF0EM4_GRVW2_NLCA1_NLCB1_SU32_SUS256_SRVW0_TT2_16_WG32_8_1_WGM2
    SolutionIndex: 125
    SolutionNameMin: Cijk_Ailk_Bjlk_BSS_BH_MT64x32x16_MI16x16x8x1_SE_AF0EM4_GRVW2_NLCA1_NLCB1_SU32_SUS128_SRVW0_TT2_16_WG32_8_1_WGM2
    SolutionIndex: 126
    SolutionNameMin: Cijk_Ailk_Bjlk_BSS_BH_MT64x32x16_MI16x16x8x1_SE_AF0EM4_GRVW2_NLCA1_NLCB1_SU0_SUS256_SRVW0_TT2_16_WG32_8_1_WGM1
    SolutionIndex: 127
    SolutionNameMin: Cijk_Ailk_Bjlk_BSS_BH_MT64x32x16_MI16x16x8x1_SE_AF0EM1_GRVW2_NLCA1_NLCB1_SU32_SUS256_SRVW4_TT2_16_WG32_8_1_WGM1
    SolutionIndex: 128
    SolutionNameMin: Cijk_Ailk_Bjlk_BSS_BH_MT64x32x16_MI16x16x8x1_SE_AF0EM4_GRVW2_NLCA1_NLCB1_SU0_SUS128_SRVW0_TT2_16_WG32_8_1_WGM1
    SolutionIndex: 129
    SolutionNameMin: Cijk_Ailk_Bjlk_BSS_BH_MT32x64x16_MI16x16x8x1_SE_AF0EM4_GRVW2_NLCA1_NLCB1_SU0_SUS256_SRVW0_TT1_32_WG32_8_1_WGM1
    SolutionIndex: 130
    SolutionNameMin: Cijk_Ailk_Bjlk_BSS_BH_MT32x64x16_MI16x16x8x1_SE_AF0EM4_GRVW2_NLCA1_NLCB1_SU0_SUS128_SRVW0_TT1_32_WG32_8_1_WGM2
    SolutionIndex: 131
    SolutionNameMin: Cijk_Ailk_Bjlk_BSS_BH_MT32x32x64_MI16x16x8x1_SE_AF0EM4_GRVW8_NLCA1_NLCB1_SU32_SUS128_SRVW0_TT1_16_WG32_8_1_WGM15
    SolutionIndex: 132
    SolutionNameMin: Cijk_Ailk_Bjlk_BSS_BH_MT32x32x64_MI16x16x8x1_SE_AF0EM4_GRVW8_NLCA1_NLCB1_SU16_SUS256_SRVW0_TT1_16_WG32_8_1_WGM2
    SolutionIndex: 133
    SolutionNameMin: Cijk_Ailk_Bjlk_BSS_BH_MT32x32x64_MI16x16x8x1_SE_AF0EM4_GRVW8_NLCA1_NLCB1_SU0_SUS256_SRVW0_TT1_16_WG32_8_1_WGM1
    SolutionIndex: 134
    SolutionNameMin: Cijk_Ailk_Bjlk_BSS_BH_MT32x32x32_MI16x16x8x1_SE_AF0EM4_GRVW8_NLCA1_NLCB1_SU32_SUS128_SRVW0_TT1_16_WG32_8_1_WGM1
    SolutionIndex: 135
    SolutionNameMin: Cijk_Ailk_Bjlk_BSS_BH_MT32x32x64_MI16x16x8x1_SE_AF0EM1_GRVW4_NLCA1_NLCB1_SU32_SUS128_SRVW0_TT1_16_WG32_8_1_WGM1
    SolutionIndex: 136
    SolutionNameMin: Cijk_Ailk_Bjlk_BSS_BH_MT128x96x32_MI32x32x4x1_SE_AF0EM4_GRVW4_NLCA1_NLCB3_SU16_SUS128_SRVW4_TT1_96_WG128_2_1_WGM15
    SolutionIndex: 137
    SolutionNameMin: Cijk_Ailk_Bjlk_BSS_BH_MT32x32x64_MI16x16x8x1_SE_AF0EM1_GRVW8_NLCA1_NLCB1_SU16_SUS128_SRVW0_TT1_16_WG32_8_1_WGM1
    SolutionIndex: 138
    SolutionNameMin: Cijk_Ailk_Bjlk_BSS_BH_MT64x32x16_MI16x16x8x1_SE_AF0EM4_GRVW4_NLCA1_NLCB1_SU0_SUS256_SRVW0_TT2_16_WG32_8_1_WGM15
    SolutionIndex: 139
    SolutionNameMin: Cijk_Ailk_Bjlk_BSS_BH_MT64x128x32_MI32x32x4x1_SE_AF0EM1_GRVW8_NLCA1_NLCB1_SU32_SUS128_SRVW4_TT1_64_WG64_4_1_WGM1
    SolutionIndex: 140
    SolutionNameMin: Cijk_Ailk_Bjlk_BSS_BH_MT32x32x16_MI16x16x8x1_SE_AF0EM1_GRVW2_NLCA1_NLCB1_SU0_SUS128_SRVW0_TT1_16_WG32_8_1_WGM1
    SolutionIndex: 141
    SolutionNameMin: Cijk_Ailk_Bjlk_BSS_BH_MT64x80x64_MI16x16x8x1_SE_AF0EM4_GRVW2_NLCA1_NLCB5_SU0_SUS256_SRVW0_TT1_80_WG64_4_1_WGM1
    SolutionIndex: 142
    SolutionNameMin: Cijk_Ailk_Bjlk_BSS_BH_MT64x128x16_MI32x32x4x1_SE_AF0EM4_GRVW4_NLCA1_NLCB1_SU32_SUS256_SRVW4_TT1_64_WG64_4_1_WGM15
    SolutionIndex: 143
    SolutionNameMin: Cijk_Ailk_Bjlk_BSS_BH_MT128x80x64_MI16x16x8x1_SE_AF0EM4_GRVW2_NLCA1_NLCB5_SU0_SUS128_SRVW0_TT2_80_WG64_4_1_WGM1
    SolutionIndex: 144
    SolutionNameMin: Cijk_Ailk_Bjlk_BSS_BH_MT64x64x64_MI32x32x4x1_SE_AF0EM1_GRVW8_NLCA1_NLCB1_SU32_SUS256_SRVW4_TT1_32_WG64_4_1_WGM1
    SolutionIndex: 145
    SolutionNameMin: Cijk_Ailk_Bjlk_BSS_BH_MT32x64x16_MI16x16x8x1_SE_AF0EM1_GRVW4_NLCA1_NLCB1_SU0_SUS128_SRVW0_TT1_32_WG32_8_1_WGM1
    SolutionIndex: 146
    SolutionNameMin: Cijk_Ailk_Bjlk_BSS_BH_MT32x64x16_MI16x16x8x1_SE_AF0EM1_GRVW4_NLCA1_NLCB1_SU0_SUS256_SRVW0_TT1_32_WG32_8_1_WGM1
    SolutionIndex: 147
    SolutionNameMin: Cijk_Ailk_Bjlk_BSS_BH_MT32x64x16_MI16x16x8x1_SE_AF0EM1_GRVW2_NLCA1_NLCB1_SU0_SUS256_SRVW0_TT1_32_WG32_8_1_WGM2
    SolutionIndex: 148
    SolutionNameMin: Cijk_Ailk_Bjlk_BSS_BH_MT32x32x16_MI16x16x8x1_SE_AF0EM1_GRVW4_NLCA1_NLCB1_SU0_SUS256_SRVW0_TT1_16_WG32_8_1_WGM2
    SolutionIndex: 149
    SolutionNameMin: Cijk_Ailk_Bjlk_BSS_BH_MT32x32x16_MI16x16x8x1_SE_AF0EM1_GRVW4_NLCA1_NLCB1_SU0_SUS128_SRVW0_TT1_16_WG32_8_1_WGM15
    SolutionIndex: 150
    SolutionNameMin: Cijk_Ailk_Bjlk_BSS_BH_MT32x32x64_MI16x16x8x1_SE_AF0EM1_GRVW4_NLCA1_NLCB1_SU16_SUS128_SRVW0_TT1_16_WG32_8_1_WGM1
    SolutionIndex: 151
    SolutionNameMin: Cijk_Ailk_Bjlk_BSS_BH_MT32x32x64_MI16x16x8x1_SE_AF0EM1_GRVW8_NLCA1_NLCB1_SU32_SUS128_SRVW0_TT1_16_WG32_8_1_WGM1
    SolutionIndex: 152
    SolutionNameMin: Cijk_Ailk_Bjlk_BSS_BH_MT64x32x64_MI16x16x8x1_SE_AF0EM4_GRVW8_NLCA1_NLCB1_SU0_SUS256_SRVW0_TT2_16_WG32_8_1_WGM1
    SolutionIndex: 153
    SolutionNameMin: Cijk_Ailk_Bjlk_BSS_BH_MT128x64x64_MI32x32x4x1_SE_AF0EM4_GRVW4_NLCA1_NLCB1_SU16_SUS128_SRVW4_TT2_32_WG64_4_1_WGM2
    SolutionIndex: 154
    SolutionNameMin: Cijk_Ailk_Bjlk_BSS_BH_MT128x64x64_MI32x32x4x1_SE_AF0EM4_GRVW8_NLCA1_NLCB1_SU0_SUS256_SRVW4_TT2_32_WG64_4_1_WGM15
    SolutionIndex: 155
    SolutionNameMin: Cijk_Ailk_Bjlk_BSS_BH_MT128x64x64_MI32x32x4x1_SE_AF0EM4_GRVW8_NLCA1_NLCB1_SU0_SUS128_SRVW4_TT2_32_WG64_4_1_WGM2
    SolutionIndex: 156
    SolutionNameMin: Cijk_Ailk_Bjlk_BSS_BH_MT64x128x64_MI32x32x4x1_SE_AF0EM4_GRVW8_NLCA1_NLCB1_SU0_SUS128_SRVW4_TT1_64_WG64_4_1_WGM15
    SolutionIndex: 157
    SolutionNameMin: Cijk_Ailk_Bjlk_BSS_BH_MT128x80x64_MI16x16x8x1_SE_AF0EM4_GRVW2_NLCA1_NLCB5_SU0_SUS128_SRVW0_TT2_80_WG64_4_1_WGM2
    SolutionIndex: 158
    SolutionNameMin: Cijk_Ailk_Bjlk_BSS_BH_MT128x96x64_MI32x32x4x1_SE_AF0EM4_GRVW8_NLCA1_NLCB3_SU0_SUS128_SRVW4_TT1_96_WG128_2_1_WGM2
    SolutionIndex: 159
    SolutionNameMin: Cijk_Ailk_Bjlk_BSS_BH_MT128x128x32_MI32x32x4x1_SE_AF0EM4_GRVW8_NLCA1_NLCB1_SU0_SUS256_SRVW4_TT2_64_WG64_4_1_WGM15
    SolutionIndex: 160
    SolutionNameMin: Cijk_Ailk_Bjlk_BSS_BH_MT128x128x32_MI32x32x4x1_SE_AF0EM1_GRVW8_NLCA1_NLCB1_SU0_SUS128_SRVW4_TT2_64_WG64_4_1_WGM15
    SolutionIndex: 161
    SolutionNameMin: Cijk_Ailk_Bjlk_BSS_BH_MT128x160x32_MI32x32x4x1_SE_AF0EM4_GRVW2_NLCA1_NLCB5_SU32_SUS128_SRVW4_TT1_160_WG128_2_1_WGM15
    SolutionIndex: 162
    SolutionNameMin: Cijk_Ailk_Bjlk_BSS_BH_MT128x96x32_MI32x32x4x1_SE_AF0EM4_GRVW4_NLCA1_NLCB3_SU16_SUS128_SRVW4_TT1_96_WG128_2_1_WGM2
    SolutionIndex: 163
    SolutionNameMin: Cijk_Ailk_Bjlk_BSS_BH_MT128x256x16_MI32x32x4x1_SE_AF0EM1_GRVW8_NLCA1_NLCB1_SU0_SUS256_SRVW4_TT2_128_WG64_4_1_WGM1
    SolutionIndex: 164
    SolutionNameMin: Cijk_Ailk_Bjlk_BSS_BH_MT128x256x16_MI32x32x4x1_SE_AF0EM4_GRVW8_NLCA1_NLCB1_SU0_SUS128_SRVW4_TT2_128_WG64_4_1_WGM2
    SolutionIndex: 165
    SolutionNameMin: Cijk_Ailk_Bjlk_BSS_BH_MT128x256x16_MI32x32x4x1_SE_AF0EM1_GRVW8_NLCA1_NLCB1_SU16_SUS128_SRVW4_TT2_128_WG64_4_1_WGM15
    SolutionIndex: 166
    SolutionNameMin: Cijk_Ailk_Bjlk_BSS_BH_MT128x256x16_MI32x32x4x1_SE_AF0EM4_GRVW8_NLCA1_NLCB1_SU16_SUS128_SRVW4_TT2_128_WG64_4_1_WGM2
    SolutionIndex: 167
    SolutionNameMin: Cijk_Ailk_Bjlk_BSS_BH_MT64x128x32_MI32x32x4x1_SE_AF0EM4_GRVW8_NLCA1_NLCB1_SU32_SUS128_SRVW4_TT1_64_WG64_4_1_WGM15
    SolutionIndex: 168
    SolutionNameMin: Cijk_Ailk_Bjlk_BSS_BH_MT128x96x32_MI32x32x4x1_SE_AF0EM1_GRVW4_NLCA1_NLCB3_SU0_SUS128_SRVW4_TT1_96_WG128_2_1_WGM1
    SolutionIndex: 169
    SolutionNameMin: Cijk_Ailk_Bjlk_BSS_BH_MT128x256x16_MI32x32x4x1_SE_AF0EM4_GRVW4_NLCA1_NLCB1_SU16_SUS256_SRVW4_TT2_128_WG64_4_1_WGM2
    SolutionIndex: 170
    SolutionNameMin: Cijk_Ailk_Bjlk_BSS_BH_MT64x64x64_MI32x32x4x1_SE_AF0EM1_GRVW4_NLCA1_NLCB1_SU32_SUS128_SRVW4_TT1_32_WG64_4_1_WGM2
    SolutionIndex: 171
    SolutionNameMin: Cijk_Ailk_Bjlk_BSS_BH_MT32x32x32_MI16x16x8x1_SE_AF0EM4_GRVW4_NLCA1_NLCB1_SU0_SUS128_SRVW0_TT1_16_WG32_8_1_WGM15
    SolutionIndex: 172
    SolutionNameMin: Cijk_Ailk_Bjlk_BSS_BH_MT32x32x32_MI16x16x8x1_SE_AF0EM4_GRVW2_NLCA1_NLCB1_SU0_SUS128_SRVW0_TT1_16_WG32_8_1_WGM1
    SolutionIndex: 173
    SolutionNameMin: Cijk_Ailk_Bjlk_BSS_BH_MT64x64x32_MI32x32x4x1_SE_AF0EM1_GRVW4_NLCA1_NLCB1_SU32_SUS128_SRVW4_TT1_32_WG64_4_1_WGM15
    SolutionIndex: 174
    SolutionNameMin: Cijk_Ailk_Bjlk_BSS_BH_MT64x64x32_MI32x32x4x1_SE_AF0EM4_GRVW4_NLCA1_NLCB1_SU0_SUS256_SRVW4_TT1_32_WG64_4_1_WGM1
    SolutionIndex: 175
    SolutionNameMin: Cijk_Ailk_Bjlk_BSS_BH_MT64x128x32_MI32x32x4x1_SE_AF0EM4_GRVW8_NLCA1_NLCB1_SU0_SUS256_SRVW4_TT1_64_WG64_4_1_WGM15
    SolutionIndex: 176
    SolutionNameMin: Cijk_Ailk_Bjlk_BSS_BH_MT32x32x64_MI16x16x8x1_SE_AF0EM4_GRVW8_NLCA1_NLCB1_SU32_SUS128_SRVW0_TT1_16_WG32_8_1_WGM1
    SolutionIndex: 177
    SolutionNameMin: Cijk_Ailk_Bjlk_BSS_BH_MT64x64x64_MI32x32x4x1_SE_AF0EM4_GRVW8_NLCA1_NLCB1_SU32_SUS128_SRVW4_TT1_32_WG64_4_1_WGM1
    SolutionIndex: 178
    SolutionNameMin: Cijk_Ailk_Bjlk_BSS_BH_MT64x64x64_MI32x32x4x1_SE_AF0EM4_GRVW8_NLCA1_NLCB1_SU32_SUS256_SRVW4_TT1_32_WG64_4_1_WGM1
    SolutionIndex: 179
    SolutionNameMin: Cijk_Ailk_Bjlk_BSS_BH_MT64x64x64_MI32x32x4x1_SE_AF0EM4_GRVW8_NLCA1_NLCB1_SU16_SUS256_SRVW4_TT1_32_WG64_4_1_WGM1
    SolutionIndex: 180
    SolutionNameMin: Cijk_Ailk_Bjlk_BSS_BH_MT64x64x64_MI32x32x4x1_SE_AF0EM4_GRVW8_NLCA1_NLCB1_SU32_SUS256_SRVW4_TT1_32_WG64_4_1_WGM2
    SolutionIndex: 181
    SolutionNameMin: Cijk_Ailk_Bjlk_BSS_BH_MT64x64x128_MI32x32x4x1_SE_AF0EM4_GRVW8_NLCA1_NLCB1_SU0_SUS256_SRVW4_TT1_32_WG64_4_1_WGM15
    SolutionIndex: 182
    SolutionNameMin: Cijk_Ailk_Bjlk_BSS_BH_MT64x64x128_MI32x32x4x1_SE_AF0EM1_GRVW8_NLCA1_NLCB1_SU0_SUS256_SRVW4_TT1_32_WG64_4_1_WGM1
    SolutionIndex: 183
    SolutionNameMin: Cijk_Ailk_Bjlk_BSS_BH_MT64x64x128_MI32x32x4x1_SE_AF0EM4_GRVW8_NLCA1_NLCB1_SU0_SUS256_SRVW0_TT1_32_WG64_4_1_WGM15
    SolutionIndex: 184
    SolutionNameMin: Cijk_Ailk_Bjlk_BSS_BH_MT64x64x128_MI32x32x4x1_SE_AF0EM1_GRVW8_NLCA1_NLCB1_SU0_SUS256_SRVW0_TT1_32_WG64_4_1_WGM1
    SolutionIndex: 185
    SolutionNameMin: Cijk_Ailk_Bjlk_BSS_BH_MT64x64x128_MI32x32x4x1_SE_AF0EM4_GRVW8_NLCA1_NLCB1_SU32_SUS256_SRVW0_TT1_32_WG64_4_1_WGM1
    SolutionIndex: 186
    SolutionNameMin: Cijk_Ailk_Bjlk_BSS_BH_MT64x64x128_MI32x32x4x1_SE_AF0EM1_GRVW8_NLCA1_NLCB1_SU0_SUS256_SRVW4_TT1_32_WG64_4_1_WGM2
    SolutionIndex: 187
    SolutionNameMin: Cijk_Ailk_Bjlk_BSS_BH_MT64x64x64_MI32x32x4x1_SE_AF0EM1_GRVW8_NLCA1_NLCB1_SU32_SUS256_SRVW4_TT1_32_WG64_4_1_WGM2
    SolutionIndex: 188
    SolutionNameMin: Cijk_Ailk_Bjlk_BSS_BH_MT64x128x32_MI32x32x4x1_SE_AF0EM1_GRVW8_NLCA1_NLCB1_SU16_SUS128_SRVW4_TT1_64_WG64_4_1_WGM15
    SolutionIndex: 189
    SolutionNameMin: Cijk_Ailk_Bjlk_BSS_BH_MT64x64x64_MI32x32x4x1_SE_AF0EM4_GRVW8_NLCA1_NLCB1_SU32_SUS128_SRVW4_TT1_32_WG64_4_1_WGM2
    SolutionIndex: 190
    SolutionNameMin: Cijk_Ailk_Bjlk_BSS_BH_MT128x96x16_MI32x32x4x1_SE_AF0EM4_GRVW2_NLCA1_NLCB3_SU0_SUS128_SRVW4_TT1_96_WG128_2_1_WGM1
    SolutionIndex: 191
    SolutionNameMin: Cijk_Ailk_Bjlk_BSS_BH_MT128x96x32_MI32x32x4x1_SE_AF0EM4_GRVW4_NLCA1_NLCB3_SU16_SUS128_SRVW4_TT1_96_WG128_2_1_WGM15
    SolutionIndex: 192
    SolutionNameMin: Cijk_Ailk_Bjlk_BSS_BH_MT128x160x16_MI32x32x4x1_SE_AF0EM4_GRVW2_NLCA1_NLCB5_SU16_SUS128_SRVW4_TT1_160_WG128_2_1_WGM1
    SolutionIndex: 193
    SolutionNameMin: Cijk_Ailk_Bjlk_BSS_BH_MT64x32x16_MI16x16x8x1_SE_AF0EM4_GRVW2_NLCA1_NLCB1_SU16_SUS256_SRVW0_TT2_16_WG32_8_1_WGM15
    SolutionIndex: 194
    SolutionNameMin: Cijk_Ailk_Bjlk_BSS_BH_MT128x96x32_MI32x32x4x1_SE_AF0EM4_GRVW4_NLCA1_NLCB3_SU16_SUS256_SRVW4_TT1_96_WG128_2_1_WGM2
    SolutionIndex: 195
    SolutionNameMin: Cijk_Ailk_Bjlk_BSS_BH_MT128x96x32_MI32x32x4x1_SE_AF0EM1_GRVW4_NLCA1_NLCB3_SU0_SUS128_SRVW4_TT1_96_WG128_2_1_WGM1
    SolutionIndex: 196
    SolutionNameMin: Cijk_Ailk_Bjlk_BSS_BH_MT128x64x16_MI32x32x2x2_SE_AF0EM4_GRVW2_NLCA1_NLCB1_SU0_SUS256_SRVW0_TT1_32_WG128_2_1_WGM1
    SolutionIndex: 197
    SolutionNameMin: Cijk_Ailk_Bjlk_BSS_BH_MT128x256x16_MI32x32x4x1_SE_AF0EM4_GRVW2_NLCA1_NLCB2_SU16_SUS128_SRVW4_TT2_128_WG64_4_1_WGM15
    SolutionIndex: 198
    SolutionNameMin: Cijk_Ailk_Bjlk_BSS_BH_MT64x64x32_MI32x32x4x1_SE_AF0EM4_GRVW4_NLCA1_NLCB1_SU0_SUS128_SRVW4_TT1_32_WG64_4_1_WGM1
    SolutionIndex: 199
    SolutionNameMin: Cijk_Ailk_Bjlk_BSS_BH_MT64x128x32_MI32x32x4x1_SE_AF0EM1_GRVW8_NLCA1_NLCB1_SU16_SUS128_SRVW4_TT1_64_WG64_4_1_WGM1
    SolutionIndex: 200
    SolutionNameMin: Cijk_Ailk_Bjlk_BSS_BH_MT128x256x16_MI32x32x4x1_SE_AF0EM4_GRVW8_NLCA1_NLCB1_SU16_SUS128_SRVW4_TT2_128_WG64_4_1_WGM15
    SolutionIndex: 201
    SolutionNameMin: Cijk_Ailk_Bjlk_BSS_BH_MT64x64x64_MI32x32x4x1_SE_AF0EM4_GRVW4_NLCA1_NLCB1_SU32_SUS128_SRVW4_TT1_32_WG64_4_1_WGM2
    SolutionIndex: 202
    SolutionNameMin: Cijk_Ailk_Bjlk_BSS_BH_MT64x64x32_MI32x32x4x1_SE_AF0EM1_GRVW8_NLCA1_NLCB1_SU0_SUS256_SRVW4_TT1_32_WG64_4_1_WGM1
    SolutionIndex: 203
    SolutionNameMin: Cijk_Ailk_Bjlk_BSS_BH_MT64x128x32_MI32x32x4x1_SE_AF0EM1_GRVW8_NLCA1_NLCB1_SU32_SUS256_SRVW4_TT1_64_WG64_4_1_WGM2
    SolutionIndex: 204
    SolutionNameMin: Cijk_Ailk_Bjlk_BSS_BH_MT128x160x32_MI32x32x4x1_SE_AF0EM4_GRVW2_NLCA1_NLCB5_SU16_SUS128_SRVW4_TT1_160_WG128_2_1_WGM1
    SolutionIndex: 205
    SolutionNameMin: Cijk_Ailk_Bjlk_BSS_BH_MT32x32x16_MI16x16x8x1_SE_AF0EM4_GRVW2_NLCA1_NLCB1_SU0_SUS128_SRVW0_TT1_16_WG32_8_1_WGM1
    SolutionIndex: 206
    SolutionNameMin: Cijk_Ailk_Bjlk_BSS_BH_MT64x32x16_MI16x16x8x1_SE_AF0EM4_GRVW2_NLCA1_NLCB1_SU32_SUS256_SRVW4_TT2_16_WG32_8_1_WGM15
    SolutionIndex: 207
    SolutionNameMin: Cijk_Ailk_Bjlk_BSS_BH_MT128x128x32_MI32x32x4x1_SE_AF0EM1_GRVW8_NLCA1_NLCB1_SU32_SUS128_SRVW4_TT2_64_WG64_4_1_WGM2
    SolutionIndex: 208
    SolutionNameMin: Cijk_Ailk_Bjlk_BSS_BH_MT64x64x32_MI32x32x4x1_SE_AF0EM4_GRVW8_NLCA1_NLCB1_SU32_SUS256_SRVW4_TT1_32_WG64_4_1_WGM15
    SolutionIndex: 209
    SolutionNameMin: Cijk_Ailk_Bjlk_BSS_BH_MT128x96x32_MI32x32x4x1_SE_AF0EM4_GRVW4_NLCA1_NLCB3_SU32_SUS128_SRVW4_TT1_96_WG128_2_1_WGM15
    SolutionIndex: 210
    SolutionNameMin: Cijk_Ailk_Bjlk_BSS_BH_MT128x128x32_MI32x32x4x1_SE_AF0EM1_GRVW8_NLCA1_NLCB1_SU32_SUS128_SRVW4_TT2_64_WG64_4_1_WGM1
    SolutionIndex: 211
    SolutionNameMin: Cijk_Ailk_Bjlk_BSS_BH_MT128x128x32_MI32x32x4x1_SE_AF0EM1_GRVW8_NLCA1_NLCB1_SU16_SUS128_SRVW4_TT2_64_WG64_4_1_WGM1
    SolutionIndex: 212
    SolutionNameMin: Cijk_Ailk_Bjlk_BSS_BH_MT128x96x32_MI32x32x4x1_SE_AF0EM1_GRVW4_NLCA1_NLCB3_SU0_SUS256_SRVW4_TT1_96_WG128_2_1_WGM1
    SolutionIndex: 213
    SolutionNameMin: Cijk_Ailk_Bjlk_BSS_BH_MT128x160x32_MI32x32x4x1_SE_AF0EM4_GRVW2_NLCA1_NLCB5_SU32_SUS256_SRVW4_TT1_160_WG128_2_1_WGM15
    SolutionIndex: 214
    SolutionNameMin: Cijk_Ailk_Bjlk_BSS_BH_MT128x80x64_MI16x16x8x1_SE_AF0EM4_GRVW2_NLCA1_NLCB5_SU0_SUS256_SRVW0_TT2_80_WG64_4_1_WGM2
    SolutionIndex: 215
    SolutionNameMin: Cijk_Ailk_Bjlk_BSS_BH_MT128x288x16_MI32x32x4x1_SE_AF0EM4_GRVW2_NLCA1_NLCB9_SU16_SUS128_SRVW4_TT1_288_WG128_2_1_WGM15
    SolutionIndex: 216
    SolutionNameMin: Cijk_Ailk_Bjlk_BSS_BH_MT128x96x64_MI32x32x4x1_SE_AF0EM4_GRVW8_NLCA1_NLCB3_SU32_SUS128_SRVW4_TT1_96_WG128_2_1_WGM1
    SolutionIndex: 217
    SolutionNameMin: Cijk_Ailk_Bjlk_BSS_BH_MT128x64x64_MI32x32x4x1_SE_AF0EM4_GRVW8_NLCA1_NLCB1_SU0_SUS128_SRVW4_TT2_32_WG64_4_1_WGM1
    SolutionIndex: 218
    SolutionNameMin: Cijk_Ailk_Bjlk_BSS_BH_MT128x160x16_MI32x32x4x1_SE_AF0EM1_GRVW2_NLCA1_NLCB5_SU32_SUS128_SRVW4_TT1_160_WG128_2_1_WGM2
    SolutionIndex: 219
    SolutionNameMin: Cijk_Ailk_Bjlk_BSS_BH_MT64x64x64_MI32x32x4x1_SE_AF0EM4_GRVW8_NLCA1_NLCB1_SU32_SUS256_SRVW4_TT1_32_WG64_4_1_WGM2
    SolutionIndex: 220
    SolutionNameMin: Cijk_Ailk_Bjlk_BSS_BH_MT128x160x16_MI32x32x4x1_SE_AF0EM1_GRVW2_NLCA1_NLCB5_SU32_SUS256_SRVW4_TT1_160_WG128_2_1_WGM15
    SolutionIndex: 221
    SolutionNameMin: Cijk_Ailk_Bjlk_BSS_BH_MT64x64x64_MI32x32x4x1_SE_AF0EM4_GRVW8_NLCA1_NLCB1_SU0_SUS256_SRVW4_TT1_32_WG64_4_1_WGM1
    SolutionIndex: 222
    SolutionNameMin: Cijk_Ailk_Bjlk_BSS_BH_MT64x128x32_MI32x32x4x1_SE_AF0EM1_GRVW8_NLCA1_NLCB1_SU32_SUS128_SRVW4_TT1_64_WG64_4_1_WGM15
    SolutionIndex: 223
    SolutionNameMin: Cijk_Ailk_Bjlk_BSS_BH_MT128x64x64_MI32x32x4x1_SE_AF0EM4_GRVW8_NLCA1_NLCB1_SU0_SUS128_SRVW4_TT2_32_WG64_4_1_WGM15
    SolutionIndex: 224
    SolutionNameMin: Cijk_Ailk_Bjlk_BSS_BH_MT64x128x32_MI32x32x4x1_SE_AF0EM1_GRVW8_NLCA1_NLCB1_SU32_SUS256_SRVW4_TT1_64_WG64_4_1_WGM1
    SolutionIndex: 225
    SolutionNameMin: Cijk_Ailk_Bjlk_BSS_BH_MT128x256x16_MI32x32x4x1_SE_AF0EM8_GRVW8_GSU1_SU32_SUS128_SRVW4_WG64_4_1_WGM15
    SolutionIndex: 226
    SolutionNameMin: Cijk_Ailk_Bjlk_BSS_BH_MT128x96x32_MI32x32x4x1_SE_AF0EM8_GRVW4_GSU1_SU32_SUS128_SRVW4_WG128_2_1_WGM15
    SolutionIndex: 227
    SolutionNameMin: Cijk_Ailk_Bjlk_BSS_BH_MT64x16x32_MI16x16x8x1_SE_AF0EM8_GRVW2_GSU1_SU0_SUS256_SRVW0_WG64_4_1_WGM1
    SolutionIndex: 228
    SolutionNameMin: Cijk_Ailk_Bjlk_BSS_BH_MT32x32x64_MI16x16x8x1_SE_AF0EM8_GRVW2_GSU5_SU0_SUS256_SRVW0_WG32_8_1_WGM1
    SolutionIndex: 229
    SolutionNameMin: Cijk_Ailk_Bjlk_BSS_BH_MT64x16x32_MI16x16x8x1_SE_AF0EM8_GRVW8_GSU15_SU0_SUS128_SRVW0_WG64_4_1_WGM1
    SolutionIndex: 230
    SolutionNameMin: Cijk_Ailk_Bjlk_BSS_BH_MT64x16x32_MI16x16x8x1_SE_AF0EM8_GRVW2_GSU1_SU0_SUS128_SRVW0_WG64_4_1_WGM1
    SolutionIndex: 231
    SolutionNameMin: Cijk_Ailk_Bjlk_BSS_BH_MT64x16x32_MI16x16x8x1_SE_AF0EM8_GRVW8_GSU7_SU0_SUS128_SRVW0_WG64_4_1_WGM1
    SolutionIndex: 232
    SolutionNameMin: Cijk_Ailk_Bjlk_BSS_BH_MT128x96x32_MI32x32x4x1_SE_AF0EM8_GRVW4_GSU1_SU0_SUS128_SRVW4_WG128_2_1_WGM1
    SolutionIndex: 233
    SolutionNameMin: Cijk_Ailk_Bjlk_BSS_BH_MT64x16x32_MI16x16x8x1_SE_AF0EM8_GRVW4_GSU15_SU0_SUS256_SRVW0_WG64_4_1_WGM1
    SolutionIndex: 234
    SolutionNameMin: Cijk_Ailk_Bjlk_BSS_BH_MT32x32x16_MI16x16x8x1_SE_AF0EM8_GRVW2_GSU1_SU0_SUS128_SRVW4_WG32_8_1_WGM1
    SolutionIndex: 235
    SolutionNameMin: Cijk_Ailk_Bjlk_BSS_BH_MT32x32x64_MI16x16x8x1_SE_AF0EM8_GRVW2_GSU7_SU0_SUS128_SRVW0_WG32_8_1_WGM2
    SolutionIndex: 236
    SolutionNameMin: Cijk_Ailk_Bjlk_BSS_BH_MT64x16x64_MI16x16x8x1_SE_AF0EM1_GRVW2_GSU7_SU0_SUS256_SRVW0_WG64_4_1_WGM1
    SolutionIndex: 237
    SolutionNameMin: Cijk_Ailk_Bjlk_BSS_BH_MT128x96x16_MI32x32x4x1_SE_AF0EM8_GRVW2_GSU1_SU32_SUS128_SRVW4_WG128_2_1_WGM2
    SolutionIndex: 238
    SolutionNameMin: Cijk_Ailk_Bjlk_BSS_BH_MT128x96x32_MI32x32x4x1_SE_AF0EM8_GRVW4_GSU1_SU32_SUS256_SRVW4_WG128_2_1_WGM2
    SolutionIndex: 239
    SolutionNameMin: Cijk_Ailk_Bjlk_BSS_BH_MT64x64x64_MI32x32x4x1_SE_AF0EM8_GRVW8_GSU15_SU32_SUS128_SRVW0_WG64_4_1_WGM1
    SolutionIndex: 240
    SolutionNameMin: Cijk_Ailk_Bjlk_BSS_BH_MT128x128x16_MI32x32x4x1_SE_AF0EM8_GRVW8_GSU15_SU0_SUS128_SRVW0_WG64_4_1_WGM1
    SolutionIndex: 241
    SolutionNameMin: Cijk_Ailk_Bjlk_BSS_BH_MT128x256x16_MI32x32x4x1_SE_AF0EM8_GRVW4_GSU7_SU0_SUS256_SRVW0_WG64_4_1_WGM2
    SolutionIndex: 242
    SolutionNameMin: Cijk_Ailk_Bjlk_BSS_BH_MT128x256x16_MI32x32x4x1_SE_AF0EM8_GRVW2_GSU7_SU0_SUS128_SRVW0_WG64_4_1_WGM2
    SolutionIndex: 243
    SolutionNameMin: Cijk_Ailk_Bjlk_BSS_BH_MT128x256x16_MI32x32x4x1_SE_AF0EM8_GRVW8_GSU1_SU0_SUS128_SRVW4_WG64_4_1_WGM1
    SolutionIndex: 244
    SolutionNameMin: Cijk_Ailk_Bjlk_BSS_BH_MT64x256x16_MI32x32x4x1_SE_AF0EM8_GRVW8_GSU1_SU0_SUS128_SRVW4_WG64_4_1_WGM15
    SolutionIndex: 245
    SolutionNameMin: Cijk_Ailk_Bjlk_BSS_BH_MT128x256x16_MI32x32x4x1_SE_AF0EM8_GRVW8_GSU1_SU0_SUS256_SRVW4_WG64_4_1_WGM1
    SolutionIndex: 246
    SolutionNameMin: Cijk_Ailk_Bjlk_BSS_BH_MT128x160x32_MI32x32x4x1_SE_AF0EM8_GRVW4_GSU2_SU0_SUS256_SRVW0_WG128_2_1_WGM1
    SolutionIndex: 247
    SolutionNameMin: Cijk_Ailk_Bjlk_BSS_BH_MT128x160x32_MI32x32x4x1_SE_AF0EM8_GRVW2_GSU2_SU0_SUS128_SRVW0_WG128_2_1_WGM15
    SolutionIndex: 248
    SolutionNameMin: Cijk_Ailk_Bjlk_BSS_BH_MT160x128x32_MI32x32x4x1_SE_AF0EM8_GRVW4_GSU2_SU0_SUS128_SRVW0_WG32_8_1_WGM1
    SolutionIndex: 249
    SolutionNameMin: Cijk_Ailk_Bjlk_BSS_BH_MT160x128x32_MI32x32x4x1_SE_AF0EM8_GRVW4_GSU2_SU0_SUS256_SRVW0_WG32_8_1_WGM1
    SolutionIndex: 250
    SolutionNameMin: Cijk_Ailk_Bjlk_BSS_BH_MT128x96x32_MI32x32x4x1_SE_AF0EM8_GRVW4_GSU1_SU32_SUS256_SRVW4_WG128_2_1_WGM15
    SolutionIndex: 251
    SolutionNameMin: Cijk_Ailk_Bjlk_BSS_BH_MT256x160x16_MI32x32x4x1_SE_AF0EM8_GRVW2_GSU1_SU32_SUS128_SRVW4_WG128_2_1_WGM2
    SolutionIndex: 252
    SolutionNameMin: Cijk_Ailk_Bjlk_BSS_BH_MT256x160x16_MI32x32x4x1_SE_AF0EM8_GRVW2_GSU1_SU32_SUS128_SRVW4_WG128_2_1_WGM15
    SolutionIndex: 253
    SolutionNameMin: Cijk_Ailk_Bjlk_BSS_BH_MT32x32x64_MI16x16x8x1_SE_AF0EM8_GRVW8_GSU5_SU32_SUS256_SRVW0_WG32_8_1_WGM2
    SolutionIndex: 254
    SolutionNameMin: Cijk_Ailk_Bjlk_BSS_BH_MT128x64x64_MI32x32x4x1_SE_AF0EM8_GRVW8_GSU3_SU0_SUS256_SRVW0_WG64_4_1_WGM2
    SolutionIndex: 255
    SolutionNameMin: Cijk_Ailk_Bjlk_BSS_BH_MT128x128x16_MI32x32x4x1_SE_AF0EM8_GRVW8_GSU3_SU0_SUS128_SRVW0_WG64_4_1_WGM2
    SolutionIndex: 256
    SolutionNameMin: Cijk_Ailk_Bjlk_BSS_BH_MT128x96x32_MI32x32x4x1_SE_AF0EM8_GRVW4_GSU2_SU0_SUS256_SRVW0_WG128_2_1_WGM15
    SolutionIndex: 257
    SolutionNameMin: Cijk_Ailk_Bjlk_BSS_BH_MT128x144x32_MI16x16x8x1_SE_AF0EM8_GRVW2_GSU2_SU0_SUS128_SRVW0_WG64_4_1_WGM1
    SolutionIndex: 258
    SolutionNameMin: Cijk_Ailk_Bjlk_BSS_BH_MT128x256x16_MI32x32x4x1_SE_AF0EM8_GRVW8_GSU3_SU0_SUS256_SRVW0_WG64_4_1_WGM1
    SolutionIndex: 259
    SolutionNameMin: Cijk_Ailk_Bjlk_BSS_BH_MT256x160x16_MI32x32x4x1_SE_AF0EM8_GRVW2_GSU3_SU0_SUS128_SRVW0_WG128_2_1_WGM1
    SolutionIndex: 260
    SolutionNameMin: Cijk_Ailk_Bjlk_BSS_BH_MT256x160x16_MI32x32x4x1_SE_AF0EM8_GRVW2_GSU3_SU32_SUS128_SRVW0_WG128_2_1_WGM1
    SolutionIndex: 261
    SolutionNameMin: Cijk_Ailk_Bjlk_BSS_BH_MT128x144x32_MI16x16x8x1_SE_AF0EM8_GRVW2_GSU1_SU0_SUS256_SRVW4_WG64_4_1_WGM1
    SolutionIndex: 262
    SolutionNameMin: Cijk_Ailk_Bjlk_BSS_BH_MT128x256x16_MI32x32x4x1_SE_AF0EM8_GRVW8_GSU3_SU0_SUS128_SRVW0_WG64_4_1_WGM2
    SolutionIndex: 263
    SolutionNameMin: Cijk_Ailk_Bjlk_BSS_BH_MT128x96x32_MI32x32x4x1_SE_AF0EM8_GRVW4_GSU1_SU32_SUS128_SRVW4_WG128_2_1_WGM2
    SolutionIndex: 264
    SolutionNameMin: Cijk_Ailk_Bjlk_BSS_BH_MT64x64x64_MI32x32x4x1_SE_AF0EM8_GRVW8_GSU1_SU0_SUS128_SRVW4_WG64_4_1_WGM1
    SolutionIndex: 265
    SolutionNameMin: Cijk_Ailk_Bjlk_BSS_BH_MT64x64x64_MI32x32x4x1_SE_AF0EM8_GRVW8_GSU1_SU32_SUS128_SRVW4_WG64_4_1_WGM1
    SolutionIndex: 266
    SolutionNameMin: Cijk_Ailk_Bjlk_BSS_BH_MT64x128x32_MI32x32x4x1_SE_AF0EM8_GRVW8_GSU2_SU0_SUS128_SRVW0_WG64_4_1_WGM2
    SolutionIndex: 267
    SolutionNameMin: Cijk_Ailk_Bjlk_BSS_BH_MT128x256x16_MI32x32x4x1_SE_AF0EM8_GRVW8_GSU1_SU32_SUS256_SRVW4_WG64_4_1_WGM1
    SolutionIndex: 268
    SolutionNameMin: Cijk_Ailk_Bjlk_BSS_BH_MT128x256x16_MI32x32x4x1_SE_AF0EM8_GRVW8_GSU1_SU0_SUS256_SRVW4_WG64_4_1_WGM15
    SolutionIndex: 269
    SolutionNameMin: Cijk_Ailk_Bjlk_BSS_BH_MT128x256x16_MI32x32x4x1_SE_AF0EM8_GRVW8_GSU1_SU0_SUS128_SRVW4_WG64_4_1_WGM2
    SolutionIndex: 270
    SolutionNameMin: Cijk_Ailk_Bjlk_BSS_BH_MT256x160x16_MI32x32x4x1_SE_AF0EM8_GRVW2_GSU1_SU32_SUS256_SRVW4_WG128_2_1_WGM2
    SolutionIndex: 271
    SolutionNameMin: Cijk_Ailk_Bjlk_BSS_BH_MT64x128x32_MI32x32x4x1_SE_AF0EM8_GRVW8_GSU1_SU0_SUS256_SRVW4_WG64_4_1_WGM15
    SolutionIndex: 272
    SolutionNameMin: Cijk_Ailk_Bjlk_BSS_BH_MT96x128x32_MI32x32x4x1_SE_AF0EM8_GRVW4_GSU3_SU32_SUS128_SRVW0_WG32_8_1_WGM1
    SolutionIndex: 273
    SolutionNameMin: Cijk_Ailk_Bjlk_BSS_BH_MT96x128x32_MI32x32x4x1_SE_AF0EM8_GRVW4_GSU5_SU32_SUS128_SRVW0_WG32_8_1_WGM2
    SolutionIndex: 274
    SolutionNameMin: Cijk_Ailk_Bjlk_BSS_BH_MT64x64x64_MI32x32x4x1_SE_AF0EM8_GRVW8_GSU3_SU32_SUS128_SRVW0_WG64_4_1_WGM2
    SolutionIndex: 275
    SolutionNameMin: Cijk_Ailk_Bjlk_BSS_BH_MT128x128x16_MI32x32x4x1_SE_AF0EM8_GRVW8_GSU7_SU32_SUS256_SRVW0_WG64_4_1_WGM1
    SolutionIndex: 276
    SolutionNameMin: Cijk_Ailk_Bjlk_BSS_BH_MT96x128x32_MI32x32x4x1_SE_AF0EM8_GRVW4_GSU5_SU32_SUS128_SRVW0_WG32_8_1_WGM15
    SolutionIndex: 277
    SolutionNameMin: Cijk_Ailk_Bjlk_BSS_BH_MT128x96x32_MI32x32x4x1_SE_AF0EM8_GRVW4_GSU5_SU32_SUS128_SRVW0_WG128_2_1_WGM1
    SolutionIndex: 278
    SolutionNameMin: Cijk_Ailk_Bjlk_BSS_BH_MT128x128x16_MI32x32x4x1_SE_AF0EM8_GRVW8_GSU7_SU0_SUS256_SRVW0_WG64_4_1_WGM1
    SolutionIndex: 279
    SolutionNameMin: Cijk_Ailk_Bjlk_BSS_BH_MT128x128x32_MI32x32x4x1_SE_AF0EM8_GRVW8_GSU7_SU0_SUS128_SRVW0_WG64_4_1_WGM1
    SolutionIndex: 280
    SolutionNameMin: Cijk_Ailk_Bjlk_BSS_BH_MT128x128x32_MI32x32x4x1_SE_AF0EM8_GRVW8_GSU7_SU32_SUS256_SRVW0_WG64_4_1_WGM1
    SolutionIndex: 281
    SolutionNameMin: Cijk_Ailk_Bjlk_BSS_BH_MT256x64x32_MI32x32x4x1_SE_AF0EM8_GRVW8_GSU7_SU0_SUS128_SRVW0_WG64_4_1_WGM1
    SolutionIndex: 282
    SolutionNameMin: Cijk_Ailk_Bjlk_BSS_BH_MT128x128x32_MI32x32x4x1_SE_AF0EM8_GRVW8_GSU7_SU0_SUS256_SRVW0_WG64_4_1_WGM1
    SolutionIndex: 283
    SolutionNameMin: Cijk_Ailk_Bjlk_BSS_BH_MT128x128x16_MI32x32x4x1_SE_AF0EM8_GRVW8_GSU7_SU0_SUS128_SRVW0_WG64_4_1_WGM1
    SolutionIndex: 284
    SolutionNameMin: Cijk_Ailk_Bjlk_BSS_BH_MT256x64x32_MI32x32x4x1_SE_AF0EM8_GRVW8_GSU7_SU0_SUS256_SRVW0_WG64_4_1_WGM2
    SolutionIndex: 285
    SolutionNameMin: Cijk_Ailk_Bjlk_BSS_BH_MT256x64x32_MI32x32x4x1_SE_AF0EM8_GRVW8_GSU7_SU32_SUS128_SRVW0_WG64_4_1_WGM1
    SolutionIndex: 286
    SolutionNameMin: Cijk_Ailk_Bjlk_BSS_BH_MT256x64x32_MI32x32x4x1_SE_AF0EM8_GRVW8_GSU7_SU0_SUS256_SRVW0_WG64_4_1_WGM1
    SolutionIndex: 287
    SolutionNameMin: Cijk_Ailk_Bjlk_BSS_BH_MT16x16x16_MI16x16x8x1_SE_AF0EM8_GRVW2_GSU1_SU0_SUS128_SRVW0_WG16_4_1_WGM1
    SolutionIndex: 288
    SolutionNameMin: Cijk_Ailk_Bjlk_BSS_BH_MT64x32x16_MI16x16x8x1_SE_AF0EM8_GRVW4_GSU1_SU0_SUS256_SRVW4_WG32_8_1_WGM2
    SolutionIndex: 289
    SolutionNameMin: Cijk_Ailk_Bjlk_BSS_BH_MT96x96x32_MI16x16x8x1_SE_AF0EM8_GRVW2_GSU1_SU0_SUS128_SRVW0_WG32_8_1_WGM1
    SolutionIndex: 290
    SolutionNameMin: Cijk_Ailk_Bjlk_BSS_BH_MT64x256x16_MI32x32x4x1_SE_AF0EM8_GRVW8_GSU1_SU0_SUS256_SRVW4_WG64_4_1_WGM15
    SolutionIndex: 291
    SolutionNameMin: Cijk_Ailk_Bjlk_BSS_BH_MT64x64x32_MI32x32x4x1_SE_AF0EM8_GRVW8_GSU1_SU0_SUS256_SRVW4_WG64_4_1_WGM1
    SolutionIndex: 292
    SolutionNameMin: Cijk_Ailk_Bjlk_BSS_BH_MT96x96x32_MI16x16x8x1_SE_AF0EM8_GRVW4_GSU1_SU0_SUS256_SRVW0_WG32_8_1_WGM2
    SolutionIndex: 293
    SolutionNameMin: Cijk_Ailk_Bjlk_BSS_BH_MT128x256x16_MI32x32x4x1_SE_AF0EM8_GRVW8_GSU1_SU32_SUS128_SRVW4_WG64_4_1_WGM2
    SolutionIndex: 294
    SolutionNameMin: Cijk_Ailk_Bjlk_BSS_BH_MT96x128x32_MI32x32x4x1_SE_AF0EM8_GRVW4_GSU1_SU0_SUS256_SRVW0_WG32_8_1_WGM1
    SolutionIndex: 295
    SolutionNameMin: Cijk_Ailk_Bjlk_BSS_BH_MT128x256x32_MI32x32x4x1_SE_AF0EM8_GRVW8_GSU7_SU0_SUS256_SRVW0_WG64_4_1_WGM1
    SolutionIndex: 296
    SolutionNameMin: Cijk_Ailk_Bjlk_BSS_BH_MT96x96x64_MI16x16x8x1_SE_AF0EM8_GRVW2_GSU1_SU32_SUS128_SRVW0_WG32_8_1_WGM1
    SolutionIndex: 297
    SolutionNameMin: Cijk_Ailk_Bjlk_BSS_BH_MT128x160x32_MI32x32x4x1_SE_AF0EM8_GRVW2_GSU1_SU0_SUS256_SRVW4_WG128_2_1_WGM2
    SolutionIndex: 298
    SolutionNameMin: Cijk_Ailk_Bjlk_BSS_BH_MT128x96x64_MI32x32x4x1_SE_AF0EM8_GRVW8_GSU1_SU0_SUS256_SRVW4_WG128_2_1_WGM15
    SolutionIndex: 299
    SolutionNameMin: Cijk_Ailk_Bjlk_BSS_BH_MT64x64x32_MI32x32x4x1_SE_AF0EM8_GRVW8_GSU1_SU0_SUS128_SRVW4_WG64_4_1_WGM1
    SolutionIndex: 300
    SolutionNameMin: Cijk_Ailk_Bjlk_BSS_BH_MT128x160x32_MI32x32x4x1_SE_AF0EM8_GRVW2_GSU1_SU0_SUS128_SRVW4_WG128_2_1_WGM2
    SolutionIndex: 301
    SolutionNameMin: Cijk_Ailk_Bjlk_BSS_BH_MT32x64x16_MI16x16x8x1_SE_AF0EM8_GRVW8_GSU1_SU0_SUS256_SRVW4_WG32_8_1_WGM15
    SolutionIndex: 302
    SolutionNameMin: Cijk_Ailk_Bjlk_BSS_BH_MT64x128x16_MI32x32x4x1_SE_AF0EM8_GRVW4_GSU1_SU0_SUS128_SRVW4_WG64_4_1_WGM15
    SolutionIndex: 303
    SolutionNameMin: Cijk_Ailk_Bjlk_BSS_BH_MT64x64x32_MI32x32x4x1_SE_AF0EM8_GRVW2_GSU1_SU0_SUS128_SRVW4_WG64_4_1_WGM15
    SolutionIndex: 304
    SolutionNameMin: Cijk_Ailk_Bjlk_BSS_BH_MT128x160x32_MI32x32x4x1_SE_AF0EM8_GRVW4_GSU2_SU0_SUS128_SRVW0_WG128_2_1_WGM1
    SolutionIndex: 305
    SolutionNameMin: Cijk_Ailk_Bjlk_BSS_BH_MT64x64x32_MI32x32x4x1_SE_AF0EM8_GRVW8_GSU1_SU32_SUS256_SRVW4_WG64_4_1_WGM15
    SolutionIndex: 306
    SolutionNameMin: Cijk_Ailk_Bjlk_BSS_BH_MT64x128x32_MI32x32x4x1_SE_AF0EM8_GRVW8_GSU3_SU32_SUS256_SRVW0_WG64_4_1_WGM2
    SolutionIndex: 307
    SolutionNameMin: Cijk_Ailk_Bjlk_BSS_BH_MT128x128x32_MI32x32x4x1_SE_AF0EM8_GRVW8_GSU3_SU0_SUS256_SRVW0_WG64_4_1_WGM1
    SolutionIndex: 308
    SolutionNameMin: Cijk_Ailk_Bjlk_BSS_BH_MT96x128x32_MI32x32x4x1_SE_AF0EM8_GRVW4_GSU5_SU0_SUS128_SRVW0_WG32_8_1_WGM15
    SolutionIndex: 309
    SolutionNameMin: Cijk_Ailk_Bjlk_BSS_BH_MT64x64x32_MI32x32x4x1_SE_AF0EM8_GRVW8_GSU1_SU0_SUS256_SRVW4_WG64_4_1_WGM2
    SolutionIndex: 310
    SolutionNameMin: Cijk_Ailk_Bjlk_BSS_BH_MT32x32x64_MI16x16x8x1_SE_AF0EM8_GRVW4_GSU7_SU0_SUS128_SRVW0_WG32_8_1_WGM1
    SolutionIndex: 311
    SolutionNameMin: Cijk_Ailk_Bjlk_BSS_BH_MT64x32x32_MI16x16x8x1_SE_AF0EM8_GRVW8_GSU15_SU0_SUS256_SRVW0_WG32_8_1_WGM15
    SolutionIndex: 312
    SolutionNameMin: Cijk_Ailk_Bjlk_BSS_BH_MT64x64x64_MI32x32x4x1_SE_AF0EM8_GRVW8_GSU15_SU0_SUS256_SRVW0_WG64_4_1_WGM1
    SolutionIndex: 313
    SolutionNameMin: Cijk_Ailk_Bjlk_BSS_BH_MT64x32x64_MI16x16x8x1_SE_AF0EM8_GRVW8_GSU15_SU0_SUS256_SRVW0_WG32_8_1_WGM1
    SolutionIndex: 314
    SolutionNameMin: Cijk_Ailk_Bjlk_BSS_BH_MT32x32x64_MI16x16x8x1_SE_AF0EM8_GRVW8_GSU1_SU32_SUS256_SRVW4_WG32_8_1_WGM1
    SolutionIndex: 315
    SolutionNameMin: Cijk_Ailk_Bjlk_BSS_BH_MT32x32x16_MI16x16x8x1_SE_AF0EM8_GRVW4_GSU1_SU0_SUS256_SRVW4_WG32_8_1_WGM1
    SolutionIndex: 316
    SolutionNameMin: Cijk_Ailk_Bjlk_BSS_BH_MT32x64x16_MI16x16x8x1_SE_AF0EM8_GRVW2_GSU1_SU0_SUS256_SRVW4_WG32_8_1_WGM1
    SolutionIndex: 317
    SolutionNameMin: Cijk_Ailk_Bjlk_BSS_BH_MT64x32x16_MI16x16x8x1_SE_AF0EM8_GRVW8_GSU1_SU0_SUS256_SRVW4_WG32_8_1_WGM1
    SolutionIndex: 318
    SolutionNameMin: Cijk_Ailk_Bjlk_BSS_BH_MT96x128x32_MI32x32x4x1_SE_AF0EM8_GRVW4_GSU3_SU0_SUS256_SRVW0_WG32_8_1_WGM1
    SolutionIndex: 319
    SolutionNameMin: Cijk_Ailk_Bjlk_BSS_BH_MT96x128x32_MI32x32x4x1_SE_AF0EM8_GRVW4_GSU3_SU0_SUS128_SRVW0_WG32_8_1_WGM1
    SolutionIndex: 320
    SolutionNameMin: Cijk_Ailk_Bjlk_BSS_BH_MT32x64x32_MI16x16x8x1_SE_AF0EM8_GRVW8_GSU1_SU0_SUS256_SRVW4_WG32_8_1_WGM15
    SolutionIndex: 321
    SolutionNameMin: Cijk_Ailk_Bjlk_BSS_BH_MT64x64x32_MI32x32x4x1_SE_AF0EM8_GRVW8_GSU7_SU0_SUS128_SRVW0_WG64_4_1_WGM2
    SolutionIndex: 322
    SolutionNameMin: Cijk_Ailk_Bjlk_BSS_BH_MT64x64x32_MI32x32x4x1_SE_AF0EM8_GRVW8_GSU7_SU0_SUS128_SRVW0_WG64_4_1_WGM1
    SolutionIndex: 323
    SolutionNameMin: Cijk_Ailk_Bjlk_BSS_BH_MT128x128x32_MI32x32x4x1_SE_AF0EM8_GRVW8_GSU15_SU0_SUS256_SRVW0_WG64_4_1_WGM1
    SolutionIndex: 324
    SolutionNameMin: Cijk_Ailk_Bjlk_BSS_BH_MT64x128x32_MI32x32x4x1_SE_AF0EM8_GRVW8_GSU7_SU32_SUS128_SRVW0_WG64_4_1_WGM1
    SolutionIndex: 325
    SolutionNameMin: Cijk_Ailk_Bjlk_BSS_BH_MT32x32x64_MI16x16x8x1_SE_AF0EM8_GRVW4_GSU1_SU32_SUS256_SRVW4_WG32_8_1_WGM1
    SolutionIndex: 326
    SolutionNameMin: Cijk_Ailk_Bjlk_BSS_BH_MT64x256x16_MI32x32x4x1_SE_AF0EM8_GRVW8_GSU1_SU32_SUS128_SRVW4_WG64_4_1_WGM15
    SolutionIndex: 327
    SolutionNameMin: Cijk_Ailk_Bjlk_BSS_BH_MT16x16x16_MI16x16x8x1_SE_AF0EM8_GRVW2_GSU1_SU0_SUS256_SRVW0_WG16_4_1_WGM2
    SolutionIndex: 328
    SolutionNameMin: Cijk_Ailk_Bjlk_BSS_BH_MT160x128x32_MI32x32x4x1_SE_AF0EM8_GRVW2_GSU2_SU32_SUS256_SRVW0_WG32_8_1_WGM1
    SolutionIndex: 329
    SolutionNameMin: Cijk_Ailk_Bjlk_BSS_BH_MT64x128x16_MI32x32x4x1_SE_AF0EM8_GRVW2_GSU1_SU0_SUS128_SRVW4_WG64_4_1_WGM1
    SolutionIndex: 330
    SolutionNameMin: Cijk_Ailk_Bjlk_BSS_BH_MT64x64x32_MI32x32x4x1_SE_AF0EM8_GRVW2_GSU1_SU0_SUS128_SRVW4_WG64_4_1_WGM2
    SolutionIndex: 331
    SolutionNameMin: Cijk_Ailk_Bjlk_BSS_BH_MT128x96x64_MI32x32x4x1_SE_AF0EM8_GRVW8_GSU1_SU32_SUS128_SRVW4_WG128_2_1_WGM15
    SolutionIndex: 332
    SolutionNameMin: Cijk_Ailk_Bjlk_BSS_BH_MT128x160x32_MI32x32x4x1_SE_AF0EM8_GRVW2_GSU2_SU0_SUS128_SRVW0_WG128_2_1_WGM2
    SolutionIndex: 333
    SolutionNameMin: Cijk_Ailk_Bjlk_BSS_BH_MT64x32x16_MI16x16x8x1_SE_AF0EM8_GRVW4_GSU1_SU0_SUS256_SRVW4_WG32_8_1_WGM1
    SolutionIndex: 334
    SolutionNameMin: Cijk_Ailk_Bjlk_BSS_BH_MT64x128x16_MI32x32x4x1_SE_AF0EM8_GRVW4_GSU1_SU0_SUS128_SRVW4_WG64_4_1_WGM2
    SolutionIndex: 335
    SolutionNameMin: Cijk_Ailk_Bjlk_BSS_BH_MT128x96x16_MI32x32x4x1_SE_AF0EM8_GRVW2_GSU1_SU0_SUS256_SRVW4_WG128_2_1_WGM15
    SolutionIndex: 336
    SolutionNameMin: Cijk_Ailk_Bjlk_BSS_BH_MT128x96x16_MI32x32x4x1_SE_AF0EM8_GRVW2_GSU1_SU0_SUS128_SRVW4_WG128_2_1_WGM2
    SolutionIndex: 337
    SolutionNameMin: Cijk_Ailk_Bjlk_BSS_BH_MT64x32x16_MI16x16x8x1_SE_AF0EM8_GRVW2_GSU1_SU0_SUS128_SRVW4_WG32_8_1_WGM1
    SolutionIndex: 338
    SolutionNameMin: Cijk_Ailk_Bjlk_BSS_BH_MT16x64x32_MI16x16x8x1_SE_AF0EM8_GRVW2_GSU1_SU0_SUS256_SRVW0_WG16_16_1_WGM15
    SolutionIndex: 339
    SolutionNameMin: Cijk_Ailk_Bjlk_BSS_BH_MT128x160x32_MI32x32x4x1_SE_AF0EM8_GRVW4_GSU2_SU0_SUS256_SRVW0_WG128_2_1_WGM2
    SolutionIndex: 340
    SolutionNameMin: Cijk_Ailk_Bjlk_BSS_BH_MT64x128x32_MI32x32x4x1_SE_AF0EM8_GRVW8_GSU1_SU0_SUS128_SRVW4_WG64_4_1_WGM2
    SolutionIndex: 341
    SolutionNameMin: Cijk_Ailk_Bjlk_BSS_BH_MT64x64x32_MI32x32x4x1_SE_AF0EM8_GRVW4_GSU1_SU0_SUS256_SRVW4_WG64_4_1_WGM2
    SolutionIndex: 342
    SolutionNameMin: Cijk_Ailk_Bjlk_BSS_BH_MT64x64x32_MI32x32x4x1_SE_AF0EM8_GRVW2_GSU1_SU0_SUS256_SRVW4_WG64_4_1_WGM15
    SolutionIndex: 343
    SolutionNameMin: Cijk_Ailk_Bjlk_BSS_BH_MT64x128x32_MI32x32x4x1_SE_AF0EM8_GRVW8_GSU1_SU0_SUS128_SRVW4_WG64_4_1_WGM15
    SolutionIndex: 344
    SolutionNameMin: Cijk_Ailk_Bjlk_BSS_BH_MT64x256x16_MI32x32x4x1_SE_AF0EM8_GRVW8_GSU1_SU0_SUS256_SRVW4_WG64_4_1_WGM1
    SolutionIndex: 345
    SolutionNameMin: Cijk_Ailk_Bjlk_BSS_BH_MT64x256x16_MI32x32x4x1_SE_AF0EM8_GRVW8_GSU1_SU0_SUS128_SRVW4_WG64_4_1_WGM2
    SolutionIndex: 346
    SolutionNameMin: Cijk_Ailk_Bjlk_BSS_BH_MT64x256x16_MI32x32x4x1_SE_AF0EM8_GRVW8_GSU1_SU0_SUS128_SRVW4_WG64_4_1_WGM1
    SolutionIndex: 347
    SolutionNameMin: Cijk_Ailk_Bjlk_BSS_BH_MT64x64x32_MI32x32x4x1_SE_AF0EM8_GRVW4_GSU1_SU0_SUS128_SRVW4_WG64_4_1_WGM2
    SolutionIndex: 348
    SolutionNameMin: Cijk_Ailk_Bjlk_BSS_BH_MT64x128x32_MI32x32x4x1_SE_AF0EM8_GRVW8_GSU1_SU0_SUS128_SRVW4_WG64_4_1_WGM1
    SolutionIndex: 349
    SolutionNameMin: Cijk_Ailk_Bjlk_BSS_BH_MT64x256x16_MI32x32x4x1_SE_AF0EM8_GRVW8_GSU1_SU32_SUS256_SRVW4_WG64_4_1_WGM1
    SolutionIndex: 350
    SolutionNameMin: Cijk_Ailk_Bjlk_BSS_BH_MT64x128x32_MI32x32x4x1_SE_AF0EM8_GRVW8_GSU1_SU32_SUS128_SRVW4_WG64_4_1_WGM1
    SolutionIndex: 351
    SolutionNameMin: Cijk_Ailk_Bjlk_BSS_BH_MT64x128x16_MI32x32x4x1_SE_AF0EM8_GRVW8_GSU1_SU0_SUS256_SRVW4_WG64_4_1_WGM15
    SolutionIndex: 352
    SolutionNameMin: Cijk_Ailk_Bjlk_BSS_BH_MT64x128x16_MI32x32x4x1_SE_AF0EM8_GRVW8_GSU1_SU0_SUS256_SRVW4_WG64_4_1_WGM1
    SolutionIndex: 353
    SolutionNameMin: Cijk_Ailk_Bjlk_BSS_BH_MT64x256x16_MI32x32x4x1_SE_AF0EM8_GRVW8_GSU1_SU0_SUS256_SRVW4_WG64_4_1_WGM2
    SolutionIndex: 354
    SolutionNameMin: Cijk_Ailk_Bjlk_BSS_BH_MT64x128x16_MI32x32x4x1_SE_AF0EM8_GRVW8_GSU1_SU0_SUS256_SRVW4_WG64_4_1_WGM2
    SolutionIndex: 355
    SolutionNameMin: Cijk_Ailk_Bjlk_BSS_BH_MT64x128x16_MI32x32x4x1_SE_AF0EM8_GRVW4_GSU1_SU0_SUS256_SRVW4_WG64_4_1_WGM1
    SolutionIndex: 356
    SolutionNameMin: Cijk_Ailk_Bjlk_BSS_BH_MT64x128x16_MI32x32x4x1_SE_AF0EM8_GRVW8_GSU1_SU0_SUS128_SRVW4_WG64_4_1_WGM15
    SolutionIndex: 357
    SolutionNameMin: Cijk_Ailk_Bjlk_BSS_BH_MT64x128x32_MI32x32x4x1_SE_AF0EM8_GRVW8_GSU1_SU32_SUS128_SRVW4_WG64_4_1_WGM2
    SolutionIndex: 358
    SolutionNameMin: Cijk_Ailk_Bjlk_BSS_BH_MT64x128x16_MI32x32x4x1_SE_AF0EM8_GRVW8_GSU1_SU32_SUS256_SRVW4_WG64_4_1_WGM1
    SolutionIndex: 359
    SolutionNameMin: Cijk_Ailk_Bjlk_BSS_BH_MT64x128x16_MI32x32x4x1_SE_AF0EM8_GRVW8_GSU1_SU0_SUS128_SRVW4_WG64_4_1_WGM2
    SolutionIndex: 360
    SolutionNameMin: Cijk_Ailk_Bjlk_BSS_BH_MT64x128x16_MI32x32x4x1_SE_AF0EM8_GRVW4_GSU1_SU0_SUS128_SRVW4_WG64_4_1_WGM1
    SolutionIndex: 361
    SolutionNameMin: Cijk_Ailk_Bjlk_BSS_BH_MT64x128x32_MI32x32x4x1_SE_AF0EM8_GRVW8_GSU1_SU0_SUS256_SRVW4_WG64_4_1_WGM1
    SolutionIndex: 362
    SolutionNameMin: Cijk_Ailk_Bjlk_BSS_BH_MT96x96x32_MI16x16x8x1_SE_AF0EM8_GRVW2_GSU1_SU0_SUS256_SRVW0_WG32_8_1_WGM2
    SolutionIndex: 363
    SolutionNameMin: Cijk_Ailk_Bjlk_BSS_BH_MT96x96x32_MI16x16x8x1_SE_AF0EM8_GRVW2_GSU1_SU0_SUS128_SRVW0_WG32_8_1_WGM2
    SolutionIndex: 364
    SolutionNameMin: Cijk_Ailk_Bjlk_BSS_BH_MT128x160x32_MI32x32x4x1_SE_AF0EM8_GRVW4_GSU2_SU0_SUS256_SRVW0_WG128_2_1_WGM15
    SolutionIndex: 365
    SolutionNameMin: Cijk_Ailk_Bjlk_BSS_BH_MT96x96x32_MI16x16x8x1_SE_AF0EM8_GRVW2_GSU1_SU0_SUS256_SRVW0_WG32_8_1_WGM1
    SolutionIndex: 366
    SolutionNameMin: Cijk_Ailk_Bjlk_BSS_BH_MT128x144x32_MI16x16x8x1_SE_AF0EM8_GRVW2_GSU1_SU0_SUS128_SRVW4_WG64_4_1_WGM2
    SolutionIndex: 367
    SolutionNameMin: Cijk_Ailk_Bjlk_BSS_BH_MT128x144x32_MI16x16x8x1_SE_AF0EM8_GRVW2_GSU1_SU0_SUS256_SRVW4_WG64_4_1_WGM2
    SolutionIndex: 368
    SolutionNameMin: Cijk_Ailk_Bjlk_BSS_BH_MT64x32x16_MI16x16x8x1_SE_AF0EM8_GRVW2_GSU1_SU0_SUS128_SRVW4_WG32_8_1_WGM15
    SolutionIndex: 369
    SolutionNameMin: Cijk_Ailk_Bjlk_BSS_BH_MT64x32x16_MI16x16x8x1_SE_AF0EM8_GRVW8_GSU1_SU0_SUS128_SRVW4_WG32_8_1_WGM1
    SolutionIndex: 370
    SolutionNameMin: Cijk_Ailk_Bjlk_BSS_BH_MT32x64x32_MI16x16x8x1_SE_AF0EM8_GRVW8_GSU1_SU0_SUS256_SRVW4_WG32_8_1_WGM2
    SolutionIndex: 371
    SolutionNameMin: Cijk_Ailk_Bjlk_BSS_BH_MT64x128x32_MI32x32x4x1_SE_AF0EM8_GRVW8_GSU1_SU32_SUS256_SRVW4_WG64_4_1_WGM15
    SolutionIndex: 372
    SolutionNameMin: Cijk_Ailk_Bjlk_BSS_BH_MT64x128x16_MI32x32x4x1_SE_AF0EM8_GRVW8_GSU1_SU0_SUS128_SRVW4_WG64_4_1_WGM1
    SolutionIndex: 373
    SolutionNameMin: Cijk_Ailk_Bjlk_BSS_BH_MT64x32x32_MI16x16x8x1_SE_AF0EM8_GRVW8_GSU1_SU0_SUS128_SRVW4_WG32_8_1_WGM15
    SolutionIndex: 374
    SolutionNameMin: Cijk_Ailk_Bjlk_BSS_BH_MT64x64x64_MI32x32x4x1_SE_AF0EM8_GRVW8_GSU1_SU0_SUS128_SRVW4_WG64_4_1_WGM15
    SolutionIndex: 375
    SolutionNameMin: Cijk_Ailk_Bjlk_BSS_BH_MT64x256x16_MI32x32x4x1_SE_AF0EM8_GRVW8_GSU1_SU32_SUS128_SRVW4_WG64_4_1_WGM1
    SolutionIndex: 376
    SolutionNameMin: Cijk_Ailk_Bjlk_BSS_BH_MT64x256x16_MI32x32x4x1_SE_AF0EM8_GRVW8_GSU1_SU32_SUS256_SRVW4_WG64_4_1_WGM15
    SolutionIndex: 377
    SolutionNameMin: Cijk_Ailk_Bjlk_BSS_BH_MT64x64x32_MI32x32x4x1_SE_AF0EM8_GRVW2_GSU1_SU0_SUS256_SRVW4_WG64_4_1_WGM2
    SolutionIndex: 378
    SolutionNameMin: Cijk_Ailk_Bjlk_BSS_BH_MT64x256x16_MI32x32x4x1_SE_AF0EM8_GRVW8_GSU1_SU32_SUS256_SRVW4_WG64_4_1_WGM2
    SolutionIndex: 379
    SolutionNameMin: Cijk_Ailk_Bjlk_BSS_BH_MT64x128x16_MI32x32x4x1_SE_AF0EM8_GRVW2_GSU1_SU0_SUS128_SRVW4_WG64_4_1_WGM2
    SolutionIndex: 380
    SolutionNameMin: Cijk_Ailk_Bjlk_BSS_BH_MT64x16x32_MI16x16x8x1_SE_AF0EM8_GRVW8_GSU1_SU0_SUS256_SRVW0_WG64_4_1_WGM2
    SolutionIndex: 381
    SolutionNameMin: Cijk_Ailk_Bjlk_BSS_BH_MT128x160x16_MI32x32x4x1_SE_AF0EM8_GRVW2_GSU1_SU0_SUS128_SRVW4_WG128_2_1_WGM1
    SolutionIndex: 382
    SolutionNameMin: Cijk_Ailk_Bjlk_BSS_BH_MT64x128x32_MI32x32x4x1_SE_AF0EM8_GRVW8_GSU1_SU0_SUS256_SRVW4_WG64_4_1_WGM2
    SolutionIndex: 383
    SolutionNameMin: Cijk_Ailk_Bjlk_BSS_BH_MT128x96x16_MI32x32x4x1_SE_AF0EM8_GRVW2_GSU1_SU32_SUS256_SRVW4_WG128_2_1_WGM1
    SolutionIndex: 384
    SolutionNameMin: Cijk_Ailk_Bjlk_BSS_BH_MT128x96x32_MI32x32x4x1_SE_AF0EM8_GRVW2_GSU1_SU0_SUS256_SRVW4_WG128_2_1_WGM1
    SolutionIndex: 385
    SolutionNameMin: Cijk_Ailk_Bjlk_BSS_BH_MT64x32x16_MI16x16x8x1_SE_AF0EM8_GRVW4_GSU1_SU0_SUS128_SRVW4_WG32_8_1_WGM2
    SolutionIndex: 386
    SolutionNameMin: Cijk_Ailk_Bjlk_BSS_BH_MT32x32x64_MI16x16x8x1_SE_AF0EM8_GRVW2_GSU7_SU0_SUS256_SRVW0_WG32_8_1_WGM1
    SolutionIndex: 387
    SolutionNameMin: Cijk_Ailk_Bjlk_BSS_BH_MT160x128x32_MI32x32x4x1_SE_AF0EM8_GRVW4_GSU1_SU0_SUS256_SRVW0_WG32_8_1_WGM15
    SolutionIndex: 388
    SolutionNameMin: Cijk_Ailk_Bjlk_BSS_BH_MT160x128x32_MI32x32x4x1_SE_AF0EM8_GRVW2_GSU1_SU0_SUS256_SRVW0_WG32_8_1_WGM2
    SolutionIndex: 389
    SolutionNameMin: Cijk_Ailk_Bjlk_BSS_BH_MT64x64x32_MI32x32x4x1_SE_AF0EM8_GRVW4_GSU1_SU0_SUS256_SRVW4_WG64_4_1_WGM15
    SolutionIndex: 390
    SolutionNameMin: Cijk_Ailk_Bjlk_BSS_BH_MT64x16x32_MI16x16x8x1_SE_AF0EM8_GRVW8_GSU15_SU0_SUS256_SRVW0_WG64_4_1_WGM1
    SolutionIndex: 391
    SolutionNameMin: Cijk_Ailk_Bjlk_BSS_BH_MT160x128x32_MI32x32x4x1_SE_AF0EM8_GRVW2_GSU1_SU0_SUS128_SRVW0_WG32_8_1_WGM1
    SolutionIndex: 392
    SolutionNameMin: Cijk_Ailk_Bjlk_BSS_BH_MT64x128x32_MI32x32x4x1_SE_AF0EM8_GRVW8_GSU3_SU0_SUS256_SRVW0_WG64_4_1_WGM15
    SolutionIndex: 393
    SolutionNameMin: Cijk_Ailk_Bjlk_BSS_BH_MT64x32x16_MI16x16x8x1_SE_AF0EM8_GRVW8_GSU1_SU0_SUS128_SRVW4_WG32_8_1_WGM15
    SolutionIndex: 394
    SolutionNameMin: Cijk_Ailk_Bjlk_BSS_BH_MT16x64x64_MI16x16x8x1_SE_AF0EM1_GRVW2_GSU15_SU0_SUS256_SRVW0_WG16_16_1_WGM1
    SolutionIndex: 395
    SolutionNameMin: Cijk_Ailk_Bjlk_BSS_BH_MT96x128x64_MI32x32x4x1_SE_AF0EM1_GRVW8_GSU3_SU32_SUS256_SRVW0_WG32_8_1_WGM1
    SolutionIndex: 396
    SolutionNameMin: Cijk_Ailk_Bjlk_BSS_BH_MT32x64x16_MI16x16x8x1_SE_AF0EM1_GRVW4_GSU1_SU32_SUS128_SRVW4_WG32_8_1_WGM15
    SolutionIndex: 397
    SolutionNameMin: Cijk_Ailk_Bjlk_BSS_BH_MT32x64x16_MI16x16x8x1_SE_AF0EM1_GRVW2_GSU1_SU32_SUS128_SRVW4_WG32_8_1_WGM1
    SolutionIndex: 398
    SolutionNameMin: Cijk_Ailk_Bjlk_BSS_BH_MT32x64x16_MI16x16x8x1_SE_AF0EM1_GRVW8_GSU1_SU0_SUS256_SRVW4_WG32_8_1_WGM1
    SolutionIndex: 399
    SolutionNameMin: Cijk_Ailk_Bjlk_BSS_BH_MT32x64x16_MI16x16x8x1_SE_AF0EM1_GRVW4_GSU1_SU32_SUS128_SRVW4_WG32_8_1_WGM1
    SolutionIndex: 400
    SolutionNameMin: Cijk_Ailk_Bjlk_BSS_BH_MT64x16x32_MI16x16x8x1_SE_AF0EM1_GRVW8_GSU1_SU0_SUS128_SRVW0_WG64_4_1_WGM1
    SolutionIndex: 401
    SolutionNameMin: Cijk_Ailk_Bjlk_BSS_BH_MT32x32x32_MI16x16x8x1_SE_AF0EM1_GRVW4_GSU1_SU32_SUS128_SRVW4_WG32_8_1_WGM1
    SolutionIndex: 402
    SolutionNameMin: Cijk_Ailk_Bjlk_BSS_BH_MT16x16x16_MI16x16x8x1_SE_AF0EM1_GRVW4_GSU1_SU0_SUS128_SRVW4_WG16_4_1_WGM1
    SolutionIndex: 403
    SolutionNameMin: Cijk_Ailk_Bjlk_BSS_BH_MT16x16x64_MI16x16x8x1_SE_AF0EM1_GRVW8_GSU7_SU0_SUS256_SRVW0_WG16_4_1_WGM1
    SolutionIndex: 404
    SolutionNameMin: Cijk_Ailk_Bjlk_BSS_BH_MT32x32x32_MI16x16x8x1_SE_AF0EM1_GRVW2_GSU15_SU0_SUS256_SRVW0_WG32_8_1_WGM15
    SolutionIndex: 405
    SolutionNameMin: Cijk_Ailk_Bjlk_BSS_BH_MT16x64x64_MI16x16x8x1_SE_AF0EM1_GRVW8_GSU15_SU0_SUS256_SRVW4_WG16_16_1_WGM1
    SolutionIndex: 406
    SolutionNameMin: Cijk_Ailk_Bjlk_BSS_BH_MT32x32x64_MI16x16x8x1_SE_AF0EM1_GRVW8_GSU15_SU0_SUS128_SRVW0_WG32_8_1_WGM1
    SolutionIndex: 407
    SolutionNameMin: Cijk_Ailk_Bjlk_BSS_BH_MT16x16x32_MI16x16x8x1_SE_AF0EM1_GRVW8_GSU3_SU0_SUS128_SRVW0_WG16_4_1_WGM15
    SolutionIndex: 408
    SolutionNameMin: Cijk_Ailk_Bjlk_BSS_BH_MT64x128x32_MI32x32x4x1_SE_AF0EM1_GRVW8_GSU1_SU0_SUS256_SRVW4_WG64_4_1_WGM1
    SolutionIndex: 409
    SolutionNameMin: Cijk_Ailk_Bjlk_BSS_BH_MT64x256x16_MI32x32x4x1_SE_AF0EM1_GRVW8_GSU1_SU0_SUS256_SRVW4_WG64_4_1_WGM15
    SolutionIndex: 410
    SolutionNameMin: Cijk_Ailk_Bjlk_BSS_BH_MT64x256x16_MI32x32x4x1_SE_AF0EM1_GRVW8_GSU1_SU0_SUS128_SRVW4_WG64_4_1_WGM1
    SolutionIndex: 411
    SolutionNameMin: Cijk_Ailk_Bjlk_BSS_BH_MT64x128x32_MI32x32x4x1_SE_AF0EM1_GRVW8_GSU1_SU32_SUS128_SRVW4_WG64_4_1_WGM2
    SolutionIndex: 412
    SolutionNameMin: Cijk_Ailk_Bjlk_BSS_BH_MT64x128x32_MI32x32x4x1_SE_AF0EM1_GRVW8_GSU1_SU0_SUS128_SRVW4_WG64_4_1_WGM15
    SolutionIndex: 413
    SolutionNameMin: Cijk_Ailk_Bjlk_BSS_BH_MT64x128x32_MI32x32x4x1_SE_AF0EM1_GRVW8_GSU1_SU0_SUS256_SRVW4_WG64_4_1_WGM15
    SolutionIndex: 414
    SolutionNameMin: Cijk_Ailk_Bjlk_BSS_BH_MT64x128x16_MI32x32x4x1_SE_AF0EM1_GRVW8_GSU1_SU0_SUS128_SRVW4_WG64_4_1_WGM1
    SolutionIndex: 415
    SolutionNameMin: Cijk_Ailk_Bjlk_BSS_BH_MT64x128x16_MI32x32x4x1_SE_AF0EM1_GRVW8_GSU1_SU0_SUS128_SRVW4_WG64_4_1_WGM2
    SolutionIndex: 416
    SolutionNameMin: Cijk_Ailk_Bjlk_BSS_BH_MT64x64x32_MI32x32x4x1_SE_AF0EM1_GRVW8_GSU1_SU32_SUS256_SRVW4_WG64_4_1_WGM1
    SolutionIndex: 417
    SolutionNameMin: Cijk_Ailk_Bjlk_BSS_BH_MT64x128x32_MI32x32x4x1_SE_AF0EM1_GRVW8_GSU1_SU0_SUS128_SRVW4_WG64_4_1_WGM1
    SolutionIndex: 418
    SolutionNameMin: Cijk_Ailk_Bjlk_BSS_BH_MT64x128x16_MI32x32x4x1_SE_AF0EM1_GRVW8_GSU1_SU0_SUS256_SRVW4_WG64_4_1_WGM1
    SolutionIndex: 419
    SolutionNameMin: Cijk_Ailk_Bjlk_BSS_BH_MT64x64x32_MI32x32x4x1_SE_AF0EM1_GRVW8_GSU1_SU0_SUS256_SRVW4_WG64_4_1_WGM15
    SolutionIndex: 420
    SolutionNameMin: Cijk_Ailk_Bjlk_BSS_BH_MT64x64x32_MI32x32x4x1_SE_AF0EM1_GRVW8_GSU1_SU0_SUS128_SRVW4_WG64_4_1_WGM1
    SolutionIndex: 421
    SolutionNameMin: Cijk_Ailk_Bjlk_BSS_BH_MT64x64x32_MI32x32x4x1_SE_AF0EM1_GRVW8_GSU1_SU0_SUS128_SRVW4_WG64_4_1_WGM2
    SolutionIndex: 422
    SolutionNameMin: Cijk_Ailk_Bjlk_BSS_BH_MT64x256x16_MI32x32x4x1_SE_AF0EM1_GRVW8_GSU1_SU0_SUS128_SRVW4_WG64_4_1_WGM15
    SolutionIndex: 423
    SolutionNameMin: Cijk_Ailk_Bjlk_BSS_BH_MT64x64x32_MI32x32x4x1_SE_AF0EM1_GRVW8_GSU1_SU32_SUS128_SRVW4_WG64_4_1_WGM1
    SolutionIndex: 424
    SolutionNameMin: Cijk_Ailk_Bjlk_BSS_BH_MT64x128x32_MI32x32x4x1_SE_AF0EM1_GRVW8_GSU1_SU32_SUS128_SRVW4_WG64_4_1_WGM1
    SolutionIndex: 425
    SolutionNameMin: Cijk_Ailk_Bjlk_BSS_BH_MT64x64x16_MI32x32x4x1_SE_AF0EM1_GRVW4_GSU1_SU0_SUS128_SRVW4_WG64_4_1_WGM1
    SolutionIndex: 426
    SolutionNameMin: Cijk_Ailk_Bjlk_BSS_BH_MT64x64x32_MI32x32x4x1_SE_AF0EM1_GRVW8_GSU1_SU0_SUS256_SRVW4_WG64_4_1_WGM1
    SolutionIndex: 427
    SolutionNameMin: Cijk_Ailk_Bjlk_BSS_BH_MT64x128x16_MI32x32x4x1_SE_AF0EM1_GRVW8_GSU1_SU0_SUS128_SRVW4_WG64_4_1_WGM15
    SolutionIndex: 428
    SolutionNameMin: Cijk_Ailk_Bjlk_BSS_BH_MT128x96x16_MI32x32x4x1_SE_AF0EM1_GRVW2_GSU1_SU0_SUS128_SRVW4_WG128_2_1_WGM15
    SolutionIndex: 429
    SolutionNameMin: Cijk_Ailk_Bjlk_BSS_BH_MT128x96x16_MI32x32x4x1_SE_AF0EM1_GRVW2_GSU1_SU0_SUS128_SRVW4_WG128_2_1_WGM2
    SolutionIndex: 430
    SolutionNameMin: Cijk_Ailk_Bjlk_BSS_BH_MT64x64x16_MI32x32x4x1_SE_AF0EM1_GRVW2_GSU1_SU0_SUS128_SRVW4_WG64_4_1_WGM15
    SolutionIndex: 431
    SolutionNameMin: Cijk_Ailk_Bjlk_BSS_BH_MT64x128x16_MI32x32x4x1_SE_AF0EM1_GRVW8_GSU1_SU32_SUS256_SRVW4_WG64_4_1_WGM1
    SolutionIndex: 432
    SolutionNameMin: Cijk_Ailk_Bjlk_BSS_BH_MT64x32x16_MI16x16x8x1_SE_AF0EM1_GRVW4_GSU1_SU0_SUS128_SRVW4_WG32_8_1_WGM1
    SolutionIndex: 433
    SolutionNameMin: Cijk_Ailk_Bjlk_BSS_BH_MT64x128x16_MI32x32x4x1_SE_AF0EM1_GRVW8_GSU1_SU32_SUS256_SRVW4_WG64_4_1_WGM2
    SolutionIndex: 434
    SolutionNameMin: Cijk_Ailk_Bjlk_BSS_BH_MT128x96x16_MI32x32x4x1_SE_AF0EM1_GRVW2_GSU1_SU0_SUS256_SRVW4_WG128_2_1_WGM2
    SolutionIndex: 435
    SolutionNameMin: Cijk_Ailk_Bjlk_BSS_BH_MT64x64x16_MI32x32x4x1_SE_AF0EM1_GRVW8_GSU1_SU0_SUS128_SRVW4_WG64_4_1_WGM1
    SolutionIndex: 436
    SolutionNameMin: Cijk_Ailk_Bjlk_BSS_BH_MT64x128x16_MI32x32x4x1_SE_AF0EM1_GRVW8_GSU1_SU32_SUS128_SRVW4_WG64_4_1_WGM1
    SolutionIndex: 437
    SolutionNameMin: Cijk_Ailk_Bjlk_BSS_BH_MT64x32x32_MI16x16x8x1_SE_AF0EM1_GRVW4_GSU1_SU0_SUS256_SRVW4_WG32_8_1_WGM2
    SolutionIndex: 438
    SolutionNameMin: Cijk_Ailk_Bjlk_BSS_BH_MT32x32x64_MI16x16x8x1_SE_AF0EM1_GRVW8_GSU1_SU0_SUS256_SRVW4_WG32_8_1_WGM15
    SolutionIndex: 439
    SolutionNameMin: Cijk_Ailk_Bjlk_BSS_BH_MT64x256x16_MI32x32x4x1_SE_AF0EM1_GRVW8_GSU1_SU0_SUS256_SRVW4_WG64_4_1_WGM2
    SolutionIndex: 440
    SolutionNameMin: Cijk_Ailk_Bjlk_BSS_BH_MT64x256x16_MI32x32x4x1_SE_AF0EM1_GRVW8_GSU1_SU32_SUS256_SRVW4_WG64_4_1_WGM15
    SolutionIndex: 441
    SolutionNameMin: Cijk_Ailk_Bjlk_BSS_BH_MT64x128x32_MI32x32x4x1_SE_AF0EM1_GRVW8_GSU1_SU32_SUS256_SRVW4_WG64_4_1_WGM15
    SolutionIndex: 442
    SolutionNameMin: Cijk_Ailk_Bjlk_BSS_BH_MT64x128x32_MI32x32x4x1_SE_AF0EM1_GRVW8_GSU1_SU0_SUS128_SRVW4_WG64_4_1_WGM2
- - - [7680, 8192, 1, 8192]
    - [225, 97.9]
  - - [3840, 4096, 1, 4096]
    - [34, 95.511]
  - - [1920, 2048, 1, 2048]
    - [11, 90.147]
  - - [960, 1024, 1, 1024]
    - [39, 66.576]
  - - [480, 512, 1, 512]
    - [30, 20.302]
  - - [8192, 7680, 1, 8192]
    - [66, 97.938]
  - - [4096, 3840, 1, 4096]
    - [1, 95.548]
  - - [2048, 1920, 1, 2048]
    - [12, 88.924]
  - - [1024, 960, 1, 1024]
    - [23, 65.648]
  - - [512, 480, 1, 512]
    - [55, 22.43]
  - - [8192, 8192, 1, 8192]
    - [226, 96.413]
  - - [4096, 4096, 1, 4096]
    - [32, 92.592]
  - - [2048, 2048, 1, 2048]
    - [60, 84.264]
  - - [1024, 1024, 1, 1024]
    - [38, 50.495]
  - - [512, 512, 1, 512]
    - [48, 17.089]
  - - [64, 512, 16, 512]
    - [7, 28.226]
  - - [1024, 2, 1, 1]
    - [227, 0.001]
  - - [1024, 2, 1, 512]
    - [26, 0.16]
  - - [1024, 1024, 1, 1]
    - [28, 0.258]
  - - [1024, 1024, 1, 77]
    - [52, 13.614]
  - - [1024, 1024, 1, 512]
    - [46, 41.523]
  - - [1024, 4096, 1, 512]
    - [35, 68.59]
  - - [1024, 30522, 1, 77]
    - [21, 36.384]
  - - [4096, 1024, 1, 512]
    - [69, 68.825]
  - - [64, 128, 160, 128]
    - [36, 24.532]
  - - [1024, 2, 1, 10]
    - [6, 0.007]
  - - [1024, 2, 1, 1280]
    - [228, 0.283]
  - - [1024, 1024, 1, 10]
    - [16, 2.256]
  - - [1024, 1024, 1, 200]
    - [63, 24.842]
  - - [1024, 1024, 1, 1280]
    - [22, 53.335]
  - - [1024, 4096, 1, 1280]
    - [31, 81.496]
  - - [1024, 30522, 1, 200]
    - [9, 61.903]
  - - [4096, 1024, 1, 1280]
    - [60, 80.452]
  - - [64, 128, 624, 128]
    - [20, 31.161]
  - - [1024, 2, 1, 39]
    - [6, 0.024]
  - - [1024, 2, 1, 4992]
    - [229, 0.862]
  - - [1024, 1024, 1, 39]
    - [70, 8.057]
  - - [1024, 1024, 1, 780]
    - [57, 42.405]
  - - [1024, 1024, 1, 4992]
    - [61, 69.632]
  - - [1024, 4096, 1, 4992]
    - [31, 90.339]
  - - [1024, 30522, 1, 780]
    - [29, 84.781]
  - - [4096, 1024, 1, 4992]
    - [10, 88.683]
  - - [64, 512, 64, 512]
    - [25, 47.51]
  - - [1024, 2, 1, 4]
    - [230, 0.003]
  - - [1024, 2, 1, 2048]
    - [231, 0.419]
  - - [1024, 1024, 1, 4]
    - [58, 0.946]
  - - [1024, 1024, 1, 308]
    - [51, 30.376]
  - - [1024, 1024, 1, 2048]
    - [40, 61.178]
  - - [1024, 4096, 1, 2048]
    - [44, 85.793]
  - - [1024, 30522, 1, 308]
    - [68, 72.476]
  - - [4096, 1024, 1, 2048]
    - [33, 84.308]
  - - [64, 128, 640, 128]
    - [14, 31.323]
  - - [1024, 2, 1, 40]
    - [2, 0.024]
  - - [1024, 2, 1, 5120]
    - [229, 0.868]
  - - [1024, 1024, 1, 40]
    - [56, 8.264]
  - - [1024, 1024, 1, 800]
    - [37, 45.642]
  - - [1024, 1024, 1, 5120]
    - [40, 69.685]
  - - [1024, 4096, 1, 5120]
    - [31, 90.445]
  - - [1024, 30522, 1, 800]
    - [232, 86.664]
  - - [4096, 1024, 1, 5120]
    - [37, 88.65]
  - - [64, 128, 656, 128]
    - [42, 31.173]
  - - [1024, 2, 1, 41]
    - [3, 0.022]
  - - [1024, 2, 1, 5248]
    - [233, 0.894]
  - - [1024, 1024, 1, 41]
    - [52, 8.652]
  - - [1024, 1024, 1, 820]
    - [57, 42.688]
  - - [1024, 1024, 1, 5248]
    - [65, 69.78]
  - - [1024, 4096, 1, 5248]
    - [31, 90.427]
  - - [1024, 30522, 1, 820]
    - [18, 85.293]
  - - [4096, 1024, 1, 5248]
    - [10, 88.542]
  - - [64, 512, 80, 512]
    - [15, 54.141]
  - - [1024, 2, 1, 5]
    - [234, 0.003]
  - - [1024, 2, 1, 2560]
    - [235, 0.491]
  - - [1024, 1024, 1, 5]
    - [62, 1.154]
  - - [1024, 1024, 1, 385]
    - [54, 34.821]
  - - [1024, 1024, 1, 2560]
    - [43, 63.76]
  - - [1024, 4096, 1, 2560]
    - [31, 87.151]
  - - [1024, 30522, 1, 385]
    - [59, 76.475]
  - - [4096, 1024, 1, 2560]
    - [69, 85.702]
  - - [64, 512, 96, 512]
    - [19, 54.316]
  - - [1024, 2, 1, 6]
    - [0, 0.004]
  - - [1024, 2, 1, 3072]
    - [236, 0.56]
  - - [1024, 1024, 1, 6]
    - [64, 1.436]
  - - [1024, 1024, 1, 462]
    - [24, 36.268]
  - - [1024, 1024, 1, 3072]
    - [27, 65.964]
  - - [1024, 4096, 1, 3072]
    - [41, 88.015]
  - - [1024, 30522, 1, 462]
    - [68, 78.11]
  - - [4096, 1024, 1, 3072]
    - [17, 86.345]
  - - [64, 128, 128, 128]
    - [45, 20.934]
  - - [1024, 2, 1, 8]
    - [234, 0.004]
  - - [1024, 2, 1, 1024]
    - [47, 0.226]
  - - [1024, 1024, 1, 8]
    - [67, 1.848]
  - - [1024, 1024, 1, 160]
    - [53, 25.53]
  - - [1024, 4096, 1, 1024]
    - [8, 79.044]
  - - [1024, 30522, 1, 160]
    - [29, 60.385]
  - - [4096, 1024, 1, 1024]
    - [69, 78.198]
  - - [64, 128, 144, 128]
    - [13, 22.43]
  - - [1024, 2, 1, 9]
    - [0, 0.006]
  - - [1024, 2, 1, 1152]
    - [4, 0.244]
  - - [1024, 1024, 1, 9]
    - [50, 2.054]
  - - [1024, 1024, 1, 180]
    - [49, 23.552]
  - - [1024, 1024, 1, 1152]
    - [71, 50.806]
  - - [1024, 4096, 1, 1152]
    - [72, 78.776]
  - - [1024, 30522, 1, 180]
    - [237, 59.524]
  - - [4096, 1024, 1, 1152]
    - [238, 78.164]
  - - [13, 512, 1, 32768]
    - [394, 9.298]
  - - [256, 128, 1, 32768]
    - [239, 40.274]
  - - [256, 32768, 1, 1]
    - [75, 0.588]
  - - [479, 1024, 1, 32768]
    - [395, 83.819]
  - - [512, 256, 1, 32768]
    - [240, 70.701]
  - - [1024, 512, 1, 32768]
    - [241, 81.549]
  - - [1024, 1024, 1, 32768]
    - [242, 84.022]
  - - [64, 128, 512, 128]
    - [78, 29.468]
  - - [128, 64, 512, 128]
    - [79, 28.226]
  - - [1024, 2, 1, 32]
    - [80, 0.021]
  - - [1024, 1024, 1, 32]
    - [81, 7.136]
  - - [1024, 1024, 1, 4096]
    - [82, 66.879]
  - - [1024, 4096, 1, 4096]
    - [83, 87.617]
  - - [1024, 30528, 1, 4096]
    - [243, 95.154]
  - - [4096, 1024, 1, 4096]
    - [226, 87.094]
  - - [512, 64, 64, 512]
    - [84, 46.2]
  - - [1024, 30528, 1, 2048]
    - [244, 92.339]
  - - [4, 64, 32768, 4]
    - [85, 0.47]
  - - [4, 64, 38400, 4]
    - [86, 0.478]
  - - [64, 4, 32768, 4]
    - [87, 0.488]
  - - [64, 4, 38400, 4]
    - [88, 0.496]
  - - [1024, 1024, 1, 8192]
    - [89, 70.92]
  - - [1024, 1024, 1, 9600]
    - [90, 71.639]
  - - [1024, 4096, 1, 8192]
    - [91, 89.619]
  - - [1024, 4096, 1, 9600]
    - [91, 89.975]
  - - [1024, 33712, 1, 8192]
    - [245, 95.335]
  - - [1024, 33712, 1, 9600]
    - [243, 95.554]
  - - [4096, 1024, 1, 8192]
    - [238, 89.283]
  - - [4096, 1024, 1, 9600]
    - [238, 89.315]
  - - [1024, 1024, 1, 10064]
    - [246, 70.87]
  - - [1024, 1024, 1, 10080]
    - [247, 71.99]
  - - [1024, 1024, 1, 10200]
    - [246, 70.812]
  - - [1024, 1024, 1, 3840]
    - [71, 66.516]
  - - [1024, 1024, 1, 3968]
    - [95, 66.616]
  - - [1024, 1024, 1, 6528]
    - [96, 69.667]
  - - [1024, 1024, 1, 7104]
    - [71, 70.309]
  - - [1024, 1024, 1, 7200]
    - [89, 68.562]
  - - [1024, 1024, 1, 8064]
    - [97, 70.528]
  - - [1024, 1024, 1, 8160]
    - [248, 69.569]
  - - [1024, 1024, 1, 9216]
    - [89, 71.604]
  - - [1024, 1024, 1, 9520]
    - [249, 70.267]
  - - [1024, 4096, 1, 10064]
    - [83, 89.943]
  - - [1024, 4096, 1, 10080]
    - [91, 90.014]
  - - [1024, 4096, 1, 10200]
    - [250, 89.619]
  - - [1024, 4096, 1, 3840]
    - [83, 87.402]
  - - [1024, 4096, 1, 3968]
    - [72, 87.648]
  - - [1024, 4096, 1, 6528]
    - [226, 89.172]
  - - [1024, 4096, 1, 7104]
    - [83, 89.46]
  - - [1024, 4096, 1, 7200]
    - [72, 89.434]
  - - [1024, 4096, 1, 8064]
    - [91, 89.643]
  - - [1024, 4096, 1, 8160]
    - [72, 89.656]
  - - [1024, 4096, 1, 9216]
    - [99, 89.93]
  - - [1024, 4096, 1, 9520]
    - [99, 89.924]
  - - [1024, 42720, 1, 10080]
    - [251, 97.003]
  - - [1024, 42720, 1, 3968]
    - [226, 95.105]
  - - [1024, 42720, 1, 6528]
    - [252, 96.387]
  - - [1024, 42720, 1, 7104]
    - [252, 96.568]
  - - [1024, 42720, 1, 7200]
    - [252, 96.475]
  - - [1024, 42720, 1, 9520]
    - [252, 96.961]
  - - [4096, 1024, 1, 10064]
    - [226, 88.991]
  - - [4096, 1024, 1, 10080]
    - [226, 90.086]
  - - [4096, 1024, 1, 10200]
    - [226, 89.011]
  - - [4096, 1024, 1, 3840]
    - [226, 86.799]
  - - [4096, 1024, 1, 3968]
    - [226, 86.697]
  - - [4096, 1024, 1, 6528]
    - [226, 88.449]
  - - [4096, 1024, 1, 7104]
    - [226, 88.776]
  - - [4096, 1024, 1, 7200]
    - [238, 89.012]
  - - [4096, 1024, 1, 8064]
    - [238, 89.162]
  - - [4096, 1024, 1, 8160]
    - [226, 89.38]
  - - [4096, 1024, 1, 9216]
    - [226, 89.298]
  - - [4096, 1024, 1, 9520]
    - [238, 88.623]
  - - [14, 64, 10880, 14]
    - [103, 2.909]
  - - [15, 64, 10880, 14]
    - [104, 2.962]
  - - [15, 64, 7680, 15]
    - [105, 2.996]
  - - [15, 64, 10880, 15]
    - [396, 3.146]
  - - [17, 64, 7680, 15]
    - [106, 3.111]
  - - [17, 64, 6144, 17]
    - [107, 3.119]
  - - [17, 64, 7680, 17]
    - [397, 3.336]
  - - [21, 64, 6144, 17]
    - [108, 3.537]
  - - [21, 64, 6144, 21]
    - [109, 4.124]
  - - [24, 64, 4736, 24]
    - [110, 7.599]
  - - [30, 64, 2048, 30]
    - [111, 5.561]
  - - [30, 64, 2048, 31]
    - [112, 5.762]
  - - [31, 64, 2048, 31]
    - [113, 5.509]
  - - [32, 64, 4608, 32]
    - [114, 11.083]
  - - [32, 64, 4608, 35]
    - [115, 10.695]
  - - [34, 64, 4736, 24]
    - [398, 6.603]
  - - [34, 64, 4736, 34]
    - [399, 8.484]
  - - [35, 64, 4608, 35]
    - [117, 8.442]
  - - [64, 14, 10880, 14]
    - [88, 4.308]
  - - [64, 15, 10880, 14]
    - [87, 4.516]
  - - [64, 15, 7680, 15]
    - [88, 4.579]
  - - [64, 15, 10880, 15]
    - [118, 4.863]
  - - [64, 17, 7680, 15]
    - [119, 5.003]
  - - [64, 17, 6144, 17]
    - [120, 4.544]
  - - [64, 17, 7680, 17]
    - [121, 5.173]
  - - [64, 21, 6144, 17]
    - [122, 5.142]
  - - [64, 21, 6144, 21]
    - [123, 6.217]
  - - [64, 24, 4736, 24]
    - [124, 7.78]
  - - [64, 30, 2048, 30]
    - [125, 8.208]
  - - [64, 30, 2048, 31]
    - [126, 8.388]
  - - [64, 31, 2048, 31]
    - [123, 8.542]
  - - [64, 32, 4608, 32]
    - [127, 11.083]
  - - [64, 32, 4608, 35]
    - [128, 10.884]
  - - [64, 34, 4736, 24]
    - [129, 8.036]
  - - [64, 34, 4736, 34]
    - [130, 9.876]
  - - [64, 35, 4608, 35]
    - [128, 10.032]
  - - [512, 64, 1, 512]
    - [131, 2.908]
  - - [64, 512, 1, 512]
    - [132, 2.99]
  - - [64, 128, 1, 128]
    - [133, 0.289]
  - - [128, 64, 1, 128]
    - [134, 0.289]
  - - [74, 2048, 1, 512]
    - [135, 11.808]
  - - [2048, 2048, 1, 512]
    - [136, 66.989]
  - - [1024, 64, 1, 512]
    - [137, 5.982]
  - - [5, 64, 1, 5]
    - [400, 0.0]
  - - [2048, 512, 1, 1]
    - [138, 0.252]
  - - [1600, 1024, 1, 512]
    - [139, 53.587]
  - - [512, 32, 1, 1600]
    - [253, 2.682]
  - - [33, 32, 1, 33]
    - [401, 0.007]
  - - [560, 1024, 1, 1600]
    - [141, 44.838]
  - - [1024, 1600, 1, 1]
    - [142, 0.319]
  - - [1024, 1024, 1, 1600]
    - [143, 56.174]
  - - [512, 512, 1, 1600]
    - [144, 27.838]
  - - [3, 64, 512, 3]
    - [145, 0.081]
  - - [5, 64, 512, 5]
    - [146, 0.21]
  - - [5, 64, 960, 5]
    - [402, 0.252]
  - - [9, 64, 512, 9]
    - [147, 0.541]
  - - [27, 128, 32768, 27]
    - [397, 6.915]
  - - [33, 32, 200, 33]
    - [148, 1.891]
  - - [33, 32, 1600, 33]
    - [149, 4.7]
  - - [67, 2048, 1, 512]
    - [150, 11.05]
  - - [74, 2048, 1, 960]
    - [151, 14.641]
  - - [100, 2048, 1, 512]
    - [152, 14.018]
  - - [256, 1280, 1, 8976]
    - [254, 61.924]
  - - [256, 2560, 1, 8976]
    - [255, 75.309]
  - - [256, 2816, 1, 8976]
    - [256, 75.317]
  - - [256, 3328, 1, 8976]
    - [154, 75.491]
  - - [256, 3584, 1, 8976]
    - [155, 81.085]
  - - [256, 3840, 1, 8976]
    - [156, 86.241]
  - - [256, 4096, 1, 8976]
    - [257, 73.585]
  - - [256, 4352, 1, 8976]
    - [157, 73.835]
  - - [256, 4864, 1, 8976]
    - [258, 77.08]
  - - [256, 5120, 1, 8976]
    - [238, 81.166]
  - - [256, 5632, 1, 8976]
    - [250, 88.759]
  - - [256, 5888, 1, 8976]
    - [259, 75.166]
  - - [256, 6144, 1, 8976]
    - [260, 78.086]
  - - [256, 7168, 1, 8976]
    - [160, 86.938]
  - - [256, 8192, 1, 8976]
    - [261, 83.312]
  - - [256, 8960, 1, 8976]
    - [161, 86.733]
  - - [256, 9728, 1, 8976]
    - [262, 80.691]
  - - [256, 9984, 1, 8976]
    - [262, 82.783]
  - - [256, 10240, 1, 8976]
    - [262, 84.595]
  - - [256, 10496, 1, 8976]
    - [238, 86.594]
  - - [256, 11008, 1, 8976]
    - [263, 90.471]
  - - [256, 11264, 1, 8976]
    - [263, 92.222]
  - - [256, 11520, 1, 8976]
    - [226, 94.534]
  - - [256, 11776, 1, 8976]
    - [264, 78.134]
  - - [256, 12544, 1, 8976]
    - [265, 79.642]
  - - [256, 12800, 1, 8976]
    - [266, 80.684]
  - - [256, 13312, 1, 8976]
    - [245, 83.496]
  - - [256, 13568, 1, 8976]
    - [267, 85.026]
  - - [256, 14336, 1, 8976]
    - [268, 89.617]
  - - [256, 14848, 1, 8976]
    - [269, 92.805]
  - - [256, 15104, 1, 8976]
    - [245, 94.364]
  - - [256, 15872, 1, 8976]
    - [238, 87.945]
  - - [256, 16128, 1, 8976]
    - [263, 89.283]
  - - [256, 17152, 1, 8976]
    - [226, 94.392]
  - - [256, 17408, 1, 8976]
    - [252, 86.494]
  - - [256, 18688, 1, 8976]
    - [270, 92.661]
  - - [256, 19968, 1, 8976]
    - [263, 83.321]
  - - [256, 20480, 1, 8976]
    - [250, 85.35]
  - - [256, 20992, 1, 8976]
    - [250, 87.534]
  - - [256, 21248, 1, 8976]
    - [238, 88.533]
  - - [256, 22016, 1, 8976]
    - [250, 91.547]
  - - [256, 26112, 1, 8976]
    - [271, 90.596]
  - - [256, 32512, 1, 8976]
    - [226, 90.469]
  - - [256, 33536, 1, 8976]
    - [226, 93.229]
  - - [256, 44505, 1, 8976]
    - [269, 93.271]
  - - [257, 4096, 1, 1024]
    - [170, 41.771]
  - - [480, 1024, 1, 32768]
    - [272, 88.951]
  - - [512, 32, 1, 200]
    - [171, 0.659]
  - - [512, 512, 1, 200]
    - [172, 10.33]
  - - [512, 2048, 1, 256]
    - [173, 30.824]
  - - [560, 1024, 1, 200]
    - [174, 15.783]
  - - [768, 2048, 1, 256]
    - [175, 40.087]
  - - [1024, 64, 1, 960]
    - [176, 7.696]
  - - [1024, 256, 1, 1024]
    - [177, 23.812]
  - - [1024, 256, 1, 1280]
    - [178, 26.388]
  - - [1024, 256, 1, 2304]
    - [177, 31.754]
  - - [1024, 256, 1, 2816]
    - [179, 33.455]
  - - [1024, 256, 1, 3072]
    - [180, 34.024]
  - - [1024, 256, 1, 3328]
    - [273, 35.421]
  - - [1024, 256, 1, 3584]
    - [274, 36.788]
  - - [1024, 256, 1, 4096]
    - [273, 39.876]
  - - [1024, 256, 1, 4352]
    - [275, 41.301]
  - - [1024, 256, 1, 4608]
    - [273, 42.259]
  - - [1024, 256, 1, 5120]
    - [276, 44.541]
  - - [1024, 256, 1, 5376]
    - [277, 45.244]
  - - [1024, 256, 1, 5632]
    - [273, 46.599]
  - - [1024, 256, 1, 6144]
    - [276, 48.388]
  - - [1024, 256, 1, 6400]
    - [275, 49.373]
  - - [1024, 256, 1, 7680]
    - [278, 53.374]
  - - [1024, 256, 1, 7936]
    - [275, 54.307]
  - - [1024, 256, 1, 8192]
    - [275, 54.611]
  - - [1024, 256, 1, 8448]
    - [279, 55.34]
  - - [1024, 256, 1, 9728]
    - [278, 58.637]
  - - [1024, 256, 1, 9984]
    - [279, 58.806]
  - - [1024, 256, 1, 10496]
    - [280, 59.604]
  - - [1024, 256, 1, 11520]
    - [281, 61.238]
  - - [1024, 256, 1, 12032]
    - [278, 62.47]
  - - [1024, 256, 1, 13568]
    - [278, 64.444]
  - - [1024, 256, 1, 14336]
    - [278, 65.615]
  - - [1024, 256, 1, 14848]
    - [278, 66.289]
  - - [1024, 256, 1, 15104]
    - [282, 66.823]
  - - [1024, 256, 1, 15872]
    - [278, 67.542]
  - - [1024, 256, 1, 16128]
    - [283, 67.865]
  - - [1024, 256, 1, 17152]
    - [278, 69.264]
  - - [1024, 256, 1, 17408]
    - [284, 69.384]
  - - [1024, 256, 1, 18944]
    - [285, 70.899]
  - - [1024, 256, 1, 19712]
    - [278, 71.324]
  - - [1024, 256, 1, 19968]
    - [285, 71.252]
  - - [1024, 256, 1, 21248]
    - [279, 72.904]
  - - [1024, 256, 1, 21504]
    - [278, 72.615]
  - - [1024, 256, 1, 22016]
    - [282, 72.79]
  - - [1024, 256, 1, 28672]
    - [285, 76.747]
  - - [1024, 256, 1, 33536]
    - [286, 78.691]
  - - [1024, 1024, 1, 960]
    - [187, 48.559]
  - - [1600, 1024, 1, 960]
    - [188, 61.846]
  - - [2048, 256, 1, 1024]
    - [189, 36.015]
  - - [2048, 960, 1, 1]
    - [190, 0.347]
  - - [2048, 2048, 1, 960]
    - [191, 78.097]
  - - [2048, 2048, 1, 1024]
    - [191, 77.971]
  - - [3200, 2048, 1, 1024]
    - [188, 79.347]
  - - [4096, 4096, 1, 1024]
    - [192, 85.931]
  - - [2048, 2, 1, 2]
    - [287, 0.003]
  - - [2048, 2048, 1, 2]
    - [193, 0.897]
  - - [2048, 30592, 1, 1024]
    - [232, 91.011]
  - - [2048, 6144, 1, 1024]
    - [232, 85.428]
  - - [2048, 8192, 1, 1024]
    - [194, 85.61]
  - - [8192, 2048, 1, 1024]
    - [192, 85.474]
  - - [1024, 1024, 1, 16]
    - [288, 3.739]
  - - [1024, 2, 1, 16]
    - [196, 0.012]
  - - [1024, 30592, 1, 8192]
    - [197, 97.197]
  - - [1024, 3072, 1, 8192]
    - [289, 82.789]
  - - [512, 64, 256, 512]
    - [198, 56.851]
  - - [64, 512, 256, 512]
    - [199, 61.885]
  - - [1024, 30592, 1, 2048]
    - [200, 92.618]
  - - [1024, 3072, 1, 2048]
    - [289, 77.098]
  - - [1024, 30592, 1, 4096]
    - [200, 95.734]
  - - [1024, 3072, 1, 4096]
    - [289, 81.145]
  - - [512, 64, 128, 512]
    - [202, 54.024]
  - - [64, 512, 128, 512]
    - [203, 55.288]
  - - [2560, 1920, 1, 2048]
    - [204, 89.804]
  - - [2560, 2, 1, 4]
    - [205, 0.007]
  - - [2560, 2560, 1, 2048]
    - [271, 86.955]
  - - [2560, 2560, 1, 4]
    - [206, 2.011]
  - - [2560, 7680, 1, 2048]
    - [290, 93.122]
  - - [640, 2560, 1, 2048]
    - [207, 73.197]
  - - [512, 64, 40, 512]
    - [291, 44.073]
  - - [64, 512, 40, 512]
    - [208, 45.51]
  - - [1536, 1536, 1, 4096]
    - [204, 89.187]
  - - [1536, 4608, 1, 4096]
    - [209, 91.381]
  - - [1536, 50304, 1, 4096]
    - [226, 95.539]
  - - [1536, 6144, 1, 4096]
    - [210, 90.959]
  - - [6144, 1536, 1, 4096]
    - [211, 90.709]
  - - [1024, 96, 64, 1024]
    - [195, 72.815]
  - - [96, 1024, 64, 1024]
    - [292, 73.079]
  - - [1536, 1536, 1, 8192]
    - [204, 91.79]
  - - [1536, 4608, 1, 8192]
    - [212, 92.794]
  - - [1536, 50304, 1, 8192]
    - [293, 96.324]
  - - [1536, 6144, 1, 8192]
    - [211, 92.666]
  - - [6144, 1536, 1, 8192]
    - [213, 92.547]
  - - [1024, 96, 128, 1024]
    - [212, 81.861]
  - - [96, 1024, 128, 1024]
    - [294, 79.383]
  - - [1024, 1024, 1, 16384]
    - [295, 76.797]
  - - [1024, 3072, 1, 16384]
    - [296, 84.544]
  - - [1024, 4096, 1, 16384]
    - [215, 92.386]
  - - [1024, 50304, 1, 16384]
    - [297, 97.51]
  - - [4096, 1024, 1, 16384]
    - [298, 90.616]
  - - [1024, 64, 256, 1024]
    - [217, 71.919]
  - - [64, 1024, 256, 1024]
    - [244, 74.988]
  - - [1024, 50304, 1, 2048]
    - [218, 94.102]
  - - [1024, 64, 32, 1024]
    - [299, 57.915]
  - - [64, 1024, 32, 1024]
    - [219, 57.337]
  - - [1024, 50304, 1, 4096]
    - [220, 95.925]
  - - [1024, 64, 64, 1024]
    - [221, 64.465]
  - - [64, 1024, 64, 1024]
    - [222, 65.784]
  - - [1024, 50304, 1, 8192]
    - [300, 96.699]
  - - [1024, 64, 128, 1024]
    - [223, 69.032]
  - - [64, 1024, 128, 1024]
    - [224, 72.684]
  - - [1024, 2, 1, 64]
    - [230, 0.033]
  - - [1024, 30528, 1, 8192]
    - [245, 96.953]
  - - [1024, 1024, 1, 64]
    - [301, 12.194]
  - - [64, 128, 1024, 128]
    - [302, 32.104]
  - - [128, 64, 1024, 128]
    - [303, 30.312]
  - - [1024, 1024, 1, 3456]
    - [238, 60.344]
  - - [1024, 1024, 1, 6912]
    - [304, 67.156]
  - - [1024, 1024, 1, 864]
    - [305, 45.953]
  - - [1024, 512, 1, 3456]
    - [306, 46.971]
  - - [1024, 512, 1, 4096]
    - [307, 49.744]
  - - [1024, 512, 1, 6912]
    - [308, 58.775]
  - - [1024, 512, 1, 864]
    - [309, 31.517]
  - - [256, 128, 1, 3456]
    - [310, 9.814]
  - - [256, 128, 1, 4096]
    - [311, 11.419]
  - - [256, 128, 1, 55296]
    - [312, 50.541]
  - - [256, 128, 1, 6912]
    - [313, 16.367]
  - - [256, 128, 1, 864]
    - [314, 2.849]
  - - [256, 3456, 1, 1]
    - [315, 0.21]
  - - [256, 4096, 1, 1]
    - [316, 0.223]
  - - [256, 6912, 1, 1]
    - [317, 0.295]
  - - [256, 864, 1, 1]
    - [315, 0.063]
  - - [480, 1024, 1, 3456]
    - [318, 51.697]
  - - [480, 1024, 1, 4096]
    - [319, 56.921]
  - - [480, 1024, 1, 6912]
    - [319, 67.431]
  - - [480, 1024, 1, 864]
    - [320, 31.667]
  - - [512, 256, 1, 3456]
    - [321, 26.248]
  - - [512, 256, 1, 4096]
    - [322, 29.295]
  - - [512, 256, 1, 55296]
    - [323, 79.423]
  - - [512, 256, 1, 6912]
    - [324, 39.071]
  - - [512, 256, 1, 864]
    - [325, 10.983]
  - - [30528, 1024, 1, 640]
    - [263, 83.343]
  - - [30528, 1024, 1, 1280]
    - [326, 90.352]
  - - [4096, 1024, 1, 10240]
    - [226, 89.738]
  - - [1024, 4096, 1, 10240]
    - [250, 89.539]
  - - [30528, 1024, 1, 1600]
    - [326, 92.106]
  - - [1024, 2, 1, 80]
    - [327, 0.037]
  - - [1024, 1024, 1, 10240]
    - [328, 71.8]
  - - [1024, 1024, 1, 80]
    - [301, 14.145]
  - - [64, 128, 1280, 128]
    - [329, 32.923]
  - - [128, 64, 1280, 128]
    - [330, 31.758]
  - - [1024, 4096, 1, 10496]
    - [250, 90.042]
  - - [30528, 1024, 1, 1640]
    - [326, 90.92]
  - - [4096, 1024, 1, 10496]
    - [331, 89.427]
  - - [1024, 1024, 1, 10496]
    - [332, 72.101]
  - - [1024, 1024, 1, 82]
    - [333, 12.672]
  - - [1024, 2, 1, 82]
    - [287, 0.034]
  - - [128, 64, 1312, 128]
    - [330, 31.868]
  - - [64, 128, 1312, 128]
    - [334, 33.097]
  - - [30528, 1024, 1, 160]
    - [335, 60.087]
  - - [1024, 4096, 1, 6144]
    - [226, 88.549]
  - - [30528, 1024, 1, 240]
    - [336, 69.723]
  - - [4096, 1024, 1, 6144]
    - [226, 88.338]
  - - [1024, 1024, 1, 12]
    - [337, 2.379]
  - - [1024, 2, 1, 12]
    - [338, 0.007]
  - - [1024, 1024, 1, 6144]
    - [339, 65.784]
  - - [64, 512, 192, 512]
    - [340, 57.86]
  - - [512, 64, 192, 512]
    - [341, 54.121]
  - - [3136, 64, 64, 128]
    - [342, 39.504]
  - - [3136, 64, 64, 256]
    - [291, 52.559]
  - - [3136, 128, 64, 256]
    - [343, 69.939]
  - - [784, 256, 64, 512]
    - [344, 74.512]
  - - [3136, 256, 64, 128]
    - [345, 60.251]
  - - [3136, 256, 64, 256]
    - [290, 76.789]
  - - [784, 512, 64, 256]
    - [346, 67.933]
  - - [784, 512, 64, 512]
    - [346, 78.08]
  - - [3136, 64, 32, 128]
    - [347, 34.422]
  - - [3136, 64, 32, 256]
    - [299, 47.859]
  - - [3136, 128, 32, 256]
    - [343, 65.267]
  - - [784, 256, 32, 512]
    - [348, 69.077]
  - - [3136, 256, 32, 128]
    - [349, 55.1]
  - - [3136, 256, 32, 256]
    - [350, 71.691]
  - - [784, 512, 32, 256]
    - [346, 62.738]
  - - [784, 512, 32, 512]
    - [344, 74.019]
  - - [3136, 256, 32, 64]
    - [351, 35.699]
  - - [3136, 64, 32, 64]
    - [309, 23.243]
  - - [784, 512, 32, 128]
    - [290, 47.49]
  - - [784, 128, 32, 512]
    - [348, 58.616]
  - - [3136, 64, 64, 64]
    - [309, 26.036]
  - - [3136, 256, 64, 64]
    - [352, 37.992]
  - - [784, 128, 64, 512]
    - [348, 67.045]
  - - [784, 512, 64, 128]
    - [353, 53.103]
  - - [64, 1280, 64, 192]
    - [351, 43.715]
  - - [64, 1280, 64, 320]
    - [354, 52.51]
  - - [64, 1280, 64, 384]
    - [271, 55.743]
  - - [64, 1280, 64, 448]
    - [350, 58.616]
  - - [64, 2048, 64, 192]
    - [355, 46.235]
  - - [64, 2048, 64, 320]
    - [356, 55.949]
  - - [64, 2048, 64, 384]
    - [350, 60.111]
  - - [64, 2048, 64, 448]
    - [357, 62.635]
  - - [64, 1280, 32, 192]
    - [358, 39.416]
  - - [64, 1280, 32, 320]
    - [356, 48.015]
  - - [64, 1280, 32, 384]
    - [356, 50.647]
  - - [64, 1280, 32, 448]
    - [359, 53.612]
  - - [64, 2048, 32, 192]
    - [360, 41.295]
  - - [64, 2048, 32, 320]
    - [355, 50.141]
  - - [64, 2048, 32, 384]
    - [350, 53.073]
  - - [64, 2048, 32, 448]
    - [361, 55.472]
  - - [1024, 1024, 1, 10224]
    - [249, 71.155]
  - - [1024, 1024, 1, 10192]
    - [248, 70.906]
  - - [1024, 1024, 1, 10208]
    - [304, 72.091]
  - - [1024, 4096, 1, 10224]
    - [250, 89.469]
  - - [4096, 1024, 1, 10224]
    - [250, 88.805]
  - - [1024, 3072, 1, 10224]
    - [362, 82.927]
  - - [1024, 3072, 1, 10240]
    - [363, 83.424]
  - - [4096, 1024, 1, 10192]
    - [226, 89.258]
  - - [1024, 3072, 1, 10192]
    - [363, 83.161]
  - - [1024, 4096, 1, 10192]
    - [250, 89.557]
  - - [1024, 3072, 1, 10200]
    - [362, 82.755]
  - - [1024, 1024, 1, 10184]
    - [364, 71.028]
  - - [4096, 1024, 1, 10208]
    - [226, 89.678]
  - - [1024, 3072, 1, 10208]
    - [365, 83.499]
  - - [1024, 4096, 1, 10208]
    - [250, 89.768]
  - - [1024, 2048, 1, 10224]
    - [366, 84.132]
  - - [1024, 2048, 1, 10240]
    - [367, 85.139]
  - - [1024, 1024, 1, 10120]
    - [249, 71.061]
  - - [1024, 2048, 1, 10192]
    - [367, 84.222]
  - - [64, 24, 6816, 24]
    - [368, 7.303]
  - - [1024, 1024, 1, 10152]
    - [249, 71.336]
  - - [1024, 3072, 1, 10080]
    - [363, 83.402]
  - - [64, 26, 6272, 26]
    - [368, 7.801]
  - - [100352, 256, 1, 512]
    - [343, 75.75]
  - - [12544, 1024, 1, 2048]
    - [226, 89.637]
  - - [12544, 147, 1, 64]
    - [369, 14.627]
  - - [200704, 256, 1, 512]
    - [290, 76.885]
  - - [25088, 512, 1, 1024]
    - [290, 83.199]
  - - [3136, 576, 1, 64]
    - [370, 15.566]
  - - [50176, 512, 1, 1024]
    - [343, 86.291]
  - - [6272, 1024, 1, 2048]
    - [371, 84.282]
  - - [784, 1152, 1, 128]
    - [309, 17.592]
  - - [3136, 256, 128, 128]
    - [344, 62.469]
  - - [3136, 256, 256, 128]
    - [353, 63.755]
  - - [3136, 256, 128, 64]
    - [372, 39.214]
  - - [3136, 256, 256, 64]
    - [372, 39.888]
  - - [3136, 64, 128, 256]
    - [299, 55.572]
  - - [3136, 64, 256, 256]
    - [299, 57.534]
  - - [3136, 64, 128, 64]
    - [373, 27.874]
  - - [3136, 64, 256, 64]
    - [374, 29.141]
  - - [784, 128, 128, 512]
    - [343, 72.494]
  - - [784, 128, 256, 512]
    - [343, 75.984]
  - - [784, 512, 128, 128]
    - [344, 57.601]
  - - [784, 512, 256, 128]
    - [375, 59.609]
  - - [784, 512, 128, 256]
    - [375, 72.643]
  - - [784, 512, 256, 256]
    - [376, 75.091]
  - - [64, 128, 2048, 128]
    - [334, 34.295]
  - - [128, 64, 2048, 128]
    - [377, 33.919]
  - - [30528, 1024, 1, 2560]
    - [378, 94.087]
  - - [1024, 1024, 1, 128]
    - [309, 20.761]
  - - [1024, 2, 1, 128]
    - [230, 0.057]
  - - [128, 64, 1536, 128]
    - [291, 32.874]
  - - [64, 128, 1536, 128]
    - [379, 33.236]
  - - [1024, 4096, 1, 12288]
    - [250, 90.231]
  - - [30528, 1024, 1, 1920]
    - [326, 92.934]
  - - [1024, 1024, 1, 96]
    - [291, 16.823]
  - - [1024, 1024, 1, 12288]
    - [249, 73.705]
  - - [4096, 1024, 1, 12288]
    - [226, 90.264]
  - - [1024, 2, 1, 96]
    - [380, 0.045]
  - - [25600, 128, 25, 128]
    - [381, 53.187]
  - - [12544, 128, 36, 128]
    - [355, 52.634]
  - - [9216, 128, 49, 128]
    - [382, 53.757]
  - - [6400, 128, 64, 128]
    - [271, 53.632]
  - - [6400, 256, 25, 256]
    - [346, 74.68]
  - - [4096, 256, 36, 256]
    - [375, 73.435]
  - - [2304, 256, 49, 256]
    - [290, 72.884]
  - - [2304, 256, 64, 256]
    - [345, 74.802]
  - - [2304, 512, 25, 512]
    - [375, 83.688]
  - - [1024, 512, 36, 512]
    - [290, 80.459]
  - - [1024, 512, 49, 512]
    - [352, 80.374]
  - - [1024, 512, 64, 512]
    - [290, 82.554]
  - - [92416, 64, 25, 64]
    - [383, 28.318]
  - - [50176, 64, 36, 64]
    - [384, 28.577]
  - - [36864, 64, 49, 64]
    - [336, 28.737]
  - - [25600, 64, 64, 64]
    - [335, 28.836]
  - - [64, 128, 192, 128]
    - [352, 25.121]
  - - [128, 64, 192, 128]
    - [385, 22.036]
  - - [768, 2, 1, 2048]
    - [386, 0.322]
  - - [3072, 768, 1, 2048]
    - [387, 76.446]
  - - [768, 3072, 1, 2048]
    - [388, 75.869]
  - - [768, 768, 1, 2048]
    - [374, 45.583]
  - - [64, 384, 144, 384]
    - [271, 50.668]
  - - [384, 64, 144, 384]
    - [389, 47.365]
  - - [768, 2, 1, 4608]
    - [390, 0.636]
  - - [3072, 768, 1, 4608]
    - [388, 85.785]
  - - [768, 3072, 1, 4608]
    - [391, 85.281]
  - - [768, 768, 1, 4608]
    - [392, 57.222]
  - - [64, 512, 48, 512]
    - [361, 48.779]
  - - [512, 64, 48, 512]
    - [265, 38.353]
  - - [64, 128, 256, 128]
    - [352, 27.012]
  - - [128, 64, 256, 128]
    - [393, 22.53]
  - - [64, 384, 192, 384]
    - [358, 54.175]
  - - [384, 64, 192, 384]
    - [342, 48.937]
  - - [1024, 2, 1, 4608]
    - [390, 0.822]
  - - [4096, 1024, 1, 4608]
    - [238, 87.759]
  - - [1024, 4096, 1, 4608]
    - [250, 87.042]
  - - [1024, 1024, 1, 4608]
    - [263, 62.672]
  - - [13, 512, 1, 3456]
    - [403, 2.03]
  - - [13, 512, 1, 4096]
    - [404, 2.465]
  - - [13, 512, 1, 55296]
    - [405, 11.462]
  - - [13, 512, 1, 6912]
    - [406, 3.68]
  - - [13, 512, 1, 864]
    - [407, 0.563]
  - - [196, 512, 64, 1024]
    - [408, 62.105]
  - - [196, 1024, 64, 512]
    - [409, 59.494]
  - - [196, 1024, 64, 1024]
    - [410, 64.514]
  - - [49, 1024, 64, 2048]
    - [411, 51.763]
  - - [49, 2048, 64, 1024]
    - [412, 51.417]
  - - [196, 512, 32, 1024]
    - [413, 54.322]
  - - [196, 1024, 32, 512]
    - [414, 54.66]
  - - [196, 1024, 32, 1024]
    - [415, 60.016]
  - - [49, 1024, 32, 2048]
    - [416, 45.489]
  - - [49, 2048, 32, 1024]
    - [417, 45.624]
  - - [196, 1024, 32, 256]
    - [418, 45.524]
  - - [196, 256, 32, 1024]
    - [419, 46.0]
  - - [49, 2048, 32, 512]
    - [420, 36.592]
  - - [49, 512, 32, 2048]
    - [421, 36.722]
  - - [196, 256, 64, 1024]
    - [417, 53.659]
  - - [196, 1024, 64, 256]
    - [422, 50.448]
  - - [49, 512, 64, 2048]
    - [423, 42.741]
  - - [49, 2048, 64, 512]
    - [424, 41.168]
  - - [1225, 192, 64, 32]
    - [420, 17.011]
  - - [1225, 192, 64, 48]
    - [425, 20.46]
  - - [1225, 192, 64, 64]
    - [426, 28.217]
  - - [1225, 256, 64, 48]
    - [427, 24.565]
  - - [1225, 256, 64, 64]
    - [427, 30.743]
  - - [1225, 288, 64, 48]
    - [428, 21.626]
  - - [1225, 288, 64, 64]
    - [429, 29.146]
  - - [5329, 64, 64, 80]
    - [430, 28.695]
  - - [289, 768, 64, 128]
    - [431, 41.051]
  - - [289, 768, 64, 160]
    - [414, 45.839]
  - - [289, 768, 64, 192]
    - [431, 49.801]
  - - [1225, 192, 32, 32]
    - [426, 14.636]
  - - [1225, 192, 32, 48]
    - [432, 18.525]
  - - [1225, 192, 32, 64]
    - [426, 24.905]
  - - [1225, 256, 32, 48]
    - [433, 20.918]
  - - [1225, 256, 32, 64]
    - [414, 27.013]
  - - [1225, 288, 32, 48]
    - [434, 19.581]
  - - [1225, 288, 32, 64]
    - [434, 25.184]
  - - [5329, 64, 32, 80]
    - [435, 26.358]
  - - [289, 768, 32, 128]
    - [418, 36.05]
  - - [289, 768, 32, 160]
    - [436, 40.359]
  - - [289, 768, 32, 192]
    - [414, 44.312]
  - - [196, 2304, 1, 256]
    - [437, 14.922]
  - - [49, 4608, 1, 512]
    - [438, 13.034]
  - - [196, 1024, 128, 256]
    - [422, 55.002]
  - - [196, 1024, 256, 256]
    - [409, 57.641]
  - - [196, 1024, 128, 512]
    - [439, 62.342]
  - - [196, 1024, 256, 512]
    - [409, 65.017]
  - - [196, 256, 128, 1024]
    - [417, 61.732]
  - - [196, 256, 256, 1024]
    - [417, 63.894]
  - - [49, 2048, 128, 512]
    - [409, 45.64]
  - - [49, 2048, 256, 512]
    - [440, 47.683]
  - - [49, 512, 128, 2048]
    - [441, 50.531]
  - - [49, 512, 256, 2048]
    - [442, 56.843]
- null
