library/src/blas3/Tensile/Logic/asm_full/aldebaran_Cijk_AlikC_Bjlk_CB.yaml
- {MinimumRequiredVersion: 4.21.0}
- aldebaran
- gfx90a
- [Device 0050, Device 0051, Device 0052, Device 0054, Device 0062, Device 7400, Device 740c]
    SolutionIndex: 0
    SolutionNameMin: Cijk_AlikC_Bjlk_CB_MT128x128x8_MI16x16x4x1_SE_1LDSB1_IU2_SIA2_SRVW0
    SolutionIndex: 1
    SolutionNameMin: Cijk_AlikC_Bjlk_CB_MT128x64x8_MI16x16x4x1_SE_1LDSB0_IU2_SIA2_SRVW2
    SolutionIndex: 2
    SolutionNameMin: Cijk_AlikC_Bjlk_CB_MT32x32x16_MI16x16x4x1_SE_1LDSB0_IU4_SIA2_SRVW2
    SolutionIndex: 3
    SolutionNameMin: Cijk_AlikC_Bjlk_CB_MT128x128x8_MI32x32x2x1_SE_1LDSB0_IU1_SIA3_SRVW2
    SolutionIndex: 4
    SolutionNameMin: Cijk_AlikC_Bjlk_CB_MT32x64x32_MI16x16x4x1_SE_1LDSB0_IU1_SIA3_SRVW2
    SolutionIndex: 5
    SolutionNameMin: Cijk_AlikC_Bjlk_CB_MT64x64x8_MI16x16x4x1_SE_1LDSB1_IU2_SIA2_SRVW2
    SolutionIndex: 6
    SolutionNameMin: Cijk_AlikC_Bjlk_CB_MT64x64x8_MI16x16x4x1_SE_1LDSB1_IU2_SIA2_SRVW2
    SolutionIndex: 7
    SolutionNameMin: Cijk_AlikC_Bjlk_CB_MT128x128x8_MI16x16x4x1_SE_1LDSB1_IU2_SIA2_SRVW2
    SolutionIndex: 8
    SolutionNameMin: Cijk_AlikC_Bjlk_CB_MT32x32x16_MI16x16x4x1_SE_1LDSB1_IU4_SIA2_SRVW2
    SolutionIndex: 9
    SolutionNameMin: Cijk_AlikC_Bjlk_CB_MT64x64x16_MI16x16x4x1_SE_1LDSB1_IU4_SIA2_SRVW2
    SolutionIndex: 10
    SolutionNameMin: Cijk_AlikC_Bjlk_CB_MT128x64x16_MI16x16x4x1_SE_1LDSB1_IU4_SIA2_SRVW2
    SolutionIndex: 11
    SolutionNameMin: Cijk_AlikC_Bjlk_CB_MT64x64x8_MI16x16x4x1_SE_1LDSB0_IU2_SIA2_SRVW0
    SolutionIndex: 12
    SolutionNameMin: Cijk_AlikC_Bjlk_CB_MT64x64x16_MI16x16x4x1_SE_1LDSB0_IU1_SIA3_SRVW0
- - - [7680, 8192, 1, 8192, 7680, 7680, 8192, 8192]
    - [0, 99.184]
  - - [960, 1024, 1, 1024, 1056, 1056, 1056, 1056]
    - [6, 93.733]
  - - [1920, 2048, 1, 2048, 2064, 2064, 2064, 2064]
    - [1, 97.339]
  - - [3840, 4096, 1, 4096, 4112, 4112, 4112, 4112]
    - [7, 98.692]
  - - [1, 1, 1, 256, 1, 1, 256, 1]
    - [11, 0.0]
  - - [480, 512, 1, 512, 544, 544, 544, 544]
    - [4, 61.367]
  - - [1920, 2048, 1, 2048, 2080, 2080, 2080, 2080]
    - [1, 97.459]
  - - [64, 64, 1, 256, 64, 64, 256, 64]
    - [12, 0.515]
  - - [64, 64, 2, 64, 64, 64, 64, 64]
    - [11, 0.563]
  - - [1, 64, 1, 256, 1, 1, 256, 64]
    - [11, 0.012]
  - - [480, 512, 1, 512, 528, 528, 528, 528]
    - [2, 70.83]
  - - [64, 1, 1, 256, 64, 64, 256, 1]
    - [11, 0.012]
  - - [7680, 8192, 1, 8192, 8224, 8224, 8224, 8224]
    - [3, 98.944]
  - - [480, 512, 1, 512, 480, 480, 512, 512]
    - [8, 63.439]
  - - [3840, 4096, 1, 4096, 3840, 3840, 4096, 4096]
    - [7, 98.68]
  - - [3840, 4096, 1, 4096, 4228, 4228, 4228, 4228]
    - [7, 98.597]
  - - [960, 1024, 1, 1024, 960, 960, 1024, 1024]
    - [9, 93.733]
  - - [7680, 8192, 1, 8192, 8208, 8208, 8208, 8208]
    - [3, 99.028]
  - - [1920, 2048, 1, 2048, 1920, 1920, 2048, 2048]
    - [10, 97.387]
  - - [960, 1024, 1, 1024, 1040, 1040, 1040, 1040]
    - [5, 93.326]
- null
