library/src/blas3/Tensile/Logic/asm_full/aldebaran_Cijk_Ailk_Bljk_4xi8BH.yaml
- {MinimumRequiredVersion: 4.6.0}
- aldebaran
- gfx90a
- [Device 0050, Device 0051, Device 0052, Device 0054, Device 0062, Device 7400, Device
    SolutionIndex: 0
    SolutionNameMin: Cijk_Ailk_Bljk_4xi8BH_MT64x64x16_SN_AMAS3_BL1_EPS1_GRVW4_GSU1_ISA90a_KLA_LPB0_LRVW4_MAC_NLCA1_PGR1_PLR1_SNLL1_TT4_4_USFGRO0_VW4_WG16_16_1_WGM8
    SolutionIndex: 1
    SolutionNameMin: Cijk_Ailk_Bljk_4xi8BH_MT128x32x16_SN_AMAS3_BL1_EPS1_GRVW4_GSU2_ISA90a_KLA_LPB0_LRVW4_MAC_NLCA1_PGR1_PLR1_SNLL0_TT8_4_USFGRO0_VW4_WG16_8_2_WGM1
    SolutionIndex: 2
    SolutionNameMin: Cijk_Ailk_Bljk_4xi8BH_MT16x16x16_SN_AMAS3_BL1_EPS1_GRVW2_GSU8_ISA90a_KLA_LPB0_LRVW2_MAC_NLCA1_PGR1_PLR1_SNLL0_TT2_2_USFGRO1_VW2_WG8_8_4_WGM1
    SolutionIndex: 3
    SolutionNameMin: Cijk_Ailk_Bljk_4xi8BH_MT16x16x16_SN_AMAS3_BL1_EPS1_GRVW2_GSU16_ISA90a_KLA_LPB0_LRVW2_MAC_NLCA1_PGR1_PLR1_SNLL0_TT2_2_USFGRO1_VW2_WG8_8_4_WGM1
    SolutionIndex: 4
    SolutionNameMin: Cijk_Ailk_Bljk_4xi8BH_MT64x64x16_SN_AMAS3_BL1_EPS1_GRVW4_GSU1_ISA90a_KLA_LPB0_LRVW4_MAC_NLCA1_PGR1_PLR1_SNLL1_TT4_4_USFGRO0_VW4_WG16_16_1_WGM1
    SolutionIndex: 5
    SolutionNameMin: Cijk_Ailk_Bljk_4xi8BH_MT128x64x8_SN_AMAS3_BL1_EPS1_GRVW4_GSU1_ISA90a_KLA_LPB0_LRVW4_MAC_NLCA1_PGR1_PLR1_SNLL1_TT8_4_USFGRO0_VW4_WG16_16_1_WGM8
    SolutionIndex: 6
    SolutionNameMin: Cijk_Ailk_Bljk_4xi8BH_MT64x16x16_SN_AMAS3_BL1_EPS1_GRVW4_GSU2_ISA90a_KLA_LPB0_LRVW4_MAC_NLCA1_PGR1_PLR1_SNLL0_TT4_4_USFGRO0_VW4_WG16_4_4_WGM8
    SolutionIndex: 7
    SolutionNameMin: Cijk_Ailk_Bljk_4xi8BH_MT32x32x32_SN_AMAS3_BL1_EPS1_GRVW4_GSU4_ISA90a_KLA_LPB0_LRVW4_MAC_NLCA1_PGR1_PLR1_SNLL0_TT4_4_USFGRO0_VW4_WG8_8_4_WGM8
    SolutionIndex: 8
    SolutionNameMin: Cijk_Ailk_Bljk_4xi8BH_MT128x64x8_SN_AMAS3_BL1_EPS1_GRVW4_GSU1_ISA90a_KLA_LPB4_LRVW4_MAC_NLCA1_PGR1_PLR1_SNLL1_TT4_8_USFGRO0_VW4_WG32_8_1_WGM1
    SolutionIndex: 9
    SolutionNameMin: Cijk_Ailk_Bljk_4xi8BH_MT128x64x8_SN_AMAS3_BL1_EPS1_GRVW4_GSU1_ISA90a_KLA_LPB4_LRVW4_MAC_NLCA1_PGR1_PLR1_SNLL1_TT8_4_USFGRO0_VW4_WG16_16_1_WGM1
    SolutionIndex: 10
    SolutionNameMin: Cijk_Ailk_Bljk_4xi8BH_MT32x32x16_SN_AMAS3_BL1_EPS1_GRVW4_GSU2_ISA90a_KLA_LPB0_LRVW4_MAC_NLCA1_PGR1_PLR1_SNLL0_TT4_4_USFGRO0_VW4_WG8_8_2_WGM1
    SolutionIndex: 11
    SolutionNameMin: Cijk_Ailk_Bljk_4xi8BH_MT128x64x8_SN_AMAS3_BL1_EPS1_GRVW4_GSU1_ISA90a_KLA_LPB0_LRVW4_MAC_NLCA1_PGR1_PLR1_SNLL1_TT8_4_USFGRO0_VW4_WG16_16_1_WGM1
    SolutionIndex: 12
    SolutionNameMin: Cijk_Ailk_Bljk_4xi8BH_MT128x64x16_SN_AMAS3_BL1_EPS1_GRVW4_GSU1_ISA90a_KLA_LPB4_LRVW4_MAC_NLCA1_PGR1_PLR1_SNLL1_TT4_4_USFGRO0_VW4_WG32_16_1_WGM1
    SolutionIndex: 13
    SolutionNameMin: Cijk_Ailk_Bljk_4xi8BH_MT128x64x8_SN_AMAS3_BL1_EPS1_GRVW4_GSU1_ISA90a_KLA_LPB4_LRVW4_MAC_NLCA1_PGR1_PLR1_SNLL1_TT8_4_USFGRO0_VW4_WG16_16_1_WGM8
    SolutionIndex: 14
    SolutionNameMin: Cijk_Ailk_Bljk_4xi8BH_MT32x8x32_SN_AMAS3_BL1_EPS1_GRVW2_GSU8_ISA90a_KLA_LPB0_LRVW2_MAC_NLCA1_PGR1_PLR1_SNLL0_TT2_2_USFGRO0_VW2_WG16_4_4_WGM8
    SolutionIndex: 15
    SolutionNameMin: Cijk_Ailk_Bljk_4xi8BH_MT24x24x24_SN_AMAS0_BL1_EPS1_GRVW1_GSU4_ISA90a_KLA_LPB0_LRVW1_MAC_NLCA1_PGR1_PLR1_SNLL0_TT3_4_USFGRO1_VW1_WG8_6_4_WGM1
    SolutionIndex: 16
    SolutionNameMin: Cijk_Ailk_Bljk_4xi8BH_MT64x128x16_SN_AMAS3_BL1_EPS0_GRVW4_GSU1_ISA90a_KLA_LPB0_LRVW4_MAC_NLCA1_PGR0_PLR1_SNLL0_TT4_8_USFGRO0_VW4_WG16_16_1_WGM1
    SolutionIndex: 17
    SolutionNameMin: Cijk_Ailk_Bljk_4xi8BH_MT16x16x16_SN_AMAS3_BL1_EPS1_GRVW2_GSU1_ISA90a_KLA_LPB0_LRVW2_MAC_NLCA1_PGR1_PLR1_SNLL1_TT2_2_USFGRO1_VW2_WG8_8_4_WGM1
    SolutionIndex: 18
    SolutionNameMin: Cijk_Ailk_Bljk_4xi8BH_MT128x32x8_SN_AMAS3_BL1_EPS1_GRVW4_GSU1_ISA90a_KLA_LPB4_LRVW4_MAC_NLCA1_PGR1_PLR1_SNLL1_TT4_4_USFGRO0_VW4_WG32_8_1_WGM8
    SolutionIndex: 19
    SolutionNameMin: Cijk_Ailk_Bljk_4xi8BH_MT32x8x32_SN_AMAS3_BL1_EPS1_GRVW2_GSU8_ISA90a_KLA_LPB0_LRVW2_MAC_NLCA1_PGR1_PLR1_SNLL0_TT2_2_USFGRO0_VW2_WG16_4_4_WGM1
    SolutionIndex: 20
    SolutionNameMin: Cijk_Ailk_Bljk_4xi8BH_MT32x32x32_SN_AMAS3_BL1_EPS1_GRVW4_GSU2_ISA90a_KLA_LPB0_LRVW4_MAC_NLCA1_PGR1_PLR1_SNLL0_TT4_4_USFGRO0_VW4_WG8_8_4_WGM1
    SolutionIndex: 21
    SolutionNameMin: Cijk_Ailk_Bljk_4xi8BH_MT32x32x16_SN_AMAS3_BL1_EPS1_GRVW4_GSU2_ISA90a_KLA_LPB0_LRVW4_MAC_NLCA1_PGR1_PLR1_SNLL0_TT4_4_USFGRO0_VW4_WG8_8_2_WGM8
    SolutionIndex: 22
    SolutionNameMin: Cijk_Ailk_Bljk_4xi8BH_MT32x32x32_SN_AMAS3_BL1_EPS1_GRVW4_GSU4_ISA90a_KLA_LPB0_LRVW4_MAC_NLCA1_PGR1_PLR1_SNLL0_TT4_4_USFGRO0_VW4_WG8_8_4_WGM1
    SolutionIndex: 23
    SolutionNameMin: Cijk_Ailk_Bljk_4xi8BH_MT128x32x16_SN_AMAS3_BL1_EPS1_GRVW4_GSU2_ISA90a_KLA_LPB0_LRVW4_MAC_NLCA1_PGR1_PLR1_SNLL0_TT8_4_USFGRO0_VW4_WG16_8_2_WGM8
    SolutionIndex: 24
    SolutionNameMin: Cijk_Ailk_Bljk_4xi8BH_MT32x16x16_SN_AMAS3_BL1_EPS1_GRVW2_GSU2_ISA90a_KLA_LPB0_LRVW2_MAC_NLCA1_PGR1_PLR1_SNLL0_TT4_2_USFGRO0_VW2_WG8_8_4_WGM8
    SolutionIndex: 25
    SolutionNameMin: Cijk_Ailk_Bljk_4xi8BH_MT64x128x8_SN_AMAS3_BL1_EPS1_GRVW1_GSU1_ISA90a_KLA_LPB4_LRVW4_MAC_NLCA1_PGR1_PLR0_SNLL1_TT4_8_USFGRO1_VW4_WG16_16_1_WGM8
    SolutionIndex: 26
    SolutionNameMin: Cijk_Ailk_Bljk_4xi8BH_MT16x16x8_SN_AMAS3_BL1_EPS1_GRVW2_GSU1_ISA90a_KLA_LPB0_LRVW2_MAC_NLCA1_PGR1_PLR1_SNLL1_TT2_2_USFGRO1_VW2_WG8_8_2_WGM1
    SolutionIndex: 27
    SolutionNameMin: Cijk_Ailk_Bljk_4xi8BH_MT128x64x16_SN_AMAS3_BL1_EPS1_GRVW4_GSU1_ISA90a_KLA_LPB4_LRVW4_MAC_NLCA1_PGR1_PLR1_SNLL1_TT4_4_USFGRO0_VW4_WG32_16_1_WGM8
    SolutionIndex: 28
    SolutionNameMin: Cijk_Ailk_Bljk_4xi8BH_MT128x64x16_SN_AMAS3_BL1_EPS1_GRVW4_GSU1_ISA90a_KLA_LPB0_LRVW4_MAC_NLCA1_PGR1_PLR1_SNLL1_TT8_4_USFGRO0_VW4_WG16_16_1_WGM1
    SolutionIndex: 29
    SolutionNameMin: Cijk_Ailk_Bljk_4xi8BH_MT32x8x32_SN_AMAS3_BL1_EPS1_GRVW2_GSU4_ISA90a_KLA_LPB0_LRVW2_MAC_NLCA1_PGR1_PLR1_SNLL0_TT2_2_USFGRO0_VW2_WG16_4_4_WGM1
    SolutionIndex: 30
    SolutionNameMin: Cijk_Ailk_Bljk_4xi8BH_MT64x32x32_SN_AMAS3_BL1_EPS1_GRVW4_GSU2_ISA90a_KLA_LPB0_LRVW4_MAC_NLCA1_PGR1_PLR1_SNLL0_TT8_4_USFGRO0_VW4_WG8_8_4_WGM8
    SolutionIndex: 31
    SolutionNameMin: Cijk_Ailk_Bljk_4xi8BH_MT64x4x64_SN_AMAS3_BL1_EPS0_GRVW2_GSU16_ISA90a_KLA_LPB0_LRVW2_MAC_NLCA1_PGR0_PLR1_SNLL0_TT2_2_USFGRO0_VW2_WG32_2_4_WGM1
    SolutionIndex: 32
    SolutionNameMin: Cijk_Ailk_Bljk_4xi8BH_MT32x16x16_SN_AMAS3_BL1_EPS1_GRVW2_GSU4_ISA90a_KLA_LPB0_LRVW2_MAC_NLCA1_PGR1_PLR1_SNLL0_TT4_2_USFGRO0_VW2_WG8_8_4_WGM1
    SolutionIndex: 33
    SolutionNameMin: Cijk_Ailk_Bljk_4xi8BH_MT32x8x64_SN_AMAS3_BL1_EPS0_GRVW2_GSU32_ISA90a_KLA_LPB0_LRVW2_MAC_NLCA1_PGR0_PLR1_SNLL0_TT4_2_USFGRO0_VW2_WG8_4_8_WGM1
    SolutionIndex: 34
    SolutionNameMin: Cijk_Ailk_Bljk_4xi8BH_MT64x8x32_SN_AMAS3_BL1_EPS1_GRVW2_GSU4_ISA90a_KLA_LPB0_LRVW2_MAC_NLCA1_PGR1_PLR1_SNLL0_TT4_2_USFGRO0_VW2_WG16_4_4_WGM8
    SolutionIndex: 35
    SolutionNameMin: Cijk_Ailk_Bljk_4xi8BH_MT24x24x32_SN_AMAS0_BL1_EPS1_GRVW1_GSU4_ISA90a_KLA_LPB0_LRVW1_MAC_NLCA1_PGR1_PLR1_SNLL0_TT3_4_USFGRO1_VW1_WG8_6_4_WGM1
    SolutionIndex: 36
    SolutionNameMin: Cijk_Ailk_Bljk_4xi8BH_MT64x32x32_SN_AMAS3_BL1_EPS1_GRVW4_GSU2_ISA90a_KLA_LPB0_LRVW4_MAC_NLCA1_PGR1_PLR1_SNLL0_TT8_4_USFGRO0_VW4_WG8_8_4_WGM1
    SolutionIndex: 37
    SolutionNameMin: Cijk_Ailk_Bljk_4xi8BH_MT128x32x8_SN_AMAS3_BL1_EPS1_GRVW4_GSU1_ISA90a_KLA_LPB4_LRVW4_MAC_NLCA1_PGR1_PLR1_SNLL1_TT4_4_USFGRO0_VW4_WG32_8_1_WGM1
    SolutionIndex: 38
    SolutionNameMin: Cijk_Ailk_Bljk_4xi8BH_MT64x16x16_SN_AMAS3_BL1_EPS1_GRVW2_GSU4_ISA90a_KLA_LPB0_LRVW2_MAC_NLCA1_PGR1_PLR1_SNLL0_TT4_2_USFGRO0_VW2_WG16_8_2_WGM1
    SolutionIndex: 39
    SolutionNameMin: Cijk_Ailk_Bljk_4xi8BH_MT64x4x64_SN_AMAS3_BL1_EPS0_GRVW2_GSU16_ISA90a_KLA_LPB0_LRVW2_MAC_NLCA1_PGR0_PLR1_SNLL0_TT4_2_USFGRO0_VW2_WG16_2_8_WGM1
    SolutionIndex: 40
    SolutionNameMin: Cijk_Ailk_Bljk_4xi8BH_MT32x16x32_SN_AMAS3_BL1_EPS1_GRVW2_GSU4_ISA90a_KLA_LPB0_LRVW2_MAC_NLCA1_PGR1_PLR1_SNLL0_TT4_2_USFGRO0_VW2_WG8_8_4_WGM8
    SolutionIndex: 41
    SolutionNameMin: Cijk_Ailk_Bljk_4xi8BH_MT128x64x8_SN_AMAS3_BL1_EPS1_GRVW4_GSU1_ISA90a_KLA_LPB4_LRVW4_MAC_NLCA1_PGR1_PLR1_SNLL1_TT4_8_USFGRO0_VW4_WG32_8_1_WGM8
    SolutionIndex: 42
    SolutionNameMin: Cijk_Ailk_Bljk_4xi8BH_MT128x64x8_SN_AMAS3_BL1_EPS1_GRVW4_GSU1_ISA90a_KLA_LPB0_LRVW4_MAC_NLCA1_PGR1_PLR1_SNLL1_TT4_8_USFGRO0_VW4_WG32_8_1_WGM8
    SolutionIndex: 43
    SolutionNameMin: Cijk_Ailk_Bljk_4xi8BH_MT64x64x16_SN_AMAS3_BL1_EPS0_GRVW4_GSU1_ISA90a_KLA_LPB0_LRVW4_MAC_NLCA1_PGR0_PLR1_SNLL0_TT4_4_USFGRO0_VW4_WG16_16_1_WGM1
    SolutionIndex: 44
    SolutionNameMin: Cijk_Ailk_Bljk_4xi8BH_MT32x16x16_SN_AMAS3_BL1_EPS1_GRVW2_GSU2_ISA90a_KLA_LPB0_LRVW2_MAC_NLCA1_PGR1_PLR1_SNLL0_TT4_2_USFGRO0_VW2_WG8_8_4_WGM1
    SolutionIndex: 45
    SolutionNameMin: Cijk_Ailk_Bljk_4xi8BH_MT64x32x16_SN_AMAS3_BL1_EPS1_GRVW4_GSU2_ISA90a_KLA_LPB0_LRVW4_MAC_NLCA1_PGR1_PLR1_SNLL0_TT4_4_USFGRO0_VW4_WG16_8_2_WGM8
    SolutionIndex: 46
    SolutionNameMin: Cijk_Ailk_Bljk_4xi8BH_MT16x16x32_SN_AMAS3_BL1_EPS1_GRVW2_GSU2_ISA90a_KLA_LPB0_LRVW2_MAC_NLCA1_PGR1_PLR1_SNLL0_TT2_2_USFGRO0_VW2_WG8_8_4_WGM1
    SolutionIndex: 47
    SolutionNameMin: Cijk_Ailk_Bljk_4xi8BH_MT8x8x8_SN_AMAS3_BL1_EPS1_GRVW2_GSU16_ISA90a_KLA_LPB0_LRVW2_MAC_NLCA1_PGR1_PLR1_SNLL0_TT2_2_USFGRO1_VW2_WG4_4_4_WGM1
    SolutionIndex: 48
    SolutionNameMin: Cijk_Ailk_Bljk_4xi8BH_MT32x32x32_SN_AMAS3_BL1_EPS1_GRVW4_GSU2_ISA90a_KLA_LPB0_LRVW4_MAC_NLCA1_PGR1_PLR1_SNLL0_TT4_4_USFGRO0_VW4_WG8_8_4_WGM8
    SolutionIndex: 49
    SolutionNameMin: Cijk_Ailk_Bljk_4xi8BH_MT64x32x16_SN_AMAS3_BL1_EPS1_GRVW4_GSU2_ISA90a_KLA_LPB0_LRVW4_MAC_NLCA1_PGR1_PLR1_SNLL0_TT4_4_USFGRO0_VW4_WG16_8_2_WGM1
    SolutionIndex: 50
    SolutionNameMin: Cijk_Ailk_Bljk_4xi8BH_MT64x64x16_SN_AMAS3_BL1_EPS0_GRVW4_GSU1_ISA90a_KLA_LPB4_LRVW4_MAC_NLCA1_PGR0_PLR0_SNLL0_TT4_4_USFGRO0_VW4_WG16_16_1_WGM8
    SolutionIndex: 51
    SolutionNameMin: Cijk_Ailk_Bljk_4xi8BH_MT64x128x16_SN_AMAS3_BL1_EPS0_GRVW4_GSU1_ISA90a_KLA_LPB0_LRVW4_MAC_NLCA1_PGR0_PLR1_SNLL0_TT4_8_USFGRO0_VW4_WG16_16_1_WGM8
    SolutionIndex: 52
    SolutionNameMin: Cijk_Ailk_Bljk_4xi8BH_MT64x4x64_SN_AMAS3_BL1_EPS0_GRVW2_GSU32_ISA90a_KLA_LPB0_LRVW2_MAC_NLCA1_PGR0_PLR1_SNLL0_TT4_2_USFGRO0_VW2_WG16_2_8_WGM1
    SolutionIndex: 53
    SolutionNameMin: Cijk_Ailk_Bljk_4xi8BH_MT8x8x8_SN_AMAS3_BL1_EPS1_GRVW2_GSU8_ISA90a_KLA_LPB0_LRVW2_MAC_NLCA1_PGR1_PLR1_SNLL0_TT2_2_USFGRO1_VW2_WG4_4_4_WGM1
    SolutionIndex: 54
    SolutionNameMin: Cijk_Ailk_Bljk_4xi8BH_MT36x48x16_SN_AMAS0_BL1_EPS1_GRVW1_GSU8_ISA90a_KLA_LPB0_LRVW1_MAC_NLCA3_PGR1_PLR1_SNLL0_TT3_3_USFGRO1_VW1_WG12_16_1_WGM1
    SolutionIndex: 55
    SolutionNameMin: Cijk_Ailk_Bljk_4xi8BH_MT64x8x32_SN_AMAS3_BL1_EPS1_GRVW2_GSU4_ISA90a_KLA_LPB0_LRVW2_MAC_NLCA1_PGR1_PLR1_SNLL0_TT4_2_USFGRO0_VW2_WG16_4_4_WGM1
    SolutionIndex: 56
    SolutionNameMin: Cijk_Ailk_Bljk_4xi8BH_MT32x8x32_SN_AMAS3_BL1_EPS1_GRVW2_GSU4_ISA90a_KLA_LPB0_LRVW2_MAC_NLCA1_PGR1_PLR1_SNLL0_TT2_2_USFGRO0_VW2_WG16_4_4_WGM8
    SolutionIndex: 57
    SolutionNameMin: Cijk_Ailk_Bljk_4xi8BH_MT32x8x64_SN_AMAS3_BL1_EPS0_GRVW2_GSU16_ISA90a_KLA_LPB0_LRVW2_MAC_NLCA1_PGR0_PLR1_SNLL0_TT4_2_USFGRO0_VW2_WG8_4_8_WGM1
    SolutionIndex: 58
    SolutionNameMin: Cijk_Ailk_Bljk_4xi8BH_MT32x8x32_SN_AMAS3_BL1_EPS1_GRVW2_GSU2_ISA90a_KLA_LPB0_LRVW2_MAC_NLCA1_PGR1_PLR1_SNLL0_TT2_2_USFGRO0_VW2_WG16_4_4_WGM8
    SolutionIndex: 59
    SolutionNameMin: Cijk_Ailk_Bljk_4xi8BH_MT64x64x16_SN_AMAS3_BL1_EPS0_GRVW4_GSU1_ISA90a_KLA_LPB0_LRVW4_MAC_NLCA1_PGR0_PLR1_SNLL0_TT4_4_USFGRO0_VW4_WG16_16_1_WGM8
    SolutionIndex: 60
    SolutionNameMin: Cijk_Ailk_Bljk_4xi8BH_MT64x16x16_SN_AMAS3_BL1_EPS1_GRVW4_GSU4_ISA90a_KLA_LPB0_LRVW4_MAC_NLCA1_PGR1_PLR1_SNLL0_TT4_4_USFGRO0_VW4_WG16_4_4_WGM8
    SolutionIndex: 61
    SolutionNameMin: Cijk_Ailk_Bljk_4xi8BH_MT32x8x32_SN_AMAS3_BL1_EPS1_GRVW2_GSU2_ISA90a_KLA_LPB0_LRVW2_MAC_NLCA1_PGR1_PLR1_SNLL0_TT2_2_USFGRO0_VW2_WG16_4_4_WGM1
    SolutionIndex: 62
    SolutionNameMin: Cijk_Ailk_Bljk_4xi8BH_MT16x16x8_SN_AMAS3_BL1_EPS1_GRVW2_GSU4_ISA90a_KLA_LPB0_LRVW2_MAC_NLCA1_PGR1_PLR1_SNLL0_TT2_2_USFGRO1_VW2_WG8_8_2_WGM1
    SolutionIndex: 63
    SolutionNameMin: Cijk_Ailk_Bljk_4xi8BH_MT16x16x16_SN_AMAS3_BL1_EPS1_GRVW2_GSU4_ISA90a_KLA_LPB0_LRVW2_MAC_NLCA1_PGR1_PLR1_SNLL0_TT2_2_USFGRO1_VW2_WG8_8_4_WGM1
    SolutionIndex: 64
    SolutionNameMin: Cijk_Ailk_Bljk_4xi8BH_MT64x16x16_SN_AMAS3_BL1_EPS1_GRVW4_GSU2_ISA90a_KLA_LPB0_LRVW4_MAC_NLCA1_PGR1_PLR1_SNLL0_TT4_4_USFGRO0_VW4_WG16_4_4_WGM1
    SolutionIndex: 65
    SolutionNameMin: Cijk_Ailk_Bljk_4xi8BH_MT64x8x32_SN_AMAS3_BL1_EPS0_GRVW2_GSU16_ISA90a_KLA_LPB0_LRVW2_MAC_NLCA1_PGR0_PLR1_SNLL0_TT4_2_USFGRO0_VW2_WG16_4_4_WGM1
    SolutionIndex: 66
    SolutionNameMin: Cijk_Ailk_Bljk_4xi8BH_MT128x64x16_SN_AMAS3_BL1_EPS0_GRVW4_GSU1_ISA90a_KLA_LPB0_LRVW4_MAC_NLCA1_PGR0_PLR1_SNLL0_TT8_4_USFGRO0_VW4_WG16_16_1_WGM8
    SolutionIndex: 67
    SolutionNameMin: Cijk_Ailk_Bljk_4xi8BH_MT128x16x16_SN_AMAS3_BL1_EPS1_GRVW4_GSU32_ISA90a_KLA_LPB0_LRVW4_MAC_NLCA1_PGR1_PLR1_SNLL0_TT4_4_USFGRO0_VW4_WG32_4_2_WGM1
    SolutionIndex: 68
    SolutionNameMin: Cijk_Ailk_Bljk_4xi8BH_MT16x16x8_SN_AMAS3_BL1_EPS1_GRVW2_GSU16_ISA90a_KLA_LPB0_LRVW2_MAC_NLCA1_PGR1_PLR1_SNLL0_TT2_2_USFGRO1_VW2_WG8_8_2_WGM1
    SolutionIndex: 69
    SolutionNameMin: Cijk_Ailk_Bljk_4xi8BH_MT64x16x16_SN_AMAS3_BL1_EPS1_GRVW2_GSU4_ISA90a_KLA_LPB0_LRVW2_MAC_NLCA1_PGR1_PLR1_SNLL0_TT4_2_USFGRO0_VW2_WG16_8_2_WGM8
    SolutionIndex: 70
    SolutionNameMin: Cijk_Ailk_Bljk_4xi8BH_MT128x32x8_SN_AMAS3_BL1_EPS1_GRVW4_GSU2_ISA90a_KLA_LPB0_LRVW4_MAC_NLCA1_PGR1_PLR1_SNLL0_TT8_4_USFGRO0_VW4_WG16_8_2_WGM1
    SolutionIndex: 71
    SolutionNameMin: Cijk_Ailk_Bljk_4xi8BH_MT16x16x8_SN_AMAS3_BL1_EPS1_GRVW2_GSU8_ISA90a_KLA_LPB0_LRVW2_MAC_NLCA1_PGR1_PLR1_SNLL0_TT2_2_USFGRO1_VW2_WG8_8_2_WGM1
    SolutionIndex: 72
    SolutionNameMin: Cijk_Ailk_Bljk_4xi8BH_MT32x16x16_SN_AMAS3_BL1_EPS1_GRVW2_GSU4_ISA90a_KLA_LPB0_LRVW2_MAC_NLCA1_PGR1_PLR1_SNLL0_TT2_2_USFGRO0_VW2_WG16_8_2_WGM1
    SolutionIndex: 73
    SolutionNameMin: Cijk_Ailk_Bljk_4xi8BH_MT128x8x32_SN_AMAS3_BL1_EPS0_GRVW4_GSU32_ISA90a_KLA_LPB0_LRVW4_MAC_NLCA1_PGR0_PLR1_SNLL0_TT4_4_USFGRO0_VW4_WG32_2_4_WGM1
    SolutionIndex: 74
    SolutionNameMin: Cijk_Ailk_Bljk_4xi8BH_MT16x16x32_SN_AMAS3_BL1_EPS1_GRVW2_GSU2_ISA90a_KLA_LPB0_LRVW2_MAC_NLCA1_PGR1_PLR1_SNLL0_TT2_2_USFGRO0_VW2_WG8_8_4_WGM8
    SolutionIndex: 75
    SolutionNameMin: Cijk_Ailk_Bljk_4xi8BH_MT64x64x16_SN_AMAS3_BL1_EPS0_GRVW1_GSU1_ISA90a_KLA_LPB4_LRVW4_MAC_NLCA1_PGR0_PLR0_SNLL0_TT4_4_USFGRO1_VW4_WG16_16_1_WGM8
    SolutionIndex: 76
    SolutionNameMin: Cijk_Ailk_Bljk_4xi8BH_MT64x64x32_SN_AMAS3_BL1_EPS1_GRVW4_GSU1_ISA90a_KLA_LPB0_LRVW4_MAC_NLCA1_PGR1_PLR1_SNLL1_TT4_4_USFGRO0_VW4_WG16_16_1_WGM8
    SolutionIndex: 77
    SolutionNameMin: Cijk_Ailk_Bljk_4xi8BH_MT16x16x16_SN_AMAS3_BL1_EPS1_GRVW2_GSU2_ISA90a_KLA_LPB0_LRVW2_MAC_NLCA1_PGR1_PLR1_SNLL0_TT2_2_USFGRO1_VW2_WG8_8_4_WGM8
- - - [704, 1024, 1, 128]
    - [0, 17.032]
  - - [1024, 1024, 1, 3328]
    - [1, 48.844]
  - - [4, 704, 1, 1280]
    - [2, 1.121]
  - - [4, 1856, 1, 3328]
    - [3, 3.649]
  - - [1856, 448, 1, 3328]
    - [4, 51.734]
  - - [2944, 4288, 1, 1280]
    - [5, 71.831]
  - - [2368, 64, 1, 3328]
    - [6, 37.344]
  - - [1760, 32, 1, 1760]
    - [7, 19.174]
  - - [2368, 5888, 1, 256]
    - [8, 67.727]
  - - [5888, 1856, 1, 256]
    - [9, 61.523]
  - - [64, 3584, 1, 1280]
    - [10, 28.032]
  - - [512, 24000, 1, 1536]
    - [11, 75.297]
  - - [128, 6784, 1, 3328]
    - [12, 60.632]
  - - [5888, 1408, 1, 256]
    - [11, 54.19]
  - - [5888, 1856, 1, 3328]
    - [13, 72.549]
  - - [512, 4, 1, 512]
    - [14, 0.415]
  - - [35, 1500, 1, 2560]
    - [15, 16.973]
  - - [1856, 4288, 1, 256]
    - [16, 55.553]
  - - [1024, 5056, 1, 128]
    - [11, 48.919]
  - - [5056, 5056, 1, 3328]
    - [11, 76.819]
  - - [1408, 5888, 1, 1280]
    - [9, 70.432]
  - - [2368, 448, 1, 128]
    - [0, 28.663]
  - - [6144, 6000, 1, 2560]
    - [13, 76.738]
  - - [2368, 6784, 1, 128]
    - [13, 54.016]
  - - [1024, 3584, 1, 3328]
    - [9, 62.045]
  - - [512, 48000, 1, 2048]
    - [11, 76.665]
  - - [1408, 64, 1, 128]
    - [17, 3.93]
  - - [256, 4288, 1, 3328]
    - [18, 54.538]
  - - [5888, 1408, 1, 1280]
    - [13, 70.728]
  - - [704, 1856, 1, 3328]
    - [0, 61.08]
  - - [1408, 4288, 1, 256]
    - [9, 55.086]
  - - [1024, 2368, 1, 256]
    - [11, 52.066]
  - - [64, 4, 1, 256]
    - [19, 0.025]
  - - [1408, 1856, 1, 1280]
    - [13, 67.133]
  - - [1408, 64, 1, 1280]
    - [20, 18.604]
  - - [448, 1024, 1, 1280]
    - [21, 36.833]
  - - [4096, 32, 1, 4096]
    - [22, 34.21]
  - - [256, 1408, 1, 3328]
    - [23, 43.25]
  - - [5056, 5056, 1, 1280]
    - [13, 76.379]
  - - [448, 5056, 1, 256]
    - [0, 43.136]
  - - [704, 1856, 1, 1280]
    - [0, 50.916]
  - - [128, 5056, 1, 128]
    - [4, 19.773]
  - - [2368, 128, 1, 256]
    - [24, 13.411]
  - - [1856, 1408, 1, 128]
    - [25, 38.604]
  - - [64, 5056, 1, 256]
    - [26, 15.875]
  - - [6784, 256, 1, 3328]
    - [27, 64.508]
  - - [1408, 3584, 1, 256]
    - [13, 58.743]
  - - [4288, 448, 1, 256]
    - [4, 44.531]
  - - [64, 704, 1, 128]
    - [17, 2.02]
  - - [1024, 1856, 1, 128]
    - [18, 30.729]
  - - [4288, 2944, 1, 1280]
    - [11, 71.071]
  - - [704, 5056, 1, 1280]
    - [25, 65.799]
  - - [2368, 704, 1, 3328]
    - [12, 64.649]
  - - [256, 5888, 1, 256]
    - [28, 44.455]
  - - [1856, 4288, 1, 3328]
    - [25, 69.421]
  - - [256, 2944, 1, 256]
    - [0, 34.623]
  - - [5888, 1024, 1, 256]
    - [9, 54.001]
  - - [448, 64, 1, 1280]
    - [29, 9.16]
  - - [3072, 64, 1, 1024]
    - [30, 26.45]
  - - [3584, 4, 1, 1280]
    - [31, 4.964]
  - - [2560, 16, 1, 2560]
    - [32, 17.483]
  - - [2944, 64, 1, 256]
    - [26, 11.97]
  - - [128, 4, 1, 1280]
    - [33, 0.23]
  - - [1408, 2944, 1, 256]
    - [8, 56.731]
  - - [256, 1856, 1, 1280]
    - [10, 37.106]
  - - [6784, 5056, 1, 3328]
    - [5, 77.297]
  - - [5056, 5056, 1, 256]
    - [9, 71.93]
  - - [128, 256, 1, 256]
    - [17, 2.947]
  - - [64, 1024, 1, 1280]
    - [15, 15.294]
  - - [2944, 4, 1, 256]
    - [34, 1.158]
  - - [704, 5056, 1, 128]
    - [4, 44.134]
  - - [4, 2368, 1, 1280]
    - [35, 2.578]
  - - [2368, 2944, 1, 1280]
    - [11, 70.758]
  - - [448, 448, 1, 3328]
    - [36, 42.157]
  - - [6784, 6784, 1, 1280]
    - [5, 77.488]
  - - [1024, 256, 1, 3328]
    - [10, 42.887]
  - - [1408, 4288, 1, 1280]
    - [11, 70.165]
  - - [3584, 4288, 1, 1280]
    - [11, 72.824]
  - - [512, 6000, 1, 2560]
    - [37, 65.98]
  - - [2368, 704, 1, 1280]
    - [27, 60.093]
  - - [5056, 4288, 1, 3328]
    - [5, 75.878]
  - - [3584, 2368, 1, 3328]
    - [5, 73.195]
  - - [5888, 6784, 1, 1280]
    - [13, 77.15]
  - - [64, 704, 1, 1280]
    - [38, 12.562]
  - - [4288, 256, 1, 256]
    - [0, 39.444]
  - - [2944, 128, 1, 128]
    - [18, 12.251]
  - - [6144, 32, 1, 2560]
    - [30, 38.661]
  - - [6784, 448, 1, 1280]
    - [18, 60.32]
  - - [2944, 5888, 1, 256]
    - [11, 69.91]
  - - [64, 64, 1, 1280]
    - [2, 1.727]
  - - [4288, 2944, 1, 256]
    - [8, 58.799]
  - - [5888, 704, 1, 1280]
    - [5, 63.199]
  - - [5056, 4, 1, 3328]
    - [39, 9.08]
  - - [1856, 64, 1, 1280]
    - [7, 22.448]
  - - [1760, 16, 1, 1760]
    - [40, 11.157]
  - - [448, 5888, 1, 128]
    - [25, 42.323]
  - - [5888, 64, 1, 3328]
    - [23, 43.754]
  - - [2944, 256, 1, 3328]
    - [12, 53.393]
  - - [1024, 64, 1, 128]
    - [17, 3.466]
  - - [5056, 2368, 1, 1280]
    - [5, 71.724]
  - - [448, 3584, 1, 1280]
    - [0, 54.15]
  - - [6784, 5888, 1, 256]
    - [8, 73.148]
  - - [64, 1024, 1, 3328]
    - [7, 25.366]
  - - [704, 128, 1, 1280]
    - [20, 19.198]
  - - [4, 3584, 1, 128]
    - [17, 0.682]
  - - [1408, 448, 1, 1280]
    - [37, 41.005]
  - - [1024, 1408, 1, 256]
    - [28, 42.235]
  - - [2368, 2368, 1, 3328]
    - [5, 67.26]
  - - [1856, 6784, 1, 128]
    - [25, 59.204]
  - - [5056, 704, 1, 3328]
    - [13, 71.533]
  - - [1408, 1856, 1, 256]
    - [41, 56.407]
  - - [1408, 704, 1, 3328]
    - [37, 49.716]
  - - [2368, 5056, 1, 256]
    - [11, 65.772]
  - - [1408, 256, 1, 1280]
    - [10, 35.365]
  - - [3072, 128, 1, 1024]
    - [10, 34.851]
  - - [3584, 2368, 1, 1280]
    - [5, 69.64]
  - - [4288, 64, 1, 3328]
    - [10, 43.851]
  - - [2368, 4, 1, 1280]
    - [29, 3.572]
  - - [704, 5888, 1, 256]
    - [4, 51.933]
  - - [6784, 2944, 1, 128]
    - [42, 56.976]
  - - [6784, 64, 1, 256]
    - [4, 24.835]
  - - [2944, 256, 1, 256]
    - [37, 33.39]
  - - [2944, 6784, 1, 3328]
    - [13, 76.141]
  - - [128, 1, 1, 1408]
    - [3, 0.064]
  - - [704, 1408, 1, 3328]
    - [30, 52.855]
  - - [3584, 704, 1, 3328]
    - [9, 68.436]
  - - [2944, 256, 1, 128]
    - [43, 20.777]
  - - [6784, 4, 1, 1280]
    - [31, 6.389]
  - - [1024, 64, 1, 1280]
    - [15, 15.317]
  - - [8448, 4, 1, 2816]
    - [39, 9.985]
  - - [448, 4288, 1, 256]
    - [4, 40.612]
  - - [64, 3584, 1, 3328]
    - [7, 38.433]
  - - [704, 2368, 1, 1280]
    - [0, 56.41]
  - - [1856, 2368, 1, 1280]
    - [0, 63.917]
  - - [2368, 128, 1, 3328]
    - [36, 41.7]
  - - [64, 193600, 1, 64]
    - [4, 48.418]
  - - [1760, 128, 1, 1760]
    - [21, 25.644]
  - - [448, 1408, 1, 256]
    - [0, 28.695]
  - - [1856, 4288, 1, 1280]
    - [25, 68.877]
  - - [64, 5056, 1, 3328]
    - [30, 43.278]
  - - [512, 1500, 1, 2816]
    - [4, 50.897]
  - - [1024, 448, 1, 128]
    - [37, 16.207]
  - - [704, 4, 1, 1280]
    - [14, 1.33]
  - - [704, 256, 1, 128]
    - [26, 7.392]
  - - [256, 193600, 1, 64]
    - [41, 63.938]
  - - [704, 2944, 1, 128]
    - [43, 38.205]
  - - [1408, 1024, 1, 1280]
    - [27, 54.489]
  - - [704, 6784, 1, 256]
    - [4, 54.518]
  - - [6784, 704, 1, 256]
    - [18, 57.155]
  - - [5056, 1408, 1, 128]
    - [5, 54.021]
  - - [2048, 7000, 1, 2048]
    - [5, 76.981]
  - - [256, 3584, 1, 3328]
    - [36, 49.396]
  - - [5056, 704, 1, 256]
    - [11, 59.95]
  - - [128, 1408, 1, 128]
    - [26, 6.148]
  - - [3584, 4288, 1, 3328]
    - [13, 74.816]
  - - [5888, 1856, 1, 1280]
    - [8, 71.737]
  - - [256, 1408, 1, 256]
    - [44, 15.78]
  - - [5056, 64, 1, 1280]
    - [45, 35.77]
  - - [1024, 704, 1, 256]
    - [0, 30.891]
  - - [64, 256, 1, 128]
    - [46, 0.747]
  - - [2368, 3584, 1, 1280]
    - [41, 69.25]
  - - [1024, 256, 1, 256]
    - [26, 14.159]
  - - [1856, 4, 1, 1280]
    - [14, 2.859]
  - - [448, 448, 1, 256]
    - [26, 11.502]
  - - [2944, 3584, 1, 3328]
    - [8, 75.595]
  - - [7680, 32, 1, 2560]
    - [22, 36.796]
  - - [128, 4288, 1, 128]
    - [4, 19.477]
  - - [256, 256, 1, 3328]
    - [22, 24.921]
  - - [128, 1024, 1, 3328]
    - [7, 33.904]
  - - [4, 1408, 1, 3328]
    - [47, 3.56]
  - - [196, 256, 64, 1024]
    - [42, 47.28]
  - - [6784, 2944, 1, 256]
    - [5, 66.259]
  - - [64, 1856, 1, 1280]
    - [20, 21.487]
  - - [64, 1024, 1, 128]
    - [17, 3.275]
  - - [1024, 1500, 1, 2560]
    - [27, 56.263]
  - - [1856, 2368, 1, 256]
    - [0, 55.137]
  - - [3584, 256, 1, 128]
    - [0, 26.261]
  - - [3584, 6784, 1, 3328]
    - [8, 78.243]
  - - [256, 1024, 1, 256]
    - [24, 13.478]
  - - [4, 6784, 1, 3328]
    - [2, 5.237]
  - - [1024, 5888, 1, 3328]
    - [5, 73.166]
  - - [1024, 128, 1, 1280]
    - [48, 23.102]
  - - [3072, 32, 1, 1024]
    - [20, 18.46]
  - - [6144, 24000, 1, 2560]
    - [13, 79.182]
  - - [448, 1024, 1, 256]
    - [0, 22.132]
  - - [5056, 4288, 1, 1280]
    - [8, 74.567]
  - - [5888, 64, 1, 256]
    - [18, 18.282]
  - - [1856, 256, 1, 1280]
    - [48, 37.404]
  - - [64, 5888, 1, 3328]
    - [30, 42.27]
  - - [2368, 2368, 1, 1280]
    - [41, 66.213]
  - - [2944, 5888, 1, 128]
    - [9, 58.736]
  - - [704, 5888, 1, 1280]
    - [16, 60.93]
  - - [2368, 3584, 1, 128]
    - [41, 54.389]
  - - [1856, 5056, 1, 128]
    - [11, 56.992]
  - - [4608, 1, 1, 1536]
    - [39, 1.502]
  - - [448, 256, 1, 3328]
    - [7, 29.881]
  - - [2944, 6784, 1, 1280]
    - [11, 74.096]
  - - [448, 1856, 1, 128]
    - [4, 23.19]
  - - [128, 1024, 1, 128]
    - [17, 6.117]
  - - [7680, 4, 1, 2560]
    - [39, 9.774]
  - - [1024, 704, 1, 1280]
    - [4, 45.801]
  - - [128, 5888, 1, 256]
    - [18, 34.362]
  - - [1024, 5056, 1, 1280]
    - [11, 69.267]
  - - [4288, 1024, 1, 256]
    - [8, 57.241]
  - - [2944, 2368, 1, 128]
    - [11, 55.513]
  - - [704, 704, 1, 3328]
    - [49, 43.555]
  - - [704, 1408, 1, 1280]
    - [4, 42.584]
  - - [5888, 448, 1, 1280]
    - [8, 63.23]
  - - [3584, 256, 1, 3328]
    - [49, 48.479]
  - - [704, 5888, 1, 3328]
    - [50, 61.956]
  - - [704, 1856, 1, 128]
    - [4, 27.853]
  - - [128, 3584, 1, 3328]
    - [10, 42.757]
  - - [4, 4288, 1, 128]
    - [46, 0.76]
  - - [128, 704, 1, 1280]
    - [48, 18.147]
  - - [3584, 2944, 1, 256]
    - [13, 67.793]
  - - [1856, 128, 1, 3328]
    - [10, 39.702]
  - - [1856, 2368, 1, 3328]
    - [50, 63.073]
  - - [512, 6000, 1, 2816]
    - [18, 64.155]
  - - [2944, 448, 1, 128]
    - [0, 30.932]
  - - [64, 193600, 1, 256]
    - [51, 64.208]
  - - [128, 2944, 1, 1280]
    - [10, 36.257]
  - - [448, 2944, 1, 1280]
    - [4, 57.539]
  - - [512, 24000, 1, 2048]
    - [13, 75.619]
  - - [128, 256, 1, 3328]
    - [22, 16.094]
  - - [1408, 5056, 1, 3328]
    - [11, 74.164]
  - - [1856, 1856, 1, 3328]
    - [13, 69.995]
  - - [3584, 128, 1, 256]
    - [18, 22.398]
  - - [448, 1408, 1, 3328]
    - [49, 47.379]
  - - [2368, 2368, 1, 256]
    - [5, 51.27]
  - - [4288, 4288, 1, 1280]
    - [13, 74.354]
  - - [64, 448, 1, 1280]
    - [32, 8.889]
  - - [5888, 1024, 1, 1280]
    - [11, 70.442]
  - - [704, 1024, 1, 256]
    - [4, 31.04]
  - - [1024, 12544, 1, 256]
    - [13, 63.049]
  - - [448, 4, 1, 256]
    - [14, 0.184]
  - - [5888, 448, 1, 128]
    - [9, 47.042]
  - - [512, 48000, 1, 2560]
    - [11, 76.804]
  - - [8448, 16, 1, 2816]
    - [6, 30.05]
  - - [704, 6784, 1, 3328]
    - [13, 66.661]
  - - [5888, 5888, 1, 1280]
    - [11, 77.526]
  - - [5056, 1024, 1, 1280]
    - [5, 67.575]
  - - [448, 5888, 1, 3328]
    - [0, 63.793]
  - - [3072, 2, 1, 1024]
    - [34, 1.635]
  - - [1024, 2944, 1, 1280]
    - [18, 62.197]
  - - [5056, 5888, 1, 1280]
    - [13, 76.089]
  - - [4288, 5888, 1, 128]
    - [8, 65.394]
  - - [256, 3584, 1, 256]
    - [18, 32.539]
  - - [256, 4, 1, 1280]
    - [52, 0.405]
  - - [1408, 3584, 1, 128]
    - [11, 54.288]
  - - [256, 2944, 1, 3328]
    - [12, 48.351]
  - - [448, 3584, 1, 128]
    - [4, 29.226]
  - - [5888, 2944, 1, 1280]
    - [8, 73.923]
  - - [4, 6784, 1, 1280]
    - [53, 4.611]
  - - [2368, 5888, 1, 128]
    - [50, 51.287]
  - - [35, 8457, 1, 1760]
    - [54, 28.325]
  - - [64, 2944, 1, 128]
    - [26, 7.933]
  - - [2368, 4, 1, 256]
    - [55, 0.859]
  - - [3584, 5888, 1, 256]
    - [9, 67.435]
  - - [2368, 1024, 1, 128]
    - [0, 35.55]
  - - [2368, 704, 1, 128]
    - [4, 29.681]
  - - [512, 32, 1, 512]
    - [56, 2.954]
  - - [3584, 2368, 1, 128]
    - [5, 60.508]
  - - [5056, 704, 1, 128]
    - [11, 42.449]
  - - [448, 2368, 1, 128]
    - [4, 25.971]
  - - [4, 5056, 1, 256]
    - [17, 1.472]
  - - [5056, 1408, 1, 3328]
    - [11, 75.063]
  - - [1408, 704, 1, 256]
    - [18, 35.372]
  - - [6784, 1024, 1, 3328]
    - [13, 73.864]
  - - [6784, 2944, 1, 3328]
    - [13, 76.079]
  - - [7680, 1, 1, 2560]
    - [39, 2.288]
  - - [1856, 1856, 1, 256]
    - [5, 57.373]
  - - [64, 64, 1, 3328]
    - [57, 3.919]
  - - [512, 1, 1, 512]
    - [14, 0.102]
  - - [6784, 2368, 1, 1280]
    - [5, 76.564]
  - - [4608, 2, 1, 1536]
    - [39, 3.209]
  - - [4288, 3584, 1, 256]
    - [41, 62.622]
  - - [4288, 5888, 1, 1280]
    - [13, 75.488]
  - - [4608, 4, 1, 1536]
    - [58, 5.494]
  - - [1024, 6000, 1, 1536]
    - [42, 72.246]
  - - [8448, 32, 1, 2816]
    - [10, 41.585]
  - - [448, 2944, 1, 3328]
    - [0, 61.709]
  - - [4288, 1856, 1, 1280]
    - [13, 73.382]
  - - [1856, 2944, 1, 3328]
    - [5, 66.862]
  - - [256, 6784, 1, 3328]
    - [12, 67.601]
  - - [512, 3000, 1, 1536]
    - [28, 55.707]
  - - [64, 5888, 1, 256]
    - [0, 18.076]
  - - [256, 5056, 1, 128]
    - [37, 34.228]
  - - [5056, 1024, 1, 256]
    - [13, 61.428]
  - - [704, 64, 1, 3328]
    - [7, 21.245]
  - - [5056, 1856, 1, 3328]
    - [13, 73.244]
  - - [4, 2944, 1, 3328]
    - [47, 4.609]
  - - [512, 1500, 1, 2048]
    - [4, 49.692]
  - - [1024, 1, 1, 500000]
    - [52, 4.487]
  - - [256, 4, 1, 256]
    - [47, 0.094]
  - - [6784, 128, 1, 3328]
    - [4, 57.755]
  - - [4288, 1408, 1, 128]
    - [8, 54.466]
  - - [1856, 5888, 1, 3328]
    - [13, 72.655]
  - - [4288, 5056, 1, 256]
    - [5, 69.996]
  - - [1408, 128, 1, 1280]
    - [30, 27.188]
  - - [4096, 7000, 1, 4096]
    - [13, 78.318]
  - - [5056, 256, 1, 3328]
    - [18, 58.765]
  - - [704, 704, 1, 256]
    - [4, 21.934]
  - - [1024, 3000, 1, 2560]
    - [18, 65.417]
  - - [1024, 5888, 1, 1280]
    - [5, 71.193]
  - - [6784, 2368, 1, 128]
    - [13, 54.793]
  - - [4, 5056, 1, 1280]
    - [53, 3.998]
  - - [256, 64, 1, 1280]
    - [29, 5.866]
  - - [128, 1856, 1, 1280]
    - [21, 30.557]
  - - [1856, 1024, 1, 1280]
    - [37, 53.194]
  - - [6784, 4288, 1, 1280]
    - [42, 76.084]
  - - [1856, 1856, 1, 1280]
    - [9, 63.179]
  - - [35, 1500, 1, 2048]
    - [48, 14.831]
  - - [3072, 24000, 1, 1024]
    - [11, 78.6]
  - - [1408, 5056, 1, 1280]
    - [8, 72.101]
  - - [4, 2368, 1, 3328]
    - [47, 4.374]
  - - [5888, 1856, 1, 128]
    - [5, 58.644]
  - - [448, 704, 1, 1280]
    - [45, 34.023]
  - - [448, 6784, 1, 128]
    - [59, 40.094]
  - - [1024, 448, 1, 3328]
    - [10, 42.223]
  - - [2944, 128, 1, 256]
    - [18, 16.443]
  - - [5056, 3584, 1, 128]
    - [9, 62.385]
  - - [5888, 5888, 1, 3328]
    - [5, 77.991]
  - - [6784, 1024, 1, 256]
    - [11, 62.923]
  - - [2944, 2368, 1, 256]
    - [5, 55.228]
  - - [256, 448, 1, 256]
    - [17, 8.593]
  - - [5056, 5888, 1, 3328]
    - [13, 76.747]
  - - [1856, 1024, 1, 256]
    - [50, 41.154]
  - - [512, 48000, 1, 1536]
    - [9, 76.551]
  - - [3584, 448, 1, 1280]
    - [12, 58.894]
  - - [1024, 1024, 1, 1280]
    - [0, 46.976]
  - - [448, 5888, 1, 256]
    - [0, 53.048]
  - - [2048, 128, 1, 2048]
    - [21, 35.715]
  - - [1408, 6784, 1, 3328]
    - [42, 74.543]
  - - [448, 1024, 1, 128]
    - [0, 14.414]
  - - [4288, 704, 1, 128]
    - [59, 38.831]
  - - [128, 1856, 1, 128]
    - [26, 9.399]
  - - [448, 2368, 1, 3328]
    - [30, 51.88]
  - - [5056, 64, 1, 128]
    - [26, 11.27]
  - - [5056, 2944, 1, 256]
    - [41, 68.386]
  - - [6784, 5888, 1, 128]
    - [5, 69.551]
  - - [1024, 700, 1, 512]
    - [4, 37.911]
  - - [3072, 1, 1, 128]
    - [60, 0.149]
  - - [1024, 4, 1, 256]
    - [39, 0.373]
  - - [2944, 704, 1, 128]
    - [43, 37.389]
  - - [128, 6784, 1, 1280]
    - [12, 57.924]
  - - [1408, 3584, 1, 3328]
    - [5, 70.961]
  - - [2368, 6784, 1, 256]
    - [8, 62.811]
  - - [5056, 1408, 1, 1280]
    - [13, 71.318]
  - - [5056, 4288, 1, 128]
    - [41, 59.485]
  - - [4, 704, 1, 256]
    - [61, 0.284]
  - - [4288, 2368, 1, 3328]
    - [5, 72.495]
  - - [1408, 1856, 1, 128]
    - [11, 44.56]
  - - [1408, 5888, 1, 3328]
    - [9, 71.86]
  - - [1856, 256, 1, 256]
    - [0, 21.907]
  - - [6784, 6784, 1, 256]
    - [9, 74.251]
  - - [5888, 5056, 1, 128]
    - [13, 68.197]
  - - [4288, 2368, 1, 128]
    - [9, 59.971]
  - - [128, 5888, 1, 1280]
    - [12, 49.9]
  - - [256, 4288, 1, 1280]
    - [4, 46.187]
  - - [2368, 2944, 1, 256]
    - [9, 56.084]
  - - [4, 1856, 1, 256]
    - [62, 0.578]
  - - [3584, 1856, 1, 1280]
    - [11, 69.906]
  - - [6784, 6784, 1, 128]
    - [11, 66.244]
  - - [256, 1856, 1, 128]
    - [4, 14.429]
  - - [49, 512, 64, 2048]
    - [0, 42.213]
  - - [704, 64, 1, 1280]
    - [7, 11.798]
  - - [5888, 5056, 1, 256]
    - [13, 70.274]
  - - [8448, 48000, 1, 2816]
    - [13, 79.391]
  - - [512, 6000, 1, 2048]
    - [37, 63.151]
  - - [3584, 448, 1, 256]
    - [28, 46.59]
  - - [448, 4288, 1, 128]
    - [43, 34.915]
  - - [7680, 64, 1, 2560]
    - [36, 42.186]
  - - [256, 6784, 1, 256]
    - [11, 47.386]
  - - [1408, 4288, 1, 128]
    - [41, 53.022]
  - - [2944, 704, 1, 3328]
    - [37, 59.221]
  - - [128, 448, 1, 256]
    - [17, 4.961]
  - - [2048, 32, 1, 2048]
    - [22, 18.751]
  - - [3584, 3584, 1, 256]
    - [9, 63.71]
  - - [448, 1408, 1, 128]
    - [0, 20.635]
  - - [128, 256, 1, 1280]
    - [32, 9.226]
  - - [3584, 5056, 1, 256]
    - [5, 65.252]
  - - [6784, 128, 1, 256]
    - [27, 36.335]
  - - [4288, 4, 1, 256]
    - [61, 1.486]
  - - [64, 1408, 1, 3328]
    - [20, 28.562]
  - - [704, 448, 1, 256]
    - [18, 16.085]
  - - [2944, 2368, 1, 1280]
    - [11, 72.593]
  - - [448, 64, 1, 3328]
    - [14, 15.593]
  - - [704, 6784, 1, 128]
    - [25, 44.935]
  - - [3584, 4, 1, 3328]
    - [31, 8.504]
  - - [6784, 3584, 1, 256]
    - [11, 73.141]
  - - [704, 448, 1, 128]
    - [26, 10.525]
  - - [256, 128, 1, 128]
    - [17, 1.608]
  - - [704, 1408, 1, 128]
    - [0, 26.786]
  - - [4, 448, 1, 128]
    - [63, 0.084]
  - - [4288, 128, 1, 1280]
    - [30, 40.759]
  - - [128, 1408, 1, 256]
    - [26, 10.885]
  - - [4, 2944, 1, 256]
    - [46, 0.95]
  - - [64, 128, 1, 3328]
    - [14, 6.471]
  - - [1856, 1408, 1, 256]
    - [13, 48.616]
  - - [5056, 2368, 1, 128]
    - [13, 57.083]
  - - [2944, 2944, 1, 3328]
    - [13, 74.452]
  - - [5056, 6784, 1, 256]
    - [41, 71.019]
  - - [1856, 3584, 1, 128]
    - [50, 50.895]
  - - [5888, 4, 1, 1280]
    - [55, 5.475]
  - - [128, 2944, 1, 128]
    - [18, 10.567]
  - - [35, 8457, 1, 2560]
    - [54, 29.042]
  - - [3584, 6784, 1, 128]
    - [5, 62.683]
  - - [128, 4288, 1, 256]
    - [0, 24.376]
  - - [704, 448, 1, 3328]
    - [36, 42.871]
  - - [2368, 6784, 1, 1280]
    - [25, 73.622]
  - - [128, 128, 1, 3328]
    - [55, 10.905]
  - - [5056, 1856, 1, 256]
    - [11, 64.621]
  - - [256, 128, 1, 256]
    - [17, 2.617]
  - - [1024, 3000, 1, 2816]
    - [42, 61.432]
  - - [1024, 1856, 1, 256]
    - [0, 43.926]
  - - [64, 1, 1, 1216]
    - [14, 0.023]
  - - [4288, 64, 1, 128]
    - [17, 8.827]
  - - [256, 448, 1, 3328]
    - [7, 30.581]
  - - [1408, 6784, 1, 1280]
    - [13, 72.072]
  - - [3584, 3584, 1, 1280]
    - [5, 73.492]
  - - [7680, 24000, 1, 2560]
    - [13, 79.112]
  - - [64, 2368, 1, 1280]
    - [64, 25.267]
  - - [448, 2368, 1, 1280]
    - [37, 41.363]
  - - [4608, 48000, 1, 1536]
    - [9, 79.091]
  - - [5888, 5888, 1, 128]
    - [9, 64.286]
  - - [64, 6784, 1, 3328]
    - [49, 45.821]
  - - [2944, 256, 1, 1280]
    - [4, 48.592]
  - - [2048, 16, 1, 2048]
    - [32, 12.164]
  - - [256, 2368, 1, 128]
    - [0, 19.842]
  - - [5056, 2368, 1, 3328]
    - [13, 73.362]
  - - [2944, 4288, 1, 256]
    - [8, 66.871]
  - - [1408, 3584, 1, 1280]
    - [13, 66.167]
  - - [2368, 64, 1, 256]
    - [26, 9.332]
  - - [1024, 128, 1, 128]
    - [26, 4.949]
  - - [704, 128, 1, 3328]
    - [20, 29.18]
  - - [5888, 4, 1, 128]
    - [17, 0.988]
  - - [1856, 704, 1, 256]
    - [0, 42.9]
  - - [1024, 1500, 1, 2816]
    - [27, 55.545]
  - - [8448, 1, 1, 2816]
    - [39, 2.897]
  - - [1024, 4, 1, 3328]
    - [14, 3.454]
  - - [1024, 6000, 1, 2048]
    - [13, 73.124]
  - - [512, 24000, 1, 2560]
    - [8, 75.48]
  - - [6144, 3000, 1, 2560]
    - [13, 76.102]
  - - [2368, 6784, 1, 3328]
    - [13, 73.834]
  - - [1856, 1408, 1, 1280]
    - [5, 61.282]
  - - [1856, 448, 1, 1280]
    - [4, 51.992]
  - - [6784, 704, 1, 128]
    - [18, 47.963]
  - - [4, 4, 1, 256]
    - [57, 0.001]
  - - [128, 5888, 1, 128]
    - [4, 23.962]
  - - [5056, 2944, 1, 128]
    - [8, 52.706]
  - - [1408, 5888, 1, 256]
    - [13, 55.371]
  - - [704, 2944, 1, 1280]
    - [0, 53.916]
  - - [4288, 64, 1, 1280]
    - [10, 34.295]
  - - [256, 64, 1, 256]
    - [61, 1.575]
  - - [1024, 1024, 1, 256]
    - [37, 37.884]
  - - [704, 1856, 1, 256]
    - [4, 45.272]
  - - [2560, 64, 1, 2560]
    - [6, 35.293]
  - - [3584, 704, 1, 1280]
    - [5, 60.034]
  - - [256, 128, 1, 1280]
    - [32, 9.647]
  - - [5888, 2368, 1, 256]
    - [9, 63.506]
  - - [256, 2368, 1, 1280]
    - [0, 39.607]
  - - [2944, 6784, 1, 128]
    - [41, 58.121]
  - - [3584, 448, 1, 3328]
    - [12, 59.411]
  - - [1408, 4, 1, 256]
    - [29, 0.56]
  - - [704, 2368, 1, 3328]
    - [4, 57.662]
  - - [2944, 448, 1, 256]
    - [18, 39.355]
  - - [1856, 448, 1, 128]
    - [4, 25.86]
  - - [4608, 6000, 1, 1536]
    - [11, 76.979]
  - - [2368, 128, 1, 1280]
    - [45, 31.942]
  - - [256, 5888, 1, 128]
    - [18, 32.213]
  - - [64, 6784, 1, 256]
    - [4, 22.642]
  - - [64, 5056, 1, 1280]
    - [49, 34.84]
  - - [4, 6784, 1, 128]
    - [26, 1.274]
  - - [2944, 2944, 1, 1280]
    - [11, 73.167]
  - - [5056, 448, 1, 3328]
    - [5, 59.699]
  - - [4, 3584, 1, 1280]
    - [63, 3.131]
  - - [1408, 128, 1, 128]
    - [26, 6.831]
  - - [6784, 704, 1, 3328]
    - [11, 66.212]
  - - [128, 64, 1, 1280]
    - [3, 3.227]
  - - [2368, 256, 1, 1280]
    - [4, 40.943]
  - - [4, 448, 1, 3328]
    - [3, 1.302]
  - - [5888, 4288, 1, 128]
    - [9, 60.181]
  - - [4, 5888, 1, 256]
    - [17, 1.856]
  - - [1408, 2944, 1, 3328]
    - [11, 67.85]
  - - [3584, 704, 1, 128]
    - [11, 43.835]
  - - [64, 1024, 1, 256]
    - [17, 4.668]
  - - [2368, 448, 1, 1280]
    - [49, 42.83]
  - - [128, 3584, 1, 256]
    - [37, 21.009]
  - - [704, 448, 1, 1280]
    - [45, 34.578]
  - - [448, 5056, 1, 128]
    - [4, 34.078]
  - - [6144, 4, 1, 2560]
    - [65, 8.822]
  - - [5056, 3584, 1, 256]
    - [8, 66.743]
  - - [4288, 4288, 1, 256]
    - [13, 68.677]
  - - [1408, 5056, 1, 128]
    - [9, 54.704]
  - - [2944, 3584, 1, 128]
    - [9, 60.02]
  - - [3584, 2368, 1, 256]
    - [41, 55.855]
  - - [5888, 5056, 1, 1280]
    - [8, 75.301]
  - - [128, 1024, 1, 1280]
    - [48, 22.124]
  - - [8448, 24000, 1, 2816]
    - [13, 79.31]
  - - [64, 704, 1, 256]
    - [17, 3.695]
  - - [4288, 256, 1, 1280]
    - [49, 43.818]
  - - [3584, 3584, 1, 3328]
    - [8, 74.373]
  - - [704, 64, 1, 128]
    - [17, 2.056]
  - - [3072, 1500, 1, 128]
    - [50, 43.989]
  - - [2048, 3136, 1, 512]
    - [11, 61.506]
  - - [3025, 256, 64, 64]
    - [66, 55.117]
  - - [5888, 6784, 1, 256]
    - [13, 70.912]
  - - [4288, 2944, 1, 3328]
    - [13, 72.525]
  - - [2944, 64, 1, 128]
    - [26, 7.653]
  - - [1024, 128, 1, 3328]
    - [22, 33.733]
  - - [1024, 16, 1, 500000]
    - [67, 38.312]
  - - [4288, 128, 1, 3328]
    - [30, 49.66]
  - - [7680, 128, 1, 2560]
    - [49, 49.294]
  - - [256, 5056, 1, 1280]
    - [4, 56.552]
  - - [1408, 256, 1, 128]
    - [43, 11.511]
  - - [2944, 5888, 1, 3328]
    - [13, 75.154]
  - - [6784, 5888, 1, 1280]
    - [13, 77.49]
  - - [3072, 1, 1, 1024]
    - [55, 1.011]
  - - [704, 128, 1, 256]
    - [17, 7.34]
  - - [5888, 4288, 1, 1280]
    - [8, 74.994]
  - - [1024, 24000, 1, 2048]
    - [9, 76.21]
  - - [448, 256, 1, 1280]
    - [20, 20.228]
  - - [5888, 3584, 1, 128]
    - [11, 59.647]
  - - [64, 4288, 1, 3328]
    - [10, 42.38]
  - - [448, 4, 1, 1280]
    - [19, 0.783]
  - - [6784, 6784, 1, 3328]
    - [13, 77.653]
  - - [5056, 4, 1, 1280]
    - [65, 5.303]
  - - [4, 5888, 1, 3328]
    - [68, 5.124]
  - - [256, 1408, 1, 1280]
    - [21, 34.784]
  - - [3072, 16, 1, 1024]
    - [69, 11.707]
  - - [704, 3584, 1, 128]
    - [0, 38.784]
  - - [1024, 2, 1, 512]
    - [19, 0.391]
  - - [5888, 448, 1, 3328]
    - [11, 69.226]
  - - [2368, 4288, 1, 1280]
    - [5, 70.511]
  - - [4288, 2944, 1, 128]
    - [16, 49.799]
  - - [256, 64, 1, 3328]
    - [19, 11.275]
  - - [2944, 64, 1, 3328]
    - [36, 40.403]
  - - [6784, 64, 1, 3328]
    - [1, 49.815]
  - - [5056, 2944, 1, 3328]
    - [11, 75.061]
  - - [448, 128, 1, 256]
    - [61, 4.642]
  - - [2944, 3584, 1, 256]
    - [41, 60.245]
  - - [1408, 1408, 1, 3328]
    - [1, 58.474]
  - - [1856, 128, 1, 1280]
    - [21, 30.638]
  - - [3584, 3584, 1, 128]
    - [9, 53.982]
  - - [64, 3584, 1, 256]
    - [17, 11.636]
  - - [1408, 4, 1, 3328]
    - [19, 4.792]
  - - [128, 2944, 1, 3328]
    - [70, 43.68]
  - - [3584, 704, 1, 256]
    - [8, 50.855]
  - - [2944, 448, 1, 3328]
    - [18, 60.144]
  - - [1024, 2, 1, 500000]
    - [52, 8.837]
  - - [3584, 1408, 1, 3328]
    - [13, 69.008]
  - - [704, 3584, 1, 1280]
    - [4, 57.554]
  - - [1024, 1408, 1, 128]
    - [28, 33.934]
  - - [1856, 6784, 1, 256]
    - [25, 66.449]
  - - [4288, 448, 1, 3328]
    - [18, 55.733]
  - - [6784, 4288, 1, 128]
    - [66, 66.951]
  - - [6784, 704, 1, 1280]
    - [11, 62.874]
  - - [6144, 1, 1, 2560]
    - [39, 2.468]
  - - [3584, 6784, 1, 256]
    - [5, 68.761]
  - - [6144, 16, 1, 2560]
    - [60, 26.649]
  - - [3584, 64, 1, 128]
    - [26, 8.569]
  - - [5888, 1024, 1, 3328]
    - [13, 71.395]
  - - [448, 64, 1, 128]
    - [17, 1.423]
  - - [704, 6784, 1, 1280]
    - [13, 64.319]
  - - [4, 448, 1, 256]
    - [40, 0.181]
  - - [196, 1024, 64, 256]
    - [42, 47.864]
  - - [5888, 128, 1, 256]
    - [37, 35.02]
  - - [4096, 16, 1, 4096]
    - [60, 27.682]
  - - [1856, 5056, 1, 3328]
    - [11, 72.269]
  - - [4, 6784, 1, 256]
    - [17, 2.082]
  - - [1024, 3584, 1, 128]
    - [18, 43.545]
  - - [64, 704, 1, 3328]
    - [22, 21.894]
  - - [2368, 2944, 1, 128]
    - [9, 56.775]
  - - [5056, 64, 1, 256]
    - [37, 16.616]
  - - [512, 1500, 1, 1536]
    - [12, 45.973]
  - - [512, 1, 1, 500000]
    - [52, 3.943]
  - - [5888, 2944, 1, 3328]
    - [11, 75.636]
  - - [128, 3584, 1, 1280]
    - [10, 37.051]
  - - [1024, 704, 1, 128]
    - [4, 23.2]
  - - [1408, 2368, 1, 128]
    - [13, 45.079]
  - - [5888, 2368, 1, 128]
    - [11, 58.364]
  - - [128, 5056, 1, 3328]
    - [1, 48.621]
  - - [3584, 6784, 1, 1280]
    - [8, 77.405]
  - - [4288, 1856, 1, 256]
    - [41, 58.285]
  - - [1856, 5888, 1, 256]
    - [9, 62.321]
  - - [256, 256, 1, 256]
    - [17, 5.876]
  - - [4288, 4288, 1, 3328]
    - [5, 75.523]
  - - [1024, 1024, 1, 128]
    - [0, 29.612]
  - - [4288, 1408, 1, 1280]
    - [11, 68.795]
  - - [3584, 5056, 1, 128]
    - [13, 64.174]
  - - [4, 1024, 1, 3328]
    - [3, 2.654]
  - - [4, 704, 1, 128]
    - [17, 0.144]
  - - [4288, 2368, 1, 256]
    - [9, 58.654]
  - - [2944, 5056, 1, 1280]
    - [9, 73.463]
  - - [448, 6784, 1, 256]
    - [4, 50.112]
  - - [64, 128, 1, 128]
    - [17, 0.355]
  - - [1856, 2368, 1, 128]
    - [50, 45.653]
  - - [6784, 2368, 1, 3328]
    - [11, 76.923]
  - - [1408, 6784, 1, 128]
    - [13, 58.621]
  - - [256, 1024, 1, 1280]
    - [21, 32.326]
  - - [704, 4, 1, 128]
    - [39, 0.154]
  - - [1408, 4, 1, 128]
    - [58, 0.313]
  - - [4288, 128, 1, 256]
    - [0, 25.81]
  - - [4288, 1856, 1, 3328]
    - [42, 74.12]
  - - [3584, 448, 1, 128]
    - [0, 36.015]
  - - [64, 4288, 1, 128]
    - [26, 9.699]
  - - [64, 448, 1, 3328]
    - [22, 15.463]
  - - [448, 4, 1, 3328]
    - [39, 1.941]
  - - [256, 4, 1, 3328]
    - [57, 1.101]
  - - [4, 1408, 1, 1280]
    - [71, 1.911]
  - - [3584, 64, 1, 1280]
    - [7, 30.151]
  - - [1408, 448, 1, 128]
    - [0, 21.49]
  - - [3584, 1024, 1, 1280]
    - [18, 61.012]
  - - [1856, 5056, 1, 256]
    - [8, 57.01]
  - - [4, 3584, 1, 256]
    - [17, 1.235]
  - - [6784, 4288, 1, 3328]
    - [13, 76.878]
  - - [4, 2944, 1, 1280]
    - [53, 3.088]
  - - [1024, 4288, 1, 256]
    - [11, 59.024]
  - - [5888, 3584, 1, 3328]
    - [13, 76.343]
  - - [1856, 4, 1, 256]
    - [29, 0.681]
  - - [4, 256, 1, 256]
    - [29, 0.106]
  - - [5056, 3584, 1, 3328]
    - [13, 74.514]
  - - [1408, 128, 1, 3328]
    - [30, 38.845]
  - - [4, 64, 1, 1280]
    - [47, 0.108]
  - - [2368, 1408, 1, 1280]
    - [8, 65.366]
  - - [5056, 2944, 1, 1280]
    - [13, 73.549]
  - - [8448, 6000, 1, 2816]
    - [13, 77.891]
  - - [4, 4, 1, 128]
    - [3, 0.001]
  - - [3584, 256, 1, 256]
    - [18, 34.495]
  - - [3584, 2944, 1, 1280]
    - [13, 72.587]
  - - [1024, 6784, 1, 256]
    - [11, 55.699]
  - - [4, 128, 1, 256]
    - [19, 0.051]
  - - [6784, 448, 1, 256]
    - [0, 49.663]
  - - [5124, 9124, 1, 2048]
    - [13, 75.592]
  - - [2944, 5056, 1, 3328]
    - [5, 75.5]
  - - [6784, 4, 1, 128]
    - [58, 0.977]
  - - [2944, 1408, 1, 128]
    - [8, 47.509]
  - - [448, 128, 1, 3328]
    - [60, 23.462]
  - - [64, 2944, 1, 3328]
    - [30, 40.392]
  - - [5056, 6784, 1, 3328]
    - [13, 76.866]
  - - [704, 2368, 1, 128]
    - [4, 37.131]
  - - [3072, 1500, 1, 1024]
    - [42, 62.877]
  - - [128, 2944, 1, 256]
    - [18, 18.175]
  - - [3136, 512, 1, 2048]
    - [27, 60.844]
  - - [128, 6784, 1, 128]
    - [0, 28.498]
  - - [3584, 4288, 1, 256]
    - [13, 63.372]
  - - [448, 1856, 1, 256]
    - [0, 37.714]
  - - [1856, 6784, 1, 3328]
    - [25, 73.184]
  - - [3584, 128, 1, 3328]
    - [21, 43.561]
  - - [64, 1856, 1, 256]
    - [17, 8.093]
  - - [64, 448, 1, 256]
    - [17, 2.54]
  - - [5888, 4288, 1, 256]
    - [13, 68.886]
  - - [128, 1500, 1, 1280]
    - [30, 28.988]
  - - [5056, 1408, 1, 256]
    - [25, 61.874]
  - - [35, 8457, 1, 4096]
    - [54, 33.298]
  - - [64, 256, 1, 1280]
    - [56, 6.389]
  - - [2944, 4, 1, 128]
    - [17, 0.608]
  - - [3584, 1024, 1, 256]
    - [18, 55.812]
  - - [512, 6000, 1, 1536]
    - [18, 61.009]
  - - [256, 704, 1, 256]
    - [26, 11.649]
  - - [5888, 5888, 1, 256]
    - [8, 72.333]
  - - [4288, 1024, 1, 1280]
    - [9, 66.366]
  - - [5888, 128, 1, 3328]
    - [12, 49.376]
  - - [448, 6784, 1, 3328]
    - [0, 61.378]
  - - [2944, 1408, 1, 1280]
    - [11, 66.716]
  - - [3072, 6000, 1, 1024]
    - [42, 74.402]
  - - [1024, 32, 1, 512]
    - [61, 5.16]
  - - [2944, 1856, 1, 3328]
    - [11, 66.646]
  - - [2368, 64, 1, 128]
    - [17, 6.67]
  - - [256, 1024, 1, 128]
    - [26, 9.696]
  - - [3584, 5888, 1, 1280]
    - [11, 76.072]
  - - [64, 4, 1, 128]
    - [39, 0.013]
  - - [6784, 1856, 1, 1280]
    - [8, 76.128]
  - - [2944, 5056, 1, 256]
    - [13, 64.153]
  - - [5888, 256, 1, 3328]
    - [12, 57.456]
  - - [2944, 4288, 1, 128]
    - [8, 60.536]
  - - [3584, 1408, 1, 256]
    - [5, 58.991]
  - - [704, 3584, 1, 3328]
    - [4, 61.763]
  - - [5056, 448, 1, 1280]
    - [5, 55.901]
  - - [3584, 1856, 1, 3328]
    - [5, 70.828]
  - - [64, 1408, 1, 128]
    - [17, 4.556]
  - - [4288, 6784, 1, 1280]
    - [11, 75.66]
  - - [1024, 3000, 1, 2048]
    - [37, 63.173]
  - - [1408, 704, 1, 1280]
    - [37, 45.886]
  - - [2944, 1024, 1, 256]
    - [13, 49.305]
  - - [256, 64, 1, 128]
    - [72, 0.737]
  - - [2368, 4288, 1, 3328]
    - [11, 72.083]
  - - [4, 1408, 1, 256]
    - [46, 0.531]
  - - [1024, 1408, 1, 1280]
    - [27, 52.577]
  - - [64, 64, 1, 256]
    - [14, 0.409]
  - - [704, 256, 1, 3328]
    - [36, 37.947]
  - - [6784, 5056, 1, 256]
    - [11, 70.755]
  - - [1856, 1856, 1, 128]
    - [13, 45.718]
  - - [4288, 5888, 1, 256]
    - [8, 70.712]
  - - [4, 704, 1, 3328]
    - [47, 2.246]
  - - [35, 8457, 1, 2048]
    - [54, 30.034]
  - - [448, 2944, 1, 256]
    - [4, 45.629]
  - - [4, 4288, 1, 3328]
    - [47, 5.031]
  - - [2944, 6784, 1, 256]
    - [5, 67.215]
  - - [2944, 2944, 1, 128]
    - [11, 61.488]
  - - [4, 4, 1, 1280]
    - [3, 0.007]
  - - [1856, 3584, 1, 1280]
    - [5, 68.982]
  - - [64, 2944, 1, 256]
    - [26, 11.781]
  - - [3584, 1408, 1, 1280]
    - [13, 66.303]
  - - [448, 256, 1, 128]
    - [17, 4.272]
  - - [4288, 448, 1, 128]
    - [4, 34.655]
  - - [5056, 256, 1, 1280]
    - [37, 53.643]
  - - [1856, 1408, 1, 3328]
    - [11, 66.947]
  - - [128, 128, 1, 128]
    - [17, 0.792]
  - - [1024, 4288, 1, 3328]
    - [13, 71.193]
  - - [448, 2368, 1, 256]
    - [4, 35.399]
  - - [1024, 4, 1, 128]
    - [56, 0.206]
  - - [64, 1408, 1, 1280]
    - [20, 19.475]
  - - [64, 6784, 1, 1280]
    - [4, 40.027]
  - - [5056, 448, 1, 256]
    - [11, 48.642]
  - - [2944, 2368, 1, 3328]
    - [9, 72.308]
  - - [704, 4288, 1, 3328]
    - [0, 61.793]
  - - [1408, 128, 1, 256]
    - [26, 10.924]
  - - [1024, 1856, 1, 1280]
    - [18, 49.695]
  - - [6784, 1856, 1, 256]
    - [9, 64.042]
  - - [512, 48000, 1, 2816]
    - [11, 76.955]
  - - [512, 3000, 1, 2816]
    - [27, 56.826]
  - - [128, 2368, 1, 3328]
    - [36, 41.169]
  - - [1024, 5888, 1, 256]
    - [5, 60.759]
  - - [64, 2944, 1, 1280]
    - [30, 28.895]
  - - [6784, 1408, 1, 256]
    - [8, 60.304]
  - - [5056, 64, 1, 3328]
    - [36, 44.069]
  - - [128, 704, 1, 128]
    - [17, 4.211]
  - - [1408, 2368, 1, 256]
    - [42, 54.431]
  - - [1408, 1408, 1, 256]
    - [4, 47.008]
  - - [4, 64, 1, 128]
    - [39, 0.014]
  - - [64, 128, 1, 1280]
    - [14, 3.551]
  - - [1024, 8, 1, 500000]
    - [73, 30.945]
  - - [4, 2368, 1, 128]
    - [74, 0.4]
  - - [2368, 2368, 1, 128]
    - [0, 53.53]
  - - [64, 5888, 1, 128]
    - [26, 11.655]
  - - [5888, 4, 1, 3328]
    - [39, 9.259]
  - - [6784, 1408, 1, 128]
    - [8, 59.306]
  - - [1408, 5056, 1, 256]
    - [11, 56.702]
  - - [512, 50176, 1, 128]
    - [11, 59.745]
  - - [5056, 128, 1, 3328]
    - [1, 50.109]
  - - [128, 128, 1, 1280]
    - [29, 6.335]
  - - [512, 2, 1, 512]
    - [19, 0.216]
  - - [448, 704, 1, 256]
    - [18, 15.827]
  - - [4288, 3584, 1, 128]
    - [11, 59.862]
  - - [2944, 128, 1, 3328]
    - [70, 44.733]
  - - [128, 5056, 1, 1280]
    - [4, 42.785]
  - - [3584, 5056, 1, 1280]
    - [11, 73.461]
  - - [256, 448, 1, 1280]
    - [7, 19.887]
  - - [704, 704, 1, 128]
    - [4, 17.148]
  - - [5056, 4, 1, 128]
    - [17, 0.989]
  - - [704, 256, 1, 1280]
    - [36, 27.805]
  - - [64, 2368, 1, 3328]
    - [6, 37.153]
  - - [1856, 1024, 1, 128]
    - [4, 36.017]
  - - [1856, 64, 1, 128]
    - [17, 4.702]
  - - [4096, 64, 1, 4096]
    - [10, 41.307]
  - - [1024, 24000, 1, 1536]
    - [11, 75.315]
  - - [704, 4288, 1, 256]
    - [0, 49.685]
  - - [5888, 2368, 1, 1280]
    - [9, 73.332]
  - - [6784, 1856, 1, 3328]
    - [13, 76.794]
  - - [64, 128, 1, 256]
    - [56, 0.827]
  - - [2368, 5888, 1, 1280]
    - [11, 72.791]
  - - [5888, 256, 1, 1280]
    - [27, 51.515]
  - - [4, 5888, 1, 1280]
    - [53, 4.654]
  - - [704, 128, 1, 128]
    - [17, 3.458]
  - - [1024, 4, 1, 1280]
    - [14, 1.815]
  - - [2368, 1856, 1, 3328]
    - [50, 64.425]
  - - [2368, 128, 1, 128]
    - [17, 10.587]
  - - [2944, 704, 1, 256]
    - [0, 42.092]
  - - [5056, 128, 1, 128]
    - [0, 19.074]
  - - [2368, 1024, 1, 3328]
    - [9, 63.484]
  - - [35, 700, 1, 2048]
    - [60, 8.753]
  - - [256, 704, 1, 3328]
    - [36, 37.247]
  - - [704, 3584, 1, 256]
    - [25, 47.657]
  - - [1024, 1024, 1, 1024]
    - [37, 47.606]
  - - [704, 2944, 1, 3328]
    - [4, 57.971]
  - - [6784, 1024, 1, 128]
    - [9, 58.413]
  - - [256, 448, 1, 128]
    - [17, 5.272]
  - - [448, 1024, 1, 3328]
    - [36, 42.13]
  - - [2944, 1024, 1, 3328]
    - [18, 63.291]
  - - [2944, 5056, 1, 128]
    - [13, 55.099]
  - - [2368, 256, 1, 256]
    - [0, 28.265]
  - - [1408, 6784, 1, 256]
    - [8, 61.952]
  - - [6784, 1408, 1, 3328]
    - [13, 73.854]
  - - [4288, 6784, 1, 128]
    - [5, 64.027]
  - - [1408, 2944, 1, 128]
    - [9, 47.125]
  - - [704, 64, 1, 256]
    - [17, 3.672]
  - - [3072, 4, 1, 1024]
    - [55, 3.486]
  - - [256, 2368, 1, 3328]
    - [1, 45.502]
  - - [6784, 2944, 1, 1280]
    - [8, 75.144]
  - - [4288, 1856, 1, 128]
    - [42, 55.831]
  - - [1856, 2944, 1, 128]
    - [50, 48.096]
  - - [6784, 448, 1, 128]
    - [0, 40.83]
  - - [64, 3584, 1, 128]
    - [26, 8.933]
  - - [448, 5056, 1, 1280]
    - [11, 53.872]
  - - [4288, 5056, 1, 1280]
    - [41, 73.866]
  - - [2368, 1856, 1, 128]
    - [75, 45.463]
  - - [128, 448, 1, 1280]
    - [7, 14.076]
  - - [4288, 704, 1, 256]
    - [4, 50.714]
  - - [256, 3584, 1, 128]
    - [0, 23.046]
  - - [5888, 704, 1, 256]
    - [8, 55.619]
  - - [3584, 1024, 1, 128]
    - [37, 43.95]
  - - [256, 5888, 1, 3328]
    - [12, 57.536]
  - - [1408, 4288, 1, 3328]
    - [11, 72.219]
  - - [6784, 4288, 1, 256]
    - [9, 71.272]
  - - [4288, 256, 1, 128]
    - [0, 29.821]
  - - [448, 1856, 1, 3328]
    - [0, 51.959]
  - - [5888, 256, 1, 256]
    - [28, 43.734]
  - - [1024, 4, 1, 500000]
    - [52, 17.416]
  - - [6784, 1024, 1, 1280]
    - [5, 70.624]
  - - [5888, 1024, 1, 128]
    - [11, 55.332]
  - - [1024, 128, 1, 256]
    - [26, 8.04]
  - - [512, 16, 1, 500000]
    - [67, 34.526]
  - - [128, 64, 1, 3328]
    - [57, 7.21]
  - - [448, 64, 1, 256]
    - [35, 2.613]
  - - [2368, 256, 1, 128]
    - [0, 19.625]
  - - [6784, 3584, 1, 1280]
    - [8, 76.602]
  - - [1024, 6784, 1, 1280]
    - [11, 71.178]
  - - [2944, 64, 1, 1280]
    - [30, 29.045]
  - - [1408, 2944, 1, 1280]
    - [5, 63.96]
  - - [256, 1856, 1, 256]
    - [4, 22.176]
  - - [1408, 2368, 1, 3328]
    - [11, 67.245]
  - - [2944, 4, 1, 3328]
    - [55, 7.265]
  - - [128, 1408, 1, 3328]
    - [30, 39.204]
  - - [2944, 1856, 1, 128]
    - [5, 49.926]
  - - [256, 2944, 1, 128]
    - [0, 21.251]
  - - [3136, 2048, 1, 512]
    - [13, 60.585]
  - - [256, 6784, 1, 128]
    - [28, 38.147]
  - - [2368, 4, 1, 128]
    - [17, 0.458]
  - - [1408, 256, 1, 3328]
    - [1, 42.973]
  - - [1856, 4, 1, 128]
    - [61, 0.329]
  - - [1024, 16, 1, 512]
    - [56, 2.575]
  - - [5056, 6784, 1, 128]
    - [13, 64.0]
  - - [4288, 5056, 1, 128]
    - [11, 58.825]
  - - [1856, 5888, 1, 128]
    - [5, 54.003]
  - - [7680, 2, 1, 2560]
    - [65, 5.143]
  - - [3584, 1856, 1, 256]
    - [5, 56.096]
  - - [4288, 3584, 1, 1280]
    - [11, 72.491]
  - - [2368, 448, 1, 256]
    - [0, 38.351]
  - - [4288, 256, 1, 3328]
    - [1, 53.653]
  - - [1856, 704, 1, 128]
    - [4, 35.298]
  - - [1408, 64, 1, 256]
    - [17, 7.277]
  - - [64, 1856, 1, 128]
    - [17, 5.396]
  - - [4, 256, 1, 128]
    - [17, 0.049]
  - - [512, 16, 1, 512]
    - [2, 1.733]
  - - [704, 5888, 1, 128]
    - [4, 43.653]
  - - [6784, 3584, 1, 128]
    - [9, 60.481]
  - - [1024, 64, 1, 256]
    - [17, 5.198]
  - - [64, 2368, 1, 256]
    - [26, 9.939]
  - - [5124, 1500, 1, 2048]
    - [42, 69.989]
  - - [4288, 5056, 1, 3328]
    - [9, 75.435]
  - - [4, 1856, 1, 1280]
    - [71, 2.131]
  - - [4288, 128, 1, 128]
    - [4, 19.254]
  - - [512, 2, 1, 500000]
    - [52, 7.852]
  - - [1408, 1408, 1, 128]
    - [4, 39.131]
  - - [7680, 16, 1, 2560]
    - [6, 26.633]
  - - [1856, 128, 1, 128]
    - [26, 7.763]
  - - [5056, 2368, 1, 256]
    - [5, 61.269]
  - - [4288, 704, 1, 3328]
    - [18, 63.137]
  - - [448, 3584, 1, 256]
    - [4, 39.804]
  - - [2368, 64, 1, 1280]
    - [48, 25.577]
  - - [2368, 1024, 1, 1280]
    - [5, 58.814]
  - - [2944, 1408, 1, 3328]
    - [13, 67.657]
  - - [6144, 1500, 1, 2560]
    - [13, 71.418]
  - - [4224, 1, 1, 128]
    - [17, 0.191]
  - - [1024, 1408, 1, 3328]
    - [12, 55.524]
  - - [2944, 5888, 1, 1280]
    - [9, 74.147]
  - - [8448, 2, 1, 2816]
    - [39, 5.617]
  - - [1408, 4, 1, 1280]
    - [39, 2.226]
  - - [5888, 3584, 1, 256]
    - [9, 67.22]
  - - [2368, 5056, 1, 128]
    - [41, 51.745]
  - - [1408, 1856, 1, 3328]
    - [8, 68.649]
  - - [4, 4, 1, 3328]
    - [57, 0.014]
  - - [5888, 5056, 1, 3328]
    - [13, 76.765]
  - - [7680, 6000, 1, 2560]
    - [13, 77.532]
  - - [6784, 1408, 1, 1280]
    - [9, 71.674]
  - - [4, 1024, 1, 1280]
    - [2, 1.507]
  - - [512, 3000, 1, 2560]
    - [27, 57.419]
  - - [704, 2944, 1, 256]
    - [0, 44.599]
  - - [4288, 64, 1, 256]
    - [37, 14.42]
  - - [6784, 5888, 1, 3328]
    - [13, 77.842]
  - - [2368, 4288, 1, 128]
    - [41, 56.48]
  - - [64, 4288, 1, 1280]
    - [10, 33.643]
  - - [6784, 64, 1, 1280]
    - [23, 39.52]
  - - [3584, 128, 1, 128]
    - [37, 16.655]
  - - [1024, 6784, 1, 128]
    - [9, 54.638]
  - - [1024, 1500, 1, 1536]
    - [12, 53.965]
  - - [1408, 64, 1, 3328]
    - [20, 29.098]
  - - [6784, 4, 1, 256]
    - [17, 1.907]
  - - [1408, 1408, 1, 1280]
    - [37, 52.742]
  - - [256, 2368, 1, 256]
    - [4, 26.062]
  - - [3072, 3000, 1, 1024]
    - [13, 68.234]
  - - [448, 4288, 1, 3328]
    - [0, 54.543]
  - - [2368, 1408, 1, 256]
    - [8, 52.008]
  - - [704, 2368, 1, 256]
    - [0, 41.054]
  - - [1024, 24000, 1, 2560]
    - [9, 76.666]
  - - [2944, 448, 1, 1280]
    - [18, 57.083]
  - - [5888, 2368, 1, 3328]
    - [13, 75.171]
  - - [1024, 256, 1, 128]
    - [17, 8.147]
  - - [5124, 9124, 1, 1760]
    - [11, 75.505]
  - - [448, 1408, 1, 1280]
    - [4, 41.698]
  - - [448, 1856, 1, 1280]
    - [4, 52.943]
  - - [4288, 448, 1, 1280]
    - [37, 50.002]
  - - [5888, 704, 1, 3328]
    - [11, 66.98]
  - - [4, 1856, 1, 128]
    - [17, 0.371]
  - - [5056, 256, 1, 128]
    - [4, 31.842]
  - - [1856, 256, 1, 128]
    - [4, 16.812]
  - - [128, 2368, 1, 256]
    - [37, 15.42]
  - - [704, 4, 1, 256]
    - [39, 0.299]
  - - [1024, 6784, 1, 3328]
    - [13, 72.811]
  - - [1408, 5888, 1, 128]
    - [13, 56.035]
  - - [4288, 4, 1, 128]
    - [17, 0.868]
  - - [512, 3136, 1, 2048]
    - [28, 57.618]
  - - [1408, 1024, 1, 256]
    - [28, 42.759]
  - - [128, 64, 1, 256]
    - [2, 0.845]
  - - [8448, 1500, 1, 2816]
    - [9, 72.415]
  - - [256, 704, 1, 128]
    - [17, 7.637]
  - - [2560, 7000, 1, 2560]
    - [13, 77.591]
  - - [5888, 64, 1, 1280]
    - [10, 36.744]
  - - [128, 4, 1, 3328]
    - [3, 0.442]
  - - [5056, 6784, 1, 1280]
    - [5, 76.522]
  - - [1024, 448, 1, 1280]
    - [48, 36.691]
  - - [704, 5056, 1, 3328]
    - [25, 67.007]
  - - [128, 5056, 1, 256]
    - [4, 30.499]
  - - [3584, 5056, 1, 3328]
    - [13, 75.026]
  - - [1856, 4, 1, 3328]
    - [39, 5.427]
  - - [4, 2944, 1, 128]
    - [46, 0.476]
  - - [2368, 2944, 1, 3328]
    - [13, 72.439]
  - - [448, 448, 1, 1280]
    - [30, 27.507]
  - - [128, 4, 1, 128]
    - [39, 0.023]
  - - [2368, 3584, 1, 256]
    - [8, 57.934]
  - - [4608, 3000, 1, 1536]
    - [11, 74.128]
  - - [1024, 256, 1, 1280]
    - [10, 32.709]
  - - [5056, 3584, 1, 1280]
    - [8, 74.255]
  - - [5124, 9124, 1, 4096]
    - [5, 75.87]
  - - [7680, 48000, 1, 2560]
    - [13, 79.178]
  - - [1856, 704, 1, 1280]
    - [37, 49.543]
  - - [1856, 2944, 1, 1280]
    - [9, 62.927]
  - - [4608, 1500, 1, 1536]
    - [11, 70.264]
  - - [1024, 48000, 1, 2816]
    - [13, 78.219]
  - - [5124, 9124, 1, 2560]
    - [13, 75.775]
  - - [128, 1024, 1, 256]
    - [26, 8.052]
  - - [2944, 1408, 1, 256]
    - [9, 55.07]
  - - [4288, 1408, 1, 3328]
    - [9, 71.076]
  - - [784, 512, 64, 128]
    - [16, 55.396]
  - - [3584, 64, 1, 3328]
    - [7, 38.464]
  - - [5888, 2944, 1, 128]
    - [8, 54.912]
  - - [2944, 1024, 1, 128]
    - [4, 40.539]
  - - [128, 1, 1, 1024]
    - [3, 0.042]
  - - [5124, 700, 1, 2048]
    - [18, 58.099]
  - - [4, 4288, 1, 1280]
    - [53, 3.615]
  - - [6784, 5056, 1, 128]
    - [8, 64.09]
  - - [256, 1024, 1, 3328]
    - [10, 42.349]
  - - [3584, 4, 1, 256]
    - [56, 1.084]
  - - [1856, 64, 1, 3328]
    - [7, 32.116]
  - - [4, 128, 1, 3328]
    - [57, 0.455]
  - - [256, 12544, 1, 1024]
    - [8, 60.824]
  - - [5888, 1408, 1, 3328]
    - [11, 70.888]
  - - [448, 2944, 1, 128]
    - [11, 24.775]
  - - [2368, 1856, 1, 256]
    - [50, 55.287]
  - - [256, 5056, 1, 256]
    - [0, 38.183]
  - - [5056, 5056, 1, 128]
    - [8, 59.304]
  - - [448, 3584, 1, 3328]
    - [4, 55.95]
  - - [4, 5056, 1, 3328]
    - [20, 4.889]
  - - [256, 256, 1, 128]
    - [17, 3.095]
  - - [5888, 256, 1, 128]
    - [11, 32.439]
  - - [4, 5056, 1, 128]
    - [17, 0.771]
  - - [448, 256, 1, 256]
    - [17, 7.152]
  - - [704, 4, 1, 3328]
    - [39, 2.458]
  - - [1408, 256, 1, 256]
    - [18, 16.692]
  - - [3584, 1856, 1, 128]
    - [5, 53.036]
  - - [4288, 4288, 1, 128]
    - [11, 59.083]
  - - [1856, 1024, 1, 3328]
    - [1, 56.063]
  - - [1856, 4288, 1, 128]
    - [50, 55.668]
  - - [1024, 6000, 1, 2560]
    - [5, 72.207]
  - - [1024, 5056, 1, 256]
    - [13, 59.947]
  - - [5056, 5888, 1, 128]
    - [16, 61.624]
  - - [2368, 1408, 1, 3328]
    - [41, 66.471]
  - - [1024, 48000, 1, 1536]
    - [11, 77.715]
  - - [5888, 448, 1, 256]
    - [11, 52.703]
  - - [5888, 6784, 1, 128]
    - [9, 67.19]
  - - [2368, 4, 1, 3328]
    - [55, 6.204]
  - - [6784, 5056, 1, 1280]
    - [5, 76.383]
  - - [5056, 704, 1, 1280]
    - [11, 66.332]
  - - [1024, 48000, 1, 2560]
    - [13, 78.117]
  - - [4608, 32, 1, 1536]
    - [6, 28.219]
  - - [1024, 2368, 1, 128]
    - [11, 39.546]
  - - [128, 704, 1, 256]
    - [17, 7.192]
  - - [2368, 448, 1, 3328]
    - [1, 52.508]
  - - [128, 5888, 1, 3328]
    - [49, 48.992]
  - - [448, 128, 1, 1280]
    - [32, 14.185]
  - - [6784, 4, 1, 3328]
    - [39, 9.749]
  - - [4288, 4, 1, 1280]
    - [39, 4.775]
  - - [1024, 64, 1, 3328]
    - [22, 25.091]
  - - [3072, 48000, 1, 1024]
    - [8, 78.716]
  - - [256, 4, 1, 128]
    - [33, 0.046]
  - - [1024, 5888, 1, 128]
    - [41, 52.339]
  - - [3584, 5888, 1, 128]
    - [9, 57.538]
  - - [5056, 5888, 1, 256]
    - [8, 69.085]
  - - [2368, 1024, 1, 256]
    - [13, 46.51]
  - - [2944, 1856, 1, 256]
    - [41, 50.534]
  - - [1856, 6784, 1, 1280]
    - [25, 71.361]
  - - [64, 5056, 1, 128]
    - [43, 10.242]
  - - [64, 6784, 1, 128]
    - [76, 13.716]
  - - [448, 704, 1, 128]
    - [26, 9.719]
  - - [4, 1024, 1, 128]
    - [77, 0.191]
  - - [1408, 448, 1, 256]
    - [37, 26.886]
  - - [1408, 704, 1, 128]
    - [0, 25.45]
  - - [64, 256, 1, 3328]
    - [14, 10.375]
  - - [8448, 3000, 1, 2816]
    - [42, 76.339]
  - - [6784, 448, 1, 3328]
    - [18, 63.78]
  - - [5056, 1856, 1, 1280]
    - [13, 70.437]
  - - [1408, 1024, 1, 3328]
    - [12, 55.356]
  - - [2368, 256, 1, 3328]
    - [1, 47.532]
  - - [7680, 1500, 1, 2560]
    - [11, 70.758]
  - - [5888, 3584, 1, 1280]
    - [11, 75.57]
  - - [1856, 3584, 1, 3328]
    - [11, 69.673]
  - - [5888, 128, 1, 1280]
    - [0, 48.682]
  - - [1024, 2944, 1, 256]
    - [18, 54.738]
  - - [448, 6784, 1, 1280]
    - [4, 58.234]
  - - [256, 3584, 1, 1280]
    - [0, 40.163]
  - - [448, 128, 1, 128]
    - [17, 2.587]
  - - [704, 5056, 1, 256]
    - [25, 52.313]
  - - [3584, 1024, 1, 3328]
    - [18, 61.491]
  - - [2944, 1856, 1, 1280]
    - [13, 64.116]
  - - [128, 256, 1, 128]
    - [17, 1.694]
  - - [5056, 256, 1, 256]
    - [4, 44.905]
  - - [2944, 4288, 1, 3328]
    - [5, 73.518]
  - - [2368, 3584, 1, 3328]
    - [8, 72.436]
  - - [2944, 704, 1, 1280]
    - [37, 57.897]
  - - [128, 4, 1, 256]
    - [33, 0.059]
  - - [2944, 3584, 1, 1280]
    - [9, 74.608]
  - - [1856, 5888, 1, 1280]
    - [11, 68.648]
  - - [256, 256, 1, 1280]
    - [15, 15.866]
  - - [4608, 24000, 1, 1536]
    - [13, 78.788]
  - - [4288, 1408, 1, 256]
    - [5, 55.055]
  - - [3584, 64, 1, 256]
    - [26, 13.139]
  - - [64, 1856, 1, 3328]
    - [22, 31.075]
  - - [256, 1408, 1, 128]
    - [43, 10.36]
  - - [5888, 1408, 1, 128]
    - [11, 56.842]
  - - [4288, 2368, 1, 1280]
    - [13, 69.947]
  - - [4, 4288, 1, 256]
    - [17, 1.164]
  - - [256, 4288, 1, 128]
    - [4, 30.436]
  - - [256, 128, 1, 3328]
    - [7, 17.314]
  - - [512, 8, 1, 500000]
    - [73, 22.049]
  - - [6784, 2368, 1, 256]
    - [42, 70.406]
  - - [5888, 128, 1, 128]
    - [37, 24.011]
  - - [1408, 448, 1, 3328]
    - [1, 49.002]
  - - [1024, 24000, 1, 2816]
    - [11, 76.466]
  - - [704, 1024, 1, 1280]
    - [0, 47.573]
  - - [1856, 256, 1, 3328]
    - [60, 42.973]
  - - [1856, 2944, 1, 256]
    - [8, 50.544]
  - - [5056, 1024, 1, 128]
    - [9, 49.803]
  - - [64, 5888, 1, 1280]
    - [21, 36.607]
  - - [7680, 3000, 1, 2560]
    - [11, 76.664]
  - - [4224, 1500, 1, 176]
    - [11, 53.753]
  - - [5124, 700, 1, 2560]
    - [18, 58.895]
  - - [6784, 256, 1, 128]
    - [12, 38.879]
  - - [5888, 704, 1, 128]
    - [13, 47.09]
  - - [6784, 64, 1, 128]
    - [37, 15.825]
  - - [4, 448, 1, 1280]
    - [2, 0.716]
  - - [1024, 4288, 1, 1280]
    - [5, 69.809]
  - - [2368, 5056, 1, 3328]
    - [13, 73.036]
  - - [448, 4, 1, 128]
    - [63, 0.08]
  - - [4, 256, 1, 3328]
    - [19, 0.874]
  - - [4288, 1024, 1, 3328]
    - [41, 69.717]
  - - [6144, 48000, 1, 2560]
    - [13, 79.194]
  - - [1024, 5056, 1, 3328]
    - [9, 70.344]
  - - [1024, 1856, 1, 3328]
    - [23, 55.168]
  - - [704, 704, 1, 1280]
    - [48, 38.141]
  - - [128, 2368, 1, 1280]
    - [45, 33.728]
  - - [3584, 4, 1, 128]
    - [56, 0.718]
  - - [3584, 256, 1, 1280]
    - [45, 41.802]
  - - [4, 128, 1, 128]
    - [57, 0.027]
  - - [128, 4288, 1, 3328]
    - [36, 47.243]
  - - [5124, 1500, 1, 2560]
    - [11, 71.094]
  - - [3584, 128, 1, 1280]
    - [21, 37.792]
  - - [4, 256, 1, 1280]
    - [19, 0.414]
  - - [128, 704, 1, 3328]
    - [20, 27.788]
  - - [4288, 6784, 1, 256]
    - [13, 68.232]
  - - [3584, 2944, 1, 3328]
    - [13, 74.917]
  - - [128, 1856, 1, 256]
    - [26, 13.422]
  - - [64, 4288, 1, 256]
    - [26, 14.066]
  - - [4, 3584, 1, 3328]
    - [47, 4.951]
  - - [64, 4, 1, 3328]
    - [3, 0.248]
  - - [4, 64, 1, 3328]
    - [39, 0.278]
  - - [35, 700, 1, 2560]
    - [60, 10.912]
  - - [5888, 2944, 1, 256]
    - [5, 69.503]
  - - [4, 2368, 1, 256]
    - [46, 0.876]
  - - [1856, 64, 1, 256]
    - [17, 8.768]
  - - [5056, 128, 1, 1280]
    - [12, 43.535]
  - - [448, 4288, 1, 1280]
    - [0, 49.688]
  - - [256, 4288, 1, 256]
    - [37, 39.847]
  - - [1024, 4288, 1, 128]
    - [41, 52.018]
  - - [4, 1024, 1, 256]
    - [15, 0.347]
  - - [5056, 4288, 1, 256]
    - [11, 69.921]
  - - [1024, 448, 1, 256]
    - [0, 21.542]
  - - [1024, 3584, 1, 256]
    - [37, 52.4]
  - - [2944, 128, 1, 1280]
    - [21, 36.518]
  - - [49, 2048, 64, 512]
    - [0, 47.064]
  - - [2560, 32, 1, 2560]
    - [7, 27.691]
  - - [64, 256, 1, 256]
    - [61, 1.649]
  - - [1024, 4, 1, 512]
    - [31, 0.844]
  - - [128, 2368, 1, 128]
    - [26, 10.633]
  - - [256, 704, 1, 1280]
    - [30, 28.087]
  - - [64, 2368, 1, 128]
    - [17, 6.725]
  - - [176, 1500, 1, 1408]
    - [49, 30.947]
  - - [448, 5888, 1, 1280]
    - [25, 58.108]
  - - [512, 3000, 1, 2048]
    - [27, 54.651]
  - - [5056, 448, 1, 128]
    - [11, 36.054]
  - - [4288, 704, 1, 1280]
    - [18, 59.402]
  - - [3584, 2944, 1, 128]
    - [9, 62.467]
  - - [6784, 256, 1, 1280]
    - [27, 57.508]
  - - [256, 2944, 1, 1280]
    - [4, 49.613]
  - - [2560, 128, 1, 2560]
    - [30, 44.324]
  - - [2368, 5888, 1, 3328]
    - [11, 74.748]
  - - [4, 64, 1, 256]
    - [2, 0.024]
  - - [704, 1024, 1, 3328]
    - [49, 47.477]
  - - [2368, 1856, 1, 1280]
    - [4, 60.709]
  - - [448, 5056, 1, 3328]
    - [13, 57.457]
  - - [128, 448, 1, 128]
    - [17, 2.299]
  - - [128, 6784, 1, 256]
    - [4, 37.844]
  - - [512, 4, 1, 500000]
    - [52, 15.568]
  - - [3584, 4288, 1, 128]
    - [5, 52.73]
  - - [64, 448, 1, 128]
    - [17, 1.461]
  - - [1024, 6000, 1, 2816]
    - [13, 72.136]
  - - [5888, 4288, 1, 3328]
    - [13, 76.192]
  - - [2368, 704, 1, 256]
    - [4, 45.631]
  - - [256, 1856, 1, 3328]
    - [10, 42.578]
  - - [1856, 128, 1, 256]
    - [26, 12.321]
  - - [6784, 128, 1, 128]
    - [37, 25.029]
  - - [3584, 1408, 1, 128]
    - [18, 51.154]
  - - [1856, 5056, 1, 1280]
    - [5, 69.247]
  - - [2944, 1024, 1, 1280]
    - [37, 58.162]
  - - [5056, 4, 1, 256]
    - [61, 1.625]
  - - [3584, 5888, 1, 3328]
    - [9, 76.401]
  - - [2368, 4288, 1, 256]
    - [8, 61.087]
  - - [1024, 2368, 1, 3328]
    - [9, 61.813]
  - - [128, 3584, 1, 128]
    - [37, 14.928]
  - - [704, 1408, 1, 256]
    - [4, 32.932]
  - - [4096, 128, 1, 4096]
    - [49, 47.242]
  - - [1024, 2944, 1, 128]
    - [41, 40.257]
  - - [1024, 3584, 1, 1280]
    - [37, 57.806]
  - - [4288, 5888, 1, 3328]
    - [13, 75.707]
  - - [4288, 4, 1, 3328]
    - [39, 8.757]
  - - [4608, 16, 1, 1536]
    - [60, 17.131]
  - - [5888, 64, 1, 128]
    - [18, 12.297]
  - - [4, 5888, 1, 128]
    - [17, 1.062]
  - - [1024, 2944, 1, 3328]
    - [18, 63.547]
  - - [2048, 64, 1, 2048]
    - [22, 27.96]
  - - [6144, 2, 1, 2560]
    - [39, 4.652]
  - - [256, 6784, 1, 1280]
    - [12, 55.489]
  - - [1856, 3584, 1, 256]
    - [11, 52.829]
  - - [128, 448, 1, 3328]
    - [60, 23.256]
  - - [6784, 1856, 1, 128]
    - [11, 53.162]
  - - [1024, 1500, 1, 2048]
    - [12, 54.932]
  - - [5056, 128, 1, 256]
    - [0, 26.918]
  - - [512, 24000, 1, 2816]
    - [5, 75.027]
  - - [256, 5888, 1, 1280]
    - [28, 54.269]
  - - [4, 128, 1, 1280]
    - [19, 0.233]
  - - [4288, 6784, 1, 3328]
    - [5, 76.702]
  - - [6784, 128, 1, 1280]
    - [4, 53.894]
  - - [64, 1408, 1, 256]
    - [17, 6.883]
  - - [2368, 1408, 1, 128]
    - [25, 47.645]
  - - [1856, 448, 1, 256]
    - [4, 37.26]
  - - [1408, 1024, 1, 128]
    - [18, 35.133]
  - - [128, 64, 1, 128]
    - [56, 0.416]
  - - [6784, 3584, 1, 3328]
    - [5, 77.995]
  - - [1760, 7000, 1, 1760]
    - [5, 73.184]
  - - [1024, 704, 1, 3328]
    - [12, 47.855]
  - - [64, 64, 1, 128]
    - [17, 0.208]
  - - [2368, 5056, 1, 1280]
    - [11, 70.232]
  - - [64, 4, 1, 1280]
    - [19, 0.099]
  - - [1408, 2368, 1, 1280]
    - [13, 61.866]
  - - [128, 1408, 1, 1280]
    - [36, 26.363]
  - - [1024, 1, 1, 512]
    - [52, 0.174]
  - - [4, 1408, 1, 128]
    - [61, 0.244]
  - - [704, 4288, 1, 128]
    - [0, 39.895]
  - - [128, 1856, 1, 3328]
    - [10, 39.536]
  - - [2944, 2944, 1, 256]
    - [8, 53.648]
  - - [2944, 4, 1, 1280]
    - [55, 4.064]
  - - [5888, 4, 1, 256]
    - [55, 1.937]
  - - [6784, 256, 1, 256]
    - [12, 45.123]
  - - [256, 5056, 1, 3328]
    - [18, 57.269]
  - - [128, 4288, 1, 1280]
    - [36, 39.557]
  - - [5056, 1856, 1, 128]
    - [9, 52.542]
  - - [1024, 3000, 1, 1536]
    - [18, 60.531]
  - - [5056, 1024, 1, 3328]
    - [13, 70.482]
  - - [128, 128, 1, 256]
    - [17, 1.424]
  - - [1760, 64, 1, 1760]
    - [20, 26.874]
  - - [4288, 3584, 1, 3328]
    - [13, 74.004]
  - - [448, 704, 1, 3328]
    - [49, 42.06]
  - - [448, 448, 1, 128]
    - [26, 6.666]
  - - [1024, 2368, 1, 1280]
    - [5, 58.941]
  - - [1856, 704, 1, 3328]
    - [37, 58.882]
  - - [512, 1500, 1, 2560]
    - [49, 48.343]
  - - [5888, 6784, 1, 3328]
    - [5, 77.769]
  - - [704, 4288, 1, 1280]
    - [0, 58.127]
  - - [128, 50176, 1, 512]
    - [11, 59.502]
  - - [704, 256, 1, 256]
    - [44, 9.695]
  - - [1024, 48000, 1, 2048]
    - [11, 77.945]
  - - [4288, 1024, 1, 128]
    - [0, 45.926]
  - - [784, 128, 64, 128]
    - [51, 48.781]
  - - [3025, 64, 64, 16]
    - [18, 18.024]
  - - [3025, 256, 64, 16]
    - [18, 19.212]
  - - [12544, 256, 1, 256]
    - [5, 53.309]
  - - [50176, 63, 1, 196]
    - [37, 42.652]
  - - [196, 256, 1, 576]
    - [35, 7.118]
  - - [3136, 2048, 1, 128]
    - [43, 53.094]
  - - [784, 512, 64, 32]
    - [43, 41.18]
  - - [12544, 256, 1, 128]
    - [9, 43.126]
  - - [50176, 128, 1, 64]
    - [13, 42.306]
  - - [3025, 64, 64, 64]
    - [43, 48.047]
  - - [50176, 512, 1, 64]
    - [42, 47.91]
  - - [784, 128, 1, 128]
    - [17, 4.447]
- null
