library/src/blas3/Tensile/Logic/asm_full/aldebaran_Cijk_Alik_Bljk_HSS_BH.yaml
- {MinimumRequiredVersion: 4.23.0}
- aldebaran
- gfx90a
- [Device 0050, Device 0051, Device 0052, Device 0054, Device 0062, Device 7400, Device
    SolutionIndex: 0
    SolutionNameMin: Cijk_Alik_Bljk_HSS_BH_MT32x32x64_MI16x16x16x1_SE_1LDSB0_AF0EM1_GRVW8_GSU15_LBSPP128_PLR5_SU0_SUS0_SRVW0_TT1_16_VAW1_WG32_8_1_WGM2
    SolutionIndex: 1
    SolutionNameMin: Cijk_Alik_Bljk_HSS_BH_MT32x32x64_MI16x16x16x1_SE_1LDSB0_AF0EM8_GRVW8_GSU7_LBSPP128_PLR5_SU32_SUS256_SRVW0_TT1_16_VAW1_WG32_8_1_WGM1
    SolutionIndex: 2
    SolutionNameMin: Cijk_Alik_Bljk_HSS_BH_MT16x16x128_MI16x16x16x1_SE_1LDSB0_AF0EM1_GRVW8_GSU1_LBSPP256_PLR9_SU0_SUS0_SRVW0_TT1_16_VAW2_WG16_4_1_WGM15
    SolutionIndex: 3
    SolutionNameMin: Cijk_Alik_Bljk_HSS_BH_MT16x16x128_MI16x16x16x1_SE_1LDSB0_AF0EM1_GRVW8_GSU1_LBSPP256_PLR9_SU32_SUS256_SRVW0_TT1_16_VAW2_WG16_4_1_WGM1
    SolutionIndex: 4
    SolutionNameMin: Cijk_Alik_Bljk_HSS_BH_MT16x16x128_MI16x16x16x1_SE_1LDSB1_AF0EM1_GRVW8_GSU1_LBSPP256_PLR9_SU0_SUS0_SRVW0_TT1_16_VAW2_WG16_4_1_WGM2
    SolutionIndex: 5
    SolutionNameMin: Cijk_Alik_Bljk_HSS_BH_MT16x16x128_MI16x16x16x1_SE_1LDSB1_AF0EM8_GRVW8_GSU1_LBSPP256_PLR9_SU0_SUS0_SRVW0_TT1_16_VAW2_WG16_4_1_WGM2
    SolutionIndex: 6
    SolutionNameMin: Cijk_Alik_Bljk_HSS_BH_MT16x16x128_MI16x16x16x1_SE_1LDSB1_AF0EM1_GRVW8_GSU1_LBSPP256_PLR9_SU0_SUS0_SRVW0_TT1_16_VAW2_WG16_4_1_WGM1
    SolutionIndex: 7
    SolutionNameMin: Cijk_Alik_Bljk_HSS_BH_MT16x16x128_MI16x16x16x1_SE_1LDSB1_AF0EM1_GRVW8_GSU1_LBSPP256_PLR9_SU32_SUS256_SRVW0_TT1_16_VAW2_WG16_4_1_WGM1
    SolutionIndex: 8
    SolutionNameMin: Cijk_Alik_Bljk_HSS_BH_MT16x16x128_MI16x16x16x1_SE_1LDSB1_AF0EM8_GRVW8_GSU1_LBSPP256_PLR9_SU0_SUS0_SRVW0_TT1_16_VAW2_WG16_4_1_WGM15
    SolutionIndex: 9
    SolutionNameMin: Cijk_Alik_Bljk_HSS_BH_MT16x16x128_MI16x16x16x1_SE_1LDSB0_AF0EM8_GRVW8_GSU1_LBSPP256_PLR9_SU0_SUS0_SRVW0_TT1_16_VAW2_WG16_4_1_WGM2
    SolutionIndex: 10
    SolutionNameMin: Cijk_Alik_Bljk_HSS_BH_MT16x16x128_MI16x16x16x1_SE_1LDSB0_AF0EM1_GRVW4_GSU1_LBSPP256_PLR9_SU0_SUS0_SRVW0_TT1_16_VAW2_WG16_4_1_WGM1
    SolutionIndex: 11
    SolutionNameMin: Cijk_Alik_Bljk_HSS_BH_MT16x16x128_MI16x16x16x1_SE_1LDSB0_AF0EM1_GRVW8_GSU1_LBSPP256_PLR9_SU0_SUS0_SRVW0_TT1_16_VAW2_WG16_4_1_WGM1
    SolutionIndex: 12
    SolutionNameMin: Cijk_Alik_Bljk_HSS_BH_MT16x16x128_MI16x16x16x1_SE_1LDSB1_AF0EM1_GRVW8_GSU1_LBSPP256_PLR9_SU0_SUS0_SRVW0_TT1_16_VAW2_WG16_4_1_WGM15
    SolutionIndex: 13
    SolutionNameMin: Cijk_Alik_Bljk_HSS_BH_MT16x16x128_MI16x16x16x1_SE_1LDSB1_AF0EM8_GRVW4_GSU1_LBSPP256_PLR9_SU0_SUS0_SRVW0_TT1_16_VAW2_WG16_4_1_WGM1
    SolutionIndex: 14
    SolutionNameMin: Cijk_Alik_Bljk_HSS_BH_MT64x32x64_MI16x16x16x1_SE_1LDSB1_AF0EM8_GRVW8_GSU1_LBSPP128_PLR5_SU0_SUS0_SRVW4_TT2_16_VAW2_WG32_8_1_WGM1
    SolutionIndex: 15
    SolutionNameMin: Cijk_Alik_Bljk_HSS_BH_MT32x64x64_MI16x16x16x1_SE_1LDSB1_AF0EM8_GRVW8_GSU1_LBSPP128_PLR5_SU0_SUS0_SRVW4_TT1_32_VAW2_WG32_8_1_WGM1
    SolutionIndex: 16
    SolutionNameMin: Cijk_Alik_Bljk_HSS_BH_MT64x32x64_MI16x16x16x1_SE_1LDSB1_AF0EM8_GRVW8_GSU1_LBSPP128_PLR5_SU32_SUS128_SRVW4_TT2_16_VAW2_WG32_8_1_WGM2
    SolutionIndex: 17
    SolutionNameMin: Cijk_Alik_Bljk_HSS_BH_MT64x64x64_MI32x32x8x1_SE_1LDSB1_AF0EM8_GRVW8_GSU1_LBSPP128_PLR9_SU0_SUS0_SRVW4_TT1_32_VAW2_WG64_4_1_WGM1
    SolutionIndex: 18
    SolutionNameMin: Cijk_Alik_Bljk_HSS_BH_MT64x64x64_MI32x32x8x1_SE_1LDSB1_AF0EM8_GRVW8_GSU1_LBSPP128_PLR9_SU0_SUS0_SRVW4_TT1_32_VAW2_WG64_4_1_WGM15
    SolutionIndex: 19
    SolutionNameMin: Cijk_Alik_Bljk_HSS_BH_MT64x32x64_MI16x16x16x1_SE_1LDSB1_AF0EM1_GRVW8_GSU1_LBSPP128_PLR5_SU0_SUS0_SRVW4_TT2_16_VAW2_WG32_8_1_WGM1
    SolutionIndex: 20
    SolutionNameMin: Cijk_Alik_Bljk_HSS_BH_MT64x64x64_MI32x32x8x1_SE_1LDSB1_AF0EM8_GRVW8_GSU1_LBSPP128_PLR9_SU32_SUS128_SRVW4_TT1_32_VAW2_WG64_4_1_WGM2
    SolutionIndex: 21
    SolutionNameMin: Cijk_Alik_Bljk_HSS_BH_MT32x64x64_MI16x16x16x1_SE_1LDSB1_AF0EM1_GRVW8_GSU1_LBSPP128_PLR5_SU0_SUS0_SRVW4_TT1_32_VAW2_WG32_8_1_WGM1
    SolutionIndex: 22
    SolutionNameMin: Cijk_Alik_Bljk_HSS_BH_MT16x16x128_MI16x16x16x1_SE_1LDSB0_AF0EM8_GRVW8_GSU1_LBSPP256_PLR9_SU32_SUS256_SRVW0_TT1_16_VAW2_WG16_4_1_WGM15
    SolutionIndex: 23
    SolutionNameMin: Cijk_Alik_Bljk_HSS_BH_MT16x16x128_MI16x16x16x1_SE_1LDSB0_AF0EM1_GRVW8_GSU1_LBSPP256_PLR9_SU0_SUS0_SRVW0_TT1_16_VAW2_WG16_4_1_WGM2
    SolutionIndex: 24
    SolutionNameMin: Cijk_Alik_Bljk_HSS_BH_MT64x64x64_MI32x32x8x1_SE_1LDSB1_AF0EM8_GRVW8_GSU1_LBSPP128_PLR9_SU0_SUS0_SRVW4_TT1_32_VAW2_WG64_4_1_WGM2
    SolutionIndex: 25
    SolutionNameMin: Cijk_Alik_Bljk_HSS_BH_MT64x64x64_MI32x32x8x1_SE_1LDSB1_AF0EM1_GRVW8_GSU1_LBSPP128_PLR9_SU0_SUS0_SRVW4_TT1_32_VAW2_WG64_4_1_WGM1
    SolutionIndex: 26
    SolutionNameMin: Cijk_Alik_Bljk_HSS_BH_MT16x16x128_MI16x16x16x1_SE_1LDSB0_AF0EM8_GRVW8_GSU1_LBSPP256_PLR9_SU0_SUS0_SRVW0_TT1_16_VAW2_WG16_4_1_WGM15
    SolutionIndex: 27
    SolutionNameMin: Cijk_Alik_Bljk_HSS_BH_MT64x64x64_MI32x32x8x1_SE_1LDSB1_AF0EM8_GRVW8_GSU1_LBSPP128_PLR9_SU32_SUS128_SRVW4_TT1_32_VAW2_WG64_4_1_WGM1
    SolutionIndex: 28
    SolutionNameMin: Cijk_Alik_Bljk_HSS_BH_MT16x16x128_MI16x16x16x1_SE_1LDSB1_AF0EM8_GRVW8_GSU1_LBSPP256_PLR9_SU32_SUS256_SRVW0_TT1_16_VAW2_WG16_4_1_WGM1
    SolutionIndex: 29
    SolutionNameMin: Cijk_Alik_Bljk_HSS_BH_MT64x64x64_MI32x32x8x1_SE_1LDSB1_AF0EM8_GRVW8_GSU1_LBSPP128_PLR9_SU32_SUS256_SRVW4_TT1_32_VAW2_WG64_4_1_WGM1
    SolutionIndex: 30
    SolutionNameMin: Cijk_Alik_Bljk_HSS_BH_MT64x64x64_MI32x32x8x1_SE_1LDSB1_AF0EM8_GRVW8_GSU1_LBSPP128_PLR9_SU32_SUS128_SRVW4_TT1_32_VAW2_WG64_4_1_WGM15
    SolutionIndex: 31
    SolutionNameMin: Cijk_Alik_Bljk_HSS_BH_MT32x32x64_MI16x16x16x1_SE_1LDSB0_AF0EM8_GRVW8_GSU1_LBSPP128_PLR5_SU0_SUS0_SRVW4_TT1_16_VAW2_WG32_8_1_WGM15
    SolutionIndex: 32
    SolutionNameMin: Cijk_Alik_Bljk_HSS_BH_MT32x32x64_MI16x16x16x1_SE_1LDSB0_AF0EM8_GRVW8_GSU1_LBSPP128_PLR5_SU32_SUS128_SRVW4_TT1_16_VAW2_WG32_8_1_WGM1
    SolutionIndex: 33
    SolutionNameMin: Cijk_Alik_Bljk_HSS_BH_MT32x64x64_MI16x16x16x1_SE_1LDSB0_AF0EM8_GRVW8_GSU1_LBSPP128_PLR5_SU32_SUS128_SRVW4_TT1_32_VAW2_WG32_8_1_WGM1
    SolutionIndex: 34
    SolutionNameMin: Cijk_Alik_Bljk_HSS_BH_MT64x128x64_MI32x32x8x1_SE_1LDSB1_AF0EM8_GRVW8_GSU1_LBSPP128_PLR9_SU32_SUS256_SRVW4_TT1_64_VAW2_WG64_4_1_WGM1
    SolutionIndex: 35
    SolutionNameMin: Cijk_Alik_Bljk_HSS_BH_MT64x32x32_MI16x16x16x1_SE_1LDSB1_AF0EM8_GRVW4_GSU1_LBSPP128_PLR2_SU0_SUS0_SRVW4_TT2_16_VAW2_WG32_8_1_WGM1
    SolutionIndex: 36
    SolutionNameMin: Cijk_Alik_Bljk_HSS_BH_MT128x96x64_MI32x32x8x1_SE_1LDSB1_AF0EM8_GRVW8_GSU1_LBSPP128_PLR9_SU0_SUS0_SRVW4_TT1_96_VAW2_WG128_2_1_WGM1
    SolutionIndex: 37
    SolutionNameMin: Cijk_Alik_Bljk_HSS_BH_MT128x96x64_MI32x32x8x1_SE_1LDSB1_AF0EM8_GRVW8_GSU1_LBSPP128_PLR9_SU32_SUS128_SRVW4_TT1_96_VAW2_WG128_2_1_WGM1
    SolutionIndex: 38
    SolutionNameMin: Cijk_Alik_Bljk_HSS_BH_MT64x128x64_MI32x32x8x1_SE_1LDSB1_AF0EM8_GRVW8_GSU1_LBSPP128_PLR9_SU0_SUS0_SRVW4_TT1_64_VAW2_WG64_4_1_WGM2
    SolutionIndex: 39
    SolutionNameMin: Cijk_Alik_Bljk_HSS_BH_MT64x64x64_MI32x32x8x1_SE_1LDSB1_AF0EM8_GRVW8_GSU1_LBSPP128_PLR9_SU32_SUS256_SRVW4_TT1_32_VAW2_WG64_4_1_WGM2
    SolutionIndex: 40
    SolutionNameMin: Cijk_Alik_Bljk_HSS_BH_MT128x96x64_MI32x32x8x1_SE_1LDSB1_AF0EM8_GRVW8_GSU1_LBSPP128_PLR9_SU32_SUS256_SRVW4_TT1_96_VAW2_WG128_2_1_WGM1
    SolutionIndex: 41
    SolutionNameMin: Cijk_Alik_Bljk_HSS_BH_MT64x128x64_MI32x32x8x1_SE_1LDSB1_AF0EM8_GRVW8_GSU1_LBSPP128_PLR9_SU32_SUS128_SRVW4_TT1_64_VAW2_WG64_4_1_WGM2
    SolutionIndex: 42
    SolutionNameMin: Cijk_Alik_Bljk_HSS_BH_MT128x128x64_MI32x32x8x1_SE_1LDSB1_AF0EM8_GRVW8_GSU1_LBSPP128_PLR9_SU32_SUS128_SRVW4_TT2_64_VAW2_WG64_4_1_WGM2
    SolutionIndex: 43
    SolutionNameMin: Cijk_Alik_Bljk_HSS_BH_MT128x128x64_MI32x32x8x1_SE_1LDSB1_AF0EM8_GRVW8_GSU1_LBSPP128_PLR9_SU32_SUS256_SRVW4_TT2_64_VAW2_WG64_4_1_WGM1
    SolutionIndex: 44
    SolutionNameMin: Cijk_Alik_Bljk_HSS_BH_MT128x160x64_MI32x32x8x1_SE_1LDSB1_AF0EM8_GRVW4_GSU1_LBSPP128_PLR9_SU32_SUS256_SRVW4_TT1_160_VAW2_WG128_2_1_WGM2
    SolutionIndex: 45
    SolutionNameMin: Cijk_Alik_Bljk_HSS_BH_MT128x96x64_MI32x32x8x1_SE_1LDSB1_AF0EM8_GRVW8_GSU1_LBSPP128_PLR9_SU32_SUS128_SRVW4_TT1_96_VAW2_WG128_2_1_WGM15
    SolutionIndex: 46
    SolutionNameMin: Cijk_Alik_Bljk_HSS_BH_MT64x128x64_MI32x32x8x1_SE_1LDSB1_AF0EM8_GRVW8_GSU1_LBSPP128_PLR9_SU0_SUS0_SRVW4_TT1_64_VAW2_WG64_4_1_WGM15
    SolutionIndex: 47
    SolutionNameMin: Cijk_Alik_Bljk_HSS_BH_MT64x64x64_MI32x32x8x1_SE_1LDSB0_AF0EM8_GRVW8_GSU1_LBSPP128_PLR9_SU32_SUS256_SRVW4_TT1_32_VAW2_WG64_4_1_WGM15
    SolutionIndex: 48
    SolutionNameMin: Cijk_Alik_Bljk_HSS_BH_MT128x96x64_MI32x32x8x1_SE_1LDSB1_AF0EM8_GRVW8_GSU1_LBSPP128_PLR9_SU32_SUS256_SRVW4_TT1_96_VAW2_WG128_2_1_WGM15
    SolutionIndex: 49
    SolutionNameMin: Cijk_Alik_Bljk_HSS_BH_MT128x96x64_MI32x32x8x1_SE_1LDSB1_AF0EM8_GRVW8_GSU1_LBSPP128_PLR9_SU0_SUS0_SRVW4_TT1_96_VAW2_WG128_2_1_WGM15
    SolutionIndex: 50
    SolutionNameMin: Cijk_Alik_Bljk_HSS_BH_MT128x256x64_MI32x32x8x1_SE_1LDSB1_AF0EM8_GRVW4_GSU1_LBSPP128_PLR9_SU32_SUS128_SRVW4_TT2_128_VAW2_WG64_4_1_WGM2
    SolutionIndex: 51
    SolutionNameMin: Cijk_Alik_Bljk_HSS_BH_MT128x96x64_MI32x32x8x1_SE_1LDSB0_AF0EM8_GRVW8_GSU1_LBSPP128_PLR9_SU0_SUS0_SRVW4_TT1_96_VAW2_WG128_2_1_WGM15
    SolutionIndex: 52
    SolutionNameMin: Cijk_Alik_Bljk_HSS_BH_MT64x128x64_MI32x32x8x1_SE_1LDSB1_AF0EM8_GRVW8_GSU1_LBSPP128_PLR9_SU32_SUS256_SRVW4_TT1_64_VAW2_WG64_4_1_WGM2
    SolutionIndex: 53
    SolutionNameMin: Cijk_Alik_Bljk_HSS_BH_MT128x96x64_MI32x32x8x1_SE_1LDSB1_AF0EM8_GRVW8_GSU1_LBSPP128_PLR9_SU32_SUS128_SRVW4_TT1_96_VAW2_WG128_2_1_WGM2
    SolutionIndex: 54
    SolutionNameMin: Cijk_Alik_Bljk_HSS_BH_MT128x96x64_MI32x32x8x1_SE_1LDSB1_AF0EM8_GRVW8_GSU1_LBSPP128_PLR9_SU0_SUS0_SRVW4_TT1_96_VAW2_WG128_2_1_WGM2
    SolutionIndex: 55
    SolutionNameMin: Cijk_Alik_Bljk_HSS_BH_MT128x96x64_MI32x32x8x1_SE_1LDSB1_AF0EM1_GRVW8_GSU1_LBSPP128_PLR9_SU32_SUS128_SRVW4_TT1_96_VAW2_WG128_2_1_WGM15
    SolutionIndex: 56
    SolutionNameMin: Cijk_Alik_Bljk_HSS_BH_MT64x128x64_MI32x32x8x1_SE_1LDSB1_AF0EM8_GRVW8_GSU1_LBSPP128_PLR9_SU0_SUS0_SRVW4_TT1_64_VAW2_WG64_4_1_WGM1
    SolutionIndex: 57
    SolutionNameMin: Cijk_Alik_Bljk_HSS_BH_MT128x96x64_MI32x32x8x1_SE_1LDSB1_AF0EM8_GRVW8_GSU1_LBSPP128_PLR9_SU32_SUS256_SRVW4_TT1_96_VAW2_WG128_2_1_WGM2
    SolutionIndex: 58
    SolutionNameMin: Cijk_Alik_Bljk_HSS_BH_MT128x128x64_MI32x32x8x1_SE_1LDSB1_AF0EM8_GRVW8_GSU1_LBSPP128_PLR9_SU0_SUS0_SRVW4_TT2_64_VAW2_WG64_4_1_WGM15
    SolutionIndex: 59
    SolutionNameMin: Cijk_Alik_Bljk_HSS_BH_MT128x128x64_MI32x32x8x1_SE_1LDSB1_AF0EM8_GRVW8_GSU1_LBSPP128_PLR9_SU32_SUS256_SRVW4_TT2_64_VAW2_WG64_4_1_WGM2
    SolutionIndex: 60
    SolutionNameMin: Cijk_Alik_Bljk_HSS_BH_MT128x160x64_MI32x32x8x1_SE_1LDSB1_AF0EM8_GRVW4_GSU1_LBSPP128_PLR9_SU0_SUS0_SRVW4_TT1_160_VAW2_WG128_2_1_WGM15
    SolutionIndex: 61
    SolutionNameMin: Cijk_Alik_Bljk_HSS_BH_MT128x256x64_MI32x32x8x1_SE_1LDSB1_AF0EM8_GRVW4_GSU1_LBSPP128_PLR9_SU32_SUS128_SRVW4_TT2_128_VAW2_WG64_4_1_WGM1
    SolutionIndex: 62
    SolutionNameMin: Cijk_Alik_Bljk_HSS_BH_MT96x128x64_MI32x32x8x1_SE_1LDSB1_AF0EM8_GRVW8_GSU1_LBSPP128_PLR9_SU0_SUS0_SRVW0_TT3_32_VAW2_WG32_8_1_WGM1
    SolutionIndex: 63
    SolutionNameMin: Cijk_Alik_Bljk_HSS_BH_MT128x128x64_MI32x32x8x1_SE_1LDSB1_AF0EM8_GRVW8_GSU1_LBSPP128_PLR9_SU0_SUS0_SRVW4_TT2_64_VAW2_WG64_4_1_WGM2
    SolutionIndex: 64
    SolutionNameMin: Cijk_Alik_Bljk_HSS_BH_MT128x160x64_MI32x32x8x1_SE_1LDSB1_AF0EM8_GRVW4_GSU1_LBSPP128_PLR9_SU32_SUS128_SRVW4_TT1_160_VAW2_WG128_2_1_WGM15
    SolutionIndex: 65
    SolutionNameMin: Cijk_Alik_Bljk_HSS_BH_MT128x128x64_MI32x32x8x1_SE_1LDSB1_AF0EM8_GRVW8_GSU1_LBSPP128_PLR9_SU32_SUS128_SRVW4_TT2_64_VAW2_WG64_4_1_WGM1
    SolutionIndex: 66
    SolutionNameMin: Cijk_Alik_Bljk_HSS_BH_MT128x96x64_MI32x32x8x1_SE_1LDSB0_AF0EM8_GRVW8_GSU1_LBSPP128_PLR9_SU0_SUS0_SRVW4_TT1_96_VAW2_WG128_2_1_WGM2
    SolutionIndex: 67
    SolutionNameMin: Cijk_Alik_Bljk_HSS_BH_MT128x160x64_MI32x32x8x1_SE_1LDSB1_AF0EM8_GRVW4_GSU1_LBSPP128_PLR9_SU32_SUS128_SRVW4_TT1_160_VAW2_WG128_2_1_WGM2
    SolutionIndex: 68
    SolutionNameMin: Cijk_Alik_Bljk_HSS_BH_MT128x96x64_MI32x32x8x1_SE_1LDSB1_AF0EM1_GRVW8_GSU1_LBSPP128_PLR9_SU32_SUS256_SRVW4_TT1_96_VAW2_WG128_2_1_WGM15
    SolutionIndex: 69
    SolutionNameMin: Cijk_Alik_Bljk_HSS_BH_MT128x256x32_MI32x32x8x1_SE_1LDSB1_AF0EM8_GRVW8_GSU1_LBSPP128_PLR5_SU0_SUS0_SRVW4_TT2_128_VAW2_WG64_4_1_WGM1
    SolutionIndex: 70
    SolutionNameMin: Cijk_Alik_Bljk_HSS_BH_MT128x160x32_MI32x32x8x1_SE_1LDSB1_AF0EM8_GRVW4_GSU1_LBSPP128_PLR5_SU0_SUS0_SRVW4_TT1_160_VAW2_WG128_2_1_WGM2
    SolutionIndex: 71
    SolutionNameMin: Cijk_Alik_Bljk_HSS_BH_MT96x96x64_MI16x16x16x1_SE_1LDSB0_AF0EM8_GRVW8_GSU1_LBSPP128_PLR5_SU0_SUS0_SRVW0_TT3_48_VAW2_WG32_8_1_WGM2
    SolutionIndex: 72
    SolutionNameMin: Cijk_Alik_Bljk_HSS_BH_MT64x64x64_MI32x32x8x1_SE_1LDSB1_AF0EM8_GRVW2_GSU1_LBSPP128_PLR9_SU0_SUS0_SRVW4_TT1_32_VAW2_WG64_4_1_WGM1
    SolutionIndex: 73
    SolutionNameMin: Cijk_Alik_Bljk_HSS_BH_MT256x160x64_MI32x32x8x1_SE_1LDSB1_AF0EM8_GRVW2_GSU1_LBSPP128_PLR9_SU0_SUS0_SRVW4_TT2_160_VAW2_WG128_2_1_WGM1
    SolutionIndex: 74
    SolutionNameMin: Cijk_Alik_Bljk_HSS_BH_MT128x160x32_MI32x32x8x1_SE_1LDSB1_AF0EM1_GRVW4_GSU1_LBSPP128_PLR5_SU32_SUS128_SRVW4_TT1_160_VAW2_WG128_2_1_WGM15
    SolutionIndex: 75
    SolutionNameMin: Cijk_Alik_Bljk_HSS_BH_MT16x16x32_MI16x16x16x1_SE_1LDSB1_AF0EM1_GRVW2_GSU1_LBSPP128_PLR2_SU0_SUS0_SRVW0_TT1_16_VAW2_WG16_4_1_WGM2
    SolutionIndex: 76
    SolutionNameMin: Cijk_Alik_Bljk_HSS_BH_MT16x16x128_MI16x16x16x1_SE_1LDSB0_AF0EM8_GRVW8_GSU1_LBSPP256_PLR9_SU32_SUS256_SRVW0_TT1_16_VAW2_WG16_4_1_WGM1
    SolutionIndex: 77
    SolutionNameMin: Cijk_Alik_Bljk_HSS_BH_MT32x32x64_MI16x16x16x1_SE_1LDSB0_AF0EM8_GRVW8_GSU1_LBSPP128_PLR5_SU0_SUS0_SRVW4_TT1_16_VAW2_WG32_8_1_WGM1
    SolutionIndex: 78
    SolutionNameMin: Cijk_Alik_Bljk_HSS_BH_MT16x16x64_MI16x16x16x1_SE_1LDSB0_AF0EM1_GRVW8_GSU1_LBSPP128_PLR5_SU0_SUS0_SRVW0_TT1_16_VAW2_WG16_4_1_WGM1
    SolutionIndex: 79
    SolutionNameMin: Cijk_Alik_Bljk_HSS_BH_MT32x64x64_MI16x16x16x1_SE_1LDSB0_AF0EM8_GRVW8_GSU1_LBSPP128_PLR5_SU32_SUS256_SRVW4_TT1_32_VAW2_WG32_8_1_WGM1
    SolutionIndex: 80
    SolutionNameMin: Cijk_Alik_Bljk_HSS_BH_MT32x32x32_MI16x16x16x1_SE_1LDSB0_AF0EM8_GRVW8_GSU1_LBSPP128_PLR2_SU0_SUS0_SRVW4_TT1_16_VAW2_WG32_8_1_WGM1
    SolutionIndex: 81
    SolutionNameMin: Cijk_Alik_Bljk_HSS_BH_MT16x16x32_MI16x16x16x1_SE_1LDSB1_AF0EM1_GRVW8_GSU1_LBSPP128_PLR2_SU0_SUS0_SRVW0_TT1_16_VAW2_WG16_4_1_WGM1
    SolutionIndex: 82
    SolutionNameMin: Cijk_Alik_Bljk_HSS_BH_MT32x32x32_MI16x16x16x1_SE_1LDSB0_AF0EM1_GRVW4_GSU1_LBSPP128_PLR2_SU0_SUS0_SRVW4_TT1_16_VAW2_WG32_8_1_WGM1
    SolutionIndex: 83
    SolutionNameMin: Cijk_Alik_Bljk_HSS_BH_MT32x32x32_MI16x16x16x1_SE_1LDSB0_AF0EM1_GRVW2_GSU1_LBSPP128_PLR2_SU0_SUS0_SRVW4_TT1_16_VAW2_WG32_8_1_WGM1
    SolutionIndex: 84
    SolutionNameMin: Cijk_Alik_Bljk_HSS_BH_MT32x32x32_MI16x16x16x1_SE_1LDSB1_AF0EM8_GRVW8_GSU1_LBSPP128_PLR2_SU0_SUS0_SRVW4_TT1_16_VAW2_WG32_8_1_WGM1
    SolutionIndex: 85
    SolutionNameMin: Cijk_Alik_Bljk_HSS_BH_MT64x64x32_MI32x32x8x1_SE_1LDSB1_AF0EM1_GRVW8_GSU1_LBSPP128_PLR5_SU0_SUS0_SRVW4_TT1_32_VAW2_WG64_4_1_WGM1
    SolutionIndex: 86
    SolutionNameMin: Cijk_Alik_Bljk_HSS_BH_MT32x32x32_MI16x16x16x1_SE_1LDSB1_AF0EM8_GRVW4_GSU1_LBSPP128_PLR2_SU0_SUS0_SRVW4_TT1_16_VAW2_WG32_8_1_WGM1
    SolutionIndex: 87
    SolutionNameMin: Cijk_Alik_Bljk_HSS_BH_MT64x32x32_MI16x16x16x1_SE_1LDSB1_AF0EM8_GRVW8_GSU1_LBSPP128_PLR2_SU0_SUS0_SRVW4_TT2_16_VAW2_WG32_8_1_WGM1
    SolutionIndex: 88
    SolutionNameMin: Cijk_Alik_Bljk_HSS_BH_MT32x64x32_MI16x16x16x1_SE_1LDSB0_AF0EM8_GRVW4_GSU1_LBSPP128_PLR2_SU0_SUS0_SRVW4_TT1_32_VAW2_WG32_8_1_WGM15
    SolutionIndex: 89
    SolutionNameMin: Cijk_Alik_Bljk_HSS_BH_MT16x16x32_MI16x16x16x1_SE_1LDSB0_AF0EM1_GRVW8_GSU1_LBSPP128_PLR2_SU0_SUS0_SRVW0_TT1_16_VAW2_WG16_4_1_WGM1
    SolutionIndex: 90
    SolutionNameMin: Cijk_Alik_Bljk_HSS_BH_MT32x32x32_MI16x16x16x1_SE_1LDSB1_AF0EM1_GRVW8_GSU1_LBSPP128_PLR2_SU0_SUS0_SRVW4_TT1_16_VAW2_WG32_8_1_WGM1
    SolutionIndex: 91
    SolutionNameMin: Cijk_Alik_Bljk_HSS_BH_MT16x16x64_MI16x16x16x1_SE_1LDSB0_AF0EM1_GRVW8_GSU1_LBSPP128_PLR5_SU0_SUS0_SRVW0_TT1_16_VAW2_WG16_4_1_WGM15
    SolutionIndex: 92
    SolutionNameMin: Cijk_Alik_Bljk_HSS_BH_MT32x32x32_MI16x16x16x1_SE_1LDSB1_AF0EM1_GRVW2_GSU1_LBSPP128_PLR2_SU0_SUS0_SRVW4_TT1_16_VAW2_WG32_8_1_WGM2
    SolutionIndex: 93
    SolutionNameMin: Cijk_Alik_Bljk_HSS_BH_MT32x32x32_MI16x16x16x1_SE_1LDSB1_AF0EM1_GRVW2_GSU1_LBSPP128_PLR2_SU0_SUS0_SRVW4_TT1_16_VAW2_WG32_8_1_WGM1
    SolutionIndex: 94
    SolutionNameMin: Cijk_Alik_Bljk_HSS_BH_MT32x32x32_MI16x16x16x1_SE_1LDSB1_AF0EM1_GRVW8_GSU1_LBSPP128_PLR2_SU0_SUS0_SRVW4_TT1_16_VAW2_WG32_8_1_WGM2
    SolutionIndex: 95
    SolutionNameMin: Cijk_Alik_Bljk_HSS_BH_MT64x128x32_MI32x32x8x1_SE_1LDSB1_AF0EM8_GRVW8_GSU1_LBSPP128_PLR5_SU0_SUS0_SRVW4_TT1_64_VAW2_WG64_4_1_WGM1
    SolutionIndex: 96
    SolutionNameMin: Cijk_Alik_Bljk_HSS_BH_MT32x32x64_MI16x16x16x1_SE_1LDSB0_AF0EM1_GRVW4_GSU1_LBSPP128_PLR5_SU0_SUS0_SRVW4_TT1_16_VAW2_WG32_8_1_WGM1
    SolutionIndex: 97
    SolutionNameMin: Cijk_Alik_Bljk_HSS_BH_MT96x96x64_MI16x16x16x1_SE_1LDSB1_AF0EM8_GRVW8_GSU1_LBSPP128_PLR5_SU32_SUS256_SRVW0_TT3_48_VAW2_WG32_8_1_WGM2
    SolutionIndex: 98
    SolutionNameMin: Cijk_Alik_Bljk_HSS_BH_MT128x96x64_MI32x32x8x1_SE_1LDSB1_AF0EM1_GRVW8_GSU1_LBSPP128_PLR9_SU0_SUS0_SRVW4_TT1_96_VAW2_WG128_2_1_WGM15
    SolutionIndex: 99
    SolutionNameMin: Cijk_Alik_Bljk_HSS_BH_MT96x128x64_MI32x32x8x1_SE_1LDSB1_AF0EM8_GRVW8_GSU1_LBSPP128_PLR9_SU32_SUS256_SRVW0_TT3_32_VAW2_WG32_8_1_WGM2
    SolutionIndex: 100
    SolutionNameMin: Cijk_Alik_Bljk_HSS_BH_MT128x144x32_MI16x16x16x1_SE_1LDSB1_AF0EM8_GRVW2_GSU1_LBSPP128_PLR2_SU0_SUS0_SRVW4_TT2_144_VAW2_WG64_4_1_WGM1
    SolutionIndex: 101
    SolutionNameMin: Cijk_Alik_Bljk_HSS_BH_MT32x64x32_MI16x16x16x1_SE_1LDSB1_AF0EM8_GRVW2_GSU1_LBSPP128_PLR2_SU0_SUS0_SRVW4_TT1_32_VAW2_WG32_8_1_WGM15
    SolutionIndex: 102
    SolutionNameMin: Cijk_Alik_Bljk_HSS_BH_MT64x64x64_MI32x32x8x1_SE_1LDSB1_AF0EM8_GRVW4_GSU1_LBSPP128_PLR9_SU0_SUS0_SRVW4_TT1_32_VAW2_WG64_4_1_WGM1
    SolutionIndex: 103
    SolutionNameMin: Cijk_Alik_Bljk_HSS_BH_MT128x64x64_MI32x32x8x1_SE_1LDSB1_AF0EM8_GRVW8_GSU1_LBSPP128_PLR9_SU0_SUS0_SRVW4_TT2_32_VAW2_WG64_4_1_WGM2
    SolutionIndex: 104
    SolutionNameMin: Cijk_Alik_Bljk_HSS_BH_MT32x64x64_MI16x16x16x1_SE_1LDSB1_AF0EM8_GRVW8_GSU1_LBSPP128_PLR5_SU32_SUS256_SRVW4_TT1_32_VAW2_WG32_8_1_WGM2
    SolutionIndex: 105
    SolutionNameMin: Cijk_Alik_Bljk_HSS_BH_MT32x64x32_MI16x16x16x1_SE_1LDSB1_AF0EM8_GRVW2_GSU1_LBSPP128_PLR2_SU0_SUS0_SRVW4_TT1_32_VAW2_WG32_8_1_WGM1
    SolutionIndex: 106
    SolutionNameMin: Cijk_Alik_Bljk_HSS_BH_MT128x160x32_MI32x32x8x1_SE_1LDSB1_AF0EM8_GRVW4_GSU1_LBSPP128_PLR5_SU32_SUS128_SRVW4_TT1_160_VAW2_WG128_2_1_WGM15
    SolutionIndex: 107
    SolutionNameMin: Cijk_Alik_Bljk_HSS_BH_MT160x128x64_MI32x32x8x1_SE_1LDSB1_AF0EM8_GRVW4_GSU1_LBSPP128_PLR9_SU0_SUS0_SRVW0_TT5_32_VAW2_WG32_8_1_WGM1
    SolutionIndex: 108
    SolutionNameMin: Cijk_Alik_Bljk_HSS_BH_MT64x128x32_MI32x32x8x1_SE_1LDSB1_AF0EM8_GRVW8_GSU1_LBSPP128_PLR5_SU32_SUS256_SRVW4_TT1_64_VAW2_WG64_4_1_WGM1
    SolutionIndex: 109
    SolutionNameMin: Cijk_Alik_Bljk_HSS_BH_MT160x160x64_MI16x16x16x1_SE_1LDSB1_AF0EM8_GRVW8_GSU1_LBSPP128_PLR5_SU0_SUS0_SRVW0_TT5_80_VAW2_WG32_8_1_WGM1
    SolutionIndex: 110
    SolutionNameMin: Cijk_Alik_Bljk_HSS_BH_MT128x128x64_MI32x32x8x1_SE_1LDSB1_AF0EM8_GRVW4_GSU3_LBSPP128_PLR9_SU32_SUS256_SRVW0_TT2_64_VAW1_WG64_4_1_WGM15
    SolutionIndex: 111
    SolutionNameMin: Cijk_Alik_Bljk_HSS_BH_MT128x256x64_MI32x32x8x1_SE_1LDSB1_AF0EM8_GRVW2_GSU1_LBSPP128_PLR9_SU32_SUS128_SRVW4_TT2_128_VAW2_WG64_4_1_WGM2
    SolutionIndex: 112
    SolutionNameMin: Cijk_Alik_Bljk_HSS_BH_MT128x128x64_MI32x32x8x1_SE_1LDSB1_AF0EM8_GRVW8_GSU1_LBSPP128_PLR9_SU32_SUS128_SRVW4_TT2_64_VAW2_WG64_4_1_WGM15
    SolutionIndex: 113
    SolutionNameMin: Cijk_Alik_Bljk_HSS_BH_MT64x64x64_MI32x32x8x1_SE_1LDSB1_AF0EM8_GRVW8_GSU3_LBSPP128_PLR9_SU0_SUS0_SRVW0_TT1_32_VAW1_WG64_4_1_WGM1
    SolutionIndex: 114
    SolutionNameMin: Cijk_Alik_Bljk_HSS_BH_MT64x64x64_MI32x32x8x1_SE_1LDSB1_AF0EM8_GRVW8_GSU2_LBSPP128_PLR9_SU32_SUS128_SRVW0_TT1_32_VAW1_WG64_4_1_WGM15
    SolutionIndex: 115
    SolutionNameMin: Cijk_Alik_Bljk_HSS_BH_MT256x160x64_MI32x32x8x1_SE_1LDSB1_AF0EM8_GRVW2_GSU1_LBSPP128_PLR9_SU0_SUS0_SRVW4_TT2_160_VAW2_WG128_2_1_WGM2
    SolutionIndex: 116
    SolutionNameMin: Cijk_Alik_Bljk_HSS_BH_MT160x256x64_MI32x32x8x1_SE_1LDSB1_AF0EM8_GRVW2_GSU1_LBSPP128_PLR9_SU0_SUS0_SRVW0_TT5_64_VAW2_WG32_8_1_WGM15
    SolutionIndex: 117
    SolutionNameMin: Cijk_Alik_Bljk_HSS_BH_MT128x96x64_MI32x32x8x1_SE_1LDSB1_AF0EM1_GRVW8_GSU1_LBSPP128_PLR9_SU0_SUS0_SRVW4_TT1_96_VAW2_WG128_2_1_WGM2
- - - [512, 8, 1, 500000]
    - [0, 2.367]
  - - [512, 16, 1, 500000]
    - [1, 3.364]
  - - [1024, 8, 1, 500000]
    - [0, 2.901]
  - - [1024, 16, 1, 500000]
    - [2, 3.923]
  - - [1760, 16, 1, 1760]
    - [3, 2.164]
  - - [3072, 16, 1, 1024]
    - [3, 3.78]
  - - [2048, 16, 1, 2048]
    - [4, 3.857]
  - - [2560, 16, 1, 2560]
    - [5, 5.322]
  - - [4608, 16, 1, 1536]
    - [6, 7.049]
  - - [6144, 16, 1, 2560]
    - [6, 10.99]
  - - [4096, 16, 1, 4096]
    - [7, 9.392]
  - - [7680, 16, 1, 2560]
    - [5, 12.055]
  - - [8448, 16, 1, 2816]
    - [8, 12.878]
  - - [64, 64, 1, 256]
    - [9, 0.11]
  - - [128, 64, 1, 256]
    - [10, 0.257]
  - - [64, 128, 1, 256]
    - [5, 0.249]
  - - [128, 128, 1, 256]
    - [3, 0.503]
  - - [64, 256, 1, 256]
    - [3, 0.473]
  - - [128, 256, 1, 256]
    - [11, 0.883]
  - - [64, 448, 1, 256]
    - [2, 0.78]
  - - [128, 448, 1, 256]
    - [8, 1.49]
  - - [64, 704, 1, 256]
    - [12, 1.214]
  - - [128, 704, 1, 256]
    - [13, 2.321]
  - - [64, 1024, 1, 256]
    - [8, 1.688]
  - - [128, 1024, 1, 256]
    - [13, 3.287]
  - - [64, 1408, 1, 256]
    - [4, 2.28]
  - - [128, 1408, 1, 256]
    - [8, 4.226]
  - - [64, 1856, 1, 256]
    - [12, 3.032]
  - - [128, 1856, 1, 256]
    - [14, 4.894]
  - - [64, 2368, 1, 256]
    - [8, 3.801]
  - - [128, 2368, 1, 256]
    - [15, 6.381]
  - - [64, 2944, 1, 256]
    - [13, 4.455]
  - - [128, 2944, 1, 256]
    - [14, 7.819]
  - - [64, 3584, 1, 256]
    - [6, 4.829]
  - - [128, 3584, 1, 256]
    - [15, 9.188]
  - - [64, 4288, 1, 256]
    - [16, 5.574]
  - - [128, 4288, 1, 256]
    - [16, 10.347]
  - - [64, 5056, 1, 256]
    - [15, 6.527]
  - - [128, 5056, 1, 256]
    - [16, 11.74]
  - - [64, 5888, 1, 256]
    - [16, 7.548]
  - - [128, 5888, 1, 256]
    - [17, 13.758]
  - - [64, 6784, 1, 256]
    - [16, 8.519]
  - - [128, 6784, 1, 256]
    - [18, 15.272]
  - - [64, 64, 1, 1280]
    - [6, 0.407]
  - - [128, 64, 1, 1280]
    - [3, 0.895]
  - - [64, 128, 1, 1280]
    - [2, 0.793]
  - - [128, 128, 1, 1280]
    - [11, 1.688]
  - - [64, 256, 1, 1280]
    - [2, 1.607]
  - - [128, 256, 1, 1280]
    - [6, 3.109]
  - - [64, 448, 1, 1280]
    - [6, 2.794]
  - - [128, 448, 1, 1280]
    - [12, 5.37]
  - - [64, 704, 1, 1280]
    - [12, 4.303]
  - - [128, 704, 1, 1280]
    - [8, 8.022]
  - - [64, 1024, 1, 1280]
    - [12, 5.982]
  - - [128, 1024, 1, 1280]
    - [12, 10.501]
  - - [64, 1408, 1, 1280]
    - [12, 8.225]
  - - [128, 1408, 1, 1280]
    - [8, 12.202]
  - - [64, 1856, 1, 1280]
    - [8, 9.517]
  - - [128, 1856, 1, 1280]
    - [19, 13.871]
  - - [64, 2368, 1, 1280]
    - [6, 11.151]
  - - [128, 2368, 1, 1280]
    - [14, 17.626]
  - - [64, 2944, 1, 1280]
    - [6, 12.817]
  - - [128, 2944, 1, 1280]
    - [19, 22.002]
  - - [64, 3584, 1, 1280]
    - [14, 13.075]
  - - [128, 3584, 1, 1280]
    - [20, 22.892]
  - - [64, 4288, 1, 1280]
    - [21, 15.46]
  - - [128, 4288, 1, 1280]
    - [18, 26.561]
  - - [64, 5056, 1, 1280]
    - [19, 18.157]
  - - [128, 5056, 1, 1280]
    - [18, 31.424]
  - - [64, 5888, 1, 1280]
    - [21, 21.395]
  - - [128, 5888, 1, 1280]
    - [17, 36.595]
  - - [64, 6784, 1, 1280]
    - [21, 24.175]
  - - [128, 6784, 1, 1280]
    - [17, 41.466]
  - - [64, 64, 1, 3328]
    - [4, 0.671]
  - - [128, 64, 1, 3328]
    - [22, 1.359]
  - - [64, 128, 1, 3328]
    - [2, 1.318]
  - - [128, 128, 1, 3328]
    - [23, 2.614]
  - - [64, 256, 1, 3328]
    - [8, 2.648]
  - - [128, 256, 1, 3328]
    - [9, 5.098]
  - - [64, 448, 1, 3328]
    - [2, 4.536]
  - - [128, 448, 1, 3328]
    - [12, 8.848]
  - - [64, 704, 1, 3328]
    - [2, 7.039]
  - - [128, 704, 1, 3328]
    - [12, 13.355]
  - - [64, 1024, 1, 3328]
    - [12, 10.239]
  - - [128, 1024, 1, 3328]
    - [12, 15.503]
  - - [64, 1408, 1, 3328]
    - [12, 12.896]
  - - [128, 1408, 1, 3328]
    - [6, 16.283]
  - - [64, 1856, 1, 3328]
    - [6, 14.555]
  - - [128, 1856, 1, 3328]
    - [19, 18.674]
  - - [64, 2368, 1, 3328]
    - [6, 16.329]
  - - [128, 2368, 1, 3328]
    - [14, 23.826]
  - - [64, 2944, 1, 3328]
    - [7, 17.706]
  - - [128, 2944, 1, 3328]
    - [14, 29.497]
  - - [64, 3584, 1, 3328]
    - [21, 17.66]
  - - [128, 3584, 1, 3328]
    - [24, 30.23]
  - - [64, 4288, 1, 3328]
    - [15, 20.746]
  - - [128, 4288, 1, 3328]
    - [18, 33.904]
  - - [64, 5056, 1, 3328]
    - [21, 24.66]
  - - [128, 5056, 1, 3328]
    - [25, 40.783]
  - - [64, 5888, 1, 3328]
    - [21, 28.544]
  - - [128, 5888, 1, 3328]
    - [25, 47.494]
  - - [64, 6784, 1, 3328]
    - [15, 31.983]
  - - [128, 6784, 1, 3328]
    - [25, 54.265]
  - - [256, 64, 1, 256]
    - [12, 0.454]
  - - [448, 64, 1, 256]
    - [2, 0.773]
  - - [704, 64, 1, 256]
    - [2, 1.192]
  - - [1024, 64, 1, 256]
    - [8, 1.718]
  - - [1408, 64, 1, 256]
    - [5, 2.3]
  - - [1856, 64, 1, 256]
    - [8, 3.005]
  - - [2368, 64, 1, 256]
    - [8, 3.801]
  - - [2944, 64, 1, 256]
    - [8, 4.454]
  - - [3584, 64, 1, 256]
    - [14, 4.974]
  - - [4288, 64, 1, 256]
    - [14, 5.614]
  - - [5056, 64, 1, 256]
    - [14, 6.666]
  - - [5888, 64, 1, 256]
    - [14, 7.548]
  - - [6784, 64, 1, 256]
    - [16, 9.009]
  - - [256, 128, 1, 256]
    - [26, 0.883]
  - - [448, 128, 1, 256]
    - [4, 1.477]
  - - [704, 128, 1, 256]
    - [12, 2.321]
  - - [1024, 128, 1, 256]
    - [8, 3.346]
  - - [1408, 128, 1, 256]
    - [5, 4.261]
  - - [1856, 128, 1, 256]
    - [14, 5.312]
  - - [2368, 128, 1, 256]
    - [19, 6.524]
  - - [2944, 128, 1, 256]
    - [14, 8.051]
  - - [3584, 128, 1, 256]
    - [19, 9.318]
  - - [4288, 128, 1, 256]
    - [16, 10.625]
  - - [5056, 128, 1, 256]
    - [16, 12.2]
  - - [5888, 128, 1, 256]
    - [24, 13.671]
  - - [6784, 128, 1, 256]
    - [24, 15.365]
  - - [256, 64, 1, 1280]
    - [26, 1.596]
  - - [448, 64, 1, 1280]
    - [3, 2.757]
  - - [704, 64, 1, 1280]
    - [9, 4.165]
  - - [1024, 64, 1, 1280]
    - [5, 5.834]
  - - [1408, 64, 1, 1280]
    - [4, 7.782]
  - - [1856, 64, 1, 1280]
    - [8, 9.16]
  - - [2368, 64, 1, 1280]
    - [5, 11.208]
  - - [2944, 64, 1, 1280]
    - [5, 12.638]
  - - [3584, 64, 1, 1280]
    - [19, 13.075]
  - - [4288, 64, 1, 1280]
    - [14, 15.643]
  - - [5056, 64, 1, 1280]
    - [14, 18.087]
  - - [5888, 64, 1, 1280]
    - [19, 21.063]
  - - [6784, 64, 1, 1280]
    - [14, 23.717]
  - - [256, 128, 1, 1280]
    - [7, 3.109]
  - - [448, 128, 1, 1280]
    - [12, 5.074]
  - - [704, 128, 1, 1280]
    - [6, 7.782]
  - - [1024, 128, 1, 1280]
    - [6, 9.794]
  - - [1408, 128, 1, 1280]
    - [4, 11.707]
  - - [1856, 128, 1, 1280]
    - [16, 13.435]
  - - [2368, 128, 1, 1280]
    - [20, 17.075]
  - - [2944, 128, 1, 1280]
    - [16, 20.982]
  - - [3584, 128, 1, 1280]
    - [18, 22.502]
  - - [4288, 128, 1, 1280]
    - [27, 25.533]
  - - [5056, 128, 1, 1280]
    - [17, 30.802]
  - - [5888, 128, 1, 1280]
    - [17, 37.222]
  - - [6784, 128, 1, 1280]
    - [25, 42.451]
  - - [256, 64, 1, 3328]
    - [3, 2.603]
  - - [448, 64, 1, 3328]
    - [3, 4.536]
  - - [704, 64, 1, 3328]
    - [6, 6.785]
  - - [1024, 64, 1, 3328]
    - [5, 9.415]
  - - [1408, 64, 1, 3328]
    - [4, 12.702]
  - - [1856, 64, 1, 3328]
    - [12, 14.414]
  - - [2368, 64, 1, 3328]
    - [4, 16.471]
  - - [2944, 64, 1, 3328]
    - [4, 17.976]
  - - [3584, 64, 1, 3328]
    - [19, 18.183]
  - - [4288, 64, 1, 3328]
    - [19, 21.348]
  - - [5056, 64, 1, 3328]
    - [19, 24.61]
  - - [5888, 64, 1, 3328]
    - [14, 28.035]
  - - [6784, 64, 1, 3328]
    - [19, 30.832]
  - - [256, 128, 1, 3328]
    - [9, 5.077]
  - - [448, 128, 1, 3328]
    - [28, 8.238]
  - - [704, 128, 1, 3328]
    - [4, 12.331]
  - - [1024, 128, 1, 3328]
    - [5, 14.848]
  - - [1408, 128, 1, 3328]
    - [7, 16.442]
  - - [1856, 128, 1, 3328]
    - [14, 18.366]
  - - [2368, 128, 1, 3328]
    - [19, 23.006]
  - - [2944, 128, 1, 3328]
    - [16, 28.602]
  - - [3584, 128, 1, 3328]
    - [29, 29.555]
  - - [4288, 128, 1, 3328]
    - [17, 34.881]
  - - [5056, 128, 1, 3328]
    - [30, 40.175]
  - - [5888, 128, 1, 3328]
    - [25, 47.978]
  - - [6784, 128, 1, 3328]
    - [17, 55.467]
  - - [256, 256, 1, 256]
    - [31, 1.703]
  - - [448, 256, 1, 256]
    - [8, 2.734]
  - - [256, 448, 1, 256]
    - [13, 2.78]
  - - [448, 448, 1, 256]
    - [19, 4.353]
  - - [256, 256, 1, 1280]
    - [6, 5.907]
  - - [448, 256, 1, 1280]
    - [6, 9.24]
  - - [256, 448, 1, 1280]
    - [6, 8.892]
  - - [448, 448, 1, 1280]
    - [19, 12.53]
  - - [256, 256, 1, 3328]
    - [8, 9.599]
  - - [448, 256, 1, 3328]
    - [4, 13.481]
  - - [256, 448, 1, 3328]
    - [12, 13.783]
  - - [448, 448, 1, 3328]
    - [14, 16.949]
  - - [1760, 32, 1, 1760]
    - [2, 4.23]
  - - [3072, 32, 1, 1024]
    - [12, 7.365]
  - - [2048, 32, 1, 2048]
    - [8, 7.637]
  - - [1760, 64, 1, 1760]
    - [32, 7.783]
  - - [3072, 64, 1, 1024]
    - [4, 10.649]
  - - [2560, 32, 1, 2560]
    - [12, 10.228]
  - - [4608, 32, 1, 1536]
    - [4, 11.495]
  - - [2048, 64, 1, 2048]
    - [8, 10.612]
  - - [1760, 128, 1, 1760]
    - [33, 13.024]
  - - [3072, 128, 1, 1024]
    - [20, 20.073]
  - - [2560, 64, 1, 2560]
    - [4, 15.596]
  - - [6144, 32, 1, 2560]
    - [4, 16.629]
  - - [2048, 128, 1, 2048]
    - [16, 17.843]
  - - [4096, 32, 1, 4096]
    - [4, 13.412]
  - - [7680, 32, 1, 2560]
    - [19, 15.682]
  - - [8448, 32, 1, 2816]
    - [16, 17.154]
  - - [2560, 128, 1, 2560]
    - [29, 23.687]
  - - [4096, 64, 1, 4096]
    - [14, 20.4]
  - - [7680, 64, 1, 2560]
    - [30, 26.449]
  - - [4096, 128, 1, 4096]
    - [34, 33.557]
  - - [7680, 128, 1, 2560]
    - [24, 41.331]
  - - [704, 256, 1, 256]
    - [16, 3.938]
  - - [1024, 256, 1, 256]
    - [19, 5.439]
  - - [1408, 256, 1, 256]
    - [16, 7.321]
  - - [1856, 256, 1, 256]
    - [35, 8.729]
  - - [2368, 256, 1, 256]
    - [16, 11.353]
  - - [2944, 256, 1, 256]
    - [18, 13.758]
  - - [3584, 256, 1, 256]
    - [18, 14.001]
  - - [4288, 256, 1, 256]
    - [17, 16.49]
  - - [5056, 256, 1, 256]
    - [24, 18.855]
  - - [5888, 256, 1, 256]
    - [34, 19.496]
  - - [6784, 256, 1, 256]
    - [34, 21.779]
  - - [704, 448, 1, 256]
    - [15, 6.498]
  - - [1024, 448, 1, 256]
    - [21, 8.94]
  - - [1408, 448, 1, 256]
    - [18, 11.515]
  - - [1856, 448, 1, 256]
    - [27, 14.713]
  - - [2368, 448, 1, 256]
    - [18, 15.853]
  - - [2944, 448, 1, 256]
    - [17, 19.508]
  - - [3584, 448, 1, 256]
    - [18, 18.749]
  - - [4288, 448, 1, 256]
    - [24, 20.37]
  - - [5056, 448, 1, 256]
    - [36, 22.373]
  - - [5888, 448, 1, 256]
    - [17, 23.628]
  - - [6784, 448, 1, 256]
    - [34, 23.313]
  - - [256, 704, 1, 256]
    - [14, 4.029]
  - - [448, 704, 1, 256]
    - [14, 6.497]
  - - [704, 704, 1, 256]
    - [19, 9.105]
  - - [1024, 704, 1, 256]
    - [17, 13.077]
  - - [1408, 704, 1, 256]
    - [17, 15.127]
  - - [1856, 704, 1, 256]
    - [24, 19.228]
  - - [2368, 704, 1, 256]
    - [17, 19.388]
  - - [2944, 704, 1, 256]
    - [24, 21.897]
  - - [3584, 704, 1, 256]
    - [17, 23.86]
  - - [4288, 704, 1, 256]
    - [14, 23.532]
  - - [5056, 704, 1, 256]
    - [17, 25.795]
  - - [5888, 704, 1, 256]
    - [17, 25.492]
  - - [6784, 704, 1, 256]
    - [37, 26.49]
  - - [256, 1024, 1, 256]
    - [16, 5.362]
  - - [448, 1024, 1, 256]
    - [16, 9.001]
  - - [704, 1024, 1, 256]
    - [24, 13.077]
  - - [1024, 1024, 1, 256]
    - [24, 15.67]
  - - [1408, 1024, 1, 256]
    - [34, 18.817]
  - - [1856, 1024, 1, 256]
    - [24, 20.764]
  - - [2368, 1024, 1, 256]
    - [25, 23.158]
  - - [2944, 1024, 1, 256]
    - [17, 24.424]
  - - [3584, 1024, 1, 256]
    - [25, 25.944]
  - - [4288, 1024, 1, 256]
    - [25, 27.003]
  - - [5056, 1024, 1, 256]
    - [36, 28.069]
  - - [5888, 1024, 1, 256]
    - [17, 27.516]
  - - [6784, 1024, 1, 256]
    - [34, 27.828]
  - - [256, 1408, 1, 256]
    - [19, 7.479]
  - - [448, 1408, 1, 256]
    - [17, 11.891]
  - - [704, 1408, 1, 256]
    - [24, 15.289]
  - - [1024, 1408, 1, 256]
    - [38, 19.076]
  - - [1408, 1408, 1, 256]
    - [24, 21.577]
  - - [1856, 1408, 1, 256]
    - [24, 24.712]
  - - [2368, 1408, 1, 256]
    - [17, 25.174]
  - - [2944, 1408, 1, 256]
    - [39, 26.806]
  - - [3584, 1408, 1, 256]
    - [24, 28.651]
  - - [4288, 1408, 1, 256]
    - [17, 28.975]
  - - [5056, 1408, 1, 256]
    - [17, 29.458]
  - - [5888, 1408, 1, 256]
    - [17, 29.231]
  - - [6784, 1408, 1, 256]
    - [17, 28.608]
  - - [256, 1856, 1, 256]
    - [16, 9.26]
  - - [448, 1856, 1, 256]
    - [24, 14.895]
  - - [704, 1856, 1, 256]
    - [17, 19.426]
  - - [1024, 1856, 1, 256]
    - [25, 20.922]
  - - [1408, 1856, 1, 256]
    - [17, 24.631]
  - - [1856, 1856, 1, 256]
    - [24, 26.284]
  - - [2368, 1856, 1, 256]
    - [24, 27.799]
  - - [2944, 1856, 1, 256]
    - [17, 28.864]
  - - [3584, 1856, 1, 256]
    - [24, 30.551]
  - - [4288, 1856, 1, 256]
    - [17, 30.894]
  - - [5056, 1856, 1, 256]
    - [17, 31.181]
  - - [5888, 1856, 1, 256]
    - [17, 30.601]
  - - [6784, 1856, 1, 256]
    - [36, 29.429]
  - - [256, 2368, 1, 256]
    - [24, 11.354]
  - - [448, 2368, 1, 256]
    - [24, 15.854]
  - - [704, 2368, 1, 256]
    - [38, 21.275]
  - - [1024, 2368, 1, 256]
    - [17, 23.708]
  - - [1408, 2368, 1, 256]
    - [24, 25.644]
  - - [1856, 2368, 1, 256]
    - [25, 27.983]
  - - [2368, 2368, 1, 256]
    - [17, 29.246]
  - - [2944, 2368, 1, 256]
    - [17, 31.271]
  - - [3584, 2368, 1, 256]
    - [24, 31.382]
  - - [4288, 2368, 1, 256]
    - [25, 31.661]
  - - [5056, 2368, 1, 256]
    - [17, 32.004]
  - - [5888, 2368, 1, 256]
    - [17, 31.03]
  - - [6784, 2368, 1, 256]
    - [19, 29.682]
  - - [256, 2944, 1, 256]
    - [24, 13.671]
  - - [448, 2944, 1, 256]
    - [17, 19.116]
  - - [704, 2944, 1, 256]
    - [17, 22.222]
  - - [1024, 2944, 1, 256]
    - [17, 25.058]
  - - [1408, 2944, 1, 256]
    - [17, 27.172]
  - - [1856, 2944, 1, 256]
    - [17, 29.024]
  - - [2368, 2944, 1, 256]
    - [24, 31.126]
  - - [2944, 2944, 1, 256]
    - [17, 32.339]
  - - [3584, 2944, 1, 256]
    - [17, 32.935]
  - - [4288, 2944, 1, 256]
    - [17, 32.567]
  - - [5056, 2944, 1, 256]
    - [27, 31.591]
  - - [5888, 2944, 1, 256]
    - [17, 31.824]
  - - [6784, 2944, 1, 256]
    - [40, 30.223]
  - - [256, 3584, 1, 256]
    - [25, 14.076]
  - - [448, 3584, 1, 256]
    - [38, 20.767]
  - - [704, 3584, 1, 256]
    - [17, 24.339]
  - - [1024, 3584, 1, 256]
    - [24, 26.663]
  - - [1408, 3584, 1, 256]
    - [24, 28.764]
  - - [1856, 3584, 1, 256]
    - [17, 30.796]
  - - [2368, 3584, 1, 256]
    - [17, 31.914]
  - - [2944, 3584, 1, 256]
    - [17, 33.332]
  - - [3584, 3584, 1, 256]
    - [17, 33.803]
  - - [4288, 3584, 1, 256]
    - [17, 33.228]
  - - [5056, 3584, 1, 256]
    - [25, 32.543]
  - - [5888, 3584, 1, 256]
    - [25, 32.102]
  - - [6784, 3584, 1, 256]
    - [19, 30.556]
  - - [256, 4288, 1, 256]
    - [17, 16.072]
  - - [448, 4288, 1, 256]
    - [17, 20.908]
  - - [704, 4288, 1, 256]
    - [24, 24.876]
  - - [1024, 4288, 1, 256]
    - [17, 28.206]
  - - [1408, 4288, 1, 256]
    - [24, 29.972]
  - - [1856, 4288, 1, 256]
    - [17, 32.059]
  - - [2368, 4288, 1, 256]
    - [24, 33.242]
  - - [2944, 4288, 1, 256]
    - [17, 33.997]
  - - [3584, 4288, 1, 256]
    - [17, 34.468]
  - - [4288, 4288, 1, 256]
    - [17, 33.843]
  - - [5056, 4288, 1, 256]
    - [17, 32.911]
  - - [5888, 4288, 1, 256]
    - [17, 32.451]
  - - [6784, 4288, 1, 256]
    - [40, 31.052]
  - - [256, 5056, 1, 256]
    - [24, 18.855]
  - - [448, 5056, 1, 256]
    - [18, 23.085]
  - - [704, 5056, 1, 256]
    - [24, 26.324]
  - - [1024, 5056, 1, 256]
    - [24, 29.395]
  - - [1408, 5056, 1, 256]
    - [24, 31.016]
  - - [1856, 5056, 1, 256]
    - [24, 32.609]
  - - [2368, 5056, 1, 256]
    - [17, 33.657]
  - - [2944, 5056, 1, 256]
    - [17, 34.428]
  - - [3584, 5056, 1, 256]
    - [17, 35.006]
  - - [4288, 5056, 1, 256]
    - [25, 34.471]
  - - [5056, 5056, 1, 256]
    - [17, 33.078]
  - - [5888, 5056, 1, 256]
    - [17, 32.898]
  - - [6784, 5056, 1, 256]
    - [19, 31.022]
  - - [256, 5888, 1, 256]
    - [38, 19.496]
  - - [448, 5888, 1, 256]
    - [24, 24.385]
  - - [704, 5888, 1, 256]
    - [17, 26.867]
  - - [1024, 5888, 1, 256]
    - [24, 29.676]
  - - [1408, 5888, 1, 256]
    - [24, 32.01]
  - - [1856, 5888, 1, 256]
    - [17, 33.531]
  - - [2368, 5888, 1, 256]
    - [17, 34.489]
  - - [2944, 5888, 1, 256]
    - [17, 35.134]
  - - [3584, 5888, 1, 256]
    - [17, 35.325]
  - - [4288, 5888, 1, 256]
    - [17, 34.545]
  - - [5056, 5888, 1, 256]
    - [17, 33.384]
  - - [5888, 5888, 1, 256]
    - [17, 33.143]
  - - [6784, 5888, 1, 256]
    - [40, 31.538]
  - - [256, 6784, 1, 256]
    - [34, 21.498]
  - - [448, 6784, 1, 256]
    - [18, 25.046]
  - - [704, 6784, 1, 256]
    - [17, 28.46]
  - - [1024, 6784, 1, 256]
    - [24, 30.873]
  - - [1408, 6784, 1, 256]
    - [25, 32.26]
  - - [1856, 6784, 1, 256]
    - [17, 33.595]
  - - [2368, 6784, 1, 256]
    - [17, 34.88]
  - - [2944, 6784, 1, 256]
    - [17, 35.558]
  - - [3584, 6784, 1, 256]
    - [17, 35.616]
  - - [4288, 6784, 1, 256]
    - [17, 35.223]
  - - [5056, 6784, 1, 256]
    - [17, 33.547]
  - - [5888, 6784, 1, 256]
    - [17, 33.297]
  - - [6784, 6784, 1, 256]
    - [14, 31.44]
  - - [704, 256, 1, 1280]
    - [7, 11.868]
  - - [1024, 256, 1, 1280]
    - [27, 15.368]
  - - [1408, 256, 1, 1280]
    - [29, 20.876]
  - - [1856, 256, 1, 1280]
    - [20, 23.071]
  - - [2368, 256, 1, 1280]
    - [30, 28.293]
  - - [2944, 256, 1, 1280]
    - [41, 35.06]
  - - [3584, 256, 1, 1280]
    - [18, 34.457]
  - - [4288, 256, 1, 1280]
    - [36, 41.769]
  - - [5056, 256, 1, 1280]
    - [30, 45.306]
  - - [5888, 256, 1, 1280]
    - [42, 45.763]
  - - [6784, 256, 1, 1280]
    - [43, 52.069]
  - - [704, 448, 1, 1280]
    - [27, 18.414]
  - - [1024, 448, 1, 1280]
    - [25, 23.213]
  - - [1408, 448, 1, 1280]
    - [41, 30.222]
  - - [1856, 448, 1, 1280]
    - [24, 38.681]
  - - [2368, 448, 1, 1280]
    - [40, 40.367]
  - - [2944, 448, 1, 1280]
    - [17, 46.733]
  - - [3584, 448, 1, 1280]
    - [30, 43.525]
  - - [4288, 448, 1, 1280]
    - [44, 45.565]
  - - [5056, 448, 1, 1280]
    - [45, 50.644]
  - - [5888, 448, 1, 1280]
    - [30, 51.199]
  - - [6784, 448, 1, 1280]
    - [46, 51.202]
  - - [256, 704, 1, 1280]
    - [6, 11.603]
  - - [448, 704, 1, 1280]
    - [47, 17.629]
  - - [704, 704, 1, 1280]
    - [24, 24.904]
  - - [1024, 704, 1, 1280]
    - [34, 35.361]
  - - [1408, 704, 1, 1280]
    - [18, 36.842]
  - - [1856, 704, 1, 1280]
    - [24, 47.108]
  - - [2368, 704, 1, 1280]
    - [30, 45.361]
  - - [2944, 704, 1, 1280]
    - [18, 48.442]
  - - [3584, 704, 1, 1280]
    - [18, 50.678]
  - - [4288, 704, 1, 1280]
    - [30, 51.95]
  - - [5056, 704, 1, 1280]
    - [48, 56.657]
  - - [5888, 704, 1, 1280]
    - [30, 53.806]
  - - [6784, 704, 1, 1280]
    - [48, 58.418]
  - - [256, 1024, 1, 1280]
    - [16, 14.767]
  - - [448, 1024, 1, 1280]
    - [18, 22.892]
  - - [704, 1024, 1, 1280]
    - [17, 33.754]
  - - [1024, 1024, 1, 1280]
    - [24, 39.379]
  - - [1408, 1024, 1, 1280]
    - [46, 44.908]
  - - [1856, 1024, 1, 1280]
    - [17, 46.612]
  - - [2368, 1024, 1, 1280]
    - [49, 54.131]
  - - [2944, 1024, 1, 1280]
    - [38, 50.377]
  - - [3584, 1024, 1, 1280]
    - [48, 56.666]
  - - [4288, 1024, 1, 1280]
    - [46, 55.742]
  - - [5056, 1024, 1, 1280]
    - [45, 61.351]
  - - [5888, 1024, 1, 1280]
    - [48, 57.913]
  - - [6784, 1024, 1, 1280]
    - [50, 57.312]
  - - [256, 1408, 1, 1280]
    - [16, 19.993]
  - - [448, 1408, 1, 1280]
    - [25, 29.535]
  - - [704, 1408, 1, 1280]
    - [51, 38.12]
  - - [1024, 1408, 1, 1280]
    - [38, 44.811]
  - - [1408, 1408, 1, 1280]
    - [24, 48.621]
  - - [1856, 1408, 1, 1280]
    - [52, 55.585]
  - - [2368, 1408, 1, 1280]
    - [34, 54.331]
  - - [2944, 1408, 1, 1280]
    - [34, 54.592]
  - - [3584, 1408, 1, 1280]
    - [45, 59.358]
  - - [4288, 1408, 1, 1280]
    - [45, 59.19]
  - - [5056, 1408, 1, 1280]
    - [45, 59.826]
  - - [5888, 1408, 1, 1280]
    - [45, 59.838]
  - - [6784, 1408, 1, 1280]
    - [45, 60.205]
  - - [256, 1856, 1, 1280]
    - [18, 23.958]
  - - [448, 1856, 1, 1280]
    - [17, 39.444]
  - - [704, 1856, 1, 1280]
    - [24, 47.825]
  - - [1024, 1856, 1, 1280]
    - [30, 47.013]
  - - [1408, 1856, 1, 1280]
    - [36, 57.624]
  - - [1856, 1856, 1, 1280]
    - [34, 57.497]
  - - [2368, 1856, 1, 1280]
    - [30, 56.189]
  - - [2944, 1856, 1, 1280]
    - [30, 57.855]
  - - [3584, 1856, 1, 1280]
    - [30, 59.033]
  - - [4288, 1856, 1, 1280]
    - [30, 59.498]
  - - [5056, 1856, 1, 1280]
    - [30, 61.345]
  - - [5888, 1856, 1, 1280]
    - [30, 61.9]
  - - [6784, 1856, 1, 1280]
    - [45, 63.224]
  - - [256, 2368, 1, 1280]
    - [25, 29.735]
  - - [448, 2368, 1, 1280]
    - [36, 40.689]
  - - [704, 2368, 1, 1280]
    - [38, 50.827]
  - - [1024, 2368, 1, 1280]
    - [53, 53.552]
  - - [1408, 2368, 1, 1280]
    - [41, 56.567]
  - - [1856, 2368, 1, 1280]
    - [17, 57.203]
  - - [2368, 2368, 1, 1280]
    - [30, 57.311]
  - - [2944, 2368, 1, 1280]
    - [34, 58.827]
  - - [3584, 2368, 1, 1280]
    - [30, 60.232]
  - - [4288, 2368, 1, 1280]
    - [45, 63.309]
  - - [5056, 2368, 1, 1280]
    - [45, 62.74]
  - - [5888, 2368, 1, 1280]
    - [45, 64.508]
  - - [6784, 2368, 1, 1280]
    - [45, 63.541]
  - - [256, 2944, 1, 1280]
    - [18, 35.635]
  - - [448, 2944, 1, 1280]
    - [24, 47.91]
  - - [704, 2944, 1, 1280]
    - [18, 49.982]
  - - [1024, 2944, 1, 1280]
    - [25, 54.344]
  - - [1408, 2944, 1, 1280]
    - [34, 57.645]
  - - [1856, 2944, 1, 1280]
    - [24, 56.284]
  - - [2368, 2944, 1, 1280]
    - [34, 59.665]
  - - [2944, 2944, 1, 1280]
    - [45, 59.406]
  - - [3584, 2944, 1, 1280]
    - [45, 63.19]
  - - [4288, 2944, 1, 1280]
    - [45, 62.647]
  - - [5056, 2944, 1, 1280]
    - [45, 63.005]
  - - [5888, 2944, 1, 1280]
    - [45, 65.423]
  - - [6784, 2944, 1, 1280]
    - [45, 65.743]
  - - [256, 3584, 1, 1280]
    - [24, 35.004]
  - - [448, 3584, 1, 1280]
    - [46, 49.058]
  - - [704, 3584, 1, 1280]
    - [18, 52.355]
  - - [1024, 3584, 1, 1280]
    - [53, 58.161]
  - - [1408, 3584, 1, 1280]
    - [37, 60.695]
  - - [1856, 3584, 1, 1280]
    - [41, 59.398]
  - - [2368, 3584, 1, 1280]
    - [45, 60.982]
  - - [2944, 3584, 1, 1280]
    - [45, 64.833]
  - - [3584, 3584, 1, 1280]
    - [45, 65.02]
  - - [4288, 3584, 1, 1280]
    - [45, 65.609]
  - - [5056, 3584, 1, 1280]
    - [45, 67.455]
  - - [5888, 3584, 1, 1280]
    - [45, 68.006]
  - - [6784, 3584, 1, 1280]
    - [45, 66.661]
  - - [256, 4288, 1, 1280]
    - [17, 40.384]
  - - [448, 4288, 1, 1280]
    - [18, 46.327]
  - - [704, 4288, 1, 1280]
    - [17, 54.079]
  - - [1024, 4288, 1, 1280]
    - [41, 59.402]
  - - [1408, 4288, 1, 1280]
    - [34, 61.229]
  - - [1856, 4288, 1, 1280]
    - [34, 63.061]
  - - [2368, 4288, 1, 1280]
    - [45, 63.611]
  - - [2944, 4288, 1, 1280]
    - [45, 63.788]
  - - [3584, 4288, 1, 1280]
    - [45, 65.551]
  - - [4288, 4288, 1, 1280]
    - [45, 67.403]
  - - [5056, 4288, 1, 1280]
    - [45, 67.339]
  - - [5888, 4288, 1, 1280]
    - [45, 69.234]
  - - [6784, 4288, 1, 1280]
    - [45, 68.761]
  - - [256, 5056, 1, 1280]
    - [17, 46.203]
  - - [448, 5056, 1, 1280]
    - [54, 51.2]
  - - [704, 5056, 1, 1280]
    - [17, 57.546]
  - - [1024, 5056, 1, 1280]
    - [54, 61.859]
  - - [1408, 5056, 1, 1280]
    - [34, 63.138]
  - - [1856, 5056, 1, 1280]
    - [34, 61.485]
  - - [2368, 5056, 1, 1280]
    - [45, 61.576]
  - - [2944, 5056, 1, 1280]
    - [45, 63.414]
  - - [3584, 5056, 1, 1280]
    - [45, 66.749]
  - - [4288, 5056, 1, 1280]
    - [45, 67.122]
  - - [5056, 5056, 1, 1280]
    - [45, 67.605]
  - - [5888, 5056, 1, 1280]
    - [48, 68.048]
  - - [6784, 5056, 1, 1280]
    - [45, 69.133]
  - - [256, 5888, 1, 1280]
    - [38, 45.098]
  - - [448, 5888, 1, 1280]
    - [24, 53.578]
  - - [704, 5888, 1, 1280]
    - [41, 55.044]
  - - [1024, 5888, 1, 1280]
    - [38, 60.298]
  - - [1408, 5888, 1, 1280]
    - [34, 59.988]
  - - [1856, 5888, 1, 1280]
    - [36, 62.119]
  - - [2368, 5888, 1, 1280]
    - [45, 64.322]
  - - [2944, 5888, 1, 1280]
    - [45, 66.484]
  - - [3584, 5888, 1, 1280]
    - [45, 67.121]
  - - [4288, 5888, 1, 1280]
    - [45, 66.297]
  - - [5056, 5888, 1, 1280]
    - [45, 67.844]
  - - [5888, 5888, 1, 1280]
    - [55, 68.723]
  - - [6784, 5888, 1, 1280]
    - [55, 68.806]
  - - [256, 6784, 1, 1280]
    - [56, 49.891]
  - - [448, 6784, 1, 1280]
    - [17, 52.934]
  - - [704, 6784, 1, 1280]
    - [54, 59.477]
  - - [1024, 6784, 1, 1280]
    - [38, 61.236]
  - - [1408, 6784, 1, 1280]
    - [34, 63.275]
  - - [1856, 6784, 1, 1280]
    - [34, 65.105]
  - - [2368, 6784, 1, 1280]
    - [45, 65.259]
  - - [2944, 6784, 1, 1280]
    - [45, 67.818]
  - - [3584, 6784, 1, 1280]
    - [45, 68.417]
  - - [4288, 6784, 1, 1280]
    - [45, 69.032]
  - - [5056, 6784, 1, 1280]
    - [45, 69.875]
  - - [5888, 6784, 1, 1280]
    - [45, 70.361]
  - - [6784, 6784, 1, 1280]
    - [55, 69.345]
  - - [704, 256, 1, 3328]
    - [6, 16.936]
  - - [1024, 256, 1, 3328]
    - [14, 20.392]
  - - [1408, 256, 1, 3328]
    - [15, 27.414]
  - - [1856, 256, 1, 3328]
    - [17, 31.87]
  - - [2368, 256, 1, 3328]
    - [25, 38.988]
  - - [2944, 256, 1, 3328]
    - [17, 47.977]
  - - [3584, 256, 1, 3328]
    - [57, 44.911]
  - - [4288, 256, 1, 3328]
    - [36, 56.772]
  - - [5056, 256, 1, 3328]
    - [18, 57.913]
  - - [5888, 256, 1, 3328]
    - [58, 60.253]
  - - [6784, 256, 1, 3328]
    - [59, 68.186]
  - - [704, 448, 1, 3328]
    - [14, 24.134]
  - - [1024, 448, 1, 3328]
    - [17, 31.446]
  - - [1408, 448, 1, 3328]
    - [25, 40.778]
  - - [1856, 448, 1, 3328]
    - [24, 53.112]
  - - [2368, 448, 1, 3328]
    - [54, 55.246]
  - - [2944, 448, 1, 3328]
    - [30, 58.112]
  - - [3584, 448, 1, 3328]
    - [30, 56.003]
  - - [4288, 448, 1, 3328]
    - [60, 60.835]
  - - [5056, 448, 1, 3328]
    - [49, 64.586]
  - - [5888, 448, 1, 3328]
    - [30, 64.392]
  - - [6784, 448, 1, 3328]
    - [61, 63.556]
  - - [256, 704, 1, 3328]
    - [7, 15.975]
  - - [448, 704, 1, 3328]
    - [14, 24.433]
  - - [704, 704, 1, 3328]
    - [17, 32.545]
  - - [1024, 704, 1, 3328]
    - [25, 46.684]
  - - [1408, 704, 1, 3328]
    - [62, 50.293]
  - - [1856, 704, 1, 3328]
    - [18, 60.039]
  - - [2368, 704, 1, 3328]
    - [18, 56.11]
  - - [2944, 704, 1, 3328]
    - [30, 62.319]
  - - [3584, 704, 1, 3328]
    - [30, 63.451]
  - - [4288, 704, 1, 3328]
    - [30, 64.716]
  - - [5056, 704, 1, 3328]
    - [49, 69.985]
  - - [5888, 704, 1, 3328]
    - [30, 65.663]
  - - [6784, 704, 1, 3328]
    - [45, 70.613]
  - - [256, 1024, 1, 3328]
    - [15, 20.018]
  - - [448, 1024, 1, 3328]
    - [17, 30.716]
  - - [704, 1024, 1, 3328]
    - [17, 46.284]
  - - [1024, 1024, 1, 3328]
    - [53, 51.193]
  - - [1408, 1024, 1, 3328]
    - [63, 58.889]
  - - [1856, 1024, 1, 3328]
    - [64, 61.064]
  - - [2368, 1024, 1, 3328]
    - [49, 69.088]
  - - [2944, 1024, 1, 3328]
    - [65, 62.175]
  - - [3584, 1024, 1, 3328]
    - [49, 70.136]
  - - [4288, 1024, 1, 3328]
    - [46, 69.791]
  - - [5056, 1024, 1, 3328]
    - [49, 76.517]
  - - [5888, 1024, 1, 3328]
    - [45, 72.621]
  - - [6784, 1024, 1, 3328]
    - [61, 72.193]
  - - [256, 1408, 1, 3328]
    - [14, 27.303]
  - - [448, 1408, 1, 3328]
    - [17, 41.062]
  - - [704, 1408, 1, 3328]
    - [66, 52.2]
  - - [1024, 1408, 1, 3328]
    - [63, 58.192]
  - - [1408, 1408, 1, 3328]
    - [67, 61.483]
  - - [1856, 1408, 1, 3328]
    - [62, 70.747]
  - - [2368, 1408, 1, 3328]
    - [63, 69.918]
  - - [2944, 1408, 1, 3328]
    - [67, 66.534]
  - - [3584, 1408, 1, 3328]
    - [45, 74.026]
  - - [4288, 1408, 1, 3328]
    - [49, 72.302]
  - - [5056, 1408, 1, 3328]
    - [58, 73.19]
  - - [5888, 1408, 1, 3328]
    - [45, 71.789]
  - - [6784, 1408, 1, 3328]
    - [45, 72.193]
  - - [256, 1856, 1, 3328]
    - [18, 32.158]
  - - [448, 1856, 1, 3328]
    - [17, 53.846]
  - - [704, 1856, 1, 3328]
    - [17, 60.634]
  - - [1024, 1856, 1, 3328]
    - [67, 59.683]
  - - [1408, 1856, 1, 3328]
    - [53, 73.672]
  - - [1856, 1856, 1, 3328]
    - [46, 70.044]
  - - [2368, 1856, 1, 3328]
    - [30, 67.983]
  - - [2944, 1856, 1, 3328]
    - [30, 67.349]
  - - [3584, 1856, 1, 3328]
    - [30, 71.18]
  - - [4288, 1856, 1, 3328]
    - [30, 71.338]
  - - [5056, 1856, 1, 3328]
    - [46, 73.303]
  - - [5888, 1856, 1, 3328]
    - [45, 73.38]
  - - [6784, 1856, 1, 3328]
    - [45, 75.913]
  - - [256, 2368, 1, 3328]
    - [17, 39.055]
  - - [448, 2368, 1, 3328]
    - [51, 55.17]
  - - [704, 2368, 1, 3328]
    - [56, 65.384]
  - - [1024, 2368, 1, 3328]
    - [53, 68.258]
  - - [1408, 2368, 1, 3328]
    - [61, 69.762]
  - - [1856, 2368, 1, 3328]
    - [30, 67.76]
  - - [2368, 2368, 1, 3328]
    - [45, 68.867]
  - - [2944, 2368, 1, 3328]
    - [42, 73.096]
  - - [3584, 2368, 1, 3328]
    - [45, 74.073]
  - - [4288, 2368, 1, 3328]
    - [45, 77.085]
  - - [5056, 2368, 1, 3328]
    - [45, 74.521]
  - - [5888, 2368, 1, 3328]
    - [45, 77.796]
  - - [6784, 2368, 1, 3328]
    - [48, 75.747]
  - - [256, 2944, 1, 3328]
    - [17, 48.722]
  - - [448, 2944, 1, 3328]
    - [18, 61.28]
  - - [704, 2944, 1, 3328]
    - [25, 62.772]
  - - [1024, 2944, 1, 3328]
    - [17, 63.682]
  - - [1408, 2944, 1, 3328]
    - [44, 67.458]
  - - [1856, 2944, 1, 3328]
    - [36, 65.414]
  - - [2368, 2944, 1, 3328]
    - [42, 74.091]
  - - [2944, 2944, 1, 3328]
    - [45, 72.669]
  - - [3584, 2944, 1, 3328]
    - [45, 77.817]
  - - [4288, 2944, 1, 3328]
    - [45, 74.954]
  - - [5056, 2944, 1, 3328]
    - [48, 75.944]
  - - [5888, 2944, 1, 3328]
    - [48, 79.262]
  - - [6784, 2944, 1, 3328]
    - [45, 78.827]
  - - [256, 3584, 1, 3328]
    - [48, 44.275]
  - - [448, 3584, 1, 3328]
    - [38, 61.369]
  - - [704, 3584, 1, 3328]
    - [38, 64.665]
  - - [1024, 3584, 1, 3328]
    - [36, 71.895]
  - - [1408, 3584, 1, 3328]
    - [36, 74.816]
  - - [1856, 3584, 1, 3328]
    - [30, 71.527]
  - - [2368, 3584, 1, 3328]
    - [45, 74.142]
  - - [2944, 3584, 1, 3328]
    - [45, 78.982]
  - - [3584, 3584, 1, 3328]
    - [45, 78.403]
  - - [4288, 3584, 1, 3328]
    - [45, 78.154]
  - - [5056, 3584, 1, 3328]
    - [48, 79.485]
  - - [5888, 3584, 1, 3328]
    - [48, 80.641]
  - - [6784, 3584, 1, 3328]
    - [48, 79.013]
  - - [256, 4288, 1, 3328]
    - [62, 54.3]
  - - [448, 4288, 1, 3328]
    - [60, 60.784]
  - - [704, 4288, 1, 3328]
    - [17, 65.126]
  - - [1024, 4288, 1, 3328]
    - [56, 71.738]
  - - [1408, 4288, 1, 3328]
    - [37, 72.325]
  - - [1856, 4288, 1, 3328]
    - [56, 72.64]
  - - [2368, 4288, 1, 3328]
    - [45, 77.211]
  - - [2944, 4288, 1, 3328]
    - [48, 76.197]
  - - [3584, 4288, 1, 3328]
    - [48, 78.474]
  - - [4288, 4288, 1, 3328]
    - [48, 80.333]
  - - [5056, 4288, 1, 3328]
    - [48, 79.727]
  - - [5888, 4288, 1, 3328]
    - [48, 82.348]
  - - [6784, 4288, 1, 3328]
    - [48, 82.176]
  - - [256, 5056, 1, 3328]
    - [17, 60.063]
  - - [448, 5056, 1, 3328]
    - [36, 64.981]
  - - [704, 5056, 1, 3328]
    - [38, 71.985]
  - - [1024, 5056, 1, 3328]
    - [53, 75.771]
  - - [1408, 5056, 1, 3328]
    - [42, 74.789]
  - - [1856, 5056, 1, 3328]
    - [36, 71.953]
  - - [2368, 5056, 1, 3328]
    - [45, 73.92]
  - - [2944, 5056, 1, 3328]
    - [45, 75.39]
  - - [3584, 5056, 1, 3328]
    - [48, 79.364]
  - - [4288, 5056, 1, 3328]
    - [48, 78.564]
  - - [5056, 5056, 1, 3328]
    - [48, 79.948]
  - - [5888, 5056, 1, 3328]
    - [48, 81.174]
  - - [6784, 5056, 1, 3328]
    - [48, 81.666]
  - - [256, 5888, 1, 3328]
    - [59, 58.75]
  - - [448, 5888, 1, 3328]
    - [46, 66.558]
  - - [704, 5888, 1, 3328]
    - [41, 67.9]
  - - [1024, 5888, 1, 3328]
    - [53, 72.761]
  - - [1408, 5888, 1, 3328]
    - [37, 72.155]
  - - [1856, 5888, 1, 3328]
    - [36, 75.225]
  - - [2368, 5888, 1, 3328]
    - [36, 77.877]
  - - [2944, 5888, 1, 3328]
    - [45, 80.073]
  - - [3584, 5888, 1, 3328]
    - [48, 80.509]
  - - [4288, 5888, 1, 3328]
    - [68, 78.243]
  - - [5056, 5888, 1, 3328]
    - [48, 80.839]
  - - [5888, 5888, 1, 3328]
    - [48, 82.225]
  - - [6784, 5888, 1, 3328]
    - [48, 81.802]
  - - [256, 6784, 1, 3328]
    - [56, 64.923]
  - - [448, 6784, 1, 3328]
    - [20, 65.192]
  - - [704, 6784, 1, 3328]
    - [54, 72.973]
  - - [1024, 6784, 1, 3328]
    - [41, 73.166]
  - - [1408, 6784, 1, 3328]
    - [41, 73.136]
  - - [1856, 6784, 1, 3328]
    - [54, 77.854]
  - - [2368, 6784, 1, 3328]
    - [45, 76.898]
  - - [2944, 6784, 1, 3328]
    - [48, 80.704]
  - - [3584, 6784, 1, 3328]
    - [48, 80.428]
  - - [4288, 6784, 1, 3328]
    - [48, 81.464]
  - - [5056, 6784, 1, 3328]
    - [48, 82.77]
  - - [5888, 6784, 1, 3328]
    - [48, 83.545]
  - - [6784, 6784, 1, 3328]
    - [48, 82.416]
  - - [1024, 1024, 1, 1024]
    - [25, 36.111]
  - - [1760, 800, 1, 1760]
    - [34, 42.175]
  - - [1760, 1600, 1, 1760]
    - [69, 52.878]
  - - [1760, 3200, 1, 1760]
    - [70, 63.526]
  - - [1760, 6400, 1, 1760]
    - [54, 67.398]
  - - [2048, 800, 1, 2048]
    - [18, 51.156]
  - - [2048, 1600, 1, 2048]
    - [34, 63.165]
  - - [2048, 3200, 1, 2048]
    - [45, 72.981]
  - - [2048, 6400, 1, 2048]
    - [45, 75.345]
  - - [2560, 800, 1, 2560]
    - [44, 60.275]
  - - [2560, 1600, 1, 2560]
    - [46, 65.306]
  - - [2560, 3200, 1, 2560]
    - [30, 68.705]
  - - [2560, 6400, 1, 2560]
    - [45, 74.149]
  - - [2048, 400, 1, 512]
    - [71, 21.578]
  - - [2048, 800, 1, 512]
    - [72, 28.727]
  - - [2048, 1600, 1, 512]
    - [41, 38.497]
  - - [2048, 3200, 1, 512]
    - [17, 44.164]
  - - [4096, 400, 1, 1024]
    - [18, 37.88]
  - - [4096, 800, 1, 1024]
    - [18, 48.036]
  - - [4096, 1600, 1, 1024]
    - [37, 57.805]
  - - [4096, 3200, 1, 1024]
    - [45, 60.584]
  - - [8192, 400, 1, 2048]
    - [49, 58.977]
  - - [8192, 800, 1, 2048]
    - [67, 63.617]
  - - [8192, 1600, 1, 2048]
    - [54, 67.81]
  - - [8192, 3200, 1, 2048]
    - [54, 69.919]
  - - [16384, 400, 1, 4096]
    - [49, 65.152]
  - - [16384, 800, 1, 4096]
    - [73, 75.912]
  - - [16384, 1600, 1, 4096]
    - [73, 76.765]
  - - [16384, 3200, 1, 4096]
    - [73, 77.272]
  - - [8448, 48000, 1, 2816]
    - [45, 81.744]
  - - [8448, 24000, 1, 2816]
    - [68, 84.767]
  - - [8448, 12000, 1, 2816]
    - [68, 83.424]
  - - [8448, 5984, 1, 2816]
    - [48, 81.262]
  - - [6144, 48000, 1, 2048]
    - [68, 80.97]
  - - [6144, 24000, 1, 2048]
    - [68, 83.496]
  - - [6144, 12000, 1, 2048]
    - [48, 81.561]
  - - [6144, 5984, 1, 2048]
    - [48, 78.281]
  - - [4608, 48000, 1, 1536]
    - [45, 78.194]
  - - [4608, 24000, 1, 1536]
    - [45, 75.443]
  - - [4608, 12000, 1, 1536]
    - [55, 74.163]
  - - [4608, 5984, 1, 1536]
    - [45, 71.126]
  - - [7680, 48000, 1, 2560]
    - [48, 85.301]
  - - [7680, 24000, 1, 2560]
    - [68, 84.647]
  - - [7680, 12000, 1, 2560]
    - [68, 83.586]
  - - [7680, 5984, 1, 2560]
    - [48, 80.529]
  - - [1024, 700, 1, 512]
    - [20, 21.314]
  - - [512, 24000, 1, 1536]
    - [41, 65.653]
  - - [1760, 7000, 1, 1760]
    - [70, 71.894]
  - - [512, 24000, 1, 2048]
    - [38, 71.132]
  - - [2048, 7000, 1, 2048]
    - [45, 75.591]
  - - [512, 24000, 1, 2560]
    - [41, 72.021]
  - - [512, 24000, 1, 2816]
    - [41, 73.034]
  - - [512, 48000, 1, 1536]
    - [36, 68.508]
  - - [1024, 24000, 1, 1536]
    - [48, 70.554]
  - - [2560, 7000, 1, 2560]
    - [48, 75.897]
  - - [512, 48000, 1, 2048]
    - [54, 74.712]
  - - [1024, 24000, 1, 2048]
    - [53, 76.177]
  - - [512, 48000, 1, 2560]
    - [36, 76.022]
  - - [1024, 24000, 1, 2560]
    - [53, 77.459]
  - - [512, 48000, 1, 2816]
    - [37, 76.789]
  - - [1024, 24000, 1, 2816]
    - [53, 78.584]
  - - [1024, 48000, 1, 1536]
    - [68, 73.157]
  - - [3072, 24000, 1, 1024]
    - [55, 69.284]
  - - [5124, 9124, 1, 1760]
    - [74, 75.584]
  - - [5124, 9124, 1, 2048]
    - [68, 79.336]
  - - [1024, 48000, 1, 2048]
    - [48, 79.188]
  - - [4096, 7000, 1, 4096]
    - [48, 83.411]
  - - [5124, 9124, 1, 2560]
    - [68, 80.282]
  - - [1024, 48000, 1, 2560]
    - [53, 80.022]
  - - [1024, 48000, 1, 2816]
    - [53, 80.824]
  - - [3072, 48000, 1, 1024]
    - [45, 70.242]
  - - [5124, 9124, 1, 4096]
    - [55, 84.155]
  - - [6144, 24000, 1, 2560]
    - [68, 84.044]
  - - [6144, 48000, 1, 2560]
    - [68, 85.019]
  - - [32, 32, 1, 32]
    - [75, 0.004]
  - - [32, 64, 1, 256]
    - [9, 0.064]
  - - [32, 128, 1, 256]
    - [76, 0.126]
  - - [32, 256, 1, 256]
    - [4, 0.227]
  - - [32, 448, 1, 256]
    - [8, 0.39]
  - - [32, 704, 1, 256]
    - [12, 0.585]
  - - [32, 1024, 1, 256]
    - [4, 0.859]
  - - [32, 1408, 1, 256]
    - [31, 1.15]
  - - [32, 1856, 1, 256]
    - [77, 1.529]
  - - [32, 2368, 1, 256]
    - [78, 1.837]
  - - [32, 2944, 1, 256]
    - [12, 2.383]
  - - [32, 3584, 1, 256]
    - [13, 2.689]
  - - [32, 4288, 1, 256]
    - [5, 3.383]
  - - [32, 5056, 1, 256]
    - [5, 3.646]
  - - [32, 5888, 1, 256]
    - [8, 4.18]
  - - [32, 6784, 1, 256]
    - [7, 4.441]
  - - [32, 64, 1, 1280]
    - [6, 0.204]
  - - [32, 128, 1, 1280]
    - [28, 0.438]
  - - [32, 256, 1, 1280]
    - [3, 0.882]
  - - [32, 448, 1, 1280]
    - [22, 1.378]
  - - [32, 704, 1, 1280]
    - [9, 2.11]
  - - [32, 1024, 1, 1280]
    - [12, 3.069]
  - - [32, 1408, 1, 1280]
    - [7, 4.036]
  - - [32, 1856, 1, 1280]
    - [12, 5.353]
  - - [32, 2368, 1, 1280]
    - [6, 6.704]
  - - [32, 2944, 1, 1280]
    - [4, 8.039]
  - - [32, 3584, 1, 1280]
    - [6, 9.138]
  - - [32, 4288, 1, 1280]
    - [4, 10.253]
  - - [32, 5056, 1, 1280]
    - [5, 11.725]
  - - [32, 5888, 1, 1280]
    - [6, 12.939]
  - - [32, 6784, 1, 1280]
    - [16, 11.949]
  - - [32, 64, 1, 3328]
    - [4, 0.349]
  - - [32, 128, 1, 3328]
    - [28, 0.674]
  - - [32, 256, 1, 3328]
    - [76, 1.39]
  - - [32, 448, 1, 3328]
    - [8, 2.287]
  - - [32, 704, 1, 3328]
    - [2, 3.52]
  - - [32, 1024, 1, 3328]
    - [2, 5.056]
  - - [32, 1408, 1, 3328]
    - [8, 6.812]
  - - [32, 1856, 1, 3328]
    - [6, 8.872]
  - - [32, 2368, 1, 3328]
    - [12, 11.012]
  - - [32, 2944, 1, 3328]
    - [12, 13.482]
  - - [32, 3584, 1, 3328]
    - [6, 14.286]
  - - [32, 4288, 1, 3328]
    - [5, 15.782]
  - - [32, 5056, 1, 3328]
    - [7, 17.432]
  - - [32, 5888, 1, 3328]
    - [6, 17.976]
  - - [32, 6784, 1, 3328]
    - [16, 16.023]
  - - [64, 32, 1, 256]
    - [4, 0.062]
  - - [128, 32, 1, 256]
    - [11, 0.127]
  - - [256, 32, 1, 256]
    - [3, 0.254]
  - - [448, 32, 1, 256]
    - [26, 0.405]
  - - [704, 32, 1, 256]
    - [31, 0.58]
  - - [1024, 32, 1, 256]
    - [77, 0.851]
  - - [1408, 32, 1, 256]
    - [77, 1.14]
  - - [1856, 32, 1, 256]
    - [31, 1.477]
  - - [2368, 32, 1, 256]
    - [31, 1.777]
  - - [2944, 32, 1, 256]
    - [13, 2.191]
  - - [3584, 32, 1, 256]
    - [13, 2.646]
  - - [4288, 32, 1, 256]
    - [13, 3.192]
  - - [5056, 32, 1, 256]
    - [13, 3.704]
  - - [5888, 32, 1, 256]
    - [13, 4.086]
  - - [6784, 32, 1, 256]
    - [8, 4.537]
  - - [64, 32, 1, 1280]
    - [4, 0.208]
  - - [128, 32, 1, 1280]
    - [28, 0.422]
  - - [256, 32, 1, 1280]
    - [8, 0.82]
  - - [448, 32, 1, 1280]
    - [12, 1.388]
  - - [704, 32, 1, 1280]
    - [3, 2.137]
  - - [1024, 32, 1, 1280]
    - [8, 2.954]
  - - [1408, 32, 1, 1280]
    - [8, 4.036]
  - - [1856, 32, 1, 1280]
    - [8, 5.129]
  - - [2368, 32, 1, 1280]
    - [8, 6.544]
  - - [2944, 32, 1, 1280]
    - [12, 7.899]
  - - [3584, 32, 1, 1280]
    - [4, 9.24]
  - - [4288, 32, 1, 1280]
    - [6, 10.2]
  - - [5056, 32, 1, 1280]
    - [4, 11.438]
  - - [5888, 32, 1, 1280]
    - [5, 12.638]
  - - [6784, 32, 1, 1280]
    - [5, 11.814]
  - - [64, 32, 1, 3328]
    - [6, 0.343]
  - - [128, 32, 1, 3328]
    - [8, 0.683]
  - - [256, 32, 1, 3328]
    - [76, 1.359]
  - - [448, 32, 1, 3328]
    - [8, 2.278]
  - - [704, 32, 1, 3328]
    - [2, 3.549]
  - - [1024, 32, 1, 3328]
    - [7, 4.994]
  - - [1408, 32, 1, 3328]
    - [2, 6.812]
  - - [1856, 32, 1, 3328]
    - [4, 8.532]
  - - [2368, 32, 1, 3328]
    - [4, 10.562]
  - - [2944, 32, 1, 3328]
    - [12, 12.939]
  - - [3584, 32, 1, 3328]
    - [12, 14.099]
  - - [4288, 32, 1, 3328]
    - [12, 15.686]
  - - [5056, 32, 1, 3328]
    - [4, 17.234]
  - - [5888, 32, 1, 3328]
    - [4, 17.885]
  - - [6784, 32, 1, 3328]
    - [79, 15.623]
  - - [64, 64, 1, 32]
    - [75, 0.015]
  - - [128, 64, 1, 32]
    - [80, 0.032]
  - - [256, 64, 1, 32]
    - [81, 0.064]
  - - [448, 64, 1, 32]
    - [82, 0.11]
  - - [704, 64, 1, 32]
    - [82, 0.175]
  - - [1024, 64, 1, 32]
    - [80, 0.236]
  - - [1408, 64, 1, 32]
    - [35, 0.322]
  - - [1856, 64, 1, 32]
    - [35, 0.412]
  - - [2368, 64, 1, 32]
    - [35, 0.506]
  - - [2944, 64, 1, 32]
    - [81, 0.591]
  - - [3584, 64, 1, 32]
    - [75, 0.713]
  - - [4288, 64, 1, 32]
    - [35, 0.839]
  - - [5056, 64, 1, 32]
    - [35, 1.006]
  - - [5888, 64, 1, 32]
    - [35, 1.161]
  - - [6784, 64, 1, 32]
    - [35, 1.283]
  - - [64, 128, 1, 32]
    - [75, 0.035]
  - - [128, 128, 1, 32]
    - [83, 0.063]
  - - [256, 128, 1, 32]
    - [84, 0.128]
  - - [448, 128, 1, 32]
    - [82, 0.215]
  - - [704, 128, 1, 32]
    - [35, 0.322]
  - - [1024, 128, 1, 32]
    - [35, 0.463]
  - - [1408, 128, 1, 32]
    - [35, 0.585]
  - - [1856, 128, 1, 32]
    - [35, 0.738]
  - - [2368, 128, 1, 32]
    - [35, 0.926]
  - - [2944, 128, 1, 32]
    - [35, 1.161]
  - - [3584, 128, 1, 32]
    - [35, 1.356]
  - - [4288, 128, 1, 32]
    - [35, 1.609]
  - - [5056, 128, 1, 32]
    - [35, 1.837]
  - - [5888, 128, 1, 32]
    - [35, 2.058]
  - - [6784, 128, 1, 32]
    - [35, 2.427]
  - - [64, 256, 1, 32]
    - [80, 0.063]
  - - [128, 256, 1, 32]
    - [84, 0.126]
  - - [256, 256, 1, 32]
    - [82, 0.241]
  - - [448, 256, 1, 32]
    - [35, 0.413]
  - - [704, 256, 1, 32]
    - [35, 0.565]
  - - [1024, 256, 1, 32]
    - [85, 0.808]
  - - [1408, 256, 1, 32]
    - [35, 1.092]
  - - [1856, 256, 1, 32]
    - [35, 1.349]
  - - [2368, 256, 1, 32]
    - [35, 1.735]
  - - [2944, 256, 1, 32]
    - [35, 2.058]
  - - [3584, 256, 1, 32]
    - [35, 2.45]
  - - [4288, 256, 1, 32]
    - [35, 2.57]
  - - [5056, 256, 1, 32]
    - [35, 3.03]
  - - [5888, 256, 1, 32]
    - [35, 3.397]
  - - [6784, 256, 1, 32]
    - [35, 3.619]
  - - [64, 448, 1, 32]
    - [84, 0.115]
  - - [128, 448, 1, 32]
    - [86, 0.209]
  - - [256, 448, 1, 32]
    - [35, 0.414]
  - - [448, 448, 1, 32]
    - [35, 0.613]
  - - [704, 448, 1, 32]
    - [35, 0.956]
  - - [1024, 448, 1, 32]
    - [35, 1.334]
  - - [1408, 448, 1, 32]
    - [35, 1.819]
  - - [1856, 448, 1, 32]
    - [35, 2.324]
  - - [2368, 448, 1, 32]
    - [35, 2.567]
  - - [2944, 448, 1, 32]
    - [35, 3.009]
  - - [3584, 448, 1, 32]
    - [87, 3.346]
  - - [4288, 448, 1, 32]
    - [35, 3.744]
  - - [5056, 448, 1, 32]
    - [87, 4.003]
  - - [5888, 448, 1, 32]
    - [35, 4.444]
  - - [6784, 448, 1, 32]
    - [35, 4.683]
  - - [64, 704, 1, 32]
    - [84, 0.175]
  - - [128, 704, 1, 32]
    - [35, 0.325]
  - - [256, 704, 1, 32]
    - [35, 0.585]
  - - [448, 704, 1, 32]
    - [35, 0.956]
  - - [704, 704, 1, 32]
    - [35, 1.453]
  - - [1024, 704, 1, 32]
    - [35, 2.031]
  - - [1408, 704, 1, 32]
    - [35, 2.571]
  - - [1856, 704, 1, 32]
    - [35, 3.001]
  - - [2368, 704, 1, 32]
    - [35, 3.599]
  - - [2944, 704, 1, 32]
    - [35, 3.852]
  - - [3584, 704, 1, 32]
    - [35, 4.373]
  - - [4288, 704, 1, 32]
    - [35, 4.711]
  - - [5056, 704, 1, 32]
    - [35, 5.013]
  - - [5888, 704, 1, 32]
    - [35, 5.318]
  - - [6784, 704, 1, 32]
    - [35, 5.484]
  - - [64, 1024, 1, 32]
    - [80, 0.236]
  - - [128, 1024, 1, 32]
    - [35, 0.459]
  - - [256, 1024, 1, 32]
    - [85, 0.829]
  - - [448, 1024, 1, 32]
    - [35, 1.334]
  - - [704, 1024, 1, 32]
    - [35, 2.031]
  - - [1024, 1024, 1, 32]
    - [35, 2.644]
  - - [1408, 1024, 1, 32]
    - [35, 3.17]
  - - [1856, 1024, 1, 32]
    - [35, 3.765]
  - - [2368, 1024, 1, 32]
    - [35, 4.285]
  - - [2944, 1024, 1, 32]
    - [35, 4.809]
  - - [3584, 1024, 1, 32]
    - [35, 5.031]
  - - [4288, 1024, 1, 32]
    - [35, 5.277]
  - - [5056, 1024, 1, 32]
    - [35, 5.622]
  - - [5888, 1024, 1, 32]
    - [35, 5.797]
  - - [6784, 1024, 1, 32]
    - [35, 5.992]
  - - [64, 1408, 1, 32]
    - [35, 0.332]
  - - [128, 1408, 1, 32]
    - [35, 0.565]
  - - [256, 1408, 1, 32]
    - [35, 1.101]
  - - [448, 1408, 1, 32]
    - [35, 1.819]
  - - [704, 1408, 1, 32]
    - [35, 2.707]
  - - [1024, 1408, 1, 32]
    - [35, 3.15]
  - - [1408, 1408, 1, 32]
    - [35, 3.802]
  - - [1856, 1408, 1, 32]
    - [35, 4.529]
  - - [2368, 1408, 1, 32]
    - [35, 4.808]
  - - [2944, 1408, 1, 32]
    - [35, 5.281]
  - - [3584, 1408, 1, 32]
    - [35, 5.703]
  - - [4288, 1408, 1, 32]
    - [35, 5.789]
  - - [5056, 1408, 1, 32]
    - [87, 6.011]
  - - [5888, 1408, 1, 32]
    - [35, 6.214]
  - - [6784, 1408, 1, 32]
    - [35, 6.473]
  - - [64, 1856, 1, 32]
    - [35, 0.424]
  - - [128, 1856, 1, 32]
    - [75, 0.726]
  - - [256, 1856, 1, 32]
    - [35, 1.381]
  - - [448, 1856, 1, 32]
    - [35, 2.306]
  - - [704, 1856, 1, 32]
    - [35, 3.059]
  - - [1024, 1856, 1, 32]
    - [35, 3.704]
  - - [1408, 1856, 1, 32]
    - [35, 4.486]
  - - [1856, 1856, 1, 32]
    - [35, 4.909]
  - - [2368, 1856, 1, 32]
    - [35, 5.335]
  - - [2944, 1856, 1, 32]
    - [35, 5.71]
  - - [3584, 1856, 1, 32]
    - [87, 5.835]
  - - [4288, 1856, 1, 32]
    - [35, 6.197]
  - - [5056, 1856, 1, 32]
    - [35, 6.456]
  - - [5888, 1856, 1, 32]
    - [35, 6.448]
  - - [6784, 1856, 1, 32]
    - [35, 6.589]
  - - [64, 2368, 1, 32]
    - [35, 0.506]
  - - [128, 2368, 1, 32]
    - [35, 0.903]
  - - [256, 2368, 1, 32]
    - [35, 1.735]
  - - [448, 2368, 1, 32]
    - [35, 2.584]
  - - [704, 2368, 1, 32]
    - [35, 3.474]
  - - [1024, 2368, 1, 32]
    - [35, 4.307]
  - - [1408, 2368, 1, 32]
    - [35, 4.886]
  - - [1856, 2368, 1, 32]
    - [35, 5.408]
  - - [2368, 2368, 1, 32]
    - [35, 5.743]
  - - [2944, 2368, 1, 32]
    - [35, 5.999]
  - - [3584, 2368, 1, 32]
    - [35, 6.388]
  - - [4288, 2368, 1, 32]
    - [35, 6.411]
  - - [5056, 2368, 1, 32]
    - [35, 6.59]
  - - [5888, 2368, 1, 32]
    - [35, 6.693]
  - - [6784, 2368, 1, 32]
    - [35, 6.798]
  - - [64, 2944, 1, 32]
    - [81, 0.612]
  - - [128, 2944, 1, 32]
    - [35, 1.192]
  - - [256, 2944, 1, 32]
    - [35, 2.209]
  - - [448, 2944, 1, 32]
    - [35, 3.213]
  - - [704, 2944, 1, 32]
    - [35, 3.872]
  - - [1024, 2944, 1, 32]
    - [35, 4.726]
  - - [1408, 2944, 1, 32]
    - [35, 5.356]
  - - [1856, 2944, 1, 32]
    - [35, 5.596]
  - - [2368, 2944, 1, 32]
    - [35, 6.071]
  - - [2944, 2944, 1, 32]
    - [35, 6.313]
  - - [3584, 2944, 1, 32]
    - [35, 6.437]
  - - [4288, 2944, 1, 32]
    - [35, 6.606]
  - - [5056, 2944, 1, 32]
    - [35, 6.75]
  - - [5888, 2944, 1, 32]
    - [35, 6.936]
  - - [6784, 2944, 1, 32]
    - [87, 6.904]
  - - [64, 3584, 1, 32]
    - [85, 0.732]
  - - [128, 3584, 1, 32]
    - [35, 1.356]
  - - [256, 3584, 1, 32]
    - [35, 2.525]
  - - [448, 3584, 1, 32]
    - [35, 3.551]
  - - [704, 3584, 1, 32]
    - [35, 4.481]
  - - [1024, 3584, 1, 32]
    - [35, 4.993]
  - - [1408, 3584, 1, 32]
    - [35, 5.668]
  - - [1856, 3584, 1, 32]
    - [35, 5.951]
  - - [2368, 3584, 1, 32]
    - [35, 6.232]
  - - [2944, 3584, 1, 32]
    - [35, 6.492]
  - - [3584, 3584, 1, 32]
    - [35, 6.692]
  - - [4288, 3584, 1, 32]
    - [35, 6.807]
  - - [5056, 3584, 1, 32]
    - [35, 6.935]
  - - [5888, 3584, 1, 32]
    - [35, 6.967]
  - - [6784, 3584, 1, 32]
    - [35, 7.035]
  - - [64, 4288, 1, 32]
    - [75, 0.839]
  - - [128, 4288, 1, 32]
    - [35, 1.596]
  - - [256, 4288, 1, 32]
    - [35, 2.729]
  - - [448, 4288, 1, 32]
    - [35, 3.958]
  - - [704, 4288, 1, 32]
    - [35, 4.691]
  - - [1024, 4288, 1, 32]
    - [35, 5.44]
  - - [1408, 4288, 1, 32]
    - [87, 5.728]
  - - [1856, 4288, 1, 32]
    - [35, 6.251]
  - - [2368, 4288, 1, 32]
    - [35, 6.491]
  - - [2944, 4288, 1, 32]
    - [35, 6.587]
  - - [3584, 4288, 1, 32]
    - [35, 6.782]
  - - [4288, 4288, 1, 32]
    - [87, 6.905]
  - - [5056, 4288, 1, 32]
    - [35, 7.099]
  - - [5888, 4288, 1, 32]
    - [35, 7.106]
  - - [6784, 4288, 1, 32]
    - [87, 7.135]
  - - [64, 5056, 1, 32]
    - [75, 0.98]
  - - [128, 5056, 1, 32]
    - [35, 1.882]
  - - [256, 5056, 1, 32]
    - [35, 3.05]
  - - [448, 5056, 1, 32]
    - [35, 4.209]
  - - [704, 5056, 1, 32]
    - [35, 5.072]
  - - [1024, 5056, 1, 32]
    - [35, 5.639]
  - - [1408, 5056, 1, 32]
    - [35, 6.125]
  - - [1856, 5056, 1, 32]
    - [35, 6.481]
  - - [2368, 5056, 1, 32]
    - [35, 6.682]
  - - [2944, 5056, 1, 32]
    - [35, 6.725]
  - - [3584, 5056, 1, 32]
    - [35, 6.921]
  - - [4288, 5056, 1, 32]
    - [87, 7.035]
  - - [5056, 5056, 1, 32]
    - [35, 7.079]
  - - [5888, 5056, 1, 32]
    - [35, 7.218]
  - - [6784, 5056, 1, 32]
    - [35, 7.232]
  - - [64, 5888, 1, 32]
    - [35, 1.161]
  - - [128, 5888, 1, 32]
    - [35, 2.139]
  - - [256, 5888, 1, 32]
    - [35, 3.418]
  - - [448, 5888, 1, 32]
    - [35, 4.403]
  - - [704, 5888, 1, 32]
    - [35, 5.356]
  - - [1024, 5888, 1, 32]
    - [35, 5.735]
  - - [1408, 5888, 1, 32]
    - [35, 6.266]
  - - [1856, 5888, 1, 32]
    - [35, 6.448]
  - - [2368, 5888, 1, 32]
    - [35, 6.867]
  - - [2944, 5888, 1, 32]
    - [87, 6.845]
  - - [3584, 5888, 1, 32]
    - [35, 6.999]
  - - [4288, 5888, 1, 32]
    - [35, 7.089]
  - - [5056, 5888, 1, 32]
    - [35, 7.213]
  - - [5888, 5888, 1, 32]
    - [87, 7.208]
  - - [6784, 5888, 1, 32]
    - [35, 7.244]
  - - [64, 6784, 1, 32]
    - [35, 1.294]
  - - [128, 6784, 1, 32]
    - [35, 2.408]
  - - [256, 6784, 1, 32]
    - [35, 3.841]
  - - [448, 6784, 1, 32]
    - [35, 4.848]
  - - [704, 6784, 1, 32]
    - [35, 5.59]
  - - [1024, 6784, 1, 32]
    - [35, 6.006]
  - - [1408, 6784, 1, 32]
    - [35, 6.449]
  - - [1856, 6784, 1, 32]
    - [87, 6.676]
  - - [2368, 6784, 1, 32]
    - [35, 6.854]
  - - [2944, 6784, 1, 32]
    - [35, 6.984]
  - - [3584, 6784, 1, 32]
    - [87, 7.138]
  - - [4288, 6784, 1, 32]
    - [35, 7.169]
  - - [5056, 6784, 1, 32]
    - [87, 7.215]
  - - [5888, 6784, 1, 32]
    - [35, 7.244]
  - - [6784, 6784, 1, 32]
    - [35, 7.287]
  - - [32, 32, 1, 256]
    - [6, 0.032]
  - - [32, 32, 1, 1280]
    - [11, 0.101]
  - - [32, 32, 1, 3328]
    - [23, 0.175]
  - - [32, 64, 1, 32]
    - [81, 0.009]
  - - [32, 128, 1, 32]
    - [81, 0.017]
  - - [32, 256, 1, 32]
    - [75, 0.034]
  - - [32, 448, 1, 32]
    - [75, 0.056]
  - - [32, 704, 1, 32]
    - [82, 0.087]
  - - [32, 1024, 1, 32]
    - [82, 0.134]
  - - [32, 1408, 1, 32]
    - [82, 0.179]
  - - [32, 1856, 1, 32]
    - [86, 0.223]
  - - [32, 2368, 1, 32]
    - [35, 0.268]
  - - [32, 2944, 1, 32]
    - [88, 0.323]
  - - [32, 3584, 1, 32]
    - [88, 0.383]
  - - [32, 4288, 1, 32]
    - [88, 0.458]
  - - [32, 5056, 1, 32]
    - [75, 0.521]
  - - [32, 5888, 1, 32]
    - [81, 0.601]
  - - [32, 6784, 1, 32]
    - [81, 0.687]
  - - [64, 32, 1, 32]
    - [89, 0.008]
  - - [128, 32, 1, 32]
    - [90, 0.017]
  - - [256, 32, 1, 32]
    - [81, 0.032]
  - - [448, 32, 1, 32]
    - [81, 0.058]
  - - [704, 32, 1, 32]
    - [84, 0.084]
  - - [1024, 32, 1, 32]
    - [80, 0.124]
  - - [1408, 32, 1, 32]
    - [84, 0.167]
  - - [1856, 32, 1, 32]
    - [84, 0.221]
  - - [2368, 32, 1, 32]
    - [35, 0.27]
  - - [2944, 32, 1, 32]
    - [35, 0.34]
  - - [3584, 32, 1, 32]
    - [35, 0.414]
  - - [4288, 32, 1, 32]
    - [35, 0.485]
  - - [5056, 32, 1, 32]
    - [35, 0.566]
  - - [5888, 32, 1, 32]
    - [35, 0.612]
  - - [6784, 32, 1, 32]
    - [89, 0.687]
  - - [1, 1, 1, 1]
    - [82, 0.0]
  - - [1, 64, 1, 256]
    - [6, 0.002]
  - - [1, 128, 1, 256]
    - [6, 0.004]
  - - [1, 256, 1, 256]
    - [91, 0.008]
  - - [1, 448, 1, 256]
    - [3, 0.015]
  - - [1, 704, 1, 256]
    - [3, 0.021]
  - - [1, 1024, 1, 256]
    - [23, 0.03]
  - - [1, 1408, 1, 256]
    - [10, 0.037]
  - - [1, 1856, 1, 256]
    - [2, 0.049]
  - - [1, 2368, 1, 256]
    - [12, 0.06]
  - - [1, 2944, 1, 256]
    - [23, 0.076]
  - - [1, 3584, 1, 256]
    - [78, 0.088]
  - - [1, 4288, 1, 256]
    - [12, 0.111]
  - - [1, 5056, 1, 256]
    - [12, 0.126]
  - - [1, 5888, 1, 256]
    - [6, 0.139]
  - - [1, 6784, 1, 256]
    - [12, 0.16]
  - - [1, 64, 1, 1280]
    - [6, 0.008]
  - - [1, 128, 1, 1280]
    - [6, 0.014]
  - - [1, 256, 1, 1280]
    - [4, 0.027]
  - - [1, 448, 1, 1280]
    - [23, 0.048]
  - - [1, 704, 1, 1280]
    - [6, 0.074]
  - - [1, 1024, 1, 1280]
    - [7, 0.102]
  - - [1, 1408, 1, 1280]
    - [3, 0.134]
  - - [1, 1856, 1, 1280]
    - [23, 0.168]
  - - [1, 2368, 1, 1280]
    - [2, 0.212]
  - - [1, 2944, 1, 1280]
    - [23, 0.26]
  - - [1, 3584, 1, 1280]
    - [12, 0.315]
  - - [1, 4288, 1, 1280]
    - [12, 0.373]
  - - [1, 5056, 1, 1280]
    - [12, 0.426]
  - - [1, 5888, 1, 1280]
    - [12, 0.474]
  - - [1, 6784, 1, 1280]
    - [12, 0.532]
  - - [1, 64, 1, 3328]
    - [6, 0.011]
  - - [1, 128, 1, 3328]
    - [6, 0.022]
  - - [1, 256, 1, 3328]
    - [6, 0.044]
  - - [1, 448, 1, 3328]
    - [23, 0.08]
  - - [1, 704, 1, 3328]
    - [7, 0.121]
  - - [1, 1024, 1, 3328]
    - [2, 0.171]
  - - [1, 1408, 1, 3328]
    - [3, 0.231]
  - - [1, 1856, 1, 3328]
    - [23, 0.285]
  - - [1, 2368, 1, 3328]
    - [2, 0.365]
  - - [1, 2944, 1, 3328]
    - [2, 0.445]
  - - [1, 3584, 1, 3328]
    - [12, 0.521]
  - - [1, 4288, 1, 3328]
    - [4, 0.609]
  - - [1, 5056, 1, 3328]
    - [12, 0.689]
  - - [1, 5888, 1, 3328]
    - [12, 0.769]
  - - [1, 6784, 1, 3328]
    - [12, 0.805]
  - - [64, 1, 1, 256]
    - [4, 0.002]
  - - [128, 1, 1, 256]
    - [26, 0.004]
  - - [256, 1, 1, 256]
    - [5, 0.008]
  - - [448, 1, 1, 256]
    - [28, 0.013]
  - - [704, 1, 1, 256]
    - [8, 0.019]
  - - [1024, 1, 1, 256]
    - [2, 0.028]
  - - [1408, 1, 1, 256]
    - [31, 0.038]
  - - [1856, 1, 1, 256]
    - [77, 0.047]
  - - [2368, 1, 1, 256]
    - [77, 0.057]
  - - [2944, 1, 1, 256]
    - [5, 0.07]
  - - [3584, 1, 1, 256]
    - [13, 0.083]
  - - [4288, 1, 1, 256]
    - [8, 0.1]
  - - [5056, 1, 1, 256]
    - [13, 0.119]
  - - [5888, 1, 1, 256]
    - [13, 0.138]
  - - [6784, 1, 1, 256]
    - [8, 0.159]
  - - [64, 1, 1, 1280]
    - [6, 0.007]
  - - [128, 1, 1, 1280]
    - [76, 0.013]
  - - [256, 1, 1, 1280]
    - [3, 0.026]
  - - [448, 1, 1, 1280]
    - [8, 0.043]
  - - [704, 1, 1, 1280]
    - [12, 0.068]
  - - [1024, 1, 1, 1280]
    - [8, 0.097]
  - - [1408, 1, 1, 1280]
    - [2, 0.13]
  - - [1856, 1, 1, 1280]
    - [2, 0.164]
  - - [2368, 1, 1, 1280]
    - [26, 0.206]
  - - [2944, 1, 1, 1280]
    - [3, 0.253]
  - - [3584, 1, 1, 1280]
    - [4, 0.302]
  - - [4288, 1, 1, 1280]
    - [7, 0.36]
  - - [5056, 1, 1, 1280]
    - [8, 0.41]
  - - [5888, 1, 1, 1280]
    - [8, 0.454]
  - - [6784, 1, 1, 1280]
    - [8, 0.529]
  - - [64, 1, 1, 3328]
    - [4, 0.011]
  - - [128, 1, 1, 3328]
    - [8, 0.021]
  - - [256, 1, 1, 3328]
    - [2, 0.041]
  - - [448, 1, 1, 3328]
    - [2, 0.072]
  - - [704, 1, 1, 3328]
    - [28, 0.113]
  - - [1024, 1, 1, 3328]
    - [2, 0.165]
  - - [1408, 1, 1, 3328]
    - [2, 0.221]
  - - [1856, 1, 1, 3328]
    - [8, 0.281]
  - - [2368, 1, 1, 3328]
    - [6, 0.344]
  - - [2944, 1, 1, 3328]
    - [3, 0.433]
  - - [3584, 1, 1, 3328]
    - [4, 0.511]
  - - [4288, 1, 1, 3328]
    - [5, 0.595]
  - - [5056, 1, 1, 3328]
    - [4, 0.677]
  - - [5888, 1, 1, 3328]
    - [12, 0.753]
  - - [6784, 1, 1, 3328]
    - [12, 0.808]
  - - [64, 64, 1, 1]
    - [89, 0.0]
  - - [128, 64, 1, 1]
    - [92, 0.001]
  - - [256, 64, 1, 1]
    - [77, 0.002]
  - - [448, 64, 1, 1]
    - [82, 0.003]
  - - [704, 64, 1, 1]
    - [90, 0.004]
  - - [1024, 64, 1, 1]
    - [84, 0.007]
  - - [1408, 64, 1, 1]
    - [84, 0.009]
  - - [1856, 64, 1, 1]
    - [35, 0.012]
  - - [2368, 64, 1, 1]
    - [35, 0.015]
  - - [2944, 64, 1, 1]
    - [35, 0.017]
  - - [3584, 64, 1, 1]
    - [35, 0.021]
  - - [4288, 64, 1, 1]
    - [35, 0.025]
  - - [5056, 64, 1, 1]
    - [35, 0.029]
  - - [5888, 64, 1, 1]
    - [35, 0.034]
  - - [6784, 64, 1, 1]
    - [35, 0.037]
  - - [64, 128, 1, 1]
    - [82, 0.001]
  - - [128, 128, 1, 1]
    - [77, 0.002]
  - - [256, 128, 1, 1]
    - [82, 0.003]
  - - [448, 128, 1, 1]
    - [93, 0.005]
  - - [704, 128, 1, 1]
    - [86, 0.009]
  - - [1024, 128, 1, 1]
    - [35, 0.012]
  - - [1408, 128, 1, 1]
    - [35, 0.017]
  - - [1856, 128, 1, 1]
    - [35, 0.021]
  - - [2368, 128, 1, 1]
    - [35, 0.027]
  - - [2944, 128, 1, 1]
    - [35, 0.033]
  - - [3584, 128, 1, 1]
    - [35, 0.039]
  - - [4288, 128, 1, 1]
    - [35, 0.045]
  - - [5056, 128, 1, 1]
    - [87, 0.051]
  - - [5888, 128, 1, 1]
    - [35, 0.058]
  - - [6784, 128, 1, 1]
    - [35, 0.064]
  - - [64, 256, 1, 1]
    - [89, 0.002]
  - - [128, 256, 1, 1]
    - [77, 0.003]
  - - [256, 256, 1, 1]
    - [82, 0.006]
  - - [448, 256, 1, 1]
    - [82, 0.011]
  - - [704, 256, 1, 1]
    - [35, 0.016]
  - - [1024, 256, 1, 1]
    - [35, 0.023]
  - - [1408, 256, 1, 1]
    - [94, 0.031]
  - - [1856, 256, 1, 1]
    - [35, 0.04]
  - - [2368, 256, 1, 1]
    - [35, 0.049]
  - - [2944, 256, 1, 1]
    - [35, 0.057]
  - - [3584, 256, 1, 1]
    - [35, 0.066]
  - - [4288, 256, 1, 1]
    - [35, 0.072]
  - - [5056, 256, 1, 1]
    - [35, 0.083]
  - - [5888, 256, 1, 1]
    - [35, 0.092]
  - - [6784, 256, 1, 1]
    - [95, 0.093]
  - - [64, 448, 1, 1]
    - [93, 0.003]
  - - [128, 448, 1, 1]
    - [84, 0.006]
  - - [256, 448, 1, 1]
    - [35, 0.011]
  - - [448, 448, 1, 1]
    - [35, 0.018]
  - - [704, 448, 1, 1]
    - [94, 0.028]
  - - [1024, 448, 1, 1]
    - [35, 0.038]
  - - [1408, 448, 1, 1]
    - [35, 0.051]
  - - [1856, 448, 1, 1]
    - [35, 0.063]
  - - [2368, 448, 1, 1]
    - [35, 0.07]
  - - [2944, 448, 1, 1]
    - [35, 0.081]
  - - [3584, 448, 1, 1]
    - [35, 0.093]
  - - [4288, 448, 1, 1]
    - [35, 0.099]
  - - [5056, 448, 1, 1]
    - [35, 0.106]
  - - [5888, 448, 1, 1]
    - [87, 0.112]
  - - [6784, 448, 1, 1]
    - [35, 0.123]
  - - [64, 704, 1, 1]
    - [82, 0.004]
  - - [128, 704, 1, 1]
    - [82, 0.009]
  - - [256, 704, 1, 1]
    - [93, 0.017]
  - - [448, 704, 1, 1]
    - [35, 0.028]
  - - [704, 704, 1, 1]
    - [35, 0.04]
  - - [1024, 704, 1, 1]
    - [35, 0.055]
  - - [1408, 704, 1, 1]
    - [35, 0.067]
  - - [1856, 704, 1, 1]
    - [35, 0.079]
  - - [2368, 704, 1, 1]
    - [35, 0.093]
  - - [2944, 704, 1, 1]
    - [35, 0.103]
  - - [3584, 704, 1, 1]
    - [35, 0.115]
  - - [4288, 704, 1, 1]
    - [35, 0.121]
  - - [5056, 704, 1, 1]
    - [35, 0.132]
  - - [5888, 704, 1, 1]
    - [87, 0.137]
  - - [6784, 704, 1, 1]
    - [35, 0.144]
  - - [64, 1024, 1, 1]
    - [82, 0.006]
  - - [128, 1024, 1, 1]
    - [35, 0.012]
  - - [256, 1024, 1, 1]
    - [35, 0.023]
  - - [448, 1024, 1, 1]
    - [35, 0.038]
  - - [704, 1024, 1, 1]
    - [35, 0.055]
  - - [1024, 1024, 1, 1]
    - [35, 0.068]
  - - [1408, 1024, 1, 1]
    - [35, 0.087]
  - - [1856, 1024, 1, 1]
    - [35, 0.096]
  - - [2368, 1024, 1, 1]
    - [35, 0.115]
  - - [2944, 1024, 1, 1]
    - [35, 0.125]
  - - [3584, 1024, 1, 1]
    - [35, 0.134]
  - - [4288, 1024, 1, 1]
    - [87, 0.142]
  - - [5056, 1024, 1, 1]
    - [35, 0.149]
  - - [5888, 1024, 1, 1]
    - [35, 0.155]
  - - [6784, 1024, 1, 1]
    - [87, 0.16]
  - - [64, 1408, 1, 1]
    - [86, 0.009]
  - - [128, 1408, 1, 1]
    - [90, 0.016]
  - - [256, 1408, 1, 1]
    - [35, 0.031]
  - - [448, 1408, 1, 1]
    - [35, 0.05]
  - - [704, 1408, 1, 1]
    - [35, 0.068]
  - - [1024, 1408, 1, 1]
    - [35, 0.085]
  - - [1408, 1408, 1, 1]
    - [35, 0.102]
  - - [1856, 1408, 1, 1]
    - [35, 0.117]
  - - [2368, 1408, 1, 1]
    - [35, 0.128]
  - - [2944, 1408, 1, 1]
    - [35, 0.142]
  - - [3584, 1408, 1, 1]
    - [35, 0.15]
  - - [4288, 1408, 1, 1]
    - [35, 0.156]
  - - [5056, 1408, 1, 1]
    - [35, 0.164]
  - - [5888, 1408, 1, 1]
    - [35, 0.17]
  - - [6784, 1408, 1, 1]
    - [35, 0.17]
  - - [64, 1856, 1, 1]
    - [87, 0.011]
  - - [128, 1856, 1, 1]
    - [35, 0.02]
  - - [256, 1856, 1, 1]
    - [35, 0.039]
  - - [448, 1856, 1, 1]
    - [35, 0.062]
  - - [704, 1856, 1, 1]
    - [35, 0.082]
  - - [1024, 1856, 1, 1]
    - [35, 0.099]
  - - [1408, 1856, 1, 1]
    - [35, 0.116]
  - - [1856, 1856, 1, 1]
    - [35, 0.13]
  - - [2368, 1856, 1, 1]
    - [35, 0.143]
  - - [2944, 1856, 1, 1]
    - [35, 0.148]
  - - [3584, 1856, 1, 1]
    - [35, 0.16]
  - - [4288, 1856, 1, 1]
    - [35, 0.17]
  - - [5056, 1856, 1, 1]
    - [35, 0.176]
  - - [5888, 1856, 1, 1]
    - [87, 0.179]
  - - [6784, 1856, 1, 1]
    - [35, 0.18]
  - - [64, 2368, 1, 1]
    - [35, 0.015]
  - - [128, 2368, 1, 1]
    - [35, 0.028]
  - - [256, 2368, 1, 1]
    - [35, 0.049]
  - - [448, 2368, 1, 1]
    - [35, 0.069]
  - - [704, 2368, 1, 1]
    - [35, 0.091]
  - - [1024, 2368, 1, 1]
    - [35, 0.11]
  - - [1408, 2368, 1, 1]
    - [35, 0.135]
  - - [1856, 2368, 1, 1]
    - [35, 0.142]
  - - [2368, 2368, 1, 1]
    - [35, 0.156]
  - - [2944, 2368, 1, 1]
    - [35, 0.161]
  - - [3584, 2368, 1, 1]
    - [35, 0.173]
  - - [4288, 2368, 1, 1]
    - [35, 0.175]
  - - [5056, 2368, 1, 1]
    - [35, 0.181]
  - - [5888, 2368, 1, 1]
    - [35, 0.185]
  - - [6784, 2368, 1, 1]
    - [35, 0.187]
  - - [64, 2944, 1, 1]
    - [35, 0.017]
  - - [128, 2944, 1, 1]
    - [35, 0.033]
  - - [256, 2944, 1, 1]
    - [35, 0.058]
  - - [448, 2944, 1, 1]
    - [35, 0.081]
  - - [704, 2944, 1, 1]
    - [35, 0.105]
  - - [1024, 2944, 1, 1]
    - [35, 0.124]
  - - [1408, 2944, 1, 1]
    - [35, 0.142]
  - - [1856, 2944, 1, 1]
    - [35, 0.151]
  - - [2368, 2944, 1, 1]
    - [35, 0.167]
  - - [2944, 2944, 1, 1]
    - [35, 0.173]
  - - [3584, 2944, 1, 1]
    - [35, 0.178]
  - - [4288, 2944, 1, 1]
    - [35, 0.181]
  - - [5056, 2944, 1, 1]
    - [35, 0.186]
  - - [5888, 2944, 1, 1]
    - [35, 0.188]
  - - [6784, 2944, 1, 1]
    - [87, 0.191]
  - - [64, 3584, 1, 1]
    - [35, 0.02]
  - - [128, 3584, 1, 1]
    - [35, 0.038]
  - - [256, 3584, 1, 1]
    - [35, 0.064]
  - - [448, 3584, 1, 1]
    - [35, 0.092]
  - - [704, 3584, 1, 1]
    - [35, 0.113]
  - - [1024, 3584, 1, 1]
    - [35, 0.135]
  - - [1408, 3584, 1, 1]
    - [35, 0.15]
  - - [1856, 3584, 1, 1]
    - [35, 0.162]
  - - [2368, 3584, 1, 1]
    - [87, 0.171]
  - - [2944, 3584, 1, 1]
    - [35, 0.178]
  - - [3584, 3584, 1, 1]
    - [87, 0.183]
  - - [4288, 3584, 1, 1]
    - [35, 0.187]
  - - [5056, 3584, 1, 1]
    - [35, 0.189]
  - - [5888, 3584, 1, 1]
    - [35, 0.193]
  - - [6784, 3584, 1, 1]
    - [87, 0.193]
  - - [64, 4288, 1, 1]
    - [35, 0.024]
  - - [128, 4288, 1, 1]
    - [35, 0.045]
  - - [256, 4288, 1, 1]
    - [35, 0.073]
  - - [448, 4288, 1, 1]
    - [35, 0.105]
  - - [704, 4288, 1, 1]
    - [87, 0.122]
  - - [1024, 4288, 1, 1]
    - [35, 0.141]
  - - [1408, 4288, 1, 1]
    - [35, 0.157]
  - - [1856, 4288, 1, 1]
    - [35, 0.167]
  - - [2368, 4288, 1, 1]
    - [35, 0.175]
  - - [2944, 4288, 1, 1]
    - [35, 0.183]
  - - [3584, 4288, 1, 1]
    - [35, 0.187]
  - - [4288, 4288, 1, 1]
    - [35, 0.191]
  - - [5056, 4288, 1, 1]
    - [35, 0.193]
  - - [5888, 4288, 1, 1]
    - [35, 0.195]
  - - [6784, 4288, 1, 1]
    - [87, 0.197]
  - - [64, 5056, 1, 1]
    - [35, 0.029]
  - - [128, 5056, 1, 1]
    - [88, 0.051]
  - - [256, 5056, 1, 1]
    - [35, 0.083]
  - - [448, 5056, 1, 1]
    - [35, 0.109]
  - - [704, 5056, 1, 1]
    - [35, 0.129]
  - - [1024, 5056, 1, 1]
    - [35, 0.147]
  - - [1408, 5056, 1, 1]
    - [35, 0.167]
  - - [1856, 5056, 1, 1]
    - [35, 0.172]
  - - [2368, 5056, 1, 1]
    - [35, 0.182]
  - - [2944, 5056, 1, 1]
    - [35, 0.188]
  - - [3584, 5056, 1, 1]
    - [35, 0.19]
  - - [4288, 5056, 1, 1]
    - [35, 0.194]
  - - [5056, 5056, 1, 1]
    - [35, 0.197]
  - - [5888, 5056, 1, 1]
    - [35, 0.199]
  - - [6784, 5056, 1, 1]
    - [35, 0.199]
  - - [64, 5888, 1, 1]
    - [35, 0.033]
  - - [128, 5888, 1, 1]
    - [35, 0.059]
  - - [256, 5888, 1, 1]
    - [35, 0.093]
  - - [448, 5888, 1, 1]
    - [87, 0.118]
  - - [704, 5888, 1, 1]
    - [87, 0.138]
  - - [1024, 5888, 1, 1]
    - [35, 0.155]
  - - [1408, 5888, 1, 1]
    - [35, 0.171]
  - - [1856, 5888, 1, 1]
    - [35, 0.178]
  - - [2368, 5888, 1, 1]
    - [35, 0.184]
  - - [2944, 5888, 1, 1]
    - [87, 0.19]
  - - [3584, 5888, 1, 1]
    - [35, 0.194]
  - - [4288, 5888, 1, 1]
    - [35, 0.197]
  - - [5056, 5888, 1, 1]
    - [35, 0.199]
  - - [5888, 5888, 1, 1]
    - [35, 0.2]
  - - [6784, 5888, 1, 1]
    - [35, 0.201]
  - - [64, 6784, 1, 1]
    - [35, 0.037]
  - - [128, 6784, 1, 1]
    - [35, 0.064]
  - - [256, 6784, 1, 1]
    - [87, 0.094]
  - - [448, 6784, 1, 1]
    - [35, 0.127]
  - - [704, 6784, 1, 1]
    - [35, 0.148]
  - - [1024, 6784, 1, 1]
    - [35, 0.16]
  - - [1408, 6784, 1, 1]
    - [35, 0.174]
  - - [1856, 6784, 1, 1]
    - [35, 0.181]
  - - [2368, 6784, 1, 1]
    - [35, 0.19]
  - - [2944, 6784, 1, 1]
    - [35, 0.194]
  - - [3584, 6784, 1, 1]
    - [35, 0.196]
  - - [4288, 6784, 1, 1]
    - [35, 0.198]
  - - [5056, 6784, 1, 1]
    - [35, 0.2]
  - - [5888, 6784, 1, 1]
    - [87, 0.202]
  - - [6784, 6784, 1, 1]
    - [35, 0.202]
  - - [1, 1, 1, 256]
    - [6, 0.0]
  - - [1, 1, 1, 1280]
    - [6, 0.0]
  - - [1, 1, 1, 3328]
    - [6, 0.0]
  - - [1, 64, 1, 1]
    - [75, 0.0]
  - - [1, 128, 1, 1]
    - [82, 0.0]
  - - [1, 256, 1, 1]
    - [75, 0.0]
  - - [1, 448, 1, 1]
    - [75, 0.0]
  - - [1, 704, 1, 1]
    - [75, 0.0]
  - - [1, 1024, 1, 1]
    - [82, 0.0]
  - - [1, 1408, 1, 1]
    - [96, 0.0]
  - - [1, 1856, 1, 1]
    - [93, 0.0]
  - - [1, 2368, 1, 1]
    - [93, 0.0]
  - - [1, 2944, 1, 1]
    - [82, 0.0]
  - - [1, 3584, 1, 1]
    - [81, 0.0]
  - - [1, 4288, 1, 1]
    - [89, 0.0]
  - - [1, 5056, 1, 1]
    - [75, 0.0]
  - - [1, 5888, 1, 1]
    - [89, 0.001]
  - - [1, 6784, 1, 1]
    - [81, 0.001]
  - - [64, 1, 1, 1]
    - [4, 0.0]
  - - [128, 1, 1, 1]
    - [89, 0.0]
  - - [256, 1, 1, 1]
    - [86, 0.0]
  - - [448, 1, 1, 1]
    - [75, 0.0]
  - - [704, 1, 1, 1]
    - [84, 0.0]
  - - [1024, 1, 1, 1]
    - [75, 0.0]
  - - [1408, 1, 1, 1]
    - [84, 0.0]
  - - [1856, 1, 1, 1]
    - [84, 0.0]
  - - [2368, 1, 1, 1]
    - [86, 0.0]
  - - [2944, 1, 1, 1]
    - [35, 0.0]
  - - [3584, 1, 1, 1]
    - [35, 0.0]
  - - [4288, 1, 1, 1]
    - [35, 0.0]
  - - [5056, 1, 1, 1]
    - [87, 0.0]
  - - [5888, 1, 1, 1]
    - [35, 0.001]
  - - [6784, 1, 1, 1]
    - [86, 0.001]
  - - [7680, 8192, 1, 8192]
    - [49, 89.781]
  - - [3840, 4096, 1, 4096]
    - [48, 82.944]
  - - [1920, 2048, 1, 2048]
    - [54, 68.997]
  - - [960, 1024, 1, 1024]
    - [97, 36.467]
  - - [480, 512, 1, 512]
    - [16, 9.088]
  - - [8192, 7680, 1, 8192]
    - [98, 86.026]
  - - [4096, 3840, 1, 4096]
    - [55, 82.37]
  - - [2048, 1920, 1, 2048]
    - [54, 68.476]
  - - [1024, 960, 1, 1024]
    - [97, 36.119]
  - - [512, 480, 1, 512]
    - [16, 8.697]
  - - [8192, 8192, 1, 8192]
    - [49, 85.213]
  - - [4096, 4096, 1, 4096]
    - [68, 81.618]
  - - [2048, 2048, 1, 2048]
    - [41, 64.177]
  - - [512, 512, 1, 512]
    - [16, 9.165]
  - - [512, 512, 16, 64]
    - [19, 9.725]
  - - [512, 512, 128, 64]
    - [14, 13.043]
  - - [1024, 1, 1, 1024]
    - [8, 0.086]
  - - [1024, 77, 1, 1024]
    - [8, 6.147]
  - - [1024, 512, 1, 1024]
    - [34, 22.57]
  - - [1024, 512, 1, 4096]
    - [24, 35.844]
  - - [4096, 512, 1, 1024]
    - [18, 44.558]
  - - [128, 128, 128, 64]
    - [19, 7.235]
  - - [128, 128, 160, 64]
    - [14, 8.078]
  - - [1024, 10, 1, 1024]
    - [28, 0.856]
  - - [1024, 200, 1, 1024]
    - [29, 11.093]
  - - [1024, 1280, 1, 1024]
    - [25, 43.453]
  - - [1024, 1280, 1, 4096]
    - [99, 62.551]
  - - [4096, 1280, 1, 1024]
    - [41, 55.493]
  - - [128, 128, 624, 64]
    - [19, 11.019]
  - - [1024, 39, 1, 1024]
    - [2, 3.156]
  - - [1024, 780, 1, 1024]
    - [17, 33.878]
  - - [1024, 4992, 1, 1024]
    - [36, 57.091]
  - - [1024, 4992, 1, 4096]
    - [98, 77.649]
  - - [4096, 4992, 1, 1024]
    - [45, 60.674]
  - - [512, 512, 64, 64]
    - [14, 12.42]
  - - [1024, 4, 1, 1024]
    - [28, 0.338]
  - - [1024, 308, 1, 1024]
    - [30, 16.768]
  - - [1024, 2048, 1, 1024]
    - [17, 46.98]
  - - [1024, 2048, 1, 4096]
    - [64, 67.63]
  - - [4096, 2048, 1, 1024]
    - [41, 55.524]
  - - [128, 128, 640, 64]
    - [19, 11.103]
  - - [1024, 40, 1, 1024]
    - [8, 3.13]
  - - [1024, 800, 1, 1024]
    - [17, 34.368]
  - - [1024, 5120, 1, 1024]
    - [36, 58.555]
  - - [1024, 5120, 1, 4096]
    - [54, 80.569]
  - - [4096, 5120, 1, 1024]
    - [45, 62.181]
  - - [128, 128, 656, 64]
    - [14, 11.151]
  - - [1024, 41, 1, 1024]
    - [8, 3.295]
  - - [1024, 820, 1, 1024]
    - [17, 35.615]
  - - [1024, 5248, 1, 1024]
    - [53, 58.878]
  - - [1024, 5248, 1, 4096]
    - [54, 81.098]
  - - [4096, 5248, 1, 1024]
    - [45, 63.023]
  - - [512, 512, 80, 64]
    - [14, 12.549]
  - - [1024, 5, 1, 1024]
    - [2, 0.419]
  - - [1024, 385, 1, 1024]
    - [16, 19.521]
  - - [1024, 2560, 1, 1024]
    - [37, 52.689]
  - - [1024, 2560, 1, 4096]
    - [45, 75.046]
  - - [4096, 2560, 1, 1024]
    - [45, 59.593]
  - - [512, 512, 96, 64]
    - [14, 12.87]
  - - [1024, 6, 1, 1024]
    - [3, 0.499]
  - - [1024, 462, 1, 1024]
    - [17, 20.912]
  - - [1024, 3072, 1, 1024]
    - [20, 52.219]
  - - [1024, 3072, 1, 4096]
    - [42, 67.052]
  - - [4096, 3072, 1, 1024]
    - [55, 58.678]
  - - [1024, 8, 1, 1024]
    - [8, 0.67]
  - - [1024, 160, 1, 1024]
    - [8, 10.501]
  - - [1024, 1024, 1, 4096]
    - [57, 52.483]
  - - [4096, 1024, 1, 1024]
    - [41, 52.942]
  - - [128, 128, 144, 64]
    - [16, 7.629]
  - - [1024, 9, 1, 1024]
    - [28, 0.738]
  - - [1024, 180, 1, 1024]
    - [33, 10.424]
  - - [1024, 1152, 1, 1024]
    - [25, 38.996]
  - - [1024, 1152, 1, 4096]
    - [99, 57.063]
  - - [4096, 1152, 1, 1024]
    - [55, 51.454]
  - - [128, 32768, 1, 256]
    - [17, 23.814]
  - - [256, 32768, 1, 512]
    - [24, 41.323]
  - - [512, 32768, 1, 13]
    - [35, 2.4]
  - - [512, 32768, 1, 1024]
    - [36, 62.539]
  - - [1024, 32768, 1, 479]
    - [100, 41.782]
  - - [1024, 32768, 1, 1024]
    - [45, 67.254]
  - - [32768, 1, 1, 256]
    - [8, 0.48]
  - - [64, 128, 512, 128]
    - [14, 11.837]
  - - [128, 128, 512, 64]
    - [14, 10.706]
  - - [1024, 32, 1, 1024]
    - [8, 2.625]
  - - [1024, 4096, 1, 1024]
    - [41, 53.647]
  - - [1024, 4096, 1, 4096]
    - [56, 70.693]
  - - [4096, 4096, 1, 1024]
    - [45, 61.545]
  - - [30528, 4096, 1, 1024]
    - [45, 68.778]
  - - [64, 512, 64, 512]
    - [30, 24.05]
  - - [30528, 2048, 1, 1024]
    - [45, 64.971]
  - - [1024, 8192, 1, 1024]
    - [17, 58.512]
  - - [1024, 8192, 1, 4096]
    - [54, 75.801]
  - - [1024, 9600, 1, 1024]
    - [41, 61.008]
  - - [1024, 9600, 1, 4096]
    - [56, 79.061]
  - - [4096, 8192, 1, 1024]
    - [55, 63.358]
  - - [4096, 9600, 1, 1024]
    - [45, 64.393]
  - - [33712, 8192, 1, 1024]
    - [45, 73.493]
  - - [33712, 9600, 1, 1024]
    - [55, 73.796]
  - - [1024, 10064, 1, 1024]
    - [45, 61.034]
  - - [1024, 10064, 1, 4096]
    - [54, 81.005]
  - - [1024, 10080, 1, 1024]
    - [36, 61.225]
  - - [1024, 10080, 1, 4096]
    - [54, 81.189]
  - - [1024, 10200, 1, 1024]
    - [36, 62.082]
  - - [1024, 10200, 1, 4096]
    - [54, 82.691]
  - - [1024, 3840, 1, 1024]
    - [53, 56.006]
  - - [1024, 3840, 1, 4096]
    - [98, 77.415]
  - - [1024, 3968, 1, 1024]
    - [20, 53.029]
  - - [1024, 3968, 1, 4096]
    - [41, 68.685]
  - - [1024, 6528, 1, 1024]
    - [36, 60.345]
  - - [1024, 6528, 1, 4096]
    - [54, 81.674]
  - - [1024, 7104, 1, 1024]
    - [24, 56.899]
  - - [1024, 7104, 1, 4096]
    - [54, 75.814]
  - - [1024, 7200, 1, 1024]
    - [55, 57.318]
  - - [1024, 7200, 1, 4096]
    - [54, 76.596]
  - - [1024, 8064, 1, 1024]
    - [24, 57.772]
  - - [1024, 8064, 1, 4096]
    - [53, 73.707]
  - - [1024, 8160, 1, 1024]
    - [24, 58.108]
  - - [1024, 8160, 1, 4096]
    - [54, 74.816]
  - - [1024, 9216, 1, 1024]
    - [36, 62.393]
  - - [1024, 9216, 1, 4096]
    - [54, 83.655]
  - - [1024, 9520, 1, 1024]
    - [41, 60.402]
  - - [1024, 9520, 1, 4096]
    - [56, 78.566]
  - - [4096, 10064, 1, 1024]
    - [45, 64.872]
  - - [4096, 10080, 1, 1024]
    - [55, 64.737]
  - - [4096, 10200, 1, 1024]
    - [45, 63.791]
  - - [4096, 3840, 1, 1024]
    - [55, 61.16]
  - - [4096, 3968, 1, 1024]
    - [45, 59.824]
  - - [4096, 6528, 1, 1024]
    - [55, 63.474]
  - - [4096, 7104, 1, 1024]
    - [45, 64.016]
  - - [4096, 7200, 1, 1024]
    - [55, 64.22]
  - - [4096, 8064, 1, 1024]
    - [45, 63.798]
  - - [4096, 8160, 1, 1024]
    - [45, 64.225]
  - - [4096, 9216, 1, 1024]
    - [55, 64.577]
  - - [4096, 9520, 1, 1024]
    - [45, 63.893]
  - - [42720, 10080, 1, 1024]
    - [45, 73.196]
  - - [42720, 3968, 1, 1024]
    - [45, 70.953]
  - - [42720, 6528, 1, 1024]
    - [45, 72.241]
  - - [42720, 7104, 1, 1024]
    - [55, 72.64]
  - - [42720, 7200, 1, 1024]
    - [45, 72.893]
  - - [42720, 9520, 1, 1024]
    - [45, 72.52]
  - - [24, 24, 4736, 64]
    - [86, 5.136]
  - - [32, 32, 4608, 64]
    - [86, 6.778]
  - - [32, 35, 4608, 64]
    - [101, 6.586]
  - - [64, 512, 1, 512]
    - [2, 1.575]
  - - [512, 512, 1, 64]
    - [102, 1.588]
  - - [128, 128, 1, 64]
    - [78, 0.122]
  - - [64, 128, 1, 128]
    - [76, 0.131]
  - - [2048, 512, 1, 2048]
    - [48, 46.98]
  - - [1024, 512, 1, 1600]
    - [103, 28.045]
  - - [2048, 512, 1, 74]
    - [35, 4.601]
  - - [512, 1, 1, 2048]
    - [5, 0.066]
  - - [64, 512, 1, 1024]
    - [3, 2.662]
  - - [1024, 1600, 1, 560]
    - [38, 26.85]
  - - [1600, 1, 1, 1024]
    - [4, 0.125]
  - - [512, 1600, 1, 512]
    - [18, 23.747]
  - - [1024, 1600, 1, 1024]
    - [38, 47.02]
  - - [32, 1600, 1, 512]
    - [22, 2.326]
  - - [64, 960, 1, 1024]
    - [12, 4.726]
  - - [200, 1, 1, 1024]
    - [8, 0.017]
  - - [256, 684, 1, 1024]
    - [104, 9.903]
  - - [256, 1280, 1, 1024]
    - [16, 17.184]
  - - [256, 1536, 1, 1024]
    - [16, 19.985]
  - - [256, 2304, 1, 1024]
    - [24, 25.297]
  - - [256, 2560, 1, 1024]
    - [18, 28.318]
  - - [256, 2816, 1, 1024]
    - [17, 31.267]
  - - [256, 3328, 1, 1024]
    - [17, 36.813]
  - - [256, 3584, 1, 1024]
    - [18, 32.772]
  - - [256, 4608, 1, 1024]
    - [24, 39.679]
  - - [256, 4864, 1, 1024]
    - [18, 40.811]
  - - [256, 5376, 1, 1024]
    - [56, 39.108]
  - - [256, 5888, 1, 1024]
    - [38, 42.519]
  - - [256, 6144, 1, 1024]
    - [46, 43.308]
  - - [256, 6400, 1, 1024]
    - [38, 45.879]
  - - [256, 6656, 1, 1024]
    - [38, 46.694]
  - - [256, 7168, 1, 1024]
    - [18, 41.429]
  - - [256, 7424, 1, 1024]
    - [24, 42.659]
  - - [256, 7936, 1, 1024]
    - [17, 44.391]
  - - [256, 8192, 1, 1024]
    - [18, 44.888]
  - - [256, 8448, 1, 1024]
    - [24, 45.698]
  - - [256, 8960, 1, 1024]
    - [49, 46.508]
  - - [256, 9984, 1, 1024]
    - [98, 50.666]
  - - [256, 10496, 1, 1024]
    - [37, 52.364]
  - - [256, 11264, 1, 1024]
    - [18, 46.334]
  - - [256, 11520, 1, 1024]
    - [18, 46.994]
  - - [256, 11776, 1, 1024]
    - [25, 47.579]
  - - [256, 12544, 1, 1024]
    - [38, 48.303]
  - - [256, 13312, 1, 1024]
    - [38, 50.796]
  - - [256, 14336, 1, 1024]
    - [36, 51.013]
  - - [256, 14592, 1, 1024]
    - [36, 52.176]
  - - [256, 14848, 1, 1024]
    - [53, 52.331]
  - - [256, 15104, 1, 1024]
    - [36, 53.488]
  - - [256, 16128, 1, 1024]
    - [56, 49.208]
  - - [256, 18176, 1, 1024]
    - [36, 51.42]
  - - [256, 18944, 1, 1024]
    - [36, 52.933]
  - - [256, 19200, 1, 1024]
    - [54, 52.997]
  - - [256, 20480, 1, 1024]
    - [36, 55.646]
  - - [256, 20992, 1, 1024]
    - [36, 56.363]
  - - [256, 21248, 1, 1024]
    - [24, 50.325]
  - - [256, 21504, 1, 1024]
    - [18, 50.728]
  - - [256, 22016, 1, 1024]
    - [18, 51.812]
  - - [256, 22344, 1, 1024]
    - [18, 51.556]
  - - [256, 23296, 1, 1024]
    - [37, 52.764]
  - - [256, 23552, 1, 1024]
    - [36, 53.631]
  - - [256, 31488, 1, 1024]
    - [36, 57.799]
  - - [256, 33536, 1, 1024]
    - [36, 54.996]
  - - [256, 44505, 1, 1024]
    - [36, 56.584]
  - - [960, 1, 1, 2048]
    - [2, 0.127]
  - - [1024, 200, 1, 560]
    - [83, 6.397]
  - - [1024, 960, 1, 1600]
    - [97, 44.863]
  - - [1024, 32768, 1, 480]
    - [100, 52.039]
  - - [1280, 8976, 1, 256]
    - [17, 33.006]
  - - [1792, 8976, 1, 256]
    - [17, 34.725]
  - - [2048, 114, 1, 512]
    - [14, 8.524]
  - - [2048, 114, 1, 768]
    - [14, 10.522]
  - - [2048, 215, 1, 512]
    - [17, 14.853]
  - - [2048, 215, 1, 768]
    - [17, 17.558]
  - - [2048, 256, 1, 512]
    - [24, 16.896]
  - - [2048, 256, 1, 768]
    - [17, 21.199]
  - - [2048, 512, 1, 67]
    - [35, 4.166]
  - - [2048, 512, 1, 100]
    - [105, 5.68]
  - - [2048, 684, 1, 512]
    - [46, 29.384]
  - - [2048, 684, 1, 768]
    - [38, 35.756]
  - - [2048, 960, 1, 74]
    - [101, 6.071]
  - - [2048, 960, 1, 2048]
    - [44, 54.988]
  - - [2048, 1536, 1, 512]
    - [41, 37.415]
  - - [2048, 1536, 1, 768]
    - [39, 46.849]
  - - [2048, 8976, 1, 256]
    - [17, 34.836]
  - - [2304, 8976, 1, 256]
    - [17, 35.933]
  - - [2560, 8976, 1, 256]
    - [17, 36.157]
  - - [2816, 8976, 1, 256]
    - [17, 36.252]
  - - [3072, 8976, 1, 256]
    - [17, 36.449]
  - - [3328, 8976, 1, 256]
    - [17, 36.354]
  - - [3840, 8976, 1, 256]
    - [17, 36.63]
  - - [4096, 8976, 1, 256]
    - [17, 36.278]
  - - [4352, 8976, 1, 256]
    - [17, 36.748]
  - - [4608, 8976, 1, 256]
    - [17, 35.889]
  - - [4864, 8976, 1, 256]
    - [17, 35.502]
  - - [5120, 8976, 1, 256]
    - [17, 35.216]
  - - [5376, 8976, 1, 256]
    - [17, 34.399]
  - - [5632, 8976, 1, 256]
    - [17, 33.728]
  - - [5888, 8976, 1, 256]
    - [17, 33.561]
  - - [6144, 8976, 1, 256]
    - [27, 32.85]
  - - [6400, 8976, 1, 256]
    - [100, 32.235]
  - - [7168, 8976, 1, 256]
    - [100, 31.304]
  - - [7936, 8976, 1, 256]
    - [36, 30.84]
  - - [8192, 8976, 1, 256]
    - [36, 33.536]
  - - [8448, 8976, 1, 256]
    - [100, 30.722]
  - - [8960, 8976, 1, 256]
    - [106, 30.814]
  - - [9472, 8976, 1, 256]
    - [106, 30.668]
  - - [9728, 8976, 1, 256]
    - [45, 30.263]
  - - [9984, 8976, 1, 256]
    - [106, 30.259]
  - - [10240, 8976, 1, 256]
    - [45, 30.934]
  - - [10496, 8976, 1, 256]
    - [106, 30.385]
  - - [11264, 8976, 1, 256]
    - [106, 30.706]
  - - [11776, 8976, 1, 256]
    - [45, 30.233]
  - - [12544, 8976, 1, 256]
    - [106, 29.652]
  - - [13312, 8976, 1, 256]
    - [106, 31.026]
  - - [13568, 8976, 1, 256]
    - [45, 30.571]
  - - [13824, 8976, 1, 256]
    - [106, 30.688]
  - - [15104, 8976, 1, 256]
    - [106, 30.928]
  - - [15360, 8976, 1, 256]
    - [106, 29.867]
  - - [15872, 8976, 1, 256]
    - [106, 30.303]
  - - [16128, 8976, 1, 256]
    - [106, 31.335]
  - - [17152, 8976, 1, 256]
    - [106, 30.858]
  - - [18176, 8976, 1, 256]
    - [106, 31.179]
  - - [18688, 8976, 1, 256]
    - [106, 31.161]
  - - [18944, 8976, 1, 256]
    - [106, 30.544]
  - - [19712, 8976, 1, 256]
    - [106, 31.233]
  - - [19968, 8976, 1, 256]
    - [106, 30.869]
  - - [20480, 8976, 1, 256]
    - [70, 27.373]
  - - [20992, 8976, 1, 256]
    - [106, 30.732]
  - - [21248, 8976, 1, 256]
    - [106, 31.099]
  - - [23552, 8976, 1, 256]
    - [106, 31.204]
  - - [28672, 8976, 1, 256]
    - [70, 26.965]
  - - [31488, 8976, 1, 256]
    - [106, 30.965]
  - - [33536, 8976, 1, 256]
    - [45, 31.166]
  - - [2048, 1024, 1, 2048]
    - [24, 56.663]
  - - [2048, 1024, 1, 8192]
    - [107, 71.424]
  - - [2048, 2, 1, 2048]
    - [11, 0.511]
  - - [30592, 1024, 1, 2048]
    - [45, 78.414]
  - - [6144, 1024, 1, 2048]
    - [45, 70.231]
  - - [8192, 1024, 1, 2048]
    - [52, 63.965]
  - - [1024, 16, 1, 1024]
    - [8, 1.38]
  - - [30592, 8192, 1, 1024]
    - [45, 69.294]
  - - [3072, 8192, 1, 1024]
    - [45, 64.88]
  - - [512, 512, 256, 64]
    - [14, 13.404]
  - - [64, 512, 256, 512]
    - [38, 28.889]
  - - [30592, 2048, 1, 1024]
    - [45, 64.833]
  - - [3072, 2048, 1, 1024]
    - [34, 57.561]
  - - [30592, 4096, 1, 1024]
    - [45, 68.203]
  - - [3072, 4096, 1, 1024]
    - [45, 61.046]
  - - [64, 512, 128, 512]
    - [46, 25.603]
  - - [1920, 2048, 1, 2560]
    - [54, 72.515]
  - - [2560, 2048, 1, 2560]
    - [53, 72.318]
  - - [2560, 2048, 1, 640]
    - [37, 47.256]
  - - [2560, 4, 1, 2560]
    - [28, 1.387]
  - - [7680, 2048, 1, 2560]
    - [45, 77.008]
  - - [512, 512, 40, 64]
    - [19, 11.722]
  - - [64, 512, 40, 512]
    - [39, 23.336]
  - - [1536, 4096, 1, 1536]
    - [37, 64.654]
  - - [1536, 4096, 1, 6144]
    - [53, 80.396]
  - - [4608, 4096, 1, 1536]
    - [45, 68.822]
  - - [50304, 4096, 1, 1536]
    - [45, 77.015]
  - - [6144, 4096, 1, 1536]
    - [45, 73.765]
  - - [1024, 1024, 64, 96]
    - [100, 16.659]
  - - [96, 1024, 64, 1024]
    - [62, 41.501]
  - - [1536, 8192, 1, 1536]
    - [45, 67.794]
  - - [1536, 8192, 1, 6144]
    - [42, 82.241]
  - - [4608, 8192, 1, 1536]
    - [45, 72.271]
  - - [50304, 8192, 1, 1536]
    - [45, 78.108]
  - - [6144, 8192, 1, 1536]
    - [45, 74.662]
  - - [1024, 1024, 128, 96]
    - [100, 16.993]
  - - [96, 1024, 128, 1024]
    - [99, 42.017]
  - - [1024, 16384, 1, 1024]
    - [45, 63.775]
  - - [1024, 16384, 1, 4096]
    - [53, 82.278]
  - - [3072, 16384, 1, 1024]
    - [45, 67.465]
  - - [4096, 16384, 1, 1024]
    - [45, 65.87]
  - - [50304, 16384, 1, 1024]
    - [45, 69.713]
  - - [1024, 1024, 256, 64]
    - [14, 13.363]
  - - [64, 1024, 256, 1024]
    - [38, 35.218]
  - - [50304, 2048, 1, 1024]
    - [45, 66.105]
  - - [1024, 1024, 32, 64]
    - [19, 12.754]
  - - [64, 1024, 32, 1024]
    - [17, 30.665]
  - - [50304, 4096, 1, 1024]
    - [45, 68.271]
  - - [1024, 1024, 64, 64]
    - [14, 13.174]
  - - [64, 1024, 64, 1024]
    - [38, 32.696]
  - - [50304, 8192, 1, 1024]
    - [55, 69.12]
  - - [1024, 1024, 128, 64]
    - [14, 13.34]
  - - [64, 1024, 128, 1024]
    - [38, 36.004]
  - - [1024, 64, 1, 1024]
    - [12, 5.074]
  - - [30528, 8192, 1, 1024]
    - [45, 69.596]
  - - [128, 128, 1024, 64]
    - [14, 11.565]
  - - [64, 128, 1024, 128]
    - [14, 12.628]
  - - [1024, 3456, 1, 1024]
    - [38, 56.238]
  - - [1024, 3456, 1, 480]
    - [100, 34.176]
  - - [1024, 4096, 1, 480]
    - [106, 37.063]
  - - [1024, 6912, 1, 1024]
    - [41, 59.001]
  - - [1024, 6912, 1, 480]
    - [100, 40.419]
  - - [1024, 864, 1, 1024]
    - [97, 32.926]
  - - [1024, 864, 1, 480]
    - [108, 18.332]
  - - [128, 3456, 1, 256]
    - [19, 9.114]
  - - [128, 4096, 1, 256]
    - [15, 10.014]
  - - [128, 55296, 1, 256]
    - [17, 25.172]
  - - [128, 6912, 1, 256]
    - [25, 15.56]
  - - [128, 864, 1, 256]
    - [8, 2.874]
  - - [256, 3456, 1, 512]
    - [24, 26.307]
  - - [256, 4096, 1, 512]
    - [17, 26.071]
  - - [256, 55296, 1, 512]
    - [18, 43.091]
  - - [256, 6912, 1, 512]
    - [38, 34.601]
  - - [256, 864, 1, 512]
    - [15, 8.285]
  - - [3456, 1, 1, 256]
    - [9, 0.09]
  - - [4096, 1, 1, 256]
    - [12, 0.105]
  - - [512, 3456, 1, 1024]
    - [56, 49.55]
  - - [512, 3456, 1, 13]
    - [35, 1.211]
  - - [512, 4096, 1, 1024]
    - [25, 47.072]
  - - [512, 4096, 1, 13]
    - [35, 1.324]
  - - [512, 55296, 1, 13]
    - [35, 2.538]
  - - [512, 6912, 1, 1024]
    - [56, 54.584]
  - - [512, 6912, 1, 13]
    - [35, 1.667]
  - - [512, 864, 1, 1024]
    - [14, 23.093]
  - - [512, 864, 1, 13]
    - [82, 0.502]
  - - [6912, 1, 1, 256]
    - [8, 0.173]
  - - [864, 1, 1, 256]
    - [8, 0.023]
  - - [30528, 640, 1, 1024]
    - [48, 58.336]
  - - [30528, 1280, 1, 1024]
    - [45, 65.203]
  - - [30528, 1600, 1, 1024]
    - [45, 62.832]
  - - [1024, 10240, 1, 1024]
    - [53, 61.753]
  - - [1024, 80, 1, 1024]
    - [12, 6.848]
  - - [4096, 10240, 1, 1024]
    - [45, 64.511]
  - - [1024, 10240, 1, 4096]
    - [53, 82.211]
  - - [64, 128, 1280, 128]
    - [20, 12.793]
  - - [128, 128, 1280, 64]
    - [19, 11.842]
  - - [1024, 10496, 1, 4096]
    - [54, 84.439]
  - - [30528, 1640, 1, 1024]
    - [45, 62.303]
  - - [1024, 82, 1, 1024]
    - [12, 6.093]
  - - [4096, 10496, 1, 1024]
    - [45, 64.827]
  - - [1024, 10496, 1, 1024]
    - [53, 63.136]
  - - [64, 128, 1312, 128]
    - [29, 12.938]
  - - [128, 128, 1312, 64]
    - [19, 11.859]
  - - [30528, 160, 1, 1024]
    - [109, 42.338]
  - - [1024, 12, 1, 1024]
    - [28, 1.013]
  - - [30528, 240, 1, 1024]
    - [52, 50.225]
  - - [1024, 6144, 1, 1024]
    - [38, 59.108]
  - - [4096, 6144, 1, 1024]
    - [55, 62.939]
  - - [1024, 6144, 1, 4096]
    - [54, 77.63]
  - - [64, 512, 192, 512]
    - [46, 27.473]
  - - [512, 512, 192, 64]
    - [14, 13.255]
  - - [1024, 10224, 1, 1024]
    - [36, 62.036]
  - - [1024, 10192, 1, 1024]
    - [53, 62.033]
  - - [1024, 10208, 1, 1024]
    - [53, 61.939]
  - - [1024, 10224, 1, 4096]
    - [53, 82.292]
  - - [4096, 10224, 1, 1024]
    - [45, 63.933]
  - - [3072, 10224, 1, 1024]
    - [45, 64.787]
  - - [3072, 10240, 1, 1024]
    - [45, 65.028]
  - - [1024, 10192, 1, 4096]
    - [54, 82.64]
  - - [4096, 10192, 1, 1024]
    - [45, 64.2]
  - - [3072, 10192, 1, 1024]
    - [45, 65.073]
  - - [3072, 10200, 1, 1024]
    - [45, 64.89]
  - - [1024, 10184, 1, 1024]
    - [53, 61.921]
  - - [3072, 10208, 1, 1024]
    - [45, 65.744]
  - - [1024, 10208, 1, 4096]
    - [54, 82.374]
  - - [4096, 10208, 1, 1024]
    - [45, 63.866]
  - - [2048, 10224, 1, 1024]
    - [45, 66.003]
  - - [2048, 10240, 1, 1024]
    - [45, 66.034]
  - - [1024, 10120, 1, 1024]
    - [54, 61.248]
  - - [2048, 10192, 1, 1024]
    - [45, 65.474]
  - - [24, 24, 6816, 64]
    - [86, 5.529]
  - - [1024, 10152, 1, 1024]
    - [53, 61.379]
  - - [3072, 10080, 1, 1024]
    - [45, 66.614]
  - - [1024, 2048, 1, 49]
    - [35, 4.453]
  - - [1024, 256, 1, 196]
    - [86, 3.784]
  - - [1024, 512, 1, 196]
    - [35, 6.654]
  - - [1152, 128, 1, 784]
    - [21, 6.03]
  - - [128, 512, 1, 784]
    - [31, 3.015]
  - - [2048, 512, 1, 49]
    - [35, 3.425]
  - - [2304, 256, 1, 196]
    - [35, 7.196]
  - - [256, 1024, 1, 196]
    - [94, 3.885]
  - - [256, 128, 1, 3136]
    - [6, 3.796]
  - - [256, 512, 1, 784]
    - [16, 5.311]
  - - [256, 64, 1, 3136]
    - [3, 1.898]
  - - [4608, 512, 1, 49]
    - [105, 4.736]
  - - [512, 1024, 1, 196]
    - [35, 6.851]
  - - [512, 128, 1, 784]
    - [77, 3.112]
  - - [512, 2048, 1, 49]
    - [105, 3.366]
  - - [512, 256, 1, 784]
    - [91, 5.41]
  - - [576, 64, 1, 3136]
    - [6, 4.202]
  - - [64, 256, 1, 3136]
    - [6, 1.923]
  - - [64, 64, 1, 3136]
    - [8, 0.474]
  - - [128, 128, 49, 12800]
    - [17, 42.722]
  - - [128, 128, 25, 25088]
    - [14, 36.011]
  - - [128, 128, 49, 25600]
    - [103, 41.971]
  - - [128, 128, 25, 50176]
    - [110, 36.214]
  - - [256, 256, 25, 12544]
    - [58, 71.933]
  - - [256, 256, 49, 3200]
    - [50, 60.268]
  - - [256, 256, 25, 6272]
    - [63, 68.264]
  - - [256, 256, 49, 6400]
    - [111, 67.864]
  - - [512, 512, 49, 1152]
    - [17, 55.983]
  - - [512, 512, 25, 2048]
    - [46, 63.297]
  - - [512, 512, 49, 2304]
    - [36, 67.238]
  - - [512, 512, 25, 4096]
    - [63, 71.245]
  - - [64, 128, 2048, 128]
    - [25, 12.931]
  - - [128, 128, 2048, 64]
    - [19, 12.128]
  - - [30528, 2560, 1, 1024]
    - [45, 66.966]
  - - [1024, 128, 1, 1024]
    - [12, 8.448]
  - - [64, 128, 1536, 128]
    - [29, 12.897]
  - - [128, 128, 1536, 64]
    - [14, 11.845]
  - - [1024, 12288, 1, 1024]
    - [52, 61.879]
  - - [1024, 12288, 1, 4096]
    - [56, 80.071]
  - - [30528, 1920, 1, 1024]
    - [45, 64.841]
  - - [1024, 96, 1, 1024]
    - [12, 7.133]
  - - [4096, 12288, 1, 1024]
    - [55, 65.45]
  - - [128, 128, 36, 12544]
    - [25, 37.098]
  - - [128, 128, 49, 9216]
    - [17, 41.931]
  - - [128, 128, 64, 6400]
    - [43, 38.497]
  - - [128, 128, 81, 12544]
    - [112, 43.567]
  - - [128, 128, 121, 9216]
    - [17, 35.399]
  - - [128, 128, 169, 6400]
    - [112, 42.032]
  - - [256, 256, 36, 4096]
    - [49, 64.653]
  - - [256, 256, 49, 2304]
    - [50, 56.668]
  - - [256, 256, 64, 2304]
    - [46, 55.099]
  - - [256, 256, 81, 4096]
    - [58, 68.697]
  - - [256, 256, 121, 2304]
    - [46, 58.445]
  - - [256, 256, 169, 2304]
    - [56, 57.65]
  - - [512, 512, 81, 1024]
    - [54, 57.763]
  - - [512, 512, 121, 1024]
    - [54, 58.309]
  - - [512, 512, 169, 1024]
    - [54, 59.363]
  - - [512, 512, 36, 1024]
    - [24, 55.155]
  - - [512, 512, 49, 1024]
    - [46, 56.028]
  - - [512, 512, 64, 1024]
    - [54, 57.097]
  - - [64, 64, 36, 50176]
    - [113, 18.272]
  - - [64, 64, 49, 36864]
    - [114, 18.557]
  - - [64, 64, 64, 25600]
    - [14, 20.146]
  - - [128, 128, 192, 64]
    - [19, 8.495]
  - - [64, 128, 192, 128]
    - [38, 9.905]
  - - [768, 2048, 1, 768]
    - [38, 38.445]
  - - [3072, 2048, 1, 768]
    - [34, 51.164]
  - - [768, 2048, 1, 3072]
    - [42, 61.512]
  - - [768, 16, 1, 768]
    - [8, 0.837]
  - - [384, 384, 144, 64]
    - [19, 12.529]
  - - [64, 384, 144, 384]
    - [38, 22.886]
  - - [768, 4608, 1, 768]
    - [20, 48.071]
  - - [3072, 4608, 1, 768]
    - [45, 54.633]
  - - [768, 4608, 1, 3072]
    - [42, 70.678]
  - - [768, 12, 1, 768]
    - [28, 0.604]
  - - [512, 512, 48, 64]
    - [14, 12.017]
  - - [64, 512, 48, 512]
    - [38, 25.486]
  - - [768, 4, 1, 768]
    - [8, 0.201]
  - - [128, 128, 256, 64]
    - [19, 9.306]
  - - [64, 128, 256, 128]
    - [20, 10.879]
  - - [384, 384, 192, 64]
    - [19, 12.986]
  - - [64, 384, 192, 384]
    - [46, 22.141]
  - - [1024, 4608, 1, 1024]
    - [24, 54.113]
  - - [4096, 4608, 1, 1024]
    - [45, 61.809]
  - - [1024, 4608, 1, 4096]
    - [98, 72.104]
  - - [2880, 3072, 1, 3072]
    - [36, 75.683]
  - - [3072, 3072, 1, 3072]
    - [55, 79.164]
  - - [3072, 512, 1, 3072]
    - [112, 61.721]
  - - [4096, 512, 1, 4096]
    - [107, 65.658]
  - - [512, 1024, 1, 1024]
    - [25, 23.175]
  - - [512, 2048, 1, 2048]
    - [17, 45.565]
  - - [512, 3072, 1, 3072]
    - [112, 60.961]
  - - [512, 4096, 1, 4096]
    - [64, 65.215]
  - - [512, 8192, 1, 8192]
    - [115, 76.024]
  - - [64, 1024, 1, 1024]
    - [8, 5.04]
  - - [8192, 512, 1, 8192]
    - [116, 75.022]
  - - [2, 1, 1, 1024]
    - [4, 0.0]
  - - [2, 8, 1, 1024]
    - [6, 0.002]
  - - [30522, 77, 1, 1024]
    - [117, 24.144]
  - - [30522, 616, 1, 1024]
    - [55, 58.625]
  - - [2, 10, 1, 1024]
    - [6, 0.002]
  - - [30522, 160, 1, 1024]
    - [55, 38.042]
  - - [30522, 200, 1, 1024]
    - [55, 41.33]
  - - [2, 39, 1, 1024]
    - [4, 0.008]
  - - [30522, 780, 1, 1024]
    - [55, 60.959]
  - - [2, 4, 1, 1024]
    - [6, 0.001]
  - - [30522, 308, 1, 1024]
    - [55, 48.526]
  - - [2, 40, 1, 1024]
    - [6, 0.008]
  - - [30522, 800, 1, 1024]
    - [55, 60.595]
  - - [2, 41, 1, 1024]
    - [6, 0.008]
  - - [30522, 820, 1, 1024]
    - [68, 62.635]
  - - [2, 5, 1, 1024]
    - [4, 0.001]
  - - [30522, 385, 1, 1024]
    - [55, 53.691]
  - - [2, 6, 1, 1024]
    - [4, 0.001]
  - - [30522, 462, 1, 1024]
    - [68, 57.243]
  - - [2, 9, 1, 1024]
    - [4, 0.002]
  - - [30522, 180, 1, 1024]
    - [117, 35.649]
  - - [2, 32, 1, 1024]
    - [4, 0.006]
  - - [4, 4, 32768, 64]
    - [75, 0.704]
  - - [4, 4, 38400, 64]
    - [81, 0.729]
  - - [14, 14, 10880, 64]
    - [89, 3.106]
  - - [15, 14, 10880, 64]
    - [89, 3.243]
  - - [15, 15, 7680, 64]
    - [89, 3.084]
  - - [15, 15, 10880, 64]
    - [89, 3.408]
  - - [17, 15, 7680, 64]
    - [93, 2.68]
  - - [17, 17, 6144, 64]
    - [93, 2.808]
  - - [17, 17, 7680, 64]
    - [93, 2.98]
  - - [21, 17, 6144, 64]
    - [93, 3.438]
  - - [21, 21, 6144, 64]
    - [92, 3.9]
  - - [30, 30, 2048, 64]
    - [92, 3.83]
  - - [30, 31, 2048, 64]
    - [94, 3.869]
  - - [31, 31, 2048, 64]
    - [82, 3.942]
  - - [34, 24, 4736, 64]
    - [19, 4.203]
  - - [34, 34, 4736, 64]
    - [81, 4.057]
  - - [35, 35, 4608, 64]
    - [75, 3.906]
  - - [2, 2048, 1, 1024]
    - [2, 0.321]
  - - [2, 1024, 1, 1024]
    - [12, 0.179]
  - - [5, 5, 1, 64]
    - [91, 0.0]
  - - [33, 33, 1, 32]
    - [89, 0.005]
  - - [3, 3, 512, 64]
    - [78, 0.029]
  - - [5, 5, 512, 64]
    - [78, 0.087]
  - - [5, 5, 960, 64]
    - [81, 0.14]
  - - [9, 9, 512, 64]
    - [78, 0.279]
  - - [27, 27, 32768, 128]
    - [12, 7.036]
  - - [33, 33, 1600, 32]
    - [81, 2.284]
  - - [684, 8976, 1, 256]
    - [25, 26.709]
  - - [44505, 8976, 1, 256]
    - [55, 33.78]
  - - [2, 2, 1, 2048]
    - [4, 0.001]
  - - [2, 16, 1, 1024]
    - [4, 0.003]
  - - [2, 4, 1, 2560]
    - [4, 0.001]
  - - [2, 64, 1, 1024]
    - [4, 0.013]
  - - [2, 80, 1, 1024]
    - [6, 0.015]
  - - [2, 82, 1, 1024]
    - [6, 0.015]
  - - [2, 12, 1, 1024]
    - [4, 0.002]
  - - [1, 4096, 1, 256]
    - [7, 0.097]
  - - [1, 6912, 1, 256]
    - [12, 0.157]
  - - [26, 26, 6272, 64]
    - [93, 4.563]
  - - [147, 64, 1, 12544]
    - [0, 2.817]
  - - [2, 128, 1, 1024]
    - [7, 0.024]
  - - [2, 96, 1, 1024]
    - [11, 0.02]
  - - [2, 2048, 1, 768]
    - [2, 0.269]
  - - [2, 4608, 1, 768]
    - [7, 0.55]
  - - [2, 4608, 1, 1024]
    - [7, 0.673]
- null
