library/src/blas3/Tensile/Logic/asm_full/aldebaran_Cijk_Alik_Bljk_HSS_BH.yaml
- {MinimumRequiredVersion: 4.23.0}
- aldebaran
- gfx90a
- [Device 0050, Device 0051, Device 0052, Device 0054, Device 0062, Device 7400, Device 740c]
    SolutionIndex: 0
    SolutionNameMin: Cijk_Alik_Bljk_HSS_BH_MT16x16x8_SE_PGR1_PLR1_TT2_2
    SolutionIndex: 1
    SolutionNameMin: Cijk_Alik_Bljk_HSS_BH_MT32x16x8_SE_PGR1_PLR1_TT4_2
    SolutionIndex: 2
    SolutionNameMin: Cijk_Alik_Bljk_HSS_BH_MT16x16x16_SE_PGR1_PLR1_TT2_2
    SolutionIndex: 3
    SolutionNameMin: Cijk_Alik_Bljk_HSS_BH_MT32x32x16_SE_PGR1_PLR1_TT4_4
    SolutionIndex: 4
    SolutionNameMin: Cijk_Alik_Bljk_HSS_BH_MT64x32x16_SE_PGR1_PLR1_TT4_4
    SolutionIndex: 5
    SolutionNameMin: Cijk_Alik_Bljk_HSS_BH_MT16x16x32_SE_PGR1_PLR1_TT2_2
    SolutionIndex: 6
    SolutionNameMin: Cijk_Alik_Bljk_HSS_BH_MT16x16x8_SE_PGR1_PLR1_TT2_2
    SolutionIndex: 7
    SolutionNameMin: Cijk_Alik_Bljk_HSS_BH_MT16x16x16_SE_PGR1_PLR1_TT2_2
    SolutionIndex: 8
    SolutionNameMin: Cijk_Alik_Bljk_HSS_BH_MT32x32x16_SE_PGR1_PLR1_TT4_4
    SolutionIndex: 9
    SolutionNameMin: Cijk_Alik_Bljk_HSS_BH_MT16x16x24_SE_PGR1_PLR1_TT2_2
    SolutionIndex: 10
    SolutionNameMin: Cijk_Alik_Bljk_HSS_BH_MT32x16x24_SE_PGR1_PLR1_TT4_2
    SolutionIndex: 11
    SolutionNameMin: Cijk_Alik_Bljk_HSS_BH_MT32x32x24_SE_PGR1_PLR1_TT4_4
    SolutionIndex: 12
    SolutionNameMin: Cijk_Alik_Bljk_HSS_BH_MT16x16x24_SE_PGR1_PLR1_TT2_2
    SolutionIndex: 13
    SolutionNameMin: Cijk_Alik_Bljk_HSS_BH_MT32x16x24_SE_PGR1_PLR1_TT4_2
    SolutionIndex: 14
    SolutionNameMin: Cijk_Alik_Bljk_HSS_BH_MT32x32x24_SE_PGR1_PLR1_TT4_4
    SolutionIndex: 15
    SolutionNameMin: Cijk_Alik_Bljk_HSS_BH_MT16x16x32_SE_PGR1_PLR1_TT2_2
    SolutionIndex: 16
    SolutionNameMin: Cijk_Alik_Bljk_HSS_BH_MT32x32x32_SE_PGR1_PLR1_TT4_4
    SolutionIndex: 17
    SolutionNameMin: Cijk_Alik_Bljk_HSS_BH_MT64x64x8_SE_PGR1_PLR1_TT4_4
    SolutionIndex: 18
    SolutionNameMin: Cijk_Alik_Bljk_HSS_BH_MT64x64x16_SE_PGR1_PLR1_TT4_4
    SolutionIndex: 19
    SolutionNameMin: Cijk_Alik_Bljk_HSS_BH_MT64x128x16_SE_PGR1_PLR1_TT4_8
    SolutionIndex: 20
    SolutionNameMin: Cijk_Alik_Bljk_HSS_BH_MT128x64x16_SE_PGR1_PLR1_TT8_4
    SolutionIndex: 21
    SolutionNameMin: Cijk_Alik_Bljk_HSS_BH_MT64x128x4_SE_PGR0_PLR0_TT4_8
    SolutionIndex: 22
    SolutionNameMin: Cijk_Alik_Bljk_HSS_BH_MT64x64x4_SE_PGR0_PLR0_TT4_4
    SolutionIndex: 23
    SolutionNameMin: Cijk_Alik_Bljk_HSS_BH_MT64x64x4_SE_PGR1_PLR0_TT4_4
    SolutionIndex: 24
    SolutionNameMin: Cijk_Alik_Bljk_HSS_BH_MT64x128x4_SE_PGR0_PLR1_TT4_8
    SolutionIndex: 25
    SolutionNameMin: Cijk_Alik_Bljk_HSS_BH_MT64x64x4_SE_PGR0_PLR1_TT4_4
    SolutionIndex: 26
    SolutionNameMin: Cijk_Alik_Bljk_HSS_BH_MT64x128x8_SE_PGR0_PLR0_TT4_8
    SolutionIndex: 27
    SolutionNameMin: Cijk_Alik_Bljk_HSS_BH_MT64x64x8_SE_PGR0_PLR0_TT4_4
    SolutionIndex: 28
    SolutionNameMin: Cijk_Alik_Bljk_HSS_BH_MT64x128x8_SE_PGR0_PLR1_TT4_8
    SolutionIndex: 29
    SolutionNameMin: Cijk_Alik_Bljk_HSS_BH_MT64x64x8_SE_PGR0_PLR1_TT4_4
    SolutionIndex: 30
    SolutionNameMin: Cijk_Alik_Bljk_HSS_BH_MT64x64x16_SE_PGR0_PLR0_TT4_4
    SolutionIndex: 31
    SolutionNameMin: Cijk_Alik_Bljk_HSS_BH_MT64x128x16_SE_PGR1_PLR0_TT4_8
    SolutionIndex: 32
    SolutionNameMin: Cijk_Alik_Bljk_HSS_BH_MT64x64x16_SE_PGR1_PLR0_TT4_4
    SolutionIndex: 33
    SolutionNameMin: Cijk_Alik_Bljk_HSS_BH_MT64x64x16_SE_PGR0_PLR1_TT4_4
    SolutionIndex: 34
    SolutionNameMin: Cijk_Alik_Bljk_HSS_BH_MT64x64x16_SE_PGR1_PLR1_TT4_4
    SolutionIndex: 35
    SolutionNameMin: Cijk_Alik_Bljk_HSS_BH_MT128x128x4_SE_PGR0_PLR0_TT8_8
    SolutionIndex: 36
    SolutionNameMin: Cijk_Alik_Bljk_HSS_BH_MT64x128x4_SE_PGR0_PLR0_TT4_8
    SolutionIndex: 37
    SolutionNameMin: Cijk_Alik_Bljk_HSS_BH_MT64x64x4_SE_PGR0_PLR0_TT4_4
    SolutionIndex: 38
    SolutionNameMin: Cijk_Alik_Bljk_HSS_BH_MT128x128x4_SE_PGR1_PLR0_TT8_8
    SolutionIndex: 39
    SolutionNameMin: Cijk_Alik_Bljk_HSS_BH_MT64x128x4_SE_PGR1_PLR0_TT4_8
    SolutionIndex: 40
    SolutionNameMin: Cijk_Alik_Bljk_HSS_BH_MT64x64x4_SE_PGR1_PLR0_TT4_4
    SolutionIndex: 41
    SolutionNameMin: Cijk_Alik_Bljk_HSS_BH_MT64x128x4_SE_PGR0_PLR1_TT4_8
    SolutionIndex: 42
    SolutionNameMin: Cijk_Alik_Bljk_HSS_BH_MT64x64x4_SE_PGR0_PLR1_TT4_4
    SolutionIndex: 43
    SolutionNameMin: Cijk_Alik_Bljk_HSS_BH_MT64x64x4_SE_PGR1_PLR1_TT4_4
    SolutionIndex: 44
    SolutionNameMin: Cijk_Alik_Bljk_HSS_BH_MT64x128x8_SE_PGR0_PLR0_TT4_8
    SolutionIndex: 45
    SolutionNameMin: Cijk_Alik_Bljk_HSS_BH_MT64x64x8_SE_PGR1_PLR0_TT4_4
    SolutionIndex: 46
    SolutionNameMin: Cijk_Alik_Bljk_HSS_BH_MT64x128x8_SE_PGR0_PLR1_TT4_8
    SolutionIndex: 47
    SolutionNameMin: Cijk_Alik_Bljk_HSS_BH_MT64x64x8_SE_PGR0_PLR1_TT4_4
    SolutionIndex: 48
    SolutionNameMin: Cijk_Alik_Bljk_HSS_BH_MT64x64x8_SE_PGR1_PLR1_TT4_4
    SolutionIndex: 49
    SolutionNameMin: Cijk_Alik_Bljk_HSS_BH_MT64x64x16_SE_PGR0_PLR0_TT4_4
    SolutionIndex: 50
    SolutionNameMin: Cijk_Alik_Bljk_HSS_BH_MT64x128x16_SE_PGR1_PLR0_TT4_8
    SolutionIndex: 51
    SolutionNameMin: Cijk_Alik_Bljk_HSS_BH_MT64x64x16_SE_PGR0_PLR1_TT4_4
    SolutionIndex: 52
    SolutionNameMin: Cijk_Alik_Bljk_HSS_BH_MT64x64x16_SE_PGR1_PLR1_TT4_4
    SolutionIndex: 53
    SolutionNameMin: Cijk_Alik_Bljk_HSS_BH_MT128x256x64_MI32x32x8x1_SE_1LDSB1_AF0EM8_GRVW4_LBSPP128_PLR9_SU32_SUS128_SRVW4_TT2_128_WG64_4_1_WGM15
    SolutionIndex: 54
    SolutionNameMin: Cijk_Alik_Bljk_HSS_BH_MT128x256x32_MI32x32x8x1_SE_1LDSB1_AF0EM8_GRVW8_LBSPP128_PLR5_SU0_SUS128_SRVW4_TT2_128_WG64_4_1_WGM2
    SolutionIndex: 55
    SolutionNameMin: Cijk_Alik_Bljk_HSS_BH_MT128x256x32_MI32x32x8x1_SE_1LDSB1_AF0EM8_GRVW8_LBSPP128_PLR5_SU0_SUS256_SRVW4_TT2_128_WG64_4_1_WGM1
    SolutionIndex: 56
    SolutionNameMin: Cijk_Alik_Bljk_HSS_BH_MT64x128x64_MI32x32x8x1_SE_1LDSB1_AF0EM8_GRVW8_LBSPP128_PLR9_SU32_SUS256_SRVW4_TT1_64_WG64_4_1_WGM1
    SolutionIndex: 57
    SolutionNameMin: Cijk_Alik_Bljk_HSS_BH_MT32x32x64_MI16x16x16x1_SE_1LDSB0_AF0EM8_GRVW8_LBSPP128_PLR5_SU32_SUS128_SRVW4_TT1_16_WG32_8_1_WGM1
    SolutionIndex: 58
    SolutionNameMin: Cijk_Alik_Bljk_HSS_BH_MT288x128x32_MI32x32x8x1_SE_1LDSB1_AF0EM8_GRVW4_LBSPP128_PLR5_SU0_SUS256_SRVW0_TT9_32_WG32_8_1_WGM15
    SolutionIndex: 59
    SolutionNameMin: Cijk_Alik_Bljk_HSS_BH_MT128x64x64_MI32x32x8x1_SE_1LDSB1_AF0EM8_GRVW8_LBSPP128_PLR9_SU0_SUS128_SRVW4_TT2_32_WG64_4_1_WGM2
    SolutionIndex: 60
    SolutionNameMin: Cijk_Alik_Bljk_HSS_BH_MT32x32x64_MI16x16x16x1_SE_1LDSB0_AF0EM8_GRVW8_LBSPP128_PLR5_SU0_SUS256_SRVW4_TT1_16_WG32_8_1_WGM15
    SolutionIndex: 61
    SolutionNameMin: Cijk_Alik_Bljk_HSS_BH_MT256x160x64_MI32x32x8x1_SE_1LDSB1_AF0EM8_GRVW4_LBSPP128_PLR9_SU32_SUS128_SRVW4_TT2_160_WG128_2_1_WGM15
    SolutionIndex: 62
    SolutionNameMin: Cijk_Alik_Bljk_HSS_BH_MT128x160x32_MI32x32x8x1_SE_1LDSB1_AF0EM8_GRVW4_LBSPP128_PLR5_SU0_SUS128_SRVW4_TT1_160_WG128_2_1_WGM15
    SolutionIndex: 63
    SolutionNameMin: Cijk_Alik_Bljk_HSS_BH_MT160x256x32_MI32x32x8x1_SE_1LDSB1_AF0EM8_GRVW4_LBSPP128_PLR5_SU0_SUS128_SRVW0_TT5_64_WG32_8_1_WGM15
    SolutionIndex: 64
    SolutionNameMin: Cijk_Alik_Bljk_HSS_BH_MT96x128x64_MI32x32x8x1_SE_1LDSB1_AF0EM8_GRVW8_LBSPP128_PLR9_SU32_SUS256_SRVW0_TT3_32_WG32_8_1_WGM2
    SolutionIndex: 65
    SolutionNameMin: Cijk_Alik_Bljk_HSS_BH_MT32x64x64_MI16x16x16x1_SE_1LDSB1_AF0EM8_GRVW8_LBSPP128_PLR5_SU32_SUS256_SRVW4_TT1_32_WG32_8_1_WGM2
    SolutionIndex: 66
    SolutionNameMin: Cijk_Alik_Bljk_HSS_BH_MT64x64x64_MI32x32x8x1_SE_1LDSB1_AF0EM8_GRVW4_LBSPP128_PLR9_SU32_SUS256_SRVW4_TT1_32_WG64_4_1_WGM1
    SolutionIndex: 67
    SolutionNameMin: Cijk_Alik_Bljk_HSS_BH_MT64x64x64_MI32x32x8x1_SE_1LDSB1_AF0EM8_GRVW2_LBSPP128_PLR9_SU0_SUS256_SRVW4_TT1_32_WG64_4_1_WGM1
    SolutionIndex: 68
    SolutionNameMin: Cijk_Alik_Bljk_HSS_BH_MT16x16x128_MI16x16x16x1_SE_1LDSB0_AF0EM1_GRVW8_LBSPP256_PLR9_SU32_SUS256_SRVW0_TT1_16_WG16_4_1_WGM1
    SolutionIndex: 69
    SolutionNameMin: Cijk_Alik_Bljk_HSS_BH_MT64x64x64_MI32x32x8x1_SE_1LDSB1_AF0EM8_GRVW8_LBSPP128_PLR9_SU32_SUS128_SRVW4_TT1_32_WG64_4_1_WGM2
    SolutionIndex: 70
    SolutionNameMin: Cijk_Alik_Bljk_HSS_BH_MT128x128x64_MI32x32x8x1_SE_1LDSB1_AF0EM8_GRVW4_LBSPP128_PLR9_SU32_SUS256_SRVW0_TT2_64_WG64_4_1_WGM15
    SolutionIndex: 71
    SolutionNameMin: Cijk_Alik_Bljk_HSS_BH_MT144x128x64_MI16x16x16x1_SE_1LDSB1_AF0EM8_GRVW4_LBSPP128_PLR5_SU0_SUS128_SRVW0_TT9_32_WG16_16_1_WGM1
    SolutionIndex: 72
    SolutionNameMin: Cijk_Alik_Bljk_HSS_BH_MT64x128x32_MI32x32x8x1_SE_1LDSB1_AF0EM8_GRVW8_LBSPP128_PLR5_SU0_SUS128_SRVW4_TT1_64_WG64_4_1_WGM2
    SolutionIndex: 73
    SolutionNameMin: Cijk_Alik_Bljk_HSS_BH_MT16x16x128_MI16x16x16x1_SE_1LDSB1_AF0EM8_GRVW8_LBSPP256_PLR9_SU32_SUS256_SRVW0_TT1_16_WG16_4_1_WGM1
    SolutionIndex: 74
    SolutionNameMin: Cijk_Alik_Bljk_HSS_BH_MT64x32x64_MI16x16x16x1_SE_1LDSB1_AF0EM8_GRVW8_LBSPP128_PLR5_SU32_SUS128_SRVW4_TT2_16_WG32_8_1_WGM2
    SolutionIndex: 75
    SolutionNameMin: Cijk_Alik_Bljk_HSS_BH_MT128x96x64_MI32x32x8x1_SE_1LDSB1_AF0EM8_GRVW8_LBSPP128_PLR9_SU0_SUS256_SRVW4_TT1_96_WG128_2_1_WGM2
    SolutionIndex: 76
    SolutionNameMin: Cijk_Alik_Bljk_HSS_BH_MT96x128x64_MI32x32x8x1_SE_1LDSB1_AF0EM8_GRVW2_LBSPP128_PLR9_SU32_SUS128_SRVW0_TT3_32_WG32_8_1_WGM1
    SolutionIndex: 77
    SolutionNameMin: Cijk_Alik_Bljk_HSS_BH_MT128x128x64_MI32x32x8x1_SE_1LDSB1_AF0EM8_GRVW8_LBSPP128_PLR9_SU32_SUS128_SRVW4_TT2_64_WG64_4_1_WGM2
    SolutionIndex: 78
    SolutionNameMin: Cijk_Alik_Bljk_HSS_BH_MT64x32x64_MI16x16x16x1_SE_1LDSB1_AF0EM8_GRVW2_LBSPP128_PLR5_SU0_SUS128_SRVW4_TT2_16_WG32_8_1_WGM1
    SolutionIndex: 79
    SolutionNameMin: Cijk_Alik_Bljk_HSS_BH_MT32x32x64_MI16x16x16x1_SE_1LDSB0_AF0EM8_GRVW8_LBSPP128_PLR5_SU0_SUS128_SRVW4_TT1_16_WG32_8_1_WGM1
    SolutionIndex: 80
    SolutionNameMin: Cijk_Alik_Bljk_HSS_BH_MT64x128x64_MI32x32x8x1_SE_1LDSB1_AF0EM8_GRVW8_LBSPP128_PLR9_SU0_SUS256_SRVW4_TT1_64_WG64_4_1_WGM15
    SolutionIndex: 81
    SolutionNameMin: Cijk_Alik_Bljk_HSS_BH_MT128x128x64_MI32x32x8x1_SE_1LDSB1_AF0EM8_GRVW4_LBSPP128_PLR9_SU0_SUS256_SRVW4_TT2_64_WG64_4_1_WGM15
    SolutionIndex: 82
    SolutionNameMin: Cijk_Alik_Bljk_HSS_BH_MT128x160x32_MI32x32x8x1_SE_1LDSB1_AF0EM8_GRVW2_LBSPP128_PLR5_SU0_SUS256_SRVW4_TT1_160_WG128_2_1_WGM1
    SolutionIndex: 83
    SolutionNameMin: Cijk_Alik_Bljk_HSS_BH_MT64x64x64_MI32x32x8x1_SE_1LDSB1_AF0EM8_GRVW2_LBSPP128_PLR9_SU0_SUS128_SRVW4_TT1_32_WG64_4_1_WGM1
    SolutionIndex: 84
    SolutionNameMin: Cijk_Alik_Bljk_HSS_BH_MT16x16x128_MI16x16x16x1_SE_1LDSB0_AF0EM8_GRVW8_LBSPP256_PLR9_SU32_SUS256_SRVW0_TT1_16_WG16_4_1_WGM15
    SolutionIndex: 85
    SolutionNameMin: Cijk_Alik_Bljk_HSS_BH_MT64x64x64_MI32x32x8x1_SE_1LDSB1_AF0EM8_GRVW8_LBSPP128_PLR9_SU32_SUS128_SRVW4_TT1_32_WG64_4_1_WGM15
    SolutionIndex: 86
    SolutionNameMin: Cijk_Alik_Bljk_HSS_BH_MT128x160x64_MI32x32x8x1_SE_1LDSB1_AF0EM8_GRVW4_LBSPP128_PLR9_SU32_SUS128_SRVW4_TT1_160_WG128_2_1_WGM15
    SolutionIndex: 87
    SolutionNameMin: Cijk_Alik_Bljk_HSS_BH_MT128x160x64_MI32x32x8x1_SE_1LDSB1_AF0EM8_GRVW4_LBSPP128_PLR9_SU0_SUS128_SRVW4_TT1_160_WG128_2_1_WGM15
    SolutionIndex: 88
    SolutionNameMin: Cijk_Alik_Bljk_HSS_BH_MT128x160x32_MI32x32x8x1_SE_1LDSB1_AF0EM8_GRVW4_LBSPP128_PLR5_SU32_SUS128_SRVW4_TT1_160_WG128_2_1_WGM2
    SolutionIndex: 89
    SolutionNameMin: Cijk_Alik_Bljk_HSS_BH_MT64x32x64_MI16x16x16x1_SE_1LDSB1_AF0EM8_GRVW4_LBSPP128_PLR5_SU0_SUS256_SRVW4_TT2_16_WG32_8_1_WGM1
    SolutionIndex: 90
    SolutionNameMin: Cijk_Alik_Bljk_HSS_BH_MT128x96x64_MI32x32x8x1_SE_1LDSB1_AF0EM8_GRVW8_LBSPP128_PLR9_SU0_SUS128_SRVW4_TT1_96_WG128_2_1_WGM15
    SolutionIndex: 91
    SolutionNameMin: Cijk_Alik_Bljk_HSS_BH_MT160x160x64_MI16x16x16x1_SE_1LDSB1_AF0EM8_GRVW2_LBSPP128_PLR5_SU32_SUS128_SRVW0_TT5_80_WG32_8_1_WGM2
    SolutionIndex: 92
    SolutionNameMin: Cijk_Alik_Bljk_HSS_BH_MT128x160x32_MI32x32x8x1_SE_1LDSB1_AF0EM8_GRVW2_LBSPP128_PLR5_SU0_SUS128_SRVW4_TT1_160_WG128_2_1_WGM1
    SolutionIndex: 93
    SolutionNameMin: Cijk_Alik_Bljk_HSS_BH_MT128x160x32_MI32x32x8x1_SE_1LDSB1_AF0EM8_GRVW4_LBSPP128_PLR5_SU0_SUS256_SRVW4_TT1_160_WG128_2_1_WGM1
    SolutionIndex: 94
    SolutionNameMin: Cijk_Alik_Bljk_HSS_BH_MT16x16x128_MI16x16x16x1_SE_1LDSB1_AF0EM8_GRVW8_LBSPP256_PLR9_SU0_SUS256_SRVW0_TT1_16_WG16_4_1_WGM2
    SolutionIndex: 95
    SolutionNameMin: Cijk_Alik_Bljk_HSS_BH_MT64x64x64_MI32x32x8x1_SE_1LDSB0_AF0EM8_GRVW8_LBSPP128_PLR9_SU0_SUS128_SRVW4_TT1_32_WG64_4_1_WGM15
    SolutionIndex: 96
    SolutionNameMin: Cijk_Alik_Bljk_HSS_BH_MT160x160x64_MI16x16x16x1_SE_1LDSB1_AF0EM8_GRVW8_LBSPP128_PLR5_SU0_SUS256_SRVW0_TT5_80_WG32_8_1_WGM1
    SolutionIndex: 97
    SolutionNameMin: Cijk_Alik_Bljk_HSS_BH_MT160x160x64_MI16x16x16x1_SE_1LDSB1_AF0EM8_GRVW2_LBSPP128_PLR5_SU0_SUS256_SRVW0_TT5_80_WG32_8_1_WGM1
    SolutionIndex: 98
    SolutionNameMin: Cijk_Alik_Bljk_HSS_BH_MT64x64x64_MI32x32x8x1_SE_1LDSB1_AF0EM8_GRVW2_LBSPP128_PLR9_SU32_SUS128_SRVW4_TT1_32_WG64_4_1_WGM1
    SolutionIndex: 99
    SolutionNameMin: Cijk_Alik_Bljk_HSS_BH_MT16x16x128_MI16x16x16x1_SE_1LDSB1_AF0EM1_GRVW8_LBSPP256_PLR9_SU32_SUS256_SRVW0_TT1_16_WG16_4_1_WGM1
    SolutionIndex: 100
    SolutionNameMin: Cijk_Alik_Bljk_HSS_BH_MT128x256x64_MI32x32x8x1_SE_1LDSB1_AF0EM8_GRVW2_LBSPP128_PLR9_SU0_SUS128_SRVW4_TT2_128_WG64_4_1_WGM2
    SolutionIndex: 101
    SolutionNameMin: Cijk_Alik_Bljk_HSS_BH_MT128x288x64_MI32x32x8x1_SE_1LDSB1_AF0EM8_GRVW4_LBSPP128_PLR9_SU32_SUS256_SRVW4_TT1_288_WG128_2_1_WGM2
    SolutionIndex: 102
    SolutionNameMin: Cijk_Alik_Bljk_HSS_BH_MT128x96x64_MI32x32x8x1_SE_1LDSB0_AF0EM8_GRVW8_LBSPP128_PLR9_SU0_SUS256_SRVW4_TT1_96_WG128_2_1_WGM15
    SolutionIndex: 103
    SolutionNameMin: Cijk_Alik_Bljk_HSS_BH_MT288x128x64_MI32x32x8x1_SE_1LDSB1_AF0EM8_GRVW4_LBSPP128_PLR9_SU0_SUS256_SRVW0_TT9_32_WG32_8_1_WGM1
    SolutionIndex: 104
    SolutionNameMin: Cijk_Alik_Bljk_HSS_BH_MT64x128x32_MI32x32x8x1_SE_1LDSB1_AF0EM8_GRVW8_LBSPP128_PLR5_SU0_SUS128_SRVW4_TT1_64_WG64_4_1_WGM1
    SolutionIndex: 105
    SolutionNameMin: Cijk_Alik_Bljk_HSS_BH_MT32x64x64_MI16x16x16x1_SE_1LDSB0_AF0EM8_GRVW8_LBSPP128_PLR5_SU32_SUS128_SRVW4_TT1_32_WG32_8_1_WGM1
    SolutionIndex: 106
    SolutionNameMin: Cijk_Alik_Bljk_HSS_BH_MT128x96x64_MI32x32x8x1_SE_1LDSB1_AF0EM8_GRVW8_LBSPP128_PLR9_SU32_SUS128_SRVW4_TT1_96_WG128_2_1_WGM2
    SolutionIndex: 107
    SolutionNameMin: Cijk_Alik_Bljk_HSS_BH_MT128x96x64_MI32x32x8x1_SE_1LDSB0_AF0EM8_GRVW8_LBSPP128_PLR9_SU0_SUS256_SRVW4_TT1_96_WG128_2_1_WGM2
    SolutionIndex: 108
    SolutionNameMin: Cijk_Alik_Bljk_HSS_BH_MT128x144x32_MI16x16x16x1_SE_1LDSB1_AF0EM8_GRVW2_LBSPP128_PLR2_SU0_SUS128_SRVW4_TT2_144_WG64_4_1_WGM1
    SolutionIndex: 109
    SolutionNameMin: Cijk_Alik_Bljk_HSS_BH_MT128x96x64_MI32x32x8x1_SE_1LDSB1_AF0EM8_GRVW8_LBSPP128_PLR9_SU0_SUS128_SRVW4_TT1_96_WG128_2_1_WGM2
    SolutionIndex: 110
    SolutionNameMin: Cijk_Alik_Bljk_HSS_BH_MT128x96x32_MI32x32x8x1_SE_1LDSB1_AF0EM8_GRVW4_LBSPP128_PLR5_SU0_SUS128_SRVW4_TT1_96_WG128_2_1_WGM1
    SolutionIndex: 111
    SolutionNameMin: Cijk_Alik_Bljk_HSS_BH_MT128x160x32_MI32x32x8x1_SE_1LDSB1_AF0EM8_GRVW4_LBSPP128_PLR5_SU0_SUS256_SRVW4_TT1_160_WG128_2_1_WGM2
    SolutionIndex: 112
    SolutionNameMin: Cijk_Alik_Bljk_HSS_BH_MT256x160x32_MI32x32x8x1_SE_1LDSB1_AF0EM8_GRVW2_LBSPP128_PLR5_SU32_SUS256_SRVW4_TT2_160_WG128_2_1_WGM15
    SolutionIndex: 113
    SolutionNameMin: Cijk_Alik_Bljk_HSS_BH_MT256x160x64_MI32x32x8x1_SE_1LDSB1_AF0EM8_GRVW2_LBSPP128_PLR9_SU0_SUS128_SRVW4_TT2_160_WG128_2_1_WGM1
    SolutionIndex: 114
    SolutionNameMin: Cijk_Alik_Bljk_HSS_BH_MT64x4x64_MI4x4x4x16_SE_1LDSB1_AF0EM8_GRVW8_LBSPP128_PLR17_SU32_SUS256_SRVW4_TT1_4_WG64_1_1_WGM1
    SolutionIndex: 115
    SolutionNameMin: Cijk_Alik_Bljk_HSS_BH_MT64x32x64_MI16x16x16x1_SE_1LDSB1_AF0EM8_GRVW8_LBSPP128_PLR5_SU0_SUS256_SRVW4_TT2_16_WG32_8_1_WGM1
    SolutionIndex: 116
    SolutionNameMin: Cijk_Alik_Bljk_HSS_BH_MT128x288x64_MI32x32x8x1_SE_1LDSB1_AF0EM8_GRVW8_LBSPP128_PLR9_SU32_SUS128_SRVW4_TT1_288_WG128_2_1_WGM1
    SolutionIndex: 117
    SolutionNameMin: Cijk_Alik_Bljk_HSS_BH_MT256x160x64_MI32x32x8x1_SE_1LDSB1_AF0EM8_GRVW2_LBSPP128_PLR9_SU32_SUS256_SRVW4_TT2_160_WG128_2_1_WGM2
    SolutionIndex: 118
    SolutionNameMin: Cijk_Alik_Bljk_HSS_BH_MT128x160x64_MI32x32x8x1_SE_1LDSB1_AF0EM8_GRVW4_LBSPP128_PLR9_SU32_SUS256_SRVW4_TT1_160_WG128_2_1_WGM2
    SolutionIndex: 119
    SolutionNameMin: Cijk_Alik_Bljk_HSS_BH_MT256x160x64_MI32x32x8x1_SE_1LDSB1_AF0EM8_GRVW2_LBSPP128_PLR9_SU32_SUS128_SRVW4_TT2_160_WG128_2_1_WGM15
    SolutionIndex: 120
    SolutionNameMin: Cijk_Alik_Bljk_HSS_BH_MT64x64x64_MI32x32x8x1_SE_1LDSB1_AF0EM8_GRVW8_LBSPP128_PLR9_SU32_SUS128_SRVW4_TT1_32_WG64_4_1_WGM1
    SolutionIndex: 121
    SolutionNameMin: Cijk_Alik_Bljk_HSS_BH_MT128x160x32_MI32x32x8x1_SE_1LDSB1_AF0EM8_GRVW4_LBSPP128_PLR5_SU0_SUS256_SRVW4_TT1_160_WG128_2_1_WGM15
    SolutionIndex: 122
    SolutionNameMin: Cijk_Alik_Bljk_HSS_BH_MT128x288x64_MI32x32x8x1_SE_1LDSB1_AF0EM8_GRVW4_LBSPP128_PLR9_SU32_SUS128_SRVW4_TT1_288_WG128_2_1_WGM1
    SolutionIndex: 123
    SolutionNameMin: Cijk_Alik_Bljk_HSS_BH_MT256x160x64_MI32x32x8x1_SE_1LDSB1_AF0EM8_GRVW2_LBSPP128_PLR9_SU0_SUS256_SRVW4_TT2_160_WG128_2_1_WGM1
    SolutionIndex: 124
    SolutionNameMin: Cijk_Alik_Bljk_HSS_BH_MT256x160x64_MI32x32x8x1_SE_1LDSB1_AF0EM8_GRVW2_LBSPP128_PLR9_SU0_SUS128_SRVW4_TT2_160_WG128_2_1_WGM2
    SolutionIndex: 125
    SolutionNameMin: Cijk_Alik_Bljk_HSS_BH_MT256x160x64_MI32x32x8x1_SE_1LDSB1_AF0EM8_GRVW2_LBSPP128_PLR9_SU32_SUS128_SRVW4_TT2_160_WG128_2_1_WGM1
    SolutionIndex: 126
    SolutionNameMin: Cijk_Alik_Bljk_HSS_BH_MT128x96x64_MI32x32x8x1_SE_1LDSB1_AF0EM8_GRVW8_LBSPP128_PLR9_SU0_SUS256_SRVW4_TT1_96_WG128_2_1_WGM15
    SolutionIndex: 127
    SolutionNameMin: Cijk_Alik_Bljk_HSS_BH_MT128x256x64_MI32x32x8x1_SE_1LDSB1_AF0EM8_GRVW2_LBSPP128_PLR9_SU0_SUS128_SRVW4_TT2_128_WG64_4_1_WGM1
    SolutionIndex: 128
    SolutionNameMin: Cijk_Alik_Bljk_HSS_BH_MT128x256x64_MI32x32x8x1_SE_1LDSB1_AF0EM8_GRVW2_LBSPP128_PLR9_SU0_SUS256_SRVW4_TT2_128_WG64_4_1_WGM2
    SolutionIndex: 129
    SolutionNameMin: Cijk_Alik_Bljk_HSS_BH_MT128x288x64_MI32x32x8x1_SE_1LDSB1_AF0EM8_GRVW4_LBSPP128_PLR9_SU32_SUS128_SRVW4_TT1_288_WG128_2_1_WGM2
    SolutionIndex: 130
    SolutionNameMin: Cijk_Alik_Bljk_HSS_BH_MT128x160x64_MI32x32x8x1_SE_1LDSB1_AF0EM8_GRVW8_LBSPP128_PLR9_SU0_SUS256_SRVW4_TT1_160_WG128_2_1_WGM15
    SolutionIndex: 131
    SolutionNameMin: Cijk_Alik_Bljk_HSS_BH_MT128x256x64_MI32x32x8x1_SE_1LDSB1_AF0EM8_GRVW2_LBSPP128_PLR9_SU0_SUS256_SRVW4_TT2_128_WG64_4_1_WGM15
    SolutionIndex: 132
    SolutionNameMin: Cijk_Alik_Bljk_HSS_BH_MT128x160x64_MI32x32x8x1_SE_1LDSB1_AF0EM8_GRVW4_LBSPP128_PLR9_SU0_SUS256_SRVW4_TT1_160_WG128_2_1_WGM15
    SolutionIndex: 133
    SolutionNameMin: Cijk_Alik_Bljk_HSS_BH_MT128x288x64_MI32x32x8x1_SE_1LDSB1_AF0EM8_GRVW4_LBSPP128_PLR9_SU32_SUS128_SRVW4_TT1_288_WG128_2_1_WGM15
    SolutionIndex: 134
    SolutionNameMin: Cijk_Alik_Bljk_HSS_BH_MT256x160x64_MI32x32x8x1_SE_1LDSB1_AF0EM8_GRVW2_LBSPP128_PLR9_SU0_SUS256_SRVW4_TT2_160_WG128_2_1_WGM15
    SolutionIndex: 135
    SolutionNameMin: Cijk_Alik_Bljk_HSS_BH_MT256x160x64_MI32x32x8x1_SE_1LDSB1_AF0EM8_GRVW2_LBSPP128_PLR9_SU0_SUS128_SRVW4_TT2_160_WG128_2_1_WGM15
    SolutionIndex: 136
    SolutionNameMin: Cijk_Alik_Bljk_HSS_BH_MT256x160x64_MI32x32x8x1_SE_1LDSB1_AF0EM8_GRVW2_LBSPP128_PLR9_SU0_SUS256_SRVW4_TT2_160_WG128_2_1_WGM2
    SolutionIndex: 137
    SolutionNameMin: Cijk_Alik_Bljk_HSS_BH_MT128x256x64_MI32x32x8x1_SE_1LDSB1_AF0EM8_GRVW4_LBSPP128_PLR9_SU32_SUS256_SRVW4_TT2_128_WG64_4_1_WGM2
    SolutionIndex: 138
    SolutionNameMin: Cijk_Alik_Bljk_HSS_BH_MT128x160x32_MI32x32x8x1_SE_1LDSB1_AF0EM8_GRVW4_LBSPP128_PLR5_SU0_SUS128_SRVW4_TT1_160_WG128_2_1_WGM1
    SolutionIndex: 139
    SolutionNameMin: Cijk_Alik_Bljk_HSS_BH_MT256x160x64_MI32x32x8x1_SE_1LDSB1_AF0EM8_GRVW2_LBSPP128_PLR9_SU32_SUS128_SRVW4_TT2_160_WG128_2_1_WGM2
    SolutionIndex: 140
    SolutionNameMin: Cijk_Alik_Bljk_HSS_BH_MT32x32x32_MI16x16x16x1_SE_1LDSB1_AF0EM8_GRVW4_LBSPP128_PLR2_SU0_SUS128_SRVW4_TT1_16_WG32_8_1_WGM1
    SolutionIndex: 141
    SolutionNameMin: Cijk_Alik_Bljk_HSS_BH_MT64x32x32_MI16x16x16x1_SE_1LDSB1_AF0EM8_GRVW4_LBSPP128_PLR2_SU0_SUS128_SRVW4_TT2_16_WG32_8_1_WGM1
    SolutionIndex: 142
    SolutionNameMin: Cijk_Alik_Bljk_HSS_BH_MT32x64x32_MI16x16x16x1_SE_1LDSB1_AF0EM8_GRVW2_LBSPP128_PLR2_SU0_SUS256_SRVW4_TT1_32_WG32_8_1_WGM1
    SolutionIndex: 143
    SolutionNameMin: Cijk_Alik_Bljk_HSS_BH_MT32x64x64_MI16x16x16x1_SE_1LDSB0_AF0EM8_GRVW8_LBSPP128_PLR5_SU32_SUS256_SRVW4_TT1_32_WG32_8_1_WGM1
    SolutionIndex: 144
    SolutionNameMin: Cijk_Alik_Bljk_HSS_BH_MT32x32x64_MI16x16x16x1_SE_1LDSB0_AF0EM8_GRVW4_LBSPP128_PLR5_SU0_SUS128_SRVW4_TT1_16_WG32_8_1_WGM1
    SolutionIndex: 145
    SolutionNameMin: Cijk_Alik_Bljk_HSS_BH_MT128x96x64_MI32x32x8x1_SE_1LDSB1_AF0EM8_GRVW4_LBSPP128_PLR9_SU32_SUS256_SRVW4_TT1_96_WG128_2_1_WGM15
    SolutionIndex: 146
    SolutionNameMin: Cijk_Alik_Bljk_HSS_BH_MT64x128x64_MI32x32x8x1_SE_1LDSB1_AF0EM8_GRVW8_LBSPP128_PLR9_SU32_SUS128_SRVW4_TT1_64_WG64_4_1_WGM2
    SolutionIndex: 147
    SolutionNameMin: Cijk_Alik_Bljk_HSS_BH_MT32x64x32_MI16x16x16x1_SE_1LDSB1_AF0EM8_GRVW2_LBSPP128_PLR2_SU0_SUS256_SRVW4_TT1_32_WG32_8_1_WGM15
    SolutionIndex: 148
    SolutionNameMin: Cijk_Alik_Bljk_HSS_BH_MT32x32x64_MI16x16x16x1_SE_1LDSB0_AF0EM8_GRVW8_LBSPP128_PLR5_SU0_SUS128_SRVW0_TT1_16_WG32_8_1_WGM1
    SolutionIndex: 149
    SolutionNameMin: Cijk_Alik_Bljk_HSS_BH_MT128x128x32_MI32x32x8x1_SE_1LDSB1_AF0EM8_GRVW8_LBSPP128_PLR5_SU0_SUS128_SRVW4_TT2_64_WG64_4_1_WGM2
    SolutionIndex: 150
    SolutionNameMin: Cijk_Alik_Bljk_HSS_BH_MT16x16x128_MI16x16x16x1_SE_1LDSB0_AF0EM8_GRVW8_LBSPP256_PLR9_SU32_SUS256_SRVW0_TT1_16_WG16_4_1_WGM1
    SolutionIndex: 151
    SolutionNameMin: Cijk_Alik_Bljk_HSS_BH_MT64x128x64_MI32x32x8x1_SE_1LDSB1_AF0EM8_GRVW8_LBSPP128_PLR9_SU0_SUS128_SRVW4_TT1_64_WG64_4_1_WGM15
    SolutionIndex: 152
    SolutionNameMin: Cijk_Alik_Bljk_HSS_BH_MT128x128x64_MI32x32x8x1_SE_1LDSB1_AF0EM8_GRVW8_LBSPP128_PLR9_SU0_SUS256_SRVW4_TT2_64_WG64_4_1_WGM15
    SolutionIndex: 153
    SolutionNameMin: Cijk_Alik_Bljk_HSS_BH_MT32x32x64_MI16x16x16x1_SE_1LDSB0_AF0EM8_GRVW8_LBSPP128_PLR5_SU0_SUS128_SRVW4_TT1_16_WG32_8_1_WGM15
    SolutionIndex: 154
    SolutionNameMin: Cijk_Alik_Bljk_HSS_BH_MT16x16x128_MI16x16x16x1_SE_1LDSB0_AF0EM8_GRVW8_LBSPP256_PLR9_SU0_SUS256_SRVW0_TT1_16_WG16_4_1_WGM2
    SolutionIndex: 155
    SolutionNameMin: Cijk_Alik_Bljk_HSS_BH_MT32x64x64_MI16x16x16x1_SE_1LDSB1_AF0EM8_GRVW4_LBSPP128_PLR5_SU0_SUS256_SRVW4_TT1_32_WG32_8_1_WGM15
    SolutionIndex: 156
    SolutionNameMin: Cijk_Alik_Bljk_HSS_BH_MT64x64x64_MI32x32x8x1_SE_1LDSB0_AF0EM8_GRVW8_LBSPP128_PLR9_SU0_SUS256_SRVW4_TT1_32_WG64_4_1_WGM15
    SolutionIndex: 157
    SolutionNameMin: Cijk_Alik_Bljk_HSS_BH_MT64x64x64_MI32x32x8x1_SE_1LDSB1_AF0EM8_GRVW4_LBSPP128_PLR9_SU0_SUS128_SRVW4_TT1_32_WG64_4_1_WGM15
    SolutionIndex: 158
    SolutionNameMin: Cijk_Alik_Bljk_HSS_BH_MT96x96x64_MI16x16x16x1_SE_1LDSB0_AF0EM8_GRVW8_LBSPP128_PLR5_SU0_SUS128_SRVW0_TT3_48_WG32_8_1_WGM2
    SolutionIndex: 159
    SolutionNameMin: Cijk_Alik_Bljk_HSS_BH_MT64x128x64_MI32x32x8x1_SE_1LDSB0_AF0EM8_GRVW8_LBSPP128_PLR9_SU0_SUS128_SRVW4_TT1_64_WG64_4_1_WGM15
    SolutionIndex: 160
    SolutionNameMin: Cijk_Alik_Bljk_HSS_BH_MT128x96x64_MI32x32x8x1_SE_1LDSB1_AF0EM8_GRVW8_LBSPP128_PLR9_SU32_SUS128_SRVW4_TT1_96_WG128_2_1_WGM15
    SolutionIndex: 161
    SolutionNameMin: Cijk_Alik_Bljk_HSS_BH_MT128x96x64_MI32x32x8x1_SE_1LDSB1_AF0EM8_GRVW8_LBSPP128_PLR9_SU32_SUS256_SRVW4_TT1_96_WG128_2_1_WGM2
    SolutionIndex: 162
    SolutionNameMin: Cijk_Alik_Bljk_HSS_BH_MT128x128x64_MI32x32x8x1_SE_1LDSB1_AF0EM8_GRVW8_LBSPP128_PLR9_SU32_SUS128_SRVW4_TT2_64_WG64_4_1_WGM15
    SolutionIndex: 163
    SolutionNameMin: Cijk_Alik_Bljk_HSS_BH_MT128x160x64_MI32x32x8x1_SE_1LDSB1_AF0EM8_GRVW8_LBSPP128_PLR9_SU0_SUS128_SRVW4_TT1_160_WG128_2_1_WGM1
    SolutionIndex: 164
    SolutionNameMin: Cijk_Alik_Bljk_HSS_BH_MT128x160x64_MI32x32x8x1_SE_1LDSB1_AF0EM8_GRVW8_LBSPP128_PLR9_SU0_SUS256_SRVW4_TT1_160_WG128_2_1_WGM2
    SolutionIndex: 165
    SolutionNameMin: Cijk_Alik_Bljk_HSS_BH_MT128x160x64_MI32x32x8x1_SE_1LDSB1_AF0EM8_GRVW8_LBSPP128_PLR9_SU0_SUS128_SRVW4_TT1_160_WG128_2_1_WGM2
    SolutionIndex: 166
    SolutionNameMin: Cijk_Alik_Bljk_HSS_BH_MT128x96x64_MI32x32x8x1_SE_1LDSB1_AF0EM8_GRVW2_LBSPP128_PLR9_SU0_SUS256_SRVW4_TT1_96_WG128_2_1_WGM15
    SolutionIndex: 167
    SolutionNameMin: Cijk_Alik_Bljk_HSS_BH_MT128x96x32_MI32x32x8x1_SE_1LDSB1_AF0EM8_GRVW4_LBSPP128_PLR5_SU0_SUS128_SRVW4_TT1_96_WG128_2_1_WGM2
    SolutionIndex: 168
    SolutionNameMin: Cijk_Alik_Bljk_HSS_BH_MT128x96x32_MI32x32x8x1_SE_1LDSB0_AF0EM8_GRVW2_LBSPP128_PLR5_SU0_SUS128_SRVW4_TT1_96_WG128_2_1_WGM2
    SolutionIndex: 169
    SolutionNameMin: Cijk_Alik_Bljk_HSS_BH_MT128x256x64_MI32x32x8x1_SE_1LDSB1_AF0EM8_GRVW4_LBSPP128_PLR9_SU32_SUS128_SRVW4_TT2_128_WG64_4_1_WGM1
    SolutionIndex: 170
    SolutionNameMin: Cijk_Alik_Bljk_HSS_BH_MT128x256x64_MI32x32x8x1_SE_1LDSB1_AF0EM8_GRVW8_LBSPP128_PLR9_SU32_SUS128_SRVW4_TT2_128_WG64_4_1_WGM1
    SolutionIndex: 171
    SolutionNameMin: Cijk_Alik_Bljk_HSS_BH_MT128x96x64_MI32x32x8x1_SE_1LDSB1_AF0EM8_GRVW4_LBSPP128_PLR9_SU0_SUS256_SRVW4_TT1_96_WG128_2_1_WGM2
    SolutionIndex: 172
    SolutionNameMin: Cijk_Alik_Bljk_HSS_BH_MT128x96x64_MI32x32x8x1_SE_1LDSB1_AF0EM8_GRVW4_LBSPP128_PLR9_SU0_SUS128_SRVW4_TT1_96_WG128_2_1_WGM2
    SolutionIndex: 173
    SolutionNameMin: Cijk_Alik_Bljk_HSS_BH_MT16x16x128_MI16x16x16x1_SE_1LDSB1_AF0EM8_GRVW8_LBSPP256_PLR9_SU0_SUS256_SRVW0_TT1_16_WG16_4_1_WGM15
    SolutionIndex: 174
    SolutionNameMin: Cijk_Alik_Bljk_HSS_BH_MT32x32x64_MI16x16x16x1_SE_1LDSB0_AF0EM8_GRVW2_LBSPP128_PLR5_SU0_SUS128_SRVW4_TT1_16_WG32_8_1_WGM15
    SolutionIndex: 175
    SolutionNameMin: Cijk_Alik_Bljk_HSS_BH_MT128x160x32_MI32x32x8x1_SE_1LDSB1_AF0EM8_GRVW4_LBSPP128_PLR5_SU32_SUS256_SRVW4_TT1_160_WG128_2_1_WGM2
    SolutionIndex: 176
    SolutionNameMin: Cijk_Alik_Bljk_HSS_BH_MT128x96x64_MI32x32x8x1_SE_1LDSB1_AF0EM8_GRVW8_LBSPP128_PLR9_SU32_SUS128_SRVW4_TT1_96_WG128_2_1_WGM1
    SolutionIndex: 177
    SolutionNameMin: Cijk_Alik_Bljk_HSS_BH_MT32x64x64_MI16x16x16x1_SE_1LDSB1_AF0EM8_GRVW8_LBSPP128_PLR5_SU32_SUS256_SRVW4_TT1_32_WG32_8_1_WGM1
    SolutionIndex: 178
    SolutionNameMin: Cijk_Alik_Bljk_HSS_BH_MT32x64x64_MI16x16x16x1_SE_1LDSB1_AF0EM8_GRVW8_LBSPP128_PLR5_SU32_SUS128_SRVW4_TT1_32_WG32_8_1_WGM1
    SolutionIndex: 179
    SolutionNameMin: Cijk_Alik_Bljk_HSS_BH_MT64x64x64_MI32x32x8x1_SE_1LDSB1_AF0EM8_GRVW8_LBSPP128_PLR9_SU0_SUS128_SRVW4_TT1_32_WG64_4_1_WGM15
    SolutionIndex: 180
    SolutionNameMin: Cijk_Alik_Bljk_HSS_BH_MT64x64x64_MI32x32x8x1_SE_1LDSB1_AF0EM8_GRVW8_LBSPP128_PLR9_SU0_SUS128_SRVW4_TT1_32_WG64_4_1_WGM2
    SolutionIndex: 181
    SolutionNameMin: Cijk_Alik_Bljk_HSS_BH_MT64x64x64_MI32x32x8x1_SE_1LDSB1_AF0EM8_GRVW8_LBSPP128_PLR9_SU0_SUS256_SRVW4_TT1_32_WG64_4_1_WGM15
    SolutionIndex: 182
    SolutionNameMin: Cijk_Alik_Bljk_HSS_BH_MT64x64x32_MI32x32x8x1_SE_1LDSB1_AF0EM8_GRVW4_LBSPP128_PLR5_SU0_SUS256_SRVW4_TT1_32_WG64_4_1_WGM15
    SolutionIndex: 183
    SolutionNameMin: Cijk_Alik_Bljk_HSS_BH_MT64x64x32_MI32x32x8x1_SE_1LDSB1_AF0EM8_GRVW4_LBSPP128_PLR5_SU0_SUS128_SRVW4_TT1_32_WG64_4_1_WGM15
    SolutionIndex: 184
    SolutionNameMin: Cijk_Alik_Bljk_HSS_BH_MT96x96x64_MI16x16x16x1_SE_1LDSB1_AF0EM8_GRVW8_LBSPP128_PLR5_SU32_SUS256_SRVW0_TT3_48_WG32_8_1_WGM2
    SolutionIndex: 185
    SolutionNameMin: Cijk_Alik_Bljk_HSS_BH_MT96x96x32_MI16x16x16x1_SE_1LDSB0_AF0EM8_GRVW4_LBSPP128_PLR2_SU0_SUS128_SRVW0_TT3_48_WG32_8_1_WGM1
    SolutionIndex: 186
    SolutionNameMin: Cijk_Alik_Bljk_HSS_BH_MT128x256x32_MI32x32x8x1_SE_1LDSB1_AF0EM8_GRVW8_LBSPP128_PLR5_SU32_SUS128_SRVW4_TT2_128_WG64_4_1_WGM15
    SolutionIndex: 187
    SolutionNameMin: Cijk_Alik_Bljk_HSS_BH_MT128x160x32_MI32x32x8x1_SE_1LDSB1_AF0EM8_GRVW4_LBSPP128_PLR5_SU32_SUS128_SRVW4_TT1_160_WG128_2_1_WGM15
    SolutionIndex: 188
    SolutionNameMin: Cijk_Alik_Bljk_HSS_BH_MT16x16x128_MI16x16x16x1_SE_1LDSB0_AF0EM1_GRVW8_LBSPP256_PLR9_SU0_SUS256_SRVW0_TT1_16_WG16_4_1_WGM1
    SolutionIndex: 189
    SolutionNameMin: Cijk_Alik_Bljk_HSS_BH_MT144x256x64_MI16x16x16x1_SE_1LDSB1_AF0EM8_GRVW2_LBSPP128_PLR5_SU32_SUS256_SRVW0_TT9_64_WG16_16_1_WGM1
    SolutionIndex: 190
    SolutionNameMin: Cijk_Alik_Bljk_HSS_BH_MT64x128x64_MI32x32x8x1_SE_1LDSB1_AF0EM8_GRVW8_LBSPP128_PLR9_SU0_SUS128_SRVW4_TT1_64_WG64_4_1_WGM2
    SolutionIndex: 191
    SolutionNameMin: Cijk_Alik_Bljk_HSS_BH_MT128x96x64_MI32x32x8x1_SE_1LDSB1_AF0EM8_GRVW4_LBSPP128_PLR9_SU32_SUS256_SRVW4_TT1_96_WG128_2_1_WGM2
    SolutionIndex: 192
    SolutionNameMin: Cijk_Alik_Bljk_HSS_BH_MT128x288x64_MI32x32x8x1_SE_1LDSB1_AF0EM8_GRVW4_LBSPP128_PLR9_SU0_SUS256_SRVW4_TT1_288_WG128_2_1_WGM15
    SolutionIndex: 193
    SolutionNameMin: Cijk_Alik_Bljk_HSS_BH_MT64x64x64_MI32x32x8x1_SE_1LDSB1_AF0EM8_GRVW8_LBSPP128_PLR9_SU0_SUS256_SRVW4_TT1_32_WG64_4_1_WGM2
    SolutionIndex: 194
    SolutionNameMin: Cijk_Alik_Bljk_HSS_BH_MT128x128x64_MI32x32x8x1_SE_1LDSB1_AF0EM8_GRVW8_LBSPP128_PLR9_SU32_SUS128_SRVW4_TT2_64_WG64_4_1_WGM1
    SolutionIndex: 195
    SolutionNameMin: Cijk_Alik_Bljk_HSS_BH_MT128x96x64_MI32x32x8x1_SE_1LDSB1_AF0EM8_GRVW8_LBSPP128_PLR9_SU32_SUS256_SRVW4_TT1_96_WG128_2_1_WGM15
    SolutionIndex: 196
    SolutionNameMin: Cijk_Alik_Bljk_HSS_BH_MT16x16x128_MI16x16x16x1_SE_1LDSB0_AF0EM8_GRVW8_LBSPP256_PLR9_SU0_SUS256_SRVW0_TT1_16_WG16_4_1_WGM15
    SolutionIndex: 197
    SolutionNameMin: Cijk_Alik_Bljk_HSS_BH_MT64x64x64_MI32x32x8x1_SE_1LDSB1_AF0EM8_GRVW8_LBSPP128_PLR9_SU0_SUS256_SRVW4_TT1_32_WG64_4_1_WGM1
    SolutionIndex: 198
    SolutionNameMin: Cijk_Alik_Bljk_HSS_BH_MT128x160x64_MI32x32x8x1_SE_1LDSB1_AF0EM8_GRVW4_LBSPP128_PLR9_SU32_SUS128_SRVW4_TT1_160_WG128_2_1_WGM2
    SolutionIndex: 199
    SolutionNameMin: Cijk_Alik_Bljk_HSS_BH_MT128x96x32_MI32x32x8x1_SE_1LDSB1_AF0EM8_GRVW2_LBSPP128_PLR5_SU0_SUS256_SRVW4_TT1_96_WG128_2_1_WGM1
    SolutionIndex: 200
    SolutionNameMin: Cijk_Alik_Bljk_HSS_BH_MT96x128x64_MI32x32x8x1_SE_1LDSB1_AF0EM8_GRVW8_LBSPP128_PLR9_SU0_SUS128_SRVW0_TT3_32_WG32_8_1_WGM1
    SolutionIndex: 201
    SolutionNameMin: Cijk_Alik_Bljk_HSS_BH_MT96x128x64_MI32x32x8x1_SE_1LDSB1_AF0EM8_GRVW4_LBSPP128_PLR9_SU0_SUS256_SRVW0_TT3_32_WG32_8_1_WGM2
    SolutionIndex: 202
    SolutionNameMin: Cijk_Alik_Bljk_HSS_BH_MT128x96x64_MI32x32x8x1_SE_1LDSB1_AF0EM8_GRVW2_LBSPP128_PLR9_SU0_SUS128_SRVW4_TT1_96_WG128_2_1_WGM1
    SolutionIndex: 203
    SolutionNameMin: Cijk_Alik_Bljk_HSS_BH_MT64x256x64_MI32x32x8x1_SE_1LDSB1_AF0EM8_GRVW4_LBSPP128_PLR9_SU0_SUS128_SRVW4_TT1_128_WG64_4_1_WGM2
    SolutionIndex: 204
    SolutionNameMin: Cijk_Alik_Bljk_HSS_BH_MT128x96x64_MI32x32x8x1_SE_1LDSB1_AF0EM8_GRVW2_LBSPP128_PLR9_SU0_SUS256_SRVW4_TT1_96_WG128_2_1_WGM2
    SolutionIndex: 205
    SolutionNameMin: Cijk_Alik_Bljk_HSS_BH_MT64x64x64_MI32x32x8x1_SE_1LDSB1_AF0EM8_GRVW8_LBSPP128_PLR9_SU32_SUS256_SRVW4_TT1_32_WG64_4_1_WGM1
    SolutionIndex: 206
    SolutionNameMin: Cijk_Alik_Bljk_HSS_BH_MT128x96x64_MI32x32x8x1_SE_1LDSB1_AF0EM8_GRVW2_LBSPP128_PLR9_SU32_SUS128_SRVW4_TT1_96_WG128_2_1_WGM2
    SolutionIndex: 207
    SolutionNameMin: Cijk_Alik_Bljk_HSS_BH_MT64x128x64_MI32x32x8x1_SE_1LDSB1_AF0EM8_GRVW8_LBSPP128_PLR9_SU0_SUS128_SRVW4_TT1_64_WG64_4_1_WGM1
    SolutionIndex: 208
    SolutionNameMin: Cijk_Alik_Bljk_HSS_BH_MT128x96x64_MI32x32x8x1_SE_1LDSB1_AF0EM8_GRVW2_LBSPP128_PLR9_SU32_SUS128_SRVW4_TT1_96_WG128_2_1_WGM1
    SolutionIndex: 209
    SolutionNameMin: Cijk_Alik_Bljk_HSS_BH_MT64x128x64_MI32x32x8x1_SE_1LDSB1_AF0EM8_GRVW8_LBSPP128_PLR9_SU32_SUS256_SRVW4_TT1_64_WG64_4_1_WGM2
    SolutionIndex: 210
    SolutionNameMin: Cijk_Alik_Bljk_HSS_BH_MT32x32x64_MI16x16x16x1_SE_1LDSB0_AF0EM8_GRVW2_LBSPP128_PLR5_SU0_SUS256_SRVW4_TT1_16_WG32_8_1_WGM2
    SolutionIndex: 211
    SolutionNameMin: Cijk_Alik_Bljk_HSS_BH_MT64x32x64_MI16x16x16x1_SE_1LDSB1_AF0EM8_GRVW4_LBSPP128_PLR5_SU0_SUS128_SRVW4_TT2_16_WG32_8_1_WGM1
    SolutionIndex: 212
    SolutionNameMin: Cijk_Alik_Bljk_HSS_BH_MT128x96x32_MI32x32x8x1_SE_1LDSB0_AF0EM8_GRVW4_LBSPP128_PLR5_SU32_SUS128_SRVW4_TT1_96_WG128_2_1_WGM1
    SolutionIndex: 213
    SolutionNameMin: Cijk_Alik_Bljk_HSS_BH_MT64x128x32_MI32x32x8x1_SE_1LDSB1_AF0EM8_GRVW8_LBSPP128_PLR5_SU32_SUS256_SRVW4_TT1_64_WG64_4_1_WGM15
    SolutionIndex: 214
    SolutionNameMin: Cijk_Alik_Bljk_HSS_BH_MT128x160x32_MI32x32x8x1_SE_1LDSB1_AF0EM8_GRVW2_LBSPP128_PLR5_SU0_SUS128_SRVW4_TT1_160_WG128_2_1_WGM15
    SolutionIndex: 215
    SolutionNameMin: Cijk_Alik_Bljk_HSS_BH_MT128x160x32_MI32x32x8x1_SE_1LDSB1_AF0EM8_GRVW2_LBSPP128_PLR5_SU32_SUS256_SRVW4_TT1_160_WG128_2_1_WGM15
    SolutionIndex: 216
    SolutionNameMin: Cijk_Alik_Bljk_HSS_BH_MT64x64x32_MI32x32x8x1_SE_1LDSB1_AF0EM8_GRVW2_LBSPP128_PLR5_SU32_SUS256_SRVW4_TT1_32_WG64_4_1_WGM15
    SolutionIndex: 217
    SolutionNameMin: Cijk_Alik_Bljk_HSS_BH_MT64x64x64_MI32x32x8x1_SE_1LDSB0_AF0EM8_GRVW8_LBSPP128_PLR9_SU0_SUS128_SRVW4_TT1_32_WG64_4_1_WGM2
    SolutionIndex: 218
    SolutionNameMin: Cijk_Alik_Bljk_HSS_BH_MT128x96x64_MI32x32x8x1_SE_1LDSB1_AF0EM8_GRVW4_LBSPP128_PLR9_SU0_SUS128_SRVW4_TT1_96_WG128_2_1_WGM1
    SolutionIndex: 219
    SolutionNameMin: Cijk_Alik_Bljk_HSS_BH_MT32x32x64_MI16x16x16x1_SE_1LDSB0_AF0EM8_GRVW8_LBSPP128_PLR5_SU0_SUS128_SRVW4_TT1_16_WG32_8_1_WGM2
    SolutionIndex: 220
    SolutionNameMin: Cijk_Alik_Bljk_HSS_BH_MT64x128x64_MI32x32x8x1_SE_1LDSB0_AF0EM8_GRVW8_LBSPP128_PLR9_SU0_SUS256_SRVW4_TT1_64_WG64_4_1_WGM15
    SolutionIndex: 221
    SolutionNameMin: Cijk_Alik_Bljk_HSS_BH_MT128x128x64_MI32x32x8x1_SE_1LDSB1_AF0EM8_GRVW8_LBSPP128_PLR9_SU0_SUS128_SRVW4_TT2_64_WG64_4_1_WGM15
    SolutionIndex: 222
    SolutionNameMin: Cijk_Alik_Bljk_HSS_BH_MT64x128x32_MI32x32x8x1_SE_1LDSB1_AF0EM8_GRVW8_LBSPP128_PLR5_SU32_SUS256_SRVW4_TT1_64_WG64_4_1_WGM1
    SolutionIndex: 223
    SolutionNameMin: Cijk_Alik_Bljk_HSS_BH_MT128x160x64_MI32x32x8x1_SE_1LDSB1_AF0EM8_GRVW8_LBSPP128_PLR9_SU32_SUS128_SRVW4_TT1_160_WG128_2_1_WGM15
    SolutionIndex: 224
    SolutionNameMin: Cijk_Alik_Bljk_HSS_BH_MT128x96x32_MI32x32x8x1_SE_1LDSB1_AF0EM8_GRVW4_LBSPP128_PLR5_SU0_SUS256_SRVW4_TT1_96_WG128_2_1_WGM15
    SolutionIndex: 225
    SolutionNameMin: Cijk_Alik_Bljk_HSS_BH_MT128x96x32_MI32x32x8x1_SE_1LDSB1_AF0EM8_GRVW4_LBSPP128_PLR5_SU32_SUS128_SRVW4_TT1_96_WG128_2_1_WGM2
    SolutionIndex: 226
    SolutionNameMin: Cijk_Alik_Bljk_HSS_BH_MT64x64x64_MI32x32x8x1_SE_1LDSB0_AF0EM8_GRVW8_LBSPP128_PLR9_SU32_SUS256_SRVW4_TT1_32_WG64_4_1_WGM15
    SolutionIndex: 227
    SolutionNameMin: Cijk_Alik_Bljk_HSS_BH_MT32x64x32_MI16x16x16x1_SE_1LDSB0_AF0EM8_GRVW8_LBSPP128_PLR2_SU0_SUS128_SRVW4_TT1_32_WG32_8_1_WGM2
    SolutionIndex: 228
    SolutionNameMin: Cijk_Alik_Bljk_HSS_BH_MT16x16x128_MI16x16x16x1_SE_1LDSB1_AF0EM8_GRVW4_LBSPP256_PLR9_SU0_SUS256_SRVW0_TT1_16_WG16_4_1_WGM1
    SolutionIndex: 229
    SolutionNameMin: Cijk_Alik_Bljk_HSS_BH_MT128x256x64_MI32x32x8x1_SE_1LDSB1_AF0EM8_GRVW2_LBSPP128_PLR9_SU0_SUS256_SRVW4_TT2_128_WG64_4_1_WGM1
    SolutionIndex: 230
    SolutionNameMin: Cijk_Alik_Bljk_HSS_BH_MT64x32x64_MI16x16x16x1_SE_1LDSB1_AF0EM8_GRVW2_LBSPP128_PLR5_SU32_SUS256_SRVW4_TT2_16_WG32_8_1_WGM1
    SolutionIndex: 231
    SolutionNameMin: Cijk_Alik_Bljk_HSS_BH_MT128x256x64_MI32x32x8x1_SE_1LDSB1_AF0EM8_GRVW4_LBSPP128_PLR9_SU32_SUS128_SRVW4_TT2_128_WG64_4_1_WGM2
    SolutionIndex: 232
    SolutionNameMin: Cijk_Alik_Bljk_HSS_BH_MT64x32x64_MI16x16x16x1_SE_1LDSB1_AF0EM8_GRVW8_LBSPP128_PLR5_SU0_SUS128_SRVW4_TT2_16_WG32_8_1_WGM1
    SolutionIndex: 233
    SolutionNameMin: Cijk_Alik_Bljk_HSS_BH_MT256x160x64_MI32x32x8x1_SE_1LDSB1_AF0EM8_GRVW8_LBSPP128_PLR9_SU0_SUS128_SRVW4_TT2_160_WG128_2_1_WGM1
    SolutionIndex: 234
    SolutionNameMin: Cijk_Alik_Bljk_HSS_BH_MT128x128x64_MI32x32x8x1_SE_1LDSB1_AF0EM8_GRVW8_LBSPP128_PLR9_SU32_SUS256_SRVW4_TT2_64_WG64_4_1_WGM2
    SolutionIndex: 235
    SolutionNameMin: Cijk_Alik_Bljk_HSS_BH_MT128x96x64_MI32x32x8x1_SE_1LDSB1_AF0EM8_GRVW4_LBSPP128_PLR9_SU0_SUS128_SRVW4_TT1_96_WG128_2_1_WGM15
    SolutionIndex: 236
    SolutionNameMin: Cijk_Alik_Bljk_HSS_BH_MT128x160x32_MI32x32x8x1_SE_1LDSB1_AF0EM8_GRVW2_LBSPP128_PLR5_SU0_SUS256_SRVW4_TT1_160_WG128_2_1_WGM15
    SolutionIndex: 237
    SolutionNameMin: Cijk_Alik_Bljk_HSS_BH_MT128x96x64_MI32x32x8x1_SE_1LDSB1_AF0EM8_GRVW4_LBSPP128_PLR9_SU0_SUS256_SRVW4_TT1_96_WG128_2_1_WGM15
    SolutionIndex: 238
    SolutionNameMin: Cijk_Alik_Bljk_HSS_BH_MT64x128x32_MI32x32x8x1_SE_1LDSB1_AF0EM8_GRVW2_LBSPP128_PLR5_SU0_SUS128_SRVW4_TT1_64_WG64_4_1_WGM2
    SolutionIndex: 239
    SolutionNameMin: Cijk_Alik_Bljk_HSS_BH_MT32x32x32_MI16x16x16x1_SE_1LDSB1_AF0EM8_GRVW8_LBSPP128_PLR2_SU0_SUS256_SRVW4_TT1_16_WG32_8_1_WGM1
    SolutionIndex: 240
    SolutionNameMin: Cijk_Alik_Bljk_HSS_BH_MT32x64x32_MI16x16x16x1_SE_1LDSB0_AF0EM8_GRVW4_LBSPP128_PLR2_SU0_SUS256_SRVW4_TT1_32_WG32_8_1_WGM15
    SolutionIndex: 241
    SolutionNameMin: Cijk_Alik_Bljk_HSS_BH_MT32x32x64_MI16x16x16x1_SE_1LDSB0_AF0EM8_GRVW8_LBSPP128_PLR5_SU0_SUS256_SRVW4_TT1_16_WG32_8_1_WGM1
    SolutionIndex: 242
    SolutionNameMin: Cijk_Alik_Bljk_HSS_BH_MT32x64x32_MI16x16x16x1_SE_1LDSB1_AF0EM8_GRVW2_LBSPP128_PLR2_SU0_SUS128_SRVW4_TT1_32_WG32_8_1_WGM15
    SolutionIndex: 243
    SolutionNameMin: Cijk_Alik_Bljk_HSS_BH_MT32x64x32_MI16x16x16x1_SE_1LDSB1_AF0EM8_GRVW4_LBSPP128_PLR2_SU0_SUS256_SRVW4_TT1_32_WG32_8_1_WGM15
    SolutionIndex: 244
    SolutionNameMin: Cijk_Alik_Bljk_HSS_BH_MT32x32x32_MI16x16x16x1_SE_1LDSB0_AF0EM8_GRVW8_LBSPP128_PLR2_SU0_SUS256_SRVW4_TT1_16_WG32_8_1_WGM1
    SolutionIndex: 245
    SolutionNameMin: Cijk_Alik_Bljk_HSS_BH_MT32x64x64_MI16x16x16x1_SE_1LDSB0_AF0EM8_GRVW8_LBSPP128_PLR5_SU0_SUS128_SRVW0_TT1_32_WG32_8_1_WGM1
    SolutionIndex: 246
    SolutionNameMin: Cijk_Alik_Bljk_HSS_BH_MT32x32x64_MI16x16x16x1_SE_1LDSB0_AF0EM8_GRVW4_LBSPP128_PLR5_SU0_SUS128_SRVW4_TT1_16_WG32_8_1_WGM15
    SolutionIndex: 247
    SolutionNameMin: Cijk_Alik_Bljk_HSS_BH_MT32x64x64_MI16x16x16x1_SE_1LDSB0_AF0EM8_GRVW8_LBSPP128_PLR5_SU0_SUS256_SRVW0_TT1_32_WG32_8_1_WGM1
    SolutionIndex: 248
    SolutionNameMin: Cijk_Alik_Bljk_HSS_BH_MT64x128x32_MI32x32x8x1_SE_1LDSB1_AF0EM8_GRVW2_LBSPP128_PLR5_SU0_SUS256_SRVW4_TT1_64_WG64_4_1_WGM15
    SolutionIndex: 249
    SolutionNameMin: Cijk_Alik_Bljk_HSS_BH_MT32x32x32_MI16x16x16x1_SE_1LDSB1_AF0EM8_GRVW4_LBSPP128_PLR2_SU0_SUS128_SRVW4_TT1_16_WG32_8_1_WGM15
    SolutionIndex: 250
    SolutionNameMin: Cijk_Alik_Bljk_HSS_BH_MT32x32x64_MI16x16x16x1_SE_1LDSB0_AF0EM8_GRVW4_LBSPP128_PLR5_SU0_SUS256_SRVW4_TT1_16_WG32_8_1_WGM1
    SolutionIndex: 251
    SolutionNameMin: Cijk_Alik_Bljk_HSS_BH_MT64x32x32_MI16x16x16x1_SE_1LDSB1_AF0EM8_GRVW8_LBSPP128_PLR2_SU0_SUS128_SRVW4_TT2_16_WG32_8_1_WGM1
    SolutionIndex: 252
    SolutionNameMin: Cijk_Alik_Bljk_HSS_BH_MT32x32x64_MI16x16x16x1_SE_1LDSB0_AF0EM8_GRVW2_LBSPP128_PLR5_SU0_SUS256_SRVW4_TT1_16_WG32_8_1_WGM1
    SolutionIndex: 253
    SolutionNameMin: Cijk_Alik_Bljk_HSS_BH_MT64x32x64_MI16x16x16x1_SE_1LDSB1_AF0EM8_GRVW8_LBSPP128_PLR5_SU0_SUS128_SRVW0_TT2_16_WG32_8_1_WGM1
    SolutionIndex: 254
    SolutionNameMin: Cijk_Alik_Bljk_HSS_BH_MT32x32x64_MI16x16x16x1_SE_1LDSB0_AF0EM8_GRVW4_LBSPP128_PLR5_SU32_SUS256_SRVW0_TT1_16_WG32_8_1_WGM2
    SolutionIndex: 255
    SolutionNameMin: Cijk_Alik_Bljk_HSS_BH_MT32x32x64_MI16x16x16x1_SE_1LDSB0_AF0EM8_GRVW8_LBSPP128_PLR5_SU32_SUS256_SRVW0_TT1_16_WG32_8_1_WGM1
    SolutionIndex: 256
    SolutionNameMin: Cijk_Alik_Bljk_HSS_BH_MT128x128x64_MI32x32x8x1_SE_1LDSB1_AF0EM8_GRVW2_LBSPP128_PLR9_SU0_SUS256_SRVW0_TT2_64_WG64_4_1_WGM15
    SolutionIndex: 257
    SolutionNameMin: Cijk_Alik_Bljk_HSS_BH_MT64x64x64_MI32x32x8x1_SE_1LDSB1_AF0EM8_GRVW8_LBSPP128_PLR9_SU32_SUS128_SRVW0_TT1_32_WG64_4_1_WGM15
    SolutionIndex: 258
    SolutionNameMin: Cijk_Alik_Bljk_HSS_BH_MT128x160x64_MI32x32x8x1_SE_1LDSB1_AF0EM8_GRVW2_LBSPP128_PLR9_SU32_SUS256_SRVW0_TT1_160_WG128_2_1_WGM1
    SolutionIndex: 259
    SolutionNameMin: Cijk_Alik_Bljk_HSS_BH_MT128x128x64_MI32x32x8x1_SE_1LDSB1_AF0EM8_GRVW2_LBSPP128_PLR9_SU0_SUS128_SRVW0_TT2_64_WG64_4_1_WGM1
    SolutionIndex: 260
    SolutionNameMin: Cijk_Alik_Bljk_HSS_BH_MT128x128x64_MI32x32x8x1_SE_1LDSB1_AF0EM8_GRVW8_LBSPP128_PLR9_SU32_SUS256_SRVW4_TT2_64_WG64_4_1_WGM1
    SolutionIndex: 261
    SolutionNameMin: Cijk_Alik_Bljk_HSS_BH_MT128x256x64_MI32x32x8x1_SE_1LDSB1_AF0EM8_GRVW2_LBSPP128_PLR9_SU32_SUS128_SRVW4_TT2_128_WG64_4_1_WGM1
    SolutionIndex: 262
    SolutionNameMin: Cijk_Alik_Bljk_HSS_BH_MT64x64x64_MI32x32x8x1_SE_1LDSB1_AF0EM8_GRVW8_LBSPP128_PLR9_SU32_SUS256_SRVW4_TT1_32_WG64_4_1_WGM2
    SolutionIndex: 263
    SolutionNameMin: Cijk_Alik_Bljk_HSS_BH_MT64x64x64_MI32x32x8x1_SE_1LDSB1_AF0EM8_GRVW8_LBSPP128_PLR9_SU0_SUS128_SRVW4_TT1_32_WG64_4_1_WGM1
    SolutionIndex: 264
    SolutionNameMin: Cijk_Alik_Bljk_HSS_BH_MT64x32x64_MI16x16x16x1_SE_1LDSB1_AF0EM8_GRVW2_LBSPP128_PLR5_SU0_SUS256_SRVW4_TT2_16_WG32_8_1_WGM1
    SolutionIndex: 265
    SolutionNameMin: Cijk_Alik_Bljk_HSS_BH_MT128x128x64_MI32x32x8x1_SE_1LDSB1_AF0EM8_GRVW8_LBSPP128_PLR9_SU0_SUS256_SRVW0_TT2_64_WG64_4_1_WGM1
    SolutionIndex: 266
    SolutionNameMin: Cijk_Alik_Bljk_HSS_BH_MT128x128x64_MI32x32x8x1_SE_1LDSB1_AF0EM8_GRVW2_LBSPP128_PLR9_SU0_SUS128_SRVW0_TT2_64_WG64_4_1_WGM2
    SolutionIndex: 267
    SolutionNameMin: Cijk_Alik_Bljk_HSS_BH_MT128x128x64_MI32x32x8x1_SE_1LDSB1_AF0EM8_GRVW8_LBSPP128_PLR9_SU0_SUS256_SRVW4_TT2_64_WG64_4_1_WGM2
    SolutionIndex: 268
    SolutionNameMin: Cijk_Alik_Bljk_HSS_BH_MT128x128x64_MI32x32x8x1_SE_1LDSB1_AF0EM8_GRVW8_LBSPP128_PLR9_SU32_SUS256_SRVW4_TT2_64_WG64_4_1_WGM15
    SolutionIndex: 269
    SolutionNameMin: Cijk_Alik_Bljk_HSS_BH_MT128x256x64_MI32x32x8x1_SE_1LDSB1_AF0EM8_GRVW2_LBSPP128_PLR9_SU32_SUS128_SRVW4_TT2_128_WG64_4_1_WGM15
    SolutionIndex: 270
    SolutionNameMin: Cijk_Alik_Bljk_HSS_BH_MT128x128x64_MI32x32x8x1_SE_1LDSB1_AF0EM8_GRVW4_LBSPP128_PLR9_SU0_SUS128_SRVW4_TT2_64_WG64_4_1_WGM1
    SolutionIndex: 271
    SolutionNameMin: Cijk_Alik_Bljk_HSS_BH_MT128x96x64_MI32x32x8x1_SE_1LDSB1_AF0EM8_GRVW8_LBSPP128_PLR9_SU0_SUS128_SRVW4_TT1_96_WG128_2_1_WGM1
    SolutionIndex: 272
    SolutionNameMin: Cijk_Alik_Bljk_HSS_BH_MT128x256x64_MI32x32x8x1_SE_1LDSB1_AF0EM8_GRVW2_LBSPP128_PLR9_SU32_SUS128_SRVW4_TT2_128_WG64_4_1_WGM2
    SolutionIndex: 273
    SolutionNameMin: Cijk_Alik_Bljk_HSS_BH_MT128x128x64_MI32x32x8x1_SE_1LDSB1_AF0EM8_GRVW8_LBSPP128_PLR9_SU0_SUS128_SRVW4_TT2_64_WG64_4_1_WGM2
    SolutionIndex: 274
    SolutionNameMin: Cijk_Alik_Bljk_HSS_BH_MT64x64x64_MI32x32x8x1_SE_1LDSB1_AF0EM8_GRVW8_LBSPP128_PLR9_SU0_SUS128_SRVW0_TT1_32_WG64_4_1_WGM1
    SolutionIndex: 275
    SolutionNameMin: Cijk_Alik_Bljk_HSS_BH_MT64x64x64_MI32x32x8x1_SE_1LDSB1_AF0EM8_GRVW8_LBSPP128_PLR9_SU0_SUS256_SRVW0_TT1_32_WG64_4_1_WGM1
    SolutionIndex: 276
    SolutionNameMin: Cijk_Alik_Bljk_HSS_BH_MT64x32x64_MI16x16x16x1_SE_1LDSB0_AF0EM8_GRVW8_LBSPP128_PLR5_SU0_SUS256_SRVW0_TT2_16_WG32_8_1_WGM1
    SolutionIndex: 277
    SolutionNameMin: Cijk_Alik_Bljk_HSS_BH_MT64x128x64_MI32x32x8x1_SE_1LDSB1_AF0EM8_GRVW8_LBSPP128_PLR9_SU0_SUS256_SRVW4_TT1_64_WG64_4_1_WGM1
    SolutionIndex: 278
    SolutionNameMin: Cijk_Alik_Bljk_HSS_BH_MT128x96x64_MI32x32x8x1_SE_1LDSB1_AF0EM8_GRVW8_LBSPP128_PLR9_SU32_SUS256_SRVW4_TT1_96_WG128_2_1_WGM1
    SolutionIndex: 279
    SolutionNameMin: Cijk_Alik_Bljk_HSS_BH_MT64x64x64_MI32x32x8x1_SE_1LDSB1_AF0EM8_GRVW4_LBSPP128_PLR9_SU0_SUS128_SRVW4_TT1_32_WG64_4_1_WGM1
    SolutionIndex: 280
    SolutionNameMin: Cijk_Alik_Bljk_HSS_BH_MT32x64x64_MI16x16x16x1_SE_1LDSB1_AF0EM8_GRVW8_LBSPP128_PLR5_SU0_SUS256_SRVW4_TT1_32_WG32_8_1_WGM1
    SolutionIndex: 281
    SolutionNameMin: Cijk_Alik_Bljk_HSS_BH_MT64x64x64_MI32x32x8x1_SE_1LDSB1_AF0EM8_GRVW4_LBSPP128_PLR9_SU0_SUS256_SRVW4_TT1_32_WG64_4_1_WGM1
    SolutionIndex: 282
    SolutionNameMin: Cijk_Alik_Bljk_HSS_BH_MT160x128x64_MI32x32x8x1_SE_1LDSB1_AF0EM8_GRVW4_LBSPP128_PLR9_SU0_SUS128_SRVW0_TT5_32_WG32_8_1_WGM1
    SolutionIndex: 283
    SolutionNameMin: Cijk_Alik_Bljk_HSS_BH_MT128x160x64_MI32x32x8x1_SE_1LDSB1_AF0EM8_GRVW2_LBSPP128_PLR9_SU0_SUS128_SRVW4_TT1_160_WG128_2_1_WGM2
    SolutionIndex: 284
    SolutionNameMin: Cijk_Alik_Bljk_HSS_BH_MT128x288x64_MI32x32x8x1_SE_1LDSB1_AF0EM8_GRVW8_LBSPP128_PLR9_SU0_SUS128_SRVW4_TT1_288_WG128_2_1_WGM1
    SolutionIndex: 285
    SolutionNameMin: Cijk_Alik_Bljk_HSS_BH_MT160x256x64_MI32x32x8x1_SE_1LDSB1_AF0EM8_GRVW2_LBSPP128_PLR9_SU0_SUS128_SRVW0_TT5_64_WG32_8_1_WGM15
    SolutionIndex: 286
    SolutionNameMin: Cijk_Alik_Bljk_HSS_BH_MT16x16x128_MI16x16x16x1_SE_1LDSB0_AF0EM1_GRVW8_LBSPP256_PLR9_SU0_SUS256_SRVW0_TT1_16_WG16_4_1_WGM15
    SolutionIndex: 287
    SolutionNameMin: Cijk_Alik_Bljk_HSS_BH_MT16x16x128_MI16x16x16x1_SE_1LDSB0_AF0EM1_GRVW4_LBSPP256_PLR9_SU0_SUS256_SRVW0_TT1_16_WG16_4_1_WGM1
    SolutionIndex: 288
    SolutionNameMin: Cijk_Alik_Bljk_HSS_BH_MT128x96x64_MI32x32x8x1_SE_1LDSB1_AF0EM1_GRVW8_LBSPP128_PLR9_SU32_SUS128_SRVW4_TT1_96_WG128_2_1_WGM1
    SolutionIndex: 289
    SolutionNameMin: Cijk_Alik_Bljk_HSS_BH_MT128x96x64_MI32x32x8x1_SE_1LDSB1_AF0EM1_GRVW8_LBSPP128_PLR9_SU32_SUS128_SRVW4_TT1_96_WG128_2_1_WGM15
    SolutionIndex: 290
    SolutionNameMin: Cijk_Alik_Bljk_HSS_BH_MT32x32x64_MI16x16x16x1_SE_1LDSB0_AF0EM1_GRVW4_LBSPP128_PLR5_SU0_SUS128_SRVW4_TT1_16_WG32_8_1_WGM1
    SolutionIndex: 291
    SolutionNameMin: Cijk_Alik_Bljk_HSS_BH_MT128x160x32_MI32x32x8x1_SE_1LDSB1_AF0EM1_GRVW4_LBSPP128_PLR5_SU32_SUS128_SRVW4_TT1_160_WG128_2_1_WGM15
    SolutionIndex: 292
    SolutionNameMin: Cijk_Alik_Bljk_HSS_BH_MT16x16x128_MI16x16x16x1_SE_1LDSB0_AF0EM1_GRVW8_LBSPP256_PLR9_SU0_SUS256_SRVW0_TT1_16_WG16_4_1_WGM2
    SolutionIndex: 293
    SolutionNameMin: Cijk_Alik_Bljk_HSS_BH_MT128x160x32_MI32x32x8x1_SE_1LDSB1_AF0EM1_GRVW2_LBSPP128_PLR5_SU32_SUS128_SRVW4_TT1_160_WG128_2_1_WGM15
    SolutionIndex: 294
    SolutionNameMin: Cijk_Alik_Bljk_HSS_BH_MT32x32x64_MI16x16x16x1_SE_1LDSB0_AF0EM1_GRVW2_LBSPP128_PLR5_SU0_SUS128_SRVW4_TT1_16_WG32_8_1_WGM1
    SolutionIndex: 295
    SolutionNameMin: Cijk_Alik_Bljk_HSS_BH_MT128x96x64_MI32x32x8x1_SE_1LDSB1_AF0EM1_GRVW8_LBSPP128_PLR9_SU32_SUS256_SRVW4_TT1_96_WG128_2_1_WGM15
    SolutionIndex: 296
    SolutionNameMin: Cijk_Alik_Bljk_HSS_BH_MT256x160x64_MI32x32x8x1_SE_1LDSB1_AF0EM1_GRVW2_LBSPP128_PLR9_SU0_SUS128_SRVW4_TT2_160_WG128_2_1_WGM15
    SolutionIndex: 297
    SolutionNameMin: Cijk_Alik_Bljk_HSS_BH_MT128x96x64_MI32x32x8x1_SE_1LDSB1_AF0EM1_GRVW8_LBSPP128_PLR9_SU0_SUS256_SRVW4_TT1_96_WG128_2_1_WGM15
    SolutionIndex: 298
    SolutionNameMin: Cijk_Alik_Bljk_HSS_BH_MT32x32x32_MI16x16x16x1_SE_1LDSB0_AF0EM1_GRVW2_LBSPP128_PLR2_SU0_SUS128_SRVW4_TT1_16_WG32_8_1_WGM1
    SolutionIndex: 299
    SolutionNameMin: Cijk_Alik_Bljk_HSS_BH_MT128x96x64_MI32x32x8x1_SE_1LDSB1_AF0EM1_GRVW8_LBSPP128_PLR9_SU0_SUS128_SRVW4_TT1_96_WG128_2_1_WGM15
    SolutionIndex: 300
    SolutionNameMin: Cijk_Alik_Bljk_HSS_BH_MT32x32x64_MI16x16x16x1_SE_1LDSB0_AF0EM1_GRVW8_LBSPP128_PLR5_SU0_SUS128_SRVW0_TT1_16_WG32_8_1_WGM1
    SolutionIndex: 301
    SolutionNameMin: Cijk_Alik_Bljk_HSS_BH_MT128x96x64_MI32x32x8x1_SE_1LDSB1_AF0EM1_GRVW4_LBSPP128_PLR9_SU32_SUS256_SRVW4_TT1_96_WG128_2_1_WGM2
    SolutionIndex: 302
    SolutionNameMin: Cijk_Alik_Bljk_HSS_BH_MT16x16x32_MI16x16x16x1_SE_1LDSB1_AF0EM1_GRVW2_LBSPP128_PLR2_SU0_SUS128_SRVW0_TT1_16_WG16_4_1_WGM2
    SolutionIndex: 303
    SolutionNameMin: Cijk_Alik_Bljk_HSS_BH_MT16x16x32_MI16x16x16x1_SE_1LDSB1_AF0EM1_GRVW8_LBSPP128_PLR2_SU0_SUS128_SRVW0_TT1_16_WG16_4_1_WGM1
    SolutionIndex: 304
    SolutionNameMin: Cijk_Alik_Bljk_HSS_BH_MT16x16x64_MI16x16x16x1_SE_1LDSB0_AF0EM1_GRVW8_LBSPP128_PLR5_SU0_SUS128_SRVW0_TT1_16_WG16_4_1_WGM1
    SolutionIndex: 305
    SolutionNameMin: Cijk_Alik_Bljk_HSS_BH_MT16x16x64_MI16x16x16x1_SE_1LDSB0_AF0EM1_GRVW8_LBSPP128_PLR5_SU0_SUS256_SRVW0_TT1_16_WG16_4_1_WGM1
    SolutionIndex: 306
    SolutionNameMin: Cijk_Alik_Bljk_HSS_BH_MT16x16x32_MI16x16x16x1_SE_1LDSB1_AF0EM1_GRVW2_LBSPP128_PLR2_SU0_SUS128_SRVW4_TT1_16_WG16_4_1_WGM2
    SolutionIndex: 307
    SolutionNameMin: Cijk_Alik_Bljk_HSS_BH_MT32x32x32_MI16x16x16x1_SE_1LDSB1_AF0EM1_GRVW8_LBSPP128_PLR2_SU0_SUS256_SRVW4_TT1_16_WG32_8_1_WGM2
    SolutionIndex: 308
    SolutionNameMin: Cijk_Alik_Bljk_HSS_BH_MT32x32x32_MI16x16x16x1_SE_1LDSB1_AF0EM1_GRVW8_LBSPP128_PLR2_SU0_SUS256_SRVW4_TT1_16_WG32_8_1_WGM1
    SolutionIndex: 309
    SolutionNameMin: Cijk_Alik_Bljk_HSS_BH_MT32x32x32_MI16x16x16x1_SE_1LDSB1_AF0EM1_GRVW2_LBSPP128_PLR2_SU0_SUS256_SRVW4_TT1_16_WG32_8_1_WGM1
    SolutionIndex: 310
    SolutionNameMin: Cijk_Alik_Bljk_HSS_BH_MT32x32x32_MI16x16x16x1_SE_1LDSB1_AF0EM1_GRVW2_LBSPP128_PLR2_SU0_SUS128_SRVW4_TT1_16_WG32_8_1_WGM2
    SolutionIndex: 311
    SolutionNameMin: Cijk_Alik_Bljk_HSS_BH_MT32x64x32_MI16x16x16x1_SE_1LDSB1_AF0EM1_GRVW2_LBSPP128_PLR2_SU0_SUS256_SRVW4_TT1_32_WG32_8_1_WGM15
    SolutionIndex: 312
    SolutionNameMin: Cijk_Alik_Bljk_HSS_BH_MT32x64x32_MI16x16x16x1_SE_1LDSB1_AF0EM1_GRVW2_LBSPP128_PLR2_SU0_SUS128_SRVW4_TT1_32_WG32_8_1_WGM2
    SolutionIndex: 313
    SolutionNameMin: Cijk_Alik_Bljk_HSS_BH_MT64x32x64_MI16x16x16x1_SE_1LDSB1_AF0EM1_GRVW8_LBSPP128_PLR5_SU0_SUS256_SRVW4_TT2_16_WG32_8_1_WGM1
    SolutionIndex: 314
    SolutionNameMin: Cijk_Alik_Bljk_HSS_BH_MT64x64x64_MI32x32x8x1_SE_1LDSB1_AF0EM1_GRVW8_LBSPP128_PLR9_SU0_SUS256_SRVW4_TT1_32_WG64_4_1_WGM1
    SolutionIndex: 315
    SolutionNameMin: Cijk_Alik_Bljk_HSS_BH_MT64x64x64_MI32x32x8x1_SE_1LDSB1_AF0EM1_GRVW2_LBSPP128_PLR9_SU0_SUS128_SRVW4_TT1_32_WG64_4_1_WGM1
    SolutionIndex: 316
    SolutionNameMin: Cijk_Alik_Bljk_HSS_BH_MT16x16x128_MI16x16x16x1_SE_1LDSB1_AF0EM1_GRVW8_LBSPP256_PLR9_SU0_SUS256_SRVW0_TT1_16_WG16_4_1_WGM15
    SolutionIndex: 317
    SolutionNameMin: Cijk_Alik_Bljk_HSS_BH_MT16x16x32_MI16x16x16x1_SE_1LDSB0_AF0EM1_GRVW8_LBSPP128_PLR2_SU0_SUS128_SRVW0_TT1_16_WG16_4_1_WGM1
    SolutionIndex: 318
    SolutionNameMin: Cijk_Alik_Bljk_HSS_BH_MT32x32x32_MI16x16x16x1_SE_1LDSB0_AF0EM1_GRVW4_LBSPP128_PLR2_SU0_SUS128_SRVW4_TT1_16_WG32_8_1_WGM1
    SolutionIndex: 319
    SolutionNameMin: Cijk_Alik_Bljk_HSS_BH_MT16x16x64_MI16x16x16x1_SE_1LDSB0_AF0EM1_GRVW8_LBSPP128_PLR5_SU0_SUS128_SRVW0_TT1_16_WG16_4_1_WGM15
    SolutionIndex: 320
    SolutionNameMin: Cijk_Alik_Bljk_HSS_BH_MT16x16x32_MI16x16x16x1_SE_1LDSB0_AF0EM1_GRVW8_LBSPP128_PLR2_SU0_SUS256_SRVW0_TT1_16_WG16_4_1_WGM1
    SolutionIndex: 321
    SolutionNameMin: Cijk_Alik_Bljk_HSS_BH_MT32x64x64_MI16x16x16x1_SE_1LDSB1_AF0EM1_GRVW8_LBSPP128_PLR5_SU0_SUS128_SRVW4_TT1_32_WG32_8_1_WGM1
    SolutionIndex: 322
    SolutionNameMin: Cijk_Alik_Bljk_HSS_BH_MT64x64x32_MI32x32x8x1_SE_1LDSB1_AF0EM1_GRVW8_LBSPP128_PLR5_SU0_SUS256_SRVW4_TT1_32_WG64_4_1_WGM1
    SolutionIndex: 323
    SolutionNameMin: Cijk_Alik_Bljk_HSS_BH_MT128x96x64_MI32x32x8x1_SE_1LDSB1_AF0EM1_GRVW8_LBSPP128_PLR9_SU0_SUS128_SRVW4_TT1_96_WG128_2_1_WGM2
    SolutionIndex: 324
    SolutionNameMin: Cijk_Alik_Bljk_HSS_BH_MT32x32x64_MI16x16x16x1_SE_1LDSB0_AF0EM1_GRVW8_LBSPP128_PLR5_SU0_SUS128_SRVW0_TT1_16_WG32_8_1_WGM1
    SolutionIndex: 325
    SolutionNameMin: Cijk_Alik_Bljk_HSS_BH_MT32x32x64_MI16x16x16x1_SE_1LDSB0_AF0EM1_GRVW2_LBSPP128_PLR5_SU0_SUS128_SRVW0_TT1_16_WG32_8_1_WGM1
    SolutionIndex: 326
    SolutionNameMin: Cijk_Alik_Bljk_HSS_BH_MT32x32x64_MI16x16x16x1_SE_1LDSB0_AF0EM1_GRVW4_LBSPP128_PLR5_SU0_SUS256_SRVW0_TT1_16_WG32_8_1_WGM1
    SolutionIndex: 327
    SolutionNameMin: Cijk_Alik_Bljk_HSS_BH_MT16x16x128_MI16x16x16x1_SE_1LDSB1_AF0EM1_GRVW8_LBSPP256_PLR9_SU0_SUS256_SRVW0_TT1_16_WG16_4_1_WGM1
    SolutionIndex: 328
    SolutionNameMin: Cijk_Alik_Bljk_HSS_BH_MT16x16x128_MI16x16x16x1_SE_1LDSB1_AF0EM1_GRVW8_LBSPP256_PLR9_SU0_SUS256_SRVW0_TT1_16_WG16_4_1_WGM2
    SolutionIndex: 329
    SolutionNameMin: Cijk_Alik_Bljk_HSS_BH_MT32x32x64_MI16x16x16x1_SE_1LDSB0_AF0EM1_GRVW8_LBSPP128_PLR5_SU0_SUS128_SRVW0_TT1_16_WG32_8_1_WGM2
- - - [512, 8, 1, 500000]
    - [2, 0.449]
  - - [512, 16, 1, 500000]
    - [5, 0.931]
  - - [1024, 8, 1, 500000]
    - [5, 0.931]
  - - [1024, 16, 1, 500000]
    - [5, 1.866]
  - - [1760, 16, 1, 1760]
    - [5, 2.983]
  - - [3072, 16, 1, 1024]
    - [9, 4.857]
  - - [2048, 16, 1, 2048]
    - [9, 3.483]
  - - [2560, 16, 1, 2560]
    - [9, 4.399]
  - - [4608, 16, 1, 1536]
    - [9, 7.544]
  - - [6144, 16, 1, 2560]
    - [9, 10.239]
  - - [4096, 16, 1, 4096]
    - [9, 7.037]
  - - [7680, 16, 1, 2560]
    - [9, 12.73]
  - - [8448, 16, 1, 2816]
    - [9, 12.757]
  - - [64, 64, 1, 256]
    - [0, 0.267]
  - - [128, 64, 1, 256]
    - [6, 0.485]
  - - [64, 128, 1, 256]
    - [0, 0.494]
  - - [128, 128, 1, 256]
    - [6, 0.958]
  - - [64, 256, 1, 256]
    - [6, 0.982]
  - - [128, 256, 1, 256]
    - [2, 2.474]
  - - [64, 448, 1, 256]
    - [5, 2.198]
  - - [128, 448, 1, 256]
    - [2, 4.228]
  - - [64, 704, 1, 256]
    - [5, 3.348]
  - - [128, 704, 1, 256]
    - [2, 6.397]
  - - [64, 1024, 1, 256]
    - [2, 4.759]
  - - [128, 1024, 1, 256]
    - [2, 8.544]
  - - [64, 1408, 1, 256]
    - [2, 6.397]
  - - [128, 1408, 1, 256]
    - [9, 11.287]
  - - [64, 1856, 1, 256]
    - [2, 8.31]
  - - [128, 1856, 1, 256]
    - [9, 13.551]
  - - [64, 2368, 1, 256]
    - [2, 9.748]
  - - [128, 2368, 1, 256]
    - [9, 14.099]
  - - [64, 2944, 1, 256]
    - [9, 11.428]
  - - [128, 2944, 1, 256]
    - [10, 16.048]
  - - [64, 3584, 1, 256]
    - [9, 13.404]
  - - [128, 3584, 1, 256]
    - [10, 18.318]
  - - [64, 4288, 1, 256]
    - [9, 13.281]
  - - [128, 4288, 1, 256]
    - [1, 18.651]
  - - [64, 5056, 1, 256]
    - [9, 14.557]
  - - [128, 5056, 1, 256]
    - [1, 20.202]
  - - [64, 5888, 1, 256]
    - [10, 15.566]
  - - [128, 5888, 1, 256]
    - [3, 22.361]
  - - [64, 6784, 1, 256]
    - [10, 17.336]
  - - [128, 6784, 1, 256]
    - [18, 25.371]
  - - [64, 64, 1, 1280]
    - [5, 0.404]
  - - [128, 64, 1, 1280]
    - [9, 0.773]
  - - [64, 128, 1, 1280]
    - [9, 0.758]
  - - [128, 128, 1, 1280]
    - [2, 1.506]
  - - [64, 256, 1, 1280]
    - [2, 1.539]
  - - [128, 256, 1, 1280]
    - [9, 3.369]
  - - [64, 448, 1, 1280]
    - [15, 2.974]
  - - [128, 448, 1, 1280]
    - [9, 5.897]
  - - [64, 704, 1, 1280]
    - [9, 4.612]
  - - [128, 704, 1, 1280]
    - [9, 8.921]
  - - [64, 1024, 1, 1280]
    - [9, 6.513]
  - - [128, 1024, 1, 1280]
    - [12, 11.76]
  - - [64, 1408, 1, 1280]
    - [9, 8.921]
  - - [128, 1408, 1, 1280]
    - [9, 16.051]
  - - [64, 1856, 1, 1280]
    - [9, 11.688]
  - - [128, 1856, 1, 1280]
    - [9, 19.591]
  - - [64, 2368, 1, 1280]
    - [9, 13.524]
  - - [128, 2368, 1, 1280]
    - [9, 20.088]
  - - [64, 2944, 1, 1280]
    - [9, 15.755]
  - - [128, 2944, 1, 1280]
    - [10, 20.849]
  - - [64, 3584, 1, 1280]
    - [9, 18.95]
  - - [128, 3584, 1, 1280]
    - [10, 24.023]
  - - [64, 4288, 1, 1280]
    - [9, 18.136]
  - - [128, 4288, 1, 1280]
    - [10, 22.712]
  - - [64, 5056, 1, 1280]
    - [10, 18.839]
  - - [128, 5056, 1, 1280]
    - [4, 23.421]
  - - [64, 5888, 1, 1280]
    - [10, 20.588]
  - - [128, 5888, 1, 1280]
    - [8, 26.748]
  - - [64, 6784, 1, 1280]
    - [13, 22.987]
  - - [128, 6784, 1, 1280]
    - [17, 30.192]
  - - [64, 64, 1, 3328]
    - [5, 0.449]
  - - [128, 64, 1, 3328]
    - [9, 0.865]
  - - [64, 128, 1, 3328]
    - [9, 0.862]
  - - [128, 128, 1, 3328]
    - [9, 1.686]
  - - [64, 256, 1, 3328]
    - [9, 1.689]
  - - [128, 256, 1, 3328]
    - [9, 3.582]
  - - [64, 448, 1, 3328]
    - [5, 3.144]
  - - [128, 448, 1, 3328]
    - [9, 6.268]
  - - [64, 704, 1, 3328]
    - [9, 4.929]
  - - [128, 704, 1, 3328]
    - [9, 9.604]
  - - [64, 1024, 1, 3328]
    - [9, 6.99]
  - - [128, 1024, 1, 3328]
    - [9, 12.503]
  - - [64, 1408, 1, 3328]
    - [9, 9.595]
  - - [128, 1408, 1, 3328]
    - [9, 17.139]
  - - [64, 1856, 1, 3328]
    - [9, 12.572]
  - - [128, 1856, 1, 3328]
    - [9, 20.9]
  - - [64, 2368, 1, 3328]
    - [9, 14.434]
  - - [128, 2368, 1, 3328]
    - [10, 19.636]
  - - [64, 2944, 1, 3328]
    - [2, 15.596]
  - - [128, 2944, 1, 3328]
    - [10, 20.403]
  - - [64, 3584, 1, 3328]
    - [10, 17.393]
  - - [128, 3584, 1, 3328]
    - [14, 23.385]
  - - [64, 4288, 1, 3328]
    - [13, 17.872]
  - - [128, 4288, 1, 3328]
    - [8, 20.801]
  - - [64, 5056, 1, 3328]
    - [13, 20.822]
  - - [128, 5056, 1, 3328]
    - [8, 24.416]
  - - [64, 5888, 1, 3328]
    - [10, 21.466]
  - - [128, 5888, 1, 3328]
    - [14, 27.803]
  - - [64, 6784, 1, 3328]
    - [14, 22.25]
  - - [128, 6784, 1, 3328]
    - [18, 31.375]
  - - [256, 64, 1, 256]
    - [6, 0.982]
  - - [448, 64, 1, 256]
    - [5, 2.198]
  - - [704, 64, 1, 256]
    - [5, 3.348]
  - - [1024, 64, 1, 256]
    - [2, 4.723]
  - - [1408, 64, 1, 256]
    - [2, 6.304]
  - - [1856, 64, 1, 256]
    - [2, 8.247]
  - - [2368, 64, 1, 256]
    - [2, 9.493]
  - - [2944, 64, 1, 256]
    - [7, 11.146]
  - - [3584, 64, 1, 256]
    - [12, 12.931]
  - - [4288, 64, 1, 256]
    - [12, 12.766]
  - - [5056, 64, 1, 256]
    - [9, 13.722]
  - - [5888, 64, 1, 256]
    - [13, 14.86]
  - - [6784, 64, 1, 256]
    - [8, 16.776]
  - - [256, 128, 1, 256]
    - [2, 2.453]
  - - [448, 128, 1, 256]
    - [5, 4.228]
  - - [704, 128, 1, 256]
    - [7, 6.397]
  - - [1024, 128, 1, 256]
    - [2, 8.319]
  - - [1408, 128, 1, 256]
    - [7, 11.071]
  - - [1856, 128, 1, 256]
    - [7, 13.551]
  - - [2368, 128, 1, 256]
    - [7, 13.832]
  - - [2944, 128, 1, 256]
    - [13, 14.86]
  - - [3584, 128, 1, 256]
    - [8, 17.944]
  - - [4288, 128, 1, 256]
    - [12, 17.474]
  - - [5056, 128, 1, 256]
    - [4, 20.07]
  - - [5888, 128, 1, 256]
    - [8, 22.43]
  - - [6784, 128, 1, 256]
    - [18, 25.604]
  - - [256, 64, 1, 1280]
    - [2, 1.542]
  - - [448, 64, 1, 1280]
    - [5, 2.974]
  - - [704, 64, 1, 1280]
    - [9, 4.612]
  - - [1024, 64, 1, 1280]
    - [9, 6.501]
  - - [1408, 64, 1, 1280]
    - [9, 8.921]
  - - [1856, 64, 1, 1280]
    - [9, 11.688]
  - - [2368, 64, 1, 1280]
    - [9, 13.524]
  - - [2944, 64, 1, 1280]
    - [9, 15.728]
  - - [3584, 64, 1, 1280]
    - [9, 18.723]
  - - [4288, 64, 1, 1280]
    - [9, 18.759]
  - - [5056, 64, 1, 1280]
    - [9, 19.726]
  - - [5888, 64, 1, 1280]
    - [10, 20.825]
  - - [6784, 64, 1, 1280]
    - [10, 23.065]
  - - [256, 128, 1, 1280]
    - [9, 3.369]
  - - [448, 128, 1, 1280]
    - [9, 5.885]
  - - [704, 128, 1, 1280]
    - [9, 8.921]
  - - [1024, 128, 1, 1280]
    - [9, 11.739]
  - - [1408, 128, 1, 1280]
    - [12, 15.962]
  - - [1856, 128, 1, 1280]
    - [12, 19.325]
  - - [2368, 128, 1, 1280]
    - [10, 18.597]
  - - [2944, 128, 1, 1280]
    - [10, 20.849]
  - - [3584, 128, 1, 1280]
    - [13, 23.763]
  - - [4288, 128, 1, 1280]
    - [10, 22.691]
  - - [5056, 128, 1, 1280]
    - [4, 23.562]
  - - [5888, 128, 1, 1280]
    - [14, 26.593]
  - - [6784, 128, 1, 1280]
    - [18, 30.438]
  - - [256, 64, 1, 3328]
    - [2, 1.692]
  - - [448, 64, 1, 3328]
    - [5, 3.144]
  - - [704, 64, 1, 3328]
    - [9, 4.929]
  - - [1024, 64, 1, 3328]
    - [9, 6.99]
  - - [1408, 64, 1, 3328]
    - [9, 9.586]
  - - [1856, 64, 1, 3328]
    - [9, 12.551]
  - - [2368, 64, 1, 3328]
    - [9, 14.413]
  - - [2944, 64, 1, 3328]
    - [9, 16.198]
  - - [3584, 64, 1, 3328]
    - [2, 18.133]
  - - [4288, 64, 1, 3328]
    - [10, 18.004]
  - - [5056, 64, 1, 3328]
    - [10, 20.726]
  - - [5888, 64, 1, 3328]
    - [10, 22.205]
  - - [6784, 64, 1, 3328]
    - [14, 22.331]
  - - [256, 128, 1, 3328]
    - [9, 3.588]
  - - [448, 128, 1, 3328]
    - [9, 6.262]
  - - [704, 128, 1, 3328]
    - [9, 9.58]
  - - [1024, 128, 1, 3328]
    - [9, 12.494]
  - - [1408, 128, 1, 3328]
    - [12, 17.01]
  - - [1856, 128, 1, 3328]
    - [12, 20.594]
  - - [2368, 128, 1, 3328]
    - [10, 19.78]
  - - [2944, 128, 1, 3328]
    - [10, 22.226]
  - - [3584, 128, 1, 3328]
    - [10, 25.652]
  - - [4288, 128, 1, 3328]
    - [3, 20.846]
  - - [5056, 128, 1, 3328]
    - [4, 24.446]
  - - [5888, 128, 1, 3328]
    - [11, 27.901]
  - - [6784, 128, 1, 3328]
    - [17, 31.411]
  - - [256, 256, 1, 256]
    - [7, 4.759]
  - - [448, 256, 1, 256]
    - [7, 8.083]
  - - [256, 448, 1, 256]
    - [7, 8.083]
  - - [448, 448, 1, 256]
    - [2, 11.727]
  - - [256, 256, 1, 1280]
    - [9, 6.528]
  - - [448, 256, 1, 1280]
    - [9, 11.332]
  - - [256, 448, 1, 1280]
    - [9, 11.332]
  - - [448, 448, 1, 1280]
    - [12, 16.695]
  - - [256, 256, 1, 3328]
    - [9, 6.966]
  - - [448, 256, 1, 3328]
    - [9, 12.078]
  - - [256, 448, 1, 3328]
    - [9, 12.128]
  - - [448, 448, 1, 3328]
    - [12, 17.684]
  - - [1760, 32, 1, 1760]
    - [9, 5.917]
  - - [3072, 32, 1, 1024]
    - [9, 9.373]
  - - [2048, 32, 1, 2048]
    - [9, 6.807]
  - - [1760, 64, 1, 1760]
    - [9, 11.47]
  - - [3072, 64, 1, 1024]
    - [12, 15.506]
  - - [2560, 32, 1, 2560]
    - [9, 8.607]
  - - [4608, 32, 1, 1536]
    - [9, 13.566]
  - - [2048, 64, 1, 2048]
    - [12, 11.458]
  - - [1760, 128, 1, 1760]
    - [12, 18.414]
  - - [3072, 128, 1, 1024]
    - [13, 19.498]
  - - [2560, 64, 1, 2560]
    - [9, 15.348]
  - - [6144, 32, 1, 2560]
    - [2, 15.647]
  - - [2048, 128, 1, 2048]
    - [12, 16.09]
  - - [4096, 32, 1, 4096]
    - [12, 12.042]
  - - [7680, 32, 1, 2560]
    - [9, 21.256]
  - - [8448, 32, 1, 2816]
    - [10, 17.462]
  - - [2560, 128, 1, 2560]
    - [10, 20.783]
  - - [4096, 64, 1, 4096]
    - [13, 17.399]
  - - [7680, 64, 1, 2560]
    - [10, 26.868]
  - - [4096, 128, 1, 4096]
    - [11, 20.025]
  - - [7680, 128, 1, 2560]
    - [3, 35.322]
  - - [704, 256, 1, 256]
    - [8, 7.816]
  - - [1024, 256, 1, 256]
    - [8, 10.969]
  - - [1408, 256, 1, 256]
    - [8, 13.928]
  - - [1856, 256, 1, 256]
    - [8, 18.214]
  - - [2368, 256, 1, 256]
    - [8, 18.384]
  - - [2944, 256, 1, 256]
    - [18, 22.223]
  - - [3584, 256, 1, 256]
    - [18, 26.889]
  - - [4288, 256, 1, 256]
    - [17, 26.233]
  - - [5056, 256, 1, 256]
    - [18, 30.779]
  - - [5888, 256, 1, 256]
    - [17, 29.24]
  - - [6784, 256, 1, 256]
    - [18, 33.286]
  - - [704, 448, 1, 256]
    - [8, 11.994]
  - - [1024, 448, 1, 256]
    - [8, 17.375]
  - - [1408, 448, 1, 256]
    - [8, 18.95]
  - - [1856, 448, 1, 256]
    - [8, 24.745]
  - - [2368, 448, 1, 256]
    - [17, 25.416]
  - - [2944, 448, 1, 256]
    - [18, 31.441]
  - - [3584, 448, 1, 256]
    - [18, 30.959]
  - - [4288, 448, 1, 256]
    - [18, 36.819]
  - - [5056, 448, 1, 256]
    - [18, 35.181]
  - - [5888, 448, 1, 256]
    - [18, 35.702]
  - - [6784, 448, 1, 256]
    - [18, 36.224]
  - - [256, 704, 1, 256]
    - [8, 7.78]
  - - [448, 704, 1, 256]
    - [16, 12.042]
  - - [704, 704, 1, 256]
    - [8, 15.372]
  - - [1024, 704, 1, 256]
    - [8, 21.589]
  - - [1408, 704, 1, 256]
    - [17, 24.047]
  - - [1856, 704, 1, 256]
    - [17, 31.148]
  - - [2368, 704, 1, 256]
    - [18, 31.887]
  - - [2944, 704, 1, 256]
    - [18, 32.244]
  - - [3584, 704, 1, 256]
    - [18, 34.247]
  - - [4288, 704, 1, 256]
    - [18, 36.026]
  - - [5056, 704, 1, 256]
    - [18, 37.817]
  - - [5888, 704, 1, 256]
    - [18, 39.485]
  - - [6784, 704, 1, 256]
    - [18, 41.38]
  - - [256, 1024, 1, 256]
    - [8, 11.017]
  - - [448, 1024, 1, 256]
    - [8, 17.585]
  - - [704, 1024, 1, 256]
    - [8, 21.589]
  - - [1024, 1024, 1, 256]
    - [18, 25.122]
  - - [1408, 1024, 1, 256]
    - [18, 34.115]
  - - [1856, 1024, 1, 256]
    - [18, 36.352]
  - - [2368, 1024, 1, 256]
    - [18, 37.601]
  - - [2944, 1024, 1, 256]
    - [18, 36.023]
  - - [3584, 1024, 1, 256]
    - [18, 38.649]
  - - [4288, 1024, 1, 256]
    - [18, 41.662]
  - - [5056, 1024, 1, 256]
    - [18, 41.311]
  - - [5888, 1024, 1, 256]
    - [18, 41.3]
  - - [6784, 1024, 1, 256]
    - [18, 41.659]
  - - [256, 1408, 1, 256]
    - [8, 13.928]
  - - [448, 1408, 1, 256]
    - [8, 18.83]
  - - [704, 1408, 1, 256]
    - [17, 24.11]
  - - [1024, 1408, 1, 256]
    - [18, 33.783]
  - - [1408, 1408, 1, 256]
    - [18, 31.145]
  - - [1856, 1408, 1, 256]
    - [18, 35.523]
  - - [2368, 1408, 1, 256]
    - [18, 39.691]
  - - [2944, 1408, 1, 256]
    - [18, 39.485]
  - - [3584, 1408, 1, 256]
    - [18, 40.23]
  - - [4288, 1408, 1, 256]
    - [18, 41.356]
  - - [5056, 1408, 1, 256]
    - [18, 42.611]
  - - [5888, 1408, 1, 256]
    - [18, 44.064]
  - - [6784, 1408, 1, 256]
    - [18, 43.692]
  - - [256, 1856, 1, 256]
    - [8, 18.142]
  - - [448, 1856, 1, 256]
    - [18, 24.517]
  - - [704, 1856, 1, 256]
    - [18, 31.07]
  - - [1024, 1856, 1, 256]
    - [18, 35.924]
  - - [1408, 1856, 1, 256]
    - [18, 35.421]
  - - [1856, 1856, 1, 256]
    - [18, 36.556]
  - - [2368, 1856, 1, 256]
    - [18, 41.782]
  - - [2944, 1856, 1, 256]
    - [18, 40.308]
  - - [3584, 1856, 1, 256]
    - [18, 42.554]
  - - [4288, 1856, 1, 256]
    - [18, 42.488]
  - - [5056, 1856, 1, 256]
    - [18, 42.923]
  - - [5888, 1856, 1, 256]
    - [18, 43.8]
  - - [6784, 1856, 1, 256]
    - [18, 44.77]
  - - [256, 2368, 1, 256]
    - [8, 18.441]
  - - [448, 2368, 1, 256]
    - [17, 25.673]
  - - [704, 2368, 1, 256]
    - [17, 32.079]
  - - [1024, 2368, 1, 256]
    - [18, 37.478]
  - - [1408, 2368, 1, 256]
    - [18, 39.64]
  - - [1856, 2368, 1, 256]
    - [18, 41.782]
  - - [2368, 2368, 1, 256]
    - [18, 41.335]
  - - [2944, 2368, 1, 256]
    - [18, 41.755]
  - - [3584, 2368, 1, 256]
    - [18, 42.737]
  - - [4288, 2368, 1, 256]
    - [18, 44.291]
  - - [5056, 2368, 1, 256]
    - [18, 44.333]
  - - [5888, 2368, 1, 256]
    - [18, 44.701]
  - - [6784, 2368, 1, 256]
    - [18, 45.384]
  - - [256, 2944, 1, 256]
    - [8, 22.223]
  - - [448, 2944, 1, 256]
    - [17, 31.13]
  - - [704, 2944, 1, 256]
    - [18, 32.244]
  - - [1024, 2944, 1, 256]
    - [18, 36.158]
  - - [1408, 2944, 1, 256]
    - [18, 39.407]
  - - [1856, 2944, 1, 256]
    - [18, 40.308]
  - - [2368, 2944, 1, 256]
    - [18, 41.755]
  - - [2944, 2944, 1, 256]
    - [18, 43.737]
  - - [3584, 2944, 1, 256]
    - [18, 44.019]
  - - [4288, 2944, 1, 256]
    - [18, 44.788]
  - - [5056, 2944, 1, 256]
    - [18, 44.686]
  - - [5888, 2944, 1, 256]
    - [18, 45.091]
  - - [6784, 2944, 1, 256]
    - [18, 45.744]
  - - [256, 3584, 1, 256]
    - [18, 26.805]
  - - [448, 3584, 1, 256]
    - [18, 30.959]
  - - [704, 3584, 1, 256]
    - [18, 34.103]
  - - [1024, 3584, 1, 256]
    - [18, 38.82]
  - - [1408, 3584, 1, 256]
    - [18, 40.23]
  - - [1856, 3584, 1, 256]
    - [18, 42.497]
  - - [2368, 3584, 1, 256]
    - [18, 42.896]
  - - [2944, 3584, 1, 256]
    - [18, 44.019]
  - - [3584, 3584, 1, 256]
    - [18, 44.135]
  - - [4288, 3584, 1, 256]
    - [18, 44.803]
  - - [5056, 3584, 1, 256]
    - [18, 45.83]
  - - [5888, 3584, 1, 256]
    - [18, 46.085]
  - - [6784, 3584, 1, 256]
    - [18, 45.884]
  - - [256, 4288, 1, 256]
    - [18, 25.973]
  - - [448, 4288, 1, 256]
    - [18, 36.454]
  - - [704, 4288, 1, 256]
    - [18, 36.116]
  - - [1024, 4288, 1, 256]
    - [18, 41.455]
  - - [1408, 4288, 1, 256]
    - [18, 41.297]
  - - [1856, 4288, 1, 256]
    - [18, 42.488]
  - - [2368, 4288, 1, 256]
    - [18, 44.07]
  - - [2944, 4288, 1, 256]
    - [18, 44.788]
  - - [3584, 4288, 1, 256]
    - [18, 44.872]
  - - [4288, 4288, 1, 256]
    - [18, 45.354]
  - - [5056, 4288, 1, 256]
    - [18, 45.381]
  - - [5888, 4288, 1, 256]
    - [20, 45.884]
  - - [6784, 4288, 1, 256]
    - [18, 46.007]
  - - [256, 5056, 1, 256]
    - [18, 30.402]
  - - [448, 5056, 1, 256]
    - [18, 34.897]
  - - [704, 5056, 1, 256]
    - [18, 37.607]
  - - [1024, 5056, 1, 256]
    - [18, 41.276]
  - - [1408, 5056, 1, 256]
    - [18, 42.665]
  - - [1856, 5056, 1, 256]
    - [18, 43.027]
  - - [2368, 5056, 1, 256]
    - [18, 44.297]
  - - [2944, 5056, 1, 256]
    - [18, 44.8]
  - - [3584, 5056, 1, 256]
    - [18, 45.89]
  - - [4288, 5056, 1, 256]
    - [18, 45.423]
  - - [5056, 5056, 1, 256]
    - [18, 45.711]
  - - [5888, 5056, 1, 256]
    - [18, 46.268]
  - - [6784, 5056, 1, 256]
    - [20, 46.735]
  - - [256, 5888, 1, 256]
    - [17, 29.3]
  - - [448, 5888, 1, 256]
    - [18, 35.454]
  - - [704, 5888, 1, 256]
    - [18, 39.407]
  - - [1024, 5888, 1, 256]
    - [18, 41.093]
  - - [1408, 5888, 1, 256]
    - [18, 44.088]
  - - [1856, 5888, 1, 256]
    - [18, 43.8]
  - - [2368, 5888, 1, 256]
    - [18, 44.791]
  - - [2944, 5888, 1, 256]
    - [18, 45.151]
  - - [3584, 5888, 1, 256]
    - [18, 46.097]
  - - [4288, 5888, 1, 256]
    - [18, 45.911]
  - - [5056, 5888, 1, 256]
    - [18, 46.214]
  - - [5888, 5888, 1, 256]
    - [18, 46.432]
  - - [6784, 5888, 1, 256]
    - [20, 46.573]
  - - [256, 6784, 1, 256]
    - [18, 33.022]
  - - [448, 6784, 1, 256]
    - [18, 36.271]
  - - [704, 6784, 1, 256]
    - [18, 41.494]
  - - [1024, 6784, 1, 256]
    - [18, 41.71]
  - - [1408, 6784, 1, 256]
    - [18, 43.546]
  - - [1856, 6784, 1, 256]
    - [18, 44.788]
  - - [2368, 6784, 1, 256]
    - [18, 45.399]
  - - [2944, 6784, 1, 256]
    - [18, 45.732]
  - - [3584, 6784, 1, 256]
    - [19, 45.902]
  - - [4288, 6784, 1, 256]
    - [19, 46.04]
  - - [5056, 6784, 1, 256]
    - [19, 46.669]
  - - [5888, 6784, 1, 256]
    - [20, 46.591]
  - - [6784, 6784, 1, 256]
    - [20, 46.9]
  - - [704, 256, 1, 1280]
    - [8, 9.334]
  - - [1024, 256, 1, 1280]
    - [8, 13.335]
  - - [1408, 256, 1, 1280]
    - [8, 17.953]
  - - [1856, 256, 1, 1280]
    - [14, 23.089]
  - - [2368, 256, 1, 1280]
    - [8, 22.071]
  - - [2944, 256, 1, 1280]
    - [14, 26.97]
  - - [3584, 256, 1, 1280]
    - [17, 32.232]
  - - [4288, 256, 1, 1280]
    - [17, 30.65]
  - - [5056, 256, 1, 1280]
    - [17, 35.58]
  - - [5888, 256, 1, 1280]
    - [17, 32.783]
  - - [6784, 256, 1, 1280]
    - [17, 37.433]
  - - [704, 448, 1, 1280]
    - [8, 15.71]
  - - [1024, 448, 1, 1280]
    - [8, 22.475]
  - - [1408, 448, 1, 1280]
    - [8, 22.897]
  - - [1856, 448, 1, 1280]
    - [17, 29.402]
  - - [2368, 448, 1, 1280]
    - [17, 29.587]
  - - [2944, 448, 1, 1280]
    - [17, 36.7]
  - - [3584, 448, 1, 1280]
    - [17, 35.355]
  - - [4288, 448, 1, 1280]
    - [17, 41.839]
  - - [5056, 448, 1, 1280]
    - [17, 38.913]
  - - [5888, 448, 1, 1280]
    - [17, 38.652]
  - - [6784, 448, 1, 1280]
    - [17, 38.979]
  - - [256, 704, 1, 1280]
    - [8, 9.274]
  - - [448, 704, 1, 1280]
    - [8, 15.692]
  - - [704, 704, 1, 1280]
    - [8, 18.408]
  - - [1024, 704, 1, 1280]
    - [8, 26.129]
  - - [1408, 704, 1, 1280]
    - [17, 27.743]
  - - [1856, 704, 1, 1280]
    - [17, 36.209]
  - - [2368, 704, 1, 1280]
    - [17, 36.592]
  - - [2944, 704, 1, 1280]
    - [17, 35.747]
  - - [3584, 704, 1, 1280]
    - [17, 37.107]
  - - [4288, 704, 1, 1280]
    - [18, 38.769]
  - - [5056, 704, 1, 1280]
    - [17, 40.482]
  - - [5888, 704, 1, 1280]
    - [18, 41.973]
  - - [6784, 704, 1, 1280]
    - [18, 44.007]
  - - [256, 1024, 1, 1280]
    - [14, 13.32]
  - - [448, 1024, 1, 1280]
    - [8, 22.316]
  - - [704, 1024, 1, 1280]
    - [8, 26.188]
  - - [1024, 1024, 1, 1280]
    - [17, 29.108]
  - - [1408, 1024, 1, 1280]
    - [17, 39.724]
  - - [1856, 1024, 1, 1280]
    - [17, 41.186]
  - - [2368, 1024, 1, 1280]
    - [17, 41.554]
  - - [2944, 1024, 1, 1280]
    - [18, 38.736]
  - - [3584, 1024, 1, 1280]
    - [18, 41.632]
  - - [4288, 1024, 1, 1280]
    - [18, 44.441]
  - - [5056, 1024, 1, 1280]
    - [18, 43.614]
  - - [5888, 1024, 1, 1280]
    - [18, 43.318]
  - - [6784, 1024, 1, 1280]
    - [18, 43.477]
  - - [256, 1408, 1, 1280]
    - [8, 17.806]
  - - [448, 1408, 1, 1280]
    - [8, 22.915]
  - - [704, 1408, 1, 1280]
    - [17, 27.71]
  - - [1024, 1408, 1, 1280]
    - [17, 39.545]
  - - [1408, 1408, 1, 1280]
    - [17, 34.343]
  - - [1856, 1408, 1, 1280]
    - [18, 38.398]
  - - [2368, 1408, 1, 1280]
    - [18, 42.737]
  - - [2944, 1408, 1, 1280]
    - [17, 42.078]
  - - [3584, 1408, 1, 1280]
    - [18, 42.545]
  - - [4288, 1408, 1, 1280]
    - [18, 43.378]
  - - [5056, 1408, 1, 1280]
    - [18, 44.594]
  - - [5888, 1408, 1, 1280]
    - [18, 45.953]
  - - [6784, 1408, 1, 1280]
    - [18, 45.381]
  - - [256, 1856, 1, 1280]
    - [14, 23.137]
  - - [448, 1856, 1, 1280]
    - [14, 29.489]
  - - [704, 1856, 1, 1280]
    - [17, 36.23]
  - - [1024, 1856, 1, 1280]
    - [17, 40.853]
  - - [1408, 1856, 1, 1280]
    - [18, 38.446]
  - - [1856, 1856, 1, 1280]
    - [17, 39.344]
  - - [2368, 1856, 1, 1280]
    - [18, 44.588]
  - - [2944, 1856, 1, 1280]
    - [18, 42.461]
  - - [3584, 1856, 1, 1280]
    - [18, 44.528]
  - - [4288, 1856, 1, 1280]
    - [18, 44.294]
  - - [5056, 1856, 1, 1280]
    - [18, 44.672]
  - - [5888, 1856, 1, 1280]
    - [18, 45.345]
  - - [6784, 1856, 1, 1280]
    - [18, 46.316]
  - - [256, 2368, 1, 1280]
    - [14, 22.071]
  - - [448, 2368, 1, 1280]
    - [17, 29.381]
  - - [704, 2368, 1, 1280]
    - [17, 36.475]
  - - [1024, 2368, 1, 1280]
    - [17, 41.392]
  - - [1408, 2368, 1, 1280]
    - [18, 42.749]
  - - [1856, 2368, 1, 1280]
    - [18, 44.531]
  - - [2368, 2368, 1, 1280]
    - [18, 43.56]
  - - [2944, 2368, 1, 1280]
    - [18, 43.716]
  - - [3584, 2368, 1, 1280]
    - [18, 44.71]
  - - [4288, 2368, 1, 1280]
    - [18, 46.034]
  - - [5056, 2368, 1, 1280]
    - [18, 45.848]
  - - [5888, 2368, 1, 1280]
    - [18, 46.19]
  - - [6784, 2368, 1, 1280]
    - [18, 46.792]
  - - [256, 2944, 1, 1280]
    - [14, 26.671]
  - - [448, 2944, 1, 1280]
    - [17, 36.256]
  - - [704, 2944, 1, 1280]
    - [17, 35.481]
  - - [1024, 2944, 1, 1280]
    - [18, 38.652]
  - - [1408, 2944, 1, 1280]
    - [18, 42.027]
  - - [1856, 2944, 1, 1280]
    - [18, 42.509]
  - - [2368, 2944, 1, 1280]
    - [18, 43.785]
  - - [2944, 2944, 1, 1280]
    - [18, 45.57]
  - - [3584, 2944, 1, 1280]
    - [18, 45.744]
  - - [4288, 2944, 1, 1280]
    - [18, 46.531]
  - - [5056, 2944, 1, 1280]
    - [18, 46.211]
  - - [5888, 2944, 1, 1280]
    - [20, 46.474]
  - - [6784, 2944, 1, 1280]
    - [18, 47.031]
  - - [256, 3584, 1, 1280]
    - [18, 31.857]
  - - [448, 3584, 1, 1280]
    - [17, 35.002]
  - - [704, 3584, 1, 1280]
    - [18, 37.131]
  - - [1024, 3584, 1, 1280]
    - [18, 41.632]
  - - [1408, 3584, 1, 1280]
    - [18, 42.47]
  - - [1856, 3584, 1, 1280]
    - [18, 44.591]
  - - [2368, 3584, 1, 1280]
    - [18, 44.722]
  - - [2944, 3584, 1, 1280]
    - [18, 45.741]
  - - [3584, 3584, 1, 1280]
    - [18, 45.654]
  - - [4288, 3584, 1, 1280]
    - [18, 46.202]
  - - [5056, 3584, 1, 1280]
    - [18, 47.235]
  - - [5888, 3584, 1, 1280]
    - [18, 47.421]
  - - [6784, 3584, 1, 1280]
    - [20, 47.235]
  - - [256, 4288, 1, 1280]
    - [17, 30.21]
  - - [448, 4288, 1, 1280]
    - [18, 41.129]
  - - [704, 4288, 1, 1280]
    - [18, 38.715]
  - - [1024, 4288, 1, 1280]
    - [18, 44.507]
  - - [1408, 4288, 1, 1280]
    - [18, 43.429]
  - - [1856, 4288, 1, 1280]
    - [18, 44.321]
  - - [2368, 4288, 1, 1280]
    - [18, 46.052]
  - - [2944, 4288, 1, 1280]
    - [18, 46.516]
  - - [3584, 4288, 1, 1280]
    - [18, 46.286]
  - - [4288, 4288, 1, 1280]
    - [18, 46.72]
  - - [5056, 4288, 1, 1280]
    - [18, 46.675]
  - - [5888, 4288, 1, 1280]
    - [20, 47.22]
  - - [6784, 4288, 1, 1280]
    - [20, 47.223]
  - - [256, 5056, 1, 1280]
    - [17, 35.277]
  - - [448, 5056, 1, 1280]
    - [18, 38.595]
  - - [704, 5056, 1, 1280]
    - [18, 40.443]
  - - [1024, 5056, 1, 1280]
    - [18, 43.65]
  - - [1408, 5056, 1, 1280]
    - [18, 44.624]
  - - [1856, 5056, 1, 1280]
    - [18, 44.621]
  - - [2368, 5056, 1, 1280]
    - [18, 45.86]
  - - [2944, 5056, 1, 1280]
    - [18, 46.211]
  - - [3584, 5056, 1, 1280]
    - [18, 47.235]
  - - [4288, 5056, 1, 1280]
    - [18, 46.678]
  - - [5056, 5056, 1, 1280]
    - [18, 46.84]
  - - [5888, 5056, 1, 1280]
    - [18, 47.406]
  - - [6784, 5056, 1, 1280]
    - [20, 47.87]
  - - [256, 5888, 1, 1280]
    - [17, 32.768]
  - - [448, 5888, 1, 1280]
    - [18, 38.58]
  - - [704, 5888, 1, 1280]
    - [18, 42.027]
  - - [1024, 5888, 1, 1280]
    - [18, 43.306]
  - - [1408, 5888, 1, 1280]
    - [18, 46.067]
  - - [1856, 5888, 1, 1280]
    - [18, 45.378]
  - - [2368, 5888, 1, 1280]
    - [18, 46.211]
  - - [2944, 5888, 1, 1280]
    - [19, 46.477]
  - - [3584, 5888, 1, 1280]
    - [18, 47.403]
  - - [4288, 5888, 1, 1280]
    - [19, 47.109]
  - - [5056, 5888, 1, 1280]
    - [18, 47.397]
  - - [5888, 5888, 1, 1280]
    - [18, 47.543]
  - - [6784, 5888, 1, 1280]
    - [20, 47.684]
  - - [256, 6784, 1, 1280]
    - [17, 37.332]
  - - [448, 6784, 1, 1280]
    - [18, 38.874]
  - - [704, 6784, 1, 1280]
    - [18, 43.797]
  - - [1024, 6784, 1, 1280]
    - [18, 43.471]
  - - [1408, 6784, 1, 1280]
    - [18, 45.372]
  - - [1856, 6784, 1, 1280]
    - [18, 46.399]
  - - [2368, 6784, 1, 1280]
    - [18, 46.891]
  - - [2944, 6784, 1, 1280]
    - [18, 47.058]
  - - [3584, 6784, 1, 1280]
    - [20, 47.199]
  - - [4288, 6784, 1, 1280]
    - [19, 47.184]
  - - [5056, 6784, 1, 1280]
    - [19, 47.825]
  - - [5888, 6784, 1, 1280]
    - [19, 47.663]
  - - [6784, 6784, 1, 1280]
    - [19, 47.933]
  - - [704, 256, 1, 3328]
    - [14, 9.67]
  - - [1024, 256, 1, 3328]
    - [8, 13.826]
  - - [1408, 256, 1, 3328]
    - [8, 18.774]
  - - [1856, 256, 1, 3328]
    - [14, 24.449]
  - - [2368, 256, 1, 3328]
    - [14, 22.948]
  - - [2944, 256, 1, 3328]
    - [14, 27.91]
  - - [3584, 256, 1, 3328]
    - [18, 33.169]
  - - [4288, 256, 1, 3328]
    - [17, 31.115]
  - - [5056, 256, 1, 3328]
    - [17, 36.565]
  - - [5888, 256, 1, 3328]
    - [17, 33.669]
  - - [6784, 256, 1, 3328]
    - [17, 38.586]
  - - [704, 448, 1, 3328]
    - [8, 16.447]
  - - [1024, 448, 1, 3328]
    - [14, 23.733]
  - - [1408, 448, 1, 3328]
    - [8, 23.936]
  - - [1856, 448, 1, 3328]
    - [14, 30.8]
  - - [2368, 448, 1, 3328]
    - [17, 30.339]
  - - [2944, 448, 1, 3328]
    - [17, 37.427]
  - - [3584, 448, 1, 3328]
    - [17, 35.834]
  - - [4288, 448, 1, 3328]
    - [17, 42.327]
  - - [5056, 448, 1, 3328]
    - [18, 39.404]
  - - [5888, 448, 1, 3328]
    - [18, 39.269]
  - - [6784, 448, 1, 3328]
    - [18, 39.506]
  - - [256, 704, 1, 3328]
    - [14, 9.658]
  - - [448, 704, 1, 3328]
    - [8, 16.378]
  - - [704, 704, 1, 3328]
    - [14, 18.98]
  - - [1024, 704, 1, 3328]
    - [14, 27.198]
  - - [1408, 704, 1, 3328]
    - [17, 28.452]
  - - [1856, 704, 1, 3328]
    - [17, 37.053]
  - - [2368, 704, 1, 3328]
    - [17, 37.2]
  - - [2944, 704, 1, 3328]
    - [17, 36.346]
  - - [3584, 704, 1, 3328]
    - [18, 37.685]
  - - [4288, 704, 1, 3328]
    - [18, 39.272]
  - - [5056, 704, 1, 3328]
    - [18, 40.925]
  - - [5888, 704, 1, 3328]
    - [18, 42.479]
  - - [6784, 704, 1, 3328]
    - [18, 44.339]
  - - [256, 1024, 1, 3328]
    - [8, 13.82]
  - - [448, 1024, 1, 3328]
    - [14, 23.607]
  - - [704, 1024, 1, 3328]
    - [14, 27.207]
  - - [1024, 1024, 1, 3328]
    - [14, 29.941]
  - - [1408, 1024, 1, 3328]
    - [17, 40.656]
  - - [1856, 1024, 1, 3328]
    - [17, 42.018]
  - - [2368, 1024, 1, 3328]
    - [18, 42.207]
  - - [2944, 1024, 1, 3328]
    - [18, 39.248]
  - - [3584, 1024, 1, 3328]
    - [18, 42.249]
  - - [4288, 1024, 1, 3328]
    - [18, 45.049]
  - - [5056, 1024, 1, 3328]
    - [18, 43.998]
  - - [5888, 1024, 1, 3328]
    - [18, 43.719]
  - - [6784, 1024, 1, 3328]
    - [18, 43.905]
  - - [256, 1408, 1, 3328]
    - [8, 18.78]
  - - [448, 1408, 1, 3328]
    - [14, 23.9]
  - - [704, 1408, 1, 3328]
    - [17, 28.485]
  - - [1024, 1408, 1, 3328]
    - [17, 40.446]
  - - [1408, 1408, 1, 3328]
    - [17, 34.978]
  - - [1856, 1408, 1, 3328]
    - [18, 39.062]
  - - [2368, 1408, 1, 3328]
    - [18, 43.336]
  - - [2944, 1408, 1, 3328]
    - [18, 42.563]
  - - [3584, 1408, 1, 3328]
    - [18, 42.941]
  - - [4288, 1408, 1, 3328]
    - [18, 43.713]
  - - [5056, 1408, 1, 3328]
    - [18, 44.971]
  - - [5888, 1408, 1, 3328]
    - [18, 46.361]
  - - [6784, 1408, 1, 3328]
    - [18, 45.681]
  - - [256, 1856, 1, 3328]
    - [14, 24.389]
  - - [448, 1856, 1, 3328]
    - [14, 30.483]
  - - [704, 1856, 1, 3328]
    - [17, 36.918]
  - - [1024, 1856, 1, 3328]
    - [18, 41.874]
  - - [1408, 1856, 1, 3328]
    - [18, 39.045]
  - - [1856, 1856, 1, 3328]
    - [18, 39.802]
  - - [2368, 1856, 1, 3328]
    - [18, 45.064]
  - - [2944, 1856, 1, 3328]
    - [18, 42.848]
  - - [3584, 1856, 1, 3328]
    - [18, 44.929]
  - - [4288, 1856, 1, 3328]
    - [18, 44.564]
  - - [5056, 1856, 1, 3328]
    - [18, 44.968]
  - - [5888, 1856, 1, 3328]
    - [18, 45.63]
  - - [6784, 1856, 1, 3328]
    - [18, 46.624]
  - - [256, 2368, 1, 3328]
    - [8, 22.99]
  - - [448, 2368, 1, 3328]
    - [17, 30.27]
  - - [704, 2368, 1, 3328]
    - [17, 36.876]
  - - [1024, 2368, 1, 3328]
    - [18, 42.219]
  - - [1408, 2368, 1, 3328]
    - [18, 43.318]
  - - [1856, 2368, 1, 3328]
    - [18, 45.061]
  - - [2368, 2368, 1, 3328]
    - [18, 43.941]
  - - [2944, 2368, 1, 3328]
    - [18, 44.135]
  - - [3584, 2368, 1, 3328]
    - [18, 45.04]
  - - [4288, 2368, 1, 3328]
    - [18, 46.352]
  - - [5056, 2368, 1, 3328]
    - [18, 46.076]
  - - [5888, 2368, 1, 3328]
    - [18, 46.444]
  - - [6784, 2368, 1, 3328]
    - [18, 47.148]
  - - [256, 2944, 1, 3328]
    - [14, 27.826]
  - - [448, 2944, 1, 3328]
    - [17, 37.2]
  - - [704, 2944, 1, 3328]
    - [18, 36.113]
  - - [1024, 2944, 1, 3328]
    - [18, 39.272]
  - - [1408, 2944, 1, 3328]
    - [18, 42.587]
  - - [1856, 2944, 1, 3328]
    - [18, 42.872]
  - - [2368, 2944, 1, 3328]
    - [18, 44.103]
  - - [2944, 2944, 1, 3328]
    - [18, 45.953]
  - - [3584, 2944, 1, 3328]
    - [18, 46.085]
  - - [4288, 2944, 1, 3328]
    - [18, 46.807]
  - - [5056, 2944, 1, 3328]
    - [18, 46.474]
  - - [5888, 2944, 1, 3328]
    - [20, 46.756]
  - - [6784, 2944, 1, 3328]
    - [18, 47.331]
  - - [256, 3584, 1, 3328]
    - [18, 33.091]
  - - [448, 3584, 1, 3328]
    - [17, 35.553]
  - - [704, 3584, 1, 3328]
    - [18, 37.643]
  - - [1024, 3584, 1, 3328]
    - [18, 42.288]
  - - [1408, 3584, 1, 3328]
    - [18, 42.935]
  - - [1856, 3584, 1, 3328]
    - [18, 44.965]
  - - [2368, 3584, 1, 3328]
    - [18, 45.01]
  - - [2944, 3584, 1, 3328]
    - [18, 46.016]
  - - [3584, 3584, 1, 3328]
    - [18, 45.908]
  - - [4288, 3584, 1, 3328]
    - [20, 46.516]
  - - [5056, 3584, 1, 3328]
    - [18, 47.448]
  - - [5888, 3584, 1, 3328]
    - [18, 47.672]
  - - [6784, 3584, 1, 3328]
    - [20, 47.394]
  - - [256, 4288, 1, 3328]
    - [17, 31.109]
  - - [448, 4288, 1, 3328]
    - [18, 41.97]
  - - [704, 4288, 1, 3328]
    - [18, 39.275]
  - - [1024, 4288, 1, 3328]
    - [18, 45.004]
  - - [1408, 4288, 1, 3328]
    - [18, 43.758]
  - - [1856, 4288, 1, 3328]
    - [18, 44.597]
  - - [2368, 4288, 1, 3328]
    - [18, 46.334]
  - - [2944, 4288, 1, 3328]
    - [18, 46.78]
  - - [3584, 4288, 1, 3328]
    - [20, 46.486]
  - - [4288, 4288, 1, 3328]
    - [20, 46.921]
  - - [5056, 4288, 1, 3328]
    - [18, 46.903]
  - - [5888, 4288, 1, 3328]
    - [20, 47.433]
  - - [6784, 4288, 1, 3328]
    - [20, 47.385]
  - - [256, 5056, 1, 3328]
    - [17, 36.505]
  - - [448, 5056, 1, 3328]
    - [18, 39.362]
  - - [704, 5056, 1, 3328]
    - [18, 40.967]
  - - [1024, 5056, 1, 3328]
    - [18, 44.079]
  - - [1408, 5056, 1, 3328]
    - [18, 45.013]
  - - [1856, 5056, 1, 3328]
    - [18, 44.905]
  - - [2368, 5056, 1, 3328]
    - [18, 46.079]
  - - [2944, 5056, 1, 3328]
    - [18, 46.432]
  - - [3584, 5056, 1, 3328]
    - [18, 47.442]
  - - [4288, 5056, 1, 3328]
    - [18, 46.834]
  - - [5056, 5056, 1, 3328]
    - [18, 47.019]
  - - [5888, 5056, 1, 3328]
    - [18, 47.573]
  - - [6784, 5056, 1, 3328]
    - [20, 47.969]
  - - [256, 5888, 1, 3328]
    - [18, 33.142]
  - - [448, 5888, 1, 3328]
    - [18, 39.308]
  - - [704, 5888, 1, 3328]
    - [18, 42.506]
  - - [1024, 5888, 1, 3328]
    - [18, 43.707]
  - - [1408, 5888, 1, 3328]
    - [18, 46.408]
  - - [1856, 5888, 1, 3328]
    - [18, 45.672]
  - - [2368, 5888, 1, 3328]
    - [18, 46.459]
  - - [2944, 5888, 1, 3328]
    - [20, 46.714]
  - - [3584, 5888, 1, 3328]
    - [18, 47.672]
  - - [4288, 5888, 1, 3328]
    - [18, 47.286]
  - - [5056, 5888, 1, 3328]
    - [18, 47.57]
  - - [5888, 5888, 1, 3328]
    - [18, 47.684]
  - - [6784, 5888, 1, 3328]
    - [20, 47.756]
  - - [256, 6784, 1, 3328]
    - [18, 38.05]
  - - [448, 6784, 1, 3328]
    - [18, 39.482]
  - - [704, 6784, 1, 3328]
    - [18, 44.411]
  - - [1024, 6784, 1, 3328]
    - [18, 43.938]
  - - [1408, 6784, 1, 3328]
    - [18, 45.681]
  - - [1856, 6784, 1, 3328]
    - [18, 46.606]
  - - [2368, 6784, 1, 3328]
    - [18, 47.088]
  - - [2944, 6784, 1, 3328]
    - [18, 47.292]
  - - [3584, 6784, 1, 3328]
    - [19, 47.382]
  - - [4288, 6784, 1, 3328]
    - [19, 47.352]
  - - [5056, 6784, 1, 3328]
    - [19, 47.903]
  - - [5888, 6784, 1, 3328]
    - [19, 47.75]
  - - [6784, 6784, 1, 3328]
    - [20, 48.082]
  - - [1024, 1024, 1, 1024]
    - [64, 37.355]
  - - [1760, 800, 1, 1760]
    - [8, 36.334]
  - - [1760, 1600, 1, 1760]
    - [18, 41.503]
  - - [1760, 3200, 1, 1760]
    - [18, 43.902]
  - - [1760, 6400, 1, 1760]
    - [18, 44.938]
  - - [2048, 800, 1, 2048]
    - [18, 35.795]
  - - [2048, 1600, 1, 2048]
    - [18, 42.405]
  - - [2048, 3200, 1, 2048]
    - [18, 44.141]
  - - [2048, 6400, 1, 2048]
    - [18, 46.717]
  - - [2560, 800, 1, 2560]
    - [18, 35.619]
  - - [2560, 1600, 1, 2560]
    - [18, 42.006]
  - - [2560, 3200, 1, 2560]
    - [18, 45.86]
  - - [2560, 6400, 1, 2560]
    - [18, 46.654]
  - - [2048, 400, 1, 512]
    - [8, 27.024]
  - - [2048, 800, 1, 512]
    - [18, 32.507]
  - - [2048, 1600, 1, 512]
    - [18, 38.413]
  - - [2048, 3200, 1, 512]
    - [20, 42.536]
  - - [4096, 400, 1, 1024]
    - [18, 35.026]
  - - [4096, 800, 1, 1024]
    - [18, 41.632]
  - - [4096, 1600, 1, 1024]
    - [18, 43.794]
  - - [4096, 3200, 1, 1024]
    - [18, 46.444]
  - - [8192, 400, 1, 2048]
    - [18, 37.46]
  - - [8192, 800, 1, 2048]
    - [18, 44.058]
  - - [8192, 1600, 1, 2048]
    - [18, 46.684]
  - - [8192, 3200, 1, 2048]
    - [19, 47.358]
  - - [16384, 400, 1, 4096]
    - [18, 41.485]
  - - [16384, 800, 1, 4096]
    - [18, 45.181]
  - - [16384, 1600, 1, 4096]
    - [20, 47.337]
  - - [16384, 3200, 1, 4096]
    - [18, 48.002]
  - - [8448, 48000, 1, 2816]
    - [20, 48.562]
  - - [8448, 24000, 1, 2816]
    - [20, 48.388]
  - - [8448, 12000, 1, 2816]
    - [18, 48.07]
  - - [8448, 5984, 1, 2816]
    - [20, 47.69]
  - - [6144, 48000, 1, 2048]
    - [19, 48.535]
  - - [6144, 24000, 1, 2048]
    - [20, 48.475]
  - - [6144, 12000, 1, 2048]
    - [18, 47.864]
  - - [6144, 5984, 1, 2048]
    - [20, 47.34]
  - - [4608, 48000, 1, 1536]
    - [19, 48.553]
  - - [4608, 24000, 1, 1536]
    - [20, 48.193]
  - - [4608, 12000, 1, 1536]
    - [18, 47.789]
  - - [4608, 5984, 1, 1536]
    - [18, 47.025]
  - - [7680, 48000, 1, 2560]
    - [20, 48.598]
  - - [7680, 24000, 1, 2560]
    - [19, 48.445]
  - - [7680, 12000, 1, 2560]
    - [20, 48.25]
  - - [7680, 5984, 1, 2560]
    - [20, 47.966]
  - - [1024, 700, 1, 512]
    - [8, 23.933]
  - - [512, 24000, 1, 1536]
    - [18, 47.025]
  - - [1760, 7000, 1, 1760]
    - [18, 45.465]
  - - [512, 24000, 1, 2048]
    - [18, 47.121]
  - - [2048, 7000, 1, 2048]
    - [18, 46.067]
  - - [512, 24000, 1, 2560]
    - [18, 47.211]
  - - [512, 24000, 1, 2816]
    - [18, 47.178]
  - - [512, 48000, 1, 1536]
    - [20, 47.747]
  - - [1024, 24000, 1, 1536]
    - [20, 47.72]
  - - [2560, 7000, 1, 2560]
    - [18, 46.918]
  - - [512, 48000, 1, 2048]
    - [20, 47.783]
  - - [1024, 24000, 1, 2048]
    - [20, 47.876]
  - - [512, 48000, 1, 2560]
    - [20, 47.822]
  - - [1024, 24000, 1, 2560]
    - [20, 47.849]
  - - [512, 48000, 1, 2816]
    - [20, 47.879]
  - - [1024, 24000, 1, 2816]
    - [20, 47.852]
  - - [1024, 48000, 1, 1536]
    - [20, 48.19]
  - - [3072, 24000, 1, 1024]
    - [20, 48.184]
  - - [5124, 9124, 1, 1760]
    - [18, 47.109]
  - - [5124, 9124, 1, 2048]
    - [18, 47.142]
  - - [1024, 48000, 1, 2048]
    - [20, 48.175]
  - - [4096, 7000, 1, 4096]
    - [18, 47.397]
  - - [5124, 9124, 1, 2560]
    - [18, 47.181]
  - - [1024, 48000, 1, 2560]
    - [20, 48.25]
  - - [1024, 48000, 1, 2816]
    - [20, 48.187]
  - - [3072, 48000, 1, 1024]
    - [19, 48.337]
  - - [5124, 9124, 1, 4096]
    - [18, 47.226]
  - - [6144, 24000, 1, 2560]
    - [20, 48.475]
  - - [6144, 48000, 1, 2560]
    - [20, 48.586]
  - - [32, 32, 1, 32]
    - [22, 0.009]
  - - [32, 64, 1, 256]
    - [30, 0.036]
  - - [32, 128, 1, 256]
    - [30, 0.072]
  - - [32, 256, 1, 256]
    - [25, 0.156]
  - - [32, 448, 1, 256]
    - [30, 0.261]
  - - [32, 704, 1, 256]
    - [29, 0.416]
  - - [32, 1024, 1, 256]
    - [30, 0.596]
  - - [32, 1408, 1, 256]
    - [22, 0.818]
  - - [32, 1856, 1, 256]
    - [33, 1.09]
  - - [32, 2368, 1, 256]
    - [30, 1.372]
  - - [32, 2944, 1, 256]
    - [22, 1.722]
  - - [32, 3584, 1, 256]
    - [33, 2.105]
  - - [32, 4288, 1, 256]
    - [30, 2.504]
  - - [32, 5056, 1, 256]
    - [30, 2.914]
  - - [32, 5888, 1, 256]
    - [25, 3.246]
  - - [32, 6784, 1, 256]
    - [30, 4.342]
  - - [32, 64, 1, 1280]
    - [30, 0.048]
  - - [32, 128, 1, 1280]
    - [30, 0.093]
  - - [32, 256, 1, 1280]
    - [30, 0.189]
  - - [32, 448, 1, 1280]
    - [30, 0.329]
  - - [32, 704, 1, 1280]
    - [30, 0.521]
  - - [32, 1024, 1, 1280]
    - [33, 0.758]
  - - [32, 1408, 1, 1280]
    - [33, 1.042]
  - - [32, 1856, 1, 1280]
    - [30, 1.375]
  - - [32, 2368, 1, 1280]
    - [30, 1.752]
  - - [32, 2944, 1, 1280]
    - [30, 2.18]
  - - [32, 3584, 1, 1280]
    - [30, 2.659]
  - - [32, 4288, 1, 1280]
    - [30, 3.231]
  - - [32, 5056, 1, 1280]
    - [33, 3.803]
  - - [32, 5888, 1, 1280]
    - [30, 4.408]
  - - [32, 6784, 1, 1280]
    - [33, 5.001]
  - - [32, 64, 1, 3328]
    - [30, 0.048]
  - - [32, 128, 1, 3328]
    - [30, 0.099]
  - - [32, 256, 1, 3328]
    - [30, 0.198]
  - - [32, 448, 1, 3328]
    - [30, 0.347]
  - - [32, 704, 1, 3328]
    - [30, 0.545]
  - - [32, 1024, 1, 3328]
    - [33, 0.794]
  - - [32, 1408, 1, 3328]
    - [30, 1.093]
  - - [32, 1856, 1, 3328]
    - [30, 1.446]
  - - [32, 2368, 1, 3328]
    - [30, 1.845]
  - - [32, 2944, 1, 3328]
    - [30, 2.282]
  - - [32, 3584, 1, 3328]
    - [33, 2.797]
  - - [32, 4288, 1, 3328]
    - [33, 3.357]
  - - [32, 5056, 1, 3328]
    - [33, 3.971]
  - - [32, 5888, 1, 3328]
    - [33, 4.624]
  - - [32, 6784, 1, 3328]
    - [30, 5.381]
  - - [64, 32, 1, 256]
    - [34, 0.042]
  - - [128, 32, 1, 256]
    - [30, 0.072]
  - - [256, 32, 1, 256]
    - [33, 0.147]
  - - [448, 32, 1, 256]
    - [30, 0.267]
  - - [704, 32, 1, 256]
    - [30, 0.41]
  - - [1024, 32, 1, 256]
    - [22, 0.593]
  - - [1408, 32, 1, 256]
    - [30, 0.824]
  - - [1856, 32, 1, 256]
    - [33, 1.099]
  - - [2368, 32, 1, 256]
    - [30, 1.396]
  - - [2944, 32, 1, 256]
    - [30, 1.734]
  - - [3584, 32, 1, 256]
    - [33, 2.126]
  - - [4288, 32, 1, 256]
    - [33, 2.471]
  - - [5056, 32, 1, 256]
    - [30, 2.854]
  - - [5888, 32, 1, 256]
    - [33, 3.3]
  - - [6784, 32, 1, 256]
    - [30, 3.707]
  - - [64, 32, 1, 1280]
    - [30, 0.048]
  - - [128, 32, 1, 1280]
    - [30, 0.093]
  - - [256, 32, 1, 1280]
    - [33, 0.189]
  - - [448, 32, 1, 1280]
    - [30, 0.332]
  - - [704, 32, 1, 1280]
    - [30, 0.521]
  - - [1024, 32, 1, 1280]
    - [30, 0.755]
  - - [1408, 32, 1, 1280]
    - [30, 1.045]
  - - [1856, 32, 1, 1280]
    - [30, 1.381]
  - - [2368, 32, 1, 1280]
    - [30, 1.758]
  - - [2944, 32, 1, 1280]
    - [33, 2.183]
  - - [3584, 32, 1, 1280]
    - [30, 2.653]
  - - [4288, 32, 1, 1280]
    - [30, 3.195]
  - - [5056, 32, 1, 1280]
    - [33, 3.788]
  - - [5888, 32, 1, 1280]
    - [30, 4.393]
  - - [6784, 32, 1, 1280]
    - [30, 5.145]
  - - [64, 32, 1, 3328]
    - [30, 0.048]
  - - [128, 32, 1, 3328]
    - [30, 0.099]
  - - [256, 32, 1, 3328]
    - [30, 0.198]
  - - [448, 32, 1, 3328]
    - [30, 0.347]
  - - [704, 32, 1, 3328]
    - [30, 0.545]
  - - [1024, 32, 1, 3328]
    - [33, 0.797]
  - - [1408, 32, 1, 3328]
    - [33, 1.096]
  - - [1856, 32, 1, 3328]
    - [30, 1.443]
  - - [2368, 32, 1, 3328]
    - [30, 1.848]
  - - [2944, 32, 1, 3328]
    - [33, 2.303]
  - - [3584, 32, 1, 3328]
    - [30, 2.809]
  - - [4288, 32, 1, 3328]
    - [30, 3.363]
  - - [5056, 32, 1, 3328]
    - [30, 3.962]
  - - [5888, 32, 1, 3328]
    - [30, 4.618]
  - - [6784, 32, 1, 3328]
    - [33, 5.393]
  - - [64, 64, 1, 32]
    - [34, 0.036]
  - - [128, 64, 1, 32]
    - [22, 0.048]
  - - [256, 64, 1, 32]
    - [22, 0.114]
  - - [448, 64, 1, 32]
    - [25, 0.177]
  - - [704, 64, 1, 32]
    - [22, 0.279]
  - - [1024, 64, 1, 32]
    - [25, 0.401]
  - - [1408, 64, 1, 32]
    - [25, 0.578]
  - - [1856, 64, 1, 32]
    - [22, 0.746]
  - - [2368, 64, 1, 32]
    - [25, 0.955]
  - - [2944, 64, 1, 32]
    - [25, 1.117]
  - - [3584, 64, 1, 32]
    - [25, 1.375]
  - - [4288, 64, 1, 32]
    - [22, 1.542]
  - - [5056, 64, 1, 32]
    - [22, 1.812]
  - - [5888, 64, 1, 32]
    - [25, 2.069]
  - - [6784, 64, 1, 32]
    - [22, 3.588]
  - - [64, 128, 1, 32]
    - [34, 0.09]
  - - [128, 128, 1, 32]
    - [25, 0.102]
  - - [256, 128, 1, 32]
    - [25, 0.204]
  - - [448, 128, 1, 32]
    - [25, 0.356]
  - - [704, 128, 1, 32]
    - [22, 0.578]
  - - [1024, 128, 1, 32]
    - [25, 0.821]
  - - [1408, 128, 1, 32]
    - [25, 1.147]
  - - [1856, 128, 1, 32]
    - [25, 1.473]
  - - [2368, 128, 1, 32]
    - [22, 1.77]
  - - [2944, 128, 1, 32]
    - [25, 2.024]
  - - [3584, 128, 1, 32]
    - [25, 3.591]
  - - [4288, 128, 1, 32]
    - [25, 4.567]
  - - [5056, 128, 1, 32]
    - [22, 5.31]
  - - [5888, 128, 1, 32]
    - [25, 6.142]
  - - [6784, 128, 1, 32]
    - [25, 6.543]
  - - [64, 256, 1, 32]
    - [25, 0.102]
  - - [128, 256, 1, 32]
    - [25, 0.225]
  - - [256, 256, 1, 32]
    - [27, 0.428]
  - - [448, 256, 1, 32]
    - [25, 0.728]
  - - [704, 256, 1, 32]
    - [25, 1.162]
  - - [1024, 256, 1, 32]
    - [25, 1.602]
  - - [1408, 256, 1, 32]
    - [22, 1.988]
  - - [1856, 256, 1, 32]
    - [22, 3.899]
  - - [2368, 256, 1, 32]
    - [22, 5.043]
  - - [2944, 256, 1, 32]
    - [25, 6.403]
  - - [3584, 256, 1, 32]
    - [22, 6.957]
  - - [4288, 256, 1, 32]
    - [22, 8.068]
  - - [5056, 256, 1, 32]
    - [22, 8.472]
  - - [5888, 256, 1, 32]
    - [22, 9.212]
  - - [6784, 256, 1, 32]
    - [25, 9.814]
  - - [64, 448, 1, 32]
    - [25, 0.183]
  - - [128, 448, 1, 32]
    - [31, 0.38]
  - - [256, 448, 1, 32]
    - [25, 0.731]
  - - [448, 448, 1, 32]
    - [25, 1.294]
  - - [704, 448, 1, 32]
    - [25, 1.758]
  - - [1024, 448, 1, 32]
    - [25, 3.737]
  - - [1408, 448, 1, 32]
    - [25, 5.106]
  - - [1856, 448, 1, 32]
    - [25, 6.729]
  - - [2368, 448, 1, 32]
    - [22, 7.894]
  - - [2944, 448, 1, 32]
    - [25, 8.541]
  - - [3584, 448, 1, 32]
    - [27, 9.568]
  - - [4288, 448, 1, 32]
    - [29, 10.05]
  - - [5056, 448, 1, 32]
    - [22, 10.724]
  - - [5888, 448, 1, 32]
    - [32, 10.934]
  - - [6784, 448, 1, 32]
    - [28, 11.413]
  - - [64, 704, 1, 32]
    - [25, 0.299]
  - - [128, 704, 1, 32]
    - [25, 0.602]
  - - [256, 704, 1, 32]
    - [25, 1.168]
  - - [448, 704, 1, 32]
    - [25, 1.842]
  - - [704, 704, 1, 32]
    - [22, 4.067]
  - - [1024, 704, 1, 32]
    - [22, 5.876]
  - - [1408, 704, 1, 32]
    - [25, 7.328]
  - - [1856, 704, 1, 32]
    - [29, 8.697]
  - - [2368, 704, 1, 32]
    - [25, 9.984]
  - - [2944, 704, 1, 32]
    - [22, 10.889]
  - - [3584, 704, 1, 32]
    - [22, 11.407]
  - - [4288, 704, 1, 32]
    - [22, 12.341]
  - - [5056, 704, 1, 32]
    - [22, 13.159]
  - - [5888, 704, 1, 32]
    - [22, 13.68]
  - - [6784, 704, 1, 32]
    - [25, 13.952]
  - - [64, 1024, 1, 32]
    - [24, 0.452]
  - - [128, 1024, 1, 32]
    - [22, 0.847]
  - - [256, 1024, 1, 32]
    - [22, 1.68]
  - - [448, 1024, 1, 32]
    - [25, 3.815]
  - - [704, 1024, 1, 32]
    - [25, 5.914]
  - - [1024, 1024, 1, 32]
    - [22, 7.753]
  - - [1408, 1024, 1, 32]
    - [22, 8.81]
  - - [1856, 1024, 1, 32]
    - [25, 10.074]
  - - [2368, 1024, 1, 32]
    - [25, 11.347]
  - - [2944, 1024, 1, 32]
    - [25, 12.158]
  - - [3584, 1024, 1, 32]
    - [26, 13.242]
  - - [4288, 1024, 1, 32]
    - [25, 13.452]
  - - [5056, 1024, 1, 32]
    - [25, 14.389]
  - - [5888, 1024, 1, 32]
    - [25, 14.893]
  - - [6784, 1024, 1, 32]
    - [22, 15.186]
  - - [64, 1408, 1, 32]
    - [25, 0.572]
  - - [128, 1408, 1, 32]
    - [25, 1.162]
  - - [256, 1408, 1, 32]
    - [25, 2.036]
  - - [448, 1408, 1, 32]
    - [25, 5.247]
  - - [704, 1408, 1, 32]
    - [25, 7.421]
  - - [1024, 1408, 1, 32]
    - [25, 8.466]
  - - [1408, 1408, 1, 32]
    - [25, 9.733]
  - - [1856, 1408, 1, 32]
    - [30, 11.302]
  - - [2368, 1408, 1, 32]
    - [24, 12.443]
  - - [2944, 1408, 1, 32]
    - [30, 13.033]
  - - [3584, 1408, 1, 32]
    - [30, 13.554]
  - - [4288, 1408, 1, 32]
    - [30, 14.069]
  - - [5056, 1408, 1, 32]
    - [21, 14.653]
  - - [5888, 1408, 1, 32]
    - [21, 14.979]
  - - [6784, 1408, 1, 32]
    - [24, 15.74]
  - - [64, 1856, 1, 32]
    - [22, 0.77]
  - - [128, 1856, 1, 32]
    - [22, 1.554]
  - - [256, 1856, 1, 32]
    - [25, 3.845]
  - - [448, 1856, 1, 32]
    - [25, 6.343]
  - - [704, 1856, 1, 32]
    - [22, 8.649]
  - - [1024, 1856, 1, 32]
    - [33, 9.814]
  - - [1408, 1856, 1, 32]
    - [33, 11.062]
  - - [1856, 1856, 1, 32]
    - [28, 12.542]
  - - [2368, 1856, 1, 32]
    - [25, 13.096]
  - - [2944, 1856, 1, 32]
    - [25, 13.925]
  - - [3584, 1856, 1, 32]
    - [22, 14.701]
  - - [4288, 1856, 1, 32]
    - [25, 14.943]
  - - [5056, 1856, 1, 32]
    - [22, 15.569]
  - - [5888, 1856, 1, 32]
    - [22, 16.081]
  - - [6784, 1856, 1, 32]
    - [25, 16.147]
  - - [64, 2368, 1, 32]
    - [22, 0.997]
  - - [128, 2368, 1, 32]
    - [25, 1.779]
  - - [256, 2368, 1, 32]
    - [22, 4.777]
  - - [448, 2368, 1, 32]
    - [22, 7.139]
  - - [704, 2368, 1, 32]
    - [29, 9.837]
  - - [1024, 2368, 1, 32]
    - [30, 10.448]
  - - [1408, 2368, 1, 32]
    - [26, 12.521]
  - - [1856, 2368, 1, 32]
    - [30, 12.904]
  - - [2368, 2368, 1, 32]
    - [24, 14.051]
  - - [2944, 2368, 1, 32]
    - [22, 14.599]
  - - [3584, 2368, 1, 32]
    - [22, 15.105]
  - - [4288, 2368, 1, 32]
    - [21, 15.575]
  - - [5056, 2368, 1, 32]
    - [21, 15.899]
  - - [5888, 2368, 1, 32]
    - [22, 16.375]
  - - [6784, 2368, 1, 32]
    - [24, 16.719]
  - - [64, 2944, 1, 32]
    - [25, 1.246]
  - - [128, 2944, 1, 32]
    - [25, 2.099]
  - - [256, 2944, 1, 32]
    - [25, 6.271]
  - - [448, 2944, 1, 32]
    - [22, 8.448]
  - - [704, 2944, 1, 32]
    - [33, 10.05]
  - - [1024, 2944, 1, 32]
    - [33, 11.284]
  - - [1408, 2944, 1, 32]
    - [30, 12.539]
  - - [1856, 2944, 1, 32]
    - [21, 13.808]
  - - [2368, 2944, 1, 32]
    - [21, 14.473]
  - - [2944, 2944, 1, 32]
    - [24, 15.405]
  - - [3584, 2944, 1, 32]
    - [24, 15.98]
  - - [4288, 2944, 1, 32]
    - [24, 16.312]
  - - [5056, 2944, 1, 32]
    - [21, 16.617]
  - - [5888, 2944, 1, 32]
    - [21, 16.896]
  - - [6784, 2944, 1, 32]
    - [26, 17.162]
  - - [64, 3584, 1, 32]
    - [25, 1.47]
  - - [128, 3584, 1, 32]
    - [22, 3.842]
  - - [256, 3584, 1, 32]
    - [22, 6.828]
  - - [448, 3584, 1, 32]
    - [29, 8.822]
  - - [704, 3584, 1, 32]
    - [21, 10.421]
  - - [1024, 3584, 1, 32]
    - [33, 12.383]
  - - [1408, 3584, 1, 32]
    - [30, 13.494]
  - - [1856, 3584, 1, 32]
    - [26, 14.647]
  - - [2368, 3584, 1, 32]
    - [33, 15.105]
  - - [2944, 3584, 1, 32]
    - [24, 16.039]
  - - [3584, 3584, 1, 32]
    - [24, 16.369]
  - - [4288, 3584, 1, 32]
    - [21, 16.674]
  - - [5056, 3584, 1, 32]
    - [24, 17.159]
  - - [5888, 3584, 1, 32]
    - [24, 17.468]
  - - [6784, 3584, 1, 32]
    - [24, 17.597]
  - - [64, 4288, 1, 32]
    - [25, 1.677]
  - - [128, 4288, 1, 32]
    - [22, 4.297]
  - - [256, 4288, 1, 32]
    - [22, 7.921]
  - - [448, 4288, 1, 32]
    - [27, 9.793]
  - - [704, 4288, 1, 32]
    - [21, 11.518]
  - - [1024, 4288, 1, 32]
    - [30, 12.796]
  - - [1408, 4288, 1, 32]
    - [30, 14.18]
  - - [1856, 4288, 1, 32]
    - [30, 14.758]
  - - [2368, 4288, 1, 32]
    - [21, 15.839]
  - - [2944, 4288, 1, 32]
    - [21, 16.261]
  - - [3584, 4288, 1, 32]
    - [24, 16.935]
  - - [4288, 4288, 1, 32]
    - [24, 17.088]
  - - [5056, 4288, 1, 32]
    - [21, 17.303]
  - - [5888, 4288, 1, 32]
    - [24, 17.707]
  - - [6784, 4288, 1, 32]
    - [24, 17.815]
  - - [64, 5056, 1, 32]
    - [25, 1.83]
  - - [128, 5056, 1, 32]
    - [25, 4.726]
  - - [256, 5056, 1, 32]
    - [22, 8.337]
  - - [448, 5056, 1, 32]
    - [33, 10.239]
  - - [704, 5056, 1, 32]
    - [28, 12.88]
  - - [1024, 5056, 1, 32]
    - [30, 13.632]
  - - [1408, 5056, 1, 32]
    - [21, 14.602]
  - - [1856, 5056, 1, 32]
    - [21, 15.743]
  - - [2368, 5056, 1, 32]
    - [24, 16.186]
  - - [2944, 5056, 1, 32]
    - [21, 16.525]
  - - [3584, 5056, 1, 32]
    - [24, 17.297]
  - - [4288, 5056, 1, 32]
    - [24, 17.336]
  - - [5056, 5056, 1, 32]
    - [21, 17.639]
  - - [5888, 5056, 1, 32]
    - [24, 17.947]
  - - [6784, 5056, 1, 32]
    - [21, 18.091]
  - - [64, 5888, 1, 32]
    - [25, 1.851]
  - - [128, 5888, 1, 32]
    - [23, 5.438]
  - - [256, 5888, 1, 32]
    - [27, 8.852]
  - - [448, 5888, 1, 32]
    - [32, 10.895]
  - - [704, 5888, 1, 32]
    - [30, 12.572]
  - - [1024, 5888, 1, 32]
    - [33, 13.889]
  - - [1408, 5888, 1, 32]
    - [28, 14.866]
  - - [1856, 5888, 1, 32]
    - [21, 15.887]
  - - [2368, 5888, 1, 32]
    - [21, 16.617]
  - - [2944, 5888, 1, 32]
    - [24, 17.118]
  - - [3584, 5888, 1, 32]
    - [21, 17.555]
  - - [4288, 5888, 1, 32]
    - [24, 17.737]
  - - [5056, 5888, 1, 32]
    - [21, 18.037]
  - - [5888, 5888, 1, 32]
    - [21, 18.151]
  - - [6784, 5888, 1, 32]
    - [21, 18.282]
  - - [64, 6784, 1, 32]
    - [23, 3.21]
  - - [128, 6784, 1, 32]
    - [22, 6.46]
  - - [256, 6784, 1, 32]
    - [32, 9.721]
  - - [448, 6784, 1, 32]
    - [28, 11.631]
  - - [704, 6784, 1, 32]
    - [33, 13.398]
  - - [1024, 6784, 1, 32]
    - [30, 14.249]
  - - [1408, 6784, 1, 32]
    - [21, 15.653]
  - - [1856, 6784, 1, 32]
    - [28, 16.429]
  - - [2368, 6784, 1, 32]
    - [21, 16.911]
  - - [2944, 6784, 1, 32]
    - [24, 17.324]
  - - [3584, 6784, 1, 32]
    - [24, 17.812]
  - - [4288, 6784, 1, 32]
    - [24, 17.926]
  - - [5056, 6784, 1, 32]
    - [28, 18.172]
  - - [5888, 6784, 1, 32]
    - [24, 18.402]
  - - [6784, 6784, 1, 32]
    - [24, 18.432]
  - - [32, 32, 1, 256]
    - [22, 0.021]
  - - [32, 32, 1, 1280]
    - [22, 0.027]
  - - [32, 32, 1, 3328]
    - [22, 0.027]
  - - [32, 64, 1, 32]
    - [22, 0.015]
  - - [32, 128, 1, 32]
    - [22, 0.03]
  - - [32, 256, 1, 32]
    - [25, 0.06]
  - - [32, 448, 1, 32]
    - [25, 0.123]
  - - [32, 704, 1, 32]
    - [25, 0.183]
  - - [32, 1024, 1, 32]
    - [25, 0.261]
  - - [32, 1408, 1, 32]
    - [25, 0.347]
  - - [32, 1856, 1, 32]
    - [25, 0.476]
  - - [32, 2368, 1, 32]
    - [25, 0.596]
  - - [32, 2944, 1, 32]
    - [22, 0.737]
  - - [32, 3584, 1, 32]
    - [25, 0.892]
  - - [32, 4288, 1, 32]
    - [22, 1.06]
  - - [32, 5056, 1, 32]
    - [25, 1.195]
  - - [32, 5888, 1, 32]
    - [22, 1.228]
  - - [32, 6784, 1, 32]
    - [22, 1.911]
  - - [64, 32, 1, 32]
    - [34, 0.021]
  - - [128, 32, 1, 32]
    - [25, 0.03]
  - - [256, 32, 1, 32]
    - [22, 0.063]
  - - [448, 32, 1, 32]
    - [29, 0.123]
  - - [704, 32, 1, 32]
    - [22, 0.171]
  - - [1024, 32, 1, 32]
    - [22, 0.252]
  - - [1408, 32, 1, 32]
    - [22, 0.347]
  - - [1856, 32, 1, 32]
    - [25, 0.434]
  - - [2368, 32, 1, 32]
    - [22, 0.581]
  - - [2944, 32, 1, 32]
    - [22, 0.737]
  - - [3584, 32, 1, 32]
    - [25, 0.904]
  - - [4288, 32, 1, 32]
    - [22, 1.015]
  - - [5056, 32, 1, 32]
    - [22, 1.096]
  - - [5888, 32, 1, 32]
    - [22, 1.201]
  - - [6784, 32, 1, 32]
    - [29, 1.596]
  - - [1, 1, 1, 1]
    - [40, 0.0]
  - - [1, 64, 1, 256]
    - [45, 0.001]
  - - [1, 128, 1, 256]
    - [37, 0.003]
  - - [1, 256, 1, 256]
    - [42, 0.006]
  - - [1, 448, 1, 256]
    - [37, 0.009]
  - - [1, 704, 1, 256]
    - [37, 0.012]
  - - [1, 1024, 1, 256]
    - [37, 0.018]
  - - [1, 1408, 1, 256]
    - [45, 0.027]
  - - [1, 1856, 1, 256]
    - [45, 0.036]
  - - [1, 2368, 1, 256]
    - [45, 0.045]
  - - [1, 2944, 1, 256]
    - [45, 0.057]
  - - [1, 3584, 1, 256]
    - [45, 0.069]
  - - [1, 4288, 1, 256]
    - [45, 0.081]
  - - [1, 5056, 1, 256]
    - [45, 0.093]
  - - [1, 5888, 1, 256]
    - [45, 0.108]
  - - [1, 6784, 1, 256]
    - [48, 0.144]
  - - [1, 64, 1, 1280]
    - [45, 0.003]
  - - [1, 128, 1, 1280]
    - [37, 0.003]
  - - [1, 256, 1, 1280]
    - [37, 0.006]
  - - [1, 448, 1, 1280]
    - [45, 0.012]
  - - [1, 704, 1, 1280]
    - [45, 0.018]
  - - [1, 1024, 1, 1280]
    - [45, 0.024]
  - - [1, 1408, 1, 1280]
    - [45, 0.036]
  - - [1, 1856, 1, 1280]
    - [45, 0.045]
  - - [1, 2368, 1, 1280]
    - [45, 0.06]
  - - [1, 2944, 1, 1280]
    - [45, 0.072]
  - - [1, 3584, 1, 1280]
    - [45, 0.09]
  - - [1, 4288, 1, 1280]
    - [45, 0.108]
  - - [1, 5056, 1, 1280]
    - [45, 0.126]
  - - [1, 5888, 1, 1280]
    - [45, 0.147]
  - - [1, 6784, 1, 1280]
    - [45, 0.165]
  - - [1, 64, 1, 3328]
    - [45, 0.003]
  - - [1, 128, 1, 3328]
    - [37, 0.003]
  - - [1, 256, 1, 3328]
    - [37, 0.006]
  - - [1, 448, 1, 3328]
    - [45, 0.012]
  - - [1, 704, 1, 3328]
    - [45, 0.018]
  - - [1, 1024, 1, 3328]
    - [45, 0.027]
  - - [1, 1408, 1, 3328]
    - [45, 0.036]
  - - [1, 1856, 1, 3328]
    - [45, 0.048]
  - - [1, 2368, 1, 3328]
    - [45, 0.06]
  - - [1, 2944, 1, 3328]
    - [45, 0.075]
  - - [1, 3584, 1, 3328]
    - [45, 0.093]
  - - [1, 4288, 1, 3328]
    - [45, 0.111]
  - - [1, 5056, 1, 3328]
    - [45, 0.132]
  - - [1, 5888, 1, 3328]
    - [45, 0.153]
  - - [1, 6784, 1, 3328]
    - [45, 0.177]
  - - [64, 1, 1, 256]
    - [52, 0.001]
  - - [128, 1, 1, 256]
    - [37, 0.003]
  - - [256, 1, 1, 256]
    - [37, 0.006]
  - - [448, 1, 1, 256]
    - [37, 0.009]
  - - [704, 1, 1, 256]
    - [45, 0.015]
  - - [1024, 1, 1, 256]
    - [37, 0.018]
  - - [1408, 1, 1, 256]
    - [45, 0.027]
  - - [1856, 1, 1, 256]
    - [45, 0.036]
  - - [2368, 1, 1, 256]
    - [45, 0.045]
  - - [2944, 1, 1, 256]
    - [45, 0.057]
  - - [3584, 1, 1, 256]
    - [45, 0.072]
  - - [4288, 1, 1, 256]
    - [45, 0.081]
  - - [5056, 1, 1, 256]
    - [45, 0.096]
  - - [5888, 1, 1, 256]
    - [45, 0.111]
  - - [6784, 1, 1, 256]
    - [49, 0.132]
  - - [64, 1, 1, 1280]
    - [45, 0.003]
  - - [128, 1, 1, 1280]
    - [37, 0.003]
  - - [256, 1, 1, 1280]
    - [37, 0.006]
  - - [448, 1, 1, 1280]
    - [45, 0.012]
  - - [704, 1, 1, 1280]
    - [45, 0.018]
  - - [1024, 1, 1, 1280]
    - [45, 0.024]
  - - [1408, 1, 1, 1280]
    - [45, 0.033]
  - - [1856, 1, 1, 1280]
    - [45, 0.045]
  - - [2368, 1, 1, 1280]
    - [45, 0.057]
  - - [2944, 1, 1, 1280]
    - [45, 0.072]
  - - [3584, 1, 1, 1280]
    - [45, 0.087]
  - - [4288, 1, 1, 1280]
    - [45, 0.105]
  - - [5056, 1, 1, 1280]
    - [45, 0.126]
  - - [5888, 1, 1, 1280]
    - [45, 0.144]
  - - [6784, 1, 1, 1280]
    - [45, 0.165]
  - - [64, 1, 1, 3328]
    - [45, 0.003]
  - - [128, 1, 1, 3328]
    - [37, 0.003]
  - - [256, 1, 1, 3328]
    - [37, 0.006]
  - - [448, 1, 1, 3328]
    - [45, 0.012]
  - - [704, 1, 1, 3328]
    - [45, 0.018]
  - - [1024, 1, 1, 3328]
    - [45, 0.027]
  - - [1408, 1, 1, 3328]
    - [45, 0.036]
  - - [1856, 1, 1, 3328]
    - [45, 0.048]
  - - [2368, 1, 1, 3328]
    - [45, 0.06]
  - - [2944, 1, 1, 3328]
    - [45, 0.075]
  - - [3584, 1, 1, 3328]
    - [45, 0.093]
  - - [4288, 1, 1, 3328]
    - [45, 0.111]
  - - [5056, 1, 1, 3328]
    - [45, 0.129]
  - - [5888, 1, 1, 3328]
    - [45, 0.15]
  - - [6784, 1, 1, 3328]
    - [45, 0.171]
  - - [64, 64, 1, 1]
    - [52, 0.001]
  - - [128, 64, 1, 1]
    - [36, 0.003]
  - - [256, 64, 1, 1]
    - [42, 0.006]
  - - [448, 64, 1, 1]
    - [47, 0.009]
  - - [704, 64, 1, 1]
    - [40, 0.015]
  - - [1024, 64, 1, 1]
    - [40, 0.018]
  - - [1408, 64, 1, 1]
    - [40, 0.024]
  - - [1856, 64, 1, 1]
    - [40, 0.03]
  - - [2368, 64, 1, 1]
    - [37, 0.039]
  - - [2944, 64, 1, 1]
    - [37, 0.048]
  - - [3584, 64, 1, 1]
    - [37, 0.06]
  - - [4288, 64, 1, 1]
    - [43, 0.069]
  - - [5056, 64, 1, 1]
    - [40, 0.078]
  - - [5888, 64, 1, 1]
    - [37, 0.084]
  - - [6784, 64, 1, 1]
    - [40, 0.15]
  - - [64, 128, 1, 1]
    - [52, 0.006]
  - - [128, 128, 1, 1]
    - [43, 0.012]
  - - [256, 128, 1, 1]
    - [43, 0.012]
  - - [448, 128, 1, 1]
    - [37, 0.015]
  - - [704, 128, 1, 1]
    - [48, 0.024]
  - - [1024, 128, 1, 1]
    - [37, 0.033]
  - - [1408, 128, 1, 1]
    - [42, 0.045]
  - - [1856, 128, 1, 1]
    - [40, 0.06]
  - - [2368, 128, 1, 1]
    - [40, 0.069]
  - - [2944, 128, 1, 1]
    - [48, 0.081]
  - - [3584, 128, 1, 1]
    - [40, 0.165]
  - - [4288, 128, 1, 1]
    - [37, 0.192]
  - - [5056, 128, 1, 1]
    - [40, 0.24]
  - - [5888, 128, 1, 1]
    - [42, 0.276]
  - - [6784, 128, 1, 1]
    - [42, 0.308]
  - - [64, 256, 1, 1]
    - [52, 0.009]
  - - [128, 256, 1, 1]
    - [43, 0.012]
  - - [256, 256, 1, 1]
    - [37, 0.018]
  - - [448, 256, 1, 1]
    - [37, 0.03]
  - - [704, 256, 1, 1]
    - [37, 0.045]
  - - [1024, 256, 1, 1]
    - [40, 0.063]
  - - [1408, 256, 1, 1]
    - [40, 0.075]
  - - [1856, 256, 1, 1]
    - [40, 0.168]
  - - [2368, 256, 1, 1]
    - [47, 0.219]
  - - [2944, 256, 1, 1]
    - [42, 0.273]
  - - [3584, 256, 1, 1]
    - [37, 0.302]
  - - [4288, 256, 1, 1]
    - [40, 0.371]
  - - [5056, 256, 1, 1]
    - [40, 0.401]
  - - [5888, 256, 1, 1]
    - [40, 0.44]
  - - [6784, 256, 1, 1]
    - [37, 0.521]
  - - [64, 448, 1, 1]
    - [37, 0.006]
  - - [128, 448, 1, 1]
    - [50, 0.024]
  - - [256, 448, 1, 1]
    - [40, 0.03]
  - - [448, 448, 1, 1]
    - [43, 0.051]
  - - [704, 448, 1, 1]
    - [37, 0.069]
  - - [1024, 448, 1, 1]
    - [42, 0.168]
  - - [1408, 448, 1, 1]
    - [40, 0.234]
  - - [1856, 448, 1, 1]
    - [40, 0.29]
  - - [2368, 448, 1, 1]
    - [40, 0.353]
  - - [2944, 448, 1, 1]
    - [40, 0.416]
  - - [3584, 448, 1, 1]
    - [42, 0.482]
  - - [4288, 448, 1, 1]
    - [37, 0.509]
  - - [5056, 448, 1, 1]
    - [40, 0.602]
  - - [5888, 448, 1, 1]
    - [40, 0.647]
  - - [6784, 448, 1, 1]
    - [42, 0.695]
  - - [64, 704, 1, 1]
    - [37, 0.012]
  - - [128, 704, 1, 1]
    - [37, 0.024]
  - - [256, 704, 1, 1]
    - [43, 0.048]
  - - [448, 704, 1, 1]
    - [40, 0.075]
  - - [704, 704, 1, 1]
    - [37, 0.168]
  - - [1024, 704, 1, 1]
    - [40, 0.246]
  - - [1408, 704, 1, 1]
    - [42, 0.308]
  - - [1856, 704, 1, 1]
    - [37, 0.404]
  - - [2368, 704, 1, 1]
    - [37, 0.476]
  - - [2944, 704, 1, 1]
    - [37, 0.53]
  - - [3584, 704, 1, 1]
    - [43, 0.653]
  - - [4288, 704, 1, 1]
    - [40, 0.716]
  - - [5056, 704, 1, 1]
    - [42, 0.767]
  - - [5888, 704, 1, 1]
    - [43, 0.812]
  - - [6784, 704, 1, 1]
    - [40, 0.862]
  - - [64, 1024, 1, 1]
    - [42, 0.018]
  - - [128, 1024, 1, 1]
    - [43, 0.036]
  - - [256, 1024, 1, 1]
    - [37, 0.066]
  - - [448, 1024, 1, 1]
    - [40, 0.171]
  - - [704, 1024, 1, 1]
    - [42, 0.27]
  - - [1024, 1024, 1, 1]
    - [40, 0.332]
  - - [1408, 1024, 1, 1]
    - [39, 0.428]
  - - [1856, 1024, 1, 1]
    - [40, 0.509]
  - - [2368, 1024, 1, 1]
    - [40, 0.635]
  - - [2944, 1024, 1, 1]
    - [40, 0.719]
  - - [3584, 1024, 1, 1]
    - [40, 0.8]
  - - [4288, 1024, 1, 1]
    - [41, 0.809]
  - - [5056, 1024, 1, 1]
    - [40, 0.877]
  - - [5888, 1024, 1, 1]
    - [37, 0.886]
  - - [6784, 1024, 1, 1]
    - [36, 0.949]
  - - [64, 1408, 1, 1]
    - [37, 0.024]
  - - [128, 1408, 1, 1]
    - [37, 0.048]
  - - [256, 1408, 1, 1]
    - [40, 0.081]
  - - [448, 1408, 1, 1]
    - [37, 0.231]
  - - [704, 1408, 1, 1]
    - [40, 0.314]
  - - [1024, 1408, 1, 1]
    - [42, 0.44]
  - - [1408, 1408, 1, 1]
    - [40, 0.527]
  - - [1856, 1408, 1, 1]
    - [42, 0.674]
  - - [2368, 1408, 1, 1]
    - [40, 0.758]
  - - [2944, 1408, 1, 1]
    - [37, 0.803]
  - - [3584, 1408, 1, 1]
    - [37, 0.862]
  - - [4288, 1408, 1, 1]
    - [37, 0.886]
  - - [5056, 1408, 1, 1]
    - [37, 0.931]
  - - [5888, 1408, 1, 1]
    - [41, 0.982]
  - - [6784, 1408, 1, 1]
    - [36, 0.979]
  - - [64, 1856, 1, 1]
    - [37, 0.03]
  - - [128, 1856, 1, 1]
    - [37, 0.063]
  - - [256, 1856, 1, 1]
    - [37, 0.174]
  - - [448, 1856, 1, 1]
    - [37, 0.293]
  - - [704, 1856, 1, 1]
    - [42, 0.419]
  - - [1024, 1856, 1, 1]
    - [42, 0.509]
  - - [1408, 1856, 1, 1]
    - [37, 0.662]
  - - [1856, 1856, 1, 1]
    - [43, 0.767]
  - - [2368, 1856, 1, 1]
    - [42, 0.827]
  - - [2944, 1856, 1, 1]
    - [41, 0.844]
  - - [3584, 1856, 1, 1]
    - [37, 0.916]
  - - [4288, 1856, 1, 1]
    - [42, 0.952]
  - - [5056, 1856, 1, 1]
    - [41, 0.997]
  - - [5888, 1856, 1, 1]
    - [41, 1.024]
  - - [6784, 1856, 1, 1]
    - [40, 1.042]
  - - [64, 2368, 1, 1]
    - [37, 0.039]
  - - [128, 2368, 1, 1]
    - [37, 0.072]
  - - [256, 2368, 1, 1]
    - [37, 0.225]
  - - [448, 2368, 1, 1]
    - [40, 0.35]
  - - [704, 2368, 1, 1]
    - [40, 0.5]
  - - [1024, 2368, 1, 1]
    - [37, 0.617]
  - - [1408, 2368, 1, 1]
    - [40, 0.734]
  - - [1856, 2368, 1, 1]
    - [42, 0.83]
  - - [2368, 2368, 1, 1]
    - [43, 0.892]
  - - [2944, 2368, 1, 1]
    - [42, 0.919]
  - - [3584, 2368, 1, 1]
    - [40, 0.955]
  - - [4288, 2368, 1, 1]
    - [40, 1.003]
  - - [5056, 2368, 1, 1]
    - [36, 1.03]
  - - [5888, 2368, 1, 1]
    - [36, 1.048]
  - - [6784, 2368, 1, 1]
    - [36, 1.066]
  - - [64, 2944, 1, 1]
    - [40, 0.051]
  - - [128, 2944, 1, 1]
    - [37, 0.084]
  - - [256, 2944, 1, 1]
    - [37, 0.264]
  - - [448, 2944, 1, 1]
    - [42, 0.437]
  - - [704, 2944, 1, 1]
    - [43, 0.542]
  - - [1024, 2944, 1, 1]
    - [42, 0.689]
  - - [1408, 2944, 1, 1]
    - [43, 0.812]
  - - [1856, 2944, 1, 1]
    - [41, 0.886]
  - - [2368, 2944, 1, 1]
    - [36, 0.952]
  - - [2944, 2944, 1, 1]
    - [42, 0.97]
  - - [3584, 2944, 1, 1]
    - [46, 0.997]
  - - [4288, 2944, 1, 1]
    - [36, 1.039]
  - - [5056, 2944, 1, 1]
    - [36, 1.099]
  - - [5888, 2944, 1, 1]
    - [36, 1.078]
  - - [6784, 2944, 1, 1]
    - [36, 1.114]
  - - [64, 3584, 1, 1]
    - [40, 0.06]
  - - [128, 3584, 1, 1]
    - [40, 0.156]
  - - [256, 3584, 1, 1]
    - [40, 0.305]
  - - [448, 3584, 1, 1]
    - [40, 0.473]
  - - [704, 3584, 1, 1]
    - [42, 0.656]
  - - [1024, 3584, 1, 1]
    - [42, 0.773]
  - - [1408, 3584, 1, 1]
    - [41, 0.853]
  - - [1856, 3584, 1, 1]
    - [40, 0.922]
  - - [2368, 3584, 1, 1]
    - [36, 0.979]
  - - [2944, 3584, 1, 1]
    - [37, 1.021]
  - - [3584, 3584, 1, 1]
    - [43, 1.042]
  - - [4288, 3584, 1, 1]
    - [41, 1.048]
  - - [5056, 3584, 1, 1]
    - [46, 1.099]
  - - [5888, 3584, 1, 1]
    - [36, 1.099]
  - - [6784, 3584, 1, 1]
    - [36, 1.111]
  - - [64, 4288, 1, 1]
    - [42, 0.072]
  - - [128, 4288, 1, 1]
    - [40, 0.192]
  - - [256, 4288, 1, 1]
    - [43, 0.341]
  - - [448, 4288, 1, 1]
    - [43, 0.5]
  - - [704, 4288, 1, 1]
    - [42, 0.698]
  - - [1024, 4288, 1, 1]
    - [41, 0.782]
  - - [1408, 4288, 1, 1]
    - [45, 0.853]
  - - [1856, 4288, 1, 1]
    - [36, 0.964]
  - - [2368, 4288, 1, 1]
    - [41, 1.021]
  - - [2944, 4288, 1, 1]
    - [36, 1.039]
  - - [3584, 4288, 1, 1]
    - [36, 1.051]
  - - [4288, 4288, 1, 1]
    - [36, 1.102]
  - - [5056, 4288, 1, 1]
    - [41, 1.117]
  - - [5888, 4288, 1, 1]
    - [42, 1.108]
  - - [6784, 4288, 1, 1]
    - [36, 1.12]
  - - [64, 5056, 1, 1]
    - [40, 0.078]
  - - [128, 5056, 1, 1]
    - [42, 0.237]
  - - [256, 5056, 1, 1]
    - [37, 0.425]
  - - [448, 5056, 1, 1]
    - [40, 0.584]
  - - [704, 5056, 1, 1]
    - [40, 0.767]
  - - [1024, 5056, 1, 1]
    - [36, 0.833]
  - - [1408, 5056, 1, 1]
    - [36, 0.904]
  - - [1856, 5056, 1, 1]
    - [43, 0.982]
  - - [2368, 5056, 1, 1]
    - [41, 1.048]
  - - [2944, 5056, 1, 1]
    - [42, 1.063]
  - - [3584, 5056, 1, 1]
    - [41, 1.069]
  - - [4288, 5056, 1, 1]
    - [46, 1.096]
  - - [5056, 5056, 1, 1]
    - [36, 1.144]
  - - [5888, 5056, 1, 1]
    - [41, 1.129]
  - - [6784, 5056, 1, 1]
    - [41, 1.153]
  - - [64, 5888, 1, 1]
    - [40, 0.087]
  - - [128, 5888, 1, 1]
    - [40, 0.279]
  - - [256, 5888, 1, 1]
    - [36, 0.449]
  - - [448, 5888, 1, 1]
    - [43, 0.677]
  - - [704, 5888, 1, 1]
    - [42, 0.788]
  - - [1024, 5888, 1, 1]
    - [41, 0.844]
  - - [1408, 5888, 1, 1]
    - [36, 0.955]
  - - [1856, 5888, 1, 1]
    - [36, 1.003]
  - - [2368, 5888, 1, 1]
    - [36, 1.081]
  - - [2944, 5888, 1, 1]
    - [42, 1.048]
  - - [3584, 5888, 1, 1]
    - [44, 1.087]
  - - [4288, 5888, 1, 1]
    - [41, 1.12]
  - - [5056, 5888, 1, 1]
    - [41, 1.156]
  - - [5888, 5888, 1, 1]
    - [36, 1.132]
  - - [6784, 5888, 1, 1]
    - [41, 1.153]
  - - [64, 6784, 1, 1]
    - [37, 0.153]
  - - [128, 6784, 1, 1]
    - [40, 0.299]
  - - [256, 6784, 1, 1]
    - [37, 0.515]
  - - [448, 6784, 1, 1]
    - [43, 0.716]
  - - [704, 6784, 1, 1]
    - [43, 0.827]
  - - [1024, 6784, 1, 1]
    - [44, 0.889]
  - - [1408, 6784, 1, 1]
    - [41, 0.97]
  - - [1856, 6784, 1, 1]
    - [36, 1.045]
  - - [2368, 6784, 1, 1]
    - [36, 1.102]
  - - [2944, 6784, 1, 1]
    - [40, 1.069]
  - - [3584, 6784, 1, 1]
    - [36, 1.117]
  - - [4288, 6784, 1, 1]
    - [36, 1.156]
  - - [5056, 6784, 1, 1]
    - [36, 1.159]
  - - [5888, 6784, 1, 1]
    - [36, 1.144]
  - - [6784, 6784, 1, 1]
    - [36, 1.171]
  - - [1, 1, 1, 256]
    - [37, 0.0]
  - - [1, 1, 1, 1280]
    - [45, 0.0]
  - - [1, 1, 1, 3328]
    - [45, 0.0]
  - - [1, 64, 1, 1]
    - [37, 0.0]
  - - [1, 128, 1, 1]
    - [52, 0.0]
  - - [1, 256, 1, 1]
    - [42, 0.0]
  - - [1, 448, 1, 1]
    - [40, 0.0]
  - - [1, 704, 1, 1]
    - [47, 0.0]
  - - [1, 1024, 1, 1]
    - [44, 0.001]
  - - [1, 1408, 1, 1]
    - [47, 0.001]
  - - [1, 1856, 1, 1]
    - [37, 0.001]
  - - [1, 2368, 1, 1]
    - [37, 0.001]
  - - [1, 2944, 1, 1]
    - [37, 0.001]
  - - [1, 3584, 1, 1]
    - [37, 0.001]
  - - [1, 4288, 1, 1]
    - [37, 0.003]
  - - [1, 5056, 1, 1]
    - [36, 0.003]
  - - [1, 5888, 1, 1]
    - [36, 0.003]
  - - [1, 6784, 1, 1]
    - [35, 0.003]
  - - [64, 1, 1, 1]
    - [51, 0.0]
  - - [128, 1, 1, 1]
    - [52, 0.0]
  - - [256, 1, 1, 1]
    - [37, 0.0]
  - - [448, 1, 1, 1]
    - [37, 0.0]
  - - [704, 1, 1, 1]
    - [40, 0.0]
  - - [1024, 1, 1, 1]
    - [38, 0.001]
  - - [1408, 1, 1, 1]
    - [43, 0.001]
  - - [1856, 1, 1, 1]
    - [40, 0.001]
  - - [2368, 1, 1, 1]
    - [37, 0.001]
  - - [2944, 1, 1, 1]
    - [47, 0.001]
  - - [3584, 1, 1, 1]
    - [40, 0.003]
  - - [4288, 1, 1, 1]
    - [37, 0.003]
  - - [5056, 1, 1, 1]
    - [36, 0.003]
  - - [5888, 1, 1, 1]
    - [35, 0.003]
  - - [6784, 1, 1, 1]
    - [35, 0.003]
  - - [7680, 8192, 1, 8192]
    - [53, 93.756]
  - - [3840, 4096, 1, 4096]
    - [54, 90.337]
  - - [1920, 2048, 1, 2048]
    - [55, 78.259]
  - - [960, 1024, 1, 1024]
    - [56, 37.382]
  - - [480, 512, 1, 512]
    - [57, 10.329]
  - - [8192, 7680, 1, 8192]
    - [53, 93.479]
  - - [4096, 3840, 1, 4096]
    - [55, 90.391]
  - - [2048, 1920, 1, 2048]
    - [58, 67.409]
  - - [1024, 960, 1, 1024]
    - [59, 37.682]
  - - [512, 480, 1, 512]
    - [60, 9.813]
  - - [8192, 8192, 1, 8192]
    - [61, 91.621]
  - - [4096, 4096, 1, 4096]
    - [62, 87.082]
  - - [2048, 2048, 1, 2048]
    - [63, 65.409]
  - - [512, 512, 1, 512]
    - [65, 9.969]
  - - [512, 512, 16, 64]
    - [66, 13.016]
  - - [512, 512, 128, 64]
    - [67, 19.399]
  - - [1024, 1, 1, 1024]
    - [68, 0.088]
  - - [1024, 77, 1, 1024]
    - [57, 4.753]
  - - [1024, 512, 1, 1024]
    - [69, 21.94]
  - - [1024, 512, 1, 4096]
    - [70, 30.966]
  - - [4096, 512, 1, 1024]
    - [71, 44.462]
  - - [128, 128, 128, 64]
    - [72, 9.662]
  - - [128, 128, 160, 64]
    - [72, 11.135]
  - - [1024, 10, 1, 1024]
    - [73, 0.868]
  - - [1024, 200, 1, 1024]
    - [74, 10.609]
  - - [1024, 1280, 1, 1024]
    - [75, 40.258]
  - - [1024, 1280, 1, 4096]
    - [76, 46.179]
  - - [4096, 1280, 1, 1024]
    - [77, 54.552]
  - - [128, 128, 624, 64]
    - [78, 13.254]
  - - [1024, 39, 1, 1024]
    - [79, 2.392]
  - - [1024, 780, 1, 1024]
    - [80, 30.863]
  - - [1024, 4992, 1, 1024]
    - [75, 57.027]
  - - [1024, 4992, 1, 4096]
    - [81, 62.643]
  - - [4096, 4992, 1, 1024]
    - [82, 64.329]
  - - [512, 512, 64, 64]
    - [83, 18.041]
  - - [1024, 4, 1, 1024]
    - [84, 0.344]
  - - [1024, 308, 1, 1024]
    - [85, 14.889]
  - - [1024, 2048, 1, 1024]
    - [86, 44.859]
  - - [1024, 2048, 1, 4096]
    - [87, 58.849]
  - - [4096, 2048, 1, 1024]
    - [88, 56.611]
  - - [128, 128, 640, 64]
    - [89, 13.305]
  - - [1024, 40, 1, 1024]
    - [57, 2.453]
  - - [1024, 800, 1, 1024]
    - [80, 31.527]
  - - [1024, 5120, 1, 1024]
    - [90, 56.389]
  - - [1024, 5120, 1, 4096]
    - [91, 62.491]
  - - [4096, 5120, 1, 1024]
    - [92, 65.505]
  - - [128, 128, 656, 64]
    - [78, 13.3]
  - - [1024, 41, 1, 1024]
    - [79, 2.579]
  - - [1024, 820, 1, 1024]
    - [80, 31.805]
  - - [1024, 5248, 1, 1024]
    - [90, 54.785]
  - - [1024, 5248, 1, 4096]
    - [81, 64.859]
  - - [4096, 5248, 1, 1024]
    - [93, 66.557]
  - - [512, 512, 80, 64]
    - [83, 18.691]
  - - [1024, 5, 1, 1024]
    - [94, 0.427]
  - - [1024, 385, 1, 1024]
    - [95, 18.985]
  - - [1024, 2560, 1, 1024]
    - [96, 45.182]
  - - [1024, 2560, 1, 4096]
    - [97, 58.489]
  - - [4096, 2560, 1, 1024]
    - [90, 59.848]
  - - [512, 512, 96, 64]
    - [98, 18.841]
  - - [1024, 6, 1, 1024]
    - [99, 0.526]
  - - [1024, 462, 1, 1024]
    - [85, 20.989]
  - - [1024, 3072, 1, 1024]
    - [53, 49.097]
  - - [1024, 3072, 1, 4096]
    - [100, 63.066]
  - - [4096, 3072, 1, 1024]
    - [101, 59.634]
  - - [1024, 8, 1, 1024]
    - [94, 0.677]
  - - [1024, 160, 1, 1024]
    - [60, 9.236]
  - - [1024, 1024, 1, 4096]
    - [102, 41.695]
  - - [4096, 1024, 1, 1024]
    - [103, 51.597]
  - - [128, 128, 144, 64]
    - [104, 10.545]
  - - [1024, 9, 1, 1024]
    - [99, 0.768]
  - - [1024, 180, 1, 1024]
    - [105, 10.094]
  - - [1024, 1152, 1, 1024]
    - [106, 37.934]
  - - [1024, 1152, 1, 4096]
    - [107, 43.944]
  - - [4096, 1152, 1, 1024]
    - [90, 53.26]
  - - [128, 32768, 1, 256]
    - [108, 28.792]
  - - [256, 32768, 1, 512]
    - [109, 51.137]
  - - [512, 32768, 1, 13]
    - [110, 3.159]
  - - [512, 32768, 1, 1024]
    - [111, 65.17]
  - - [1024, 32768, 1, 479]
    - [112, 42.121]
  - - [1024, 32768, 1, 1024]
    - [113, 68.752]
  - - [32768, 1, 1, 256]
    - [114, 0.47]
  - - [64, 128, 512, 128]
    - [67, 16.917]
  - - [128, 128, 512, 64]
    - [115, 12.849]
  - - [1024, 32, 1, 1024]
    - [57, 1.962]
  - - [1024, 4096, 1, 1024]
    - [116, 53.592]
  - - [1024, 4096, 1, 4096]
    - [117, 70.054]
  - - [4096, 4096, 1, 1024]
    - [118, 61.318]
  - - [30528, 4096, 1, 1024]
    - [119, 71.199]
  - - [64, 512, 64, 512]
    - [120, 26.305]
  - - [30528, 2048, 1, 1024]
    - [121, 69.911]
  - - [1024, 8192, 1, 1024]
    - [122, 57.667]
  - - [1024, 8192, 1, 4096]
    - [123, 73.013]
  - - [1024, 9600, 1, 1024]
    - [124, 65.014]
  - - [1024, 9600, 1, 4096]
    - [125, 85.466]
  - - [4096, 8192, 1, 1024]
    - [113, 68.27]
  - - [4096, 9600, 1, 1024]
    - [123, 72.063]
  - - [33712, 8192, 1, 1024]
    - [124, 73.713]
  - - [33712, 9600, 1, 1024]
    - [124, 75.243]
  - - [1024, 10064, 1, 1024]
    - [126, 59.492]
  - - [1024, 10064, 1, 4096]
    - [127, 71.112]
  - - [1024, 10080, 1, 1024]
    - [109, 59.767]
  - - [1024, 10080, 1, 4096]
    - [127, 71.444]
  - - [1024, 10200, 1, 1024]
    - [126, 59.261]
  - - [1024, 10200, 1, 4096]
    - [127, 72.125]
  - - [1024, 3840, 1, 1024]
    - [53, 59.341]
  - - [1024, 3840, 1, 4096]
    - [128, 74.617]
  - - [1024, 3968, 1, 1024]
    - [109, 53.34]
  - - [1024, 3968, 1, 4096]
    - [129, 68.432]
  - - [1024, 6528, 1, 1024]
    - [121, 56.192]
  - - [1024, 6528, 1, 4096]
    - [86, 68.366]
  - - [1024, 7104, 1, 1024]
    - [130, 58.63]
  - - [1024, 7104, 1, 4096]
    - [131, 73.226]
  - - [1024, 7200, 1, 1024]
    - [132, 61.922]
  - - [1024, 7200, 1, 4096]
    - [128, 74.235]
  - - [1024, 8064, 1, 1024]
    - [129, 59.813]
  - - [1024, 8064, 1, 4096]
    - [133, 72.565]
  - - [1024, 8160, 1, 1024]
    - [123, 57.483]
  - - [1024, 8160, 1, 4096]
    - [113, 74.678]
  - - [1024, 9216, 1, 1024]
    - [121, 62.241]
  - - [1024, 9216, 1, 4096]
    - [134, 81.108]
  - - [1024, 9520, 1, 1024]
    - [87, 60.504]
  - - [1024, 9520, 1, 4096]
    - [135, 83.709]
  - - [4096, 10064, 1, 1024]
    - [136, 67.0]
  - - [4096, 10080, 1, 1024]
    - [123, 68.347]
  - - [4096, 10200, 1, 1024]
    - [123, 67.676]
  - - [4096, 3840, 1, 1024]
    - [137, 65.306]
  - - [4096, 3968, 1, 1024]
    - [138, 64.6]
  - - [4096, 6528, 1, 1024]
    - [137, 64.689]
  - - [4096, 7104, 1, 1024]
    - [113, 68.546]
  - - [4096, 7200, 1, 1024]
    - [113, 71.044]
  - - [4096, 8064, 1, 1024]
    - [123, 67.648]
  - - [4096, 8160, 1, 1024]
    - [124, 69.872]
  - - [4096, 9216, 1, 1024]
    - [113, 68.022]
  - - [4096, 9520, 1, 1024]
    - [136, 69.885]
  - - [42720, 10080, 1, 1024]
    - [124, 74.311]
  - - [42720, 3968, 1, 1024]
    - [139, 72.309]
  - - [42720, 6528, 1, 1024]
    - [139, 73.399]
  - - [42720, 7104, 1, 1024]
    - [139, 72.995]
  - - [42720, 7200, 1, 1024]
    - [139, 73.837]
  - - [42720, 9520, 1, 1024]
    - [139, 74.001]
  - - [24, 24, 4736, 64]
    - [140, 4.551]
  - - [32, 32, 4608, 64]
    - [141, 5.851]
  - - [32, 35, 4608, 64]
    - [142, 6.084]
  - - [64, 512, 1, 512]
    - [79, 1.467]
  - - [512, 512, 1, 64]
    - [143, 2.181]
  - - [128, 128, 1, 64]
    - [144, 0.158]
  - - [64, 128, 1, 128]
    - [79, 0.139]
  - - [2048, 512, 1, 2048]
    - [145, 39.328]
  - - [1024, 512, 1, 1600]
    - [146, 27.07]
  - - [2048, 512, 1, 74]
    - [147, 5.586]
  - - [512, 1, 1, 2048]
    - [148, 0.061]
  - - [64, 512, 1, 1024]
    - [79, 2.052]
  - - [1024, 1600, 1, 560]
    - [149, 27.001]
  - - [1600, 1, 1, 1024]
    - [150, 0.136]
  - - [512, 1600, 1, 512]
    - [151, 23.226]
  - - [1024, 1600, 1, 1024]
    - [152, 43.372]
  - - [32, 1600, 1, 512]
    - [144, 2.21]
  - - [64, 960, 1, 1024]
    - [153, 3.68]
  - - [200, 1, 1, 1024]
    - [154, 0.018]
  - - [256, 684, 1, 1024]
    - [153, 10.048]
  - - [256, 1280, 1, 1024]
    - [155, 15.859]
  - - [256, 1536, 1, 1024]
    - [156, 18.471]
  - - [256, 2304, 1, 1024]
    - [157, 24.9]
  - - [256, 2560, 1, 1024]
    - [157, 25.222]
  - - [256, 2816, 1, 1024]
    - [158, 26.267]
  - - [256, 3328, 1, 1024]
    - [80, 31.401]
  - - [256, 3584, 1, 1024]
    - [159, 33.304]
  - - [256, 4608, 1, 1024]
    - [160, 37.682]
  - - [256, 4864, 1, 1024]
    - [161, 39.252]
  - - [256, 5376, 1, 1024]
    - [107, 43.527]
  - - [256, 5888, 1, 1024]
    - [77, 42.99]
  - - [256, 6144, 1, 1024]
    - [77, 44.201]
  - - [256, 6400, 1, 1024]
    - [162, 45.117]
  - - [256, 6656, 1, 1024]
    - [77, 46.521]
  - - [256, 7168, 1, 1024]
    - [77, 50.242]
  - - [256, 7424, 1, 1024]
    - [77, 52.186]
  - - [256, 7936, 1, 1024]
    - [163, 43.072]
  - - [256, 8192, 1, 1024]
    - [164, 45.162]
  - - [256, 8448, 1, 1024]
    - [164, 45.152]
  - - [256, 8960, 1, 1024]
    - [165, 52.088]
  - - [256, 9984, 1, 1024]
    - [166, 46.301]
  - - [256, 10496, 1, 1024]
    - [90, 47.42]
  - - [256, 11264, 1, 1024]
    - [167, 46.995]
  - - [256, 11520, 1, 1024]
    - [168, 47.498]
  - - [256, 11776, 1, 1024]
    - [53, 46.223]
  - - [256, 12544, 1, 1024]
    - [169, 48.847]
  - - [256, 13312, 1, 1024]
    - [77, 51.107]
  - - [256, 14336, 1, 1024]
    - [169, 55.56]
  - - [256, 14592, 1, 1024]
    - [170, 54.989]
  - - [256, 14848, 1, 1024]
    - [53, 57.004]
  - - [256, 15104, 1, 1024]
    - [77, 56.831]
  - - [256, 16128, 1, 1024]
    - [122, 55.259]
  - - [256, 18176, 1, 1024]
    - [130, 53.53]
  - - [256, 18944, 1, 1024]
    - [75, 55.195]
  - - [256, 19200, 1, 1024]
    - [130, 59.173]
  - - [256, 20480, 1, 1024]
    - [75, 57.289]
  - - [256, 20992, 1, 1024]
    - [75, 57.093]
  - - [256, 21248, 1, 1024]
    - [90, 57.281]
  - - [256, 21504, 1, 1024]
    - [75, 56.301]
  - - [256, 22016, 1, 1024]
    - [77, 56.973]
  - - [256, 22344, 1, 1024]
    - [77, 55.934]
  - - [256, 23296, 1, 1024]
    - [171, 53.915]
  - - [256, 23552, 1, 1024]
    - [172, 54.611]
  - - [256, 31488, 1, 1024]
    - [126, 59.103]
  - - [256, 33536, 1, 1024]
    - [122, 57.533]
  - - [256, 44505, 1, 1024]
    - [111, 60.089]
  - - [960, 1, 1, 2048]
    - [173, 0.116]
  - - [1024, 200, 1, 560]
    - [174, 6.924]
  - - [1024, 960, 1, 1600]
    - [75, 41.231]
  - - [1024, 32768, 1, 480]
    - [175, 64.358]
  - - [1280, 8976, 1, 256]
    - [176, 41.144]
  - - [1792, 8976, 1, 256]
    - [176, 43.84]
  - - [2048, 114, 1, 512]
    - [177, 8.878]
  - - [2048, 114, 1, 768]
    - [178, 11.112]
  - - [2048, 215, 1, 512]
    - [85, 14.065]
  - - [2048, 215, 1, 768]
    - [179, 18.188]
  - - [2048, 256, 1, 512]
    - [180, 15.899]
  - - [2048, 256, 1, 768]
    - [181, 20.043]
  - - [2048, 512, 1, 67]
    - [182, 5.057]
  - - [2048, 512, 1, 100]
    - [183, 6.96]
  - - [2048, 684, 1, 512]
    - [152, 27.174]
  - - [2048, 684, 1, 768]
    - [184, 33.119]
  - - [2048, 960, 1, 74]
    - [185, 8.302]
  - - [2048, 960, 1, 2048]
    - [86, 54.85]
  - - [2048, 1536, 1, 512]
    - [186, 38.159]
  - - [2048, 1536, 1, 768]
    - [186, 45.038]
  - - [2048, 8976, 1, 256]
    - [121, 41.198]
  - - [2304, 8976, 1, 256]
    - [176, 45.33]
  - - [2560, 8976, 1, 256]
    - [176, 45.05]
  - - [2816, 8976, 1, 256]
    - [176, 45.668]
  - - [3072, 8976, 1, 256]
    - [106, 44.666]
  - - [3328, 8976, 1, 256]
    - [176, 45.935]
  - - [3840, 8976, 1, 256]
    - [176, 46.003]
  - - [4096, 8976, 1, 256]
    - [176, 44.757]
  - - [4352, 8976, 1, 256]
    - [106, 46.079]
  - - [4608, 8976, 1, 256]
    - [176, 46.478]
  - - [4864, 8976, 1, 256]
    - [176, 46.757]
  - - [5120, 8976, 1, 256]
    - [90, 46.106]
  - - [5376, 8976, 1, 256]
    - [176, 46.842]
  - - [5632, 8976, 1, 256]
    - [176, 46.492]
  - - [5888, 8976, 1, 256]
    - [176, 47.21]
  - - [6144, 8976, 1, 256]
    - [187, 45.971]
  - - [6400, 8976, 1, 256]
    - [176, 46.939]
  - - [7168, 8976, 1, 256]
    - [109, 47.067]
  - - [7936, 8976, 1, 256]
    - [109, 47.326]
  - - [8192, 8976, 1, 256]
    - [75, 46.641]
  - - [8448, 8976, 1, 256]
    - [75, 47.236]
  - - [8960, 8976, 1, 256]
    - [109, 47.202]
  - - [9472, 8976, 1, 256]
    - [75, 47.215]
  - - [9728, 8976, 1, 256]
    - [109, 46.956]
  - - [9984, 8976, 1, 256]
    - [109, 47.01]
  - - [10240, 8976, 1, 256]
    - [109, 46.427]
  - - [10496, 8976, 1, 256]
    - [187, 46.895]
  - - [11264, 8976, 1, 256]
    - [187, 46.761]
  - - [11776, 8976, 1, 256]
    - [187, 47.422]
  - - [12544, 8976, 1, 256]
    - [75, 46.75]
  - - [13312, 8976, 1, 256]
    - [75, 47.168]
  - - [13568, 8976, 1, 256]
    - [187, 46.9]
  - - [13824, 8976, 1, 256]
    - [187, 47.171]
  - - [15104, 8976, 1, 256]
    - [90, 46.943]
  - - [15360, 8976, 1, 256]
    - [126, 46.898]
  - - [15872, 8976, 1, 256]
    - [109, 47.352]
  - - [16128, 8976, 1, 256]
    - [109, 48.203]
  - - [17152, 8976, 1, 256]
    - [187, 47.513]
  - - [18176, 8976, 1, 256]
    - [187, 47.946]
  - - [18688, 8976, 1, 256]
    - [187, 47.939]
  - - [18944, 8976, 1, 256]
    - [187, 47.003]
  - - [19712, 8976, 1, 256]
    - [187, 47.65]
  - - [19968, 8976, 1, 256]
    - [187, 47.695]
  - - [20480, 8976, 1, 256]
    - [75, 46.644]
  - - [20992, 8976, 1, 256]
    - [187, 47.593]
  - - [21248, 8976, 1, 256]
    - [187, 47.448]
  - - [23552, 8976, 1, 256]
    - [187, 47.884]
  - - [28672, 8976, 1, 256]
    - [75, 46.717]
  - - [31488, 8976, 1, 256]
    - [75, 48.044]
  - - [33536, 8976, 1, 256]
    - [109, 48.52]
  - - [2048, 1024, 1, 2048]
    - [87, 55.747]
  - - [2048, 1024, 1, 8192]
    - [130, 67.018]
  - - [2048, 2, 1, 2048]
    - [188, 0.47]
  - - [30592, 1024, 1, 2048]
    - [135, 74.909]
  - - [6144, 1024, 1, 2048]
    - [132, 61.868]
  - - [8192, 1024, 1, 2048]
    - [189, 64.986]
  - - [1024, 16, 1, 1024]
    - [150, 1.366]
  - - [30592, 8192, 1, 1024]
    - [134, 71.934]
  - - [3072, 8192, 1, 1024]
    - [93, 66.381]
  - - [512, 512, 256, 64]
    - [83, 20.198]
  - - [64, 512, 256, 512]
    - [190, 30.543]
  - - [30592, 2048, 1, 1024]
    - [121, 70.123]
  - - [3072, 2048, 1, 1024]
    - [191, 55.824]
  - - [30592, 4096, 1, 1024]
    - [134, 70.906]
  - - [3072, 4096, 1, 1024]
    - [192, 61.178]
  - - [64, 512, 128, 512]
    - [193, 28.506]
  - - [1920, 2048, 1, 2560]
    - [169, 73.483]
  - - [2560, 2048, 1, 2560]
    - [194, 66.143]
  - - [2560, 2048, 1, 640]
    - [195, 52.423]
  - - [2560, 4, 1, 2560]
    - [196, 1.305]
  - - [7680, 2048, 1, 2560]
    - [169, 78.032]
  - - [512, 512, 40, 64]
    - [83, 16.571]
  - - [64, 512, 40, 512]
    - [197, 23.522]
  - - [1536, 4096, 1, 1536]
    - [160, 62.327]
  - - [1536, 4096, 1, 6144]
    - [198, 68.72]
  - - [4608, 4096, 1, 1536]
    - [124, 72.023]
  - - [50304, 4096, 1, 1536]
    - [136, 78.531]
  - - [6144, 4096, 1, 1536]
    - [62, 71.056]
  - - [1024, 1024, 64, 96]
    - [199, 28.199]
  - - [96, 1024, 64, 1024]
    - [200, 42.578]
  - - [1536, 8192, 1, 1536]
    - [133, 66.816]
  - - [1536, 8192, 1, 6144]
    - [122, 79.504]
  - - [4608, 8192, 1, 1536]
    - [134, 74.72]
  - - [50304, 8192, 1, 1536]
    - [124, 79.404]
  - - [6144, 8192, 1, 1536]
    - [135, 73.578]
  - - [1024, 1024, 128, 96]
    - [199, 28.82]
  - - [96, 1024, 128, 1024]
    - [201, 46.146]
  - - [1024, 16384, 1, 1024]
    - [132, 62.316]
  - - [1024, 16384, 1, 4096]
    - [133, 75.757]
  - - [3072, 16384, 1, 1024]
    - [138, 68.019]
  - - [4096, 16384, 1, 1024]
    - [123, 70.873]
  - - [50304, 16384, 1, 1024]
    - [136, 74.388]
  - - [1024, 1024, 256, 64]
    - [202, 21.815]
  - - [64, 1024, 256, 1024]
    - [203, 36.465]
  - - [50304, 2048, 1, 1024]
    - [62, 71.108]
  - - [1024, 1024, 32, 64]
    - [204, 20.037]
  - - [64, 1024, 32, 1024]
    - [205, 30.13]
  - - [50304, 4096, 1, 1024]
    - [139, 72.828]
  - - [1024, 1024, 64, 64]
    - [206, 20.989]
  - - [64, 1024, 64, 1024]
    - [207, 32.625]
  - - [50304, 8192, 1, 1024]
    - [117, 73.557]
  - - [1024, 1024, 128, 64]
    - [208, 21.54]
  - - [64, 1024, 128, 1024]
    - [209, 35.304]
  - - [1024, 64, 1, 1024]
    - [210, 3.829]
  - - [30528, 8192, 1, 1024]
    - [136, 71.736]
  - - [128, 128, 1024, 64]
    - [211, 14.014]
  - - [64, 128, 1024, 128]
    - [83, 16.692]
  - - [1024, 3456, 1, 1024]
    - [53, 50.921]
  - - [1024, 3456, 1, 480]
    - [212, 39.643]
  - - [1024, 4096, 1, 480]
    - [213, 43.918]
  - - [1024, 6912, 1, 1024]
    - [214, 58.472]
  - - [1024, 6912, 1, 480]
    - [215, 50.627]
  - - [1024, 864, 1, 1024]
    - [80, 31.636]
  - - [1024, 864, 1, 480]
    - [216, 21.599]
  - - [128, 3456, 1, 256]
    - [217, 10.094]
  - - [128, 4096, 1, 256]
    - [197, 10.922]
  - - [128, 55296, 1, 256]
    - [218, 33.379]
  - - [128, 6912, 1, 256]
    - [159, 16.822]
  - - [128, 864, 1, 256]
    - [219, 3.117]
  - - [256, 3456, 1, 512]
    - [220, 24.224]
  - - [256, 4096, 1, 512]
    - [80, 24.996]
  - - [256, 55296, 1, 512]
    - [90, 54.699]
  - - [256, 6912, 1, 512]
    - [221, 36.703]
  - - [256, 864, 1, 512]
    - [60, 8.831]
  - - [3456, 1, 1, 256]
    - [173, 0.105]
  - - [4096, 1, 1, 256]
    - [94, 0.123]
  - - [512, 3456, 1, 1024]
    - [81, 46.457]
  - - [512, 3456, 1, 13]
    - [222, 1.538]
  - - [512, 4096, 1, 1024]
    - [223, 44.759]
  - - [512, 4096, 1, 13]
    - [104, 1.667]
  - - [512, 55296, 1, 13]
    - [224, 3.566]
  - - [512, 6912, 1, 1024]
    - [53, 55.055]
  - - [512, 6912, 1, 13]
    - [225, 2.121]
  - - [512, 864, 1, 1024]
    - [226, 20.091]
  - - [512, 864, 1, 13]
    - [227, 0.605]
  - - [6912, 1, 1, 256]
    - [228, 0.199]
  - - [864, 1, 1, 256]
    - [94, 0.027]
  - - [30528, 640, 1, 1024]
    - [136, 66.654]
  - - [30528, 1280, 1, 1024]
    - [134, 69.81]
  - - [30528, 1600, 1, 1024]
    - [135, 70.643]
  - - [1024, 10240, 1, 1024]
    - [126, 59.213]
  - - [1024, 80, 1, 1024]
    - [57, 4.937]
  - - [4096, 10240, 1, 1024]
    - [113, 69.276]
  - - [1024, 10240, 1, 4096]
    - [229, 73.2]
  - - [64, 128, 1280, 128]
    - [83, 17.066]
  - - [128, 128, 1280, 64]
    - [230, 14.257]
  - - [1024, 10496, 1, 4096]
    - [128, 75.043]
  - - [30528, 1640, 1, 1024]
    - [62, 68.393]
  - - [1024, 82, 1, 1024]
    - [60, 4.937]
  - - [4096, 10496, 1, 1024]
    - [113, 69.452]
  - - [1024, 10496, 1, 1024]
    - [231, 59.952]
  - - [64, 128, 1312, 128]
    - [181, 17.189]
  - - [128, 128, 1312, 64]
    - [232, 14.258]
  - - [30528, 160, 1, 1024]
    - [233, 57.362]
  - - [1024, 12, 1, 1024]
    - [150, 1.024]
  - - [30528, 240, 1, 1024]
    - [234, 55.901]
  - - [1024, 6144, 1, 1024]
    - [75, 55.568]
  - - [4096, 6144, 1, 1024]
    - [138, 65.892]
  - - [1024, 6144, 1, 4096]
    - [198, 66.018]
  - - [64, 512, 192, 512]
    - [80, 29.525]
  - - [512, 512, 192, 64]
    - [67, 19.938]
  - - [1024, 10224, 1, 1024]
    - [126, 59.051]
  - - [1024, 10192, 1, 1024]
    - [235, 59.04]
  - - [1024, 10208, 1, 1024]
    - [75, 58.682]
  - - [1024, 10224, 1, 4096]
    - [229, 72.165]
  - - [4096, 10224, 1, 1024]
    - [113, 67.927]
  - - [3072, 10224, 1, 1024]
    - [137, 66.442]
  - - [3072, 10240, 1, 1024]
    - [231, 67.666]
  - - [1024, 10192, 1, 4096]
    - [229, 72.043]
  - - [4096, 10192, 1, 1024]
    - [113, 67.645]
  - - [3072, 10192, 1, 1024]
    - [137, 66.484]
  - - [3072, 10200, 1, 1024]
    - [236, 67.508]
  - - [1024, 10184, 1, 1024]
    - [237, 58.889]
  - - [3072, 10208, 1, 1024]
    - [137, 66.647]
  - - [1024, 10208, 1, 4096]
    - [229, 72.391]
  - - [4096, 10208, 1, 1024]
    - [113, 67.889]
  - - [2048, 10224, 1, 1024]
    - [121, 64.395]
  - - [2048, 10240, 1, 1024]
    - [62, 65.059]
  - - [1024, 10120, 1, 1024]
    - [90, 59.288]
  - - [2048, 10192, 1, 1024]
    - [236, 63.723]
  - - [24, 24, 6816, 64]
    - [232, 4.075]
  - - [1024, 10152, 1, 1024]
    - [90, 59.869]
  - - [3072, 10080, 1, 1024]
    - [62, 68.092]
  - - [1024, 2048, 1, 49]
    - [238, 6.087]
  - - [1024, 256, 1, 196]
    - [239, 4.332]
  - - [1024, 512, 1, 196]
    - [240, 7.285]
  - - [1152, 128, 1, 784]
    - [153, 6.637]
  - - [128, 512, 1, 784]
    - [241, 3.063]
  - - [2048, 512, 1, 49]
    - [242, 4.109]
  - - [2304, 256, 1, 196]
    - [243, 8.259]
  - - [256, 1024, 1, 196]
    - [244, 4.411]
  - - [256, 128, 1, 3136]
    - [245, 4.645]
  - - [256, 512, 1, 784]
    - [246, 5.724]
  - - [256, 64, 1, 3136]
    - [247, 2.479]
  - - [4608, 512, 1, 49]
    - [248, 6.847]
  - - [512, 1024, 1, 196]
    - [249, 7.513]
  - - [512, 128, 1, 784]
    - [250, 2.95]
  - - [512, 2048, 1, 49]
    - [251, 4.218]
  - - [512, 256, 1, 784]
    - [252, 5.759]
  - - [576, 64, 1, 3136]
    - [253, 4.643]
  - - [64, 256, 1, 3136]
    - [254, 2.518]
  - - [64, 64, 1, 3136]
    - [255, 0.66]
  - - [128, 128, 49, 12800]
    - [256, 40.373]
  - - [128, 128, 25, 25088]
    - [257, 35.33]
  - - [128, 128, 49, 25600]
    - [258, 42.393]
  - - [128, 128, 25, 50176]
    - [259, 36.852]
  - - [256, 256, 25, 12544]
    - [260, 62.588]
  - - [256, 256, 49, 3200]
    - [261, 60.558]
  - - [256, 256, 25, 6272]
    - [77, 60.331]
  - - [256, 256, 49, 6400]
    - [261, 66.162]
  - - [512, 512, 49, 1152]
    - [162, 58.455]
  - - [512, 512, 25, 2048]
    - [127, 60.915]
  - - [512, 512, 49, 2304]
    - [162, 67.322]
  - - [512, 512, 25, 4096]
    - [127, 67.639]
  - - [64, 128, 2048, 128]
    - [262, 17.722]
  - - [128, 128, 2048, 64]
    - [78, 14.702]
  - - [30528, 2560, 1, 1024]
    - [134, 71.198]
  - - [1024, 128, 1, 1024]
    - [57, 7.612]
  - - [64, 128, 1536, 128]
    - [263, 17.325]
  - - [128, 128, 1536, 64]
    - [264, 14.437]
  - - [1024, 12288, 1, 1024]
    - [122, 60.23]
  - - [1024, 12288, 1, 4096]
    - [136, 74.433]
  - - [30528, 1920, 1, 1024]
    - [134, 71.064]
  - - [1024, 96, 1, 1024]
    - [57, 5.851]
  - - [4096, 12288, 1, 1024]
    - [128, 67.981]
  - - [128, 128, 36, 12544]
    - [265, 35.875]
  - - [128, 128, 49, 9216]
    - [266, 38.023]
  - - [128, 128, 64, 6400]
    - [267, 35.462]
  - - [128, 128, 81, 12544]
    - [268, 39.641]
  - - [128, 128, 121, 9216]
    - [197, 33.824]
  - - [128, 128, 169, 6400]
    - [256, 39.561]
  - - [256, 256, 36, 4096]
    - [128, 47.398]
  - - [256, 256, 49, 2304]
    - [269, 56.477]
  - - [256, 256, 64, 2304]
    - [75, 51.708]
  - - [256, 256, 81, 4096]
    - [270, 60.024]
  - - [256, 256, 121, 2304]
    - [271, 55.712]
  - - [256, 256, 169, 2304]
    - [272, 65.951]
  - - [512, 512, 81, 1024]
    - [229, 59.602]
  - - [512, 512, 121, 1024]
    - [229, 60.563]
  - - [512, 512, 169, 1024]
    - [229, 63.622]
  - - [512, 512, 36, 1024]
    - [273, 54.513]
  - - [512, 512, 49, 1024]
    - [267, 55.901]
  - - [512, 512, 64, 1024]
    - [273, 56.911]
  - - [64, 64, 36, 50176]
    - [274, 19.954]
  - - [64, 64, 49, 36864]
    - [275, 21.259]
  - - [64, 64, 64, 25600]
    - [276, 20.091]
  - - [128, 128, 192, 64]
    - [277, 10.467]
  - - [64, 128, 192, 128]
    - [277, 13.653]
  - - [768, 2048, 1, 768]
    - [194, 40.23]
  - - [3072, 2048, 1, 768]
    - [278, 53.011]
  - - [768, 2048, 1, 3072]
    - [162, 57.238]
  - - [768, 16, 1, 768]
    - [73, 0.901]
  - - [384, 384, 144, 64]
    - [279, 18.065]
  - - [64, 384, 144, 384]
    - [190, 25.589]
  - - [768, 4608, 1, 768]
    - [221, 48.633]
  - - [3072, 4608, 1, 768]
    - [88, 60.416]
  - - [768, 4608, 1, 3072]
    - [137, 68.559]
  - - [768, 12, 1, 768]
    - [150, 0.619]
  - - [512, 512, 48, 64]
    - [83, 17.325]
  - - [64, 512, 48, 512]
    - [277, 26.443]
  - - [768, 4, 1, 768]
    - [68, 0.213]
  - - [128, 128, 256, 64]
    - [78, 11.067]
  - - [64, 128, 256, 128]
    - [280, 12.688]
  - - [384, 384, 192, 64]
    - [67, 18.572]
  - - [64, 384, 192, 384]
    - [281, 25.576]
  - - [1024, 4608, 1, 1024]
    - [164, 54.877]
  - - [4096, 4608, 1, 1024]
    - [88, 65.015]
  - - [1024, 4608, 1, 4096]
    - [124, 77.995]
  - - [2880, 3072, 1, 3072]
    - [123, 73.597]
  - - [3072, 3072, 1, 3072]
    - [135, 78.142]
  - - [3072, 512, 1, 3072]
    - [194, 57.165]
  - - [4096, 512, 1, 4096]
    - [282, 56.651]
  - - [512, 1024, 1, 1024]
    - [181, 22.133]
  - - [512, 2048, 1, 2048]
    - [109, 41.869]
  - - [512, 3072, 1, 3072]
    - [152, 56.172]
  - - [512, 4096, 1, 4096]
    - [283, 57.833]
  - - [512, 8192, 1, 8192]
    - [284, 76.306]
  - - [64, 1024, 1, 1024]
    - [79, 3.975]
  - - [8192, 512, 1, 8192]
    - [285, 76.017]
  - - [2, 1, 1, 1024]
    - [286, 0.0]
  - - [2, 8, 1, 1024]
    - [287, 0.001]
  - - [30522, 77, 1, 1024]
    - [288, 29.83]
  - - [30522, 616, 1, 1024]
    - [289, 58.252]
  - - [2, 10, 1, 1024]
    - [290, 0.001]
  - - [30522, 160, 1, 1024]
    - [291, 51.427]
  - - [30522, 200, 1, 1024]
    - [289, 43.172]
  - - [2, 39, 1, 1024]
    - [292, 0.007]
  - - [30522, 780, 1, 1024]
    - [293, 61.827]
  - - [2, 4, 1, 1024]
    - [294, 0.001]
  - - [30522, 308, 1, 1024]
    - [295, 49.228]
  - - [2, 40, 1, 1024]
    - [188, 0.007]
  - - [30522, 800, 1, 1024]
    - [296, 63.327]
  - - [2, 41, 1, 1024]
    - [188, 0.007]
  - - [30522, 820, 1, 1024]
    - [297, 59.916]
  - - [2, 5, 1, 1024]
    - [298, 0.001]
  - - [30522, 385, 1, 1024]
    - [293, 52.769]
  - - [2, 6, 1, 1024]
    - [298, 0.001]
  - - [30522, 462, 1, 1024]
    - [299, 56.188]
  - - [2, 9, 1, 1024]
    - [300, 0.001]
  - - [30522, 180, 1, 1024]
    - [301, 38.627]
  - - [2, 32, 1, 1024]
    - [188, 0.005]
  - - [4, 4, 32768, 64]
    - [302, 0.701]
  - - [4, 4, 38400, 64]
    - [303, 0.719]
  - - [14, 14, 10880, 64]
    - [304, 2.991]
  - - [15, 14, 10880, 64]
    - [305, 3.168]
  - - [15, 15, 7680, 64]
    - [306, 2.891]
  - - [15, 15, 10880, 64]
    - [304, 3.347]
  - - [17, 15, 7680, 64]
    - [307, 2.48]
  - - [17, 17, 6144, 64]
    - [308, 2.369]
  - - [17, 17, 7680, 64]
    - [308, 3.028]
  - - [21, 17, 6144, 64]
    - [309, 2.686]
  - - [21, 21, 6144, 64]
    - [310, 3.005]
  - - [30, 30, 2048, 64]
    - [311, 3.743]
  - - [30, 31, 2048, 64]
    - [312, 3.777]
  - - [31, 31, 2048, 64]
    - [310, 3.89]
  - - [34, 24, 4736, 64]
    - [313, 4.611]
  - - [34, 34, 4736, 64]
    - [314, 4.574]
  - - [35, 35, 4608, 64]
    - [315, 3.982]
  - - [2, 2048, 1, 1024]
    - [286, 0.344]
  - - [2, 1024, 1, 1024]
    - [316, 0.172]
  - - [5, 5, 1, 64]
    - [317, 0.0]
  - - [33, 33, 1, 32]
    - [318, 0.004]
  - - [3, 3, 512, 64]
    - [319, 0.042]
  - - [5, 5, 512, 64]
    - [319, 0.116]
  - - [5, 5, 960, 64]
    - [320, 0.205]
  - - [9, 9, 512, 64]
    - [319, 0.345]
  - - [27, 27, 32768, 128]
    - [321, 7.68]
  - - [33, 33, 1600, 32]
    - [322, 1.911]
  - - [684, 8976, 1, 256]
    - [323, 31.976]
  - - [44505, 8976, 1, 256]
    - [289, 45.13]
  - - [2, 2, 1, 2048]
    - [324, 0.001]
  - - [2, 16, 1, 1024]
    - [325, 0.002]
  - - [2, 4, 1, 2560]
    - [326, 0.001]
  - - [2, 64, 1, 1024]
    - [188, 0.01]
  - - [2, 80, 1, 1024]
    - [292, 0.014]
  - - [2, 82, 1, 1024]
    - [188, 0.014]
  - - [2, 12, 1, 1024]
    - [327, 0.002]
  - - [1, 4096, 1, 256]
    - [328, 0.117]
  - - [1, 6912, 1, 256]
    - [327, 0.186]
  - - [26, 26, 6272, 64]
    - [321, 3.999]
  - - [147, 64, 1, 12544]
    - [329, 4.526]
  - - [2, 128, 1, 1024]
    - [188, 0.022]
  - - [2, 96, 1, 1024]
    - [188, 0.016]
  - - [2, 2048, 1, 768]
    - [316, 0.289]
  - - [2, 4608, 1, 768]
    - [316, 0.576]
  - - [2, 4608, 1, 1024]
    - [327, 0.712]
- null
