library/src/blas3/Tensile/Logic/asm_full/aldebaran_Cijk_Ailk_Bjlk_ZB.yaml
- {MinimumRequiredVersion: 4.28.0}
- aldebaran
- gfx90a
- [Device 7400, Device 7408, Device 740c]
    SolutionIndex: 0
    SolutionNameMin: Cijk_Ailk_Bjlk_ZB_MT64x32x8_MI16x16x4x1_SN_1LDSB1_IU2_NLCA1_NLCB1_SIA2_TT1_32_WG64_4_1
    SolutionIndex: 1
    SolutionNameMin: Cijk_Ailk_Bjlk_ZB_MT64x32x8_MI16x16x4x1_SN_1LDSB1_IU1_NLCA1_NLCB1_SIA3_TT1_32_WG64_4_1
    SolutionIndex: 2
    SolutionNameMin: Cijk_Ailk_Bjlk_ZB_MT64x64x8_MI16x16x4x1_SN_1LDSB1_IU1_NLCA1_NLCB1_SIA3_TT1_64_WG64_4_1
    SolutionIndex: 3
    SolutionNameMin: Cijk_Ailk_Bjlk_ZB_MT64x64x8_MI16x16x4x1_SN_1LDSB1_IU1_NLCA1_NLCB1_SIA3_TT1_64_WG64_4_1
    SolutionIndex: 4
    SolutionNameMin: Cijk_Ailk_Bjlk_ZB_MT64x64x8_MI16x16x4x1_SN_1LDSB1_IU1_NLCA1_NLCB1_SIA3_TT2_32_WG32_8_1
    SolutionIndex: 5
    SolutionNameMin: Cijk_Ailk_Bjlk_ZB_MT64x32x8_MI16x16x4x1_SN_1LDSB1_IU1_NLCA1_NLCB1_SIA3_TT1_32_WG64_4_1
    SolutionIndex: 6
    SolutionNameMin: Cijk_Ailk_Bjlk_ZB_MT64x64x8_MI16x16x4x1_SN_1LDSB1_IU1_NLCA1_NLCB1_SIA3_TT1_64_WG64_4_1
    SolutionIndex: 7
    SolutionNameMin: Cijk_Ailk_Bjlk_ZB_MT96x64x8_MI16x16x4x1_SN_1LDSB1_IU1_NLCA3_NLCB1_SIA3_TT6_16_WG16_16_1
    SolutionIndex: 8
    SolutionNameMin: Cijk_Ailk_Bjlk_ZB_MT64x64x8_MI16x16x4x1_SN_1LDSB1_IU1_NLCA1_NLCB1_SIA3_TT1_64_WG64_4_1
    SolutionIndex: 9
    SolutionNameMin: Cijk_Ailk_Bjlk_ZB_MT64x64x8_MI16x16x4x1_SN_1LDSB1_IU1_NLCA1_NLCB1_SIA3_TT2_32_WG32_8_1
    SolutionIndex: 10
    SolutionNameMin: Cijk_Ailk_Bjlk_ZB_MT64x32x8_MI16x16x4x1_SN_1LDSB1_IU1_NLCA1_NLCB1_SIA3_TT1_32_WG64_4_1
    SolutionIndex: 11
    SolutionNameMin: Cijk_Ailk_Bjlk_ZB_MT96x64x8_MI16x16x4x1_SN_1LDSB1_IU1_NLCA3_NLCB1_SIA3_TT6_16_WG16_16_1
    SolutionIndex: 12
    SolutionNameMin: Cijk_Ailk_Bjlk_ZB_MT64x64x8_MI16x16x4x1_SN_1LDSB1_IU1_NLCA1_NLCB1_SIA3_TT1_64_WG64_4_1
    SolutionIndex: 13
    SolutionNameMin: Cijk_Ailk_Bjlk_ZB_MT64x64x8_MI16x16x4x1_SN_1LDSB1_IU1_NLCA1_NLCB1_SIA3_TT2_32_WG32_8_1
    SolutionIndex: 14
    SolutionNameMin: Cijk_Ailk_Bjlk_ZB_MT64x32x8_MI16x16x4x1_SN_1LDSB1_IU1_NLCA1_NLCB1_SIA3_TT1_32_WG64_4_1
    SolutionIndex: 15
    SolutionNameMin: Cijk_Ailk_Bjlk_ZB_MT64x64x8_MI16x16x4x1_SN_1LDSB1_IU1_NLCA1_NLCB1_SIA3_TT2_32_WG32_8_1
    SolutionIndex: 16
    SolutionNameMin: Cijk_Ailk_Bjlk_ZB_MT64x64x8_MI16x16x4x1_SN_1LDSB1_IU1_NLCA1_NLCB1_SIA3_TT2_32_WG32_8_1
    SolutionIndex: 17
    SolutionNameMin: Cijk_Ailk_Bjlk_ZB_MT64x64x8_MI16x16x4x1_SN_1LDSB1_IU1_NLCA1_NLCB1_SIA3_TT2_32_WG32_8_1
    SolutionIndex: 18
    SolutionNameMin: Cijk_Ailk_Bjlk_ZB_MT64x64x8_MI16x16x4x1_SN_1LDSB1_IU1_NLCA1_NLCB1_SIA3_TT2_32_WG32_8_1
    SolutionIndex: 19
    SolutionNameMin: Cijk_Ailk_Bjlk_ZB_MT64x64x8_MI16x16x4x1_SN_1LDSB1_IU1_NLCA1_NLCB1_SIA3_TT2_32_WG32_8_1
    SolutionIndex: 20
    SolutionNameMin: Cijk_Ailk_Bjlk_ZB_MT64x64x8_MI16x16x4x1_SN_1LDSB1_IU1_NLCA1_NLCB1_SIA3_TT2_32_WG32_8_1
    SolutionIndex: 21
    SolutionNameMin: Cijk_Ailk_Bjlk_ZB_MT64x64x8_MI16x16x4x1_SN_1LDSB1_IU1_NLCA1_NLCB1_SIA3_TT2_32_WG32_8_1
    SolutionIndex: 22
    SolutionNameMin: Cijk_Ailk_Bjlk_ZB_MT64x64x8_MI16x16x4x1_SN_1LDSB1_IU1_NLCA1_NLCB1_SIA3_TT2_32_WG32_8_1
    SolutionIndex: 23
    SolutionNameMin: Cijk_Ailk_Bjlk_ZB_MT64x64x8_MI16x16x4x1_SN_1LDSB1_IU1_NLCA1_NLCB1_SIA3_TT2_32_WG32_8_1
    SolutionIndex: 24
    SolutionNameMin: Cijk_Ailk_Bjlk_ZB_MT64x64x8_MI16x16x4x1_SN_1LDSB1_IU1_NLCA1_NLCB1_SIA3_TT1_64_WG64_4_1
    SolutionIndex: 25
    SolutionNameMin: Cijk_Ailk_Bjlk_ZB_MT64x64x8_MI16x16x4x1_SN_1LDSB1_IU1_NLCA1_NLCB1_SIA3_TT2_32_WG32_8_1
    SolutionIndex: 26
    SolutionNameMin: Cijk_Ailk_Bjlk_ZB_MT64x32x8_MI16x16x4x1_SN_1LDSB1_IU1_NLCA1_NLCB1_SIA3_TT1_32_WG64_4_1
    SolutionIndex: 27
    SolutionNameMin: Cijk_Ailk_Bjlk_ZB_MT64x64x8_MI16x16x4x1_SN_1LDSB1_IU1_NLCA1_NLCB1_SIA3_TT2_32_WG32_8_1
    SolutionIndex: 28
    SolutionNameMin: Cijk_Ailk_Bjlk_ZB_MT64x64x8_MI16x16x4x1_SN_1LDSB1_IU1_NLCA1_NLCB1_SIA3_TT2_32_WG32_8_1
    SolutionIndex: 29
    SolutionNameMin: Cijk_Ailk_Bjlk_ZB_MT64x64x8_MI16x16x4x1_SN_1LDSB1_IU1_NLCA1_NLCB1_SIA3_TT1_64_WG64_4_1
    SolutionIndex: 30
    SolutionNameMin: Cijk_Ailk_Bjlk_ZB_MT64x64x8_MI16x16x4x1_SN_1LDSB1_IU1_NLCA1_NLCB1_SIA3_TT2_32_WG32_8_1
    SolutionIndex: 31
    SolutionNameMin: Cijk_Ailk_Bjlk_ZB_MT64x64x8_MI16x16x4x1_SN_1LDSB1_IU1_NLCA1_NLCB1_SIA3_TT2_32_WG32_8_1
    SolutionIndex: 32
    SolutionNameMin: Cijk_Ailk_Bjlk_ZB_MT64x64x8_MI16x16x4x1_SN_1LDSB1_IU1_NLCA1_NLCB1_SIA3_TT1_64_WG64_4_1
    SolutionIndex: 33
    SolutionNameMin: Cijk_Ailk_Bjlk_ZB_MT64x96x8_MI16x16x4x1_SN_1LDSB1_IU1_NLCA1_NLCB3_SIA3_TT2_48_WG32_8_1
    SolutionIndex: 34
    SolutionNameMin: Cijk_Ailk_Bjlk_ZB_MT32x64x8_MI16x16x4x1_SN_1LDSB1_IU1_NLCA1_NLCB1_SIA3_TT1_32_WG32_8_1
    SolutionIndex: 35
    SolutionNameMin: Cijk_Ailk_Bjlk_ZB_MT32x64x8_MI16x16x4x1_SN_1LDSB1_IU1_NLCA1_NLCB1_SIA3_TT1_32_WG32_8_1
    SolutionIndex: 36
    SolutionNameMin: Cijk_Ailk_Bjlk_ZB_MT64x96x8_MI16x16x4x1_SN_1LDSB1_IU1_NLCA1_NLCB3_SIA3_TT2_48_WG32_8_1
    SolutionIndex: 37
    SolutionNameMin: Cijk_Ailk_Bjlk_ZB_MT64x96x8_MI16x16x4x1_SN_1LDSB1_IU1_NLCA1_NLCB3_SIA3_TT2_48_WG32_8_1
    SolutionIndex: 38
    SolutionNameMin: Cijk_Ailk_Bjlk_ZB_MT32x64x8_MI16x16x4x1_SN_1LDSB1_IU1_NLCA1_NLCB1_SIA3_TT1_32_WG32_8_1
    SolutionIndex: 39
    SolutionNameMin: Cijk_Ailk_Bjlk_ZB_MT16x16x16_MI16x16x4x1_SN_1LDSB1_IU4_NLCA1_NLCB1_SIA2_TT1_16_WG16_4_1
    SolutionIndex: 40
    SolutionNameMin: Cijk_Ailk_Bjlk_ZB_MT16x16x16_MI16x16x4x1_SN_1LDSB0_IU1_NLCA1_NLCB1_SIA3_TT1_16_WG16_4_1
    SolutionIndex: 41
    SolutionNameMin: Cijk_Ailk_Bjlk_ZB_MT32x32x16_MI16x16x4x1_SN_1LDSB0_IU1_NLCA1_NLCB1_SIA3_TT1_16_WG32_8_1
    SolutionIndex: 42
    SolutionNameMin: Cijk_Ailk_Bjlk_ZB_MT64x64x8_MI16x16x4x1_SN_IU1_NLCA1_NLCB1_PLR3_SIA3_SU32_SSO4_TT1_64_WG64_4_1_WGM8
- - - [10112, 1792, 1, 128]
    - [30, 77.922]
  - - [10112, 1792, 1, 256]
    - [7, 84.055]
  - - [10112, 1792, 1, 384]
    - [7, 86.159]
  - - [1024, 1024, 1, 1024]
    - [26, 76.117]
  - - [10752, 1792, 1, 128]
    - [21, 78.274]
  - - [10752, 1792, 1, 256]
    - [17, 85.22]
  - - [10752, 1792, 1, 384]
    - [17, 87.005]
  - - [11392, 1792, 1, 128]
    - [25, 78.249]
  - - [11392, 1792, 1, 256]
    - [17, 84.517]
  - - [11392, 1792, 1, 384]
    - [20, 86.264]
  - - [12032, 1792, 1, 128]
    - [15, 79.085]
  - - [12032, 1792, 1, 256]
    - [17, 85.544]
  - - [12032, 1792, 1, 384]
    - [20, 87.295]
  - - [12672, 1792, 1, 128]
    - [30, 79.128]
  - - [12672, 1792, 1, 256]
    - [17, 84.918]
  - - [12672, 1792, 1, 384]
    - [17, 86.633]
  - - [1280, 1280, 1, 1280]
    - [6, 79.708]
  - - [13312, 1792, 1, 128]
    - [21, 79.156]
  - - [13312, 1792, 1, 256]
    - [17, 85.793]
  - - [13312, 1792, 1, 384]
    - [17, 87.535]
  - - [13952, 1792, 1, 128]
    - [31, 79.214]
  - - [13952, 1792, 1, 256]
    - [18, 85.222]
  - - [13952, 1792, 1, 384]
    - [17, 86.915]
  - - [14592, 1792, 1, 128]
    - [28, 78.821]
  - - [14592, 1792, 1, 256]
    - [16, 84.673]
  - - [14592, 1792, 1, 384]
    - [11, 86.444]
  - - [15232, 1792, 1, 128]
    - [28, 79.395]
  - - [15232, 1792, 1, 256]
    - [17, 85.472]
  - - [15232, 1792, 1, 384]
    - [17, 87.163]
  - - [1536, 1536, 1, 1536]
    - [26, 82.464]
  - - [15872, 1792, 1, 128]
    - [21, 78.75]
  - - [15872, 1792, 1, 256]
    - [17, 84.931]
  - - [15872, 1792, 1, 384]
    - [16, 86.588]
  - - [16512, 1792, 1, 128]
    - [21, 78.878]
  - - [16512, 1792, 1, 256]
    - [17, 85.678]
  - - [16512, 1792, 1, 384]
    - [16, 87.348]
  - - [17152, 1792, 1, 128]
    - [31, 79.43]
  - - [17152, 1792, 1, 256]
    - [18, 85.193]
  - - [17152, 1792, 1, 384]
    - [17, 86.852]
  - - [17792, 1792, 1, 128]
    - [21, 79.967]
  - - [17792, 1792, 1, 256]
    - [17, 85.881]
  - - [17792, 1792, 1, 384]
    - [20, 87.545]
  - - [1792, 1792, 1, 1792]
    - [33, 84.865]
  - - [18432, 1792, 1, 128]
    - [28, 78.842]
  - - [18432, 1792, 1, 256]
    - [17, 85.377]
  - - [18432, 1792, 1, 384]
    - [17, 87.038]
  - - [19072, 1792, 1, 128]
    - [19, 79.643]
  - - [19072, 1792, 1, 256]
    - [17, 86.043]
  - - [19072, 1792, 1, 384]
    - [18, 87.683]
  - - [19712, 1792, 1, 128]
    - [31, 79.809]
  - - [19712, 1792, 1, 256]
    - [17, 85.605]
  - - [19712, 1792, 1, 384]
    - [16, 87.238]
  - - [20352, 1792, 1, 128]
    - [31, 80.316]
  - - [20352, 1792, 1, 256]
    - [17, 86.167]
  - - [20352, 1792, 1, 384]
    - [20, 87.814]
  - - [2048, 2048, 1, 2048]
    - [35, 86.365]
  - - [20992, 1792, 1, 128]
    - [21, 79.445]
  - - [20992, 1792, 1, 256]
    - [16, 85.76]
  - - [20992, 1792, 1, 384]
    - [17, 87.381]
  - - [21632, 1792, 1, 128]
    - [31, 79.651]
  - - [21632, 1792, 1, 256]
    - [17, 85.384]
  - - [21632, 1792, 1, 384]
    - [20, 86.981]
  - - [22272, 1792, 1, 128]
    - [31, 80.131]
  - - [22272, 1792, 1, 256]
    - [17, 85.933]
  - - [22272, 1792, 1, 384]
    - [16, 87.537]
  - - [22912, 1792, 1, 128]
    - [28, 79.903]
  - - [22912, 1792, 1, 256]
    - [16, 85.529]
  - - [22912, 1792, 1, 384]
    - [20, 87.137]
  - - [2304, 2304, 1, 2304]
    - [12, 88.722]
  - - [23552, 1792, 1, 128]
    - [21, 79.917]
  - - [23552, 1792, 1, 256]
    - [17, 86.035]
  - - [23552, 1792, 1, 384]
    - [18, 87.641]
  - - [24192, 1792, 1, 128]
    - [28, 79.957]
  - - [24192, 1792, 1, 256]
    - [20, 85.678]
  - - [24192, 1792, 1, 384]
    - [17, 87.272]
  - - [24832, 1792, 1, 128]
    - [31, 80.263]
  - - [24832, 1792, 1, 256]
    - [17, 86.145]
  - - [24832, 1792, 1, 384]
    - [17, 87.758]
  - - [25472, 1792, 1, 128]
    - [31, 80.255]
  - - [25472, 1792, 1, 256]
    - [18, 85.823]
  - - [25472, 1792, 1, 384]
    - [20, 87.413]
  - - [256, 256, 1, 256]
    - [1, 11.954]
  - - [2560, 2560, 1, 2560]
    - [12, 87.838]
  - - [26112, 1792, 1, 128]
    - [15, 79.585]
  - - [26112, 1792, 1, 256]
    - [16, 86.237]
  - - [26112, 1792, 1, 384]
    - [17, 87.84]
  - - [26752, 1792, 1, 128]
    - [31, 80.043]
  - - [26752, 1792, 1, 256]
    - [16, 85.935]
  - - [26752, 1792, 1, 384]
    - [16, 87.524]
  - - [27392, 1792, 1, 128]
    - [31, 80.296]
  - - [27392, 1792, 1, 256]
    - [17, 86.36]
  - - [27392, 1792, 1, 384]
    - [20, 87.95]
  - - [28032, 1792, 1, 128]
    - [27, 80.333]
  - - [28032, 1792, 1, 256]
    - [18, 86.058]
  - - [28032, 1792, 1, 384]
    - [17, 87.631]
  - - [2816, 2816, 1, 2816]
    - [8, 88.717]
  - - [28672, 1792, 1, 128]
    - [24, 74.327]
  - - [28672, 1792, 1, 256]
    - [16, 85.558]
  - - [28672, 1792, 1, 384]
    - [22, 87.188]
  - - [29312, 1792, 1, 128]
    - [27, 80.119]
  - - [29312, 1792, 1, 256]
    - [16, 86.138]
  - - [29312, 1792, 1, 384]
    - [17, 87.724]
  - - [29952, 1792, 1, 128]
    - [31, 80.569]
  - - [29952, 1792, 1, 256]
    - [18, 85.877]
  - - [29952, 1792, 1, 384]
    - [18, 87.42]
  - - [30592, 1792, 1, 128]
    - [27, 80.561]
  - - [30592, 1792, 1, 256]
    - [17, 86.234]
  - - [30592, 1792, 1, 384]
    - [18, 87.809]
  - - [3072, 1792, 1, 128]
    - [15, 70.846]
  - - [3072, 1792, 1, 256]
    - [5, 79.243]
  - - [3072, 1792, 1, 384]
    - [14, 82.094]
  - - [3072, 3072, 1, 3072]
    - [12, 90.586]
  - - [31232, 1792, 1, 128]
    - [20, 79.748]
  - - [31232, 1792, 1, 256]
    - [17, 85.958]
  - - [31232, 1792, 1, 384]
    - [17, 87.508]
  - - [31872, 1792, 1, 128]
    - [27, 80.571]
  - - [31872, 1792, 1, 256]
    - [17, 86.312]
  - - [31872, 1792, 1, 384]
    - [18, 87.888]
  - - [32512, 1792, 1, 128]
    - [30, 80.612]
  - - [32512, 1792, 1, 256]
    - [17, 86.053]
  - - [32512, 1792, 1, 384]
    - [18, 87.607]
  - - [33152, 1792, 1, 128]
    - [30, 80.913]
  - - [33152, 1792, 1, 256]
    - [17, 86.354]
  - - [33152, 1792, 1, 384]
    - [20, 87.941]
  - - [3328, 3328, 1, 3328]
    - [12, 89.427]
  - - [33792, 1792, 1, 128]
    - [15, 80.12]
  - - [33792, 1792, 1, 256]
    - [17, 86.117]
  - - [33792, 1792, 1, 384]
    - [18, 87.678]
  - - [34432, 1792, 1, 128]
    - [16, 79.74]
  - - [34432, 1792, 1, 256]
    - [17, 86.44]
  - - [34432, 1792, 1, 384]
    - [20, 88.017]
  - - [35072, 1792, 1, 128]
    - [30, 80.846]
  - - [35072, 1792, 1, 256]
    - [20, 86.233]
  - - [35072, 1792, 1, 384]
    - [17, 87.772]
  - - [35712, 1792, 1, 128]
    - [30, 80.826]
  - - [35712, 1792, 1, 256]
    - [16, 85.994]
  - - [35712, 1792, 1, 384]
    - [20, 87.525]
  - - [3584, 3584, 1, 3584]
    - [12, 89.472]
  - - [36352, 1792, 1, 128]
    - [13, 79.908]
  - - [36352, 1792, 1, 256]
    - [17, 86.264]
  - - [36352, 1792, 1, 384]
    - [17, 87.83]
  - - [36992, 1792, 1, 128]
    - [30, 80.872]
  - - [36992, 1792, 1, 256]
    - [17, 86.059]
  - - [36992, 1792, 1, 384]
    - [16, 87.592]
  - - [3712, 1792, 1, 128]
    - [13, 74.546]
  - - [3712, 1792, 1, 256]
    - [4, 82.323]
  - - [3712, 1792, 1, 384]
    - [4, 84.63]
  - - [37632, 1792, 1, 128]
    - [20, 80.797]
  - - [37632, 1792, 1, 256]
    - [17, 86.367]
  - - [37632, 1792, 1, 384]
    - [18, 87.907]
  - - [38272, 1792, 1, 128]
    - [22, 77.081]
  - - [38272, 1792, 1, 256]
    - [16, 86.118]
  - - [38272, 1792, 1, 384]
    - [16, 87.669]
  - - [3840, 3840, 1, 3840]
    - [3, 90.318]
  - - [38912, 1792, 1, 128]
    - [27, 79.437]
  - - [38912, 1792, 1, 256]
    - [16, 86.399]
  - - [38912, 1792, 1, 384]
    - [17, 87.946]
  - - [39552, 1792, 1, 128]
    - [30, 81.112]
  - - [39552, 1792, 1, 256]
    - [20, 86.211]
  - - [39552, 1792, 1, 384]
    - [16, 87.74]
  - - [40192, 1792, 1, 128]
    - [13, 80.68]
  - - [40192, 1792, 1, 256]
    - [17, 86.455]
  - - [40192, 1792, 1, 384]
    - [17, 88.025]
  - - [40832, 1792, 1, 128]
    - [30, 80.684]
  - - [40832, 1792, 1, 256]
    - [17, 86.246]
  - - [40832, 1792, 1, 384]
    - [17, 87.791]
  - - [4096, 4096, 1, 4096]
    - [24, 89.246]
  - - [41472, 1792, 1, 128]
    - [13, 80.07]
  - - [41472, 1792, 1, 256]
    - [17, 86.463]
  - - [41472, 1792, 1, 384]
    - [18, 88.036]
  - - [42112, 1792, 1, 128]
    - [30, 80.932]
  - - [42112, 1792, 1, 256]
    - [18, 86.332]
  - - [42112, 1792, 1, 384]
    - [20, 87.869]
  - - [42752, 1792, 1, 128]
    - [13, 80.765]
  - - [42752, 1792, 1, 256]
    - [17, 86.152]
  - - [42752, 1792, 1, 384]
    - [20, 87.669]
  - - [43392, 1792, 1, 128]
    - [30, 81.03]
  - - [43392, 1792, 1, 256]
    - [17, 86.389]
  - - [43392, 1792, 1, 384]
    - [20, 87.923]
  - - [4352, 1792, 1, 128]
    - [15, 73.934]
  - - [4352, 1792, 1, 256]
    - [38, 81.483]
  - - [4352, 1792, 1, 384]
    - [34, 83.882]
  - - [4352, 4352, 1, 4352]
    - [10, 89.596]
  - - [44032, 1792, 1, 128]
    - [20, 80.417]
  - - [44032, 1792, 1, 256]
    - [18, 86.182]
  - - [44032, 1792, 1, 384]
    - [18, 87.714]
  - - [4608, 4608, 1, 4608]
    - [12, 89.545]
  - - [4864, 4864, 1, 4864]
    - [3, 90.378]
  - - [4992, 1792, 1, 128]
    - [17, 76.085]
  - - [4992, 1792, 1, 256]
    - [4, 83.689]
  - - [4992, 1792, 1, 384]
    - [17, 85.924]
  - - [512, 512, 1, 512]
    - [0, 42.824]
  - - [5120, 5120, 1, 5120]
    - [12, 89.983]
  - - [5376, 5376, 1, 5376]
    - [37, 90.661]
  - - [5632, 1792, 1, 128]
    - [2, 74.834]
  - - [5632, 1792, 1, 256]
    - [17, 82.48]
  - - [5632, 1792, 1, 384]
    - [4, 84.582]
  - - [5632, 5632, 1, 5632]
    - [12, 90.518]
  - - [5888, 5888, 1, 5888]
    - [29, 91.237]
  - - [6144, 6144, 1, 6144]
    - [29, 91.072]
  - - [6272, 1792, 1, 128]
    - [4, 77.163]
  - - [6272, 1792, 1, 256]
    - [17, 84.602]
  - - [6272, 1792, 1, 384]
    - [17, 86.661]
  - - [64, 1, 1, 256]
    - [40, 0.017]
  - - [64, 64, 1, 256]
    - [39, 1.099]
  - - [6400, 6400, 1, 6400]
    - [29, 91.241]
  - - [6656, 6656, 1, 6656]
    - [12, 90.73]
  - - [6912, 1792, 1, 128]
    - [9, 77.142]
  - - [6912, 1792, 1, 256]
    - [18, 83.57]
  - - [6912, 1792, 1, 384]
    - [17, 85.521]
  - - [6912, 6912, 1, 6912]
    - [36, 90.867]
  - - [7168, 7168, 1, 7168]
    - [29, 90.61]
  - - [7424, 7424, 1, 7424]
    - [32, 90.883]
  - - [7552, 1792, 1, 128]
    - [31, 76.332]
  - - [7552, 1792, 1, 256]
    - [17, 82.645]
  - - [7552, 1792, 1, 384]
    - [17, 84.497]
  - - [768, 768, 1, 768]
    - [0, 71.195]
  - - [7680, 7680, 1, 7680]
    - [29, 91.322]
  - - [7936, 7936, 1, 7936]
    - [29, 91.253]
  - - [8192, 1792, 1, 128]
    - [23, 74.744]
  - - [8192, 1792, 1, 256]
    - [16, 84.002]
  - - [8192, 1792, 1, 384]
    - [16, 85.923]
  - - [8192, 8192, 1, 8192]
    - [29, 91.275]
  - - [8832, 1792, 1, 128]
    - [20, 77.291]
  - - [8832, 1792, 1, 256]
    - [18, 83.398]
  - - [8832, 1792, 1, 384]
    - [17, 85.261]
  - - [9472, 1792, 1, 128]
    - [18, 78.474]
  - - [9472, 1792, 1, 256]
    - [18, 84.831]
  - - [9472, 1792, 1, 384]
    - [17, 86.645]
  - - [1, 1, 1, 256]
    - [40, 0.0]
  - - [1, 64, 1, 256]
    - [41, 0.017]
  - - [4224, 3840, 1, 4096]
    - [42, 91.106]
  - - [5376, 4096, 1, 4096]
    - [42, 90.901]
- null
- null
- DeviceEfficiency
