library/src/blas3/Tensile/Logic/asm_full/arcturus_Cijk_Alik_Bljk_BBH.yaml
- {MinimumRequiredVersion: 4.14.0}
- arcturus
- gfx908
- [Device 7380, Device 7388, Device 738c, Device 7390]
    SolutionIndex: 0
    SolutionNameMin: Cijk_Alik_Bljk_BBH_MT64x80x64_MI16x16x8x1_SE_1LDSB0_AF0EM4_AMAS3_ASEM1_BL1_EPS1_GRVW4_GSU1_ISA908_IU1_KLA_LBSPP128_LPA8_LPB8_LRVW8_MAC_PGR1_PLR9_SIA3_SU16_SUM0_SUS128_SRVW0_TT1_80_TLDS1_USFGROn1_VSn1_VW2_WSGRA1_WSGRB1_WG64_4_1_WGM15
    SolutionIndex: 1
    SolutionNameMin: Cijk_Alik_Bljk_BBH_MT128x96x32_MI32x32x4x1_SE_1LDSB1_AF0EM1_AMAS3_ASEM1_BL1_EPS1_GRVW2_GSU1_ISA908_IU1_KLA_LBSPP128_LPA4_LPB4_LRVW4_MAC_PGR1_PLR9_SIA3_SU32_SUM0_SUS128_SRVW4_TT1_96_TLDS1_USFGROn1_VSn1_VW2_WSGRA1_WSGRB1_WG128_2_1_WGM15
    SolutionIndex: 2
    SolutionNameMin: Cijk_Alik_Bljk_BBH_MT128x96x64_MI32x32x4x1_SE_1LDSB1_AF0EM8_AMAS3_ASEM1_BL1_EPS1_GRVW2_GSU1_ISA908_IU1_KLA_LBSPP128_LPA4_LPB4_LRVW4_MAC_PGR1_PLR17_SIA3_SU32_SUM0_SUS256_SRVW4_TT1_96_TLDS1_USFGROn1_VSn1_VW2_WSGRA1_WSGRB1_WG128_2_1_WGM15
    SolutionIndex: 3
    SolutionNameMin: Cijk_Alik_Bljk_BBH_MT128x160x32_MI32x32x4x1_SE_1LDSB1_AF0EM8_AMAS3_ASEM1_BL1_EPS1_GRVW2_GSU1_ISA908_IU1_KLA_LBSPP128_LPA4_LPB4_LRVW4_MAC_PGR1_PLR9_SIA3_SU0_SUM0_SUS256_SRVW4_TT1_160_TLDS1_USFGROn1_VSn1_VW2_WSGRA1_WSGRB1_WG128_2_1_WGM15
    SolutionIndex: 4
    SolutionNameMin: Cijk_Alik_Bljk_BBH_MT64x128x64_MI32x32x4x1_SE_1LDSB1_AF0EM1_AMAS3_ASEM1_BL1_EPS1_GRVW8_GSU1_ISA908_IU1_KLA_LBSPP128_LPA8_LPB8_LRVW4_MAC_PGR1_PLR17_SIA3_SU32_SUM0_SUS256_SRVW4_TT1_64_TLDS1_USFGROn1_VSn1_VW2_WSGRA1_WSGRB1_WG64_4_1_WGM2
    SolutionIndex: 5
    SolutionNameMin: Cijk_Alik_Bljk_BBH_MT128x96x32_MI32x32x4x1_SE_1LDSB1_AF0EM8_AMAS3_ASEM1_BL1_EPS0_GRVW4_GSU1_ISA908_IU1_KLA_LBSPP128_LPA4_LPB4_LRVW4_MAC_PGR2_PLR9_SIA3_SU0_SUM0_SUS256_SRVW4_TT1_96_TLDS1_USFGROn1_VSn1_VW2_WSGRA1_WSGRB1_WG128_2_1_WGM15
    SolutionIndex: 6
    SolutionNameMin: Cijk_Alik_Bljk_BBH_MT128x80x64_MI16x16x8x1_SE_1LDSB0_AF0EM4_AMAS3_ASEM1_BL1_EPS1_GRVW2_GSU1_ISA908_IU1_KLA_LBSPP128_LPA8_LPB8_LRVW8_MAC_PGR1_PLR9_SIA3_SU32_SUM0_SUS256_SRVW0_TT2_80_TLDS1_USFGROn1_VSn1_VW2_WSGRA1_WSGRB1_WG64_4_1_WGM2
    SolutionIndex: 7
    SolutionNameMin: Cijk_Alik_Bljk_BBH_MT128x80x64_MI16x16x8x1_SE_1LDSB0_AF0EM4_AMAS3_ASEM1_BL1_EPS1_GRVW2_GSU1_ISA908_IU1_KLA_LBSPP128_LPA8_LPB8_LRVW8_MAC_PGR1_PLR9_SIA3_SU0_SUM0_SUS256_SRVW0_TT2_80_TLDS1_USFGROn1_VSn1_VW2_WSGRA1_WSGRB1_WG64_4_1_WGM2
    SolutionIndex: 8
    SolutionNameMin: Cijk_Alik_Bljk_BBH_MT128x64x64_MI32x32x4x1_SE_1LDSB1_AF0EM8_AMAS3_ASEM1_BL1_EPS1_GRVW8_GSU1_ISA908_IU1_KLA_LBSPP128_LPA8_LPB8_LRVW4_MAC_PGR1_PLR17_SIA3_SU32_SUM0_SUS256_SRVW4_TT2_32_TLDS1_USFGROn1_VSn1_VW2_WSGRA1_WSGRB1_WG64_4_1_WGM15
    SolutionIndex: 9
    SolutionNameMin: Cijk_Alik_Bljk_BBH_MT64x64x128_MI32x32x4x1_SE_1LDSB1_AF0EM1_AMAS3_ASEM1_BL1_EPS1_GRVW8_GSU1_ISA908_IU1_KLA_LBSPP256_LPA8_LPB8_LRVW8_MAC_PGR1_PLR33_SIA3_SU0_SUM0_SUS256_SRVW4_TT1_32_TLDS1_USFGROn1_VSn1_VW2_WSGRA1_WSGRB1_WG64_4_1_WGM15
    SolutionIndex: 10
    SolutionNameMin: Cijk_Alik_Bljk_BBH_MT128x160x32_MI32x32x4x1_SE_1LDSB1_AF0EM8_AMAS3_ASEM1_BL1_EPS1_GRVW2_GSU1_ISA908_IU1_KLA_LBSPP128_LPA4_LPB4_LRVW4_MAC_PGR1_PLR9_SIA3_SU0_SUM0_SUS256_SRVW4_TT1_160_TLDS1_USFGROn1_VSn1_VW2_WSGRA1_WSGRB1_WG128_2_1_WGM2
    SolutionIndex: 11
    SolutionNameMin: Cijk_Alik_Bljk_BBH_MT32x32x64_MI16x16x8x1_SE_1LDSB1_AF0EM1_AMAS3_ASEM1_BL1_EPS1_GRVW4_GSU1_ISA908_IU1_KLA_LBSPP128_LPA4_LPB4_LRVW4_MAC_PGR1_PLR9_SIA3_SU0_SUM0_SUS256_SRVW4_TT1_16_TLDS1_USFGROn1_VSn1_VW2_WSGRA1_WSGRB1_WG32_8_1_WGM2
    SolutionIndex: 12
    SolutionNameMin: Cijk_Alik_Bljk_BBH_MT64x80x64_MI16x16x8x1_SE_1LDSB0_AF0EM4_AMAS3_ASEM1_BL1_EPS1_GRVW4_GSU1_ISA908_IU1_KLA_LBSPP128_LPA8_LPB8_LRVW8_MAC_PGR1_PLR9_SIA3_SU32_SUM0_SUS256_SRVW0_TT1_80_TLDS1_USFGROn1_VSn1_VW2_WSGRA1_WSGRB1_WG64_4_1_WGM2
    SolutionIndex: 13
    SolutionNameMin: Cijk_Alik_Bljk_BBH_MT64x64x32_MI16x16x2x4_SE_1LDSB0_AF0EM1_AMAS3_ASEM1_BL1_EPS1_GRVW4_GSU1_ISA908_IU2_KLA_LBSPP128_LPA4_LPB4_LRVW2_MAC_PGR1_PLR1_SIA3_SU16_SUM0_SUS256_SRVW0_TT1_16_TLDS1_USFGROn1_VSn1_VW2_WSGRA0_WSGRB0_WG64_4_1_WGM8
    SolutionIndex: 14
    SolutionNameMin: Cijk_Alik_Bljk_BBH_MT64x64x64_MI32x32x4x1_SE_1LDSB1_AF0EM8_AMAS3_ASEM1_BL1_EPS1_GRVW4_GSU1_ISA908_IU1_KLA_LBSPP128_LPA4_LPB4_LRVW4_MAC_PGR1_PLR17_SIA3_SU0_SUM0_SUS256_SRVW4_TT1_32_TLDS1_USFGROn1_VSn1_VW2_WSGRA1_WSGRB1_WG64_4_1_WGM15
    SolutionIndex: 15
    SolutionNameMin: Cijk_Alik_Bljk_BBH_MT128x144x32_MI16x16x8x1_SE_1LDSB1_AF0EM8_AMAS3_ASEM1_BL1_EPS1_GRVW2_GSU1_ISA908_IU1_KLA_LBSPP128_LPA4_LPB4_LRVW4_MAC_PGR1_PLR5_SIA3_SU0_SUM0_SUS256_SRVW4_TT2_144_TLDS1_USFGROn1_VSn1_VW2_WSGRA1_WSGRB1_WG64_4_1_WGM2
    SolutionIndex: 16
    SolutionNameMin: Cijk_Alik_Bljk_BBH_MT128x80x64_MI16x16x8x1_SE_1LDSB0_AF0EM4_AMAS3_ASEM1_BL1_EPS1_GRVW2_GSU1_ISA908_IU1_KLA_LBSPP128_LPA8_LPB8_LRVW8_MAC_PGR1_PLR9_SIA3_SU32_SUM0_SUS128_SRVW0_TT2_80_TLDS1_USFGROn1_VSn1_VW2_WSGRA1_WSGRB1_WG64_4_1_WGM2
    SolutionIndex: 17
    SolutionNameMin: Cijk_Alik_Bljk_BBH_MT128x160x32_MI32x32x4x1_SE_1LDSB1_AF0EM8_AMAS3_ASEM1_BL1_EPS1_GRVW2_GSU1_ISA908_IU1_KLA_LBSPP128_LPA4_LPB4_LRVW4_MAC_PGR1_PLR9_SIA3_SU0_SUM0_SUS256_SRVW4_TT1_160_TLDS1_USFGROn1_VSn1_VW2_WSGRA1_WSGRB1_WG128_2_1_WGM1
    SolutionIndex: 18
    SolutionNameMin: Cijk_Alik_Bljk_BBH_MT32x64x32_MI16x16x8x1_SE_1LDSB0_AF0EM1_AMAS3_ASEM1_BL1_EPS1_GRVW2_GSU1_ISA908_IU1_KLA_LBSPP128_LPA2_LPB2_LRVW2_MAC_PGR1_PLR1_SIA3_SU32_SUM3_SUS256_SRVW4_TT2_16_TLDS1_USFGROn1_VSn1_VW2_WSGRA0_WSGRB1_WG16_16_1_WGM1
    SolutionIndex: 19
    SolutionNameMin: Cijk_Alik_Bljk_BBH_MT64x80x64_MI16x16x8x1_SE_1LDSB0_AF0EM4_AMAS3_ASEM1_BL1_EPS1_GRVW4_GSU1_ISA908_IU1_KLA_LBSPP128_LPA8_LPB8_LRVW8_MAC_PGR1_PLR9_SIA3_SU0_SUM0_SUS256_SRVW0_TT1_80_TLDS1_USFGROn1_VSn1_VW2_WSGRA1_WSGRB1_WG64_4_1_WGM15
    SolutionIndex: 20
    SolutionNameMin: Cijk_Alik_Bljk_BBH_MT32x32x32_MI16x16x8x1_SE_1LDSB0_AF0EM1_AMAS3_ASEM1_BL1_EPS1_GRVW4_GSU1_ISA908_IU1_KLA_LBSPP128_LPA4_LPB4_LRVW2_MAC_PGR1_PLR1_SIA3_SU32_SUM0_SUS256_SRVW0_TT1_16_TLDS1_USFGROn1_VSn1_VW2_WSGRA1_WSGRB0_WG32_8_1_WGM1
    SolutionIndex: 21
    SolutionNameMin: Cijk_Alik_Bljk_BBH_MT32x64x32_MI16x16x8x1_SE_1LDSB0_AF0EM1_AMAS3_ASEM1_BL1_EPS1_GRVW4_GSU1_ISA908_IU1_KLA_LBSPP128_LPA4_LPB4_LRVW2_MAC_PGR1_PLR1_SIA3_SU32_SUM0_SUS256_SRVW4_TT2_16_TLDS1_USFGROn1_VSn1_VW2_WSGRA1_WSGRB0_WG16_16_1_WGM1
    SolutionIndex: 22
    SolutionNameMin: Cijk_Alik_Bljk_BBH_MT128x96x64_MI32x32x4x1_SE_1LDSB1_AF0EM1_AMAS3_ASEM1_BL1_EPS1_GRVW8_GSU1_ISA908_IU1_KLA_LBSPP128_LPA8_LPB8_LRVW4_MAC_PGR1_PLR17_SIA3_SU32_SUM0_SUS128_SRVW4_TT1_96_TLDS1_USFGROn1_VSn1_VW2_WSGRA1_WSGRB1_WG128_2_1_WGM15
    SolutionIndex: 23
    SolutionNameMin: Cijk_Alik_Bljk_BBH_MT64x64x32_MI32x32x4x1_SE_1LDSB1_AF0EM1_AMAS3_ASEM1_BL1_EPS1_GRVW2_GSU1_ISA908_IU1_KLA_LBSPP128_LPA4_LPB4_LRVW4_MAC_PGR1_PLR9_SIA3_SU0_SUM0_SUS256_SRVW4_TT1_32_TLDS1_USFGROn1_VSn1_VW2_WSGRA1_WSGRB1_WG64_4_1_WGM1
    SolutionIndex: 24
    SolutionNameMin: Cijk_Alik_Bljk_BBH_MT128x96x64_MI32x32x4x1_SE_1LDSB1_AF0EM8_AMAS3_ASEM1_BL1_EPS1_GRVW2_GSU1_ISA908_IU1_KLA_LBSPP128_LPA4_LPB4_LRVW4_MAC_PGR1_PLR17_SIA3_SU32_SUM0_SUS256_SRVW4_TT1_96_TLDS1_USFGROn1_VSn1_VW2_WSGRA1_WSGRB1_WG128_2_1_WGM2
    SolutionIndex: 25
    SolutionNameMin: Cijk_Alik_Bljk_BBH_MT128x96x32_MI32x32x4x1_SE_1LDSB1_AF0EM8_AMAS3_ASEM1_BL1_EPS1_GRVW2_GSU1_ISA908_IU1_KLA_LBSPP128_LPA4_LPB4_LRVW4_MAC_PGR1_PLR9_SIA3_SU32_SUM0_SUS128_SRVW4_TT1_96_TLDS1_USFGROn1_VSn1_VW2_WSGRA1_WSGRB1_WG128_2_1_WGM15
    SolutionIndex: 26
    SolutionNameMin: Cijk_Alik_Bljk_BBH_MT128x80x64_MI16x16x8x1_SE_1LDSB0_AF0EM4_AMAS3_ASEM1_BL1_EPS1_GRVW2_GSU1_ISA908_IU1_KLA_LBSPP128_LPA8_LPB8_LRVW8_MAC_PGR1_PLR9_SIA3_SU32_SUM0_SUS128_SRVW0_TT2_80_TLDS1_USFGROn1_VSn1_VW2_WSGRA1_WSGRB1_WG64_4_1_WGM15
    SolutionIndex: 27
    SolutionNameMin: Cijk_Alik_Bljk_BBH_MT128x128x32_MI32x32x4x1_SE_1LDSB0_AF0EM1_AMAS3_ASEM1_BL1_EPS1_GRVW8_GSU1_ISA908_IU1_KLA_LBSPP128_LPA8_LPB8_LRVW2_MAC_PGR1_PLR1_SIA3_SU32_SUM0_SUS256_SRVW0_TT2_64_TLDS1_USFGROn1_VSn1_VW2_WSGRA0_WSGRB0_WG64_4_1_WGM4
    SolutionIndex: 28
    SolutionNameMin: Cijk_Alik_Bljk_BBH_MT64x32x64_MI16x16x8x1_SE_1LDSB0_AF0EM8_AMAS3_ASEM1_BL1_EPS1_GRVW2_GSU1_ISA908_IU1_KLA_LBSPP128_LPA4_LPB4_LRVW4_MAC_PGR1_PLR9_SIA3_SU0_SUM0_SUS256_SRVW4_TT2_16_TLDS1_USFGROn1_VSn1_VW2_WSGRA1_WSGRB1_WG32_8_1_WGM15
    SolutionIndex: 29
    SolutionNameMin: Cijk_Alik_Bljk_BBH_MT96x128x64_MI32x32x4x1_SE_1LDSB1_AF0EM8_AMAS3_ASEM1_BL1_EPS1_GRVW2_GSU1_ISA908_IU1_KLA_LBSPP128_LPA4_LPB4_LRVW4_MAC_PGR1_PLR17_SIA3_SU0_SUM0_SUS256_SRVW0_TT3_32_TLDS1_USFGROn1_VSn1_VW2_WSGRA1_WSGRB1_WG32_8_1_WGM1
    SolutionIndex: 30
    SolutionNameMin: Cijk_Alik_Bljk_BBH_MT32x32x32_MI16x16x8x1_SE_1LDSB0_AF0EM8_AMAS3_ASEM1_BL1_EPS1_GRVW4_GSU1_ISA908_IU1_KLA_LBSPP128_LPA4_LPB4_LRVW4_MAC_PGR1_PLR5_SIA3_SU0_SUM0_SUS256_SRVW4_TT1_16_TLDS1_USFGROn1_VSn1_VW2_WSGRA1_WSGRB1_WG32_8_1_WGM15
    SolutionIndex: 31
    SolutionNameMin: Cijk_Alik_Bljk_BBH_MT128x160x32_MI32x32x4x1_SE_1LDSB1_AF0EM1_AMAS3_ASEM1_BL1_EPS1_GRVW2_GSU1_ISA908_IU1_KLA_LBSPP128_LPA4_LPB4_LRVW4_MAC_PGR1_PLR9_SIA3_SU0_SUM0_SUS256_SRVW4_TT1_160_TLDS1_USFGROn1_VSn1_VW2_WSGRA1_WSGRB1_WG128_2_1_WGM15
    SolutionIndex: 32
    SolutionNameMin: Cijk_Alik_Bljk_BBH_MT128x64x64_MI32x32x4x1_SE_1LDSB1_AF0EM1_AMAS3_ASEM1_BL1_EPS1_GRVW8_GSU1_ISA908_IU1_KLA_LBSPP128_LPA8_LPB8_LRVW4_MAC_PGR1_PLR17_SIA3_SU32_SUM0_SUS128_SRVW4_TT2_32_TLDS1_USFGROn1_VSn1_VW2_WSGRA1_WSGRB1_WG64_4_1_WGM15
    SolutionIndex: 33
    SolutionNameMin: Cijk_Alik_Bljk_BBH_MT32x32x32_MI16x16x8x1_SE_1LDSB0_AF0EM1_AMAS3_ASEM1_BL1_EPS1_GRVW2_GSU1_ISA908_IU1_KLA_LBSPP128_LPA2_LPB2_LRVW2_MAC_PGR1_PLR1_SIA3_SU32_SUM0_SUS256_SRVW0_TT1_16_TLDS1_USFGROn1_VSn1_VW2_WSGRA0_WSGRB0_WG32_8_1_WGM4
    SolutionIndex: 34
    SolutionNameMin: Cijk_Alik_Bljk_BBH_MT64x64x64_MI32x32x4x1_SE_1LDSB1_AF0EM8_AMAS3_ASEM1_BL1_EPS1_GRVW8_GSU1_ISA908_IU1_KLA_LBSPP128_LPA8_LPB8_LRVW4_MAC_PGR1_PLR17_SIA3_SU32_SUM0_SUS256_SRVW4_TT1_32_TLDS1_USFGROn1_VSn1_VW2_WSGRA1_WSGRB1_WG64_4_1_WGM15
    SolutionIndex: 35
    SolutionNameMin: Cijk_Alik_Bljk_BBH_MT128x64x64_MI32x32x4x1_SE_1LDSB1_AF0EM8_AMAS3_ASEM1_BL1_EPS1_GRVW8_GSU1_ISA908_IU1_KLA_LBSPP128_LPA8_LPB8_LRVW4_MAC_PGR1_PLR17_SIA3_SU32_SUM0_SUS128_SRVW4_TT2_32_TLDS1_USFGROn1_VSn1_VW2_WSGRA1_WSGRB1_WG64_4_1_WGM2
    SolutionIndex: 36
    SolutionNameMin: Cijk_Alik_Bljk_BBH_MT32x32x64_MI16x16x8x1_SE_1LDSB1_AF0EM1_AMAS3_ASEM1_BL1_EPS1_GRVW8_GSU1_ISA908_IU1_KLA_LBSPP128_LPA8_LPB8_LRVW4_MAC_PGR1_PLR9_SIA3_SU0_SUM0_SUS256_SRVW4_TT1_16_TLDS1_USFGROn1_VSn1_VW2_WSGRA1_WSGRB1_WG32_8_1_WGM1
    SolutionIndex: 37
    SolutionNameMin: Cijk_Alik_Bljk_BBH_MT96x96x64_MI16x16x8x1_SE_1LDSB0_AF0EM1_AMAS3_ASEM1_BL1_EPS1_GRVW8_GSU1_ISA908_IU1_KLA_LBSPP128_LPA8_LPB8_LRVW8_MAC_PGR1_PLR9_SIA3_SU0_SUM0_SUS256_SRVW0_TT3_48_TLDS1_USFGROn1_VSn1_VW2_WSGRA1_WSGRB1_WG32_8_1_WGM15
    SolutionIndex: 38
    SolutionNameMin: Cijk_Alik_Bljk_BBH_MT96x96x64_MI16x16x8x1_SE_1LDSB1_AF0EM8_AMAS3_ASEM1_BL1_EPS1_GRVW8_GSU1_ISA908_IU1_KLA_LBSPP128_LPA8_LPB8_LRVW4_MAC_PGR1_PLR9_SIA3_SU32_SUM0_SUS256_SRVW0_TT3_48_TLDS1_USFGROn1_VSn1_VW2_WSGRA1_WSGRB1_WG32_8_1_WGM1
    SolutionIndex: 39
    SolutionNameMin: Cijk_Alik_Bljk_BBH_MT96x96x64_MI16x16x8x1_SE_1LDSB1_AF0EM8_AMAS3_ASEM1_BL1_EPS1_GRVW2_GSU1_ISA908_IU1_KLA_LBSPP128_LPA4_LPB4_LRVW4_MAC_PGR1_PLR9_SIA3_SU32_SUM0_SUS128_SRVW0_TT3_48_TLDS1_USFGROn1_VSn1_VW2_WSGRA1_WSGRB1_WG32_8_1_WGM1
    SolutionIndex: 40
    SolutionNameMin: Cijk_Alik_Bljk_BBH_MT96x96x64_MI16x16x8x1_SE_1LDSB1_AF0EM8_AMAS3_ASEM1_BL1_EPS1_GRVW8_GSU1_ISA908_IU1_KLA_LBSPP128_LPA8_LPB8_LRVW4_MAC_PGR1_PLR9_SIA3_SU32_SUM0_SUS256_SRVW0_TT3_48_TLDS1_USFGROn1_VSn1_VW2_WSGRA1_WSGRB1_WG32_8_1_WGM15
    SolutionIndex: 41
    SolutionNameMin: Cijk_Alik_Bljk_BBH_MT64x64x32_MI16x16x2x4_SE_1LDSB0_AF0EM1_AMAS3_ASEM1_BL1_EPS1_GRVW4_GSU1_ISA908_IU1_KLA_LBSPP128_LPA4_LPB4_LRVW2_MAC_PGR1_PLR1_SIA3_SU32_SUM0_SUS256_SRVW0_TT1_16_TLDS1_USFGROn1_VSn1_VW2_WSGRA0_WSGRB0_WG64_4_1_WGM8
    SolutionIndex: 42
    SolutionNameMin: Cijk_Alik_Bljk_BBH_MT64x32x128_MI16x16x8x1_SE_1LDSB0_AF0EM1_AMAS3_ASEM1_BL1_EPS1_GRVW8_GSU1_ISA908_IU1_KLA_LBSPP256_LPA8_LPB8_LRVW8_MAC_PGR1_PLR17_SIA3_SU0_SUM0_SUS256_SRVW0_TT2_16_TLDS1_USFGROn1_VSn1_VW2_WSGRA1_WSGRB1_WG32_8_1_WGM15
    SolutionIndex: 43
    SolutionNameMin: Cijk_Alik_Bljk_BBH_MT32x32x64_MI16x16x8x1_SE_1LDSB1_AF0EM8_AMAS3_ASEM1_BL1_EPS1_GRVW4_GSU1_ISA908_IU1_KLA_LBSPP128_LPA4_LPB4_LRVW4_MAC_PGR1_PLR9_SIA3_SU0_SUM0_SUS256_SRVW4_TT1_16_TLDS1_USFGROn1_VSn1_VW2_WSGRA1_WSGRB1_WG32_8_1_WGM15
    SolutionIndex: 44
    SolutionNameMin: Cijk_Alik_Bljk_BBH_MT64x32x64_MI16x16x8x1_SE_1LDSB1_AF0EM8_AMAS3_ASEM1_BL1_EPS1_GRVW8_GSU1_ISA908_IU1_KLA_LBSPP128_LPA8_LPB8_LRVW4_MAC_PGR1_PLR9_SIA3_SU32_SUM0_SUS128_SRVW4_TT2_16_TLDS1_USFGROn1_VSn1_VW2_WSGRA1_WSGRB1_WG32_8_1_WGM15
    SolutionIndex: 45
    SolutionNameMin: Cijk_Alik_Bljk_BBH_MT128x32x128_MI32x32x4x1_SE_1LDSB1_AF0EM1_AMAS3_ASEM1_BL1_EPS1_GRVW8_GSU1_ISA908_IU1_KLA_LBSPP256_LPA8_LPB8_LRVW8_MAC_PGR1_PLR33_SIA3_SU32_SUM0_SUS256_SRVW0_TT1_32_TLDS1_USFGROn1_VSn1_VW2_WSGRA1_WSGRB1_WG128_2_1_WGM2
    SolutionIndex: 46
    SolutionNameMin: Cijk_Alik_Bljk_BBH_MT96x96x64_MI16x16x8x1_SE_1LDSB1_AF0EM8_AMAS3_ASEM1_BL1_EPS1_GRVW8_GSU1_ISA908_IU1_KLA_LBSPP128_LPA8_LPB8_LRVW4_MAC_PGR1_PLR9_SIA3_SU32_SUM0_SUS128_SRVW0_TT3_48_TLDS1_USFGROn1_VSn1_VW2_WSGRA1_WSGRB1_WG32_8_1_WGM1
    SolutionIndex: 47
    SolutionNameMin: Cijk_Alik_Bljk_BBH_MT96x96x64_MI16x16x8x1_SE_1LDSB1_AF0EM8_AMAS3_ASEM1_BL1_EPS1_GRVW2_GSU1_ISA908_IU1_KLA_LBSPP128_LPA4_LPB4_LRVW4_MAC_PGR1_PLR9_SIA3_SU32_SUM0_SUS128_SRVW0_TT3_48_TLDS1_USFGROn1_VSn1_VW2_WSGRA1_WSGRB1_WG32_8_1_WGM15
    SolutionIndex: 48
    SolutionNameMin: Cijk_Alik_Bljk_BBH_MT96x96x64_MI16x16x8x1_SE_1LDSB0_AF0EM1_AMAS3_ASEM1_BL1_EPS1_GRVW8_GSU1_ISA908_IU1_KLA_LBSPP128_LPA8_LPB8_LRVW8_MAC_PGR1_PLR9_SIA3_SU0_SUM0_SUS256_SRVW0_TT3_48_TLDS1_USFGROn1_VSn1_VW2_WSGRA1_WSGRB1_WG32_8_1_WGM2
    SolutionIndex: 49
    SolutionNameMin: Cijk_Alik_Bljk_BBH_MT32x64x64_MI16x16x8x1_SE_1LDSB0_AF0EM8_AMAS3_ASEM1_BL1_EPS1_GRVW8_GSU1_ISA908_IU1_KLA_LBSPP128_LPA8_LPB8_LRVW4_MAC_PGR1_PLR9_SIA3_SU32_SUM0_SUS128_SRVW4_TT1_32_TLDS1_USFGROn1_VSn1_VW2_WSGRA1_WSGRB1_WG32_8_1_WGM1
    SolutionIndex: 50
    SolutionNameMin: Cijk_Alik_Bljk_BBH_MT96x96x64_MI16x16x8x1_SE_1LDSB1_AF0EM8_AMAS3_ASEM1_BL1_EPS1_GRVW8_GSU1_ISA908_IU1_KLA_LBSPP128_LPA8_LPB8_LRVW4_MAC_PGR1_PLR9_SIA3_SU0_SUM0_SUS256_SRVW0_TT3_48_TLDS1_USFGROn1_VSn1_VW2_WSGRA1_WSGRB1_WG32_8_1_WGM2
    SolutionIndex: 51
    SolutionNameMin: Cijk_Alik_Bljk_BBH_MT64x144x32_MI16x16x8x1_SE_1LDSB1_AF0EM8_AMAS3_ASEM1_BL1_EPS0_GRVW2_GSU1_ISA908_IU1_KLA_LBSPP128_LPA4_LPB4_LRVW4_MAC_PGR2_PLR5_SIA3_SU0_SUM0_SUS256_SRVW4_TT1_144_TLDS1_USFGROn1_VSn1_VW2_WSGRA1_WSGRB1_WG64_4_1_WGM15
    SolutionIndex: 52
    SolutionNameMin: Cijk_Alik_Bljk_BBH_MT128x96x64_MI32x32x4x1_SE_1LDSB1_AF0EM8_AMAS3_ASEM1_BL1_EPS1_GRVW2_GSU1_ISA908_IU1_KLA_LBSPP128_LPA4_LPB4_LRVW4_MAC_PGR1_PLR17_SIA3_SU32_SUM0_SUS256_SRVW4_TT1_96_TLDS1_USFGROn1_VSn1_VW2_WSGRA1_WSGRB1_WG128_2_1_WGM1
    SolutionIndex: 53
    SolutionNameMin: Cijk_Alik_Bljk_BBH_MT16x16x64_MI16x16x8x1_SE_1LDSB0_AF0EM1_AMAS3_ASEM1_BL1_EPS1_GRVW8_GSU1_ISA908_IU1_KLA_LBSPP128_LPA8_LPB8_LRVW4_MAC_PGR1_PLR9_SIA3_SU0_SUM0_SUS256_SRVW0_TT1_16_TLDS1_USFGROn1_VSn1_VW2_WSGRA1_WSGRB1_WG16_4_1_WGM1
    SolutionIndex: 54
    SolutionNameMin: Cijk_Alik_Bljk_BBH_MT16x16x64_MI16x16x8x1_SE_1LDSB1_AF0EM1_AMAS3_ASEM1_BL1_EPS1_GRVW8_GSU1_ISA908_IU1_KLA_LBSPP128_LPA8_LPB8_LRVW4_MAC_PGR1_PLR9_SIA3_SU32_SUM0_SUS256_SRVW0_TT1_16_TLDS1_USFGROn1_VSn1_VW2_WSGRA1_WSGRB1_WG16_4_1_WGM1
    SolutionIndex: 55
    SolutionNameMin: Cijk_Alik_Bljk_BBH_MT32x32x64_MI16x16x8x1_SE_1LDSB0_AF0EM1_AMAS3_ASEM1_BL1_EPS1_GRVW2_GSU1_ISA908_IU1_KLA_LBSPP128_LPA4_LPB4_LRVW4_MAC_PGR1_PLR9_SIA3_SU0_SUM0_SUS256_SRVW4_TT1_16_TLDS1_USFGROn1_VSn1_VW2_WSGRA1_WSGRB1_WG32_8_1_WGM1
    SolutionIndex: 56
    SolutionNameMin: Cijk_Alik_Bljk_BBH_MT16x16x64_MI16x16x8x1_SE_1LDSB1_AF0EM1_AMAS3_ASEM1_BL1_EPS1_GRVW8_GSU1_ISA908_IU1_KLA_LBSPP128_LPA8_LPB8_LRVW4_MAC_PGR1_PLR9_SIA3_SU0_SUM0_SUS256_SRVW0_TT1_16_TLDS1_USFGROn1_VSn1_VW2_WSGRA1_WSGRB1_WG16_4_1_WGM1
    SolutionIndex: 57
    SolutionNameMin: Cijk_Alik_Bljk_BBH_MT32x32x64_MI16x16x8x1_SE_1LDSB1_AF0EM1_AMAS3_ASEM1_BL1_EPS1_GRVW4_GSU1_ISA908_IU1_KLA_LBSPP128_LPA4_LPB4_LRVW4_MAC_PGR1_PLR9_SIA3_SU0_SUM0_SUS256_SRVW4_TT1_16_TLDS1_USFGROn1_VSn1_VW2_WSGRA1_WSGRB1_WG32_8_1_WGM1
    SolutionIndex: 58
    SolutionNameMin: Cijk_Alik_Bljk_BBH_MT16x16x64_MI16x16x8x1_SE_1LDSB1_AF0EM1_AMAS3_ASEM1_BL1_EPS1_GRVW8_GSU1_ISA908_IU1_KLA_LBSPP128_LPA8_LPB8_LRVW4_MAC_PGR1_PLR9_SIA3_SU0_SUM0_SUS256_SRVW0_TT1_16_TLDS1_USFGROn1_VSn1_VW2_WSGRA1_WSGRB1_WG16_4_1_WGM15
    SolutionIndex: 59
    SolutionNameMin: Cijk_Alik_Bljk_BBH_MT16x16x128_MI16x16x8x1_SE_1LDSB1_AF0EM1_AMAS3_ASEM1_BL1_EPS1_GRVW8_GSU1_ISA908_IU1_KLA_LBSPP256_LPA8_LPB8_LRVW4_MAC_PGR1_PLR17_SIA3_SU0_SUM0_SUS256_SRVW0_TT1_16_TLDS1_USFGROn1_VSn1_VW2_WSGRA1_WSGRB1_WG16_4_1_WGM1
    SolutionIndex: 60
    SolutionNameMin: Cijk_Alik_Bljk_BBH_MT16x16x128_MI16x16x8x1_SE_1LDSB0_AF0EM1_AMAS3_ASEM1_BL1_EPS0_GRVW8_GSU1_ISA908_IU1_KLA_LBSPP256_LPA16_LPB16_LRVW8_MAC_PGR2_PLR17_SIA3_SU32_SUM0_SUS256_SRVW0_TT1_16_TLDS1_USFGROn1_VSn1_VW2_WSGRA1_WSGRB1_WG16_4_1_WGM1
    SolutionIndex: 61
    SolutionNameMin: Cijk_Alik_Bljk_BBH_MT64x64x64_MI32x32x4x1_SE_1LDSB1_AF0EM8_AMAS3_ASEM1_BL1_EPS1_GRVW8_GSU1_ISA908_IU1_KLA_LBSPP128_LPA8_LPB8_LRVW4_MAC_PGR1_PLR17_SIA3_SU0_SUM0_SUS256_SRVW4_TT1_32_TLDS1_USFGROn1_VSn1_VW2_WSGRA1_WSGRB1_WG64_4_1_WGM2
    SolutionIndex: 62
    SolutionNameMin: Cijk_Alik_Bljk_BBH_MT32x32x128_MI16x16x8x1_SE_1LDSB1_AF0EM8_AMAS3_ASEM1_BL1_EPS0_GRVW8_GSU1_ISA908_IU1_KLA_LBSPP256_LPA16_LPB16_LRVW8_MAC_PGR2_PLR17_SIA3_SU32_SUM0_SUS256_SRVW0_TT1_16_TLDS1_USFGROn1_VSn1_VW2_WSGRA1_WSGRB1_WG32_8_1_WGM1
    SolutionIndex: 63
    SolutionNameMin: Cijk_Alik_Bljk_BBH_MT64x64x64_MI32x32x4x1_SE_1LDSB1_AF0EM8_AMAS3_ASEM1_BL1_EPS1_GRVW8_GSU1_ISA908_IU1_KLA_LBSPP128_LPA8_LPB8_LRVW4_MAC_PGR1_PLR17_SIA3_SU0_SUM0_SUS256_SRVW4_TT1_32_TLDS1_USFGROn1_VSn1_VW2_WSGRA1_WSGRB1_WG64_4_1_WGM1
    SolutionIndex: 64
    SolutionNameMin: Cijk_Alik_Bljk_BBH_MT128x64x32_MI32x32x4x1_SE_1LDSB1_AF0EM8_AMAS3_ASEM1_BL1_EPS0_GRVW8_GSU1_ISA908_IU1_KLA_LBSPP128_LPA8_LPB8_LRVW4_MAC_PGR2_PLR9_SIA3_SU0_SUM0_SUS256_SRVW4_TT2_32_TLDS1_USFGROn1_VSn1_VW2_WSGRA1_WSGRB1_WG64_4_1_WGM1
    SolutionIndex: 65
    SolutionNameMin: Cijk_Alik_Bljk_BBH_MT128x128x32_MI32x32x4x1_SE_1LDSB1_AF0EM8_AMAS3_ASEM1_BL1_EPS0_GRVW8_GSU1_ISA908_IU1_KLA_LBSPP128_LPA8_LPB8_LRVW4_MAC_PGR2_PLR9_SIA3_SU0_SUM0_SUS256_SRVW4_TT2_64_TLDS1_USFGROn1_VSn1_VW2_WSGRA1_WSGRB1_WG64_4_1_WGM15
    SolutionIndex: 66
    SolutionNameMin: Cijk_Alik_Bljk_BBH_MT32x32x128_MI16x16x8x1_SE_1LDSB0_AF0EM4_AMAS3_ASEM1_BL1_EPS1_GRVW8_GSU1_ISA908_IU1_KLA_LBSPP256_LPA8_LPB8_LRVW8_MAC_PGR1_PLR17_SIA3_SU0_SUM0_SUS256_SRVW4_TT1_16_TLDS1_USFGROn1_VSn1_VW2_WSGRA1_WSGRB1_WG32_8_1_WGM1
    SolutionIndex: 67
    SolutionNameMin: Cijk_Alik_Bljk_BBH_MT128x96x64_MI32x32x4x1_SE_1LDSB1_AF0EM8_AMAS3_ASEM1_BL1_EPS1_GRVW2_GSU1_ISA908_IU1_KLA_LBSPP128_LPA4_LPB4_LRVW4_MAC_PGR1_PLR17_SIA3_SU0_SUM0_SUS256_SRVW4_TT1_96_TLDS1_USFGROn1_VSn1_VW2_WSGRA1_WSGRB1_WG128_2_1_WGM15
    SolutionIndex: 68
    SolutionNameMin: Cijk_Alik_Bljk_BBH_MT64x64x32_MI32x32x4x1_SE_1LDSB1_AF0EM8_AMAS3_ASEM1_BL1_EPS1_GRVW2_GSU1_ISA908_IU1_KLA_LBSPP128_LPA4_LPB4_LRVW4_MAC_PGR1_PLR9_SIA3_SU32_SUM0_SUS128_SRVW4_TT1_32_TLDS1_USFGROn1_VSn1_VW2_WSGRA1_WSGRB1_WG64_4_1_WGM15
    SolutionIndex: 69
    SolutionNameMin: Cijk_Alik_Bljk_BBH_MT128x128x32_MI32x32x4x1_SE_1LDSB1_AF0EM8_AMAS3_ASEM1_BL1_EPS0_GRVW8_GSU1_ISA908_IU1_KLA_LBSPP128_LPA8_LPB8_LRVW4_MAC_PGR2_PLR9_SIA3_SU32_SUM0_SUS128_SRVW4_TT2_64_TLDS1_USFGROn1_VSn1_VW2_WSGRA1_WSGRB1_WG64_4_1_WGM1
    SolutionIndex: 70
    SolutionNameMin: Cijk_Alik_Bljk_BBH_MT128x128x32_MI32x32x4x1_SE_1LDSB1_AF0EM8_AMAS3_ASEM1_BL1_EPS1_GRVW8_GSU1_ISA908_IU1_KLA_LBSPP128_LPA8_LPB8_LRVW4_MAC_PGR1_PLR9_SIA3_SU32_SUM0_SUS256_SRVW4_TT2_64_TLDS1_USFGROn1_VSn1_VW2_WSGRA1_WSGRB1_WG64_4_1_WGM15
    SolutionIndex: 71
    SolutionNameMin: Cijk_Alik_Bljk_BBH_MT16x16x128_MI16x16x8x1_SE_1LDSB1_AF0EM8_AMAS3_ASEM1_BL1_EPS1_GRVW8_GSU1_ISA908_IU1_KLA_LBSPP256_LPA8_LPB8_LRVW4_MAC_PGR1_PLR17_SIA3_SU0_SUM0_SUS256_SRVW0_TT1_16_TLDS1_USFGROn1_VSn1_VW2_WSGRA1_WSGRB1_WG16_4_1_WGM1
    SolutionIndex: 72
    SolutionNameMin: Cijk_Alik_Bljk_BBH_MT16x16x128_MI16x16x8x1_SE_1LDSB0_AF0EM1_AMAS3_ASEM1_BL1_EPS1_GRVW8_GSU1_ISA908_IU1_KLA_LBSPP256_LPA8_LPB8_LRVW4_MAC_PGR1_PLR17_SIA3_SU32_SUM0_SUS256_SRVW0_TT1_16_TLDS1_USFGROn1_VSn1_VW2_WSGRA1_WSGRB1_WG16_4_1_WGM1
    SolutionIndex: 73
    SolutionNameMin: Cijk_Alik_Bljk_BBH_MT128x64x32_MI32x32x4x1_SE_1LDSB1_AF0EM1_AMAS3_ASEM1_BL1_EPS1_GRVW8_GSU1_ISA908_IU1_KLA_LBSPP128_LPA8_LPB8_LRVW4_MAC_PGR1_PLR9_SIA3_SU32_SUM0_SUS128_SRVW4_TT2_32_TLDS1_USFGROn1_VSn1_VW2_WSGRA1_WSGRB1_WG64_4_1_WGM15
    SolutionIndex: 74
    SolutionNameMin: Cijk_Alik_Bljk_BBH_MT32x64x128_MI16x16x8x1_SE_1LDSB0_AF0EM4_AMAS3_ASEM1_BL1_EPS1_GRVW8_GSU1_ISA908_IU1_KLA_LBSPP256_LPA8_LPB8_LRVW8_MAC_PGR1_PLR17_SIA3_SU0_SUM0_SUS256_SRVW0_TT1_32_TLDS1_USFGROn1_VSn1_VW2_WSGRA1_WSGRB1_WG32_8_1_WGM15
    SolutionIndex: 75
    SolutionNameMin: Cijk_Alik_Bljk_BBH_MT64x64x64_MI32x32x4x1_SE_1LDSB1_AF0EM8_AMAS3_ASEM1_BL1_EPS0_GRVW8_GSU1_ISA908_IU1_KLA_LBSPP128_LPA8_LPB8_LRVW4_MAC_PGR2_PLR17_SIA3_SU0_SUM0_SUS256_SRVW4_TT1_32_TLDS1_USFGROn1_VSn1_VW2_WSGRA1_WSGRB1_WG64_4_1_WGM15
    SolutionIndex: 76
    SolutionNameMin: Cijk_Alik_Bljk_BBH_MT64x64x64_MI32x32x4x1_SE_1LDSB1_AF0EM8_AMAS3_ASEM1_BL1_EPS1_GRVW4_GSU1_ISA908_IU1_KLA_LBSPP128_LPA4_LPB4_LRVW4_MAC_PGR1_PLR17_SIA3_SU32_SUM0_SUS128_SRVW4_TT1_32_TLDS1_USFGROn1_VSn1_VW2_WSGRA1_WSGRB1_WG64_4_1_WGM15
    SolutionIndex: 77
    SolutionNameMin: Cijk_Alik_Bljk_BBH_MT128x64x64_MI32x32x4x1_SE_1LDSB0_AF0EM8_AMAS3_ASEM1_BL1_EPS0_GRVW8_GSU1_ISA908_IU1_KLA_LBSPP128_LPA8_LPB8_LRVW4_MAC_PGR2_PLR17_SIA3_SU0_SUM0_SUS256_SRVW4_TT2_32_TLDS1_USFGROn1_VSn1_VW2_WSGRA1_WSGRB1_WG64_4_1_WGM1
    SolutionIndex: 78
    SolutionNameMin: Cijk_Alik_Bljk_BBH_MT64x128x64_MI32x32x4x1_SE_1LDSB1_AF0EM8_AMAS3_ASEM1_BL1_EPS1_GRVW8_GSU1_ISA908_IU1_KLA_LBSPP128_LPA8_LPB8_LRVW4_MAC_PGR1_PLR17_SIA3_SU0_SUM0_SUS256_SRVW4_TT1_64_TLDS1_USFGROn1_VSn1_VW2_WSGRA1_WSGRB1_WG64_4_1_WGM15
    SolutionIndex: 79
    SolutionNameMin: Cijk_Alik_Bljk_BBH_MT128x64x64_MI32x32x4x1_SE_1LDSB1_AF0EM8_AMAS3_ASEM1_BL1_EPS1_GRVW8_GSU1_ISA908_IU1_KLA_LBSPP128_LPA8_LPB8_LRVW4_MAC_PGR1_PLR17_SIA3_SU0_SUM0_SUS256_SRVW4_TT2_32_TLDS1_USFGROn1_VSn1_VW2_WSGRA1_WSGRB1_WG64_4_1_WGM2
    SolutionIndex: 80
    SolutionNameMin: Cijk_Alik_Bljk_BBH_MT128x64x32_MI16x16x2x4_SE_1LDSB0_AF0EM1_AMAS3_ASEM1_BL1_EPS1_GRVW2_GSU1_ISA908_IU1_KLA_LBSPP128_LPA2_LPB2_LRVW2_MAC_PGR1_PLR1_SIA3_SU32_SUM0_SUS256_SRVW4_TT2_16_TLDS1_USFGROn1_VSn1_VW2_WSGRA1_WSGRB1_WG64_4_1_WGM120
    SolutionIndex: 81
    SolutionNameMin: Cijk_Alik_Bljk_BBH_MT128x128x32_MI32x32x4x1_SE_1LDSB1_AF0EM8_AMAS3_ASEM1_BL1_EPS1_GRVW2_GSU1_ISA908_IU1_KLA_LBSPP128_LPA4_LPB4_LRVW4_MAC_PGR1_PLR9_SIA3_SU0_SUM0_SUS256_SRVW4_TT2_64_TLDS1_USFGROn1_VSn1_VW2_WSGRA1_WSGRB1_WG64_4_1_WGM1
    SolutionIndex: 82
    SolutionNameMin: Cijk_Alik_Bljk_BBH_MT128x96x32_MI32x32x4x1_SE_1LDSB1_AF0EM8_AMAS3_ASEM1_BL1_EPS1_GRVW2_GSU1_ISA908_IU1_KLA_LBSPP128_LPA4_LPB4_LRVW4_MAC_PGR1_PLR9_SIA3_SU32_SUM0_SUS128_SRVW4_TT1_96_TLDS1_USFGROn1_VSn1_VW2_WSGRA1_WSGRB1_WG128_2_1_WGM2
    SolutionIndex: 83
    SolutionNameMin: Cijk_Alik_Bljk_BBH_MT64x128x64_MI32x32x4x1_SE_1LDSB1_AF0EM8_AMAS3_ASEM1_BL1_EPS1_GRVW8_GSU1_ISA908_IU1_KLA_LBSPP128_LPA8_LPB8_LRVW4_MAC_PGR1_PLR17_SIA3_SU32_SUM0_SUS128_SRVW4_TT1_64_TLDS1_USFGROn1_VSn1_VW2_WSGRA1_WSGRB1_WG64_4_1_WGM15
    SolutionIndex: 84
    SolutionNameMin: Cijk_Alik_Bljk_BBH_MT128x64x64_MI32x32x4x1_SE_1LDSB1_AF0EM8_AMAS3_ASEM1_BL1_EPS0_GRVW8_GSU1_ISA908_IU1_KLA_LBSPP128_LPA8_LPB8_LRVW4_MAC_PGR2_PLR17_SIA3_SU32_SUM0_SUS128_SRVW4_TT2_32_TLDS1_USFGROn1_VSn1_VW2_WSGRA1_WSGRB1_WG64_4_1_WGM15
    SolutionIndex: 85
    SolutionNameMin: Cijk_Alik_Bljk_BBH_MT128x64x32_MI32x32x4x1_SE_1LDSB1_AF0EM8_AMAS3_ASEM1_BL1_EPS0_GRVW8_GSU1_ISA908_IU1_KLA_LBSPP128_LPA8_LPB8_LRVW4_MAC_PGR2_PLR9_SIA3_SU32_SUM0_SUS128_SRVW4_TT2_32_TLDS1_USFGROn1_VSn1_VW2_WSGRA1_WSGRB1_WG64_4_1_WGM15
    SolutionIndex: 86
    SolutionNameMin: Cijk_Alik_Bljk_BBH_MT64x64x64_MI32x32x4x1_SE_1LDSB1_AF0EM8_AMAS3_ASEM1_BL1_EPS1_GRVW8_GSU1_ISA908_IU1_KLA_LBSPP128_LPA8_LPB8_LRVW4_MAC_PGR1_PLR17_SIA3_SU0_SUM0_SUS256_SRVW4_TT1_32_TLDS1_USFGROn1_VSn1_VW2_WSGRA1_WSGRB1_WG64_4_1_WGM15
    SolutionIndex: 87
    SolutionNameMin: Cijk_Alik_Bljk_BBH_MT128x64x32_MI32x32x4x1_SE_1LDSB1_AF0EM8_AMAS3_ASEM1_BL1_EPS0_GRVW8_GSU1_ISA908_IU1_KLA_LBSPP128_LPA8_LPB8_LRVW4_MAC_PGR2_PLR9_SIA3_SU0_SUM0_SUS256_SRVW4_TT2_32_TLDS1_USFGROn1_VSn1_VW2_WSGRA1_WSGRB1_WG64_4_1_WGM15
    SolutionIndex: 88
    SolutionNameMin: Cijk_Alik_Bljk_BBH_MT64x128x32_MI32x32x4x1_SE_1LDSB1_AF0EM8_AMAS3_ASEM1_BL1_EPS0_GRVW2_GSU1_ISA908_IU1_KLA_LBSPP128_LPA4_LPB4_LRVW4_MAC_PGR2_PLR9_SIA3_SU0_SUM0_SUS256_SRVW4_TT1_64_TLDS1_USFGROn1_VSn1_VW2_WSGRA1_WSGRB1_WG64_4_1_WGM15
    SolutionIndex: 89
    SolutionNameMin: Cijk_Alik_Bljk_BBH_MT128x96x64_MI32x32x4x1_SE_1LDSB1_AF0EM8_AMAS3_ASEM1_BL1_EPS1_GRVW2_GSU1_ISA908_IU1_KLA_LBSPP128_LPA4_LPB4_LRVW4_MAC_PGR1_PLR17_SIA3_SU0_SUM0_SUS256_SRVW4_TT1_96_TLDS1_USFGROn1_VSn1_VW2_WSGRA1_WSGRB1_WG128_2_1_WGM2
    SolutionIndex: 90
    SolutionNameMin: Cijk_Alik_Bljk_BBH_MT64x128x64_MI32x32x4x1_SE_1LDSB1_AF0EM8_AMAS3_ASEM1_BL1_EPS1_GRVW4_GSU1_ISA908_IU1_KLA_LBSPP128_LPA4_LPB4_LRVW4_MAC_PGR1_PLR17_SIA3_SU0_SUM0_SUS256_SRVW4_TT1_64_TLDS1_USFGROn1_VSn1_VW2_WSGRA1_WSGRB1_WG64_4_1_WGM15
    SolutionIndex: 91
    SolutionNameMin: Cijk_Alik_Bljk_BBH_MT128x160x32_MI32x32x4x1_SE_1LDSB1_AF0EM1_AMAS3_ASEM1_BL1_EPS1_GRVW2_GSU1_ISA908_IU1_KLA_LBSPP128_LPA4_LPB4_LRVW4_MAC_PGR1_PLR9_SIA3_SU0_SUM0_SUS256_SRVW4_TT1_160_TLDS1_USFGROn1_VSn1_VW2_WSGRA1_WSGRB1_WG128_2_1_WGM2
    SolutionIndex: 92
    SolutionNameMin: Cijk_Alik_Bljk_BBH_MT128x128x32_MI32x32x4x1_SE_1LDSB1_AF0EM8_AMAS3_ASEM1_BL1_EPS0_GRVW8_GSU1_ISA908_IU1_KLA_LBSPP128_LPA8_LPB8_LRVW4_MAC_PGR2_PLR9_SIA3_SU0_SUM0_SUS256_SRVW4_TT2_64_TLDS1_USFGROn1_VSn1_VW2_WSGRA1_WSGRB1_WG64_4_1_WGM1
    SolutionIndex: 93
    SolutionNameMin: Cijk_Alik_Bljk_BBH_MT128x64x32_MI32x32x4x1_SE_1LDSB1_AF0EM8_AMAS3_ASEM1_BL1_EPS0_GRVW2_GSU1_ISA908_IU1_KLA_LBSPP128_LPA4_LPB4_LRVW4_MAC_PGR2_PLR9_SIA3_SU0_SUM0_SUS256_SRVW4_TT2_32_TLDS1_USFGROn1_VSn1_VW2_WSGRA1_WSGRB1_WG64_4_1_WGM15
    SolutionIndex: 94
    SolutionNameMin: Cijk_Alik_Bljk_BBH_MT128x128x32_MI32x32x4x1_SE_1LDSB1_AF0EM8_AMAS3_ASEM1_BL1_EPS0_GRVW8_GSU1_ISA908_IU1_KLA_LBSPP128_LPA8_LPB8_LRVW4_MAC_PGR2_PLR9_SIA3_SU32_SUM0_SUS256_SRVW4_TT2_64_TLDS1_USFGROn1_VSn1_VW2_WSGRA1_WSGRB1_WG64_4_1_WGM1
    SolutionIndex: 95
    SolutionNameMin: Cijk_Alik_Bljk_BBH_MT64x128x64_MI32x32x4x1_SE_1LDSB1_AF0EM8_AMAS3_ASEM1_BL1_EPS1_GRVW8_GSU1_ISA908_IU1_KLA_LBSPP128_LPA8_LPB8_LRVW4_MAC_PGR1_PLR17_SIA3_SU32_SUM0_SUS256_SRVW4_TT1_64_TLDS1_USFGROn1_VSn1_VW2_WSGRA1_WSGRB1_WG64_4_1_WGM1
    SolutionIndex: 96
    SolutionNameMin: Cijk_Alik_Bljk_BBH_MT128x96x64_MI32x32x4x1_SE_1LDSB1_AF0EM8_AMAS3_ASEM1_BL1_EPS1_GRVW8_GSU1_ISA908_IU1_KLA_LBSPP128_LPA8_LPB8_LRVW4_MAC_PGR1_PLR17_SIA3_SU32_SUM0_SUS256_SRVW4_TT1_96_TLDS1_USFGROn1_VSn1_VW2_WSGRA1_WSGRB1_WG128_2_1_WGM15
    SolutionIndex: 97
    SolutionNameMin: Cijk_Alik_Bljk_BBH_MT64x64x64_MI32x32x4x1_SE_1LDSB1_AF0EM8_AMAS3_ASEM1_BL1_EPS1_GRVW8_GSU1_ISA908_IU1_KLA_LBSPP128_LPA8_LPB8_LRVW4_MAC_PGR1_PLR17_SIA3_SU32_SUM0_SUS128_SRVW4_TT1_32_TLDS1_USFGROn1_VSn1_VW2_WSGRA1_WSGRB1_WG64_4_1_WGM15
    SolutionIndex: 98
    SolutionNameMin: Cijk_Alik_Bljk_BBH_MT128x128x32_MI32x32x4x1_SE_1LDSB1_AF0EM8_AMAS3_ASEM1_BL1_EPS1_GRVW8_GSU1_ISA908_IU1_KLA_LBSPP128_LPA8_LPB8_LRVW4_MAC_PGR1_PLR9_SIA3_SU0_SUM0_SUS256_SRVW4_TT2_64_TLDS1_USFGROn1_VSn1_VW2_WSGRA1_WSGRB1_WG64_4_1_WGM1
    SolutionIndex: 99
    SolutionNameMin: Cijk_Alik_Bljk_BBH_MT128x128x32_MI32x32x4x1_SE_1LDSB1_AF0EM8_AMAS3_ASEM1_BL1_EPS1_GRVW4_GSU1_ISA908_IU1_KLA_LBSPP128_LPA4_LPB4_LRVW4_MAC_PGR1_PLR9_SIA3_SU0_SUM0_SUS256_SRVW4_TT2_64_TLDS1_USFGROn1_VSn1_VW2_WSGRA1_WSGRB1_WG64_4_1_WGM15
    SolutionIndex: 100
    SolutionNameMin: Cijk_Alik_Bljk_BBH_MT64x128x32_MI32x32x4x1_SE_1LDSB0_AF0EM1_AMAS3_ASEM1_BL1_EPS1_GRVW8_GSU1_ISA908_IU1_KLA_LBSPP128_LPA8_LPB8_LRVW2_MAC_PGR1_PLR1_SIA3_SU32_SUM3_SUS256_SRVW4_TT2_32_TLDS1_USFGROn1_VSn1_VW2_WSGRA1_WSGRB0_WG32_8_1_WGM4
    SolutionIndex: 101
    SolutionNameMin: Cijk_Alik_Bljk_BBH_MT64x80x128_MI16x16x8x1_SE_1LDSB1_AF0EM4_AMAS3_ASEM1_BL1_EPS1_GRVW8_GSU1_ISA908_IU1_KLA_LBSPP256_LPA8_LPB8_LRVW8_MAC_PGR1_PLR17_SIA3_SU0_SUM0_SUS256_SRVW0_TT1_80_TLDS1_USFGROn1_VSn1_VW2_WSGRA1_WSGRB1_WG64_4_1_WGM15
    SolutionIndex: 102
    SolutionNameMin: Cijk_Alik_Bljk_BBH_MT64x64x64_MI32x32x4x1_SE_1LDSB1_AF0EM8_AMAS3_ASEM1_BL1_EPS1_GRVW8_GSU1_ISA908_IU1_KLA_LBSPP128_LPA8_LPB8_LRVW4_MAC_PGR1_PLR17_SIA3_SU32_SUM0_SUS128_SRVW4_TT1_32_TLDS1_USFGROn1_VSn1_VW2_WSGRA1_WSGRB1_WG64_4_1_WGM1
    SolutionIndex: 103
    SolutionNameMin: Cijk_Alik_Bljk_BBH_MT128x64x64_MI32x32x4x1_SE_1LDSB0_AF0EM8_AMAS3_ASEM1_BL1_EPS1_GRVW8_GSU1_ISA908_IU1_KLA_LBSPP128_LPA8_LPB8_LRVW4_MAC_PGR1_PLR17_SIA3_SU32_SUM0_SUS128_SRVW4_TT2_32_TLDS1_USFGROn1_VSn1_VW2_WSGRA1_WSGRB1_WG64_4_1_WGM15
    SolutionIndex: 104
    SolutionNameMin: Cijk_Alik_Bljk_BBH_MT128x64x64_MI32x32x4x1_SE_1LDSB1_AF0EM8_AMAS3_ASEM1_BL1_EPS1_GRVW8_GSU1_ISA908_IU1_KLA_LBSPP128_LPA8_LPB8_LRVW4_MAC_PGR1_PLR17_SIA3_SU0_SUM0_SUS256_SRVW4_TT2_32_TLDS1_USFGROn1_VSn1_VW2_WSGRA1_WSGRB1_WG64_4_1_WGM15
    SolutionIndex: 105
    SolutionNameMin: Cijk_Alik_Bljk_BBH_MT64x128x32_MI32x32x4x1_SE_1LDSB1_AF0EM8_AMAS3_ASEM1_BL1_EPS1_GRVW8_GSU1_ISA908_IU1_KLA_LBSPP128_LPA8_LPB8_LRVW4_MAC_PGR1_PLR9_SIA3_SU0_SUM0_SUS256_SRVW4_TT1_64_TLDS1_USFGROn1_VSn1_VW2_WSGRA1_WSGRB1_WG64_4_1_WGM2
    SolutionIndex: 106
    SolutionNameMin: Cijk_Alik_Bljk_BBH_MT128x96x32_MI32x32x4x1_SE_1LDSB1_AF0EM8_AMAS3_ASEM1_BL1_EPS0_GRVW4_GSU1_ISA908_IU1_KLA_LBSPP128_LPA4_LPB4_LRVW4_MAC_PGR2_PLR9_SIA3_SU32_SUM0_SUS128_SRVW4_TT1_96_TLDS1_USFGROn1_VSn1_VW2_WSGRA1_WSGRB1_WG128_2_1_WGM15
    SolutionIndex: 107
    SolutionNameMin: Cijk_Alik_Bljk_BBH_MT64x32x64_MI16x16x8x1_SE_1LDSB0_AF0EM8_AMAS3_ASEM1_BL1_EPS1_GRVW4_GSU1_ISA908_IU1_KLA_LBSPP128_LPA4_LPB4_LRVW4_MAC_PGR1_PLR9_SIA3_SU32_SUM0_SUS256_SRVW4_TT2_16_TLDS1_USFGROn1_VSn1_VW2_WSGRA1_WSGRB1_WG32_8_1_WGM15
    SolutionIndex: 108
    SolutionNameMin: Cijk_Alik_Bljk_BBH_MT64x32x64_MI16x16x8x1_SE_1LDSB0_AF0EM8_AMAS3_ASEM1_BL1_EPS1_GRVW8_GSU1_ISA908_IU1_KLA_LBSPP128_LPA8_LPB8_LRVW4_MAC_PGR1_PLR9_SIA3_SU0_SUM0_SUS256_SRVW4_TT2_16_TLDS1_USFGROn1_VSn1_VW2_WSGRA1_WSGRB1_WG32_8_1_WGM15
    SolutionIndex: 109
    SolutionNameMin: Cijk_Alik_Bljk_BBH_MT64x64x64_MI32x32x4x1_SE_1LDSB1_AF0EM8_AMAS3_ASEM1_BL1_EPS1_GRVW4_GSU1_ISA908_IU1_KLA_LBSPP128_LPA4_LPB4_LRVW4_MAC_PGR1_PLR17_SIA3_SU32_SUM0_SUS128_SRVW4_TT1_32_TLDS1_USFGROn1_VSn1_VW2_WSGRA1_WSGRB1_WG64_4_1_WGM1
    SolutionIndex: 110
    SolutionNameMin: Cijk_Alik_Bljk_BBH_MT32x64x32_MI16x16x8x1_SE_1LDSB1_AF0EM8_AMAS3_ASEM1_BL1_EPS1_GRVW2_GSU1_ISA908_IU1_KLA_LBSPP128_LPA4_LPB4_LRVW4_MAC_PGR1_PLR5_SIA3_SU0_SUM0_SUS256_SRVW4_TT1_32_TLDS1_USFGROn1_VSn1_VW2_WSGRA1_WSGRB1_WG32_8_1_WGM15
    SolutionIndex: 111
    SolutionNameMin: Cijk_Alik_Bljk_BBH_MT64x64x16_MI16x16x2x4_SE_1LDSB0_AF0EM1_AMAS3_ASEM1_BL1_EPS1_GRVW4_GSU1_ISA908_IU1_KLA_LBSPP128_LPA4_LPB4_LRVW2_MAC_PGR1_PLR0_SIA3_SU16_SUM0_SUS256_SRVW0_TT1_16_TLDS1_USFGROn1_VSn1_VW2_WSGRA0_WSGRB0_WG64_4_1_WGM120
    SolutionIndex: 112
    SolutionNameMin: Cijk_Alik_Bljk_BBH_MT64x64x16_MI16x16x2x4_SE_1LDSB0_AF0EM1_AMAS3_ASEM1_BL1_EPS1_GRVW4_GSU1_ISA908_IU1_KLA_LBSPP128_LPA4_LPB4_LRVW2_MAC_PGR1_PLR1_SIA3_SU32_SUM2_SUS64_SRVW0_TT1_16_TLDS1_USFGROn1_VSn1_VW2_WSGRA0_WSGRB0_WG64_4_1_WGM120
    SolutionIndex: 113
    SolutionNameMin: Cijk_Alik_Bljk_BBH_MT128x64x64_MI32x32x4x1_SE_1LDSB1_AF0EM8_AMAS3_ASEM1_BL1_EPS0_GRVW8_GSU1_ISA908_IU1_KLA_LBSPP128_LPA8_LPB8_LRVW4_MAC_PGR2_PLR17_SIA3_SU0_SUM0_SUS256_SRVW4_TT2_32_TLDS1_USFGROn1_VSn1_VW2_WSGRA1_WSGRB1_WG64_4_1_WGM15
    SolutionIndex: 114
    SolutionNameMin: Cijk_Alik_Bljk_BBH_MT128x64x32_MI32x32x4x1_SE_1LDSB1_AF0EM8_AMAS3_ASEM1_BL1_EPS0_GRVW8_GSU1_ISA908_IU1_KLA_LBSPP128_LPA8_LPB8_LRVW4_MAC_PGR2_PLR9_SIA3_SU32_SUM0_SUS256_SRVW4_TT2_32_TLDS1_USFGROn1_VSn1_VW2_WSGRA1_WSGRB1_WG64_4_1_WGM15
    SolutionIndex: 115
    SolutionNameMin: Cijk_Alik_Bljk_BBH_MT64x144x32_MI16x16x8x1_SE_1LDSB1_AF0EM8_AMAS3_ASEM1_BL1_EPS1_GRVW2_GSU1_ISA908_IU1_KLA_LBSPP128_LPA4_LPB4_LRVW4_MAC_PGR1_PLR5_SIA3_SU32_SUM0_SUS128_SRVW4_TT1_144_TLDS1_USFGROn1_VSn1_VW2_WSGRA1_WSGRB1_WG64_4_1_WGM15
    SolutionIndex: 116
    SolutionNameMin: Cijk_Alik_Bljk_BBH_MT64x128x32_MI32x32x4x1_SE_1LDSB0_AF0EM1_AMAS3_ASEM1_BL1_EPS1_GRVW8_GSU1_ISA908_IU1_KLA_LBSPP128_LPA8_LPB8_LRVW2_MAC_PGR1_PLR1_SIA3_SU32_SUM3_SUS256_SRVW4_TT2_32_TLDS1_USFGROn1_VSn1_VW2_WSGRA1_WSGRB1_WG32_8_1_WGM10
    SolutionIndex: 117
    SolutionNameMin: Cijk_Alik_Bljk_BBH_MT64x64x32_MI32x32x4x1_SE_1LDSB1_AF0EM8_AMAS3_ASEM1_BL1_EPS1_GRVW8_GSU1_ISA908_IU1_KLA_LBSPP128_LPA8_LPB8_LRVW4_MAC_PGR1_PLR9_SIA3_SU32_SUM0_SUS256_SRVW4_TT1_32_TLDS1_USFGROn1_VSn1_VW2_WSGRA1_WSGRB1_WG64_4_1_WGM15
    SolutionIndex: 118
    SolutionNameMin: Cijk_Alik_Bljk_BBH_MT128x64x64_MI32x32x4x1_SE_1LDSB1_AF0EM8_AMAS3_ASEM1_BL1_EPS0_GRVW8_GSU1_ISA908_IU1_KLA_LBSPP128_LPA8_LPB8_LRVW4_MAC_PGR2_PLR17_SIA3_SU0_SUM0_SUS256_SRVW4_TT2_32_TLDS1_USFGROn1_VSn1_VW2_WSGRA1_WSGRB1_WG64_4_1_WGM2
    SolutionIndex: 119
    SolutionNameMin: Cijk_Alik_Bljk_BBH_MT128x96x32_MI32x32x4x1_SE_1LDSB1_AF0EM8_AMAS3_ASEM1_BL1_EPS1_GRVW2_GSU1_ISA908_IU1_KLA_LBSPP128_LPA4_LPB4_LRVW4_MAC_PGR1_PLR9_SIA3_SU32_SUM0_SUS256_SRVW4_TT1_96_TLDS1_USFGROn1_VSn1_VW2_WSGRA1_WSGRB1_WG128_2_1_WGM15
    SolutionIndex: 120
    SolutionNameMin: Cijk_Alik_Bljk_BBH_MT128x96x64_MI32x32x4x1_SE_1LDSB1_AF0EM8_AMAS3_ASEM1_BL1_EPS1_GRVW4_GSU1_ISA908_IU1_KLA_LBSPP128_LPA4_LPB4_LRVW4_MAC_PGR1_PLR17_SIA3_SU32_SUM0_SUS128_SRVW4_TT1_96_TLDS1_USFGROn1_VSn1_VW2_WSGRA1_WSGRB1_WG128_2_1_WGM1
    SolutionIndex: 121
    SolutionNameMin: Cijk_Alik_Bljk_BBH_MT128x64x64_MI32x32x4x1_SE_1LDSB1_AF0EM8_AMAS3_ASEM1_BL1_EPS1_GRVW8_GSU1_ISA908_IU1_KLA_LBSPP128_LPA8_LPB8_LRVW4_MAC_PGR1_PLR17_SIA3_SU0_SUM0_SUS256_SRVW4_TT2_32_TLDS1_USFGROn1_VSn1_VW2_WSGRA1_WSGRB1_WG64_4_1_WGM1
    SolutionIndex: 122
    SolutionNameMin: Cijk_Alik_Bljk_BBH_MT128x96x32_MI32x32x4x1_SE_1LDSB1_AF0EM8_AMAS3_ASEM1_BL1_EPS0_GRVW2_GSU1_ISA908_IU1_KLA_LBSPP128_LPA4_LPB4_LRVW4_MAC_PGR2_PLR9_SIA3_SU0_SUM0_SUS256_SRVW4_TT1_96_TLDS1_USFGROn1_VSn1_VW2_WSGRA1_WSGRB1_WG128_2_1_WGM15
    SolutionIndex: 123
    SolutionNameMin: Cijk_Alik_Bljk_BBH_MT128x160x32_MI32x32x4x1_SE_1LDSB1_AF0EM8_AMAS3_ASEM1_BL1_EPS1_GRVW4_GSU1_ISA908_IU1_KLA_LBSPP128_LPA4_LPB4_LRVW4_MAC_PGR1_PLR9_SIA3_SU32_SUM0_SUS128_SRVW4_TT1_160_TLDS1_USFGROn1_VSn1_VW2_WSGRA1_WSGRB1_WG128_2_1_WGM15
    SolutionIndex: 124
    SolutionNameMin: Cijk_Alik_Bljk_BBH_MT128x96x32_MI32x32x4x1_SE_1LDSB1_AF0EM8_AMAS3_ASEM1_BL1_EPS1_GRVW4_GSU1_ISA908_IU1_KLA_LBSPP128_LPA4_LPB4_LRVW4_MAC_PGR1_PLR9_SIA3_SU32_SUM0_SUS128_SRVW4_TT1_96_TLDS1_USFGROn1_VSn1_VW2_WSGRA1_WSGRB1_WG128_2_1_WGM15
    SolutionIndex: 125
    SolutionNameMin: Cijk_Alik_Bljk_BBH_MT16x16x64_MI16x16x8x1_SE_1LDSB1_AF0EM1_AMAS3_ASEM1_BL1_EPS1_GRVW2_GSU1_ISA908_IU1_KLA_LBSPP128_LPA4_LPB4_LRVW4_MAC_PGR1_PLR9_SIA3_SU0_SUM0_SUS256_SRVW0_TT1_16_TLDS1_USFGROn1_VSn1_VW2_WSGRA1_WSGRB1_WG16_4_1_WGM1
    SolutionIndex: 126
    SolutionNameMin: Cijk_Alik_Bljk_BBH_MT32x32x64_MI16x16x8x1_SE_1LDSB1_AF0EM1_AMAS3_ASEM1_BL1_EPS1_GRVW8_GSU1_ISA908_IU1_KLA_LBSPP128_LPA8_LPB8_LRVW4_MAC_PGR1_PLR9_SIA3_SU32_SUM0_SUS256_SRVW4_TT1_16_TLDS1_USFGROn1_VSn1_VW2_WSGRA1_WSGRB1_WG32_8_1_WGM1
    SolutionIndex: 127
    SolutionNameMin: Cijk_Alik_Bljk_BBH_MT32x32x64_MI16x16x8x1_SE_1LDSB1_AF0EM8_AMAS3_ASEM1_BL1_EPS1_GRVW4_GSU1_ISA908_IU1_KLA_LBSPP128_LPA4_LPB4_LRVW4_MAC_PGR1_PLR9_SIA3_SU32_SUM0_SUS128_SRVW4_TT1_16_TLDS1_USFGROn1_VSn1_VW2_WSGRA1_WSGRB1_WG32_8_1_WGM15
    SolutionIndex: 128
    SolutionNameMin: Cijk_Alik_Bljk_BBH_MT32x32x32_MI16x16x8x1_SE_1LDSB0_AF0EM1_AMAS3_ASEM1_BL1_EPS1_GRVW4_GSU1_ISA908_IU1_KLA_LBSPP128_LPA4_LPB4_LRVW4_MAC_PGR1_PLR5_SIA3_SU32_SUM0_SUS256_SRVW4_TT1_16_TLDS1_USFGROn1_VSn1_VW2_WSGRA1_WSGRB1_WG32_8_1_WGM1
    SolutionIndex: 129
    SolutionNameMin: Cijk_Alik_Bljk_BBH_MT32x32x32_MI16x16x8x1_SE_1LDSB0_AF0EM1_AMAS3_ASEM1_BL1_EPS1_GRVW2_GSU1_ISA908_IU1_KLA_LBSPP128_LPA4_LPB4_LRVW4_MAC_PGR1_PLR5_SIA3_SU0_SUM0_SUS256_SRVW4_TT1_16_TLDS1_USFGROn1_VSn1_VW2_WSGRA1_WSGRB1_WG32_8_1_WGM1
    SolutionIndex: 130
    SolutionNameMin: Cijk_Alik_Bljk_BBH_MT64x32x32_MI16x16x8x1_SE_1LDSB1_AF0EM1_AMAS3_ASEM1_BL1_EPS1_GRVW4_GSU1_ISA908_IU1_KLA_LBSPP128_LPA4_LPB4_LRVW4_MAC_PGR1_PLR5_SIA3_SU0_SUM0_SUS256_SRVW4_TT2_16_TLDS1_USFGROn1_VSn1_VW2_WSGRA1_WSGRB1_WG32_8_1_WGM1
    SolutionIndex: 131
    SolutionNameMin: Cijk_Alik_Bljk_BBH_MT128x96x32_MI32x32x4x1_SE_1LDSB0_AF0EM4_AMAS3_ASEM1_BL1_EPS1_GRVW2_GSU1_ISA908_IU1_KLA_LBSPP128_LPA8_LPB8_LRVW8_MAC_PGR1_PLR9_SIA3_SU16_SUM0_SUS128_SRVW4_TT1_96_TLDS1_USFGROn1_VSn1_VW2_WSGRA1_WSGRB1_WG128_2_1_WGM2
    SolutionIndex: 132
    SolutionNameMin: Cijk_Alik_Bljk_BBH_MT64x192x32_MI32x32x4x1_SE_1LDSB1_AF0EM8_AMAS3_ASEM1_BL1_EPS0_GRVW8_GSU1_ISA908_IU1_KLA_LBSPP128_LPA8_LPB8_LRVW4_MAC_PGR2_PLR9_SIA3_SU0_SUM0_SUS256_SRVW4_TT1_96_TLDS1_USFGROn1_VSn1_VW2_WSGRA1_WSGRB1_WG64_4_1_WGM15
    SolutionIndex: 133
    SolutionNameMin: Cijk_Alik_Bljk_BBH_MT128x96x64_MI32x32x4x1_SE_1LDSB1_AF0EM8_AMAS3_ASEM1_BL1_EPS1_GRVW2_GSU1_ISA908_IU1_KLA_LBSPP128_LPA4_LPB4_LRVW4_MAC_PGR1_PLR17_SIA3_SU0_SUM0_SUS256_SRVW4_TT1_96_TLDS1_USFGROn1_VSn1_VW2_WSGRA1_WSGRB1_WG128_2_1_WGM1
    SolutionIndex: 134
    SolutionNameMin: Cijk_Alik_Bljk_BBH_MT128x96x32_MI32x32x4x1_SE_1LDSB0_AF0EM8_AMAS3_ASEM1_BL1_EPS1_GRVW2_GSU1_ISA908_IU1_KLA_LBSPP128_LPA4_LPB4_LRVW4_MAC_PGR1_PLR9_SIA3_SU32_SUM0_SUS128_SRVW4_TT1_96_TLDS1_USFGROn1_VSn1_VW2_WSGRA1_WSGRB1_WG128_2_1_WGM15
    SolutionIndex: 135
    SolutionNameMin: Cijk_Alik_Bljk_BBH_MT128x128x32_MI32x32x4x1_SE_1LDSB1_AF0EM8_AMAS3_ASEM1_BL1_EPS1_GRVW8_GSU1_ISA908_IU1_KLA_LBSPP128_LPA8_LPB8_LRVW4_MAC_PGR1_PLR9_SIA3_SU32_SUM0_SUS256_SRVW4_TT2_64_TLDS1_USFGROn1_VSn1_VW2_WSGRA1_WSGRB1_WG64_4_1_WGM1
    SolutionIndex: 136
    SolutionNameMin: Cijk_Alik_Bljk_BBH_MT64x128x64_MI32x32x4x1_SE_1LDSB1_AF0EM8_AMAS3_ASEM1_BL1_EPS1_GRVW8_GSU1_ISA908_IU1_KLA_LBSPP128_LPA8_LPB8_LRVW4_MAC_PGR1_PLR17_SIA3_SU0_SUM0_SUS256_SRVW4_TT1_64_TLDS1_USFGROn1_VSn1_VW2_WSGRA1_WSGRB1_WG64_4_1_WGM1
    SolutionIndex: 137
    SolutionNameMin: Cijk_Alik_Bljk_BBH_MT128x160x32_MI32x32x4x1_SE_1LDSB1_AF0EM8_AMAS3_ASEM1_BL1_EPS1_GRVW2_GSU1_ISA908_IU1_KLA_LBSPP128_LPA4_LPB4_LRVW4_MAC_PGR1_PLR9_SIA3_SU32_SUM0_SUS128_SRVW4_TT1_160_TLDS1_USFGROn1_VSn1_VW2_WSGRA1_WSGRB1_WG128_2_1_WGM2
    SolutionIndex: 138
    SolutionNameMin: Cijk_Alik_Bljk_BBH_MT64x128x32_MI32x32x4x1_SE_1LDSB1_AF0EM8_AMAS3_ASEM1_BL1_EPS1_GRVW8_GSU1_ISA908_IU1_KLA_LBSPP128_LPA8_LPB8_LRVW4_MAC_PGR1_PLR9_SIA3_SU0_SUM0_SUS256_SRVW4_TT1_64_TLDS1_USFGROn1_VSn1_VW2_WSGRA1_WSGRB1_WG64_4_1_WGM15
    SolutionIndex: 139
    SolutionNameMin: Cijk_Alik_Bljk_BBH_MT128x64x32_MI32x32x4x1_SE_1LDSB1_AF0EM8_AMAS3_ASEM1_BL1_EPS1_GRVW8_GSU1_ISA908_IU1_KLA_LBSPP128_LPA8_LPB8_LRVW4_MAC_PGR1_PLR9_SIA3_SU32_SUM0_SUS128_SRVW4_TT2_32_TLDS1_USFGROn1_VSn1_VW2_WSGRA1_WSGRB1_WG64_4_1_WGM15
    SolutionIndex: 140
    SolutionNameMin: Cijk_Alik_Bljk_BBH_MT128x128x32_MI32x32x4x1_SE_1LDSB1_AF0EM8_AMAS3_ASEM1_BL1_EPS1_GRVW8_GSU1_ISA908_IU1_KLA_LBSPP128_LPA8_LPB8_LRVW4_MAC_PGR1_PLR9_SIA3_SU32_SUM0_SUS128_SRVW4_TT2_64_TLDS1_USFGROn1_VSn1_VW2_WSGRA1_WSGRB1_WG64_4_1_WGM1
    SolutionIndex: 141
    SolutionNameMin: Cijk_Alik_Bljk_BBH_MT128x128x32_MI32x32x4x1_SE_1LDSB1_AF0EM1_AMAS3_ASEM1_BL1_EPS1_GRVW8_GSU1_ISA908_IU1_KLA_LBSPP128_LPA8_LPB8_LRVW4_MAC_PGR1_PLR9_SIA3_SU32_SUM0_SUS128_SRVW4_TT2_64_TLDS1_USFGROn1_VSn1_VW2_WSGRA1_WSGRB1_WG64_4_1_WGM15
    SolutionIndex: 142
    SolutionNameMin: Cijk_Alik_Bljk_BBH_MT32x32x64_MI16x16x8x1_SE_1LDSB1_AF0EM1_AMAS3_ASEM1_BL1_EPS1_GRVW8_GSU1_ISA908_IU1_KLA_LBSPP128_LPA8_LPB8_LRVW4_MAC_PGR1_PLR9_SIA3_SU32_SUM0_SUS128_SRVW4_TT1_16_TLDS1_USFGROn1_VSn1_VW2_WSGRA1_WSGRB1_WG32_8_1_WGM1
    SolutionIndex: 143
    SolutionNameMin: Cijk_Alik_Bljk_BBH_MT64x128x32_MI32x32x4x1_SE_1LDSB1_AF0EM8_AMAS3_ASEM1_BL1_EPS0_GRVW8_GSU1_ISA908_IU1_KLA_LBSPP128_LPA8_LPB8_LRVW4_MAC_PGR2_PLR9_SIA3_SU0_SUM0_SUS256_SRVW4_TT1_64_TLDS1_USFGROn1_VSn1_VW2_WSGRA1_WSGRB1_WG64_4_1_WGM15
    SolutionIndex: 144
    SolutionNameMin: Cijk_Alik_Bljk_BBH_MT96x96x32_MI16x16x8x1_SE_1LDSB1_AF0EM8_AMAS3_ASEM1_BL1_EPS0_GRVW2_GSU1_ISA908_IU1_KLA_LBSPP128_LPA4_LPB4_LRVW4_MAC_PGR2_PLR5_SIA3_SU32_SUM0_SUS128_SRVW0_TT3_48_TLDS1_USFGROn1_VSn1_VW2_WSGRA1_WSGRB1_WG32_8_1_WGM15
    SolutionIndex: 145
    SolutionNameMin: Cijk_Alik_Bljk_BBH_MT32x32x128_MI16x16x8x1_SE_1LDSB0_AF0EM1_AMAS3_ASEM1_BL1_EPS1_GRVW8_GSU1_ISA908_IU1_KLA_LBSPP256_LPA8_LPB8_LRVW8_MAC_PGR1_PLR17_SIA3_SU0_SUM0_SUS256_SRVW0_TT1_16_TLDS1_USFGROn1_VSn1_VW2_WSGRA1_WSGRB1_WG32_8_1_WGM15
    SolutionIndex: 146
    SolutionNameMin: Cijk_Alik_Bljk_BBH_MT16x16x128_MI16x16x8x1_SE_1LDSB1_AF0EM1_AMAS3_ASEM1_BL1_EPS1_GRVW8_GSU1_ISA908_IU1_KLA_LBSPP256_LPA8_LPB8_LRVW4_MAC_PGR1_PLR17_SIA3_SU32_SUM0_SUS256_SRVW0_TT1_16_TLDS1_USFGROn1_VSn1_VW2_WSGRA1_WSGRB1_WG16_4_1_WGM2
    SolutionIndex: 147
    SolutionNameMin: Cijk_Alik_Bljk_BBH_MT32x32x128_MI16x16x8x1_SE_1LDSB0_AF0EM4_AMAS3_ASEM1_BL1_EPS1_GRVW8_GSU1_ISA908_IU1_KLA_LBSPP256_LPA8_LPB8_LRVW8_MAC_PGR1_PLR17_SIA3_SU0_SUM0_SUS256_SRVW0_TT1_16_TLDS1_USFGROn1_VSn1_VW2_WSGRA1_WSGRB1_WG32_8_1_WGM15
    SolutionIndex: 148
    SolutionNameMin: Cijk_Alik_Bljk_BBH_MT128x160x32_MI32x32x4x1_SE_1LDSB1_AF0EM1_AMAS3_ASEM1_BL1_EPS1_GRVW4_GSU1_ISA908_IU1_KLA_LBSPP128_LPA4_LPB4_LRVW4_MAC_PGR1_PLR9_SIA3_SU32_SUM0_SUS128_SRVW4_TT1_160_TLDS1_USFGROn1_VSn1_VW2_WSGRA1_WSGRB1_WG128_2_1_WGM2
    SolutionIndex: 149
    SolutionNameMin: Cijk_Alik_Bljk_BBH_MT64x64x64_MI32x32x4x1_SE_1LDSB1_AF0EM8_AMAS3_ASEM1_BL1_EPS1_GRVW8_GSU1_ISA908_IU1_KLA_LBSPP128_LPA8_LPB8_LRVW4_MAC_PGR1_PLR17_SIA3_SU32_SUM0_SUS256_SRVW4_TT1_32_TLDS1_USFGROn1_VSn1_VW2_WSGRA1_WSGRB1_WG64_4_1_WGM2
    SolutionIndex: 150
    SolutionNameMin: Cijk_Alik_Bljk_BBH_MT64x128x32_MI32x32x4x1_SE_1LDSB0_AF0EM1_AMAS3_ASEM1_BL1_EPS1_GRVW8_GSU1_ISA908_IU1_KLA_LBSPP128_LPA8_LPB8_LRVW2_MAC_PGR1_PLR1_SIA3_SU32_SUM3_SUS256_SRVW4_TT2_32_TLDS1_USFGROn1_VSn1_VW2_WSGRA0_WSGRB1_WG16_16_1_WGM4
    SolutionIndex: 151
    SolutionNameMin: Cijk_Alik_Bljk_BBH_MT64x64x32_MI16x16x2x4_SE_1LDSB0_AF0EM1_AMAS3_ASEM1_BL1_EPS1_GRVW4_GSU1_ISA908_IU2_KLA_LBSPP128_LPA4_LPB4_LRVW2_MAC_PGR1_PLR0_SIA3_SU16_SUM2_SUS64_SRVW0_TT1_16_TLDS1_USFGROn1_VSn1_VW2_WSGRA0_WSGRB0_WG64_4_1_WGM8
    SolutionIndex: 152
    SolutionNameMin: Cijk_Alik_Bljk_BBH_MT32x32x64_MI16x16x8x1_SE_1LDSB1_AF0EM8_AMAS3_ASEM1_BL1_EPS1_GRVW8_GSU3_ISA908_IU1_KLA_LBSPP128_LPA8_LPB8_LRVW4_MAC_PGR1_PLR9_SIA3_SU32_SUM0_SUS256_SRVW0_TT1_16_TLDS1_USFGROn1_VSn1_VW2_WSGRA1_WSGRB1_WG32_8_1_WGM1
    SolutionIndex: 153
    SolutionNameMin: Cijk_Alik_Bljk_BBH_MT16x16x128_MI16x16x8x1_SE_1LDSB0_AF0EM1_AMAS3_ASEM1_BL1_EPS1_GRVW8_GSU1_ISA908_IU1_KLA_LBSPP256_LPA8_LPB8_LRVW4_MAC_PGR1_PLR17_SIA3_SU0_SUM0_SUS256_SRVW0_TT1_16_TLDS1_USFGROn1_VSn1_VW2_WSGRA1_WSGRB1_WG16_4_1_WGM1
    SolutionIndex: 154
    SolutionNameMin: Cijk_Alik_Bljk_BBH_MT128x128x32_MI32x32x4x1_SE_1LDSB1_AF0EM8_AMAS3_ASEM1_BL1_EPS1_GRVW8_GSU1_ISA908_IU1_KLA_LBSPP128_LPA8_LPB8_LRVW4_MAC_PGR1_PLR9_SIA3_SU0_SUM0_SUS256_SRVW4_TT2_64_TLDS1_USFGROn1_VSn1_VW2_WSGRA1_WSGRB1_WG64_4_1_WGM15
    SolutionIndex: 155
    SolutionNameMin: Cijk_Alik_Bljk_BBH_MT64x64x32_MI32x32x4x1_SE_1LDSB1_AF0EM8_AMAS3_ASEM1_BL1_EPS1_GRVW2_GSU1_ISA908_IU1_KLA_LBSPP128_LPA4_LPB4_LRVW4_MAC_PGR1_PLR9_SIA3_SU0_SUM0_SUS256_SRVW4_TT1_32_TLDS1_USFGROn1_VSn1_VW2_WSGRA1_WSGRB1_WG64_4_1_WGM15
    SolutionIndex: 156
    SolutionNameMin: Cijk_Alik_Bljk_BBH_MT96x96x32_MI16x16x8x1_SE_1LDSB1_AF0EM8_AMAS3_ASEM1_BL1_EPS1_GRVW2_GSU1_ISA908_IU1_KLA_LBSPP128_LPA4_LPB4_LRVW4_MAC_PGR1_PLR5_SIA3_SU0_SUM0_SUS256_SRVW0_TT3_48_TLDS1_USFGROn1_VSn1_VW2_WSGRA1_WSGRB1_WG32_8_1_WGM15
    SolutionIndex: 157
    SolutionNameMin: Cijk_Alik_Bljk_BBH_MT96x96x32_MI16x16x8x1_SE_1LDSB1_AF0EM8_AMAS3_ASEM1_BL1_EPS0_GRVW2_GSU1_ISA908_IU1_KLA_LBSPP128_LPA4_LPB4_LRVW4_MAC_PGR2_PLR5_SIA3_SU0_SUM0_SUS256_SRVW0_TT3_48_TLDS1_USFGROn1_VSn1_VW2_WSGRA1_WSGRB1_WG32_8_1_WGM15
    SolutionIndex: 158
    SolutionNameMin: Cijk_Alik_Bljk_BBH_MT16x16x128_MI16x16x8x1_SE_1LDSB1_AF0EM8_AMAS3_ASEM1_BL1_EPS1_GRVW8_GSU1_ISA908_IU1_KLA_LBSPP256_LPA8_LPB8_LRVW4_MAC_PGR1_PLR17_SIA3_SU0_SUM0_SUS256_SRVW0_TT1_16_TLDS1_USFGROn1_VSn1_VW2_WSGRA1_WSGRB1_WG16_4_1_WGM15
    SolutionIndex: 159
    SolutionNameMin: Cijk_Alik_Bljk_BBH_MT128x96x32_MI32x32x4x1_SE_1LDSB0_AF0EM1_AMAS3_ASEM1_BL1_EPS1_GRVW2_GSU1_ISA908_IU1_KLA_LBSPP128_LPA4_LPB4_LRVW4_MAC_PGR1_PLR9_SIA3_SU32_SUM0_SUS128_SRVW4_TT1_96_TLDS1_USFGROn1_VSn1_VW2_WSGRA1_WSGRB1_WG128_2_1_WGM1
    SolutionIndex: 160
    SolutionNameMin: Cijk_Alik_Bljk_BBH_MT16x16x64_MI16x16x8x1_SE_1LDSB1_AF0EM1_AMAS3_ASEM1_BL1_EPS1_GRVW4_GSU1_ISA908_IU1_KLA_LBSPP128_LPA4_LPB4_LRVW4_MAC_PGR1_PLR9_SIA3_SU32_SUM0_SUS128_SRVW0_TT1_16_TLDS1_USFGROn1_VSn1_VW2_WSGRA1_WSGRB1_WG16_4_1_WGM15
    SolutionIndex: 161
    SolutionNameMin: Cijk_Alik_Bljk_BBH_MT32x32x128_MI16x16x8x1_SE_1LDSB0_AF0EM4_AMAS3_ASEM1_BL1_EPS1_GRVW8_GSU1_ISA908_IU1_KLA_LBSPP256_LPA8_LPB8_LRVW8_MAC_PGR1_PLR17_SIA3_SU0_SUM0_SUS256_SRVW0_TT1_16_TLDS1_USFGROn1_VSn1_VW2_WSGRA1_WSGRB1_WG32_8_1_WGM2
    SolutionIndex: 162
    SolutionNameMin: Cijk_Alik_Bljk_BBH_MT16x16x128_MI16x16x8x1_SE_1LDSB1_AF0EM1_AMAS3_ASEM1_BL1_EPS1_GRVW8_GSU1_ISA908_IU1_KLA_LBSPP256_LPA8_LPB8_LRVW4_MAC_PGR1_PLR17_SIA3_SU0_SUM0_SUS256_SRVW0_TT1_16_TLDS1_USFGROn1_VSn1_VW2_WSGRA1_WSGRB1_WG16_4_1_WGM15
    SolutionIndex: 163
    SolutionNameMin: Cijk_Alik_Bljk_BBH_MT128x192x32_MI32x32x4x1_SE_1LDSB1_AF0EM8_AMAS3_ASEM1_BL1_EPS1_GRVW2_GSU1_ISA908_IU1_KLA_LBSPP128_LPA4_LPB4_LRVW4_MAC_PGR1_PLR9_SIA3_SU0_SUM0_SUS256_SRVW4_TT2_96_TLDS1_USFGROn1_VSn1_VW2_WSGRA1_WSGRB1_WG64_4_1_WGM1
    SolutionIndex: 164
    SolutionNameMin: Cijk_Alik_Bljk_BBH_MT128x128x64_MI32x32x4x1_SE_1LDSB1_AF0EM8_AMAS3_ASEM1_BL1_EPS1_GRVW2_GSU1_ISA908_IU1_KLA_LBSPP128_LPA4_LPB4_LRVW4_MAC_PGR1_PLR17_SIA3_SU0_SUM0_SUS256_SRVW4_TT2_64_TLDS1_USFGROn1_VSn1_VW2_WSGRA1_WSGRB1_WG64_4_1_WGM2
    SolutionIndex: 165
    SolutionNameMin: Cijk_Alik_Bljk_BBH_MT128x96x32_MI32x32x4x1_SE_1LDSB1_AF0EM8_AMAS3_ASEM1_BL1_EPS1_GRVW4_GSU1_ISA908_IU1_KLA_LBSPP128_LPA4_LPB4_LRVW4_MAC_PGR1_PLR9_SIA3_SU0_SUM0_SUS256_SRVW4_TT1_96_TLDS1_USFGROn1_VSn1_VW2_WSGRA1_WSGRB1_WG128_2_1_WGM2
    SolutionIndex: 166
    SolutionNameMin: Cijk_Alik_Bljk_BBH_MT64x128x64_MI32x32x4x1_SE_1LDSB1_AF0EM8_AMAS3_ASEM1_BL1_EPS1_GRVW8_GSU1_ISA908_IU1_KLA_LBSPP128_LPA8_LPB8_LRVW4_MAC_PGR1_PLR17_SIA3_SU32_SUM0_SUS256_SRVW4_TT1_64_TLDS1_USFGROn1_VSn1_VW2_WSGRA1_WSGRB1_WG64_4_1_WGM15
    SolutionIndex: 167
    SolutionNameMin: Cijk_Alik_Bljk_BBH_MT96x96x64_MI16x16x8x1_SE_1LDSB1_AF0EM8_AMAS3_ASEM1_BL1_EPS1_GRVW2_GSU1_ISA908_IU1_KLA_LBSPP128_LPA4_LPB4_LRVW4_MAC_PGR1_PLR9_SIA3_SU0_SUM0_SUS256_SRVW0_TT3_48_TLDS1_USFGROn1_VSn1_VW2_WSGRA1_WSGRB1_WG32_8_1_WGM1
    SolutionIndex: 168
    SolutionNameMin: Cijk_Alik_Bljk_BBH_MT32x32x64_MI16x16x8x1_SE_1LDSB0_AF0EM1_AMAS3_ASEM1_BL1_EPS0_GRVW4_GSU7_ISA908_IU1_KLA_LBSPP128_LPA4_LPB4_LRVW4_MAC_PGR2_PLR9_SIA3_SU32_SUM0_SUS128_SRVW4_TT1_16_TLDS1_USFGROn1_VSn1_VW2_WSGRA1_WSGRB1_WG32_8_1_WGM1
    SolutionIndex: 169
    SolutionNameMin: Cijk_Alik_Bljk_BBH_MT144x128x32_MI16x16x8x1_SE_1LDSB0_AF0EM8_AMAS3_ASEM1_BL1_EPS1_GRVW2_GSU1_ISA908_IU1_KLA_LBSPP128_LPA4_LPB4_LRVW4_MAC_PGR1_PLR5_SIA3_SU0_SUM0_SUS256_SRVW0_TT9_32_TLDS1_USFGROn1_VSn1_VW2_WSGRA1_WSGRB1_WG16_16_1_WGM2
    SolutionIndex: 170
    SolutionNameMin: Cijk_Alik_Bljk_BBH_MT128x64x64_MI32x32x4x1_SE_1LDSB0_AF0EM8_AMAS3_ASEM1_BL1_EPS0_GRVW8_GSU1_ISA908_IU1_KLA_LBSPP128_LPA8_LPB8_LRVW4_MAC_PGR2_PLR17_SIA3_SU0_SUM0_SUS256_SRVW4_TT2_32_TLDS1_USFGROn1_VSn1_VW2_WSGRA1_WSGRB1_WG64_4_1_WGM2
    SolutionIndex: 171
    SolutionNameMin: Cijk_Alik_Bljk_BBH_MT32x32x64_MI16x16x8x1_SE_1LDSB0_AF0EM1_AMAS3_ASEM1_BL1_EPS1_GRVW8_GSU7_ISA908_IU1_KLA_LBSPP128_LPA8_LPB8_LRVW4_MAC_PGR1_PLR9_SIA3_SU0_SUM0_SUS256_SRVW0_TT1_16_TLDS1_USFGROn1_VSn1_VW2_WSGRA1_WSGRB1_WG32_8_1_WGM1
    SolutionIndex: 172
    SolutionNameMin: Cijk_Alik_Bljk_BBH_MT64x128x32_MI32x32x4x1_SE_1LDSB1_AF0EM8_AMAS3_ASEM1_BL1_EPS0_GRVW8_GSU1_ISA908_IU1_KLA_LBSPP128_LPA8_LPB8_LRVW4_MAC_PGR2_PLR9_SIA3_SU32_SUM0_SUS128_SRVW4_TT1_64_TLDS1_USFGROn1_VSn1_VW2_WSGRA1_WSGRB1_WG64_4_1_WGM15
    SolutionIndex: 173
    SolutionNameMin: Cijk_Alik_Bljk_BBH_MT128x256x32_MI32x32x4x1_SE_1LDSB1_AF0EM8_AMAS3_ASEM1_BL1_EPS0_GRVW8_GSU1_ISA908_IU1_KLA_LBSPP128_LPA8_LPB8_LRVW4_MAC_PGR2_PLR9_SIA3_SU0_SUM0_SUS256_SRVW4_TT2_128_TLDS1_USFGROn1_VSn1_VW2_WSGRA1_WSGRB1_WG64_4_1_WGM15
    SolutionIndex: 174
    SolutionNameMin: Cijk_Alik_Bljk_BBH_MT128x96x64_MI32x32x4x1_SE_1LDSB1_AF0EM8_AMAS3_ASEM1_BL1_EPS0_GRVW8_GSU1_ISA908_IU1_KLA_LBSPP128_LPA8_LPB8_LRVW4_MAC_PGR2_PLR17_SIA3_SU0_SUM0_SUS256_SRVW4_TT1_96_TLDS1_USFGROn1_VSn1_VW2_WSGRA1_WSGRB1_WG128_2_1_WGM15
    SolutionIndex: 175
    SolutionNameMin: Cijk_Alik_Bljk_BBH_MT32x32x64_MI16x16x8x1_SE_1LDSB1_AF0EM8_AMAS3_ASEM1_BL1_EPS1_GRVW8_GSU7_ISA908_IU1_KLA_LBSPP128_LPA8_LPB8_LRVW4_MAC_PGR1_PLR9_SIA3_SU0_SUM0_SUS256_SRVW0_TT1_16_TLDS1_USFGROn1_VSn1_VW2_WSGRA1_WSGRB1_WG32_8_1_WGM1
    SolutionIndex: 176
    SolutionNameMin: Cijk_Alik_Bljk_BBH_MT32x32x64_MI16x16x8x1_SE_1LDSB0_AF0EM8_AMAS3_ASEM1_BL1_EPS1_GRVW8_GSU7_ISA908_IU1_KLA_LBSPP128_LPA8_LPB8_LRVW4_MAC_PGR1_PLR9_SIA3_SU32_SUM0_SUS256_SRVW0_TT1_16_TLDS1_USFGROn1_VSn1_VW2_WSGRA1_WSGRB1_WG32_8_1_WGM2
    SolutionIndex: 177
    SolutionNameMin: Cijk_Alik_Bljk_BBH_MT32x32x128_MI16x16x8x1_SE_1LDSB0_AF0EM1_AMAS3_ASEM1_BL1_EPS1_GRVW8_GSU1_ISA908_IU1_KLA_LBSPP256_LPA8_LPB8_LRVW8_MAC_PGR1_PLR17_SIA3_SU0_SUM0_SUS256_SRVW4_TT1_16_TLDS1_USFGROn1_VSn1_VW2_WSGRA1_WSGRB1_WG32_8_1_WGM1
    SolutionIndex: 178
    SolutionNameMin: Cijk_Alik_Bljk_BBH_MT64x64x64_MI32x32x4x1_SE_1LDSB1_AF0EM8_AMAS3_ASEM1_BL1_EPS1_GRVW8_GSU1_ISA908_IU1_KLA_LBSPP128_LPA8_LPB8_LRVW4_MAC_PGR1_PLR17_SIA3_SU32_SUM0_SUS128_SRVW4_TT1_32_TLDS1_USFGROn1_VSn1_VW2_WSGRA1_WSGRB1_WG64_4_1_WGM2
    SolutionIndex: 179
    SolutionNameMin: Cijk_Alik_Bljk_BBH_MT64x64x32_MI32x32x4x1_SE_1LDSB1_AF0EM8_AMAS3_ASEM1_BL1_EPS1_GRVW8_GSU1_ISA908_IU1_KLA_LBSPP128_LPA8_LPB8_LRVW4_MAC_PGR1_PLR9_SIA3_SU32_SUM0_SUS128_SRVW4_TT1_32_TLDS1_USFGROn1_VSn1_VW2_WSGRA1_WSGRB1_WG64_4_1_WGM15
    SolutionIndex: 180
    SolutionNameMin: Cijk_Alik_Bljk_BBH_MT64x64x64_MI16x16x2x4_SE_1LDSB0_AF0EM1_AMAS3_ASEM1_BL1_EPS1_GRVW4_GSU1_ISA908_IU8_KLA_LBSPP128_LPA4_LPB4_LRVW2_MAC_PGR1_PLR0_SIA3_SU16_SUM2_SUS256_SRVW0_TT1_16_TLDS1_USFGROn1_VSn1_VW2_WSGRA0_WSGRB0_WG64_4_1_WGM8
    SolutionIndex: 181
    SolutionNameMin: Cijk_Alik_Bljk_BBH_MT128x96x32_MI32x32x4x1_SE_1LDSB1_AF0EM8_AMAS3_ASEM1_BL1_EPS1_GRVW4_GSU1_ISA908_IU1_KLA_LBSPP128_LPA4_LPB4_LRVW4_MAC_PGR1_PLR9_SIA3_SU0_SUM0_SUS256_SRVW4_TT1_96_TLDS1_USFGROn1_VSn1_VW2_WSGRA1_WSGRB1_WG128_2_1_WGM1
    SolutionIndex: 182
    SolutionNameMin: Cijk_Alik_Bljk_BBH_MT32x32x128_MI16x16x8x1_SE_1LDSB0_AF0EM4_AMAS3_ASEM1_BL1_EPS1_GRVW8_GSU1_ISA908_IU1_KLA_LBSPP256_LPA8_LPB8_LRVW8_MAC_PGR1_PLR17_SIA3_SU16_SUM0_SUS256_SRVW0_TT1_16_TLDS1_USFGROn1_VSn1_VW2_WSGRA1_WSGRB1_WG32_8_1_WGM2
    SolutionIndex: 183
    SolutionNameMin: Cijk_Alik_Bljk_BBH_MT64x64x32_MI32x32x4x1_SE_1LDSB1_AF0EM8_AMAS3_ASEM1_BL1_EPS1_GRVW8_GSU1_ISA908_IU1_KLA_LBSPP128_LPA8_LPB8_LRVW4_MAC_PGR1_PLR9_SIA3_SU0_SUM0_SUS256_SRVW4_TT1_32_TLDS1_USFGROn1_VSn1_VW2_WSGRA1_WSGRB1_WG64_4_1_WGM15
    SolutionIndex: 184
    SolutionNameMin: Cijk_Alik_Bljk_BBH_MT16x16x128_MI16x16x8x1_SE_1LDSB1_AF0EM1_AMAS3_ASEM1_BL1_EPS1_GRVW8_GSU1_ISA908_IU1_KLA_LBSPP256_LPA8_LPB8_LRVW4_MAC_PGR1_PLR17_SIA3_SU0_SUM0_SUS256_SRVW4_TT1_16_TLDS1_USFGROn1_VSn1_VW2_WSGRA1_WSGRB1_WG16_4_1_WGM1
    SolutionIndex: 185
    SolutionNameMin: Cijk_Alik_Bljk_BBH_MT64x32x32_MI16x16x8x1_SE_1LDSB1_AF0EM8_AMAS3_ASEM1_BL1_EPS1_GRVW4_GSU1_ISA908_IU1_KLA_LBSPP128_LPA4_LPB4_LRVW4_MAC_PGR1_PLR5_SIA3_SU0_SUM0_SUS256_SRVW4_TT2_16_TLDS1_USFGROn1_VSn1_VW2_WSGRA1_WSGRB1_WG32_8_1_WGM1
    SolutionIndex: 186
    SolutionNameMin: Cijk_Alik_Bljk_BBH_MT64x64x32_MI32x32x4x1_SE_1LDSB1_AF0EM8_AMAS3_ASEM1_BL1_EPS1_GRVW4_GSU1_ISA908_IU1_KLA_LBSPP128_LPA4_LPB4_LRVW4_MAC_PGR1_PLR9_SIA3_SU0_SUM0_SUS256_SRVW4_TT1_32_TLDS1_USFGROn1_VSn1_VW2_WSGRA1_WSGRB1_WG64_4_1_WGM2
    SolutionIndex: 187
    SolutionNameMin: Cijk_Alik_Bljk_BBH_MT64x128x64_MI32x32x4x1_SE_1LDSB1_AF0EM8_AMAS3_ASEM1_BL1_EPS1_GRVW8_GSU1_ISA908_IU1_KLA_LBSPP128_LPA8_LPB8_LRVW4_MAC_PGR1_PLR17_SIA3_SU32_SUM0_SUS128_SRVW4_TT1_64_TLDS1_USFGROn1_VSn1_VW2_WSGRA1_WSGRB1_WG64_4_1_WGM1
    SolutionIndex: 188
    SolutionNameMin: Cijk_Alik_Bljk_BBH_MT64x128x32_MI32x32x4x1_SE_1LDSB1_AF0EM8_AMAS3_ASEM1_BL1_EPS1_GRVW8_GSU1_ISA908_IU1_KLA_LBSPP128_LPA8_LPB8_LRVW4_MAC_PGR1_PLR9_SIA3_SU32_SUM0_SUS128_SRVW4_TT1_64_TLDS1_USFGROn1_VSn1_VW2_WSGRA1_WSGRB1_WG64_4_1_WGM15
    SolutionIndex: 189
    SolutionNameMin: Cijk_Alik_Bljk_BBH_MT96x96x32_MI16x16x8x1_SE_1LDSB0_AF0EM8_AMAS3_ASEM1_BL1_EPS1_GRVW2_GSU1_ISA908_IU1_KLA_LBSPP128_LPA4_LPB4_LRVW4_MAC_PGR1_PLR5_SIA3_SU32_SUM0_SUS256_SRVW0_TT3_48_TLDS1_USFGROn1_VSn1_VW2_WSGRA1_WSGRB1_WG32_8_1_WGM1
    SolutionIndex: 190
    SolutionNameMin: Cijk_Alik_Bljk_BBH_MT128x128x32_MI32x32x4x1_SE_1LDSB1_AF0EM8_AMAS3_ASEM1_BL1_EPS1_GRVW8_GSU1_ISA908_IU1_KLA_LBSPP128_LPA8_LPB8_LRVW4_MAC_PGR1_PLR9_SIA3_SU0_SUM0_SUS256_SRVW4_TT2_64_TLDS1_USFGROn1_VSn1_VW2_WSGRA1_WSGRB1_WG64_4_1_WGM2
    SolutionIndex: 191
    SolutionNameMin: Cijk_Alik_Bljk_BBH_MT32x32x64_MI16x16x8x1_SE_1LDSB0_AF0EM8_AMAS3_ASEM1_BL1_EPS1_GRVW8_GSU1_ISA908_IU1_KLA_LBSPP128_LPA8_LPB8_LRVW4_MAC_PGR1_PLR9_SIA3_SU32_SUM0_SUS128_SRVW4_TT1_16_TLDS1_USFGROn1_VSn1_VW2_WSGRA1_WSGRB1_WG32_8_1_WGM2
    SolutionIndex: 192
    SolutionNameMin: Cijk_Alik_Bljk_BBH_MT64x64x32_MI32x32x4x1_SE_1LDSB1_AF0EM8_AMAS3_ASEM1_BL1_EPS1_GRVW4_GSU1_ISA908_IU1_KLA_LBSPP128_LPA4_LPB4_LRVW4_MAC_PGR1_PLR9_SIA3_SU32_SUM0_SUS256_SRVW4_TT1_32_TLDS1_USFGROn1_VSn1_VW2_WSGRA1_WSGRB1_WG64_4_1_WGM15
    SolutionIndex: 193
    SolutionNameMin: Cijk_Alik_Bljk_BBH_MT64x64x32_MI32x32x4x1_SE_1LDSB1_AF0EM8_AMAS3_ASEM1_BL1_EPS1_GRVW2_GSU1_ISA908_IU1_KLA_LBSPP128_LPA4_LPB4_LRVW4_MAC_PGR1_PLR9_SIA3_SU0_SUM0_SUS256_SRVW4_TT1_32_TLDS1_USFGROn1_VSn1_VW2_WSGRA1_WSGRB1_WG64_4_1_WGM1
    SolutionIndex: 194
    SolutionNameMin: Cijk_Alik_Bljk_BBH_MT32x32x64_MI16x16x8x1_SE_1LDSB0_AF0EM8_AMAS3_ASEM1_BL1_EPS1_GRVW2_GSU1_ISA908_IU1_KLA_LBSPP128_LPA4_LPB4_LRVW4_MAC_PGR1_PLR9_SIA3_SU32_SUM0_SUS128_SRVW4_TT1_16_TLDS1_USFGROn1_VSn1_VW2_WSGRA1_WSGRB1_WG32_8_1_WGM2
    SolutionIndex: 195
    SolutionNameMin: Cijk_Alik_Bljk_BBH_MT32x32x64_MI16x16x8x1_SE_1LDSB0_AF0EM1_AMAS3_ASEM1_BL1_EPS0_GRVW8_GSU7_ISA908_IU1_KLA_LBSPP128_LPA8_LPB8_LRVW4_MAC_PGR2_PLR9_SIA3_SU32_SUM0_SUS256_SRVW4_TT1_16_TLDS1_USFGROn1_VSn1_VW2_WSGRA1_WSGRB1_WG32_8_1_WGM15
    SolutionIndex: 196
    SolutionNameMin: Cijk_Alik_Bljk_BBH_MT32x32x64_MI16x16x8x1_SE_1LDSB0_AF0EM8_AMAS3_ASEM1_BL1_EPS0_GRVW8_GSU1_ISA908_IU1_KLA_LBSPP128_LPA8_LPB8_LRVW4_MAC_PGR2_PLR9_SIA3_SU0_SUM0_SUS256_SRVW4_TT1_16_TLDS1_USFGROn1_VSn1_VW2_WSGRA1_WSGRB1_WG32_8_1_WGM15
    SolutionIndex: 197
    SolutionNameMin: Cijk_Alik_Bljk_BBH_MT32x32x64_MI16x16x8x1_SE_1LDSB1_AF0EM8_AMAS3_ASEM1_BL1_EPS1_GRVW2_GSU1_ISA908_IU1_KLA_LBSPP128_LPA4_LPB4_LRVW4_MAC_PGR1_PLR9_SIA3_SU0_SUM0_SUS256_SRVW4_TT1_16_TLDS1_USFGROn1_VSn1_VW2_WSGRA1_WSGRB1_WG32_8_1_WGM1
    SolutionIndex: 198
    SolutionNameMin: Cijk_Alik_Bljk_BBH_MT32x32x64_MI16x16x8x1_SE_1LDSB0_AF0EM1_AMAS3_ASEM1_BL1_EPS0_GRVW8_GSU3_ISA908_IU1_KLA_LBSPP128_LPA8_LPB8_LRVW4_MAC_PGR2_PLR9_SIA3_SU32_SUM0_SUS128_SRVW4_TT1_16_TLDS1_USFGROn1_VSn1_VW2_WSGRA1_WSGRB1_WG32_8_1_WGM2
    SolutionIndex: 199
    SolutionNameMin: Cijk_Alik_Bljk_BBH_MT32x32x64_MI16x16x8x1_SE_1LDSB0_AF0EM8_AMAS3_ASEM1_BL1_EPS1_GRVW8_GSU7_ISA908_IU1_KLA_LBSPP128_LPA8_LPB8_LRVW4_MAC_PGR1_PLR9_SIA3_SU32_SUM0_SUS256_SRVW0_TT1_16_TLDS1_USFGROn1_VSn1_VW2_WSGRA1_WSGRB1_WG32_8_1_WGM15
    SolutionIndex: 200
    SolutionNameMin: Cijk_Alik_Bljk_BBH_MT128x64x64_MI32x32x4x1_SE_1LDSB1_AF0EM8_AMAS3_ASEM1_BL1_EPS0_GRVW8_GSU1_ISA908_IU1_KLA_LBSPP128_LPA8_LPB8_LRVW4_MAC_PGR2_PLR17_SIA3_SU0_SUM0_SUS256_SRVW4_TT2_32_TLDS1_USFGROn1_VSn1_VW2_WSGRA1_WSGRB1_WG64_4_1_WGM1
    SolutionIndex: 201
    SolutionNameMin: Cijk_Alik_Bljk_BBH_MT64x64x128_MI32x32x4x1_SE_1LDSB1_AF0EM4_AMAS3_ASEM1_BL1_EPS1_GRVW8_GSU1_ISA908_IU1_KLA_LBSPP256_LPA8_LPB8_LRVW8_MAC_PGR1_PLR33_SIA3_SU0_SUM0_SUS256_SRVW4_TT1_32_TLDS1_USFGROn1_VSn1_VW2_WSGRA1_WSGRB1_WG64_4_1_WGM15
    SolutionIndex: 202
    SolutionNameMin: Cijk_Alik_Bljk_BBH_MT64x64x64_MI32x32x4x1_SE_1LDSB1_AF0EM8_AMAS3_ASEM1_BL1_EPS1_GRVW4_GSU1_ISA908_IU1_KLA_LBSPP128_LPA4_LPB4_LRVW4_MAC_PGR1_PLR17_SIA3_SU0_SUM0_SUS256_SRVW4_TT1_32_TLDS1_USFGROn1_VSn1_VW2_WSGRA1_WSGRB1_WG64_4_1_WGM2
    SolutionIndex: 203
    SolutionNameMin: Cijk_Alik_Bljk_BBH_MT128x64x32_MI32x32x4x1_SE_1LDSB0_AF0EM8_AMAS3_ASEM1_BL1_EPS1_GRVW4_GSU1_ISA908_IU1_KLA_LBSPP128_LPA4_LPB4_LRVW4_MAC_PGR1_PLR9_SIA3_SU0_SUM0_SUS256_SRVW4_TT2_32_TLDS1_USFGROn1_VSn1_VW2_WSGRA1_WSGRB1_WG64_4_1_WGM15
    SolutionIndex: 204
    SolutionNameMin: Cijk_Alik_Bljk_BBH_MT64x32x128_MI16x16x8x1_SE_1LDSB0_AF0EM1_AMAS3_ASEM1_BL1_EPS1_GRVW8_GSU1_ISA908_IU1_KLA_LBSPP256_LPA8_LPB8_LRVW8_MAC_PGR1_PLR17_SIA3_SU16_SUM0_SUS256_SRVW0_TT2_16_TLDS1_USFGROn1_VSn1_VW2_WSGRA1_WSGRB1_WG32_8_1_WGM15
    SolutionIndex: 205
    SolutionNameMin: Cijk_Alik_Bljk_BBH_MT32x32x128_MI16x16x8x1_SE_1LDSB0_AF0EM1_AMAS3_ASEM1_BL1_EPS1_GRVW8_GSU1_ISA908_IU1_KLA_LBSPP256_LPA8_LPB8_LRVW8_MAC_PGR1_PLR17_SIA3_SU32_SUM0_SUS256_SRVW4_TT1_16_TLDS1_USFGROn1_VSn1_VW2_WSGRA1_WSGRB1_WG32_8_1_WGM2
    SolutionIndex: 206
    SolutionNameMin: Cijk_Alik_Bljk_BBH_MT128x64x64_MI32x32x4x1_SE_1LDSB1_AF0EM8_AMAS3_ASEM1_BL1_EPS1_GRVW8_GSU3_ISA908_IU1_KLA_LBSPP128_LPA8_LPB8_LRVW4_MAC_PGR1_PLR17_SIA3_SU32_SUM0_SUS256_SRVW0_TT2_32_TLDS1_USFGROn1_VSn1_VW2_WSGRA1_WSGRB1_WG64_4_1_WGM15
    SolutionIndex: 207
    SolutionNameMin: Cijk_Alik_Bljk_BBH_MT64x128x64_MI32x32x4x1_SE_1LDSB1_AF0EM8_AMAS3_ASEM1_BL1_EPS1_GRVW8_GSU1_ISA908_IU1_KLA_LBSPP128_LPA8_LPB8_LRVW4_MAC_PGR1_PLR17_SIA3_SU0_SUM0_SUS256_SRVW4_TT1_64_TLDS1_USFGROn1_VSn1_VW2_WSGRA1_WSGRB1_WG64_4_1_WGM2
    SolutionIndex: 208
    SolutionNameMin: Cijk_Alik_Bljk_BBH_MT128x128x32_MI32x32x4x1_SE_1LDSB1_AF0EM8_AMAS3_ASEM1_BL1_EPS1_GRVW2_GSU1_ISA908_IU1_KLA_LBSPP128_LPA4_LPB4_LRVW4_MAC_PGR1_PLR9_SIA3_SU0_SUM0_SUS256_SRVW4_TT2_64_TLDS1_USFGROn1_VSn1_VW2_WSGRA1_WSGRB1_WG64_4_1_WGM15
    SolutionIndex: 209
    SolutionNameMin: Cijk_Alik_Bljk_BBH_MT64x64x64_MI32x32x4x1_SE_1LDSB1_AF0EM8_AMAS3_ASEM1_BL1_EPS1_GRVW2_GSU3_ISA908_IU1_KLA_LBSPP128_LPA4_LPB4_LRVW4_MAC_PGR1_PLR17_SIA3_SU0_SUM0_SUS256_SRVW0_TT1_32_TLDS1_USFGROn1_VSn1_VW2_WSGRA1_WSGRB1_WG64_4_1_WGM1
    SolutionIndex: 210
    SolutionNameMin: Cijk_Alik_Bljk_BBH_MT64x64x64_MI32x32x4x1_SE_1LDSB1_AF0EM8_AMAS3_ASEM1_BL1_EPS1_GRVW2_GSU2_ISA908_IU1_KLA_LBSPP128_LPA4_LPB4_LRVW4_MAC_PGR1_PLR17_SIA3_SU32_SUM0_SUS256_SRVW0_TT1_32_TLDS1_USFGROn1_VSn1_VW2_WSGRA1_WSGRB1_WG64_4_1_WGM2
    SolutionIndex: 211
    SolutionNameMin: Cijk_Alik_Bljk_BBH_MT32x64x32_MI16x16x8x1_SE_1LDSB0_AF0EM1_AMAS3_ASEM1_BL1_EPS1_GRVW8_GSU1_ISA908_IU1_KLA_LBSPP128_LPA8_LPB8_LRVW2_MAC_PGR1_PLR1_SIA3_SU32_SUM0_SUS256_SRVW4_TT2_16_TLDS1_USFGROn1_VSn1_VW2_WSGRA0_WSGRB0_WG16_16_1_WGM1
    SolutionIndex: 212
    SolutionNameMin: Cijk_Alik_Bljk_BBH_MT64x64x64_MI32x32x4x1_SE_1LDSB1_AF0EM8_AMAS3_ASEM1_BL1_EPS1_GRVW4_GSU1_ISA908_IU1_KLA_LBSPP128_LPA4_LPB4_LRVW4_MAC_PGR1_PLR17_SIA3_SU32_SUM0_SUS256_SRVW4_TT1_32_TLDS1_USFGROn1_VSn1_VW2_WSGRA1_WSGRB1_WG64_4_1_WGM1
    SolutionIndex: 213
    SolutionNameMin: Cijk_Alik_Bljk_BBH_MT128x64x32_MI32x32x4x1_SE_1LDSB1_AF0EM8_AMAS3_ASEM1_BL1_EPS1_GRVW8_GSU1_ISA908_IU1_KLA_LBSPP128_LPA8_LPB8_LRVW4_MAC_PGR1_PLR9_SIA3_SU0_SUM0_SUS256_SRVW4_TT2_32_TLDS1_USFGROn1_VSn1_VW2_WSGRA1_WSGRB1_WG64_4_1_WGM1
    SolutionIndex: 214
    SolutionNameMin: Cijk_Alik_Bljk_BBH_MT144x128x32_MI16x16x8x1_SE_1LDSB1_AF0EM8_AMAS3_ASEM1_BL1_EPS1_GRVW2_GSU1_ISA908_IU1_KLA_LBSPP128_LPA4_LPB4_LRVW4_MAC_PGR1_PLR5_SIA3_SU0_SUM0_SUS256_SRVW0_TT9_32_TLDS1_USFGROn1_VSn1_VW2_WSGRA1_WSGRB1_WG16_16_1_WGM1
    SolutionIndex: 215
    SolutionNameMin: Cijk_Alik_Bljk_BBH_MT32x32x64_MI16x16x8x1_SE_1LDSB0_AF0EM1_AMAS3_ASEM1_BL1_EPS1_GRVW8_GSU3_ISA908_IU1_KLA_LBSPP128_LPA8_LPB8_LRVW4_MAC_PGR1_PLR9_SIA3_SU0_SUM0_SUS256_SRVW0_TT1_16_TLDS1_USFGROn1_VSn1_VW2_WSGRA1_WSGRB1_WG32_8_1_WGM1
    SolutionIndex: 216
    SolutionNameMin: Cijk_Alik_Bljk_BBH_MT96x128x64_MI32x32x4x1_SE_1LDSB1_AF0EM8_AMAS3_ASEM1_BL1_EPS1_GRVW2_GSU1_ISA908_IU1_KLA_LBSPP128_LPA4_LPB4_LRVW4_MAC_PGR1_PLR17_SIA3_SU0_SUM0_SUS256_SRVW0_TT3_32_TLDS1_USFGROn1_VSn1_VW2_WSGRA1_WSGRB1_WG32_8_1_WGM15
    SolutionIndex: 217
    SolutionNameMin: Cijk_Alik_Bljk_BBH_MT96x96x64_MI16x16x8x1_SE_1LDSB1_AF0EM8_AMAS3_ASEM1_BL1_EPS1_GRVW2_GSU1_ISA908_IU1_KLA_LBSPP128_LPA4_LPB4_LRVW4_MAC_PGR1_PLR9_SIA3_SU0_SUM0_SUS256_SRVW0_TT3_48_TLDS1_USFGROn1_VSn1_VW2_WSGRA1_WSGRB1_WG32_8_1_WGM15
    SolutionIndex: 218
    SolutionNameMin: Cijk_Alik_Bljk_BBH_MT128x144x32_MI16x16x8x1_SE_1LDSB1_AF0EM8_AMAS3_ASEM1_BL1_EPS1_GRVW2_GSU1_ISA908_IU1_KLA_LBSPP128_LPA4_LPB4_LRVW4_MAC_PGR1_PLR5_SIA3_SU0_SUM0_SUS256_SRVW4_TT2_144_TLDS1_USFGROn1_VSn1_VW2_WSGRA1_WSGRB1_WG64_4_1_WGM15
    SolutionIndex: 219
    SolutionNameMin: Cijk_Alik_Bljk_BBH_MT96x96x64_MI16x16x8x1_SE_1LDSB1_AF0EM8_AMAS3_ASEM1_BL1_EPS1_GRVW8_GSU1_ISA908_IU1_KLA_LBSPP128_LPA8_LPB8_LRVW4_MAC_PGR1_PLR9_SIA3_SU32_SUM0_SUS256_SRVW0_TT3_48_TLDS1_USFGROn1_VSn1_VW2_WSGRA1_WSGRB1_WG32_8_1_WGM2
    SolutionIndex: 220
    SolutionNameMin: Cijk_Alik_Bljk_BBH_MT128x96x32_MI32x32x4x1_SE_1LDSB1_AF0EM8_AMAS3_ASEM1_BL1_EPS1_GRVW2_GSU1_ISA908_IU1_KLA_LBSPP128_LPA4_LPB4_LRVW4_MAC_PGR1_PLR9_SIA3_SU0_SUM0_SUS256_SRVW4_TT1_96_TLDS1_USFGROn1_VSn1_VW2_WSGRA1_WSGRB1_WG128_2_1_WGM1
    SolutionIndex: 221
    SolutionNameMin: Cijk_Alik_Bljk_BBH_MT128x128x32_MI32x32x4x1_SE_1LDSB1_AF0EM8_AMAS3_ASEM1_BL1_EPS1_GRVW2_GSU1_ISA908_IU1_KLA_LBSPP128_LPA4_LPB4_LRVW4_MAC_PGR1_PLR9_SIA3_SU32_SUM0_SUS128_SRVW4_TT2_64_TLDS1_USFGROn1_VSn1_VW2_WSGRA1_WSGRB1_WG64_4_1_WGM1
    SolutionIndex: 222
    SolutionNameMin: Cijk_Alik_Bljk_BBH_MT128x96x32_MI32x32x4x1_SE_1LDSB1_AF0EM8_AMAS3_ASEM1_BL1_EPS1_GRVW2_GSU1_ISA908_IU1_KLA_LBSPP128_LPA4_LPB4_LRVW4_MAC_PGR1_PLR9_SIA3_SU0_SUM0_SUS256_SRVW4_TT1_96_TLDS1_USFGROn1_VSn1_VW2_WSGRA1_WSGRB1_WG128_2_1_WGM15
    SolutionIndex: 223
    SolutionNameMin: Cijk_Alik_Bljk_BBH_MT64x128x64_MI32x32x4x1_SE_1LDSB1_AF0EM8_AMAS3_ASEM1_BL1_EPS1_GRVW8_GSU1_ISA908_IU1_KLA_LBSPP128_LPA8_LPB8_LRVW4_MAC_PGR1_PLR17_SIA3_SU32_SUM0_SUS256_SRVW4_TT1_64_TLDS1_USFGROn1_VSn1_VW2_WSGRA1_WSGRB1_WG64_4_1_WGM2
    SolutionIndex: 224
    SolutionNameMin: Cijk_Alik_Bljk_BBH_MT32x32x128_MI16x16x8x1_SE_1LDSB0_AF0EM1_AMAS3_ASEM1_BL1_EPS0_GRVW8_GSU120_ISA908_IU1_KLA_LBSPP256_LPA16_LPB16_LRVW8_MAC_PGR2_PLR17_SIA3_SU32_SUM0_SUS256_SRVW0_TT1_16_TLDS1_USFGROn1_VSn1_VW2_WSGRA1_WSGRB1_WG32_8_1_WGM2
    SolutionIndex: 225
    SolutionNameMin: Cijk_Alik_Bljk_BBH_MT64x128x32_MI32x32x4x1_SE_1LDSB0_AF0EM8_AMAS3_ASEM1_BL1_EPS0_GRVW8_GSU1_ISA908_IU1_KLA_LBSPP128_LPA8_LPB8_LRVW4_MAC_PGR2_PLR9_SIA3_SU32_SUM0_SUS256_SRVW4_TT1_64_TLDS1_USFGROn1_VSn1_VW2_WSGRA1_WSGRB1_WG64_4_1_WGM2
    SolutionIndex: 226
    SolutionNameMin: Cijk_Alik_Bljk_BBH_MT64x128x32_MI32x32x4x1_SE_1LDSB1_AF0EM8_AMAS3_ASEM1_BL1_EPS1_GRVW8_GSU1_ISA908_IU1_KLA_LBSPP128_LPA8_LPB8_LRVW4_MAC_PGR1_PLR9_SIA3_SU32_SUM0_SUS128_SRVW4_TT1_64_TLDS1_USFGROn1_VSn1_VW2_WSGRA1_WSGRB1_WG64_4_1_WGM1
    SolutionIndex: 227
    SolutionNameMin: Cijk_Alik_Bljk_BBH_MT128x256x32_MI32x32x4x1_SE_1LDSB1_AF0EM8_AMAS3_ASEM1_BL1_EPS1_GRVW2_GSU1_ISA908_IU1_KLA_LBSPP128_LPA4_LPB4_LRVW4_MAC_PGR1_PLR9_SIA3_SU0_SUM0_SUS256_SRVW4_TT2_128_TLDS1_USFGROn1_VSn1_VW2_WSGRA1_WSGRB1_WG64_4_1_WGM2
    SolutionIndex: 228
    SolutionNameMin: Cijk_Alik_Bljk_BBH_MT96x96x32_MI16x16x8x1_SE_1LDSB1_AF0EM8_AMAS3_ASEM1_BL1_EPS1_GRVW2_GSU1_ISA908_IU1_KLA_LBSPP128_LPA4_LPB4_LRVW4_MAC_PGR1_PLR5_SIA3_SU32_SUM0_SUS128_SRVW0_TT3_48_TLDS1_USFGROn1_VSn1_VW2_WSGRA1_WSGRB1_WG32_8_1_WGM15
    SolutionIndex: 229
    SolutionNameMin: Cijk_Alik_Bljk_BBH_MT128x64x32_MI32x32x4x1_SE_1LDSB1_AF0EM8_AMAS3_ASEM1_BL1_EPS1_GRVW8_GSU1_ISA908_IU1_KLA_LBSPP128_LPA8_LPB8_LRVW4_MAC_PGR1_PLR9_SIA3_SU0_SUM0_SUS256_SRVW4_TT2_32_TLDS1_USFGROn1_VSn1_VW2_WSGRA1_WSGRB1_WG64_4_1_WGM15
    SolutionIndex: 230
    SolutionNameMin: Cijk_Alik_Bljk_BBH_MT128x128x32_MI32x32x4x1_SE_1LDSB1_AF0EM8_AMAS3_ASEM1_BL1_EPS1_GRVW4_GSU1_ISA908_IU1_KLA_LBSPP128_LPA4_LPB4_LRVW4_MAC_PGR1_PLR9_SIA3_SU0_SUM0_SUS256_SRVW4_TT2_64_TLDS1_USFGROn1_VSn1_VW2_WSGRA1_WSGRB1_WG64_4_1_WGM1
    SolutionIndex: 231
    SolutionNameMin: Cijk_Alik_Bljk_BBH_MT128x64x64_MI32x32x4x1_SE_1LDSB1_AF0EM8_AMAS3_ASEM1_BL1_EPS1_GRVW8_GSU1_ISA908_IU1_KLA_LBSPP128_LPA8_LPB8_LRVW4_MAC_PGR1_PLR17_SIA3_SU32_SUM0_SUS128_SRVW4_TT2_32_TLDS1_USFGROn1_VSn1_VW2_WSGRA1_WSGRB1_WG64_4_1_WGM15
    SolutionIndex: 232
    SolutionNameMin: Cijk_Alik_Bljk_BBH_MT64x128x32_MI32x32x4x1_SE_1LDSB0_AF0EM1_AMAS3_ASEM1_BL1_EPS1_GRVW8_GSU1_ISA908_IU1_KLA_LBSPP128_LPA8_LPB8_LRVW2_MAC_PGR1_PLR1_SIA3_SU32_SUM0_SUS256_SRVW4_TT2_32_TLDS1_USFGROn1_VSn1_VW2_WSGRA1_WSGRB1_WG32_8_1_WGM4
    SolutionIndex: 233
    SolutionNameMin: Cijk_Alik_Bljk_BBH_MT128x64x64_MI32x32x4x1_SE_1LDSB0_AF0EM8_AMAS3_ASEM1_BL1_EPS1_GRVW8_GSU1_ISA908_IU1_KLA_LBSPP128_LPA8_LPB8_LRVW4_MAC_PGR1_PLR17_SIA3_SU0_SUM0_SUS256_SRVW4_TT2_32_TLDS1_USFGROn1_VSn1_VW2_WSGRA1_WSGRB1_WG64_4_1_WGM15
    SolutionIndex: 234
    SolutionNameMin: Cijk_Alik_Bljk_BBH_MT256x64x64_MI32x32x4x1_SE_1LDSB1_AF0EM8_AMAS3_ASEM1_BL1_EPS1_GRVW2_GSU1_ISA908_IU1_KLA_LBSPP128_LPA4_LPB4_LRVW4_MAC_PGR1_PLR17_SIA3_SU0_SUM0_SUS256_SRVW4_TT4_32_TLDS1_USFGROn1_VSn1_VW2_WSGRA1_WSGRB1_WG64_4_1_WGM1
    SolutionIndex: 235
    SolutionNameMin: Cijk_Alik_Bljk_BBH_MT128x96x32_MI32x32x4x1_SE_1LDSB0_AF0EM4_AMAS3_ASEM1_BL1_EPS1_GRVW2_GSU1_ISA908_IU1_KLA_LBSPP128_LPA8_LPB8_LRVW8_MAC_PGR1_PLR9_SIA3_SU0_SUM0_SUS256_SRVW4_TT1_96_TLDS1_USFGROn1_VSn1_VW2_WSGRA1_WSGRB1_WG128_2_1_WGM15
    SolutionIndex: 236
    SolutionNameMin: Cijk_Alik_Bljk_BBH_MT64x128x32_MI32x32x4x1_SE_1LDSB0_AF0EM8_AMAS3_ASEM1_BL1_EPS0_GRVW8_GSU1_ISA908_IU1_KLA_LBSPP128_LPA8_LPB8_LRVW4_MAC_PGR2_PLR9_SIA3_SU0_SUM0_SUS256_SRVW4_TT1_64_TLDS1_USFGROn1_VSn1_VW2_WSGRA1_WSGRB1_WG64_4_1_WGM2
    SolutionIndex: 237
    SolutionNameMin: Cijk_Alik_Bljk_BBH_MT16x16x128_MI16x16x8x1_SE_1LDSB1_AF0EM1_AMAS3_ASEM1_BL1_EPS0_GRVW8_GSU120_ISA908_IU1_KLA_LBSPP256_LPA16_LPB16_LRVW8_MAC_PGR2_PLR17_SIA3_SU32_SUM0_SUS256_SRVW0_TT1_16_TLDS1_USFGROn1_VSn1_VW2_WSGRA1_WSGRB1_WG16_4_1_WGM1
    SolutionIndex: 238
    SolutionNameMin: Cijk_Alik_Bljk_BBH_MT32x32x64_MI16x16x8x1_SE_1LDSB1_AF0EM1_AMAS3_ASEM1_BL1_EPS1_GRVW2_GSU3_ISA908_IU1_KLA_LBSPP128_LPA4_LPB4_LRVW4_MAC_PGR1_PLR9_SIA3_SU0_SUM0_SUS256_SRVW0_TT1_16_TLDS1_USFGROn1_VSn1_VW2_WSGRA1_WSGRB1_WG32_8_1_WGM1
- - - [1024, 512, 1, 1025]
    - [0, 19.211]
  - - [8192, 8193, 1, 8192]
    - [1, 94.847]
  - - [8192, 8192, 1, 8193]
    - [2, 91.592]
  - - [4096, 4096, 1, 4097]
    - [3, 83.368]
  - - [1025, 1024, 1, 1024]
    - [4, 25.567]
  - - [8192, 8191, 1, 8192]
    - [5, 94.875]
  - - [2048, 513, 1, 2048]
    - [6, 44.047]
  - - [1024, 1024, 1, 1025]
    - [7, 31.183]
  - - [3072, 511, 1, 3072]
    - [8, 61.706]
  - - [2049, 512, 1, 2048]
    - [9, 34.948]
  - - [4096, 4095, 1, 4096]
    - [10, 89.914]
  - - [513, 512, 1, 512]
    - [11, 6.685]
  - - [1024, 511, 1, 1024]
    - [12, 18.735]
  - - [1023, 512, 1, 1024]
    - [13, 18.932]
  - - [1024, 513, 1, 1024]
    - [14, 21.365]
  - - [4096, 4097, 1, 4096]
    - [3, 89.317]
  - - [2048, 2047, 1, 2048]
    - [15, 64.09]
  - - [8193, 8192, 1, 8192]
    - [4, 93.19]
  - - [1024, 1023, 1, 1024]
    - [16, 34.229]
  - - [4096, 4096, 1, 4095]
    - [17, 82.417]
  - - [1025, 512, 1, 1024]
    - [18, 19.955]
  - - [1024, 512, 1, 1023]
    - [19, 16.62]
  - - [512, 512, 1, 513]
    - [20, 5.717]
  - - [1024, 1025, 1, 1024]
    - [16, 32.342]
  - - [512, 512, 1, 511]
    - [21, 5.323]
  - - [2047, 2048, 1, 2048]
    - [22, 59.72]
  - - [2049, 2048, 1, 2048]
    - [23, 63.836]
  - - [2048, 511, 1, 2048]
    - [24, 39.941]
  - - [2048, 2049, 1, 2048]
    - [25, 66.45]
  - - [2048, 512, 1, 2047]
    - [26, 41.321]
  - - [2047, 512, 1, 2048]
    - [9, 37.74]
  - - [3072, 513, 1, 3072]
    - [27, 57.868]
  - - [512, 511, 1, 512]
    - [28, 7.088]
  - - [4097, 4096, 1, 4096]
    - [1, 85.174]
  - - [2048, 2048, 1, 2047]
    - [24, 63.572]
  - - [2048, 2048, 1, 2049]
    - [29, 64.701]
  - - [8191, 8192, 1, 8192]
    - [1, 93.89]
  - - [512, 513, 1, 512]
    - [30, 6.355]
  - - [8192, 8192, 1, 8191]
    - [2, 91.924]
  - - [1024, 1024, 1, 1023]
    - [7, 26.256]
  - - [511, 512, 1, 512]
    - [11, 6.49]
  - - [4095, 4096, 1, 4096]
    - [31, 87.545]
  - - [2048, 512, 1, 2049]
    - [26, 36.196]
  - - [1023, 1024, 1, 1024]
    - [32, 24.32]
  - - [512, 512, 1, 512]
    - [33, 6.121]
  - - [1024, 1024, 1, 1024]
    - [34, 32.641]
  - - [2048, 2048, 1, 2048]
    - [35, 65.008]
  - - [4096, 4096, 1, 4096]
    - [10, 89.457]
  - - [8192, 8192, 1, 8192]
    - [25, 94.918]
  - - [479, 1024, 1, 1024]
    - [36, 17.403]
  - - [479, 2048, 1, 2048]
    - [37, 43.747]
  - - [480, 1023, 1, 1024]
    - [19, 22.073]
  - - [480, 1024, 1, 1023]
    - [0, 16.307]
  - - [480, 1024, 1, 1025]
    - [19, 19.336]
  - - [480, 1025, 1, 1024]
    - [0, 20.727]
  - - [480, 2047, 1, 2048]
    - [37, 47.039]
  - - [480, 2048, 1, 2047]
    - [38, 39.151]
  - - [480, 2048, 1, 2049]
    - [39, 42.515]
  - - [480, 2049, 1, 2048]
    - [40, 48.333]
  - - [481, 1024, 1, 1024]
    - [41, 15.05]
  - - [481, 2048, 1, 2048]
    - [9, 33.815]
  - - [511, 480, 1, 512]
    - [42, 7.134]
  - - [512, 479, 1, 512]
    - [43, 8.802]
  - - [512, 480, 1, 511]
    - [11, 7.126]
  - - [512, 480, 1, 513]
    - [20, 5.616]
  - - [512, 481, 1, 512]
    - [44, 7.619]
  - - [513, 480, 1, 512]
    - [36, 6.529]
  - - [1023, 480, 1, 1024]
    - [45, 20.357]
  - - [1024, 479, 1, 1024]
    - [45, 21.595]
  - - [1024, 480, 1, 1023]
    - [12, 17.566]
  - - [1024, 480, 1, 1025]
    - [12, 18.058]
  - - [1024, 481, 1, 1024]
    - [12, 22.267]
  - - [1025, 480, 1, 1024]
    - [18, 17.509]
  - - [2047, 480, 1, 2048]
    - [37, 42.221]
  - - [2048, 479, 1, 2048]
    - [46, 40.584]
  - - [2048, 480, 1, 2047]
    - [47, 41.46]
  - - [2048, 480, 1, 2049]
    - [40, 38.489]
  - - [2048, 481, 1, 2048]
    - [26, 40.008]
  - - [2049, 480, 1, 2048]
    - [48, 45.694]
  - - [480, 1024, 1, 1024]
    - [49, 22.486]
  - - [480, 2048, 1, 2048]
    - [46, 48.835]
  - - [512, 480, 1, 512]
    - [20, 7.38]
  - - [1024, 480, 1, 1024]
    - [43, 20.262]
  - - [2048, 480, 1, 2048]
    - [50, 49.545]
  - - [480, 3072, 1, 3072]
    - [29, 67.777]
  - - [480, 4096, 1, 4096]
    - [51, 61.46]
  - - [480, 8192, 1, 8192]
    - [29, 81.64]
  - - [3072, 480, 1, 3072]
    - [52, 70.551]
  - - [4096, 480, 1, 4096]
    - [37, 59.336]
  - - [8192, 480, 1, 8192]
    - [29, 80.086]
  - - [17, 17, 1, 64]
    - [20, 0.001]
  - - [24, 24, 1, 64]
    - [53, 0.003]
  - - [30, 31, 1, 64]
    - [54, 0.004]
  - - [32, 32, 1, 64]
    - [53, 0.005]
  - - [32, 35, 1, 64]
    - [53, 0.006]
  - - [31, 31, 1, 64]
    - [54, 0.005]
  - - [34, 34, 1, 64]
    - [55, 0.005]
  - - [30, 30, 1, 64]
    - [33, 0.004]
  - - [17, 15, 1, 64]
    - [20, 0.001]
  - - [35, 35, 1, 64]
    - [20, 0.004]
  - - [21, 17, 1, 64]
    - [56, 0.001]
  - - [21, 21, 1, 64]
    - [57, 0.001]
  - - [15, 14, 1, 64]
    - [56, 0.001]
  - - [14, 14, 1, 64]
    - [20, 0.001]
  - - [15, 15, 1, 64]
    - [33, 0.001]
  - - [34, 24, 1, 64]
    - [58, 0.004]
  - - [2, 4, 1, 1024]
    - [59, 0.001]
  - - [2, 32, 1, 1024]
    - [60, 0.003]
  - - [2, 2048, 1, 1024]
    - [59, 0.268]
  - - [64, 128, 512, 128]
    - [61, 15.212]
  - - [64, 512, 1, 512]
    - [62, 1.077]
  - - [64, 512, 64, 512]
    - [63, 28.368]
  - - [128, 128, 512, 64]
    - [64, 16.237]
  - - [512, 512, 1, 64]
    - [11, 1.085]
  - - [512, 512, 64, 64]
    - [65, 20.628]
  - - [1024, 4, 1, 1024]
    - [62, 0.258]
  - - [1024, 32, 1, 1024]
    - [66, 1.934]
  - - [1024, 2048, 1, 1024]
    - [51, 49.757]
  - - [1024, 2048, 1, 4096]
    - [10, 62.714]
  - - [1024, 4096, 1, 1024]
    - [67, 61.926]
  - - [1024, 4096, 1, 4096]
    - [5, 78.316]
  - - [4096, 2048, 1, 1024]
    - [68, 64.934]
  - - [4096, 4096, 1, 1024]
    - [69, 75.172]
  - - [30528, 2048, 1, 1024]
    - [65, 86.927]
  - - [30528, 4096, 1, 1024]
    - [70, 89.41]
  - - [3, 3, 512, 64]
    - [53, 0.022]
  - - [5, 5, 512, 64]
    - [58, 0.05]
  - - [5, 5, 960, 64]
    - [56, 0.114]
  - - [9, 9, 512, 64]
    - [33, 0.203]
  - - [27, 27, 32768, 128]
    - [11, 13.264]
  - - [32, 1600, 1, 512]
    - [71, 1.748]
  - - [33, 33, 1600, 32]
    - [20, 1.967]
  - - [64, 512, 1, 1024]
    - [72, 2.147]
  - - [64, 960, 1, 1024]
    - [60, 4.005]
  - - [128, 32768, 1, 256]
    - [73, 31.821]
  - - [256, 684, 1, 1024]
    - [74, 9.073]
  - - [256, 1280, 1, 1024]
    - [75, 17.295]
  - - [256, 1536, 1, 1024]
    - [75, 20.138]
  - - [256, 2304, 1, 1024]
    - [34, 23.517]
  - - [256, 2560, 1, 1024]
    - [76, 25.739]
  - - [256, 2816, 1, 1024]
    - [77, 27.404]
  - - [256, 3328, 1, 1024]
    - [14, 34.192]
  - - [256, 3584, 1, 1024]
    - [78, 32.419]
  - - [256, 4608, 1, 1024]
    - [52, 36.371]
  - - [256, 4864, 1, 1024]
    - [76, 38.766]
  - - [256, 5376, 1, 1024]
    - [67, 42.725]
  - - [256, 5888, 1, 1024]
    - [75, 35.597]
  - - [256, 6144, 1, 1024]
    - [8, 42.44]
  - - [256, 6400, 1, 1024]
    - [8, 46.056]
  - - [256, 6656, 1, 1024]
    - [79, 45.425]
  - - [256, 7168, 1, 1024]
    - [80, 46.406]
  - - [256, 7424, 1, 1024]
    - [81, 51.016]
  - - [256, 7936, 1, 1024]
    - [14, 44.705]
  - - [256, 8192, 1, 1024]
    - [51, 46.393]
  - - [256, 8448, 1, 1024]
    - [22, 46.655]
  - - [256, 8960, 1, 1024]
    - [3, 53.946]
  - - [256, 9984, 1, 1024]
    - [82, 48.58]
  - - [256, 10496, 1, 1024]
    - [83, 55.629]
  - - [256, 11264, 1, 1024]
    - [73, 58.716]
  - - [256, 11520, 1, 1024]
    - [2, 57.88]
  - - [256, 11776, 1, 1024]
    - [84, 48.368]
  - - [256, 12544, 1, 1024]
    - [85, 52.15]
  - - [256, 13312, 1, 1024]
    - [86, 56.746]
  - - [256, 14336, 1, 1024]
    - [87, 53.918]
  - - [256, 14592, 1, 1024]
    - [78, 61.098]
  - - [256, 14848, 1, 1024]
    - [80, 58.151]
  - - [256, 15104, 1, 1024]
    - [88, 62.298]
  - - [256, 16128, 1, 1024]
    - [89, 60.266]
  - - [256, 18176, 1, 1024]
    - [87, 60.001]
  - - [256, 18944, 1, 1024]
    - [90, 65.462]
  - - [256, 19200, 1, 1024]
    - [91, 63.016]
  - - [256, 20480, 1, 1024]
    - [51, 57.214]
  - - [256, 20992, 1, 1024]
    - [92, 56.238]
  - - [256, 21248, 1, 1024]
    - [93, 54.494]
  - - [256, 21504, 1, 1024]
    - [9, 52.278]
  - - [256, 22016, 1, 1024]
    - [85, 64.57]
  - - [256, 22344, 1, 1024]
    - [94, 55.794]
  - - [256, 23296, 1, 1024]
    - [95, 56.503]
  - - [256, 23552, 1, 1024]
    - [95, 57.343]
  - - [256, 31488, 1, 1024]
    - [81, 63.38]
  - - [256, 32768, 1, 512]
    - [96, 57.979]
  - - [256, 33536, 1, 1024]
    - [97, 66.617]
  - - [256, 44505, 1, 1024]
    - [98, 73.997]
  - - [512, 1600, 1, 512]
    - [14, 20.214]
  - - [512, 32768, 1, 13]
    - [99, 4.516]
  - - [512, 32768, 1, 1024]
    - [99, 76.145]
  - - [684, 8976, 1, 256]
    - [100, 32.061]
  - - [1024, 200, 1, 560]
    - [11, 5.354]
  - - [1024, 512, 1, 1024]
    - [101, 22.216]
  - - [1024, 512, 1, 1600]
    - [102, 27.915]
  - - [1024, 960, 1, 1024]
    - [103, 37.263]
  - - [1024, 960, 1, 1600]
    - [104, 46.452]
  - - [1024, 1600, 1, 560]
    - [73, 27.545]
  - - [1024, 1600, 1, 1024]
    - [80, 42.352]
  - - [1024, 32768, 1, 480]
    - [105, 71.716]
  - - [1024, 32768, 1, 1024]
    - [84, 81.972]
  - - [1280, 8976, 1, 256]
    - [106, 49.227]
  - - [1792, 8976, 1, 256]
    - [96, 54.057]
  - - [2048, 114, 1, 512]
    - [20, 6.738]
  - - [2048, 114, 1, 768]
    - [107, 8.833]
  - - [2048, 215, 1, 512]
    - [108, 12.197]
  - - [2048, 215, 1, 768]
    - [45, 16.443]
  - - [2048, 256, 1, 512]
    - [23, 13.14]
  - - [2048, 256, 1, 768]
    - [109, 17.094]
  - - [2048, 512, 1, 67]
    - [110, 3.445]
  - - [2048, 512, 1, 74]
    - [111, 4.022]
  - - [2048, 512, 1, 100]
    - [112, 4.499]
  - - [2048, 512, 1, 2048]
    - [97, 40.244]
  - - [2048, 684, 1, 512]
    - [63, 26.599]
  - - [2048, 684, 1, 768]
    - [63, 37.007]
  - - [2048, 960, 1, 74]
    - [112, 7.279]
  - - [2048, 960, 1, 2048]
    - [113, 69.157]
  - - [2048, 1536, 1, 512]
    - [114, 37.842]
  - - [2048, 1536, 1, 768]
    - [115, 49.446]
  - - [2048, 8976, 1, 256]
    - [116, 44.574]
  - - [2304, 8976, 1, 256]
    - [117, 45.97]
  - - [2560, 8976, 1, 256]
    - [104, 54.567]
  - - [2816, 8976, 1, 256]
    - [118, 50.48]
  - - [3072, 8976, 1, 256]
    - [105, 52.565]
  - - [3328, 8976, 1, 256]
    - [113, 58.234]
  - - [3840, 8976, 1, 256]
    - [119, 57.407]
  - - [4096, 8976, 1, 256]
    - [113, 57.327]
  - - [4352, 8976, 1, 256]
    - [25, 59.123]
  - - [4608, 8976, 1, 256]
    - [113, 59.374]
  - - [4864, 8976, 1, 256]
    - [106, 61.004]
  - - [5120, 8976, 1, 256]
    - [106, 59.719]
  - - [5376, 8976, 1, 256]
    - [120, 60.458]
  - - [5632, 8976, 1, 256]
    - [119, 58.84]
  - - [5888, 8976, 1, 256]
    - [5, 61.761]
  - - [6144, 8976, 1, 256]
    - [121, 60.997]
  - - [6400, 8976, 1, 256]
    - [25, 63.872]
  - - [7168, 8976, 1, 256]
    - [96, 64.785]
  - - [7936, 8976, 1, 256]
    - [122, 64.268]
  - - [8192, 8976, 1, 256]
    - [113, 62.758]
  - - [8448, 8976, 1, 256]
    - [113, 64.073]
  - - [8960, 8976, 1, 256]
    - [5, 67.383]
  - - [9472, 8976, 1, 256]
    - [113, 65.702]
  - - [9728, 8976, 1, 256]
    - [106, 66.432]
  - - [9984, 8976, 1, 256]
    - [22, 65.571]
  - - [10240, 8976, 1, 256]
    - [123, 66.408]
  - - [10496, 8976, 1, 256]
    - [123, 67.804]
  - - [11264, 8976, 1, 256]
    - [106, 67.975]
  - - [11776, 8976, 1, 256]
    - [119, 66.708]
  - - [12544, 8976, 1, 256]
    - [122, 66.982]
  - - [13312, 8976, 1, 256]
    - [123, 69.237]
  - - [13568, 8976, 1, 256]
    - [106, 68.393]
  - - [13824, 8976, 1, 256]
    - [123, 68.419]
  - - [15104, 8976, 1, 256]
    - [106, 69.834]
  - - [15360, 8976, 1, 256]
    - [123, 71.426]
  - - [15872, 8976, 1, 256]
    - [123, 71.55]
  - - [16128, 8976, 1, 256]
    - [123, 68.856]
  - - [17152, 8976, 1, 256]
    - [124, 70.14]
  - - [18176, 8976, 1, 256]
    - [123, 68.846]
  - - [18688, 8976, 1, 256]
    - [5, 69.01]
  - - [18944, 8976, 1, 256]
    - [123, 69.028]
  - - [19712, 8976, 1, 256]
    - [123, 69.424]
  - - [19968, 8976, 1, 256]
    - [123, 69.381]
  - - [20480, 8976, 1, 256]
    - [106, 71.27]
  - - [20992, 8976, 1, 256]
    - [123, 70.638]
  - - [21248, 8976, 1, 256]
    - [123, 71.023]
  - - [23552, 8976, 1, 256]
    - [123, 71.361]
  - - [28672, 8976, 1, 256]
    - [123, 71.495]
  - - [31488, 8976, 1, 256]
    - [5, 71.167]
  - - [33536, 8976, 1, 256]
    - [123, 71.901]
  - - [44505, 8976, 1, 256]
    - [22, 68.932]
  - - [14, 14, 10880, 64]
    - [125, 3.647]
  - - [15, 14, 10880, 64]
    - [125, 3.889]
  - - [15, 15, 7680, 64]
    - [125, 3.086]
  - - [15, 15, 10880, 64]
    - [125, 3.988]
  - - [17, 15, 7680, 64]
    - [54, 3.509]
  - - [17, 17, 7680, 64]
    - [20, 3.69]
  - - [21, 17, 6144, 64]
    - [11, 4.185]
  - - [21, 21, 6144, 64]
    - [126, 4.73]
  - - [24, 24, 4736, 64]
    - [127, 6.002]
  - - [30, 30, 2048, 64]
    - [128, 4.275]
  - - [30, 31, 2048, 64]
    - [129, 5.099]
  - - [31, 31, 2048, 64]
    - [126, 5.171]
  - - [32, 32, 4608, 64]
    - [33, 8.777]
  - - [32, 35, 4608, 64]
    - [20, 7.266]
  - - [34, 24, 4736, 64]
    - [130, 4.682]
  - - [34, 34, 4736, 64]
    - [125, 6.722]
  - - [35, 35, 4608, 64]
    - [56, 6.087]
  - - [1024, 3840, 1, 1024]
    - [81, 60.093]
  - - [1024, 3840, 1, 4096]
    - [27, 79.692]
  - - [1024, 3968, 1, 1024]
    - [119, 57.325]
  - - [1024, 3968, 1, 4096]
    - [89, 73.776]
  - - [1024, 6528, 1, 1024]
    - [80, 63.089]
  - - [1024, 6528, 1, 4096]
    - [95, 83.125]
  - - [1024, 7104, 1, 1024]
    - [131, 64.044]
  - - [1024, 7104, 1, 4096]
    - [132, 83.16]
  - - [1024, 7200, 1, 1024]
    - [133, 68.376]
  - - [1024, 7200, 1, 4096]
    - [96, 86.414]
  - - [1024, 8064, 1, 1024]
    - [134, 62.543]
  - - [1024, 8064, 1, 4096]
    - [2, 83.963]
  - - [1024, 8160, 1, 1024]
    - [100, 65.312]
  - - [1024, 8160, 1, 4096]
    - [132, 84.263]
  - - [1024, 9216, 1, 1024]
    - [135, 74.011]
  - - [1024, 9216, 1, 4096]
    - [3, 86.673]
  - - [1024, 9520, 1, 1024]
    - [136, 68.609]
  - - [1024, 9520, 1, 4096]
    - [137, 89.723]
  - - [1024, 10064, 1, 1024]
    - [124, 69.629]
  - - [1024, 10064, 1, 4096]
    - [67, 89.978]
  - - [1024, 10080, 1, 1024]
    - [131, 70.302]
  - - [1024, 10080, 1, 4096]
    - [24, 89.896]
  - - [1024, 10200, 1, 1024]
    - [95, 68.517]
  - - [1024, 10200, 1, 4096]
    - [114, 86.603]
  - - [4096, 3840, 1, 1024]
    - [94, 75.736]
  - - [4096, 3968, 1, 1024]
    - [138, 74.549]
  - - [4096, 6528, 1, 1024]
    - [3, 80.996]
  - - [4096, 7104, 1, 1024]
    - [139, 80.614]
  - - [4096, 7200, 1, 1024]
    - [89, 80.642]
  - - [4096, 8064, 1, 1024]
    - [65, 82.956]
  - - [4096, 8160, 1, 1024]
    - [17, 81.27]
  - - [4096, 9216, 1, 1024]
    - [2, 82.512]
  - - [4096, 9520, 1, 1024]
    - [140, 83.498]
  - - [4096, 10064, 1, 1024]
    - [124, 84.77]
  - - [4096, 10080, 1, 1024]
    - [17, 84.311]
  - - [4096, 10200, 1, 1024]
    - [114, 82.596]
  - - [42720, 3968, 1, 1024]
    - [141, 89.702]
  - - [42720, 6528, 1, 1024]
    - [70, 90.82]
  - - [42720, 7104, 1, 1024]
    - [85, 90.223]
  - - [42720, 7200, 1, 1024]
    - [123, 91.117]
  - - [42720, 9520, 1, 1024]
    - [123, 90.661]
  - - [42720, 10080, 1, 1024]
    - [70, 91.076]
  - - [27, 27, 1920, 64]
    - [142, 3.805]
  - - [27, 33, 1920, 64]
    - [18, 4.312]
  - - [33, 33, 1920, 64]
    - [125, 3.555]
  - - [1024, 3240, 1, 1024]
    - [143, 50.28]
  - - [1024, 3240, 1, 4096]
    - [141, 68.492]
  - - [1024, 3960, 1, 1024]
    - [52, 55.792]
  - - [1024, 3960, 1, 4096]
    - [29, 75.557]
  - - [4096, 3240, 1, 1024]
    - [65, 74.645]
  - - [4096, 3960, 1, 1024]
    - [104, 73.351]
  - - [42720, 3960, 1, 1024]
    - [70, 89.684]
  - - [1024, 10, 1, 1024]
    - [71, 0.49]
  - - [1024, 32768, 1, 479]
    - [17, 66.73]
  - - [1024, 4992, 1, 4096]
    - [144, 78.009]
  - - [1024, 5, 1, 1024]
    - [71, 0.333]
  - - [2, 5, 1, 1024]
    - [145, 0.0]
  - - [8192, 7680, 1, 8192]
    - [141, 95.854]
  - - [2, 40, 1, 1024]
    - [146, 0.005]
  - - [128, 128, 128, 64]
    - [73, 7.128]
  - - [64, 128, 1, 128]
    - [147, 0.055]
  - - [1024, 2560, 1, 4096]
    - [87, 68.517]
  - - [30522, 462, 1, 1024]
    - [148, 69.225]
  - - [1024, 820, 1, 1024]
    - [149, 28.566]
  - - [4096, 5248, 1, 1024]
    - [98, 79.362]
  - - [4096, 3840, 1, 4096]
    - [65, 91.806]
  - - [1024, 39, 1, 1024]
    - [60, 2.381]
  - - [128, 128, 160, 64]
    - [114, 7.912]
  - - [4096, 1280, 1, 1024]
    - [51, 57.365]
  - - [1024, 2560, 1, 1024]
    - [150, 51.687]
  - - [1024, 800, 1, 1024]
    - [151, 30.194]
  - - [1024, 8, 1, 1024]
    - [152, 0.429]
  - - [30522, 160, 1, 1024]
    - [73, 44.553]
  - - [2, 1024, 1, 1024]
    - [153, 0.129]
  - - [30522, 308, 1, 1024]
    - [80, 60.355]
  - - [17, 17, 6144, 64]
    - [33, 3.207]
  - - [4096, 2560, 1, 1024]
    - [100, 72.175]
  - - [4096, 8192, 1, 1024]
    - [123, 82.292]
  - - [33, 33, 1, 32]
    - [20, 0.002]
  - - [1024, 5120, 1, 1024]
    - [154, 59.255]
  - - [1024, 9, 1, 1024]
    - [145, 0.432]
  - - [1024, 780, 1, 1024]
    - [155, 30.468]
  - - [512, 512, 80, 64]
    - [154, 22.569]
  - - [4096, 3072, 1, 1024]
    - [2, 75.562]
  - - [480, 512, 1, 512]
    - [44, 6.329]
  - - [1024, 3072, 1, 4096]
    - [156, 69.663]
  - - [4096, 1024, 1, 1024]
    - [157, 61.635]
  - - [1024, 1152, 1, 1024]
    - [16, 36.688]
  - - [128, 128, 656, 64]
    - [130, 16.572]
  - - [1024, 1024, 1, 4096]
    - [7, 51.368]
  - - [30522, 820, 1, 1024]
    - [32, 76.559]
  - - [2, 10, 1, 1024]
    - [60, 0.001]
  - - [1024, 180, 1, 1024]
    - [158, 8.74]
  - - [128, 128, 624, 64]
    - [80, 16.04]
  - - [1024, 160, 1, 1024]
    - [45, 8.634]
  - - [4096, 5120, 1, 1024]
    - [32, 77.315]
  - - [4, 4, 38400, 64]
    - [125, 0.783]
  - - [2048, 1920, 1, 2048]
    - [70, 73.191]
  - - [2, 39, 1, 1024]
    - [60, 0.004]
  - - [1024, 462, 1, 1024]
    - [45, 20.407]
  - - [2, 9, 1, 1024]
    - [145, 0.001]
  - - [30522, 180, 1, 1024]
    - [159, 48.766]
  - - [33712, 8192, 1, 1024]
    - [65, 91.728]
  - - [1024, 77, 1, 1024]
    - [45, 3.816]
  - - [5, 5, 1, 64]
    - [160, 0.0]
  - - [1024, 40, 1, 1024]
    - [161, 2.452]
  - - [2, 8, 1, 1024]
    - [60, 0.001]
  - - [512, 512, 96, 64]
    - [141, 20.875]
  - - [1024, 1152, 1, 4096]
    - [24, 52.908]
  - - [30522, 385, 1, 1024]
    - [32, 63.604]
  - - [1024, 200, 1, 1024]
    - [45, 10.289]
  - - [1024, 5120, 1, 4096]
    - [141, 77.512]
  - - [30522, 616, 1, 1024]
    - [73, 72.574]
  - - [1024, 41, 1, 1024]
    - [162, 2.463]
  - - [128, 128, 1, 64]
    - [58, 0.08]
  - - [1024, 5248, 1, 4096]
    - [98, 80.167]
  - - [4, 4, 32768, 64]
    - [58, 0.705]
  - - [128, 128, 640, 64]
    - [80, 15.421]
  - - [7680, 8192, 1, 8192]
    - [141, 95.909]
  - - [1024, 1280, 1, 4096]
    - [67, 58.968]
  - - [1024, 5248, 1, 1024]
    - [51, 61.638]
  - - [512, 512, 128, 64]
    - [81, 22.847]
  - - [512, 512, 16, 64]
    - [80, 10.379]
  - - [1024, 9600, 1, 1024]
    - [65, 77.089]
  - - [2, 6, 1, 1024]
    - [60, 0.001]
  - - [1024, 385, 1, 1024]
    - [75, 20.662]
  - - [1024, 4992, 1, 1024]
    - [51, 64.655]
  - - [33712, 9600, 1, 1024]
    - [70, 91.965]
  - - [1024, 512, 1, 4096]
    - [101, 36.92]
  - - [1024, 9600, 1, 4096]
    - [99, 89.55]
  - - [1024, 6, 1, 1024]
    - [60, 0.319]
  - - [1024, 308, 1, 1024]
    - [75, 14.017]
  - - [3840, 4096, 1, 4096]
    - [70, 91.669]
  - - [2, 41, 1, 1024]
    - [60, 0.005]
  - - [4096, 1152, 1, 1024]
    - [87, 65.13]
  - - [4096, 9600, 1, 1024]
    - [65, 84.704]
  - - [30522, 200, 1, 1024]
    - [80, 47.416]
  - - [4096, 4992, 1, 1024]
    - [163, 78.961]
  - - [1024, 8192, 1, 1024]
    - [96, 65.872]
  - - [30522, 780, 1, 1024]
    - [32, 73.57]
  - - [4096, 512, 1, 1024]
    - [102, 43.485]
  - - [1024, 1280, 1, 1024]
    - [75, 39.667]
  - - [1920, 2048, 1, 2048]
    - [164, 73.229]
  - - [1024, 3072, 1, 1024]
    - [97, 53.747]
  - - [1024, 8192, 1, 4096]
    - [114, 84.516]
  - - [128, 128, 144, 64]
    - [116, 7.494]
  - - [30522, 800, 1, 1024]
    - [91, 74.94]
  - - [30522, 77, 1, 1024]
    - [22, 38.159]
  - - [1024, 1024, 128, 96]
    - [165, 45.423]
  - - [30592, 4096, 1, 1024]
    - [70, 88.539]
  - - [64, 1024, 256, 1024]
    - [166, 63.097]
  - - [1536, 8192, 1, 1536]
    - [88, 79.869]
  - - [2048, 2, 1, 2048]
    - [62, 0.411]
  - - [3072, 8192, 1, 1024]
    - [85, 78.599]
  - - [3072, 2048, 1, 1024]
    - [150, 59.703]
  - - [50304, 8192, 1, 1024]
    - [65, 90.095]
  - - [64, 512, 40, 512]
    - [63, 22.29]
  - - [2048, 1024, 1, 8192]
    - [75, 68.715]
  - - [96, 1024, 64, 1024]
    - [167, 54.99]
  - - [1024, 16, 1, 1024]
    - [60, 0.789]
  - - [50304, 2048, 1, 1024]
    - [141, 87.504]
  - - [1536, 8192, 1, 6144]
    - [8, 91.741]
  - - [50304, 4096, 1, 1536]
    - [65, 91.909]
  - - [8192, 1024, 1, 2048]
    - [166, 76.584]
  - - [2, 4, 1, 2560]
    - [168, 0.001]
  - - [2560, 2048, 1, 640]
    - [96, 55.397]
  - - [1024, 1024, 128, 64]
    - [5, 30.861]
  - - [2048, 1024, 1, 2048]
    - [169, 58.793]
  - - [1536, 4096, 1, 1536]
    - [118, 70.203]
  - - [1024, 1024, 64, 64]
    - [85, 26.41]
  - - [30592, 8192, 1, 1024]
    - [65, 89.669]
  - - [50304, 16384, 1, 1024]
    - [123, 91.317]
  - - [4608, 4096, 1, 1536]
    - [82, 83.188]
  - - [2560, 2048, 1, 2560]
    - [63, 76.741]
  - - [7680, 2048, 1, 2560]
    - [65, 88.721]
  - - [2, 16, 1, 1024]
    - [60, 0.002]
  - - [50304, 4096, 1, 1024]
    - [65, 89.092]
  - - [64, 1024, 128, 1024]
    - [76, 54.82]
  - - [1920, 2048, 1, 2560]
    - [170, 76.693]
  - - [1024, 1024, 64, 96]
    - [98, 38.276]
  - - [64, 1024, 32, 1024]
    - [9, 40.892]
  - - [6144, 4096, 1, 1536]
    - [135, 85.129]
  - - [64, 512, 128, 512]
    - [63, 41.932]
  - - [1536, 4096, 1, 6144]
    - [51, 84.348]
  - - [512, 512, 256, 64]
    - [165, 26.95]
  - - [96, 1024, 128, 1024]
    - [167, 65.53]
  - - [50304, 8192, 1, 1536]
    - [65, 92.474]
  - - [6144, 8192, 1, 1536]
    - [73, 87.954]
  - - [4096, 16384, 1, 1024]
    - [124, 85.89]
  - - [30592, 1024, 1, 2048]
    - [141, 89.462]
  - - [2, 2, 1, 2048]
    - [171, 0.0]
  - - [1024, 16384, 1, 4096]
    - [137, 88.035]
  - - [64, 512, 256, 512]
    - [172, 39.671]
  - - [512, 512, 40, 64]
    - [73, 18.929]
  - - [6144, 1024, 1, 2048]
    - [38, 70.605]
  - - [4608, 8192, 1, 1536]
    - [132, 87.149]
  - - [30592, 2048, 1, 1024]
    - [173, 86.156]
  - - [3072, 16384, 1, 1024]
    - [174, 84.844]
  - - [1024, 1024, 256, 64]
    - [140, 33.098]
  - - [64, 1024, 64, 1024]
    - [136, 51.387]
  - - [1024, 16384, 1, 1024]
    - [65, 74.957]
  - - [1024, 1024, 32, 64]
    - [165, 18.853]
  - - [3072, 4096, 1, 1024]
    - [138, 71.659]
  - - [2560, 4, 1, 2560]
    - [60, 1.059]
  - - [960, 1024, 1, 1024]
    - [100, 35.7]
  - - [1024, 1, 1, 1024]
    - [161, 0.065]
  - - [32768, 1, 1, 256]
    - [125, 0.473]
  - - [512, 1, 1, 2048]
    - [175, 0.065]
  - - [1600, 1, 1, 1024]
    - [60, 0.113]
  - - [200, 1, 1, 1024]
    - [62, 0.011]
  - - [960, 1, 1, 2048]
    - [176, 0.103]
  - - [1024, 64, 1, 1024]
    - [177, 3.919]
  - - [30528, 8192, 1, 1024]
    - [65, 90.354]
  - - [128, 128, 1024, 64]
    - [64, 20.15]
  - - [64, 128, 1024, 128]
    - [178, 24.025]
  - - [1024, 3456, 1, 1024]
    - [104, 59.576]
  - - [1024, 3456, 1, 480]
    - [80, 43.763]
  - - [1024, 4096, 1, 480]
    - [179, 47.976]
  - - [1024, 6912, 1, 1024]
    - [132, 63.905]
  - - [1024, 6912, 1, 480]
    - [165, 54.641]
  - - [1024, 864, 1, 1024]
    - [41, 31.736]
  - - [1024, 864, 1, 480]
    - [13, 18.184]
  - - [128, 3456, 1, 256]
    - [180, 5.706]
  - - [128, 4096, 1, 256]
    - [36, 7.405]
  - - [128, 55296, 1, 256]
    - [181, 40.025]
  - - [128, 6912, 1, 256]
    - [34, 11.136]
  - - [128, 864, 1, 256]
    - [182, 1.874]
  - - [256, 3456, 1, 512]
    - [183, 19.429]
  - - [256, 4096, 1, 512]
    - [51, 21.659]
  - - [256, 55296, 1, 512]
    - [89, 64.132]
  - - [256, 6912, 1, 512]
    - [114, 27.832]
  - - [256, 864, 1, 512]
    - [33, 6.098]
  - - [3456, 1, 1, 256]
    - [153, 0.065]
  - - [4096, 1, 1, 256]
    - [184, 0.082]
  - - [512, 3456, 1, 1024]
    - [8, 49.37]
  - - [512, 3456, 1, 13]
    - [112, 1.35]
  - - [512, 4096, 1, 1024]
    - [76, 46.669]
  - - [512, 4096, 1, 13]
    - [185, 1.491]
  - - [512, 55296, 1, 13]
    - [119, 4.276]
  - - [512, 6912, 1, 1024]
    - [79, 55.167]
  - - [512, 6912, 1, 13]
    - [111, 1.995]
  - - [512, 864, 1, 1024]
    - [86, 20.957]
  - - [512, 864, 1, 13]
    - [102, 0.331]
  - - [6912, 1, 1, 256]
    - [54, 0.115]
  - - [864, 1, 1, 256]
    - [66, 0.014]
  - - [30528, 640, 1, 1024]
    - [8, 76.674]
  - - [30528, 1280, 1, 1024]
    - [70, 83.021]
  - - [30528, 1600, 1, 1024]
    - [3, 85.569]
  - - [1024, 10240, 1, 1024]
    - [104, 69.754]
  - - [1024, 80, 1, 1024]
    - [158, 5.055]
  - - [4096, 10240, 1, 1024]
    - [5, 83.018]
  - - [1024, 10240, 1, 4096]
    - [87, 85.66]
  - - [64, 128, 1280, 128]
    - [186, 23.271]
  - - [128, 128, 1280, 64]
    - [141, 20.237]
  - - [1024, 10496, 1, 4096]
    - [93, 87.252]
  - - [30528, 1640, 1, 1024]
    - [70, 84.783]
  - - [1024, 82, 1, 1024]
    - [158, 3.875]
  - - [4096, 10496, 1, 1024]
    - [70, 84.041]
  - - [1024, 10496, 1, 1024]
    - [187, 70.404]
  - - [64, 128, 1312, 128]
    - [14, 24.81]
  - - [128, 128, 1312, 64]
    - [80, 19.317]
  - - [30528, 160, 1, 1024]
    - [137, 60.856]
  - - [1024, 12, 1, 1024]
    - [60, 0.772]
  - - [30528, 240, 1, 1024]
    - [188, 68.14]
  - - [1024, 6144, 1, 1024]
    - [189, 59.563]
  - - [4096, 6144, 1, 1024]
    - [83, 78.776]
  - - [1024, 6144, 1, 4096]
    - [78, 79.405]
  - - [64, 512, 192, 512]
    - [166, 45.895]
  - - [512, 512, 192, 64]
    - [88, 23.879]
  - - [2, 64, 1, 1024]
    - [60, 0.007]
  - - [2, 80, 1, 1024]
    - [72, 0.008]
  - - [2, 82, 1, 1024]
    - [59, 0.011]
  - - [2, 12, 1, 1024]
    - [59, 0.001]
  - - [2, 1, 1, 1024]
    - [146, 0.0]
  - - [1, 4096, 1, 256]
    - [59, 0.061]
  - - [1, 6912, 1, 256]
    - [162, 0.094]
  - - [1024, 10224, 1, 1024]
    - [84, 72.781]
  - - [1024, 10192, 1, 1024]
    - [78, 73.294]
  - - [1024, 10208, 1, 1024]
    - [172, 70.208]
  - - [1024, 10224, 1, 4096]
    - [113, 86.204]
  - - [4096, 10224, 1, 1024]
    - [190, 82.557]
  - - [3072, 10224, 1, 1024]
    - [65, 83.219]
  - - [3072, 10240, 1, 1024]
    - [3, 83.961]
  - - [1024, 10192, 1, 4096]
    - [114, 86.177]
  - - [4096, 10192, 1, 1024]
    - [114, 82.504]
  - - [3072, 10192, 1, 1024]
    - [3, 83.306]
  - - [3072, 10200, 1, 1024]
    - [135, 82.513]
  - - [1024, 10184, 1, 1024]
    - [84, 70.012]
  - - [3072, 10208, 1, 1024]
    - [123, 81.004]
  - - [1024, 10208, 1, 4096]
    - [114, 86.941]
  - - [4096, 10208, 1, 1024]
    - [104, 83.031]
  - - [2048, 10224, 1, 1024]
    - [104, 77.334]
  - - [2048, 10240, 1, 1024]
    - [25, 76.766]
  - - [1024, 10120, 1, 1024]
    - [116, 68.672]
  - - [2048, 10192, 1, 1024]
    - [83, 77.114]
  - - [24, 24, 6816, 64]
    - [33, 6.08]
  - - [1024, 10152, 1, 1024]
    - [89, 69.594]
  - - [3072, 10080, 1, 1024]
    - [67, 83.995]
  - - [1024, 2048, 1, 49]
    - [130, 4.648]
  - - [1024, 256, 1, 196]
    - [33, 3.395]
  - - [1024, 512, 1, 196]
    - [19, 5.979]
  - - [1152, 128, 1, 784]
    - [191, 5.534]
  - - [128, 512, 1, 784]
    - [53, 2.905]
  - - [2048, 512, 1, 49]
    - [192, 2.916]
  - - [2304, 256, 1, 196]
    - [193, 5.57]
  - - [256, 1024, 1, 196]
    - [33, 3.218]
  - - [256, 128, 1, 3136]
    - [175, 5.023]
  - - [256, 512, 1, 784]
    - [194, 5.319]
  - - [256, 64, 1, 3136]
    - [195, 2.685]
  - - [4608, 512, 1, 49]
    - [111, 5.376]
  - - [512, 1024, 1, 196]
    - [41, 5.831]
  - - [512, 128, 1, 784]
    - [196, 2.834]
  - - [512, 2048, 1, 49]
    - [23, 2.708]
  - - [512, 256, 1, 784]
    - [197, 5.872]
  - - [576, 64, 1, 3136]
    - [198, 5.142]
  - - [64, 256, 1, 3136]
    - [199, 2.796]
  - - [64, 64, 1, 3136]
    - [168, 0.692]
  - - [128, 128, 49, 12800]
    - [200, 66.421]
  - - [128, 128, 25, 25088]
    - [201, 60.46]
  - - [128, 128, 49, 25600]
    - [170, 72.82]
  - - [128, 128, 25, 50176]
    - [75, 66.196]
  - - [256, 256, 25, 12544]
    - [104, 75.06]
  - - [256, 256, 49, 3200]
    - [102, 67.814]
  - - [256, 256, 25, 6272]
    - [95, 65.642]
  - - [256, 256, 49, 6400]
    - [61, 73.997]
  - - [512, 512, 49, 1152]
    - [88, 72.451]
  - - [512, 512, 25, 2048]
    - [136, 74.623]
  - - [512, 512, 49, 2304]
    - [97, 82.71]
  - - [512, 512, 25, 4096]
    - [84, 81.234]
  - - [64, 128, 2048, 128]
    - [202, 27.248]
  - - [128, 128, 2048, 64]
    - [203, 20.06]
  - - [30528, 2560, 1, 1024]
    - [65, 87.102]
  - - [1024, 128, 1, 1024]
    - [204, 7.307]
  - - [64, 128, 1536, 128]
    - [14, 24.969]
  - - [128, 128, 1536, 64]
    - [80, 19.337]
  - - [1024, 12288, 1, 1024]
    - [39, 69.665]
  - - [1024, 12288, 1, 4096]
    - [87, 88.399]
  - - [30528, 1920, 1, 1024]
    - [31, 85.769]
  - - [1024, 96, 1, 1024]
    - [205, 5.379]
  - - [4096, 12288, 1, 1024]
    - [92, 84.968]
  - - [128, 128, 36, 12544]
    - [206, 54.677]
  - - [128, 128, 49, 9216]
    - [104, 62.223]
  - - [128, 128, 64, 6400]
    - [178, 51.858]
  - - [128, 128, 81, 12544]
    - [201, 64.889]
  - - [128, 128, 121, 9216]
    - [9, 64.937]
  - - [128, 128, 169, 6400]
    - [77, 71.744]
  - - [256, 256, 36, 4096]
    - [122, 59.474]
  - - [256, 256, 49, 2304]
    - [76, 61.339]
  - - [256, 256, 64, 2304]
    - [61, 71.497]
  - - [256, 256, 81, 4096]
    - [164, 78.59]
  - - [256, 256, 121, 2304]
    - [207, 75.823]
  - - [256, 256, 169, 2304]
    - [113, 81.602]
  - - [512, 512, 81, 1024]
    - [208, 79.276]
  - - [512, 512, 121, 1024]
    - [190, 81.043]
  - - [512, 512, 169, 1024]
    - [92, 83.481]
  - - [512, 512, 36, 1024]
    - [140, 72.226]
  - - [512, 512, 49, 1024]
    - [32, 73.36]
  - - [512, 512, 64, 1024]
    - [92, 74.25]
  - - [64, 64, 36, 50176]
    - [209, 35.222]
  - - [64, 64, 49, 36864]
    - [210, 39.471]
  - - [64, 64, 64, 25600]
    - [9, 40.242]
  - - [128, 128, 192, 64]
    - [211, 8.955]
  - - [64, 128, 192, 128]
    - [100, 10.429]
  - - [768, 2048, 1, 768]
    - [41, 34.179]
  - - [3072, 2048, 1, 768]
    - [212, 61.16]
  - - [768, 2048, 1, 3072]
    - [79, 58.353]
  - - [768, 16, 1, 768]
    - [53, 0.453]
  - - [384, 384, 144, 64]
    - [5, 22.144]
  - - [64, 384, 144, 384]
    - [63, 31.059]
  - - [768, 4608, 1, 768]
    - [113, 54.608]
  - - [3072, 4608, 1, 768]
    - [1, 71.204]
  - - [768, 4608, 1, 3072]
    - [136, 69.519]
  - - [768, 12, 1, 768]
    - [182, 0.452]
  - - [512, 512, 48, 64]
    - [213, 19.158]
  - - [64, 512, 48, 512]
    - [78, 27.091]
  - - [768, 4, 1, 768]
    - [60, 0.149]
  - - [128, 128, 256, 64]
    - [21, 10.416]
  - - [64, 128, 256, 128]
    - [34, 12.087]
  - - [384, 384, 192, 64]
    - [1, 24.337]
  - - [64, 384, 192, 384]
    - [151, 33.688]
  - - [1024, 4608, 1, 1024]
    - [78, 66.94]
  - - [4096, 4608, 1, 1024]
    - [124, 77.536]
  - - [1024, 4608, 1, 4096]
    - [87, 82.694]
  - - [2880, 3072, 1, 3072]
    - [143, 87.055]
  - - [3072, 3072, 1, 3072]
    - [87, 84.551]
  - - [3072, 512, 1, 3072]
    - [78, 58.735]
  - - [4096, 512, 1, 4096]
    - [214, 65.369]
  - - [512, 1024, 1, 1024]
    - [63, 21.741]
  - - [512, 2048, 1, 2048]
    - [51, 40.747]
  - - [512, 3072, 1, 3072]
    - [8, 61.196]
  - - [512, 4096, 1, 4096]
    - [10, 63.254]
  - - [512, 8192, 1, 8192]
    - [133, 86.295]
  - - [64, 1024, 1, 1024]
    - [204, 4.036]
  - - [8192, 512, 1, 8192]
    - [29, 84.803]
  - - [26, 26, 6272, 64]
    - [33, 6.39]
  - - [147, 64, 1, 12544]
    - [195, 5.2]
  - - [2, 128, 1, 1024]
    - [215, 0.016]
  - - [2, 96, 1, 1024]
    - [60, 0.009]
  - - [2, 2048, 1, 768]
    - [60, 0.157]
  - - [2, 4608, 1, 768]
    - [162, 0.343]
  - - [2, 4608, 1, 1024]
    - [146, 0.563]
  - - [1024, 1024, 160, 96]
    - [154, 45.421]
  - - [96, 1024, 160, 1024]
    - [216, 70.829]
  - - [2880, 16384, 1, 1920]
    - [83, 90.39]
  - - [1920, 16384, 1, 960]
    - [140, 82.941]
  - - [3840, 16384, 1, 1920]
    - [154, 91.531]
  - - [1920, 16384, 1, 3840]
    - [154, 93.038]
  - - [25216, 16384, 1, 1920]
    - [65, 93.788]
  - - [1024, 1024, 40, 96]
    - [114, 33.591]
  - - [96, 1024, 40, 1024]
    - [216, 56.26]
  - - [2880, 4096, 1, 1920]
    - [4, 85.385]
  - - [1920, 4096, 1, 960]
    - [136, 67.901]
  - - [3840, 4096, 1, 1920]
    - [94, 85.937]
  - - [1920, 4096, 1, 3840]
    - [143, 86.791]
  - - [25216, 4096, 1, 1920]
    - [5, 91.826]
  - - [1024, 1024, 80, 96]
    - [165, 40.925]
  - - [96, 1024, 80, 1024]
    - [217, 58.521]
  - - [2880, 8192, 1, 1920]
    - [207, 87.883]
  - - [1920, 8192, 1, 960]
    - [117, 73.78]
  - - [3840, 8192, 1, 1920]
    - [92, 89.113]
  - - [1920, 8192, 1, 3840]
    - [190, 91.353]
  - - [25216, 8192, 1, 1920]
    - [141, 92.449]
  - - [1024, 1024, 96, 96]
    - [218, 42.527]
  - - [96, 1024, 96, 1024]
    - [219, 62.799]
  - - [1728, 16384, 1, 2304]
    - [105, 89.604]
  - - [2304, 16384, 1, 576]
    - [70, 77.105]
  - - [2304, 16384, 1, 2304]
    - [220, 89.694]
  - - [12672, 16384, 1, 2304]
    - [70, 93.856]
  - - [1024, 1024, 24, 96]
    - [135, 30.602]
  - - [96, 1024, 24, 1024]
    - [216, 40.548]
  - - [1728, 4096, 1, 2304]
    - [35, 78.07]
  - - [2304, 4096, 1, 576]
    - [143, 66.921]
  - - [2304, 4096, 1, 2304]
    - [34, 81.113]
  - - [12672, 4096, 1, 2304]
    - [85, 91.468]
  - - [1024, 1024, 48, 96]
    - [221, 36.935]
  - - [96, 1024, 48, 1024]
    - [52, 45.23]
  - - [1728, 8192, 1, 2304]
    - [213, 85.472]
  - - [2304, 8192, 1, 576]
    - [105, 68.624]
  - - [2304, 8192, 1, 2304]
    - [222, 86.889]
  - - [12672, 8192, 1, 2304]
    - [65, 93.168]
  - - [1024, 1024, 16, 96]
    - [98, 29.929]
  - - [96, 1024, 16, 1024]
    - [157, 35.864]
  - - [1152, 4096, 1, 3072]
    - [84, 80.139]
  - - [3072, 4096, 1, 384]
    - [223, 56.47]
  - - [1536, 4096, 1, 3072]
    - [51, 78.987]
  - - [3072, 4096, 1, 1536]
    - [172, 77.597]
  - - [6400, 4096, 1, 3072]
    - [222, 90.628]
  - - [1024, 1024, 32, 96]
    - [192, 28.557]
  - - [96, 1024, 32, 1024]
    - [217, 53.167]
  - - [1152, 8192, 1, 3072]
    - [187, 84.513]
  - - [3072, 8192, 1, 384]
    - [64, 62.17]
  - - [1536, 8192, 1, 3072]
    - [87, 86.468]
  - - [3072, 8192, 1, 1536]
    - [190, 85.983]
  - - [6400, 8192, 1, 3072]
    - [98, 92.424]
  - - [40, 40, 1, 1909283]
    - [224, 8.128]
  - - [40, 40, 1, 3818566]
    - [224, 9.879]
  - - [2048, 4096, 1, 2048]
    - [225, 75.88]
  - - [2048, 4096, 1, 4096]
    - [143, 84.609]
  - - [2048, 8, 1, 2048]
    - [147, 1.678]
  - - [29000, 199, 1, 2048]
    - [226, 58.055]
  - - [29000, 221, 1, 2048]
    - [99, 67.163]
  - - [29000, 224, 1, 2048]
    - [227, 64.82]
  - - [29000, 229, 1, 2048]
    - [190, 69.461]
  - - [29000, 234, 1, 2048]
    - [154, 68.592]
  - - [29000, 242, 1, 2048]
    - [87, 73.921]
  - - [29000, 246, 1, 2048]
    - [187, 74.063]
  - - [29000, 247, 1, 2048]
    - [172, 76.121]
  - - [29000, 256, 1, 2048]
    - [65, 75.024]
  - - [29000, 262, 1, 2048]
    - [67, 68.267]
  - - [29000, 264, 1, 2048]
    - [82, 72.406]
  - - [29000, 265, 1, 2048]
    - [96, 69.317]
  - - [29000, 274, 1, 2048]
    - [124, 71.969]
  - - [29000, 277, 1, 2048]
    - [52, 73.771]
  - - [29000, 279, 1, 2048]
    - [157, 75.213]
  - - [29000, 288, 1, 2048]
    - [228, 78.823]
  - - [29000, 296, 1, 2048]
    - [229, 73.984]
  - - [29000, 315, 1, 2048]
    - [114, 77.404]
  - - [29000, 335, 1, 2048]
    - [135, 71.251]
  - - [4096, 4096, 1, 2048]
    - [230, 82.215]
  - - [29000, 2283, 1, 1024]
    - [106, 87.374]
  - - [29000, 2296, 1, 1024]
    - [25, 87.737]
  - - [29000, 2306, 1, 1024]
    - [114, 84.968]
  - - [29000, 2309, 1, 1024]
    - [119, 85.084]
  - - [29000, 2318, 1, 1024]
    - [85, 85.549]
  - - [29000, 2320, 1, 1024]
    - [114, 85.727]
  - - [29000, 2324, 1, 1024]
    - [85, 85.777]
  - - [29000, 2325, 1, 1024]
    - [85, 86.08]
  - - [29000, 2329, 1, 1024]
    - [139, 85.95]
  - - [29000, 2338, 1, 1024]
    - [114, 86.506]
  - - [29000, 2345, 1, 1024]
    - [106, 86.843]
  - - [29000, 2350, 1, 1024]
    - [231, 86.813]
  - - [29000, 2362, 1, 1024]
    - [139, 87.399]
  - - [29000, 2366, 1, 1024]
    - [104, 87.466]
  - - [29000, 2368, 1, 1024]
    - [231, 87.49]
  - - [29000, 2374, 1, 1024]
    - [106, 87.841]
  - - [29000, 2390, 1, 1024]
    - [122, 88.03]
  - - [512, 512, 320, 64]
    - [208, 27.813]
  - - [64, 512, 320, 512]
    - [63, 51.186]
  - - [1024, 20, 1, 1024]
    - [60, 1.334]
  - - [29000, 561, 1, 1024]
    - [25, 73.959]
  - - [29000, 574, 1, 1024]
    - [73, 74.028]
  - - [29000, 600, 1, 1024]
    - [85, 71.067]
  - - [29000, 608, 1, 1024]
    - [83, 76.363]
  - - [29000, 615, 1, 1024]
    - [166, 74.888]
  - - [29000, 622, 1, 1024]
    - [114, 77.775]
  - - [29000, 625, 1, 1024]
    - [187, 74.399]
  - - [29000, 626, 1, 1024]
    - [143, 76.015]
  - - [29000, 628, 1, 1024]
    - [81, 73.486]
  - - [29000, 636, 1, 1024]
    - [70, 75.865]
  - - [29000, 651, 1, 1024]
    - [119, 75.305]
  - - [29000, 658, 1, 1024]
    - [25, 74.972]
  - - [29000, 669, 1, 1024]
    - [106, 75.848]
  - - [29000, 670, 1, 1024]
    - [106, 77.916]
  - - [29000, 672, 1, 1024]
    - [85, 77.763]
  - - [29000, 684, 1, 1024]
    - [85, 77.743]
  - - [29000, 716, 1, 1024]
    - [166, 75.758]
  - - [29000, 730, 1, 1024]
    - [96, 75.235]
  - - [64, 512, 80, 512]
    - [202, 32.857]
  - - [2560, 1024, 1, 2560]
    - [232, 63.33]
  - - [2560, 1024, 1, 4096]
    - [124, 68.683]
  - - [2560, 2, 1, 2560]
    - [60, 0.567]
  - - [29000, 109, 1, 2560]
    - [113, 58.731]
  - - [29000, 121, 1, 2560]
    - [225, 67.103]
  - - [29000, 27, 1, 2560]
    - [45, 27.719]
  - - [29000, 35, 1, 2560]
    - [79, 35.522]
  - - [29000, 36, 1, 2560]
    - [113, 36.654]
  - - [29000, 39, 1, 2560]
    - [233, 39.142]
  - - [29000, 40, 1, 2560]
    - [113, 41.622]
  - - [29000, 42, 1, 2560]
    - [8, 41.009]
  - - [29000, 43, 1, 2560]
    - [86, 39.351]
  - - [29000, 44, 1, 2560]
    - [201, 44.611]
  - - [29000, 46, 1, 2560]
    - [35, 43.293]
  - - [29000, 48, 1, 2560]
    - [113, 47.922]
  - - [29000, 49, 1, 2560]
    - [86, 47.915]
  - - [29000, 50, 1, 2560]
    - [201, 48.816]
  - - [29000, 51, 1, 2560]
    - [121, 50.914]
  - - [29000, 53, 1, 2560]
    - [77, 53.164]
  - - [29000, 54, 1, 2560]
    - [118, 52.241]
  - - [29000, 55, 1, 2560]
    - [84, 52.207]
  - - [29000, 56, 1, 2560]
    - [104, 55.199]
  - - [29000, 57, 1, 2560]
    - [77, 57.274]
  - - [29000, 58, 1, 2560]
    - [234, 55.766]
  - - [29000, 59, 1, 2560]
    - [121, 55.345]
  - - [29000, 61, 1, 2560]
    - [104, 58.326]
  - - [29000, 63, 1, 2560]
    - [231, 58.485]
  - - [29000, 65, 1, 2560]
    - [52, 45.573]
  - - [29000, 66, 1, 2560]
    - [16, 46.746]
  - - [29000, 67, 1, 2560]
    - [106, 42.566]
  - - [29000, 69, 1, 2560]
    - [134, 47.976]
  - - [29000, 70, 1, 2560]
    - [220, 49.193]
  - - [29000, 71, 1, 2560]
    - [22, 47.727]
  - - [29000, 73, 1, 2560]
    - [165, 48.324]
  - - [29000, 74, 1, 2560]
    - [22, 50.592]
  - - [29000, 75, 1, 2560]
    - [220, 53.324]
  - - [29000, 77, 1, 2560]
    - [120, 54.269]
  - - [29000, 78, 1, 2560]
    - [106, 52.793]
  - - [29000, 80, 1, 2560]
    - [165, 55.712]
  - - [29000, 81, 1, 2560]
    - [120, 56.89]
  - - [29000, 82, 1, 2560]
    - [106, 57.678]
  - - [29000, 83, 1, 2560]
    - [235, 56.335]
  - - [29000, 84, 1, 2560]
    - [222, 56.178]
  - - [29000, 88, 1, 2560]
    - [24, 58.211]
  - - [29000, 89, 1, 2560]
    - [220, 61.659]
  - - [29000, 90, 1, 2560]
    - [174, 58.87]
  - - [29000, 92, 1, 2560]
    - [131, 59.342]
  - - [29000, 95, 1, 2560]
    - [220, 66.672]
  - - [29000, 98, 1, 2560]
    - [79, 55.624]
  - - [4096, 1024, 1, 2560]
    - [236, 69.683]
  - - [1024, 1024, 512, 64]
    - [98, 34.92]
  - - [64, 1024, 512, 1024]
    - [223, 67.906]
  - - [1024, 32768, 1, 4096]
    - [67, 92.566]
  - - [3072, 32768, 1, 1024]
    - [5, 87.99]
  - - [4096, 32768, 1, 1024]
    - [65, 88.741]
  - - [50304, 32768, 1, 1024]
    - [123, 91.104]
  - - [1024, 1024, 24, 128]
    - [181, 34.599]
  - - [128, 1024, 24, 1024]
    - [104, 50.997]
  - - [11, 11, 1, 1909283]
    - [237, 3.783]
  - - [11, 11, 1, 3818566]
    - [237, 4.232]
  - - [2, 8, 1, 2048]
    - [60, 0.001]
  - - [2, 20, 1, 1024]
    - [238, 0.002]
  - - [2, 2, 1, 2560]
    - [195, 0.001]
- null
