library/src/blas3/Tensile/Logic/asm_full/arcturus_Cijk_Ailk_Bjlk_BBH.yaml
- {MinimumRequiredVersion: 4.14.0}
- arcturus
- gfx908
- [Device 7380, Device 7388, Device 738c, Device 7390]
    SolutionIndex: 0
    SolutionNameMin: Cijk_Ailk_Bjlk_BBH_MT32x256x8_MI32x32x2x2_SE_ONLL0_SNLL0
    SolutionIndex: 1
    SolutionNameMin: Cijk_Ailk_Bjlk_BBH_MT64x128x16_MI32x32x2x2_SE_ONLL1_SNLL1
    SolutionIndex: 2
    SolutionNameMin: Cijk_Ailk_Bjlk_BBH_MT32x256x16_MI32x32x2x2_SE_ONLL1_SNLL0
    SolutionIndex: 3
    SolutionNameMin: Cijk_Ailk_Bjlk_BBH_MT64x256x16_MI32x32x2x2_SE_ONLL0_SNLL0
    SolutionIndex: 4
    SolutionNameMin: Cijk_Ailk_Bjlk_BBH_MT64x128x32_MI32x32x2x2_SE_AF0EM1_ASEM2_ONLL0_SNLL0
    SolutionIndex: 5
    SolutionIndex: 6
    SolutionIndex: 7
    SolutionIndex: 8
    SolutionIndex: 9
    SolutionIndex: 10
    SolutionIndex: 11
    SolutionIndex: 12
    SolutionIndex: 13
    SolutionIndex: 14
    SolutionIndex: 15
    SolutionIndex: 16
    SolutionIndex: 17
    SolutionIndex: 18
    SolutionIndex: 19
    SolutionIndex: 20
    SolutionIndex: 21
    SolutionIndex: 22
    SolutionIndex: 23
    SolutionIndex: 24
    SolutionIndex: 25
    SolutionIndex: 26
    SolutionIndex: 27
    SolutionIndex: 28
    SolutionIndex: 29
    SolutionIndex: 30
    SolutionIndex: 31
    SolutionIndex: 32
    SolutionIndex: 33
    SolutionIndex: 34
    SolutionIndex: 35
    SolutionIndex: 36
    SolutionIndex: 37
    SolutionIndex: 38
    SolutionIndex: 39
    SolutionIndex: 40
    SolutionIndex: 41
    SolutionIndex: 42
    SolutionIndex: 43
    SolutionIndex: 44
    SolutionIndex: 45
    SolutionIndex: 46
    SolutionIndex: 47
    SolutionIndex: 48
    SolutionIndex: 49
    SolutionIndex: 50
    SolutionIndex: 51
    SolutionIndex: 52
    SolutionIndex: 53
    SolutionIndex: 54
    SolutionIndex: 55
    SolutionIndex: 56
    SolutionIndex: 57
    SolutionIndex: 58
    SolutionIndex: 59
    SolutionIndex: 60
    SolutionIndex: 61
    SolutionIndex: 62
    SolutionIndex: 63
    SolutionIndex: 64
    SolutionIndex: 65
    SolutionIndex: 66
    SolutionIndex: 67
    SolutionIndex: 68
    SolutionIndex: 69
    SolutionIndex: 70
    SolutionIndex: 71
    SolutionIndex: 72
    SolutionIndex: 73
    SolutionIndex: 74
    SolutionIndex: 75
    SolutionIndex: 76
    SolutionIndex: 77
    SolutionIndex: 78
    SolutionIndex: 79
    SolutionIndex: 80
    SolutionIndex: 81
    SolutionIndex: 82
    SolutionIndex: 83
    SolutionIndex: 84
    SolutionIndex: 85
    SolutionIndex: 86
    SolutionIndex: 87
    SolutionIndex: 88
    SolutionIndex: 89
    SolutionIndex: 90
    SolutionIndex: 91
    SolutionIndex: 92
    SolutionIndex: 93
    SolutionIndex: 94
    SolutionIndex: 95
    SolutionIndex: 96
    SolutionIndex: 97
    SolutionIndex: 98
    SolutionIndex: 99
    SolutionIndex: 100
    SolutionIndex: 101
    SolutionIndex: 102
    SolutionIndex: 103
    SolutionIndex: 104
    SolutionIndex: 105
    SolutionIndex: 106
    SolutionIndex: 107
    SolutionIndex: 108
    SolutionIndex: 109
    SolutionIndex: 110
    SolutionIndex: 111
    SolutionIndex: 112
    SolutionIndex: 113
    SolutionIndex: 114
    SolutionIndex: 115
    SolutionIndex: 116
    SolutionIndex: 117
    SolutionIndex: 118
    SolutionIndex: 119
    SolutionIndex: 120
    SolutionIndex: 121
    SolutionIndex: 122
    SolutionIndex: 123
    SolutionIndex: 124
    SolutionIndex: 125
    SolutionIndex: 126
    SolutionIndex: 127
    SolutionIndex: 128
    SolutionIndex: 129
    SolutionIndex: 130
    SolutionIndex: 131
    SolutionIndex: 132
    SolutionIndex: 133
    SolutionIndex: 134
    SolutionIndex: 135
    SolutionIndex: 136
    SolutionIndex: 137
    SolutionIndex: 138
    SolutionIndex: 139
    SolutionIndex: 140
    SolutionIndex: 141
    SolutionIndex: 142
    SolutionIndex: 143
    SolutionIndex: 144
    SolutionIndex: 145
    SolutionIndex: 146
    SolutionIndex: 147
    SolutionIndex: 148
    SolutionIndex: 149
    SolutionIndex: 150
    SolutionIndex: 151
    SolutionIndex: 152
    SolutionIndex: 153
    SolutionIndex: 154
    SolutionIndex: 155
    SolutionIndex: 156
    SolutionIndex: 157
    SolutionIndex: 158
    SolutionIndex: 159
    SolutionIndex: 160
    SolutionIndex: 161
    SolutionIndex: 162
    SolutionIndex: 163
    SolutionIndex: 164
    SolutionIndex: 165
    SolutionIndex: 166
    SolutionIndex: 167
    SolutionIndex: 168
    SolutionIndex: 169
    SolutionIndex: 170
    SolutionIndex: 171
    SolutionIndex: 172
    SolutionIndex: 173
    SolutionIndex: 174
    SolutionIndex: 175
    SolutionIndex: 176
    SolutionIndex: 177
    SolutionIndex: 178
    SolutionIndex: 179
    SolutionIndex: 180
    SolutionIndex: 181
    SolutionIndex: 182
    SolutionIndex: 183
    SolutionIndex: 184
    SolutionIndex: 185
    SolutionIndex: 186
    SolutionNameMin: Cijk_Ailk_Bjlk_BBH_MT128x128x32_MI32x32x4x1_SE_AF0EM4_GRVW8_NLCA1_NLCB1_SU16_SUS128_SRVW4_TT2_64_WG64_4_1_WGM2
    SolutionIndex: 187
    SolutionNameMin: Cijk_Ailk_Bjlk_BBH_MT64x128x16_MI32x32x2x2_SE_AF0EM4_GRVW2_NLCA1_NLCB1_SU0_SUS256_SRVW4_TT1_32_WG64_4_1_WGM15
    SolutionIndex: 188
    SolutionNameMin: Cijk_Ailk_Bjlk_BBH_MT128x96x32_MI32x32x4x1_SE_AF0EM4_GRVW4_NLCA1_NLCB3_SU16_SUS128_SRVW4_TT1_96_WG128_2_1_WGM15
    SolutionIndex: 189
    SolutionNameMin: Cijk_Ailk_Bjlk_BBH_MT64x32x16_MI16x16x8x1_SE_AF0EM4_GRVW2_NLCA1_NLCB1_SU0_SUS256_SRVW4_TT2_16_WG32_8_1_WGM15
    SolutionIndex: 190
    SolutionNameMin: Cijk_Ailk_Bjlk_BBH_MT128x80x64_MI16x16x8x1_SE_AF0EM4_GRVW2_NLCA1_NLCB5_SU32_SUS128_SRVW0_TT2_80_WG64_4_1_WGM2
    SolutionIndex: 191
    SolutionNameMin: Cijk_Ailk_Bjlk_BBH_MT128x96x32_MI32x32x4x1_SE_AF0EM4_GRVW4_NLCA1_NLCB3_SU32_SUS128_SRVW4_TT1_96_WG128_2_1_WGM15
    SolutionIndex: 192
    SolutionNameMin: Cijk_Ailk_Bjlk_BBH_MT64x64x128_MI32x32x4x1_SE_AF0EM4_GRVW8_NLCA1_NLCB1_SU16_SUS256_SRVW4_TT1_32_WG64_4_1_WGM2
    SolutionIndex: 193
    SolutionNameMin: Cijk_Ailk_Bjlk_BBH_MT64x64x128_MI32x32x4x1_SE_AF0EM4_GRVW8_NLCA1_NLCB1_SU32_SUS256_SRVW4_TT1_32_WG64_4_1_WGM15
    SolutionIndex: 194
    SolutionNameMin: Cijk_Ailk_Bjlk_BBH_MT32x32x16_MI16x16x8x1_SE_AF0EM4_GRVW4_NLCA1_NLCB1_SU0_SUS256_SRVW0_TT1_16_WG32_8_1_WGM2
    SolutionIndex: 195
    SolutionNameMin: Cijk_Ailk_Bjlk_BBH_MT64x64x32_MI32x32x4x1_SE_AF0EM4_GRVW8_NLCA1_NLCB1_SU0_SUS256_SRVW4_TT1_32_WG64_4_1_WGM1
    SolutionIndex: 196
    SolutionNameMin: Cijk_Ailk_Bjlk_BBH_MT32x32x64_MI16x16x8x1_SE_AF0EM1_GRVW8_NLCA1_NLCB1_SU0_SUS256_SRVW0_TT1_16_WG32_8_1_WGM2
    SolutionIndex: 197
    SolutionNameMin: Cijk_Ailk_Bjlk_BBH_MT128x64x64_MI32x32x4x1_SE_AF0EM4_GRVW4_NLCA1_NLCB1_SU0_SUS256_SRVW4_TT2_32_WG64_4_1_WGM2
    SolutionIndex: 198
    SolutionNameMin: Cijk_Ailk_Bjlk_BBH_MT32x32x16_MI16x16x8x1_SE_AF0EM4_GRVW2_NLCA1_NLCB1_SU0_SUS256_SRVW0_TT1_16_WG32_8_1_WGM1
    SolutionIndex: 199
    SolutionNameMin: Cijk_Ailk_Bjlk_BBH_MT64x32x16_MI16x16x8x1_SE_AF0EM4_GRVW2_NLCA1_NLCB1_SU32_SUS256_SRVW0_TT2_16_WG32_8_1_WGM2
    SolutionIndex: 200
    SolutionNameMin: Cijk_Ailk_Bjlk_BBH_MT128x80x64_MI16x16x8x1_SE_AF0EM4_GRVW2_NLCA1_NLCB5_SU32_SUS256_SRVW0_TT2_80_WG64_4_1_WGM2
    SolutionIndex: 201
    SolutionNameMin: Cijk_Ailk_Bjlk_BBH_MT128x80x64_MI16x16x8x1_SE_AF0EM4_GRVW2_NLCA1_NLCB5_SU0_SUS256_SRVW0_TT2_80_WG64_4_1_WGM15
    SolutionIndex: 202
    SolutionNameMin: Cijk_Ailk_Bjlk_BBH_MT32x32x64_MI16x16x8x1_SE_AF0EM4_GRVW8_NLCA1_NLCB1_SU16_SUS128_SRVW0_TT1_16_WG32_8_1_WGM1
    SolutionIndex: 203
    SolutionNameMin: Cijk_Ailk_Bjlk_BBH_MT128x128x32_MI32x32x4x1_SE_AF0EM4_GRVW4_NLCA1_NLCB1_SU0_SUS256_SRVW4_TT2_64_WG64_4_1_WGM15
    SolutionIndex: 204
    SolutionNameMin: Cijk_Ailk_Bjlk_BBH_MT64x64x32_MI32x32x4x1_SE_AF0EM1_GRVW8_NLCA1_NLCB1_SU16_SUS256_SRVW4_TT1_32_WG64_4_1_WGM1
    SolutionIndex: 205
    SolutionNameMin: Cijk_Ailk_Bjlk_BBH_MT64x128x32_MI32x32x4x1_SE_AF0EM1_GRVW8_NLCA1_NLCB1_SU32_SUS128_SRVW4_TT1_64_WG64_4_1_WGM1
    SolutionIndex: 206
    SolutionNameMin: Cijk_Ailk_Bjlk_BBH_MT64x64x32_MI32x32x4x1_SE_AF0EM1_GRVW4_NLCA1_NLCB1_SU0_SUS256_SRVW4_TT1_32_WG64_4_1_WGM2
    SolutionIndex: 207
    SolutionNameMin: Cijk_Ailk_Bjlk_BBH_MT64x64x64_MI32x32x4x1_SE_AF0EM1_GRVW4_NLCA1_NLCB1_SU16_SUS256_SRVW4_TT1_32_WG64_4_1_WGM2
    SolutionIndex: 208
    SolutionNameMin: Cijk_Ailk_Bjlk_BBH_MT32x64x16_MI16x16x8x1_SE_AF0EM1_GRVW4_NLCA1_NLCB1_SU16_SUS256_SRVW0_TT1_32_WG32_8_1_WGM1
    SolutionIndex: 209
    SolutionNameMin: Cijk_Ailk_Bjlk_BBH_MT64x128x32_MI32x32x4x1_SE_AF0EM4_GRVW8_NLCA1_NLCB1_SU0_SUS256_SRVW4_TT1_64_WG64_4_1_WGM15
    SolutionIndex: 210
    SolutionNameMin: Cijk_Ailk_Bjlk_BBH_MT64x32x16_MI16x16x8x1_SE_AF0EM4_GRVW2_NLCA1_NLCB1_SU16_SUS256_SRVW0_TT2_16_WG32_8_1_WGM2
    SolutionIndex: 211
    SolutionNameMin: Cijk_Ailk_Bjlk_BBH_MT128x96x32_MI32x32x4x1_SE_AF0EM4_GRVW4_NLCA1_NLCB3_SU16_SUS256_SRVW4_TT1_96_WG128_2_1_WGM2
    SolutionIndex: 212
    SolutionNameMin: Cijk_Ailk_Bjlk_BBH_MT32x32x16_MI16x16x8x1_SE_AF0EM1_GRVW2_NLCA1_NLCB1_SU0_SUS256_SRVW0_TT1_16_WG32_8_1_WGM1
    SolutionIndex: 213
    SolutionNameMin: Cijk_Ailk_Bjlk_BBH_MT128x80x64_MI16x16x8x1_SE_AF0EM4_GRVW2_NLCA1_NLCB5_SU16_SUS256_SRVW0_TT2_80_WG64_4_1_WGM2
    SolutionIndex: 214
    SolutionNameMin: Cijk_Ailk_Bjlk_BBH_MT64x64x32_MI32x32x4x1_SE_AF0EM4_GRVW4_NLCA1_NLCB1_SU32_SUS256_SRVW4_TT1_32_WG64_4_1_WGM15
    SolutionIndex: 215
    SolutionNameMin: Cijk_Ailk_Bjlk_BBH_MT128x96x32_MI32x32x4x1_SE_AF0EM4_GRVW4_NLCA1_NLCB3_SU0_SUS256_SRVW4_TT1_96_WG128_2_1_WGM2
    SolutionIndex: 216
    SolutionNameMin: Cijk_Ailk_Bjlk_BBH_MT32x64x16_MI16x16x8x1_SE_AF0EM4_GRVW4_NLCA1_NLCB1_SU0_SUS256_SRVW0_TT1_32_WG32_8_1_WGM1
    SolutionIndex: 217
    SolutionNameMin: Cijk_Ailk_Bjlk_BBH_MT32x32x64_MI16x16x8x1_SE_AF0EM4_GRVW8_NLCA1_NLCB1_SU32_SUS128_SRVW0_TT1_16_WG32_8_1_WGM1
    SolutionIndex: 218
    SolutionNameMin: Cijk_Ailk_Bjlk_BBH_MT128x64x32_MI32x32x2x2_SE_AF0EM4_GRVW8_NLCA1_NLCB1_SU0_SUS256_SRVW4_TT1_32_WG128_2_1_WGM1
    SolutionIndex: 219
    SolutionNameMin: Cijk_Ailk_Bjlk_BBH_MT64x64x128_MI32x32x4x1_SE_AF0EM1_GRVW8_NLCA1_NLCB1_SU32_SUS256_SRVW4_TT1_32_WG64_4_1_WGM15
    SolutionIndex: 220
    SolutionNameMin: Cijk_Ailk_Bjlk_BBH_MT64x64x16_MI32x32x4x1_SE_AF0EM4_GRVW4_NLCA1_NLCB1_SU0_SUS256_SRVW4_TT1_32_WG64_4_1_WGM1
    SolutionIndex: 221
    SolutionNameMin: Cijk_Ailk_Bjlk_BBH_MT128x128x32_MI32x32x4x1_SE_AF0EM4_GRVW8_NLCA1_NLCB1_SU0_SUS256_SRVW4_TT2_64_WG64_4_1_WGM1
    SolutionIndex: 222
    SolutionNameMin: Cijk_Ailk_Bjlk_BBH_MT64x64x32_MI32x32x4x1_SE_AF0EM1_GRVW8_NLCA1_NLCB1_SU0_SUS256_SRVW4_TT1_32_WG64_4_1_WGM1
    SolutionIndex: 223
    SolutionNameMin: Cijk_Ailk_Bjlk_BBH_MT128x96x32_MI32x32x4x1_SE_AF0EM4_GRVW4_NLCA1_NLCB3_SU0_SUS256_SRVW4_TT1_96_WG128_2_1_WGM15
    SolutionIndex: 224
    SolutionNameMin: Cijk_Ailk_Bjlk_BBH_MT32x32x64_MI16x16x8x1_SE_AF0EM4_GRVW2_NLCA1_NLCB1_SU32_SUS128_SRVW0_TT1_16_WG32_8_1_WGM2
    SolutionIndex: 225
    SolutionNameMin: Cijk_Ailk_Bjlk_BBH_MT64x64x128_MI32x32x4x1_SE_AF0EM1_GRVW8_NLCA1_NLCB1_SU32_SUS256_SRVW4_TT1_32_WG64_4_1_WGM2
    SolutionIndex: 226
    SolutionNameMin: Cijk_Ailk_Bjlk_BBH_MT64x64x128_MI32x32x4x1_SE_AF0EM1_GRVW8_NLCA1_NLCB1_SU16_SUS256_SRVW4_TT1_32_WG64_4_1_WGM15
    SolutionIndex: 227
    SolutionNameMin: Cijk_Ailk_Bjlk_BBH_MT32x32x64_MI16x16x8x1_SE_AF0EM4_GRVW8_NLCA1_NLCB1_SU0_SUS256_SRVW0_TT1_16_WG32_8_1_WGM1
    SolutionIndex: 228
    SolutionNameMin: Cijk_Ailk_Bjlk_BBH_MT32x64x16_MI16x16x8x1_SE_AF0EM1_GRVW2_NLCA1_NLCB1_SU0_SUS256_SRVW0_TT1_32_WG32_8_1_WGM1
    SolutionIndex: 229
    SolutionNameMin: Cijk_Ailk_Bjlk_BBH_MT128x128x32_MI32x32x4x1_SE_AF0EM1_GRVW8_NLCA1_NLCB1_SU0_SUS256_SRVW4_TT2_64_WG64_4_1_WGM15
    SolutionIndex: 230
    SolutionNameMin: Cijk_Ailk_Bjlk_BBH_MT32x32x16_MI16x16x8x1_SE_AF0EM4_GRVW4_NLCA1_NLCB1_SU0_SUS256_SRVW0_TT1_16_WG32_8_1_WGM15
    SolutionIndex: 231
    SolutionNameMin: Cijk_Ailk_Bjlk_BBH_MT64x64x32_MI32x32x4x1_SE_AF0EM1_GRVW8_NLCA1_NLCB1_SU32_SUS128_SRVW4_TT1_32_WG64_4_1_WGM1
    SolutionIndex: 232
    SolutionNameMin: Cijk_Ailk_Bjlk_BBH_MT32x64x16_MI16x16x8x1_SE_AF0EM1_GRVW2_NLCA1_NLCB1_SU16_SUS256_SRVW4_TT1_32_WG32_8_1_WGM1
    SolutionIndex: 233
    SolutionNameMin: Cijk_Ailk_Bjlk_BBH_MT64x32x16_MI16x16x8x1_SE_AF0EM4_GRVW8_NLCA1_NLCB1_SU0_SUS256_SRVW4_TT2_16_WG32_8_1_WGM1
    SolutionIndex: 234
    SolutionNameMin: Cijk_Ailk_Bjlk_BBH_MT32x64x16_MI16x16x8x1_SE_AF0EM1_GRVW8_NLCA1_NLCB1_SU32_SUS128_SRVW4_TT1_32_WG32_8_1_WGM2
    SolutionIndex: 235
    SolutionNameMin: Cijk_Ailk_Bjlk_BBH_MT64x64x128_MI32x32x4x1_SE_AF0EM4_GRVW8_NLCA1_NLCB1_SU16_SUS256_SRVW4_TT1_32_WG64_4_1_WGM15
    SolutionIndex: 236
    SolutionNameMin: Cijk_Ailk_Bjlk_BBH_MT64x32x16_MI16x16x8x1_SE_AF0EM1_GRVW2_NLCA1_NLCB1_SU0_SUS256_SRVW4_TT2_16_WG32_8_1_WGM1
    SolutionIndex: 237
    SolutionNameMin: Cijk_Ailk_Bjlk_BBH_MT128x96x32_MI32x32x4x1_SE_AF0EM1_GRVW4_NLCA1_NLCB3_SU0_SUS256_SRVW4_TT1_96_WG128_2_1_WGM1
    SolutionIndex: 238
    SolutionNameMin: Cijk_Ailk_Bjlk_BBH_MT64x64x128_MI32x32x4x1_SE_AF0EM1_GRVW8_NLCA1_NLCB1_SU16_SUS256_SRVW4_TT1_32_WG64_4_1_WGM1
    SolutionIndex: 239
    SolutionNameMin: Cijk_Ailk_Bjlk_BBH_MT32x32x128_MI16x16x8x1_SE_AF0EM1_GRVW2_NLCA1_NLCB1_SU32_SUS256_SRVW0_TT1_16_WG32_8_1_WGM2
    SolutionIndex: 240
    SolutionNameMin: Cijk_Ailk_Bjlk_BBH_MT64x128x32_MI32x32x4x1_SE_AF0EM1_GRVW8_NLCA1_NLCB1_SU0_SUS256_SRVW4_TT1_64_WG64_4_1_WGM1
    SolutionIndex: 241
    SolutionNameMin: Cijk_Ailk_Bjlk_BBH_MT32x64x16_MI16x16x8x1_SE_AF0EM1_GRVW8_NLCA1_NLCB1_SU16_SUS128_SRVW0_TT1_32_WG32_8_1_WGM2
    SolutionIndex: 242
    SolutionNameMin: Cijk_Ailk_Bjlk_BBH_MT64x128x16_MI32x32x4x1_SE_AF0EM1_GRVW2_NLCA1_NLCB1_SU0_SUS256_SRVW4_TT1_64_WG64_4_1_WGM1
    SolutionIndex: 243
    SolutionNameMin: Cijk_Ailk_Bjlk_BBH_MT128x96x32_MI32x32x4x1_SE_AF0EM1_GRVW4_NLCA1_NLCB3_SU0_SUS256_SRVW4_TT1_96_WG128_2_1_WGM15
    SolutionIndex: 244
    SolutionNameMin: Cijk_Ailk_Bjlk_BBH_MT32x64x16_MI16x16x8x1_SE_AF0EM1_GRVW2_NLCA1_NLCB1_SU0_SUS256_SRVW4_TT1_32_WG32_8_1_WGM1
    SolutionIndex: 245
    SolutionNameMin: Cijk_Ailk_Bjlk_BBH_MT64x32x16_MI16x16x8x1_SE_AF0EM1_GRVW2_NLCA1_NLCB1_SU0_SUS256_SRVW4_TT2_16_WG32_8_1_WGM15
    SolutionIndex: 246
    SolutionNameMin: Cijk_Ailk_Bjlk_BBH_MT128x96x32_MI32x32x4x1_SE_AF0EM4_GRVW4_NLCA1_NLCB3_SU0_SUS256_SRVW4_TT1_96_WG128_2_1_WGM1
    SolutionIndex: 247
    SolutionNameMin: Cijk_Ailk_Bjlk_BBH_MT128x96x32_MI32x32x4x1_SE_AF0EM4_GRVW4_NLCA1_NLCB3_SU16_SUS128_SRVW4_TT1_96_WG128_2_1_WGM2
    SolutionIndex: 248
    SolutionNameMin: Cijk_Ailk_Bjlk_BBH_MT128x288x32_MI32x32x4x1_SE_AF0EM4_GRVW2_NLCA1_NLCB9_SU0_SUS256_SRVW0_TT1_288_WG128_2_1_WGM2
    SolutionIndex: 249
    SolutionNameMin: Cijk_Ailk_Bjlk_BBH_MT128x80x64_MI16x16x8x1_SE_AF0EM4_GRVW2_NLCA1_NLCB5_SU0_SUS256_SRVW0_TT2_80_WG64_4_1_WGM2
    SolutionIndex: 250
    SolutionNameMin: Cijk_Ailk_Bjlk_BBH_MT32x32x16_MI16x16x8x1_SE_AF0EM1_GRVW8_NLCA1_NLCB1_SU0_SUS256_SRVW0_TT1_16_WG32_8_1_WGM2
    SolutionIndex: 251
    SolutionNameMin: Cijk_Ailk_Bjlk_BBH_MT128x80x64_MI16x16x8x1_SE_AF0EM4_GRVW2_NLCA1_NLCB5_SU16_SUS128_SRVW0_TT2_80_WG64_4_1_WGM2
    SolutionIndex: 252
    SolutionNameMin: Cijk_Ailk_Bjlk_BBH_MT64x64x16_MI32x32x4x1_SE_AF0EM4_GRVW2_NLCA1_NLCB1_SU0_SUS256_SRVW4_TT1_32_WG64_4_1_WGM15
    SolutionIndex: 253
    SolutionNameMin: Cijk_Ailk_Bjlk_BBH_MT128x128x32_MI32x32x4x1_SE_AF0EM4_GRVW4_NLCA1_NLCB1_SU0_SUS256_SRVW4_TT2_64_WG64_4_1_WGM2
    SolutionIndex: 254
    SolutionNameMin: Cijk_Ailk_Bjlk_BBH_MT32x32x64_MI16x16x8x1_SE_AF0EM1_GRVW8_NLCA1_NLCB1_SU32_SUS128_SRVW4_TT1_16_WG32_8_1_WGM1
    SolutionIndex: 255
    SolutionNameMin: Cijk_Ailk_Bjlk_BBH_MT128x256x16_MI32x32x4x1_SE_AF0EM4_GRVW4_NLCA1_NLCB1_SU0_SUS256_SRVW4_TT2_128_WG64_4_1_WGM1
    SolutionIndex: 256
    SolutionNameMin: Cijk_Ailk_Bjlk_BBH_MT128x96x32_MI32x32x4x1_SE_AF0EM4_GRVW4_NLCA1_NLCB3_SU0_SUS256_SRVW0_TT1_96_WG128_2_1_WGM2
    SolutionIndex: 257
    SolutionNameMin: Cijk_Ailk_Bjlk_BBH_MT64x64x16_MI32x32x4x1_SE_AF0EM4_GRVW4_NLCA1_NLCB1_SU32_SUS256_SRVW0_TT1_32_WG64_4_1_WGM2
    SolutionIndex: 258
    SolutionNameMin: Cijk_Ailk_Bjlk_BBH_MT32x64x16_MI16x16x8x1_SE_AF0EM1_GRVW2_NLCA1_NLCB1_SU32_SUS256_SRVW0_TT1_32_WG32_8_1_WGM1
    SolutionIndex: 259
    SolutionNameMin: Cijk_Ailk_Bjlk_BBH_MT64x32x16_MI16x16x8x1_SE_AF0EM4_GRVW2_NLCA1_NLCB1_SU0_SUS256_SRVW0_TT2_16_WG32_8_1_WGM1
    SolutionIndex: 260
    SolutionNameMin: Cijk_Ailk_Bjlk_BBH_MT32x64x16_MI16x16x8x1_SE_AF0EM1_GRVW2_NLCA1_NLCB1_SU16_SUS128_SRVW4_TT1_32_WG32_8_1_WGM2
    SolutionIndex: 261
    SolutionNameMin: Cijk_Ailk_Bjlk_BBH_MT128x64x32_MI32x32x4x1_SE_AF0EM4_GRVW8_NLCA1_NLCB1_SU16_SUS128_SRVW4_TT2_32_WG64_4_1_WGM2
    SolutionIndex: 262
    SolutionNameMin: Cijk_Ailk_Bjlk_BBH_MT128x96x32_MI32x32x4x1_SE_AF0EM4_GRVW4_NLCA1_NLCB3_SU32_SUS128_SRVW4_TT1_96_WG128_2_1_WGM2
    SolutionIndex: 263
    SolutionNameMin: Cijk_Ailk_Bjlk_BBH_MT32x32x64_MI16x16x8x1_SE_AF0EM4_GRVW8_NLCA1_NLCB1_SU16_SUS128_SRVW4_TT1_16_WG32_8_1_WGM2
    SolutionIndex: 264
    SolutionNameMin: Cijk_Ailk_Bjlk_BBH_MT64x64x128_MI32x32x4x1_SE_AF0EM4_GRVW8_NLCA1_NLCB1_SU32_SUS256_SRVW4_TT1_32_WG64_4_1_WGM2
    SolutionIndex: 265
    SolutionNameMin: Cijk_Ailk_Bjlk_BBH_MT64x64x16_MI32x32x4x1_SE_AF0EM4_GRVW8_NLCA1_NLCB1_SU0_SUS256_SRVW4_TT1_32_WG64_4_1_WGM1
    SolutionIndex: 266
    SolutionNameMin: Cijk_Ailk_Bjlk_BBH_MT128x160x32_MI32x32x4x1_SE_AF0EM4_GRVW4_NLCA1_NLCB5_SU0_SUS256_SRVW0_TT1_160_WG128_2_1_WGM15
    SolutionIndex: 267
    SolutionNameMin: Cijk_Ailk_Bjlk_BBH_MT64x32x16_MI16x16x8x1_SE_AF0EM4_GRVW4_NLCA1_NLCB1_SU0_SUS256_SRVW0_TT2_16_WG32_8_1_WGM1
    SolutionIndex: 268
    SolutionNameMin: Cijk_Ailk_Bjlk_BBH_MT64x64x16_MI32x32x4x1_SE_AF0EM4_GRVW8_NLCA1_NLCB1_SU32_SUS256_SRVW0_TT1_32_WG64_4_1_WGM2
    SolutionIndex: 269
    SolutionNameMin: Cijk_Ailk_Bjlk_BBH_MT64x128x16_MI32x32x4x1_SE_AF0EM4_GRVW2_NLCA1_NLCB1_SU16_SUS256_SRVW4_TT1_64_WG64_4_1_WGM1
    SolutionIndex: 270
    SolutionNameMin: Cijk_Ailk_Bjlk_BBH_MT128x96x32_MI32x32x4x1_SE_AF0EM4_GRVW4_NLCA1_NLCB3_SU32_SUS256_SRVW4_TT1_96_WG128_2_1_WGM1
    SolutionIndex: 271
    SolutionNameMin: Cijk_Ailk_Bjlk_BBH_MT128x64x64_MI32x32x4x1_SE_AF0EM4_GRVW4_NLCA1_NLCB1_SU0_SUS256_SRVW4_TT2_32_WG64_4_1_WGM15
    SolutionIndex: 272
    SolutionNameMin: Cijk_Ailk_Bjlk_BBH_MT128x96x32_MI32x32x4x1_SE_AF0EM1_GRVW4_NLCA1_NLCB3_SU0_SUS256_SRVW4_TT1_96_WG128_2_1_WGM2
    SolutionIndex: 273
    SolutionNameMin: Cijk_Ailk_Bjlk_BBH_MT32x64x32_MI16x16x8x1_SE_AF0EM4_GRVW4_NLCA1_NLCB1_SU16_SUS128_SRVW0_TT1_32_WG32_8_1_WGM15
    SolutionIndex: 274
    SolutionNameMin: Cijk_Ailk_Bjlk_BBH_MT128x288x16_MI32x32x4x1_SE_AF0EM4_GRVW2_NLCA1_NLCB9_SU0_SUS256_SRVW0_TT1_288_WG128_2_1_WGM15
    SolutionIndex: 275
    SolutionNameMin: Cijk_Ailk_Bjlk_BBH_MT128x64x32_MI32x32x4x1_SE_AF0EM4_GRVW8_NLCA1_NLCB1_SU16_SUS256_SRVW4_TT2_32_WG64_4_1_WGM1
    SolutionIndex: 276
    SolutionNameMin: Cijk_Ailk_Bjlk_BBH_MT64x64x16_MI32x32x4x1_SE_AF0EM4_GRVW2_NLCA1_NLCB1_SU32_SUS256_SRVW4_TT1_32_WG64_4_1_WGM2
    SolutionIndex: 277
    SolutionNameMin: Cijk_Ailk_Bjlk_BBH_MT64x128x32_MI32x32x4x1_SE_AF0EM4_GRVW8_NLCA1_NLCB1_SU32_SUS128_SRVW4_TT1_64_WG64_4_1_WGM15
    SolutionIndex: 278
    SolutionNameMin: Cijk_Ailk_Bjlk_BBH_MT128x96x32_MI32x32x4x1_SE_AF0EM4_GRVW4_NLCA1_NLCB3_SU0_SUS256_SRVW0_TT1_96_WG128_2_1_WGM1
    SolutionIndex: 279
    SolutionNameMin: Cijk_Ailk_Bjlk_BBH_MT64x128x64_MI32x32x4x1_SE_AF0EM4_GRVW4_NLCA1_NLCB1_SU16_SUS128_SRVW4_TT1_64_WG64_4_1_WGM1
    SolutionIndex: 280
    SolutionNameMin: Cijk_Ailk_Bjlk_BBH_MT128x128x16_MI32x32x4x1_SE_AF0EM4_GRVW8_NLCA1_NLCB1_SU16_SUS256_SRVW4_TT2_64_WG64_4_1_WGM15
    SolutionIndex: 281
    SolutionNameMin: Cijk_Ailk_Bjlk_BBH_MT128x128x16_MI32x32x4x1_SE_AF0EM4_GRVW8_NLCA1_NLCB1_SU16_SUS128_SRVW4_TT2_64_WG64_4_1_WGM15
    SolutionIndex: 282
    SolutionNameMin: Cijk_Ailk_Bjlk_BBH_MT128x160x32_MI32x32x4x1_SE_AF0EM4_GRVW4_NLCA1_NLCB5_SU0_SUS256_SRVW4_TT1_160_WG128_2_1_WGM2
    SolutionIndex: 283
    SolutionNameMin: Cijk_Ailk_Bjlk_BBH_MT128x128x16_MI32x32x4x1_SE_AF0EM4_GRVW8_NLCA1_NLCB1_SU32_SUS256_SRVW4_TT2_64_WG64_4_1_WGM15
    SolutionIndex: 284
    SolutionNameMin: Cijk_Ailk_Bjlk_BBH_MT64x64x64_MI32x32x4x1_SE_AF0EM1_GRVW4_NLCA1_NLCB1_SU32_SUS128_SRVW4_TT1_32_WG64_4_1_WGM1
    SolutionIndex: 285
    SolutionNameMin: Cijk_Ailk_Bjlk_BBH_MT64x64x32_MI32x32x4x1_SE_AF0EM1_GRVW4_NLCA1_NLCB1_SU16_SUS128_SRVW4_TT1_32_WG64_4_1_WGM15
    SolutionIndex: 286
    SolutionNameMin: Cijk_Ailk_Bjlk_BBH_MT64x32x16_MI16x16x8x1_SE_AF0EM4_GRVW2_NLCA1_NLCB1_SU0_SUS256_SRVW4_TT2_16_WG32_8_1_WGM2
    SolutionIndex: 287
    SolutionNameMin: Cijk_Ailk_Bjlk_BBH_MT128x256x16_MI32x32x4x1_SE_AF0EM1_GRVW4_NLCA1_NLCB1_SU0_SUS256_SRVW4_TT2_128_WG64_4_1_WGM15
    SolutionIndex: 288
    SolutionNameMin: Cijk_Ailk_Bjlk_BBH_MT64x128x16_MI32x32x2x2_SE_AF0EM1_GRVW2_NLCA1_NLCB1_SU0_SUS256_SRVW0_TT1_32_WG64_4_1_WGM1
    SolutionIndex: 289
    SolutionNameMin: Cijk_Ailk_Bjlk_BBH_MT64x64x16_MI32x32x4x1_SE_AF0EM4_GRVW4_NLCA1_NLCB1_SU0_SUS256_SRVW4_TT1_32_WG64_4_1_WGM15
    SolutionIndex: 290
    SolutionNameMin: Cijk_Ailk_Bjlk_BBH_MT64x32x16_MI16x16x8x1_SE_AF0EM4_GRVW2_NLCA1_NLCB1_SU16_SUS256_SRVW4_TT2_16_WG32_8_1_WGM15
    SolutionIndex: 291
    SolutionNameMin: Cijk_Ailk_Bjlk_BBH_MT64x64x64_MI32x32x4x1_SE_AF0EM4_GRVW8_NLCA1_NLCB1_SU16_SUS256_SRVW4_TT1_32_WG64_4_1_WGM1
    SolutionIndex: 292
    SolutionNameMin: Cijk_Ailk_Bjlk_BBH_MT32x64x16_MI16x16x8x1_SE_AF0EM4_GRVW2_NLCA1_NLCB1_SU32_SUS256_SRVW4_TT1_32_WG32_8_1_WGM2
    SolutionIndex: 293
    SolutionNameMin: Cijk_Ailk_Bjlk_BBH_MT128x96x32_MI32x32x4x1_SE_AF0EM4_GRVW4_NLCA1_NLCB3_SU32_SUS256_SRVW4_TT1_96_WG128_2_1_WGM2
    SolutionIndex: 294
    SolutionNameMin: Cijk_Ailk_Bjlk_BBH_MT32x64x16_MI16x16x8x1_SE_AF0EM1_GRVW2_NLCA1_NLCB1_SU32_SUS128_SRVW0_TT1_32_WG32_8_1_WGM1
    SolutionIndex: 295
    SolutionNameMin: Cijk_Ailk_Bjlk_BBH_MT128x128x32_MI32x32x4x1_SE_AF0EM4_GRVW8_NLCA1_NLCB1_SU32_SUS128_SRVW4_TT2_64_WG64_4_1_WGM15
    SolutionIndex: 296
    SolutionNameMin: Cijk_Ailk_Bjlk_BBH_MT64x128x16_MI32x32x2x2_SE_AF0EM1_GRVW8_NLCA1_NLCB1_SU32_SUS128_SRVW4_TT1_32_WG64_4_1_WGM1
    SolutionIndex: 297
    SolutionNameMin: Cijk_Ailk_Bjlk_BBH_MT32x32x128_MI16x16x8x1_SE_AF0EM1_GRVW4_NLCA1_NLCB1_SU0_SUS256_SRVW4_TT1_16_WG32_8_1_WGM1
    SolutionIndex: 298
    SolutionNameMin: Cijk_Ailk_Bjlk_BBH_MT128x144x32_MI16x16x8x1_SE_AF0EM4_GRVW2_NLCA1_NLCB9_SU0_SUS256_SRVW0_TT2_144_WG64_4_1_WGM1
    SolutionIndex: 299
    SolutionNameMin: Cijk_Ailk_Bjlk_BBH_MT32x64x16_MI16x16x8x1_SE_AF0EM4_GRVW2_NLCA1_NLCB1_SU32_SUS256_SRVW0_TT1_32_WG32_8_1_WGM2
    SolutionIndex: 300
    SolutionNameMin: Cijk_Ailk_Bjlk_BBH_MT32x32x128_MI16x16x8x1_SE_AF0EM4_GRVW2_NLCA1_NLCB1_SU0_SUS256_SRVW0_TT1_16_WG32_8_1_WGM1
    SolutionIndex: 301
    SolutionNameMin: Cijk_Ailk_Bjlk_BBH_MT64x64x128_MI32x32x4x1_SE_AF0EM1_GRVW8_NLCA1_NLCB1_SU32_SUS256_SRVW0_TT1_32_WG64_4_1_WGM15
    SolutionIndex: 302
    SolutionNameMin: Cijk_Ailk_Bjlk_BBH_MT64x64x32_MI32x32x4x1_SE_AF0EM4_GRVW4_NLCA1_NLCB1_SU16_SUS128_SRVW4_TT1_32_WG64_4_1_WGM15
    SolutionIndex: 303
    SolutionNameMin: Cijk_Ailk_Bjlk_BBH_MT128x64x32_MI32x32x4x1_SE_AF0EM1_GRVW8_NLCA1_NLCB1_SU0_SUS256_SRVW4_TT2_32_WG64_4_1_WGM1
    SolutionIndex: 304
    SolutionNameMin: Cijk_Ailk_Bjlk_BBH_MT32x64x16_MI16x16x8x1_SE_AF0EM1_GRVW4_NLCA1_NLCB1_SU32_SUS256_SRVW0_TT1_32_WG32_8_1_WGM1
    SolutionIndex: 305
    SolutionNameMin: Cijk_Ailk_Bjlk_BBH_MT64x64x32_MI32x32x4x1_SE_AF0EM1_GRVW8_NLCA1_NLCB1_SU0_SUS256_SRVW4_TT1_32_WG64_4_1_WGM2
    SolutionIndex: 306
    SolutionNameMin: Cijk_Ailk_Bjlk_BBH_MT64x128x64_MI32x32x4x1_SE_AF0EM1_GRVW4_NLCA1_NLCB1_SU0_SUS256_SRVW0_TT1_64_WG64_4_1_WGM1
    SolutionIndex: 307
    SolutionNameMin: Cijk_Ailk_Bjlk_BBH_MT128x96x32_MI32x32x4x1_SE_AF0EM4_GRVW4_NLCA1_NLCB3_SU32_SUS128_SRVW4_TT1_96_WG128_2_1_WGM1
    SolutionIndex: 308
    SolutionNameMin: Cijk_Ailk_Bjlk_BBH_MT32x32x32_MI16x16x8x1_SE_AF0EM4_GRVW4_NLCA1_NLCB1_SU0_SUS256_SRVW0_TT1_16_WG32_8_1_WGM1
    SolutionIndex: 309
    SolutionNameMin: Cijk_Ailk_Bjlk_BBH_MT32x32x64_MI16x16x8x1_SE_AF0EM4_GRVW8_NLCA1_NLCB1_SU0_SUS256_SRVW0_TT1_16_WG32_8_1_WGM15
    SolutionIndex: 310
    SolutionNameMin: Cijk_Ailk_Bjlk_BBH_MT64x128x16_MI32x32x2x2_SE_AF0EM1_GRVW2_NLCA1_NLCB1_SU0_SUS256_SRVW4_TT1_32_WG64_4_1_WGM15
    SolutionIndex: 311
    SolutionNameMin: Cijk_Ailk_Bjlk_BBH_MT32x32x64_MI16x16x8x1_SE_AF0EM1_GRVW4_NLCA1_NLCB1_SU16_SUS256_SRVW0_TT1_16_WG32_8_1_WGM2
    SolutionIndex: 312
    SolutionNameMin: Cijk_Ailk_Bjlk_BBH_MT32x32x128_MI16x16x8x1_SE_AF0EM4_GRVW2_NLCA1_NLCB1_SU32_SUS256_SRVW0_TT1_16_WG32_8_1_WGM1
    SolutionIndex: 313
    SolutionNameMin: Cijk_Ailk_Bjlk_BBH_MT32x32x128_MI16x16x8x1_SE_AF0EM4_GRVW2_NLCA1_NLCB1_SU16_SUS256_SRVW0_TT1_16_WG32_8_1_WGM1
    SolutionIndex: 314
    SolutionNameMin: Cijk_Ailk_Bjlk_BBH_MT32x64x16_MI16x16x8x1_SE_AF0EM1_GRVW4_NLCA1_NLCB1_SU0_SUS256_SRVW0_TT1_32_WG32_8_1_WGM1
    SolutionIndex: 315
    SolutionNameMin: Cijk_Ailk_Bjlk_BBH_MT128x96x32_MI32x32x4x1_SE_AF0EM4_GRVW4_NLCA1_NLCB3_SU32_SUS256_SRVW4_TT1_96_WG128_2_1_WGM15
    SolutionIndex: 316
    SolutionNameMin: Cijk_Ailk_Bjlk_BBH_MT128x96x32_MI32x32x4x1_SE_AF0EM4_GRVW4_NLCA1_NLCB3_SU16_SUS128_SRVW4_TT1_96_WG128_2_1_WGM1
    SolutionIndex: 317
    SolutionNameMin: Cijk_Ailk_Bjlk_BBH_MT64x32x16_MI16x16x8x1_SE_AF0EM4_GRVW8_NLCA1_NLCB1_SU16_SUS128_SRVW0_TT2_16_WG32_8_1_WGM1
    SolutionIndex: 318
    SolutionNameMin: Cijk_Ailk_Bjlk_BBH_MT64x128x16_MI32x32x4x1_SE_AF0EM4_GRVW8_NLCA1_NLCB1_SU0_SUS256_SRVW4_TT1_64_WG64_4_1_WGM15
    SolutionIndex: 319
    SolutionNameMin: Cijk_Ailk_Bjlk_BBH_MT64x128x64_MI32x32x4x1_SE_AF0EM4_GRVW8_NLCA1_NLCB1_SU0_SUS256_SRVW4_TT1_64_WG64_4_1_WGM15
    SolutionIndex: 320
    SolutionNameMin: Cijk_Ailk_Bjlk_BBH_MT32x64x16_MI16x16x8x1_SE_AF0EM4_GRVW4_NLCA1_NLCB1_SU16_SUS128_SRVW4_TT1_32_WG32_8_1_WGM1
    SolutionIndex: 321
    SolutionNameMin: Cijk_Ailk_Bjlk_BBH_MT64x32x16_MI16x16x8x1_SE_AF0EM4_GRVW2_NLCA1_NLCB1_SU0_SUS256_SRVW4_TT2_16_WG32_8_1_WGM1
    SolutionIndex: 322
    SolutionNameMin: Cijk_Ailk_Bjlk_BBH_MT128x64x16_MI32x32x2x2_SE_AF0EM1_GRVW8_NLCA1_NLCB1_SU0_SUS256_SRVW4_TT1_32_WG128_2_1_WGM2
    SolutionIndex: 323
    SolutionNameMin: Cijk_Ailk_Bjlk_BBH_MT64x80x64_MI16x16x8x1_SE_AF0EM1_GRVW2_NLCA1_NLCB5_SU0_SUS256_SRVW4_TT1_80_WG64_4_1_WGM15
    SolutionIndex: 324
    SolutionNameMin: Cijk_Ailk_Bjlk_BBH_MT128x128x16_MI32x32x4x1_SE_AF0EM4_GRVW8_NLCA1_NLCB1_SU32_SUS128_SRVW4_TT2_64_WG64_4_1_WGM15
    SolutionIndex: 325
    SolutionNameMin: Cijk_Ailk_Bjlk_BBH_MT64x64x128_MI32x32x4x1_SE_AF0EM4_GRVW8_NLCA1_NLCB1_SU16_SUS256_SRVW4_TT1_32_WG64_4_1_WGM1
    SolutionIndex: 326
    SolutionNameMin: Cijk_Ailk_Bjlk_BBH_MT64x128x64_MI32x32x4x1_SE_AF0EM4_GRVW4_NLCA1_NLCB1_SU0_SUS256_SRVW4_TT1_64_WG64_4_1_WGM2
    SolutionIndex: 327
    SolutionNameMin: Cijk_Ailk_Bjlk_BBH_MT64x64x128_MI32x32x4x1_SE_AF0EM4_GRVW8_NLCA1_NLCB1_SU32_SUS256_SRVW0_TT1_32_WG64_4_1_WGM15
    SolutionIndex: 328
    SolutionNameMin: Cijk_Ailk_Bjlk_BBH_MT64x64x64_MI32x32x4x1_SE_AF0EM4_GRVW4_NLCA1_NLCB1_SU16_SUS128_SRVW4_TT1_32_WG64_4_1_WGM2
    SolutionIndex: 329
    SolutionNameMin: Cijk_Ailk_Bjlk_BBH_MT128x96x32_MI32x32x4x1_SE_AF0EM1_GRVW4_NLCA1_NLCB3_SU16_SUS128_SRVW4_TT1_96_WG128_2_1_WGM15
    SolutionIndex: 330
    SolutionNameMin: Cijk_Ailk_Bjlk_BBH_MT64x32x16_MI16x16x8x1_SE_AF0EM4_GRVW2_NLCA1_NLCB1_SU32_SUS256_SRVW4_TT2_16_WG32_8_1_WGM2
    SolutionIndex: 331
    SolutionNameMin: Cijk_Ailk_Bjlk_BBH_MT64x32x16_MI16x16x8x1_SE_AF0EM4_GRVW2_NLCA1_NLCB1_SU16_SUS256_SRVW0_TT2_16_WG32_8_1_WGM1
    SolutionIndex: 332
    SolutionNameMin: Cijk_Ailk_Bjlk_BBH_MT128x160x32_MI32x32x4x1_SE_AF0EM4_GRVW4_NLCA1_NLCB5_SU0_SUS256_SRVW0_TT1_160_WG128_2_1_WGM2
    SolutionIndex: 333
    SolutionNameMin: Cijk_Ailk_Bjlk_BBH_MT64x64x32_MI32x32x4x1_SE_AF0EM4_GRVW2_NLCA1_NLCB1_SU0_SUS256_SRVW4_TT1_32_WG64_4_1_WGM1
    SolutionIndex: 334
    SolutionNameMin: Cijk_Ailk_Bjlk_BBH_MT64x64x128_MI32x32x4x1_SE_AF0EM1_GRVW8_NLCA1_NLCB1_SU32_SUS256_SRVW0_TT1_32_WG64_4_1_WGM2
    SolutionIndex: 335
    SolutionNameMin: Cijk_Ailk_Bjlk_BBH_MT128x96x32_MI32x32x4x1_SE_AF0EM4_GRVW4_NLCA1_NLCB3_SU32_SUS128_SRVW0_TT1_96_WG128_2_1_WGM2
    SolutionIndex: 336
    SolutionNameMin: Cijk_Ailk_Bjlk_BBH_MT128x64x32_MI32x32x4x1_SE_AF0EM4_GRVW8_NLCA1_NLCB1_SU16_SUS128_SRVW4_TT2_32_WG64_4_1_WGM1
    SolutionIndex: 337
    SolutionNameMin: Cijk_Ailk_Bjlk_BBH_MT32x64x16_MI16x16x8x1_SE_AF0EM1_GRVW2_NLCA1_NLCB1_SU32_SUS256_SRVW4_TT1_32_WG32_8_1_WGM1
    SolutionIndex: 338
    SolutionNameMin: Cijk_Ailk_Bjlk_BBH_MT64x128x32_MI32x32x4x1_SE_AF0EM4_GRVW8_NLCA1_NLCB1_SU16_SUS128_SRVW4_TT1_64_WG64_4_1_WGM1
    SolutionIndex: 339
    SolutionNameMin: Cijk_Ailk_Bjlk_BBH_MT32x32x16_MI16x16x8x1_SE_AF0EM4_GRVW2_NLCA1_NLCB1_SU16_SUS128_SRVW0_TT1_16_WG32_8_1_WGM2
    SolutionIndex: 340
    SolutionNameMin: Cijk_Ailk_Bjlk_BBH_MT32x64x16_MI16x16x8x1_SE_AF0EM1_GRVW4_NLCA1_NLCB1_SU16_SUS256_SRVW0_TT1_32_WG32_8_1_WGM2
    SolutionIndex: 341
    SolutionNameMin: Cijk_Ailk_Bjlk_BBH_MT64x128x32_MI32x32x4x1_SE_AF0EM1_GRVW8_NLCA1_NLCB1_SU32_SUS256_SRVW4_TT1_64_WG64_4_1_WGM1
    SolutionIndex: 342
    SolutionNameMin: Cijk_Ailk_Bjlk_BBH_MT128x64x32_MI32x32x4x1_SE_AF0EM1_GRVW8_NLCA1_NLCB1_SU0_SUS256_SRVW4_TT2_32_WG64_4_1_WGM2
    SolutionIndex: 343
    SolutionNameMin: Cijk_Ailk_Bjlk_BBH_MT32x32x16_MI16x16x8x1_SE_AF0EM4_GRVW2_NLCA1_NLCB1_SU16_SUS256_SRVW0_TT1_16_WG32_8_1_WGM15
    SolutionIndex: 344
    SolutionNameMin: Cijk_Ailk_Bjlk_BBH_MT64x64x32_MI32x32x4x1_SE_AF0EM4_GRVW4_NLCA1_NLCB1_SU0_SUS256_SRVW4_TT1_32_WG64_4_1_WGM15
    SolutionIndex: 345
    SolutionNameMin: Cijk_Ailk_Bjlk_BBH_MT64x64x64_MI32x32x4x1_SE_AF0EM4_GRVW4_NLCA1_NLCB1_SU0_SUS256_SRVW4_TT1_32_WG64_4_1_WGM1
    SolutionIndex: 346
    SolutionNameMin: Cijk_Ailk_Bjlk_BBH_MT128x128x16_MI32x32x4x1_SE_AF0EM4_GRVW8_NLCA1_NLCB1_SU32_SUS256_SRVW4_TT2_64_WG64_4_1_WGM1
    SolutionIndex: 347
    SolutionNameMin: Cijk_Ailk_Bjlk_BBH_MT128x128x32_MI32x32x4x1_SE_AF0EM4_GRVW8_NLCA1_NLCB1_SU32_SUS256_SRVW4_TT2_64_WG64_4_1_WGM2
    SolutionIndex: 348
    SolutionNameMin: Cijk_Ailk_Bjlk_BBH_MT64x64x32_MI32x32x4x1_SE_AF0EM4_GRVW4_NLCA1_NLCB1_SU16_SUS256_SRVW4_TT1_32_WG64_4_1_WGM15
    SolutionIndex: 349
    SolutionNameMin: Cijk_Ailk_Bjlk_BBH_MT64x64x32_MI32x32x4x1_SE_AF0EM1_GRVW8_NLCA1_NLCB1_SU0_SUS256_SRVW4_TT1_32_WG64_4_1_WGM15
    SolutionIndex: 350
    SolutionNameMin: Cijk_Ailk_Bjlk_BBH_MT128x96x32_MI32x32x4x1_SE_AF0EM1_GRVW4_NLCA1_NLCB3_SU32_SUS128_SRVW4_TT1_96_WG128_2_1_WGM15
    SolutionIndex: 351
    SolutionNameMin: Cijk_Ailk_Bjlk_BBH_MT128x80x64_MI16x16x8x1_SE_AF0EM4_GRVW2_NLCA1_NLCB5_SU16_SUS256_SRVW0_TT2_80_WG64_4_1_WGM15
    SolutionIndex: 352
    SolutionNameMin: Cijk_Ailk_Bjlk_BBH_MT32x32x64_MI16x16x8x1_SE_AF0EM1_GRVW8_NLCA1_NLCB1_SU32_SUS256_SRVW0_TT1_16_WG32_8_1_WGM2
    SolutionIndex: 353
    SolutionNameMin: Cijk_Ailk_Bjlk_BBH_MT64x64x64_MI32x32x4x1_SE_AF0EM1_GRVW8_NLCA1_NLCB1_SU16_SUS128_SRVW4_TT1_32_WG64_4_1_WGM1
    SolutionIndex: 354
    SolutionNameMin: Cijk_Ailk_Bjlk_BBH_MT64x128x32_MI32x32x4x1_SE_AF0EM4_GRVW8_NLCA1_NLCB1_SU16_SUS128_SRVW4_TT1_64_WG64_4_1_WGM15
    SolutionIndex: 355
    SolutionNameMin: Cijk_Ailk_Bjlk_BBH_MT64x32x128_MI16x16x8x1_SE_AF0EM4_GRVW8_NLCA1_NLCB1_SU0_SUS256_SRVW0_TT2_16_WG32_8_1_WGM2
    SolutionIndex: 356
    SolutionNameMin: Cijk_Ailk_Bjlk_BBH_MT32x64x16_MI16x16x8x1_SE_AF0EM4_GRVW2_NLCA1_NLCB1_SU0_SUS256_SRVW4_TT1_32_WG32_8_1_WGM2
    SolutionIndex: 357
    SolutionNameMin: Cijk_Ailk_Bjlk_BBH_MT64x64x16_MI32x32x4x1_SE_AF0EM1_GRVW2_NLCA1_NLCB1_SU0_SUS256_SRVW4_TT1_32_WG64_4_1_WGM15
    SolutionIndex: 358
    SolutionNameMin: Cijk_Ailk_Bjlk_BBH_MT128x96x32_MI32x32x4x1_SE_AF0EM1_GRVW4_NLCA1_NLCB3_SU32_SUS128_SRVW4_TT1_96_WG128_2_1_WGM2
    SolutionIndex: 359
    SolutionNameMin: Cijk_Ailk_Bjlk_BBH_MT32x32x16_MI16x16x8x1_SE_AF0EM4_GRVW2_NLCA1_NLCB1_SU16_SUS256_SRVW0_TT1_16_WG32_8_1_WGM2
    SolutionIndex: 360
    SolutionNameMin: Cijk_Ailk_Bjlk_BBH_MT64x64x32_MI32x32x4x1_SE_AF0EM1_GRVW8_NLCA1_NLCB1_SU32_SUS128_SRVW4_TT1_32_WG64_4_1_WGM2
    SolutionIndex: 361
    SolutionNameMin: Cijk_Ailk_Bjlk_BBH_MT64x64x32_MI32x32x4x1_SE_AF0EM1_GRVW4_NLCA1_NLCB1_SU32_SUS256_SRVW4_TT1_32_WG64_4_1_WGM2
    SolutionIndex: 362
    SolutionNameMin: Cijk_Ailk_Bjlk_BBH_MT128x96x32_MI32x32x4x1_SE_AF0EM1_GRVW4_NLCA1_NLCB3_SU16_SUS256_SRVW4_TT1_96_WG128_2_1_WGM15
    SolutionIndex: 363
    SolutionNameMin: Cijk_Ailk_Bjlk_BBH_MT128x96x16_MI32x32x4x1_SE_AF0EM4_GRVW2_NLCA1_NLCB3_SU16_SUS128_SRVW4_TT1_96_WG128_2_1_WGM2
    SolutionIndex: 364
    SolutionNameMin: Cijk_Ailk_Bjlk_BBH_MT64x80x64_MI16x16x8x1_SE_AF0EM4_GRVW2_NLCA1_NLCB5_SU16_SUS256_SRVW4_TT1_80_WG64_4_1_WGM15
    SolutionIndex: 365
    SolutionNameMin: Cijk_Ailk_Bjlk_BBH_MT32x64x16_MI16x16x8x1_SE_AF0EM1_GRVW2_NLCA1_NLCB1_SU16_SUS128_SRVW4_TT1_32_WG32_8_1_WGM1
    SolutionIndex: 366
    SolutionNameMin: Cijk_Ailk_Bjlk_BBH_MT64x64x64_MI32x32x4x1_SE_AF0EM4_GRVW8_NLCA1_NLCB1_SU32_SUS256_SRVW0_TT1_32_WG64_4_1_WGM1
    SolutionIndex: 367
    SolutionNameMin: Cijk_Ailk_Bjlk_BBH_MT64x64x64_MI32x32x4x1_SE_AF0EM4_GRVW8_NLCA1_NLCB1_SU0_SUS256_SRVW4_TT1_32_WG64_4_1_WGM15
    SolutionIndex: 368
    SolutionNameMin: Cijk_Ailk_Bjlk_BBH_MT64x64x32_MI32x32x4x1_SE_AF0EM4_GRVW4_NLCA1_NLCB1_SU0_SUS256_SRVW4_TT1_32_WG64_4_1_WGM1
    SolutionIndex: 369
    SolutionNameMin: Cijk_Ailk_Bjlk_BBH_MT64x64x32_MI32x32x4x1_SE_AF0EM4_GRVW2_NLCA1_NLCB1_SU0_SUS256_SRVW0_TT1_32_WG64_4_1_WGM15
    SolutionIndex: 370
    SolutionNameMin: Cijk_Ailk_Bjlk_BBH_MT128x80x64_MI16x16x8x1_SE_AF0EM4_GRVW2_NLCA1_NLCB5_SU16_SUS128_SRVW0_TT2_80_WG64_4_1_WGM15
    SolutionIndex: 371
    SolutionNameMin: Cijk_Ailk_Bjlk_BBH_MT64x64x64_MI32x32x4x1_SE_AF0EM1_GRVW4_NLCA1_NLCB1_SU32_SUS128_SRVW4_TT1_32_WG64_4_1_WGM2
    SolutionIndex: 372
    SolutionNameMin: Cijk_Ailk_Bjlk_BBH_MT64x64x64_MI32x32x4x1_SE_AF0EM1_GRVW8_NLCA1_NLCB1_SU32_SUS256_SRVW4_TT1_32_WG64_4_1_WGM1
    SolutionIndex: 373
    SolutionNameMin: Cijk_Ailk_Bjlk_BBH_MT64x64x32_MI32x32x4x1_SE_AF0EM1_GRVW8_NLCA1_NLCB1_SU16_SUS256_SRVW4_TT1_32_WG64_4_1_WGM2
    SolutionIndex: 374
    SolutionNameMin: Cijk_Ailk_Bjlk_BBH_MT32x32x64_MI16x16x8x1_SE_AF0EM1_GRVW4_NLCA1_NLCB1_SU0_SUS256_SRVW0_TT1_16_WG32_8_1_WGM1
    SolutionIndex: 375
    SolutionNameMin: Cijk_Ailk_Bjlk_BBH_MT64x32x16_MI16x16x8x1_SE_AF0EM4_GRVW2_NLCA1_NLCB1_SU0_SUS256_SRVW0_TT2_16_WG32_8_1_WGM2
    SolutionIndex: 376
    SolutionNameMin: Cijk_Ailk_Bjlk_BBH_MT64x32x16_MI16x16x8x1_SE_AF0EM1_GRVW4_NLCA1_NLCB1_SU0_SUS256_SRVW4_TT2_16_WG32_8_1_WGM1
    SolutionIndex: 377
    SolutionNameMin: Cijk_Ailk_Bjlk_BBH_MT128x128x32_MI32x32x4x1_SE_AF0EM4_GRVW8_NLCA1_NLCB1_SU32_SUS256_SRVW4_TT2_64_WG64_4_1_WGM15
    SolutionIndex: 378
    SolutionNameMin: Cijk_Ailk_Bjlk_BBH_MT128x64x32_MI32x32x2x2_SE_AF0EM1_GRVW8_NLCA1_NLCB1_SU0_SUS256_SRVW4_TT1_32_WG128_2_1_WGM2
    SolutionIndex: 379
    SolutionNameMin: Cijk_Ailk_Bjlk_BBH_MT64x64x32_MI32x32x4x1_SE_AF0EM4_GRVW4_NLCA1_NLCB1_SU0_SUS256_SRVW4_TT1_32_WG64_4_1_WGM2
    SolutionIndex: 380
    SolutionNameMin: Cijk_Ailk_Bjlk_BBH_MT64x64x64_MI32x32x4x1_SE_AF0EM1_GRVW8_NLCA1_NLCB1_SU16_SUS256_SRVW4_TT1_32_WG64_4_1_WGM15
    SolutionIndex: 381
    SolutionNameMin: Cijk_Ailk_Bjlk_BBH_MT128x64x32_MI32x32x2x2_SE_AF0EM4_ASBE01_GRVW4_PBD0_SRVW4_TT1_32_WG128_2_1_WGM4
    SolutionIndex: 382
    SolutionNameMin: Cijk_Ailk_Bjlk_BBH_MT64x64x32_MI32x32x4x1_SE_AF0EM1_ASBE01_GRVW4_PBD0_SRVW4_TT1_32_WG64_4_1_WGM1
    SolutionIndex: 383
    SolutionNameMin: Cijk_Ailk_Bjlk_BBH_MT128x128x32_MI32x32x4x1_SE_AF0EM8_ASBE01_GRVW8_PBD0_SRVW4_TT2_64_WG64_4_1_WGM1
    SolutionIndex: 384
    SolutionNameMin: Cijk_Ailk_Bjlk_BBH_MT64x64x32_MI32x32x4x1_SE_AF0EM4_ASBE01_GRVW2_PBD0_SRVW4_TT1_32_WG64_4_1_WGM10
    SolutionIndex: 385
    SolutionNameMin: Cijk_Ailk_Bjlk_BBH_MT64x64x32_MI16x16x8x1_SE_AF0EM1_ASBE01_GRVW2_PBD0_SRVW4_TT2_32_WG32_8_1_WGM4
    SolutionIndex: 386
    SolutionNameMin: Cijk_Ailk_Bjlk_BBH_MT64x128x32_MI32x32x4x1_SE_AF0EM1_ASBE01_GRVW4_PBD0_SRVW4_TT2_32_WG32_8_1_WGM4
    SolutionIndex: 387
    SolutionNameMin: Cijk_Ailk_Bjlk_BBH_MT64x128x32_MI32x32x4x1_SE_AF0EM8_ASBE01_GRVW8_PBD0_SRVW4_TT2_32_WG32_8_1_WGM4
    SolutionIndex: 388
    SolutionNameMin: Cijk_Ailk_Bjlk_BBH_MT64x64x32_MI32x32x4x1_SE_AF0EM1_ASBE01_GRVW4_PBD0_SRVW4_TT1_32_WG64_4_1_WGM10
    SolutionIndex: 389
    SolutionNameMin: Cijk_Ailk_Bjlk_BBH_MT64x128x32_MI32x32x4x1_SE_AF0EM8_ASBE01_GRVW8_PBD0_SRVW4_TT2_32_WG32_8_1_WGM1
    SolutionIndex: 390
    SolutionNameMin: Cijk_Ailk_Bjlk_BBH_MT64x64x32_MI16x16x8x1_SE_AF0EM1_ASBE01_GRVW4_PBD0_SRVW4_TT2_32_WG32_8_1_WGM1
    SolutionIndex: 391
    SolutionNameMin: Cijk_Ailk_Bjlk_BBH_MT128x128x32_MI32x32x4x1_SE_AF0EM8_ASBE01_GRVW4_PBD0_SRVW4_TT2_64_WG64_4_1_WGM1
    SolutionIndex: 392
    SolutionNameMin: Cijk_Ailk_Bjlk_BBH_MT128x128x32_MI32x32x4x1_SE_AF0EM4_ASBE01_GRVW4_PBD0_SRVW4_TT2_64_WG64_4_1_WGM10
    SolutionIndex: 393
    SolutionNameMin: Cijk_Ailk_Bjlk_BBH_MT64x128x32_MI32x32x2x2_SE_AF0EM1_ASBE01_GRVW4_PBD0_SRVW4_TT1_32_WG64_4_1_WGM1
    SolutionIndex: 394
    SolutionNameMin: Cijk_Ailk_Bjlk_BBH_MT64x128x32_MI32x32x4x1_SE_AF0EM8_ASBE01_GRVW8_PBD0_SRVW4_TT2_32_WG32_8_1_WGM10
    SolutionIndex: 395
    SolutionNameMin: Cijk_Ailk_Bjlk_BBH_MT64x64x32_MI16x16x8x1_SE_AF0EM1_ASBE01_GRVW2_PBD0_SRVW4_TT2_32_WG32_8_1_WGM1
    SolutionIndex: 396
    SolutionNameMin: Cijk_Ailk_Bjlk_BBH_MT64x64x32_MI32x32x4x1_SE_AF0EM1_ASBE01_GRVW4_PBD0_SRVW4_TT1_32_WG64_4_1_WGM4
    SolutionIndex: 397
    SolutionNameMin: Cijk_Ailk_Bjlk_BBH_MT64x64x32_MI32x32x4x1_SE_AF0EM8_ASBE01_GRVW8_PBD0_SRVW4_TT1_32_WG64_4_1_WGM1
    SolutionIndex: 398
    SolutionNameMin: Cijk_Ailk_Bjlk_BBH_MT128x128x32_MI32x32x4x1_SE_AF0EM8_ASBE01_GRVW8_PBD0_SRVW4_TT2_64_WG64_4_1_WGM4
    SolutionIndex: 399
    SolutionNameMin: Cijk_Ailk_Bjlk_BBH_MT64x128x32_MI32x32x4x1_SE_AF0EM1_ASBE01_GRVW4_PBD0_SRVW4_TT2_32_WG32_8_1_WGM1
    SolutionIndex: 400
    SolutionNameMin: Cijk_Ailk_Bjlk_BBH_MT128x128x32_MI32x32x4x1_SE_AF0EM1_ASBE01_GRVW4_PBD0_SRVW4_TT2_64_WG64_4_1_WGM1
    SolutionIndex: 401
    SolutionNameMin: Cijk_Ailk_Bjlk_BBH_MT64x64x32_MI16x16x8x1_SE_AF0EM1_ASBE01_GRVW2_PBD0_SRVW4_TT2_32_WG32_8_1_WGM10
    SolutionIndex: 402
    SolutionNameMin: Cijk_Ailk_Bjlk_BBH_MT128x64x32_MI32x32x4x1_SE_AF0EM4_ASBE01_GRVW4_PBD0_SRVW4_TT2_32_WG64_4_1_WGM10
    SolutionIndex: 403
    SolutionNameMin: Cijk_Ailk_Bjlk_BBH_MT128x64x32_MI32x32x4x1_SE_AF0EM4_ASBE01_GRVW4_PBD0_SRVW4_TT2_32_WG64_4_1_WGM4
    SolutionIndex: 404
    SolutionNameMin: Cijk_Ailk_Bjlk_BBH_MT64x64x32_MI32x32x4x1_SE_AF0EM8_ASBE01_GRVW4_PBD0_SRVW4_TT1_32_WG64_4_1_WGM1
    SolutionIndex: 405
    SolutionNameMin: Cijk_Ailk_Bjlk_BBH_MT128x128x32_MI32x32x4x1_SE_AF0EM4_ASBE01_GRVW4_PBD0_SRVW4_TT2_64_WG64_4_1_WGM1
    SolutionIndex: 406
    SolutionNameMin: Cijk_Ailk_Bjlk_BBH_MT64x64x32_MI32x32x4x1_SE_AF0EM4_ASBE01_GRVW2_PBD0_SRVW4_TT1_32_WG64_4_1_WGM1
    SolutionIndex: 407
    SolutionNameMin: Cijk_Ailk_Bjlk_BBH_MT64x64x32_MI32x32x4x1_SE_AF0EM8_ASBE01_GRVW2_PBD0_SRVW4_TT1_32_WG64_4_1_WGM1
    SolutionIndex: 408
    SolutionNameMin: Cijk_Ailk_Bjlk_BBH_MT64x64x32_MI16x16x8x1_SE_AF0EM1_ASBE01_GRVW4_PBD0_SRVW4_TT2_32_WG32_8_1_WGM4
    SolutionIndex: 409
    SolutionNameMin: Cijk_Ailk_Bjlk_BBH_MT64x64x32_MI32x32x4x1_SE_AF0EM8_ASBE01_GRVW8_PBD0_SRVW4_TT1_32_WG64_4_1_WGM10
    SolutionIndex: 410
    SolutionNameMin: Cijk_Ailk_Bjlk_BBH_MT64x64x32_MI16x16x8x1_SE_AF0EM1_ASBE01_GRVW4_PBD0_SRVW4_TT2_32_WG32_8_1_WGM10
    SolutionIndex: 411
    SolutionNameMin: Cijk_Ailk_Bjlk_BBH_MT64x64x32_MI32x32x4x1_SE_AF0EM8_ASBE01_GRVW2_PBD0_SRVW4_TT1_32_WG64_4_1_WGM10
    SolutionIndex: 412
    SolutionNameMin: Cijk_Ailk_Bjlk_BBH_MT128x128x32_MI32x32x4x1_SE_AF0EM1_ASBE01_GRVW4_PBD0_SRVW4_TT2_64_WG64_4_1_WGM10
    SolutionIndex: 413
    SolutionNameMin: Cijk_Ailk_Bjlk_BBH_MT128x128x32_MI32x32x4x1_SE_AF0EM4_ASBE01_GRVW4_PBD0_SRVW4_TT2_64_WG64_4_1_WGM4
    SolutionIndex: 414
    SolutionNameMin: Cijk_Ailk_Bjlk_BBH_MT64x64x32_MI16x16x8x1_SE_AF0EM8_ASBE01_GRVW8_PBD0_SRVW4_TT2_32_WG32_8_1_WGM1
- - - [34, 64, 1, 34]
    - [13, 0.008]
  - - [32, 64, 1, 35]
    - [12, 0.006]
  - - [64, 21, 1, 17]
    - [9, 0.002]
  - - [64, 32, 1, 35]
    - [12, 0.006]
  - - [21, 64, 1, 21]
    - [11, 0.003]
  - - [64, 30, 1, 31]
    - [12, 0.005]
  - - [15, 64, 1, 15]
    - [5, 0.001]
  - - [64, 24, 1, 24]
    - [12, 0.004]
  - - [17, 64, 1, 15]
    - [18, 0.002]
  - - [64, 35, 1, 35]
    - [9, 0.006]
  - - [32, 64, 1, 32]
    - [13, 0.007]
  - - [64, 34, 1, 24]
    - [12, 0.005]
  - - [64, 15, 1, 15]
    - [7, 0.001]
  - - [30, 64, 1, 30]
    - [24, 0.006]
  - - [30, 64, 1, 31]
    - [18, 0.007]
  - - [34, 64, 1, 24]
    - [25, 0.007]
  - - [64, 30, 1, 30]
    - [12, 0.005]
  - - [14, 64, 1, 14]
    - [5, 0.001]
  - - [64, 17, 1, 17]
    - [6, 0.001]
  - - [64, 17, 1, 15]
    - [6, 0.001]
  - - [64, 32, 1, 32]
    - [10, 0.007]
  - - [64, 31, 1, 31]
    - [12, 0.005]
  - - [17, 64, 1, 17]
    - [11, 0.002]
  - - [64, 21, 1, 21]
    - [6, 0.002]
  - - [35, 64, 1, 35]
    - [13, 0.008]
  - - [31, 64, 1, 31]
    - [18, 0.007]
  - - [21, 64, 1, 17]
    - [13, 0.003]
  - - [64, 15, 1, 15]
    - [7, 0.001]
  - - [64, 17, 1, 17]
    - [6, 0.001]
  - - [17, 64, 1, 17]
    - [11, 0.002]
  - - [64, 34, 1, 34]
    - [27, 0.007]
  - - [15, 64, 1, 14]
    - [8, 0.001]
  - - [24, 64, 1, 24]
    - [13, 0.004]
  - - [64, 14, 1, 14]
    - [8, 0.001]
  - - [15, 64, 1, 15]
    - [5, 0.001]
  - - [64, 15, 1, 14]
    - [9, 0.001]
  - - [64, 128, 512, 128]
    - [357, 33.606]
  - - [64, 512, 1, 512]
    - [196, 3.108]
  - - [64, 512, 64, 512]
    - [231, 48.31]
  - - [128, 64, 512, 128]
    - [252, 33.383]
  - - [512, 64, 1, 512]
    - [217, 3.171]
  - - [512, 64, 64, 512]
    - [285, 48.544]
  - - [1024, 2, 1, 4]
    - [212, 0.003]
  - - [1024, 2, 1, 32]
    - [198, 0.021]
  - - [1024, 2, 1, 2048]
    - [312, 0.356]
  - - [1024, 1024, 1, 4]
    - [189, 1.006]
  - - [1024, 1024, 1, 32]
    - [376, 8.264]
  - - [1024, 1024, 1, 2048]
    - [278, 57.174]
  - - [1024, 1024, 1, 4096]
    - [251, 64.004]
  - - [1024, 4096, 1, 2048]
    - [188, 84.977]
  - - [1024, 4096, 1, 4096]
    - [315, 87.401]
  - - [1024, 30528, 1, 2048]
    - [186, 94.718]
  - - [1024, 30528, 1, 4096]
    - [255, 95.904]
  - - [4096, 1024, 1, 2048]
    - [293, 84.797]
  - - [4096, 1024, 1, 4096]
    - [293, 87.952]
  - - [3, 64, 512, 3]
    - [228, 0.064]
  - - [5, 64, 512, 5]
    - [304, 0.178]
  - - [5, 64, 960, 5]
    - [208, 0.24]
  - - [9, 64, 512, 9]
    - [228, 0.541]
  - - [13, 512, 1, 32768]
    - [297, 1.488]
  - - [27, 128, 32768, 27]
    - [365, 9.827]
  - - [33, 32, 200, 33]
    - [250, 1.693]
  - - [33, 32, 1600, 33]
    - [245, 5.018]
  - - [67, 2048, 1, 512]
    - [374, 10.354]
  - - [74, 2048, 1, 512]
    - [311, 11.258]
  - - [74, 2048, 1, 960]
    - [352, 14.183]
  - - [100, 2048, 1, 512]
    - [309, 13.919]
  - - [256, 128, 1, 32768]
    - [239, 7.699]
  - - [256, 1280, 1, 8976]
    - [192, 49.595]
  - - [256, 2560, 1, 8976]
    - [197, 58.534]
  - - [256, 2816, 1, 8976]
    - [326, 64.318]
  - - [256, 3328, 1, 8976]
    - [279, 75.214]
  - - [256, 3584, 1, 8976]
    - [271, 81.127]
  - - [256, 3840, 1, 8976]
    - [319, 86.061]
  - - [256, 4096, 1, 8976]
    - [249, 66.982]
  - - [256, 4352, 1, 8976]
    - [249, 71.495]
  - - [256, 4864, 1, 8976]
    - [335, 77.021]
  - - [256, 5120, 1, 8976]
    - [278, 81.106]
  - - [256, 5632, 1, 8976]
    - [246, 88.693]
  - - [256, 5888, 1, 8976]
    - [295, 71.716]
  - - [256, 6144, 1, 8976]
    - [377, 74.603]
  - - [256, 7168, 1, 8976]
    - [253, 86.694]
  - - [256, 8192, 1, 8976]
    - [298, 80.182]
  - - [256, 8960, 1, 8976]
    - [282, 86.753]
  - - [256, 9728, 1, 8976]
    - [246, 80.104]
  - - [256, 9984, 1, 8976]
    - [243, 82.544]
  - - [256, 10240, 1, 8976]
    - [246, 83.902]
  - - [256, 10496, 1, 8976]
    - [256, 85.952]
  - - [256, 11008, 1, 8976]
    - [278, 90.092]
  - - [256, 11264, 1, 8976]
    - [215, 92.134]
  - - [256, 11520, 1, 8976]
    - [243, 94.698]
  - - [256, 11776, 1, 8976]
    - [345, 77.029]
  - - [256, 12544, 1, 8976]
    - [369, 79.76]
  - - [256, 12800, 1, 8976]
    - [333, 80.355]
  - - [256, 13312, 1, 8976]
    - [203, 83.252]
  - - [256, 13568, 1, 8976]
    - [203, 84.878]
  - - [256, 14336, 1, 8976]
    - [253, 89.397]
  - - [256, 14848, 1, 8976]
    - [203, 92.495]
  - - [256, 15104, 1, 8976]
    - [253, 94.036]
  - - [256, 15872, 1, 8976]
    - [223, 87.561]
  - - [256, 16128, 1, 8976]
    - [243, 89.225]
  - - [256, 17152, 1, 8976]
    - [246, 94.368]
  - - [256, 17408, 1, 8976]
    - [332, 85.136]
  - - [256, 18688, 1, 8976]
    - [266, 91.034]
  - - [256, 19968, 1, 8976]
    - [203, 83.768]
  - - [256, 20480, 1, 8976]
    - [253, 85.874]
  - - [256, 20992, 1, 8976]
    - [203, 87.816]
  - - [256, 21248, 1, 8976]
    - [203, 88.8]
  - - [256, 22016, 1, 8976]
    - [203, 91.992]
  - - [256, 26112, 1, 8976]
    - [277, 90.399]
  - - [256, 32512, 1, 8976]
    - [223, 90.393]
  - - [256, 32768, 1, 1]
    - [252, 0.744]
  - - [256, 33536, 1, 8976]
    - [246, 93.155]
  - - [256, 44505, 1, 8976]
    - [255, 93.124]
  - - [257, 4096, 1, 1024]
    - [284, 42.565]
  - - [480, 1024, 1, 32768]
    - [323, 53.269]
  - - [512, 32, 1, 200]
    - [217, 0.681]
  - - [512, 32, 1, 1600]
    - [263, 2.49]
  - - [512, 256, 1, 32768]
    - [355, 26.28]
  - - [512, 512, 1, 200]
    - [308, 9.716]
  - - [512, 512, 1, 1600]
    - [380, 27.258]
  - - [512, 2048, 1, 256]
    - [368, 33.72]
  - - [560, 1024, 1, 200]
    - [273, 16.64]
  - - [560, 1024, 1, 1600]
    - [366, 43.366]
  - - [768, 2048, 1, 256]
    - [261, 43.065]
  - - [1024, 64, 1, 512]
    - [202, 6.28]
  - - [1024, 64, 1, 960]
    - [254, 8.011]
  - - [1024, 256, 1, 1024]
    - [291, 22.734]
  - - [1024, 256, 1, 1280]
    - [353, 25.324]
  - - [1024, 256, 1, 2304]
    - [193, 31.142]
  - - [1024, 256, 1, 2816]
    - [192, 33.374]
  - - [1024, 256, 1, 3072]
    - [264, 34.024]
  - - [1024, 256, 1, 3328]
    - [238, 35.267]
  - - [1024, 256, 1, 3584]
    - [264, 35.887]
  - - [1024, 256, 1, 4096]
    - [235, 36.942]
  - - [1024, 256, 1, 4352]
    - [226, 37.462]
  - - [1024, 256, 1, 4608]
    - [264, 38.127]
  - - [1024, 256, 1, 5120]
    - [235, 38.768]
  - - [1024, 256, 1, 5376]
    - [192, 39.019]
  - - [1024, 256, 1, 5632]
    - [225, 39.876]
  - - [1024, 256, 1, 6144]
    - [334, 39.98]
  - - [1024, 256, 1, 6400]
    - [235, 40.31]
  - - [1024, 256, 1, 7680]
    - [238, 41.454]
  - - [1024, 256, 1, 7936]
    - [219, 41.644]
  - - [1024, 256, 1, 8192]
    - [301, 41.912]
  - - [1024, 256, 1, 8448]
    - [327, 42.038]
  - - [1024, 256, 1, 9728]
    - [193, 42.962]
  - - [1024, 256, 1, 9984]
    - [193, 43.084]
  - - [1024, 256, 1, 10496]
    - [235, 43.167]
  - - [1024, 256, 1, 11520]
    - [193, 43.412]
  - - [1024, 256, 1, 12032]
    - [238, 43.697]
  - - [1024, 256, 1, 13568]
    - [193, 44.204]
  - - [1024, 256, 1, 14336]
    - [225, 44.323]
  - - [1024, 256, 1, 14848]
    - [325, 44.531]
  - - [1024, 256, 1, 15104]
    - [192, 44.616]
  - - [1024, 256, 1, 15872]
    - [226, 44.603]
  - - [1024, 256, 1, 16128]
    - [192, 44.733]
  - - [1024, 256, 1, 17152]
    - [219, 44.883]
  - - [1024, 256, 1, 17408]
    - [235, 45.095]
  - - [1024, 256, 1, 18944]
    - [235, 45.164]
  - - [1024, 256, 1, 19712]
    - [226, 45.471]
  - - [1024, 256, 1, 19968]
    - [219, 45.42]
  - - [1024, 256, 1, 21248]
    - [226, 45.446]
  - - [1024, 256, 1, 21504]
    - [193, 45.537]
  - - [1024, 256, 1, 22016]
    - [225, 45.464]
  - - [1024, 256, 1, 28672]
    - [193, 46.169]
  - - [1024, 256, 1, 33536]
    - [219, 46.455]
  - - [1024, 512, 1, 32768]
    - [364, 55.795]
  - - [1024, 1024, 1, 200]
    - [379, 26.885]
  - - [1024, 1024, 1, 512]
    - [302, 43.689]
  - - [1024, 1024, 1, 960]
    - [360, 51.059]
  - - [1024, 1024, 1, 1600]
    - [305, 54.802]
  - - [1024, 1024, 1, 32768]
    - [351, 72.535]
  - - [1600, 1024, 1, 512]
    - [338, 55.285]
  - - [1600, 1024, 1, 960]
    - [275, 63.858]
  - - [2048, 256, 1, 1024]
    - [372, 36.942]
  - - [2048, 960, 1, 1]
    - [265, 0.413]
  - - [2048, 2048, 1, 512]
    - [223, 69.419]
  - - [2048, 2048, 1, 960]
    - [191, 78.832]
  - - [2048, 2048, 1, 1024]
    - [223, 79.908]
  - - [3200, 2048, 1, 1024]
    - [336, 82.527]
  - - [4096, 4096, 1, 1024]
    - [186, 88.508]
  - - [14, 64, 10880, 14]
    - [228, 3.246]
  - - [15, 64, 10880, 14]
    - [228, 3.421]
  - - [15, 64, 7680, 15]
    - [294, 3.49]
  - - [15, 64, 10880, 15]
    - [228, 3.652]
  - - [17, 64, 7680, 15]
    - [258, 3.871]
  - - [17, 64, 6144, 17]
    - [241, 3.839]
  - - [17, 64, 7680, 17]
    - [340, 4.053]
  - - [21, 64, 6144, 17]
    - [234, 4.287]
  - - [21, 64, 6144, 21]
    - [260, 5.235]
  - - [24, 64, 4736, 24]
    - [299, 8.785]
  - - [30, 64, 2048, 30]
    - [337, 7.311]
  - - [30, 64, 2048, 31]
    - [244, 7.481]
  - - [31, 64, 2048, 31]
    - [232, 7.391]
  - - [32, 64, 4608, 32]
    - [292, 14.06]
  - - [32, 64, 4608, 35]
    - [194, 11.687]
  - - [34, 64, 4736, 24]
    - [314, 7.024]
  - - [34, 64, 4736, 34]
    - [228, 8.851]
  - - [35, 64, 4608, 35]
    - [228, 8.816]
  - - [64, 14, 10880, 14]
    - [259, 4.08]
  - - [64, 15, 10880, 14]
    - [375, 4.338]
  - - [64, 15, 7680, 15]
    - [259, 4.443]
  - - [64, 15, 10880, 15]
    - [259, 4.663]
  - - [64, 17, 7680, 15]
    - [259, 4.98]
  - - [64, 17, 6144, 17]
    - [210, 4.727]
  - - [64, 17, 7680, 17]
    - [317, 5.275]
  - - [64, 21, 6144, 17]
    - [199, 5.651]
  - - [64, 21, 6144, 21]
    - [210, 6.804]
  - - [64, 24, 4736, 24]
    - [199, 8.599]
  - - [64, 30, 2048, 30]
    - [259, 9.316]
  - - [64, 30, 2048, 31]
    - [259, 9.546]
  - - [64, 31, 2048, 31]
    - [331, 9.583]
  - - [64, 32, 4608, 32]
    - [330, 14.382]
  - - [64, 32, 4608, 35]
    - [230, 11.513]
  - - [64, 34, 4736, 24]
    - [276, 8.009]
  - - [64, 34, 4736, 34]
    - [268, 10.167]
  - - [64, 35, 4608, 35]
    - [257, 10.418]
  - - [1024, 1024, 1, 3840]
    - [200, 63.49]
  - - [1024, 1024, 1, 3968]
    - [190, 63.885]
  - - [1024, 1024, 1, 6528]
    - [201, 67.465]
  - - [1024, 1024, 1, 7104]
    - [249, 68.144]
  - - [1024, 1024, 1, 7200]
    - [201, 65.877]
  - - [1024, 1024, 1, 8064]
    - [251, 68.87]
  - - [1024, 1024, 1, 8160]
    - [251, 66.7]
  - - [1024, 1024, 1, 9216]
    - [190, 69.46]
  - - [1024, 1024, 1, 9520]
    - [213, 67.474]
  - - [1024, 1024, 1, 10064]
    - [249, 68.085]
  - - [1024, 1024, 1, 10080]
    - [213, 67.982]
  - - [1024, 1024, 1, 10200]
    - [249, 68.112]
  - - [1024, 4096, 1, 3840]
    - [191, 87.1]
  - - [1024, 4096, 1, 3968]
    - [188, 87.822]
  - - [1024, 4096, 1, 6528]
    - [188, 88.97]
  - - [1024, 4096, 1, 7104]
    - [188, 89.373]
  - - [1024, 4096, 1, 7200]
    - [191, 89.138]
  - - [1024, 4096, 1, 8064]
    - [191, 89.389]
  - - [1024, 4096, 1, 8160]
    - [191, 89.355]
  - - [1024, 4096, 1, 9216]
    - [191, 89.74]
  - - [1024, 4096, 1, 9520]
    - [274, 89.097]
  - - [1024, 4096, 1, 10064]
    - [274, 89.535]
  - - [1024, 4096, 1, 10080]
    - [248, 89.728]
  - - [1024, 4096, 1, 10200]
    - [188, 89.228]
  - - [1024, 42720, 1, 3968]
    - [215, 95.377]
  - - [1024, 42720, 1, 6528]
    - [243, 95.744]
  - - [1024, 42720, 1, 7104]
    - [243, 95.8]
  - - [1024, 42720, 1, 7200]
    - [243, 95.812]
  - - [1024, 42720, 1, 9520]
    - [243, 95.729]
  - - [1024, 42720, 1, 10080]
    - [243, 95.96]
  - - [4096, 1024, 1, 3840]
    - [293, 87.377]
  - - [4096, 1024, 1, 3968]
    - [307, 87.426]
  - - [4096, 1024, 1, 6528]
    - [307, 88.894]
  - - [4096, 1024, 1, 7104]
    - [188, 89.074]
  - - [4096, 1024, 1, 7200]
    - [191, 89.026]
  - - [4096, 1024, 1, 8064]
    - [191, 89.439]
  - - [4096, 1024, 1, 8160]
    - [188, 89.33]
  - - [4096, 1024, 1, 9216]
    - [211, 89.541]
  - - [4096, 1024, 1, 9520]
    - [316, 88.749]
  - - [4096, 1024, 1, 10064]
    - [211, 89.192]
  - - [4096, 1024, 1, 10080]
    - [191, 89.494]
  - - [4096, 1024, 1, 10200]
    - [247, 88.921]
  - - [27, 64, 1920, 27]
    - [65, 3.275]
  - - [27, 64, 1920, 33]
    - [63, 3.57]
  - - [33, 64, 1920, 33]
    - [37, 3.548]
  - - [64, 27, 1920, 27]
    - [50, 2.525]
  - - [64, 27, 1920, 33]
    - [62, 2.903]
  - - [64, 33, 1920, 33]
    - [32, 3.716]
  - - [1024, 1024, 1, 3240]
    - [68, 26.989]
  - - [1024, 1024, 1, 3960]
    - [53, 27.424]
  - - [1024, 4096, 1, 3240]
    - [69, 38.306]
  - - [1024, 4096, 1, 3960]
    - [52, 38.342]
  - - [1024, 42720, 1, 3960]
    - [64, 45.984]
  - - [4096, 1024, 1, 3240]
    - [48, 38.398]
  - - [4096, 1024, 1, 3960]
    - [48, 38.589]
  - - [64, 1280, 64, 192]
    - [411, 46.868]
  - - [64, 1280, 64, 320]
    - [394, 56.887]
  - - [64, 1280, 64, 384]
    - [387, 60.099]
  - - [64, 1280, 64, 448]
    - [389, 62.893]
  - - [64, 2048, 64, 192]
    - [384, 50.325]
  - - [64, 2048, 64, 320]
    - [389, 60.753]
  - - [64, 2048, 64, 384]
    - [389, 64.002]
  - - [64, 2048, 64, 448]
    - [387, 66.609]
  - - [1225, 192, 64, 32]
    - [410, 21.065]
  - - [1225, 192, 64, 48]
    - [395, 19.155]
  - - [1225, 192, 64, 64]
    - [408, 33.329]
  - - [1225, 256, 64, 48]
    - [412, 20.397]
  - - [1225, 256, 64, 64]
    - [390, 34.593]
  - - [1225, 288, 64, 48]
    - [385, 17.952]
  - - [1225, 288, 64, 64]
    - [390, 30.805]
  - - [5329, 64, 64, 80]
    - [395, 25.573]
  - - [289, 768, 64, 128]
    - [399, 44.369]
  - - [289, 768, 64, 160]
    - [399, 49.235]
  - - [289, 768, 64, 192]
    - [399, 53.009]
  - - [64, 1280, 32, 192]
    - [406, 42.056]
  - - [64, 1280, 32, 320]
    - [386, 51.478]
  - - [64, 1280, 32, 384]
    - [389, 54.454]
  - - [64, 1280, 32, 448]
    - [394, 56.798]
  - - [64, 2048, 32, 192]
    - [407, 44.993]
  - - [64, 2048, 32, 320]
    - [394, 53.563]
  - - [64, 2048, 32, 384]
    - [387, 56.664]
  - - [64, 2048, 32, 448]
    - [389, 59.813]
  - - [1225, 192, 32, 32]
    - [390, 17.678]
  - - [1225, 192, 32, 48]
    - [401, 17.472]
  - - [1225, 192, 32, 64]
    - [390, 28.713]
  - - [1225, 256, 32, 48]
    - [400, 18.031]
  - - [1225, 256, 32, 64]
    - [390, 30.588]
  - - [1225, 288, 32, 48]
    - [385, 17.162]
  - - [1225, 288, 32, 64]
    - [390, 28.47]
  - - [5329, 64, 32, 80]
    - [401, 24.21]
  - - [289, 768, 32, 128]
    - [382, 38.323]
  - - [289, 768, 32, 160]
    - [393, 43.143]
  - - [289, 768, 32, 192]
    - [386, 47.886]
  - - [3136, 64, 64, 256]
    - [411, 58.173]
  - - [3136, 64, 64, 64]
    - [397, 35.866]
  - - [3136, 256, 64, 64]
    - [383, 50.739]
  - - [784, 128, 64, 512]
    - [387, 71.152]
  - - [784, 512, 64, 128]
    - [383, 61.301]
  - - [196, 256, 64, 1024]
    - [402, 54.903]
  - - [196, 1024, 64, 256]
    - [392, 57.682]
  - - [49, 512, 64, 2048]
    - [382, 45.624]
  - - [49, 2048, 64, 512]
    - [390, 44.859]
  - - [3136, 64, 32, 256]
    - [404, 54.178]
  - - [3136, 64, 32, 64]
    - [409, 29.704]
  - - [3136, 256, 32, 64]
    - [398, 45.321]
  - - [784, 128, 32, 512]
    - [394, 61.794]
  - - [784, 512, 32, 128]
    - [383, 53.149]
  - - [196, 256, 32, 1024]
    - [396, 47.126]
  - - [196, 1024, 32, 256]
    - [405, 49.396]
  - - [49, 512, 32, 2048]
    - [382, 38.562]
  - - [49, 2048, 32, 512]
    - [382, 41.642]
  - - [3136, 64, 64, 128]
    - [397, 46.91]
  - - [3136, 128, 64, 256]
    - [383, 77.76]
  - - [784, 256, 64, 512]
    - [389, 76.03]
  - - [3136, 256, 64, 128]
    - [383, 73.139]
  - - [3136, 256, 64, 256]
    - [391, 83.312]
  - - [196, 512, 64, 1024]
    - [403, 62.738]
  - - [784, 512, 64, 256]
    - [383, 73.009]
  - - [784, 512, 64, 512]
    - [387, 78.956]
  - - [196, 1024, 64, 512]
    - [413, 64.111]
  - - [196, 1024, 64, 1024]
    - [392, 67.209]
  - - [49, 1024, 64, 2048]
    - [388, 53.287]
  - - [49, 2048, 64, 1024]
    - [393, 53.519]
  - - [3136, 64, 32, 128]
    - [414, 42.271]
  - - [3136, 128, 32, 256]
    - [397, 71.234]
  - - [784, 256, 32, 512]
    - [389, 71.733]
  - - [3136, 256, 32, 128]
    - [405, 65.826]
  - - [3136, 256, 32, 256]
    - [383, 79.724]
  - - [196, 512, 32, 1024]
    - [403, 55.1]
  - - [784, 512, 32, 256]
    - [383, 66.754]
  - - [784, 512, 32, 512]
    - [394, 74.921]
  - - [196, 1024, 32, 512]
    - [381, 57.2]
  - - [196, 1024, 32, 1024]
    - [403, 62.548]
  - - [49, 1024, 32, 2048]
    - [388, 48.121]
  - - [49, 2048, 32, 1024]
    - [396, 48.234]
  - - [64, 128, 624, 128]
    - [187, 34.891]
  - - [1024, 1024, 1, 1024]
    - [305, 52.61]
  - - [1024, 1024, 1, 1280]
    - [204, 52.555]
  - - [1024, 1024, 1, 39]
    - [189, 8.601]
  - - [1024, 4096, 1, 2560]
    - [188, 85.737]
  - - [1024, 4096, 1, 1024]
    - [191, 79.2]
  - - [33, 32, 1, 33]
    - [212, 0.009]
  - - [1024, 2, 1, 4992]
    - [312, 0.476]
  - - [64, 128, 144, 128]
    - [195, 24.574]
  - - [512, 512, 1, 512]
    - [196, 17.944]
  - - [1024, 2, 1, 39]
    - [198, 0.022]
  - - [1024, 1024, 1, 8192]
    - [201, 68.795]
  - - [1024, 960, 1, 1024]
    - [367, 62.595]
  - - [1024, 1024, 1, 308]
    - [206, 32.324]
  - - [1024, 2, 1, 5]
    - [212, 0.003]
  - - [1024, 1024, 1, 4992]
    - [200, 65.886]
  - - [4096, 3840, 1, 4096]
    - [287, 96.496]
  - - [4096, 1024, 1, 3072]
    - [247, 86.407]
  - - [64, 512, 96, 512]
    - [318, 54.415]
  - - [1024, 1024, 1, 5248]
    - [200, 66.151]
  - - [4096, 1024, 1, 4992]
    - [211, 88.362]
  - - [1024, 1024, 1, 180]
    - [289, 24.878]
  - - [5, 64, 1, 5]
    - [288, 0.0]
  - - [4096, 1024, 1, 2560]
    - [211, 85.994]
  - - [1024, 33712, 1, 9600]
    - [255, 95.054]
  - - [64, 128, 640, 128]
    - [242, 35.184]
  - - [1024, 1024, 1, 5]
    - [321, 1.243]
  - - [4, 64, 32768, 4]
    - [216, 0.418]
  - - [1024, 2, 1, 40]
    - [198, 0.024]
  - - [1024, 30522, 1, 160]
    - [324, 74.166]
  - - [1024, 1024, 1, 800]
    - [361, 48.759]
  - - [1024, 1024, 1, 41]
    - [233, 8.56]
  - - [1024, 2, 1, 5248]
    - [312, 0.473]
  - - [4096, 4096, 1, 4096]
    - [221, 91.721]
  - - [1024, 30522, 1, 385]
    - [281, 86.125]
  - - [1024, 4096, 1, 9600]
    - [329, 89.717]
  - - [2048, 512, 1, 1]
    - [189, 0.273]
  - - [1024, 4096, 1, 1152]
    - [191, 80.245]
  - - [1024, 2, 1, 512]
    - [224, 0.178]
  - - [64, 4, 38400, 4]
    - [267, 0.437]
  - - [1024, 30522, 1, 180]
    - [281, 75.211]
  - - [4096, 1024, 1, 512]
    - [188, 70.024]
  - - [4096, 1024, 1, 1024]
    - [315, 78.967]
  - - [4, 64, 38400, 4]
    - [216, 0.421]
  - - [1024, 2, 1, 9]
    - [198, 0.006]
  - - [8192, 8192, 1, 8192]
    - [223, 95.991]
  - - [4096, 1024, 1, 1280]
    - [316, 80.97]
  - - [1024, 1024, 1, 3072]
    - [200, 61.647]
  - - [64, 128, 656, 128]
    - [296, 35.762]
  - - [1024, 4096, 1, 4992]
    - [191, 88.064]
  - - [1024, 1024, 1, 9]
    - [189, 2.209]
  - - [1024, 4096, 1, 512]
    - [191, 68.59]
  - - [64, 512, 16, 512]
    - [222, 29.554]
  - - [1024, 2, 1, 6]
    - [198, 0.004]
  - - [2048, 1920, 1, 2048]
    - [203, 91.294]
  - - [1024, 30522, 1, 780]
    - [283, 91.111]
  - - [64, 128, 128, 128]
    - [222, 22.632]
  - - [1024, 30522, 1, 800]
    - [280, 91.887]
  - - [960, 1024, 1, 1024]
    - [204, 66.109]
  - - [1024, 1024, 1, 6]
    - [189, 1.55]
  - - [8192, 7680, 1, 8192]
    - [287, 97.421]
  - - [1024, 2, 1, 1152]
    - [300, 0.268]
  - - [1024, 1024, 1, 2560]
    - [190, 59.318]
  - - [1024, 1024, 1, 77]
    - [252, 13.738]
  - - [1024, 1024, 1, 160]
    - [344, 27.305]
  - - [1024, 4096, 1, 8192]
    - [350, 89.419]
  - - [1024, 2, 1, 41]
    - [339, 0.024]
  - - [128, 64, 1, 128]
    - [227, 0.298]
  - - [480, 512, 1, 512]
    - [227, 21.217]
  - - [1024, 1024, 1, 462]
    - [348, 38.583]
  - - [1024, 1024, 1, 780]
    - [349, 45.696]
  - - [1024, 4096, 1, 5248]
    - [191, 88.371]
  - - [1024, 4096, 1, 1280]
    - [188, 81.036]
  - - [4096, 1024, 1, 9600]
    - [191, 89.644]
  - - [64, 512, 80, 512]
    - [296, 55.333]
  - - [4096, 1024, 1, 1152]
    - [262, 80.387]
  - - [1024, 1600, 1, 1]
    - [320, 0.379]
  - - [1024, 1024, 1, 820]
    - [305, 46.112]
  - - [1024, 2, 1, 2560]
    - [312, 0.386]
  - - [4096, 1024, 1, 5248]
    - [293, 88.334]
  - - [1024, 33712, 1, 8192]
    - [255, 94.889]
  - - [1024, 1024, 1, 385]
    - [214, 36.327]
  - - [1024, 1024, 1, 1]
    - [356, 0.27]
  - - [1024, 2, 1, 10]
    - [212, 0.006]
  - - [64, 4, 32768, 4]
    - [267, 0.433]
  - - [1024, 1024, 1, 10]
    - [189, 2.393]
  - - [1024, 2, 1, 5120]
    - [313, 0.479]
  - - [1920, 2048, 1, 2048]
    - [253, 91.405]
  - - [2048, 2048, 1, 2048]
    - [215, 85.428]
  - - [3840, 4096, 1, 4096]
    - [287, 96.442]
  - - [1024, 4096, 1, 5120]
    - [188, 88.416]
  - - [64, 128, 160, 128]
    - [222, 26.611]
  - - [1024, 30522, 1, 308]
    - [280, 83.801]
  - - [1024, 30522, 1, 820]
    - [280, 91.736]
  - - [1024, 30522, 1, 200]
    - [281, 77.021]
  - - [1024, 30522, 1, 462]
    - [281, 87.293]
  - - [1024, 2, 1, 1024]
    - [300, 0.258]
  - - [1024, 30522, 1, 77]
    - [363, 47.767]
  - - [1024, 1024, 1, 40]
    - [286, 8.626]
  - - [1024, 2, 1, 1]
    - [288, 0.0]
  - - [1024, 2, 1, 8]
    - [359, 0.006]
  - - [1024, 1024, 1, 8]
    - [290, 2.012]
  - - [1024, 1024, 1, 9600]
    - [370, 69.446]
  - - [4096, 1024, 1, 5120]
    - [191, 88.26]
  - - [1024, 4096, 1, 3072]
    - [315, 86.16]
  - - [1024, 1024, 1, 1152]
    - [373, 51.737]
  - - [512, 480, 1, 512]
    - [309, 20.659]
  - - [64, 128, 1, 128]
    - [196, 0.302]
  - - [1024, 1024, 1, 5120]
    - [249, 65.935]
  - - [1024, 2, 1, 3072]
    - [300, 0.413]
  - - [7680, 8192, 1, 8192]
    - [287, 97.4]
  - - [4096, 1024, 1, 8192]
    - [329, 89.431]
  - - [1024, 2, 1, 1280]
    - [312, 0.289]
  - - [479, 1024, 1, 32768]
    - [306, 47.254]
  - - [64, 1024, 32, 1024]
    - [204, 59.546]
  - - [2560, 1920, 1, 2048]
    - [205, 89.336]
  - - [1024, 3072, 1, 4096]
    - [207, 78.838]
  - - [2560, 2560, 1, 2048]
    - [209, 87.928]
  - - [2048, 2, 1, 2]
    - [212, 0.003]
  - - [1024, 64, 128, 1024]
    - [218, 75.058]
  - - [2048, 2048, 1, 2]
    - [220, 1.189]
  - - [1024, 64, 32, 1024]
    - [222, 60.533]
  - - [1024, 96, 64, 1024]
    - [223, 74.71]
  - - [1024, 30592, 1, 2048]
    - [229, 95.157]
  - - [1024, 3072, 1, 16384]
    - [229, 78.02]
  - - [6144, 1536, 1, 4096]
    - [229, 92.281]
  - - [1024, 1024, 1, 16]
    - [236, 4.55]
  - - [1536, 4608, 1, 8192]
    - [237, 92.604]
  - - [640, 2560, 1, 2048]
    - [240, 72.022]
  - - [1024, 4096, 1, 16384]
    - [248, 90.968]
  - - [64, 512, 40, 512]
    - [231, 46.868]
  - - [1024, 1024, 1, 16384]
    - [201, 71.234]
  - - [1536, 6144, 1, 4096]
    - [229, 92.387]
  - - [1024, 30592, 1, 4096]
    - [255, 96.112]
  - - [2560, 2560, 1, 4]
    - [252, 2.757]
  - - [1536, 1536, 1, 4096]
    - [266, 85.884]
  - - [2560, 7680, 1, 2048]
    - [255, 95.578]
  - - [64, 1024, 256, 1024]
    - [269, 77.725]
  - - [96, 1024, 64, 1024]
    - [270, 62.869]
  - - [1536, 50304, 1, 4096]
    - [272, 95.605]
  - - [2048, 8192, 1, 1024]
    - [221, 88.436]
  - - [1024, 30592, 1, 8192]
    - [255, 96.708]
  - - [512, 64, 256, 512]
    - [303, 63.447]
  - - [1024, 96, 128, 1024]
    - [272, 83.912]
  - - [64, 512, 128, 512]
    - [310, 56.532]
  - - [4096, 1024, 1, 16384]
    - [188, 90.146]
  - - [8192, 2048, 1, 1024]
    - [295, 88.289]
  - - [64, 1024, 64, 1024]
    - [240, 67.78]
  - - [1024, 50304, 1, 4096]
    - [215, 95.695]
  - - [1536, 4608, 1, 4096]
    - [246, 91.55]
  - - [512, 64, 128, 512]
    - [322, 55.903]
  - - [6144, 1536, 1, 8192]
    - [229, 92.964]
  - - [1024, 3072, 1, 8192]
    - [328, 79.434]
  - - [1536, 1536, 1, 8192]
    - [332, 89.43]
  - - [1536, 50304, 1, 8192]
    - [246, 95.985]
  - - [2560, 2, 1, 4]
    - [212, 0.006]
  - - [2048, 6144, 1, 1024]
    - [272, 87.251]
  - - [64, 1024, 128, 1024]
    - [341, 75.093]
  - - [1024, 64, 64, 1024]
    - [342, 67.102]
  - - [1024, 2, 1, 16]
    - [343, 0.012]
  - - [96, 1024, 128, 1024]
    - [346, 65.48]
  - - [2048, 30592, 1, 1024]
    - [347, 94.32]
  - - [64, 512, 256, 512]
    - [354, 63.951]
  - - [1536, 6144, 1, 8192]
    - [229, 92.988]
  - - [1024, 50304, 1, 2048]
    - [358, 94.519]
  - - [1024, 50304, 1, 8192]
    - [362, 96.213]
  - - [1024, 3072, 1, 2048]
    - [371, 76.414]
  - - [1024, 64, 256, 1024]
    - [378, 77.725]
  - - [1024, 50304, 1, 16384]
    - [358, 96.497]
  - - [512, 64, 40, 512]
    - [195, 45.345]
- null
