library/src/blas3/Tensile/Logic/asm_full/arcturus_Cijk_Ailk_Bjlk_DB_GB.yaml
- {MinimumRequiredVersion: 4.25.0}
- arcturus
- gfx908
- [Device 7380, Device 7388, Device 738c, Device 7390]
    SolutionIndex: 0
    SolutionNameMin: Cijk_Ailk_Bjlk_DB_GB_MT16x16x8_SN_NLCA1_NLCB1_TT2_2_WG8_8_1
    SolutionIndex: 1
    SolutionNameMin: Cijk_Ailk_Bjlk_DB_GB_MT32x16x8_SN_NLCA1_NLCB1_TT2_2_WG16_8_1
    SolutionIndex: 2
    SolutionNameMin: Cijk_Ailk_Bjlk_DB_GB_MT64x32x8_SN_NLCA1_NLCB1_TT4_4_WG16_8_1
    SolutionIndex: 3
    SolutionNameMin: Cijk_Ailk_Bjlk_DB_GB_MT16x32x8_SN_NLCA1_NLCB1_TT2_2_WG8_16_1
    SolutionIndex: 4
    SolutionNameMin: Cijk_Ailk_Bjlk_DB_GB_MT64x64x8_SN_NLCA1_NLCB1_TT4_4_WG16_16_1
    SolutionIndex: 5
    SolutionNameMin: Cijk_Ailk_Bjlk_DB_GB_MT16x16x16_SN_NLCA1_NLCB1_TT2_2_WG8_8_1
    SolutionIndex: 6
    SolutionNameMin: Cijk_Ailk_Bjlk_DB_GB_MT32x16x16_SN_NLCA1_NLCB1_TT2_2_WG16_8_1
    SolutionIndex: 7
    SolutionNameMin: Cijk_Ailk_Bjlk_DB_GB_MT16x32x16_SN_NLCA1_NLCB1_TT2_2_WG8_16_1
    SolutionIndex: 8
    SolutionNameMin: Cijk_Ailk_Bjlk_DB_GB_MT32x32x16_SN_NLCA1_NLCB1_TT2_2_WG16_16_1
- - - [32, 32, 8, 128, 32, 32, 32, 32]
    - [0, 84.0]
  - - [128, 128, 8, 128, 128, 128, 128, 128]
    - [0, 1303.0]
  - - [256, 256, 8, 128, 256, 256, 256, 256]
    - [4, 2630.0]
  - - [512, 512, 8, 128, 512, 512, 512, 512]
    - [4, 5123.0]
  - - [32, 32, 8, 512, 32, 32, 32, 32]
    - [8, 143.0]
  - - [128, 128, 8, 512, 128, 128, 128, 128]
    - [5, 2007.0]
  - - [256, 256, 8, 512, 256, 256, 256, 256]
    - [4, 3608.0]
  - - [512, 512, 8, 512, 512, 512, 512, 512]
    - [4, 5987.0]
  - - [32, 32, 8, 1024, 32, 32, 32, 32]
    - [6, 167.0]
  - - [128, 128, 8, 1024, 128, 128, 128, 128]
    - [6, 2205.0]
  - - [256, 256, 8, 1024, 256, 256, 256, 256]
    - [2, 3852.0]
  - - [512, 512, 8, 1024, 512, 512, 512, 512]
    - [4, 6141.0]
  - - [32, 128, 8, 128, 32, 32, 32, 128]
    - [0, 328.0]
  - - [32, 256, 8, 128, 32, 32, 32, 256]
    - [0, 651.0]
  - - [32, 512, 8, 128, 32, 32, 32, 512]
    - [0, 1241.0]
  - - [32, 128, 8, 512, 32, 32, 32, 128]
    - [6, 576.0]
  - - [32, 256, 8, 512, 32, 32, 32, 256]
    - [8, 1146.0]
  - - [32, 512, 8, 512, 32, 32, 32, 512]
    - [5, 1942.0]
  - - [32, 128, 8, 1024, 32, 32, 32, 128]
    - [7, 668.0]
  - - [32, 256, 8, 1024, 32, 32, 32, 256]
    - [8, 1313.0]
  - - [32, 512, 8, 1024, 32, 32, 32, 512]
    - [5, 2173.0]
  - - [128, 32, 8, 128, 128, 128, 128, 32]
    - [1, 343.0]
  - - [256, 32, 8, 128, 256, 256, 256, 32]
    - [1, 636.0]
  - - [512, 32, 8, 128, 512, 512, 512, 32]
    - [3, 1263.0]
  - - [128, 32, 8, 512, 128, 128, 128, 32]
    - [7, 579.0]
  - - [256, 32, 8, 512, 256, 256, 256, 32]
    - [6, 1159.0]
  - - [512, 32, 8, 512, 512, 512, 512, 32]
    - [6, 1993.0]
  - - [128, 32, 8, 1024, 128, 128, 128, 32]
    - [6, 671.0]
  - - [256, 32, 8, 1024, 256, 256, 256, 32]
    - [8, 1305.0]
  - - [512, 32, 8, 1024, 512, 512, 512, 32]
    - [6, 2208.0]
- null
