library/src/blas3/Tensile/Logic/asm_full/arcturus_Cijk_Ailk_Bjlk_BBH.yaml
- {MinimumRequiredVersion: 4.14.0}
- arcturus
- gfx908
- [Device 7380, Device 7388, Device 738c, Device 7390]
    SolutionIndex: 0
    SolutionNameMin: Cijk_Ailk_Bjlk_BBH_MT16x16x16_MI16x16x8x1_SE_1LDSB0_AF0EM1_AF1EM1_EPS1_FL0_GRVW2_GSU1_IU1_NLCA1_NLCB1_PGR1_PLR1_SIA3_SU0_SUM0_SUS256_SRVW0_TT1_16_WSGRA1_WSGRB1_WG16_4_1_WGM1
    SolutionIndex: 1
    SolutionNameMin: Cijk_Ailk_Bjlk_BBH_MT16x16x16_MI16x16x8x1_SE_1LDSB0_AF0EM1_AF1EM1_EPS1_FL0_GRVW4_GSU1_IU1_NLCA1_NLCB1_PGR1_PLR1_SIA3_SU32_SUM0_SUS128_SRVW0_TT1_16_WSGRA1_WSGRB1_WG16_4_1_WGM1
    SolutionIndex: 2
    SolutionNameMin: Cijk_Ailk_Bjlk_BBH_MT16x16x16_MI16x16x8x1_SE_1LDSB0_AF0EM8_AF1EM1_EPS1_FL0_GRVW2_GSU1_IU1_NLCA1_NLCB1_PGR1_PLR1_SIA3_SU0_SUM0_SUS256_SRVW0_TT1_16_WSGRA1_WSGRB1_WG16_4_1_WGM1
    SolutionIndex: 3
    SolutionNameMin: Cijk_Ailk_Bjlk_BBH_MT64x16x32_MI16x16x8x1_SE_1LDSB0_AF0EM8_AF1EM1_EPS1_FL0_GRVW4_GSU1_IU1_NLCA1_NLCB1_PGR1_PLR1_SIA3_SU0_SUM0_SUS256_SRVW0_TT1_16_WSGRA1_WSGRB1_WG64_4_1_WGM1
    SolutionIndex: 4
    SolutionNameMin: Cijk_Ailk_Bjlk_BBH_MT64x32x16_MI16x16x8x1_SE_1LDSB0_AF0EM1_AF1EM1_EPS1_FL0_GRVW2_GSU1_IU1_NLCA1_NLCB1_PGR1_PLR1_SIA3_SU32_SUM0_SUS256_SRVW0_TT2_16_WSGRA0_WSGRB1_WG32_8_1_WGM10
    SolutionIndex: 5
    SolutionNameMin: Cijk_Ailk_Bjlk_BBH_MT16x16x32_MI16x16x8x1_SE_1LDSB0_AF0EM8_AF1EM1_EPS1_FL0_GRVW2_GSU1_IU1_NLCA1_NLCB1_PGR1_PLR1_SIA3_SU0_SUM0_SUS256_SRVW0_TT1_16_WSGRA1_WSGRB1_WG16_4_1_WGM1
    SolutionIndex: 6
    SolutionNameMin: Cijk_Ailk_Bjlk_BBH_MT16x16x16_MI16x16x8x1_SE_1LDSB0_AF0EM8_AF1EM1_EPS1_FL0_GRVW2_GSU1_IU1_NLCA1_NLCB1_PGR1_PLR1_SIA3_SU32_SUM0_SUS128_SRVW0_TT1_16_WSGRA1_WSGRB1_WG16_4_1_WGM1
    SolutionIndex: 7
    SolutionNameMin: Cijk_Ailk_Bjlk_BBH_MT16x16x16_MI16x16x8x1_SE_1LDSB0_AF0EM1_AF1EM1_EPS1_FL0_GRVW2_GSU1_IU1_NLCA1_NLCB1_PGR1_PLR1_SIA3_SU32_SUM0_SUS128_SRVW0_TT1_16_WSGRA1_WSGRB1_WG16_4_1_WGM1
    SolutionIndex: 8
    SolutionNameMin: Cijk_Ailk_Bjlk_BBH_MT32x64x16_MI16x16x8x1_SE_1LDSB0_AF0EM1_AF1EM1_EPS1_FL0_GRVW2_GSU1_IU1_NLCA1_NLCB1_PGR1_PLR1_SIA3_SU32_SUM0_SUS128_SRVW4_TT1_32_WSGRA1_WSGRB1_WG32_8_1_WGM2
    SolutionIndex: 9
    SolutionNameMin: Cijk_Ailk_Bjlk_BBH_MT32x32x16_MI16x16x8x1_SE_1LDSB0_AF0EM8_AF1EM1_EPS1_FL0_GRVW2_GSU1_IU1_NLCA1_NLCB1_PGR1_PLR1_SIA3_SU0_SUM0_SUS256_SRVW4_TT1_16_WSGRA1_WSGRB1_WG32_8_1_WGM1
    SolutionIndex: 10
    SolutionNameMin: Cijk_Ailk_Bjlk_BBH_MT32x32x16_MI16x16x8x1_SE_1LDSB0_AF0EM4_AF1EM1_EPS1_FL0_GRVW4_GSU1_IU1_NLCA1_NLCB1_PGR1_PLR1_SIA3_SU0_SUM0_SUS256_SRVW0_TT1_16_WSGRA1_WSGRB1_WG32_8_1_WGM15
    SolutionIndex: 11
    SolutionNameMin: Cijk_Ailk_Bjlk_BBH_MT32x32x64_MI16x16x8x1_SE_1LDSB0_AF0EM1_AF1EM1_EPS1_FL0_GRVW8_GSU1_IU1_NLCA1_NLCB1_PGR1_PLR1_SIA3_SU0_SUM0_SUS256_SRVW4_TT1_16_WSGRA1_WSGRB1_WG32_8_1_WGM15
    SolutionIndex: 12
    SolutionNameMin: Cijk_Ailk_Bjlk_BBH_MT32x32x16_MI16x16x8x1_SE_1LDSB0_AF0EM8_AF1EM1_EPS1_FL0_GRVW4_GSU1_IU1_NLCA1_NLCB1_PGR1_PLR1_SIA3_SU0_SUM0_SUS256_SRVW4_TT1_16_WSGRA1_WSGRB1_WG32_8_1_WGM1
    SolutionIndex: 13
    SolutionNameMin: Cijk_Ailk_Bjlk_BBH_MT32x32x16_MI16x16x8x1_SE_1LDSB0_AF0EM1_AF1EM1_EPS1_FL0_GRVW2_GSU1_IU1_NLCA1_NLCB1_PGR1_PLR1_SIA3_SU0_SUM0_SUS256_SRVW0_TT1_16_WSGRA1_WSGRB1_WG32_8_1_WGM1
    SolutionIndex: 14
    SolutionNameMin: Cijk_Ailk_Bjlk_BBH_MT32x32x64_MI16x16x8x1_SE_1LDSB0_AF0EM8_AF1EM1_EPS1_FL0_GRVW8_GSU1_IU1_NLCA1_NLCB1_PGR1_PLR1_SIA3_SU0_SUM0_SUS256_SRVW4_TT1_16_WSGRA1_WSGRB1_WG32_8_1_WGM1
    SolutionIndex: 15
    SolutionNameMin: Cijk_Ailk_Bjlk_BBH_MT16x16x16_MI16x16x8x1_SE_1LDSB0_AF0EM1_AF1EM1_EPS1_FL0_GRVW2_GSU1_IU1_NLCA1_NLCB1_PGR1_PLR1_SIA3_SU32_SUM0_SUS256_SRVW0_TT1_16_WSGRA1_WSGRB1_WG16_4_1_WGM1
    SolutionIndex: 16
    SolutionNameMin: Cijk_Ailk_Bjlk_BBH_MT16x16x16_MI16x16x8x1_SE_1LDSB0_AF0EM1_AF1EM1_EPS1_FL0_GRVW2_GSU1_IU1_NLCA1_NLCB1_PGR1_PLR1_SIA3_SU32_SUM0_SUS256_SRVW0_TT1_16_WSGRA1_WSGRB1_WG16_4_1_WGM15
    SolutionIndex: 17
    SolutionNameMin: Cijk_Ailk_Bjlk_BBH_MT32x32x16_MI16x16x8x1_SE_1LDSB0_AF0EM4_AF1EM1_EPS1_FL0_GRVW2_GSU1_IU1_NLCA1_NLCB1_PGR1_PLR1_SIA3_SU0_SUM0_SUS256_SRVW0_TT1_16_WSGRA1_WSGRB1_WG32_8_1_WGM1
    SolutionIndex: 18
    SolutionNameMin: Cijk_Ailk_Bjlk_BBH_MT32x32x16_MI16x16x8x1_SE_1LDSB0_AF0EM4_AF1EM1_EPS1_FL0_GRVW2_GSU1_IU1_NLCA1_NLCB1_PGR1_PLR1_SIA3_SU16_SUM0_SUS128_SRVW0_TT1_16_WSGRA1_WSGRB1_WG32_8_1_WGM2
    SolutionIndex: 19
    SolutionNameMin: Cijk_Ailk_Bjlk_BBH_MT64x64x16_MI32x32x4x1_SE_1LDSB0_AF0EM8_AF1EM1_EPS0_FL0_GRVW4_GSU1_IU1_NLCA1_NLCB1_PGR2_PLR1_SIA3_SU0_SUM0_SUS256_SRVW4_TT1_32_WSGRA1_WSGRB1_WG64_4_1_WGM15
    SolutionIndex: 20
    SolutionNameMin: Cijk_Ailk_Bjlk_BBH_MT32x32x64_MI16x16x8x1_SE_1LDSB0_AF0EM4_AF1EM1_EPS1_FL0_GRVW8_GSU1_IU1_NLCA1_NLCB1_PGR1_PLR1_SIA3_SU0_SUM0_SUS256_SRVW0_TT1_16_WSGRA1_WSGRB1_WG32_8_1_WGM15
    SolutionIndex: 21
    SolutionNameMin: Cijk_Ailk_Bjlk_BBH_MT64x64x64_MI32x32x4x1_SE_1LDSB0_AF0EM1_AF1EM1_EPS1_FL0_GRVW4_GSU1_IU1_NLCA1_NLCB1_PGR1_PLR1_SIA3_SU32_SUM0_SUS128_SRVW4_TT1_32_WSGRA1_WSGRB1_WG64_4_1_WGM1
    SolutionIndex: 22
    SolutionNameMin: Cijk_Ailk_Bjlk_BBH_MT128x64x16_MI32x32x4x1_SE_1LDSB0_AF0EM1_AF1EM1_EPS1_FL0_GRVW8_GSU1_IU1_NLCA1_NLCB1_PGR1_PLR1_SIA3_SU0_SUM0_SUS256_SRVW4_TT2_32_WSGRA1_WSGRB1_WG64_4_1_WGM15
    SolutionIndex: 23
    SolutionNameMin: Cijk_Ailk_Bjlk_BBH_MT32x32x64_MI16x16x8x1_SE_1LDSB0_AF0EM8_AF1EM1_EPS1_FL0_GRVW8_GSU1_IU1_NLCA1_NLCB1_PGR1_PLR1_SIA3_SU0_SUM0_SUS256_SRVW4_TT1_16_WSGRA1_WSGRB1_WG32_8_1_WGM2
    SolutionIndex: 24
    SolutionNameMin: Cijk_Ailk_Bjlk_BBH_MT64x64x32_MI32x32x4x1_SE_1LDSB0_AF0EM1_AF1EM1_EPS1_FL0_GRVW8_GSU1_IU1_NLCA1_NLCB1_PGR1_PLR1_SIA3_SU32_SUM0_SUS128_SRVW4_TT1_32_WSGRA1_WSGRB1_WG64_4_1_WGM1
    SolutionIndex: 25
    SolutionNameMin: Cijk_Ailk_Bjlk_BBH_MT16x64x32_MI16x16x8x1_SE_1LDSB0_AF0EM8_AF1EM1_EPS0_FL0_GRVW2_GSU1_IU1_NLCA1_NLCB1_PGR2_PLR1_SIA3_SU32_SUM0_SUS256_SRVW0_TT1_16_WSGRA1_WSGRB1_WG16_16_1_WGM1
    SolutionIndex: 26
    SolutionNameMin: Cijk_Ailk_Bjlk_BBH_MT64x16x64_MI16x16x8x1_SE_1LDSB0_AF0EM8_AF1EM1_EPS1_FL0_GRVW2_GSU7_IU1_NLCA1_NLCB1_PGR1_PLR1_SIA3_SU0_SUM0_SUS256_SRVW0_TT1_16_WSGRA1_WSGRB1_WG64_4_1_WGM1
    SolutionIndex: 27
    SolutionNameMin: Cijk_Ailk_Bjlk_BBH_MT64x64x32_MI32x32x4x1_SE_1LDSB0_AF0EM8_AF1EM1_EPS1_FL0_GRVW4_GSU1_IU1_NLCA1_NLCB1_PGR1_PLR1_SIA3_SU0_SUM0_SUS256_SRVW4_TT1_32_WSGRA1_WSGRB1_WG64_4_1_WGM1
    SolutionIndex: 28
    SolutionNameMin: Cijk_Ailk_Bjlk_BBH_MT32x64x16_MI16x16x8x1_SE_1LDSB0_AF0EM4_AF1EM1_EPS1_FL0_GRVW2_GSU1_IU1_NLCA1_NLCB1_PGR1_PLR1_SIA3_SU32_SUM0_SUS256_SRVW0_TT1_32_WSGRA1_WSGRB1_WG32_8_1_WGM2
    SolutionIndex: 29
    SolutionNameMin: Cijk_Ailk_Bjlk_BBH_MT128x96x32_MI32x32x4x1_SE_1LDSB0_AF0EM8_AF1EM1_EPS1_FL0_GRVW4_GSU1_IU1_NLCA1_NLCB3_PGR1_PLR1_SIA3_SU0_SUM0_SUS256_SRVW4_TT1_96_WSGRA1_WSGRB1_WG128_2_1_WGM2
    SolutionIndex: 30
    SolutionNameMin: Cijk_Ailk_Bjlk_BBH_MT160x128x32_MI32x32x4x1_SE_1LDSB0_AF0EM8_AF1EM1_EPS1_FL0_GRVW2_GSU2_IU1_NLCA5_NLCB1_PGR1_PLR1_SIA3_SU32_SUM0_SUS256_SRVW0_TT5_32_WSGRA1_WSGRB1_WG32_8_1_WGM1
    SolutionIndex: 31
    SolutionNameMin: Cijk_Ailk_Bjlk_BBH_MT96x96x32_MI16x16x8x1_SE_1LDSB0_AF0EM8_AF1EM1_EPS0_FL0_GRVW2_GSU1_IU1_NLCA3_NLCB3_PGR2_PLR1_SIA3_SU0_SUM0_SUS256_SRVW0_TT3_48_WSGRA1_WSGRB1_WG32_8_1_WGM1
    SolutionIndex: 32
    SolutionNameMin: Cijk_Ailk_Bjlk_BBH_MT64x192x32_MI32x32x4x1_SE_1LDSB0_AF0EM8_AF1EM1_EPS0_FL0_GRVW4_GSU1_IU1_NLCA1_NLCB3_PGR2_PLR1_SIA3_SU0_SUM0_SUS256_SRVW4_TT1_96_WSGRA1_WSGRB1_WG64_4_1_WGM2
    SolutionIndex: 33
    SolutionNameMin: Cijk_Ailk_Bjlk_BBH_MT128x128x16_MI32x32x4x1_SE_1LDSB1_AF0EM8_AF1EM1_EPS0_FL0_GRVW8_GSU1_IU1_NLCA1_NLCB1_PGR2_PLR1_SIA3_SU32_SUM0_SUS128_SRVW4_TT2_64_WSGRA1_WSGRB1_WG64_4_1_WGM15
    SolutionIndex: 34
    SolutionNameMin: Cijk_Ailk_Bjlk_BBH_MT128x128x16_MI32x32x4x1_SE_1LDSB1_AF0EM8_AF1EM1_EPS1_FL0_GRVW8_GSU1_IU1_NLCA1_NLCB1_PGR1_PLR1_SIA3_SU0_SUM0_SUS256_SRVW4_TT2_64_WSGRA1_WSGRB1_WG64_4_1_WGM2
    SolutionIndex: 35
    SolutionNameMin: Cijk_Ailk_Bjlk_BBH_MT64x128x32_MI32x32x4x1_SE_1LDSB0_AF0EM8_AF1EM1_EPS1_FL0_GRVW8_GSU1_IU1_NLCA1_NLCB1_PGR1_PLR1_SIA3_SU32_SUM0_SUS256_SRVW4_TT1_64_WSGRA1_WSGRB1_WG64_4_1_WGM2
    SolutionIndex: 36
    SolutionNameMin: Cijk_Ailk_Bjlk_BBH_MT128x96x32_MI32x32x4x1_SE_1LDSB0_AF0EM8_AF1EM1_EPS1_FL0_GRVW4_GSU1_IU1_NLCA1_NLCB3_PGR1_PLR1_SIA3_SU32_SUM0_SUS128_SRVW4_TT1_96_WSGRA1_WSGRB1_WG128_2_1_WGM2
    SolutionIndex: 37
    SolutionNameMin: Cijk_Ailk_Bjlk_BBH_MT16x64x64_MI16x16x8x1_SE_1LDSB0_AF0EM1_AF1EM1_EPS1_FL0_GRVW8_GSU15_IU1_NLCA1_NLCB1_PGR1_PLR1_SIA3_SU0_SUM0_SUS256_SRVW0_TT1_16_WSGRA1_WSGRB1_WG16_16_1_WGM1
    SolutionIndex: 38
    SolutionNameMin: Cijk_Ailk_Bjlk_BBH_MT128x64x16_MI32x32x4x1_SE_1LDSB0_AF0EM1_AF1EM1_EPS1_FL0_GRVW2_GSU1_IU1_NLCA1_NLCB1_PGR1_PLR1_SIA3_SU32_SUM0_SUS128_SRVW4_TT2_32_WSGRA1_WSGRB1_WG64_4_1_WGM2
    SolutionIndex: 39
    SolutionNameMin: Cijk_Ailk_Bjlk_BBH_MT64x32x16_MI16x16x8x1_SE_1LDSB0_AF0EM1_AF1EM1_EPS1_FL0_GRVW2_GSU1_IU1_NLCA1_NLCB1_PGR1_PLR1_SIA3_SU0_SUM0_SUS256_SRVW4_TT2_16_WSGRA1_WSGRB1_WG32_8_1_WGM1
    SolutionIndex: 40
    SolutionNameMin: Cijk_Ailk_Bjlk_BBH_MT32x32x64_MI16x16x8x1_SE_1LDSB0_AF0EM1_AF1EM1_EPS1_FL0_GRVW8_GSU1_IU1_NLCA1_NLCB1_PGR1_PLR1_SIA3_SU32_SUM0_SUS256_SRVW4_TT1_16_WSGRA1_WSGRB1_WG32_8_1_WGM2
    SolutionIndex: 41
    SolutionNameMin: Cijk_Ailk_Bjlk_BBH_MT32x32x64_MI16x16x8x1_SE_1LDSB0_AF0EM1_AF1EM1_EPS1_FL0_GRVW8_GSU1_IU1_NLCA1_NLCB1_PGR1_PLR1_SIA3_SU32_SUM0_SUS256_SRVW4_TT1_16_WSGRA1_WSGRB1_WG32_8_1_WGM1
    SolutionIndex: 42
    SolutionNameMin: Cijk_Ailk_Bjlk_BBH_MT64x64x64_MI32x32x4x1_SE_1LDSB0_AF0EM1_AF1EM1_EPS1_FL0_GRVW4_GSU1_IU1_NLCA1_NLCB1_PGR1_PLR1_SIA3_SU32_SUM0_SUS256_SRVW0_TT1_32_WSGRA1_WSGRB1_WG64_4_1_WGM10
    SolutionIndex: 43
    SolutionNameMin: Cijk_Ailk_Bjlk_BBH_MT64x64x64_MI32x32x4x1_SE_1LDSB0_AF0EM8_AF1EM1_EPS1_FL0_GRVW8_GSU15_IU1_NLCA1_NLCB1_PGR1_PLR1_SIA3_SU0_SUM0_SUS256_SRVW0_TT1_32_WSGRA1_WSGRB1_WG64_4_1_WGM1
    SolutionIndex: 44
    SolutionNameMin: Cijk_Ailk_Bjlk_BBH_MT64x128x64_MI32x32x4x1_SE_1LDSB0_AF0EM8_AF1EM1_EPS1_FL0_GRVW4_GSU3_IU1_NLCA1_NLCB1_PGR1_PLR1_SIA3_SU0_SUM0_SUS256_SRVW0_TT1_64_WSGRA1_WSGRB1_WG64_4_1_WGM1
    SolutionIndex: 45
    SolutionNameMin: Cijk_Ailk_Bjlk_BBH_MT128x64x64_MI32x32x4x1_SE_1LDSB0_AF0EM8_AF1EM1_EPS1_FL0_GRVW4_GSU3_IU1_NLCA1_NLCB1_PGR1_PLR1_SIA3_SU0_SUM0_SUS256_SRVW0_TT2_32_WSGRA1_WSGRB1_WG64_4_1_WGM15
    SolutionIndex: 46
    SolutionNameMin: Cijk_Ailk_Bjlk_BBH_MT128x96x32_MI32x32x4x1_SE_1LDSB0_AF0EM8_AF1EM1_EPS1_FL0_GRVW4_GSU2_IU1_NLCA1_NLCB3_PGR1_PLR1_SIA3_SU0_SUM0_SUS256_SRVW0_TT1_96_WSGRA1_WSGRB1_WG128_2_1_WGM1
    SolutionIndex: 47
    SolutionNameMin: Cijk_Ailk_Bjlk_BBH_MT64x128x32_MI32x32x4x1_SE_1LDSB0_AF0EM8_AF1EM1_EPS0_FL0_GRVW8_GSU1_IU1_NLCA1_NLCB1_PGR2_PLR1_SIA3_SU0_SUM0_SUS256_SRVW4_TT1_64_WSGRA1_WSGRB1_WG64_4_1_WGM2
    SolutionIndex: 48
    SolutionNameMin: Cijk_Ailk_Bjlk_BBH_MT64x128x64_MI32x32x4x1_SE_1LDSB0_AF0EM8_AF1EM1_EPS1_FL0_GRVW4_GSU1_IU1_NLCA1_NLCB1_PGR1_PLR1_SIA3_SU0_SUM0_SUS256_SRVW4_TT1_64_WSGRA1_WSGRB1_WG64_4_1_WGM1
    SolutionIndex: 49
    SolutionNameMin: Cijk_Ailk_Bjlk_BBH_MT128x64x32_MI32x32x4x1_SE_1LDSB0_AF0EM8_AF1EM1_EPS0_FL0_GRVW2_GSU1_IU1_NLCA1_NLCB1_PGR2_PLR1_SIA3_SU0_SUM0_SUS256_SRVW4_TT2_32_WSGRA1_WSGRB1_WG64_4_1_WGM1
    SolutionIndex: 50
    SolutionNameMin: Cijk_Ailk_Bjlk_BBH_MT128x80x64_MI16x16x8x1_SE_1LDSB0_AF0EM4_AF1EM1_EPS1_FL0_GRVW2_GSU1_IU1_NLCA1_NLCB5_PGR1_PLR1_SIA3_SU16_SUM0_SUS128_SRVW0_TT2_80_WSGRA1_WSGRB1_WG64_4_1_WGM2
    SolutionIndex: 51
    SolutionNameMin: Cijk_Ailk_Bjlk_BBH_MT128x160x32_MI32x32x4x1_SE_1LDSB0_AF0EM8_AF1EM1_EPS1_FL0_GRVW2_GSU2_IU1_NLCA1_NLCB5_PGR1_PLR1_SIA3_SU0_SUM0_SUS256_SRVW4_TT1_160_WSGRA1_WSGRB1_WG128_2_1_WGM1
    SolutionIndex: 52
    SolutionNameMin: Cijk_Ailk_Bjlk_BBH_MT128x256x16_MI32x32x4x1_SE_1LDSB0_AF0EM8_AF1EM1_EPS1_FL0_GRVW8_GSU3_IU1_NLCA1_NLCB1_PGR1_PLR1_SIA3_SU0_SUM0_SUS256_SRVW0_TT2_128_WSGRA1_WSGRB1_WG64_4_1_WGM15
    SolutionIndex: 53
    SolutionNameMin: Cijk_Ailk_Bjlk_BBH_MT128x96x64_MI32x32x4x1_SE_1LDSB0_AF0EM8_AF1EM1_EPS1_FL0_GRVW8_GSU1_IU1_NLCA1_NLCB3_PGR1_PLR1_SIA3_SU32_SUM0_SUS128_SRVW4_TT1_96_WSGRA1_WSGRB1_WG128_2_1_WGM15
    SolutionIndex: 54
    SolutionNameMin: Cijk_Ailk_Bjlk_BBH_MT128x64x32_MI32x32x4x1_SE_1LDSB0_AF0EM8_AF1EM1_EPS0_FL0_GRVW4_GSU1_IU1_NLCA1_NLCB1_PGR2_PLR1_SIA3_SU0_SUM0_SUS256_SRVW4_TT2_32_WSGRA1_WSGRB1_WG64_4_1_WGM1
    SolutionIndex: 55
    SolutionNameMin: Cijk_Ailk_Bjlk_BBH_MT128x128x32_MI32x32x4x1_SE_1LDSB0_AF0EM8_AF1EM1_EPS1_FL0_GRVW8_GSU1_IU1_NLCA1_NLCB1_PGR1_PLR1_SIA3_SU32_SUM0_SUS128_SRVW4_TT2_64_WSGRA1_WSGRB1_WG64_4_1_WGM15
    SolutionIndex: 56
    SolutionNameMin: Cijk_Ailk_Bjlk_BBH_MT128x144x32_MI16x16x8x1_SE_1LDSB0_AF0EM8_AF1EM1_EPS1_FL0_GRVW2_GSU1_IU1_NLCA1_NLCB9_PGR1_PLR1_SIA3_SU0_SUM0_SUS256_SRVW4_TT2_144_WSGRA1_WSGRB1_WG64_4_1_WGM15
    SolutionIndex: 57
    SolutionNameMin: Cijk_Ailk_Bjlk_BBH_MT128x160x32_MI32x32x4x1_SE_1LDSB0_AF0EM8_AF1EM1_EPS1_FL0_GRVW4_GSU1_IU1_NLCA1_NLCB5_PGR1_PLR1_SIA3_SU0_SUM0_SUS256_SRVW4_TT1_160_WSGRA1_WSGRB1_WG128_2_1_WGM1
    SolutionIndex: 58
    SolutionNameMin: Cijk_Ailk_Bjlk_BBH_MT128x96x32_MI32x32x4x1_SE_1LDSB0_AF0EM8_AF1EM1_EPS1_FL0_GRVW4_GSU1_IU1_NLCA1_NLCB3_PGR1_PLR1_SIA3_SU32_SUM0_SUS128_SRVW4_TT1_96_WSGRA1_WSGRB1_WG128_2_1_WGM1
    SolutionIndex: 59
    SolutionNameMin: Cijk_Ailk_Bjlk_BBH_MT128x96x32_MI32x32x4x1_SE_1LDSB0_AF0EM4_AF1EM1_EPS1_FL0_GRVW4_GSU1_IU1_NLCA1_NLCB3_PGR1_PLR1_SIA3_SU0_SUM0_SUS256_SRVW0_TT1_96_WSGRA1_WSGRB1_WG128_2_1_WGM1
    SolutionIndex: 60
    SolutionNameMin: Cijk_Ailk_Bjlk_BBH_MT128x96x32_MI32x32x4x1_SE_1LDSB0_AF0EM4_AF1EM1_EPS1_FL0_GRVW4_GSU1_IU1_NLCA1_NLCB3_PGR1_PLR1_SIA3_SU32_SUM0_SUS128_SRVW4_TT1_96_WSGRA1_WSGRB1_WG128_2_1_WGM15
    SolutionIndex: 61
    SolutionNameMin: Cijk_Ailk_Bjlk_BBH_MT128x128x16_MI32x32x4x1_SE_1LDSB0_AF0EM8_AF1EM1_EPS1_FL0_GRVW8_GSU3_IU1_NLCA1_NLCB1_PGR1_PLR1_SIA3_SU0_SUM0_SUS256_SRVW0_TT2_64_WSGRA1_WSGRB1_WG64_4_1_WGM2
    SolutionIndex: 62
    SolutionNameMin: Cijk_Ailk_Bjlk_BBH_MT128x128x16_MI32x32x4x1_SE_1LDSB0_AF0EM8_AF1EM1_EPS1_FL0_GRVW8_GSU3_IU1_NLCA1_NLCB1_PGR1_PLR1_SIA3_SU0_SUM0_SUS256_SRVW0_TT2_64_WSGRA1_WSGRB1_WG64_4_1_WGM1
    SolutionIndex: 63
    SolutionNameMin: Cijk_Ailk_Bjlk_BBH_MT64x64x64_MI32x32x4x1_SE_1LDSB0_AF0EM8_AF1EM1_EPS1_FL0_GRVW8_GSU1_IU1_NLCA1_NLCB1_PGR1_PLR1_SIA3_SU0_SUM0_SUS256_SRVW4_TT1_32_WSGRA1_WSGRB1_WG64_4_1_WGM1
    SolutionIndex: 64
    SolutionNameMin: Cijk_Ailk_Bjlk_BBH_MT128x128x32_MI32x32x4x1_SE_1LDSB0_AF0EM4_AF1EM1_EPS1_FL0_GRVW4_GSU1_IU1_NLCA1_NLCB1_PGR1_PLR1_SIA3_SU0_SUM0_SUS256_SRVW4_TT2_64_WSGRA1_WSGRB1_WG64_4_1_WGM2
    SolutionIndex: 65
    SolutionNameMin: Cijk_Ailk_Bjlk_BBH_MT256x128x16_MI32x32x4x1_SE_1LDSB0_AF0EM8_AF1EM1_EPS1_FL0_GRVW8_GSU1_IU1_NLCA1_NLCB1_PGR1_PLR1_SIA3_SU32_SUM0_SUS256_SRVW4_TT4_64_WSGRA1_WSGRB1_WG64_4_1_WGM2
    SolutionIndex: 66
    SolutionNameMin: Cijk_Ailk_Bjlk_BBH_MT128x256x16_MI32x32x4x1_SE_1LDSB0_AF0EM8_AF1EM1_EPS1_FL0_GRVW8_GSU1_IU1_NLCA1_NLCB1_PGR1_PLR1_SIA3_SU0_SUM0_SUS256_SRVW4_TT2_128_WSGRA1_WSGRB1_WG64_4_1_WGM2
    SolutionIndex: 67
    SolutionNameMin: Cijk_Ailk_Bjlk_BBH_MT128x96x16_MI32x32x4x1_SE_1LDSB0_AF0EM8_AF1EM1_EPS0_FL0_GRVW2_GSU1_IU1_NLCA1_NLCB3_PGR2_PLR1_SIA3_SU32_SUM0_SUS128_SRVW4_TT1_96_WSGRA1_WSGRB1_WG128_2_1_WGM2
    SolutionIndex: 68
    SolutionNameMin: Cijk_Ailk_Bjlk_BBH_MT128x96x16_MI32x32x4x1_SE_1LDSB0_AF0EM8_AF1EM1_EPS0_FL0_GRVW2_GSU1_IU1_NLCA1_NLCB3_PGR2_PLR1_SIA3_SU32_SUM0_SUS128_SRVW4_TT1_96_WSGRA1_WSGRB1_WG128_2_1_WGM15
    SolutionIndex: 69
    SolutionNameMin: Cijk_Ailk_Bjlk_BBH_MT128x96x16_MI32x32x4x1_SE_1LDSB0_AF0EM8_AF1EM1_EPS0_FL0_GRVW2_GSU1_IU1_NLCA1_NLCB3_PGR2_PLR1_SIA3_SU0_SUM0_SUS256_SRVW4_TT1_96_WSGRA1_WSGRB1_WG128_2_1_WGM1
    SolutionIndex: 70
    SolutionNameMin: Cijk_Ailk_Bjlk_BBH_MT128x256x16_MI32x32x4x1_SE_1LDSB0_AF0EM8_AF1EM1_EPS1_FL0_GRVW8_GSU3_IU1_NLCA1_NLCB1_PGR1_PLR1_SIA3_SU0_SUM0_SUS256_SRVW0_TT2_128_WSGRA1_WSGRB1_WG64_4_1_WGM2
    SolutionIndex: 71
    SolutionNameMin: Cijk_Ailk_Bjlk_BBH_MT128x96x32_MI32x32x4x1_SE_1LDSB0_AF0EM8_AF1EM1_EPS0_FL0_GRVW4_GSU1_IU1_NLCA1_NLCB3_PGR2_PLR1_SIA3_SU32_SUM0_SUS128_SRVW4_TT1_96_WSGRA1_WSGRB1_WG128_2_1_WGM15
    SolutionIndex: 72
    SolutionNameMin: Cijk_Ailk_Bjlk_BBH_MT128x96x16_MI32x32x4x1_SE_1LDSB0_AF0EM8_AF1EM1_EPS0_FL0_GRVW2_GSU1_IU1_NLCA1_NLCB3_PGR2_PLR1_SIA3_SU0_SUM0_SUS256_SRVW4_TT1_96_WSGRA1_WSGRB1_WG128_2_1_WGM15
    SolutionIndex: 73
    SolutionNameMin: Cijk_Ailk_Bjlk_BBH_MT64x128x32_MI32x32x4x1_SE_1LDSB0_AF0EM8_AF1EM1_EPS0_FL0_GRVW2_GSU1_IU1_NLCA1_NLCB1_PGR2_PLR1_SIA3_SU0_SUM0_SUS256_SRVW4_TT1_64_WSGRA1_WSGRB1_WG64_4_1_WGM15
    SolutionIndex: 74
    SolutionNameMin: Cijk_Ailk_Bjlk_BBH_MT64x64x8_MI16x16x2x4_SE_1LDSB0_AF0EM1_AF1EM1_EPS1_FL0_GRVW4_GSU1_IU1_NLCA1_NLCB1_PGR1_PLR1_SIA3_SU32_SUM3_SUS256_SRVW4_TT1_16_WSGRA1_WSGRB0_WG64_4_1_WGM4
    SolutionIndex: 75
    SolutionNameMin: Cijk_Ailk_Bjlk_BBH_MT96x128x64_MI32x32x4x1_SE_1LDSB0_AF0EM1_AF1EM1_EPS1_FL0_GRVW8_GSU3_IU1_NLCA3_NLCB1_PGR1_PLR1_SIA3_SU32_SUM0_SUS128_SRVW0_TT3_32_WSGRA1_WSGRB1_WG32_8_1_WGM1
    SolutionIndex: 76
    SolutionNameMin: Cijk_Ailk_Bjlk_BBH_MT16x16x32_MI16x16x8x1_SE_1LDSB0_AF0EM1_AF1EM1_EPS1_FL0_GRVW4_GSU3_IU1_NLCA1_NLCB1_PGR1_PLR1_SIA3_SU32_SUM0_SUS128_SRVW0_TT1_16_WSGRA1_WSGRB1_WG16_4_1_WGM1
    SolutionIndex: 77
    SolutionNameMin: Cijk_Ailk_Bjlk_BBH_MT128x128x32_MI32x32x4x1_SE_1LDSB0_AF0EM8_AF1EM1_EPS1_FL0_GRVW8_GSU15_IU1_NLCA1_NLCB1_PGR1_PLR1_SIA3_SU0_SUM0_SUS256_SRVW0_TT2_64_WSGRA1_WSGRB1_WG64_4_1_WGM15
    SolutionIndex: 78
    SolutionNameMin: Cijk_Ailk_Bjlk_BBH_MT64x64x64_MI32x32x4x1_SE_1LDSB0_AF0EM8_AF1EM1_EPS0_FL0_GRVW8_GSU1_IU1_NLCA1_NLCB1_PGR2_PLR1_SIA3_SU0_SUM0_SUS256_SRVW4_TT1_32_WSGRA1_WSGRB1_WG64_4_1_WGM15
    SolutionIndex: 79
    SolutionNameMin: Cijk_Ailk_Bjlk_BBH_MT64x64x32_MI32x32x4x1_SE_1LDSB0_AF0EM8_AF1EM1_EPS1_FL0_GRVW4_GSU1_IU1_NLCA1_NLCB1_PGR1_PLR1_SIA3_SU0_SUM0_SUS256_SRVW4_TT1_32_WSGRA1_WSGRB1_WG64_4_1_WGM15
    SolutionIndex: 80
    SolutionNameMin: Cijk_Ailk_Bjlk_BBH_MT64x64x32_MI32x32x4x1_SE_1LDSB0_AF0EM8_AF1EM1_EPS1_FL0_GRVW8_GSU1_IU1_NLCA1_NLCB1_PGR1_PLR1_SIA3_SU32_SUM0_SUS256_SRVW4_TT1_32_WSGRA1_WSGRB1_WG64_4_1_WGM15
    SolutionIndex: 81
    SolutionNameMin: Cijk_Ailk_Bjlk_BBH_MT64x64x64_MI32x32x4x1_SE_1LDSB0_AF0EM8_AF1EM1_EPS1_FL0_GRVW8_GSU1_IU1_NLCA1_NLCB1_PGR1_PLR1_SIA3_SU32_SUM0_SUS256_SRVW4_TT1_32_WSGRA1_WSGRB1_WG64_4_1_WGM1
    SolutionIndex: 82
    SolutionNameMin: Cijk_Ailk_Bjlk_BBH_MT32x32x64_MI16x16x8x1_SE_1LDSB0_AF0EM4_AF1EM1_EPS1_FL0_GRVW8_GSU1_IU1_NLCA1_NLCB1_PGR1_PLR1_SIA3_SU32_SUM0_SUS128_SRVW0_TT1_16_WSGRA1_WSGRB1_WG32_8_1_WGM1
    SolutionIndex: 83
    SolutionNameMin: Cijk_Ailk_Bjlk_BBH_MT32x32x64_MI16x16x8x1_SE_1LDSB0_AF0EM4_AF1EM1_EPS1_FL0_GRVW8_GSU1_IU1_NLCA1_NLCB1_PGR1_PLR1_SIA3_SU16_SUM0_SUS128_SRVW0_TT1_16_WSGRA1_WSGRB1_WG32_8_1_WGM1
    SolutionIndex: 84
    SolutionNameMin: Cijk_Ailk_Bjlk_BBH_MT64x64x64_MI32x32x4x1_SE_1LDSB0_AF0EM8_AF1EM1_EPS1_FL0_GRVW8_GSU1_IU1_NLCA1_NLCB1_PGR1_PLR1_SIA3_SU32_SUM0_SUS128_SRVW4_TT1_32_WSGRA1_WSGRB1_WG64_4_1_WGM1
    SolutionIndex: 85
    SolutionNameMin: Cijk_Ailk_Bjlk_BBH_MT256x64x32_MI32x32x4x1_SE_1LDSB0_AF0EM8_AF1EM1_EPS1_FL0_GRVW8_GSU7_IU1_NLCA1_NLCB1_PGR1_PLR1_SIA3_SU32_SUM0_SUS256_SRVW0_TT4_32_WSGRA1_WSGRB1_WG64_4_1_WGM15
    SolutionIndex: 86
    SolutionNameMin: Cijk_Ailk_Bjlk_BBH_MT96x128x32_MI32x32x4x1_SE_1LDSB0_AF0EM8_AF1EM1_EPS1_FL0_GRVW4_GSU5_IU1_NLCA3_NLCB1_PGR1_PLR1_SIA3_SU32_SUM0_SUS128_SRVW0_TT3_32_WSGRA1_WSGRB1_WG32_8_1_WGM1
    SolutionIndex: 87
    SolutionNameMin: Cijk_Ailk_Bjlk_BBH_MT96x128x32_MI32x32x4x1_SE_1LDSB0_AF0EM8_AF1EM1_EPS1_FL0_GRVW4_GSU5_IU1_NLCA3_NLCB1_PGR1_PLR1_SIA3_SU32_SUM0_SUS256_SRVW0_TT3_32_WSGRA1_WSGRB1_WG32_8_1_WGM15
    SolutionIndex: 88
    SolutionNameMin: Cijk_Ailk_Bjlk_BBH_MT96x128x32_MI32x32x4x1_SE_1LDSB0_AF0EM8_AF1EM1_EPS1_FL0_GRVW4_GSU5_IU1_NLCA3_NLCB1_PGR1_PLR1_SIA3_SU0_SUM0_SUS256_SRVW0_TT3_32_WSGRA1_WSGRB1_WG32_8_1_WGM15
    SolutionIndex: 89
    SolutionNameMin: Cijk_Ailk_Bjlk_BBH_MT256x64x32_MI32x32x4x1_SE_1LDSB0_AF0EM8_AF1EM1_EPS1_FL0_GRVW4_GSU7_IU1_NLCA1_NLCB1_PGR1_PLR1_SIA3_SU0_SUM0_SUS256_SRVW0_TT4_32_WSGRA1_WSGRB1_WG64_4_1_WGM1
    SolutionIndex: 90
    SolutionNameMin: Cijk_Ailk_Bjlk_BBH_MT64x64x32_MI32x32x4x1_SE_1LDSB0_AF0EM8_AF1EM1_EPS1_FL0_GRVW8_GSU3_IU1_NLCA1_NLCB1_PGR1_PLR1_SIA3_SU0_SUM0_SUS256_SRVW0_TT1_32_WSGRA1_WSGRB1_WG64_4_1_WGM15
    SolutionIndex: 91
    SolutionNameMin: Cijk_Ailk_Bjlk_BBH_MT256x64x32_MI32x32x4x1_SE_1LDSB0_AF0EM8_AF1EM1_EPS1_FL0_GRVW8_GSU7_IU1_NLCA1_NLCB1_PGR1_PLR1_SIA3_SU0_SUM0_SUS256_SRVW0_TT4_32_WSGRA1_WSGRB1_WG64_4_1_WGM15
    SolutionIndex: 92
    SolutionNameMin: Cijk_Ailk_Bjlk_BBH_MT256x64x32_MI32x32x4x1_SE_1LDSB0_AF0EM8_AF1EM1_EPS1_FL0_GRVW8_GSU7_IU1_NLCA1_NLCB1_PGR1_PLR1_SIA3_SU32_SUM0_SUS256_SRVW0_TT4_32_WSGRA1_WSGRB1_WG64_4_1_WGM2
    SolutionIndex: 93
    SolutionNameMin: Cijk_Ailk_Bjlk_BBH_MT96x128x32_MI32x32x4x1_SE_1LDSB0_AF0EM8_AF1EM1_EPS1_FL0_GRVW4_GSU5_IU1_NLCA3_NLCB1_PGR1_PLR1_SIA3_SU32_SUM0_SUS256_SRVW0_TT3_32_WSGRA1_WSGRB1_WG32_8_1_WGM2
    SolutionIndex: 94
    SolutionNameMin: Cijk_Ailk_Bjlk_BBH_MT64x128x32_MI32x32x4x1_SE_1LDSB0_AF0EM8_AF1EM1_EPS1_FL0_GRVW8_GSU7_IU1_NLCA1_NLCB1_PGR1_PLR1_SIA3_SU32_SUM0_SUS256_SRVW0_TT1_64_WSGRA1_WSGRB1_WG64_4_1_WGM2
    SolutionIndex: 95
    SolutionNameMin: Cijk_Ailk_Bjlk_BBH_MT256x64x32_MI32x32x4x1_SE_1LDSB0_AF0EM8_AF1EM1_EPS1_FL0_GRVW8_GSU7_IU1_NLCA1_NLCB1_PGR1_PLR1_SIA3_SU0_SUM0_SUS256_SRVW0_TT4_32_WSGRA1_WSGRB1_WG64_4_1_WGM2
    SolutionIndex: 96
    SolutionNameMin: Cijk_Ailk_Bjlk_BBH_MT256x64x32_MI32x32x4x1_SE_1LDSB0_AF0EM8_AF1EM1_EPS1_FL0_GRVW8_GSU7_IU1_NLCA1_NLCB1_PGR1_PLR1_SIA3_SU32_SUM0_SUS128_SRVW0_TT4_32_WSGRA1_WSGRB1_WG64_4_1_WGM15
    SolutionIndex: 97
    SolutionNameMin: Cijk_Ailk_Bjlk_BBH_MT256x64x32_MI32x32x4x1_SE_1LDSB0_AF0EM8_AF1EM1_EPS1_FL0_GRVW8_GSU7_IU1_NLCA1_NLCB1_PGR1_PLR1_SIA3_SU0_SUM0_SUS256_SRVW0_TT4_32_WSGRA1_WSGRB1_WG64_4_1_WGM1
    SolutionIndex: 98
    SolutionNameMin: Cijk_Ailk_Bjlk_BBH_MT256x64x32_MI32x32x4x1_SE_1LDSB0_AF0EM8_AF1EM1_EPS1_FL0_GRVW8_GSU15_IU1_NLCA1_NLCB1_PGR1_PLR1_SIA3_SU32_SUM0_SUS256_SRVW0_TT4_32_WSGRA1_WSGRB1_WG64_4_1_WGM1
    SolutionIndex: 99
    SolutionNameMin: Cijk_Ailk_Bjlk_BBH_MT96x128x32_MI32x32x4x1_SE_1LDSB0_AF0EM8_AF1EM1_EPS1_FL0_GRVW4_GSU5_IU1_NLCA3_NLCB1_PGR1_PLR1_SIA3_SU0_SUM0_SUS256_SRVW0_TT3_32_WSGRA1_WSGRB1_WG32_8_1_WGM2
    SolutionIndex: 100
    SolutionNameMin: Cijk_Ailk_Bjlk_BBH_MT64x256x32_MI32x32x4x1_SE_1LDSB0_AF0EM8_AF1EM1_EPS1_FL0_GRVW8_GSU7_IU1_NLCA1_NLCB1_PGR1_PLR1_SIA3_SU0_SUM0_SUS256_SRVW0_TT1_128_WSGRA1_WSGRB1_WG64_4_1_WGM1
    SolutionIndex: 101
    SolutionNameMin: Cijk_Ailk_Bjlk_BBH_MT256x128x16_MI32x32x4x1_SE_1LDSB0_AF0EM8_AF1EM1_EPS1_FL0_GRVW8_GSU7_IU1_NLCA1_NLCB1_PGR1_PLR1_SIA3_SU32_SUM0_SUS128_SRVW0_TT4_64_WSGRA1_WSGRB1_WG64_4_1_WGM15
    SolutionIndex: 102
    SolutionNameMin: Cijk_Ailk_Bjlk_BBH_MT64x64x32_MI32x32x4x1_SE_1LDSB0_AF0EM8_AF1EM1_EPS1_FL0_GRVW8_GSU1_IU1_NLCA1_NLCB1_PGR1_PLR1_SIA3_SU32_SUM0_SUS128_SRVW4_TT1_32_WSGRA1_WSGRB1_WG64_4_1_WGM2
    SolutionIndex: 103
    SolutionNameMin: Cijk_Ailk_Bjlk_BBH_MT64x64x64_MI32x32x4x1_SE_1LDSB0_AF0EM8_AF1EM1_EPS1_FL0_GRVW8_GSU1_IU1_NLCA1_NLCB1_PGR1_PLR1_SIA3_SU32_SUM0_SUS256_SRVW4_TT1_32_WSGRA1_WSGRB1_WG64_4_1_WGM2
    SolutionIndex: 104
    SolutionNameMin: Cijk_Ailk_Bjlk_BBH_MT128x96x32_MI32x32x4x1_SE_1LDSB0_AF0EM4_AF1EM1_EPS1_FL0_GRVW4_GSU1_IU1_NLCA1_NLCB3_PGR1_PLR1_SIA3_SU32_SUM0_SUS128_SRVW4_TT1_96_WSGRA1_WSGRB1_WG128_2_1_WGM1
    SolutionIndex: 105
    SolutionNameMin: Cijk_Ailk_Bjlk_BBH_MT64x128x32_MI32x32x4x1_SE_1LDSB0_AF0EM8_AF1EM1_EPS1_FL0_GRVW8_GSU1_IU1_NLCA1_NLCB1_PGR1_PLR1_SIA3_SU32_SUM0_SUS128_SRVW4_TT1_64_WSGRA1_WSGRB1_WG64_4_1_WGM1
    SolutionIndex: 106
    SolutionNameMin: Cijk_Ailk_Bjlk_BBH_MT64x128x32_MI32x32x4x1_SE_1LDSB0_AF0EM1_AF1EM1_EPS1_FL0_GRVW4_GSU1_IU1_NLCA1_NLCB1_PGR1_PLR1_SIA3_SU32_SUM0_SUS256_SRVW4_TT2_32_WSGRA1_WSGRB0_WG32_8_1_WGM10
    SolutionIndex: 107
    SolutionNameMin: Cijk_Ailk_Bjlk_BBH_MT128x64x16_MI32x32x4x1_SE_1LDSB0_AF0EM8_AF1EM1_EPS0_FL0_GRVW8_GSU1_IU1_NLCA1_NLCB1_PGR2_PLR1_SIA3_SU32_SUM0_SUS128_SRVW4_TT2_32_WSGRA1_WSGRB1_WG64_4_1_WGM15
    SolutionIndex: 108
    SolutionNameMin: Cijk_Ailk_Bjlk_BBH_MT128x96x32_MI32x32x4x1_SE_1LDSB0_AF0EM8_AF1EM1_EPS1_FL0_GRVW4_GSU1_IU1_NLCA1_NLCB3_PGR1_PLR1_SIA3_SU32_SUM0_SUS256_SRVW4_TT1_96_WSGRA1_WSGRB1_WG128_2_1_WGM2
    SolutionIndex: 109
    SolutionNameMin: Cijk_Ailk_Bjlk_BBH_MT128x96x32_MI32x32x4x1_SE_1LDSB0_AF0EM4_AF1EM1_EPS1_FL0_GRVW4_GSU1_IU1_NLCA1_NLCB3_PGR1_PLR1_SIA3_SU16_SUM0_SUS128_SRVW4_TT1_96_WSGRA1_WSGRB1_WG128_2_1_WGM2
    SolutionIndex: 110
    SolutionNameMin: Cijk_Ailk_Bjlk_BBH_MT128x96x32_MI32x32x4x1_SE_1LDSB0_AF0EM8_AF1EM1_EPS1_FL0_GRVW4_GSU1_IU1_NLCA1_NLCB3_PGR1_PLR1_SIA3_SU0_SUM0_SUS256_SRVW4_TT1_96_WSGRA1_WSGRB1_WG128_2_1_WGM15
    SolutionIndex: 111
    SolutionNameMin: Cijk_Ailk_Bjlk_BBH_MT128x64x32_MI32x32x4x1_SE_1LDSB0_AF0EM8_AF1EM1_EPS1_FL0_GRVW8_GSU1_IU1_NLCA1_NLCB1_PGR1_PLR1_SIA3_SU0_SUM0_SUS256_SRVW4_TT2_32_WSGRA1_WSGRB1_WG64_4_1_WGM1
    SolutionIndex: 112
    SolutionNameMin: Cijk_Ailk_Bjlk_BBH_MT32x64x16_MI16x16x8x1_SE_1LDSB0_AF0EM1_AF1EM1_EPS1_FL0_GRVW4_GSU1_IU1_NLCA1_NLCB1_PGR1_PLR1_SIA3_SU32_SUM0_SUS256_SRVW4_TT2_16_WSGRA1_WSGRB1_WG16_16_1_WGM1
    SolutionIndex: 113
    SolutionNameMin: Cijk_Ailk_Bjlk_BBH_MT32x64x16_MI16x16x8x1_SE_1LDSB0_AF0EM1_AF1EM1_EPS1_FL0_GRVW8_GSU1_IU1_NLCA1_NLCB1_PGR1_PLR1_SIA3_SU32_SUM0_SUS256_SRVW4_TT1_32_WSGRA1_WSGRB1_WG32_8_1_WGM2
    SolutionIndex: 114
    SolutionNameMin: Cijk_Ailk_Bjlk_BBH_MT32x64x16_MI16x16x8x1_SE_1LDSB0_AF0EM4_AF1EM1_EPS1_FL0_GRVW4_GSU1_IU1_NLCA1_NLCB1_PGR1_PLR1_SIA3_SU0_SUM0_SUS256_SRVW0_TT1_32_WSGRA1_WSGRB1_WG32_8_1_WGM1
    SolutionIndex: 115
    SolutionNameMin: Cijk_Ailk_Bjlk_BBH_MT32x64x16_MI16x16x8x1_SE_1LDSB0_AF0EM1_AF1EM1_EPS1_FL0_GRVW2_GSU1_IU1_NLCA1_NLCB1_PGR1_PLR1_SIA3_SU32_SUM0_SUS256_SRVW4_TT1_32_WSGRA1_WSGRB1_WG32_8_1_WGM2
    SolutionIndex: 116
    SolutionNameMin: Cijk_Ailk_Bjlk_BBH_MT32x32x32_MI16x16x8x1_SE_1LDSB0_AF0EM8_AF1EM1_EPS1_FL0_GRVW8_GSU1_IU1_NLCA1_NLCB1_PGR1_PLR1_SIA3_SU0_SUM0_SUS256_SRVW4_TT1_16_WSGRA1_WSGRB1_WG32_8_1_WGM2
    SolutionIndex: 117
    SolutionNameMin: Cijk_Ailk_Bjlk_BBH_MT32x64x16_MI16x16x8x1_SE_1LDSB0_AF0EM1_AF1EM1_EPS1_FL0_GRVW4_GSU1_IU1_NLCA1_NLCB1_PGR1_PLR1_SIA3_SU16_SUM0_SUS256_SRVW0_TT1_32_WSGRA1_WSGRB1_WG32_8_1_WGM2
    SolutionIndex: 118
    SolutionNameMin: Cijk_Ailk_Bjlk_BBH_MT32x64x16_MI16x16x8x1_SE_1LDSB0_AF0EM1_AF1EM1_EPS1_FL0_GRVW4_GSU1_IU1_NLCA1_NLCB1_PGR1_PLR1_SIA3_SU32_SUM3_SUS256_SRVW4_TT2_16_WSGRA0_WSGRB0_WG16_16_1_WGM10
    SolutionIndex: 119
    SolutionNameMin: Cijk_Ailk_Bjlk_BBH_MT32x64x16_MI16x16x8x1_SE_1LDSB0_AF0EM1_AF1EM1_EPS1_FL0_GRVW2_GSU1_IU1_NLCA1_NLCB1_PGR1_PLR1_SIA3_SU0_SUM0_SUS256_SRVW0_TT1_32_WSGRA1_WSGRB1_WG32_8_1_WGM1
    SolutionIndex: 120
    SolutionNameMin: Cijk_Ailk_Bjlk_BBH_MT64x32x16_MI16x16x8x1_SE_1LDSB0_AF0EM4_AF1EM1_EPS1_FL0_GRVW2_GSU1_IU1_NLCA1_NLCB1_PGR1_PLR1_SIA3_SU0_SUM0_SUS256_SRVW0_TT2_16_WSGRA1_WSGRB1_WG32_8_1_WGM1
    SolutionIndex: 121
    SolutionNameMin: Cijk_Ailk_Bjlk_BBH_MT64x32x16_MI16x16x8x1_SE_1LDSB0_AF0EM4_AF1EM1_EPS1_FL0_GRVW2_GSU1_IU1_NLCA1_NLCB1_PGR1_PLR1_SIA3_SU16_SUM0_SUS256_SRVW0_TT2_16_WSGRA1_WSGRB1_WG32_8_1_WGM2
    SolutionIndex: 122
    SolutionNameMin: Cijk_Ailk_Bjlk_BBH_MT64x32x16_MI16x16x8x1_SE_1LDSB0_AF0EM4_AF1EM1_EPS1_FL0_GRVW8_GSU1_IU1_NLCA1_NLCB1_PGR1_PLR1_SIA3_SU16_SUM0_SUS128_SRVW0_TT2_16_WSGRA1_WSGRB1_WG32_8_1_WGM1
    SolutionIndex: 123
    SolutionNameMin: Cijk_Ailk_Bjlk_BBH_MT64x32x16_MI16x16x8x1_SE_1LDSB0_AF0EM4_AF1EM1_EPS1_FL0_GRVW2_GSU1_IU1_NLCA1_NLCB1_PGR1_PLR1_SIA3_SU16_SUM0_SUS256_SRVW0_TT2_16_WSGRA1_WSGRB1_WG32_8_1_WGM1
    SolutionIndex: 124
    SolutionNameMin: Cijk_Ailk_Bjlk_BBH_MT64x32x16_MI16x16x8x1_SE_1LDSB0_AF0EM8_AF1EM1_EPS1_FL0_GRVW8_GSU1_IU1_NLCA1_NLCB1_PGR1_PLR1_SIA3_SU0_SUM0_SUS256_SRVW4_TT2_16_WSGRA1_WSGRB1_WG32_8_1_WGM1
    SolutionIndex: 125
    SolutionNameMin: Cijk_Ailk_Bjlk_BBH_MT64x64x16_MI32x32x4x1_SE_1LDSB0_AF0EM8_AF1EM1_EPS1_FL0_GRVW2_GSU1_IU1_NLCA1_NLCB1_PGR1_PLR1_SIA3_SU0_SUM0_SUS256_SRVW4_TT1_32_WSGRA1_WSGRB1_WG64_4_1_WGM15
    SolutionIndex: 126
    SolutionNameMin: Cijk_Ailk_Bjlk_BBH_MT64x64x16_MI32x32x4x1_SE_1LDSB0_AF0EM8_AF1EM1_EPS1_FL0_GRVW8_GSU1_IU1_NLCA1_NLCB1_PGR1_PLR1_SIA3_SU0_SUM0_SUS256_SRVW4_TT1_32_WSGRA1_WSGRB1_WG64_4_1_WGM1
    SolutionIndex: 127
    SolutionNameMin: Cijk_Ailk_Bjlk_BBH_MT64x64x16_MI32x32x4x1_SE_1LDSB0_AF0EM8_AF1EM1_EPS1_FL0_GRVW2_GSU1_IU1_NLCA1_NLCB1_PGR1_PLR1_SIA3_SU0_SUM0_SUS256_SRVW4_TT1_32_WSGRA1_WSGRB1_WG64_4_1_WGM1
    SolutionIndex: 128
    SolutionNameMin: Cijk_Ailk_Bjlk_BBH_MT64x64x64_MI32x32x4x1_SE_1LDSB0_AF0EM8_AF1EM1_EPS1_FL0_GRVW8_GSU1_IU1_NLCA1_NLCB1_PGR1_PLR1_SIA3_SU0_SUM0_SUS256_SRVW4_TT1_32_WSGRA1_WSGRB1_WG64_4_1_WGM2
    SolutionIndex: 129
    SolutionNameMin: Cijk_Ailk_Bjlk_BBH_MT160x128x32_MI32x32x4x1_SE_1LDSB0_AF0EM8_AF1EM1_EPS1_FL0_GRVW2_GSU2_IU1_NLCA5_NLCB1_PGR1_PLR1_SIA3_SU32_SUM0_SUS256_SRVW0_TT5_32_WSGRA1_WSGRB1_WG32_8_1_WGM15
    SolutionIndex: 130
    SolutionNameMin: Cijk_Ailk_Bjlk_BBH_MT128x160x32_MI32x32x4x1_SE_1LDSB0_AF0EM8_AF1EM1_EPS1_FL0_GRVW4_GSU2_IU1_NLCA1_NLCB5_PGR1_PLR1_SIA3_SU0_SUM0_SUS256_SRVW4_TT1_160_WSGRA1_WSGRB1_WG128_2_1_WGM2
    SolutionIndex: 131
    SolutionNameMin: Cijk_Ailk_Bjlk_BBH_MT128x96x32_MI32x32x4x1_SE_1LDSB0_AF0EM4_AF1EM1_EPS1_FL0_GRVW4_GSU1_IU1_NLCA1_NLCB3_PGR1_PLR1_SIA3_SU16_SUM0_SUS128_SRVW4_TT1_96_WSGRA1_WSGRB1_WG128_2_1_WGM15
    SolutionIndex: 132
    SolutionNameMin: Cijk_Ailk_Bjlk_BBH_MT128x96x32_MI32x32x4x1_SE_1LDSB0_AF0EM8_AF1EM1_EPS0_FL0_GRVW4_GSU1_IU1_NLCA1_NLCB3_PGR2_PLR1_SIA3_SU0_SUM0_SUS256_SRVW4_TT1_96_WSGRA1_WSGRB1_WG128_2_1_WGM15
    SolutionIndex: 133
    SolutionNameMin: Cijk_Ailk_Bjlk_BBH_MT128x96x32_MI32x32x4x1_SE_1LDSB0_AF0EM8_AF1EM1_EPS0_FL0_GRVW2_GSU1_IU1_NLCA1_NLCB3_PGR2_PLR1_SIA3_SU0_SUM0_SUS256_SRVW4_TT1_96_WSGRA1_WSGRB1_WG128_2_1_WGM15
    SolutionIndex: 134
    SolutionNameMin: Cijk_Ailk_Bjlk_BBH_MT128x96x32_MI32x32x4x1_SE_1LDSB0_AF0EM8_AF1EM1_EPS1_FL0_GRVW4_GSU1_IU1_NLCA1_NLCB3_PGR1_PLR1_SIA3_SU32_SUM0_SUS256_SRVW4_TT1_96_WSGRA1_WSGRB1_WG128_2_1_WGM15
    SolutionIndex: 135
    SolutionNameMin: Cijk_Ailk_Bjlk_BBH_MT128x96x32_MI32x32x4x1_SE_1LDSB0_AF0EM4_AF1EM1_EPS1_FL0_GRVW4_GSU1_IU1_NLCA1_NLCB3_PGR1_PLR1_SIA3_SU0_SUM0_SUS256_SRVW4_TT1_96_WSGRA1_WSGRB1_WG128_2_1_WGM15
    SolutionIndex: 136
    SolutionNameMin: Cijk_Ailk_Bjlk_BBH_MT128x96x32_MI32x32x4x1_SE_1LDSB0_AF0EM4_AF1EM1_EPS1_FL0_GRVW4_GSU1_IU1_NLCA1_NLCB3_PGR1_PLR1_SIA3_SU0_SUM0_SUS256_SRVW4_TT1_96_WSGRA1_WSGRB1_WG128_2_1_WGM2
    SolutionIndex: 137
    SolutionNameMin: Cijk_Ailk_Bjlk_BBH_MT128x288x16_MI32x32x4x1_SE_1LDSB0_AF0EM8_AF1EM1_EPS1_FL0_GRVW2_GSU1_IU1_NLCA1_NLCB9_PGR1_PLR1_SIA3_SU32_SUM0_SUS256_SRVW4_TT1_288_WSGRA1_WSGRB1_WG128_2_1_WGM2
    SolutionIndex: 138
    SolutionNameMin: Cijk_Ailk_Bjlk_BBH_MT128x192x32_MI32x32x4x1_SE_1LDSB1_AF0EM8_AF1EM1_EPS0_FL0_GRVW8_GSU1_IU1_NLCA1_NLCB3_PGR2_PLR1_SIA3_SU0_SUM0_SUS256_SRVW4_TT2_96_WSGRA1_WSGRB1_WG64_4_1_WGM1
    SolutionIndex: 139
    SolutionNameMin: Cijk_Ailk_Bjlk_BBH_MT128x192x32_MI32x32x4x1_SE_1LDSB1_AF0EM8_AF1EM1_EPS0_FL0_GRVW8_GSU1_IU1_NLCA1_NLCB3_PGR2_PLR1_SIA3_SU0_SUM0_SUS256_SRVW4_TT2_96_WSGRA1_WSGRB1_WG64_4_1_WGM2
    SolutionIndex: 140
    SolutionNameMin: Cijk_Ailk_Bjlk_BBH_MT128x96x16_MI32x32x4x1_SE_1LDSB0_AF0EM8_AF1EM1_EPS0_FL0_GRVW2_GSU1_IU1_NLCA1_NLCB3_PGR2_PLR1_SIA3_SU0_SUM0_SUS256_SRVW4_TT1_96_WSGRA1_WSGRB1_WG128_2_1_WGM2
    SolutionIndex: 141
    SolutionNameMin: Cijk_Ailk_Bjlk_BBH_MT32x64x16_MI16x16x8x1_SE_1LDSB0_AF0EM1_AF1EM1_EPS1_FL0_GRVW4_GSU1_IU1_NLCA1_NLCB1_PGR1_PLR1_SIA3_SU32_SUM3_SUS256_SRVW4_TT2_16_WSGRA1_WSGRB1_WG16_16_1_WGM4
    SolutionIndex: 142
    SolutionNameMin: Cijk_Ailk_Bjlk_BBH_MT64x32x16_MI16x16x8x1_SE_1LDSB0_AF0EM8_AF1EM1_EPS1_FL0_GRVW4_GSU1_IU1_NLCA1_NLCB1_PGR1_PLR1_SIA3_SU0_SUM0_SUS256_SRVW4_TT2_16_WSGRA1_WSGRB1_WG32_8_1_WGM1
    SolutionIndex: 143
    SolutionNameMin: Cijk_Ailk_Bjlk_BBH_MT64x64x16_MI32x32x4x1_SE_1LDSB0_AF0EM8_AF1EM1_EPS1_FL0_GRVW2_GSU1_IU1_NLCA1_NLCB1_PGR1_PLR1_SIA3_SU32_SUM0_SUS128_SRVW4_TT1_32_WSGRA1_WSGRB1_WG64_4_1_WGM15
    SolutionIndex: 144
    SolutionNameMin: Cijk_Ailk_Bjlk_BBH_MT128x96x16_MI32x32x4x1_SE_1LDSB0_AF0EM8_AF1EM1_EPS0_FL0_GRVW2_GSU1_IU1_NLCA1_NLCB3_PGR2_PLR1_SIA3_SU32_SUM0_SUS256_SRVW4_TT1_96_WSGRA1_WSGRB1_WG128_2_1_WGM15
    SolutionIndex: 145
    SolutionNameMin: Cijk_Ailk_Bjlk_BBH_MT64x128x16_MI32x32x4x1_SE_1LDSB0_AF0EM8_AF1EM1_EPS1_FL0_GRVW2_GSU1_IU1_NLCA1_NLCB1_PGR1_PLR1_SIA3_SU32_SUM0_SUS256_SRVW4_TT1_64_WSGRA1_WSGRB1_WG64_4_1_WGM1
    SolutionIndex: 146
    SolutionNameMin: Cijk_Ailk_Bjlk_BBH_MT64x192x16_MI32x32x4x1_SE_1LDSB0_AF0EM8_AF1EM1_EPS0_FL0_GRVW4_GSU1_IU1_NLCA1_NLCB3_PGR2_PLR1_SIA3_SU0_SUM0_SUS256_SRVW4_TT1_96_WSGRA1_WSGRB1_WG64_4_1_WGM15
    SolutionIndex: 147
    SolutionNameMin: Cijk_Ailk_Bjlk_BBH_MT64x128x16_MI32x32x4x1_SE_1LDSB0_AF0EM8_AF1EM1_EPS1_FL0_GRVW8_GSU1_IU1_NLCA1_NLCB1_PGR1_PLR1_SIA3_SU0_SUM0_SUS256_SRVW4_TT1_64_WSGRA1_WSGRB1_WG64_4_1_WGM1
    SolutionIndex: 148
    SolutionNameMin: Cijk_Ailk_Bjlk_BBH_MT64x128x16_MI32x32x4x1_SE_1LDSB0_AF0EM8_AF1EM1_EPS0_FL0_GRVW2_GSU1_IU1_NLCA1_NLCB1_PGR2_PLR1_SIA3_SU32_SUM0_SUS128_SRVW4_TT1_64_WSGRA1_WSGRB1_WG64_4_1_WGM2
    SolutionIndex: 149
    SolutionNameMin: Cijk_Ailk_Bjlk_BBH_MT64x128x16_MI32x32x4x1_SE_1LDSB0_AF0EM8_AF1EM1_EPS1_FL0_GRVW8_GSU1_IU1_NLCA1_NLCB1_PGR1_PLR1_SIA3_SU0_SUM0_SUS256_SRVW4_TT1_64_WSGRA1_WSGRB1_WG64_4_1_WGM15
    SolutionIndex: 150
    SolutionNameMin: Cijk_Ailk_Bjlk_BBH_MT64x128x16_MI32x32x4x1_SE_1LDSB0_AF0EM8_AF1EM1_EPS0_FL0_GRVW4_GSU1_IU1_NLCA1_NLCB1_PGR2_PLR1_SIA3_SU32_SUM0_SUS256_SRVW4_TT1_64_WSGRA1_WSGRB1_WG64_4_1_WGM15
    SolutionIndex: 151
    SolutionNameMin: Cijk_Ailk_Bjlk_BBH_MT64x64x32_MI32x32x4x1_SE_1LDSB0_AF0EM1_AF1EM1_EPS1_FL0_GRVW8_GSU1_IU1_NLCA1_NLCB1_PGR1_PLR1_SIA3_SU0_SUM0_SUS256_SRVW4_TT1_32_WSGRA1_WSGRB1_WG64_4_1_WGM2
    SolutionIndex: 152
    SolutionNameMin: Cijk_Ailk_Bjlk_BBH_MT64x128x16_MI32x32x2x2_SE_1LDSB0_AF0EM1_AF1EM1_EPS1_FL0_GRVW4_GSU1_IU1_NLCA1_NLCB1_PGR1_PLR1_SIA3_SU32_SUM3_SUS256_SRVW4_TT1_32_WSGRA0_WSGRB0_WG64_4_1_WGM10
    SolutionIndex: 153
    SolutionNameMin: Cijk_Ailk_Bjlk_BBH_MT64x128x16_MI32x32x4x1_SE_1LDSB0_AF0EM1_AF1EM1_EPS1_FL0_GRVW8_GSU1_IU1_NLCA1_NLCB1_PGR1_PLR1_SIA3_SU32_SUM0_SUS128_SRVW4_TT1_64_WSGRA1_WSGRB1_WG64_4_1_WGM1
    SolutionIndex: 154
    SolutionNameMin: Cijk_Ailk_Bjlk_BBH_MT128x96x16_MI32x32x4x1_SE_1LDSB0_AF0EM1_AF1EM1_EPS1_FL0_GRVW2_GSU1_IU1_NLCA1_NLCB3_PGR1_PLR1_SIA3_SU32_SUM0_SUS128_SRVW4_TT1_96_WSGRA1_WSGRB1_WG128_2_1_WGM15
    SolutionIndex: 155
    SolutionNameMin: Cijk_Ailk_Bjlk_BBH_MT128x96x32_MI32x32x4x1_SE_1LDSB0_AF0EM1_AF1EM1_EPS1_FL0_GRVW4_GSU1_IU1_NLCA1_NLCB3_PGR1_PLR1_SIA3_SU32_SUM0_SUS128_SRVW4_TT1_96_WSGRA1_WSGRB1_WG128_2_1_WGM15
    SolutionIndex: 156
    SolutionNameMin: Cijk_Ailk_Bjlk_BBH_MT128x64x16_MI32x32x4x1_SE_1LDSB0_AF0EM1_AF1EM1_EPS1_FL0_GRVW4_GSU1_IU1_NLCA1_NLCB1_PGR1_PLR1_SIA3_SU0_SUM0_SUS256_SRVW4_TT2_32_WSGRA1_WSGRB1_WG64_4_1_WGM1
    SolutionIndex: 157
    SolutionNameMin: Cijk_Ailk_Bjlk_BBH_MT64x128x16_MI32x32x4x1_SE_1LDSB0_AF0EM1_AF1EM1_EPS1_FL0_GRVW8_GSU1_IU1_NLCA1_NLCB1_PGR1_PLR1_SIA3_SU32_SUM0_SUS256_SRVW4_TT1_64_WSGRA1_WSGRB1_WG64_4_1_WGM1
    SolutionIndex: 158
    SolutionNameMin: Cijk_Ailk_Bjlk_BBH_MT64x128x16_MI32x32x4x1_SE_1LDSB0_AF0EM8_AF1EM1_EPS0_FL0_GRVW8_GSU1_IU1_NLCA1_NLCB1_PGR2_PLR1_SIA3_SU32_SUM0_SUS256_SRVW4_TT1_64_WSGRA1_WSGRB1_WG64_4_1_WGM15
    SolutionIndex: 159
    SolutionNameMin: Cijk_Ailk_Bjlk_BBH_MT64x128x16_MI32x32x4x1_SE_1LDSB0_AF0EM8_AF1EM1_EPS0_FL0_GRVW4_GSU1_IU1_NLCA1_NLCB1_PGR2_PLR1_SIA3_SU32_SUM0_SUS128_SRVW4_TT1_64_WSGRA1_WSGRB1_WG64_4_1_WGM2
    SolutionIndex: 160
    SolutionNameMin: Cijk_Ailk_Bjlk_BBH_MT64x192x16_MI32x32x4x1_SE_1LDSB0_AF0EM8_AF1EM1_EPS0_FL0_GRVW4_GSU1_IU1_NLCA1_NLCB3_PGR2_PLR1_SIA3_SU0_SUM0_SUS256_SRVW4_TT1_96_WSGRA1_WSGRB1_WG64_4_1_WGM2
    SolutionIndex: 161
    SolutionNameMin: Cijk_Ailk_Bjlk_BBH_MT64x192x16_MI32x32x4x1_SE_1LDSB0_AF0EM8_AF1EM1_EPS0_FL0_GRVW4_GSU1_IU1_NLCA1_NLCB3_PGR2_PLR1_SIA3_SU32_SUM0_SUS256_SRVW4_TT1_96_WSGRA1_WSGRB1_WG64_4_1_WGM15
    SolutionIndex: 162
    SolutionNameMin: Cijk_Ailk_Bjlk_BBH_MT64x64x16_MI32x32x4x1_SE_1LDSB0_AF0EM1_AF1EM1_EPS1_FL0_GRVW2_GSU1_IU1_NLCA1_NLCB1_PGR1_PLR1_SIA3_SU0_SUM0_SUS256_SRVW4_TT1_32_WSGRA1_WSGRB1_WG64_4_1_WGM1
    SolutionIndex: 163
    SolutionNameMin: Cijk_Ailk_Bjlk_BBH_MT64x128x16_MI32x32x4x1_SE_1LDSB0_AF0EM1_AF1EM1_EPS1_FL0_GRVW8_GSU1_IU1_NLCA1_NLCB1_PGR1_PLR1_SIA3_SU0_SUM0_SUS256_SRVW4_TT1_64_WSGRA1_WSGRB1_WG64_4_1_WGM1
    SolutionIndex: 164
    SolutionNameMin: Cijk_Ailk_Bjlk_BBH_MT128x96x16_MI32x32x4x1_SE_1LDSB0_AF0EM1_AF1EM1_EPS1_FL0_GRVW2_GSU1_IU1_NLCA1_NLCB3_PGR1_PLR1_SIA3_SU32_SUM0_SUS256_SRVW4_TT1_96_WSGRA1_WSGRB1_WG128_2_1_WGM15
    SolutionIndex: 165
    SolutionNameMin: Cijk_Ailk_Bjlk_BBH_MT64x64x32_MI32x32x4x1_SE_1LDSB0_AF0EM8_AF1EM1_EPS1_FL0_GRVW8_GSU1_IU1_NLCA1_NLCB1_PGR1_PLR1_SIA3_SU0_SUM0_SUS256_SRVW4_TT1_32_WSGRA1_WSGRB1_WG64_4_1_WGM1
    SolutionIndex: 166
    SolutionNameMin: Cijk_Ailk_Bjlk_BBH_MT64x128x16_MI32x32x4x1_SE_1LDSB0_AF0EM8_AF1EM1_EPS0_FL0_GRVW8_GSU1_IU1_NLCA1_NLCB1_PGR2_PLR1_SIA3_SU32_SUM0_SUS128_SRVW4_TT1_64_WSGRA1_WSGRB1_WG64_4_1_WGM1
    SolutionIndex: 167
    SolutionNameMin: Cijk_Ailk_Bjlk_BBH_MT128x128x32_MI32x32x4x1_SE_1LDSB0_AF0EM4_AF1EM1_EPS1_FL1_GRVW4_GSU1_IU1_NLCA1_NLCB1_PGR1_PLR1_SIA3_SU0_SUM0_SUS256_SRVW4_TT2_64_WSGRA0_WSGRB0_WG64_4_1_WGM4
    SolutionIndex: 168
    SolutionNameMin: Cijk_Ailk_Bjlk_BBH_MT64x128x32_MI32x32x4x1_SE_1LDSB0_AF0EM4_AF1EM1_EPS1_FL0_GRVW8_GSU1_IU1_NLCA1_NLCB1_PGR1_PLR1_SIA3_SU0_SUM0_SUS256_SRVW4_TT1_64_WSGRA1_WSGRB1_WG64_4_1_WGM15
    SolutionIndex: 169
    SolutionNameMin: Cijk_Ailk_Bjlk_BBH_MT128x96x32_MI32x32x4x1_SE_1LDSB0_AF0EM4_AF1EM1_EPS1_FL0_GRVW4_GSU1_IU1_NLCA1_NLCB3_PGR1_PLR1_SIA3_SU16_SUM0_SUS128_SRVW4_TT1_96_WSGRA1_WSGRB1_WG128_2_1_WGM1
    SolutionIndex: 170
    SolutionNameMin: Cijk_Ailk_Bjlk_BBH_MT64x128x16_MI32x32x4x1_SE_1LDSB0_AF0EM1_AF1EM1_EPS1_FL0_GRVW8_GSU1_IU1_NLCA1_NLCB1_PGR1_PLR1_SIA3_SU0_SUM0_SUS256_SRVW4_TT1_64_WSGRA1_WSGRB1_WG64_4_1_WGM2
    SolutionIndex: 171
    SolutionNameMin: Cijk_Ailk_Bjlk_BBH_MT64x64x32_MI32x32x4x1_SE_1LDSB0_AF0EM1_AF1EM1_EPS1_FL0_GRVW4_GSU1_IU1_NLCA1_NLCB1_PGR1_PLR1_SIA3_SU32_SUM0_SUS256_SRVW4_TT1_32_WSGRA1_WSGRB1_WG64_4_1_WGM2
    SolutionIndex: 172
    SolutionNameMin: Cijk_Ailk_Bjlk_BBH_MT128x64x16_MI32x32x4x1_SE_1LDSB0_AF0EM8_AF1EM1_EPS1_FL0_GRVW8_GSU1_IU1_NLCA1_NLCB1_PGR1_PLR1_SIA3_SU0_SUM0_SUS256_SRVW4_TT2_32_WSGRA1_WSGRB1_WG64_4_1_WGM1
    SolutionIndex: 173
    SolutionNameMin: Cijk_Ailk_Bjlk_BBH_MT64x64x32_MI32x32x4x1_SE_1LDSB0_AF0EM8_AF1EM1_EPS1_FL0_GRVW8_GSU1_IU1_NLCA1_NLCB1_PGR1_PLR1_SIA3_SU32_SUM0_SUS128_SRVW4_TT1_32_WSGRA1_WSGRB1_WG64_4_1_WGM1
    SolutionIndex: 174
    SolutionNameMin: Cijk_Ailk_Bjlk_BBH_MT64x128x16_MI32x32x4x1_SE_1LDSB0_AF0EM8_AF1EM1_EPS0_FL0_GRVW8_GSU1_IU1_NLCA1_NLCB1_PGR2_PLR1_SIA3_SU0_SUM0_SUS256_SRVW4_TT1_64_WSGRA1_WSGRB1_WG64_4_1_WGM15
    SolutionIndex: 175
    SolutionNameMin: Cijk_Ailk_Bjlk_BBH_MT128x128x16_MI32x32x4x1_SE_1LDSB1_AF0EM8_AF1EM1_EPS0_FL0_GRVW8_GSU1_IU1_NLCA1_NLCB1_PGR2_PLR1_SIA3_SU32_SUM0_SUS256_SRVW4_TT2_64_WSGRA1_WSGRB1_WG64_4_1_WGM15
    SolutionIndex: 176
    SolutionNameMin: Cijk_Ailk_Bjlk_BBH_MT128x96x16_MI32x32x4x1_SE_1LDSB0_AF0EM4_AF1EM1_EPS1_FL0_GRVW2_GSU1_IU1_NLCA1_NLCB3_PGR1_PLR1_SIA3_SU16_SUM0_SUS128_SRVW4_TT1_96_WSGRA1_WSGRB1_WG128_2_1_WGM2
    SolutionIndex: 177
    SolutionNameMin: Cijk_Ailk_Bjlk_BBH_MT64x64x32_MI32x32x4x1_SE_1LDSB0_AF0EM1_AF1EM1_EPS1_FL0_GRVW8_GSU1_IU1_NLCA1_NLCB1_PGR1_PLR1_SIA3_SU0_SUM0_SUS256_SRVW4_TT1_32_WSGRA1_WSGRB1_WG64_4_1_WGM15
    SolutionIndex: 178
    SolutionNameMin: Cijk_Ailk_Bjlk_BBH_MT128x128x16_MI32x32x4x1_SE_1LDSB0_AF0EM8_AF1EM1_EPS1_FL0_GRVW8_GSU1_IU1_NLCA1_NLCB1_PGR1_PLR1_SIA3_SU32_SUM0_SUS128_SRVW4_TT2_64_WSGRA1_WSGRB1_WG64_4_1_WGM15
    SolutionIndex: 179
    SolutionNameMin: Cijk_Ailk_Bjlk_BBH_MT128x128x16_MI32x32x4x1_SE_1LDSB0_AF0EM8_AF1EM1_EPS1_FL0_GRVW8_GSU1_IU1_NLCA1_NLCB1_PGR1_PLR1_SIA3_SU0_SUM0_SUS256_SRVW4_TT2_64_WSGRA1_WSGRB1_WG64_4_1_WGM1
    SolutionIndex: 180
    SolutionNameMin: Cijk_Ailk_Bjlk_BBH_MT128x128x16_MI32x32x4x1_SE_1LDSB1_AF0EM8_AF1EM1_EPS1_FL0_GRVW8_GSU1_IU1_NLCA1_NLCB1_PGR1_PLR1_SIA3_SU32_SUM0_SUS128_SRVW4_TT2_64_WSGRA1_WSGRB1_WG64_4_1_WGM15
    SolutionIndex: 181
    SolutionNameMin: Cijk_Ailk_Bjlk_BBH_MT128x128x32_MI32x32x4x1_SE_1LDSB0_AF0EM4_AF1EM1_EPS1_FL1_GRVW4_GSU1_IU1_NLCA1_NLCB1_PGR1_PLR1_SIA3_SU0_SUM0_SUS256_SRVW4_TT2_64_WSGRA0_WSGRB0_WG64_4_1_WGM10
    SolutionIndex: 182
    SolutionNameMin: Cijk_Ailk_Bjlk_BBH_MT64x256x16_MI32x32x4x1_SE_1LDSB0_AF0EM1_AF1EM1_EPS1_FL0_GRVW8_GSU1_IU1_NLCA1_NLCB1_PGR1_PLR1_SIA3_SU0_SUM0_SUS256_SRVW4_TT1_128_WSGRA1_WSGRB1_WG64_4_1_WGM1
    SolutionIndex: 183
    SolutionNameMin: Cijk_Ailk_Bjlk_BBH_MT64x256x16_MI32x32x4x1_SE_1LDSB0_AF0EM1_AF1EM1_EPS1_FL0_GRVW8_GSU1_IU1_NLCA1_NLCB1_PGR1_PLR1_SIA3_SU0_SUM0_SUS256_SRVW4_TT1_128_WSGRA1_WSGRB1_WG64_4_1_WGM15
    SolutionIndex: 184
    SolutionNameMin: Cijk_Ailk_Bjlk_BBH_MT128x64x16_MI32x32x4x1_SE_1LDSB0_AF0EM8_AF1EM1_EPS0_FL0_GRVW2_GSU1_IU1_NLCA1_NLCB1_PGR2_PLR1_SIA3_SU0_SUM0_SUS256_SRVW4_TT2_32_WSGRA1_WSGRB1_WG64_4_1_WGM1
    SolutionIndex: 185
    SolutionNameMin: Cijk_Ailk_Bjlk_BBH_MT128x128x16_MI32x32x4x1_SE_1LDSB1_AF0EM8_AF1EM1_EPS0_FL0_GRVW8_GSU1_IU1_NLCA1_NLCB1_PGR2_PLR1_SIA3_SU0_SUM0_SUS256_SRVW4_TT2_64_WSGRA1_WSGRB1_WG64_4_1_WGM1
    SolutionIndex: 186
    SolutionNameMin: Cijk_Ailk_Bjlk_BBH_MT64x128x16_MI32x32x4x1_SE_1LDSB0_AF0EM8_AF1EM1_EPS0_FL0_GRVW8_GSU1_IU1_NLCA1_NLCB1_PGR2_PLR1_SIA3_SU32_SUM0_SUS128_SRVW4_TT1_64_WSGRA1_WSGRB1_WG64_4_1_WGM2
    SolutionIndex: 187
    SolutionNameMin: Cijk_Ailk_Bjlk_BBH_MT128x96x32_MI32x32x4x1_SE_1LDSB0_AF0EM4_AF1EM1_EPS1_FL0_GRVW4_GSU1_IU1_NLCA1_NLCB3_PGR1_PLR1_SIA3_SU32_SUM0_SUS256_SRVW4_TT1_96_WSGRA1_WSGRB1_WG128_2_1_WGM2
    SolutionIndex: 188
    SolutionNameMin: Cijk_Ailk_Bjlk_BBH_MT64x128x32_MI32x32x4x1_SE_1LDSB0_AF0EM1_AF1EM1_EPS1_FL0_GRVW8_GSU1_IU1_NLCA1_NLCB1_PGR1_PLR1_SIA3_SU32_SUM0_SUS256_SRVW4_TT1_64_WSGRA1_WSGRB1_WG64_4_1_WGM1
    SolutionIndex: 189
    SolutionNameMin: Cijk_Ailk_Bjlk_BBH_MT64x128x32_MI32x32x4x1_SE_1LDSB0_AF0EM1_AF1EM1_EPS1_FL0_GRVW8_GSU1_IU1_NLCA1_NLCB1_PGR1_PLR1_SIA3_SU0_SUM0_SUS256_SRVW4_TT1_64_WSGRA1_WSGRB1_WG64_4_1_WGM1
    SolutionIndex: 190
    SolutionNameMin: Cijk_Ailk_Bjlk_BBH_MT64x64x16_MI32x32x4x1_SE_1LDSB0_AF0EM8_AF1EM1_EPS1_FL0_GRVW2_GSU1_IU1_NLCA1_NLCB1_PGR1_PLR1_SIA3_SU32_SUM0_SUS256_SRVW4_TT1_32_WSGRA1_WSGRB1_WG64_4_1_WGM2
    SolutionIndex: 191
    SolutionNameMin: Cijk_Ailk_Bjlk_BBH_MT64x64x64_MI32x32x4x1_SE_1LDSB0_AF0EM8_AF1EM1_EPS1_FL0_GRVW8_GSU1_IU1_NLCA1_NLCB1_PGR1_PLR1_SIA3_SU0_SUM0_SUS256_SRVW4_TT1_32_WSGRA1_WSGRB1_WG64_4_1_WGM15
    SolutionIndex: 192
    SolutionNameMin: Cijk_Ailk_Bjlk_BBH_MT128x96x32_MI32x32x4x1_SE_1LDSB0_AF0EM4_AF1EM1_EPS1_FL0_GRVW4_GSU1_IU1_NLCA1_NLCB3_PGR1_PLR1_SIA3_SU32_SUM0_SUS128_SRVW4_TT1_96_WSGRA1_WSGRB1_WG128_2_1_WGM2
    SolutionIndex: 193
    SolutionNameMin: Cijk_Ailk_Bjlk_BBH_MT32x32x64_MI16x16x8x1_SE_1LDSB0_AF0EM1_AF1EM1_EPS1_FL0_GRVW8_GSU1_IU1_NLCA1_NLCB1_PGR1_PLR1_SIA3_SU0_SUM0_SUS256_SRVW0_TT1_16_WSGRA1_WSGRB1_WG32_8_1_WGM2
    SolutionIndex: 194
    SolutionNameMin: Cijk_Ailk_Bjlk_BBH_MT64x16x64_MI16x16x8x1_SE_1LDSB0_AF0EM8_AF1EM1_EPS1_FL0_GRVW2_GSU15_IU1_NLCA1_NLCB1_PGR1_PLR1_SIA3_SU32_SUM0_SUS128_SRVW0_TT1_16_WSGRA1_WSGRB1_WG64_4_1_WGM2
    SolutionIndex: 195
    SolutionNameMin: Cijk_Ailk_Bjlk_BBH_MT32x32x16_MI16x16x8x1_SE_1LDSB0_AF0EM8_AF1EM1_EPS1_FL0_GRVW2_GSU1_IU1_NLCA1_NLCB1_PGR1_PLR1_SIA3_SU32_SUM0_SUS256_SRVW4_TT1_16_WSGRA1_WSGRB1_WG32_8_1_WGM1
    SolutionIndex: 196
    SolutionNameMin: Cijk_Ailk_Bjlk_BBH_MT64x16x32_MI16x16x8x1_SE_1LDSB0_AF0EM8_AF1EM1_EPS1_FL0_GRVW8_GSU1_IU1_NLCA1_NLCB1_PGR1_PLR1_SIA3_SU0_SUM0_SUS256_SRVW0_TT1_16_WSGRA1_WSGRB1_WG64_4_1_WGM15
    SolutionIndex: 197
    SolutionNameMin: Cijk_Ailk_Bjlk_BBH_MT128x256x32_MI32x32x4x1_SE_1LDSB1_AF0EM8_AF1EM1_EPS1_FL0_GRVW8_GSU1_IU1_NLCA1_NLCB1_PGR1_PLR1_SIA3_SU0_SUM0_SUS256_SRVW4_TT2_128_WSGRA1_WSGRB1_WG64_4_1_WGM1
    SolutionIndex: 198
    SolutionNameMin: Cijk_Ailk_Bjlk_BBH_MT128x96x32_MI32x32x4x1_SE_1LDSB0_AF0EM1_AF1EM1_EPS1_FL0_GRVW4_GSU1_IU1_NLCA1_NLCB3_PGR1_PLR1_SIA3_SU0_SUM0_SUS256_SRVW4_TT1_96_WSGRA1_WSGRB1_WG128_2_1_WGM15
    SolutionIndex: 199
    SolutionNameMin: Cijk_Ailk_Bjlk_BBH_MT64x128x32_MI32x32x4x1_SE_1LDSB0_AF0EM8_AF1EM1_EPS1_FL0_GRVW8_GSU1_IU1_NLCA1_NLCB1_PGR1_PLR1_SIA3_SU32_SUM0_SUS256_SRVW4_TT1_64_WSGRA1_WSGRB1_WG64_4_1_WGM15
    SolutionIndex: 200
    SolutionNameMin: Cijk_Ailk_Bjlk_BBH_MT64x64x16_MI32x32x4x1_SE_1LDSB0_AF0EM8_AF1EM1_EPS1_FL0_GRVW2_GSU1_IU1_NLCA1_NLCB1_PGR1_PLR1_SIA3_SU32_SUM0_SUS128_SRVW4_TT1_32_WSGRA1_WSGRB1_WG64_4_1_WGM2
    SolutionIndex: 201
    SolutionNameMin: Cijk_Ailk_Bjlk_BBH_MT128x96x32_MI32x32x4x1_SE_1LDSB0_AF0EM4_AF1EM1_EPS1_FL0_GRVW4_GSU1_IU1_NLCA1_NLCB3_PGR1_PLR1_SIA3_SU16_SUM0_SUS256_SRVW4_TT1_96_WSGRA1_WSGRB1_WG128_2_1_WGM2
    SolutionIndex: 202
    SolutionNameMin: Cijk_Ailk_Bjlk_BBH_MT64x32x16_MI16x16x8x1_SE_1LDSB0_AF0EM8_AF1EM1_EPS1_FL0_GRVW2_GSU1_IU1_NLCA1_NLCB1_PGR1_PLR1_SIA3_SU0_SUM0_SUS256_SRVW4_TT2_16_WSGRA1_WSGRB1_WG32_8_1_WGM15
    SolutionIndex: 203
    SolutionNameMin: Cijk_Ailk_Bjlk_BBH_MT64x64x16_MI32x32x4x1_SE_1LDSB0_AF0EM8_AF1EM1_EPS1_FL0_GRVW4_GSU1_IU1_NLCA1_NLCB1_PGR1_PLR1_SIA3_SU0_SUM0_SUS256_SRVW4_TT1_32_WSGRA1_WSGRB1_WG64_4_1_WGM15
    SolutionIndex: 204
    SolutionNameMin: Cijk_Ailk_Bjlk_BBH_MT64x16x64_MI16x16x8x1_SE_1LDSB0_AF0EM8_AF1EM1_EPS1_FL0_GRVW2_GSU15_IU1_NLCA1_NLCB1_PGR1_PLR1_SIA3_SU0_SUM0_SUS256_SRVW0_TT1_16_WSGRA1_WSGRB1_WG64_4_1_WGM2
    SolutionIndex: 205
    SolutionNameMin: Cijk_Ailk_Bjlk_BBH_MT128x160x16_MI32x32x4x1_SE_1LDSB0_AF0EM8_AF1EM1_EPS0_FL0_GRVW2_GSU1_IU1_NLCA1_NLCB5_PGR2_PLR1_SIA3_SU32_SUM0_SUS128_SRVW4_TT1_160_WSGRA1_WSGRB1_WG128_2_1_WGM1
    SolutionIndex: 206
    SolutionNameMin: Cijk_Ailk_Bjlk_BBH_MT128x128x16_MI32x32x4x1_SE_1LDSB1_AF0EM8_AF1EM1_EPS1_FL0_GRVW8_GSU1_IU1_NLCA1_NLCB1_PGR1_PLR1_SIA3_SU0_SUM0_SUS256_SRVW4_TT2_64_WSGRA1_WSGRB1_WG64_4_1_WGM1
    SolutionIndex: 207
    SolutionNameMin: Cijk_Ailk_Bjlk_BBH_MT128x288x16_MI32x32x4x1_SE_1LDSB0_AF0EM4_AF1EM1_EPS1_FL0_GRVW2_GSU1_IU1_NLCA1_NLCB9_PGR1_PLR1_SIA3_SU0_SUM0_SUS256_SRVW0_TT1_288_WSGRA1_WSGRB1_WG128_2_1_WGM15
    SolutionIndex: 208
    SolutionNameMin: Cijk_Ailk_Bjlk_BBH_MT32x64x16_MI16x16x8x1_SE_1LDSB0_AF0EM1_AF1EM1_EPS1_FL0_GRVW4_GSU1_IU1_NLCA1_NLCB1_PGR1_PLR1_SIA3_SU0_SUM0_SUS256_SRVW0_TT1_32_WSGRA1_WSGRB1_WG32_8_1_WGM1
    SolutionIndex: 209
    SolutionNameMin: Cijk_Ailk_Bjlk_BBH_MT64x32x16_MI16x16x8x1_SE_1LDSB0_AF0EM4_AF1EM1_EPS1_FL0_GRVW2_GSU1_IU1_NLCA1_NLCB1_PGR1_PLR1_SIA3_SU32_SUM0_SUS256_SRVW0_TT2_16_WSGRA1_WSGRB1_WG32_8_1_WGM2
    SolutionIndex: 210
    SolutionNameMin: Cijk_Ailk_Bjlk_BBH_MT128x256x16_MI32x32x4x1_SE_1LDSB0_AF0EM8_AF1EM1_EPS1_FL0_GRVW4_GSU1_IU1_NLCA1_NLCB1_PGR1_PLR1_SIA3_SU32_SUM0_SUS256_SRVW4_TT2_128_WSGRA1_WSGRB1_WG64_4_1_WGM2
    SolutionIndex: 211
    SolutionNameMin: Cijk_Ailk_Bjlk_BBH_MT32x32x16_MI16x16x8x1_SE_1LDSB0_AF0EM4_AF1EM1_EPS1_FL0_GRVW4_GSU1_IU1_NLCA1_NLCB1_PGR1_PLR1_SIA3_SU0_SUM0_SUS256_SRVW0_TT1_16_WSGRA1_WSGRB1_WG32_8_1_WGM2
    SolutionIndex: 212
    SolutionNameMin: Cijk_Ailk_Bjlk_BBH_MT128x96x32_MI32x32x4x1_SE_1LDSB0_AF0EM8_AF1EM1_EPS1_FL0_GRVW4_GSU1_IU1_NLCA1_NLCB3_PGR1_PLR1_SIA3_SU32_SUM0_SUS128_SRVW4_TT1_96_WSGRA1_WSGRB1_WG128_2_1_WGM15
    SolutionIndex: 213
    SolutionNameMin: Cijk_Ailk_Bjlk_BBH_MT128x128x16_MI32x32x4x1_SE_1LDSB0_AF0EM8_AF1EM1_EPS1_FL0_GRVW8_GSU1_IU1_NLCA1_NLCB1_PGR1_PLR1_SIA3_SU0_SUM0_SUS256_SRVW4_TT2_64_WSGRA1_WSGRB1_WG64_4_1_WGM15
    SolutionIndex: 214
    SolutionNameMin: Cijk_Ailk_Bjlk_BBH_MT64x128x64_MI32x32x4x1_SE_1LDSB0_AF0EM8_AF1EM1_EPS1_FL0_GRVW8_GSU1_IU1_NLCA1_NLCB1_PGR1_PLR1_SIA3_SU0_SUM0_SUS256_SRVW4_TT1_64_WSGRA1_WSGRB1_WG64_4_1_WGM2
    SolutionIndex: 215
    SolutionNameMin: Cijk_Ailk_Bjlk_BBH_MT64x32x16_MI16x16x8x1_SE_1LDSB0_AF0EM8_AF1EM1_EPS1_FL0_GRVW2_GSU1_IU1_NLCA1_NLCB1_PGR1_PLR1_SIA3_SU32_SUM0_SUS256_SRVW4_TT2_16_WSGRA1_WSGRB1_WG32_8_1_WGM15
    SolutionIndex: 216
    SolutionNameMin: Cijk_Ailk_Bjlk_BBH_MT16x64x64_MI16x16x8x1_SE_1LDSB0_AF0EM1_AF1EM1_EPS1_FL0_GRVW2_GSU2_IU1_NLCA1_NLCB1_PGR1_PLR1_SIA3_SU32_SUM0_SUS256_SRVW0_TT1_16_WSGRA1_WSGRB1_WG16_16_1_WGM1
    SolutionIndex: 217
    SolutionNameMin: Cijk_Ailk_Bjlk_BBH_MT128x80x64_MI16x16x8x1_SE_1LDSB0_AF0EM4_AF1EM1_EPS1_FL0_GRVW2_GSU1_IU1_NLCA1_NLCB5_PGR1_PLR1_SIA3_SU32_SUM0_SUS256_SRVW0_TT2_80_WSGRA1_WSGRB1_WG64_4_1_WGM2
    SolutionIndex: 218
    SolutionNameMin: Cijk_Ailk_Bjlk_BBH_MT64x128x32_MI32x32x4x1_SE_1LDSB0_AF0EM1_AF1EM1_EPS1_FL0_GRVW4_GSU1_IU1_NLCA1_NLCB1_PGR1_PLR1_SIA3_SU32_SUM0_SUS256_SRVW8_TT2_32_WSGRA0_WSGRB1_WG32_8_1_WGM10
    SolutionIndex: 219
    SolutionNameMin: Cijk_Ailk_Bjlk_BBH_MT64x16x64_MI16x16x8x1_SE_1LDSB0_AF0EM8_AF1EM1_EPS1_FL0_GRVW2_GSU7_IU1_NLCA1_NLCB1_PGR1_PLR1_SIA3_SU32_SUM0_SUS128_SRVW0_TT1_16_WSGRA1_WSGRB1_WG64_4_1_WGM2
    SolutionIndex: 220
    SolutionNameMin: Cijk_Ailk_Bjlk_BBH_MT128x96x32_MI32x32x4x1_SE_1LDSB0_AF0EM4_AF1EM1_EPS1_FL0_GRVW4_GSU1_IU1_NLCA1_NLCB3_PGR1_PLR1_SIA3_SU32_SUM0_SUS256_SRVW4_TT1_96_WSGRA1_WSGRB1_WG128_2_1_WGM15
    SolutionIndex: 221
    SolutionNameMin: Cijk_Ailk_Bjlk_BBH_MT64x64x32_MI32x32x4x1_SE_1LDSB0_AF0EM8_AF1EM1_EPS1_FL0_GRVW8_GSU1_IU1_NLCA1_NLCB1_PGR1_PLR1_SIA3_SU32_SUM0_SUS256_SRVW4_TT1_32_WSGRA1_WSGRB1_WG64_4_1_WGM1
    SolutionIndex: 222
    SolutionNameMin: Cijk_Ailk_Bjlk_BBH_MT64x64x16_MI32x32x4x1_SE_1LDSB0_AF0EM8_AF1EM1_EPS1_FL0_GRVW2_GSU1_IU1_NLCA1_NLCB1_PGR1_PLR1_SIA3_SU32_SUM0_SUS128_SRVW4_TT1_32_WSGRA1_WSGRB1_WG64_4_1_WGM1
    SolutionIndex: 223
    SolutionNameMin: Cijk_Ailk_Bjlk_BBH_MT64x16x64_MI16x16x8x1_SE_1LDSB0_AF0EM8_AF1EM1_EPS1_FL0_GRVW2_GSU7_IU1_NLCA1_NLCB1_PGR1_PLR1_SIA3_SU0_SUM0_SUS256_SRVW0_TT1_16_WSGRA1_WSGRB1_WG64_4_1_WGM15
    SolutionIndex: 224
    SolutionNameMin: Cijk_Ailk_Bjlk_BBH_MT128x256x16_MI32x32x4x1_SE_1LDSB0_AF0EM8_AF1EM1_EPS1_FL0_GRVW8_GSU1_IU1_NLCA1_NLCB1_PGR1_PLR1_SIA3_SU0_SUM0_SUS256_SRVW4_TT2_128_WSGRA1_WSGRB1_WG64_4_1_WGM15
    SolutionIndex: 225
    SolutionNameMin: Cijk_Ailk_Bjlk_BBH_MT128x128x16_MI32x32x4x1_SE_1LDSB1_AF0EM8_AF1EM1_EPS1_FL0_GRVW8_GSU1_IU1_NLCA1_NLCB1_PGR1_PLR1_SIA3_SU32_SUM0_SUS256_SRVW4_TT2_64_WSGRA1_WSGRB1_WG64_4_1_WGM15
    SolutionIndex: 226
    SolutionNameMin: Cijk_Ailk_Bjlk_BBH_MT128x128x16_MI32x32x4x1_SE_1LDSB0_AF0EM8_AF1EM1_EPS0_FL0_GRVW8_GSU1_IU1_NLCA1_NLCB1_PGR2_PLR1_SIA3_SU32_SUM0_SUS256_SRVW4_TT2_64_WSGRA1_WSGRB1_WG64_4_1_WGM1
    SolutionIndex: 227
    SolutionNameMin: Cijk_Ailk_Bjlk_BBH_MT64x32x16_MI16x16x8x1_SE_1LDSB0_AF0EM8_AF1EM1_EPS1_FL0_GRVW2_GSU1_IU1_NLCA1_NLCB1_PGR1_PLR1_SIA3_SU32_SUM0_SUS128_SRVW4_TT2_16_WSGRA1_WSGRB1_WG32_8_1_WGM2
    SolutionIndex: 228
    SolutionNameMin: Cijk_Ailk_Bjlk_BBH_MT128x80x64_MI16x16x8x1_SE_1LDSB0_AF0EM4_AF1EM1_EPS1_FL0_GRVW2_GSU1_IU1_NLCA1_NLCB5_PGR1_PLR1_SIA3_SU32_SUM0_SUS128_SRVW0_TT2_80_WSGRA1_WSGRB1_WG64_4_1_WGM2
    SolutionIndex: 229
    SolutionNameMin: Cijk_Ailk_Bjlk_BBH_MT32x32x64_MI16x16x8x1_SE_1LDSB0_AF0EM8_AF1EM1_EPS1_FL0_GRVW2_GSU5_IU1_NLCA1_NLCB1_PGR1_PLR1_SIA3_SU32_SUM0_SUS128_SRVW0_TT1_16_WSGRA1_WSGRB1_WG32_8_1_WGM1
    SolutionIndex: 230
    SolutionNameMin: Cijk_Ailk_Bjlk_BBH_MT96x96x32_MI16x16x8x1_SE_1LDSB0_AF0EM8_AF1EM1_EPS0_FL0_GRVW2_GSU1_IU1_NLCA3_NLCB3_PGR2_PLR1_SIA3_SU32_SUM0_SUS128_SRVW0_TT3_48_WSGRA1_WSGRB1_WG32_8_1_WGM2
    SolutionIndex: 231
    SolutionNameMin: Cijk_Ailk_Bjlk_BBH_MT128x64x32_MI32x32x4x1_SE_1LDSB0_AF0EM8_AF1EM1_EPS1_FL0_GRVW8_GSU1_IU1_NLCA1_NLCB1_PGR1_PLR1_SIA3_SU0_SUM0_SUS256_SRVW4_TT2_32_WSGRA1_WSGRB1_WG64_4_1_WGM15
    SolutionIndex: 232
    SolutionNameMin: Cijk_Ailk_Bjlk_BBH_MT64x64x32_MI32x32x4x1_SE_1LDSB0_AF0EM1_AF1EM1_EPS1_FL1_GRVW4_GSU1_IU1_NLCA1_NLCB1_PGR1_PLR1_SIA3_SU0_SUM0_SUS256_SRVW4_TT1_32_WSGRA0_WSGRB0_WG64_4_1_WGM10
    SolutionIndex: 233
    SolutionNameMin: Cijk_Ailk_Bjlk_BBH_MT96x96x32_MI16x16x8x1_SE_1LDSB0_AF0EM8_AF1EM1_EPS0_FL0_GRVW2_GSU1_IU1_NLCA3_NLCB3_PGR2_PLR1_SIA3_SU0_SUM0_SUS256_SRVW0_TT3_48_WSGRA1_WSGRB1_WG32_8_1_WGM2
    SolutionIndex: 234
    SolutionNameMin: Cijk_Ailk_Bjlk_BBH_MT96x96x32_MI16x16x8x1_SE_1LDSB0_AF0EM8_AF1EM1_EPS0_FL0_GRVW2_GSU1_IU1_NLCA3_NLCB3_PGR2_PLR1_SIA3_SU0_SUM0_SUS256_SRVW0_TT3_48_WSGRA1_WSGRB1_WG32_8_1_WGM15
    SolutionIndex: 235
    SolutionNameMin: Cijk_Ailk_Bjlk_BBH_MT128x128x16_MI32x32x4x1_SE_1LDSB0_AF0EM4_AF1EM1_EPS1_FL0_GRVW8_GSU1_IU1_NLCA1_NLCB1_PGR1_PLR1_SIA3_SU16_SUM0_SUS128_SRVW4_TT2_64_WSGRA1_WSGRB1_WG64_4_1_WGM15
    SolutionIndex: 236
    SolutionNameMin: Cijk_Ailk_Bjlk_BBH_MT128x64x32_MI32x32x4x1_SE_1LDSB0_AF0EM8_AF1EM1_EPS1_FL0_GRVW8_GSU1_IU1_NLCA1_NLCB1_PGR1_PLR1_SIA3_SU32_SUM0_SUS256_SRVW4_TT2_32_WSGRA1_WSGRB1_WG64_4_1_WGM1
    SolutionIndex: 237
    SolutionNameMin: Cijk_Ailk_Bjlk_BBH_MT128x160x16_MI32x32x4x1_SE_1LDSB0_AF0EM8_AF1EM1_EPS0_FL0_GRVW2_GSU1_IU1_NLCA1_NLCB5_PGR2_PLR1_SIA3_SU0_SUM0_SUS256_SRVW4_TT1_160_WSGRA1_WSGRB1_WG128_2_1_WGM15
    SolutionIndex: 238
    SolutionNameMin: Cijk_Ailk_Bjlk_BBH_MT128x256x16_MI32x32x4x1_SE_1LDSB0_AF0EM8_AF1EM1_EPS1_FL0_GRVW8_GSU1_IU1_NLCA1_NLCB1_PGR1_PLR1_SIA3_SU32_SUM0_SUS128_SRVW4_TT2_128_WSGRA1_WSGRB1_WG64_4_1_WGM15
    SolutionIndex: 239
    SolutionNameMin: Cijk_Ailk_Bjlk_BBH_MT128x64x16_MI32x32x4x1_SE_1LDSB0_AF0EM8_AF1EM1_EPS1_FL0_GRVW2_GSU1_IU1_NLCA1_NLCB1_PGR1_PLR1_SIA3_SU0_SUM0_SUS256_SRVW4_TT2_32_WSGRA1_WSGRB1_WG64_4_1_WGM1
    SolutionIndex: 240
    SolutionNameMin: Cijk_Ailk_Bjlk_BBH_MT64x64x64_MI32x32x4x1_SE_1LDSB0_AF0EM1_AF1EM1_EPS1_FL0_GRVW8_GSU1_IU1_NLCA1_NLCB1_PGR1_PLR1_SIA3_SU0_SUM0_SUS256_SRVW4_TT1_32_WSGRA1_WSGRB1_WG64_4_1_WGM1
    SolutionIndex: 241
    SolutionNameMin: Cijk_Ailk_Bjlk_BBH_MT128x128x16_MI32x32x4x1_SE_1LDSB0_AF0EM4_AF1EM1_EPS1_FL0_GRVW8_GSU1_IU1_NLCA1_NLCB1_PGR1_PLR1_SIA3_SU16_SUM0_SUS256_SRVW4_TT2_64_WSGRA1_WSGRB1_WG64_4_1_WGM15
    SolutionIndex: 242
    SolutionNameMin: Cijk_Ailk_Bjlk_BBH_MT128x128x16_MI32x32x4x1_SE_1LDSB0_AF0EM1_AF1EM1_EPS1_FL0_GRVW8_GSU1_IU1_NLCA1_NLCB1_PGR1_PLR1_SIA3_SU0_SUM0_SUS256_SRVW4_TT2_64_WSGRA1_WSGRB1_WG64_4_1_WGM15
    SolutionIndex: 243
    SolutionNameMin: Cijk_Ailk_Bjlk_BBH_MT128x64x16_MI32x32x4x1_SE_1LDSB0_AF0EM8_AF1EM1_EPS1_FL0_GRVW8_GSU1_IU1_NLCA1_NLCB1_PGR1_PLR1_SIA3_SU0_SUM0_SUS256_SRVW4_TT2_32_WSGRA1_WSGRB1_WG64_4_1_WGM2
    SolutionIndex: 244
    SolutionNameMin: Cijk_Ailk_Bjlk_BBH_MT64x64x32_MI32x32x4x1_SE_1LDSB0_AF0EM8_AF1EM1_EPS1_FL0_GRVW8_GSU1_IU1_NLCA1_NLCB1_PGR1_PLR1_SIA3_SU0_SUM0_SUS256_SRVW4_TT1_32_WSGRA1_WSGRB1_WG64_4_1_WGM15
    SolutionIndex: 245
    SolutionNameMin: Cijk_Ailk_Bjlk_BBH_MT64x128x16_MI32x32x4x1_SE_1LDSB0_AF0EM8_AF1EM1_EPS1_FL0_GRVW2_GSU1_IU1_NLCA1_NLCB1_PGR1_PLR1_SIA3_SU32_SUM0_SUS256_SRVW4_TT1_64_WSGRA1_WSGRB1_WG64_4_1_WGM15
    SolutionIndex: 246
    SolutionNameMin: Cijk_Ailk_Bjlk_BBH_MT128x64x16_MI32x32x4x1_SE_1LDSB0_AF0EM8_AF1EM1_EPS1_FL0_GRVW8_GSU1_IU1_NLCA1_NLCB1_PGR1_PLR1_SIA3_SU32_SUM0_SUS128_SRVW4_TT2_32_WSGRA1_WSGRB1_WG64_4_1_WGM1
    SolutionIndex: 247
    SolutionNameMin: Cijk_Ailk_Bjlk_BBH_MT96x128x32_MI32x32x4x1_SE_1LDSB0_AF0EM8_AF1EM1_EPS1_FL0_GRVW4_GSU5_IU1_NLCA3_NLCB1_PGR1_PLR1_SIA3_SU0_SUM0_SUS256_SRVW0_TT3_32_WSGRA1_WSGRB1_WG32_8_1_WGM1
    SolutionIndex: 248
    SolutionNameMin: Cijk_Ailk_Bjlk_BBH_MT32x32x64_MI16x16x8x1_SE_1LDSB0_AF0EM8_AF1EM1_EPS1_FL0_GRVW8_GSU5_IU1_NLCA1_NLCB1_PGR1_PLR1_SIA3_SU32_SUM0_SUS256_SRVW0_TT1_16_WSGRA1_WSGRB1_WG32_8_1_WGM1
    SolutionIndex: 249
    SolutionNameMin: Cijk_Ailk_Bjlk_BBH_MT64x64x64_MI32x32x4x1_SE_1LDSB0_AF0EM8_AF1EM1_EPS1_FL0_GRVW8_GSU15_IU1_NLCA1_NLCB1_PGR1_PLR1_SIA3_SU0_SUM0_SUS256_SRVW0_TT1_32_WSGRA1_WSGRB1_WG64_4_1_WGM2
    SolutionIndex: 250
    SolutionNameMin: Cijk_Ailk_Bjlk_BBH_MT32x64x16_MI16x16x8x1_SE_1LDSB0_AF0EM8_AF1EM1_EPS1_FL0_GRVW2_GSU1_IU1_NLCA1_NLCB1_PGR1_PLR1_SIA3_SU32_SUM0_SUS256_SRVW4_TT1_32_WSGRA1_WSGRB1_WG32_8_1_WGM2
    SolutionIndex: 251
    SolutionNameMin: Cijk_Ailk_Bjlk_BBH_MT96x128x64_MI32x32x4x1_SE_1LDSB0_AF0EM8_AF1EM1_EPS1_FL0_GRVW8_GSU3_IU1_NLCA3_NLCB1_PGR1_PLR1_SIA3_SU0_SUM0_SUS256_SRVW0_TT3_32_WSGRA1_WSGRB1_WG32_8_1_WGM1
    SolutionIndex: 252
    SolutionNameMin: Cijk_Ailk_Bjlk_BBH_MT128x64x64_MI32x32x4x1_SE_1LDSB0_AF0EM8_AF1EM1_EPS1_FL0_GRVW8_GSU7_IU1_NLCA1_NLCB1_PGR1_PLR1_SIA3_SU0_SUM0_SUS256_SRVW0_TT2_32_WSGRA1_WSGRB1_WG64_4_1_WGM15
    SolutionIndex: 253
    SolutionNameMin: Cijk_Ailk_Bjlk_BBH_MT128x128x16_MI32x32x4x1_SE_1LDSB1_AF0EM8_AF1EM1_EPS0_FL0_GRVW8_GSU1_IU1_NLCA1_NLCB1_PGR2_PLR1_SIA3_SU32_SUM0_SUS256_SRVW4_TT2_64_WSGRA1_WSGRB1_WG64_4_1_WGM2
    SolutionIndex: 254
    SolutionNameMin: Cijk_Ailk_Bjlk_BBH_MT128x128x16_MI32x32x4x1_SE_1LDSB0_AF0EM4_AF1EM1_EPS1_FL0_GRVW8_GSU1_IU1_NLCA1_NLCB1_PGR1_PLR1_SIA3_SU32_SUM0_SUS256_SRVW4_TT2_64_WSGRA1_WSGRB1_WG64_4_1_WGM15
    SolutionIndex: 255
    SolutionNameMin: Cijk_Ailk_Bjlk_BBH_MT128x160x32_MI32x32x4x1_SE_1LDSB0_AF0EM8_AF1EM1_EPS1_FL0_GRVW2_GSU2_IU1_NLCA1_NLCB5_PGR1_PLR1_SIA3_SU0_SUM0_SUS256_SRVW0_TT1_160_WSGRA1_WSGRB1_WG128_2_1_WGM15
    SolutionIndex: 256
    SolutionNameMin: Cijk_Ailk_Bjlk_BBH_MT64x128x16_MI32x32x4x1_SE_1LDSB0_AF0EM8_AF1EM1_EPS1_FL0_GRVW2_GSU1_IU1_NLCA1_NLCB1_PGR1_PLR1_SIA3_SU0_SUM0_SUS256_SRVW4_TT1_64_WSGRA1_WSGRB1_WG64_4_1_WGM2
    SolutionIndex: 257
    SolutionNameMin: Cijk_Ailk_Bjlk_BBH_MT128x128x16_MI32x32x4x1_SE_1LDSB1_AF0EM8_AF1EM1_EPS0_FL0_GRVW8_GSU1_IU1_NLCA1_NLCB1_PGR2_PLR1_SIA3_SU32_SUM0_SUS128_SRVW4_TT2_64_WSGRA1_WSGRB1_WG64_4_1_WGM2
    SolutionIndex: 258
    SolutionNameMin: Cijk_Ailk_Bjlk_BBH_MT128x160x32_MI32x32x4x1_SE_1LDSB0_AF0EM8_AF1EM1_EPS1_FL0_GRVW2_GSU2_IU1_NLCA1_NLCB5_PGR1_PLR1_SIA3_SU32_SUM0_SUS128_SRVW0_TT1_160_WSGRA1_WSGRB1_WG128_2_1_WGM2
    SolutionIndex: 259
    SolutionNameMin: Cijk_Ailk_Bjlk_BBH_MT16x64x64_MI16x16x8x1_SE_1LDSB0_AF0EM1_AF1EM1_EPS1_FL0_GRVW8_GSU15_IU1_NLCA1_NLCB1_PGR1_PLR1_SIA3_SU32_SUM0_SUS128_SRVW0_TT1_16_WSGRA1_WSGRB1_WG16_16_1_WGM15
    SolutionIndex: 260
    SolutionNameMin: Cijk_Ailk_Bjlk_BBH_MT96x96x32_MI16x16x8x1_SE_1LDSB0_AF0EM8_AF1EM1_EPS0_FL0_GRVW4_GSU1_IU1_NLCA3_NLCB3_PGR2_PLR1_SIA3_SU0_SUM0_SUS256_SRVW0_TT3_48_WSGRA1_WSGRB1_WG32_8_1_WGM1
    SolutionIndex: 261
    SolutionNameMin: Cijk_Ailk_Bjlk_BBH_MT128x144x32_MI16x16x8x1_SE_1LDSB0_AF0EM8_AF1EM1_EPS1_FL0_GRVW2_GSU1_IU1_NLCA1_NLCB9_PGR1_PLR1_SIA3_SU0_SUM0_SUS256_SRVW4_TT2_144_WSGRA1_WSGRB1_WG64_4_1_WGM1
    SolutionIndex: 262
    SolutionNameMin: Cijk_Ailk_Bjlk_BBH_MT128x144x32_MI16x16x8x1_SE_1LDSB0_AF0EM8_AF1EM1_EPS1_FL0_GRVW2_GSU1_IU1_NLCA1_NLCB9_PGR1_PLR1_SIA3_SU0_SUM0_SUS256_SRVW4_TT2_144_WSGRA1_WSGRB1_WG64_4_1_WGM2
    SolutionIndex: 263
    SolutionNameMin: Cijk_Ailk_Bjlk_BBH_MT128x128x16_MI32x32x4x1_SE_1LDSB0_AF0EM8_AF1EM1_EPS1_FL0_GRVW8_GSU1_IU1_NLCA1_NLCB1_PGR1_PLR1_SIA3_SU32_SUM0_SUS256_SRVW4_TT2_64_WSGRA1_WSGRB1_WG64_4_1_WGM2
    SolutionIndex: 264
    SolutionNameMin: Cijk_Ailk_Bjlk_BBH_MT128x64x16_MI32x32x4x1_SE_1LDSB0_AF0EM8_AF1EM1_EPS1_FL0_GRVW2_GSU1_IU1_NLCA1_NLCB1_PGR1_PLR1_SIA3_SU32_SUM0_SUS256_SRVW4_TT2_32_WSGRA1_WSGRB1_WG64_4_1_WGM1
    SolutionIndex: 265
    SolutionNameMin: Cijk_Ailk_Bjlk_BBH_MT128x128x16_MI32x32x4x1_SE_1LDSB0_AF0EM1_AF1EM1_EPS1_FL0_GRVW8_GSU1_IU1_NLCA1_NLCB1_PGR1_PLR1_SIA3_SU32_SUM0_SUS256_SRVW4_TT2_64_WSGRA1_WSGRB1_WG64_4_1_WGM15
    SolutionIndex: 266
    SolutionNameMin: Cijk_Ailk_Bjlk_BBH_MT128x128x32_MI32x32x4x1_SE_1LDSB0_AF0EM8_AF1EM1_EPS1_FL0_GRVW8_GSU1_IU1_NLCA1_NLCB1_PGR1_PLR1_SIA3_SU32_SUM0_SUS256_SRVW4_TT2_64_WSGRA1_WSGRB1_WG64_4_1_WGM15
    SolutionIndex: 267
    SolutionNameMin: Cijk_Ailk_Bjlk_BBH_MT128x256x32_MI32x32x4x1_SE_1LDSB1_AF0EM8_AF1EM1_EPS1_FL0_GRVW8_GSU1_IU1_NLCA1_NLCB1_PGR1_PLR1_SIA3_SU32_SUM0_SUS128_SRVW4_TT2_128_WSGRA1_WSGRB1_WG64_4_1_WGM15
    SolutionIndex: 268
    SolutionNameMin: Cijk_Ailk_Bjlk_BBH_MT128x128x16_MI32x32x4x1_SE_1LDSB1_AF0EM8_AF1EM1_EPS1_FL0_GRVW8_GSU1_IU1_NLCA1_NLCB1_PGR1_PLR1_SIA3_SU32_SUM0_SUS256_SRVW4_TT2_64_WSGRA1_WSGRB1_WG64_4_1_WGM2
    SolutionIndex: 269
    SolutionNameMin: Cijk_Ailk_Bjlk_BBH_MT128x96x16_MI32x32x4x1_SE_1LDSB0_AF0EM8_AF1EM1_EPS0_FL0_GRVW2_GSU1_IU1_NLCA1_NLCB3_PGR2_PLR1_SIA3_SU32_SUM0_SUS256_SRVW4_TT1_96_WSGRA1_WSGRB1_WG128_2_1_WGM1
    SolutionIndex: 270
    SolutionNameMin: Cijk_Ailk_Bjlk_BBH_MT128x64x32_MI32x32x4x1_SE_1LDSB0_AF0EM8_AF1EM1_EPS1_FL0_GRVW8_GSU1_IU1_NLCA1_NLCB1_PGR1_PLR1_SIA3_SU32_SUM0_SUS256_SRVW4_TT2_32_WSGRA1_WSGRB1_WG64_4_1_WGM2
    SolutionIndex: 271
    SolutionNameMin: Cijk_Ailk_Bjlk_BBH_MT16x16x64_MI16x16x8x1_SE_1LDSB0_AF0EM8_AF1EM1_EPS1_FL0_GRVW2_GSU3_IU1_NLCA1_NLCB1_PGR1_PLR1_SIA3_SU0_SUM0_SUS256_SRVW0_TT1_16_WSGRA1_WSGRB1_WG16_4_1_WGM1
    SolutionIndex: 272
    SolutionNameMin: Cijk_Ailk_Bjlk_BBH_MT128x160x32_MI32x32x4x1_SE_1LDSB0_AF0EM8_AF1EM1_EPS1_FL0_GRVW2_GSU1_IU1_NLCA1_NLCB5_PGR1_PLR1_SIA3_SU0_SUM0_SUS256_SRVW4_TT1_160_WSGRA1_WSGRB1_WG128_2_1_WGM2
    SolutionIndex: 273
    SolutionNameMin: Cijk_Ailk_Bjlk_BBH_MT64x64x64_MI32x32x4x1_SE_1LDSB0_AF0EM8_AF1EM1_EPS1_FL0_GRVW4_GSU1_IU1_NLCA1_NLCB1_PGR1_PLR1_SIA3_SU0_SUM0_SUS256_SRVW4_TT1_32_WSGRA1_WSGRB1_WG64_4_1_WGM2
    SolutionIndex: 274
    SolutionNameMin: Cijk_Ailk_Bjlk_BBH_MT64x128x16_MI32x32x4x1_SE_1LDSB0_AF0EM1_AF1EM1_EPS1_FL0_GRVW8_GSU1_IU1_NLCA1_NLCB1_PGR1_PLR1_SIA3_SU0_SUM0_SUS256_SRVW4_TT1_64_WSGRA1_WSGRB1_WG64_4_1_WGM15
    SolutionIndex: 275
    SolutionNameMin: Cijk_Ailk_Bjlk_BBH_MT64x16x64_MI16x16x8x1_SE_1LDSB0_AF0EM8_AF1EM1_EPS1_FL0_GRVW2_GSU7_IU1_NLCA1_NLCB1_PGR1_PLR1_SIA3_SU32_SUM0_SUS128_SRVW0_TT1_16_WSGRA1_WSGRB1_WG64_4_1_WGM1
    SolutionIndex: 276
    SolutionNameMin: Cijk_Ailk_Bjlk_BBH_MT96x128x16_MI32x32x4x1_SE_1LDSB0_AF0EM8_AF1EM1_EPS0_FL0_GRVW2_GSU1_IU1_NLCA3_NLCB1_PGR2_PLR1_SIA3_SU0_SUM0_SUS256_SRVW0_TT3_32_WSGRA1_WSGRB1_WG32_8_1_WGM15
    SolutionIndex: 277
    SolutionNameMin: Cijk_Ailk_Bjlk_BBH_MT64x256x16_MI32x32x4x1_SE_1LDSB0_AF0EM1_AF1EM1_EPS1_FL0_GRVW8_GSU1_IU1_NLCA1_NLCB1_PGR1_PLR1_SIA3_SU32_SUM0_SUS128_SRVW4_TT1_128_WSGRA1_WSGRB1_WG64_4_1_WGM1
    SolutionIndex: 278
    SolutionNameMin: Cijk_Ailk_Bjlk_BBH_MT64x128x32_MI32x32x4x1_SE_1LDSB0_AF0EM1_AF1EM1_EPS1_FL0_GRVW8_GSU1_IU1_NLCA1_NLCB1_PGR1_PLR1_SIA3_SU0_SUM0_SUS256_SRVW4_TT1_64_WSGRA1_WSGRB1_WG64_4_1_WGM2
    SolutionIndex: 279
    SolutionNameMin: Cijk_Ailk_Bjlk_BBH_MT64x256x32_MI32x32x4x1_SE_1LDSB0_AF0EM8_AF1EM1_EPS1_FL0_GRVW8_GSU1_IU1_NLCA1_NLCB1_PGR1_PLR1_SIA3_SU0_SUM0_SUS256_SRVW4_TT1_128_WSGRA1_WSGRB1_WG64_4_1_WGM15
    SolutionIndex: 280
    SolutionNameMin: Cijk_Ailk_Bjlk_BBH_MT96x128x16_MI32x32x4x1_SE_1LDSB0_AF0EM8_AF1EM1_EPS0_FL0_GRVW2_GSU1_IU1_NLCA3_NLCB1_PGR2_PLR1_SIA3_SU0_SUM0_SUS256_SRVW0_TT3_32_WSGRA1_WSGRB1_WG32_8_1_WGM1
    SolutionIndex: 281
    SolutionNameMin: Cijk_Ailk_Bjlk_BBH_MT128x96x32_MI32x32x4x1_SE_1LDSB0_AF0EM4_AF1EM1_EPS1_FL0_GRVW4_GSU1_IU1_NLCA1_NLCB3_PGR1_PLR1_SIA3_SU0_SUM0_SUS256_SRVW4_TT1_96_WSGRA1_WSGRB1_WG128_2_1_WGM1
    SolutionIndex: 282
    SolutionNameMin: Cijk_Ailk_Bjlk_BBH_MT128x128x32_MI32x32x4x1_SE_1LDSB0_AF0EM8_AF1EM1_EPS1_FL0_GRVW8_GSU1_IU1_NLCA1_NLCB1_PGR1_PLR1_SIA3_SU32_SUM0_SUS128_SRVW4_TT2_64_WSGRA1_WSGRB1_WG64_4_1_WGM2
    SolutionIndex: 283
    SolutionNameMin: Cijk_Ailk_Bjlk_BBH_MT96x128x32_MI32x32x4x1_SE_1LDSB0_AF0EM8_AF1EM1_EPS1_FL0_GRVW4_GSU1_IU1_NLCA3_NLCB1_PGR1_PLR1_SIA3_SU0_SUM0_SUS256_SRVW0_TT3_32_WSGRA1_WSGRB1_WG32_8_1_WGM1
    SolutionIndex: 284
    SolutionNameMin: Cijk_Ailk_Bjlk_BBH_MT128x96x32_MI32x32x4x1_SE_1LDSB0_AF0EM1_AF1EM1_EPS1_FL0_GRVW4_GSU1_IU1_NLCA1_NLCB3_PGR1_PLR1_SIA3_SU0_SUM0_SUS256_SRVW4_TT1_96_WSGRA1_WSGRB1_WG128_2_1_WGM2
    SolutionIndex: 285
    SolutionNameMin: Cijk_Ailk_Bjlk_BBH_MT128x96x32_MI32x32x4x1_SE_1LDSB0_AF0EM8_AF1EM1_EPS1_FL0_GRVW4_GSU1_IU1_NLCA1_NLCB3_PGR1_PLR1_SIA3_SU0_SUM0_SUS256_SRVW4_TT1_96_WSGRA1_WSGRB1_WG128_2_1_WGM1
    SolutionIndex: 286
    SolutionNameMin: Cijk_Ailk_Bjlk_BBH_MT64x128x32_MI32x32x4x1_SE_1LDSB0_AF0EM1_AF1EM1_EPS1_FL0_GRVW8_GSU1_IU1_NLCA1_NLCB1_PGR1_PLR1_SIA3_SU0_SUM0_SUS256_SRVW4_TT1_64_WSGRA1_WSGRB1_WG64_4_1_WGM15
    SolutionIndex: 287
    SolutionNameMin: Cijk_Ailk_Bjlk_BBH_MT128x128x16_MI32x32x4x1_SE_1LDSB1_AF0EM8_AF1EM1_EPS1_FL0_GRVW8_GSU1_IU1_NLCA1_NLCB1_PGR1_PLR1_SIA3_SU32_SUM0_SUS128_SRVW4_TT2_64_WSGRA1_WSGRB1_WG64_4_1_WGM2
    SolutionIndex: 288
    SolutionNameMin: Cijk_Ailk_Bjlk_BBH_MT128x128x16_MI32x32x4x1_SE_1LDSB0_AF0EM8_AF1EM1_EPS1_FL0_GRVW2_GSU1_IU1_NLCA1_NLCB1_PGR1_PLR1_SIA3_SU32_SUM0_SUS256_SRVW4_TT2_64_WSGRA1_WSGRB1_WG64_4_1_WGM1
    SolutionIndex: 289
    SolutionNameMin: Cijk_Ailk_Bjlk_BBH_MT128x128x16_MI32x32x4x1_SE_1LDSB0_AF0EM8_AF1EM1_EPS1_FL0_GRVW8_GSU1_IU1_NLCA1_NLCB1_PGR1_PLR1_SIA3_SU32_SUM0_SUS128_SRVW4_TT2_64_WSGRA1_WSGRB1_WG64_4_1_WGM2
    SolutionIndex: 290
    SolutionNameMin: Cijk_Ailk_Bjlk_BBH_MT128x128x16_MI32x32x4x1_SE_1LDSB0_AF0EM8_AF1EM1_EPS1_FL0_GRVW2_GSU1_IU1_NLCA1_NLCB1_PGR1_PLR1_SIA3_SU32_SUM0_SUS256_SRVW4_TT2_64_WSGRA1_WSGRB1_WG64_4_1_WGM15
    SolutionIndex: 291
    SolutionNameMin: Cijk_Ailk_Bjlk_BBH_MT64x128x16_MI32x32x4x1_SE_1LDSB0_AF0EM8_AF1EM1_EPS1_FL0_GRVW8_GSU1_IU1_NLCA1_NLCB1_PGR1_PLR1_SIA3_SU32_SUM0_SUS128_SRVW4_TT1_64_WSGRA1_WSGRB1_WG64_4_1_WGM1
    SolutionIndex: 292
    SolutionNameMin: Cijk_Ailk_Bjlk_BBH_MT256x160x16_MI32x32x4x1_SE_1LDSB0_AF0EM8_AF1EM1_EPS1_FL0_GRVW2_GSU3_IU1_NLCA2_NLCB5_PGR1_PLR1_SIA3_SU32_SUM0_SUS128_SRVW0_TT2_160_WSGRA1_WSGRB1_WG128_2_1_WGM2
- - - [34, 64, 1, 34]
    - [0, 0.005]
  - - [32, 64, 1, 35]
    - [1, 0.005]
  - - [64, 21, 1, 17]
    - [2, 0.002]
  - - [64, 32, 1, 35]
    - [3, 0.006]
  - - [21, 64, 1, 21]
    - [4, 0.002]
  - - [64, 30, 1, 31]
    - [5, 0.005]
  - - [64, 24, 1, 24]
    - [6, 0.003]
  - - [17, 64, 1, 15]
    - [0, 0.001]
  - - [64, 35, 1, 35]
    - [7, 0.006]
  - - [32, 64, 1, 32]
    - [8, 0.004]
  - - [64, 34, 1, 24]
    - [9, 0.004]
  - - [30, 64, 1, 30]
    - [7, 0.004]
  - - [30, 64, 1, 31]
    - [0, 0.003]
  - - [34, 64, 1, 24]
    - [11, 0.003]
  - - [64, 30, 1, 30]
    - [12, 0.004]
  - - [14, 64, 1, 14]
    - [13, 0.001]
  - - [64, 17, 1, 15]
    - [14, 0.001]
  - - [64, 32, 1, 32]
    - [15, 0.005]
  - - [64, 31, 1, 31]
    - [0, 0.004]
  - - [64, 21, 1, 21]
    - [4, 0.002]
  - - [35, 64, 1, 35]
    - [1, 0.006]
  - - [31, 64, 1, 31]
    - [15, 0.004]
  - - [21, 64, 1, 17]
    - [7, 0.001]
  - - [64, 15, 1, 15]
    - [10, 0.001]
  - - [64, 17, 1, 17]
    - [5, 0.001]
  - - [17, 64, 1, 17]
    - [16, 0.001]
  - - [64, 34, 1, 34]
    - [17, 0.005]
  - - [15, 64, 1, 14]
    - [0, 0.001]
  - - [24, 64, 1, 24]
    - [15, 0.003]
  - - [64, 14, 1, 14]
    - [17, 0.001]
  - - [15, 64, 1, 15]
    - [0, 0.001]
  - - [64, 15, 1, 14]
    - [18, 0.001]
  - - [64, 128, 512, 128]
    - [19, 18.412]
  - - [64, 512, 1, 512]
    - [20, 1.162]
  - - [64, 512, 64, 512]
    - [21, 31.976]
  - - [128, 64, 512, 128]
    - [22, 18.052]
  - - [512, 64, 1, 512]
    - [23, 0.991]
  - - [512, 64, 64, 512]
    - [24, 33.038]
  - - [1024, 2, 1, 4]
    - [25, 0.001]
  - - [1024, 2, 1, 32]
    - [12, 0.005]
  - - [1024, 2, 1, 2048]
    - [26, 0.2]
  - - [1024, 1024, 1, 4]
    - [27, 0.281]
  - - [1024, 1024, 1, 32]
    - [28, 1.982]
  - - [1024, 1024, 1, 2048]
    - [29, 43.243]
  - - [1024, 1024, 1, 4096]
    - [30, 53.904]
  - - [1024, 4096, 1, 2048]
    - [31, 66.479]
  - - [1024, 4096, 1, 4096]
    - [32, 78.972]
  - - [1024, 30528, 1, 2048]
    - [33, 89.888]
  - - [1024, 30528, 1, 4096]
    - [34, 92.679]
  - - [4096, 1024, 1, 2048]
    - [35, 66.387]
  - - [4096, 1024, 1, 4096]
    - [36, 79.808]
  - - [3, 64, 512, 3]
    - [15, 0.016]
  - - [5, 64, 512, 5]
    - [16, 0.06]
  - - [5, 64, 960, 5]
    - [1, 0.073]
  - - [9, 64, 512, 9]
    - [7, 0.135]
  - - [13, 512, 1, 32768]
    - [37, 6.818]
  - - [27, 128, 32768, 27]
    - [8, 7.249]
  - - [33, 32, 200, 33]
    - [38, 0.428]
  - - [33, 32, 1600, 33]
    - [39, 2.095]
  - - [67, 2048, 1, 512]
    - [40, 3.401]
  - - [74, 2048, 1, 512]
    - [41, 3.885]
  - - [74, 2048, 1, 960]
    - [11, 6.854]
  - - [100, 2048, 1, 512]
    - [42, 4.879]
  - - [256, 128, 1, 32768]
    - [43, 29.68]
  - - [256, 1280, 1, 8976]
    - [44, 52.184]
  - - [256, 2560, 1, 8976]
    - [45, 54.147]
  - - [256, 2816, 1, 8976]
    - [46, 59.061]
  - - [256, 3328, 1, 8976]
    - [47, 64.331]
  - - [256, 3584, 1, 8976]
    - [48, 63.87]
  - - [256, 3840, 1, 8976]
    - [49, 67.052]
  - - [256, 4096, 1, 8976]
    - [50, 59.162]
  - - [256, 4352, 1, 8976]
    - [51, 64.277]
  - - [256, 4864, 1, 8976]
    - [52, 69.707]
  - - [256, 5120, 1, 8976]
    - [52, 75.433]
  - - [256, 5632, 1, 8976]
    - [53, 78.707]
  - - [256, 5888, 1, 8976]
    - [54, 65.263]
  - - [256, 6144, 1, 8976]
    - [47, 67.744]
  - - [256, 7168, 1, 8976]
    - [55, 80.263]
  - - [256, 8192, 1, 8976]
    - [56, 75.725]
  - - [256, 8960, 1, 8976]
    - [57, 80.609]
  - - [256, 9728, 1, 8976]
    - [58, 75.305]
  - - [256, 9984, 1, 8976]
    - [52, 78.407]
  - - [256, 10240, 1, 8976]
    - [52, 79.02]
  - - [256, 10496, 1, 8976]
    - [32, 81.179]
  - - [256, 11008, 1, 8976]
    - [59, 84.895]
  - - [256, 11264, 1, 8976]
    - [32, 87.04]
  - - [256, 11520, 1, 8976]
    - [60, 88.399]
  - - [256, 11776, 1, 8976]
    - [61, 75.104]
  - - [256, 12544, 1, 8976]
    - [61, 77.773]
  - - [256, 12800, 1, 8976]
    - [62, 78.755]
  - - [256, 13312, 1, 8976]
    - [63, 79.681]
  - - [256, 13568, 1, 8976]
    - [64, 79.686]
  - - [256, 14336, 1, 8976]
    - [65, 85.107]
  - - [256, 14848, 1, 8976]
    - [66, 88.732]
  - - [256, 15104, 1, 8976]
    - [64, 88.894]
  - - [256, 15872, 1, 8976]
    - [32, 82.56]
  - - [256, 16128, 1, 8976]
    - [67, 83.855]
  - - [256, 17152, 1, 8976]
    - [68, 89.102]
  - - [256, 17408, 1, 8976]
    - [54, 82.98]
  - - [256, 18688, 1, 8976]
    - [47, 87.988]
  - - [256, 19968, 1, 8976]
    - [69, 81.051]
  - - [256, 20480, 1, 8976]
    - [70, 82.823]
  - - [256, 20992, 1, 8976]
    - [71, 84.119]
  - - [256, 21248, 1, 8976]
    - [72, 85.032]
  - - [256, 22016, 1, 8976]
    - [32, 87.857]
  - - [256, 26112, 1, 8976]
    - [73, 88.707]
  - - [256, 32512, 1, 8976]
    - [68, 87.709]
  - - [256, 32768, 1, 1]
    - [74, 0.343]
  - - [256, 33536, 1, 8976]
    - [72, 90.573]
  - - [256, 44505, 1, 8976]
    - [72, 91.057]
  - - [257, 4096, 1, 1024]
    - [21, 29.467]
  - - [480, 1024, 1, 32768]
    - [75, 79.487]
  - - [512, 32, 1, 200]
    - [40, 0.202]
  - - [512, 32, 1, 1600]
    - [76, 1.259]
  - - [512, 256, 1, 32768]
    - [77, 59.142]
  - - [512, 512, 1, 200]
    - [18, 3.483]
  - - [512, 512, 1, 1600]
    - [78, 16.033]
  - - [512, 2048, 1, 256]
    - [79, 15.234]
  - - [560, 1024, 1, 200]
    - [80, 7.041]
  - - [560, 1024, 1, 1600]
    - [81, 28.201]
  - - [768, 2048, 1, 256]
    - [54, 19.059]
  - - [1024, 64, 1, 512]
    - [82, 2.011]
  - - [1024, 64, 1, 960]
    - [23, 3.092]
  - - [1024, 256, 1, 1024]
    - [83, 10.424]
  - - [1024, 256, 1, 1280]
    - [78, 13.246]
  - - [1024, 256, 1, 2304]
    - [84, 18.821]
  - - [1024, 256, 1, 2816]
    - [21, 21.326]
  - - [1024, 256, 1, 3072]
    - [85, 22.666]
  - - [1024, 256, 1, 3328]
    - [86, 27.206]
  - - [1024, 256, 1, 3584]
    - [87, 26.076]
  - - [1024, 256, 1, 4096]
    - [88, 28.772]
  - - [1024, 256, 1, 4352]
    - [89, 30.24]
  - - [1024, 256, 1, 4608]
    - [86, 31.369]
  - - [1024, 256, 1, 5120]
    - [90, 30.333]
  - - [1024, 256, 1, 5376]
    - [91, 36.75]
  - - [1024, 256, 1, 5632]
    - [92, 35.057]
  - - [1024, 256, 1, 6144]
    - [86, 38.308]
  - - [1024, 256, 1, 6400]
    - [93, 36.424]
  - - [1024, 256, 1, 7680]
    - [93, 43.749]
  - - [1024, 256, 1, 7936]
    - [88, 40.026]
  - - [1024, 256, 1, 8192]
    - [94, 42.914]
  - - [1024, 256, 1, 8448]
    - [85, 43.787]
  - - [1024, 256, 1, 9728]
    - [95, 43.545]
  - - [1024, 256, 1, 9984]
    - [85, 49.834]
  - - [1024, 256, 1, 10496]
    - [95, 44.952]
  - - [1024, 256, 1, 11520]
    - [96, 50.599]
  - - [1024, 256, 1, 12032]
    - [97, 52.426]
  - - [1024, 256, 1, 13568]
    - [96, 54.671]
  - - [1024, 256, 1, 14336]
    - [96, 56.232]
  - - [1024, 256, 1, 14848]
    - [96, 55.727]
  - - [1024, 256, 1, 15104]
    - [92, 55.983]
  - - [1024, 256, 1, 15872]
    - [97, 58.32]
  - - [1024, 256, 1, 16128]
    - [92, 59.866]
  - - [1024, 256, 1, 17152]
    - [96, 58.422]
  - - [1024, 256, 1, 17408]
    - [85, 58.17]
  - - [1024, 256, 1, 18944]
    - [96, 59.482]
  - - [1024, 256, 1, 19712]
    - [96, 59.295]
  - - [1024, 256, 1, 19968]
    - [85, 62.07]
  - - [1024, 256, 1, 21248]
    - [98, 51.914]
  - - [1024, 256, 1, 21504]
    - [99, 52.973]
  - - [1024, 256, 1, 22016]
    - [44, 53.344]
  - - [1024, 256, 1, 28672]
    - [96, 67.622]
  - - [1024, 256, 1, 33536]
    - [100, 66.815]
  - - [1024, 512, 1, 32768]
    - [101, 75.117]
  - - [1024, 1024, 1, 200]
    - [39, 10.685]
  - - [1024, 1024, 1, 512]
    - [102, 21.426]
  - - [1024, 1024, 1, 960]
    - [103, 28.872]
  - - [1024, 1024, 1, 1600]
    - [104, 40.398]
  - - [1024, 1024, 1, 32768]
    - [91, 79.418]
  - - [1600, 1024, 1, 512]
    - [105, 29.977]
  - - [1600, 1024, 1, 960]
    - [106, 41.005]
  - - [2048, 256, 1, 1024]
    - [84, 21.055]
  - - [2048, 960, 1, 1]
    - [107, 0.133]
  - - [2048, 2048, 1, 512]
    - [108, 48.913]
  - - [2048, 2048, 1, 960]
    - [109, 61.65]
  - - [2048, 2048, 1, 1024]
    - [110, 62.565]
  - - [3200, 2048, 1, 1024]
    - [111, 63.276]
  - - [4096, 4096, 1, 1024]
    - [68, 76.508]
  - - [14, 64, 10880, 14]
    - [7, 2.362]
  - - [15, 64, 10880, 14]
    - [16, 2.384]
  - - [15, 64, 7680, 15]
    - [16, 2.522]
  - - [15, 64, 10880, 15]
    - [16, 2.651]
  - - [17, 64, 7680, 15]
    - [8, 2.303]
  - - [17, 64, 6144, 17]
    - [112, 2.486]
  - - [17, 64, 7680, 17]
    - [113, 2.578]
  - - [21, 64, 6144, 17]
    - [113, 2.943]
  - - [21, 64, 6144, 21]
    - [113, 3.615]
  - - [24, 64, 4736, 24]
    - [114, 5.482]
  - - [30, 64, 2048, 30]
    - [115, 4.085]
  - - [30, 64, 2048, 31]
    - [115, 4.492]
  - - [31, 64, 2048, 31]
    - [115, 3.943]
  - - [32, 64, 4608, 32]
    - [116, 8.129]
  - - [32, 64, 4608, 35]
    - [117, 7.874]
  - - [34, 64, 4736, 24]
    - [118, 3.893]
  - - [34, 64, 4736, 34]
    - [119, 5.622]
  - - [35, 64, 4608, 35]
    - [119, 5.401]
  - - [64, 14, 10880, 14]
    - [6, 2.77]
  - - [64, 15, 10880, 14]
    - [6, 2.95]
  - - [64, 15, 7680, 15]
    - [120, 2.799]
  - - [64, 15, 10880, 15]
    - [121, 2.991]
  - - [64, 17, 7680, 15]
    - [120, 3.277]
  - - [64, 17, 6144, 17]
    - [122, 3.231]
  - - [64, 17, 7680, 17]
    - [120, 3.604]
  - - [64, 21, 6144, 17]
    - [122, 4.074]
  - - [64, 21, 6144, 21]
    - [120, 4.506]
  - - [64, 24, 4736, 24]
    - [123, 5.218]
  - - [64, 30, 2048, 30]
    - [120, 5.188]
  - - [64, 30, 2048, 31]
    - [120, 5.36]
  - - [64, 31, 2048, 31]
    - [123, 5.27]
  - - [64, 32, 4608, 32]
    - [124, 8.257]
  - - [64, 32, 4608, 35]
    - [121, 8.203]
  - - [64, 34, 4736, 24]
    - [125, 5.826]
  - - [64, 34, 4736, 34]
    - [126, 7.505]
  - - [64, 35, 4608, 35]
    - [127, 7.225]
  - - [1024, 1024, 1, 3840]
    - [50, 54.545]
  - - [1024, 1024, 1, 3968]
    - [50, 56.766]
  - - [1024, 1024, 1, 6528]
    - [128, 52.388]
  - - [1024, 1024, 1, 7104]
    - [32, 57.551]
  - - [1024, 1024, 1, 7200]
    - [93, 58.234]
  - - [1024, 1024, 1, 8064]
    - [129, 63.102]
  - - [1024, 1024, 1, 8160]
    - [130, 64.271]
  - - [1024, 1024, 1, 9216]
    - [97, 61.104]
  - - [1024, 1024, 1, 9520]
    - [130, 63.593]
  - - [1024, 1024, 1, 10064]
    - [130, 66.522]
  - - [1024, 1024, 1, 10080]
    - [130, 68.069]
  - - [1024, 1024, 1, 10200]
    - [51, 63.618]
  - - [1024, 4096, 1, 3840]
    - [108, 79.922]
  - - [1024, 4096, 1, 3968]
    - [71, 81.57]
  - - [1024, 4096, 1, 6528]
    - [131, 84.105]
  - - [1024, 4096, 1, 7104]
    - [67, 83.738]
  - - [1024, 4096, 1, 7200]
    - [132, 85.411]
  - - [1024, 4096, 1, 8064]
    - [131, 85.683]
  - - [1024, 4096, 1, 8160]
    - [133, 85.731]
  - - [1024, 4096, 1, 9216]
    - [133, 86.66]
  - - [1024, 4096, 1, 9520]
    - [134, 85.554]
  - - [1024, 4096, 1, 10064]
    - [135, 85.99]
  - - [1024, 4096, 1, 10080]
    - [136, 86.0]
  - - [1024, 4096, 1, 10200]
    - [137, 85.986]
  - - [1024, 42720, 1, 3968]
    - [138, 93.261]
  - - [1024, 42720, 1, 6528]
    - [69, 94.192]
  - - [1024, 42720, 1, 7104]
    - [138, 94.528]
  - - [1024, 42720, 1, 7200]
    - [139, 94.378]
  - - [1024, 42720, 1, 9520]
    - [72, 94.875]
  - - [1024, 42720, 1, 10080]
    - [140, 94.917]
  - - [4096, 1024, 1, 3840]
    - [109, 80.481]
  - - [4096, 1024, 1, 3968]
    - [132, 80.347]
  - - [4096, 1024, 1, 6528]
    - [133, 85.084]
  - - [4096, 1024, 1, 7104]
    - [71, 85.816]
  - - [4096, 1024, 1, 7200]
    - [140, 83.96]
  - - [4096, 1024, 1, 8064]
    - [133, 85.694]
  - - [4096, 1024, 1, 8160]
    - [132, 85.847]
  - - [4096, 1024, 1, 9216]
    - [36, 85.374]
  - - [4096, 1024, 1, 9520]
    - [135, 85.592]
  - - [4096, 1024, 1, 10064]
    - [132, 87.276]
  - - [4096, 1024, 1, 10080]
    - [134, 85.792]
  - - [4096, 1024, 1, 10200]
    - [132, 86.475]
  - - [27, 64, 1920, 27]
    - [115, 3.125]
  - - [27, 64, 1920, 33]
    - [115, 3.848]
  - - [33, 64, 1920, 33]
    - [141, 3.599]
  - - [64, 27, 1920, 27]
    - [123, 3.888]
  - - [64, 27, 1920, 33]
    - [142, 3.966]
  - - [64, 33, 1920, 33]
    - [143, 4.402]
  - - [1024, 1024, 1, 3240]
    - [130, 48.603]
  - - [1024, 1024, 1, 3960]
    - [50, 52.119]
  - - [1024, 4096, 1, 3240]
    - [132, 77.348]
  - - [1024, 4096, 1, 3960]
    - [60, 79.746]
  - - [1024, 42720, 1, 3960]
    - [139, 93.042]
  - - [4096, 1024, 1, 3240]
    - [144, 76.657]
  - - [4096, 1024, 1, 3960]
    - [140, 79.977]
  - - [64, 1280, 64, 192]
    - [145, 30.188]
  - - [64, 1280, 64, 320]
    - [146, 40.874]
  - - [64, 1280, 64, 384]
    - [145, 41.953]
  - - [64, 1280, 64, 448]
    - [147, 44.44]
  - - [64, 2048, 64, 192]
    - [148, 35.552]
  - - [64, 2048, 64, 320]
    - [149, 43.259]
  - - [64, 2048, 64, 384]
    - [150, 50.806]
  - - [64, 2048, 64, 448]
    - [105, 52.012]
  - - [1225, 192, 64, 32]
    - [39, 10.762]
  - - [1225, 192, 64, 48]
    - [38, 15.085]
  - - [1225, 192, 64, 64]
    - [151, 19.808]
  - - [1225, 256, 64, 48]
    - [152, 15.223]
  - - [1225, 256, 64, 64]
    - [153, 19.14]
  - - [1225, 288, 64, 48]
    - [154, 15.603]
  - - [1225, 288, 64, 64]
    - [155, 19.83]
  - - [5329, 64, 64, 80]
    - [156, 21.499]
  - - [289, 768, 64, 128]
    - [157, 27.994]
  - - [289, 768, 64, 160]
    - [153, 32.276]
  - - [289, 768, 64, 192]
    - [106, 35.184]
  - - [64, 1280, 32, 192]
    - [158, 21.247]
  - - [64, 1280, 32, 320]
    - [152, 29.375]
  - - [64, 1280, 32, 384]
    - [147, 35.541]
  - - [64, 1280, 32, 448]
    - [159, 36.559]
  - - [64, 2048, 32, 192]
    - [160, 24.436]
  - - [64, 2048, 32, 320]
    - [160, 35.636]
  - - [64, 2048, 32, 384]
    - [161, 38.831]
  - - [64, 2048, 32, 448]
    - [148, 41.557]
  - - [1225, 192, 32, 32]
    - [39, 7.938]
  - - [1225, 192, 32, 48]
    - [162, 10.418]
  - - [1225, 192, 32, 64]
    - [154, 13.017]
  - - [1225, 256, 32, 48]
    - [157, 13.182]
  - - [1225, 256, 32, 64]
    - [163, 16.971]
  - - [1225, 288, 32, 48]
    - [39, 12.366]
  - - [1225, 288, 32, 64]
    - [164, 17.302]
  - - [5329, 64, 32, 80]
    - [156, 18.928]
  - - [289, 768, 32, 128]
    - [163, 20.914]
  - - [289, 768, 32, 160]
    - [157, 25.828]
  - - [289, 768, 32, 192]
    - [157, 28.415]
  - - [3136, 64, 64, 256]
    - [27, 43.214]
  - - [3136, 64, 64, 64]
    - [165, 19.249]
  - - [3136, 256, 64, 64]
    - [166, 29.764]
  - - [784, 128, 64, 512]
    - [167, 53.423]
  - - [784, 512, 64, 128]
    - [64, 41.575]
  - - [196, 256, 64, 1024]
    - [168, 45.639]
  - - [196, 1024, 64, 256]
    - [169, 44.143]
  - - [49, 512, 64, 2048]
    - [170, 31.732]
  - - [49, 2048, 64, 512]
    - [171, 29.985]
  - - [3136, 64, 32, 256]
    - [172, 34.471]
  - - [3136, 64, 32, 64]
    - [173, 13.606]
  - - [3136, 256, 32, 64]
    - [166, 26.149]
  - - [784, 128, 32, 512]
    - [174, 43.748]
  - - [784, 512, 32, 128]
    - [175, 36.024]
  - - [196, 256, 32, 1024]
    - [169, 33.801]
  - - [196, 1024, 32, 256]
    - [176, 33.882]
  - - [49, 512, 32, 2048]
    - [177, 28.653]
  - - [49, 2048, 32, 512]
    - [157, 28.064]
  - - [3136, 64, 64, 128]
    - [107, 30.753]
  - - [3136, 128, 64, 256]
    - [178, 55.906]
  - - [784, 256, 64, 512]
    - [179, 60.755]
  - - [3136, 256, 64, 128]
    - [174, 49.504]
  - - [3136, 256, 64, 256]
    - [180, 63.876]
  - - [196, 512, 64, 1024]
    - [181, 50.507]
  - - [784, 512, 64, 256]
    - [104, 50.481]
  - - [784, 512, 64, 512]
    - [34, 67.449]
  - - [196, 1024, 64, 512]
    - [136, 50.915]
  - - [196, 1024, 64, 1024]
    - [182, 57.864]
  - - [49, 1024, 64, 2048]
    - [163, 45.647]
  - - [49, 2048, 64, 1024]
    - [183, 42.073]
  - - [3136, 64, 32, 128]
    - [184, 21.473]
  - - [3136, 128, 32, 256]
    - [185, 51.196]
  - - [784, 256, 32, 512]
    - [166, 55.642]
  - - [3136, 256, 32, 128]
    - [166, 40.107]
  - - [3136, 256, 32, 256]
    - [58, 53.624]
  - - [196, 512, 32, 1024]
    - [168, 43.759]
  - - [784, 512, 32, 256]
    - [186, 49.874]
  - - [784, 512, 32, 512]
    - [168, 60.932]
  - - [196, 1024, 32, 512]
    - [187, 45.257]
  - - [196, 1024, 32, 1024]
    - [188, 49.988]
  - - [49, 1024, 32, 2048]
    - [189, 30.869]
  - - [49, 2048, 32, 1024]
    - [171, 30.769]
  - - [64, 128, 624, 128]
    - [190, 20.082]
  - - [1024, 1024, 1, 1024]
    - [84, 30.207]
  - - [1024, 1024, 1, 1280]
    - [191, 33.579]
  - - [1024, 1024, 1, 39]
    - [142, 2.387]
  - - [1024, 4096, 1, 2560]
    - [72, 71.482]
  - - [1024, 4096, 1, 1024]
    - [192, 64.166]
  - - [33, 32, 1, 33]
    - [193, 0.002]
  - - [1024, 2, 1, 4992]
    - [194, 0.53]
  - - [64, 128, 144, 128]
    - [174, 9.228]
  - - [512, 512, 1, 512]
    - [14, 7.006]
  - - [1024, 2, 1, 39]
    - [195, 0.006]
  - - [1024, 1024, 1, 8192]
    - [30, 64.008]
  - - [1024, 960, 1, 1024]
    - [81, 36.142]
  - - [1024, 1024, 1, 308]
    - [162, 14.654]
  - - [1024, 2, 1, 5]
    - [196, 0.001]
  - - [1024, 1024, 1, 4992]
    - [140, 53.08]
  - - [4096, 3840, 1, 4096]
    - [197, 92.252]
  - - [4096, 1024, 1, 3072]
    - [198, 73.438]
  - - [64, 512, 96, 512]
    - [199, 38.433]
  - - [1024, 1024, 1, 5248]
    - [130, 54.331]
  - - [4096, 1024, 1, 4992]
    - [60, 81.568]
  - - [1024, 1024, 1, 180]
    - [200, 10.369]
  - - [5, 64, 1, 5]
    - [170, 0.0]
  - - [4096, 1024, 1, 2560]
    - [201, 76.681]
  - - [1024, 33712, 1, 9600]
    - [197, 93.467]
  - - [64, 128, 640, 128]
    - [125, 21.002]
  - - [1024, 1024, 1, 5]
    - [202, 0.33]
  - - [4, 64, 32768, 4]
    - [114, 0.313]
  - - [1024, 2, 1, 40]
    - [0, 0.006]
  - - [1024, 30522, 1, 160]
    - [175, 46.799]
  - - [1024, 1024, 1, 800]
    - [19, 29.928]
  - - [1024, 1024, 1, 41]
    - [203, 2.873]
  - - [1024, 2, 1, 5248]
    - [204, 0.535]
  - - [4096, 4096, 1, 4096]
    - [205, 88.024]
  - - [1024, 30522, 1, 385]
    - [206, 67.286]
  - - [1024, 4096, 1, 9600]
    - [207, 86.36]
  - - [2048, 512, 1, 1]
    - [208, 0.064]
  - - [1024, 4096, 1, 1152]
    - [134, 64.878]
  - - [1024, 2, 1, 512]
    - [25, 0.06]
  - - [64, 4, 38400, 4]
    - [209, 0.295]
  - - [1024, 30522, 1, 180]
    - [210, 44.592]
  - - [4096, 1024, 1, 512]
    - [60, 44.358]
  - - [4096, 1024, 1, 1024]
    - [36, 63.962]
  - - [4, 64, 38400, 4]
    - [16, 0.301]
  - - [1024, 2, 1, 9]
    - [211, 0.001]
  - - [8192, 8192, 1, 8192]
    - [138, 94.903]
  - - [4096, 1024, 1, 1280]
    - [192, 67.91]
  - - [1024, 1024, 1, 3072]
    - [50, 54.173]
  - - [64, 128, 656, 128]
    - [190, 20.16]
  - - [1024, 4096, 1, 4992]
    - [140, 81.194]
  - - [1024, 1024, 1, 9]
    - [112, 0.589]
  - - [1024, 4096, 1, 512]
    - [212, 48.31]
  - - [64, 512, 16, 512]
    - [80, 13.239]
  - - [1024, 2, 1, 6]
    - [12, 0.001]
  - - [2048, 1920, 1, 2048]
    - [185, 75.674]
  - - [1024, 30522, 1, 780]
    - [213, 79.999]
  - - [64, 128, 128, 128]
    - [24, 8.585]
  - - [1024, 30522, 1, 800]
    - [206, 81.112]
  - - [960, 1024, 1, 1024]
    - [214, 38.717]
  - - [1024, 1024, 1, 6]
    - [215, 0.331]
  - - [8192, 7680, 1, 8192]
    - [197, 96.056]
  - - [1024, 2, 1, 1152]
    - [216, 0.092]
  - - [1024, 1024, 1, 2560]
    - [217, 46.044]
  - - [1024, 1024, 1, 77]
    - [124, 5.282]
  - - [1024, 1024, 1, 160]
    - [79, 10.146]
  - - [1024, 4096, 1, 8192]
    - [110, 84.994]
  - - [1024, 2, 1, 41]
    - [6, 0.006]
  - - [128, 64, 1, 128]
    - [18, 0.076]
  - - [480, 512, 1, 512]
    - [41, 7.66]
  - - [1024, 1024, 1, 462]
    - [80, 18.017]
  - - [1024, 1024, 1, 780]
    - [151, 25.974]
  - - [1024, 4096, 1, 5248]
    - [109, 81.195]
  - - [1024, 4096, 1, 1280]
    - [132, 67.675]
  - - [4096, 1024, 1, 9600]
    - [134, 85.941]
  - - [64, 512, 80, 512]
    - [218, 36.916]
  - - [4096, 1024, 1, 1152]
    - [71, 62.14]
  - - [1024, 1600, 1, 1]
    - [39, 0.114]
  - - [1024, 1024, 1, 820]
    - [177, 25.217]
  - - [1024, 2, 1, 2560]
    - [219, 0.23]
  - - [4096, 1024, 1, 5248]
    - [220, 80.169]
  - - [1024, 33712, 1, 8192]
    - [139, 93.317]
  - - [1024, 1024, 1, 385]
    - [221, 19.105]
  - - [1024, 1024, 1, 1]
    - [222, 0.065]
  - - [1024, 2, 1, 10]
    - [196, 0.002]
  - - [64, 4, 32768, 4]
    - [120, 0.315]
  - - [1024, 1024, 1, 10]
    - [9, 0.558]
  - - [1024, 2, 1, 5120]
    - [223, 0.377]
  - - [1920, 2048, 1, 2048]
    - [64, 73.843]
  - - [2048, 2048, 1, 2048]
    - [58, 65.097]
  - - [3840, 4096, 1, 4096]
    - [224, 90.52]
  - - [1024, 4096, 1, 5120]
    - [71, 82.808]
  - - [64, 128, 160, 128]
    - [151, 8.008]
  - - [1024, 30522, 1, 308]
    - [34, 61.334]
  - - [1024, 30522, 1, 820]
    - [225, 79.893]
  - - [1024, 30522, 1, 200]
    - [226, 50.495]
  - - [1024, 30522, 1, 462]
    - [175, 70.133]
  - - [1024, 2, 1, 1024]
    - [25, 0.115]
  - - [1024, 30522, 1, 77]
    - [178, 22.594]
  - - [1024, 1024, 1, 40]
    - [227, 2.783]
  - - [1024, 2, 1, 1]
    - [196, 0.0]
  - - [1024, 2, 1, 8]
    - [17, 0.001]
  - - [1024, 1024, 1, 8]
    - [127, 0.553]
  - - [1024, 1024, 1, 9600]
    - [30, 66.254]
  - - [4096, 1024, 1, 5120]
    - [133, 83.055]
  - - [1024, 4096, 1, 3072]
    - [53, 72.737]
  - - [1024, 1024, 1, 1152]
    - [136, 32.276]
  - - [512, 480, 1, 512]
    - [23, 6.541]
  - - [64, 128, 1, 128]
    - [6, 0.061]
  - - [1024, 1024, 1, 5120]
    - [228, 50.673]
  - - [1024, 2, 1, 3072]
    - [219, 0.356]
  - - [7680, 8192, 1, 8192]
    - [197, 96.065]
  - - [4096, 1024, 1, 8192]
    - [132, 86.059]
  - - [1024, 2, 1, 1280]
    - [229, 0.112]
  - - [479, 1024, 1, 32768]
    - [75, 76.647]
  - - [64, 1024, 32, 1024]
    - [63, 41.926]
  - - [2560, 1920, 1, 2048]
    - [218, 75.223]
  - - [1024, 3072, 1, 4096]
    - [230, 71.842]
  - - [2560, 2560, 1, 2048]
    - [106, 76.033]
  - - [2048, 2, 1, 2]
    - [16, 0.001]
  - - [1024, 64, 128, 1024]
    - [231, 64.226]
  - - [2048, 2048, 1, 2]
    - [176, 0.363]
  - - [1024, 64, 32, 1024]
    - [232, 43.144]
  - - [1024, 96, 64, 1024]
    - [233, 62.25]
  - - [1024, 30592, 1, 2048]
    - [33, 89.679]
  - - [1024, 3072, 1, 16384]
    - [234, 83.596]
  - - [6144, 1536, 1, 4096]
    - [235, 86.851]
  - - [1024, 1024, 1, 16]
    - [18, 1.108]
  - - [1536, 4608, 1, 8192]
    - [146, 88.767]
  - - [640, 2560, 1, 2048]
    - [236, 56.266]
  - - [1024, 4096, 1, 16384]
    - [132, 88.747]
  - - [64, 512, 40, 512]
    - [78, 24.716]
  - - [1024, 1024, 1, 16384]
    - [92, 71.046]
  - - [1536, 6144, 1, 4096]
    - [54, 87.254]
  - - [1024, 30592, 1, 4096]
    - [175, 93.05]
  - - [2560, 2560, 1, 4]
    - [118, 1.016]
  - - [1536, 1536, 1, 4096]
    - [237, 73.572]
  - - [2560, 7680, 1, 2048]
    - [226, 88.166]
  - - [64, 1024, 256, 1024]
    - [47, 68.531]
  - - [96, 1024, 64, 1024]
    - [230, 60.128]
  - - [1536, 50304, 1, 4096]
    - [67, 93.638]
  - - [2048, 8192, 1, 1024]
    - [175, 77.894]
  - - [1024, 30592, 1, 8192]
    - [238, 94.698]
  - - [512, 64, 256, 512]
    - [239, 41.388]
  - - [1024, 96, 128, 1024]
    - [58, 72.35]
  - - [64, 512, 128, 512]
    - [240, 42.182]
  - - [4096, 1024, 1, 16384]
    - [60, 87.847]
  - - [8192, 2048, 1, 1024]
    - [167, 75.255]
  - - [64, 1024, 64, 1024]
    - [78, 54.588]
  - - [1024, 50304, 1, 4096]
    - [140, 93.608]
  - - [1536, 4608, 1, 4096]
    - [58, 86.132]
  - - [512, 64, 128, 512]
    - [49, 43.179]
  - - [6144, 1536, 1, 8192]
    - [241, 89.371]
  - - [1024, 3072, 1, 8192]
    - [233, 77.652]
  - - [1536, 1536, 1, 8192]
    - [57, 83.112]
  - - [1536, 50304, 1, 8192]
    - [132, 95.024]
  - - [2560, 2, 1, 4]
    - [7, 0.002]
  - - [2048, 6144, 1, 1024]
    - [159, 73.929]
  - - [64, 1024, 128, 1024]
    - [147, 65.36]
  - - [1024, 64, 64, 1024]
    - [49, 55.231]
  - - [1024, 2, 1, 16]
    - [195, 0.002]
  - - [96, 1024, 128, 1024]
    - [230, 71.393]
  - - [2048, 30592, 1, 1024]
    - [226, 87.579]
  - - [64, 512, 256, 512]
    - [199, 51.907]
  - - [1536, 6144, 1, 8192]
    - [54, 89.406]
  - - [1024, 50304, 1, 2048]
    - [69, 90.997]
  - - [1024, 50304, 1, 8192]
    - [72, 95.57]
  - - [1024, 3072, 1, 2048]
    - [242, 61.95]
  - - [1024, 64, 256, 1024]
    - [243, 68.125]
  - - [1024, 50304, 1, 16384]
    - [68, 96.248]
  - - [512, 64, 40, 512]
    - [244, 25.552]
  - - [1024, 2, 1, 64]
    - [2, 0.009]
  - - [1024, 30528, 1, 8192]
    - [197, 94.616]
  - - [1024, 1024, 1, 64]
    - [142, 4.703]
  - - [64, 128, 1024, 128]
    - [245, 24.404]
  - - [128, 64, 1024, 128]
    - [246, 21.955]
  - - [1024, 1024, 1, 3456]
    - [217, 53.754]
  - - [1024, 1024, 1, 6912]
    - [133, 55.293]
  - - [1024, 1024, 1, 864]
    - [140, 26.425]
  - - [1024, 512, 1, 3456]
    - [247, 33.113]
  - - [1024, 512, 1, 4096]
    - [93, 36.022]
  - - [1024, 512, 1, 6912]
    - [88, 47.44]
  - - [1024, 512, 1, 864]
    - [168, 15.785]
  - - [256, 128, 1, 3456]
    - [248, 5.57]
  - - [256, 128, 1, 4096]
    - [43, 5.261]
  - - [256, 128, 1, 55296]
    - [43, 39.492]
  - - [256, 128, 1, 6912]
    - [249, 10.048]
  - - [256, 128, 1, 864]
    - [14, 1.537]
  - - [256, 3456, 1, 1]
    - [250, 0.068]
  - - [256, 4096, 1, 1]
    - [142, 0.08]
  - - [256, 6912, 1, 1]
    - [215, 0.116]
  - - [256, 864, 1, 1]
    - [9, 0.019]
  - - [480, 1024, 1, 3456]
    - [251, 42.364]
  - - [480, 1024, 1, 4096]
    - [251, 40.488]
  - - [480, 1024, 1, 6912]
    - [75, 54.115]
  - - [480, 1024, 1, 864]
    - [244, 18.574]
  - - [512, 256, 1, 3456]
    - [252, 15.365]
  - - [512, 256, 1, 4096]
    - [252, 15.851]
  - - [512, 256, 1, 55296]
    - [252, 63.217]
  - - [512, 256, 1, 6912]
    - [252, 24.609]
  - - [512, 256, 1, 864]
    - [14, 5.787]
  - - [30528, 1024, 1, 640]
    - [253, 77.95]
  - - [30528, 1024, 1, 1280]
    - [254, 85.611]
  - - [4096, 1024, 1, 10240]
    - [71, 86.464]
  - - [1024, 4096, 1, 10240]
    - [133, 87.038]
  - - [30528, 1024, 1, 1600]
    - [226, 88.095]
  - - [1024, 2, 1, 80]
    - [3, 0.012]
  - - [1024, 1024, 1, 10240]
    - [255, 67.252]
  - - [1024, 1024, 1, 80]
    - [143, 5.331]
  - - [64, 128, 1280, 128]
    - [256, 26.183]
  - - [128, 64, 1280, 128]
    - [184, 24.609]
  - - [1024, 4096, 1, 10496]
    - [132, 87.211]
  - - [30528, 1024, 1, 1640]
    - [257, 88.366]
  - - [4096, 1024, 1, 10496]
    - [60, 86.172]
  - - [1024, 1024, 1, 10496]
    - [258, 66.081]
  - - [1024, 1024, 1, 82]
    - [127, 4.353]
  - - [1024, 2, 1, 82]
    - [211, 0.01]
  - - [128, 64, 1312, 128]
    - [176, 25.553]
  - - [64, 128, 1312, 128]
    - [145, 26.732]
  - - [30528, 1024, 1, 160]
    - [178, 46.818]
  - - [1024, 4096, 1, 6144]
    - [132, 82.867]
  - - [30528, 1024, 1, 240]
    - [254, 55.865]
  - - [4096, 1024, 1, 6144]
    - [131, 80.606]
  - - [1024, 1024, 1, 12]
    - [118, 0.803]
  - - [1024, 2, 1, 12]
    - [7, 0.001]
  - - [1024, 1024, 1, 6144]
    - [228, 60.034]
  - - [64, 512, 192, 512]
    - [218, 47.197]
  - - [512, 64, 192, 512]
    - [111, 46.588]
  - - [13, 512, 1, 3456]
    - [76, 0.744]
  - - [13, 512, 1, 4096]
    - [259, 1.11]
  - - [13, 512, 1, 55296]
    - [37, 7.721]
  - - [13, 512, 1, 6912]
    - [259, 1.988]
  - - [13, 512, 1, 864]
    - [11, 0.26]
  - - [1024, 1024, 1, 10224]
    - [130, 62.736]
  - - [1024, 1024, 1, 10192]
    - [228, 62.63]
  - - [1024, 1024, 1, 10208]
    - [130, 67.602]
  - - [1024, 4096, 1, 10224]
    - [133, 85.469]
  - - [4096, 1024, 1, 10224]
    - [131, 86.231]
  - - [1024, 3072, 1, 10224]
    - [260, 81.581]
  - - [1024, 3072, 1, 10240]
    - [61, 79.852]
  - - [4096, 1024, 1, 10192]
    - [133, 86.457]
  - - [1024, 3072, 1, 10192]
    - [31, 81.13]
  - - [1024, 4096, 1, 10192]
    - [207, 86.91]
  - - [1024, 3072, 1, 10200]
    - [230, 81.195]
  - - [1024, 1024, 1, 10184]
    - [130, 67.315]
  - - [4096, 1024, 1, 10208]
    - [133, 86.004]
  - - [1024, 3072, 1, 10208]
    - [31, 81.347]
  - - [1024, 4096, 1, 10208]
    - [132, 86.945]
  - - [1024, 2048, 1, 10224]
    - [261, 77.966]
  - - [1024, 2048, 1, 10240]
    - [262, 77.101]
  - - [1024, 1024, 1, 10120]
    - [133, 58.374]
  - - [1024, 2048, 1, 10192]
    - [262, 77.778]
  - - [64, 24, 6816, 24]
    - [120, 6.096]
  - - [1024, 1024, 1, 10152]
    - [258, 66.114]
  - - [1024, 3072, 1, 10080]
    - [31, 79.616]
  - - [64, 26, 6272, 26]
    - [122, 6.065]
  - - [100352, 256, 1, 512]
    - [257, 66.248]
  - - [12544, 1024, 1, 2048]
    - [144, 84.102]
  - - [12544, 147, 1, 64]
    - [187, 7.075]
  - - [200704, 256, 1, 512]
    - [206, 74.262]
  - - [25088, 512, 1, 1024]
    - [263, 73.802]
  - - [3136, 576, 1, 64]
    - [80, 7.668]
  - - [50176, 512, 1, 1024]
    - [175, 79.2]
  - - [6272, 1024, 1, 2048]
    - [174, 72.436]
  - - [784, 1152, 1, 128]
    - [165, 6.963]
  - - [3136, 256, 128, 128]
    - [159, 52.072]
  - - [3136, 256, 256, 128]
    - [33, 58.017]
  - - [3136, 256, 128, 64]
    - [166, 32.349]
  - - [3136, 256, 256, 64]
    - [263, 35.461]
  - - [3136, 64, 128, 256]
    - [54, 46.577]
  - - [3136, 64, 256, 256]
    - [54, 52.031]
  - - [3136, 64, 128, 64]
    - [221, 22.254]
  - - [3136, 64, 256, 64]
    - [184, 25.108]
  - - [784, 128, 128, 512]
    - [174, 62.1]
  - - [784, 128, 256, 512]
    - [185, 64.135]
  - - [784, 512, 128, 128]
    - [179, 45.935]
  - - [784, 512, 256, 128]
    - [185, 55.619]
  - - [784, 512, 128, 256]
    - [33, 63.171]
  - - [784, 512, 256, 256]
    - [66, 67.486]
  - - [64, 128, 2048, 128]
    - [27, 30.264]
  - - [128, 64, 2048, 128]
    - [264, 27.869]
  - - [30528, 1024, 1, 2560]
    - [33, 91.374]
  - - [1024, 1024, 1, 128]
    - [102, 8.435]
  - - [1024, 2, 1, 128]
    - [2, 0.018]
  - - [128, 64, 1536, 128]
    - [79, 26.068]
  - - [64, 128, 1536, 128]
    - [152, 26.281]
  - - [1024, 4096, 1, 12288]
    - [132, 87.484]
  - - [30528, 1024, 1, 1920]
    - [253, 88.435]
  - - [1024, 1024, 1, 96]
    - [102, 5.648]
  - - [1024, 1024, 1, 12288]
    - [50, 63.795]
  - - [4096, 1024, 1, 12288]
    - [131, 87.203]
  - - [1024, 2, 1, 96]
    - [196, 0.012]
  - - [25600, 128, 25, 128]
    - [265, 46.381]
  - - [12544, 128, 36, 128]
    - [34, 44.061]
  - - [9216, 128, 49, 128]
    - [253, 45.991]
  - - [6400, 128, 64, 128]
    - [185, 42.734]
  - - [6400, 256, 25, 256]
    - [225, 59.556]
  - - [4096, 256, 36, 256]
    - [266, 61.09]
  - - [2304, 256, 49, 256]
    - [64, 57.454]
  - - [2304, 256, 64, 256]
    - [267, 62.093]
  - - [2304, 512, 25, 512]
    - [34, 72.745]
  - - [1024, 512, 36, 512]
    - [263, 65.82]
  - - [1024, 512, 49, 512]
    - [179, 71.091]
  - - [1024, 512, 64, 512]
    - [268, 72.638]
  - - [92416, 64, 25, 64]
    - [72, 27.187]
  - - [50176, 64, 36, 64]
    - [269, 26.821]
  - - [36864, 64, 49, 64]
    - [140, 26.704]
  - - [25600, 64, 64, 64]
    - [107, 25.921]
  - - [64, 128, 192, 128]
    - [158, 10.502]
  - - [128, 64, 192, 128]
    - [270, 10.747]
  - - [768, 2, 1, 2048]
    - [271, 0.151]
  - - [3072, 768, 1, 2048]
    - [272, 66.064]
  - - [768, 3072, 1, 2048]
    - [237, 69.35]
  - - [768, 768, 1, 2048]
    - [81, 33.897]
  - - [64, 384, 144, 384]
    - [188, 33.849]
  - - [384, 64, 144, 384]
    - [49, 34.987]
  - - [768, 2, 1, 4608]
    - [26, 0.251]
  - - [3072, 768, 1, 4608]
    - [81, 68.965]
  - - [768, 3072, 1, 4608]
    - [273, 70.153]
  - - [768, 768, 1, 4608]
    - [88, 48.651]
  - - [64, 512, 48, 512]
    - [105, 29.179]
  - - [512, 64, 48, 512]
    - [231, 29.278]
  - - [64, 128, 256, 128]
    - [190, 13.517]
  - - [128, 64, 256, 128]
    - [124, 12.821]
  - - [64, 384, 192, 384]
    - [274, 39.144]
  - - [384, 64, 192, 384]
    - [184, 37.474]
  - - [1024, 2, 1, 4608]
    - [275, 0.398]
  - - [4096, 1024, 1, 4608]
    - [155, 78.366]
  - - [1024, 4096, 1, 4608]
    - [276, 77.93]
  - - [1024, 1024, 1, 4608]
    - [133, 48.843]
  - - [196, 2304, 1, 256]
    - [24, 6.411]
  - - [49, 4608, 1, 512]
    - [11, 6.001]
  - - [196, 1024, 128, 256]
    - [254, 49.662]
  - - [196, 1024, 256, 256]
    - [176, 52.2]
  - - [196, 1024, 128, 512]
    - [241, 57.939]
  - - [196, 1024, 256, 512]
    - [254, 62.62]
  - - [196, 256, 128, 1024]
    - [163, 51.305]
  - - [196, 256, 256, 1024]
    - [167, 57.869]
  - - [49, 2048, 128, 512]
    - [153, 39.697]
  - - [49, 2048, 256, 512]
    - [277, 43.087]
  - - [49, 512, 128, 2048]
    - [278, 42.381]
  - - [49, 512, 256, 2048]
    - [189, 52.264]
  - - [96, 1024, 160, 1024]
    - [234, 71.281]
  - - [1024, 96, 160, 1024]
    - [110, 76.547]
  - - [1920, 25216, 1, 16384]
    - [133, 96.0]
  - - [3840, 1920, 1, 16384]
    - [133, 94.727]
  - - [1920, 3840, 1, 16384]
    - [71, 94.658]
  - - [960, 1920, 1, 16384]
    - [279, 86.197]
  - - [1920, 2880, 1, 16384]
    - [234, 90.411]
  - - [96, 1024, 40, 1024]
    - [280, 56.809]
  - - [1024, 96, 40, 1024]
    - [281, 60.747]
  - - [1920, 25216, 1, 4096]
    - [69, 93.776]
  - - [3840, 1920, 1, 4096]
    - [192, 88.651]
  - - [1920, 3840, 1, 4096]
    - [212, 88.679]
  - - [960, 1920, 1, 4096]
    - [266, 72.479]
  - - [1920, 2880, 1, 4096]
    - [282, 83.042]
  - - [96, 1024, 80, 1024]
    - [283, 60.383]
  - - [1024, 96, 80, 1024]
    - [155, 64.415]
  - - [1920, 25216, 1, 8192]
    - [133, 95.112]
  - - [3840, 1920, 1, 8192]
    - [58, 92.523]
  - - [1920, 3840, 1, 8192]
    - [132, 92.493]
  - - [960, 1920, 1, 8192]
    - [254, 75.242]
  - - [1920, 2880, 1, 8192]
    - [284, 85.825]
  - - [96, 1024, 96, 1024]
    - [31, 61.58]
  - - [1024, 96, 96, 1024]
    - [36, 66.151]
  - - [2304, 12672, 1, 16384]
    - [72, 95.192]
  - - [2304, 2304, 1, 16384]
    - [233, 86.663]
  - - [576, 2304, 1, 16384]
    - [285, 79.07]
  - - [2304, 1728, 1, 16384]
    - [133, 84.345]
  - - [96, 1024, 24, 1024]
    - [280, 47.368]
  - - [1024, 96, 24, 1024]
    - [109, 49.845]
  - - [2304, 12672, 1, 4096]
    - [72, 91.997]
  - - [2304, 2304, 1, 4096]
    - [60, 79.248]
  - - [576, 2304, 1, 4096]
    - [58, 67.223]
  - - [2304, 1728, 1, 4096]
    - [281, 77.28]
  - - [96, 1024, 48, 1024]
    - [73, 49.841]
  - - [1024, 96, 48, 1024]
    - [257, 45.812]
  - - [2304, 12672, 1, 8192]
    - [139, 94.311]
  - - [2304, 2304, 1, 8192]
    - [63, 85.418]
  - - [576, 2304, 1, 8192]
    - [201, 72.428]
  - - [2304, 1728, 1, 8192]
    - [198, 82.234]
  - - [96, 1024, 16, 1024]
    - [31, 40.001]
  - - [1024, 96, 16, 1024]
    - [63, 36.011]
  - - [3072, 6400, 1, 4096]
    - [179, 91.929]
  - - [1536, 3072, 1, 4096]
    - [54, 82.008]
  - - [3072, 1536, 1, 4096]
    - [168, 77.924]
  - - [384, 3072, 1, 4096]
    - [50, 62.792]
  - - [3072, 1152, 1, 4096]
    - [254, 75.199]
  - - [96, 1024, 32, 1024]
    - [233, 53.982]
  - - [1024, 96, 32, 1024]
    - [234, 51.777]
  - - [3072, 6400, 1, 8192]
    - [197, 95.027]
  - - [1536, 3072, 1, 8192]
    - [73, 86.663]
  - - [3072, 1536, 1, 8192]
    - [286, 84.997]
  - - [384, 3072, 1, 8192]
    - [258, 69.3]
  - - [3072, 1152, 1, 8192]
    - [238, 80.481]
  - - [2048, 2, 1, 8]
    - [0, 0.002]
  - - [2048, 2048, 1, 4096]
    - [198, 77.319]
  - - [2048, 2048, 1, 8]
    - [74, 1.271]
  - - [2048, 29000, 1, 199]
    - [287, 56.95]
  - - [2048, 29000, 1, 221]
    - [144, 58.405]
  - - [2048, 29000, 1, 224]
    - [139, 59.924]
  - - [2048, 29000, 1, 229]
    - [213, 58.902]
  - - [2048, 29000, 1, 234]
    - [235, 60.57]
  - - [2048, 29000, 1, 242]
    - [179, 62.622]
  - - [2048, 29000, 1, 246]
    - [179, 62.299]
  - - [2048, 29000, 1, 247]
    - [226, 63.918]
  - - [2048, 29000, 1, 256]
    - [138, 66.04]
  - - [2048, 29000, 1, 262]
    - [257, 62.255]
  - - [2048, 29000, 1, 264]
    - [288, 61.518]
  - - [2048, 29000, 1, 265]
    - [140, 65.061]
  - - [2048, 29000, 1, 274]
    - [268, 64.813]
  - - [2048, 29000, 1, 277]
    - [289, 65.368]
  - - [2048, 29000, 1, 279]
    - [140, 64.405]
  - - [2048, 29000, 1, 288]
    - [206, 66.479]
  - - [2048, 29000, 1, 296]
    - [254, 66.752]
  - - [2048, 29000, 1, 315]
    - [34, 67.374]
  - - [2048, 29000, 1, 335]
    - [206, 70.449]
  - - [2048, 4096, 1, 4096]
    - [71, 85.375]
  - - [4096, 2048, 1, 4096]
    - [110, 84.305]
  - - [1024, 29000, 1, 2283]
    - [140, 86.949]
  - - [1024, 29000, 1, 2296]
    - [174, 87.385]
  - - [1024, 29000, 1, 2306]
    - [72, 87.278]
  - - [1024, 29000, 1, 2309]
    - [174, 87.444]
  - - [1024, 29000, 1, 2318]
    - [150, 86.658]
  - - [1024, 29000, 1, 2320]
    - [68, 87.619]
  - - [1024, 29000, 1, 2324]
    - [158, 86.807]
  - - [1024, 29000, 1, 2325]
    - [166, 86.905]
  - - [1024, 29000, 1, 2329]
    - [68, 87.42]
  - - [1024, 29000, 1, 2338]
    - [140, 87.147]
  - - [1024, 29000, 1, 2345]
    - [150, 86.398]
  - - [1024, 29000, 1, 2350]
    - [158, 86.893]
  - - [1024, 29000, 1, 2362]
    - [174, 87.246]
  - - [1024, 29000, 1, 2366]
    - [174, 87.23]
  - - [1024, 29000, 1, 2368]
    - [72, 87.575]
  - - [1024, 29000, 1, 2374]
    - [140, 87.252]
  - - [1024, 29000, 1, 2390]
    - [132, 86.754]
  - - [512, 64, 320, 512]
    - [239, 49.92]
  - - [64, 512, 320, 512]
    - [286, 51.868]
  - - [1024, 1024, 1, 20]
    - [202, 1.55]
  - - [1024, 2, 1, 20]
    - [15, 0.002]
  - - [1024, 29000, 1, 561]
    - [179, 71.79]
  - - [1024, 29000, 1, 574]
    - [140, 71.212]
  - - [1024, 29000, 1, 600]
    - [257, 71.022]
  - - [1024, 29000, 1, 608]
    - [175, 73.74]
  - - [1024, 29000, 1, 615]
    - [269, 72.481]
  - - [1024, 29000, 1, 622]
    - [68, 73.926]
  - - [1024, 29000, 1, 625]
    - [144, 73.68]
  - - [1024, 29000, 1, 626]
    - [158, 74.503]
  - - [1024, 29000, 1, 628]
    - [268, 74.184]
  - - [1024, 29000, 1, 636]
    - [185, 74.746]
  - - [1024, 29000, 1, 651]
    - [150, 75.332]
  - - [1024, 29000, 1, 658]
    - [140, 72.488]
  - - [1024, 29000, 1, 669]
    - [133, 73.066]
  - - [1024, 29000, 1, 670]
    - [166, 73.907]
  - - [1024, 29000, 1, 672]
    - [68, 74.948]
  - - [1024, 29000, 1, 684]
    - [140, 73.878]
  - - [1024, 29000, 1, 716]
    - [206, 75.549]
  - - [1024, 29000, 1, 730]
    - [144, 76.677]
  - - [512, 64, 80, 512]
    - [54, 36.27]
  - - [2560, 2, 1, 2]
    - [7, 0.001]
  - - [2560, 2560, 1, 1024]
    - [64, 64.335]
  - - [2560, 2560, 1, 2]
    - [74, 0.518]
  - - [2560, 29000, 1, 109]
    - [175, 40.046]
  - - [2560, 29000, 1, 121]
    - [254, 43.49]
  - - [2560, 29000, 1, 27]
    - [69, 12.697]
  - - [2560, 29000, 1, 35]
    - [34, 16.317]
  - - [2560, 29000, 1, 36]
    - [69, 16.648]
  - - [2560, 29000, 1, 39]
    - [269, 18.558]
  - - [2560, 29000, 1, 40]
    - [257, 18.647]
  - - [2560, 29000, 1, 42]
    - [69, 20.29]
  - - [2560, 29000, 1, 43]
    - [68, 19.042]
  - - [2560, 29000, 1, 44]
    - [140, 20.999]
  - - [2560, 29000, 1, 46]
    - [69, 21.504]
  - - [2560, 29000, 1, 48]
    - [179, 23.146]
  - - [2560, 29000, 1, 49]
    - [176, 22.532]
  - - [2560, 29000, 1, 50]
    - [140, 22.62]
  - - [2560, 29000, 1, 51]
    - [68, 23.654]
  - - [2560, 29000, 1, 53]
    - [72, 25.167]
  - - [2560, 29000, 1, 54]
    - [144, 24.03]
  - - [2560, 29000, 1, 55]
    - [69, 25.968]
  - - [2560, 29000, 1, 56]
    - [269, 26.084]
  - - [2560, 29000, 1, 57]
    - [140, 25.034]
  - - [2560, 29000, 1, 58]
    - [69, 25.744]
  - - [2560, 29000, 1, 59]
    - [241, 24.465]
  - - [2560, 29000, 1, 61]
    - [290, 24.806]
  - - [2560, 29000, 1, 63]
    - [269, 27.097]
  - - [2560, 29000, 1, 65]
    - [67, 28.922]
  - - [2560, 29000, 1, 66]
    - [269, 30.798]
  - - [2560, 29000, 1, 67]
    - [67, 31.588]
  - - [2560, 29000, 1, 69]
    - [176, 29.573]
  - - [2560, 29000, 1, 70]
    - [269, 30.77]
  - - [2560, 29000, 1, 71]
    - [287, 29.037]
  - - [2560, 29000, 1, 73]
    - [226, 29.709]
  - - [2560, 29000, 1, 74]
    - [144, 31.555]
  - - [2560, 29000, 1, 75]
    - [72, 30.513]
  - - [2560, 29000, 1, 77]
    - [68, 30.804]
  - - [2560, 29000, 1, 78]
    - [67, 34.128]
  - - [2560, 29000, 1, 80]
    - [257, 36.612]
  - - [2560, 29000, 1, 81]
    - [268, 35.224]
  - - [2560, 29000, 1, 82]
    - [269, 35.928]
  - - [2560, 29000, 1, 83]
    - [241, 32.594]
  - - [2560, 29000, 1, 84]
    - [185, 33.494]
  - - [2560, 29000, 1, 88]
    - [67, 34.801]
  - - [2560, 29000, 1, 89]
    - [69, 33.894]
  - - [2560, 29000, 1, 90]
    - [176, 34.896]
  - - [2560, 29000, 1, 92]
    - [176, 36.53]
  - - [2560, 29000, 1, 95]
    - [69, 40.013]
  - - [2560, 29000, 1, 98]
    - [235, 39.36]
  - - [2560, 4096, 1, 1024]
    - [254, 68.936]
  - - [4096, 2560, 1, 1024]
    - [269, 70.023]
  - - [1024, 64, 512, 1024]
    - [49, 71.279]
  - - [64, 1024, 512, 1024]
    - [291, 73.183]
  - - [1024, 3072, 1, 32768]
    - [292, 87.128]
  - - [1024, 4096, 1, 32768]
    - [71, 90.026]
  - - [1024, 50304, 1, 32768]
    - [72, 96.755]
  - - [4096, 1024, 1, 32768]
    - [71, 90.099]
  - - [1024, 128, 24, 1024]
    - [168, 54.0]
  - - [128, 1024, 24, 1024]
    - [55, 54.067]
- null
