library/src/blas3/Tensile/Logic/asm_full/arcturus_Cijk_Ailk_Bjlk_HBH.yaml
- {MinimumRequiredVersion: 4.6.0}
- arcturus
- gfx908
- [Device 7380, Device 7388, Device 738c, Device 7390]
    SolutionIndex: 0
    SolutionNameMin: Cijk_Ailk_Bjlk_HBH_MT016x016x08_PGR1_PLR1_TT02_02
    SolutionIndex: 1
    SolutionNameMin: Cijk_Ailk_Bjlk_HBH_MT016x016x16_PGR1_PLR1_TT02_02
    SolutionIndex: 2
    SolutionNameMin: Cijk_Ailk_Bjlk_HBH_MT032x016x16_PGR1_PLR1_TT04_02
    SolutionIndex: 3
    SolutionNameMin: Cijk_Ailk_Bjlk_HBH_MT016x016x24_PGR1_PLR1_TT02_02
    SolutionIndex: 4
    SolutionNameMin: Cijk_Ailk_Bjlk_HBH_MT032x016x24_PGR1_PLR1_TT04_02
    SolutionIndex: 5
    SolutionNameMin: Cijk_Ailk_Bjlk_HBH_MT016x016x32_PGR1_PLR1_TT02_02
    SolutionIndex: 6
    SolutionNameMin: Cijk_Ailk_Bjlk_HBH_MT032x016x32_PGR1_PLR1_TT02_02
    SolutionIndex: 7
    SolutionNameMin: Cijk_Ailk_Bjlk_HBH_MT064x016x32_PGR1_PLR1_TT02_02
    SolutionIndex: 8
    SolutionNameMin: Cijk_Ailk_Bjlk_HBH_MT016x016x32_PGR1_PLR1_TT02_02
    SolutionIndex: 9
    SolutionNameMin: Cijk_Ailk_Bjlk_HBH_MT064x016x32_PGR1_PLR1_TT02_02
    SolutionIndex: 10
    SolutionNameMin: Cijk_Ailk_Bjlk_HBH_MT016x016x64_PGR1_PLR1_TT02_02
    SolutionIndex: 11
    SolutionNameMin: Cijk_Ailk_Bjlk_HBH_MT032x016x64_PGR1_PLR1_TT02_02
    SolutionIndex: 12
    SolutionNameMin: Cijk_Ailk_Bjlk_HBH_MT064x016x64_PGR1_PLR1_TT02_02
    SolutionIndex: 13
    SolutionNameMin: Cijk_Ailk_Bjlk_HBH_MT016x016x64_PGR1_PLR1_TT02_02
    SolutionIndex: 14
    SolutionNameMin: Cijk_Ailk_Bjlk_HBH_MT032x016x64_PGR1_PLR1_TT02_02
    SolutionIndex: 15
    SolutionNameMin: Cijk_Ailk_Bjlk_HBH_MT032x032x08_PGR1_PLR1_TT02_02
    SolutionIndex: 16
    SolutionNameMin: Cijk_Ailk_Bjlk_HBH_MT032x032x16_PGR1_PLR1_TT02_02
    SolutionIndex: 17
    SolutionNameMin: Cijk_Ailk_Bjlk_HBH_MT032x032x32_PGR1_PLR1_TT02_02
    SolutionIndex: 18
    SolutionNameMin: Cijk_Ailk_Bjlk_HBH_MT032x032x64_PGR1_PLR1_TT02_02
    SolutionIndex: 19
    SolutionNameMin: Cijk_Ailk_Bjlk_HBH_MT064x064x04_PGR0_PLR1_TT04_04
    SolutionIndex: 20
    SolutionNameMin: Cijk_Ailk_Bjlk_HBH_MT064x064x04_PGR1_PLR1_TT04_04
    SolutionIndex: 21
    SolutionNameMin: Cijk_Ailk_Bjlk_HBH_MT064x064x08_PGR0_PLR1_TT04_04
    SolutionIndex: 22
    SolutionNameMin: Cijk_Ailk_Bjlk_HBH_MT064x064x16_PGR1_PLR1_TT04_04
    SolutionIndex: 23
    SolutionNameMin: Cijk_Ailk_Bjlk_HBH_MT064x032x16_PGR1_PLR1_TT04_04
    SolutionIndex: 24
    SolutionNameMin: Cijk_Ailk_Bjlk_HBH_MT128x032x32_PGR1_PLR1_TT04_04
    SolutionIndex: 25
    SolutionNameMin: Cijk_Ailk_Bjlk_HBH_MT128x016x32_PGR1_PLR1_TT04_04
    SolutionIndex: 26
    SolutionNameMin: Cijk_Ailk_Bjlk_HBH_MT064x064x16_PGR1_PLR1_TT08_08
    SolutionIndex: 27
    SolutionNameMin: Cijk_Ailk_Bjlk_HBH_MT064x128x16_PGR1_PLR1_TT04_08
    SolutionIndex: 28
    SolutionNameMin: Cijk_Ailk_Bjlk_HBH_MT128x128x16_PGR1_PLR1_TT08_08
    SolutionIndex: 29
    SolutionNameMin: Cijk_Ailk_Bjlk_HBH_MT064x064x08_PGR0_PLR1_TT04_04
    SolutionIndex: 30
    SolutionNameMin: Cijk_Ailk_Bjlk_HBH_MT128x128x04_PGR0_PLR1_TT08_08
    SolutionIndex: 31
    SolutionNameMin: Cijk_Ailk_Bjlk_HBH_MT064x128x16_PGR0_PLR1_TT04_08
    SolutionIndex: 32
    SolutionNameMin: Cijk_Ailk_Bjlk_HBH_MT128x128x16_EPS1_GRVW04_PGR1_PLR1_SNLL1_TT08_08_VW04_WG16_16_01_WGM01
    SolutionIndex: 33
    SolutionNameMin: Cijk_Ailk_Bjlk_HBH_MT128x064x16_EPS1_GRVW04_PGR1_PLR1_SNLL1_TT08_04_VW04_WG16_16_01_WGM08
    SolutionIndex: 34
    SolutionNameMin: Cijk_Ailk_Bjlk_HBH_MT064x064x32_EPS0_GRVW04_PGR0_PLR0_SNLL0_TT04_04_VW04_WG16_16_01_WGM01
    SolutionIndex: 35
    SolutionNameMin: Cijk_Ailk_Bjlk_HBH_MT128x128x32_EPS1_GRVW08_PGR1_PLR1_SNLL1_TT08_08_VW08_WG16_16_01_WGM64
    SolutionIndex: 36
    SolutionNameMin: Cijk_Ailk_Bjlk_HBH_MT64x128x16_MI32x32x4x2_SE_AF0EM1_ASEM2_ONLL1_SNLL1
    SolutionIndex: 37
    SolutionNameMin: Cijk_Ailk_Bjlk_HBH_MT64x256x16_MI32x32x4x2_SE_AF0EM1_ASEM1_ONLL0_SNLL0
    SolutionIndex: 38
    SolutionIndex: 39
    SolutionIndex: 40
    SolutionIndex: 41
    SolutionIndex: 42
    SolutionIndex: 43
    SolutionIndex: 44
    SolutionIndex: 45
    SolutionIndex: 46
    SolutionIndex: 47
    SolutionIndex: 48
    SolutionIndex: 49
    SolutionIndex: 50
    SolutionIndex: 51
    SolutionIndex: 52
    SolutionIndex: 53
    SolutionIndex: 54
    SolutionIndex: 55
    SolutionIndex: 56
    SolutionIndex: 57
    SolutionIndex: 58
    SolutionIndex: 59
    SolutionIndex: 60
    SolutionIndex: 61
    SolutionIndex: 62
    SolutionIndex: 63
    SolutionIndex: 64
    SolutionIndex: 65
    SolutionIndex: 66
    SolutionIndex: 67
    SolutionIndex: 68
    SolutionIndex: 69
    SolutionIndex: 70
    SolutionIndex: 71
    SolutionIndex: 72
    SolutionIndex: 73
    SolutionIndex: 74
    SolutionIndex: 75
    SolutionIndex: 76
    SolutionIndex: 77
    SolutionIndex: 78
    SolutionIndex: 79
    SolutionIndex: 80
    SolutionIndex: 81
    SolutionIndex: 82
    SolutionIndex: 83
    SolutionIndex: 84
    SolutionIndex: 85
    SolutionIndex: 86
    SolutionIndex: 87
    SolutionIndex: 88
    SolutionIndex: 89
    SolutionIndex: 90
    SolutionIndex: 91
    SolutionIndex: 92
    SolutionIndex: 93
    SolutionIndex: 94
    SolutionNameMin: Cijk_Ailk_Bjlk_HBH_MT256x256x32_MI32x32x8x1_SE_AF0EM4_GRVW8_NLCA1_NLCB1_SU0_SUS256_SRVW4_TT4_128_WG64_4_1_WGM15
    SolutionIndex: 95
    SolutionNameMin: Cijk_Ailk_Bjlk_HBH_MT32x64x16_MI16x16x16x1_SE_AF0EM4_GRVW4_NLCA1_NLCB1_SU0_SUS256_SRVW4_TT1_32_WG32_8_1_WGM1
    SolutionIndex: 96
    SolutionNameMin: Cijk_Ailk_Bjlk_HBH_MT128x128x16_MI32x32x8x1_SE_AF0EM1_GRVW8_NLCA1_NLCB1_SU32_SUS128_SRVW4_TT2_64_WG64_4_1_WGM15
    SolutionIndex: 97
    SolutionNameMin: Cijk_Ailk_Bjlk_HBH_MT32x32x16_MI16x16x16x1_SE_AF0EM4_GRVW2_NLCA1_NLCB1_SU0_SUS256_SRVW0_TT1_16_WG32_8_1_WGM2
    SolutionIndex: 98
    SolutionNameMin: Cijk_Ailk_Bjlk_HBH_MT32x32x16_MI16x16x16x1_SE_AF0EM1_GRVW2_NLCA1_NLCB1_SU0_SUS256_SRVW0_TT1_16_WG32_8_1_WGM1
    SolutionIndex: 99
    SolutionNameMin: Cijk_Ailk_Bjlk_HBH_MT32x32x128_MI16x16x16x1_SE_AF0EM1_GRVW8_NLCA1_NLCB1_SU16_SUS256_SRVW0_TT1_16_WG32_8_1_WGM1
    SolutionIndex: 100
    SolutionNameMin: Cijk_Ailk_Bjlk_HBH_MT64x128x16_MI32x32x8x1_SE_AF0EM1_GRVW4_NLCA1_NLCB1_SU0_SUS256_SRVW4_TT1_64_WG64_4_1_WGM15
    SolutionIndex: 101
    SolutionNameMin: Cijk_Ailk_Bjlk_HBH_MT256x128x32_MI32x32x8x1_SE_AF0EM1_GRVW8_NLCA1_NLCB1_SU0_SUS256_SRVW4_TT4_64_WG64_4_1_WGM15
    SolutionIndex: 102
    SolutionNameMin: Cijk_Ailk_Bjlk_HBH_MT64x32x16_MI16x16x16x1_SE_AF0EM4_GRVW4_NLCA1_NLCB1_SU32_SUS256_SRVW0_TT2_16_WG32_8_1_WGM15
    SolutionIndex: 103
    SolutionNameMin: Cijk_Ailk_Bjlk_HBH_MT64x64x32_MI32x32x8x1_SE_AF0EM1_GRVW8_NLCA1_NLCB1_SU32_SUS256_SRVW4_TT1_32_WG64_4_1_WGM15
    SolutionIndex: 104
    SolutionNameMin: Cijk_Ailk_Bjlk_HBH_MT32x64x16_MI16x16x16x1_SE_AF0EM4_GRVW4_NLCA1_NLCB1_SU0_SUS256_SRVW0_TT1_32_WG32_8_1_WGM1
    SolutionIndex: 105
    SolutionNameMin: Cijk_Ailk_Bjlk_HBH_MT64x64x16_MI32x32x8x1_SE_AF0EM4_GRVW2_NLCA1_NLCB1_SU32_SUS256_SRVW4_TT1_32_WG64_4_1_WGM1
    SolutionIndex: 106
    SolutionNameMin: Cijk_Ailk_Bjlk_HBH_MT32x32x64_MI16x16x16x1_SE_AF0EM4_GRVW2_NLCA1_NLCB1_SU16_SUS256_SRVW0_TT1_16_WG32_8_1_WGM1
    SolutionIndex: 107
    SolutionNameMin: Cijk_Ailk_Bjlk_HBH_MT32x64x16_MI16x16x16x1_SE_AF0EM1_GRVW4_NLCA1_NLCB1_SU0_SUS256_SRVW0_TT1_32_WG32_8_1_WGM1
    SolutionIndex: 108
    SolutionNameMin: Cijk_Ailk_Bjlk_HBH_MT32x64x16_MI16x16x16x1_SE_AF0EM1_GRVW2_NLCA1_NLCB1_SU0_SUS256_SRVW4_TT1_32_WG32_8_1_WGM2
    SolutionIndex: 109
    SolutionNameMin: Cijk_Ailk_Bjlk_HBH_MT32x64x16_MI16x16x16x1_SE_AF0EM1_GRVW2_NLCA1_NLCB1_SU32_SUS128_SRVW4_TT1_32_WG32_8_1_WGM15
    SolutionIndex: 110
    SolutionNameMin: Cijk_Ailk_Bjlk_HBH_MT256x256x32_MI32x32x8x1_SE_AF0EM4_GRVW8_NLCA1_NLCB1_SU16_SUS128_SRVW4_TT4_128_WG64_4_1_WGM15
    SolutionIndex: 111
    SolutionNameMin: Cijk_Ailk_Bjlk_HBH_MT64x64x128_MI32x32x8x1_SE_AF0EM4_GRVW8_NLCA1_NLCB1_SU32_SUS256_SRVW4_TT1_32_WG64_4_1_WGM2
    SolutionIndex: 112
    SolutionNameMin: Cijk_Ailk_Bjlk_HBH_MT128x128x64_MI32x32x8x1_SE_AF0EM1_GRVW8_NLCA1_NLCB1_SU16_SUS128_SRVW4_TT2_64_WG64_4_1_WGM2
    SolutionIndex: 113
    SolutionNameMin: Cijk_Ailk_Bjlk_HBH_MT32x64x16_MI16x16x16x1_SE_AF0EM1_GRVW2_NLCA1_NLCB1_SU16_SUS256_SRVW0_TT1_32_WG32_8_1_WGM2
    SolutionIndex: 114
    SolutionNameMin: Cijk_Ailk_Bjlk_HBH_MT256x128x32_MI32x32x8x1_SE_AF0EM4_GRVW8_NLCA1_NLCB1_SU0_SUS256_SRVW4_TT4_64_WG64_4_1_WGM2
    SolutionIndex: 115
    SolutionNameMin: Cijk_Ailk_Bjlk_HBH_MT128x128x64_MI32x32x8x1_SE_AF0EM4_GRVW8_NLCA1_NLCB1_SU0_SUS256_SRVW4_TT2_64_WG64_4_1_WGM2
    SolutionIndex: 116
    SolutionNameMin: Cijk_Ailk_Bjlk_HBH_MT64x64x128_MI32x32x8x1_SE_AF0EM4_GRVW8_NLCA1_NLCB1_SU32_SUS256_SRVW4_TT1_32_WG64_4_1_WGM1
    SolutionIndex: 117
    SolutionNameMin: Cijk_Ailk_Bjlk_HBH_MT32x32x16_MI16x16x16x1_SE_AF0EM1_GRVW8_NLCA1_NLCB1_SU0_SUS256_SRVW0_TT1_16_WG32_8_1_WGM1
    SolutionIndex: 118
    SolutionNameMin: Cijk_Ailk_Bjlk_HBH_MT32x32x64_MI16x16x16x1_SE_AF0EM4_GRVW8_NLCA1_NLCB1_SU16_SUS128_SRVW0_TT1_16_WG32_8_1_WGM1
    SolutionIndex: 119
    SolutionNameMin: Cijk_Ailk_Bjlk_HBH_MT64x64x16_MI32x32x8x1_SE_AF0EM4_GRVW2_NLCA1_NLCB1_SU0_SUS256_SRVW4_TT1_32_WG64_4_1_WGM2
    SolutionIndex: 120
    SolutionNameMin: Cijk_Ailk_Bjlk_HBH_MT32x64x16_MI16x16x16x1_SE_AF0EM1_GRVW2_NLCA1_NLCB1_SU32_SUS256_SRVW0_TT1_32_WG32_8_1_WGM1
    SolutionIndex: 121
    SolutionNameMin: Cijk_Ailk_Bjlk_HBH_MT64x32x16_MI16x16x16x1_SE_AF0EM4_GRVW2_NLCA1_NLCB1_SU0_SUS256_SRVW0_TT2_16_WG32_8_1_WGM1
    SolutionIndex: 122
    SolutionNameMin: Cijk_Ailk_Bjlk_HBH_MT64x64x128_MI32x32x8x1_SE_AF0EM1_GRVW8_NLCA1_NLCB1_SU16_SUS256_SRVW0_TT1_32_WG64_4_1_WGM15
    SolutionIndex: 123
    SolutionNameMin: Cijk_Ailk_Bjlk_HBH_MT128x256x32_MI32x32x8x1_SE_AF0EM1_GRVW8_NLCA1_NLCB1_SU0_SUS256_SRVW4_TT2_128_WG64_4_1_WGM15
    SolutionIndex: 124
    SolutionNameMin: Cijk_Ailk_Bjlk_HBH_MT64x32x16_MI16x16x16x1_SE_AF0EM4_GRVW4_NLCA1_NLCB1_SU0_SUS256_SRVW0_TT2_16_WG32_8_1_WGM1
    SolutionIndex: 125
    SolutionNameMin: Cijk_Ailk_Bjlk_HBH_MT64x128x32_MI32x32x8x1_SE_AF0EM4_GRVW4_NLCA1_NLCB1_SU32_SUS256_SRVW4_TT1_64_WG64_4_1_WGM15
    SolutionIndex: 126
    SolutionNameMin: Cijk_Ailk_Bjlk_HBH_MT32x64x16_MI16x16x16x1_SE_AF0EM1_GRVW2_NLCA1_NLCB1_SU0_SUS256_SRVW0_TT1_32_WG32_8_1_WGM15
    SolutionIndex: 127
    SolutionNameMin: Cijk_Ailk_Bjlk_HBH_MT128x128x64_MI32x32x8x1_SE_AF0EM4_GRVW8_NLCA1_NLCB1_SU32_SUS256_SRVW4_TT2_64_WG64_4_1_WGM15
    SolutionIndex: 128
    SolutionNameMin: Cijk_Ailk_Bjlk_HBH_MT128x128x64_MI32x32x8x1_SE_AF0EM4_GRVW8_NLCA1_NLCB1_SU0_SUS256_SRVW4_TT2_64_WG64_4_1_WGM15
    SolutionIndex: 129
    SolutionNameMin: Cijk_Ailk_Bjlk_HBH_MT128x256x16_MI32x32x8x1_SE_AF0EM4_GRVW8_NLCA1_NLCB1_SU16_SUS128_SRVW4_TT2_128_WG64_4_1_WGM15
    SolutionIndex: 130
    SolutionNameMin: Cijk_Ailk_Bjlk_HBH_MT128x64x16_MI32x32x8x1_SE_AF0EM4_GRVW8_NLCA1_NLCB1_SU16_SUS128_SRVW4_TT2_32_WG64_4_1_WGM2
    SolutionIndex: 131
    SolutionNameMin: Cijk_Ailk_Bjlk_HBH_MT32x32x16_MI16x16x16x1_SE_AF0EM4_GRVW2_NLCA1_NLCB1_SU32_SUS128_SRVW0_TT1_16_WG32_8_1_WGM15
    SolutionIndex: 132
    SolutionNameMin: Cijk_Ailk_Bjlk_HBH_MT64x64x64_MI32x32x8x1_SE_AF0EM4_GRVW8_NLCA1_NLCB1_SU32_SUS128_SRVW4_TT1_32_WG64_4_1_WGM1
    SolutionIndex: 133
    SolutionNameMin: Cijk_Ailk_Bjlk_HBH_MT64x128x16_MI32x32x4x2_SE_AF0EM1_GRVW4_NLCA1_NLCB1_SU0_SUS256_SRVW4_TT1_32_WG64_4_1_WGM15
    SolutionIndex: 134
    SolutionNameMin: Cijk_Ailk_Bjlk_HBH_MT256x128x32_MI32x32x4x2_SE_AF0EM4_GRVW8_NLCA1_NLCB1_SU32_SUS128_SRVW4_TT2_64_WG128_2_1_WGM2
    SolutionIndex: 135
    SolutionNameMin: Cijk_Ailk_Bjlk_HBH_MT32x64x16_MI16x16x16x1_SE_AF0EM4_GRVW2_NLCA1_NLCB1_SU32_SUS256_SRVW0_TT1_32_WG32_8_1_WGM15
    SolutionIndex: 136
    SolutionNameMin: Cijk_Ailk_Bjlk_HBH_MT128x96x64_MI32x32x8x1_SE_AF0EM4_GRVW8_NLCA1_NLCB3_SU16_SUS128_SRVW4_TT1_96_WG128_2_1_WGM15
    SolutionIndex: 137
    SolutionNameMin: Cijk_Ailk_Bjlk_HBH_MT64x64x128_MI32x32x8x1_SE_AF0EM1_GRVW8_NLCA1_NLCB1_SU16_SUS256_SRVW4_TT1_32_WG64_4_1_WGM15
    SolutionIndex: 138
    SolutionNameMin: Cijk_Ailk_Bjlk_HBH_MT64x128x16_MI32x32x4x2_SE_AF0EM1_GRVW2_NLCA1_NLCB1_SU16_SUS128_SRVW4_TT1_32_WG64_4_1_WGM1
    SolutionIndex: 139
    SolutionNameMin: Cijk_Ailk_Bjlk_HBH_MT32x32x64_MI16x16x16x1_SE_AF0EM4_GRVW8_NLCA1_NLCB1_SU0_SUS256_SRVW0_TT1_16_WG32_8_1_WGM15
    SolutionIndex: 140
    SolutionNameMin: Cijk_Ailk_Bjlk_HBH_MT64x32x16_MI16x16x16x1_SE_AF0EM4_GRVW2_NLCA1_NLCB1_SU32_SUS128_SRVW0_TT2_16_WG32_8_1_WGM2
    SolutionIndex: 141
    SolutionNameMin: Cijk_Ailk_Bjlk_HBH_MT64x128x16_MI32x32x4x2_SE_AF0EM1_GRVW8_NLCA1_NLCB1_SU32_SUS128_SRVW4_TT1_32_WG64_4_1_WGM15
    SolutionIndex: 142
    SolutionNameMin: Cijk_Ailk_Bjlk_HBH_MT128x128x64_MI32x32x8x1_SE_AF0EM1_GRVW8_NLCA1_NLCB1_SU32_SUS128_SRVW4_TT2_64_WG64_4_1_WGM2
    SolutionIndex: 143
    SolutionNameMin: Cijk_Ailk_Bjlk_HBH_MT64x32x16_MI16x16x16x1_SE_AF0EM4_GRVW4_NLCA1_NLCB1_SU32_SUS256_SRVW0_TT2_16_WG32_8_1_WGM1
    SolutionIndex: 144
    SolutionNameMin: Cijk_Ailk_Bjlk_HBH_MT32x32x16_MI16x16x16x1_SE_AF0EM1_GRVW2_NLCA1_NLCB1_SU32_SUS256_SRVW0_TT1_16_WG32_8_1_WGM1
    SolutionIndex: 145
    SolutionNameMin: Cijk_Ailk_Bjlk_HBH_MT64x128x64_MI32x32x8x1_SE_AF0EM1_GRVW8_NLCA1_NLCB1_SU0_SUS256_SRVW4_TT1_64_WG64_4_1_WGM1
    SolutionIndex: 146
    SolutionNameMin: Cijk_Ailk_Bjlk_HBH_MT128x288x32_MI32x32x8x1_SE_AF0EM4_GRVW4_NLCA1_NLCB9_SU32_SUS128_SRVW4_TT1_288_WG128_2_1_WGM15
    SolutionIndex: 147
    SolutionNameMin: Cijk_Ailk_Bjlk_HBH_MT64x32x16_MI16x16x16x1_SE_AF0EM4_GRVW2_NLCA1_NLCB1_SU32_SUS256_SRVW0_TT2_16_WG32_8_1_WGM1
    SolutionIndex: 148
    SolutionNameMin: Cijk_Ailk_Bjlk_HBH_MT128x160x32_MI32x32x8x1_SE_AF0EM4_GRVW2_NLCA1_NLCB5_SU0_SUS256_SRVW4_TT1_160_WG128_2_1_WGM15
    SolutionIndex: 149
    SolutionNameMin: Cijk_Ailk_Bjlk_HBH_MT32x64x16_MI16x16x16x1_SE_AF0EM1_GRVW2_NLCA1_NLCB1_SU16_SUS256_SRVW4_TT1_32_WG32_8_1_WGM2
    SolutionIndex: 150
    SolutionNameMin: Cijk_Ailk_Bjlk_HBH_MT128x96x64_MI32x32x8x1_SE_AF0EM4_GRVW8_NLCA1_NLCB3_SU32_SUS128_SRVW4_TT1_96_WG128_2_1_WGM15
    SolutionIndex: 151
    SolutionNameMin: Cijk_Ailk_Bjlk_HBH_MT128x256x32_MI32x32x8x1_SE_AF0EM4_GRVW8_NLCA1_NLCB1_SU0_SUS256_SRVW4_TT2_128_WG64_4_1_WGM15
    SolutionIndex: 152
    SolutionNameMin: Cijk_Ailk_Bjlk_HBH_MT128x128x16_MI32x32x8x1_SE_AF0EM4_GRVW8_NLCA1_NLCB1_SU16_SUS128_SRVW4_TT2_64_WG64_4_1_WGM15
    SolutionIndex: 153
    SolutionNameMin: Cijk_Ailk_Bjlk_HBH_MT256x256x16_MI32x32x4x2_SE_AF0EM4_GRVW8_NLCA1_NLCB1_SU0_SUS256_SRVW4_TT2_128_WG128_2_1_WGM2
    SolutionIndex: 154
    SolutionNameMin: Cijk_Ailk_Bjlk_HBH_MT64x128x16_MI32x32x4x2_SE_AF0EM4_GRVW8_NLCA1_NLCB1_SU32_SUS256_SRVW4_TT1_32_WG64_4_1_WGM2
    SolutionIndex: 155
    SolutionNameMin: Cijk_Ailk_Bjlk_HBH_MT64x32x16_MI16x16x16x1_SE_AF0EM4_GRVW2_NLCA1_NLCB1_SU16_SUS256_SRVW0_TT2_16_WG32_8_1_WGM2
    SolutionIndex: 156
    SolutionNameMin: Cijk_Ailk_Bjlk_HBH_MT256x144x32_MI16x16x16x1_SE_AF0EM4_GRVW2_NLCA2_NLCB9_SU0_SUS256_SRVW0_TT4_144_WG64_4_1_WGM1
    SolutionIndex: 157
    SolutionNameMin: Cijk_Ailk_Bjlk_HBH_MT32x64x16_MI16x16x16x1_SE_AF0EM1_GRVW8_NLCA1_NLCB1_SU0_SUS256_SRVW0_TT1_32_WG32_8_1_WGM2
    SolutionIndex: 158
    SolutionNameMin: Cijk_Ailk_Bjlk_HBH_MT128x96x16_MI32x32x8x1_SE_AF0EM4_GRVW2_NLCA1_NLCB3_SU0_SUS256_SRVW4_TT1_96_WG128_2_1_WGM2
    SolutionIndex: 159
    SolutionNameMin: Cijk_Ailk_Bjlk_HBH_MT64x64x32_MI32x32x8x1_SE_AF0EM4_GRVW8_NLCA1_NLCB1_SU0_SUS256_SRVW4_TT1_32_WG64_4_1_WGM15
    SolutionIndex: 160
    SolutionNameMin: Cijk_Ailk_Bjlk_HBH_MT128x128x64_MI32x32x8x1_SE_AF0EM4_GRVW4_NLCA1_NLCB1_SU0_SUS256_SRVW4_TT2_64_WG64_4_1_WGM15
    SolutionIndex: 161
    SolutionNameMin: Cijk_Ailk_Bjlk_HBH_MT128x64x32_MI32x32x8x1_SE_AF0EM4_GRVW4_NLCA1_NLCB1_SU0_SUS256_SRVW4_TT2_32_WG64_4_1_WGM1
    SolutionIndex: 162
    SolutionNameMin: Cijk_Ailk_Bjlk_HBH_MT128x128x32_MI32x32x8x1_SE_AF0EM4_ASBE01_GRVW4_PBD0_SRVW4_TT2_64_WG64_4_1_WGM1
    SolutionIndex: 163
    SolutionNameMin: Cijk_Ailk_Bjlk_HBH_MT64x64x32_MI16x16x16x1_SE_AF0EM1_ASBE01_GRVW2_PBD0_SRVW4_TT2_32_WG32_8_1_WGM1
    SolutionIndex: 164
    SolutionNameMin: Cijk_Ailk_Bjlk_HBH_MT128x128x32_MI32x32x8x1_SE_AF0EM8_ASBE01_GRVW8_PBD0_SRVW4_TT2_64_WG64_4_1_WGM1
    SolutionIndex: 165
    SolutionNameMin: Cijk_Ailk_Bjlk_HBH_MT128x256x32_MI32x32x4x2_SE_AF0EM4_ASBE01_GRVW4_PBD0_SRVW4_TT2_64_WG64_4_1_WGM120
    SolutionIndex: 166
    SolutionNameMin: Cijk_Ailk_Bjlk_HBH_MT128x128x32_MI32x32x8x1_SE_AF0EM4_ASBE01_GRVW4_PBD0_SRVW4_TT2_64_WG64_4_1_WGM10
    SolutionIndex: 167
    SolutionNameMin: Cijk_Ailk_Bjlk_HBH_MT64x64x32_MI32x32x8x1_SE_AF0EM1_ASBE01_GRVW4_PBD0_SRVW4_TT1_32_WG64_4_1_WGM120
    SolutionIndex: 168
    SolutionNameMin: Cijk_Ailk_Bjlk_HBH_MT64x128x32_MI32x32x8x1_SE_AF0EM4_ASBE01_GRVW4_PBD0_SRVW4_TT2_32_WG32_8_1_WGM1
    SolutionIndex: 169
    SolutionNameMin: Cijk_Ailk_Bjlk_HBH_MT64x64x32_MI32x32x8x1_SE_AF0EM8_ASBE01_GRVW8_PBD0_SRVW4_TT1_32_WG64_4_1_WGM1
    SolutionIndex: 170
    SolutionNameMin: Cijk_Ailk_Bjlk_HBH_MT64x64x32_MI32x32x8x1_SE_AF0EM4_ASBE01_GRVW2_PBD0_SRVW4_TT1_32_WG64_4_1_WGM120
    SolutionIndex: 171
    SolutionNameMin: Cijk_Ailk_Bjlk_HBH_MT256x256x32_MI32x32x8x1_SE_AF0EM8_GRVW8_GSU1_SU0_SUS256_SRVW4_VAW2_WG64_4_1_WGM1
    SolutionIndex: 172
    SolutionNameMin: Cijk_Ailk_Bjlk_HBH_MT128x256x32_MI32x32x8x1_SE_AF0EM8_GRVW8_GSU1_SU32_SUS128_SRVW4_VAW2_WG64_4_1_WGM1
    SolutionIndex: 173
    SolutionNameMin: Cijk_Ailk_Bjlk_HBH_MT64x128x64_MI32x32x8x1_SE_AF0EM8_GRVW8_GSU1_SU32_SUS256_SRVW4_VAW2_WG64_4_1_WGM2
    SolutionIndex: 174
    SolutionNameMin: Cijk_Ailk_Bjlk_HBH_MT32x64x64_MI16x16x16x1_SE_AF0EM8_GRVW8_GSU1_SU0_SUS256_SRVW4_VAW2_WG32_8_1_WGM15
    SolutionIndex: 175
    SolutionNameMin: Cijk_Ailk_Bjlk_HBH_MT256x256x32_MI32x32x8x1_SE_AF0EM8_GRVW8_GSU1_SU0_SUS256_SRVW4_VAW2_WG64_4_1_WGM15
    SolutionIndex: 176
    SolutionNameMin: Cijk_Ailk_Bjlk_HBH_MT256x128x32_MI32x32x8x1_SE_AF0EM8_GRVW8_GSU1_SU0_SUS256_SRVW4_VAW2_WG64_4_1_WGM15
    SolutionIndex: 177
    SolutionNameMin: Cijk_Ailk_Bjlk_HBH_MT128x64x64_MI32x32x8x1_SE_AF0EM8_GRVW8_GSU1_SU0_SUS256_SRVW4_VAW2_WG64_4_1_WGM15
    SolutionIndex: 178
    SolutionNameMin: Cijk_Ailk_Bjlk_HBH_MT64x32x64_MI16x16x16x1_SE_AF0EM8_GRVW8_GSU1_SU0_SUS256_SRVW4_VAW2_WG32_8_1_WGM1
    SolutionIndex: 179
    SolutionNameMin: Cijk_Ailk_Bjlk_HBH_MT256x160x32_MI32x32x8x1_SE_AF0EM8_GRVW4_GSU1_SU0_SUS256_SRVW4_VAW2_WG128_2_1_WGM15
    SolutionIndex: 180
    SolutionNameMin: Cijk_Ailk_Bjlk_HBH_MT144x256x32_MI16x16x16x1_SE_AF0EM8_GRVW2_GSU1_SU0_SUS256_SRVW0_VAW2_WG16_16_1_WGM1
    SolutionIndex: 181
    SolutionNameMin: Cijk_Ailk_Bjlk_HBH_MT128x96x64_MI32x32x8x1_SE_AF0EM8_GRVW8_GSU1_SU0_SUS256_SRVW4_VAW2_WG128_2_1_WGM2
    SolutionIndex: 182
    SolutionNameMin: Cijk_Ailk_Bjlk_HBH_MT64x64x64_MI32x32x8x1_SE_AF0EM8_GRVW8_GSU1_SU32_SUS128_SRVW4_VAW2_WG64_4_1_WGM1
    SolutionIndex: 183
    SolutionNameMin: Cijk_Ailk_Bjlk_HBH_MT64x64x64_MI32x32x8x1_SE_AF0EM8_GRVW8_GSU1_SU0_SUS256_SRVW4_VAW2_WG64_4_1_WGM1
    SolutionIndex: 184
    SolutionNameMin: Cijk_Ailk_Bjlk_HBH_MT16x16x64_MI16x16x16x1_SE_AF0EM8_GRVW2_GSU1_SU0_SUS256_SRVW0_VAW2_WG16_4_1_WGM2
    SolutionIndex: 185
    SolutionNameMin: Cijk_Ailk_Bjlk_HBH_MT64x64x16_MI32x32x8x1_SE_AF0EM8_GRVW8_GSU1_SU0_SUS256_SRVW4_VAW2_WG64_4_1_WGM1
    SolutionIndex: 186
    SolutionNameMin: Cijk_Ailk_Bjlk_HBH_MT64x64x16_MI32x32x8x1_SE_AF0EM8_GRVW4_GSU1_SU0_SUS256_SRVW4_VAW2_WG64_4_1_WGM15
    SolutionIndex: 187
    SolutionNameMin: Cijk_Ailk_Bjlk_HBH_MT128x288x32_MI32x32x8x1_SE_AF0EM8_GRVW4_GSU1_SU0_SUS256_SRVW4_VAW2_WG128_2_1_WGM15
    SolutionIndex: 188
    SolutionNameMin: Cijk_Ailk_Bjlk_HBH_MT128x256x16_MI32x32x8x1_SE_AF0EM8_GRVW4_GSU1_SU0_SUS256_SRVW4_VAW2_WG64_4_1_WGM2
    SolutionIndex: 189
    SolutionNameMin: Cijk_Ailk_Bjlk_HBH_MT128x128x32_MI32x32x8x1_SE_AF0EM8_GRVW8_GSU1_SU32_SUS256_SRVW4_VAW2_WG64_4_1_WGM2
    SolutionIndex: 190
    SolutionNameMin: Cijk_Ailk_Bjlk_HBH_MT32x32x16_MI16x16x16x1_SE_AF0EM8_GRVW2_GSU1_SU0_SUS256_SRVW4_VAW2_WG32_8_1_WGM1
    SolutionIndex: 191
    SolutionNameMin: Cijk_Ailk_Bjlk_HBH_MT64x32x16_MI16x16x16x1_SE_AF0EM8_GRVW2_GSU1_SU0_SUS256_SRVW4_VAW2_WG32_8_1_WGM1
    SolutionIndex: 192
    SolutionNameMin: Cijk_Ailk_Bjlk_HBH_MT128x288x32_MI32x32x8x1_SE_AF0EM8_GRVW2_GSU1_SU0_SUS256_SRVW4_VAW2_WG128_2_1_WGM15
    SolutionIndex: 193
    SolutionNameMin: Cijk_Ailk_Bjlk_HBH_MT128x256x16_MI32x32x8x1_SE_AF0EM8_GRVW8_GSU1_SU0_SUS256_SRVW4_VAW2_WG64_4_1_WGM2
    SolutionIndex: 194
    SolutionNameMin: Cijk_Ailk_Bjlk_HBH_MT16x16x16_MI16x16x16x1_SE_AF0EM8_GRVW2_GSU1_SU0_SUS256_SRVW0_VAW2_WG16_4_1_WGM1
    SolutionIndex: 195
    SolutionNameMin: Cijk_Ailk_Bjlk_HBH_MT64x16x64_MI16x16x16x1_SE_AF0EM1_GRVW2_GSU15_SU0_SUS256_SRVW0_VAW1_WG64_4_1_WGM1
    SolutionIndex: 196
    SolutionNameMin: Cijk_Ailk_Bjlk_HBH_MT64x64x16_MI32x32x8x1_SE_AF0EM8_GRVW8_GSU1_SU0_SUS256_SRVW4_VAW2_WG64_4_1_WGM15
    SolutionIndex: 197
    SolutionNameMin: Cijk_Ailk_Bjlk_HBH_MT128x96x64_MI32x32x8x1_SE_AF0EM8_GRVW8_GSU1_SU32_SUS128_SRVW4_VAW2_WG128_2_1_WGM2
    SolutionIndex: 198
    SolutionNameMin: Cijk_Ailk_Bjlk_HBH_MT128x96x64_MI32x32x8x1_SE_AF0EM8_GRVW8_GSU1_SU32_SUS256_SRVW4_VAW2_WG128_2_1_WGM15
    SolutionIndex: 199
    SolutionNameMin: Cijk_Ailk_Bjlk_HBH_MT256x256x16_MI32x32x8x1_SE_AF0EM8_GRVW4_GSU1_SU0_SUS256_SRVW4_VAW2_WG64_4_1_WGM15
    SolutionIndex: 200
    SolutionNameMin: Cijk_Ailk_Bjlk_HBH_MT64x16x32_MI16x16x16x1_SE_AF0EM8_GRVW8_GSU15_SU32_SUS128_SRVW0_VAW1_WG64_4_1_WGM1
    SolutionIndex: 201
    SolutionNameMin: Cijk_Ailk_Bjlk_HBH_MT64x64x16_MI32x32x8x1_SE_AF0EM8_GRVW4_GSU1_SU0_SUS256_SRVW4_VAW2_WG64_4_1_WGM1
    SolutionIndex: 202
    SolutionNameMin: Cijk_Ailk_Bjlk_HBH_MT128x256x16_MI32x32x8x1_SE_AF0EM8_GRVW8_GSU1_SU0_SUS256_SRVW4_VAW2_WG64_4_1_WGM15
    SolutionIndex: 203
    SolutionNameMin: Cijk_Ailk_Bjlk_HBH_MT16x64x32_MI16x16x16x1_SE_AF0EM8_GRVW2_GSU1_SU0_SUS256_SRVW0_VAW2_WG16_16_1_WGM1
    SolutionIndex: 204
    SolutionNameMin: Cijk_Ailk_Bjlk_HBH_MT64x16x64_MI16x16x16x1_SE_AF0EM8_GRVW2_GSU15_SU0_SUS256_SRVW0_VAW1_WG64_4_1_WGM1
    SolutionIndex: 205
    SolutionNameMin: Cijk_Ailk_Bjlk_HBH_MT64x64x16_MI32x32x8x1_SE_AF0EM8_GRVW2_GSU1_SU0_SUS256_SRVW4_VAW2_WG64_4_1_WGM15
    SolutionIndex: 206
    SolutionNameMin: Cijk_Ailk_Bjlk_HBH_MT128x128x32_MI32x32x8x1_SE_AF0EM8_GRVW8_GSU1_SU32_SUS256_SRVW4_VAW2_WG64_4_1_WGM15
    SolutionIndex: 207
    SolutionNameMin: Cijk_Ailk_Bjlk_HBH_MT128x96x64_MI32x32x8x1_SE_AF0EM8_GRVW8_GSU1_SU32_SUS256_SRVW4_VAW2_WG128_2_1_WGM2
    SolutionIndex: 208
    SolutionNameMin: Cijk_Ailk_Bjlk_HBH_MT256x256x32_MI32x32x8x1_SE_AF0EM8_GRVW8_GSU1_SU0_SUS256_SRVW4_VAW2_WG64_4_1_WGM2
    SolutionIndex: 209
    SolutionNameMin: Cijk_Ailk_Bjlk_HBH_MT160x256x32_MI32x32x8x1_SE_AF0EM8_GRVW4_GSU1_SU0_SUS256_SRVW0_VAW2_WG32_8_1_WGM1
    SolutionIndex: 210
    SolutionNameMin: Cijk_Ailk_Bjlk_HBH_MT32x32x16_MI16x16x16x1_SE_AF0EM8_GRVW8_GSU1_SU0_SUS256_SRVW4_VAW2_WG32_8_1_WGM1
    SolutionIndex: 211
    SolutionNameMin: Cijk_Ailk_Bjlk_HBH_MT64x16x64_MI16x16x16x1_SE_AF0EM1_GRVW2_GSU15_SU0_SUS256_SRVW0_VAW1_WG64_4_1_WGM2
    SolutionIndex: 212
    SolutionNameMin: Cijk_Ailk_Bjlk_HBH_MT128x96x32_MI32x32x8x1_SE_AF0EM8_GRVW4_GSU1_SU0_SUS256_SRVW4_VAW2_WG128_2_1_WGM2
    SolutionIndex: 213
    SolutionNameMin: Cijk_Ailk_Bjlk_HBH_MT64x16x32_MI16x16x16x1_SE_AF0EM1_GRVW8_GSU15_SU0_SUS256_SRVW0_VAW1_WG64_4_1_WGM1
    SolutionIndex: 214
    SolutionNameMin: Cijk_Ailk_Bjlk_HBH_MT64x64x16_MI32x32x8x1_SE_AF0EM8_GRVW2_GSU1_SU0_SUS256_SRVW4_VAW2_WG64_4_1_WGM1
    SolutionIndex: 215
    SolutionNameMin: Cijk_Ailk_Bjlk_HBH_MT128x256x16_MI32x32x8x1_SE_AF0EM8_GRVW8_GSU1_SU32_SUS128_SRVW4_VAW2_WG64_4_1_WGM15
    SolutionIndex: 216
    SolutionNameMin: Cijk_Ailk_Bjlk_HBH_MT64x128x32_MI32x32x8x1_SE_AF0EM8_GRVW8_GSU1_SU32_SUS128_SRVW4_VAW2_WG64_4_1_WGM15
    SolutionIndex: 217
    SolutionNameMin: Cijk_Ailk_Bjlk_HBH_MT32x32x16_MI16x16x16x1_SE_AF0EM8_GRVW2_GSU1_SU0_SUS256_SRVW4_VAW2_WG32_8_1_WGM2
    SolutionIndex: 218
    SolutionNameMin: Cijk_Ailk_Bjlk_HBH_MT64x16x32_MI16x16x16x1_SE_AF0EM8_GRVW2_GSU15_SU0_SUS256_SRVW0_VAW1_WG64_4_1_WGM1
    SolutionIndex: 219
    SolutionNameMin: Cijk_Ailk_Bjlk_HBH_MT128x64x32_MI32x32x8x1_SE_AF0EM8_GRVW8_GSU1_SU0_SUS256_SRVW4_VAW2_WG64_4_1_WGM15
    SolutionIndex: 220
    SolutionNameMin: Cijk_Ailk_Bjlk_HBH_MT128x288x32_MI32x32x8x1_SE_AF0EM8_GRVW2_GSU1_SU0_SUS256_SRVW4_VAW2_WG128_2_1_WGM15
    SolutionIndex: 221
    SolutionNameMin: Cijk_Ailk_Bjlk_HBH_MT128x256x16_MI32x32x8x1_SE_AF0EM8_GRVW4_GSU1_SU32_SUS256_SRVW4_VAW2_WG64_4_1_WGM2
    SolutionIndex: 222
    SolutionNameMin: Cijk_Ailk_Bjlk_HBH_MT64x64x32_MI32x32x8x1_SE_AF0EM8_GRVW8_GSU1_SU32_SUS128_SRVW4_VAW2_WG64_4_1_WGM1
    SolutionIndex: 223
    SolutionNameMin: Cijk_Ailk_Bjlk_HBH_MT64x16x32_MI16x16x16x1_SE_AF0EM1_GRVW8_GSU15_SU0_SUS256_SRVW0_VAW1_WG64_4_1_WGM2
    SolutionIndex: 224
    SolutionNameMin: Cijk_Ailk_Bjlk_HBH_MT128x96x64_MI32x32x8x1_SE_AF0EM8_GRVW8_GSU1_SU0_SUS256_SRVW4_VAW2_WG128_2_1_WGM15
    SolutionIndex: 225
    SolutionNameMin: Cijk_Ailk_Bjlk_HBH_MT128x256x16_MI32x32x8x1_SE_AF0EM8_GRVW8_GSU1_SU32_SUS128_SRVW4_VAW2_WG64_4_1_WGM15
    SolutionIndex: 226
    SolutionNameMin: Cijk_Ailk_Bjlk_HBH_MT128x128x64_MI32x32x8x1_SE_AF0EM8_GRVW8_GSU15_SU32_SUS256_SRVW0_VAW1_WG64_4_1_WGM2
    SolutionIndex: 227
    SolutionNameMin: Cijk_Ailk_Bjlk_HBH_MT128x256x32_MI32x32x8x1_SE_AF0EM8_GRVW8_GSU3_SU0_SUS256_SRVW0_VAW1_WG64_4_1_WGM15
    SolutionIndex: 228
    SolutionNameMin: Cijk_Ailk_Bjlk_HBH_MT64x64x16_MI32x32x8x1_SE_AF0EM8_GRVW2_GSU1_SU32_SUS128_SRVW4_VAW2_WG64_4_1_WGM2
    SolutionIndex: 229
    SolutionNameMin: Cijk_Ailk_Bjlk_HBH_MT64x16x32_MI16x16x16x1_SE_AF0EM8_GRVW2_GSU1_SU0_SUS256_SRVW0_VAW2_WG64_4_1_WGM1
    SolutionIndex: 230
    SolutionNameMin: Cijk_Ailk_Bjlk_HBH_MT64x64x32_MI32x32x8x1_SE_AF0EM8_GRVW8_GSU1_SU0_SUS256_SRVW4_VAW2_WG64_4_1_WGM15
    SolutionIndex: 231
    SolutionNameMin: Cijk_Ailk_Bjlk_HBH_MT256x256x32_MI32x32x8x1_SE_AF0EM8_GRVW8_GSU1_SU32_SUS256_SRVW4_VAW2_WG64_4_1_WGM1
    SolutionIndex: 232
    SolutionNameMin: Cijk_Ailk_Bjlk_HBH_MT160x256x32_MI32x32x8x1_SE_AF0EM8_GRVW4_GSU1_SU32_SUS128_SRVW0_VAW2_WG32_8_1_WGM1
    SolutionIndex: 233
    SolutionNameMin: Cijk_Ailk_Bjlk_HBH_MT128x96x64_MI32x32x8x1_SE_AF0EM8_GRVW8_GSU1_SU32_SUS128_SRVW4_VAW2_WG128_2_1_WGM15
    SolutionIndex: 234
    SolutionNameMin: Cijk_Ailk_Bjlk_HBH_MT160x256x32_MI32x32x8x1_SE_AF0EM8_GRVW4_GSU1_SU32_SUS256_SRVW0_VAW2_WG32_8_1_WGM2
    SolutionIndex: 235
    SolutionNameMin: Cijk_Ailk_Bjlk_HBH_MT32x64x16_MI16x16x16x1_SE_AF0EM8_GRVW4_GSU1_SU32_SUS128_SRVW4_VAW2_WG32_8_1_WGM2
    SolutionIndex: 236
    SolutionNameMin: Cijk_Ailk_Bjlk_HBH_MT64x32x16_MI16x16x16x1_SE_AF0EM8_GRVW2_GSU1_SU32_SUS128_SRVW4_VAW2_WG32_8_1_WGM15
    SolutionIndex: 237
    SolutionNameMin: Cijk_Ailk_Bjlk_HBH_MT64x32x16_MI16x16x16x1_SE_AF0EM8_GRVW2_GSU1_SU32_SUS256_SRVW4_VAW2_WG32_8_1_WGM15
    SolutionIndex: 238
    SolutionNameMin: Cijk_Ailk_Bjlk_HBH_MT64x64x16_MI32x32x8x1_SE_AF0EM8_GRVW2_GSU1_SU32_SUS256_SRVW4_VAW2_WG64_4_1_WGM2
    SolutionIndex: 239
    SolutionNameMin: Cijk_Ailk_Bjlk_HBH_MT32x32x64_MI16x16x16x1_SE_AF0EM8_GRVW4_GSU1_SU0_SUS256_SRVW4_VAW2_WG32_8_1_WGM1
    SolutionIndex: 240
    SolutionNameMin: Cijk_Ailk_Bjlk_HBH_MT32x32x64_MI16x16x16x1_SE_AF0EM8_GRVW8_GSU1_SU0_SUS256_SRVW4_VAW2_WG32_8_1_WGM1
    SolutionIndex: 241
    SolutionNameMin: Cijk_Ailk_Bjlk_HBH_MT32x32x64_MI16x16x16x1_SE_AF0EM8_GRVW8_GSU1_SU0_SUS256_SRVW4_VAW2_WG32_8_1_WGM15
    SolutionIndex: 242
    SolutionNameMin: Cijk_Ailk_Bjlk_HBH_MT256x144x32_MI16x16x16x1_SE_AF0EM8_GRVW2_GSU1_SU0_SUS256_SRVW4_VAW2_WG64_4_1_WGM15
    SolutionIndex: 243
    SolutionNameMin: Cijk_Ailk_Bjlk_HBH_MT128x128x64_MI32x32x8x1_SE_AF0EM8_GRVW4_GSU1_SU32_SUS128_SRVW4_VAW2_WG64_4_1_WGM15
    SolutionIndex: 244
    SolutionNameMin: Cijk_Ailk_Bjlk_HBH_MT64x128x64_MI32x32x8x1_SE_AF0EM8_GRVW8_GSU1_SU32_SUS256_SRVW4_VAW2_WG64_4_1_WGM15
    SolutionIndex: 245
    SolutionNameMin: Cijk_Ailk_Bjlk_HBH_MT64x64x64_MI32x32x8x1_SE_AF0EM8_GRVW8_GSU1_SU32_SUS128_SRVW4_VAW2_WG64_4_1_WGM15
    SolutionIndex: 246
    SolutionNameMin: Cijk_Ailk_Bjlk_HBH_MT128x128x64_MI32x32x8x1_SE_AF0EM8_GRVW8_GSU3_SU0_SUS256_SRVW0_VAW1_WG64_4_1_WGM2
    SolutionIndex: 247
    SolutionNameMin: Cijk_Ailk_Bjlk_HBH_MT128x128x64_MI32x32x8x1_SE_AF0EM8_GRVW8_GSU1_SU0_SUS256_SRVW4_VAW2_WG64_4_1_WGM2
    SolutionIndex: 248
    SolutionNameMin: Cijk_Ailk_Bjlk_HBH_MT128x160x32_MI32x32x8x1_SE_AF0EM8_GRVW4_GSU1_SU0_SUS256_SRVW4_VAW2_WG128_2_1_WGM2
    SolutionIndex: 249
    SolutionNameMin: Cijk_Ailk_Bjlk_HBH_MT128x256x32_MI32x32x8x1_SE_AF0EM8_GRVW4_GSU1_SU0_SUS256_SRVW4_VAW2_WG64_4_1_WGM1
    SolutionIndex: 250
    SolutionNameMin: Cijk_Ailk_Bjlk_HBH_MT128x256x32_MI32x32x8x1_SE_AF0EM8_GRVW8_GSU1_SU0_SUS256_SRVW4_VAW2_WG64_4_1_WGM15
    SolutionIndex: 251
    SolutionNameMin: Cijk_Ailk_Bjlk_HBH_MT128x256x32_MI32x32x8x1_SE_AF0EM8_GRVW8_GSU1_SU32_SUS256_SRVW4_VAW2_WG64_4_1_WGM2
    SolutionIndex: 252
    SolutionNameMin: Cijk_Ailk_Bjlk_HBH_MT256x128x32_MI32x32x8x1_SE_AF0EM8_GRVW8_GSU1_SU32_SUS256_SRVW4_VAW2_WG64_4_1_WGM15
    SolutionIndex: 253
    SolutionNameMin: Cijk_Ailk_Bjlk_HBH_MT256x128x32_MI32x32x8x1_SE_AF0EM8_GRVW8_GSU1_SU32_SUS256_SRVW4_VAW2_WG64_4_1_WGM2
    SolutionIndex: 254
    SolutionNameMin: Cijk_Ailk_Bjlk_HBH_MT256x160x32_MI32x32x8x1_SE_AF0EM8_GRVW4_GSU1_SU0_SUS256_SRVW4_VAW2_WG128_2_1_WGM2
    SolutionIndex: 255
    SolutionNameMin: Cijk_Ailk_Bjlk_HBH_MT128x128x32_MI32x32x8x1_SE_AF0EM8_GRVW8_GSU1_SU0_SUS256_SRVW4_VAW2_WG64_4_1_WGM15
    SolutionIndex: 256
    SolutionNameMin: Cijk_Ailk_Bjlk_HBH_MT128x128x32_MI32x32x8x1_SE_AF0EM8_GRVW8_GSU1_SU0_SUS256_SRVW4_VAW2_WG64_4_1_WGM2
    SolutionIndex: 257
    SolutionNameMin: Cijk_Ailk_Bjlk_HBH_MT128x256x32_MI32x32x8x1_SE_AF0EM8_GRVW8_GSU7_SU0_SUS256_SRVW0_VAW1_WG64_4_1_WGM2
    SolutionIndex: 258
    SolutionNameMin: Cijk_Ailk_Bjlk_HBH_MT64x32x32_MI16x16x16x1_SE_AF0EM8_GRVW2_GSU1_SU0_SUS256_SRVW4_VAW2_WG32_8_1_WGM1
    SolutionIndex: 259
    SolutionNameMin: Cijk_Ailk_Bjlk_HBH_MT64x64x32_MI32x32x8x1_SE_AF0EM8_GRVW4_GSU1_SU0_SUS256_SRVW4_VAW2_WG64_4_1_WGM15
    SolutionIndex: 260
    SolutionNameMin: Cijk_Ailk_Bjlk_HBH_MT128x128x32_MI32x32x8x1_SE_AF0EM8_GRVW8_GSU1_SU32_SUS128_SRVW4_VAW2_WG64_4_1_WGM1
    SolutionIndex: 261
    SolutionNameMin: Cijk_Ailk_Bjlk_HBH_MT64x64x64_MI32x32x8x1_SE_AF0EM8_GRVW8_GSU1_SU0_SUS256_SRVW4_VAW2_WG64_4_1_WGM2
    SolutionIndex: 262
    SolutionNameMin: Cijk_Ailk_Bjlk_HBH_MT96x96x64_MI16x16x16x1_SE_AF0EM8_GRVW8_GSU3_SU0_SUS256_SRVW0_VAW1_WG32_8_1_WGM1
    SolutionIndex: 263
    SolutionNameMin: Cijk_Ailk_Bjlk_HBH_MT96x96x64_MI16x16x16x1_SE_AF0EM8_GRVW8_GSU3_SU32_SUS256_SRVW0_VAW1_WG32_8_1_WGM1
    SolutionIndex: 264
    SolutionNameMin: Cijk_Ailk_Bjlk_HBH_MT96x96x64_MI16x16x16x1_SE_AF0EM8_GRVW8_GSU3_SU0_SUS256_SRVW0_VAW1_WG32_8_1_WGM2
    SolutionIndex: 265
    SolutionNameMin: Cijk_Ailk_Bjlk_HBH_MT128x128x64_MI32x32x8x1_SE_AF0EM8_GRVW4_GSU7_SU32_SUS128_SRVW0_VAW1_WG64_4_1_WGM1
    SolutionIndex: 266
    SolutionNameMin: Cijk_Ailk_Bjlk_HBH_MT128x128x64_MI32x32x8x1_SE_AF0EM8_GRVW2_GSU7_SU32_SUS128_SRVW0_VAW1_WG64_4_1_WGM1
    SolutionIndex: 267
    SolutionNameMin: Cijk_Ailk_Bjlk_HBH_MT128x128x64_MI32x32x8x1_SE_AF0EM8_GRVW2_GSU7_SU0_SUS256_SRVW0_VAW1_WG64_4_1_WGM1
    SolutionIndex: 268
    SolutionNameMin: Cijk_Ailk_Bjlk_HBH_MT128x128x64_MI32x32x8x1_SE_AF0EM8_GRVW2_GSU7_SU32_SUS128_SRVW0_VAW1_WG64_4_1_WGM2
    SolutionIndex: 269
    SolutionNameMin: Cijk_Ailk_Bjlk_HBH_MT128x128x64_MI32x32x8x1_SE_AF0EM8_GRVW8_GSU1_SU32_SUS256_SRVW4_VAW2_WG64_4_1_WGM1
    SolutionIndex: 270
    SolutionNameMin: Cijk_Ailk_Bjlk_HBH_MT64x128x64_MI32x32x8x1_SE_AF0EM8_GRVW8_GSU1_SU32_SUS256_SRVW4_VAW2_WG64_4_1_WGM1
    SolutionIndex: 271
    SolutionNameMin: Cijk_Ailk_Bjlk_HBH_MT64x64x16_MI32x32x8x1_SE_AF0EM8_GRVW8_GSU1_SU0_SUS256_SRVW4_VAW2_WG64_4_1_WGM2
    SolutionIndex: 272
    SolutionNameMin: Cijk_Ailk_Bjlk_HBH_MT128x256x32_MI32x32x8x1_SE_AF0EM8_GRVW8_GSU1_SU32_SUS256_SRVW4_VAW2_WG64_4_1_WGM15
    SolutionIndex: 273
    SolutionNameMin: Cijk_Ailk_Bjlk_HBH_MT256x128x32_MI32x32x8x1_SE_AF0EM8_GRVW4_GSU1_SU32_SUS128_SRVW4_VAW2_WG64_4_1_WGM2
    SolutionIndex: 274
    SolutionNameMin: Cijk_Ailk_Bjlk_HBH_MT16x16x16_MI16x16x16x1_SE_AF0EM8_GRVW2_GSU1_SU32_SUS256_SRVW0_VAW2_WG16_4_1_WGM1
    SolutionIndex: 275
    SolutionNameMin: Cijk_Ailk_Bjlk_HBH_MT256x256x16_MI32x32x8x1_SE_AF0EM8_GRVW8_GSU1_SU0_SUS256_SRVW4_VAW2_WG64_4_1_WGM15
    SolutionIndex: 276
    SolutionNameMin: Cijk_Ailk_Bjlk_HBH_MT128x256x16_MI32x32x8x1_SE_AF0EM8_GRVW8_GSU1_SU32_SUS256_SRVW4_VAW2_WG64_4_1_WGM2
    SolutionIndex: 277
    SolutionNameMin: Cijk_Ailk_Bjlk_HBH_MT128x64x16_MI32x32x8x1_SE_AF0EM8_GRVW2_GSU1_SU0_SUS256_SRVW4_VAW2_WG64_4_1_WGM1
    SolutionIndex: 278
    SolutionNameMin: Cijk_Ailk_Bjlk_HBH_MT256x256x16_MI32x32x8x1_SE_AF0EM8_GRVW8_GSU1_SU0_SUS256_SRVW4_VAW2_WG64_4_1_WGM1
    SolutionIndex: 279
    SolutionNameMin: Cijk_Ailk_Bjlk_HBH_MT64x128x32_MI32x32x8x1_SE_AF0EM8_GRVW8_GSU1_SU0_SUS256_SRVW4_VAW2_WG64_4_1_WGM1
    SolutionIndex: 280
    SolutionNameMin: Cijk_Ailk_Bjlk_HBH_MT256x256x16_MI32x32x8x1_SE_AF0EM8_GRVW4_GSU1_SU32_SUS128_SRVW4_VAW2_WG64_4_1_WGM1
    SolutionIndex: 281
    SolutionNameMin: Cijk_Ailk_Bjlk_HBH_MT64x64x16_MI32x32x8x1_SE_AF0EM8_GRVW4_GSU1_SU32_SUS256_SRVW4_VAW2_WG64_4_1_WGM15
    SolutionIndex: 282
    SolutionNameMin: Cijk_Ailk_Bjlk_HBH_MT128x160x32_MI32x32x8x1_SE_AF0EM8_GRVW4_GSU1_SU0_SUS256_SRVW4_VAW2_WG128_2_1_WGM1
    SolutionIndex: 283
    SolutionNameMin: Cijk_Ailk_Bjlk_HBH_MT256x256x16_MI32x32x8x1_SE_AF0EM8_GRVW8_GSU1_SU0_SUS256_SRVW4_VAW2_WG64_4_1_WGM1
    SolutionIndex: 284
    SolutionNameMin: Cijk_Ailk_Bjlk_HBH_MT128x96x64_MI32x32x8x1_SE_AF0EM8_GRVW8_GSU1_SU0_SUS256_SRVW4_VAW2_WG128_2_1_WGM1
    SolutionIndex: 285
    SolutionNameMin: Cijk_Ailk_Bjlk_HBH_MT256x256x32_MI32x32x8x1_SE_AF0EM8_GRVW8_GSU1_SU32_SUS128_SRVW4_VAW2_WG64_4_1_WGM15
    SolutionIndex: 286
    SolutionNameMin: Cijk_Ailk_Bjlk_HBH_MT128x128x32_MI32x32x8x1_SE_AF0EM8_GRVW8_GSU1_SU0_SUS256_SRVW4_VAW2_WG64_4_1_WGM1
    SolutionIndex: 287
    SolutionNameMin: Cijk_Ailk_Bjlk_HBH_MT128x256x16_MI32x32x8x1_SE_AF0EM8_GRVW8_GSU1_SU0_SUS256_SRVW4_VAW2_WG64_4_1_WGM1
    SolutionIndex: 288
    SolutionNameMin: Cijk_Ailk_Bjlk_HBH_MT128x64x32_MI32x32x8x1_SE_AF0EM8_GRVW8_GSU1_SU0_SUS256_SRVW4_VAW2_WG64_4_1_WGM1
    SolutionIndex: 289
    SolutionNameMin: Cijk_Ailk_Bjlk_HBH_MT64x16x32_MI16x16x16x1_SE_AF0EM8_GRVW4_GSU1_SU0_SUS256_SRVW0_VAW2_WG64_4_1_WGM1
    SolutionIndex: 290
    SolutionNameMin: Cijk_Ailk_Bjlk_HBH_MT256x256x32_MI32x32x8x1_SE_AF0EM8_GRVW8_GSU1_SU32_SUS256_SRVW4_VAW2_WG64_4_1_WGM2
    SolutionIndex: 291
    SolutionNameMin: Cijk_Ailk_Bjlk_HBH_MT128x64x16_MI32x32x8x1_SE_AF0EM8_GRVW2_GSU1_SU32_SUS256_SRVW4_VAW2_WG64_4_1_WGM15
    SolutionIndex: 292
    SolutionNameMin: Cijk_Ailk_Bjlk_HBH_MT128x64x64_MI32x32x8x1_SE_AF0EM8_GRVW8_GSU1_SU32_SUS128_SRVW4_VAW2_WG64_4_1_WGM15
    SolutionIndex: 293
    SolutionNameMin: Cijk_Ailk_Bjlk_HBH_MT64x32x64_MI16x16x16x1_SE_AF0EM8_GRVW8_GSU7_SU32_SUS256_SRVW0_VAW1_WG32_8_1_WGM1
    SolutionIndex: 294
    SolutionNameMin: Cijk_Ailk_Bjlk_HBH_MT64x64x64_MI32x32x8x1_SE_AF0EM8_GRVW8_GSU15_SU32_SUS128_SRVW0_VAW1_WG64_4_1_WGM15
    SolutionIndex: 295
    SolutionNameMin: Cijk_Ailk_Bjlk_HBH_MT64x32x16_MI16x16x16x1_SE_AF0EM8_GRVW2_GSU1_SU0_SUS256_SRVW4_VAW2_WG32_8_1_WGM1
    SolutionIndex: 296
    SolutionNameMin: Cijk_Ailk_Bjlk_HBH_MT96x128x64_MI32x32x8x1_SE_AF0EM8_GRVW2_GSU3_SU32_SUS128_SRVW0_VAW1_WG32_8_1_WGM2
    SolutionIndex: 297
    SolutionNameMin: Cijk_Ailk_Bjlk_HBH_MT128x64x32_MI32x32x8x1_SE_AF0EM8_GRVW8_GSU1_SU32_SUS128_SRVW4_VAW2_WG64_4_1_WGM1
    SolutionIndex: 298
    SolutionNameMin: Cijk_Ailk_Bjlk_HBH_MT96x96x64_MI16x16x16x1_SE_AF0EM8_GRVW8_GSU5_SU32_SUS256_SRVW0_VAW1_WG32_8_1_WGM2
    SolutionIndex: 299
    SolutionNameMin: Cijk_Ailk_Bjlk_HBH_MT128x64x64_MI32x32x8x1_SE_AF0EM8_GRVW8_GSU7_SU0_SUS256_SRVW0_VAW1_WG64_4_1_WGM2
    SolutionIndex: 300
    SolutionNameMin: Cijk_Ailk_Bjlk_HBH_MT32x32x64_MI16x16x16x1_SE_AF0EM8_GRVW4_GSU1_SU0_SUS256_SRVW4_VAW2_WG32_8_1_WGM15
    SolutionIndex: 301
    SolutionNameMin: Cijk_Ailk_Bjlk_HBH_MT256x256x16_MI32x32x8x1_SE_AF0EM8_GRVW8_GSU1_SU32_SUS128_SRVW4_VAW2_WG64_4_1_WGM2
    SolutionIndex: 302
    SolutionNameMin: Cijk_Ailk_Bjlk_HBH_MT256x256x16_MI32x32x8x1_SE_AF0EM8_GRVW8_GSU1_SU0_SUS256_SRVW4_VAW2_WG64_4_1_WGM15
    SolutionIndex: 303
    SolutionNameMin: Cijk_Ailk_Bjlk_HBH_MT16x16x16_MI16x16x16x1_SE_AF0EM8_GRVW2_GSU1_SU0_SUS256_SRVW0_VAW2_WG16_4_1_WGM15
    SolutionIndex: 304
    SolutionNameMin: Cijk_Ailk_Bjlk_HBH_MT64x64x16_MI32x32x8x1_SE_AF0EM8_GRVW4_GSU1_SU0_SUS256_SRVW4_VAW2_WG64_4_1_WGM2
    SolutionIndex: 305
    SolutionNameMin: Cijk_Ailk_Bjlk_HBH_MT16x16x16_MI16x16x16x1_SE_AF0EM8_GRVW2_GSU1_SU0_SUS256_SRVW0_VAW2_WG16_4_1_WGM2
    SolutionIndex: 306
    SolutionNameMin: Cijk_Ailk_Bjlk_HBH_MT64x128x16_MI32x32x8x1_SE_AF0EM8_GRVW2_GSU1_SU32_SUS256_SRVW4_VAW2_WG64_4_1_WGM15
    SolutionIndex: 307
    SolutionNameMin: Cijk_Ailk_Bjlk_HBH_MT256x256x16_MI32x32x8x1_SE_AF0EM8_GRVW4_GSU1_SU32_SUS128_SRVW4_VAW2_WG64_4_1_WGM2
    SolutionIndex: 308
    SolutionNameMin: Cijk_Ailk_Bjlk_HBH_MT32x32x16_MI16x16x16x1_SE_AF0EM8_GRVW4_GSU1_SU0_SUS256_SRVW4_VAW2_WG32_8_1_WGM1
    SolutionIndex: 309
    SolutionNameMin: Cijk_Ailk_Bjlk_HBH_MT16x64x64_MI16x16x16x1_SE_AF0EM1_GRVW8_GSU15_SU0_SUS256_SRVW0_VAW1_WG16_16_1_WGM1
    SolutionIndex: 310
    SolutionNameMin: Cijk_Ailk_Bjlk_HBH_MT16x16x16_MI16x16x16x1_SE_AF0EM1_GRVW2_GSU1_SU0_SUS256_SRVW4_VAW2_WG16_4_1_WGM1
    SolutionIndex: 311
    SolutionNameMin: Cijk_Ailk_Bjlk_HBH_MT16x16x16_MI16x16x16x1_SE_AF0EM1_GRVW2_GSU1_SU32_SUS128_SRVW4_VAW2_WG16_4_1_WGM1
    SolutionIndex: 312
    SolutionNameMin: Cijk_Ailk_Bjlk_HBH_MT32x64x16_MI16x16x16x1_SE_AF0EM1_GRVW8_GSU1_SU32_SUS256_SRVW4_VAW2_WG32_8_1_WGM2
    SolutionIndex: 313
    SolutionNameMin: Cijk_Ailk_Bjlk_HBH_MT32x64x16_MI16x16x16x1_SE_AF0EM1_GRVW4_GSU1_SU32_SUS256_SRVW4_VAW2_WG32_8_1_WGM2
    SolutionIndex: 314
    SolutionNameMin: Cijk_Ailk_Bjlk_HBH_MT32x64x16_MI16x16x16x1_SE_AF0EM1_GRVW2_GSU1_SU32_SUS128_SRVW4_VAW2_WG32_8_1_WGM2
    SolutionIndex: 315
    SolutionNameMin: Cijk_Ailk_Bjlk_HBH_MT32x32x16_MI16x16x16x1_SE_AF0EM1_GRVW2_GSU1_SU32_SUS128_SRVW4_VAW2_WG32_8_1_WGM1
    SolutionIndex: 316
    SolutionNameMin: Cijk_Ailk_Bjlk_HBH_MT64x64x16_MI32x32x8x1_SE_AF0EM1_GRVW2_GSU1_SU32_SUS128_SRVW4_VAW2_WG64_4_1_WGM2
    SolutionIndex: 317
    SolutionNameMin: Cijk_Ailk_Bjlk_HBH_MT32x32x64_MI16x16x16x1_SE_AF0EM1_GRVW2_GSU1_SU32_SUS128_SRVW4_VAW2_WG32_8_1_WGM1
    SolutionIndex: 318
    SolutionNameMin: Cijk_Ailk_Bjlk_HBH_MT16x16x16_MI16x16x16x1_SE_AF0EM1_GRVW4_GSU1_SU0_SUS256_SRVW0_VAW2_WG16_4_1_WGM1
    SolutionIndex: 319
    SolutionNameMin: Cijk_Ailk_Bjlk_HBH_MT32x32x16_MI16x16x16x1_SE_AF0EM1_GRVW2_GSU1_SU0_SUS256_SRVW4_VAW2_WG32_8_1_WGM1
    SolutionIndex: 320
    SolutionNameMin: Cijk_Ailk_Bjlk_HBH_MT16x16x16_MI16x16x16x1_SE_AF0EM1_GRVW2_GSU1_SU0_SUS256_SRVW0_VAW2_WG16_4_1_WGM1
    SolutionIndex: 321
    SolutionNameMin: Cijk_Ailk_Bjlk_HBH_MT16x16x16_MI16x16x16x1_SE_AF0EM1_GRVW4_GSU1_SU32_SUS128_SRVW0_VAW2_WG16_4_1_WGM1
    SolutionIndex: 322
    SolutionNameMin: Cijk_Ailk_Bjlk_HBH_MT32x64x16_MI16x16x16x1_SE_AF0EM1_GRVW2_GSU1_SU32_SUS256_SRVW4_VAW2_WG32_8_1_WGM2
    SolutionIndex: 323
    SolutionNameMin: Cijk_Ailk_Bjlk_HBH_MT64x32x16_MI16x16x16x1_SE_AF0EM1_GRVW2_GSU1_SU0_SUS256_SRVW4_VAW2_WG32_8_1_WGM1
    SolutionIndex: 324
    SolutionNameMin: Cijk_Ailk_Bjlk_HBH_MT64x32x16_MI16x16x16x1_SE_AF0EM1_GRVW4_GSU1_SU32_SUS128_SRVW4_VAW2_WG32_8_1_WGM1
    SolutionIndex: 325
    SolutionNameMin: Cijk_Ailk_Bjlk_HBH_MT32x32x64_MI16x16x16x1_SE_AF0EM1_GRVW2_GSU1_SU0_SUS256_SRVW4_VAW2_WG32_8_1_WGM2
    SolutionIndex: 326
    SolutionNameMin: Cijk_Ailk_Bjlk_HBH_MT32x32x64_MI16x16x16x1_SE_AF0EM1_GRVW4_GSU1_SU0_SUS256_SRVW4_VAW2_WG32_8_1_WGM1
    SolutionIndex: 327
    SolutionNameMin: Cijk_Ailk_Bjlk_HBH_MT64x64x64_MI32x32x8x1_SE_AF0EM1_GRVW4_GSU1_SU32_SUS128_SRVW4_VAW2_WG64_4_1_WGM2
    SolutionIndex: 328
    SolutionNameMin: Cijk_Ailk_Bjlk_HBH_MT96x128x64_MI32x32x8x1_SE_AF0EM1_GRVW4_GSU1_SU32_SUS256_SRVW0_VAW2_WG32_8_1_WGM15
    SolutionIndex: 329
    SolutionNameMin: Cijk_Ailk_Bjlk_HBH_MT16x64x64_MI16x16x16x1_SE_AF0EM1_GRVW8_GSU15_SU0_SUS256_SRVW0_VAW1_WG16_16_1_WGM15
    SolutionIndex: 330
    SolutionNameMin: Cijk_Ailk_Bjlk_HBH_MT16x64x64_MI16x16x16x1_SE_AF0EM1_GRVW8_GSU15_SU0_SUS256_SRVW0_VAW1_WG16_16_1_WGM2
    SolutionIndex: 331
    SolutionNameMin: Cijk_Ailk_Bjlk_HBH_MT16x16x32_MI16x16x16x1_SE_AF0EM1_GRVW2_GSU1_SU0_SUS256_SRVW0_VAW2_WG16_4_1_WGM2
    SolutionIndex: 332
    SolutionNameMin: Cijk_Ailk_Bjlk_HBH_MT64x64x16_MI32x32x8x1_SE_1LDSB0_GRVW8_NLCA1_NLCB1_SU32_SUS256_SRVW4_TT1_32_WG64_4_1_WGM2
    SolutionIndex: 333
    SolutionNameMin: Cijk_Ailk_Bjlk_HBH_MT128x128x32_MI32x32x8x1_SE_1LDSB0_GRVW8_NLCA1_NLCB1_SU0_SUS256_SRVW4_TT2_64_WG64_4_1_WGM1
    SolutionIndex: 334
    SolutionNameMin: Cijk_Ailk_Bjlk_HBH_MT128x256x16_MI32x32x8x1_SE_1LDSB1_GRVW8_NLCA1_NLCB1_SU0_SUS256_SRVW4_TT2_128_WG64_4_1_WGM2
    SolutionIndex: 335
    SolutionNameMin: Cijk_Ailk_Bjlk_HBH_MT128x256x32_MI32x32x8x1_SE_1LDSB1_GRVW2_NLCA1_NLCB2_SU0_SUS256_SRVW4_TT2_128_WG64_4_1_WGM1
    SolutionIndex: 336
    SolutionNameMin: Cijk_Ailk_Bjlk_HBH_MT128x256x16_MI32x32x8x1_SE_1LDSB0_GRVW8_NLCA1_NLCB1_SU0_SUS256_SRVW4_TT2_128_WG64_4_1_WGM2
    SolutionIndex: 337
    SolutionNameMin: Cijk_Ailk_Bjlk_HBH_MT64x64x32_MI32x32x8x1_SE_1LDSB0_GRVW4_NLCA1_NLCB1_SU0_SUS256_SRVW4_TT1_32_WG64_4_1_WGM1
    SolutionIndex: 338
    SolutionNameMin: Cijk_Ailk_Bjlk_HBH_MT128x256x32_MI32x32x8x1_SE_1LDSB1_GRVW2_NLCA1_NLCB2_SU0_SUS256_SRVW4_TT2_128_WG64_4_1_WGM2
    SolutionIndex: 339
    SolutionNameMin: Cijk_Ailk_Bjlk_HBH_MT128x256x16_MI32x32x8x1_SE_1LDSB1_GRVW8_NLCA1_NLCB1_SU0_SUS256_SRVW4_TT2_128_WG64_4_1_WGM1
    SolutionIndex: 340
    SolutionNameMin: Cijk_Ailk_Bjlk_HBH_MT64x64x32_MI32x32x8x1_SE_1LDSB0_GRVW8_NLCA1_NLCB1_SU0_SUS256_SRVW4_TT1_32_WG64_4_1_WGM1
    SolutionIndex: 341
    SolutionNameMin: Cijk_Ailk_Bjlk_HBH_MT128x128x16_MI32x32x8x1_SE_1LDSB0_GRVW8_NLCA1_NLCB1_SU0_SUS256_SRVW4_TT2_64_WG64_4_1_WGM1
    SolutionIndex: 342
    SolutionNameMin: Cijk_Ailk_Bjlk_HBH_MT128x128x32_MI32x32x8x1_SE_1LDSB0_GRVW8_NLCA1_NLCB1_SU32_SUS256_SRVW4_TT2_64_WG64_4_1_WGM1
    SolutionIndex: 343
    SolutionNameMin: Cijk_Ailk_Bjlk_HBH_MT64x128x16_MI32x32x8x1_SE_1LDSB0_GRVW2_NLCA1_NLCB1_SU32_SUS256_SRVW4_TT1_64_WG64_4_1_WGM2
    SolutionIndex: 344
    SolutionNameMin: Cijk_Ailk_Bjlk_HBH_MT64x128x32_MI32x32x8x1_SE_1LDSB0_GRVW8_NLCA1_NLCB1_SU32_SUS128_SRVW4_TT1_64_WG64_4_1_WGM1
    SolutionIndex: 345
    SolutionNameMin: Cijk_Ailk_Bjlk_HBH_MT64x128x16_MI32x32x8x1_SE_1LDSB0_GRVW4_NLCA1_NLCB1_SU0_SUS256_SRVW4_TT1_64_WG64_4_1_WGM1
    SolutionIndex: 346
    SolutionNameMin: Cijk_Ailk_Bjlk_HBH_MT64x128x32_MI32x32x8x1_SE_1LDSB0_GRVW8_NLCA1_NLCB1_SU0_SUS256_SRVW4_TT1_64_WG64_4_1_WGM15
    SolutionIndex: 347
    SolutionNameMin: Cijk_Ailk_Bjlk_HBH_MT64x128x32_MI32x32x8x1_SE_1LDSB0_GRVW8_NLCA1_NLCB1_SU0_SUS256_SRVW4_TT1_64_WG64_4_1_WGM1
    SolutionIndex: 348
    SolutionNameMin: Cijk_Ailk_Bjlk_HBH_MT64x256x16_MI32x32x8x1_SE_1LDSB0_GRVW8_NLCA1_NLCB1_SU32_SUS256_SRVW4_TT1_128_WG64_4_1_WGM1
    SolutionIndex: 349
    SolutionNameMin: Cijk_Ailk_Bjlk_HBH_MT64x128x16_MI32x32x8x1_SE_1LDSB0_GRVW8_NLCA1_NLCB1_SU32_SUS256_SRVW4_TT1_64_WG64_4_1_WGM1
    SolutionIndex: 350
    SolutionNameMin: Cijk_Ailk_Bjlk_HBH_MT64x128x32_MI32x32x8x1_SE_1LDSB0_GRVW8_NLCA1_NLCB1_SU32_SUS256_SRVW4_TT1_64_WG64_4_1_WGM15
    SolutionIndex: 351
    SolutionNameMin: Cijk_Ailk_Bjlk_HBH_MT128x128x32_MI32x32x8x1_SE_1LDSB0_GRVW8_NLCA1_NLCB1_SU0_SUS256_SRVW4_TT2_64_WG64_4_1_WGM15
    SolutionIndex: 352
    SolutionNameMin: Cijk_Ailk_Bjlk_HBH_MT64x128x64_MI32x32x8x1_SE_1LDSB0_GRVW8_NLCA1_NLCB1_SU32_SUS128_SRVW4_TT1_64_WG64_4_1_WGM1
    SolutionIndex: 353
    SolutionNameMin: Cijk_Ailk_Bjlk_HBH_MT64x128x32_MI32x32x8x1_SE_1LDSB0_GRVW8_NLCA1_NLCB1_SU0_SUS256_SRVW4_TT1_64_WG64_4_1_WGM2
    SolutionIndex: 354
    SolutionNameMin: Cijk_Ailk_Bjlk_HBH_MT128x128x32_MI32x32x8x1_SE_1LDSB0_GRVW8_NLCA1_NLCB1_SU0_SUS256_SRVW4_TT2_64_WG64_4_1_WGM2
    SolutionIndex: 355
    SolutionNameMin: Cijk_Ailk_Bjlk_HBH_MT128x128x32_MI32x32x8x1_SE_1LDSB0_GRVW8_NLCA1_NLCB1_SU0_SUS256_SRVW4_TT2_64_WG64_4_1_WGM1
    SolutionIndex: 356
    SolutionNameMin: Cijk_Ailk_Bjlk_HBH_MT256x160x32_MI32x32x8x1_SE_1LDSB0_GRVW4_NLCA1_NLCB5_SU32_SUS128_SRVW4_TT2_160_WG128_2_1_WGM1
    SolutionIndex: 357
    SolutionNameMin: Cijk_Ailk_Bjlk_HBH_MT64x128x32_MI32x32x8x1_SE_1LDSB0_GRVW8_NLCA1_NLCB1_SU0_SUS256_SRVW4_TT1_64_WG64_4_1_WGM15
    SolutionIndex: 358
    SolutionNameMin: Cijk_Ailk_Bjlk_HBH_MT96x128x32_MI32x32x8x1_SE_1LDSB0_GRVW4_NLCA3_NLCB1_SU0_SUS256_SRVW0_TT3_32_WG32_8_1_WGM1
    SolutionIndex: 359
    SolutionNameMin: Cijk_Ailk_Bjlk_HBH_MT64x128x32_MI32x32x8x1_SE_1LDSB0_GRVW8_NLCA1_NLCB1_SU32_SUS128_SRVW4_TT1_64_WG64_4_1_WGM2
    SolutionIndex: 360
    SolutionNameMin: Cijk_Ailk_Bjlk_HBH_MT64x128x32_MI32x32x8x1_SE_1LDSB0_GRVW8_NLCA1_NLCB1_SU32_SUS256_SRVW4_TT1_64_WG64_4_1_WGM2
    SolutionIndex: 361
    SolutionNameMin: Cijk_Ailk_Bjlk_HBH_MT64x128x16_MI32x32x8x1_SE_1LDSB0_GRVW8_NLCA1_NLCB1_SU0_SUS256_SRVW4_TT1_64_WG64_4_1_WGM1
    SolutionIndex: 362
    SolutionNameMin: Cijk_Ailk_Bjlk_HBH_MT64x128x16_MI32x32x8x1_SE_1LDSB0_GRVW8_NLCA1_NLCB1_SU32_SUS128_SRVW4_TT1_64_WG64_4_1_WGM2
    SolutionIndex: 363
    SolutionNameMin: Cijk_Ailk_Bjlk_HBH_MT64x64x16_MI32x32x8x1_SE_1LDSB0_GRVW8_NLCA1_NLCB1_SU0_SUS256_SRVW4_TT1_32_WG64_4_1_WGM1
    SolutionIndex: 364
    SolutionNameMin: Cijk_Ailk_Bjlk_HBH_MT128x96x16_MI32x32x8x1_SE_1LDSB0_GRVW2_NLCA1_NLCB3_SU0_SUS256_SRVW4_TT1_96_WG128_2_1_WGM1
    SolutionIndex: 365
    SolutionNameMin: Cijk_Ailk_Bjlk_HBH_MT128x96x32_MI32x32x8x1_SE_1LDSB0_GRVW4_NLCA1_NLCB3_SU0_SUS256_SRVW4_TT1_96_WG128_2_1_WGM2
    SolutionIndex: 366
    SolutionNameMin: Cijk_Ailk_Bjlk_HBH_MT64x128x16_MI32x32x8x1_SE_1LDSB0_GRVW8_NLCA1_NLCB1_SU0_SUS256_SRVW4_TT1_64_WG64_4_1_WGM15
    SolutionIndex: 367
    SolutionNameMin: Cijk_Ailk_Bjlk_HBH_MT128x96x16_MI32x32x8x1_SE_1LDSB0_GRVW2_NLCA1_NLCB3_SU32_SUS256_SRVW4_TT1_96_WG128_2_1_WGM2
    SolutionIndex: 368
    SolutionNameMin: Cijk_Ailk_Bjlk_HBH_MT128x128x16_MI32x32x8x1_SE_1LDSB0_GRVW8_NLCA1_NLCB1_SU0_SUS256_SRVW4_TT2_64_WG64_4_1_WGM15
    SolutionIndex: 369
    SolutionNameMin: Cijk_Ailk_Bjlk_HBH_MT128x256x16_MI32x32x8x1_SE_1LDSB1_GRVW8_NLCA1_NLCB1_SU32_SUS256_SRVW4_TT2_128_WG64_4_1_WGM2
    SolutionIndex: 370
    SolutionNameMin: Cijk_Ailk_Bjlk_HBH_MT128x256x16_MI32x32x8x1_SE_1LDSB0_GRVW8_NLCA1_NLCB1_SU32_SUS256_SRVW4_TT2_128_WG64_4_1_WGM1
    SolutionIndex: 371
    SolutionNameMin: Cijk_Ailk_Bjlk_HBH_MT64x64x16_MI32x32x8x1_SE_1LDSB0_GRVW8_NLCA1_NLCB1_SU32_SUS128_SRVW4_TT1_32_WG64_4_1_WGM15
    SolutionIndex: 372
    SolutionNameMin: Cijk_Ailk_Bjlk_HBH_MT64x64x16_MI32x32x8x1_SE_1LDSB0_GRVW8_NLCA1_NLCB1_SU32_SUS256_SRVW4_TT1_32_WG64_4_1_WGM2
    SolutionIndex: 373
    SolutionNameMin: Cijk_Ailk_Bjlk_HBH_MT64x64x32_MI32x32x8x1_SE_1LDSB0_GRVW8_NLCA1_NLCB1_SU0_SUS256_SRVW4_TT1_32_WG64_4_1_WGM2
    SolutionIndex: 374
    SolutionNameMin: Cijk_Ailk_Bjlk_HBH_MT64x128x16_MI32x32x8x1_SE_1LDSB0_GRVW8_NLCA1_NLCB1_SU32_SUS256_SRVW4_TT1_64_WG64_4_1_WGM1
    SolutionIndex: 375
    SolutionNameMin: Cijk_Ailk_Bjlk_HBH_MT128x96x16_MI32x32x8x1_SE_1LDSB0_GRVW2_NLCA1_NLCB3_SU32_SUS128_SRVW4_TT1_96_WG128_2_1_WGM1
    SolutionIndex: 376
    SolutionNameMin: Cijk_Ailk_Bjlk_HBH_MT128x128x16_MI32x32x8x1_SE_1LDSB0_GRVW4_NLCA1_NLCB1_SU32_SUS256_SRVW4_TT2_64_WG64_4_1_WGM15
    SolutionIndex: 377
    SolutionNameMin: Cijk_Ailk_Bjlk_HBH_MT128x128x16_MI32x32x8x1_SE_1LDSB0_GRVW8_NLCA1_NLCB1_SU0_SUS256_SRVW4_TT2_64_WG64_4_1_WGM1
    SolutionIndex: 378
    SolutionNameMin: Cijk_Ailk_Bjlk_HBH_MT256x128x32_MI32x32x8x1_SE_AF0EM8_GRVW8_GSU1_SU0_SUS256_SRVW4_VAW2_WG64_4_1_WGM15
    SolutionIndex: 379
    SolutionNameMin: Cijk_Ailk_Bjlk_HBH_MT256x160x32_MI32x32x8x1_SE_AF0EM8_GRVW4_GSU1_SU0_SUS256_SRVW4_VAW2_WG128_2_1_WGM2
    SolutionIndex: 380
    SolutionNameMin: Cijk_Ailk_Bjlk_HBH_MT128x288x32_MI32x32x8x1_SE_AF0EM8_GRVW4_GSU1_SU32_SUS128_SRVW4_VAW2_WG128_2_1_WGM1
    SolutionIndex: 381
    SolutionNameMin: Cijk_Ailk_Bjlk_HBH_MT64x64x32_MI32x32x8x1_SE_AF0EM8_GRVW4_GSU1_SU32_SUS256_SRVW4_VAW2_WG64_4_1_WGM1
    SolutionIndex: 382
    SolutionNameMin: Cijk_Ailk_Bjlk_HBH_MT32x32x64_MI16x16x16x1_SE_AF0EM8_GRVW2_GSU5_SU0_SUS256_SRVW0_VAW1_WG32_8_1_WGM15
    SolutionIndex: 383
    SolutionNameMin: Cijk_Ailk_Bjlk_HBH_MT128x288x32_MI32x32x8x1_SE_AF0EM8_GRVW2_GSU1_SU0_SUS256_SRVW4_VAW2_WG128_2_1_WGM15
    SolutionIndex: 384
    SolutionNameMin: Cijk_Ailk_Bjlk_HBH_MT256x160x32_MI32x32x8x1_SE_AF0EM8_GRVW4_GSU1_SU32_SUS256_SRVW4_VAW2_WG128_2_1_WGM2
    SolutionIndex: 385
    SolutionNameMin: Cijk_Ailk_Bjlk_HBH_MT64x64x16_MI32x32x8x1_SE_AF0EM8_GRVW8_GSU1_SU0_SUS256_SRVW4_VAW2_WG64_4_1_WGM1
    SolutionIndex: 386
    SolutionNameMin: Cijk_Ailk_Bjlk_HBH_MT64x128x16_MI32x32x8x1_SE_AF0EM8_GRVW8_GSU1_SU0_SUS256_SRVW4_VAW2_WG64_4_1_WGM2
    SolutionIndex: 387
    SolutionNameMin: Cijk_Ailk_Bjlk_HBH_MT32x32x64_MI16x16x16x1_SE_AF0EM8_GRVW2_GSU7_SU32_SUS256_SRVW0_VAW1_WG32_8_1_WGM15
    SolutionIndex: 388
    SolutionNameMin: Cijk_Ailk_Bjlk_HBH_MT256x160x32_MI32x32x8x1_SE_AF0EM8_GRVW4_GSU1_SU0_SUS256_SRVW4_VAW2_WG128_2_1_WGM15
    SolutionIndex: 389
    SolutionNameMin: Cijk_Ailk_Bjlk_HBH_MT64x64x16_MI32x32x8x1_SE_AF0EM8_GRVW2_GSU1_SU0_SUS256_SRVW4_VAW2_WG64_4_1_WGM15
    SolutionIndex: 390
    SolutionNameMin: Cijk_Ailk_Bjlk_HBH_MT160x256x32_MI32x32x8x1_SE_AF0EM8_GRVW4_GSU1_SU0_SUS256_SRVW0_VAW2_WG32_8_1_WGM1
    SolutionIndex: 391
    SolutionNameMin: Cijk_Ailk_Bjlk_HBH_MT64x64x16_MI32x32x8x1_SE_AF0EM8_GRVW2_GSU1_SU32_SUS256_SRVW4_VAW2_WG64_4_1_WGM15
    SolutionIndex: 392
    SolutionNameMin: Cijk_Ailk_Bjlk_HBH_MT64x128x16_MI32x32x8x1_SE_AF0EM8_GRVW2_GSU1_SU0_SUS256_SRVW4_VAW2_WG64_4_1_WGM2
    SolutionIndex: 393
    SolutionNameMin: Cijk_Ailk_Bjlk_HBH_MT64x16x64_MI16x16x16x1_SE_AF0EM8_GRVW2_GSU7_SU32_SUS128_SRVW0_VAW1_WG64_4_1_WGM15
    SolutionIndex: 394
    SolutionNameMin: Cijk_Ailk_Bjlk_HBH_MT256x160x32_MI32x32x8x1_SE_AF0EM8_GRVW4_GSU1_SU32_SUS128_SRVW4_VAW2_WG128_2_1_WGM2
    SolutionIndex: 395
    SolutionNameMin: Cijk_Ailk_Bjlk_HBH_MT64x256x16_MI32x32x8x1_SE_AF0EM8_GRVW4_GSU1_SU32_SUS256_SRVW4_VAW2_WG64_4_1_WGM1
    SolutionIndex: 396
    SolutionNameMin: Cijk_Ailk_Bjlk_HBH_MT128x96x64_MI32x32x8x1_SE_AF0EM8_GRVW8_GSU1_SU32_SUS256_SRVW4_VAW2_WG128_2_1_WGM15
    SolutionIndex: 397
    SolutionNameMin: Cijk_Ailk_Bjlk_HBH_MT144x256x32_MI16x16x16x1_SE_AF0EM8_GRVW2_GSU1_SU32_SUS128_SRVW0_VAW2_WG16_16_1_WGM15
    SolutionIndex: 398
    SolutionNameMin: Cijk_Ailk_Bjlk_HBH_MT64x64x64_MI32x32x8x1_SE_AF0EM8_GRVW8_GSU15_SU0_SUS256_SRVW0_VAW1_WG64_4_1_WGM1
    SolutionIndex: 399
    SolutionNameMin: Cijk_Ailk_Bjlk_HBH_MT64x64x16_MI32x32x8x1_SE_AF0EM8_GRVW2_GSU1_SU32_SUS256_SRVW4_VAW2_WG64_4_1_WGM1
    SolutionIndex: 400
    SolutionNameMin: Cijk_Ailk_Bjlk_HBH_MT128x128x32_MI32x32x8x1_SE_AF0EM8_GRVW8_GSU15_SU0_SUS256_SRVW0_VAW1_WG64_4_1_WGM15
    SolutionIndex: 401
    SolutionNameMin: Cijk_Ailk_Bjlk_HBH_MT256x256x16_MI32x32x8x1_SE_AF0EM8_GRVW4_GSU15_SU0_SUS256_SRVW0_VAW1_WG64_4_1_WGM15
    SolutionIndex: 402
    SolutionNameMin: Cijk_Ailk_Bjlk_HBH_MT256x256x32_MI32x32x8x1_SE_AF0EM8_GRVW8_GSU7_SU0_SUS256_SRVW0_VAW1_WG64_4_1_WGM15
    SolutionIndex: 403
    SolutionNameMin: Cijk_Ailk_Bjlk_HBH_MT64x64x32_MI32x32x8x1_SE_AF0EM8_GRVW4_GSU1_SU0_SUS256_SRVW4_VAW2_WG64_4_1_WGM2
    SolutionIndex: 404
    SolutionNameMin: Cijk_Ailk_Bjlk_HBH_MT128x64x16_MI32x32x8x1_SE_AF0EM8_GRVW8_GSU1_SU32_SUS128_SRVW4_VAW2_WG64_4_1_WGM1
    SolutionIndex: 405
    SolutionNameMin: Cijk_Ailk_Bjlk_HBH_MT128x256x32_MI32x32x8x1_SE_AF0EM8_GRVW8_GSU3_SU32_SUS128_SRVW0_VAW1_WG64_4_1_WGM1
    SolutionIndex: 406
    SolutionNameMin: Cijk_Ailk_Bjlk_HBH_MT256x128x32_MI32x32x8x1_SE_AF0EM8_GRVW8_GSU3_SU0_SUS256_SRVW0_VAW1_WG64_4_1_WGM15
    SolutionIndex: 407
    SolutionNameMin: Cijk_Ailk_Bjlk_HBH_MT128x256x16_MI32x32x8x1_SE_AF0EM8_GRVW8_GSU1_SU32_SUS128_SRVW4_VAW2_WG64_4_1_WGM2
    SolutionIndex: 408
    SolutionNameMin: Cijk_Ailk_Bjlk_HBH_MT160x256x32_MI32x32x8x1_SE_AF0EM8_GRVW4_GSU1_SU32_SUS128_SRVW0_VAW2_WG32_8_1_WGM1
    SolutionIndex: 409
    SolutionNameMin: Cijk_Ailk_Bjlk_HBH_MT256x128x32_MI32x32x8x1_SE_AF0EM8_GRVW8_GSU3_SU0_SUS256_SRVW0_VAW1_WG64_4_1_WGM2
    SolutionIndex: 410
    SolutionNameMin: Cijk_Ailk_Bjlk_HBH_MT256x256x16_MI32x32x8x1_SE_AF0EM8_GRVW4_GSU7_SU32_SUS128_SRVW0_VAW1_WG64_4_1_WGM2
    SolutionIndex: 411
    SolutionNameMin: Cijk_Ailk_Bjlk_HBH_MT128x256x32_MI32x32x8x1_SE_AF0EM8_GRVW8_GSU3_SU0_SUS256_SRVW0_VAW1_WG64_4_1_WGM1
    SolutionIndex: 412
    SolutionNameMin: Cijk_Ailk_Bjlk_HBH_MT256x128x32_MI32x32x8x1_SE_AF0EM8_GRVW8_GSU3_SU32_SUS128_SRVW0_VAW1_WG64_4_1_WGM1
    SolutionIndex: 413
    SolutionNameMin: Cijk_Ailk_Bjlk_HBH_MT128x256x32_MI32x32x8x1_SE_AF0EM8_GRVW8_GSU3_SU0_SUS256_SRVW0_VAW1_WG64_4_1_WGM2
    SolutionIndex: 414
    SolutionNameMin: Cijk_Ailk_Bjlk_HBH_MT256x256x16_MI32x32x8x1_SE_AF0EM8_GRVW8_GSU7_SU0_SUS256_SRVW0_VAW1_WG64_4_1_WGM15
    SolutionIndex: 415
    SolutionNameMin: Cijk_Ailk_Bjlk_HBH_MT256x160x32_MI32x32x8x1_SE_AF0EM8_GRVW4_GSU1_SU32_SUS128_SRVW4_VAW2_WG128_2_1_WGM15
    SolutionIndex: 416
    SolutionNameMin: Cijk_Ailk_Bjlk_HBH_MT160x256x32_MI32x32x8x1_SE_AF0EM8_GRVW4_GSU1_SU32_SUS128_SRVW0_VAW2_WG32_8_1_WGM15
    SolutionIndex: 417
    SolutionNameMin: Cijk_Ailk_Bjlk_HBH_MT64x32x16_MI16x16x16x1_SE_AF0EM8_GRVW2_GSU1_SU32_SUS256_SRVW4_VAW2_WG32_8_1_WGM1
    SolutionIndex: 418
    SolutionNameMin: Cijk_Ailk_Bjlk_HBH_MT64x32x16_MI16x16x16x1_SE_AF0EM8_GRVW2_GSU1_SU32_SUS128_SRVW4_VAW2_WG32_8_1_WGM15
    SolutionIndex: 419
    SolutionNameMin: Cijk_Ailk_Bjlk_HBH_MT64x32x16_MI16x16x16x1_SE_AF0EM8_GRVW2_GSU1_SU32_SUS256_SRVW4_VAW2_WG32_8_1_WGM15
    SolutionIndex: 420
    SolutionNameMin: Cijk_Ailk_Bjlk_HBH_MT64x64x16_MI32x32x8x1_SE_AF0EM8_GRVW2_GSU1_SU0_SUS256_SRVW4_VAW2_WG64_4_1_WGM2
    SolutionIndex: 421
    SolutionNameMin: Cijk_Ailk_Bjlk_HBH_MT32x32x64_MI16x16x16x1_SE_AF0EM8_GRVW8_GSU5_SU0_SUS256_SRVW0_VAW1_WG32_8_1_WGM1
    SolutionIndex: 422
    SolutionNameMin: Cijk_Ailk_Bjlk_HBH_MT128x160x32_MI32x32x8x1_SE_AF0EM8_GRVW4_GSU7_SU0_SUS256_SRVW0_VAW1_WG128_2_1_WGM1
    SolutionIndex: 423
    SolutionNameMin: Cijk_Ailk_Bjlk_HBH_MT128x128x64_MI32x32x8x1_SE_AF0EM8_GRVW8_GSU3_SU0_SUS256_SRVW0_VAW1_WG64_4_1_WGM15
    SolutionIndex: 424
    SolutionNameMin: Cijk_Ailk_Bjlk_HBH_MT128x256x32_MI32x32x8x1_SE_AF0EM8_GRVW8_GSU5_SU32_SUS128_SRVW0_VAW1_WG64_4_1_WGM1
    SolutionIndex: 425
    SolutionNameMin: Cijk_Ailk_Bjlk_HBH_MT128x128x64_MI32x32x8x1_SE_AF0EM8_GRVW8_GSU2_SU0_SUS256_SRVW0_VAW1_WG64_4_1_WGM2
    SolutionIndex: 426
    SolutionNameMin: Cijk_Ailk_Bjlk_HBH_MT256x160x32_MI32x32x8x1_SE_AF0EM8_GRVW4_GSU5_SU0_SUS256_SRVW0_VAW1_WG128_2_1_WGM2
    SolutionIndex: 427
    SolutionNameMin: Cijk_Ailk_Bjlk_HBH_MT128x256x32_MI32x32x8x1_SE_AF0EM8_GRVW4_GSU3_SU32_SUS128_SRVW0_VAW1_WG64_4_1_WGM15
    SolutionIndex: 428
    SolutionNameMin: Cijk_Ailk_Bjlk_HBH_MT128x256x32_MI32x32x8x1_SE_AF0EM8_GRVW8_GSU3_SU0_SUS256_SRVW0_VAW1_WG64_4_1_WGM15
    SolutionIndex: 429
    SolutionNameMin: Cijk_Ailk_Bjlk_HBH_MT128x288x32_MI32x32x8x1_SE_AF0EM8_GRVW4_GSU3_SU0_SUS256_SRVW0_VAW1_WG128_2_1_WGM1
    SolutionIndex: 430
    SolutionNameMin: Cijk_Ailk_Bjlk_HBH_MT256x160x32_MI32x32x8x1_SE_AF0EM8_GRVW4_GSU3_SU32_SUS256_SRVW0_VAW1_WG128_2_1_WGM2
    SolutionIndex: 431
    SolutionNameMin: Cijk_Ailk_Bjlk_HBH_MT256x160x32_MI32x32x8x1_SE_AF0EM8_GRVW4_GSU3_SU0_SUS256_SRVW0_VAW1_WG128_2_1_WGM15
    SolutionIndex: 432
    SolutionNameMin: Cijk_Ailk_Bjlk_HBH_MT128x256x32_MI32x32x8x1_SE_AF0EM8_GRVW8_GSU2_SU0_SUS256_SRVW0_VAW1_WG64_4_1_WGM15
    SolutionIndex: 433
    SolutionNameMin: Cijk_Ailk_Bjlk_HBH_MT128x288x32_MI32x32x8x1_SE_AF0EM8_GRVW4_GSU2_SU0_SUS256_SRVW0_VAW1_WG128_2_1_WGM2
    SolutionIndex: 434
    SolutionNameMin: Cijk_Ailk_Bjlk_HBH_MT256x160x32_MI32x32x8x1_SE_AF0EM8_GRVW4_GSU2_SU0_SUS256_SRVW0_VAW1_WG128_2_1_WGM1
    SolutionIndex: 435
    SolutionNameMin: Cijk_Ailk_Bjlk_HBH_MT256x256x16_MI32x32x8x1_SE_AF0EM8_GRVW8_GSU3_SU0_SUS256_SRVW0_VAW1_WG64_4_1_WGM15
    SolutionIndex: 436
    SolutionNameMin: Cijk_Ailk_Bjlk_HBH_MT256x256x16_MI32x32x8x1_SE_AF0EM8_GRVW4_GSU3_SU32_SUS256_SRVW0_VAW1_WG64_4_1_WGM1
    SolutionIndex: 437
    SolutionNameMin: Cijk_Ailk_Bjlk_HBH_MT256x256x16_MI32x32x8x1_SE_AF0EM8_GRVW4_GSU3_SU32_SUS128_SRVW0_VAW1_WG64_4_1_WGM2
    SolutionIndex: 438
    SolutionNameMin: Cijk_Ailk_Bjlk_HBH_MT128x288x32_MI32x32x8x1_SE_AF0EM8_GRVW4_GSU3_SU0_SUS256_SRVW0_VAW1_WG128_2_1_WGM2
    SolutionIndex: 439
    SolutionNameMin: Cijk_Ailk_Bjlk_HBH_MT128x256x32_MI32x32x8x1_SE_AF0EM8_GRVW8_GSU1_SU0_SUS256_SRVW4_VAW2_WG64_4_1_WGM1
    SolutionIndex: 440
    SolutionNameMin: Cijk_Ailk_Bjlk_HBH_MT128x256x32_MI32x32x8x1_SE_AF0EM8_GRVW8_GSU1_SU32_SUS256_SRVW4_VAW2_WG64_4_1_WGM1
    SolutionIndex: 441
    SolutionNameMin: Cijk_Ailk_Bjlk_HBH_MT256x128x32_MI32x32x8x1_SE_AF0EM8_GRVW8_GSU1_SU0_SUS256_SRVW4_VAW2_WG64_4_1_WGM2
    SolutionIndex: 442
    SolutionNameMin: Cijk_Ailk_Bjlk_HBH_MT128x256x32_MI32x32x8x1_SE_AF0EM8_GRVW8_GSU1_SU32_SUS128_SRVW4_VAW2_WG64_4_1_WGM15
    SolutionIndex: 443
    SolutionNameMin: Cijk_Ailk_Bjlk_HBH_MT256x128x32_MI32x32x8x1_SE_AF0EM8_GRVW8_GSU1_SU32_SUS128_SRVW4_VAW2_WG64_4_1_WGM15
    SolutionIndex: 444
    SolutionNameMin: Cijk_Ailk_Bjlk_HBH_MT128x288x32_MI32x32x8x1_SE_AF0EM8_GRVW4_GSU1_SU0_SUS256_SRVW4_VAW2_WG128_2_1_WGM15
    SolutionIndex: 445
    SolutionNameMin: Cijk_Ailk_Bjlk_HBH_MT128x128x32_MI32x32x8x1_SE_AF0EM8_GRVW8_GSU1_SU0_SUS256_SRVW4_VAW2_WG64_4_1_WGM15
    SolutionIndex: 446
    SolutionNameMin: Cijk_Ailk_Bjlk_HBH_MT128x128x32_MI32x32x8x1_SE_AF0EM8_GRVW8_GSU1_SU0_SUS256_SRVW4_VAW2_WG64_4_1_WGM2
    SolutionIndex: 447
    SolutionNameMin: Cijk_Ailk_Bjlk_HBH_MT256x256x16_MI32x32x8x1_SE_AF0EM8_GRVW4_GSU1_SU32_SUS128_SRVW4_VAW2_WG64_4_1_WGM15
    SolutionIndex: 448
    SolutionNameMin: Cijk_Ailk_Bjlk_HBH_MT128x288x32_MI32x32x8x1_SE_AF0EM8_GRVW4_GSU1_SU0_SUS256_SRVW4_VAW2_WG128_2_1_WGM2
    SolutionIndex: 449
    SolutionNameMin: Cijk_Ailk_Bjlk_HBH_MT256x128x32_MI32x32x8x1_SE_AF0EM8_GRVW8_GSU7_SU32_SUS128_SRVW0_VAW1_WG64_4_1_WGM15
    SolutionIndex: 450
    SolutionNameMin: Cijk_Ailk_Bjlk_HBH_MT96x128x64_MI32x32x8x1_SE_AF0EM8_GRVW4_GSU5_SU0_SUS256_SRVW0_VAW1_WG32_8_1_WGM2
    SolutionIndex: 451
    SolutionNameMin: Cijk_Ailk_Bjlk_HBH_MT96x128x64_MI32x32x8x1_SE_AF0EM8_GRVW8_GSU5_SU0_SUS256_SRVW0_VAW1_WG32_8_1_WGM1
    SolutionIndex: 452
    SolutionNameMin: Cijk_Ailk_Bjlk_HBH_MT96x128x64_MI32x32x8x1_SE_AF0EM8_GRVW8_GSU5_SU32_SUS128_SRVW0_VAW1_WG32_8_1_WGM15
    SolutionIndex: 453
    SolutionNameMin: Cijk_Ailk_Bjlk_HBH_MT96x128x64_MI32x32x8x1_SE_AF0EM8_GRVW8_GSU5_SU32_SUS256_SRVW0_VAW1_WG32_8_1_WGM15
    SolutionIndex: 454
    SolutionNameMin: Cijk_Ailk_Bjlk_HBH_MT128x128x64_MI32x32x8x1_SE_AF0EM8_GRVW8_GSU7_SU0_SUS256_SRVW0_VAW1_WG64_4_1_WGM1
    SolutionIndex: 455
    SolutionNameMin: Cijk_Ailk_Bjlk_HBH_MT128x128x64_MI32x32x8x1_SE_AF0EM8_GRVW8_GSU7_SU32_SUS256_SRVW0_VAW1_WG64_4_1_WGM1
    SolutionIndex: 456
    SolutionNameMin: Cijk_Ailk_Bjlk_HBH_MT128x128x64_MI32x32x8x1_SE_AF0EM8_GRVW8_GSU7_SU0_SUS256_SRVW0_VAW1_WG64_4_1_WGM2
    SolutionIndex: 457
    SolutionNameMin: Cijk_Ailk_Bjlk_HBH_MT128x128x64_MI32x32x8x1_SE_AF0EM8_GRVW4_GSU7_SU0_SUS256_SRVW0_VAW1_WG64_4_1_WGM1
    SolutionIndex: 458
    SolutionNameMin: Cijk_Ailk_Bjlk_HBH_MT128x128x64_MI32x32x8x1_SE_AF0EM8_GRVW8_GSU7_SU32_SUS256_SRVW0_VAW1_WG64_4_1_WGM2
    SolutionIndex: 459
    SolutionNameMin: Cijk_Ailk_Bjlk_HBH_MT128x128x64_MI32x32x8x1_SE_AF0EM8_GRVW8_GSU7_SU32_SUS128_SRVW0_VAW1_WG64_4_1_WGM1
    SolutionIndex: 460
    SolutionNameMin: Cijk_Ailk_Bjlk_HBH_MT128x128x64_MI32x32x8x1_SE_AF0EM8_GRVW8_GSU7_SU32_SUS128_SRVW0_VAW1_WG64_4_1_WGM2
    SolutionIndex: 461
    SolutionNameMin: Cijk_Ailk_Bjlk_HBH_MT128x128x64_MI32x32x8x1_SE_AF0EM8_GRVW4_GSU7_SU0_SUS256_SRVW0_VAW1_WG64_4_1_WGM2
    SolutionIndex: 462
    SolutionNameMin: Cijk_Ailk_Bjlk_HBH_MT128x128x64_MI32x32x8x1_SE_AF0EM8_GRVW8_GSU7_SU32_SUS128_SRVW0_VAW1_WG64_4_1_WGM15
    SolutionIndex: 463
    SolutionNameMin: Cijk_Ailk_Bjlk_HBH_MT128x128x64_MI32x32x8x1_SE_AF0EM8_GRVW2_GSU7_SU0_SUS256_SRVW0_VAW1_WG64_4_1_WGM1
    SolutionIndex: 464
    SolutionNameMin: Cijk_Ailk_Bjlk_HBH_MT256x128x32_MI32x32x8x1_SE_AF0EM8_GRVW8_GSU15_SU0_SUS256_SRVW0_VAW1_WG64_4_1_WGM2
    SolutionIndex: 465
    SolutionNameMin: Cijk_Ailk_Bjlk_HBH_MT256x128x32_MI32x32x8x1_SE_AF0EM8_GRVW8_GSU15_SU0_SUS256_SRVW0_VAW1_WG64_4_1_WGM1
    SolutionIndex: 466
    SolutionNameMin: Cijk_Ailk_Bjlk_HBH_MT256x128x32_MI32x32x8x1_SE_AF0EM8_GRVW8_GSU15_SU0_SUS256_SRVW0_VAW1_WG64_4_1_WGM15
    SolutionIndex: 467
    SolutionNameMin: Cijk_Ailk_Bjlk_HBH_MT128x256x32_MI32x32x8x1_SE_AF0EM8_GRVW8_GSU15_SU0_SUS256_SRVW0_VAW1_WG64_4_1_WGM2
    SolutionIndex: 468
    SolutionNameMin: Cijk_Ailk_Bjlk_HBH_MT128x96x16_MI32x32x8x1_SE_AF0EM8_GRVW2_GSU1_SU32_SUS128_SRVW4_VAW2_WG128_2_1_WGM2
    SolutionIndex: 469
    SolutionNameMin: Cijk_Ailk_Bjlk_HBH_MT256x256x16_MI32x32x8x1_SE_AF0EM8_GRVW4_GSU1_SU0_SUS256_SRVW4_VAW2_WG64_4_1_WGM1
    SolutionIndex: 470
    SolutionNameMin: Cijk_Ailk_Bjlk_HBH_MT64x128x32_MI32x32x8x1_SE_AF0EM8_GRVW8_GSU1_SU32_SUS128_SRVW4_VAW2_WG64_4_1_WGM1
    SolutionIndex: 471
    SolutionNameMin: Cijk_Ailk_Bjlk_HBH_MT256x256x32_MI32x32x8x1_SE_AF0EM8_GRVW8_GSU1_SU0_SUS256_SRVW4_VAW2_WG64_4_1_WGM2
    SolutionIndex: 472
    SolutionNameMin: Cijk_Ailk_Bjlk_HBH_MT128x64x32_MI32x32x8x1_SE_AF0EM8_GRVW2_GSU1_SU0_SUS256_SRVW4_VAW2_WG64_4_1_WGM2
    SolutionIndex: 473
    SolutionNameMin: Cijk_Ailk_Bjlk_HBH_MT128x64x32_MI32x32x8x1_SE_AF0EM8_GRVW8_GSU1_SU0_SUS256_SRVW4_VAW2_WG64_4_1_WGM15
    SolutionIndex: 474
    SolutionNameMin: Cijk_Ailk_Bjlk_HBH_MT64x128x32_MI32x32x8x1_SE_AF0EM8_GRVW8_GSU1_SU0_SUS256_SRVW4_VAW2_WG64_4_1_WGM1
    SolutionIndex: 475
    SolutionNameMin: Cijk_Ailk_Bjlk_HBH_MT256x160x32_MI32x32x8x1_SE_AF0EM8_GRVW4_GSU2_SU0_SUS256_SRVW0_VAW1_WG128_2_1_WGM15
    SolutionIndex: 476
    SolutionNameMin: Cijk_Ailk_Bjlk_HBH_MT256x256x16_MI32x32x8x1_SE_AF0EM8_GRVW4_GSU7_SU32_SUS128_SRVW0_VAW1_WG64_4_1_WGM1
    SolutionIndex: 477
    SolutionNameMin: Cijk_Ailk_Bjlk_HBH_MT256x64x32_MI32x32x8x1_SE_AF0EM8_GRVW8_GSU1_SU0_SUS256_SRVW4_VAW2_WG64_4_1_WGM1
    SolutionIndex: 478
    SolutionNameMin: Cijk_Ailk_Bjlk_HBH_MT128x64x16_MI32x32x8x1_SE_AF0EM8_GRVW8_GSU1_SU0_SUS256_SRVW4_VAW2_WG64_4_1_WGM15
    SolutionIndex: 479
    SolutionNameMin: Cijk_Ailk_Bjlk_HBH_MT128x64x16_MI32x32x8x1_SE_AF0EM8_GRVW4_GSU1_SU0_SUS256_SRVW4_VAW2_WG64_4_1_WGM15
    SolutionIndex: 480
    SolutionNameMin: Cijk_Ailk_Bjlk_HBH_MT128x64x16_MI32x32x8x1_SE_AF0EM8_GRVW2_GSU1_SU0_SUS256_SRVW4_VAW2_WG64_4_1_WGM15
    SolutionIndex: 481
    SolutionNameMin: Cijk_Ailk_Bjlk_HBH_MT256x128x32_MI32x32x8x1_SE_AF0EM8_GRVW8_GSU3_SU32_SUS128_SRVW0_VAW1_WG64_4_1_WGM2
    SolutionIndex: 482
    SolutionNameMin: Cijk_Ailk_Bjlk_HBH_MT128x128x32_MI32x32x8x1_SE_AF0EM8_GRVW8_GSU3_SU32_SUS128_SRVW0_VAW1_WG64_4_1_WGM15
    SolutionIndex: 483
    SolutionNameMin: Cijk_Ailk_Bjlk_HBH_MT128x128x64_MI32x32x8x1_SE_AF0EM8_GRVW8_GSU3_SU0_SUS256_SRVW0_VAW1_WG64_4_1_WGM1
    SolutionIndex: 484
    SolutionNameMin: Cijk_Ailk_Bjlk_HBH_MT256x128x32_MI32x32x8x1_SE_AF0EM8_GRVW8_GSU7_SU0_SUS256_SRVW0_VAW1_WG64_4_1_WGM15
    SolutionIndex: 485
    SolutionNameMin: Cijk_Ailk_Bjlk_HBH_MT32x32x64_MI16x16x16x1_SE_AF0EM8_GRVW2_GSU7_SU0_SUS256_SRVW0_VAW1_WG32_8_1_WGM1
    SolutionIndex: 486
    SolutionNameMin: Cijk_Ailk_Bjlk_HBH_MT64x64x64_MI32x32x8x1_SE_AF0EM8_GRVW8_GSU15_SU32_SUS128_SRVW0_VAW1_WG64_4_1_WGM1
    SolutionIndex: 487
    SolutionNameMin: Cijk_Ailk_Bjlk_HBH_MT64x64x64_MI32x32x8x1_SE_AF0EM8_GRVW8_GSU15_SU0_SUS256_SRVW0_VAW1_WG64_4_1_WGM2
    SolutionIndex: 488
    SolutionNameMin: Cijk_Ailk_Bjlk_HBH_MT64x64x64_MI32x32x8x1_SE_AF0EM8_GRVW8_GSU15_SU32_SUS256_SRVW0_VAW1_WG64_4_1_WGM1
    SolutionIndex: 489
    SolutionNameMin: Cijk_Ailk_Bjlk_HBH_MT96x128x64_MI32x32x8x1_SE_AF0EM8_GRVW2_GSU3_SU0_SUS256_SRVW0_VAW1_WG32_8_1_WGM2
    SolutionIndex: 490
    SolutionNameMin: Cijk_Ailk_Bjlk_HBH_MT128x256x32_MI32x32x8x1_SE_AF0EM8_GRVW4_GSU7_SU0_SUS256_SRVW0_VAW1_WG64_4_1_WGM1
    SolutionIndex: 491
    SolutionNameMin: Cijk_Ailk_Bjlk_HBH_MT64x128x64_MI32x32x8x1_SE_AF0EM8_GRVW8_GSU7_SU32_SUS128_SRVW0_VAW1_WG64_4_1_WGM2
    SolutionIndex: 492
    SolutionNameMin: Cijk_Ailk_Bjlk_HBH_MT128x64x64_MI32x32x8x1_SE_AF0EM8_GRVW8_GSU7_SU32_SUS256_SRVW0_VAW1_WG64_4_1_WGM2
    SolutionIndex: 493
    SolutionNameMin: Cijk_Ailk_Bjlk_HBH_MT128x128x64_MI32x32x8x1_SE_AF0EM8_GRVW8_GSU15_SU0_SUS256_SRVW0_VAW1_WG64_4_1_WGM15
    SolutionIndex: 494
    SolutionNameMin: Cijk_Ailk_Bjlk_HBH_MT128x64x64_MI32x32x8x1_SE_AF0EM8_GRVW8_GSU7_SU32_SUS128_SRVW0_VAW1_WG64_4_1_WGM1
    SolutionIndex: 495
    SolutionNameMin: Cijk_Ailk_Bjlk_HBH_MT256x256x16_MI32x32x8x1_SE_AF0EM8_GRVW8_GSU1_SU0_SUS256_SRVW4_VAW2_WG64_4_1_WGM15
    SolutionIndex: 496
    SolutionNameMin: Cijk_Ailk_Bjlk_HBH_MT64x128x16_MI32x32x8x1_SE_AF0EM8_GRVW2_GSU1_SU0_SUS256_SRVW4_VAW2_WG64_4_1_WGM15
    SolutionIndex: 497
    SolutionNameMin: Cijk_Ailk_Bjlk_HBH_MT128x64x16_MI32x32x8x1_SE_AF0EM8_GRVW2_GSU1_SU32_SUS256_SRVW4_VAW2_WG64_4_1_WGM1
    SolutionIndex: 498
    SolutionNameMin: Cijk_Ailk_Bjlk_HBH_MT256x256x32_MI32x32x8x1_SE_AF0EM8_GRVW8_GSU7_SU32_SUS256_SRVW0_VAW1_WG64_4_1_WGM15
    SolutionIndex: 499
    SolutionNameMin: Cijk_Ailk_Bjlk_HBH_MT128x64x16_MI32x32x8x1_SE_AF0EM8_GRVW2_GSU1_SU32_SUS128_SRVW4_VAW2_WG64_4_1_WGM2
    SolutionIndex: 500
    SolutionNameMin: Cijk_Ailk_Bjlk_HBH_MT64x128x16_MI32x32x8x1_SE_AF0EM8_GRVW2_GSU1_SU32_SUS256_SRVW4_VAW2_WG64_4_1_WGM1
    SolutionIndex: 501
    SolutionNameMin: Cijk_Ailk_Bjlk_HBH_MT256x128x32_MI32x32x8x1_SE_AF0EM8_GRVW8_GSU3_SU32_SUS256_SRVW0_VAW1_WG64_4_1_WGM1
    SolutionIndex: 502
    SolutionNameMin: Cijk_Ailk_Bjlk_HBH_MT128x64x16_MI32x32x8x1_SE_AF0EM8_GRVW8_GSU1_SU0_SUS256_SRVW4_VAW2_WG64_4_1_WGM1
    SolutionIndex: 503
    SolutionNameMin: Cijk_Ailk_Bjlk_HBH_MT128x128x32_MI32x32x8x1_SE_AF0EM8_GRVW8_GSU1_SU0_SUS256_SRVW4_VAW2_WG64_4_1_WGM1
    SolutionIndex: 504
    SolutionNameMin: Cijk_Ailk_Bjlk_HBH_MT128x256x16_MI32x32x8x1_SE_AF0EM8_GRVW8_GSU1_SU0_SUS256_SRVW4_VAW2_WG64_4_1_WGM15
    SolutionIndex: 505
    SolutionNameMin: Cijk_Ailk_Bjlk_HBH_MT128x256x32_MI32x32x8x1_SE_AF0EM8_GRVW2_GSU1_SU0_SUS256_SRVW4_VAW2_WG64_4_1_WGM15
    SolutionIndex: 506
    SolutionNameMin: Cijk_Ailk_Bjlk_HBH_MT64x64x32_MI32x32x8x1_SE_AF0EM8_GRVW2_GSU1_SU32_SUS256_SRVW4_VAW2_WG64_4_1_WGM1
    SolutionIndex: 507
    SolutionNameMin: Cijk_Ailk_Bjlk_HBH_MT128x96x16_MI32x32x8x1_SE_AF0EM8_GRVW2_GSU1_SU0_SUS256_SRVW4_VAW2_WG128_2_1_WGM2
    SolutionIndex: 508
    SolutionNameMin: Cijk_Ailk_Bjlk_HBH_MT64x64x32_MI32x32x8x1_SE_AF0EM8_GRVW8_GSU1_SU0_SUS256_SRVW4_VAW2_WG64_4_1_WGM1
    SolutionIndex: 509
    SolutionNameMin: Cijk_Ailk_Bjlk_HBH_MT64x128x16_MI32x32x8x1_SE_AF0EM8_GRVW2_GSU1_SU0_SUS256_SRVW4_VAW2_WG64_4_1_WGM1
    SolutionIndex: 510
    SolutionNameMin: Cijk_Ailk_Bjlk_HBH_MT64x128x16_MI32x32x8x1_SE_AF0EM8_GRVW2_GSU1_SU32_SUS128_SRVW4_VAW2_WG64_4_1_WGM1
    SolutionIndex: 511
    SolutionNameMin: Cijk_Ailk_Bjlk_HBH_MT64x128x32_MI32x32x8x1_SE_AF0EM8_GRVW8_GSU1_SU0_SUS256_SRVW4_VAW2_WG64_4_1_WGM15
    SolutionIndex: 512
    SolutionNameMin: Cijk_Ailk_Bjlk_HBH_MT64x128x16_MI32x32x8x1_SE_AF0EM8_GRVW4_GSU1_SU0_SUS256_SRVW4_VAW2_WG64_4_1_WGM15
    SolutionIndex: 513
    SolutionNameMin: Cijk_Ailk_Bjlk_HBH_MT64x256x16_MI32x32x8x1_SE_AF0EM8_GRVW8_GSU1_SU0_SUS256_SRVW4_VAW2_WG64_4_1_WGM1
    SolutionIndex: 514
    SolutionNameMin: Cijk_Ailk_Bjlk_HBH_MT64x256x16_MI32x32x8x1_SE_AF0EM8_GRVW8_GSU1_SU0_SUS256_SRVW4_VAW2_WG64_4_1_WGM2
    SolutionIndex: 515
    SolutionNameMin: Cijk_Ailk_Bjlk_HBH_MT64x128x16_MI32x32x8x1_SE_AF0EM8_GRVW4_GSU1_SU0_SUS256_SRVW4_VAW2_WG64_4_1_WGM2
    SolutionIndex: 516
    SolutionNameMin: Cijk_Ailk_Bjlk_HBH_MT64x128x32_MI32x32x8x1_SE_AF0EM8_GRVW8_GSU1_SU32_SUS128_SRVW4_VAW2_WG64_4_1_WGM15
    SolutionIndex: 517
    SolutionNameMin: Cijk_Ailk_Bjlk_HBH_MT256x256x16_MI32x32x8x1_SE_AF0EM8_GRVW4_GSU7_SU32_SUS256_SRVW0_VAW1_WG64_4_1_WGM15
    SolutionIndex: 518
    SolutionNameMin: Cijk_Ailk_Bjlk_HBH_MT256x256x16_MI32x32x8x1_SE_AF0EM8_GRVW8_GSU7_SU0_SUS256_SRVW0_VAW1_WG64_4_1_WGM15
    SolutionIndex: 519
    SolutionNameMin: Cijk_Ailk_Bjlk_HBH_MT256x128x32_MI32x32x8x1_SE_AF0EM8_GRVW4_GSU1_SU0_SUS256_SRVW4_VAW2_WG64_4_1_WGM15
    SolutionIndex: 520
    SolutionNameMin: Cijk_Ailk_Bjlk_HBH_MT256x160x32_MI32x32x8x1_SE_AF0EM8_GRVW4_GSU1_SU32_SUS256_SRVW4_VAW2_WG128_2_1_WGM15
    SolutionIndex: 521
    SolutionNameMin: Cijk_Ailk_Bjlk_HBH_MT256x160x32_MI32x32x8x1_SE_AF0EM8_GRVW4_GSU2_SU32_SUS256_SRVW0_VAW1_WG128_2_1_WGM2
    SolutionIndex: 522
    SolutionNameMin: Cijk_Ailk_Bjlk_HBH_MT256x160x32_MI32x32x8x1_SE_AF0EM8_GRVW4_GSU2_SU0_SUS256_SRVW0_VAW1_WG128_2_1_WGM2
    SolutionIndex: 523
    SolutionNameMin: Cijk_Ailk_Bjlk_HBH_MT64x32x16_MI16x16x16x1_SE_AF0EM8_GRVW2_GSU1_SU32_SUS256_SRVW4_VAW2_WG32_8_1_WGM2
    SolutionIndex: 524
    SolutionNameMin: Cijk_Ailk_Bjlk_HBH_MT128x256x16_MI32x32x8x1_SE_AF0EM8_GRVW8_GSU1_SU32_SUS128_SRVW4_VAW2_WG64_4_1_WGM1
    SolutionIndex: 525
    SolutionNameMin: Cijk_Ailk_Bjlk_HBH_MT64x64x16_MI32x32x8x1_SE_AF0EM8_GRVW8_GSU1_SU32_SUS128_SRVW4_VAW2_WG64_4_1_WGM2
    SolutionIndex: 526
    SolutionNameMin: Cijk_Ailk_Bjlk_HBH_MT128x256x16_MI32x32x8x1_SE_AF0EM8_GRVW8_GSU1_SU32_SUS128_SRVW4_VAW2_WG64_4_1_WGM1
    SolutionIndex: 527
    SolutionNameMin: Cijk_Ailk_Bjlk_HBH_MT128x128x32_MI32x32x8x1_SE_AF0EM8_GRVW8_GSU1_SU32_SUS256_SRVW4_VAW2_WG64_4_1_WGM2
    SolutionIndex: 528
    SolutionNameMin: Cijk_Ailk_Bjlk_HBH_MT64x64x16_MI32x32x8x1_SE_AF0EM8_GRVW8_GSU1_SU32_SUS256_SRVW4_VAW2_WG64_4_1_WGM15
    SolutionIndex: 529
    SolutionNameMin: Cijk_Ailk_Bjlk_HBH_MT128x256x32_MI32x32x8x1_SE_AF0EM8_GRVW8_GSU1_SU0_SUS256_SRVW4_VAW2_WG64_4_1_WGM15
    SolutionIndex: 530
    SolutionNameMin: Cijk_Ailk_Bjlk_HBH_MT64x128x64_MI32x32x8x1_SE_AF0EM8_GRVW8_GSU1_SU0_SUS256_SRVW4_VAW2_WG64_4_1_WGM15
    SolutionIndex: 531
    SolutionNameMin: Cijk_Ailk_Bjlk_HBH_MT128x256x32_MI32x32x8x1_SE_AF0EM8_GRVW2_GSU1_SU0_SUS256_SRVW4_VAW2_WG64_4_1_WGM1
    SolutionIndex: 532
    SolutionNameMin: Cijk_Ailk_Bjlk_HBH_MT128x256x32_MI32x32x8x1_SE_AF0EM8_GRVW2_GSU1_SU32_SUS256_SRVW4_VAW2_WG64_4_1_WGM1
    SolutionIndex: 533
    SolutionNameMin: Cijk_Ailk_Bjlk_HBH_MT128x128x32_MI32x32x8x1_SE_AF0EM8_GRVW8_GSU1_SU32_SUS256_SRVW4_VAW2_WG64_4_1_WGM1
    SolutionIndex: 534
    SolutionNameMin: Cijk_Ailk_Bjlk_HBH_MT64x64x32_MI32x32x8x1_SE_AF0EM8_GRVW8_GSU1_SU0_SUS256_SRVW4_VAW2_WG64_4_1_WGM15
    SolutionIndex: 535
    SolutionNameMin: Cijk_Ailk_Bjlk_HBH_MT128x256x16_MI32x32x8x1_SE_AF0EM8_GRVW8_GSU1_SU0_SUS256_SRVW4_VAW2_WG64_4_1_WGM2
    SolutionIndex: 536
    SolutionNameMin: Cijk_Ailk_Bjlk_HBH_MT128x256x16_MI32x32x8x1_SE_AF0EM8_GRVW8_GSU1_SU32_SUS256_SRVW4_VAW2_WG64_4_1_WGM1
    SolutionIndex: 537
    SolutionNameMin: Cijk_Ailk_Bjlk_HBH_MT128x256x16_MI32x32x8x1_SE_AF0EM8_GRVW8_GSU1_SU0_SUS256_SRVW4_VAW2_WG64_4_1_WGM1
    SolutionIndex: 538
    SolutionNameMin: Cijk_Ailk_Bjlk_HBH_MT128x64x16_MI32x32x8x1_SE_AF0EM8_GRVW2_GSU1_SU0_SUS256_SRVW4_VAW2_WG64_4_1_WGM1
    SolutionIndex: 539
    SolutionNameMin: Cijk_Ailk_Bjlk_HBH_MT64x64x32_MI32x32x8x1_SE_AF0EM8_GRVW4_GSU1_SU32_SUS256_SRVW4_VAW2_WG64_4_1_WGM15
    SolutionIndex: 540
    SolutionNameMin: Cijk_Ailk_Bjlk_HBH_MT64x16x32_MI16x16x16x1_SE_AF0EM8_GRVW4_GSU1_SU0_SUS256_SRVW0_VAW2_WG64_4_1_WGM1
    SolutionIndex: 541
    SolutionNameMin: Cijk_Ailk_Bjlk_HBH_MT256x256x16_MI32x32x8x1_SE_AF0EM8_GRVW4_GSU1_SU32_SUS128_SRVW4_VAW2_WG64_4_1_WGM2
    SolutionIndex: 542
    SolutionNameMin: Cijk_Ailk_Bjlk_HBH_MT64x64x32_MI32x32x8x1_SE_AF0EM8_GRVW8_GSU1_SU32_SUS256_SRVW4_VAW2_WG64_4_1_WGM15
    SolutionIndex: 543
    SolutionNameMin: Cijk_Ailk_Bjlk_HBH_MT256x256x32_MI32x32x8x1_SE_AF0EM8_GRVW8_GSU7_SU32_SUS128_SRVW0_VAW1_WG64_4_1_WGM15
    SolutionIndex: 544
    SolutionNameMin: Cijk_Ailk_Bjlk_HBH_MT16x16x16_MI16x16x16x1_SE_AF0EM8_GRVW2_GSU1_SU0_SUS256_SRVW0_VAW2_WG16_4_1_WGM15
    SolutionIndex: 545
    SolutionNameMin: Cijk_Ailk_Bjlk_HBH_MT128x128x32_MI32x32x8x1_SE_AF0EM8_GRVW2_GSU1_SU0_SUS256_SRVW4_VAW2_WG64_4_1_WGM1
    SolutionIndex: 546
    SolutionNameMin: Cijk_Ailk_Bjlk_HBH_MT128x256x16_MI32x32x8x1_SE_AF0EM8_GRVW8_GSU1_SU0_SUS256_SRVW4_VAW2_WG64_4_1_WGM2
    SolutionIndex: 547
    SolutionNameMin: Cijk_Ailk_Bjlk_HBH_MT128x64x32_MI32x32x8x1_SE_AF0EM8_GRVW8_GSU1_SU0_SUS256_SRVW4_VAW2_WG64_4_1_WGM1
    SolutionIndex: 548
    SolutionNameMin: Cijk_Ailk_Bjlk_HBH_MT64x128x32_MI32x32x8x1_SE_AF0EM8_GRVW4_GSU1_SU0_SUS256_SRVW4_VAW2_WG64_4_1_WGM1
    SolutionIndex: 549
    SolutionNameMin: Cijk_Ailk_Bjlk_HBH_MT32x32x64_MI16x16x16x1_SE_AF0EM8_GRVW2_GSU7_SU32_SUS128_SRVW0_VAW1_WG32_8_1_WGM15
    SolutionIndex: 550
    SolutionNameMin: Cijk_Ailk_Bjlk_HBH_MT128x160x32_MI32x32x8x1_SE_AF0EM8_GRVW4_GSU1_SU0_SUS256_SRVW4_VAW2_WG128_2_1_WGM15
    SolutionIndex: 551
    SolutionNameMin: Cijk_Ailk_Bjlk_HBH_MT64x64x64_MI32x32x8x1_SE_AF0EM8_GRVW8_GSU1_SU0_SUS256_SRVW4_VAW2_WG64_4_1_WGM1
    SolutionIndex: 552
    SolutionNameMin: Cijk_Ailk_Bjlk_HBH_MT128x64x32_MI32x32x8x1_SE_AF0EM8_GRVW4_GSU1_SU0_SUS256_SRVW4_VAW2_WG64_4_1_WGM2
    SolutionIndex: 553
    SolutionNameMin: Cijk_Ailk_Bjlk_HBH_MT64x16x64_MI16x16x16x1_SE_AF0EM8_GRVW2_GSU15_SU0_SUS256_SRVW0_VAW1_WG64_4_1_WGM15
    SolutionIndex: 554
    SolutionNameMin: Cijk_Ailk_Bjlk_HBH_MT128x128x64_MI32x32x8x1_SE_AF0EM8_GRVW8_GSU3_SU32_SUS256_SRVW0_VAW1_WG64_4_1_WGM1
    SolutionIndex: 555
    SolutionNameMin: Cijk_Ailk_Bjlk_HBH_MT64x128x16_MI32x32x8x1_SE_AF0EM8_GRVW8_GSU1_SU0_SUS256_SRVW4_VAW2_WG64_4_1_WGM1
    SolutionIndex: 556
    SolutionNameMin: Cijk_Ailk_Bjlk_HBH_MT128x64x16_MI32x32x8x1_SE_AF0EM8_GRVW4_GSU1_SU32_SUS256_SRVW4_VAW2_WG64_4_1_WGM2
    SolutionIndex: 557
    SolutionNameMin: Cijk_Ailk_Bjlk_HBH_MT128x64x16_MI32x32x8x1_SE_AF0EM8_GRVW4_GSU1_SU0_SUS256_SRVW4_VAW2_WG64_4_1_WGM2
    SolutionIndex: 558
    SolutionNameMin: Cijk_Ailk_Bjlk_HBH_MT64x16x64_MI16x16x16x1_SE_AF0EM8_GRVW2_GSU15_SU32_SUS128_SRVW0_VAW1_WG64_4_1_WGM1
    SolutionIndex: 559
    SolutionNameMin: Cijk_Ailk_Bjlk_HBH_MT128x96x64_MI32x32x8x1_SE_AF0EM8_GRVW8_GSU1_SU32_SUS256_SRVW4_VAW2_WG128_2_1_WGM2
    SolutionIndex: 560
    SolutionNameMin: Cijk_Ailk_Bjlk_HBH_MT128x256x32_MI32x32x8x1_SE_AF0EM1_GRVW8_GSU7_SU32_SUS128_SRVW0_VAW1_WG64_4_1_WGM2
    SolutionIndex: 561
    SolutionNameMin: Cijk_Ailk_Bjlk_HBH_MT16x64x64_MI16x16x16x1_SE_AF0EM1_GRVW8_GSU15_SU0_SUS256_SRVW0_VAW1_WG16_16_1_WGM15
    SolutionIndex: 562
    SolutionNameMin: Cijk_Ailk_Bjlk_HBH_MT128x256x16_MI32x32x8x1_SE_AF0EM1_GRVW8_GSU1_SU0_SUS256_SRVW4_VAW2_WG64_4_1_WGM2
    SolutionIndex: 563
    SolutionNameMin: Cijk_Ailk_Bjlk_HBH_MT64x128x16_MI32x32x8x1_SE_AF0EM1_GRVW4_GSU1_SU0_SUS256_SRVW4_VAW2_WG64_4_1_WGM15
    SolutionIndex: 564
    SolutionNameMin: Cijk_Ailk_Bjlk_HBH_MT64x128x16_MI32x32x8x1_SE_AF0EM1_GRVW8_GSU1_SU0_SUS256_SRVW4_VAW2_WG64_4_1_WGM1
    SolutionIndex: 565
    SolutionNameMin: Cijk_Ailk_Bjlk_HBH_MT128x64x16_MI32x32x8x1_SE_AF0EM1_GRVW2_GSU1_SU32_SUS128_SRVW4_VAW2_WG64_4_1_WGM1
    SolutionIndex: 566
    SolutionNameMin: Cijk_Ailk_Bjlk_HBH_MT128x64x16_MI32x32x8x1_SE_AF0EM1_GRVW2_GSU1_SU0_SUS256_SRVW4_VAW2_WG64_4_1_WGM2
    SolutionIndex: 567
    SolutionNameMin: Cijk_Ailk_Bjlk_HBH_MT64x64x64_MI32x32x8x1_SE_AF0EM1_GRVW8_GSU1_SU0_SUS256_SRVW4_VAW2_WG64_4_1_WGM1
    SolutionIndex: 568
    SolutionNameMin: Cijk_Ailk_Bjlk_HBH_MT32x32x64_MI16x16x16x1_SE_AF0EM1_GRVW8_GSU1_SU0_SUS256_SRVW4_VAW2_WG32_8_1_WGM2
    SolutionIndex: 569
    SolutionNameMin: Cijk_Ailk_Bjlk_HBH_MT128x256x16_MI32x32x8x1_SE_AF0EM1_GRVW8_GSU1_SU0_SUS256_SRVW4_VAW2_WG64_4_1_WGM15
    SolutionIndex: 570
    SolutionNameMin: Cijk_Ailk_Bjlk_HBH_MT128x128x32_MI32x32x8x1_SE_AF0EM1_GRVW8_GSU1_SU0_SUS256_SRVW4_VAW2_WG64_4_1_WGM2
    SolutionIndex: 571
    SolutionNameMin: Cijk_Ailk_Bjlk_HBH_MT128x128x32_MI32x32x8x1_SE_AF0EM1_GRVW8_GSU1_SU0_SUS256_SRVW4_VAW2_WG64_4_1_WGM15
    SolutionIndex: 572
    SolutionNameMin: Cijk_Ailk_Bjlk_HBH_MT64x128x16_MI32x32x8x1_SE_AF0EM1_GRVW8_GSU1_SU32_SUS256_SRVW4_VAW2_WG64_4_1_WGM1
    SolutionIndex: 573
    SolutionNameMin: Cijk_Ailk_Bjlk_HBH_MT64x128x16_MI32x32x8x1_SE_AF0EM1_GRVW8_GSU1_SU0_SUS256_SRVW4_VAW2_WG64_4_1_WGM15
    SolutionIndex: 574
    SolutionNameMin: Cijk_Ailk_Bjlk_HBH_MT64x128x64_MI32x32x8x1_SE_AF0EM1_GRVW8_GSU1_SU0_SUS256_SRVW4_VAW2_WG64_4_1_WGM1
    SolutionIndex: 575
    SolutionNameMin: Cijk_Ailk_Bjlk_HBH_MT64x128x32_MI32x32x8x1_SE_AF0EM1_GRVW8_GSU1_SU32_SUS128_SRVW4_VAW2_WG64_4_1_WGM2
- - - [64, 448, 1, 3328]
    - [10, 1.084]
  - - [1, 64, 1, 256]
    - [20, 0.0]
  - - [3584, 64, 1, 1280]
    - [17, 4.354]
  - - [64, 128, 1, 256]
    - [1, 0.158]
  - - [64, 5888, 1, 1280]
    - [17, 5.261]
  - - [64, 4288, 1, 1280]
    - [18, 4.395]
  - - [3584, 64, 1, 3328]
    - [17, 4.663]
  - - [64, 1024, 1, 3328]
    - [18, 2.468]
  - - [1, 64, 1, 1280]
    - [22, 0.001]
  - - [704, 64, 1, 3328]
    - [10, 1.617]
  - - [64, 448, 1, 1280]
    - [6, 0.993]
  - - [64, 704, 1, 3328]
    - [11, 1.645]
  - - [64, 64, 1, 1280]
    - [9, 0.136]
  - - [64, 5056, 1, 256]
    - [0, 3.674]
  - - [64, 4288, 1, 3328]
    - [17, 4.673]
  - - [1856, 64, 1, 3328]
    - [18, 4.101]
  - - [1, 64, 1, 1]
    - [19, 0.0]
  - - [448, 64, 1, 1280]
    - [5, 0.993]
  - - [5888, 64, 1, 1280]
    - [17, 5.218]
  - - [2944, 64, 1, 256]
    - [1, 2.931]
  - - [64, 1856, 1, 256]
    - [12, 2.453]
  - - [64, 1024, 1, 1280]
    - [18, 2.295]
  - - [64, 256, 1, 1280]
    - [10, 0.582]
  - - [704, 64, 1, 1280]
    - [3, 1.405]
  - - [64, 128, 1, 1280]
    - [5, 0.264]
  - - [2368, 64, 1, 256]
    - [5, 2.593]
  - - [2368, 64, 1, 3328]
    - [18, 3.966]
  - - [64, 1408, 1, 3328]
    - [11, 3.118]
  - - [1856, 64, 1, 1280]
    - [18, 3.63]
  - - [64, 3584, 1, 1280]
    - [4, 4.504]
  - - [448, 64, 1, 3328]
    - [10, 1.085]
  - - [5888, 64, 1, 3328]
    - [17, 5.505]
  - - [128, 64, 1, 256]
    - [16, 0.158]
  - - [64, 128, 1, 3328]
    - [6, 0.295]
  - - [64, 256, 1, 3328]
    - [13, 0.619]
  - - [4288, 64, 1, 3328]
    - [17, 4.645]
  - - [64, 2944, 1, 256]
    - [16, 3.113]
  - - [6784, 64, 1, 256]
    - [17, 4.464]
  - - [1024, 64, 1, 1280]
    - [18, 2.336]
  - - [64, 2368, 1, 1280]
    - [6, 3.751]
  - - [64, 3584, 1, 3328]
    - [17, 4.657]
  - - [64, 6784, 1, 3328]
    - [17, 5.581]
  - - [3584, 64, 1, 256]
    - [17, 3.271]
  - - [64, 1856, 1, 3328]
    - [18, 4.079]
  - - [448, 64, 1, 256]
    - [5, 0.63]
  - - [64, 5056, 1, 3328]
    - [17, 5.401]
  - - [256, 64, 1, 256]
    - [1, 0.381]
  - - [4288, 64, 1, 1280]
    - [17, 4.516]
  - - [1, 1, 1, 1]
    - [21, 0.0]
  - - [5056, 64, 1, 1280]
    - [18, 5.161]
  - - [1024, 64, 1, 3328]
    - [17, 2.43]
  - - [1408, 64, 1, 256]
    - [16, 1.877]
  - - [64, 1408, 1, 256]
    - [7, 1.91]
  - - [64, 2368, 1, 3328]
    - [6, 3.973]
  - - [64, 448, 1, 256]
    - [5, 0.66]
  - - [64, 6784, 1, 1280]
    - [18, 5.345]
  - - [64, 1856, 1, 1280]
    - [14, 3.63]
  - - [64, 6784, 1, 256]
    - [17, 4.426]
  - - [64, 5056, 1, 1280]
    - [18, 5.047]
  - - [64, 4288, 1, 256]
    - [16, 3.497]
  - - [128, 64, 1, 1280]
    - [5, 0.258]
  - - [5888, 64, 1, 256]
    - [16, 3.858]
  - - [64, 5888, 1, 3328]
    - [17, 5.567]
  - - [64, 1024, 1, 256]
    - [11, 1.427]
  - - [5056, 64, 1, 3328]
    - [17, 5.504]
  - - [256, 64, 1, 1280]
    - [10, 0.574]
  - - [64, 256, 1, 256]
    - [5, 0.374]
  - - [704, 64, 1, 256]
    - [5, 0.981]
  - - [64, 1408, 1, 1280]
    - [18, 2.894]
  - - [1, 1, 1, 256]
    - [20, 0.0]
  - - [64, 704, 1, 256]
    - [8, 1.009]
  - - [64, 2944, 1, 3328]
    - [18, 4.919]
  - - [64, 64, 1, 256]
    - [1, 0.08]
  - - [1856, 64, 1, 256]
    - [17, 2.541]
  - - [128, 64, 1, 3328]
    - [17, 0.294]
  - - [2944, 64, 1, 1280]
    - [17, 4.434]
  - - [4288, 64, 1, 256]
    - [18, 3.424]
  - - [1, 1, 1, 1280]
    - [22, 0.0]
  - - [64, 2944, 1, 1280]
    - [18, 4.634]
  - - [1408, 64, 1, 1280]
    - [18, 2.902]
  - - [6784, 64, 1, 3328]
    - [17, 5.551]
  - - [1024, 64, 1, 256]
    - [18, 1.555]
  - - [64, 2368, 1, 256]
    - [7, 2.71]
  - - [64, 3584, 1, 256]
    - [2, 3.351]
  - - [2944, 64, 1, 3328]
    - [18, 4.911]
  - - [2368, 64, 1, 1280]
    - [5, 3.667]
  - - [256, 64, 1, 3328]
    - [10, 0.62]
  - - [64, 64, 1, 3328]
    - [17, 0.152]
  - - [1, 1, 1, 3328]
    - [22, 0.0]
  - - [64, 5888, 1, 256]
    - [17, 4.104]
  - - [64, 704, 1, 1280]
    - [13, 1.483]
  - - [6784, 64, 1, 1280]
    - [17, 5.269]
  - - [5056, 64, 1, 256]
    - [15, 3.461]
  - - [1408, 64, 1, 3328]
    - [18, 3.091]
  - - [4096, 7133, 1, 4096]
    - [28, 14.1]
  - - [512, 16, 1, 512]
    - [25, 0.198]
  - - [2048, 7133, 1, 2048]
    - [26, 13.977]
  - - [2560, 7133, 1, 2560]
    - [27, 13.724]
  - - [1024, 1024, 1, 1024]
    - [181, 42.044]
  - - [3072, 7435, 1, 1024]
    - [26, 13.851]
  - - [1024, 32, 1, 512]
    - [23, 0.674]
  - - [1760, 7133, 1, 1760]
    - [27, 13.094]
  - - [7680, 5481, 1, 2560]
    - [26, 13.968]
  - - [1024, 16, 1, 512]
    - [23, 0.333]
  - - [512, 32, 1, 512]
    - [24, 0.387]
  - - [3136, 256, 64, 64]
    - [342, 32.223]
  - - [784, 512, 64, 128]
    - [335, 43.161]
  - - [784, 128, 64, 512]
    - [446, 50.531]
  - - [3136, 64, 128, 64]
    - [534, 21.58]
  - - [196, 256, 128, 1024]
    - [570, 44.925]
  - - [196, 256, 64, 1024]
    - [354, 36.635]
  - - [196, 1024, 128, 256]
    - [569, 36.766]
  - - [784, 128, 256, 512]
    - [445, 54.636]
  - - [3136, 64, 64, 256]
    - [502, 31.21]
  - - [3136, 64, 256, 256]
    - [502, 32.746]
  - - [3136, 256, 256, 64]
    - [533, 34.374]
  - - [3136, 64, 128, 256]
    - [502, 32.257]
  - - [784, 128, 128, 512]
    - [503, 53.706]
  - - [784, 512, 128, 128]
    - [535, 46.276]
  - - [784, 512, 256, 128]
    - [536, 48.731]
  - - [196, 1024, 64, 256]
    - [162, 35.741]
  - - [3136, 64, 64, 64]
    - [340, 19.983]
  - - [196, 1024, 256, 256]
    - [569, 38.097]
  - - [196, 256, 256, 1024]
    - [571, 50.489]
  - - [3136, 256, 128, 64]
    - [503, 33.577]
  - - [3136, 64, 256, 64]
    - [508, 22.611]
  - - [14, 64, 1, 14]
    - [38, 0.001]
  - - [15, 64, 1, 14]
    - [38, 0.001]
  - - [15, 64, 1, 15]
    - [38, 0.001]
  - - [15, 64, 1, 15]
    - [38, 0.001]
  - - [17, 64, 1, 15]
    - [38, 0.002]
  - - [17, 64, 1, 17]
    - [38, 0.002]
  - - [17, 64, 1, 17]
    - [38, 0.002]
  - - [21, 64, 1, 17]
    - [44, 0.003]
  - - [21, 64, 1, 21]
    - [38, 0.003]
  - - [24, 64, 1, 24]
    - [38, 0.004]
  - - [30, 64, 1, 30]
    - [51, 0.007]
  - - [30, 64, 1, 31]
    - [44, 0.007]
  - - [31, 64, 1, 31]
    - [45, 0.007]
  - - [32, 64, 1, 32]
    - [44, 0.007]
  - - [32, 64, 1, 35]
    - [41, 0.007]
  - - [34, 64, 1, 24]
    - [52, 0.007]
  - - [34, 64, 1, 34]
    - [44, 0.008]
  - - [35, 64, 1, 35]
    - [47, 0.008]
  - - [64, 14, 1, 14]
    - [38, 0.001]
  - - [64, 15, 1, 14]
    - [39, 0.001]
  - - [64, 15, 1, 15]
    - [39, 0.001]
  - - [64, 15, 1, 15]
    - [39, 0.001]
  - - [64, 17, 1, 15]
    - [38, 0.001]
  - - [64, 17, 1, 17]
    - [48, 0.002]
  - - [64, 17, 1, 17]
    - [43, 0.002]
  - - [64, 21, 1, 17]
    - [39, 0.002]
  - - [64, 21, 1, 21]
    - [39, 0.003]
  - - [64, 24, 1, 24]
    - [39, 0.004]
  - - [64, 30, 1, 30]
    - [40, 0.005]
  - - [64, 30, 1, 31]
    - [39, 0.005]
  - - [64, 31, 1, 31]
    - [42, 0.006]
  - - [64, 32, 1, 32]
    - [41, 0.007]
  - - [64, 32, 1, 35]
    - [43, 0.007]
  - - [64, 34, 1, 24]
    - [39, 0.005]
  - - [64, 34, 1, 34]
    - [40, 0.007]
  - - [64, 35, 1, 35]
    - [40, 0.007]
  - - [64, 128, 512, 128]
    - [228, 18.073]
  - - [64, 512, 1, 512]
    - [240, 2.151]
  - - [64, 512, 64, 512]
    - [386, 28.628]
  - - [128, 64, 512, 128]
    - [403, 17.691]
  - - [512, 64, 1, 512]
    - [239, 2.151]
  - - [512, 64, 64, 512]
    - [404, 28.386]
  - - [1024, 2, 1, 4]
    - [190, 0.002]
  - - [1024, 2, 1, 32]
    - [229, 0.019]
  - - [1024, 2, 1, 2048]
    - [387, 0.319]
  - - [1024, 1024, 1, 4]
    - [201, 0.818]
  - - [1024, 1024, 1, 32]
    - [230, 7.659]
  - - [1024, 1024, 1, 2048]
    - [198, 43.312]
  - - [1024, 1024, 1, 4096]
    - [181, 46.36]
  - - [1024, 4096, 1, 2048]
    - [192, 70.146]
  - - [1024, 4096, 1, 4096]
    - [179, 73.413]
  - - [1024, 30528, 1, 2048]
    - [231, 87.338]
  - - [1024, 30528, 1, 4096]
    - [231, 91.492]
  - - [4096, 1024, 1, 2048]
    - [388, 66.381]
  - - [4096, 1024, 1, 4096]
    - [388, 73.38]
  - - [3, 64, 512, 3]
    - [320, 0.049]
  - - [5, 64, 512, 5]
    - [321, 0.137]
  - - [5, 64, 960, 5]
    - [318, 0.189]
  - - [9, 64, 512, 9]
    - [318, 0.443]
  - - [13, 512, 1, 32768]
    - [309, 4.942]
  - - [27, 128, 32768, 27]
    - [322, 5.364]
  - - [33, 32, 200, 33]
    - [323, 1.254]
  - - [33, 32, 1600, 33]
    - [324, 2.982]
  - - [67, 2048, 1, 512]
    - [325, 6.383]
  - - [74, 2048, 1, 512]
    - [317, 7.119]
  - - [74, 2048, 1, 960]
    - [326, 8.509]
  - - [100, 2048, 1, 512]
    - [327, 8.608]
  - - [256, 128, 1, 32768]
    - [398, 22.89]
  - - [256, 1280, 1, 8976]
    - [422, 40.301]
  - - [256, 2560, 1, 8976]
    - [423, 52.68]
  - - [256, 2816, 1, 8976]
    - [424, 53.119]
  - - [256, 3328, 1, 8976]
    - [425, 54.882]
  - - [256, 3584, 1, 8976]
    - [425, 56.754]
  - - [256, 3840, 1, 8976]
    - [426, 59.067]
  - - [256, 4096, 1, 8976]
    - [412, 55.854]
  - - [256, 4352, 1, 8976]
    - [413, 58.091]
  - - [256, 4864, 1, 8976]
    - [427, 65.413]
  - - [256, 5120, 1, 8976]
    - [428, 68.344]
  - - [256, 5632, 1, 8976]
    - [429, 66.508]
  - - [256, 5888, 1, 8976]
    - [430, 65.032]
  - - [256, 6144, 1, 8976]
    - [431, 67.72]
  - - [256, 7168, 1, 8976]
    - [432, 69.842]
  - - [256, 8192, 1, 8976]
    - [433, 66.226]
  - - [256, 8960, 1, 8976]
    - [434, 70.603]
  - - [256, 9728, 1, 8976]
    - [435, 70.128]
  - - [256, 9984, 1, 8976]
    - [436, 71.613]
  - - [256, 10240, 1, 8976]
    - [437, 73.036]
  - - [256, 10496, 1, 8976]
    - [438, 63.651]
  - - [256, 11008, 1, 8976]
    - [439, 65.175]
  - - [256, 11264, 1, 8976]
    - [439, 66.691]
  - - [256, 11520, 1, 8976]
    - [440, 68.132]
  - - [256, 11776, 1, 8976]
    - [439, 69.55]
  - - [256, 12544, 1, 8976]
    - [441, 73.903]
  - - [256, 12800, 1, 8976]
    - [251, 75.681]
  - - [256, 13312, 1, 8976]
    - [442, 79.984]
  - - [256, 13568, 1, 8976]
    - [443, 81.842]
  - - [256, 14336, 1, 8976]
    - [443, 86.257]
  - - [256, 14848, 1, 8976]
    - [253, 89.163]
  - - [256, 15104, 1, 8976]
    - [253, 90.473]
  - - [256, 15872, 1, 8976]
    - [444, 83.247]
  - - [256, 16128, 1, 8976]
    - [444, 84.507]
  - - [256, 17152, 1, 8976]
    - [187, 89.199]
  - - [256, 17408, 1, 8976]
    - [415, 82.021]
  - - [256, 18688, 1, 8976]
    - [388, 87.783]
  - - [256, 19968, 1, 8976]
    - [255, 70.694]
  - - [256, 20480, 1, 8976]
    - [255, 70.713]
  - - [256, 20992, 1, 8976]
    - [445, 73.305]
  - - [256, 21248, 1, 8976]
    - [256, 72.024]
  - - [256, 22016, 1, 8976]
    - [446, 73.435]
  - - [256, 26112, 1, 8976]
    - [447, 80.608]
  - - [256, 32512, 1, 8976]
    - [448, 84.427]
  - - [256, 32768, 1, 1]
    - [399, 0.47]
  - - [256, 33536, 1, 8976]
    - [448, 87.233]
  - - [256, 44505, 1, 8976]
    - [443, 87.665]
  - - [257, 4096, 1, 1024]
    - [328, 27.045]
  - - [480, 1024, 1, 32768]
    - [449, 69.975]
  - - [512, 32, 1, 200]
    - [239, 0.502]
  - - [512, 32, 1, 1600]
    - [421, 1.902]
  - - [512, 256, 1, 32768]
    - [400, 47.231]
  - - [512, 512, 1, 200]
    - [258, 5.983]
  - - [512, 512, 1, 1600]
    - [245, 19.528]
  - - [512, 2048, 1, 256]
    - [224, 22.837]
  - - [560, 1024, 1, 200]
    - [259, 11.418]
  - - [560, 1024, 1, 1600]
    - [244, 29.71]
  - - [768, 2048, 1, 256]
    - [260, 32.207]
  - - [1024, 64, 1, 512]
    - [240, 4.302]
  - - [1024, 64, 1, 960]
    - [241, 5.165]
  - - [1024, 256, 1, 1024]
    - [183, 17.325]
  - - [1024, 256, 1, 1280]
    - [261, 18.151]
  - - [1024, 256, 1, 2304]
    - [450, 18.175]
  - - [1024, 256, 1, 2816]
    - [451, 20.998]
  - - [1024, 256, 1, 3072]
    - [451, 21.845]
  - - [1024, 256, 1, 3328]
    - [452, 22.934]
  - - [1024, 256, 1, 3584]
    - [453, 23.572]
  - - [1024, 256, 1, 4096]
    - [454, 25.7]
  - - [1024, 256, 1, 4352]
    - [454, 27.446]
  - - [1024, 256, 1, 4608]
    - [455, 27.913]
  - - [1024, 256, 1, 5120]
    - [456, 29.143]
  - - [1024, 256, 1, 5376]
    - [454, 30.6]
  - - [1024, 256, 1, 5632]
    - [457, 30.979]
  - - [1024, 256, 1, 6144]
    - [455, 32.276]
  - - [1024, 256, 1, 6400]
    - [458, 33.194]
  - - [1024, 256, 1, 7680]
    - [459, 35.684]
  - - [1024, 256, 1, 7936]
    - [457, 36.873]
  - - [1024, 256, 1, 8192]
    - [457, 36.943]
  - - [1024, 256, 1, 8448]
    - [460, 38.027]
  - - [1024, 256, 1, 9728]
    - [461, 39.188]
  - - [1024, 256, 1, 9984]
    - [462, 39.569]
  - - [1024, 256, 1, 10496]
    - [454, 40.108]
  - - [1024, 256, 1, 11520]
    - [463, 42.244]
  - - [1024, 256, 1, 12032]
    - [464, 43.536]
  - - [1024, 256, 1, 13568]
    - [465, 46.101]
  - - [1024, 256, 1, 14336]
    - [465, 47.398]
  - - [1024, 256, 1, 14848]
    - [465, 48.182]
  - - [1024, 256, 1, 15104]
    - [466, 48.755]
  - - [1024, 256, 1, 15872]
    - [466, 49.92]
  - - [1024, 256, 1, 16128]
    - [465, 49.581]
  - - [1024, 256, 1, 17152]
    - [464, 50.757]
  - - [1024, 256, 1, 17408]
    - [466, 51.145]
  - - [1024, 256, 1, 18944]
    - [464, 53.603]
  - - [1024, 256, 1, 19712]
    - [464, 53.851]
  - - [1024, 256, 1, 19968]
    - [465, 54.672]
  - - [1024, 256, 1, 21248]
    - [466, 55.395]
  - - [1024, 256, 1, 21504]
    - [467, 54.33]
  - - [1024, 256, 1, 22016]
    - [464, 57.034]
  - - [1024, 256, 1, 28672]
    - [465, 62.803]
  - - [1024, 256, 1, 33536]
    - [465, 63.876]
  - - [1024, 512, 1, 32768]
    - [401, 69.27]
  - - [1024, 1024, 1, 200]
    - [186, 16.774]
  - - [1024, 1024, 1, 512]
    - [181, 32.002]
  - - [1024, 1024, 1, 960]
    - [197, 38.928]
  - - [1024, 1024, 1, 1600]
    - [207, 41.757]
  - - [1024, 1024, 1, 32768]
    - [402, 76.723]
  - - [1600, 1024, 1, 512]
    - [243, 41.536]
  - - [1600, 1024, 1, 960]
    - [269, 49.394]
  - - [2048, 256, 1, 1024]
    - [270, 25.121]
  - - [2048, 960, 1, 1]
    - [271, 0.347]
  - - [2048, 2048, 1, 512]
    - [242, 54.91]
  - - [2048, 2048, 1, 960]
    - [242, 61.073]
  - - [2048, 2048, 1, 1024]
    - [242, 60.9]
  - - [3200, 2048, 1, 1024]
    - [272, 67.602]
  - - [4096, 4096, 1, 1024]
    - [273, 70.888]
  - - [14, 64, 10880, 14]
    - [310, 1.906]
  - - [15, 64, 10880, 14]
    - [311, 1.98]
  - - [15, 64, 7680, 15]
    - [311, 2.042]
  - - [15, 64, 10880, 15]
    - [310, 2.104]
  - - [17, 64, 7680, 15]
    - [120, 2.033]
  - - [17, 64, 6144, 17]
    - [113, 1.896]
  - - [17, 64, 7680, 17]
    - [312, 2.033]
  - - [21, 64, 6144, 17]
    - [313, 2.253]
  - - [21, 64, 6144, 21]
    - [314, 2.718]
  - - [24, 64, 4736, 24]
    - [135, 4.311]
  - - [30, 64, 2048, 30]
    - [315, 4.044]
  - - [30, 64, 2048, 31]
    - [315, 4.21]
  - - [31, 64, 2048, 31]
    - [315, 4.21]
  - - [32, 64, 4608, 32]
    - [235, 7.517]
  - - [32, 64, 4608, 35]
    - [97, 5.865]
  - - [34, 64, 4736, 24]
    - [316, 3.628]
  - - [34, 64, 4736, 34]
    - [107, 4.455]
  - - [35, 64, 4608, 35]
    - [157, 4.391]
  - - [64, 14, 10880, 14]
    - [121, 2.322]
  - - [64, 15, 10880, 14]
    - [121, 2.47]
  - - [64, 15, 7680, 15]
    - [121, 2.5]
  - - [64, 15, 10880, 15]
    - [121, 2.618]
  - - [64, 17, 7680, 15]
    - [121, 2.793]
  - - [64, 17, 6144, 17]
    - [102, 2.385]
  - - [64, 17, 7680, 17]
    - [143, 2.68]
  - - [64, 21, 6144, 17]
    - [140, 2.825]
  - - [64, 21, 6144, 21]
    - [155, 3.424]
  - - [64, 24, 4736, 24]
    - [236, 4.392]
  - - [64, 30, 2048, 30]
    - [417, 4.821]
  - - [64, 30, 2048, 31]
    - [418, 5.003]
  - - [64, 31, 2048, 31]
    - [419, 5.148]
  - - [64, 32, 4608, 32]
    - [237, 7.618]
  - - [64, 32, 4608, 35]
    - [97, 5.757]
  - - [64, 34, 4736, 24]
    - [238, 4.733]
  - - [64, 34, 4736, 34]
    - [228, 5.272]
  - - [64, 35, 4608, 35]
    - [420, 5.333]
  - - [1024, 1024, 1, 3840]
    - [207, 46.578]
  - - [1024, 1024, 1, 3968]
    - [233, 47.659]
  - - [1024, 1024, 1, 6528]
    - [411, 49.929]
  - - [1024, 1024, 1, 7104]
    - [412, 51.83]
  - - [1024, 1024, 1, 7200]
    - [406, 53.122]
  - - [1024, 1024, 1, 8064]
    - [406, 53.794]
  - - [1024, 1024, 1, 8160]
    - [406, 54.067]
  - - [1024, 1024, 1, 9216]
    - [413, 56.417]
  - - [1024, 1024, 1, 9520]
    - [414, 55.906]
  - - [1024, 1024, 1, 10064]
    - [409, 56.724]
  - - [1024, 1024, 1, 10080]
    - [406, 57.11]
  - - [1024, 1024, 1, 10200]
    - [410, 56.137]
  - - [1024, 4096, 1, 3840]
    - [179, 72.604]
  - - [1024, 4096, 1, 3968]
    - [179, 73.468]
  - - [1024, 4096, 1, 6528]
    - [179, 76.671]
  - - [1024, 4096, 1, 7104]
    - [179, 77.221]
  - - [1024, 4096, 1, 7200]
    - [179, 77.216]
  - - [1024, 4096, 1, 8064]
    - [179, 77.713]
  - - [1024, 4096, 1, 8160]
    - [179, 77.798]
  - - [1024, 4096, 1, 9216]
    - [179, 78.571]
  - - [1024, 4096, 1, 9520]
    - [388, 77.301]
  - - [1024, 4096, 1, 10064]
    - [179, 78.038]
  - - [1024, 4096, 1, 10080]
    - [388, 78.224]
  - - [1024, 4096, 1, 10200]
    - [179, 78.181]
  - - [1024, 42720, 1, 3968]
    - [179, 91.6]
  - - [1024, 42720, 1, 6528]
    - [388, 93.224]
  - - [1024, 42720, 1, 7104]
    - [415, 92.907]
  - - [1024, 42720, 1, 7200]
    - [179, 93.153]
  - - [1024, 42720, 1, 9520]
    - [388, 92.661]
  - - [1024, 42720, 1, 10080]
    - [388, 93.172]
  - - [4096, 1024, 1, 3840]
    - [179, 73.097]
  - - [4096, 1024, 1, 3968]
    - [179, 73.398]
  - - [4096, 1024, 1, 6528]
    - [179, 74.035]
  - - [4096, 1024, 1, 7104]
    - [390, 74.498]
  - - [4096, 1024, 1, 7200]
    - [388, 75.083]
  - - [4096, 1024, 1, 8064]
    - [416, 75.869]
  - - [4096, 1024, 1, 8160]
    - [390, 75.08]
  - - [4096, 1024, 1, 9216]
    - [416, 76.852]
  - - [4096, 1024, 1, 9520]
    - [390, 75.247]
  - - [4096, 1024, 1, 10064]
    - [390, 75.445]
  - - [4096, 1024, 1, 10080]
    - [209, 76.693]
  - - [4096, 1024, 1, 10200]
    - [416, 76.377]
  - - [27, 64, 1920, 27]
    - [55, 2.881]
  - - [27, 64, 1920, 33]
    - [61, 3.326]
  - - [33, 64, 1920, 33]
    - [60, 3.901]
  - - [64, 27, 1920, 27]
    - [68, 2.563]
  - - [64, 27, 1920, 33]
    - [56, 2.987]
  - - [64, 33, 1920, 33]
    - [54, 3.488]
  - - [1024, 1024, 1, 3240]
    - [64, 33.538]
  - - [1024, 1024, 1, 3960]
    - [65, 35.455]
  - - [1024, 4096, 1, 3240]
    - [57, 48.172]
  - - [1024, 4096, 1, 3960]
    - [59, 49.597]
  - - [1024, 42720, 1, 3960]
    - [62, 76.971]
  - - [4096, 1024, 1, 3240]
    - [63, 48.503]
  - - [4096, 1024, 1, 3960]
    - [67, 49.111]
  - - [64, 1280, 64, 192]
    - [509, 27.227]
  - - [64, 1280, 64, 320]
    - [510, 31.848]
  - - [64, 1280, 64, 384]
    - [511, 33.17]
  - - [64, 1280, 64, 448]
    - [474, 34.67]
  - - [64, 2048, 64, 192]
    - [512, 28.71]
  - - [64, 2048, 64, 320]
    - [392, 32.625]
  - - [64, 2048, 64, 384]
    - [346, 33.795]
  - - [64, 2048, 64, 448]
    - [347, 35.597]
  - - [1225, 192, 64, 32]
    - [363, 13.578]
  - - [1225, 192, 64, 48]
    - [364, 17.841]
  - - [1225, 192, 64, 64]
    - [365, 21.114]
  - - [1225, 256, 64, 48]
    - [366, 19.599]
  - - [1225, 256, 64, 64]
    - [361, 23.117]
  - - [1225, 288, 64, 48]
    - [367, 19.927]
  - - [1225, 288, 64, 64]
    - [367, 24.814]
  - - [5329, 64, 64, 80]
    - [565, 20.1]
  - - [289, 768, 64, 128]
    - [368, 29.748]
  - - [289, 768, 64, 160]
    - [369, 33.39]
  - - [289, 768, 64, 192]
    - [370, 36.358]
  - - [64, 1280, 32, 192]
    - [513, 25.461]
  - - [64, 1280, 32, 320]
    - [513, 30.665]
  - - [64, 1280, 32, 384]
    - [513, 31.826]
  - - [64, 1280, 32, 448]
    - [514, 33.61]
  - - [64, 2048, 32, 192]
    - [515, 25.29]
  - - [64, 2048, 32, 320]
    - [474, 29.211]
  - - [64, 2048, 32, 384]
    - [516, 30.698]
  - - [64, 2048, 32, 448]
    - [350, 31.799]
  - - [1225, 192, 32, 32]
    - [371, 12.118]
  - - [1225, 192, 32, 48]
    - [372, 15.509]
  - - [1225, 192, 32, 64]
    - [373, 17.96]
  - - [1225, 256, 32, 48]
    - [361, 18.104]
  - - [1225, 256, 32, 64]
    - [374, 21.163]
  - - [1225, 288, 32, 48]
    - [375, 16.627]
  - - [1225, 288, 32, 64]
    - [375, 20.49]
  - - [5329, 64, 32, 80]
    - [566, 18.403]
  - - [289, 768, 32, 128]
    - [376, 26.504]
  - - [289, 768, 32, 160]
    - [368, 29.957]
  - - [289, 768, 32, 192]
    - [377, 31.825]
  - - [49, 512, 64, 2048]
    - [564, 26.302]
  - - [49, 2048, 64, 512]
    - [362, 25.101]
  - - [3136, 64, 32, 256]
    - [507, 29.086]
  - - [3136, 64, 32, 64]
    - [508, 17.406]
  - - [3136, 256, 32, 64]
    - [333, 30.111]
  - - [784, 128, 32, 512]
    - [446, 46.346]
  - - [784, 512, 32, 128]
    - [341, 38.954]
  - - [196, 256, 32, 1024]
    - [358, 31.53]
  - - [196, 1024, 32, 256]
    - [162, 30.052]
  - - [49, 512, 32, 2048]
    - [360, 22.107]
  - - [49, 2048, 32, 512]
    - [359, 21.825]
  - - [3136, 64, 64, 128]
    - [332, 24.618]
  - - [3136, 128, 64, 256]
    - [503, 49.998]
  - - [784, 256, 64, 512]
    - [504, 58.173]
  - - [3136, 256, 64, 128]
    - [505, 49.916]
  - - [3136, 256, 64, 256]
    - [504, 64.211]
  - - [196, 512, 64, 1024]
    - [351, 46.415]
  - - [784, 512, 64, 256]
    - [336, 54.904]
  - - [784, 512, 64, 512]
    - [334, 64.111]
  - - [196, 1024, 64, 512]
    - [162, 43.435]
  - - [196, 1024, 64, 1024]
    - [562, 49.774]
  - - [49, 1024, 64, 2048]
    - [352, 28.271]
  - - [49, 2048, 64, 1024]
    - [353, 29.378]
  - - [3136, 64, 32, 128]
    - [506, 22.171]
  - - [3136, 128, 32, 256]
    - [446, 47.126]
  - - [784, 256, 32, 512]
    - [503, 51.807]
  - - [3136, 256, 32, 128]
    - [338, 45.255]
  - - [3136, 256, 32, 256]
    - [503, 58.728]
  - - [196, 512, 32, 1024]
    - [354, 37.483]
  - - [784, 512, 32, 256]
    - [334, 49.957]
  - - [784, 512, 32, 512]
    - [339, 60.28]
  - - [196, 1024, 32, 512]
    - [355, 39.003]
  - - [196, 1024, 32, 1024]
    - [356, 45.422]
  - - [49, 1024, 32, 2048]
    - [563, 26.783]
  - - [49, 2048, 32, 1024]
    - [357, 26.035]
  - - [7680, 8192, 1, 8192]
    - [171, 95.591]
  - - [3840, 4096, 1, 4096]
    - [171, 93.517]
  - - [1920, 2048, 1, 2048]
    - [172, 81.828]
  - - [960, 1024, 1, 1024]
    - [173, 42.435]
  - - [480, 512, 1, 512]
    - [174, 13.381]
  - - [8192, 7680, 1, 8192]
    - [175, 95.372]
  - - [4096, 3840, 1, 4096]
    - [171, 93.315]
  - - [2048, 1920, 1, 2048]
    - [378, 84.869]
  - - [1024, 960, 1, 1024]
    - [177, 42.82]
  - - [512, 480, 1, 512]
    - [178, 13.692]
  - - [8192, 8192, 1, 8192]
    - [379, 92.398]
  - - [4096, 4096, 1, 4096]
    - [380, 82.407]
  - - [2048, 2048, 1, 2048]
    - [180, 73.213]
  - - [512, 512, 1, 512]
    - [182, 13.653]
  - - [64, 512, 16, 512]
    - [183, 19.031]
  - - [1024, 2, 1, 1]
    - [131, 0.001]
  - - [1024, 2, 1, 512]
    - [184, 0.126]
  - - [1024, 1024, 1, 1]
    - [185, 0.218]
  - - [1024, 1024, 1, 77]
    - [186, 10.35]
  - - [1024, 4096, 1, 512]
    - [187, 57.585]
  - - [1024, 30522, 1, 77]
    - [188, 28.223]
  - - [4096, 1024, 1, 512]
    - [189, 47.065]
  - - [64, 128, 160, 128]
    - [381, 14.674]
  - - [1024, 2, 1, 10]
    - [190, 0.005]
  - - [1024, 2, 1, 1280]
    - [382, 0.219]
  - - [1024, 1024, 1, 10]
    - [191, 1.924]
  - - [1024, 1024, 1, 1280]
    - [181, 41.048]
  - - [1024, 4096, 1, 1280]
    - [383, 66.458]
  - - [1024, 30522, 1, 200]
    - [193, 49.616]
  - - [4096, 1024, 1, 1280]
    - [384, 62.104]
  - - [64, 128, 624, 128]
    - [385, 18.333]
  - - [1024, 2, 1, 39]
    - [194, 0.018]
  - - [1024, 2, 1, 4992]
    - [195, 0.576]
  - - [1024, 1024, 1, 39]
    - [196, 6.714]
  - - [1024, 1024, 1, 780]
    - [197, 29.552]
  - - [1024, 1024, 1, 4992]
    - [198, 47.978]
  - - [1024, 4096, 1, 4992]
    - [179, 74.96]
  - - [1024, 30522, 1, 780]
    - [199, 70.83]
  - - [4096, 1024, 1, 4992]
    - [179, 75.189]
  - - [1024, 1024, 1, 308]
    - [196, 19.626]
  - - [1024, 30522, 1, 308]
    - [202, 57.417]
  - - [64, 128, 640, 128]
    - [389, 18.636]
  - - [1024, 2, 1, 40]
    - [203, 0.019]
  - - [1024, 2, 1, 5120]
    - [204, 0.598]
  - - [1024, 1024, 1, 40]
    - [205, 7.009]
  - - [1024, 1024, 1, 800]
    - [206, 31.912]
  - - [1024, 1024, 1, 5120]
    - [207, 48.449]
  - - [1024, 4096, 1, 5120]
    - [179, 75.269]
  - - [1024, 30522, 1, 800]
    - [208, 76.668]
  - - [4096, 1024, 1, 5120]
    - [390, 72.473]
  - - [64, 128, 656, 128]
    - [391, 18.713]
  - - [1024, 2, 1, 41]
    - [210, 0.019]
  - - [1024, 2, 1, 5248]
    - [211, 0.595]
  - - [1024, 1024, 1, 41]
    - [205, 6.596]
  - - [1024, 1024, 1, 820]
    - [212, 27.747]
  - - [1024, 1024, 1, 5248]
    - [181, 48.355]
  - - [1024, 4096, 1, 5248]
    - [388, 75.07]
  - - [1024, 30522, 1, 820]
    - [199, 72.416]
  - - [4096, 1024, 1, 5248]
    - [179, 74.125]
  - - [64, 512, 80, 512]
    - [392, 30.862]
  - - [1024, 2, 1, 5]
    - [210, 0.003]
  - - [1024, 2, 1, 2560]
    - [393, 0.363]
  - - [1024, 1024, 1, 5]
    - [214, 1.044]
  - - [1024, 1024, 1, 385]
    - [212, 22.759]
  - - [1024, 1024, 1, 2560]
    - [198, 45.02]
  - - [1024, 4096, 1, 2560]
    - [192, 71.469]
  - - [1024, 30522, 1, 385]
    - [215, 62.009]
  - - [4096, 1024, 1, 2560]
    - [394, 69.3]
  - - [64, 512, 96, 512]
    - [395, 31.666]
  - - [1024, 2, 1, 6]
    - [190, 0.003]
  - - [1024, 2, 1, 3072]
    - [211, 0.427]
  - - [1024, 1024, 1, 6]
    - [214, 1.226]
  - - [1024, 1024, 1, 462]
    - [212, 23.131]
  - - [1024, 1024, 1, 3072]
    - [396, 45.4]
  - - [1024, 4096, 1, 3072]
    - [192, 72.552]
  - - [1024, 30522, 1, 462]
    - [215, 62.91]
  - - [4096, 1024, 1, 3072]
    - [388, 70.722]
  - - [64, 128, 128, 128]
    - [216, 14.437]
  - - [1024, 2, 1, 8]
    - [217, 0.004]
  - - [1024, 2, 1, 1024]
    - [218, 0.178]
  - - [1024, 1024, 1, 8]
    - [214, 1.67]
  - - [1024, 1024, 1, 160]
    - [219, 18.256]
  - - [1024, 4096, 1, 1024]
    - [220, 64.516]
  - - [1024, 30522, 1, 160]
    - [221, 49.366]
  - - [4096, 1024, 1, 1024]
    - [180, 56.771]
  - - [64, 128, 144, 128]
    - [222, 14.568]
  - - [1024, 2, 1, 9]
    - [190, 0.004]
  - - [1024, 2, 1, 1152]
    - [223, 0.197]
  - - [1024, 1024, 1, 9]
    - [205, 1.732]
  - - [1024, 1024, 1, 180]
    - [196, 16.205]
  - - [1024, 1024, 1, 1152]
    - [224, 39.804]
  - - [1024, 4096, 1, 1152]
    - [192, 65.533]
  - - [1024, 30522, 1, 180]
    - [225, 46.264]
  - - [4096, 1024, 1, 1152]
    - [397, 59.891]
  - - [479, 1024, 1, 32768]
    - [560, 61.573]
  - - [4, 64, 32768, 4]
    - [104, 0.219]
  - - [4, 64, 38400, 4]
    - [104, 0.22]
  - - [64, 4, 32768, 4]
    - [124, 0.225]
  - - [64, 4, 38400, 4]
    - [124, 0.228]
  - - [1024, 1024, 1, 8192]
    - [405, 54.611]
  - - [1024, 1024, 1, 9600]
    - [406, 57.128]
  - - [1024, 4096, 1, 8192]
    - [179, 78.008]
  - - [1024, 4096, 1, 9600]
    - [388, 78.454]
  - - [1024, 33712, 1, 8192]
    - [134, 87.468]
  - - [1024, 33712, 1, 9600]
    - [407, 87.495]
  - - [4096, 1024, 1, 8192]
    - [390, 75.463]
  - - [4096, 1024, 1, 9600]
    - [408, 75.818]
  - - [64, 128, 1, 128]
    - [241, 0.252]
  - - [128, 64, 1, 128]
    - [240, 0.265]
  - - [5, 64, 1, 5]
    - [318, 0.001]
  - - [2048, 512, 1, 1]
    - [214, 0.213]
  - - [33, 32, 1, 33]
    - [319, 0.007]
  - - [1024, 1600, 1, 1]
    - [201, 0.301]
  - - [64, 1024, 32, 1024]
    - [100, 33.439]
  - - [2560, 1920, 1, 2048]
    - [254, 87.632]
  - - [1024, 3072, 1, 4096]
    - [176, 69.58]
  - - [2560, 2560, 1, 2048]
    - [280, 75.033]
  - - [2048, 2, 1, 2]
    - [274, 0.003]
  - - [1024, 64, 128, 1024]
    - [479, 39.776]
  - - [2048, 2048, 1, 2]
    - [468, 0.836]
  - - [1024, 64, 32, 1024]
    - [478, 33.72]
  - - [1024, 96, 64, 1024]
    - [284, 48.858]
  - - [1024, 30592, 1, 2048]
    - [278, 88.463]
  - - [1024, 3072, 1, 16384]
    - [378, 75.611]
  - - [6144, 1536, 1, 4096]
    - [254, 85.782]
  - - [1024, 1024, 1, 16]
    - [201, 4.026]
  - - [1536, 4608, 1, 8192]
    - [171, 86.211]
  - - [640, 2560, 1, 2048]
    - [112, 55.284]
  - - [1024, 4096, 1, 16384]
    - [388, 78.628]
  - - [64, 512, 40, 512]
    - [474, 26.954]
  - - [1024, 1024, 1, 16384]
    - [476, 66.299]
  - - [1536, 6144, 1, 4096]
    - [179, 85.925]
  - - [1024, 30592, 1, 4096]
    - [471, 92.029]
  - - [2560, 2560, 1, 4]
    - [281, 1.872]
  - - [1536, 1536, 1, 4096]
    - [282, 66.06]
  - - [2560, 7680, 1, 2048]
    - [388, 89.187]
  - - [64, 1024, 256, 1024]
    - [125, 40.682]
  - - [96, 1024, 64, 1024]
    - [255, 46.992]
  - - [1536, 50304, 1, 4096]
    - [175, 91.75]
  - - [2048, 8192, 1, 1024]
    - [249, 70.857]
  - - [1024, 30592, 1, 8192]
    - [469, 94.55]
  - - [512, 64, 256, 512]
    - [277, 33.948]
  - - [1024, 96, 128, 1024]
    - [212, 52.679]
  - - [64, 512, 128, 512]
    - [279, 30.085]
  - - [4096, 1024, 1, 16384]
    - [390, 78.065]
  - - [8192, 2048, 1, 1024]
    - [276, 71.36]
  - - [64, 1024, 64, 1024]
    - [279, 36.081]
  - - [1024, 50304, 1, 4096]
    - [415, 88.499]
  - - [1536, 4608, 1, 4096]
    - [283, 84.1]
  - - [512, 64, 128, 512]
    - [472, 29.773]
  - - [6144, 1536, 1, 8192]
    - [388, 89.034]
  - - [1024, 3072, 1, 8192]
    - [250, 73.57]
  - - [1536, 1536, 1, 8192]
    - [475, 71.746]
  - - [1536, 50304, 1, 8192]
    - [285, 93.608]
  - - [2560, 2, 1, 4]
    - [194, 0.007]
  - - [2048, 6144, 1, 1024]
    - [275, 69.259]
  - - [64, 1024, 128, 1024]
    - [141, 39.816]
  - - [1024, 64, 64, 1024]
    - [288, 35.664]
  - - [1024, 2, 1, 16]
    - [194, 0.01]
  - - [96, 1024, 128, 1024]
    - [286, 51.708]
  - - [2048, 30592, 1, 1024]
    - [208, 83.376]
  - - [64, 512, 256, 512]
    - [470, 33.692]
  - - [1536, 6144, 1, 8192]
    - [388, 89.264]
  - - [1024, 50304, 1, 2048]
    - [415, 84.954]
  - - [1024, 50304, 1, 8192]
    - [179, 90.352]
  - - [1024, 3072, 1, 2048]
    - [439, 63.131]
  - - [1024, 64, 256, 1024]
    - [477, 40.467]
  - - [1024, 50304, 1, 16384]
    - [388, 91.289]
  - - [512, 64, 40, 512]
    - [473, 26.839]
  - - [1024, 2, 1, 64]
    - [289, 0.034]
  - - [1024, 30528, 1, 8192]
    - [290, 93.968]
  - - [1024, 1024, 1, 64]
    - [259, 11.85]
  - - [64, 128, 1024, 128]
    - [392, 19.436]
  - - [128, 64, 1024, 128]
    - [480, 19.781]
  - - [1024, 1024, 1, 3456]
    - [198, 46.078]
  - - [1024, 1024, 1, 6912]
    - [481, 51.895]
  - - [1024, 1024, 1, 864]
    - [206, 32.115]
  - - [1024, 512, 1, 3456]
    - [482, 32.484]
  - - [1024, 512, 1, 4096]
    - [483, 35.382]
  - - [1024, 512, 1, 6912]
    - [484, 44.741]
  - - [1024, 512, 1, 864]
    - [279, 21.303]
  - - [256, 128, 1, 3456]
    - [485, 6.463]
  - - [256, 128, 1, 4096]
    - [486, 7.432]
  - - [256, 128, 1, 55296]
    - [487, 27.935]
  - - [256, 128, 1, 6912]
    - [488, 10.87]
  - - [256, 128, 1, 864]
    - [239, 2.119]
  - - [256, 3456, 1, 1]
    - [214, 0.202]
  - - [256, 4096, 1, 1]
    - [214, 0.213]
  - - [256, 6912, 1, 1]
    - [201, 0.318]
  - - [256, 864, 1, 1]
    - [295, 0.063]
  - - [480, 1024, 1, 3456]
    - [489, 34.71]
  - - [480, 1024, 1, 4096]
    - [489, 36.513]
  - - [480, 1024, 1, 6912]
    - [490, 45.616]
  - - [480, 1024, 1, 864]
    - [297, 19.674]
  - - [512, 256, 1, 3456]
    - [491, 17.517]
  - - [512, 256, 1, 4096]
    - [492, 19.703]
  - - [512, 256, 1, 55296]
    - [493, 55.505]
  - - [512, 256, 1, 6912]
    - [494, 25.77]
  - - [512, 256, 1, 864]
    - [300, 7.019]
  - - [30528, 1024, 1, 640]
    - [301, 75.588]
  - - [30528, 1024, 1, 1280]
    - [302, 84.548]
  - - [4096, 1024, 1, 10240]
    - [390, 77.489]
  - - [1024, 4096, 1, 10240]
    - [388, 78.719]
  - - [30528, 1024, 1, 1600]
    - [495, 86.297]
  - - [1024, 2, 1, 80]
    - [303, 0.04]
  - - [1024, 1024, 1, 10240]
    - [411, 57.683]
  - - [1024, 1024, 1, 80]
    - [186, 12.461]
  - - [64, 128, 1280, 128]
    - [496, 20.194]
  - - [128, 64, 1280, 128]
    - [497, 19.781]
  - - [1024, 4096, 1, 10496]
    - [179, 78.94]
  - - [30528, 1024, 1, 1640]
    - [495, 83.804]
  - - [4096, 1024, 1, 10496]
    - [390, 76.906]
  - - [1024, 1024, 1, 10496]
    - [498, 58.026]
  - - [1024, 1024, 1, 82]
    - [304, 10.316]
  - - [1024, 2, 1, 82]
    - [305, 0.034]
  - - [128, 64, 1312, 128]
    - [499, 19.868]
  - - [64, 128, 1312, 128]
    - [500, 20.243]
  - - [30528, 1024, 1, 160]
    - [447, 47.329]
  - - [1024, 4096, 1, 6144]
    - [388, 76.414]
  - - [30528, 1024, 1, 240]
    - [307, 55.547]
  - - [4096, 1024, 1, 6144]
    - [179, 74.756]
  - - [1024, 1024, 1, 12]
    - [214, 2.309]
  - - [1024, 2, 1, 12]
    - [308, 0.007]
  - - [1024, 1024, 1, 6144]
    - [501, 49.298]
  - - [64, 512, 192, 512]
    - [392, 33.2]
  - - [512, 64, 192, 512]
    - [473, 32.414]
  - - [13, 512, 1, 3456]
    - [329, 1.722]
  - - [13, 512, 1, 4096]
    - [309, 1.918]
  - - [13, 512, 1, 55296]
    - [561, 5.674]
  - - [13, 512, 1, 6912]
    - [330, 2.563]
  - - [13, 512, 1, 864]
    - [331, 0.417]
  - - [1024, 1024, 1, 10224]
    - [517, 57.069]
  - - [1024, 1024, 1, 10192]
    - [518, 57.085]
  - - [1024, 1024, 1, 10208]
    - [405, 57.701]
  - - [1024, 4096, 1, 10224]
    - [388, 78.015]
  - - [4096, 1024, 1, 10224]
    - [390, 76.006]
  - - [1024, 3072, 1, 10224]
    - [378, 72.983]
  - - [1024, 3072, 1, 10240]
    - [378, 74.341]
  - - [4096, 1024, 1, 10192]
    - [408, 75.553]
  - - [1024, 3072, 1, 10192]
    - [519, 72.737]
  - - [1024, 4096, 1, 10192]
    - [388, 78.028]
  - - [1024, 3072, 1, 10200]
    - [378, 72.741]
  - - [1024, 1024, 1, 10184]
    - [406, 57.073]
  - - [4096, 1024, 1, 10208]
    - [390, 75.786]
  - - [1024, 3072, 1, 10208]
    - [378, 74.145]
  - - [1024, 4096, 1, 10208]
    - [520, 77.531]
  - - [1024, 2048, 1, 10224]
    - [521, 65.487]
  - - [1024, 2048, 1, 10240]
    - [475, 68.079]
  - - [1024, 1024, 1, 10120]
    - [413, 57.502]
  - - [1024, 2048, 1, 10192]
    - [522, 65.776]
  - - [64, 24, 6816, 24]
    - [418, 4.154]
  - - [1024, 1024, 1, 10152]
    - [428, 57.784]
  - - [1024, 3072, 1, 10080]
    - [378, 74.167]
  - - [64, 26, 6272, 26]
    - [523, 4.494]
  - - [100352, 256, 1, 512]
    - [524, 70.784]
  - - [12544, 1024, 1, 2048]
    - [469, 74.421]
  - - [12544, 147, 1, 64]
    - [525, 11.875]
  - - [200704, 256, 1, 512]
    - [526, 74.331]
  - - [25088, 512, 1, 1024]
    - [527, 70.298]
  - - [3136, 576, 1, 64]
    - [528, 13.034]
  - - [50176, 512, 1, 1024]
    - [407, 79.466]
  - - [6272, 1024, 1, 2048]
    - [529, 72.28]
  - - [784, 1152, 1, 128]
    - [530, 12.879]
  - - [3136, 256, 128, 128]
    - [531, 52.514]
  - - [3136, 256, 256, 128]
    - [532, 53.953]
  - - [784, 512, 128, 256]
    - [537, 58.755]
  - - [784, 512, 256, 256]
    - [537, 61.088]
  - - [64, 128, 2048, 128]
    - [510, 20.57]
  - - [128, 64, 2048, 128]
    - [538, 20.633]
  - - [30528, 1024, 1, 2560]
    - [447, 89.477]
  - - [1024, 1024, 1, 128]
    - [539, 13.803]
  - - [1024, 2, 1, 128]
    - [540, 0.034]
  - - [128, 64, 1536, 128]
    - [480, 20.123]
  - - [64, 128, 1536, 128]
    - [509, 20.259]
  - - [1024, 4096, 1, 12288]
    - [388, 79.421]
  - - [30528, 1024, 1, 1920]
    - [541, 87.409]
  - - [1024, 1024, 1, 96]
    - [542, 12.395]
  - - [1024, 1024, 1, 12288]
    - [543, 61.147]
  - - [4096, 1024, 1, 12288]
    - [408, 76.232]
  - - [1024, 2, 1, 96]
    - [544, 0.027]
  - - [25600, 128, 25, 128]
    - [545, 44.024]
  - - [12544, 128, 36, 128]
    - [545, 43.356]
  - - [9216, 128, 49, 128]
    - [545, 43.465]
  - - [6400, 128, 64, 128]
    - [545, 43.163]
  - - [6400, 256, 25, 256]
    - [546, 64.729]
  - - [4096, 256, 36, 256]
    - [535, 62.499]
  - - [2304, 256, 49, 256]
    - [503, 60.525]
  - - [2304, 256, 64, 256]
    - [535, 62.89]
  - - [2304, 512, 25, 512]
    - [535, 73.751]
  - - [1024, 512, 36, 512]
    - [504, 70.93]
  - - [1024, 512, 49, 512]
    - [535, 72.493]
  - - [1024, 512, 64, 512]
    - [504, 74.606]
  - - [92416, 64, 25, 64]
    - [538, 23.063]
  - - [50176, 64, 36, 64]
    - [547, 23.057]
  - - [36864, 64, 49, 64]
    - [480, 23.212]
  - - [25600, 64, 64, 64]
    - [538, 23.26]
  - - [64, 128, 192, 128]
    - [548, 15.701]
  - - [128, 64, 192, 128]
    - [385, 15.194]
  - - [768, 2, 1, 2048]
    - [549, 0.237]
  - - [3072, 768, 1, 2048]
    - [550, 62.542]
  - - [768, 3072, 1, 2048]
    - [550, 61.689]
  - - [768, 768, 1, 2048]
    - [551, 29.286]
  - - [64, 384, 144, 384]
    - [500, 32.609]
  - - [384, 64, 144, 384]
    - [552, 30.065]
  - - [768, 2, 1, 4608]
    - [553, 0.436]
  - - [3072, 768, 1, 4608]
    - [550, 67.736]
  - - [768, 3072, 1, 4608]
    - [550, 65.851]
  - - [768, 768, 1, 4608]
    - [554, 42.321]
  - - [64, 512, 48, 512]
    - [474, 29.098]
  - - [512, 64, 48, 512]
    - [473, 28.655]
  - - [64, 128, 256, 128]
    - [555, 17.206]
  - - [128, 64, 256, 128]
    - [556, 17.206]
  - - [64, 384, 192, 384]
    - [511, 29.49]
  - - [384, 64, 192, 384]
    - [557, 31.577]
  - - [1024, 2, 1, 4608]
    - [558, 0.535]
  - - [4096, 1024, 1, 4608]
    - [408, 71.21]
  - - [1024, 4096, 1, 4608]
    - [388, 74.219]
  - - [1024, 1024, 1, 4608]
    - [559, 47.053]
  - - [196, 2304, 1, 256]
    - [567, 10.111]
  - - [49, 4608, 1, 512]
    - [568, 6.935]
  - - [196, 1024, 128, 512]
    - [562, 47.915]
  - - [196, 1024, 256, 512]
    - [562, 48.846]
  - - [49, 2048, 128, 512]
    - [572, 26.876]
  - - [49, 2048, 256, 512]
    - [573, 27.88]
  - - [49, 512, 128, 2048]
    - [574, 26.935]
  - - [49, 512, 256, 2048]
    - [575, 30.454]
- null
