library/src/blas3/Tensile/Logic/asm_full/arcturus_Cijk_Alik_Bljk_SB.yaml
- {MinimumRequiredVersion: 4.20.0}
- arcturus
- gfx908
- [Device 7380, Device 7388, Device 738c, Device 7390]
    SolutionIndex: 2
    SolutionNameMin: Cijk_Alik_Bljk_SB_MT64x128x32_SE_
    SolutionIndex: 5
    SolutionNameMin: Cijk_Alik_Bljk_SB_MT32x64x32_MI16x16x4x1_SE_1LDSB0_AF0EM1_AMAS0_BL1_DTL0_EPS0_FL0_GRVW1_GSU1_ISA908_IU1_KLA_LBSPP128_LPA2_LPB2_LRVW2_MAC_NLCA1_NLCB1_ONLL1_PGR2_PLR9_SIA3_SU32_SUS256_SRVW2_SNLL0_TT1_32_TLDS1_USFGROn1_VSn1_VW1_WSGRA1_WSGRB1_WG32_8_1_WGM2
    SolutionIndex: 6
    SolutionNameMin: Cijk_Alik_Bljk_SB_MT32x64x16_MI16x16x4x1_SE_1LDSB1_AF0EM1_AMAS0_BL1_DTL0_EPS0_FL0_GRVW4_GSU1_ISA908_IU1_KLA_LBSPP128_LPA4_LPB4_LRVW2_MAC_NLCA1_NLCB1_ONLL1_PGR2_PLR5_SIA3_SU32_SUS256_SRVW2_SNLL0_TT1_32_TLDS1_USFGROn1_VSn1_VW1_WSGRA1_WSGRB1_WG32_8_1_WGM15
    SolutionIndex: 7
    SolutionNameMin: Cijk_Alik_Bljk_SB_MT128x96x16_MI32x32x2x1_SE_1LDSB0_AF0EM1_AMAS0_BL1_DTL0_EPS1_FL0_GRVW1_GSU1_ISA908_IU1_KLA_LBSPP128_LPA2_LPB2_LRVW2_MAC_NLCA1_NLCB1_ONLL1_PGR1_PLR9_SIA3_SU0_SUS256_SRVW2_SNLL0_TT1_96_TLDS1_USFGROn1_VSn1_VW1_WSGRA1_WSGRB1_WG128_2_1_WGM15
    SolutionIndex: 8
    SolutionNameMin: Cijk_Alik_Bljk_SB_MT64x128x32_MI32x32x2x1_SE_1LDSB1_AF0EM1_AMAS0_BL1_DTL0_EPS1_FL0_GRVW4_GSU1_ISA908_IU1_KLA_LBSPP128_LPA4_LPB4_LRVW2_MAC_NLCA1_NLCB1_ONLL1_PGR1_PLR17_SIA3_SU32_SUS256_SRVW2_SNLL0_TT1_64_TLDS1_USFGROn1_VSn1_VW1_WSGRA1_WSGRB1_WG64_4_1_WGM2
    SolutionIndex: 9
    SolutionNameMin: Cijk_Alik_Bljk_SB_MT128x96x32_MI32x32x2x1_SE_1LDSB1_AF0EM1_AMAS0_BL1_DTL0_EPS1_FL0_GRVW1_GSU1_ISA908_IU1_KLA_LBSPP128_LPA2_LPB2_LRVW2_MAC_NLCA1_NLCB1_ONLL1_PGR1_PLR17_SIA3_SU32_SUS256_SRVW2_SNLL0_TT1_96_TLDS1_USFGROn1_VSn1_VW1_WSGRA1_WSGRB1_WG128_2_1_WGM2
    SolutionIndex: 10
    SolutionNameMin: Cijk_Alik_Bljk_SB_MT128x96x32_MI32x32x2x1_SE_1LDSB1_AF0EM1_AMAS0_BL1_DTL0_EPS0_FL0_GRVW4_GSU1_ISA908_IU1_KLA_LBSPP128_LPA4_LPB4_LRVW2_MAC_NLCA1_NLCB1_ONLL1_PGR2_PLR17_SIA3_SU32_SUS256_SRVW2_SNLL0_TT1_96_TLDS1_USFGROn1_VSn1_VW1_WSGRA1_WSGRB1_WG128_2_1_WGM15
    SolutionIndex: 11
    SolutionNameMin: Cijk_Alik_Bljk_SB_MT64x144x32_MI16x16x4x1_SE_1LDSB1_AF0EM1_AMAS0_BL1_DTL0_EPS0_FL0_GRVW1_GSU1_ISA908_IU1_KLA_LBSPP128_LPA2_LPB2_LRVW2_MAC_NLCA1_NLCB1_ONLL1_PGR2_PLR9_SIA3_SU32_SUS256_SRVW2_SNLL0_TT1_144_TLDS1_USFGROn1_VSn1_VW1_WSGRA1_WSGRB1_WG64_4_1_WGM2
    SolutionIndex: 12
    SolutionNameMin: Cijk_Alik_Bljk_SB_MT64x128x32_MI32x32x2x1_SE_1LDSB1_AF0EM1_AMAS0_BL1_DTL0_EPS1_FL0_GRVW4_GSU1_ISA908_IU1_KLA_LBSPP128_LPA4_LPB4_LRVW2_MAC_NLCA1_NLCB1_ONLL1_PGR1_PLR17_SIA3_SU0_SUS256_SRVW2_SNLL0_TT1_64_TLDS1_USFGROn1_VSn1_VW1_WSGRA1_WSGRB1_WG64_4_1_WGM1
    SolutionIndex: 13
    SolutionNameMin: Cijk_Alik_Bljk_SB_MT64x144x32_MI16x16x4x1_SE_1LDSB0_AF0EM1_AMAS0_BL1_DTL0_EPS0_FL0_GRVW1_GSU1_ISA908_IU1_KLA_LBSPP128_LPA2_LPB2_LRVW2_MAC_NLCA1_NLCB1_ONLL1_PGR2_PLR9_SIA3_SU0_SUS256_SRVW2_SNLL0_TT1_144_TLDS1_USFGROn1_VSn1_VW1_WSGRA1_WSGRB1_WG64_4_1_WGM15
    SolutionIndex: 14
    SolutionNameMin: Cijk_Alik_Bljk_SB_MT64x128x32_MI32x32x2x1_SE_1LDSB1_AF0EM1_AMAS0_BL1_DTL0_EPS1_FL0_GRVW4_GSU1_ISA908_IU1_KLA_LBSPP128_LPA4_LPB4_LRVW2_MAC_NLCA1_NLCB1_ONLL1_PGR1_PLR17_SIA3_SU32_SUS256_SRVW2_SNLL0_TT1_64_TLDS1_USFGROn1_VSn1_VW1_WSGRA1_WSGRB1_WG64_4_1_WGM15
    SolutionIndex: 15
    SolutionNameMin: Cijk_Alik_Bljk_SB_MT64x64x32_MI32x32x2x1_SE_1LDSB1_AF0EM1_AMAS0_BL1_DTL0_EPS0_FL0_GRVW4_GSU1_ISA908_IU1_KLA_LBSPP128_LPA4_LPB4_LRVW2_MAC_NLCA1_NLCB1_ONLL1_PGR2_PLR17_SIA3_SU0_SUS256_SRVW2_SNLL0_TT1_32_TLDS1_USFGROn1_VSn1_VW1_WSGRA1_WSGRB1_WG64_4_1_WGM15
    SolutionIndex: 16
    SolutionNameMin: Cijk_Alik_Bljk_SB_MT64x128x32_MI32x32x2x1_SE_1LDSB1_AF0EM1_AMAS0_BL1_DTL0_EPS1_FL0_GRVW4_GSU1_ISA908_IU1_KLA_LBSPP128_LPA4_LPB4_LRVW2_MAC_NLCA1_NLCB1_ONLL1_PGR1_PLR17_SIA3_SU32_SUS128_SRVW2_SNLL0_TT1_64_TLDS1_USFGROn1_VSn1_VW1_WSGRA1_WSGRB1_WG64_4_1_WGM1
    SolutionIndex: 17
    SolutionNameMin: Cijk_Alik_Bljk_SB_MT64x144x32_MI16x16x4x1_SE_1LDSB1_AF0EM1_AMAS0_BL1_DTL0_EPS1_FL0_GRVW1_GSU1_ISA908_IU1_KLA_LBSPP128_LPA2_LPB2_LRVW2_MAC_NLCA1_NLCB1_ONLL1_PGR1_PLR9_SIA3_SU0_SUS256_SRVW2_SNLL0_TT1_144_TLDS1_USFGROn1_VSn1_VW1_WSGRA1_WSGRB1_WG64_4_1_WGM2
    SolutionIndex: 18
    SolutionNameMin: Cijk_Alik_Bljk_SB_MT96x96x32_MI16x16x4x1_SE_1LDSB1_AF0EM1_AMAS0_BL1_DTL0_EPS1_FL0_GRVW1_GSU1_ISA908_IU1_KLA_LBSPP128_LPA2_LPB2_LRVW2_MAC_NLCA1_NLCB1_ONLL1_PGR1_PLR9_SIA3_SU0_SUS256_SRVW0_SNLL0_TT3_48_TLDS1_USFGROn1_VSn1_VW1_WSGRA1_WSGRB1_WG32_8_1_WGM15
    SolutionIndex: 19
    SolutionNameMin: Cijk_Alik_Bljk_SB_MT128x96x32_MI32x32x2x1_SE_1LDSB1_AF0EM1_AMAS0_BL1_DTL0_EPS0_FL0_GRVW1_GSU1_ISA908_IU1_KLA_LBSPP128_LPA2_LPB2_LRVW2_MAC_NLCA1_NLCB1_ONLL1_PGR2_PLR17_SIA3_SU32_SUS128_SRVW2_SNLL0_TT1_96_TLDS1_USFGROn1_VSn1_VW1_WSGRA1_WSGRB1_WG128_2_1_WGM15
    SolutionIndex: 20
    SolutionNameMin: Cijk_Alik_Bljk_SB_MT64x128x32_MI32x32x2x1_SE_1LDSB1_AF0EM1_AMAS0_BL1_DTL0_EPS0_FL0_GRVW4_GSU1_ISA908_IU1_KLA_LBSPP128_LPA4_LPB4_LRVW2_MAC_NLCA1_NLCB1_ONLL1_PGR2_PLR17_SIA3_SU0_SUS256_SRVW2_SNLL0_TT1_64_TLDS1_USFGROn1_VSn1_VW1_WSGRA1_WSGRB1_WG64_4_1_WGM2
    SolutionIndex: 21
    SolutionNameMin: Cijk_Alik_Bljk_SB_MT64x64x32_MI32x32x2x1_SE_1LDSB1_AF0EM1_AMAS0_BL1_DTL0_EPS0_FL0_GRVW4_GSU1_ISA908_IU1_KLA_LBSPP128_LPA4_LPB4_LRVW2_MAC_NLCA1_NLCB1_ONLL1_PGR2_PLR17_SIA3_SU32_SUS256_SRVW2_SNLL0_TT1_32_TLDS1_USFGROn1_VSn1_VW1_WSGRA1_WSGRB1_WG64_4_1_WGM1
    SolutionIndex: 22
    SolutionNameMin: Cijk_Alik_Bljk_SB_MT64x128x32_MI32x32x2x1_SE_1LDSB1_AF0EM1_AMAS0_BL1_DTL0_EPS1_FL0_GRVW4_GSU1_ISA908_IU1_KLA_LBSPP128_LPA4_LPB4_LRVW2_MAC_NLCA1_NLCB1_ONLL1_PGR1_PLR17_SIA3_SU32_SUS128_SRVW2_SNLL0_TT1_64_TLDS1_USFGROn1_VSn1_VW1_WSGRA1_WSGRB1_WG64_4_1_WGM15
    SolutionIndex: 23
    SolutionNameMin: Cijk_Alik_Bljk_SB_MT64x128x16_MI32x32x2x1_SE_1LDSB0_AF0EM1_AMAS0_BL1_DTL0_EPS0_FL0_GRVW4_GSU1_ISA908_IU1_KLA_LBSPP128_LPA4_LPB4_LRVW2_MAC_NLCA1_NLCB1_ONLL1_PGR2_PLR9_SIA3_SU0_SUS256_SRVW2_SNLL0_TT1_64_TLDS1_USFGROn1_VSn1_VW1_WSGRA1_WSGRB1_WG64_4_1_WGM1
    SolutionIndex: 24
    SolutionNameMin: Cijk_Alik_Bljk_SB_MT64x128x16_MI32x32x2x1_SE_1LDSB1_AF0EM1_AMAS0_BL1_DTL0_EPS0_FL0_GRVW2_GSU1_ISA908_IU1_KLA_LBSPP128_LPA2_LPB2_LRVW2_MAC_NLCA1_NLCB1_ONLL1_PGR2_PLR9_SIA3_SU32_SUS256_SRVW2_SNLL0_TT1_64_TLDS1_USFGROn1_VSn1_VW1_WSGRA1_WSGRB1_WG64_4_1_WGM1
    SolutionIndex: 25
    SolutionNameMin: Cijk_Alik_Bljk_SB_MT64x144x32_MI16x16x4x1_SE_1LDSB0_AF0EM1_AMAS0_BL1_DTL0_EPS1_FL0_GRVW1_GSU1_ISA908_IU1_KLA_LBSPP128_LPA2_LPB2_LRVW2_MAC_NLCA1_NLCB1_ONLL1_PGR1_PLR9_SIA3_SU0_SUS256_SRVW2_SNLL0_TT1_144_TLDS1_USFGROn1_VSn1_VW1_WSGRA1_WSGRB1_WG64_4_1_WGM15
    SolutionIndex: 26
    SolutionNameMin: Cijk_Alik_Bljk_SB_MT128x64x32_MI32x32x2x1_SE_1LDSB0_AF0EM1_AMAS0_BL1_DTL0_EPS0_FL0_GRVW4_GSU1_ISA908_IU1_KLA_LBSPP128_LPA4_LPB4_LRVW2_MAC_NLCA1_NLCB1_ONLL1_PGR2_PLR17_SIA3_SU32_SUS256_SRVW2_SNLL0_TT2_32_TLDS1_USFGROn1_VSn1_VW1_WSGRA1_WSGRB1_WG64_4_1_WGM1
    SolutionIndex: 27
    SolutionNameMin: Cijk_Alik_Bljk_SB_MT96x96x32_MI16x16x4x1_SN_1LDSB1_AF0EM1_AMAS0_BL1_DTL0_EPS1_FL0_GRVW4_GSU1_ISA908_IU1_KLA_LBSPP128_LPA4_LPB4_LRVW2_MAC_NLCA1_NLCB1_ONLL1_PGR1_PLR9_SIA3_SU32_SUS256_SRVW0_SNLL0_TT3_48_TLDS1_USFGROn1_VSn1_VW1_WSGRA1_WSGRB1_WG32_8_1_WGM15
    SolutionIndex: 28
    SolutionNameMin: Cijk_Alik_Bljk_SB_MT64x64x32_MI32x32x2x1_SE_1LDSB1_AF0EM1_AMAS0_BL1_DTL0_EPS1_FL0_GRVW1_GSU1_ISA908_IU1_KLA_LBSPP128_LPA2_LPB2_LRVW2_MAC_NLCA1_NLCB1_ONLL1_PGR1_PLR17_SIA3_SU32_SUS128_SRVW2_SNLL0_TT1_32_TLDS1_USFGROn1_VSn1_VW1_WSGRA1_WSGRB1_WG64_4_1_WGM15
    SolutionIndex: 29
    SolutionNameMin: Cijk_Alik_Bljk_SB_MT64x128x32_MI32x32x2x1_SE_1LDSB1_AF0EM1_AMAS0_BL1_DTL0_EPS0_FL0_GRVW4_GSU1_ISA908_IU1_KLA_LBSPP128_LPA4_LPB4_LRVW2_MAC_NLCA1_NLCB1_ONLL1_PGR2_PLR17_SIA3_SU32_SUS128_SRVW2_SNLL0_TT1_64_TLDS1_USFGROn1_VSn1_VW1_WSGRA1_WSGRB1_WG64_4_1_WGM15
    SolutionIndex: 30
    SolutionNameMin: Cijk_Alik_Bljk_SB_MT128x160x16_MI32x32x2x1_SE_1LDSB1_AF0EM1_AMAS0_BL1_DTL0_EPS1_FL0_GRVW1_GSU1_ISA908_IU1_KLA_LBSPP128_LPA2_LPB2_LRVW2_MAC_NLCA1_NLCB1_ONLL1_PGR1_PLR9_SIA3_SU32_SUS128_SRVW2_SNLL0_TT1_160_TLDS1_USFGROn1_VSn1_VW1_WSGRA1_WSGRB1_WG128_2_1_WGM15
    SolutionIndex: 31
    SolutionNameMin: Cijk_Alik_Bljk_SB_MT64x32x32_MI16x16x4x1_SE_1LDSB0_AF0EM1_AMAS0_BL1_DTL0_EPS0_FL0_GRVW4_GSU1_ISA908_IU1_KLA_LBSPP128_LPA4_LPB4_LRVW2_MAC_NLCA1_NLCB1_ONLL1_PGR2_PLR9_SIA3_SU32_SUS128_SRVW2_SNLL0_TT2_16_TLDS1_USFGROn1_VSn1_VW1_WSGRA1_WSGRB1_WG32_8_1_WGM15
    SolutionIndex: 32
    SolutionNameMin: Cijk_Alik_Bljk_SB_MT64x64x16_MI32x32x2x1_SE_1LDSB0_AF0EM1_AMAS0_BL1_DTL0_EPS0_FL0_GRVW1_GSU1_ISA908_IU1_KLA_LBSPP128_LPA2_LPB2_LRVW2_MAC_NLCA1_NLCB1_ONLL1_PGR2_PLR9_SIA3_SU32_SUS128_SRVW2_SNLL0_TT1_32_TLDS1_USFGROn1_VSn1_VW1_WSGRA1_WSGRB1_WG64_4_1_WGM15
    SolutionIndex: 33
    SolutionNameMin: Cijk_Alik_Bljk_SB_MT16x16x32_MI16x16x4x1_SE_1LDSB0_AF0EM1_AMAS3_BL1_DTL0_EPS0_FL0_GRVW4_GSU1_ISA908_IU1_KLA_LBSPP128_LPA4_LPB4_LRVW2_MAC_NLCA1_NLCB1_ONLL1_PGR2_PLR9_SIA3_SU0_SUS256_SRVW0_SNLL0_TT1_16_TLDS1_USFGROn1_VSn1_VW2_WSGRA1_WSGRB1_WG16_4_1_WGM1
    SolutionIndex: 34
    SolutionNameMin: Cijk_Alik_Bljk_SB_MT16x16x32_MI16x16x4x1_SE_1LDSB0_AF0EM1_AMAS3_BL1_DTL0_EPS0_FL0_GRVW1_GSU1_ISA908_IU1_KLA_LBSPP128_LPA2_LPB2_LRVW2_MAC_NLCA1_NLCB1_ONLL1_PGR2_PLR9_SIA3_SU0_SUS256_SRVW0_SNLL0_TT1_16_TLDS1_USFGROn1_VSn1_VW2_WSGRA1_WSGRB1_WG16_4_1_WGM1
    SolutionIndex: 35
    SolutionNameMin: Cijk_Alik_Bljk_SB_MT32x32x32_MI16x16x4x1_SE_1LDSB0_AF0EM1_AMAS0_BL1_DTL0_EPS0_FL0_GRVW2_GSU1_ISA908_IU1_KLA_LBSPP128_LPA2_LPB2_LRVW2_MAC_NLCA1_NLCB1_ONLL1_PGR2_PLR9_SIA3_SU32_SUS128_SRVW2_SNLL0_TT1_16_TLDS1_USFGROn1_VSn1_VW1_WSGRA1_WSGRB1_WG32_8_1_WGM2
    SolutionIndex: 36
    SolutionNameMin: Cijk_Alik_Bljk_SB_MT32x32x32_MI16x16x4x1_SE_1LDSB0_AF0EM1_AMAS0_BL1_DTL0_EPS0_FL0_GRVW2_GSU1_ISA908_IU1_KLA_LBSPP128_LPA2_LPB2_LRVW2_MAC_NLCA1_NLCB1_ONLL1_PGR2_PLR9_SIA3_SU32_SUS256_SRVW2_SNLL0_TT1_16_TLDS1_USFGROn1_VSn1_VW1_WSGRA1_WSGRB1_WG32_8_1_WGM1
    SolutionIndex: 37
    SolutionNameMin: Cijk_Alik_Bljk_SB_MT16x64x32_MI16x16x4x1_SE_1LDSB0_AF0EM1_AMAS3_BL1_DTL0_EPS0_FL0_GRVW4_GSU1_ISA908_IU1_KLA_LBSPP128_LPA4_LPB4_LRVW2_MAC_NLCA1_NLCB1_ONLL1_PGR2_PLR9_SIA3_SU0_SUS256_SRVW0_SNLL0_TT1_16_TLDS1_USFGROn1_VSn1_VW2_WSGRA1_WSGRB1_WG16_16_1_WGM2
    SolutionIndex: 38
    SolutionNameMin: Cijk_Alik_Bljk_SB_MT16x16x16_SN_1LDSB0_AF0EM1_AMAS3_BL1_DTL0_EPS1_FL0_GRVW2_GSU8_ISA908_IU1_KLA_LBSPP0_LPA0_LPB0_LRVW2_MAC_NLCA1_NLCB1_ONLL1_PGR1_PLR1_SIA1_SU32_SUS256_SRVW0_SNLL0_TT2_2_TLDS0_USFGRO1_VS1_VW2_WSGRA0_WSGRB0_WG8_8_4_WGM8
    SolutionIndex: 39
    SolutionNameMin: Cijk_Alik_Bljk_SB_MT16x16x32_MI16x16x4x1_SE_1LDSB0_AF0EM1_AMAS3_BL1_DTL0_EPS0_FL0_GRVW2_GSU5_ISA908_IU1_KLA_LBSPP128_LPA2_LPB2_LRVW2_MAC_NLCA1_NLCB1_ONLL1_PGR2_PLR9_SIA3_SU32_SUS256_SRVW0_SNLL0_TT1_16_TLDS1_USFGROn1_VSn1_VW2_WSGRA1_WSGRB1_WG16_4_1_WGM1
    SolutionIndex: 40
    SolutionNameMin: Cijk_Alik_Bljk_SB_MT32x32x32_MI16x16x4x1_SE_1LDSB0_AF0EM1_AMAS0_BL1_DTL0_EPS0_FL0_GRVW2_GSU5_ISA908_IU1_KLA_LBSPP128_LPA2_LPB2_LRVW2_MAC_NLCA1_NLCB1_ONLL1_PGR2_PLR9_SIA3_SU0_SUS256_SRVW0_SNLL0_TT1_16_TLDS1_USFGROn1_VSn1_VW1_WSGRA1_WSGRB1_WG32_8_1_WGM1
    SolutionIndex: 41
    SolutionNameMin: Cijk_Alik_Bljk_SB_MT64x32x32_MI16x16x4x1_SE_1LDSB1_AF0EM1_AMAS0_BL1_DTL0_EPS1_FL0_GRVW2_GSU1_ISA908_IU1_KLA_LBSPP128_LPA2_LPB2_LRVW2_MAC_NLCA1_NLCB1_ONLL1_PGR1_PLR9_SIA3_SU32_SUS256_SRVW2_SNLL0_TT2_16_TLDS1_USFGROn1_VSn1_VW1_WSGRA1_WSGRB1_WG32_8_1_WGM15
    SolutionIndex: 42
    SolutionNameMin: Cijk_Alik_Bljk_SB_MT64x64x32_MI32x32x2x1_SE_1LDSB1_AF0EM1_AMAS0_BL1_DTL0_EPS1_FL0_GRVW2_GSU1_ISA908_IU1_KLA_LBSPP128_LPA2_LPB2_LRVW2_MAC_NLCA1_NLCB1_ONLL1_PGR1_PLR17_SIA3_SU32_SUS256_SRVW2_SNLL0_TT1_32_TLDS1_USFGROn1_VSn1_VW1_WSGRA1_WSGRB1_WG64_4_1_WGM1
    SolutionIndex: 43
    SolutionNameMin: Cijk_Alik_Bljk_SB_MT64x64x32_MI32x32x2x1_SE_1LDSB1_AF0EM1_AMAS0_BL1_DTL0_EPS1_FL0_GRVW2_GSU1_ISA908_IU1_KLA_LBSPP128_LPA2_LPB2_LRVW2_MAC_NLCA1_NLCB1_ONLL1_PGR1_PLR17_SIA3_SU32_SUS256_SRVW2_SNLL0_TT1_32_TLDS1_USFGROn1_VSn1_VW1_WSGRA1_WSGRB1_WG64_4_1_WGM2
    SolutionIndex: 44
    SolutionNameMin: Cijk_Alik_Bljk_SB_MT64x64x32_MI32x32x2x1_SE_1LDSB1_AF0EM1_AMAS0_BL1_DTL0_EPS1_FL0_GRVW4_GSU1_ISA908_IU1_KLA_LBSPP128_LPA4_LPB4_LRVW2_MAC_NLCA1_NLCB1_ONLL1_PGR1_PLR17_SIA3_SU0_SUS256_SRVW2_SNLL0_TT1_32_TLDS1_USFGROn1_VSn1_VW1_WSGRA1_WSGRB1_WG64_4_1_WGM1
    SolutionIndex: 45
    SolutionNameMin: Cijk_Alik_Bljk_SB_MT64x64x32_MI32x32x2x1_SE_1LDSB1_AF0EM1_AMAS0_BL1_DTL0_EPS0_FL0_GRVW4_GSU1_ISA908_IU1_KLA_LBSPP128_LPA4_LPB4_LRVW2_MAC_NLCA1_NLCB1_ONLL1_PGR2_PLR17_SIA3_SU0_SUS256_SRVW2_SNLL0_TT1_32_TLDS1_USFGROn1_VSn1_VW1_WSGRA1_WSGRB1_WG64_4_1_WGM1
    SolutionIndex: 46
    SolutionNameMin: Cijk_Alik_Bljk_SB_MT64x64x16_MI16x16x4x1_SE_1LDSB0_AF0EM1_AMAS3_BL1_DTL0_EPS1_FL0_GRVW4_GSU1_ISA908_IU1_KLA_LBSPP0_LPA0_LPB0_LRVW1_MAC_NLCA1_NLCB1_ONLL1_PGR1_PLR1_SIA3_SU32_SUS256_SRVW0_SNLL0_TT4_16_TLDS0_USFGROn1_VSn1_VW2_WSGRA1_WSGRB1_WG16_16_1_WGM8
    SolutionIndex: 47
    SolutionNameMin: Cijk_Alik_Bljk_SB_MT64x64x16_MI32x32x2x1_SE_1LDSB0_AF0EM1_AMAS0_BL1_DTL0_EPS0_FL0_GRVW1_GSU1_ISA908_IU1_KLA_LBSPP128_LPA2_LPB2_LRVW2_MAC_NLCA1_NLCB1_ONLL1_PGR2_PLR9_SIA3_SU0_SUS256_SRVW2_SNLL0_TT1_32_TLDS1_USFGROn1_VSn1_VW1_WSGRA1_WSGRB1_WG64_4_1_WGM1
    SolutionIndex: 48
    SolutionNameMin: Cijk_Alik_Bljk_SB_MT64x64x16_MI16x16x4x1_SE_1LDSB0_AF0EM1_AMAS3_BL1_DTL0_EPS1_FL0_GRVW4_GSU1_ISA908_IU1_KLA_LBSPP0_LPA0_LPB0_LRVW1_MAC_NLCA1_NLCB1_ONLL1_PGR1_PLR1_SIA3_SU32_SUS256_SRVW0_SNLL0_TT2_32_TLDS0_USFGROn1_VSn1_VW2_WSGRA1_WSGRB1_WG32_8_1_WGM8
    SolutionIndex: 49
    SolutionNameMin: Cijk_Alik_Bljk_SB_MT64x32x32_MI16x16x4x1_SE_1LDSB0_AF0EM1_AMAS0_BL1_DTL0_EPS1_FL0_GRVW4_GSU1_ISA908_IU1_KLA_LBSPP0_LPA0_LPB0_LRVW1_MAC_NLCA1_NLCB1_ONLL1_PGR1_PLR1_SIA3_SU32_SUS256_SRVW0_SNLL0_TT2_16_TLDS0_USFGROn1_VSn1_VW1_WSGRA1_WSGRB1_WG32_8_1_WGM8
    SolutionIndex: 50
    SolutionNameMin: Cijk_Alik_Bljk_SB_MT64x128x16_MI32x32x2x1_SE_1LDSB1_AF0EM1_AMAS0_BL1_DTL0_EPS0_FL0_GRVW4_GSU1_ISA908_IU1_KLA_LBSPP128_LPA4_LPB4_LRVW2_MAC_NLCA1_NLCB1_ONLL1_PGR2_PLR9_SIA3_SU32_SUS128_SRVW2_SNLL0_TT1_64_TLDS1_USFGROn1_VSn1_VW1_WSGRA1_WSGRB1_WG64_4_1_WGM2
    SolutionIndex: 51
    SolutionNameMin: Cijk_Alik_Bljk_SB_MT32x32x32_MI16x16x4x1_SE_1LDSB0_AF0EM1_AMAS0_BL1_DTL0_EPS0_FL0_GRVW1_GSU1_ISA908_IU1_KLA_LBSPP128_LPA2_LPB2_LRVW2_MAC_NLCA1_NLCB1_ONLL1_PGR2_PLR9_SIA3_SU32_SUS128_SRVW2_SNLL0_TT1_16_TLDS1_USFGROn1_VSn1_VW1_WSGRA1_WSGRB1_WG32_8_1_WGM2
    SolutionIndex: 52
    SolutionNameMin: Cijk_Alik_Bljk_SB_MT16x16x32_MI16x16x4x1_SE_1LDSB0_AF0EM1_AMAS3_BL1_DTL0_EPS0_FL0_GRVW2_GSU5_ISA908_IU1_KLA_LBSPP128_LPA2_LPB2_LRVW2_MAC_NLCA1_NLCB1_ONLL1_PGR2_PLR9_SIA3_SU0_SUS256_SRVW0_SNLL0_TT1_16_TLDS1_USFGROn1_VSn1_VW2_WSGRA1_WSGRB1_WG16_4_1_WGM2
    SolutionIndex: 53
    SolutionNameMin: Cijk_Alik_Bljk_SB_MT16x16x32_MI16x16x4x1_SE_1LDSB0_AF0EM1_AMAS3_BL1_DTL0_EPS0_FL0_GRVW4_GSU5_ISA908_IU1_KLA_LBSPP128_LPA4_LPB4_LRVW2_MAC_NLCA1_NLCB1_ONLL1_PGR2_PLR9_SIA3_SU0_SUS256_SRVW0_SNLL0_TT1_16_TLDS1_USFGROn1_VSn1_VW2_WSGRA1_WSGRB1_WG16_4_1_WGM15
    SolutionIndex: 54
    SolutionNameMin: Cijk_Alik_Bljk_SB_MT64x128x32_MI32x32x2x1_SE_1LDSB0_AF0EM1_AMAS0_BL1_DTL0_EPS0_FL0_GRVW1_GSU1_ISA908_IU1_KLA_LBSPP128_LPA2_LPB2_LRVW2_MAC_NLCA1_NLCB1_ONLL1_PGR2_PLR17_SIA3_SU32_SUS256_SRVW2_SNLL0_TT1_64_TLDS1_USFGROn1_VSn1_VW1_WSGRA1_WSGRB1_WG64_4_1_WGM1
    SolutionIndex: 55
    SolutionNameMin: Cijk_Alik_Bljk_SB_MT128x96x32_MI32x32x2x1_SE_1LDSB1_AF0EM1_AMAS0_BL1_DTL0_EPS1_FL0_GRVW1_GSU1_ISA908_IU1_KLA_LBSPP128_LPA2_LPB2_LRVW2_MAC_NLCA1_NLCB1_ONLL1_PGR1_PLR17_SIA3_SU0_SUS256_SRVW2_SNLL0_TT1_96_TLDS1_USFGROn1_VSn1_VW1_WSGRA1_WSGRB1_WG128_2_1_WGM1
    SolutionIndex: 56
    SolutionNameMin: Cijk_Alik_Bljk_SB_MT32x64x32_MI16x16x4x1_SE_1LDSB0_AF0EM1_AMAS0_BL1_DTL0_EPS0_FL0_GRVW1_GSU1_ISA908_IU1_KLA_LBSPP128_LPA2_LPB2_LRVW2_MAC_NLCA1_NLCB1_ONLL1_PGR2_PLR9_SIA3_SU0_SUS256_SRVW2_SNLL0_TT1_32_TLDS1_USFGROn1_VSn1_VW1_WSGRA1_WSGRB1_WG32_8_1_WGM15
    SolutionIndex: 57
    SolutionNameMin: Cijk_Alik_Bljk_SB_MT128x96x32_MI32x32x2x1_SE_1LDSB1_AF0EM1_AMAS0_BL1_DTL0_EPS1_FL0_GRVW1_GSU1_ISA908_IU1_KLA_LBSPP128_LPA2_LPB2_LRVW2_MAC_NLCA1_NLCB1_ONLL1_PGR1_PLR17_SIA3_SU32_SUS128_SRVW2_SNLL0_TT1_96_TLDS1_USFGROn1_VSn1_VW1_WSGRA1_WSGRB1_WG128_2_1_WGM15
    SolutionIndex: 58
    SolutionNameMin: Cijk_Alik_Bljk_SB_MT8x32x32_SE_1LDSB0_AF0EM1_AMAS3_BL1_DTL0_EPS1_FL0_GRVW4_GSU1_ISA908_IU1_KLA_LBSPP0_LPA2_LPB2_LRVW2_MAC_NLCA1_NLCB1_ONLL1_PGR1_PLR1_SIA1_SU32_SUS256_SRVW0_SNLL0_TT2_2_TLDS0_USFGRO1_VS1_VW2_WSGRA0_WSGRB0_WG4_16_4_WGM8
    SolutionIndex: 59
    SolutionNameMin: Cijk_Alik_Bljk_SB_MT128x160x16_MI32x32x2x1_SE_1LDSB1_AF0EM1_AMAS0_BL1_DTL0_EPS1_FL0_GRVW1_GSU1_ISA908_IU1_KLA_LBSPP128_LPA2_LPB2_LRVW2_MAC_NLCA1_NLCB1_ONLL1_PGR1_PLR9_SIA3_SU32_SUS256_SRVW2_SNLL0_TT1_160_TLDS1_USFGROn1_VSn1_VW1_WSGRA1_WSGRB1_WG128_2_1_WGM1
    SolutionIndex: 60
    SolutionNameMin: Cijk_Alik_Bljk_SB_MT64x144x32_MI16x16x4x1_SE_1LDSB1_AF0EM1_AMAS0_BL1_DTL0_EPS1_FL0_GRVW1_GSU1_ISA908_IU1_KLA_LBSPP128_LPA2_LPB2_LRVW2_MAC_NLCA1_NLCB1_ONLL1_PGR1_PLR9_SIA3_SU0_SUS256_SRVW2_SNLL0_TT1_144_TLDS1_USFGROn1_VSn1_VW1_WSGRA1_WSGRB1_WG64_4_1_WGM1
    SolutionIndex: 61
    SolutionNameMin: Cijk_Alik_Bljk_SB_MT64x64x16_MI32x32x2x1_SE_1LDSB0_AF0EM1_AMAS0_BL1_DTL0_EPS0_FL0_GRVW1_GSU1_ISA908_IU1_KLA_LBSPP128_LPA2_LPB2_LRVW2_MAC_NLCA1_NLCB1_ONLL1_PGR2_PLR9_SIA3_SU0_SUS256_SRVW2_SNLL0_TT1_32_TLDS1_USFGROn1_VSn1_VW1_WSGRA1_WSGRB1_WG64_4_1_WGM15
    SolutionIndex: 62
    SolutionNameMin: Cijk_Alik_Bljk_SB_MT128x96x32_MI32x32x2x1_SE_1LDSB1_AF0EM1_AMAS0_BL1_DTL0_EPS1_FL0_GRVW1_GSU1_ISA908_IU1_KLA_LBSPP128_LPA2_LPB2_LRVW2_MAC_NLCA1_NLCB1_ONLL1_PGR1_PLR17_SIA3_SU0_SUS256_SRVW2_SNLL0_TT1_96_TLDS1_USFGROn1_VSn1_VW1_WSGRA1_WSGRB1_WG128_2_1_WGM15
    SolutionIndex: 63
    SolutionNameMin: Cijk_Alik_Bljk_SB_MT64x128x32_MI32x32x2x1_SE_1LDSB1_AF0EM1_AMAS0_BL1_DTL0_EPS1_FL0_GRVW4_GSU1_ISA908_IU1_KLA_LBSPP128_LPA4_LPB4_LRVW2_MAC_NLCA1_NLCB1_ONLL1_PGR1_PLR17_SIA3_SU32_SUS128_SRVW2_SNLL0_TT1_64_TLDS1_USFGROn1_VSn1_VW1_WSGRA1_WSGRB1_WG64_4_1_WGM2
    SolutionIndex: 64
    SolutionNameMin: Cijk_Alik_Bljk_SB_MT64x64x16_MI32x32x2x1_SE_1LDSB1_AF0EM1_AMAS0_BL1_DTL0_EPS0_FL0_GRVW4_GSU1_ISA908_IU1_KLA_LBSPP128_LPA4_LPB4_LRVW2_MAC_NLCA1_NLCB1_ONLL1_PGR2_PLR9_SIA3_SU0_SUS256_SRVW2_SNLL0_TT1_32_TLDS1_USFGROn1_VSn1_VW1_WSGRA1_WSGRB1_WG64_4_1_WGM1
    SolutionIndex: 65
    SolutionNameMin: Cijk_Alik_Bljk_SB_MT64x128x32_MI32x32x2x1_SE_1LDSB1_AF0EM1_AMAS0_BL1_DTL0_EPS1_FL0_GRVW4_GSU1_ISA908_IU1_KLA_LBSPP128_LPA4_LPB4_LRVW2_MAC_NLCA1_NLCB1_ONLL1_PGR1_PLR17_SIA3_SU0_SUS256_SRVW2_SNLL0_TT1_64_TLDS1_USFGROn1_VSn1_VW1_WSGRA1_WSGRB1_WG64_4_1_WGM2
    SolutionIndex: 66
    SolutionNameMin: Cijk_Alik_Bljk_SB_MT32x32x32_MI16x16x4x1_SE_1LDSB1_AF0EM1_AMAS0_BL1_DTL0_EPS1_FL0_GRVW1_GSU1_ISA908_IU1_KLA_LBSPP128_LPA2_LPB2_LRVW2_MAC_NLCA1_NLCB1_ONLL1_PGR1_PLR9_SIA3_SU32_SUS256_SRVW2_SNLL0_TT1_16_TLDS1_USFGROn1_VSn1_VW1_WSGRA1_WSGRB1_WG32_8_1_WGM15
    SolutionIndex: 67
    SolutionNameMin: Cijk_Alik_Bljk_SB_MT128x128x16_MI32x32x2x1_SE_1LDSB0_AF0EM1_AMAS0_BL1_DTL0_EPS0_FL0_GRVW4_GSU1_ISA908_IU1_KLA_LBSPP128_LPA4_LPB4_LRVW2_MAC_NLCA1_NLCB1_ONLL1_PGR2_PLR9_SIA3_SU0_SUS256_SRVW2_SNLL0_TT2_64_TLDS1_USFGROn1_VSn1_VW1_WSGRA1_WSGRB1_WG64_4_1_WGM15
    SolutionIndex: 68
    SolutionNameMin: Cijk_Alik_Bljk_SB_MT128x160x16_MI32x32x2x1_SE_1LDSB1_AF0EM1_AMAS0_BL1_DTL0_EPS1_FL0_GRVW1_GSU1_ISA908_IU1_KLA_LBSPP128_LPA2_LPB2_LRVW2_MAC_NLCA1_NLCB1_ONLL1_PGR1_PLR9_SIA3_SU0_SUS256_SRVW2_SNLL0_TT1_160_TLDS1_USFGROn1_VSn1_VW1_WSGRA1_WSGRB1_WG128_2_1_WGM2
    SolutionIndex: 69
    SolutionNameMin: Cijk_Alik_Bljk_SB_MT16x16x32_MI16x16x4x1_SE_1LDSB0_AF0EM1_AMAS3_BL1_DTL0_EPS0_FL0_GRVW2_GSU1_ISA908_IU1_KLA_LBSPP128_LPA2_LPB2_LRVW2_MAC_NLCA1_NLCB1_ONLL1_PGR2_PLR9_SIA3_SU0_SUS256_SRVW0_SNLL0_TT1_16_TLDS1_USFGROn1_VSn1_VW2_WSGRA1_WSGRB1_WG16_4_1_WGM15
    SolutionIndex: 70
    SolutionNameMin: Cijk_Alik_Bljk_SB_MT64x144x32_MI16x16x4x1_SE_1LDSB0_AF0EM1_AMAS0_BL1_DTL0_EPS1_FL0_GRVW1_GSU1_ISA908_IU1_KLA_LBSPP128_LPA2_LPB2_LRVW2_MAC_NLCA1_NLCB1_ONLL1_PGR1_PLR9_SIA3_SU0_SUS256_SRVW2_SNLL0_TT1_144_TLDS1_USFGROn1_VSn1_VW1_WSGRA1_WSGRB1_WG64_4_1_WGM1
    SolutionIndex: 71
    SolutionNameMin: Cijk_Alik_Bljk_SB_MT64x64x32_MI32x32x2x1_SE_1LDSB0_AF0EM1_AMAS0_BL1_DTL0_EPS0_FL0_GRVW4_GSU1_ISA908_IU1_KLA_LBSPP128_LPA4_LPB4_LRVW2_MAC_NLCA1_NLCB1_ONLL1_PGR2_PLR17_SIA3_SU32_SUS128_SRVW2_SNLL0_TT1_32_TLDS1_USFGROn1_VSn1_VW1_WSGRA1_WSGRB1_WG64_4_1_WGM1
    SolutionIndex: 72
    SolutionNameMin: Cijk_Alik_Bljk_SB_MT32x32x32_MI16x16x4x1_SE_1LDSB0_AF0EM1_AMAS0_BL1_DTL0_EPS1_FL0_GRVW4_GSU1_ISA908_IU2_KLA_LBSPP128_LPA4_LPB4_LRVW2_MAC_NLCA1_NLCB1_ONLL1_PGR1_PLR5_SIA3_SU0_SUS128_SRVW2_SNLL0_TT1_16_TLDS1_USFGROn1_VSn1_VW1_WSGRA1_WSGRB1_WG32_8_1_WGM8
    SolutionIndex: 73
    SolutionNameMin: Cijk_Alik_Bljk_SB_MT64x64x32_MI32x32x2x1_SE_1LDSB1_AF0EM1_AMAS0_BL1_DTL0_EPS1_FL0_GRVW2_GSU1_ISA908_IU1_KLA_LBSPP128_LPA2_LPB2_LRVW2_MAC_NLCA1_NLCB1_ONLL1_PGR1_PLR17_SIA3_SU0_SUS256_SRVW2_SNLL0_TT1_32_TLDS1_USFGROn1_VSn1_VW1_WSGRA1_WSGRB1_WG64_4_1_WGM15
    SolutionIndex: 74
    SolutionNameMin: Cijk_Alik_Bljk_SB_MT16x16x32_MI16x16x4x1_SE_1LDSB0_AF0EM1_AMAS3_BL1_DTL0_EPS0_FL0_GRVW4_GSU1_ISA908_IU1_KLA_LBSPP128_LPA4_LPB4_LRVW2_MAC_NLCA1_NLCB1_ONLL1_PGR2_PLR9_SIA3_SU32_SUS256_SRVW0_SNLL0_TT1_16_TLDS1_USFGROn1_VSn1_VW2_WSGRA1_WSGRB1_WG16_4_1_WGM1
    SolutionIndex: 75
    SolutionNameMin: Cijk_Alik_Bljk_SB_MT64x128x32_MI32x32x2x1_SE_1LDSB0_AF0EM1_AMAS0_BL1_DTL0_EPS0_FL0_GRVW4_GSU1_ISA908_IU1_KLA_LBSPP128_LPA4_LPB4_LRVW2_MAC_NLCA1_NLCB1_ONLL1_PGR2_PLR17_SIA3_SU0_SUS256_SRVW2_SNLL0_TT1_64_TLDS1_USFGROn1_VSn1_VW1_WSGRA1_WSGRB1_WG64_4_1_WGM15
    SolutionIndex: 76
    SolutionNameMin: Cijk_Alik_Bljk_SB_MT32x32x32_MI16x16x4x1_SE_1LDSB0_AF0EM1_AMAS0_BL1_DTL0_EPS0_FL0_GRVW4_GSU1_ISA908_IU1_KLA_LBSPP128_LPA4_LPB4_LRVW2_MAC_NLCA1_NLCB1_ONLL1_PGR2_PLR9_SIA3_SU32_SUS128_SRVW2_SNLL0_TT1_16_TLDS1_USFGROn1_VSn1_VW1_WSGRA1_WSGRB1_WG32_8_1_WGM1
    SolutionIndex: 77
    SolutionNameMin: Cijk_Alik_Bljk_SB_MT64x64x32_MI32x32x2x1_SE_1LDSB0_AF0EM1_AMAS0_BL1_DTL0_EPS0_FL0_GRVW4_GSU1_ISA908_IU2_KLA_LBSPP128_LPA4_LPB4_LRVW2_MAC_NLCA1_NLCB1_ONLL1_PGR2_PLR9_SIA3_SU0_SUS256_SRVW2_SNLL0_TT1_32_TLDS1_USFGROn1_VSn1_VW1_WSGRA1_WSGRB1_WG64_4_1_WGM1
    SolutionIndex: 78
    SolutionNameMin: Cijk_Alik_Bljk_SB_MT128x160x16_MI32x32x2x1_SE_1LDSB1_AF0EM1_AMAS0_BL1_DTL0_EPS1_FL0_GRVW1_GSU1_ISA908_IU1_KLA_LBSPP128_LPA2_LPB2_LRVW2_MAC_NLCA1_NLCB1_ONLL1_PGR1_PLR9_SIA3_SU0_SUS256_SRVW2_SNLL0_TT1_160_TLDS1_USFGROn1_VSn1_VW1_WSGRA1_WSGRB1_WG128_2_1_WGM15
    SolutionIndex: 79
    SolutionNameMin: Cijk_Alik_Bljk_SB_MT64x32x32_MI16x16x4x1_SE_1LDSB0_AF0EM1_AMAS0_BL1_DTL0_EPS0_FL0_GRVW2_GSU1_ISA908_IU1_KLA_LBSPP128_LPA2_LPB2_LRVW2_MAC_NLCA1_NLCB1_ONLL1_PGR2_PLR9_SIA3_SU32_SUS256_SRVW2_SNLL0_TT2_16_TLDS1_USFGROn1_VSn1_VW1_WSGRA1_WSGRB1_WG32_8_1_WGM15
    SolutionIndex: 80
    SolutionNameMin: Cijk_Alik_Bljk_SB_MT64x64x32_MI32x32x2x1_SE_1LDSB0_AF0EM1_AMAS0_BL1_DTL0_EPS0_FL0_GRVW2_GSU1_ISA908_IU1_KLA_LBSPP128_LPA2_LPB2_LRVW2_MAC_NLCA1_NLCB1_ONLL1_PGR2_PLR17_SIA3_SU32_SUS128_SRVW2_SNLL0_TT1_32_TLDS1_USFGROn1_VSn1_VW1_WSGRA1_WSGRB1_WG64_4_1_WGM2
    SolutionIndex: 81
    SolutionNameMin: Cijk_Alik_Bljk_SB_MT64x64x32_MI32x32x2x1_SE_1LDSB1_AF0EM1_AMAS0_BL1_DTL0_EPS1_FL0_GRVW1_GSU1_ISA908_IU1_KLA_LBSPP128_LPA2_LPB2_LRVW2_MAC_NLCA1_NLCB1_ONLL1_PGR1_PLR17_SIA3_SU0_SUS256_SRVW2_SNLL0_TT1_32_TLDS1_USFGROn1_VSn1_VW1_WSGRA1_WSGRB1_WG64_4_1_WGM15
    SolutionIndex: 82
    SolutionNameMin: Cijk_Alik_Bljk_SB_MT128x96x32_MI32x32x2x1_SE_1LDSB1_AF0EM1_AMAS0_BL1_DTL0_EPS1_FL0_GRVW1_GSU1_ISA908_IU1_KLA_LBSPP128_LPA2_LPB2_LRVW2_MAC_NLCA1_NLCB1_ONLL1_PGR1_PLR17_SIA3_SU32_SUS128_SRVW2_SNLL0_TT1_96_TLDS1_USFGROn1_VSn1_VW1_WSGRA1_WSGRB1_WG128_2_1_WGM2
    SolutionIndex: 83
    SolutionNameMin: Cijk_Alik_Bljk_SB_MT128x64x32_MI32x32x2x1_SE_1LDSB1_AF0EM1_AMAS0_BL1_DTL0_EPS0_FL0_GRVW4_GSU1_ISA908_IU1_KLA_LBSPP128_LPA4_LPB4_LRVW2_MAC_NLCA1_NLCB1_ONLL1_PGR2_PLR17_SIA3_SU32_SUS256_SRVW2_SNLL0_TT2_32_TLDS1_USFGROn1_VSn1_VW1_WSGRA1_WSGRB1_WG64_4_1_WGM2
    SolutionIndex: 84
    SolutionNameMin: Cijk_Alik_Bljk_SB_MT64x32x32_MI16x16x4x1_SE_1LDSB0_AF0EM1_AMAS0_BL1_DTL0_EPS0_FL0_GRVW1_GSU1_ISA908_IU1_KLA_LBSPP128_LPA2_LPB2_LRVW2_MAC_NLCA1_NLCB1_ONLL1_PGR2_PLR9_SIA3_SU32_SUS128_SRVW2_SNLL0_TT2_16_TLDS1_USFGROn1_VSn1_VW1_WSGRA1_WSGRB1_WG32_8_1_WGM15
    SolutionIndex: 85
    SolutionNameMin: Cijk_Alik_Bljk_SB_MT64x128x16_MI32x32x2x1_SE_1LDSB1_AF0EM1_AMAS0_BL1_DTL0_EPS0_FL0_GRVW1_GSU1_ISA908_IU1_KLA_LBSPP128_LPA2_LPB2_LRVW2_MAC_NLCA1_NLCB1_ONLL1_PGR2_PLR9_SIA3_SU32_SUS128_SRVW2_SNLL0_TT1_64_TLDS1_USFGROn1_VSn1_VW1_WSGRA1_WSGRB1_WG64_4_1_WGM15
    SolutionIndex: 86
    SolutionNameMin: Cijk_Alik_Bljk_SB_MT64x64x16_MI32x32x2x1_SE_1LDSB1_AF0EM1_AMAS0_BL1_DTL0_EPS1_FL0_GRVW4_GSU1_ISA908_IU1_KLA_LBSPP128_LPA4_LPB4_LRVW2_MAC_NLCA1_NLCB1_ONLL1_PGR1_PLR9_SIA3_SU32_SUS256_SRVW2_SNLL0_TT1_32_TLDS1_USFGROn1_VSn1_VW1_WSGRA1_WSGRB1_WG64_4_1_WGM1
    SolutionIndex: 87
    SolutionNameMin: Cijk_Alik_Bljk_SB_MT64x64x32_MI32x32x2x1_SE_1LDSB0_AF0EM1_AMAS0_BL1_DTL0_EPS0_FL0_GRVW2_GSU1_ISA908_IU1_KLA_LBSPP128_LPA2_LPB2_LRVW2_MAC_NLCA1_NLCB1_ONLL1_PGR2_PLR17_SIA3_SU0_SUS256_SRVW2_SNLL0_TT1_32_TLDS1_USFGROn1_VSn1_VW1_WSGRA1_WSGRB1_WG64_4_1_WGM2
    SolutionIndex: 88
    SolutionNameMin: Cijk_Alik_Bljk_SB_MT128x96x32_MI32x32x2x1_SE_1LDSB1_AF0EM1_AMAS0_BL1_DTL0_EPS1_FL0_GRVW4_GSU1_ISA908_IU1_KLA_LBSPP128_LPA4_LPB4_LRVW2_MAC_NLCA1_NLCB1_ONLL1_PGR1_PLR17_SIA3_SU32_SUS256_SRVW2_SNLL0_TT1_96_TLDS1_USFGROn1_VSn1_VW1_WSGRA1_WSGRB1_WG128_2_1_WGM15
    SolutionIndex: 89
    SolutionNameMin: Cijk_Alik_Bljk_SB_MT64x64x32_MI32x32x2x1_SE_1LDSB1_AF0EM1_AMAS0_BL1_DTL0_EPS0_FL0_GRVW4_GSU1_ISA908_IU1_KLA_LBSPP128_LPA4_LPB4_LRVW2_MAC_NLCA1_NLCB1_ONLL1_PGR2_PLR17_SIA3_SU32_SUS128_SRVW2_SNLL0_TT1_32_TLDS1_USFGROn1_VSn1_VW1_WSGRA1_WSGRB1_WG64_4_1_WGM1
    SolutionIndex: 90
    SolutionNameMin: Cijk_Alik_Bljk_SB_MT32x32x32_MI16x16x4x1_SN_1LDSB0_AF0EM1_AMAS0_BL1_DTL0_EPS0_FL0_GRVW1_GSU1_ISA908_IU1_KLA_LBSPP128_LPA2_LPB2_LRVW2_MAC_NLCA1_NLCB1_ONLL1_PGR2_PLR9_SIA3_SU32_SUS256_SRVW2_SNLL0_TT1_16_TLDS1_USFGROn1_VSn1_VW1_WSGRA1_WSGRB1_WG32_8_1_WGM15
    SolutionIndex: 91
    SolutionNameMin: Cijk_Alik_Bljk_SB_MT64x128x16_MI32x32x2x1_SE_1LDSB0_AF0EM1_AMAS0_BL1_DTL0_EPS1_FL0_GRVW4_GSU1_ISA908_IU2_KLA_LBSPP128_LPA4_LPB4_LRVW2_MAC_NLCA1_NLCB1_ONLL1_PGR1_PLR5_SIA3_SU0_SUS128_SRVW2_SNLL0_TT1_64_TLDS1_USFGROn1_VSn1_VW1_WSGRA1_WSGRB1_WG64_4_1_WGM8
    SolutionIndex: 92
    SolutionNameMin: Cijk_Alik_Bljk_SB_MT64x128x32_MI32x32x2x1_SE_1LDSB1_AF0EM1_AMAS0_BL1_DTL0_EPS0_FL0_GRVW4_GSU1_ISA908_IU1_KLA_LBSPP128_LPA4_LPB4_LRVW2_MAC_NLCA1_NLCB1_ONLL1_PGR2_PLR17_SIA3_SU0_SUS256_SRVW2_SNLL0_TT1_64_TLDS1_USFGROn1_VSn1_VW1_WSGRA1_WSGRB1_WG64_4_1_WGM1
    SolutionIndex: 93
    SolutionNameMin: Cijk_Alik_Bljk_SB_MT64x64x16_MI32x32x2x1_SE_1LDSB1_AF0EM1_AMAS0_BL1_DTL0_EPS0_FL0_GRVW4_GSU1_ISA908_IU1_KLA_LBSPP128_LPA4_LPB4_LRVW2_MAC_NLCA1_NLCB1_ONLL1_PGR2_PLR9_SIA3_SU32_SUS256_SRVW2_SNLL0_TT1_32_TLDS1_USFGROn1_VSn1_VW1_WSGRA1_WSGRB1_WG64_4_1_WGM15
    SolutionIndex: 94
    SolutionNameMin: Cijk_Alik_Bljk_SB_MT16x16x32_MI16x16x4x1_SE_1LDSB0_AF0EM1_AMAS3_BL1_DTL0_EPS0_FL0_GRVW2_GSU1_ISA908_IU1_KLA_LBSPP128_LPA2_LPB2_LRVW2_MAC_NLCA1_NLCB1_ONLL1_PGR2_PLR9_SIA3_SU0_SUS256_SRVW0_SNLL0_TT1_16_TLDS1_USFGROn1_VSn1_VW2_WSGRA1_WSGRB1_WG16_4_1_WGM2
    SolutionIndex: 95
    SolutionNameMin: Cijk_Alik_Bljk_SB_MT32x32x32_MI16x16x4x1_SE_1LDSB0_AF0EM1_AMAS0_BL1_DTL0_EPS0_FL0_GRVW1_GSU1_ISA908_IU1_KLA_LBSPP128_LPA2_LPB2_LRVW2_MAC_NLCA1_NLCB1_ONLL1_PGR2_PLR9_SIA3_SU32_SUS256_SRVW2_SNLL0_TT1_16_TLDS1_USFGROn1_VSn1_VW1_WSGRA1_WSGRB1_WG32_8_1_WGM15
    SolutionIndex: 96
    SolutionNameMin: Cijk_Alik_Bljk_SB_MT64x64x32_MI32x32x2x1_SE_1LDSB0_AF0EM1_AMAS0_BL1_DTL0_EPS0_FL0_GRVW4_GSU1_ISA908_IU1_KLA_LBSPP128_LPA4_LPB4_LRVW2_MAC_NLCA1_NLCB1_ONLL1_PGR2_PLR17_SIA3_SU32_SUS128_SRVW2_SNLL0_TT1_32_TLDS1_USFGROn1_VSn1_VW1_WSGRA1_WSGRB1_WG64_4_1_WGM15
    SolutionIndex: 97
    SolutionNameMin: Cijk_Alik_Bljk_SB_MT32x16x16_SN_1LDSB0_AF0EM1_AMAS3_BL1_DTL0_EPS1_FL0_GRVW2_GSU8_ISA908_IU1_KLA_LBSPP0_LPA0_LPB0_LRVW2_MAC_NLCA1_NLCB1_ONLL1_PGR1_PLR1_SIA1_SU32_SUS256_SRVW0_SNLL0_TT2_2_TLDS0_USFGRO0_VS1_VW2_WSGRA0_WSGRB0_WG16_8_2_WGM8
    SolutionIndex: 98
    SolutionNameMin: Cijk_Alik_Bljk_SB_MT64x128x16_MI32x32x2x1_SE_1LDSB0_AF0EM1_AMAS0_BL1_DTL0_EPS0_FL0_GRVW4_GSU1_ISA908_IU1_KLA_LBSPP128_LPA4_LPB4_LRVW2_MAC_NLCA1_NLCB1_ONLL1_PGR2_PLR9_SIA3_SU32_SUS128_SRVW2_SNLL0_TT1_64_TLDS1_USFGROn1_VSn1_VW1_WSGRA1_WSGRB1_WG64_4_1_WGM15
    SolutionIndex: 99
    SolutionNameMin: Cijk_Alik_Bljk_SB_MT64x64x32_MI32x32x2x1_SN_1LDSB1_AF0EM1_AMAS0_BL1_DTL0_EPS0_FL0_GRVW4_GSU1_ISA908_IU1_KLA_LBSPP128_LPA4_LPB4_LRVW2_MAC_NLCA1_NLCB1_ONLL1_PGR2_PLR17_SIA3_SU32_SUS256_SRVW2_SNLL0_TT1_32_TLDS1_USFGROn1_VSn1_VW1_WSGRA1_WSGRB1_WG64_4_1_WGM1
    SolutionIndex: 100
    SolutionNameMin: Cijk_Alik_Bljk_SB_MT16x16x16_SN_1LDSB0_AF0EM1_AMAS3_BL1_DTL0_EPS1_FL0_GRVW2_GSU4_ISA908_IU1_KLA_LBSPP0_LPA0_LPB0_LRVW2_MAC_NLCA1_NLCB1_ONLL1_PGR1_PLR1_SIA1_SU32_SUS256_SRVW0_SNLL0_TT2_2_TLDS0_USFGRO1_VS1_VW2_WSGRA0_WSGRB0_WG8_8_4_WGM1
    SolutionIndex: 101
    SolutionNameMin: Cijk_Alik_Bljk_SB_MT16x16x32_MI16x16x4x1_SE_1LDSB0_AF0EM1_AMAS3_BL1_DTL0_EPS0_FL0_GRVW2_GSU3_ISA908_IU1_KLA_LBSPP128_LPA2_LPB2_LRVW2_MAC_NLCA1_NLCB1_ONLL1_PGR2_PLR9_SIA3_SU0_SUS256_SRVW0_SNLL0_TT1_16_TLDS1_USFGROn1_VSn1_VW2_WSGRA1_WSGRB1_WG16_4_1_WGM1
    SolutionIndex: 102
    SolutionNameMin: Cijk_Alik_Bljk_SB_MT128x96x32_MI32x32x2x1_SE_1LDSB1_AF0EM1_AMAS0_BL1_DTL0_EPS1_FL0_GRVW1_GSU1_ISA908_IU1_KLA_LBSPP128_LPA2_LPB2_LRVW2_MAC_NLCA1_NLCB1_ONLL1_PGR1_PLR17_SIA3_SU32_SUS256_SRVW2_SNLL0_TT1_96_TLDS1_USFGROn1_VSn1_VW1_WSGRA1_WSGRB1_WG128_2_1_WGM1
    SolutionIndex: 103
    SolutionNameMin: Cijk_Alik_Bljk_SB_MT64x64x32_MI32x32x2x1_SE_1LDSB1_AF0EM1_AMAS0_BL1_DTL0_EPS1_FL0_GRVW4_GSU1_ISA908_IU1_KLA_LBSPP128_LPA4_LPB4_LRVW2_MAC_NLCA1_NLCB1_ONLL1_PGR1_PLR17_SIA3_SU32_SUS256_SRVW2_SNLL0_TT1_32_TLDS1_USFGROn1_VSn1_VW1_WSGRA1_WSGRB1_WG64_4_1_WGM15
    SolutionIndex: 104
    SolutionNameMin: Cijk_Alik_Bljk_SB_MT64x128x32_MI32x32x2x1_SE_1LDSB1_AF0EM1_AMAS0_BL1_DTL0_EPS0_FL0_GRVW4_GSU1_ISA908_IU1_KLA_LBSPP128_LPA4_LPB4_LRVW2_MAC_NLCA1_NLCB1_ONLL1_PGR2_PLR17_SIA3_SU32_SUS256_SRVW2_SNLL0_TT1_64_TLDS1_USFGROn1_VSn1_VW1_WSGRA1_WSGRB1_WG64_4_1_WGM1
    SolutionIndex: 105
    SolutionNameMin: Cijk_Alik_Bljk_SB_MT64x128x16_MI32x32x2x1_SE_1LDSB1_AF0EM1_AMAS0_BL1_DTL0_EPS0_FL0_GRVW4_GSU1_ISA908_IU1_KLA_LBSPP128_LPA4_LPB4_LRVW2_MAC_NLCA1_NLCB1_ONLL1_PGR2_PLR9_SIA3_SU32_SUS256_SRVW2_SNLL0_TT1_64_TLDS1_USFGROn1_VSn1_VW1_WSGRA1_WSGRB1_WG64_4_1_WGM15
    SolutionIndex: 106
    SolutionNameMin: Cijk_Alik_Bljk_SB_MT64x64x16_MI32x32x2x1_SE_1LDSB1_AF0EM1_AMAS0_BL1_DTL0_EPS1_FL0_GRVW2_GSU1_ISA908_IU1_KLA_LBSPP128_LPA2_LPB2_LRVW2_MAC_NLCA1_NLCB1_ONLL1_PGR1_PLR9_SIA3_SU0_SUS256_SRVW2_SNLL0_TT1_32_TLDS1_USFGROn1_VSn1_VW1_WSGRA1_WSGRB1_WG64_4_1_WGM15
    SolutionIndex: 107
    SolutionNameMin: Cijk_Alik_Bljk_SB_MT32x64x32_MI16x16x4x1_SE_1LDSB0_AF0EM1_AMAS0_BL1_DTL0_EPS0_FL0_GRVW1_GSU1_ISA908_IU1_KLA_LBSPP128_LPA2_LPB2_LRVW2_MAC_NLCA1_NLCB1_ONLL1_PGR2_PLR9_SIA3_SU0_SUS256_SRVW2_SNLL0_TT1_32_TLDS1_USFGROn1_VSn1_VW1_WSGRA1_WSGRB1_WG32_8_1_WGM2
    SolutionIndex: 108
    SolutionNameMin: Cijk_Alik_Bljk_SB_MT64x32x32_MI16x16x4x1_SE_1LDSB0_AF0EM1_AMAS0_BL1_DTL0_EPS0_FL0_GRVW1_GSU1_ISA908_IU1_KLA_LBSPP128_LPA2_LPB2_LRVW2_MAC_NLCA1_NLCB1_ONLL1_PGR2_PLR9_SIA3_SU0_SUS256_SRVW2_SNLL0_TT2_16_TLDS1_USFGROn1_VSn1_VW1_WSGRA1_WSGRB1_WG32_8_1_WGM1
    SolutionIndex: 109
    SolutionNameMin: Cijk_Alik_Bljk_SB_MT64x64x16_MI32x32x2x1_SE_1LDSB1_AF0EM1_AMAS0_BL1_DTL0_EPS0_FL0_GRVW4_GSU1_ISA908_IU1_KLA_LBSPP128_LPA4_LPB4_LRVW2_MAC_NLCA1_NLCB1_ONLL1_PGR2_PLR9_SIA3_SU32_SUS128_SRVW2_SNLL0_TT1_32_TLDS1_USFGROn1_VSn1_VW1_WSGRA1_WSGRB1_WG64_4_1_WGM2
    SolutionIndex: 110
    SolutionNameMin: Cijk_Alik_Bljk_SB_MT32x32x32_MI16x16x4x1_SE_1LDSB0_AF0EM1_AMAS0_BL1_DTL0_EPS0_FL0_GRVW1_GSU1_ISA908_IU2_KLA_LBSPP128_LPA2_LPB2_LRVW2_MAC_NLCA1_NLCB1_ONLL1_PGR2_PLR5_SIA3_SU32_SUS128_SRVW2_SNLL0_TT1_16_TLDS1_USFGROn1_VSn1_VW1_WSGRA1_WSGRB1_WG32_8_1_WGM1
    SolutionIndex: 111
    SolutionNameMin: Cijk_Alik_Bljk_SB_MT32x32x32_MI16x16x4x1_SE_1LDSB0_AF0EM1_AMAS0_BL1_DTL0_EPS0_FL0_GRVW1_GSU1_ISA908_IU1_KLA_LBSPP128_LPA2_LPB2_LRVW2_MAC_NLCA1_NLCB1_ONLL1_PGR2_PLR9_SIA3_SU0_SUS256_SRVW2_SNLL0_TT1_16_TLDS1_USFGROn1_VSn1_VW1_WSGRA1_WSGRB1_WG32_8_1_WGM15
    SolutionIndex: 112
    SolutionNameMin: Cijk_Alik_Bljk_SB_MT64x64x32_MI32x32x2x1_SE_1LDSB1_AF0EM1_AMAS0_BL1_DTL0_EPS0_FL0_GRVW4_GSU1_ISA908_IU1_KLA_LBSPP128_LPA4_LPB4_LRVW2_MAC_NLCA1_NLCB1_ONLL1_PGR2_PLR17_SIA3_SU32_SUS256_SRVW2_SNLL0_TT1_32_TLDS1_USFGROn1_VSn1_VW1_WSGRA1_WSGRB1_WG64_4_1_WGM15
    SolutionIndex: 113
    SolutionNameMin: Cijk_Alik_Bljk_SB_MT128x64x32_MI32x32x2x1_SE_1LDSB0_AF0EM1_AMAS0_BL1_DTL0_EPS0_FL0_GRVW4_GSU1_ISA908_IU1_KLA_LBSPP128_LPA4_LPB4_LRVW2_MAC_NLCA1_NLCB1_ONLL1_PGR2_PLR17_SIA3_SU0_SUS256_SRVW2_SNLL0_TT2_32_TLDS1_USFGROn1_VSn1_VW1_WSGRA1_WSGRB1_WG64_4_1_WGM1
    SolutionIndex: 114
    SolutionNameMin: Cijk_Alik_Bljk_SB_MT128x160x16_MI32x32x2x1_SE_1LDSB1_AF0EM1_AMAS0_BL1_DTL0_EPS1_FL0_GRVW1_GSU1_ISA908_IU1_KLA_LBSPP128_LPA2_LPB2_LRVW2_MAC_NLCA1_NLCB1_ONLL1_PGR1_PLR9_SIA3_SU32_SUS128_SRVW2_SNLL0_TT1_160_TLDS1_USFGROn1_VSn1_VW1_WSGRA1_WSGRB1_WG128_2_1_WGM1
    SolutionIndex: 115
    SolutionNameMin: Cijk_Alik_Bljk_SB_MT64x128x16_MI32x32x2x1_SE_1LDSB1_AF0EM1_AMAS0_BL1_DTL0_EPS0_FL0_GRVW2_GSU1_ISA908_IU1_KLA_LBSPP128_LPA2_LPB2_LRVW2_MAC_NLCA1_NLCB1_ONLL1_PGR2_PLR9_SIA3_SU0_SUS256_SRVW2_SNLL0_TT1_64_TLDS1_USFGROn1_VSn1_VW1_WSGRA1_WSGRB1_WG64_4_1_WGM15
    SolutionIndex: 116
    SolutionNameMin: Cijk_Alik_Bljk_SB_MT128x96x32_MI32x32x2x1_SE_1LDSB1_AF0EM1_AMAS0_BL1_DTL0_EPS0_FL0_GRVW4_GSU1_ISA908_IU1_KLA_LBSPP128_LPA4_LPB4_LRVW2_MAC_NLCA1_NLCB1_ONLL1_PGR2_PLR17_SIA3_SU32_SUS128_SRVW2_SNLL0_TT1_96_TLDS1_USFGROn1_VSn1_VW1_WSGRA1_WSGRB1_WG128_2_1_WGM15
    SolutionIndex: 117
    SolutionNameMin: Cijk_Alik_Bljk_SB_MT32x32x32_MI16x16x4x1_SE_1LDSB0_AF0EM1_AMAS0_BL1_DTL0_EPS0_FL0_GRVW4_GSU1_ISA908_IU1_KLA_LBSPP128_LPA4_LPB4_LRVW2_MAC_NLCA1_NLCB1_ONLL1_PGR2_PLR9_SIA3_SU0_SUS256_SRVW2_SNLL0_TT1_16_TLDS1_USFGROn1_VSn1_VW1_WSGRA1_WSGRB1_WG32_8_1_WGM8
    SolutionIndex: 118
    SolutionNameMin: Cijk_Alik_Bljk_SB_MT32x32x32_MI16x16x4x1_SE_1LDSB0_AF0EM1_AMAS0_BL1_DTL0_EPS0_FL0_GRVW2_GSU1_ISA908_IU1_KLA_LBSPP128_LPA2_LPB2_LRVW2_MAC_NLCA1_NLCB1_ONLL1_PGR2_PLR9_SIA3_SU0_SUS256_SRVW2_SNLL0_TT1_16_TLDS1_USFGROn1_VSn1_VW1_WSGRA1_WSGRB1_WG32_8_1_WGM1
    SolutionIndex: 119
    SolutionNameMin: Cijk_Alik_Bljk_SB_MT64x64x32_MI32x32x2x1_SE_1LDSB0_AF0EM1_AMAS0_BL1_DTL0_EPS0_FL0_GRVW4_GSU1_ISA908_IU1_KLA_LBSPP128_LPA4_LPB4_LRVW2_MAC_NLCA1_NLCB1_ONLL1_PGR2_PLR17_SIA3_SU32_SUS256_SRVW2_SNLL0_TT1_32_TLDS1_USFGROn1_VSn1_VW1_WSGRA1_WSGRB1_WG64_4_1_WGM2
    SolutionIndex: 120
    SolutionNameMin: Cijk_Alik_Bljk_SB_MT64x64x32_MI32x32x2x1_SE_1LDSB1_AF0EM1_AMAS0_BL1_DTL0_EPS1_FL0_GRVW4_GSU1_ISA908_IU1_KLA_LBSPP128_LPA4_LPB4_LRVW2_MAC_NLCA1_NLCB1_ONLL1_PGR1_PLR17_SIA3_SU32_SUS256_SRVW2_SNLL0_TT1_32_TLDS1_USFGROn1_VSn1_VW1_WSGRA1_WSGRB1_WG64_4_1_WGM1
    SolutionIndex: 121
    SolutionNameMin: Cijk_Alik_Bljk_SB_MT144x64x32_MI16x16x4x1_SE_1LDSB0_AF0EM1_AMAS0_BL1_DTL0_EPS1_FL0_GRVW1_GSU1_ISA908_IU1_KLA_LBSPP128_LPA2_LPB2_LRVW2_MAC_NLCA1_NLCB1_ONLL1_PGR1_PLR9_SIA3_SU0_SUS256_SRVW0_SNLL0_TT9_16_TLDS1_USFGROn1_VSn1_VW1_WSGRA1_WSGRB1_WG16_16_1_WGM1
    SolutionIndex: 122
    SolutionNameMin: Cijk_Alik_Bljk_SB_MT64x64x32_MI32x32x2x1_SE_1LDSB0_AF0EM1_AMAS0_BL1_DTL0_EPS0_FL0_GRVW4_GSU1_ISA908_IU1_KLA_LBSPP128_LPA4_LPB4_LRVW2_MAC_NLCA1_NLCB1_ONLL1_PGR2_PLR17_SIA3_SU32_SUS256_SRVW2_SNLL0_TT1_32_TLDS1_USFGROn1_VSn1_VW1_WSGRA1_WSGRB1_WG64_4_1_WGM1
    SolutionIndex: 123
    SolutionNameMin: Cijk_Alik_Bljk_SB_MT64x128x32_MI32x32x2x1_SN_1LDSB1_AF0EM1_AMAS0_BL1_DTL0_EPS1_FL0_GRVW4_GSU1_ISA908_IU1_KLA_LBSPP128_LPA4_LPB4_LRVW2_MAC_NLCA1_NLCB1_ONLL1_PGR1_PLR17_SIA3_SU32_SUS256_SRVW2_SNLL0_TT1_64_TLDS1_USFGROn1_VSn1_VW1_WSGRA1_WSGRB1_WG64_4_1_WGM2
    SolutionIndex: 124
    SolutionNameMin: Cijk_Alik_Bljk_SB_MT64x128x16_MI32x32x2x1_SE_1LDSB1_AF0EM1_AMAS0_BL1_DTL0_EPS1_FL0_GRVW1_GSU1_ISA908_IU1_KLA_LBSPP128_LPA2_LPB2_LRVW2_MAC_NLCA1_NLCB1_ONLL1_PGR1_PLR9_SIA3_SU32_SUS128_SRVW2_SNLL0_TT1_64_TLDS1_USFGROn1_VSn1_VW1_WSGRA1_WSGRB1_WG64_4_1_WGM15
    SolutionIndex: 125
    SolutionNameMin: Cijk_Alik_Bljk_SB_MT128x96x32_MI32x32x2x1_SE_1LDSB1_AF0EM1_AMAS0_BL1_DTL0_EPS1_FL0_GRVW4_GSU1_ISA908_IU1_KLA_LBSPP128_LPA4_LPB4_LRVW2_MAC_NLCA1_NLCB1_ONLL1_PGR1_PLR17_SIA3_SU0_SUS256_SRVW2_SNLL0_TT1_96_TLDS1_USFGROn1_VSn1_VW1_WSGRA1_WSGRB1_WG128_2_1_WGM2
    SolutionIndex: 126
    SolutionNameMin: Cijk_Alik_Bljk_SB_MT128x64x16_MI32x32x2x1_SE_1LDSB0_AF0EM1_AMAS0_BL1_DTL0_EPS0_FL0_GRVW2_GSU1_ISA908_IU1_KLA_LBSPP128_LPA2_LPB2_LRVW2_MAC_NLCA1_NLCB1_ONLL1_PGR2_PLR9_SIA3_SU0_SUS256_SRVW2_SNLL0_TT2_32_TLDS1_USFGROn1_VSn1_VW1_WSGRA1_WSGRB1_WG64_4_1_WGM2
    SolutionIndex: 127
    SolutionNameMin: Cijk_Alik_Bljk_SB_MT16x16x32_MI16x16x4x1_SE_1LDSB0_AF0EM1_AMAS3_BL1_DTL0_EPS0_FL0_GRVW4_GSU1_ISA908_IU1_KLA_LBSPP128_LPA4_LPB4_LRVW2_MAC_NLCA1_NLCB1_ONLL1_PGR2_PLR9_SIA3_SU32_SUS128_SRVW0_SNLL0_TT1_16_TLDS1_USFGROn1_VSn1_VW2_WSGRA1_WSGRB1_WG16_4_1_WGM1
    SolutionIndex: 128
    SolutionNameMin: Cijk_Alik_Bljk_SB_MT64x128x16_MI16x16x1x4_SE_1LDSB0_AF0EM1_AMAS0_BL1_DTL0_EPS1_FL0_GRVW4_GSU1_ISA908_IU1_KLA_LBSPP0_LPA0_LPB0_LRVW1_MAC_NLCA1_NLCB1_ONLL1_PGR1_PLR1_SIA3_SU32_SUS256_SRVW0_SNLL0_TT2_16_TLDS0_USFGROn1_VSn1_VW1_WSGRA1_WSGRB1_WG32_8_1_WGM8
    SolutionIndex: 129
    SolutionNameMin: Cijk_Alik_Bljk_SB_MT64x128x32_MI32x32x2x1_SE_1LDSB1_AF0EM1_AMAS0_BL1_DTL0_EPS0_FL0_GRVW4_GSU1_ISA908_IU1_KLA_LBSPP128_LPA4_LPB4_LRVW2_MAC_NLCA1_NLCB1_ONLL1_PGR2_PLR17_SIA3_SU0_SUS256_SRVW2_SNLL0_TT1_64_TLDS1_USFGROn1_VSn1_VW1_WSGRA1_WSGRB1_WG64_4_1_WGM15
    SolutionIndex: 130
    SolutionNameMin: Cijk_Alik_Bljk_SB_MT64x64x32_MI32x32x2x1_SN_1LDSB1_AF0EM1_AMAS0_BL1_DTL0_EPS1_FL0_GRVW2_GSU1_ISA908_IU1_KLA_LBSPP128_LPA2_LPB2_LRVW2_MAC_NLCA1_NLCB1_ONLL1_PGR1_PLR17_SIA3_SU32_SUS256_SRVW2_SNLL0_TT1_32_TLDS1_USFGROn1_VSn1_VW1_WSGRA1_WSGRB1_WG64_4_1_WGM2
    SolutionIndex: 131
    SolutionNameMin: Cijk_Alik_Bljk_SB_MT64x64x32_MI32x32x2x1_SE_1LDSB0_AF0EM1_AMAS0_BL1_DTL0_EPS0_FL0_GRVW2_GSU1_ISA908_IU1_KLA_LBSPP128_LPA2_LPB2_LRVW2_MAC_NLCA1_NLCB1_ONLL1_PGR2_PLR17_SIA3_SU32_SUS256_SRVW2_SNLL0_TT1_32_TLDS1_USFGROn1_VSn1_VW1_WSGRA1_WSGRB1_WG64_4_1_WGM15
    SolutionIndex: 132
    SolutionNameMin: Cijk_Alik_Bljk_SB_MT64x64x32_MI16x16x4x1_SE_1LDSB0_AF0EM1_AMAS3_BL1_DTL0_EPS1_FL0_GRVW4_GSU1_ISA908_IU1_KLA_LBSPP0_LPA0_LPB0_LRVW1_MAC_NLCA1_NLCB1_ONLL1_PGR1_PLR1_SIA3_SU32_SUS256_SRVW0_SNLL0_TT2_32_TLDS0_USFGROn1_VSn1_VW4_WSGRA1_WSGRB1_WG32_8_1_WGM8
    SolutionIndex: 133
    SolutionNameMin: Cijk_Alik_Bljk_SB_MT16x16x32_MI16x16x4x1_SE_1LDSB1_AF0EM1_AMAS3_BL1_DTL0_EPS1_FL0_GRVW4_GSU5_ISA908_IU1_KLA_LBSPP128_LPA4_LPB4_LRVW2_MAC_NLCA1_NLCB1_ONLL1_PGR1_PLR9_SIA3_SU0_SUS256_SRVW0_SNLL0_TT1_16_TLDS1_USFGROn1_VSn1_VW2_WSGRA1_WSGRB1_WG16_4_1_WGM1
    SolutionIndex: 134
    SolutionNameMin: Cijk_Alik_Bljk_SB_MT32x32x32_SE_1LDSB0_AF0EM1_AMAS3_BL1_DTL0_EPS1_FL1_GRVW4_GSU1_ISA908_IU1_KLA_LBSPP0_LPA2_LPB2_LRVW2_MAC_NLCA1_NLCB1_ONLL1_PGR1_PLR1_SIA1_SU32_SUS256_SRVW0_SNLL0_TT4_2_TLDS0_USFGRO1_VS1_VW2_WSGRA0_WSGRB0_WG8_16_1_WGM1
    SolutionIndex: 135
    SolutionNameMin: Cijk_Alik_Bljk_SB_MT144x64x32_MI16x16x4x1_SE_1LDSB1_AF0EM1_AMAS0_BL1_DTL0_EPS1_FL0_GRVW1_GSU1_ISA908_IU1_KLA_LBSPP128_LPA2_LPB2_LRVW2_MAC_NLCA1_NLCB1_ONLL1_PGR1_PLR9_SIA3_SU32_SUS256_SRVW0_SNLL0_TT9_16_TLDS1_USFGROn1_VSn1_VW1_WSGRA1_WSGRB1_WG16_16_1_WGM15
    SolutionIndex: 136
    SolutionNameMin: Cijk_Alik_Bljk_SB_MT64x128x16_MI32x32x2x1_SE_1LDSB1_AF0EM1_AMAS0_BL1_DTL0_EPS0_FL0_GRVW1_GSU1_ISA908_IU1_KLA_LBSPP128_LPA2_LPB2_LRVW2_MAC_NLCA1_NLCB1_ONLL1_PGR2_PLR9_SIA3_SU0_SUS256_SRVW2_SNLL0_TT1_64_TLDS1_USFGROn1_VSn1_VW1_WSGRA1_WSGRB1_WG64_4_1_WGM1
    SolutionIndex: 137
    SolutionNameMin: Cijk_Alik_Bljk_SB_MT32x32x32_MI16x16x4x1_SE_1LDSB1_AF0EM1_AMAS0_BL1_DTL0_EPS1_FL0_GRVW2_GSU1_ISA908_IU1_KLA_LBSPP128_LPA2_LPB2_LRVW2_MAC_NLCA1_NLCB1_ONLL1_PGR1_PLR9_SIA3_SU0_SUS256_SRVW2_SNLL0_TT1_16_TLDS1_USFGROn1_VSn1_VW1_WSGRA1_WSGRB1_WG32_8_1_WGM1
    SolutionIndex: 138
    SolutionNameMin: Cijk_Alik_Bljk_SB_MT64x128x32_MI32x32x2x1_SE_1LDSB1_AF0EM1_AMAS0_BL1_DTL0_EPS1_FL0_GRVW4_GSU1_ISA908_IU1_KLA_LBSPP128_LPA4_LPB4_LRVW2_MAC_NLCA1_NLCB1_ONLL1_PGR1_PLR17_SIA3_SU0_SUS256_SRVW2_SNLL0_TT1_64_TLDS1_USFGROn1_VSn1_VW1_WSGRA1_WSGRB1_WG64_4_1_WGM15
    SolutionIndex: 139
    SolutionNameMin: Cijk_Alik_Bljk_SB_MT64x64x24_MI16x16x4x1_SE_1LDSB0_AF0EM1_AMAS3_BL1_DTL0_EPS1_FL0_GRVW1_GSU1_ISA908_IU1_KLA_LBSPP0_LPA0_LPB0_LRVW1_MAC_NLCA3_NLCB3_ONLL1_PGR1_PLR1_SIA3_SU32_SUS256_SRVW0_SNLL0_TT2_32_TLDS1_USFGROn1_VSn1_VW4_WSGRA1_WSGRB1_WG32_8_1_WGM8
    SolutionIndex: 140
    SolutionNameMin: Cijk_Alik_Bljk_SB_MT16x16x32_MI16x16x4x1_SE_1LDSB0_AF0EM1_AMAS3_BL1_DTL0_EPS0_FL0_GRVW4_GSU3_ISA908_IU1_KLA_LBSPP128_LPA4_LPB4_LRVW2_MAC_NLCA1_NLCB1_ONLL1_PGR2_PLR9_SIA3_SU0_SUS256_SRVW0_SNLL0_TT1_16_TLDS1_USFGROn1_VSn1_VW2_WSGRA1_WSGRB1_WG16_4_1_WGM15
    SolutionIndex: 141
    SolutionNameMin: Cijk_Alik_Bljk_SB_MT64x64x16_MI32x32x2x1_SE_1LDSB0_AF0EM1_AMAS0_BL1_DTL0_EPS0_FL0_GRVW4_GSU1_ISA908_IU1_KLA_LBSPP128_LPA4_LPB4_LRVW2_MAC_NLCA1_NLCB1_ONLL1_PGR2_PLR9_SIA3_SU32_SUS256_SRVW2_SNLL0_TT1_32_TLDS1_USFGROn1_VSn1_VW1_WSGRA1_WSGRB1_WG64_4_1_WGM2
    SolutionIndex: 142
    SolutionNameMin: Cijk_Alik_Bljk_SB_MT32x64x32_MI16x16x4x1_SE_1LDSB1_AF0EM1_AMAS0_BL1_DTL0_EPS0_FL0_GRVW2_GSU3_ISA908_IU1_KLA_LBSPP128_LPA2_LPB2_LRVW2_MAC_NLCA1_NLCB1_ONLL1_PGR2_PLR9_SIA3_SU32_SUS256_SRVW0_SNLL0_TT1_32_TLDS1_USFGROn1_VSn1_VW1_WSGRA1_WSGRB1_WG32_8_1_WGM15
    SolutionIndex: 143
    SolutionNameMin: Cijk_Alik_Bljk_SB_MT32x64x32_MI16x16x4x1_SE_1LDSB0_AF0EM1_AMAS0_BL1_DTL0_EPS0_FL0_GRVW1_GSU1_ISA908_IU1_KLA_LBSPP128_LPA2_LPB2_LRVW2_MAC_NLCA1_NLCB1_ONLL1_PGR2_PLR9_SIA3_SU32_SUS128_SRVW2_SNLL0_TT1_32_TLDS1_USFGROn1_VSn1_VW1_WSGRA1_WSGRB1_WG32_8_1_WGM1
    SolutionIndex: 144
    SolutionNameMin: Cijk_Alik_Bljk_SB_MT64x128x16_MI32x32x2x1_SE_1LDSB1_AF0EM1_AMAS0_BL1_DTL0_EPS0_FL0_GRVW4_GSU1_ISA908_IU1_KLA_LBSPP128_LPA4_LPB4_LRVW2_MAC_NLCA1_NLCB1_ONLL1_PGR2_PLR9_SIA3_SU0_SUS256_SRVW2_SNLL0_TT1_64_TLDS1_USFGROn1_VSn1_VW1_WSGRA1_WSGRB1_WG64_4_1_WGM2
    SolutionIndex: 145
    SolutionNameMin: Cijk_Alik_Bljk_SB_MT32x64x24_MI16x16x4x1_SE_1LDSB0_AF0EM1_AMAS3_BL1_DTL0_EPS1_FL0_GRVW1_GSU1_ISA908_IU1_KLA_LBSPP0_LPA0_LPB0_LRVW1_MAC_NLCA3_NLCB3_ONLL1_PGR1_PLR1_SIA3_SU32_SUS256_SRVW0_SNLL0_TT2_16_TLDS1_USFGROn1_VSn1_VW4_WSGRA1_WSGRB1_WG16_16_1_WGM8
    SolutionIndex: 146
    SolutionNameMin: Cijk_Alik_Bljk_SB_MT32x32x32_MI16x16x4x1_SE_1LDSB1_AF0EM1_AMAS0_BL1_DTL0_EPS0_FL0_GRVW4_GSU1_ISA908_IU1_KLA_LBSPP128_LPA4_LPB4_LRVW2_MAC_NLCA1_NLCB1_ONLL1_PGR2_PLR9_SIA3_SU32_SUS128_SRVW2_SNLL0_TT1_16_TLDS1_USFGROn1_VSn1_VW1_WSGRA1_WSGRB1_WG32_8_1_WGM1
    SolutionIndex: 147
    SolutionNameMin: Cijk_Alik_Bljk_SB_MT128x96x32_MI32x32x2x1_SE_1LDSB1_AF0EM1_AMAS0_BL1_DTL0_EPS1_FL0_GRVW4_GSU1_ISA908_IU1_KLA_LBSPP128_LPA4_LPB4_LRVW2_MAC_NLCA1_NLCB1_ONLL1_PGR1_PLR17_SIA3_SU32_SUS128_SRVW2_SNLL0_TT1_96_TLDS1_USFGROn1_VSn1_VW1_WSGRA1_WSGRB1_WG128_2_1_WGM15
    SolutionIndex: 148
    SolutionNameMin: Cijk_Alik_Bljk_SB_MT64x64x32_MI32x32x2x1_SE_1LDSB1_AF0EM1_AMAS0_BL1_DTL0_EPS1_FL0_GRVW1_GSU1_ISA908_IU1_KLA_LBSPP128_LPA2_LPB2_LRVW2_MAC_NLCA1_NLCB1_ONLL1_PGR1_PLR17_SIA3_SU32_SUS256_SRVW2_SNLL0_TT1_32_TLDS1_USFGROn1_VSn1_VW1_WSGRA1_WSGRB1_WG64_4_1_WGM2
    SolutionIndex: 149
    SolutionNameMin: Cijk_Alik_Bljk_SB_MT128x64x32_MI32x32x2x1_SE_1LDSB0_AF0EM1_AMAS0_BL1_DTL0_EPS0_FL0_GRVW4_GSU1_ISA908_IU1_KLA_LBSPP128_LPA4_LPB4_LRVW2_MAC_NLCA1_NLCB1_ONLL1_PGR2_PLR17_SIA3_SU0_SUS256_SRVW2_SNLL0_TT2_32_TLDS1_USFGROn1_VSn1_VW1_WSGRA1_WSGRB1_WG64_4_1_WGM2
    SolutionIndex: 150
    SolutionNameMin: Cijk_Alik_Bljk_SB_MT64x64x32_MI32x32x2x1_SE_1LDSB0_AF0EM1_AMAS0_BL1_DTL0_EPS0_FL0_GRVW4_GSU1_ISA908_IU1_KLA_LBSPP128_LPA4_LPB4_LRVW2_MAC_NLCA1_NLCB1_ONLL1_PGR2_PLR17_SIA3_SU32_SUS256_SRVW2_SNLL0_TT1_32_TLDS1_USFGROn1_VSn1_VW1_WSGRA1_WSGRB1_WG64_4_1_WGM15
    SolutionIndex: 151
    SolutionNameMin: Cijk_Alik_Bljk_SB_MT64x128x32_MI32x32x2x1_SE_1LDSB1_AF0EM1_AMAS0_BL1_DTL0_EPS0_FL0_GRVW1_GSU1_ISA908_IU1_KLA_LBSPP128_LPA2_LPB2_LRVW2_MAC_NLCA1_NLCB1_ONLL1_PGR2_PLR17_SIA3_SU0_SUS256_SRVW2_SNLL0_TT1_64_TLDS1_USFGROn1_VSn1_VW1_WSGRA1_WSGRB1_WG64_4_1_WGM1
    SolutionIndex: 152
    SolutionNameMin: Cijk_Alik_Bljk_SB_MT64x64x32_MI32x32x2x1_SE_1LDSB1_AF0EM1_AMAS0_BL1_DTL0_EPS1_FL0_GRVW4_GSU1_ISA908_IU1_KLA_LBSPP128_LPA4_LPB4_LRVW2_MAC_NLCA1_NLCB1_ONLL1_PGR1_PLR17_SIA3_SU0_SUS256_SRVW2_SNLL0_TT1_32_TLDS1_USFGROn1_VSn1_VW1_WSGRA1_WSGRB1_WG64_4_1_WGM15
    SolutionIndex: 153
    SolutionNameMin: Cijk_Alik_Bljk_SB_MT64x144x16_MI16x16x4x1_SE_1LDSB1_AF0EM1_AMAS0_BL1_DTL0_EPS0_FL0_GRVW1_GSU1_ISA908_IU1_KLA_LBSPP128_LPA2_LPB2_LRVW2_MAC_NLCA1_NLCB1_ONLL1_PGR2_PLR5_SIA3_SU32_SUS256_SRVW2_SNLL0_TT1_144_TLDS1_USFGROn1_VSn1_VW1_WSGRA1_WSGRB1_WG64_4_1_WGM15
    SolutionIndex: 154
    SolutionNameMin: Cijk_Alik_Bljk_SB_MT32x32x32_MI16x16x4x1_SE_1LDSB0_AF0EM1_AMAS0_BL1_DTL0_EPS0_FL0_GRVW2_GSU1_ISA908_IU1_KLA_LBSPP128_LPA2_LPB2_LRVW2_MAC_NLCA1_NLCB1_ONLL1_PGR2_PLR9_SIA3_SU32_SUS128_SRVW2_SNLL0_TT1_16_TLDS1_USFGROn1_VSn1_VW1_WSGRA1_WSGRB1_WG32_8_1_WGM1
    SolutionIndex: 155
    SolutionNameMin: Cijk_Alik_Bljk_SB_MT16x16x32_MI16x16x4x1_SE_1LDSB1_AF0EM1_AMAS3_BL1_DTL0_EPS1_FL0_GRVW4_GSU1_ISA908_IU1_KLA_LBSPP128_LPA4_LPB4_LRVW2_MAC_NLCA1_NLCB1_ONLL1_PGR1_PLR9_SIA3_SU0_SUS256_SRVW0_SNLL0_TT1_16_TLDS1_USFGROn1_VSn1_VW2_WSGRA1_WSGRB1_WG16_4_1_WGM15
    SolutionIndex: 156
    SolutionNameMin: Cijk_Alik_Bljk_SB_MT64x64x32_MI32x32x2x1_SE_1LDSB1_AF0EM1_AMAS0_BL1_DTL0_EPS1_FL0_GRVW4_GSU1_ISA908_IU1_KLA_LBSPP128_LPA4_LPB4_LRVW2_MAC_NLCA1_NLCB1_ONLL1_PGR1_PLR17_SIA3_SU0_SUS256_SRVW2_SNLL0_TT1_32_TLDS1_USFGROn1_VSn1_VW1_WSGRA1_WSGRB1_WG64_4_1_WGM2
    SolutionIndex: 157
    SolutionNameMin: Cijk_Alik_Bljk_SB_MT64x128x32_MI32x32x2x1_SE_1LDSB1_AF0EM1_AMAS0_BL1_DTL0_EPS0_FL0_GRVW1_GSU1_ISA908_IU1_KLA_LBSPP128_LPA2_LPB2_LRVW2_MAC_NLCA1_NLCB1_ONLL1_PGR2_PLR17_SIA3_SU32_SUS128_SRVW2_SNLL0_TT1_64_TLDS1_USFGROn1_VSn1_VW1_WSGRA1_WSGRB1_WG64_4_1_WGM2
    SolutionIndex: 158
    SolutionNameMin: Cijk_Alik_Bljk_SB_MT32x64x16_MI16x16x4x1_SE_1LDSB1_AF0EM1_AMAS0_BL1_DTL0_EPS0_FL0_GRVW4_GSU1_ISA908_IU1_KLA_LBSPP128_LPA4_LPB4_LRVW2_MAC_NLCA1_NLCB1_ONLL1_PGR2_PLR5_SIA3_SU0_SUS256_SRVW2_SNLL0_TT1_32_TLDS1_USFGROn1_VSn1_VW1_WSGRA1_WSGRB1_WG32_8_1_WGM15
    SolutionIndex: 159
    SolutionNameMin: Cijk_Alik_Bljk_SB_MT96x96x32_MI16x16x4x1_SE_1LDSB1_AF0EM1_AMAS0_BL1_DTL0_EPS0_FL0_GRVW4_GSU1_ISA908_IU1_KLA_LBSPP128_LPA4_LPB4_LRVW2_MAC_NLCA1_NLCB1_ONLL1_PGR2_PLR9_SIA3_SU32_SUS256_SRVW0_SNLL0_TT3_48_TLDS1_USFGROn1_VSn1_VW1_WSGRA1_WSGRB1_WG32_8_1_WGM15
    SolutionIndex: 160
    SolutionNameMin: Cijk_Alik_Bljk_SB_MT128x64x32_MI32x32x2x1_SE_1LDSB1_AF0EM1_AMAS0_BL1_DTL0_EPS0_FL0_GRVW2_GSU1_ISA908_IU1_KLA_LBSPP128_LPA2_LPB2_LRVW2_MAC_NLCA1_NLCB1_ONLL1_PGR2_PLR17_SIA3_SU32_SUS256_SRVW2_SNLL0_TT2_32_TLDS1_USFGROn1_VSn1_VW1_WSGRA1_WSGRB1_WG64_4_1_WGM1
    SolutionIndex: 161
    SolutionNameMin: Cijk_Alik_Bljk_SB_MT128x96x32_MI32x32x2x1_SE_1LDSB1_AF0EM1_AMAS0_BL1_DTL0_EPS0_FL0_GRVW1_GSU1_ISA908_IU1_KLA_LBSPP128_LPA2_LPB2_LRVW2_MAC_NLCA1_NLCB1_ONLL1_PGR2_PLR17_SIA3_SU32_SUS256_SRVW2_SNLL0_TT1_96_TLDS1_USFGROn1_VSn1_VW1_WSGRA1_WSGRB1_WG128_2_1_WGM15
    SolutionIndex: 162
    SolutionNameMin: Cijk_Alik_Bljk_SB_MT64x32x32_MI16x16x4x1_SE_1LDSB0_AF0EM1_AMAS0_BL1_DTL0_EPS0_FL0_GRVW1_GSU1_ISA908_IU1_KLA_LBSPP128_LPA2_LPB2_LRVW2_MAC_NLCA1_NLCB1_ONLL1_PGR2_PLR9_SIA3_SU0_SUS256_SRVW2_SNLL0_TT2_16_TLDS1_USFGROn1_VSn1_VW1_WSGRA1_WSGRB1_WG32_8_1_WGM2
    SolutionIndex: 163
    SolutionNameMin: Cijk_Alik_Bljk_SB_MT64x128x16_MI32x32x2x1_SE_1LDSB1_AF0EM1_AMAS0_BL1_DTL0_EPS0_FL0_GRVW1_GSU1_ISA908_IU1_KLA_LBSPP128_LPA2_LPB2_LRVW2_MAC_NLCA1_NLCB1_ONLL1_PGR2_PLR9_SIA3_SU32_SUS256_SRVW2_SNLL0_TT1_64_TLDS1_USFGROn1_VSn1_VW1_WSGRA1_WSGRB1_WG64_4_1_WGM1
    SolutionIndex: 164
    SolutionNameMin: Cijk_Alik_Bljk_SB_MT16x16x32_MI16x16x4x1_SE_1LDSB1_AF0EM1_AMAS3_BL1_DTL0_EPS1_FL0_GRVW2_GSU1_ISA908_IU1_KLA_LBSPP128_LPA2_LPB2_LRVW2_MAC_NLCA1_NLCB1_ONLL1_PGR1_PLR9_SIA3_SU0_SUS256_SRVW0_SNLL0_TT1_16_TLDS1_USFGROn1_VSn1_VW2_WSGRA1_WSGRB1_WG16_4_1_WGM1
    SolutionIndex: 165
    SolutionNameMin: Cijk_Alik_Bljk_SB_MT64x32x32_MI16x16x4x1_SE_1LDSB0_AF0EM1_AMAS0_BL1_DTL0_EPS0_FL0_GRVW2_GSU1_ISA908_IU1_KLA_LBSPP128_LPA2_LPB2_LRVW2_MAC_NLCA1_NLCB1_ONLL1_PGR2_PLR9_SIA3_SU32_SUS128_SRVW2_SNLL0_TT2_16_TLDS1_USFGROn1_VSn1_VW1_WSGRA1_WSGRB1_WG32_8_1_WGM15
    SolutionIndex: 166
    SolutionNameMin: Cijk_Alik_Bljk_SB_MT16x64x32_MI16x16x4x1_SE_1LDSB0_AF0EM1_AMAS3_BL1_DTL0_EPS0_FL0_GRVW4_GSU5_ISA908_IU1_KLA_LBSPP128_LPA4_LPB4_LRVW2_MAC_NLCA1_NLCB1_ONLL1_PGR2_PLR9_SIA3_SU32_SUS256_SRVW0_SNLL0_TT1_16_TLDS1_USFGROn1_VSn1_VW2_WSGRA1_WSGRB1_WG16_16_1_WGM1
    SolutionIndex: 167
    SolutionNameMin: Cijk_Alik_Bljk_SB_MT16x16x32_MI16x16x4x1_SE_1LDSB0_AF0EM1_AMAS3_BL1_DTL0_EPS0_FL0_GRVW4_GSU5_ISA908_IU1_KLA_LBSPP128_LPA4_LPB4_LRVW2_MAC_NLCA1_NLCB1_ONLL1_PGR2_PLR9_SIA3_SU0_SUS256_SRVW0_SNLL0_TT1_16_TLDS1_USFGROn1_VSn1_VW2_WSGRA1_WSGRB1_WG16_4_1_WGM2
    SolutionIndex: 168
    SolutionNameMin: Cijk_Alik_Bljk_SB_MT64x144x32_MI16x16x4x1_SE_1LDSB0_AF0EM1_AMAS0_BL1_DTL0_EPS0_FL0_GRVW1_GSU1_ISA908_IU1_KLA_LBSPP128_LPA2_LPB2_LRVW2_MAC_NLCA1_NLCB1_ONLL1_PGR2_PLR9_SIA3_SU32_SUS128_SRVW2_SNLL0_TT1_144_TLDS1_USFGROn1_VSn1_VW1_WSGRA1_WSGRB1_WG64_4_1_WGM15
    SolutionIndex: 169
    SolutionNameMin: Cijk_Alik_Bljk_SB_MT128x64x16_MI32x32x2x1_SE_1LDSB0_AF0EM1_AMAS0_BL1_DTL0_EPS0_FL0_GRVW4_GSU1_ISA908_IU1_KLA_LBSPP128_LPA4_LPB4_LRVW2_MAC_NLCA1_NLCB1_ONLL1_PGR2_PLR9_SIA3_SU0_SUS256_SRVW2_SNLL0_TT2_32_TLDS1_USFGROn1_VSn1_VW1_WSGRA1_WSGRB1_WG64_4_1_WGM1
    SolutionIndex: 170
    SolutionNameMin: Cijk_Alik_Bljk_SB_MT64x128x16_MI32x32x2x1_SE_1LDSB1_AF0EM1_AMAS0_BL1_DTL0_EPS0_FL0_GRVW4_GSU1_ISA908_IU1_KLA_LBSPP128_LPA4_LPB4_LRVW2_MAC_NLCA1_NLCB1_ONLL1_PGR2_PLR9_SIA3_SU0_SUS256_SRVW2_SNLL0_TT1_64_TLDS1_USFGROn1_VSn1_VW1_WSGRA1_WSGRB1_WG64_4_1_WGM1
    SolutionIndex: 171
    SolutionNameMin: Cijk_Alik_Bljk_SB_MT64x64x32_MI32x32x2x1_SE_1LDSB1_AF0EM1_AMAS0_BL1_DTL0_EPS1_FL0_GRVW4_GSU1_ISA908_IU1_KLA_LBSPP128_LPA4_LPB4_LRVW2_MAC_NLCA1_NLCB1_ONLL1_PGR1_PLR17_SIA3_SU32_SUS128_SRVW2_SNLL0_TT1_32_TLDS1_USFGROn1_VSn1_VW1_WSGRA1_WSGRB1_WG64_4_1_WGM2
    SolutionIndex: 172
    SolutionNameMin: Cijk_Alik_Bljk_SB_MT32x64x32_MI16x16x4x1_SE_1LDSB1_AF0EM1_AMAS0_BL1_DTL0_EPS1_FL0_GRVW4_GSU1_ISA908_IU1_KLA_LBSPP128_LPA4_LPB4_LRVW2_MAC_NLCA1_NLCB1_ONLL1_PGR1_PLR9_SIA3_SU0_SUS256_SRVW2_SNLL0_TT1_32_TLDS1_USFGROn1_VSn1_VW1_WSGRA1_WSGRB1_WG32_8_1_WGM15
    SolutionIndex: 173
    SolutionNameMin: Cijk_Alik_Bljk_SB_MT144x64x32_MI16x16x4x1_SE_1LDSB1_AF0EM1_AMAS0_BL1_DTL0_EPS0_FL0_GRVW1_GSU1_ISA908_IU1_KLA_LBSPP128_LPA2_LPB2_LRVW2_MAC_NLCA1_NLCB1_ONLL1_PGR2_PLR9_SIA3_SU32_SUS256_SRVW0_SNLL0_TT9_16_TLDS1_USFGROn1_VSn1_VW1_WSGRA1_WSGRB1_WG16_16_1_WGM15
    SolutionIndex: 174
    SolutionNameMin: Cijk_Alik_Bljk_SB_MT64x128x32_MI32x32x2x1_SE_1LDSB0_AF0EM1_AMAS0_BL1_DTL0_EPS0_FL0_GRVW4_GSU1_ISA908_IU1_KLA_LBSPP128_LPA4_LPB4_LRVW2_MAC_NLCA1_NLCB1_ONLL1_PGR2_PLR17_SIA3_SU0_SUS256_SRVW2_SNLL0_TT1_64_TLDS1_USFGROn1_VSn1_VW1_WSGRA1_WSGRB1_WG64_4_1_WGM1
    SolutionIndex: 175
    SolutionNameMin: Cijk_Alik_Bljk_SB_MT64x144x16_MI16x16x4x1_SE_1LDSB1_AF0EM1_AMAS0_BL1_DTL0_EPS0_FL0_GRVW1_GSU1_ISA908_IU1_KLA_LBSPP128_LPA2_LPB2_LRVW2_MAC_NLCA1_NLCB1_ONLL1_PGR2_PLR5_SIA3_SU32_SUS256_SRVW2_SNLL0_TT1_144_TLDS1_USFGROn1_VSn1_VW1_WSGRA1_WSGRB1_WG64_4_1_WGM2
    SolutionIndex: 176
    SolutionNameMin: Cijk_Alik_Bljk_SB_MT64x128x32_MI32x32x2x1_SE_1LDSB1_AF0EM1_AMAS0_BL1_DTL0_EPS1_FL0_GRVW1_GSU1_ISA908_IU1_KLA_LBSPP128_LPA2_LPB2_LRVW2_MAC_NLCA1_NLCB1_ONLL1_PGR1_PLR17_SIA3_SU32_SUS128_SRVW2_SNLL0_TT1_64_TLDS1_USFGROn1_VSn1_VW1_WSGRA1_WSGRB1_WG64_4_1_WGM2
    SolutionIndex: 177
    SolutionNameMin: Cijk_Alik_Bljk_SB_MT8x32x32_SE_1LDSB0_AF0EM1_AMAS3_BL1_DTL0_EPS1_FL0_GRVW2_GSU1_ISA908_IU1_KLA_LBSPP0_LPA0_LPB2_LRVW2_MAC_NLCA1_NLCB1_ONLL1_PGR1_PLR1_SIA1_SU32_SUS256_SRVW0_SNLL0_TT2_2_TLDS0_USFGRO1_VS1_VW2_WSGRA0_WSGRB0_WG4_16_4_WGM8
    SolutionIndex: 178
    SolutionNameMin: Cijk_Alik_Bljk_SB_MT64x64x16_MI16x16x1x4_SE_1LDSB0_AF0EM1_AMAS0_BL1_DTL0_EPS1_FL0_GRVW4_GSU1_ISA908_IU1_KLA_LBSPP0_LPA0_LPB0_LRVW1_MAC_NLCA1_NLCB1_ONLL1_PGR1_PLR1_SIA1_SU32_SUS256_SRVW0_SNLL0_TT1_16_TLDS0_USFGROn1_VSn1_VW1_WSGRA0_WSGRB0_WG64_4_1_WGM8
    SolutionIndex: 179
    SolutionNameMin: Cijk_Alik_Bljk_SB_MT64x64x16_MI32x32x2x1_SE_1LDSB1_AF0EM1_AMAS0_BL1_DTL0_EPS1_FL0_GRVW1_GSU1_ISA908_IU1_KLA_LBSPP128_LPA2_LPB2_LRVW2_MAC_NLCA1_NLCB1_ONLL1_PGR1_PLR9_SIA3_SU0_SUS256_SRVW2_SNLL0_TT1_32_TLDS1_USFGROn1_VSn1_VW1_WSGRA1_WSGRB1_WG64_4_1_WGM2
    SolutionIndex: 180
    SolutionNameMin: Cijk_Alik_Bljk_SB_MT32x32x32_MI16x16x4x1_SE_1LDSB0_AF0EM1_AMAS0_BL1_DTL0_EPS0_FL0_GRVW1_GSU1_ISA908_IU1_KLA_LBSPP128_LPA2_LPB2_LRVW2_MAC_NLCA1_NLCB1_ONLL1_PGR2_PLR9_SIA3_SU32_SUS128_SRVW2_SNLL0_TT1_16_TLDS1_USFGROn1_VSn1_VW1_WSGRA1_WSGRB1_WG32_8_1_WGM15
    SolutionIndex: 181
    SolutionNameMin: Cijk_Alik_Bljk_SB_MT128x32x64_MI32x32x2x1_SE_1LDSB1_AF0EM1_AMAS0_BL1_DTL0_EPS1_FL0_GRVW4_GSU1_ISA908_IU1_KLA_LBSPP256_LPA4_LPB4_LRVW4_MAC_NLCA1_NLCB1_ONLL1_PGR1_PLR33_SIA3_SU32_SUS256_SRVW0_SNLL0_TT1_32_TLDS1_USFGROn1_VSn1_VW1_WSGRA1_WSGRB1_WG128_2_1_WGM2
    SolutionIndex: 182
    SolutionNameMin: Cijk_Alik_Bljk_SB_MT64x128x32_MI32x32x2x1_SE_1LDSB1_AF0EM1_AMAS0_BL1_DTL0_EPS0_FL0_GRVW2_GSU1_ISA908_IU1_KLA_LBSPP128_LPA2_LPB2_LRVW2_MAC_NLCA1_NLCB1_ONLL1_PGR2_PLR17_SIA3_SU0_SUS256_SRVW2_SNLL0_TT1_64_TLDS1_USFGROn1_VSn1_VW1_WSGRA1_WSGRB1_WG64_4_1_WGM2
    SolutionIndex: 183
    SolutionNameMin: Cijk_Alik_Bljk_SB_MT64x64x32_MI32x32x2x1_SE_1LDSB0_AF0EM1_AMAS0_BL1_DTL0_EPS0_FL0_GRVW2_GSU1_ISA908_IU1_KLA_LBSPP128_LPA2_LPB2_LRVW2_MAC_NLCA1_NLCB1_ONLL1_PGR2_PLR17_SIA3_SU32_SUS128_SRVW2_SNLL0_TT1_32_TLDS1_USFGROn1_VSn1_VW1_WSGRA1_WSGRB1_WG64_4_1_WGM1
    SolutionIndex: 184
    SolutionNameMin: Cijk_Alik_Bljk_SB_MT64x32x32_MI16x16x4x1_SE_1LDSB0_AF0EM1_AMAS0_BL1_DTL0_EPS0_FL0_GRVW2_GSU3_ISA908_IU1_KLA_LBSPP128_LPA2_LPB2_LRVW2_MAC_NLCA1_NLCB1_ONLL1_PGR2_PLR9_SIA3_SU0_SUS256_SRVW0_SNLL0_TT2_16_TLDS1_USFGROn1_VSn1_VW1_WSGRA1_WSGRB1_WG32_8_1_WGM2
    SolutionIndex: 185
    SolutionNameMin: Cijk_Alik_Bljk_SB_MT16x16x32_MI16x16x4x1_SE_1LDSB0_AF0EM1_AMAS3_BL1_DTL0_EPS0_FL0_GRVW2_GSU3_ISA908_IU1_KLA_LBSPP128_LPA2_LPB2_LRVW2_MAC_NLCA1_NLCB1_ONLL1_PGR2_PLR9_SIA3_SU32_SUS128_SRVW0_SNLL0_TT1_16_TLDS1_USFGROn1_VSn1_VW2_WSGRA1_WSGRB1_WG16_4_1_WGM1
    SolutionIndex: 186
    SolutionNameMin: Cijk_Alik_Bljk_SB_MT128x96x32_MI32x32x2x1_SN_1LDSB1_AF0EM1_AMAS0_BL1_DTL0_EPS1_FL0_GRVW4_GSU1_ISA908_IU1_KLA_LBSPP128_LPA4_LPB4_LRVW2_MAC_NLCA1_NLCB1_ONLL1_PGR1_PLR17_SIA3_SU32_SUS256_SRVW2_SNLL0_TT1_96_TLDS1_USFGROn1_VSn1_VW1_WSGRA1_WSGRB1_WG128_2_1_WGM15
    SolutionIndex: 187
    SolutionNameMin: Cijk_Alik_Bljk_SB_MT64x64x16_MI16x16x1x4_SE_1LDSB0_AF0EM1_AMAS0_BL1_DTL0_EPS1_FL0_GRVW4_GSU1_ISA908_IU1_KLA_LBSPP0_LPA0_LPB0_LRVW1_MAC_NLCA1_NLCB1_ONLL2_PGR1_PLR1_SIA1_SU32_SUS256_SRVW0_SNLL0_TT1_16_TLDS0_USFGROn1_VSn1_VW1_WSGRA0_WSGRB0_WG64_4_1_WGM8
    SolutionIndex: 188
    SolutionNameMin: Cijk_Alik_Bljk_SB_MT16x16x32_SE_1LDSB0_AF0EM1_AMAS3_BL1_DTL0_EPS1_FL1_GRVW4_GSU8_ISA908_IU1_KLA_LBSPP0_LPA0_LPB0_LRVW4_MAC_NLCA1_NLCB1_ONLL1_PGR1_PLR1_SIA1_SU32_SUS256_SRVW0_SNLL0_TT4_4_TLDS0_USFGRO1_VS1_VW4_WSGRA0_WSGRB0_WG4_4_8_WGM8
    SolutionIndex: 189
    SolutionNameMin: Cijk_Alik_Bljk_SB_MT64x128x32_MI32x32x2x1_SE_1LDSB1_AF0EM1_AMAS0_BL1_DTL0_EPS0_FL0_GRVW4_GSU1_ISA908_IU1_KLA_LBSPP128_LPA4_LPB4_LRVW2_MAC_NLCA1_NLCB1_ONLL1_PGR2_PLR17_SIA3_SU32_SUS256_SRVW2_SNLL0_TT1_64_TLDS1_USFGROn1_VSn1_VW1_WSGRA1_WSGRB1_WG64_4_1_WGM15
    SolutionIndex: 190
    SolutionNameMin: Cijk_Alik_Bljk_SB_MT128x96x32_MI32x32x2x1_SE_1LDSB1_AF0EM1_AMAS0_BL1_DTL0_EPS1_FL0_GRVW1_GSU1_ISA908_IU1_KLA_LBSPP128_LPA2_LPB2_LRVW2_MAC_NLCA1_NLCB1_ONLL1_PGR1_PLR17_SIA3_SU0_SUS256_SRVW2_SNLL0_TT1_96_TLDS1_USFGROn1_VSn1_VW1_WSGRA1_WSGRB1_WG128_2_1_WGM2
    SolutionIndex: 191
    SolutionNameMin: Cijk_Alik_Bljk_SB_MT128x64x32_MI32x32x2x1_SE_1LDSB1_AF0EM1_AMAS0_BL1_DTL0_EPS0_FL0_GRVW4_GSU1_ISA908_IU1_KLA_LBSPP128_LPA4_LPB4_LRVW2_MAC_NLCA1_NLCB1_ONLL1_PGR2_PLR17_SIA3_SU0_SUS256_SRVW2_SNLL0_TT2_32_TLDS1_USFGROn1_VSn1_VW1_WSGRA1_WSGRB1_WG64_4_1_WGM15
    SolutionIndex: 192
    SolutionNameMin: Cijk_Alik_Bljk_SB_MT32x32x32_MI16x16x4x1_SE_1LDSB0_AF0EM1_AMAS0_BL1_DTL0_EPS0_FL0_GRVW2_GSU3_ISA908_IU1_KLA_LBSPP128_LPA2_LPB2_LRVW2_MAC_NLCA1_NLCB1_ONLL1_PGR2_PLR9_SIA3_SU0_SUS256_SRVW0_SNLL0_TT1_16_TLDS1_USFGROn1_VSn1_VW1_WSGRA1_WSGRB1_WG32_8_1_WGM2
    SolutionIndex: 193
    SolutionNameMin: Cijk_Alik_Bljk_SB_MT32x64x16_MI16x16x4x1_SE_1LDSB0_AF0EM1_AMAS0_BL1_DTL0_EPS0_FL0_GRVW1_GSU1_ISA908_IU1_KLA_LBSPP128_LPA2_LPB2_LRVW2_MAC_NLCA1_NLCB1_ONLL1_PGR2_PLR5_SIA3_SU0_SUS256_SRVW2_SNLL0_TT1_32_TLDS1_USFGROn1_VSn1_VW1_WSGRA1_WSGRB1_WG32_8_1_WGM15
    SolutionIndex: 194
    SolutionNameMin: Cijk_Alik_Bljk_SB_MT64x64x32_MI32x32x2x1_SE_1LDSB0_AF0EM1_AMAS0_BL1_DTL0_EPS0_FL0_GRVW2_GSU1_ISA908_IU1_KLA_LBSPP128_LPA2_LPB2_LRVW2_MAC_NLCA1_NLCB1_ONLL1_PGR2_PLR17_SIA3_SU0_SUS256_SRVW2_SNLL0_TT1_32_TLDS1_USFGROn1_VSn1_VW1_WSGRA1_WSGRB1_WG64_4_1_WGM1
    SolutionIndex: 195
    SolutionNameMin: Cijk_Alik_Bljk_SB_MT64x128x16_MI32x32x2x1_SE_1LDSB1_AF0EM1_AMAS0_BL1_DTL0_EPS0_FL0_GRVW2_GSU1_ISA908_IU1_KLA_LBSPP128_LPA2_LPB2_LRVW2_MAC_NLCA1_NLCB1_ONLL1_PGR2_PLR9_SIA3_SU32_SUS256_SRVW2_SNLL0_TT1_64_TLDS1_USFGROn1_VSn1_VW1_WSGRA1_WSGRB1_WG64_4_1_WGM2
    SolutionIndex: 196
    SolutionNameMin: Cijk_Alik_Bljk_SB_MT32x8x32_SE_1LDSB0_AF0EM1_AMAS3_BL1_DTL0_EPS1_FL0_GRVW4_GSU1_ISA908_IU1_KLA_LBSPP0_LPA2_LPB2_LRVW2_MAC_NLCA1_NLCB1_ONLL1_PGR1_PLR1_SIA1_SU32_SUS256_SRVW0_SNLL0_TT2_2_TLDS0_USFGRO1_VS1_VW2_WSGRA0_WSGRB0_WG16_4_4_WGM1
    SolutionIndex: 197
    SolutionNameMin: Cijk_Alik_Bljk_SB_MT64x32x16_SN_1LDSB0_AF0EM1_AMAS3_BL1_DTL0_EPS1_FL1_GRVW4_GSU1_ISA908_IU1_KLA_LBSPP0_LPA0_LPB0_LRVW4_MAC_NLCA1_NLCB1_ONLL1_PGR1_PLR1_SIA1_SU32_SUS256_SRVW0_SNLL1_TT4_4_TLDS0_USFGRO1_VS1_VW4_WSGRA0_WSGRB0_WG16_8_1_WGM64
    SolutionIndex: 198
    SolutionNameMin: Cijk_Alik_Bljk_SB_MT64x144x32_MI16x16x4x1_SE_1LDSB1_AF0EM1_AMAS0_BL1_DTL0_EPS1_FL0_GRVW1_GSU1_ISA908_IU1_KLA_LBSPP128_LPA2_LPB2_LRVW2_MAC_NLCA1_NLCB1_ONLL1_PGR1_PLR9_SIA3_SU0_SUS256_SRVW2_SNLL0_TT1_144_TLDS1_USFGROn1_VSn1_VW1_WSGRA1_WSGRB1_WG64_4_1_WGM15
    SolutionIndex: 199
    SolutionNameMin: Cijk_Alik_Bljk_SB_MT64x16x16_SE_1LDSB0_AF0EM1_AMAS3_BL1_DTL0_EPS1_FL0_GRVW4_GSU1_ISA908_IU1_KLA_LBSPP0_LPA0_LPB0_LRVW4_MAC_NLCA1_NLCB1_ONLL1_PGR1_PLR1_SIA1_SU32_SUS256_SRVW0_SNLL0_TT4_4_TLDS0_USFGRO1_VS1_VW4_WSGRA0_WSGRB0_WG16_4_4_WGM8
    SolutionIndex: 200
    SolutionNameMin: Cijk_Alik_Bljk_SB_MT96x96x16_MI16x16x4x1_SE_1LDSB1_AF0EM1_AMAS0_BL1_DTL0_EPS0_FL0_GRVW1_GSU1_ISA908_IU1_KLA_LBSPP128_LPA2_LPB2_LRVW2_MAC_NLCA1_NLCB1_ONLL1_PGR2_PLR5_SIA3_SU0_SUS256_SRVW0_SNLL0_TT3_48_TLDS1_USFGROn1_VSn1_VW1_WSGRA1_WSGRB1_WG32_8_1_WGM1
    SolutionIndex: 201
    SolutionNameMin: Cijk_Alik_Bljk_SB_MT128x96x16_MI32x32x2x1_SE_1LDSB1_AF0EM1_AMAS0_BL1_DTL0_EPS1_FL0_GRVW1_GSU1_ISA908_IU1_KLA_LBSPP128_LPA2_LPB2_LRVW2_MAC_NLCA1_NLCB1_ONLL1_PGR1_PLR9_SIA3_SU32_SUS128_SRVW2_SNLL0_TT1_96_TLDS1_USFGROn1_VSn1_VW1_WSGRA1_WSGRB1_WG128_2_1_WGM15
    SolutionIndex: 202
    SolutionNameMin: Cijk_Alik_Bljk_SB_MT128x96x32_MI32x32x2x1_SE_1LDSB1_AF0EM1_AMAS0_BL1_DTL0_EPS1_FL0_GRVW4_GSU1_ISA908_IU1_KLA_LBSPP128_LPA4_LPB4_LRVW2_MAC_NLCA1_NLCB1_ONLL1_PGR1_PLR17_SIA3_SU0_SUS256_SRVW2_SNLL0_TT1_96_TLDS1_USFGROn1_VSn1_VW1_WSGRA1_WSGRB1_WG128_2_1_WGM15
    SolutionIndex: 203
    SolutionNameMin: Cijk_Alik_Bljk_SB_MT64x144x32_MI16x16x4x1_SE_1LDSB0_AF0EM1_AMAS0_BL1_DTL0_EPS0_FL0_GRVW2_GSU1_ISA908_IU1_KLA_LBSPP128_LPA2_LPB2_LRVW2_MAC_NLCA1_NLCB1_ONLL1_PGR2_PLR9_SIA3_SU32_SUS256_SRVW2_SNLL0_TT1_144_TLDS1_USFGROn1_VSn1_VW1_WSGRA1_WSGRB1_WG64_4_1_WGM15
    SolutionIndex: 204
    SolutionNameMin: Cijk_Alik_Bljk_SB_MT8x32x32_SE_1LDSB0_AF0EM1_AMAS3_BL1_DTL0_EPS1_FL0_GRVW4_GSU1_ISA908_IU1_KLA_LBSPP0_LPA2_LPB2_LRVW2_MAC_NLCA1_NLCB1_ONLL1_PGR1_PLR1_SIA1_SU32_SUS256_SRVW0_SNLL0_TT2_2_TLDS0_USFGRO1_VS1_VW2_WSGRA0_WSGRB0_WG4_16_4_WGM1
    SolutionIndex: 205
    SolutionNameMin: Cijk_Alik_Bljk_SB_MT64x128x32_MI32x32x2x1_SE_1LDSB1_AF0EM1_AMAS0_BL1_DTL0_EPS1_FL0_GRVW4_GSU1_ISA908_IU1_KLA_LBSPP128_LPA4_LPB4_LRVW2_MAC_NLCA1_NLCB1_ONLL1_PGR1_PLR17_SIA3_SU32_SUS256_SRVW2_SNLL0_TT1_64_TLDS1_USFGROn1_VSn1_VW1_WSGRA1_WSGRB1_WG64_4_1_WGM1
    SolutionIndex: 206
    SolutionNameMin: Cijk_Alik_Bljk_SB_MT64x64x32_MI32x32x2x1_SE_1LDSB0_AF0EM1_AMAS0_BL1_DTL0_EPS0_FL0_GRVW2_GSU1_ISA908_IU1_KLA_LBSPP128_LPA2_LPB2_LRVW2_MAC_NLCA1_NLCB1_ONLL1_PGR2_PLR17_SIA3_SU32_SUS256_SRVW2_SNLL0_TT1_32_TLDS1_USFGROn1_VSn1_VW1_WSGRA1_WSGRB1_WG64_4_1_WGM1
    SolutionIndex: 207
    SolutionNameMin: Cijk_Alik_Bljk_SB_MT128x144x16_MI16x16x4x1_SE_1LDSB1_AF0EM1_AMAS0_BL1_DTL0_EPS1_FL0_GRVW1_GSU1_ISA908_IU1_KLA_LBSPP128_LPA2_LPB2_LRVW2_MAC_NLCA1_NLCB1_ONLL1_PGR1_PLR5_SIA3_SU0_SUS256_SRVW2_SNLL0_TT2_144_TLDS1_USFGROn1_VSn1_VW1_WSGRA1_WSGRB1_WG64_4_1_WGM15
    SolutionIndex: 208
    SolutionNameMin: Cijk_Alik_Bljk_SB_MT64x64x32_MI32x32x2x1_SE_1LDSB0_AF0EM1_AMAS0_BL1_DTL0_EPS0_FL0_GRVW2_GSU1_ISA908_IU1_KLA_LBSPP128_LPA2_LPB2_LRVW2_MAC_NLCA1_NLCB1_ONLL1_PGR2_PLR17_SIA3_SU32_SUS128_SRVW2_SNLL0_TT1_32_TLDS1_USFGROn1_VSn1_VW1_WSGRA1_WSGRB1_WG64_4_1_WGM15
    SolutionIndex: 209
    SolutionNameMin: Cijk_Alik_Bljk_SB_MT64x128x16_MI32x32x2x1_SE_1LDSB0_AF0EM1_AMAS0_BL1_DTL0_EPS0_FL0_GRVW4_GSU1_ISA908_IU1_KLA_LBSPP128_LPA4_LPB4_LRVW2_MAC_NLCA1_NLCB1_ONLL1_PGR2_PLR9_SIA3_SU0_SUS256_SRVW2_SNLL0_TT1_64_TLDS1_USFGROn1_VSn1_VW1_WSGRA1_WSGRB1_WG64_4_1_WGM15
    SolutionIndex: 210
    SolutionNameMin: Cijk_Alik_Bljk_SB_MT144x64x32_MI16x16x4x1_SE_1LDSB1_AF0EM1_AMAS0_BL1_DTL0_EPS1_FL0_GRVW1_GSU1_ISA908_IU1_KLA_LBSPP128_LPA2_LPB2_LRVW2_MAC_NLCA1_NLCB1_ONLL1_PGR1_PLR9_SIA3_SU0_SUS256_SRVW0_SNLL0_TT9_16_TLDS1_USFGROn1_VSn1_VW1_WSGRA1_WSGRB1_WG16_16_1_WGM1
    SolutionIndex: 211
    SolutionNameMin: Cijk_Alik_Bljk_SB_MT64x128x16_MI32x32x2x1_SE_1LDSB1_AF0EM1_AMAS0_BL1_DTL0_EPS1_FL0_GRVW4_GSU1_ISA908_IU1_KLA_LBSPP128_LPA4_LPB4_LRVW2_MAC_NLCA1_NLCB1_ONLL1_PGR1_PLR9_SIA3_SU0_SUS256_SRVW2_SNLL0_TT1_64_TLDS1_USFGROn1_VSn1_VW1_WSGRA1_WSGRB1_WG64_4_1_WGM1
    SolutionIndex: 212
    SolutionNameMin: Cijk_Alik_Bljk_SB_MT32x32x32_MI16x16x4x1_SE_1LDSB0_AF0EM1_AMAS0_BL1_DTL0_EPS0_FL0_GRVW4_GSU1_ISA908_IU2_KLA_LBSPP128_LPA4_LPB4_LRVW2_MAC_NLCA1_NLCB1_ONLL1_PGR2_PLR5_SIA3_SU0_SUS128_SRVW2_SNLL0_TT1_16_TLDS1_USFGROn1_VSn1_VW1_WSGRA1_WSGRB1_WG32_8_1_WGM1
    SolutionIndex: 213
    SolutionNameMin: Cijk_Alik_Bljk_SB_MT32x32x32_MI16x16x4x1_SE_1LDSB1_AF0EM1_AMAS0_BL1_DTL0_EPS1_FL0_GRVW1_GSU1_ISA908_IU1_KLA_LBSPP128_LPA2_LPB2_LRVW2_MAC_NLCA1_NLCB1_ONLL1_PGR1_PLR9_SIA3_SU0_SUS256_SRVW2_SNLL0_TT1_16_TLDS1_USFGROn1_VSn1_VW1_WSGRA1_WSGRB1_WG32_8_1_WGM15
    SolutionIndex: 214
    SolutionNameMin: Cijk_Alik_Bljk_SB_MT32x32x32_MI16x16x4x1_SE_1LDSB0_AF0EM1_AMAS0_BL1_DTL0_EPS0_FL0_GRVW1_GSU3_ISA908_IU1_KLA_LBSPP128_LPA2_LPB2_LRVW2_MAC_NLCA1_NLCB1_ONLL1_PGR2_PLR9_SIA3_SU0_SUS256_SRVW0_SNLL0_TT1_16_TLDS1_USFGROn1_VSn1_VW1_WSGRA1_WSGRB1_WG32_8_1_WGM1
    SolutionIndex: 215
    SolutionNameMin: Cijk_Alik_Bljk_SB_MT64x128x16_MI32x32x2x1_SE_1LDSB0_AF0EM1_AMAS0_BL1_DTL0_EPS0_FL0_GRVW4_GSU1_ISA908_IU1_KLA_LBSPP128_LPA4_LPB4_LRVW2_MAC_NLCA1_NLCB1_ONLL1_PGR2_PLR9_SIA3_SU32_SUS256_SRVW2_SNLL0_TT1_64_TLDS1_USFGROn1_VSn1_VW1_WSGRA1_WSGRB1_WG64_4_1_WGM15
    SolutionIndex: 216
    SolutionNameMin: Cijk_Alik_Bljk_SB_MT16x16x32_MI16x16x4x1_SE_1LDSB1_AF0EM1_AMAS3_BL1_DTL0_EPS1_FL0_GRVW4_GSU1_ISA908_IU1_KLA_LBSPP128_LPA4_LPB4_LRVW2_MAC_NLCA1_NLCB1_ONLL1_PGR1_PLR9_SIA3_SU0_SUS256_SRVW0_SNLL0_TT1_16_TLDS1_USFGROn1_VSn1_VW2_WSGRA1_WSGRB1_WG16_4_1_WGM1
    SolutionIndex: 217
    SolutionNameMin: Cijk_Alik_Bljk_SB_MT64x32x32_MI16x16x4x1_SE_1LDSB0_AF0EM1_AMAS0_BL1_DTL0_EPS0_FL0_GRVW1_GSU1_ISA908_IU1_KLA_LBSPP128_LPA2_LPB2_LRVW2_MAC_NLCA1_NLCB1_ONLL1_PGR2_PLR9_SIA3_SU0_SUS256_SRVW2_SNLL0_TT2_16_TLDS1_USFGROn1_VSn1_VW1_WSGRA1_WSGRB1_WG32_8_1_WGM15
    SolutionIndex: 218
    SolutionNameMin: Cijk_Alik_Bljk_SB_MT128x64x32_MI32x32x2x1_SE_1LDSB1_AF0EM1_AMAS0_BL1_DTL0_EPS1_FL0_GRVW2_GSU1_ISA908_IU1_KLA_LBSPP128_LPA2_LPB2_LRVW2_MAC_NLCA1_NLCB1_ONLL1_PGR1_PLR17_SIA3_SU0_SUS256_SRVW2_SNLL0_TT2_32_TLDS1_USFGROn1_VSn1_VW1_WSGRA1_WSGRB1_WG64_4_1_WGM1
    SolutionIndex: 219
    SolutionNameMin: Cijk_Alik_Bljk_SB_MT64x64x16_MI32x32x2x1_SE_1LDSB1_AF0EM1_AMAS0_BL1_DTL0_EPS0_FL0_GRVW4_GSU1_ISA908_IU1_KLA_LBSPP128_LPA4_LPB4_LRVW2_MAC_NLCA1_NLCB1_ONLL1_PGR2_PLR9_SIA3_SU0_SUS256_SRVW2_SNLL0_TT1_32_TLDS1_USFGROn1_VSn1_VW1_WSGRA1_WSGRB1_WG64_4_1_WGM15
    SolutionIndex: 220
    SolutionNameMin: Cijk_Alik_Bljk_SB_MT32x32x32_MI16x16x4x1_SE_1LDSB0_AF0EM1_AMAS0_BL1_DTL0_EPS0_FL0_GRVW1_GSU5_ISA908_IU1_KLA_LBSPP128_LPA2_LPB2_LRVW2_MAC_NLCA1_NLCB1_ONLL1_PGR2_PLR9_SIA3_SU32_SUS256_SRVW0_SNLL0_TT1_16_TLDS1_USFGROn1_VSn1_VW1_WSGRA1_WSGRB1_WG32_8_1_WGM1
    SolutionIndex: 221
    SolutionNameMin: Cijk_Alik_Bljk_SB_MT64x192x16_MI32x32x2x1_SE_1LDSB1_AF0EM1_AMAS0_BL1_DTL0_EPS1_FL0_GRVW4_GSU1_ISA908_IU1_KLA_LBSPP128_LPA4_LPB4_LRVW2_MAC_NLCA1_NLCB1_ONLL1_PGR1_PLR9_SIA3_SU32_SUS256_SRVW2_SNLL0_TT1_96_TLDS1_USFGROn1_VSn1_VW1_WSGRA1_WSGRB1_WG64_4_1_WGM1
    SolutionIndex: 222
    SolutionNameMin: Cijk_Alik_Bljk_SB_MT64x64x32_MI32x32x2x1_SE_1LDSB0_AF0EM1_AMAS0_BL1_DTL0_EPS0_FL0_GRVW4_GSU1_ISA908_IU1_KLA_LBSPP128_LPA4_LPB4_LRVW2_MAC_NLCA1_NLCB1_ONLL1_PGR2_PLR17_SIA3_SU0_SUS256_SRVW2_SNLL0_TT1_32_TLDS1_USFGROn1_VSn1_VW1_WSGRA1_WSGRB1_WG64_4_1_WGM2
    SolutionIndex: 223
    SolutionNameMin: Cijk_Alik_Bljk_SB_MT64x144x32_MI16x16x4x1_SE_1LDSB0_AF0EM1_AMAS0_BL1_DTL0_EPS1_FL0_GRVW1_GSU1_ISA908_IU1_KLA_LBSPP128_LPA2_LPB2_LRVW2_MAC_NLCA1_NLCB1_ONLL1_PGR1_PLR9_SIA3_SU0_SUS256_SRVW2_SNLL0_TT1_144_TLDS1_USFGROn1_VSn1_VW1_WSGRA1_WSGRB1_WG64_4_1_WGM2
    SolutionIndex: 224
    SolutionNameMin: Cijk_Alik_Bljk_SB_MT64x64x16_MI32x32x2x1_SE_1LDSB0_AF0EM1_AMAS0_BL1_DTL0_EPS0_FL0_GRVW1_GSU1_ISA908_IU2_KLA_LBSPP128_LPA2_LPB2_LRVW2_MAC_NLCA1_NLCB1_ONLL1_PGR2_PLR5_SIA3_SU0_SUS128_SRVW2_SNLL0_TT1_32_TLDS1_USFGROn1_VSn1_VW1_WSGRA1_WSGRB1_WG64_4_1_WGM8
    SolutionIndex: 225
    SolutionNameMin: Cijk_Alik_Bljk_SB_MT128x160x16_MI32x32x2x1_SN_1LDSB1_AF0EM1_AMAS0_BL1_DTL0_EPS1_FL0_GRVW1_GSU1_ISA908_IU1_KLA_LBSPP128_LPA2_LPB2_LRVW2_MAC_NLCA1_NLCB1_ONLL1_PGR1_PLR9_SIA3_SU32_SUS256_SRVW2_SNLL0_TT1_160_TLDS1_USFGROn1_VSn1_VW1_WSGRA1_WSGRB1_WG128_2_1_WGM1
    SolutionIndex: 226
    SolutionNameMin: Cijk_Alik_Bljk_SB_MT64x32x32_MI16x16x4x1_SE_1LDSB1_AF0EM1_AMAS0_BL1_DTL0_EPS0_FL0_GRVW2_GSU1_ISA908_IU1_KLA_LBSPP128_LPA2_LPB2_LRVW2_MAC_NLCA1_NLCB1_ONLL1_PGR2_PLR9_SIA3_SU32_SUS256_SRVW2_SNLL0_TT2_16_TLDS1_USFGROn1_VSn1_VW1_WSGRA1_WSGRB1_WG32_8_1_WGM2
    SolutionIndex: 227
    SolutionNameMin: Cijk_Alik_Bljk_SB_MT128x64x32_MI32x32x2x1_SE_1LDSB0_AF0EM1_AMAS0_BL1_DTL0_EPS0_FL0_GRVW4_GSU1_ISA908_IU1_KLA_LBSPP128_LPA4_LPB4_LRVW2_MAC_NLCA1_NLCB1_ONLL1_PGR2_PLR17_SIA3_SU0_SUS256_SRVW2_SNLL0_TT2_32_TLDS1_USFGROn1_VSn1_VW1_WSGRA1_WSGRB1_WG64_4_1_WGM15
    SolutionIndex: 228
    SolutionNameMin: Cijk_Alik_Bljk_SB_MT64x64x16_SN_1LDSB0_AF0EM1_AMAS3_BL1_DTL0_EPS1_FL1_GRVW4_GSU1_ISA908_IU1_KLA_LBSPP0_LPA2_LPB2_LRVW2_MAC_NLCA1_NLCB1_ONLL1_PGR1_PLR1_SIA1_SU32_SUS256_SRVW0_SNLL1_TT4_4_TLDS0_USFGRO1_VS1_VW2_WSGRA0_WSGRB0_WG16_16_1_WGM64
    SolutionIndex: 229
    SolutionNameMin: Cijk_Alik_Bljk_SB_MT64x64x16_MI32x32x2x1_SE_1LDSB0_AF0EM1_AMAS0_BL1_DTL0_EPS0_FL0_GRVW2_GSU1_ISA908_IU1_KLA_LBSPP128_LPA2_LPB2_LRVW2_MAC_NLCA1_NLCB1_ONLL1_PGR2_PLR9_SIA3_SU0_SUS256_SRVW2_SNLL0_TT1_32_TLDS1_USFGROn1_VSn1_VW1_WSGRA1_WSGRB1_WG64_4_1_WGM1
    SolutionIndex: 230
    SolutionNameMin: Cijk_Alik_Bljk_SB_MT32x64x32_MI16x16x4x1_SE_1LDSB0_AF0EM1_AMAS0_BL1_DTL0_EPS0_FL0_GRVW1_GSU1_ISA908_IU1_KLA_LBSPP128_LPA2_LPB2_LRVW2_MAC_NLCA1_NLCB1_ONLL1_PGR2_PLR9_SIA3_SU32_SUS128_SRVW2_SNLL0_TT1_32_TLDS1_USFGROn1_VSn1_VW1_WSGRA1_WSGRB1_WG32_8_1_WGM15
    SolutionIndex: 231
    SolutionNameMin: Cijk_Alik_Bljk_SB_MT128x128x16_MI32x32x2x1_SE_1LDSB1_AF0EM1_AMAS0_BL1_DTL0_EPS1_FL0_GRVW1_GSU1_ISA908_IU1_KLA_LBSPP128_LPA2_LPB2_LRVW2_MAC_NLCA1_NLCB1_ONLL1_PGR1_PLR9_SIA3_SU32_SUS256_SRVW2_SNLL0_TT2_64_TLDS1_USFGROn1_VSn1_VW1_WSGRA1_WSGRB1_WG64_4_1_WGM2
    SolutionIndex: 232
    SolutionNameMin: Cijk_Alik_Bljk_SB_MT64x64x16_MI32x32x2x1_SE_1LDSB0_AF0EM1_AMAS0_BL1_DTL0_EPS0_FL0_GRVW1_GSU1_ISA908_IU1_KLA_LBSPP128_LPA2_LPB2_LRVW2_MAC_NLCA1_NLCB1_ONLL1_PGR2_PLR9_SIA3_SU32_SUS128_SRVW2_SNLL0_TT1_32_TLDS1_USFGROn1_VSn1_VW1_WSGRA1_WSGRB1_WG64_4_1_WGM2
    SolutionIndex: 233
    SolutionNameMin: Cijk_Alik_Bljk_SB_MT64x128x32_MI32x32x2x1_SE_1LDSB1_AF0EM1_AMAS0_BL1_DTL0_EPS1_FL0_GRVW2_GSU1_ISA908_IU1_KLA_LBSPP128_LPA2_LPB2_LRVW2_MAC_NLCA1_NLCB1_ONLL1_PGR1_PLR17_SIA3_SU0_SUS256_SRVW2_SNLL0_TT1_64_TLDS1_USFGROn1_VSn1_VW1_WSGRA1_WSGRB1_WG64_4_1_WGM15
    SolutionIndex: 234
    SolutionNameMin: Cijk_Alik_Bljk_SB_MT128x64x32_MI32x32x2x1_SE_1LDSB0_AF0EM1_AMAS0_BL1_DTL0_EPS0_FL0_GRVW4_GSU1_ISA908_IU1_KLA_LBSPP128_LPA4_LPB4_LRVW2_MAC_NLCA1_NLCB1_ONLL1_PGR2_PLR17_SIA3_SU32_SUS128_SRVW2_SNLL0_TT2_32_TLDS1_USFGROn1_VSn1_VW1_WSGRA1_WSGRB1_WG64_4_1_WGM15
    SolutionIndex: 235
    SolutionNameMin: Cijk_Alik_Bljk_SB_MT16x16x32_MI16x16x4x1_SE_1LDSB0_AF0EM1_AMAS3_BL1_DTL0_EPS0_FL0_GRVW2_GSU5_ISA908_IU1_KLA_LBSPP128_LPA2_LPB2_LRVW2_MAC_NLCA1_NLCB1_ONLL1_PGR2_PLR9_SIA3_SU0_SUS256_SRVW0_SNLL0_TT1_16_TLDS1_USFGROn1_VSn1_VW2_WSGRA1_WSGRB1_WG16_4_1_WGM1
    SolutionIndex: 236
    SolutionNameMin: Cijk_Alik_Bljk_SB_MT32x32x32_MI16x16x4x1_SE_1LDSB0_AF0EM1_AMAS0_BL1_DTL0_EPS0_FL0_GRVW1_GSU7_ISA908_IU1_KLA_LBSPP128_LPA2_LPB2_LRVW2_MAC_NLCA1_NLCB1_ONLL1_PGR2_PLR9_SIA3_SU32_SUS256_SRVW0_SNLL0_TT1_16_TLDS1_USFGROn1_VSn1_VW1_WSGRA1_WSGRB1_WG32_8_1_WGM2
    SolutionIndex: 237
    SolutionNameMin: Cijk_Alik_Bljk_SB_MT64x64x32_MI32x32x2x1_SE_1LDSB0_AF0EM1_AMAS0_BL1_DTL0_EPS0_FL0_GRVW4_GSU1_ISA908_IU1_KLA_LBSPP128_LPA4_LPB4_LRVW2_MAC_NLCA1_NLCB1_ONLL1_PGR2_PLR17_SIA3_SU0_SUS256_SRVW2_SNLL0_TT1_32_TLDS1_USFGROn1_VSn1_VW1_WSGRA1_WSGRB1_WG64_4_1_WGM15
    SolutionIndex: 238
    SolutionNameMin: Cijk_Alik_Bljk_SB_MT32x32x32_MI16x16x4x1_SE_1LDSB0_AF0EM1_AMAS0_BL1_DTL0_EPS0_FL0_GRVW1_GSU3_ISA908_IU1_KLA_LBSPP128_LPA2_LPB2_LRVW2_MAC_NLCA1_NLCB1_ONLL1_PGR2_PLR9_SIA3_SU32_SUS256_SRVW0_SNLL0_TT1_16_TLDS1_USFGROn1_VSn1_VW1_WSGRA1_WSGRB1_WG32_8_1_WGM2
    SolutionIndex: 239
    SolutionNameMin: Cijk_Alik_Bljk_SB_MT32x32x64_MI16x16x4x1_SE_1LDSB0_AF0EM1_AMAS0_BL1_DTL0_EPS0_FL0_GRVW1_GSU120_ISA908_IU1_KLA_LBSPP256_LPA2_LPB2_LRVW2_MAC_NLCA1_NLCB1_ONLL1_PGR2_PLR17_SIA3_SU32_SUS256_SRVW0_SNLL0_TT1_16_TLDS1_USFGROn1_VSn1_VW1_WSGRA1_WSGRB1_WG32_8_1_WGM2
    SolutionIndex: 240
    SolutionNameMin: Cijk_Alik_Bljk_SB_MT128x96x16_MI32x32x2x1_SE_1LDSB1_AF0EM1_AMAS0_BL1_DTL0_EPS0_FL0_GRVW1_GSU1_ISA908_IU1_KLA_LBSPP128_LPA2_LPB2_LRVW2_MAC_NLCA1_NLCB1_ONLL1_PGR2_PLR9_SIA3_SU32_SUS128_SRVW2_SNLL0_TT1_96_TLDS1_USFGROn1_VSn1_VW1_WSGRA1_WSGRB1_WG128_2_1_WGM15
    SolutionIndex: 241
    SolutionNameMin: Cijk_Alik_Bljk_SB_MT128x64x32_MI32x32x2x1_SE_1LDSB0_AF0EM1_AMAS0_BL1_DTL0_EPS0_FL0_GRVW4_GSU1_ISA908_IU1_KLA_LBSPP128_LPA4_LPB4_LRVW2_MAC_NLCA1_NLCB1_ONLL1_PGR2_PLR17_SIA3_SU32_SUS256_SRVW2_SNLL0_TT2_32_TLDS1_USFGROn1_VSn1_VW1_WSGRA1_WSGRB1_WG64_4_1_WGM15
    SolutionIndex: 242
    SolutionNameMin: Cijk_Alik_Bljk_SB_MT16x16x32_MI16x16x4x1_SE_1LDSB1_AF0EM1_AMAS3_BL1_DTL0_EPS1_FL0_GRVW4_GSU1_ISA908_IU1_KLA_LBSPP128_LPA4_LPB4_LRVW2_MAC_NLCA1_NLCB1_ONLL1_PGR1_PLR9_SIA3_SU0_SUS256_SRVW2_SNLL0_TT1_16_TLDS1_USFGROn1_VSn1_VW2_WSGRA1_WSGRB1_WG16_4_1_WGM1
    SolutionIndex: 243
    SolutionNameMin: Cijk_Alik_Bljk_SB_MT96x96x32_MI16x16x4x1_SE_1LDSB1_AF0EM1_AMAS0_BL1_DTL0_EPS1_FL0_GRVW1_GSU1_ISA908_IU1_KLA_LBSPP128_LPA2_LPB2_LRVW2_MAC_NLCA1_NLCB1_ONLL1_PGR1_PLR9_SIA3_SU0_SUS256_SRVW0_SNLL0_TT3_48_TLDS1_USFGROn1_VSn1_VW1_WSGRA1_WSGRB1_WG32_8_1_WGM1
    SolutionIndex: 244
    SolutionNameMin: Cijk_Alik_Bljk_SB_MT64x16x32_SE_1LDSB0_AF0EM1_AMAS3_BL1_DTL0_EPS1_FL1_GRVW4_GSU8_ISA908_IU1_KLA_LBSPP0_LPA2_LPB2_LRVW2_MAC_NLCA1_NLCB1_ONLL1_PGR1_PLR1_SIA1_SU32_SUS256_SRVW0_SNLL0_TT4_4_TLDS0_USFGRO1_VS1_VW2_WSGRA0_WSGRB0_WG16_4_4_WGM1
    SolutionIndex: 245
    SolutionNameMin: Cijk_Alik_Bljk_SB_MT128x64x32_MI32x32x2x1_SE_1LDSB1_AF0EM1_AMAS0_BL1_DTL0_EPS0_FL0_GRVW4_GSU1_ISA908_IU1_KLA_LBSPP128_LPA4_LPB4_LRVW2_MAC_NLCA1_NLCB1_ONLL1_PGR2_PLR17_SIA3_SU0_SUS256_SRVW2_SNLL0_TT2_32_TLDS1_USFGROn1_VSn1_VW1_WSGRA1_WSGRB1_WG64_4_1_WGM2
    SolutionIndex: 246
    SolutionNameMin: Cijk_Alik_Bljk_SB_MT128x96x32_MI32x32x2x1_SE_1LDSB1_AF0EM1_AMAS0_BL1_DTL0_EPS1_FL0_GRVW1_GSU1_ISA908_IU1_KLA_LBSPP128_LPA2_LPB2_LRVW2_MAC_NLCA1_NLCB1_ONLL1_PGR1_PLR17_SIA3_SU32_SUS256_SRVW2_SNLL0_TT1_96_TLDS1_USFGROn1_VSn1_VW1_WSGRA1_WSGRB1_WG128_2_1_WGM15
    SolutionIndex: 247
    SolutionNameMin: Cijk_Alik_Bljk_SB_MT16x64x16_SE_1LDSB0_AF0EM1_AMAS3_BL1_DTL0_EPS1_FL0_GRVW4_GSU1_ISA908_IU1_KLA_LBSPP0_LPA0_LPB0_LRVW4_MAC_NLCA1_NLCB1_ONLL1_PGR1_PLR1_SIA1_SU32_SUS256_SRVW0_SNLL0_TT4_4_TLDS0_USFGRO1_VS1_VW4_WSGRA0_WSGRB0_WG4_16_4_WGM8
    SolutionIndex: 248
    SolutionNameMin: Cijk_Alik_Bljk_SB_MT16x16x32_MI16x16x4x1_SE_1LDSB0_AF0EM1_AMAS3_BL1_DTL0_EPS0_FL0_GRVW4_GSU5_ISA908_IU1_KLA_LBSPP128_LPA4_LPB4_LRVW2_MAC_NLCA1_NLCB1_ONLL1_PGR2_PLR9_SIA3_SU32_SUS128_SRVW0_SNLL0_TT1_16_TLDS1_USFGROn1_VSn1_VW2_WSGRA1_WSGRB1_WG16_4_1_WGM1
    SolutionIndex: 249
    SolutionNameMin: Cijk_Alik_Bljk_SB_MT64x32x32_MI16x16x4x1_SE_1LDSB0_AF0EM1_AMAS0_BL1_DTL0_EPS0_FL0_GRVW1_GSU1_ISA908_IU1_KLA_LBSPP128_LPA2_LPB2_LRVW2_MAC_NLCA1_NLCB1_ONLL1_PGR2_PLR9_SIA3_SU32_SUS256_SRVW2_SNLL0_TT2_16_TLDS1_USFGROn1_VSn1_VW1_WSGRA1_WSGRB1_WG32_8_1_WGM1
    SolutionIndex: 250
    SolutionNameMin: Cijk_Alik_Bljk_SB_MT16x16x32_MI16x16x4x1_SE_1LDSB0_AF0EM1_AMAS3_BL1_DTL0_EPS0_FL0_GRVW4_GSU5_ISA908_IU1_KLA_LBSPP128_LPA4_LPB4_LRVW2_MAC_NLCA1_NLCB1_ONLL1_PGR2_PLR9_SIA3_SU0_SUS256_SRVW0_SNLL0_TT1_16_TLDS1_USFGROn1_VSn1_VW2_WSGRA1_WSGRB1_WG16_4_1_WGM1
    SolutionIndex: 251
    SolutionNameMin: Cijk_Alik_Bljk_SB_MT64x128x16_MI32x32x2x1_SE_1LDSB1_AF0EM1_AMAS0_BL1_DTL0_EPS1_FL0_GRVW4_GSU1_ISA908_IU1_KLA_LBSPP128_LPA4_LPB4_LRVW2_MAC_NLCA1_NLCB1_ONLL1_PGR1_PLR9_SIA3_SU32_SUS128_SRVW2_SNLL0_TT1_64_TLDS1_USFGROn1_VSn1_VW1_WSGRA1_WSGRB1_WG64_4_1_WGM15
    SolutionIndex: 252
    SolutionNameMin: Cijk_Alik_Bljk_SB_MT16x8x32_SE_1LDSB0_AF0EM1_AMAS3_BL1_DTL0_EPS1_FL1_GRVW4_GSU1_ISA908_IU1_KLA_LBSPP0_LPA0_LPB0_LRVW2_MAC_NLCA1_NLCB1_ONLL1_PGR1_PLR1_SIA1_SU32_SUS256_SRVW0_SNLL1_TT4_2_TLDS0_USFGRO1_VS1_VW2_WSGRA0_WSGRB0_WG4_4_8_WGM8
    SolutionIndex: 253
    SolutionNameMin: Cijk_Alik_Bljk_SB_MT32x32x32_MI16x16x4x1_SE_1LDSB0_AF0EM1_AMAS0_BL1_DTL0_EPS0_FL0_GRVW2_GSU1_ISA908_IU1_KLA_LBSPP128_LPA2_LPB2_LRVW2_MAC_NLCA1_NLCB1_ONLL1_PGR2_PLR9_SIA3_SU0_SUS256_SRVW2_SNLL0_TT1_16_TLDS1_USFGROn1_VSn1_VW1_WSGRA1_WSGRB1_WG32_8_1_WGM15
    SolutionIndex: 254
    SolutionNameMin: Cijk_Alik_Bljk_SB_MT16x32x32_SE_1LDSB0_AF0EM1_AMAS3_BL1_DTL0_EPS1_FL0_GRVW2_GSU8_ISA908_IU1_KLA_LBSPP0_LPA2_LPB2_LRVW2_MAC_NLCA1_NLCB1_ONLL1_PGR1_PLR0_SIA1_SU32_SUS256_SRVW0_SNLL0_TT4_2_TLDS0_USFGRO1_VS1_VW2_WSGRA0_WSGRB0_WG4_16_4_WGM1
    SolutionIndex: 255
    SolutionNameMin: Cijk_Alik_Bljk_SB_MT32x32x32_MI16x16x4x1_SE_1LDSB0_AF0EM1_AMAS0_BL1_DTL0_EPS0_FL0_GRVW2_GSU5_ISA908_IU1_KLA_LBSPP128_LPA2_LPB2_LRVW2_MAC_NLCA1_NLCB1_ONLL1_PGR2_PLR9_SIA3_SU32_SUS128_SRVW0_SNLL0_TT1_16_TLDS1_USFGROn1_VSn1_VW1_WSGRA1_WSGRB1_WG32_8_1_WGM2
    SolutionIndex: 256
    SolutionNameMin: Cijk_Alik_Bljk_SB_MT16x16x32_MI16x16x4x1_SE_1LDSB0_AF0EM1_AMAS3_BL1_DTL0_EPS1_FL0_GRVW2_GSU1_ISA908_IU1_KLA_LBSPP128_LPA2_LPB2_LRVW2_MAC_NLCA1_NLCB1_ONLL1_PGR1_PLR9_SIA3_SU0_SUS256_SRVW0_SNLL0_TT1_16_TLDS1_USFGROn1_VSn1_VW2_WSGRA1_WSGRB1_WG16_4_1_WGM2
    SolutionIndex: 257
    SolutionNameMin: Cijk_Alik_Bljk_SB_MT16x16x16_SN_1LDSB0_AF0EM1_AMAS3_BL1_DTL0_EPS1_FL0_GRVW2_GSU8_ISA908_IU1_KLA_LBSPP0_LPA0_LPB0_LRVW2_MAC_NLCA1_NLCB1_ONLL1_PGR1_PLR1_SIA1_SU32_SUS256_SRVW0_SNLL0_TT2_2_TLDS0_USFGRO1_VS1_VW2_WSGRA0_WSGRB0_WG8_8_4_WGM1
    SolutionIndex: 258
    SolutionNameMin: Cijk_Alik_Bljk_SB_MT8x32x32_SE_1LDSB0_AF0EM1_AMAS3_BL1_DTL0_EPS1_FL0_GRVW2_GSU1_ISA908_IU1_KLA_LBSPP0_LPA2_LPB2_LRVW2_MAC_NLCA1_NLCB1_ONLL1_PGR1_PLR1_SIA1_SU32_SUS256_SRVW0_SNLL0_TT2_2_TLDS0_USFGRO1_VS1_VW2_WSGRA0_WSGRB0_WG4_16_4_WGM8
    SolutionIndex: 259
    SolutionNameMin: Cijk_Alik_Bljk_SB_MT16x16x32_MI16x16x4x1_SE_1LDSB1_AF0EM1_AMAS3_BL1_DTL0_EPS1_FL0_GRVW4_GSU5_ISA908_IU1_KLA_LBSPP128_LPA4_LPB4_LRVW2_MAC_NLCA1_NLCB1_ONLL1_PGR1_PLR9_SIA3_SU0_SUS256_SRVW0_SNLL0_TT1_16_TLDS1_USFGROn1_VSn1_VW2_WSGRA1_WSGRB1_WG16_4_1_WGM15
    SolutionIndex: 260
    SolutionNameMin: Cijk_Alik_Bljk_SB_MT32x64x32_MI16x16x4x1_SE_1LDSB0_AF0EM1_AMAS0_BL1_DTL0_EPS0_FL0_GRVW4_GSU3_ISA908_IU1_KLA_LBSPP128_LPA4_LPB4_LRVW2_MAC_NLCA1_NLCB1_ONLL1_PGR2_PLR9_SIA3_SU32_SUS256_SRVW0_SNLL0_TT1_32_TLDS1_USFGROn1_VSn1_VW1_WSGRA1_WSGRB1_WG32_8_1_WGM15
    SolutionIndex: 261
    SolutionNameMin: Cijk_Alik_Bljk_SB_MT64x144x32_MI16x16x4x1_SE_1LDSB1_AF0EM1_AMAS0_BL1_DTL0_EPS0_FL0_GRVW1_GSU1_ISA908_IU1_KLA_LBSPP128_LPA2_LPB2_LRVW2_MAC_NLCA1_NLCB1_ONLL1_PGR2_PLR9_SIA3_SU0_SUS256_SRVW2_SNLL0_TT1_144_TLDS1_USFGROn1_VSn1_VW1_WSGRA1_WSGRB1_WG64_4_1_WGM15
    SolutionIndex: 262
    SolutionNameMin: Cijk_Alik_Bljk_SB_MT64x64x32_MI32x32x2x1_SE_1LDSB1_AF0EM1_AMAS0_BL1_DTL0_EPS0_FL0_GRVW4_GSU1_ISA908_IU1_KLA_LBSPP128_LPA4_LPB4_LRVW2_MAC_NLCA1_NLCB1_ONLL1_PGR2_PLR17_SIA3_SU0_SUS256_SRVW2_SNLL0_TT1_32_TLDS1_USFGROn1_VSn1_VW1_WSGRA1_WSGRB1_WG64_4_1_WGM2
    SolutionIndex: 263
    SolutionNameMin: Cijk_Alik_Bljk_SB_MT64x64x32_MI32x32x2x1_SE_1LDSB0_AF0EM1_AMAS0_BL1_DTL0_EPS0_FL0_GRVW1_GSU1_ISA908_IU1_KLA_LBSPP128_LPA2_LPB2_LRVW2_MAC_NLCA1_NLCB1_ONLL1_PGR2_PLR17_SIA3_SU32_SUS128_SRVW2_SNLL0_TT1_32_TLDS1_USFGROn1_VSn1_VW1_WSGRA1_WSGRB1_WG64_4_1_WGM2
    SolutionIndex: 264
    SolutionNameMin: Cijk_Alik_Bljk_SB_MT64x128x32_MI32x32x2x1_SE_1LDSB0_AF0EM1_AMAS0_BL1_DTL0_EPS0_FL0_GRVW1_GSU1_ISA908_IU1_KLA_LBSPP128_LPA2_LPB2_LRVW2_MAC_NLCA1_NLCB1_ONLL1_PGR2_PLR17_SIA3_SU0_SUS256_SRVW2_SNLL0_TT1_64_TLDS1_USFGROn1_VSn1_VW1_WSGRA1_WSGRB1_WG64_4_1_WGM15
    SolutionIndex: 265
    SolutionNameMin: Cijk_Alik_Bljk_SB_MT64x64x32_MI32x32x2x1_SE_1LDSB1_AF0EM1_AMAS0_BL1_DTL0_EPS1_FL0_GRVW2_GSU1_ISA908_IU1_KLA_LBSPP128_LPA2_LPB2_LRVW2_MAC_NLCA1_NLCB1_ONLL1_PGR1_PLR17_SIA3_SU0_SUS256_SRVW2_SNLL0_TT1_32_TLDS1_USFGROn1_VSn1_VW1_WSGRA1_WSGRB1_WG64_4_1_WGM1
    SolutionIndex: 266
    SolutionNameMin: Cijk_Alik_Bljk_SB_MT8x32x32_SE_1LDSB0_AF0EM1_AMAS3_BL1_DTL0_EPS1_FL0_GRVW4_GSU4_ISA908_IU1_KLA_LBSPP0_LPA0_LPB2_LRVW2_MAC_NLCA1_NLCB1_ONLL1_PGR1_PLR1_SIA1_SU32_SUS256_SRVW0_SNLL0_TT2_2_TLDS0_USFGRO1_VS1_VW2_WSGRA0_WSGRB0_WG4_16_4_WGM8
    SolutionIndex: 267
    SolutionNameMin: Cijk_Alik_Bljk_SB_MT64x144x32_MI16x16x4x1_SE_1LDSB1_AF0EM1_AMAS0_BL1_DTL0_EPS0_FL0_GRVW1_GSU1_ISA908_IU1_KLA_LBSPP128_LPA2_LPB2_LRVW2_MAC_NLCA1_NLCB1_ONLL1_PGR2_PLR9_SIA3_SU32_SUS128_SRVW2_SNLL0_TT1_144_TLDS1_USFGROn1_VSn1_VW1_WSGRA1_WSGRB1_WG64_4_1_WGM15
    SolutionIndex: 268
    SolutionNameMin: Cijk_Alik_Bljk_SB_MT32x64x16_MI16x16x4x1_SN_1LDSB0_AF0EM1_AMAS0_BL1_DTL0_EPS0_FL0_GRVW2_GSU1_ISA908_IU1_KLA_LBSPP128_LPA2_LPB2_LRVW2_MAC_NLCA1_NLCB1_ONLL1_PGR2_PLR5_SIA3_SU32_SUS256_SRVW2_SNLL0_TT1_32_TLDS1_USFGROn1_VSn1_VW1_WSGRA1_WSGRB1_WG32_8_1_WGM15
    SolutionIndex: 269
    SolutionNameMin: Cijk_Alik_Bljk_SB_MT96x96x32_MI16x16x4x1_SE_1LDSB1_AF0EM1_AMAS0_BL1_DTL0_EPS1_FL0_GRVW1_GSU1_ISA908_IU1_KLA_LBSPP128_LPA2_LPB2_LRVW2_MAC_NLCA1_NLCB1_ONLL1_PGR1_PLR9_SIA3_SU32_SUS256_SRVW0_SNLL0_TT3_48_TLDS1_USFGROn1_VSn1_VW1_WSGRA1_WSGRB1_WG32_8_1_WGM1
    SolutionIndex: 270
    SolutionNameMin: Cijk_Alik_Bljk_SB_MT32x64x32_MI16x16x4x1_SE_1LDSB0_AF0EM1_AMAS0_BL1_DTL0_EPS0_FL0_GRVW1_GSU1_ISA908_IU1_KLA_LBSPP128_LPA2_LPB2_LRVW2_MAC_NLCA1_NLCB1_ONLL1_PGR2_PLR9_SIA3_SU0_SUS256_SRVW2_SNLL0_TT1_32_TLDS1_USFGROn1_VSn1_VW1_WSGRA1_WSGRB1_WG32_8_1_WGM1
    SolutionIndex: 271
    SolutionNameMin: Cijk_Alik_Bljk_SB_MT64x128x32_MI32x32x2x1_SE_1LDSB1_AF0EM1_AMAS0_BL1_DTL0_EPS0_FL0_GRVW4_GSU1_ISA908_IU1_KLA_LBSPP128_LPA4_LPB4_LRVW2_MAC_NLCA1_NLCB1_ONLL1_PGR2_PLR17_SIA3_SU32_SUS256_SRVW2_SNLL0_TT1_64_TLDS1_USFGROn1_VSn1_VW1_WSGRA1_WSGRB1_WG64_4_1_WGM2
    SolutionIndex: 272
    SolutionNameMin: Cijk_Alik_Bljk_SB_MT16x16x16_SN_1LDSB0_AF0EM1_AMAS3_BL1_DTL0_EPS1_FL0_GRVW2_GSU16_ISA908_IU1_KLA_LBSPP0_LPA0_LPB0_LRVW2_MAC_NLCA1_NLCB1_ONLL1_PGR1_PLR1_SIA1_SU32_SUS256_SRVW0_SNLL0_TT2_2_TLDS0_USFGRO1_VS1_VW2_WSGRA0_WSGRB0_WG8_8_4_WGM1
    SolutionIndex: 273
    SolutionNameMin: Cijk_Alik_Bljk_SB_MT64x128x16_MI32x32x2x1_SE_1LDSB1_AF0EM1_AMAS0_BL1_DTL0_EPS0_FL0_GRVW2_GSU1_ISA908_IU1_KLA_LBSPP128_LPA2_LPB2_LRVW2_MAC_NLCA1_NLCB1_ONLL1_PGR2_PLR9_SIA3_SU32_SUS128_SRVW2_SNLL0_TT1_64_TLDS1_USFGROn1_VSn1_VW1_WSGRA1_WSGRB1_WG64_4_1_WGM1
    SolutionIndex: 274
    SolutionNameMin: Cijk_Alik_Bljk_SB_MT64x64x32_MI32x32x2x1_SE_1LDSB0_AF0EM1_AMAS0_BL1_DTL0_EPS0_FL0_GRVW2_GSU1_ISA908_IU1_KLA_LBSPP128_LPA2_LPB2_LRVW2_MAC_NLCA1_NLCB1_ONLL1_PGR2_PLR17_SIA3_SU0_SUS256_SRVW2_SNLL0_TT1_32_TLDS1_USFGROn1_VSn1_VW1_WSGRA1_WSGRB1_WG64_4_1_WGM15
    SolutionIndex: 275
    SolutionNameMin: Cijk_Alik_Bljk_SB_MT96x96x32_MI16x16x4x1_SE_1LDSB1_AF0EM1_AMAS0_BL1_DTL0_EPS0_FL0_GRVW1_GSU1_ISA908_IU1_KLA_LBSPP128_LPA2_LPB2_LRVW2_MAC_NLCA1_NLCB1_ONLL1_PGR2_PLR9_SIA3_SU0_SUS256_SRVW0_SNLL0_TT3_48_TLDS1_USFGROn1_VSn1_VW1_WSGRA1_WSGRB1_WG32_8_1_WGM2
    SolutionIndex: 276
    SolutionNameMin: Cijk_Alik_Bljk_SB_MT32x64x32_MI16x16x4x1_SE_1LDSB0_AF0EM1_AMAS0_BL1_DTL0_EPS0_FL0_GRVW4_GSU1_ISA908_IU1_KLA_LBSPP128_LPA4_LPB4_LRVW2_MAC_NLCA1_NLCB1_ONLL1_PGR2_PLR9_SIA3_SU32_SUS128_SRVW2_SNLL0_TT1_32_TLDS1_USFGROn1_VSn1_VW1_WSGRA1_WSGRB1_WG32_8_1_WGM15
    SolutionIndex: 277
    SolutionNameMin: Cijk_Alik_Bljk_SB_MT64x64x32_MI32x32x2x1_SE_1LDSB0_AF0EM1_AMAS0_BL1_DTL0_EPS0_FL0_GRVW1_GSU1_ISA908_IU1_KLA_LBSPP128_LPA2_LPB2_LRVW2_MAC_NLCA1_NLCB1_ONLL1_PGR2_PLR17_SIA3_SU0_SUS256_SRVW2_SNLL0_TT1_32_TLDS1_USFGROn1_VSn1_VW1_WSGRA1_WSGRB1_WG64_4_1_WGM2
    SolutionIndex: 278
    SolutionNameMin: Cijk_Alik_Bljk_SB_MT64x64x32_MI32x32x2x1_SE_1LDSB0_AF0EM1_AMAS0_BL1_DTL0_EPS0_FL0_GRVW4_GSU1_ISA908_IU1_KLA_LBSPP128_LPA4_LPB4_LRVW2_MAC_NLCA1_NLCB1_ONLL1_PGR2_PLR17_SIA3_SU0_SUS256_SRVW2_SNLL0_TT1_32_TLDS1_USFGROn1_VSn1_VW1_WSGRA1_WSGRB1_WG64_4_1_WGM1
    SolutionIndex: 279
    SolutionNameMin: Cijk_Alik_Bljk_SB_MT32x8x32_SE_1LDSB0_AF0EM1_AMAS3_BL1_DTL0_EPS1_FL0_GRVW1_GSU1_ISA908_IU1_KLA_LBSPP0_LPA2_LPB2_LRVW2_MAC_NLCA1_NLCB1_ONLL1_PGR1_PLR1_SIA1_SU32_SUS256_SRVW0_SNLL0_TT2_2_TLDS0_USFGRO1_VS1_VW2_WSGRA0_WSGRB0_WG16_4_4_WGM1
    SolutionIndex: 280
    SolutionNameMin: Cijk_Alik_Bljk_SB_MT32x32x32_MI16x16x4x1_SE_1LDSB0_AF0EM1_AMAS0_BL1_DTL0_EPS0_FL0_GRVW1_GSU1_ISA908_IU1_KLA_LBSPP128_LPA2_LPB2_LRVW2_MAC_NLCA1_NLCB1_ONLL1_PGR2_PLR9_SIA3_SU0_SUS256_SRVW2_SNLL0_TT1_16_TLDS1_USFGROn1_VSn1_VW1_WSGRA1_WSGRB1_WG32_8_1_WGM1
    SolutionIndex: 281
    SolutionNameMin: Cijk_Alik_Bljk_SB_MT8x32x32_SE_1LDSB0_AF0EM1_AMAS3_BL1_DTL0_EPS1_FL0_GRVW1_GSU1_ISA908_IU1_KLA_LBSPP0_LPA0_LPB2_LRVW2_MAC_NLCA1_NLCB1_ONLL1_PGR1_PLR1_SIA1_SU32_SUS256_SRVW0_SNLL0_TT2_2_TLDS0_USFGRO1_VS1_VW2_WSGRA0_WSGRB0_WG4_16_4_WGM1
    SolutionIndex: 282
    SolutionNameMin: Cijk_Alik_Bljk_SB_MT128x144x16_MI16x16x4x1_SE_1LDSB1_AF0EM1_AMAS0_BL1_DTL0_EPS0_FL0_GRVW1_GSU1_ISA908_IU1_KLA_LBSPP128_LPA2_LPB2_LRVW2_MAC_NLCA1_NLCB1_ONLL1_PGR2_PLR5_SIA3_SU0_SUS256_SRVW2_SNLL0_TT2_144_TLDS1_USFGROn1_VSn1_VW1_WSGRA1_WSGRB1_WG64_4_1_WGM15
    SolutionIndex: 283
    SolutionNameMin: Cijk_Alik_Bljk_SB_MT64x64x16_MI32x32x2x1_SE_1LDSB1_AF0EM1_AMAS0_BL1_DTL0_EPS1_FL0_GRVW4_GSU1_ISA908_IU1_KLA_LBSPP128_LPA4_LPB4_LRVW2_MAC_NLCA1_NLCB1_ONLL1_PGR1_PLR9_SIA3_SU32_SUS256_SRVW2_SNLL0_TT1_32_TLDS1_USFGROn1_VSn1_VW1_WSGRA1_WSGRB1_WG64_4_1_WGM2
    SolutionIndex: 284
    SolutionNameMin: Cijk_Alik_Bljk_SB_MT64x32x16_SE_1LDSB0_AF0EM1_AMAS3_BL1_DTL0_EPS1_FL1_GRVW2_GSU1_ISA908_IU1_KLA_LBSPP0_LPA4_LPB4_LRVW4_MAC_NLCA1_NLCB1_ONLL1_PGR1_PLR1_SIA1_SU32_SUS256_SRVW0_SNLL0_TT4_4_TLDS0_USFGRO1_VS1_VW4_WSGRA0_WSGRB0_WG16_8_1_WGM1
    SolutionIndex: 285
    SolutionNameMin: Cijk_Alik_Bljk_SB_MT64x128x16_MI32x32x2x1_SE_1LDSB1_AF0EM1_AMAS0_BL1_DTL0_EPS0_FL0_GRVW4_GSU1_ISA908_IU1_KLA_LBSPP128_LPA4_LPB4_LRVW2_MAC_NLCA1_NLCB1_ONLL1_PGR2_PLR9_SIA3_SU0_SUS256_SRVW2_SNLL0_TT1_64_TLDS1_USFGROn1_VSn1_VW1_WSGRA1_WSGRB1_WG64_4_1_WGM15
    SolutionIndex: 286
    SolutionNameMin: Cijk_Alik_Bljk_SB_MT96x96x32_MI16x16x4x1_SE_1LDSB1_AF0EM1_AMAS0_BL1_DTL0_EPS0_FL0_GRVW1_GSU1_ISA908_IU1_KLA_LBSPP128_LPA2_LPB2_LRVW2_MAC_NLCA1_NLCB1_ONLL1_PGR2_PLR9_SIA3_SU32_SUS256_SRVW0_SNLL0_TT3_48_TLDS1_USFGROn1_VSn1_VW1_WSGRA1_WSGRB1_WG32_8_1_WGM15
    SolutionIndex: 287
    SolutionNameMin: Cijk_Alik_Bljk_SB_MT64x128x16_MI32x32x2x1_SE_1LDSB0_AF0EM1_AMAS0_BL1_DTL0_EPS0_FL0_GRVW2_GSU1_ISA908_IU1_KLA_LBSPP128_LPA2_LPB2_LRVW2_MAC_NLCA1_NLCB1_ONLL1_PGR2_PLR9_SIA3_SU32_SUS256_SRVW2_SNLL0_TT1_64_TLDS1_USFGROn1_VSn1_VW1_WSGRA1_WSGRB1_WG64_4_1_WGM15
    SolutionIndex: 288
    SolutionNameMin: Cijk_Alik_Bljk_SB_MT32x32x32_MI16x16x4x1_SE_1LDSB1_AF0EM1_AMAS0_BL1_DTL0_EPS0_FL0_GRVW4_GSU3_ISA908_IU1_KLA_LBSPP128_LPA4_LPB4_LRVW2_MAC_NLCA1_NLCB1_ONLL1_PGR2_PLR9_SIA3_SU32_SUS128_SRVW0_SNLL0_TT1_16_TLDS1_USFGROn1_VSn1_VW1_WSGRA1_WSGRB1_WG32_8_1_WGM1
    SolutionIndex: 289
    SolutionNameMin: Cijk_Alik_Bljk_SB_MT16x16x32_MI16x16x4x1_SE_1LDSB0_AF0EM1_AMAS3_BL1_DTL0_EPS1_FL0_GRVW2_GSU1_ISA908_IU1_KLA_LBSPP128_LPA2_LPB2_LRVW2_MAC_NLCA1_NLCB1_ONLL1_PGR1_PLR9_SIA3_SU0_SUS256_SRVW0_SNLL0_TT1_16_TLDS1_USFGROn1_VSn1_VW2_WSGRA1_WSGRB1_WG16_4_1_WGM1
    SolutionIndex: 290
    SolutionNameMin: Cijk_Alik_Bljk_SB_MT144x64x32_MI16x16x4x1_SE_1LDSB0_AF0EM1_AMAS0_BL1_DTL0_EPS1_FL0_GRVW1_GSU1_ISA908_IU1_KLA_LBSPP128_LPA2_LPB2_LRVW2_MAC_NLCA1_NLCB1_ONLL1_PGR1_PLR9_SIA3_SU0_SUS256_SRVW0_SNLL0_TT9_16_TLDS1_USFGROn1_VSn1_VW1_WSGRA1_WSGRB1_WG16_16_1_WGM15
    SolutionIndex: 291
    SolutionNameMin: Cijk_Alik_Bljk_SB_MT32x8x32_SE_1LDSB0_AF0EM1_AMAS3_BL1_DTL0_EPS1_FL0_GRVW2_GSU1_ISA908_IU1_KLA_LBSPP0_LPA2_LPB2_LRVW2_MAC_NLCA1_NLCB1_ONLL1_PGR1_PLR1_SIA1_SU32_SUS256_SRVW0_SNLL0_TT2_2_TLDS0_USFGRO1_VS1_VW2_WSGRA0_WSGRB0_WG16_4_4_WGM8
    SolutionIndex: 292
    SolutionNameMin: Cijk_Alik_Bljk_SB_MT16x16x32_MI16x16x4x1_SE_1LDSB0_AF0EM1_AMAS3_BL1_DTL0_EPS0_FL0_GRVW2_GSU3_ISA908_IU1_KLA_LBSPP128_LPA2_LPB2_LRVW2_MAC_NLCA1_NLCB1_ONLL1_PGR2_PLR9_SIA3_SU32_SUS128_SRVW0_SNLL0_TT1_16_TLDS1_USFGROn1_VSn1_VW2_WSGRA1_WSGRB1_WG16_4_1_WGM2
    SolutionIndex: 293
    SolutionNameMin: Cijk_Alik_Bljk_SB_MT96x96x32_MI16x16x4x1_SN_1LDSB1_AF0EM1_AMAS0_BL1_DTL0_EPS1_FL0_GRVW1_GSU1_ISA908_IU1_KLA_LBSPP128_LPA2_LPB2_LRVW2_MAC_NLCA1_NLCB1_ONLL1_PGR1_PLR9_SIA3_SU32_SUS256_SRVW0_SNLL0_TT3_48_TLDS1_USFGROn1_VSn1_VW1_WSGRA1_WSGRB1_WG32_8_1_WGM15
    SolutionIndex: 294
    SolutionNameMin: Cijk_Alik_Bljk_SB_MT64x128x16_MI32x32x2x1_SE_1LDSB0_AF0EM1_AMAS3_BL1_DTL0_EPS1_FL0_GRVW4_GSU1_ISA908_IU1_KLA_LBSPP128_LPA4_LPB4_LRVW1_MAC_NLCA1_NLCB1_ONLL1_PGR1_PLR1_SIA3_SU32_SUS256_SRVW0_SNLL0_TT2_32_TLDS1_USFGROn1_VSn1_VW4_WSGRA1_WSGRB0_WG16_16_1_WGM8
    SolutionIndex: 295
    SolutionNameMin: Cijk_Alik_Bljk_SB_MT16x16x32_MI16x16x4x1_SE_1LDSB0_AF0EM1_AMAS3_BL1_DTL0_EPS0_FL0_GRVW2_GSU5_ISA908_IU1_KLA_LBSPP128_LPA2_LPB2_LRVW2_MAC_NLCA1_NLCB1_ONLL1_PGR2_PLR9_SIA3_SU32_SUS128_SRVW0_SNLL0_TT1_16_TLDS1_USFGROn1_VSn1_VW2_WSGRA1_WSGRB1_WG16_4_1_WGM1
    SolutionIndex: 296
    SolutionNameMin: Cijk_Alik_Bljk_SB_MT64x128x32_MI32x32x2x1_SE_1LDSB1_AF0EM1_AMAS0_BL1_DTL0_EPS0_FL0_GRVW2_GSU1_ISA908_IU1_KLA_LBSPP128_LPA2_LPB2_LRVW2_MAC_NLCA1_NLCB1_ONLL1_PGR2_PLR17_SIA3_SU32_SUS256_SRVW2_SNLL0_TT1_64_TLDS1_USFGROn1_VSn1_VW1_WSGRA1_WSGRB1_WG64_4_1_WGM15
    SolutionIndex: 297
    SolutionNameMin: Cijk_Alik_Bljk_SB_MT16x64x32_MI16x16x4x1_SE_1LDSB0_AF0EM1_AMAS3_BL1_DTL0_EPS0_FL0_GRVW4_GSU5_ISA908_IU1_KLA_LBSPP128_LPA4_LPB4_LRVW2_MAC_NLCA1_NLCB1_ONLL1_PGR2_PLR9_SIA3_SU0_SUS256_SRVW0_SNLL0_TT1_16_TLDS1_USFGROn1_VSn1_VW2_WSGRA1_WSGRB1_WG16_16_1_WGM2
    SolutionIndex: 298
    SolutionNameMin: Cijk_Alik_Bljk_SB_MT64x144x16_MI16x16x4x1_SE_1LDSB0_AF0EM1_AMAS0_BL1_DTL0_EPS0_FL0_GRVW1_GSU1_ISA908_IU1_KLA_LBSPP128_LPA2_LPB2_LRVW2_MAC_NLCA1_NLCB1_ONLL1_PGR2_PLR5_SIA3_SU0_SUS256_SRVW2_SNLL0_TT1_144_TLDS1_USFGROn1_VSn1_VW1_WSGRA1_WSGRB1_WG64_4_1_WGM1
    SolutionIndex: 299
    SolutionNameMin: Cijk_Alik_Bljk_SB_MT96x96x32_MI16x16x4x1_SE_1LDSB1_AF0EM1_AMAS0_BL1_DTL0_EPS1_FL0_GRVW1_GSU1_ISA908_IU1_KLA_LBSPP128_LPA2_LPB2_LRVW2_MAC_NLCA1_NLCB1_ONLL1_PGR1_PLR9_SIA3_SU0_SUS256_SRVW0_SNLL0_TT3_48_TLDS1_USFGROn1_VSn1_VW1_WSGRA1_WSGRB1_WG32_8_1_WGM2
    SolutionIndex: 300
    SolutionNameMin: Cijk_Alik_Bljk_SB_MT32x64x32_MI16x16x4x1_SE_1LDSB1_AF0EM1_AMAS0_BL1_DTL0_EPS0_FL0_GRVW2_GSU1_ISA908_IU1_KLA_LBSPP128_LPA2_LPB2_LRVW2_MAC_NLCA1_NLCB1_ONLL1_PGR2_PLR9_SIA3_SU0_SUS256_SRVW2_SNLL0_TT1_32_TLDS1_USFGROn1_VSn1_VW1_WSGRA1_WSGRB1_WG32_8_1_WGM1
    SolutionIndex: 301
    SolutionNameMin: Cijk_Alik_Bljk_SB_MT128x144x16_MI16x16x4x1_SE_1LDSB1_AF0EM1_AMAS0_BL1_DTL0_EPS1_FL0_GRVW1_GSU1_ISA908_IU1_KLA_LBSPP128_LPA2_LPB2_LRVW2_MAC_NLCA1_NLCB1_ONLL1_PGR1_PLR5_SIA3_SU32_SUS128_SRVW2_SNLL0_TT2_144_TLDS1_USFGROn1_VSn1_VW1_WSGRA1_WSGRB1_WG64_4_1_WGM15
    SolutionIndex: 302
    SolutionNameMin: Cijk_Alik_Bljk_SB_MT64x64x16_MI32x32x2x1_SE_1LDSB0_AF0EM1_AMAS0_BL1_DTL0_EPS0_FL0_GRVW4_GSU1_ISA908_IU1_KLA_LBSPP128_LPA4_LPB4_LRVW2_MAC_NLCA1_NLCB1_ONLL1_PGR2_PLR9_SIA3_SU0_SUS256_SRVW2_SNLL0_TT1_32_TLDS1_USFGROn1_VSn1_VW1_WSGRA1_WSGRB1_WG64_4_1_WGM2
    SolutionIndex: 303
    SolutionNameMin: Cijk_Alik_Bljk_SB_MT64x64x16_MI32x32x2x1_SE_1LDSB0_AF0EM1_AMAS0_BL1_DTL0_EPS0_FL0_GRVW1_GSU1_ISA908_IU1_KLA_LBSPP128_LPA2_LPB2_LRVW2_MAC_NLCA1_NLCB1_ONLL1_PGR2_PLR9_SIA3_SU32_SUS128_SRVW2_SNLL0_TT1_32_TLDS1_USFGROn1_VSn1_VW1_WSGRA1_WSGRB1_WG64_4_1_WGM1
    SolutionIndex: 304
    SolutionNameMin: Cijk_Alik_Bljk_SB_MT64x64x32_MI32x32x2x1_SE_1LDSB0_AF0EM1_AMAS0_BL1_DTL0_EPS0_FL0_GRVW1_GSU1_ISA908_IU1_KLA_LBSPP128_LPA2_LPB2_LRVW2_MAC_NLCA1_NLCB1_ONLL1_PGR2_PLR17_SIA3_SU32_SUS256_SRVW2_SNLL0_TT1_32_TLDS1_USFGROn1_VSn1_VW1_WSGRA1_WSGRB1_WG64_4_1_WGM2
    SolutionIndex: 305
    SolutionNameMin: Cijk_Alik_Bljk_SB_MT32x32x16_MI16x16x4x1_SE_1LDSB0_AF0EM1_AMAS0_BL1_DTL0_EPS0_FL0_GRVW1_GSU1_ISA908_IU1_KLA_LBSPP128_LPA2_LPB2_LRVW2_MAC_NLCA1_NLCB1_ONLL1_PGR2_PLR5_SIA3_SU0_SUS256_SRVW2_SNLL0_TT1_16_TLDS1_USFGROn1_VSn1_VW1_WSGRA1_WSGRB1_WG32_8_1_WGM1
    SolutionIndex: 306
    SolutionNameMin: Cijk_Alik_Bljk_SB_MT32x32x32_MI16x16x4x1_SE_1LDSB0_AF0EM1_AMAS0_BL1_DTL0_EPS0_FL0_GRVW4_GSU5_ISA908_IU1_KLA_LBSPP128_LPA4_LPB4_LRVW2_MAC_NLCA1_NLCB1_ONLL1_PGR2_PLR9_SIA3_SU0_SUS256_SRVW0_SNLL0_TT1_16_TLDS1_USFGROn1_VSn1_VW1_WSGRA1_WSGRB1_WG32_8_1_WGM1
    SolutionIndex: 307
    SolutionNameMin: Cijk_Alik_Bljk_SB_MT32x32x16_MI16x16x4x1_SE_1LDSB0_AF0EM1_AMAS0_BL1_DTL0_EPS1_FL0_GRVW1_GSU1_ISA908_IU1_KLA_LBSPP128_LPA2_LPB2_LRVW2_MAC_NLCA1_NLCB1_ONLL1_PGR1_PLR5_SIA3_SU0_SUS256_SRVW2_SNLL0_TT1_16_TLDS1_USFGROn1_VSn1_VW1_WSGRA1_WSGRB1_WG32_8_1_WGM1
    SolutionIndex: 308
    SolutionNameMin: Cijk_Alik_Bljk_SB_MT16x16x32_MI16x16x4x1_SE_1LDSB0_AF0EM1_AMAS3_BL1_DTL0_EPS1_FL0_GRVW4_GSU5_ISA908_IU1_KLA_LBSPP128_LPA4_LPB4_LRVW2_MAC_NLCA1_NLCB1_ONLL1_PGR1_PLR9_SIA3_SU32_SUS128_SRVW0_SNLL0_TT1_16_TLDS1_USFGROn1_VSn1_VW2_WSGRA1_WSGRB1_WG16_4_1_WGM1
    SolutionIndex: 309
    SolutionNameMin: Cijk_Alik_Bljk_SB_MT64x128x16_MI32x32x2x1_SE_1LDSB1_AF0EM1_AMAS0_BL1_DTL0_EPS1_FL0_GRVW4_GSU1_ISA908_IU1_KLA_LBSPP128_LPA4_LPB4_LRVW2_MAC_NLCA1_NLCB1_ONLL1_PGR1_PLR9_SIA3_SU0_SUS256_SRVW2_SNLL0_TT1_64_TLDS1_USFGROn1_VSn1_VW1_WSGRA1_WSGRB1_WG64_4_1_WGM2
    SolutionIndex: 310
    SolutionNameMin: Cijk_Alik_Bljk_SB_MT128x96x16_MI32x32x2x1_SE_1LDSB0_AF0EM1_AMAS0_BL1_DTL0_EPS0_FL0_GRVW2_GSU1_ISA908_IU1_KLA_LBSPP128_LPA2_LPB2_LRVW2_MAC_NLCA1_NLCB1_ONLL1_PGR2_PLR9_SIA3_SU0_SUS256_SRVW2_SNLL0_TT1_96_TLDS1_USFGROn1_VSn1_VW1_WSGRA1_WSGRB1_WG128_2_1_WGM15
    SolutionIndex: 311
    SolutionNameMin: Cijk_Alik_Bljk_SB_MT64x32x32_MI16x16x4x1_SE_1LDSB0_AF0EM1_AMAS0_BL1_DTL0_EPS0_FL0_GRVW2_GSU1_ISA908_IU1_KLA_LBSPP128_LPA2_LPB2_LRVW2_MAC_NLCA1_NLCB1_ONLL1_PGR2_PLR9_SIA3_SU32_SUS256_SRVW2_SNLL0_TT2_16_TLDS1_USFGROn1_VSn1_VW1_WSGRA1_WSGRB1_WG32_8_1_WGM2
    SolutionIndex: 312
    SolutionNameMin: Cijk_Alik_Bljk_SB_MT16x16x32_SE_1LDSB0_AF0EM1_AMAS3_BL1_DTL0_EPS1_FL1_GRVW4_GSU1_ISA908_IU1_KLA_LBSPP0_LPA0_LPB0_LRVW4_MAC_NLCA1_NLCB1_ONLL1_PGR1_PLR1_SIA1_SU32_SUS256_SRVW0_SNLL1_TT4_4_TLDS0_USFGRO1_VS1_VW4_WSGRA0_WSGRB0_WG4_4_8_WGM64
    SolutionIndex: 313
    SolutionNameMin: Cijk_Alik_Bljk_SB_MT64x128x16_MI32x32x2x1_SE_1LDSB1_AF0EM1_AMAS0_BL1_DTL0_EPS1_FL0_GRVW4_GSU1_ISA908_IU1_KLA_LBSPP128_LPA4_LPB4_LRVW2_MAC_NLCA1_NLCB1_ONLL1_PGR1_PLR9_SIA3_SU0_SUS256_SRVW2_SNLL0_TT1_64_TLDS1_USFGROn1_VSn1_VW1_WSGRA1_WSGRB1_WG64_4_1_WGM15
    SolutionIndex: 314
    SolutionNameMin: Cijk_Alik_Bljk_SB_MT64x128x16_MI32x32x2x1_SE_1LDSB0_AF0EM1_AMAS0_BL1_DTL0_EPS0_FL0_GRVW1_GSU1_ISA908_IU1_KLA_LBSPP128_LPA2_LPB2_LRVW2_MAC_NLCA1_NLCB1_ONLL1_PGR2_PLR9_SIA3_SU32_SUS256_SRVW2_SNLL0_TT1_64_TLDS1_USFGROn1_VSn1_VW1_WSGRA1_WSGRB1_WG64_4_1_WGM15
    SolutionIndex: 315
    SolutionNameMin: Cijk_Alik_Bljk_SB_MT144x64x32_MI16x16x4x1_SE_1LDSB0_AF0EM1_AMAS0_BL1_DTL0_EPS0_FL0_GRVW1_GSU1_ISA908_IU1_KLA_LBSPP128_LPA2_LPB2_LRVW2_MAC_NLCA1_NLCB1_ONLL1_PGR2_PLR9_SIA3_SU0_SUS256_SRVW0_SNLL0_TT9_16_TLDS1_USFGROn1_VSn1_VW1_WSGRA1_WSGRB1_WG16_16_1_WGM1
    SolutionIndex: 316
    SolutionNameMin: Cijk_Alik_Bljk_SB_MT16x16x32_MI16x16x4x1_SE_1LDSB0_AF0EM1_AMAS3_BL1_DTL0_EPS0_FL0_GRVW1_GSU5_ISA908_IU1_KLA_LBSPP128_LPA2_LPB2_LRVW2_MAC_NLCA1_NLCB1_ONLL1_PGR2_PLR9_SIA3_SU32_SUS256_SRVW0_SNLL0_TT1_16_TLDS1_USFGROn1_VSn1_VW2_WSGRA1_WSGRB1_WG16_4_1_WGM2
    SolutionIndex: 317
    SolutionNameMin: Cijk_Alik_Bljk_SB_MT144x64x16_MI16x16x4x1_SE_1LDSB0_AF0EM1_AMAS0_BL1_DTL0_EPS0_FL0_GRVW1_GSU1_ISA908_IU1_KLA_LBSPP128_LPA2_LPB2_LRVW2_MAC_NLCA1_NLCB1_ONLL1_PGR2_PLR5_SIA3_SU0_SUS256_SRVW0_SNLL0_TT9_16_TLDS1_USFGROn1_VSn1_VW1_WSGRA1_WSGRB1_WG16_16_1_WGM1
    SolutionIndex: 318
    SolutionNameMin: Cijk_Alik_Bljk_SB_MT32x32x32_MI16x16x4x1_SE_1LDSB1_AF0EM1_AMAS0_BL1_DTL0_EPS1_FL0_GRVW2_GSU1_ISA908_IU1_KLA_LBSPP128_LPA2_LPB2_LRVW2_MAC_NLCA1_NLCB1_ONLL1_PGR1_PLR9_SIA3_SU32_SUS256_SRVW2_SNLL0_TT1_16_TLDS1_USFGROn1_VSn1_VW1_WSGRA1_WSGRB1_WG32_8_1_WGM1
    SolutionIndex: 319
    SolutionNameMin: Cijk_Alik_Bljk_SB_MT16x16x32_MI16x16x4x1_SE_1LDSB0_AF0EM1_AMAS3_BL1_DTL0_EPS0_FL0_GRVW4_GSU3_ISA908_IU1_KLA_LBSPP128_LPA4_LPB4_LRVW2_MAC_NLCA1_NLCB1_ONLL1_PGR2_PLR9_SIA3_SU0_SUS256_SRVW0_SNLL0_TT1_16_TLDS1_USFGROn1_VSn1_VW2_WSGRA1_WSGRB1_WG16_4_1_WGM1
    SolutionIndex: 320
    SolutionNameMin: Cijk_Alik_Bljk_SB_MT128x128x24_MI32x32x2x1_SE_1LDSB0_AF0EM1_AMAS3_BL1_DTL0_EPS1_FL0_GRVW1_GSU1_ISA908_IU1_KLA_LBSPP0_LPA0_LPB0_LRVW1_MAC_NLCA3_NLCB3_ONLL1_PGR1_PLR1_SIA3_SU32_SUS256_SRVW0_SNLL0_TT2_64_TLDS1_USFGROn1_VSn1_VW2_WSGRA1_WSGRB1_WG64_4_1_WGM8
    SolutionIndex: 321
    SolutionNameMin: Cijk_Alik_Bljk_SB_MT128x96x32_MI32x32x2x1_SN_1LDSB1_AF0EM1_AMAS0_BL1_DTL0_EPS1_FL0_GRVW1_GSU1_ISA908_IU1_KLA_LBSPP128_LPA2_LPB2_LRVW2_MAC_NLCA1_NLCB1_ONLL1_PGR1_PLR17_SIA3_SU32_SUS256_SRVW2_SNLL0_TT1_96_TLDS1_USFGROn1_VSn1_VW1_WSGRA1_WSGRB1_WG128_2_1_WGM1
    SolutionIndex: 322
    SolutionNameMin: Cijk_Alik_Bljk_SB_MT32x32x32_MI16x16x4x1_SE_1LDSB0_AF0EM1_AMAS0_BL1_DTL0_EPS0_FL0_GRVW4_GSU15_ISA908_IU2_KLA_LBSPP128_LPA4_LPB4_LRVW2_MAC_NLCA1_NLCB1_ONLL1_PGR2_PLR5_SIA3_SU0_SUS256_SRVW0_SNLL0_TT1_16_TLDS1_USFGROn1_VSn1_VW1_WSGRA1_WSGRB1_WG32_8_1_WGM8
    SolutionIndex: 323
    SolutionNameMin: Cijk_Alik_Bljk_SB_MT64x32x16_MI16x16x4x1_SE_1LDSB0_AF0EM1_AMAS0_BL1_DTL0_EPS1_FL0_GRVW4_GSU1_ISA908_IU1_KLA_LBSPP128_LPA4_LPB4_LRVW2_MAC_NLCA1_NLCB1_ONLL1_PGR1_PLR5_SIA3_SU0_SUS256_SRVW2_SNLL0_TT2_16_TLDS1_USFGROn1_VSn1_VW1_WSGRA1_WSGRB1_WG32_8_1_WGM15
    SolutionIndex: 324
    SolutionNameMin: Cijk_Alik_Bljk_SB_MT64x64x32_MI32x32x2x1_SE_1LDSB0_AF0EM1_AMAS0_BL1_DTL0_EPS0_FL0_GRVW1_GSU1_ISA908_IU1_KLA_LBSPP128_LPA2_LPB2_LRVW2_MAC_NLCA1_NLCB1_ONLL1_PGR2_PLR17_SIA3_SU0_SUS256_SRVW2_SNLL0_TT1_32_TLDS1_USFGROn1_VSn1_VW1_WSGRA1_WSGRB1_WG64_4_1_WGM1
    SolutionIndex: 325
    SolutionNameMin: Cijk_Alik_Bljk_SB_MT64x64x16_MI32x32x2x1_SE_1LDSB1_AF0EM1_AMAS0_BL1_DTL0_EPS0_FL0_GRVW4_GSU1_ISA908_IU1_KLA_LBSPP128_LPA4_LPB4_LRVW2_MAC_NLCA1_NLCB1_ONLL1_PGR2_PLR9_SIA3_SU0_SUS256_SRVW2_SNLL0_TT1_32_TLDS1_USFGROn1_VSn1_VW1_WSGRA1_WSGRB1_WG64_4_1_WGM2
    SolutionIndex: 326
    SolutionNameMin: Cijk_Alik_Bljk_SB_MT32x32x32_MI16x16x4x1_SE_1LDSB0_AF0EM1_AMAS0_BL1_DTL0_EPS0_FL0_GRVW1_GSU2_ISA908_IU1_KLA_LBSPP128_LPA2_LPB2_LRVW2_MAC_NLCA1_NLCB1_ONLL1_PGR2_PLR9_SIA3_SU32_SUS256_SRVW0_SNLL0_TT1_16_TLDS1_USFGROn1_VSn1_VW1_WSGRA1_WSGRB1_WG32_8_1_WGM1
    SolutionIndex: 327
    SolutionNameMin: Cijk_Alik_Bljk_SB_MT64x8x32_SN_1LDSB0_AF0EM1_AMAS3_BL1_DTL0_EPS1_FL0_GRVW4_GSU32_ISA908_IU1_KLA_LBSPP0_LPA0_LPB0_LRVW4_MAC_NLCA1_NLCB1_ONLL1_PGR1_PLR1_SIA1_SU32_SUS256_SRVW0_SNLL0_TT4_4_TLDS0_USFGRO0_VS1_VW4_WSGRA0_WSGRB0_WG16_2_8_WGM1
    SolutionIndex: 328
    SolutionNameMin: Cijk_Alik_Bljk_SB_MT64x128x16_MI32x32x2x1_SE_1LDSB1_AF0EM1_AMAS0_BL1_DTL0_EPS0_FL0_GRVW4_GSU1_ISA908_IU1_KLA_LBSPP128_LPA4_LPB4_LRVW2_MAC_NLCA1_NLCB1_ONLL1_PGR2_PLR9_SIA3_SU32_SUS256_SRVW2_SNLL0_TT1_64_TLDS1_USFGROn1_VSn1_VW1_WSGRA1_WSGRB1_WG64_4_1_WGM1
    SolutionIndex: 329
    SolutionNameMin: Cijk_Alik_Bljk_SB_MT16x16x16_SN_1LDSB0_AF0EM1_AMAS3_BL1_DTL0_EPS1_FL0_GRVW2_GSU2_ISA908_IU1_KLA_LBSPP0_LPA0_LPB0_LRVW2_MAC_NLCA1_NLCB1_ONLL1_PGR1_PLR1_SIA1_SU32_SUS256_SRVW0_SNLL0_TT2_2_TLDS0_USFGRO1_VS1_VW2_WSGRA0_WSGRB0_WG8_8_4_WGM1
    SolutionIndex: 330
    SolutionNameMin: Cijk_Alik_Bljk_SB_MT128x64x32_MI32x32x2x1_SE_1LDSB0_AF0EM1_AMAS0_BL1_DTL0_EPS0_FL0_GRVW4_GSU1_ISA908_IU1_KLA_LBSPP128_LPA4_LPB4_LRVW2_MAC_NLCA1_NLCB1_ONLL1_PGR2_PLR17_SIA3_SU32_SUS256_SRVW2_SNLL0_TT2_32_TLDS1_USFGROn1_VSn1_VW1_WSGRA1_WSGRB1_WG64_4_1_WGM2
    SolutionIndex: 331
    SolutionNameMin: Cijk_Alik_Bljk_SB_MT16x64x32_MI16x16x4x1_SE_1LDSB0_AF0EM1_AMAS3_BL1_DTL0_EPS0_FL0_GRVW4_GSU5_ISA908_IU1_KLA_LBSPP128_LPA4_LPB4_LRVW2_MAC_NLCA1_NLCB1_ONLL1_PGR2_PLR9_SIA3_SU0_SUS256_SRVW0_SNLL0_TT1_16_TLDS1_USFGROn1_VSn1_VW2_WSGRA1_WSGRB1_WG16_16_1_WGM1
    SolutionIndex: 332
    SolutionNameMin: Cijk_Alik_Bljk_SB_MT8x32x16_SE_1LDSB0_AF0EM1_AMAS3_BL1_DTL0_EPS1_FL1_GRVW4_GSU1_ISA908_IU1_KLA_LBSPP0_LPA0_LPB0_LRVW2_MAC_NLCA1_NLCB1_ONLL1_PGR1_PLR1_SIA1_SU32_SUS256_SRVW0_SNLL0_TT2_2_TLDS0_USFGRO1_VS1_VW2_WSGRA0_WSGRB0_WG4_16_4_WGM1
    SolutionIndex: 333
    SolutionNameMin: Cijk_Alik_Bljk_SB_MT64x128x16_MI32x32x2x1_SE_1LDSB1_AF0EM1_AMAS0_BL1_DTL0_EPS0_FL0_GRVW1_GSU1_ISA908_IU1_KLA_LBSPP128_LPA2_LPB2_LRVW2_MAC_NLCA1_NLCB1_ONLL1_PGR2_PLR9_SIA3_SU0_SUS256_SRVW2_SNLL0_TT1_64_TLDS1_USFGROn1_VSn1_VW1_WSGRA1_WSGRB1_WG64_4_1_WGM15
    SolutionIndex: 334
    SolutionNameMin: Cijk_Alik_Bljk_SB_MT64x32x32_MI16x16x4x1_SE_1LDSB1_AF0EM1_AMAS0_BL1_DTL0_EPS0_FL0_GRVW4_GSU1_ISA908_IU1_KLA_LBSPP128_LPA4_LPB4_LRVW2_MAC_NLCA1_NLCB1_ONLL1_PGR2_PLR9_SIA3_SU0_SUS256_SRVW2_SNLL0_TT2_16_TLDS1_USFGROn1_VSn1_VW1_WSGRA1_WSGRB1_WG32_8_1_WGM15
    SolutionIndex: 335
    SolutionNameMin: Cijk_Alik_Bljk_SB_MT64x64x32_MI32x32x2x1_SE_1LDSB0_AF0EM1_AMAS0_BL1_DTL0_EPS0_FL0_GRVW1_GSU1_ISA908_IU1_KLA_LBSPP128_LPA2_LPB2_LRVW2_MAC_NLCA1_NLCB1_ONLL1_PGR2_PLR17_SIA3_SU0_SUS256_SRVW2_SNLL0_TT1_32_TLDS1_USFGROn1_VSn1_VW1_WSGRA1_WSGRB1_WG64_4_1_WGM15
    SolutionIndex: 336
    SolutionNameMin: Cijk_Alik_Bljk_SB_MT64x128x32_MI32x32x2x1_SE_1LDSB1_AF0EM1_AMAS0_BL1_DTL0_EPS0_FL0_GRVW1_GSU1_ISA908_IU1_KLA_LBSPP128_LPA2_LPB2_LRVW2_MAC_NLCA1_NLCB1_ONLL1_PGR2_PLR17_SIA3_SU32_SUS256_SRVW2_SNLL0_TT1_64_TLDS1_USFGROn1_VSn1_VW1_WSGRA1_WSGRB1_WG64_4_1_WGM2
    SolutionIndex: 337
    SolutionNameMin: Cijk_Alik_Bljk_SB_MT128x128x32_MI32x32x2x1_SE_1LDSB1_AF0EM1_AMAS0_BL1_DTL0_EPS1_FL0_GRVW1_GSU1_ISA908_IU1_KLA_LBSPP128_LPA2_LPB2_LRVW2_MAC_NLCA1_NLCB1_ONLL1_PGR1_PLR17_SIA3_SU0_SUS256_SRVW2_SNLL0_TT2_64_TLDS1_USFGROn1_VSn1_VW1_WSGRA1_WSGRB1_WG64_4_1_WGM1
    SolutionIndex: 338
    SolutionNameMin: Cijk_Alik_Bljk_SB_MT32x32x32_MI16x16x4x1_SE_1LDSB0_AF0EM1_AMAS0_BL1_DTL0_EPS0_FL0_GRVW2_GSU2_ISA908_IU1_KLA_LBSPP128_LPA2_LPB2_LRVW2_MAC_NLCA1_NLCB1_ONLL1_PGR2_PLR9_SIA3_SU0_SUS256_SRVW0_SNLL0_TT1_16_TLDS1_USFGROn1_VSn1_VW1_WSGRA1_WSGRB1_WG32_8_1_WGM1
    SolutionIndex: 339
    SolutionNameMin: Cijk_Alik_Bljk_SB_MT32x16x16_SN_1LDSB0_AF0EM1_AMAS3_BL1_DTL0_EPS1_FL0_GRVW2_GSU4_ISA908_IU1_KLA_LBSPP0_LPA0_LPB0_LRVW2_MAC_NLCA1_NLCB1_ONLL1_PGR1_PLR1_SIA1_SU32_SUS256_SRVW0_SNLL0_TT4_2_TLDS0_USFGRO0_VS1_VW2_WSGRA0_WSGRB0_WG8_8_4_WGM1
    SolutionIndex: 340
    SolutionNameMin: Cijk_Alik_Bljk_SB_MT128x160x16_MI32x32x2x1_SE_1LDSB1_AF0EM1_AMAS0_BL1_DTL0_EPS1_FL0_GRVW1_GSU1_ISA908_IU1_KLA_LBSPP128_LPA2_LPB2_LRVW2_MAC_NLCA1_NLCB1_ONLL1_PGR1_PLR9_SIA3_SU0_SUS256_SRVW2_SNLL0_TT1_160_TLDS1_USFGROn1_VSn1_VW1_WSGRA1_WSGRB1_WG128_2_1_WGM1
    SolutionIndex: 341
    SolutionNameMin: Cijk_Alik_Bljk_SB_MT16x16x16_MI16x16x4x1_SE_1LDSB0_AF0EM1_AMAS3_BL1_DTL0_EPS0_FL0_GRVW4_GSU1_ISA908_IU1_KLA_LBSPP128_LPA4_LPB4_LRVW2_MAC_NLCA1_NLCB1_ONLL1_PGR2_PLR5_SIA3_SU32_SUS256_SRVW0_SNLL0_TT1_16_TLDS1_USFGROn1_VSn1_VW2_WSGRA1_WSGRB1_WG16_4_1_WGM1
    SolutionIndex: 342
    SolutionNameMin: Cijk_Alik_Bljk_SB_MT16x32x16_SE_1LDSB0_AF0EM1_AMAS3_BL1_DTL0_EPS1_FL0_GRVW4_GSU1_ISA908_IU1_KLA_LBSPP0_LPA0_LPB0_LRVW2_MAC_NLCA1_NLCB1_ONLL1_PGR1_PLR1_SIA1_SU32_SUS256_SRVW0_SNLL0_TT4_2_TLDS0_USFGRO1_VS1_VW2_WSGRA0_WSGRB0_WG4_16_4_WGM1
    SolutionIndex: 343
    SolutionNameMin: Cijk_Alik_Bljk_SB_MT32x32x32_MI16x16x4x1_SE_1LDSB0_AF0EM1_AMAS0_BL1_DTL0_EPS0_FL0_GRVW4_GSU3_ISA908_IU1_KLA_LBSPP128_LPA4_LPB4_LRVW2_MAC_NLCA1_NLCB1_ONLL1_PGR2_PLR9_SIA3_SU32_SUS256_SRVW0_SNLL0_TT1_16_TLDS1_USFGROn1_VSn1_VW1_WSGRA1_WSGRB1_WG32_8_1_WGM2
    SolutionIndex: 344
    SolutionNameMin: Cijk_Alik_Bljk_SB_MT128x128x32_MI32x32x2x1_SE_1LDSB1_AF0EM1_AMAS0_BL1_DTL0_EPS1_FL0_GRVW1_GSU1_ISA908_IU1_KLA_LBSPP128_LPA2_LPB2_LRVW2_MAC_NLCA1_NLCB1_ONLL1_PGR1_PLR17_SIA3_SU0_SUS256_SRVW2_SNLL0_TT2_64_TLDS1_USFGROn1_VSn1_VW1_WSGRA1_WSGRB1_WG64_4_1_WGM2
    SolutionIndex: 345
    SolutionNameMin: Cijk_Alik_Bljk_SB_MT8x8x8_SN_1LDSB0_AF0EM1_AMAS3_BL1_DTL0_EPS1_FL0_GRVW2_GSU8_ISA908_IU1_KLA_LBSPP0_LPA0_LPB0_LRVW2_MAC_NLCA1_NLCB1_ONLL1_PGR1_PLR1_SIA1_SU32_SUS256_SRVW0_SNLL0_TT2_2_TLDS0_USFGRO1_VS1_VW2_WSGRA0_WSGRB0_WG4_4_4_WGM1
    SolutionIndex: 346
    SolutionNameMin: Cijk_Alik_Bljk_SB_MT96x128x32_MI32x32x2x1_SE_1LDSB1_AF0EM1_AMAS0_BL1_DTL0_EPS1_FL0_GRVW1_GSU1_ISA908_IU1_KLA_LBSPP128_LPA2_LPB2_LRVW2_MAC_NLCA1_NLCB1_ONLL1_PGR1_PLR17_SIA3_SU32_SUS128_SRVW0_SNLL0_TT3_32_TLDS1_USFGROn1_VSn1_VW1_WSGRA1_WSGRB1_WG32_8_1_WGM1
    SolutionIndex: 347
    SolutionNameMin: Cijk_Alik_Bljk_SB_MT32x32x32_MI16x16x4x1_SE_1LDSB0_AF0EM1_AMAS0_BL1_DTL0_EPS0_FL0_GRVW1_GSU5_ISA908_IU1_KLA_LBSPP128_LPA2_LPB2_LRVW2_MAC_NLCA1_NLCB1_ONLL1_PGR2_PLR9_SIA3_SU0_SUS256_SRVW0_SNLL0_TT1_16_TLDS1_USFGROn1_VSn1_VW1_WSGRA1_WSGRB1_WG32_8_1_WGM1
    SolutionIndex: 348
    SolutionNameMin: Cijk_Alik_Bljk_SB_MT32x32x16_MI16x16x4x1_SE_1LDSB0_AF0EM1_AMAS0_BL1_DTL0_EPS0_FL0_GRVW2_GSU1_ISA908_IU1_KLA_LBSPP128_LPA2_LPB2_LRVW2_MAC_NLCA1_NLCB1_ONLL1_PGR2_PLR5_SIA3_SU0_SUS256_SRVW2_SNLL0_TT1_16_TLDS1_USFGROn1_VSn1_VW1_WSGRA1_WSGRB1_WG32_8_1_WGM15
    SolutionIndex: 349
    SolutionNameMin: Cijk_Alik_Bljk_SB_MT64x32x32_MI16x16x4x1_SE_1LDSB1_AF0EM1_AMAS0_BL1_DTL0_EPS0_FL0_GRVW2_GSU1_ISA908_IU1_KLA_LBSPP128_LPA2_LPB2_LRVW2_MAC_NLCA1_NLCB1_ONLL1_PGR2_PLR9_SIA3_SU0_SUS256_SRVW2_SNLL0_TT2_16_TLDS1_USFGROn1_VSn1_VW1_WSGRA1_WSGRB1_WG32_8_1_WGM15
    SolutionIndex: 350
    SolutionNameMin: Cijk_Alik_Bljk_SB_MT128x128x32_MI32x32x2x1_SE_1LDSB1_AF0EM1_AMAS0_BL1_DTL0_EPS1_FL0_GRVW1_GSU3_ISA908_IU1_KLA_LBSPP128_LPA2_LPB2_LRVW2_MAC_NLCA1_NLCB1_ONLL1_PGR1_PLR17_SIA3_SU0_SUS256_SRVW0_SNLL0_TT2_64_TLDS1_USFGROn1_VSn1_VW1_WSGRA1_WSGRB1_WG64_4_1_WGM1
    SolutionIndex: 351
    SolutionNameMin: Cijk_Alik_Bljk_SB_MT144x64x32_MI16x16x4x1_SN_1LDSB0_AF0EM1_AMAS0_BL1_DTL0_EPS1_FL0_GRVW1_GSU1_ISA908_IU1_KLA_LBSPP128_LPA2_LPB2_LRVW2_MAC_NLCA1_NLCB1_ONLL1_PGR1_PLR9_SIA3_SU32_SUS256_SRVW0_SNLL0_TT9_16_TLDS1_USFGROn1_VSn1_VW1_WSGRA1_WSGRB1_WG16_16_1_WGM1
    SolutionIndex: 352
    SolutionNameMin: Cijk_Alik_Bljk_SB_MT144x64x32_MI16x16x4x1_SE_1LDSB0_AF0EM1_AMAS0_BL1_DTL0_EPS0_FL0_GRVW1_GSU1_ISA908_IU1_KLA_LBSPP128_LPA2_LPB2_LRVW2_MAC_NLCA1_NLCB1_ONLL1_PGR2_PLR9_SIA3_SU32_SUS256_SRVW0_SNLL0_TT9_16_TLDS1_USFGROn1_VSn1_VW1_WSGRA1_WSGRB1_WG16_16_1_WGM15
    SolutionIndex: 353
    SolutionNameMin: Cijk_Alik_Bljk_SB_MT32x64x16_SE_1LDSB0_AF0EM1_AMAS3_BL1_DTL0_EPS0_FL0_GRVW4_GSU1_ISA908_IU1_KLA_LBSPP0_LPA4_LPB4_LRVW4_MAC_NLCA1_NLCB1_ONLL1_PGR0_PLR1_SIA1_SU32_SUS256_SRVW0_SNLL0_TT4_4_TLDS0_USFGRO1_VS1_VW4_WSGRA0_WSGRB0_WG8_16_1_WGM1
    SolutionIndex: 354
    SolutionNameMin: Cijk_Alik_Bljk_SB_MT64x64x32_MI32x32x2x1_SE_1LDSB1_AF0EM1_AMAS0_BL1_DTL0_EPS0_FL0_GRVW4_GSU3_ISA908_IU1_KLA_LBSPP128_LPA4_LPB4_LRVW2_MAC_NLCA1_NLCB1_ONLL1_PGR2_PLR17_SIA3_SU0_SUS256_SRVW0_SNLL0_TT1_32_TLDS1_USFGROn1_VSn1_VW1_WSGRA1_WSGRB1_WG64_4_1_WGM2
    SolutionIndex: 355
    SolutionNameMin: Cijk_Alik_Bljk_SB_MT64x32x16_MI16x16x4x1_SE_1LDSB0_AF0EM1_AMAS0_BL1_DTL0_EPS0_FL0_GRVW2_GSU1_ISA908_IU1_KLA_LBSPP128_LPA2_LPB2_LRVW2_MAC_NLCA1_NLCB1_ONLL1_PGR2_PLR5_SIA3_SU32_SUS128_SRVW2_SNLL0_TT2_16_TLDS1_USFGROn1_VSn1_VW1_WSGRA1_WSGRB1_WG32_8_1_WGM15
    SolutionIndex: 356
    SolutionNameMin: Cijk_Alik_Bljk_SB_MT144x64x32_MI16x16x4x1_SE_1LDSB0_AF0EM1_AMAS0_BL1_DTL0_EPS0_FL0_GRVW1_GSU1_ISA908_IU1_KLA_LBSPP128_LPA2_LPB2_LRVW2_MAC_NLCA1_NLCB1_ONLL1_PGR2_PLR9_SIA3_SU32_SUS256_SRVW0_SNLL0_TT9_16_TLDS1_USFGROn1_VSn1_VW1_WSGRA1_WSGRB1_WG16_16_1_WGM1
    SolutionIndex: 357
    SolutionNameMin: Cijk_Alik_Bljk_SB_MT144x64x32_MI16x16x4x1_SE_1LDSB0_AF0EM1_AMAS0_BL1_DTL0_EPS0_FL0_GRVW1_GSU1_ISA908_IU1_KLA_LBSPP128_LPA2_LPB2_LRVW2_MAC_NLCA1_NLCB1_ONLL1_PGR2_PLR9_SIA3_SU32_SUS128_SRVW0_SNLL0_TT9_16_TLDS1_USFGROn1_VSn1_VW1_WSGRA1_WSGRB1_WG16_16_1_WGM15
    SolutionIndex: 358
    SolutionNameMin: Cijk_Alik_Bljk_SB_MT96x128x32_MI32x32x2x1_SE_1LDSB1_AF0EM1_AMAS0_BL1_DTL0_EPS1_FL0_GRVW1_GSU1_ISA908_IU1_KLA_LBSPP128_LPA2_LPB2_LRVW2_MAC_NLCA1_NLCB1_ONLL1_PGR1_PLR17_SIA3_SU32_SUS128_SRVW0_SNLL0_TT3_32_TLDS1_USFGROn1_VSn1_VW1_WSGRA1_WSGRB1_WG32_8_1_WGM15
    SolutionIndex: 359
    SolutionNameMin: Cijk_Alik_Bljk_SB_MT64x64x32_MI32x32x2x1_SE_1LDSB1_AF0EM1_AMAS0_BL1_DTL0_EPS0_FL0_GRVW4_GSU3_ISA908_IU1_KLA_LBSPP128_LPA4_LPB4_LRVW2_MAC_NLCA1_NLCB1_ONLL1_PGR2_PLR17_SIA3_SU0_SUS256_SRVW0_SNLL0_TT1_32_TLDS1_USFGROn1_VSn1_VW1_WSGRA1_WSGRB1_WG64_4_1_WGM1
    SolutionIndex: 360
    SolutionNameMin: Cijk_Alik_Bljk_SB_MT8x8x8_SN_1LDSB0_AF0EM1_AMAS3_BL1_DTL0_EPS1_FL0_GRVW2_GSU16_ISA908_IU1_KLA_LBSPP0_LPA0_LPB0_LRVW2_MAC_NLCA1_NLCB1_ONLL1_PGR1_PLR1_SIA1_SU32_SUS256_SRVW0_SNLL0_TT2_2_TLDS0_USFGRO1_VS1_VW2_WSGRA0_WSGRB0_WG4_4_4_WGM1
    SolutionIndex: 361
    SolutionNameMin: Cijk_Alik_Bljk_SB_MT16x16x16_SN_1LDSB0_AF0EM1_AMAS3_BL1_DTL0_EPS1_FL0_GRVW2_GSU4_ISA908_IU1_KLA_LBSPP0_LPA0_LPB0_LRVW2_MAC_NLCA1_NLCB1_ONLL1_PGR1_PLR1_SIA1_SU32_SUS256_SRVW0_SNLL0_TT2_2_TLDS0_USFGRO1_VS1_VW2_WSGRA0_WSGRB0_WG8_8_4_WGM8
    SolutionIndex: 362
    SolutionNameMin: Cijk_Alik_Bljk_SB_MT144x64x32_MI16x16x4x1_SE_1LDSB0_AF0EM1_AMAS0_BL1_DTL0_EPS0_FL0_GRVW1_GSU1_ISA908_IU1_KLA_LBSPP128_LPA2_LPB2_LRVW2_MAC_NLCA1_NLCB1_ONLL1_PGR2_PLR9_SIA3_SU32_SUS128_SRVW0_SNLL0_TT9_16_TLDS1_USFGROn1_VSn1_VW1_WSGRA1_WSGRB1_WG16_16_1_WGM2
    SolutionIndex: 363
    SolutionNameMin: Cijk_Alik_Bljk_SB_MT64x64x32_MI32x32x2x1_SE_1LDSB1_AF0EM1_AMAS0_BL1_DTL0_EPS1_FL0_GRVW1_GSU1_ISA908_IU1_KLA_LBSPP128_LPA2_LPB2_LRVW2_MAC_NLCA1_NLCB1_ONLL1_PGR1_PLR17_SIA3_SU0_SUS256_SRVW2_SNLL0_TT1_32_TLDS1_USFGROn1_VSn1_VW1_WSGRA1_WSGRB1_WG64_4_1_WGM2
    SolutionIndex: 364
    SolutionNameMin: Cijk_Alik_Bljk_SB_MT64x64x32_MI32x32x2x1_SE_1LDSB0_AF0EM1_AMAS0_BL1_DTL0_EPS0_FL0_GRVW2_GSU2_ISA908_IU1_KLA_LBSPP128_LPA2_LPB2_LRVW2_MAC_NLCA1_NLCB1_ONLL1_PGR2_PLR17_SIA3_SU0_SUS256_SRVW0_SNLL0_TT1_32_TLDS1_USFGROn1_VSn1_VW1_WSGRA1_WSGRB1_WG64_4_1_WGM1
    SolutionIndex: 365
    SolutionNameMin: Cijk_Alik_Bljk_SB_MT64x32x32_MI16x16x4x1_SE_1LDSB0_AF0EM1_AMAS0_BL1_DTL0_EPS1_FL0_GRVW1_GSU1_ISA908_IU1_KLA_LBSPP128_LPA2_LPB2_LRVW2_MAC_NLCA1_NLCB1_ONLL1_PGR1_PLR9_SIA3_SU32_SUS256_SRVW2_SNLL0_TT2_16_TLDS1_USFGROn1_VSn1_VW1_WSGRA1_WSGRB1_WG32_8_1_WGM2
    SolutionIndex: 366
    SolutionNameMin: Cijk_Alik_Bljk_SB_MT16x16x32_MI16x16x4x1_SE_1LDSB0_AF0EM1_AMAS3_BL1_DTL0_EPS0_FL0_GRVW4_GSU5_ISA908_IU1_KLA_LBSPP128_LPA4_LPB4_LRVW2_MAC_NLCA1_NLCB1_ONLL1_PGR2_PLR9_SIA3_SU32_SUS256_SRVW0_SNLL0_TT1_16_TLDS1_USFGROn1_VSn1_VW2_WSGRA1_WSGRB1_WG16_4_1_WGM1
    SolutionIndex: 367
    SolutionNameMin: Cijk_Alik_Bljk_SB_MT64x64x32_MI32x32x2x1_SE_1LDSB0_AF0EM1_AMAS0_BL1_DTL0_EPS0_FL0_GRVW4_GSU3_ISA908_IU1_KLA_LBSPP128_LPA4_LPB4_LRVW2_MAC_NLCA1_NLCB1_ONLL1_PGR2_PLR17_SIA3_SU0_SUS256_SRVW0_SNLL0_TT1_32_TLDS1_USFGROn1_VSn1_VW1_WSGRA1_WSGRB1_WG64_4_1_WGM15
    SolutionIndex: 368
    SolutionNameMin: Cijk_Alik_Bljk_SB_MT64x32x16_MI16x16x4x1_SE_1LDSB0_AF0EM1_AMAS0_BL1_DTL0_EPS0_FL0_GRVW2_GSU1_ISA908_IU1_KLA_LBSPP128_LPA2_LPB2_LRVW2_MAC_NLCA1_NLCB1_ONLL1_PGR2_PLR5_SIA3_SU0_SUS256_SRVW2_SNLL0_TT2_16_TLDS1_USFGROn1_VSn1_VW1_WSGRA1_WSGRB1_WG32_8_1_WGM15
    SolutionIndex: 369
    SolutionNameMin: Cijk_Alik_Bljk_SB_MT128x96x32_MI32x32x2x1_SE_1LDSB1_AF0EM1_AMAS0_BL1_DTL0_EPS0_FL0_GRVW1_GSU1_ISA908_IU1_KLA_LBSPP128_LPA2_LPB2_LRVW2_MAC_NLCA1_NLCB1_ONLL1_PGR2_PLR17_SIA3_SU0_SUS256_SRVW2_SNLL0_TT1_96_TLDS1_USFGROn1_VSn1_VW1_WSGRA1_WSGRB1_WG128_2_1_WGM1
    SolutionIndex: 370
    SolutionNameMin: Cijk_Alik_Bljk_SB_MT32x32x32_MI16x16x4x1_SE_1LDSB0_AF0EM1_AMAS0_BL1_DTL0_EPS0_FL0_GRVW2_GSU1_ISA908_IU1_KLA_LBSPP128_LPA2_LPB2_LRVW2_MAC_NLCA1_NLCB1_ONLL1_PGR2_PLR9_SIA3_SU32_SUS256_SRVW2_SNLL0_TT1_16_TLDS1_USFGROn1_VSn1_VW1_WSGRA1_WSGRB1_WG32_8_1_WGM2
    SolutionIndex: 371
    SolutionNameMin: Cijk_Alik_Bljk_SB_MT32x64x32_MI16x16x4x1_SE_1LDSB1_AF0EM1_AMAS0_BL1_DTL0_EPS1_FL0_GRVW1_GSU1_ISA908_IU1_KLA_LBSPP128_LPA2_LPB2_LRVW2_MAC_NLCA1_NLCB1_ONLL1_PGR1_PLR9_SIA3_SU32_SUS256_SRVW2_SNLL0_TT1_32_TLDS1_USFGROn1_VSn1_VW1_WSGRA1_WSGRB1_WG32_8_1_WGM15
    SolutionIndex: 372
    SolutionNameMin: Cijk_Alik_Bljk_SB_MT32x32x32_MI16x16x4x1_SE_1LDSB0_AF0EM1_AMAS0_BL1_DTL0_EPS0_FL0_GRVW1_GSU1_ISA908_IU1_KLA_LBSPP128_LPA2_LPB2_LRVW2_MAC_NLCA1_NLCB1_ONLL1_PGR2_PLR9_SIA3_SU32_SUS256_SRVW2_SNLL0_TT1_16_TLDS1_USFGROn1_VSn1_VW1_WSGRA1_WSGRB1_WG32_8_1_WGM2
    SolutionIndex: 373
    SolutionNameMin: Cijk_Alik_Bljk_SB_MT64x64x32_MI32x32x2x1_SE_1LDSB0_AF0EM1_AMAS0_BL1_DTL0_EPS0_FL0_GRVW4_GSU3_ISA908_IU1_KLA_LBSPP128_LPA4_LPB4_LRVW2_MAC_NLCA1_NLCB1_ONLL1_PGR2_PLR17_SIA3_SU32_SUS256_SRVW0_SNLL0_TT1_32_TLDS1_USFGROn1_VSn1_VW1_WSGRA1_WSGRB1_WG64_4_1_WGM2
    SolutionIndex: 374
    SolutionNameMin: Cijk_Alik_Bljk_SB_MT128x160x16_MI32x32x2x1_SE_1LDSB1_AF0EM1_AMAS0_BL1_DTL0_EPS1_FL0_GRVW1_GSU2_ISA908_IU1_KLA_LBSPP128_LPA2_LPB2_LRVW2_MAC_NLCA1_NLCB1_ONLL1_PGR1_PLR9_SIA3_SU32_SUS256_SRVW0_SNLL0_TT1_160_TLDS1_USFGROn1_VSn1_VW1_WSGRA1_WSGRB1_WG128_2_1_WGM1
    SolutionIndex: 375
    SolutionNameMin: Cijk_Alik_Bljk_SB_MT64x32x16_MI16x16x4x1_SE_1LDSB0_AF0EM1_AMAS0_BL1_DTL0_EPS0_FL0_GRVW4_GSU1_ISA908_IU1_KLA_LBSPP128_LPA4_LPB4_LRVW2_MAC_NLCA1_NLCB1_ONLL1_PGR2_PLR5_SIA3_SU0_SUS256_SRVW2_SNLL0_TT2_16_TLDS1_USFGROn1_VSn1_VW1_WSGRA1_WSGRB1_WG32_8_1_WGM2
    SolutionIndex: 376
    SolutionNameMin: Cijk_Alik_Bljk_SB_MT64x32x16_MI16x16x4x1_SE_1LDSB1_AF0EM1_AMAS0_BL1_DTL0_EPS0_FL0_GRVW4_GSU1_ISA908_IU1_KLA_LBSPP128_LPA4_LPB4_LRVW2_MAC_NLCA1_NLCB1_ONLL1_PGR2_PLR5_SIA3_SU32_SUS128_SRVW2_SNLL0_TT2_16_TLDS1_USFGROn1_VSn1_VW1_WSGRA1_WSGRB1_WG32_8_1_WGM1
    SolutionIndex: 377
    SolutionNameMin: Cijk_Alik_Bljk_SB_MT128x64x32_MI32x32x2x1_SE_1LDSB1_AF0EM1_AMAS0_BL1_DTL0_EPS1_FL0_GRVW4_GSU1_ISA908_IU1_KLA_LBSPP128_LPA4_LPB4_LRVW2_MAC_NLCA1_NLCB1_ONLL1_PGR1_PLR17_SIA3_SU0_SUS256_SRVW2_SNLL0_TT2_32_TLDS1_USFGROn1_VSn1_VW1_WSGRA1_WSGRB1_WG64_4_1_WGM15
    SolutionIndex: 378
    SolutionNameMin: Cijk_Alik_Bljk_SB_MT128x64x32_MI32x32x2x1_SE_1LDSB1_AF0EM1_AMAS0_BL1_DTL0_EPS0_FL0_GRVW4_GSU1_ISA908_IU1_KLA_LBSPP128_LPA4_LPB4_LRVW2_MAC_NLCA1_NLCB1_ONLL1_PGR2_PLR17_SIA3_SU32_SUS128_SRVW2_SNLL0_TT2_32_TLDS1_USFGROn1_VSn1_VW1_WSGRA1_WSGRB1_WG64_4_1_WGM1
    SolutionIndex: 379
    SolutionNameMin: Cijk_Alik_Bljk_SB_MT64x64x32_MI32x32x2x1_SE_1LDSB0_AF0EM1_AMAS0_BL1_DTL0_EPS0_FL0_GRVW4_GSU3_ISA908_IU1_KLA_LBSPP128_LPA4_LPB4_LRVW2_MAC_NLCA1_NLCB1_ONLL1_PGR2_PLR17_SIA3_SU0_SUS256_SRVW0_SNLL0_TT1_32_TLDS1_USFGROn1_VSn1_VW1_WSGRA1_WSGRB1_WG64_4_1_WGM2
    SolutionIndex: 380
    SolutionNameMin: Cijk_Alik_Bljk_SB_MT128x64x32_MI32x32x2x1_SE_1LDSB1_AF0EM1_AMAS0_BL1_DTL0_EPS1_FL0_GRVW4_GSU1_ISA908_IU1_KLA_LBSPP128_LPA4_LPB4_LRVW2_MAC_NLCA1_NLCB1_ONLL1_PGR1_PLR17_SIA3_SU0_SUS256_SRVW2_SNLL0_TT2_32_TLDS1_USFGROn1_VSn1_VW1_WSGRA1_WSGRB1_WG64_4_1_WGM2
    SolutionIndex: 381
    SolutionNameMin: Cijk_Alik_Bljk_SB_MT128x96x16_MI32x32x2x1_SE_1LDSB1_AF0EM1_AMAS0_BL1_DTL0_EPS1_FL0_GRVW1_GSU1_ISA908_IU1_KLA_LBSPP128_LPA2_LPB2_LRVW2_MAC_NLCA1_NLCB1_ONLL1_PGR1_PLR9_SIA3_SU0_SUS256_SRVW2_SNLL0_TT1_96_TLDS1_USFGROn1_VSn1_VW1_WSGRA1_WSGRB1_WG128_2_1_WGM2
    SolutionIndex: 382
    SolutionNameMin: Cijk_Alik_Bljk_SB_MT128x128x32_MI32x32x2x1_SE_1LDSB1_AF0EM1_AMAS0_BL1_DTL0_EPS1_FL0_GRVW4_GSU3_ISA908_IU1_KLA_LBSPP128_LPA4_LPB4_LRVW2_MAC_NLCA1_NLCB1_ONLL1_PGR1_PLR17_SIA3_SU0_SUS256_SRVW0_SNLL0_TT2_64_TLDS1_USFGROn1_VSn1_VW1_WSGRA1_WSGRB1_WG64_4_1_WGM2
    SolutionIndex: 383
    SolutionNameMin: Cijk_Alik_Bljk_SB_MT64x64x32_MI32x32x2x1_SE_1LDSB0_AF0EM1_AMAS0_BL1_DTL0_EPS0_FL0_GRVW1_GSU1_ISA908_IU1_KLA_LBSPP128_LPA2_LPB2_LRVW2_MAC_NLCA1_NLCB1_ONLL1_PGR2_PLR17_SIA3_SU32_SUS256_SRVW2_SNLL0_TT1_32_TLDS1_USFGROn1_VSn1_VW1_WSGRA1_WSGRB1_WG64_4_1_WGM15
    SolutionIndex: 384
    SolutionNameMin: Cijk_Alik_Bljk_SB_MT64x64x32_MI32x32x2x1_SE_1LDSB0_AF0EM1_AMAS0_BL1_DTL0_EPS0_FL0_GRVW1_GSU3_ISA908_IU1_KLA_LBSPP128_LPA2_LPB2_LRVW2_MAC_NLCA1_NLCB1_ONLL1_PGR2_PLR17_SIA3_SU0_SUS256_SRVW0_SNLL0_TT1_32_TLDS1_USFGROn1_VSn1_VW1_WSGRA1_WSGRB1_WG64_4_1_WGM1
    SolutionIndex: 385
    SolutionNameMin: Cijk_Alik_Bljk_SB_MT64x64x16_SE_1LDSB0_AF0EM1_AMAS3_BL1_DTL0_EPS0_FL1_GRVW2_GSU1_ISA908_IU1_KLA_LBSPP0_LPA4_LPB4_LRVW4_MAC_NLCA1_NLCB1_ONLL1_PGR0_PLR1_SIA1_SU32_SUS256_SRVW0_SNLL0_TT4_4_TLDS0_USFGRO1_VS1_VW4_WSGRA0_WSGRB0_WG16_16_1_WGM1
    SolutionIndex: 386
    SolutionNameMin: Cijk_Alik_Bljk_SB_MT128x96x32_MI32x32x2x1_SE_1LDSB0_AF0EM1_AMAS0_BL1_DTL0_EPS0_FL0_GRVW4_GSU1_ISA908_IU1_KLA_LBSPP128_LPA4_LPB4_LRVW2_MAC_NLCA1_NLCB1_ONLL1_PGR2_PLR17_SIA3_SU0_SUS256_SRVW2_SNLL0_TT1_96_TLDS1_USFGROn1_VSn1_VW1_WSGRA1_WSGRB1_WG128_2_1_WGM1
    SolutionIndex: 387
    SolutionNameMin: Cijk_Alik_Bljk_SB_MT32x32x32_MI16x16x4x1_SE_1LDSB0_AF0EM1_AMAS0_BL1_DTL0_EPS0_FL0_GRVW4_GSU1_ISA908_IU1_KLA_LBSPP128_LPA4_LPB4_LRVW2_MAC_NLCA1_NLCB1_ONLL1_PGR2_PLR9_SIA3_SU0_SUS256_SRVW2_SNLL0_TT1_16_TLDS1_USFGROn1_VSn1_VW1_WSGRA1_WSGRB1_WG32_8_1_WGM2
    SolutionIndex: 388
    SolutionNameMin: Cijk_Alik_Bljk_SB_MT144x64x32_MI16x16x4x1_SE_1LDSB0_AF0EM1_AMAS0_BL1_DTL0_EPS0_FL0_GRVW2_GSU1_ISA908_IU1_KLA_LBSPP128_LPA2_LPB2_LRVW2_MAC_NLCA1_NLCB1_ONLL1_PGR2_PLR9_SIA3_SU32_SUS256_SRVW0_SNLL0_TT9_16_TLDS1_USFGROn1_VSn1_VW1_WSGRA1_WSGRB1_WG16_16_1_WGM15
    SolutionIndex: 389
    SolutionNameMin: Cijk_Alik_Bljk_SB_MT64x32x32_MI16x16x4x1_SE_1LDSB0_AF0EM1_AMAS0_BL1_DTL0_EPS1_FL0_GRVW1_GSU1_ISA908_IU1_KLA_LBSPP128_LPA2_LPB2_LRVW2_MAC_NLCA1_NLCB1_ONLL1_PGR1_PLR9_SIA3_SU0_SUS256_SRVW2_SNLL0_TT2_16_TLDS1_USFGROn1_VSn1_VW1_WSGRA1_WSGRB1_WG32_8_1_WGM1
    SolutionIndex: 390
    SolutionNameMin: Cijk_Alik_Bljk_SB_MT64x128x16_MI32x32x2x1_SE_1LDSB1_AF0EM1_AMAS0_BL1_DTL0_EPS0_FL0_GRVW4_GSU1_ISA908_IU1_KLA_LBSPP128_LPA4_LPB4_LRVW2_MAC_NLCA1_NLCB1_ONLL1_PGR2_PLR9_SIA3_SU32_SUS256_SRVW2_SNLL0_TT1_64_TLDS1_USFGROn1_VSn1_VW1_WSGRA1_WSGRB1_WG64_4_1_WGM2
    SolutionIndex: 391
    SolutionNameMin: Cijk_Alik_Bljk_SB_MT32x64x32_MI16x16x4x1_SE_1LDSB1_AF0EM1_AMAS0_BL1_DTL0_EPS0_FL0_GRVW4_GSU1_ISA908_IU1_KLA_LBSPP128_LPA4_LPB4_LRVW2_MAC_NLCA1_NLCB1_ONLL1_PGR2_PLR9_SIA3_SU0_SUS256_SRVW2_SNLL0_TT1_32_TLDS1_USFGROn1_VSn1_VW1_WSGRA1_WSGRB1_WG32_8_1_WGM2
    SolutionIndex: 392
    SolutionNameMin: Cijk_Alik_Bljk_SB_MT96x96x32_MI16x16x4x1_SE_1LDSB0_AF0EM1_AMAS0_BL1_DTL0_EPS1_FL0_GRVW4_GSU1_ISA908_IU1_KLA_LBSPP128_LPA4_LPB4_LRVW4_MAC_NLCA1_NLCB1_ONLL1_PGR1_PLR9_SIA3_SU0_SUS256_SRVW0_SNLL0_TT3_48_TLDS1_USFGROn1_VSn1_VW1_WSGRA1_WSGRB1_WG32_8_1_WGM1
    SolutionIndex: 393
    SolutionNameMin: Cijk_Alik_Bljk_SB_MT128x96x32_MI32x32x2x1_SE_1LDSB1_AF0EM1_AMAS0_BL1_DTL0_EPS0_FL0_GRVW1_GSU1_ISA908_IU1_KLA_LBSPP128_LPA2_LPB2_LRVW2_MAC_NLCA1_NLCB1_ONLL1_PGR2_PLR17_SIA3_SU32_SUS256_SRVW2_SNLL0_TT1_96_TLDS1_USFGROn1_VSn1_VW1_WSGRA1_WSGRB1_WG128_2_1_WGM2
    SolutionIndex: 394
    SolutionNameMin: Cijk_Alik_Bljk_SB_MT64x144x16_MI16x16x4x1_SE_1LDSB1_AF0EM1_AMAS0_BL1_DTL0_EPS0_FL0_GRVW1_GSU1_ISA908_IU1_KLA_LBSPP128_LPA2_LPB2_LRVW2_MAC_NLCA1_NLCB1_ONLL1_PGR2_PLR5_SIA3_SU0_SUS256_SRVW2_SNLL0_TT1_144_TLDS1_USFGROn1_VSn1_VW1_WSGRA1_WSGRB1_WG64_4_1_WGM15
    SolutionIndex: 395
    SolutionNameMin: Cijk_Alik_Bljk_SB_MT64x64x16_SE_1LDSB0_AF0EM1_AMAS0_BL1_DTL0_EPS0_FL1_GRVW4_GSU1_ISA908_IU1_KLA_LBSPP0_LPA1_LPB1_LRVW1_MAC_NLCA1_NLCB1_ONLL1_PGR0_PLR1_SIA1_SU32_SUS256_SRVW0_SNLL0_TT4_4_TLDS0_USFGRO1_VS1_VW1_WSGRA0_WSGRB0_WG16_16_1_WGM8
    SolutionIndex: 396
    SolutionNameMin: Cijk_Alik_Bljk_SB_MT64x144x16_MI16x16x4x1_SE_1LDSB0_AF0EM1_AMAS0_BL1_DTL0_EPS0_FL0_GRVW1_GSU1_ISA908_IU1_KLA_LBSPP128_LPA2_LPB2_LRVW2_MAC_NLCA1_NLCB1_ONLL1_PGR2_PLR5_SIA3_SU0_SUS256_SRVW2_SNLL0_TT1_144_TLDS1_USFGROn1_VSn1_VW1_WSGRA1_WSGRB1_WG64_4_1_WGM15
    SolutionIndex: 397
    SolutionNameMin: Cijk_Alik_Bljk_SB_MT128x96x16_MI32x32x2x1_SE_1LDSB1_AF0EM1_AMAS0_BL1_DTL0_EPS0_FL0_GRVW2_GSU1_ISA908_IU1_KLA_LBSPP128_LPA2_LPB2_LRVW2_MAC_NLCA1_NLCB1_ONLL1_PGR2_PLR9_SIA3_SU0_SUS256_SRVW2_SNLL0_TT1_96_TLDS1_USFGROn1_VSn1_VW1_WSGRA1_WSGRB1_WG128_2_1_WGM15
    SolutionIndex: 398
    SolutionNameMin: Cijk_Alik_Bljk_SB_MT64x64x16_MI32x32x2x1_SE_1LDSB0_AF0EM1_AMAS3_BL1_DTL0_EPS1_FL0_GRVW4_GSU1_ISA908_IU1_KLA_LBSPP0_LPA0_LPB0_LRVW1_MAC_NLCA1_NLCB1_ONLL1_PGR1_PLR1_SIA3_SU32_SUS256_SRVW0_SNLL0_TT1_32_TLDS0_USFGROn1_VSn1_VW2_WSGRA1_WSGRB1_WG64_4_1_WGM8
    SolutionIndex: 399
    SolutionNameMin: Cijk_Alik_Bljk_SB_MT32x32x32_SE_1LDSB0_AF0EM1_AMAS3_BL1_DTL0_EPS0_FL1_GRVW2_GSU1_ISA908_IU1_KLA_LBSPP0_LPA2_LPB2_LRVW2_MAC_NLCA1_NLCB1_ONLL1_PGR0_PLR1_SIA1_SU32_SUS256_SRVW0_SNLL0_TT2_4_TLDS0_USFGRO1_VS1_VW2_WSGRA0_WSGRB0_WG16_8_1_WGM1
    SolutionIndex: 400
    SolutionNameMin: Cijk_Alik_Bljk_SB_MT64x64x32_MI32x32x2x1_SE_1LDSB0_AF0EM1_AMAS0_BL1_DTL0_EPS0_FL0_GRVW1_GSU1_ISA908_IU1_KLA_LBSPP128_LPA2_LPB2_LRVW2_MAC_NLCA1_NLCB1_ONLL1_PGR2_PLR17_SIA3_SU32_SUS128_SRVW2_SNLL0_TT1_32_TLDS1_USFGROn1_VSn1_VW1_WSGRA1_WSGRB1_WG64_4_1_WGM15
    SolutionIndex: 401
    SolutionNameMin: Cijk_Alik_Bljk_SB_MT128x96x16_MI32x32x2x1_SE_1LDSB1_AF0EM1_AMAS0_BL1_DTL0_EPS0_FL0_GRVW1_GSU1_ISA908_IU1_KLA_LBSPP128_LPA2_LPB2_LRVW2_MAC_NLCA1_NLCB1_ONLL1_PGR2_PLR9_SIA3_SU32_SUS256_SRVW2_SNLL0_TT1_96_TLDS1_USFGROn1_VSn1_VW1_WSGRA1_WSGRB1_WG128_2_1_WGM2
    SolutionIndex: 402
    SolutionNameMin: Cijk_Alik_Bljk_SB_MT96x96x32_MI16x16x4x1_SE_1LDSB1_AF0EM1_AMAS0_BL1_DTL0_EPS1_FL0_GRVW1_GSU1_ISA908_IU1_KLA_LBSPP128_LPA2_LPB2_LRVW2_MAC_NLCA1_NLCB1_ONLL1_PGR1_PLR9_SIA3_SU32_SUS256_SRVW0_SNLL0_TT3_48_TLDS1_USFGROn1_VSn1_VW1_WSGRA1_WSGRB1_WG32_8_1_WGM15
    SolutionIndex: 403
    SolutionNameMin: Cijk_Alik_Bljk_SB_MT32x32x16_SE_1LDSB0_AF0EM1_AMAS3_BL1_DTL0_EPS0_FL1_GRVW4_GSU1_ISA908_IU1_KLA_LBSPP0_LPA2_LPB2_LRVW2_MAC_NLCA1_NLCB1_ONLL1_PGR0_PLR1_SIA1_SU32_SUS256_SRVW0_SNLL0_TT2_4_TLDS0_USFGRO1_VS1_VW2_WSGRA0_WSGRB0_WG16_8_1_WGM1
    SolutionIndex: 404
    SolutionNameMin: Cijk_Alik_Bljk_SB_MT128x96x16_MI32x32x2x1_SE_1LDSB0_AF0EM1_AMAS0_BL1_DTL0_EPS0_FL0_GRVW1_GSU1_ISA908_IU1_KLA_LBSPP128_LPA2_LPB2_LRVW2_MAC_NLCA1_NLCB1_ONLL1_PGR2_PLR9_SIA3_SU0_SUS256_SRVW2_SNLL0_TT1_96_TLDS1_USFGROn1_VSn1_VW1_WSGRA1_WSGRB1_WG128_2_1_WGM15
    SolutionIndex: 405
    SolutionNameMin: Cijk_Alik_Bljk_SB_MT128x128x32_MI32x32x2x1_SE_1LDSB1_AF0EM1_AMAS0_BL1_DTL0_EPS1_FL0_GRVW1_GSU1_ISA908_IU1_KLA_LBSPP128_LPA2_LPB2_LRVW2_MAC_NLCA1_NLCB1_ONLL1_PGR1_PLR17_SIA3_SU32_SUS256_SRVW2_SNLL0_TT2_64_TLDS1_USFGROn1_VSn1_VW1_WSGRA1_WSGRB1_WG64_4_1_WGM1
    SolutionIndex: 406
    SolutionNameMin: Cijk_Alik_Bljk_SB_MT64x64x32_MI32x32x2x1_SE_1LDSB1_AF0EM1_AMAS0_BL1_DTL0_EPS1_FL0_GRVW1_GSU1_ISA908_IU1_KLA_LBSPP128_LPA2_LPB2_LRVW2_MAC_NLCA1_NLCB1_ONLL1_PGR1_PLR17_SIA3_SU32_SUS256_SRVW2_SNLL0_TT1_32_TLDS1_USFGROn1_VSn1_VW1_WSGRA1_WSGRB1_WG64_4_1_WGM15
    SolutionIndex: 407
    SolutionNameMin: Cijk_Alik_Bljk_SB_MT32x32x16_SE_1LDSB0_AF0EM1_AMAS0_BL1_DTL0_EPS0_FL1_GRVW4_GSU1_ISA908_IU1_KLA_LBSPP0_LPA1_LPB1_LRVW1_MAC_NLCA1_NLCB1_ONLL1_PGR0_PLR1_SIA1_SU32_SUS256_SRVW0_SNLL0_TT2_4_TLDS0_USFGRO1_VS1_VW1_WSGRA0_WSGRB0_WG16_8_1_WGM1
    SolutionIndex: 408
    SolutionNameMin: Cijk_Alik_Bljk_SB_MT32x32x16_SE_1LDSB0_AF0EM1_AMAS3_BL1_DTL0_EPS0_FL1_GRVW4_GSU1_ISA908_IU1_KLA_LBSPP0_LPA2_LPB2_LRVW2_MAC_NLCA1_NLCB1_ONLL1_PGR0_PLR1_SIA1_SU32_SUS256_SRVW0_SNLL0_TT4_2_TLDS0_USFGRO1_VS1_VW2_WSGRA0_WSGRB0_WG8_16_1_WGM8
    SolutionIndex: 409
    SolutionNameMin: Cijk_Alik_Bljk_SB_MT32x32x32_MI16x16x4x1_SE_1LDSB1_AF0EM1_AMAS0_BL1_DTL0_EPS1_FL0_GRVW4_GSU1_ISA908_IU1_KLA_LBSPP128_LPA4_LPB4_LRVW2_MAC_NLCA1_NLCB1_ONLL1_PGR1_PLR9_SIA3_SU0_SUS256_SRVW2_SNLL0_TT1_16_TLDS1_USFGROn1_VSn1_VW1_WSGRA1_WSGRB1_WG32_8_1_WGM1
    SolutionIndex: 410
    SolutionNameMin: Cijk_Alik_Bljk_SB_MT32x16x8_SN_1LDSB0_AF0EM1_AMAS2_BL0_DTL0_EPS0_FL0_GRVW2_GSU1_ISA000_IU1_KLS_LBSPP0_LPA0_LPB0_LRVW2_FMA_NLCA1_NLCB1_ONLL1_PGR1_PLR1_SIA1_SU32_SUS256_SRVW0_SNLL0_TT2_2_TLDS0_USFGRO0_VS1_VW2_WSGRA0_WSGRB0_WG16_8_1_WGM1
    SolutionIndex: 411
    SolutionNameMin: Cijk_Alik_Bljk_SB_MT32x32x32_SE_1LDSB0_AF0EM1_AMAS3_BL1_DTL0_EPS0_FL0_GRVW2_GSU1_ISA908_IU1_KLA_LBSPP0_LPA2_LPB2_LRVW2_MAC_NLCA1_NLCB1_ONLL1_PGR0_PLR0_SIA1_SU32_SUS256_SRVW0_SNLL0_TT2_4_TLDS0_USFGRO1_VS1_VW2_WSGRA0_WSGRB0_WG16_8_1_WGM8
    SolutionIndex: 412
    SolutionNameMin: Cijk_Alik_Bljk_SB_MT128x96x16_MI32x32x2x1_SE_1LDSB1_AF0EM1_AMAS0_BL1_DTL0_EPS0_FL0_GRVW1_GSU1_ISA908_IU1_KLA_LBSPP128_LPA2_LPB2_LRVW2_MAC_NLCA1_NLCB1_ONLL1_PGR2_PLR9_SIA3_SU0_SUS256_SRVW2_SNLL0_TT1_96_TLDS1_USFGROn1_VSn1_VW1_WSGRA1_WSGRB1_WG128_2_1_WGM15
    SolutionIndex: 413
    SolutionNameMin: Cijk_Alik_Bljk_SB_MT32x32x32_MI16x16x4x1_SE_1LDSB1_AF0EM1_AMAS0_BL1_DTL0_EPS1_FL0_GRVW2_GSU1_ISA908_IU1_KLA_LBSPP128_LPA2_LPB2_LRVW2_MAC_NLCA1_NLCB1_ONLL1_PGR1_PLR9_SIA3_SU32_SUS128_SRVW2_SNLL0_TT1_16_TLDS1_USFGROn1_VSn1_VW1_WSGRA1_WSGRB1_WG32_8_1_WGM1
    SolutionIndex: 414
    SolutionNameMin: Cijk_Alik_Bljk_SB_MT64x128x16_MI32x32x2x1_SE_1LDSB1_AF0EM1_AMAS0_BL1_DTL0_EPS0_FL0_GRVW2_GSU1_ISA908_IU1_KLA_LBSPP128_LPA2_LPB2_LRVW2_MAC_NLCA1_NLCB1_ONLL1_PGR2_PLR9_SIA3_SU0_SUS256_SRVW2_SNLL0_TT1_64_TLDS1_USFGROn1_VSn1_VW1_WSGRA1_WSGRB1_WG64_4_1_WGM2
    SolutionIndex: 415
    SolutionNameMin: Cijk_Alik_Bljk_SB_MT32x32x16_SE_1LDSB0_AF0EM1_AMAS0_BL1_DTL0_EPS0_FL0_GRVW1_GSU1_ISA908_IU1_KLA_LBSPP0_LPA1_LPB1_LRVW1_MAC_NLCA1_NLCB1_ONLL1_PGR0_PLR1_SIA1_SU32_SUS256_SRVW0_SNLL0_TT2_4_TLDS0_USFGRO1_VS1_VW1_WSGRA0_WSGRB0_WG16_8_1_WGM8
    SolutionIndex: 416
    SolutionNameMin: Cijk_Alik_Bljk_SB_MT96x96x16_MI16x16x4x1_SE_1LDSB1_AF0EM1_AMAS0_BL1_DTL0_EPS0_FL0_GRVW1_GSU1_ISA908_IU1_KLA_LBSPP128_LPA2_LPB2_LRVW2_MAC_NLCA1_NLCB1_ONLL1_PGR2_PLR5_SIA3_SU0_SUS256_SRVW0_SNLL0_TT3_48_TLDS1_USFGROn1_VSn1_VW1_WSGRA1_WSGRB1_WG32_8_1_WGM2
    SolutionIndex: 417
    SolutionNameMin: Cijk_Alik_Bljk_SB_MT64x32x16_SN_1LDSB0_AF0EM1_AMAS3_BL1_DTL0_EPS0_FL1_GRVW4_GSU1_ISA908_IU1_KLA_LBSPP0_LPA2_LPB0_LRVW2_MAC_NLCA1_NLCB1_ONLL1_PGR0_PLR1_SIA1_SU32_SUS256_SRVW0_SNLL0_TT4_4_TLDS0_USFGRO1_VS1_VW2_WSGRA0_WSGRB0_WG16_8_1_WGM8
    SolutionIndex: 418
    SolutionNameMin: Cijk_Alik_Bljk_SB_MT64x64x16_SE_1LDSB0_AF0EM1_AMAS0_BL1_DTL0_EPS0_FL0_GRVW4_GSU1_ISA908_IU1_KLA_LBSPP0_LPA1_LPB1_LRVW1_MAC_NLCA1_NLCB1_ONLL1_PGR0_PLR1_SIA1_SU32_SUS256_SRVW0_SNLL0_TT4_4_TLDS0_USFGRO1_VS1_VW1_WSGRA0_WSGRB0_WG16_16_1_WGM1
    SolutionIndex: 419
    SolutionNameMin: Cijk_Alik_Bljk_SB_MT16x16x8_SN_1LDSB0_AF0EM1_AMAS2_BL0_DTL0_EPS0_FL0_GRVW2_GSU1_ISA000_IU1_KLS_LBSPP0_LPA0_LPB0_LRVW2_FMA_NLCA1_NLCB1_ONLL1_PGR1_PLR1_SIA1_SU32_SUS256_SRVW0_SNLL0_TT2_2_TLDS0_USFGRO0_VS1_VW2_WSGRA0_WSGRB0_WG8_8_1_WGM1
    SolutionIndex: 420
    SolutionNameMin: Cijk_Alik_Bljk_SB_MT128x96x16_MI32x32x2x1_SE_1LDSB0_AF0EM1_AMAS0_BL1_DTL0_EPS0_FL0_GRVW1_GSU1_ISA908_IU1_KLA_LBSPP128_LPA2_LPB2_LRVW2_MAC_NLCA1_NLCB1_ONLL1_PGR2_PLR9_SIA3_SU0_SUS256_SRVW2_SNLL0_TT1_96_TLDS1_USFGROn1_VSn1_VW1_WSGRA1_WSGRB1_WG128_2_1_WGM2
    SolutionIndex: 421
    SolutionNameMin: Cijk_Alik_Bljk_SB_MT32x32x16_SE_1LDSB0_AF0EM1_AMAS3_BL1_DTL0_EPS0_FL0_GRVW4_GSU1_ISA908_IU1_KLA_LBSPP0_LPA2_LPB2_LRVW2_MAC_NLCA1_NLCB1_ONLL1_PGR0_PLR1_SIA1_SU32_SUS256_SRVW0_SNLL0_TT4_2_TLDS0_USFGRO1_VS1_VW2_WSGRA0_WSGRB0_WG8_16_1_WGM8
    SolutionIndex: 422
    SolutionNameMin: Cijk_Alik_Bljk_SB_MT128x96x16_MI32x32x2x1_SE_1LDSB0_AF0EM1_AMAS0_BL1_DTL0_EPS1_FL0_GRVW1_GSU1_ISA908_IU1_KLA_LBSPP128_LPA2_LPB2_LRVW2_MAC_NLCA1_NLCB1_ONLL1_PGR1_PLR9_SIA3_SU32_SUS256_SRVW2_SNLL0_TT1_96_TLDS1_USFGROn1_VSn1_VW1_WSGRA1_WSGRB1_WG128_2_1_WGM1
    SolutionIndex: 423
    SolutionNameMin: Cijk_Alik_Bljk_SB_MT64x192x16_MI32x32x2x1_SE_1LDSB1_AF0EM1_AMAS0_BL1_DTL0_EPS0_FL0_GRVW4_GSU1_ISA908_IU1_KLA_LBSPP128_LPA4_LPB4_LRVW2_MAC_NLCA1_NLCB1_ONLL1_PGR2_PLR9_SIA3_SU32_SUS128_SRVW2_SNLL0_TT1_96_TLDS1_USFGROn1_VSn1_VW1_WSGRA1_WSGRB1_WG64_4_1_WGM2
    SolutionIndex: 424
    SolutionNameMin: Cijk_Alik_Bljk_SB_MT64x32x16_MI16x16x4x1_SE_1LDSB0_AF0EM1_AMAS0_BL1_DTL0_EPS0_FL0_GRVW4_GSU1_ISA908_IU1_KLA_LBSPP128_LPA4_LPB4_LRVW2_MAC_NLCA1_NLCB1_ONLL1_PGR2_PLR5_SIA3_SU32_SUS128_SRVW2_SNLL0_TT2_16_TLDS1_USFGROn1_VSn1_VW1_WSGRA1_WSGRB1_WG32_8_1_WGM1
    SolutionIndex: 425
    SolutionNameMin: Cijk_Alik_Bljk_SB_MT32x64x16_MI16x16x4x1_SE_1LDSB1_AF0EM1_AMAS0_BL1_DTL0_EPS1_FL0_GRVW1_GSU1_ISA908_IU1_KLA_LBSPP128_LPA2_LPB2_LRVW2_MAC_NLCA1_NLCB1_ONLL1_PGR1_PLR5_SIA3_SU0_SUS256_SRVW2_SNLL0_TT1_32_TLDS1_USFGROn1_VSn1_VW1_WSGRA1_WSGRB1_WG32_8_1_WGM15
    SolutionIndex: 426
    SolutionNameMin: Cijk_Alik_Bljk_SB_MT16x16x16_SN_1LDSB0_AF0EM1_AMAS2_BL0_DTL0_EPS0_FL0_GRVW2_GSU1_ISA000_IU1_KLS_LBSPP0_LPA0_LPB0_LRVW2_FMA_NLCA1_NLCB1_ONLL1_PGR1_PLR1_SIA1_SU32_SUS256_SRVW0_SNLL0_TT2_2_TLDS0_USFGRO0_VS1_VW2_WSGRA0_WSGRB0_WG8_8_1_WGM1
    SolutionIndex: 427
    SolutionNameMin: Cijk_Alik_Bljk_SB_MT128x128x32_MI32x32x2x1_SE_1LDSB1_AF0EM1_AMAS0_BL1_DTL0_EPS1_FL0_GRVW1_GSU1_ISA908_IU1_KLA_LBSPP128_LPA2_LPB2_LRVW2_MAC_NLCA1_NLCB1_ONLL1_PGR1_PLR17_SIA3_SU32_SUS256_SRVW2_SNLL0_TT2_64_TLDS1_USFGROn1_VSn1_VW1_WSGRA1_WSGRB1_WG64_4_1_WGM15
- - - [1024, 512, 1, 1600]
    - [5, 32.957]
  - - [2048, 512, 1, 100]
    - [6, 10.262]
  - - [1024, 4096, 1, 1024]
    - [7, 63.534]
  - - [4096, 4096, 1, 1024]
    - [8, 80.316]
  - - [1024, 4096, 1, 4096]
    - [9, 85.445]
  - - [30528, 4096, 1, 1024]
    - [10, 90.735]
  - - [1024, 2048, 1, 1024]
    - [11, 61.048]
  - - [4096, 2048, 1, 1024]
    - [12, 75.493]
  - - [1024, 2048, 1, 4096]
    - [13, 75.313]
  - - [30528, 2048, 1, 1024]
    - [14, 87.838]
  - - [30522, 320, 1, 768]
    - [15, 69.021]
  - - [3072, 4096, 1, 768]
    - [16, 76.582]
  - - [768, 4096, 1, 3072]
    - [17, 79.159]
  - - [768, 4096, 1, 768]
    - [18, 62.445]
  - - [30522, 160, 1, 768]
    - [19, 57.063]
  - - [30522, 640, 1, 768]
    - [20, 79.328]
  - - [768, 640, 1, 768]
    - [21, 29.969]
  - - [30522, 1280, 1, 768]
    - [22, 85.563]
  - - [768, 1280, 1, 768]
    - [2, 73.512]
  - - [1024, 3072, 1, 1024]
    - [23, 59.7]
  - - [1024, 512, 1, 1024]
    - [24, 26.279]
  - - [1024, 2048, 1, 3072]
    - [25, 73.083]
  - - [1024, 3072, 1, 3072]
    - [17, 77.844]
  - - [1024, 512, 1, 3072]
    - [26, 35.954]
  - - [3072, 2048, 1, 1024]
    - [27, 72.468]
  - - [3072, 3072, 1, 1024]
    - [8, 77.001]
  - - [3072, 512, 1, 1024]
    - [2, 64.109]
  - - [30522, 120, 1, 1024]
    - [22, 57.517]
  - - [30522, 20, 1, 1024]
    - [28, 18.282]
  - - [30522, 80, 1, 1024]
    - [29, 42.729]
  - - [30522, 160, 1, 1024]
    - [30, 65.549]
  - - [1024, 200, 1, 560]
    - [31, 11.664]
  - - [768, 320, 1, 768]
    - [32, 15.404]
  - - [768, 32, 1, 768]
    - [33, 1.942]
  - - [768, 64, 1, 768]
    - [34, 3.768]
  - - [1024, 80, 1, 1024]
    - [35, 7.305]
  - - [1024, 120, 1, 1024]
    - [36, 10.577]
  - - [1024, 20, 1, 1024]
    - [37, 1.828]
  - - [768, 16, 1, 768]
    - [38, 1.06]
  - - [1024, 4, 1, 1024]
    - [39, 0.495]
  - - [1024, 6, 1, 1024]
    - [40, 0.673]
  - - [128, 128, 512, 64]
    - [41, 18.735]
  - - [64, 128, 512, 128]
    - [42, 24.771]
  - - [64, 512, 64, 512]
    - [43, 38.051]
  - - [512, 512, 64, 64]
    - [44, 24.126]
  - - [256, 256, 192, 64]
    - [45, 22.13]
  - - [256, 256, 96, 64]
    - [45, 20.678]
  - - [128, 128, 384, 64]
    - [46, 19.275]
  - - [128, 128, 96, 64]
    - [47, 9.055]
  - - [64, 64, 768, 64]
    - [48, 12.483]
  - - [64, 64, 96, 64]
    - [49, 3.404]
  - - [512, 512, 16, 64]
    - [42, 17.444]
  - - [512, 512, 96, 64]
    - [48, 24.756]
  - - [512, 512, 128, 64]
    - [50, 27.821]
  - - [1024, 128, 1, 128]
    - [51, 2.415]
  - - [4, 704, 1, 1280]
    - [52, 0.424]
  - - [4, 1856, 1, 3328]
    - [53, 1.891]
  - - [1856, 448, 1, 3328]
    - [54, 52.245]
  - - [2944, 4288, 1, 1280]
    - [55, 81.132]
  - - [2368, 64, 1, 3328]
    - [56, 25.939]
  - - [1760, 32, 1, 1760]
    - [35, 7.731]
  - - [2368, 5888, 1, 256]
    - [10, 53.612]
  - - [5888, 1856, 1, 256]
    - [57, 52.365]
  - - [128, 64, 1, 256]
    - [58, 0.274]
  - - [512, 24000, 1, 1536]
    - [59, 84.155]
  - - [128, 6784, 1, 3328]
    - [48, 54.254]
  - - [5888, 1408, 1, 256]
    - [22, 45.093]
  - - [5888, 1856, 1, 3328]
    - [60, 88.451]
  - - [5056, 704, 1, 256]
    - [15, 37.717]
  - - [2048, 400, 1, 512]
    - [61, 30.681]
  - - [5888, 2944, 1, 3328]
    - [62, 91.509]
  - - [1856, 4288, 1, 256]
    - [63, 44.48]
  - - [1024, 5056, 1, 128]
    - [64, 29.751]
  - - [5056, 5056, 1, 3328]
    - [65, 90.686]
  - - [1408, 5888, 1, 1280]
    - [21, 76.902]
  - - [2368, 448, 1, 128]
    - [66, 12.969]
  - - [2368, 6784, 1, 128]
    - [60, 38.672]
  - - [1024, 3584, 1, 3328]
    - [67, 82.196]
  - - [512, 48000, 1, 2048]
    - [68, 91.582]
  - - [128, 448, 1, 1280]
    - [69, 5.921]
  - - [256, 4288, 1, 3328]
    - [70, 66.237]
  - - [5888, 1408, 1, 1280]
    - [20, 77.313]
  - - [704, 1856, 1, 3328]
    - [71, 66.355]
  - - [4, 1408, 1, 128]
    - [72, 0.094]
  - - [1024, 2368, 1, 256]
    - [73, 35.128]
  - - [64, 4, 1, 256]
    - [74, 0.007]
  - - [1408, 1856, 1, 1280]
    - [75, 63.722]
  - - [1408, 64, 1, 1280]
    - [76, 9.5]
  - - [448, 1024, 1, 1280]
    - [77, 39.548]
  - - [6144, 24000, 1, 2048]
    - [78, 94.435]
  - - [4096, 32, 1, 4096]
    - [79, 22.006]
  - - [256, 1408, 1, 3328]
    - [80, 46.873]
  - - [5056, 5056, 1, 1280]
    - [22, 86.654]
  - - [448, 5056, 1, 256]
    - [81, 33.234]
  - - [704, 1856, 1, 1280]
    - [82, 56.903]
  - - [128, 5056, 1, 128]
    - [83, 8.795]
  - - [2368, 128, 1, 256]
    - [84, 7.965]
  - - [1760, 6400, 1, 1760]
    - [85, 84.728]
  - - [1856, 1408, 1, 128]
    - [86, 22.387]
  - - [64, 5056, 1, 256]
    - [87, 8.506]
  - - [6784, 256, 1, 3328]
    - [12, 72.38]
  - - [6784, 4288, 1, 3328]
    - [88, 93.152]
  - - [4288, 448, 1, 256]
    - [89, 27.898]
  - - [64, 704, 1, 128]
    - [90, 0.836]
  - - [1856, 2368, 1, 3328]
    - [15, 82.469]
  - - [4288, 2944, 1, 1280]
    - [22, 83.623]
  - - [704, 5056, 1, 1280]
    - [91, 67.83]
  - - [2368, 704, 1, 3328]
    - [92, 72.065]
  - - [256, 5888, 1, 256]
    - [22, 27.063]
  - - [1856, 4288, 1, 3328]
    - [15, 82.386]
  - - [256, 2944, 1, 256]
    - [93, 17.411]
  - - [5888, 1024, 1, 256]
    - [63, 50.147]
  - - [448, 64, 1, 1280]
    - [94, 3.769]
  - - [3072, 64, 1, 1024]
    - [84, 16.888]
  - - [3584, 4, 1, 1280]
    - [95, 1.698]
  - - [16384, 3200, 1, 4096]
    - [63, 93.305]
  - - [2944, 64, 1, 256]
    - [96, 4.733]
  - - [128, 4, 1, 1280]
    - [97, 0.062]
  - - [1408, 2944, 1, 256]
    - [98, 42.956]
  - - [256, 1856, 1, 1280]
    - [89, 36.731]
  - - [6784, 5056, 1, 3328]
    - [65, 91.925]
  - - [5056, 5056, 1, 256]
    - [10, 62.18]
  - - [1408, 6784, 1, 128]
    - [99, 36.565]
  - - [64, 1024, 1, 1280]
    - [76, 8.139]
  - - [2944, 4, 1, 256]
    - [100, 0.332]
  - - [704, 5056, 1, 128]
    - [46, 25.122]
  - - [4, 2368, 1, 1280]
    - [101, 1.157]
  - - [2368, 2944, 1, 1280]
    - [102, 76.483]
  - - [128, 3584, 1, 1280]
    - [87, 36.024]
  - - [6784, 6784, 1, 1280]
    - [29, 90.666]
  - - [1408, 4288, 1, 1280]
    - [103, 75.623]
  - - [3584, 4288, 1, 1280]
    - [104, 83.861]
  - - [2368, 704, 1, 1280]
    - [105, 58.691]
  - - [5056, 4288, 1, 3328]
    - [68, 91.825]
  - - [3584, 2368, 1, 3328]
    - [55, 86.562]
  - - [64, 704, 1, 1280]
    - [69, 6.063]
  - - [4288, 256, 1, 256]
    - [106, 21.389]
  - - [2944, 128, 1, 128]
    - [107, 5.393]
  - - [6144, 32, 1, 2560]
    - [108, 25.034]
  - - [6784, 448, 1, 1280]
    - [109, 59.406]
  - - [1408, 2944, 1, 128]
    - [48, 29.686]
  - - [4288, 2944, 1, 256]
    - [63, 51.192]
  - - [5888, 704, 1, 1280]
    - [20, 67.909]
  - - [5056, 4, 1, 3328]
    - [33, 3.3]
  - - [1856, 64, 1, 1280]
    - [110, 14.312]
  - - [1760, 16, 1, 1760]
    - [111, 4.264]
  - - [448, 5888, 1, 128]
    - [112, 23.52]
  - - [5888, 64, 1, 3328]
    - [99, 48.775]
  - - [2944, 256, 1, 3328]
    - [113, 52.229]
  - - [1024, 64, 1, 128]
    - [49, 0.988]
  - - [5056, 2368, 1, 1280]
    - [114, 80.626]
  - - [448, 3584, 1, 1280]
    - [115, 58.148]
  - - [6784, 5888, 1, 256]
    - [116, 67.75]
  - - [704, 1024, 1, 128]
    - [48, 9.467]
  - - [704, 128, 1, 1280]
    - [117, 10.485]
  - - [4, 3584, 1, 128]
    - [118, 0.256]
  - - [1408, 448, 1, 1280]
    - [119, 34.75]
  - - [1024, 1408, 1, 256]
    - [48, 24.339]
  - - [2368, 2368, 1, 3328]
    - [29, 85.304]
  - - [1856, 6784, 1, 128]
    - [120, 39.428]
  - - [5056, 704, 1, 3328]
    - [29, 79.995]
  - - [1408, 1856, 1, 256]
    - [46, 31.778]
  - - [1408, 704, 1, 3328]
    - [121, 54.822]
  - - [2368, 5056, 1, 256]
    - [63, 50.336]
  - - [1408, 256, 1, 1280]
    - [77, 28.221]
  - - [3072, 128, 1, 1024]
    - [122, 28.246]
  - - [3584, 2368, 1, 1280]
    - [123, 79.423]
  - - [4288, 64, 1, 3328]
    - [21, 35.694]
  - - [2368, 4, 1, 1280]
    - [69, 1.117]
  - - [704, 5888, 1, 256]
    - [64, 43.703]
  - - [6784, 2944, 1, 128]
    - [124, 42.017]
  - - [2560, 1600, 1, 2560]
    - [125, 76.73]
  - - [4288, 6784, 1, 3328]
    - [65, 93.31]
  - - [2944, 256, 1, 256]
    - [126, 17.034]
  - - [2944, 6784, 1, 3328]
    - [22, 91.498]
  - - [704, 1408, 1, 3328]
    - [18, 61.075]
  - - [6144, 5984, 1, 2048]
    - [57, 89.704]
  - - [3584, 704, 1, 3328]
    - [62, 74.279]
  - - [2944, 256, 1, 128]
    - [120, 10.085]
  - - [6784, 4, 1, 1280]
    - [127, 2.809]
  - - [1024, 64, 1, 1280]
    - [111, 7.862]
  - - [2048, 1600, 1, 512]
    - [48, 51.32]
  - - [448, 4288, 1, 256]
    - [128, 28.58]
  - - [64, 3584, 1, 3328]
    - [107, 35.691]
  - - [1856, 4288, 1, 128]
    - [46, 33.232]
  - - [704, 2368, 1, 1280]
    - [129, 56.979]
  - - [1856, 2368, 1, 1280]
    - [89, 73.157]
  - - [2368, 128, 1, 3328]
    - [15, 38.137]
  - - [2944, 128, 1, 256]
    - [71, 11.107]
  - - [448, 1408, 1, 256]
    - [130, 13.385]
  - - [1856, 4288, 1, 1280]
    - [98, 74.193]
  - - [64, 5056, 1, 3328]
    - [131, 37.867]
  - - [4, 704, 1, 256]
    - [35, 0.083]
  - - [1024, 448, 1, 128]
    - [132, 7.04]
  - - [704, 4, 1, 1280]
    - [133, 0.387]
  - - [704, 256, 1, 128]
    - [134, 2.98]
  - - [704, 2944, 1, 128]
    - [81, 19.494]
  - - [1408, 1024, 1, 1280]
    - [15, 59.745]
  - - [704, 6784, 1, 256]
    - [15, 44.338]
  - - [6784, 704, 1, 256]
    - [15, 46.271]
  - - [5056, 1408, 1, 128]
    - [135, 30.479]
  - - [2048, 7000, 1, 2048]
    - [57, 87.146]
  - - [256, 3584, 1, 3328]
    - [136, 56.819]
  - - [4, 5888, 1, 3328]
    - [101, 3.319]
  - - [128, 1408, 1, 128]
    - [137, 2.861]
  - - [3584, 4288, 1, 3328]
    - [29, 90.646]
  - - [5888, 1856, 1, 1280]
    - [138, 79.03]
  - - [256, 1408, 1, 256]
    - [139, 8.604]
  - - [5056, 64, 1, 1280]
    - [77, 25.543]
  - - [1024, 704, 1, 256]
    - [106, 17.252]
  - - [448, 128, 1, 128]
    - [49, 0.965]
  - - [2368, 3584, 1, 1280]
    - [138, 79.345]
  - - [2368, 6784, 1, 1280]
    - [29, 82.905]
  - - [1856, 4, 1, 1280]
    - [140, 0.847]
  - - [448, 448, 1, 256]
    - [141, 5.488]
  - - [2944, 3584, 1, 3328]
    - [22, 90.148]
  - - [7680, 32, 1, 2560]
    - [108, 27.644]
  - - [128, 4288, 1, 128]
    - [48, 7.815]
  - - [256, 256, 1, 3328]
    - [142, 12.787]
  - - [128, 1024, 1, 3328]
    - [143, 22.038]
  - - [4, 1408, 1, 3328]
    - [40, 1.578]
  - - [6784, 2944, 1, 256]
    - [29, 59.247]
  - - [64, 1856, 1, 1280]
    - [35, 13.721]
  - - [6784, 64, 1, 128]
    - [49, 6.576]
  - - [4288, 2368, 1, 3328]
    - [144, 85.443]
  - - [1856, 2368, 1, 256]
    - [64, 39.318]
  - - [3584, 256, 1, 128]
    - [24, 11.944]
  - - [3584, 6784, 1, 3328]
    - [29, 93.365]
  - - [256, 1024, 1, 256]
    - [145, 6.946]
  - - [4, 6784, 1, 3328]
    - [37, 3.79]
  - - [1024, 5888, 1, 3328]
    - [15, 81.515]
  - - [1024, 128, 1, 1280]
    - [146, 13.052]
  - - [3072, 32, 1, 1024]
    - [110, 9.149]
  - - [6144, 24000, 1, 2560]
    - [147, 95.772]
  - - [5056, 4288, 1, 1280]
    - [125, 85.065]
  - - [5888, 64, 1, 256]
    - [148, 9.195]
  - - [6784, 1856, 1, 3328]
    - [149, 88.435]
  - - [1408, 5056, 1, 1280]
    - [147, 76.463]
  - - [1856, 256, 1, 1280]
    - [150, 39.858]
  - - [64, 5888, 1, 3328]
    - [131, 43.823]
  - - [2368, 2368, 1, 1280]
    - [151, 74.496]
  - - [2944, 5888, 1, 128]
    - [152, 41.437]
  - - [704, 5888, 1, 1280]
    - [153, 68.802]
  - - [2368, 3584, 1, 128]
    - [44, 34.895]
  - - [1856, 5056, 1, 128]
    - [89, 35.291]
  - - [704, 1024, 1, 1280]
    - [15, 41.526]
  - - [448, 256, 1, 3328]
    - [154, 20.886]
  - - [448, 1856, 1, 128]
    - [46, 10.703]
  - - [8192, 3200, 1, 2048]
    - [68, 89.059]
  - - [128, 1024, 1, 128]
    - [49, 2.24]
  - - [2944, 4, 1, 128]
    - [155, 0.225]
  - - [1024, 704, 1, 1280]
    - [21, 42.422]
  - - [128, 5888, 1, 256]
    - [85, 17.822]
  - - [1024, 5056, 1, 1280]
    - [156, 73.239]
  - - [4288, 1024, 1, 256]
    - [23, 43.926]
  - - [2944, 2368, 1, 128]
    - [157, 33.45]
  - - [704, 704, 1, 3328]
    - [158, 34.888]
  - - [704, 1408, 1, 1280]
    - [159, 46.819]
  - - [5888, 448, 1, 1280]
    - [126, 63.627]
  - - [3584, 256, 1, 3328]
    - [160, 57.626]
  - - [704, 5888, 1, 3328]
    - [152, 78.761]
  - - [704, 1856, 1, 128]
    - [161, 12.651]
  - - [448, 448, 1, 3328]
    - [56, 30.252]
  - - [4, 4288, 1, 128]
    - [162, 0.271]
  - - [128, 704, 1, 1280]
    - [108, 9.317]
  - - [3584, 2944, 1, 256]
    - [163, 49.68]
  - - [3584, 4, 1, 128]
    - [164, 0.262]
  - - [1856, 128, 1, 3328]
    - [165, 35.738]
  - - [4, 64, 1, 1280]
    - [166, 0.033]
  - - [2944, 448, 1, 128]
    - [48, 14.955]
  - - [128, 2944, 1, 1280]
    - [150, 30.678]
  - - [64, 64, 1, 3328]
    - [167, 1.374]
  - - [448, 2944, 1, 1280]
    - [48, 50.65]
  - - [512, 24000, 1, 2048]
    - [68, 87.491]
  - - [128, 256, 1, 3328]
    - [101, 8.076]
  - - [1408, 5056, 1, 3328]
    - [55, 86.5]
  - - [1856, 1856, 1, 3328]
    - [105, 76.395]
  - - [3584, 128, 1, 256]
    - [48, 11.999]
  - - [2560, 800, 1, 2560]
    - [168, 65.449]
  - - [448, 1408, 1, 3328]
    - [169, 39.46]
  - - [2368, 2368, 1, 256]
    - [46, 43.058]
  - - [4288, 4288, 1, 1280]
    - [170, 85.36]
  - - [64, 448, 1, 1280]
    - [33, 3.776]
  - - [5888, 1024, 1, 1280]
    - [18, 74.24]
  - - [1408, 4288, 1, 256]
    - [171, 47.658]
  - - [448, 4, 1, 256]
    - [69, 0.056]
  - - [5888, 448, 1, 128]
    - [46, 23.859]
  - - [512, 48000, 1, 2560]
    - [12, 92.405]
  - - [35, 8457, 1, 1760]
    - [172, 21.982]
  - - [704, 6784, 1, 3328]
    - [138, 88.037]
  - - [2560, 6400, 1, 2560]
    - [22, 90.042]
  - - [5056, 1024, 1, 1280]
    - [173, 74.411]
  - - [448, 5888, 1, 3328]
    - [174, 76.753]
  - - [128, 4, 1, 128]
    - [49, 0.008]
  - - [1024, 2944, 1, 1280]
    - [175, 59.8]
  - - [5056, 5888, 1, 1280]
    - [29, 88.656]
  - - [4288, 5888, 1, 128]
    - [46, 43.728]
  - - [256, 3584, 1, 256]
    - [48, 19.808]
  - - [1408, 3584, 1, 128]
    - [46, 30.184]
  - - [256, 2944, 1, 3328]
    - [11, 45.74]
  - - [448, 3584, 1, 128]
    - [136, 18.002]
  - - [5888, 2944, 1, 1280]
    - [116, 84.622]
  - - [4, 6784, 1, 1280]
    - [94, 2.52]
  - - [2368, 5888, 1, 128]
    - [176, 33.708]
  - - [8448, 16, 1, 2816]
    - [69, 14.244]
  - - [64, 2944, 1, 128]
    - [37, 2.996]
  - - [2368, 4, 1, 256]
    - [177, 0.315]
  - - [3584, 5888, 1, 256]
    - [57, 59.449]
  - - [2368, 1024, 1, 128]
    - [178, 21.883]
  - - [2368, 704, 1, 128]
    - [46, 18.429]
  - - [3584, 2944, 1, 1280]
    - [129, 82.427]
  - - [3584, 2368, 1, 128]
    - [89, 34.126]
  - - [5056, 704, 1, 128]
    - [15, 26.709]
  - - [448, 2368, 1, 128]
    - [44, 12.852]
  - - [5056, 1408, 1, 3328]
    - [68, 86.751]
  - - [1408, 704, 1, 256]
    - [179, 19.253]
  - - [6784, 1024, 1, 3328]
    - [102, 84.582]
  - - [6784, 2944, 1, 3328]
    - [65, 91.135]
  - - [2944, 5056, 1, 3328]
    - [65, 88.53]
  - - [1856, 1856, 1, 256]
    - [138, 41.09]
  - - [1024, 5888, 1, 128]
    - [15, 34.018]
  - - [6784, 2368, 1, 1280]
    - [12, 82.163]
  - - [256, 4, 1, 128]
    - [180, 0.018]
  - - [4288, 5888, 1, 1280]
    - [22, 88.407]
  - - [4288, 4288, 1, 256]
    - [170, 57.208]
  - - [8448, 32, 1, 2816]
    - [181, 27.809]
  - - [448, 2944, 1, 3328]
    - [156, 66.33]
  - - [5888, 4, 1, 128]
    - [94, 0.425]
  - - [4288, 1856, 1, 1280]
    - [115, 74.366]
  - - [1856, 2944, 1, 3328]
    - [63, 84.829]
  - - [256, 6784, 1, 3328]
    - [182, 72.41]
  - - [64, 5888, 1, 256]
    - [183, 10.575]
  - - [256, 5056, 1, 128]
    - [48, 14.884]
  - - [5056, 1024, 1, 256]
    - [48, 42.288]
  - - [704, 64, 1, 3328]
    - [184, 9.224]
  - - [5056, 1856, 1, 3328]
    - [68, 87.008]
  - - [4, 2944, 1, 3328]
    - [185, 2.432]
  - - [4, 5056, 1, 256]
    - [117, 0.715]
  - - [1856, 1408, 1, 256]
    - [99, 33.505]
  - - [8448, 12000, 1, 2816]
    - [186, 95.359]
  - - [6784, 128, 1, 3328]
    - [45, 59.179]
  - - [4288, 1408, 1, 128]
    - [187, 30.655]
  - - [1856, 5888, 1, 3328]
    - [135, 88.216]
  - - [4288, 5056, 1, 256]
    - [129, 58.04]
  - - [1408, 128, 1, 1280]
    - [117, 16.37]
  - - [4096, 800, 1, 1024]
    - [50, 59.658]
  - - [5056, 256, 1, 3328]
    - [125, 66.365]
  - - [704, 704, 1, 256]
    - [109, 11.992]
  - - [1024, 5888, 1, 1280]
    - [120, 75.368]
  - - [6784, 2368, 1, 128]
    - [10, 38.43]
  - - [4, 5056, 1, 1280]
    - [33, 1.972]
  - - [256, 64, 1, 1280]
    - [188, 2.085]
  - - [128, 1856, 1, 1280]
    - [56, 25.327]
  - - [1856, 1024, 1, 1280]
    - [189, 64.631]
  - - [6784, 4288, 1, 1280]
    - [190, 87.168]
  - - [2560, 64, 1, 2560]
    - [84, 23.771]
  - - [1856, 1856, 1, 1280]
    - [138, 68.153]
  - - [4096, 400, 1, 1024]
    - [191, 52.516]
  - - [3072, 24000, 1, 1024]
    - [116, 90.689]
  - - [128, 4288, 1, 3328]
    - [149, 41.48]
  - - [4, 2368, 1, 3328]
    - [192, 2.04]
  - - [5888, 1856, 1, 128]
    - [46, 35.903]
  - - [448, 704, 1, 1280]
    - [150, 29.121]
  - - [128, 5056, 1, 1280]
    - [193, 34.276]
  - - [1024, 448, 1, 3328]
    - [194, 59.66]
  - - [1856, 704, 1, 1280]
    - [10, 54.109]
  - - [5056, 3584, 1, 128]
    - [123, 42.199]
  - - [5888, 5888, 1, 3328]
    - [63, 93.082]
  - - [6784, 1024, 1, 256]
    - [16, 51.359]
  - - [2944, 2368, 1, 256]
    - [171, 45.674]
  - - [256, 448, 1, 256]
    - [90, 3.02]
  - - [5056, 5888, 1, 3328]
    - [29, 92.4]
  - - [1856, 1024, 1, 256]
    - [63, 34.035]
  - - [512, 48000, 1, 1536]
    - [63, 89.414]
  - - [3584, 448, 1, 1280]
    - [195, 57.78]
  - - [8448, 5984, 1, 2816]
    - [65, 93.461]
  - - [448, 5888, 1, 256]
    - [50, 36.503]
  - - [704, 64, 1, 128]
    - [196, 0.832]
  - - [1408, 6784, 1, 3328]
    - [22, 89.11]
  - - [448, 1024, 1, 128]
    - [197, 6.58]
  - - [4288, 704, 1, 128]
    - [46, 23.154]
  - - [128, 1856, 1, 128]
    - [117, 4.198]
  - - [448, 2368, 1, 3328]
    - [198, 62.006]
  - - [5056, 64, 1, 128]
    - [199, 4.623]
  - - [5056, 2944, 1, 256]
    - [123, 57.011]
  - - [6784, 5888, 1, 128]
    - [10, 50.484]
  - - [1024, 700, 1, 512]
    - [43, 25.332]
  - - [704, 1024, 1, 256]
    - [48, 15.57]
  - - [1024, 4, 1, 256]
    - [117, 0.141]
  - - [2944, 704, 1, 128]
    - [109, 20.36]
  - - [128, 6784, 1, 1280]
    - [174, 48.996]
  - - [1408, 3584, 1, 3328]
    - [200, 79.801]
  - - [2368, 6784, 1, 256]
    - [63, 57.706]
  - - [5056, 1408, 1, 1280]
    - [201, 75.462]
  - - [256, 256, 1, 128]
    - [196, 0.996]
  - - [5056, 4288, 1, 128]
    - [46, 42.345]
  - - [1408, 1856, 1, 128]
    - [99, 21.836]
  - - [1408, 5888, 1, 3328]
    - [202, 85.489]
  - - [1856, 256, 1, 256]
    - [132, 10.131]
  - - [6784, 6784, 1, 256]
    - [10, 71.555]
  - - [64, 256, 1, 128]
    - [49, 0.243]
  - - [4288, 2368, 1, 128]
    - [48, 35.078]
  - - [256, 4288, 1, 1280]
    - [203, 48.41]
  - - [2368, 2944, 1, 256]
    - [98, 48.156]
  - - [4, 1856, 1, 256]
    - [204, 0.244]
  - - [3584, 1856, 1, 1280]
    - [205, 76.707]
  - - [6784, 6784, 1, 128]
    - [161, 50.588]
  - - [256, 1856, 1, 128]
    - [206, 8.275]
  - - [704, 64, 1, 1280]
    - [69, 5.434]
  - - [5888, 5056, 1, 256]
    - [207, 65.858]
  - - [8448, 48000, 1, 2816]
    - [186, 96.444]
  - - [3584, 448, 1, 256]
    - [22, 26.705]
  - - [448, 4288, 1, 128]
    - [46, 18.017]
  - - [7680, 64, 1, 2560]
    - [208, 52.872]
  - - [256, 6784, 1, 256]
    - [209, 28.819]
  - - [1408, 4288, 1, 128]
    - [73, 34.344]
  - - [2944, 704, 1, 3328]
    - [210, 75.05]
  - - [128, 448, 1, 256]
    - [48, 1.56]
  - - [5056, 256, 1, 1280]
    - [208, 54.426]
  - - [2560, 32, 1, 2560]
    - [117, 14.249]
  - - [3584, 3584, 1, 256]
    - [29, 50.372]
  - - [448, 1408, 1, 128]
    - [48, 8.535]
  - - [128, 256, 1, 1280]
    - [127, 3.8]
  - - [3584, 5056, 1, 256]
    - [211, 58.254]
  - - [6784, 128, 1, 256]
    - [113, 18.614]
  - - [4288, 4, 1, 256]
    - [212, 0.539]
  - - [704, 448, 1, 256]
    - [213, 7.911]
  - - [2944, 2368, 1, 1280]
    - [186, 72.132]
  - - [448, 64, 1, 3328]
    - [214, 7.422]
  - - [1408, 3584, 1, 256]
    - [92, 46.574]
  - - [3584, 4, 1, 3328]
    - [90, 2.8]
  - - [6784, 3584, 1, 256]
    - [215, 59.632]
  - - [256, 128, 1, 128]
    - [216, 0.648]
  - - [704, 1408, 1, 128]
    - [48, 12.091]
  - - [4, 2368, 1, 256]
    - [72, 0.301]
  - - [4288, 128, 1, 1280]
    - [129, 33.203]
  - - [128, 1408, 1, 256]
    - [48, 4.845]
  - - [4, 2944, 1, 256]
    - [37, 0.397]
  - - [64, 128, 1, 3328]
    - [39, 2.601]
  - - [5056, 2368, 1, 128]
    - [46, 37.85]
  - - [2944, 2944, 1, 3328]
    - [129, 89.327]
  - - [5056, 6784, 1, 256]
    - [22, 66.996]
  - - [1856, 3584, 1, 128]
    - [99, 34.767]
  - - [128, 2944, 1, 128]
    - [46, 5.86]
  - - [35, 8457, 1, 2560]
    - [217, 23.865]
  - - [1024, 704, 1, 3328]
    - [218, 48.21]
  - - [6784, 448, 1, 256]
    - [15, 38.26]
  - - [3584, 6784, 1, 128]
    - [10, 45.722]
  - - [128, 4288, 1, 256]
    - [219, 13.22]
  - - [704, 448, 1, 3328]
    - [89, 43.419]
  - - [128, 128, 1, 3328]
    - [220, 4.728]
  - - [5056, 1856, 1, 256]
    - [17, 45.6]
  - - [4608, 5984, 1, 1536]
    - [88, 88.604]
  - - [256, 128, 1, 256]
    - [74, 1.093]
  - - [1760, 3200, 1, 1760]
    - [221, 79.029]
  - - [1024, 1856, 1, 256]
    - [73, 31.89]
  - - [4096, 1600, 1, 1024]
    - [195, 68.439]
  - - [4288, 64, 1, 128]
    - [90, 4.305]
  - - [256, 448, 1, 3328]
    - [111, 22.86]
  - - [1408, 6784, 1, 1280]
    - [16, 81.394]
  - - [3584, 3584, 1, 1280]
    - [147, 81.872]
  - - [7680, 24000, 1, 2560]
    - [88, 95.874]
  - - [64, 2368, 1, 1280]
    - [222, 13.992]
  - - [448, 2368, 1, 1280]
    - [223, 46.863]
  - - [4608, 48000, 1, 1536]
    - [147, 94.463]
  - - [5888, 5888, 1, 128]
    - [123, 46.734]
  - - [64, 6784, 1, 3328]
    - [119, 52.886]
  - - [2944, 256, 1, 1280]
    - [45, 45.112]
  - - [2048, 16, 1, 2048]
    - [95, 4.644]
  - - [256, 2368, 1, 128]
    - [224, 8.202]
  - - [5056, 2368, 1, 3328]
    - [225, 88.33]
  - - [2944, 4288, 1, 256]
    - [123, 52.094]
  - - [1408, 3584, 1, 1280]
    - [43, 71.391]
  - - [2368, 64, 1, 256]
    - [226, 4.981]
  - - [64, 448, 1, 3328]
    - [101, 6.609]
  - - [704, 128, 1, 3328]
    - [110, 16.536]
  - - [8192, 1600, 1, 2048]
    - [98, 82.123]
  - - [1856, 704, 1, 256]
    - [15, 25.334]
  - - [4, 4288, 1, 1280]
    - [74, 1.665]
  - - [1408, 448, 1, 3328]
    - [227, 44.147]
  - - [1024, 4, 1, 3328]
    - [53, 1.121]
  - - [512, 24000, 1, 2560]
    - [30, 89.402]
  - - [2368, 6784, 1, 3328]
    - [65, 89.874]
  - - [1856, 1408, 1, 1280]
    - [174, 61.664]
  - - [1856, 448, 1, 1280]
    - [99, 48.15]
  - - [6784, 704, 1, 128]
    - [103, 31.375]
  - - [4, 4, 1, 256]
    - [196, 0.001]
  - - [128, 5888, 1, 128]
    - [228, 8.979]
  - - [1408, 5888, 1, 256]
    - [22, 47.532]
  - - [704, 2944, 1, 1280]
    - [60, 58.234]
  - - [4288, 64, 1, 1280]
    - [80, 23.345]
  - - [256, 64, 1, 256]
    - [84, 0.518]
  - - [704, 1856, 1, 256]
    - [229, 23.777]
  - - [704, 6784, 1, 128]
    - [48, 32.112]
  - - [3584, 704, 1, 1280]
    - [7, 60.335]
  - - [256, 128, 1, 1280]
    - [35, 3.847]
  - - [5888, 2368, 1, 256]
    - [102, 52.463]
  - - [256, 2368, 1, 1280]
    - [230, 33.699]
  - - [2944, 6784, 1, 128]
    - [211, 40.861]
  - - [3584, 448, 1, 3328]
    - [83, 67.472]
  - - [1408, 4, 1, 256]
    - [216, 0.147]
  - - [704, 2368, 1, 3328]
    - [8, 71.255]
  - - [2944, 448, 1, 256]
    - [46, 24.306]
  - - [1856, 448, 1, 128]
    - [48, 11.471]
  - - [4288, 4, 1, 3328]
    - [33, 3.088]
  - - [2368, 128, 1, 1280]
    - [208, 25.398]
  - - [256, 5888, 1, 128]
    - [231, 14.633]
  - - [64, 6784, 1, 256]
    - [232, 11.826]
  - - [64, 5056, 1, 1280]
    - [222, 26.672]
  - - [4, 6784, 1, 128]
    - [107, 0.512]
  - - [2048, 3200, 1, 512]
    - [63, 62.823]
  - - [2944, 2944, 1, 1280]
    - [233, 80.944]
  - - [5056, 448, 1, 3328]
    - [32, 73.703]
  - - [4, 3584, 1, 1280]
    - [90, 1.661]
  - - [1408, 128, 1, 128]
    - [111, 3.319]
  - - [6784, 704, 1, 3328]
    - [234, 83.809]
  - - [128, 64, 1, 1280]
    - [235, 1.098]
  - - [2368, 256, 1, 1280]
    - [195, 36.465]
  - - [4, 448, 1, 3328]
    - [236, 0.614]
  - - [5888, 4288, 1, 128]
    - [10, 41.98]
  - - [4, 5888, 1, 256]
    - [33, 0.781]
  - - [1408, 2944, 1, 3328]
    - [55, 82.917]
  - - [3584, 704, 1, 128]
    - [48, 22.295]
  - - [4608, 12000, 1, 1536]
    - [147, 91.963]
  - - [64, 1024, 1, 256]
    - [196, 2.179]
  - - [5056, 5056, 1, 128]
    - [175, 42.869]
  - - [2368, 448, 1, 1280]
    - [135, 52.716]
  - - [128, 3584, 1, 256]
    - [237, 13.408]
  - - [704, 448, 1, 1280]
    - [77, 27.969]
  - - [8192, 800, 1, 2048]
    - [59, 76.179]
  - - [448, 5056, 1, 128]
    - [48, 20.173]
  - - [256, 4, 1, 1280]
    - [40, 0.138]
  - - [5056, 3584, 1, 256]
    - [29, 57.56]
  - - [2368, 4, 1, 3328]
    - [238, 2.067]
  - - [1408, 5056, 1, 128]
    - [48, 35.005]
  - - [2944, 3584, 1, 128]
    - [104, 37.196]
  - - [3584, 2368, 1, 256]
    - [46, 41.151]
  - - [128, 3584, 1, 3328]
    - [222, 58.884]
  - - [128, 1024, 1, 1280]
    - [5, 13.531]
  - - [8448, 24000, 1, 2816]
    - [147, 95.826]
  - - [64, 704, 1, 256]
    - [49, 1.367]
  - - [4288, 256, 1, 1280]
    - [210, 48.922]
  - - [3584, 3584, 1, 3328]
    - [147, 89.627]
  - - [4, 704, 1, 128]
    - [33, 0.05]
  - - [5888, 6784, 1, 256]
    - [14, 67.463]
  - - [4288, 2944, 1, 3328]
    - [138, 91.742]
  - - [2944, 64, 1, 128]
    - [95, 2.659]
  - - [1024, 128, 1, 3328]
    - [217, 24.288]
  - - [1024, 16, 1, 500000]
    - [239, 12.611]
  - - [4288, 128, 1, 3328]
    - [16, 38.057]
  - - [7680, 128, 1, 2560]
    - [149, 70.246]
  - - [256, 5056, 1, 1280]
    - [45, 54.829]
  - - [1408, 256, 1, 128]
    - [213, 6.064]
  - - [2944, 5888, 1, 3328]
    - [29, 91.664]
  - - [6784, 5888, 1, 1280]
    - [189, 89.739]
  - - [2048, 800, 1, 512]
    - [131, 35.711]
  - - [704, 128, 1, 256]
    - [212, 2.8]
  - - [5888, 4288, 1, 1280]
    - [147, 85.728]
  - - [1024, 24000, 1, 2048]
    - [68, 91.064]
  - - [448, 256, 1, 1280]
    - [90, 13.71]
  - - [5888, 3584, 1, 128]
    - [240, 41.163]
  - - [1024, 2944, 1, 128]
    - [48, 24.996]
  - - [5056, 4, 1, 1280]
    - [69, 2.137]
  - - [256, 1408, 1, 1280]
    - [208, 29.586]
  - - [3072, 16, 1, 1024]
    - [110, 5.045]
  - - [704, 3584, 1, 128]
    - [211, 23.113]
  - - [5888, 448, 1, 3328]
    - [241, 75.373]
  - - [2368, 4288, 1, 1280]
    - [152, 79.225]
  - - [4288, 2944, 1, 128]
    - [129, 34.728]
  - - [1024, 6784, 1, 3328]
    - [9, 83.65]
  - - [128, 2368, 1, 256]
    - [137, 7.515]
  - - [6784, 64, 1, 3328]
    - [208, 55.647]
  - - [5056, 2944, 1, 3328]
    - [20, 88.493]
  - - [448, 128, 1, 256]
    - [242, 1.878]
  - - [2944, 3584, 1, 256]
    - [27, 45.974]
  - - [1408, 1408, 1, 3328]
    - [243, 73.686]
  - - [1856, 128, 1, 1280]
    - [230, 24.542]
  - - [3584, 3584, 1, 128]
    - [8, 36.417]
  - - [64, 3584, 1, 256]
    - [183, 6.717]
  - - [1408, 4, 1, 3328]
    - [244, 1.525]
  - - [128, 2944, 1, 3328]
    - [131, 47.639]
  - - [3584, 704, 1, 256]
    - [245, 33.239]
  - - [2944, 448, 1, 3328]
    - [82, 66.621]
  - - [3584, 1408, 1, 3328]
    - [135, 79.523]
  - - [704, 3584, 1, 1280]
    - [80, 59.667]
  - - [2944, 6784, 1, 1280]
    - [189, 84.985]
  - - [1856, 6784, 1, 256]
    - [8, 51.996]
  - - [4288, 448, 1, 3328]
    - [227, 76.44]
  - - [6784, 4288, 1, 128]
    - [116, 43.137]
  - - [6784, 704, 1, 1280]
    - [227, 70.788]
  - - [256, 4288, 1, 256]
    - [46, 21.365]
  - - [3584, 6784, 1, 256]
    - [63, 64.662]
  - - [6144, 12000, 1, 2048]
    - [246, 93.732]
  - - [6144, 16, 1, 2560]
    - [111, 12.849]
  - - [3584, 64, 1, 128]
    - [247, 3.671]
  - - [5888, 1024, 1, 3328]
    - [15, 81.324]
  - - [448, 64, 1, 128]
    - [33, 0.525]
  - - [704, 6784, 1, 1280]
    - [20, 76.89]
  - - [4, 1024, 1, 1280]
    - [248, 0.544]
  - - [5888, 128, 1, 256]
    - [48, 17.461]
  - - [4096, 16, 1, 4096]
    - [249, 11.846]
  - - [1856, 5056, 1, 3328]
    - [105, 86.04]
  - - [4, 6784, 1, 256]
    - [37, 0.713]
  - - [1024, 3584, 1, 128]
    - [44, 27.589]
  - - [1024, 1408, 1, 128]
    - [21, 17.534]
  - - [2368, 2944, 1, 128]
    - [157, 32.171]
  - - [5056, 64, 1, 256]
    - [232, 8.869]
  - - [4, 448, 1, 1280]
    - [39, 0.265]
  - - [5056, 2944, 1, 128]
    - [115, 36.038]
  - - [5888, 5056, 1, 3328]
    - [22, 92.199]
  - - [1024, 704, 1, 128]
    - [112, 10.172]
  - - [5888, 2368, 1, 128]
    - [46, 32.639]
  - - [128, 5056, 1, 3328]
    - [65, 40.8]
  - - [3584, 6784, 1, 1280]
    - [22, 88.396]
  - - [448, 4, 1, 1280]
    - [250, 0.227]
  - - [1856, 5888, 1, 256]
    - [171, 52.615]
  - - [256, 256, 1, 256]
    - [94, 2.284]
  - - [256, 64, 1, 128]
    - [74, 0.313]
  - - [4288, 4288, 1, 3328]
    - [29, 91.821]
  - - [4288, 1408, 1, 1280]
    - [14, 73.872]
  - - [3584, 5056, 1, 128]
    - [251, 39.561]
  - - [4, 1024, 1, 3328]
    - [167, 1.204]
  - - [4288, 2368, 1, 256]
    - [28, 47.626]
  - - [2944, 5056, 1, 1280]
    - [29, 83.703]
  - - [448, 6784, 1, 256]
    - [44, 39.629]
  - - [64, 128, 1, 128]
    - [90, 0.136]
  - - [1856, 2368, 1, 128]
    - [48, 30.377]
  - - [6784, 2368, 1, 3328]
    - [14, 89.06]
  - - [256, 1024, 1, 1280]
    - [237, 23.635]
  - - [704, 4, 1, 128]
    - [252, 0.049]
  - - [256, 4, 1, 256]
    - [253, 0.037]
  - - [4288, 128, 1, 256]
    - [24, 13.284]
  - - [4288, 1856, 1, 3328]
    - [138, 82.368]
  - - [3584, 448, 1, 128]
    - [46, 17.737]
  - - [2048, 1600, 1, 2048]
    - [189, 68.503]
  - - [256, 4, 1, 3328]
    - [254, 0.304]
  - - [4, 1408, 1, 1280]
    - [255, 0.675]
  - - [3584, 64, 1, 1280]
    - [84, 24.957]
  - - [1408, 448, 1, 128]
    - [249, 9.512]
  - - [3584, 1024, 1, 1280]
    - [149, 70.946]
  - - [1856, 5056, 1, 256]
    - [205, 44.453]
  - - [4, 3584, 1, 256]
    - [256, 0.526]
  - - [4, 2944, 1, 1280]
    - [33, 1.451]
  - - [1024, 4288, 1, 256]
    - [63, 43.579]
  - - [5888, 3584, 1, 3328]
    - [22, 92.114]
  - - [1856, 4, 1, 256]
    - [204, 0.228]
  - - [4, 256, 1, 256]
    - [257, 0.034]
  - - [5056, 3584, 1, 3328]
    - [20, 90.806]
  - - [704, 448, 1, 128]
    - [48, 4.833]
  - - [2368, 1408, 1, 1280]
    - [156, 66.222]
  - - [5056, 2944, 1, 1280]
    - [29, 83.245]
  - - [4, 4, 1, 128]
    - [155, 0.0]
  - - [3584, 256, 1, 256]
    - [208, 20.06]
  - - [1024, 6784, 1, 256]
    - [205, 43.286]
  - - [4, 128, 1, 256]
    - [258, 0.016]
  - - [64, 64, 1, 1280]
    - [259, 0.585]
  - - [5124, 9124, 1, 2048]
    - [57, 89.911]
  - - [6784, 4, 1, 128]
    - [127, 0.571]
  - - [2944, 1408, 1, 128]
    - [48, 29.578]
  - - [448, 128, 1, 3328]
    - [260, 12.88]
  - - [3584, 1408, 1, 1280]
    - [261, 71.134]
  - - [64, 4288, 1, 3328]
    - [206, 33.671]
  - - [5056, 6784, 1, 3328]
    - [65, 94.039]
  - - [128, 2944, 1, 256]
    - [262, 8.908]
  - - [128, 6784, 1, 128]
    - [48, 11.025]
  - - [3584, 4288, 1, 256]
    - [63, 53.583]
  - - [448, 1856, 1, 256]
    - [46, 17.595]
  - - [1856, 6784, 1, 3328]
    - [29, 91.401]
  - - [3584, 128, 1, 3328]
    - [263, 55.863]
  - - [64, 1856, 1, 256]
    - [146, 3.892]
  - - [64, 448, 1, 256]
    - [117, 0.944]
  - - [5888, 4288, 1, 256]
    - [251, 61.575]
  - - [4, 448, 1, 128]
    - [49, 0.03]
  - - [5056, 1408, 1, 256]
    - [104, 47.61]
  - - [35, 8457, 1, 2048]
    - [264, 19.102]
  - - [64, 256, 1, 1280]
    - [250, 2.057]
  - - [3584, 1024, 1, 256]
    - [22, 43.206]
  - - [256, 704, 1, 256]
    - [49, 5.429]
  - - [5888, 5888, 1, 256]
    - [14, 68.474]
  - - [4288, 1024, 1, 1280]
    - [104, 70.803]
  - - [5888, 128, 1, 3328]
    - [103, 47.172]
  - - [448, 6784, 1, 3328]
    - [243, 79.422]
  - - [2944, 1408, 1, 1280]
    - [265, 67.759]
  - - [64, 128, 1, 1280]
    - [266, 1.025]
  - - [2944, 1856, 1, 3328]
    - [267, 84.997]
  - - [2368, 64, 1, 128]
    - [49, 2.417]
  - - [256, 1024, 1, 128]
    - [268, 4.168]
  - - [3584, 5888, 1, 1280]
    - [129, 85.839]
  - - [64, 4, 1, 128]
    - [69, 0.004]
  - - [6784, 1856, 1, 1280]
    - [191, 79.845]
  - - [2944, 5056, 1, 256]
    - [29, 56.142]
  - - [4288, 4, 1, 128]
    - [155, 0.304]
  - - [5888, 256, 1, 3328]
    - [233, 64.085]
  - - [2944, 4288, 1, 128]
    - [89, 34.847]
  - - [3584, 1408, 1, 256]
    - [152, 45.865]
  - - [704, 3584, 1, 3328]
    - [65, 74.64]
  - - [4096, 3200, 1, 1024]
    - [50, 77.254]
  - - [5056, 448, 1, 1280]
    - [265, 55.087]
  - - [3584, 1856, 1, 3328]
    - [16, 86.652]
  - - [4288, 6784, 1, 1280]
    - [189, 88.248]
  - - [2560, 7000, 1, 2560]
    - [144, 88.043]
  - - [1408, 704, 1, 1280]
    - [269, 44.15]
  - - [2944, 1024, 1, 256]
    - [29, 37.641]
  - - [6784, 64, 1, 256]
    - [122, 10.093]
  - - [2368, 4288, 1, 3328]
    - [65, 86.537]
  - - [4, 1408, 1, 256]
    - [76, 0.151]
  - - [1024, 1408, 1, 1280]
    - [265, 57.295]
  - - [64, 64, 1, 256]
    - [257, 0.129]
  - - [704, 256, 1, 3328]
    - [270, 29.407]
  - - [6784, 5056, 1, 256]
    - [22, 65.103]
  - - [1856, 1856, 1, 128]
    - [48, 26.401]
  - - [3584, 5056, 1, 3328]
    - [12, 90.706]
  - - [448, 6784, 1, 128]
    - [48, 25.37]
  - - [4, 704, 1, 3328]
    - [220, 0.897]
  - - [35, 8457, 1, 4096]
    - [271, 22.061]
  - - [448, 2944, 1, 256]
    - [77, 23.963]
  - - [4, 4288, 1, 3328]
    - [33, 3.048]
  - - [2944, 6784, 1, 256]
    - [14, 61.377]
  - - [2944, 2944, 1, 128]
    - [21, 35.291]
  - - [4, 4, 1, 1280]
    - [272, 0.002]
  - - [1856, 3584, 1, 1280]
    - [273, 77.693]
  - - [64, 2944, 1, 256]
    - [49, 5.528]
  - - [448, 256, 1, 128]
    - [118, 1.937]
  - - [4288, 448, 1, 128]
    - [152, 19.468]
  - - [4608, 24000, 1, 1536]
    - [147, 93.731]
  - - [1856, 1408, 1, 3328]
    - [63, 77.275]
  - - [128, 128, 1, 128]
    - [252, 0.283]
  - - [1024, 4288, 1, 3328]
    - [62, 87.202]
  - - [448, 2368, 1, 256]
    - [44, 21.946]
  - - [1024, 4, 1, 128]
    - [137, 0.074]
  - - [64, 1408, 1, 1280]
    - [242, 10.062]
  - - [64, 6784, 1, 1280]
    - [274, 38.414]
  - - [5056, 448, 1, 256]
    - [152, 34.359]
  - - [2944, 2368, 1, 3328]
    - [82, 84.478]
  - - [704, 4288, 1, 3328]
    - [275, 78.52]
  - - [1408, 128, 1, 256]
    - [276, 5.366]
  - - [1024, 1856, 1, 1280]
    - [63, 60.171]
  - - [2048, 6400, 1, 2048]
    - [62, 87.3]
  - - [512, 48000, 1, 2816]
    - [138, 93.273]
  - - [5124, 9124, 1, 2560]
    - [65, 91.559]
  - - [128, 2368, 1, 3328]
    - [277, 38.575]
  - - [1024, 5888, 1, 256]
    - [205, 48.566]
  - - [64, 2944, 1, 1280]
    - [107, 16.632]
  - - [5056, 64, 1, 3328]
    - [278, 41.385]
  - - [128, 704, 1, 128]
    - [34, 1.514]
  - - [1408, 2368, 1, 256]
    - [224, 38.131]
  - - [1408, 1408, 1, 256]
    - [89, 30.913]
  - - [4, 64, 1, 128]
    - [279, 0.005]
  - - [64, 1024, 1, 128]
    - [69, 1.243]
  - - [1024, 8, 1, 500000]
    - [239, 6.686]
  - - [2368, 2368, 1, 128]
    - [48, 33.217]
  - - [64, 5888, 1, 128]
    - [49, 5.903]
  - - [5888, 4, 1, 3328]
    - [127, 3.29]
  - - [6784, 1408, 1, 128]
    - [129, 34.743]
  - - [4288, 5888, 1, 256]
    - [12, 62.848]
  - - [1408, 5056, 1, 256]
    - [116, 45.201]
  - - [5056, 128, 1, 3328]
    - [159, 41.125]
  - - [128, 128, 1, 1280]
    - [257, 1.938]
  - - [448, 704, 1, 256]
    - [48, 8.994]
  - - [4288, 3584, 1, 128]
    - [171, 37.261]
  - - [2944, 128, 1, 3328]
    - [150, 46.957]
  - - [64, 1408, 1, 3328]
    - [280, 18.368]
  - - [3584, 5056, 1, 1280]
    - [16, 83.715]
  - - [256, 448, 1, 1280]
    - [95, 13.613]
  - - [704, 704, 1, 128]
    - [86, 6.936]
  - - [5056, 4, 1, 128]
    - [213, 0.361]
  - - [704, 256, 1, 1280]
    - [37, 17.534]
  - - [64, 2368, 1, 3328]
    - [162, 25.146]
  - - [1856, 1024, 1, 128]
    - [46, 20.565]
  - - [1856, 64, 1, 128]
    - [280, 2.216]
  - - [4096, 64, 1, 4096]
    - [119, 36.884]
  - - [1024, 24000, 1, 1536]
    - [202, 88.596]
  - - [704, 4288, 1, 256]
    - [156, 37.597]
  - - [5888, 2368, 1, 1280]
    - [57, 80.187]
  - - [128, 256, 1, 256]
    - [281, 1.024]
  - - [64, 128, 1, 256]
    - [33, 0.26]
  - - [2368, 5888, 1, 1280]
    - [29, 83.124]
  - - [5888, 256, 1, 1280]
    - [8, 55.548]
  - - [1760, 128, 1, 1760]
    - [276, 25.472]
  - - [4, 5888, 1, 1280]
    - [69, 2.159]
  - - [704, 128, 1, 128]
    - [94, 1.511]
  - - [1024, 4, 1, 1280]
    - [257, 0.547]
  - - [2368, 1856, 1, 3328]
    - [112, 83.681]
  - - [2368, 128, 1, 128]
    - [226, 4.685]
  - - [2944, 704, 1, 256]
    - [43, 28.699]
  - - [5056, 128, 1, 128]
    - [46, 8.86]
  - - [2368, 1024, 1, 3328]
    - [15, 77.811]
  - - [256, 704, 1, 3328]
    - [5, 28.688]
  - - [704, 3584, 1, 256]
    - [176, 32.015]
  - - [704, 2944, 1, 3328]
    - [60, 75.177]
  - - [6784, 1024, 1, 128]
    - [282, 35.293]
  - - [256, 448, 1, 128]
    - [146, 2.006]
  - - [448, 1024, 1, 3328]
    - [89, 56.927]
  - - [2944, 1024, 1, 3328]
    - [18, 78.66]
  - - [2944, 5056, 1, 128]
    - [283, 35.402]
  - - [2368, 256, 1, 256]
    - [219, 14.009]
  - - [1408, 6784, 1, 256]
    - [46, 46.361]
  - - [6784, 1408, 1, 3328]
    - [129, 89.743]
  - - [4288, 6784, 1, 128]
    - [271, 45.914]
  - - [704, 64, 1, 256]
    - [117, 1.391]
  - - [5888, 4, 1, 1280]
    - [110, 2.086]
  - - [256, 2368, 1, 3328]
    - [48, 38.593]
  - - [6784, 2944, 1, 1280]
    - [29, 86.117]
  - - [4288, 1856, 1, 128]
    - [48, 33.741]
  - - [1856, 2944, 1, 128]
    - [48, 34.021]
  - - [6784, 448, 1, 128]
    - [103, 24.981]
  - - [64, 3584, 1, 128]
    - [158, 3.384]
  - - [448, 5056, 1, 1280]
    - [46, 54.854]
  - - [2368, 1856, 1, 128]
    - [46, 29.299]
  - - [64, 2944, 1, 3328]
    - [56, 29.12]
  - - [4288, 704, 1, 256]
    - [171, 36.77]
  - - [256, 3584, 1, 128]
    - [284, 11.103]
  - - [5888, 704, 1, 256]
    - [48, 38.761]
  - - [3584, 1024, 1, 128]
    - [285, 28.707]
  - - [256, 5888, 1, 3328]
    - [104, 63.149]
  - - [1408, 4288, 1, 3328]
    - [286, 81.775]
  - - [6784, 4288, 1, 256]
    - [147, 63.765]
  - - [4288, 256, 1, 128]
    - [287, 11.677]
  - - [5888, 256, 1, 256]
    - [170, 24.792]
  - - [6784, 1024, 1, 1280]
    - [57, 72.343]
  - - [5888, 1024, 1, 128]
    - [46, 33.019]
  - - [1024, 128, 1, 256]
    - [253, 3.267]
  - - [512, 16, 1, 500000]
    - [239, 12.318]
  - - [128, 64, 1, 3328]
    - [272, 2.51]
  - - [448, 64, 1, 256]
    - [212, 0.931]
  - - [2368, 256, 1, 128]
    - [46, 8.692]
  - - [6784, 3584, 1, 1280]
    - [63, 87.889]
  - - [1024, 6784, 1, 1280]
    - [9, 76.778]
  - - [2944, 64, 1, 1280]
    - [79, 17.062]
  - - [1408, 2944, 1, 1280]
    - [18, 69.094]
  - - [256, 1856, 1, 256]
    - [5, 13.183]
  - - [2048, 800, 1, 2048]
    - [29, 63.409]
  - - [1408, 2368, 1, 3328]
    - [43, 79.191]
  - - [2944, 4, 1, 3328]
    - [288, 2.407]
  - - [128, 1408, 1, 3328]
    - [56, 31.011]
  - - [2944, 1856, 1, 128]
    - [43, 32.488]
  - - [256, 2944, 1, 128]
    - [46, 9.892]
  - - [256, 6784, 1, 128]
    - [46, 18.221]
  - - [2368, 4, 1, 128]
    - [289, 0.145]
  - - [1408, 256, 1, 3328]
    - [21, 45.961]
  - - [1856, 4, 1, 128]
    - [58, 0.134]
  - - [5056, 6784, 1, 128]
    - [205, 47.641]
  - - [4288, 5056, 1, 128]
    - [46, 42.464]
  - - [1856, 5888, 1, 128]
    - [46, 37.371]
  - - [2944, 5888, 1, 256]
    - [92, 56.68]
  - - [3584, 1856, 1, 256]
    - [23, 47.983]
  - - [4288, 3584, 1, 1280]
    - [65, 83.859]
  - - [2368, 448, 1, 256]
    - [48, 20.134]
  - - [4288, 256, 1, 3328]
    - [290, 66.173]
  - - [1856, 704, 1, 128]
    - [46, 15.91]
  - - [1408, 64, 1, 256]
    - [69, 2.987]
  - - [64, 1856, 1, 128]
    - [280, 2.255]
  - - [4, 256, 1, 128]
    - [108, 0.017]
  - - [2560, 16, 1, 2560]
    - [90, 6.366]
  - - [704, 5888, 1, 128]
    - [47, 27.261]
  - - [6784, 3584, 1, 128]
    - [22, 42.433]
  - - [1024, 64, 1, 256]
    - [291, 2.055]
  - - [64, 2368, 1, 256]
    - [212, 5.08]
  - - [4288, 5056, 1, 3328]
    - [18, 90.548]
  - - [4, 1856, 1, 1280]
    - [292, 0.742]
  - - [4288, 128, 1, 128]
    - [46, 7.727]
  - - [1408, 1408, 1, 128]
    - [112, 21.018]
  - - [7680, 16, 1, 2560]
    - [69, 14.729]
  - - [1856, 128, 1, 128]
    - [45, 3.565]
  - - [5056, 2368, 1, 256]
    - [92, 47.958]
  - - [4288, 704, 1, 3328]
    - [293, 78.76]
  - - [448, 3584, 1, 256]
    - [294, 25.302]
  - - [2368, 64, 1, 1280]
    - [108, 17.009]
  - - [2368, 1024, 1, 1280]
    - [262, 59.604]
  - - [2944, 1408, 1, 3328]
    - [190, 82.972]
  - - [1408, 448, 1, 256]
    - [48, 14.61]
  - - [1024, 1408, 1, 3328]
    - [186, 70.385]
  - - [2944, 5888, 1, 1280]
    - [92, 85.231]
  - - [1408, 4, 1, 1280]
    - [295, 0.773]
  - - [5888, 3584, 1, 256]
    - [296, 56.111]
  - - [2368, 5056, 1, 128]
    - [46, 37.602]
  - - [1408, 1856, 1, 3328]
    - [115, 75.315]
  - - [4, 4, 1, 3328]
    - [297, 0.005]
  - - [6784, 1408, 1, 1280]
    - [138, 81.397]
  - - [4096, 7000, 1, 4096]
    - [22, 92.209]
  - - [704, 2944, 1, 256]
    - [298, 27.732]
  - - [4288, 64, 1, 256]
    - [48, 7.399]
  - - [6784, 5888, 1, 3328]
    - [29, 93.908]
  - - [2368, 4288, 1, 128]
    - [48, 35.763]
  - - [64, 4288, 1, 1280]
    - [87, 24.688]
  - - [6784, 64, 1, 1280]
    - [45, 38.264]
  - - [3584, 128, 1, 128]
    - [49, 7.074]
  - - [1024, 6784, 1, 128]
    - [47, 31.977]
  - - [4, 1856, 1, 128]
    - [164, 0.149]
  - - [1408, 64, 1, 3328]
    - [76, 18.206]
  - - [6784, 4, 1, 256]
    - [212, 0.866]
  - - [1408, 1408, 1, 1280]
    - [299, 59.244]
  - - [16384, 400, 1, 4096]
    - [11, 73.991]
  - - [256, 2368, 1, 256]
    - [300, 12.559]
  - - [448, 4288, 1, 3328]
    - [16, 80.151]
  - - [2368, 1408, 1, 256]
    - [152, 39.261]
  - - [5888, 5056, 1, 128]
    - [301, 47.187]
  - - [704, 2368, 1, 256]
    - [46, 25.373]
  - - [1024, 24000, 1, 2560]
    - [114, 91.704]
  - - [2944, 448, 1, 1280]
    - [302, 50.448]
  - - [5888, 2368, 1, 3328]
    - [18, 88.769]
  - - [5124, 9124, 1, 1760]
    - [29, 91.425]
  - - [448, 1408, 1, 1280]
    - [71, 37.201]
  - - [448, 1856, 1, 1280]
    - [303, 49.171]
  - - [4288, 448, 1, 1280]
    - [112, 67.116]
  - - [5888, 704, 1, 3328]
    - [15, 79.214]
  - - [5056, 256, 1, 128]
    - [48, 16.033]
  - - [1856, 256, 1, 128]
    - [304, 7.51]
  - - [64, 1408, 1, 128]
    - [58, 1.537]
  - - [704, 4, 1, 256]
    - [305, 0.087]
  - - [1408, 5888, 1, 128]
    - [89, 33.78]
  - - [7680, 12000, 1, 2560]
    - [88, 94.446]
  - - [1408, 1024, 1, 256]
    - [152, 28.562]
  - - [8192, 400, 1, 2048]
    - [83, 65.803]
  - - [1024, 1856, 1, 128]
    - [46, 18.972]
  - - [256, 704, 1, 128]
    - [155, 3.122]
  - - [2560, 128, 1, 2560]
    - [278, 37.044]
  - - [448, 1024, 1, 256]
    - [46, 11.176]
  - - [128, 4, 1, 3328]
    - [306, 0.153]
  - - [5056, 6784, 1, 1280]
    - [29, 89.642]
  - - [1408, 64, 1, 128]
    - [307, 1.517]
  - - [1024, 448, 1, 1280]
    - [21, 40.365]
  - - [704, 5056, 1, 3328]
    - [16, 79.68]
  - - [128, 5056, 1, 256]
    - [48, 13.048]
  - - [64, 1024, 1, 3328]
    - [288, 13.075]
  - - [1856, 4, 1, 3328]
    - [308, 1.734]
  - - [4, 2944, 1, 128]
    - [242, 0.18]
  - - [2368, 2944, 1, 3328]
    - [246, 85.51]
  - - [448, 448, 1, 1280]
    - [31, 19.45]
  - - [2368, 3584, 1, 256]
    - [63, 46.018]
  - - [5056, 3584, 1, 1280]
    - [251, 84.332]
  - - [5124, 9124, 1, 4096]
    - [22, 92.727]
  - - [7680, 48000, 1, 2560]
    - [186, 96.293]
  - - [448, 4, 1, 3328]
    - [52, 0.551]
  - - [1856, 2944, 1, 1280]
    - [12, 75.24]
  - - [1024, 48000, 1, 2816]
    - [22, 94.644]
  - - [128, 1024, 1, 256]
    - [118, 4.061]
  - - [2944, 1408, 1, 256]
    - [187, 39.56]
  - - [4288, 1408, 1, 3328]
    - [22, 81.476]
  - - [3584, 64, 1, 3328]
    - [5, 32.784]
  - - [5888, 2944, 1, 128]
    - [309, 40.747]
  - - [2944, 1024, 1, 128]
    - [46, 23.923]
  - - [4288, 5056, 1, 1280]
    - [8, 84.597]
  - - [5888, 6784, 1, 1280]
    - [271, 89.144]
  - - [6784, 5056, 1, 128]
    - [282, 46.134]
  - - [256, 1024, 1, 3328]
    - [183, 34.298]
  - - [3584, 4, 1, 256]
    - [196, 0.463]
  - - [1760, 1600, 1, 1760]
    - [310, 74.809]
  - - [1856, 64, 1, 3328]
    - [117, 22.799]
  - - [4, 128, 1, 3328]
    - [220, 0.154]
  - - [5888, 1408, 1, 3328]
    - [202, 84.615]
  - - [448, 2944, 1, 128]
    - [48, 15.809]
  - - [2368, 1856, 1, 256]
    - [81, 44.761]
  - - [256, 5056, 1, 256]
    - [152, 25.535]
  - - [128, 3584, 1, 128]
    - [311, 6.988]
  - - [448, 3584, 1, 3328]
    - [233, 66.805]
  - - [4, 5056, 1, 3328]
    - [33, 3.254]
  - - [704, 2368, 1, 128]
    - [303, 17.054]
  - - [5888, 256, 1, 128]
    - [89, 17.284]
  - - [4, 5056, 1, 128]
    - [312, 0.331]
  - - [448, 256, 1, 256]
    - [279, 3.319]
  - - [704, 4, 1, 3328]
    - [220, 0.783]
  - - [1408, 256, 1, 256]
    - [80, 9.827]
  - - [3584, 1856, 1, 128]
    - [171, 35.269]
  - - [4288, 4288, 1, 128]
    - [12, 38.14]
  - - [1856, 1024, 1, 3328]
    - [14, 79.576]
  - - [128, 5888, 1, 3328]
    - [48, 47.264]
  - - [1024, 5056, 1, 256]
    - [15, 46.756]
  - - [5888, 5888, 1, 1280]
    - [189, 89.061]
  - - [5056, 5888, 1, 128]
    - [129, 47.622]
  - - [2368, 1408, 1, 3328]
    - [89, 79.201]
  - - [1024, 48000, 1, 1536]
    - [29, 91.32]
  - - [5888, 448, 1, 256]
    - [46, 31.993]
  - - [2560, 3200, 1, 2560]
    - [55, 83.42]
  - - [5888, 6784, 1, 128]
    - [313, 49.448]
  - - [6144, 48000, 1, 2048]
    - [78, 95.08]
  - - [6784, 5056, 1, 1280]
    - [63, 87.848]
  - - [5056, 704, 1, 1280]
    - [314, 62.699]
  - - [1024, 48000, 1, 2560]
    - [14, 93.846]
  - - [4608, 32, 1, 1536]
    - [31, 14.843]
  - - [1024, 2368, 1, 128]
    - [265, 22.245]
  - - [128, 704, 1, 256]
    - [74, 2.996]
  - - [2368, 448, 1, 3328]
    - [315, 58.727]
  - - [128, 5888, 1, 1280]
    - [245, 41.306]
  - - [16384, 800, 1, 4096]
    - [191, 84.362]
  - - [448, 128, 1, 1280]
    - [212, 5.778]
  - - [6784, 4, 1, 3328]
    - [216, 3.52]
  - - [5888, 5056, 1, 1280]
    - [22, 87.552]
  - - [1024, 64, 1, 3328]
    - [280, 13.362]
  - - [3072, 48000, 1, 1024]
    - [186, 91.65]
  - - [64, 3584, 1, 1280]
    - [56, 23.31]
  - - [6784, 1408, 1, 256]
    - [231, 45.137]
  - - [3584, 5888, 1, 128]
    - [48, 41.357]
  - - [5056, 5888, 1, 256]
    - [63, 65.859]
  - - [2368, 1024, 1, 256]
    - [171, 32.888]
  - - [2944, 1856, 1, 256]
    - [152, 47.932]
  - - [1856, 6784, 1, 1280]
    - [12, 84.889]
  - - [64, 5056, 1, 128]
    - [96, 4.918]
  - - [64, 6784, 1, 128]
    - [48, 6.894]
  - - [448, 704, 1, 128]
    - [49, 4.979]
  - - [4, 1024, 1, 128]
    - [279, 0.074]
  - - [4288, 3584, 1, 256]
    - [14, 55.263]
  - - [1408, 704, 1, 128]
    - [48, 12.446]
  - - [64, 256, 1, 3328]
    - [316, 4.457]
  - - [6784, 448, 1, 3328]
    - [135, 77.989]
  - - [5056, 1856, 1, 1280]
    - [271, 79.828]
  - - [1408, 1024, 1, 3328]
    - [304, 73.317]
  - - [2368, 256, 1, 3328]
    - [92, 44.427]
  - - [5888, 3584, 1, 1280]
    - [189, 85.913]
  - - [1856, 3584, 1, 3328]
    - [65, 87.416]
  - - [5888, 128, 1, 1280]
    - [149, 46.19]
  - - [1024, 2944, 1, 256]
    - [29, 36.554]
  - - [448, 6784, 1, 1280]
    - [194, 61.168]
  - - [256, 3584, 1, 1280]
    - [96, 49.643]
  - - [704, 5056, 1, 256]
    - [44, 35.926]
  - - [3584, 1024, 1, 3328]
    - [170, 81.551]
  - - [2944, 1856, 1, 1280]
    - [261, 76.281]
  - - [128, 256, 1, 128]
    - [94, 0.604]
  - - [5056, 256, 1, 256]
    - [46, 23.315]
  - - [2944, 4288, 1, 3328]
    - [149, 89.684]
  - - [2368, 3584, 1, 3328]
    - [29, 86.681]
  - - [2944, 704, 1, 1280]
    - [317, 63.443]
  - - [128, 4, 1, 256]
    - [280, 0.017]
  - - [2944, 3584, 1, 1280]
    - [65, 81.771]
  - - [1856, 5888, 1, 1280]
    - [14, 80.205]
  - - [256, 256, 1, 1280]
    - [111, 8.134]
  - - [2048, 3200, 1, 2048]
    - [23, 81.057]
  - - [4288, 1408, 1, 256]
    - [22, 50.478]
  - - [3584, 64, 1, 256]
    - [79, 7.024]
  - - [64, 1856, 1, 3328]
    - [253, 22.989]
  - - [256, 1408, 1, 128]
    - [318, 6.033]
  - - [5888, 1408, 1, 128]
    - [178, 34.285]
  - - [4288, 2368, 1, 1280]
    - [22, 78.823]
  - - [4, 4288, 1, 256]
    - [127, 0.576]
  - - [256, 4288, 1, 128]
    - [217, 12.701]
  - - [2048, 128, 1, 2048]
    - [21, 29.037]
  - - [256, 128, 1, 3328]
    - [319, 7.999]
  - - [512, 8, 1, 500000]
    - [239, 6.462]
  - - [6784, 2368, 1, 256]
    - [190, 52.445]
  - - [5888, 128, 1, 128]
    - [99, 10.446]
  - - [1024, 24000, 1, 2816]
    - [30, 92.242]
  - - [7680, 5984, 1, 2560]
    - [22, 93.562]
  - - [4288, 1856, 1, 256]
    - [105, 45.002]
  - - [1856, 256, 1, 3328]
    - [122, 56.565]
  - - [1856, 2944, 1, 256]
    - [29, 47.408]
  - - [5056, 1024, 1, 128]
    - [48, 32.633]
  - - [64, 5888, 1, 1280]
    - [87, 28.913]
  - - [1760, 800, 1, 1760]
    - [320, 46.847]
  - - [6784, 256, 1, 128]
    - [46, 18.974]
  - - [5888, 704, 1, 128]
    - [103, 28.455]
  - - [1408, 2368, 1, 128]
    - [48, 27.344]
  - - [1024, 4288, 1, 1280]
    - [321, 71.425]
  - - [2368, 5056, 1, 3328]
    - [285, 86.678]
  - - [448, 4, 1, 128]
    - [94, 0.034]
  - - [4, 256, 1, 3328]
    - [322, 0.321]
  - - [4288, 1024, 1, 3328]
    - [317, 82.281]
  - - [6144, 48000, 1, 2560]
    - [88, 96.195]
  - - [1024, 5056, 1, 3328]
    - [18, 82.435]
  - - [1024, 1856, 1, 3328]
    - [123, 79.409]
  - - [704, 704, 1, 1280]
    - [323, 29.431]
  - - [128, 2368, 1, 1280]
    - [324, 27.08]
  - - [1408, 128, 1, 3328]
    - [217, 27.547]
  - - [3584, 256, 1, 1280]
    - [112, 49.738]
  - - [4, 128, 1, 128]
    - [252, 0.009]
  - - [5888, 64, 1, 1280]
    - [119, 33.663]
  - - [3584, 128, 1, 1280]
    - [277, 38.593]
  - - [4, 256, 1, 1280]
    - [272, 0.142]
  - - [128, 704, 1, 3328]
    - [95, 17.951]
  - - [4288, 6784, 1, 256]
    - [14, 66.841]
  - - [3584, 2944, 1, 3328]
    - [22, 90.155]
  - - [128, 1856, 1, 256]
    - [276, 7.922]
  - - [64, 4288, 1, 256]
    - [325, 6.768]
  - - [4, 3584, 1, 3328]
    - [326, 2.592]
  - - [64, 4, 1, 3328]
    - [272, 0.079]
  - - [4, 64, 1, 3328]
    - [327, 0.081]
  - - [5888, 2944, 1, 256]
    - [22, 56.704]
  - - [1856, 64, 1, 256]
    - [253, 3.568]
  - - [5056, 128, 1, 1280]
    - [217, 35.293]
  - - [448, 4288, 1, 1280]
    - [328, 64.981]
  - - [448, 1856, 1, 3328]
    - [63, 59.2]
  - - [1024, 4288, 1, 128]
    - [48, 30.368]
  - - [4, 1024, 1, 256]
    - [329, 0.127]
  - - [5056, 4288, 1, 256]
    - [186, 58.856]
  - - [1024, 448, 1, 256]
    - [15, 11.969]
  - - [1024, 3584, 1, 256]
    - [63, 39.838]
  - - [2944, 128, 1, 1280]
    - [278, 29.285]
  - - [2048, 32, 1, 2048]
    - [90, 9.129]
  - - [64, 256, 1, 256]
    - [74, 0.549]
  - - [1408, 4, 1, 128]
    - [33, 0.107]
  - - [128, 2368, 1, 128]
    - [145, 4.814]
  - - [256, 704, 1, 1280]
    - [165, 20.433]
  - - [64, 2368, 1, 128]
    - [74, 2.524]
  - - [6784, 6784, 1, 3328]
    - [14, 94.445]
  - - [448, 5888, 1, 1280]
    - [136, 61.094]
  - - [5056, 448, 1, 128]
    - [46, 21.876]
  - - [4288, 704, 1, 1280]
    - [330, 58.918]
  - - [3584, 2944, 1, 128]
    - [46, 36.401]
  - - [6784, 256, 1, 1280]
    - [65, 61.427]
  - - [256, 2944, 1, 1280]
    - [103, 42.31]
  - - [64, 4288, 1, 128]
    - [146, 4.604]
  - - [2368, 5888, 1, 3328]
    - [243, 89.167]
  - - [4, 64, 1, 256]
    - [331, 0.008]
  - - [704, 1024, 1, 3328]
    - [209, 48.922]
  - - [2368, 1856, 1, 1280]
    - [148, 71.937]
  - - [448, 5056, 1, 3328]
    - [303, 72.932]
  - - [128, 448, 1, 128]
    - [332, 0.966]
  - - [128, 6784, 1, 256]
    - [333, 19.69]
  - - [3584, 4288, 1, 128]
    - [46, 36.833]
  - - [64, 448, 1, 128]
    - [37, 0.481]
  - - [5888, 4288, 1, 3328]
    - [267, 92.116]
  - - [2368, 704, 1, 256]
    - [314, 25.998]
  - - [256, 1856, 1, 3328]
    - [237, 47.873]
  - - [1856, 128, 1, 256]
    - [334, 7.018]
  - - [6784, 128, 1, 128]
    - [195, 10.779]
  - - [3584, 1408, 1, 128]
    - [171, 32.65]
  - - [1856, 5056, 1, 1280]
    - [98, 80.115]
  - - [2944, 1024, 1, 1280]
    - [335, 58.543]
  - - [5056, 4, 1, 256]
    - [69, 0.685]
  - - [3584, 5888, 1, 3328]
    - [65, 91.576]
  - - [2368, 4288, 1, 256]
    - [98, 51.17]
  - - [1024, 2368, 1, 3328]
    - [225, 80.146]
  - - [64, 704, 1, 3328]
    - [288, 9.487]
  - - [704, 1408, 1, 256]
    - [47, 18.322]
  - - [4096, 128, 1, 4096]
    - [336, 39.782]
  - - [1024, 3584, 1, 1280]
    - [337, 70.576]
  - - [4288, 5888, 1, 3328]
    - [22, 93.228]
  - - [4288, 4, 1, 1280]
    - [212, 1.696]
  - - [4608, 16, 1, 1536]
    - [127, 7.56]
  - - [5888, 64, 1, 128]
    - [49, 5.696]
  - - [4, 5888, 1, 128]
    - [258, 0.422]
  - - [1024, 2944, 1, 3328]
    - [27, 77.474]
  - - [6784, 1856, 1, 256]
    - [27, 48.249]
  - - [2048, 64, 1, 2048]
    - [84, 17.23]
  - - [256, 6784, 1, 1280]
    - [271, 58.116]
  - - [1856, 3584, 1, 256]
    - [20, 44.952]
  - - [128, 448, 1, 3328]
    - [338, 12.615]
  - - [6784, 1856, 1, 128]
    - [50, 30.511]
  - - [4, 448, 1, 256]
    - [339, 0.05]
  - - [5056, 128, 1, 256]
    - [16, 15.463]
  - - [512, 24000, 1, 2816]
    - [30, 91.375]
  - - [256, 5888, 1, 1280]
    - [48, 46.739]
  - - [4, 128, 1, 1280]
    - [38, 0.059]
  - - [16384, 1600, 1, 4096]
    - [340, 91.433]
  - - [6784, 128, 1, 1280]
    - [245, 51.26]
  - - [64, 1408, 1, 256]
    - [341, 3.027]
  - - [2368, 1408, 1, 128]
    - [89, 26.474]
  - - [1856, 448, 1, 256]
    - [71, 19.551]
  - - [1408, 1024, 1, 128]
    - [46, 17.166]
  - - [128, 64, 1, 128]
    - [33, 0.142]
  - - [6784, 3584, 1, 3328]
    - [22, 93.338]
  - - [1760, 7000, 1, 1760]
    - [104, 85.948]
  - - [2944, 64, 1, 3328]
    - [230, 31.172]
  - - [64, 64, 1, 128]
    - [342, 0.07]
  - - [2368, 5056, 1, 1280]
    - [152, 80.81]
  - - [64, 4, 1, 1280]
    - [343, 0.03]
  - - [1408, 2368, 1, 1280]
    - [15, 62.843]
  - - [128, 1408, 1, 1280]
    - [108, 16.111]
  - - [256, 64, 1, 3328]
    - [331, 4.513]
  - - [704, 4288, 1, 128]
    - [106, 23.273]
  - - [128, 1856, 1, 3328]
    - [56, 36.14]
  - - [2944, 2944, 1, 256]
    - [344, 41.464]
  - - [2944, 4, 1, 1280]
    - [345, 1.23]
  - - [5888, 4, 1, 256]
    - [74, 0.768]
  - - [6784, 256, 1, 256]
    - [328, 30.65]
  - - [256, 5056, 1, 3328]
    - [346, 63.952]
  - - [128, 4288, 1, 1280]
    - [112, 31.529]
  - - [5056, 1856, 1, 128]
    - [48, 34.864]
  - - [5056, 1024, 1, 3328]
    - [159, 81.089]
  - - [128, 128, 1, 256]
    - [127, 0.568]
  - - [1760, 64, 1, 1760]
    - [117, 14.998]
  - - [4288, 3584, 1, 3328]
    - [29, 91.205]
  - - [448, 704, 1, 3328]
    - [122, 43.189]
  - - [448, 448, 1, 128]
    - [118, 3.4]
  - - [1024, 2368, 1, 1280]
    - [22, 56.506]
  - - [1856, 704, 1, 3328]
    - [278, 65.736]
  - - [4, 2368, 1, 128]
    - [33, 0.169]
  - - [5888, 6784, 1, 3328]
    - [22, 94.328]
  - - [704, 4288, 1, 1280]
    - [42, 58.645]
  - - [704, 256, 1, 256]
    - [49, 5.299]
  - - [1024, 48000, 1, 2048]
    - [68, 92.241]
  - - [4288, 1024, 1, 128]
    - [103, 30.27]
  - - [256, 64, 1, 3136]
    - [347, 4.353]
  - - [256, 1024, 1, 196]
    - [348, 6.07]
  - - [1024, 1024, 1, 3328]
    - [125, 52.972]
  - - [2048, 200, 1, 3200]
    - [349, 40.676]
  - - [1024, 200, 1, 13312]
    - [311, 39.209]
  - - [1024, 256, 1, 1536]
    - [237, 24.442]
  - - [4096, 256, 1, 12288]
    - [121, 79.053]
  - - [64, 200, 1, 1024]
    - [295, 1.284]
  - - [32, 512, 1, 1024]
    - [266, 1.624]
  - - [2048, 256, 1, 3328]
    - [262, 39.846]
  - - [4096, 512, 1, 32]
    - [46, 6.682]
  - - [2048, 256, 1, 13312]
    - [350, 53.776]
  - - [4096, 200, 1, 11264]
    - [351, 62.103]
  - - [2048, 512, 1, 1024]
    - [135, 41.765]
  - - [2048, 1024, 1, 1664]
    - [352, 63.3]
  - - [1024, 1024, 1, 64]
    - [353, 7.004]
  - - [512, 1024, 1, 1536]
    - [15, 32.652]
  - - [1024, 256, 1, 15360]
    - [354, 50.18]
  - - [1, 512, 1, 1024]
    - [39, 0.058]
  - - [4096, 512, 1, 1408]
    - [48, 54.373]
  - - [1024, 200, 1, 1408]
    - [79, 19.196]
  - - [1024, 512, 1, 512]
    - [120, 19.886]
  - - [4096, 256, 1, 15360]
    - [173, 79.141]
  - - [2048, 512, 1, 640]
    - [48, 33.793]
  - - [4096, 1024, 1, 1280]
    - [144, 69.81]
  - - [1024, 200, 1, 6144]
    - [84, 36.865]
  - - [1024, 1024, 1, 512]
    - [61, 32.395]
  - - [128, 512, 1, 2048]
    - [111, 8.559]
  - - [2048, 1024, 1, 640]
    - [210, 49.598]
  - - [1024, 256, 1, 3328]
    - [87, 33.138]
  - - [4096, 1024, 1, 13312]
    - [246, 90.921]
  - - [2048, 256, 1, 2048]
    - [205, 35.657]
  - - [2048, 1024, 1, 13312]
    - [210, 85.324]
  - - [2048, 512, 1, 16640]
    - [135, 80.514]
  - - [1024, 512, 1, 128]
    - [355, 6.968]
  - - [2048, 1024, 1, 3584]
    - [356, 74.433]
  - - [2048, 512, 1, 256]
    - [357, 22.724]
  - - [512, 256, 1, 3200]
    - [5, 22.03]
  - - [4096, 1024, 1, 1920]
    - [82, 78.081]
  - - [4096, 200, 1, 2560]
    - [210, 52.932]
  - - [1024, 256, 1, 16384]
    - [99, 41.647]
  - - [1024, 1024, 1, 1152]
    - [109, 43.644]
  - - [2048, 200, 1, 32]
    - [49, 1.74]
  - - [512, 1024, 1, 2816]
    - [205, 39.499]
  - - [4096, 256, 1, 14336]
    - [135, 79.13]
  - - [1024, 200, 1, 4608]
    - [165, 36.497]
  - - [1024, 200, 1, 16384]
    - [35, 36.951]
  - - [64, 256, 1, 1024]
    - [266, 1.742]
  - - [1, 200, 1, 1024]
    - [133, 0.022]
  - - [2048, 200, 1, 2080]
    - [162, 30.09]
  - - [512, 256, 1, 1792]
    - [108, 14.548]
  - - [2048, 200, 1, 1024]
    - [311, 24.689]
  - - [4096, 1024, 1, 12288]
    - [57, 90.128]
  - - [4096, 200, 1, 4096]
    - [352, 47.205]
  - - [1024, 512, 1, 11264]
    - [350, 51.097]
  - - [128, 512, 1, 1024]
    - [127, 6.558]
  - - [32, 256, 1, 2048]
    - [257, 1.58]
  - - [1024, 200, 1, 1792]
    - [165, 22.99]
  - - [1024, 1024, 1, 1792]
    - [15, 44.996]
  - - [32, 256, 1, 512]
    - [127, 0.513]
  - - [512, 200, 1, 2816]
    - [51, 16.982]
  - - [512, 200, 1, 3072]
    - [180, 18.581]
  - - [1024, 1024, 1, 8192]
    - [358, 61.732]
  - - [1024, 256, 1, 12288]
    - [359, 44.157]
  - - [4096, 200, 1, 768]
    - [165, 34.552]
  - - [1024, 512, 1, 16384]
    - [350, 57.443]
  - - [4096, 256, 1, 1024]
    - [351, 41.349]
  - - [1024, 512, 1, 256]
    - [328, 12.322]
  - - [4096, 1024, 1, 8320]
    - [62, 89.339]
  - - [4096, 256, 1, 9216]
    - [290, 76.833]
  - - [1024, 512, 1, 1408]
    - [112, 32.515]
  - - [1024, 512, 1, 5632]
    - [89, 43.754]
  - - [4096, 200, 1, 256]
    - [121, 15.574]
  - - [1024, 200, 1, 128]
    - [49, 3.568]
  - - [256, 200, 1, 1024]
    - [111, 4.418]
  - - [1024, 200, 1, 5120]
    - [31, 37.613]
  - - [512, 1024, 1, 3072]
    - [104, 39.511]
  - - [4096, 1024, 1, 15360]
    - [9, 90.791]
  - - [1, 256, 1, 2048]
    - [360, 0.049]
  - - [1024, 1024, 1, 4160]
    - [237, 55.976]
  - - [1024, 256, 1, 256]
    - [194, 6.333]
  - - [2048, 256, 1, 384]
    - [178, 15.686]
  - - [512, 256, 1, 2560]
    - [276, 19.03]
  - - [4096, 512, 1, 3072]
    - [352, 71.744]
  - - [1024, 256, 1, 4160]
    - [150, 37.696]
  - - [4096, 512, 1, 13312]
    - [210, 85.703]
  - - [4096, 1024, 1, 3840]
    - [102, 85.058]
  - - [4096, 200, 1, 640]
    - [73, 28.323]
  - - [32, 200, 1, 2048]
    - [38, 1.312]
  - - [1024, 200, 1, 512]
    - [49, 9.612]
  - - [1024, 1024, 1, 7168]
    - [9, 60.469]
  - - [2048, 1024, 1, 3200]
    - [210, 72.76]
  - - [512, 512, 1, 1536]
    - [77, 25.402]
  - - [4096, 256, 1, 768]
    - [317, 41.681]
  - - [2048, 256, 1, 6656]
    - [191, 44.395]
  - - [1024, 256, 1, 896]
    - [150, 20.143]
  - - [2048, 200, 1, 3072]
    - [41, 37.456]
  - - [128, 200, 1, 1024]
    - [361, 2.364]
  - - [4096, 512, 1, 3840]
    - [173, 76.633]
  - - [1024, 200, 1, 3200]
    - [226, 29.694]
  - - [4096, 512, 1, 5632]
    - [362, 76.834]
  - - [4096, 512, 1, 64]
    - [363, 11.471]
  - - [1024, 512, 1, 2816]
    - [234, 39.678]
  - - [4096, 256, 1, 7680]
    - [210, 73.175]
  - - [4096, 200, 1, 1024]
    - [290, 37.375]
  - - [1024, 512, 1, 12288]
    - [364, 50.23]
  - - [2048, 1024, 1, 512]
    - [43, 42.179]
  - - [128, 256, 1, 2048]
    - [192, 5.25]
  - - [2048, 200, 1, 1792]
    - [249, 33.664]
  - - [1024, 1024, 1, 2816]
    - [102, 49.012]
  - - [2048, 512, 1, 1536]
    - [315, 48.339]
  - - [4096, 256, 1, 3072]
    - [135, 58.667]
  - - [1024, 200, 1, 1536]
    - [311, 21.155]
  - - [1024, 256, 1, 1024]
    - [262, 19.832]
  - - [4096, 512, 1, 8192]
    - [173, 80.348]
  - - [128, 1024, 1, 512]
    - [49, 6.109]
  - - [4096, 512, 1, 2304]
    - [210, 69.55]
  - - [2048, 256, 1, 5632]
    - [63, 45.253]
  - - [1024, 256, 1, 5120]
    - [194, 38.519]
  - - [1024, 512, 1, 6656]
    - [22, 45.087]
  - - [4096, 512, 1, 2816]
    - [173, 69.089]
  - - [4096, 200, 1, 2080]
    - [362, 45.777]
  - - [1024, 200, 1, 2304]
    - [165, 29.973]
  - - [2048, 200, 1, 13312]
    - [31, 49.352]
  - - [64, 1024, 1, 1024]
    - [111, 6.166]
  - - [4096, 256, 1, 3584]
    - [121, 69.504]
  - - [2048, 1024, 1, 7680]
    - [210, 81.005]
  - - [1024, 256, 1, 1664]
    - [89, 26.145]
  - - [1, 512, 1, 2048]
    - [39, 0.108]
  - - [512, 512, 1, 1024]
    - [183, 19.854]
  - - [2048, 256, 1, 8192]
    - [241, 46.265]
  - - [2048, 512, 1, 512]
    - [48, 30.88]
  - - [4096, 512, 1, 1920]
    - [290, 60.822]
  - - [4096, 200, 1, 12288]
    - [210, 61.697]
  - - [2048, 512, 1, 1152]
    - [121, 42.186]
  - - [1024, 256, 1, 2080]
    - [87, 29.268]
  - - [4096, 1024, 1, 32]
    - [148, 9.061]
  - - [4096, 512, 1, 16640]
    - [135, 84.96]
  - - [2048, 200, 1, 9216]
    - [79, 44.422]
  - - [2048, 200, 1, 2560]
    - [181, 33.876]
  - - [2048, 1024, 1, 1024]
    - [210, 54.351]
  - - [2048, 256, 1, 4608]
    - [22, 43.79]
  - - [512, 200, 1, 768]
    - [253, 6.98]
  - - [128, 256, 1, 512]
    - [177, 1.865]
  - - [4096, 512, 1, 1792]
    - [317, 66.696]
  - - [4096, 1024, 1, 8192]
    - [190, 88.574]
  - - [1024, 256, 1, 2816]
    - [194, 31.178]
  - - [1024, 1024, 1, 13312]
    - [9, 65.79]
  - - [2048, 1024, 1, 4160]
    - [210, 75.759]
  - - [2048, 256, 1, 3584]
    - [269, 34.979]
  - - [128, 200, 1, 2048]
    - [188, 3.981]
  - - [4096, 512, 1, 10240]
    - [135, 81.586]
  - - [4096, 512, 1, 512]
    - [89, 43.063]
  - - [2048, 1024, 1, 6656]
    - [173, 80.314]
  - - [1024, 512, 1, 640]
    - [262, 20.908]
  - - [2048, 512, 1, 768]
    - [48, 35.307]
  - - [2048, 200, 1, 1408]
    - [365, 26.014]
  - - [4096, 200, 1, 2048]
    - [135, 46.942]
  - - [1024, 1024, 1, 5632]
    - [125, 57.819]
  - - [2048, 512, 1, 3584]
    - [290, 70.105]
  - - [64, 200, 1, 512]
    - [212, 0.741]
  - - [1024, 200, 1, 64]
    - [90, 1.958]
  - - [512, 512, 1, 2304]
    - [194, 28.339]
  - - [2048, 1024, 1, 14336]
    - [210, 85.492]
  - - [4096, 512, 1, 11264]
    - [210, 84.504]
  - - [4096, 512, 1, 128]
    - [46, 20.178]
  - - [1024, 512, 1, 64]
    - [46, 4.062]
  - - [4096, 512, 1, 768]
    - [362, 52.688]
  - - [4096, 1024, 1, 11264]
    - [57, 90.573]
  - - [1, 256, 1, 1024]
    - [366, 0.025]
  - - [4096, 200, 1, 7680]
    - [210, 56.944]
  - - [1024, 200, 1, 12288]
    - [84, 44.114]
  - - [1024, 1024, 1, 1280]
    - [87, 44.467]
  - - [4096, 1024, 1, 16640]
    - [190, 91.363]
  - - [2048, 1024, 1, 5632]
    - [362, 77.391]
  - - [1024, 200, 1, 15360]
    - [162, 46.21]
  - - [1, 1024, 1, 1024]
    - [306, 0.109]
  - - [2048, 256, 1, 16384]
    - [367, 51.12]
  - - [4096, 512, 1, 12288]
    - [210, 84.74]
  - - [2048, 200, 1, 896]
    - [368, 20.153]
  - - [4096, 1024, 1, 5632]
    - [190, 87.531]
  - - [2048, 256, 1, 32]
    - [48, 2.34]
  - - [2048, 256, 1, 1280]
    - [311, 29.513]
  - - [4096, 256, 1, 4096]
    - [351, 63.403]
  - - [2048, 256, 1, 11264]
    - [367, 50.36]
  - - [4096, 200, 1, 9216]
    - [173, 59.526]
  - - [1024, 512, 1, 4096]
    - [63, 39.225]
  - - [2048, 1024, 1, 10240]
    - [210, 84.31]
  - - [4096, 1024, 1, 640]
    - [369, 51.058]
  - - [128, 1024, 1, 2048]
    - [162, 15.669]
  - - [4096, 200, 1, 3840]
    - [173, 47.628]
  - - [1024, 1024, 1, 1920]
    - [89, 45.003]
  - - [2048, 200, 1, 7168]
    - [165, 43.38]
  - - [2048, 512, 1, 16384]
    - [290, 74.874]
  - - [2048, 1024, 1, 12288]
    - [210, 84.779]
  - - [4096, 1024, 1, 10240]
    - [246, 89.676]
  - - [1024, 1024, 1, 8320]
    - [9, 63.044]
  - - [1024, 256, 1, 9216]
    - [122, 44.462]
  - - [4096, 256, 1, 1152]
    - [120, 45.852]
  - - [512, 200, 1, 2560]
    - [370, 17.103]
  - - [2048, 256, 1, 1920]
    - [174, 37.114]
  - - [2048, 1024, 1, 4608]
    - [356, 76.809]
  - - [512, 256, 1, 1024]
    - [270, 10.129]
  - - [1024, 256, 1, 1920]
    - [112, 29.242]
  - - [4096, 512, 1, 3584]
    - [210, 76.227]
  - - [2048, 512, 1, 4160]
    - [315, 59.926]
  - - [2048, 512, 1, 5632]
    - [210, 74.786]
  - - [4096, 1024, 1, 4608]
    - [346, 84.733]
  - - [4096, 1024, 1, 3328]
    - [321, 84.392]
  - - [4096, 256, 1, 7168]
    - [351, 68.92]
  - - [4096, 200, 1, 128]
    - [15, 9.295]
  - - [2048, 200, 1, 5120]
    - [41, 38.656]
  - - [1024, 1024, 1, 6656]
    - [55, 61.469]
  - - [512, 1024, 1, 3200]
    - [149, 41.648]
  - - [512, 200, 1, 2304]
    - [90, 15.089]
  - - [2048, 1024, 1, 9216]
    - [210, 83.981]
  - - [2048, 256, 1, 1536]
    - [287, 32.261]
  - - [4096, 256, 1, 256]
    - [48, 18.106]
  - - [2048, 512, 1, 1408]
    - [351, 53.112]
  - - [1024, 256, 1, 384]
    - [15, 9.753]
  - - [2048, 1024, 1, 2304]
    - [210, 72.083]
  - - [4096, 512, 1, 6144]
    - [210, 79.186]
  - - [1024, 200, 1, 14336]
    - [165, 42.859]
  - - [1024, 512, 1, 2080]
    - [16, 35.497]
  - - [2048, 512, 1, 2304]
    - [121, 62.675]
  - - [4096, 512, 1, 15360]
    - [135, 85.558]
  - - [1024, 256, 1, 32]
    - [49, 1.18]
  - - [1024, 200, 1, 2816]
    - [217, 30.199]
  - - [4096, 200, 1, 512]
    - [48, 22.72]
  - - [4096, 1024, 1, 7168]
    - [102, 88.649]
  - - [2048, 256, 1, 14336]
    - [350, 57.528]
  - - [1024, 200, 1, 3072]
    - [108, 32.693]
  - - [2048, 200, 1, 1280]
    - [365, 29.858]
  - - [1024, 1024, 1, 2304]
    - [96, 45.353]
  - - [4096, 1024, 1, 9216]
    - [62, 89.971]
  - - [2048, 512, 1, 4608]
    - [290, 66.484]
  - - [4096, 1024, 1, 7680]
    - [9, 88.482]
  - - [4096, 256, 1, 6144]
    - [135, 70.725]
  - - [4096, 256, 1, 896]
    - [45, 39.406]
  - - [512, 256, 1, 1536]
    - [230, 14.793]
  - - [1024, 256, 1, 512]
    - [45, 12.947]
  - - [2048, 256, 1, 640]
    - [371, 21.244]
  - - [256, 256, 1, 2048]
    - [372, 9.368]
  - - [2048, 1024, 1, 8192]
    - [210, 80.957]
  - - [4096, 200, 1, 16640]
    - [351, 63.39]
  - - [256, 512, 1, 512]
    - [69, 7.468]
  - - [2048, 512, 1, 384]
    - [317, 28.128]
  - - [2048, 200, 1, 16384]
    - [181, 51.606]
  - - [4096, 200, 1, 10240]
    - [315, 59.387]
  - - [1024, 512, 1, 9216]
    - [16, 46.962]
  - - [4096, 1024, 1, 64]
    - [48, 17.19]
  - - [4096, 200, 1, 1920]
    - [351, 48.278]
  - - [2048, 1024, 1, 1280]
    - [210, 65.036]
  - - [1024, 200, 1, 3840]
    - [162, 34.911]
  - - [256, 1024, 1, 512]
    - [96, 13.11]
  - - [2048, 1024, 1, 3328]
    - [210, 71.44]
  - - [1024, 256, 1, 16640]
    - [373, 47.267]
  - - [4096, 512, 1, 14336]
    - [173, 84.386]
  - - [1024, 1024, 1, 16640]
    - [374, 68.969]
  - - [1024, 256, 1, 1152]
    - [77, 21.89]
  - - [4096, 512, 1, 8320]
    - [173, 82.597]
  - - [2048, 512, 1, 7680]
    - [210, 76.039]
  - - [4096, 1024, 1, 6656]
    - [55, 88.555]
  - - [1024, 512, 1, 3584]
    - [241, 35.019]
  - - [1024, 1024, 1, 32]
    - [93, 3.954]
  - - [512, 512, 1, 2816]
    - [77, 33.059]
  - - [2048, 512, 1, 1664]
    - [210, 52.341]
  - - [1024, 1024, 1, 14336]
    - [374, 67.67]
  - - [2048, 200, 1, 2048]
    - [355, 33.085]
  - - [1024, 1024, 1, 3584]
    - [57, 55.702]
  - - [512, 200, 1, 1280]
    - [51, 10.32]
  - - [4096, 256, 1, 6656]
    - [210, 71.389]
  - - [4096, 256, 1, 4160]
    - [357, 64.741]
  - - [128, 256, 1, 1024]
    - [212, 3.149]
  - - [512, 200, 1, 3200]
    - [117, 18.7]
  - - [2048, 512, 1, 9216]
    - [352, 74.932]
  - - [2048, 1024, 1, 256]
    - [121, 30.275]
  - - [1024, 256, 1, 2304]
    - [194, 28.646]
  - - [1024, 200, 1, 8192]
    - [217, 44.231]
  - - [2048, 256, 1, 3072]
    - [191, 40.238]
  - - [2048, 256, 1, 8320]
    - [245, 47.134]
  - - [4096, 512, 1, 1024]
    - [121, 59.215]
  - - [1024, 512, 1, 3200]
    - [99, 41.738]
  - - [1024, 512, 1, 896]
    - [375, 25.587]
  - - [2048, 512, 1, 1280]
    - [210, 51.495]
  - - [4096, 200, 1, 64]
    - [46, 6.207]
  - - [1024, 256, 1, 6144]
    - [150, 40.164]
  - - [1024, 200, 1, 2560]
    - [108, 26.591]
  - - [1024, 1024, 1, 5120]
    - [112, 58.955]
  - - [2048, 512, 1, 6656]
    - [210, 71.015]
  - - [4096, 1024, 1, 1536]
    - [317, 71.118]
  - - [1024, 1024, 1, 128]
    - [311, 11.964]
  - - [512, 1024, 1, 1792]
    - [104, 36.195]
  - - [2048, 1024, 1, 32]
    - [376, 6.492]
  - - [4096, 256, 1, 2816]
    - [351, 51.825]
  - - [1024, 1024, 1, 15360]
    - [82, 66.936]
  - - [1024, 256, 1, 5632]
    - [122, 40.884]
  - - [1024, 1024, 1, 4096]
    - [190, 55.464]
  - - [2048, 200, 1, 4160]
    - [217, 43.595]
  - - [512, 256, 1, 768]
    - [35, 11.167]
  - - [4096, 512, 1, 640]
    - [135, 51.574]
  - - [2048, 512, 1, 8192]
    - [315, 75.294]
  - - [1024, 512, 1, 768]
    - [123, 25.463]
  - - [4096, 200, 1, 8320]
    - [210, 60.588]
  - - [2048, 512, 1, 896]
    - [156, 40.679]
  - - [4096, 200, 1, 7168]
    - [173, 55.616]
  - - [2048, 512, 1, 13312]
    - [135, 79.106]
  - - [2048, 200, 1, 3840]
    - [108, 43.508]
  - - [1024, 1024, 1, 768]
    - [283, 36.892]
  - - [4096, 512, 1, 16384]
    - [135, 82.591]
  - - [4096, 256, 1, 2304]
    - [290, 57.445]
  - - [1, 256, 1, 4096]
    - [322, 0.093]
  - - [1024, 1024, 1, 11264]
    - [346, 63.878]
  - - [2048, 200, 1, 16640]
    - [181, 54.942]
  - - [1024, 256, 1, 3072]
    - [274, 32.263]
  - - [4096, 1024, 1, 512]
    - [89, 57.106]
  - - [2048, 256, 1, 2816]
    - [377, 38.565]
  - - [32, 512, 1, 512]
    - [252, 0.919]
  - - [256, 512, 1, 2048]
    - [217, 15.829]
  - - [1024, 512, 1, 384]
    - [24, 14.495]
  - - [2048, 200, 1, 7680]
    - [79, 43.227]
  - - [1024, 512, 1, 4608]
    - [92, 40.123]
  - - [4096, 200, 1, 32]
    - [132, 3.046]
  - - [4096, 200, 1, 3328]
    - [290, 45.855]
  - - [1024, 200, 1, 1152]
    - [84, 18.891]
  - - [1024, 1024, 1, 1408]
    - [15, 46.36]
  - - [2048, 200, 1, 15360]
    - [181, 54.28]
  - - [512, 1024, 1, 2048]
    - [174, 35.629]
  - - [1024, 200, 1, 10240]
    - [311, 34.914]
  - - [4096, 256, 1, 5632]
    - [210, 69.239]
  - - [512, 512, 1, 3072]
    - [96, 32.722]
  - - [2048, 256, 1, 1408]
    - [89, 30.983]
  - - [2048, 256, 1, 6144]
    - [170, 40.695]
  - - [4096, 256, 1, 3328]
    - [352, 63.28]
  - - [1024, 200, 1, 1664]
    - [84, 22.75]
  - - [2048, 1024, 1, 1152]
    - [135, 55.18]
  - - [2048, 512, 1, 6144]
    - [356, 65.92]
  - - [2048, 512, 1, 3200]
    - [317, 58.722]
  - - [4096, 1024, 1, 2080]
    - [321, 79.079]
  - - [4096, 1024, 1, 768]
    - [63, 60.541]
  - - [4096, 1024, 1, 2560]
    - [62, 79.627]
  - - [64, 200, 1, 2048]
    - [295, 2.226]
  - - [2048, 200, 1, 4608]
    - [181, 41.748]
  - - [1024, 1024, 1, 6144]
    - [9, 61.648]
  - - [4096, 256, 1, 1664]
    - [317, 52.176]
  - - [2048, 200, 1, 384]
    - [334, 15.449]
  - - [1, 200, 1, 2048]
    - [266, 0.036]
  - - [4096, 256, 1, 1792]
    - [121, 50.954]
  - - [2048, 1024, 1, 64]
    - [46, 11.973]
  - - [4096, 1024, 1, 16384]
    - [62, 90.579]
  - - [1024, 512, 1, 16640]
    - [350, 56.591]
  - - [2048, 512, 1, 10240]
    - [135, 77.302]
  - - [4096, 512, 1, 6656]
    - [210, 79.626]
  - - [2048, 256, 1, 16640]
    - [350, 56.787]
  - - [2048, 512, 1, 2816]
    - [89, 53.388]
  - - [1024, 200, 1, 32]
    - [76, 0.953]
  - - [1, 512, 1, 4096]
    - [236, 0.195]
  - - [256, 256, 1, 1024]
    - [217, 5.955]
  - - [2048, 1024, 1, 128]
    - [44, 20.818]
  - - [2048, 1024, 1, 2080]
    - [32, 66.115]
  - - [2048, 1024, 1, 16640]
    - [210, 84.52]
  - - [1024, 200, 1, 384]
    - [355, 8.321]
  - - [4096, 256, 1, 384]
    - [48, 25.946]
  - - [4096, 256, 1, 13312]
    - [121, 79.04]
  - - [2048, 256, 1, 128]
    - [172, 6.552]
  - - [512, 256, 1, 2304]
    - [5, 20.398]
  - - [2048, 1024, 1, 3072]
    - [173, 70.154]
  - - [1024, 1024, 1, 640]
    - [325, 36.913]
  - - [256, 512, 1, 1024]
    - [217, 11.657]
  - - [4096, 1024, 1, 1408]
    - [116, 70.879]
  - - [4096, 200, 1, 5632]
    - [210, 56.406]
  - - [4096, 1024, 1, 2048]
    - [321, 77.919]
  - - [2048, 1024, 1, 2560]
    - [45, 67.311]
  - - [4096, 1024, 1, 128]
    - [15, 29.522]
  - - [1024, 200, 1, 3328]
    - [311, 33.097]
  - - [2048, 200, 1, 1152]
    - [311, 26.076]
  - - [1024, 200, 1, 9216]
    - [162, 42.829]
  - - [4096, 256, 1, 512]
    - [80, 30.712]
  - - [4096, 1024, 1, 14336]
    - [55, 90.783]
  - - [1024, 1024, 1, 384]
    - [99, 26.322]
  - - [2048, 200, 1, 512]
    - [117, 15.977]
  - - [2048, 256, 1, 9216]
    - [123, 47.337]
  - - [2048, 256, 1, 1792]
    - [378, 35.17]
  - - [4096, 512, 1, 9216]
    - [210, 84.744]
  - - [4096, 200, 1, 15360]
    - [351, 62.767]
  - - [64, 256, 1, 2048]
    - [39, 2.91]
  - - [4096, 200, 1, 1792]
    - [181, 43.52]
  - - [1, 200, 1, 4096]
    - [235, 0.076]
  - - [2048, 1024, 1, 2048]
    - [173, 62.146]
  - - [1024, 200, 1, 2080]
    - [217, 26.502]
  - - [2048, 200, 1, 1536]
    - [79, 32.893]
  - - [1024, 1024, 1, 3072]
    - [194, 49.861]
  - - [512, 200, 1, 1792]
    - [111, 14.676]
  - - [1024, 256, 1, 11264]
    - [379, 43.854]
  - - [2048, 512, 1, 12288]
    - [315, 77.795]
  - - [1024, 256, 1, 1792]
    - [77, 28.658]
  - - [1024, 200, 1, 7168]
    - [162, 41.341]
  - - [32, 256, 1, 1024]
    - [257, 0.915]
  - - [512, 256, 1, 3072]
    - [217, 20.21]
  - - [1024, 1024, 1, 2080]
    - [15, 49.84]
  - - [2048, 200, 1, 2304]
    - [365, 34.385]
  - - [4096, 512, 1, 1536]
    - [44, 56.663]
  - - [2048, 256, 1, 7168]
    - [380, 45.081]
  - - [2048, 512, 1, 1792]
    - [317, 56.703]
  - - [1024, 200, 1, 2048]
    - [84, 23.92]
  - - [1024, 1024, 1, 4608]
    - [321, 56.724]
  - - [4096, 256, 1, 8192]
    - [357, 73.524]
  - - [512, 1024, 1, 1280]
    - [92, 29.132]
  - - [2048, 1024, 1, 16384]
    - [210, 82.288]
  - - [512, 512, 1, 1280]
    - [21, 21.38]
  - - [1024, 200, 1, 1280]
    - [217, 19.376]
  - - [2048, 256, 1, 3200]
    - [29, 40.904]
  - - [2048, 512, 1, 15360]
    - [356, 79.44]
  - - [1024, 512, 1, 3328]
    - [227, 36.712]
  - - [1024, 512, 1, 4160]
    - [270, 39.915]
  - - [4096, 200, 1, 6656]
    - [210, 56.363]
  - - [4096, 1024, 1, 1024]
    - [381, 63.968]
  - - [2048, 200, 1, 3328]
    - [217, 42.797]
  - - [1024, 1024, 1, 256]
    - [219, 20.861]
  - - [512, 200, 1, 512]
    - [117, 5.827]
  - - [2048, 256, 1, 64]
    - [48, 3.764]
  - - [1024, 256, 1, 2560]
    - [262, 32.876]
  - - [2048, 512, 1, 11264]
    - [210, 76.836]
  - - [32, 200, 1, 1024]
    - [39, 0.661]
  - - [32, 512, 1, 2048]
    - [39, 2.604]
  - - [2048, 256, 1, 2304]
    - [375, 38.543]
  - - [2048, 256, 1, 12288]
    - [382, 51.029]
  - - [4096, 200, 1, 8192]
    - [351, 57.302]
  - - [1024, 512, 1, 7168]
    - [149, 45.055]
  - - [1024, 512, 1, 1792]
    - [15, 35.897]
  - - [4096, 1024, 1, 1664]
    - [62, 75.093]
  - - [4096, 200, 1, 2816]
    - [120, 43.382]
  - - [1024, 1024, 1, 896]
    - [81, 33.617]
  - - [1024, 200, 1, 8320]
    - [84, 44.397]
  - - [1024, 1024, 1, 12288]
    - [358, 64.817]
  - - [1024, 256, 1, 8320]
    - [383, 41.005]
  - - [1024, 200, 1, 1024]
    - [79, 16.921]
  - - [1024, 200, 1, 16640]
    - [162, 42.596]
  - - [4096, 256, 1, 5120]
    - [290, 67.244]
  - - [1024, 256, 1, 3200]
    - [237, 33.605]
  - - [512, 512, 1, 2560]
    - [87, 29.964]
  - - [4096, 256, 1, 2048]
    - [317, 57.464]
  - - [1024, 256, 1, 640]
    - [274, 14.129]
  - - [2048, 256, 1, 5120]
    - [227, 44.283]
  - - [2048, 256, 1, 7680]
    - [123, 44.686]
  - - [4096, 512, 1, 384]
    - [156, 37.803]
  - - [2048, 200, 1, 3584]
    - [181, 45.616]
  - - [1024, 512, 1, 1536]
    - [20, 31.399]
  - - [4096, 512, 1, 3328]
    - [173, 76.49]
  - - [4096, 1024, 1, 256]
    - [63, 40.5]
  - - [2048, 200, 1, 64]
    - [49, 3.291]
  - - [2048, 200, 1, 4096]
    - [181, 37.029]
  - - [1024, 1024, 1, 1536]
    - [73, 45.899]
  - - [2048, 1024, 1, 7168]
    - [351, 78.687]
  - - [1024, 256, 1, 3584]
    - [324, 35.351]
  - - [4096, 256, 1, 32]
    - [46, 3.803]
  - - [4096, 256, 1, 1280]
    - [156, 45.292]
  - - [512, 512, 1, 3200]
    - [80, 35.191]
  - - [2048, 1024, 1, 1536]
    - [224, 59.716]
  - - [2048, 256, 1, 1024]
    - [371, 27.632]
  - - [128, 200, 1, 512]
    - [69, 1.366]
  - - [4096, 512, 1, 7168]
    - [121, 79.485]
  - - [1024, 512, 1, 1152]
    - [15, 30.409]
  - - [64, 1024, 1, 2048]
    - [143, 8.287]
  - - [2048, 512, 1, 3328]
    - [135, 60.614]
  - - [4096, 1024, 1, 896]
    - [205, 64.517]
  - - [1, 1024, 1, 2048]
    - [306, 0.22]
  - - [4096, 200, 1, 3584]
    - [351, 50.188]
  - - [4096, 1024, 1, 4096]
    - [9, 84.818]
  - - [1024, 256, 1, 14336]
    - [384, 43.246]
  - - [2048, 200, 1, 256]
    - [323, 11.078]
  - - [4096, 256, 1, 16384]
    - [135, 67.889]
  - - [4096, 256, 1, 1920]
    - [351, 60.53]
  - - [32, 1024, 1, 512]
    - [110, 1.941]
  - - [1024, 256, 1, 7680]
    - [77, 37.475]
  - - [2048, 256, 1, 1664]
    - [26, 35.454]
  - - [512, 200, 1, 1536]
    - [111, 14.325]
  - - [2048, 1024, 1, 6144]
    - [210, 80.25]
  - - [512, 256, 1, 2816]
    - [143, 22.195]
  - - [4096, 512, 1, 4160]
    - [210, 77.498]
  - - [4096, 512, 1, 2080]
    - [352, 66.625]
  - - [2048, 256, 1, 15360]
    - [350, 56.816]
  - - [4096, 200, 1, 5120]
    - [210, 55.699]
  - - [1024, 512, 1, 8192]
    - [8, 46.748]
  - - [4096, 200, 1, 896]
    - [334, 34.88]
  - - [2048, 512, 1, 8320]
    - [173, 75.53]
  - - [1024, 1024, 1, 10240]
    - [82, 65.262]
  - - [1024, 200, 1, 768]
    - [249, 12.439]
  - - [2048, 200, 1, 640]
    - [217, 17.227]
  - - [512, 200, 1, 2048]
    - [253, 14.347]
  - - [1024, 1024, 1, 9216]
    - [62, 63.817]
  - - [4096, 200, 1, 1408]
    - [362, 38.096]
  - - [1024, 256, 1, 13312]
    - [206, 44.344]
  - - [1024, 256, 1, 128]
    - [242, 4.189]
  - - [2048, 200, 1, 5632]
    - [79, 42.315]
  - - [64, 1024, 1, 512]
    - [69, 4.308]
  - - [1024, 512, 1, 2560]
    - [113, 36.957]
  - - [4096, 200, 1, 1280]
    - [103, 35.291]
  - - [1024, 200, 1, 4096]
    - [79, 32.543]
  - - [1024, 1024, 1, 2560]
    - [80, 50.07]
  - - [2048, 512, 1, 64]
    - [385, 6.876]
  - - [2048, 200, 1, 8192]
    - [365, 42.976]
  - - [2048, 512, 1, 3072]
    - [290, 53.685]
  - - [4096, 1024, 1, 5120]
    - [321, 86.949]
  - - [4096, 256, 1, 640]
    - [357, 36.325]
  - - [1024, 256, 1, 1280]
    - [274, 23.167]
  - - [2048, 1024, 1, 1920]
    - [30, 61.437]
  - - [2048, 256, 1, 4096]
    - [92, 39.605]
  - - [2048, 1024, 1, 15360]
    - [210, 86.011]
  - - [4096, 200, 1, 16384]
    - [135, 54.497]
  - - [1, 1024, 1, 4096]
    - [295, 0.353]
  - - [4096, 1024, 1, 2816]
    - [125, 80.07]
  - - [4096, 200, 1, 1664]
    - [317, 43.139]
  - - [4096, 512, 1, 256]
    - [46, 28.411]
  - - [1024, 200, 1, 896]
    - [334, 15.197]
  - - [2048, 200, 1, 6656]
    - [181, 45.225]
  - - [2048, 1024, 1, 5120]
    - [135, 76.388]
  - - [512, 1024, 1, 768]
    - [92, 23.828]
  - - [2048, 512, 1, 14336]
    - [290, 79.785]
  - - [2048, 200, 1, 8320]
    - [181, 50.926]
  - - [4096, 256, 1, 3840]
    - [290, 59.513]
  - - [2048, 1024, 1, 4096]
    - [356, 74.436]
  - - [1024, 1024, 1, 3200]
    - [89, 50.979]
  - - [1024, 256, 1, 4608]
    - [278, 37.533]
  - - [4096, 512, 1, 4608]
    - [351, 74.964]
  - - [4096, 512, 1, 1664]
    - [28, 60.076]
  - - [4096, 256, 1, 4608]
    - [210, 72.706]
  - - [1024, 512, 1, 32]
    - [46, 2.04]
  - - [1024, 512, 1, 3840]
    - [50, 37.395]
  - - [2048, 512, 1, 1920]
    - [351, 59.207]
  - - [2048, 1024, 1, 896]
    - [317, 58.024]
  - - [4096, 200, 1, 6144]
    - [121, 54.422]
  - - [1024, 512, 1, 13312]
    - [350, 53.75]
  - - [4096, 1024, 1, 4160]
    - [82, 85.86]
  - - [2048, 200, 1, 2816]
    - [181, 40.842]
  - - [1024, 1024, 1, 3840]
    - [386, 54.759]
  - - [128, 1024, 1, 1024]
    - [300, 11.744]
  - - [2048, 1024, 1, 11264]
    - [210, 82.32]
  - - [2048, 1024, 1, 384]
    - [120, 40.772]
  - - [1024, 256, 1, 2048]
    - [122, 27.266]
  - - [2048, 1024, 1, 3840]
    - [135, 73.178]
  - - [4096, 256, 1, 8320]
    - [173, 74.671]
  - - [2048, 256, 1, 3840]
    - [156, 37.316]
  - - [64, 256, 1, 512]
    - [252, 0.964]
  - - [4096, 512, 1, 1280]
    - [135, 61.614]
  - - [512, 256, 1, 1280]
    - [387, 12.036]
  - - [1024, 512, 1, 7680]
    - [191, 45.684]
  - - [4096, 1024, 1, 1152]
    - [82, 66.316]
  - - [256, 200, 1, 512]
    - [204, 2.887]
  - - [256, 1024, 1, 2048]
    - [131, 26.894]
  - - [2048, 200, 1, 10240]
    - [181, 48.809]
  - - [2048, 512, 1, 5120]
    - [210, 69.833]
  - - [2048, 1024, 1, 1408]
    - [388, 54.789]
  - - [512, 1024, 1, 512]
    - [152, 18.26]
  - - [1024, 200, 1, 11264]
    - [249, 41.856]
  - - [2048, 512, 1, 32]
    - [48, 3.823]
  - - [4096, 256, 1, 2560]
    - [351, 60.065]
  - - [4096, 256, 1, 64]
    - [48, 7.017]
  - - [32, 1024, 1, 1024]
    - [84, 3.041]
  - - [2048, 200, 1, 768]
    - [375, 20.844]
  - - [512, 512, 1, 2048]
    - [208, 29.227]
  - - [2048, 512, 1, 2560]
    - [210, 66.316]
  - - [512, 256, 1, 512]
    - [226, 6.52]
  - - [1024, 200, 1, 7680]
    - [165, 40.009]
  - - [4096, 512, 1, 896]
    - [171, 57.561]
  - - [4096, 1024, 1, 3072]
    - [62, 83.622]
  - - [4096, 200, 1, 13312]
    - [121, 62.132]
  - - [2048, 512, 1, 7168]
    - [362, 72.361]
  - - [2048, 1024, 1, 2816]
    - [210, 72.579]
  - - [2048, 512, 1, 128]
    - [48, 12.691]
  - - [1024, 256, 1, 8192]
    - [194, 40.131]
  - - [4096, 1024, 1, 1792]
    - [170, 73.299]
  - - [1024, 200, 1, 6656]
    - [217, 41.28]
  - - [4096, 200, 1, 2304]
    - [290, 44.102]
  - - [4096, 512, 1, 1152]
    - [317, 62.891]
  - - [512, 200, 1, 1024]
    - [111, 8.707]
  - - [1024, 256, 1, 3840]
    - [89, 35.999]
  - - [512, 512, 1, 768]
    - [183, 15.331]
  - - [2048, 512, 1, 4096]
    - [351, 65.022]
  - - [2048, 256, 1, 2560]
    - [89, 38.026]
  - - [2048, 256, 1, 4160]
    - [5, 41.043]
  - - [1024, 256, 1, 64]
    - [389, 1.902]
  - - [4096, 512, 1, 7680]
    - [173, 79.96]
  - - [1024, 512, 1, 1664]
    - [123, 33.862]
  - - [2048, 512, 1, 2080]
    - [173, 61.222]
  - - [2048, 512, 1, 3840]
    - [357, 62.143]
  - - [4096, 1024, 1, 384]
    - [92, 48.982]
  - - [4096, 200, 1, 3072]
    - [388, 44.741]
  - - [1024, 512, 1, 14336]
    - [350, 55.705]
  - - [1024, 200, 1, 1920]
    - [311, 26.842]
  - - [1024, 1024, 1, 1664]
    - [15, 49.531]
  - - [512, 1024, 1, 2304]
    - [390, 35.147]
  - - [2048, 1024, 1, 1792]
    - [210, 69.403]
  - - [32, 200, 1, 512]
    - [39, 0.416]
  - - [4096, 256, 1, 11264]
    - [210, 78.527]
  - - [4096, 256, 1, 1408]
    - [290, 49.475]
  - - [1024, 256, 1, 7168]
    - [375, 33.476]
  - - [2048, 256, 1, 1152]
    - [99, 30.191]
  - - [256, 256, 1, 512]
    - [33, 3.36]
  - - [1024, 512, 1, 1280]
    - [64, 30.911]
  - - [512, 512, 1, 1792]
    - [194, 24.349]
  - - [2048, 200, 1, 12288]
    - [181, 51.614]
  - - [2048, 200, 1, 1664]
    - [108, 30.012]
  - - [4096, 200, 1, 4608]
    - [351, 52.168]
  - - [512, 1024, 1, 2560]
    - [205, 38.842]
  - - [4096, 200, 1, 384]
    - [48, 19.372]
  - - [128, 512, 1, 512]
    - [204, 3.418]
  - - [1024, 200, 1, 256]
    - [368, 5.573]
  - - [256, 1024, 1, 1024]
    - [71, 18.185]
  - - [2048, 200, 1, 128]
    - [49, 5.874]
  - - [2048, 200, 1, 11264]
    - [181, 46.574]
  - - [1024, 512, 1, 1920]
    - [245, 34.602]
  - - [4096, 256, 1, 1536]
    - [351, 58.514]
  - - [4096, 1024, 1, 3584]
    - [299, 84.179]
  - - [2048, 256, 1, 256]
    - [109, 13.016]
  - - [2048, 1024, 1, 768]
    - [148, 52.736]
  - - [4096, 256, 1, 10240]
    - [290, 77.513]
  - - [2048, 256, 1, 10240]
    - [350, 50.569]
  - - [4096, 200, 1, 14336]
    - [210, 61.877]
  - - [1024, 512, 1, 5120]
    - [45, 40.194]
  - - [1024, 512, 1, 8320]
    - [8, 47.272]
  - - [256, 200, 1, 2048]
    - [372, 7.857]
  - - [1024, 200, 1, 640]
    - [370, 13.017]
  - - [1024, 512, 1, 10240]
    - [330, 48.008]
  - - [1024, 200, 1, 4160]
    - [165, 35.298]
  - - [1024, 200, 1, 5632]
    - [217, 40.822]
  - - [1024, 1024, 1, 2048]
    - [48, 40.831]
  - - [1024, 256, 1, 6656]
    - [119, 39.452]
  - - [2048, 1024, 1, 8320]
    - [210, 81.08]
  - - [1024, 256, 1, 10240]
    - [15, 41.386]
  - - [2048, 256, 1, 2080]
    - [174, 35.905]
  - - [4096, 256, 1, 128]
    - [46, 13.252]
  - - [1024, 256, 1, 768]
    - [21, 16.752]
  - - [2048, 256, 1, 896]
    - [162, 27.237]
  - - [64, 512, 1, 2048]
    - [101, 5.31]
  - - [4096, 512, 1, 2048]
    - [210, 63.435]
  - - [512, 256, 1, 2048]
    - [79, 16.585]
  - - [4096, 256, 1, 16640]
    - [290, 80.541]
  - - [4096, 512, 1, 2560]
    - [135, 68.992]
  - - [1024, 512, 1, 15360]
    - [350, 54.272]
  - - [4096, 1024, 1, 2304]
    - [275, 77.139]
  - - [4096, 200, 1, 1152]
    - [181, 37.132]
  - - [2048, 200, 1, 6144]
    - [181, 45.078]
  - - [1024, 1024, 1, 7680]
    - [62, 62.398]
  - - [2048, 200, 1, 1920]
    - [79, 35.485]
  - - [32, 1024, 1, 2048]
    - [280, 5.091]
  - - [1024, 200, 1, 3584]
    - [217, 36.632]
  - - [4096, 256, 1, 2080]
    - [315, 64.16]
  - - [1024, 1024, 1, 16384]
    - [374, 67.996]
  - - [1024, 256, 1, 1408]
    - [274, 23.441]
  - - [1024, 256, 1, 4096]
    - [208, 36.387]
  - - [2048, 200, 1, 14336]
    - [349, 50.938]
  - - [4096, 512, 1, 5120]
    - [351, 76.086]
  - - [1024, 512, 1, 6144]
    - [83, 44.96]
  - - [1024, 512, 1, 2304]
    - [209, 36.659]
  - - [4096, 200, 1, 4160]
    - [356, 52.25]
  - - [4096, 200, 1, 1536]
    - [317, 43.611]
  - - [4096, 1024, 1, 6144]
    - [62, 86.778]
  - - [256, 64, 1, 1225]
    - [255, 1.853]
  - - [2048, 320, 1, 64]
    - [48, 5.044]
  - - [1024, 128, 1, 289]
    - [217, 4.16]
  - - [384, 64, 1, 1225]
    - [266, 2.666]
  - - [2048, 384, 1, 64]
    - [391, 5.753]
  - - [64, 80, 1, 5329]
    - [188, 2.173]
  - - [1024, 384, 1, 289]
    - [145, 9.863]
  - - [2048, 448, 1, 64]
    - [46, 6.396]
  - - [768, 192, 1, 289]
    - [117, 5.28]
  - - [288, 64, 1, 1225]
    - [319, 2.309]
  - - [384, 96, 1, 1225]
    - [212, 3.916]
  - - [1024, 3392, 1, 4096]
    - [285, 80.551]
  - - [1024, 3301, 1, 4096]
    - [15, 77.499]
  - - [1024, 3443, 1, 4096]
    - [129, 80.882]
  - - [132, 134, 480, 64]
    - [48, 15.045]
  - - [162, 162, 400, 64]
    - [44, 17.289]
  - - [4096, 3548, 1, 1024]
    - [202, 81.009]
  - - [4096, 2977, 1, 1024]
    - [170, 77.005]
  - - [132, 135, 480, 64]
    - [48, 14.275]
  - - [1024, 2985, 1, 4096]
    - [392, 75.248]
  - - [33708, 3681, 1, 1024]
    - [147, 89.927]
  - - [4096, 3443, 1, 1024]
    - [104, 77.472]
  - - [11, 11, 5456, 64]
    - [164, 2.966]
  - - [1024, 3400, 1, 4096]
    - [63, 80.122]
  - - [4096, 3995, 1, 1024]
    - [340, 78.128]
  - - [4096, 3190, 1, 1024]
    - [16, 75.373]
  - - [4096, 3594, 1, 1024]
    - [29, 76.836]
  - - [159, 162, 400, 64]
    - [15, 18.629]
  - - [1024, 3565, 1, 4096]
    - [63, 83.557]
  - - [4096, 3422, 1, 1024]
    - [29, 77.286]
  - - [1024, 3214, 1, 4096]
    - [123, 75.524]
  - - [33708, 3584, 1, 1024]
    - [147, 89.707]
  - - [33708, 3640, 1, 1024]
    - [57, 89.433]
  - - [4096, 3263, 1, 1024]
    - [29, 79.298]
  - - [4096, 3296, 1, 1024]
    - [170, 80.061]
  - - [1024, 3557, 1, 4096]
    - [20, 84.254]
  - - [4096, 3463, 1, 1024]
    - [205, 78.339]
  - - [4096, 3528, 1, 1024]
    - [393, 78.438]
  - - [14, 14, 4368, 64]
    - [33, 3.699]
  - - [4096, 3226, 1, 1024]
    - [170, 77.894]
  - - [4096, 3439, 1, 1024]
    - [14, 77.869]
  - - [1024, 3523, 1, 4096]
    - [22, 83.344]
  - - [1024, 3098, 1, 4096]
    - [17, 80.139]
  - - [4096, 3121, 1, 1024]
    - [55, 78.532]
  - - [33708, 3894, 1, 1024]
    - [147, 90.535]
  - - [1024, 3548, 1, 4096]
    - [22, 83.207]
  - - [1024, 3451, 1, 4096]
    - [63, 80.672]
  - - [4096, 3353, 1, 1024]
    - [200, 75.457]
  - - [4096, 3402, 1, 1024]
    - [11, 76.29]
  - - [4096, 3939, 1, 1024]
    - [22, 80.776]
  - - [133, 133, 480, 64]
    - [64, 14.728]
  - - [1024, 3559, 1, 4096]
    - [22, 83.68]
  - - [1024, 2977, 1, 4096]
    - [243, 80.072]
  - - [1024, 3478, 1, 4096]
    - [63, 81.81]
  - - [134, 134, 480, 64]
    - [46, 14.971]
  - - [1024, 3368, 1, 4096]
    - [63, 78.958]
  - - [4096, 4012, 1, 1024]
    - [394, 79.346]
  - - [4096, 3486, 1, 1024]
    - [205, 78.775]
  - - [1024, 3479, 1, 4096]
    - [285, 81.568]
  - - [1024, 3505, 1, 4096]
    - [65, 82.271]
  - - [4096, 3381, 1, 1024]
    - [202, 78.208]
  - - [4096, 3430, 1, 1024]
    - [55, 78.589]
  - - [1024, 3554, 1, 4096]
    - [22, 83.954]
  - - [4096, 3271, 1, 1024]
    - [22, 79.348]
  - - [1024, 3063, 1, 4096]
    - [17, 79.366]
  - - [1024, 3209, 1, 4096]
    - [65, 75.35]
  - - [4096, 3503, 1, 1024]
    - [202, 79.479]
  - - [4096, 3344, 1, 1024]
    - [211, 76.538]
  - - [1024, 3147, 1, 4096]
    - [17, 81.867]
  - - [1024, 3322, 1, 4096]
    - [20, 78.03]
  - - [1024, 3341, 1, 4096]
    - [65, 79.035]
  - - [1024, 3516, 1, 4096]
    - [285, 82.425]
  - - [102, 101, 624, 64]
    - [283, 14.746]
  - - [1024, 3454, 1, 4096]
    - [65, 80.745]
  - - [4096, 3969, 1, 1024]
    - [189, 77.876]
  - - [4096, 3466, 1, 1024]
    - [102, 78.157]
  - - [1024, 3999, 1, 1024]
    - [152, 63.033]
  - - [1024, 4032, 1, 1024]
    - [62, 65.909]
  - - [1024, 3403, 1, 4096]
    - [285, 79.758]
  - - [4096, 3361, 1, 1024]
    - [116, 78.797]
  - - [1024, 3527, 1, 4096]
    - [65, 82.677]
  - - [1024, 3822, 1, 4096]
    - [29, 88.575]
  - - [4096, 3315, 1, 1024]
    - [92, 79.179]
  - - [232, 232, 272, 64]
    - [325, 17.098]
  - - [1024, 3336, 1, 4096]
    - [22, 78.635]
  - - [228, 232, 272, 64]
    - [395, 17.138]
  - - [4096, 3547, 1, 1024]
    - [82, 78.765]
  - - [4096, 3340, 1, 1024]
    - [394, 78.352]
  - - [1024, 3906, 1, 1024]
    - [396, 62.021]
  - - [1024, 3295, 1, 4096]
    - [129, 77.435]
  - - [4096, 3294, 1, 1024]
    - [123, 79.188]
  - - [33708, 3968, 1, 1024]
    - [147, 90.201]
  - - [1024, 3473, 1, 4096]
    - [63, 81.964]
  - - [1024, 3072, 1, 4096]
    - [243, 82.934]
  - - [4096, 3189, 1, 1024]
    - [205, 75.115]
  - - [4096, 3494, 1, 1024]
    - [397, 78.584]
  - - [1024, 3522, 1, 4096]
    - [29, 83.565]
  - - [33708, 3944, 1, 1024]
    - [186, 89.709]
  - - [135, 135, 480, 64]
    - [398, 14.381]
  - - [4096, 3421, 1, 1024]
    - [123, 78.097]
  - - [32, 32, 1984, 64]
    - [399, 8.726]
  - - [4096, 3311, 1, 1024]
    - [92, 78.404]
  - - [1024, 3990, 1, 1024]
    - [147, 65.211]
  - - [1024, 3290, 1, 4096]
    - [20, 77.434]
  - - [4096, 3565, 1, 1024]
    - [16, 79.474]
  - - [1024, 3484, 1, 4096]
    - [170, 81.879]
  - - [4096, 3384, 1, 1024]
    - [147, 78.86]
  - - [1024, 3422, 1, 4096]
    - [63, 80.807]
  - - [4096, 3681, 1, 1024]
    - [29, 78.601]
  - - [1024, 3584, 1, 1024]
    - [98, 62.206]
  - - [4096, 4050, 1, 1024]
    - [14, 78.82]
  - - [1024, 3996, 1, 4096]
    - [62, 82.993]
  - - [4096, 3169, 1, 1024]
    - [16, 74.953]
  - - [4096, 3538, 1, 1024]
    - [190, 80.208]
  - - [1024, 3495, 1, 4096]
    - [22, 82.001]
  - - [4096, 3401, 1, 1024]
    - [200, 79.405]
  - - [1024, 3560, 1, 4096]
    - [63, 83.671]
  - - [133, 135, 480, 64]
    - [46, 15.327]
  - - [1024, 3263, 1, 4096]
    - [138, 76.648]
  - - [1024, 3870, 1, 4096]
    - [9, 80.779]
  - - [4096, 3555, 1, 1024]
    - [22, 79.664]
  - - [4096, 3412, 1, 1024]
    - [62, 76.443]
  - - [101, 101, 624, 64]
    - [89, 15.64]
  - - [1024, 3296, 1, 4096]
    - [400, 77.104]
  - - [1024, 3379, 1, 4096]
    - [63, 79.26]
  - - [4096, 3302, 1, 1024]
    - [271, 78.676]
  - - [1024, 3490, 1, 4096]
    - [63, 81.97]
  - - [1024, 3428, 1, 4096]
    - [129, 80.494]
  - - [1024, 3976, 1, 4096]
    - [246, 82.215]
  - - [4096, 3485, 1, 1024]
    - [63, 79.015]
  - - [4096, 3534, 1, 1024]
    - [88, 78.344]
  - - [1024, 3064, 1, 4096]
    - [394, 79.288]
  - - [4096, 3216, 1, 1024]
    - [170, 76.533]
  - - [1024, 3450, 1, 4096]
    - [20, 80.936]
  - - [1024, 3533, 1, 4096]
    - [138, 82.741]
  - - [1024, 4030, 1, 1024]
    - [88, 64.01]
  - - [1024, 3311, 1, 4096]
    - [129, 78.177]
  - - [1024, 3468, 1, 4096]
    - [22, 82.136]
  - - [23, 23, 2720, 64]
    - [66, 4.645]
  - - [4096, 3359, 1, 1024]
    - [62, 76.179]
  - - [4096, 3392, 1, 1024]
    - [186, 78.336]
  - - [1024, 3925, 1, 1024]
    - [202, 60.605]
  - - [4096, 3233, 1, 1024]
    - [92, 77.689]
  - - [4096, 3956, 1, 1024]
    - [123, 78.972]
  - - [1024, 3463, 1, 4096]
    - [16, 81.394]
  - - [1024, 3126, 1, 4096]
    - [17, 80.544]
  - - [1024, 3363, 1, 4096]
    - [138, 79.324]
  - - [4096, 3465, 1, 1024]
    - [401, 77.24]
  - - [33708, 3996, 1, 1024]
    - [147, 90.526]
  - - [1024, 3231, 1, 4096]
    - [170, 75.81]
  - - [33708, 3978, 1, 1024]
    - [10, 90.058]
  - - [4096, 3476, 1, 1024]
    - [170, 79.318]
  - - [85, 85, 752, 64]
    - [44, 13.361]
  - - [4096, 3339, 1, 1024]
    - [402, 75.419]
  - - [4096, 3452, 1, 1024]
    - [190, 78.737]
  - - [1024, 3396, 1, 4096]
    - [209, 80.21]
  - - [4096, 3293, 1, 1024]
    - [271, 78.359]
  - - [54, 54, 1184, 64]
    - [130, 9.497]
  - - [1024, 3432, 1, 4096]
    - [75, 79.781]
  - - [4096, 3493, 1, 1024]
    - [22, 80.118]
  - - [4096, 3350, 1, 1024]
    - [210, 75.992]
  - - [1024, 3079, 1, 4096]
    - [153, 77.629]
  - - [1024, 3101, 1, 4096]
    - [198, 78.575]
  - - [33708, 3939, 1, 1024]
    - [147, 89.518]
  - - [4096, 3256, 1, 1024]
    - [98, 78.967]
  - - [1024, 3439, 1, 4096]
    - [63, 80.7]
  - - [1024, 3510, 1, 4096]
    - [22, 83.258]
  - - [4096, 3900, 1, 1024]
    - [125, 82.125]
  - - [1024, 3470, 1, 4096]
    - [285, 82.128]
  - - [4096, 3456, 1, 1024]
    - [102, 79.262]
  - - [4096, 3014, 1, 1024]
    - [98, 77.827]
  - - [4096, 3367, 1, 1024]
    - [147, 79.419]
  - - [4096, 3432, 1, 1024]
    - [221, 77.67]
  - - [33708, 4026, 1, 1024]
    - [116, 90.303]
  - - [4096, 3273, 1, 1024]
    - [271, 78.536]
  - - [4096, 3130, 1, 1024]
    - [147, 78.295]
  - - [1024, 3496, 1, 4096]
    - [20, 81.742]
  - - [1024, 3995, 1, 4096]
    - [57, 82.794]
  - - [1024, 3939, 1, 4096]
    - [321, 82.829]
  - - [1024, 3121, 1, 4096]
    - [198, 83.104]
  - - [1024, 3232, 1, 4096]
    - [8, 76.174]
  - - [4096, 3147, 1, 1024]
    - [202, 78.948]
  - - [4096, 3516, 1, 1024]
    - [82, 79.185]
  - - [1024, 3969, 1, 1024]
    - [88, 63.775]
  - - [1024, 3364, 1, 4096]
    - [129, 78.772]
  - - [4096, 3411, 1, 1024]
    - [394, 76.99]
  - - [147, 147, 432, 64]
    - [112, 17.365]
  - - [4096, 3301, 1, 1024]
    - [23, 78.051]
  - - [112, 111, 576, 64]
    - [403, 15.249]
  - - [1024, 3513, 1, 4096]
    - [22, 82.979]
  - - [1024, 3469, 1, 4096]
    - [14, 80.457]
  - - [1024, 3095, 1, 4096]
    - [267, 79.777]
  - - [4096, 3533, 1, 1024]
    - [251, 79.883]
  - - [4096, 3390, 1, 1024]
    - [104, 76.373]
  - - [4096, 3582, 1, 1024]
    - [170, 80.58]
  - - [1024, 3956, 1, 1024]
    - [404, 63.058]
  - - [4096, 3585, 1, 1024]
    - [271, 76.97]
  - - [4096, 3231, 1, 1024]
    - [29, 77.868]
  - - [1024, 3205, 1, 4096]
    - [22, 75.289]
  - - [4096, 3496, 1, 1024]
    - [22, 80.204]
  - - [1024, 3143, 1, 4096]
    - [11, 81.008]
  - - [1024, 3318, 1, 4096]
    - [129, 77.842]
  - - [1024, 3353, 1, 4096]
    - [285, 78.838]
  - - [1024, 3464, 1, 4096]
    - [209, 82.175]
  - - [4096, 2736, 1, 1024]
    - [23, 75.63]
  - - [1024, 3402, 1, 4096]
    - [285, 79.892]
  - - [4096, 3138, 1, 1024]
    - [125, 79.138]
  - - [1024, 3860, 1, 4096]
    - [190, 80.413]
  - - [148, 148, 432, 64]
    - [46, 15.235]
  - - [1024, 3539, 1, 4096]
    - [129, 83.091]
  - - [4096, 3211, 1, 1024]
    - [98, 77.513]
  - - [1024, 3332, 1, 4096]
    - [14, 78.728]
  - - [1024, 3466, 1, 4096]
    - [129, 81.332]
  - - [4096, 3475, 1, 1024]
    - [147, 80.97]
  - - [4096, 3524, 1, 1024]
    - [62, 79.809]
  - - [4096, 2985, 1, 1024]
    - [189, 76.701]
  - - [4096, 3222, 1, 1024]
    - [129, 77.235]
  - - [4096, 3451, 1, 1024]
    - [82, 78.112]
  - - [1024, 3181, 1, 4096]
    - [20, 75.368]
  - - [1024, 3640, 1, 4096]
    - [138, 85.435]
  - - [1024, 3375, 1, 4096]
    - [63, 79.73]
  - - [1024, 3550, 1, 4096]
    - [20, 83.288]
  - - [1024, 4020, 1, 1024]
    - [202, 63.228]
  - - [4096, 3349, 1, 1024]
    - [8, 76.361]
  - - [4096, 3398, 1, 1024]
    - [10, 76.529]
  - - [33708, 3976, 1, 1024]
    - [147, 90.323]
  - - [1024, 2917, 1, 4096]
    - [60, 75.974]
  - - [33708, 3910, 1, 1024]
    - [88, 90.617]
  - - [4096, 3860, 1, 1024]
    - [147, 81.047]
  - - [4096, 3304, 1, 1024]
    - [92, 79.321]
  - - [1024, 3286, 1, 4096]
    - [335, 77.071]
  - - [1024, 3460, 1, 4096]
    - [129, 81.68]
  - - [1024, 4026, 1, 4096]
    - [82, 83.857]
  - - [4096, 3471, 1, 1024]
    - [92, 78.754]
  - - [193, 193, 320, 64]
    - [334, 16.613]
  - - [1024, 3894, 1, 1024]
    - [82, 61.825]
  - - [65, 65, 992, 64]
    - [146, 9.028]
  - - [1024, 3506, 1, 4096]
    - [285, 82.855]
  - - [35, 35, 1808, 64]
    - [42, 7.432]
  - - [1024, 4000, 1, 1024]
    - [43, 63.246]
  - - [1024, 3900, 1, 4096]
    - [321, 81.307]
  - - [1024, 3445, 1, 4096]
    - [63, 81.399]
  - - [4096, 3442, 1, 1024]
    - [63, 77.574]
  - - [1024, 3358, 1, 4096]
    - [63, 78.929]
  - - [13, 13, 4672, 64]
    - [164, 2.974]
  - - [1024, 3211, 1, 4096]
    - [63, 75.668]
  - - [4096, 3515, 1, 1024]
    - [205, 79.683]
  - - [1024, 3564, 1, 4096]
    - [138, 83.852]
  - - [4096, 3057, 1, 1024]
    - [12, 79.316]
  - - [1024, 3343, 1, 4096]
    - [20, 78.647]
  - - [4096, 3262, 1, 1024]
    - [211, 77.849]
  - - [1024, 3518, 1, 4096]
    - [22, 82.676]
  - - [77, 77, 816, 64]
    - [240, 12.01]
  - - [33708, 3876, 1, 1024]
    - [186, 89.819]
  - - [4096, 3462, 1, 1024]
    - [10, 79.079]
  - - [1024, 3265, 1, 4096]
    - [63, 77.23]
  - - [4096, 3389, 1, 1024]
    - [116, 78.195]
  - - [4096, 3438, 1, 1024]
    - [22, 78.31]
  - - [1024, 3955, 1, 1024]
    - [397, 58.825]
  - - [1024, 3545, 1, 4096]
    - [65, 83.328]
  - - [1024, 3144, 1, 4096]
    - [394, 79.715]
  - - [1024, 3417, 1, 4096]
    - [63, 79.756]
  - - [4096, 3543, 1, 1024]
    - [321, 80.025]
  - - [4096, 3352, 1, 1024]
    - [12, 76.244]
  - - [33708, 3975, 1, 1024]
    - [88, 90.029]
  - - [148, 147, 432, 64]
    - [44, 15.917]
  - - [4096, 3137, 1, 1024]
    - [190, 78.941]
  - - [4096, 3506, 1, 1024]
    - [147, 79.89]
  - - [1024, 3975, 1, 1024]
    - [175, 62.036]
  - - [1024, 3859, 1, 4096]
    - [82, 80.756]
  - - [4096, 3369, 1, 1024]
    - [202, 78.343]
  - - [1024, 3434, 1, 4096]
    - [63, 81.017]
  - - [1024, 3292, 1, 4096]
    - [138, 77.636]
  - - [4096, 3523, 1, 1024]
    - [190, 80.749]
  - - [4096, 3380, 1, 1024]
    - [147, 78.844]
  - - [1024, 3408, 1, 4096]
    - [63, 80.09]
  - - [4096, 3221, 1, 1024]
    - [29, 78.014]
  - - [4096, 3270, 1, 1024]
    - [22, 77.248]
  - - [143, 143, 432, 64]
    - [81, 15.95]
  - - [111, 111, 576, 64]
    - [283, 13.843]
  - - [1024, 3303, 1, 4096]
    - [65, 77.226]
  - - [4096, 3502, 1, 1024]
    - [55, 79.053]
  - - [1024, 3222, 1, 4096]
    - [63, 75.929]
  - - [4096, 2505, 1, 1024]
    - [104, 73.82]
  - - [4096, 3397, 1, 1024]
    - [16, 76.837]
  - - [4096, 3562, 1, 1024]
    - [123, 79.82]
  - - [4096, 3095, 1, 1024]
    - [202, 78.159]
  - - [1024, 3226, 1, 4096]
    - [138, 76.351]
  - - [177, 177, 352, 64]
    - [73, 18.925]
  - - [4096, 3360, 1, 1024]
    - [147, 78.839]
  - - [1024, 3942, 1, 1024]
    - [275, 61.421]
  - - [1024, 3298, 1, 4096]
    - [112, 77.079]
  - - [1024, 3381, 1, 4096]
    - [285, 78.918]
  - - [4096, 3314, 1, 1024]
    - [405, 77.363]
  - - [1024, 3492, 1, 4096]
    - [123, 81.263]
  - - [1024, 3430, 1, 4096]
    - [20, 81.116]
  - - [4096, 3977, 1, 1024]
    - [198, 79.202]
  - - [4096, 3546, 1, 1024]
    - [170, 79.875]
  - - [4096, 3640, 1, 1024]
    - [170, 78.364]
  - - [4096, 3441, 1, 1024]
    - [170, 77.372]
  - - [33708, 4059, 1, 1024]
    - [88, 90.175]
  - - [1024, 3978, 1, 1024]
    - [406, 62.704]
  - - [1024, 3376, 1, 4096]
    - [138, 80.502]
  - - [1024, 3482, 1, 4096]
    - [20, 81.198]
  - - [1024, 3563, 1, 4096]
    - [65, 82.409]
  - - [4096, 4020, 1, 1024]
    - [189, 78.591]
  - - [1024, 3271, 1, 4096]
    - [335, 76.762]
  - - [1024, 3291, 1, 4096]
    - [138, 77.296]
  - - [1024, 3431, 1, 4096]
    - [22, 80.34]
  - - [1024, 3481, 1, 4096]
    - [63, 81.584]
  - - [84, 85, 752, 64]
    - [407, 11.803]
  - - [4096, 3461, 1, 1024]
    - [98, 78.202]
  - - [1024, 3574, 1, 4096]
    - [65, 83.085]
  - - [1024, 4059, 1, 1024]
    - [208, 62.734]
  - - [84, 84, 752, 64]
    - [408, 12.829]
  - - [1024, 3421, 1, 4096]
    - [22, 80.271]
  - - [4096, 3224, 1, 1024]
    - [14, 77.185]
  - - [4096, 3437, 1, 1024]
    - [147, 79.336]
  - - [45, 45, 1424, 64]
    - [171, 9.483]
  - - [4096, 3168, 1, 1024]
    - [88, 79.93]
  - - [33708, 3990, 1, 1024]
    - [186, 89.935]
  - - [1024, 3349, 1, 4096]
    - [138, 79.527]
  - - [4096, 3335, 1, 1024]
    - [394, 75.594]
  - - [4096, 3400, 1, 1024]
    - [57, 76.481]
  - - [160, 159, 400, 64]
    - [409, 17.967]
  - - [1024, 3398, 1, 4096]
    - [285, 79.95]
  - - [1024, 3780, 1, 4096]
    - [63, 88.119]
  - - [29, 29, 2176, 64]
    - [46, 6.145]
  - - [4096, 3098, 1, 1024]
    - [57, 78.719]
  - - [1024, 4012, 1, 4096]
    - [190, 83.781]
  - - [4096, 3505, 1, 1024]
    - [340, 77.726]
  - - [4096, 3554, 1, 1024]
    - [14, 79.983]
  - - [4096, 3063, 1, 1024]
    - [205, 79.13]
  - - [1024, 3503, 1, 4096]
    - [14, 82.631]
  - - [1024, 3166, 1, 4096]
    - [17, 81.725]
  - - [1024, 3425, 1, 4096]
    - [20, 80.72]
  - - [1024, 3344, 1, 4096]
    - [63, 78.595]
  - - [4096, 3484, 1, 1024]
    - [246, 79.465]
  - - [1024, 3681, 1, 1024]
    - [115, 63.925]
  - - [1024, 4050, 1, 1024]
    - [22, 65.072]
  - - [4096, 3379, 1, 1024]
    - [198, 78.209]
  - - [4096, 3428, 1, 1024]
    - [186, 77.493]
  - - [12, 12, 5040, 64]
    - [410, 2.579]
  - - [27, 27, 2336, 64]
    - [411, 6.356]
  - - [1024, 3304, 1, 4096]
    - [63, 78.083]
  - - [1024, 3387, 1, 4096]
    - [209, 79.476]
  - - [4096, 3126, 1, 1024]
    - [147, 78.818]
  - - [1024, 3498, 1, 4096]
    - [65, 82.09]
  - - [1024, 3436, 1, 4096]
    - [22, 80.613]
  - - [4096, 3501, 1, 1024]
    - [88, 80.118]
  - - [4096, 3358, 1, 1024]
    - [88, 76.597]
  - - [4096, 3232, 1, 1024]
    - [285, 77.874]
  - - [1024, 3585, 1, 4096]
    - [129, 84.835]
  - - [4096, 3143, 1, 1024]
    - [202, 79.582]
  - - [4096, 3464, 1, 1024]
    - [104, 77.97]
  - - [1024, 3366, 1, 4096]
    - [20, 79.69]
  - - [4096, 3375, 1, 1024]
    - [10, 77.685]
  - - [4096, 2917, 1, 1024]
    - [23, 75.243]
  - - [4096, 4026, 1, 1024]
    - [116, 79.739]
  - - [49, 49, 1296, 64]
    - [130, 9.277]
  - - [1024, 3277, 1, 4096]
    - [138, 76.926]
  - - [1024, 3103, 1, 4096]
    - [17, 78.685]
  - - [33708, 3995, 1, 1024]
    - [88, 90.317]
  - - [1024, 3297, 1, 4096]
    - [15, 77.475]
  - - [4096, 3545, 1, 1024]
    - [55, 79.152]
  - - [1024, 3399, 1, 4096]
    - [138, 79.954]
  - - [33708, 3796, 1, 1024]
    - [116, 90.188]
  - - [4096, 3292, 1, 1024]
    - [98, 79.247]
  - - [71, 71, 896, 64]
    - [146, 10.649]
  - - [33708, 3859, 1, 1024]
    - [147, 89.78]
  - - [4096, 3566, 1, 1024]
    - [14, 79.885]
  - - [4096, 3894, 1, 1024]
    - [125, 80.918]
  - - [4096, 3492, 1, 1024]
    - [98, 79.453]
  - - [1024, 3977, 1, 1024]
    - [43, 62.949]
  - - [1024, 3272, 1, 4096]
    - [15, 76.976]
  - - [135, 134, 480, 64]
    - [156, 15.159]
  - - [1024, 3355, 1, 4096]
    - [209, 79.214]
  - - [4096, 3419, 1, 1024]
    - [29, 77.095]
  - - [1024, 3404, 1, 4096]
    - [20, 80.102]
  - - [4096, 3999, 1, 1024]
    - [261, 79.416]
  - - [4096, 3166, 1, 1024]
    - [125, 79.566]
  - - [33708, 3840, 1, 1024]
    - [147, 91.858]
  - - [4096, 4032, 1, 1024]
    - [116, 79.21]
  - - [1024, 3573, 1, 4096]
    - [138, 83.833]
  - - [4096, 3366, 1, 1024]
    - [147, 78.197]
  - - [1024, 3541, 1, 4096]
    - [63, 83.259]
  - - [4096, 3207, 1, 1024]
    - [251, 77.856]
  - - [4096, 3272, 1, 1024]
    - [12, 78.003]
  - - [1024, 3334, 1, 4096]
    - [16, 78.362]
  - - [228, 228, 272, 64]
    - [81, 15.627]
  - - [4096, 3183, 1, 1024]
    - [123, 77.08]
  - - [4096, 3536, 1, 1024]
    - [57, 79.53]
  - - [1024, 4005, 1, 1024]
    - [261, 60.979]
  - - [1024, 3245, 1, 4096]
    - [129, 76.263]
  - - [4096, 3447, 1, 1024]
    - [225, 77.936]
  - - [1024, 3183, 1, 4096]
    - [335, 75.093]
  - - [1024, 3361, 1, 4096]
    - [65, 78.981]
  - - [33708, 3870, 1, 1024]
    - [147, 89.651]
  - - [1024, 3321, 1, 4096]
    - [335, 77.883]
  - - [1024, 3486, 1, 4096]
    - [63, 82.3]
  - - [4096, 4005, 1, 1024]
    - [198, 79.865]
  - - [4096, 3410, 1, 1024]
    - [22, 76.781]
  - - [1024, 3944, 1, 1024]
    - [175, 63.367]
  - - [4096, 3300, 1, 1024]
    - [16, 78.968]
  - - [4096, 3579, 1, 1024]
    - [211, 80.53]
  - - [4096, 3483, 1, 1024]
    - [19, 78.713]
  - - [4096, 3532, 1, 1024]
    - [12, 79.692]
  - - [1024, 3140, 1, 4096]
    - [17, 79.283]
  - - [1024, 3372, 1, 4096]
    - [285, 79.178]
  - - [1024, 3224, 1, 4096]
    - [144, 75.846]
  - - [4096, 3230, 1, 1024]
    - [23, 78.225]
  - - [4096, 3427, 1, 1024]
    - [271, 78.008]
  - - [1024, 3796, 1, 1024]
    - [234, 68.565]
  - - [143, 148, 432, 64]
    - [48, 14.768]
  - - [1024, 3616, 1, 4096]
    - [20, 84.674]
  - - [1024, 3315, 1, 4096]
    - [63, 77.651]
  - - [1024, 3476, 1, 4096]
    - [65, 81.642]
  - - [1024, 3509, 1, 4096]
    - [22, 82.768]
  - - [4096, 3357, 1, 1024]
    - [205, 75.806]
  - - [4096, 3406, 1, 1024]
    - [412, 77.227]
  - - [1024, 3558, 1, 4096]
    - [65, 83.428]
  - - [4096, 3593, 1, 1024]
    - [22, 78.139]
  - - [4096, 3247, 1, 1024]
    - [251, 78.274]
  - - [4096, 3088, 1, 1024]
    - [190, 77.968]
  - - [1024, 3213, 1, 4096]
    - [98, 75.505]
  - - [4096, 3511, 1, 1024]
    - [82, 79.561]
  - - [122, 122, 528, 64]
    - [81, 13.323]
  - - [1024, 3365, 1, 4096]
    - [209, 79.169]
  - - [1024, 3504, 1, 4096]
    - [129, 82.456]
  - - [1024, 3442, 1, 4096]
    - [20, 81.291]
  - - [4096, 3474, 1, 1024]
    - [88, 79.444]
  - - [4096, 2984, 1, 1024]
    - [8, 77.517]
  - - [1024, 3876, 1, 4096]
    - [190, 80.995]
  - - [4096, 3337, 1, 1024]
    - [189, 75.424]
  - - [4096, 3450, 1, 1024]
    - [98, 78.009]
  - - [1024, 3547, 1, 4096]
    - [63, 83.586]
  - - [4096, 3291, 1, 1024]
    - [251, 79.472]
  - - [1024, 3340, 1, 4096]
    - [22, 78.923]
  - - [4096, 3491, 1, 1024]
    - [116, 80.515]
  - - [4096, 3348, 1, 1024]
    - [116, 77.44]
  - - [78, 78, 816, 64]
    - [66, 11.024]
  - - [4096, 3906, 1, 1024]
    - [10, 80.559]
  - - [1024, 3477, 1, 4096]
    - [129, 81.363]
  - - [1024, 3397, 1, 4096]
    - [63, 79.466]
  - - [4096, 3165, 1, 1024]
    - [62, 79.834]
  - - [4096, 3470, 1, 1024]
    - [98, 77.162]
  - - [1024, 3526, 1, 4096]
    - [63, 82.723]
  - - [112, 112, 576, 64]
    - [413, 14.131]
  - - [4096, 3365, 1, 1024]
    - [116, 77.686]
  - - [4096, 3319, 1, 1024]
    - [170, 79.449]
  - - [1024, 3401, 1, 4096]
    - [20, 79.842]
  - - [1024, 3294, 1, 4096]
    - [129, 77.491]
  - - [159, 159, 400, 64]
    - [41, 17.195]
  - - [1024, 3472, 1, 4096]
    - [20, 81.633]
  - - [4096, 3328, 1, 1024]
    - [14, 78.63]
  - - [1024, 3861, 1, 1024]
    - [89, 55.609]
  - - [1024, 3910, 1, 1024]
    - [202, 60.291]
  - - [1024, 3410, 1, 4096]
    - [138, 80.092]
  - - [1024, 3395, 1, 4096]
    - [138, 79.695]
  - - [4096, 3282, 1, 1024]
    - [22, 79.311]
  - - [1024, 3751, 1, 1024]
    - [285, 65.249]
  - - [4096, 3145, 1, 1024]
    - [202, 79.444]
  - - [4096, 3514, 1, 1024]
    - [251, 79.629]
  - - [4096, 3944, 1, 1024]
    - [92, 78.73]
  - - [1024, 3515, 1, 4096]
    - [63, 83.02]
  - - [4096, 3409, 1, 1024]
    - [340, 78.076]
  - - [4096, 3564, 1, 1024]
    - [22, 79.558]
  - - [4096, 3299, 1, 1024]
    - [251, 78.468]
  - - [1024, 3057, 1, 4096]
    - [402, 79.853]
  - - [4096, 3531, 1, 1024]
    - [123, 79.297]
  - - [4096, 3388, 1, 1024]
    - [102, 77.287]
  - - [1024, 3189, 1, 4096]
    - [138, 75.389]
  - - [1024, 3300, 1, 4096]
    - [63, 78.123]
  - - [1024, 3720, 1, 4096]
    - [29, 86.961]
  - - [1024, 3383, 1, 4096]
    - [20, 79.531]
  - - [1024, 3494, 1, 4096]
    - [63, 82.721]
  - - [77, 78, 816, 64]
    - [62, 11.634]
  - - [1024, 3448, 1, 4096]
    - [63, 81.037]
  - - [4096, 3542, 1, 1024]
    - [170, 79.927]
  - - [1024, 3488, 1, 4096]
    - [63, 81.924]
  - - [4096, 3405, 1, 1024]
    - [261, 76.49]
  - - [1024, 3262, 1, 4096]
    - [138, 77.325]
  - - [33708, 4005, 1, 1024]
    - [147, 90.387]
  - - [1024, 3594, 1, 4096]
    - [20, 84.423]
  - - [4096, 3103, 1, 1024]
    - [55, 78.056]
  - - [4096, 3136, 1, 1024]
    - [62, 79.507]
  - - [1024, 3378, 1, 4096]
    - [209, 79.465]
  - - [10, 10, 5952, 64]
    - [164, 2.776]
  - - [7, 7, 8192, 64]
    - [242, 1.496]
  - - [4096, 3559, 1, 1024]
    - [24, 79.061]
  - - [4096, 3368, 1, 1024]
    - [9, 76.372]
  - - [4096, 3209, 1, 1024]
    - [138, 77.73]
  - - [4096, 3322, 1, 1024]
    - [22, 78.733]
  - - [1024, 3483, 1, 4096]
    - [170, 82.383]
  - - [4096, 3473, 1, 1024]
    - [147, 80.555]
  - - [4096, 3522, 1, 1024]
    - [202, 78.842]
  - - [1024, 3532, 1, 4096]
    - [65, 82.906]
  - - [4096, 3449, 1, 1024]
    - [200, 77.46]
  - - [1024, 3351, 1, 4096]
    - [65, 78.632]
  - - [1024, 3462, 1, 4096]
    - [20, 81.468]
  - - [4096, 3396, 1, 1024]
    - [200, 79.027]
  - - [132, 132, 480, 64]
    - [46, 14.355]
  - - [111, 112, 576, 64]
    - [265, 13.198]
  - - [1024, 3416, 1, 4096]
    - [65, 80.84]
  - - [4096, 3469, 1, 1024]
    - [62, 78.912]
  - - [1024, 3582, 1, 4096]
    - [22, 83.841]
  - - [1024, 3230, 1, 4096]
    - [29, 75.547]
  - - [1024, 3489, 1, 4096]
    - [22, 82.457]
  - - [1024, 3427, 1, 4096]
    - [65, 80.575]
  - - [1024, 3346, 1, 4096]
    - [144, 78.578]
  - - [33708, 3977, 1, 1024]
    - [201, 89.794]
  - - [4096, 3796, 1, 1024]
    - [285, 78.079]
  - - [4096, 3176, 1, 1024]
    - [105, 74.897]
  - - [4096, 3990, 1, 1024]
    - [29, 77.949]
  - - [1024, 3257, 1, 4096]
    - [414, 76.8]
  - - [4096, 3343, 1, 1024]
    - [18, 75.522]
  - - [4096, 3440, 1, 1024]
    - [190, 77.686]
  - - [33708, 4030, 1, 1024]
    - [88, 90.371]
  - - [1024, 3190, 1, 4096]
    - [63, 74.96]
  - - [1024, 3389, 1, 4096]
    - [65, 79.357]
  - - [1024, 3500, 1, 4096]
    - [129, 82.181]
  - - [1024, 3471, 1, 4096]
    - [285, 82.266]
  - - [1024, 3438, 1, 4096]
    - [65, 80.977]
  - - [4096, 3513, 1, 1024]
    - [129, 78.936]
  - - [1024, 3562, 1, 4096]
    - [63, 83.595]
  - - [4096, 3616, 1, 1024]
    - [12, 76.082]
  - - [4096, 3955, 1, 1024]
    - [29, 81.092]
  - - [1024, 3441, 1, 4096]
    - [138, 80.75]
  - - [1024, 3236, 1, 4096]
    - [138, 76.01]
  - - [1024, 3524, 1, 4096]
    - [285, 82.715]
  - - [4096, 3460, 1, 1024]
    - [246, 77.89]
  - - [16, 16, 3840, 64]
    - [410, 3.836]
  - - [92, 93, 688, 64]
    - [415, 13.085]
  - - [1024, 3384, 1, 4096]
    - [65, 79.622]
  - - [4096, 3387, 1, 1024]
    - [147, 77.922]
  - - [4096, 3436, 1, 1024]
    - [416, 78.399]
  - - [4096, 3277, 1, 1024]
    - [147, 77.206]
  - - [1024, 3457, 1, 4096]
    - [20, 81.428]
  - - [1024, 3999, 1, 4096]
    - [82, 83.596]
  - - [1024, 4032, 1, 4096]
    - [246, 85.026]
  - - [4096, 3541, 1, 1024]
    - [88, 79.809]
  - - [4096, 3334, 1, 1024]
    - [23, 74.874]
  - - [1024, 3393, 1, 4096]
    - [129, 79.683]
  - - [17, 17, 3632, 64]
    - [307, 3.903]
  - - [1024, 3411, 1, 4096]
    - [63, 80.817]
  - - [1024, 3822, 1, 1024]
    - [129, 65.791]
  - - [1024, 3593, 1, 4096]
    - [138, 84.311]
  - - [33708, 3822, 1, 1024]
    - [147, 90.534]
  - - [4096, 3504, 1, 1024]
    - [321, 79.754]
  - - [1024, 3163, 1, 4096]
    - [267, 80.472]
  - - [1024, 3357, 1, 4096]
    - [129, 79.63]
  - - [1024, 3906, 1, 4096]
    - [321, 82.04]
  - - [4096, 3415, 1, 1024]
    - [29, 78.488]
  - - [1024, 3406, 1, 4096]
    - [22, 80.443]
  - - [4096, 3321, 1, 1024]
    - [22, 78.724]
  - - [4096, 3584, 1, 1024]
    - [104, 80.567]
  - - [1024, 2736, 1, 4096]
    - [9, 82.166]
  - - [1024, 3110, 1, 4096]
    - [198, 77.899]
  - - [33708, 3999, 1, 1024]
    - [147, 90.3]
  - - [1024, 3093, 1, 4096]
    - [60, 78.291]
  - - [4096, 3378, 1, 1024]
    - [9, 77.348]
  - - [1024, 3543, 1, 4096]
    - [29, 82.881]
  - - [33708, 3925, 1, 1024]
    - [186, 91.032]
  - - [1024, 3352, 1, 4096]
    - [170, 78.434]
  - - [4096, 3780, 1, 1024]
    - [390, 79.53]
  - - [1024, 3990, 1, 4096]
    - [55, 83.49]
  - - [4096, 3500, 1, 1024]
    - [8, 79.696]
  - - [4096, 3996, 1, 1024]
    - [394, 79.55]
  - - [1024, 3247, 1, 4096]
    - [20, 76.826]
  - - [4096, 3395, 1, 1024]
    - [205, 78.102]
  - - [1024, 3169, 1, 4096]
    - [112, 75.214]
  - - [1024, 3088, 1, 4096]
    - [11, 77.818]
  - - [1024, 3584, 1, 4096]
    - [138, 84.822]
  - - [4096, 3093, 1, 1024]
    - [186, 78.077]
  - - [1024, 3538, 1, 4096]
    - [129, 83.741]
  - - [1024, 3996, 1, 1024]
    - [138, 63.275]
  - - [1024, 3581, 1, 4096]
    - [22, 83.736]
  - - [4096, 3374, 1, 1024]
    - [202, 77.886]
  - - [33708, 3751, 1, 1024]
    - [88, 89.661]
  - - [59, 59, 1088, 64]
    - [417, 10.948]
  - - [4096, 3215, 1, 1024]
    - [123, 77.21]
  - - [4096, 3312, 1, 1024]
    - [211, 79.775]
  - - [4096, 3581, 1, 1024]
    - [390, 79.151]
  - - [4096, 3479, 1, 1024]
    - [102, 80.162]
  - - [4096, 3544, 1, 1024]
    - [22, 78.949]
  - - [1024, 3870, 1, 1024]
    - [412, 55.887]
  - - [1024, 3374, 1, 4096]
    - [29, 79.221]
  - - [1024, 2967, 1, 4096]
    - [299, 80.04]
  - - [41, 41, 1552, 64]
    - [44, 8.769]
  - - [4096, 3455, 1, 1024]
    - [299, 78.015]
  - - [4096, 3942, 1, 1024]
    - [22, 80.512]
  - - [1024, 3528, 1, 4096]
    - [63, 83.329]
  - - [4096, 3186, 1, 1024]
    - [205, 76.403]
  - - [1024, 3976, 1, 1024]
    - [23, 62.062]
  - - [1024, 3511, 1, 4096]
    - [138, 83.081]
  - - [4096, 3573, 1, 1024]
    - [129, 78.931]
  - - [4096, 3561, 1, 1024]
    - [24, 78.457]
  - - [4096, 3418, 1, 1024]
    - [16, 78.071]
  - - [33708, 3906, 1, 1024]
    - [88, 90.349]
  - - [4096, 3259, 1, 1024]
    - [271, 78.371]
  - - [4096, 3308, 1, 1024]
    - [271, 77.533]
  - - [1024, 3419, 1, 4096]
    - [22, 80.587]
  - - [1024, 3215, 1, 4096]
    - [20, 76.264]
  - - [1024, 4030, 1, 4096]
    - [57, 83.162]
  - - [4096, 3459, 1, 1024]
    - [57, 78.724]
  - - [1024, 3572, 1, 4096]
    - [138, 83.76]
  - - [1024, 3137, 1, 4096]
    - [17, 81.254]
  - - [1024, 3312, 1, 4096]
    - [20, 77.794]
  - - [1024, 3925, 1, 4096]
    - [82, 80.967]
  - - [1024, 3453, 1, 4096]
    - [65, 80.979]
  - - [4096, 3435, 1, 1024]
    - [8, 77.954]
  - - [1024, 3176, 1, 4096]
    - [383, 75.06]
  - - [1024, 3444, 1, 4096]
    - [63, 80.801]
  - - [4096, 3975, 1, 1024]
    - [190, 77.655]
  - - [4096, 3182, 1, 1024]
    - [12, 75.416]
  - - [1024, 3475, 1, 4096]
    - [65, 81.578]
  - - [9, 9, 6544, 64]
    - [164, 2.273]
  - - [33708, 3955, 1, 1024]
    - [147, 89.647]
  - - [4096, 3446, 1, 1024]
    - [19, 78.225]
  - - [1024, 3138, 1, 4096]
    - [198, 79.686]
  - - [1024, 3549, 1, 4096]
    - [63, 83.271]
  - - [4096, 3287, 1, 1024]
    - [63, 78.094]
  - - [1024, 3342, 1, 4096]
    - [63, 78.516]
  - - [102, 102, 624, 64]
    - [418, 14.573]
  - - [4096, 3519, 1, 1024]
    - [22, 79.774]
  - - [4096, 3552, 1, 1024]
    - [190, 80.514]
  - - [4096, 3859, 1, 1024]
    - [9, 80.33]
  - - [33708, 3969, 1, 1024]
    - [147, 89.67]
  - - [1024, 3369, 1, 4096]
    - [271, 79.584]
  - - [4096, 3482, 1, 1024]
    - [19, 78.185]
  - - [1024, 3306, 1, 4096]
    - [335, 78.064]
  - - [1024, 3474, 1, 4096]
    - [20, 81.581]
  - - [99, 99, 624, 64]
    - [43, 15.695]
  - - [4096, 3377, 1, 1024]
    - [202, 78.778]
  - - [4096, 3426, 1, 1024]
    - [63, 76.535]
  - - [4096, 2935, 1, 1024]
    - [12, 75.38]
  - - [4096, 3267, 1, 1024]
    - [123, 78.548]
  - - [1024, 3299, 1, 4096]
    - [20, 77.331]
  - - [1024, 3456, 1, 4096]
    - [67, 81.834]
  - - [1024, 3280, 1, 4096]
    - [63, 77.299]
  - - [1024, 3555, 1, 4096]
    - [22, 83.32]
  - - [4096, 3499, 1, 1024]
    - [62, 79.145]
  - - [4096, 3356, 1, 1024]
    - [18, 75.436]
  - - [100, 102, 624, 64]
    - [43, 14.312]
  - - [1024, 3412, 1, 4096]
    - [209, 80.151]
  - - [1024, 2984, 1, 4096]
    - [243, 77.639]
  - - [4096, 3141, 1, 1024]
    - [147, 79.565]
  - - [4096, 3510, 1, 1024]
    - [19, 79.413]
  - - [1024, 3995, 1, 1024]
    - [32, 63.842]
  - - [1024, 3517, 1, 4096]
    - [63, 82.344]
  - - [1024, 3455, 1, 4096]
    - [29, 80.51]
  - - [1024, 3939, 1, 1024]
    - [82, 61.132]
  - - [38, 38, 1680, 64]
    - [44, 8.451]
  - - [1024, 3447, 1, 4096]
    - [63, 80.791]
  - - [1024, 3969, 1, 4096]
    - [243, 81.863]
  - - [4096, 3527, 1, 1024]
    - [202, 79.689]
  - - [4096, 3336, 1, 1024]
    - [394, 78.179]
  - - [1024, 3191, 1, 4096]
    - [22, 75.58]
  - - [1024, 3302, 1, 4096]
    - [22, 78.056]
  - - [1024, 3337, 1, 4096]
    - [29, 78.898]
  - - [4096, 3290, 1, 1024]
    - [14, 78.568]
  - - [1024, 3512, 1, 4096]
    - [129, 82.951]
  - - [1024, 3433, 1, 4096]
    - [65, 80.589]
  - - [4096, 3876, 1, 1024]
    - [190, 81.937]
  - - [4096, 3490, 1, 1024]
    - [98, 79.502]
  - - [4096, 3064, 1, 1024]
    - [138, 76.929]
  - - [1024, 3508, 1, 4096]
    - [65, 82.832]
  - - [1024, 3956, 1, 4096]
    - [9, 82.022]
  - - [4096, 3417, 1, 1024]
    - [8, 76.252]
  - - [1024, 3248, 1, 4096]
    - [209, 76.235]
  - - [1024, 2499, 1, 4096]
    - [321, 74.801]
  - - [1024, 3186, 1, 4096]
    - [103, 74.728]
  - - [1024, 3180, 1, 4096]
    - [15, 75.37]
  - - [4096, 3364, 1, 1024]
    - [147, 78.449]
  - - [4096, 3976, 1, 1024]
    - [60, 77.335]
  - - [4096, 3205, 1, 1024]
    - [98, 78.801]
  - - [4096, 3318, 1, 1024]
    - [16, 79.816]
  - - [1024, 3377, 1, 4096]
    - [129, 79.126]
  - - [1024, 3485, 1, 4096]
    - [20, 81.885]
  - - [4096, 3181, 1, 1024]
    - [63, 76.222]
  - - [4096, 3550, 1, 1024]
    - [401, 78.432]
  - - [1024, 3534, 1, 4096]
    - [22, 83.048]
  - - [1024, 3860, 1, 1024]
    - [98, 59.983]
  - - [160, 160, 400, 64]
    - [156, 17.332]
  - - [4096, 3445, 1, 1024]
    - [271, 78.7]
  - - [1024, 3391, 1, 4096]
    - [65, 80.198]
  - - [1024, 3221, 1, 4096]
    - [129, 75.643]
  - - [4096, 3079, 1, 1024]
    - [116, 77.552]
  - - [4096, 3144, 1, 1024]
    - [116, 79.146]
  - - [1024, 3270, 1, 4096]
    - [144, 76.561]
  - - [1024, 3561, 1, 4096]
    - [20, 84.157]
  - - [1024, 3480, 1, 4096]
    - [20, 82.05]
  - - [4096, 3408, 1, 1024]
    - [225, 76.489]
  - - [1024, 3418, 1, 4096]
    - [63, 80.211]
  - - [4096, 3298, 1, 1024]
    - [29, 77.852]
  - - [1024, 3640, 1, 1024]
    - [22, 68.714]
  - - [1024, 3449, 1, 4096]
    - [63, 81.214]
  - - [1024, 4020, 1, 4096]
    - [9, 83.477]
  - - [4096, 3481, 1, 1024]
    - [170, 79.105]
  - - [4096, 3530, 1, 1024]
    - [14, 79.768]
  - - [1024, 3216, 1, 4096]
    - [65, 76.086]
  - - [1024, 3491, 1, 4096]
    - [63, 82.125]
  - - [1024, 3154, 1, 4096]
    - [396, 79.482]
  - - [4096, 3425, 1, 1024]
    - [68, 78.087]
  - - [1024, 3348, 1, 4096]
    - [144, 78.836]
  - - [1024, 3415, 1, 4096]
    - [20, 80.781]
  - - [1024, 4026, 1, 1024]
    - [286, 62.866]
  - - [1024, 3367, 1, 4096]
    - [129, 79.071]
  - - [1024, 3259, 1, 4096]
    - [22, 77.098]
  - - [1024, 3894, 1, 4096]
    - [246, 80.857]
  - - [4096, 3355, 1, 1024]
    - [147, 76.775]
  - - [4096, 3404, 1, 1024]
    - [225, 76.966]
  - - [1024, 3308, 1, 4096]
    - [138, 77.644]
  - - [4096, 3245, 1, 1024]
    - [12, 78.497]
  - - [1024, 3502, 1, 4096]
    - [129, 82.306]
  - - [33708, 4032, 1, 1024]
    - [147, 91.546]
  - - [8, 8, 7280, 64]
    - [419, 1.83]
  - - [1024, 3424, 1, 4096]
    - [20, 80.295]
  - - [4096, 3509, 1, 1024]
    - [136, 77.862]
  - - [4096, 3558, 1, 1024]
    - [136, 79.384]
  - - [1024, 3900, 1, 1024]
    - [420, 61.186]
  - - [1024, 2505, 1, 4096]
    - [16, 75.03]
  - - [4096, 3472, 1, 1024]
    - [271, 78.943]
  - - [1024, 3386, 1, 4096]
    - [63, 79.511]
  - - [4096, 3383, 1, 1024]
    - [310, 76.349]
  - - [4096, 3448, 1, 1024]
    - [394, 78.367]
  - - [4096, 4030, 1, 1024]
    - [189, 78.66]
  - - [4096, 3289, 1, 1024]
    - [16, 78.6]
  - - [1024, 3459, 1, 4096]
    - [22, 81.261]
  - - [1024, 2918, 1, 4096]
    - [299, 78.781]
  - - [4096, 3489, 1, 1024]
    - [211, 78.022]
  - - [4096, 3346, 1, 1024]
    - [125, 75.764]
  - - [4096, 3572, 1, 1024]
    - [16, 78.988]
  - - [1024, 3955, 1, 4096]
    - [82, 81.7]
  - - [4096, 3236, 1, 1024]
    - [205, 78.254]
  - - [4096, 3163, 1, 1024]
    - [202, 79.656]
  - - [4096, 3468, 1, 1024]
    - [201, 78.525]
  - - [1024, 3165, 1, 4096]
    - [394, 80.331]
  - - [1024, 3276, 1, 4096]
    - [15, 76.793]
  - - [1024, 3359, 1, 4096]
    - [129, 79.544]
  - - [4096, 3363, 1, 1024]
    - [147, 78.704]
  - - [1024, 3385, 1, 4096]
    - [129, 79.92]
  - - [1024, 3207, 1, 4096]
    - [63, 75.898]
  - - [1024, 3458, 1, 4096]
    - [138, 81.17]
  - - [21, 21, 2976, 64]
    - [421, 5.274]
  - - [4096, 3110, 1, 1024]
    - [102, 78.383]
  - - [4096, 3925, 1, 1024]
    - [9, 81.387]
  - - [1024, 3975, 1, 4096]
    - [9, 82.135]
  - - [4096, 3549, 1, 1024]
    - [116, 80.906]
  - - [4096, 3342, 1, 1024]
    - [394, 78.064]
  - - [1024, 3859, 1, 1024]
    - [422, 59.954]
  - - [1024, 3497, 1, 4096]
    - [20, 82.577]
  - - [4096, 3280, 1, 1024]
    - [63, 77.872]
  - - [1024, 3435, 1, 4096]
    - [65, 80.515]
  - - [1024, 3354, 1, 4096]
    - [285, 79.629]
  - - [4096, 3191, 1, 1024]
    - [104, 76.367]
  - - [4096, 3512, 1, 1024]
    - [19, 78.014]
  - - [1024, 3055, 1, 4096]
    - [402, 79.854]
  - - [4096, 2499, 1, 1024]
    - [271, 74.707]
  - - [1024, 3233, 1, 4096]
    - [144, 75.367]
  - - [4096, 3423, 1, 1024]
    - [116, 79.162]
  - - [1024, 3319, 1, 4096]
    - [22, 78.259]
  - - [4096, 3297, 1, 1024]
    - [12, 79.488]
  - - [4096, 3154, 1, 1024]
    - [147, 79.4]
  - - [1024, 3540, 1, 4096]
    - [63, 82.908]
  - - [1024, 3289, 1, 4096]
    - [20, 77.304]
  - - [4096, 3529, 1, 1024]
    - [271, 79.03]
  - - [4096, 3386, 1, 1024]
    - [62, 78.684]
  - - [4096, 3276, 1, 1024]
    - [29, 78.779]
  - - [1024, 3244, 1, 4096]
    - [170, 76.679]
  - - [1024, 3182, 1, 4096]
    - [81, 75.207]
  - - [4096, 3540, 1, 1024]
    - [55, 79.234]
  - - [1024, 3360, 1, 4096]
    - [209, 79.49]
  - - [1024, 3942, 1, 4096]
    - [102, 81.907]
  - - [4096, 3403, 1, 1024]
    - [200, 78.798]
  - - [4096, 3101, 1, 1024]
    - [202, 78.285]
  - - [4096, 2918, 1, 1024]
    - [328, 73.204]
  - - [1024, 3465, 1, 4096]
    - [209, 81.397]
  - - [33708, 3780, 1, 1024]
    - [147, 89.561]
  - - [4096, 3557, 1, 1024]
    - [124, 78.819]
  - - [4096, 3414, 1, 1024]
    - [50, 75.676]
  - - [1024, 3948, 1, 1024]
    - [298, 62.248]
  - - [4096, 3320, 1, 1024]
    - [92, 78.61]
  - - [4096, 2765, 1, 1024]
    - [190, 76.587]
  - - [1024, 3978, 1, 4096]
    - [299, 82.168]
  - - [4096, 3487, 1, 1024]
    - [211, 78.636]
  - - [4096, 3520, 1, 1024]
    - [340, 82.218]
  - - [1024, 3139, 1, 4096]
    - [11, 80.899]
  - - [1024, 3314, 1, 4096]
    - [138, 78.199]
  - - [4096, 3431, 1, 1024]
    - [147, 78.951]
  - - [123, 122, 528, 64]
    - [148, 16.094]
  - - [1024, 3446, 1, 4096]
    - [22, 81.288]
  - - [1024, 4059, 1, 4096]
    - [246, 84.372]
  - - [99, 102, 624, 64]
    - [156, 15.477]
  - - [4096, 3345, 1, 1024]
    - [211, 76.261]
  - - [4096, 3394, 1, 1024]
    - [267, 78.433]
  - - [1024, 3927, 1, 1024]
    - [175, 62.083]
  - - [4096, 3235, 1, 1024]
    - [16, 78.518]
  - - [1024, 3328, 1, 4096]
    - [75, 78.272]
  - - [33708, 3956, 1, 1024]
    - [201, 89.855]
  - - [4096, 3467, 1, 1024]
    - [116, 78.928]
  - - [1024, 3287, 1, 4096]
    - [129, 77.672]
  - - [4096, 3214, 1, 1024]
    - [92, 77.804]
  - - [4096, 3910, 1, 1024]
    - [19, 80.692]
  - - [1024, 3780, 1, 1024]
    - [22, 67.465]
  - - [1024, 3371, 1, 4096]
    - [138, 79.377]
  - - [4096, 3478, 1, 1024]
    - [125, 78.83]
  - - [1024, 3546, 1, 4096]
    - [65, 83.179]
  - - [1024, 4012, 1, 1024]
    - [369, 63.807]
  - - [4096, 3341, 1, 1024]
    - [267, 75.814]
  - - [4096, 3454, 1, 1024]
    - [340, 77.52]
  - - [4096, 3295, 1, 1024]
    - [14, 78.183]
  - - [4096, 3072, 1, 1024]
    - [12, 79.163]
  - - [1024, 3282, 1, 4096]
    - [129, 77.628]
  - - [33708, 3720, 1, 1024]
    - [116, 90.663]
  - - [1024, 3681, 1, 4096]
    - [63, 86.423]
  - - [1024, 4050, 1, 4096]
    - [102, 84.374]
  - - [4096, 3495, 1, 1024]
    - [22, 77.9]
  - - [4096, 3560, 1, 1024]
    - [124, 78.244]
  - - [4096, 3751, 1, 1024]
    - [190, 79.652]
  - - [1024, 3414, 1, 4096]
    - [285, 80.029]
  - - [33708, 3860, 1, 1024]
    - [147, 89.648]
  - - [1024, 3325, 1, 4096]
    - [138, 78.601]
  - - [4096, 3458, 1, 1024]
    - [147, 79.895]
  - - [4096, 2967, 1, 1024]
    - [16, 76.965]
  - - [1024, 3519, 1, 4096]
    - [20, 82.373]
  - - [4096, 3385, 1, 1024]
    - [9, 77.282]
  - - [4096, 3434, 1, 1024]
    - [243, 77.066]
  - - [1024, 3552, 1, 4096]
    - [65, 83.265]
  - - [4096, 3822, 1, 1024]
    - [92, 79.345]
  - - [1024, 3544, 1, 4096]
    - [20, 83.128]
  - - [4096, 3539, 1, 1024]
    - [62, 78.411]
  - - [4096, 3332, 1, 1024]
    - [243, 75.448]
  - - [1024, 3145, 1, 4096]
    - [267, 80.258]
  - - [1024, 3535, 1, 4096]
    - [63, 83.098]
  - - [1024, 3320, 1, 4096]
    - [65, 77.892]
  - - [33708, 4012, 1, 1024]
    - [147, 90.294]
  - - [4096, 3286, 1, 1024]
    - [23, 77.034]
  - - [1024, 3514, 1, 4096]
    - [138, 82.381]
  - - [93, 93, 688, 64]
    - [41, 15.669]
  - - [1024, 2765, 1, 4096]
    - [423, 83.971]
  - - [1024, 3452, 1, 4096]
    - [63, 81.203]
  - - [4096, 3518, 1, 1024]
    - [125, 79.454]
  - - [1024, 3529, 1, 4096]
    - [144, 82.959]
  - - [4096, 3413, 1, 1024]
    - [340, 75.974]
  - - [33708, 4050, 1, 1024]
    - [57, 90.008]
  - - [1024, 3525, 1, 4096]
    - [129, 82.197]
  - - [4096, 3303, 1, 1024]
    - [14, 78.306]
  - - [1024, 3382, 1, 4096]
    - [138, 80.306]
  - - [1024, 3390, 1, 4096]
    - [63, 79.381]
  - - [1024, 3977, 1, 4096]
    - [102, 82.62]
  - - [1024, 3184, 1, 4096]
    - [335, 75.47]
  - - [4096, 3535, 1, 1024]
    - [82, 79.023]
  - - [4096, 3376, 1, 1024]
    - [202, 77.27]
  - - [4096, 3978, 1, 1024]
    - [394, 79.507]
  - - [1024, 3136, 1, 4096]
    - [267, 79.837]
  - - [1024, 3293, 1, 4096]
    - [65, 77.923]
  - - [4096, 3266, 1, 1024]
    - [29, 77.422]
  - - [1024, 3487, 1, 4096]
    - [285, 81.78]
  - - [1024, 3409, 1, 4096]
    - [20, 80.006]
  - - [4096, 3498, 1, 1024]
    - [62, 81.108]
  - - [1024, 3520, 1, 4096]
    - [209, 82.583]
  - - [1024, 3530, 1, 4096]
    - [29, 82.658]
  - - [4096, 3393, 1, 1024]
    - [271, 77.067]
  - - [4096, 3140, 1, 1024]
    - [62, 79.183]
  - - [1024, 3536, 1, 4096]
    - [285, 83.39]
  - - [1024, 3288, 1, 4096]
    - [138, 77.073]
  - - [1024, 4005, 1, 4096]
    - [82, 82.755]
  - - [1024, 3579, 1, 4096]
    - [63, 83.125]
  - - [4096, 3372, 1, 1024]
    - [135, 75.324]
  - - [1024, 3440, 1, 4096]
    - [65, 80.698]
  - - [4096, 3213, 1, 1024]
    - [189, 76.814]
  - - [123, 123, 528, 64]
    - [334, 13.74]
  - - [100, 100, 624, 64]
    - [21, 14.681]
  - - [4096, 3477, 1, 1024]
    - [202, 79.839]
  - - [4096, 3526, 1, 1024]
    - [147, 79.58]
  - - [1024, 3493, 1, 4096]
    - [22, 82.094]
  - - [1024, 3944, 1, 4096]
    - [269, 81.145]
  - - [4096, 3453, 1, 1024]
    - [412, 77.051]
  - - [1024, 3350, 1, 4096]
    - [285, 78.696]
  - - [4096, 3184, 1, 1024]
    - [63, 74.87]
  - - [1024, 3423, 1, 4096]
    - [63, 80.359]
  - - [4096, 3351, 1, 1024]
    - [68, 76.893]
  - - [4096, 3416, 1, 1024]
    - [68, 76.929]
  - - [1024, 3796, 1, 4096]
    - [63, 89.221]
  - - [4096, 3257, 1, 1024]
    - [23, 78.324]
  - - [4096, 3306, 1, 1024]
    - [104, 78.95]
  - - [33708, 4020, 1, 1024]
    - [147, 90.795]
  - - [19, 19, 3264, 64]
    - [408, 4.276]
  - - [1024, 3426, 1, 4096]
    - [138, 80.438]
  - - [4096, 3457, 1, 1024]
    - [147, 81.267]
  - - [1024, 2935, 1, 4096]
    - [17, 75.88]
  - - [1024, 3046, 1, 4096]
    - [293, 78.619]
  - - [4096, 3433, 1, 1024]
    - [9, 77.73]
  - - [1024, 3256, 1, 4096]
    - [209, 77.068]
  - - [1024, 3531, 1, 4096]
    - [138, 82.984]
  - - [4096, 3180, 1, 1024]
    - [170, 76.806]
  - - [1024, 3388, 1, 4096]
    - [63, 80.033]
  - - [4096, 3444, 1, 1024]
    - [22, 78.273]
  - - [1024, 3501, 1, 4096]
    - [170, 81.797]
  - - [1024, 3266, 1, 4096]
    - [285, 76.841]
  - - [1024, 3267, 1, 4096]
    - [22, 76.579]
  - - [1024, 3461, 1, 4096]
    - [63, 81.183]
  - - [4096, 3870, 1, 1024]
    - [9, 80.613]
  - - [4096, 3517, 1, 1024]
    - [381, 79.593]
  - - [1024, 3566, 1, 4096]
    - [63, 83.614]
  - - [4096, 3574, 1, 1024]
    - [211, 79.076]
  - - [1024, 3876, 1, 1024]
    - [423, 61.222]
  - - [25, 25, 2512, 64]
    - [424, 5.574]
  - - [4096, 3720, 1, 1024]
    - [205, 77.599]
  - - [4096, 3248, 1, 1024]
    - [23, 77.887]
  - - [4096, 4059, 1, 1024]
    - [68, 79.243]
  - - [1024, 3380, 1, 4096]
    - [14, 79.441]
  - - [4096, 3480, 1, 1024]
    - [190, 80.764]
  - - [1024, 3335, 1, 4096]
    - [14, 78.365]
  - - [1024, 3345, 1, 4096]
    - [63, 78.904]
  - - [4096, 3391, 1, 1024]
    - [68, 77.343]
  - - [4096, 3424, 1, 1024]
    - [60, 77.513]
  - - [1024, 3394, 1, 4096]
    - [63, 79.672]
  - - [4096, 3265, 1, 1024]
    - [92, 78.323]
  - - [1024, 3014, 1, 4096]
    - [198, 78.223]
  - - [4096, 3497, 1, 1024]
    - [12, 79.088]
  - - [4096, 3354, 1, 1024]
    - [68, 76.151]
  - - [4096, 3055, 1, 1024]
    - [63, 78.033]
  - - [1024, 3499, 1, 4096]
    - [63, 82.847]
  - - [1024, 3162, 1, 4096]
    - [267, 82.415]
  - - [4096, 3244, 1, 1024]
    - [98, 78.56]
  - - [1024, 3437, 1, 4096]
    - [20, 80.721]
  - - [1024, 3356, 1, 4096]
    - [22, 79.403]
  - - [4096, 3139, 1, 1024]
    - [116, 79.048]
  - - [4096, 3508, 1, 1024]
    - [138, 78.938]
  - - [1024, 3235, 1, 4096]
    - [115, 75.849]
  - - [1024, 3910, 1, 4096]
    - [57, 81.176]
  - - [4096, 3371, 1, 1024]
    - [147, 78.981]
  - - [1024, 3751, 1, 4096]
    - [22, 88.803]
  - - [4096, 3325, 1, 1024]
    - [211, 80.126]
  - - [1024, 3413, 1, 4096]
    - [63, 80.148]
  - - [1024, 3542, 1, 4096]
    - [63, 83.258]
  - - [18, 18, 3440, 64]
    - [425, 4.455]
  - - [101, 102, 624, 64]
    - [89, 13.561]
  - - [33708, 3900, 1, 1024]
    - [57, 90.533]
  - - [4096, 3525, 1, 1024]
    - [381, 79.594]
  - - [4096, 3382, 1, 1024]
    - [394, 78.162]
  - - [102, 100, 624, 64]
    - [265, 15.224]
  - - [15, 15, 4096, 64]
    - [426, 3.602]
  - - [1024, 3339, 1, 4096]
    - [63, 79.023]
  - - [4096, 3288, 1, 1024]
    - [16, 77.723]
  - - [92, 92, 688, 64]
    - [363, 13.398]
  - - [1024, 3141, 1, 4096]
    - [198, 80.983]
  - - [1024, 3168, 1, 4096]
    - [11, 80.67]
  - - [4096, 3488, 1, 1024]
    - [55, 79.419]
  - - [4096, 3046, 1, 1024]
    - [170, 78.702]
  - - [1024, 3362, 1, 4096]
    - [92, 78.846]
  - - [33708, 3942, 1, 1024]
    - [201, 89.884]
  - - [4096, 3399, 1, 1024]
    - [202, 77.488]
  - - [1024, 3720, 1, 1024]
    - [233, 65.781]
  - - [4096, 3563, 1, 1024]
    - [205, 80.744]
  - - [1024, 3273, 1, 4096]
    - [20, 76.841]
  - - [4096, 3162, 1, 1024]
    - [147, 79.651]
  - - [1024, 3467, 1, 4096]
    - [129, 82.032]
  - - [1024, 3130, 1, 4096]
    - [261, 80.757]
  - - [1024, 3405, 1, 4096]
    - [129, 80.494]
  - - [4096, 3362, 1, 1024]
    - [202, 78.06]
  - - [1024, 3960, 1, 1024]
    - [152, 63.438]
  - - [2048, 128, 1, 4096]
    - [89, 36.18]
  - - [1024, 3712, 1, 36548]
    - [427, 93.932]
  - - [1024, 128, 1, 1024]
    - [226, 11.57]
  - - [3072, 128, 1, 4096]
    - [77, 47.387]
  - - [1024, 3712, 1, 1024]
    - [405, 64.471]
  - - [2, 16, 1, 768]
    - [259, 0.003]
  - - [2, 8, 1, 768]
    - [188, 0.001]
  - - [2, 64, 1, 768]
    - [248, 0.011]
  - - [1728, 320, 1, 64]
    - [48, 4.466]
  - - [1152, 128, 1, 784]
    - [349, 11.345]
  - - [576, 96, 1, 5329]
    - [184, 14.734]
  - - [864, 96, 1, 1225]
    - [95, 9.609]
  - - [256, 128, 1, 784]
    - [35, 2.739]
  - - [1440, 320, 1, 196]
    - [48, 8.745]
  - - [192, 48, 1, 1225]
    - [97, 1.146]
  - - [2592, 384, 1, 289]
    - [315, 22.819]
  - - [192, 80, 36, 10368]
    - [16, 49.216]
  - - [896, 192, 1, 289]
    - [49, 5.329]
  - - [768, 128, 1, 289]
    - [36, 3.214]
  - - [64, 256, 1, 3136]
    - [39, 4.751]
  - - [1280, 384, 1, 64]
    - [49, 3.658]
