library/src/blas3/Tensile/Logic/asm_full/arcturus_Cijk_Ailk_Bjlk_BBH.yaml
- {MinimumRequiredVersion: 4.14.0}
- arcturus
- gfx908
- [Device 7380, Device 7388, Device 738c, Device 7390]
    SolutionIndex: 0
    SolutionNameMin: Cijk_Ailk_Bjlk_BBH_MT64x256x16_MI32x32x2x2_SE_ONLL0_SNLL0
    SolutionIndex: 1
    SolutionIndex: 2
    SolutionIndex: 3
    SolutionIndex: 4
    SolutionIndex: 5
    SolutionIndex: 6
    SolutionIndex: 7
    SolutionIndex: 8
    SolutionIndex: 9
    SolutionIndex: 10
    SolutionIndex: 11
    SolutionIndex: 12
    SolutionIndex: 13
    SolutionIndex: 14
    SolutionIndex: 15
    SolutionIndex: 16
    SolutionIndex: 17
    SolutionIndex: 18
    SolutionIndex: 19
    SolutionIndex: 20
    SolutionIndex: 21
    SolutionIndex: 22
    SolutionIndex: 23
    SolutionIndex: 24
    SolutionIndex: 25
    SolutionIndex: 26
    SolutionIndex: 27
    SolutionIndex: 28
    SolutionIndex: 29
    SolutionIndex: 30
    SolutionIndex: 31
    SolutionIndex: 32
    SolutionIndex: 33
    SolutionIndex: 34
    SolutionIndex: 35
    SolutionIndex: 36
    SolutionIndex: 37
    SolutionIndex: 38
    SolutionIndex: 39
    SolutionIndex: 40
    SolutionIndex: 41
    SolutionIndex: 42
    SolutionIndex: 43
    SolutionIndex: 44
    SolutionIndex: 45
    SolutionIndex: 46
    SolutionIndex: 47
    SolutionIndex: 48
    SolutionIndex: 49
    SolutionIndex: 50
    SolutionIndex: 51
    SolutionIndex: 52
    SolutionIndex: 53
    SolutionIndex: 54
    SolutionIndex: 55
    SolutionIndex: 56
    SolutionIndex: 57
    SolutionIndex: 58
    SolutionIndex: 59
    SolutionIndex: 60
    SolutionIndex: 61
    SolutionIndex: 62
    SolutionIndex: 63
    SolutionNameMin: Cijk_Ailk_Bjlk_BBH_MT128x96x32_MI32x32x4x1_SE_AF0EM4_GRVW4_NLCA1_NLCB3_SU16_SUS128_SRVW4_TT1_96_WG128_2_1_WGM15
    SolutionIndex: 64
    SolutionNameMin: Cijk_Ailk_Bjlk_BBH_MT128x80x64_MI16x16x8x1_SE_AF0EM4_GRVW2_NLCA1_NLCB5_SU32_SUS128_SRVW0_TT2_80_WG64_4_1_WGM2
    SolutionIndex: 65
    SolutionNameMin: Cijk_Ailk_Bjlk_BBH_MT128x96x32_MI32x32x4x1_SE_AF0EM4_GRVW4_NLCA1_NLCB3_SU32_SUS128_SRVW4_TT1_96_WG128_2_1_WGM15
    SolutionIndex: 66
    SolutionNameMin: Cijk_Ailk_Bjlk_BBH_MT64x64x128_MI32x32x4x1_SE_AF0EM4_GRVW8_NLCA1_NLCB1_SU32_SUS256_SRVW4_TT1_32_WG64_4_1_WGM15
    SolutionIndex: 67
    SolutionNameMin: Cijk_Ailk_Bjlk_BBH_MT32x32x16_MI16x16x8x1_SE_AF0EM4_GRVW4_NLCA1_NLCB1_SU0_SUS256_SRVW0_TT1_16_WG32_8_1_WGM2
    SolutionIndex: 68
    SolutionNameMin: Cijk_Ailk_Bjlk_BBH_MT32x32x64_MI16x16x8x1_SE_AF0EM1_GRVW8_NLCA1_NLCB1_SU0_SUS256_SRVW0_TT1_16_WG32_8_1_WGM2
    SolutionIndex: 69
    SolutionNameMin: Cijk_Ailk_Bjlk_BBH_MT32x32x16_MI16x16x8x1_SE_AF0EM4_GRVW2_NLCA1_NLCB1_SU0_SUS256_SRVW0_TT1_16_WG32_8_1_WGM1
    SolutionIndex: 70
    SolutionNameMin: Cijk_Ailk_Bjlk_BBH_MT64x32x16_MI16x16x8x1_SE_AF0EM4_GRVW2_NLCA1_NLCB1_SU32_SUS256_SRVW0_TT2_16_WG32_8_1_WGM2
    SolutionIndex: 71
    SolutionNameMin: Cijk_Ailk_Bjlk_BBH_MT128x80x64_MI16x16x8x1_SE_AF0EM4_GRVW2_NLCA1_NLCB5_SU32_SUS256_SRVW0_TT2_80_WG64_4_1_WGM2
    SolutionIndex: 72
    SolutionNameMin: Cijk_Ailk_Bjlk_BBH_MT32x32x64_MI16x16x8x1_SE_AF0EM4_GRVW8_NLCA1_NLCB1_SU16_SUS128_SRVW0_TT1_16_WG32_8_1_WGM1
    SolutionIndex: 73
    SolutionNameMin: Cijk_Ailk_Bjlk_BBH_MT64x64x32_MI32x32x4x1_SE_AF0EM1_GRVW8_NLCA1_NLCB1_SU16_SUS256_SRVW4_TT1_32_WG64_4_1_WGM1
    SolutionIndex: 74
    SolutionNameMin: Cijk_Ailk_Bjlk_BBH_MT64x64x32_MI32x32x4x1_SE_AF0EM1_GRVW4_NLCA1_NLCB1_SU0_SUS256_SRVW4_TT1_32_WG64_4_1_WGM2
    SolutionIndex: 75
    SolutionNameMin: Cijk_Ailk_Bjlk_BBH_MT64x128x32_MI32x32x4x1_SE_AF0EM4_GRVW8_NLCA1_NLCB1_SU0_SUS256_SRVW4_TT1_64_WG64_4_1_WGM15
    SolutionIndex: 76
    SolutionNameMin: Cijk_Ailk_Bjlk_BBH_MT64x32x16_MI16x16x8x1_SE_AF0EM4_GRVW2_NLCA1_NLCB1_SU16_SUS256_SRVW0_TT2_16_WG32_8_1_WGM2
    SolutionIndex: 77
    SolutionNameMin: Cijk_Ailk_Bjlk_BBH_MT128x96x32_MI32x32x4x1_SE_AF0EM4_GRVW4_NLCA1_NLCB3_SU16_SUS256_SRVW4_TT1_96_WG128_2_1_WGM2
    SolutionIndex: 78
    SolutionNameMin: Cijk_Ailk_Bjlk_BBH_MT32x32x16_MI16x16x8x1_SE_AF0EM1_GRVW2_NLCA1_NLCB1_SU0_SUS256_SRVW0_TT1_16_WG32_8_1_WGM1
    SolutionIndex: 79
    SolutionNameMin: Cijk_Ailk_Bjlk_BBH_MT64x64x32_MI32x32x4x1_SE_AF0EM4_GRVW4_NLCA1_NLCB1_SU32_SUS256_SRVW4_TT1_32_WG64_4_1_WGM15
    SolutionIndex: 80
    SolutionNameMin: Cijk_Ailk_Bjlk_BBH_MT128x96x32_MI32x32x4x1_SE_AF0EM4_GRVW4_NLCA1_NLCB3_SU0_SUS256_SRVW4_TT1_96_WG128_2_1_WGM2
    SolutionIndex: 81
    SolutionNameMin: Cijk_Ailk_Bjlk_BBH_MT32x64x16_MI16x16x8x1_SE_AF0EM4_GRVW4_NLCA1_NLCB1_SU0_SUS256_SRVW0_TT1_32_WG32_8_1_WGM1
    SolutionIndex: 82
    SolutionNameMin: Cijk_Ailk_Bjlk_BBH_MT32x32x64_MI16x16x8x1_SE_AF0EM4_GRVW8_NLCA1_NLCB1_SU32_SUS128_SRVW0_TT1_16_WG32_8_1_WGM1
    SolutionIndex: 83
    SolutionNameMin: Cijk_Ailk_Bjlk_BBH_MT64x64x16_MI32x32x4x1_SE_AF0EM4_GRVW4_NLCA1_NLCB1_SU0_SUS256_SRVW4_TT1_32_WG64_4_1_WGM1
    SolutionIndex: 84
    SolutionNameMin: Cijk_Ailk_Bjlk_BBH_MT128x96x32_MI32x32x4x1_SE_AF0EM4_GRVW4_NLCA1_NLCB3_SU0_SUS256_SRVW4_TT1_96_WG128_2_1_WGM15
    SolutionIndex: 85
    SolutionNameMin: Cijk_Ailk_Bjlk_BBH_MT64x64x128_MI32x32x4x1_SE_AF0EM1_GRVW8_NLCA1_NLCB1_SU32_SUS256_SRVW4_TT1_32_WG64_4_1_WGM2
    SolutionIndex: 86
    SolutionNameMin: Cijk_Ailk_Bjlk_BBH_MT32x32x64_MI16x16x8x1_SE_AF0EM4_GRVW8_NLCA1_NLCB1_SU0_SUS256_SRVW0_TT1_16_WG32_8_1_WGM1
    SolutionIndex: 87
    SolutionNameMin: Cijk_Ailk_Bjlk_BBH_MT32x64x16_MI16x16x8x1_SE_AF0EM1_GRVW2_NLCA1_NLCB1_SU0_SUS256_SRVW0_TT1_32_WG32_8_1_WGM1
    SolutionIndex: 88
    SolutionNameMin: Cijk_Ailk_Bjlk_BBH_MT32x32x16_MI16x16x8x1_SE_AF0EM4_GRVW4_NLCA1_NLCB1_SU0_SUS256_SRVW0_TT1_16_WG32_8_1_WGM15
    SolutionIndex: 89
    SolutionNameMin: Cijk_Ailk_Bjlk_BBH_MT64x64x32_MI32x32x4x1_SE_AF0EM1_GRVW8_NLCA1_NLCB1_SU32_SUS128_SRVW4_TT1_32_WG64_4_1_WGM1
    SolutionIndex: 90
    SolutionNameMin: Cijk_Ailk_Bjlk_BBH_MT64x32x16_MI16x16x8x1_SE_AF0EM4_GRVW8_NLCA1_NLCB1_SU0_SUS256_SRVW4_TT2_16_WG32_8_1_WGM1
    SolutionIndex: 91
    SolutionNameMin: Cijk_Ailk_Bjlk_BBH_MT64x64x128_MI32x32x4x1_SE_AF0EM4_GRVW8_NLCA1_NLCB1_SU16_SUS256_SRVW4_TT1_32_WG64_4_1_WGM15
    SolutionIndex: 92
    SolutionNameMin: Cijk_Ailk_Bjlk_BBH_MT128x96x32_MI32x32x4x1_SE_AF0EM1_GRVW4_NLCA1_NLCB3_SU0_SUS256_SRVW4_TT1_96_WG128_2_1_WGM1
    SolutionIndex: 93
    SolutionNameMin: Cijk_Ailk_Bjlk_BBH_MT64x128x32_MI32x32x4x1_SE_AF0EM1_GRVW8_NLCA1_NLCB1_SU0_SUS256_SRVW4_TT1_64_WG64_4_1_WGM1
    SolutionIndex: 94
    SolutionNameMin: Cijk_Ailk_Bjlk_BBH_MT32x64x16_MI16x16x8x1_SE_AF0EM1_GRVW8_NLCA1_NLCB1_SU16_SUS128_SRVW0_TT1_32_WG32_8_1_WGM2
    SolutionIndex: 95
    SolutionNameMin: Cijk_Ailk_Bjlk_BBH_MT128x96x32_MI32x32x4x1_SE_AF0EM1_GRVW4_NLCA1_NLCB3_SU0_SUS256_SRVW4_TT1_96_WG128_2_1_WGM15
    SolutionIndex: 96
    SolutionNameMin: Cijk_Ailk_Bjlk_BBH_MT64x32x16_MI16x16x8x1_SE_AF0EM1_GRVW2_NLCA1_NLCB1_SU0_SUS256_SRVW4_TT2_16_WG32_8_1_WGM15
    SolutionIndex: 97
    SolutionNameMin: Cijk_Ailk_Bjlk_BBH_MT128x96x32_MI32x32x4x1_SE_AF0EM4_GRVW4_NLCA1_NLCB3_SU0_SUS256_SRVW4_TT1_96_WG128_2_1_WGM1
    SolutionIndex: 98
    SolutionNameMin: Cijk_Ailk_Bjlk_BBH_MT128x96x32_MI32x32x4x1_SE_AF0EM4_GRVW4_NLCA1_NLCB3_SU16_SUS128_SRVW4_TT1_96_WG128_2_1_WGM2
    SolutionIndex: 99
    SolutionNameMin: Cijk_Ailk_Bjlk_BBH_MT128x288x32_MI32x32x4x1_SE_AF0EM4_GRVW2_NLCA1_NLCB9_SU0_SUS256_SRVW0_TT1_288_WG128_2_1_WGM2
    SolutionIndex: 100
    SolutionNameMin: Cijk_Ailk_Bjlk_BBH_MT32x32x16_MI16x16x8x1_SE_AF0EM1_GRVW8_NLCA1_NLCB1_SU0_SUS256_SRVW0_TT1_16_WG32_8_1_WGM2
    SolutionIndex: 101
    SolutionNameMin: Cijk_Ailk_Bjlk_BBH_MT128x80x64_MI16x16x8x1_SE_AF0EM4_GRVW2_NLCA1_NLCB5_SU16_SUS128_SRVW0_TT2_80_WG64_4_1_WGM2
    SolutionIndex: 102
    SolutionNameMin: Cijk_Ailk_Bjlk_BBH_MT128x128x32_MI32x32x4x1_SE_AF0EM4_GRVW4_NLCA1_NLCB1_SU0_SUS256_SRVW4_TT2_64_WG64_4_1_WGM2
    SolutionIndex: 103
    SolutionNameMin: Cijk_Ailk_Bjlk_BBH_MT128x96x32_MI32x32x4x1_SE_AF0EM4_GRVW4_NLCA1_NLCB3_SU0_SUS256_SRVW0_TT1_96_WG128_2_1_WGM2
    SolutionIndex: 104
    SolutionNameMin: Cijk_Ailk_Bjlk_BBH_MT64x64x16_MI32x32x4x1_SE_AF0EM4_GRVW4_NLCA1_NLCB1_SU32_SUS256_SRVW0_TT1_32_WG64_4_1_WGM2
    SolutionIndex: 105
    SolutionNameMin: Cijk_Ailk_Bjlk_BBH_MT32x64x16_MI16x16x8x1_SE_AF0EM1_GRVW2_NLCA1_NLCB1_SU32_SUS256_SRVW0_TT1_32_WG32_8_1_WGM1
    SolutionIndex: 106
    SolutionNameMin: Cijk_Ailk_Bjlk_BBH_MT64x32x16_MI16x16x8x1_SE_AF0EM4_GRVW2_NLCA1_NLCB1_SU0_SUS256_SRVW0_TT2_16_WG32_8_1_WGM1
    SolutionIndex: 107
    SolutionNameMin: Cijk_Ailk_Bjlk_BBH_MT128x64x32_MI32x32x4x1_SE_AF0EM4_GRVW8_NLCA1_NLCB1_SU16_SUS128_SRVW4_TT2_32_WG64_4_1_WGM2
    SolutionIndex: 108
    SolutionNameMin: Cijk_Ailk_Bjlk_BBH_MT128x96x32_MI32x32x4x1_SE_AF0EM4_GRVW4_NLCA1_NLCB3_SU32_SUS128_SRVW4_TT1_96_WG128_2_1_WGM2
    SolutionIndex: 109
    SolutionNameMin: Cijk_Ailk_Bjlk_BBH_MT64x64x16_MI32x32x4x1_SE_AF0EM4_GRVW8_NLCA1_NLCB1_SU0_SUS256_SRVW4_TT1_32_WG64_4_1_WGM1
    SolutionIndex: 110
    SolutionNameMin: Cijk_Ailk_Bjlk_BBH_MT64x32x16_MI16x16x8x1_SE_AF0EM4_GRVW4_NLCA1_NLCB1_SU0_SUS256_SRVW0_TT2_16_WG32_8_1_WGM1
    SolutionIndex: 111
    SolutionNameMin: Cijk_Ailk_Bjlk_BBH_MT64x64x16_MI32x32x4x1_SE_AF0EM4_GRVW8_NLCA1_NLCB1_SU32_SUS256_SRVW0_TT1_32_WG64_4_1_WGM2
    SolutionIndex: 112
    SolutionNameMin: Cijk_Ailk_Bjlk_BBH_MT128x64x64_MI32x32x4x1_SE_AF0EM4_GRVW4_NLCA1_NLCB1_SU0_SUS256_SRVW4_TT2_32_WG64_4_1_WGM15
    SolutionIndex: 113
    SolutionNameMin: Cijk_Ailk_Bjlk_BBH_MT128x96x32_MI32x32x4x1_SE_AF0EM1_GRVW4_NLCA1_NLCB3_SU0_SUS256_SRVW4_TT1_96_WG128_2_1_WGM2
    SolutionIndex: 114
    SolutionNameMin: Cijk_Ailk_Bjlk_BBH_MT128x288x16_MI32x32x4x1_SE_AF0EM4_GRVW2_NLCA1_NLCB9_SU0_SUS256_SRVW0_TT1_288_WG128_2_1_WGM15
    SolutionIndex: 115
    SolutionNameMin: Cijk_Ailk_Bjlk_BBH_MT64x64x16_MI32x32x4x1_SE_AF0EM4_GRVW2_NLCA1_NLCB1_SU32_SUS256_SRVW4_TT1_32_WG64_4_1_WGM2
    SolutionIndex: 116
    SolutionNameMin: Cijk_Ailk_Bjlk_BBH_MT128x96x32_MI32x32x4x1_SE_AF0EM4_GRVW4_NLCA1_NLCB3_SU0_SUS256_SRVW0_TT1_96_WG128_2_1_WGM1
    SolutionIndex: 117
    SolutionNameMin: Cijk_Ailk_Bjlk_BBH_MT128x128x16_MI32x32x4x1_SE_AF0EM4_GRVW8_NLCA1_NLCB1_SU16_SUS256_SRVW4_TT2_64_WG64_4_1_WGM15
    SolutionIndex: 118
    SolutionNameMin: Cijk_Ailk_Bjlk_BBH_MT128x128x16_MI32x32x4x1_SE_AF0EM4_GRVW8_NLCA1_NLCB1_SU16_SUS128_SRVW4_TT2_64_WG64_4_1_WGM15
    SolutionIndex: 119
    SolutionNameMin: Cijk_Ailk_Bjlk_BBH_MT128x128x16_MI32x32x4x1_SE_AF0EM4_GRVW8_NLCA1_NLCB1_SU32_SUS256_SRVW4_TT2_64_WG64_4_1_WGM15
    SolutionIndex: 120
    SolutionNameMin: Cijk_Ailk_Bjlk_BBH_MT64x64x32_MI32x32x4x1_SE_AF0EM1_GRVW4_NLCA1_NLCB1_SU16_SUS128_SRVW4_TT1_32_WG64_4_1_WGM15
    SolutionIndex: 121
    SolutionNameMin: Cijk_Ailk_Bjlk_BBH_MT64x128x16_MI32x32x2x2_SE_AF0EM1_GRVW2_NLCA1_NLCB1_SU0_SUS256_SRVW0_TT1_32_WG64_4_1_WGM1
    SolutionIndex: 122
    SolutionNameMin: Cijk_Ailk_Bjlk_BBH_MT64x32x16_MI16x16x8x1_SE_AF0EM4_GRVW2_NLCA1_NLCB1_SU16_SUS256_SRVW4_TT2_16_WG32_8_1_WGM15
    SolutionIndex: 123
    SolutionNameMin: Cijk_Ailk_Bjlk_BBH_MT32x64x16_MI16x16x8x1_SE_AF0EM4_GRVW2_NLCA1_NLCB1_SU32_SUS256_SRVW4_TT1_32_WG32_8_1_WGM2
    SolutionIndex: 124
    SolutionNameMin: Cijk_Ailk_Bjlk_BBH_MT128x96x32_MI32x32x4x1_SE_AF0EM4_GRVW4_NLCA1_NLCB3_SU32_SUS256_SRVW4_TT1_96_WG128_2_1_WGM2
    SolutionIndex: 125
    SolutionNameMin: Cijk_Ailk_Bjlk_BBH_MT64x128x16_MI32x32x2x2_SE_AF0EM1_GRVW8_NLCA1_NLCB1_SU32_SUS128_SRVW4_TT1_32_WG64_4_1_WGM1
    SolutionIndex: 126
    SolutionNameMin: Cijk_Ailk_Bjlk_BBH_MT32x64x16_MI16x16x8x1_SE_AF0EM4_GRVW2_NLCA1_NLCB1_SU32_SUS256_SRVW0_TT1_32_WG32_8_1_WGM2
    SolutionIndex: 127
    SolutionNameMin: Cijk_Ailk_Bjlk_BBH_MT64x64x32_MI32x32x4x1_SE_AF0EM4_GRVW4_NLCA1_NLCB1_SU16_SUS128_SRVW4_TT1_32_WG64_4_1_WGM15
    SolutionIndex: 128
    SolutionNameMin: Cijk_Ailk_Bjlk_BBH_MT32x64x16_MI16x16x8x1_SE_AF0EM1_GRVW4_NLCA1_NLCB1_SU32_SUS256_SRVW0_TT1_32_WG32_8_1_WGM1
    SolutionIndex: 129
    SolutionNameMin: Cijk_Ailk_Bjlk_BBH_MT64x64x32_MI32x32x4x1_SE_AF0EM1_GRVW8_NLCA1_NLCB1_SU0_SUS256_SRVW4_TT1_32_WG64_4_1_WGM2
    SolutionIndex: 130
    SolutionNameMin: Cijk_Ailk_Bjlk_BBH_MT128x96x32_MI32x32x4x1_SE_AF0EM4_GRVW4_NLCA1_NLCB3_SU32_SUS128_SRVW4_TT1_96_WG128_2_1_WGM1
    SolutionIndex: 131
    SolutionNameMin: Cijk_Ailk_Bjlk_BBH_MT32x32x64_MI16x16x8x1_SE_AF0EM4_GRVW8_NLCA1_NLCB1_SU0_SUS256_SRVW0_TT1_16_WG32_8_1_WGM15
    SolutionIndex: 132
    SolutionNameMin: Cijk_Ailk_Bjlk_BBH_MT32x32x64_MI16x16x8x1_SE_AF0EM1_GRVW4_NLCA1_NLCB1_SU16_SUS256_SRVW0_TT1_16_WG32_8_1_WGM2
    SolutionIndex: 133
    SolutionNameMin: Cijk_Ailk_Bjlk_BBH_MT32x64x16_MI16x16x8x1_SE_AF0EM1_GRVW4_NLCA1_NLCB1_SU0_SUS256_SRVW0_TT1_32_WG32_8_1_WGM1
    SolutionIndex: 134
    SolutionNameMin: Cijk_Ailk_Bjlk_BBH_MT128x96x32_MI32x32x4x1_SE_AF0EM4_GRVW4_NLCA1_NLCB3_SU32_SUS256_SRVW4_TT1_96_WG128_2_1_WGM15
    SolutionIndex: 135
    SolutionNameMin: Cijk_Ailk_Bjlk_BBH_MT128x96x32_MI32x32x4x1_SE_AF0EM4_GRVW4_NLCA1_NLCB3_SU16_SUS128_SRVW4_TT1_96_WG128_2_1_WGM1
    SolutionIndex: 136
    SolutionNameMin: Cijk_Ailk_Bjlk_BBH_MT64x32x16_MI16x16x8x1_SE_AF0EM4_GRVW8_NLCA1_NLCB1_SU16_SUS128_SRVW0_TT2_16_WG32_8_1_WGM1
    SolutionIndex: 137
    SolutionNameMin: Cijk_Ailk_Bjlk_BBH_MT64x128x64_MI32x32x4x1_SE_AF0EM4_GRVW8_NLCA1_NLCB1_SU0_SUS256_SRVW4_TT1_64_WG64_4_1_WGM15
    SolutionIndex: 138
    SolutionNameMin: Cijk_Ailk_Bjlk_BBH_MT64x32x16_MI16x16x8x1_SE_AF0EM4_GRVW2_NLCA1_NLCB1_SU0_SUS256_SRVW4_TT2_16_WG32_8_1_WGM1
    SolutionIndex: 139
    SolutionNameMin: Cijk_Ailk_Bjlk_BBH_MT128x128x16_MI32x32x4x1_SE_AF0EM4_GRVW8_NLCA1_NLCB1_SU32_SUS128_SRVW4_TT2_64_WG64_4_1_WGM15
    SolutionIndex: 140
    SolutionNameMin: Cijk_Ailk_Bjlk_BBH_MT64x64x64_MI32x32x4x1_SE_AF0EM4_GRVW4_NLCA1_NLCB1_SU16_SUS128_SRVW4_TT1_32_WG64_4_1_WGM2
    SolutionIndex: 141
    SolutionNameMin: Cijk_Ailk_Bjlk_BBH_MT128x96x32_MI32x32x4x1_SE_AF0EM1_GRVW4_NLCA1_NLCB3_SU16_SUS128_SRVW4_TT1_96_WG128_2_1_WGM15
    SolutionIndex: 142
    SolutionNameMin: Cijk_Ailk_Bjlk_BBH_MT64x32x16_MI16x16x8x1_SE_AF0EM4_GRVW2_NLCA1_NLCB1_SU16_SUS256_SRVW0_TT2_16_WG32_8_1_WGM1
    SolutionIndex: 143
    SolutionNameMin: Cijk_Ailk_Bjlk_BBH_MT64x64x32_MI32x32x4x1_SE_AF0EM4_GRVW2_NLCA1_NLCB1_SU0_SUS256_SRVW4_TT1_32_WG64_4_1_WGM1
    SolutionIndex: 144
    SolutionNameMin: Cijk_Ailk_Bjlk_BBH_MT128x96x32_MI32x32x4x1_SE_AF0EM4_GRVW4_NLCA1_NLCB3_SU32_SUS128_SRVW0_TT1_96_WG128_2_1_WGM2
    SolutionIndex: 145
    SolutionNameMin: Cijk_Ailk_Bjlk_BBH_MT64x128x32_MI32x32x4x1_SE_AF0EM4_GRVW8_NLCA1_NLCB1_SU16_SUS128_SRVW4_TT1_64_WG64_4_1_WGM1
    SolutionIndex: 146
    SolutionNameMin: Cijk_Ailk_Bjlk_BBH_MT32x32x16_MI16x16x8x1_SE_AF0EM4_GRVW2_NLCA1_NLCB1_SU16_SUS128_SRVW0_TT1_16_WG32_8_1_WGM2
    SolutionIndex: 147
    SolutionNameMin: Cijk_Ailk_Bjlk_BBH_MT32x64x16_MI16x16x8x1_SE_AF0EM1_GRVW4_NLCA1_NLCB1_SU16_SUS256_SRVW0_TT1_32_WG32_8_1_WGM2
    SolutionIndex: 148
    SolutionNameMin: Cijk_Ailk_Bjlk_BBH_MT128x64x32_MI32x32x4x1_SE_AF0EM1_GRVW8_NLCA1_NLCB1_SU0_SUS256_SRVW4_TT2_32_WG64_4_1_WGM2
    SolutionIndex: 149
    SolutionNameMin: Cijk_Ailk_Bjlk_BBH_MT32x32x16_MI16x16x8x1_SE_AF0EM4_GRVW2_NLCA1_NLCB1_SU16_SUS256_SRVW0_TT1_16_WG32_8_1_WGM15
    SolutionIndex: 150
    SolutionNameMin: Cijk_Ailk_Bjlk_BBH_MT128x128x16_MI32x32x4x1_SE_AF0EM4_GRVW8_NLCA1_NLCB1_SU32_SUS256_SRVW4_TT2_64_WG64_4_1_WGM1
    SolutionIndex: 151
    SolutionNameMin: Cijk_Ailk_Bjlk_BBH_MT64x64x32_MI32x32x4x1_SE_AF0EM1_GRVW8_NLCA1_NLCB1_SU0_SUS256_SRVW4_TT1_32_WG64_4_1_WGM15
    SolutionIndex: 152
    SolutionNameMin: Cijk_Ailk_Bjlk_BBH_MT128x96x32_MI32x32x4x1_SE_AF0EM1_GRVW4_NLCA1_NLCB3_SU32_SUS128_SRVW4_TT1_96_WG128_2_1_WGM15
    SolutionIndex: 153
    SolutionNameMin: Cijk_Ailk_Bjlk_BBH_MT64x64x64_MI32x32x4x1_SE_AF0EM1_GRVW8_NLCA1_NLCB1_SU16_SUS128_SRVW4_TT1_32_WG64_4_1_WGM1
    SolutionIndex: 154
    SolutionNameMin: Cijk_Ailk_Bjlk_BBH_MT32x64x16_MI16x16x8x1_SE_AF0EM4_GRVW2_NLCA1_NLCB1_SU0_SUS256_SRVW4_TT1_32_WG32_8_1_WGM2
    SolutionIndex: 155
    SolutionNameMin: Cijk_Ailk_Bjlk_BBH_MT128x96x32_MI32x32x4x1_SE_AF0EM1_GRVW4_NLCA1_NLCB3_SU32_SUS128_SRVW4_TT1_96_WG128_2_1_WGM2
    SolutionIndex: 156
    SolutionNameMin: Cijk_Ailk_Bjlk_BBH_MT32x32x16_MI16x16x8x1_SE_AF0EM4_GRVW2_NLCA1_NLCB1_SU16_SUS256_SRVW0_TT1_16_WG32_8_1_WGM2
    SolutionIndex: 157
    SolutionNameMin: Cijk_Ailk_Bjlk_BBH_MT64x64x32_MI32x32x4x1_SE_AF0EM1_GRVW4_NLCA1_NLCB1_SU32_SUS256_SRVW4_TT1_32_WG64_4_1_WGM2
    SolutionIndex: 158
    SolutionNameMin: Cijk_Ailk_Bjlk_BBH_MT128x96x32_MI32x32x4x1_SE_AF0EM1_GRVW4_NLCA1_NLCB3_SU16_SUS256_SRVW4_TT1_96_WG128_2_1_WGM15
    SolutionIndex: 159
    SolutionNameMin: Cijk_Ailk_Bjlk_BBH_MT128x96x16_MI32x32x4x1_SE_AF0EM4_GRVW2_NLCA1_NLCB3_SU16_SUS128_SRVW4_TT1_96_WG128_2_1_WGM2
    SolutionIndex: 160
    SolutionNameMin: Cijk_Ailk_Bjlk_BBH_MT64x64x64_MI32x32x4x1_SE_AF0EM4_GRVW8_NLCA1_NLCB1_SU32_SUS256_SRVW0_TT1_32_WG64_4_1_WGM1
    SolutionIndex: 161
    SolutionNameMin: Cijk_Ailk_Bjlk_BBH_MT64x64x32_MI32x32x4x1_SE_AF0EM4_GRVW4_NLCA1_NLCB1_SU0_SUS256_SRVW4_TT1_32_WG64_4_1_WGM1
    SolutionIndex: 162
    SolutionNameMin: Cijk_Ailk_Bjlk_BBH_MT64x64x64_MI32x32x4x1_SE_AF0EM1_GRVW8_NLCA1_NLCB1_SU32_SUS256_SRVW4_TT1_32_WG64_4_1_WGM1
    SolutionIndex: 163
    SolutionNameMin: Cijk_Ailk_Bjlk_BBH_MT32x32x64_MI16x16x8x1_SE_AF0EM1_GRVW4_NLCA1_NLCB1_SU0_SUS256_SRVW0_TT1_16_WG32_8_1_WGM1
    SolutionIndex: 164
    SolutionNameMin: Cijk_Ailk_Bjlk_BBH_MT64x32x16_MI16x16x8x1_SE_AF0EM1_GRVW4_NLCA1_NLCB1_SU0_SUS256_SRVW4_TT2_16_WG32_8_1_WGM1
    SolutionIndex: 165
    SolutionNameMin: Cijk_Ailk_Bjlk_BBH_MT64x64x32_MI32x32x4x1_SE_AF0EM4_GRVW4_NLCA1_NLCB1_SU0_SUS256_SRVW4_TT1_32_WG64_4_1_WGM2
    SolutionIndex: 166
    SolutionNameMin: Cijk_Ailk_Bjlk_BBH_MT128x64x32_MI32x32x2x2_SE_AF0EM4_ASBE01_GRVW4_PBD0_SRVW4_TT1_32_WG128_2_1_WGM4
    SolutionIndex: 167
    SolutionNameMin: Cijk_Ailk_Bjlk_BBH_MT64x64x32_MI32x32x4x1_SE_AF0EM4_ASBE01_GRVW2_PBD0_SRVW4_TT1_32_WG64_4_1_WGM10
    SolutionIndex: 168
    SolutionNameMin: Cijk_Ailk_Bjlk_BBH_MT64x128x32_MI32x32x4x1_SE_AF0EM8_ASBE01_GRVW8_PBD0_SRVW4_TT2_32_WG32_8_1_WGM4
    SolutionIndex: 169
    SolutionNameMin: Cijk_Ailk_Bjlk_BBH_MT64x64x32_MI32x32x4x1_SE_AF0EM1_ASBE01_GRVW4_PBD0_SRVW4_TT1_32_WG64_4_1_WGM10
    SolutionIndex: 170
    SolutionNameMin: Cijk_Ailk_Bjlk_BBH_MT64x64x32_MI16x16x8x1_SE_AF0EM1_ASBE01_GRVW4_PBD0_SRVW4_TT2_32_WG32_8_1_WGM1
    SolutionIndex: 171
    SolutionNameMin: Cijk_Ailk_Bjlk_BBH_MT128x128x32_MI32x32x4x1_SE_AF0EM4_ASBE01_GRVW4_PBD0_SRVW4_TT2_64_WG64_4_1_WGM10
    SolutionIndex: 172
    SolutionNameMin: Cijk_Ailk_Bjlk_BBH_MT64x64x32_MI32x32x4x1_SE_AF0EM1_ASBE01_GRVW4_PBD0_SRVW4_TT1_32_WG64_4_1_WGM4
    SolutionIndex: 173
    SolutionNameMin: Cijk_Ailk_Bjlk_BBH_MT64x128x32_MI32x32x4x1_SE_AF0EM1_ASBE01_GRVW4_PBD0_SRVW4_TT2_32_WG32_8_1_WGM1
    SolutionIndex: 174
    SolutionNameMin: Cijk_Ailk_Bjlk_BBH_MT128x64x32_MI32x32x4x1_SE_AF0EM4_ASBE01_GRVW4_PBD0_SRVW4_TT2_32_WG64_4_1_WGM10
    SolutionIndex: 175
    SolutionNameMin: Cijk_Ailk_Bjlk_BBH_MT64x64x32_MI32x32x4x1_SE_AF0EM8_ASBE01_GRVW4_PBD0_SRVW4_TT1_32_WG64_4_1_WGM1
    SolutionIndex: 176
    SolutionNameMin: Cijk_Ailk_Bjlk_BBH_MT64x64x32_MI32x32x4x1_SE_AF0EM4_ASBE01_GRVW2_PBD0_SRVW4_TT1_32_WG64_4_1_WGM1
    SolutionIndex: 177
    SolutionNameMin: Cijk_Ailk_Bjlk_BBH_MT64x64x32_MI32x32x4x1_SE_AF0EM8_ASBE01_GRVW8_PBD0_SRVW4_TT1_32_WG64_4_1_WGM10
    SolutionIndex: 178
    SolutionNameMin: Cijk_Ailk_Bjlk_BBH_MT128x128x32_MI32x32x4x1_SE_AF0EM4_ASBE01_GRVW4_PBD0_SRVW4_TT2_64_WG64_4_1_WGM4
    SolutionIndex: 179
    SolutionNameMin: Cijk_Ailk_Bjlk_BBH_MT128x256x32_MI32x32x4x1_SE_AF0EM8_GRVW8_GSU1_SU32_SUS128_SRVW4_WG64_4_1_WGM15
    SolutionIndex: 180
    SolutionNameMin: Cijk_Ailk_Bjlk_BBH_MT128x256x16_MI32x32x4x1_SE_AF0EM8_GRVW8_GSU1_SU0_SUS256_SRVW4_WG64_4_1_WGM1
    SolutionIndex: 181
    SolutionNameMin: Cijk_Ailk_Bjlk_BBH_MT128x256x16_MI32x32x4x1_SE_AF0EM8_GRVW8_GSU1_SU0_SUS256_SRVW4_WG64_4_1_WGM15
    SolutionIndex: 182
    SolutionNameMin: Cijk_Ailk_Bjlk_BBH_MT128x160x16_MI32x32x4x1_SE_AF0EM8_GRVW2_GSU1_SU32_SUS128_SRVW4_WG128_2_1_WGM1
    SolutionIndex: 183
    SolutionNameMin: Cijk_Ailk_Bjlk_BBH_MT64x16x64_MI16x16x8x1_SE_AF0EM8_GRVW2_GSU15_SU0_SUS256_SRVW0_WG64_4_1_WGM1
    SolutionIndex: 184
    SolutionNameMin: Cijk_Ailk_Bjlk_BBH_MT64x16x32_MI16x16x8x1_SE_AF0EM1_GRVW8_GSU15_SU0_SUS256_SRVW0_WG64_4_1_WGM1
    SolutionIndex: 185
    SolutionNameMin: Cijk_Ailk_Bjlk_BBH_MT128x128x16_MI32x32x4x1_SE_AF0EM8_GRVW8_GSU1_SU32_SUS256_SRVW4_WG64_4_1_WGM15
    SolutionIndex: 186
    SolutionNameMin: Cijk_Ailk_Bjlk_BBH_MT64x64x64_MI32x32x4x1_SE_AF0EM8_GRVW8_GSU15_SU32_SUS128_SRVW0_WG64_4_1_WGM15
    SolutionIndex: 187
    SolutionNameMin: Cijk_Ailk_Bjlk_BBH_MT128x128x16_MI32x32x4x1_SE_AF0EM8_GRVW8_GSU7_SU0_SUS256_SRVW0_WG64_4_1_WGM1
    SolutionIndex: 188
    SolutionNameMin: Cijk_Ailk_Bjlk_BBH_MT128x256x32_MI32x32x4x1_SE_AF0EM8_GRVW8_GSU1_SU0_SUS256_SRVW4_WG64_4_1_WGM1
    SolutionIndex: 189
    SolutionNameMin: Cijk_Ailk_Bjlk_BBH_MT128x128x16_MI32x32x4x1_SE_AF0EM8_GRVW8_GSU1_SU32_SUS128_SRVW4_WG64_4_1_WGM15
    SolutionIndex: 190
    SolutionNameMin: Cijk_Ailk_Bjlk_BBH_MT128x96x32_MI32x32x4x1_SE_AF0EM8_GRVW4_GSU1_SU32_SUS128_SRVW4_WG128_2_1_WGM15
    SolutionIndex: 191
    SolutionNameMin: Cijk_Ailk_Bjlk_BBH_MT128x96x32_MI32x32x4x1_SE_AF0EM8_GRVW4_GSU1_SU32_SUS256_SRVW4_WG128_2_1_WGM2
    SolutionIndex: 192
    SolutionNameMin: Cijk_Ailk_Bjlk_BBH_MT32x32x64_MI16x16x8x1_SE_AF0EM8_GRVW8_GSU15_SU0_SUS256_SRVW0_WG32_8_1_WGM1
    SolutionIndex: 193
    SolutionNameMin: Cijk_Ailk_Bjlk_BBH_MT128x128x16_MI32x32x4x1_SE_AF0EM8_GRVW8_GSU3_SU0_SUS256_SRVW0_WG64_4_1_WGM2
    SolutionIndex: 194
    SolutionNameMin: Cijk_Ailk_Bjlk_BBH_MT64x64x64_MI32x32x4x1_SE_AF0EM8_GRVW8_GSU1_SU0_SUS256_SRVW4_WG64_4_1_WGM1
    SolutionIndex: 195
    SolutionNameMin: Cijk_Ailk_Bjlk_BBH_MT128x128x32_MI32x32x4x1_SE_AF0EM8_GRVW8_GSU1_SU32_SUS128_SRVW4_WG64_4_1_WGM15
    SolutionIndex: 196
    SolutionNameMin: Cijk_Ailk_Bjlk_BBH_MT128x128x16_MI32x32x4x1_SE_AF0EM8_GRVW8_GSU1_SU0_SUS256_SRVW4_WG64_4_1_WGM1
    SolutionIndex: 197
    SolutionNameMin: Cijk_Ailk_Bjlk_BBH_MT128x128x16_MI32x32x4x1_SE_AF0EM8_GRVW8_GSU1_SU0_SUS256_SRVW4_WG64_4_1_WGM1
    SolutionIndex: 198
    SolutionNameMin: Cijk_Ailk_Bjlk_BBH_MT128x128x32_MI32x32x4x1_SE_AF0EM8_GRVW8_GSU1_SU32_SUS256_SRVW4_WG64_4_1_WGM15
    SolutionIndex: 199
    SolutionNameMin: Cijk_Ailk_Bjlk_BBH_MT96x128x64_MI32x32x4x1_SE_AF0EM8_GRVW8_GSU3_SU0_SUS256_SRVW0_WG32_8_1_WGM2
    SolutionIndex: 200
    SolutionNameMin: Cijk_Ailk_Bjlk_BBH_MT96x96x32_MI16x16x8x1_SE_AF0EM8_GRVW4_GSU7_SU0_SUS256_SRVW0_WG32_8_1_WGM15
    SolutionIndex: 201
    SolutionNameMin: Cijk_Ailk_Bjlk_BBH_MT128x96x32_MI32x32x4x1_SE_AF0EM8_GRVW4_GSU5_SU0_SUS256_SRVW0_WG128_2_1_WGM1
    SolutionIndex: 202
    SolutionNameMin: Cijk_Ailk_Bjlk_BBH_MT96x128x32_MI32x32x4x1_SE_AF0EM8_GRVW4_GSU5_SU32_SUS128_SRVW0_WG32_8_1_WGM1
    SolutionIndex: 203
    SolutionNameMin: Cijk_Ailk_Bjlk_BBH_MT256x64x32_MI32x32x4x1_SE_AF0EM8_GRVW8_GSU7_SU32_SUS128_SRVW0_WG64_4_1_WGM2
    SolutionIndex: 204
    SolutionNameMin: Cijk_Ailk_Bjlk_BBH_MT128x64x32_MI32x32x4x1_SE_AF0EM8_GRVW8_GSU1_SU32_SUS128_SRVW4_WG64_4_1_WGM1
    SolutionIndex: 205
    SolutionNameMin: Cijk_Ailk_Bjlk_BBH_MT128x128x16_MI32x32x4x1_SE_AF0EM8_GRVW8_GSU1_SU32_SUS128_SRVW4_WG64_4_1_WGM15
    SolutionIndex: 206
    SolutionNameMin: Cijk_Ailk_Bjlk_BBH_MT96x96x64_MI16x16x8x1_SE_AF0EM8_GRVW2_GSU1_SU0_SUS256_SRVW0_WG32_8_1_WGM2
    SolutionIndex: 207
    SolutionNameMin: Cijk_Ailk_Bjlk_BBH_MT96x96x32_MI16x16x8x1_SE_AF0EM8_GRVW2_GSU1_SU0_SUS256_SRVW0_WG32_8_1_WGM1
    SolutionIndex: 208
    SolutionNameMin: Cijk_Ailk_Bjlk_BBH_MT128x128x32_MI32x32x4x1_SE_AF0EM8_GRVW8_GSU1_SU32_SUS128_SRVW4_WG64_4_1_WGM2
    SolutionIndex: 209
    SolutionNameMin: Cijk_Ailk_Bjlk_BBH_MT96x128x32_MI32x32x4x1_SE_AF0EM8_GRVW4_GSU1_SU0_SUS256_SRVW0_WG32_8_1_WGM1
    SolutionIndex: 210
    SolutionNameMin: Cijk_Ailk_Bjlk_BBH_MT128x160x32_MI32x32x4x1_SE_AF0EM8_GRVW2_GSU1_SU0_SUS256_SRVW4_WG128_2_1_WGM2
    SolutionIndex: 211
    SolutionNameMin: Cijk_Ailk_Bjlk_BBH_MT64x16x32_MI16x16x8x1_SE_AF0EM8_GRVW4_GSU1_SU0_SUS256_SRVW0_WG64_4_1_WGM1
    SolutionIndex: 212
    SolutionNameMin: Cijk_Ailk_Bjlk_BBH_MT64x128x16_MI32x32x4x1_SE_AF0EM8_GRVW2_GSU1_SU32_SUS256_SRVW4_WG64_4_1_WGM1
    SolutionIndex: 213
    SolutionNameMin: Cijk_Ailk_Bjlk_BBH_MT64x64x32_MI32x32x4x1_SE_AF0EM8_GRVW8_GSU1_SU32_SUS256_SRVW4_WG64_4_1_WGM15
    SolutionIndex: 214
    SolutionNameMin: Cijk_Ailk_Bjlk_BBH_MT64x64x64_MI32x32x4x1_SE_AF0EM8_GRVW8_GSU1_SU32_SUS128_SRVW4_WG64_4_1_WGM2
    SolutionIndex: 215
    SolutionNameMin: Cijk_Ailk_Bjlk_BBH_MT64x32x32_MI16x16x8x1_SE_AF0EM8_GRVW8_GSU15_SU32_SUS256_SRVW0_WG32_8_1_WGM2
    SolutionIndex: 216
    SolutionNameMin: Cijk_Ailk_Bjlk_BBH_MT64x32x64_MI16x16x8x1_SE_AF0EM8_GRVW8_GSU15_SU32_SUS128_SRVW0_WG32_8_1_WGM2
    SolutionIndex: 217
    SolutionNameMin: Cijk_Ailk_Bjlk_BBH_MT64x32x16_MI16x16x8x1_SE_AF0EM8_GRVW2_GSU1_SU0_SUS256_SRVW4_WG32_8_1_WGM1
    SolutionIndex: 218
    SolutionNameMin: Cijk_Ailk_Bjlk_BBH_MT32x32x32_MI16x16x8x1_SE_AF0EM8_GRVW8_GSU1_SU0_SUS256_SRVW4_WG32_8_1_WGM1
    SolutionIndex: 219
    SolutionNameMin: Cijk_Ailk_Bjlk_BBH_MT96x128x32_MI32x32x4x1_SE_AF0EM8_GRVW4_GSU3_SU0_SUS256_SRVW0_WG32_8_1_WGM1
    SolutionIndex: 220
    SolutionNameMin: Cijk_Ailk_Bjlk_BBH_MT32x64x64_MI16x16x8x1_SE_AF0EM8_GRVW8_GSU3_SU32_SUS128_SRVW0_WG32_8_1_WGM1
    SolutionIndex: 221
    SolutionNameMin: Cijk_Ailk_Bjlk_BBH_MT128x64x64_MI32x32x4x1_SE_AF0EM8_GRVW4_GSU7_SU32_SUS128_SRVW0_WG64_4_1_WGM1
    SolutionIndex: 222
    SolutionNameMin: Cijk_Ailk_Bjlk_BBH_MT32x32x64_MI16x16x8x1_SE_AF0EM8_GRVW8_GSU1_SU32_SUS128_SRVW4_WG32_8_1_WGM1
    SolutionIndex: 223
    SolutionNameMin: Cijk_Ailk_Bjlk_BBH_MT128x96x32_MI32x32x4x1_SE_AF0EM8_GRVW4_GSU1_SU32_SUS128_SRVW4_WG128_2_1_WGM1
    SolutionIndex: 224
    SolutionNameMin: Cijk_Ailk_Bjlk_BBH_MT128x96x32_MI32x32x4x1_SE_AF0EM8_GRVW4_GSU1_SU32_SUS256_SRVW4_WG128_2_1_WGM15
    SolutionIndex: 225
    SolutionNameMin: Cijk_Ailk_Bjlk_BBH_MT32x64x16_MI16x16x8x1_SE_AF0EM8_GRVW8_GSU1_SU0_SUS256_SRVW4_WG32_8_1_WGM15
    SolutionIndex: 226
    SolutionNameMin: Cijk_Ailk_Bjlk_BBH_MT16x64x32_MI16x16x8x1_SE_AF0EM8_GRVW2_GSU1_SU0_SUS256_SRVW0_WG16_16_1_WGM2
    SolutionIndex: 227
    SolutionNameMin: Cijk_Ailk_Bjlk_BBH_MT128x96x16_MI32x32x4x1_SE_AF0EM8_GRVW2_GSU1_SU32_SUS128_SRVW4_WG128_2_1_WGM2
    SolutionIndex: 228
    SolutionNameMin: Cijk_Ailk_Bjlk_BBH_MT16x64x64_MI16x16x8x1_SE_AF0EM1_GRVW8_GSU15_SU0_SUS256_SRVW0_WG16_16_1_WGM2
    SolutionIndex: 229
    SolutionNameMin: Cijk_Ailk_Bjlk_BBH_MT16x16x16_MI16x16x8x1_SE_AF0EM1_GRVW2_GSU1_SU32_SUS128_SRVW0_WG16_4_1_WGM1
    SolutionIndex: 230
    SolutionNameMin: Cijk_Ailk_Bjlk_BBH_MT16x16x16_MI16x16x8x1_SE_AF0EM1_GRVW2_GSU1_SU32_SUS256_SRVW0_WG16_4_1_WGM2
    SolutionIndex: 231
    SolutionNameMin: Cijk_Ailk_Bjlk_BBH_MT32x64x16_MI16x16x8x1_SE_AF0EM1_GRVW2_GSU1_SU32_SUS128_SRVW4_WG32_8_1_WGM2
    SolutionIndex: 232
    SolutionNameMin: Cijk_Ailk_Bjlk_BBH_MT32x32x64_MI16x16x8x1_SE_AF0EM1_GRVW4_GSU15_SU0_SUS256_SRVW0_WG32_8_1_WGM1
    SolutionIndex: 233
    SolutionNameMin: Cijk_Ailk_Bjlk_BBH_MT32x32x64_MI16x16x8x1_SE_AF0EM1_GRVW8_GSU15_SU0_SUS256_SRVW0_WG32_8_1_WGM15
    SolutionIndex: 234
    SolutionNameMin: Cijk_Ailk_Bjlk_BBH_MT128x128x16_MI32x32x4x1_SE_1LDSB0_GRVW8_NLCA1_NLCB1_SU0_SUS256_SRVW4_TT2_64_WG64_4_1_WGM1
    SolutionIndex: 235
    SolutionNameMin: Cijk_Ailk_Bjlk_BBH_MT128x128x16_MI32x32x4x1_SE_1LDSB1_GRVW8_NLCA1_NLCB1_SU0_SUS256_SRVW4_TT2_64_WG64_4_1_WGM1
    SolutionIndex: 236
    SolutionNameMin: Cijk_Ailk_Bjlk_BBH_MT64x128x16_MI32x32x4x1_SE_1LDSB0_GRVW8_NLCA1_NLCB1_SU32_SUS256_SRVW4_TT1_64_WG64_4_1_WGM1
    SolutionIndex: 237
    SolutionNameMin: Cijk_Ailk_Bjlk_BBH_MT64x128x16_MI32x32x4x1_SE_1LDSB0_GRVW8_NLCA1_NLCB1_SU32_SUS128_SRVW4_TT1_64_WG64_4_1_WGM1
    SolutionIndex: 238
    SolutionNameMin: Cijk_Ailk_Bjlk_BBH_MT64x128x32_MI32x32x4x1_SE_1LDSB0_GRVW8_NLCA1_NLCB1_SU32_SUS128_SRVW4_TT1_64_WG64_4_1_WGM2
    SolutionIndex: 239
    SolutionNameMin: Cijk_Ailk_Bjlk_BBH_MT128x96x32_MI32x32x4x1_SE_1LDSB0_GRVW4_NLCA1_NLCB3_SU0_SUS256_SRVW4_TT1_96_WG128_2_1_WGM15
    SolutionIndex: 240
    SolutionNameMin: Cijk_Ailk_Bjlk_BBH_MT64x64x16_MI32x32x4x1_SE_1LDSB0_GRVW8_NLCA1_NLCB1_SU0_SUS256_SRVW4_TT1_32_WG64_4_1_WGM15
    SolutionIndex: 241
    SolutionNameMin: Cijk_Ailk_Bjlk_BBH_MT64x128x16_MI32x32x4x1_SE_1LDSB0_GRVW8_NLCA1_NLCB1_SU0_SUS256_SRVW4_TT1_64_WG64_4_1_WGM1
    SolutionIndex: 242
    SolutionNameMin: Cijk_Ailk_Bjlk_BBH_MT64x64x16_MI32x32x4x1_SE_1LDSB0_GRVW8_NLCA1_NLCB1_SU32_SUS256_SRVW4_TT1_32_WG64_4_1_WGM1
    SolutionIndex: 243
    SolutionNameMin: Cijk_Ailk_Bjlk_BBH_MT64x128x16_MI32x32x4x1_SE_1LDSB0_GRVW8_NLCA1_NLCB1_SU0_SUS256_SRVW4_TT1_64_WG64_4_1_WGM15
    SolutionIndex: 244
    SolutionNameMin: Cijk_Ailk_Bjlk_BBH_MT64x64x16_MI32x32x4x1_SE_1LDSB0_GRVW4_NLCA1_NLCB1_SU0_SUS256_SRVW4_TT1_32_WG64_4_1_WGM1
    SolutionIndex: 245
    SolutionNameMin: Cijk_Ailk_Bjlk_BBH_MT64x128x16_MI32x32x4x1_SE_1LDSB0_GRVW8_NLCA1_NLCB1_SU32_SUS256_SRVW4_TT1_64_WG64_4_1_WGM2
    SolutionIndex: 246
    SolutionNameMin: Cijk_Ailk_Bjlk_BBH_MT128x256x16_MI32x32x4x1_SE_AF0EM8_GRVW8_GSU1_SU0_SUS256_SRVW4_WG64_4_1_WGM2
    SolutionIndex: 247
    SolutionNameMin: Cijk_Ailk_Bjlk_BBH_MT64x128x64_MI32x32x4x1_SE_AF0EM8_GRVW8_GSU1_SU0_SUS256_SRVW4_WG64_4_1_WGM2
    SolutionIndex: 248
    SolutionNameMin: Cijk_Ailk_Bjlk_BBH_MT32x32x64_MI16x16x8x1_SE_AF0EM8_GRVW8_GSU1_SU0_SUS256_SRVW4_WG32_8_1_WGM1
    SolutionIndex: 249
    SolutionNameMin: Cijk_Ailk_Bjlk_BBH_MT256x128x32_MI32x32x4x1_SE_AF0EM8_GRVW8_GSU1_SU32_SUS256_SRVW4_WG64_4_1_WGM15
    SolutionIndex: 250
    SolutionNameMin: Cijk_Ailk_Bjlk_BBH_MT128x64x64_MI32x32x4x1_SE_AF0EM8_GRVW4_GSU1_SU0_SUS256_SRVW4_WG64_4_1_WGM2
    SolutionIndex: 251
    SolutionNameMin: Cijk_Ailk_Bjlk_BBH_MT64x32x64_MI16x16x8x1_SE_AF0EM8_GRVW8_GSU1_SU0_SUS256_SRVW4_WG32_8_1_WGM1
    SolutionIndex: 252
    SolutionNameMin: Cijk_Ailk_Bjlk_BBH_MT64x64x64_MI32x32x4x1_SE_AF0EM8_GRVW4_GSU1_SU0_SUS256_SRVW4_WG64_4_1_WGM2
    SolutionIndex: 253
    SolutionNameMin: Cijk_Ailk_Bjlk_BBH_MT64x64x32_MI32x32x4x1_SE_AF0EM8_GRVW8_GSU1_SU0_SUS256_SRVW4_WG64_4_1_WGM15
    SolutionIndex: 254
    SolutionNameMin: Cijk_Ailk_Bjlk_BBH_MT64x64x16_MI32x32x4x1_SE_AF0EM8_GRVW2_GSU1_SU0_SUS256_SRVW4_WG64_4_1_WGM1
    SolutionIndex: 255
    SolutionNameMin: Cijk_Ailk_Bjlk_BBH_MT16x64x64_MI16x16x8x1_SE_AF0EM1_GRVW2_GSU2_SU32_SUS256_SRVW0_WG16_16_1_WGM1
    SolutionIndex: 256
    SolutionNameMin: Cijk_Ailk_Bjlk_BBH_MT64x64x16_MI32x32x4x1_SE_AF0EM8_GRVW2_GSU1_SU0_SUS256_SRVW4_WG64_4_1_WGM2
    SolutionIndex: 257
    SolutionNameMin: Cijk_Ailk_Bjlk_BBH_MT64x64x64_MI32x32x4x1_SE_AF0EM8_GRVW8_GSU1_SU32_SUS256_SRVW4_WG64_4_1_WGM2
    SolutionIndex: 258
    SolutionNameMin: Cijk_Ailk_Bjlk_BBH_MT128x96x32_MI32x32x4x1_SE_AF0EM8_GRVW4_GSU1_SU32_SUS128_SRVW4_WG128_2_1_WGM15
    SolutionIndex: 259
    SolutionNameMin: Cijk_Ailk_Bjlk_BBH_MT64x64x32_MI32x32x4x1_SE_AF0EM8_GRVW8_GSU1_SU0_SUS256_SRVW4_WG64_4_1_WGM1
    SolutionIndex: 260
    SolutionNameMin: Cijk_Ailk_Bjlk_BBH_MT32x32x16_MI16x16x8x1_SE_AF0EM8_GRVW2_GSU1_SU0_SUS256_SRVW4_WG32_8_1_WGM1
    SolutionIndex: 261
    SolutionNameMin: Cijk_Ailk_Bjlk_BBH_MT32x32x64_MI16x16x8x1_SE_AF0EM8_GRVW2_GSU5_SU32_SUS128_SRVW0_WG32_8_1_WGM1
    SolutionIndex: 262
    SolutionNameMin: Cijk_Ailk_Bjlk_BBH_MT64x64x16_MI32x32x4x1_SE_AF0EM8_GRVW2_GSU1_SU32_SUS256_SRVW4_WG64_4_1_WGM2
    SolutionIndex: 263
    SolutionNameMin: Cijk_Ailk_Bjlk_BBH_MT64x64x32_MI32x32x4x1_SE_AF0EM8_GRVW8_GSU1_SU32_SUS256_SRVW4_WG64_4_1_WGM15
    SolutionIndex: 264
    SolutionNameMin: Cijk_Ailk_Bjlk_BBH_MT128x256x16_MI32x32x4x1_SE_AF0EM8_GRVW4_GSU1_SU32_SUS256_SRVW4_WG64_4_1_WGM2
    SolutionIndex: 265
    SolutionNameMin: Cijk_Ailk_Bjlk_BBH_MT64x128x16_MI32x32x4x1_SE_AF0EM8_GRVW2_GSU1_SU32_SUS256_SRVW4_WG64_4_1_WGM15
    SolutionIndex: 266
    SolutionNameMin: Cijk_Ailk_Bjlk_BBH_MT64x16x64_MI16x16x8x1_SE_AF0EM8_GRVW2_GSU7_SU0_SUS256_SRVW0_WG64_4_1_WGM1
    SolutionIndex: 267
    SolutionNameMin: Cijk_Ailk_Bjlk_BBH_MT64x32x16_MI16x16x8x1_SE_AF0EM8_GRVW2_GSU1_SU0_SUS256_SRVW4_WG32_8_1_WGM15
    SolutionIndex: 268
    SolutionNameMin: Cijk_Ailk_Bjlk_BBH_MT128x160x32_MI32x32x4x1_SE_AF0EM8_GRVW2_GSU2_SU0_SUS256_SRVW0_WG128_2_1_WGM15
    SolutionIndex: 269
    SolutionNameMin: Cijk_Ailk_Bjlk_BBH_MT64x64x64_MI32x32x4x1_SE_AF0EM8_GRVW8_GSU1_SU0_SUS256_SRVW4_WG64_4_1_WGM2
    SolutionIndex: 270
    SolutionNameMin: Cijk_Ailk_Bjlk_BBH_MT32x32x16_MI16x16x8x1_SE_AF0EM8_GRVW4_GSU1_SU0_SUS256_SRVW4_WG32_8_1_WGM1
    SolutionIndex: 271
    SolutionNameMin: Cijk_Ailk_Bjlk_BBH_MT64x16x64_MI16x16x8x1_SE_AF0EM8_GRVW2_GSU7_SU32_SUS128_SRVW0_WG64_4_1_WGM1
    SolutionIndex: 272
    SolutionNameMin: Cijk_Ailk_Bjlk_BBH_MT64x64x16_MI32x32x4x1_SE_AF0EM8_GRVW2_GSU1_SU0_SUS256_SRVW4_WG64_4_1_WGM15
    SolutionIndex: 273
    SolutionNameMin: Cijk_Ailk_Bjlk_BBH_MT64x64x32_MI32x32x4x1_SE_AF0EM8_GRVW4_GSU1_SU0_SUS256_SRVW4_WG64_4_1_WGM15
    SolutionIndex: 274
    SolutionNameMin: Cijk_Ailk_Bjlk_BBH_MT128x256x16_MI32x32x4x1_SE_AF0EM8_GRVW4_GSU1_SU32_SUS256_SRVW4_WG64_4_1_WGM2
    SolutionIndex: 275
    SolutionNameMin: Cijk_Ailk_Bjlk_BBH_MT64x16x64_MI16x16x8x1_SE_AF0EM1_GRVW2_GSU15_SU32_SUS128_SRVW0_WG64_4_1_WGM2
    SolutionIndex: 276
    SolutionNameMin: Cijk_Ailk_Bjlk_BBH_MT160x128x32_MI32x32x4x1_SE_AF0EM8_GRVW2_GSU2_SU0_SUS256_SRVW0_WG32_8_1_WGM1
    SolutionIndex: 277
    SolutionNameMin: Cijk_Ailk_Bjlk_BBH_MT128x128x16_MI32x32x4x1_SE_AF0EM8_GRVW8_GSU1_SU0_SUS256_SRVW4_WG64_4_1_WGM2
    SolutionIndex: 278
    SolutionNameMin: Cijk_Ailk_Bjlk_BBH_MT64x128x16_MI32x32x4x1_SE_AF0EM8_GRVW2_GSU1_SU32_SUS256_SRVW4_WG64_4_1_WGM1
    SolutionIndex: 279
    SolutionNameMin: Cijk_Ailk_Bjlk_BBH_MT64x16x64_MI16x16x8x1_SE_AF0EM8_GRVW2_GSU15_SU32_SUS128_SRVW0_WG64_4_1_WGM2
    SolutionIndex: 280
    SolutionNameMin: Cijk_Ailk_Bjlk_BBH_MT64x32x16_MI16x16x8x1_SE_AF0EM8_GRVW2_GSU1_SU32_SUS256_SRVW4_WG32_8_1_WGM15
    SolutionIndex: 281
    SolutionNameMin: Cijk_Ailk_Bjlk_BBH_MT128x160x32_MI32x32x4x1_SE_AF0EM8_GRVW2_GSU2_SU0_SUS256_SRVW0_WG128_2_1_WGM2
    SolutionIndex: 282
    SolutionNameMin: Cijk_Ailk_Bjlk_BBH_MT64x128x32_MI32x32x4x1_SE_AF0EM8_GRVW8_GSU1_SU32_SUS256_SRVW4_WG64_4_1_WGM15
    SolutionIndex: 283
    SolutionNameMin: Cijk_Ailk_Bjlk_BBH_MT64x16x64_MI16x16x8x1_SE_AF0EM8_GRVW2_GSU7_SU0_SUS256_SRVW0_WG64_4_1_WGM15
    SolutionIndex: 284
    SolutionNameMin: Cijk_Ailk_Bjlk_BBH_MT64x128x32_MI32x32x4x1_SE_AF0EM8_GRVW8_GSU1_SU32_SUS128_SRVW4_WG64_4_1_WGM1
    SolutionIndex: 285
    SolutionNameMin: Cijk_Ailk_Bjlk_BBH_MT16x64x32_MI16x16x8x1_SE_AF0EM8_GRVW2_GSU1_SU0_SUS256_SRVW0_WG16_16_1_WGM2
    SolutionIndex: 286
    SolutionNameMin: Cijk_Ailk_Bjlk_BBH_MT64x16x64_MI16x16x8x1_SE_AF0EM8_GRVW2_GSU7_SU32_SUS128_SRVW0_WG64_4_1_WGM2
    SolutionIndex: 287
    SolutionNameMin: Cijk_Ailk_Bjlk_BBH_MT64x64x32_MI32x32x4x1_SE_AF0EM8_GRVW8_GSU1_SU32_SUS128_SRVW4_WG64_4_1_WGM1
    SolutionIndex: 288
    SolutionNameMin: Cijk_Ailk_Bjlk_BBH_MT16x16x64_MI16x16x8x1_SE_AF0EM8_GRVW2_GSU3_SU32_SUS128_SRVW0_WG16_4_1_WGM1
    SolutionIndex: 289
    SolutionNameMin: Cijk_Ailk_Bjlk_BBH_MT128x256x16_MI32x32x4x1_SE_AF0EM8_GRVW4_GSU1_SU32_SUS128_SRVW4_WG64_4_1_WGM2
    SolutionIndex: 290
    SolutionNameMin: Cijk_Ailk_Bjlk_BBH_MT64x64x32_MI32x32x4x1_SE_AF0EM8_GRVW8_GSU1_SU0_SUS256_SRVW4_WG64_4_1_WGM2
    SolutionIndex: 291
    SolutionNameMin: Cijk_Ailk_Bjlk_BBH_MT16x16x64_MI16x16x8x1_SE_AF0EM8_GRVW2_GSU3_SU0_SUS256_SRVW0_WG16_4_1_WGM1
    SolutionIndex: 292
    SolutionNameMin: Cijk_Ailk_Bjlk_BBH_MT64x64x16_MI32x32x4x1_SE_AF0EM8_GRVW4_GSU1_SU0_SUS256_SRVW4_WG64_4_1_WGM2
    SolutionIndex: 293
    SolutionNameMin: Cijk_Ailk_Bjlk_BBH_MT64x64x64_MI32x32x4x1_SE_AF0EM8_GRVW4_GSU1_SU32_SUS256_SRVW4_WG64_4_1_WGM2
    SolutionIndex: 294
    SolutionNameMin: Cijk_Ailk_Bjlk_BBH_MT128x256x16_MI32x32x4x1_SE_AF0EM8_GRVW4_GSU1_SU32_SUS128_SRVW4_WG64_4_1_WGM2
    SolutionIndex: 295
    SolutionNameMin: Cijk_Ailk_Bjlk_BBH_MT64x64x64_MI32x32x4x1_SE_AF0EM8_GRVW8_GSU15_SU0_SUS256_SRVW0_WG64_4_1_WGM1
    SolutionIndex: 296
    SolutionNameMin: Cijk_Ailk_Bjlk_BBH_MT128x128x16_MI32x32x4x1_SE_AF0EM8_GRVW4_GSU1_SU32_SUS128_SRVW4_WG64_4_1_WGM1
    SolutionIndex: 297
    SolutionNameMin: Cijk_Ailk_Bjlk_BBH_MT128x128x32_MI32x32x4x1_SE_AF0EM8_GRVW8_GSU15_SU0_SUS256_SRVW0_WG64_4_1_WGM15
    SolutionIndex: 298
    SolutionNameMin: Cijk_Ailk_Bjlk_BBH_MT256x128x16_MI32x32x4x1_SE_AF0EM8_GRVW8_GSU7_SU0_SUS256_SRVW0_WG64_4_1_WGM15
    SolutionIndex: 299
    SolutionNameMin: Cijk_Ailk_Bjlk_BBH_MT256x128x16_MI32x32x4x1_SE_AF0EM8_GRVW8_GSU7_SU32_SUS256_SRVW0_WG64_4_1_WGM15
    SolutionIndex: 300
    SolutionNameMin: Cijk_Ailk_Bjlk_BBH_MT64x128x16_MI32x32x4x1_SE_AF0EM8_GRVW2_GSU1_SU32_SUS128_SRVW4_WG64_4_1_WGM1
    SolutionIndex: 301
    SolutionNameMin: Cijk_Ailk_Bjlk_BBH_MT64x64x32_MI32x32x4x1_SE_AF0EM8_GRVW4_GSU1_SU0_SUS256_SRVW4_WG64_4_1_WGM1
    SolutionIndex: 302
    SolutionNameMin: Cijk_Ailk_Bjlk_BBH_MT16x16x32_MI16x16x8x1_SE_AF0EM8_GRVW2_GSU1_SU0_SUS256_SRVW0_WG16_4_1_WGM1
    SolutionIndex: 303
    SolutionNameMin: Cijk_Ailk_Bjlk_BBH_MT64x64x64_MI32x32x4x1_SE_AF0EM8_GRVW8_GSU1_SU32_SUS128_SRVW4_WG64_4_1_WGM1
    SolutionIndex: 304
    SolutionNameMin: Cijk_Ailk_Bjlk_BBH_MT128x160x32_MI32x32x4x1_SE_AF0EM8_GRVW2_GSU2_SU32_SUS128_SRVW0_WG128_2_1_WGM2
    SolutionIndex: 305
    SolutionNameMin: Cijk_Ailk_Bjlk_BBH_MT128x160x32_MI32x32x4x1_SE_AF0EM8_GRVW2_GSU2_SU32_SUS256_SRVW0_WG128_2_1_WGM15
    SolutionIndex: 306
    SolutionNameMin: Cijk_Ailk_Bjlk_BBH_MT160x128x32_MI32x32x4x1_SE_AF0EM8_GRVW2_GSU2_SU32_SUS256_SRVW0_WG32_8_1_WGM15
    SolutionIndex: 307
    SolutionNameMin: Cijk_Ailk_Bjlk_BBH_MT128x160x32_MI32x32x4x1_SE_AF0EM8_GRVW2_GSU2_SU32_SUS256_SRVW0_WG128_2_1_WGM2
    SolutionIndex: 308
    SolutionNameMin: Cijk_Ailk_Bjlk_BBH_MT128x160x32_MI32x32x4x1_SE_AF0EM8_GRVW2_GSU2_SU0_SUS256_SRVW0_WG128_2_1_WGM1
    SolutionIndex: 309
    SolutionNameMin: Cijk_Ailk_Bjlk_BBH_MT160x128x32_MI32x32x4x1_SE_AF0EM8_GRVW2_GSU2_SU0_SUS256_SRVW0_WG32_8_1_WGM15
    SolutionIndex: 310
    SolutionNameMin: Cijk_Ailk_Bjlk_BBH_MT32x64x16_MI16x16x8x1_SE_AF0EM8_GRVW2_GSU1_SU32_SUS256_SRVW4_WG32_8_1_WGM2
    SolutionIndex: 311
    SolutionNameMin: Cijk_Ailk_Bjlk_BBH_MT16x16x16_MI16x16x8x1_SE_AF0EM8_GRVW2_GSU1_SU0_SUS256_SRVW0_WG16_4_1_WGM1
    SolutionIndex: 312
    SolutionNameMin: Cijk_Ailk_Bjlk_BBH_MT64x32x16_MI16x16x8x1_SE_AF0EM8_GRVW2_GSU1_SU32_SUS128_SRVW4_WG32_8_1_WGM2
    SolutionIndex: 313
    SolutionNameMin: Cijk_Ailk_Bjlk_BBH_MT64x64x16_MI32x32x4x1_SE_AF0EM8_GRVW2_GSU1_SU32_SUS128_SRVW4_WG64_4_1_WGM15
    SolutionIndex: 314
    SolutionNameMin: Cijk_Ailk_Bjlk_BBH_MT32x32x64_MI16x16x8x1_SE_AF0EM8_GRVW2_GSU1_SU32_SUS128_SRVW4_WG32_8_1_WGM2
    SolutionIndex: 315
    SolutionNameMin: Cijk_Ailk_Bjlk_BBH_MT32x32x64_MI16x16x8x1_SE_AF0EM8_GRVW8_GSU1_SU0_SUS256_SRVW4_WG32_8_1_WGM2
    SolutionIndex: 316
    SolutionNameMin: Cijk_Ailk_Bjlk_BBH_MT64x64x16_MI32x32x4x1_SE_AF0EM8_GRVW4_GSU1_SU32_SUS128_SRVW4_WG64_4_1_WGM2
    SolutionIndex: 317
    SolutionNameMin: Cijk_Ailk_Bjlk_BBH_MT128x64x32_MI32x32x4x1_SE_AF0EM8_GRVW8_GSU1_SU32_SUS256_SRVW4_WG64_4_1_WGM2
    SolutionIndex: 318
    SolutionNameMin: Cijk_Ailk_Bjlk_BBH_MT32x32x64_MI16x16x8x1_SE_AF0EM8_GRVW8_GSU5_SU32_SUS256_SRVW0_WG32_8_1_WGM1
    SolutionIndex: 319
    SolutionNameMin: Cijk_Ailk_Bjlk_BBH_MT64x64x16_MI32x32x4x1_SE_AF0EM8_GRVW2_GSU1_SU32_SUS128_SRVW4_WG64_4_1_WGM1
    SolutionIndex: 320
    SolutionNameMin: Cijk_Ailk_Bjlk_BBH_MT64x64x32_MI32x32x4x1_SE_AF0EM8_GRVW8_GSU3_SU0_SUS256_SRVW0_WG64_4_1_WGM15
    SolutionIndex: 321
    SolutionNameMin: Cijk_Ailk_Bjlk_BBH_MT64x128x64_MI32x32x4x1_SE_AF0EM8_GRVW4_GSU3_SU0_SUS256_SRVW0_WG64_4_1_WGM1
    SolutionIndex: 322
    SolutionNameMin: Cijk_Ailk_Bjlk_BBH_MT128x128x16_MI32x32x4x1_SE_AF0EM8_GRVW8_GSU3_SU0_SUS256_SRVW0_WG64_4_1_WGM2
    SolutionIndex: 323
    SolutionNameMin: Cijk_Ailk_Bjlk_BBH_MT128x96x32_MI32x32x4x1_SE_AF0EM8_GRVW4_GSU2_SU0_SUS256_SRVW0_WG128_2_1_WGM1
    SolutionIndex: 324
    SolutionNameMin: Cijk_Ailk_Bjlk_BBH_MT128x64x64_MI32x32x4x1_SE_AF0EM8_GRVW4_GSU1_SU0_SUS256_SRVW4_WG64_4_1_WGM15
    SolutionIndex: 325
    SolutionNameMin: Cijk_Ailk_Bjlk_BBH_MT64x128x64_MI32x32x4x1_SE_AF0EM8_GRVW4_GSU1_SU0_SUS256_SRVW4_WG64_4_1_WGM1
    SolutionIndex: 326
    SolutionNameMin: Cijk_Ailk_Bjlk_BBH_MT64x128x64_MI32x32x4x1_SE_AF0EM8_GRVW8_GSU1_SU0_SUS256_SRVW4_WG64_4_1_WGM15
    SolutionIndex: 327
    SolutionNameMin: Cijk_Ailk_Bjlk_BBH_MT128x144x32_MI16x16x8x1_SE_AF0EM8_GRVW2_GSU2_SU0_SUS256_SRVW0_WG64_4_1_WGM15
    SolutionIndex: 328
    SolutionNameMin: Cijk_Ailk_Bjlk_BBH_MT128x256x16_MI32x32x4x1_SE_AF0EM8_GRVW8_GSU3_SU0_SUS256_SRVW0_WG64_4_1_WGM2
    SolutionIndex: 329
    SolutionNameMin: Cijk_Ailk_Bjlk_BBH_MT128x256x16_MI32x32x4x1_SE_AF0EM8_GRVW8_GSU3_SU0_SUS256_SRVW0_WG64_4_1_WGM15
    SolutionIndex: 330
    SolutionNameMin: Cijk_Ailk_Bjlk_BBH_MT128x96x32_MI32x32x4x1_SE_AF0EM8_GRVW4_GSU1_SU0_SUS256_SRVW4_WG128_2_1_WGM2
    SolutionIndex: 331
    SolutionNameMin: Cijk_Ailk_Bjlk_BBH_MT256x160x16_MI32x32x4x1_SE_AF0EM8_GRVW2_GSU3_SU32_SUS128_SRVW0_WG128_2_1_WGM2
    SolutionIndex: 332
    SolutionNameMin: Cijk_Ailk_Bjlk_BBH_MT64x256x32_MI32x32x4x1_SE_AF0EM8_GRVW8_GSU1_SU0_SUS256_SRVW4_WG64_4_1_WGM15
    SolutionIndex: 333
    SolutionNameMin: Cijk_Ailk_Bjlk_BBH_MT128x144x32_MI16x16x8x1_SE_AF0EM8_GRVW2_GSU1_SU0_SUS256_SRVW4_WG64_4_1_WGM1
    SolutionIndex: 334
    SolutionNameMin: Cijk_Ailk_Bjlk_BBH_MT128x160x32_MI32x32x4x1_SE_AF0EM8_GRVW4_GSU1_SU0_SUS256_SRVW4_WG128_2_1_WGM1
    SolutionIndex: 335
    SolutionNameMin: Cijk_Ailk_Bjlk_BBH_MT64x64x64_MI32x32x4x1_SE_AF0EM8_GRVW8_GSU1_SU0_SUS256_SRVW4_WG64_4_1_WGM1
    SolutionIndex: 336
    SolutionNameMin: Cijk_Ailk_Bjlk_BBH_MT256x128x16_MI32x32x4x1_SE_AF0EM8_GRVW4_GSU1_SU0_SUS256_SRVW4_WG64_4_1_WGM15
    SolutionIndex: 337
    SolutionNameMin: Cijk_Ailk_Bjlk_BBH_MT128x256x16_MI32x32x4x1_SE_AF0EM8_GRVW4_GSU1_SU0_SUS256_SRVW4_WG64_4_1_WGM15
    SolutionIndex: 338
    SolutionNameMin: Cijk_Ailk_Bjlk_BBH_MT128x256x16_MI32x32x4x1_SE_AF0EM8_GRVW4_GSU1_SU0_SUS256_SRVW4_WG64_4_1_WGM2
    SolutionIndex: 339
    SolutionNameMin: Cijk_Ailk_Bjlk_BBH_MT256x160x32_MI32x32x4x1_SE_AF0EM8_GRVW4_GSU1_SU32_SUS128_SRVW4_WG128_2_1_WGM2
    SolutionIndex: 340
    SolutionNameMin: Cijk_Ailk_Bjlk_BBH_MT256x160x16_MI32x32x4x1_SE_AF0EM8_GRVW2_GSU1_SU32_SUS256_SRVW4_WG128_2_1_WGM2
    SolutionIndex: 341
    SolutionNameMin: Cijk_Ailk_Bjlk_BBH_MT128x64x32_MI32x32x4x1_SE_AF0EM8_GRVW8_GSU1_SU32_SUS128_SRVW4_WG64_4_1_WGM2
    SolutionIndex: 342
    SolutionNameMin: Cijk_Ailk_Bjlk_BBH_MT96x128x64_MI32x32x4x1_SE_AF0EM8_GRVW8_GSU3_SU0_SUS256_SRVW0_WG32_8_1_WGM1
    SolutionIndex: 343
    SolutionNameMin: Cijk_Ailk_Bjlk_BBH_MT32x32x32_MI16x16x8x1_SE_AF0EM8_GRVW8_GSU1_SU0_SUS256_SRVW4_WG32_8_1_WGM2
    SolutionIndex: 344
    SolutionNameMin: Cijk_Ailk_Bjlk_BBH_MT64x32x32_MI16x16x8x1_SE_AF0EM8_GRVW4_GSU1_SU0_SUS256_SRVW4_WG32_8_1_WGM15
    SolutionIndex: 345
    SolutionNameMin: Cijk_Ailk_Bjlk_BBH_MT32x32x64_MI16x16x8x1_SE_AF0EM8_GRVW8_GSU3_SU0_SUS256_SRVW0_WG32_8_1_WGM15
    SolutionIndex: 346
    SolutionNameMin: Cijk_Ailk_Bjlk_BBH_MT64x64x64_MI32x32x4x1_SE_AF0EM8_GRVW8_GSU1_SU32_SUS256_SRVW4_WG64_4_1_WGM1
    SolutionIndex: 347
    SolutionNameMin: Cijk_Ailk_Bjlk_BBH_MT64x64x32_MI32x32x4x1_SE_AF0EM8_GRVW8_GSU3_SU32_SUS128_SRVW0_WG64_4_1_WGM15
    SolutionIndex: 348
    SolutionNameMin: Cijk_Ailk_Bjlk_BBH_MT96x128x32_MI32x32x4x1_SE_AF0EM8_GRVW4_GSU5_SU32_SUS128_SRVW0_WG32_8_1_WGM1
    SolutionIndex: 349
    SolutionNameMin: Cijk_Ailk_Bjlk_BBH_MT64x128x64_MI32x32x4x1_SE_AF0EM8_GRVW8_GSU3_SU32_SUS256_SRVW0_WG64_4_1_WGM2
    SolutionIndex: 350
    SolutionNameMin: Cijk_Ailk_Bjlk_BBH_MT96x128x32_MI32x32x4x1_SE_AF0EM8_GRVW4_GSU5_SU32_SUS256_SRVW0_WG32_8_1_WGM2
    SolutionIndex: 351
    SolutionNameMin: Cijk_Ailk_Bjlk_BBH_MT96x128x32_MI32x32x4x1_SE_AF0EM8_GRVW4_GSU5_SU0_SUS256_SRVW0_WG32_8_1_WGM2
    SolutionIndex: 352
    SolutionNameMin: Cijk_Ailk_Bjlk_BBH_MT128x64x64_MI32x32x4x1_SE_AF0EM8_GRVW4_GSU3_SU0_SUS256_SRVW0_WG64_4_1_WGM15
    SolutionIndex: 353
    SolutionNameMin: Cijk_Ailk_Bjlk_BBH_MT96x128x32_MI32x32x4x1_SE_AF0EM8_GRVW4_GSU5_SU32_SUS256_SRVW0_WG32_8_1_WGM15
    SolutionIndex: 354
    SolutionNameMin: Cijk_Ailk_Bjlk_BBH_MT96x128x64_MI32x32x4x1_SE_AF0EM8_GRVW8_GSU5_SU0_SUS256_SRVW0_WG32_8_1_WGM15
    SolutionIndex: 355
    SolutionNameMin: Cijk_Ailk_Bjlk_BBH_MT96x128x32_MI32x32x4x1_SE_AF0EM8_GRVW4_GSU5_SU32_SUS256_SRVW0_WG32_8_1_WGM1
    SolutionIndex: 356
    SolutionNameMin: Cijk_Ailk_Bjlk_BBH_MT96x128x32_MI32x32x4x1_SE_AF0EM8_GRVW4_GSU5_SU32_SUS128_SRVW0_WG32_8_1_WGM2
    SolutionIndex: 357
    SolutionNameMin: Cijk_Ailk_Bjlk_BBH_MT96x128x64_MI32x32x4x1_SE_AF0EM8_GRVW8_GSU5_SU0_SUS256_SRVW0_WG32_8_1_WGM1
    SolutionIndex: 358
    SolutionNameMin: Cijk_Ailk_Bjlk_BBH_MT96x128x32_MI32x32x4x1_SE_AF0EM8_GRVW4_GSU5_SU0_SUS256_SRVW0_WG32_8_1_WGM1
    SolutionIndex: 359
    SolutionNameMin: Cijk_Ailk_Bjlk_BBH_MT128x128x16_MI32x32x4x1_SE_AF0EM8_GRVW8_GSU7_SU0_SUS256_SRVW0_WG64_4_1_WGM1
    SolutionIndex: 360
    SolutionNameMin: Cijk_Ailk_Bjlk_BBH_MT256x64x32_MI32x32x4x1_SE_AF0EM8_GRVW8_GSU7_SU0_SUS256_SRVW0_WG64_4_1_WGM15
    SolutionIndex: 361
    SolutionNameMin: Cijk_Ailk_Bjlk_BBH_MT256x64x32_MI32x32x4x1_SE_AF0EM8_GRVW8_GSU7_SU32_SUS256_SRVW0_WG64_4_1_WGM2
    SolutionIndex: 362
    SolutionNameMin: Cijk_Ailk_Bjlk_BBH_MT256x64x32_MI32x32x4x1_SE_AF0EM8_GRVW4_GSU7_SU0_SUS256_SRVW0_WG64_4_1_WGM1
    SolutionIndex: 363
    SolutionNameMin: Cijk_Ailk_Bjlk_BBH_MT256x64x32_MI32x32x4x1_SE_AF0EM8_GRVW8_GSU7_SU0_SUS256_SRVW0_WG64_4_1_WGM2
    SolutionIndex: 364
    SolutionNameMin: Cijk_Ailk_Bjlk_BBH_MT256x64x32_MI32x32x4x1_SE_AF0EM8_GRVW8_GSU7_SU32_SUS256_SRVW0_WG64_4_1_WGM15
    SolutionIndex: 365
    SolutionNameMin: Cijk_Ailk_Bjlk_BBH_MT256x64x32_MI32x32x4x1_SE_AF0EM8_GRVW8_GSU7_SU0_SUS256_SRVW0_WG64_4_1_WGM1
    SolutionIndex: 366
    SolutionNameMin: Cijk_Ailk_Bjlk_BBH_MT256x64x32_MI32x32x4x1_SE_AF0EM8_GRVW8_GSU7_SU32_SUS128_SRVW0_WG64_4_1_WGM15
    SolutionIndex: 367
    SolutionNameMin: Cijk_Ailk_Bjlk_BBH_MT64x256x32_MI32x32x4x1_SE_AF0EM8_GRVW8_GSU7_SU0_SUS256_SRVW0_WG64_4_1_WGM1
    SolutionIndex: 368
    SolutionNameMin: Cijk_Ailk_Bjlk_BBH_MT64x64x64_MI32x32x4x1_SE_AF0EM8_GRVW4_GSU1_SU32_SUS128_SRVW4_WG64_4_1_WGM2
    SolutionIndex: 369
    SolutionNameMin: Cijk_Ailk_Bjlk_BBH_MT128x64x32_MI32x32x4x1_SE_AF0EM8_GRVW8_GSU1_SU32_SUS256_SRVW4_WG64_4_1_WGM1
    SolutionIndex: 370
    SolutionNameMin: Cijk_Ailk_Bjlk_BBH_MT64x64x16_MI32x32x4x1_SE_AF0EM8_GRVW4_GSU1_SU0_SUS256_SRVW4_WG64_4_1_WGM15
    SolutionIndex: 371
    SolutionNameMin: Cijk_Ailk_Bjlk_BBH_MT128x128x16_MI32x32x4x1_SE_AF0EM8_GRVW8_GSU1_SU32_SUS128_SRVW4_WG64_4_1_WGM15
    SolutionIndex: 372
    SolutionNameMin: Cijk_Ailk_Bjlk_BBH_MT128x128x16_MI32x32x4x1_SE_AF0EM8_GRVW2_GSU1_SU32_SUS256_SRVW4_WG64_4_1_WGM1
    SolutionIndex: 373
    SolutionNameMin: Cijk_Ailk_Bjlk_BBH_MT128x128x16_MI32x32x4x1_SE_AF0EM8_GRVW8_GSU1_SU32_SUS256_SRVW4_WG64_4_1_WGM2
    SolutionIndex: 374
    SolutionNameMin: Cijk_Ailk_Bjlk_BBH_MT96x96x64_MI16x16x8x1_SE_AF0EM8_GRVW2_GSU1_SU0_SUS256_SRVW0_WG32_8_1_WGM1
    SolutionIndex: 375
    SolutionNameMin: Cijk_Ailk_Bjlk_BBH_MT128x64x32_MI32x32x4x1_SE_AF0EM8_GRVW8_GSU1_SU0_SUS256_SRVW4_WG64_4_1_WGM15
    SolutionIndex: 376
    SolutionNameMin: Cijk_Ailk_Bjlk_BBH_MT64x128x32_MI32x32x4x1_SE_AF0EM8_GRVW8_GSU1_SU32_SUS128_SRVW4_WG64_4_1_WGM2
    SolutionIndex: 377
    SolutionNameMin: Cijk_Ailk_Bjlk_BBH_MT96x96x32_MI16x16x8x1_SE_AF0EM8_GRVW2_GSU1_SU0_SUS256_SRVW0_WG32_8_1_WGM2
    SolutionIndex: 378
    SolutionNameMin: Cijk_Ailk_Bjlk_BBH_MT96x96x32_MI16x16x8x1_SE_AF0EM8_GRVW2_GSU1_SU0_SUS256_SRVW0_WG32_8_1_WGM1
    SolutionIndex: 379
    SolutionNameMin: Cijk_Ailk_Bjlk_BBH_MT128x64x32_MI32x32x4x1_SE_AF0EM8_GRVW8_GSU1_SU0_SUS256_SRVW4_WG64_4_1_WGM2
    SolutionIndex: 380
    SolutionNameMin: Cijk_Ailk_Bjlk_BBH_MT64x128x32_MI32x32x4x1_SE_AF0EM8_GRVW8_GSU1_SU0_SUS256_SRVW4_WG64_4_1_WGM1
    SolutionIndex: 381
    SolutionNameMin: Cijk_Ailk_Bjlk_BBH_MT256x160x16_MI32x32x4x1_SE_AF0EM8_GRVW2_GSU1_SU32_SUS128_SRVW4_WG128_2_1_WGM15
    SolutionIndex: 382
    SolutionNameMin: Cijk_Ailk_Bjlk_BBH_MT128x256x16_MI32x32x4x1_SE_AF0EM8_GRVW4_GSU1_SU32_SUS256_SRVW4_WG64_4_1_WGM15
    SolutionIndex: 383
    SolutionNameMin: Cijk_Ailk_Bjlk_BBH_MT256x64x32_MI32x32x4x1_SE_AF0EM8_GRVW4_GSU1_SU0_SUS256_SRVW4_WG64_4_1_WGM1
    SolutionIndex: 384
    SolutionNameMin: Cijk_Ailk_Bjlk_BBH_MT128x160x32_MI32x32x4x1_SE_AF0EM8_GRVW2_GSU1_SU0_SUS256_SRVW4_WG128_2_1_WGM1
    SolutionIndex: 385
    SolutionNameMin: Cijk_Ailk_Bjlk_BBH_MT128x96x32_MI32x32x4x1_SE_AF0EM8_GRVW4_GSU1_SU0_SUS256_SRVW4_WG128_2_1_WGM15
    SolutionIndex: 386
    SolutionNameMin: Cijk_Ailk_Bjlk_BBH_MT96x96x32_MI16x16x8x1_SE_AF0EM8_GRVW4_GSU1_SU0_SUS256_SRVW0_WG32_8_1_WGM1
    SolutionIndex: 387
    SolutionNameMin: Cijk_Ailk_Bjlk_BBH_MT128x160x32_MI32x32x4x1_SE_AF0EM8_GRVW2_GSU1_SU0_SUS256_SRVW4_WG128_2_1_WGM15
    SolutionIndex: 388
    SolutionNameMin: Cijk_Ailk_Bjlk_BBH_MT96x128x32_MI32x32x4x1_SE_AF0EM8_GRVW4_GSU1_SU32_SUS256_SRVW0_WG32_8_1_WGM1
    SolutionIndex: 389
    SolutionNameMin: Cijk_Ailk_Bjlk_BBH_MT256x128x16_MI32x32x4x1_SE_AF0EM8_GRVW8_GSU7_SU32_SUS128_SRVW0_WG64_4_1_WGM15
    SolutionIndex: 390
    SolutionNameMin: Cijk_Ailk_Bjlk_BBH_MT64x128x32_MI32x32x4x1_SE_AF0EM8_GRVW8_GSU1_SU32_SUS128_SRVW4_WG64_4_1_WGM15
    SolutionIndex: 391
    SolutionNameMin: Cijk_Ailk_Bjlk_BBH_MT64x128x32_MI32x32x4x1_SE_AF0EM8_GRVW8_GSU1_SU32_SUS256_SRVW4_WG64_4_1_WGM1
    SolutionIndex: 392
    SolutionNameMin: Cijk_Ailk_Bjlk_BBH_MT128x64x32_MI32x32x4x1_SE_AF0EM8_GRVW8_GSU1_SU0_SUS256_SRVW4_WG64_4_1_WGM1
    SolutionIndex: 393
    SolutionNameMin: Cijk_Ailk_Bjlk_BBH_MT64x16x32_MI16x16x8x1_SE_AF0EM8_GRVW2_GSU1_SU0_SUS256_SRVW0_WG64_4_1_WGM1
    SolutionIndex: 394
    SolutionNameMin: Cijk_Ailk_Bjlk_BBH_MT64x64x32_MI32x32x4x1_SE_AF0EM8_GRVW8_GSU1_SU32_SUS128_SRVW4_WG64_4_1_WGM2
    SolutionIndex: 395
    SolutionNameMin: Cijk_Ailk_Bjlk_BBH_MT64x128x16_MI32x32x4x1_SE_AF0EM8_GRVW2_GSU1_SU0_SUS256_SRVW4_WG64_4_1_WGM2
    SolutionIndex: 396
    SolutionNameMin: Cijk_Ailk_Bjlk_BBH_MT128x64x16_MI32x32x4x1_SE_AF0EM8_GRVW2_GSU1_SU0_SUS256_SRVW4_WG64_4_1_WGM2
    SolutionIndex: 397
    SolutionNameMin: Cijk_Ailk_Bjlk_BBH_MT128x128x16_MI32x32x4x1_SE_AF0EM8_GRVW8_GSU3_SU0_SUS256_SRVW0_WG64_4_1_WGM1
    SolutionIndex: 398
    SolutionNameMin: Cijk_Ailk_Bjlk_BBH_MT96x128x32_MI32x32x4x1_SE_AF0EM8_GRVW4_GSU5_SU0_SUS256_SRVW0_WG32_8_1_WGM15
    SolutionIndex: 399
    SolutionNameMin: Cijk_Ailk_Bjlk_BBH_MT64x32x64_MI16x16x8x1_SE_AF0EM8_GRVW8_GSU7_SU32_SUS256_SRVW0_WG32_8_1_WGM15
    SolutionIndex: 400
    SolutionNameMin: Cijk_Ailk_Bjlk_BBH_MT32x64x64_MI16x16x8x1_SE_AF0EM8_GRVW8_GSU7_SU32_SUS128_SRVW0_WG32_8_1_WGM2
    SolutionIndex: 401
    SolutionNameMin: Cijk_Ailk_Bjlk_BBH_MT64x64x64_MI32x32x4x1_SE_AF0EM8_GRVW8_GSU15_SU32_SUS128_SRVW0_WG64_4_1_WGM1
    SolutionIndex: 402
    SolutionNameMin: Cijk_Ailk_Bjlk_BBH_MT64x64x64_MI32x32x4x1_SE_AF0EM8_GRVW8_GSU15_SU0_SUS256_SRVW0_WG64_4_1_WGM2
    SolutionIndex: 403
    SolutionNameMin: Cijk_Ailk_Bjlk_BBH_MT32x32x32_MI16x16x8x1_SE_AF0EM8_GRVW8_GSU3_SU0_SUS256_SRVW0_WG32_8_1_WGM2
    SolutionIndex: 404
    SolutionNameMin: Cijk_Ailk_Bjlk_BBH_MT64x32x16_MI16x16x8x1_SE_AF0EM8_GRVW8_GSU1_SU0_SUS256_SRVW4_WG32_8_1_WGM1
    SolutionIndex: 405
    SolutionNameMin: Cijk_Ailk_Bjlk_BBH_MT64x32x16_MI16x16x8x1_SE_AF0EM8_GRVW4_GSU1_SU0_SUS256_SRVW4_WG32_8_1_WGM1
    SolutionIndex: 406
    SolutionNameMin: Cijk_Ailk_Bjlk_BBH_MT64x64x16_MI32x32x4x1_SE_AF0EM8_GRVW2_GSU1_SU32_SUS128_SRVW4_WG64_4_1_WGM2
    SolutionIndex: 407
    SolutionNameMin: Cijk_Ailk_Bjlk_BBH_MT32x32x16_MI16x16x8x1_SE_AF0EM8_GRVW2_GSU1_SU32_SUS256_SRVW4_WG32_8_1_WGM1
    SolutionIndex: 408
    SolutionNameMin: Cijk_Ailk_Bjlk_BBH_MT96x128x32_MI32x32x4x1_SE_AF0EM8_GRVW4_GSU3_SU0_SUS256_SRVW0_WG32_8_1_WGM1
    SolutionIndex: 409
    SolutionNameMin: Cijk_Ailk_Bjlk_BBH_MT32x64x32_MI16x16x8x1_SE_AF0EM8_GRVW8_GSU1_SU32_SUS256_SRVW4_WG32_8_1_WGM15
    SolutionIndex: 410
    SolutionNameMin: Cijk_Ailk_Bjlk_BBH_MT128x64x64_MI32x32x4x1_SE_AF0EM8_GRVW4_GSU7_SU0_SUS256_SRVW0_WG64_4_1_WGM2
    SolutionIndex: 411
    SolutionNameMin: Cijk_Ailk_Bjlk_BBH_MT64x128x32_MI32x32x4x1_SE_AF0EM8_GRVW8_GSU7_SU32_SUS256_SRVW0_WG64_4_1_WGM2
    SolutionIndex: 412
    SolutionNameMin: Cijk_Ailk_Bjlk_BBH_MT256x64x32_MI32x32x4x1_SE_AF0EM8_GRVW8_GSU15_SU32_SUS256_SRVW0_WG64_4_1_WGM1
    SolutionIndex: 413
    SolutionNameMin: Cijk_Ailk_Bjlk_BBH_MT128x64x64_MI32x32x4x1_SE_AF0EM8_GRVW8_GSU7_SU0_SUS256_SRVW0_WG64_4_1_WGM15
    SolutionIndex: 414
    SolutionNameMin: Cijk_Ailk_Bjlk_BBH_MT64x32x32_MI16x16x8x1_SE_AF0EM8_GRVW8_GSU3_SU32_SUS256_SRVW0_WG32_8_1_WGM1
    SolutionIndex: 415
    SolutionNameMin: Cijk_Ailk_Bjlk_BBH_MT128x128x16_MI32x32x4x1_SE_AF0EM8_GRVW8_GSU1_SU32_SUS128_SRVW4_WG64_4_1_WGM2
    SolutionIndex: 416
    SolutionNameMin: Cijk_Ailk_Bjlk_BBH_MT16x16x16_MI16x16x8x1_SE_AF0EM8_GRVW2_GSU1_SU32_SUS128_SRVW0_WG16_4_1_WGM1
    SolutionIndex: 417
    SolutionNameMin: Cijk_Ailk_Bjlk_BBH_MT64x64x16_MI32x32x4x1_SE_AF0EM8_GRVW8_GSU1_SU0_SUS256_SRVW4_WG64_4_1_WGM2
    SolutionIndex: 418
    SolutionNameMin: Cijk_Ailk_Bjlk_BBH_MT128x64x16_MI32x32x4x1_SE_AF0EM8_GRVW2_GSU1_SU32_SUS256_SRVW4_WG64_4_1_WGM1
    SolutionIndex: 419
    SolutionNameMin: Cijk_Ailk_Bjlk_BBH_MT128x64x16_MI32x32x4x1_SE_AF0EM8_GRVW4_GSU1_SU32_SUS256_SRVW4_WG64_4_1_WGM1
    SolutionIndex: 420
    SolutionNameMin: Cijk_Ailk_Bjlk_BBH_MT128x128x16_MI32x32x4x1_SE_AF0EM8_GRVW2_GSU1_SU32_SUS256_SRVW4_WG64_4_1_WGM15
    SolutionIndex: 421
    SolutionNameMin: Cijk_Ailk_Bjlk_BBH_MT128x64x16_MI32x32x4x1_SE_AF0EM8_GRVW8_GSU1_SU0_SUS256_SRVW4_WG64_4_1_WGM1
    SolutionIndex: 422
    SolutionNameMin: Cijk_Ailk_Bjlk_BBH_MT128x128x16_MI32x32x4x1_SE_AF0EM8_GRVW8_GSU1_SU0_SUS256_SRVW4_WG64_4_1_WGM1
    SolutionIndex: 423
    SolutionNameMin: Cijk_Ailk_Bjlk_BBH_MT64x256x16_MI32x32x4x1_SE_AF0EM8_GRVW8_GSU1_SU0_SUS256_SRVW4_WG64_4_1_WGM15
    SolutionIndex: 424
    SolutionNameMin: Cijk_Ailk_Bjlk_BBH_MT128x128x16_MI32x32x4x1_SE_AF0EM8_GRVW8_GSU1_SU32_SUS128_SRVW4_WG64_4_1_WGM15
    SolutionIndex: 425
    SolutionNameMin: Cijk_Ailk_Bjlk_BBH_MT128x128x16_MI32x32x4x1_SE_AF0EM8_GRVW8_GSU1_SU32_SUS256_SRVW4_WG64_4_1_WGM15
    SolutionIndex: 426
    SolutionNameMin: Cijk_Ailk_Bjlk_BBH_MT64x128x16_MI32x32x4x1_SE_AF0EM8_GRVW8_GSU1_SU32_SUS256_SRVW4_WG64_4_1_WGM1
    SolutionIndex: 427
    SolutionNameMin: Cijk_Ailk_Bjlk_BBH_MT64x128x16_MI32x32x4x1_SE_AF0EM8_GRVW8_GSU1_SU32_SUS128_SRVW4_WG64_4_1_WGM15
    SolutionIndex: 428
    SolutionNameMin: Cijk_Ailk_Bjlk_BBH_MT128x128x16_MI32x32x4x1_SE_AF0EM8_GRVW8_GSU1_SU0_SUS256_SRVW4_WG64_4_1_WGM15
    SolutionIndex: 429
    SolutionNameMin: Cijk_Ailk_Bjlk_BBH_MT64x128x16_MI32x32x4x1_SE_AF0EM8_GRVW8_GSU1_SU0_SUS256_SRVW4_WG64_4_1_WGM1
    SolutionIndex: 430
    SolutionNameMin: Cijk_Ailk_Bjlk_BBH_MT128x128x16_MI32x32x4x1_SE_AF0EM8_GRVW8_GSU1_SU32_SUS256_SRVW4_WG64_4_1_WGM2
    SolutionIndex: 431
    SolutionNameMin: Cijk_Ailk_Bjlk_BBH_MT128x128x16_MI32x32x4x1_SE_AF0EM8_GRVW8_GSU1_SU32_SUS128_SRVW4_WG64_4_1_WGM2
    SolutionIndex: 432
    SolutionNameMin: Cijk_Ailk_Bjlk_BBH_MT64x64x32_MI32x32x4x1_SE_AF0EM8_GRVW8_GSU1_SU32_SUS256_SRVW4_WG64_4_1_WGM1
    SolutionIndex: 433
    SolutionNameMin: Cijk_Ailk_Bjlk_BBH_MT64x128x32_MI32x32x4x1_SE_AF0EM8_GRVW8_GSU1_SU0_SUS256_SRVW4_WG64_4_1_WGM2
    SolutionIndex: 434
    SolutionNameMin: Cijk_Ailk_Bjlk_BBH_MT128x128x16_MI32x32x4x1_SE_AF0EM8_GRVW8_GSU1_SU0_SUS256_SRVW4_WG64_4_1_WGM1
    SolutionIndex: 435
    SolutionNameMin: Cijk_Ailk_Bjlk_BBH_MT64x128x16_MI32x32x4x1_SE_AF0EM8_GRVW8_GSU1_SU0_SUS256_SRVW4_WG64_4_1_WGM15
    SolutionIndex: 436
    SolutionNameMin: Cijk_Ailk_Bjlk_BBH_MT64x256x16_MI32x32x4x1_SE_AF0EM8_GRVW8_GSU1_SU32_SUS256_SRVW4_WG64_4_1_WGM1
    SolutionIndex: 437
    SolutionNameMin: Cijk_Ailk_Bjlk_BBH_MT64x128x16_MI32x32x4x1_SE_AF0EM8_GRVW8_GSU1_SU32_SUS256_SRVW4_WG64_4_1_WGM15
    SolutionIndex: 438
    SolutionNameMin: Cijk_Ailk_Bjlk_BBH_MT64x128x16_MI32x32x4x1_SE_AF0EM8_GRVW4_GSU1_SU32_SUS256_SRVW4_WG64_4_1_WGM1
    SolutionIndex: 439
    SolutionNameMin: Cijk_Ailk_Bjlk_BBH_MT64x128x32_MI32x32x4x1_SE_AF0EM8_GRVW8_GSU1_SU32_SUS256_SRVW4_WG64_4_1_WGM2
    SolutionIndex: 440
    SolutionNameMin: Cijk_Ailk_Bjlk_BBH_MT128x96x32_MI32x32x4x1_SE_AF0EM8_GRVW4_GSU1_SU32_SUS256_SRVW4_WG128_2_1_WGM15
    SolutionIndex: 441
    SolutionNameMin: Cijk_Ailk_Bjlk_BBH_MT160x128x32_MI32x32x4x1_SE_AF0EM8_GRVW2_GSU2_SU32_SUS256_SRVW0_WG32_8_1_WGM1
    SolutionIndex: 442
    SolutionNameMin: Cijk_Ailk_Bjlk_BBH_MT128x96x32_MI32x32x4x1_SE_AF0EM8_GRVW4_GSU1_SU32_SUS128_SRVW4_WG128_2_1_WGM2
    SolutionIndex: 443
    SolutionNameMin: Cijk_Ailk_Bjlk_BBH_MT128x144x32_MI16x16x8x1_SE_AF0EM8_GRVW2_GSU1_SU0_SUS256_SRVW4_WG64_4_1_WGM15
    SolutionIndex: 444
    SolutionNameMin: Cijk_Ailk_Bjlk_BBH_MT128x144x32_MI16x16x8x1_SE_AF0EM8_GRVW2_GSU1_SU0_SUS256_SRVW4_WG64_4_1_WGM2
    SolutionIndex: 445
    SolutionNameMin: Cijk_Ailk_Bjlk_BBH_MT64x32x16_MI16x16x8x1_SE_AF0EM8_GRVW2_GSU1_SU32_SUS256_SRVW4_WG32_8_1_WGM2
    SolutionIndex: 446
    SolutionNameMin: Cijk_Ailk_Bjlk_BBH_MT64x128x64_MI32x32x4x1_SE_AF0EM8_GRVW8_GSU1_SU32_SUS128_SRVW4_WG64_4_1_WGM15
    SolutionIndex: 447
    SolutionNameMin: Cijk_Ailk_Bjlk_BBH_MT128x256x16_MI32x32x4x1_SE_AF0EM8_GRVW8_GSU1_SU32_SUS256_SRVW4_WG64_4_1_WGM2
    SolutionIndex: 448
    SolutionNameMin: Cijk_Ailk_Bjlk_BBH_MT128x64x16_MI32x32x4x1_SE_AF0EM8_GRVW8_GSU1_SU0_SUS256_SRVW4_WG64_4_1_WGM15
    SolutionIndex: 449
    SolutionNameMin: Cijk_Ailk_Bjlk_BBH_MT128x64x16_MI32x32x4x1_SE_AF0EM8_GRVW8_GSU1_SU0_SUS256_SRVW4_WG64_4_1_WGM2
    SolutionIndex: 450
    SolutionNameMin: Cijk_Ailk_Bjlk_BBH_MT64x128x16_MI32x32x4x1_SE_AF0EM8_GRVW8_GSU1_SU0_SUS256_SRVW4_WG64_4_1_WGM2
    SolutionIndex: 451
    SolutionNameMin: Cijk_Ailk_Bjlk_BBH_MT128x256x16_MI32x32x4x1_SE_AF0EM8_GRVW8_GSU1_SU32_SUS128_SRVW4_WG64_4_1_WGM15
    SolutionIndex: 452
    SolutionNameMin: Cijk_Ailk_Bjlk_BBH_MT64x128x16_MI32x32x4x1_SE_AF0EM8_GRVW2_GSU1_SU32_SUS128_SRVW4_WG64_4_1_WGM2
    SolutionIndex: 453
    SolutionNameMin: Cijk_Ailk_Bjlk_BBH_MT64x64x32_MI32x32x4x1_SE_AF0EM8_GRVW8_GSU1_SU32_SUS128_SRVW4_WG64_4_1_WGM15
    SolutionIndex: 454
    SolutionNameMin: Cijk_Ailk_Bjlk_BBH_MT64x16x32_MI16x16x8x1_SE_AF0EM8_GRVW8_GSU1_SU0_SUS256_SRVW0_WG64_4_1_WGM15
    SolutionIndex: 455
    SolutionNameMin: Cijk_Ailk_Bjlk_BBH_MT128x64x16_MI32x32x4x1_SE_AF0EM8_GRVW2_GSU1_SU0_SUS256_SRVW4_WG64_4_1_WGM1
    SolutionIndex: 456
    SolutionNameMin: Cijk_Ailk_Bjlk_BBH_MT128x128x32_MI32x32x4x1_SE_AF0EM8_GRVW8_GSU1_SU32_SUS128_SRVW4_WG64_4_1_WGM15
    SolutionIndex: 457
    SolutionNameMin: Cijk_Ailk_Bjlk_BBH_MT128x96x64_MI32x32x4x1_SE_AF0EM8_GRVW8_GSU1_SU32_SUS128_SRVW4_WG128_2_1_WGM15
    SolutionIndex: 458
    SolutionNameMin: Cijk_Ailk_Bjlk_BBH_MT64x16x32_MI16x16x8x1_SE_AF0EM8_GRVW4_GSU1_SU0_SUS256_SRVW0_WG64_4_1_WGM1
    SolutionIndex: 459
    SolutionNameMin: Cijk_Ailk_Bjlk_BBH_MT64x128x16_MI32x32x4x1_SE_AF0EM8_GRVW8_GSU1_SU32_SUS128_SRVW4_WG64_4_1_WGM1
    SolutionIndex: 460
    SolutionNameMin: Cijk_Ailk_Bjlk_BBH_MT128x64x16_MI32x32x4x1_SE_AF0EM8_GRVW8_GSU1_SU32_SUS128_SRVW4_WG64_4_1_WGM1
    SolutionIndex: 461
    SolutionNameMin: Cijk_Ailk_Bjlk_BBH_MT32x32x64_MI16x16x8x1_SE_AF0EM8_GRVW2_GSU5_SU0_SUS256_SRVW0_WG32_8_1_WGM1
    SolutionIndex: 462
    SolutionNameMin: Cijk_Ailk_Bjlk_BBH_MT128x160x32_MI32x32x4x1_SE_AF0EM8_GRVW4_GSU1_SU0_SUS256_SRVW4_WG128_2_1_WGM15
    SolutionIndex: 463
    SolutionNameMin: Cijk_Ailk_Bjlk_BBH_MT64x64x64_MI32x32x4x1_SE_AF0EM8_GRVW8_GSU1_SU0_SUS256_SRVW4_WG64_4_1_WGM15
    SolutionIndex: 464
    SolutionNameMin: Cijk_Ailk_Bjlk_BBH_MT64x16x64_MI16x16x8x1_SE_AF0EM1_GRVW2_GSU15_SU0_SUS256_SRVW0_WG64_4_1_WGM1
    SolutionIndex: 465
    SolutionNameMin: Cijk_Ailk_Bjlk_BBH_MT128x160x32_MI32x32x4x1_SE_AF0EM8_GRVW2_GSU1_SU0_SUS256_SRVW4_WG128_2_1_WGM2
    SolutionIndex: 466
    SolutionNameMin: Cijk_Ailk_Bjlk_BBH_MT64x256x32_MI32x32x4x1_SE_AF0EM8_GRVW8_GSU3_SU0_SUS256_SRVW0_WG64_4_1_WGM1
    SolutionIndex: 467
    SolutionNameMin: Cijk_Ailk_Bjlk_BBH_MT64x64x16_MI32x32x4x1_SE_AF0EM8_GRVW8_GSU1_SU0_SUS256_SRVW4_WG64_4_1_WGM1
    SolutionIndex: 468
    SolutionNameMin: Cijk_Ailk_Bjlk_BBH_MT64x128x32_MI32x32x4x1_SE_AF0EM8_GRVW4_GSU1_SU32_SUS128_SRVW4_WG64_4_1_WGM15
    SolutionIndex: 469
    SolutionNameMin: Cijk_Ailk_Bjlk_BBH_MT64x16x64_MI16x16x8x1_SE_AF0EM8_GRVW2_GSU15_SU0_SUS256_SRVW0_WG64_4_1_WGM2
    SolutionIndex: 470
    SolutionNameMin: Cijk_Ailk_Bjlk_BBH_MT128x160x32_MI32x32x4x1_SE_AF0EM8_GRVW4_GSU2_SU0_SUS256_SRVW0_WG128_2_1_WGM1
    SolutionIndex: 471
    SolutionNameMin: Cijk_Ailk_Bjlk_BBH_MT16x64x64_MI16x16x8x1_SE_AF0EM1_GRVW8_GSU15_SU32_SUS128_SRVW0_WG16_16_1_WGM15
    SolutionIndex: 472
    SolutionNameMin: Cijk_Ailk_Bjlk_BBH_MT96x128x64_MI32x32x4x1_SE_AF0EM1_GRVW8_GSU3_SU32_SUS128_SRVW0_WG32_8_1_WGM1
    SolutionIndex: 473
    SolutionNameMin: Cijk_Ailk_Bjlk_BBH_MT16x16x16_MI16x16x8x1_SE_AF0EM1_GRVW2_GSU1_SU32_SUS256_SRVW0_WG16_4_1_WGM1
    SolutionIndex: 474
    SolutionNameMin: Cijk_Ailk_Bjlk_BBH_MT16x16x16_MI16x16x8x1_SE_AF0EM1_GRVW2_GSU1_SU32_SUS128_SRVW0_WG16_4_1_WGM1
    SolutionIndex: 475
    SolutionNameMin: Cijk_Ailk_Bjlk_BBH_MT16x16x16_MI16x16x8x1_SE_AF0EM1_GRVW2_GSU1_SU32_SUS256_SRVW0_WG16_4_1_WGM15
    SolutionIndex: 476
    SolutionNameMin: Cijk_Ailk_Bjlk_BBH_MT32x64x16_MI16x16x8x1_SE_AF0EM1_GRVW8_GSU1_SU32_SUS256_SRVW4_WG32_8_1_WGM2
    SolutionIndex: 477
    SolutionNameMin: Cijk_Ailk_Bjlk_BBH_MT32x64x16_MI16x16x8x1_SE_AF0EM1_GRVW2_GSU1_SU32_SUS128_SRVW4_WG32_8_1_WGM2
    SolutionIndex: 478
    SolutionNameMin: Cijk_Ailk_Bjlk_BBH_MT32x64x16_MI16x16x8x1_SE_AF0EM1_GRVW2_GSU1_SU32_SUS256_SRVW4_WG32_8_1_WGM2
    SolutionIndex: 479
    SolutionNameMin: Cijk_Ailk_Bjlk_BBH_MT32x32x64_MI16x16x8x1_SE_AF0EM1_GRVW4_GSU1_SU32_SUS256_SRVW4_WG32_8_1_WGM1
    SolutionIndex: 480
    SolutionNameMin: Cijk_Ailk_Bjlk_BBH_MT64x64x16_MI32x32x4x1_SE_AF0EM1_GRVW2_GSU1_SU0_SUS256_SRVW4_WG64_4_1_WGM1
    SolutionIndex: 481
    SolutionNameMin: Cijk_Ailk_Bjlk_BBH_MT16x16x16_MI16x16x8x1_SE_AF0EM1_GRVW2_GSU1_SU0_SUS256_SRVW0_WG16_4_1_WGM1
    SolutionIndex: 482
    SolutionNameMin: Cijk_Ailk_Bjlk_BBH_MT16x16x16_MI16x16x8x1_SE_AF0EM1_GRVW4_GSU1_SU32_SUS128_SRVW0_WG16_4_1_WGM1
    SolutionIndex: 483
    SolutionNameMin: Cijk_Ailk_Bjlk_BBH_MT64x32x16_MI16x16x8x1_SE_AF0EM1_GRVW2_GSU1_SU0_SUS256_SRVW4_WG32_8_1_WGM1
    SolutionIndex: 484
    SolutionNameMin: Cijk_Ailk_Bjlk_BBH_MT32x32x64_MI16x16x8x1_SE_AF0EM1_GRVW8_GSU1_SU32_SUS256_SRVW4_WG32_8_1_WGM1
    SolutionIndex: 485
    SolutionNameMin: Cijk_Ailk_Bjlk_BBH_MT32x32x64_MI16x16x8x1_SE_AF0EM1_GRVW8_GSU1_SU32_SUS256_SRVW4_WG32_8_1_WGM2
    SolutionIndex: 486
    SolutionNameMin: Cijk_Ailk_Bjlk_BBH_MT64x64x64_MI32x32x4x1_SE_AF0EM1_GRVW4_GSU1_SU32_SUS128_SRVW4_WG64_4_1_WGM1
    SolutionIndex: 487
    SolutionNameMin: Cijk_Ailk_Bjlk_BBH_MT16x16x64_MI16x16x8x1_SE_AF0EM1_GRVW2_GSU7_SU0_SUS256_SRVW0_WG16_4_1_WGM15
    SolutionIndex: 488
    SolutionNameMin: Cijk_Ailk_Bjlk_BBH_MT16x64x64_MI16x16x8x1_SE_AF0EM1_GRVW8_GSU15_SU0_SUS256_SRVW0_WG16_16_1_WGM1
    SolutionIndex: 489
    SolutionNameMin: Cijk_Ailk_Bjlk_BBH_MT16x16x32_MI16x16x8x1_SE_AF0EM1_GRVW4_GSU3_SU32_SUS128_SRVW0_WG16_4_1_WGM1
    SolutionIndex: 490
    SolutionNameMin: Cijk_Ailk_Bjlk_BBH_MT64x128x32_MI32x32x4x1_SE_AF0EM1_GRVW8_GSU1_SU0_SUS256_SRVW4_WG64_4_1_WGM15
    SolutionIndex: 491
    SolutionNameMin: Cijk_Ailk_Bjlk_BBH_MT64x64x64_MI32x32x4x1_SE_AF0EM1_GRVW8_GSU1_SU0_SUS256_SRVW4_WG64_4_1_WGM1
    SolutionIndex: 492
    SolutionNameMin: Cijk_Ailk_Bjlk_BBH_MT64x128x32_MI32x32x4x1_SE_AF0EM1_GRVW8_GSU1_SU0_SUS256_SRVW4_WG64_4_1_WGM2
    SolutionIndex: 493
    SolutionNameMin: Cijk_Ailk_Bjlk_BBH_MT128x96x32_MI32x32x4x1_SE_AF0EM1_GRVW4_GSU1_SU32_SUS128_SRVW4_WG128_2_1_WGM15
    SolutionIndex: 494
    SolutionNameMin: Cijk_Ailk_Bjlk_BBH_MT128x96x32_MI32x32x4x1_SE_AF0EM1_GRVW4_GSU1_SU0_SUS256_SRVW4_WG128_2_1_WGM1
    SolutionIndex: 495
    SolutionNameMin: Cijk_Ailk_Bjlk_BBH_MT64x128x16_MI32x32x4x1_SE_AF0EM1_GRVW8_GSU1_SU32_SUS256_SRVW4_WG64_4_1_WGM1
    SolutionIndex: 496
    SolutionNameMin: Cijk_Ailk_Bjlk_BBH_MT64x64x32_MI32x32x4x1_SE_AF0EM1_GRVW8_GSU1_SU0_SUS256_SRVW4_WG64_4_1_WGM2
    SolutionIndex: 497
    SolutionNameMin: Cijk_Ailk_Bjlk_BBH_MT64x128x16_MI32x32x4x1_SE_AF0EM1_GRVW8_GSU1_SU32_SUS128_SRVW4_WG64_4_1_WGM1
    SolutionIndex: 498
    SolutionNameMin: Cijk_Ailk_Bjlk_BBH_MT64x64x32_MI32x32x4x1_SE_AF0EM1_GRVW8_GSU1_SU0_SUS256_SRVW4_WG64_4_1_WGM15
    SolutionIndex: 499
    SolutionNameMin: Cijk_Ailk_Bjlk_BBH_MT64x64x64_MI32x32x4x1_SE_AF0EM1_GRVW4_GSU1_SU0_SUS256_SRVW4_WG64_4_1_WGM1
    SolutionIndex: 500
    SolutionNameMin: Cijk_Ailk_Bjlk_BBH_MT64x128x32_MI32x32x4x1_SE_AF0EM1_GRVW8_GSU1_SU0_SUS256_SRVW4_WG64_4_1_WGM1
    SolutionIndex: 501
    SolutionNameMin: Cijk_Ailk_Bjlk_BBH_MT128x96x16_MI32x32x4x1_SE_AF0EM1_GRVW2_GSU1_SU32_SUS256_SRVW4_WG128_2_1_WGM15
    SolutionIndex: 502
    SolutionNameMin: Cijk_Ailk_Bjlk_BBH_MT128x96x16_MI32x32x4x1_SE_AF0EM1_GRVW2_GSU1_SU32_SUS128_SRVW4_WG128_2_1_WGM15
    SolutionIndex: 503
    SolutionNameMin: Cijk_Ailk_Bjlk_BBH_MT128x96x16_MI32x32x4x1_SE_AF0EM1_GRVW2_GSU1_SU0_SUS256_SRVW4_WG128_2_1_WGM15
    SolutionIndex: 504
    SolutionNameMin: Cijk_Ailk_Bjlk_BBH_MT128x128x16_MI32x32x4x1_SE_AF0EM1_GRVW8_GSU1_SU32_SUS256_SRVW4_WG64_4_1_WGM15
    SolutionIndex: 505
    SolutionNameMin: Cijk_Ailk_Bjlk_BBH_MT128x128x16_MI32x32x4x1_SE_AF0EM1_GRVW8_GSU1_SU0_SUS256_SRVW4_WG64_4_1_WGM15
    SolutionIndex: 506
    SolutionNameMin: Cijk_Ailk_Bjlk_BBH_MT128x64x16_MI32x32x4x1_SE_AF0EM1_GRVW4_GSU1_SU0_SUS256_SRVW4_WG64_4_1_WGM1
    SolutionIndex: 507
    SolutionNameMin: Cijk_Ailk_Bjlk_BBH_MT64x256x16_MI32x32x4x1_SE_AF0EM1_GRVW8_GSU1_SU32_SUS128_SRVW4_WG64_4_1_WGM1
    SolutionIndex: 508
    SolutionNameMin: Cijk_Ailk_Bjlk_BBH_MT64x256x16_MI32x32x4x1_SE_AF0EM1_GRVW8_GSU1_SU32_SUS256_SRVW4_WG64_4_1_WGM15
    SolutionIndex: 509
    SolutionNameMin: Cijk_Ailk_Bjlk_BBH_MT64x256x16_MI32x32x4x1_SE_AF0EM1_GRVW8_GSU1_SU0_SUS256_SRVW4_WG64_4_1_WGM1
    SolutionIndex: 510
    SolutionNameMin: Cijk_Ailk_Bjlk_BBH_MT128x64x16_MI32x32x4x1_SE_AF0EM1_GRVW8_GSU1_SU0_SUS256_SRVW4_WG64_4_1_WGM15
    SolutionIndex: 511
    SolutionNameMin: Cijk_Ailk_Bjlk_BBH_MT128x96x16_MI32x32x4x1_SE_AF0EM1_GRVW2_GSU1_SU32_SUS256_SRVW4_WG128_2_1_WGM1
    SolutionIndex: 512
    SolutionNameMin: Cijk_Ailk_Bjlk_BBH_MT128x96x16_MI32x32x4x1_SE_AF0EM1_GRVW2_GSU1_SU0_SUS256_SRVW4_WG128_2_1_WGM1
    SolutionIndex: 513
    SolutionNameMin: Cijk_Ailk_Bjlk_BBH_MT64x128x16_MI32x32x4x1_SE_AF0EM1_GRVW8_GSU1_SU0_SUS256_SRVW4_WG64_4_1_WGM2
    SolutionIndex: 514
    SolutionNameMin: Cijk_Ailk_Bjlk_BBH_MT64x128x16_MI32x32x4x1_SE_AF0EM1_GRVW8_GSU1_SU0_SUS256_SRVW4_WG64_4_1_WGM1
    SolutionIndex: 515
    SolutionNameMin: Cijk_Ailk_Bjlk_BBH_MT128x96x16_MI32x32x4x1_SE_AF0EM1_GRVW2_GSU1_SU32_SUS128_SRVW4_WG128_2_1_WGM1
    SolutionIndex: 516
    SolutionNameMin: Cijk_Ailk_Bjlk_BBH_MT128x64x16_MI32x32x4x1_SE_AF0EM1_GRVW2_GSU1_SU32_SUS128_SRVW4_WG64_4_1_WGM2
    SolutionIndex: 517
    SolutionNameMin: Cijk_Ailk_Bjlk_BBH_MT64x128x16_MI32x32x4x1_SE_AF0EM1_GRVW8_GSU1_SU0_SUS256_SRVW4_WG64_4_1_WGM15
    SolutionIndex: 518
    SolutionNameMin: Cijk_Ailk_Bjlk_BBH_MT64x256x16_MI32x32x4x1_SE_AF0EM1_GRVW8_GSU1_SU0_SUS256_SRVW4_WG64_4_1_WGM15
    SolutionIndex: 519
    SolutionNameMin: Cijk_Ailk_Bjlk_BBH_MT64x64x32_MI32x32x4x1_SE_AF0EM1_GRVW8_GSU1_SU32_SUS128_SRVW4_WG64_4_1_WGM1
    SolutionIndex: 520
    SolutionNameMin: Cijk_Ailk_Bjlk_BBH_MT32x32x64_MI16x16x8x1_SE_AF0EM1_GRVW8_GSU1_SU0_SUS256_SRVW4_WG32_8_1_WGM15
    SolutionIndex: 521
    SolutionNameMin: Cijk_Ailk_Bjlk_BBH_MT128x128x16_MI32x32x4x1_SE_AF0EM1_GRVW8_GSU1_SU32_SUS128_SRVW4_WG64_4_1_WGM15
    SolutionIndex: 522
    SolutionNameMin: Cijk_Ailk_Bjlk_BBH_MT64x128x32_MI32x32x4x1_SE_AF0EM1_GRVW8_GSU1_SU32_SUS128_SRVW4_WG64_4_1_WGM1
    SolutionIndex: 523
    SolutionNameMin: Cijk_Ailk_Bjlk_BBH_MT64x128x32_MI32x32x4x1_SE_AF0EM1_GRVW8_GSU1_SU32_SUS256_SRVW4_WG64_4_1_WGM1
- - - [34, 64, 1, 34]
    - [9, 0.008]
  - - [32, 64, 1, 35]
    - [8, 0.006]
  - - [64, 21, 1, 17]
    - [5, 0.002]
  - - [64, 32, 1, 35]
    - [8, 0.006]
  - - [21, 64, 1, 21]
    - [7, 0.003]
  - - [64, 30, 1, 31]
    - [8, 0.005]
  - - [15, 64, 1, 15]
    - [1, 0.001]
  - - [64, 24, 1, 24]
    - [8, 0.004]
  - - [17, 64, 1, 15]
    - [11, 0.002]
  - - [64, 35, 1, 35]
    - [5, 0.006]
  - - [32, 64, 1, 32]
    - [9, 0.007]
  - - [64, 34, 1, 24]
    - [8, 0.005]
  - - [64, 15, 1, 15]
    - [3, 0.001]
  - - [30, 64, 1, 30]
    - [13, 0.006]
  - - [30, 64, 1, 31]
    - [11, 0.007]
  - - [34, 64, 1, 24]
    - [14, 0.007]
  - - [64, 30, 1, 30]
    - [8, 0.005]
  - - [14, 64, 1, 14]
    - [1, 0.001]
  - - [64, 17, 1, 17]
    - [2, 0.001]
  - - [64, 17, 1, 15]
    - [2, 0.001]
  - - [64, 32, 1, 32]
    - [6, 0.007]
  - - [64, 31, 1, 31]
    - [8, 0.005]
  - - [17, 64, 1, 17]
    - [7, 0.002]
  - - [64, 21, 1, 21]
    - [2, 0.002]
  - - [35, 64, 1, 35]
    - [9, 0.008]
  - - [31, 64, 1, 31]
    - [11, 0.007]
  - - [21, 64, 1, 17]
    - [9, 0.003]
  - - [64, 15, 1, 15]
    - [3, 0.001]
  - - [64, 17, 1, 17]
    - [2, 0.001]
  - - [17, 64, 1, 17]
    - [7, 0.002]
  - - [64, 34, 1, 34]
    - [15, 0.007]
  - - [15, 64, 1, 14]
    - [4, 0.001]
  - - [24, 64, 1, 24]
    - [9, 0.004]
  - - [64, 14, 1, 14]
    - [4, 0.001]
  - - [15, 64, 1, 15]
    - [1, 0.001]
  - - [64, 15, 1, 14]
    - [5, 0.001]
  - - [64, 128, 512, 128]
    - [300, 35.258]
  - - [64, 512, 1, 512]
    - [68, 3.108]
  - - [64, 512, 64, 512]
    - [269, 49.622]
  - - [128, 64, 512, 128]
    - [301, 34.178]
  - - [512, 64, 1, 512]
    - [82, 3.171]
  - - [512, 64, 64, 512]
    - [303, 49.992]
  - - [1024, 2, 1, 4]
    - [270, 0.003]
  - - [1024, 2, 1, 32]
    - [302, 0.021]
  - - [1024, 2, 1, 2048]
    - [271, 0.66]
  - - [1024, 1024, 1, 4]
    - [272, 1.286]
  - - [1024, 1024, 1, 32]
    - [287, 9.969]
  - - [1024, 1024, 1, 2048]
    - [116, 57.174]
  - - [1024, 1024, 1, 4096]
    - [101, 64.004]
  - - [1024, 4096, 1, 2048]
    - [63, 84.977]
  - - [1024, 4096, 1, 4096]
    - [134, 87.401]
  - - [1024, 30528, 1, 2048]
    - [189, 95.283]
  - - [1024, 30528, 1, 4096]
    - [188, 96.795]
  - - [4096, 1024, 1, 2048]
    - [124, 84.797]
  - - [4096, 1024, 1, 4096]
    - [124, 87.952]
  - - [3, 64, 512, 3]
    - [481, 0.088]
  - - [5, 64, 512, 5]
    - [481, 0.226]
  - - [5, 64, 960, 5]
    - [482, 0.323]
  - - [9, 64, 512, 9]
    - [473, 0.671]
  - - [13, 512, 1, 32768]
    - [471, 11.004]
  - - [27, 128, 32768, 27]
    - [231, 9.875]
  - - [33, 32, 200, 33]
    - [483, 1.74]
  - - [33, 32, 1600, 33]
    - [483, 5.351]
  - - [67, 2048, 1, 512]
    - [484, 10.868]
  - - [74, 2048, 1, 512]
    - [479, 11.435]
  - - [74, 2048, 1, 960]
    - [485, 14.961]
  - - [100, 2048, 1, 512]
    - [131, 13.919]
  - - [256, 128, 1, 32768]
    - [295, 49.744]
  - - [256, 1280, 1, 8976]
    - [321, 68.985]
  - - [256, 2560, 1, 8976]
    - [322, 78.531]
  - - [256, 2816, 1, 8976]
    - [323, 78.592]
  - - [256, 3328, 1, 8976]
    - [324, 76.828]
  - - [256, 3584, 1, 8976]
    - [325, 82.693]
  - - [256, 3840, 1, 8976]
    - [326, 87.151]
  - - [256, 4096, 1, 8976]
    - [327, 76.86]
  - - [256, 4352, 1, 8976]
    - [268, 75.656]
  - - [256, 4864, 1, 8976]
    - [328, 79.631]
  - - [256, 5120, 1, 8976]
    - [329, 83.409]
  - - [256, 5632, 1, 8976]
    - [330, 89.118]
  - - [256, 5888, 1, 8976]
    - [331, 76.83]
  - - [256, 6144, 1, 8976]
    - [331, 80.709]
  - - [256, 7168, 1, 8976]
    - [332, 87.581]
  - - [256, 8192, 1, 8976]
    - [333, 83.707]
  - - [256, 8960, 1, 8976]
    - [334, 87.7]
  - - [256, 9728, 1, 8976]
    - [328, 80.956]
  - - [256, 9984, 1, 8976]
    - [328, 82.783]
  - - [256, 10240, 1, 8976]
    - [328, 84.579]
  - - [256, 10496, 1, 8976]
    - [103, 85.952]
  - - [256, 11008, 1, 8976]
    - [116, 90.092]
  - - [256, 11264, 1, 8976]
    - [80, 92.134]
  - - [256, 11520, 1, 8976]
    - [95, 94.698]
  - - [256, 11776, 1, 8976]
    - [335, 78.327]
  - - [256, 12544, 1, 8976]
    - [194, 81.494]
  - - [256, 12800, 1, 8976]
    - [327, 81.352]
  - - [256, 13312, 1, 8976]
    - [336, 83.629]
  - - [256, 13568, 1, 8976]
    - [337, 85.287]
  - - [256, 14336, 1, 8976]
    - [338, 89.984]
  - - [256, 14848, 1, 8976]
    - [246, 93.047]
  - - [256, 15104, 1, 8976]
    - [337, 94.666]
  - - [256, 15872, 1, 8976]
    - [84, 87.561]
  - - [256, 16128, 1, 8976]
    - [95, 89.225]
  - - [256, 17152, 1, 8976]
    - [97, 94.368]
  - - [256, 17408, 1, 8976]
    - [339, 85.146]
  - - [256, 18688, 1, 8976]
    - [340, 91.314]
  - - [256, 19968, 1, 8976]
    - [196, 83.833]
  - - [256, 20480, 1, 8976]
    - [102, 85.874]
  - - [256, 20992, 1, 8976]
    - [197, 87.961]
  - - [256, 21248, 1, 8976]
    - [196, 88.981]
  - - [256, 22016, 1, 8976]
    - [198, 92.046]
  - - [256, 26112, 1, 8976]
    - [341, 91.007]
  - - [256, 32512, 1, 8976]
    - [84, 90.393]
  - - [256, 32768, 1, 1]
    - [296, 0.892]
  - - [256, 33536, 1, 8976]
    - [97, 93.155]
  - - [256, 44505, 1, 8976]
    - [180, 93.75]
  - - [257, 4096, 1, 1024]
    - [486, 43.388]
  - - [480, 1024, 1, 32768]
    - [342, 90.635]
  - - [512, 32, 1, 200]
    - [82, 0.681]
  - - [512, 32, 1, 1600]
    - [318, 3.775]
  - - [512, 256, 1, 32768]
    - [297, 75.058]
  - - [512, 512, 1, 200]
    - [343, 10.222]
  - - [512, 512, 1, 1600]
    - [320, 29.623]
  - - [512, 2048, 1, 256]
    - [253, 36.146]
  - - [560, 1024, 1, 200]
    - [344, 17.595]
  - - [560, 1024, 1, 1600]
    - [257, 43.366]
  - - [768, 2048, 1, 256]
    - [317, 46.235]
  - - [1024, 64, 1, 512]
    - [72, 6.28]
  - - [1024, 64, 1, 960]
    - [345, 8.989]
  - - [1024, 256, 1, 1024]
    - [346, 23.26]
  - - [1024, 256, 1, 1280]
    - [347, 25.324]
  - - [1024, 256, 1, 2304]
    - [348, 35.548]
  - - [1024, 256, 1, 2816]
    - [349, 40.048]
  - - [1024, 256, 1, 3072]
    - [350, 41.638]
  - - [1024, 256, 1, 3328]
    - [351, 43.427]
  - - [1024, 256, 1, 3584]
    - [352, 44.859]
  - - [1024, 256, 1, 4096]
    - [353, 48.079]
  - - [1024, 256, 1, 4352]
    - [354, 48.53]
  - - [1024, 256, 1, 4608]
    - [355, 50.466]
  - - [1024, 256, 1, 5120]
    - [356, 52.119]
  - - [1024, 256, 1, 5376]
    - [357, 52.754]
  - - [1024, 256, 1, 5632]
    - [351, 53.552]
  - - [1024, 256, 1, 6144]
    - [358, 55.825]
  - - [1024, 256, 1, 6400]
    - [358, 56.99]
  - - [1024, 256, 1, 7680]
    - [353, 59.907]
  - - [1024, 256, 1, 7936]
    - [350, 60.745]
  - - [1024, 256, 1, 8192]
    - [359, 61.085]
  - - [1024, 256, 1, 8448]
    - [351, 61.681]
  - - [1024, 256, 1, 9728]
    - [360, 64.24]
  - - [1024, 256, 1, 9984]
    - [361, 64.625]
  - - [1024, 256, 1, 10496]
    - [362, 65.94]
  - - [1024, 256, 1, 11520]
    - [359, 67.37]
  - - [1024, 256, 1, 12032]
    - [360, 68.169]
  - - [1024, 256, 1, 13568]
    - [363, 70.0]
  - - [1024, 256, 1, 14336]
    - [360, 71.05]
  - - [1024, 256, 1, 14848]
    - [363, 71.423]
  - - [1024, 256, 1, 15104]
    - [360, 71.601]
  - - [1024, 256, 1, 15872]
    - [360, 72.645]
  - - [1024, 256, 1, 16128]
    - [364, 72.932]
  - - [1024, 256, 1, 17152]
    - [363, 73.434]
  - - [1024, 256, 1, 17408]
    - [360, 73.694]
  - - [1024, 256, 1, 18944]
    - [363, 74.777]
  - - [1024, 256, 1, 19712]
    - [364, 75.56]
  - - [1024, 256, 1, 19968]
    - [363, 75.247]
  - - [1024, 256, 1, 21248]
    - [363, 76.319]
  - - [1024, 256, 1, 21504]
    - [363, 76.734]
  - - [1024, 256, 1, 22016]
    - [365, 76.611]
  - - [1024, 256, 1, 28672]
    - [366, 79.66]
  - - [1024, 256, 1, 33536]
    - [367, 81.016]
  - - [1024, 512, 1, 32768]
    - [298, 82.937]
  - - [1024, 1024, 1, 200]
    - [263, 27.838]
  - - [1024, 1024, 1, 512]
    - [257, 45.061]
  - - [1024, 1024, 1, 960]
    - [368, 51.198]
  - - [1024, 1024, 1, 1600]
    - [129, 54.802]
  - - [1024, 1024, 1, 32768]
    - [299, 83.879]
  - - [1600, 1024, 1, 512]
    - [317, 56.682]
  - - [1600, 1024, 1, 960]
    - [369, 64.844]
  - - [2048, 256, 1, 1024]
    - [335, 38.797]
  - - [2048, 960, 1, 1]
    - [370, 0.575]
  - - [2048, 2048, 1, 512]
    - [84, 69.419]
  - - [2048, 2048, 1, 960]
    - [65, 78.832]
  - - [2048, 2048, 1, 1024]
    - [84, 79.908]
  - - [3200, 2048, 1, 1024]
    - [341, 83.348]
  - - [4096, 4096, 1, 1024]
    - [371, 88.85]
  - - [14, 64, 10880, 14]
    - [473, 3.701]
  - - [15, 64, 10880, 14]
    - [474, 3.806]
  - - [15, 64, 7680, 15]
    - [475, 3.898]
  - - [15, 64, 10880, 15]
    - [475, 4.034]
  - - [17, 64, 7680, 15]
    - [105, 3.871]
  - - [17, 64, 6144, 17]
    - [94, 3.839]
  - - [17, 64, 7680, 17]
    - [147, 4.053]
  - - [21, 64, 6144, 17]
    - [476, 4.342]
  - - [21, 64, 6144, 21]
    - [477, 5.244]
  - - [24, 64, 4736, 24]
    - [126, 8.785]
  - - [30, 64, 2048, 30]
    - [477, 7.83]
  - - [30, 64, 2048, 31]
    - [478, 8.09]
  - - [31, 64, 2048, 31]
    - [478, 7.833]
  - - [32, 64, 4608, 32]
    - [310, 14.455]
  - - [32, 64, 4608, 35]
    - [67, 11.687]
  - - [34, 64, 4736, 24]
    - [133, 7.024]
  - - [34, 64, 4736, 34]
    - [87, 8.851]
  - - [35, 64, 4608, 35]
    - [87, 8.816]
  - - [64, 14, 10880, 14]
    - [311, 4.236]
  - - [64, 15, 10880, 14]
    - [311, 4.386]
  - - [64, 15, 7680, 15]
    - [106, 4.443]
  - - [64, 15, 10880, 15]
    - [106, 4.663]
  - - [64, 17, 7680, 15]
    - [106, 4.98]
  - - [64, 17, 6144, 17]
    - [76, 4.727]
  - - [64, 17, 7680, 17]
    - [136, 5.275]
  - - [64, 21, 6144, 17]
    - [70, 5.651]
  - - [64, 21, 6144, 21]
    - [76, 6.804]
  - - [64, 24, 4736, 24]
    - [70, 8.599]
  - - [64, 30, 2048, 30]
    - [106, 9.316]
  - - [64, 30, 2048, 31]
    - [106, 9.546]
  - - [64, 31, 2048, 31]
    - [142, 9.583]
  - - [64, 32, 4608, 32]
    - [312, 14.681]
  - - [64, 32, 4608, 35]
    - [88, 11.513]
  - - [64, 34, 4736, 24]
    - [313, 8.222]
  - - [64, 34, 4736, 34]
    - [111, 10.167]
  - - [64, 35, 4608, 35]
    - [104, 10.418]
  - - [1024, 1024, 1, 3840]
    - [71, 63.49]
  - - [1024, 1024, 1, 3968]
    - [64, 63.885]
  - - [1024, 1024, 1, 6528]
    - [281, 69.515]
  - - [1024, 1024, 1, 7104]
    - [281, 70.309]
  - - [1024, 1024, 1, 7200]
    - [308, 70.231]
  - - [1024, 1024, 1, 8064]
    - [307, 71.547]
  - - [1024, 1024, 1, 8160]
    - [309, 71.558]
  - - [1024, 1024, 1, 9216]
    - [304, 72.756]
  - - [1024, 1024, 1, 9520]
    - [281, 72.139]
  - - [1024, 1024, 1, 10064]
    - [306, 72.589]
  - - [1024, 1024, 1, 10080]
    - [276, 73.298]
  - - [1024, 1024, 1, 10200]
    - [307, 72.452]
  - - [1024, 4096, 1, 3840]
    - [65, 87.1]
  - - [1024, 4096, 1, 3968]
    - [63, 87.822]
  - - [1024, 4096, 1, 6528]
    - [63, 88.97]
  - - [1024, 4096, 1, 7104]
    - [63, 89.373]
  - - [1024, 4096, 1, 7200]
    - [65, 89.138]
  - - [1024, 4096, 1, 8064]
    - [65, 89.389]
  - - [1024, 4096, 1, 8160]
    - [65, 89.355]
  - - [1024, 4096, 1, 9216]
    - [65, 89.74]
  - - [1024, 4096, 1, 9520]
    - [114, 89.097]
  - - [1024, 4096, 1, 10064]
    - [114, 89.535]
  - - [1024, 4096, 1, 10080]
    - [99, 89.728]
  - - [1024, 4096, 1, 10200]
    - [63, 89.228]
  - - [1024, 42720, 1, 3968]
    - [80, 95.377]
  - - [1024, 42720, 1, 6528]
    - [95, 95.744]
  - - [1024, 42720, 1, 7104]
    - [95, 95.8]
  - - [1024, 42720, 1, 7200]
    - [95, 95.812]
  - - [1024, 42720, 1, 9520]
    - [95, 95.729]
  - - [1024, 42720, 1, 10080]
    - [95, 95.96]
  - - [4096, 1024, 1, 3840]
    - [124, 87.377]
  - - [4096, 1024, 1, 3968]
    - [190, 87.549]
  - - [4096, 1024, 1, 6528]
    - [130, 88.894]
  - - [4096, 1024, 1, 7104]
    - [63, 89.074]
  - - [4096, 1024, 1, 7200]
    - [65, 89.026]
  - - [4096, 1024, 1, 8064]
    - [65, 89.439]
  - - [4096, 1024, 1, 8160]
    - [63, 89.33]
  - - [4096, 1024, 1, 9216]
    - [77, 89.541]
  - - [4096, 1024, 1, 9520]
    - [191, 88.77]
  - - [4096, 1024, 1, 10064]
    - [77, 89.192]
  - - [4096, 1024, 1, 10080]
    - [65, 89.494]
  - - [4096, 1024, 1, 10200]
    - [98, 88.921]
  - - [27, 64, 1920, 27]
    - [31, 3.275]
  - - [27, 64, 1920, 33]
    - [29, 3.57]
  - - [33, 64, 1920, 33]
    - [19, 3.548]
  - - [64, 27, 1920, 27]
    - [23, 2.525]
  - - [64, 27, 1920, 33]
    - [28, 2.903]
  - - [64, 33, 1920, 33]
    - [17, 3.716]
  - - [1024, 1024, 1, 3240]
    - [32, 26.989]
  - - [1024, 1024, 1, 3960]
    - [25, 27.424]
  - - [1024, 4096, 1, 3240]
    - [33, 38.306]
  - - [1024, 4096, 1, 3960]
    - [24, 38.342]
  - - [1024, 42720, 1, 3960]
    - [30, 45.984]
  - - [4096, 1024, 1, 3240]
    - [22, 38.398]
  - - [4096, 1024, 1, 3960]
    - [22, 38.589]
  - - [64, 1280, 64, 192]
    - [435, 53.525]
  - - [64, 1280, 64, 320]
    - [429, 60.738]
  - - [64, 1280, 64, 384]
    - [429, 62.698]
  - - [64, 1280, 64, 448]
    - [436, 64.936]
  - - [64, 2048, 64, 192]
    - [437, 54.71]
  - - [64, 2048, 64, 320]
    - [438, 62.49]
  - - [64, 2048, 64, 384]
    - [433, 65.892]
  - - [64, 2048, 64, 448]
    - [380, 67.633]
  - - [1225, 192, 64, 32]
    - [501, 24.106]
  - - [1225, 192, 64, 48]
    - [502, 33.227]
  - - [1225, 192, 64, 64]
    - [503, 39.98]
  - - [1225, 256, 64, 48]
    - [504, 35.635]
  - - [1225, 256, 64, 64]
    - [505, 43.555]
  - - [1225, 288, 64, 48]
    - [502, 36.159]
  - - [1225, 288, 64, 64]
    - [501, 42.728]
  - - [5329, 64, 64, 80]
    - [506, 38.815]
  - - [289, 768, 64, 128]
    - [507, 51.022]
  - - [289, 768, 64, 160]
    - [508, 55.607]
  - - [289, 768, 64, 192]
    - [509, 59.151]
  - - [64, 1280, 32, 192]
    - [429, 46.868]
  - - [64, 1280, 32, 320]
    - [380, 55.285]
  - - [64, 1280, 32, 384]
    - [380, 57.794]
  - - [64, 1280, 32, 448]
    - [376, 60.388]
  - - [64, 2048, 32, 192]
    - [426, 49.418]
  - - [64, 2048, 32, 320]
    - [439, 56.2]
  - - [64, 2048, 32, 384]
    - [376, 59.109]
  - - [64, 2048, 32, 448]
    - [390, 61.165]
  - - [1225, 192, 32, 32]
    - [510, 20.214]
  - - [1225, 192, 32, 48]
    - [511, 28.174]
  - - [1225, 192, 32, 64]
    - [512, 32.548]
  - - [1225, 256, 32, 48]
    - [513, 30.153]
  - - [1225, 256, 32, 64]
    - [514, 36.427]
  - - [1225, 288, 32, 48]
    - [515, 30.459]
  - - [1225, 288, 32, 64]
    - [515, 37.05]
  - - [5329, 64, 32, 80]
    - [516, 36.155]
  - - [289, 768, 32, 128]
    - [517, 44.778]
  - - [289, 768, 32, 160]
    - [518, 49.349]
  - - [289, 768, 32, 192]
    - [497, 51.983]
  - - [3136, 64, 64, 256]
    - [379, 59.58]
  - - [3136, 64, 64, 64]
    - [259, 37.992]
  - - [3136, 256, 64, 64]
    - [434, 61.485]
  - - [784, 128, 64, 512]
    - [435, 72.237]
  - - [784, 512, 64, 128]
    - [431, 65.967]
  - - [196, 256, 64, 1024]
    - [492, 55.448]
  - - [196, 1024, 64, 256]
    - [171, 57.682]
  - - [49, 512, 64, 2048]
    - [499, 45.862]
  - - [49, 2048, 64, 512]
    - [500, 47.199]
  - - [3136, 64, 32, 256]
    - [259, 55.749]
  - - [3136, 64, 32, 64]
    - [432, 32.738]
  - - [3136, 256, 32, 64]
    - [415, 56.361]
  - - [784, 128, 32, 512]
    - [433, 61.794]
  - - [784, 512, 32, 128]
    - [373, 59.293]
  - - [196, 256, 32, 1024]
    - [496, 47.271]
  - - [196, 1024, 32, 256]
    - [495, 50.038]
  - - [49, 512, 32, 2048]
    - [498, 39.101]
  - - [49, 2048, 32, 512]
    - [497, 42.156]
  - - [3136, 64, 64, 128]
    - [421, 47.416]
  - - [3136, 128, 64, 256]
    - [422, 80.191]
  - - [784, 256, 64, 512]
    - [423, 79.109]
  - - [3136, 256, 64, 128]
    - [424, 77.957]
  - - [3136, 256, 64, 256]
    - [425, 86.624]
  - - [196, 512, 64, 1024]
    - [490, 63.68]
  - - [784, 512, 64, 256]
    - [426, 75.704]
  - - [784, 512, 64, 512]
    - [427, 82.309]
  - - [196, 1024, 64, 512]
    - [178, 64.111]
  - - [196, 1024, 64, 1024]
    - [171, 67.209]
  - - [49, 1024, 64, 2048]
    - [491, 54.732]
  - - [49, 2048, 64, 1024]
    - [492, 55.223]
  - - [3136, 64, 32, 128]
    - [421, 43.099]
  - - [3136, 128, 32, 256]
    - [428, 74.966]
  - - [784, 256, 32, 512]
    - [429, 73.974]
  - - [3136, 256, 32, 128]
    - [430, 72.579]
  - - [3136, 256, 32, 256]
    - [431, 82.226]
  - - [196, 512, 32, 1024]
    - [490, 56.105]
  - - [784, 512, 32, 256]
    - [426, 71.234]
  - - [784, 512, 32, 512]
    - [429, 79.16]
  - - [196, 1024, 32, 512]
    - [493, 57.36]
  - - [196, 1024, 32, 1024]
    - [494, 63.255]
  - - [49, 1024, 32, 2048]
    - [169, 48.121]
  - - [49, 2048, 32, 1024]
    - [492, 49.041]
  - - [64, 128, 624, 128]
    - [265, 35.914]
  - - [1024, 1024, 1, 1024]
    - [252, 53.027]
  - - [1024, 1024, 1, 1280]
    - [257, 53.223]
  - - [1024, 1024, 1, 39]
    - [267, 10.071]
  - - [1024, 4096, 1, 2560]
    - [63, 85.737]
  - - [1024, 4096, 1, 1024]
    - [65, 79.2]
  - - [33, 32, 1, 33]
    - [78, 0.009]
  - - [1024, 2, 1, 4992]
    - [266, 1.132]
  - - [64, 128, 144, 128]
    - [290, 26.167]
  - - [512, 512, 1, 512]
    - [251, 18.609]
  - - [1024, 2, 1, 39]
    - [69, 0.022]
  - - [1024, 1024, 1, 8192]
    - [304, 71.679]
  - - [1024, 960, 1, 1024]
    - [250, 70.301]
  - - [1024, 1024, 1, 308]
    - [273, 33.397]
  - - [1024, 2, 1, 5]
    - [260, 0.003]
  - - [1024, 1024, 1, 4992]
    - [268, 65.974]
  - - [4096, 3840, 1, 4096]
    - [181, 97.18]
  - - [4096, 1024, 1, 3072]
    - [98, 86.407]
  - - [64, 512, 96, 512]
    - [284, 56.453]
  - - [1024, 1024, 1, 5248]
    - [281, 66.882]
  - - [4096, 1024, 1, 4992]
    - [77, 88.362]
  - - [1024, 1024, 1, 180]
    - [292, 26.364]
  - - [5, 64, 1, 5]
    - [480, 0.0]
  - - [4096, 1024, 1, 2560]
    - [77, 85.994]
  - - [1024, 33712, 1, 9600]
    - [188, 95.931]
  - - [64, 128, 640, 128]
    - [265, 35.683]
  - - [1024, 1024, 1, 5]
    - [267, 1.557]
  - - [4, 64, 32768, 4]
    - [81, 0.418]
  - - [1024, 2, 1, 40]
    - [69, 0.024]
  - - [1024, 30522, 1, 160]
    - [289, 77.803]
  - - [1024, 1024, 1, 800]
    - [157, 48.759]
  - - [1024, 1024, 1, 41]
    - [280, 9.695]
  - - [1024, 2, 1, 5248]
    - [279, 1.177]
  - - [4096, 4096, 1, 4096]
    - [182, 92.432]
  - - [1024, 30522, 1, 385]
    - [274, 86.224]
  - - [1024, 4096, 1, 9600]
    - [141, 89.717]
  - - [2048, 512, 1, 1]
    - [316, 0.356]
  - - [1024, 4096, 1, 1152]
    - [65, 80.245]
  - - [1024, 2, 1, 512]
    - [255, 0.196]
  - - [64, 4, 38400, 4]
    - [110, 0.437]
  - - [1024, 30522, 1, 180]
    - [294, 76.858]
  - - [4096, 1024, 1, 512]
    - [258, 71.266]
  - - [4096, 1024, 1, 1024]
    - [134, 78.967]
  - - [4, 64, 38400, 4]
    - [81, 0.421]
  - - [1024, 2, 1, 9]
    - [260, 0.006]
  - - [8192, 8192, 1, 8192]
    - [84, 95.991]
  - - [4096, 1024, 1, 1280]
    - [135, 80.97]
  - - [1024, 1024, 1, 3072]
    - [71, 61.647]
  - - [64, 128, 656, 128]
    - [278, 36.369]
  - - [1024, 4096, 1, 4992]
    - [65, 88.064]
  - - [1024, 1024, 1, 9]
    - [254, 2.637]
  - - [1024, 4096, 1, 512]
    - [65, 68.59]
  - - [64, 512, 16, 512]
    - [253, 30.824]
  - - [1024, 2, 1, 6]
    - [285, 0.004]
  - - [2048, 1920, 1, 2048]
    - [249, 91.906]
  - - [1024, 30522, 1, 780]
    - [119, 91.111]
  - - [64, 128, 128, 128]
    - [287, 23.478]
  - - [1024, 30522, 1, 800]
    - [277, 92.505]
  - - [960, 1024, 1, 1024]
    - [247, 71.368]
  - - [1024, 1024, 1, 6]
    - [272, 1.84]
  - - [8192, 7680, 1, 8192]
    - [180, 98.372]
  - - [1024, 2, 1, 1152]
    - [291, 0.391]
  - - [1024, 1024, 1, 2560]
    - [64, 59.318]
  - - [1024, 1024, 1, 77]
    - [256, 15.741]
  - - [1024, 1024, 1, 160]
    - [253, 29.623]
  - - [1024, 4096, 1, 8192]
    - [152, 89.419]
  - - [1024, 2, 1, 41]
    - [146, 0.024]
  - - [128, 64, 1, 128]
    - [315, 0.37]
  - - [480, 512, 1, 512]
    - [248, 21.41]
  - - [1024, 1024, 1, 462]
    - [263, 38.748]
  - - [1024, 1024, 1, 780]
    - [151, 45.696]
  - - [1024, 4096, 1, 5248]
    - [65, 88.371]
  - - [1024, 4096, 1, 1280]
    - [63, 81.036]
  - - [4096, 1024, 1, 9600]
    - [65, 89.644]
  - - [64, 512, 80, 512]
    - [282, 56.965]
  - - [4096, 1024, 1, 1152]
    - [108, 80.387]
  - - [1024, 1600, 1, 1]
    - [319, 0.503]
  - - [1024, 1024, 1, 820]
    - [129, 46.112]
  - - [1024, 2, 1, 2560]
    - [283, 0.773]
  - - [4096, 1024, 1, 5248]
    - [124, 88.334]
  - - [1024, 33712, 1, 8192]
    - [180, 95.838]
  - - [1024, 1024, 1, 385]
    - [253, 37.779]
  - - [1024, 1024, 1, 1]
    - [254, 0.37]
  - - [1024, 2, 1, 10]
    - [260, 0.006]
  - - [64, 4, 32768, 4]
    - [110, 0.433]
  - - [1024, 1024, 1, 10]
    - [262, 2.929]
  - - [1024, 2, 1, 5120]
    - [275, 1.183]
  - - [1920, 2048, 1, 2048]
    - [246, 92.357]
  - - [2048, 2048, 1, 2048]
    - [80, 85.428]
  - - [3840, 4096, 1, 4096]
    - [180, 97.18]
  - - [1024, 4096, 1, 5120]
    - [63, 88.416]
  - - [64, 128, 160, 128]
    - [259, 28.038]
  - - [1024, 30522, 1, 308]
    - [274, 84.114]
  - - [1024, 30522, 1, 820]
    - [117, 91.736]
  - - [1024, 30522, 1, 200]
    - [264, 77.43]
  - - [1024, 30522, 1, 462]
    - [118, 87.293]
  - - [1024, 2, 1, 1024]
    - [288, 0.356]
  - - [1024, 30522, 1, 77]
    - [159, 47.767]
  - - [1024, 1024, 1, 40]
    - [256, 9.938]
  - - [1024, 2, 1, 1]
    - [254, 0.0]
  - - [1024, 2, 1, 8]
    - [156, 0.006]
  - - [1024, 1024, 1, 8]
    - [256, 2.453]
  - - [1024, 1024, 1, 9600]
    - [305, 73.14]
  - - [4096, 1024, 1, 5120]
    - [65, 88.26]
  - - [1024, 4096, 1, 3072]
    - [134, 86.16]
  - - [1024, 1024, 1, 1152]
    - [293, 52.458]
  - - [512, 480, 1, 512]
    - [251, 21.607]
  - - [64, 128, 1, 128]
    - [314, 0.37]
  - - [1024, 1024, 1, 5120]
    - [276, 66.371]
  - - [1024, 2, 1, 3072]
    - [286, 0.879]
  - - [7680, 8192, 1, 8192]
    - [179, 98.329]
  - - [4096, 1024, 1, 8192]
    - [141, 89.431]
  - - [1024, 2, 1, 1280]
    - [261, 0.43]
  - - [479, 1024, 1, 32768]
    - [472, 86.444]
  - - [64, 1024, 32, 1024]
    - [269, 60.808]
  - - [2560, 1920, 1, 2048]
    - [381, 92.721]
  - - [1024, 3072, 1, 4096]
    - [378, 81.199]
  - - [2560, 2560, 1, 2048]
    - [75, 87.928]
  - - [2048, 2, 1, 2]
    - [260, 0.003]
  - - [1024, 64, 128, 1024]
    - [392, 75.623]
  - - [2048, 2048, 1, 2]
    - [372, 1.467]
  - - [1024, 64, 32, 1024]
    - [269, 61.178]
  - - [1024, 96, 64, 1024]
    - [330, 74.71]
  - - [1024, 30592, 1, 2048]
    - [189, 95.704]
  - - [1024, 3072, 1, 16384]
    - [374, 85.338]
  - - [6144, 1536, 1, 4096]
    - [195, 92.529]
  - - [1024, 1024, 1, 16]
    - [267, 5.709]
  - - [1536, 4608, 1, 8192]
    - [92, 92.604]
  - - [640, 2560, 1, 2048]
    - [383, 73.712]
  - - [1024, 4096, 1, 16384]
    - [99, 90.968]
  - - [64, 512, 40, 512]
    - [89, 46.868]
  - - [1024, 1024, 1, 16384]
    - [389, 77.745]
  - - [1536, 6144, 1, 4096]
    - [208, 92.708]
  - - [1024, 30592, 1, 4096]
    - [188, 96.779]
  - - [2560, 2560, 1, 4]
    - [382, 3.384]
  - - [1536, 1536, 1, 4096]
    - [384, 89.056]
  - - [2560, 7680, 1, 2048]
    - [188, 96.719]
  - - [64, 1024, 256, 1024]
    - [390, 78.198]
  - - [96, 1024, 64, 1024]
    - [386, 75.41]
  - - [1536, 50304, 1, 4096]
    - [188, 96.387]
  - - [2048, 8192, 1, 1024]
    - [196, 89.023]
  - - [1024, 30592, 1, 8192]
    - [188, 97.758]
  - - [512, 64, 256, 512]
    - [375, 64.465]
  - - [1024, 96, 128, 1024]
    - [113, 83.912]
  - - [64, 512, 128, 512]
    - [380, 58.252]
  - - [4096, 1024, 1, 16384]
    - [190, 90.171]
  - - [8192, 2048, 1, 1024]
    - [373, 88.9]
  - - [64, 1024, 64, 1024]
    - [391, 68.648]
  - - [1024, 50304, 1, 4096]
    - [80, 95.695]
  - - [1536, 4608, 1, 4096]
    - [385, 91.565]
  - - [512, 64, 128, 512]
    - [379, 58.763]
  - - [6144, 1536, 1, 8192]
    - [195, 93.353]
  - - [1024, 3072, 1, 8192]
    - [374, 83.78]
  - - [1536, 1536, 1, 8192]
    - [387, 90.914]
  - - [1536, 50304, 1, 8192]
    - [188, 96.756]
  - - [2560, 2, 1, 4]
    - [311, 0.009]
  - - [2048, 6144, 1, 1024]
    - [330, 87.377]
  - - [64, 1024, 128, 1024]
    - [282, 75.623]
  - - [1024, 64, 64, 1024]
    - [379, 68.707]
  - - [1024, 2, 1, 16]
    - [149, 0.012]
  - - [96, 1024, 128, 1024]
    - [388, 80.2]
  - - [2048, 30592, 1, 1024]
    - [205, 94.796]
  - - [64, 512, 256, 512]
    - [376, 65.356]
  - - [1536, 6144, 1, 8192]
    - [208, 93.462]
  - - [1024, 50304, 1, 2048]
    - [155, 94.519]
  - - [1024, 50304, 1, 8192]
    - [158, 96.213]
  - - [1024, 3072, 1, 2048]
    - [377, 77.544]
  - - [1024, 64, 256, 1024]
    - [375, 78.046]
  - - [1024, 50304, 1, 16384]
    - [210, 96.681]
  - - [512, 64, 40, 512]
    - [303, 47.22]
  - - [1024, 2, 1, 64]
    - [393, 0.036]
  - - [1024, 30528, 1, 8192]
    - [188, 97.49]
  - - [1024, 1024, 1, 64]
    - [394, 16.748]
  - - [64, 128, 1024, 128]
    - [395, 38.872]
  - - [128, 64, 1024, 128]
    - [396, 38.279]
  - - [1024, 1024, 1, 3456]
    - [330, 61.16]
  - - [1024, 1024, 1, 6912]
    - [307, 70.215]
  - - [1024, 1024, 1, 864]
    - [253, 49.15]
  - - [1024, 512, 1, 3456]
    - [397, 49.947]
  - - [1024, 512, 1, 4096]
    - [397, 53.236]
  - - [1024, 512, 1, 6912]
    - [398, 61.829]
  - - [1024, 512, 1, 864]
    - [394, 35.774]
  - - [256, 128, 1, 3456]
    - [399, 13.587]
  - - [256, 128, 1, 4096]
    - [400, 15.134]
  - - [256, 128, 1, 55296]
    - [401, 56.334]
  - - [256, 128, 1, 6912]
    - [402, 21.629]
  - - [256, 128, 1, 864]
    - [403, 3.812]
  - - [256, 3456, 1, 1]
    - [404, 0.325]
  - - [256, 4096, 1, 1]
    - [405, 0.344]
  - - [256, 6912, 1, 1]
    - [406, 0.494]
  - - [256, 864, 1, 1]
    - [407, 0.109]
  - - [480, 1024, 1, 3456]
    - [408, 60.792]
  - - [480, 1024, 1, 4096]
    - [408, 65.193]
  - - [480, 1024, 1, 6912]
    - [408, 74.722]
  - - [480, 1024, 1, 864]
    - [409, 35.015]
  - - [512, 256, 1, 3456]
    - [410, 33.778]
  - - [512, 256, 1, 4096]
    - [411, 37.079]
  - - [512, 256, 1, 55296]
    - [412, 82.818]
  - - [512, 256, 1, 6912]
    - [413, 49.008]
  - - [512, 256, 1, 864]
    - [414, 13.331]
  - - [30528, 1024, 1, 640]
    - [415, 91.622]
  - - [30528, 1024, 1, 1280]
    - [371, 94.003]
  - - [4096, 1024, 1, 10240]
    - [223, 89.21]
  - - [1024, 4096, 1, 10240]
    - [224, 89.648]
  - - [30528, 1024, 1, 1600]
    - [185, 94.437]
  - - [1024, 2, 1, 80]
    - [416, 0.042]
  - - [1024, 1024, 1, 10240]
    - [281, 73.534]
  - - [1024, 1024, 1, 80]
    - [417, 19.148]
  - - [64, 128, 1280, 128]
    - [300, 40.194]
  - - [128, 64, 1280, 128]
    - [418, 38.947]
  - - [1024, 4096, 1, 10496]
    - [191, 89.494]
  - - [30528, 1024, 1, 1640]
    - [185, 94.093]
  - - [4096, 1024, 1, 10496]
    - [190, 89.174]
  - - [1024, 1024, 1, 10496]
    - [308, 73.965]
  - - [1024, 1024, 1, 82]
    - [272, 17.121]
  - - [1024, 2, 1, 82]
    - [285, 0.04]
  - - [128, 64, 1312, 128]
    - [419, 39.191]
  - - [64, 128, 1312, 128]
    - [278, 40.108]
  - - [30528, 1024, 1, 160]
    - [420, 74.298]
  - - [1024, 4096, 1, 6144]
    - [190, 88.695]
  - - [30528, 1024, 1, 240]
    - [371, 82.943]
  - - [4096, 1024, 1, 6144]
    - [190, 88.647]
  - - [1024, 1024, 1, 12]
    - [267, 3.516]
  - - [1024, 2, 1, 12]
    - [260, 0.007]
  - - [1024, 1024, 1, 6144]
    - [281, 68.825]
  - - [64, 512, 192, 512]
    - [284, 62.803]
  - - [512, 64, 192, 512]
    - [375, 62.413]
  - - [13, 512, 1, 3456]
    - [487, 3.053]
  - - [13, 512, 1, 4096]
    - [488, 3.645]
  - - [13, 512, 1, 55296]
    - [471, 12.709]
  - - [13, 512, 1, 6912]
    - [488, 5.283]
  - - [13, 512, 1, 864]
    - [489, 0.882]
  - - [1024, 1024, 1, 10224]
    - [304, 72.886]
  - - [1024, 1024, 1, 10192]
    - [307, 72.552]
  - - [1024, 1024, 1, 10208]
    - [268, 73.492]
  - - [1024, 4096, 1, 10224]
    - [440, 88.687]
  - - [4096, 1024, 1, 10224]
    - [258, 88.57]
  - - [1024, 3072, 1, 10224]
    - [377, 82.484]
  - - [1024, 3072, 1, 10240]
    - [374, 84.417]
  - - [4096, 1024, 1, 10192]
    - [258, 88.743]
  - - [1024, 3072, 1, 10192]
    - [377, 82.621]
  - - [1024, 4096, 1, 10192]
    - [440, 88.714]
  - - [1024, 3072, 1, 10200]
    - [377, 82.368]
  - - [1024, 1024, 1, 10184]
    - [441, 72.759]
  - - [4096, 1024, 1, 10208]
    - [258, 89.12]
  - - [1024, 3072, 1, 10208]
    - [378, 83.279]
  - - [1024, 4096, 1, 10208]
    - [442, 88.972]
  - - [1024, 2048, 1, 10224]
    - [443, 85.805]
  - - [1024, 2048, 1, 10240]
    - [443, 86.308]
  - - [1024, 1024, 1, 10120]
    - [281, 72.699]
  - - [1024, 2048, 1, 10192]
    - [444, 85.757]
  - - [64, 24, 6816, 24]
    - [312, 8.123]
  - - [1024, 1024, 1, 10152]
    - [441, 72.69]
  - - [1024, 3072, 1, 10080]
    - [377, 83.285]
  - - [64, 26, 6272, 26]
    - [445, 8.258]
  - - [100352, 256, 1, 512]
    - [371, 86.109]
  - - [12544, 1024, 1, 2048]
    - [385, 90.626]
  - - [12544, 147, 1, 64]
    - [406, 21.238]
  - - [200704, 256, 1, 512]
    - [424, 89.948]
  - - [25088, 512, 1, 1024]
    - [425, 87.208]
  - - [3136, 576, 1, 64]
    - [370, 23.519]
  - - [50176, 512, 1, 1024]
    - [427, 89.005]
  - - [6272, 1024, 1, 2048]
    - [390, 85.809]
  - - [784, 1152, 1, 128]
    - [446, 23.266]
  - - [3136, 256, 128, 128]
    - [274, 80.876]
  - - [3136, 256, 256, 128]
    - [447, 82.433]
  - - [3136, 256, 128, 64]
    - [422, 64.447]
  - - [3136, 256, 256, 64]
    - [422, 65.756]
  - - [3136, 64, 128, 256]
    - [448, 61.825]
  - - [3136, 64, 256, 256]
    - [449, 63.697]
  - - [3136, 64, 128, 64]
    - [287, 41.698]
  - - [3136, 64, 256, 64]
    - [259, 43.867]
  - - [784, 128, 128, 512]
    - [435, 77.957]
  - - [784, 128, 256, 512]
    - [450, 81.789]
  - - [784, 512, 128, 128]
    - [274, 70.46]
  - - [784, 512, 256, 128]
    - [451, 72.772]
  - - [784, 512, 128, 256]
    - [426, 78.478]
  - - [784, 512, 256, 256]
    - [426, 79.801]
  - - [64, 128, 2048, 128]
    - [452, 40.889]
  - - [128, 64, 2048, 128]
    - [396, 40.314]
  - - [30528, 1024, 1, 2560]
    - [430, 95.04]
  - - [1024, 1024, 1, 128]
    - [453, 25.898]
  - - [1024, 2, 1, 128]
    - [454, 0.064]
  - - [128, 64, 1536, 128]
    - [455, 39.304]
  - - [64, 128, 1536, 128]
    - [278, 39.876]
  - - [1024, 4096, 1, 12288]
    - [440, 89.253]
  - - [30528, 1024, 1, 1920]
    - [456, 94.657]
  - - [1024, 1024, 1, 96]
    - [273, 22.43]
  - - [1024, 1024, 1, 12288]
    - [309, 75.082]
  - - [4096, 1024, 1, 12288]
    - [457, 89.006]
  - - [1024, 2, 1, 96]
    - [458, 0.049]
  - - [25600, 128, 25, 128]
    - [373, 80.401]
  - - [12544, 128, 36, 128]
    - [430, 78.952]
  - - [9216, 128, 49, 128]
    - [425, 78.952]
  - - [6400, 128, 64, 128]
    - [430, 78.601]
  - - [6400, 256, 25, 256]
    - [431, 87.498]
  - - [4096, 256, 36, 256]
    - [430, 85.721]
  - - [2304, 256, 49, 256]
    - [424, 86.227]
  - - [2304, 256, 64, 256]
    - [425, 85.6]
  - - [2304, 512, 25, 512]
    - [424, 91.698]
  - - [1024, 512, 36, 512]
    - [425, 87.293]
  - - [1024, 512, 49, 512]
    - [459, 86.961]
  - - [1024, 512, 64, 512]
    - [425, 88.241]
  - - [92416, 64, 25, 64]
    - [460, 44.841]
  - - [50176, 64, 36, 64]
    - [419, 44.158]
  - - [36864, 64, 49, 64]
    - [421, 44.902]
  - - [25600, 64, 64, 64]
    - [449, 44.748]
  - - [64, 128, 192, 128]
    - [459, 29.439]
  - - [128, 64, 192, 128]
    - [254, 29.21]
  - - [768, 2, 1, 2048]
    - [461, 0.494]
  - - [3072, 768, 1, 2048]
    - [462, 85.317]
  - - [768, 3072, 1, 2048]
    - [334, 85.64]
  - - [768, 768, 1, 2048]
    - [463, 48.726]
  - - [64, 384, 144, 384]
    - [437, 59.29]
  - - [384, 64, 144, 384]
    - [379, 56.273]
  - - [768, 2, 1, 4608]
    - [464, 0.907]
  - - [3072, 768, 1, 4608]
    - [387, 89.403]
  - - [768, 3072, 1, 4608]
    - [465, 89.482]
  - - [768, 768, 1, 4608]
    - [466, 63.194]
  - - [64, 512, 48, 512]
    - [439, 53.449]
  - - [512, 64, 48, 512]
    - [375, 52.702]
  - - [64, 128, 256, 128]
    - [467, 31.799]
  - - [128, 64, 256, 128]
    - [421, 31.799]
  - - [64, 384, 192, 384]
    - [468, 58.98]
  - - [384, 64, 192, 384]
    - [449, 62.226]
  - - [1024, 2, 1, 4608]
    - [469, 1.098]
  - - [4096, 1024, 1, 4608]
    - [258, 87.377]
  - - [1024, 4096, 1, 4608]
    - [258, 87.504]
  - - [1024, 1024, 1, 4608]
    - [470, 65.109]
  - - [196, 2304, 1, 256]
    - [519, 18.336]
  - - [49, 4608, 1, 512]
    - [520, 14.62]
  - - [196, 1024, 128, 256]
    - [504, 58.422]
  - - [196, 1024, 256, 256]
    - [518, 60.997]
  - - [196, 1024, 128, 512]
    - [521, 64.195]
  - - [196, 1024, 256, 512]
    - [504, 66.762]
  - - [196, 256, 128, 1024]
    - [500, 63.222]
  - - [196, 256, 256, 1024]
    - [509, 65.233]
  - - [49, 2048, 128, 512]
    - [507, 50.222]
  - - [49, 2048, 256, 512]
    - [490, 52.435]
  - - [49, 512, 128, 2048]
    - [522, 53.334]
  - - [49, 512, 256, 2048]
    - [523, 59.884]
- null
