library/src/blas3/Tensile/Logic/asm_full/arcturus_Cijk_Ailk_Bljk_BBH.yaml
- {MinimumRequiredVersion: 4.14.0}
- arcturus
- gfx908
- [Device 7380, Device 7388, Device 738c, Device 7390]
    SolutionIndex: 0
    SolutionNameMin: Cijk_Ailk_Bljk_BBH_MT64x128x8_MI32x32x2x2_SE_GRVW2_ONLL0_SNLL1
    SolutionIndex: 1
    SolutionNameMin: Cijk_Ailk_Bljk_BBH_MT64x128x16_MI32x32x2x2_SE_GRVW2_ONLL0_SNLL1
    SolutionIndex: 2
    SolutionNameMin: Cijk_Ailk_Bljk_BBH_MT64x128x8_MI32x32x2x2_SE_GRVW4_ONLL0_SNLL1
    SolutionIndex: 3
    SolutionNameMin: Cijk_Ailk_Bljk_BBH_MT64x128x16_MI32x32x2x2_SE_GRVW2_ONLL0_SNLL0
    SolutionIndex: 4
    SolutionNameMin: Cijk_Ailk_Bljk_BBH_MT64x128x8_MI32x32x2x2_SE_GRVW4_ONLL0_SNLL0
    SolutionIndex: 5
    SolutionNameMin: Cijk_Ailk_Bljk_BBH_MT64x128x8_MI32x32x2x2_SE_GRVW2_ONLL1_SNLL1
    SolutionIndex: 6
    SolutionNameMin: Cijk_Ailk_Bljk_BBH_MT64x128x16_MI32x32x2x2_SE_GRVW2_ONLL1_SNLL1
    SolutionIndex: 7
    SolutionNameMin: Cijk_Ailk_Bljk_BBH_MT64x128x32_MI32x32x2x2_SE_GRVW2_ONLL1_SNLL1
    SolutionIndex: 8
    SolutionNameMin: Cijk_Ailk_Bljk_BBH_MT64x128x8_MI32x32x2x2_SE_GRVW2_ONLL1_SNLL0
    SolutionIndex: 9
    SolutionNameMin: Cijk_Ailk_Bljk_BBH_MT64x128x16_MI32x32x2x2_SE_GRVW2_ONLL1_SNLL0
    SolutionIndex: 10
    SolutionNameMin: Cijk_Ailk_Bljk_BBH_MT64x128x8_MI32x32x2x2_SE_GRVW4_ONLL1_SNLL0
    SolutionIndex: 11
    SolutionNameMin: Cijk_Ailk_Bljk_BBH_MT32x256x16_MI32x32x2x2_SE_GRVW4_ONLL1_SNLL0
    SolutionIndex: 12
    SolutionNameMin: Cijk_Ailk_Bljk_BBH_MT64x256x16_MI32x32x2x2_SE_GRVW2_ONLL0_SNLL1
    SolutionIndex: 13
    SolutionNameMin: Cijk_Ailk_Bljk_BBH_MT64x256x16_MI32x32x2x2_SE_GRVW2_ONLL1_SNLL1
    SolutionIndex: 14
    SolutionNameMin: Cijk_Ailk_Bljk_BBH_MT64x256x16_MI32x32x2x2_SE_GRVW2_ONLL1_SNLL0
    SolutionIndex: 15
    SolutionNameMin: Cijk_Ailk_Bljk_BBH_MT64x128x8_MI32x32x2x2_SE_AF0EM1_ASEM1_GRVW2_ONLL0_SNLL1
    SolutionIndex: 16
    SolutionNameMin: Cijk_Ailk_Bljk_BBH_MT64x128x8_MI32x32x2x2_SE_AF0EM2_ASEM1_GRVW2_ONLL0_SNLL1
    SolutionIndex: 17
    SolutionNameMin: Cijk_Ailk_Bljk_BBH_MT64x128x8_MI32x32x2x2_SE_AF0EM2_ASEM1_GRVW4_ONLL0_SNLL1
    SolutionIndex: 18
    SolutionNameMin: Cijk_Ailk_Bljk_BBH_MT64x128x8_MI32x32x2x2_SE_AF0EM2_ASEM1_GRVW4_ONLL0_SNLL0
    SolutionIndex: 19
    SolutionNameMin: Cijk_Ailk_Bljk_BBH_MT64x128x8_MI32x32x2x2_SE_AF0EM1_ASEM1_GRVW4_ONLL1_SNLL1
    SolutionIndex: 20
    SolutionNameMin: Cijk_Ailk_Bljk_BBH_MT64x128x16_MI32x32x2x2_SE_AF0EM1_ASEM2_GRVW2_ONLL1_SNLL0
    SolutionIndex: 21
    SolutionNameMin: Cijk_Ailk_Bljk_BBH_MT64x128x32_MI32x32x2x2_SE_AF0EM2_ASEM1_GRVW2_ONLL1_SNLL0
    SolutionIndex: 22
    SolutionNameMin: Cijk_Ailk_Bljk_BBH_MT64x128x8_MI32x32x2x2_SE_AF0EM2_ASEM1_GRVW4_ONLL1_SNLL0
    SolutionIndex: 23
    SolutionNameMin: Cijk_Ailk_Bljk_BBH_MT64x256x8_MI32x32x2x2_SE_AF0EM2_ASEM1_GRVW2_ONLL0_SNLL0
    SolutionIndex: 24
    SolutionIndex: 25
    SolutionIndex: 26
    SolutionIndex: 27
    SolutionIndex: 28
    SolutionIndex: 29
    SolutionIndex: 30
    SolutionIndex: 31
    SolutionIndex: 32
    SolutionIndex: 33
    SolutionIndex: 34
    SolutionIndex: 35
    SolutionIndex: 36
    SolutionIndex: 37
    SolutionIndex: 38
    SolutionIndex: 39
    SolutionIndex: 40
    SolutionIndex: 41
    SolutionIndex: 42
    SolutionIndex: 43
    SolutionIndex: 44
    SolutionIndex: 45
    SolutionIndex: 46
    SolutionIndex: 47
    SolutionIndex: 48
    SolutionIndex: 49
    SolutionIndex: 50
    SolutionIndex: 51
    SolutionIndex: 52
    SolutionIndex: 53
    SolutionIndex: 54
    SolutionIndex: 55
    SolutionIndex: 56
    SolutionIndex: 57
    SolutionIndex: 58
    SolutionIndex: 59
    SolutionIndex: 60
    SolutionIndex: 61
    SolutionIndex: 62
    SolutionIndex: 63
    SolutionIndex: 64
    SolutionIndex: 65
    SolutionIndex: 66
    SolutionIndex: 67
    SolutionIndex: 68
    SolutionIndex: 69
    SolutionIndex: 70
    SolutionIndex: 71
    SolutionIndex: 72
    SolutionIndex: 73
    SolutionIndex: 74
    SolutionIndex: 75
    SolutionIndex: 76
    SolutionIndex: 77
    SolutionIndex: 78
    SolutionIndex: 79
    SolutionIndex: 80
    SolutionIndex: 81
    SolutionIndex: 82
    SolutionIndex: 83
    SolutionIndex: 84
    SolutionIndex: 85
    SolutionIndex: 86
    SolutionIndex: 87
    SolutionIndex: 88
    SolutionIndex: 89
    SolutionIndex: 90
    SolutionIndex: 91
    SolutionIndex: 92
    SolutionIndex: 93
    SolutionIndex: 94
    SolutionIndex: 95
    SolutionIndex: 96
    SolutionIndex: 97
    SolutionNameMin: Cijk_Ailk_Bljk_BBH_MT64x128x8_MI32x32x2x2_SE_GRVW2_ONLL0_SNLL1
    SolutionIndex: 98
    SolutionNameMin: Cijk_Ailk_Bljk_BBH_MT64x128x16_MI32x32x2x2_SE_GRVW2_ONLL0_SNLL1
    SolutionIndex: 99
    SolutionNameMin: Cijk_Ailk_Bljk_BBH_MT64x128x8_MI32x32x2x2_SE_GRVW4_ONLL0_SNLL1
    SolutionIndex: 100
    SolutionNameMin: Cijk_Ailk_Bljk_BBH_MT64x128x16_MI32x32x2x2_SE_GRVW2_ONLL0_SNLL0
    SolutionIndex: 101
    SolutionNameMin: Cijk_Ailk_Bljk_BBH_MT64x128x8_MI32x32x2x2_SE_GRVW4_ONLL0_SNLL0
    SolutionIndex: 102
    SolutionNameMin: Cijk_Ailk_Bljk_BBH_MT64x128x8_MI32x32x2x2_SE_GRVW2_ONLL1_SNLL1
    SolutionIndex: 103
    SolutionNameMin: Cijk_Ailk_Bljk_BBH_MT64x128x16_MI32x32x2x2_SE_GRVW2_ONLL1_SNLL1
    SolutionIndex: 104
    SolutionNameMin: Cijk_Ailk_Bljk_BBH_MT64x128x32_MI32x32x2x2_SE_GRVW2_ONLL1_SNLL1
    SolutionIndex: 105
    SolutionNameMin: Cijk_Ailk_Bljk_BBH_MT64x128x8_MI32x32x2x2_SE_GRVW2_ONLL1_SNLL0
    SolutionIndex: 106
    SolutionNameMin: Cijk_Ailk_Bljk_BBH_MT64x128x16_MI32x32x2x2_SE_GRVW2_ONLL1_SNLL0
    SolutionIndex: 107
    SolutionNameMin: Cijk_Ailk_Bljk_BBH_MT64x128x8_MI32x32x2x2_SE_GRVW4_ONLL1_SNLL0
    SolutionIndex: 108
    SolutionNameMin: Cijk_Ailk_Bljk_BBH_MT32x256x16_MI32x32x2x2_SE_GRVW4_ONLL1_SNLL0
    SolutionIndex: 109
    SolutionNameMin: Cijk_Ailk_Bljk_BBH_MT64x256x16_MI32x32x2x2_SE_GRVW2_ONLL0_SNLL1
    SolutionIndex: 110
    SolutionNameMin: Cijk_Ailk_Bljk_BBH_MT64x256x16_MI32x32x2x2_SE_GRVW2_ONLL1_SNLL1
    SolutionIndex: 111
    SolutionNameMin: Cijk_Ailk_Bljk_BBH_MT64x256x16_MI32x32x2x2_SE_GRVW2_ONLL1_SNLL0
    SolutionIndex: 112
    SolutionNameMin: Cijk_Ailk_Bljk_BBH_MT64x128x8_MI32x32x2x2_SE_AF0EM1_ASEM1_GRVW2_ONLL0_SNLL1
    SolutionIndex: 113
    SolutionNameMin: Cijk_Ailk_Bljk_BBH_MT64x128x8_MI32x32x2x2_SE_AF0EM2_ASEM1_GRVW2_ONLL0_SNLL1
    SolutionIndex: 114
    SolutionNameMin: Cijk_Ailk_Bljk_BBH_MT64x128x8_MI32x32x2x2_SE_AF0EM2_ASEM1_GRVW4_ONLL0_SNLL1
    SolutionIndex: 115
    SolutionNameMin: Cijk_Ailk_Bljk_BBH_MT64x128x8_MI32x32x2x2_SE_AF0EM2_ASEM1_GRVW4_ONLL0_SNLL0
    SolutionIndex: 116
    SolutionNameMin: Cijk_Ailk_Bljk_BBH_MT64x128x8_MI32x32x2x2_SE_AF0EM1_ASEM1_GRVW4_ONLL1_SNLL1
    SolutionIndex: 117
    SolutionNameMin: Cijk_Ailk_Bljk_BBH_MT64x128x16_MI32x32x2x2_SE_AF0EM1_ASEM2_GRVW2_ONLL1_SNLL0
    SolutionIndex: 118
    SolutionNameMin: Cijk_Ailk_Bljk_BBH_MT64x128x32_MI32x32x2x2_SE_AF0EM2_ASEM1_GRVW2_ONLL1_SNLL0
    SolutionIndex: 119
    SolutionNameMin: Cijk_Ailk_Bljk_BBH_MT64x128x8_MI32x32x2x2_SE_AF0EM2_ASEM1_GRVW4_ONLL1_SNLL0
    SolutionIndex: 120
    SolutionNameMin: Cijk_Ailk_Bljk_BBH_MT64x256x8_MI32x32x2x2_SE_AF0EM2_ASEM1_GRVW2_ONLL0_SNLL0
    SolutionIndex: 121
    SolutionIndex: 122
    SolutionIndex: 123
    SolutionIndex: 124
    SolutionIndex: 125
    SolutionIndex: 126
    SolutionIndex: 127
    SolutionIndex: 128
    SolutionIndex: 129
    SolutionIndex: 130
    SolutionIndex: 131
    SolutionIndex: 132
    SolutionIndex: 133
    SolutionIndex: 134
    SolutionIndex: 135
    SolutionIndex: 136
    SolutionIndex: 137
    SolutionIndex: 138
    SolutionIndex: 139
    SolutionIndex: 140
    SolutionIndex: 141
    SolutionIndex: 142
    SolutionIndex: 143
    SolutionIndex: 144
    SolutionIndex: 145
    SolutionIndex: 146
    SolutionIndex: 147
    SolutionIndex: 148
    SolutionIndex: 149
    SolutionIndex: 150
    SolutionIndex: 151
    SolutionIndex: 152
    SolutionIndex: 153
    SolutionIndex: 154
    SolutionIndex: 155
    SolutionIndex: 156
    SolutionIndex: 157
    SolutionIndex: 158
    SolutionIndex: 159
    SolutionIndex: 160
    SolutionIndex: 161
    SolutionIndex: 162
    SolutionIndex: 163
    SolutionIndex: 164
    SolutionIndex: 165
    SolutionIndex: 166
    SolutionIndex: 167
    SolutionIndex: 168
    SolutionIndex: 169
    SolutionIndex: 170
    SolutionIndex: 171
    SolutionIndex: 172
    SolutionIndex: 173
    SolutionIndex: 174
    SolutionIndex: 175
    SolutionIndex: 176
    SolutionIndex: 177
    SolutionIndex: 178
    SolutionIndex: 179
    SolutionIndex: 180
    SolutionIndex: 181
    SolutionIndex: 182
    SolutionIndex: 183
    SolutionIndex: 184
    SolutionIndex: 185
    SolutionIndex: 186
    SolutionIndex: 187
    SolutionIndex: 188
    SolutionIndex: 189
    SolutionIndex: 190
    SolutionIndex: 191
    SolutionIndex: 192
    SolutionIndex: 193
- - - [1024, 10200, 1, 4096]
    - [26, 0.0]
  - - [64, 15, 10880, 15]
    - [91, 0.0]
  - - [64, 30, 2048, 30]
    - [75, 0.0]
  - - [512, 1600, 1, 512]
    - [61, 0.0]
  - - [1024, 1600, 1, 1]
    - [74, 0.0]
  - - [256, 8976, 1, 4352]
    - [46, 0.0]
  - - [1024, 3240, 1, 4096]
    - [60, 0.0]
  - - [1024, 9216, 1, 1024]
    - [27, 0.0]
  - - [74, 512, 1, 2048]
    - [46, 0.0]
  - - [1024, 512, 1, 1024]
    - [29, 0.0]
  - - [512, 200, 1, 32]
    - [43, 0.0]
  - - [1024, 7200, 1, 1024]
    - [33, 0.0]
  - - [1024, 9984, 1, 256]
    - [83, 0.0]
  - - [100, 512, 1, 2048]
    - [80, 0.0]
  - - [256, 8976, 1, 15872]
    - [86, 0.0]
  - - [1024, 960, 1, 64]
    - [38, 0.0]
  - - [1024, 3328, 1, 256]
    - [90, 0.0]
  - - [1024, 1600, 1, 1024]
    - [95, 0.0]
  - - [256, 8976, 1, 26112]
    - [35, 0.0]
  - - [1024, 4096, 1, 1024]
    - [31, 0.0]
  - - [512, 512, 64, 64]
    - [72, 0.0]
  - - [64, 5, 512, 5]
    - [78, 0.0]
  - - [1024, 8960, 1, 256]
    - [55, 0.0]
  - - [4096, 3968, 1, 1024]
    - [62, 0.0]
  - - [3200, 1024, 1, 2048]
    - [88, 0.0]
  - - [1024, 4096, 1, 4096]
    - [70, 0.0]
  - - [1024, 10064, 1, 1024]
    - [83, 0.0]
  - - [512, 1600, 1, 32]
    - [45, 0.0]
  - - [256, 8976, 1, 5376]
    - [47, 0.0]
  - - [256, 8976, 1, 6144]
    - [29, 0.0]
  - - [256, 8976, 1, 19968]
    - [77, 0.0]
  - - [256, 8976, 1, 17152]
    - [80, 0.0]
  - - [256, 8976, 1, 12288]
    - [41, 0.0]
  - - [256, 8976, 1, 2048]
    - [29, 0.0]
  - - [1024, 16128, 1, 256]
    - [83, 0.0]
  - - [1024, 200, 1, 1]
    - [39, 0.0]
  - - [1024, 21504, 1, 256]
    - [83, 0.0]
  - - [64, 33, 1920, 33]
    - [91, 0.0]
  - - [64, 35, 1, 35]
    - [29, 0.0]
  - - [1024, 512, 1, 1]
    - [91, 0.0]
  - - [256, 8976, 1, 7168]
    - [93, 0.0]
  - - [1024, 4608, 1, 256]
    - [69, 0.0]
  - - [256, 8976, 1, 9472]
    - [46, 0.0]
  - - [480, 32768, 1, 1024]
    - [49, 0.0]
  - - [1024, 3960, 1, 42720]
    - [80, 0.0]
  - - [256, 8976, 1, 5632]
    - [46, 0.0]
  - - [1024, 15104, 1, 256]
    - [83, 0.0]
  - - [64, 14, 10880, 15]
    - [91, 0.0]
  - - [1024, 8064, 1, 1024]
    - [31, 0.0]
  - - [1024, 4096, 1, 256]
    - [46, 0.0]
  - - [1024, 2048, 1, 30528]
    - [26, 0.0]
  - - [256, 1024, 1, 1]
    - [30, 0.0]
  - - [1024, 960, 1, 1024]
    - [66, 0.0]
  - - [1024, 10080, 1, 4096]
    - [86, 0.0]
  - - [1024, 8448, 1, 256]
    - [69, 0.0]
  - - [256, 8976, 1, 10496]
    - [48, 0.0]
  - - [512, 32768, 1, 256]
    - [83, 0.0]
  - - [1024, 9520, 1, 4096]
    - [88, 0.0]
  - - [1024, 40448, 1, 256]
    - [83, 0.0]
  - - [1024, 2560, 1, 256]
    - [48, 0.0]
  - - [4096, 6528, 1, 1024]
    - [29, 0.0]
  - - [1024, 8704, 1, 256]
    - [27, 0.0]
  - - [1024, 14848, 1, 256]
    - [83, 0.0]
  - - [1024, 20992, 1, 256]
    - [36, 0.0]
  - - [4096, 10200, 1, 1024]
    - [47, 0.0]
  - - [4096, 8160, 1, 1024]
    - [32, 0.0]
  - - [256, 8976, 1, 20480]
    - [60, 0.0]
  - - [1024, 11264, 1, 256]
    - [83, 0.0]
  - - [64, 35, 1, 32]
    - [28, 0.0]
  - - [256, 8976, 1, 5888]
    - [47, 0.0]
  - - [1024, 22016, 1, 256]
    - [83, 0.0]
  - - [1024, 7200, 1, 42720]
    - [26, 0.0]
  - - [64, 15, 1, 15]
    - [24, 0.0]
  - - [1024, 3840, 1, 4096]
    - [88, 0.0]
  - - [64, 33, 1920, 27]
    - [92, 0.0]
  - - [1024, 7680, 1, 256]
    - [35, 0.0]
  - - [256, 8976, 1, 14848]
    - [48, 0.0]
  - - [4096, 3240, 1, 1024]
    - [56, 0.0]
  - - [768, 215, 1, 2048]
    - [48, 0.0]
  - - [4096, 4096, 1, 1024]
    - [56, 0.0]
  - - [64, 15, 1, 17]
    - [34, 0.0]
  - - [64, 512, 64, 512]
    - [68, 0.0]
  - - [64, 5, 960, 5]
    - [42, 0.0]
  - - [1024, 4864, 1, 256]
    - [55, 0.0]
  - - [4096, 1024, 1, 1]
    - [92, 0.0]
  - - [1024, 2048, 1, 2]
    - [50, 0.0]
  - - [1024, 10240, 1, 256]
    - [83, 0.0]
  - - [1024, 3840, 1, 1024]
    - [35, 0.0]
  - - [256, 8976, 1, 9984]
    - [47, 0.0]
  - - [1024, 8192, 1, 256]
    - [69, 0.0]
  - - [4096, 10080, 1, 1024]
    - [56, 0.0]
  - - [1024, 14592, 1, 256]
    - [83, 0.0]
  - - [4096, 3960, 1, 1024]
    - [56, 0.0]
  - - [2048, 512, 1, 1]
    - [87, 0.0]
  - - [64, 17, 1, 17]
    - [28, 0.0]
  - - [256, 8976, 1, 11520]
    - [93, 0.0]
  - - [1024, 2048, 1, 4096]
    - [59, 0.0]
  - - [128, 27, 32768, 27]
    - [43, 0.0]
  - - [74, 960, 1, 2048]
    - [46, 0.0]
  - - [256, 8976, 1, 11008]
    - [69, 0.0]
  - - [512, 512, 1, 64]
    - [52, 0.0]
  - - [256, 8976, 1, 3072]
    - [69, 0.0]
  - - [1024, 7104, 1, 42720]
    - [26, 0.0]
  - - [1024, 14336, 1, 256]
    - [83, 0.0]
  - - [1024, 20480, 1, 256]
    - [36, 0.0]
  - - [1024, 32768, 1, 512]
    - [83, 0.0]
  - - [1024, 17152, 1, 256]
    - [36, 0.0]
  - - [64, 30, 1, 30]
    - [24, 0.0]
  - - [32, 33, 1600, 33]
    - [91, 0.0]
  - - [1024, 8160, 1, 4096]
    - [70, 0.0]
  - - [64, 32, 1, 32]
    - [81, 0.0]
  - - [256, 8976, 1, 14336]
    - [37, 0.0]
  - - [4096, 2048, 1, 1024]
    - [62, 0.0]
  - - [128, 128, 512, 64]
    - [39, 0.0]
  - - [4096, 7200, 1, 1024]
    - [48, 0.0]
  - - [1024, 11008, 1, 256]
    - [83, 0.0]
  - - [64, 31, 2048, 31]
    - [91, 0.0]
  - - [256, 8976, 1, 44505]
    - [70, 0.0]
  - - [2048, 1024, 1, 256]
    - [48, 0.0]
  - - [64, 31, 1, 31]
    - [53, 0.0]
  - - [4096, 3840, 1, 1024]
    - [65, 0.0]
  - - [1024, 9520, 1, 42720]
    - [58, 0.0]
  - - [1024, 4, 1, 1024]
    - [48, 0.0]
  - - [64, 24, 1, 24]
    - [34, 0.0]
  - - [512, 256, 1, 2048]
    - [47, 0.0]
  - - [256, 32768, 1, 128]
    - [79, 0.0]
  - - [4096, 10064, 1, 1024]
    - [56, 0.0]
  - - [64, 17, 7680, 17]
    - [91, 0.0]
  - - [4096, 9216, 1, 1024]
    - [56, 0.0]
  - - [256, 8976, 1, 1536]
    - [69, 0.0]
  - - [256, 8976, 1, 33536]
    - [54, 0.0]
  - - [1024, 9520, 1, 1024]
    - [94, 0.0]
  - - [67, 512, 1, 2048]
    - [40, 0.0]
  - - [2048, 1024, 1, 1]
    - [50, 0.0]
  - - [64, 15, 7680, 15]
    - [91, 0.0]
  - - [512, 215, 1, 2048]
    - [71, 0.0]
  - - [1024, 7168, 1, 256]
    - [83, 0.0]
  - - [2048, 960, 1, 2048]
    - [48, 0.0]
  - - [1024, 8160, 1, 1024]
    - [44, 0.0]
  - - [1024, 11520, 1, 256]
    - [35, 0.0]
  - - [256, 8976, 1, 22016]
    - [80, 0.0]
  - - [512, 200, 1, 1]
    - [39, 0.0]
  - - [256, 8976, 1, 9728]
    - [84, 0.0]
  - - [1024, 10200, 1, 1024]
    - [83, 0.0]
  - - [1024, 33536, 1, 256]
    - [35, 0.0]
  - - [1024, 6144, 1, 256]
    - [83, 0.0]
  - - [1024, 6528, 1, 1024]
    - [83, 0.0]
  - - [1600, 512, 1, 1024]
    - [46, 0.0]
  - - [1024, 10496, 1, 256]
    - [83, 0.0]
  - - [64, 512, 1, 1]
    - [57, 0.0]
  - - [256, 8976, 1, 15104]
    - [64, 0.0]
  - - [1024, 10064, 1, 4096]
    - [54, 0.0]
  - - [1024, 9728, 1, 256]
    - [83, 0.0]
  - - [1024, 8064, 1, 4096]
    - [88, 0.0]
  - - [1024, 3240, 1, 1024]
    - [35, 0.0]
  - - [256, 8976, 1, 2304]
    - [46, 0.0]
  - - [1024, 7936, 1, 256]
    - [46, 0.0]
  - - [768, 256, 1, 2048]
    - [47, 0.0]
  - - [1024, 6528, 1, 4096]
    - [73, 0.0]
  - - [1024, 32, 1, 2]
    - [34, 0.0]
  - - [2048, 512, 1, 2048]
    - [96, 0.0]
  - - [1024, 10080, 1, 42720]
    - [26, 0.0]
  - - [1024, 32, 1, 1024]
    - [29, 0.0]
  - - [1024, 5120, 1, 256]
    - [55, 0.0]
  - - [64, 15, 7680, 17]
    - [91, 0.0]
  - - [256, 8976, 1, 8192]
    - [56, 0.0]
  - - [1024, 7104, 1, 1024]
    - [35, 0.0]
  - - [1024, 2048, 1, 1024]
    - [47, 0.0]
  - - [64, 15, 1, 15]
    - [39, 0.0]
  - - [256, 8976, 1, 8448]
    - [47, 0.0]
  - - [64, 17, 1, 17]
    - [28, 0.0]
  - - [1024, 32768, 1, 1024]
    - [33, 0.0]
  - - [64, 14, 10880, 14]
    - [91, 0.0]
  - - [1024, 28672, 1, 256]
    - [35, 0.0]
  - - [1024, 12288, 1, 256]
    - [46, 0.0]
  - - [64, 34, 1, 34]
    - [28, 0.0]
  - - [256, 8976, 1, 8960]
    - [48, 0.0]
  - - [256, 8976, 1, 2560]
    - [93, 0.0]
  - - [256, 8976, 1, 19712]
    - [89, 0.0]
  - - [256, 8976, 1, 4864]
    - [93, 0.0]
  - - [64, 14, 1, 15]
    - [24, 0.0]
  - - [4096, 8064, 1, 1024]
    - [31, 0.0]
  - - [1024, 9216, 1, 4096]
    - [60, 0.0]
  - - [64, 31, 2048, 30]
    - [91, 0.0]
  - - [1024, 3968, 1, 1024]
    - [46, 0.0]
  - - [4096, 7104, 1, 1024]
    - [56, 0.0]
  - - [256, 8976, 1, 6656]
    - [93, 0.0]
  - - [1024, 7104, 1, 4096]
    - [60, 0.0]
  - - [64, 17, 1, 21]
    - [24, 0.0]
  - - [1024, 3072, 1, 256]
    - [83, 0.0]
  - - [64, 14, 1, 14]
    - [24, 0.0]
  - - [1024, 4096, 1, 30528]
    - [26, 0.0]
  - - [1024, 10080, 1, 1024]
    - [35, 0.0]
  - - [1024, 7424, 1, 256]
    - [83, 0.0]
  - - [256, 8976, 1, 20992]
    - [80, 0.0]
  - - [257, 1024, 1, 4096]
    - [40, 0.0]
  - - [4096, 9520, 1, 1024]
    - [56, 0.0]
  - - [1024, 18944, 1, 256]
    - [35, 0.0]
  - - [256, 8976, 1, 2816]
    - [47, 0.0]
  - - [1024, 19968, 1, 256]
    - [35, 0.0]
  - - [1024, 2048, 1, 256]
    - [44, 0.0]
  - - [560, 1600, 1, 1024]
    - [82, 0.0]
  - - [1024, 7200, 1, 4096]
    - [59, 0.0]
  - - [1024, 1792, 1, 256]
    - [26, 0.0]
  - - [1024, 6400, 1, 256]
    - [48, 0.0]
  - - [1024, 3960, 1, 4096]
    - [49, 0.0]
  - - [64, 9, 512, 9]
    - [67, 0.0]
  - - [256, 8976, 1, 7424]
    - [93, 0.0]
  - - [560, 200, 1, 1024]
    - [71, 0.0]
  - - [1024, 5632, 1, 256]
    - [27, 0.0]
  - - [64, 27, 1920, 27]
    - [91, 0.0]
  - - [1024, 3968, 1, 4096]
    - [49, 0.0]
  - - [64, 24, 1, 34]
    - [85, 0.0]
  - - [1024, 3840, 1, 256]
    - [83, 0.0]
  - - [1024, 13312, 1, 256]
    - [51, 0.0]
  - - [64, 21, 1, 21]
    - [29, 0.0]
  - - [64, 3, 512, 3]
    - [75, 0.0]
  - - [1024, 512, 1, 64]
    - [91, 0.0]
  - - [1024, 23552, 1, 256]
    - [83, 0.0]
  - - [1024, 13568, 1, 256]
    - [83, 0.0]
  - - [1024, 4, 1, 2]
    - [24, 0.0]
  - - [256, 8976, 1, 10240]
    - [41, 0.0]
  - - [1024, 6528, 1, 42720]
    - [70, 0.0]
  - - [1024, 19712, 1, 256]
    - [83, 0.0]
  - - [32, 200, 1, 1]
    - [24, 0.0]
  - - [64, 512, 1, 512]
    - [25, 0.0]
  - - [1024, 3960, 1, 1024]
    - [48, 0.0]
  - - [64, 128, 512, 128]
    - [63, 0.0]
  - - [64, 31, 1, 30]
    - [76, 0.0]
  - - [1024, 3968, 1, 42720]
    - [40, 0.0]
  - - [1024, 10200, 1, 4096]
    - [123, 0.0]
  - - [64, 15, 10880, 15]
    - [188, 0.0]
  - - [64, 30, 2048, 30]
    - [172, 0.0]
  - - [512, 1600, 1, 512]
    - [158, 0.0]
  - - [1024, 1600, 1, 1]
    - [171, 0.0]
  - - [256, 8976, 1, 4352]
    - [143, 0.0]
  - - [1024, 3240, 1, 4096]
    - [157, 0.0]
  - - [1024, 9216, 1, 1024]
    - [124, 0.0]
  - - [74, 512, 1, 2048]
    - [143, 0.0]
  - - [1024, 512, 1, 1024]
    - [126, 0.0]
  - - [512, 200, 1, 32]
    - [140, 0.0]
  - - [1024, 7200, 1, 1024]
    - [130, 0.0]
  - - [1024, 9984, 1, 256]
    - [180, 0.0]
  - - [100, 512, 1, 2048]
    - [177, 0.0]
  - - [256, 8976, 1, 15872]
    - [183, 0.0]
  - - [1024, 960, 1, 64]
    - [135, 0.0]
  - - [1024, 3328, 1, 256]
    - [187, 0.0]
  - - [1024, 1600, 1, 1024]
    - [192, 0.0]
  - - [256, 8976, 1, 26112]
    - [132, 0.0]
  - - [1024, 4096, 1, 1024]
    - [128, 0.0]
  - - [512, 512, 64, 64]
    - [169, 0.0]
  - - [64, 5, 512, 5]
    - [175, 0.0]
  - - [1024, 8960, 1, 256]
    - [152, 0.0]
  - - [4096, 3968, 1, 1024]
    - [159, 0.0]
  - - [3200, 1024, 1, 2048]
    - [185, 0.0]
  - - [1024, 4096, 1, 4096]
    - [167, 0.0]
  - - [1024, 10064, 1, 1024]
    - [180, 0.0]
  - - [512, 1600, 1, 32]
    - [142, 0.0]
  - - [256, 8976, 1, 5376]
    - [144, 0.0]
  - - [256, 8976, 1, 6144]
    - [126, 0.0]
  - - [256, 8976, 1, 19968]
    - [174, 0.0]
  - - [256, 8976, 1, 17152]
    - [177, 0.0]
  - - [256, 8976, 1, 12288]
    - [138, 0.0]
  - - [256, 8976, 1, 2048]
    - [126, 0.0]
  - - [1024, 16128, 1, 256]
    - [180, 0.0]
  - - [1024, 200, 1, 1]
    - [136, 0.0]
  - - [1024, 21504, 1, 256]
    - [180, 0.0]
  - - [64, 33, 1920, 33]
    - [188, 0.0]
  - - [64, 35, 1, 35]
    - [126, 0.0]
  - - [1024, 512, 1, 1]
    - [188, 0.0]
  - - [256, 8976, 1, 7168]
    - [190, 0.0]
  - - [1024, 4608, 1, 256]
    - [166, 0.0]
  - - [256, 8976, 1, 9472]
    - [143, 0.0]
  - - [480, 32768, 1, 1024]
    - [146, 0.0]
  - - [1024, 3960, 1, 42720]
    - [177, 0.0]
  - - [256, 8976, 1, 5632]
    - [143, 0.0]
  - - [1024, 15104, 1, 256]
    - [180, 0.0]
  - - [64, 14, 10880, 15]
    - [188, 0.0]
  - - [1024, 8064, 1, 1024]
    - [128, 0.0]
  - - [1024, 4096, 1, 256]
    - [143, 0.0]
  - - [1024, 2048, 1, 30528]
    - [123, 0.0]
  - - [256, 1024, 1, 1]
    - [127, 0.0]
  - - [1024, 960, 1, 1024]
    - [163, 0.0]
  - - [1024, 10080, 1, 4096]
    - [183, 0.0]
  - - [1024, 8448, 1, 256]
    - [166, 0.0]
  - - [256, 8976, 1, 10496]
    - [145, 0.0]
  - - [512, 32768, 1, 256]
    - [180, 0.0]
  - - [1024, 9520, 1, 4096]
    - [185, 0.0]
  - - [1024, 40448, 1, 256]
    - [180, 0.0]
  - - [1024, 2560, 1, 256]
    - [145, 0.0]
  - - [4096, 6528, 1, 1024]
    - [126, 0.0]
  - - [1024, 8704, 1, 256]
    - [124, 0.0]
  - - [1024, 14848, 1, 256]
    - [180, 0.0]
  - - [1024, 20992, 1, 256]
    - [133, 0.0]
  - - [4096, 10200, 1, 1024]
    - [144, 0.0]
  - - [4096, 8160, 1, 1024]
    - [129, 0.0]
  - - [256, 8976, 1, 20480]
    - [157, 0.0]
  - - [1024, 11264, 1, 256]
    - [180, 0.0]
  - - [64, 35, 1, 32]
    - [125, 0.0]
  - - [256, 8976, 1, 5888]
    - [144, 0.0]
  - - [1024, 22016, 1, 256]
    - [180, 0.0]
  - - [1024, 7200, 1, 42720]
    - [123, 0.0]
  - - [64, 15, 1, 15]
    - [121, 0.0]
  - - [1024, 3840, 1, 4096]
    - [185, 0.0]
  - - [64, 33, 1920, 27]
    - [189, 0.0]
  - - [1024, 7680, 1, 256]
    - [132, 0.0]
  - - [256, 8976, 1, 14848]
    - [145, 0.0]
  - - [4096, 3240, 1, 1024]
    - [153, 0.0]
  - - [768, 215, 1, 2048]
    - [145, 0.0]
  - - [4096, 4096, 1, 1024]
    - [153, 0.0]
  - - [64, 15, 1, 17]
    - [131, 0.0]
  - - [64, 512, 64, 512]
    - [165, 0.0]
  - - [64, 5, 960, 5]
    - [139, 0.0]
  - - [1024, 4864, 1, 256]
    - [152, 0.0]
  - - [4096, 1024, 1, 1]
    - [189, 0.0]
  - - [1024, 2048, 1, 2]
    - [147, 0.0]
  - - [1024, 10240, 1, 256]
    - [180, 0.0]
  - - [1024, 3840, 1, 1024]
    - [132, 0.0]
  - - [256, 8976, 1, 9984]
    - [144, 0.0]
  - - [1024, 8192, 1, 256]
    - [166, 0.0]
  - - [4096, 10080, 1, 1024]
    - [153, 0.0]
  - - [1024, 14592, 1, 256]
    - [180, 0.0]
  - - [4096, 3960, 1, 1024]
    - [153, 0.0]
  - - [2048, 512, 1, 1]
    - [184, 0.0]
  - - [64, 17, 1, 17]
    - [125, 0.0]
  - - [256, 8976, 1, 11520]
    - [190, 0.0]
  - - [1024, 2048, 1, 4096]
    - [156, 0.0]
  - - [128, 27, 32768, 27]
    - [140, 0.0]
  - - [74, 960, 1, 2048]
    - [143, 0.0]
  - - [256, 8976, 1, 11008]
    - [166, 0.0]
  - - [512, 512, 1, 64]
    - [149, 0.0]
  - - [256, 8976, 1, 3072]
    - [166, 0.0]
  - - [1024, 7104, 1, 42720]
    - [123, 0.0]
  - - [1024, 14336, 1, 256]
    - [180, 0.0]
  - - [1024, 20480, 1, 256]
    - [133, 0.0]
  - - [1024, 32768, 1, 512]
    - [180, 0.0]
  - - [1024, 17152, 1, 256]
    - [133, 0.0]
  - - [64, 30, 1, 30]
    - [121, 0.0]
  - - [32, 33, 1600, 33]
    - [188, 0.0]
  - - [1024, 8160, 1, 4096]
    - [167, 0.0]
  - - [64, 32, 1, 32]
    - [178, 0.0]
  - - [256, 8976, 1, 14336]
    - [134, 0.0]
  - - [4096, 2048, 1, 1024]
    - [159, 0.0]
  - - [128, 128, 512, 64]
    - [136, 0.0]
  - - [4096, 7200, 1, 1024]
    - [145, 0.0]
  - - [1024, 11008, 1, 256]
    - [180, 0.0]
  - - [64, 31, 2048, 31]
    - [188, 0.0]
  - - [256, 8976, 1, 44505]
    - [167, 0.0]
  - - [2048, 1024, 1, 256]
    - [145, 0.0]
  - - [64, 31, 1, 31]
    - [150, 0.0]
  - - [4096, 3840, 1, 1024]
    - [162, 0.0]
  - - [1024, 9520, 1, 42720]
    - [155, 0.0]
  - - [1024, 4, 1, 1024]
    - [145, 0.0]
  - - [64, 24, 1, 24]
    - [131, 0.0]
  - - [512, 256, 1, 2048]
    - [144, 0.0]
  - - [256, 32768, 1, 128]
    - [176, 0.0]
  - - [4096, 10064, 1, 1024]
    - [153, 0.0]
  - - [64, 17, 7680, 17]
    - [188, 0.0]
  - - [4096, 9216, 1, 1024]
    - [153, 0.0]
  - - [256, 8976, 1, 1536]
    - [166, 0.0]
  - - [256, 8976, 1, 33536]
    - [151, 0.0]
  - - [1024, 9520, 1, 1024]
    - [191, 0.0]
  - - [67, 512, 1, 2048]
    - [137, 0.0]
  - - [2048, 1024, 1, 1]
    - [147, 0.0]
  - - [64, 15, 7680, 15]
    - [188, 0.0]
  - - [512, 215, 1, 2048]
    - [168, 0.0]
  - - [1024, 7168, 1, 256]
    - [180, 0.0]
  - - [2048, 960, 1, 2048]
    - [145, 0.0]
  - - [1024, 8160, 1, 1024]
    - [141, 0.0]
  - - [1024, 11520, 1, 256]
    - [132, 0.0]
  - - [256, 8976, 1, 22016]
    - [177, 0.0]
  - - [512, 200, 1, 1]
    - [136, 0.0]
  - - [256, 8976, 1, 9728]
    - [181, 0.0]
  - - [1024, 10200, 1, 1024]
    - [180, 0.0]
  - - [1024, 33536, 1, 256]
    - [132, 0.0]
  - - [1024, 6144, 1, 256]
    - [180, 0.0]
  - - [1024, 6528, 1, 1024]
    - [180, 0.0]
  - - [1600, 512, 1, 1024]
    - [143, 0.0]
  - - [1024, 10496, 1, 256]
    - [180, 0.0]
  - - [64, 512, 1, 1]
    - [154, 0.0]
  - - [256, 8976, 1, 15104]
    - [161, 0.0]
  - - [1024, 10064, 1, 4096]
    - [151, 0.0]
  - - [1024, 9728, 1, 256]
    - [180, 0.0]
  - - [1024, 8064, 1, 4096]
    - [185, 0.0]
  - - [1024, 3240, 1, 1024]
    - [132, 0.0]
  - - [256, 8976, 1, 2304]
    - [143, 0.0]
  - - [1024, 7936, 1, 256]
    - [143, 0.0]
  - - [768, 256, 1, 2048]
    - [144, 0.0]
  - - [1024, 6528, 1, 4096]
    - [170, 0.0]
  - - [1024, 32, 1, 2]
    - [131, 0.0]
  - - [2048, 512, 1, 2048]
    - [193, 0.0]
  - - [1024, 10080, 1, 42720]
    - [123, 0.0]
  - - [1024, 32, 1, 1024]
    - [126, 0.0]
  - - [1024, 5120, 1, 256]
    - [152, 0.0]
  - - [64, 15, 7680, 17]
    - [188, 0.0]
  - - [256, 8976, 1, 8192]
    - [153, 0.0]
  - - [1024, 7104, 1, 1024]
    - [132, 0.0]
  - - [1024, 2048, 1, 1024]
    - [144, 0.0]
  - - [64, 15, 1, 15]
    - [136, 0.0]
  - - [256, 8976, 1, 8448]
    - [144, 0.0]
  - - [64, 17, 1, 17]
    - [125, 0.0]
  - - [1024, 32768, 1, 1024]
    - [130, 0.0]
  - - [64, 14, 10880, 14]
    - [188, 0.0]
  - - [1024, 28672, 1, 256]
    - [132, 0.0]
  - - [1024, 12288, 1, 256]
    - [143, 0.0]
  - - [64, 34, 1, 34]
    - [125, 0.0]
  - - [256, 8976, 1, 8960]
    - [145, 0.0]
  - - [256, 8976, 1, 2560]
    - [190, 0.0]
  - - [256, 8976, 1, 19712]
    - [186, 0.0]
  - - [256, 8976, 1, 4864]
    - [190, 0.0]
  - - [64, 14, 1, 15]
    - [121, 0.0]
  - - [4096, 8064, 1, 1024]
    - [128, 0.0]
  - - [1024, 9216, 1, 4096]
    - [157, 0.0]
  - - [64, 31, 2048, 30]
    - [188, 0.0]
  - - [1024, 3968, 1, 1024]
    - [143, 0.0]
  - - [4096, 7104, 1, 1024]
    - [153, 0.0]
  - - [256, 8976, 1, 6656]
    - [190, 0.0]
  - - [1024, 7104, 1, 4096]
    - [157, 0.0]
  - - [64, 17, 1, 21]
    - [121, 0.0]
  - - [1024, 3072, 1, 256]
    - [180, 0.0]
  - - [64, 14, 1, 14]
    - [121, 0.0]
  - - [1024, 4096, 1, 30528]
    - [123, 0.0]
  - - [1024, 10080, 1, 1024]
    - [132, 0.0]
  - - [1024, 7424, 1, 256]
    - [180, 0.0]
  - - [256, 8976, 1, 20992]
    - [177, 0.0]
  - - [257, 1024, 1, 4096]
    - [137, 0.0]
  - - [4096, 9520, 1, 1024]
    - [153, 0.0]
  - - [1024, 18944, 1, 256]
    - [132, 0.0]
  - - [256, 8976, 1, 2816]
    - [144, 0.0]
  - - [1024, 19968, 1, 256]
    - [132, 0.0]
  - - [1024, 2048, 1, 256]
    - [141, 0.0]
  - - [560, 1600, 1, 1024]
    - [179, 0.0]
  - - [1024, 7200, 1, 4096]
    - [156, 0.0]
  - - [1024, 1792, 1, 256]
    - [123, 0.0]
  - - [1024, 6400, 1, 256]
    - [145, 0.0]
  - - [1024, 3960, 1, 4096]
    - [146, 0.0]
  - - [64, 9, 512, 9]
    - [164, 0.0]
  - - [256, 8976, 1, 7424]
    - [190, 0.0]
  - - [560, 200, 1, 1024]
    - [168, 0.0]
  - - [1024, 5632, 1, 256]
    - [124, 0.0]
  - - [64, 27, 1920, 27]
    - [188, 0.0]
  - - [1024, 3968, 1, 4096]
    - [146, 0.0]
  - - [64, 24, 1, 34]
    - [182, 0.0]
  - - [1024, 3840, 1, 256]
    - [180, 0.0]
  - - [1024, 13312, 1, 256]
    - [148, 0.0]
  - - [64, 21, 1, 21]
    - [126, 0.0]
  - - [64, 3, 512, 3]
    - [172, 0.0]
  - - [1024, 512, 1, 64]
    - [188, 0.0]
  - - [1024, 23552, 1, 256]
    - [180, 0.0]
  - - [1024, 13568, 1, 256]
    - [180, 0.0]
  - - [1024, 4, 1, 2]
    - [121, 0.0]
  - - [256, 8976, 1, 10240]
    - [138, 0.0]
  - - [1024, 6528, 1, 42720]
    - [167, 0.0]
  - - [1024, 19712, 1, 256]
    - [180, 0.0]
  - - [32, 200, 1, 1]
    - [121, 0.0]
  - - [64, 512, 1, 512]
    - [122, 0.0]
  - - [1024, 3960, 1, 1024]
    - [145, 0.0]
  - - [64, 128, 512, 128]
    - [160, 0.0]
  - - [64, 31, 1, 30]
    - [173, 0.0]
  - - [1024, 3968, 1, 42720]
    - [137, 0.0]
- null
