library/src/blas3/Tensile/Logic/asm_full/arcturus_Cijk_Ailk_Bljk_BBH.yaml
- {MinimumRequiredVersion: 4.14.0}
- arcturus
- gfx908
- [Device 7380, Device 7388, Device 738c, Device 7390]
    SolutionIndex: 0
    SolutionNameMin: Cijk_Ailk_Bljk_BBH_MT64x128x8_MI32x32x2x2_SE_GRVW2_ONLL0_SNLL1
    SolutionIndex: 1
    SolutionNameMin: Cijk_Ailk_Bljk_BBH_MT64x128x16_MI32x32x2x2_SE_GRVW2_ONLL0_SNLL1
    SolutionIndex: 2
    SolutionNameMin: Cijk_Ailk_Bljk_BBH_MT64x128x8_MI32x32x2x2_SE_GRVW4_ONLL0_SNLL1
    SolutionIndex: 3
    SolutionNameMin: Cijk_Ailk_Bljk_BBH_MT64x128x16_MI32x32x2x2_SE_GRVW2_ONLL0_SNLL0
    SolutionIndex: 4
    SolutionNameMin: Cijk_Ailk_Bljk_BBH_MT64x128x8_MI32x32x2x2_SE_GRVW4_ONLL0_SNLL0
    SolutionIndex: 5
    SolutionNameMin: Cijk_Ailk_Bljk_BBH_MT64x128x8_MI32x32x2x2_SE_GRVW2_ONLL1_SNLL1
    SolutionIndex: 6
    SolutionNameMin: Cijk_Ailk_Bljk_BBH_MT64x128x16_MI32x32x2x2_SE_GRVW2_ONLL1_SNLL1
    SolutionIndex: 7
    SolutionNameMin: Cijk_Ailk_Bljk_BBH_MT64x128x32_MI32x32x2x2_SE_GRVW2_ONLL1_SNLL1
    SolutionIndex: 8
    SolutionNameMin: Cijk_Ailk_Bljk_BBH_MT64x128x8_MI32x32x2x2_SE_GRVW2_ONLL1_SNLL0
    SolutionIndex: 9
    SolutionNameMin: Cijk_Ailk_Bljk_BBH_MT64x128x16_MI32x32x2x2_SE_GRVW2_ONLL1_SNLL0
    SolutionIndex: 10
    SolutionNameMin: Cijk_Ailk_Bljk_BBH_MT64x128x8_MI32x32x2x2_SE_GRVW4_ONLL1_SNLL0
    SolutionIndex: 11
    SolutionNameMin: Cijk_Ailk_Bljk_BBH_MT32x256x16_MI32x32x2x2_SE_GRVW4_ONLL1_SNLL0
    SolutionIndex: 12
    SolutionNameMin: Cijk_Ailk_Bljk_BBH_MT64x256x16_MI32x32x2x2_SE_GRVW2_ONLL0_SNLL1
    SolutionIndex: 13
    SolutionNameMin: Cijk_Ailk_Bljk_BBH_MT64x256x16_MI32x32x2x2_SE_GRVW2_ONLL1_SNLL1
    SolutionIndex: 14
    SolutionNameMin: Cijk_Ailk_Bljk_BBH_MT64x256x16_MI32x32x2x2_SE_GRVW2_ONLL1_SNLL0
    SolutionIndex: 15
    SolutionNameMin: Cijk_Ailk_Bljk_BBH_MT64x128x8_MI32x32x2x2_SE_AF0EM1_ASEM1_GRVW2_ONLL0_SNLL1
    SolutionIndex: 16
    SolutionNameMin: Cijk_Ailk_Bljk_BBH_MT64x128x8_MI32x32x2x2_SE_AF0EM2_ASEM1_GRVW2_ONLL0_SNLL1
    SolutionIndex: 17
    SolutionNameMin: Cijk_Ailk_Bljk_BBH_MT64x128x8_MI32x32x2x2_SE_AF0EM2_ASEM1_GRVW4_ONLL0_SNLL1
    SolutionIndex: 18
    SolutionNameMin: Cijk_Ailk_Bljk_BBH_MT64x128x8_MI32x32x2x2_SE_AF0EM2_ASEM1_GRVW4_ONLL0_SNLL0
    SolutionIndex: 19
    SolutionNameMin: Cijk_Ailk_Bljk_BBH_MT64x128x8_MI32x32x2x2_SE_AF0EM1_ASEM1_GRVW4_ONLL1_SNLL1
    SolutionIndex: 20
    SolutionNameMin: Cijk_Ailk_Bljk_BBH_MT64x128x16_MI32x32x2x2_SE_AF0EM1_ASEM2_GRVW2_ONLL1_SNLL0
    SolutionIndex: 21
    SolutionNameMin: Cijk_Ailk_Bljk_BBH_MT64x128x32_MI32x32x2x2_SE_AF0EM2_ASEM1_GRVW2_ONLL1_SNLL0
    SolutionIndex: 22
    SolutionNameMin: Cijk_Ailk_Bljk_BBH_MT64x128x8_MI32x32x2x2_SE_AF0EM2_ASEM1_GRVW4_ONLL1_SNLL0
    SolutionIndex: 23
    SolutionNameMin: Cijk_Ailk_Bljk_BBH_MT64x256x8_MI32x32x2x2_SE_AF0EM2_ASEM1_GRVW2_ONLL0_SNLL0
    SolutionIndex: 24
    SolutionIndex: 25
    SolutionIndex: 26
    SolutionIndex: 27
    SolutionIndex: 28
    SolutionIndex: 29
    SolutionIndex: 30
    SolutionIndex: 31
    SolutionIndex: 32
    SolutionIndex: 33
    SolutionIndex: 34
    SolutionIndex: 35
    SolutionIndex: 36
    SolutionIndex: 37
    SolutionIndex: 38
    SolutionIndex: 39
    SolutionIndex: 40
    SolutionIndex: 41
    SolutionIndex: 42
    SolutionIndex: 43
    SolutionIndex: 44
    SolutionIndex: 45
    SolutionIndex: 46
    SolutionIndex: 47
    SolutionIndex: 48
    SolutionIndex: 49
    SolutionIndex: 50
    SolutionIndex: 51
    SolutionIndex: 52
    SolutionIndex: 53
    SolutionIndex: 54
    SolutionIndex: 55
    SolutionIndex: 56
    SolutionIndex: 57
    SolutionIndex: 58
    SolutionIndex: 59
    SolutionIndex: 60
    SolutionIndex: 61
    SolutionIndex: 62
    SolutionIndex: 63
    SolutionIndex: 64
    SolutionIndex: 65
    SolutionIndex: 66
    SolutionIndex: 67
    SolutionIndex: 68
    SolutionIndex: 69
    SolutionIndex: 70
    SolutionIndex: 71
    SolutionIndex: 72
    SolutionIndex: 73
    SolutionIndex: 74
    SolutionIndex: 75
    SolutionIndex: 76
    SolutionIndex: 77
    SolutionIndex: 78
    SolutionIndex: 79
    SolutionIndex: 80
    SolutionIndex: 81
    SolutionIndex: 82
    SolutionIndex: 83
    SolutionIndex: 84
    SolutionIndex: 85
    SolutionIndex: 86
    SolutionIndex: 87
    SolutionIndex: 88
    SolutionIndex: 89
    SolutionIndex: 90
    SolutionIndex: 91
    SolutionIndex: 92
    SolutionIndex: 93
    SolutionIndex: 94
    SolutionIndex: 95
    SolutionIndex: 96
    SolutionIndex: 97
    SolutionNameMin: Cijk_Ailk_Bljk_BBH_MT64x128x8_MI32x32x2x2_SE_GRVW2_ONLL0_SNLL1
    SolutionIndex: 98
    SolutionNameMin: Cijk_Ailk_Bljk_BBH_MT64x128x16_MI32x32x2x2_SE_GRVW2_ONLL0_SNLL1
    SolutionIndex: 99
    SolutionNameMin: Cijk_Ailk_Bljk_BBH_MT64x128x8_MI32x32x2x2_SE_GRVW4_ONLL0_SNLL1
    SolutionIndex: 100
    SolutionNameMin: Cijk_Ailk_Bljk_BBH_MT64x128x16_MI32x32x2x2_SE_GRVW2_ONLL0_SNLL0
    SolutionIndex: 101
    SolutionNameMin: Cijk_Ailk_Bljk_BBH_MT64x128x8_MI32x32x2x2_SE_GRVW4_ONLL0_SNLL0
    SolutionIndex: 102
    SolutionNameMin: Cijk_Ailk_Bljk_BBH_MT64x128x8_MI32x32x2x2_SE_GRVW2_ONLL1_SNLL1
    SolutionIndex: 103
    SolutionNameMin: Cijk_Ailk_Bljk_BBH_MT64x128x16_MI32x32x2x2_SE_GRVW2_ONLL1_SNLL1
    SolutionIndex: 104
    SolutionNameMin: Cijk_Ailk_Bljk_BBH_MT64x128x32_MI32x32x2x2_SE_GRVW2_ONLL1_SNLL1
    SolutionIndex: 105
    SolutionNameMin: Cijk_Ailk_Bljk_BBH_MT64x128x8_MI32x32x2x2_SE_GRVW2_ONLL1_SNLL0
    SolutionIndex: 106
    SolutionNameMin: Cijk_Ailk_Bljk_BBH_MT64x128x16_MI32x32x2x2_SE_GRVW2_ONLL1_SNLL0
    SolutionIndex: 107
    SolutionNameMin: Cijk_Ailk_Bljk_BBH_MT64x128x8_MI32x32x2x2_SE_GRVW4_ONLL1_SNLL0
    SolutionIndex: 108
    SolutionNameMin: Cijk_Ailk_Bljk_BBH_MT32x256x16_MI32x32x2x2_SE_GRVW4_ONLL1_SNLL0
    SolutionIndex: 109
    SolutionNameMin: Cijk_Ailk_Bljk_BBH_MT64x256x16_MI32x32x2x2_SE_GRVW2_ONLL0_SNLL1
    SolutionIndex: 110
    SolutionNameMin: Cijk_Ailk_Bljk_BBH_MT64x256x16_MI32x32x2x2_SE_GRVW2_ONLL1_SNLL1
    SolutionIndex: 111
    SolutionNameMin: Cijk_Ailk_Bljk_BBH_MT64x256x16_MI32x32x2x2_SE_GRVW2_ONLL1_SNLL0
    SolutionIndex: 112
    SolutionNameMin: Cijk_Ailk_Bljk_BBH_MT64x128x8_MI32x32x2x2_SE_AF0EM1_ASEM1_GRVW2_ONLL0_SNLL1
    SolutionIndex: 113
    SolutionNameMin: Cijk_Ailk_Bljk_BBH_MT64x128x8_MI32x32x2x2_SE_AF0EM2_ASEM1_GRVW2_ONLL0_SNLL1
    SolutionIndex: 114
    SolutionNameMin: Cijk_Ailk_Bljk_BBH_MT64x128x8_MI32x32x2x2_SE_AF0EM2_ASEM1_GRVW4_ONLL0_SNLL1
    SolutionIndex: 115
    SolutionNameMin: Cijk_Ailk_Bljk_BBH_MT64x128x8_MI32x32x2x2_SE_AF0EM2_ASEM1_GRVW4_ONLL0_SNLL0
    SolutionIndex: 116
    SolutionNameMin: Cijk_Ailk_Bljk_BBH_MT64x128x8_MI32x32x2x2_SE_AF0EM1_ASEM1_GRVW4_ONLL1_SNLL1
    SolutionIndex: 117
    SolutionNameMin: Cijk_Ailk_Bljk_BBH_MT64x128x16_MI32x32x2x2_SE_AF0EM1_ASEM2_GRVW2_ONLL1_SNLL0
    SolutionIndex: 118
    SolutionNameMin: Cijk_Ailk_Bljk_BBH_MT64x128x32_MI32x32x2x2_SE_AF0EM2_ASEM1_GRVW2_ONLL1_SNLL0
    SolutionIndex: 119
    SolutionNameMin: Cijk_Ailk_Bljk_BBH_MT64x128x8_MI32x32x2x2_SE_AF0EM2_ASEM1_GRVW4_ONLL1_SNLL0
    SolutionIndex: 120
    SolutionNameMin: Cijk_Ailk_Bljk_BBH_MT64x256x8_MI32x32x2x2_SE_AF0EM2_ASEM1_GRVW2_ONLL0_SNLL0
    SolutionIndex: 121
    SolutionIndex: 122
    SolutionIndex: 123
    SolutionIndex: 124
    SolutionIndex: 125
    SolutionIndex: 126
    SolutionIndex: 127
    SolutionIndex: 128
    SolutionIndex: 129
    SolutionIndex: 130
    SolutionIndex: 131
    SolutionIndex: 132
    SolutionIndex: 133
    SolutionIndex: 134
    SolutionIndex: 135
    SolutionIndex: 136
    SolutionIndex: 137
    SolutionIndex: 138
    SolutionIndex: 139
    SolutionIndex: 140
    SolutionIndex: 141
    SolutionIndex: 142
    SolutionIndex: 143
    SolutionIndex: 144
    SolutionIndex: 145
    SolutionIndex: 146
    SolutionIndex: 147
    SolutionIndex: 148
    SolutionIndex: 149
    SolutionIndex: 150
    SolutionIndex: 151
    SolutionIndex: 152
    SolutionIndex: 153
    SolutionIndex: 154
    SolutionIndex: 155
    SolutionIndex: 156
    SolutionIndex: 157
    SolutionIndex: 158
    SolutionIndex: 159
    SolutionIndex: 160
    SolutionIndex: 161
    SolutionIndex: 162
    SolutionIndex: 163
    SolutionIndex: 164
    SolutionIndex: 165
    SolutionIndex: 166
    SolutionIndex: 167
    SolutionIndex: 168
    SolutionIndex: 169
    SolutionIndex: 170
    SolutionIndex: 171
    SolutionIndex: 172
    SolutionIndex: 173
    SolutionIndex: 174
    SolutionIndex: 175
    SolutionIndex: 176
    SolutionIndex: 177
    SolutionIndex: 178
    SolutionIndex: 179
    SolutionIndex: 180
    SolutionIndex: 181
    SolutionIndex: 182
    SolutionIndex: 183
    SolutionIndex: 184
    SolutionIndex: 185
    SolutionIndex: 186
    SolutionIndex: 187
    SolutionIndex: 188
    SolutionIndex: 189
    SolutionIndex: 190
    SolutionIndex: 191
    SolutionIndex: 192
    SolutionIndex: 193
- - - [1024, 10200, 1, 4096]
    - [26, 32576.0]
  - - [64, 15, 10880, 15]
    - [91, 1722.0]
  - - [64, 30, 2048, 30]
    - [75, 4213.0]
  - - [512, 1600, 1, 512]
    - [61, 22216.0]
  - - [1024, 1600, 1, 1]
    - [74, 168.0]
  - - [256, 8976, 1, 4352]
    - [46, 44692.0]
  - - [1024, 3240, 1, 4096]
    - [60, 57739.0]
  - - [1024, 9216, 1, 1024]
    - [27, 51888.0]
  - - [74, 512, 1, 2048]
    - [46, 1501.0]
  - - [1024, 512, 1, 1024]
    - [29, 18336.0]
  - - [512, 200, 1, 32]
    - [43, 318.0]
  - - [1024, 7200, 1, 1024]
    - [33, 54995.0]
  - - [1024, 9984, 1, 256]
    - [83, 34293.0]
  - - [100, 512, 1, 2048]
    - [80, 2020.0]
  - - [256, 8976, 1, 15872]
    - [86, 25077.0]
  - - [1024, 960, 1, 64]
    - [38, 6446.0]
  - - [1024, 3328, 1, 256]
    - [90, 30981.0]
  - - [1024, 1600, 1, 1024]
    - [95, 39946.0]
  - - [256, 8976, 1, 26112]
    - [35, 28350.0]
  - - [1024, 4096, 1, 1024]
    - [31, 44260.0]
  - - [512, 512, 64, 64]
    - [72, 15064.0]
  - - [64, 5, 512, 5]
    - [78, 118.0]
  - - [1024, 8960, 1, 256]
    - [55, 34021.0]
  - - [4096, 3968, 1, 1024]
    - [62, 47292.0]
  - - [3200, 1024, 1, 2048]
    - [88, 52331.0]
  - - [1024, 4096, 1, 4096]
    - [70, 44214.0]
  - - [1024, 10064, 1, 1024]
    - [83, 52976.0]
  - - [512, 1600, 1, 32]
    - [45, 3034.0]
  - - [256, 8976, 1, 5376]
    - [47, 45296.0]
  - - [256, 8976, 1, 6144]
    - [29, 43845.0]
  - - [256, 8976, 1, 19968]
    - [77, 25518.0]
  - - [256, 8976, 1, 17152]
    - [80, 23822.0]
  - - [256, 8976, 1, 12288]
    - [41, 30095.0]
  - - [256, 8976, 1, 2048]
    - [29, 40264.0]
  - - [1024, 16128, 1, 256]
    - [83, 35232.0]
  - - [1024, 200, 1, 1]
    - [39, 22.0]
  - - [1024, 21504, 1, 256]
    - [83, 36892.0]
  - - [64, 33, 1920, 33]
    - [91, 4509.0]
  - - [64, 35, 1, 35]
    - [29, 7.0]
  - - [1024, 512, 1, 1]
    - [91, 62.0]
  - - [256, 8976, 1, 7168]
    - [93, 46101.0]
  - - [1024, 4608, 1, 256]
    - [69, 31457.0]
  - - [256, 8976, 1, 9472]
    - [46, 45996.0]
  - - [480, 32768, 1, 1024]
    - [49, 54634.0]
  - - [1024, 3960, 1, 42720]
    - [80, 24299.0]
  - - [256, 8976, 1, 5632]
    - [46, 45492.0]
  - - [1024, 15104, 1, 256]
    - [83, 37666.0]
  - - [64, 14, 10880, 15]
    - [91, 1625.0]
  - - [1024, 8064, 1, 1024]
    - [31, 49345.0]
  - - [1024, 4096, 1, 256]
    - [46, 28557.0]
  - - [1024, 2048, 1, 30528]
    - [26, 24751.0]
  - - [256, 1024, 1, 1]
    - [30, 31.0]
  - - [1024, 960, 1, 1024]
    - [66, 25216.0]
  - - [1024, 10080, 1, 4096]
    - [86, 36439.0]
  - - [1024, 8448, 1, 256]
    - [69, 33153.0]
  - - [256, 8976, 1, 10496]
    - [48, 45824.0]
  - - [512, 32768, 1, 256]
    - [83, 35159.0]
  - - [1024, 9520, 1, 4096]
    - [88, 44913.0]
  - - [1024, 40448, 1, 256]
    - [83, 37966.0]
  - - [1024, 2560, 1, 256]
    - [48, 27685.0]
  - - [4096, 6528, 1, 1024]
    - [29, 40336.0]
  - - [1024, 8704, 1, 256]
    - [27, 33126.0]
  - - [1024, 14848, 1, 256]
    - [83, 37658.0]
  - - [1024, 20992, 1, 256]
    - [36, 36706.0]
  - - [4096, 10200, 1, 1024]
    - [47, 25331.0]
  - - [4096, 8160, 1, 1024]
    - [32, 25388.0]
  - - [256, 8976, 1, 20480]
    - [60, 25444.0]
  - - [1024, 11264, 1, 256]
    - [83, 37283.0]
  - - [64, 35, 1, 32]
    - [28, 7.0]
  - - [256, 8976, 1, 5888]
    - [47, 45696.0]
  - - [1024, 22016, 1, 256]
    - [83, 37554.0]
  - - [1024, 7200, 1, 42720]
    - [26, 33334.0]
  - - [64, 15, 1, 15]
    - [24, 1.0]
  - - [1024, 3840, 1, 4096]
    - [88, 69857.0]
  - - [64, 33, 1920, 27]
    - [92, 4013.0]
  - - [1024, 7680, 1, 256]
    - [35, 36472.0]
  - - [256, 8976, 1, 14848]
    - [48, 29529.0]
  - - [4096, 3240, 1, 1024]
    - [56, 47265.0]
  - - [768, 215, 1, 2048]
    - [48, 6952.0]
  - - [4096, 4096, 1, 1024]
    - [56, 49265.0]
  - - [64, 15, 1, 17]
    - [34, 2.0]
  - - [64, 512, 64, 512]
    - [68, 28496.0]
  - - [64, 5, 960, 5]
    - [42, 140.0]
  - - [1024, 4864, 1, 256]
    - [55, 29515.0]
  - - [4096, 1024, 1, 1]
    - [92, 206.0]
  - - [1024, 2048, 1, 2]
    - [50, 369.0]
  - - [1024, 10240, 1, 256]
    - [83, 34592.0]
  - - [1024, 3840, 1, 1024]
    - [35, 59075.0]
  - - [256, 8976, 1, 9984]
    - [47, 46254.0]
  - - [1024, 8192, 1, 256]
    - [69, 32538.0]
  - - [4096, 10080, 1, 1024]
    - [56, 26718.0]
  - - [1024, 14592, 1, 256]
    - [83, 37123.0]
  - - [4096, 3960, 1, 1024]
    - [56, 45680.0]
  - - [2048, 512, 1, 1]
    - [87, 112.0]
  - - [64, 17, 1, 17]
    - [28, 2.0]
  - - [256, 8976, 1, 11520]
    - [93, 46098.0]
  - - [1024, 2048, 1, 4096]
    - [59, 37090.0]
  - - [128, 27, 32768, 27]
    - [43, 1932.0]
  - - [74, 960, 1, 2048]
    - [46, 2887.0]
  - - [256, 8976, 1, 11008]
    - [69, 45073.0]
  - - [512, 512, 1, 64]
    - [52, 1762.0]
  - - [256, 8976, 1, 3072]
    - [69, 42959.0]
  - - [1024, 7104, 1, 42720]
    - [26, 33160.0]
  - - [1024, 14336, 1, 256]
    - [83, 36700.0]
  - - [1024, 20480, 1, 256]
    - [36, 36216.0]
  - - [1024, 32768, 1, 512]
    - [83, 49153.0]
  - - [1024, 17152, 1, 256]
    - [36, 36567.0]
  - - [64, 30, 1, 30]
    - [24, 5.0]
  - - [32, 33, 1600, 33]
    - [91, 2670.0]
  - - [1024, 8160, 1, 4096]
    - [70, 30179.0]
  - - [64, 32, 1, 32]
    - [81, 7.0]
  - - [256, 8976, 1, 14336]
    - [37, 29755.0]
  - - [4096, 2048, 1, 1024]
    - [62, 43952.0]
  - - [128, 128, 512, 64]
    - [39, 12906.0]
  - - [4096, 7200, 1, 1024]
    - [48, 43595.0]
  - - [1024, 11008, 1, 256]
    - [83, 36882.0]
  - - [64, 31, 2048, 31]
    - [91, 4233.0]
  - - [256, 8976, 1, 44505]
    - [70, 24211.0]
  - - [2048, 1024, 1, 256]
    - [48, 21304.0]
  - - [64, 31, 1, 31]
    - [53, 6.0]
  - - [4096, 3840, 1, 1024]
    - [65, 46798.0]
  - - [1024, 9520, 1, 42720]
    - [58, 34470.0]
  - - [1024, 4, 1, 1024]
    - [48, 148.0]
  - - [64, 24, 1, 24]
    - [34, 4.0]
  - - [512, 256, 1, 2048]
    - [47, 5785.0]
  - - [256, 32768, 1, 128]
    - [79, 22148.0]
  - - [4096, 10064, 1, 1024]
    - [56, 27229.0]
  - - [64, 17, 7680, 17]
    - [91, 1993.0]
  - - [4096, 9216, 1, 1024]
    - [56, 27761.0]
  - - [256, 8976, 1, 1536]
    - [69, 40889.0]
  - - [256, 8976, 1, 33536]
    - [54, 24857.0]
  - - [1024, 9520, 1, 1024]
    - [94, 52473.0]
  - - [67, 512, 1, 2048]
    - [40, 1394.0]
  - - [2048, 1024, 1, 1]
    - [50, 163.0]
  - - [64, 15, 7680, 15]
    - [91, 1696.0]
  - - [512, 215, 1, 2048]
    - [71, 4697.0]
  - - [1024, 7168, 1, 256]
    - [83, 35320.0]
  - - [2048, 960, 1, 2048]
    - [48, 35722.0]
  - - [1024, 8160, 1, 1024]
    - [44, 48352.0]
  - - [1024, 11520, 1, 256]
    - [35, 37673.0]
  - - [256, 8976, 1, 22016]
    - [80, 26745.0]
  - - [512, 200, 1, 1]
    - [39, 11.0]
  - - [256, 8976, 1, 9728]
    - [84, 44416.0]
  - - [1024, 10200, 1, 1024]
    - [83, 53692.0]
  - - [1024, 33536, 1, 256]
    - [35, 38117.0]
  - - [1024, 6144, 1, 256]
    - [83, 31408.0]
  - - [1024, 6528, 1, 1024]
    - [83, 51638.0]
  - - [1600, 512, 1, 1024]
    - [46, 31115.0]
  - - [1024, 10496, 1, 256]
    - [83, 35167.0]
  - - [64, 512, 1, 1]
    - [57, 5.0]
  - - [256, 8976, 1, 15104]
    - [64, 29766.0]
  - - [1024, 10064, 1, 4096]
    - [54, 29954.0]
  - - [1024, 9728, 1, 256]
    - [83, 33205.0]
  - - [1024, 8064, 1, 4096]
    - [88, 31518.0]
  - - [1024, 3240, 1, 1024]
    - [35, 50020.0]
  - - [256, 8976, 1, 2304]
    - [46, 42834.0]
  - - [1024, 7936, 1, 256]
    - [46, 31986.0]
  - - [768, 256, 1, 2048]
    - [47, 8693.0]
  - - [1024, 6528, 1, 4096]
    - [73, 58535.0]
  - - [1024, 32, 1, 2]
    - [34, 8.0]
  - - [2048, 512, 1, 2048]
    - [96, 31213.0]
  - - [1024, 10080, 1, 42720]
    - [26, 30621.0]
  - - [1024, 32, 1, 1024]
    - [29, 1134.0]
  - - [1024, 5120, 1, 256]
    - [55, 31477.0]
  - - [64, 15, 7680, 17]
    - [91, 1805.0]
  - - [256, 8976, 1, 8192]
    - [56, 43325.0]
  - - [1024, 7104, 1, 1024]
    - [35, 55491.0]
  - - [1024, 2048, 1, 1024]
    - [47, 35839.0]
  - - [64, 15, 1, 15]
    - [39, 2.0]
  - - [256, 8976, 1, 8448]
    - [47, 46334.0]
  - - [64, 17, 1, 17]
    - [28, 2.0]
  - - [1024, 32768, 1, 1024]
    - [33, 55383.0]
  - - [64, 14, 10880, 14]
    - [91, 1583.0]
  - - [1024, 28672, 1, 256]
    - [35, 36830.0]
  - - [1024, 12288, 1, 256]
    - [46, 34008.0]
  - - [64, 34, 1, 34]
    - [28, 6.0]
  - - [256, 8976, 1, 8960]
    - [48, 46205.0]
  - - [256, 8976, 1, 2560]
    - [93, 43203.0]
  - - [256, 8976, 1, 19712]
    - [89, 25435.0]
  - - [256, 8976, 1, 4864]
    - [93, 45301.0]
  - - [64, 14, 1, 15]
    - [24, 1.0]
  - - [4096, 8064, 1, 1024]
    - [31, 28402.0]
  - - [1024, 9216, 1, 4096]
    - [60, 39498.0]
  - - [64, 31, 2048, 30]
    - [91, 4366.0]
  - - [1024, 3968, 1, 1024]
    - [46, 42877.0]
  - - [4096, 7104, 1, 1024]
    - [56, 44627.0]
  - - [256, 8976, 1, 6656]
    - [93, 45935.0]
  - - [1024, 7104, 1, 4096]
    - [60, 60355.0]
  - - [64, 17, 1, 21]
    - [24, 2.0]
  - - [1024, 3072, 1, 256]
    - [83, 28761.0]
  - - [64, 14, 1, 14]
    - [24, 1.0]
  - - [1024, 4096, 1, 30528]
    - [26, 26461.0]
  - - [1024, 10080, 1, 1024]
    - [35, 52077.0]
  - - [1024, 7424, 1, 256]
    - [83, 36201.0]
  - - [256, 8976, 1, 20992]
    - [80, 26203.0]
  - - [257, 1024, 1, 4096]
    - [40, 11419.0]
  - - [4096, 9520, 1, 1024]
    - [56, 25941.0]
  - - [1024, 18944, 1, 256]
    - [35, 38200.0]
  - - [256, 8976, 1, 2816]
    - [47, 43721.0]
  - - [1024, 19968, 1, 256]
    - [35, 35657.0]
  - - [1024, 2048, 1, 256]
    - [44, 22672.0]
  - - [560, 1600, 1, 1024]
    - [82, 35952.0]
  - - [1024, 7200, 1, 4096]
    - [59, 64682.0]
  - - [1024, 1792, 1, 256]
    - [26, 27830.0]
  - - [1024, 6400, 1, 256]
    - [48, 32067.0]
  - - [1024, 3960, 1, 4096]
    - [49, 44919.0]
  - - [64, 9, 512, 9]
    - [67, 361.0]
  - - [256, 8976, 1, 7424]
    - [93, 45711.0]
  - - [560, 200, 1, 1024]
    - [71, 4120.0]
  - - [1024, 5632, 1, 256]
    - [27, 33554.0]
  - - [64, 27, 1920, 27]
    - [91, 3499.0]
  - - [1024, 3968, 1, 4096]
    - [49, 46077.0]
  - - [64, 24, 1, 34]
    - [85, 5.0]
  - - [1024, 3840, 1, 256]
    - [83, 35246.0]
  - - [1024, 13312, 1, 256]
    - [51, 36260.0]
  - - [64, 21, 1, 21]
    - [29, 3.0]
  - - [64, 3, 512, 3]
    - [75, 43.0]
  - - [1024, 512, 1, 64]
    - [91, 3495.0]
  - - [1024, 23552, 1, 256]
    - [83, 36063.0]
  - - [1024, 13568, 1, 256]
    - [83, 34707.0]
  - - [1024, 4, 1, 2]
    - [24, 1.0]
  - - [256, 8976, 1, 10240]
    - [41, 43581.0]
  - - [1024, 6528, 1, 42720]
    - [70, 29247.0]
  - - [1024, 19712, 1, 256]
    - [83, 35412.0]
  - - [32, 200, 1, 1]
    - [24, 1.0]
  - - [64, 512, 1, 512]
    - [25, 881.0]
  - - [1024, 3960, 1, 1024]
    - [48, 41096.0]
  - - [64, 128, 512, 128]
    - [63, 19680.0]
  - - [64, 31, 1, 30]
    - [76, 6.0]
  - - [1024, 3968, 1, 42720]
    - [40, 24336.0]
  - - [1024, 10200, 1, 4096]
    - [123, 32576.0]
  - - [64, 15, 10880, 15]
    - [188, 1722.0]
  - - [64, 30, 2048, 30]
    - [172, 4213.0]
  - - [512, 1600, 1, 512]
    - [158, 22216.0]
  - - [1024, 1600, 1, 1]
    - [171, 168.0]
  - - [256, 8976, 1, 4352]
    - [143, 44692.0]
  - - [1024, 3240, 1, 4096]
    - [157, 57739.0]
  - - [1024, 9216, 1, 1024]
    - [124, 51888.0]
  - - [74, 512, 1, 2048]
    - [143, 1501.0]
  - - [1024, 512, 1, 1024]
    - [126, 18336.0]
  - - [512, 200, 1, 32]
    - [140, 318.0]
  - - [1024, 7200, 1, 1024]
    - [130, 54995.0]
  - - [1024, 9984, 1, 256]
    - [180, 34293.0]
  - - [100, 512, 1, 2048]
    - [177, 2020.0]
  - - [256, 8976, 1, 15872]
    - [183, 25077.0]
  - - [1024, 960, 1, 64]
    - [135, 6446.0]
  - - [1024, 3328, 1, 256]
    - [187, 30981.0]
  - - [1024, 1600, 1, 1024]
    - [192, 39946.0]
  - - [256, 8976, 1, 26112]
    - [132, 28350.0]
  - - [1024, 4096, 1, 1024]
    - [128, 44260.0]
  - - [512, 512, 64, 64]
    - [169, 15064.0]
  - - [64, 5, 512, 5]
    - [175, 118.0]
  - - [1024, 8960, 1, 256]
    - [152, 34021.0]
  - - [4096, 3968, 1, 1024]
    - [159, 47292.0]
  - - [3200, 1024, 1, 2048]
    - [185, 52331.0]
  - - [1024, 4096, 1, 4096]
    - [167, 44214.0]
  - - [1024, 10064, 1, 1024]
    - [180, 52976.0]
  - - [512, 1600, 1, 32]
    - [142, 3034.0]
  - - [256, 8976, 1, 5376]
    - [144, 45296.0]
  - - [256, 8976, 1, 6144]
    - [126, 43845.0]
  - - [256, 8976, 1, 19968]
    - [174, 25518.0]
  - - [256, 8976, 1, 17152]
    - [177, 23822.0]
  - - [256, 8976, 1, 12288]
    - [138, 30095.0]
  - - [256, 8976, 1, 2048]
    - [126, 40264.0]
  - - [1024, 16128, 1, 256]
    - [180, 35232.0]
  - - [1024, 200, 1, 1]
    - [136, 22.0]
  - - [1024, 21504, 1, 256]
    - [180, 36892.0]
  - - [64, 33, 1920, 33]
    - [188, 4509.0]
  - - [64, 35, 1, 35]
    - [126, 7.0]
  - - [1024, 512, 1, 1]
    - [188, 62.0]
  - - [256, 8976, 1, 7168]
    - [190, 46101.0]
  - - [1024, 4608, 1, 256]
    - [166, 31457.0]
  - - [256, 8976, 1, 9472]
    - [143, 45996.0]
  - - [480, 32768, 1, 1024]
    - [146, 54634.0]
  - - [1024, 3960, 1, 42720]
    - [177, 24299.0]
  - - [256, 8976, 1, 5632]
    - [143, 45492.0]
  - - [1024, 15104, 1, 256]
    - [180, 37666.0]
  - - [64, 14, 10880, 15]
    - [188, 1625.0]
  - - [1024, 8064, 1, 1024]
    - [128, 49345.0]
  - - [1024, 4096, 1, 256]
    - [143, 28557.0]
  - - [1024, 2048, 1, 30528]
    - [123, 24751.0]
  - - [256, 1024, 1, 1]
    - [127, 31.0]
  - - [1024, 960, 1, 1024]
    - [163, 25216.0]
  - - [1024, 10080, 1, 4096]
    - [183, 36439.0]
  - - [1024, 8448, 1, 256]
    - [166, 33153.0]
  - - [256, 8976, 1, 10496]
    - [145, 45824.0]
  - - [512, 32768, 1, 256]
    - [180, 35159.0]
  - - [1024, 9520, 1, 4096]
    - [185, 44913.0]
  - - [1024, 40448, 1, 256]
    - [180, 37966.0]
  - - [1024, 2560, 1, 256]
    - [145, 27685.0]
  - - [4096, 6528, 1, 1024]
    - [126, 40336.0]
  - - [1024, 8704, 1, 256]
    - [124, 33126.0]
  - - [1024, 14848, 1, 256]
    - [180, 37658.0]
  - - [1024, 20992, 1, 256]
    - [133, 36706.0]
  - - [4096, 10200, 1, 1024]
    - [144, 25331.0]
  - - [4096, 8160, 1, 1024]
    - [129, 25388.0]
  - - [256, 8976, 1, 20480]
    - [157, 25444.0]
  - - [1024, 11264, 1, 256]
    - [180, 37283.0]
  - - [64, 35, 1, 32]
    - [125, 7.0]
  - - [256, 8976, 1, 5888]
    - [144, 45696.0]
  - - [1024, 22016, 1, 256]
    - [180, 37554.0]
  - - [1024, 7200, 1, 42720]
    - [123, 33334.0]
  - - [64, 15, 1, 15]
    - [121, 1.0]
  - - [1024, 3840, 1, 4096]
    - [185, 69857.0]
  - - [64, 33, 1920, 27]
    - [189, 4013.0]
  - - [1024, 7680, 1, 256]
    - [132, 36472.0]
  - - [256, 8976, 1, 14848]
    - [145, 29529.0]
  - - [4096, 3240, 1, 1024]
    - [153, 47265.0]
  - - [768, 215, 1, 2048]
    - [145, 6952.0]
  - - [4096, 4096, 1, 1024]
    - [153, 49265.0]
  - - [64, 15, 1, 17]
    - [131, 2.0]
  - - [64, 512, 64, 512]
    - [165, 28496.0]
  - - [64, 5, 960, 5]
    - [139, 140.0]
  - - [1024, 4864, 1, 256]
    - [152, 29515.0]
  - - [4096, 1024, 1, 1]
    - [189, 206.0]
  - - [1024, 2048, 1, 2]
    - [147, 369.0]
  - - [1024, 10240, 1, 256]
    - [180, 34592.0]
  - - [1024, 3840, 1, 1024]
    - [132, 59075.0]
  - - [256, 8976, 1, 9984]
    - [144, 46254.0]
  - - [1024, 8192, 1, 256]
    - [166, 32538.0]
  - - [4096, 10080, 1, 1024]
    - [153, 26718.0]
  - - [1024, 14592, 1, 256]
    - [180, 37123.0]
  - - [4096, 3960, 1, 1024]
    - [153, 45680.0]
  - - [2048, 512, 1, 1]
    - [184, 112.0]
  - - [64, 17, 1, 17]
    - [125, 2.0]
  - - [256, 8976, 1, 11520]
    - [190, 46098.0]
  - - [1024, 2048, 1, 4096]
    - [156, 37090.0]
  - - [128, 27, 32768, 27]
    - [140, 1932.0]
  - - [74, 960, 1, 2048]
    - [143, 2887.0]
  - - [256, 8976, 1, 11008]
    - [166, 45073.0]
  - - [512, 512, 1, 64]
    - [149, 1762.0]
  - - [256, 8976, 1, 3072]
    - [166, 42959.0]
  - - [1024, 7104, 1, 42720]
    - [123, 33160.0]
  - - [1024, 14336, 1, 256]
    - [180, 36700.0]
  - - [1024, 20480, 1, 256]
    - [133, 36216.0]
  - - [1024, 32768, 1, 512]
    - [180, 49153.0]
  - - [1024, 17152, 1, 256]
    - [133, 36567.0]
  - - [64, 30, 1, 30]
    - [121, 5.0]
  - - [32, 33, 1600, 33]
    - [188, 2670.0]
  - - [1024, 8160, 1, 4096]
    - [167, 30179.0]
  - - [64, 32, 1, 32]
    - [178, 7.0]
  - - [256, 8976, 1, 14336]
    - [134, 29755.0]
  - - [4096, 2048, 1, 1024]
    - [159, 43952.0]
  - - [128, 128, 512, 64]
    - [136, 12906.0]
  - - [4096, 7200, 1, 1024]
    - [145, 43595.0]
  - - [1024, 11008, 1, 256]
    - [180, 36882.0]
  - - [64, 31, 2048, 31]
    - [188, 4233.0]
  - - [256, 8976, 1, 44505]
    - [167, 24211.0]
  - - [2048, 1024, 1, 256]
    - [145, 21304.0]
  - - [64, 31, 1, 31]
    - [150, 6.0]
  - - [4096, 3840, 1, 1024]
    - [162, 46798.0]
  - - [1024, 9520, 1, 42720]
    - [155, 34470.0]
  - - [1024, 4, 1, 1024]
    - [145, 148.0]
  - - [64, 24, 1, 24]
    - [131, 4.0]
  - - [512, 256, 1, 2048]
    - [144, 5785.0]
  - - [256, 32768, 1, 128]
    - [176, 22148.0]
  - - [4096, 10064, 1, 1024]
    - [153, 27229.0]
  - - [64, 17, 7680, 17]
    - [188, 1993.0]
  - - [4096, 9216, 1, 1024]
    - [153, 27761.0]
  - - [256, 8976, 1, 1536]
    - [166, 40889.0]
  - - [256, 8976, 1, 33536]
    - [151, 24857.0]
  - - [1024, 9520, 1, 1024]
    - [191, 52473.0]
  - - [67, 512, 1, 2048]
    - [137, 1394.0]
  - - [2048, 1024, 1, 1]
    - [147, 163.0]
  - - [64, 15, 7680, 15]
    - [188, 1696.0]
  - - [512, 215, 1, 2048]
    - [168, 4697.0]
  - - [1024, 7168, 1, 256]
    - [180, 35320.0]
  - - [2048, 960, 1, 2048]
    - [145, 35722.0]
  - - [1024, 8160, 1, 1024]
    - [141, 48352.0]
  - - [1024, 11520, 1, 256]
    - [132, 37673.0]
  - - [256, 8976, 1, 22016]
    - [177, 26745.0]
  - - [512, 200, 1, 1]
    - [136, 11.0]
  - - [256, 8976, 1, 9728]
    - [181, 44416.0]
  - - [1024, 10200, 1, 1024]
    - [180, 53692.0]
  - - [1024, 33536, 1, 256]
    - [132, 38117.0]
  - - [1024, 6144, 1, 256]
    - [180, 31408.0]
  - - [1024, 6528, 1, 1024]
    - [180, 51638.0]
  - - [1600, 512, 1, 1024]
    - [143, 31115.0]
  - - [1024, 10496, 1, 256]
    - [180, 35167.0]
  - - [64, 512, 1, 1]
    - [154, 5.0]
  - - [256, 8976, 1, 15104]
    - [161, 29766.0]
  - - [1024, 10064, 1, 4096]
    - [151, 29954.0]
  - - [1024, 9728, 1, 256]
    - [180, 33205.0]
  - - [1024, 8064, 1, 4096]
    - [185, 31518.0]
  - - [1024, 3240, 1, 1024]
    - [132, 50020.0]
  - - [256, 8976, 1, 2304]
    - [143, 42834.0]
  - - [1024, 7936, 1, 256]
    - [143, 31986.0]
  - - [768, 256, 1, 2048]
    - [144, 8693.0]
  - - [1024, 6528, 1, 4096]
    - [170, 58535.0]
  - - [1024, 32, 1, 2]
    - [131, 8.0]
  - - [2048, 512, 1, 2048]
    - [193, 31213.0]
  - - [1024, 10080, 1, 42720]
    - [123, 30621.0]
  - - [1024, 32, 1, 1024]
    - [126, 1134.0]
  - - [1024, 5120, 1, 256]
    - [152, 31477.0]
  - - [64, 15, 7680, 17]
    - [188, 1805.0]
  - - [256, 8976, 1, 8192]
    - [153, 43325.0]
  - - [1024, 7104, 1, 1024]
    - [132, 55491.0]
  - - [1024, 2048, 1, 1024]
    - [144, 35839.0]
  - - [64, 15, 1, 15]
    - [136, 2.0]
  - - [256, 8976, 1, 8448]
    - [144, 46334.0]
  - - [64, 17, 1, 17]
    - [125, 2.0]
  - - [1024, 32768, 1, 1024]
    - [130, 55383.0]
  - - [64, 14, 10880, 14]
    - [188, 1583.0]
  - - [1024, 28672, 1, 256]
    - [132, 36830.0]
  - - [1024, 12288, 1, 256]
    - [143, 34008.0]
  - - [64, 34, 1, 34]
    - [125, 6.0]
  - - [256, 8976, 1, 8960]
    - [145, 46205.0]
  - - [256, 8976, 1, 2560]
    - [190, 43203.0]
  - - [256, 8976, 1, 19712]
    - [186, 25435.0]
  - - [256, 8976, 1, 4864]
    - [190, 45301.0]
  - - [64, 14, 1, 15]
    - [121, 1.0]
  - - [4096, 8064, 1, 1024]
    - [128, 28402.0]
  - - [1024, 9216, 1, 4096]
    - [157, 39498.0]
  - - [64, 31, 2048, 30]
    - [188, 4366.0]
  - - [1024, 3968, 1, 1024]
    - [143, 42877.0]
  - - [4096, 7104, 1, 1024]
    - [153, 44627.0]
  - - [256, 8976, 1, 6656]
    - [190, 45935.0]
  - - [1024, 7104, 1, 4096]
    - [157, 60355.0]
  - - [64, 17, 1, 21]
    - [121, 2.0]
  - - [1024, 3072, 1, 256]
    - [180, 28761.0]
  - - [64, 14, 1, 14]
    - [121, 1.0]
  - - [1024, 4096, 1, 30528]
    - [123, 26461.0]
  - - [1024, 10080, 1, 1024]
    - [132, 52077.0]
  - - [1024, 7424, 1, 256]
    - [180, 36201.0]
  - - [256, 8976, 1, 20992]
    - [177, 26203.0]
  - - [257, 1024, 1, 4096]
    - [137, 11419.0]
  - - [4096, 9520, 1, 1024]
    - [153, 25941.0]
  - - [1024, 18944, 1, 256]
    - [132, 38200.0]
  - - [256, 8976, 1, 2816]
    - [144, 43721.0]
  - - [1024, 19968, 1, 256]
    - [132, 35657.0]
  - - [1024, 2048, 1, 256]
    - [141, 22672.0]
  - - [560, 1600, 1, 1024]
    - [179, 35952.0]
  - - [1024, 7200, 1, 4096]
    - [156, 64682.0]
  - - [1024, 1792, 1, 256]
    - [123, 27830.0]
  - - [1024, 6400, 1, 256]
    - [145, 32067.0]
  - - [1024, 3960, 1, 4096]
    - [146, 44919.0]
  - - [64, 9, 512, 9]
    - [164, 361.0]
  - - [256, 8976, 1, 7424]
    - [190, 45711.0]
  - - [560, 200, 1, 1024]
    - [168, 4120.0]
  - - [1024, 5632, 1, 256]
    - [124, 33554.0]
  - - [64, 27, 1920, 27]
    - [188, 3499.0]
  - - [1024, 3968, 1, 4096]
    - [146, 46077.0]
  - - [64, 24, 1, 34]
    - [182, 5.0]
  - - [1024, 3840, 1, 256]
    - [180, 35246.0]
  - - [1024, 13312, 1, 256]
    - [148, 36260.0]
  - - [64, 21, 1, 21]
    - [126, 3.0]
  - - [64, 3, 512, 3]
    - [172, 43.0]
  - - [1024, 512, 1, 64]
    - [188, 3495.0]
  - - [1024, 23552, 1, 256]
    - [180, 36063.0]
  - - [1024, 13568, 1, 256]
    - [180, 34707.0]
  - - [1024, 4, 1, 2]
    - [121, 1.0]
  - - [256, 8976, 1, 10240]
    - [138, 43581.0]
  - - [1024, 6528, 1, 42720]
    - [167, 29247.0]
  - - [1024, 19712, 1, 256]
    - [180, 35412.0]
  - - [32, 200, 1, 1]
    - [121, 1.0]
  - - [64, 512, 1, 512]
    - [122, 881.0]
  - - [1024, 3960, 1, 1024]
    - [145, 41096.0]
  - - [64, 128, 512, 128]
    - [160, 19680.0]
  - - [64, 31, 1, 30]
    - [173, 6.0]
  - - [1024, 3968, 1, 42720]
    - [137, 24336.0]
- null
