library/src/blas3/Tensile/Logic/asm_full/arcturus_Cijk_Ailk_Bljk_BBH.yaml
- {MinimumRequiredVersion: 4.14.0}
- arcturus
- gfx908
- [Device 7380, Device 7388, Device 738c, Device 7390]
    SolutionIndex: 0
    SolutionNameMin: Cijk_Ailk_Bljk_BBH_MT64x128x8_MI32x32x2x2_SE_GRVW2_ONLL0_SNLL1
    SolutionIndex: 1
    SolutionNameMin: Cijk_Ailk_Bljk_BBH_MT64x128x16_MI32x32x2x2_SE_GRVW2_ONLL0_SNLL1
    SolutionIndex: 2
    SolutionNameMin: Cijk_Ailk_Bljk_BBH_MT64x128x8_MI32x32x2x2_SE_GRVW4_ONLL0_SNLL1
    SolutionIndex: 3
    SolutionNameMin: Cijk_Ailk_Bljk_BBH_MT64x128x16_MI32x32x2x2_SE_GRVW2_ONLL0_SNLL0
    SolutionIndex: 4
    SolutionNameMin: Cijk_Ailk_Bljk_BBH_MT64x128x8_MI32x32x2x2_SE_GRVW4_ONLL0_SNLL0
    SolutionIndex: 5
    SolutionNameMin: Cijk_Ailk_Bljk_BBH_MT64x128x8_MI32x32x2x2_SE_GRVW2_ONLL1_SNLL1
    SolutionIndex: 6
    SolutionNameMin: Cijk_Ailk_Bljk_BBH_MT64x128x16_MI32x32x2x2_SE_GRVW2_ONLL1_SNLL1
    SolutionIndex: 7
    SolutionNameMin: Cijk_Ailk_Bljk_BBH_MT64x128x32_MI32x32x2x2_SE_GRVW2_ONLL1_SNLL1
    SolutionIndex: 8
    SolutionNameMin: Cijk_Ailk_Bljk_BBH_MT64x128x8_MI32x32x2x2_SE_GRVW2_ONLL1_SNLL0
    SolutionIndex: 9
    SolutionNameMin: Cijk_Ailk_Bljk_BBH_MT64x128x16_MI32x32x2x2_SE_GRVW2_ONLL1_SNLL0
    SolutionIndex: 10
    SolutionNameMin: Cijk_Ailk_Bljk_BBH_MT64x128x8_MI32x32x2x2_SE_GRVW4_ONLL1_SNLL0
    SolutionIndex: 11
    SolutionNameMin: Cijk_Ailk_Bljk_BBH_MT32x256x16_MI32x32x2x2_SE_GRVW4_ONLL1_SNLL0
    SolutionIndex: 12
    SolutionNameMin: Cijk_Ailk_Bljk_BBH_MT64x256x16_MI32x32x2x2_SE_GRVW2_ONLL0_SNLL1
    SolutionIndex: 13
    SolutionNameMin: Cijk_Ailk_Bljk_BBH_MT64x256x16_MI32x32x2x2_SE_GRVW2_ONLL1_SNLL1
    SolutionIndex: 14
    SolutionNameMin: Cijk_Ailk_Bljk_BBH_MT64x256x16_MI32x32x2x2_SE_GRVW2_ONLL1_SNLL0
    SolutionIndex: 15
    SolutionNameMin: Cijk_Ailk_Bljk_BBH_MT64x128x8_MI32x32x2x2_SE_AF0EM1_ASEM1_GRVW2_ONLL0_SNLL1
    SolutionIndex: 16
    SolutionNameMin: Cijk_Ailk_Bljk_BBH_MT64x128x8_MI32x32x2x2_SE_AF0EM2_ASEM1_GRVW2_ONLL0_SNLL1
    SolutionIndex: 17
    SolutionNameMin: Cijk_Ailk_Bljk_BBH_MT64x128x8_MI32x32x2x2_SE_AF0EM2_ASEM1_GRVW4_ONLL0_SNLL1
    SolutionIndex: 18
    SolutionNameMin: Cijk_Ailk_Bljk_BBH_MT64x128x8_MI32x32x2x2_SE_AF0EM2_ASEM1_GRVW4_ONLL0_SNLL0
    SolutionIndex: 19
    SolutionNameMin: Cijk_Ailk_Bljk_BBH_MT64x128x8_MI32x32x2x2_SE_AF0EM1_ASEM1_GRVW4_ONLL1_SNLL1
    SolutionIndex: 20
    SolutionNameMin: Cijk_Ailk_Bljk_BBH_MT64x128x16_MI32x32x2x2_SE_AF0EM1_ASEM2_GRVW2_ONLL1_SNLL0
    SolutionIndex: 21
    SolutionNameMin: Cijk_Ailk_Bljk_BBH_MT64x128x32_MI32x32x2x2_SE_AF0EM2_ASEM1_GRVW2_ONLL1_SNLL0
    SolutionIndex: 22
    SolutionNameMin: Cijk_Ailk_Bljk_BBH_MT64x128x8_MI32x32x2x2_SE_AF0EM2_ASEM1_GRVW4_ONLL1_SNLL0
    SolutionIndex: 23
    SolutionNameMin: Cijk_Ailk_Bljk_BBH_MT64x256x8_MI32x32x2x2_SE_AF0EM2_ASEM1_GRVW2_ONLL0_SNLL0
    SolutionIndex: 24
    SolutionIndex: 25
    SolutionIndex: 26
    SolutionIndex: 27
    SolutionIndex: 28
    SolutionIndex: 29
    SolutionIndex: 30
    SolutionIndex: 31
    SolutionIndex: 32
    SolutionIndex: 33
    SolutionIndex: 34
    SolutionIndex: 35
    SolutionIndex: 36
    SolutionIndex: 37
    SolutionIndex: 38
    SolutionIndex: 39
    SolutionIndex: 40
    SolutionIndex: 41
    SolutionIndex: 42
    SolutionIndex: 43
    SolutionIndex: 44
    SolutionIndex: 45
    SolutionIndex: 46
    SolutionIndex: 47
    SolutionIndex: 48
    SolutionIndex: 49
    SolutionIndex: 50
    SolutionIndex: 51
    SolutionIndex: 52
    SolutionIndex: 53
    SolutionIndex: 54
    SolutionIndex: 55
    SolutionIndex: 56
    SolutionIndex: 57
    SolutionIndex: 58
    SolutionIndex: 59
    SolutionIndex: 60
    SolutionIndex: 61
    SolutionIndex: 62
    SolutionIndex: 63
    SolutionIndex: 64
    SolutionIndex: 65
    SolutionIndex: 66
    SolutionIndex: 67
    SolutionIndex: 68
    SolutionIndex: 69
    SolutionIndex: 70
    SolutionIndex: 71
    SolutionIndex: 72
    SolutionIndex: 73
    SolutionIndex: 74
    SolutionIndex: 75
    SolutionIndex: 76
    SolutionIndex: 77
    SolutionIndex: 78
    SolutionIndex: 79
    SolutionIndex: 80
    SolutionIndex: 81
    SolutionIndex: 82
    SolutionIndex: 83
    SolutionIndex: 84
    SolutionIndex: 85
    SolutionIndex: 86
    SolutionIndex: 87
    SolutionIndex: 88
    SolutionIndex: 89
    SolutionIndex: 90
    SolutionIndex: 91
    SolutionIndex: 92
    SolutionIndex: 93
    SolutionIndex: 94
    SolutionIndex: 95
    SolutionIndex: 96
    SolutionIndex: 97
    SolutionNameMin: Cijk_Ailk_Bljk_BBH_MT64x128x8_MI32x32x2x2_SE_GRVW2_ONLL0_SNLL1
    SolutionIndex: 98
    SolutionNameMin: Cijk_Ailk_Bljk_BBH_MT64x128x16_MI32x32x2x2_SE_GRVW2_ONLL0_SNLL1
    SolutionIndex: 99
    SolutionNameMin: Cijk_Ailk_Bljk_BBH_MT64x128x8_MI32x32x2x2_SE_GRVW4_ONLL0_SNLL1
    SolutionIndex: 100
    SolutionNameMin: Cijk_Ailk_Bljk_BBH_MT64x128x16_MI32x32x2x2_SE_GRVW2_ONLL0_SNLL0
    SolutionIndex: 101
    SolutionNameMin: Cijk_Ailk_Bljk_BBH_MT64x128x8_MI32x32x2x2_SE_GRVW4_ONLL0_SNLL0
    SolutionIndex: 102
    SolutionNameMin: Cijk_Ailk_Bljk_BBH_MT64x128x8_MI32x32x2x2_SE_GRVW2_ONLL1_SNLL1
    SolutionIndex: 103
    SolutionNameMin: Cijk_Ailk_Bljk_BBH_MT64x128x16_MI32x32x2x2_SE_GRVW2_ONLL1_SNLL1
    SolutionIndex: 104
    SolutionNameMin: Cijk_Ailk_Bljk_BBH_MT64x128x32_MI32x32x2x2_SE_GRVW2_ONLL1_SNLL1
    SolutionIndex: 105
    SolutionNameMin: Cijk_Ailk_Bljk_BBH_MT64x128x8_MI32x32x2x2_SE_GRVW2_ONLL1_SNLL0
    SolutionIndex: 106
    SolutionNameMin: Cijk_Ailk_Bljk_BBH_MT64x128x16_MI32x32x2x2_SE_GRVW2_ONLL1_SNLL0
    SolutionIndex: 107
    SolutionNameMin: Cijk_Ailk_Bljk_BBH_MT64x128x8_MI32x32x2x2_SE_GRVW4_ONLL1_SNLL0
    SolutionIndex: 108
    SolutionNameMin: Cijk_Ailk_Bljk_BBH_MT32x256x16_MI32x32x2x2_SE_GRVW4_ONLL1_SNLL0
    SolutionIndex: 109
    SolutionNameMin: Cijk_Ailk_Bljk_BBH_MT64x256x16_MI32x32x2x2_SE_GRVW2_ONLL0_SNLL1
    SolutionIndex: 110
    SolutionNameMin: Cijk_Ailk_Bljk_BBH_MT64x256x16_MI32x32x2x2_SE_GRVW2_ONLL1_SNLL1
    SolutionIndex: 111
    SolutionNameMin: Cijk_Ailk_Bljk_BBH_MT64x256x16_MI32x32x2x2_SE_GRVW2_ONLL1_SNLL0
    SolutionIndex: 112
    SolutionNameMin: Cijk_Ailk_Bljk_BBH_MT64x128x8_MI32x32x2x2_SE_AF0EM1_ASEM1_GRVW2_ONLL0_SNLL1
    SolutionIndex: 113
    SolutionNameMin: Cijk_Ailk_Bljk_BBH_MT64x128x8_MI32x32x2x2_SE_AF0EM2_ASEM1_GRVW2_ONLL0_SNLL1
    SolutionIndex: 114
    SolutionNameMin: Cijk_Ailk_Bljk_BBH_MT64x128x8_MI32x32x2x2_SE_AF0EM2_ASEM1_GRVW4_ONLL0_SNLL1
    SolutionIndex: 115
    SolutionNameMin: Cijk_Ailk_Bljk_BBH_MT64x128x8_MI32x32x2x2_SE_AF0EM2_ASEM1_GRVW4_ONLL0_SNLL0
    SolutionIndex: 116
    SolutionNameMin: Cijk_Ailk_Bljk_BBH_MT64x128x8_MI32x32x2x2_SE_AF0EM1_ASEM1_GRVW4_ONLL1_SNLL1
    SolutionIndex: 117
    SolutionNameMin: Cijk_Ailk_Bljk_BBH_MT64x128x16_MI32x32x2x2_SE_AF0EM1_ASEM2_GRVW2_ONLL1_SNLL0
    SolutionIndex: 118
    SolutionNameMin: Cijk_Ailk_Bljk_BBH_MT64x128x32_MI32x32x2x2_SE_AF0EM2_ASEM1_GRVW2_ONLL1_SNLL0
    SolutionIndex: 119
    SolutionNameMin: Cijk_Ailk_Bljk_BBH_MT64x128x8_MI32x32x2x2_SE_AF0EM2_ASEM1_GRVW4_ONLL1_SNLL0
    SolutionIndex: 120
    SolutionNameMin: Cijk_Ailk_Bljk_BBH_MT64x256x8_MI32x32x2x2_SE_AF0EM2_ASEM1_GRVW2_ONLL0_SNLL0
    SolutionIndex: 121
    SolutionIndex: 122
    SolutionIndex: 123
    SolutionIndex: 124
    SolutionIndex: 125
    SolutionIndex: 126
    SolutionIndex: 127
    SolutionIndex: 128
    SolutionIndex: 129
    SolutionIndex: 130
    SolutionIndex: 131
    SolutionIndex: 132
    SolutionIndex: 133
    SolutionIndex: 134
    SolutionIndex: 135
    SolutionIndex: 136
    SolutionIndex: 137
    SolutionIndex: 138
    SolutionIndex: 139
    SolutionIndex: 140
    SolutionIndex: 141
    SolutionIndex: 142
    SolutionIndex: 143
    SolutionIndex: 144
    SolutionIndex: 145
    SolutionIndex: 146
    SolutionIndex: 147
    SolutionIndex: 148
    SolutionIndex: 149
    SolutionIndex: 150
    SolutionIndex: 151
    SolutionIndex: 152
    SolutionIndex: 153
    SolutionIndex: 154
    SolutionIndex: 155
    SolutionIndex: 156
    SolutionIndex: 157
    SolutionIndex: 158
    SolutionIndex: 159
    SolutionIndex: 160
    SolutionIndex: 161
    SolutionIndex: 162
    SolutionIndex: 163
    SolutionIndex: 164
    SolutionIndex: 165
    SolutionIndex: 166
    SolutionIndex: 167
    SolutionIndex: 168
    SolutionIndex: 169
    SolutionIndex: 170
    SolutionIndex: 171
    SolutionIndex: 172
    SolutionIndex: 173
    SolutionIndex: 174
    SolutionIndex: 175
    SolutionIndex: 176
    SolutionIndex: 177
    SolutionIndex: 178
    SolutionIndex: 179
    SolutionIndex: 180
    SolutionIndex: 181
    SolutionIndex: 182
    SolutionIndex: 183
    SolutionIndex: 184
    SolutionIndex: 185
    SolutionIndex: 186
    SolutionIndex: 187
    SolutionIndex: 188
    SolutionIndex: 189
    SolutionIndex: 190
    SolutionIndex: 191
    SolutionIndex: 192
    SolutionIndex: 193
    SolutionIndex: 194
    SolutionIndex: 195
    SolutionIndex: 196
    SolutionIndex: 197
    SolutionIndex: 198
    SolutionIndex: 199
    SolutionIndex: 200
    SolutionIndex: 201
    SolutionIndex: 202
    SolutionIndex: 203
    SolutionIndex: 204
    SolutionIndex: 205
    SolutionIndex: 206
    SolutionIndex: 207
    SolutionIndex: 208
    SolutionIndex: 209
    SolutionIndex: 210
    SolutionIndex: 211
    SolutionIndex: 212
    SolutionIndex: 213
    SolutionIndex: 214
    SolutionIndex: 215
    SolutionIndex: 216
    SolutionIndex: 217
    SolutionIndex: 218
    SolutionIndex: 219
    SolutionIndex: 220
    SolutionIndex: 221
    SolutionIndex: 222
    SolutionIndex: 223
    SolutionIndex: 224
    SolutionIndex: 225
    SolutionIndex: 226
    SolutionIndex: 227
    SolutionIndex: 228
    SolutionIndex: 229
    SolutionIndex: 230
    SolutionIndex: 231
    SolutionIndex: 232
    SolutionIndex: 233
    SolutionIndex: 234
    SolutionIndex: 235
    SolutionIndex: 236
    SolutionIndex: 237
    SolutionIndex: 238
    SolutionIndex: 239
    SolutionIndex: 240
    SolutionIndex: 241
    SolutionIndex: 242
    SolutionIndex: 243
    SolutionIndex: 244
    SolutionIndex: 245
    SolutionIndex: 246
    SolutionIndex: 247
    SolutionIndex: 248
    SolutionIndex: 249
    SolutionIndex: 250
    SolutionIndex: 251
    SolutionIndex: 252
    SolutionIndex: 253
    SolutionIndex: 254
    SolutionIndex: 255
    SolutionIndex: 256
    SolutionIndex: 257
    SolutionIndex: 258
    SolutionIndex: 259
    SolutionIndex: 260
    SolutionIndex: 261
    SolutionIndex: 262
    SolutionIndex: 263
    SolutionIndex: 264
    SolutionIndex: 265
    SolutionIndex: 266
    SolutionIndex: 267
    SolutionIndex: 268
    SolutionIndex: 269
    SolutionIndex: 270
    SolutionIndex: 271
    SolutionIndex: 272
    SolutionIndex: 273
    SolutionIndex: 274
    SolutionIndex: 275
    SolutionIndex: 276
    SolutionIndex: 277
    SolutionIndex: 278
    SolutionIndex: 279
    SolutionIndex: 280
    SolutionIndex: 281
    SolutionIndex: 282
    SolutionIndex: 283
    SolutionIndex: 284
    SolutionIndex: 285
    SolutionIndex: 286
    SolutionIndex: 287
    SolutionIndex: 288
    SolutionIndex: 289
    SolutionIndex: 290
    SolutionIndex: 291
    SolutionIndex: 292
    SolutionIndex: 293
    SolutionIndex: 294
    SolutionIndex: 295
    SolutionIndex: 296
    SolutionIndex: 297
    SolutionIndex: 298
    SolutionIndex: 299
    SolutionIndex: 300
    SolutionIndex: 301
    SolutionIndex: 302
    SolutionIndex: 303
    SolutionIndex: 304
    SolutionIndex: 305
    SolutionIndex: 306
    SolutionIndex: 307
    SolutionIndex: 308
- - - [64, 35, 1, 35]
    - [29, 0.0]
  - - [64, 35, 1, 32]
    - [28, 0.0]
  - - [64, 15, 1, 15]
    - [24, 0.0]
  - - [64, 15, 1, 17]
    - [34, 0.0]
  - - [64, 17, 1, 17]
    - [28, 0.0]
  - - [64, 30, 1, 30]
    - [24, 0.0]
  - - [64, 32, 1, 32]
    - [81, 0.0]
  - - [64, 31, 1, 31]
    - [53, 0.0]
  - - [64, 24, 1, 24]
    - [34, 0.0]
  - - [64, 15, 1, 15]
    - [39, 0.0]
  - - [64, 17, 1, 17]
    - [28, 0.0]
  - - [64, 34, 1, 34]
    - [28, 0.0]
  - - [64, 14, 1, 15]
    - [24, 0.0]
  - - [64, 17, 1, 21]
    - [24, 0.0]
  - - [64, 14, 1, 14]
    - [24, 0.0]
  - - [64, 24, 1, 34]
    - [85, 0.0]
  - - [64, 21, 1, 21]
    - [29, 0.0]
  - - [64, 31, 1, 30]
    - [76, 0.0]
  - - [64, 35, 1, 35]
    - [126, 0.0]
  - - [64, 35, 1, 32]
    - [125, 0.0]
  - - [64, 15, 1, 15]
    - [121, 0.0]
  - - [64, 15, 1, 17]
    - [131, 0.0]
  - - [64, 17, 1, 17]
    - [125, 0.0]
  - - [64, 30, 1, 30]
    - [121, 0.0]
  - - [64, 32, 1, 32]
    - [178, 0.0]
  - - [64, 31, 1, 31]
    - [150, 0.0]
  - - [64, 24, 1, 24]
    - [131, 0.0]
  - - [64, 15, 1, 15]
    - [136, 0.0]
  - - [64, 17, 1, 17]
    - [125, 0.0]
  - - [64, 34, 1, 34]
    - [125, 0.0]
  - - [64, 14, 1, 15]
    - [121, 0.0]
  - - [64, 17, 1, 21]
    - [121, 0.0]
  - - [64, 14, 1, 14]
    - [121, 0.0]
  - - [64, 24, 1, 34]
    - [182, 0.0]
  - - [64, 21, 1, 21]
    - [126, 0.0]
  - - [64, 31, 1, 30]
    - [173, 0.0]
  - - [64, 128, 512, 128]
    - [205, 14.479]
  - - [64, 512, 1, 512]
    - [239, 2.013]
  - - [64, 512, 64, 512]
    - [210, 20.633]
  - - [128, 128, 512, 64]
    - [237, 13.398]
  - - [512, 512, 1, 64]
    - [208, 2.804]
  - - [512, 512, 64, 64]
    - [220, 17.943]
  - - [1024, 4, 1, 2]
    - [194, 0.001]
  - - [1024, 4, 1, 1024]
    - [296, 0.314]
  - - [1024, 32, 1, 2]
    - [206, 0.013]
  - - [1024, 32, 1, 1024]
    - [211, 2.754]
  - - [1024, 2048, 1, 2]
    - [214, 0.311]
  - - [1024, 2048, 1, 1024]
    - [273, 29.641]
  - - [1024, 2048, 1, 4096]
    - [260, 31.9]
  - - [1024, 2048, 1, 30528]
    - [247, 34.282]
  - - [1024, 4096, 1, 1024]
    - [255, 36.706]
  - - [1024, 4096, 1, 4096]
    - [260, 38.491]
  - - [1024, 4096, 1, 30528]
    - [247, 41.056]
  - - [4096, 2048, 1, 1024]
    - [307, 41.098]
  - - [4096, 4096, 1, 1024]
    - [305, 42.22]
  - - [32, 33, 1600, 33]
    - [253, 2.007]
  - - [32, 200, 1, 1]
    - [196, 0.001]
  - - [64, 3, 512, 3]
    - [224, 0.033]
  - - [64, 5, 512, 5]
    - [195, 0.09]
  - - [64, 5, 960, 5]
    - [195, 0.137]
  - - [64, 9, 512, 9]
    - [215, 0.27]
  - - [64, 512, 1, 1]
    - [194, 0.007]
  - - [67, 512, 1, 2048]
    - [239, 3.287]
  - - [74, 512, 1, 2048]
    - [256, 3.743]
  - - [74, 960, 1, 2048]
    - [266, 6.362]
  - - [100, 512, 1, 2048]
    - [239, 5.006]
  - - [128, 27, 32768, 27]
    - [214, 2.733]
  - - [256, 1024, 1, 1]
    - [229, 0.042]
  - - [256, 8976, 1, 1536]
    - [293, 31.883]
  - - [256, 8976, 1, 2048]
    - [227, 32.792]
  - - [256, 8976, 1, 2304]
    - [277, 33.319]
  - - [256, 8976, 1, 2560]
    - [267, 33.753]
  - - [256, 8976, 1, 2816]
    - [261, 33.754]
  - - [256, 8976, 1, 3072]
    - [283, 34.282]
  - - [256, 8976, 1, 4352]
    - [245, 34.868]
  - - [256, 8976, 1, 4864]
    - [245, 35.3]
  - - [256, 8976, 1, 5376]
    - [245, 35.408]
  - - [256, 8976, 1, 5632]
    - [245, 35.927]
  - - [256, 8976, 1, 5888]
    - [277, 35.798]
  - - [256, 8976, 1, 6144]
    - [289, 35.449]
  - - [256, 8976, 1, 6656]
    - [277, 35.999]
  - - [256, 8976, 1, 7168]
    - [245, 35.88]
  - - [256, 8976, 1, 7424]
    - [245, 35.997]
  - - [256, 8976, 1, 8192]
    - [295, 36.018]
  - - [256, 8976, 1, 8448]
    - [245, 36.116]
  - - [256, 8976, 1, 8960]
    - [245, 36.224]
  - - [256, 8976, 1, 9472]
    - [289, 36.346]
  - - [256, 8976, 1, 9728]
    - [245, 36.457]
  - - [256, 8976, 1, 9984]
    - [295, 36.402]
  - - [256, 8976, 1, 10240]
    - [289, 36.433]
  - - [256, 8976, 1, 10496]
    - [295, 36.469]
  - - [256, 8976, 1, 11008]
    - [262, 36.519]
  - - [256, 8976, 1, 11520]
    - [262, 36.608]
  - - [256, 8976, 1, 12288]
    - [284, 36.68]
  - - [256, 8976, 1, 14336]
    - [284, 36.849]
  - - [256, 8976, 1, 14848]
    - [295, 36.93]
  - - [256, 8976, 1, 15104]
    - [295, 36.918]
  - - [256, 8976, 1, 15872]
    - [295, 36.991]
  - - [256, 8976, 1, 17152]
    - [284, 37.051]
  - - [256, 8976, 1, 19712]
    - [295, 37.19]
  - - [256, 8976, 1, 19968]
    - [278, 37.177]
  - - [256, 8976, 1, 20480]
    - [295, 37.209]
  - - [256, 8976, 1, 20992]
    - [295, 37.254]
  - - [256, 8976, 1, 22016]
    - [284, 37.269]
  - - [256, 8976, 1, 26112]
    - [284, 37.394]
  - - [256, 8976, 1, 33536]
    - [262, 37.512]
  - - [256, 8976, 1, 44505]
    - [284, 37.39]
  - - [256, 32768, 1, 128]
    - [234, 22.994]
  - - [257, 1024, 1, 4096]
    - [241, 16.592]
  - - [480, 32768, 1, 1024]
    - [305, 39.252]
  - - [512, 200, 1, 1]
    - [248, 0.017]
  - - [512, 200, 1, 32]
    - [206, 0.601]
  - - [512, 215, 1, 2048]
    - [302, 10.342]
  - - [512, 256, 1, 2048]
    - [218, 11.471]
  - - [512, 1600, 1, 32]
    - [271, 3.894]
  - - [512, 1600, 1, 512]
    - [285, 21.449]
  - - [512, 32768, 1, 256]
    - [286, 35.507]
  - - [560, 200, 1, 1024]
    - [233, 7.351]
  - - [560, 1600, 1, 1024]
    - [268, 26.583]
  - - [768, 215, 1, 2048]
    - [238, 13.467]
  - - [768, 256, 1, 2048]
    - [252, 16.035]
  - - [1024, 200, 1, 1]
    - [199, 0.032]
  - - [1024, 512, 1, 1]
    - [214, 0.073]
  - - [1024, 512, 1, 64]
    - [231, 4.985]
  - - [1024, 512, 1, 1024]
    - [246, 19.324]
  - - [1024, 960, 1, 64]
    - [200, 7.851]
  - - [1024, 960, 1, 1024]
    - [289, 30.291]
  - - [1024, 1600, 1, 1]
    - [230, 0.147]
  - - [1024, 1600, 1, 1024]
    - [219, 30.968]
  - - [1024, 1792, 1, 256]
    - [281, 24.56]
  - - [1024, 2048, 1, 256]
    - [263, 22.036]
  - - [1024, 2560, 1, 256]
    - [306, 26.611]
  - - [1024, 3072, 1, 256]
    - [292, 26.259]
  - - [1024, 3328, 1, 256]
    - [298, 27.961]
  - - [1024, 3840, 1, 256]
    - [281, 29.624]
  - - [1024, 4096, 1, 256]
    - [220, 27.455]
  - - [1024, 4608, 1, 256]
    - [308, 30.307]
  - - [1024, 4864, 1, 256]
    - [223, 28.41]
  - - [1024, 5120, 1, 256]
    - [291, 29.764]
  - - [1024, 5632, 1, 256]
    - [288, 31.118]
  - - [1024, 6144, 1, 256]
    - [286, 31.078]
  - - [1024, 6400, 1, 256]
    - [286, 31.782]
  - - [1024, 7168, 1, 256]
    - [279, 32.384]
  - - [1024, 7424, 1, 256]
    - [279, 32.407]
  - - [1024, 7680, 1, 256]
    - [220, 32.042]
  - - [1024, 7936, 1, 256]
    - [308, 32.502]
  - - [1024, 8192, 1, 256]
    - [288, 33.054]
  - - [1024, 8448, 1, 256]
    - [279, 33.107]
  - - [1024, 8704, 1, 256]
    - [308, 32.451]
  - - [1024, 8960, 1, 256]
    - [279, 33.004]
  - - [1024, 9728, 1, 256]
    - [288, 33.146]
  - - [1024, 9984, 1, 256]
    - [297, 33.552]
  - - [1024, 10240, 1, 256]
    - [279, 33.856]
  - - [1024, 10496, 1, 256]
    - [287, 34.15]
  - - [1024, 11008, 1, 256]
    - [281, 33.926]
  - - [1024, 11264, 1, 256]
    - [222, 34.2]
  - - [1024, 11520, 1, 256]
    - [286, 34.132]
  - - [1024, 12288, 1, 256]
    - [307, 34.65]
  - - [1024, 13312, 1, 256]
    - [279, 34.594]
  - - [1024, 13568, 1, 256]
    - [305, 34.708]
  - - [1024, 14336, 1, 256]
    - [287, 35.099]
  - - [1024, 14592, 1, 256]
    - [287, 35.199]
  - - [1024, 14848, 1, 256]
    - [286, 35.365]
  - - [1024, 15104, 1, 256]
    - [299, 35.089]
  - - [1024, 16128, 1, 256]
    - [220, 35.295]
  - - [1024, 17152, 1, 256]
    - [297, 35.539]
  - - [1024, 18944, 1, 256]
    - [279, 35.722]
  - - [1024, 19712, 1, 256]
    - [287, 35.927]
  - - [1024, 19968, 1, 256]
    - [305, 36.046]
  - - [1024, 20480, 1, 256]
    - [297, 36.042]
  - - [1024, 20992, 1, 256]
    - [280, 36.19]
  - - [1024, 21504, 1, 256]
    - [219, 36.01]
  - - [1024, 22016, 1, 256]
    - [279, 36.176]
  - - [1024, 23552, 1, 256]
    - [279, 36.408]
  - - [1024, 28672, 1, 256]
    - [279, 36.846]
  - - [1024, 32768, 1, 512]
    - [220, 42.309]
  - - [1024, 32768, 1, 1024]
    - [273, 43.909]
  - - [1024, 33536, 1, 256]
    - [280, 37.227]
  - - [1024, 40448, 1, 256]
    - [219, 37.416]
  - - [1600, 512, 1, 1024]
    - [270, 28.037]
  - - [2048, 512, 1, 1]
    - [202, 0.106]
  - - [2048, 512, 1, 2048]
    - [257, 23.588]
  - - [2048, 960, 1, 2048]
    - [294, 37.795]
  - - [2048, 1024, 1, 1]
    - [214, 0.153]
  - - [2048, 1024, 1, 256]
    - [249, 22.036]
  - - [3200, 1024, 1, 2048]
    - [201, 36.986]
  - - [4096, 1024, 1, 1]
    - [221, 0.195]
  - - [64, 14, 10880, 14]
    - [195, 1.173]
  - - [64, 14, 10880, 15]
    - [224, 1.254]
  - - [64, 15, 7680, 15]
    - [264, 1.238]
  - - [64, 15, 10880, 15]
    - [235, 1.287]
  - - [64, 15, 7680, 17]
    - [213, 1.381]
  - - [64, 17, 6144, 17]
    - [203, 1.221]
  - - [64, 17, 7680, 17]
    - [236, 1.238]
  - - [64, 17, 6144, 21]
    - [209, 1.476]
  - - [64, 21, 6144, 21]
    - [216, 1.735]
  - - [64, 24, 4736, 24]
    - [275, 2.05]
  - - [64, 24, 4736, 34]
    - [304, 2.664]
  - - [64, 30, 2048, 30]
    - [244, 2.481]
  - - [64, 31, 2048, 30]
    - [265, 2.496]
  - - [64, 31, 2048, 31]
    - [226, 2.574]
  - - [64, 32, 4608, 32]
    - [228, 6.681]
  - - [64, 34, 4736, 34]
    - [204, 3.159]
  - - [64, 35, 4608, 32]
    - [198, 4.792]
  - - [64, 35, 4608, 35]
    - [272, 3.071]
  - - [1024, 3840, 1, 1024]
    - [273, 38.807]
  - - [1024, 3840, 1, 4096]
    - [300, 45.482]
  - - [1024, 3968, 1, 1024]
    - [255, 35.559]
  - - [1024, 3968, 1, 4096]
    - [260, 37.368]
  - - [1024, 3968, 1, 42720]
    - [284, 39.587]
  - - [1024, 6528, 1, 1024]
    - [274, 41.195]
  - - [1024, 6528, 1, 4096]
    - [258, 41.142]
  - - [1024, 6528, 1, 42720]
    - [289, 46.152]
  - - [1024, 7104, 1, 1024]
    - [240, 39.926]
  - - [1024, 7104, 1, 4096]
    - [282, 42.912]
  - - [1024, 7104, 1, 42720]
    - [282, 45.136]
  - - [1024, 7200, 1, 1024]
    - [259, 40.212]
  - - [1024, 7200, 1, 4096]
    - [282, 42.774]
  - - [1024, 7200, 1, 42720]
    - [276, 45.675]
  - - [1024, 8064, 1, 1024]
    - [240, 41.022]
  - - [1024, 8064, 1, 4096]
    - [207, 41.808]
  - - [1024, 8160, 1, 1024]
    - [269, 40.667]
  - - [1024, 8160, 1, 4096]
    - [207, 41.634]
  - - [1024, 9216, 1, 1024]
    - [254, 42.024]
  - - [1024, 9216, 1, 4096]
    - [301, 44.228]
  - - [1024, 9520, 1, 1024]
    - [306, 39.888]
  - - [1024, 9520, 1, 4096]
    - [303, 45.119]
  - - [1024, 9520, 1, 42720]
    - [250, 48.162]
  - - [1024, 10064, 1, 1024]
    - [273, 41.582]
  - - [1024, 10064, 1, 4096]
    - [217, 42.24]
  - - [1024, 10080, 1, 1024]
    - [274, 41.422]
  - - [1024, 10080, 1, 4096]
    - [217, 41.908]
  - - [1024, 10080, 1, 42720]
    - [278, 45.576]
  - - [1024, 10200, 1, 1024]
    - [273, 41.827]
  - - [1024, 10200, 1, 4096]
    - [212, 41.511]
  - - [4096, 3840, 1, 1024]
    - [242, 42.327]
  - - [4096, 3968, 1, 1024]
    - [219, 42.289]
  - - [4096, 6528, 1, 1024]
    - [219, 42.928]
  - - [4096, 7104, 1, 1024]
    - [305, 42.926]
  - - [4096, 7200, 1, 1024]
    - [306, 42.569]
  - - [4096, 8064, 1, 1024]
    - [273, 43.413]
  - - [4096, 8160, 1, 1024]
    - [306, 42.843]
  - - [4096, 9216, 1, 1024]
    - [273, 43.468]
  - - [4096, 9520, 1, 1024]
    - [290, 43.04]
  - - [4096, 10064, 1, 1024]
    - [305, 43.257]
  - - [4096, 10080, 1, 1024]
    - [305, 43.312]
  - - [4096, 10200, 1, 1024]
    - [305, 43.301]
  - - [64, 27, 1920, 27]
    - [197, 2.212]
  - - [64, 33, 1920, 27]
    - [225, 2.176]
  - - [64, 33, 1920, 33]
    - [232, 2.734]
  - - [1024, 3240, 1, 1024]
    - [243, 34.747]
  - - [1024, 3240, 1, 4096]
    - [282, 38.008]
  - - [1024, 3960, 1, 1024]
    - [254, 34.758]
  - - [1024, 3960, 1, 4096]
    - [260, 37.079]
  - - [1024, 3960, 1, 42720]
    - [251, 39.481]
  - - [4096, 3240, 1, 1024]
    - [290, 40.489]
  - - [4096, 3960, 1, 1024]
    - [219, 41.988]
- null
