library/src/blas3/Tensile/Logic/asm_full/arcturus_Cijk_Ailk_Bjlk_BBH.yaml
- {MinimumRequiredVersion: 4.14.0}
- arcturus
- gfx908
- [Device 7380, Device 7388, Device 738c, Device 7390]
    SolutionIndex: 0
    SolutionNameMin: Cijk_Ailk_Bjlk_BBH_MT64x128x8_MI32x32x2x2_SE_ONLL0_SNLL1
    SolutionIndex: 1
    SolutionNameMin: Cijk_Ailk_Bjlk_BBH_MT32x256x8_MI32x32x2x2_SE_ONLL0_SNLL0
    SolutionIndex: 2
    SolutionNameMin: Cijk_Ailk_Bjlk_BBH_MT64x128x16_MI32x32x2x2_SE_ONLL0_SNLL0
    SolutionIndex: 3
    SolutionNameMin: Cijk_Ailk_Bjlk_BBH_MT64x128x16_MI32x32x2x2_SE_ONLL1_SNLL1
    SolutionIndex: 4
    SolutionNameMin: Cijk_Ailk_Bjlk_BBH_MT32x256x8_MI32x32x2x2_SE_ONLL1_SNLL0
    SolutionIndex: 5
    SolutionNameMin: Cijk_Ailk_Bjlk_BBH_MT32x256x16_MI32x32x2x2_SE_ONLL1_SNLL0
    SolutionIndex: 6
    SolutionNameMin: Cijk_Ailk_Bjlk_BBH_MT64x128x32_MI32x32x2x2_SE_ONLL1_SNLL0
    SolutionIndex: 7
    SolutionNameMin: Cijk_Ailk_Bjlk_BBH_MT64x256x16_MI32x32x2x2_SE_ONLL0_SNLL0
    SolutionIndex: 8
    SolutionNameMin: Cijk_Ailk_Bjlk_BBH_MT64x128x8_MI32x32x2x2_SE_AF0EM1_ASEM1_ONLL0_SNLL1
    SolutionIndex: 9
    SolutionNameMin: Cijk_Ailk_Bjlk_BBH_MT64x128x32_MI32x32x2x2_SE_AF0EM1_ASEM2_ONLL0_SNLL0
    SolutionIndex: 10
    SolutionNameMin: Cijk_Ailk_Bjlk_BBH_MT64x128x8_MI32x32x2x2_SE_AF0EM1_ASEM1_ONLL1_SNLL0
    SolutionIndex: 11
    SolutionIndex: 12
    SolutionIndex: 13
    SolutionIndex: 14
    SolutionIndex: 15
    SolutionIndex: 16
    SolutionIndex: 17
    SolutionIndex: 18
    SolutionIndex: 19
    SolutionIndex: 20
    SolutionIndex: 21
    SolutionIndex: 22
    SolutionIndex: 23
    SolutionIndex: 24
    SolutionIndex: 25
    SolutionIndex: 26
    SolutionIndex: 27
    SolutionIndex: 28
    SolutionIndex: 29
    SolutionIndex: 30
    SolutionIndex: 31
    SolutionIndex: 32
    SolutionIndex: 33
    SolutionIndex: 34
    SolutionIndex: 35
    SolutionIndex: 36
    SolutionIndex: 37
    SolutionIndex: 38
    SolutionIndex: 39
    SolutionIndex: 40
    SolutionIndex: 41
    SolutionIndex: 42
    SolutionIndex: 43
    SolutionIndex: 44
    SolutionIndex: 45
    SolutionIndex: 46
    SolutionIndex: 47
    SolutionIndex: 48
    SolutionIndex: 49
    SolutionIndex: 50
    SolutionIndex: 51
    SolutionIndex: 52
    SolutionIndex: 53
    SolutionIndex: 54
    SolutionIndex: 55
    SolutionIndex: 56
    SolutionIndex: 57
    SolutionIndex: 58
    SolutionIndex: 59
    SolutionIndex: 60
    SolutionIndex: 61
    SolutionIndex: 62
    SolutionIndex: 63
    SolutionIndex: 64
    SolutionIndex: 65
    SolutionIndex: 66
    SolutionIndex: 67
    SolutionIndex: 68
    SolutionIndex: 69
    SolutionIndex: 70
    SolutionIndex: 71
    SolutionIndex: 72
    SolutionIndex: 73
    SolutionIndex: 74
    SolutionIndex: 75
    SolutionIndex: 76
    SolutionIndex: 77
    SolutionIndex: 78
    SolutionIndex: 79
    SolutionIndex: 80
    SolutionIndex: 81
    SolutionIndex: 82
    SolutionIndex: 83
    SolutionIndex: 84
    SolutionIndex: 85
    SolutionIndex: 86
    SolutionIndex: 87
    SolutionIndex: 88
    SolutionIndex: 89
    SolutionIndex: 90
    SolutionIndex: 91
    SolutionIndex: 92
    SolutionIndex: 93
    SolutionIndex: 94
    SolutionIndex: 95
    SolutionIndex: 96
    SolutionIndex: 97
    SolutionIndex: 98
    SolutionIndex: 99
    SolutionIndex: 100
    SolutionIndex: 101
    SolutionIndex: 102
    SolutionIndex: 103
    SolutionIndex: 104
    SolutionIndex: 105
    SolutionIndex: 106
    SolutionIndex: 107
    SolutionIndex: 108
    SolutionIndex: 109
    SolutionIndex: 110
    SolutionIndex: 111
    SolutionIndex: 112
    SolutionIndex: 113
    SolutionIndex: 114
    SolutionIndex: 115
    SolutionIndex: 116
    SolutionIndex: 117
    SolutionIndex: 118
    SolutionIndex: 119
    SolutionIndex: 120
    SolutionIndex: 121
    SolutionIndex: 122
    SolutionIndex: 123
    SolutionIndex: 124
    SolutionIndex: 125
    SolutionIndex: 126
    SolutionIndex: 127
    SolutionIndex: 128
    SolutionIndex: 129
    SolutionIndex: 130
    SolutionIndex: 131
    SolutionIndex: 132
    SolutionIndex: 133
    SolutionIndex: 134
    SolutionIndex: 135
    SolutionIndex: 136
    SolutionIndex: 137
    SolutionIndex: 138
    SolutionIndex: 139
    SolutionIndex: 140
    SolutionIndex: 141
    SolutionIndex: 142
    SolutionIndex: 143
    SolutionIndex: 144
    SolutionIndex: 145
    SolutionIndex: 146
    SolutionIndex: 147
    SolutionIndex: 148
    SolutionIndex: 149
    SolutionIndex: 150
    SolutionIndex: 151
    SolutionIndex: 152
    SolutionIndex: 153
    SolutionIndex: 154
    SolutionIndex: 155
    SolutionIndex: 156
    SolutionIndex: 157
    SolutionIndex: 158
    SolutionIndex: 159
    SolutionIndex: 160
    SolutionIndex: 161
    SolutionIndex: 162
    SolutionIndex: 163
    SolutionIndex: 164
    SolutionIndex: 165
    SolutionIndex: 166
    SolutionIndex: 167
    SolutionIndex: 168
    SolutionIndex: 169
    SolutionIndex: 170
    SolutionIndex: 171
    SolutionIndex: 172
    SolutionIndex: 173
    SolutionIndex: 174
    SolutionIndex: 175
    SolutionIndex: 176
    SolutionIndex: 177
    SolutionIndex: 178
    SolutionIndex: 179
    SolutionIndex: 180
    SolutionIndex: 181
    SolutionIndex: 182
    SolutionIndex: 183
    SolutionIndex: 184
    SolutionIndex: 185
    SolutionIndex: 186
    SolutionIndex: 187
    SolutionIndex: 188
    SolutionIndex: 189
    SolutionIndex: 190
    SolutionIndex: 191
    SolutionIndex: 192
    SolutionIndex: 193
    SolutionIndex: 194
    SolutionIndex: 195
    SolutionIndex: 196
    SolutionIndex: 197
    SolutionIndex: 198
    SolutionIndex: 199
    SolutionIndex: 200
    SolutionIndex: 201
    SolutionIndex: 202
    SolutionIndex: 203
    SolutionIndex: 204
    SolutionIndex: 205
    SolutionIndex: 206
    SolutionIndex: 207
    SolutionIndex: 208
    SolutionIndex: 209
    SolutionIndex: 210
    SolutionIndex: 211
    SolutionIndex: 212
    SolutionIndex: 213
    SolutionIndex: 214
    SolutionIndex: 215
    SolutionIndex: 216
    SolutionIndex: 217
    SolutionIndex: 218
    SolutionIndex: 219
    SolutionIndex: 220
    SolutionIndex: 221
    SolutionIndex: 222
    SolutionIndex: 223
    SolutionIndex: 224
    SolutionIndex: 225
    SolutionIndex: 226
    SolutionIndex: 227
    SolutionIndex: 228
    SolutionIndex: 229
    SolutionIndex: 230
    SolutionIndex: 231
    SolutionIndex: 232
    SolutionIndex: 233
    SolutionIndex: 234
    SolutionIndex: 235
    SolutionIndex: 236
    SolutionIndex: 237
    SolutionIndex: 238
    SolutionIndex: 239
    SolutionIndex: 240
    SolutionIndex: 241
    SolutionIndex: 242
    SolutionIndex: 243
    SolutionIndex: 244
    SolutionIndex: 245
    SolutionIndex: 246
    SolutionIndex: 247
    SolutionIndex: 248
    SolutionIndex: 249
    SolutionIndex: 250
    SolutionIndex: 251
    SolutionIndex: 252
    SolutionIndex: 253
    SolutionIndex: 254
    SolutionIndex: 255
    SolutionIndex: 256
    SolutionIndex: 257
    SolutionIndex: 258
    SolutionIndex: 259
    SolutionIndex: 260
    SolutionIndex: 261
    SolutionIndex: 262
    SolutionIndex: 263
    SolutionIndex: 264
    SolutionIndex: 265
    SolutionIndex: 266
    SolutionIndex: 267
    SolutionIndex: 268
    SolutionIndex: 269
    SolutionIndex: 270
    SolutionIndex: 271
    SolutionIndex: 272
    SolutionIndex: 273
    SolutionIndex: 274
    SolutionIndex: 275
    SolutionIndex: 276
    SolutionIndex: 277
    SolutionIndex: 278
    SolutionIndex: 279
    SolutionIndex: 280
    SolutionIndex: 281
    SolutionIndex: 282
    SolutionIndex: 283
    SolutionIndex: 284
    SolutionIndex: 285
    SolutionIndex: 286
    SolutionIndex: 287
    SolutionIndex: 288
    SolutionIndex: 289
    SolutionIndex: 290
    SolutionIndex: 291
    SolutionIndex: 292
    SolutionIndex: 293
    SolutionIndex: 294
    SolutionIndex: 295
    SolutionIndex: 296
    SolutionIndex: 297
    SolutionIndex: 298
    SolutionIndex: 299
    SolutionIndex: 300
    SolutionIndex: 301
    SolutionIndex: 302
    SolutionIndex: 303
    SolutionIndex: 304
    SolutionIndex: 305
    SolutionIndex: 306
    SolutionIndex: 307
    SolutionIndex: 308
    SolutionIndex: 309
    SolutionIndex: 310
    SolutionIndex: 311
    SolutionIndex: 312
    SolutionIndex: 313
    SolutionIndex: 314
    SolutionIndex: 315
    SolutionIndex: 316
    SolutionIndex: 317
    SolutionIndex: 318
    SolutionIndex: 319
    SolutionIndex: 320
    SolutionIndex: 321
    SolutionIndex: 322
    SolutionIndex: 323
    SolutionIndex: 324
    SolutionIndex: 325
    SolutionIndex: 326
    SolutionIndex: 327
    SolutionIndex: 328
    SolutionIndex: 329
    SolutionIndex: 330
    SolutionIndex: 331
    SolutionIndex: 332
    SolutionIndex: 333
    SolutionIndex: 334
    SolutionIndex: 335
    SolutionIndex: 336
    SolutionIndex: 337
    SolutionIndex: 338
    SolutionIndex: 339
    SolutionIndex: 340
    SolutionIndex: 341
    SolutionIndex: 342
    SolutionIndex: 343
    SolutionIndex: 344
    SolutionIndex: 345
    SolutionIndex: 346
    SolutionIndex: 347
    SolutionIndex: 348
    SolutionIndex: 349
    SolutionIndex: 350
    SolutionIndex: 351
    SolutionIndex: 352
    SolutionIndex: 353
    SolutionIndex: 354
    SolutionIndex: 355
    SolutionIndex: 356
    SolutionIndex: 357
- - - [34, 64, 1, 34]
    - [19, 0.008]
  - - [32, 64, 1, 35]
    - [18, 0.006]
  - - [64, 21, 1, 17]
    - [15, 0.002]
  - - [64, 32, 1, 35]
    - [18, 0.006]
  - - [21, 64, 1, 21]
    - [17, 0.003]
  - - [64, 30, 1, 31]
    - [18, 0.005]
  - - [15, 64, 1, 15]
    - [11, 0.001]
  - - [64, 24, 1, 24]
    - [18, 0.004]
  - - [17, 64, 1, 15]
    - [28, 0.002]
  - - [64, 35, 1, 35]
    - [15, 0.006]
  - - [32, 64, 1, 32]
    - [19, 0.007]
  - - [64, 34, 1, 24]
    - [18, 0.005]
  - - [64, 15, 1, 15]
    - [13, 0.001]
  - - [30, 64, 1, 30]
    - [39, 0.006]
  - - [30, 64, 1, 31]
    - [28, 0.007]
  - - [34, 64, 1, 24]
    - [41, 0.007]
  - - [64, 30, 1, 30]
    - [18, 0.005]
  - - [14, 64, 1, 14]
    - [11, 0.001]
  - - [64, 17, 1, 17]
    - [12, 0.001]
  - - [64, 17, 1, 15]
    - [12, 0.001]
  - - [64, 32, 1, 32]
    - [16, 0.007]
  - - [64, 31, 1, 31]
    - [18, 0.005]
  - - [17, 64, 1, 17]
    - [17, 0.002]
  - - [64, 21, 1, 21]
    - [12, 0.002]
  - - [35, 64, 1, 35]
    - [19, 0.008]
  - - [31, 64, 1, 31]
    - [28, 0.007]
  - - [21, 64, 1, 17]
    - [19, 0.003]
  - - [64, 15, 1, 15]
    - [13, 0.001]
  - - [64, 17, 1, 17]
    - [12, 0.001]
  - - [17, 64, 1, 17]
    - [17, 0.002]
  - - [64, 34, 1, 34]
    - [44, 0.007]
  - - [15, 64, 1, 14]
    - [14, 0.001]
  - - [24, 64, 1, 24]
    - [19, 0.004]
  - - [64, 14, 1, 14]
    - [14, 0.001]
  - - [15, 64, 1, 15]
    - [11, 0.001]
  - - [64, 15, 1, 14]
    - [15, 0.001]
  - - [64, 128, 512, 128]
    - [356, 32.414]
  - - [64, 512, 1, 512]
    - [327, 2.755]
  - - [64, 512, 64, 512]
    - [251, 46.846]
  - - [128, 64, 512, 128]
    - [306, 32.31]
  - - [512, 64, 1, 512]
    - [309, 2.638]
  - - [512, 64, 64, 512]
    - [196, 46.2]
  - - [1024, 2, 1, 4]
    - [282, 0.001]
  - - [1024, 2, 1, 32]
    - [252, 0.016]
  - - [1024, 2, 1, 2048]
    - [259, 0.299]
  - - [1024, 1024, 1, 4]
    - [228, 0.818]
  - - [1024, 1024, 1, 32]
    - [348, 7.566]
  - - [1024, 1024, 1, 2048]
    - [167, 54.097]
  - - [1024, 1024, 1, 4096]
    - [194, 57.543]
  - - [1024, 4096, 1, 2048]
    - [173, 76.451]
  - - [1024, 4096, 1, 4096]
    - [269, 77.989]
  - - [1024, 30528, 1, 2048]
    - [256, 93.88]
  - - [1024, 30528, 1, 4096]
    - [271, 95.32]
  - - [4096, 1024, 1, 2048]
    - [188, 77.258]
  - - [4096, 1024, 1, 4096]
    - [265, 79.005]
  - - [3, 64, 512, 3]
    - [289, 0.055]
  - - [5, 64, 512, 5]
    - [219, 0.15]
  - - [5, 64, 960, 5]
    - [219, 0.211]
  - - [9, 64, 512, 9]
    - [219, 0.469]
  - - [13, 512, 1, 32768]
    - [322, 1.476]
  - - [27, 128, 32768, 27]
    - [336, 9.525]
  - - [33, 32, 200, 33]
    - [264, 1.499]
  - - [33, 32, 1600, 33]
    - [274, 4.618]
  - - [67, 2048, 1, 512]
    - [345, 9.46]
  - - [74, 2048, 1, 512]
    - [175, 10.374]
  - - [74, 2048, 1, 960]
    - [287, 13.823]
  - - [100, 2048, 1, 512]
    - [181, 12.744]
  - - [256, 128, 1, 32768]
    - [340, 7.68]
  - - [256, 1280, 1, 8976]
    - [232, 47.704]
  - - [256, 2560, 1, 8976]
    - [189, 57.017]
  - - [256, 2816, 1, 8976]
    - [353, 62.752]
  - - [256, 3328, 1, 8976]
    - [224, 73.326]
  - - [256, 3584, 1, 8976]
    - [285, 78.845]
  - - [256, 3840, 1, 8976]
    - [272, 84.477]
  - - [256, 4096, 1, 8976]
    - [350, 57.739]
  - - [256, 4352, 1, 8976]
    - [263, 63.213]
  - - [256, 4864, 1, 8976]
    - [227, 70.128]
  - - [256, 5120, 1, 8976]
    - [317, 72.411]
  - - [256, 5632, 1, 8976]
    - [323, 72.586]
  - - [256, 5888, 1, 8976]
    - [307, 70.557]
  - - [256, 6144, 1, 8976]
    - [209, 73.524]
  - - [256, 7168, 1, 8976]
    - [268, 84.95]
  - - [256, 8192, 1, 8976]
    - [255, 67.964]
  - - [256, 8960, 1, 8976]
    - [320, 74.392]
  - - [256, 9728, 1, 8976]
    - [171, 77.796]
  - - [256, 9984, 1, 8976]
    - [171, 79.651]
  - - [256, 10240, 1, 8976]
    - [171, 81.106]
  - - [256, 10496, 1, 8976]
    - [249, 83.333]
  - - [256, 11008, 1, 8976]
    - [249, 86.916]
  - - [256, 11264, 1, 8976]
    - [171, 88.629]
  - - [256, 11520, 1, 8976]
    - [170, 88.919]
  - - [256, 11776, 1, 8976]
    - [257, 77.029]
  - - [256, 12544, 1, 8976]
    - [342, 78.862]
  - - [256, 12800, 1, 8976]
    - [195, 80.167]
  - - [256, 13312, 1, 8976]
    - [231, 83.131]
  - - [256, 13568, 1, 8976]
    - [179, 84.656]
  - - [256, 14336, 1, 8976]
    - [195, 89.177]
  - - [256, 14848, 1, 8976]
    - [203, 92.161]
  - - [256, 15104, 1, 8976]
    - [195, 93.777]
  - - [256, 15872, 1, 8976]
    - [333, 80.328]
  - - [256, 16128, 1, 8976]
    - [350, 82.029]
  - - [256, 17152, 1, 8976]
    - [171, 83.599]
  - - [256, 17408, 1, 8976]
    - [171, 84.664]
  - - [256, 18688, 1, 8976]
    - [249, 90.206]
  - - [256, 19968, 1, 8976]
    - [286, 83.596]
  - - [256, 20480, 1, 8976]
    - [195, 85.682]
  - - [256, 20992, 1, 8976]
    - [195, 87.789]
  - - [256, 21248, 1, 8976]
    - [195, 88.722]
  - - [256, 22016, 1, 8976]
    - [234, 91.742]
  - - [256, 26112, 1, 8976]
    - [315, 90.385]
  - - [256, 32512, 1, 8976]
    - [171, 88.594]
  - - [256, 32768, 1, 1]
    - [349, 0.71]
  - - [256, 33536, 1, 8976]
    - [171, 91.212]
  - - [256, 44505, 1, 8976]
    - [217, 92.651]
  - - [257, 4096, 1, 1024]
    - [281, 41.599]
  - - [480, 1024, 1, 32768]
    - [248, 48.52]
  - - [512, 32, 1, 200]
    - [310, 0.563]
  - - [512, 32, 1, 1600]
    - [298, 2.282]
  - - [512, 256, 1, 32768]
    - [301, 25.724]
  - - [512, 512, 1, 200]
    - [310, 8.316]
  - - [512, 512, 1, 1600]
    - [202, 25.655]
  - - [512, 2048, 1, 256]
    - [341, 33.054]
  - - [560, 1024, 1, 200]
    - [200, 14.602]
  - - [560, 1024, 1, 1600]
    - [339, 39.937]
  - - [768, 2048, 1, 256]
    - [293, 40.301]
  - - [1024, 64, 1, 512]
    - [244, 5.278]
  - - [1024, 64, 1, 960]
    - [287, 7.18]
  - - [1024, 256, 1, 1024]
    - [337, 21.023]
  - - [1024, 256, 1, 1280]
    - [297, 23.005]
  - - [1024, 256, 1, 2304]
    - [202, 29.515]
  - - [1024, 256, 1, 2816]
    - [202, 30.978]
  - - [1024, 256, 1, 3072]
    - [202, 31.598]
  - - [1024, 256, 1, 3328]
    - [232, 31.83]
  - - [1024, 256, 1, 3584]
    - [278, 32.931]
  - - [1024, 256, 1, 4096]
    - [207, 34.12]
  - - [1024, 256, 1, 4352]
    - [166, 34.608]
  - - [1024, 256, 1, 4608]
    - [300, 35.162]
  - - [1024, 256, 1, 5120]
    - [207, 36.355]
  - - [1024, 256, 1, 5376]
    - [207, 36.584]
  - - [1024, 256, 1, 5632]
    - [245, 36.992]
  - - [1024, 256, 1, 6144]
    - [163, 37.776]
  - - [1024, 256, 1, 6400]
    - [273, 38.062]
  - - [1024, 256, 1, 7680]
    - [172, 39.748]
  - - [1024, 256, 1, 7936]
    - [166, 39.855]
  - - [1024, 256, 1, 8192]
    - [245, 39.914]
  - - [1024, 256, 1, 8448]
    - [232, 40.165]
  - - [1024, 256, 1, 9728]
    - [165, 41.04]
  - - [1024, 256, 1, 9984]
    - [258, 41.27]
  - - [1024, 256, 1, 10496]
    - [166, 41.431]
  - - [1024, 256, 1, 11520]
    - [273, 42.213]
  - - [1024, 256, 1, 12032]
    - [208, 42.411]
  - - [1024, 256, 1, 13568]
    - [262, 42.95]
  - - [1024, 256, 1, 14336]
    - [207, 43.206]
  - - [1024, 256, 1, 14848]
    - [229, 43.261]
  - - [1024, 256, 1, 15104]
    - [163, 43.414]
  - - [1024, 256, 1, 15872]
    - [165, 43.555]
  - - [1024, 256, 1, 16128]
    - [300, 43.598]
  - - [1024, 256, 1, 17152]
    - [163, 43.923]
  - - [1024, 256, 1, 17408]
    - [262, 44.073]
  - - [1024, 256, 1, 18944]
    - [163, 44.451]
  - - [1024, 256, 1, 19712]
    - [208, 44.508]
  - - [1024, 256, 1, 19968]
    - [258, 44.392]
  - - [1024, 256, 1, 21248]
    - [245, 44.61]
  - - [1024, 256, 1, 21504]
    - [163, 44.651]
  - - [1024, 256, 1, 22016]
    - [242, 44.748]
  - - [1024, 256, 1, 28672]
    - [166, 45.63]
  - - [1024, 256, 1, 33536]
    - [166, 45.833]
  - - [1024, 512, 1, 32768]
    - [332, 51.056]
  - - [1024, 1024, 1, 200]
    - [357, 23.225]
  - - [1024, 1024, 1, 512]
    - [299, 41.523]
  - - [1024, 1024, 1, 960]
    - [239, 48.937]
  - - [1024, 1024, 1, 1600]
    - [354, 52.51]
  - - [1024, 1024, 1, 32768]
    - [294, 61.184]
  - - [1600, 1024, 1, 512]
    - [261, 52.687]
  - - [1600, 1024, 1, 960]
    - [184, 60.951]
  - - [2048, 256, 1, 1024]
    - [220, 34.178]
  - - [2048, 960, 1, 1]
    - [236, 0.344]
  - - [2048, 2048, 1, 512]
    - [182, 65.145]
  - - [2048, 2048, 1, 960]
    - [210, 71.502]
  - - [2048, 2048, 1, 1024]
    - [188, 72.684]
  - - [3200, 2048, 1, 1024]
    - [334, 81.934]
  - - [4096, 4096, 1, 1024]
    - [203, 88.193]
  - - [14, 64, 10880, 14]
    - [279, 3.165]
  - - [15, 64, 10880, 14]
    - [289, 3.35]
  - - [15, 64, 7680, 15]
    - [321, 3.376]
  - - [15, 64, 10880, 15]
    - [186, 3.567]
  - - [17, 64, 7680, 15]
    - [279, 3.766]
  - - [17, 64, 6144, 17]
    - [325, 3.661]
  - - [17, 64, 7680, 17]
    - [198, 3.922]
  - - [21, 64, 6144, 17]
    - [254, 4.067]
  - - [21, 64, 6144, 21]
    - [205, 4.955]
  - - [24, 64, 4736, 24]
    - [205, 6.382]
  - - [30, 64, 2048, 30]
    - [235, 6.987]
  - - [30, 64, 2048, 31]
    - [235, 7.153]
  - - [31, 64, 2048, 31]
    - [235, 7.123]
  - - [32, 64, 4608, 32]
    - [343, 13.522]
  - - [32, 64, 4608, 35]
    - [250, 10.372]
  - - [34, 64, 4736, 24]
    - [204, 7.467]
  - - [34, 64, 4736, 34]
    - [305, 8.652]
  - - [35, 64, 4608, 35]
    - [305, 8.68]
  - - [64, 14, 10880, 14]
    - [296, 2.74]
  - - [64, 15, 10880, 14]
    - [346, 2.921]
  - - [64, 15, 7680, 15]
    - [338, 2.969]
  - - [64, 15, 10880, 15]
    - [237, 3.119]
  - - [64, 17, 7680, 15]
    - [324, 3.332]
  - - [64, 17, 6144, 17]
    - [211, 3.308]
  - - [64, 17, 7680, 17]
    - [351, 3.662]
  - - [64, 21, 6144, 17]
    - [191, 4.011]
  - - [64, 21, 6144, 21]
    - [304, 4.844]
  - - [64, 24, 4736, 24]
    - [192, 5.615]
  - - [64, 30, 2048, 30]
    - [237, 6.772]
  - - [64, 30, 2048, 31]
    - [221, 6.934]
  - - [64, 31, 2048, 31]
    - [308, 6.996]
  - - [64, 32, 4608, 32]
    - [237, 13.686]
  - - [64, 32, 4608, 35]
    - [183, 10.356]
  - - [64, 34, 4736, 24]
    - [314, 7.067]
  - - [64, 34, 4736, 34]
    - [183, 8.899]
  - - [64, 35, 4608, 35]
    - [183, 8.968]
  - - [1024, 1024, 1, 3840]
    - [331, 57.18]
  - - [1024, 1024, 1, 3968]
    - [201, 57.643]
  - - [1024, 1024, 1, 6528]
    - [241, 59.314]
  - - [1024, 1024, 1, 7104]
    - [241, 59.303]
  - - [1024, 1024, 1, 7200]
    - [247, 57.794]
  - - [1024, 1024, 1, 8064]
    - [194, 59.813]
  - - [1024, 1024, 1, 8160]
    - [241, 58.384]
  - - [1024, 1024, 1, 9216]
    - [247, 59.991]
  - - [1024, 1024, 1, 9520]
    - [194, 58.865]
  - - [1024, 1024, 1, 10064]
    - [194, 59.101]
  - - [1024, 1024, 1, 10080]
    - [194, 59.035]
  - - [1024, 1024, 1, 10200]
    - [194, 58.878]
  - - [1024, 4096, 1, 3840]
    - [246, 77.935]
  - - [1024, 4096, 1, 3968]
    - [246, 78.071]
  - - [1024, 4096, 1, 6528]
    - [180, 78.999]
  - - [1024, 4096, 1, 7104]
    - [180, 79.284]
  - - [1024, 4096, 1, 7200]
    - [269, 79.085]
  - - [1024, 4096, 1, 8064]
    - [233, 79.559]
  - - [1024, 4096, 1, 8160]
    - [174, 79.261]
  - - [1024, 4096, 1, 9216]
    - [233, 79.97]
  - - [1024, 4096, 1, 9520]
    - [206, 78.968]
  - - [1024, 4096, 1, 10064]
    - [177, 79.013]
  - - [1024, 4096, 1, 10080]
    - [177, 79.657]
  - - [1024, 4096, 1, 10200]
    - [210, 79.046]
  - - [1024, 42720, 1, 3968]
    - [222, 93.735]
  - - [1024, 42720, 1, 6528]
    - [222, 94.206]
  - - [1024, 42720, 1, 7104]
    - [210, 94.109]
  - - [1024, 42720, 1, 7200]
    - [182, 94.066]
  - - [1024, 42720, 1, 9520]
    - [288, 94.075]
  - - [1024, 42720, 1, 10080]
    - [217, 93.959]
  - - [4096, 1024, 1, 3840]
    - [174, 79.101]
  - - [4096, 1024, 1, 3968]
    - [188, 78.981]
  - - [4096, 1024, 1, 6528]
    - [180, 79.663]
  - - [4096, 1024, 1, 7104]
    - [216, 79.91]
  - - [4096, 1024, 1, 7200]
    - [193, 80.049]
  - - [4096, 1024, 1, 8064]
    - [188, 80.184]
  - - [4096, 1024, 1, 8160]
    - [182, 80.133]
  - - [4096, 1024, 1, 9216]
    - [193, 80.218]
  - - [4096, 1024, 1, 9520]
    - [188, 79.735]
  - - [4096, 1024, 1, 10064]
    - [188, 79.853]
  - - [4096, 1024, 1, 10080]
    - [193, 80.133]
  - - [4096, 1024, 1, 10200]
    - [188, 79.636]
  - - [27, 64, 1920, 27]
    - [116, 3.275]
  - - [27, 64, 1920, 33]
    - [113, 3.57]
  - - [33, 64, 1920, 33]
    - [64, 3.548]
  - - [64, 27, 1920, 27]
    - [88, 2.525]
  - - [64, 27, 1920, 33]
    - [111, 2.903]
  - - [64, 33, 1920, 33]
    - [54, 3.716]
  - - [1024, 1024, 1, 3240]
    - [122, 26.989]
  - - [1024, 1024, 1, 3960]
    - [93, 27.424]
  - - [1024, 4096, 1, 3240]
    - [124, 38.306]
  - - [1024, 4096, 1, 3960]
    - [91, 38.342]
  - - [1024, 42720, 1, 3960]
    - [115, 45.984]
  - - [4096, 1024, 1, 3240]
    - [85, 38.398]
  - - [4096, 1024, 1, 3960]
    - [85, 38.589]
  - - [64, 1280, 64, 192]
    - [126, 44.859]
  - - [64, 1280, 64, 320]
    - [127, 56.274]
  - - [64, 1280, 64, 384]
    - [128, 60.485]
  - - [64, 1280, 64, 448]
    - [128, 62.625]
  - - [64, 2048, 64, 192]
    - [129, 49.418]
  - - [64, 2048, 64, 320]
    - [130, 60.459]
  - - [64, 2048, 64, 384]
    - [131, 64.207]
  - - [64, 2048, 64, 448]
    - [131, 67.569]
  - - [1225, 192, 64, 32]
    - [132, 23.057]
  - - [1225, 192, 64, 48]
    - [133, 19.685]
  - - [1225, 192, 64, 64]
    - [132, 35.99]
  - - [1225, 256, 64, 48]
    - [134, 20.305]
  - - [1225, 256, 64, 64]
    - [132, 36.316]
  - - [1225, 288, 64, 48]
    - [135, 18.16]
  - - [1225, 288, 64, 64]
    - [136, 32.314]
  - - [5329, 64, 64, 80]
    - [135, 25.613]
  - - [289, 768, 64, 128]
    - [137, 44.486]
  - - [289, 768, 64, 160]
    - [137, 49.349]
  - - [289, 768, 64, 192]
    - [130, 54.075]
  - - [64, 1280, 32, 192]
    - [138, 39.251]
  - - [64, 1280, 32, 320]
    - [127, 50.322]
  - - [64, 1280, 32, 384]
    - [127, 53.525]
  - - [64, 1280, 32, 448]
    - [128, 56.652]
  - - [64, 2048, 32, 192]
    - [139, 43.312]
  - - [64, 2048, 32, 320]
    - [140, 53.223]
  - - [64, 2048, 32, 384]
    - [141, 56.241]
  - - [64, 2048, 32, 448]
    - [131, 59.408]
  - - [1225, 192, 32, 32]
    - [142, 19.599]
  - - [1225, 192, 32, 48]
    - [143, 18.079]
  - - [1225, 192, 32, 64]
    - [144, 31.195]
  - - [1225, 256, 32, 48]
    - [144, 18.14]
  - - [1225, 256, 32, 64]
    - [132, 33.206]
  - - [1225, 288, 32, 48]
    - [145, 16.932]
  - - [1225, 288, 32, 64]
    - [133, 29.722]
  - - [5329, 64, 32, 80]
    - [146, 24.61]
  - - [289, 768, 32, 128]
    - [136, 40.418]
  - - [289, 768, 32, 160]
    - [147, 43.855]
  - - [289, 768, 32, 192]
    - [130, 47.886]
  - - [3136, 64, 64, 256]
    - [148, 58.504]
  - - [3136, 64, 64, 64]
    - [149, 37.621]
  - - [3136, 256, 64, 64]
    - [150, 47.6]
  - - [784, 128, 64, 512]
    - [131, 71.733]
  - - [784, 512, 64, 128]
    - [151, 58.228]
  - - [196, 256, 64, 1024]
    - [130, 55.249]
  - - [196, 1024, 64, 256]
    - [134, 52.515]
  - - [49, 512, 64, 2048]
    - [152, 44.406]
  - - [49, 2048, 64, 512]
    - [153, 45.965]
  - - [3136, 64, 32, 256]
    - [154, 54.178]
  - - [3136, 64, 32, 64]
    - [139, 31.273]
  - - [3136, 256, 32, 64]
    - [150, 45.122]
  - - [784, 128, 32, 512]
    - [131, 62.168]
  - - [784, 512, 32, 128]
    - [138, 51.203]
  - - [196, 256, 32, 1024]
    - [155, 46.275]
  - - [196, 1024, 32, 256]
    - [130, 46.137]
  - - [49, 512, 32, 2048]
    - [142, 38.133]
  - - [49, 2048, 32, 512]
    - [145, 41.252]
  - - [3136, 64, 64, 128]
    - [156, 46.91]
  - - [3136, 128, 64, 256]
    - [157, 77.858]
  - - [784, 256, 64, 512]
    - [138, 76.646]
  - - [3136, 256, 64, 128]
    - [158, 70.947]
  - - [3136, 256, 64, 256]
    - [158, 83.369]
  - - [196, 512, 64, 1024]
    - [137, 62.58]
  - - [784, 512, 64, 256]
    - [158, 71.567]
  - - [784, 512, 64, 512]
    - [138, 78.453]
  - - [196, 1024, 64, 512]
    - [159, 60.31]
  - - [196, 1024, 64, 1024]
    - [134, 65.441]
  - - [49, 1024, 64, 2048]
    - [147, 53.241]
  - - [49, 2048, 64, 1024]
    - [160, 53.988]
  - - [3136, 64, 32, 128]
    - [156, 40.922]
  - - [3136, 128, 32, 256]
    - [131, 71.4]
  - - [784, 256, 32, 512]
    - [138, 72.408]
  - - [3136, 256, 32, 128]
    - [157, 64.718]
  - - [3136, 256, 32, 256]
    - [157, 78.553]
  - - [196, 512, 32, 1024]
    - [137, 54.952]
  - - [784, 512, 32, 256]
    - [131, 66.754]
  - - [784, 512, 32, 512]
    - [138, 75.195]
  - - [196, 1024, 32, 512]
    - [140, 55.1]
  - - [196, 1024, 32, 1024]
    - [161, 61.424]
  - - [49, 1024, 32, 2048]
    - [162, 47.162]
  - - [49, 2048, 32, 1024]
    - [160, 47.972]
  - - [64, 128, 624, 128]
    - [164, 32.745]
  - - [1024, 1024, 1, 1024]
    - [167, 51.137]
  - - [1024, 1024, 1, 1280]
    - [168, 51.162]
  - - [1024, 1024, 1, 39]
    - [169, 7.087]
  - - [1024, 4096, 1, 2560]
    - [173, 77.325]
  - - [1024, 4096, 1, 1024]
    - [174, 72.032]
  - - [33, 32, 1, 33]
    - [176, 0.009]
  - - [1024, 2, 1, 4992]
    - [178, 0.43]
  - - [64, 128, 144, 128]
    - [185, 21.74]
  - - [512, 512, 1, 512]
    - [187, 16.974]
  - - [1024, 2, 1, 39]
    - [190, 0.018]
  - - [1024, 1024, 1, 8192]
    - [194, 59.901]
  - - [1024, 960, 1, 1024]
    - [197, 59.062]
  - - [1024, 1024, 1, 308]
    - [199, 30.376]
  - - [1024, 2, 1, 5]
    - [200, 0.003]
  - - [1024, 1024, 1, 4992]
    - [194, 58.387]
  - - [4096, 3840, 1, 4096]
    - [179, 96.126]
  - - [4096, 1024, 1, 3072]
    - [193, 78.504]
  - - [64, 512, 96, 512]
    - [212, 53.26]
  - - [1024, 1024, 1, 5248]
    - [201, 58.389]
  - - [4096, 1024, 1, 4992]
    - [213, 79.491]
  - - [1024, 1024, 1, 180]
    - [214, 21.541]
  - - [5, 64, 1, 5]
    - [215, 0.0]
  - - [4096, 1024, 1, 2560]
    - [216, 78.077]
  - - [1024, 33712, 1, 9600]
    - [217, 94.611]
  - - [64, 128, 640, 128]
    - [218, 33.317]
  - - [1024, 1024, 1, 5]
    - [221, 1.023]
  - - [4, 64, 32768, 4]
    - [223, 0.332]
  - - [1024, 2, 1, 40]
    - [200, 0.018]
  - - [1024, 30522, 1, 160]
    - [225, 67.094]
  - - [1024, 1024, 1, 800]
    - [226, 47.292]
  - - [1024, 1024, 1, 41]
    - [228, 7.451]
  - - [1024, 2, 1, 5248]
    - [230, 0.448]
  - - [4096, 4096, 1, 4096]
    - [217, 91.564]
  - - [1024, 30522, 1, 385]
    - [231, 80.148]
  - - [1024, 4096, 1, 9600]
    - [233, 79.893]
  - - [2048, 512, 1, 1]
    - [235, 0.226]
  - - [1024, 4096, 1, 1152]
    - [238, 73.109]
  - - [1024, 2, 1, 512]
    - [240, 0.142]
  - - [64, 4, 38400, 4]
    - [183, 0.338]
  - - [1024, 30522, 1, 180]
    - [243, 67.239]
  - - [4096, 1024, 1, 512]
    - [177, 65.462]
  - - [4096, 1024, 1, 1024]
    - [246, 72.75]
  - - [4, 64, 38400, 4]
    - [223, 0.335]
  - - [1024, 2, 1, 9]
    - [200, 0.004]
  - - [8192, 8192, 1, 8192]
    - [253, 95.115]
  - - [4096, 1024, 1, 1280]
    - [177, 74.71]
  - - [1024, 1024, 1, 3072]
    - [241, 56.241]
  - - [64, 128, 656, 128]
    - [260, 33.792]
  - - [1024, 4096, 1, 4992]
    - [206, 78.661]
  - - [1024, 1024, 1, 9]
    - [266, 1.785]
  - - [1024, 4096, 1, 512]
    - [173, 64.724]
  - - [64, 512, 16, 512]
    - [267, 27.012]
  - - [1024, 2, 1, 6]
    - [200, 0.003]
  - - [2048, 1920, 1, 2048]
    - [231, 90.745]
  - - [1024, 30522, 1, 780]
    - [231, 87.849]
  - - [64, 128, 128, 128]
    - [270, 19.78]
  - - [1024, 30522, 1, 800]
    - [271, 89.532]
  - - [960, 1024, 1, 1024]
    - [275, 61.773]
  - - [1024, 1024, 1, 6]
    - [276, 1.226]
  - - [8192, 7680, 1, 8192]
    - [277, 97.126]
  - - [1024, 2, 1, 1152]
    - [280, 0.231]
  - - [1024, 1024, 1, 2560]
    - [283, 55.333]
  - - [1024, 1024, 1, 77]
    - [284, 12.489]
  - - [1024, 1024, 1, 160]
    - [270, 25.324]
  - - [1024, 4096, 1, 8192]
    - [184, 79.601]
  - - [1024, 2, 1, 41]
    - [252, 0.018]
  - - [128, 64, 1, 128]
    - [290, 0.243]
  - - [480, 512, 1, 512]
    - [291, 18.545]
  - - [1024, 1024, 1, 462]
    - [292, 35.839]
  - - [1024, 1024, 1, 780]
    - [226, 43.737]
  - - [1024, 4096, 1, 5248]
    - [184, 78.639]
  - - [1024, 4096, 1, 1280]
    - [174, 73.399]
  - - [4096, 1024, 1, 9600]
    - [188, 80.259]
  - - [64, 512, 80, 512]
    - [295, 54.849]
  - - [4096, 1024, 1, 1152]
    - [174, 73.705]
  - - [1024, 1600, 1, 1]
    - [276, 0.313]
  - - [1024, 1024, 1, 820]
    - [281, 44.091]
  - - [1024, 2, 1, 2560]
    - [230, 0.34]
  - - [4096, 1024, 1, 5248]
    - [188, 79.765]
  - - [1024, 33712, 1, 8192]
    - [217, 94.528]
  - - [1024, 1024, 1, 385]
    - [302, 33.883]
  - - [1024, 1024, 1, 1]
    - [303, 0.22]
  - - [1024, 2, 1, 10]
    - [200, 0.004]
  - - [64, 4, 32768, 4]
    - [183, 0.334]
  - - [1024, 1024, 1, 10]
    - [228, 2.002]
  - - [1024, 2, 1, 5120]
    - [311, 0.434]
  - - [1920, 2048, 1, 2048]
    - [312, 90.963]
  - - [2048, 2048, 1, 2048]
    - [313, 78.046]
  - - [3840, 4096, 1, 4096]
    - [316, 96.05]
  - - [1024, 4096, 1, 5120]
    - [184, 78.734]
  - - [64, 128, 160, 128]
    - [270, 23.79]
  - - [1024, 30522, 1, 308]
    - [318, 77.261]
  - - [1024, 30522, 1, 820]
    - [231, 88.096]
  - - [1024, 30522, 1, 200]
    - [319, 68.701]
  - - [1024, 30522, 1, 462]
    - [277, 81.355]
  - - [1024, 2, 1, 1024]
    - [326, 0.225]
  - - [1024, 30522, 1, 77]
    - [328, 39.651]
  - - [1024, 1024, 1, 40]
    - [329, 7.851]
  - - [1024, 2, 1, 1]
    - [330, 0.001]
  - - [1024, 2, 1, 8]
    - [200, 0.004]
  - - [1024, 1024, 1, 8]
    - [335, 1.939]
  - - [1024, 1024, 1, 9600]
    - [194, 60.233]
  - - [4096, 1024, 1, 5120]
    - [265, 79.387]
  - - [1024, 4096, 1, 3072]
    - [269, 77.619]
  - - [1024, 1024, 1, 1152]
    - [344, 49.8]
  - - [512, 480, 1, 512]
    - [187, 17.842]
  - - [64, 128, 1, 128]
    - [347, 0.246]
  - - [1024, 1024, 1, 5120]
    - [241, 58.66]
  - - [1024, 2, 1, 3072]
    - [230, 0.364]
  - - [7680, 8192, 1, 8192]
    - [217, 97.125]
  - - [4096, 1024, 1, 8192]
    - [180, 79.898]
  - - [1024, 2, 1, 1280]
    - [352, 0.243]
  - - [479, 1024, 1, 32768]
    - [355, 46.938]
- null
