library/src/blas3/Tensile/Logic/asm_full/arcturus_Cijk_Alik_Bjlk_HBH_GB.yaml
- {MinimumRequiredVersion: 4.25.0}
- arcturus
- gfx908
- [Device 7380, Device 7388, Device 738c, Device 7390]
    SolutionIndex: 0
    SolutionNameMin: Cijk_Alik_Bjlk_HBH_GB_MT32x32x64_MI16x16x16x1_SN_1LDSB0_EPS1_GRVW4_LPA16_NLCB1_PGR1_PLR5_SU0_SUS128_TT1_16_WG32_8_1_WGM1
    SolutionIndex: 1
    SolutionNameMin: Cijk_Alik_Bjlk_HBH_GB_MT64x64x32_MI32x32x8x1_SN_1LDSB0_EPS0_GRVW8_LPA8_NLCB1_PGR2_PLR5_SU0_SUS128_TT1_32_WG64_4_1_WGM1
    SolutionIndex: 2
    SolutionNameMin: Cijk_Alik_Bjlk_HBH_GB_MT32x32x64_MI16x16x16x1_SN_1LDSB0_EPS1_GRVW8_LPA16_NLCB1_PGR1_PLR5_SU0_SUS128_TT1_16_WG32_8_1_WGM1
    SolutionIndex: 3
    SolutionNameMin: Cijk_Alik_Bjlk_HBH_GB_MT32x32x64_MI16x16x16x1_SN_1LDSB0_EPS0_GRVW8_LPA16_NLCB1_PGR2_PLR5_SU0_SUS128_TT1_16_WG32_8_1_WGM1
    SolutionIndex: 4
    SolutionNameMin: Cijk_Alik_Bjlk_HBH_GB_MT64x32x32_MI16x16x16x1_SN_1LDSB0_EPS1_GRVW8_LPA16_NLCB1_PGR1_PLR2_SU0_SUS256_TT2_16_WG32_8_1_WGM1
    SolutionIndex: 5
    SolutionNameMin: Cijk_Alik_Bjlk_HBH_GB_MT64x128x32_MI32x32x8x1_SN_1LDSB0_EPS0_GRVW8_LPA8_NLCB1_PGR2_PLR5_SU0_SUS256_TT1_64_WG64_4_1_WGM1
    SolutionIndex: 6
    SolutionNameMin: Cijk_Alik_Bjlk_HBH_GB_MT32x32x64_MI16x16x16x1_SN_1LDSB0_EPS1_GRVW8_LPA16_NLCB1_PGR1_PLR5_SU0_SUS256_TT1_16_WG32_8_1_WGM1
    SolutionIndex: 7
    SolutionNameMin: Cijk_Alik_Bjlk_HBH_GB_MT32x32x64_MI16x16x16x1_SN_1LDSB0_EPS0_GRVW8_LPA16_NLCB1_PGR2_PLR5_SU0_SUS256_TT1_16_WG32_8_1_WGM1
    SolutionIndex: 8
    SolutionNameMin: Cijk_Alik_Bjlk_HBH_GB_MT64x32x64_MI16x16x16x1_SN_1LDSB0_EPS0_GRVW8_LPA16_NLCB1_PGR2_PLR5_SU0_SUS256_TT2_16_WG32_8_1_WGM1
    SolutionIndex: 9
    SolutionNameMin: Cijk_Alik_Bjlk_HBH_GB_MT32x32x64_MI16x16x16x1_SN_1LDSB0_EPS0_GRVW8_LPA16_NLCB1_PGR2_PLR5_SU32_SUS128_TT1_16_WG32_8_1_WGM1
    SolutionIndex: 10
    SolutionNameMin: Cijk_Alik_Bjlk_HBH_GB_MT32x32x64_MI16x16x16x1_SN_1LDSB0_EPS0_GRVW8_LPA16_NLCB1_PGR2_PLR5_SU32_SUS256_TT1_16_WG32_8_1_WGM1
    SolutionIndex: 11
    SolutionNameMin: Cijk_Alik_Bjlk_HBH_GB_MT32x32x64_MI16x16x16x1_SN_1LDSB0_EPS0_GRVW8_LPA16_NLCB1_PGR2_PLR5_SU0_SUS128_TT1_16_WG32_8_1_WGM2
    SolutionIndex: 12
    SolutionNameMin: Cijk_Alik_Bjlk_HBH_GB_MT128x64x32_MI32x32x8x1_SN_1LDSB0_EPS0_GRVW8_LPA8_NLCB1_PGR2_PLR5_SU0_SUS256_TT2_32_WG64_4_1_WGM2
    SolutionIndex: 13
    SolutionNameMin: Cijk_Alik_Bjlk_HBH_GB_MT32x32x64_MI16x16x16x1_SN_1LDSB0_EPS0_GRVW8_LPA16_NLCB1_PGR2_PLR5_SU0_SUS256_TT1_16_WG32_8_1_WGM2
    SolutionIndex: 14
    SolutionNameMin: Cijk_Alik_Bjlk_HBH_GB_MT32x32x64_MI16x16x16x1_SN_1LDSB0_EPS0_GRVW8_LPA16_NLCB1_PGR2_PLR5_SU32_SUS128_TT1_16_WG32_8_1_WGM2
    SolutionIndex: 15
    SolutionNameMin: Cijk_Alik_Bjlk_HBH_GB_MT32x32x64_MI16x16x16x1_SN_1LDSB0_EPS0_GRVW8_LPA16_NLCB1_PGR2_PLR5_SU0_SUS128_TT1_16_WG32_8_1_WGM15
    SolutionIndex: 16
    SolutionNameMin: Cijk_Alik_Bjlk_HBH_GB_MT32x32x32_MI16x16x16x1_SN_1LDSB0_EPS0_GRVW8_LPA16_NLCB1_PGR2_PLR2_SU0_SUS256_TT1_16_WG32_8_1_WGM15
    SolutionIndex: 17
    SolutionNameMin: Cijk_Alik_Bjlk_HBH_GB_MT32x32x64_MI16x16x16x1_SN_1LDSB0_EPS0_GRVW8_LPA16_NLCB1_PGR2_PLR5_SU0_SUS256_TT1_16_WG32_8_1_WGM15
- - - [32, 32, 8, 128, 32, 32, 128, 32]
    - [13, 175.0]
  - - [128, 128, 8, 128, 128, 128, 128, 128]
    - [0, 2655.0]
  - - [256, 256, 8, 128, 256, 256, 128, 256]
    - [4, 8830.0]
  - - [512, 512, 8, 128, 512, 512, 128, 512]
    - [5, 18437.0]
  - - [32, 32, 8, 512, 32, 32, 512, 32]
    - [3, 499.0]
  - - [128, 128, 8, 512, 128, 128, 512, 128]
    - [10, 7294.0]
  - - [256, 256, 8, 512, 256, 256, 512, 256]
    - [1, 19973.0]
  - - [512, 512, 8, 512, 512, 512, 512, 512]
    - [12, 36772.0]
  - - [32, 32, 8, 1024, 32, 32, 1024, 32]
    - [13, 744.0]
  - - [128, 128, 8, 1024, 128, 128, 1024, 128]
    - [8, 10046.0]
  - - [256, 256, 8, 1024, 256, 256, 1024, 256]
    - [1, 25229.0]
  - - [512, 512, 8, 1024, 512, 512, 1024, 512]
    - [12, 42273.0]
  - - [32, 128, 8, 128, 32, 32, 128, 128]
    - [2, 681.0]
  - - [32, 256, 8, 128, 32, 32, 128, 256]
    - [15, 1380.0]
  - - [32, 512, 8, 128, 32, 32, 128, 512]
    - [16, 2655.0]
  - - [32, 128, 8, 512, 32, 32, 512, 128]
    - [14, 1960.0]
  - - [32, 256, 8, 512, 32, 32, 512, 256]
    - [15, 4033.0]
  - - [32, 512, 8, 512, 32, 32, 512, 512]
    - [15, 7109.0]
  - - [32, 128, 8, 1024, 32, 32, 1024, 128]
    - [7, 2954.0]
  - - [32, 256, 8, 1024, 32, 32, 1024, 256]
    - [17, 5825.0]
  - - [32, 512, 8, 1024, 32, 32, 1024, 512]
    - [15, 9754.0]
  - - [128, 32, 8, 128, 128, 128, 128, 32]
    - [7, 681.0]
  - - [256, 32, 8, 128, 256, 256, 128, 32]
    - [2, 1362.0]
  - - [512, 32, 8, 128, 512, 512, 128, 32]
    - [6, 2724.0]
  - - [128, 32, 8, 512, 128, 128, 512, 32]
    - [7, 2076.0]
  - - [256, 32, 8, 512, 256, 256, 512, 32]
    - [7, 4033.0]
  - - [512, 32, 8, 512, 512, 512, 512, 32]
    - [10, 7424.0]
  - - [128, 32, 8, 1024, 128, 128, 1024, 32]
    - [11, 3017.0]
  - - [256, 32, 8, 1024, 256, 256, 1024, 32]
    - [13, 6214.0]
  - - [512, 32, 8, 1024, 512, 512, 1024, 32]
    - [9, 10552.0]
- null
