library/src/blas3/Tensile/Logic/asm_full/arcturus_Cijk_Ailk_Bljk_ZB_GB.yaml
- {MinimumRequiredVersion: 4.26.0}
- arcturus
- gfx908
- [Device 7380, Device 7388, Device 738c, Device 7390]
    SolutionIndex: 0
    SolutionNameMin: Cijk_Ailk_Bljk_ZB_GB_MT32x128x8_SN_PLR1_SU0_SUM0_SUS256_SNLL1_TT4_4_WG8_32_1_WGM1
    SolutionIndex: 1
    SolutionNameMin: Cijk_Ailk_Bljk_ZB_GB_MT64x64x8_SN_PLR1_SU0_SUM0_SUS256_SNLL1_TT4_4_WG16_16_1_WGM1
    SolutionIndex: 2
    SolutionNameMin: Cijk_Ailk_Bljk_ZB_GB_MT64x64x8_SN_PLR0_SU0_SUM0_SUS256_SNLL1_TT4_4_WG16_16_1_WGM1
    SolutionIndex: 3
    SolutionNameMin: Cijk_Ailk_Bljk_ZB_GB_MT128x32x8_SN_PLR1_SU0_SUM0_SUS256_SNLL1_TT4_4_WG32_8_1_WGM1
    SolutionIndex: 4
    SolutionNameMin: Cijk_Ailk_Bljk_ZB_GB_MT64x64x16_SN_PLR1_SU0_SUM0_SUS256_SNLL1_TT4_4_WG16_16_1_WGM1
    SolutionIndex: 5
    SolutionNameMin: Cijk_Ailk_Bljk_ZB_GB_MT32x128x8_SN_PLR1_SU32_SUM0_SUS128_SNLL1_TT4_4_WG8_32_1_WGM1
    SolutionIndex: 6
    SolutionNameMin: Cijk_Ailk_Bljk_ZB_GB_MT64x64x8_SN_PLR1_SU32_SUM0_SUS128_SNLL1_TT4_4_WG16_16_1_WGM1
    SolutionIndex: 7
    SolutionNameMin: Cijk_Ailk_Bljk_ZB_GB_MT64x64x8_SN_PLR0_SU32_SUM0_SUS128_SNLL1_TT4_4_WG16_16_1_WGM1
    SolutionIndex: 8
    SolutionNameMin: Cijk_Ailk_Bljk_ZB_GB_MT128x32x8_SN_PLR1_SU32_SUM0_SUS128_SNLL1_TT4_4_WG32_8_1_WGM1
    SolutionIndex: 9
    SolutionNameMin: Cijk_Ailk_Bljk_ZB_GB_MT64x64x8_SN_PLR1_SU32_SUM3_SUS128_SNLL1_TT4_4_WG16_16_1_WGM1
    SolutionIndex: 10
    SolutionNameMin: Cijk_Ailk_Bljk_ZB_GB_MT64x64x8_SN_PLR0_SU32_SUM3_SUS128_SNLL1_TT4_4_WG16_16_1_WGM1
    SolutionIndex: 11
    SolutionNameMin: Cijk_Ailk_Bljk_ZB_GB_MT128x32x8_SN_PLR1_SU32_SUM3_SUS128_SNLL1_TT4_4_WG32_8_1_WGM1
    SolutionIndex: 12
    SolutionNameMin: Cijk_Ailk_Bljk_ZB_GB_MT64x64x8_SN_PLR1_SU32_SUM0_SUS256_SNLL1_TT4_4_WG16_16_1_WGM1
    SolutionIndex: 13
    SolutionNameMin: Cijk_Ailk_Bljk_ZB_GB_MT64x64x8_SN_PLR0_SU32_SUM0_SUS256_SNLL1_TT4_4_WG16_16_1_WGM1
    SolutionIndex: 14
    SolutionNameMin: Cijk_Ailk_Bljk_ZB_GB_MT32x128x8_SN_PLR1_SU32_SUM3_SUS256_SNLL1_TT4_4_WG8_32_1_WGM1
    SolutionIndex: 15
    SolutionNameMin: Cijk_Ailk_Bljk_ZB_GB_MT64x64x8_SN_PLR0_SU32_SUM3_SUS256_SNLL1_TT4_4_WG16_16_1_WGM1
    SolutionIndex: 16
    SolutionNameMin: Cijk_Ailk_Bljk_ZB_GB_MT32x128x8_SN_PLR1_SU0_SUM0_SUS256_SNLL1_TT4_4_WG8_32_1_WGM8
    SolutionIndex: 17
    SolutionNameMin: Cijk_Ailk_Bljk_ZB_GB_MT64x64x8_SN_PLR1_SU0_SUM0_SUS256_SNLL1_TT4_4_WG16_16_1_WGM8
    SolutionIndex: 18
    SolutionNameMin: Cijk_Ailk_Bljk_ZB_GB_MT64x64x8_SN_PLR0_SU0_SUM0_SUS256_SNLL1_TT4_4_WG16_16_1_WGM8
    SolutionIndex: 19
    SolutionNameMin: Cijk_Ailk_Bljk_ZB_GB_MT128x32x8_SN_PLR1_SU0_SUM0_SUS256_SNLL1_TT4_4_WG32_8_1_WGM8
    SolutionIndex: 20
    SolutionNameMin: Cijk_Ailk_Bljk_ZB_GB_MT64x64x8_SN_PLR0_SU32_SUM0_SUS128_SNLL1_TT4_4_WG16_16_1_WGM8
    SolutionIndex: 21
    SolutionNameMin: Cijk_Ailk_Bljk_ZB_GB_MT128x32x8_SN_PLR1_SU32_SUM0_SUS128_SNLL1_TT4_4_WG32_8_1_WGM8
    SolutionIndex: 22
    SolutionNameMin: Cijk_Ailk_Bljk_ZB_GB_MT64x64x8_SN_PLR1_SU32_SUM3_SUS128_SNLL1_TT4_4_WG16_16_1_WGM8
    SolutionIndex: 23
    SolutionNameMin: Cijk_Ailk_Bljk_ZB_GB_MT64x64x8_SN_PLR1_SU32_SUM0_SUS256_SNLL1_TT4_4_WG16_16_1_WGM8
    SolutionIndex: 24
    SolutionNameMin: Cijk_Ailk_Bljk_ZB_GB_MT64x64x8_SN_PLR1_SU32_SUM3_SUS256_SNLL1_TT4_4_WG16_16_1_WGM8
    SolutionIndex: 25
    SolutionNameMin: Cijk_Ailk_Bljk_ZB_GB_MT64x64x8_SN_PLR1_SU0_SUM0_SUS256_SNLL1_TT4_4_WG16_16_1_WGM15
    SolutionIndex: 26
    SolutionNameMin: Cijk_Ailk_Bljk_ZB_GB_MT64x64x8_SN_PLR0_SU0_SUM0_SUS256_SNLL1_TT4_4_WG16_16_1_WGM15
    SolutionIndex: 27
    SolutionNameMin: Cijk_Ailk_Bljk_ZB_GB_MT128x32x8_SN_PLR1_SU0_SUM0_SUS256_SNLL1_TT4_4_WG32_8_1_WGM15
    SolutionIndex: 28
    SolutionNameMin: Cijk_Ailk_Bljk_ZB_GB_MT64x64x8_SN_PLR0_SU32_SUM0_SUS128_SNLL1_TT4_4_WG16_16_1_WGM15
    SolutionIndex: 29
    SolutionNameMin: Cijk_Ailk_Bljk_ZB_GB_MT128x32x8_SN_PLR1_SU32_SUM0_SUS128_SNLL1_TT4_4_WG32_8_1_WGM15
    SolutionIndex: 30
    SolutionNameMin: Cijk_Ailk_Bljk_ZB_GB_MT32x128x8_SN_PLR1_SU32_SUM3_SUS128_SNLL1_TT4_4_WG8_32_1_WGM15
    SolutionIndex: 31
    SolutionNameMin: Cijk_Ailk_Bljk_ZB_GB_MT64x64x8_SN_PLR0_SU32_SUM3_SUS128_SNLL1_TT4_4_WG16_16_1_WGM15
    SolutionIndex: 32
    SolutionNameMin: Cijk_Ailk_Bljk_ZB_GB_MT64x64x8_SN_PLR1_SU32_SUM0_SUS256_SNLL1_TT4_4_WG16_16_1_WGM15
    SolutionIndex: 33
    SolutionNameMin: Cijk_Ailk_Bljk_ZB_GB_MT64x64x8_SN_PLR0_SU32_SUM0_SUS256_SNLL1_TT4_4_WG16_16_1_WGM15
    SolutionIndex: 34
    SolutionNameMin: Cijk_Ailk_Bljk_ZB_GB_MT64x64x8_SN_PLR0_SU32_SUM3_SUS256_SNLL1_TT4_4_WG16_16_1_WGM15
    SolutionIndex: 35
    SolutionNameMin: Cijk_Ailk_Bljk_ZB_GB_MT32x128x8_SN_PLR1_SU0_SUM0_SUS256_SNLL0_TT4_4_WG8_32_1_WGM1
    SolutionIndex: 36
    SolutionNameMin: Cijk_Ailk_Bljk_ZB_GB_MT64x64x8_SN_PLR1_SU0_SUM0_SUS256_SNLL0_TT4_4_WG16_16_1_WGM1
    SolutionIndex: 37
    SolutionNameMin: Cijk_Ailk_Bljk_ZB_GB_MT64x64x8_SN_PLR0_SU0_SUM0_SUS256_SNLL0_TT4_4_WG16_16_1_WGM1
    SolutionIndex: 38
    SolutionNameMin: Cijk_Ailk_Bljk_ZB_GB_MT128x32x8_SN_PLR1_SU0_SUM0_SUS256_SNLL0_TT4_4_WG32_8_1_WGM1
    SolutionIndex: 39
    SolutionNameMin: Cijk_Ailk_Bljk_ZB_GB_MT64x64x16_SN_PLR1_SU0_SUM0_SUS256_SNLL0_TT4_4_WG16_16_1_WGM1
    SolutionIndex: 40
    SolutionNameMin: Cijk_Ailk_Bljk_ZB_GB_MT64x64x8_SN_PLR0_SU32_SUM0_SUS128_SNLL0_TT4_4_WG16_16_1_WGM1
    SolutionIndex: 41
    SolutionNameMin: Cijk_Ailk_Bljk_ZB_GB_MT32x128x8_SN_PLR1_SU32_SUM3_SUS128_SNLL0_TT4_4_WG8_32_1_WGM1
    SolutionIndex: 42
    SolutionNameMin: Cijk_Ailk_Bljk_ZB_GB_MT64x64x8_SN_PLR0_SU32_SUM3_SUS128_SNLL0_TT4_4_WG16_16_1_WGM1
    SolutionIndex: 43
    SolutionNameMin: Cijk_Ailk_Bljk_ZB_GB_MT128x32x8_SN_PLR1_SU32_SUM3_SUS128_SNLL0_TT4_4_WG32_8_1_WGM1
    SolutionIndex: 44
    SolutionNameMin: Cijk_Ailk_Bljk_ZB_GB_MT64x64x8_SN_PLR0_SU32_SUM0_SUS256_SNLL0_TT4_4_WG16_16_1_WGM1
    SolutionIndex: 45
    SolutionNameMin: Cijk_Ailk_Bljk_ZB_GB_MT128x32x8_SN_PLR1_SU32_SUM0_SUS256_SNLL0_TT4_4_WG32_8_1_WGM1
    SolutionIndex: 46
    SolutionNameMin: Cijk_Ailk_Bljk_ZB_GB_MT32x128x8_SN_PLR1_SU32_SUM3_SUS256_SNLL0_TT4_4_WG8_32_1_WGM1
    SolutionIndex: 47
    SolutionNameMin: Cijk_Ailk_Bljk_ZB_GB_MT64x64x8_SN_PLR0_SU32_SUM3_SUS256_SNLL0_TT4_4_WG16_16_1_WGM1
    SolutionIndex: 48
    SolutionNameMin: Cijk_Ailk_Bljk_ZB_GB_MT64x64x8_SN_PLR1_SU0_SUM0_SUS256_SNLL0_TT4_4_WG16_16_1_WGM8
    SolutionIndex: 49
    SolutionNameMin: Cijk_Ailk_Bljk_ZB_GB_MT64x64x8_SN_PLR0_SU0_SUM0_SUS256_SNLL0_TT4_4_WG16_16_1_WGM8
    SolutionIndex: 50
    SolutionNameMin: Cijk_Ailk_Bljk_ZB_GB_MT128x32x8_SN_PLR1_SU0_SUM0_SUS256_SNLL0_TT4_4_WG32_8_1_WGM8
    SolutionIndex: 51
    SolutionNameMin: Cijk_Ailk_Bljk_ZB_GB_MT64x64x8_SN_PLR0_SU32_SUM0_SUS128_SNLL0_TT4_4_WG16_16_1_WGM8
    SolutionIndex: 52
    SolutionNameMin: Cijk_Ailk_Bljk_ZB_GB_MT64x64x8_SN_PLR0_SU32_SUM3_SUS128_SNLL0_TT4_4_WG16_16_1_WGM8
    SolutionIndex: 53
    SolutionNameMin: Cijk_Ailk_Bljk_ZB_GB_MT64x64x8_SN_PLR0_SU32_SUM0_SUS256_SNLL0_TT4_4_WG16_16_1_WGM8
    SolutionIndex: 54
    SolutionNameMin: Cijk_Ailk_Bljk_ZB_GB_MT32x128x8_SN_PLR1_SU32_SUM3_SUS256_SNLL0_TT4_4_WG8_32_1_WGM8
    SolutionIndex: 55
    SolutionNameMin: Cijk_Ailk_Bljk_ZB_GB_MT128x32x8_SN_PLR1_SU32_SUM3_SUS256_SNLL0_TT4_4_WG32_8_1_WGM8
    SolutionIndex: 56
    SolutionNameMin: Cijk_Ailk_Bljk_ZB_GB_MT32x128x8_SN_PLR1_SU0_SUM0_SUS256_SNLL0_TT4_4_WG8_32_1_WGM15
    SolutionIndex: 57
    SolutionNameMin: Cijk_Ailk_Bljk_ZB_GB_MT64x64x8_SN_PLR0_SU0_SUM0_SUS256_SNLL0_TT4_4_WG16_16_1_WGM15
    SolutionIndex: 58
    SolutionNameMin: Cijk_Ailk_Bljk_ZB_GB_MT64x64x8_SN_PLR1_SU32_SUM0_SUS128_SNLL0_TT4_4_WG16_16_1_WGM15
    SolutionIndex: 59
    SolutionNameMin: Cijk_Ailk_Bljk_ZB_GB_MT64x64x8_SN_PLR0_SU32_SUM0_SUS128_SNLL0_TT4_4_WG16_16_1_WGM15
    SolutionIndex: 60
    SolutionNameMin: Cijk_Ailk_Bljk_ZB_GB_MT64x64x8_SN_PLR0_SU32_SUM0_SUS256_SNLL0_TT4_4_WG16_16_1_WGM15
    SolutionIndex: 61
    SolutionNameMin: Cijk_Ailk_Bljk_ZB_GB_MT32x128x8_SN_PLR1_SU32_SUM3_SUS256_SNLL0_TT4_4_WG8_32_1_WGM15
    SolutionIndex: 62
    SolutionNameMin: Cijk_Ailk_Bljk_ZB_GB_MT16x16x4_SN_PLR1_SU0_SUM0_SUS256_SNLL1_TT2_2_WG8_8_1_WGM1
    SolutionIndex: 63
    SolutionNameMin: Cijk_Ailk_Bljk_ZB_GB_MT8x8x8_SN_PLR1_SU0_SUM0_SUS256_SNLL1_TT1_1_WG8_8_1_WGM1
    SolutionIndex: 64
    SolutionNameMin: Cijk_Ailk_Bljk_ZB_GB_MT8x8x8_SN_PLR0_SU0_SUM0_SUS256_SNLL1_TT1_1_WG8_8_1_WGM1
    SolutionIndex: 65
    SolutionNameMin: Cijk_Ailk_Bljk_ZB_GB_MT16x16x4_SN_PLR1_SU0_SUM0_SUS256_SNLL1_TT2_2_WG8_8_1_WGM8
    SolutionIndex: 66
    SolutionNameMin: Cijk_Ailk_Bljk_ZB_GB_MT16x16x4_SN_PLR0_SU0_SUM0_SUS256_SNLL1_TT2_2_WG8_8_1_WGM8
    SolutionIndex: 67
    SolutionNameMin: Cijk_Ailk_Bljk_ZB_GB_MT8x8x8_SN_PLR1_SU0_SUM0_SUS256_SNLL1_TT1_1_WG8_8_1_WGM8
    SolutionIndex: 68
    SolutionNameMin: Cijk_Ailk_Bljk_ZB_GB_MT8x8x8_SN_PLR0_SU0_SUM0_SUS256_SNLL1_TT1_1_WG8_8_1_WGM8
    SolutionIndex: 69
    SolutionNameMin: Cijk_Ailk_Bljk_ZB_GB_MT16x16x4_SN_PLR1_SU0_SUM0_SUS256_SNLL1_TT2_2_WG8_8_1_WGM15
    SolutionIndex: 70
    SolutionNameMin: Cijk_Ailk_Bljk_ZB_GB_MT16x16x4_SN_PLR1_SU32_SUM0_SUS256_SNLL1_TT2_2_WG8_8_1_WGM15
    SolutionIndex: 71
    SolutionNameMin: Cijk_Ailk_Bljk_ZB_GB_MT16x16x4_SN_PLR1_SU0_SUM0_SUS256_SNLL0_TT2_2_WG8_8_1_WGM1
    SolutionIndex: 72
    SolutionNameMin: Cijk_Ailk_Bljk_ZB_GB_MT16x16x4_SN_PLR0_SU0_SUM0_SUS256_SNLL0_TT2_2_WG8_8_1_WGM1
    SolutionIndex: 73
    SolutionNameMin: Cijk_Ailk_Bljk_ZB_GB_MT8x8x8_SN_PLR0_SU0_SUM0_SUS256_SNLL0_TT1_1_WG8_8_1_WGM1
    SolutionIndex: 74
    SolutionNameMin: Cijk_Ailk_Bljk_ZB_GB_MT16x16x8_SN_PLR1_SU0_SUM0_SUS256_SNLL0_TT2_2_WG8_8_1_WGM1
    SolutionIndex: 75
    SolutionNameMin: Cijk_Ailk_Bljk_ZB_GB_MT32x32x8_SN_PLR1_SU0_SUM0_SUS256_SNLL0_TT2_2_WG16_16_1_WGM1
    SolutionIndex: 76
    SolutionNameMin: Cijk_Ailk_Bljk_ZB_GB_MT16x16x4_SN_PLR1_SU32_SUM0_SUS128_SNLL0_TT2_2_WG8_8_1_WGM1
    SolutionIndex: 77
    SolutionNameMin: Cijk_Ailk_Bljk_ZB_GB_MT16x16x4_SN_PLR0_SU32_SUM0_SUS128_SNLL0_TT2_2_WG8_8_1_WGM1
    SolutionIndex: 78
    SolutionNameMin: Cijk_Ailk_Bljk_ZB_GB_MT32x32x8_SN_PLR1_SU32_SUM0_SUS128_SNLL0_TT2_2_WG16_16_1_WGM1
    SolutionIndex: 79
    SolutionNameMin: Cijk_Ailk_Bljk_ZB_GB_MT32x32x8_SN_PLR1_SU32_SUM0_SUS256_SNLL0_TT2_2_WG16_16_1_WGM1
    SolutionIndex: 80
    SolutionNameMin: Cijk_Ailk_Bljk_ZB_GB_MT16x16x4_SN_PLR1_SU32_SUM3_SUS256_SNLL0_TT2_2_WG8_8_1_WGM1
    SolutionIndex: 81
    SolutionNameMin: Cijk_Ailk_Bljk_ZB_GB_MT16x16x4_SN_PLR1_SU0_SUM0_SUS256_SNLL0_TT2_2_WG8_8_1_WGM8
    SolutionIndex: 82
    SolutionNameMin: Cijk_Ailk_Bljk_ZB_GB_MT16x16x8_SN_PLR1_SU0_SUM0_SUS256_SNLL0_TT2_2_WG8_8_1_WGM8
    SolutionIndex: 83
    SolutionNameMin: Cijk_Ailk_Bljk_ZB_GB_MT32x32x8_SN_PLR1_SU0_SUM0_SUS256_SNLL0_TT2_2_WG16_16_1_WGM8
    SolutionIndex: 84
    SolutionNameMin: Cijk_Ailk_Bljk_ZB_GB_MT16x16x4_SN_PLR1_SU32_SUM0_SUS256_SNLL0_TT2_2_WG8_8_1_WGM8
    SolutionIndex: 85
    SolutionNameMin: Cijk_Ailk_Bljk_ZB_GB_MT16x16x4_SN_PLR1_SU32_SUM3_SUS256_SNLL0_TT2_2_WG8_8_1_WGM8
    SolutionIndex: 86
    SolutionNameMin: Cijk_Ailk_Bljk_ZB_GB_MT32x32x8_SN_PLR1_SU32_SUM3_SUS256_SNLL0_TT2_2_WG16_16_1_WGM8
    SolutionIndex: 87
    SolutionNameMin: Cijk_Ailk_Bljk_ZB_GB_MT16x16x4_SN_PLR1_SU0_SUM0_SUS256_SNLL0_TT2_2_WG8_8_1_WGM15
    SolutionIndex: 88
    SolutionNameMin: Cijk_Ailk_Bljk_ZB_GB_MT8x8x8_SN_PLR1_SU0_SUM0_SUS256_SNLL0_TT1_1_WG8_8_1_WGM15
    SolutionIndex: 89
    SolutionNameMin: Cijk_Ailk_Bljk_ZB_GB_MT16x16x8_SN_PLR1_SU0_SUM0_SUS256_SNLL0_TT2_2_WG8_8_1_WGM15
    SolutionIndex: 90
    SolutionNameMin: Cijk_Ailk_Bljk_ZB_GB_MT32x32x8_SN_PLR1_SU0_SUM0_SUS256_SNLL0_TT2_2_WG16_16_1_WGM15
    SolutionIndex: 91
    SolutionNameMin: Cijk_Ailk_Bljk_ZB_GB_MT16x16x4_SN_PLR1_SU32_SUM0_SUS256_SNLL0_TT2_2_WG8_8_1_WGM15
    SolutionIndex: 92
    SolutionNameMin: Cijk_Ailk_Bljk_ZB_GB_MT32x32x8_SN_PLR1_SU32_SUM0_SUS256_SNLL0_TT2_2_WG16_16_1_WGM15
    SolutionIndex: 93
    SolutionNameMin: Cijk_Ailk_Bljk_ZB_GB_MT24x24x8_SN_PLR1_SU0_SUM0_SUS256_SNLL0_TT3_3_WG8_8_1_WGM1
    SolutionIndex: 94
    SolutionNameMin: Cijk_Ailk_Bljk_ZB_GB_MT48x48x16_SN_PLR1_SU0_SUM0_SUS256_SNLL0_TT3_3_WG16_16_1_WGM1
    SolutionIndex: 95
    SolutionNameMin: Cijk_Ailk_Bljk_ZB_GB_MT24x24x8_SN_PLR1_SU0_SUM0_SUS256_SNLL0_TT3_3_WG8_8_1_WGM8
    SolutionIndex: 96
    SolutionNameMin: Cijk_Ailk_Bljk_ZB_GB_MT48x48x16_SN_PLR1_SU0_SUM0_SUS256_SNLL0_TT3_3_WG16_16_1_WGM8
    SolutionIndex: 97
    SolutionNameMin: Cijk_Ailk_Bljk_ZB_GB_MT24x24x8_SN_PLR1_SU0_SUM0_SUS256_SNLL0_TT3_3_WG8_8_1_WGM15
    SolutionIndex: 98
    SolutionNameMin: Cijk_Ailk_Bljk_ZB_GB_MT48x48x16_SN_PLR1_SU0_SUM0_SUS256_SNLL0_TT3_3_WG16_16_1_WGM15
- - - [192, 192, 1000, 32, 192, 192, 192, 32]
    - [44, 1616.0]
  - - [1536, 1536, 168, 32, 1536, 1536, 1536, 32]
    - [37, 1679.0]
  - - [1536, 32, 168, 1536, 1536, 1536, 1536, 1536]
    - [19, 1514.0]
  - - [32, 1536, 168, 32, 32, 32, 32, 32]
    - [56, 1083.0]
  - - [384, 384, 1024, 384, 384, 384, 384, 384]
    - [37, 1985.0]
  - - [1, 1, 1000, 1, 1, 1, 1, 1]
    - [62, 0.0]
  - - [2, 2, 1000, 2, 2, 2, 2, 2]
    - [62, 2.0]
  - - [3, 3, 1000, 3, 3, 3, 3, 3]
    - [63, 7.0]
  - - [4, 4, 1000, 4, 4, 4, 4, 4]
    - [73, 17.0]
  - - [5, 5, 1000, 5, 5, 5, 5, 5]
    - [68, 31.0]
  - - [6, 6, 1000, 6, 6, 6, 6, 6]
    - [64, 53.0]
  - - [7, 7, 1000, 7, 7, 7, 7, 7]
    - [67, 79.0]
  - - [8, 8, 1000, 8, 8, 8, 8, 8]
    - [88, 114.0]
  - - [9, 9, 1000, 9, 9, 9, 9, 9]
    - [87, 120.0]
  - - [10, 10, 1000, 10, 10, 10, 10, 10]
    - [80, 154.0]
  - - [11, 11, 1000, 11, 11, 11, 11, 11]
    - [85, 191.0]
  - - [12, 12, 1000, 12, 12, 12, 12, 12]
    - [70, 254.0]
  - - [13, 13, 1000, 13, 13, 13, 13, 13]
    - [71, 277.0]
  - - [14, 14, 1000, 14, 14, 14, 14, 14]
    - [77, 333.0]
  - - [15, 15, 1000, 15, 15, 15, 15, 15]
    - [84, 391.0]
  - - [16, 16, 1000, 16, 16, 16, 16, 16]
    - [76, 497.0]
  - - [17, 17, 1000, 17, 17, 17, 17, 17]
    - [90, 269.0]
  - - [18, 18, 1000, 18, 18, 18, 18, 18]
    - [78, 304.0]
  - - [19, 19, 1000, 19, 19, 19, 19, 19]
    - [75, 343.0]
  - - [20, 20, 1000, 20, 20, 20, 20, 20]
    - [71, 424.0]
  - - [21, 21, 1000, 21, 21, 21, 21, 21]
    - [78, 427.0]
  - - [22, 22, 1000, 22, 22, 22, 22, 22]
    - [86, 481.0]
  - - [23, 23, 1000, 23, 23, 23, 23, 23]
    - [92, 523.0]
  - - [24, 24, 1000, 24, 24, 24, 24, 24]
    - [75, 638.0]
  - - [25, 25, 1000, 25, 25, 25, 25, 25]
    - [90, 620.0]
  - - [26, 26, 1000, 26, 26, 26, 26, 26]
    - [83, 678.0]
  - - [27, 27, 1000, 27, 27, 27, 27, 27]
    - [83, 713.0]
  - - [28, 28, 1000, 28, 28, 28, 28, 28]
    - [71, 819.0]
  - - [29, 29, 1000, 29, 29, 29, 29, 29]
    - [83, 817.0]
  - - [30, 30, 1000, 30, 30, 30, 30, 30]
    - [83, 865.0]
  - - [31, 31, 1000, 31, 31, 31, 31, 31]
    - [79, 913.0]
  - - [32, 32, 1000, 32, 32, 32, 32, 32]
    - [78, 1069.0]
  - - [33, 33, 1000, 33, 33, 33, 33, 33]
    - [81, 571.0]
  - - [34, 34, 1000, 34, 34, 34, 34, 34]
    - [91, 640.0]
  - - [35, 35, 1000, 35, 35, 35, 35, 35]
    - [62, 636.0]
  - - [36, 36, 1000, 36, 36, 36, 36, 36]
    - [71, 775.0]
  - - [37, 37, 1000, 37, 37, 37, 37, 37]
    - [69, 683.0]
  - - [38, 38, 1000, 38, 38, 38, 38, 38]
    - [71, 790.0]
  - - [39, 39, 1000, 39, 39, 39, 39, 39]
    - [87, 739.0]
  - - [40, 40, 1000, 40, 40, 40, 40, 40]
    - [87, 954.0]
  - - [41, 41, 1000, 41, 41, 41, 41, 41]
    - [65, 795.0]
  - - [42, 42, 1000, 42, 42, 42, 42, 42]
    - [81, 921.0]
  - - [43, 43, 1000, 43, 43, 43, 43, 43]
    - [72, 865.0]
  - - [44, 44, 1000, 44, 44, 44, 44, 44]
    - [71, 1150.0]
  - - [45, 45, 1000, 45, 45, 45, 45, 45]
    - [66, 908.0]
  - - [46, 46, 1000, 46, 46, 46, 46, 46]
    - [69, 1061.0]
  - - [47, 47, 1000, 47, 47, 47, 47, 47]
    - [65, 993.0]
  - - [48, 48, 1000, 48, 48, 48, 48, 48]
    - [71, 1333.0]
  - - [49, 49, 1000, 49, 49, 49, 49, 49]
    - [75, 837.0]
  - - [50, 50, 1000, 50, 50, 50, 50, 50]
    - [83, 878.0]
  - - [51, 51, 1000, 51, 51, 51, 51, 51]
    - [75, 915.0]
  - - [52, 52, 1000, 52, 52, 52, 52, 52]
    - [90, 960.0]
  - - [53, 53, 1000, 53, 53, 53, 53, 53]
    - [75, 995.0]
  - - [54, 54, 1000, 54, 54, 54, 54, 54]
    - [75, 1039.0]
  - - [55, 55, 1000, 55, 55, 55, 55, 55]
    - [75, 1077.0]
  - - [56, 56, 1000, 56, 56, 56, 56, 56]
    - [75, 1139.0]
  - - [57, 57, 1000, 57, 57, 57, 57, 57]
    - [90, 1143.0]
  - - [58, 58, 1000, 58, 58, 58, 58, 58]
    - [83, 1193.0]
  - - [59, 59, 1000, 59, 59, 59, 59, 59]
    - [83, 1237.0]
  - - [60, 60, 1000, 60, 60, 60, 60, 60]
    - [75, 1286.0]
  - - [61, 61, 1000, 61, 61, 61, 61, 61]
    - [75, 1326.0]
  - - [62, 62, 1000, 62, 62, 62, 62, 62]
    - [83, 1374.0]
  - - [63, 63, 1000, 63, 63, 63, 63, 63]
    - [83, 1419.0]
  - - [64, 64, 1000, 64, 64, 64, 64, 64]
    - [83, 1494.0]
  - - [65, 65, 1000, 65, 65, 65, 65, 65]
    - [95, 843.0]
  - - [66, 66, 1000, 66, 66, 66, 66, 66]
    - [97, 868.0]
  - - [67, 67, 1000, 67, 67, 67, 67, 67]
    - [93, 893.0]
  - - [68, 68, 1000, 68, 68, 68, 68, 68]
    - [93, 927.0]
  - - [69, 69, 1000, 69, 69, 69, 69, 69]
    - [93, 946.0]
  - - [70, 70, 1000, 70, 70, 70, 70, 70]
    - [95, 977.0]
  - - [71, 71, 1000, 71, 71, 71, 71, 71]
    - [93, 999.0]
  - - [72, 72, 1000, 72, 72, 72, 72, 72]
    - [95, 1102.0]
  - - [73, 73, 1000, 73, 73, 73, 73, 73]
    - [89, 963.0]
  - - [74, 74, 1000, 74, 74, 74, 74, 74]
    - [74, 999.0]
  - - [75, 75, 1000, 75, 75, 75, 75, 75]
    - [74, 1024.0]
  - - [76, 76, 1000, 76, 76, 76, 76, 76]
    - [89, 1065.0]
  - - [77, 77, 1000, 77, 77, 77, 77, 77]
    - [74, 1083.0]
  - - [78, 78, 1000, 78, 78, 78, 78, 78]
    - [89, 1121.0]
  - - [79, 79, 1000, 79, 79, 79, 79, 79]
    - [89, 1145.0]
  - - [80, 80, 1000, 80, 80, 80, 80, 80]
    - [82, 1216.0]
  - - [81, 81, 1000, 81, 81, 81, 81, 81]
    - [75, 1079.0]
  - - [82, 82, 1000, 82, 82, 82, 82, 82]
    - [83, 1110.0]
  - - [83, 83, 1000, 83, 83, 83, 83, 83]
    - [83, 1139.0]
  - - [84, 84, 1000, 84, 84, 84, 84, 84]
    - [75, 1171.0]
  - - [85, 85, 1000, 85, 85, 85, 85, 85]
    - [79, 1200.0]
  - - [86, 86, 1000, 86, 86, 86, 86, 86]
    - [75, 1236.0]
  - - [87, 87, 1000, 87, 87, 87, 87, 87]
    - [83, 1269.0]
  - - [88, 88, 1000, 88, 88, 88, 88, 88]
    - [75, 1303.0]
  - - [89, 89, 1000, 89, 89, 89, 89, 89]
    - [78, 1304.0]
  - - [90, 90, 1000, 90, 90, 90, 90, 90]
    - [79, 1340.0]
  - - [91, 91, 1000, 91, 91, 91, 91, 91]
    - [83, 1373.0]
  - - [92, 92, 1000, 92, 92, 92, 92, 92]
    - [83, 1412.0]
  - - [93, 93, 1000, 93, 93, 93, 93, 93]
    - [83, 1443.0]
  - - [94, 94, 1000, 94, 94, 94, 94, 94]
    - [75, 1479.0]
  - - [95, 95, 1000, 95, 95, 95, 95, 95]
    - [90, 1510.0]
  - - [96, 96, 1000, 96, 96, 96, 96, 96]
    - [75, 1552.0]
  - - [97, 97, 1000, 97, 97, 97, 97, 97]
    - [18, 1032.0]
  - - [98, 98, 1000, 98, 98, 98, 98, 98]
    - [18, 1056.0]
  - - [99, 99, 1000, 99, 99, 99, 99, 99]
    - [26, 1073.0]
  - - [100, 100, 1000, 100, 100, 100, 100, 100]
    - [37, 1101.0]
  - - [101, 101, 1000, 101, 101, 101, 101, 101]
    - [26, 1111.0]
  - - [102, 102, 1000, 102, 102, 102, 102, 102]
    - [18, 1141.0]
  - - [103, 103, 1000, 103, 103, 103, 103, 103]
    - [2, 1163.0]
  - - [104, 104, 1000, 104, 104, 104, 104, 104]
    - [18, 1211.0]
  - - [105, 105, 1000, 105, 105, 105, 105, 105]
    - [18, 1209.0]
  - - [106, 106, 1000, 106, 106, 106, 106, 106]
    - [57, 1233.0]
  - - [107, 107, 1000, 107, 107, 107, 107, 107]
    - [26, 1253.0]
  - - [108, 108, 1000, 108, 108, 108, 108, 108]
    - [49, 1287.0]
  - - [109, 109, 1000, 109, 109, 109, 109, 109]
    - [2, 1296.0]
  - - [110, 110, 1000, 110, 110, 110, 110, 110]
    - [18, 1327.0]
  - - [111, 111, 1000, 111, 111, 111, 111, 111]
    - [57, 1350.0]
  - - [112, 112, 1000, 112, 112, 112, 112, 112]
    - [2, 1400.0]
  - - [113, 113, 1000, 113, 113, 113, 113, 113]
    - [10, 1390.0]
  - - [114, 114, 1000, 114, 114, 114, 114, 114]
    - [2, 1429.0]
  - - [115, 115, 1000, 115, 115, 115, 115, 115]
    - [7, 1442.0]
  - - [116, 116, 1000, 116, 116, 116, 116, 116]
    - [40, 1482.0]
  - - [117, 117, 1000, 117, 117, 117, 117, 117]
    - [2, 1495.0]
  - - [118, 118, 1000, 118, 118, 118, 118, 118]
    - [2, 1526.0]
  - - [119, 119, 1000, 119, 119, 119, 119, 119]
    - [40, 1539.0]
  - - [120, 120, 1000, 120, 120, 120, 120, 120]
    - [31, 1603.0]
  - - [121, 121, 1000, 121, 121, 121, 121, 121]
    - [59, 1597.0]
  - - [122, 122, 1000, 122, 122, 122, 122, 122]
    - [57, 1630.0]
  - - [123, 123, 1000, 123, 123, 123, 123, 123]
    - [53, 1647.0]
  - - [124, 124, 1000, 124, 124, 124, 124, 124]
    - [37, 1689.0]
  - - [125, 125, 1000, 125, 125, 125, 125, 125]
    - [42, 1697.0]
  - - [126, 126, 1000, 126, 126, 126, 126, 126]
    - [2, 1734.0]
  - - [127, 127, 1000, 127, 127, 127, 127, 127]
    - [20, 1752.0]
  - - [128, 128, 1000, 128, 128, 128, 128, 128]
    - [57, 1849.0]
  - - [129, 129, 1000, 129, 129, 129, 129, 129]
    - [96, 1033.0]
  - - [130, 130, 1000, 130, 130, 130, 130, 130]
    - [98, 1050.0]
  - - [131, 131, 1000, 131, 131, 131, 131, 131]
    - [96, 1064.0]
  - - [132, 132, 1000, 132, 132, 132, 132, 132]
    - [94, 1083.0]
  - - [133, 133, 1000, 133, 133, 133, 133, 133]
    - [96, 1093.0]
  - - [134, 134, 1000, 134, 134, 134, 134, 134]
    - [96, 1111.0]
  - - [135, 135, 1000, 135, 135, 135, 135, 135]
    - [98, 1124.0]
  - - [136, 136, 1000, 136, 136, 136, 136, 136]
    - [98, 1146.0]
  - - [137, 137, 1000, 137, 137, 137, 137, 137]
    - [96, 1154.0]
  - - [138, 138, 1000, 138, 138, 138, 138, 138]
    - [96, 1175.0]
  - - [139, 139, 1000, 139, 139, 139, 139, 139]
    - [98, 1186.0]
  - - [140, 140, 1000, 140, 140, 140, 140, 140]
    - [96, 1209.0]
  - - [141, 141, 1000, 141, 141, 141, 141, 141]
    - [98, 1220.0]
  - - [142, 142, 1000, 142, 142, 142, 142, 142]
    - [96, 1240.0]
  - - [143, 143, 1000, 143, 143, 143, 143, 143]
    - [96, 1252.0]
  - - [144, 144, 1000, 144, 144, 144, 144, 144]
    - [94, 1359.0]
  - - [145, 145, 1000, 145, 145, 145, 145, 145]
    - [90, 1271.0]
  - - [146, 146, 1000, 146, 146, 146, 146, 146]
    - [83, 1291.0]
  - - [147, 147, 1000, 147, 147, 147, 147, 147]
    - [75, 1309.0]
  - - [148, 148, 1000, 148, 148, 148, 148, 148]
    - [83, 1330.0]
  - - [149, 149, 1000, 149, 149, 149, 149, 149]
    - [75, 1349.0]
  - - [150, 150, 1000, 150, 150, 150, 150, 150]
    - [75, 1372.0]
  - - [32, 32, 8, 32, 32, 32, 32, 32]
    - [11, 10.0]
  - - [32, 32, 8, 64, 32, 32, 32, 64]
    - [0, 14.0]
  - - [32, 32, 8, 128, 32, 32, 32, 128]
    - [1, 19.0]
  - - [32, 32, 8, 256, 32, 32, 32, 256]
    - [1, 22.0]
  - - [32, 32, 8, 512, 32, 32, 32, 512]
    - [1, 24.0]
  - - [32, 32, 8, 1024, 32, 32, 32, 1024]
    - [1, 25.0]
  - - [32, 32, 8, 2048, 32, 32, 32, 2048]
    - [1, 26.0]
  - - [32, 64, 8, 32, 32, 32, 32, 32]
    - [0, 19.0]
  - - [32, 64, 8, 64, 32, 32, 32, 64]
    - [1, 28.0]
  - - [32, 64, 8, 128, 32, 32, 32, 128]
    - [1, 37.0]
  - - [32, 64, 8, 256, 32, 32, 32, 256]
    - [1, 43.0]
  - - [32, 64, 8, 512, 32, 32, 32, 512]
    - [1, 48.0]
  - - [32, 64, 8, 1024, 32, 32, 32, 1024]
    - [1, 50.0]
  - - [32, 64, 8, 2048, 32, 32, 32, 2048]
    - [1, 52.0]
  - - [32, 128, 8, 32, 32, 32, 32, 32]
    - [0, 39.0]
  - - [32, 128, 8, 64, 32, 32, 32, 64]
    - [12, 58.0]
  - - [32, 128, 8, 128, 32, 32, 32, 128]
    - [17, 75.0]
  - - [32, 128, 8, 256, 32, 32, 32, 256]
    - [1, 87.0]
  - - [32, 128, 8, 512, 32, 32, 32, 512]
    - [17, 96.0]
  - - [32, 128, 8, 1024, 32, 32, 32, 1024]
    - [1, 101.0]
  - - [32, 128, 8, 2048, 32, 32, 32, 2048]
    - [1, 103.0]
  - - [32, 256, 8, 32, 32, 32, 32, 32]
    - [5, 79.0]
  - - [32, 256, 8, 64, 32, 32, 32, 64]
    - [25, 114.0]
  - - [32, 256, 8, 128, 32, 32, 32, 128]
    - [1, 149.0]
  - - [32, 256, 8, 256, 32, 32, 32, 256]
    - [1, 174.0]
  - - [32, 256, 8, 512, 32, 32, 32, 512]
    - [1, 191.0]
  - - [32, 256, 8, 1024, 32, 32, 32, 1024]
    - [1, 201.0]
  - - [32, 256, 8, 2048, 32, 32, 32, 2048]
    - [1, 206.0]
  - - [32, 512, 8, 32, 32, 32, 32, 32]
    - [16, 159.0]
  - - [32, 512, 8, 64, 32, 32, 32, 64]
    - [25, 228.0]
  - - [32, 512, 8, 128, 32, 32, 32, 128]
    - [32, 297.0]
  - - [32, 512, 8, 256, 32, 32, 32, 256]
    - [1, 346.0]
  - - [32, 512, 8, 512, 32, 32, 32, 512]
    - [25, 382.0]
  - - [32, 512, 8, 1024, 32, 32, 32, 1024]
    - [25, 403.0]
  - - [32, 512, 8, 2048, 32, 32, 32, 2048]
    - [1, 413.0]
  - - [32, 1024, 8, 32, 32, 32, 32, 32]
    - [13, 396.0]
  - - [32, 1024, 8, 64, 32, 32, 32, 64]
    - [7, 459.0]
  - - [32, 1024, 8, 128, 32, 32, 32, 128]
    - [14, 570.0]
  - - [32, 1024, 8, 256, 32, 32, 32, 256]
    - [30, 649.0]
  - - [32, 1024, 8, 512, 32, 32, 32, 512]
    - [56, 692.0]
  - - [32, 1024, 8, 1024, 32, 32, 32, 1024]
    - [35, 743.0]
  - - [32, 1024, 8, 2048, 32, 32, 32, 2048]
    - [54, 761.0]
  - - [32, 2048, 8, 32, 32, 32, 32, 32]
    - [46, 549.0]
  - - [32, 2048, 8, 64, 32, 32, 32, 64]
    - [41, 635.0]
  - - [32, 2048, 8, 128, 32, 32, 32, 128]
    - [35, 694.0]
  - - [32, 2048, 8, 256, 32, 32, 32, 256]
    - [61, 729.0]
  - - [32, 2048, 8, 512, 32, 32, 32, 512]
    - [56, 753.0]
  - - [32, 2048, 8, 1024, 32, 32, 32, 1024]
    - [0, 767.0]
  - - [32, 2048, 8, 2048, 32, 32, 32, 2048]
    - [54, 762.0]
  - - [64, 32, 8, 32, 64, 64, 64, 32]
    - [36, 37.0]
  - - [64, 32, 8, 64, 64, 64, 64, 64]
    - [25, 43.0]
  - - [64, 32, 8, 128, 64, 64, 64, 128]
    - [17, 47.0]
  - - [64, 32, 8, 256, 64, 64, 64, 256]
    - [1, 50.0]
  - - [64, 32, 8, 512, 64, 64, 64, 512]
    - [48, 51.0]
  - - [64, 32, 8, 1024, 64, 64, 64, 1024]
    - [36, 52.0]
  - - [64, 32, 8, 2048, 64, 64, 64, 2048]
    - [25, 53.0]
  - - [64, 64, 8, 32, 64, 64, 64, 32]
    - [58, 73.0]
  - - [64, 64, 8, 64, 64, 64, 64, 64]
    - [1, 85.0]
  - - [64, 64, 8, 128, 64, 64, 64, 128]
    - [4, 91.0]
  - - [64, 64, 8, 256, 64, 64, 64, 256]
    - [36, 100.0]
  - - [64, 64, 8, 512, 64, 64, 64, 512]
    - [39, 100.0]
  - - [64, 64, 8, 1024, 64, 64, 64, 1024]
    - [58, 103.0]
  - - [64, 64, 8, 2048, 64, 64, 64, 2048]
    - [1, 104.0]
  - - [64, 128, 8, 32, 64, 64, 64, 32]
    - [25, 81.0]
  - - [64, 128, 8, 64, 64, 64, 64, 64]
    - [1, 117.0]
  - - [64, 128, 8, 128, 64, 64, 64, 128]
    - [6, 151.0]
  - - [64, 128, 8, 256, 64, 64, 64, 256]
    - [1, 176.0]
  - - [64, 128, 8, 512, 64, 64, 64, 512]
    - [1, 192.0]
  - - [64, 128, 8, 1024, 64, 64, 64, 1024]
    - [1, 201.0]
  - - [64, 128, 8, 2048, 64, 64, 64, 2048]
    - [1, 206.0]
  - - [64, 256, 8, 32, 64, 64, 64, 32]
    - [5, 159.0]
  - - [64, 256, 8, 64, 64, 64, 64, 64]
    - [22, 231.0]
  - - [64, 256, 8, 128, 64, 64, 64, 128]
    - [25, 301.0]
  - - [64, 256, 8, 256, 64, 64, 64, 256]
    - [1, 352.0]
  - - [64, 256, 8, 512, 64, 64, 64, 512]
    - [1, 383.0]
  - - [64, 256, 8, 1024, 64, 64, 64, 1024]
    - [1, 402.0]
  - - [64, 256, 8, 2048, 64, 64, 64, 2048]
    - [1, 412.0]
  - - [64, 512, 8, 32, 64, 64, 64, 32]
    - [1, 317.0]
  - - [64, 512, 8, 64, 64, 64, 64, 64]
    - [1, 465.0]
  - - [64, 512, 8, 128, 64, 64, 64, 128]
    - [6, 603.0]
  - - [64, 512, 8, 256, 64, 64, 64, 256]
    - [1, 703.0]
  - - [64, 512, 8, 512, 64, 64, 64, 512]
    - [25, 766.0]
  - - [64, 512, 8, 1024, 64, 64, 64, 1024]
    - [1, 804.0]
  - - [64, 512, 8, 2048, 64, 64, 64, 2048]
    - [1, 825.0]
  - - [64, 1024, 8, 32, 64, 64, 64, 32]
    - [52, 777.0]
  - - [64, 1024, 8, 64, 64, 64, 64, 64]
    - [2, 904.0]
  - - [64, 1024, 8, 128, 64, 64, 64, 128]
    - [37, 988.0]
  - - [64, 1024, 8, 256, 64, 64, 64, 256]
    - [33, 1040.0]
  - - [64, 1024, 8, 512, 64, 64, 64, 512]
    - [44, 1070.0]
  - - [64, 1024, 8, 1024, 64, 64, 64, 1024]
    - [7, 1084.0]
  - - [64, 1024, 8, 2048, 64, 64, 64, 2048]
    - [60, 1092.0]
  - - [64, 2048, 8, 32, 64, 64, 64, 32]
    - [51, 846.0]
  - - [64, 2048, 8, 64, 64, 64, 64, 64]
    - [44, 1001.0]
  - - [64, 2048, 8, 128, 64, 64, 64, 128]
    - [37, 1101.0]
  - - [64, 2048, 8, 256, 64, 64, 64, 256]
    - [37, 1159.0]
  - - [64, 2048, 8, 512, 64, 64, 64, 512]
    - [49, 1191.0]
  - - [64, 2048, 8, 1024, 64, 64, 64, 1024]
    - [40, 1206.0]
  - - [64, 2048, 8, 2048, 64, 64, 64, 2048]
    - [37, 1213.0]
  - - [128, 32, 8, 32, 128, 128, 128, 32]
    - [19, 40.0]
  - - [128, 32, 8, 64, 128, 128, 128, 64]
    - [19, 58.0]
  - - [128, 32, 8, 128, 128, 128, 128, 128]
    - [3, 74.0]
  - - [128, 32, 8, 256, 128, 128, 128, 256]
    - [1, 87.0]
  - - [128, 32, 8, 512, 128, 128, 128, 512]
    - [1, 96.0]
  - - [128, 32, 8, 1024, 128, 128, 128, 1024]
    - [1, 101.0]
  - - [128, 32, 8, 2048, 128, 128, 128, 2048]
    - [1, 103.0]
  - - [128, 64, 8, 32, 128, 128, 128, 32]
    - [25, 81.0]
  - - [128, 64, 8, 64, 128, 128, 128, 64]
    - [17, 117.0]
  - - [128, 64, 8, 128, 128, 128, 128, 128]
    - [1, 150.0]
  - - [128, 64, 8, 256, 128, 128, 128, 256]
    - [1, 177.0]
  - - [128, 64, 8, 512, 128, 128, 128, 512]
    - [1, 192.0]
  - - [128, 64, 8, 1024, 128, 128, 128, 1024]
    - [1, 201.0]
  - - [128, 64, 8, 2048, 128, 128, 128, 2048]
    - [1, 206.0]
  - - [128, 128, 8, 32, 128, 128, 128, 32]
    - [25, 159.0]
  - - [128, 128, 8, 64, 128, 128, 128, 64]
    - [24, 232.0]
  - - [128, 128, 8, 128, 128, 128, 128, 128]
    - [6, 299.0]
  - - [128, 128, 8, 256, 128, 128, 128, 256]
    - [25, 353.0]
  - - [128, 128, 8, 512, 128, 128, 128, 512]
    - [17, 384.0]
  - - [128, 128, 8, 1024, 128, 128, 128, 1024]
    - [1, 402.0]
  - - [128, 128, 8, 2048, 128, 128, 128, 2048]
    - [1, 412.0]
  - - [128, 256, 8, 32, 128, 128, 128, 32]
    - [3, 316.0]
  - - [128, 256, 8, 64, 128, 128, 128, 64]
    - [24, 459.0]
  - - [128, 256, 8, 128, 128, 128, 128, 128]
    - [17, 595.0]
  - - [128, 256, 8, 256, 128, 128, 128, 256]
    - [32, 700.0]
  - - [128, 256, 8, 512, 128, 128, 128, 512]
    - [25, 767.0]
  - - [128, 256, 8, 1024, 128, 128, 128, 1024]
    - [17, 804.0]
  - - [128, 256, 8, 2048, 128, 128, 128, 2048]
    - [1, 824.0]
  - - [128, 512, 8, 32, 128, 128, 128, 32]
    - [57, 771.0]
  - - [128, 512, 8, 64, 128, 128, 128, 64]
    - [40, 910.0]
  - - [128, 512, 8, 128, 128, 128, 128, 128]
    - [51, 992.0]
  - - [128, 512, 8, 256, 128, 128, 128, 256]
    - [18, 1043.0]
  - - [128, 512, 8, 512, 128, 128, 128, 512]
    - [20, 1071.0]
  - - [128, 512, 8, 1024, 128, 128, 128, 1024]
    - [18, 1086.0]
  - - [128, 512, 8, 2048, 128, 128, 128, 2048]
    - [7, 1092.0]
  - - [128, 1024, 8, 32, 128, 128, 128, 32]
    - [37, 853.0]
  - - [128, 1024, 8, 64, 128, 128, 128, 64]
    - [37, 1007.0]
  - - [128, 1024, 8, 128, 128, 128, 128, 128]
    - [37, 1104.0]
  - - [128, 1024, 8, 256, 128, 128, 128, 256]
    - [51, 1158.0]
  - - [128, 1024, 8, 512, 128, 128, 128, 512]
    - [51, 1192.0]
  - - [128, 1024, 8, 1024, 128, 128, 128, 1024]
    - [49, 1210.0]
  - - [128, 1024, 8, 2048, 128, 128, 128, 2048]
    - [20, 1215.0]
  - - [128, 2048, 8, 32, 128, 128, 128, 32]
    - [40, 1108.0]
  - - [128, 2048, 8, 64, 128, 128, 128, 64]
    - [51, 1279.0]
  - - [128, 2048, 8, 128, 128, 128, 128, 128]
    - [51, 1407.0]
  - - [128, 2048, 8, 256, 128, 128, 128, 256]
    - [18, 1483.0]
  - - [128, 2048, 8, 512, 128, 128, 128, 512]
    - [18, 1523.0]
  - - [128, 2048, 8, 1024, 128, 128, 128, 1024]
    - [57, 1544.0]
  - - [128, 2048, 8, 2048, 128, 128, 128, 2048]
    - [18, 1551.0]
  - - [256, 32, 8, 32, 256, 256, 256, 32]
    - [8, 80.0]
  - - [256, 32, 8, 64, 256, 256, 256, 64]
    - [11, 117.0]
  - - [256, 32, 8, 128, 256, 256, 256, 128]
    - [11, 149.0]
  - - [256, 32, 8, 256, 256, 256, 256, 256]
    - [3, 173.0]
  - - [256, 32, 8, 512, 256, 256, 256, 512]
    - [1, 191.0]
  - - [256, 32, 8, 1024, 256, 256, 256, 1024]
    - [1, 201.0]
  - - [256, 32, 8, 2048, 256, 256, 256, 2048]
    - [1, 207.0]
  - - [256, 64, 8, 32, 256, 256, 256, 32]
    - [19, 157.0]
  - - [256, 64, 8, 64, 256, 256, 256, 64]
    - [17, 231.0]
  - - [256, 64, 8, 128, 256, 256, 256, 128]
    - [17, 297.0]
  - - [256, 64, 8, 256, 256, 256, 256, 256]
    - [9, 350.0]
  - - [256, 64, 8, 512, 256, 256, 256, 512]
    - [1, 384.0]
  - - [256, 64, 8, 1024, 256, 256, 256, 1024]
    - [1, 401.0]
  - - [256, 64, 8, 2048, 256, 256, 256, 2048]
    - [1, 412.0]
  - - [256, 128, 8, 32, 256, 256, 256, 32]
    - [21, 316.0]
  - - [256, 128, 8, 64, 256, 256, 256, 64]
    - [23, 461.0]
  - - [256, 128, 8, 128, 256, 256, 256, 128]
    - [17, 594.0]
  - - [256, 128, 8, 256, 256, 256, 256, 256]
    - [17, 697.0]
  - - [256, 128, 8, 512, 256, 256, 256, 512]
    - [25, 766.0]
  - - [256, 128, 8, 1024, 256, 256, 256, 1024]
    - [17, 803.0]
  - - [256, 128, 8, 2048, 256, 256, 256, 2048]
    - [1, 824.0]
  - - [256, 256, 8, 32, 256, 256, 256, 32]
    - [18, 777.0]
  - - [256, 256, 8, 64, 256, 256, 256, 64]
    - [34, 908.0]
  - - [256, 256, 8, 128, 256, 256, 256, 128]
    - [53, 990.0]
  - - [256, 256, 8, 256, 256, 256, 256, 256]
    - [49, 1045.0]
  - - [256, 256, 8, 512, 256, 256, 256, 512]
    - [18, 1072.0]
  - - [256, 256, 8, 1024, 256, 256, 256, 1024]
    - [13, 1086.0]
  - - [256, 256, 8, 2048, 256, 256, 256, 2048]
    - [28, 1093.0]
  - - [256, 512, 8, 32, 256, 256, 256, 32]
    - [37, 863.0]
  - - [256, 512, 8, 64, 256, 256, 256, 64]
    - [2, 1009.0]
  - - [256, 512, 8, 128, 256, 256, 256, 128]
    - [37, 1114.0]
  - - [256, 512, 8, 256, 256, 256, 256, 256]
    - [37, 1168.0]
  - - [256, 512, 8, 512, 256, 256, 256, 512]
    - [37, 1193.0]
  - - [256, 512, 8, 1024, 256, 256, 256, 1024]
    - [37, 1210.0]
  - - [256, 512, 8, 2048, 256, 256, 256, 2048]
    - [49, 1218.0]
  - - [256, 1024, 8, 32, 256, 256, 256, 32]
    - [37, 1097.0]
  - - [256, 1024, 8, 64, 256, 256, 256, 64]
    - [18, 1279.0]
  - - [256, 1024, 8, 128, 256, 256, 256, 128]
    - [57, 1413.0]
  - - [256, 1024, 8, 256, 256, 256, 256, 256]
    - [49, 1482.0]
  - - [256, 1024, 8, 512, 256, 256, 256, 512]
    - [18, 1523.0]
  - - [256, 1024, 8, 1024, 256, 256, 256, 1024]
    - [49, 1543.0]
  - - [256, 1024, 8, 2048, 256, 256, 256, 2048]
    - [49, 1555.0]
  - - [256, 2048, 8, 32, 256, 256, 256, 32]
    - [37, 1286.0]
  - - [256, 2048, 8, 64, 256, 256, 256, 64]
    - [47, 1487.0]
  - - [256, 2048, 8, 128, 256, 256, 256, 128]
    - [18, 1645.0]
  - - [256, 2048, 8, 256, 256, 256, 256, 256]
    - [42, 1667.0]
  - - [256, 2048, 8, 512, 256, 256, 256, 512]
    - [40, 1705.0]
  - - [256, 2048, 8, 1024, 256, 256, 256, 1024]
    - [18, 1793.0]
  - - [256, 2048, 8, 2048, 256, 256, 256, 2048]
    - [18, 1733.0]
  - - [512, 32, 8, 32, 512, 512, 512, 32]
    - [27, 157.0]
  - - [512, 32, 8, 64, 512, 512, 512, 64]
    - [3, 230.0]
  - - [512, 32, 8, 128, 512, 512, 512, 128]
    - [3, 296.0]
  - - [512, 32, 8, 256, 512, 512, 512, 256]
    - [12, 346.0]
  - - [512, 32, 8, 512, 512, 512, 512, 512]
    - [25, 381.0]
  - - [512, 32, 8, 1024, 512, 512, 512, 1024]
    - [1, 402.0]
  - - [512, 32, 8, 2048, 512, 512, 512, 2048]
    - [1, 413.0]
  - - [512, 64, 8, 32, 512, 512, 512, 32]
    - [29, 314.0]
  - - [512, 64, 8, 64, 512, 512, 512, 64]
    - [27, 458.0]
  - - [512, 64, 8, 128, 512, 512, 512, 128]
    - [3, 597.0]
  - - [512, 64, 8, 256, 512, 512, 512, 256]
    - [1, 694.0]
  - - [512, 64, 8, 512, 512, 512, 512, 512]
    - [1, 764.0]
  - - [512, 64, 8, 1024, 512, 512, 512, 1024]
    - [1, 803.0]
  - - [512, 64, 8, 2048, 512, 512, 512, 2048]
    - [1, 824.0]
  - - [512, 128, 8, 32, 512, 512, 512, 32]
    - [49, 771.0]
  - - [512, 128, 8, 64, 512, 512, 512, 64]
    - [28, 902.0]
  - - [512, 128, 8, 128, 512, 512, 512, 128]
    - [37, 990.0]
  - - [512, 128, 8, 256, 512, 512, 512, 256]
    - [2, 1041.0]
  - - [512, 128, 8, 512, 512, 512, 512, 512]
    - [7, 1070.0]
  - - [512, 128, 8, 1024, 512, 512, 512, 1024]
    - [57, 1086.0]
  - - [512, 128, 8, 2048, 512, 512, 512, 2048]
    - [18, 1093.0]
  - - [512, 256, 8, 32, 512, 512, 512, 32]
    - [53, 865.0]
  - - [512, 256, 8, 64, 512, 512, 512, 64]
    - [37, 1018.0]
  - - [512, 256, 8, 128, 512, 512, 512, 128]
    - [26, 1112.0]
  - - [512, 256, 8, 256, 512, 512, 512, 256]
    - [57, 1166.0]
  - - [512, 256, 8, 512, 512, 512, 512, 512]
    - [37, 1194.0]
  - - [512, 256, 8, 1024, 512, 512, 512, 1024]
    - [51, 1209.0]
  - - [512, 256, 8, 2048, 512, 512, 512, 2048]
    - [51, 1216.0]
  - - [512, 512, 8, 32, 512, 512, 512, 32]
    - [37, 1105.0]
  - - [512, 512, 8, 64, 512, 512, 512, 64]
    - [42, 1288.0]
  - - [512, 512, 8, 128, 512, 512, 512, 128]
    - [57, 1410.0]
  - - [512, 512, 8, 256, 512, 512, 512, 256]
    - [2, 1486.0]
  - - [512, 512, 8, 512, 512, 512, 512, 512]
    - [49, 1521.0]
  - - [512, 512, 8, 1024, 512, 512, 512, 1024]
    - [26, 1542.0]
  - - [512, 512, 8, 2048, 512, 512, 512, 2048]
    - [49, 1553.0]
  - - [512, 1024, 8, 32, 512, 512, 512, 32]
    - [37, 1290.0]
  - - [512, 1024, 8, 64, 512, 512, 512, 64]
    - [37, 1505.0]
  - - [512, 1024, 8, 128, 512, 512, 512, 128]
    - [37, 1598.0]
  - - [512, 1024, 8, 256, 512, 512, 512, 256]
    - [2, 1667.0]
  - - [512, 1024, 8, 512, 512, 512, 512, 512]
    - [37, 1707.0]
  - - [512, 1024, 8, 1024, 512, 512, 512, 1024]
    - [49, 1723.0]
  - - [512, 1024, 8, 2048, 512, 512, 512, 2048]
    - [18, 1805.0]
  - - [512, 2048, 8, 32, 512, 512, 512, 32]
    - [37, 1432.0]
  - - [512, 2048, 8, 64, 512, 512, 512, 64]
    - [37, 1663.0]
  - - [512, 2048, 8, 128, 512, 512, 512, 128]
    - [2, 1787.0]
  - - [512, 2048, 8, 256, 512, 512, 512, 256]
    - [37, 1855.0]
  - - [512, 2048, 8, 512, 512, 512, 512, 512]
    - [37, 1896.0]
  - - [512, 2048, 8, 1024, 512, 512, 512, 1024]
    - [37, 1910.0]
  - - [512, 2048, 8, 2048, 512, 512, 512, 2048]
    - [37, 1920.0]
  - - [1024, 32, 8, 32, 1024, 1024, 1024, 32]
    - [2, 397.0]
  - - [1024, 32, 8, 64, 1024, 1024, 1024, 64]
    - [26, 462.0]
  - - [1024, 32, 8, 128, 1024, 1024, 1024, 128]
    - [19, 591.0]
  - - [1024, 32, 8, 256, 1024, 1024, 1024, 256]
    - [19, 690.0]
  - - [1024, 32, 8, 512, 1024, 1024, 1024, 512]
    - [19, 753.0]
  - - [1024, 32, 8, 1024, 1024, 1024, 1024, 1024]
    - [3, 786.0]
  - - [1024, 32, 8, 2048, 1024, 1024, 1024, 2048]
    - [19, 807.0]
  - - [1024, 64, 8, 32, 1024, 1024, 1024, 32]
    - [7, 768.0]
  - - [1024, 64, 8, 64, 1024, 1024, 1024, 64]
    - [57, 898.0]
  - - [1024, 64, 8, 128, 1024, 1024, 1024, 128]
    - [57, 986.0]
  - - [1024, 64, 8, 256, 1024, 1024, 1024, 256]
    - [15, 1039.0]
  - - [1024, 64, 8, 512, 1024, 1024, 1024, 512]
    - [2, 1069.0]
  - - [1024, 64, 8, 1024, 1024, 1024, 1024, 1024]
    - [49, 1084.0]
  - - [1024, 64, 8, 2048, 1024, 1024, 1024, 2048]
    - [49, 1091.0]
  - - [1024, 128, 8, 32, 1024, 1024, 1024, 32]
    - [53, 853.0]
  - - [1024, 128, 8, 64, 1024, 1024, 1024, 64]
    - [18, 1002.0]
  - - [1024, 128, 8, 128, 1024, 1024, 1024, 128]
    - [18, 1099.0]
  - - [1024, 128, 8, 256, 1024, 1024, 1024, 256]
    - [57, 1156.0]
  - - [1024, 128, 8, 512, 1024, 1024, 1024, 512]
    - [37, 1191.0]
  - - [1024, 128, 8, 1024, 1024, 1024, 1024, 1024]
    - [49, 1206.0]
  - - [1024, 128, 8, 2048, 1024, 1024, 1024, 2048]
    - [26, 1212.0]
  - - [1024, 256, 8, 32, 1024, 1024, 1024, 32]
    - [57, 1089.0]
  - - [1024, 256, 8, 64, 1024, 1024, 1024, 64]
    - [18, 1291.0]
  - - [1024, 256, 8, 128, 1024, 1024, 1024, 128]
    - [26, 1407.0]
  - - [1024, 256, 8, 256, 1024, 1024, 1024, 256]
    - [49, 1480.0]
  - - [1024, 256, 8, 512, 1024, 1024, 1024, 512]
    - [18, 1520.0]
  - - [1024, 256, 8, 1024, 1024, 1024, 1024, 1024]
    - [18, 1540.0]
  - - [1024, 256, 8, 2048, 1024, 1024, 1024, 2048]
    - [51, 1549.0]
  - - [1024, 512, 8, 32, 1024, 1024, 1024, 32]
    - [37, 1326.0]
  - - [1024, 512, 8, 64, 1024, 1024, 1024, 64]
    - [37, 1475.0]
  - - [1024, 512, 8, 128, 1024, 1024, 1024, 128]
    - [37, 1605.0]
  - - [1024, 512, 8, 256, 1024, 1024, 1024, 256]
    - [26, 1724.0]
  - - [1024, 512, 8, 512, 1024, 1024, 1024, 512]
    - [37, 1700.0]
  - - [1024, 512, 8, 1024, 1024, 1024, 1024, 1024]
    - [37, 1719.0]
  - - [1024, 512, 8, 2048, 1024, 1024, 1024, 2048]
    - [18, 1730.0]
  - - [1024, 1024, 8, 32, 1024, 1024, 1024, 32]
    - [2, 1453.0]
  - - [1024, 1024, 8, 64, 1024, 1024, 1024, 64]
    - [37, 1660.0]
  - - [1024, 1024, 8, 128, 1024, 1024, 1024, 128]
    - [37, 1784.0]
  - - [1024, 1024, 8, 256, 1024, 1024, 1024, 256]
    - [2, 1850.0]
  - - [1024, 1024, 8, 512, 1024, 1024, 1024, 512]
    - [37, 1888.0]
  - - [1024, 1024, 8, 1024, 1024, 1024, 1024, 1024]
    - [37, 1910.0]
  - - [1024, 1024, 8, 2048, 1024, 1024, 1024, 2048]
    - [18, 1918.0]
  - - [1024, 2048, 8, 32, 1024, 1024, 1024, 32]
    - [37, 1566.0]
  - - [1024, 2048, 8, 64, 1024, 1024, 1024, 64]
    - [2, 1732.0]
  - - [1024, 2048, 8, 128, 1024, 1024, 1024, 128]
    - [2, 1838.0]
  - - [1024, 2048, 8, 256, 1024, 1024, 1024, 256]
    - [2, 1891.0]
  - - [1024, 2048, 8, 512, 1024, 1024, 1024, 512]
    - [2, 1919.0]
  - - [1024, 2048, 8, 1024, 1024, 1024, 1024, 1024]
    - [37, 1933.0]
  - - [1024, 2048, 8, 2048, 1024, 1024, 1024, 2048]
    - [60, 1938.0]
  - - [2048, 32, 8, 32, 2048, 2048, 2048, 32]
    - [50, 583.0]
  - - [2048, 32, 8, 64, 2048, 2048, 2048, 64]
    - [38, 690.0]
  - - [2048, 32, 8, 128, 2048, 2048, 2048, 128]
    - [38, 750.0]
  - - [2048, 32, 8, 256, 2048, 2048, 2048, 256]
    - [45, 788.0]
  - - [2048, 32, 8, 512, 2048, 2048, 2048, 512]
    - [55, 808.0]
  - - [2048, 32, 8, 1024, 2048, 2048, 2048, 1024]
    - [43, 817.0]
  - - [2048, 32, 8, 2048, 2048, 2048, 2048, 2048]
    - [50, 819.0]
  - - [2048, 64, 8, 32, 2048, 2048, 2048, 32]
    - [47, 846.0]
  - - [2048, 64, 8, 64, 2048, 2048, 2048, 64]
    - [59, 1006.0]
  - - [2048, 64, 8, 128, 2048, 2048, 2048, 128]
    - [15, 1098.0]
  - - [2048, 64, 8, 256, 2048, 2048, 2048, 256]
    - [37, 1157.0]
  - - [2048, 64, 8, 512, 2048, 2048, 2048, 512]
    - [2, 1187.0]
  - - [2048, 64, 8, 1024, 2048, 2048, 2048, 1024]
    - [57, 1205.0]
  - - [2048, 64, 8, 2048, 2048, 2048, 2048, 2048]
    - [49, 1211.0]
  - - [2048, 128, 8, 32, 2048, 2048, 2048, 32]
    - [26, 1084.0]
  - - [2048, 128, 8, 64, 2048, 2048, 2048, 64]
    - [15, 1283.0]
  - - [2048, 128, 8, 128, 2048, 2048, 2048, 128]
    - [49, 1402.0]
  - - [2048, 128, 8, 256, 2048, 2048, 2048, 256]
    - [18, 1471.0]
  - - [2048, 128, 8, 512, 2048, 2048, 2048, 512]
    - [26, 1515.0]
  - - [2048, 128, 8, 1024, 2048, 2048, 2048, 1024]
    - [18, 1536.0]
  - - [2048, 128, 8, 2048, 2048, 2048, 2048, 2048]
    - [26, 1547.0]
  - - [2048, 256, 8, 32, 2048, 2048, 2048, 32]
    - [49, 1261.0]
  - - [2048, 256, 8, 64, 2048, 2048, 2048, 64]
    - [49, 1472.0]
  - - [2048, 256, 8, 128, 2048, 2048, 2048, 128]
    - [37, 1596.0]
  - - [2048, 256, 8, 256, 2048, 2048, 2048, 256]
    - [18, 1658.0]
  - - [2048, 256, 8, 512, 2048, 2048, 2048, 512]
    - [18, 1699.0]
  - - [2048, 256, 8, 1024, 2048, 2048, 2048, 1024]
    - [2, 1717.0]
  - - [2048, 256, 8, 2048, 2048, 2048, 2048, 2048]
    - [37, 1727.0]
  - - [2048, 512, 8, 32, 2048, 2048, 2048, 32]
    - [10, 1434.0]
  - - [2048, 512, 8, 64, 2048, 2048, 2048, 64]
    - [47, 1640.0]
  - - [2048, 512, 8, 128, 2048, 2048, 2048, 128]
    - [47, 1766.0]
  - - [2048, 512, 8, 256, 2048, 2048, 2048, 256]
    - [2, 1848.0]
  - - [2048, 512, 8, 512, 2048, 2048, 2048, 512]
    - [2, 1883.0]
  - - [2048, 512, 8, 1024, 2048, 2048, 2048, 1024]
    - [37, 1903.0]
  - - [2048, 512, 8, 2048, 2048, 2048, 2048, 2048]
    - [37, 1912.0]
  - - [2048, 1024, 8, 32, 2048, 2048, 2048, 32]
    - [40, 1538.0]
  - - [2048, 1024, 8, 64, 2048, 2048, 2048, 64]
    - [2, 1730.0]
  - - [2048, 1024, 8, 128, 2048, 2048, 2048, 128]
    - [10, 1824.0]
  - - [2048, 1024, 8, 256, 2048, 2048, 2048, 256]
    - [2, 1883.0]
  - - [2048, 1024, 8, 512, 2048, 2048, 2048, 512]
    - [15, 1911.0]
  - - [2048, 1024, 8, 1024, 2048, 2048, 2048, 1024]
    - [2, 1926.0]
  - - [2048, 1024, 8, 2048, 2048, 2048, 2048, 2048]
    - [20, 1933.0]
  - - [2048, 2048, 8, 32, 2048, 2048, 2048, 32]
    - [37, 1612.0]
  - - [2048, 2048, 8, 64, 2048, 2048, 2048, 64]
    - [44, 1777.0]
  - - [2048, 2048, 8, 128, 2048, 2048, 2048, 128]
    - [37, 1870.0]
  - - [2048, 2048, 8, 256, 2048, 2048, 2048, 256]
    - [37, 1921.0]
  - - [2048, 2048, 8, 512, 2048, 2048, 2048, 512]
    - [37, 1949.0]
  - - [2048, 2048, 8, 1024, 2048, 2048, 2048, 1024]
    - [37, 1962.0]
  - - [2048, 2048, 8, 2048, 2048, 2048, 2048, 2048]
    - [37, 1967.0]
- null
