library/src/blas3/Tensile/Logic/asm_full/arcturus_Cijk_Ailk_Bljk_HB.yaml
- {MinimumRequiredVersion: 4.6.0}
- arcturus
- gfx908
- [Device 7380, Device 7388, Device 738c, Device 7390]
    SolutionIndex: 0
    SolutionNameMin: Cijk_Ailk_Bljk_HB_MT016x016x08_EPS1_GRVW02_LPB00_PGR1_SNLL1_TT02_02_USFGRO01_VW02_WG08_08_01
    SolutionIndex: 1
    SolutionNameMin: Cijk_Ailk_Bljk_HB_MT032x008x08_EPS1_GRVW02_LPB00_PGR1_SNLL1_TT02_02_USFGRO01_VW02_WG16_04_01
    SolutionIndex: 2
    SolutionNameMin: Cijk_Ailk_Bljk_HB_MT064x016x08_EPS1_GRVW04_LPB00_PGR1_SNLL1_TT04_04_USFGRO0_VW04_WG16_04_01
    SolutionIndex: 3
    SolutionNameMin: Cijk_Ailk_Bljk_HB_MT064x016x08_EPS1_GRVW02_LPB00_PGR1_SNLL1_TT04_02_USFGRO01_VW02_WG16_08_01
    SolutionIndex: 4
    SolutionNameMin: Cijk_Ailk_Bljk_HB_MT064x032x08_EPS1_GRVW04_LPB00_PGR1_SNLL1_TT04_04_USFGRO0_VW04_WG16_08_01
    SolutionIndex: 5
    SolutionNameMin: Cijk_Ailk_Bljk_HB_MT128x016x08_EPS1_GRVW04_LPB00_PGR1_SNLL1_TT04_04_USFGRO0_VW04_WG32_04_01
    SolutionIndex: 6
    SolutionNameMin: Cijk_Ailk_Bljk_HB_MT128x032x08_EPS1_GRVW04_LPB00_PGR1_SNLL1_TT04_04_USFGRO0_VW04_WG32_08_01
    SolutionIndex: 7
    SolutionNameMin: Cijk_Ailk_Bljk_HB_MT256x064x08_EPS1_GRVW08_LPB00_PGR1_SNLL1_TT08_08_USFGRO0_VW08_WG32_08_01
    SolutionIndex: 8
    SolutionNameMin: Cijk_Ailk_Bljk_HB_MT016x016x16_EPS1_GRVW02_LPB00_PGR1_SNLL1_TT02_02_USFGRO01_VW02_WG08_08_01
    SolutionIndex: 9
    SolutionNameMin: Cijk_Ailk_Bljk_HB_MT032x008x16_EPS1_GRVW02_LPB00_PGR1_SNLL1_TT02_02_USFGRO01_VW02_WG16_04_01
    SolutionIndex: 10
    SolutionNameMin: Cijk_Ailk_Bljk_HB_MT064x016x16_EPS1_GRVW04_LPB00_PGR1_SNLL1_TT04_04_USFGRO0_VW04_WG16_04_01
    SolutionIndex: 11
    SolutionNameMin: Cijk_Ailk_Bljk_HB_MT032x016x16_EPS1_GRVW02_LPB00_PGR1_SNLL1_TT02_02_USFGRO01_VW02_WG16_08_01
    SolutionIndex: 12
    SolutionNameMin: Cijk_Ailk_Bljk_HB_MT064x016x16_EPS1_GRVW02_LPB00_PGR1_SNLL1_TT04_02_USFGRO01_VW02_WG16_08_01
    SolutionIndex: 13
    SolutionNameMin: Cijk_Ailk_Bljk_HB_MT064x032x16_EPS1_GRVW04_LPB00_PGR1_SNLL1_TT04_04_USFGRO0_VW04_WG16_08_01
    SolutionIndex: 14
    SolutionNameMin: Cijk_Ailk_Bljk_HB_MT032x032x16_EPS1_GRVW02_LPB00_PGR1_SNLL1_TT02_02_USFGRO01_VW02_WG16_16_01
    SolutionIndex: 15
    SolutionNameMin: Cijk_Ailk_Bljk_HB_MT128x016x16_EPS1_GRVW04_LPB00_PGR1_SNLL1_TT04_04_USFGRO0_VW04_WG32_04_01
    SolutionIndex: 16
    SolutionNameMin: Cijk_Ailk_Bljk_HB_MT064x016x16_EPS1_GRVW02_LPB00_PGR1_SNLL1_TT02_02_USFGRO01_VW02_WG32_08_01
    SolutionIndex: 17
    SolutionNameMin: Cijk_Ailk_Bljk_HB_MT032x008x32_EPS1_GRVW02_LPB00_PGR1_SNLL1_TT02_02_USFGRO01_VW02_WG16_04_01
    SolutionIndex: 18
    SolutionNameMin: Cijk_Ailk_Bljk_HB_MT032x016x32_EPS1_GRVW02_LPB00_PGR1_SNLL1_TT02_02_USFGRO01_VW02_WG16_08_01
    SolutionIndex: 19
    SolutionNameMin: Cijk_Ailk_Bljk_HB_MT064x008x32_EPS1_GRVW02_LPB00_PGR1_SNLL1_TT02_02_USFGRO01_VW02_WG32_04_01
    SolutionIndex: 20
    SolutionNameMin: Cijk_Ailk_Bljk_HB_MT064x016x32_EPS1_GRVW02_LPB00_PGR1_SNLL1_TT02_02_USFGRO01_VW02_WG32_08_01
    SolutionIndex: 21
    SolutionNameMin: Cijk_Ailk_Bljk_HB_MT032x008x64_EPS1_GRVW02_LPB00_PGR1_SNLL1_TT02_02_USFGRO01_VW02_WG16_04_01
    SolutionIndex: 22
    SolutionNameMin: Cijk_Ailk_Bljk_HB_MT064x008x64_EPS1_GRVW02_LPB00_PGR1_SNLL1_TT02_02_USFGRO01_VW02_WG32_04_01
    SolutionIndex: 23
    SolutionNameMin: Cijk_Ailk_Bljk_HB_MT256x032x08_EPS1_GRVW04_LPB00_PGR1_SNLL1_TT08_04_USFGRO0_VW04_WG32_08_01
    SolutionIndex: 24
    SolutionNameMin: Cijk_Ailk_Bljk_HB_MT032x032x08_EPS1_GRVW04_LPB00_PGR1_SNLL1_TT04_04_USFGRO0_VW04_WG08_08_01
    SolutionIndex: 25
    SolutionNameMin: Cijk_Ailk_Bljk_HB_MT064x032x08_EPS1_GRVW04_LPB00_PGR1_SNLL1_TT08_04_USFGRO0_VW04_WG08_08_01
    SolutionIndex: 26
    SolutionNameMin: Cijk_Ailk_Bljk_HB_MT064x016x08_EPS1_GRVW02_LPB00_PGR1_SNLL1_TT04_02_USFGRO01_VW02_WG16_08_01
    SolutionIndex: 27
    SolutionNameMin: Cijk_Ailk_Bljk_HB_MT064x032x08_EPS1_GRVW04_LPB00_PGR1_SNLL1_TT04_04_USFGRO0_VW04_WG16_08_01
    SolutionIndex: 28
    SolutionNameMin: Cijk_Ailk_Bljk_HB_MT128x032x08_EPS1_GRVW04_LPB00_PGR1_SNLL1_TT04_04_USFGRO0_VW04_WG32_08_01
    SolutionIndex: 29
    SolutionNameMin: Cijk_Ailk_Bljk_HB_MT128x016x08_EPS1_GRVW04_LPB00_PGR1_SNLL1_TT04_04_USFGRO0_VW04_WG32_04_01
    SolutionIndex: 30
    SolutionNameMin: Cijk_Ailk_Bljk_HB_MT032x032x16_EPS1_GRVW04_LPB00_PGR1_SNLL1_TT04_04_USFGRO0_VW04_WG08_08_01
    SolutionIndex: 31
    SolutionNameMin: Cijk_Ailk_Bljk_HB_MT064x032x16_EPS1_GRVW04_LPB00_PGR1_SNLL1_TT08_04_USFGRO0_VW04_WG08_08_01
    SolutionIndex: 32
    SolutionNameMin: Cijk_Ailk_Bljk_HB_MT064x064x16_EPS1_GRVW08_LPB00_PGR1_SNLL1_TT08_08_USFGRO0_VW08_WG08_08_01
    SolutionIndex: 33
    SolutionNameMin: Cijk_Ailk_Bljk_HB_MT032x016x16_EPS1_GRVW02_LPB00_PGR1_SNLL1_TT02_02_USFGRO01_VW02_WG16_08_01
    SolutionIndex: 34
    SolutionNameMin: Cijk_Ailk_Bljk_HB_MT064x016x16_EPS1_GRVW02_LPB00_PGR1_SNLL1_TT04_02_USFGRO01_VW02_WG16_08_01
    SolutionIndex: 35
    SolutionNameMin: Cijk_Ailk_Bljk_HB_MT064x032x16_EPS1_GRVW04_LPB00_PGR1_SNLL1_TT04_04_USFGRO0_VW04_WG16_08_01
    SolutionIndex: 36
    SolutionNameMin: Cijk_Ailk_Bljk_HB_MT064x016x16_EPS1_GRVW02_LPB00_PGR1_SNLL1_TT02_02_USFGRO01_VW02_WG32_08_01
    SolutionIndex: 37
    SolutionNameMin: Cijk_Ailk_Bljk_HB_MT064x016x16_EPS1_GRVW04_LPB00_PGR1_SNLL1_TT04_04_USFGRO0_VW04_WG16_04_01
    SolutionIndex: 38
    SolutionNameMin: Cijk_Ailk_Bljk_HB_MT016x016x24_EPS1_GRVW02_LPB00_PGR1_SNLL1_TT02_02_USFGRO01_VW02_WG08_08_01
    SolutionIndex: 39
    SolutionNameMin: Cijk_Ailk_Bljk_HB_MT032x032x24_EPS1_GRVW04_LPB00_PGR1_SNLL1_TT04_04_USFGRO0_VW04_WG08_08_01
    SolutionIndex: 40
    SolutionNameMin: Cijk_Ailk_Bljk_HB_MT032x032x24_EPS1_GRVW04_LPB00_PGR1_SNLL1_TT04_04_USFGRO0_VW04_WG08_08_01
    SolutionIndex: 41
    SolutionNameMin: Cijk_Ailk_Bljk_HB_MT064x016x32_EPS1_GRVW02_LPB00_PGR1_SNLL1_TT02_02_USFGRO01_VW02_WG32_08_01
    SolutionIndex: 42
    SolutionNameMin: Cijk_Ailk_Bljk_HB_MT032x008x32_EPS1_GRVW02_LPB00_PGR1_SNLL1_TT02_02_USFGRO01_VW02_WG16_04_01
    SolutionIndex: 43
    SolutionNameMin: Cijk_Ailk_Bljk_HB_MT064x008x32_EPS1_GRVW02_LPB00_PGR1_SNLL1_TT02_02_USFGRO01_VW02_WG32_04_01
    SolutionIndex: 44
    SolutionNameMin: Cijk_Ailk_Bljk_HB_MT064x064x08_EPS1_GRVW04_LPB00_PGR1_SNLL1_TT04_04_USFGRO01_VW04_WG16_16_01
    SolutionIndex: 45
    SolutionNameMin: Cijk_Ailk_Bljk_HB_MT128x064x08_EPS1_GRVW04_LPB00_PGR1_SNLL1_TT08_04_USFGRO0_VW04_WG16_16_01
    SolutionIndex: 46
    SolutionNameMin: Cijk_Ailk_Bljk_HB_MT064x064x16_EPS0_GRVW08_LPB00_PGR0_SNLL0_TT08_08_USFGRO0_VW08_WG08_08_01
    SolutionIndex: 47
    SolutionNameMin: Cijk_Ailk_Bljk_HB_MT064x064x16_EPS1_GRVW04_LPB00_PGR1_SNLL1_TT04_04_USFGRO0_VW04_WG16_16_01
    SolutionIndex: 48
    SolutionNameMin: Cijk_Ailk_Bljk_HB_MT064x128x16_EPS1_GRVW04_LPB00_PGR1_SNLL1_TT04_08_USFGRO0_VW04_WG16_16_01
    SolutionIndex: 49
    SolutionNameMin: Cijk_Ailk_Bljk_HB_MT128x064x16_EPS1_GRVW04_LPB00_PGR1_SNLL1_TT08_04_USFGRO0_VW04_WG16_16_01
    SolutionIndex: 50
    SolutionNameMin: Cijk_Ailk_Bljk_HB_MT128x128x16_EPS1_GRVW08_LPB00_PGR1_SNLL1_TT08_08_USFGRO0_VW08_WG16_16_01
    SolutionIndex: 51
    SolutionNameMin: Cijk_Ailk_Bljk_HB_MT128x064x32_EPS0_GRVW04_LPB00_PGR0_SNLL0_TT08_04_USFGRO0_VW04_WG16_16_01
    SolutionIndex: 52
    SolutionNameMin: Cijk_Ailk_Bljk_HB_MT128x064x32_EPS1_GRVW04_LPB00_PGR1_SNLL1_TT08_04_USFGRO0_VW04_WG16_16_01
    SolutionIndex: 53
    SolutionNameMin: Cijk_Ailk_Bljk_HB_MT128x128x32_EPS0_GRVW08_LPB00_PGR0_SNLL0_TT08_08_USFGRO0_VW08_WG16_16_01
    SolutionIndex: 54
    SolutionNameMin: Cijk_Ailk_Bljk_HB_MT128x128x32_EPS1_GRVW08_LPB00_PGR1_SNLL1_TT08_08_USFGRO0_VW08_WG16_16_01
    SolutionIndex: 55
    SolutionNameMin: Cijk_Ailk_Bljk_HB_MT064x064x16_EPS1_GRVW04_LPB04_PGR1_SNLL1_TT04_04_USFGRO0_VW04_WG16_16_01
    SolutionIndex: 56
    SolutionNameMin: Cijk_Ailk_Bljk_HB_MT128x064x16_EPS1_GRVW04_LPB04_PGR1_SNLL1_TT04_08_USFGRO0_VW04_WG32_08_01
    SolutionIndex: 57
    SolutionNameMin: Cijk_Ailk_Bljk_HB_MT256x064x16_EPS1_GRVW04_LPB04_PGR1_SNLL1_TT08_04_USFGRO0_VW04_WG32_16_01
    SolutionIndex: 58
    SolutionNameMin: Cijk_Ailk_Bljk_HB_MT064x128x16_EPS1_GRVW04_LPB04_PGR1_SNLL1_TT04_08_USFGRO0_VW04_WG16_16_01
    SolutionIndex: 59
    SolutionNameMin: Cijk_Ailk_Bljk_HB_MT128x064x16_EPS1_GRVW04_LPB04_PGR1_SNLL1_TT08_04_USFGRO0_VW04_WG16_16_01
    SolutionIndex: 60
    SolutionNameMin: Cijk_Ailk_Bljk_HB_MT128x064x32_EPS1_GRVW04_LPB04_PGR1_SNLL1_TT04_04_USFGRO0_VW04_WG32_16_01
    SolutionIndex: 61
    SolutionNameMin: Cijk_Ailk_Bljk_HB_MT064x128x16_EPS0_GRVW04_LPB04_PGR0_SNLL0_TT04_08_USFGRO0_VW04_WG16_16_01
    SolutionIndex: 62
    SolutionNameMin: Cijk_Ailk_Bljk_HB_MT128x064x16_EPS0_GRVW04_LPB04_PGR0_SNLL0_TT08_04_USFGRO0_VW04_WG16_16_01
    SolutionIndex: 63
    SolutionNameMin: Cijk_Ailk_Bljk_HB_MT128x064x16_EPS0_GRVW04_LPB04_PGR0_SNLL0_TT04_08_USFGRO0_VW04_WG32_08_01
    SolutionIndex: 64
    SolutionNameMin: Cijk_Ailk_Bljk_HB_MT256x032x16_EPS0_GRVW04_LPB04_PGR0_SNLL0_TT08_04_USFGRO0_VW04_WG32_08_01
    SolutionIndex: 0
    SolutionNameMin: Cijk_Ailk_Bljk_HB_MT128x128x16_DTL0_GRVW08_GSU01_LPB00_PGR1_PLR1_TT08_08_USFGRO0_VW08_WG16_16_01_WGM01
    SolutionIndex: 1
    SolutionNameMin: Cijk_Ailk_Bljk_HB_MT064x128x16_DTL0_GRVW02_GSU01_LPB04_PGR0_PLR1_TT08_04_USFGRO01_VW04_WG08_32_01_WGM01
    SolutionIndex: 2
    SolutionNameMin: Cijk_Ailk_Bljk_HB_MT128x064x16_DTL0_GRVW02_GSU01_LPB04_PGR0_PLR1_TT08_04_USFGRO01_VW04_WG16_16_01_WGM01
    SolutionIndex: 3
    SolutionNameMin: Cijk_Ailk_Bljk_HB_MT128x064x16_DTL0_GRVW02_GSU01_LPB04_PGR1_PLR1_TT08_04_USFGRO01_VW04_WG16_16_01_WGM64
    SolutionIndex: 4
    SolutionNameMin: Cijk_Ailk_Bljk_HB_MT128x064x32_DTL0_GRVW02_GSU03_LPB04_PGR0_PLR1_TT08_04_USFGRO01_VW04_WG16_16_01_WGM08
    SolutionIndex: 5
    SolutionNameMin: Cijk_Ailk_Bljk_HB_MT128x064x32_DTL0_GRVW02_GSU05_LPB04_PGR0_PLR1_TT08_04_USFGRO01_VW04_WG16_16_01_WGM08
    SolutionIndex: 6
    SolutionNameMin: Cijk_Ailk_Bljk_HB_MT128x128x08_DTL0_GRVW02_GSU01_LPB08_PGR1_PLR1_TT08_08_USFGRO01_VW08_WG16_16_01_WGM01
- - - [1024, 1024, 1, 3328]
    - [49, 0.0]
  - - [2944, 4288, 1, 1280]
    - [45, 0.0]
  - - [2368, 64, 1, 3328]
    - [33, 0.0]
  - - [1760, 32, 1, 1760]
    - [38, 0.0]
  - - [2368, 5888, 1, 256]
    - [50, 0.0]
  - - [256, 704, 1, 1280]
    - [30, 0.0]
  - - [512, 24000, 1, 1536]
    - [50, 0.0]
  - - [128, 6784, 1, 3328]
    - [49, 0.0]
  - - [5888, 1856, 1, 3328]
    - [45, 0.0]
  - - [512, 4, 1, 512]
    - [17, 0.0]
  - - [5888, 2944, 1, 3328]
    - [50, 0.0]
  - - [1856, 4288, 1, 256]
    - [45, 0.0]
  - - [5056, 5056, 1, 3328]
    - [50, 0.0]
  - - [1408, 5888, 1, 1280]
    - [50, 0.0]
  - - [6144, 6000, 1, 2560]
    - [50, 0.0]
  - - [1024, 3584, 1, 3328]
    - [45, 0.0]
  - - [512, 48000, 1, 2048]
    - [53, 0.0]
  - - [448, 3584, 1, 3328]
    - [49, 0.0]
  - - [256, 4288, 1, 3328]
    - [47, 0.0]
  - - [5888, 1408, 1, 1280]
    - [50, 0.0]
  - - [704, 1856, 1, 3328]
    - [47, 0.0]
  - - [1024, 2368, 1, 256]
    - [45, 0.0]
  - - [5056, 6784, 1, 1280]
    - [50, 0.0]
  - - [1408, 64, 1, 1280]
    - [33, 0.0]
  - - [448, 1024, 1, 1280]
    - [47, 0.0]
  - - [4096, 32, 1, 4096]
    - [41, 0.0]
  - - [5056, 5056, 1, 1280]
    - [50, 0.0]
  - - [4288, 6784, 1, 256]
    - [46, 0.0]
  - - [6784, 448, 1, 256]
    - [49, 0.0]
  - - [5056, 256, 1, 1280]
    - [47, 0.0]
  - - [5888, 704, 1, 1280]
    - [45, 0.0]
  - - [3584, 1024, 1, 256]
    - [49, 0.0]
  - - [6784, 4288, 1, 3328]
    - [45, 0.0]
  - - [1856, 2368, 1, 3328]
    - [45, 0.0]
  - - [5888, 2944, 1, 1280]
    - [50, 0.0]
  - - [5888, 1024, 1, 256]
    - [45, 0.0]
  - - [448, 64, 1, 1280]
    - [38, 0.0]
  - - [3072, 64, 1, 1024]
    - [34, 0.0]
  - - [2560, 16, 1, 2560]
    - [17, 0.0]
  - - [1024, 704, 1, 256]
    - [47, 0.0]
  - - [1408, 2944, 1, 256]
    - [50, 0.0]
  - - [256, 1856, 1, 1280]
    - [47, 0.0]
  - - [6784, 5056, 1, 3328]
    - [45, 0.0]
  - - [5056, 5056, 1, 256]
    - [45, 0.0]
  - - [256, 2944, 1, 3328]
    - [47, 0.0]
  - - [64, 1024, 1, 1280]
    - [38, 0.0]
  - - [1024, 3584, 1, 1280]
    - [45, 0.0]
  - - [2368, 2944, 1, 1280]
    - [50, 0.0]
  - - [128, 3584, 1, 1280]
    - [35, 0.0]
  - - [6784, 6784, 1, 1280]
    - [50, 0.0]
  - - [1024, 256, 1, 3328]
    - [40, 0.0]
  - - [1408, 4288, 1, 1280]
    - [50, 0.0]
  - - [3584, 4288, 1, 1280]
    - [50, 0.0]
  - - [512, 6000, 1, 2560]
    - [50, 0.0]
  - - [2368, 704, 1, 1280]
    - [45, 0.0]
  - - [5056, 4288, 1, 3328]
    - [45, 0.0]
  - - [3584, 2368, 1, 3328]
    - [45, 0.0]
  - - [5888, 6784, 1, 1280]
    - [50, 0.0]
  - - [64, 704, 1, 1280]
    - [38, 0.0]
  - - [4288, 256, 1, 256]
    - [24, 0.0]
  - - [6144, 32, 1, 2560]
    - [34, 0.0]
  - - [6784, 448, 1, 1280]
    - [45, 0.0]
  - - [2944, 5888, 1, 256]
    - [50, 0.0]
  - - [256, 128, 1, 256]
    - [41, 0.0]
  - - [4288, 2944, 1, 256]
    - [45, 0.0]
  - - [1760, 16, 1, 1760]
    - [17, 0.0]
  - - [6144, 24000, 1, 2560]
    - [50, 0.0]
  - - [5888, 64, 1, 3328]
    - [13, 0.0]
  - - [2944, 256, 1, 3328]
    - [47, 0.0]
  - - [5056, 2368, 1, 1280]
    - [50, 0.0]
  - - [448, 3584, 1, 1280]
    - [49, 0.0]
  - - [6784, 5888, 1, 256]
    - [45, 0.0]
  - - [64, 1024, 1, 3328]
    - [42, 0.0]
  - - [704, 128, 1, 1280]
    - [11, 0.0]
  - - [1408, 448, 1, 1280]
    - [47, 0.0]
  - - [1024, 1408, 1, 256]
    - [49, 0.0]
  - - [2368, 2368, 1, 3328]
    - [45, 0.0]
  - - [5056, 704, 1, 3328]
    - [45, 0.0]
  - - [1408, 1856, 1, 256]
    - [45, 0.0]
  - - [1408, 256, 1, 1280]
    - [24, 0.0]
  - - [3072, 128, 1, 1024]
    - [35, 0.0]
  - - [5888, 1856, 1, 256]
    - [45, 0.0]
  - - [704, 5888, 1, 256]
    - [46, 0.0]
  - - [6784, 64, 1, 256]
    - [4, 0.0]
  - - [128, 1, 1, 1408]
    - [21, 0.0]
  - - [3584, 704, 1, 3328]
    - [45, 0.0]
  - - [1408, 1408, 1, 256]
    - [45, 0.0]
  - - [1024, 64, 1, 1280]
    - [17, 0.0]
  - - [8448, 4, 1, 2816]
    - [19, 0.0]
  - - [448, 4288, 1, 256]
    - [48, 0.0]
  - - [64, 3584, 1, 3328]
    - [39, 0.0]
  - - [704, 2368, 1, 1280]
    - [45, 0.0]
  - - [7680, 16, 1, 2560]
    - [20, 0.0]
  - - [1856, 2368, 1, 1280]
    - [45, 0.0]
  - - [2368, 128, 1, 3328]
    - [13, 0.0]
  - - [1408, 1408, 1, 3328]
    - [49, 0.0]
  - - [2944, 128, 1, 256]
    - [27, 0.0]
  - - [448, 1408, 1, 256]
    - [47, 0.0]
  - - [64, 5056, 1, 3328]
    - [13, 0.0]
  - - [512, 1500, 1, 2816]
    - [47, 0.0]
  - - [256, 193600, 1, 64]
    - [7, 0.0]
  - - [1408, 1024, 1, 1280]
    - [45, 0.0]
  - - [704, 6784, 1, 256]
    - [50, 0.0]
  - - [6784, 704, 1, 256]
    - [45, 0.0]
  - - [2048, 7000, 1, 2048]
    - [53, 0.0]
  - - [256, 3584, 1, 3328]
    - [49, 0.0]
  - - [5056, 704, 1, 256]
    - [45, 0.0]
  - - [1408, 3584, 1, 256]
    - [50, 0.0]
  - - [3584, 4288, 1, 3328]
    - [50, 0.0]
  - - [5888, 1856, 1, 1280]
    - [45, 0.0]
  - - [256, 1408, 1, 256]
    - [44, 0.0]
  - - [5056, 64, 1, 1280]
    - [12, 0.0]
  - - [2368, 128, 1, 256]
    - [26, 0.0]
  - - [2368, 3584, 1, 1280]
    - [45, 0.0]
  - - [1024, 256, 1, 256]
    - [24, 0.0]
  - - [448, 448, 1, 256]
    - [3, 0.0]
  - - [2944, 3584, 1, 3328]
    - [45, 0.0]
  - - [7680, 32, 1, 2560]
    - [40, 0.0]
  - - [256, 256, 1, 3328]
    - [17, 0.0]
  - - [128, 1024, 1, 3328]
    - [20, 0.0]
  - - [6784, 2944, 1, 256]
    - [45, 0.0]
  - - [64, 1856, 1, 1280]
    - [16, 0.0]
  - - [448, 256, 1, 256]
    - [36, 0.0]
  - - [1024, 1500, 1, 2560]
    - [49, 0.0]
  - - [1856, 2368, 1, 256]
    - [45, 0.0]
  - - [3584, 6784, 1, 3328]
    - [45, 0.0]
  - - [256, 1024, 1, 256]
    - [44, 0.0]
  - - [1024, 128, 1, 1280]
    - [36, 0.0]
  - - [3072, 32, 1, 1024]
    - [33, 0.0]
  - - [4288, 128, 1, 1280]
    - [29, 0.0]
  - - [5056, 4288, 1, 1280]
    - [45, 0.0]
  - - [5888, 64, 1, 256]
    - [6, 0.0]
  - - [6784, 1856, 1, 3328]
    - [45, 0.0]
  - - [1408, 5056, 1, 1280]
    - [50, 0.0]
  - - [1856, 256, 1, 1280]
    - [24, 0.0]
  - - [64, 5888, 1, 3328]
    - [13, 0.0]
  - - [196, 1024, 64, 256]
    - [63, 0.0]
  - - [6784, 5888, 1, 3328]
    - [45, 0.0]
  - - [4608, 1, 1, 1536]
    - [17, 0.0]
  - - [448, 256, 1, 3328]
    - [20, 0.0]
  - - [2368, 5056, 1, 1280]
    - [50, 0.0]
  - - [7680, 4, 1, 2560]
    - [17, 0.0]
  - - [1024, 704, 1, 1280]
    - [44, 0.0]
  - - [256, 1408, 1, 3328]
    - [40, 0.0]
  - - [6784, 128, 1, 3328]
    - [49, 0.0]
  - - [1024, 5056, 1, 1280]
    - [50, 0.0]
  - - [4288, 1024, 1, 256]
    - [45, 0.0]
  - - [2368, 1408, 1, 256]
    - [45, 0.0]
  - - [704, 704, 1, 3328]
    - [47, 0.0]
  - - [5888, 448, 1, 1280]
    - [45, 0.0]
  - - [3584, 256, 1, 3328]
    - [49, 0.0]
  - - [704, 5888, 1, 3328]
    - [48, 0.0]
  - - [1024, 6784, 1, 1280]
    - [50, 0.0]
  - - [128, 3584, 1, 3328]
    - [37, 0.0]
  - - [128, 704, 1, 1280]
    - [11, 0.0]
  - - [3584, 2944, 1, 1280]
    - [45, 0.0]
  - - [1856, 128, 1, 3328]
    - [39, 0.0]
  - - [512, 6000, 1, 2816]
    - [45, 0.0]
  - - [128, 2944, 1, 1280]
    - [13, 0.0]
  - - [512, 24000, 1, 2048]
    - [53, 0.0]
  - - [448, 1856, 1, 1280]
    - [49, 0.0]
  - - [1408, 5056, 1, 3328]
    - [50, 0.0]
  - - [1856, 1856, 1, 3328]
    - [45, 0.0]
  - - [3584, 128, 1, 256]
    - [6, 0.0]
  - - [448, 1408, 1, 3328]
    - [47, 0.0]
  - - [2368, 2368, 1, 256]
    - [45, 0.0]
  - - [4288, 4288, 1, 1280]
    - [45, 0.0]
  - - [64, 448, 1, 1280]
    - [38, 0.0]
  - - [5888, 1024, 1, 1280]
    - [50, 0.0]
  - - [704, 1024, 1, 256]
    - [47, 0.0]
  - - [1024, 12544, 1, 256]
    - [23, 0.0]
  - - [512, 48000, 1, 2560]
    - [50, 0.0]
  - - [8448, 16, 1, 2816]
    - [43, 0.0]
  - - [704, 6784, 1, 3328]
    - [50, 0.0]
  - - [5888, 5888, 1, 3328]
    - [45, 0.0]
  - - [5056, 1024, 1, 1280]
    - [50, 0.0]
  - - [448, 5888, 1, 3328]
    - [45, 0.0]
  - - [3072, 2, 1, 1024]
    - [19, 0.0]
  - - [1024, 2944, 1, 1280]
    - [45, 0.0]
  - - [5056, 5888, 1, 1280]
    - [50, 0.0]
  - - [448, 6784, 1, 256]
    - [48, 0.0]
  - - [256, 3584, 1, 256]
    - [45, 0.0]
  - - [256, 448, 1, 256]
    - [16, 0.0]
  - - [6144, 16, 1, 2560]
    - [19, 0.0]
  - - [3584, 5888, 1, 256]
    - [45, 0.0]
  - - [2944, 3584, 1, 256]
    - [45, 0.0]
  - - [512, 32, 1, 512]
    - [20, 0.0]
  - - [3072, 1500, 1, 1024]
    - [49, 0.0]
  - - [1408, 704, 1, 256]
    - [45, 0.0]
  - - [6784, 1024, 1, 3328]
    - [50, 0.0]
  - - [6784, 2944, 1, 3328]
    - [45, 0.0]
  - - [7680, 1, 1, 2560]
    - [19, 0.0]
  - - [64, 64, 1, 3328]
    - [21, 0.0]
  - - [512, 1, 1, 512]
    - [17, 0.0]
  - - [6784, 2368, 1, 1280]
    - [45, 0.0]
  - - [512, 2, 1, 512]
    - [19, 0.0]
  - - [4288, 3584, 1, 256]
    - [50, 0.0]
  - - [4288, 5888, 1, 1280]
    - [45, 0.0]
  - - [4608, 4, 1, 1536]
    - [17, 0.0]
  - - [1024, 6000, 1, 1536]
    - [50, 0.0]
  - - [8448, 32, 1, 2816]
    - [13, 0.0]
  - - [448, 2944, 1, 3328]
    - [49, 0.0]
  - - [4288, 1856, 1, 1280]
    - [50, 0.0]
  - - [1856, 2944, 1, 3328]
    - [45, 0.0]
  - - [256, 6784, 1, 3328]
    - [49, 0.0]
  - - [512, 3000, 1, 1536]
    - [49, 0.0]
  - - [64, 5888, 1, 256]
    - [13, 0.0]
  - - [5056, 1024, 1, 256]
    - [45, 0.0]
  - - [704, 64, 1, 3328]
    - [17, 0.0]
  - - [5056, 1856, 1, 3328]
    - [46, 0.0]
  - - [512, 1500, 1, 2048]
    - [52, 0.0]
  - - [1024, 1, 1, 500000]
    - [21, 0.0]
  - - [448, 448, 1, 3328]
    - [39, 0.0]
  - - [448, 2368, 1, 1280]
    - [47, 0.0]
  - - [1408, 128, 1, 1280]
    - [12, 0.0]
  - - [4096, 7000, 1, 4096]
    - [50, 0.0]
  - - [5056, 256, 1, 3328]
    - [47, 0.0]
  - - [704, 704, 1, 256]
    - [47, 0.0]
  - - [1024, 5888, 1, 1280]
    - [50, 0.0]
  - - [64, 128, 1, 256]
    - [18, 0.0]
  - - [128, 1856, 1, 1280]
    - [10, 0.0]
  - - [5056, 3584, 1, 256]
    - [45, 0.0]
  - - [1856, 1024, 1, 1280]
    - [45, 0.0]
  - - [64, 193600, 1, 64]
    - [55, 0.0]
  - - [1856, 1856, 1, 1280]
    - [45, 0.0]
  - - [3072, 24000, 1, 1024]
    - [50, 0.0]
  - - [128, 4288, 1, 3328]
    - [15, 0.0]
  - - [1856, 1024, 1, 3328]
    - [49, 0.0]
  - - [256, 2368, 1, 256]
    - [47, 0.0]
  - - [1024, 448, 1, 3328]
    - [40, 0.0]
  - - [1856, 704, 1, 1280]
    - [47, 0.0]
  - - [6784, 1024, 1, 256]
    - [45, 0.0]
  - - [5056, 5888, 1, 3328]
    - [50, 0.0]
  - - [1856, 1024, 1, 256]
    - [45, 0.0]
  - - [512, 48000, 1, 1536]
    - [50, 0.0]
  - - [5056, 1408, 1, 3328]
    - [50, 0.0]
  - - [1024, 1024, 1, 1280]
    - [49, 0.0]
  - - [448, 5888, 1, 256]
    - [45, 0.0]
  - - [2048, 128, 1, 2048]
    - [37, 0.0]
  - - [1408, 6784, 1, 3328]
    - [45, 0.0]
  - - [1024, 24000, 1, 2560]
    - [50, 0.0]
  - - [2944, 1408, 1, 3328]
    - [50, 0.0]
  - - [2944, 4288, 1, 3328]
    - [45, 0.0]
  - - [256, 2944, 1, 256]
    - [47, 0.0]
  - - [5056, 2944, 1, 256]
    - [45, 0.0]
  - - [1024, 700, 1, 512]
    - [47, 0.0]
  - - [3072, 1, 1, 128]
    - [0, 0.0]
  - - [2368, 1856, 1, 256]
    - [45, 0.0]
  - - [128, 6784, 1, 1280]
    - [49, 0.0]
  - - [1408, 3584, 1, 3328]
    - [50, 0.0]
  - - [2368, 6784, 1, 256]
    - [50, 0.0]
  - - [4288, 2368, 1, 3328]
    - [45, 0.0]
  - - [704, 3584, 1, 1280]
    - [48, 0.0]
  - - [1408, 5888, 1, 3328]
    - [50, 0.0]
  - - [1856, 5056, 1, 256]
    - [45, 0.0]
  - - [6784, 6784, 1, 256]
    - [50, 0.0]
  - - [1408, 704, 1, 3328]
    - [49, 0.0]
  - - [128, 5888, 1, 1280]
    - [6, 0.0]
  - - [2368, 4288, 1, 1280]
    - [45, 0.0]
  - - [3584, 1856, 1, 1280]
    - [45, 0.0]
  - - [704, 1408, 1, 3328]
    - [31, 0.0]
  - - [704, 64, 1, 1280]
    - [38, 0.0]
  - - [8448, 48000, 1, 2816]
    - [53, 0.0]
  - - [512, 6000, 1, 2048]
    - [51, 0.0]
  - - [3584, 448, 1, 256]
    - [45, 0.0]
  - - [3584, 3584, 1, 1280]
    - [45, 0.0]
  - - [7680, 64, 1, 2560]
    - [13, 0.0]
  - - [256, 6784, 1, 256]
    - [45, 0.0]
  - - [1856, 3584, 1, 3328]
    - [50, 0.0]
  - - [128, 448, 1, 256]
    - [8, 0.0]
  - - [2048, 32, 1, 2048]
    - [20, 0.0]
  - - [3584, 3584, 1, 256]
    - [45, 0.0]
  - - [6784, 4288, 1, 1280]
    - [45, 0.0]
  - - [448, 704, 1, 1280]
    - [40, 0.0]
  - - [3584, 5056, 1, 256]
    - [45, 0.0]
  - - [6784, 128, 1, 256]
    - [27, 0.0]
  - - [64, 1408, 1, 3328]
    - [33, 0.0]
  - - [704, 448, 1, 256]
    - [44, 0.0]
  - - [2944, 2368, 1, 1280]
    - [50, 0.0]
  - - [448, 64, 1, 3328]
    - [38, 0.0]
  - - [6784, 3584, 1, 256]
    - [45, 0.0]
  - - [256, 1856, 1, 3328]
    - [47, 0.0]
  - - [256, 704, 1, 256]
    - [44, 0.0]
  - - [128, 1408, 1, 256]
    - [16, 0.0]
  - - [64, 128, 1, 3328]
    - [21, 0.0]
  - - [1856, 1408, 1, 256]
    - [48, 0.0]
  - - [2944, 2944, 1, 3328]
    - [45, 0.0]
  - - [5056, 6784, 1, 256]
    - [46, 0.0]
  - - [1408, 4288, 1, 3328]
    - [50, 0.0]
  - - [6784, 256, 1, 1280]
    - [49, 0.0]
  - - [1024, 704, 1, 3328]
    - [47, 0.0]
  - - [2368, 704, 1, 3328]
    - [45, 0.0]
  - - [128, 4288, 1, 256]
    - [5, 0.0]
  - - [3584, 6784, 1, 256]
    - [45, 0.0]
  - - [128, 128, 1, 3328]
    - [21, 0.0]
  - - [5056, 1856, 1, 256]
    - [45, 0.0]
  - - [1024, 3000, 1, 2816]
    - [45, 0.0]
  - - [64, 1, 1, 1216]
    - [38, 0.0]
  - - [704, 4288, 1, 256]
    - [48, 0.0]
  - - [256, 448, 1, 3328]
    - [20, 0.0]
  - - [1408, 6784, 1, 1280]
    - [45, 0.0]
  - - [7680, 24000, 1, 2560]
    - [50, 0.0]
  - - [64, 2368, 1, 1280]
    - [33, 0.0]
  - - [4608, 48000, 1, 1536]
    - [50, 0.0]
  - - [64, 6784, 1, 3328]
    - [13, 0.0]
  - - [2944, 256, 1, 1280]
    - [47, 0.0]
  - - [2048, 16, 1, 2048]
    - [17, 0.0]
  - - [1024, 24000, 1, 1536]
    - [50, 0.0]
  - - [5056, 2368, 1, 3328]
    - [50, 0.0]
  - - [2944, 4288, 1, 256]
    - [45, 0.0]
  - - [1408, 3584, 1, 1280]
    - [50, 0.0]
  - - [2368, 64, 1, 256]
    - [11, 0.0]
  - - [256, 256, 1, 256]
    - [8, 0.0]
  - - [704, 128, 1, 3328]
    - [33, 0.0]
  - - [1856, 704, 1, 256]
    - [47, 0.0]
  - - [1024, 1500, 1, 2816]
    - [49, 0.0]
  - - [8448, 1, 1, 2816]
    - [19, 0.0]
  - - [1024, 6000, 1, 2048]
    - [54, 0.0]
  - - [512, 24000, 1, 2560]
    - [50, 0.0]
  - - [6144, 3000, 1, 2560]
    - [50, 0.0]
  - - [2368, 6784, 1, 3328]
    - [50, 0.0]
  - - [5056, 704, 1, 1280]
    - [45, 0.0]
  - - [1856, 4288, 1, 3328]
    - [50, 0.0]
  - - [1408, 5888, 1, 256]
    - [50, 0.0]
  - - [704, 2944, 1, 1280]
    - [32, 0.0]
  - - [4288, 64, 1, 1280]
    - [12, 0.0]
  - - [704, 1856, 1, 256]
    - [47, 0.0]
  - - [2560, 64, 1, 2560]
    - [33, 0.0]
  - - [3584, 704, 1, 1280]
    - [45, 0.0]
  - - [5888, 5056, 1, 256]
    - [45, 0.0]
  - - [3584, 448, 1, 3328]
    - [49, 0.0]
  - - [704, 2368, 1, 3328]
    - [49, 0.0]
  - - [2944, 448, 1, 256]
    - [45, 0.0]
  - - [448, 5056, 1, 3328]
    - [45, 0.0]
  - - [2368, 128, 1, 1280]
    - [12, 0.0]
  - - [4288, 448, 1, 256]
    - [45, 0.0]
  - - [64, 6784, 1, 256]
    - [13, 0.0]
  - - [64, 5056, 1, 1280]
    - [12, 0.0]
  - - [5888, 2368, 1, 256]
    - [45, 0.0]
  - - [704, 448, 1, 3328]
    - [40, 0.0]
  - - [6784, 704, 1, 3328]
    - [45, 0.0]
  - - [128, 64, 1, 1280]
    - [21, 0.0]
  - - [2368, 256, 1, 1280]
    - [24, 0.0]
  - - [1408, 2944, 1, 3328]
    - [50, 0.0]
  - - [64, 1024, 1, 256]
    - [8, 0.0]
  - - [2368, 448, 1, 1280]
    - [47, 0.0]
  - - [128, 3584, 1, 256]
    - [6, 0.0]
  - - [1856, 448, 1, 3328]
    - [49, 0.0]
  - - [6144, 4, 1, 2560]
    - [17, 0.0]
  - - [128, 5056, 1, 256]
    - [13, 0.0]
  - - [4288, 4288, 1, 256]
    - [45, 0.0]
  - - [2368, 704, 1, 256]
    - [45, 0.0]
  - - [3584, 2368, 1, 256]
    - [45, 0.0]
  - - [5888, 5056, 1, 1280]
    - [45, 0.0]
  - - [128, 1024, 1, 1280]
    - [20, 0.0]
  - - [8448, 24000, 1, 2816]
    - [50, 0.0]
  - - [64, 704, 1, 256]
    - [14, 0.0]
  - - [4288, 256, 1, 1280]
    - [47, 0.0]
  - - [3584, 3584, 1, 3328]
    - [45, 0.0]
  - - [128, 1024, 1, 256]
    - [16, 0.0]
  - - [3072, 1500, 1, 128]
    - [45, 0.0]
  - - [2048, 3136, 1, 512]
    - [59, 0.0]
  - - [5888, 6784, 1, 256]
    - [50, 0.0]
  - - [4288, 2944, 1, 3328]
    - [45, 0.0]
  - - [1856, 64, 1, 256]
    - [16, 0.0]
  - - [1024, 16, 1, 500000]
    - [21, 0.0]
  - - [4288, 128, 1, 3328]
    - [15, 0.0]
  - - [7680, 128, 1, 2560]
    - [49, 0.0]
  - - [256, 5056, 1, 1280]
    - [47, 0.0]
  - - [6784, 5888, 1, 1280]
    - [45, 0.0]
  - - [3072, 1, 1, 1024]
    - [19, 0.0]
  - - [704, 128, 1, 256]
    - [11, 0.0]
  - - [5888, 4288, 1, 1280]
    - [45, 0.0]
  - - [1024, 24000, 1, 2048]
    - [53, 0.0]
  - - [448, 256, 1, 1280]
    - [20, 0.0]
  - - [448, 2368, 1, 3328]
    - [47, 0.0]
  - - [256, 1408, 1, 1280]
    - [40, 0.0]
  - - [3072, 16, 1, 1024]
    - [17, 0.0]
  - - [1408, 1856, 1, 1280]
    - [45, 0.0]
  - - [1024, 2, 1, 512]
    - [19, 0.0]
  - - [5888, 448, 1, 3328]
    - [45, 0.0]
  - - [704, 5888, 1, 1280]
    - [46, 0.0]
  - - [256, 64, 1, 3328]
    - [42, 0.0]
  - - [128, 2368, 1, 256]
    - [3, 0.0]
  - - [6784, 64, 1, 3328]
    - [4, 0.0]
  - - [5056, 2944, 1, 3328]
    - [45, 0.0]
  - - [448, 128, 1, 256]
    - [16, 0.0]
  - - [4096, 16, 1, 4096]
    - [17, 0.0]
  - - [1856, 128, 1, 1280]
    - [10, 0.0]
  - - [448, 4288, 1, 1280]
    - [32, 0.0]
  - - [64, 3584, 1, 256]
    - [12, 0.0]
  - - [128, 2944, 1, 3328]
    - [13, 0.0]
  - - [3584, 704, 1, 256]
    - [45, 0.0]
  - - [2944, 448, 1, 3328]
    - [49, 0.0]
  - - [1024, 2, 1, 500000]
    - [21, 0.0]
  - - [3584, 1408, 1, 3328]
    - [50, 0.0]
  - - [2368, 1024, 1, 1280]
    - [45, 0.0]
  - - [2944, 6784, 1, 1280]
    - [45, 0.0]
  - - [1856, 6784, 1, 256]
    - [45, 0.0]
  - - [4288, 448, 1, 3328]
    - [49, 0.0]
  - - [6784, 704, 1, 1280]
    - [45, 0.0]
  - - [6144, 1, 1, 2560]
    - [17, 0.0]
  - - [5888, 1024, 1, 3328]
    - [50, 0.0]
  - - [704, 6784, 1, 1280]
    - [50, 0.0]
  - - [5888, 128, 1, 256]
    - [6, 0.0]
  - - [512, 3000, 1, 2048]
    - [51, 0.0]
  - - [5056, 1024, 1, 3328]
    - [50, 0.0]
  - - [704, 5056, 1, 1280]
    - [48, 0.0]
  - - [64, 704, 1, 3328]
    - [17, 0.0]
  - - [2944, 1856, 1, 256]
    - [45, 0.0]
  - - [5056, 64, 1, 256]
    - [3, 0.0]
  - - [512, 1500, 1, 1536]
    - [47, 0.0]
  - - [512, 1, 1, 500000]
    - [21, 0.0]
  - - [5888, 5056, 1, 3328]
    - [45, 0.0]
  - - [128, 5056, 1, 3328]
    - [13, 0.0]
  - - [3584, 6784, 1, 1280]
    - [45, 0.0]
  - - [1856, 5888, 1, 256]
    - [50, 0.0]
  - - [64, 448, 1, 3328]
    - [38, 0.0]
  - - [4288, 4288, 1, 3328]
    - [45, 0.0]
  - - [4288, 1408, 1, 1280]
    - [50, 0.0]
  - - [64, 1856, 1, 256]
    - [11, 0.0]
  - - [4288, 2368, 1, 256]
    - [45, 0.0]
  - - [2944, 5056, 1, 1280]
    - [45, 0.0]
  - - [256, 4288, 1, 1280]
    - [47, 0.0]
  - - [6784, 2368, 1, 3328]
    - [45, 0.0]
  - - [256, 1024, 1, 1280]
    - [40, 0.0]
  - - [4288, 128, 1, 256]
    - [27, 0.0]
  - - [4288, 1856, 1, 3328]
    - [50, 0.0]
  - - [1856, 2944, 1, 1280]
    - [45, 0.0]
  - - [3584, 64, 1, 1280]
    - [10, 0.0]
  - - [4288, 6784, 1, 3328]
    - [45, 0.0]
  - - [3584, 1024, 1, 1280]
    - [45, 0.0]
  - - [1024, 4288, 1, 256]
    - [45, 0.0]
  - - [5888, 3584, 1, 3328]
    - [45, 0.0]
  - - [5056, 3584, 1, 3328]
    - [45, 0.0]
  - - [1408, 128, 1, 3328]
    - [12, 0.0]
  - - [2368, 1408, 1, 1280]
    - [45, 0.0]
  - - [5056, 2944, 1, 1280]
    - [45, 0.0]
  - - [8448, 6000, 1, 2816]
    - [45, 0.0]
  - - [3584, 256, 1, 256]
    - [25, 0.0]
  - - [1024, 6784, 1, 256]
    - [50, 0.0]
  - - [2944, 5056, 1, 3328]
    - [45, 0.0]
  - - [3584, 2944, 1, 256]
    - [45, 0.0]
  - - [448, 128, 1, 3328]
    - [17, 0.0]
  - - [64, 2944, 1, 3328]
    - [34, 0.0]
  - - [64, 4288, 1, 3328]
    - [35, 0.0]
  - - [5056, 6784, 1, 3328]
    - [50, 0.0]
  - - [128, 2944, 1, 256]
    - [2, 0.0]
  - - [3584, 4288, 1, 256]
    - [50, 0.0]
  - - [1856, 6784, 1, 3328]
    - [45, 0.0]
  - - [3584, 128, 1, 3328]
    - [6, 0.0]
  - - [128, 256, 1, 1280]
    - [42, 0.0]
  - - [64, 448, 1, 256]
    - [8, 0.0]
  - - [128, 1500, 1, 1280]
    - [12, 0.0]
  - - [64, 256, 1, 1280]
    - [22, 0.0]
  - - [512, 6000, 1, 1536]
    - [49, 0.0]
  - - [5056, 1408, 1, 1280]
    - [50, 0.0]
  - - [5888, 5888, 1, 256]
    - [50, 0.0]
  - - [4288, 1024, 1, 1280]
    - [45, 0.0]
  - - [5888, 128, 1, 3328]
    - [28, 0.0]
  - - [448, 6784, 1, 3328]
    - [48, 0.0]
  - - [2944, 1408, 1, 1280]
    - [50, 0.0]
  - - [64, 128, 1, 1280]
    - [21, 0.0]
  - - [3072, 6000, 1, 1024]
    - [50, 0.0]
  - - [1024, 32, 1, 512]
    - [20, 0.0]
  - - [2944, 1856, 1, 3328]
    - [45, 0.0]
  - - [448, 5056, 1, 256]
    - [45, 0.0]
  - - [64, 64, 1, 256]
    - [8, 0.0]
  - - [3584, 5888, 1, 1280]
    - [45, 0.0]
  - - [6784, 1856, 1, 1280]
    - [45, 0.0]
  - - [5888, 256, 1, 3328]
    - [49, 0.0]
  - - [1856, 5888, 1, 3328]
    - [50, 0.0]
  - - [3584, 1408, 1, 256]
    - [50, 0.0]
  - - [704, 3584, 1, 3328]
    - [48, 0.0]
  - - [5056, 448, 1, 1280]
    - [45, 0.0]
  - - [3584, 1856, 1, 3328]
    - [45, 0.0]
  - - [64, 193600, 1, 256]
    - [58, 0.0]
  - - [1024, 3000, 1, 2048]
    - [51, 0.0]
  - - [1408, 704, 1, 1280]
    - [49, 0.0]
  - - [2944, 1024, 1, 256]
    - [45, 0.0]
  - - [448, 1408, 1, 1280]
    - [47, 0.0]
  - - [2368, 4288, 1, 3328]
    - [45, 0.0]
  - - [1024, 1408, 1, 1280]
    - [45, 0.0]
  - - [256, 128, 1, 1280]
    - [17, 0.0]
  - - [704, 1408, 1, 1280]
    - [31, 0.0]
  - - [6784, 5056, 1, 256]
    - [45, 0.0]
  - - [4288, 5888, 1, 256]
    - [45, 0.0]
  - - [448, 2944, 1, 256]
    - [45, 0.0]
  - - [2944, 6784, 1, 256]
    - [45, 0.0]
  - - [2368, 2368, 1, 1280]
    - [45, 0.0]
  - - [1856, 3584, 1, 1280]
    - [50, 0.0]
  - - [64, 2944, 1, 256]
    - [36, 0.0]
  - - [3584, 1408, 1, 1280]
    - [50, 0.0]
  - - [5056, 3584, 1, 1280]
    - [45, 0.0]
  - - [256, 5888, 1, 256]
    - [45, 0.0]
  - - [128, 256, 1, 3328]
    - [17, 0.0]
  - - [1856, 1408, 1, 3328]
    - [48, 0.0]
  - - [1024, 4288, 1, 3328]
    - [45, 0.0]
  - - [448, 2368, 1, 256]
    - [47, 0.0]
  - - [64, 1408, 1, 1280]
    - [38, 0.0]
  - - [64, 6784, 1, 1280]
    - [13, 0.0]
  - - [2944, 2368, 1, 3328]
    - [50, 0.0]
  - - [704, 4288, 1, 3328]
    - [48, 0.0]
  - - [1024, 48000, 1, 2816]
    - [50, 0.0]
  - - [1024, 1856, 1, 1280]
    - [49, 0.0]
  - - [6784, 1856, 1, 256]
    - [45, 0.0]
  - - [512, 48000, 1, 2816]
    - [50, 0.0]
  - - [512, 3000, 1, 2816]
    - [45, 0.0]
  - - [128, 2368, 1, 3328]
    - [13, 0.0]
  - - [1024, 5888, 1, 256]
    - [50, 0.0]
  - - [64, 2944, 1, 1280]
    - [12, 0.0]
  - - [5056, 64, 1, 3328]
    - [13, 0.0]
  - - [1408, 2368, 1, 256]
    - [49, 0.0]
  - - [2944, 704, 1, 3328]
    - [49, 0.0]
  - - [256, 64, 1, 256]
    - [14, 0.0]
  - - [1024, 8, 1, 500000]
    - [21, 0.0]
  - - [2944, 2944, 1, 1280]
    - [45, 0.0]
  - - [6784, 256, 1, 3328]
    - [49, 0.0]
  - - [1408, 5056, 1, 256]
    - [45, 0.0]
  - - [512, 50176, 1, 128]
    - [7, 0.0]
  - - [5056, 128, 1, 3328]
    - [35, 0.0]
  - - [128, 128, 1, 1280]
    - [19, 0.0]
  - - [448, 704, 1, 256]
    - [44, 0.0]
  - - [1856, 256, 1, 3328]
    - [24, 0.0]
  - - [2944, 128, 1, 3328]
    - [13, 0.0]
  - - [704, 256, 1, 256]
    - [24, 0.0]
  - - [256, 448, 1, 1280]
    - [16, 0.0]
  - - [704, 256, 1, 1280]
    - [30, 0.0]
  - - [64, 2368, 1, 3328]
    - [33, 0.0]
  - - [256, 704, 1, 3328]
    - [30, 0.0]
  - - [1024, 1024, 1, 256]
    - [47, 0.0]
  - - [4096, 64, 1, 4096]
    - [40, 0.0]
  - - [1408, 4288, 1, 256]
    - [50, 0.0]
  - - [5888, 2368, 1, 1280]
    - [45, 0.0]
  - - [128, 256, 1, 256]
    - [41, 0.0]
  - - [256, 64, 1, 1280]
    - [22, 0.0]
  - - [2368, 5888, 1, 1280]
    - [50, 0.0]
  - - [5888, 256, 1, 1280]
    - [25, 0.0]
  - - [1760, 128, 1, 1760]
    - [10, 0.0]
  - - [704, 1024, 1, 1280]
    - [47, 0.0]
  - - [2368, 1856, 1, 3328]
    - [45, 0.0]
  - - [2944, 704, 1, 256]
    - [45, 0.0]
  - - [2368, 6784, 1, 1280]
    - [50, 0.0]
  - - [2368, 1024, 1, 3328]
    - [45, 0.0]
  - - [1856, 4288, 1, 1280]
    - [50, 0.0]
  - - [704, 3584, 1, 256]
    - [48, 0.0]
  - - [704, 2944, 1, 3328]
    - [32, 0.0]
  - - [1856, 5056, 1, 3328]
    - [45, 0.0]
  - - [196, 256, 64, 1024]
    - [64, 0.0]
  - - [3584, 5056, 1, 1280]
    - [45, 0.0]
  - - [2944, 1024, 1, 3328]
    - [45, 0.0]
  - - [256, 4288, 1, 256]
    - [47, 0.0]
  - - [2368, 256, 1, 256]
    - [24, 0.0]
  - - [1408, 6784, 1, 256]
    - [45, 0.0]
  - - [6784, 1408, 1, 3328]
    - [45, 0.0]
  - - [1024, 2368, 1, 1280]
    - [45, 0.0]
  - - [704, 64, 1, 256]
    - [20, 0.0]
  - - [3072, 4, 1, 1024]
    - [19, 0.0]
  - - [256, 2368, 1, 3328]
    - [47, 0.0]
  - - [6784, 2944, 1, 1280]
    - [45, 0.0]
  - - [3584, 448, 1, 1280]
    - [49, 0.0]
  - - [2944, 6784, 1, 3328]
    - [45, 0.0]
  - - [448, 5056, 1, 1280]
    - [45, 0.0]
  - - [4288, 5056, 1, 1280]
    - [45, 0.0]
  - - [128, 448, 1, 1280]
    - [17, 0.0]
  - - [4288, 704, 1, 256]
    - [45, 0.0]
  - - [64, 64, 1, 1280]
    - [21, 0.0]
  - - [5888, 704, 1, 256]
    - [45, 0.0]
  - - [256, 5888, 1, 3328]
    - [49, 0.0]
  - - [6784, 4288, 1, 256]
    - [45, 0.0]
  - - [5888, 256, 1, 256]
    - [25, 0.0]
  - - [1024, 4, 1, 500000]
    - [21, 0.0]
  - - [6784, 1024, 1, 1280]
    - [50, 0.0]
  - - [704, 448, 1, 1280]
    - [30, 0.0]
  - - [512, 16, 1, 500000]
    - [21, 0.0]
  - - [128, 64, 1, 3328]
    - [21, 0.0]
  - - [448, 64, 1, 256]
    - [14, 0.0]
  - - [2944, 704, 1, 1280]
    - [49, 0.0]
  - - [6784, 3584, 1, 1280]
    - [45, 0.0]
  - - [2944, 64, 1, 1280]
    - [12, 0.0]
  - - [1408, 2944, 1, 1280]
    - [50, 0.0]
  - - [256, 1856, 1, 256]
    - [47, 0.0]
  - - [1408, 2368, 1, 3328]
    - [45, 0.0]
  - - [128, 1408, 1, 3328]
    - [12, 0.0]
  - - [2368, 2944, 1, 256]
    - [45, 0.0]
  - - [64, 5056, 1, 256]
    - [3, 0.0]
  - - [1408, 256, 1, 3328]
    - [24, 0.0]
  - - [1024, 16, 1, 512]
    - [41, 0.0]
  - - [7680, 2, 1, 2560]
    - [17, 0.0]
  - - [3584, 1856, 1, 256]
    - [45, 0.0]
  - - [4288, 3584, 1, 1280]
    - [50, 0.0]
  - - [2368, 448, 1, 256]
    - [47, 0.0]
  - - [4288, 256, 1, 3328]
    - [47, 0.0]
  - - [1408, 64, 1, 256]
    - [11, 0.0]
  - - [512, 16, 1, 512]
    - [18, 0.0]
  - - [4288, 2944, 1, 1280]
    - [45, 0.0]
  - - [5056, 448, 1, 3328]
    - [45, 0.0]
  - - [1024, 64, 1, 256]
    - [42, 0.0]
  - - [64, 2368, 1, 256]
    - [33, 0.0]
  - - [5124, 1500, 1, 2048]
    - [53, 0.0]
  - - [4288, 5056, 1, 3328]
    - [45, 0.0]
  - - [512, 2, 1, 500000]
    - [21, 0.0]
  - - [2944, 256, 1, 256]
    - [44, 0.0]
  - - [1024, 128, 1, 3328]
    - [41, 0.0]
  - - [256, 5056, 1, 3328]
    - [47, 0.0]
  - - [5056, 2368, 1, 256]
    - [45, 0.0]
  - - [4288, 704, 1, 3328]
    - [45, 0.0]
  - - [448, 3584, 1, 256]
    - [45, 0.0]
  - - [2368, 64, 1, 1280]
    - [11, 0.0]
  - - [6144, 1500, 1, 2560]
    - [50, 0.0]
  - - [4224, 1, 1, 128]
    - [1, 0.0]
  - - [1024, 1408, 1, 3328]
    - [49, 0.0]
  - - [2944, 5888, 1, 1280]
    - [50, 0.0]
  - - [8448, 2, 1, 2816]
    - [19, 0.0]
  - - [5888, 3584, 1, 256]
    - [45, 0.0]
  - - [1408, 1856, 1, 3328]
    - [45, 0.0]
  - - [7680, 6000, 1, 2560]
    - [45, 0.0]
  - - [6784, 1408, 1, 1280]
    - [45, 0.0]
  - - [512, 3000, 1, 2560]
    - [49, 0.0]
  - - [704, 2944, 1, 256]
    - [48, 0.0]
  - - [4288, 64, 1, 256]
    - [3, 0.0]
  - - [2944, 5888, 1, 3328]
    - [50, 0.0]
  - - [64, 4288, 1, 1280]
    - [12, 0.0]
  - - [6784, 64, 1, 1280]
    - [4, 0.0]
  - - [704, 1856, 1, 1280]
    - [47, 0.0]
  - - [1024, 1500, 1, 1536]
    - [49, 0.0]
  - - [1408, 64, 1, 3328]
    - [38, 0.0]
  - - [1408, 1408, 1, 1280]
    - [45, 0.0]
  - - [448, 1024, 1, 3328]
    - [40, 0.0]
  - - [3072, 3000, 1, 1024]
    - [49, 0.0]
  - - [448, 4288, 1, 3328]
    - [32, 0.0]
  - - [704, 2368, 1, 256]
    - [45, 0.0]
  - - [2944, 448, 1, 1280]
    - [45, 0.0]
  - - [5888, 2368, 1, 3328]
    - [45, 0.0]
  - - [5124, 9124, 1, 1760]
    - [45, 0.0]
  - - [4288, 5056, 1, 256]
    - [45, 0.0]
  - - [4288, 448, 1, 1280]
    - [45, 0.0]
  - - [5888, 704, 1, 3328]
    - [45, 0.0]
  - - [4288, 3584, 1, 3328]
    - [50, 0.0]
  - - [2944, 64, 1, 256]
    - [16, 0.0]
  - - [1024, 6784, 1, 3328]
    - [50, 0.0]
  - - [512, 3136, 1, 2048]
    - [57, 0.0]
  - - [1408, 1024, 1, 256]
    - [45, 0.0]
  - - [8448, 1500, 1, 2816]
    - [45, 0.0]
  - - [2560, 7000, 1, 2560]
    - [50, 0.0]
  - - [448, 1024, 1, 256]
    - [47, 0.0]
  - - [6784, 6784, 1, 3328]
    - [50, 0.0]
  - - [1024, 448, 1, 1280]
    - [47, 0.0]
  - - [704, 5056, 1, 3328]
    - [48, 0.0]
  - - [256, 2368, 1, 1280]
    - [47, 0.0]
  - - [3584, 5056, 1, 3328]
    - [45, 0.0]
  - - [2368, 2944, 1, 3328]
    - [50, 0.0]
  - - [448, 448, 1, 1280]
    - [37, 0.0]
  - - [2368, 3584, 1, 256]
    - [45, 0.0]
  - - [4608, 3000, 1, 1536]
    - [50, 0.0]
  - - [1024, 256, 1, 1280]
    - [40, 0.0]
  - - [128, 5056, 1, 1280]
    - [35, 0.0]
  - - [5124, 9124, 1, 4096]
    - [50, 0.0]
  - - [7680, 48000, 1, 2560]
    - [53, 0.0]
  - - [4608, 1500, 1, 1536]
    - [50, 0.0]
  - - [3584, 2368, 1, 1280]
    - [45, 0.0]
  - - [5124, 9124, 1, 2560]
    - [50, 0.0]
  - - [1856, 1856, 1, 256]
    - [45, 0.0]
  - - [4288, 1408, 1, 3328]
    - [50, 0.0]
  - - [3584, 64, 1, 3328]
    - [39, 0.0]
  - - [5124, 9124, 1, 2048]
    - [50, 0.0]
  - - [128, 1, 1, 1024]
    - [8, 0.0]
  - - [5124, 700, 1, 2048]
    - [54, 0.0]
  - - [256, 1024, 1, 3328]
    - [40, 0.0]
  - - [1856, 64, 1, 3328]
    - [20, 0.0]
  - - [256, 12544, 1, 1024]
    - [60, 0.0]
  - - [5888, 1408, 1, 3328]
    - [50, 0.0]
  - - [256, 5056, 1, 256]
    - [47, 0.0]
  - - [1856, 64, 1, 1280]
    - [16, 0.0]
  - - [1408, 256, 1, 256]
    - [24, 0.0]
  - - [2368, 5056, 1, 256]
    - [45, 0.0]
  - - [128, 5888, 1, 3328]
    - [6, 0.0]
  - - [1024, 6000, 1, 2560]
    - [50, 0.0]
  - - [1024, 5056, 1, 256]
    - [50, 0.0]
  - - [4224, 1500, 1, 176]
    - [45, 0.0]
  - - [2368, 1408, 1, 3328]
    - [45, 0.0]
  - - [1024, 48000, 1, 1536]
    - [50, 0.0]
  - - [5888, 448, 1, 256]
    - [49, 0.0]
  - - [6784, 5056, 1, 1280]
    - [45, 0.0]
  - - [1024, 48000, 1, 2560]
    - [50, 0.0]
  - - [4608, 32, 1, 1536]
    - [11, 0.0]
  - - [4288, 6784, 1, 1280]
    - [50, 0.0]
  - - [2368, 448, 1, 3328]
    - [47, 0.0]
  - - [1024, 128, 1, 256]
    - [16, 0.0]
  - - [448, 128, 1, 1280]
    - [17, 0.0]
  - - [1024, 64, 1, 3328]
    - [42, 0.0]
  - - [3072, 48000, 1, 1024]
    - [50, 0.0]
  - - [64, 3584, 1, 1280]
    - [10, 0.0]
  - - [6784, 1408, 1, 256]
    - [45, 0.0]
  - - [5888, 4288, 1, 256]
    - [45, 0.0]
  - - [5056, 5888, 1, 256]
    - [50, 0.0]
  - - [2368, 1024, 1, 256]
    - [45, 0.0]
  - - [1856, 6784, 1, 1280]
    - [45, 0.0]
  - - [3584, 128, 1, 1280]
    - [6, 0.0]
  - - [128, 64, 1, 256]
    - [19, 0.0]
  - - [1408, 448, 1, 256]
    - [47, 0.0]
  - - [64, 256, 1, 3328]
    - [38, 0.0]
  - - [8448, 3000, 1, 2816]
    - [45, 0.0]
  - - [6784, 448, 1, 3328]
    - [45, 0.0]
  - - [5056, 1856, 1, 1280]
    - [46, 0.0]
  - - [1408, 1024, 1, 3328]
    - [49, 0.0]
  - - [2368, 256, 1, 3328]
    - [24, 0.0]
  - - [7680, 1500, 1, 2560]
    - [49, 0.0]
  - - [5888, 3584, 1, 1280]
    - [45, 0.0]
  - - [5888, 128, 1, 1280]
    - [6, 0.0]
  - - [1024, 2944, 1, 256]
    - [45, 0.0]
  - - [448, 6784, 1, 1280]
    - [48, 0.0]
  - - [256, 3584, 1, 1280]
    - [49, 0.0]
  - - [704, 5056, 1, 256]
    - [48, 0.0]
  - - [3584, 1024, 1, 3328]
    - [45, 0.0]
  - - [2944, 1856, 1, 1280]
    - [45, 0.0]
  - - [5056, 256, 1, 256]
    - [47, 0.0]
  - - [128, 5888, 1, 256]
    - [6, 0.0]
  - - [2368, 3584, 1, 3328]
    - [45, 0.0]
  - - [3584, 5888, 1, 3328]
    - [45, 0.0]
  - - [2944, 3584, 1, 1280]
    - [45, 0.0]
  - - [1856, 5888, 1, 1280]
    - [50, 0.0]
  - - [256, 256, 1, 1280]
    - [42, 0.0]
  - - [4608, 24000, 1, 1536]
    - [50, 0.0]
  - - [4288, 1408, 1, 256]
    - [45, 0.0]
  - - [3584, 64, 1, 256]
    - [12, 0.0]
  - - [64, 1856, 1, 3328]
    - [20, 0.0]
  - - [1408, 128, 1, 256]
    - [16, 0.0]
  - - [4288, 2368, 1, 1280]
    - [45, 0.0]
  - - [2944, 5056, 1, 256]
    - [45, 0.0]
  - - [256, 128, 1, 3328]
    - [42, 0.0]
  - - [512, 8, 1, 500000]
    - [21, 0.0]
  - - [6784, 2368, 1, 256]
    - [45, 0.0]
  - - [1024, 1024, 1, 1024]
    - [52, 0.0]
  - - [1408, 448, 1, 3328]
    - [47, 0.0]
  - - [1024, 24000, 1, 2816]
    - [50, 0.0]
  - - [4288, 1856, 1, 256]
    - [45, 0.0]
  - - [1856, 2944, 1, 256]
    - [45, 0.0]
  - - [4608, 6000, 1, 1536]
    - [50, 0.0]
  - - [64, 5888, 1, 1280]
    - [13, 0.0]
  - - [7680, 3000, 1, 2560]
    - [50, 0.0]
  - - [5124, 700, 1, 2560]
    - [50, 0.0]
  - - [1856, 1408, 1, 1280]
    - [48, 0.0]
  - - [128, 704, 1, 256]
    - [11, 0.0]
  - - [1024, 4288, 1, 1280]
    - [49, 0.0]
  - - [2368, 5056, 1, 3328]
    - [50, 0.0]
  - - [4288, 1024, 1, 3328]
    - [45, 0.0]
  - - [6144, 48000, 1, 2560]
    - [50, 0.0]
  - - [1024, 5056, 1, 3328]
    - [50, 0.0]
  - - [1024, 1856, 1, 3328]
    - [49, 0.0]
  - - [704, 704, 1, 1280]
    - [47, 0.0]
  - - [128, 2368, 1, 1280]
    - [12, 0.0]
  - - [3584, 256, 1, 1280]
    - [49, 0.0]
  - - [5888, 64, 1, 1280]
    - [13, 0.0]
  - - [5124, 1500, 1, 2560]
    - [50, 0.0]
  - - [128, 704, 1, 3328]
    - [17, 0.0]
  - - [3584, 2944, 1, 3328]
    - [45, 0.0]
  - - [128, 1856, 1, 256]
    - [12, 0.0]
  - - [64, 4288, 1, 256]
    - [3, 0.0]
  - - [5888, 2944, 1, 256]
    - [50, 0.0]
  - - [5056, 128, 1, 1280]
    - [13, 0.0]
  - - [448, 1856, 1, 3328]
    - [49, 0.0]
  - - [5056, 4288, 1, 256]
    - [45, 0.0]
  - - [1024, 448, 1, 256]
    - [44, 0.0]
  - - [1024, 3584, 1, 256]
    - [49, 0.0]
  - - [2944, 128, 1, 1280]
    - [35, 0.0]
  - - [2560, 32, 1, 2560]
    - [33, 0.0]
  - - [64, 256, 1, 256]
    - [41, 0.0]
  - - [1024, 4, 1, 512]
    - [43, 0.0]
  - - [704, 256, 1, 3328]
    - [30, 0.0]
  - - [5056, 1408, 1, 256]
    - [45, 0.0]
  - - [5888, 5888, 1, 1280]
    - [50, 0.0]
  - - [176, 1500, 1, 1408]
    - [12, 0.0]
  - - [448, 5888, 1, 1280]
    - [45, 0.0]
  - - [1024, 3000, 1, 2560]
    - [50, 0.0]
  - - [4288, 704, 1, 1280]
    - [45, 0.0]
  - - [2944, 1408, 1, 256]
    - [50, 0.0]
  - - [4608, 2, 1, 1536]
    - [17, 0.0]
  - - [256, 2944, 1, 1280]
    - [47, 0.0]
  - - [2560, 128, 1, 2560]
    - [35, 0.0]
  - - [2368, 5888, 1, 3328]
    - [50, 0.0]
  - - [704, 1024, 1, 3328]
    - [47, 0.0]
  - - [2368, 1856, 1, 1280]
    - [45, 0.0]
  - - [1856, 448, 1, 1280]
    - [49, 0.0]
  - - [128, 6784, 1, 256]
    - [6, 0.0]
  - - [512, 4, 1, 500000]
    - [21, 0.0]
  - - [1024, 6000, 1, 2816]
    - [50, 0.0]
  - - [5888, 4288, 1, 3328]
    - [45, 0.0]
  - - [1856, 128, 1, 256]
    - [12, 0.0]
  - - [5056, 448, 1, 256]
    - [45, 0.0]
  - - [1856, 5056, 1, 1280]
    - [46, 0.0]
  - - [2944, 1024, 1, 1280]
    - [45, 0.0]
  - - [2368, 4288, 1, 256]
    - [45, 0.0]
  - - [1024, 2368, 1, 3328]
    - [45, 0.0]
  - - [4288, 64, 1, 3328]
    - [13, 0.0]
  - - [704, 1408, 1, 256]
    - [47, 0.0]
  - - [4096, 128, 1, 4096]
    - [31, 0.0]
  - - [4288, 5888, 1, 3328]
    - [45, 0.0]
  - - [4608, 16, 1, 1536]
    - [38, 0.0]
  - - [448, 2944, 1, 1280]
    - [45, 0.0]
  - - [1024, 2944, 1, 3328]
    - [50, 0.0]
  - - [2048, 64, 1, 2048]
    - [41, 0.0]
  - - [6144, 2, 1, 2560]
    - [17, 0.0]
  - - [256, 6784, 1, 1280]
    - [49, 0.0]
  - - [1856, 3584, 1, 256]
    - [45, 0.0]
  - - [128, 448, 1, 3328]
    - [17, 0.0]
  - - [1856, 256, 1, 256]
    - [24, 0.0]
  - - [1024, 1500, 1, 2048]
    - [51, 0.0]
  - - [5056, 128, 1, 256]
    - [6, 0.0]
  - - [512, 24000, 1, 2816]
    - [50, 0.0]
  - - [256, 5888, 1, 1280]
    - [49, 0.0]
  - - [6784, 128, 1, 1280]
    - [49, 0.0]
  - - [64, 1408, 1, 256]
    - [33, 0.0]
  - - [2944, 2368, 1, 256]
    - [45, 0.0]
  - - [1856, 448, 1, 256]
    - [45, 0.0]
  - - [1024, 1856, 1, 256]
    - [49, 0.0]
  - - [6784, 3584, 1, 3328]
    - [45, 0.0]
  - - [1760, 7000, 1, 1760]
    - [45, 0.0]
  - - [2944, 64, 1, 3328]
    - [12, 0.0]
  - - [1024, 5888, 1, 3328]
    - [50, 0.0]
  - - [1408, 2368, 1, 1280]
    - [45, 0.0]
  - - [128, 1408, 1, 1280]
    - [12, 0.0]
  - - [1024, 1, 1, 512]
    - [9, 0.0]
  - - [128, 1856, 1, 3328]
    - [39, 0.0]
  - - [2944, 2944, 1, 256]
    - [45, 0.0]
  - - [6784, 256, 1, 256]
    - [25, 0.0]
  - - [128, 4288, 1, 1280]
    - [15, 0.0]
  - - [1024, 3000, 1, 1536]
    - [50, 0.0]
  - - [5888, 1408, 1, 256]
    - [45, 0.0]
  - - [128, 128, 1, 256]
    - [18, 0.0]
  - - [1760, 64, 1, 1760]
    - [16, 0.0]
  - - [448, 704, 1, 3328]
    - [40, 0.0]
  - - [448, 1856, 1, 256]
    - [45, 0.0]
  - - [1856, 704, 1, 3328]
    - [47, 0.0]
  - - [512, 1500, 1, 2560]
    - [47, 0.0]
  - - [5888, 6784, 1, 3328]
    - [45, 0.0]
  - - [704, 4288, 1, 1280]
    - [48, 0.0]
  - - [128, 50176, 1, 512]
    - [56, 0.0]
  - - [1024, 48000, 1, 2048]
    - [53, 0.0]
  - - [3136, 64, 128, 64]
    - [67, 0.0]
  - - [784, 512, 64, 128]
    - [66, 0.0]
  - - [3136, 256, 64, 64]
    - [71, 0.0]
  - - [12544, 1024, 1, 256]
    - [67, 0.0]
  - - [784, 128, 128, 512]
    - [65, 0.0]
  - - [784, 512, 256, 128]
    - [66, 0.0]
  - - [3136, 64, 64, 256]
    - [67, 0.0]
  - - [3136, 512, 1, 2048]
    - [70, 0.0]
  - - [12544, 256, 1, 1024]
    - [69, 0.0]
  - - [3136, 2048, 1, 512]
    - [68, 0.0]
  - - [3136, 256, 256, 64]
    - [71, 0.0]
  - - [3136, 64, 128, 256]
    - [67, 0.0]
  - - [784, 128, 64, 512]
    - [65, 0.0]
  - - [3136, 64, 256, 64]
    - [67, 0.0]
  - - [784, 512, 128, 128]
    - [66, 0.0]
  - - [3136, 64, 64, 64]
    - [67, 0.0]
  - - [784, 128, 256, 512]
    - [65, 0.0]
  - - [3136, 64, 256, 256]
    - [67, 0.0]
  - - [3136, 256, 128, 64]
    - [71, 0.0]
- null
