library/src/blas3/Tensile/Logic/asm_full/arcturus_Cijk_Ailk_Bjlk_HBH.yaml
- {MinimumRequiredVersion: 4.6.0}
- arcturus
- gfx908
- [Device 7380, Device 7388, Device 738c, Device 7390]
    SolutionIndex: 0
    SolutionNameMin: Cijk_Ailk_Bjlk_HBH_MT016x016x08_PGR1_PLR1_TT02_02
    SolutionIndex: 1
    SolutionNameMin: Cijk_Ailk_Bjlk_HBH_MT016x016x16_PGR1_PLR1_TT02_02
    SolutionIndex: 2
    SolutionNameMin: Cijk_Ailk_Bjlk_HBH_MT032x016x16_PGR1_PLR1_TT04_02
    SolutionIndex: 3
    SolutionNameMin: Cijk_Ailk_Bjlk_HBH_MT016x016x24_PGR1_PLR1_TT02_02
    SolutionIndex: 4
    SolutionNameMin: Cijk_Ailk_Bjlk_HBH_MT032x016x24_PGR1_PLR1_TT04_02
    SolutionIndex: 5
    SolutionNameMin: Cijk_Ailk_Bjlk_HBH_MT016x016x32_PGR1_PLR1_TT02_02
    SolutionIndex: 6
    SolutionNameMin: Cijk_Ailk_Bjlk_HBH_MT032x016x32_PGR1_PLR1_TT02_02
    SolutionIndex: 7
    SolutionNameMin: Cijk_Ailk_Bjlk_HBH_MT064x016x32_PGR1_PLR1_TT02_02
    SolutionIndex: 8
    SolutionNameMin: Cijk_Ailk_Bjlk_HBH_MT016x016x32_PGR1_PLR1_TT02_02
    SolutionIndex: 9
    SolutionNameMin: Cijk_Ailk_Bjlk_HBH_MT064x016x32_PGR1_PLR1_TT02_02
    SolutionIndex: 10
    SolutionNameMin: Cijk_Ailk_Bjlk_HBH_MT016x016x64_PGR1_PLR1_TT02_02
    SolutionIndex: 11
    SolutionNameMin: Cijk_Ailk_Bjlk_HBH_MT032x016x64_PGR1_PLR1_TT02_02
    SolutionIndex: 12
    SolutionNameMin: Cijk_Ailk_Bjlk_HBH_MT064x016x64_PGR1_PLR1_TT02_02
    SolutionIndex: 13
    SolutionNameMin: Cijk_Ailk_Bjlk_HBH_MT016x016x64_PGR1_PLR1_TT02_02
    SolutionIndex: 14
    SolutionNameMin: Cijk_Ailk_Bjlk_HBH_MT032x016x64_PGR1_PLR1_TT02_02
    SolutionIndex: 15
    SolutionNameMin: Cijk_Ailk_Bjlk_HBH_MT032x032x08_PGR1_PLR1_TT02_02
    SolutionIndex: 16
    SolutionNameMin: Cijk_Ailk_Bjlk_HBH_MT032x032x16_PGR1_PLR1_TT02_02
    SolutionIndex: 17
    SolutionNameMin: Cijk_Ailk_Bjlk_HBH_MT032x032x32_PGR1_PLR1_TT02_02
    SolutionIndex: 18
    SolutionNameMin: Cijk_Ailk_Bjlk_HBH_MT032x032x64_PGR1_PLR1_TT02_02
    SolutionIndex: 19
    SolutionNameMin: Cijk_Ailk_Bjlk_HBH_MT064x064x04_PGR0_PLR1_TT04_04
    SolutionIndex: 20
    SolutionNameMin: Cijk_Ailk_Bjlk_HBH_MT064x064x04_PGR1_PLR1_TT04_04
    SolutionIndex: 21
    SolutionNameMin: Cijk_Ailk_Bjlk_HBH_MT064x064x08_PGR0_PLR1_TT04_04
    SolutionIndex: 22
    SolutionNameMin: Cijk_Ailk_Bjlk_HBH_MT064x064x16_PGR1_PLR1_TT04_04
    SolutionIndex: 23
    SolutionNameMin: Cijk_Ailk_Bjlk_HBH_MT064x032x16_PGR1_PLR1_TT04_04
    SolutionIndex: 24
    SolutionNameMin: Cijk_Ailk_Bjlk_HBH_MT064x032x32_PGR1_PLR1_TT04_04
    SolutionIndex: 25
    SolutionNameMin: Cijk_Ailk_Bjlk_HBH_MT128x032x32_PGR1_PLR1_TT04_04
    SolutionIndex: 26
    SolutionNameMin: Cijk_Ailk_Bjlk_HBH_MT128x016x32_PGR1_PLR1_TT04_04
    SolutionIndex: 27
    SolutionNameMin: Cijk_Ailk_Bjlk_HBH_MT128x016x32_PGR1_PLR1_TT04_04
    SolutionIndex: 28
    SolutionNameMin: Cijk_Ailk_Bjlk_HBH_MT064x064x08_PGR1_PLR1_TT08_08
    SolutionIndex: 29
    SolutionNameMin: Cijk_Ailk_Bjlk_HBH_MT064x064x16_PGR1_PLR1_TT08_08
    SolutionIndex: 30
    SolutionNameMin: Cijk_Ailk_Bjlk_HBH_MT064x128x16_PGR1_PLR1_TT04_08
    SolutionIndex: 31
    SolutionNameMin: Cijk_Ailk_Bjlk_HBH_MT128x128x16_PGR1_PLR1_TT08_08
    SolutionIndex: 32
    SolutionNameMin: Cijk_Ailk_Bjlk_HBH_MT128x128x32_PGR1_PLR1_TT08_08
    SolutionIndex: 33
    SolutionNameMin: Cijk_Ailk_Bjlk_HBH_MT064x128x04_PGR0_PLR0_TT04_08
    SolutionIndex: 34
    SolutionNameMin: Cijk_Ailk_Bjlk_HBH_MT064x064x08_PGR0_PLR0_TT04_04
    SolutionIndex: 35
    SolutionNameMin: Cijk_Ailk_Bjlk_HBH_MT064x064x08_PGR0_PLR1_TT04_04
    SolutionIndex: 36
    SolutionNameMin: Cijk_Ailk_Bjlk_HBH_MT064x064x16_PGR0_PLR0_TT04_04
    SolutionIndex: 37
    SolutionNameMin: Cijk_Ailk_Bjlk_HBH_MT064x128x16_PGR1_PLR1_TT04_08
    SolutionIndex: 38
    SolutionNameMin: Cijk_Ailk_Bjlk_HBH_MT064x064x04_PGR0_PLR0_TT04_04
    SolutionIndex: 39
    SolutionNameMin: Cijk_Ailk_Bjlk_HBH_MT128x128x04_PGR0_PLR1_TT08_08
    SolutionIndex: 40
    SolutionNameMin: Cijk_Ailk_Bjlk_HBH_MT064x128x04_PGR1_PLR1_TT04_08
    SolutionIndex: 41
    SolutionNameMin: Cijk_Ailk_Bjlk_HBH_MT064x064x08_PGR1_PLR0_TT04_04
    SolutionIndex: 42
    SolutionNameMin: Cijk_Ailk_Bjlk_HBH_MT064x128x08_PGR1_PLR1_TT04_08
    SolutionIndex: 43
    SolutionNameMin: Cijk_Ailk_Bjlk_HBH_MT064x128x16_PGR0_PLR1_TT04_08
    SolutionIndex: 44
    SolutionNameMin: Cijk_Ailk_Bjlk_HBH_MT064x128x16_EPS1_GRVW04_PGR1_PLR1_SNLL1_TT08_04_VW04_WG08_32_01_WGM01
    SolutionIndex: 45
    SolutionNameMin: Cijk_Ailk_Bjlk_HBH_MT128x128x16_EPS1_GRVW04_PGR1_PLR1_SNLL1_TT08_08_VW04_WG16_16_01_WGM01
    SolutionIndex: 46
    SolutionNameMin: Cijk_Ailk_Bjlk_HBH_MT064x128x16_EPS1_GRVW04_PGR1_PLR1_SNLL1_TT08_04_VW04_WG08_32_01_WGM08
    SolutionIndex: 47
    SolutionNameMin: Cijk_Ailk_Bjlk_HBH_MT128x064x16_EPS1_GRVW04_PGR1_PLR1_SNLL1_TT08_04_VW04_WG16_16_01_WGM08
    SolutionIndex: 48
    SolutionNameMin: Cijk_Ailk_Bjlk_HBH_MT128x128x16_EPS1_GRVW04_PGR1_PLR1_SNLL1_TT08_08_VW04_WG16_16_01_WGM08
    SolutionIndex: 49
    SolutionNameMin: Cijk_Ailk_Bjlk_HBH_MT064x064x32_EPS0_GRVW04_PGR0_PLR0_SNLL0_TT04_04_VW04_WG16_16_01_WGM01
    SolutionIndex: 50
    SolutionNameMin: Cijk_Ailk_Bjlk_HBH_MT128x064x16_EPS1_GRVW08_PGR1_PLR1_SNLL1_TT08_08_VW08_WG16_08_01_WGM64
    SolutionIndex: 51
    SolutionNameMin: Cijk_Ailk_Bjlk_HBH_MT128x128x32_EPS1_GRVW08_PGR1_PLR1_SNLL1_TT08_08_VW08_WG16_16_01_WGM64
    SolutionIndex: 52
    SolutionNameMin: Cijk_Ailk_Bjlk_HBH_MT64x128x16_MI32x32x4x2_SE_AF0EM2_ASEM2_ONLL0_SNLL1
    SolutionIndex: 53
    SolutionNameMin: Cijk_Ailk_Bjlk_HBH_MT32x256x16_MI32x32x4x2_SE_AF0EM2_ASEM2_ONLL0_SNLL0
    SolutionIndex: 54
    SolutionNameMin: Cijk_Ailk_Bjlk_HBH_MT64x128x16_MI32x32x4x2_SE_AF0EM2_ASEM2_ONLL0_SNLL0
    SolutionIndex: 55
    SolutionNameMin: Cijk_Ailk_Bjlk_HBH_MT64x128x16_MI32x32x4x2_SE_AF0EM1_ASEM2_ONLL1_SNLL1
    SolutionIndex: 56
    SolutionNameMin: Cijk_Ailk_Bjlk_HBH_MT64x128x8_MI32x32x4x2_SE_AF0EM1_ASEM1_ONLL1_SNLL0
    SolutionIndex: 57
    SolutionNameMin: Cijk_Ailk_Bjlk_HBH_MT64x128x16_MI32x32x4x2_SE_AF0EM2_ASEM2_ONLL1_SNLL0
    SolutionIndex: 58
    SolutionNameMin: Cijk_Ailk_Bjlk_HBH_MT64x256x16_MI32x32x4x2_SE_AF0EM1_ASEM2_ONLL0_SNLL1
    SolutionIndex: 59
    SolutionNameMin: Cijk_Ailk_Bjlk_HBH_MT64x256x16_MI32x32x4x2_SE_AF0EM1_ASEM1_ONLL0_SNLL0
    SolutionIndex: 60
    SolutionIndex: 61
    SolutionIndex: 62
    SolutionIndex: 63
    SolutionIndex: 64
    SolutionIndex: 65
    SolutionIndex: 66
    SolutionIndex: 67
    SolutionIndex: 68
    SolutionIndex: 69
    SolutionIndex: 70
    SolutionIndex: 71
    SolutionIndex: 72
    SolutionIndex: 73
    SolutionIndex: 74
    SolutionIndex: 75
    SolutionIndex: 76
    SolutionIndex: 77
    SolutionIndex: 78
    SolutionIndex: 79
    SolutionIndex: 80
    SolutionIndex: 81
    SolutionIndex: 82
    SolutionIndex: 83
    SolutionIndex: 84
    SolutionIndex: 85
    SolutionIndex: 86
    SolutionIndex: 87
    SolutionIndex: 88
    SolutionIndex: 89
    SolutionIndex: 90
    SolutionIndex: 91
    SolutionIndex: 92
    SolutionIndex: 93
    SolutionIndex: 94
    SolutionIndex: 95
    SolutionIndex: 96
    SolutionIndex: 97
    SolutionIndex: 98
    SolutionIndex: 99
    SolutionIndex: 100
    SolutionIndex: 101
    SolutionIndex: 102
    SolutionIndex: 103
    SolutionIndex: 104
    SolutionIndex: 105
    SolutionIndex: 106
    SolutionIndex: 107
    SolutionIndex: 108
    SolutionIndex: 109
    SolutionIndex: 110
    SolutionIndex: 111
    SolutionIndex: 112
    SolutionIndex: 113
    SolutionIndex: 114
    SolutionIndex: 115
    SolutionIndex: 116
    SolutionIndex: 117
    SolutionIndex: 118
    SolutionIndex: 119
    SolutionIndex: 120
    SolutionIndex: 121
    SolutionIndex: 122
    SolutionIndex: 123
    SolutionIndex: 124
    SolutionIndex: 125
    SolutionIndex: 126
    SolutionIndex: 127
    SolutionIndex: 128
    SolutionIndex: 129
    SolutionIndex: 130
    SolutionIndex: 131
    SolutionIndex: 132
    SolutionIndex: 133
    SolutionIndex: 134
    SolutionIndex: 135
    SolutionIndex: 136
    SolutionIndex: 137
    SolutionIndex: 138
    SolutionIndex: 139
    SolutionIndex: 140
    SolutionIndex: 141
    SolutionIndex: 142
    SolutionIndex: 143
    SolutionIndex: 144
    SolutionIndex: 145
    SolutionIndex: 146
    SolutionIndex: 147
    SolutionIndex: 148
    SolutionIndex: 149
    SolutionIndex: 150
    SolutionIndex: 151
    SolutionIndex: 152
    SolutionIndex: 153
    SolutionIndex: 154
    SolutionIndex: 155
    SolutionIndex: 156
    SolutionIndex: 157
    SolutionIndex: 158
    SolutionIndex: 159
    SolutionIndex: 160
    SolutionIndex: 161
    SolutionIndex: 162
    SolutionIndex: 163
    SolutionIndex: 164
    SolutionIndex: 165
    SolutionIndex: 166
    SolutionIndex: 167
    SolutionIndex: 168
    SolutionIndex: 169
    SolutionIndex: 170
    SolutionIndex: 171
    SolutionIndex: 172
    SolutionIndex: 173
    SolutionIndex: 174
    SolutionIndex: 175
    SolutionIndex: 176
    SolutionIndex: 177
    SolutionIndex: 178
    SolutionIndex: 179
    SolutionIndex: 180
    SolutionIndex: 181
    SolutionIndex: 182
    SolutionIndex: 183
    SolutionIndex: 184
    SolutionIndex: 185
    SolutionIndex: 186
    SolutionIndex: 187
    SolutionIndex: 188
    SolutionIndex: 189
    SolutionIndex: 190
    SolutionIndex: 191
    SolutionIndex: 192
    SolutionIndex: 193
    SolutionIndex: 194
    SolutionIndex: 195
    SolutionIndex: 196
    SolutionIndex: 197
    SolutionIndex: 198
    SolutionIndex: 199
    SolutionIndex: 200
    SolutionIndex: 201
    SolutionIndex: 202
    SolutionIndex: 203
    SolutionIndex: 204
    SolutionIndex: 205
    SolutionIndex: 206
    SolutionIndex: 207
    SolutionIndex: 208
    SolutionIndex: 209
    SolutionIndex: 210
    SolutionIndex: 211
    SolutionIndex: 212
    SolutionIndex: 213
    SolutionIndex: 214
    SolutionIndex: 215
    SolutionIndex: 216
    SolutionIndex: 217
    SolutionIndex: 218
    SolutionIndex: 219
    SolutionIndex: 220
    SolutionIndex: 221
    SolutionIndex: 222
    SolutionIndex: 223
    SolutionIndex: 224
    SolutionIndex: 225
    SolutionIndex: 226
    SolutionIndex: 227
    SolutionIndex: 228
    SolutionIndex: 229
    SolutionIndex: 230
    SolutionIndex: 231
    SolutionIndex: 232
    SolutionNameMin: Cijk_Ailk_Bjlk_HBH_MT256x256x32_MI32x32x8x1_SE_AF0EM4_GRVW8_NLCA1_NLCB1_SU0_SUS256_SRVW4_TT4_128_WG64_4_1_WGM15
    SolutionIndex: 233
    SolutionNameMin: Cijk_Ailk_Bjlk_HBH_MT64x128x16_MI32x32x4x2_SE_AF0EM4_GRVW2_NLCA1_NLCB1_SU16_SUS256_SRVW4_TT1_32_WG64_4_1_WGM2
    SolutionIndex: 234
    SolutionNameMin: Cijk_Ailk_Bjlk_HBH_MT128x288x32_MI32x32x8x1_SE_AF0EM1_GRVW4_NLCA1_NLCB9_SU32_SUS128_SRVW4_TT1_288_WG128_2_1_WGM15
    SolutionIndex: 235
    SolutionNameMin: Cijk_Ailk_Bjlk_HBH_MT32x64x16_MI16x16x16x1_SE_AF0EM4_GRVW4_NLCA1_NLCB1_SU0_SUS256_SRVW4_TT1_32_WG32_8_1_WGM1
    SolutionIndex: 236
    SolutionNameMin: Cijk_Ailk_Bjlk_HBH_MT128x96x64_MI32x32x8x1_SE_AF0EM4_GRVW4_NLCA1_NLCB3_SU0_SUS256_SRVW4_TT1_96_WG128_2_1_WGM15
    SolutionIndex: 237
    SolutionNameMin: Cijk_Ailk_Bjlk_HBH_MT128x288x32_MI32x32x8x1_SE_AF0EM4_GRVW2_NLCA1_NLCB9_SU32_SUS128_SRVW4_TT1_288_WG128_2_1_WGM15
    SolutionIndex: 238
    SolutionNameMin: Cijk_Ailk_Bjlk_HBH_MT64x64x128_MI32x32x8x1_SE_AF0EM4_GRVW4_NLCA1_NLCB1_SU16_SUS256_SRVW4_TT1_32_WG64_4_1_WGM2
    SolutionIndex: 239
    SolutionNameMin: Cijk_Ailk_Bjlk_HBH_MT128x128x16_MI32x32x8x1_SE_AF0EM1_GRVW8_NLCA1_NLCB1_SU32_SUS128_SRVW4_TT2_64_WG64_4_1_WGM15
    SolutionIndex: 240
    SolutionNameMin: Cijk_Ailk_Bjlk_HBH_MT64x64x128_MI32x32x8x1_SE_AF0EM4_GRVW8_NLCA1_NLCB1_SU16_SUS256_SRVW4_TT1_32_WG64_4_1_WGM2
    SolutionIndex: 241
    SolutionNameMin: Cijk_Ailk_Bjlk_HBH_MT32x32x16_MI16x16x16x1_SE_AF0EM4_GRVW2_NLCA1_NLCB1_SU0_SUS256_SRVW0_TT1_16_WG32_8_1_WGM2
    SolutionIndex: 242
    SolutionNameMin: Cijk_Ailk_Bjlk_HBH_MT64x64x32_MI32x32x8x1_SE_AF0EM4_GRVW8_NLCA1_NLCB1_SU0_SUS256_SRVW4_TT1_32_WG64_4_1_WGM2
    SolutionIndex: 243
    SolutionNameMin: Cijk_Ailk_Bjlk_HBH_MT32x32x64_MI16x16x16x1_SE_AF0EM1_GRVW8_NLCA1_NLCB1_SU0_SUS256_SRVW0_TT1_16_WG32_8_1_WGM2
    SolutionIndex: 244
    SolutionNameMin: Cijk_Ailk_Bjlk_HBH_MT64x128x64_MI32x32x8x1_SE_AF0EM1_GRVW8_NLCA1_NLCB1_SU32_SUS128_SRVW4_TT1_64_WG64_4_1_WGM1
    SolutionIndex: 245
    SolutionNameMin: Cijk_Ailk_Bjlk_HBH_MT32x32x16_MI16x16x16x1_SE_AF0EM1_GRVW2_NLCA1_NLCB1_SU0_SUS256_SRVW0_TT1_16_WG32_8_1_WGM1
    SolutionIndex: 246
    SolutionNameMin: Cijk_Ailk_Bjlk_HBH_MT64x32x16_MI16x16x16x1_SE_AF0EM4_GRVW2_NLCA1_NLCB1_SU16_SUS128_SRVW0_TT2_16_WG32_8_1_WGM1
    SolutionIndex: 247
    SolutionNameMin: Cijk_Ailk_Bjlk_HBH_MT128x96x64_MI32x32x8x1_SE_AF0EM4_GRVW4_NLCA1_NLCB3_SU32_SUS128_SRVW4_TT1_96_WG128_2_1_WGM15
    SolutionIndex: 248
    SolutionNameMin: Cijk_Ailk_Bjlk_HBH_MT32x32x128_MI16x16x16x1_SE_AF0EM1_GRVW8_NLCA1_NLCB1_SU16_SUS256_SRVW0_TT1_16_WG32_8_1_WGM1
    SolutionIndex: 249
    SolutionNameMin: Cijk_Ailk_Bjlk_HBH_MT128x128x32_MI32x32x8x1_SE_AF0EM1_GRVW8_NLCA1_NLCB1_SU0_SUS256_SRVW4_TT2_64_WG64_4_1_WGM2
    SolutionIndex: 250
    SolutionNameMin: Cijk_Ailk_Bjlk_HBH_MT64x128x16_MI32x32x8x1_SE_AF0EM1_GRVW4_NLCA1_NLCB1_SU0_SUS256_SRVW4_TT1_64_WG64_4_1_WGM15
    SolutionIndex: 251
    SolutionNameMin: Cijk_Ailk_Bjlk_HBH_MT128x160x16_MI32x32x8x1_SE_AF0EM4_GRVW2_NLCA1_NLCB5_SU0_SUS256_SRVW4_TT1_160_WG128_2_1_WGM15
    SolutionIndex: 252
    SolutionNameMin: Cijk_Ailk_Bjlk_HBH_MT64x64x32_MI32x32x8x1_SE_AF0EM1_GRVW4_NLCA1_NLCB1_SU0_SUS256_SRVW4_TT1_32_WG64_4_1_WGM15
    SolutionIndex: 253
    SolutionNameMin: Cijk_Ailk_Bjlk_HBH_MT128x288x32_MI32x32x8x1_SE_AF0EM1_GRVW2_NLCA1_NLCB9_SU0_SUS256_SRVW4_TT1_288_WG128_2_1_WGM15
    SolutionIndex: 254
    SolutionNameMin: Cijk_Ailk_Bjlk_HBH_MT256x128x32_MI32x32x8x1_SE_AF0EM1_GRVW8_NLCA1_NLCB1_SU0_SUS256_SRVW4_TT4_64_WG64_4_1_WGM15
    SolutionIndex: 255
    SolutionNameMin: Cijk_Ailk_Bjlk_HBH_MT32x64x16_MI16x16x16x1_SE_AF0EM1_GRVW4_NLCA1_NLCB1_SU16_SUS128_SRVW4_TT1_32_WG32_8_1_WGM1
    SolutionIndex: 256
    SolutionNameMin: Cijk_Ailk_Bjlk_HBH_MT128x96x64_MI32x32x8x1_SE_AF0EM4_GRVW4_NLCA1_NLCB3_SU32_SUS256_SRVW4_TT1_96_WG128_2_1_WGM15
    SolutionIndex: 257
    SolutionNameMin: Cijk_Ailk_Bjlk_HBH_MT256x128x32_MI32x32x8x1_SE_AF0EM1_GRVW8_NLCA1_NLCB1_SU16_SUS128_SRVW4_TT4_64_WG64_4_1_WGM1
    SolutionIndex: 258
    SolutionNameMin: Cijk_Ailk_Bjlk_HBH_MT64x32x16_MI16x16x16x1_SE_AF0EM4_GRVW4_NLCA1_NLCB1_SU32_SUS256_SRVW0_TT2_16_WG32_8_1_WGM15
    SolutionIndex: 259
    SolutionNameMin: Cijk_Ailk_Bjlk_HBH_MT128x128x64_MI32x32x8x1_SE_AF0EM1_GRVW8_NLCA1_NLCB1_SU16_SUS128_SRVW4_TT2_64_WG64_4_1_WGM1
    SolutionIndex: 260
    SolutionNameMin: Cijk_Ailk_Bjlk_HBH_MT128x128x32_MI32x32x8x1_SE_AF0EM4_GRVW8_NLCA1_NLCB1_SU16_SUS128_SRVW4_TT2_64_WG64_4_1_WGM15
    SolutionIndex: 261
    SolutionNameMin: Cijk_Ailk_Bjlk_HBH_MT128x96x64_MI32x32x8x1_SE_AF0EM4_GRVW4_NLCA1_NLCB3_SU16_SUS128_SRVW0_TT1_96_WG128_2_1_WGM15
    SolutionIndex: 262
    SolutionNameMin: Cijk_Ailk_Bjlk_HBH_MT64x64x32_MI32x32x8x1_SE_AF0EM1_GRVW8_NLCA1_NLCB1_SU32_SUS256_SRVW4_TT1_32_WG64_4_1_WGM15
    SolutionIndex: 263
    SolutionNameMin: Cijk_Ailk_Bjlk_HBH_MT256x256x32_MI32x32x8x1_SE_AF0EM4_GRVW8_NLCA1_NLCB1_SU0_SUS256_SRVW4_TT4_128_WG64_4_1_WGM2
    SolutionIndex: 264
    SolutionNameMin: Cijk_Ailk_Bjlk_HBH_MT32x64x16_MI16x16x16x1_SE_AF0EM4_GRVW4_NLCA1_NLCB1_SU0_SUS256_SRVW0_TT1_32_WG32_8_1_WGM1
    SolutionIndex: 265
    SolutionNameMin: Cijk_Ailk_Bjlk_HBH_MT32x32x128_MI16x16x16x1_SE_AF0EM4_GRVW8_NLCA1_NLCB1_SU0_SUS256_SRVW0_TT1_16_WG32_8_1_WGM1
    SolutionIndex: 266
    SolutionNameMin: Cijk_Ailk_Bjlk_HBH_MT128x64x16_MI32x32x4x2_SE_AF0EM1_GRVW4_NLCA1_NLCB1_SU0_SUS256_SRVW4_TT1_32_WG128_2_1_WGM2
    SolutionIndex: 267
    SolutionNameMin: Cijk_Ailk_Bjlk_HBH_MT64x64x128_MI32x32x8x1_SE_AF0EM4_GRVW8_NLCA1_NLCB1_SU16_SUS256_SRVW4_TT1_32_WG64_4_1_WGM15
    SolutionIndex: 268
    SolutionNameMin: Cijk_Ailk_Bjlk_HBH_MT64x64x16_MI32x32x8x1_SE_AF0EM4_GRVW2_NLCA1_NLCB1_SU32_SUS256_SRVW4_TT1_32_WG64_4_1_WGM1
    SolutionIndex: 269
    SolutionNameMin: Cijk_Ailk_Bjlk_HBH_MT128x288x32_MI32x32x8x1_SE_AF0EM4_GRVW4_NLCA1_NLCB9_SU0_SUS256_SRVW4_TT1_288_WG128_2_1_WGM15
    SolutionIndex: 270
    SolutionNameMin: Cijk_Ailk_Bjlk_HBH_MT128x64x16_MI32x32x8x1_SE_AF0EM4_GRVW4_NLCA1_NLCB1_SU0_SUS256_SRVW4_TT2_32_WG64_4_1_WGM15
    SolutionIndex: 271
    SolutionNameMin: Cijk_Ailk_Bjlk_HBH_MT128x96x32_MI32x32x8x1_SE_AF0EM1_GRVW4_NLCA1_NLCB3_SU0_SUS256_SRVW4_TT1_96_WG128_2_1_WGM15
    SolutionIndex: 272
    SolutionNameMin: Cijk_Ailk_Bjlk_HBH_MT32x32x64_MI16x16x16x1_SE_AF0EM4_GRVW2_NLCA1_NLCB1_SU16_SUS256_SRVW0_TT1_16_WG32_8_1_WGM1
    SolutionIndex: 273
    SolutionNameMin: Cijk_Ailk_Bjlk_HBH_MT64x64x128_MI32x32x8x1_SE_AF0EM1_GRVW8_NLCA1_NLCB1_SU32_SUS256_SRVW4_TT1_32_WG64_4_1_WGM2
    SolutionIndex: 274
    SolutionNameMin: Cijk_Ailk_Bjlk_HBH_MT64x64x128_MI32x32x8x1_SE_AF0EM4_GRVW8_NLCA1_NLCB1_SU32_SUS256_SRVW4_TT1_32_WG64_4_1_WGM15
    SolutionIndex: 275
    SolutionNameMin: Cijk_Ailk_Bjlk_HBH_MT32x32x64_MI16x16x16x1_SE_AF0EM4_GRVW8_NLCA1_NLCB1_SU0_SUS256_SRVW0_TT1_16_WG32_8_1_WGM1
    SolutionIndex: 276
    SolutionNameMin: Cijk_Ailk_Bjlk_HBH_MT32x64x16_MI16x16x16x1_SE_AF0EM1_GRVW4_NLCA1_NLCB1_SU0_SUS256_SRVW0_TT1_32_WG32_8_1_WGM1
    SolutionIndex: 277
    SolutionNameMin: Cijk_Ailk_Bjlk_HBH_MT128x128x32_MI32x32x8x1_SE_AF0EM4_GRVW8_NLCA1_NLCB1_SU0_SUS256_SRVW4_TT2_64_WG64_4_1_WGM15
    SolutionIndex: 278
    SolutionNameMin: Cijk_Ailk_Bjlk_HBH_MT256x256x16_MI32x32x4x2_SE_AF0EM4_GRVW8_NLCA1_NLCB1_SU0_SUS256_SRVW4_TT2_128_WG128_2_1_WGM15
    SolutionIndex: 279
    SolutionNameMin: Cijk_Ailk_Bjlk_HBH_MT64x128x16_MI32x32x8x1_SE_AF0EM1_GRVW8_NLCA1_NLCB1_SU0_SUS256_SRVW4_TT1_64_WG64_4_1_WGM1
    SolutionIndex: 280
    SolutionNameMin: Cijk_Ailk_Bjlk_HBH_MT32x64x16_MI16x16x16x1_SE_AF0EM1_GRVW2_NLCA1_NLCB1_SU0_SUS256_SRVW4_TT1_32_WG32_8_1_WGM2
    SolutionIndex: 281
    SolutionNameMin: Cijk_Ailk_Bjlk_HBH_MT256x128x32_MI32x32x4x2_SE_AF0EM4_GRVW8_NLCA1_NLCB1_SU0_SUS256_SRVW4_TT2_64_WG128_2_1_WGM15
    SolutionIndex: 282
    SolutionNameMin: Cijk_Ailk_Bjlk_HBH_MT128x128x32_MI32x32x8x1_SE_AF0EM4_GRVW8_NLCA1_NLCB1_SU32_SUS128_SRVW4_TT2_64_WG64_4_1_WGM15
    SolutionIndex: 283
    SolutionNameMin: Cijk_Ailk_Bjlk_HBH_MT64x32x16_MI16x16x16x1_SE_AF0EM4_GRVW8_NLCA1_NLCB1_SU0_SUS256_SRVW4_TT2_16_WG32_8_1_WGM15
    SolutionIndex: 284
    SolutionNameMin: Cijk_Ailk_Bjlk_HBH_MT32x64x16_MI16x16x16x1_SE_AF0EM1_GRVW2_NLCA1_NLCB1_SU32_SUS128_SRVW4_TT1_32_WG32_8_1_WGM15
    SolutionIndex: 285
    SolutionNameMin: Cijk_Ailk_Bjlk_HBH_MT64x64x128_MI32x32x8x1_SE_AF0EM4_GRVW8_NLCA1_NLCB1_SU32_SUS256_SRVW0_TT1_32_WG64_4_1_WGM2
    SolutionIndex: 286
    SolutionNameMin: Cijk_Ailk_Bjlk_HBH_MT64x64x64_MI32x32x8x1_SE_AF0EM4_GRVW4_NLCA1_NLCB1_SU32_SUS128_SRVW4_TT1_32_WG64_4_1_WGM15
    SolutionIndex: 287
    SolutionNameMin: Cijk_Ailk_Bjlk_HBH_MT64x32x16_MI16x16x16x1_SE_AF0EM4_GRVW4_NLCA1_NLCB1_SU0_SUS256_SRVW4_TT2_16_WG32_8_1_WGM15
    SolutionIndex: 288
    SolutionNameMin: Cijk_Ailk_Bjlk_HBH_MT256x256x32_MI32x32x8x1_SE_AF0EM4_GRVW8_NLCA1_NLCB1_SU16_SUS128_SRVW4_TT4_128_WG64_4_1_WGM15
    SolutionIndex: 289
    SolutionNameMin: Cijk_Ailk_Bjlk_HBH_MT128x128x32_MI32x32x8x1_SE_AF0EM1_GRVW8_NLCA1_NLCB1_SU16_SUS128_SRVW4_TT2_64_WG64_4_1_WGM2
    SolutionIndex: 290
    SolutionNameMin: Cijk_Ailk_Bjlk_HBH_MT64x32x16_MI16x16x16x1_SE_AF0EM4_GRVW2_NLCA1_NLCB1_SU0_SUS256_SRVW4_TT2_16_WG32_8_1_WGM1
    SolutionIndex: 291
    SolutionNameMin: Cijk_Ailk_Bjlk_HBH_MT64x64x128_MI32x32x8x1_SE_AF0EM4_GRVW8_NLCA1_NLCB1_SU32_SUS256_SRVW4_TT1_32_WG64_4_1_WGM2
    SolutionIndex: 292
    SolutionNameMin: Cijk_Ailk_Bjlk_HBH_MT32x32x16_MI16x16x16x1_SE_AF0EM4_GRVW2_NLCA1_NLCB1_SU0_SUS256_SRVW0_TT1_16_WG32_8_1_WGM1
    SolutionIndex: 293
    SolutionNameMin: Cijk_Ailk_Bjlk_HBH_MT64x32x16_MI16x16x16x1_SE_AF0EM4_GRVW2_NLCA1_NLCB1_SU32_SUS128_SRVW4_TT2_16_WG32_8_1_WGM1
    SolutionIndex: 294
    SolutionNameMin: Cijk_Ailk_Bjlk_HBH_MT32x32x128_MI16x16x16x1_SE_AF0EM1_GRVW2_NLCA1_NLCB1_SU32_SUS256_SRVW4_TT1_16_WG32_8_1_WGM1
    SolutionIndex: 295
    SolutionNameMin: Cijk_Ailk_Bjlk_HBH_MT128x128x64_MI32x32x8x1_SE_AF0EM1_GRVW8_NLCA1_NLCB1_SU16_SUS128_SRVW4_TT2_64_WG64_4_1_WGM2
    SolutionIndex: 296
    SolutionNameMin: Cijk_Ailk_Bjlk_HBH_MT32x64x16_MI16x16x16x1_SE_AF0EM1_GRVW2_NLCA1_NLCB1_SU16_SUS256_SRVW0_TT1_32_WG32_8_1_WGM2
    SolutionIndex: 297
    SolutionNameMin: Cijk_Ailk_Bjlk_HBH_MT64x128x16_MI32x32x4x2_SE_AF0EM1_GRVW2_NLCA1_NLCB1_SU32_SUS128_SRVW4_TT1_32_WG64_4_1_WGM2
    SolutionIndex: 298
    SolutionNameMin: Cijk_Ailk_Bjlk_HBH_MT256x128x32_MI32x32x8x1_SE_AF0EM4_GRVW8_NLCA1_NLCB1_SU0_SUS256_SRVW4_TT4_64_WG64_4_1_WGM2
    SolutionIndex: 299
    SolutionNameMin: Cijk_Ailk_Bjlk_HBH_MT64x32x16_MI16x16x16x1_SE_AF0EM1_GRVW2_NLCA1_NLCB1_SU0_SUS256_SRVW4_TT2_16_WG32_8_1_WGM1
    SolutionIndex: 300
    SolutionNameMin: Cijk_Ailk_Bjlk_HBH_MT64x64x64_MI32x32x8x1_SE_AF0EM1_GRVW8_NLCA1_NLCB1_SU0_SUS256_SRVW4_TT1_32_WG64_4_1_WGM1
    SolutionIndex: 301
    SolutionNameMin: Cijk_Ailk_Bjlk_HBH_MT128x128x64_MI32x32x8x1_SE_AF0EM4_GRVW8_NLCA1_NLCB1_SU0_SUS256_SRVW4_TT2_64_WG64_4_1_WGM2
    SolutionIndex: 302
    SolutionNameMin: Cijk_Ailk_Bjlk_HBH_MT128x128x64_MI32x32x8x1_SE_AF0EM1_GRVW8_NLCA1_NLCB1_SU32_SUS128_SRVW4_TT2_64_WG64_4_1_WGM15
    SolutionIndex: 303
    SolutionNameMin: Cijk_Ailk_Bjlk_HBH_MT128x128x32_MI32x32x8x1_SE_AF0EM4_GRVW8_NLCA1_NLCB1_SU32_SUS128_SRVW4_TT2_64_WG64_4_1_WGM2
    SolutionIndex: 304
    SolutionNameMin: Cijk_Ailk_Bjlk_HBH_MT64x64x128_MI32x32x8x1_SE_AF0EM4_GRVW8_NLCA1_NLCB1_SU32_SUS256_SRVW4_TT1_32_WG64_4_1_WGM1
    SolutionIndex: 305
    SolutionNameMin: Cijk_Ailk_Bjlk_HBH_MT32x64x16_MI16x16x16x1_SE_AF0EM1_GRVW2_NLCA1_NLCB1_SU0_SUS256_SRVW0_TT1_32_WG32_8_1_WGM2
    SolutionIndex: 306
    SolutionNameMin: Cijk_Ailk_Bjlk_HBH_MT128x288x32_MI32x32x8x1_SE_AF0EM4_GRVW4_NLCA1_NLCB9_SU32_SUS256_SRVW4_TT1_288_WG128_2_1_WGM15
    SolutionIndex: 307
    SolutionNameMin: Cijk_Ailk_Bjlk_HBH_MT128x96x64_MI32x32x8x1_SE_AF0EM4_GRVW8_NLCA1_NLCB3_SU0_SUS256_SRVW4_TT1_96_WG128_2_1_WGM15
    SolutionIndex: 308
    SolutionNameMin: Cijk_Ailk_Bjlk_HBH_MT32x32x16_MI16x16x16x1_SE_AF0EM1_GRVW8_NLCA1_NLCB1_SU0_SUS256_SRVW0_TT1_16_WG32_8_1_WGM1
    SolutionIndex: 309
    SolutionNameMin: Cijk_Ailk_Bjlk_HBH_MT128x96x64_MI32x32x8x1_SE_AF0EM1_GRVW4_NLCA1_NLCB3_SU32_SUS256_SRVW4_TT1_96_WG128_2_1_WGM15
    SolutionIndex: 310
    SolutionNameMin: Cijk_Ailk_Bjlk_HBH_MT64x64x16_MI32x32x8x1_SE_AF0EM4_GRVW4_NLCA1_NLCB1_SU0_SUS256_SRVW4_TT1_32_WG64_4_1_WGM15
    SolutionIndex: 311
    SolutionNameMin: Cijk_Ailk_Bjlk_HBH_MT128x256x32_MI32x32x8x1_SE_AF0EM4_GRVW8_NLCA1_NLCB1_SU16_SUS128_SRVW4_TT2_128_WG64_4_1_WGM15
    SolutionIndex: 312
    SolutionNameMin: Cijk_Ailk_Bjlk_HBH_MT32x32x64_MI16x16x16x1_SE_AF0EM4_GRVW8_NLCA1_NLCB1_SU16_SUS128_SRVW0_TT1_16_WG32_8_1_WGM1
    SolutionIndex: 313
    SolutionNameMin: Cijk_Ailk_Bjlk_HBH_MT64x128x32_MI32x32x8x1_SE_AF0EM4_GRVW8_NLCA1_NLCB1_SU32_SUS128_SRVW4_TT1_64_WG64_4_1_WGM1
    SolutionIndex: 314
    SolutionNameMin: Cijk_Ailk_Bjlk_HBH_MT256x256x16_MI32x32x4x2_SE_AF0EM4_GRVW8_NLCA1_NLCB1_SU0_SUS256_SRVW4_TT2_128_WG128_2_1_WGM1
    SolutionIndex: 315
    SolutionNameMin: Cijk_Ailk_Bjlk_HBH_MT128x128x32_MI32x32x8x1_SE_AF0EM4_GRVW8_NLCA1_NLCB1_SU16_SUS128_SRVW4_TT2_64_WG64_4_1_WGM2
    SolutionIndex: 316
    SolutionNameMin: Cijk_Ailk_Bjlk_HBH_MT64x64x16_MI32x32x8x1_SE_AF0EM4_GRVW2_NLCA1_NLCB1_SU0_SUS256_SRVW4_TT1_32_WG64_4_1_WGM2
    SolutionIndex: 317
    SolutionNameMin: Cijk_Ailk_Bjlk_HBH_MT32x64x16_MI16x16x16x1_SE_AF0EM1_GRVW2_NLCA1_NLCB1_SU32_SUS256_SRVW0_TT1_32_WG32_8_1_WGM1
    SolutionIndex: 318
    SolutionNameMin: Cijk_Ailk_Bjlk_HBH_MT128x256x32_MI32x32x8x1_SE_AF0EM4_GRVW8_NLCA1_NLCB1_SU0_SUS256_SRVW4_TT2_128_WG64_4_1_WGM2
    SolutionIndex: 319
    SolutionNameMin: Cijk_Ailk_Bjlk_HBH_MT64x32x16_MI16x16x16x1_SE_AF0EM4_GRVW2_NLCA1_NLCB1_SU0_SUS256_SRVW0_TT2_16_WG32_8_1_WGM1
    SolutionIndex: 320
    SolutionNameMin: Cijk_Ailk_Bjlk_HBH_MT32x64x16_MI16x16x16x1_SE_AF0EM1_GRVW2_NLCA1_NLCB1_SU32_SUS256_SRVW4_TT1_32_WG32_8_1_WGM15
    SolutionIndex: 321
    SolutionNameMin: Cijk_Ailk_Bjlk_HBH_MT64x64x16_MI32x32x8x1_SE_AF0EM4_GRVW2_NLCA1_NLCB1_SU0_SUS256_SRVW4_TT1_32_WG64_4_1_WGM15
    SolutionIndex: 322
    SolutionNameMin: Cijk_Ailk_Bjlk_HBH_MT64x128x32_MI32x32x8x1_SE_AF0EM1_GRVW8_NLCA1_NLCB1_SU32_SUS128_SRVW4_TT1_64_WG64_4_1_WGM15
    SolutionIndex: 323
    SolutionNameMin: Cijk_Ailk_Bjlk_HBH_MT64x64x128_MI32x32x8x1_SE_AF0EM1_GRVW8_NLCA1_NLCB1_SU16_SUS256_SRVW0_TT1_32_WG64_4_1_WGM15
    SolutionIndex: 324
    SolutionNameMin: Cijk_Ailk_Bjlk_HBH_MT128x96x64_MI32x32x8x1_SE_AF0EM4_GRVW4_NLCA1_NLCB3_SU16_SUS128_SRVW4_TT1_96_WG128_2_1_WGM15
    SolutionIndex: 325
    SolutionNameMin: Cijk_Ailk_Bjlk_HBH_MT64x64x16_MI32x32x8x1_SE_AF0EM4_GRVW4_NLCA1_NLCB1_SU0_SUS256_SRVW4_TT1_32_WG64_4_1_WGM1
    SolutionIndex: 326
    SolutionNameMin: Cijk_Ailk_Bjlk_HBH_MT128x160x32_MI32x32x8x1_SE_AF0EM4_GRVW2_NLCA1_NLCB5_SU32_SUS128_SRVW4_TT1_160_WG128_2_1_WGM15
    SolutionIndex: 327
    SolutionNameMin: Cijk_Ailk_Bjlk_HBH_MT128x256x32_MI32x32x8x1_SE_AF0EM1_GRVW8_NLCA1_NLCB1_SU0_SUS256_SRVW4_TT2_128_WG64_4_1_WGM15
    SolutionIndex: 328
    SolutionNameMin: Cijk_Ailk_Bjlk_HBH_MT64x32x16_MI16x16x16x1_SE_AF0EM4_GRVW4_NLCA1_NLCB1_SU0_SUS256_SRVW0_TT2_16_WG32_8_1_WGM1
    SolutionIndex: 329
    SolutionNameMin: Cijk_Ailk_Bjlk_HBH_MT64x64x16_MI32x32x8x1_SE_AF0EM4_GRVW2_NLCA1_NLCB1_SU16_SUS128_SRVW4_TT1_32_WG64_4_1_WGM2
    SolutionIndex: 330
    SolutionNameMin: Cijk_Ailk_Bjlk_HBH_MT64x64x32_MI32x32x8x1_SE_AF0EM1_GRVW8_NLCA1_NLCB1_SU0_SUS256_SRVW4_TT1_32_WG64_4_1_WGM1
    SolutionIndex: 331
    SolutionNameMin: Cijk_Ailk_Bjlk_HBH_MT64x128x32_MI32x32x8x1_SE_AF0EM4_GRVW4_NLCA1_NLCB1_SU32_SUS256_SRVW4_TT1_64_WG64_4_1_WGM15
    SolutionIndex: 332
    SolutionNameMin: Cijk_Ailk_Bjlk_HBH_MT128x128x16_MI32x32x8x1_SE_AF0EM4_GRVW8_NLCA1_NLCB1_SU32_SUS256_SRVW4_TT2_64_WG64_4_1_WGM2
    SolutionIndex: 333
    SolutionNameMin: Cijk_Ailk_Bjlk_HBH_MT128x96x32_MI32x32x8x1_SE_AF0EM4_GRVW4_NLCA1_NLCB3_SU16_SUS256_SRVW0_TT1_96_WG128_2_1_WGM15
    SolutionIndex: 334
    SolutionNameMin: Cijk_Ailk_Bjlk_HBH_MT64x128x64_MI32x32x4x2_SE_AF0EM4_GRVW8_NLCA1_NLCB1_SU0_SUS256_SRVW4_TT1_32_WG64_4_1_WGM1
    SolutionIndex: 335
    SolutionNameMin: Cijk_Ailk_Bjlk_HBH_MT32x64x16_MI16x16x16x1_SE_AF0EM1_GRVW2_NLCA1_NLCB1_SU0_SUS256_SRVW0_TT1_32_WG32_8_1_WGM15
    SolutionIndex: 336
    SolutionNameMin: Cijk_Ailk_Bjlk_HBH_MT64x32x32_MI16x16x16x1_SE_AF0EM4_GRVW4_NLCA1_NLCB1_SU32_SUS256_SRVW0_TT2_16_WG32_8_1_WGM15
    SolutionIndex: 337
    SolutionNameMin: Cijk_Ailk_Bjlk_HBH_MT128x288x32_MI32x32x8x1_SE_AF0EM4_GRVW4_NLCA1_NLCB9_SU0_SUS256_SRVW4_TT1_288_WG128_2_1_WGM1
    SolutionIndex: 338
    SolutionNameMin: Cijk_Ailk_Bjlk_HBH_MT128x288x32_MI32x32x8x1_SE_AF0EM1_GRVW2_NLCA1_NLCB9_SU0_SUS256_SRVW0_TT1_288_WG128_2_1_WGM15
    SolutionIndex: 339
    SolutionNameMin: Cijk_Ailk_Bjlk_HBH_MT128x128x64_MI32x32x8x1_SE_AF0EM4_GRVW8_NLCA1_NLCB1_SU32_SUS256_SRVW4_TT2_64_WG64_4_1_WGM15
    SolutionIndex: 340
    SolutionNameMin: Cijk_Ailk_Bjlk_HBH_MT64x64x16_MI32x32x8x1_SE_AF0EM4_GRVW2_NLCA1_NLCB1_SU16_SUS256_SRVW4_TT1_32_WG64_4_1_WGM2
    SolutionIndex: 341
    SolutionNameMin: Cijk_Ailk_Bjlk_HBH_MT128x128x64_MI32x32x8x1_SE_AF0EM4_GRVW8_NLCA1_NLCB1_SU16_SUS128_SRVW4_TT2_64_WG64_4_1_WGM1
    SolutionIndex: 342
    SolutionNameMin: Cijk_Ailk_Bjlk_HBH_MT128x128x64_MI32x32x8x1_SE_AF0EM4_GRVW8_NLCA1_NLCB1_SU16_SUS128_SRVW4_TT2_64_WG64_4_1_WGM2
    SolutionIndex: 343
    SolutionNameMin: Cijk_Ailk_Bjlk_HBH_MT128x128x64_MI32x32x8x1_SE_AF0EM4_GRVW8_NLCA1_NLCB1_SU0_SUS256_SRVW4_TT2_64_WG64_4_1_WGM15
    SolutionIndex: 344
    SolutionNameMin: Cijk_Ailk_Bjlk_HBH_MT64x128x64_MI32x32x8x1_SE_AF0EM1_GRVW4_NLCA1_NLCB1_SU0_SUS256_SRVW4_TT1_64_WG64_4_1_WGM1
    SolutionIndex: 345
    SolutionNameMin: Cijk_Ailk_Bjlk_HBH_MT128x288x32_MI32x32x8x1_SE_AF0EM4_GRVW4_NLCA1_NLCB9_SU16_SUS128_SRVW4_TT1_288_WG128_2_1_WGM15
    SolutionIndex: 346
    SolutionNameMin: Cijk_Ailk_Bjlk_HBH_MT128x256x16_MI32x32x8x1_SE_AF0EM4_GRVW8_NLCA1_NLCB1_SU0_SUS256_SRVW4_TT2_128_WG64_4_1_WGM15
    SolutionIndex: 347
    SolutionNameMin: Cijk_Ailk_Bjlk_HBH_MT128x256x16_MI32x32x8x1_SE_AF0EM4_GRVW8_NLCA1_NLCB1_SU16_SUS128_SRVW4_TT2_128_WG64_4_1_WGM15
    SolutionIndex: 348
    SolutionNameMin: Cijk_Ailk_Bjlk_HBH_MT32x64x16_MI16x16x16x1_SE_AF0EM1_GRVW2_NLCA1_NLCB1_SU0_SUS256_SRVW0_TT1_32_WG32_8_1_WGM1
    SolutionIndex: 349
    SolutionNameMin: Cijk_Ailk_Bjlk_HBH_MT128x160x32_MI32x32x8x1_SE_AF0EM1_GRVW2_NLCA1_NLCB5_SU32_SUS128_SRVW4_TT1_160_WG128_2_1_WGM2
    SolutionIndex: 350
    SolutionNameMin: Cijk_Ailk_Bjlk_HBH_MT128x64x32_MI32x32x8x1_SE_AF0EM1_GRVW8_NLCA1_NLCB1_SU32_SUS256_SRVW4_TT2_32_WG64_4_1_WGM1
    SolutionIndex: 351
    SolutionNameMin: Cijk_Ailk_Bjlk_HBH_MT128x64x16_MI32x32x8x1_SE_AF0EM4_GRVW8_NLCA1_NLCB1_SU16_SUS128_SRVW4_TT2_32_WG64_4_1_WGM2
    SolutionIndex: 352
    SolutionNameMin: Cijk_Ailk_Bjlk_HBH_MT64x32x16_MI16x16x16x1_SE_AF0EM4_GRVW4_NLCA1_NLCB1_SU0_SUS256_SRVW4_TT2_16_WG32_8_1_WGM1
    SolutionIndex: 353
    SolutionNameMin: Cijk_Ailk_Bjlk_HBH_MT256x256x32_MI32x32x8x1_SE_AF0EM1_GRVW8_NLCA1_NLCB1_SU0_SUS256_SRVW4_TT4_128_WG64_4_1_WGM1
    SolutionIndex: 354
    SolutionNameMin: Cijk_Ailk_Bjlk_HBH_MT32x32x16_MI16x16x16x1_SE_AF0EM4_GRVW2_NLCA1_NLCB1_SU32_SUS128_SRVW0_TT1_16_WG32_8_1_WGM15
    SolutionIndex: 355
    SolutionNameMin: Cijk_Ailk_Bjlk_HBH_MT256x128x32_MI32x32x8x1_SE_AF0EM4_GRVW8_NLCA1_NLCB1_SU16_SUS128_SRVW4_TT4_64_WG64_4_1_WGM2
    SolutionIndex: 356
    SolutionNameMin: Cijk_Ailk_Bjlk_HBH_MT64x64x32_MI32x32x8x1_SE_AF0EM4_GRVW4_NLCA1_NLCB1_SU0_SUS256_SRVW4_TT1_32_WG64_4_1_WGM15
    SolutionIndex: 357
    SolutionNameMin: Cijk_Ailk_Bjlk_HBH_MT64x64x128_MI32x32x8x1_SE_AF0EM1_GRVW8_NLCA1_NLCB1_SU16_SUS256_SRVW4_TT1_32_WG64_4_1_WGM2
    SolutionIndex: 358
    SolutionNameMin: Cijk_Ailk_Bjlk_HBH_MT64x64x64_MI32x32x8x1_SE_AF0EM4_GRVW8_NLCA1_NLCB1_SU32_SUS128_SRVW4_TT1_32_WG64_4_1_WGM1
    SolutionIndex: 359
    SolutionNameMin: Cijk_Ailk_Bjlk_HBH_MT32x64x16_MI16x16x16x1_SE_AF0EM1_GRVW2_NLCA1_NLCB1_SU32_SUS256_SRVW4_TT1_32_WG32_8_1_WGM2
    SolutionIndex: 360
    SolutionNameMin: Cijk_Ailk_Bjlk_HBH_MT128x96x32_MI32x32x8x1_SE_AF0EM1_GRVW4_NLCA1_NLCB3_SU0_SUS256_SRVW0_TT1_96_WG128_2_1_WGM2
    SolutionIndex: 361
    SolutionNameMin: Cijk_Ailk_Bjlk_HBH_MT64x128x16_MI32x32x4x2_SE_AF0EM1_GRVW4_NLCA1_NLCB1_SU0_SUS256_SRVW4_TT1_32_WG64_4_1_WGM15
    SolutionIndex: 362
    SolutionNameMin: Cijk_Ailk_Bjlk_HBH_MT32x32x128_MI16x16x16x1_SE_AF0EM1_GRVW2_NLCA1_NLCB1_SU16_SUS256_SRVW0_TT1_16_WG32_8_1_WGM1
    SolutionIndex: 363
    SolutionNameMin: Cijk_Ailk_Bjlk_HBH_MT256x128x32_MI32x32x4x2_SE_AF0EM4_GRVW8_NLCA1_NLCB1_SU32_SUS128_SRVW4_TT2_64_WG128_2_1_WGM2
    SolutionIndex: 364
    SolutionNameMin: Cijk_Ailk_Bjlk_HBH_MT128x160x32_MI32x32x8x1_SE_AF0EM4_GRVW2_NLCA1_NLCB5_SU0_SUS256_SRVW4_TT1_160_WG128_2_1_WGM2
    SolutionIndex: 365
    SolutionNameMin: Cijk_Ailk_Bjlk_HBH_MT32x64x16_MI16x16x16x1_SE_AF0EM4_GRVW2_NLCA1_NLCB1_SU32_SUS256_SRVW0_TT1_32_WG32_8_1_WGM15
    SolutionIndex: 366
    SolutionNameMin: Cijk_Ailk_Bjlk_HBH_MT32x32x128_MI16x16x16x1_SE_AF0EM4_GRVW2_NLCA1_NLCB1_SU0_SUS256_SRVW0_TT1_16_WG32_8_1_WGM1
    SolutionIndex: 367
    SolutionNameMin: Cijk_Ailk_Bjlk_HBH_MT128x64x16_MI32x32x4x2_SE_AF0EM4_GRVW2_NLCA1_NLCB1_SU0_SUS256_SRVW4_TT1_32_WG128_2_1_WGM15
    SolutionIndex: 368
    SolutionNameMin: Cijk_Ailk_Bjlk_HBH_MT128x256x32_MI32x32x8x1_SE_AF0EM4_GRVW4_NLCA1_NLCB1_SU16_SUS128_SRVW4_TT2_128_WG64_4_1_WGM2
    SolutionIndex: 369
    SolutionNameMin: Cijk_Ailk_Bjlk_HBH_MT128x96x64_MI32x32x8x1_SE_AF0EM4_GRVW8_NLCA1_NLCB3_SU16_SUS128_SRVW4_TT1_96_WG128_2_1_WGM15
    SolutionIndex: 370
    SolutionNameMin: Cijk_Ailk_Bjlk_HBH_MT64x128x64_MI32x32x8x1_SE_AF0EM1_GRVW8_NLCA1_NLCB1_SU16_SUS128_SRVW0_TT1_64_WG64_4_1_WGM1
    SolutionIndex: 371
    SolutionNameMin: Cijk_Ailk_Bjlk_HBH_MT128x96x32_MI32x32x8x1_SE_AF0EM1_GRVW2_NLCA1_NLCB3_SU0_SUS256_SRVW4_TT1_96_WG128_2_1_WGM2
    SolutionIndex: 372
    SolutionNameMin: Cijk_Ailk_Bjlk_HBH_MT128x128x64_MI32x32x8x1_SE_AF0EM1_GRVW8_NLCA1_NLCB1_SU16_SUS128_SRVW4_TT2_64_WG64_4_1_WGM15
    SolutionIndex: 373
    SolutionNameMin: Cijk_Ailk_Bjlk_HBH_MT64x64x128_MI32x32x8x1_SE_AF0EM1_GRVW8_NLCA1_NLCB1_SU16_SUS256_SRVW4_TT1_32_WG64_4_1_WGM15
    SolutionIndex: 374
    SolutionNameMin: Cijk_Ailk_Bjlk_HBH_MT32x32x32_MI16x16x16x1_SE_AF0EM4_GRVW2_NLCA1_NLCB1_SU0_SUS256_SRVW0_TT1_16_WG32_8_1_WGM1
    SolutionIndex: 375
    SolutionNameMin: Cijk_Ailk_Bjlk_HBH_MT64x64x32_MI32x32x8x1_SE_AF0EM1_GRVW4_NLCA1_NLCB1_SU16_SUS256_SRVW4_TT1_32_WG64_4_1_WGM15
    SolutionIndex: 376
    SolutionNameMin: Cijk_Ailk_Bjlk_HBH_MT32x32x64_MI16x16x16x1_SE_AF0EM1_GRVW4_NLCA1_NLCB1_SU0_SUS256_SRVW0_TT1_16_WG32_8_1_WGM15
    SolutionIndex: 377
    SolutionNameMin: Cijk_Ailk_Bjlk_HBH_MT64x128x16_MI32x32x4x2_SE_AF0EM1_GRVW2_NLCA1_NLCB1_SU16_SUS128_SRVW4_TT1_32_WG64_4_1_WGM1
    SolutionIndex: 378
    SolutionNameMin: Cijk_Ailk_Bjlk_HBH_MT128x128x64_MI32x32x8x1_SE_AF0EM1_GRVW8_NLCA1_NLCB1_SU0_SUS256_SRVW4_TT2_64_WG64_4_1_WGM1
    SolutionIndex: 379
    SolutionNameMin: Cijk_Ailk_Bjlk_HBH_MT32x32x64_MI16x16x16x1_SE_AF0EM1_GRVW8_NLCA1_NLCB1_SU0_SUS256_SRVW0_TT1_16_WG32_8_1_WGM1
    SolutionIndex: 380
    SolutionNameMin: Cijk_Ailk_Bjlk_HBH_MT32x32x128_MI16x16x16x1_SE_AF0EM1_GRVW2_NLCA1_NLCB1_SU0_SUS256_SRVW0_TT1_16_WG32_8_1_WGM1
    SolutionIndex: 381
    SolutionNameMin: Cijk_Ailk_Bjlk_HBH_MT32x32x64_MI16x16x16x1_SE_AF0EM4_GRVW8_NLCA1_NLCB1_SU0_SUS256_SRVW0_TT1_16_WG32_8_1_WGM15
    SolutionIndex: 382
    SolutionNameMin: Cijk_Ailk_Bjlk_HBH_MT128x128x32_MI32x32x8x1_SE_AF0EM1_GRVW8_NLCA1_NLCB1_SU32_SUS128_SRVW4_TT2_64_WG64_4_1_WGM2
    SolutionIndex: 383
    SolutionNameMin: Cijk_Ailk_Bjlk_HBH_MT64x128x16_MI32x32x4x2_SE_AF0EM1_GRVW2_NLCA1_NLCB1_SU32_SUS128_SRVW4_TT1_32_WG64_4_1_WGM1
    SolutionIndex: 384
    SolutionNameMin: Cijk_Ailk_Bjlk_HBH_MT64x64x128_MI32x32x8x1_SE_AF0EM4_GRVW8_NLCA1_NLCB1_SU32_SUS256_SRVW0_TT1_32_WG64_4_1_WGM15
    SolutionIndex: 385
    SolutionNameMin: Cijk_Ailk_Bjlk_HBH_MT64x32x16_MI16x16x16x1_SE_AF0EM4_GRVW2_NLCA1_NLCB1_SU32_SUS128_SRVW0_TT2_16_WG32_8_1_WGM2
    SolutionIndex: 386
    SolutionNameMin: Cijk_Ailk_Bjlk_HBH_MT32x32x128_MI16x16x16x1_SE_AF0EM4_GRVW2_NLCA1_NLCB1_SU16_SUS256_SRVW0_TT1_16_WG32_8_1_WGM1
    SolutionIndex: 387
    SolutionNameMin: Cijk_Ailk_Bjlk_HBH_MT128x256x16_MI32x32x8x1_SE_AF0EM4_GRVW8_NLCA1_NLCB1_SU16_SUS128_SRVW4_TT2_128_WG64_4_1_WGM2
    SolutionIndex: 388
    SolutionNameMin: Cijk_Ailk_Bjlk_HBH_MT64x128x16_MI32x32x4x2_SE_AF0EM1_GRVW8_NLCA1_NLCB1_SU32_SUS128_SRVW4_TT1_32_WG64_4_1_WGM15
    SolutionIndex: 389
    SolutionNameMin: Cijk_Ailk_Bjlk_HBH_MT128x128x64_MI32x32x8x1_SE_AF0EM1_GRVW8_NLCA1_NLCB1_SU32_SUS128_SRVW4_TT2_64_WG64_4_1_WGM1
    SolutionIndex: 390
    SolutionNameMin: Cijk_Ailk_Bjlk_HBH_MT64x64x32_MI32x32x8x1_SE_AF0EM4_GRVW4_NLCA1_NLCB1_SU32_SUS256_SRVW4_TT1_32_WG64_4_1_WGM15
    SolutionIndex: 391
    SolutionNameMin: Cijk_Ailk_Bjlk_HBH_MT64x64x16_MI32x32x8x1_SE_AF0EM1_GRVW2_NLCA1_NLCB1_SU0_SUS256_SRVW0_TT1_32_WG64_4_1_WGM1
    SolutionIndex: 392
    SolutionNameMin: Cijk_Ailk_Bjlk_HBH_MT128x128x64_MI32x32x8x1_SE_AF0EM1_GRVW8_NLCA1_NLCB1_SU32_SUS128_SRVW4_TT2_64_WG64_4_1_WGM2
    SolutionIndex: 393
    SolutionNameMin: Cijk_Ailk_Bjlk_HBH_MT256x256x32_MI32x32x8x1_SE_AF0EM4_GRVW8_NLCA1_NLCB1_SU16_SUS256_SRVW4_TT4_128_WG64_4_1_WGM1
    SolutionIndex: 394
    SolutionNameMin: Cijk_Ailk_Bjlk_HBH_MT64x32x16_MI16x16x16x1_SE_AF0EM4_GRVW4_NLCA1_NLCB1_SU32_SUS256_SRVW0_TT2_16_WG32_8_1_WGM1
    SolutionIndex: 395
    SolutionNameMin: Cijk_Ailk_Bjlk_HBH_MT64x128x16_MI32x32x8x1_SE_AF0EM4_GRVW2_NLCA1_NLCB1_SU16_SUS256_SRVW4_TT1_64_WG64_4_1_WGM15
    SolutionIndex: 396
    SolutionNameMin: Cijk_Ailk_Bjlk_HBH_MT128x288x32_MI32x32x8x1_SE_AF0EM4_GRVW2_NLCA1_NLCB9_SU0_SUS256_SRVW4_TT1_288_WG128_2_1_WGM15
    SolutionIndex: 397
    SolutionNameMin: Cijk_Ailk_Bjlk_HBH_MT64x128x64_MI32x32x8x1_SE_AF0EM4_GRVW8_NLCA1_NLCB1_SU0_SUS256_SRVW4_TT1_64_WG64_4_1_WGM1
    SolutionIndex: 398
    SolutionNameMin: Cijk_Ailk_Bjlk_HBH_MT32x32x16_MI16x16x16x1_SE_AF0EM1_GRVW2_NLCA1_NLCB1_SU32_SUS256_SRVW0_TT1_16_WG32_8_1_WGM1
    SolutionIndex: 399
    SolutionNameMin: Cijk_Ailk_Bjlk_HBH_MT256x128x32_MI32x32x4x2_SE_AF0EM4_GRVW8_NLCA1_NLCB1_SU16_SUS128_SRVW4_TT2_64_WG128_2_1_WGM2
    SolutionIndex: 400
    SolutionNameMin: Cijk_Ailk_Bjlk_HBH_MT64x64x128_MI32x32x8x1_SE_AF0EM4_GRVW8_NLCA1_NLCB1_SU16_SUS256_SRVW4_TT1_32_WG64_4_1_WGM1
    SolutionIndex: 401
    SolutionNameMin: Cijk_Ailk_Bjlk_HBH_MT128x64x16_MI32x32x4x2_SE_AF0EM1_GRVW2_NLCA1_NLCB1_SU0_SUS256_SRVW4_TT1_32_WG128_2_1_WGM1
    SolutionIndex: 402
    SolutionNameMin: Cijk_Ailk_Bjlk_HBH_MT64x128x64_MI32x32x8x1_SE_AF0EM1_GRVW8_NLCA1_NLCB1_SU0_SUS256_SRVW4_TT1_64_WG64_4_1_WGM1
    SolutionIndex: 403
    SolutionNameMin: Cijk_Ailk_Bjlk_HBH_MT128x256x16_MI32x32x8x1_SE_AF0EM4_GRVW4_NLCA1_NLCB1_SU16_SUS128_SRVW4_TT2_128_WG64_4_1_WGM15
    SolutionIndex: 404
    SolutionNameMin: Cijk_Ailk_Bjlk_HBH_MT64x128x64_MI32x32x8x1_SE_AF0EM1_GRVW8_NLCA1_NLCB1_SU16_SUS128_SRVW4_TT1_64_WG64_4_1_WGM1
    SolutionIndex: 405
    SolutionNameMin: Cijk_Ailk_Bjlk_HBH_MT128x128x32_MI32x32x8x1_SE_AF0EM1_GRVW8_NLCA1_NLCB1_SU16_SUS256_SRVW4_TT2_64_WG64_4_1_WGM2
    SolutionIndex: 406
    SolutionNameMin: Cijk_Ailk_Bjlk_HBH_MT128x288x32_MI32x32x8x1_SE_AF0EM4_GRVW4_NLCA1_NLCB9_SU32_SUS128_SRVW4_TT1_288_WG128_2_1_WGM15
    SolutionIndex: 407
    SolutionNameMin: Cijk_Ailk_Bjlk_HBH_MT128x128x32_MI32x32x8x1_SE_AF0EM4_GRVW8_NLCA1_NLCB1_SU16_SUS256_SRVW4_TT2_64_WG64_4_1_WGM2
    SolutionIndex: 408
    SolutionNameMin: Cijk_Ailk_Bjlk_HBH_MT64x32x16_MI16x16x16x1_SE_AF0EM4_GRVW8_NLCA1_NLCB1_SU32_SUS128_SRVW4_TT2_16_WG32_8_1_WGM15
    SolutionIndex: 409
    SolutionNameMin: Cijk_Ailk_Bjlk_HBH_MT64x32x16_MI16x16x16x1_SE_AF0EM4_GRVW2_NLCA1_NLCB1_SU32_SUS256_SRVW0_TT2_16_WG32_8_1_WGM1
    SolutionIndex: 410
    SolutionNameMin: Cijk_Ailk_Bjlk_HBH_MT128x288x32_MI32x32x8x1_SE_AF0EM1_GRVW4_NLCA1_NLCB9_SU0_SUS256_SRVW4_TT1_288_WG128_2_1_WGM15
    SolutionIndex: 411
    SolutionNameMin: Cijk_Ailk_Bjlk_HBH_MT128x160x16_MI32x32x8x1_SE_AF0EM4_GRVW2_NLCA1_NLCB5_SU0_SUS256_SRVW4_TT1_160_WG128_2_1_WGM2
    SolutionIndex: 412
    SolutionNameMin: Cijk_Ailk_Bjlk_HBH_MT256x128x32_MI32x32x8x1_SE_AF0EM1_GRVW8_NLCA1_NLCB1_SU0_SUS256_SRVW4_TT4_64_WG64_4_1_WGM1
    SolutionIndex: 413
    SolutionNameMin: Cijk_Ailk_Bjlk_HBH_MT128x160x32_MI32x32x8x1_SE_AF0EM4_GRVW2_NLCA1_NLCB5_SU0_SUS256_SRVW4_TT1_160_WG128_2_1_WGM15
    SolutionIndex: 414
    SolutionNameMin: Cijk_Ailk_Bjlk_HBH_MT128x288x32_MI32x32x8x1_SE_AF0EM1_GRVW4_NLCA1_NLCB9_SU32_SUS256_SRVW4_TT1_288_WG128_2_1_WGM15
    SolutionIndex: 415
    SolutionNameMin: Cijk_Ailk_Bjlk_HBH_MT128x288x32_MI32x32x8x1_SE_AF0EM4_GRVW2_NLCA1_NLCB9_SU0_SUS256_SRVW0_TT1_288_WG128_2_1_WGM15
    SolutionIndex: 416
    SolutionNameMin: Cijk_Ailk_Bjlk_HBH_MT128x128x32_MI32x32x8x1_SE_AF0EM1_GRVW8_NLCA1_NLCB1_SU16_SUS128_SRVW4_TT2_64_WG64_4_1_WGM1
    SolutionIndex: 417
    SolutionNameMin: Cijk_Ailk_Bjlk_HBH_MT32x64x16_MI16x16x16x1_SE_AF0EM1_GRVW2_NLCA1_NLCB1_SU16_SUS256_SRVW4_TT1_32_WG32_8_1_WGM2
    SolutionIndex: 418
    SolutionNameMin: Cijk_Ailk_Bjlk_HBH_MT128x64x32_MI32x32x8x1_SE_AF0EM4_GRVW4_NLCA1_NLCB1_SU0_SUS256_SRVW4_TT2_32_WG64_4_1_WGM15
    SolutionIndex: 419
    SolutionNameMin: Cijk_Ailk_Bjlk_HBH_MT128x128x32_MI32x32x8x1_SE_AF0EM1_GRVW8_NLCA1_NLCB1_SU32_SUS256_SRVW4_TT2_64_WG64_4_1_WGM1
    SolutionIndex: 420
    SolutionNameMin: Cijk_Ailk_Bjlk_HBH_MT128x288x32_MI32x32x8x1_SE_AF0EM1_GRVW2_NLCA1_NLCB9_SU32_SUS128_SRVW4_TT1_288_WG128_2_1_WGM15
    SolutionIndex: 421
    SolutionNameMin: Cijk_Ailk_Bjlk_HBH_MT128x96x64_MI32x32x8x1_SE_AF0EM4_GRVW8_NLCA1_NLCB3_SU32_SUS128_SRVW4_TT1_96_WG128_2_1_WGM15
    SolutionIndex: 422
    SolutionNameMin: Cijk_Ailk_Bjlk_HBH_MT128x128x64_MI32x32x8x1_SE_AF0EM1_GRVW8_NLCA1_NLCB1_SU32_SUS256_SRVW4_TT2_64_WG64_4_1_WGM15
    SolutionIndex: 423
    SolutionNameMin: Cijk_Ailk_Bjlk_HBH_MT32x64x16_MI16x16x16x1_SE_AF0EM1_GRVW8_NLCA1_NLCB1_SU32_SUS128_SRVW0_TT1_32_WG32_8_1_WGM15
    SolutionIndex: 424
    SolutionNameMin: Cijk_Ailk_Bjlk_HBH_MT64x64x32_MI32x32x8x1_SE_AF0EM4_GRVW4_NLCA1_NLCB1_SU0_SUS256_SRVW4_TT1_32_WG64_4_1_WGM1
    SolutionIndex: 425
    SolutionNameMin: Cijk_Ailk_Bjlk_HBH_MT128x256x32_MI32x32x8x1_SE_AF0EM4_GRVW8_NLCA1_NLCB1_SU0_SUS256_SRVW4_TT2_128_WG64_4_1_WGM15
    SolutionIndex: 426
    SolutionNameMin: Cijk_Ailk_Bjlk_HBH_MT128x64x32_MI32x32x4x2_SE_AF0EM1_GRVW8_NLCA1_NLCB1_SU0_SUS256_SRVW4_TT1_32_WG128_2_1_WGM1
    SolutionIndex: 427
    SolutionNameMin: Cijk_Ailk_Bjlk_HBH_MT128x128x64_MI32x32x8x1_SE_AF0EM1_GRVW8_NLCA1_NLCB1_SU16_SUS256_SRVW4_TT2_64_WG64_4_1_WGM15
    SolutionIndex: 428
    SolutionNameMin: Cijk_Ailk_Bjlk_HBH_MT32x32x128_MI16x16x16x1_SE_AF0EM4_GRVW2_NLCA1_NLCB1_SU0_SUS256_SRVW4_TT1_16_WG32_8_1_WGM2
    SolutionIndex: 429
    SolutionNameMin: Cijk_Ailk_Bjlk_HBH_MT128x128x16_MI32x32x8x1_SE_AF0EM4_GRVW8_NLCA1_NLCB1_SU16_SUS128_SRVW4_TT2_64_WG64_4_1_WGM15
    SolutionIndex: 430
    SolutionNameMin: Cijk_Ailk_Bjlk_HBH_MT128x96x32_MI32x32x8x1_SE_AF0EM4_GRVW4_NLCA1_NLCB3_SU0_SUS256_SRVW0_TT1_96_WG128_2_1_WGM15
    SolutionIndex: 431
    SolutionNameMin: Cijk_Ailk_Bjlk_HBH_MT128x128x32_MI32x32x8x1_SE_AF0EM4_GRVW8_NLCA1_NLCB1_SU0_SUS256_SRVW4_TT2_64_WG64_4_1_WGM1
    SolutionIndex: 432
    SolutionNameMin: Cijk_Ailk_Bjlk_HBH_MT256x256x16_MI32x32x4x2_SE_AF0EM4_GRVW8_NLCA1_NLCB1_SU0_SUS256_SRVW4_TT2_128_WG128_2_1_WGM2
    SolutionIndex: 433
    SolutionNameMin: Cijk_Ailk_Bjlk_HBH_MT128x288x32_MI32x32x8x1_SE_AF0EM4_GRVW4_NLCA1_NLCB9_SU0_SUS256_SRVW4_TT1_288_WG128_2_1_WGM2
    SolutionIndex: 434
    SolutionNameMin: Cijk_Ailk_Bjlk_HBH_MT64x64x32_MI32x32x8x1_SE_AF0EM4_GRVW4_NLCA1_NLCB1_SU16_SUS128_SRVW4_TT1_32_WG64_4_1_WGM15
    SolutionIndex: 435
    SolutionNameMin: Cijk_Ailk_Bjlk_HBH_MT256x128x32_MI32x32x4x2_SE_AF0EM4_GRVW8_NLCA1_NLCB1_SU32_SUS256_SRVW4_TT2_64_WG128_2_1_WGM15
    SolutionIndex: 436
    SolutionNameMin: Cijk_Ailk_Bjlk_HBH_MT64x128x16_MI32x32x4x2_SE_AF0EM4_GRVW8_NLCA1_NLCB1_SU32_SUS256_SRVW4_TT1_32_WG64_4_1_WGM2
    SolutionIndex: 437
    SolutionNameMin: Cijk_Ailk_Bjlk_HBH_MT32x64x128_MI16x16x16x1_SE_AF0EM4_GRVW8_NLCA1_NLCB1_SU32_SUS256_SRVW0_TT1_32_WG32_8_1_WGM15
    SolutionIndex: 438
    SolutionNameMin: Cijk_Ailk_Bjlk_HBH_MT64x32x16_MI16x16x16x1_SE_AF0EM4_GRVW2_NLCA1_NLCB1_SU32_SUS128_SRVW0_TT2_16_WG32_8_1_WGM1
    SolutionIndex: 439
    SolutionNameMin: Cijk_Ailk_Bjlk_HBH_MT64x32x16_MI16x16x16x1_SE_AF0EM4_GRVW2_NLCA1_NLCB1_SU16_SUS256_SRVW0_TT2_16_WG32_8_1_WGM2
    SolutionIndex: 440
    SolutionNameMin: Cijk_Ailk_Bjlk_HBH_MT256x128x32_MI32x32x8x1_SE_AF0EM4_GRVW8_NLCA1_NLCB1_SU0_SUS256_SRVW4_TT4_64_WG64_4_1_WGM15
    SolutionIndex: 441
    SolutionNameMin: Cijk_Ailk_Bjlk_HBH_MT64x64x32_MI32x32x8x1_SE_AF0EM1_GRVW2_NLCA1_NLCB1_SU16_SUS256_SRVW4_TT1_32_WG64_4_1_WGM1
    SolutionIndex: 442
    SolutionNameMin: Cijk_Ailk_Bjlk_HBH_MT256x256x32_MI32x32x8x1_SE_AF0EM4_GRVW8_NLCA1_NLCB1_SU32_SUS128_SRVW4_TT4_128_WG64_4_1_WGM1
    SolutionIndex: 443
    SolutionNameMin: Cijk_Ailk_Bjlk_HBH_MT256x144x32_MI16x16x16x1_SE_AF0EM4_GRVW2_NLCA2_NLCB9_SU0_SUS256_SRVW0_TT4_144_WG64_4_1_WGM1
    SolutionIndex: 444
    SolutionNameMin: Cijk_Ailk_Bjlk_HBH_MT128x256x16_MI32x32x8x1_SE_AF0EM1_GRVW8_NLCA1_NLCB1_SU16_SUS128_SRVW4_TT2_128_WG64_4_1_WGM15
    SolutionIndex: 445
    SolutionNameMin: Cijk_Ailk_Bjlk_HBH_MT32x64x16_MI16x16x16x1_SE_AF0EM1_GRVW8_NLCA1_NLCB1_SU0_SUS256_SRVW0_TT1_32_WG32_8_1_WGM2
    SolutionIndex: 446
    SolutionNameMin: Cijk_Ailk_Bjlk_HBH_MT32x32x16_MI16x16x16x1_SE_AF0EM4_GRVW2_NLCA1_NLCB1_SU16_SUS128_SRVW0_TT1_16_WG32_8_1_WGM1
    SolutionIndex: 447
    SolutionNameMin: Cijk_Ailk_Bjlk_HBH_MT128x96x64_MI32x32x8x1_SE_AF0EM4_GRVW8_NLCA1_NLCB3_SU32_SUS128_SRVW4_TT1_96_WG128_2_1_WGM2
    SolutionIndex: 448
    SolutionNameMin: Cijk_Ailk_Bjlk_HBH_MT128x96x64_MI32x32x8x1_SE_AF0EM4_GRVW4_NLCA1_NLCB3_SU32_SUS256_SRVW4_TT1_96_WG128_2_1_WGM2
    SolutionIndex: 449
    SolutionNameMin: Cijk_Ailk_Bjlk_HBH_MT128x96x16_MI32x32x8x1_SE_AF0EM4_GRVW2_NLCA1_NLCB3_SU0_SUS256_SRVW4_TT1_96_WG128_2_1_WGM2
    SolutionIndex: 450
    SolutionNameMin: Cijk_Ailk_Bjlk_HBH_MT32x64x16_MI16x16x16x1_SE_AF0EM1_GRVW2_NLCA1_NLCB1_SU16_SUS256_SRVW4_TT1_32_WG32_8_1_WGM15
    SolutionIndex: 451
    SolutionNameMin: Cijk_Ailk_Bjlk_HBH_MT64x64x64_MI32x32x8x1_SE_AF0EM4_GRVW8_NLCA1_NLCB1_SU32_SUS256_SRVW4_TT1_32_WG64_4_1_WGM1
    SolutionIndex: 452
    SolutionNameMin: Cijk_Ailk_Bjlk_HBH_MT64x64x64_MI32x32x8x1_SE_AF0EM4_GRVW8_NLCA1_NLCB1_SU0_SUS256_SRVW4_TT1_32_WG64_4_1_WGM15
    SolutionIndex: 453
    SolutionNameMin: Cijk_Ailk_Bjlk_HBH_MT64x64x32_MI32x32x8x1_SE_AF0EM4_GRVW8_NLCA1_NLCB1_SU0_SUS256_SRVW4_TT1_32_WG64_4_1_WGM15
    SolutionIndex: 454
    SolutionNameMin: Cijk_Ailk_Bjlk_HBH_MT64x64x64_MI32x32x8x1_SE_AF0EM4_GRVW8_NLCA1_NLCB1_SU16_SUS256_SRVW4_TT1_32_WG64_4_1_WGM1
    SolutionIndex: 455
    SolutionNameMin: Cijk_Ailk_Bjlk_HBH_MT64x64x128_MI32x32x8x1_SE_AF0EM1_GRVW8_NLCA1_NLCB1_SU32_SUS256_SRVW4_TT1_32_WG64_4_1_WGM15
    SolutionIndex: 456
    SolutionNameMin: Cijk_Ailk_Bjlk_HBH_MT64x64x16_MI32x32x8x1_SE_AF0EM4_GRVW8_NLCA1_NLCB1_SU0_SUS256_SRVW4_TT1_32_WG64_4_1_WGM1
    SolutionIndex: 457
    SolutionNameMin: Cijk_Ailk_Bjlk_HBH_MT128x128x64_MI32x32x8x1_SE_AF0EM4_GRVW4_NLCA1_NLCB1_SU0_SUS256_SRVW4_TT2_64_WG64_4_1_WGM15
    SolutionIndex: 458
    SolutionNameMin: Cijk_Ailk_Bjlk_HBH_MT128x64x32_MI32x32x8x1_SE_AF0EM1_GRVW8_NLCA1_NLCB1_SU0_SUS256_SRVW4_TT2_32_WG64_4_1_WGM2
    SolutionIndex: 459
    SolutionNameMin: Cijk_Ailk_Bjlk_HBH_MT32x32x128_MI16x16x16x1_SE_AF0EM4_GRVW4_NLCA1_NLCB1_SU0_SUS256_SRVW0_TT1_16_WG32_8_1_WGM15
    SolutionIndex: 460
    SolutionNameMin: Cijk_Ailk_Bjlk_HBH_MT64x64x32_MI32x32x8x1_SE_AF0EM4_GRVW8_NLCA1_NLCB1_SU32_SUS256_SRVW4_TT1_32_WG64_4_1_WGM15
    SolutionIndex: 461
    SolutionNameMin: Cijk_Ailk_Bjlk_HBH_MT128x64x32_MI32x32x8x1_SE_AF0EM4_GRVW4_NLCA1_NLCB1_SU0_SUS256_SRVW4_TT2_32_WG64_4_1_WGM1
    SolutionIndex: 462
    SolutionNameMin: Cijk_Ailk_Bjlk_HBH_MT64x64x64_MI32x32x8x1_SE_AF0EM1_GRVW8_NLCA1_NLCB1_SU32_SUS128_SRVW4_TT1_32_WG64_4_1_WGM2
    SolutionIndex: 463
    SolutionNameMin: Cijk_Ailk_Bjlk_HBH_MT128x128x32_MI32x32x8x1_SE_AF0EM4_ASBE01_GRVW4_PBD0_SRVW4_TT2_64_WG64_4_1_WGM1
    SolutionIndex: 464
    SolutionNameMin: Cijk_Ailk_Bjlk_HBH_MT64x64x64_MI32x32x8x1_SE_AF0EM1_ASBE01_GRVW2_PBD0_SRVW4_TT1_32_WG64_4_1_WGM120
    SolutionIndex: 465
    SolutionNameMin: Cijk_Ailk_Bjlk_HBH_MT128x128x32_MI32x32x8x1_SE_AF0EM8_ASBE01_GRVW8_PBD0_SRVW4_TT2_64_WG64_4_1_WGM10
    SolutionIndex: 466
    SolutionNameMin: Cijk_Ailk_Bjlk_HBH_MT64x64x32_MI32x32x8x1_SE_AF0EM1_ASBE01_GRVW4_PBD0_SRVW4_TT1_32_WG64_4_1_WGM1
    SolutionIndex: 467
    SolutionNameMin: Cijk_Ailk_Bjlk_HBH_MT64x64x32_MI16x16x16x1_SE_AF0EM1_ASBE01_GRVW2_PBD0_SRVW4_TT2_32_WG32_8_1_WGM1
    SolutionIndex: 468
    SolutionNameMin: Cijk_Ailk_Bjlk_HBH_MT128x128x32_MI32x32x8x1_SE_AF0EM1_ASBE01_GRVW4_PBD0_SRVW4_TT2_64_WG64_4_1_WGM10
    SolutionIndex: 469
    SolutionNameMin: Cijk_Ailk_Bjlk_HBH_MT64x128x32_MI32x32x8x1_SE_AF0EM8_ASBE01_GRVW8_PBD0_SRVW4_TT2_32_WG32_8_1_WGM120
    SolutionIndex: 470
    SolutionNameMin: Cijk_Ailk_Bjlk_HBH_MT64x128x32_MI32x32x4x2_SE_AF0EM1_ASBE01_GRVW4_PBD0_SRVW4_TT1_32_WG64_4_1_WGM1
    SolutionIndex: 471
    SolutionNameMin: Cijk_Ailk_Bjlk_HBH_MT128x128x32_MI32x32x8x1_SE_AF0EM8_ASBE01_GRVW8_PBD0_SRVW4_TT2_64_WG64_4_1_WGM1
    SolutionIndex: 472
    SolutionNameMin: Cijk_Ailk_Bjlk_HBH_MT64x64x32_MI32x32x8x1_SE_AF0EM1_ASBE01_GRVW2_PBD0_SRVW4_TT1_32_WG64_4_1_WGM10
    SolutionIndex: 473
    SolutionNameMin: Cijk_Ailk_Bjlk_HBH_MT64x128x32_MI32x32x8x1_SE_AF0EM8_ASBE01_GRVW8_PBD0_SRVW4_TT2_32_WG32_8_1_WGM10
    SolutionIndex: 474
    SolutionNameMin: Cijk_Ailk_Bjlk_HBH_MT64x128x32_MI32x32x4x2_SE_AF0EM4_ASBE01_GRVW4_PBD0_SRVW4_TT1_32_WG64_4_1_WGM120
    SolutionIndex: 475
    SolutionNameMin: Cijk_Ailk_Bjlk_HBH_MT128x256x32_MI32x32x4x2_SE_AF0EM4_ASBE01_GRVW4_PBD0_SRVW4_TT2_64_WG64_4_1_WGM120
    SolutionIndex: 476
    SolutionNameMin: Cijk_Ailk_Bjlk_HBH_MT64x64x32_MI32x32x8x1_SE_AF0EM1_ASBE01_GRVW4_PBD0_SRVW4_TT1_32_WG64_4_1_WGM10
    SolutionIndex: 477
    SolutionNameMin: Cijk_Ailk_Bjlk_HBH_MT64x128x32_MI32x32x4x2_SE_AF0EM8_ASBE01_GRVW8_PBD0_SRVW4_TT1_32_WG64_4_1_WGM1
    SolutionIndex: 478
    SolutionNameMin: Cijk_Ailk_Bjlk_HBH_MT64x64x32_MI32x32x8x1_SE_AF0EM1_ASBE01_GRVW2_PBD0_SRVW4_TT1_32_WG64_4_1_WGM120
    SolutionIndex: 479
    SolutionNameMin: Cijk_Ailk_Bjlk_HBH_MT128x128x32_MI32x32x8x1_SE_AF0EM4_ASBE01_GRVW4_PBD0_SRVW4_TT2_64_WG64_4_1_WGM10
    SolutionIndex: 480
    SolutionNameMin: Cijk_Ailk_Bjlk_HBH_MT64x64x32_MI32x32x8x1_SE_AF0EM4_ASBE01_GRVW4_PBD0_SRVW4_TT1_32_WG64_4_1_WGM120
    SolutionIndex: 481
    SolutionNameMin: Cijk_Ailk_Bjlk_HBH_MT128x128x32_MI32x32x8x1_SE_AF0EM8_ASBE01_GRVW8_PBD0_SRVW4_TT2_64_WG64_4_1_WGM120
    SolutionIndex: 482
    SolutionNameMin: Cijk_Ailk_Bjlk_HBH_MT128x128x32_MI32x32x8x1_SE_AF0EM1_ASBE01_GRVW4_PBD0_SRVW4_TT2_64_WG64_4_1_WGM120
    SolutionIndex: 483
    SolutionNameMin: Cijk_Ailk_Bjlk_HBH_MT64x64x32_MI32x32x8x1_SE_AF0EM1_ASBE01_GRVW4_PBD0_SRVW4_TT1_32_WG64_4_1_WGM120
    SolutionIndex: 484
    SolutionNameMin: Cijk_Ailk_Bjlk_HBH_MT128x128x32_MI32x32x8x1_SE_AF0EM1_ASBE01_GRVW2_PBD0_SRVW4_TT2_64_WG64_4_1_WGM10
    SolutionIndex: 485
    SolutionNameMin: Cijk_Ailk_Bjlk_HBH_MT128x128x32_MI32x32x8x1_SE_AF0EM1_ASBE01_GRVW2_PBD0_SRVW4_TT2_64_WG64_4_1_WGM1
    SolutionIndex: 486
    SolutionNameMin: Cijk_Ailk_Bjlk_HBH_MT64x64x32_MI32x32x8x1_SE_AF0EM4_ASBE01_GRVW4_PBD0_SRVW4_TT1_32_WG64_4_1_WGM1
    SolutionIndex: 487
    SolutionNameMin: Cijk_Ailk_Bjlk_HBH_MT64x128x32_MI32x32x8x1_SE_AF0EM4_ASBE01_GRVW4_PBD0_SRVW4_TT2_32_WG32_8_1_WGM1
    SolutionIndex: 488
    SolutionNameMin: Cijk_Ailk_Bjlk_HBH_MT128x128x32_MI32x32x8x1_SE_AF0EM4_ASBE01_GRVW2_PBD0_SRVW4_TT2_64_WG64_4_1_WGM10
    SolutionIndex: 489
    SolutionNameMin: Cijk_Ailk_Bjlk_HBH_MT64x64x64_MI32x32x8x1_SE_AF0EM1_ASBE01_GRVW4_PBD0_SRVW4_TT1_32_WG64_4_1_WGM120
    SolutionIndex: 490
    SolutionNameMin: Cijk_Ailk_Bjlk_HBH_MT64x64x32_MI32x32x8x1_SE_AF0EM8_ASBE01_GRVW8_PBD0_SRVW4_TT1_32_WG64_4_1_WGM10
    SolutionIndex: 491
    SolutionNameMin: Cijk_Ailk_Bjlk_HBH_MT64x64x32_MI32x32x8x1_SE_AF0EM8_ASBE01_GRVW8_PBD0_SRVW4_TT1_32_WG64_4_1_WGM1
    SolutionIndex: 492
    SolutionNameMin: Cijk_Ailk_Bjlk_HBH_MT64x128x32_MI32x32x4x2_SE_AF0EM8_ASBE01_GRVW2_PBD0_SRVW4_TT1_32_WG64_4_1_WGM1
    SolutionIndex: 493
    SolutionNameMin: Cijk_Ailk_Bjlk_HBH_MT64x128x32_MI32x32x4x2_SE_AF0EM8_ASBE01_GRVW4_PBD0_SRVW4_TT1_32_WG64_4_1_WGM10
    SolutionIndex: 494
    SolutionNameMin: Cijk_Ailk_Bjlk_HBH_MT64x64x32_MI16x16x16x1_SE_AF0EM1_ASBE01_GRVW2_PBD0_SRVW4_TT2_32_WG32_8_1_WGM120
    SolutionIndex: 495
    SolutionNameMin: Cijk_Ailk_Bjlk_HBH_MT64x64x32_MI32x32x8x1_SE_AF0EM4_ASBE01_GRVW2_PBD0_SRVW4_TT1_32_WG64_4_1_WGM120
    SolutionIndex: 496
    SolutionNameMin: Cijk_Ailk_Bjlk_HBH_MT64x128x32_MI32x32x4x2_SE_AF0EM1_ASBE01_GRVW2_PBD0_SRVW4_TT1_32_WG64_4_1_WGM1
    SolutionIndex: 497
    SolutionNameMin: Cijk_Ailk_Bjlk_HBH_MT64x128x32_MI32x32x8x1_SE_AF0EM4_ASBE01_GRVW2_PBD0_SRVW4_TT2_32_WG32_8_1_WGM120
- - - [64, 448, 1, 3328]
    - [10, 1.084]
  - - [1, 64, 1, 256]
    - [20, 0.0]
  - - [3584, 64, 1, 1280]
    - [17, 4.354]
  - - [64, 128, 1, 256]
    - [1, 0.158]
  - - [64, 5888, 1, 1280]
    - [17, 5.261]
  - - [64, 4288, 1, 1280]
    - [18, 4.395]
  - - [3584, 64, 1, 3328]
    - [17, 4.663]
  - - [64, 1024, 1, 3328]
    - [18, 2.468]
  - - [1, 64, 1, 1280]
    - [22, 0.001]
  - - [704, 64, 1, 3328]
    - [10, 1.617]
  - - [64, 448, 1, 1280]
    - [6, 0.993]
  - - [64, 704, 1, 3328]
    - [11, 1.645]
  - - [64, 64, 1, 1280]
    - [9, 0.136]
  - - [64, 5056, 1, 256]
    - [0, 3.674]
  - - [64, 4288, 1, 3328]
    - [17, 4.673]
  - - [1856, 64, 1, 3328]
    - [18, 4.101]
  - - [1, 64, 1, 1]
    - [19, 0.0]
  - - [448, 64, 1, 1280]
    - [5, 0.993]
  - - [5888, 64, 1, 1280]
    - [17, 5.218]
  - - [2944, 64, 1, 256]
    - [1, 2.931]
  - - [64, 1856, 1, 256]
    - [12, 2.453]
  - - [64, 1024, 1, 1280]
    - [18, 2.295]
  - - [64, 256, 1, 1280]
    - [10, 0.582]
  - - [704, 64, 1, 1280]
    - [3, 1.405]
  - - [64, 128, 1, 1280]
    - [5, 0.264]
  - - [2368, 64, 1, 256]
    - [5, 2.593]
  - - [2368, 64, 1, 3328]
    - [18, 3.966]
  - - [64, 1408, 1, 3328]
    - [11, 3.118]
  - - [1856, 64, 1, 1280]
    - [18, 3.63]
  - - [64, 3584, 1, 1280]
    - [4, 4.504]
  - - [448, 64, 1, 3328]
    - [10, 1.085]
  - - [5888, 64, 1, 3328]
    - [17, 5.505]
  - - [128, 64, 1, 256]
    - [16, 0.158]
  - - [64, 128, 1, 3328]
    - [6, 0.295]
  - - [64, 256, 1, 3328]
    - [13, 0.619]
  - - [4288, 64, 1, 3328]
    - [17, 4.645]
  - - [64, 2944, 1, 256]
    - [16, 3.113]
  - - [6784, 64, 1, 256]
    - [17, 4.464]
  - - [1024, 64, 1, 1280]
    - [18, 2.336]
  - - [64, 2368, 1, 1280]
    - [6, 3.751]
  - - [64, 3584, 1, 3328]
    - [17, 4.657]
  - - [64, 6784, 1, 3328]
    - [17, 5.581]
  - - [3584, 64, 1, 256]
    - [17, 3.271]
  - - [64, 1856, 1, 3328]
    - [18, 4.079]
  - - [448, 64, 1, 256]
    - [5, 0.63]
  - - [64, 5056, 1, 3328]
    - [17, 5.401]
  - - [256, 64, 1, 256]
    - [1, 0.381]
  - - [4288, 64, 1, 1280]
    - [17, 4.516]
  - - [1, 1, 1, 1]
    - [21, 0.0]
  - - [5056, 64, 1, 1280]
    - [18, 5.161]
  - - [1024, 64, 1, 3328]
    - [17, 2.43]
  - - [1408, 64, 1, 256]
    - [16, 1.877]
  - - [64, 1408, 1, 256]
    - [7, 1.91]
  - - [64, 2368, 1, 3328]
    - [6, 3.973]
  - - [64, 448, 1, 256]
    - [5, 0.66]
  - - [64, 6784, 1, 1280]
    - [18, 5.345]
  - - [64, 1856, 1, 1280]
    - [14, 3.63]
  - - [64, 6784, 1, 256]
    - [17, 4.426]
  - - [64, 5056, 1, 1280]
    - [18, 5.047]
  - - [64, 4288, 1, 256]
    - [16, 3.497]
  - - [128, 64, 1, 1280]
    - [5, 0.258]
  - - [5888, 64, 1, 256]
    - [16, 3.858]
  - - [64, 5888, 1, 3328]
    - [17, 5.567]
  - - [64, 1024, 1, 256]
    - [11, 1.427]
  - - [5056, 64, 1, 3328]
    - [17, 5.504]
  - - [256, 64, 1, 1280]
    - [10, 0.574]
  - - [64, 256, 1, 256]
    - [5, 0.374]
  - - [704, 64, 1, 256]
    - [5, 0.981]
  - - [64, 1408, 1, 1280]
    - [18, 2.894]
  - - [1, 1, 1, 256]
    - [20, 0.0]
  - - [64, 704, 1, 256]
    - [8, 1.009]
  - - [64, 2944, 1, 3328]
    - [18, 4.919]
  - - [64, 64, 1, 256]
    - [1, 0.08]
  - - [1856, 64, 1, 256]
    - [17, 2.541]
  - - [128, 64, 1, 3328]
    - [17, 0.294]
  - - [2944, 64, 1, 1280]
    - [17, 4.434]
  - - [4288, 64, 1, 256]
    - [18, 3.424]
  - - [1, 1, 1, 1280]
    - [22, 0.0]
  - - [64, 2944, 1, 1280]
    - [18, 4.634]
  - - [1408, 64, 1, 1280]
    - [18, 2.902]
  - - [6784, 64, 1, 3328]
    - [17, 5.551]
  - - [1024, 64, 1, 256]
    - [18, 1.555]
  - - [64, 2368, 1, 256]
    - [7, 2.71]
  - - [64, 3584, 1, 256]
    - [2, 3.351]
  - - [2944, 64, 1, 3328]
    - [18, 4.911]
  - - [2368, 64, 1, 1280]
    - [5, 3.667]
  - - [256, 64, 1, 3328]
    - [10, 0.62]
  - - [64, 64, 1, 3328]
    - [17, 0.152]
  - - [1, 1, 1, 3328]
    - [22, 0.0]
  - - [64, 5888, 1, 256]
    - [17, 4.104]
  - - [64, 704, 1, 1280]
    - [13, 1.483]
  - - [6784, 64, 1, 1280]
    - [17, 5.269]
  - - [5056, 64, 1, 256]
    - [15, 3.461]
  - - [1408, 64, 1, 3328]
    - [18, 3.091]
  - - [4096, 7133, 1, 4096]
    - [31, 14.1]
  - - [512, 16, 1, 512]
    - [26, 0.198]
  - - [2048, 7133, 1, 2048]
    - [29, 13.977]
  - - [2560, 7133, 1, 2560]
    - [30, 13.724]
  - - [1024, 1024, 1, 1024]
    - [375, 30.635]
  - - [3072, 7435, 1, 1024]
    - [29, 13.851]
  - - [1024, 32, 1, 512]
    - [23, 0.674]
  - - [1760, 7133, 1, 1760]
    - [30, 13.094]
  - - [7680, 5481, 1, 2560]
    - [29, 13.968]
  - - [1024, 16, 1, 512]
    - [23, 0.333]
  - - [512, 32, 1, 512]
    - [25, 0.387]
  - - [3136, 256, 64, 64]
    - [471, 30.081]
  - - [784, 512, 64, 128]
    - [471, 38.515]
  - - [784, 128, 64, 512]
    - [465, 48.616]
  - - [3136, 64, 128, 64]
    - [49, 11.517]
  - - [196, 256, 128, 1024]
    - [45, 13.29]
  - - [196, 256, 64, 1024]
    - [488, 33.78]
  - - [196, 1024, 128, 256]
    - [45, 12.602]
  - - [784, 128, 256, 512]
    - [44, 16.038]
  - - [3136, 64, 64, 256]
    - [491, 30.052]
  - - [3136, 64, 256, 256]
    - [47, 15.705]
  - - [3136, 256, 256, 64]
    - [51, 14.128]
  - - [3136, 64, 128, 256]
    - [50, 15.605]
  - - [784, 128, 128, 512]
    - [44, 15.875]
  - - [784, 512, 128, 128]
    - [44, 14.414]
  - - [784, 512, 256, 128]
    - [46, 14.421]
  - - [196, 1024, 64, 256]
    - [463, 35.741]
  - - [3136, 64, 64, 64]
    - [486, 19.137]
  - - [196, 1024, 256, 256]
    - [48, 12.724]
  - - [196, 256, 256, 1024]
    - [45, 13.524]
  - - [3136, 256, 128, 64]
    - [50, 13.599]
  - - [3136, 64, 256, 64]
    - [49, 11.71]
  - - [14, 64, 1, 14]
    - [60, 0.001]
  - - [15, 64, 1, 14]
    - [60, 0.001]
  - - [15, 64, 1, 15]
    - [60, 0.001]
  - - [15, 64, 1, 15]
    - [60, 0.001]
  - - [17, 64, 1, 15]
    - [60, 0.002]
  - - [17, 64, 1, 17]
    - [60, 0.002]
  - - [17, 64, 1, 17]
    - [60, 0.002]
  - - [21, 64, 1, 17]
    - [66, 0.003]
  - - [21, 64, 1, 21]
    - [60, 0.003]
  - - [24, 64, 1, 24]
    - [60, 0.004]
  - - [30, 64, 1, 30]
    - [86, 0.007]
  - - [30, 64, 1, 31]
    - [66, 0.007]
  - - [31, 64, 1, 31]
    - [68, 0.007]
  - - [32, 64, 1, 32]
    - [66, 0.007]
  - - [32, 64, 1, 35]
    - [63, 0.007]
  - - [34, 64, 1, 24]
    - [87, 0.007]
  - - [34, 64, 1, 34]
    - [66, 0.008]
  - - [35, 64, 1, 35]
    - [74, 0.008]
  - - [64, 14, 1, 14]
    - [60, 0.001]
  - - [64, 15, 1, 14]
    - [61, 0.001]
  - - [64, 15, 1, 15]
    - [61, 0.001]
  - - [64, 15, 1, 15]
    - [61, 0.001]
  - - [64, 17, 1, 15]
    - [60, 0.001]
  - - [64, 17, 1, 17]
    - [75, 0.002]
  - - [64, 17, 1, 17]
    - [65, 0.002]
  - - [64, 21, 1, 17]
    - [61, 0.002]
  - - [64, 21, 1, 21]
    - [61, 0.003]
  - - [64, 24, 1, 24]
    - [61, 0.004]
  - - [64, 30, 1, 30]
    - [62, 0.005]
  - - [64, 30, 1, 31]
    - [61, 0.005]
  - - [64, 31, 1, 31]
    - [64, 0.006]
  - - [64, 32, 1, 32]
    - [63, 0.007]
  - - [64, 32, 1, 35]
    - [65, 0.007]
  - - [64, 34, 1, 24]
    - [61, 0.005]
  - - [64, 34, 1, 34]
    - [62, 0.007]
  - - [64, 35, 1, 35]
    - [62, 0.007]
  - - [64, 128, 512, 128]
    - [441, 17.325]
  - - [64, 512, 1, 512]
    - [459, 1.586]
  - - [64, 512, 64, 512]
    - [279, 27.682]
  - - [128, 64, 512, 128]
    - [330, 17.147]
  - - [512, 64, 1, 512]
    - [265, 1.539]
  - - [512, 64, 64, 512]
    - [351, 27.99]
  - - [1024, 2, 1, 4]
    - [245, 0.001]
  - - [1024, 2, 1, 32]
    - [292, 0.011]
  - - [1024, 2, 1, 2048]
    - [366, 0.175]
  - - [1024, 1024, 1, 4]
    - [290, 0.523]
  - - [1024, 1024, 1, 32]
    - [456, 4.361]
  - - [1024, 1024, 1, 2048]
    - [421, 38.062]
  - - [1024, 1024, 1, 4096]
    - [448, 43.406]
  - - [1024, 4096, 1, 2048]
    - [269, 62.51]
  - - [1024, 4096, 1, 4096]
    - [234, 64.054]
  - - [1024, 30528, 1, 2048]
    - [232, 85.201]
  - - [1024, 30528, 1, 4096]
    - [232, 90.689]
  - - [4096, 1024, 1, 2048]
    - [260, 54.426]
  - - [4096, 1024, 1, 4096]
    - [259, 57.195]
  - - [3, 64, 512, 3]
    - [335, 0.033]
  - - [5, 64, 512, 5]
    - [335, 0.088]
  - - [5, 64, 960, 5]
    - [255, 0.123]
  - - [9, 64, 512, 9]
    - [335, 0.282]
  - - [13, 512, 1, 32768]
    - [362, 0.753]
  - - [27, 128, 32768, 27]
    - [450, 5.316]
  - - [33, 32, 200, 33]
    - [308, 0.858]
  - - [33, 32, 1600, 33]
    - [299, 2.545]
  - - [67, 2048, 1, 512]
    - [379, 5.177]
  - - [74, 2048, 1, 512]
    - [379, 5.763]
  - - [74, 2048, 1, 960]
    - [379, 7.243]
  - - [100, 2048, 1, 512]
    - [381, 6.767]
  - - [256, 128, 1, 32768]
    - [294, 3.934]
  - - [256, 1280, 1, 8976]
    - [238, 25.416]
  - - [256, 2560, 1, 8976]
    - [244, 36.361]
  - - [256, 2816, 1, 8976]
    - [404, 39.997]
  - - [256, 3328, 1, 8976]
    - [344, 43.086]
  - - [256, 3584, 1, 8976]
    - [334, 45.018]
  - - [256, 3840, 1, 8976]
    - [397, 44.088]
  - - [256, 4096, 1, 8976]
    - [236, 44.893]
  - - [256, 4352, 1, 8976]
    - [236, 48.44]
  - - [256, 4864, 1, 8976]
    - [339, 51.601]
  - - [256, 5120, 1, 8976]
    - [343, 54.614]
  - - [256, 5632, 1, 8976]
    - [301, 59.368]
  - - [256, 5888, 1, 8976]
    - [343, 61.915]
  - - [256, 6144, 1, 8976]
    - [457, 61.942]
  - - [256, 7168, 1, 8976]
    - [301, 64.279]
  - - [256, 8192, 1, 8976]
    - [364, 54.07]
  - - [256, 8960, 1, 8976]
    - [349, 59.652]
  - - [256, 9728, 1, 8976]
    - [360, 59.48]
  - - [256, 9984, 1, 8976]
    - [333, 59.031]
  - - [256, 10240, 1, 8976]
    - [430, 61.049]
  - - [256, 10496, 1, 8976]
    - [298, 61.838]
  - - [256, 11008, 1, 8976]
    - [368, 64.641]
  - - [256, 11264, 1, 8976]
    - [318, 66.036]
  - - [256, 11520, 1, 8976]
    - [298, 67.445]
  - - [256, 11776, 1, 8976]
    - [298, 68.963]
  - - [256, 12544, 1, 8976]
    - [298, 73.182]
  - - [256, 12800, 1, 8976]
    - [412, 74.513]
  - - [256, 13312, 1, 8976]
    - [298, 77.536]
  - - [256, 13568, 1, 8976]
    - [318, 78.899]
  - - [256, 14336, 1, 8976]
    - [425, 82.805]
  - - [256, 14848, 1, 8976]
    - [425, 85.877]
  - - [256, 15104, 1, 8976]
    - [425, 87.078]
  - - [256, 15872, 1, 8976]
    - [433, 79.541]
  - - [256, 16128, 1, 8976]
    - [269, 81.127]
  - - [256, 17152, 1, 8976]
    - [269, 85.281]
  - - [256, 17408, 1, 8976]
    - [411, 63.459]
  - - [256, 18688, 1, 8976]
    - [251, 67.872]
  - - [256, 19968, 1, 8976]
    - [343, 68.168]
  - - [256, 20480, 1, 8976]
    - [260, 67.733]
  - - [256, 20992, 1, 8976]
    - [277, 69.835]
  - - [256, 21248, 1, 8976]
    - [249, 69.167]
  - - [256, 22016, 1, 8976]
    - [277, 70.609]
  - - [256, 26112, 1, 8976]
    - [314, 79.209]
  - - [256, 32512, 1, 8976]
    - [337, 82.145]
  - - [256, 32768, 1, 1]
    - [310, 0.416]
  - - [256, 33536, 1, 8976]
    - [269, 84.733]
  - - [256, 44505, 1, 8976]
    - [435, 85.199]
  - - [257, 4096, 1, 1024]
    - [350, 24.604]
  - - [480, 1024, 1, 32768]
    - [402, 30.511]
  - - [512, 32, 1, 200]
    - [275, 0.341]
  - - [512, 32, 1, 1600]
    - [248, 1.095]
  - - [512, 256, 1, 32768]
    - [437, 12.584]
  - - [512, 512, 1, 200]
    - [374, 4.907]
  - - [512, 512, 1, 1600]
    - [462, 13.87]
  - - [512, 2048, 1, 256]
    - [453, 19.626]
  - - [560, 1024, 1, 200]
    - [336, 8.256]
  - - [560, 1024, 1, 1600]
    - [451, 24.603]
  - - [768, 2048, 1, 256]
    - [322, 24.791]
  - - [1024, 64, 1, 512]
    - [248, 3.019]
  - - [1024, 64, 1, 960]
    - [312, 3.848]
  - - [1024, 256, 1, 1024]
    - [358, 12.254]
  - - [1024, 256, 1, 1280]
    - [274, 13.772]
  - - [1024, 256, 1, 2304]
    - [373, 16.674]
  - - [1024, 256, 1, 2816]
    - [291, 18.979]
  - - [1024, 256, 1, 3072]
    - [373, 19.373]
  - - [1024, 256, 1, 3328]
    - [304, 19.486]
  - - [1024, 256, 1, 3584]
    - [323, 19.626]
  - - [1024, 256, 1, 4096]
    - [400, 19.898]
  - - [1024, 256, 1, 4352]
    - [291, 20.144]
  - - [1024, 256, 1, 4608]
    - [455, 20.223]
  - - [1024, 256, 1, 5120]
    - [240, 20.659]
  - - [1024, 256, 1, 5376]
    - [274, 20.934]
  - - [1024, 256, 1, 5632]
    - [274, 20.966]
  - - [1024, 256, 1, 6144]
    - [274, 21.44]
  - - [1024, 256, 1, 6400]
    - [274, 21.391]
  - - [1024, 256, 1, 7680]
    - [291, 21.959]
  - - [1024, 256, 1, 7936]
    - [267, 22.352]
  - - [1024, 256, 1, 8192]
    - [357, 22.06]
  - - [1024, 256, 1, 8448]
    - [267, 22.166]
  - - [1024, 256, 1, 9728]
    - [240, 22.493]
  - - [1024, 256, 1, 9984]
    - [373, 22.533]
  - - [1024, 256, 1, 10496]
    - [357, 22.646]
  - - [1024, 256, 1, 11520]
    - [384, 22.81]
  - - [1024, 256, 1, 12032]
    - [267, 22.953]
  - - [1024, 256, 1, 13568]
    - [291, 23.195]
  - - [1024, 256, 1, 14336]
    - [240, 23.368]
  - - [1024, 256, 1, 14848]
    - [267, 23.364]
  - - [1024, 256, 1, 15104]
    - [273, 23.217]
  - - [1024, 256, 1, 15872]
    - [267, 23.33]
  - - [1024, 256, 1, 16128]
    - [267, 23.412]
  - - [1024, 256, 1, 17152]
    - [373, 23.573]
  - - [1024, 256, 1, 17408]
    - [240, 23.647]
  - - [1024, 256, 1, 18944]
    - [285, 23.711]
  - - [1024, 256, 1, 19712]
    - [267, 23.716]
  - - [1024, 256, 1, 19968]
    - [267, 23.861]
  - - [1024, 256, 1, 21248]
    - [267, 23.955]
  - - [1024, 256, 1, 21504]
    - [267, 24.012]
  - - [1024, 256, 1, 22016]
    - [291, 23.846]
  - - [1024, 256, 1, 28672]
    - [291, 24.18]
  - - [1024, 256, 1, 33536]
    - [291, 24.362]
  - - [1024, 512, 1, 32768]
    - [404, 32.441]
  - - [1024, 1024, 1, 200]
    - [460, 14.326]
  - - [1024, 1024, 1, 512]
    - [356, 24.508]
  - - [1024, 1024, 1, 960]
    - [447, 28.897]
  - - [1024, 1024, 1, 1600]
    - [369, 35.282]
  - - [1024, 1024, 1, 32768]
    - [236, 50.878]
  - - [1600, 1024, 1, 512]
    - [418, 31.782]
  - - [1600, 1024, 1, 960]
    - [339, 40.549]
  - - [2048, 256, 1, 1024]
    - [454, 21.289]
  - - [2048, 960, 1, 1]
    - [325, 0.236]
  - - [2048, 2048, 1, 512]
    - [382, 42.942]
  - - [2048, 2048, 1, 960]
    - [289, 49.001]
  - - [2048, 2048, 1, 1024]
    - [303, 50.117]
  - - [3200, 2048, 1, 1024]
    - [416, 61.692]
  - - [4096, 4096, 1, 1024]
    - [444, 66.027]
  - - [14, 64, 10880, 14]
    - [305, 1.745]
  - - [15, 64, 10880, 14]
    - [348, 1.847]
  - - [15, 64, 7680, 15]
    - [305, 1.875]
  - - [15, 64, 10880, 15]
    - [348, 1.963]
  - - [17, 64, 7680, 15]
    - [317, 2.033]
  - - [17, 64, 6144, 17]
    - [296, 1.896]
  - - [17, 64, 7680, 17]
    - [423, 2.002]
  - - [21, 64, 6144, 17]
    - [284, 2.193]
  - - [21, 64, 6144, 21]
    - [320, 2.665]
  - - [24, 64, 4736, 24]
    - [365, 4.311]
  - - [30, 64, 2048, 30]
    - [417, 3.717]
  - - [30, 64, 2048, 31]
    - [280, 3.88]
  - - [31, 64, 2048, 31]
    - [280, 3.84]
  - - [32, 64, 4608, 32]
    - [359, 7.228]
  - - [32, 64, 4608, 35]
    - [241, 5.865]
  - - [34, 64, 4736, 24]
    - [348, 3.507]
  - - [34, 64, 4736, 34]
    - [276, 4.455]
  - - [35, 64, 4608, 35]
    - [445, 4.391]
  - - [64, 14, 10880, 14]
    - [319, 2.322]
  - - [64, 15, 10880, 14]
    - [319, 2.47]
  - - [64, 15, 7680, 15]
    - [319, 2.5]
  - - [64, 15, 10880, 15]
    - [319, 2.618]
  - - [64, 17, 7680, 15]
    - [319, 2.793]
  - - [64, 17, 6144, 17]
    - [258, 2.385]
  - - [64, 17, 7680, 17]
    - [394, 2.68]
  - - [64, 21, 6144, 17]
    - [385, 2.825]
  - - [64, 21, 6144, 21]
    - [439, 3.424]
  - - [64, 24, 4736, 24]
    - [246, 4.255]
  - - [64, 30, 2048, 30]
    - [246, 4.821]
  - - [64, 30, 2048, 31]
    - [438, 4.938]
  - - [64, 31, 2048, 31]
    - [409, 4.953]
  - - [64, 32, 4608, 32]
    - [408, 7.359]
  - - [64, 32, 4608, 35]
    - [241, 5.757]
  - - [64, 34, 4736, 24]
    - [340, 4.477]
  - - [64, 34, 4736, 34]
    - [329, 5.14]
  - - [64, 35, 4608, 35]
    - [316, 5.291]
  - - [1024, 1024, 1, 3840]
    - [236, 42.482]
  - - [1024, 1024, 1, 3968]
    - [256, 43.264]
  - - [1024, 1024, 1, 6528]
    - [236, 46.42]
  - - [1024, 1024, 1, 7104]
    - [307, 46.661]
  - - [1024, 1024, 1, 7200]
    - [247, 45.232]
  - - [1024, 1024, 1, 8064]
    - [309, 46.713]
  - - [1024, 1024, 1, 8160]
    - [236, 45.574]
  - - [1024, 1024, 1, 9216]
    - [236, 47.723]
  - - [1024, 1024, 1, 9520]
    - [236, 46.384]
  - - [1024, 1024, 1, 10064]
    - [324, 46.672]
  - - [1024, 1024, 1, 10080]
    - [261, 46.071]
  - - [1024, 1024, 1, 10200]
    - [236, 46.425]
  - - [1024, 4096, 1, 3840]
    - [414, 62.646]
  - - [1024, 4096, 1, 3968]
    - [253, 63.52]
  - - [1024, 4096, 1, 6528]
    - [420, 64.706]
  - - [1024, 4096, 1, 7104]
    - [234, 65.333]
  - - [1024, 4096, 1, 7200]
    - [396, 64.983]
  - - [1024, 4096, 1, 8064]
    - [253, 66.385]
  - - [1024, 4096, 1, 8160]
    - [253, 66.853]
  - - [1024, 4096, 1, 9216]
    - [415, 65.94]
  - - [1024, 4096, 1, 9520]
    - [234, 64.751]
  - - [1024, 4096, 1, 10064]
    - [338, 65.511]
  - - [1024, 4096, 1, 10080]
    - [415, 65.085]
  - - [1024, 4096, 1, 10200]
    - [396, 64.203]
  - - [1024, 42720, 1, 3968]
    - [263, 85.505]
  - - [1024, 42720, 1, 6528]
    - [232, 87.469]
  - - [1024, 42720, 1, 7104]
    - [232, 87.601]
  - - [1024, 42720, 1, 7200]
    - [232, 87.756]
  - - [1024, 42720, 1, 9520]
    - [314, 87.638]
  - - [1024, 42720, 1, 10080]
    - [232, 88.568]
  - - [4096, 1024, 1, 3840]
    - [389, 56.942]
  - - [4096, 1024, 1, 3968]
    - [372, 57.031]
  - - [4096, 1024, 1, 6528]
    - [295, 58.716]
  - - [4096, 1024, 1, 7104]
    - [341, 59.115]
  - - [4096, 1024, 1, 7200]
    - [282, 57.162]
  - - [4096, 1024, 1, 8064]
    - [342, 59.197]
  - - [4096, 1024, 1, 8160]
    - [295, 56.941]
  - - [4096, 1024, 1, 9216]
    - [341, 59.468]
  - - [4096, 1024, 1, 9520]
    - [392, 57.215]
  - - [4096, 1024, 1, 10064]
    - [342, 57.939]
  - - [4096, 1024, 1, 10080]
    - [259, 57.828]
  - - [4096, 1024, 1, 10200]
    - [302, 57.89]
  - - [27, 64, 1920, 27]
    - [96, 2.881]
  - - [27, 64, 1920, 33]
    - [111, 3.326]
  - - [33, 64, 1920, 33]
    - [109, 3.901]
  - - [64, 27, 1920, 27]
    - [128, 2.563]
  - - [64, 27, 1920, 33]
    - [98, 2.987]
  - - [64, 33, 1920, 33]
    - [95, 3.488]
  - - [1024, 1024, 1, 3240]
    - [117, 33.538]
  - - [1024, 1024, 1, 3960]
    - [118, 35.455]
  - - [1024, 4096, 1, 3240]
    - [102, 48.172]
  - - [1024, 4096, 1, 3960]
    - [107, 49.597]
  - - [1024, 42720, 1, 3960]
    - [113, 76.971]
  - - [4096, 1024, 1, 3240]
    - [115, 48.503]
  - - [4096, 1024, 1, 3960]
    - [124, 49.111]
  - - [64, 1280, 64, 192]
    - [477, 24.661]
  - - [64, 1280, 64, 320]
    - [477, 30.427]
  - - [64, 1280, 64, 384]
    - [473, 32.097]
  - - [64, 1280, 64, 448]
    - [487, 33.355]
  - - [64, 2048, 64, 192]
    - [466, 25.854]
  - - [64, 2048, 64, 320]
    - [473, 30.937]
  - - [64, 2048, 64, 384]
    - [497, 32.554]
  - - [64, 2048, 64, 448]
    - [496, 34.178]
  - - [1225, 192, 64, 32]
    - [476, 12.183]
  - - [1225, 192, 64, 48]
    - [478, 10.371]
  - - [1225, 192, 64, 64]
    - [472, 18.705]
  - - [1225, 256, 64, 48]
    - [484, 11.298]
  - - [1225, 256, 64, 64]
    - [468, 19.771]
  - - [1225, 288, 64, 48]
    - [467, 9.596]
  - - [1225, 288, 64, 64]
    - [476, 16.757]
  - - [5329, 64, 64, 80]
    - [478, 13.384]
  - - [289, 768, 64, 128]
    - [485, 25.208]
  - - [289, 768, 64, 160]
    - [468, 28.782]
  - - [289, 768, 64, 192]
    - [482, 31.317]
  - - [64, 1280, 32, 192]
    - [490, 21.217]
  - - [64, 1280, 32, 320]
    - [477, 26.255]
  - - [64, 1280, 32, 384]
    - [474, 27.707]
  - - [64, 1280, 32, 448]
    - [492, 28.923]
  - - [64, 2048, 32, 192]
    - [491, 23.117]
  - - [64, 2048, 32, 320]
    - [477, 27.606]
  - - [64, 2048, 32, 384]
    - [469, 29.268]
  - - [64, 2048, 32, 448]
    - [493, 30.743]
  - - [1225, 192, 32, 32]
    - [472, 10.153]
  - - [1225, 192, 32, 48]
    - [494, 9.605]
  - - [1225, 192, 32, 64]
    - [483, 16.215]
  - - [1225, 256, 32, 48]
    - [484, 9.778]
  - - [1225, 256, 32, 64]
    - [476, 17.321]
  - - [1225, 288, 32, 48]
    - [494, 8.96]
  - - [1225, 288, 32, 64]
    - [483, 15.438]
  - - [5329, 64, 32, 80]
    - [472, 12.688]
  - - [289, 768, 32, 128]
    - [482, 21.648]
  - - [289, 768, 32, 160]
    - [468, 24.561]
  - - [289, 768, 32, 192]
    - [468, 26.924]
  - - [49, 512, 64, 2048]
    - [464, 22.028]
  - - [49, 2048, 64, 512]
    - [478, 23.473]
  - - [3136, 64, 32, 256]
    - [478, 28.027]
  - - [3136, 64, 32, 64]
    - [476, 16.299]
  - - [3136, 256, 32, 64]
    - [481, 26.994]
  - - [784, 128, 32, 512]
    - [481, 45.931]
  - - [784, 512, 32, 128]
    - [471, 34.117]
  - - [196, 256, 32, 1024]
    - [479, 28.129]
  - - [196, 1024, 32, 256]
    - [463, 30.052]
  - - [49, 512, 32, 2048]
    - [476, 21.856]
  - - [49, 2048, 32, 512]
    - [466, 21.194]
  - - [3136, 64, 64, 128]
    - [480, 24.231]
  - - [3136, 128, 64, 256]
    - [471, 47.6]
  - - [784, 256, 64, 512]
    - [471, 56.054]
  - - [3136, 256, 64, 128]
    - [465, 45.794]
  - - [3136, 256, 64, 256]
    - [471, 60.222]
  - - [196, 512, 64, 1024]
    - [479, 43.251]
  - - [784, 512, 64, 256]
    - [471, 50.656]
  - - [784, 512, 64, 512]
    - [471, 59.152]
  - - [196, 1024, 64, 512]
    - [463, 43.435]
  - - [196, 1024, 64, 1024]
    - [475, 48.673]
  - - [49, 1024, 64, 2048]
    - [470, 27.293]
  - - [49, 2048, 64, 1024]
    - [470, 28.078]
  - - [3136, 64, 32, 128]
    - [495, 21.918]
  - - [3136, 128, 32, 256]
    - [479, 43.1]
  - - [784, 256, 32, 512]
    - [471, 51.72]
  - - [3136, 256, 32, 128]
    - [481, 40.814]
  - - [3136, 256, 32, 256]
    - [471, 55.85]
  - - [196, 512, 32, 1024]
    - [488, 34.004]
  - - [784, 512, 32, 256]
    - [465, 46.486]
  - - [784, 512, 32, 512]
    - [471, 56.361]
  - - [196, 1024, 32, 512]
    - [463, 37.805]
  - - [196, 1024, 32, 1024]
    - [463, 42.358]
  - - [49, 1024, 32, 2048]
    - [489, 23.892]
  - - [49, 2048, 32, 1024]
    - [470, 24.618]
  - - [7680, 8192, 1, 8192]
    - [232, 95.037]
  - - [3840, 4096, 1, 4096]
    - [353, 91.156]
  - - [1920, 2048, 1, 2048]
    - [311, 77.375]
  - - [960, 1024, 1, 1024]
    - [300, 35.415]
  - - [480, 512, 1, 512]
    - [275, 10.421]
  - - [8192, 7680, 1, 8192]
    - [353, 95.096]
  - - [4096, 3840, 1, 4096]
    - [442, 91.114]
  - - [2048, 1920, 1, 2048]
    - [254, 78.097]
  - - [1024, 960, 1, 1024]
    - [452, 36.093]
  - - [512, 480, 1, 512]
    - [376, 9.979]
  - - [8192, 8192, 1, 8192]
    - [232, 90.431]
  - - [4096, 4096, 1, 4096]
    - [269, 80.842]
  - - [2048, 2048, 1, 2048]
    - [443, 61.412]
  - - [512, 512, 1, 512]
    - [243, 9.036]
  - - [64, 512, 16, 512]
    - [286, 16.207]
  - - [1024, 2, 1, 1]
    - [354, 0.001]
  - - [1024, 2, 1, 512]
    - [272, 0.091]
  - - [1024, 1024, 1, 1]
    - [325, 0.139]
  - - [1024, 1024, 1, 77]
    - [310, 7.481]
  - - [1024, 4096, 1, 512]
    - [419, 43.219]
  - - [1024, 30522, 1, 77]
    - [449, 27.332]
  - - [4096, 1024, 1, 512]
    - [239, 43.406]
  - - [64, 128, 160, 128]
    - [424, 14.145]
  - - [1024, 2, 1, 10]
    - [292, 0.004]
  - - [1024, 2, 1, 1280]
    - [366, 0.147]
  - - [1024, 1024, 1, 10]
    - [293, 1.258]
  - - [1024, 1024, 1, 1280]
    - [247, 32.124]
  - - [1024, 4096, 1, 1280]
    - [345, 56.9]
  - - [1024, 30522, 1, 200]
    - [347, 46.354]
  - - [4096, 1024, 1, 1280]
    - [260, 51.903]
  - - [64, 128, 624, 128]
    - [233, 18.279]
  - - [1024, 2, 1, 39]
    - [245, 0.011]
  - - [1024, 2, 1, 4992]
    - [380, 0.223]
  - - [1024, 1024, 1, 39]
    - [235, 4.252]
  - - [1024, 1024, 1, 780]
    - [434, 25.771]
  - - [1024, 1024, 1, 4992]
    - [247, 44.777]
  - - [1024, 4096, 1, 4992]
    - [253, 65.38]
  - - [1024, 30522, 1, 780]
    - [314, 67.259]
  - - [4096, 1024, 1, 4992]
    - [259, 58.195]
  - - [1024, 1024, 1, 308]
    - [252, 17.572]
  - - [1024, 30522, 1, 308]
    - [346, 55.032]
  - - [64, 128, 640, 128]
    - [297, 18.417]
  - - [1024, 2, 1, 40]
    - [354, 0.012]
  - - [1024, 2, 1, 5120]
    - [386, 0.225]
  - - [1024, 1024, 1, 40]
    - [352, 4.511]
  - - [1024, 1024, 1, 800]
    - [356, 27.448]
  - - [1024, 1024, 1, 5120]
    - [247, 44.58]
  - - [1024, 4096, 1, 5120]
    - [253, 65.102]
  - - [1024, 30522, 1, 800]
    - [278, 72.331]
  - - [4096, 1024, 1, 5120]
    - [427, 58.067]
  - - [64, 128, 656, 128]
    - [383, 18.551]
  - - [1024, 2, 1, 41]
    - [245, 0.012]
  - - [1024, 2, 1, 5248]
    - [428, 0.224]
  - - [1024, 1024, 1, 41]
    - [283, 4.678]
  - - [1024, 1024, 1, 820]
    - [390, 25.384]
  - - [1024, 1024, 1, 5248]
    - [256, 45.134]
  - - [1024, 4096, 1, 5248]
    - [237, 64.982]
  - - [1024, 30522, 1, 820]
    - [278, 69.139]
  - - [4096, 1024, 1, 5248]
    - [259, 58.223]
  - - [64, 512, 80, 512]
    - [361, 30.194]
  - - [1024, 2, 1, 5]
    - [391, 0.001]
  - - [1024, 2, 1, 2560]
    - [380, 0.19]
  - - [1024, 1024, 1, 5]
    - [290, 0.645]
  - - [1024, 1024, 1, 385]
    - [262, 20.311]
  - - [1024, 1024, 1, 2560]
    - [247, 40.388]
  - - [1024, 4096, 1, 2560]
    - [410, 62.685]
  - - [1024, 30522, 1, 385]
    - [346, 59.866]
  - - [4096, 1024, 1, 2560]
    - [260, 55.856]
  - - [64, 512, 96, 512]
    - [395, 30.206]
  - - [1024, 2, 1, 6]
    - [292, 0.002]
  - - [1024, 2, 1, 3072]
    - [366, 0.2]
  - - [1024, 1024, 1, 6]
    - [290, 0.755]
  - - [1024, 1024, 1, 462]
    - [252, 22.115]
  - - [1024, 1024, 1, 3072]
    - [247, 41.239]
  - - [1024, 4096, 1, 3072]
    - [345, 63.564]
  - - [1024, 30522, 1, 462]
    - [346, 60.952]
  - - [4096, 1024, 1, 3072]
    - [282, 56.189]
  - - [64, 128, 128, 128]
    - [424, 12.078]
  - - [1024, 2, 1, 8]
    - [446, 0.003]
  - - [1024, 2, 1, 1024]
    - [366, 0.131]
  - - [1024, 1024, 1, 8]
    - [290, 1.02]
  - - [1024, 1024, 1, 160]
    - [262, 14.812]
  - - [1024, 4096, 1, 1024]
    - [269, 55.824]
  - - [1024, 30522, 1, 160]
    - [403, 46.289]
  - - [4096, 1024, 1, 1024]
    - [407, 50.179]
  - - [64, 128, 144, 128]
    - [242, 13.331]
  - - [1024, 2, 1, 9]
    - [245, 0.003]
  - - [1024, 2, 1, 1152]
    - [366, 0.14]
  - - [1024, 1024, 1, 9]
    - [290, 1.162]
  - - [1024, 1024, 1, 180]
    - [356, 12.893]
  - - [1024, 1024, 1, 1152]
    - [247, 30.971]
  - - [1024, 4096, 1, 1152]
    - [345, 55.347]
  - - [1024, 30522, 1, 180]
    - [429, 44.317]
  - - [4096, 1024, 1, 1152]
    - [282, 51.56]
  - - [479, 1024, 1, 32768]
    - [370, 28.628]
  - - [4, 64, 32768, 4]
    - [264, 0.219]
  - - [4, 64, 38400, 4]
    - [264, 0.22]
  - - [64, 4, 32768, 4]
    - [328, 0.225]
  - - [64, 4, 38400, 4]
    - [328, 0.228]
  - - [1024, 1024, 1, 8192]
    - [236, 47.398]
  - - [1024, 1024, 1, 9600]
    - [236, 47.941]
  - - [1024, 4096, 1, 8192]
    - [410, 65.026]
  - - [1024, 4096, 1, 9600]
    - [406, 66.213]
  - - [1024, 33712, 1, 8192]
    - [363, 87.468]
  - - [1024, 33712, 1, 9600]
    - [399, 86.851]
  - - [4096, 1024, 1, 8192]
    - [422, 59.25]
  - - [4096, 1024, 1, 9600]
    - [295, 59.463]
  - - [64, 128, 1, 128]
    - [275, 0.156]
  - - [128, 64, 1, 128]
    - [379, 0.149]
  - - [5, 64, 1, 5]
    - [398, 0.0]
  - - [2048, 512, 1, 1]
    - [325, 0.14]
  - - [33, 32, 1, 33]
    - [245, 0.004]
  - - [1024, 1600, 1, 1]
    - [325, 0.201]
  - - [64, 1024, 32, 1024]
    - [250, 33.439]
  - - [2560, 1920, 1, 2048]
    - [251, 65.602]
  - - [1024, 3072, 1, 4096]
    - [254, 69.14]
  - - [2560, 2560, 1, 2048]
    - [257, 69.242]
  - - [2048, 2, 1, 2]
    - [245, 0.001]
  - - [1024, 64, 128, 1024]
    - [266, 39.697]
  - - [2048, 2048, 1, 2]
    - [268, 0.628]
  - - [1024, 64, 32, 1024]
    - [270, 33.0]
  - - [1024, 96, 64, 1024]
    - [271, 46.485]
  - - [1024, 30592, 1, 2048]
    - [278, 85.162]
  - - [1024, 3072, 1, 16384]
    - [281, 73.024]
  - - [6144, 1536, 1, 4096]
    - [282, 74.311]
  - - [1024, 1024, 1, 16]
    - [287, 2.533]
  - - [1536, 4608, 1, 8192]
    - [288, 84.309]
  - - [640, 2560, 1, 2048]
    - [295, 55.284]
  - - [1024, 4096, 1, 16384]
    - [306, 65.871]
  - - [64, 512, 40, 512]
    - [313, 25.634]
  - - [1024, 1024, 1, 16384]
    - [236, 49.853]
  - - [1536, 6144, 1, 4096]
    - [315, 73.346]
  - - [1024, 30592, 1, 4096]
    - [232, 90.824]
  - - [2560, 2560, 1, 4]
    - [321, 1.496]
  - - [1536, 1536, 1, 4096]
    - [326, 58.233]
  - - [2560, 7680, 1, 2048]
    - [327, 84.602]
  - - [64, 1024, 256, 1024]
    - [331, 40.682]
  - - [96, 1024, 64, 1024]
    - [332, 45.297]
  - - [1536, 50304, 1, 4096]
    - [263, 91.247]
  - - [2048, 8192, 1, 1024]
    - [355, 65.542]
  - - [1024, 30592, 1, 8192]
    - [232, 93.702]
  - - [512, 64, 256, 512]
    - [367, 33.607]
  - - [1024, 96, 128, 1024]
    - [371, 52.11]
  - - [64, 512, 128, 512]
    - [377, 28.958]
  - - [4096, 1024, 1, 16384]
    - [378, 60.204]
  - - [8192, 2048, 1, 1024]
    - [387, 67.751]
  - - [64, 1024, 64, 1024]
    - [388, 35.043]
  - - [1024, 50304, 1, 4096]
    - [263, 86.545]
  - - [1536, 4608, 1, 4096]
    - [393, 80.746]
  - - [512, 64, 128, 512]
    - [401, 28.71]
  - - [6144, 1536, 1, 8192]
    - [405, 74.579]
  - - [1024, 3072, 1, 8192]
    - [254, 71.245]
  - - [1536, 1536, 1, 8192]
    - [413, 61.292]
  - - [1536, 50304, 1, 8192]
    - [232, 93.482]
  - - [2560, 2, 1, 4]
    - [245, 0.003]
  - - [2048, 6144, 1, 1024]
    - [289, 66.73]
  - - [64, 1024, 128, 1024]
    - [388, 39.816]
  - - [1024, 64, 64, 1024]
    - [426, 34.982]
  - - [1024, 2, 1, 16]
    - [292, 0.006]
  - - [96, 1024, 128, 1024]
    - [431, 50.179]
  - - [2048, 30592, 1, 1024]
    - [432, 80.352]
  - - [64, 512, 256, 512]
    - [436, 33.692]
  - - [1536, 6144, 1, 8192]
    - [440, 74.303]
  - - [1024, 50304, 1, 2048]
    - [263, 82.203]
  - - [1024, 50304, 1, 8192]
    - [232, 88.896]
  - - [1024, 3072, 1, 2048]
    - [254, 62.934]
  - - [1024, 64, 256, 1024]
    - [458, 40.416]
  - - [1024, 50304, 1, 16384]
    - [232, 90.081]
  - - [512, 64, 40, 512]
    - [461, 25.634]
- null
