library/src/blas3/Tensile/Logic/asm_full/arcturus_Cijk_Alik_Bljk_HBH.yaml
- {MinimumRequiredVersion: 4.6.0}
- arcturus
- gfx908
- [Device 7380, Device 7388, Device 738c, Device 7390]
    SolutionIndex: 0
    SolutionNameMin: Cijk_Alik_Bljk_HBH_MT032x016x08_PGR1_PLR1_TT04_02
    SolutionIndex: 1
    SolutionNameMin: Cijk_Alik_Bljk_HBH_MT032x016x08_PGR1_PLR1_TT02_02
    SolutionIndex: 2
    SolutionNameMin: Cijk_Alik_Bljk_HBH_MT032x032x08_PGR1_PLR1_TT02_02
    SolutionIndex: 3
    SolutionNameMin: Cijk_Alik_Bljk_HBH_MT016x016x16_PGR1_PLR1_TT02_02
    SolutionIndex: 4
    SolutionNameMin: Cijk_Alik_Bljk_HBH_MT032x032x16_PGR1_PLR1_TT04_04
    SolutionIndex: 5
    SolutionNameMin: Cijk_Alik_Bljk_HBH_MT064x032x16_PGR1_PLR1_TT04_04
    SolutionIndex: 6
    SolutionNameMin: Cijk_Alik_Bljk_HBH_MT032x032x32_PGR1_PLR1_TT04_04
    SolutionIndex: 7
    SolutionNameMin: Cijk_Alik_Bljk_HBH_MT032x016x08_PGR1_PLR1_TT04_02
    SolutionIndex: 8
    SolutionNameMin: Cijk_Alik_Bljk_HBH_MT016x016x16_PGR1_PLR1_TT02_02
    SolutionIndex: 9
    SolutionNameMin: Cijk_Alik_Bljk_HBH_MT032x032x16_PGR1_PLR1_TT04_04
    SolutionIndex: 10
    SolutionNameMin: Cijk_Alik_Bljk_HBH_MT064x064x16_PGR1_PLR1_TT08_08
    SolutionIndex: 11
    SolutionNameMin: Cijk_Alik_Bljk_HBH_MT064x032x16_PGR1_PLR1_TT04_04
    SolutionIndex: 12
    SolutionNameMin: Cijk_Alik_Bljk_HBH_MT016x016x24_PGR1_PLR1_TT02_02
    SolutionIndex: 13
    SolutionNameMin: Cijk_Alik_Bljk_HBH_MT032x032x24_PGR1_PLR1_TT04_04
    SolutionIndex: 14
    SolutionNameMin: Cijk_Alik_Bljk_HBH_MT016x016x24_PGR1_PLR1_TT02_02
    SolutionIndex: 15
    SolutionNameMin: Cijk_Alik_Bljk_HBH_MT032x016x24_PGR1_PLR1_TT04_02
    SolutionIndex: 16
    SolutionNameMin: Cijk_Alik_Bljk_HBH_MT032x032x24_PGR1_PLR1_TT04_04
    SolutionIndex: 17
    SolutionNameMin: Cijk_Alik_Bljk_HBH_MT064x064x24_PGR1_PLR1_TT08_08
    SolutionIndex: 18
    SolutionNameMin: Cijk_Alik_Bljk_HBH_MT064x064x08_PGR1_PLR1_TT04_04
    SolutionIndex: 19
    SolutionNameMin: Cijk_Alik_Bljk_HBH_MT064x128x08_PGR1_PLR1_TT04_08
    SolutionIndex: 20
    SolutionNameMin: Cijk_Alik_Bljk_HBH_MT128x064x08_PGR1_PLR1_TT08_04
    SolutionIndex: 21
    SolutionNameMin: Cijk_Alik_Bljk_HBH_MT064x064x16_PGR1_PLR1_TT04_04
    SolutionIndex: 22
    SolutionNameMin: Cijk_Alik_Bljk_HBH_MT064x128x16_PGR1_PLR1_TT04_08
    SolutionIndex: 23
    SolutionNameMin: Cijk_Alik_Bljk_HBH_MT128x128x16_PGR1_PLR1_TT08_08
    SolutionIndex: 24
    SolutionNameMin: Cijk_Alik_Bljk_HBH_MT128x064x32_PGR1_PLR1_TT08_04
    SolutionIndex: 25
    SolutionNameMin: Cijk_Alik_Bljk_HBH_MT064x128x04_PGR0_PLR0_TT04_08
    SolutionIndex: 26
    SolutionNameMin: Cijk_Alik_Bljk_HBH_MT064x064x04_PGR0_PLR0_TT04_04
    SolutionIndex: 27
    SolutionNameMin: Cijk_Alik_Bljk_HBH_MT064x064x04_PGR1_PLR0_TT04_04
    SolutionIndex: 28
    SolutionNameMin: Cijk_Alik_Bljk_HBH_MT064x064x04_PGR0_PLR1_TT04_04
    SolutionIndex: 29
    SolutionNameMin: Cijk_Alik_Bljk_HBH_MT064x064x08_PGR0_PLR0_TT04_04
    SolutionIndex: 30
    SolutionNameMin: Cijk_Alik_Bljk_HBH_MT064x064x08_PGR1_PLR0_TT04_04
    SolutionIndex: 31
    SolutionNameMin: Cijk_Alik_Bljk_HBH_MT128x128x08_PGR0_PLR1_TT08_08
    SolutionIndex: 32
    SolutionNameMin: Cijk_Alik_Bljk_HBH_MT064x128x08_PGR0_PLR1_TT04_08
    SolutionIndex: 33
    SolutionNameMin: Cijk_Alik_Bljk_HBH_MT064x064x08_PGR0_PLR1_TT04_04
    SolutionIndex: 34
    SolutionNameMin: Cijk_Alik_Bljk_HBH_MT064x064x08_PGR1_PLR1_TT04_04
    SolutionIndex: 35
    SolutionNameMin: Cijk_Alik_Bljk_HBH_MT064x064x16_PGR0_PLR0_TT04_04
    SolutionIndex: 36
    SolutionNameMin: Cijk_Alik_Bljk_HBH_MT064x064x16_PGR1_PLR0_TT04_04
    SolutionIndex: 37
    SolutionNameMin: Cijk_Alik_Bljk_HBH_MT064x064x16_PGR0_PLR1_TT04_04
    SolutionIndex: 38
    SolutionNameMin: Cijk_Alik_Bljk_HBH_MT064x064x16_PGR1_PLR1_TT04_04
    SolutionIndex: 39
    SolutionNameMin: Cijk_Alik_Bljk_HBH_MT064x128x04_PGR0_PLR0_TT04_08
    SolutionIndex: 40
    SolutionNameMin: Cijk_Alik_Bljk_HBH_MT064x064x04_PGR0_PLR0_TT04_04
    SolutionIndex: 41
    SolutionNameMin: Cijk_Alik_Bljk_HBH_MT064x128x04_PGR1_PLR0_TT04_08
    SolutionIndex: 42
    SolutionNameMin: Cijk_Alik_Bljk_HBH_MT064x064x04_PGR1_PLR0_TT04_04
    SolutionIndex: 43
    SolutionNameMin: Cijk_Alik_Bljk_HBH_MT128x128x04_PGR0_PLR1_TT08_08
    SolutionIndex: 44
    SolutionNameMin: Cijk_Alik_Bljk_HBH_MT064x128x04_PGR0_PLR1_TT04_08
    SolutionIndex: 45
    SolutionNameMin: Cijk_Alik_Bljk_HBH_MT064x064x04_PGR0_PLR1_TT04_04
    SolutionIndex: 46
    SolutionNameMin: Cijk_Alik_Bljk_HBH_MT064x128x04_PGR1_PLR1_TT04_08
    SolutionIndex: 47
    SolutionNameMin: Cijk_Alik_Bljk_HBH_MT064x064x04_PGR1_PLR1_TT04_04
    SolutionIndex: 48
    SolutionNameMin: Cijk_Alik_Bljk_HBH_MT128x128x08_PGR0_PLR0_TT08_08
    SolutionIndex: 49
    SolutionNameMin: Cijk_Alik_Bljk_HBH_MT064x128x08_PGR0_PLR0_TT04_08
    SolutionIndex: 50
    SolutionNameMin: Cijk_Alik_Bljk_HBH_MT064x064x08_PGR0_PLR0_TT04_04
    SolutionIndex: 51
    SolutionNameMin: Cijk_Alik_Bljk_HBH_MT064x064x08_PGR1_PLR0_TT04_04
    SolutionIndex: 52
    SolutionNameMin: Cijk_Alik_Bljk_HBH_MT064x128x08_PGR0_PLR1_TT04_08
    SolutionIndex: 53
    SolutionNameMin: Cijk_Alik_Bljk_HBH_MT064x064x08_PGR0_PLR1_TT04_04
    SolutionIndex: 54
    SolutionNameMin: Cijk_Alik_Bljk_HBH_MT064x128x08_PGR1_PLR1_TT04_08
    SolutionIndex: 55
    SolutionNameMin: Cijk_Alik_Bljk_HBH_MT064x064x08_PGR1_PLR1_TT04_04
    SolutionIndex: 56
    SolutionNameMin: Cijk_Alik_Bljk_HBH_MT064x064x16_PGR1_PLR1_TT04_04
    SolutionIndex: 57
    SolutionNameMin: Cijk_Alik_Bljk_HBH_MT064x032x16_EPS1_GRVW04_LPB04_PGR1_PLR1_SNLL1_TT04_04_VW04_WG16_08_01_WGM01
    SolutionIndex: 58
    SolutionNameMin: Cijk_Alik_Bljk_HBH_MT064x064x16_EPS1_GRVW04_LPB04_PGR1_PLR1_SNLL1_TT04_04_VW04_WG16_16_01_WGM01
    SolutionIndex: 59
    SolutionNameMin: Cijk_Alik_Bljk_HBH_MT064x032x16_EPS1_GRVW04_LPB04_PGR1_PLR1_SNLL1_TT04_04_VW04_WG16_08_01_WGM08
    SolutionIndex: 60
    SolutionNameMin: Cijk_Alik_Bljk_HBH_MT064x032x16_EPS1_GRVW04_LPB04_PGR1_PLR1_SNLL1_TT04_04_VW04_WG16_08_01_WGM64
    SolutionIndex: 61
    SolutionNameMin: Cijk_Alik_Bljk_HBH_MT032x128x32_EPS1_GRVW04_LPB04_PGR1_PLR1_SNLL1_TT04_04_VW04_WG08_32_01_WGM01
    SolutionIndex: 62
    SolutionNameMin: Cijk_Alik_Bljk_HBH_MT032x128x32_EPS1_GRVW04_LPB04_PGR1_PLR1_SNLL1_TT04_04_VW04_WG08_32_01_WGM64
    SolutionIndex: 63
    SolutionNameMin: Cijk_Alik_Bljk_HBH_MT032x032x08_PGR1_PLR1_TT04_04
    SolutionIndex: 64
    SolutionNameMin: Cijk_Alik_Bljk_HBH_MT032x032x16_PGR1_PLR1_TT04_04
    SolutionIndex: 65
    SolutionNameMin: Cijk_Alik_Bljk_HBH_MT064x016x16_PGR1_PLR1_TT04_04
    SolutionIndex: 66
    SolutionNameMin: Cijk_Alik_Bljk_HBH_MT032x032x32_PGR1_PLR1_TT04_04
    SolutionIndex: 67
    SolutionNameMin: Cijk_Alik_Bljk_HBH_MT064x016x32_PGR1_PLR1_TT04_04
    SolutionIndex: 68
    SolutionNameMin: Cijk_Alik_Bljk_HBH_MT032x032x16_PGR1_PLR1_TT04_04
    SolutionIndex: 69
    SolutionNameMin: Cijk_Alik_Bljk_HBH_MT032x032x32_PGR1_PLR1_TT04_04
    SolutionIndex: 70
    SolutionNameMin: Cijk_Alik_Bljk_HBH_MT064x032x32_PGR1_PLR1_TT04_04
    SolutionIndex: 71
    SolutionNameMin: Cijk_Alik_Bljk_HBH_MT064x064x08_PGR1_PLR1_TT08_08
    SolutionIndex: 72
    SolutionNameMin: Cijk_Alik_Bljk_HBH_MT064x064x16_PGR1_PLR1_TT08_08
    SolutionIndex: 73
    SolutionNameMin: Cijk_Alik_Bljk_HBH_MT064x064x32_PGR1_PLR1_TT08_08
    SolutionIndex: 74
    SolutionNameMin: Cijk_Alik_Bljk_HBH_MT128x128x08_PGR1_PLR1_TT08_08
    SolutionIndex: 75
    SolutionNameMin: Cijk_Alik_Bljk_HBH_MT064x064x16_PGR1_PLR1_TT04_04
    SolutionIndex: 76
    SolutionNameMin: Cijk_Alik_Bljk_HBH_MT128x064x16_PGR1_PLR1_TT08_04
    SolutionIndex: 77
    SolutionNameMin: Cijk_Alik_Bljk_HBH_MT128x128x32_PGR1_PLR1_TT08_08
    SolutionIndex: 78
    SolutionNameMin: Cijk_Alik_Bljk_HBH_MT128x128x16_PGR1_PLR1_TT08_08
    SolutionIndex: 79
    SolutionNameMin: Cijk_Alik_Bljk_HBH_MT128x128x32_PGR1_PLR1_TT08_08
    SolutionIndex: 80
    SolutionNameMin: Cijk_Alik_Bljk_HBH_MT064x064x04_PGR0_PLR0_TT04_04
    SolutionIndex: 81
    SolutionNameMin: Cijk_Alik_Bljk_HBH_MT064x064x04_PGR1_PLR1_TT04_04
    SolutionIndex: 82
    SolutionNameMin: Cijk_Alik_Bljk_HBH_MT064x064x08_PGR0_PLR0_TT04_04
    SolutionIndex: 83
    SolutionNameMin: Cijk_Alik_Bljk_HBH_MT064x064x08_PGR1_PLR0_TT04_04
    SolutionIndex: 84
    SolutionNameMin: Cijk_Alik_Bljk_HBH_MT064x064x08_PGR1_PLR1_TT04_04
    SolutionIndex: 85
    SolutionNameMin: Cijk_Alik_Bljk_HBH_MT064x128x16_PGR1_PLR1_TT04_08
    SolutionIndex: 86
    SolutionNameMin: Cijk_Alik_Bljk_HBH_MT128x128x04_PGR0_PLR0_TT08_08
    SolutionIndex: 87
    SolutionNameMin: Cijk_Alik_Bljk_HBH_MT064x064x04_PGR0_PLR0_TT04_04
    SolutionIndex: 88
    SolutionNameMin: Cijk_Alik_Bljk_HBH_MT064x064x04_PGR1_PLR0_TT04_04
    SolutionIndex: 89
    SolutionNameMin: Cijk_Alik_Bljk_HBH_MT064x064x04_PGR0_PLR1_TT04_04
    SolutionIndex: 90
    SolutionNameMin: Cijk_Alik_Bljk_HBH_MT064x064x04_PGR1_PLR1_TT04_04
    SolutionIndex: 91
    SolutionNameMin: Cijk_Alik_Bljk_HBH_MT064x128x08_PGR0_PLR0_TT04_08
    SolutionIndex: 92
    SolutionNameMin: Cijk_Alik_Bljk_HBH_MT064x064x08_PGR1_PLR0_TT04_04
    SolutionIndex: 93
    SolutionNameMin: Cijk_Alik_Bljk_HBH_MT064x064x08_PGR1_PLR1_TT04_04
    SolutionIndex: 94
    SolutionNameMin: Cijk_Alik_Bljk_HBH_MT064x064x16_PGR1_PLR1_TT04_04
    SolutionIndex: 95
    SolutionNameMin: Cijk_Alik_Bljk_HBH_MT128x64x16_SE_
    SolutionIndex: 96
    SolutionNameMin: Cijk_Alik_Bljk_HBH_MT64x16x16_SE_
    SolutionIndex: 97
    SolutionNameMin: Cijk_Alik_Bljk_HBH_MT64x128x32_SE_
    SolutionIndex: 98
    SolutionNameMin: Cijk_Alik_Bljk_HBH_MT128x256x16_SE_
    SolutionIndex: 99
    SolutionNameMin: Cijk_Alik_Bljk_HBH_MT128x32x16_SE_AF0EM1_ASEM1_GRVW1_ONLL1_SNLL0
    SolutionIndex: 100
    SolutionNameMin: Cijk_Alik_Bljk_HBH_MT128x64x16_SE_AF0EM1_ASEM1_GRVW1_ONLL1_SNLL0
    SolutionIndex: 101
    SolutionNameMin: Cijk_Alik_Bljk_HBH_MT64x128x16_SE_AF0EM1_ASEM1_GRVW1_ONLL1_SNLL0
    SolutionIndex: 102
    SolutionNameMin: Cijk_Alik_Bljk_HBH_MT256x64x16_SE_AF0EM1_ASEM1_GRVW1_ONLL1_SNLL0
    SolutionIndex: 103
    SolutionNameMin: Cijk_Alik_Bljk_HBH_MT256x128x16_SE_AF0EM1_ASEM1_GRVW1_ONLL1_SNLL0
    SolutionIndex: 104
    SolutionNameMin: Cijk_Alik_Bljk_HBH_MT64x32x16_SE_AF0EM1_ASEM1_GRVW1_ONLL1_SNLL0
    SolutionIndex: 105
    SolutionNameMin: Cijk_Alik_Bljk_HBH_MT64x128x32_SE_AF0EM8_ASEM8_GRVW4_ONLL1_SNLL0
    SolutionIndex: 106
    SolutionNameMin: Cijk_Alik_Bljk_HBH_MT128x256x32_SE_AF0EM8_ASEM8_GRVW8_ONLL1_SNLL0
    SolutionIndex: 107
    SolutionNameMin: Cijk_Alik_Bljk_HBH_MT64x128x16_MI32x32x4x2_SE_AF0EM2_ASEM1_GRVW2_ONLL0_SNLL1
    SolutionIndex: 108
    SolutionNameMin: Cijk_Alik_Bljk_HBH_MT64x128x16_MI32x32x4x2_SE_AF0EM1_ASEM2_GRVW4_ONLL0_SNLL1
    SolutionIndex: 109
    SolutionNameMin: Cijk_Alik_Bljk_HBH_MT64x128x16_MI32x32x4x2_SE_AF0EM2_ASEM2_GRVW4_ONLL0_SNLL1
    SolutionIndex: 110
    SolutionNameMin: Cijk_Alik_Bljk_HBH_MT64x128x16_MI32x32x4x2_SE_AF0EM2_ASEM1_GRVW2_ONLL0_SNLL0
    SolutionIndex: 111
    SolutionNameMin: Cijk_Alik_Bljk_HBH_MT64x128x16_MI32x32x4x2_SE_AF0EM1_ASEM1_GRVW4_ONLL0_SNLL0
    SolutionIndex: 112
    SolutionNameMin: Cijk_Alik_Bljk_HBH_MT64x128x16_MI32x32x4x2_SE_AF0EM2_ASEM1_GRVW4_ONLL0_SNLL0
    SolutionIndex: 113
    SolutionNameMin: Cijk_Alik_Bljk_HBH_MT64x128x32_MI32x32x4x2_SE_AF0EM1_ASEM1_GRVW4_ONLL0_SNLL0
    SolutionIndex: 114
    SolutionNameMin: Cijk_Alik_Bljk_HBH_MT64x128x32_MI32x32x4x2_SE_AF0EM2_ASEM1_GRVW4_ONLL0_SNLL0
    SolutionIndex: 115
    SolutionNameMin: Cijk_Alik_Bljk_HBH_MT64x128x16_MI32x32x4x2_SE_AF0EM1_ASEM1_GRVW2_ONLL1_SNLL1
    SolutionIndex: 116
    SolutionNameMin: Cijk_Alik_Bljk_HBH_MT64x128x8_MI32x32x4x2_SE_AF0EM1_ASEM1_GRVW4_ONLL1_SNLL1
    SolutionIndex: 117
    SolutionNameMin: Cijk_Alik_Bljk_HBH_MT64x128x16_MI32x32x4x2_SE_AF0EM2_ASEM1_GRVW4_ONLL1_SNLL1
    SolutionIndex: 118
    SolutionNameMin: Cijk_Alik_Bljk_HBH_MT64x128x8_MI32x32x4x2_SE_AF0EM1_ASEM2_GRVW4_ONLL1_SNLL0
    SolutionIndex: 119
    SolutionNameMin: Cijk_Alik_Bljk_HBH_MT64x128x16_MI32x32x4x2_SE_AF0EM1_ASEM1_GRVW4_ONLL1_SNLL0
    SolutionIndex: 120
    SolutionNameMin: Cijk_Alik_Bljk_HBH_MT64x128x16_MI32x32x4x2_SE_AF0EM2_ASEM1_GRVW4_ONLL1_SNLL0
    SolutionIndex: 121
    SolutionNameMin: Cijk_Alik_Bljk_HBH_MT64x128x32_MI32x32x4x2_SE_AF0EM1_ASEM1_GRVW4_ONLL1_SNLL0
    SolutionIndex: 122
    SolutionNameMin: Cijk_Alik_Bljk_HBH_MT64x128x32_MI32x32x4x2_SE_AF0EM2_ASEM1_GRVW4_ONLL1_SNLL0
    SolutionIndex: 123
    SolutionIndex: 124
    SolutionIndex: 125
    SolutionIndex: 126
    SolutionIndex: 127
    SolutionIndex: 128
    SolutionIndex: 129
    SolutionIndex: 130
    SolutionIndex: 131
    SolutionIndex: 132
    SolutionIndex: 133
    SolutionIndex: 134
    SolutionIndex: 135
    SolutionIndex: 136
    SolutionIndex: 137
    SolutionIndex: 138
    SolutionIndex: 139
    SolutionIndex: 140
    SolutionIndex: 141
    SolutionIndex: 142
    SolutionIndex: 143
    SolutionIndex: 144
    SolutionIndex: 145
    SolutionIndex: 146
    SolutionIndex: 147
    SolutionIndex: 148
    SolutionIndex: 149
    SolutionIndex: 150
    SolutionIndex: 151
    SolutionIndex: 152
    SolutionIndex: 153
    SolutionIndex: 154
    SolutionIndex: 155
    SolutionIndex: 156
    SolutionIndex: 157
    SolutionIndex: 158
    SolutionIndex: 159
    SolutionIndex: 160
    SolutionIndex: 161
    SolutionIndex: 162
    SolutionIndex: 163
    SolutionIndex: 164
    SolutionIndex: 165
    SolutionIndex: 166
    SolutionIndex: 167
    SolutionIndex: 168
    SolutionIndex: 169
    SolutionIndex: 170
    SolutionIndex: 171
    SolutionIndex: 172
    SolutionIndex: 173
    SolutionIndex: 174
    SolutionIndex: 175
    SolutionIndex: 176
    SolutionIndex: 177
    SolutionIndex: 178
    SolutionIndex: 179
    SolutionIndex: 180
    SolutionIndex: 181
    SolutionIndex: 182
    SolutionIndex: 183
    SolutionIndex: 184
    SolutionIndex: 185
    SolutionIndex: 186
    SolutionIndex: 187
    SolutionIndex: 188
    SolutionIndex: 189
    SolutionIndex: 190
    SolutionIndex: 191
    SolutionIndex: 192
    SolutionIndex: 193
    SolutionIndex: 194
    SolutionIndex: 195
    SolutionIndex: 196
    SolutionIndex: 197
    SolutionIndex: 198
    SolutionIndex: 199
    SolutionIndex: 200
    SolutionIndex: 201
    SolutionIndex: 202
    SolutionIndex: 203
    SolutionIndex: 204
    SolutionIndex: 205
    SolutionIndex: 206
    SolutionIndex: 207
    SolutionIndex: 208
    SolutionIndex: 209
    SolutionIndex: 210
    SolutionIndex: 211
    SolutionIndex: 212
    SolutionIndex: 213
    SolutionIndex: 214
    SolutionIndex: 215
    SolutionIndex: 216
    SolutionIndex: 217
    SolutionIndex: 218
    SolutionIndex: 219
    SolutionIndex: 220
    SolutionIndex: 221
    SolutionIndex: 222
    SolutionIndex: 223
    SolutionIndex: 224
    SolutionIndex: 225
    SolutionIndex: 226
    SolutionIndex: 227
    SolutionIndex: 228
    SolutionIndex: 229
    SolutionIndex: 230
    SolutionIndex: 231
    SolutionIndex: 232
    SolutionIndex: 233
    SolutionIndex: 234
    SolutionIndex: 235
    SolutionIndex: 236
    SolutionIndex: 237
    SolutionIndex: 238
    SolutionIndex: 239
    SolutionIndex: 240
    SolutionIndex: 241
    SolutionIndex: 242
    SolutionIndex: 243
    SolutionIndex: 244
    SolutionIndex: 245
    SolutionIndex: 246
    SolutionIndex: 247
    SolutionIndex: 248
    SolutionIndex: 249
    SolutionIndex: 250
    SolutionIndex: 251
    SolutionIndex: 252
    SolutionIndex: 253
    SolutionIndex: 254
    SolutionIndex: 255
    SolutionIndex: 256
    SolutionIndex: 257
    SolutionIndex: 258
    SolutionIndex: 259
    SolutionIndex: 260
    SolutionIndex: 261
    SolutionIndex: 262
    SolutionIndex: 263
    SolutionIndex: 264
    SolutionIndex: 265
    SolutionIndex: 266
    SolutionIndex: 267
    SolutionIndex: 268
    SolutionIndex: 269
    SolutionIndex: 270
    SolutionIndex: 271
    SolutionIndex: 272
    SolutionIndex: 273
    SolutionIndex: 274
    SolutionIndex: 275
    SolutionIndex: 276
    SolutionIndex: 277
    SolutionIndex: 278
    SolutionIndex: 279
    SolutionIndex: 280
    SolutionIndex: 281
    SolutionIndex: 282
    SolutionIndex: 283
    SolutionIndex: 284
    SolutionIndex: 285
    SolutionIndex: 286
    SolutionIndex: 287
    SolutionIndex: 288
    SolutionIndex: 289
    SolutionIndex: 290
    SolutionIndex: 291
    SolutionIndex: 292
    SolutionIndex: 293
    SolutionIndex: 294
    SolutionIndex: 295
    SolutionIndex: 296
    SolutionIndex: 297
    SolutionIndex: 298
    SolutionIndex: 299
    SolutionIndex: 300
    SolutionIndex: 301
    SolutionIndex: 302
    SolutionIndex: 303
    SolutionIndex: 304
    SolutionIndex: 305
    SolutionIndex: 306
    SolutionIndex: 307
    SolutionIndex: 308
    SolutionIndex: 309
    SolutionIndex: 310
    SolutionIndex: 311
    SolutionIndex: 312
    SolutionIndex: 313
    SolutionIndex: 314
    SolutionIndex: 315
    SolutionIndex: 316
    SolutionIndex: 317
    SolutionIndex: 318
    SolutionIndex: 319
    SolutionIndex: 320
    SolutionIndex: 321
    SolutionIndex: 322
    SolutionIndex: 323
    SolutionIndex: 324
    SolutionIndex: 325
    SolutionIndex: 326
    SolutionIndex: 327
    SolutionIndex: 328
    SolutionIndex: 329
    SolutionIndex: 330
    SolutionIndex: 331
    SolutionIndex: 332
    SolutionIndex: 333
    SolutionIndex: 334
    SolutionIndex: 335
    SolutionIndex: 336
    SolutionIndex: 337
    SolutionIndex: 338
    SolutionIndex: 339
    SolutionIndex: 340
    SolutionIndex: 341
    SolutionIndex: 342
    SolutionIndex: 343
    SolutionIndex: 344
    SolutionIndex: 345
    SolutionIndex: 346
    SolutionIndex: 347
    SolutionIndex: 348
    SolutionIndex: 349
    SolutionIndex: 350
    SolutionIndex: 351
    SolutionIndex: 352
    SolutionIndex: 353
    SolutionIndex: 354
    SolutionIndex: 355
    SolutionIndex: 356
    SolutionIndex: 357
    SolutionIndex: 358
    SolutionIndex: 359
    SolutionIndex: 360
    SolutionIndex: 361
    SolutionIndex: 362
    SolutionIndex: 363
    SolutionIndex: 364
    SolutionIndex: 365
    SolutionIndex: 366
    SolutionIndex: 367
    SolutionIndex: 368
    SolutionIndex: 369
    SolutionIndex: 370
    SolutionIndex: 371
    SolutionIndex: 372
    SolutionIndex: 373
    SolutionIndex: 374
    SolutionIndex: 375
    SolutionIndex: 376
    SolutionIndex: 377
    SolutionIndex: 378
    SolutionIndex: 379
    SolutionIndex: 380
    SolutionIndex: 381
    SolutionIndex: 382
    SolutionIndex: 383
    SolutionIndex: 384
    SolutionIndex: 385
    SolutionIndex: 386
    SolutionIndex: 387
    SolutionIndex: 388
    SolutionIndex: 389
    SolutionIndex: 390
    SolutionIndex: 391
    SolutionIndex: 392
- - - [2368, 1024, 1, 1]
    - [40, 0.102]
  - - [448, 1, 1, 256]
    - [55, 0.002]
  - - [5056, 1408, 1, 3328]
    - [23, 7.272]
  - - [5056, 1856, 1, 3328]
    - [21, 7.471]
  - - [5888, 128, 1, 1]
    - [44, 0.047]
  - - [448, 3584, 1, 3328]
    - [21, 6.164]
  - - [704, 64, 1, 3328]
    - [14, 1.486]
  - - [5056, 4288, 1, 32]
    - [25, 2.75]
  - - [3584, 1024, 1, 256]
    - [21, 6.864]
  - - [32, 5056, 1, 1280]
    - [38, 0.886]
  - - [1856, 256, 1, 1]
    - [40, 0.031]
  - - [256, 1856, 1, 32]
    - [33, 0.697]
  - - [1408, 3584, 1, 3328]
    - [21, 7.263]
  - - [128, 3584, 1, 1280]
    - [16, 4.85]
  - - [1024, 2368, 1, 3328]
    - [21, 6.724]
  - - [4288, 64, 1, 3328]
    - [14, 3.36]
  - - [1, 4288, 1, 1280]
    - [55, 0.021]
  - - [2368, 64, 1, 1]
    - [53, 0.009]
  - - [256, 128, 1, 256]
    - [3, 0.707]
  - - [448, 64, 1, 1]
    - [48, 0.002]
  - - [32, 1408, 1, 32]
    - [27, 0.071]
  - - [448, 3584, 1, 32]
    - [33, 1.507]
  - - [64, 1024, 1, 1280]
    - [14, 1.934]
  - - [1, 1408, 1, 3328]
    - [56, 0.01]
  - - [1408, 128, 1, 32]
    - [27, 0.257]
  - - [4288, 6784, 1, 3328]
    - [21, 7.768]
  - - [1024, 1, 1, 3328]
    - [56, 0.008]
  - - [2944, 128, 1, 32]
    - [34, 0.623]
  - - [64, 6784, 1, 1]
    - [40, 0.03]
  - - [1024, 64, 1, 1280]
    - [14, 1.924]
  - - [448, 128, 1, 256]
    - [3, 1.126]
  - - [64, 5056, 1, 3328]
    - [11, 3.642]
  - - [5888, 4288, 1, 3328]
    - [21, 7.564]
  - - [1, 2368, 1, 1280]
    - [56, 0.016]
  - - [704, 1024, 1, 1]
    - [45, 0.046]
  - - [2368, 1408, 1, 32]
    - [25, 2.021]
  - - [256, 1856, 1, 1280]
    - [16, 5.01]
  - - [1024, 2944, 1, 1]
    - [40, 0.113]
  - - [2944, 3584, 1, 3328]
    - [21, 7.548]
  - - [2368, 2944, 1, 1280]
    - [21, 7.448]
  - - [256, 1408, 1, 1]
    - [40, 0.024]
  - - [1, 1024, 1, 3328]
    - [56, 0.008]
  - - [6784, 5888, 1, 3328]
    - [19, 7.545]
  - - [3584, 1408, 1, 32]
    - [25, 2.279]
  - - [5056, 256, 1, 256]
    - [21, 5.818]
  - - [1856, 2368, 1, 256]
    - [21, 6.886]
  - - [2368, 1024, 1, 3328]
    - [21, 6.712]
  - - [3584, 4288, 1, 32]
    - [25, 2.651]
  - - [1024, 1024, 1, 1280]
    - [23, 6.386]
  - - [3584, 3584, 1, 1]
    - [44, 0.176]
  - - [32, 2944, 1, 3328]
    - [38, 0.791]
  - - [704, 1408, 1, 3328]
    - [17, 6.156]
  - - [1408, 704, 1, 256]
    - [21, 5.447]
  - - [704, 64, 1, 32]
    - [27, 0.067]
  - - [5888, 1, 1, 3328]
    - [55, 0.03]
  - - [2368, 32, 1, 256]
    - [34, 0.396]
  - - [6784, 128, 1, 3328]
    - [5, 5.435]
  - - [2944, 256, 1, 1]
    - [49, 0.041]
  - - [1408, 2368, 1, 1]
    - [45, 0.118]
  - - [32, 448, 1, 3328]
    - [38, 0.123]
  - - [5056, 1, 1, 3328]
    - [55, 0.026]
  - - [2944, 256, 1, 32]
    - [27, 1.012]
  - - [5056, 6784, 1, 1280]
    - [21, 7.582]
  - - [4288, 5056, 1, 1]
    - [40, 0.182]
  - - [5056, 4288, 1, 1]
    - [40, 0.182]
  - - [128, 4288, 1, 3328]
    - [16, 4.336]
  - - [5056, 128, 1, 256]
    - [11, 4.405]
  - - [1408, 4288, 1, 1280]
    - [21, 7.244]
  - - [1856, 704, 1, 1280]
    - [21, 6.59]
  - - [4288, 1024, 1, 3328]
    - [21, 7.366]
  - - [1, 5888, 1, 3328]
    - [55, 0.03]
  - - [1024, 128, 1, 32]
    - [27, 0.199]
  - - [32, 4288, 1, 1280]
    - [38, 0.741]
  - - [1024, 5056, 1, 1]
    - [40, 0.141]
  - - [704, 3584, 1, 1280]
    - [21, 6.891]
  - - [1856, 5056, 1, 256]
    - [21, 7.219]
  - - [1408, 1024, 1, 1280]
    - [21, 6.242]
  - - [5056, 5888, 1, 3328]
    - [20, 7.437]
  - - [448, 1, 1, 1]
    - [48, 0.0]
  - - [3584, 3584, 1, 1280]
    - [21, 7.649]
  - - [2368, 3584, 1, 32]
    - [25, 2.516]
  - - [2944, 2368, 1, 1]
    - [40, 0.153]
  - - [704, 4288, 1, 1]
    - [40, 0.113]
  - - [2368, 256, 1, 32]
    - [29, 0.886]
  - - [1024, 6784, 1, 1280]
    - [21, 7.419]
  - - [1024, 3584, 1, 1]
    - [46, 0.124]
  - - [32, 5056, 1, 32]
    - [29, 0.285]
  - - [5888, 32, 1, 32]
    - [27, 0.332]
  - - [64, 128, 1, 3328]
    - [12, 0.271]
  - - [256, 5056, 1, 32]
    - [33, 1.379]
  - - [5056, 64, 1, 32]
    - [34, 0.58]
  - - [2368, 5056, 1, 32]
    - [25, 2.568]
  - - [6784, 1856, 1, 32]
    - [25, 2.572]
  - - [64, 128, 1, 1]
    - [40, 0.001]
  - - [64, 2368, 1, 1280]
    - [12, 3.061]
  - - [128, 704, 1, 32]
    - [27, 0.134]
  - - [64, 6784, 1, 3328]
    - [13, 4.778]
  - - [2944, 256, 1, 1280]
    - [21, 5.791]
  - - [5056, 704, 1, 1]
    - [40, 0.122]
  - - [2944, 4288, 1, 256]
    - [21, 7.225]
  - - [1024, 1024, 1, 3328]
    - [23, 6.513]
  - - [5056, 704, 1, 32]
    - [29, 1.992]
  - - [1856, 4288, 1, 3328]
    - [21, 7.488]
  - - [1, 1856, 1, 256]
    - [55, 0.009]
  - - [6784, 4288, 1, 32]
    - [25, 2.783]
  - - [5888, 64, 1, 256]
    - [5, 3.42]
  - - [256, 128, 1, 1]
    - [52, 0.002]
  - - [5888, 5056, 1, 256]
    - [21, 7.275]
  - - [2944, 448, 1, 256]
    - [21, 5.249]
  - - [3584, 2368, 1, 3328]
    - [21, 7.502]
  - - [4288, 1856, 1, 1]
    - [45, 0.158]
  - - [1856, 2944, 1, 1]
    - [40, 0.141]
  - - [32, 4288, 1, 3328]
    - [38, 0.772]
  - - [1, 3584, 1, 3328]
    - [56, 0.027]
  - - [256, 32, 1, 3328]
    - [38, 0.072]
  - - [1856, 2368, 1, 32]
    - [25, 2.161]
  - - [4288, 1856, 1, 32]
    - [25, 2.437]
  - - [5056, 64, 1, 3328]
    - [5, 3.647]
  - - [6784, 1, 1, 1280]
    - [55, 0.033]
  - - [1024, 448, 1, 32]
    - [27, 0.719]
  - - [1408, 64, 1, 1]
    - [47, 0.006]
  - - [1, 1, 1, 3328]
    - [56, 0.0]
  - - [5056, 2368, 1, 256]
    - [21, 7.139]
  - - [1408, 5888, 1, 256]
    - [23, 7.147]
  - - [5056, 6784, 1, 1]
    - [45, 0.192]
  - - [32, 448, 1, 1280]
    - [38, 0.111]
  - - [32, 448, 1, 32]
    - [33, 0.022]
  - - [1856, 64, 1, 256]
    - [8, 1.976]
  - - [1024, 1408, 1, 3328]
    - [21, 6.331]
  - - [256, 5056, 1, 1280]
    - [21, 6.523]
  - - [704, 2368, 1, 1]
    - [42, 0.083]
  - - [64, 1024, 1, 32]
    - [27, 0.099]
  - - [1024, 256, 1, 256]
    - [9, 3.204]
  - - [128, 1, 1, 1]
    - [56, 0.0]
  - - [3584, 4288, 1, 1280]
    - [21, 7.632]
  - - [1856, 128, 1, 32]
    - [34, 0.404]
  - - [1856, 128, 1, 1280]
    - [16, 3.952]
  - - [128, 2944, 1, 3328]
    - [11, 4.226]
  - - [1, 6784, 1, 3328]
    - [55, 0.034]
  - - [3584, 2368, 1, 1]
    - [46, 0.16]
  - - [4288, 448, 1, 3328]
    - [21, 6.515]
  - - [4288, 32, 1, 3328]
    - [38, 0.773]
  - - [256, 1856, 1, 1]
    - [42, 0.031]
  - - [704, 6784, 1, 1280]
    - [21, 7.158]
  - - [2368, 4288, 1, 32]
    - [25, 2.511]
  - - [704, 5056, 1, 1280]
    - [21, 7.117]
  - - [256, 3584, 1, 3328]
    - [23, 5.701]
  - - [1024, 32, 1, 3328]
    - [38, 0.279]
  - - [3584, 6784, 1, 32]
    - [25, 2.779]
  - - [3584, 6784, 1, 1280]
    - [21, 7.702]
  - - [4288, 4288, 1, 3328]
    - [21, 7.649]
  - - [3584, 64, 1, 1280]
    - [16, 3.795]
  - - [64, 1856, 1, 256]
    - [3, 2.018]
  - - [3584, 64, 1, 32]
    - [34, 0.404]
  - - [448, 1, 1, 1280]
    - [56, 0.003]
  - - [256, 4288, 1, 1280]
    - [21, 5.562]
  - - [1408, 3584, 1, 1]
    - [39, 0.139]
  - - [4288, 1856, 1, 3328]
    - [21, 7.475]
  - - [1856, 2944, 1, 1280]
    - [21, 7.428]
  - - [4288, 256, 1, 256]
    - [21, 5.038]
  - - [128, 5888, 1, 32]
    - [33, 0.999]
  - - [128, 5888, 1, 1280]
    - [21, 5.769]
  - - [1408, 128, 1, 3328]
    - [14, 3.517]
  - - [3584, 256, 1, 256]
    - [21, 5.053]
  - - [32, 6784, 1, 3328]
    - [38, 1.213]
  - - [64, 64, 1, 1280]
    - [12, 0.122]
  - - [32, 3584, 1, 256]
    - [38, 0.685]
  - - [704, 256, 1, 32]
    - [27, 0.255]
  - - [448, 128, 1, 3328]
    - [12, 1.853]
  - - [64, 2944, 1, 3328]
    - [14, 3.707]
  - - [64, 4288, 1, 3328]
    - [2, 3.343]
  - - [5056, 1024, 1, 3328]
    - [23, 7.331]
  - - [128, 256, 1, 1280]
    - [12, 1.028]
  - - [1856, 256, 1, 256]
    - [9, 4.124]
  - - [3584, 704, 1, 1]
    - [45, 0.104]
  - - [256, 704, 1, 256]
    - [9, 2.385]
  - - [448, 5056, 1, 1]
    - [45, 0.099]
  - - [5888, 5888, 1, 256]
    - [21, 7.279]
  - - [3584, 704, 1, 32]
    - [33, 1.812]
  - - [448, 6784, 1, 3328]
    - [21, 7.097]
  - - [6784, 4288, 1, 1]
    - [41, 0.187]
  - - [3584, 6784, 1, 1]
    - [39, 0.189]
  - - [1408, 2368, 1, 32]
    - [25, 1.989]
  - - [448, 5056, 1, 32]
    - [29, 1.735]
  - - [4288, 4288, 1, 1280]
    - [21, 7.612]
  - - [6784, 1408, 1, 1]
    - [39, 0.166]
  - - [1856, 5888, 1, 3328]
    - [21, 7.639]
  - - [1024, 704, 1, 1]
    - [42, 0.046]
  - - [3584, 1856, 1, 3328]
    - [21, 7.41]
  - - [5056, 5888, 1, 1]
    - [40, 0.189]
  - - [2944, 1024, 1, 256]
    - [21, 6.542]
  - - [448, 1408, 1, 3328]
    - [21, 4.955]
  - - [5056, 32, 1, 3328]
    - [38, 0.912]
  - - [2368, 4288, 1, 3328]
    - [21, 7.628]
  - - [1024, 704, 1, 32]
    - [34, 0.977]
  - - [448, 2944, 1, 256]
    - [21, 5.223]
  - - [2944, 6784, 1, 256]
    - [21, 7.323]
  - - [2368, 2368, 1, 1280]
    - [21, 7.299]
  - - [5888, 128, 1, 3328]
    - [21, 5.845]
  - - [256, 256, 1, 32]
    - [27, 0.096]
  - - [1024, 1, 1, 256]
    - [55, 0.005]
  - - [3584, 3584, 1, 32]
    - [25, 2.64]
  - - [2944, 448, 1, 1]
    - [55, 0.066]
  - - [128, 32, 1, 32]
    - [27, 0.006]
  - - [5056, 64, 1, 1280]
    - [5, 3.527]
  - - [2944, 2944, 1, 1280]
    - [21, 7.406]
  - - [1, 2368, 1, 256]
    - [55, 0.011]
  - - [1408, 5056, 1, 1]
    - [39, 0.154]
  - - [2944, 32, 1, 1280]
    - [38, 0.74]
  - - [64, 1408, 1, 3328]
    - [12, 2.587]
  - - [256, 448, 1, 1280]
    - [12, 2.886]
  - - [2368, 6784, 1, 1]
    - [40, 0.165]
  - - [6784, 4288, 1, 1280]
    - [21, 7.576]
  - - [2944, 704, 1, 256]
    - [21, 6.382]
  - - [2368, 6784, 1, 1280]
    - [21, 7.605]
  - - [704, 2944, 1, 3328]
    - [10, 7.032]
  - - [5888, 256, 1, 1]
    - [40, 0.078]
  - - [704, 704, 1, 32]
    - [29, 0.742]
  - - [256, 4288, 1, 256]
    - [21, 5.107]
  - - [5056, 6784, 1, 32]
    - [25, 2.819]
  - - [5056, 128, 1, 1]
    - [40, 0.043]
  - - [448, 5056, 1, 1280]
    - [21, 6.807]
  - - [448, 448, 1, 256]
    - [9, 2.657]
  - - [256, 5888, 1, 3328]
    - [21, 6.606]
  - - [704, 448, 1, 1280]
    - [9, 3.388]
  - - [448, 64, 1, 256]
    - [3, 0.613]
  - - [1024, 704, 1, 1280]
    - [21, 5.514]
  - - [5888, 1024, 1, 1]
    - [44, 0.147]
  - - [5888, 448, 1, 32]
    - [33, 1.771]
  - - [6784, 2944, 1, 256]
    - [21, 7.204]
  - - [1024, 256, 1, 1]
    - [40, 0.018]
  - - [2368, 448, 1, 256]
    - [21, 4.85]
  - - [4288, 256, 1, 3328]
    - [21, 5.651]
  - - [4288, 2944, 1, 256]
    - [21, 7.196]
  - - [448, 5888, 1, 3328]
    - [21, 6.696]
  - - [128, 256, 1, 3328]
    - [12, 1.097]
  - - [128, 6784, 1, 32]
    - [29, 1.107]
  - - [1856, 64, 1, 32]
    - [27, 0.18]
  - - [1408, 4288, 1, 1]
    - [39, 0.147]
  - - [1408, 1856, 1, 3328]
    - [21, 7.226]
  - - [4288, 64, 1, 256]
    - [14, 2.599]
  - - [3584, 1024, 1, 3328]
    - [21, 7.407]
  - - [2944, 5888, 1, 3328]
    - [21, 7.648]
  - - [128, 6784, 1, 3328]
    - [5, 5.467]
  - - [448, 4288, 1, 3328]
    - [21, 6.524]
  - - [704, 2368, 1, 256]
    - [21, 5.788]
  - - [1, 64, 1, 3328]
    - [56, 0.0]
  - - [4288, 128, 1, 1]
    - [40, 0.037]
  - - [256, 2368, 1, 32]
    - [34, 0.886]
  - - [4288, 3584, 1, 3328]
    - [21, 7.675]
  - - [1408, 64, 1, 256]
    - [2, 1.564]
  - - [1408, 1024, 1, 1]
    - [39, 0.075]
  - - [64, 1024, 1, 1]
    - [47, 0.004]
  - - [1408, 1024, 1, 256]
    - [21, 5.719]
  - - [5056, 3584, 1, 1]
    - [45, 0.174]
  - - [448, 1024, 1, 256]
    - [21, 4.041]
  - - [6784, 6784, 1, 3328]
    - [23, 7.612]
  - - [6784, 32, 1, 32]
    - [33, 0.363]
  - - [64, 1024, 1, 3328]
    - [12, 2.06]
  - - [2368, 2944, 1, 3328]
    - [21, 7.494]
  - - [448, 448, 1, 1280]
    - [16, 3.325]
  - - [5056, 3584, 1, 32]
    - [25, 2.702]
  - - [5056, 3584, 1, 1280]
    - [21, 7.465]
  - - [1856, 1856, 1, 256]
    - [21, 6.508]
  - - [32, 5888, 1, 256]
    - [38, 0.831]
  - - [256, 1408, 1, 32]
    - [34, 0.565]
  - - [2944, 1, 1, 3328]
    - [56, 0.022]
  - - [32, 704, 1, 3328]
    - [38, 0.189]
  - - [5888, 4288, 1, 1]
    - [44, 0.188]
  - - [1024, 128, 1, 256]
    - [1, 2.166]
  - - [32, 1856, 1, 3328]
    - [38, 0.5]
  - - [5056, 704, 1, 256]
    - [21, 6.585]
  - - [2368, 5056, 1, 256]
    - [21, 7.254]
  - - [1024, 5056, 1, 256]
    - [21, 6.96]
  - - [32, 1024, 1, 3328]
    - [38, 0.276]
  - - [5888, 448, 1, 256]
    - [21, 6.076]
  - - [6784, 5056, 1, 1280]
    - [21, 7.58]
  - - [4288, 6784, 1, 1280]
    - [21, 7.733]
  - - [64, 1, 1, 256]
    - [55, 0.0]
  - - [1856, 64, 1, 1280]
    - [14, 2.964]
  - - [128, 1408, 1, 1]
    - [42, 0.01]
  - - [1024, 64, 1, 32]
    - [27, 0.1]
  - - [1024, 64, 1, 3328]
    - [12, 2.055]
  - - [704, 6784, 1, 3328]
    - [21, 7.221]
  - - [2944, 1856, 1, 1]
    - [40, 0.143]
  - - [5888, 4288, 1, 1280]
    - [21, 7.521]
  - - [5888, 3584, 1, 1280]
    - [21, 7.517]
  - - [32, 2368, 1, 1280]
    - [38, 0.598]
  - - [3584, 1408, 1, 1280]
    - [21, 7.194]
  - - [1024, 2944, 1, 256]
    - [23, 6.483]
  - - [1, 2944, 1, 1280]
    - [56, 0.02]
  - - [32, 1024, 1, 256]
    - [34, 0.161]
  - - [2944, 1856, 1, 1280]
    - [21, 7.43]
  - - [3584, 1, 1, 1280]
    - [56, 0.025]
  - - [256, 3584, 1, 32]
    - [33, 1.15]
  - - [1024, 2368, 1, 1]
    - [39, 0.102]
  - - [2944, 3584, 1, 1280]
    - [21, 7.503]
  - - [64, 1, 1, 1]
    - [45, 0.0]
  - - [1856, 4288, 1, 256]
    - [21, 7.088]
  - - [256, 1, 1, 256]
    - [55, 0.001]
  - - [256, 128, 1, 3328]
    - [12, 1.102]
  - - [1, 1856, 1, 3328]
    - [56, 0.014]
  - - [448, 3584, 1, 1]
    - [45, 0.083]
  - - [2368, 2944, 1, 32]
    - [25, 2.419]
  - - [128, 4288, 1, 32]
    - [34, 0.81]
  - - [448, 256, 1, 256]
    - [8, 1.844]
  - - [64, 64, 1, 1]
    - [45, 0.0]
  - - [1, 1408, 1, 1]
    - [40, 0.0]
  - - [2944, 32, 1, 32]
    - [27, 0.134]
  - - [448, 1856, 1, 1]
    - [51, 0.05]
  - - [4288, 704, 1, 256]
    - [21, 6.533]
  - - [1856, 1024, 1, 256]
    - [21, 5.913]
  - - [448, 1856, 1, 32]
    - [29, 1.078]
  - - [448, 1856, 1, 3328]
    - [17, 5.177]
  - - [448, 448, 1, 32]
    - [35, 0.247]
  - - [1024, 448, 1, 256]
    - [21, 4.041]
  - - [6784, 1, 1, 256]
    - [55, 0.028]
  - - [704, 6784, 1, 32]
    - [25, 2.135]
  - - [1024, 4288, 1, 1]
    - [40, 0.133]
  - - [704, 256, 1, 3328]
    - [16, 3.177]
  - - [704, 1856, 1, 32]
    - [33, 1.408]
  - - [1408, 5888, 1, 1280]
    - [21, 7.504]
  - - [32, 704, 1, 1280]
    - [38, 0.178]
  - - [5056, 1856, 1, 256]
    - [21, 7.092]
  - - [6784, 704, 1, 1280]
    - [21, 7.033]
  - - [704, 1408, 1, 32]
    - [33, 1.187]
  - - [5888, 1024, 1, 256]
    - [21, 6.978]
  - - [64, 2944, 1, 1]
    - [45, 0.011]
  - - [64, 2944, 1, 32]
    - [29, 0.259]
  - - [64, 2944, 1, 1280]
    - [12, 3.472]
  - - [6784, 1856, 1, 3328]
    - [21, 7.413]
  - - [2368, 5888, 1, 1280]
    - [21, 7.568]
  - - [5888, 6784, 1, 32]
    - [25, 2.836]
  - - [1, 6784, 1, 256]
    - [55, 0.028]
  - - [6784, 6784, 1, 32]
    - [25, 2.843]
  - - [256, 1, 1, 1280]
    - [56, 0.002]
  - - [5888, 128, 1, 32]
    - [29, 0.952]
  - - [6784, 256, 1, 256]
    - [21, 5.944]
  - - [2368, 3584, 1, 3328]
    - [21, 7.507]
  - - [128, 4288, 1, 1280]
    - [21, 4.239]
  - - [32, 3584, 1, 1280]
    - [38, 0.946]
  - - [5888, 1024, 1, 1280]
    - [21, 7.366]
  - - [1856, 704, 1, 3328]
    - [21, 6.709]
  - - [5888, 6784, 1, 3328]
    - [21, 7.604]
  - - [6784, 448, 1, 1]
    - [40, 0.112]
  - - [6784, 1856, 1, 1]
    - [41, 0.173]
  - - [128, 32, 1, 1280]
    - [38, 0.032]
  - - [2944, 2368, 1, 1280]
    - [21, 7.437]
  - - [128, 256, 1, 1]
    - [41, 0.002]
  - - [6784, 448, 1, 32]
    - [29, 1.88]
  - - [6784, 448, 1, 3328]
    - [21, 6.963]
  - - [1, 6784, 1, 1]
    - [45, 0.001]
  - - [448, 3584, 1, 1280]
    - [21, 6.069]
  - - [1408, 6784, 1, 1280]
    - [21, 7.509]
  - - [5056, 5888, 1, 1280]
    - [21, 7.554]
  - - [32, 2944, 1, 32]
    - [27, 0.139]
  - - [5888, 704, 1, 1]
    - [45, 0.128]
  - - [3584, 1856, 1, 1]
    - [45, 0.15]
  - - [1, 256, 1, 256]
    - [56, 0.001]
  - - [5056, 2944, 1, 32]
    - [25, 2.725]
  - - [32, 6784, 1, 256]
    - [38, 0.935]
  - - [4288, 6784, 1, 1]
    - [40, 0.189]
  - - [1, 4288, 1, 3328]
    - [55, 0.022]
  - - [1024, 6784, 1, 1]
    - [46, 0.14]
  - - [2368, 5888, 1, 32]
    - [25, 2.703]
  - - [448, 448, 1, 3328]
    - [16, 3.524]
  - - [1, 256, 1, 1]
    - [42, 0.0]
  - - [3584, 4288, 1, 1]
    - [46, 0.18]
  - - [5888, 1024, 1, 3328]
    - [21, 7.088]
  - - [6784, 5888, 1, 256]
    - [21, 7.297]
  - - [704, 128, 1, 1280]
    - [14, 2.42]
  - - [4288, 128, 1, 256]
    - [21, 3.768]
  - - [5056, 1024, 1, 1]
    - [40, 0.14]
  - - [32, 3584, 1, 3328]
    - [38, 0.995]
  - - [1024, 1, 1, 1280]
    - [56, 0.007]
  - - [4288, 2368, 1, 32]
    - [25, 2.566]
  - - [704, 3584, 1, 1]
    - [42, 0.103]
  - - [704, 1856, 1, 3328]
    - [21, 6.712]
  - - [2944, 128, 1, 1280]
    - [5, 4.111]
  - - [1, 2368, 1, 3328]
    - [56, 0.018]
  - - [6784, 704, 1, 32]
    - [25, 2.132]
  - - [4288, 1, 1, 1280]
    - [55, 0.021]
  - - [704, 5888, 1, 256]
    - [21, 6.835]
  - - [2368, 3584, 1, 1280]
    - [21, 7.46]
  - - [64, 448, 1, 256]
    - [3, 0.613]
  - - [1408, 448, 1, 1280]
    - [21, 4.828]
  - - [3584, 5056, 1, 32]
    - [25, 2.68]
  - - [1024, 32, 1, 1280]
    - [38, 0.259]
  - - [128, 2368, 1, 1]
    - [47, 0.021]
  - - [6784, 1856, 1, 1280]
    - [21, 7.376]
  - - [5056, 5056, 1, 3328]
    - [22, 7.252]
  - - [128, 704, 1, 1280]
    - [14, 2.409]
  - - [128, 2944, 1, 1280]
    - [5, 4.111]
  - - [2368, 5056, 1, 1]
    - [45, 0.173]
  - - [5888, 1408, 1, 256]
    - [23, 7.061]
  - - [2368, 1024, 1, 32]
    - [25, 1.767]
  - - [256, 256, 1, 3328]
    - [12, 2.051]
  - - [64, 4288, 1, 1]
    - [40, 0.019]
  - - [4288, 1024, 1, 256]
    - [21, 6.884]
  - - [3584, 32, 1, 32]
    - [34, 0.208]
  - - [3584, 64, 1, 1]
    - [51, 0.017]
  - - [704, 32, 1, 1280]
    - [38, 0.175]
  - - [32, 4288, 1, 32]
    - [38, 0.231]
  - - [64, 64, 1, 3328]
    - [12, 0.136]
  - - [64, 1408, 1, 1]
    - [47, 0.006]
  - - [4288, 5888, 1, 1280]
    - [21, 7.668]
  - - [1856, 2944, 1, 3328]
    - [21, 7.497]
  - - [256, 1024, 1, 256]
    - [9, 3.358]
  - - [5056, 5888, 1, 256]
    - [21, 7.278]
  - - [1408, 128, 1, 1280]
    - [14, 3.4]
  - - [5056, 256, 1, 3328]
    - [21, 6.547]
  - - [1024, 5888, 1, 1280]
    - [21, 7.517]
  - - [1024, 448, 1, 1]
    - [45, 0.032]
  - - [32, 32, 1, 32]
    - [29, 0.002]
  - - [5056, 1, 1, 1280]
    - [55, 0.025]
  - - [5888, 5056, 1, 1280]
    - [21, 7.553]
  - - [5888, 2944, 1, 1]
    - [39, 0.18]
  - - [64, 4288, 1, 1280]
    - [7, 3.354]
  - - [1408, 4288, 1, 3328]
    - [21, 7.287]
  - - [704, 2944, 1, 32]
    - [25, 1.763]
  - - [1, 5888, 1, 1280]
    - [55, 0.029]
  - - [2944, 4288, 1, 3328]
    - [21, 7.585]
  - - [256, 2944, 1, 256]
    - [21, 5.058]
  - - [704, 448, 1, 32]
    - [34, 0.534]
  - - [5056, 2944, 1, 256]
    - [21, 7.2]
  - - [704, 1024, 1, 256]
    - [21, 4.893]
  - - [2368, 1856, 1, 256]
    - [21, 6.9]
  - - [64, 3584, 1, 1]
    - [42, 0.012]
  - - [1024, 128, 1, 1280]
    - [14, 3.237]
  - - [2368, 4288, 1, 1280]
    - [21, 7.575]
  - - [3584, 448, 1, 256]
    - [21, 5.583]
  - - [256, 6784, 1, 256]
    - [21, 6.03]
  - - [1024, 32, 1, 32]
    - [27, 0.052]
  - - [1024, 1408, 1, 1]
    - [40, 0.076]
  - - [128, 64, 1, 32]
    - [27, 0.013]
  - - [64, 1, 1, 1280]
    - [56, 0.0]
  - - [2368, 32, 1, 32]
    - [27, 0.117]
  - - [256, 5888, 1, 1]
    - [45, 0.078]
  - - [2944, 2944, 1, 1]
    - [39, 0.164]
  - - [6784, 3584, 1, 256]
    - [21, 7.266]
  - - [1408, 1856, 1, 256]
    - [21, 6.604]
  - - [128, 1408, 1, 256]
    - [1, 2.359]
  - - [2944, 2944, 1, 32]
    - [25, 2.463]
  - - [2944, 2944, 1, 3328]
    - [21, 7.454]
  - - [1, 2944, 1, 256]
    - [55, 0.014]
  - - [448, 32, 1, 1280]
    - [38, 0.113]
  - - [3584, 1, 1, 256]
    - [51, 0.017]
  - - [704, 32, 1, 3328]
    - [38, 0.193]
  - - [256, 448, 1, 3328]
    - [14, 3.077]
  - - [128, 128, 1, 256]
    - [3, 0.36]
  - - [2368, 64, 1, 256]
    - [14, 2.111]
  - - [64, 448, 1, 1280]
    - [12, 0.899]
  - - [6784, 1408, 1, 32]
    - [25, 2.547]
  - - [1408, 448, 1, 3328]
    - [21, 4.947]
  - - [2368, 6784, 1, 3328]
    - [21, 7.649]
  - - [256, 2368, 1, 1]
    - [53, 0.039]
  - - [4288, 3584, 1, 32]
    - [25, 2.616]
  - - [5888, 64, 1, 3328]
    - [5, 4.225]
  - - [3584, 704, 1, 1280]
    - [21, 6.893]
  - - [448, 5056, 1, 3328]
    - [21, 6.906]
  - - [4288, 448, 1, 256]
    - [21, 5.885]
  - - [5056, 256, 1, 1280]
    - [21, 6.431]
  - - [704, 448, 1, 3328]
    - [16, 3.507]
  - - [2944, 5888, 1, 32]
    - [25, 2.731]
  - - [3584, 5056, 1, 256]
    - [21, 7.293]
  - - [6784, 1, 1, 3328]
    - [55, 0.034]
  - - [32, 2368, 1, 3328]
    - [38, 0.641]
  - - [4288, 256, 1, 1]
    - [41, 0.062]
  - - [64, 256, 1, 1]
    - [45, 0.001]
  - - [1856, 448, 1, 3328]
    - [21, 5.163]
  - - [3584, 2368, 1, 256]
    - [21, 7.094]
  - - [4288, 4288, 1, 256]
    - [21, 7.279]
  - - [4288, 256, 1, 1280]
    - [21, 5.562]
  - - [448, 5056, 1, 256]
    - [21, 6.216]
  - - [128, 1856, 1, 1]
    - [42, 0.017]
  - - [4288, 704, 1, 1280]
    - [21, 6.975]
  - - [128, 1856, 1, 32]
    - [38, 0.409]
  - - [2368, 704, 1, 1]
    - [45, 0.082]
  - - [3584, 32, 1, 256]
    - [38, 0.632]
  - - [448, 2368, 1, 1280]
    - [21, 5.362]
  - - [3584, 256, 1, 1]
    - [40, 0.055]
  - - [1408, 1856, 1, 1280]
    - [21, 7.135]
  - - [3584, 4288, 1, 3328]
    - [21, 7.682]
  - - [448, 4288, 1, 32]
    - [25, 1.667]
  - - [448, 4288, 1, 1280]
    - [21, 6.424]
  - - [64, 3584, 1, 256]
    - [9, 2.987]
  - - [1, 6784, 1, 1280]
    - [55, 0.033]
  - - [5056, 1024, 1, 256]
    - [21, 6.868]
  - - [2368, 448, 1, 32]
    - [29, 1.217]
  - - [4288, 3584, 1, 1280]
    - [21, 7.629]
  - - [32, 2944, 1, 1280]
    - [38, 0.718]
  - - [1408, 704, 1, 1]
    - [42, 0.056]
  - - [2368, 256, 1, 256]
    - [21, 4.185]
  - - [1, 5056, 1, 1]
    - [45, 0.0]
  - - [4288, 32, 1, 32]
    - [34, 0.258]
  - - [1856, 3584, 1, 32]
    - [25, 2.282]
  - - [5056, 3584, 1, 3328]
    - [19, 7.429]
  - - [4288, 5056, 1, 256]
    - [21, 7.381]
  - - [1856, 5888, 1, 256]
    - [21, 7.25]
  - - [256, 256, 1, 256]
    - [8, 1.331]
  - - [2368, 3584, 1, 1]
    - [40, 0.161]
  - - [4288, 2368, 1, 256]
    - [21, 7.21]
  - - [448, 1, 1, 3328]
    - [56, 0.003]
  - - [1856, 256, 1, 1280]
    - [16, 4.953]
  - - [256, 2944, 1, 1]
    - [41, 0.046]
  - - [1408, 2944, 1, 3328]
    - [21, 7.375]
  - - [32, 1856, 1, 32]
    - [27, 0.091]
  - - [5888, 3584, 1, 1]
    - [44, 0.185]
  - - [256, 1, 1, 1]
    - [47, 0.0]
  - - [6784, 5056, 1, 3328]
    - [21, 7.608]
  - - [6784, 5056, 1, 1]
    - [39, 0.193]
  - - [5888, 3584, 1, 32]
    - [25, 2.769]
  - - [5888, 3584, 1, 3328]
    - [21, 7.554]
  - - [32, 1024, 1, 1280]
    - [38, 0.254]
  - - [1, 256, 1, 3328]
    - [56, 0.002]
  - - [1024, 6784, 1, 256]
    - [21, 7.055]
  - - [6784, 5888, 1, 32]
    - [25, 2.825]
  - - [1408, 1, 1, 1280]
    - [56, 0.01]
  - - [2368, 6784, 1, 32]
    - [25, 2.701]
  - - [6784, 64, 1, 1]
    - [45, 0.032]
  - - [5056, 1408, 1, 1280]
    - [23, 7.211]
  - - [3584, 1408, 1, 3328]
    - [21, 7.252]
  - - [2944, 3584, 1, 1]
    - [39, 0.172]
  - - [2944, 1408, 1, 1280]
    - [21, 7.304]
  - - [1856, 64, 1, 1]
    - [40, 0.007]
  - - [3584, 1024, 1, 1]
    - [40, 0.123]
  - - [256, 32, 1, 256]
    - [38, 0.053]
  - - [2944, 1856, 1, 3328]
    - [21, 7.491]
  - - [128, 1024, 1, 3328]
    - [12, 3.486]
  - - [1408, 128, 1, 1]
    - [45, 0.01]
  - - [2944, 3584, 1, 32]
    - [25, 2.596]
  - - [5888, 256, 1, 32]
    - [32, 1.456]
  - - [6784, 64, 1, 256]
    - [21, 3.852]
  - - [256, 128, 1, 1280]
    - [12, 1.03]
  - - [6784, 5056, 1, 256]
    - [21, 7.304]
  - - [1408, 32, 1, 3328]
    - [38, 0.38]
  - - [1856, 3584, 1, 1280]
    - [21, 7.368]
  - - [256, 5888, 1, 256]
    - [21, 5.91]
  - - [5056, 32, 1, 256]
    - [38, 0.733]
  - - [1024, 4288, 1, 3328]
    - [21, 7.379]
  - - [448, 2368, 1, 256]
    - [21, 4.906]
  - - [64, 1408, 1, 1280]
    - [12, 2.42]
  - - [3584, 32, 1, 1280]
    - [38, 0.92]
  - - [128, 2368, 1, 3328]
    - [5, 3.414]
  - - [64, 5056, 1, 256]
    - [5, 3.028]
  - - [256, 64, 1, 256]
    - [3, 0.35]
  - - [32, 1408, 1, 256]
    - [34, 0.239]
  - - [2368, 448, 1, 3328]
    - [21, 5.473]
  - - [2368, 1408, 1, 1]
    - [40, 0.118]
  - - [1, 1, 1, 1]
    - [45, 0.0]
  - - [1024, 1856, 1, 32]
    - [25, 1.612]
  - - [32, 1024, 1, 32]
    - [26, 0.049]
  - - [4288, 1, 1, 256]
    - [55, 0.018]
  - - [1856, 128, 1, 3328]
    - [16, 4.173]
  - - [5888, 2368, 1, 1]
    - [45, 0.177]
  - - [2368, 2368, 1, 1]
    - [40, 0.144]
  - - [704, 256, 1, 1280]
    - [16, 2.994]
  - - [704, 4288, 1, 256]
    - [21, 6.486]
  - - [5888, 2368, 1, 32]
    - [25, 2.592]
  - - [5888, 2368, 1, 1280]
    - [20, 7.196]
  - - [128, 256, 1, 256]
    - [3, 0.701]
  - - [2944, 5056, 1, 3328]
    - [21, 7.699]
  - - [6784, 704, 1, 3328]
    - [21, 7.083]
  - - [1856, 1856, 1, 32]
    - [25, 2.023]
  - - [4288, 2944, 1, 32]
    - [25, 2.566]
  - - [256, 5056, 1, 1]
    - [41, 0.069]
  - - [704, 64, 1, 256]
    - [3, 0.947]
  - - [256, 2368, 1, 3328]
    - [21, 4.764]
  - - [704, 1, 1, 1]
    - [40, 0.0]
  - - [128, 448, 1, 1280]
    - [12, 1.73]
  - - [5056, 5056, 1, 256]
    - [21, 7.257]
  - - [5888, 256, 1, 256]
    - [21, 5.862]
  - - [5888, 64, 1, 1]
    - [42, 0.028]
  - - [6784, 6784, 1, 256]
    - [23, 7.385]
  - - [256, 3584, 1, 1]
    - [40, 0.054]
  - - [2368, 1, 1, 256]
    - [55, 0.011]
  - - [448, 32, 1, 32]
    - [27, 0.023]
  - - [704, 64, 1, 1]
    - [53, 0.003]
  - - [3584, 704, 1, 3328]
    - [21, 6.974]
  - - [4288, 704, 1, 3328]
    - [21, 7.041]
  - - [4288, 2944, 1, 1280]
    - [21, 7.527]
  - - [448, 3584, 1, 256]
    - [21, 5.583]
  - - [704, 32, 1, 256]
    - [34, 0.119]
  - - [6784, 256, 1, 32]
    - [33, 1.59]
  - - [1856, 128, 1, 1]
    - [42, 0.016]
  - - [1856, 32, 1, 32]
    - [27, 0.096]
  - - [6784, 1408, 1, 1280]
    - [21, 7.367]
  - - [2368, 5056, 1, 1280]
    - [21, 7.595]
  - - [704, 1856, 1, 1280]
    - [21, 6.563]
  - - [1408, 1408, 1, 1280]
    - [23, 6.701]
  - - [448, 1024, 1, 3328]
    - [21, 4.932]
  - - [32, 704, 1, 32]
    - [27, 0.035]
  - - [256, 704, 1, 1]
    - [45, 0.01]
  - - [5888, 1856, 1, 32]
    - [25, 2.575]
  - - [5888, 704, 1, 3328]
    - [21, 7.241]
  - - [5056, 1, 1, 256]
    - [55, 0.021]
  - - [448, 6784, 1, 256]
    - [21, 6.524]
  - - [1024, 128, 1, 1]
    - [47, 0.008]
  - - [128, 64, 1, 256]
    - [3, 0.157]
  - - [1856, 128, 1, 256]
    - [9, 3.11]
  - - [2944, 5888, 1, 256]
    - [21, 7.296]
  - - [1024, 256, 1, 1280]
    - [16, 4.325]
  - - [128, 5056, 1, 32]
    - [29, 0.919]
  - - [128, 5056, 1, 1280]
    - [21, 4.985]
  - - [448, 32, 1, 3328]
    - [38, 0.119]
  - - [1856, 1408, 1, 32]
    - [25, 1.877]
  - - [64, 704, 1, 32]
    - [27, 0.068]
  - - [64, 704, 1, 3328]
    - [12, 1.482]
  - - [64, 2368, 1, 32]
    - [27, 0.222]
  - - [5888, 64, 1, 32]
    - [36, 0.567]
  - - [2368, 256, 1, 1]
    - [55, 0.036]
  - - [5888, 64, 1, 1280]
    - [11, 4.081]
  - - [5056, 1, 1, 1]
    - [53, 0.0]
  - - [5888, 2944, 1, 1280]
    - [23, 7.343]
  - - [32, 2368, 1, 256]
    - [34, 0.396]
  - - [256, 1408, 1, 256]
    - [9, 3.283]
  - - [448, 5888, 1, 1]
    - [45, 0.107]
  - - [3584, 1408, 1, 1]
    - [39, 0.138]
  - - [32, 6784, 1, 1280]
    - [38, 1.169]
  - - [32, 6784, 1, 32]
    - [34, 0.361]
  - - [448, 5888, 1, 32]
    - [25, 1.816]
  - - [5056, 704, 1, 1280]
    - [21, 6.993]
  - - [1856, 6784, 1, 1]
    - [45, 0.173]
  - - [5056, 64, 1, 1]
    - [47, 0.023]
  - - [1, 5888, 1, 1]
    - [40, 0.0]
  - - [2368, 1024, 1, 256]
    - [21, 6.206]
  - - [1856, 6784, 1, 32]
    - [25, 2.626]
  - - [1856, 6784, 1, 1280]
    - [21, 7.529]
  - - [64, 3584, 1, 3328]
    - [13, 4.029]
  - - [5888, 5056, 1, 3328]
    - [19, 7.423]
  - - [1, 2944, 1, 3328]
    - [56, 0.022]
  - - [1408, 6784, 1, 32]
    - [25, 2.507]
  - - [32, 5888, 1, 1280]
    - [38, 1.014]
  - - [448, 256, 1, 1]
    - [40, 0.007]
  - - [3584, 5888, 1, 3328]
    - [21, 7.707]
  - - [4288, 1408, 1, 256]
    - [21, 6.881]
  - - [448, 64, 1, 1280]
    - [12, 0.904]
  - - [128, 448, 1, 32]
    - [37, 0.08]
  - - [6784, 2368, 1, 256]
    - [21, 7.164]
  - - [1408, 448, 1, 32]
    - [29, 0.908]
  - - [1856, 1408, 1, 1280]
    - [21, 7.142]
  - - [448, 256, 1, 3328]
    - [14, 3.066]
  - - [1856, 2368, 1, 1]
    - [40, 0.133]
  - - [1408, 5056, 1, 3328]
    - [21, 7.4]
  - - [128, 704, 1, 3328]
    - [12, 2.603]
  - - [5056, 128, 1, 1280]
    - [5, 4.989]
  - - [5056, 4288, 1, 256]
    - [21, 7.245]
  - - [5056, 5056, 1, 32]
    - [25, 2.788]
  - - [1856, 704, 1, 256]
    - [21, 5.895]
  - - [64, 256, 1, 256]
    - [3, 0.363]
  - - [448, 5888, 1, 1280]
    - [21, 6.612]
  - - [128, 6784, 1, 256]
    - [5, 4.782]
  - - [5056, 448, 1, 256]
    - [21, 6.181]
  - - [4288, 5888, 1, 1]
    - [40, 0.187]
  - - [1856, 5056, 1, 1280]
    - [21, 7.573]
  - - [2368, 4288, 1, 1]
    - [45, 0.167]
  - - [2368, 32, 1, 3328]
    - [38, 0.637]
  - - [3584, 1856, 1, 256]
    - [21, 7.002]
  - - [256, 3584, 1, 256]
    - [21, 5.018]
  - - [64, 704, 1, 1]
    - [45, 0.003]
  - - [4288, 5888, 1, 32]
    - [25, 2.749]
  - - [4288, 5888, 1, 3328]
    - [21, 7.706]
  - - [1, 1024, 1, 1]
    - [45, 0.0]
  - - [1024, 2944, 1, 3328]
    - [21, 7.045]
  - - [2944, 2368, 1, 256]
    - [21, 7.077]
  - - [1024, 1856, 1, 256]
    - [21, 5.906]
  - - [2944, 64, 1, 3328]
    - [15, 3.468]
  - - [1024, 5888, 1, 32]
    - [33, 2.226]
  - - [1024, 5888, 1, 3328]
    - [21, 7.581]
  - - [5056, 2368, 1, 32]
    - [25, 2.5]
  - - [1408, 2368, 1, 1280]
    - [21, 7.151]
  - - [256, 1, 1, 3328]
    - [56, 0.002]
  - - [128, 1024, 1, 32]
    - [27, 0.194]
  - - [5056, 6784, 1, 3328]
    - [21, 7.62]
  - - [448, 704, 1, 1]
    - [55, 0.021]
  - - [32, 64, 1, 32]
    - [27, 0.003]
  - - [448, 704, 1, 32]
    - [34, 0.508]
  - - [448, 704, 1, 3328]
    - [16, 3.513]
  - - [1408, 2944, 1, 256]
    - [23, 6.896]
  - - [64, 5888, 1, 1]
    - [50, 0.026]
  - - [2368, 128, 1, 32]
    - [34, 0.513]
  - - [2368, 256, 1, 1280]
    - [21, 4.682]
  - - [2368, 128, 1, 3328]
    - [11, 3.412]
  - - [704, 5056, 1, 32]
    - [25, 2.086]
  - - [32, 2368, 1, 32]
    - [27, 0.114]
  - - [1408, 1, 1, 256]
    - [55, 0.007]
  - - [4288, 256, 1, 32]
    - [33, 1.294]
  - - [448, 1408, 1, 1]
    - [51, 0.04]
  - - [5056, 4288, 1, 1280]
    - [21, 7.535]
  - - [1408, 256, 1, 256]
    - [21, 3.296]
  - - [4288, 448, 1, 1]
    - [40, 0.065]
  - - [256, 4288, 1, 32]
    - [29, 1.274]
  - - [1408, 256, 1, 1280]
    - [16, 3.821]
  - - [256, 256, 1, 1]
    - [40, 0.004]
  - - [1408, 1, 1, 1]
    - [47, 0.0]
  - - [448, 1408, 1, 256]
    - [21, 4.305]
  - - [5888, 5888, 1, 1]
    - [44, 0.196]
  - - [128, 2944, 1, 32]
    - [34, 0.613]
  - - [32, 256, 1, 32]
    - [34, 0.018]
  - - [2944, 704, 1, 1280]
    - [21, 6.935]
  - - [1024, 3584, 1, 1280]
    - [21, 7.337]
  - - [1856, 448, 1, 1]
    - [40, 0.05]
  - - [2368, 2944, 1, 1]
    - [45, 0.153]
  - - [5056, 256, 1, 32]
    - [33, 1.425]
  - - [4288, 1, 1, 3328]
    - [55, 0.022]
  - - [5056, 1024, 1, 1280]
    - [23, 7.244]
  - - [704, 704, 1, 1]
    - [45, 0.033]
  - - [1856, 448, 1, 1280]
    - [21, 5.077]
  - - [3584, 6784, 1, 256]
    - [21, 7.395]
  - - [64, 1856, 1, 1280]
    - [14, 2.983]
  - - [1856, 1408, 1, 256]
    - [21, 6.611]
  - - [4288, 4288, 1, 32]
    - [25, 2.716]
  - - [128, 1, 1, 256]
    - [55, 0.001]
  - - [32, 64, 1, 3328]
    - [38, 0.017]
  - - [5888, 448, 1, 1]
    - [40, 0.104]
  - - [128, 5888, 1, 256]
    - [21, 4.974]
  - - [3584, 256, 1, 3328]
    - [17, 5.703]
  - - [5056, 5056, 1, 1280]
    - [21, 7.537]
  - - [6784, 1408, 1, 3328]
    - [21, 7.409]
  - - [448, 2368, 1, 1]
    - [53, 0.06]
  - - [2368, 1, 1, 1280]
    - [56, 0.016]
  - - [32, 3584, 1, 32]
    - [34, 0.204]
  - - [128, 6784, 1, 1]
    - [45, 0.055]
  - - [1, 3584, 1, 1]
    - [40, 0.0]
  - - [5888, 5888, 1, 3328]
    - [19, 7.505]
  - - [256, 2944, 1, 3328]
    - [21, 5.912]
  - - [1, 128, 1, 3328]
    - [56, 0.001]
  - - [32, 256, 1, 256]
    - [38, 0.053]
  - - [5888, 1408, 1, 32]
    - [25, 2.539]
  - - [704, 256, 1, 1]
    - [45, 0.011]
  - - [1, 448, 1, 1]
    - [46, 0.0]
  - - [256, 6784, 1, 3328]
    - [21, 6.655]
  - - [64, 5888, 1, 256]
    - [5, 3.472]
  - - [1856, 1, 1, 1]
    - [40, 0.0]
  - - [1024, 256, 1, 3328]
    - [16, 4.592]
  - - [704, 704, 1, 256]
    - [21, 4.302]
  - - [448, 1024, 1, 32]
    - [29, 0.673]
  - - [6784, 2368, 1, 1280]
    - [21, 7.451]
  - - [128, 1856, 1, 1280]
    - [13, 3.947]
  - - [256, 2368, 1, 256]
    - [21, 4.161]
  - - [2944, 1408, 1, 1]
    - [40, 0.13]
  - - [6784, 1024, 1, 256]
    - [21, 6.94]
  - - [5056, 1408, 1, 32]
    - [25, 2.379]
  - - [1408, 6784, 1, 3328]
    - [21, 7.561]
  - - [2944, 1408, 1, 3328]
    - [21, 7.374]
  - - [1856, 32, 1, 256]
    - [34, 0.318]
  - - [704, 2368, 1, 32]
    - [29, 1.522]
  - - [448, 256, 1, 32]
    - [28, 0.165]
  - - [704, 6784, 1, 1]
    - [45, 0.137]
  - - [2368, 6784, 1, 256]
    - [21, 7.271]
  - - [1856, 3584, 1, 3328]
    - [21, 7.423]
  - - [1, 704, 1, 3328]
    - [56, 0.005]
  - - [64, 1, 1, 3328]
    - [56, 0.0]
  - - [448, 704, 1, 1280]
    - [9, 3.401]
  - - [704, 1856, 1, 1]
    - [47, 0.07]
  - - [704, 448, 1, 256]
    - [21, 2.895]
  - - [448, 64, 1, 3328]
    - [12, 0.969]
  - - [704, 6784, 1, 256]
    - [21, 6.766]
  - - [256, 32, 1, 1280]
    - [38, 0.065]
  - - [2368, 448, 1, 1280]
    - [21, 5.387]
  - - [6784, 2944, 1, 32]
    - [25, 2.759]
  - - [64, 4288, 1, 32]
    - [27, 0.464]
  - - [128, 704, 1, 1]
    - [47, 0.006]
  - - [128, 448, 1, 3328]
    - [14, 1.862]
  - - [5888, 2368, 1, 3328]
    - [21, 7.457]
  - - [2368, 704, 1, 1280]
    - [21, 6.313]
  - - [1024, 1408, 1, 1280]
    - [21, 6.233]
  - - [4288, 64, 1, 1280]
    - [14, 3.236]
  - - [128, 5056, 1, 1]
    - [51, 0.043]
  - - [2944, 5056, 1, 32]
    - [25, 2.672]
  - - [448, 448, 1, 1]
    - [55, 0.011]
  - - [256, 2368, 1, 1280]
    - [21, 4.673]
  - - [704, 2368, 1, 3328]
    - [21, 6.389]
  - - [3584, 2944, 1, 256]
    - [21, 7.157]
  - - [64, 6784, 1, 256]
    - [9, 3.896]
  - - [3584, 1024, 1, 1280]
    - [21, 7.322]
  - - [64, 1024, 1, 256]
    - [3, 1.298]
  - - [1408, 32, 1, 32]
    - [27, 0.071]
  - - [128, 3584, 1, 256]
    - [9, 4.056]
  - - [704, 1408, 1, 1]
    - [42, 0.057]
  - - [5056, 3584, 1, 256]
    - [21, 7.178]
  - - [2368, 704, 1, 256]
    - [21, 5.805]
  - - [1856, 1856, 1, 1280]
    - [21, 6.903]
  - - [32, 5888, 1, 32]
    - [27, 0.33]
  - - [64, 32, 1, 32]
    - [27, 0.003]
  - - [4288, 704, 1, 1]
    - [43, 0.088]
  - - [1856, 1024, 1, 1]
    - [45, 0.088]
  - - [4288, 2944, 1, 3328]
    - [21, 7.575]
  - - [1024, 128, 1, 3328]
    - [12, 3.495]
  - - [4288, 128, 1, 3328]
    - [16, 4.331]
  - - [4288, 704, 1, 32]
    - [33, 1.911]
  - - [1856, 1024, 1, 32]
    - [31, 1.577]
  - - [1, 448, 1, 3328]
    - [56, 0.003]
  - - [2944, 6784, 1, 1]
    - [44, 0.189]
  - - [6784, 2368, 1, 32]
    - [25, 2.667]
  - - [5888, 5056, 1, 1]
    - [39, 0.191]
  - - [128, 6784, 1, 1280]
    - [11, 5.351]
  - - [704, 5888, 1, 1]
    - [40, 0.131]
  - - [6784, 6784, 1, 1]
    - [44, 0.189]
  - - [1856, 32, 1, 1280]
    - [38, 0.472]
  - - [5888, 448, 1, 3328]
    - [21, 6.579]
  - - [704, 5888, 1, 32]
    - [25, 2.174]
  - - [704, 5888, 1, 1280]
    - [21, 7.302]
  - - [1024, 6784, 1, 3328]
    - [21, 7.482]
  - - [704, 2944, 1, 1280]
    - [21, 6.927]
  - - [4288, 6784, 1, 256]
    - [21, 7.421]
  - - [3584, 256, 1, 32]
    - [29, 1.15]
  - - [1408, 1408, 1, 32]
    - [25, 1.682]
  - - [1408, 1408, 1, 3328]
    - [23, 6.772]
  - - [1024, 64, 1, 256]
    - [3, 1.308]
  - - [4288, 64, 1, 32]
    - [34, 0.462]
  - - [1408, 256, 1, 32]
    - [34, 0.6]
  - - [5888, 128, 1, 256]
    - [21, 5.058]
  - - [64, 704, 1, 1280]
    - [12, 1.377]
  - - [2944, 1856, 1, 256]
    - [21, 7.027]
  - - [128, 5056, 1, 3328]
    - [5, 5.09]
  - - [4288, 2944, 1, 1]
    - [45, 0.173]
  - - [6784, 5056, 1, 32]
    - [25, 2.805]
  - - [1024, 448, 1, 3328]
    - [16, 4.977]
  - - [3584, 128, 1, 1]
    - [47, 0.033]
  - - [2944, 4288, 1, 1280]
    - [21, 7.536]
  - - [64, 32, 1, 3328]
    - [38, 0.017]
  - - [1024, 4288, 1, 256]
    - [21, 6.884]
  - - [128, 2368, 1, 256]
    - [0, 2.882]
  - - [2368, 64, 1, 32]
    - [27, 0.224]
  - - [1408, 1, 1, 3328]
    - [56, 0.01]
  - - [64, 1408, 1, 32]
    - [29, 0.135]
  - - [2368, 5888, 1, 1]
    - [45, 0.176]
  - - [1408, 1856, 1, 32]
    - [33, 1.783]
  - - [448, 1856, 1, 256]
    - [21, 4.569]
  - - [1856, 6784, 1, 3328]
    - [21, 7.567]
  - - [3584, 128, 1, 256]
    - [9, 4.056]
  - - [1024, 448, 1, 1280]
    - [21, 4.795]
  - - [1024, 2368, 1, 32]
    - [25, 1.78]
  - - [32, 2944, 1, 256]
    - [34, 0.449]
  - - [128, 5888, 1, 1]
    - [44, 0.047]
  - - [64, 5056, 1, 1]
    - [47, 0.022]
  - - [1856, 256, 1, 32]
    - [27, 0.711]
  - - [2368, 2368, 1, 3328]
    - [21, 7.358]
  - - [64, 448, 1, 1]
    - [54, 0.002]
  - - [3584, 5888, 1, 32]
    - [25, 2.71]
  - - [3584, 5888, 1, 1280]
    - [21, 7.665]
  - - [64, 5056, 1, 32]
    - [34, 0.554]
  - - [2944, 64, 1, 1]
    - [47, 0.011]
  - - [6784, 704, 1, 256]
    - [21, 6.668]
  - - [3584, 1024, 1, 32]
    - [25, 2.109]
  - - [1408, 704, 1, 32]
    - [29, 1.197]
  - - [1408, 704, 1, 1280]
    - [21, 6.021]
  - - [2368, 5888, 1, 256]
    - [21, 7.247]
  - - [2944, 64, 1, 32]
    - [27, 0.26]
  - - [1, 1408, 1, 256]
    - [55, 0.007]
  - - [64, 2944, 1, 256]
    - [1, 2.536]
  - - [5888, 5888, 1, 32]
    - [25, 2.809]
  - - [1856, 1408, 1, 3328]
    - [21, 7.231]
  - - [1024, 1024, 1, 32]
    - [29, 1.251]
  - - [4288, 1024, 1, 1]
    - [40, 0.131]
  - - [704, 4288, 1, 3328]
    - [21, 7.053]
  - - [2944, 5056, 1, 1280]
    - [21, 7.654]
  - - [6784, 2944, 1, 1280]
    - [21, 7.483]
  - - [6784, 256, 1, 3328]
    - [21, 6.552]
  - - [5056, 128, 1, 3328]
    - [5, 5.091]
  - - [128, 128, 1, 1280]
    - [12, 0.514]
  - - [128, 4288, 1, 1]
    - [53, 0.036]
  - - [1408, 5056, 1, 32]
    - [25, 2.302]
  - - [2944, 128, 1, 3328]
    - [5, 4.234]
  - - [5888, 1856, 1, 1280]
    - [21, 7.435]
  - - [64, 128, 1, 256]
    - [3, 0.166]
  - - [5888, 256, 1, 1280]
    - [21, 6.421]
  - - [1856, 5056, 1, 1]
    - [45, 0.152]
  - - [3584, 1856, 1, 1280]
    - [21, 7.366]
  - - [6784, 448, 1, 256]
    - [21, 6.398]
  - - [704, 3584, 1, 256]
    - [21, 6.363]
  - - [1856, 5056, 1, 32]
    - [25, 2.514]
  - - [1856, 5056, 1, 3328]
    - [21, 7.628]
  - - [1024, 2944, 1, 32]
    - [25, 1.925]
  - - [1408, 6784, 1, 256]
    - [21, 7.169]
  - - [1024, 2368, 1, 1280]
    - [21, 6.642]
  - - [1856, 3584, 1, 1]
    - [45, 0.151]
  - - [5888, 128, 1, 1280]
    - [21, 5.743]
  - - [2944, 5888, 1, 1280]
    - [21, 7.607]
  - - [1, 1856, 1, 1]
    - [50, 0.0]
  - - [3584, 3584, 1, 256]
    - [21, 7.299]
  - - [1856, 2368, 1, 3328]
    - [21, 7.384]
  - - [5888, 704, 1, 256]
    - [21, 6.769]
  - - [64, 448, 1, 32]
    - [27, 0.044]
  - - [6784, 4288, 1, 256]
    - [21, 7.297]
  - - [128, 64, 1, 3328]
    - [12, 0.271]
  - - [1, 5056, 1, 1280]
    - [55, 0.025]
  - - [32, 64, 1, 1280]
    - [38, 0.016]
  - - [1408, 2368, 1, 3328]
    - [21, 7.222]
  - - [1024, 3584, 1, 256]
    - [21, 6.858]
  - - [2944, 128, 1, 256]
    - [11, 3.407]
  - - [6784, 128, 1, 1]
    - [42, 0.053]
  - - [1408, 256, 1, 3328]
    - [16, 3.928]
  - - [448, 32, 1, 256]
    - [34, 0.075]
  - - [1024, 32, 1, 256]
    - [34, 0.174]
  - - [1, 5888, 1, 256]
    - [55, 0.024]
  - - [64, 2368, 1, 256]
    - [1, 2.255]
  - - [2944, 256, 1, 256]
    - [21, 5.086]
  - - [1, 128, 1, 256]
    - [55, 0.001]
  - - [32, 256, 1, 1280]
    - [38, 0.069]
  - - [5888, 1, 1, 256]
    - [55, 0.024]
  - - [32, 128, 1, 3328]
    - [38, 0.035]
  - - [6784, 128, 1, 256]
    - [21, 4.696]
  - - [6784, 64, 1, 1280]
    - [16, 4.57]
  - - [4288, 1024, 1, 32]
    - [25, 2.188]
  - - [1408, 64, 1, 3328]
    - [14, 2.591]
  - - [2944, 448, 1, 1280]
    - [21, 5.735]
  - - [6784, 32, 1, 1280]
    - [38, 1.154]
  - - [2944, 64, 1, 1280]
    - [14, 3.456]
  - - [704, 448, 1, 1]
    - [53, 0.022]
  - - [32, 128, 1, 32]
    - [27, 0.006]
  - - [1, 128, 1, 1]
    - [45, 0.0]
  - - [5888, 1, 1, 1]
    - [40, 0.0]
  - - [5888, 1856, 1, 3328]
    - [20, 7.356]
  - - [2368, 3584, 1, 256]
    - [21, 7.102]
  - - [4288, 1408, 1, 3328]
    - [21, 7.279]
  - - [1856, 32, 1, 3328]
    - [38, 0.5]
  - - [2944, 32, 1, 256]
    - [34, 0.478]
  - - [128, 64, 1, 1]
    - [56, 0.001]
  - - [256, 1024, 1, 3328]
    - [16, 4.602]
  - - [32, 448, 1, 256]
    - [34, 0.075]
  - - [1856, 64, 1, 3328]
    - [14, 3.192]
  - - [256, 5056, 1, 256]
    - [21, 5.884]
  - - [5888, 2944, 1, 3328]
    - [21, 7.493]
  - - [2368, 1408, 1, 3328]
    - [21, 7.221]
  - - [5888, 704, 1, 32]
    - [33, 2.076]
  - - [2944, 704, 1, 1]
    - [45, 0.092]
  - - [6784, 1856, 1, 256]
    - [21, 7.078]
  - - [1, 704, 1, 256]
    - [55, 0.003]
  - - [1856, 1856, 1, 1]
    - [40, 0.121]
  - - [5888, 32, 1, 256]
    - [38, 0.837]
  - - [128, 704, 1, 256]
    - [12, 1.599]
  - - [256, 1408, 1, 3328]
    - [16, 3.925]
  - - [2944, 128, 1, 1]
    - [55, 0.023]
  - - [32, 256, 1, 3328]
    - [38, 0.071]
  - - [2944, 704, 1, 3328]
    - [21, 7.031]
  - - [704, 1024, 1, 32]
    - [34, 0.977]
  - - [2368, 1856, 1, 32]
    - [25, 2.151]
  - - [5056, 4288, 1, 3328]
    - [19, 7.435]
  - - [3584, 448, 1, 3328]
    - [21, 6.157]
  - - [256, 32, 1, 32]
    - [34, 0.018]
  - - [64, 256, 1, 3328]
    - [12, 0.553]
  - - [256, 6784, 1, 1]
    - [40, 0.086]
  - - [1024, 3584, 1, 32]
    - [25, 2.093]
  - - [256, 6784, 1, 32]
    - [33, 1.581]
  - - [2944, 1408, 1, 32]
    - [25, 2.17]
  - - [4288, 3584, 1, 1]
    - [45, 0.18]
  - - [1, 704, 1, 1]
    - [47, 0.0]
  - - [5056, 448, 1, 3328]
    - [21, 6.785]
  - - [3584, 64, 1, 256]
    - [9, 2.987]
  - - [64, 1856, 1, 32]
    - [27, 0.181]
  - - [64, 1856, 1, 3328]
    - [14, 3.184]
  - - [6784, 3584, 1, 32]
    - [25, 2.812]
  - - [4288, 1856, 1, 256]
    - [21, 7.067]
  - - [1856, 2944, 1, 256]
    - [21, 7.027]
  - - [128, 448, 1, 1]
    - [47, 0.004]
  - - [64, 128, 1, 32]
    - [27, 0.012]
  - - [704, 1, 1, 1280]
    - [56, 0.005]
  - - [2944, 5888, 1, 1]
    - [44, 0.18]
  - - [1024, 1856, 1, 3328]
    - [23, 6.497]
  - - [5888, 1024, 1, 32]
    - [25, 2.37]
  - - [3584, 256, 1, 1280]
    - [21, 5.585]
  - - [1024, 1, 1, 1]
    - [50, 0.0]
  - - [1408, 5056, 1, 1280]
    - [21, 7.349]
  - - [3584, 128, 1, 1280]
    - [16, 4.804]
  - - [5056, 6784, 1, 256]
    - [21, 7.3]
  - - [256, 1856, 1, 256]
    - [21, 4.185]
  - - [5888, 32, 1, 1280]
    - [38, 1.014]
  - - [256, 128, 1, 32]
    - [29, 0.048]
  - - [32, 1856, 1, 1280]
    - [38, 0.46]
  - - [2944, 5056, 1, 1]
    - [39, 0.18]
  - - [448, 128, 1, 1]
    - [47, 0.004]
  - - [256, 704, 1, 32]
    - [30, 0.232]
  - - [256, 704, 1, 1280]
    - [16, 2.998]
  - - [1, 2368, 1, 1]
    - [51, 0.0]
  - - [5888, 5888, 1, 1280]
    - [21, 7.553]
  - - [256, 2944, 1, 1280]
    - [21, 5.772]
  - - [2944, 256, 1, 3328]
    - [21, 5.91]
  - - [5056, 2944, 1, 1280]
    - [21, 7.496]
  - - [704, 1024, 1, 3328]
    - [21, 5.655]
  - - [2368, 1856, 1, 1280]
    - [21, 7.316]
  - - [448, 2944, 1, 1]
    - [41, 0.072]
  - - [6784, 2944, 1, 1]
    - [39, 0.187]
  - - [2944, 1024, 1, 32]
    - [25, 1.993]
  - - [2944, 1024, 1, 1280]
    - [21, 6.965]
  - - [1408, 64, 1, 32]
    - [29, 0.137]
  - - [5056, 5056, 1, 1]
    - [40, 0.186]
  - - [2368, 4288, 1, 256]
    - [21, 7.229]
  - - [448, 1856, 1, 1280]
    - [21, 5.058]
  - - [2368, 448, 1, 1]
    - [49, 0.057]
  - - [448, 2944, 1, 32]
    - [33, 1.376]
  - - [448, 2944, 1, 1280]
    - [21, 5.722]
  - - [2944, 6784, 1, 1280]
    - [21, 7.63]
  - - [256, 6784, 1, 1280]
    - [21, 6.571]
  - - [128, 2368, 1, 1280]
    - [0, 3.508]
  - - [3584, 2368, 1, 32]
    - [25, 2.492]
  - - [704, 32, 1, 32]
    - [29, 0.035]
  - - [6784, 3584, 1, 3328]
    - [19, 7.469]
  - - [128, 32, 1, 256]
    - [34, 0.021]
  - - [128, 1408, 1, 1280]
    - [12, 3.389]
  - - [64, 32, 1, 1280]
    - [38, 0.016]
  - - [128, 1856, 1, 3328]
    - [13, 4.171]
  - - [2944, 2944, 1, 256]
    - [21, 7.08]
  - - [1408, 1024, 1, 3328]
    - [21, 6.329]
  - - [5056, 2368, 1, 1280]
    - [21, 7.449]
  - - [448, 128, 1, 32]
    - [27, 0.084]
  - - [2368, 64, 1, 3328]
    - [14, 3.198]
  - - [32, 5056, 1, 3328]
    - [38, 0.907]
  - - [448, 2944, 1, 3328]
    - [21, 5.808]
  - - [2944, 1024, 1, 1]
    - [40, 0.114]
  - - [2368, 128, 1, 1280]
    - [11, 3.328]
  - - [3584, 704, 1, 256]
    - [21, 6.424]
  - - [2368, 5888, 1, 3328]
    - [21, 7.608]
  - - [4288, 2368, 1, 1]
    - [40, 0.168]
  - - [1408, 3584, 1, 32]
    - [25, 2.279]
  - - [2944, 4288, 1, 32]
    - [29, 2.476]
  - - [5888, 1408, 1, 1280]
    - [23, 7.387]
  - - [3584, 5056, 1, 1280]
    - [21, 7.603]
  - - [5888, 6784, 1, 1280]
    - [20, 7.504]
  - - [64, 1856, 1, 1]
    - [47, 0.008]
  - - [704, 128, 1, 32]
    - [27, 0.138]
  - - [3584, 2944, 1, 1]
    - [41, 0.171]
  - - [128, 3584, 1, 3328]
    - [13, 5.038]
  - - [256, 4288, 1, 3328]
    - [21, 5.647]
  - - [4288, 64, 1, 1]
    - [40, 0.02]
  - - [1, 1408, 1, 1280]
    - [56, 0.01]
  - - [5056, 32, 1, 1280]
    - [38, 0.888]
  - - [1856, 704, 1, 32]
    - [33, 1.397]
  - - [1024, 1856, 1, 1]
    - [40, 0.09]
  - - [704, 5056, 1, 3328]
    - [21, 7.195]
  - - [1024, 3584, 1, 3328]
    - [21, 7.419]
  - - [5888, 256, 1, 3328]
    - [21, 6.511]
  - - [1856, 1408, 1, 1]
    - [45, 0.106]
  - - [2944, 448, 1, 32]
    - [33, 1.386]
  - - [128, 448, 1, 256]
    - [3, 1.205]
  - - [128, 1024, 1, 1]
    - [47, 0.008]
  - - [32, 32, 1, 256]
    - [34, 0.005]
  - - [4288, 5056, 1, 1280]
    - [21, 7.683]
  - - [1856, 1856, 1, 3328]
    - [21, 6.963]
  - - [1024, 2368, 1, 256]
    - [21, 6.226]
  - - [4288, 2368, 1, 3328]
    - [21, 7.622]
  - - [256, 64, 1, 32]
    - [34, 0.033]
  - - [1, 1024, 1, 1280]
    - [56, 0.007]
  - - [5056, 128, 1, 32]
    - [27, 0.945]
  - - [5888, 3584, 1, 256]
    - [21, 7.233]
  - - [1024, 5056, 1, 32]
    - [25, 2.202]
  - - [5888, 448, 1, 1280]
    - [21, 6.507]
  - - [704, 5888, 1, 3328]
    - [21, 7.378]
  - - [1024, 1408, 1, 256]
    - [21, 5.681]
  - - [3584, 2944, 1, 1280]
    - [21, 7.494]
  - - [1, 5056, 1, 256]
    - [55, 0.021]
  - - [256, 1024, 1, 1]
    - [45, 0.017]
  - - [32, 32, 1, 3328]
    - [38, 0.009]
  - - [2368, 1, 1, 3328]
    - [56, 0.018]
  - - [4288, 1856, 1, 1280]
    - [21, 7.421]
  - - [3584, 5888, 1, 1]
    - [39, 0.185]
  - - [5888, 4288, 1, 256]
    - [21, 7.244]
  - - [1024, 2944, 1, 1280]
    - [21, 6.973]
  - - [6784, 1, 1, 1]
    - [53, 0.001]
  - - [1408, 64, 1, 1280]
    - [14, 2.399]
  - - [1, 256, 1, 1280]
    - [56, 0.002]
  - - [2944, 3584, 1, 256]
    - [21, 7.177]
  - - [1, 128, 1, 1280]
    - [56, 0.001]
  - - [1024, 256, 1, 32]
    - [34, 0.454]
  - - [5888, 1, 1, 1280]
    - [55, 0.029]
  - - [2368, 32, 1, 1280]
    - [38, 0.598]
  - - [5888, 1856, 1, 1]
    - [39, 0.152]
  - - [6784, 128, 1, 1280]
    - [11, 5.34]
  - - [6784, 2368, 1, 3328]
    - [21, 7.495]
  - - [1, 64, 1, 256]
    - [55, 0.0]
  - - [704, 128, 1, 1]
    - [47, 0.006]
  - - [1408, 4288, 1, 32]
    - [25, 2.36]
  - - [256, 64, 1, 1280]
    - [12, 0.51]
  - - [256, 448, 1, 256]
    - [1, 2.006]
  - - [1856, 1024, 1, 1280]
    - [23, 6.397]
  - - [5888, 1856, 1, 256]
    - [21, 7.116]
  - - [5056, 1856, 1, 1]
    - [40, 0.165]
  - - [5888, 2368, 1, 256]
    - [21, 7.122]
  - - [1408, 1024, 1, 32]
    - [29, 1.459]
  - - [32, 704, 1, 256]
    - [38, 0.117]
  - - [2944, 1, 1, 256]
    - [55, 0.014]
  - - [32, 4288, 1, 256]
    - [34, 0.593]
  - - [5056, 1856, 1, 32]
    - [25, 2.437]
  - - [5056, 1856, 1, 1280]
    - [21, 7.422]
  - - [1, 64, 1, 1]
    - [40, 0.0]
  - - [1408, 5888, 1, 3328]
    - [21, 7.561]
  - - [1408, 704, 1, 3328]
    - [17, 6.148]
  - - [5056, 704, 1, 3328]
    - [21, 7.06]
  - - [704, 64, 1, 1280]
    - [14, 1.377]
  - - [1, 704, 1, 1280]
    - [56, 0.005]
  - - [5888, 6784, 1, 1]
    - [39, 0.198]
  - - [5888, 4288, 1, 32]
    - [25, 2.782]
  - - [1408, 3584, 1, 256]
    - [21, 6.842]
  - - [1856, 704, 1, 1]
    - [42, 0.069]
  - - [6784, 256, 1, 1]
    - [45, 0.086]
  - - [2944, 1, 1, 1]
    - [40, 0.0]
  - - [256, 1856, 1, 3328]
    - [16, 5.207]
  - - [4288, 128, 1, 1280]
    - [9, 4.244]
  - - [6784, 256, 1, 1280]
    - [21, 6.453]
  - - [128, 4288, 1, 256]
    - [11, 3.822]
  - - [128, 128, 1, 32]
    - [34, 0.032]
  - - [128, 1408, 1, 32]
    - [33, 0.249]
  - - [6784, 128, 1, 32]
    - [33, 1.136]
  - - [1408, 448, 1, 1]
    - [42, 0.04]
  - - [2368, 704, 1, 3328]
    - [21, 6.393]
  - - [704, 128, 1, 3328]
    - [14, 2.589]
  - - [2944, 1856, 1, 32]
    - [25, 2.229]
  - - [1024, 64, 1, 1]
    - [40, 0.004]
  - - [1408, 32, 1, 1280]
    - [38, 0.352]
  - - [704, 1, 1, 256]
    - [55, 0.003]
  - - [2368, 1408, 1, 256]
    - [21, 6.712]
  - - [2368, 1856, 1, 1]
    - [40, 0.132]
  - - [4288, 1408, 1, 1]
    - [53, 0.14]
  - - [3584, 2368, 1, 1280]
    - [21, 7.452]
  - - [64, 5056, 1, 1280]
    - [7, 3.685]
  - - [1408, 2944, 1, 1]
    - [39, 0.13]
  - - [4288, 1408, 1, 32]
    - [25, 2.373]
  - - [5888, 2944, 1, 256]
    - [21, 7.165]
  - - [128, 64, 1, 1280]
    - [3, 0.244]
  - - [1408, 2944, 1, 32]
    - [25, 2.166]
  - - [1, 3584, 1, 1280]
    - [56, 0.025]
  - - [64, 64, 1, 32]
    - [27, 0.006]
  - - [448, 1408, 1, 32]
    - [34, 0.9]
  - - [128, 5056, 1, 256]
    - [21, 4.43]
  - - [1, 1, 1, 1280]
    - [56, 0.0]
  - - [64, 704, 1, 256]
    - [3, 0.947]
  - - [5888, 6784, 1, 256]
    - [21, 7.294]
  - - [6784, 5888, 1, 1]
    - [39, 0.197]
  - - [64, 4288, 1, 256]
    - [1, 2.822]
  - - [1, 448, 1, 1280]
    - [56, 0.003]
  - - [1024, 1024, 1, 1]
    - [40, 0.059]
  - - [6784, 5888, 1, 1280]
    - [19, 7.47]
  - - [1024, 4288, 1, 32]
    - [33, 2.117]
  - - [1856, 1, 1, 1280]
    - [56, 0.013]
  - - [3584, 5888, 1, 256]
    - [21, 7.354]
  - - [5056, 2368, 1, 1]
    - [46, 0.16]
  - - [256, 1408, 1, 1280]
    - [16, 3.831]
  - - [64, 256, 1, 32]
    - [27, 0.025]
  - - [64, 5888, 1, 3328]
    - [5, 4.238]
  - - [6784, 64, 1, 3328]
    - [16, 4.75]
  - - [5056, 448, 1, 1]
    - [40, 0.098]
  - - [2944, 448, 1, 3328]
    - [21, 5.816]
  - - [2368, 1024, 1, 1280]
    - [21, 6.641]
  - - [1856, 6784, 1, 256]
    - [21, 7.217]
  - - [4288, 32, 1, 1280]
    - [38, 0.744]
  - - [448, 1408, 1, 1280]
    - [21, 4.856]
  - - [5056, 448, 1, 32]
    - [33, 1.726]
  - - [3584, 2944, 1, 32]
    - [25, 2.616]
  - - [2368, 128, 1, 1]
    - [47, 0.019]
  - - [32, 128, 1, 1280]
    - [38, 0.032]
  - - [3584, 1856, 1, 32]
    - [25, 2.346]
  - - [128, 128, 1, 3328]
    - [12, 0.549]
  - - [5056, 64, 1, 256]
    - [5, 3.005]
  - - [64, 448, 1, 3328]
    - [12, 0.97]
  - - [4288, 1408, 1, 1280]
    - [21, 7.221]
  - - [6784, 2368, 1, 1]
    - [49, 0.175]
  - - [32, 5056, 1, 256]
    - [38, 0.719]
  - - [704, 128, 1, 256]
    - [8, 1.599]
  - - [704, 5056, 1, 1]
    - [45, 0.122]
  - - [256, 1024, 1, 32]
    - [36, 0.411]
  - - [256, 1024, 1, 1280]
    - [16, 4.349]
  - - [2368, 128, 1, 256]
    - [11, 2.815]
  - - [32, 64, 1, 256]
    - [34, 0.011]
  - - [2368, 1408, 1, 1280]
    - [21, 7.14]
  - - [128, 256, 1, 32]
    - [27, 0.05]
  - - [64, 6784, 1, 32]
    - [34, 0.681]
  - - [6784, 32, 1, 256]
    - [38, 0.947]
  - - [256, 4288, 1, 1]
    - [41, 0.062]
  - - [5888, 1408, 1, 1]
    - [44, 0.142]
  - - [1024, 4288, 1, 1280]
    - [21, 7.314]
  - - [1856, 4288, 1, 1]
    - [40, 0.158]
  - - [128, 2944, 1, 256]
    - [11, 3.42]
  - - [3584, 4288, 1, 256]
    - [21, 7.289]
  - - [2368, 2944, 1, 256]
    - [21, 7.074]
  - - [3584, 128, 1, 32]
    - [29, 0.712]
  - - [3584, 128, 1, 3328]
    - [16, 5.013]
  - - [704, 5056, 1, 256]
    - [21, 6.657]
  - - [1856, 4288, 1, 32]
    - [25, 2.465]
  - - [64, 256, 1, 1280]
    - [12, 0.512]
  - - [4288, 1024, 1, 1280]
    - [21, 7.301]
  - - [1, 4288, 1, 256]
    - [55, 0.018]
  - - [64, 2368, 1, 1]
    - [47, 0.009]
  - - [4288, 6784, 1, 32]
    - [25, 2.766]
  - - [704, 704, 1, 3328]
    - [21, 5.323]
  - - [128, 2944, 1, 1]
    - [53, 0.027]
  - - [3584, 1408, 1, 256]
    - [23, 6.803]
  - - [704, 3584, 1, 3328]
    - [21, 6.983]
  - - [5056, 448, 1, 1280]
    - [21, 6.693]
  - - [1408, 2944, 1, 1280]
    - [21, 7.307]
  - - [5888, 704, 1, 1280]
    - [21, 7.165]
  - - [64, 64, 1, 256]
    - [3, 0.078]
  - - [704, 1408, 1, 1280]
    - [10, 6.04]
  - - [4288, 5888, 1, 256]
    - [21, 7.343]
  - - [6784, 64, 1, 32]
    - [30, 0.688]
  - - [3584, 3584, 1, 3328]
    - [21, 7.706]
  - - [2944, 6784, 1, 32]
    - [25, 2.736]
  - - [448, 64, 1, 32]
    - [27, 0.043]
  - - [5056, 256, 1, 1]
    - [41, 0.07]
  - - [64, 6784, 1, 1280]
    - [16, 4.574]
  - - [2944, 2368, 1, 3328]
    - [21, 7.498]
  - - [1, 4288, 1, 1]
    - [53, 0.0]
  - - [1408, 128, 1, 256]
    - [9, 2.347]
  - - [1024, 1856, 1, 1280]
    - [23, 6.4]
  - - [448, 5888, 1, 256]
    - [21, 6.165]
  - - [1024, 5888, 1, 256]
    - [21, 7.088]
  - - [704, 1408, 1, 256]
    - [21, 5.325]
  - - [6784, 2944, 1, 3328]
    - [21, 7.52]
  - - [1408, 2368, 1, 256]
    - [21, 6.668]
  - - [64, 128, 1, 1280]
    - [3, 0.245]
  - - [5888, 32, 1, 3328]
    - [38, 1.06]
  - - [1408, 5056, 1, 256]
    - [21, 7.013]
  - - [1024, 1408, 1, 32]
    - [33, 1.411]
  - - [4288, 128, 1, 32]
    - [27, 0.81]
  - - [6784, 704, 1, 1]
    - [40, 0.135]
  - - [448, 704, 1, 256]
    - [21, 2.895]
  - - [704, 3584, 1, 32]
    - [25, 1.834]
  - - [1856, 256, 1, 3328]
    - [16, 5.214]
  - - [448, 1024, 1, 1280]
    - [21, 4.787]
  - - [4288, 4288, 1, 1]
    - [40, 0.179]
  - - [5056, 2944, 1, 1]
    - [40, 0.179]
  - - [64, 2368, 1, 3328]
    - [12, 3.224]
  - - [256, 704, 1, 3328]
    - [16, 3.171]
  - - [1, 2944, 1, 1]
    - [45, 0.0]
  - - [1024, 1024, 1, 256]
    - [21, 5.658]
  - - [3584, 1, 1, 1]
    - [40, 0.0]
  - - [256, 2944, 1, 32]
    - [33, 0.994]
  - - [6784, 4288, 1, 3328]
    - [20, 7.541]
  - - [5056, 2944, 1, 3328]
    - [20, 7.335]
  - - [704, 1024, 1, 1280]
    - [21, 5.539]
  - - [256, 3584, 1, 1280]
    - [21, 5.573]
  - - [2368, 1856, 1, 3328]
    - [21, 7.378]
  - - [1856, 4288, 1, 1280]
    - [21, 7.438]
  - - [1, 1024, 1, 256]
    - [55, 0.005]
  - - [3584, 448, 1, 1]
    - [51, 0.078]
  - - [2944, 1024, 1, 3328]
    - [21, 7.041]
  - - [32, 1408, 1, 3328]
    - [38, 0.379]
  - - [128, 1, 1, 3328]
    - [56, 0.001]
  - - [5888, 5056, 1, 32]
    - [25, 2.774]
  - - [704, 2944, 1, 1]
    - [47, 0.093]
  - - [3584, 448, 1, 32]
    - [33, 1.507]
  - - [3584, 448, 1, 1280]
    - [21, 6.06]
  - - [2944, 6784, 1, 3328]
    - [21, 7.675]
  - - [1856, 2368, 1, 1280]
    - [21, 7.314]
  - - [6784, 1024, 1, 1280]
    - [21, 7.278]
  - - [6784, 3584, 1, 1280]
    - [21, 7.55]
  - - [1, 5056, 1, 3328]
    - [55, 0.026]
  - - [128, 128, 1, 1]
    - [55, 0.001]
  - - [128, 2368, 1, 32]
    - [34, 0.516]
  - - [128, 1408, 1, 3328]
    - [12, 3.513]
  - - [2944, 32, 1, 3328]
    - [38, 0.79]
  - - [704, 1856, 1, 256]
    - [21, 5.873]
  - - [1408, 1408, 1, 1]
    - [40, 0.09]
  - - [1408, 4288, 1, 256]
    - [21, 6.891]
  - - [256, 5056, 1, 3328]
    - [21, 6.645]
  - - [2368, 64, 1, 1280]
    - [14, 3.036]
  - - [1856, 448, 1, 32]
    - [33, 1.073]
  - - [1408, 448, 1, 256]
    - [21, 4.281]
  - - [32, 128, 1, 256]
    - [34, 0.02]
  - - [448, 1024, 1, 1]
    - [45, 0.029]
  - - [128, 1024, 1, 1280]
    - [12, 3.278]
  - - [448, 6784, 1, 1]
    - [40, 0.115]
  - - [704, 2944, 1, 256]
    - [21, 6.309]
  - - [1408, 1408, 1, 256]
    - [23, 6.217]
  - - [448, 6784, 1, 32]
    - [33, 1.854]
  - - [1, 64, 1, 1280]
    - [56, 0.0]
  - - [1408, 1856, 1, 1]
    - [45, 0.105]
  - - [4288, 448, 1, 32]
    - [33, 1.598]
  - - [4288, 448, 1, 1280]
    - [21, 6.41]
  - - [2944, 704, 1, 32]
    - [29, 1.677]
  - - [1024, 704, 1, 256]
    - [21, 4.771]
  - - [448, 4288, 1, 1]
    - [40, 0.09]
  - - [3584, 5056, 1, 1]
    - [40, 0.183]
  - - [1408, 3584, 1, 1280]
    - [21, 7.193]
  - - [6784, 448, 1, 1280]
    - [21, 6.889]
  - - [3584, 5056, 1, 3328]
    - [21, 7.655]
  - - [2368, 2368, 1, 32]
    - [25, 2.332]
  - - [64, 5888, 1, 32]
    - [34, 0.617]
  - - [1856, 448, 1, 256]
    - [21, 4.622]
  - - [128, 1024, 1, 256]
    - [12, 2.136]
  - - [3584, 64, 1, 3328]
    - [16, 4.02]
  - - [5888, 2944, 1, 32]
    - [25, 2.716]
  - - [2944, 1, 1, 1280]
    - [56, 0.02]
  - - [1856, 2944, 1, 32]
    - [25, 2.298]
  - - [5056, 1408, 1, 1]
    - [45, 0.153]
  - - [5888, 1408, 1, 3328]
    - [21, 7.408]
  - - [448, 4288, 1, 256]
    - [21, 5.923]
  - - [6784, 1024, 1, 1]
    - [46, 0.154]
  - - [256, 448, 1, 1]
    - [47, 0.007]
  - - [128, 5888, 1, 3328]
    - [21, 5.917]
  - - [6784, 1024, 1, 32]
    - [25, 2.43]
  - - [256, 448, 1, 32]
    - [29, 0.168]
  - - [6784, 3584, 1, 1]
    - [45, 0.189]
  - - [2944, 2368, 1, 32]
    - [25, 2.359]
  - - [3584, 6784, 1, 3328]
    - [21, 7.748]
  - - [448, 128, 1, 1280]
    - [14, 1.743]
  - - [64, 3584, 1, 32]
    - [27, 0.297]
  - - [64, 3584, 1, 1280]
    - [16, 3.827]
  - - [6784, 1408, 1, 256]
    - [21, 7.045]
  - - [5056, 1024, 1, 32]
    - [29, 2.218]
  - - [1024, 5056, 1, 1280]
    - [21, 7.386]
  - - [4288, 3584, 1, 256]
    - [21, 7.311]
  - - [2368, 256, 1, 3328]
    - [21, 4.763]
  - - [448, 6784, 1, 1280]
    - [21, 7.015]
  - - [1856, 5888, 1, 1]
    - [45, 0.169]
  - - [256, 5888, 1, 32]
    - [25, 1.48]
  - - [3584, 1, 1, 3328]
    - [56, 0.027]
  - - [4288, 32, 1, 256]
    - [38, 0.623]
  - - [256, 64, 1, 1]
    - [47, 0.001]
  - - [4288, 5056, 1, 32]
    - [25, 2.752]
  - - [4288, 5056, 1, 3328]
    - [21, 7.725]
  - - [1856, 5888, 1, 32]
    - [25, 2.589]
  - - [1856, 5888, 1, 1280]
    - [21, 7.586]
  - - [256, 256, 1, 1280]
    - [12, 1.943]
  - - [704, 2368, 1, 1280]
    - [21, 6.303]
  - - [4288, 2368, 1, 1280]
    - [21, 7.571]
  - - [2944, 5056, 1, 256]
    - [21, 7.33]
  - - [32, 1856, 1, 256]
    - [34, 0.293]
  - - [64, 5888, 1, 1280]
    - [11, 4.122]
  - - [1, 1856, 1, 1280]
    - [56, 0.013]
  - - [2944, 4288, 1, 1]
    - [46, 0.174]
  - - [5056, 5888, 1, 32]
    - [25, 2.788]
  - - [704, 1, 1, 3328]
    - [56, 0.005]
  - - [448, 256, 1, 1280]
    - [14, 2.838]
  - - [1408, 256, 1, 1]
    - [47, 0.024]
  - - [2368, 5056, 1, 3328]
    - [21, 7.65]
  - - [1024, 5056, 1, 3328]
    - [21, 7.451]
  - - [704, 704, 1, 1280]
    - [21, 5.162]
  - - [128, 32, 1, 3328]
    - [38, 0.035]
  - - [1024, 6784, 1, 32]
    - [25, 2.324]
  - - [3584, 2944, 1, 3328]
    - [21, 7.549]
  - - [128, 1856, 1, 256]
    - [4, 3.093]
  - - [32, 32, 1, 1280]
    - [38, 0.008]
  - - [1408, 5888, 1, 1]
    - [44, 0.148]
  - - [1, 3584, 1, 256]
    - [56, 0.02]
  - - [704, 4288, 1, 32]
    - [25, 1.97]
  - - [1408, 5888, 1, 32]
    - [25, 2.528]
  - - [6784, 1024, 1, 3328]
    - [21, 7.329]
  - - [1856, 1, 1, 3328]
    - [56, 0.014]
  - - [5056, 1408, 1, 256]
    - [21, 6.888]
  - - [1, 1, 1, 256]
    - [55, 0.0]
  - - [2944, 1408, 1, 256]
    - [21, 6.877]
  - - [4288, 1, 1, 1]
    - [47, 0.0]
  - - [2368, 2368, 1, 256]
    - [21, 6.935]
  - - [1, 448, 1, 256]
    - [55, 0.002]
  - - [1408, 6784, 1, 1]
    - [39, 0.157]
  - - [3584, 32, 1, 3328]
    - [38, 0.997]
  - - [128, 3584, 1, 1]
    - [47, 0.032]
  - - [1856, 1, 1, 256]
    - [55, 0.009]
  - - [6784, 6784, 1, 1280]
    - [21, 7.584]
  - - [1024, 5888, 1, 1]
    - [39, 0.127]
  - - [6784, 32, 1, 3328]
    - [38, 1.21]
  - - [1408, 32, 1, 256]
    - [34, 0.237]
  - - [128, 3584, 1, 32]
    - [33, 0.708]
  - - [1856, 3584, 1, 256]
    - [21, 7.014]
  - - [2944, 64, 1, 256]
    - [4, 2.453]
  - - [2368, 704, 1, 32]
    - [29, 1.508]
  - - [256, 5888, 1, 1280]
    - [21, 6.528]
  - - [448, 2368, 1, 32]
    - [33, 1.107]
  - - [448, 2368, 1, 3328]
    - [21, 5.465]
  - - [64, 1408, 1, 256]
    - [3, 1.674]
  - - [5056, 32, 1, 32]
    - [27, 0.299]
  - - [1024, 704, 1, 3328]
    - [21, 5.655]
  - - [32, 5888, 1, 3328]
    - [38, 1.055]
  - - [256, 64, 1, 3328]
    - [12, 0.553]
  - - [32, 1408, 1, 1280]
    - [38, 0.357]
  - - [64, 32, 1, 256]
    - [34, 0.011]
  - - [1856, 1024, 1, 3328]
    - [23, 6.497]
  - - [2368, 1, 1, 1]
    - [45, 0.0]
  - - [5056, 2368, 1, 3328]
    - [21, 7.495]
  - - [128, 1, 1, 1280]
    - [56, 0.001]
  - - [704, 4288, 1, 1280]
    - [21, 6.978]
  - - [704, 256, 1, 256]
    - [9, 2.261]
  - - [512, 128, 1, 784]
    - [57, 1.748]
  - - [1024, 256, 1, 196]
    - [61, 4.808]
  - - [256, 64, 1, 3136]
    - [59, 0.524]
  - - [256, 1024, 1, 196]
    - [58, 4.906]
  - - [64, 256, 1, 3136]
    - [62, 0.558]
  - - [128, 512, 1, 784]
    - [60, 1.755]
  - - [64, 64, 1, 3136]
    - [61, 0.13]
  - - [2560, 7000, 1, 2560]
    - [78, 12.082]
  - - [7680, 12000, 1, 2560]
    - [78, 13.04]
  - - [5124, 9124, 1, 1760]
    - [74, 12.552]
  - - [1760, 32, 1, 1760]
    - [64, 1.541]
  - - [512, 24000, 1, 1536]
    - [78, 11.7]
  - - [3072, 24000, 1, 1024]
    - [78, 11.963]
  - - [2048, 400, 1, 512]
    - [79, 6.414]
  - - [2560, 128, 1, 2560]
    - [68, 4.81]
  - - [3072, 16, 1, 1024]
    - [69, 1.04]
  - - [512, 48000, 1, 2816]
    - [78, 12.758]
  - - [512, 48000, 1, 2048]
    - [79, 10.232]
  - - [1760, 64, 1, 1760]
    - [64, 2.978]
  - - [2048, 1600, 1, 2048]
    - [79, 6.088]
  - - [512, 48000, 1, 1536]
    - [78, 12.287]
  - - [2560, 32, 1, 2560]
    - [64, 2.186]
  - - [8448, 5984, 1, 2816]
    - [78, 12.759]
  - - [4096, 3200, 1, 1024]
    - [79, 10.152]
  - - [1024, 24000, 1, 2560]
    - [78, 12.402]
  - - [1760, 6400, 1, 1760]
    - [74, 12.673]
  - - [5124, 9124, 1, 2048]
    - [79, 10.267]
  - - [1024, 700, 1, 512]
    - [73, 5.469]
  - - [4608, 32, 1, 1536]
    - [64, 3.322]
  - - [3072, 64, 1, 1024]
    - [69, 3.015]
  - - [16384, 3200, 1, 4096]
    - [79, 10.63]
  - - [2560, 16, 1, 2560]
    - [68, 1.129]
  - - [1024, 48000, 1, 2560]
    - [78, 12.882]
  - - [8448, 48000, 1, 2816]
    - [78, 11.709]
  - - [2048, 32, 1, 2048]
    - [66, 1.215]
  - - [2560, 3200, 1, 2560]
    - [78, 11.639]
  - - [16384, 800, 1, 4096]
    - [79, 8.686]
  - - [4608, 24000, 1, 1536]
    - [78, 12.921]
  - - [7680, 48000, 1, 2560]
    - [78, 12.276]
  - - [3072, 48000, 1, 1024]
    - [78, 12.454]
  - - [1760, 16, 1, 1760]
    - [66, 0.734]
  - - [8192, 3200, 1, 2048]
    - [79, 10.168]
  - - [512, 24000, 1, 2816]
    - [78, 12.625]
  - - [4096, 400, 1, 1024]
    - [79, 7.625]
  - - [6144, 48000, 1, 2560]
    - [78, 13.067]
  - - [4608, 48000, 1, 1536]
    - [78, 13.057]
  - - [4096, 128, 1, 4096]
    - [69, 3.428]
  - - [2048, 800, 1, 512]
    - [78, 7.788]
  - - [4608, 5984, 1, 1536]
    - [78, 12.254]
  - - [4096, 1600, 1, 1024]
    - [79, 9.132]
  - - [6144, 5984, 1, 2048]
    - [79, 10.445]
  - - [7680, 24000, 1, 2560]
    - [78, 12.975]
  - - [6144, 48000, 1, 2048]
    - [79, 11.058]
  - - [2048, 3200, 1, 2048]
    - [79, 8.487]
  - - [5124, 9124, 1, 2560]
    - [78, 12.325]
  - - [1024, 24000, 1, 1536]
    - [78, 12.236]
  - - [7680, 16, 1, 2560]
    - [66, 2.186]
  - - [2560, 6400, 1, 2560]
    - [78, 12.244]
  - - [2048, 128, 1, 2048]
    - [66, 2.63]
  - - [512, 16, 1, 500000]
    - [66, 0.23]
  - - [1024, 8, 1, 500000]
    - [64, 0.231]
  - - [512, 24000, 1, 2560]
    - [78, 12.043]
  - - [1024, 24000, 1, 2816]
    - [78, 12.737]
  - - [7680, 5984, 1, 2560]
    - [78, 12.764]
  - - [2048, 1600, 1, 512]
    - [79, 7.866]
  - - [2048, 7000, 1, 2048]
    - [79, 9.591]
  - - [1760, 800, 1, 1760]
    - [71, 8.65]
  - - [4096, 64, 1, 4096]
    - [66, 2.672]
  - - [7680, 32, 1, 2560]
    - [66, 4.317]
  - - [2560, 64, 1, 2560]
    - [68, 3.933]
  - - [3072, 128, 1, 1024]
    - [69, 3.841]
  - - [7680, 64, 1, 2560]
    - [73, 4.992]
  - - [1760, 128, 1, 1760]
    - [64, 5.19]
  - - [2560, 1600, 1, 2560]
    - [78, 9.133]
  - - [2048, 3200, 1, 512]
    - [79, 9.263]
  - - [2560, 800, 1, 2560]
    - [78, 7.858]
  - - [3072, 32, 1, 1024]
    - [66, 2.004]
  - - [6144, 32, 1, 2560]
    - [64, 4.009]
  - - [4608, 12000, 1, 1536]
    - [78, 12.701]
  - - [4096, 32, 1, 4096]
    - [70, 1.746]
  - - [6144, 24000, 1, 2048]
    - [79, 10.943]
  - - [8192, 800, 1, 2048]
    - [79, 7.666]
  - - [5124, 9124, 1, 4096]
    - [79, 10.35]
  - - [8448, 24000, 1, 2816]
    - [78, 12.94]
  - - [1024, 48000, 1, 1536]
    - [78, 12.669]
  - - [7680, 128, 1, 2560]
    - [73, 8.749]
  - - [8192, 1600, 1, 2048]
    - [79, 9.136]
  - - [4096, 800, 1, 1024]
    - [79, 7.802]
  - - [1024, 16, 1, 500000]
    - [66, 0.46]
  - - [2048, 800, 1, 2048]
    - [77, 5.62]
  - - [1760, 3200, 1, 1760]
    - [74, 11.354]
  - - [512, 48000, 1, 2560]
    - [78, 12.509]
  - - [8448, 16, 1, 2816]
    - [65, 2.552]
  - - [2048, 64, 1, 2048]
    - [66, 2.169]
  - - [512, 24000, 1, 2048]
    - [79, 9.372]
  - - [16384, 1600, 1, 4096]
    - [79, 9.853]
  - - [4608, 16, 1, 1536]
    - [64, 1.685]
  - - [1024, 24000, 1, 2048]
    - [79, 10.192]
  - - [8192, 400, 1, 2048]
    - [79, 6.087]
  - - [2048, 6400, 1, 2048]
    - [79, 9.487]
  - - [6144, 12000, 1, 2048]
    - [79, 10.796]
  - - [512, 8, 1, 500000]
    - [64, 0.116]
  - - [1760, 7000, 1, 1760]
    - [74, 11.811]
  - - [1024, 48000, 1, 2816]
    - [78, 13.051]
  - - [6144, 16, 1, 2560]
    - [68, 2.077]
  - - [8448, 32, 1, 2816]
    - [68, 4.543]
  - - [4096, 7000, 1, 4096]
    - [79, 10.357]
  - - [4096, 16, 1, 4096]
    - [67, 0.885]
  - - [6144, 24000, 1, 2560]
    - [78, 12.895]
  - - [2048, 16, 1, 2048]
    - [69, 0.643]
  - - [8448, 12000, 1, 2816]
    - [78, 12.941]
  - - [16384, 400, 1, 4096]
    - [79, 7.144]
  - - [1760, 1600, 1, 1760]
    - [72, 11.099]
  - - [1024, 48000, 1, 2048]
    - [79, 10.643]
  - - [3073, 3072, 1, 3072]
    - [100, 2.988]
  - - [3072, 512, 1, 3072]
    - [106, 22.872]
  - - [511, 2048, 1, 2048]
    - [99, 1.637]
  - - [4096, 4096, 1, 4096]
    - [260, 82.08]
  - - [4096, 513, 1, 4096]
    - [103, 1.678]
  - - [513, 1024, 1, 1024]
    - [100, 1.11]
  - - [512, 2048, 1, 2047]
    - [104, 1.54]
  - - [512, 512, 1, 512]
    - [263, 14.605]
  - - [512, 1025, 1, 1024]
    - [99, 1.107]
  - - [1024, 1024, 1, 1024]
    - [276, 36.674]
  - - [960, 1025, 1, 1024]
    - [99, 1.533]
  - - [4096, 511, 1, 4096]
    - [99, 2.024]
  - - [512, 3072, 1, 3072]
    - [106, 24.548]
  - - [2049, 512, 1, 2048]
    - [99, 1.632]
  - - [8192, 512, 1, 8191]
    - [104, 2.248]
  - - [2048, 2048, 1, 2049]
    - [100, 2.544]
  - - [2880, 3072, 1, 3072]
    - [105, 38.26]
  - - [8192, 512, 1, 8193]
    - [100, 2.513]
  - - [1023, 512, 1, 1024]
    - [99, 1.106]
  - - [513, 2048, 1, 2048]
    - [99, 1.637]
  - - [8192, 8191, 1, 8192]
    - [100, 3.027]
  - - [512, 1023, 1, 1024]
    - [99, 1.104]
  - - [512, 4097, 1, 4096]
    - [100, 1.934]
  - - [3073, 512, 1, 3072]
    - [100, 2.328]
  - - [8192, 512, 1, 8192]
    - [106, 22.381]
  - - [511, 512, 1, 512]
    - [99, 0.707]
  - - [1024, 512, 1, 1025]
    - [99, 1.104]
  - - [4095, 512, 1, 4096]
    - [99, 2.026]
  - - [2879, 3072, 1, 3072]
    - [100, 2.808]
  - - [8192, 8192, 1, 8192]
    - [259, 89.731]
  - - [1024, 1024, 1, 1023]
    - [99, 1.637]
  - - [8191, 512, 1, 8192]
    - [100, 2.486]
  - - [512, 8193, 1, 8192]
    - [100, 2.441]
  - - [1024, 1025, 1, 1024]
    - [99, 1.63]
  - - [512, 512, 1, 511]
    - [99, 0.744]
  - - [2047, 2048, 1, 2048]
    - [99, 2.361]
  - - [1024, 1023, 1, 1024]
    - [99, 1.629]
  - - [512, 1024, 1, 1024]
    - [106, 6.594]
  - - [2880, 3072, 1, 3071]
    - [101, 2.676]
  - - [2048, 511, 1, 2048]
    - [99, 1.639]
  - - [512, 8191, 1, 8192]
    - [100, 2.449]
  - - [512, 4096, 1, 4096]
    - [106, 33.734]
  - - [4097, 512, 1, 4096]
    - [100, 1.982]
  - - [2048, 2049, 1, 2048]
    - [100, 2.373]
  - - [3072, 512, 1, 3071]
    - [100, 2.336]
  - - [8192, 8192, 1, 8191]
    - [103, 3.088]
  - - [2880, 3072, 1, 3073]
    - [101, 2.591]
  - - [2047, 512, 1, 2048]
    - [99, 1.641]
  - - [1025, 1024, 1, 1024]
    - [104, 1.467]
  - - [3072, 513, 1, 3072]
    - [100, 2.327]
  - - [512, 513, 1, 512]
    - [99, 0.726]
  - - [512, 511, 1, 512]
    - [99, 0.722]
  - - [512, 4096, 1, 4097]
    - [100, 1.974]
  - - [3072, 3073, 1, 3072]
    - [100, 2.989]
  - - [512, 4096, 1, 4095]
    - [103, 1.709]
  - - [8191, 8192, 1, 8192]
    - [103, 2.89]
  - - [2880, 3071, 1, 3072]
    - [100, 2.807]
  - - [4096, 512, 1, 4097]
    - [99, 2.042]
  - - [512, 2049, 1, 2048]
    - [99, 1.643]
  - - [3072, 3072, 1, 3071]
    - [100, 2.99]
  - - [8192, 8193, 1, 8192]
    - [100, 3.099]
  - - [4096, 512, 1, 4095]
    - [103, 1.765]
  - - [960, 1024, 1, 1024]
    - [105, 30.586]
  - - [961, 1024, 1, 1024]
    - [99, 1.531]
  - - [4096, 4097, 1, 4096]
    - [99, 2.525]
  - - [512, 8192, 1, 8192]
    - [106, 34.413]
  - - [8192, 8192, 1, 8193]
    - [103, 3.117]
  - - [4096, 4095, 1, 4096]
    - [103, 2.688]
  - - [511, 8192, 1, 8192]
    - [99, 2.275]
  - - [512, 3071, 1, 3072]
    - [100, 2.308]
  - - [4096, 4096, 1, 4097]
    - [100, 2.977]
  - - [512, 8192, 1, 8193]
    - [100, 2.551]
  - - [8192, 513, 1, 8192]
    - [100, 2.483]
  - - [1024, 1024, 1, 1025]
    - [99, 1.637]
  - - [960, 1024, 1, 1023]
    - [101, 1.668]
  - - [512, 2048, 1, 2049]
    - [99, 1.651]
  - - [8192, 511, 1, 8192]
    - [100, 2.443]
  - - [513, 4096, 1, 4096]
    - [100, 1.89]
  - - [511, 1024, 1, 1024]
    - [99, 1.104]
  - - [513, 512, 1, 512]
    - [99, 0.728]
  - - [3072, 3072, 1, 3073]
    - [102, 2.65]
  - - [960, 1024, 1, 1025]
    - [104, 1.86]
  - - [959, 1024, 1, 1024]
    - [104, 1.863]
  - - [2048, 2048, 1, 2048]
    - [261, 58.763]
  - - [512, 3072, 1, 3073]
    - [100, 2.326]
  - - [511, 3072, 1, 3072]
    - [100, 2.319]
  - - [513, 8192, 1, 8192]
    - [104, 2.206]
  - - [4095, 4096, 1, 4096]
    - [103, 2.721]
  - - [8193, 8192, 1, 8192]
    - [100, 3.062]
  - - [512, 3073, 1, 3072]
    - [100, 2.318]
  - - [4096, 4096, 1, 4095]
    - [100, 2.911]
  - - [512, 8192, 1, 8191]
    - [101, 2.151]
  - - [1025, 512, 1, 1024]
    - [99, 1.111]
  - - [2881, 3072, 1, 3072]
    - [100, 2.808]
  - - [1024, 512, 1, 1023]
    - [100, 1.101]
  - - [2048, 513, 1, 2048]
    - [99, 1.604]
  - - [3072, 512, 1, 3073]
    - [100, 2.334]
  - - [513, 3072, 1, 3072]
    - [101, 2.071]
  - - [3072, 511, 1, 3072]
    - [100, 2.327]
  - - [511, 4096, 1, 4096]
    - [100, 1.932]
  - - [2049, 2048, 1, 2048]
    - [100, 2.516]
  - - [2048, 2047, 1, 2048]
    - [100, 2.516]
  - - [960, 1023, 1, 1024]
    - [104, 1.871]
  - - [2880, 3073, 1, 3072]
    - [100, 2.812]
  - - [1024, 511, 1, 1024]
    - [104, 1.094]
  - - [512, 2048, 1, 2048]
    - [106, 15.134]
  - - [8193, 512, 1, 8192]
    - [100, 2.525]
  - - [2048, 512, 1, 2047]
    - [99, 1.634]
  - - [3071, 3072, 1, 3072]
    - [103, 2.593]
  - - [4096, 512, 1, 4096]
    - [106, 14.925]
  - - [512, 4095, 1, 4096]
    - [100, 1.932]
  - - [512, 1024, 1, 1025]
    - [99, 1.113]
  - - [3071, 512, 1, 3072]
    - [100, 2.329]
  - - [2048, 2048, 1, 2047]
    - [100, 2.523]
  - - [512, 2047, 1, 2048]
    - [99, 1.634]
  - - [512, 3072, 1, 3071]
    - [102, 2.169]
  - - [3072, 3071, 1, 3072]
    - [101, 2.605]
  - - [4097, 4096, 1, 4096]
    - [100, 2.935]
  - - [1024, 513, 1, 1024]
    - [99, 1.111]
  - - [3072, 3072, 1, 3072]
    - [106, 48.276]
  - - [512, 512, 1, 513]
    - [99, 0.733]
  - - [2048, 512, 1, 2049]
    - [99, 1.621]
  - - [512, 1024, 1, 1023]
    - [99, 1.112]
  - - [1023, 1024, 1, 1024]
    - [99, 1.63]
  - - [14, 14, 1, 64]
    - [172, 0.001]
  - - [15, 14, 1, 64]
    - [171, 0.001]
  - - [15, 15, 1, 64]
    - [171, 0.001]
  - - [15, 15, 1, 64]
    - [171, 0.001]
  - - [17, 15, 1, 64]
    - [174, 0.002]
  - - [17, 17, 1, 64]
    - [172, 0.002]
  - - [17, 17, 1, 64]
    - [172, 0.002]
  - - [21, 17, 1, 64]
    - [175, 0.003]
  - - [21, 21, 1, 64]
    - [171, 0.003]
  - - [24, 24, 1, 64]
    - [174, 0.004]
  - - [30, 30, 1, 64]
    - [174, 0.007]
  - - [30, 31, 1, 64]
    - [174, 0.007]
  - - [31, 31, 1, 64]
    - [173, 0.007]
  - - [32, 32, 1, 64]
    - [174, 0.007]
  - - [32, 35, 1, 64]
    - [174, 0.008]
  - - [34, 24, 1, 64]
    - [173, 0.006]
  - - [34, 34, 1, 64]
    - [174, 0.008]
  - - [35, 35, 1, 64]
    - [174, 0.009]
  - - [27, 27, 1, 64]
    - [173, 0.005]
  - - [27, 33, 1, 64]
    - [174, 0.007]
  - - [33, 33, 1, 64]
    - [128, 0.008]
  - - [2, 4, 1, 1024]
    - [284, 0.001]
  - - [2, 32, 1, 1024]
    - [272, 0.006]
  - - [2, 2048, 1, 1024]
    - [272, 0.413]
  - - [64, 128, 512, 128]
    - [316, 14.777]
  - - [64, 512, 1, 512]
    - [318, 2.908]
  - - [64, 512, 64, 512]
    - [321, 25.503]
  - - [128, 128, 512, 64]
    - [317, 16.366]
  - - [512, 512, 1, 64]
    - [346, 3.271]
  - - [512, 512, 64, 64]
    - [285, 22.28]
  - - [1024, 4, 1, 1024]
    - [286, 0.462]
  - - [1024, 4, 1, 1024]
    - [286, 0.462]
  - - [1024, 32, 1, 1024]
    - [318, 3.609]
  - - [1024, 2048, 1, 1024]
    - [288, 39.483]
  - - [1024, 2048, 1, 4096]
    - [289, 45.315]
  - - [1024, 4096, 1, 1024]
    - [282, 49.439]
  - - [1024, 4096, 1, 4096]
    - [319, 57.77]
  - - [4096, 2048, 1, 1024]
    - [271, 59.59]
  - - [4096, 4096, 1, 1024]
    - [276, 66.217]
  - - [30528, 2048, 1, 1024]
    - [301, 72.976]
  - - [30528, 4096, 1, 1024]
    - [320, 74.65]
  - - [3, 3, 512, 64]
    - [284, 0.04]
  - - [5, 5, 512, 64]
    - [322, 0.126]
  - - [5, 5, 960, 64]
    - [356, 0.175]
  - - [9, 9, 512, 64]
    - [357, 0.395]
  - - [27, 27, 32768, 128]
    - [358, 8.15]
  - - [32, 1600, 1, 512]
    - [281, 4.158]
  - - [33, 33, 1600, 32]
    - [359, 2.147]
  - - [64, 512, 1, 1024]
    - [352, 3.738]
  - - [64, 960, 1, 1024]
    - [360, 5.888]
  - - [128, 32768, 1, 256]
    - [313, 28.71]
  - - [256, 684, 1, 1024]
    - [258, 13.212]
  - - [256, 1280, 1, 1024]
    - [361, 21.362]
  - - [256, 1536, 1, 1024]
    - [287, 23.699]
  - - [256, 2304, 1, 1024]
    - [292, 30.065]
  - - [256, 2560, 1, 1024]
    - [292, 33.054]
  - - [256, 2816, 1, 1024]
    - [362, 34.031]
  - - [256, 3328, 1, 1024]
    - [292, 36.448]
  - - [256, 3584, 1, 1024]
    - [363, 36.788]
  - - [256, 4608, 1, 1024]
    - [262, 40.518]
  - - [256, 4864, 1, 1024]
    - [282, 42.164]
  - - [256, 5376, 1, 1024]
    - [293, 45.953]
  - - [256, 5888, 1, 1024]
    - [271, 48.635]
  - - [256, 6144, 1, 1024]
    - [282, 50.75]
  - - [256, 6400, 1, 1024]
    - [282, 52.687]
  - - [256, 6656, 1, 1024]
    - [271, 53.713]
  - - [256, 7168, 1, 1024]
    - [324, 56.361]
  - - [256, 7424, 1, 1024]
    - [328, 57.273]
  - - [256, 7936, 1, 1024]
    - [362, 38.629]
  - - [256, 8192, 1, 1024]
    - [292, 39.639]
  - - [256, 8448, 1, 1024]
    - [362, 40.478]
  - - [256, 8960, 1, 1024]
    - [362, 42.271]
  - - [256, 9984, 1, 1024]
    - [364, 45.107]
  - - [256, 10496, 1, 1024]
    - [320, 47.42]
  - - [256, 11264, 1, 1024]
    - [365, 49.879]
  - - [256, 11520, 1, 1024]
    - [320, 50.921]
  - - [256, 11776, 1, 1024]
    - [306, 52.431]
  - - [256, 12544, 1, 1024]
    - [365, 54.659]
  - - [256, 13312, 1, 1024]
    - [306, 57.801]
  - - [256, 14336, 1, 1024]
    - [301, 61.485]
  - - [256, 14592, 1, 1024]
    - [320, 62.366]
  - - [256, 14848, 1, 1024]
    - [301, 63.459]
  - - [256, 15104, 1, 1024]
    - [251, 64.441]
  - - [256, 16128, 1, 1024]
    - [282, 48.666]
  - - [256, 18176, 1, 1024]
    - [282, 53.465]
  - - [256, 18944, 1, 1024]
    - [282, 55.458]
  - - [256, 19200, 1, 1024]
    - [282, 55.808]
  - - [256, 20480, 1, 1024]
    - [282, 59.388]
  - - [256, 20992, 1, 1024]
    - [271, 60.373]
  - - [256, 21248, 1, 1024]
    - [282, 61.109]
  - - [256, 21504, 1, 1024]
    - [282, 61.919]
  - - [256, 22016, 1, 1024]
    - [366, 62.296]
  - - [256, 22344, 1, 1024]
    - [271, 60.17]
  - - [256, 23296, 1, 1024]
    - [332, 53.114]
  - - [256, 23552, 1, 1024]
    - [367, 53.399]
  - - [256, 31488, 1, 1024]
    - [307, 56.883]
  - - [256, 32768, 1, 512]
    - [262, 50.431]
  - - [256, 33536, 1, 1024]
    - [261, 59.531]
  - - [256, 44505, 1, 1024]
    - [271, 62.568]
  - - [512, 1600, 1, 512]
    - [355, 29.963]
  - - [512, 32768, 1, 13]
    - [314, 3.619]
  - - [512, 32768, 1, 1024]
    - [282, 66.464]
  - - [684, 8976, 1, 256]
    - [368, 34.207]
  - - [1024, 200, 1, 560]
    - [369, 9.414]
  - - [1024, 512, 1, 1024]
    - [268, 28.71]
  - - [1024, 512, 1, 1600]
    - [350, 32.042]
  - - [1024, 960, 1, 1024]
    - [370, 39.252]
  - - [1024, 960, 1, 1600]
    - [371, 41.817]
  - - [1024, 1600, 1, 560]
    - [353, 27.877]
  - - [1024, 1600, 1, 1024]
    - [324, 44.353]
  - - [1024, 32768, 1, 480]
    - [253, 67.079]
  - - [1024, 32768, 1, 1024]
    - [302, 72.048]
  - - [1280, 8976, 1, 256]
    - [372, 41.082]
  - - [1792, 8976, 1, 256]
    - [372, 43.347]
  - - [2048, 114, 1, 512]
    - [373, 11.776]
  - - [2048, 114, 1, 768]
    - [374, 14.22]
  - - [2048, 215, 1, 512]
    - [305, 16.878]
  - - [2048, 215, 1, 768]
    - [375, 20.417]
  - - [2048, 256, 1, 512]
    - [376, 21.289]
  - - [2048, 256, 1, 768]
    - [377, 25.81]
  - - [2048, 512, 1, 67]
    - [265, 6.849]
  - - [2048, 512, 1, 74]
    - [351, 7.41]
  - - [2048, 512, 1, 100]
    - [265, 9.62]
  - - [2048, 512, 1, 2048]
    - [349, 39.875]
  - - [2048, 684, 1, 512]
    - [378, 33.561]
  - - [2048, 684, 1, 768]
    - [317, 37.015]
  - - [2048, 960, 1, 74]
    - [368, 11.252]
  - - [2048, 960, 1, 2048]
    - [379, 44.228]
  - - [2048, 1536, 1, 512]
    - [380, 46.956]
  - - [2048, 1536, 1, 768]
    - [381, 53.323]
  - - [2048, 8976, 1, 256]
    - [382, 43.519]
  - - [2304, 8976, 1, 256]
    - [383, 44.237]
  - - [2560, 8976, 1, 256]
    - [384, 43.656]
  - - [2816, 8976, 1, 256]
    - [385, 44.723]
  - - [3072, 8976, 1, 256]
    - [382, 44.696]
  - - [3328, 8976, 1, 256]
    - [384, 45.238]
  - - [3840, 8976, 1, 256]
    - [385, 45.446]
  - - [4096, 8976, 1, 256]
    - [386, 45.031]
  - - [4352, 8976, 1, 256]
    - [384, 45.474]
  - - [4608, 8976, 1, 256]
    - [387, 45.727]
  - - [4864, 8976, 1, 256]
    - [385, 45.007]
  - - [5120, 8976, 1, 256]
    - [386, 47.132]
  - - [5376, 8976, 1, 256]
    - [387, 45.622]
  - - [5632, 8976, 1, 256]
    - [386, 45.377]
  - - [5888, 8976, 1, 256]
    - [388, 46.602]
  - - [6144, 8976, 1, 256]
    - [386, 46.229]
  - - [6400, 8976, 1, 256]
    - [386, 46.828]
  - - [7168, 8976, 1, 256]
    - [387, 47.707]
  - - [7936, 8976, 1, 256]
    - [294, 46.704]
  - - [8192, 8976, 1, 256]
    - [298, 47.153]
  - - [8448, 8976, 1, 256]
    - [388, 47.223]
  - - [8960, 8976, 1, 256]
    - [388, 47.918]
  - - [9472, 8976, 1, 256]
    - [294, 47.769]
  - - [9728, 8976, 1, 256]
    - [386, 48.256]
  - - [9984, 8976, 1, 256]
    - [387, 47.796]
  - - [10240, 8976, 1, 256]
    - [388, 48.653]
  - - [10496, 8976, 1, 256]
    - [386, 48.279]
  - - [11264, 8976, 1, 256]
    - [386, 48.022]
  - - [11776, 8976, 1, 256]
    - [386, 48.115]
  - - [12544, 8976, 1, 256]
    - [388, 48.212]
  - - [13312, 8976, 1, 256]
    - [388, 48.429]
  - - [13568, 8976, 1, 256]
    - [388, 48.791]
  - - [13824, 8976, 1, 256]
    - [388, 48.598]
  - - [15104, 8976, 1, 256]
    - [294, 48.982]
  - - [15360, 8976, 1, 256]
    - [294, 48.631]
  - - [15872, 8976, 1, 256]
    - [388, 48.898]
  - - [16128, 8976, 1, 256]
    - [387, 49.013]
  - - [17152, 8976, 1, 256]
    - [387, 49.271]
  - - [18176, 8976, 1, 256]
    - [388, 48.943]
  - - [18688, 8976, 1, 256]
    - [388, 49.54]
  - - [18944, 8976, 1, 256]
    - [388, 49.354]
  - - [19712, 8976, 1, 256]
    - [294, 49.485]
  - - [19968, 8976, 1, 256]
    - [294, 49.045]
  - - [20480, 8976, 1, 256]
    - [388, 49.417]
  - - [20992, 8976, 1, 256]
    - [294, 49.443]
  - - [21248, 8976, 1, 256]
    - [388, 49.179]
  - - [23552, 8976, 1, 256]
    - [387, 49.869]
  - - [28672, 8976, 1, 256]
    - [294, 49.916]
  - - [31488, 8976, 1, 256]
    - [294, 49.799]
  - - [33536, 8976, 1, 256]
    - [294, 49.855]
  - - [44505, 8976, 1, 256]
    - [294, 48.25]
  - - [14, 14, 10880, 64]
    - [322, 2.447]
  - - [15, 14, 10880, 64]
    - [333, 2.592]
  - - [15, 15, 7680, 64]
    - [333, 2.555]
  - - [15, 15, 10880, 64]
    - [322, 2.777]
  - - [17, 15, 7680, 64]
    - [284, 2.766]
  - - [17, 17, 7680, 64]
    - [334, 3.099]
  - - [21, 17, 6144, 64]
    - [335, 2.507]
  - - [21, 21, 6144, 64]
    - [336, 2.847]
  - - [24, 24, 4736, 64]
    - [337, 4.892]
  - - [30, 30, 2048, 64]
    - [338, 4.135]
  - - [30, 31, 2048, 64]
    - [339, 4.338]
  - - [31, 31, 2048, 64]
    - [340, 4.302]
  - - [32, 32, 4608, 64]
    - [341, 6.157]
  - - [32, 35, 4608, 64]
    - [342, 5.404]
  - - [34, 24, 4736, 64]
    - [343, 5.054]
  - - [34, 34, 4736, 64]
    - [344, 3.999]
  - - [35, 35, 4608, 64]
    - [345, 3.679]
  - - [1024, 3840, 1, 1024]
    - [301, 67.289]
  - - [1024, 3840, 1, 4096]
    - [330, 79.539]
  - - [1024, 3968, 1, 1024]
    - [319, 48.25]
  - - [1024, 3968, 1, 4096]
    - [319, 56.006]
  - - [1024, 6528, 1, 1024]
    - [328, 59.095]
  - - [1024, 6528, 1, 4096]
    - [294, 72.199]
  - - [1024, 7104, 1, 1024]
    - [271, 59.941]
  - - [1024, 7104, 1, 4096]
    - [302, 75.979]
  - - [1024, 7200, 1, 1024]
    - [297, 59.573]
  - - [1024, 7200, 1, 4096]
    - [302, 77.09]
  - - [1024, 8064, 1, 1024]
    - [282, 58.834]
  - - [1024, 8064, 1, 4096]
    - [261, 65.236]
  - - [1024, 8160, 1, 1024]
    - [297, 54.583]
  - - [1024, 8160, 1, 4096]
    - [297, 65.675]
  - - [1024, 9216, 1, 1024]
    - [283, 63.154]
  - - [1024, 9216, 1, 4096]
    - [325, 68.681]
  - - [1024, 9520, 1, 1024]
    - [324, 61.744]
  - - [1024, 9520, 1, 4096]
    - [302, 69.755]
  - - [1024, 10064, 1, 1024]
    - [328, 59.78]
  - - [1024, 10064, 1, 4096]
    - [302, 73.507]
  - - [1024, 10080, 1, 1024]
    - [328, 60.167]
  - - [1024, 10080, 1, 4096]
    - [302, 73.611]
  - - [1024, 10200, 1, 1024]
    - [328, 60.079]
  - - [1024, 10200, 1, 4096]
    - [329, 74.362]
  - - [4096, 3840, 1, 1024]
    - [329, 72.222]
  - - [4096, 3968, 1, 1024]
    - [271, 64.627]
  - - [4096, 6528, 1, 1024]
    - [298, 72.505]
  - - [4096, 7104, 1, 1024]
    - [294, 67.403]
  - - [4096, 7200, 1, 1024]
    - [294, 68.165]
  - - [4096, 8064, 1, 1024]
    - [298, 70.843]
  - - [4096, 8160, 1, 1024]
    - [332, 69.463]
  - - [4096, 9216, 1, 1024]
    - [298, 72.683]
  - - [4096, 9520, 1, 1024]
    - [327, 70.598]
  - - [4096, 10064, 1, 1024]
    - [331, 70.465]
  - - [4096, 10080, 1, 1024]
    - [331, 70.489]
  - - [4096, 10200, 1, 1024]
    - [331, 71.214]
  - - [42720, 3968, 1, 1024]
    - [298, 73.647]
  - - [42720, 6528, 1, 1024]
    - [294, 75.062]
  - - [42720, 7104, 1, 1024]
    - [294, 74.416]
  - - [42720, 7200, 1, 1024]
    - [294, 73.824]
  - - [42720, 9520, 1, 1024]
    - [294, 74.49]
  - - [42720, 10080, 1, 1024]
    - [294, 74.802]
  - - [27, 27, 1920, 64]
    - [208, 4.05]
  - - [27, 33, 1920, 64]
    - [186, 4.765]
  - - [33, 33, 1920, 64]
    - [185, 3.46]
  - - [1024, 3240, 1, 1024]
    - [238, 49.756]
  - - [1024, 3240, 1, 4096]
    - [249, 62.865]
  - - [1024, 3960, 1, 1024]
    - [235, 42.377]
  - - [1024, 3960, 1, 4096]
    - [243, 45.238]
  - - [4096, 3240, 1, 1024]
    - [224, 59.015]
  - - [4096, 3960, 1, 1024]
    - [211, 61.195]
  - - [42720, 3960, 1, 1024]
    - [241, 72.574]
  - - [7680, 8192, 1, 8192]
    - [251, 94.209]
  - - [3840, 4096, 1, 4096]
    - [252, 90.472]
  - - [1920, 2048, 1, 2048]
    - [253, 82.185]
  - - [480, 512, 1, 512]
    - [254, 13.084]
  - - [8192, 7680, 1, 8192]
    - [255, 94.147]
  - - [4096, 3840, 1, 4096]
    - [256, 91.906]
  - - [2048, 1920, 1, 2048]
    - [257, 83.551]
  - - [512, 480, 1, 512]
    - [258, 14.187]
  - - [2, 8, 1, 1024]
    - [264, 0.001]
  - - [512, 512, 16, 64]
    - [265, 15.603]
  - - [512, 512, 128, 64]
    - [266, 23.368]
  - - [1024, 77, 1, 1024]
    - [267, 6.996]
  - - [1024, 512, 1, 4096]
    - [269, 33.663]
  - - [4096, 512, 1, 1024]
    - [268, 40.275]
  - - [30522, 77, 1, 1024]
    - [270, 31.676]
  - - [30522, 616, 1, 1024]
    - [271, 62.129]
  - - [2, 10, 1, 1024]
    - [272, 0.002]
  - - [128, 128, 128, 64]
    - [265, 11.018]
  - - [128, 128, 160, 64]
    - [273, 12.461]
  - - [1024, 10, 1, 1024]
    - [274, 1.211]
  - - [1024, 200, 1, 1024]
    - [275, 14.868]
  - - [1024, 1280, 1, 1024]
    - [276, 45.02]
  - - [1024, 1280, 1, 4096]
    - [277, 44.779]
  - - [4096, 1280, 1, 1024]
    - [278, 60.388]
  - - [30522, 160, 1, 1024]
    - [276, 38.549]
  - - [30522, 200, 1, 1024]
    - [279, 46.354]
  - - [2, 39, 1, 1024]
    - [272, 0.008]
  - - [128, 128, 624, 64]
    - [280, 15.864]
  - - [1024, 39, 1, 1024]
    - [281, 4.115]
  - - [1024, 780, 1, 1024]
    - [268, 34.634]
  - - [1024, 4992, 1, 1024]
    - [282, 58.737]
  - - [1024, 4992, 1, 4096]
    - [283, 66.898]
  - - [4096, 4992, 1, 1024]
    - [282, 66.784]
  - - [30522, 780, 1, 1024]
    - [260, 60.419]
  - - [1024, 308, 1, 1024]
    - [287, 19.884]
  - - [30522, 308, 1, 1024]
    - [271, 51.744]
  - - [2, 40, 1, 1024]
    - [272, 0.008]
  - - [128, 128, 640, 64]
    - [290, 17.112]
  - - [1024, 40, 1, 1024]
    - [291, 4.005]
  - - [1024, 800, 1, 1024]
    - [292, 35.046]
  - - [1024, 5120, 1, 1024]
    - [282, 59.955]
  - - [1024, 5120, 1, 4096]
    - [283, 64.166]
  - - [4096, 5120, 1, 1024]
    - [293, 68.055]
  - - [30522, 800, 1, 1024]
    - [294, 61.399]
  - - [2, 41, 1, 1024]
    - [272, 0.008]
  - - [128, 128, 656, 64]
    - [295, 16.38]
  - - [1024, 41, 1, 1024]
    - [296, 4.064]
  - - [1024, 820, 1, 1024]
    - [268, 35.292]
  - - [1024, 5248, 1, 1024]
    - [282, 60.444]
  - - [1024, 5248, 1, 4096]
    - [297, 68.323]
  - - [4096, 5248, 1, 1024]
    - [298, 68.413]
  - - [30522, 820, 1, 1024]
    - [294, 62.426]
  - - [2, 5, 1, 1024]
    - [284, 0.001]
  - - [512, 512, 80, 64]
    - [265, 22.92]
  - - [1024, 5, 1, 1024]
    - [299, 0.558]
  - - [1024, 385, 1, 1024]
    - [300, 22.623]
  - - [1024, 2560, 1, 1024]
    - [301, 47.85]
  - - [1024, 2560, 1, 4096]
    - [302, 56.294]
  - - [4096, 2560, 1, 1024]
    - [298, 64.621]
  - - [30522, 385, 1, 1024]
    - [260, 49.959]
  - - [2, 6, 1, 1024]
    - [272, 0.001]
  - - [512, 512, 96, 64]
    - [303, 23.153]
  - - [1024, 6, 1, 1024]
    - [304, 0.693]
  - - [1024, 462, 1, 1024]
    - [305, 22.897]
  - - [1024, 3072, 1, 1024]
    - [306, 55.722]
  - - [1024, 3072, 1, 4096]
    - [302, 67.326]
  - - [4096, 3072, 1, 1024]
    - [282, 64.344]
  - - [30522, 462, 1, 1024]
    - [307, 56.969]
  - - [1024, 8, 1, 1024]
    - [274, 0.97]
  - - [1024, 160, 1, 1024]
    - [308, 13.305]
  - - [1024, 1024, 1, 4096]
    - [309, 40.436]
  - - [4096, 1024, 1, 1024]
    - [282, 49.5]
  - - [2, 9, 1, 1024]
    - [264, 0.001]
  - - [128, 128, 144, 64]
    - [310, 11.975]
  - - [1024, 9, 1, 1024]
    - [274, 1.118]
  - - [1024, 180, 1, 1024]
    - [311, 13.587]
  - - [1024, 1152, 1, 1024]
    - [276, 40.811]
  - - [1024, 1152, 1, 4096]
    - [307, 46.473]
  - - [4096, 1152, 1, 1024]
    - [282, 55.619]
  - - [30522, 180, 1, 1024]
    - [312, 42.356]
  - - [1024, 32768, 1, 479]
    - [315, 42.816]
  - - [4, 4, 32768, 64]
    - [322, 0.226]
  - - [4, 4, 38400, 64]
    - [284, 0.228]
  - - [1024, 8192, 1, 1024]
    - [282, 59.946]
  - - [1024, 8192, 1, 4096]
    - [323, 66.491]
  - - [1024, 9600, 1, 1024]
    - [324, 63.911]
  - - [1024, 9600, 1, 4096]
    - [298, 71.939]
  - - [4096, 8192, 1, 1024]
    - [298, 71.887]
  - - [4096, 9600, 1, 1024]
    - [325, 73.211]
  - - [33712, 8192, 1, 1024]
    - [326, 74.716]
  - - [33712, 9600, 1, 1024]
    - [327, 74.974]
  - - [17, 17, 6144, 64]
    - [333, 2.307]
  - - [128, 128, 1, 64]
    - [347, 0.289]
  - - [64, 128, 1, 128]
    - [347, 0.265]
  - - [2, 1024, 1, 1024]
    - [348, 0.209]
  - - [5, 5, 1, 64]
    - [347, 0.0]
  - - [33, 33, 1, 32]
    - [354, 0.007]
  - - [480, 1024, 1, 1024]
    - [389, 24.405]
  - - [480, 2048, 1, 2048]
    - [390, 46.406]
  - - [1024, 480, 1, 1024]
    - [391, 27.385]
  - - [2048, 480, 1, 2048]
    - [392, 47.102]
- null
