library/src/blas3/Tensile/Logic/asm_full/arcturus_Cijk_Ailk_Bljk_HBH.yaml
- {MinimumRequiredVersion: 4.6.0}
- arcturus
- gfx908
- [Device 7380, Device 7388, Device 738c, Device 7390]
    SolutionIndex: 0
    SolutionNameMin: Cijk_Ailk_Bljk_HBH_MT032x032x16_PGR1_PLR1_TT04_04
    SolutionIndex: 1
    SolutionNameMin: Cijk_Ailk_Bljk_HBH_MT064x016x16_PGR1_PLR1_TT04_04
    SolutionIndex: 2
    SolutionNameMin: Cijk_Ailk_Bljk_HBH_MT032x016x16_PGR1_PLR1_TT02_02
    SolutionIndex: 3
    SolutionNameMin: Cijk_Ailk_Bljk_HBH_MT064x016x16_PGR1_PLR1_TT04_02
    SolutionIndex: 4
    SolutionNameMin: Cijk_Ailk_Bljk_HBH_MT064x008x16_PGR1_PLR1_TT02_02
    SolutionIndex: 5
    SolutionNameMin: Cijk_Ailk_Bljk_HBH_MT064x016x16_PGR1_PLR1_TT02_02
    SolutionIndex: 6
    SolutionNameMin: Cijk_Ailk_Bljk_HBH_MT128x016x16_PGR1_PLR1_TT04_02
    SolutionIndex: 7
    SolutionNameMin: Cijk_Ailk_Bljk_HBH_MT016x016x32_PGR1_PLR1_TT02_02
    SolutionIndex: 8
    SolutionNameMin: Cijk_Ailk_Bljk_HBH_MT032x008x32_PGR1_PLR1_TT02_02
    SolutionIndex: 9
    SolutionNameMin: Cijk_Ailk_Bljk_HBH_MT032x016x32_PGR1_PLR1_TT02_02
    SolutionIndex: 10
    SolutionNameMin: Cijk_Ailk_Bljk_HBH_MT064x016x32_PGR1_PLR1_TT04_02
    SolutionIndex: 11
    SolutionNameMin: Cijk_Ailk_Bljk_HBH_MT064x008x32_PGR1_PLR1_TT02_02
    SolutionIndex: 12
    SolutionNameMin: Cijk_Ailk_Bljk_HBH_MT064x016x32_PGR1_PLR1_TT02_02
    SolutionIndex: 13
    SolutionNameMin: Cijk_Ailk_Bljk_HBH_MT128x016x32_PGR1_PLR1_TT04_02
    SolutionIndex: 14
    SolutionNameMin: Cijk_Ailk_Bljk_HBH_MT032x008x64_PGR1_PLR1_TT02_02
    SolutionIndex: 15
    SolutionNameMin: Cijk_Ailk_Bljk_HBH_MT064x008x64_PGR1_PLR1_TT02_02
    SolutionIndex: 16
    SolutionNameMin: Cijk_Ailk_Bljk_HBH_MT032x032x08_PGR1_PLR1_TT04_04
    SolutionIndex: 17
    SolutionNameMin: Cijk_Ailk_Bljk_HBH_MT064x032x08_PGR1_PLR1_TT08_04
    SolutionIndex: 18
    SolutionNameMin: Cijk_Ailk_Bljk_HBH_MT032x016x16_PGR1_PLR1_TT04_02
    SolutionIndex: 19
    SolutionNameMin: Cijk_Ailk_Bljk_HBH_MT032x032x16_PGR1_PLR1_TT04_04
    SolutionIndex: 20
    SolutionNameMin: Cijk_Ailk_Bljk_HBH_MT064x064x16_PGR1_PLR1_TT08_08
    SolutionIndex: 21
    SolutionNameMin: Cijk_Ailk_Bljk_HBH_MT064x016x16_PGR1_PLR1_TT04_02
    SolutionIndex: 22
    SolutionNameMin: Cijk_Ailk_Bljk_HBH_MT064x016x16_PGR1_PLR1_TT02_02
    SolutionIndex: 23
    SolutionNameMin: Cijk_Ailk_Bljk_HBH_MT128x016x16_PGR1_PLR1_TT04_02
    SolutionIndex: 24
    SolutionNameMin: Cijk_Ailk_Bljk_HBH_MT064x016x16_PGR1_PLR1_TT04_04
    SolutionIndex: 25
    SolutionNameMin: Cijk_Ailk_Bljk_HBH_MT064x008x16_PGR1_PLR1_TT02_02
    SolutionIndex: 26
    SolutionNameMin: Cijk_Ailk_Bljk_HBH_MT016x016x24_PGR1_PLR1_TT02_02
    SolutionIndex: 27
    SolutionNameMin: Cijk_Ailk_Bljk_HBH_MT032x016x24_PGR1_PLR1_TT04_02
    SolutionIndex: 28
    SolutionNameMin: Cijk_Ailk_Bljk_HBH_MT032x016x24_PGR1_PLR1_TT04_02
    SolutionIndex: 29
    SolutionNameMin: Cijk_Ailk_Bljk_HBH_MT032x032x24_PGR1_PLR1_TT04_04
    SolutionIndex: 30
    SolutionNameMin: Cijk_Ailk_Bljk_HBH_MT032x032x32_PGR1_PLR1_TT04_04
    SolutionIndex: 31
    SolutionNameMin: Cijk_Ailk_Bljk_HBH_MT064x016x32_PGR1_PLR1_TT02_02
    SolutionIndex: 32
    SolutionNameMin: Cijk_Ailk_Bljk_HBH_MT128x016x32_PGR1_PLR1_TT04_02
    SolutionIndex: 33
    SolutionNameMin: Cijk_Ailk_Bljk_HBH_MT032x008x32_PGR1_PLR1_TT02_02
    SolutionIndex: 34
    SolutionNameMin: Cijk_Ailk_Bljk_HBH_MT064x008x32_PGR1_PLR1_TT02_02
    SolutionIndex: 35
    SolutionNameMin: Cijk_Ailk_Bljk_HBH_MT032x008x64_PGR1_PLR1_TT02_02
    SolutionIndex: 36
    SolutionNameMin: Cijk_Ailk_Bljk_HBH_MT064x008x64_PGR1_PLR1_TT02_02
    SolutionIndex: 37
    SolutionNameMin: Cijk_Ailk_Bljk_HBH_MT064x064x08_PGR1_PLR1_TT04_04
    SolutionIndex: 38
    SolutionNameMin: Cijk_Ailk_Bljk_HBH_MT064x128x08_PGR1_PLR1_TT04_08
    SolutionIndex: 39
    SolutionNameMin: Cijk_Ailk_Bljk_HBH_MT128x064x08_PGR1_PLR1_TT08_04
    SolutionIndex: 40
    SolutionNameMin: Cijk_Ailk_Bljk_HBH_MT064x064x16_PGR1_PLR1_TT04_04
    SolutionIndex: 41
    SolutionNameMin: Cijk_Ailk_Bljk_HBH_MT064x128x16_PGR1_PLR1_TT04_08
    SolutionIndex: 42
    SolutionNameMin: Cijk_Ailk_Bljk_HBH_MT128x064x16_PGR1_PLR1_TT08_04
    SolutionIndex: 43
    SolutionNameMin: Cijk_Ailk_Bljk_HBH_MT128x128x16_PGR1_PLR1_TT08_08
    SolutionIndex: 44
    SolutionNameMin: Cijk_Ailk_Bljk_HBH_MT064x128x16_PGR0_PLR0_TT04_08
    SolutionIndex: 45
    SolutionNameMin: Cijk_Ailk_Bljk_HBH_MT032x128x16_PGR0_PLR0_TT04_04
    SolutionIndex: 46
    SolutionNameMin: Cijk_Ailk_Bljk_HBH_MT064x064x04_PGR1_PLR1_TT04_04
    SolutionIndex: 47
    SolutionNameMin: Cijk_Ailk_Bljk_HBH_MT064x064x08_PGR1_PLR1_TT04_04
    SolutionIndex: 48
    SolutionNameMin: Cijk_Ailk_Bljk_HBH_MT064x064x16_PGR1_PLR1_TT04_04
    SolutionIndex: 49
    SolutionNameMin: Cijk_Ailk_Bljk_HBH_MT032x032x16_PGR1_PLR1_TT04_04
    SolutionIndex: 50
    SolutionNameMin: Cijk_Ailk_Bljk_HBH_MT064x016x16_PGR1_PLR1_TT04_04
    SolutionIndex: 51
    SolutionNameMin: Cijk_Ailk_Bljk_HBH_MT064x032x16_PGR1_PLR1_TT04_04
    SolutionIndex: 52
    SolutionNameMin: Cijk_Ailk_Bljk_HBH_MT032x032x32_PGR1_PLR1_TT04_04
    SolutionIndex: 53
    SolutionNameMin: Cijk_Ailk_Bljk_HBH_MT064x016x32_PGR1_PLR1_TT04_04
    SolutionIndex: 54
    SolutionNameMin: Cijk_Ailk_Bljk_HBH_MT064x032x32_PGR1_PLR1_TT04_04
    SolutionIndex: 55
    SolutionNameMin: Cijk_Ailk_Bljk_HBH_MT128x016x32_PGR1_PLR1_TT04_04
    SolutionIndex: 56
    SolutionNameMin: Cijk_Ailk_Bljk_HBH_MT128x032x32_PGR1_PLR1_TT04_04
    SolutionIndex: 57
    SolutionNameMin: Cijk_Ailk_Bljk_HBH_MT064x064x16_PGR1_PLR1_TT08_08
    SolutionIndex: 58
    SolutionNameMin: Cijk_Ailk_Bljk_HBH_MT128x128x16_PGR1_PLR1_TT08_08
    SolutionIndex: 59
    SolutionNameMin: Cijk_Ailk_Bljk_HBH_MT064x032x08_PGR1_PLR1_TT08_04
    SolutionIndex: 60
    SolutionNameMin: Cijk_Ailk_Bljk_HBH_MT064x064x08_PGR1_PLR1_TT08_08
    SolutionIndex: 61
    SolutionNameMin: Cijk_Ailk_Bljk_HBH_MT128x032x16_PGR1_PLR1_TT08_04
    SolutionIndex: 62
    SolutionNameMin: Cijk_Ailk_Bljk_HBH_MT032x032x16_PGR1_PLR1_TT04_04
    SolutionIndex: 63
    SolutionNameMin: Cijk_Ailk_Bljk_HBH_MT064x032x16_PGR1_PLR1_TT08_04
    SolutionIndex: 64
    SolutionNameMin: Cijk_Ailk_Bljk_HBH_MT064x064x16_PGR1_PLR1_TT04_04
    SolutionIndex: 65
    SolutionNameMin: Cijk_Ailk_Bljk_HBH_MT128x064x16_PGR1_PLR1_TT08_04
    SolutionIndex: 66
    SolutionNameMin: Cijk_Ailk_Bljk_HBH_MT128x128x16_PGR1_PLR1_TT08_08
    SolutionIndex: 67
    SolutionNameMin: Cijk_Ailk_Bljk_HBH_MT064x032x16_PGR1_PLR1_TT04_04
    SolutionIndex: 68
    SolutionNameMin: Cijk_Ailk_Bljk_HBH_MT128x064x32_PGR1_PLR1_TT08_04
    SolutionIndex: 69
    SolutionNameMin: Cijk_Ailk_Bljk_HBH_MT128x032x32_PGR1_PLR1_TT04_04
    SolutionIndex: 70
    SolutionNameMin: Cijk_Ailk_Bljk_HBH_MT064x016x32_PGR1_PLR1_TT04_04
    SolutionIndex: 71
    SolutionNameMin: Cijk_Ailk_Bljk_HBH_MT064x064x16_PGR1_PLR1_TT08_08
    SolutionIndex: 72
    SolutionNameMin: Cijk_Ailk_Bljk_HBH_MT128x128x16_PGR1_PLR1_TT08_08
    SolutionIndex: 73
    SolutionNameMin: Cijk_Ailk_Bljk_HBH_MT064x064x32_PGR1_PLR1_TT08_08
    SolutionIndex: 74
    SolutionNameMin: Cijk_Ailk_Bljk_HBH_MT128x128x32_PGR1_PLR1_TT08_08
    SolutionIndex: 75
    SolutionNameMin: Cijk_Ailk_Bljk_HBH_MT128x128x32_PGR0_PLR1_TT08_08
    SolutionIndex: 76
    SolutionNameMin: Cijk_Ailk_Bljk_HBH_MT064x128x16_PGR1_PLR1_TT04_08
    SolutionIndex: 77
    SolutionNameMin: Cijk_Ailk_Bljk_HBH_MT128x064x16_PGR1_PLR1_TT08_04
    SolutionIndex: 78
    SolutionNameMin: Cijk_Ailk_Bljk_HBH_MT128x128x16_PGR1_PLR1_TT08_08
    SolutionIndex: 79
    SolutionNameMin: Cijk_Ailk_Bljk_HBH_MT128x064x16_PGR1_PLR1_TT04_08
    SolutionIndex: 80
    SolutionNameMin: Cijk_Ailk_Bljk_HBH_MT128x064x16_PGR1_PLR1_TT04_08
    SolutionIndex: 81
    SolutionNameMin: Cijk_Ailk_Bljk_HBH_MT128x064x32_PGR1_PLR1_TT04_04
    SolutionIndex: 82
    SolutionNameMin: Cijk_Ailk_Bljk_HBH_MT256x128x32_PGR1_PLR1_TT08_08
    SolutionIndex: 83
    SolutionNameMin: Cijk_Ailk_Bljk_HBH_MT064x128x16_PGR1_PLR0_TT04_08
    SolutionIndex: 84
    SolutionNameMin: Cijk_Ailk_Bljk_HBH_MT128x064x16_PGR1_PLR0_TT04_08
    SolutionIndex: 85
    SolutionNameMin: Cijk_Ailk_Bljk_HBH_MT064x064x04_PGR0_PLR0_TT04_04
    SolutionIndex: 86
    SolutionNameMin: Cijk_Ailk_Bljk_HBH_MT064x064x04_PGR0_PLR1_TT04_04
    SolutionIndex: 87
    SolutionNameMin: Cijk_Ailk_Bljk_HBH_MT064x128x08_PGR0_PLR0_TT04_08
    SolutionIndex: 88
    SolutionNameMin: Cijk_Ailk_Bljk_HBH_MT064x128x08_PGR1_PLR0_TT04_08
    SolutionIndex: 89
    SolutionNameMin: Cijk_Ailk_Bljk_HBH_MT064x128x08_PGR0_PLR1_TT04_08
    SolutionIndex: 90
    SolutionNameMin: Cijk_Ailk_Bljk_HBH_MT064x064x08_PGR1_PLR1_TT04_04
    SolutionIndex: 91
    SolutionNameMin: Cijk_Ailk_Bljk_HBH_MT064x128x16_PGR0_PLR0_TT04_08
    SolutionIndex: 92
    SolutionNameMin: Cijk_Ailk_Bljk_HBH_MT064x064x16_PGR0_PLR1_TT04_04
    SolutionIndex: 93
    SolutionNameMin: Cijk_Ailk_Bljk_HBH_MT128x128x04_PGR0_PLR0_TT08_08
    SolutionIndex: 94
    SolutionNameMin: Cijk_Ailk_Bljk_HBH_MT064x064x04_PGR0_PLR0_TT04_04
    SolutionIndex: 95
    SolutionNameMin: Cijk_Ailk_Bljk_HBH_MT064x064x04_PGR1_PLR0_TT04_04
    SolutionIndex: 96
    SolutionNameMin: Cijk_Ailk_Bljk_HBH_MT064x064x04_PGR0_PLR1_TT04_04
    SolutionIndex: 97
    SolutionNameMin: Cijk_Ailk_Bljk_HBH_MT064x064x04_PGR1_PLR1_TT04_04
    SolutionIndex: 98
    SolutionNameMin: Cijk_Ailk_Bljk_HBH_MT064x128x08_PGR1_PLR0_TT04_08
    SolutionIndex: 99
    SolutionNameMin: Cijk_Ailk_Bljk_HBH_MT064x128x08_PGR0_PLR1_TT04_08
    SolutionIndex: 100
    SolutionNameMin: Cijk_Ailk_Bljk_HBH_MT064x064x08_PGR1_PLR1_TT04_04
    SolutionIndex: 101
    SolutionNameMin: Cijk_Ailk_Bljk_HBH_MT128x128x16_PGR1_PLR0_TT08_08
    SolutionIndex: 102
    SolutionNameMin: Cijk_Ailk_Bljk_HBH_MT064x064x16_PGR1_PLR1_TT04_04
    SolutionIndex: 103
    SolutionNameMin: Cijk_Ailk_Bljk_HBH_MT128x064x16_EPS1_GRVW08_LPB00_PGR1_PLR1_SNLL1_TT08_08_VW08_WG16_08_01_WGM01
    SolutionIndex: 104
    SolutionNameMin: Cijk_Ailk_Bljk_HBH_MT064x128x16_EPS1_GRVW04_LPB04_PGR1_PLR1_SNLL1_TT08_04_VW04_WG08_32_01_WGM01
    SolutionIndex: 105
    SolutionNameMin: Cijk_Ailk_Bljk_HBH_MT128x064x16_EPS1_GRVW04_LPB04_PGR1_PLR1_SNLL1_TT08_04_VW04_WG16_16_01_WGM01
    SolutionIndex: 106
    SolutionNameMin: Cijk_Ailk_Bljk_HBH_MT128x128x16_EPS1_GRVW04_LPB04_PGR1_PLR1_SNLL1_TT08_08_VW04_WG16_16_01_WGM01
    SolutionIndex: 107
    SolutionNameMin: Cijk_Ailk_Bljk_HBH_MT064x128x16_EPS1_GRVW04_LPB04_PGR1_PLR1_SNLL1_TT08_04_VW04_WG08_32_01_WGM08
    SolutionIndex: 108
    SolutionNameMin: Cijk_Ailk_Bljk_HBH_MT128x064x16_EPS1_GRVW04_LPB04_PGR1_PLR1_SNLL1_TT08_04_VW04_WG16_16_01_WGM08
    SolutionIndex: 109
    SolutionNameMin: Cijk_Ailk_Bljk_HBH_MT256x064x16_EPS1_GRVW04_LPB04_PGR1_PLR1_SNLL1_TT08_08_VW04_WG32_08_01_WGM64
    SolutionIndex: 110
    SolutionNameMin: Cijk_Ailk_Bljk_HBH_MT064x128x32_EPS0_GRVW04_LPB04_PGR0_PLR0_SNLL0_TT08_04_VW04_WG08_32_01_WGM01
    SolutionIndex: 111
    SolutionNameMin: Cijk_Ailk_Bljk_HBH_MT064x064x32_EPS0_GRVW04_LPB04_PGR0_PLR0_SNLL0_TT04_04_VW04_WG16_16_01_WGM01
    SolutionIndex: 112
    SolutionNameMin: Cijk_Ailk_Bljk_HBH_MT128x064x32_EPS1_GRVW04_LPB04_PGR1_PLR1_SNLL1_TT08_04_VW04_WG16_16_01_WGM01
    SolutionIndex: 113
    SolutionNameMin: Cijk_Ailk_Bljk_HBH_MT128x064x32_EPS0_GRVW08_LPB08_PGR0_PLR1_SNLL0_TT08_08_VW08_WG16_08_01_WGM01
    SolutionIndex: 114
    SolutionNameMin: Cijk_Ailk_Bljk_HBH_MT64x128x16_MI32x32x4x2_SE_AF0EM1_ASEM2_GRVW2_ONLL0_SNLL1
    SolutionIndex: 115
    SolutionNameMin: Cijk_Ailk_Bljk_HBH_MT64x128x16_MI32x32x4x2_SE_AF0EM1_ASEM1_GRVW2_ONLL0_SNLL0
    SolutionIndex: 116
    SolutionNameMin: Cijk_Ailk_Bljk_HBH_MT64x128x16_MI32x32x4x2_SE_AF0EM2_ASEM1_GRVW2_ONLL0_SNLL0
    SolutionIndex: 117
    SolutionNameMin: Cijk_Ailk_Bljk_HBH_MT64x128x32_MI32x32x4x2_SE_AF0EM2_ASEM2_GRVW2_ONLL0_SNLL0
    SolutionIndex: 118
    SolutionNameMin: Cijk_Ailk_Bljk_HBH_MT64x128x16_MI32x32x4x2_SE_AF0EM1_ASEM1_GRVW2_ONLL1_SNLL1
    SolutionIndex: 119
    SolutionNameMin: Cijk_Ailk_Bljk_HBH_MT64x128x16_MI32x32x4x2_SE_AF0EM2_ASEM1_GRVW2_ONLL1_SNLL1
    SolutionIndex: 120
    SolutionNameMin: Cijk_Ailk_Bljk_HBH_MT64x128x16_MI32x32x4x2_SE_AF0EM1_ASEM1_GRVW2_ONLL1_SNLL0
    SolutionIndex: 121
    SolutionNameMin: Cijk_Ailk_Bljk_HBH_MT64x128x16_MI32x32x4x2_SE_AF0EM2_ASEM1_GRVW2_ONLL1_SNLL0
    SolutionIndex: 122
    SolutionNameMin: Cijk_Ailk_Bljk_HBH_MT64x128x8_MI32x32x4x2_SE_AF0EM2_ASEM1_GRVW4_ONLL1_SNLL0
    SolutionIndex: 123
    SolutionNameMin: Cijk_Ailk_Bljk_HBH_MT32x256x16_MI32x32x4x2_SE_AF0EM2_ASEM2_GRVW4_ONLL1_SNLL0
    SolutionIndex: 124
    SolutionNameMin: Cijk_Ailk_Bljk_HBH_MT64x256x16_MI32x32x4x2_SE_AF0EM1_ASEM1_GRVW2_ONLL0_SNLL0
    SolutionIndex: 125
    SolutionNameMin: Cijk_Ailk_Bljk_HBH_MT64x256x16_MI32x32x4x2_SE_AF0EM1_ASEM1_GRVW2_ONLL1_SNLL1
    SolutionIndex: 126
    SolutionNameMin: Cijk_Ailk_Bljk_HBH_MT64x256x16_MI32x32x4x2_SE_AF0EM1_ASEM2_GRVW2_ONLL1_SNLL0
    SolutionIndex: 127
    SolutionIndex: 128
    SolutionIndex: 129
    SolutionIndex: 130
    SolutionIndex: 131
    SolutionIndex: 132
    SolutionIndex: 133
    SolutionIndex: 134
    SolutionIndex: 135
    SolutionIndex: 136
    SolutionIndex: 137
    SolutionIndex: 138
    SolutionIndex: 139
    SolutionIndex: 140
    SolutionIndex: 141
    SolutionIndex: 142
    SolutionIndex: 143
    SolutionIndex: 144
    SolutionIndex: 145
    SolutionIndex: 146
    SolutionIndex: 147
    SolutionIndex: 148
    SolutionIndex: 149
    SolutionIndex: 150
    SolutionIndex: 151
    SolutionIndex: 152
    SolutionIndex: 153
    SolutionIndex: 154
    SolutionIndex: 155
    SolutionIndex: 156
    SolutionIndex: 157
    SolutionIndex: 158
    SolutionIndex: 159
    SolutionIndex: 160
    SolutionIndex: 161
    SolutionIndex: 162
    SolutionIndex: 163
    SolutionIndex: 164
    SolutionIndex: 165
    SolutionIndex: 166
    SolutionIndex: 167
    SolutionIndex: 168
    SolutionIndex: 169
    SolutionIndex: 170
    SolutionIndex: 171
    SolutionIndex: 172
    SolutionIndex: 173
    SolutionIndex: 174
    SolutionIndex: 175
    SolutionIndex: 176
    SolutionIndex: 177
    SolutionIndex: 178
    SolutionIndex: 179
    SolutionIndex: 180
    SolutionIndex: 181
    SolutionIndex: 182
    SolutionIndex: 183
    SolutionIndex: 184
    SolutionIndex: 185
    SolutionIndex: 186
    SolutionIndex: 187
    SolutionIndex: 188
    SolutionIndex: 189
    SolutionIndex: 190
    SolutionIndex: 191
    SolutionIndex: 192
    SolutionIndex: 193
    SolutionIndex: 194
    SolutionIndex: 195
    SolutionIndex: 196
    SolutionIndex: 197
    SolutionIndex: 198
    SolutionIndex: 199
    SolutionIndex: 200
    SolutionIndex: 201
    SolutionIndex: 202
    SolutionIndex: 203
    SolutionIndex: 204
    SolutionIndex: 205
    SolutionIndex: 206
    SolutionIndex: 207
    SolutionIndex: 208
    SolutionIndex: 209
    SolutionIndex: 210
    SolutionIndex: 211
    SolutionIndex: 212
    SolutionIndex: 213
    SolutionIndex: 214
    SolutionIndex: 215
    SolutionIndex: 216
    SolutionIndex: 217
    SolutionIndex: 218
    SolutionIndex: 219
    SolutionIndex: 220
    SolutionIndex: 221
    SolutionIndex: 222
    SolutionIndex: 223
    SolutionIndex: 224
    SolutionIndex: 225
    SolutionIndex: 226
    SolutionIndex: 227
    SolutionIndex: 228
    SolutionIndex: 229
    SolutionIndex: 230
    SolutionIndex: 231
    SolutionIndex: 232
    SolutionIndex: 233
    SolutionIndex: 234
    SolutionIndex: 235
    SolutionIndex: 236
    SolutionIndex: 237
    SolutionIndex: 238
    SolutionIndex: 239
    SolutionIndex: 240
    SolutionIndex: 241
    SolutionIndex: 242
    SolutionIndex: 243
    SolutionIndex: 244
    SolutionIndex: 245
    SolutionIndex: 246
    SolutionIndex: 247
    SolutionIndex: 248
    SolutionIndex: 249
    SolutionIndex: 250
    SolutionIndex: 251
    SolutionIndex: 252
    SolutionIndex: 253
    SolutionIndex: 254
    SolutionIndex: 255
    SolutionIndex: 256
    SolutionIndex: 257
    SolutionIndex: 258
    SolutionIndex: 259
    SolutionIndex: 260
    SolutionIndex: 261
    SolutionIndex: 262
    SolutionIndex: 263
    SolutionIndex: 264
    SolutionIndex: 265
    SolutionIndex: 266
    SolutionIndex: 267
    SolutionIndex: 268
    SolutionIndex: 269
    SolutionIndex: 270
    SolutionIndex: 271
    SolutionIndex: 272
    SolutionIndex: 273
    SolutionIndex: 274
    SolutionIndex: 275
    SolutionIndex: 276
    SolutionIndex: 277
    SolutionIndex: 278
    SolutionIndex: 279
    SolutionIndex: 280
    SolutionIndex: 281
    SolutionIndex: 282
    SolutionIndex: 283
    SolutionIndex: 284
    SolutionIndex: 285
    SolutionIndex: 286
    SolutionIndex: 287
    SolutionIndex: 288
    SolutionIndex: 289
    SolutionIndex: 290
    SolutionIndex: 291
    SolutionIndex: 292
    SolutionIndex: 293
    SolutionIndex: 294
    SolutionIndex: 295
    SolutionIndex: 296
    SolutionIndex: 297
    SolutionIndex: 298
    SolutionIndex: 299
    SolutionIndex: 300
    SolutionIndex: 301
    SolutionIndex: 302
    SolutionIndex: 303
    SolutionIndex: 304
    SolutionIndex: 305
    SolutionIndex: 306
    SolutionIndex: 307
    SolutionIndex: 308
    SolutionIndex: 309
    SolutionIndex: 310
    SolutionIndex: 311
    SolutionIndex: 312
    SolutionIndex: 313
    SolutionIndex: 314
    SolutionIndex: 315
    SolutionIndex: 316
    SolutionIndex: 317
    SolutionIndex: 318
    SolutionIndex: 319
    SolutionIndex: 320
    SolutionIndex: 321
    SolutionIndex: 322
    SolutionIndex: 323
    SolutionIndex: 324
    SolutionIndex: 325
    SolutionIndex: 326
    SolutionIndex: 327
    SolutionIndex: 328
    SolutionIndex: 329
    SolutionIndex: 330
    SolutionIndex: 331
    SolutionIndex: 332
    SolutionIndex: 333
    SolutionIndex: 334
    SolutionIndex: 335
    SolutionIndex: 336
    SolutionIndex: 337
    SolutionIndex: 338
    SolutionIndex: 339
    SolutionIndex: 340
    SolutionIndex: 341
    SolutionIndex: 342
    SolutionIndex: 343
    SolutionIndex: 344
    SolutionIndex: 345
    SolutionIndex: 346
    SolutionIndex: 347
    SolutionIndex: 348
    SolutionIndex: 349
    SolutionIndex: 350
    SolutionIndex: 351
    SolutionIndex: 352
    SolutionIndex: 353
    SolutionIndex: 354
    SolutionIndex: 355
    SolutionIndex: 356
    SolutionIndex: 357
    SolutionIndex: 358
    SolutionIndex: 359
    SolutionIndex: 360
    SolutionIndex: 361
    SolutionIndex: 362
    SolutionIndex: 363
    SolutionIndex: 364
    SolutionIndex: 365
    SolutionIndex: 366
    SolutionIndex: 367
    SolutionIndex: 368
    SolutionIndex: 369
    SolutionIndex: 370
    SolutionIndex: 371
    SolutionIndex: 372
    SolutionIndex: 373
    SolutionIndex: 374
    SolutionIndex: 375
    SolutionIndex: 376
    SolutionIndex: 377
    SolutionIndex: 378
    SolutionIndex: 379
    SolutionIndex: 380
    SolutionIndex: 381
    SolutionIndex: 382
    SolutionIndex: 383
    SolutionIndex: 384
    SolutionIndex: 385
    SolutionIndex: 386
    SolutionIndex: 387
    SolutionIndex: 388
    SolutionIndex: 389
    SolutionIndex: 390
    SolutionIndex: 391
    SolutionIndex: 392
    SolutionIndex: 393
    SolutionIndex: 394
    SolutionIndex: 395
    SolutionIndex: 396
    SolutionIndex: 397
    SolutionIndex: 398
    SolutionIndex: 399
    SolutionIndex: 400
    SolutionIndex: 401
    SolutionIndex: 402
    SolutionIndex: 403
    SolutionIndex: 404
    SolutionIndex: 405
    SolutionIndex: 406
    SolutionIndex: 407
    SolutionIndex: 408
    SolutionIndex: 409
    SolutionIndex: 410
    SolutionIndex: 411
    SolutionIndex: 412
    SolutionIndex: 413
    SolutionIndex: 414
    SolutionIndex: 415
    SolutionIndex: 416
    SolutionIndex: 417
    SolutionIndex: 418
    SolutionIndex: 419
    SolutionIndex: 420
    SolutionIndex: 421
    SolutionIndex: 422
    SolutionIndex: 423
    SolutionIndex: 424
    SolutionIndex: 425
    SolutionIndex: 426
    SolutionIndex: 427
    SolutionIndex: 428
    SolutionIndex: 429
    SolutionIndex: 430
    SolutionIndex: 431
    SolutionIndex: 432
    SolutionIndex: 433
    SolutionIndex: 434
    SolutionIndex: 435
    SolutionIndex: 436
    SolutionIndex: 437
    SolutionIndex: 438
    SolutionIndex: 439
    SolutionIndex: 440
    SolutionIndex: 441
    SolutionIndex: 442
    SolutionIndex: 443
    SolutionIndex: 444
    SolutionIndex: 445
    SolutionIndex: 446
    SolutionIndex: 447
    SolutionIndex: 448
    SolutionIndex: 449
    SolutionIndex: 450
    SolutionIndex: 451
    SolutionIndex: 452
    SolutionIndex: 453
    SolutionIndex: 454
    SolutionIndex: 455
    SolutionIndex: 456
    SolutionIndex: 457
    SolutionIndex: 458
    SolutionIndex: 459
    SolutionIndex: 460
    SolutionIndex: 461
- - - [1024, 1024, 1, 3328]
    - [19, 6.912]
  - - [2944, 4288, 1, 1280]
    - [40, 7.641]
  - - [2368, 64, 1, 3328]
    - [34, 3.688]
  - - [2368, 5888, 1, 256]
    - [38, 7.416]
  - - [256, 704, 1, 1280]
    - [19, 3.036]
  - - [128, 6784, 1, 3328]
    - [23, 6.204]
  - - [5888, 1856, 1, 3328]
    - [40, 7.754]
  - - [5888, 2944, 1, 3328]
    - [40, 7.758]
  - - [1856, 4288, 1, 256]
    - [37, 7.19]
  - - [5056, 5056, 1, 3328]
    - [40, 7.842]
  - - [1408, 5888, 1, 1280]
    - [42, 7.623]
  - - [1024, 3584, 1, 3328]
    - [40, 7.605]
  - - [448, 3584, 1, 3328]
    - [40, 6.405]
  - - [256, 4288, 1, 3328]
    - [40, 5.937]
  - - [5888, 1408, 1, 1280]
    - [42, 7.624]
  - - [704, 1856, 1, 3328]
    - [40, 7.059]
  - - [1024, 2368, 1, 256]
    - [42, 6.405]
  - - [5056, 6784, 1, 1280]
    - [37, 7.827]
  - - [1408, 64, 1, 1280]
    - [11, 2.607]
  - - [448, 1024, 1, 1280]
    - [29, 5.254]
  - - [5056, 5056, 1, 1280]
    - [40, 7.786]
  - - [4288, 6784, 1, 256]
    - [38, 7.546]
  - - [6784, 448, 1, 256]
    - [42, 6.78]
  - - [5056, 256, 1, 1280]
    - [40, 6.879]
  - - [5888, 704, 1, 1280]
    - [40, 7.476]
  - - [3584, 1024, 1, 256]
    - [42, 7.085]
  - - [6784, 4288, 1, 3328]
    - [40, 7.877]
  - - [1856, 2368, 1, 3328]
    - [40, 7.55]
  - - [5888, 2944, 1, 1280]
    - [37, 7.691]
  - - [5888, 1024, 1, 256]
    - [37, 7.244]
  - - [448, 64, 1, 1280]
    - [15, 0.949]
  - - [1024, 704, 1, 256]
    - [16, 5.155]
  - - [1408, 2944, 1, 256]
    - [42, 7.083]
  - - [256, 1856, 1, 1280]
    - [19, 5.436]
  - - [6784, 5056, 1, 3328]
    - [40, 7.883]
  - - [5056, 5056, 1, 256]
    - [17, 7.536]
  - - [256, 2944, 1, 3328]
    - [40, 6.342]
  - - [64, 1024, 1, 1280]
    - [31, 2.071]
  - - [1024, 3584, 1, 1280]
    - [40, 7.511]
  - - [2368, 2944, 1, 1280]
    - [40, 7.572]
  - - [128, 3584, 1, 1280]
    - [1, 5.356]
  - - [6784, 6784, 1, 1280]
    - [42, 7.849]
  - - [1024, 256, 1, 3328]
    - [29, 4.657]
  - - [1408, 4288, 1, 1280]
    - [40, 7.365]
  - - [3584, 4288, 1, 1280]
    - [40, 7.738]
  - - [2368, 704, 1, 1280]
    - [40, 6.547]
  - - [5056, 4288, 1, 3328]
    - [40, 7.841]
  - - [3584, 2368, 1, 3328]
    - [40, 7.64]
  - - [5888, 6784, 1, 1280]
    - [37, 7.81]
  - - [64, 704, 1, 1280]
    - [33, 1.424]
  - - [4288, 256, 1, 256]
    - [40, 5.302]
  - - [6784, 448, 1, 1280]
    - [40, 7.219]
  - - [2944, 5888, 1, 256]
    - [37, 7.385]
  - - [256, 128, 1, 256]
    - [15, 0.727]
  - - [4288, 2944, 1, 256]
    - [37, 7.31]
  - - [5888, 64, 1, 3328]
    - [23, 5.438]
  - - [2944, 256, 1, 3328]
    - [19, 6.359]
  - - [5056, 2368, 1, 1280]
    - [37, 7.703]
  - - [448, 3584, 1, 1280]
    - [40, 6.314]
  - - [6784, 5888, 1, 256]
    - [38, 7.564]
  - - [64, 1024, 1, 3328]
    - [31, 2.226]
  - - [704, 128, 1, 1280]
    - [11, 2.639]
  - - [1408, 448, 1, 1280]
    - [19, 5.255]
  - - [1024, 1408, 1, 256]
    - [37, 5.905]
  - - [2368, 2368, 1, 3328]
    - [40, 7.502]
  - - [5056, 704, 1, 3328]
    - [40, 7.372]
  - - [1408, 1856, 1, 256]
    - [42, 6.887]
  - - [1408, 256, 1, 1280]
    - [19, 4.204]
  - - [5888, 1856, 1, 256]
    - [42, 7.427]
  - - [704, 5888, 1, 256]
    - [38, 7.073]
  - - [6784, 64, 1, 256]
    - [24, 4.281]
  - - [3584, 704, 1, 3328]
    - [40, 7.202]
  - - [1408, 1408, 1, 256]
    - [43, 6.392]
  - - [1024, 64, 1, 1280]
    - [8, 2.082]
  - - [448, 4288, 1, 256]
    - [20, 6.178]
  - - [64, 3584, 1, 3328]
    - [27, 4.533]
  - - [704, 2368, 1, 1280]
    - [40, 6.554]
  - - [1856, 2368, 1, 1280]
    - [40, 7.475]
  - - [2368, 128, 1, 3328]
    - [22, 4.634]
  - - [1408, 1408, 1, 3328]
    - [40, 6.976]
  - - [2944, 128, 1, 256]
    - [6, 4.18]
  - - [448, 1408, 1, 256]
    - [40, 4.552]
  - - [64, 5056, 1, 3328]
    - [5, 4.935]
  - - [1408, 1024, 1, 1280]
    - [40, 6.512]
  - - [704, 6784, 1, 256]
    - [37, 6.922]
  - - [6784, 704, 1, 256]
    - [37, 6.909]
  - - [256, 3584, 1, 3328]
    - [40, 6.044]
  - - [5056, 704, 1, 256]
    - [17, 6.866]
  - - [1408, 3584, 1, 256]
    - [42, 6.992]
  - - [3584, 4288, 1, 3328]
    - [40, 7.799]
  - - [5888, 1856, 1, 1280]
    - [42, 7.699]
  - - [256, 1408, 1, 256]
    - [40, 3.496]
  - - [5056, 64, 1, 1280]
    - [22, 4.727]
  - - [2368, 128, 1, 256]
    - [5, 3.542]
  - - [2368, 3584, 1, 1280]
    - [40, 7.575]
  - - [1024, 256, 1, 256]
    - [19, 3.413]
  - - [448, 448, 1, 256]
    - [10, 3.024]
  - - [2944, 3584, 1, 3328]
    - [40, 7.667]
  - - [256, 256, 1, 3328]
    - [12, 2.231]
  - - [128, 1024, 1, 3328]
    - [11, 3.822]
  - - [6784, 2944, 1, 256]
    - [38, 7.418]
  - - [64, 1856, 1, 1280]
    - [11, 3.256]
  - - [448, 256, 1, 256]
    - [12, 2.271]
  - - [1856, 2368, 1, 256]
    - [37, 7.048]
  - - [3584, 6784, 1, 3328]
    - [40, 7.857]
  - - [256, 1024, 1, 256]
    - [19, 3.47]
  - - [1024, 128, 1, 1280]
    - [11, 3.568]
  - - [4288, 128, 1, 1280]
    - [3, 5.218]
  - - [5056, 4288, 1, 1280]
    - [40, 7.787]
  - - [5888, 64, 1, 256]
    - [6, 4.238]
  - - [6784, 1856, 1, 3328]
    - [40, 7.679]
  - - [1408, 5056, 1, 1280]
    - [40, 7.466]
  - - [1856, 256, 1, 1280]
    - [19, 5.452]
  - - [64, 5888, 1, 3328]
    - [5, 4.969]
  - - [6784, 5888, 1, 3328]
    - [40, 7.867]
  - - [448, 256, 1, 3328]
    - [11, 3.357]
  - - [2368, 5056, 1, 1280]
    - [40, 7.707]
  - - [1024, 704, 1, 1280]
    - [19, 5.976]
  - - [256, 1408, 1, 3328]
    - [19, 4.336]
  - - [6784, 128, 1, 3328]
    - [23, 6.197]
  - - [1024, 5056, 1, 1280]
    - [40, 7.522]
  - - [4288, 1024, 1, 256]
    - [37, 7.022]
  - - [2368, 1408, 1, 256]
    - [37, 6.862]
  - - [704, 704, 1, 3328]
    - [19, 5.878]
  - - [5888, 448, 1, 1280]
    - [40, 6.807]
  - - [3584, 256, 1, 3328]
    - [19, 6.094]
  - - [704, 5888, 1, 3328]
    - [40, 7.557]
  - - [1024, 6784, 1, 1280]
    - [40, 7.545]
  - - [128, 3584, 1, 3328]
    - [1, 5.531]
  - - [128, 704, 1, 1280]
    - [11, 2.614]
  - - [3584, 2944, 1, 1280]
    - [40, 7.606]
  - - [1856, 128, 1, 3328]
    - [32, 4.698]
  - - [128, 2944, 1, 1280]
    - [6, 5.231]
  - - [448, 1856, 1, 1280]
    - [19, 5.434]
  - - [1408, 5056, 1, 3328]
    - [40, 7.529]
  - - [1856, 1856, 1, 3328]
    - [40, 7.142]
  - - [3584, 128, 1, 256]
    - [24, 4.486]
  - - [448, 1408, 1, 3328]
    - [19, 5.376]
  - - [2368, 2368, 1, 256]
    - [17, 7.07]
  - - [4288, 4288, 1, 1280]
    - [37, 7.708]
  - - [64, 448, 1, 1280]
    - [14, 0.951]
  - - [5888, 1024, 1, 1280]
    - [40, 7.655]
  - - [704, 1024, 1, 256]
    - [40, 5.155]
  - - [704, 6784, 1, 3328]
    - [40, 7.372]
  - - [5888, 5888, 1, 3328]
    - [40, 7.851]
  - - [5056, 1024, 1, 1280]
    - [40, 7.528]
  - - [448, 5888, 1, 3328]
    - [40, 6.883]
  - - [1024, 2944, 1, 1280]
    - [40, 7.154]
  - - [5056, 5888, 1, 1280]
    - [38, 7.815]
  - - [448, 6784, 1, 256]
    - [41, 6.761]
  - - [256, 3584, 1, 256]
    - [40, 5.284]
  - - [256, 448, 1, 256]
    - [34, 2.29]
  - - [3584, 5888, 1, 256]
    - [37, 7.46]
  - - [2944, 3584, 1, 256]
    - [37, 7.266]
  - - [1408, 704, 1, 256]
    - [42, 5.681]
  - - [6784, 1024, 1, 3328]
    - [40, 7.613]
  - - [6784, 2944, 1, 3328]
    - [40, 7.784]
  - - [64, 64, 1, 3328]
    - [11, 0.142]
  - - [6784, 2368, 1, 1280]
    - [42, 7.71]
  - - [4288, 3584, 1, 256]
    - [37, 7.408]
  - - [4288, 5888, 1, 1280]
    - [40, 7.77]
  - - [448, 2944, 1, 3328]
    - [40, 6.054]
  - - [4288, 1856, 1, 1280]
    - [40, 7.549]
  - - [1856, 2944, 1, 3328]
    - [40, 7.654]
  - - [256, 6784, 1, 3328]
    - [40, 6.915]
  - - [64, 5888, 1, 256]
    - [18, 4.048]
  - - [5056, 1024, 1, 256]
    - [38, 7.174]
  - - [704, 64, 1, 3328]
    - [35, 1.549]
  - - [5056, 1856, 1, 3328]
    - [40, 7.755]
  - - [448, 448, 1, 3328]
    - [27, 3.987]
  - - [448, 2368, 1, 1280]
    - [40, 5.645]
  - - [1408, 128, 1, 1280]
    - [5, 3.932]
  - - [5056, 256, 1, 3328]
    - [40, 7.0]
  - - [704, 704, 1, 256]
    - [19, 4.731]
  - - [1024, 5888, 1, 1280]
    - [40, 7.656]
  - - [64, 128, 1, 256]
    - [2, 0.162]
  - - [128, 1856, 1, 1280]
    - [13, 4.453]
  - - [5056, 3584, 1, 256]
    - [38, 7.472]
  - - [1856, 1024, 1, 1280]
    - [40, 6.605]
  - - [1856, 1856, 1, 1280]
    - [40, 7.061]
  - - [128, 4288, 1, 3328]
    - [3, 5.315]
  - - [1856, 1024, 1, 3328]
    - [40, 6.691]
  - - [256, 2368, 1, 256]
    - [40, 4.414]
  - - [1024, 448, 1, 3328]
    - [19, 5.437]
  - - [1856, 704, 1, 1280]
    - [40, 6.929]
  - - [6784, 1024, 1, 256]
    - [37, 7.18]
  - - [5056, 5888, 1, 3328]
    - [40, 7.855]
  - - [1856, 1024, 1, 256]
    - [20, 6.12]
  - - [5056, 1408, 1, 3328]
    - [40, 7.532]
  - - [1024, 1024, 1, 1280]
    - [19, 6.764]
  - - [448, 5888, 1, 256]
    - [37, 6.383]
  - - [1408, 6784, 1, 3328]
    - [40, 7.685]
  - - [2944, 1408, 1, 3328]
    - [40, 7.555]
  - - [2944, 4288, 1, 3328]
    - [40, 7.697]
  - - [256, 2944, 1, 256]
    - [40, 5.39]
  - - [5056, 2944, 1, 256]
    - [37, 7.426]
  - - [2368, 1856, 1, 256]
    - [37, 7.043]
  - - [128, 6784, 1, 1280]
    - [6, 6.094]
  - - [1408, 3584, 1, 3328]
    - [40, 7.412]
  - - [2368, 6784, 1, 256]
    - [38, 7.464]
  - - [4288, 2368, 1, 3328]
    - [40, 7.757]
  - - [704, 3584, 1, 1280]
    - [40, 7.113]
  - - [1408, 5888, 1, 3328]
    - [40, 7.69]
  - - [1856, 5056, 1, 256]
    - [17, 7.364]
  - - [6784, 6784, 1, 256]
    - [38, 7.629]
  - - [1408, 704, 1, 3328]
    - [40, 6.524]
  - - [128, 5888, 1, 1280]
    - [0, 6.222]
  - - [2368, 4288, 1, 1280]
    - [40, 7.696]
  - - [3584, 1856, 1, 1280]
    - [40, 7.494]
  - - [704, 1408, 1, 3328]
    - [40, 6.524]
  - - [704, 64, 1, 1280]
    - [14, 1.42]
  - - [3584, 448, 1, 256]
    - [40, 5.802]
  - - [3584, 3584, 1, 1280]
    - [40, 7.77]
  - - [256, 6784, 1, 256]
    - [37, 6.238]
  - - [1856, 3584, 1, 3328]
    - [40, 7.566]
  - - [128, 448, 1, 256]
    - [31, 1.26]
  - - [3584, 3584, 1, 256]
    - [37, 7.43]
  - - [6784, 4288, 1, 1280]
    - [37, 7.826]
  - - [448, 704, 1, 1280]
    - [19, 3.693]
  - - [3584, 5056, 1, 256]
    - [42, 7.464]
  - - [6784, 128, 1, 256]
    - [6, 5.389]
  - - [64, 1408, 1, 3328]
    - [11, 2.838]
  - - [704, 448, 1, 256]
    - [19, 3.072]
  - - [2944, 2368, 1, 1280]
    - [40, 7.57]
  - - [448, 64, 1, 3328]
    - [36, 1.041]
  - - [6784, 3584, 1, 256]
    - [38, 7.501]
  - - [256, 1856, 1, 3328]
    - [29, 5.685]
  - - [256, 704, 1, 256]
    - [19, 2.347]
  - - [128, 1408, 1, 256]
    - [5, 2.859]
  - - [64, 128, 1, 3328]
    - [34, 0.284]
  - - [1856, 1408, 1, 256]
    - [38, 6.857]
  - - [2944, 2944, 1, 3328]
    - [40, 7.576]
  - - [5056, 6784, 1, 256]
    - [38, 7.565]
  - - [1408, 4288, 1, 3328]
    - [40, 7.426]
  - - [6784, 256, 1, 1280]
    - [40, 6.816]
  - - [1024, 704, 1, 3328]
    - [19, 6.075]
  - - [2368, 704, 1, 3328]
    - [40, 6.641]
  - - [128, 4288, 1, 256]
    - [3, 4.534]
  - - [3584, 6784, 1, 256]
    - [37, 7.495]
  - - [128, 128, 1, 3328]
    - [14, 0.595]
  - - [5056, 1856, 1, 256]
    - [17, 7.371]
  - - [704, 4288, 1, 256]
    - [17, 6.703]
  - - [256, 448, 1, 3328]
    - [11, 3.363]
  - - [1408, 6784, 1, 1280]
    - [40, 7.614]
  - - [64, 2368, 1, 1280]
    - [11, 3.451]
  - - [64, 6784, 1, 3328]
    - [1, 5.165]
  - - [2944, 256, 1, 1280]
    - [40, 6.196]
  - - [5056, 2368, 1, 3328]
    - [40, 7.767]
  - - [2944, 4288, 1, 256]
    - [37, 7.307]
  - - [1408, 3584, 1, 1280]
    - [40, 7.339]
  - - [2368, 64, 1, 256]
    - [11, 2.575]
  - - [256, 256, 1, 256]
    - [12, 1.402]
  - - [704, 128, 1, 3328]
    - [11, 2.841]
  - - [1856, 704, 1, 256]
    - [16, 6.199]
  - - [2368, 6784, 1, 3328]
    - [40, 7.762]
  - - [5056, 704, 1, 1280]
    - [40, 7.3]
  - - [1856, 4288, 1, 3328]
    - [40, 7.615]
  - - [1408, 5888, 1, 256]
    - [38, 7.332]
  - - [704, 2944, 1, 1280]
    - [40, 7.18]
  - - [4288, 64, 1, 1280]
    - [25, 4.074]
  - - [704, 1856, 1, 256]
    - [37, 6.199]
  - - [3584, 704, 1, 1280]
    - [40, 7.118]
  - - [5888, 5056, 1, 256]
    - [39, 7.572]
  - - [3584, 448, 1, 3328]
    - [40, 6.401]
  - - [704, 2368, 1, 3328]
    - [40, 6.642]
  - - [2944, 448, 1, 256]
    - [40, 5.457]
  - - [448, 5056, 1, 3328]
    - [40, 7.137]
  - - [2368, 128, 1, 1280]
    - [5, 4.46]
  - - [4288, 448, 1, 256]
    - [20, 6.169]
  - - [64, 6784, 1, 256]
    - [1, 4.298]
  - - [64, 5056, 1, 1280]
    - [5, 4.739]
  - - [5888, 2368, 1, 256]
    - [42, 7.406]
  - - [704, 448, 1, 3328]
    - [19, 3.807]
  - - [6784, 704, 1, 3328]
    - [40, 7.373]
  - - [128, 64, 1, 1280]
    - [26, 0.254]
  - - [2368, 256, 1, 1280]
    - [19, 5.043]
  - - [1408, 2944, 1, 3328]
    - [40, 7.552]
  - - [64, 1024, 1, 256]
    - [12, 1.414]
  - - [2368, 448, 1, 1280]
    - [19, 5.678]
  - - [128, 3584, 1, 256]
    - [1, 4.45]
  - - [1856, 448, 1, 3328]
    - [19, 5.523]
  - - [128, 5056, 1, 256]
    - [6, 5.168]
  - - [4288, 4288, 1, 256]
    - [37, 7.396]
  - - [2368, 704, 1, 256]
    - [37, 6.006]
  - - [3584, 2368, 1, 256]
    - [37, 7.22]
  - - [5888, 5056, 1, 1280]
    - [42, 7.819]
  - - [128, 1024, 1, 1280]
    - [11, 3.544]
  - - [64, 704, 1, 256]
    - [9, 0.981]
  - - [4288, 256, 1, 1280]
    - [40, 5.849]
  - - [3584, 3584, 1, 3328]
    - [40, 7.832]
  - - [128, 1024, 1, 256]
    - [34, 2.473]
  - - [5888, 6784, 1, 256]
    - [38, 7.56]
  - - [4288, 2944, 1, 3328]
    - [40, 7.699]
  - - [1856, 64, 1, 256]
    - [11, 2.333]
  - - [4288, 128, 1, 3328]
    - [3, 5.312]
  - - [256, 5056, 1, 1280]
    - [40, 6.851]
  - - [6784, 5888, 1, 1280]
    - [40, 7.814]
  - - [704, 128, 1, 256]
    - [12, 1.77]
  - - [5888, 4288, 1, 1280]
    - [40, 7.771]
  - - [448, 256, 1, 1280]
    - [11, 3.158]
  - - [448, 2368, 1, 3328]
    - [40, 5.744]
  - - [1, 1, 1, 1280]
    - [48, 0.0]
  - - [256, 1408, 1, 1280]
    - [19, 4.216]
  - - [1408, 1856, 1, 1280]
    - [40, 7.362]
  - - [5888, 448, 1, 3328]
    - [40, 6.887]
  - - [704, 5888, 1, 1280]
    - [40, 7.466]
  - - [256, 64, 1, 3328]
    - [35, 0.594]
  - - [128, 2368, 1, 256]
    - [5, 3.595]
  - - [6784, 64, 1, 3328]
    - [24, 5.239]
  - - [5056, 2944, 1, 3328]
    - [40, 7.815]
  - - [448, 128, 1, 256]
    - [31, 1.272]
  - - [1856, 128, 1, 1280]
    - [32, 4.482]
  - - [448, 4288, 1, 1280]
    - [40, 6.678]
  - - [64, 3584, 1, 256]
    - [10, 3.351]
  - - [128, 2944, 1, 3328]
    - [23, 5.428]
  - - [3584, 704, 1, 256]
    - [42, 6.628]
  - - [2944, 448, 1, 3328]
    - [40, 6.061]
  - - [3584, 1408, 1, 3328]
    - [40, 7.412]
  - - [2368, 1024, 1, 1280]
    - [40, 6.834]
  - - [2944, 6784, 1, 1280]
    - [40, 7.724]
  - - [1856, 6784, 1, 256]
    - [37, 7.295]
  - - [4288, 448, 1, 3328]
    - [40, 6.764]
  - - [6784, 704, 1, 1280]
    - [40, 7.298]
  - - [5888, 1024, 1, 3328]
    - [40, 7.727]
  - - [704, 6784, 1, 1280]
    - [40, 7.296]
  - - [5888, 128, 1, 256]
    - [19, 5.406]
  - - [5056, 1024, 1, 3328]
    - [40, 7.602]
  - - [704, 5056, 1, 1280]
    - [40, 7.286]
  - - [64, 704, 1, 3328]
    - [14, 1.549]
  - - [2944, 1856, 1, 256]
    - [37, 7.169]
  - - [5056, 64, 1, 256]
    - [5, 3.782]
  - - [5888, 5056, 1, 3328]
    - [42, 7.86]
  - - [128, 5056, 1, 3328]
    - [6, 6.2]
  - - [3584, 6784, 1, 1280]
    - [37, 7.803]
  - - [1856, 5888, 1, 256]
    - [38, 7.421]
  - - [64, 448, 1, 3328]
    - [36, 1.044]
  - - [4288, 4288, 1, 3328]
    - [40, 7.766]
  - - [4288, 1408, 1, 1280]
    - [40, 7.364]
  - - [64, 1856, 1, 256]
    - [11, 2.277]
  - - [4288, 2368, 1, 256]
    - [37, 7.343]
  - - [2944, 5056, 1, 1280]
    - [37, 7.754]
  - - [256, 4288, 1, 1280]
    - [40, 5.847]
  - - [6784, 2368, 1, 3328]
    - [40, 7.764]
  - - [256, 1024, 1, 1280]
    - [19, 4.417]
  - - [4288, 128, 1, 256]
    - [3, 4.503]
  - - [4288, 1856, 1, 3328]
    - [40, 7.621]
  - - [1856, 2944, 1, 1280]
    - [40, 7.575]
  - - [3584, 64, 1, 1280]
    - [13, 4.313]
  - - [4288, 6784, 1, 3328]
    - [40, 7.883]
  - - [3584, 1024, 1, 1280]
    - [40, 7.515]
  - - [1024, 4288, 1, 256]
    - [37, 7.018]
  - - [5888, 3584, 1, 3328]
    - [40, 7.822]
  - - [5056, 3584, 1, 3328]
    - [40, 7.765]
  - - [1408, 128, 1, 3328]
    - [5, 4.149]
  - - [2368, 1408, 1, 1280]
    - [40, 7.33]
  - - [5056, 2944, 1, 1280]
    - [37, 7.755]
  - - [3584, 256, 1, 256]
    - [40, 5.297]
  - - [1024, 6784, 1, 256]
    - [37, 7.158]
  - - [2944, 5056, 1, 3328]
    - [40, 7.818]
  - - [3584, 2944, 1, 256]
    - [37, 7.276]
  - - [448, 128, 1, 3328]
    - [12, 1.95]
  - - [64, 2944, 1, 3328]
    - [22, 4.347]
  - - [64, 4288, 1, 3328]
    - [25, 4.263]
  - - [5056, 6784, 1, 3328]
    - [40, 7.881]
  - - [128, 2944, 1, 256]
    - [6, 4.238]
  - - [3584, 4288, 1, 256]
    - [37, 7.419]
  - - [1856, 6784, 1, 3328]
    - [40, 7.679]
  - - [3584, 128, 1, 3328]
    - [24, 5.506]
  - - [128, 256, 1, 1280]
    - [15, 1.096]
  - - [64, 448, 1, 256]
    - [15, 0.654]
  - - [64, 256, 1, 1280]
    - [14, 0.545]
  - - [5056, 1408, 1, 1280]
    - [42, 7.459]
  - - [5888, 5888, 1, 256]
    - [38, 7.538]
  - - [4288, 1024, 1, 1280]
    - [40, 7.47]
  - - [5888, 128, 1, 3328]
    - [0, 6.359]
  - - [448, 6784, 1, 3328]
    - [40, 7.3]
  - - [2944, 1408, 1, 1280]
    - [40, 7.471]
  - - [64, 128, 1, 1280]
    - [11, 0.253]
  - - [2944, 1856, 1, 3328]
    - [40, 7.652]
  - - [448, 5056, 1, 256]
    - [37, 6.554]
  - - [64, 64, 1, 256]
    - [2, 0.082]
  - - [3584, 5888, 1, 1280]
    - [37, 7.765]
  - - [6784, 1856, 1, 1280]
    - [37, 7.619]
  - - [5888, 256, 1, 3328]
    - [40, 6.912]
  - - [1856, 5888, 1, 3328]
    - [40, 7.758]
  - - [3584, 1408, 1, 256]
    - [42, 6.984]
  - - [704, 3584, 1, 3328]
    - [40, 7.204]
  - - [5056, 448, 1, 1280]
    - [40, 7.046]
  - - [3584, 1856, 1, 3328]
    - [40, 7.566]
  - - [1408, 704, 1, 1280]
    - [19, 6.401]
  - - [2944, 1024, 1, 256]
    - [42, 6.75]
  - - [448, 1408, 1, 1280]
    - [19, 5.262]
  - - [2368, 4288, 1, 3328]
    - [40, 7.754]
  - - [1024, 1408, 1, 1280]
    - [40, 6.515]
  - - [256, 128, 1, 1280]
    - [15, 1.084]
  - - [704, 1408, 1, 1280]
    - [19, 6.397]
  - - [6784, 5056, 1, 256]
    - [39, 7.549]
  - - [4288, 5888, 1, 256]
    - [38, 7.482]
  - - [448, 2944, 1, 256]
    - [37, 5.495]
  - - [2944, 6784, 1, 256]
    - [37, 7.409]
  - - [2368, 2368, 1, 1280]
    - [40, 7.429]
  - - [1856, 3584, 1, 1280]
    - [40, 7.497]
  - - [64, 2944, 1, 256]
    - [5, 2.97]
  - - [3584, 1408, 1, 1280]
    - [40, 7.338]
  - - [5056, 3584, 1, 1280]
    - [42, 7.715]
  - - [256, 5888, 1, 256]
    - [42, 6.173]
  - - [128, 256, 1, 3328]
    - [15, 1.195]
  - - [1856, 1408, 1, 3328]
    - [40, 7.461]
  - - [1024, 4288, 1, 3328]
    - [40, 7.545]
  - - [448, 2368, 1, 256]
    - [40, 5.134]
  - - [64, 1408, 1, 1280]
    - [11, 2.646]
  - - [64, 6784, 1, 1280]
    - [24, 5.099]
  - - [2944, 2368, 1, 3328]
    - [40, 7.644]
  - - [704, 4288, 1, 3328]
    - [40, 7.25]
  - - [1024, 1856, 1, 1280]
    - [40, 6.605]
  - - [6784, 1856, 1, 256]
    - [37, 7.292]
  - - [128, 2368, 1, 3328]
    - [5, 4.643]
  - - [1024, 5888, 1, 256]
    - [37, 7.226]
  - - [64, 2944, 1, 1280]
    - [22, 4.074]
  - - [5056, 64, 1, 3328]
    - [22, 4.938]
  - - [1408, 2368, 1, 256]
    - [37, 6.845]
  - - [2944, 704, 1, 3328]
    - [40, 7.295]
  - - [256, 64, 1, 256]
    - [14, 0.367]
  - - [2944, 2944, 1, 1280]
    - [42, 7.516]
  - - [6784, 256, 1, 3328]
    - [40, 6.919]
  - - [1408, 5056, 1, 256]
    - [42, 7.166]
  - - [5056, 128, 1, 3328]
    - [23, 6.187]
  - - [128, 128, 1, 1280]
    - [14, 0.545]
  - - [448, 704, 1, 256]
    - [40, 3.084]
  - - [1856, 256, 1, 3328]
    - [29, 5.612]
  - - [2944, 128, 1, 3328]
    - [23, 5.413]
  - - [704, 256, 1, 256]
    - [19, 2.399]
  - - [256, 448, 1, 1280]
    - [11, 3.151]
  - - [704, 256, 1, 1280]
    - [30, 3.067]
  - - [64, 2368, 1, 3328]
    - [34, 3.693]
  - - [256, 704, 1, 3328]
    - [29, 3.209]
  - - [1024, 1024, 1, 256]
    - [19, 5.953]
  - - [1408, 4288, 1, 256]
    - [42, 7.045]
  - - [5888, 2368, 1, 1280]
    - [42, 7.672]
  - - [128, 256, 1, 256]
    - [9, 0.714]
  - - [256, 64, 1, 1280]
    - [14, 0.544]
  - - [2368, 5888, 1, 1280]
    - [37, 7.663]
  - - [5888, 256, 1, 1280]
    - [40, 6.798]
  - - [704, 1024, 1, 1280]
    - [40, 5.931]
  - - [2368, 1856, 1, 3328]
    - [40, 7.558]
  - - [2944, 704, 1, 256]
    - [20, 6.656]
  - - [2368, 6784, 1, 1280]
    - [38, 7.707]
  - - [2368, 1024, 1, 3328]
    - [40, 6.925]
  - - [1856, 4288, 1, 1280]
    - [40, 7.55]
  - - [704, 3584, 1, 256]
    - [37, 6.614]
  - - [704, 2944, 1, 3328]
    - [40, 7.292]
  - - [1856, 5056, 1, 3328]
    - [40, 7.756]
  - - [3584, 5056, 1, 1280]
    - [42, 7.719]
  - - [2944, 1024, 1, 3328]
    - [40, 7.241]
  - - [256, 4288, 1, 256]
    - [40, 5.291]
  - - [2368, 256, 1, 256]
    - [40, 4.428]
  - - [1408, 6784, 1, 256]
    - [37, 7.265]
  - - [6784, 1408, 1, 3328]
    - [40, 7.685]
  - - [1024, 2368, 1, 1280]
    - [40, 6.844]
  - - [704, 64, 1, 256]
    - [11, 0.99]
  - - [256, 2368, 1, 3328]
    - [19, 5.178]
  - - [6784, 2944, 1, 1280]
    - [40, 7.726]
  - - [3584, 448, 1, 1280]
    - [40, 6.31]
  - - [2944, 6784, 1, 3328]
    - [40, 7.785]
  - - [448, 5056, 1, 1280]
    - [40, 7.044]
  - - [4288, 5056, 1, 1280]
    - [37, 7.788]
  - - [128, 448, 1, 1280]
    - [31, 1.812]
  - - [4288, 704, 1, 256]
    - [17, 6.715]
  - - [64, 64, 1, 1280]
    - [31, 0.134]
  - - [5888, 704, 1, 256]
    - [42, 7.088]
  - - [256, 5888, 1, 3328]
    - [40, 6.913]
  - - [6784, 4288, 1, 256]
    - [39, 7.533]
  - - [5888, 256, 1, 256]
    - [37, 6.152]
  - - [6784, 1024, 1, 1280]
    - [40, 7.545]
  - - [704, 448, 1, 1280]
    - [19, 3.7]
  - - [128, 64, 1, 3328]
    - [11, 0.284]
  - - [448, 64, 1, 256]
    - [34, 0.654]
  - - [2944, 704, 1, 1280]
    - [40, 7.186]
  - - [6784, 3584, 1, 1280]
    - [37, 7.801]
  - - [2944, 64, 1, 1280]
    - [5, 4.096]
  - - [1408, 2944, 1, 1280]
    - [40, 7.476]
  - - [256, 1856, 1, 256]
    - [40, 4.499]
  - - [1408, 2368, 1, 3328]
    - [40, 7.417]
  - - [128, 1408, 1, 3328]
    - [5, 4.164]
  - - [2368, 2944, 1, 256]
    - [37, 7.199]
  - - [64, 5056, 1, 256]
    - [5, 3.727]
  - - [1408, 256, 1, 3328]
    - [29, 4.324]
  - - [3584, 1856, 1, 256]
    - [42, 7.182]
  - - [4288, 3584, 1, 1280]
    - [37, 7.739]
  - - [2368, 448, 1, 256]
    - [19, 5.155]
  - - [4288, 256, 1, 3328]
    - [40, 5.941]
  - - [1408, 64, 1, 256]
    - [12, 1.799]
  - - [4288, 2944, 1, 1280]
    - [40, 7.641]
  - - [5056, 448, 1, 3328]
    - [40, 7.142]
  - - [1024, 64, 1, 256]
    - [12, 1.414]
  - - [64, 2368, 1, 256]
    - [11, 2.539]
  - - [4288, 5056, 1, 3328]
    - [40, 7.845]
  - - [2944, 256, 1, 256]
    - [16, 5.342]
  - - [1024, 128, 1, 3328]
    - [34, 3.801]
  - - [256, 5056, 1, 3328]
    - [40, 6.994]
  - - [5056, 2368, 1, 256]
    - [17, 7.423]
  - - [4288, 704, 1, 3328]
    - [40, 7.249]
  - - [448, 3584, 1, 256]
    - [37, 5.802]
  - - [2368, 64, 1, 1280]
    - [11, 3.451]
  - - [1024, 1408, 1, 3328]
    - [40, 6.617]
  - - [2944, 5888, 1, 1280]
    - [37, 7.694]
  - - [5888, 3584, 1, 256]
    - [38, 7.451]
  - - [1408, 1856, 1, 3328]
    - [40, 7.464]
  - - [6784, 1408, 1, 1280]
    - [40, 7.621]
  - - [704, 2944, 1, 256]
    - [20, 6.638]
  - - [4288, 64, 1, 256]
    - [4, 3.321]
  - - [2944, 5888, 1, 3328]
    - [40, 7.754]
  - - [64, 4288, 1, 1280]
    - [4, 4.104]
  - - [6784, 64, 1, 1280]
    - [1, 5.099]
  - - [704, 1856, 1, 1280]
    - [40, 6.935]
  - - [1408, 64, 1, 3328]
    - [11, 2.829]
  - - [1408, 1408, 1, 1280]
    - [40, 6.891]
  - - [448, 1024, 1, 3328]
    - [29, 5.445]
  - - [448, 4288, 1, 3328]
    - [40, 6.763]
  - - [704, 2368, 1, 256]
    - [37, 6.033]
  - - [2944, 448, 1, 1280]
    - [19, 5.987]
  - - [5888, 2368, 1, 3328]
    - [40, 7.723]
  - - [4288, 5056, 1, 256]
    - [37, 7.476]
  - - [4288, 448, 1, 1280]
    - [40, 6.67]
  - - [5888, 704, 1, 3328]
    - [40, 7.553]
  - - [4288, 3584, 1, 3328]
    - [40, 7.799]
  - - [2944, 64, 1, 256]
    - [5, 2.97]
  - - [1024, 6784, 1, 3328]
    - [40, 7.615]
  - - [1408, 1024, 1, 256]
    - [40, 5.935]
  - - [448, 1024, 1, 256]
    - [40, 4.396]
  - - [6784, 6784, 1, 3328]
    - [42, 7.888]
  - - [1024, 448, 1, 1280]
    - [29, 5.279]
  - - [704, 5056, 1, 3328]
    - [40, 7.377]
  - - [256, 2368, 1, 1280]
    - [19, 5.053]
  - - [3584, 5056, 1, 3328]
    - [42, 7.761]
  - - [2368, 2944, 1, 3328]
    - [40, 7.639]
  - - [448, 448, 1, 1280]
    - [27, 3.786]
  - - [2368, 3584, 1, 256]
    - [37, 7.231]
  - - [1024, 256, 1, 1280]
    - [40, 4.41]
  - - [128, 5056, 1, 1280]
    - [6, 6.056]
  - - [3584, 2368, 1, 1280]
    - [40, 7.581]
  - - [1856, 1856, 1, 256]
    - [42, 6.645]
  - - [4288, 1408, 1, 3328]
    - [40, 7.43]
  - - [3584, 64, 1, 3328]
    - [27, 4.542]
  - - [1, 1, 1, 1]
    - [46, 0.0]
  - - [256, 1024, 1, 3328]
    - [29, 4.649]
  - - [1856, 64, 1, 3328]
    - [11, 3.477]
  - - [5888, 1408, 1, 3328]
    - [40, 7.692]
  - - [256, 5056, 1, 256]
    - [37, 6.128]
  - - [1856, 64, 1, 1280]
    - [34, 3.263]
  - - [1408, 256, 1, 256]
    - [40, 3.496]
  - - [2368, 5056, 1, 256]
    - [17, 7.421]
  - - [128, 5888, 1, 3328]
    - [40, 6.342]
  - - [1024, 5056, 1, 256]
    - [42, 7.17]
  - - [2368, 1408, 1, 3328]
    - [40, 7.413]
  - - [5888, 448, 1, 256]
    - [37, 6.383]
  - - [6784, 5056, 1, 1280]
    - [40, 7.825]
  - - [4288, 6784, 1, 1280]
    - [37, 7.828]
  - - [2368, 448, 1, 3328]
    - [40, 5.743]
  - - [1024, 128, 1, 256]
    - [12, 2.512]
  - - [448, 128, 1, 1280]
    - [12, 1.822]
  - - [1024, 64, 1, 3328]
    - [31, 2.228]
  - - [64, 3584, 1, 1280]
    - [27, 4.307]
  - - [6784, 1408, 1, 256]
    - [37, 7.267]
  - - [5888, 4288, 1, 256]
    - [37, 7.464]
  - - [5056, 5888, 1, 256]
    - [38, 7.587]
  - - [2368, 1024, 1, 256]
    - [37, 6.384]
  - - [1856, 6784, 1, 1280]
    - [37, 7.613]
  - - [3584, 128, 1, 1280]
    - [24, 5.361]
  - - [128, 64, 1, 256]
    - [2, 0.162]
  - - [1408, 448, 1, 256]
    - [40, 4.566]
  - - [64, 256, 1, 3328]
    - [14, 0.595]
  - - [6784, 448, 1, 3328]
    - [40, 7.296]
  - - [5056, 1856, 1, 1280]
    - [40, 7.693]
  - - [1408, 1024, 1, 3328]
    - [40, 6.617]
  - - [2368, 256, 1, 3328]
    - [19, 5.177]
  - - [5888, 3584, 1, 1280]
    - [37, 7.764]
  - - [5888, 128, 1, 1280]
    - [19, 6.218]
  - - [1024, 2944, 1, 256]
    - [42, 6.712]
  - - [448, 6784, 1, 1280]
    - [40, 7.212]
  - - [256, 3584, 1, 1280]
    - [19, 5.963]
  - - [704, 5056, 1, 256]
    - [17, 6.86]
  - - [3584, 1024, 1, 3328]
    - [40, 7.604]
  - - [2944, 1856, 1, 1280]
    - [40, 7.573]
  - - [5056, 256, 1, 256]
    - [16, 6.165]
  - - [128, 5888, 1, 256]
    - [0, 5.39]
  - - [2368, 3584, 1, 3328]
    - [40, 7.641]
  - - [3584, 5888, 1, 3328]
    - [40, 7.82]
  - - [2944, 3584, 1, 1280]
    - [40, 7.609]
  - - [1856, 5888, 1, 1280]
    - [40, 7.688]
  - - [256, 256, 1, 1280]
    - [31, 2.055]
  - - [4288, 1408, 1, 256]
    - [38, 7.032]
  - - [3584, 64, 1, 256]
    - [21, 3.351]
  - - [64, 1856, 1, 3328]
    - [11, 3.474]
  - - [1408, 128, 1, 256]
    - [22, 2.878]
  - - [4288, 2368, 1, 1280]
    - [40, 7.686]
  - - [2944, 5056, 1, 256]
    - [37, 7.426]
  - - [256, 128, 1, 3328]
    - [15, 1.195]
  - - [6784, 2368, 1, 256]
    - [39, 7.448]
  - - [1408, 448, 1, 3328]
    - [19, 5.388]
  - - [4288, 1856, 1, 256]
    - [37, 7.198]
  - - [1856, 2944, 1, 256]
    - [37, 7.165]
  - - [64, 5888, 1, 1280]
    - [18, 4.993]
  - - [1856, 1408, 1, 1280]
    - [40, 7.352]
  - - [128, 704, 1, 256]
    - [8, 1.784]
  - - [1024, 4288, 1, 1280]
    - [40, 7.466]
  - - [2368, 5056, 1, 3328]
    - [40, 7.773]
  - - [4288, 1024, 1, 3328]
    - [40, 7.548]
  - - [1024, 5056, 1, 3328]
    - [40, 7.603]
  - - [1024, 1856, 1, 3328]
    - [40, 6.69]
  - - [704, 704, 1, 1280]
    - [19, 5.692]
  - - [128, 2368, 1, 1280]
    - [5, 4.46]
  - - [3584, 256, 1, 1280]
    - [19, 5.973]
  - - [5888, 64, 1, 1280]
    - [23, 5.224]
  - - [128, 704, 1, 3328]
    - [34, 2.829]
  - - [3584, 2944, 1, 3328]
    - [40, 7.671]
  - - [128, 1856, 1, 256]
    - [21, 3.408]
  - - [64, 4288, 1, 256]
    - [4, 3.304]
  - - [5888, 2944, 1, 256]
    - [37, 7.383]
  - - [5056, 128, 1, 1280]
    - [6, 6.052]
  - - [448, 1856, 1, 3328]
    - [19, 5.53]
  - - [5056, 4288, 1, 256]
    - [37, 7.473]
  - - [1024, 448, 1, 256]
    - [19, 4.379]
  - - [1024, 3584, 1, 256]
    - [42, 7.051]
  - - [2944, 128, 1, 1280]
    - [23, 5.237]
  - - [64, 256, 1, 256]
    - [8, 0.36]
  - - [704, 256, 1, 3328]
    - [30, 3.186]
  - - [5056, 1408, 1, 256]
    - [38, 7.163]
  - - [5888, 5888, 1, 1280]
    - [40, 7.794]
  - - [448, 5888, 1, 1280]
    - [40, 6.807]
  - - [1, 1, 1, 256]
    - [47, 0.0]
  - - [4288, 704, 1, 1280]
    - [40, 7.166]
  - - [2944, 1408, 1, 256]
    - [39, 7.053]
  - - [256, 2944, 1, 1280]
    - [40, 6.213]
  - - [2368, 5888, 1, 3328]
    - [40, 7.725]
  - - [704, 1024, 1, 3328]
    - [19, 6.081]
  - - [2368, 1856, 1, 1280]
    - [40, 7.472]
  - - [1856, 448, 1, 1280]
    - [19, 5.437]
  - - [128, 6784, 1, 256]
    - [6, 5.432]
  - - [5888, 4288, 1, 3328]
    - [40, 7.826]
  - - [1856, 128, 1, 256]
    - [3, 3.492]
  - - [5056, 448, 1, 256]
    - [37, 6.538]
  - - [1856, 5056, 1, 1280]
    - [40, 7.688]
  - - [2944, 1024, 1, 1280]
    - [40, 7.157]
  - - [2368, 4288, 1, 256]
    - [37, 7.34]
  - - [1024, 2368, 1, 3328]
    - [40, 6.927]
  - - [4288, 64, 1, 3328]
    - [25, 4.235]
  - - [704, 1408, 1, 256]
    - [40, 5.695]
  - - [4288, 5888, 1, 3328]
    - [40, 7.824]
  - - [448, 2944, 1, 1280]
    - [40, 5.964]
  - - [1024, 2944, 1, 3328]
    - [40, 7.241]
  - - [256, 6784, 1, 1280]
    - [40, 6.814]
  - - [1856, 3584, 1, 256]
    - [38, 7.178]
  - - [128, 448, 1, 3328]
    - [8, 1.954]
  - - [1856, 256, 1, 256]
    - [19, 4.517]
  - - [5056, 128, 1, 256]
    - [6, 5.203]
  - - [256, 5888, 1, 1280]
    - [40, 6.803]
  - - [6784, 128, 1, 1280]
    - [23, 6.097]
  - - [64, 1408, 1, 256]
    - [11, 1.83]
  - - [2944, 2368, 1, 256]
    - [37, 7.196]
  - - [1856, 448, 1, 256]
    - [40, 4.859]
  - - [1024, 1856, 1, 256]
    - [20, 6.112]
  - - [6784, 3584, 1, 3328]
    - [40, 7.853]
  - - [2944, 64, 1, 3328]
    - [5, 4.34]
  - - [1024, 5888, 1, 3328]
    - [40, 7.73]
  - - [1408, 2368, 1, 1280]
    - [40, 7.334]
  - - [128, 1408, 1, 1280]
    - [5, 3.925]
  - - [128, 1856, 1, 3328]
    - [32, 4.71]
  - - [2944, 2944, 1, 256]
    - [38, 7.232]
  - - [6784, 256, 1, 256]
    - [37, 6.219]
  - - [128, 4288, 1, 1280]
    - [3, 5.222]
  - - [5888, 1408, 1, 256]
    - [42, 7.321]
  - - [128, 128, 1, 256]
    - [7, 0.37]
  - - [448, 704, 1, 3328]
    - [19, 3.8]
  - - [448, 1856, 1, 256]
    - [37, 4.823]
  - - [1856, 704, 1, 3328]
    - [40, 7.06]
  - - [5888, 6784, 1, 3328]
    - [40, 7.867]
  - - [704, 4288, 1, 1280]
    - [40, 7.166]
  - - [4096, 7000, 1, 4096]
    - [72, 12.773]
  - - [5124, 9124, 1, 1760]
    - [71, 13.175]
  - - [1760, 32, 1, 1760]
    - [53, 1.546]
  - - [1024, 1500, 1, 1536]
    - [65, 10.666]
  - - [512, 24000, 1, 2048]
    - [74, 11.656]
  - - [3072, 24000, 1, 1024]
    - [72, 13.246]
  - - [1024, 3000, 1, 2560]
    - [72, 12.434]
  - - [512, 3136, 1, 2048]
    - [82, 9.51]
  - - [7680, 4, 1, 2560]
    - [53, 0.845]
  - - [64, 193600, 1, 64]
    - [71, 10.056]
  - - [8448, 1500, 1, 2816]
    - [71, 12.603]
  - - [2560, 7000, 1, 2560]
    - [71, 12.934]
  - - [3072, 16, 1, 1024]
    - [49, 1.27]
  - - [512, 48000, 1, 2048]
    - [74, 11.976]
  - - [1760, 64, 1, 1760]
    - [67, 3.113]
  - - [1024, 16, 1, 512]
    - [51, 0.33]
  - - [196, 256, 64, 1024]
    - [283, 29.477]
  - - [512, 48000, 1, 1536]
    - [72, 13.24]
  - - [2560, 32, 1, 2560]
    - [53, 2.274]
  - - [4608, 1500, 1, 1536]
    - [72, 12.359]
  - - [2048, 128, 1, 2048]
    - [69, 6.344]
  - - [1024, 24000, 1, 2560]
    - [71, 13.286]
  - - [4608, 3000, 1, 1536]
    - [72, 12.652]
  - - [5124, 9124, 1, 2048]
    - [72, 12.228]
  - - [2048, 16, 1, 2048]
    - [52, 0.912]
  - - [1024, 700, 1, 512]
    - [64, 7.038]
  - - [3072, 1, 1, 128]
    - [49, 0.043]
  - - [5124, 700, 1, 2560]
    - [72, 11.017]
  - - [8448, 16, 1, 2816]
    - [50, 3.503]
  - - [6144, 6000, 1, 2560]
    - [66, 12.359]
  - - [4608, 32, 1, 1536]
    - [49, 3.84]
  - - [3072, 64, 1, 1024]
    - [62, 4.794]
  - - [512, 16, 1, 512]
    - [51, 0.165]
  - - [7680, 2, 1, 2560]
    - [53, 0.424]
  - - [4224, 1, 1, 128]
    - [49, 0.059]
  - - [7680, 1, 1, 2560]
    - [53, 0.212]
  - - [128, 1500, 1, 1280]
    - [49, 4.893]
  - - [1024, 1500, 1, 2816]
    - [65, 10.873]
  - - [6144, 2, 1, 2560]
    - [53, 0.337]
  - - [8448, 48000, 1, 2816]
    - [72, 11.618]
  - - [512, 6000, 1, 2048]
    - [75, 9.075]
  - - [4224, 1500, 1, 176]
    - [59, 10.499]
  - - [1024, 6000, 1, 2816]
    - [71, 13.17]
  - - [1024, 48000, 1, 1536]
    - [72, 13.536]
  - - [1024, 48000, 1, 2560]
    - [71, 13.667]
  - - [4096, 32, 1, 4096]
    - [54, 3.615]
  - - [512, 16, 1, 500000]
    - [51, 0.248]
  - - [2560, 128, 1, 2560]
    - [67, 6.493]
  - - [4608, 24000, 1, 1536]
    - [71, 13.7]
  - - [512, 2, 1, 500000]
    - [51, 0.031]
  - - [7680, 48000, 1, 2560]
    - [72, 11.713]
  - - [3072, 48000, 1, 1024]
    - [72, 13.466]
  - - [1760, 16, 1, 1760]
    - [49, 0.776]
  - - [1024, 1500, 1, 2048]
    - [68, 8.337]
  - - [1024, 16, 1, 500000]
    - [51, 0.495]
  - - [64, 193600, 1, 256]
    - [76, 11.737]
  - - [1024, 3000, 1, 2048]
    - [73, 9.114]
  - - [6144, 4, 1, 2560]
    - [53, 0.678]
  - - [1024, 6000, 1, 2048]
    - [74, 10.898]
  - - [512, 24000, 1, 2816]
    - [71, 13.314]
  - - [6144, 48000, 1, 2560]
    - [74, 10.807]
  - - [1760, 7000, 1, 1760]
    - [60, 12.493]
  - - [8448, 3000, 1, 2816]
    - [71, 13.199]
  - - [3072, 4, 1, 1024]
    - [49, 0.317]
  - - [4608, 48000, 1, 1536]
    - [71, 13.803]
  - - [2048, 32, 1, 2048]
    - [70, 1.802]
  - - [7680, 1500, 1, 2560]
    - [72, 12.174]
  - - [4096, 128, 1, 4096]
    - [63, 8.618]
  - - [4608, 16, 1, 1536]
    - [53, 1.988]
  - - [512, 3000, 1, 1536]
    - [65, 10.677]
  - - [3072, 2, 1, 1024]
    - [49, 0.161]
  - - [8448, 1, 1, 2816]
    - [50, 0.217]
  - - [1024, 3000, 1, 2816]
    - [71, 12.729]
  - - [128, 1, 1, 1408]
    - [49, 0.004]
  - - [64, 1, 1, 1216]
    - [51, 0.002]
  - - [1024, 2, 1, 512]
    - [51, 0.041]
  - - [1024, 4, 1, 500000]
    - [51, 0.124]
  - - [6144, 1, 1, 2560]
    - [53, 0.17]
  - - [5124, 9124, 1, 2560]
    - [72, 12.812]
  - - [512, 48000, 1, 2816]
    - [71, 13.521]
  - - [512, 3000, 1, 2816]
    - [65, 10.878]
  - - [1024, 24000, 1, 1536]
    - [72, 13.198]
  - - [7680, 6000, 1, 2560]
    - [71, 13.271]
  - - [1760, 128, 1, 1760]
    - [69, 5.613]
  - - [512, 1500, 1, 2816]
    - [64, 8.44]
  - - [512, 1, 1, 512]
    - [55, 0.012]
  - - [512, 6000, 1, 2560]
    - [72, 12.47]
  - - [512, 8, 1, 500000]
    - [51, 0.124]
  - - [512, 24000, 1, 2560]
    - [72, 13.148]
  - - [6144, 3000, 1, 2560]
    - [74, 12.058]
  - - [1024, 24000, 1, 2816]
    - [71, 13.579]
  - - [2048, 7000, 1, 2048]
    - [74, 11.849]
  - - [7680, 3000, 1, 2560]
    - [66, 12.113]
  - - [1024, 4, 1, 512]
    - [51, 0.083]
  - - [5124, 700, 1, 2048]
    - [74, 9.788]
  - - [5124, 9124, 1, 4096]
    - [66, 11.835]
  - - [4096, 64, 1, 4096]
    - [70, 6.296]
  - - [256, 193600, 1, 64]
    - [57, 10.826]
  - - [7680, 32, 1, 2560]
    - [56, 6.365]
  - - [2560, 64, 1, 2560]
    - [62, 4.4]
  - - [3072, 128, 1, 1024]
    - [67, 7.123]
  - - [8448, 6000, 1, 2816]
    - [72, 13.321]
  - - [7680, 64, 1, 2560]
    - [51, 8.357]
  - - [5124, 1500, 1, 2560]
    - [72, 12.081]
  - - [1024, 1500, 1, 2560]
    - [65, 10.817]
  - - [512, 4, 1, 512]
    - [55, 0.048]
  - - [1024, 6000, 1, 2560]
    - [72, 12.881]
  - - [3072, 32, 1, 1024]
    - [70, 2.519]
  - - [6144, 32, 1, 2560]
    - [62, 5.153]
  - - [196, 1024, 64, 256]
    - [282, 28.258]
  - - [512, 50176, 1, 128]
    - [78, 11.895]
  - - [4608, 1, 1, 1536]
    - [53, 0.124]
  - - [1024, 32, 1, 512]
    - [51, 0.68]
  - - [7680, 24000, 1, 2560]
    - [72, 12.896]
  - - [8448, 4, 1, 2816]
    - [53, 0.865]
  - - [512, 1, 1, 500000]
    - [51, 0.015]
  - - [176, 1500, 1, 1408]
    - [51, 5.049]
  - - [512, 3000, 1, 2560]
    - [65, 10.833]
  - - [8448, 24000, 1, 2816]
    - [72, 10.875]
  - - [4608, 2, 1, 1536]
    - [53, 0.247]
  - - [512, 6000, 1, 1536]
    - [72, 12.29]
  - - [7680, 128, 1, 2560]
    - [58, 10.352]
  - - [3072, 6000, 1, 1024]
    - [72, 12.559]
  - - [3072, 1500, 1, 128]
    - [71, 9.65]
  - - [2048, 3136, 1, 512]
    - [80, 11.759]
  - - [1024, 3000, 1, 1536]
    - [72, 12.253]
  - - [512, 4, 1, 500000]
    - [51, 0.062]
  - - [512, 6000, 1, 2816]
    - [72, 12.517]
  - - [128, 50176, 1, 512]
    - [77, 11.932]
  - - [256, 12544, 1, 1024]
    - [81, 10.481]
  - - [1024, 12544, 1, 256]
    - [79, 12.265]
  - - [512, 48000, 1, 2560]
    - [72, 13.287]
  - - [2560, 16, 1, 2560]
    - [49, 1.149]
  - - [2048, 64, 1, 2048]
    - [70, 3.533]
  - - [512, 2, 1, 512]
    - [55, 0.024]
  - - [1024, 1, 1, 512]
    - [51, 0.021]
  - - [512, 1500, 1, 2560]
    - [64, 8.273]
  - - [512, 24000, 1, 1536]
    - [72, 13.079]
  - - [1024, 1, 1, 500000]
    - [51, 0.031]
  - - [6144, 16, 1, 2560]
    - [53, 2.707]
  - - [1024, 24000, 1, 2048]
    - [74, 11.97]
  - - [4096, 16, 1, 4096]
    - [54, 1.878]
  - - [512, 32, 1, 512]
    - [51, 0.341]
  - - [5124, 1500, 1, 2048]
    - [74, 10.763]
  - - [3072, 1500, 1, 1024]
    - [65, 10.993]
  - - [1024, 2, 1, 500000]
    - [51, 0.062]
  - - [1024, 8, 1, 500000]
    - [51, 0.247]
  - - [7680, 16, 1, 2560]
    - [53, 3.38]
  - - [6144, 1500, 1, 2560]
    - [72, 12.713]
  - - [3072, 1, 1, 1024]
    - [49, 0.08]
  - - [1024, 48000, 1, 2816]
    - [71, 13.914]
  - - [8448, 2, 1, 2816]
    - [53, 0.434]
  - - [4608, 4, 1, 1536]
    - [53, 0.493]
  - - [1024, 6000, 1, 1536]
    - [72, 12.801]
  - - [8448, 32, 1, 2816]
    - [51, 5.401]
  - - [512, 3000, 1, 2048]
    - [74, 8.347]
  - - [6144, 24000, 1, 2560]
    - [74, 11.945]
  - - [4608, 6000, 1, 1536]
    - [72, 13.229]
  - - [1024, 1024, 1, 1024]
    - [314, 36.276]
  - - [512, 1500, 1, 2048]
    - [74, 6.937]
  - - [512, 1500, 1, 1536]
    - [64, 8.099]
  - - [128, 1, 1, 1024]
    - [49, 0.003]
  - - [3072, 3000, 1, 1024]
    - [74, 11.785]
  - - [1024, 48000, 1, 2048]
    - [72, 12.578]
  - - [3136, 64, 128, 64]
    - [111, 11.398]
  - - [784, 512, 64, 128]
    - [280, 28.207]
  - - [3136, 256, 64, 64]
    - [278, 24.639]
  - - [12544, 1024, 1, 256]
    - [107, 15.558]
  - - [784, 128, 128, 512]
    - [106, 14.852]
  - - [784, 512, 256, 128]
    - [110, 13.829]
  - - [3136, 64, 64, 256]
    - [266, 29.448]
  - - [3136, 512, 1, 2048]
    - [109, 11.648]
  - - [12544, 256, 1, 1024]
    - [112, 13.213]
  - - [3136, 2048, 1, 512]
    - [105, 14.598]
  - - [3136, 256, 256, 64]
    - [113, 13.548]
  - - [3136, 64, 128, 256]
    - [105, 14.906]
  - - [784, 128, 64, 512]
    - [281, 37.166]
  - - [3136, 64, 256, 64]
    - [111, 11.552]
  - - [784, 512, 128, 128]
    - [104, 14.327]
  - - [3136, 64, 64, 64]
    - [279, 18.145]
  - - [784, 128, 256, 512]
    - [106, 15.098]
  - - [3136, 64, 256, 256]
    - [108, 15.01]
  - - [3136, 256, 128, 64]
    - [103, 13.708]
  - - [64, 14, 1, 14]
    - [128, 0.001]
  - - [64, 14, 1, 15]
    - [128, 0.001]
  - - [64, 15, 1, 15]
    - [127, 0.001]
  - - [64, 15, 1, 15]
    - [127, 0.001]
  - - [64, 15, 1, 17]
    - [127, 0.001]
  - - [64, 17, 1, 17]
    - [127, 0.001]
  - - [64, 17, 1, 17]
    - [127, 0.001]
  - - [64, 17, 1, 21]
    - [128, 0.002]
  - - [64, 21, 1, 21]
    - [128, 0.003]
  - - [64, 24, 1, 24]
    - [128, 0.004]
  - - [64, 24, 1, 34]
    - [128, 0.004]
  - - [64, 30, 1, 30]
    - [128, 0.005]
  - - [64, 31, 1, 30]
    - [134, 0.006]
  - - [64, 31, 1, 31]
    - [136, 0.006]
  - - [64, 32, 1, 32]
    - [130, 0.007]
  - - [64, 34, 1, 34]
    - [133, 0.007]
  - - [64, 35, 1, 32]
    - [132, 0.007]
  - - [64, 35, 1, 35]
    - [128, 0.007]
  - - [64, 128, 512, 128]
    - [379, 15.225]
  - - [64, 512, 1, 512]
    - [406, 2.243]
  - - [64, 512, 64, 512]
    - [342, 22.28]
  - - [128, 128, 512, 64]
    - [385, 15.603]
  - - [512, 512, 1, 64]
    - [407, 2.962]
  - - [512, 512, 64, 64]
    - [387, 22.133]
  - - [1024, 4, 1, 2]
    - [332, 0.001]
  - - [1024, 4, 1, 1024]
    - [349, 0.374]
  - - [1024, 32, 1, 2]
    - [386, 0.013]
  - - [1024, 32, 1, 1024]
    - [319, 3.204]
  - - [1024, 2048, 1, 2]
    - [352, 0.314]
  - - [1024, 2048, 1, 1024]
    - [353, 37.847]
  - - [1024, 2048, 1, 4096]
    - [309, 46.387]
  - - [1024, 2048, 1, 30528]
    - [388, 50.847]
  - - [1024, 4096, 1, 1024]
    - [326, 44.96]
  - - [1024, 4096, 1, 4096]
    - [327, 47.107]
  - - [1024, 4096, 1, 30528]
    - [374, 51.04]
  - - [4096, 2048, 1, 1024]
    - [354, 55.097]
  - - [4096, 4096, 1, 1024]
    - [329, 66.381]
  - - [32, 33, 1600, 33]
    - [413, 2.054]
  - - [32, 200, 1, 1]
    - [332, 0.001]
  - - [64, 3, 512, 3]
    - [414, 0.031]
  - - [64, 5, 512, 5]
    - [415, 0.086]
  - - [64, 5, 960, 5]
    - [389, 0.119]
  - - [64, 9, 512, 9]
    - [364, 0.256]
  - - [64, 512, 1, 1]
    - [345, 0.007]
  - - [67, 512, 1, 2048]
    - [333, 3.937]
  - - [74, 512, 1, 2048]
    - [349, 4.482]
  - - [74, 960, 1, 2048]
    - [416, 6.808]
  - - [100, 512, 1, 2048]
    - [417, 5.911]
  - - [128, 27, 32768, 27]
    - [402, 3.451]
  - - [256, 1024, 1, 1]
    - [418, 0.042]
  - - [256, 8976, 1, 1536]
    - [419, 41.031]
  - - [256, 8976, 1, 2048]
    - [420, 43.691]
  - - [256, 8976, 1, 2304]
    - [421, 45.041]
  - - [256, 8976, 1, 2560]
    - [422, 46.106]
  - - [256, 8976, 1, 2816]
    - [422, 46.725]
  - - [256, 8976, 1, 3072]
    - [422, 47.355]
  - - [256, 8976, 1, 4352]
    - [423, 49.7]
  - - [256, 8976, 1, 4864]
    - [422, 50.384]
  - - [256, 8976, 1, 5376]
    - [424, 50.704]
  - - [256, 8976, 1, 5632]
    - [425, 50.759]
  - - [256, 8976, 1, 5888]
    - [425, 50.891]
  - - [256, 8976, 1, 6144]
    - [425, 51.309]
  - - [256, 8976, 1, 6656]
    - [421, 51.56]
  - - [256, 8976, 1, 7168]
    - [423, 51.865]
  - - [256, 8976, 1, 7424]
    - [422, 52.121]
  - - [256, 8976, 1, 8192]
    - [423, 52.104]
  - - [256, 8976, 1, 8448]
    - [426, 52.565]
  - - [256, 8976, 1, 8960]
    - [427, 52.601]
  - - [256, 8976, 1, 9472]
    - [421, 52.783]
  - - [256, 8976, 1, 9728]
    - [428, 53.068]
  - - [256, 8976, 1, 9984]
    - [424, 52.816]
  - - [256, 8976, 1, 10240]
    - [422, 53.048]
  - - [256, 8976, 1, 10496]
    - [421, 53.083]
  - - [256, 8976, 1, 11008]
    - [425, 53.291]
  - - [256, 8976, 1, 11520]
    - [424, 53.24]
  - - [256, 8976, 1, 12288]
    - [420, 53.588]
  - - [256, 8976, 1, 14336]
    - [424, 53.754]
  - - [256, 8976, 1, 14848]
    - [422, 53.771]
  - - [256, 8976, 1, 15104]
    - [420, 53.721]
  - - [256, 8976, 1, 15872]
    - [424, 54.031]
  - - [256, 8976, 1, 17152]
    - [421, 53.814]
  - - [256, 8976, 1, 19712]
    - [429, 54.213]
  - - [256, 8976, 1, 19968]
    - [374, 54.175]
  - - [256, 8976, 1, 20480]
    - [425, 54.331]
  - - [256, 8976, 1, 20992]
    - [388, 54.355]
  - - [256, 8976, 1, 22016]
    - [430, 54.399]
  - - [256, 8976, 1, 26112]
    - [425, 54.606]
  - - [256, 8976, 1, 33536]
    - [343, 54.725]
  - - [256, 8976, 1, 44505]
    - [427, 55.327]
  - - [256, 32768, 1, 128]
    - [382, 28.547]
  - - [257, 1024, 1, 4096]
    - [431, 16.647]
  - - [480, 32768, 1, 1024]
    - [309, 57.617]
  - - [512, 200, 1, 1]
    - [432, 0.017]
  - - [512, 200, 1, 32]
    - [418, 0.59]
  - - [512, 215, 1, 2048]
    - [433, 11.466]
  - - [512, 256, 1, 2048]
    - [434, 13.153]
  - - [512, 1600, 1, 32]
    - [412, 4.81]
  - - [512, 1600, 1, 512]
    - [411, 25.824]
  - - [512, 32768, 1, 256]
    - [384, 42.805]
  - - [560, 200, 1, 1024]
    - [435, 8.07]
  - - [560, 1600, 1, 1024]
    - [322, 33.938]
  - - [768, 215, 1, 2048]
    - [436, 14.32]
  - - [768, 256, 1, 2048]
    - [437, 17.051]
  - - [1024, 200, 1, 1]
    - [432, 0.034]
  - - [1024, 512, 1, 1]
    - [438, 0.078]
  - - [1024, 512, 1, 64]
    - [409, 5.322]
  - - [1024, 512, 1, 1024]
    - [322, 25.765]
  - - [1024, 960, 1, 64]
    - [439, 9.813]
  - - [1024, 960, 1, 1024]
    - [310, 38.928]
  - - [1024, 1600, 1, 1]
    - [337, 0.176]
  - - [1024, 1600, 1, 1024]
    - [393, 39.951]
  - - [1024, 1792, 1, 256]
    - [393, 29.114]
  - - [1024, 2048, 1, 256]
    - [440, 27.758]
  - - [1024, 2560, 1, 256]
    - [441, 30.194]
  - - [1024, 3072, 1, 256]
    - [442, 34.256]
  - - [1024, 3328, 1, 256]
    - [443, 35.652]
  - - [1024, 3840, 1, 256]
    - [444, 37.986]
  - - [1024, 4096, 1, 256]
    - [360, 33.273]
  - - [1024, 4608, 1, 256]
    - [445, 34.676]
  - - [1024, 4864, 1, 256]
    - [446, 36.491]
  - - [1024, 5120, 1, 256]
    - [447, 37.494]
  - - [1024, 5632, 1, 256]
    - [448, 36.264]
  - - [1024, 6144, 1, 256]
    - [385, 36.319]
  - - [1024, 6400, 1, 256]
    - [449, 37.117]
  - - [1024, 7168, 1, 256]
    - [447, 39.164]
  - - [1024, 7424, 1, 256]
    - [304, 39.941]
  - - [1024, 7680, 1, 256]
    - [450, 40.431]
  - - [1024, 7936, 1, 256]
    - [385, 38.476]
  - - [1024, 8192, 1, 256]
    - [385, 38.426]
  - - [1024, 8448, 1, 256]
    - [385, 39.551]
  - - [1024, 8704, 1, 256]
    - [451, 40.062]
  - - [1024, 8960, 1, 256]
    - [452, 39.748]
  - - [1024, 9728, 1, 256]
    - [384, 39.381]
  - - [1024, 9984, 1, 256]
    - [446, 39.633]
  - - [1024, 10240, 1, 256]
    - [360, 40.715]
  - - [1024, 10496, 1, 256]
    - [447, 40.743]
  - - [1024, 11008, 1, 256]
    - [391, 42.394]
  - - [1024, 11264, 1, 256]
    - [453, 42.188]
  - - [1024, 11520, 1, 256]
    - [395, 42.691]
  - - [1024, 12288, 1, 256]
    - [451, 41.695]
  - - [1024, 13312, 1, 256]
    - [454, 41.079]
  - - [1024, 13568, 1, 256]
    - [327, 41.711]
  - - [1024, 14336, 1, 256]
    - [391, 43.047]
  - - [1024, 14592, 1, 256]
    - [309, 43.286]
  - - [1024, 14848, 1, 256]
    - [309, 43.834]
  - - [1024, 15104, 1, 256]
    - [455, 43.85]
  - - [1024, 16128, 1, 256]
    - [447, 42.271]
  - - [1024, 17152, 1, 256]
    - [327, 42.937]
  - - [1024, 18944, 1, 256]
    - [309, 45.607]
  - - [1024, 19712, 1, 256]
    - [447, 42.947]
  - - [1024, 19968, 1, 256]
    - [451, 43.16]
  - - [1024, 20480, 1, 256]
    - [456, 43.349]
  - - [1024, 20992, 1, 256]
    - [308, 44.091]
  - - [1024, 21504, 1, 256]
    - [308, 44.898]
  - - [1024, 22016, 1, 256]
    - [309, 45.694]
  - - [1024, 23552, 1, 256]
    - [457, 43.706]
  - - [1024, 28672, 1, 256]
    - [308, 46.155]
  - - [1024, 32768, 1, 512]
    - [309, 61.061]
  - - [1024, 32768, 1, 1024]
    - [309, 72.161]
  - - [1024, 33536, 1, 256]
    - [308, 48.056]
  - - [1024, 40448, 1, 256]
    - [458, 48.146]
  - - [1600, 512, 1, 1024]
    - [459, 34.281]
  - - [2048, 512, 1, 1]
    - [460, 0.121]
  - - [2048, 512, 1, 2048]
    - [410, 33.833]
  - - [2048, 960, 1, 2048]
    - [461, 42.626]
  - - [2048, 1024, 1, 1]
    - [337, 0.161]
  - - [2048, 1024, 1, 256]
    - [451, 27.606]
  - - [3200, 1024, 1, 2048]
    - [368, 62.74]
  - - [4096, 1024, 1, 1]
    - [358, 0.212]
  - - [64, 14, 10880, 14]
    - [402, 1.051]
  - - [64, 14, 10880, 15]
    - [402, 1.121]
  - - [64, 15, 7680, 15]
    - [402, 1.151]
  - - [64, 15, 10880, 15]
    - [402, 1.191]
  - - [64, 15, 7680, 17]
    - [402, 1.216]
  - - [64, 17, 6144, 17]
    - [402, 1.333]
  - - [64, 17, 7680, 17]
    - [402, 1.355]
  - - [64, 17, 6144, 21]
    - [402, 1.589]
  - - [64, 21, 6144, 21]
    - [402, 1.937]
  - - [64, 24, 4736, 24]
    - [402, 2.45]
  - - [64, 24, 4736, 34]
    - [402, 3.014]
  - - [64, 30, 2048, 30]
    - [402, 3.154]
  - - [64, 31, 2048, 30]
    - [402, 3.213]
  - - [64, 31, 2048, 31]
    - [402, 3.302]
  - - [64, 32, 4608, 32]
    - [403, 6.826]
  - - [64, 34, 4736, 34]
    - [389, 3.174]
  - - [64, 35, 4608, 32]
    - [404, 4.914]
  - - [64, 35, 4608, 35]
    - [405, 3.113]
  - - [1024, 3840, 1, 1024]
    - [309, 64.523]
  - - [1024, 3840, 1, 4096]
    - [309, 77.895]
  - - [1024, 3968, 1, 1024]
    - [393, 44.551]
  - - [1024, 3968, 1, 4096]
    - [394, 46.368]
  - - [1024, 3968, 1, 42720]
    - [374, 49.636]
  - - [1024, 6528, 1, 1024]
    - [309, 61.892]
  - - [1024, 6528, 1, 4096]
    - [309, 72.732]
  - - [1024, 6528, 1, 42720]
    - [374, 80.748]
  - - [1024, 7104, 1, 1024]
    - [395, 58.434]
  - - [1024, 7104, 1, 4096]
    - [392, 76.083]
  - - [1024, 7104, 1, 42720]
    - [374, 86.02]
  - - [1024, 7200, 1, 1024]
    - [396, 59.124]
  - - [1024, 7200, 1, 4096]
    - [309, 74.099]
  - - [1024, 7200, 1, 42720]
    - [388, 84.206]
  - - [1024, 8064, 1, 1024]
    - [309, 53.18]
  - - [1024, 8064, 1, 4096]
    - [359, 62.064]
  - - [1024, 8160, 1, 1024]
    - [397, 49.185]
  - - [1024, 8160, 1, 4096]
    - [375, 61.102]
  - - [1024, 9216, 1, 1024]
    - [359, 59.302]
  - - [1024, 9216, 1, 4096]
    - [359, 70.296]
  - - [1024, 9520, 1, 1024]
    - [354, 56.652]
  - - [1024, 9520, 1, 4096]
    - [392, 70.852]
  - - [1024, 9520, 1, 42720]
    - [374, 78.547]
  - - [1024, 10064, 1, 1024]
    - [391, 58.819]
  - - [1024, 10064, 1, 4096]
    - [309, 73.893]
  - - [1024, 10080, 1, 1024]
    - [391, 59.266]
  - - [1024, 10080, 1, 4096]
    - [309, 73.913]
  - - [1024, 10080, 1, 42720]
    - [374, 82.946]
  - - [1024, 10200, 1, 1024]
    - [392, 59.331]
  - - [1024, 10200, 1, 4096]
    - [309, 74.64]
  - - [4096, 3840, 1, 1024]
    - [399, 66.224]
  - - [4096, 3968, 1, 1024]
    - [348, 64.546]
  - - [4096, 6528, 1, 1024]
    - [400, 68.512]
  - - [4096, 7104, 1, 1024]
    - [329, 69.468]
  - - [4096, 7200, 1, 1024]
    - [348, 68.662]
  - - [4096, 8064, 1, 1024]
    - [390, 71.905]
  - - [4096, 8160, 1, 1024]
    - [369, 70.179]
  - - [4096, 9216, 1, 1024]
    - [401, 70.337]
  - - [4096, 9520, 1, 1024]
    - [348, 69.059]
  - - [4096, 10064, 1, 1024]
    - [398, 69.892]
  - - [4096, 10080, 1, 1024]
    - [369, 69.134]
  - - [4096, 10200, 1, 1024]
    - [303, 69.017]
  - - [64, 27, 1920, 27]
    - [216, 2.194]
  - - [64, 33, 1920, 27]
    - [208, 2.334]
  - - [64, 33, 1920, 33]
    - [211, 2.746]
  - - [1024, 3240, 1, 1024]
    - [242, 46.687]
  - - [1024, 3240, 1, 4096]
    - [226, 61.646]
  - - [1024, 3960, 1, 1024]
    - [206, 40.819]
  - - [1024, 3960, 1, 4096]
    - [191, 42.95]
  - - [1024, 3960, 1, 42720]
    - [224, 48.607]
  - - [4096, 3240, 1, 1024]
    - [249, 57.754]
  - - [4096, 3960, 1, 1024]
    - [244, 59.012]
  - - [64, 192, 64, 1280]
    - [252, 23.203]
  - - [64, 320, 64, 1280]
    - [253, 26.038]
  - - [64, 384, 64, 1280]
    - [254, 29.624]
  - - [64, 448, 64, 1280]
    - [255, 28.809]
  - - [64, 192, 64, 2048]
    - [256, 24.001]
  - - [64, 320, 64, 2048]
    - [257, 27.305]
  - - [64, 384, 64, 2048]
    - [258, 30.543]
  - - [64, 448, 64, 2048]
    - [259, 30.06]
  - - [1225, 32, 64, 192]
    - [260, 13.537]
  - - [1225, 48, 64, 192]
    - [261, 14.146]
  - - [1225, 64, 64, 192]
    - [262, 21.883]
  - - [1225, 48, 64, 256]
    - [262, 16.512]
  - - [1225, 64, 64, 256]
    - [263, 24.186]
  - - [1225, 48, 64, 288]
    - [264, 17.67]
  - - [1225, 64, 64, 288]
    - [265, 25.661]
  - - [5329, 80, 64, 64]
    - [266, 12.334]
  - - [289, 128, 64, 768]
    - [267, 28.407]
  - - [289, 160, 64, 768]
    - [266, 26.002]
  - - [289, 192, 64, 768]
    - [263, 30.494]
  - - [64, 192, 32, 1280]
    - [268, 18.256]
  - - [64, 320, 32, 1280]
    - [253, 23.646]
  - - [64, 384, 32, 1280]
    - [269, 28.721]
  - - [64, 448, 32, 1280]
    - [270, 26.168]
  - - [64, 192, 32, 2048]
    - [271, 20.314]
  - - [64, 320, 32, 2048]
    - [272, 25.634]
  - - [64, 384, 32, 2048]
    - [273, 28.493]
  - - [64, 448, 32, 2048]
    - [252, 27.606]
  - - [1225, 32, 32, 192]
    - [274, 10.995]
  - - [1225, 48, 32, 192]
    - [264, 11.739]
  - - [1225, 64, 32, 192]
    - [263, 18.25]
  - - [1225, 48, 32, 256]
    - [264, 13.297]
  - - [1225, 64, 32, 256]
    - [263, 19.642]
  - - [1225, 48, 32, 288]
    - [264, 14.245]
  - - [1225, 64, 32, 288]
    - [275, 21.603]
  - - [5329, 80, 32, 64]
    - [266, 11.38]
  - - [289, 128, 32, 768]
    - [267, 25.396]
  - - [289, 160, 32, 768]
    - [276, 21.142]
  - - [289, 192, 32, 768]
    - [277, 24.401]
  - - [49, 2048, 64, 512]
    - [284, 20.667]
  - - [49, 512, 64, 2048]
    - [285, 19.828]
  - - [3136, 256, 32, 64]
    - [286, 23.349]
  - - [3136, 64, 32, 64]
    - [279, 14.91]
  - - [3136, 64, 32, 256]
    - [287, 26.76]
  - - [784, 512, 32, 128]
    - [288, 25.947]
  - - [784, 128, 32, 512]
    - [281, 33.742]
  - - [196, 1024, 32, 256]
    - [289, 24.979]
  - - [196, 256, 32, 1024]
    - [290, 27.526]
  - - [49, 2048, 32, 512]
    - [291, 18.187]
  - - [49, 512, 32, 2048]
    - [292, 18.209]
  - - [3136, 128, 64, 64]
    - [293, 22.661]
  - - [3136, 256, 64, 128]
    - [294, 34.422]
  - - [784, 512, 64, 256]
    - [288, 37.121]
  - - [3136, 128, 64, 256]
    - [294, 40.043]
  - - [3136, 256, 64, 256]
    - [294, 43.93]
  - - [196, 1024, 64, 512]
    - [282, 37.054]
  - - [784, 256, 64, 512]
    - [295, 42.329]
  - - [784, 512, 64, 512]
    - [296, 46.468]
  - - [196, 512, 64, 1024]
    - [297, 37.505]
  - - [196, 1024, 64, 1024]
    - [282, 44.294]
  - - [49, 2048, 64, 1024]
    - [298, 23.892]
  - - [49, 1024, 64, 2048]
    - [299, 23.995]
  - - [3136, 128, 32, 64]
    - [293, 20.353]
  - - [3136, 256, 32, 128]
    - [294, 32.496]
  - - [784, 512, 32, 256]
    - [266, 35.089]
  - - [3136, 128, 32, 256]
    - [300, 37.166]
  - - [3136, 256, 32, 256]
    - [294, 42.329]
  - - [196, 1024, 32, 512]
    - [301, 31.053]
  - - [784, 256, 32, 512]
    - [295, 39.914]
  - - [784, 512, 32, 512]
    - [295, 43.775]
  - - [196, 512, 32, 1024]
    - [301, 30.897]
  - - [196, 1024, 32, 1024]
    - [297, 37.369]
  - - [49, 2048, 32, 1024]
    - [298, 21.565]
  - - [49, 1024, 32, 2048]
    - [302, 20.299]
  - - [7680, 8192, 1, 8192]
    - [303, 91.189]
  - - [3840, 4096, 1, 4096]
    - [304, 89.798]
  - - [1920, 2048, 1, 2048]
    - [305, 80.089]
  - - [960, 1024, 1, 1024]
    - [306, 40.606]
  - - [480, 512, 1, 512]
    - [307, 12.799]
  - - [8192, 7680, 1, 8192]
    - [308, 90.828]
  - - [4096, 3840, 1, 4096]
    - [304, 89.732]
  - - [2048, 1920, 1, 2048]
    - [309, 79.834]
  - - [512, 480, 1, 512]
    - [311, 12.527]
  - - [8192, 8192, 1, 8192]
    - [312, 88.811]
  - - [4096, 4096, 1, 4096]
    - [312, 78.008]
  - - [2048, 2048, 1, 2048]
    - [313, 47.878]
  - - [512, 512, 1, 512]
    - [315, 12.314]
  - - [64, 512, 16, 512]
    - [316, 17.206]
  - - [64, 512, 128, 512]
    - [317, 26.374]
  - - [1024, 8, 1, 1024]
    - [318, 0.755]
  - - [1024, 77, 1, 1024]
    - [319, 6.746]
  - - [1024, 77, 1, 30522]
    - [320, 10.699]
  - - [1024, 512, 1, 2]
    - [321, 0.136]
  - - [1024, 512, 1, 4096]
    - [323, 27.305]
  - - [1024, 616, 1, 1024]
    - [324, 25.399]
  - - [1024, 4096, 1, 2]
    - [325, 0.427]
  - - [4096, 512, 1, 1024]
    - [328, 38.574]
  - - [64, 128, 128, 128]
    - [330, 11.739]
  - - [64, 128, 160, 128]
    - [331, 14.145]
  - - [1024, 10, 1, 2]
    - [332, 0.004]
  - - [1024, 10, 1, 1024]
    - [333, 0.917]
  - - [1024, 160, 1, 1024]
    - [334, 11.544]
  - - [1024, 200, 1, 1024]
    - [335, 12.998]
  - - [1024, 200, 1, 30522]
    - [336, 19.857]
  - - [1024, 1024, 1, 2]
    - [337, 0.237]
  - - [1024, 1024, 1, 4096]
    - [338, 34.266]
  - - [1024, 1280, 1, 2]
    - [339, 0.292]
  - - [1024, 1280, 1, 1024]
    - [340, 34.602]
  - - [1024, 1280, 1, 4096]
    - [341, 41.729]
  - - [4096, 1024, 1, 1024]
    - [342, 41.565]
  - - [4096, 1280, 1, 1024]
    - [343, 50.142]
  - - [64, 128, 624, 128]
    - [344, 15.864]
  - - [1024, 39, 1, 2]
    - [345, 0.015]
  - - [1024, 39, 1, 1024]
    - [333, 3.576]
  - - [1024, 780, 1, 1024]
    - [317, 32.432]
  - - [1024, 780, 1, 30522]
    - [346, 34.582]
  - - [1024, 4992, 1, 2]
    - [347, 0.481]
  - - [1024, 4992, 1, 1024]
    - [309, 48.405]
  - - [1024, 4992, 1, 4096]
    - [309, 57.428]
  - - [4096, 4992, 1, 1024]
    - [348, 67.73]
  - - [1024, 308, 1, 1024]
    - [350, 16.791]
  - - [1024, 308, 1, 30522]
    - [351, 22.847]
  - - [64, 128, 640, 128]
    - [355, 16.062]
  - - [1024, 40, 1, 2]
    - [356, 0.015]
  - - [1024, 40, 1, 1024]
    - [333, 3.774]
  - - [1024, 800, 1, 1024]
    - [316, 32.574]
  - - [1024, 800, 1, 30522]
    - [357, 35.566]
  - - [1024, 5120, 1, 2]
    - [358, 0.49]
  - - [1024, 5120, 1, 1024]
    - [359, 49.161]
  - - [1024, 5120, 1, 4096]
    - [359, 58.404]
  - - [4096, 5120, 1, 1024]
    - [303, 69.157]
  - - [64, 128, 656, 128]
    - [360, 16.297]
  - - [1024, 41, 1, 2]
    - [361, 0.015]
  - - [1024, 41, 1, 1024]
    - [319, 3.868]
  - - [1024, 820, 1, 1024]
    - [362, 33.251]
  - - [1024, 820, 1, 30522]
    - [363, 37.041]
  - - [1024, 5248, 1, 2]
    - [337, 0.498]
  - - [1024, 5248, 1, 1024]
    - [309, 50.489]
  - - [1024, 5248, 1, 4096]
    - [309, 60.214]
  - - [4096, 5248, 1, 1024]
    - [329, 69.947]
  - - [64, 512, 80, 512]
    - [306, 26.005]
  - - [1024, 5, 1, 2]
    - [364, 0.002]
  - - [1024, 5, 1, 1024]
    - [365, 0.467]
  - - [1024, 385, 1, 1024]
    - [366, 21.466]
  - - [1024, 385, 1, 30522]
    - [367, 24.651]
  - - [1024, 2560, 1, 2]
    - [347, 0.366]
  - - [1024, 2560, 1, 1024]
    - [368, 45.758]
  - - [1024, 2560, 1, 4096]
    - [309, 57.159]
  - - [4096, 2560, 1, 1024]
    - [369, 66.327]
  - - [64, 512, 96, 512]
    - [370, 27.455]
  - - [1024, 6, 1, 2]
    - [332, 0.002]
  - - [1024, 6, 1, 1024]
    - [365, 0.55]
  - - [1024, 462, 1, 1024]
    - [371, 20.989]
  - - [1024, 462, 1, 30522]
    - [372, 28.193]
  - - [1024, 3072, 1, 2]
    - [373, 0.415]
  - - [1024, 3072, 1, 1024]
    - [374, 53.831]
  - - [1024, 3072, 1, 4096]
    - [309, 67.629]
  - - [4096, 3072, 1, 1024]
    - [375, 62.124]
  - - [1024, 8, 1, 2]
    - [332, 0.003]
  - - [1024, 160, 1, 30522]
    - [376, 17.613]
  - - [64, 128, 144, 128]
    - [373, 12.505]
  - - [1024, 9, 1, 2]
    - [345, 0.004]
  - - [1024, 9, 1, 1024]
    - [349, 0.833]
  - - [1024, 180, 1, 1024]
    - [377, 12.098]
  - - [1024, 180, 1, 30522]
    - [378, 19.477]
  - - [1024, 1152, 1, 2]
    - [379, 0.27]
  - - [1024, 1152, 1, 1024]
    - [380, 34.36]
  - - [1024, 1152, 1, 4096]
    - [325, 36.262]
  - - [4096, 1152, 1, 1024]
    - [381, 45.907]
  - - [479, 32768, 1, 1024]
    - [383, 53.509]
  - - [64, 4, 32768, 4]
    - [389, 0.106]
  - - [64, 4, 38400, 4]
    - [389, 0.106]
  - - [1024, 8192, 1, 1024]
    - [359, 53.915]
  - - [1024, 8192, 1, 4096]
    - [343, 62.656]
  - - [1024, 8192, 1, 33712]
    - [388, 66.794]
  - - [1024, 9600, 1, 1024]
    - [309, 61.895]
  - - [1024, 9600, 1, 4096]
    - [309, 73.31]
  - - [1024, 9600, 1, 33712]
    - [343, 77.292]
  - - [4096, 8192, 1, 1024]
    - [390, 72.032]
  - - [4096, 9600, 1, 1024]
    - [329, 71.34]
  - - [128, 128, 1, 64]
    - [408, 0.28]
  - - [64, 128, 1, 128]
    - [406, 0.228]
  - - [64, 5, 1, 5]
    - [345, 0.0]
  - - [32, 33, 1, 33]
    - [332, 0.006]
- null
