library/src/blas3/Tensile/Logic/asm_full/arcturus_Cijk_Alik_Bjlk_HB.yaml
- {MinimumRequiredVersion: 4.6.0}
- arcturus
- gfx908
- [Device 7380, Device 7388, Device 738c, Device 7390]
    SolutionIndex: 0
    SolutionNameMin: Cijk_Alik_Bjlk_HB_MT32x64x16_SN_EPS1_GRVW4_LRVW4_NLCA1_PGR1_TT4_4_VW4_WG8_16_1_WGM4
    SolutionIndex: 1
    SolutionNameMin: Cijk_Alik_Bjlk_HB_MT32x64x16_SN_EPS1_GRVW4_LRVW4_NLCA1_PGR1_TT4_4_VW4_WG8_16_1_WGM1
    SolutionIndex: 2
    SolutionNameMin: Cijk_Alik_Bjlk_HB_MT64x128x8_SN_EPS1_GRVW4_LRVW4_NLCA1_PGR1_TT4_8_VW4_WG16_16_1_WGM4
    SolutionIndex: 3
    SolutionNameMin: Cijk_Alik_Bjlk_HB_MT8x64x32_SN_EPS1_GRVW2_LRVW2_NLCA1_PGR1_TT2_2_VW2_WG4_32_1_WGM4
    SolutionIndex: 4
    SolutionNameMin: Cijk_Alik_Bjlk_HB_MT128x128x16_SN_EPS1_GRVW8_LRVW8_NLCA1_PGR1_TT8_8_VW8_WG16_16_1_WGM1
    SolutionIndex: 5
    SolutionNameMin: Cijk_Alik_Bjlk_HB_MT64x128x16_SN_EPS1_GRVW4_LRVW4_NLCA1_PGR1_TT4_8_VW4_WG16_16_1_WGM4
    SolutionIndex: 6
    SolutionNameMin: Cijk_Alik_Bjlk_HB_MT64x64x16_SN_EPS1_GRVW4_LRVW4_NLCA1_PGR1_TT4_4_VW4_WG16_16_1_WGM4
    SolutionIndex: 7
    SolutionNameMin: Cijk_Alik_Bjlk_HB_MT64x128x8_SN_EPS1_GRVW4_LRVW4_NLCA1_PGR1_TT4_8_VW4_WG16_16_1_WGM1
    SolutionIndex: 8
    SolutionNameMin: Cijk_Alik_Bjlk_HB_MT128x64x16_SN_EPS1_GRVW4_LRVW4_NLCA1_PGR1_TT8_4_VW4_WG16_16_1_WGM1
    SolutionIndex: 9
    SolutionNameMin: Cijk_Alik_Bjlk_HB_MT64x128x16_SN_EPS1_GRVW4_LRVW4_NLCA1_PGR1_TT4_8_VW4_WG16_16_1_WGM1
    SolutionIndex: 10
    SolutionNameMin: Cijk_Alik_Bjlk_HB_MT32x64x8_SN_EPS1_GRVW4_LRVW4_NLCA1_PGR1_TT4_4_VW4_WG8_16_1_WGM4
    SolutionIndex: 11
    SolutionNameMin: Cijk_Alik_Bjlk_HB_MT32x128x8_SN_EPS1_GRVW4_LRVW4_NLCA1_PGR1_TT4_4_VW4_WG8_32_1_WGM4
    SolutionIndex: 12
    SolutionNameMin: Cijk_Alik_Bjlk_HB_MT16x16x16_SN_EPS1_GRVW2_LRVW2_NLCA1_PGR1_TT2_2_VW2_WG8_8_1_WGM1
    SolutionIndex: 13
    SolutionNameMin: Cijk_Alik_Bjlk_HB_MT16x16x24_SN_EPS1_GRVW2_LRVW2_NLCA3_PGR1_TT2_2_VW2_WG8_8_1_WGM1
    SolutionIndex: 14
    SolutionNameMin: Cijk_Alik_Bjlk_HB_MT16x128x16_SN_EPS1_GRVW4_LRVW4_NLCA1_PGR1_TT4_4_VW4_WG4_32_1_WGM1
    SolutionIndex: 15
    SolutionNameMin: Cijk_Alik_Bjlk_HB_MT64x64x16_SN_EPS1_GRVW4_LRVW4_NLCA1_PGR1_TT4_4_VW4_WG16_16_1_WGM1
    SolutionIndex: 16
    SolutionNameMin: Cijk_Alik_Bjlk_HB_MT32x64x8_SN_EPS1_GRVW4_LRVW4_NLCA1_PGR1_TT4_4_VW4_WG8_16_1_WGM1
    SolutionIndex: 17
    SolutionNameMin: Cijk_Alik_Bjlk_HB_MT16x16x24_SN_EPS1_GRVW2_LRVW2_NLCA3_PGR1_TT2_2_VW2_WG8_8_1_WGM4
    SolutionIndex: 18
    SolutionNameMin: Cijk_Alik_Bjlk_HB_MT16x64x16_SN_EPS1_GRVW2_LRVW2_NLCA1_PGR1_TT2_4_VW2_WG8_16_1_WGM1
    SolutionIndex: 19
    SolutionNameMin: Cijk_Alik_Bjlk_HB_MT128x128x16_SN_EPS1_GRVW8_LRVW8_NLCA1_PGR1_TT8_8_VW8_WG16_16_1_WGM4
    SolutionIndex: 20
    SolutionNameMin: Cijk_Alik_Bjlk_HB_MT16x16x32_SN_EPS1_GRVW2_LRVW2_NLCA1_PGR1_TT2_2_VW2_WG8_8_1_WGM1
    SolutionIndex: 21
    SolutionNameMin: Cijk_Alik_Bjlk_HB_MT128x64x16_SN_EPS1_GRVW4_LRVW4_NLCA1_PGR1_TT8_4_VW4_WG16_16_1_WGM4
    SolutionIndex: 22
    SolutionNameMin: Cijk_Alik_Bjlk_HB_MT16x32x16_SN_EPS1_GRVW2_LRVW2_NLCA1_PGR1_TT2_2_VW2_WG8_16_1_WGM4
    SolutionIndex: 23
    SolutionNameMin: Cijk_Alik_Bjlk_HB_MT16x64x16_SN_EPS1_GRVW2_LRVW2_NLCA1_PGR1_TT2_2_VW2_WG8_32_1_WGM4
    SolutionIndex: 24
    SolutionNameMin: Cijk_Alik_Bjlk_HB_MT64x128x32_SN_EPS1_GRVW4_LRVW4_NLCA1_PGR1_TT4_8_VW4_WG16_16_1_WGM4
    SolutionIndex: 25
    SolutionNameMin: Cijk_Alik_Bjlk_HB_MT16x64x32_SN_EPS1_GRVW2_LRVW2_NLCA1_PGR1_TT2_2_VW2_WG8_32_1_WGM1
    SolutionIndex: 26
    SolutionNameMin: Cijk_Alik_Bjlk_HB_MT32x32x16_SN_EPS1_GRVW4_LRVW4_NLCA1_PGR1_TT4_4_VW4_WG8_8_1_WGM1
    SolutionIndex: 27
    SolutionNameMin: Cijk_Alik_Bjlk_HB_MT32x32x24_SN_EPS1_GRVW4_LRVW4_NLCA3_PGR1_TT4_4_VW4_WG8_8_1_WGM1
    SolutionIndex: 28
    SolutionNameMin: Cijk_Alik_Bjlk_HB_MT32x64x16_SN_EPS1_GRVW4_LRVW4_NLCA1_PGR1_TT4_8_VW4_WG8_8_1_WGM4
    SolutionIndex: 29
    SolutionNameMin: Cijk_Alik_Bjlk_HB_MT16x32x16_SN_EPS1_GRVW2_LRVW2_NLCA1_PGR1_TT2_2_VW2_WG8_16_1_WGM1
    SolutionIndex: 30
    SolutionNameMin: Cijk_Alik_Bjlk_HB_MT8x64x32_SN_EPS1_GRVW2_LRVW2_NLCA1_PGR1_TT2_2_VW2_WG4_32_1_WGM1
    SolutionIndex: 31
    SolutionNameMin: Cijk_Alik_Bjlk_HB_MT64x64x16_SN_EPS0_GRVW8_LRVW8_NLCA1_PGR0_TT8_8_VW8_WG8_8_1_WGM4
    SolutionIndex: 32
    SolutionNameMin: Cijk_Alik_Bjlk_HB_MT8x64x16_SN_EPS1_GRVW2_LRVW2_NLCA1_PGR1_TT2_2_VW2_WG4_32_1_WGM1
    SolutionIndex: 33
    SolutionNameMin: Cijk_Alik_Bjlk_HB_MT16x128x16_SN_EPS1_GRVW2_LRVW2_NLCA1_PGR1_TT2_4_VW2_WG8_32_1_WGM1
    SolutionIndex: 34
    SolutionNameMin: Cijk_Alik_Bjlk_HB_MT8x64x64_SN_EPS1_GRVW2_LRVW2_NLCA1_PGR1_TT2_2_VW2_WG4_32_1_WGM4
    SolutionIndex: 35
    SolutionNameMin: Cijk_Alik_Bjlk_HB_MT32x32x16_SN_EPS1_GRVW4_LRVW4_NLCA1_PGR1_TT4_4_VW4_WG8_8_1_WGM4
    SolutionIndex: 36
    SolutionNameMin: Cijk_Alik_Bjlk_HB_MT32x128x8_SN_EPS1_GRVW4_LRVW4_NLCA1_PGR1_TT4_4_VW4_WG8_32_1_WGM1
    SolutionIndex: 37
    SolutionNameMin: Cijk_Alik_Bjlk_HB_MT32x32x16_SN_EPS1_GRVW2_LRVW2_NLCA1_PGR1_TT2_2_VW2_WG16_16_1_WGM1
    SolutionIndex: 38
    SolutionNameMin: Cijk_Alik_Bjlk_HB_MT16x64x16_SN_EPS1_GRVW2_LRVW2_NLCA1_PGR1_TT2_4_VW2_WG8_16_1_WGM4
    SolutionIndex: 39
    SolutionNameMin: Cijk_Alik_Bjlk_HB_MT64x64x16_SN_EPS0_GRVW8_LRVW8_NLCA1_PGR0_TT8_8_VW8_WG8_8_1_WGM1
    SolutionIndex: 40
    SolutionNameMin: Cijk_Alik_Bjlk_HB_MT16x128x8_SN_EPS1_GRVW4_LRVW4_NLCA1_PGR1_TT4_4_VW4_WG4_32_1_WGM4
    SolutionIndex: 41
    SolutionNameMin: Cijk_Alik_Bjlk_HB_MT32x32x24_SN_EPS1_GRVW4_LRVW4_NLCA3_PGR1_TT4_4_VW4_WG8_8_1_WGM4
    SolutionIndex: 42
    SolutionNameMin: Cijk_Alik_Bjlk_HB_MT16x64x8_SN_EPS1_GRVW2_LRVW2_NLCA1_PGR1_TT2_4_VW2_WG8_16_1_WGM1
    SolutionIndex: 43
    SolutionNameMin: Cijk_Alik_Bjlk_HB_MT16x64x16_SN_EPS1_GRVW2_LRVW2_NLCA1_PGR1_TT2_2_VW2_WG8_32_1_WGM1
    SolutionIndex: 44
    SolutionNameMin: Cijk_Alik_Bjlk_HB_MT16x64x32_SN_EPS1_GRVW2_LRVW2_NLCA1_PGR1_TT2_2_VW2_WG8_32_1_WGM4
    SolutionIndex: 45
    SolutionNameMin: Cijk_Alik_Bjlk_HB_MT16x128x8_SN_EPS1_GRVW4_LRVW4_NLCA1_PGR1_TT4_4_VW4_WG4_32_1_WGM1
- - - [1024, 1024, 1, 3328]
    - [0, 11.381]
  - - [64, 6784, 1, 256]
    - [1, 2.957]
  - - [2944, 4288, 1, 1280]
    - [2, 20.053]
  - - [2368, 64, 1, 3328]
    - [3, 3.591]
  - - [2368, 5888, 1, 256]
    - [2, 16.082]
  - - [1024, 5056, 1, 3328]
    - [4, 18.495]
  - - [5888, 1024, 1, 1280]
    - [5, 16.859]
  - - [128, 6784, 1, 3328]
    - [6, 11.05]
  - - [5888, 1856, 1, 3328]
    - [7, 20.703]
  - - [5056, 704, 1, 256]
    - [8, 10.881]
  - - [5888, 2944, 1, 3328]
    - [4, 22.38]
  - - [1856, 4288, 1, 256]
    - [5, 14.429]
  - - [5056, 5056, 1, 3328]
    - [7, 22.374]
  - - [1408, 5888, 1, 1280]
    - [9, 19.006]
  - - [448, 3584, 1, 3328]
    - [0, 12.943]
  - - [256, 4288, 1, 3328]
    - [10, 11.632]
  - - [5888, 1408, 1, 1280]
    - [9, 19.428]
  - - [704, 1856, 1, 3328]
    - [11, 14.038]
  - - [3584, 1856, 1, 3328]
    - [2, 20.468]
  - - [5056, 6784, 1, 1280]
    - [2, 22.44]
  - - [1408, 64, 1, 1280]
    - [12, 1.524]
  - - [704, 64, 1, 3328]
    - [13, 1.155]
  - - [448, 1024, 1, 1280]
    - [14, 5.962]
  - - [5056, 5056, 1, 1280]
    - [2, 21.563]
  - - [448, 5056, 1, 256]
    - [15, 7.909]
  - - [6784, 448, 1, 256]
    - [5, 9.032]
  - - [2368, 128, 1, 256]
    - [16, 1.042]
  - - [5888, 704, 1, 1280]
    - [8, 14.685]
  - - [3584, 1024, 1, 256]
    - [9, 10.957]
  - - [6784, 4288, 1, 3328]
    - [2, 22.377]
  - - [1856, 2368, 1, 3328]
    - [2, 18.538]
  - - [5888, 2944, 1, 1280]
    - [4, 21.573]
  - - [5888, 1024, 1, 256]
    - [2, 13.697]
  - - [448, 64, 1, 1280]
    - [17, 0.46]
  - - [2944, 64, 1, 256]
    - [0, 0.509]
  - - [1408, 2944, 1, 256]
    - [6, 6.809]
  - - [256, 1856, 1, 1280]
    - [6, 3.661]
  - - [6784, 5056, 1, 3328]
    - [2, 22.813]
  - - [5056, 5056, 1, 256]
    - [5, 18.026]
  - - [448, 704, 1, 1280]
    - [18, 4.304]
  - - [64, 1024, 1, 1280]
    - [3, 1.16]
  - - [1024, 3584, 1, 1280]
    - [8, 14.955]
  - - [2368, 2944, 1, 1280]
    - [19, 17.666]
  - - [128, 3584, 1, 1280]
    - [1, 6.124]
  - - [1024, 256, 1, 3328]
    - [18, 3.997]
  - - [1408, 4288, 1, 1280]
    - [5, 16.859]
  - - [3584, 4288, 1, 1280]
    - [9, 20.994]
  - - [2368, 704, 1, 1280]
    - [15, 9.745]
  - - [5056, 4288, 1, 3328]
    - [2, 22.036]
  - - [3584, 2368, 1, 3328]
    - [7, 20.885]
  - - [64, 704, 1, 1280]
    - [13, 0.935]
  - - [4288, 256, 1, 256]
    - [0, 5.997]
  - - [6784, 448, 1, 1280]
    - [5, 12.631]
  - - [1024, 1408, 1, 3328]
    - [11, 13.403]
  - - [4288, 2944, 1, 256]
    - [19, 15.243]
  - - [1856, 64, 1, 1280]
    - [3, 2.416]
  - - [5888, 64, 1, 3328]
    - [0, 5.929]
  - - [2944, 256, 1, 3328]
    - [11, 9.658]
  - - [5056, 2368, 1, 1280]
    - [7, 20.188]
  - - [448, 3584, 1, 1280]
    - [14, 9.264]
  - - [6784, 5888, 1, 256]
    - [4, 20.228]
  - - [256, 4288, 1, 1280]
    - [14, 10.026]
  - - [704, 128, 1, 1280]
    - [20, 1.591]
  - - [1408, 448, 1, 1280]
    - [14, 7.685]
  - - [1024, 1408, 1, 256]
    - [21, 5.374]
  - - [2368, 2368, 1, 3328]
    - [2, 19.752]
  - - [5056, 704, 1, 3328]
    - [9, 18.11]
  - - [1408, 1856, 1, 256]
    - [5, 8.656]
  - - [5888, 1856, 1, 256]
    - [1, 12.765]
  - - [4288, 64, 1, 3328]
    - [22, 4.175]
  - - [704, 5888, 1, 256]
    - [7, 10.417]
  - - [6784, 128, 1, 1280]
    - [14, 9.3]
  - - [4288, 6784, 1, 3328]
    - [2, 23.005]
  - - [3584, 704, 1, 3328]
    - [2, 16.351]
  - - [1408, 1408, 1, 256]
    - [11, 7.884]
  - - [1856, 128, 1, 256]
    - [22, 0.547]
  - - [2944, 64, 1, 1280]
    - [23, 2.921]
  - - [448, 4288, 1, 256]
    - [6, 8.509]
  - - [64, 3584, 1, 3328]
    - [3, 5.278]
  - - [704, 2368, 1, 1280]
    - [24, 9.496]
  - - [1856, 2368, 1, 1280]
    - [21, 15.757]
  - - [2368, 128, 1, 3328]
    - [25, 4.835]
  - - [2944, 128, 1, 256]
    - [26, 2.335]
  - - [448, 1408, 1, 256]
    - [6, 3.15]
  - - [64, 5056, 1, 3328]
    - [26, 4.912]
  - - [1408, 1024, 1, 1280]
    - [11, 12.78]
  - - [2368, 256, 1, 1280]
    - [14, 4.405]
  - - [6784, 704, 1, 256]
    - [21, 12.946]
  - - [256, 3584, 1, 3328]
    - [27, 11.785]
  - - [1408, 3584, 1, 256]
    - [19, 12.751]
  - - [3584, 4288, 1, 3328]
    - [19, 22.059]
  - - [5888, 1856, 1, 1280]
    - [4, 20.064]
  - - [5056, 1024, 1, 3328]
    - [7, 18.352]
  - - [5056, 64, 1, 1280]
    - [18, 4.449]
  - - [1024, 704, 1, 256]
    - [21, 2.632]
  - - [128, 448, 1, 256]
    - [28, 0.177]
  - - [2368, 3584, 1, 1280]
    - [5, 19.592]
  - - [1024, 256, 1, 256]
    - [29, 1.629]
  - - [448, 448, 1, 256]
    - [23, 0.492]
  - - [2944, 3584, 1, 3328]
    - [7, 21.186]
  - - [256, 256, 1, 3328]
    - [30, 1.678]
  - - [128, 1024, 1, 3328]
    - [3, 3.307]
  - - [6784, 2944, 1, 256]
    - [31, 16.303]
  - - [64, 1856, 1, 1280]
    - [30, 2.306]
  - - [1024, 2368, 1, 256]
    - [7, 4.272]
  - - [4288, 2368, 1, 3328]
    - [7, 20.969]
  - - [1856, 2368, 1, 256]
    - [6, 11.872]
  - - [3584, 6784, 1, 3328]
    - [7, 22.703]
  - - [6784, 1856, 1, 3328]
    - [7, 20.456]
  - - [1024, 128, 1, 1280]
    - [32, 2.408]
  - - [4288, 128, 1, 1280]
    - [14, 6.634]
  - - [5056, 4288, 1, 1280]
    - [7, 21.434]
  - - [5888, 64, 1, 256]
    - [1, 2.292]
  - - [1408, 5056, 1, 1280]
    - [5, 18.08]
  - - [1856, 256, 1, 1280]
    - [14, 6.363]
  - - [64, 5888, 1, 3328]
    - [33, 5.608]
  - - [6784, 5888, 1, 3328]
    - [2, 23.304]
  - - [448, 256, 1, 3328]
    - [34, 2.934]
  - - [2368, 5056, 1, 1280]
    - [2, 20.578]
  - - [256, 1408, 1, 3328]
    - [14, 5.441]
  - - [6784, 128, 1, 3328]
    - [10, 10.615]
  - - [1024, 5056, 1, 1280]
    - [4, 16.029]
  - - [4288, 1024, 1, 256]
    - [2, 11.036]
  - - [2368, 1408, 1, 256]
    - [9, 11.126]
  - - [704, 704, 1, 3328]
    - [14, 7.355]
  - - [5888, 448, 1, 1280]
    - [21, 12.512]
  - - [3584, 256, 1, 3328]
    - [1, 11.279]
  - - [704, 5888, 1, 3328]
    - [2, 17.295]
  - - [1024, 6784, 1, 1280]
    - [31, 17.584]
  - - [128, 3584, 1, 3328]
    - [35, 6.967]
  - - [128, 704, 1, 1280]
    - [34, 1.612]
  - - [3584, 2944, 1, 1280]
    - [7, 20.474]
  - - [1856, 128, 1, 3328]
    - [23, 4.971]
  - - [128, 2944, 1, 1280]
    - [1, 4.857]
  - - [2368, 1024, 1, 3328]
    - [11, 15.655]
  - - [448, 1856, 1, 1280]
    - [14, 9.725]
  - - [1408, 5056, 1, 3328]
    - [19, 19.865]
  - - [1856, 1856, 1, 3328]
    - [9, 17.615]
  - - [3584, 128, 1, 256]
    - [33, 2.492]
  - - [448, 1408, 1, 3328]
    - [33, 7.716]
  - - [2368, 2368, 1, 256]
    - [9, 13.184]
  - - [4288, 4288, 1, 1280]
    - [7, 21.483]
  - - [64, 448, 1, 1280]
    - [20, 0.526]
  - - [704, 6784, 1, 3328]
    - [7, 19.703]
  - - [5888, 5888, 1, 3328]
    - [4, 23.067]
  - - [5056, 1024, 1, 1280]
    - [5, 16.847]
  - - [448, 5888, 1, 3328]
    - [7, 17.115]
  - - [5056, 5888, 1, 1280]
    - [2, 22.294]
  - - [448, 6784, 1, 256]
    - [36, 9.133]
  - - [256, 3584, 1, 256]
    - [1, 4.185]
  - - [256, 2944, 1, 3328]
    - [11, 9.639]
  - - [256, 448, 1, 256]
    - [37, 0.791]
  - - [3584, 5888, 1, 256]
    - [7, 17.27]
  - - [2944, 3584, 1, 256]
    - [2, 15.595]
  - - [1408, 704, 1, 256]
    - [0, 4.313]
  - - [6784, 2944, 1, 3328]
    - [2, 22.236]
  - - [2944, 5056, 1, 3328]
    - [19, 21.296]
  - - [64, 64, 1, 3328]
    - [30, 0.095]
  - - [6784, 2368, 1, 1280]
    - [7, 20.668]
  - - [4288, 5888, 1, 1280]
    - [7, 21.73]
  - - [4288, 4288, 1, 256]
    - [2, 16.023]
  - - [448, 2944, 1, 3328]
    - [36, 13.789]
  - - [4288, 1856, 1, 1280]
    - [9, 18.284]
  - - [1856, 2944, 1, 3328]
    - [19, 19.339]
  - - [256, 6784, 1, 3328]
    - [5, 14.283]
  - - [64, 5888, 1, 256]
    - [38, 2.06]
  - - [5056, 1024, 1, 256]
    - [39, 12.069]
  - - [1408, 1408, 1, 1280]
    - [0, 11.578]
  - - [5056, 1856, 1, 3328]
    - [7, 21.004]
  - - [1856, 1408, 1, 256]
    - [5, 8.641]
  - - [448, 448, 1, 3328]
    - [30, 4.68]
  - - [448, 2368, 1, 1280]
    - [14, 10.121]
  - - [1408, 128, 1, 1280]
    - [30, 2.984]
  - - [5056, 256, 1, 3328]
    - [11, 13.674]
  - - [256, 64, 1, 1280]
    - [12, 0.267]
  - - [128, 1856, 1, 1280]
    - [30, 3.661]
  - - [5056, 3584, 1, 256]
    - [2, 16.678]
  - - [1856, 1024, 1, 1280]
    - [8, 11.365]
  - - [1856, 1856, 1, 1280]
    - [2, 15.793]
  - - [6784, 6784, 1, 1280]
    - [4, 22.723]
  - - [128, 4288, 1, 3328]
    - [14, 7.975]
  - - [1856, 1024, 1, 3328]
    - [5, 15.506]
  - - [256, 2368, 1, 256]
    - [0, 3.079]
  - - [1024, 448, 1, 3328]
    - [15, 7.17]
  - - [1856, 704, 1, 1280]
    - [1, 10.228]
  - - [6784, 1024, 1, 256]
    - [4, 14.316]
  - - [5056, 5888, 1, 3328]
    - [2, 22.755]
  - - [1856, 1024, 1, 256]
    - [5, 7.464]
  - - [5056, 1408, 1, 3328]
    - [5, 19.377]
  - - [1024, 1024, 1, 1280]
    - [0, 10.505]
  - - [4288, 1024, 1, 3328]
    - [7, 18.247]
  - - [2944, 1408, 1, 3328]
    - [2, 17.378]
  - - [2944, 4288, 1, 3328]
    - [2, 20.957]
  - - [256, 2944, 1, 256]
    - [14, 3.878]
  - - [5056, 2944, 1, 256]
    - [2, 16.829]
  - - [2368, 1856, 1, 256]
    - [8, 11.054]
  - - [128, 448, 1, 1280]
    - [12, 0.995]
  - - [128, 6784, 1, 1280]
    - [0, 10.037]
  - - [1408, 3584, 1, 3328]
    - [4, 17.885]
  - - [2368, 6784, 1, 256]
    - [19, 15.85]
  - - [5056, 1408, 1, 1280]
    - [39, 18.154]
  - - [1408, 5888, 1, 3328]
    - [7, 20.557]
  - - [1856, 5056, 1, 256]
    - [2, 15.27]
  - - [6784, 6784, 1, 256]
    - [4, 19.737]
  - - [1408, 704, 1, 3328]
    - [40, 10.413]
  - - [128, 5888, 1, 1280]
    - [16, 8.489]
  - - [2368, 4288, 1, 1280]
    - [7, 19.786]
  - - [3584, 1856, 1, 1280]
    - [5, 18.6]
  - - [704, 1408, 1, 3328]
    - [11, 10.362]
  - - [704, 64, 1, 1280]
    - [13, 0.772]
  - - [5888, 5056, 1, 256]
    - [4, 18.787]
  - - [3584, 448, 1, 256]
    - [15, 7.183]
  - - [3584, 3584, 1, 1280]
    - [19, 19.822]
  - - [256, 6784, 1, 256]
    - [9, 7.641]
  - - [1856, 3584, 1, 3328]
    - [9, 20.437]
  - - [5056, 256, 1, 1280]
    - [11, 11.468]
  - - [3584, 3584, 1, 256]
    - [39, 15.322]
  - - [6784, 4288, 1, 1280]
    - [7, 21.56]
  - - [704, 5056, 1, 256]
    - [7, 11.592]
  - - [6784, 128, 1, 256]
    - [15, 5.005]
  - - [64, 1408, 1, 3328]
    - [3, 2.377]
  - - [704, 448, 1, 256]
    - [18, 1.777]
  - - [2944, 2368, 1, 1280]
    - [19, 17.934]
  - - [448, 64, 1, 3328]
    - [13, 0.702]
  - - [6784, 3584, 1, 256]
    - [2, 17.96]
  - - [256, 1856, 1, 3328]
    - [27, 7.211]
  - - [704, 6784, 1, 256]
    - [5, 12.103]
  - - [1024, 3584, 1, 3328]
    - [9, 18.707]
  - - [64, 128, 1, 3328]
    - [3, 0.193]
  - - [2944, 2944, 1, 3328]
    - [2, 21.391]
  - - [5056, 6784, 1, 256]
    - [19, 19.269]
  - - [1408, 4288, 1, 3328]
    - [7, 18.235]
  - - [6784, 256, 1, 1280]
    - [21, 9.96]
  - - [2368, 704, 1, 3328]
    - [0, 13.419]
  - - [128, 4288, 1, 256]
    - [16, 3.123]
  - - [3584, 6784, 1, 256]
    - [4, 17.423]
  - - [128, 128, 1, 3328]
    - [17, 0.406]
  - - [5056, 1856, 1, 256]
    - [5, 15.826]
  - - [256, 128, 1, 256]
    - [20, 0.188]
  - - [704, 4288, 1, 256]
    - [15, 8.512]
  - - [256, 448, 1, 3328]
    - [34, 2.702]
  - - [1408, 6784, 1, 1280]
    - [4, 20.388]
  - - [64, 2368, 1, 1280]
    - [13, 2.778]
  - - [64, 6784, 1, 3328]
    - [0, 6.842]
  - - [2944, 256, 1, 1280]
    - [14, 8.719]
  - - [5056, 2368, 1, 3328]
    - [2, 20.863]
  - - [2944, 4288, 1, 256]
    - [31, 15.01]
  - - [1408, 3584, 1, 1280]
    - [4, 16.069]
  - - [2368, 64, 1, 256]
    - [22, 1.207]
  - - [64, 448, 1, 3328]
    - [20, 0.779]
  - - [1024, 1408, 1, 1280]
    - [11, 13.745]
  - - [1856, 704, 1, 256]
    - [24, 5.143]
  - - [1408, 448, 1, 3328]
    - [14, 9.681]
  - - [2368, 256, 1, 256]
    - [14, 3.214]
  - - [2368, 6784, 1, 3328]
    - [7, 21.894]
  - - [5056, 704, 1, 1280]
    - [7, 16.838]
  - - [1856, 4288, 1, 3328]
    - [7, 19.826]
  - - [1408, 5888, 1, 256]
    - [7, 14.291]
  - - [4288, 64, 1, 1280]
    - [30, 4.073]
  - - [256, 64, 1, 256]
    - [22, 0.098]
  - - [704, 1856, 1, 256]
    - [15, 6.254]
  - - [5888, 64, 1, 1280]
    - [41, 4.783]
  - - [3584, 704, 1, 1280]
    - [2, 14.634]
  - - [256, 128, 1, 1280]
    - [13, 0.541]
  - - [256, 2368, 1, 1280]
    - [14, 7.011]
  - - [3584, 448, 1, 3328]
    - [11, 12.861]
  - - [704, 2368, 1, 3328]
    - [36, 13.586]
  - - [2944, 448, 1, 256]
    - [15, 4.699]
  - - [448, 5056, 1, 3328]
    - [11, 14.926]
  - - [2368, 128, 1, 1280]
    - [32, 4.504]
  - - [4288, 448, 1, 256]
    - [6, 6.89]
  - - [448, 5888, 1, 256]
    - [2, 8.515]
  - - [64, 5056, 1, 1280]
    - [38, 4.86]
  - - [5888, 2368, 1, 256]
    - [2, 16.603]
  - - [704, 448, 1, 3328]
    - [42, 4.884]
  - - [6784, 704, 1, 3328]
    - [21, 17.502]
  - - [128, 64, 1, 1280]
    - [12, 0.15]
  - - [1408, 2944, 1, 3328]
    - [2, 17.211]
  - - [64, 1024, 1, 256]
    - [22, 0.532]
  - - [5056, 64, 1, 3328]
    - [25, 5.149]
  - - [2368, 448, 1, 1280]
    - [14, 10.402]
  - - [1408, 256, 1, 1280]
    - [38, 5.19]
  - - [1856, 448, 1, 3328]
    - [10, 10.396]
  - - [128, 5056, 1, 256]
    - [0, 3.388]
  - - [2368, 704, 1, 256]
    - [8, 6.944]
  - - [3584, 2368, 1, 256]
    - [2, 14.856]
  - - [5888, 5056, 1, 1280]
    - [2, 21.939]
  - - [128, 1024, 1, 1280]
    - [3, 2.555]
  - - [64, 704, 1, 256]
    - [12, 0.366]
  - - [4288, 256, 1, 1280]
    - [14, 10.949]
  - - [3584, 3584, 1, 3328]
    - [2, 21.262]
  - - [704, 704, 1, 256]
    - [26, 2.83]
  - - [5888, 6784, 1, 256]
    - [2, 19.271]
  - - [4288, 2944, 1, 3328]
    - [2, 22.144]
  - - [1856, 64, 1, 256]
    - [30, 0.811]
  - - [4288, 128, 1, 3328]
    - [14, 8.111]
  - - [4288, 704, 1, 1280]
    - [2, 14.115]
  - - [256, 5056, 1, 1280]
    - [36, 12.339]
  - - [6784, 5888, 1, 1280]
    - [7, 22.658]
  - - [704, 128, 1, 256]
    - [29, 0.538]
  - - [5888, 4288, 1, 1280]
    - [2, 21.301]
  - - [448, 256, 1, 1280]
    - [30, 1.809]
  - - [256, 1024, 1, 256]
    - [42, 1.14]
  - - [256, 1408, 1, 1280]
    - [18, 4.762]
  - - [3584, 1024, 1, 3328]
    - [5, 18.66]
  - - [1408, 1856, 1, 1280]
    - [8, 12.388]
  - - [5888, 448, 1, 3328]
    - [8, 15.628]
  - - [704, 5888, 1, 1280]
    - [5, 15.297]
  - - [1024, 6784, 1, 3328]
    - [19, 19.171]
  - - [704, 2944, 1, 1280]
    - [36, 12.464]
  - - [6784, 64, 1, 3328]
    - [41, 6.841]
  - - [5056, 2944, 1, 3328]
    - [19, 21.185]
  - - [448, 128, 1, 256]
    - [30, 0.395]
  - - [1408, 1408, 1, 3328]
    - [6, 12.982]
  - - [1856, 128, 1, 1280]
    - [3, 4.326]
  - - [448, 4288, 1, 1280]
    - [16, 11.347]
  - - [64, 3584, 1, 256]
    - [30, 1.379]
  - - [128, 2944, 1, 3328]
    - [38, 5.588]
  - - [3584, 704, 1, 256]
    - [2, 8.263]
  - - [2944, 448, 1, 3328]
    - [6, 12.351]
  - - [3584, 1408, 1, 3328]
    - [4, 17.999]
  - - [2368, 1024, 1, 1280]
    - [2, 14.249]
  - - [1856, 6784, 1, 256]
    - [8, 14.565]
  - - [4288, 448, 1, 3328]
    - [28, 15.301]
  - - [4288, 3584, 1, 1280]
    - [19, 20.847]
  - - [5888, 1024, 1, 3328]
    - [2, 18.395]
  - - [704, 6784, 1, 1280]
    - [5, 17.135]
  - - [1024, 2944, 1, 3328]
    - [5, 15.56]
  - - [2368, 448, 1, 3328]
    - [0, 11.488]
  - - [704, 5056, 1, 1280]
    - [7, 16.684]
  - - [1024, 5888, 1, 1280]
    - [5, 17.099]
  - - [2944, 1856, 1, 256]
    - [2, 13.345]
  - - [5056, 64, 1, 256]
    - [42, 1.936]
  - - [3584, 5056, 1, 256]
    - [5, 16.39]
  - - [5888, 5056, 1, 3328]
    - [2, 22.629]
  - - [128, 5056, 1, 3328]
    - [14, 9.533]
  - - [3584, 6784, 1, 1280]
    - [2, 22.308]
  - - [4288, 1856, 1, 256]
    - [7, 14.879]
  - - [1856, 5888, 1, 256]
    - [9, 16.092]
  - - [256, 256, 1, 256]
    - [30, 0.415]
  - - [4288, 4288, 1, 3328]
    - [2, 22.62]
  - - [4288, 1408, 1, 1280]
    - [2, 17.709]
  - - [64, 1856, 1, 256]
    - [29, 0.883]
  - - [4288, 2368, 1, 256]
    - [7, 15.486]
  - - [2944, 5056, 1, 1280]
    - [4, 20.771]
  - - [6784, 64, 1, 256]
    - [35, 2.867]
  - - [6784, 2368, 1, 3328]
    - [2, 21.933]
  - - [256, 1024, 1, 1280]
    - [32, 4.074]
  - - [4288, 1856, 1, 3328]
    - [2, 19.51]
  - - [1856, 2944, 1, 1280]
    - [2, 17.171]
  - - [3584, 64, 1, 1280]
    - [32, 4.118]
  - - [3584, 1024, 1, 1280]
    - [9, 17.497]
  - - [1024, 4288, 1, 256]
    - [7, 12.505]
  - - [5888, 3584, 1, 3328]
    - [2, 22.452]
  - - [5056, 3584, 1, 3328]
    - [7, 22.314]
  - - [1408, 128, 1, 3328]
    - [3, 4.352]
  - - [2368, 1408, 1, 1280]
    - [2, 15.786]
  - - [5056, 2944, 1, 1280]
    - [19, 20.948]
  - - [128, 2368, 1, 256]
    - [3, 1.918]
  - - [3584, 256, 1, 256]
    - [0, 4.368]
  - - [1024, 6784, 1, 256]
    - [7, 13.273]
  - - [3584, 2944, 1, 256]
    - [2, 16.134]
  - - [448, 128, 1, 3328]
    - [34, 1.465]
  - - [3584, 1408, 1, 1280]
    - [4, 16.783]
  - - [64, 4288, 1, 3328]
    - [18, 4.651]
  - - [5056, 6784, 1, 3328]
    - [7, 23.234]
  - - [128, 2944, 1, 256]
    - [18, 2.348]
  - - [3584, 4288, 1, 256]
    - [21, 15.347]
  - - [1856, 6784, 1, 3328]
    - [2, 21.981]
  - - [3584, 128, 1, 3328]
    - [38, 6.968]
  - - [128, 256, 1, 1280]
    - [17, 0.585]
  - - [1024, 448, 1, 1280]
    - [41, 5.956]
  - - [5056, 1408, 1, 256]
    - [2, 13.884]
  - - [64, 256, 1, 1280]
    - [29, 0.276]
  - - [256, 704, 1, 256]
    - [30, 1.111]
  - - [5888, 5888, 1, 256]
    - [4, 20.027]
  - - [4288, 1024, 1, 1280]
    - [8, 15.775]
  - - [5888, 128, 1, 3328]
    - [16, 9.499]
  - - [448, 6784, 1, 3328]
    - [9, 15.601]
  - - [2944, 1408, 1, 1280]
    - [11, 15.082]
  - - [2944, 1856, 1, 3328]
    - [19, 19.167]
  - - [128, 1024, 1, 256]
    - [29, 1.038]
  - - [3584, 5888, 1, 1280]
    - [2, 21.849]
  - - [6784, 1856, 1, 1280]
    - [19, 19.656]
  - - [5888, 256, 1, 3328]
    - [5, 12.134]
  - - [1856, 5888, 1, 3328]
    - [7, 20.911]
  - - [3584, 1408, 1, 256]
    - [8, 11.817]
  - - [64, 448, 1, 256]
    - [20, 0.18]
  - - [704, 3584, 1, 3328]
    - [5, 15.36]
  - - [5056, 448, 1, 1280]
    - [2, 13.294]
  - - [4288, 704, 1, 256]
    - [5, 9.039]
  - - [1408, 704, 1, 1280]
    - [0, 8.961]
  - - [2944, 1024, 1, 256]
    - [9, 9.3]
  - - [448, 1408, 1, 1280]
    - [14, 7.967]
  - - [2368, 4288, 1, 3328]
    - [2, 20.964]
  - - [64, 64, 1, 256]
    - [32, 0.022]
  - - [704, 1408, 1, 1280]
    - [14, 9.326]
  - - [6784, 5056, 1, 256]
    - [19, 18.693]
  - - [3584, 5056, 1, 3328]
    - [7, 21.872]
  - - [4288, 5888, 1, 256]
    - [2, 18.367]
  - - [448, 2944, 1, 256]
    - [11, 6.283]
  - - [2944, 6784, 1, 256]
    - [19, 16.326]
  - - [2368, 2368, 1, 1280]
    - [2, 18.458]
  - - [1856, 3584, 1, 1280]
    - [7, 18.944]
  - - [64, 2944, 1, 256]
    - [3, 1.111]
  - - [5056, 3584, 1, 1280]
    - [7, 21.036]
  - - [256, 5888, 1, 256]
    - [1, 5.696]
  - - [128, 256, 1, 3328]
    - [17, 0.776]
  - - [1856, 1408, 1, 3328]
    - [8, 15.786]
  - - [1024, 4288, 1, 3328]
    - [7, 18.2]
  - - [448, 2368, 1, 256]
    - [1, 4.684]
  - - [64, 1408, 1, 1280]
    - [34, 1.474]
  - - [2944, 2368, 1, 3328]
    - [19, 19.335]
  - - [704, 128, 1, 3328]
    - [12, 2.157]
  - - [1408, 128, 1, 256]
    - [3, 1.041]
  - - [1024, 1856, 1, 1280]
    - [21, 11.147]
  - - [6784, 1856, 1, 256]
    - [21, 15.028]
  - - [1024, 5888, 1, 256]
    - [5, 12.677]
  - - [64, 2944, 1, 1280]
    - [32, 2.96]
  - - [64, 5056, 1, 256]
    - [27, 2.002]
  - - [1408, 2368, 1, 256]
    - [36, 10.54]
  - - [2944, 704, 1, 3328]
    - [0, 13.569]
  - - [64, 128, 1, 1280]
    - [13, 0.125]
  - - [2944, 2944, 1, 1280]
    - [5, 19.829]
  - - [6784, 256, 1, 3328]
    - [9, 14.187]
  - - [1408, 5056, 1, 256]
    - [2, 14.054]
  - - [5056, 128, 1, 3328]
    - [27, 8.141]
  - - [128, 128, 1, 1280]
    - [13, 0.284]
  - - [448, 704, 1, 256]
    - [23, 1.886]
  - - [1856, 256, 1, 3328]
    - [1, 7.306]
  - - [2944, 128, 1, 3328]
    - [0, 5.807]
  - - [704, 256, 1, 1280]
    - [3, 3.2]
  - - [256, 448, 1, 1280]
    - [30, 2.174]
  - - [5056, 256, 1, 256]
    - [11, 6.262]
  - - [64, 2368, 1, 3328]
    - [30, 3.731]
  - - [256, 704, 1, 3328]
    - [30, 4.487]
  - - [64, 6784, 1, 1280]
    - [18, 5.916]
  - - [1408, 4288, 1, 256]
    - [7, 12.954]
  - - [5888, 2368, 1, 1280]
    - [9, 19.995]
  - - [128, 256, 1, 256]
    - [20, 0.231]
  - - [64, 128, 1, 256]
    - [23, 0.047]
  - - [2368, 5888, 1, 1280]
    - [2, 20.595]
  - - [5888, 256, 1, 1280]
    - [1, 10.912]
  - - [704, 1024, 1, 1280]
    - [0, 8.532]
  - - [2368, 1856, 1, 3328]
    - [7, 18.214]
  - - [2944, 704, 1, 256]
    - [11, 7.254]
  - - [2368, 6784, 1, 1280]
    - [5, 20.858]
  - - [1856, 4288, 1, 1280]
    - [5, 18.315]
  - - [704, 3584, 1, 256]
    - [5, 9.302]
  - - [704, 2944, 1, 3328]
    - [0, 13.805]
  - - [1856, 5056, 1, 3328]
    - [2, 20.851]
  - - [3584, 5056, 1, 1280]
    - [7, 21.139]
  - - [2944, 1024, 1, 3328]
    - [5, 15.405]
  - - [256, 4288, 1, 256]
    - [10, 5.027]
  - - [1408, 6784, 1, 256]
    - [4, 15.261]
  - - [6784, 1408, 1, 3328]
    - [2, 21.542]
  - - [1024, 2368, 1, 1280]
    - [2, 14.42]
  - - [704, 64, 1, 256]
    - [20, 0.348]
  - - [256, 2368, 1, 3328]
    - [0, 8.846]
  - - [6784, 2944, 1, 1280]
    - [7, 21.283]
  - - [3584, 448, 1, 1280]
    - [10, 9.189]
  - - [2944, 6784, 1, 3328]
    - [2, 22.211]
  - - [448, 5056, 1, 1280]
    - [36, 13.272]
  - - [64, 2944, 1, 3328]
    - [3, 4.385]
  - - [128, 1408, 1, 256]
    - [30, 1.096]
  - - [64, 64, 1, 1280]
    - [29, 0.069]
  - - [5888, 704, 1, 256]
    - [6, 10.703]
  - - [256, 5888, 1, 3328]
    - [28, 12.564]
  - - [6784, 4288, 1, 256]
    - [4, 18.543]
  - - [5888, 256, 1, 256]
    - [1, 6.861]
  - - [128, 3584, 1, 256]
    - [6, 2.818]
  - - [6784, 1024, 1, 1280]
    - [4, 17.77]
  - - [704, 448, 1, 1280]
    - [18, 4.827]
  - - [128, 64, 1, 3328]
    - [3, 0.2]
  - - [448, 64, 1, 256]
    - [20, 0.18]
  - - [2944, 704, 1, 1280]
    - [28, 12.124]
  - - [6784, 3584, 1, 1280]
    - [2, 22.141]
  - - [1024, 704, 1, 1280]
    - [14, 8.851]
  - - [1408, 2944, 1, 1280]
    - [8, 14.913]
  - - [256, 1856, 1, 256]
    - [14, 3.09]
  - - [1408, 2368, 1, 3328]
    - [5, 17.061]
  - - [1024, 3584, 1, 256]
    - [9, 12.111]
  - - [2368, 2944, 1, 256]
    - [5, 14.571]
  - - [704, 1856, 1, 1280]
    - [6, 11.768]
  - - [1408, 256, 1, 3328]
    - [38, 5.493]
  - - [5888, 128, 1, 256]
    - [0, 3.833]
  - - [2944, 5888, 1, 256]
    - [31, 17.297]
  - - [3584, 1856, 1, 256]
    - [5, 14.794]
  - - [2368, 448, 1, 256]
    - [0, 5.809]
  - - [4288, 256, 1, 3328]
    - [0, 11.584]
  - - [1408, 64, 1, 256]
    - [22, 0.53]
  - - [704, 4288, 1, 3328]
    - [9, 15.457]
  - - [4288, 2944, 1, 1280]
    - [5, 20.402]
  - - [1024, 64, 1, 256]
    - [12, 0.399]
  - - [64, 2368, 1, 256]
    - [3, 1.136]
  - - [4288, 5056, 1, 3328]
    - [2, 22.084]
  - - [2944, 256, 1, 256]
    - [14, 4.307]
  - - [1024, 128, 1, 3328]
    - [3, 3.255]
  - - [256, 5056, 1, 3328]
    - [11, 13.382]
  - - [5056, 2368, 1, 256]
    - [8, 14.342]
  - - [4288, 704, 1, 3328]
    - [9, 15.309]
  - - [448, 3584, 1, 256]
    - [1, 6.408]
  - - [2368, 64, 1, 1280]
    - [13, 2.395]
  - - [1408, 448, 1, 256]
    - [1, 3.104]
  - - [2944, 5888, 1, 1280]
    - [4, 21.486]
  - - [5888, 3584, 1, 256]
    - [5, 17.356]
  - - [1408, 1856, 1, 3328]
    - [9, 15.705]
  - - [6784, 1408, 1, 1280]
    - [5, 20.169]
  - - [704, 2944, 1, 256]
    - [1, 7.15]
  - - [4288, 64, 1, 256]
    - [23, 1.662]
  - - [2944, 5888, 1, 3328]
    - [4, 22.299]
  - - [64, 4288, 1, 1280]
    - [22, 4.351]
  - - [6784, 64, 1, 1280]
    - [1, 6.339]
  - - [1408, 6784, 1, 3328]
    - [7, 21.586]
  - - [1408, 64, 1, 3328]
    - [34, 2.403]
  - - [448, 1024, 1, 3328]
    - [38, 7.083]
  - - [448, 4288, 1, 3328]
    - [2, 15.529]
  - - [704, 2368, 1, 256]
    - [1, 7.68]
  - - [2944, 448, 1, 1280]
    - [6, 11.381]
  - - [5888, 2368, 1, 3328]
    - [7, 21.536]
  - - [4288, 5056, 1, 256]
    - [7, 17.663]
  - - [4288, 448, 1, 1280]
    - [10, 11.578]
  - - [5888, 704, 1, 3328]
    - [2, 17.096]
  - - [4288, 3584, 1, 3328]
    - [19, 22.011]
  - - [5056, 128, 1, 256]
    - [1, 3.797]
  - - [128, 64, 1, 256]
    - [29, 0.052]
  - - [448, 1024, 1, 256]
    - [26, 2.902]
  - - [6784, 6784, 1, 3328]
    - [2, 23.424]
  - - [704, 5056, 1, 3328]
    - [2, 18.048]
  - - [1024, 64, 1, 1280]
    - [12, 1.263]
  - - [64, 1024, 1, 3328]
    - [34, 1.723]
  - - [2368, 2944, 1, 3328]
    - [2, 19.524]
  - - [448, 448, 1, 1280]
    - [22, 3.322]
  - - [2368, 3584, 1, 256]
    - [9, 15.978]
  - - [1024, 256, 1, 1280]
    - [29, 3.922]
  - - [128, 5056, 1, 1280]
    - [0, 7.859]
  - - [3584, 2368, 1, 1280]
    - [2, 19.774]
  - - [1856, 1856, 1, 256]
    - [8, 11.123]
  - - [4288, 1408, 1, 3328]
    - [2, 18.672]
  - - [3584, 64, 1, 3328]
    - [3, 5.404]
  - - [4288, 5056, 1, 1280]
    - [2, 21.541]
  - - [5888, 6784, 1, 1280]
    - [2, 22.847]
  - - [256, 1024, 1, 3328]
    - [26, 4.023]
  - - [1856, 64, 1, 3328]
    - [13, 2.757]
  - - [5888, 1408, 1, 3328]
    - [7, 20.025]
  - - [256, 5056, 1, 256]
    - [6, 5.384]
  - - [1408, 1024, 1, 256]
    - [11, 5.932]
  - - [448, 256, 1, 256]
    - [3, 0.691]
  - - [1408, 256, 1, 256]
    - [38, 1.949]
  - - [2368, 5056, 1, 256]
    - [8, 13.679]
  - - [128, 5888, 1, 3328]
    - [1, 10.262]
  - - [1024, 5056, 1, 256]
    - [7, 11.62]
  - - [2368, 1408, 1, 3328]
    - [9, 17.175]
  - - [5888, 448, 1, 256]
    - [8, 9.332]
  - - [6784, 5056, 1, 1280]
    - [2, 22.118]
  - - [4288, 6784, 1, 1280]
    - [2, 22.272]
  - - [128, 704, 1, 256]
    - [12, 0.644]
  - - [1024, 128, 1, 256]
    - [30, 1.01]
  - - [448, 128, 1, 1280]
    - [34, 1.14]
  - - [1024, 64, 1, 3328]
    - [34, 1.65]
  - - [64, 3584, 1, 1280]
    - [43, 3.399]
  - - [6784, 1408, 1, 256]
    - [4, 16.822]
  - - [5888, 4288, 1, 256]
    - [31, 17.67]
  - - [5056, 5888, 1, 256]
    - [4, 17.888]
  - - [2368, 1024, 1, 256]
    - [8, 8.407]
  - - [1856, 6784, 1, 1280]
    - [2, 20.955]
  - - [3584, 128, 1, 1280]
    - [41, 6.466]
  - - [4288, 128, 1, 256]
    - [1, 3.394]
  - - [4288, 3584, 1, 256]
    - [2, 17.985]
  - - [64, 256, 1, 3328]
    - [13, 0.414]
  - - [5056, 1856, 1, 1280]
    - [4, 19.923]
  - - [1408, 1024, 1, 3328]
    - [11, 15.103]
  - - [2368, 256, 1, 3328]
    - [0, 9.045]
  - - [5888, 3584, 1, 1280]
    - [19, 21.891]
  - - [5888, 128, 1, 1280]
    - [14, 9.206]
  - - [1024, 2944, 1, 256]
    - [9, 9.017]
  - - [448, 6784, 1, 1280]
    - [5, 14.447]
  - - [256, 3584, 1, 1280]
    - [14, 9.955]
  - - [2944, 1856, 1, 1280]
    - [19, 17.233]
  - - [128, 5888, 1, 256]
    - [1, 4.265]
  - - [2368, 3584, 1, 3328]
    - [7, 20.651]
  - - [3584, 5888, 1, 3328]
    - [7, 22.37]
  - - [2944, 3584, 1, 1280]
    - [7, 20.421]
  - - [1856, 5888, 1, 1280]
    - [7, 20.006]
  - - [256, 256, 1, 1280]
    - [3, 1.184]
  - - [5056, 448, 1, 3328]
    - [15, 14.747]
  - - [4288, 1408, 1, 256]
    - [7, 13.627]
  - - [3584, 64, 1, 256]
    - [22, 1.204]
  - - [64, 1856, 1, 3328]
    - [44, 3.081]
  - - [1024, 1024, 1, 256]
    - [15, 4.72]
  - - [4288, 2368, 1, 1280]
    - [2, 19.745]
  - - [2944, 5056, 1, 256]
    - [19, 17.192]
  - - [256, 128, 1, 3328]
    - [17, 0.795]
  - - [6784, 2368, 1, 256]
    - [8, 15.888]
  - - [1024, 1024, 1, 1024]
    - [14, 8.91]
  - - [2944, 64, 1, 3328]
    - [3, 4.146]
  - - [128, 1408, 1, 3328]
    - [30, 4.083]
  - - [1856, 2944, 1, 256]
    - [2, 12.766]
  - - [64, 5888, 1, 1280]
    - [14, 5.14]
  - - [1856, 1408, 1, 1280]
    - [2, 14.978]
  - - [704, 1024, 1, 256]
    - [1, 3.867]
  - - [1024, 4288, 1, 1280]
    - [8, 15.909]
  - - [2368, 5056, 1, 3328]
    - [2, 21.105]
  - - [1024, 1856, 1, 3328]
    - [28, 15.377]
  - - [704, 704, 1, 1280]
    - [14, 6.55]
  - - [128, 2368, 1, 1280]
    - [29, 4.522]
  - - [3584, 256, 1, 1280]
    - [14, 10.773]
  - - [704, 3584, 1, 1280]
    - [2, 15.156]
  - - [128, 704, 1, 3328]
    - [3, 2.343]
  - - [4288, 6784, 1, 256]
    - [19, 18.492]
  - - [3584, 2944, 1, 3328]
    - [7, 21.437]
  - - [128, 1856, 1, 256]
    - [43, 1.677]
  - - [64, 4288, 1, 256]
    - [30, 1.578]
  - - [5888, 2944, 1, 256]
    - [8, 17.164]
  - - [5056, 128, 1, 1280]
    - [0, 8.049]
  - - [448, 1856, 1, 3328]
    - [10, 10.346]
  - - [5056, 4288, 1, 256]
    - [4, 17.339]
  - - [1024, 448, 1, 256]
    - [38, 3.137]
  - - [2944, 128, 1, 1280]
    - [14, 5.245]
  - - [6784, 1024, 1, 3328]
    - [19, 19.552]
  - - [64, 256, 1, 256]
    - [29, 0.086]
  - - [704, 256, 1, 3328]
    - [3, 4.073]
  - - [256, 704, 1, 1280]
    - [3, 3.123]
  - - [5888, 5888, 1, 1280]
    - [2, 22.595]
  - - [448, 5888, 1, 1280]
    - [2, 15.797]
  - - [2944, 1408, 1, 256]
    - [6, 10.805]
  - - [256, 2944, 1, 1280]
    - [27, 8.586]
  - - [1024, 2944, 1, 1280]
    - [7, 14.394]
  - - [2368, 5888, 1, 3328]
    - [7, 21.363]
  - - [704, 1024, 1, 3328]
    - [40, 9.135]
  - - [2368, 1856, 1, 1280]
    - [8, 15.861]
  - - [1856, 448, 1, 1280]
    - [0, 9.861]
  - - [128, 6784, 1, 256]
    - [11, 4.812]
  - - [5888, 4288, 1, 3328]
    - [7, 22.046]
  - - [6784, 704, 1, 1280]
    - [21, 16.976]
  - - [5056, 448, 1, 256]
    - [6, 8.243]
  - - [1856, 5056, 1, 1280]
    - [5, 19.864]
  - - [2944, 1024, 1, 1280]
    - [2, 14.748]
  - - [2368, 4288, 1, 256]
    - [5, 16.163]
  - - [1024, 2368, 1, 3328]
    - [9, 14.974]
  - - [64, 704, 1, 3328]
    - [17, 1.162]
  - - [704, 1408, 1, 256]
    - [40, 3.312]
  - - [4288, 5888, 1, 3328]
    - [7, 22.916]
  - - [256, 1408, 1, 256]
    - [1, 2.14]
  - - [448, 2944, 1, 1280]
    - [36, 11.585]
  - - [2944, 6784, 1, 1280]
    - [2, 21.718]
  - - [256, 6784, 1, 1280]
    - [6, 10.283]
  - - [1856, 3584, 1, 256]
    - [21, 14.351]
  - - [128, 448, 1, 3328]
    - [34, 1.63]
  - - [1856, 256, 1, 256]
    - [1, 1.142]
  - - [128, 2368, 1, 3328]
    - [27, 4.769]
  - - [256, 5888, 1, 1280]
    - [45, 11.695]
  - - [448, 2368, 1, 3328]
    - [40, 11.175]
  - - [64, 1408, 1, 256]
    - [30, 0.651]
  - - [2944, 2368, 1, 256]
    - [39, 14.516]
  - - [1856, 448, 1, 256]
    - [0, 4.008]
  - - [1024, 1856, 1, 256]
    - [11, 7.342]
  - - [6784, 3584, 1, 3328]
    - [2, 22.959]
  - - [1024, 704, 1, 3328]
    - [10, 9.738]
  - - [1024, 5888, 1, 3328]
    - [9, 18.52]
  - - [1408, 2368, 1, 1280]
    - [36, 14.485]
  - - [128, 1408, 1, 1280]
    - [34, 1.939]
  - - [256, 64, 1, 3328]
    - [3, 0.409]
  - - [128, 1856, 1, 3328]
    - [3, 5.177]
  - - [2944, 2944, 1, 256]
    - [7, 16.078]
  - - [6784, 256, 1, 256]
    - [8, 7.266]
  - - [128, 4288, 1, 1280]
    - [0, 6.746]
  - - [5888, 1408, 1, 256]
    - [2, 14.905]
  - - [128, 128, 1, 256]
    - [12, 0.093]
  - - [448, 704, 1, 3328]
    - [14, 4.797]
  - - [448, 1856, 1, 256]
    - [41, 4.258]
  - - [1856, 704, 1, 3328]
    - [11, 13.763]
  - - [5888, 6784, 1, 3328]
    - [2, 23.228]
  - - [704, 4288, 1, 1280]
    - [2, 14.767]
  - - [704, 256, 1, 256]
    - [22, 1.328]
  - - [6784, 448, 1, 3328]
    - [2, 15.551]
- null
