library/src/blas3/Tensile/Logic/asm_full/arcturus_Cijk_Alik_Bjlk_CB_GB.yaml
- {MinimumRequiredVersion: 4.26.0}
- arcturus
- gfx908
- [Device 7380, Device 7388, Device 738c, Device 7390]
    SolutionIndex: 0
    SolutionNameMin: Cijk_Alik_Bjlk_CB_GB_MT32x32x16_MI16x16x4x1_SN_1LDSB0_EPS1_GRVW1_LBSPP128_LPA4_NLCB1_PGR1_PLR5_SRVW1_TT1_16_WG32_8_1_WGM1
    SolutionIndex: 1
    SolutionNameMin: Cijk_Alik_Bjlk_CB_GB_MT32x32x16_MI16x16x4x1_SN_1LDSB0_EPS0_GRVW1_LBSPP128_LPA4_NLCB1_PGR2_PLR5_SRVW1_TT1_16_WG32_8_1_WGM1
    SolutionIndex: 2
    SolutionNameMin: Cijk_Alik_Bjlk_CB_GB_MT32x32x32_MI16x16x4x1_SN_1LDSB0_EPS0_GRVW1_LBSPP256_LPA4_NLCB1_PGR2_PLR9_SRVW1_TT1_16_WG32_8_1_WGM1
    SolutionIndex: 3
    SolutionNameMin: Cijk_Alik_Bjlk_CB_GB_MT32x32x16_MI16x16x4x1_SN_1LDSB0_EPS1_GRVW2_LBSPP128_LPA4_NLCB1_PGR1_PLR5_SRVW1_TT1_16_WG32_8_1_WGM1
    SolutionIndex: 4
    SolutionNameMin: Cijk_Alik_Bjlk_CB_GB_MT32x32x16_MI16x16x4x1_SN_1LDSB0_EPS0_GRVW2_LBSPP128_LPA4_NLCB1_PGR2_PLR5_SRVW1_TT1_16_WG32_8_1_WGM1
    SolutionIndex: 5
    SolutionNameMin: Cijk_Alik_Bjlk_CB_GB_MT32x32x32_MI16x16x4x1_SN_1LDSB0_EPS1_GRVW2_LBSPP256_LPA4_NLCB1_PGR1_PLR9_SRVW1_TT1_16_WG32_8_1_WGM1
    SolutionIndex: 6
    SolutionNameMin: Cijk_Alik_Bjlk_CB_GB_MT32x32x32_MI16x16x4x1_SN_1LDSB0_EPS0_GRVW2_LBSPP256_LPA4_NLCB1_PGR2_PLR9_SRVW1_TT1_16_WG32_8_1_WGM1
    SolutionIndex: 7
    SolutionNameMin: Cijk_Alik_Bjlk_CB_GB_MT32x32x16_MI16x16x4x1_SN_1LDSB0_EPS0_GRVW1_LBSPP128_LPA4_NLCB1_PGR2_PLR5_SRVW1_TT1_16_WG32_8_1_WGM2
    SolutionIndex: 8
    SolutionNameMin: Cijk_Alik_Bjlk_CB_GB_MT32x32x32_MI16x16x4x1_SN_1LDSB0_EPS1_GRVW1_LBSPP256_LPA4_NLCB1_PGR1_PLR9_SRVW1_TT1_16_WG32_8_1_WGM2
    SolutionIndex: 9
    SolutionNameMin: Cijk_Alik_Bjlk_CB_GB_MT32x32x16_MI16x16x4x1_SN_1LDSB0_EPS1_GRVW2_LBSPP128_LPA4_NLCB1_PGR1_PLR5_SRVW1_TT1_16_WG32_8_1_WGM2
    SolutionIndex: 10
    SolutionNameMin: Cijk_Alik_Bjlk_CB_GB_MT32x32x16_MI16x16x4x1_SN_1LDSB0_EPS0_GRVW2_LBSPP128_LPA4_NLCB1_PGR2_PLR5_SRVW1_TT1_16_WG32_8_1_WGM2
    SolutionIndex: 11
    SolutionNameMin: Cijk_Alik_Bjlk_CB_GB_MT32x32x32_MI16x16x4x1_SN_1LDSB0_EPS1_GRVW2_LBSPP256_LPA4_NLCB1_PGR1_PLR9_SRVW1_TT1_16_WG32_8_1_WGM2
    SolutionIndex: 12
    SolutionNameMin: Cijk_Alik_Bjlk_CB_GB_MT32x32x16_MI16x16x4x1_SN_1LDSB0_EPS1_GRVW1_LBSPP128_LPA4_NLCB1_PGR1_PLR5_SRVW1_TT1_16_WG32_8_1_WGM15
    SolutionIndex: 13
    SolutionNameMin: Cijk_Alik_Bjlk_CB_GB_MT32x32x16_MI16x16x4x1_SN_1LDSB0_EPS1_GRVW2_LBSPP128_LPA4_NLCB1_PGR1_PLR5_SRVW1_TT1_16_WG32_8_1_WGM15
    SolutionIndex: 14
    SolutionNameMin: Cijk_Alik_Bjlk_CB_GB_MT32x32x16_MI16x16x4x1_SN_1LDSB0_EPS0_GRVW2_LBSPP128_LPA4_NLCB1_PGR2_PLR5_SRVW1_TT1_16_WG32_8_1_WGM15
    SolutionIndex: 15
    SolutionNameMin: Cijk_Alik_Bjlk_CB_GB_MT32x32x32_MI16x16x4x1_SN_1LDSB0_EPS1_GRVW2_LBSPP256_LPA4_NLCB1_PGR1_PLR9_SRVW1_TT1_16_WG32_8_1_WGM15
    SolutionIndex: 16
    SolutionNameMin: Cijk_Alik_Bjlk_CB_GB_MT32x32x32_MI16x16x4x1_SN_1LDSB0_EPS0_GRVW2_LBSPP256_LPA4_NLCB1_PGR2_PLR9_SRVW1_TT1_16_WG32_8_1_WGM15
    SolutionIndex: 17
    SolutionNameMin: Cijk_Alik_Bjlk_CB_GB_MT64x32x16_MI16x16x4x1_SN_1LDSB1_EPS1_GRVW1_LBSPP128_LPA4_NLCB1_PGR1_PLR5_SRVW1_TT2_16_WG32_8_1_WGM1
    SolutionIndex: 18
    SolutionNameMin: Cijk_Alik_Bjlk_CB_GB_MT32x64x16_MI16x16x4x1_SN_1LDSB1_EPS0_GRVW1_LBSPP128_LPA4_NLCB1_PGR2_PLR5_SRVW1_TT1_32_WG32_8_1_WGM1
    SolutionIndex: 19
    SolutionNameMin: Cijk_Alik_Bjlk_CB_GB_MT64x32x16_MI16x16x4x1_SN_1LDSB1_EPS0_GRVW1_LBSPP128_LPA4_NLCB1_PGR2_PLR5_SRVW1_TT2_16_WG32_8_1_WGM1
    SolutionIndex: 20
    SolutionNameMin: Cijk_Alik_Bjlk_CB_GB_MT64x32x16_MI16x16x4x1_SN_1LDSB1_EPS1_GRVW2_LBSPP128_LPA4_NLCB1_PGR1_PLR5_SRVW1_TT2_16_WG32_8_1_WGM1
    SolutionIndex: 21
    SolutionNameMin: Cijk_Alik_Bjlk_CB_GB_MT64x32x16_MI16x16x4x1_SN_1LDSB1_EPS0_GRVW2_LBSPP128_LPA4_NLCB1_PGR2_PLR5_SRVW1_TT2_16_WG32_8_1_WGM1
    SolutionIndex: 22
    SolutionNameMin: Cijk_Alik_Bjlk_CB_GB_MT32x64x16_MI16x16x4x1_SN_1LDSB1_EPS1_GRVW1_LBSPP128_LPA4_NLCB1_PGR1_PLR5_SRVW1_TT1_32_WG32_8_1_WGM2
    SolutionIndex: 23
    SolutionNameMin: Cijk_Alik_Bjlk_CB_GB_MT64x32x16_MI16x16x4x1_SN_1LDSB1_EPS1_GRVW1_LBSPP128_LPA4_NLCB1_PGR1_PLR5_SRVW1_TT2_16_WG32_8_1_WGM2
    SolutionIndex: 24
    SolutionNameMin: Cijk_Alik_Bjlk_CB_GB_MT64x32x16_MI16x16x4x1_SN_1LDSB1_EPS0_GRVW1_LBSPP128_LPA4_NLCB1_PGR2_PLR5_SRVW1_TT2_16_WG32_8_1_WGM2
    SolutionIndex: 25
    SolutionNameMin: Cijk_Alik_Bjlk_CB_GB_MT64x32x16_MI16x16x4x1_SN_1LDSB1_EPS1_GRVW2_LBSPP128_LPA4_NLCB1_PGR1_PLR5_SRVW1_TT2_16_WG32_8_1_WGM2
    SolutionIndex: 26
    SolutionNameMin: Cijk_Alik_Bjlk_CB_GB_MT64x32x16_MI16x16x4x1_SN_1LDSB1_EPS0_GRVW2_LBSPP128_LPA4_NLCB1_PGR2_PLR5_SRVW1_TT2_16_WG32_8_1_WGM2
    SolutionIndex: 27
    SolutionNameMin: Cijk_Alik_Bjlk_CB_GB_MT64x32x16_MI16x16x4x1_SN_1LDSB1_EPS1_GRVW1_LBSPP128_LPA4_NLCB1_PGR1_PLR5_SRVW1_TT2_16_WG32_8_1_WGM15
    SolutionIndex: 28
    SolutionNameMin: Cijk_Alik_Bjlk_CB_GB_MT64x32x16_MI16x16x4x1_SN_1LDSB1_EPS0_GRVW1_LBSPP128_LPA4_NLCB1_PGR2_PLR5_SRVW1_TT2_16_WG32_8_1_WGM15
    SolutionIndex: 29
    SolutionNameMin: Cijk_Alik_Bjlk_CB_GB_MT32x64x16_MI16x16x4x1_SN_1LDSB1_EPS1_GRVW2_LBSPP128_LPA4_NLCB1_PGR1_PLR5_SRVW1_TT1_32_WG32_8_1_WGM15
    SolutionIndex: 30
    SolutionNameMin: Cijk_Alik_Bjlk_CB_GB_MT64x32x16_MI16x16x4x1_SN_1LDSB1_EPS1_GRVW2_LBSPP128_LPA4_NLCB1_PGR1_PLR5_SRVW1_TT2_16_WG32_8_1_WGM15
    SolutionIndex: 31
    SolutionNameMin: Cijk_Alik_Bjlk_CB_GB_MT64x32x16_MI16x16x4x1_SN_1LDSB1_EPS0_GRVW2_LBSPP128_LPA4_NLCB1_PGR2_PLR5_SRVW1_TT2_16_WG32_8_1_WGM15
    SolutionIndex: 32
    SolutionNameMin: Cijk_Alik_Bjlk_CB_GB_MT64x32x32_MI16x16x4x1_SN_1LDSB1_EPS1_GRVW2_LBSPP256_LPA4_NLCB1_PGR1_PLR9_SRVW1_TT2_16_WG32_8_1_WGM15
    SolutionIndex: 33
    SolutionNameMin: Cijk_Alik_Bjlk_CB_GB_MT32x32x8_MI32x32x2x1_SN_1LDSB0_EPS1_GRVW1_LBSPP128_LPA2_NLCB1_PGR1_PLR5_SRVW1_TT1_32_WG32_2_1_WGM1
    SolutionIndex: 34
    SolutionNameMin: Cijk_Alik_Bjlk_CB_GB_MT16x16x16_MI16x16x4x1_SN_1LDSB0_EPS1_GRVW1_LBSPP128_LPA4_NLCB1_PGR1_PLR5_SRVW1_TT1_16_WG16_4_1_WGM1
    SolutionIndex: 35
    SolutionNameMin: Cijk_Alik_Bjlk_CB_GB_MT16x16x16_MI16x16x4x1_SN_1LDSB0_EPS0_GRVW1_LBSPP128_LPA4_NLCB1_PGR2_PLR5_SRVW1_TT1_16_WG16_4_1_WGM1
    SolutionIndex: 36
    SolutionNameMin: Cijk_Alik_Bjlk_CB_GB_MT16x16x16_MI16x16x4x1_SN_1LDSB0_EPS1_GRVW1_LBSPP128_LPA4_NLCB1_PGR1_PLR5_SRVW1_TT1_16_WG16_4_1_WGM2
    SolutionIndex: 37
    SolutionNameMin: Cijk_Alik_Bjlk_CB_GB_MT16x16x16_MI16x16x4x1_SN_1LDSB0_EPS1_GRVW1_LBSPP128_LPA4_NLCB1_PGR1_PLR5_SRVW1_TT1_16_WG16_4_1_WGM15
    SolutionIndex: 38
    SolutionNameMin: Cijk_Alik_Bjlk_CB_GB_MT32x32x8_MI32x32x2x1_SN_1LDSB1_EPS1_GRVW2_LBSPP128_LPA2_NLCB1_PGR1_PLR5_SRVW1_TT1_32_WG32_2_1_WGM1
    SolutionIndex: 39
    SolutionNameMin: Cijk_Alik_Bjlk_CB_GB_MT32x32x8_MI32x32x2x1_SN_1LDSB1_EPS0_GRVW2_LBSPP128_LPA2_NLCB1_PGR2_PLR5_SRVW1_TT1_32_WG32_2_1_WGM1
    SolutionIndex: 40
    SolutionNameMin: Cijk_Alik_Bjlk_CB_GB_MT32x32x8_MI32x32x2x1_SN_1LDSB1_EPS1_GRVW2_LBSPP128_LPA2_NLCB1_PGR1_PLR5_SRVW1_TT1_32_WG32_2_1_WGM2
    SolutionIndex: 41
    SolutionNameMin: Cijk_Alik_Bjlk_CB_GB_MT32x32x8_MI32x32x2x1_SN_1LDSB1_EPS0_GRVW2_LBSPP128_LPA2_NLCB1_PGR2_PLR5_SRVW1_TT1_32_WG32_2_1_WGM2
    SolutionIndex: 42
    SolutionNameMin: Cijk_Alik_Bjlk_CB_GB_MT32x32x8_MI32x32x2x1_SN_1LDSB1_EPS1_GRVW2_LBSPP128_LPA2_NLCB1_PGR1_PLR5_SRVW1_TT1_32_WG32_2_1_WGM15
    SolutionIndex: 43
    SolutionNameMin: Cijk_Alik_Bjlk_CB_GB_MT32x32x8_MI32x32x2x1_SN_1LDSB1_EPS0_GRVW2_LBSPP128_LPA2_NLCB1_PGR2_PLR5_SRVW1_TT1_32_WG32_2_1_WGM15
    SolutionIndex: 44
    SolutionNameMin: Cijk_Alik_Bjlk_CB_GB_MT96x96x16_MI16x16x4x1_SN_1LDSB1_EPS1_GRVW2_LBSPP128_LPA4_NLCB3_PGR1_PLR5_SRVW0_TT3_48_WG32_8_1_WGM1
    SolutionIndex: 45
    SolutionNameMin: Cijk_Alik_Bjlk_CB_GB_MT96x96x16_MI16x16x4x1_SN_1LDSB1_EPS0_GRVW2_LBSPP128_LPA4_NLCB3_PGR2_PLR5_SRVW0_TT3_48_WG32_8_1_WGM1
    SolutionIndex: 46
    SolutionNameMin: Cijk_Alik_Bjlk_CB_GB_MT96x96x16_MI16x16x4x1_SN_1LDSB1_EPS1_GRVW1_LBSPP128_LPA4_NLCB3_PGR1_PLR5_SRVW0_TT3_48_WG32_8_1_WGM2
    SolutionIndex: 47
    SolutionNameMin: Cijk_Alik_Bjlk_CB_GB_MT96x96x16_MI16x16x4x1_SN_1LDSB1_EPS0_GRVW1_LBSPP128_LPA4_NLCB3_PGR2_PLR5_SRVW0_TT3_48_WG32_8_1_WGM2
    SolutionIndex: 48
    SolutionNameMin: Cijk_Alik_Bjlk_CB_GB_MT96x96x16_MI16x16x4x1_SN_1LDSB1_EPS1_GRVW2_LBSPP128_LPA4_NLCB3_PGR1_PLR5_SRVW0_TT3_48_WG32_8_1_WGM2
    SolutionIndex: 49
    SolutionNameMin: Cijk_Alik_Bjlk_CB_GB_MT96x96x16_MI16x16x4x1_SN_1LDSB1_EPS0_GRVW2_LBSPP128_LPA4_NLCB3_PGR2_PLR5_SRVW0_TT3_48_WG32_8_1_WGM2
    SolutionIndex: 50
    SolutionNameMin: Cijk_Alik_Bjlk_CB_GB_MT96x96x16_MI16x16x4x1_SN_1LDSB1_EPS1_GRVW2_LBSPP128_LPA4_NLCB3_PGR1_PLR5_SRVW0_TT3_48_WG32_8_1_WGM15
    SolutionIndex: 51
    SolutionNameMin: Cijk_Alik_Bjlk_CB_GB_MT96x96x16_MI16x16x4x1_SN_1LDSB1_EPS0_GRVW2_LBSPP128_LPA4_NLCB3_PGR2_PLR5_SRVW0_TT3_48_WG32_8_1_WGM15
- - - [192, 192, 1000, 32, 192, 192, 32, 192]
    - [18, 5014.0]
  - - [1536, 1536, 168, 32, 1536, 1536, 32, 1536]
    - [29, 4814.0]
  - - [1536, 32, 168, 1536, 1536, 1536, 1536, 32]
    - [32, 6725.0]
  - - [32, 1536, 168, 32, 32, 32, 32, 1536]
    - [22, 3626.0]
  - - [384, 384, 1024, 384, 384, 384, 384, 384]
    - [29, 7812.0]
  - - [1, 1, 1000, 1, 1, 1, 1, 1]
    - [33, 0.0]
  - - [2, 2, 1000, 2, 2, 2, 2, 2]
    - [33, 1.0]
  - - [3, 3, 1000, 3, 3, 3, 3, 3]
    - [34, 4.0]
  - - [4, 4, 1000, 4, 4, 4, 4, 4]
    - [34, 10.0]
  - - [5, 5, 1000, 5, 5, 5, 5, 5]
    - [34, 20.0]
  - - [6, 6, 1000, 6, 6, 6, 6, 6]
    - [37, 34.0]
  - - [7, 7, 1000, 7, 7, 7, 7, 7]
    - [34, 52.0]
  - - [8, 8, 1000, 8, 8, 8, 8, 8]
    - [34, 80.0]
  - - [9, 9, 1000, 9, 9, 9, 9, 9]
    - [34, 104.0]
  - - [10, 10, 1000, 10, 10, 10, 10, 10]
    - [37, 142.0]
  - - [11, 11, 1000, 11, 11, 11, 11, 11]
    - [36, 191.0]
  - - [12, 12, 1000, 12, 12, 12, 12, 12]
    - [37, 243.0]
  - - [13, 13, 1000, 13, 13, 13, 13, 13]
    - [35, 286.0]
  - - [14, 14, 1000, 14, 14, 14, 14, 14]
    - [37, 361.0]
  - - [15, 15, 1000, 15, 15, 15, 15, 15]
    - [34, 444.0]
  - - [16, 16, 1000, 16, 16, 16, 16, 16]
    - [34, 602.0]
  - - [17, 17, 1000, 17, 17, 17, 17, 17]
    - [39, 379.0]
  - - [18, 18, 1000, 18, 18, 18, 18, 18]
    - [43, 447.0]
  - - [19, 19, 1000, 19, 19, 19, 19, 19]
    - [41, 536.0]
  - - [20, 20, 1000, 20, 20, 20, 20, 20]
    - [39, 588.0]
  - - [21, 21, 1000, 21, 21, 21, 21, 21]
    - [39, 643.0]
  - - [22, 22, 1000, 22, 22, 22, 22, 22]
    - [39, 744.0]
  - - [23, 23, 1000, 23, 23, 23, 23, 23]
    - [39, 869.0]
  - - [24, 24, 1000, 24, 24, 24, 24, 24]
    - [38, 960.0]
  - - [25, 25, 1000, 25, 25, 25, 25, 25]
    - [40, 930.0]
  - - [26, 26, 1000, 26, 26, 26, 26, 26]
    - [38, 1041.0]
  - - [27, 27, 1000, 27, 27, 27, 27, 27]
    - [40, 1103.0]
  - - [28, 28, 1000, 28, 28, 28, 28, 28]
    - [38, 1204.0]
  - - [29, 29, 1000, 29, 29, 29, 29, 29]
    - [38, 1244.0]
  - - [30, 30, 1000, 30, 30, 30, 30, 30]
    - [42, 1361.0]
  - - [31, 31, 1000, 31, 31, 31, 31, 31]
    - [42, 1484.0]
  - - [32, 32, 1000, 32, 32, 32, 32, 32]
    - [38, 1766.0]
  - - [33, 33, 1000, 33, 33, 33, 33, 33]
    - [28, 932.0]
  - - [34, 34, 1000, 34, 34, 34, 34, 34]
    - [24, 1013.0]
  - - [35, 35, 1000, 35, 35, 35, 35, 35]
    - [24, 1096.0]
  - - [36, 36, 1000, 36, 36, 36, 36, 36]
    - [24, 1188.0]
  - - [37, 37, 1000, 37, 37, 37, 37, 37]
    - [20, 1204.0]
  - - [38, 38, 1000, 38, 38, 38, 38, 38]
    - [24, 1306.0]
  - - [39, 39, 1000, 39, 39, 39, 39, 39]
    - [28, 1407.0]
  - - [40, 40, 1000, 40, 40, 40, 40, 40]
    - [21, 1518.0]
  - - [41, 41, 1000, 41, 41, 41, 41, 41]
    - [24, 1514.0]
  - - [42, 42, 1000, 42, 42, 42, 42, 42]
    - [19, 1625.0]
  - - [43, 43, 1000, 43, 43, 43, 43, 43]
    - [24, 1737.0]
  - - [44, 44, 1000, 44, 44, 44, 44, 44]
    - [19, 1875.0]
  - - [45, 45, 1000, 45, 45, 45, 45, 45]
    - [26, 1858.0]
  - - [46, 46, 1000, 46, 46, 46, 46, 46]
    - [24, 1995.0]
  - - [47, 47, 1000, 47, 47, 47, 47, 47]
    - [26, 2097.0]
  - - [48, 48, 1000, 48, 48, 48, 48, 48]
    - [21, 2716.0]
  - - [49, 49, 1000, 49, 49, 49, 49, 49]
    - [31, 2407.0]
  - - [50, 50, 1000, 50, 50, 50, 50, 50]
    - [26, 2561.0]
  - - [51, 51, 1000, 51, 51, 51, 51, 51]
    - [20, 2674.0]
  - - [52, 52, 1000, 52, 52, 52, 52, 52]
    - [20, 2853.0]
  - - [53, 53, 1000, 53, 53, 53, 53, 53]
    - [20, 2811.0]
  - - [54, 54, 1000, 54, 54, 54, 54, 54]
    - [20, 2955.0]
  - - [55, 55, 1000, 55, 55, 55, 55, 55]
    - [20, 3076.0]
  - - [56, 56, 1000, 56, 56, 56, 56, 56]
    - [30, 3341.0]
  - - [57, 57, 1000, 57, 57, 57, 57, 57]
    - [21, 3224.0]
  - - [58, 58, 1000, 58, 58, 58, 58, 58]
    - [25, 3416.0]
  - - [59, 59, 1000, 59, 59, 59, 59, 59]
    - [25, 3512.0]
  - - [60, 60, 1000, 60, 60, 60, 60, 60]
    - [21, 3649.0]
  - - [61, 61, 1000, 61, 61, 61, 61, 61]
    - [27, 3666.0]
  - - [62, 62, 1000, 62, 62, 62, 62, 62]
    - [30, 3824.0]
  - - [63, 63, 1000, 63, 63, 63, 63, 63]
    - [26, 3937.0]
  - - [64, 64, 1000, 64, 64, 64, 64, 64]
    - [30, 4387.0]
  - - [65, 65, 1000, 65, 65, 65, 65, 65]
    - [44, 2054.0]
  - - [66, 66, 1000, 66, 66, 66, 66, 66]
    - [48, 2160.0]
  - - [67, 67, 1000, 67, 67, 67, 67, 67]
    - [50, 2227.0]
  - - [68, 68, 1000, 68, 68, 68, 68, 68]
    - [48, 2338.0]
  - - [69, 69, 1000, 69, 69, 69, 69, 69]
    - [45, 2284.0]
  - - [70, 70, 1000, 70, 70, 70, 70, 70]
    - [50, 2387.0]
  - - [71, 71, 1000, 71, 71, 71, 71, 71]
    - [48, 2420.0]
  - - [72, 72, 1000, 72, 72, 72, 72, 72]
    - [50, 2748.0]
  - - [73, 73, 1000, 73, 73, 73, 73, 73]
    - [51, 2468.0]
  - - [74, 74, 1000, 74, 74, 74, 74, 74]
    - [49, 2545.0]
  - - [75, 75, 1000, 75, 75, 75, 75, 75]
    - [46, 2642.0]
  - - [76, 76, 1000, 76, 76, 76, 76, 76]
    - [45, 2790.0]
  - - [77, 77, 1000, 77, 77, 77, 77, 77]
    - [45, 2818.0]
  - - [78, 78, 1000, 78, 78, 78, 78, 78]
    - [49, 2899.0]
  - - [79, 79, 1000, 79, 79, 79, 79, 79]
    - [51, 3008.0]
  - - [80, 80, 1000, 80, 80, 80, 80, 80]
    - [45, 3342.0]
  - - [81, 81, 1000, 81, 81, 81, 81, 81]
    - [51, 3009.0]
  - - [82, 82, 1000, 82, 82, 82, 82, 82]
    - [45, 3134.0]
  - - [83, 83, 1000, 83, 83, 83, 83, 83]
    - [47, 3165.0]
  - - [84, 84, 1000, 84, 84, 84, 84, 84]
    - [26, 3294.0]
  - - [85, 85, 1000, 85, 85, 85, 85, 85]
    - [26, 3278.0]
  - - [86, 86, 1000, 86, 86, 86, 86, 86]
    - [25, 3402.0]
  - - [87, 87, 1000, 87, 87, 87, 87, 87]
    - [26, 3506.0]
  - - [88, 88, 1000, 88, 88, 88, 88, 88]
    - [49, 3872.0]
  - - [89, 89, 1000, 89, 89, 89, 89, 89]
    - [31, 3644.0]
  - - [90, 90, 1000, 90, 90, 90, 90, 90]
    - [31, 3780.0]
  - - [91, 91, 1000, 91, 91, 91, 91, 91]
    - [26, 3878.0]
  - - [92, 92, 1000, 92, 92, 92, 92, 92]
    - [31, 4057.0]
  - - [93, 93, 1000, 93, 93, 93, 93, 93]
    - [26, 3991.0]
  - - [94, 94, 1000, 94, 94, 94, 94, 94]
    - [26, 4131.0]
  - - [95, 95, 1000, 95, 95, 95, 95, 95]
    - [31, 4216.0]
  - - [96, 96, 1000, 96, 96, 96, 96, 96]
    - [51, 5226.0]
  - - [97, 97, 1000, 97, 97, 97, 97, 97]
    - [25, 3326.0]
  - - [98, 98, 1000, 98, 98, 98, 98, 98]
    - [25, 3455.0]
  - - [99, 99, 1000, 99, 99, 99, 99, 99]
    - [25, 3531.0]
  - - [100, 100, 1000, 100, 100, 100, 100, 100]
    - [25, 3738.0]
  - - [101, 101, 1000, 101, 101, 101, 101, 101]
    - [25, 3586.0]
  - - [102, 102, 1000, 102, 102, 102, 102, 102]
    - [25, 3685.0]
  - - [103, 103, 1000, 103, 103, 103, 103, 103]
    - [25, 3762.0]
  - - [104, 104, 1000, 104, 104, 104, 104, 104]
    - [20, 4121.0]
  - - [105, 105, 1000, 105, 105, 105, 105, 105]
    - [25, 3915.0]
  - - [106, 106, 1000, 106, 106, 106, 106, 106]
    - [25, 4053.0]
  - - [107, 107, 1000, 107, 107, 107, 107, 107]
    - [25, 4129.0]
  - - [108, 108, 1000, 108, 108, 108, 108, 108]
    - [25, 4349.0]
  - - [109, 109, 1000, 109, 109, 109, 109, 109]
    - [25, 4277.0]
  - - [110, 110, 1000, 110, 110, 110, 110, 110]
    - [25, 4417.0]
  - - [111, 111, 1000, 111, 111, 111, 111, 111]
    - [25, 4467.0]
  - - [112, 112, 1000, 112, 112, 112, 112, 112]
    - [20, 5068.0]
  - - [113, 113, 1000, 113, 113, 113, 113, 113]
    - [25, 4485.0]
  - - [114, 114, 1000, 114, 114, 114, 114, 114]
    - [25, 4641.0]
  - - [115, 115, 1000, 115, 115, 115, 115, 115]
    - [25, 4702.0]
  - - [116, 116, 1000, 116, 116, 116, 116, 116]
    - [25, 5003.0]
  - - [117, 117, 1000, 117, 117, 117, 117, 117]
    - [25, 4825.0]
  - - [118, 118, 1000, 118, 118, 118, 118, 118]
    - [25, 4993.0]
  - - [119, 119, 1000, 119, 119, 119, 119, 119]
    - [25, 5029.0]
  - - [120, 120, 1000, 120, 120, 120, 120, 120]
    - [20, 5488.0]
  - - [121, 121, 1000, 121, 121, 121, 121, 121]
    - [25, 5152.0]
  - - [122, 122, 1000, 122, 122, 122, 122, 122]
    - [25, 5346.0]
  - - [123, 123, 1000, 123, 123, 123, 123, 123]
    - [25, 5358.0]
  - - [124, 124, 1000, 124, 124, 124, 124, 124]
    - [20, 5704.0]
  - - [125, 125, 1000, 125, 125, 125, 125, 125]
    - [20, 5467.0]
  - - [126, 126, 1000, 126, 126, 126, 126, 126]
    - [20, 5601.0]
  - - [127, 127, 1000, 127, 127, 127, 127, 127]
    - [20, 5563.0]
  - - [128, 128, 1000, 128, 128, 128, 128, 128]
    - [20, 6436.0]
  - - [129, 129, 1000, 129, 129, 129, 129, 129]
    - [20, 3512.0]
  - - [130, 130, 1000, 130, 130, 130, 130, 130]
    - [20, 3597.0]
  - - [131, 131, 1000, 131, 131, 131, 131, 131]
    - [20, 3665.0]
  - - [132, 132, 1000, 132, 132, 132, 132, 132]
    - [20, 3799.0]
  - - [133, 133, 1000, 133, 133, 133, 133, 133]
    - [20, 3725.0]
  - - [134, 134, 1000, 134, 134, 134, 134, 134]
    - [20, 3815.0]
  - - [135, 135, 1000, 135, 135, 135, 135, 135]
    - [20, 3894.0]
  - - [136, 136, 1000, 136, 136, 136, 136, 136]
    - [20, 4073.0]
  - - [137, 137, 1000, 137, 137, 137, 137, 137]
    - [20, 3947.0]
  - - [138, 138, 1000, 138, 138, 138, 138, 138]
    - [20, 4044.0]
  - - [139, 139, 1000, 139, 139, 139, 139, 139]
    - [20, 4110.0]
  - - [140, 140, 1000, 140, 140, 140, 140, 140]
    - [20, 4239.0]
  - - [141, 141, 1000, 141, 141, 141, 141, 141]
    - [20, 4172.0]
  - - [142, 142, 1000, 142, 142, 142, 142, 142]
    - [20, 4267.0]
  - - [143, 143, 1000, 143, 143, 143, 143, 143]
    - [20, 4337.0]
  - - [144, 144, 1000, 144, 144, 144, 144, 144]
    - [20, 4804.0]
  - - [145, 145, 1000, 145, 145, 145, 145, 145]
    - [20, 4440.0]
  - - [146, 146, 1000, 146, 146, 146, 146, 146]
    - [20, 4533.0]
  - - [147, 147, 1000, 147, 147, 147, 147, 147]
    - [20, 4578.0]
  - - [148, 148, 1000, 148, 148, 148, 148, 148]
    - [20, 4821.0]
  - - [149, 149, 1000, 149, 149, 149, 149, 149]
    - [20, 4689.0]
  - - [150, 150, 1000, 150, 150, 150, 150, 150]
    - [20, 4818.0]
  - - [32, 32, 8, 32, 32, 32, 32, 32]
    - [12, 54.0]
  - - [32, 32, 8, 64, 32, 32, 64, 32]
    - [9, 90.0]
  - - [32, 32, 8, 128, 32, 32, 128, 32]
    - [11, 127.0]
  - - [32, 32, 8, 256, 32, 32, 256, 32]
    - [6, 185.0]
  - - [32, 32, 8, 512, 32, 32, 512, 32]
    - [5, 244.0]
  - - [32, 32, 8, 1024, 32, 32, 1024, 32]
    - [11, 296.0]
  - - [32, 32, 8, 2048, 32, 32, 2048, 32]
    - [6, 323.0]
  - - [32, 64, 8, 32, 32, 32, 32, 64]
    - [8, 92.0]
  - - [32, 64, 8, 64, 32, 32, 64, 64]
    - [3, 162.0]
  - - [32, 64, 8, 128, 32, 32, 128, 64]
    - [10, 247.0]
  - - [32, 64, 8, 256, 32, 32, 256, 64]
    - [16, 372.0]
  - - [32, 64, 8, 512, 32, 32, 512, 64]
    - [6, 490.0]
  - - [32, 64, 8, 1024, 32, 32, 1024, 64]
    - [6, 591.0]
  - - [32, 64, 8, 2048, 32, 32, 2048, 64]
    - [5, 664.0]
  - - [32, 128, 8, 32, 32, 32, 32, 128]
    - [6, 177.0]
  - - [32, 128, 8, 64, 32, 32, 64, 128]
    - [0, 305.0]
  - - [32, 128, 8, 128, 32, 32, 128, 128]
    - [3, 490.0]
  - - [32, 128, 8, 256, 32, 32, 256, 128]
    - [16, 733.0]
  - - [32, 128, 8, 512, 32, 32, 512, 128]
    - [11, 999.0]
  - - [32, 128, 8, 1024, 32, 32, 1024, 128]
    - [5, 1202.0]
  - - [32, 128, 8, 2048, 32, 32, 2048, 128]
    - [11, 1336.0]
  - - [32, 256, 8, 32, 32, 32, 32, 256]
    - [2, 369.0]
  - - [32, 256, 8, 64, 32, 32, 64, 256]
    - [3, 639.0]
  - - [32, 256, 8, 128, 32, 32, 128, 256]
    - [14, 980.0]
  - - [32, 256, 8, 256, 32, 32, 256, 256]
    - [14, 1446.0]
  - - [32, 256, 8, 512, 32, 32, 512, 256]
    - [11, 1997.0]
  - - [32, 256, 8, 1024, 32, 32, 1024, 256]
    - [11, 2439.0]
  - - [32, 256, 8, 2048, 32, 32, 2048, 256]
    - [11, 2702.0]
  - - [32, 512, 8, 32, 32, 32, 32, 512]
    - [7, 760.0]
  - - [32, 512, 8, 64, 32, 32, 64, 512]
    - [4, 1248.0]
  - - [32, 512, 8, 128, 32, 32, 128, 512]
    - [14, 1705.0]
  - - [32, 512, 8, 256, 32, 32, 256, 512]
    - [4, 2330.0]
  - - [32, 512, 8, 512, 32, 32, 512, 512]
    - [14, 2759.0]
  - - [32, 512, 8, 1024, 32, 32, 1024, 512]
    - [14, 3023.0]
  - - [32, 512, 8, 2048, 32, 32, 2048, 512]
    - [10, 3255.0]
  - - [32, 1024, 8, 32, 32, 32, 32, 1024]
    - [14, 1128.0]
  - - [32, 1024, 8, 64, 32, 32, 64, 1024]
    - [14, 1808.0]
  - - [32, 1024, 8, 128, 32, 32, 128, 1024]
    - [4, 2558.0]
  - - [32, 1024, 8, 256, 32, 32, 256, 1024]
    - [10, 3130.0]
  - - [32, 1024, 8, 512, 32, 32, 512, 1024]
    - [4, 3562.0]
  - - [32, 1024, 8, 1024, 32, 32, 1024, 1024]
    - [4, 3861.0]
  - - [32, 1024, 8, 2048, 32, 32, 2048, 1024]
    - [4, 4155.0]
  - - [32, 2048, 8, 32, 32, 32, 32, 2048]
    - [10, 1638.0]
  - - [32, 2048, 8, 64, 32, 32, 64, 2048]
    - [4, 2482.0]
  - - [32, 2048, 8, 128, 32, 32, 128, 2048]
    - [10, 3190.0]
  - - [32, 2048, 8, 256, 32, 32, 256, 2048]
    - [4, 3459.0]
  - - [32, 2048, 8, 512, 32, 32, 512, 2048]
    - [1, 3581.0]
  - - [32, 2048, 8, 1024, 32, 32, 1024, 2048]
    - [4, 3992.0]
  - - [32, 2048, 8, 2048, 32, 32, 2048, 2048]
    - [14, 4844.0]
  - - [64, 32, 8, 32, 64, 64, 32, 32]
    - [16, 92.0]
  - - [64, 32, 8, 64, 64, 64, 64, 32]
    - [10, 160.0]
  - - [64, 32, 8, 128, 64, 64, 128, 32]
    - [10, 255.0]
  - - [64, 32, 8, 256, 64, 64, 256, 32]
    - [6, 367.0]
  - - [64, 32, 8, 512, 64, 64, 512, 32]
    - [15, 502.0]
  - - [64, 32, 8, 1024, 64, 64, 1024, 32]
    - [11, 599.0]
  - - [64, 32, 8, 2048, 64, 64, 2048, 32]
    - [5, 668.0]
  - - [64, 64, 8, 32, 64, 64, 32, 64]
    - [3, 180.0]
  - - [64, 64, 8, 64, 64, 64, 64, 64]
    - [3, 324.0]
  - - [64, 64, 8, 128, 64, 64, 128, 64]
    - [3, 519.0]
  - - [64, 64, 8, 256, 64, 64, 256, 64]
    - [6, 718.0]
  - - [64, 64, 8, 512, 64, 64, 512, 64]
    - [15, 1008.0]
  - - [64, 64, 8, 1024, 64, 64, 1024, 64]
    - [11, 1195.0]
  - - [64, 64, 8, 2048, 64, 64, 2048, 64]
    - [11, 1349.0]
  - - [64, 128, 8, 32, 64, 64, 32, 128]
    - [8, 354.0]
  - - [64, 128, 8, 64, 64, 64, 64, 128]
    - [10, 639.0]
  - - [64, 128, 8, 128, 64, 64, 128, 128]
    - [3, 1028.0]
  - - [64, 128, 8, 256, 64, 64, 256, 128]
    - [15, 1446.0]
  - - [64, 128, 8, 512, 64, 64, 512, 128]
    - [5, 2016.0]
  - - [64, 128, 8, 1024, 64, 64, 1024, 128]
    - [5, 2376.0]
  - - [64, 128, 8, 2048, 64, 64, 2048, 128]
    - [5, 2676.0]
  - - [64, 256, 8, 32, 64, 64, 32, 256]
    - [10, 771.0]
  - - [64, 256, 8, 64, 64, 64, 64, 256]
    - [4, 1248.0]
  - - [64, 256, 8, 128, 64, 64, 128, 256]
    - [13, 1777.0]
  - - [64, 256, 8, 256, 64, 64, 256, 256]
    - [10, 2280.0]
  - - [64, 256, 8, 512, 64, 64, 512, 256]
    - [3, 2759.0]
  - - [64, 256, 8, 1024, 64, 64, 1024, 256]
    - [13, 3101.0]
  - - [64, 256, 8, 2048, 64, 64, 2048, 256]
    - [3, 3236.0]
  - - [64, 512, 8, 32, 64, 64, 32, 512]
    - [21, 1192.0]
  - - [64, 512, 8, 64, 64, 64, 64, 512]
    - [10, 1808.0]
  - - [64, 512, 8, 128, 64, 64, 128, 512]
    - [10, 2589.0]
  - - [64, 512, 8, 256, 64, 64, 256, 512]
    - [10, 3251.0]
  - - [64, 512, 8, 512, 64, 64, 512, 512]
    - [14, 3704.0]
  - - [64, 512, 8, 1024, 64, 64, 1024, 512]
    - [14, 3985.0]
  - - [64, 512, 8, 2048, 64, 64, 2048, 512]
    - [14, 4215.0]
  - - [64, 1024, 8, 32, 64, 64, 32, 1024]
    - [31, 1856.0]
  - - [64, 1024, 8, 64, 64, 64, 64, 1024]
    - [30, 2638.0]
  - - [64, 1024, 8, 128, 64, 64, 128, 1024]
    - [27, 3466.0]
  - - [64, 1024, 8, 256, 64, 64, 256, 1024]
    - [20, 4173.0]
  - - [64, 1024, 8, 512, 64, 64, 512, 1024]
    - [21, 4522.0]
  - - [64, 1024, 8, 1024, 64, 64, 1024, 1024]
    - [21, 4787.0]
  - - [64, 1024, 8, 2048, 64, 64, 2048, 1024]
    - [31, 4933.0]
  - - [64, 2048, 8, 32, 64, 64, 32, 2048]
    - [24, 2621.0]
  - - [64, 2048, 8, 64, 64, 64, 64, 2048]
    - [20, 3663.0]
  - - [64, 2048, 8, 128, 64, 64, 128, 2048]
    - [20, 4510.0]
  - - [64, 2048, 8, 256, 64, 64, 256, 2048]
    - [25, 5178.0]
  - - [64, 2048, 8, 512, 64, 64, 512, 2048]
    - [23, 5523.0]
  - - [64, 2048, 8, 1024, 64, 64, 1024, 2048]
    - [30, 5869.0]
  - - [64, 2048, 8, 2048, 64, 64, 2048, 2048]
    - [25, 6230.0]
  - - [128, 32, 8, 32, 128, 128, 32, 32]
    - [2, 180.0]
  - - [128, 32, 8, 64, 128, 128, 64, 32]
    - [3, 320.0]
  - - [128, 32, 8, 128, 128, 128, 128, 32]
    - [3, 509.0]
  - - [128, 32, 8, 256, 128, 128, 256, 32]
    - [10, 728.0]
  - - [128, 32, 8, 512, 128, 128, 512, 32]
    - [5, 980.0]
  - - [128, 32, 8, 1024, 128, 128, 1024, 32]
    - [5, 1192.0]
  - - [128, 32, 8, 2048, 128, 128, 2048, 32]
    - [5, 1342.0]
  - - [128, 64, 8, 32, 128, 128, 32, 64]
    - [2, 364.0]
  - - [128, 64, 8, 64, 128, 128, 64, 64]
    - [3, 647.0]
  - - [128, 64, 8, 128, 128, 128, 128, 64]
    - [3, 1018.0]
  - - [128, 64, 8, 256, 128, 128, 256, 64]
    - [5, 1446.0]
  - - [128, 64, 8, 512, 128, 128, 512, 64]
    - [5, 2016.0]
  - - [128, 64, 8, 1024, 128, 128, 1024, 64]
    - [5, 2411.0]
  - - [128, 64, 8, 2048, 128, 128, 2048, 64]
    - [11, 2693.0]
  - - [128, 128, 8, 32, 128, 128, 32, 128]
    - [10, 771.0]
  - - [128, 128, 8, 64, 128, 128, 64, 128]
    - [3, 1248.0]
  - - [128, 128, 8, 128, 128, 128, 128, 128]
    - [3, 1840.0]
  - - [128, 128, 8, 256, 128, 128, 256, 128]
    - [10, 2231.0]
  - - [128, 128, 8, 512, 128, 128, 512, 128]
    - [4, 2741.0]
  - - [128, 128, 8, 1024, 128, 128, 1024, 128]
    - [3, 3113.0]
  - - [128, 128, 8, 2048, 128, 128, 2048, 128]
    - [3, 3283.0]
  - - [128, 256, 8, 32, 128, 128, 32, 256]
    - [21, 1234.0]
  - - [128, 256, 8, 64, 128, 128, 64, 256]
    - [4, 1872.0]
  - - [128, 256, 8, 128, 128, 128, 128, 256]
    - [14, 2638.0]
  - - [128, 256, 8, 256, 128, 128, 256, 256]
    - [4, 3239.0]
  - - [128, 256, 8, 512, 128, 128, 512, 256]
    - [4, 3687.0]
  - - [128, 256, 8, 1024, 128, 128, 1024, 256]
    - [4, 3948.0]
  - - [128, 256, 8, 2048, 128, 128, 2048, 256]
    - [14, 4213.0]
  - - [128, 512, 8, 32, 128, 128, 32, 512]
    - [21, 1942.0]
  - - [128, 512, 8, 64, 128, 128, 64, 512]
    - [30, 2759.0]
  - - [128, 512, 8, 128, 128, 128, 128, 512]
    - [21, 3570.0]
  - - [128, 512, 8, 256, 128, 128, 256, 512]
    - [25, 4226.0]
  - - [128, 512, 8, 512, 128, 128, 512, 512]
    - [25, 4622.0]
  - - [128, 512, 8, 1024, 128, 128, 1024, 512]
    - [25, 4800.0]
  - - [128, 512, 8, 2048, 128, 128, 2048, 512]
    - [25, 4978.0]
  - - [128, 1024, 8, 32, 128, 128, 32, 1024]
    - [28, 2689.0]
  - - [128, 1024, 8, 64, 128, 128, 64, 1024]
    - [26, 3663.0]
  - - [128, 1024, 8, 128, 128, 128, 128, 1024]
    - [25, 4647.0]
  - - [128, 1024, 8, 256, 128, 128, 256, 1024]
    - [30, 5369.0]
  - - [128, 1024, 8, 512, 128, 128, 512, 1024]
    - [25, 5820.0]
  - - [128, 1024, 8, 1024, 128, 128, 1024, 1024]
    - [30, 6051.0]
  - - [128, 1024, 8, 2048, 128, 128, 2048, 1024]
    - [25, 6263.0]
  - - [128, 2048, 8, 32, 128, 128, 32, 2048]
    - [24, 3316.0]
  - - [128, 2048, 8, 64, 128, 128, 64, 2048]
    - [25, 4427.0]
  - - [128, 2048, 8, 128, 128, 128, 128, 2048]
    - [30, 5202.0]
  - - [128, 2048, 8, 256, 128, 128, 256, 2048]
    - [25, 6051.0]
  - - [128, 2048, 8, 512, 128, 128, 512, 2048]
    - [25, 6475.0]
  - - [128, 2048, 8, 1024, 128, 128, 1024, 2048]
    - [25, 6760.0]
  - - [128, 2048, 8, 2048, 128, 128, 2048, 2048]
    - [30, 7153.0]
  - - [256, 32, 8, 32, 256, 256, 32, 32]
    - [2, 364.0]
  - - [256, 32, 8, 64, 256, 256, 64, 32]
    - [1, 632.0]
  - - [256, 32, 8, 128, 256, 256, 128, 32]
    - [3, 1018.0]
  - - [256, 32, 8, 256, 256, 256, 256, 32]
    - [10, 1427.0]
  - - [256, 32, 8, 512, 256, 256, 512, 32]
    - [5, 1942.0]
  - - [256, 32, 8, 1024, 256, 256, 1024, 32]
    - [5, 2356.0]
  - - [256, 32, 8, 2048, 256, 256, 2048, 32]
    - [15, 2680.0]
  - - [256, 64, 8, 32, 256, 256, 32, 64]
    - [10, 771.0]
  - - [256, 64, 8, 64, 256, 256, 64, 64]
    - [9, 1248.0]
  - - [256, 64, 8, 128, 256, 256, 128, 64]
    - [14, 1808.0]
  - - [256, 64, 8, 256, 256, 256, 256, 64]
    - [0, 2162.0]
  - - [256, 64, 8, 512, 256, 256, 512, 64]
    - [3, 2750.0]
  - - [256, 64, 8, 1024, 256, 256, 1024, 64]
    - [9, 3023.0]
  - - [256, 64, 8, 2048, 256, 256, 2048, 64]
    - [3, 3223.0]
  - - [256, 128, 8, 32, 256, 256, 32, 128]
    - [4, 1205.0]
  - - [256, 128, 8, 64, 256, 256, 64, 128]
    - [4, 1856.0]
  - - [256, 128, 8, 128, 256, 256, 128, 128]
    - [14, 2655.0]
  - - [256, 128, 8, 256, 256, 256, 256, 128]
    - [4, 3028.0]
  - - [256, 128, 8, 512, 256, 256, 512, 128]
    - [14, 3687.0]
  - - [256, 128, 8, 1024, 256, 256, 1024, 128]
    - [14, 4023.0]
  - - [256, 128, 8, 2048, 256, 256, 2048, 128]
    - [14, 4184.0]
  - - [256, 256, 8, 32, 256, 256, 32, 256]
    - [31, 1942.0]
  - - [256, 256, 8, 64, 256, 256, 64, 256]
    - [21, 2759.0]
  - - [256, 256, 8, 128, 256, 256, 128, 256]
    - [10, 3600.0]
  - - [256, 256, 8, 256, 256, 256, 256, 256]
    - [30, 4023.0]
  - - [256, 256, 8, 512, 256, 256, 512, 256]
    - [30, 4609.0]
  - - [256, 256, 8, 1024, 256, 256, 1024, 256]
    - [30, 4828.0]
  - - [256, 256, 8, 2048, 256, 256, 2048, 256]
    - [14, 5257.0]
  - - [256, 512, 8, 32, 256, 256, 32, 512]
    - [21, 2672.0]
  - - [256, 512, 8, 64, 256, 256, 64, 512]
    - [26, 3695.0]
  - - [256, 512, 8, 128, 256, 256, 128, 512]
    - [30, 4302.0]
  - - [256, 512, 8, 256, 256, 256, 256, 512]
    - [30, 5326.0]
  - - [256, 512, 8, 512, 256, 256, 512, 512]
    - [30, 5795.0]
  - - [256, 512, 8, 1024, 256, 256, 1024, 512]
    - [25, 6040.0]
  - - [256, 512, 8, 2048, 256, 256, 2048, 512]
    - [20, 6250.0]
  - - [256, 1024, 8, 32, 256, 256, 32, 1024]
    - [19, 3303.0]
  - - [256, 1024, 8, 64, 256, 256, 64, 1024]
    - [20, 4427.0]
  - - [256, 1024, 8, 128, 256, 256, 128, 1024]
    - [25, 5131.0]
  - - [256, 1024, 8, 256, 256, 256, 256, 1024]
    - [30, 6123.0]
  - - [256, 1024, 8, 512, 256, 256, 512, 1024]
    - [30, 6557.0]
  - - [256, 1024, 8, 1024, 256, 256, 1024, 1024]
    - [30, 6791.0]
  - - [256, 1024, 8, 2048, 256, 256, 2048, 1024]
    - [25, 7029.0]
  - - [256, 2048, 8, 32, 256, 256, 32, 2048]
    - [20, 3839.0]
  - - [256, 2048, 8, 64, 256, 256, 64, 2048]
    - [25, 5008.0]
  - - [256, 2048, 8, 128, 256, 256, 128, 2048]
    - [25, 6019.0]
  - - [256, 2048, 8, 256, 256, 256, 256, 2048]
    - [20, 6631.0]
  - - [256, 2048, 8, 512, 256, 256, 512, 2048]
    - [30, 6945.0]
  - - [256, 2048, 8, 1024, 256, 256, 1024, 2048]
    - [30, 7086.0]
  - - [256, 2048, 8, 2048, 256, 256, 2048, 2048]
    - [25, 7304.0]
  - - [512, 32, 8, 32, 512, 512, 32, 32]
    - [1, 738.0]
  - - [512, 32, 8, 64, 512, 512, 64, 32]
    - [10, 1178.0]
  - - [512, 32, 8, 128, 512, 512, 128, 32]
    - [0, 1748.0]
  - - [512, 32, 8, 256, 512, 512, 256, 32]
    - [10, 2243.0]
  - - [512, 32, 8, 512, 512, 512, 512, 32]
    - [3, 2646.0]
  - - [512, 32, 8, 1024, 512, 512, 1024, 32]
    - [9, 2985.0]
  - - [512, 32, 8, 2048, 512, 512, 2048, 32]
    - [9, 3151.0]
  - - [512, 64, 8, 32, 512, 512, 32, 64]
    - [4, 1234.0]
  - - [512, 64, 8, 64, 512, 512, 64, 64]
    - [4, 1872.0]
  - - [512, 64, 8, 128, 512, 512, 128, 64]
    - [4, 2638.0]
  - - [512, 64, 8, 256, 512, 512, 256, 64]
    - [4, 3084.0]
  - - [512, 64, 8, 512, 512, 512, 512, 64]
    - [10, 3687.0]
  - - [512, 64, 8, 1024, 512, 512, 1024, 64]
    - [10, 3976.0]
  - - [512, 64, 8, 2048, 512, 512, 2048, 64]
    - [14, 4166.0]
  - - [512, 128, 8, 32, 512, 512, 32, 128]
    - [24, 1856.0]
  - - [512, 128, 8, 64, 512, 512, 64, 128]
    - [21, 2706.0]
  - - [512, 128, 8, 128, 512, 512, 128, 128]
    - [14, 3585.0]
  - - [512, 128, 8, 256, 512, 512, 256, 128]
    - [31, 4122.0]
  - - [512, 128, 8, 512, 512, 512, 512, 128]
    - [14, 4759.0]
  - - [512, 128, 8, 1024, 512, 512, 1024, 128]
    - [13, 4888.0]
  - - [512, 128, 8, 2048, 512, 512, 2048, 128]
    - [14, 5249.0]
  - - [512, 256, 8, 32, 512, 512, 32, 256]
    - [19, 2724.0]
  - - [512, 256, 8, 64, 512, 512, 64, 256]
    - [26, 3679.0]
  - - [512, 256, 8, 128, 512, 512, 128, 256]
    - [25, 4462.0]
  - - [512, 256, 8, 256, 512, 512, 256, 256]
    - [25, 5447.0]
  - - [512, 256, 8, 512, 512, 512, 512, 256]
    - [25, 5846.0]
  - - [512, 256, 8, 1024, 512, 512, 1024, 256]
    - [25, 6076.0]
  - - [512, 256, 8, 2048, 512, 512, 2048, 256]
    - [30, 6214.0]
  - - [512, 512, 8, 32, 512, 512, 32, 512]
    - [19, 3264.0]
  - - [512, 512, 8, 64, 512, 512, 64, 512]
    - [20, 4358.0]
  - - [512, 512, 8, 128, 512, 512, 128, 512]
    - [25, 5115.0]
  - - [512, 512, 8, 256, 512, 512, 256, 512]
    - [25, 6254.0]
  - - [512, 512, 8, 512, 512, 512, 512, 512]
    - [25, 6573.0]
  - - [512, 512, 8, 1024, 512, 512, 1024, 512]
    - [30, 6777.0]
  - - [512, 512, 8, 2048, 512, 512, 2048, 512]
    - [25, 7068.0]
  - - [512, 1024, 8, 32, 512, 512, 32, 1024]
    - [17, 3695.0]
  - - [512, 1024, 8, 64, 512, 512, 64, 1024]
    - [25, 4863.0]
  - - [512, 1024, 8, 128, 512, 512, 128, 1024]
    - [20, 5611.0]
  - - [512, 1024, 8, 256, 512, 512, 256, 1024]
    - [25, 6570.0]
  - - [512, 1024, 8, 512, 512, 512, 512, 1024]
    - [25, 6886.0]
  - - [512, 1024, 8, 1024, 512, 512, 1024, 1024]
    - [30, 7025.0]
  - - [512, 1024, 8, 2048, 512, 512, 2048, 1024]
    - [25, 7294.0]
  - - [512, 2048, 8, 32, 512, 512, 32, 2048]
    - [20, 4112.0]
  - - [512, 2048, 8, 64, 512, 512, 64, 2048]
    - [25, 5231.0]
  - - [512, 2048, 8, 128, 512, 512, 128, 2048]
    - [20, 6191.0]
  - - [512, 2048, 8, 256, 512, 512, 256, 2048]
    - [25, 6897.0]
  - - [512, 2048, 8, 512, 512, 512, 512, 2048]
    - [30, 7202.0]
  - - [512, 2048, 8, 1024, 512, 512, 1024, 2048]
    - [30, 7260.0]
  - - [512, 2048, 8, 2048, 512, 512, 2048, 2048]
    - [25, 7567.0]
  - - [1024, 32, 8, 32, 1024, 1024, 32, 32]
    - [20, 1165.0]
  - - [1024, 32, 8, 64, 1024, 1024, 64, 32]
    - [4, 1808.0]
  - - [1024, 32, 8, 128, 1024, 1024, 128, 32]
    - [4, 2542.0]
  - - [1024, 32, 8, 256, 1024, 1024, 256, 32]
    - [4, 3118.0]
  - - [1024, 32, 8, 512, 1024, 1024, 512, 32]
    - [10, 3608.0]
  - - [1024, 32, 8, 1024, 1024, 1024, 1024, 32]
    - [14, 3911.0]
  - - [1024, 32, 8, 2048, 1024, 1024, 2048, 32]
    - [14, 3802.0]
  - - [1024, 64, 8, 32, 1024, 1024, 32, 64]
    - [20, 1889.0]
  - - [1024, 64, 8, 64, 1024, 1024, 64, 64]
    - [20, 2741.0]
  - - [1024, 64, 8, 128, 1024, 1024, 128, 64]
    - [14, 3570.0]
  - - [1024, 64, 8, 256, 1024, 1024, 256, 64]
    - [25, 4122.0]
  - - [1024, 64, 8, 512, 1024, 1024, 512, 64]
    - [14, 4759.0]
  - - [1024, 64, 8, 1024, 1024, 1024, 1024, 64]
    - [14, 5008.0]
  - - [1024, 64, 8, 2048, 1024, 1024, 2048, 64]
    - [10, 5214.0]
  - - [1024, 128, 8, 32, 1024, 1024, 32, 128]
    - [28, 2672.0]
  - - [1024, 128, 8, 64, 1024, 1024, 64, 128]
    - [26, 3663.0]
  - - [1024, 128, 8, 128, 1024, 1024, 128, 128]
    - [26, 4438.0]
  - - [1024, 128, 8, 256, 1024, 1024, 256, 128]
    - [30, 5386.0]
  - - [1024, 128, 8, 512, 1024, 1024, 512, 128]
    - [30, 5785.0]
  - - [1024, 128, 8, 1024, 1024, 1024, 1024, 128]
    - [25, 6013.0]
  - - [1024, 128, 8, 2048, 1024, 1024, 2048, 128]
    - [30, 6205.0]
  - - [1024, 256, 8, 32, 1024, 1024, 32, 256]
    - [19, 3239.0]
  - - [1024, 256, 8, 64, 1024, 1024, 64, 256]
    - [21, 4369.0]
  - - [1024, 256, 8, 128, 1024, 1024, 128, 256]
    - [30, 5131.0]
  - - [1024, 256, 8, 256, 1024, 1024, 256, 256]
    - [30, 6385.0]
  - - [1024, 256, 8, 512, 1024, 1024, 512, 256]
    - [25, 6738.0]
  - - [1024, 256, 8, 1024, 1024, 1024, 1024, 256]
    - [30, 6945.0]
  - - [1024, 256, 8, 2048, 1024, 1024, 2048, 256]
    - [30, 7136.0]
  - - [1024, 512, 8, 32, 1024, 1024, 32, 512]
    - [20, 3624.0]
  - - [1024, 512, 8, 64, 1024, 1024, 64, 512]
    - [30, 4884.0]
  - - [1024, 512, 8, 128, 1024, 1024, 128, 512]
    - [30, 5663.0]
  - - [1024, 512, 8, 256, 1024, 1024, 256, 512]
    - [30, 6586.0]
  - - [1024, 512, 8, 512, 1024, 1024, 512, 512]
    - [25, 6949.0]
  - - [1024, 512, 8, 1024, 1024, 1024, 1024, 512]
    - [30, 7020.0]
  - - [1024, 512, 8, 2048, 1024, 1024, 2048, 512]
    - [30, 7255.0]
  - - [1024, 1024, 8, 32, 1024, 1024, 32, 1024]
    - [28, 3920.0]
  - - [1024, 1024, 8, 64, 1024, 1024, 64, 1024]
    - [30, 5046.0]
  - - [1024, 1024, 8, 128, 1024, 1024, 128, 1024]
    - [31, 5780.0]
  - - [1024, 1024, 8, 256, 1024, 1024, 256, 1024]
    - [25, 6779.0]
  - - [1024, 1024, 8, 512, 1024, 1024, 512, 1024]
    - [25, 7083.0]
  - - [1024, 1024, 8, 1024, 1024, 1024, 1024, 1024]
    - [30, 7163.0]
  - - [1024, 1024, 8, 2048, 1024, 1024, 2048, 1024]
    - [30, 7361.0]
  - - [1024, 2048, 8, 32, 1024, 1024, 32, 2048]
    - [28, 4218.0]
  - - [1024, 2048, 8, 64, 1024, 1024, 64, 2048]
    - [30, 5299.0]
  - - [1024, 2048, 8, 128, 1024, 1024, 128, 2048]
    - [20, 6447.0]
  - - [1024, 2048, 8, 256, 1024, 1024, 256, 2048]
    - [30, 7011.0]
  - - [1024, 2048, 8, 512, 1024, 1024, 512, 2048]
    - [30, 7344.0]
  - - [1024, 2048, 8, 1024, 1024, 1024, 1024, 2048]
    - [30, 7407.0]
  - - [1024, 2048, 8, 2048, 1024, 1024, 2048, 2048]
    - [30, 7617.0]
  - - [2048, 32, 8, 32, 2048, 2048, 32, 32]
    - [21, 1762.0]
  - - [2048, 32, 8, 64, 2048, 2048, 64, 32]
    - [21, 2527.0]
  - - [2048, 32, 8, 128, 2048, 2048, 128, 32]
    - [14, 3342.0]
  - - [2048, 32, 8, 256, 2048, 2048, 256, 32]
    - [4, 3848.0]
  - - [2048, 32, 8, 512, 2048, 2048, 512, 32]
    - [4, 4615.0]
  - - [2048, 32, 8, 1024, 2048, 2048, 1024, 32]
    - [10, 4898.0]
  - - [2048, 32, 8, 2048, 2048, 2048, 2048, 32]
    - [14, 4872.0]
  - - [2048, 64, 8, 32, 2048, 2048, 32, 64]
    - [26, 2655.0]
  - - [2048, 64, 8, 64, 2048, 2048, 64, 64]
    - [21, 3679.0]
  - - [2048, 64, 8, 128, 2048, 2048, 128, 64]
    - [25, 4547.0]
  - - [2048, 64, 8, 256, 2048, 2048, 256, 64]
    - [30, 5326.0]
  - - [2048, 64, 8, 512, 2048, 2048, 512, 64]
    - [25, 5751.0]
  - - [2048, 64, 8, 1024, 2048, 2048, 1024, 64]
    - [30, 5949.0]
  - - [2048, 64, 8, 2048, 2048, 2048, 2048, 64]
    - [30, 6138.0]
  - - [2048, 128, 8, 32, 2048, 2048, 32, 128]
    - [19, 3316.0]
  - - [2048, 128, 8, 64, 2048, 2048, 64, 128]
    - [25, 4474.0]
  - - [2048, 128, 8, 128, 2048, 2048, 128, 128]
    - [25, 5210.0]
  - - [2048, 128, 8, 256, 2048, 2048, 256, 128]
    - [30, 6355.0]
  - - [2048, 128, 8, 512, 2048, 2048, 512, 128]
    - [30, 6724.0]
  - - [2048, 128, 8, 1024, 2048, 2048, 1024, 128]
    - [30, 6926.0]
  - - [2048, 128, 8, 2048, 2048, 2048, 2048, 128]
    - [30, 7131.0]
  - - [2048, 256, 8, 32, 2048, 2048, 32, 256]
    - [20, 3695.0]
  - - [2048, 256, 8, 64, 2048, 2048, 64, 256]
    - [20, 4920.0]
  - - [2048, 256, 8, 128, 2048, 2048, 128, 256]
    - [31, 5663.0]
  - - [2048, 256, 8, 256, 2048, 2048, 256, 256]
    - [30, 6718.0]
  - - [2048, 256, 8, 512, 2048, 2048, 512, 256]
    - [30, 7016.0]
  - - [2048, 256, 8, 1024, 2048, 2048, 1024, 256]
    - [30, 7155.0]
  - - [2048, 256, 8, 2048, 2048, 2048, 2048, 256]
    - [30, 7344.0]
  - - [2048, 512, 8, 32, 2048, 2048, 32, 512]
    - [28, 3720.0]
  - - [2048, 512, 8, 64, 2048, 2048, 64, 512]
    - [30, 5111.0]
  - - [2048, 512, 8, 128, 2048, 2048, 128, 512]
    - [30, 6095.0]
  - - [2048, 512, 8, 256, 2048, 2048, 256, 512]
    - [25, 6803.0]
  - - [2048, 512, 8, 512, 2048, 2048, 512, 512]
    - [30, 7110.0]
  - - [2048, 512, 8, 1024, 2048, 2048, 1024, 512]
    - [30, 7188.0]
  - - [2048, 512, 8, 2048, 2048, 2048, 2048, 512]
    - [31, 7368.0]
  - - [2048, 1024, 8, 32, 2048, 2048, 32, 1024]
    - [30, 3828.0]
  - - [2048, 1024, 8, 64, 2048, 2048, 64, 1024]
    - [30, 5190.0]
  - - [2048, 1024, 8, 128, 2048, 2048, 128, 1024]
    - [30, 5960.0]
  - - [2048, 1024, 8, 256, 2048, 2048, 256, 1024]
    - [25, 6918.0]
  - - [2048, 1024, 8, 512, 2048, 2048, 512, 1024]
    - [25, 7176.0]
  - - [2048, 1024, 8, 1024, 2048, 2048, 1024, 1024]
    - [30, 7253.0]
  - - [2048, 1024, 8, 2048, 2048, 2048, 2048, 1024]
    - [30, 7492.0]
  - - [2048, 2048, 8, 32, 2048, 2048, 32, 2048]
    - [30, 4001.0]
  - - [2048, 2048, 8, 64, 2048, 2048, 64, 2048]
    - [25, 5511.0]
  - - [2048, 2048, 8, 128, 2048, 2048, 128, 2048]
    - [25, 6640.0]
  - - [2048, 2048, 8, 256, 2048, 2048, 256, 2048]
    - [25, 7132.0]
  - - [2048, 2048, 8, 512, 2048, 2048, 512, 2048]
    - [30, 7413.0]
  - - [2048, 2048, 8, 1024, 2048, 2048, 1024, 2048]
    - [30, 7484.0]
  - - [2048, 2048, 8, 2048, 2048, 2048, 2048, 2048]
    - [30, 7689.0]
- null
