library/src/blas3/Tensile/Logic/asm_full/arcturus_Cijk_Ailk_Bljk_BBH.yaml
- {MinimumRequiredVersion: 4.14.0}
- arcturus
- gfx908
- [Device 7380, Device 7388, Device 738c, Device 7390]
    SolutionIndex: 0
    SolutionNameMin: Cijk_Ailk_Bljk_BBH_MT64x128x16_MI32x32x2x2_SE_GRVW2_ONLL0_SNLL0
    SolutionIndex: 1
    SolutionNameMin: Cijk_Ailk_Bljk_BBH_MT64x128x32_MI32x32x2x2_SE_GRVW2_ONLL1_SNLL1
    SolutionIndex: 2
    SolutionNameMin: Cijk_Ailk_Bljk_BBH_MT32x256x16_MI32x32x2x2_SE_GRVW4_ONLL1_SNLL0
    SolutionIndex: 3
    SolutionNameMin: Cijk_Ailk_Bljk_BBH_MT64x128x8_MI32x32x2x2_SE_AF0EM1_ASEM1_GRVW2_ONLL0_SNLL1
    SolutionIndex: 4
    SolutionNameMin: Cijk_Ailk_Bljk_BBH_MT64x128x8_MI32x32x2x2_SE_AF0EM1_ASEM1_GRVW4_ONLL1_SNLL1
    SolutionIndex: 5
    SolutionNameMin: Cijk_Ailk_Bljk_BBH_MT64x256x8_MI32x32x2x2_SE_AF0EM2_ASEM1_GRVW2_ONLL0_SNLL0
    SolutionIndex: 6
    SolutionIndex: 7
    SolutionIndex: 8
    SolutionIndex: 9
    SolutionIndex: 10
    SolutionIndex: 11
    SolutionIndex: 12
    SolutionIndex: 13
    SolutionIndex: 14
    SolutionIndex: 15
    SolutionIndex: 16
    SolutionIndex: 17
    SolutionIndex: 18
    SolutionIndex: 19
    SolutionIndex: 20
    SolutionIndex: 21
    SolutionIndex: 22
    SolutionIndex: 23
    SolutionIndex: 24
    SolutionIndex: 25
    SolutionIndex: 26
    SolutionIndex: 27
    SolutionIndex: 28
    SolutionIndex: 29
    SolutionIndex: 30
    SolutionIndex: 31
    SolutionIndex: 32
    SolutionIndex: 33
    SolutionIndex: 34
    SolutionIndex: 35
    SolutionIndex: 36
    SolutionIndex: 37
    SolutionIndex: 38
    SolutionIndex: 39
    SolutionIndex: 40
    SolutionIndex: 41
    SolutionIndex: 42
    SolutionIndex: 43
    SolutionIndex: 44
    SolutionIndex: 45
    SolutionIndex: 46
    SolutionIndex: 47
    SolutionIndex: 48
    SolutionIndex: 49
    SolutionIndex: 50
    SolutionIndex: 51
    SolutionIndex: 52
    SolutionIndex: 53
    SolutionIndex: 54
    SolutionIndex: 55
    SolutionIndex: 56
    SolutionIndex: 57
    SolutionIndex: 58
    SolutionIndex: 59
    SolutionIndex: 60
    SolutionIndex: 61
    SolutionIndex: 62
    SolutionIndex: 63
    SolutionIndex: 64
    SolutionIndex: 65
    SolutionIndex: 66
    SolutionIndex: 67
    SolutionIndex: 68
    SolutionIndex: 69
    SolutionIndex: 70
    SolutionIndex: 71
    SolutionIndex: 72
    SolutionIndex: 73
    SolutionIndex: 74
    SolutionIndex: 75
    SolutionIndex: 76
    SolutionIndex: 77
    SolutionIndex: 78
    SolutionIndex: 79
    SolutionIndex: 80
    SolutionIndex: 81
    SolutionIndex: 82
    SolutionIndex: 83
    SolutionIndex: 84
    SolutionIndex: 85
    SolutionIndex: 86
    SolutionIndex: 87
    SolutionIndex: 88
    SolutionIndex: 89
    SolutionIndex: 90
    SolutionIndex: 91
    SolutionIndex: 92
    SolutionIndex: 93
    SolutionIndex: 94
    SolutionIndex: 95
    SolutionIndex: 96
    SolutionIndex: 97
    SolutionIndex: 98
    SolutionIndex: 99
    SolutionIndex: 100
    SolutionIndex: 101
    SolutionIndex: 102
    SolutionIndex: 103
    SolutionIndex: 104
    SolutionIndex: 105
    SolutionIndex: 106
    SolutionIndex: 107
    SolutionIndex: 108
    SolutionIndex: 109
    SolutionIndex: 110
    SolutionIndex: 111
    SolutionIndex: 112
    SolutionIndex: 113
    SolutionIndex: 114
    SolutionIndex: 115
    SolutionIndex: 116
    SolutionIndex: 117
    SolutionIndex: 118
    SolutionIndex: 119
    SolutionIndex: 120
    SolutionIndex: 121
    SolutionIndex: 122
    SolutionIndex: 123
    SolutionIndex: 124
    SolutionIndex: 125
    SolutionIndex: 126
    SolutionIndex: 127
    SolutionIndex: 128
    SolutionIndex: 129
    SolutionIndex: 130
    SolutionIndex: 131
    SolutionIndex: 132
    SolutionIndex: 133
    SolutionIndex: 134
    SolutionIndex: 135
    SolutionIndex: 136
    SolutionIndex: 137
    SolutionIndex: 138
    SolutionIndex: 139
    SolutionIndex: 140
    SolutionIndex: 141
    SolutionIndex: 142
    SolutionIndex: 143
    SolutionIndex: 144
    SolutionIndex: 145
    SolutionIndex: 146
    SolutionIndex: 147
    SolutionIndex: 148
    SolutionIndex: 149
    SolutionIndex: 150
    SolutionIndex: 151
    SolutionIndex: 152
    SolutionIndex: 153
    SolutionIndex: 154
    SolutionIndex: 155
    SolutionIndex: 156
    SolutionIndex: 157
    SolutionIndex: 158
    SolutionIndex: 159
    SolutionIndex: 160
    SolutionIndex: 161
    SolutionIndex: 162
    SolutionNameMin: Cijk_Ailk_Bljk_BBH_MT64x32x32_MI16x16x8x1_SE_AF0EM4_GRVW2_LBSPP128_LPB2_NLCA1_SU0_SUS256_SRVW4_TT2_16_WG32_8_1_WGM1
    SolutionIndex: 163
    SolutionNameMin: Cijk_Ailk_Bljk_BBH_MT32x64x64_MI16x16x8x1_SE_AF0EM4_GRVW8_LBSPP128_LPB8_NLCA1_SU32_SUS256_SRVW0_TT1_32_WG32_8_1_WGM1
    SolutionIndex: 164
    SolutionNameMin: Cijk_Ailk_Bljk_BBH_MT64x128x32_MI32x32x4x1_SE_AF0EM4_GRVW4_LBSPP128_LPB4_NLCA1_SU0_SUS256_SRVW4_TT1_64_WG64_4_1_WGM15
    SolutionIndex: 165
    SolutionNameMin: Cijk_Ailk_Bljk_BBH_MT128x160x32_MI32x32x4x1_SE_AF0EM4_GRVW4_LBSPP128_LPB4_NLCA1_SU0_SUS256_SRVW0_TT1_160_WG128_2_1_WGM2
    SolutionIndex: 166
    SolutionNameMin: Cijk_Ailk_Bljk_BBH_MT32x32x32_MI16x16x8x1_SE_AF0EM1_GRVW2_LBSPP128_LPB2_NLCA1_SU0_SUS256_SRVW0_TT1_16_WG32_8_1_WGM1
    SolutionIndex: 167
    SolutionNameMin: Cijk_Ailk_Bljk_BBH_MT64x128x32_MI32x32x4x1_SE_AF0EM4_GRVW8_LBSPP128_LPB8_NLCA1_SU0_SUS256_SRVW4_TT1_64_WG64_4_1_WGM1
    SolutionIndex: 168
    SolutionNameMin: Cijk_Ailk_Bljk_BBH_MT128x288x32_MI32x32x4x1_SE_AF0EM4_GRVW2_LBSPP128_LPB2_NLCA1_SU0_SUS256_SRVW0_TT1_288_WG128_2_1_WGM15
    SolutionIndex: 169
    SolutionNameMin: Cijk_Ailk_Bljk_BBH_MT32x32x128_MI16x16x8x1_SE_AF0EM4_GRVW2_LBSPP256_LPB2_NLCA1_SU16_SUS256_SRVW0_TT1_16_WG32_8_1_WGM1
    SolutionIndex: 170
    SolutionNameMin: Cijk_Ailk_Bljk_BBH_MT32x32x64_MI16x16x8x1_SE_AF0EM4_GRVW4_LBSPP128_LPB4_NLCA1_SU16_SUS256_SRVW0_TT1_16_WG32_8_1_WGM1
    SolutionIndex: 171
    SolutionNameMin: Cijk_Ailk_Bljk_BBH_MT32x32x128_MI16x16x8x1_SE_AF0EM1_GRVW8_LBSPP256_LPB8_NLCA1_SU32_SUS256_SRVW0_TT1_16_WG32_8_1_WGM1
    SolutionIndex: 172
    SolutionNameMin: Cijk_Ailk_Bljk_BBH_MT64x80x64_MI16x16x8x1_SE_AF0EM4_GRVW4_LBSPP128_LPB4_NLCA1_SU0_SUS256_SRVW0_TT1_80_WG64_4_1_WGM2
    SolutionIndex: 173
    SolutionNameMin: Cijk_Ailk_Bljk_BBH_MT64x80x32_MI16x16x8x1_SE_AF0EM4_GRVW2_LBSPP128_LPB2_NLCA1_SU32_SUS256_SRVW0_TT1_80_WG64_4_1_WGM2
    SolutionIndex: 174
    SolutionNameMin: Cijk_Ailk_Bljk_BBH_MT64x128x32_MI32x32x4x1_SE_AF0EM4_GRVW8_LBSPP128_LPB8_NLCA1_SU0_SUS256_SRVW4_TT1_64_WG64_4_1_WGM15
    SolutionIndex: 175
    SolutionNameMin: Cijk_Ailk_Bljk_BBH_MT64x32x32_MI16x16x8x1_SE_AF0EM4_GRVW2_LBSPP128_LPB2_NLCA1_SU0_SUS256_SRVW0_TT2_16_WG32_8_1_WGM1
    SolutionIndex: 176
    SolutionNameMin: Cijk_Ailk_Bljk_BBH_MT128x96x32_MI32x32x4x1_SE_AF0EM4_GRVW4_LBSPP128_LPB4_NLCA1_SU16_SUS128_SRVW4_TT1_96_WG128_2_1_WGM2
    SolutionIndex: 177
    SolutionNameMin: Cijk_Ailk_Bljk_BBH_MT128x96x32_MI32x32x4x1_SE_AF0EM4_GRVW4_LBSPP128_LPB4_NLCA1_SU0_SUS256_SRVW4_TT1_96_WG128_2_1_WGM2
    SolutionIndex: 178
    SolutionNameMin: Cijk_Ailk_Bljk_BBH_MT64x80x32_MI16x16x8x1_SE_AF0EM4_GRVW2_LBSPP128_LPB2_NLCA1_SU32_SUS256_SRVW4_TT1_80_WG64_4_1_WGM15
    SolutionIndex: 179
    SolutionNameMin: Cijk_Ailk_Bljk_BBH_MT128x160x32_MI32x32x4x1_SE_AF0EM4_GRVW4_LBSPP128_LPB4_NLCA1_SU0_SUS256_SRVW4_TT1_160_WG128_2_1_WGM15
    SolutionIndex: 180
    SolutionNameMin: Cijk_Ailk_Bljk_BBH_MT64x128x32_MI32x32x4x1_SE_AF0EM4_GRVW8_LBSPP128_LPB8_NLCA1_SU32_SUS128_SRVW4_TT1_64_WG64_4_1_WGM1
    SolutionIndex: 181
    SolutionNameMin: Cijk_Ailk_Bljk_BBH_MT64x128x32_MI32x32x2x2_SE_AF0EM4_GRVW8_LBSPP128_LPB8_NLCA1_SU0_SUS256_SRVW4_TT1_32_WG64_4_1_WGM1
    SolutionIndex: 182
    SolutionNameMin: Cijk_Ailk_Bljk_BBH_MT128x80x32_MI16x16x8x1_SE_AF0EM4_GRVW2_LBSPP128_LPB2_NLCA1_SU16_SUS256_SRVW4_TT2_80_WG64_4_1_WGM1
    SolutionIndex: 183
    SolutionNameMin: Cijk_Ailk_Bljk_BBH_MT64x128x64_MI32x32x4x1_SE_AF0EM4_GRVW8_LBSPP128_LPB8_NLCA1_SU32_SUS128_SRVW0_TT1_64_WG64_4_1_WGM2
    SolutionIndex: 184
    SolutionNameMin: Cijk_Ailk_Bljk_BBH_MT128x80x64_MI16x16x8x1_SE_AF0EM4_GRVW2_LBSPP128_LPB2_NLCA1_SU32_SUS256_SRVW0_TT2_80_WG64_4_1_WGM2
    SolutionIndex: 185
    SolutionNameMin: Cijk_Ailk_Bljk_BBH_MT128x64x64_MI32x32x4x1_SE_AF0EM1_GRVW4_LBSPP128_LPB4_NLCA1_SU0_SUS256_SRVW4_TT2_32_WG64_4_1_WGM15
    SolutionIndex: 186
    SolutionNameMin: Cijk_Ailk_Bljk_BBH_MT128x160x32_MI32x32x4x1_SE_AF0EM4_GRVW4_LBSPP128_LPB4_NLCA1_SU0_SUS256_SRVW0_TT1_160_WG128_2_1_WGM15
    SolutionIndex: 187
    SolutionNameMin: Cijk_Ailk_Bljk_BBH_MT128x144x32_MI16x16x8x1_SE_AF0EM4_GRVW2_LBSPP128_LPB2_NLCA1_SU0_SUS256_SRVW0_TT2_144_WG64_4_1_WGM15
    SolutionIndex: 188
    SolutionNameMin: Cijk_Ailk_Bljk_BBH_MT128x96x64_MI32x32x4x1_SE_AF0EM4_GRVW4_LBSPP128_LPB4_NLCA1_SU16_SUS128_SRVW0_TT1_96_WG128_2_1_WGM1
    SolutionIndex: 189
    SolutionNameMin: Cijk_Ailk_Bljk_BBH_MT32x32x32_MI16x16x8x1_SE_AF0EM4_GRVW2_LBSPP128_LPB2_NLCA1_SU0_SUS256_SRVW0_TT1_16_WG32_8_1_WGM15
    SolutionIndex: 190
    SolutionNameMin: Cijk_Ailk_Bljk_BBH_MT64x32x128_MI16x16x8x1_SE_AF0EM4_GRVW8_LBSPP256_LPB8_NLCA1_SU32_SUS256_SRVW0_TT2_16_WG32_8_1_WGM15
    SolutionIndex: 191
    SolutionNameMin: Cijk_Ailk_Bljk_BBH_MT64x128x32_MI32x32x4x1_SE_AF0EM4_GRVW8_LBSPP128_LPB8_NLCA1_SU16_SUS128_SRVW4_TT1_64_WG64_4_1_WGM1
    SolutionIndex: 192
    SolutionNameMin: Cijk_Ailk_Bljk_BBH_MT128x96x32_MI32x32x4x1_SE_AF0EM4_GRVW4_LBSPP128_LPB4_NLCA1_SU0_SUS256_SRVW4_TT1_96_WG128_2_1_WGM15
    SolutionIndex: 193
    SolutionNameMin: Cijk_Ailk_Bljk_BBH_MT32x32x32_MI16x16x8x1_SE_AF0EM4_GRVW4_LBSPP128_LPB4_NLCA1_SU0_SUS256_SRVW0_TT1_16_WG32_8_1_WGM2
    SolutionIndex: 194
    SolutionNameMin: Cijk_Ailk_Bljk_BBH_MT128x128x32_MI32x32x4x1_SE_AF0EM1_GRVW8_LBSPP128_LPB8_NLCA1_SU0_SUS256_SRVW4_TT2_64_WG64_4_1_WGM15
    SolutionIndex: 195
    SolutionNameMin: Cijk_Ailk_Bljk_BBH_MT128x96x32_MI32x32x4x1_SE_AF0EM4_GRVW4_LBSPP128_LPB4_NLCA1_SU16_SUS256_SRVW4_TT1_96_WG128_2_1_WGM2
    SolutionIndex: 196
    SolutionNameMin: Cijk_Ailk_Bljk_BBH_MT128x160x32_MI32x32x4x1_SE_AF0EM4_GRVW4_LBSPP128_LPB4_NLCA1_SU0_SUS256_SRVW0_TT1_160_WG128_2_1_WGM1
    SolutionIndex: 197
    SolutionNameMin: Cijk_Ailk_Bljk_BBH_MT32x32x128_MI16x16x8x1_SE_AF0EM4_GRVW8_LBSPP256_LPB8_NLCA1_SU16_SUS256_SRVW0_TT1_16_WG32_8_1_WGM2
    SolutionIndex: 198
    SolutionNameMin: Cijk_Ailk_Bljk_BBH_MT128x64x32_MI32x32x2x2_SE_AF0EM4_GRVW8_LBSPP128_LPB8_NLCA1_SU0_SUS256_SRVW4_TT1_32_WG128_2_1_WGM1
    SolutionIndex: 199
    SolutionNameMin: Cijk_Ailk_Bljk_BBH_MT64x128x32_MI32x32x2x2_SE_AF0EM4_GRVW8_LBSPP128_LPB8_NLCA1_SU16_SUS256_SRVW4_TT1_32_WG64_4_1_WGM1
    SolutionIndex: 200
    SolutionNameMin: Cijk_Ailk_Bljk_BBH_MT128x96x32_MI32x32x4x1_SE_AF0EM1_GRVW4_LBSPP128_LPB4_NLCA1_SU0_SUS256_SRVW4_TT1_96_WG128_2_1_WGM15
    SolutionIndex: 201
    SolutionNameMin: Cijk_Ailk_Bljk_BBH_MT128x96x32_MI32x32x4x1_SE_AF0EM4_GRVW4_LBSPP128_LPB4_NLCA1_SU16_SUS256_SRVW4_TT1_96_WG128_2_1_WGM15
    SolutionIndex: 202
    SolutionNameMin: Cijk_Ailk_Bljk_BBH_MT128x160x32_MI32x32x4x1_SE_AF0EM4_GRVW4_LBSPP128_LPB4_NLCA1_SU0_SUS256_SRVW4_TT1_160_WG128_2_1_WGM2
    SolutionIndex: 203
    SolutionNameMin: Cijk_Ailk_Bljk_BBH_MT32x32x128_MI16x16x8x1_SE_AF0EM1_GRVW2_LBSPP256_LPB2_NLCA1_SU16_SUS256_SRVW0_TT1_16_WG32_8_1_WGM15
    SolutionIndex: 204
    SolutionNameMin: Cijk_Ailk_Bljk_BBH_MT128x96x32_MI32x32x4x1_SE_AF0EM4_GRVW4_LBSPP128_LPB4_NLCA1_SU16_SUS128_SRVW4_TT1_96_WG128_2_1_WGM15
    SolutionIndex: 205
    SolutionNameMin: Cijk_Ailk_Bljk_BBH_MT128x96x64_MI32x32x4x1_SE_AF0EM4_GRVW2_LBSPP128_LPB2_NLCA1_SU0_SUS256_SRVW0_TT1_96_WG128_2_1_WGM1
    SolutionIndex: 206
    SolutionNameMin: Cijk_Ailk_Bljk_BBH_MT128x64x64_MI32x32x4x1_SE_AF0EM4_GRVW8_LBSPP128_LPB8_NLCA1_SU0_SUS256_SRVW0_TT2_32_WG64_4_1_WGM15
    SolutionIndex: 207
    SolutionNameMin: Cijk_Ailk_Bljk_BBH_MT128x96x32_MI32x32x4x1_SE_AF0EM4_GRVW4_LBSPP128_LPB4_NLCA1_SU32_SUS128_SRVW4_TT1_96_WG128_2_1_WGM2
    SolutionIndex: 208
    SolutionNameMin: Cijk_Ailk_Bljk_BBH_MT32x32x64_MI16x16x8x1_SE_AF0EM1_GRVW8_LBSPP128_LPB8_NLCA1_SU32_SUS128_SRVW0_TT1_16_WG32_8_1_WGM1
    SolutionIndex: 209
    SolutionNameMin: Cijk_Ailk_Bljk_BBH_MT128x256x32_MI32x32x4x1_SE_AF0EM1_GRVW8_LBSPP128_LPB8_NLCA1_SU0_SUS256_SRVW4_TT2_128_WG64_4_1_WGM15
    SolutionIndex: 210
    SolutionNameMin: Cijk_Ailk_Bljk_BBH_MT32x32x32_MI16x16x8x1_SE_AF0EM4_GRVW4_LBSPP128_LPB4_NLCA1_SU0_SUS256_SRVW0_TT1_16_WG32_8_1_WGM1
    SolutionIndex: 211
    SolutionNameMin: Cijk_Ailk_Bljk_BBH_MT128x96x32_MI32x32x4x1_SE_AF0EM4_GRVW4_LBSPP128_LPB4_NLCA1_SU32_SUS128_SRVW4_TT1_96_WG128_2_1_WGM15
    SolutionIndex: 212
    SolutionNameMin: Cijk_Ailk_Bljk_BBH_MT64x80x32_MI16x16x8x1_SE_AF0EM4_GRVW2_LBSPP128_LPB2_NLCA1_SU16_SUS128_SRVW0_TT1_80_WG64_4_1_WGM15
    SolutionIndex: 213
    SolutionNameMin: Cijk_Ailk_Bljk_BBH_MT32x32x128_MI16x16x8x1_SE_AF0EM1_GRVW2_LBSPP256_LPB2_NLCA1_SU16_SUS256_SRVW0_TT1_16_WG32_8_1_WGM1
    SolutionIndex: 214
    SolutionNameMin: Cijk_Ailk_Bljk_BBH_MT64x128x32_MI32x32x4x1_SE_AF0EM4_GRVW8_LBSPP128_LPB8_NLCA1_SU32_SUS256_SRVW4_TT1_64_WG64_4_1_WGM2
    SolutionIndex: 215
    SolutionNameMin: Cijk_Ailk_Bljk_BBH_MT128x80x32_MI16x16x8x1_SE_AF0EM4_GRVW2_LBSPP128_LPB2_NLCA1_SU32_SUS128_SRVW0_TT2_80_WG64_4_1_WGM1
    SolutionIndex: 216
    SolutionNameMin: Cijk_Ailk_Bljk_BBH_MT128x64x64_MI32x32x4x1_SE_AF0EM1_GRVW4_LBSPP128_LPB4_NLCA1_SU0_SUS256_SRVW4_TT2_32_WG64_4_1_WGM2
    SolutionIndex: 217
    SolutionNameMin: Cijk_Ailk_Bljk_BBH_MT32x32x32_MI16x16x8x1_SE_AF0EM4_GRVW2_LBSPP128_LPB2_NLCA1_SU0_SUS256_SRVW0_TT1_16_WG32_8_1_WGM1
    SolutionIndex: 218
    SolutionNameMin: Cijk_Ailk_Bljk_BBH_MT64x128x32_MI32x32x4x1_SE_AF0EM4_GRVW4_LBSPP128_LPB4_NLCA1_SU0_SUS256_SRVW4_TT1_64_WG64_4_1_WGM1
    SolutionIndex: 219
    SolutionNameMin: Cijk_Ailk_Bljk_BBH_MT32x32x128_MI16x16x8x1_SE_AF0EM1_GRVW4_LBSPP256_LPB4_NLCA1_SU0_SUS256_SRVW0_TT1_16_WG32_8_1_WGM1
    SolutionIndex: 220
    SolutionNameMin: Cijk_Ailk_Bljk_BBH_MT32x32x32_MI16x16x8x1_SE_AF0EM4_GRVW4_LBSPP128_LPB4_NLCA1_SU16_SUS256_SRVW0_TT1_16_WG32_8_1_WGM1
    SolutionIndex: 221
    SolutionNameMin: Cijk_Ailk_Bljk_BBH_MT32x64x32_MI16x16x8x1_SE_AF0EM4_GRVW2_LBSPP128_LPB2_NLCA1_SU0_SUS256_SRVW0_TT1_32_WG32_8_1_WGM1
    SolutionIndex: 222
    SolutionNameMin: Cijk_Ailk_Bljk_BBH_MT64x80x64_MI16x16x8x1_SE_AF0EM4_GRVW2_LBSPP128_LPB2_NLCA1_SU0_SUS256_SRVW0_TT1_80_WG64_4_1_WGM15
    SolutionIndex: 223
    SolutionNameMin: Cijk_Ailk_Bljk_BBH_MT64x32x32_MI16x16x8x1_SE_AF0EM4_GRVW2_LBSPP128_LPB2_NLCA1_SU0_SUS256_SRVW4_TT2_16_WG32_8_1_WGM15
    SolutionIndex: 224
    SolutionNameMin: Cijk_Ailk_Bljk_BBH_MT128x288x32_MI32x32x4x1_SE_AF0EM4_GRVW2_LBSPP128_LPB2_NLCA1_SU0_SUS256_SRVW0_TT1_288_WG128_2_1_WGM2
    SolutionIndex: 225
    SolutionNameMin: Cijk_Ailk_Bljk_BBH_MT128x144x32_MI16x16x8x1_SE_AF0EM4_GRVW2_LBSPP128_LPB2_NLCA1_SU0_SUS256_SRVW0_TT2_144_WG64_4_1_WGM1
    SolutionIndex: 226
    SolutionNameMin: Cijk_Ailk_Bljk_BBH_MT64x128x32_MI32x32x4x1_SE_AF0EM1_GRVW4_LBSPP128_LPB4_NLCA1_SU32_SUS128_SRVW4_TT1_64_WG64_4_1_WGM2
    SolutionIndex: 227
    SolutionNameMin: Cijk_Ailk_Bljk_BBH_MT64x64x32_MI32x32x4x1_SE_AF0EM4_GRVW8_LBSPP128_LPB8_NLCA1_SU16_SUS128_SRVW4_TT1_32_WG64_4_1_WGM1
    SolutionIndex: 228
    SolutionNameMin: Cijk_Ailk_Bljk_BBH_MT64x128x32_MI32x32x2x2_SE_AF0EM1_GRVW2_LBSPP128_LPB2_NLCA1_SU0_SUS256_SRVW0_TT1_32_WG64_4_1_WGM1
    SolutionIndex: 229
    SolutionNameMin: Cijk_Ailk_Bljk_BBH_MT256x128x32_MI32x32x4x1_SE_AF0EM1_GRVW8_LBSPP128_LPB8_NLCA1_SU0_SUS256_SRVW4_TT4_64_WG64_4_1_WGM2
    SolutionIndex: 230
    SolutionNameMin: Cijk_Ailk_Bljk_BBH_MT128x80x64_MI16x16x8x1_SE_AF0EM4_GRVW2_LBSPP128_LPB2_NLCA1_SU32_SUS256_SRVW0_TT2_80_WG64_4_1_WGM15
    SolutionIndex: 231
    SolutionNameMin: Cijk_Ailk_Bljk_BBH_MT32x64x128_MI16x16x8x1_SE_AF0EM4_GRVW8_LBSPP256_LPB8_NLCA1_SU16_SUS256_SRVW0_TT1_32_WG32_8_1_WGM1
    SolutionIndex: 232
    SolutionNameMin: Cijk_Ailk_Bljk_BBH_MT128x64x32_MI32x32x4x1_SE_AF0EM4_GRVW8_LBSPP128_LPB8_NLCA1_SU0_SUS256_SRVW4_TT2_32_WG64_4_1_WGM15
    SolutionIndex: 233
    SolutionNameMin: Cijk_Ailk_Bljk_BBH_MT64x128x32_MI32x32x4x1_SE_AF0EM1_GRVW8_LBSPP128_LPB8_NLCA1_SU16_SUS128_SRVW4_TT1_64_WG64_4_1_WGM1
    SolutionIndex: 234
    SolutionNameMin: Cijk_Ailk_Bljk_BBH_MT64x32x128_MI16x16x8x1_SE_AF0EM1_GRVW8_LBSPP256_LPB8_NLCA1_SU16_SUS256_SRVW4_TT2_16_WG32_8_1_WGM15
    SolutionIndex: 235
    SolutionNameMin: Cijk_Ailk_Bljk_BBH_MT64x128x32_MI32x32x4x1_SE_AF0EM4_GRVW8_LBSPP128_LPB8_NLCA1_SU16_SUS128_SRVW4_TT1_64_WG64_4_1_WGM15
    SolutionIndex: 236
    SolutionNameMin: Cijk_Ailk_Bljk_BBH_MT32x32x32_MI16x16x8x1_SE_AF0EM4_GRVW2_LBSPP128_LPB2_NLCA1_SU16_SUS256_SRVW0_TT1_16_WG32_8_1_WGM2
    SolutionIndex: 237
    SolutionNameMin: Cijk_Ailk_Bljk_BBH_MT128x144x32_MI16x16x8x1_SE_AF0EM4_GRVW2_LBSPP128_LPB2_NLCA1_SU0_SUS256_SRVW0_TT2_144_WG64_4_1_WGM2
    SolutionIndex: 238
    SolutionNameMin: Cijk_Ailk_Bljk_BBH_MT64x64x32_MI32x32x4x1_SE_AF0EM4_GRVW8_LBSPP128_LPB8_NLCA1_SU32_SUS128_SRVW0_TT1_32_WG64_4_1_WGM1
    SolutionIndex: 239
    SolutionNameMin: Cijk_Ailk_Bljk_BBH_MT64x32x32_MI16x16x8x1_SE_AF0EM4_GRVW2_LBSPP128_LPB2_NLCA1_SU0_SUS256_SRVW0_TT2_16_WG32_8_1_WGM2
    SolutionIndex: 240
    SolutionNameMin: Cijk_Ailk_Bljk_BBH_MT32x32x32_MI16x16x8x1_SE_AF0EM4_GRVW8_LBSPP128_LPB8_NLCA1_SU0_SUS256_SRVW0_TT1_16_WG32_8_1_WGM15
    SolutionIndex: 241
    SolutionNameMin: Cijk_Ailk_Bljk_BBH_MT128x96x32_MI32x32x4x1_SE_AF0EM4_GRVW4_LBSPP128_LPB4_NLCA1_SU16_SUS128_SRVW4_TT1_96_WG128_2_1_WGM1
    SolutionIndex: 242
    SolutionNameMin: Cijk_Ailk_Bljk_BBH_MT128x80x64_MI16x16x8x1_SE_AF0EM4_GRVW2_LBSPP128_LPB2_NLCA1_SU0_SUS256_SRVW0_TT2_80_WG64_4_1_WGM1
    SolutionIndex: 243
    SolutionNameMin: Cijk_Ailk_Bljk_BBH_MT128x96x32_MI32x32x4x1_SE_AF0EM4_GRVW2_LBSPP128_LPB2_NLCA1_SU16_SUS256_SRVW4_TT1_96_WG128_2_1_WGM2
    SolutionIndex: 244
    SolutionNameMin: Cijk_Ailk_Bljk_BBH_MT128x96x32_MI32x32x4x1_SE_AF0EM4_GRVW4_LBSPP128_LPB4_NLCA1_SU16_SUS256_SRVW4_TT1_96_WG128_2_1_WGM1
    SolutionIndex: 245
    SolutionNameMin: Cijk_Ailk_Bljk_BBH_MT128x96x32_MI32x32x4x1_SE_AF0EM4_GRVW4_LBSPP128_LPB4_NLCA1_SU32_SUS256_SRVW4_TT1_96_WG128_2_1_WGM2
    SolutionIndex: 246
    SolutionNameMin: Cijk_Ailk_Bljk_BBH_MT64x64x32_MI32x32x4x1_SE_AF0EM4_GRVW2_LBSPP128_LPB2_NLCA1_SU0_SUS256_SRVW0_TT1_32_WG64_4_1_WGM15
    SolutionIndex: 247
    SolutionNameMin: Cijk_Ailk_Bljk_BBH_MT64x128x32_MI32x32x2x2_SE_AF0EM4_GRVW2_LBSPP128_LPB2_NLCA1_SU16_SUS256_SRVW4_TT1_32_WG64_4_1_WGM1
    SolutionIndex: 248
    SolutionNameMin: Cijk_Ailk_Bljk_BBH_MT64x80x32_MI16x16x8x1_SE_AF0EM4_GRVW2_LBSPP128_LPB2_NLCA1_SU0_SUS256_SRVW0_TT1_80_WG64_4_1_WGM2
    SolutionIndex: 249
    SolutionNameMin: Cijk_Ailk_Bljk_BBH_MT128x96x32_MI32x32x4x1_SE_AF0EM4_GRVW4_LBSPP128_LPB4_NLCA1_SU32_SUS256_SRVW4_TT1_96_WG128_2_1_WGM15
    SolutionIndex: 250
    SolutionNameMin: Cijk_Ailk_Bljk_BBH_MT64x128x32_MI32x32x4x1_SE_AF0EM4_GRVW8_LBSPP128_LPB8_NLCA1_SU16_SUS256_SRVW4_TT1_64_WG64_4_1_WGM1
    SolutionIndex: 251
    SolutionNameMin: Cijk_Ailk_Bljk_BBH_MT128x96x32_MI32x32x4x1_SE_AF0EM4_GRVW4_LBSPP128_LPB4_NLCA1_SU32_SUS128_SRVW4_TT1_96_WG128_2_1_WGM1
    SolutionIndex: 252
    SolutionNameMin: Cijk_Ailk_Bljk_BBH_MT128x160x32_MI32x32x4x1_SE_AF0EM4_GRVW4_LBSPP128_LPB4_NLCA1_SU16_SUS128_SRVW0_TT1_160_WG128_2_1_WGM1
    SolutionIndex: 253
    SolutionNameMin: Cijk_Ailk_Bljk_BBH_MT64x64x32_MI32x32x4x1_SE_AF0EM4_GRVW8_LBSPP128_LPB8_NLCA1_SU32_SUS256_SRVW0_TT1_32_WG64_4_1_WGM15
    SolutionIndex: 254
    SolutionNameMin: Cijk_Ailk_Bljk_BBH_MT64x64x32_MI32x32x4x1_SE_AF0EM4_GRVW4_LBSPP128_LPB4_NLCA1_SU0_SUS256_SRVW4_TT1_32_WG64_4_1_WGM15
    SolutionIndex: 255
    SolutionNameMin: Cijk_Ailk_Bljk_BBH_MT128x160x32_MI32x32x4x1_SE_AF0EM4_GRVW2_LBSPP128_LPB2_NLCA1_SU32_SUS128_SRVW0_TT1_160_WG128_2_1_WGM15
    SolutionIndex: 256
    SolutionNameMin: Cijk_Ailk_Bljk_BBH_MT64x128x32_MI32x32x4x1_SE_AF0EM4_GRVW2_LBSPP128_LPB2_NLCA1_SU16_SUS128_SRVW4_TT1_64_WG64_4_1_WGM2
    SolutionIndex: 257
    SolutionNameMin: Cijk_Ailk_Bljk_BBH_MT64x80x64_MI16x16x8x1_SE_AF0EM4_GRVW4_LBSPP128_LPB4_NLCA1_SU32_SUS256_SRVW0_TT1_80_WG64_4_1_WGM15
    SolutionIndex: 258
    SolutionNameMin: Cijk_Ailk_Bljk_BBH_MT64x128x32_MI32x32x2x2_SE_AF0EM4_GRVW8_LBSPP128_LPB8_NLCA1_SU32_SUS128_SRVW4_TT1_32_WG64_4_1_WGM2
    SolutionIndex: 259
    SolutionNameMin: Cijk_Ailk_Bljk_BBH_MT64x64x64_MI32x32x4x1_SE_AF0EM1_GRVW2_LBSPP128_LPB2_NLCA1_SU32_SUS256_SRVW4_TT1_32_WG64_4_1_WGM2
    SolutionIndex: 260
    SolutionNameMin: Cijk_Ailk_Bljk_BBH_MT128x80x32_MI16x16x8x1_SE_AF0EM4_GRVW2_LBSPP128_LPB2_NLCA1_SU0_SUS256_SRVW0_TT2_80_WG64_4_1_WGM15
    SolutionIndex: 261
    SolutionNameMin: Cijk_Ailk_Bljk_BBH_MT64x128x32_MI32x32x2x2_SE_AF0EM1_GRVW8_LBSPP128_LPB8_NLCA1_SU0_SUS256_SRVW4_TT1_32_WG64_4_1_WGM15
    SolutionIndex: 262
    SolutionNameMin: Cijk_Ailk_Bljk_BBH_MT32x32x64_MI16x16x8x1_SE_AF0EM4_GRVW8_LBSPP128_LPB8_NLCA1_SU16_SUS128_SRVW0_TT1_16_WG32_8_1_WGM2
    SolutionIndex: 263
    SolutionNameMin: Cijk_Ailk_Bljk_BBH_MT32x32x128_MI16x16x8x1_SE_AF0EM4_GRVW8_LBSPP256_LPB8_NLCA1_SU16_SUS256_SRVW0_TT1_16_WG32_8_1_WGM15
    SolutionIndex: 264
    SolutionNameMin: Cijk_Ailk_Bljk_BBH_MT64x80x64_MI16x16x8x1_SE_AF0EM1_GRVW4_LBSPP128_LPB4_NLCA1_SU32_SUS256_SRVW0_TT1_80_WG64_4_1_WGM15
    SolutionIndex: 265
    SolutionNameMin: Cijk_Ailk_Bljk_BBH_MT128x64x32_MI32x32x2x2_SE_AF0EM4_GRVW8_LBSPP128_LPB8_NLCA1_SU0_SUS256_SRVW4_TT1_32_WG128_2_1_WGM15
    SolutionIndex: 266
    SolutionNameMin: Cijk_Ailk_Bljk_BBH_MT128x80x32_MI16x16x8x1_SE_AF0EM4_GRVW2_LBSPP128_LPB2_NLCA1_SU0_SUS256_SRVW0_TT2_80_WG64_4_1_WGM1
    SolutionIndex: 267
    SolutionNameMin: Cijk_Ailk_Bljk_BBH_MT64x128x32_MI32x32x4x1_SE_AF0EM4_GRVW2_LBSPP128_LPB2_NLCA1_SU16_SUS256_SRVW4_TT1_64_WG64_4_1_WGM1
    SolutionIndex: 268
    SolutionNameMin: Cijk_Ailk_Bljk_BBH_MT32x32x64_MI16x16x8x1_SE_AF0EM4_GRVW8_LBSPP128_LPB8_NLCA1_SU16_SUS256_SRVW0_TT1_16_WG32_8_1_WGM15
    SolutionIndex: 269
    SolutionNameMin: Cijk_Ailk_Bljk_BBH_MT64x128x64_MI32x32x4x1_SE_AF0EM1_GRVW4_LBSPP128_LPB4_NLCA1_SU32_SUS128_SRVW4_TT1_64_WG64_4_1_WGM2
    SolutionIndex: 270
    SolutionNameMin: Cijk_Ailk_Bljk_BBH_MT32x32x128_MI16x16x8x1_SE_AF0EM4_GRVW4_LBSPP256_LPB4_NLCA1_SU0_SUS256_SRVW0_TT1_16_WG32_8_1_WGM1
    SolutionIndex: 271
    SolutionNameMin: Cijk_Ailk_Bljk_BBH_MT64x128x32_MI32x32x4x1_SE_AF0EM4_GRVW2_LBSPP128_LPB2_NLCA1_SU32_SUS128_SRVW4_TT1_64_WG64_4_1_WGM1
    SolutionIndex: 272
    SolutionNameMin: Cijk_Ailk_Bljk_BBH_MT128x96x32_MI32x32x4x1_SE_AF0EM1_GRVW4_LBSPP128_LPB4_NLCA1_SU16_SUS128_SRVW4_TT1_96_WG128_2_1_WGM15
    SolutionIndex: 273
    SolutionNameMin: Cijk_Ailk_Bljk_BBH_MT128x80x64_MI16x16x8x1_SE_AF0EM4_GRVW2_LBSPP128_LPB2_NLCA1_SU0_SUS256_SRVW0_TT2_80_WG64_4_1_WGM2
    SolutionIndex: 274
    SolutionNameMin: Cijk_Ailk_Bljk_BBH_MT128x96x32_MI32x32x4x1_SE_AF0EM4_GRVW4_LBSPP128_LPB4_NLCA1_SU0_SUS256_SRVW4_TT1_96_WG128_2_1_WGM1
    SolutionIndex: 275
    SolutionNameMin: Cijk_Ailk_Bljk_BBH_MT32x32x32_MI16x16x8x1_SE_AF0EM4_GRVW4_LBSPP128_LPB4_NLCA1_SU32_SUS128_SRVW0_TT1_16_WG32_8_1_WGM2
    SolutionIndex: 276
    SolutionNameMin: Cijk_Ailk_Bljk_BBH_MT32x32x128_MI16x16x8x1_SE_AF0EM1_GRVW8_LBSPP256_LPB8_NLCA1_SU16_SUS256_SRVW0_TT1_16_WG32_8_1_WGM2
    SolutionIndex: 277
    SolutionNameMin: Cijk_Ailk_Bljk_BBH_MT64x128x32_MI32x32x4x1_SE_AF0EM4_GRVW8_LBSPP128_LPB8_NLCA1_SU0_SUS256_SRVW4_TT1_64_WG64_4_1_WGM2
    SolutionIndex: 278
    SolutionNameMin: Cijk_Ailk_Bljk_BBH_MT128x96x32_MI32x32x4x1_SE_AF0EM4_GRVW2_LBSPP128_LPB2_NLCA1_SU0_SUS256_SRVW4_TT1_96_WG128_2_1_WGM15
    SolutionIndex: 279
    SolutionNameMin: Cijk_Ailk_Bljk_BBH_MT64x32x32_MI16x16x8x1_SE_AF0EM4_GRVW8_LBSPP128_LPB8_NLCA1_SU16_SUS256_SRVW4_TT2_16_WG32_8_1_WGM1
    SolutionIndex: 280
    SolutionNameMin: Cijk_Ailk_Bljk_BBH_MT64x64x32_MI32x32x4x1_SE_AF0EM4_GRVW8_LBSPP128_LPB8_NLCA1_SU0_SUS256_SRVW4_TT1_32_WG64_4_1_WGM15
    SolutionIndex: 281
    SolutionNameMin: Cijk_Ailk_Bljk_BBH_MT128x96x64_MI32x32x4x1_SE_AF0EM4_GRVW4_LBSPP128_LPB4_NLCA1_SU32_SUS256_SRVW0_TT1_96_WG128_2_1_WGM15
    SolutionIndex: 282
    SolutionNameMin: Cijk_Ailk_Bljk_BBH_MT32x64x64_MI16x16x8x1_SE_AF0EM4_GRVW4_LBSPP128_LPB4_NLCA1_SU16_SUS128_SRVW4_TT1_32_WG32_8_1_WGM1
    SolutionIndex: 283
    SolutionNameMin: Cijk_Ailk_Bljk_BBH_MT64x64x64_MI32x32x4x1_SE_AF0EM4_GRVW8_LBSPP128_LPB8_NLCA1_SU32_SUS128_SRVW4_TT1_32_WG64_4_1_WGM2
    SolutionIndex: 284
    SolutionNameMin: Cijk_Ailk_Bljk_BBH_MT64x64x32_MI32x32x4x1_SE_AF0EM4_GRVW8_LBSPP128_LPB8_NLCA1_SU16_SUS256_SRVW4_TT1_32_WG64_4_1_WGM15
    SolutionIndex: 285
    SolutionNameMin: Cijk_Ailk_Bljk_BBH_MT64x128x32_MI32x32x4x1_SE_AF0EM4_GRVW2_LBSPP128_LPB2_NLCA1_SU32_SUS256_SRVW4_TT1_64_WG64_4_1_WGM2
    SolutionIndex: 286
    SolutionNameMin: Cijk_Ailk_Bljk_BBH_MT128x64x32_MI32x32x2x2_SE_AF0EM4_GRVW8_LBSPP128_LPB8_NLCA1_SU32_SUS128_SRVW4_TT1_32_WG128_2_1_WGM15
    SolutionIndex: 287
    SolutionNameMin: Cijk_Ailk_Bljk_BBH_MT128x64x64_MI32x32x4x1_SE_AF0EM4_GRVW8_LBSPP128_LPB8_NLCA1_SU16_SUS256_SRVW4_TT2_32_WG64_4_1_WGM2
    SolutionIndex: 288
    SolutionNameMin: Cijk_Ailk_Bljk_BBH_MT64x128x32_MI32x32x4x1_SE_AF0EM4_GRVW8_LBSPP128_LPB8_NLCA1_SU16_SUS256_SRVW4_TT1_64_WG64_4_1_WGM2
    SolutionIndex: 289
    SolutionNameMin: Cijk_Ailk_Bljk_BBH_MT128x160x32_MI32x32x4x1_SE_AF0EM4_GRVW4_LBSPP128_LPB4_NLCA1_SU32_SUS128_SRVW0_TT1_160_WG128_2_1_WGM1
    SolutionIndex: 290
    SolutionNameMin: Cijk_Ailk_Bljk_BBH_MT128x96x32_MI32x32x4x1_SE_AF0EM1_GRVW4_LBSPP128_LPB4_NLCA1_SU32_SUS128_SRVW4_TT1_96_WG128_2_1_WGM2
    SolutionIndex: 291
    SolutionNameMin: Cijk_Ailk_Bljk_BBH_MT32x32x128_MI16x16x8x1_SE_AF0EM4_GRVW8_LBSPP256_LPB8_NLCA1_SU16_SUS256_SRVW0_TT1_16_WG32_8_1_WGM1
    SolutionIndex: 292
    SolutionNameMin: Cijk_Ailk_Bljk_BBH_MT64x128x64_MI32x32x4x1_SE_AF0EM4_GRVW4_LBSPP128_LPB4_NLCA1_SU0_SUS256_SRVW4_TT1_64_WG64_4_1_WGM1
    SolutionIndex: 293
    SolutionNameMin: Cijk_Ailk_Bljk_BBH_MT128x64x64_MI32x32x4x1_SE_AF0EM4_GRVW4_LBSPP128_LPB4_NLCA1_SU0_SUS256_SRVW4_TT2_32_WG64_4_1_WGM1
    SolutionIndex: 294
    SolutionNameMin: Cijk_Ailk_Bljk_BBH_MT128x160x32_MI32x32x4x1_SE_AF0EM1_GRVW2_LBSPP128_LPB2_NLCA1_SU32_SUS256_SRVW4_TT1_160_WG128_2_1_WGM15
    SolutionIndex: 295
    SolutionNameMin: Cijk_Ailk_Bljk_BBH_MT128x160x32_MI32x32x4x1_SE_AF0EM4_GRVW4_LBSPP128_LPB4_NLCA1_SU32_SUS256_SRVW0_TT1_160_WG128_2_1_WGM1
    SolutionIndex: 296
    SolutionNameMin: Cijk_Ailk_Bljk_BBH_MT64x128x64_MI32x32x4x1_SE_AF0EM4_GRVW4_LBSPP128_LPB4_NLCA1_SU0_SUS256_SRVW0_TT1_64_WG64_4_1_WGM1
    SolutionIndex: 297
    SolutionNameMin: Cijk_Ailk_Bljk_BBH_MT64x80x32_MI16x16x8x1_SE_AF0EM4_GRVW2_LBSPP128_LPB2_NLCA1_SU16_SUS128_SRVW0_TT1_80_WG64_4_1_WGM2
    SolutionIndex: 298
    SolutionNameMin: Cijk_Ailk_Bljk_BBH_MT32x64x128_MI16x16x8x1_SE_AF0EM4_GRVW8_LBSPP256_LPB8_NLCA1_SU0_SUS256_SRVW0_TT1_32_WG32_8_1_WGM15
    SolutionIndex: 299
    SolutionNameMin: Cijk_Ailk_Bljk_BBH_MT64x32x128_MI16x16x8x1_SE_AF0EM1_GRVW8_LBSPP256_LPB8_NLCA1_SU32_SUS256_SRVW0_TT2_16_WG32_8_1_WGM15
    SolutionIndex: 300
    SolutionNameMin: Cijk_Ailk_Bljk_BBH_MT64x64x64_MI32x32x4x1_SE_AF0EM1_GRVW2_LBSPP128_LPB2_NLCA1_SU16_SUS256_SRVW4_TT1_32_WG64_4_1_WGM15
    SolutionIndex: 301
    SolutionNameMin: Cijk_Ailk_Bljk_BBH_MT128x160x32_MI32x32x4x1_SE_AF0EM4_GRVW2_LBSPP128_LPB2_NLCA1_SU16_SUS128_SRVW0_TT1_160_WG128_2_1_WGM2
    SolutionIndex: 302
    SolutionNameMin: Cijk_Ailk_Bljk_BBH_MT128x80x32_MI16x16x8x1_SE_AF0EM1_GRVW2_LBSPP128_LPB2_NLCA1_SU0_SUS256_SRVW4_TT2_80_WG64_4_1_WGM15
    SolutionIndex: 303
    SolutionNameMin: Cijk_Ailk_Bljk_BBH_MT32x32x64_MI16x16x8x1_SE_AF0EM4_GRVW8_LBSPP128_LPB8_NLCA1_SU16_SUS256_SRVW0_TT1_16_WG32_8_1_WGM2
    SolutionIndex: 304
    SolutionNameMin: Cijk_Ailk_Bljk_BBH_MT64x128x32_MI32x32x4x1_SE_AF0EM4_GRVW2_LBSPP128_LPB2_NLCA1_SU32_SUS128_SRVW4_TT1_64_WG64_4_1_WGM2
    SolutionIndex: 305
    SolutionNameMin: Cijk_Ailk_Bljk_BBH_MT128x96x64_MI32x32x4x1_SE_AF0EM4_GRVW2_LBSPP128_LPB2_NLCA1_SU0_SUS256_SRVW4_TT1_96_WG128_2_1_WGM15
    SolutionIndex: 306
    SolutionNameMin: Cijk_Ailk_Bljk_BBH_MT32x32x128_MI16x16x8x1_SE_AF0EM4_GRVW8_LBSPP256_LPB8_NLCA1_SU32_SUS256_SRVW0_TT1_16_WG32_8_1_WGM15
    SolutionIndex: 307
    SolutionNameMin: Cijk_Ailk_Bljk_BBH_MT128x64x32_MI32x32x2x2_SE_AF0EM1_GRVW8_LBSPP128_LPB8_NLCA1_SU16_SUS128_SRVW4_TT1_32_WG128_2_1_WGM15
    SolutionIndex: 308
    SolutionNameMin: Cijk_Ailk_Bljk_BBH_MT128x96x32_MI32x32x4x1_SE_AF0EM1_GRVW2_LBSPP128_LPB2_NLCA1_SU0_SUS256_SRVW4_TT1_96_WG128_2_1_WGM15
    SolutionIndex: 309
    SolutionNameMin: Cijk_Ailk_Bljk_BBH_MT128x64x64_MI32x32x4x1_SE_AF0EM4_GRVW8_LBSPP128_LPB8_NLCA1_SU0_SUS256_SRVW4_TT2_32_WG64_4_1_WGM1
    SolutionIndex: 310
    SolutionNameMin: Cijk_Ailk_Bljk_BBH_MT64x128x32_MI32x32x4x1_SE_AF0EM1_GRVW8_LBSPP128_LPB8_NLCA1_SU16_SUS128_SRVW4_TT1_64_WG64_4_1_WGM15
    SolutionIndex: 311
    SolutionNameMin: Cijk_Ailk_Bljk_BBH_MT32x32x32_MI16x16x8x1_SE_AF0EM4_GRVW8_LBSPP128_LPB8_NLCA1_SU0_SUS256_SRVW4_TT1_16_WG32_8_1_WGM1
    SolutionIndex: 312
    SolutionNameMin: Cijk_Ailk_Bljk_BBH_MT32x64x128_MI16x16x8x1_SE_AF0EM1_GRVW8_LBSPP256_LPB8_NLCA1_SU32_SUS256_SRVW0_TT1_32_WG32_8_1_WGM15
    SolutionIndex: 313
    SolutionNameMin: Cijk_Ailk_Bljk_BBH_MT64x80x32_MI16x16x8x1_SE_AF0EM4_GRVW2_LBSPP128_LPB2_NLCA1_SU0_SUS256_SRVW0_TT1_80_WG64_4_1_WGM15
    SolutionIndex: 314
    SolutionNameMin: Cijk_Ailk_Bljk_BBH_MT64x64x64_MI32x32x4x1_SE_AF0EM4_GRVW8_LBSPP128_LPB8_NLCA1_SU0_SUS256_SRVW4_TT1_32_WG64_4_1_WGM15
    SolutionIndex: 315
    SolutionNameMin: Cijk_Ailk_Bljk_BBH_MT64x32x32_MI16x16x8x1_SE_AF0EM4_GRVW2_LBSPP128_LPB2_NLCA1_SU16_SUS128_SRVW4_TT2_16_WG32_8_1_WGM1
    SolutionIndex: 316
    SolutionNameMin: Cijk_Ailk_Bljk_BBH_MT128x80x32_MI16x16x8x1_SE_AF0EM4_GRVW2_LBSPP128_LPB2_NLCA1_SU0_SUS256_SRVW4_TT2_80_WG64_4_1_WGM15
    SolutionIndex: 317
    SolutionNameMin: Cijk_Ailk_Bljk_BBH_MT32x32x128_MI16x16x8x1_SE_AF0EM4_GRVW2_LBSPP256_LPB2_NLCA1_SU16_SUS256_SRVW0_TT1_16_WG32_8_1_WGM2
    SolutionIndex: 318
    SolutionNameMin: Cijk_Ailk_Bljk_BBH_MT64x128x32_MI32x32x4x1_SE_AF0EM1_GRVW8_LBSPP128_LPB8_NLCA1_SU0_SUS256_SRVW4_TT1_64_WG64_4_1_WGM1
    SolutionIndex: 319
    SolutionNameMin: Cijk_Ailk_Bljk_BBH_MT64x64x32_MI32x32x4x1_SE_AF0EM4_GRVW8_LBSPP128_LPB8_NLCA1_SU0_SUS256_SRVW4_TT1_32_WG64_4_1_WGM2
    SolutionIndex: 320
    SolutionNameMin: Cijk_Ailk_Bljk_BBH_MT64x80x64_MI16x16x8x1_SE_AF0EM4_GRVW2_LBSPP128_LPB2_NLCA1_SU16_SUS256_SRVW0_TT1_80_WG64_4_1_WGM15
    SolutionIndex: 321
    SolutionNameMin: Cijk_Ailk_Bljk_BBH_MT32x32x32_MI16x16x8x1_SE_AF0EM4_GRVW2_LBSPP128_LPB2_NLCA1_SU0_SUS256_SRVW0_TT1_16_WG32_8_1_WGM2
    SolutionIndex: 322
    SolutionNameMin: Cijk_Ailk_Bljk_BBH_MT64x128x32_MI32x32x4x1_SE_AF0EM4_GRVW4_LBSPP128_LPB4_NLCA1_SU0_SUS256_SRVW4_TT1_64_WG64_4_1_WGM2
    SolutionIndex: 323
    SolutionNameMin: Cijk_Ailk_Bljk_BBH_MT128x288x32_MI32x32x4x1_SE_AF0EM4_GRVW2_LBSPP128_LPB2_NLCA1_SU0_SUS256_SRVW4_TT1_288_WG128_2_1_WGM15
    SolutionIndex: 324
    SolutionNameMin: Cijk_Ailk_Bljk_BBH_MT32x32x128_MI16x16x8x1_SE_AF0EM1_GRVW8_LBSPP256_LPB8_NLCA1_SU32_SUS256_SRVW0_TT1_16_WG32_8_1_WGM15
    SolutionIndex: 325
    SolutionNameMin: Cijk_Ailk_Bljk_BBH_MT128x64x64_MI32x32x4x1_SE_AF0EM1_GRVW8_LBSPP128_LPB8_NLCA1_SU0_SUS256_SRVW0_TT2_32_WG64_4_1_WGM15
    SolutionIndex: 326
    SolutionNameMin: Cijk_Ailk_Bljk_BBH_MT128x64x32_MI32x32x2x2_SE_AF0EM4_GRVW4_LBSPP128_LPB4_NLCA1_SU0_SUS256_SRVW4_TT1_32_WG128_2_1_WGM1
    SolutionIndex: 327
    SolutionNameMin: Cijk_Ailk_Bljk_BBH_MT32x32x128_MI16x16x8x1_SE_AF0EM4_GRVW8_LBSPP256_LPB8_NLCA1_SU0_SUS256_SRVW0_TT1_16_WG32_8_1_WGM1
    SolutionIndex: 328
    SolutionNameMin: Cijk_Ailk_Bljk_BBH_MT64x32x64_MI16x16x8x1_SE_AF0EM1_ASBE01_GRVW4_LPB4_PBD0_SRVW4_TT1_32_WG128_2_1_WGM10
    SolutionIndex: 329
    SolutionNameMin: Cijk_Ailk_Bljk_BBH_MT64x64x32_MI32x32x4x1_SE_AF0EM1_ASBE01_GRVW4_LPB4_PBD0_SRVW4_TT1_32_WG64_4_1_WGM1
    SolutionIndex: 330
    SolutionNameMin: Cijk_Ailk_Bljk_BBH_MT128x64x32_MI32x32x2x2_SE_AF0EM4_ASBE01_GRVW4_LPB4_PBD0_SRVW4_TT1_32_WG128_2_1_WGM1
    SolutionIndex: 331
    SolutionNameMin: Cijk_Ailk_Bljk_BBH_MT128x64x32_MI32x32x2x2_SE_AF0EM1_ASBE01_GRVW4_LPB4_PBD0_SRVW4_TT1_32_WG128_2_1_WGM1
    SolutionIndex: 332
    SolutionNameMin: Cijk_Ailk_Bljk_BBH_MT64x128x32_MI32x32x2x2_SE_AF0EM1_ASBE01_GRVW4_LPB4_PBD0_SRVW4_TT1_32_WG64_4_1_WGM1
    SolutionIndex: 333
    SolutionNameMin: Cijk_Ailk_Bljk_BBH_MT128x64x32_MI16x16x8x1_SE_AF0EM8_ASBE01_GRVW8_LPB8_PBD0_SRVW4_TT2_64_WG128_2_1_WGM1
    SolutionIndex: 334
    SolutionNameMin: Cijk_Ailk_Bljk_BBH_MT64x64x32_MI32x32x4x1_SE_AF0EM1_ASBE01_GRVW4_LPB4_PBD0_SRVW4_TT1_32_WG64_4_1_WGM10
    SolutionIndex: 335
    SolutionNameMin: Cijk_Ailk_Bljk_BBH_MT64x32x32_MI16x16x8x1_SE_AF0EM1_ASBE01_GRVW4_LPB4_PBD0_SRVW4_TT1_32_WG64_4_1_WGM1
    SolutionIndex: 336
    SolutionNameMin: Cijk_Ailk_Bljk_BBH_MT128x64x32_MI32x32x4x1_SE_AF0EM4_ASBE01_GRVW4_LPB4_PBD0_SRVW4_TT2_32_WG64_4_1_WGM10
    SolutionIndex: 337
    SolutionNameMin: Cijk_Ailk_Bljk_BBH_MT128x64x32_MI32x32x4x1_SE_AF0EM8_ASBE01_GRVW8_LPB8_PBD0_SRVW4_TT2_32_WG64_4_1_WGM1
    SolutionIndex: 338
    SolutionNameMin: Cijk_Ailk_Bljk_BBH_MT64x32x32_MI16x16x8x1_SE_AF0EM1_ASBE01_GRVW2_LPB2_PBD0_SRVW4_TT1_32_WG64_4_1_WGM1
    SolutionIndex: 339
    SolutionNameMin: Cijk_Ailk_Bljk_BBH_MT128x64x32_MI32x32x4x1_SE_AF0EM4_ASBE01_GRVW4_LPB4_PBD0_SRVW4_TT2_32_WG64_4_1_WGM1
    SolutionIndex: 340
    SolutionNameMin: Cijk_Ailk_Bljk_BBH_MT64x128x64_MI32x32x4x1_SE_AF0EM8_ASBE01_GRVW8_LPB8_PBD0_SRVW4_TT2_32_WG32_8_1_WGM10
    SolutionIndex: 341
    SolutionNameMin: Cijk_Ailk_Bljk_BBH_MT64x64x32_MI32x32x4x1_SE_AF0EM1_ASBE01_GRVW2_LPB2_PBD0_SRVW4_TT1_32_WG64_4_1_WGM1
    SolutionIndex: 342
    SolutionNameMin: Cijk_Ailk_Bljk_BBH_MT64x128x32_MI32x32x4x1_SE_AF0EM8_ASBE01_GRVW8_LPB8_PBD0_SRVW4_TT2_32_WG32_8_1_WGM1
    SolutionIndex: 343
    SolutionNameMin: Cijk_Ailk_Bljk_BBH_MT128x64x32_MI32x32x2x2_SE_AF0EM1_ASBE01_GRVW4_LPB4_PBD0_SRVW4_TT1_32_WG128_2_1_WGM10
    SolutionIndex: 344
    SolutionNameMin: Cijk_Ailk_Bljk_BBH_MT64x128x32_MI16x16x8x1_SE_AF0EM1_ASBE01_GRVW2_LPB2_PBD0_SRVW4_TT2_64_WG32_8_1_WGM1
    SolutionIndex: 345
    SolutionNameMin: Cijk_Ailk_Bljk_BBH_MT128x64x32_MI32x32x4x1_SE_AF0EM8_ASBE01_GRVW8_LPB8_PBD0_SRVW4_TT2_32_WG64_4_1_WGM4
    SolutionIndex: 346
    SolutionNameMin: Cijk_Ailk_Bljk_BBH_MT128x64x32_MI32x32x4x1_SE_AF0EM8_ASBE01_GRVW4_LPB4_PBD0_SRVW4_TT2_32_WG64_4_1_WGM1
    SolutionIndex: 347
    SolutionNameMin: Cijk_Ailk_Bljk_BBH_MT128x64x32_MI32x32x2x2_SE_AF0EM8_ASBE01_GRVW8_LPB8_PBD0_SRVW4_TT1_32_WG128_2_1_WGM1
    SolutionIndex: 348
    SolutionNameMin: Cijk_Ailk_Bljk_BBH_MT64x64x32_MI32x32x4x1_SE_AF0EM8_ASBE01_GRVW8_LPB8_PBD0_SRVW4_TT1_32_WG64_4_1_WGM10
    SolutionIndex: 349
    SolutionNameMin: Cijk_Ailk_Bljk_BBH_MT128x32x32_MI32x32x4x1_SE_AF0EM1_ASBE01_GRVW4_LPB4_PBD0_SRVW4_TT1_32_WG128_2_1_WGM1
    SolutionIndex: 350
    SolutionNameMin: Cijk_Ailk_Bljk_BBH_MT128x64x32_MI32x32x4x1_SE_AF0EM1_ASBE01_GRVW4_LPB4_PBD0_SRVW4_TT2_32_WG64_4_1_WGM4
    SolutionIndex: 351
    SolutionNameMin: Cijk_Ailk_Bljk_BBH_MT128x64x32_MI32x32x2x2_SE_AF0EM1_ASBE01_GRVW4_LPB4_PBD0_SRVW4_TT1_32_WG128_2_1_WGM4
    SolutionIndex: 352
    SolutionNameMin: Cijk_Ailk_Bljk_BBH_MT64x32x64_MI16x16x8x1_SE_AF0EM1_ASBE01_GRVW4_LPB4_PBD0_SRVW4_TT1_32_WG64_4_1_WGM1
    SolutionIndex: 353
    SolutionNameMin: Cijk_Ailk_Bljk_BBH_MT128x64x32_MI32x32x2x2_SE_AF0EM4_ASBE01_GRVW4_LPB4_PBD0_SRVW4_TT1_32_WG128_2_1_WGM4
    SolutionIndex: 354
    SolutionNameMin: Cijk_Ailk_Bljk_BBH_MT32x64x64_MI16x16x8x1_SE_AF0EM8_ASBE01_GRVW8_LPB8_PBD0_SRVW0_TT1_32_WG32_8_1_WGM1
    SolutionIndex: 355
    SolutionNameMin: Cijk_Ailk_Bljk_BBH_MT128x64x32_MI32x32x4x1_SE_AF0EM1_ASBE01_GRVW4_LPB4_PBD0_SRVW4_TT2_32_WG64_4_1_WGM1
    SolutionIndex: 356
    SolutionNameMin: Cijk_Ailk_Bljk_BBH_MT64x128x32_MI32x32x2x2_SE_AF0EM1_ASBE01_GRVW2_LPB2_PBD0_SRVW4_TT1_32_WG64_4_1_WGM10
    SolutionIndex: 357
    SolutionNameMin: Cijk_Ailk_Bljk_BBH_MT128x64x32_MI32x32x2x2_SE_AF0EM4_ASBE01_GRVW4_LPB4_PBD0_SRVW4_TT1_32_WG128_2_1_WGM10
    SolutionIndex: 358
    SolutionNameMin: Cijk_Ailk_Bljk_BBH_MT128x64x32_MI16x16x8x1_SE_AF0EM1_ASBE01_GRVW4_LPB4_PBD0_SRVW4_TT2_64_WG64_4_1_WGM1
    SolutionIndex: 359
    SolutionNameMin: Cijk_Ailk_Bljk_BBH_MT128x64x32_MI16x16x8x1_SE_AF0EM1_ASBE01_GRVW4_LPB4_PBD0_SRVW4_TT2_64_WG64_4_1_WGM4
    SolutionIndex: 360
    SolutionNameMin: Cijk_Ailk_Bljk_BBH_MT64x128x32_MI16x16x2x4_SE_AF0EM4_ASBE01_GRVW2_LPB2_PBD0_SRVW4_TT1_32_WG64_4_1_WGM4
    SolutionIndex: 361
    SolutionNameMin: Cijk_Ailk_Bljk_BBH_MT64x64x32_MI32x32x4x1_SE_AF0EM4_ASBE01_GRVW2_LPB2_PBD0_SRVW4_TT1_32_WG64_4_1_WGM10
    SolutionIndex: 362
    SolutionNameMin: Cijk_Ailk_Bljk_BBH_MT64x128x32_MI32x32x4x1_SE_AF0EM1_ASBE01_GRVW2_LPB2_PBD0_SRVW4_TT2_32_WG32_8_1_WGM10
    SolutionIndex: 363
    SolutionNameMin: Cijk_Ailk_Bljk_BBH_MT64x32x64_MI16x16x8x1_SE_AF0EM4_ASBE01_GRVW4_LPB4_PBD0_SRVW4_TT1_32_WG128_2_1_WGM4
    SolutionIndex: 364
    SolutionNameMin: Cijk_Ailk_Bljk_BBH_MT64x128x64_MI32x32x4x1_SE_AF0EM8_ASBE01_GRVW8_LPB8_PBD0_SRVW0_TT2_32_WG32_8_1_WGM4
    SolutionIndex: 365
    SolutionNameMin: Cijk_Ailk_Bljk_BBH_MT64x32x64_MI16x16x8x1_SE_AF0EM1_ASBE01_GRVW2_LPB2_PBD0_SRVW4_TT1_32_WG128_2_1_WGM10
    SolutionIndex: 366
    SolutionNameMin: Cijk_Ailk_Bljk_BBH_MT64x128x64_MI32x32x2x2_SE_AF0EM1_ASBE01_GRVW4_LPB4_PBD0_SRVW4_TT1_32_WG64_4_1_WGM1
    SolutionIndex: 367
    SolutionNameMin: Cijk_Ailk_Bljk_BBH_MT64x128x32_MI32x32x2x2_SE_AF0EM8_ASBE01_GRVW8_LPB8_PBD0_SRVW4_TT1_32_WG64_4_1_WGM1
    SolutionIndex: 368
    SolutionNameMin: Cijk_Ailk_Bljk_BBH_MT128x64x32_MI32x32x4x1_SE_AF0EM4_ASBE01_GRVW4_LPB4_PBD0_SRVW4_TT2_32_WG64_4_1_WGM4
    SolutionIndex: 369
    SolutionNameMin: Cijk_Ailk_Bljk_BBH_MT64x32x32_MI16x16x8x1_SE_AF0EM1_ASBE01_GRVW4_LPB4_PBD0_SRVW4_TT1_32_WG128_2_1_WGM1
    SolutionIndex: 370
    SolutionNameMin: Cijk_Ailk_Bljk_BBH_MT64x32x32_MI16x16x8x1_SE_AF0EM4_ASBE01_GRVW2_LPB2_PBD0_SRVW0_TT1_32_WG128_2_1_WGM1
- - - [64, 35, 1, 35]
    - [8, 0.005]
  - - [64, 35, 1, 32]
    - [7, 0.005]
  - - [64, 15, 1, 15]
    - [6, 0.001]
  - - [64, 15, 1, 17]
    - [10, 0.001]
  - - [64, 17, 1, 17]
    - [7, 0.001]
  - - [64, 30, 1, 30]
    - [6, 0.004]
  - - [64, 32, 1, 32]
    - [24, 0.005]
  - - [64, 31, 1, 31]
    - [16, 0.004]
  - - [64, 24, 1, 24]
    - [10, 0.003]
  - - [64, 15, 1, 15]
    - [12, 0.001]
  - - [64, 17, 1, 17]
    - [7, 0.001]
  - - [64, 34, 1, 34]
    - [7, 0.004]
  - - [64, 14, 1, 15]
    - [6, 0.001]
  - - [64, 17, 1, 21]
    - [6, 0.001]
  - - [64, 14, 1, 14]
    - [6, 0.001]
  - - [64, 24, 1, 34]
    - [25, 0.004]
  - - [64, 21, 1, 21]
    - [8, 0.002]
  - - [64, 31, 1, 30]
    - [22, 0.004]
  - - [64, 128, 512, 128]
    - [162, 28.792]
  - - [64, 512, 1, 512]
    - [327, 3.237]
  - - [64, 512, 64, 512]
    - [212, 44.66]
  - - [128, 128, 512, 64]
    - [191, 27.606]
  - - [512, 512, 1, 64]
    - [220, 4.83]
  - - [512, 512, 64, 64]
    - [201, 38.353]
  - - [1024, 4, 1, 2]
    - [166, 0.003]
  - - [1024, 4, 1, 1024]
    - [270, 0.564]
  - - [1024, 32, 1, 2]
    - [210, 0.022]
  - - [1024, 32, 1, 1024]
    - [171, 4.759]
  - - [1024, 2048, 1, 2]
    - [266, 0.623]
  - - [1024, 2048, 1, 1024]
    - [237, 67.44]
  - - [1024, 2048, 1, 4096]
    - [237, 82.406]
  - - [1024, 2048, 1, 30528]
    - [237, 88.558]
  - - [1024, 4096, 1, 1024]
    - [192, 80.307]
  - - [1024, 4096, 1, 4096]
    - [192, 88.508]
  - - [1024, 4096, 1, 30528]
    - [168, 92.094]
  - - [4096, 2048, 1, 1024]
    - [245, 84.264]
  - - [4096, 4096, 1, 1024]
    - [211, 87.879]
  - - [32, 33, 1600, 33]
    - [221, 4.517]
  - - [32, 200, 1, 1]
    - [228, 0.001]
  - - [64, 3, 512, 3]
    - [175, 0.052]
  - - [64, 5, 512, 5]
    - [210, 0.147]
  - - [64, 5, 960, 5]
    - [175, 0.232]
  - - [64, 9, 512, 9]
    - [189, 0.443]
  - - [64, 512, 1, 1]
    - [210, 0.012]
  - - [67, 512, 1, 2048]
    - [324, 5.977]
  - - [74, 512, 1, 2048]
    - [276, 6.819]
  - - [74, 960, 1, 2048]
    - [219, 12.157]
  - - [100, 512, 1, 2048]
    - [213, 9.574]
  - - [128, 27, 32768, 27]
    - [175, 7.871]
  - - [256, 1024, 1, 1]
    - [210, 0.088]
  - - [256, 8976, 1, 1536]
    - [196, 76.37]
  - - [256, 8976, 1, 2048]
    - [196, 79.784]
  - - [256, 8976, 1, 2304]
    - [196, 81.09]
  - - [256, 8976, 1, 2560]
    - [295, 81.921]
  - - [256, 8976, 1, 2816]
    - [196, 82.557]
  - - [256, 8976, 1, 3072]
    - [196, 83.199]
  - - [256, 8976, 1, 4352]
    - [289, 85.155]
  - - [256, 8976, 1, 4864]
    - [196, 86.052]
  - - [256, 8976, 1, 5376]
    - [165, 86.694]
  - - [256, 8976, 1, 5632]
    - [165, 86.848]
  - - [256, 8976, 1, 5888]
    - [196, 87.17]
  - - [256, 8976, 1, 6144]
    - [165, 87.325]
  - - [256, 8976, 1, 6656]
    - [165, 87.462]
  - - [256, 8976, 1, 7168]
    - [165, 87.73]
  - - [256, 8976, 1, 7424]
    - [165, 87.79]
  - - [256, 8976, 1, 8192]
    - [165, 88.28]
  - - [256, 8976, 1, 8448]
    - [165, 88.359]
  - - [256, 8976, 1, 8960]
    - [165, 88.546]
  - - [256, 8976, 1, 9472]
    - [186, 88.597]
  - - [256, 8976, 1, 9728]
    - [165, 88.716]
  - - [256, 8976, 1, 9984]
    - [165, 88.864]
  - - [256, 8976, 1, 10240]
    - [165, 89.06]
  - - [256, 8976, 1, 10496]
    - [165, 88.966]
  - - [256, 8976, 1, 11008]
    - [165, 89.091]
  - - [256, 8976, 1, 11520]
    - [165, 89.142]
  - - [256, 8976, 1, 12288]
    - [165, 89.361]
  - - [256, 8976, 1, 14336]
    - [186, 89.604]
  - - [256, 8976, 1, 14848]
    - [165, 89.701]
  - - [256, 8976, 1, 15104]
    - [165, 89.834]
  - - [256, 8976, 1, 15872]
    - [186, 89.855]
  - - [256, 8976, 1, 17152]
    - [165, 89.939]
  - - [256, 8976, 1, 19712]
    - [186, 90.15]
  - - [256, 8976, 1, 19968]
    - [165, 90.191]
  - - [256, 8976, 1, 20480]
    - [186, 90.155]
  - - [256, 8976, 1, 20992]
    - [165, 90.319]
  - - [256, 8976, 1, 22016]
    - [186, 90.307]
  - - [256, 8976, 1, 26112]
    - [165, 90.515]
  - - [256, 8976, 1, 33536]
    - [186, 90.673]
  - - [256, 8976, 1, 44505]
    - [165, 90.427]
  - - [256, 32768, 1, 128]
    - [232, 49.017]
  - - [257, 1024, 1, 4096]
    - [259, 31.04]
  - - [480, 32768, 1, 1024]
    - [192, 82.771]
  - - [512, 200, 1, 1]
    - [210, 0.034]
  - - [512, 200, 1, 32]
    - [321, 1.095]
  - - [512, 215, 1, 2048]
    - [169, 19.444]
  - - [512, 256, 1, 2048]
    - [170, 20.508]
  - - [512, 1600, 1, 32]
    - [162, 7.111]
  - - [512, 1600, 1, 512]
    - [254, 42.899]
  - - [512, 32768, 1, 256]
    - [176, 72.947]
  - - [560, 200, 1, 1024]
    - [262, 13.585]
  - - [560, 1600, 1, 1024]
    - [296, 57.626]
  - - [768, 215, 1, 2048]
    - [231, 24.821]
  - - [768, 256, 1, 2048]
    - [312, 28.985]
  - - [1024, 200, 1, 1]
    - [189, 0.07]
  - - [1024, 512, 1, 1]
    - [311, 0.148]
  - - [1024, 512, 1, 64]
    - [240, 8.845]
  - - [1024, 512, 1, 1024]
    - [257, 39.561]
  - - [1024, 960, 1, 64]
    - [319, 14.361]
  - - [1024, 960, 1, 1024]
    - [280, 61.773]
  - - [1024, 1600, 1, 1]
    - [164, 0.295]
  - - [1024, 1600, 1, 1024]
    - [174, 64.084]
  - - [1024, 1792, 1, 256]
    - [307, 48.31]
  - - [1024, 2048, 1, 256]
    - [260, 43.126]
  - - [1024, 2560, 1, 256]
    - [232, 50.647]
  - - [1024, 3072, 1, 256]
    - [277, 50.921]
  - - [1024, 3328, 1, 256]
    - [261, 54.43]
  - - [1024, 3840, 1, 256]
    - [192, 59.622]
  - - [1024, 4096, 1, 256]
    - [201, 56.932]
  - - [1024, 4608, 1, 256]
    - [288, 60.614]
  - - [1024, 4864, 1, 256]
    - [214, 58.35]
  - - [1024, 5120, 1, 256]
    - [244, 60.242]
  - - [1024, 5632, 1, 256]
    - [211, 62.803]
  - - [1024, 6144, 1, 256]
    - [207, 64.414]
  - - [1024, 6400, 1, 256]
    - [180, 64.347]
  - - [1024, 7168, 1, 256]
    - [211, 67.504]
  - - [1024, 7424, 1, 256]
    - [180, 65.514]
  - - [1024, 7680, 1, 256]
    - [290, 67.772]
  - - [1024, 7936, 1, 256]
    - [207, 65.773]
  - - [1024, 8192, 1, 256]
    - [204, 68.356]
  - - [1024, 8448, 1, 256]
    - [211, 70.854]
  - - [1024, 8704, 1, 256]
    - [214, 66.727]
  - - [1024, 8960, 1, 256]
    - [191, 66.811]
  - - [1024, 9728, 1, 256]
    - [204, 70.089]
  - - [1024, 9984, 1, 256]
    - [278, 71.827]
  - - [1024, 10240, 1, 256]
    - [180, 68.636]
  - - [1024, 10496, 1, 256]
    - [241, 68.756]
  - - [1024, 11008, 1, 256]
    - [204, 70.602]
  - - [1024, 11264, 1, 256]
    - [204, 71.496]
  - - [1024, 11520, 1, 256]
    - [195, 72.004]
  - - [1024, 12288, 1, 256]
    - [207, 74.433]
  - - [1024, 13312, 1, 256]
    - [207, 72.896]
  - - [1024, 13568, 1, 256]
    - [176, 71.968]
  - - [1024, 14336, 1, 256]
    - [245, 72.143]
  - - [1024, 14592, 1, 256]
    - [207, 74.501]
  - - [1024, 14848, 1, 256]
    - [176, 73.217]
  - - [1024, 15104, 1, 256]
    - [176, 74.256]
  - - [1024, 16128, 1, 256]
    - [176, 75.006]
  - - [1024, 17152, 1, 256]
    - [204, 74.672]
  - - [1024, 18944, 1, 256]
    - [241, 75.079]
  - - [1024, 19712, 1, 256]
    - [207, 77.373]
  - - [1024, 19968, 1, 256]
    - [207, 77.266]
  - - [1024, 20480, 1, 256]
    - [241, 76.298]
  - - [1024, 20992, 1, 256]
    - [176, 77.616]
  - - [1024, 21504, 1, 256]
    - [195, 77.523]
  - - [1024, 22016, 1, 256]
    - [207, 76.828]
  - - [1024, 23552, 1, 256]
    - [207, 77.089]
  - - [1024, 28672, 1, 256]
    - [211, 78.415]
  - - [1024, 32768, 1, 512]
    - [177, 87.497]
  - - [1024, 32768, 1, 1024]
    - [177, 92.016]
  - - [1024, 33536, 1, 256]
    - [207, 79.914]
  - - [1024, 40448, 1, 256]
    - [207, 80.937]
  - - [1600, 512, 1, 1024]
    - [253, 53.043]
  - - [2048, 512, 1, 1]
    - [313, 0.22]
  - - [2048, 512, 1, 2048]
    - [242, 62.219]
  - - [2048, 960, 1, 2048]
    - [309, 76.511]
  - - [2048, 1024, 1, 1]
    - [215, 0.304]
  - - [2048, 1024, 1, 256]
    - [226, 42.759]
  - - [3200, 1024, 1, 2048]
    - [182, 76.125]
  - - [4096, 1024, 1, 1]
    - [218, 0.407]
  - - [64, 14, 10880, 14]
    - [175, 2.478]
  - - [64, 14, 10880, 15]
    - [175, 2.632]
  - - [64, 15, 7680, 15]
    - [175, 2.692]
  - - [64, 15, 10880, 15]
    - [175, 2.813]
  - - [64, 15, 7680, 17]
    - [175, 2.911]
  - - [64, 17, 6144, 17]
    - [175, 3.203]
  - - [64, 17, 7680, 17]
    - [175, 3.303]
  - - [64, 17, 6144, 21]
    - [175, 3.853]
  - - [64, 21, 6144, 21]
    - [175, 4.718]
  - - [64, 24, 4736, 24]
    - [175, 6.007]
  - - [64, 24, 4736, 34]
    - [175, 7.407]
  - - [64, 30, 2048, 30]
    - [239, 6.987]
  - - [64, 31, 2048, 30]
    - [175, 7.198]
  - - [64, 31, 2048, 31]
    - [175, 7.344]
  - - [64, 32, 4608, 32]
    - [315, 12.817]
  - - [64, 34, 4736, 34]
    - [246, 6.754]
  - - [64, 35, 4608, 32]
    - [175, 10.252]
  - - [64, 35, 4608, 35]
    - [238, 6.714]
  - - [1024, 3840, 1, 1024]
    - [194, 79.414]
  - - [1024, 3840, 1, 4096]
    - [209, 92.386]
  - - [1024, 3968, 1, 1024]
    - [192, 78.032]
  - - [1024, 3968, 1, 4096]
    - [192, 86.145]
  - - [1024, 3968, 1, 42720]
    - [224, 89.523]
  - - [1024, 6528, 1, 1024]
    - [167, 83.193]
  - - [1024, 6528, 1, 4096]
    - [177, 86.551]
  - - [1024, 6528, 1, 42720]
    - [269, 92.576]
  - - [1024, 7104, 1, 1024]
    - [200, 86.383]
  - - [1024, 7104, 1, 4096]
    - [200, 92.302]
  - - [1024, 7104, 1, 42720]
    - [301, 95.87]
  - - [1024, 7200, 1, 1024]
    - [192, 86.585]
  - - [1024, 7200, 1, 4096]
    - [179, 93.658]
  - - [1024, 7200, 1, 42720]
    - [294, 97.155]
  - - [1024, 8064, 1, 1024]
    - [200, 84.951]
  - - [1024, 8064, 1, 4096]
    - [200, 89.376]
  - - [1024, 8160, 1, 1024]
    - [192, 85.824]
  - - [1024, 8160, 1, 4096]
    - [192, 90.325]
  - - [1024, 9216, 1, 1024]
    - [167, 84.361]
  - - [1024, 9216, 1, 4096]
    - [194, 90.12]
  - - [1024, 9520, 1, 1024]
    - [177, 85.275]
  - - [1024, 9520, 1, 4096]
    - [179, 92.586]
  - - [1024, 9520, 1, 42720]
    - [165, 96.342]
  - - [1024, 10064, 1, 1024]
    - [278, 87.125]
  - - [1024, 10064, 1, 4096]
    - [278, 92.264]
  - - [1024, 10080, 1, 1024]
    - [245, 88.04]
  - - [1024, 10080, 1, 4096]
    - [308, 92.757]
  - - [1024, 10080, 1, 42720]
    - [201, 96.554]
  - - [1024, 10200, 1, 1024]
    - [214, 84.932]
  - - [1024, 10200, 1, 4096]
    - [302, 87.093]
  - - [4096, 3840, 1, 1024]
    - [207, 89.108]
  - - [4096, 3968, 1, 1024]
    - [180, 85.955]
  - - [4096, 6528, 1, 1024]
    - [204, 89.749]
  - - [4096, 7104, 1, 1024]
    - [195, 91.544]
  - - [4096, 7200, 1, 1024]
    - [243, 90.277]
  - - [4096, 8064, 1, 1024]
    - [201, 91.099]
  - - [4096, 8160, 1, 1024]
    - [195, 91.604]
  - - [4096, 9216, 1, 1024]
    - [195, 91.814]
  - - [4096, 9520, 1, 1024]
    - [245, 91.084]
  - - [4096, 10064, 1, 1024]
    - [201, 91.062]
  - - [4096, 10080, 1, 1024]
    - [211, 91.134]
  - - [4096, 10200, 1, 1024]
    - [195, 91.221]
  - - [64, 27, 1920, 27]
    - [29, 2.212]
  - - [64, 33, 1920, 27]
    - [37, 2.176]
  - - [64, 33, 1920, 33]
    - [39, 2.734]
  - - [1024, 3240, 1, 1024]
    - [42, 34.747]
  - - [1024, 3240, 1, 4096]
    - [53, 38.008]
  - - [1024, 3960, 1, 1024]
    - [45, 34.758]
  - - [1024, 3960, 1, 4096]
    - [47, 37.079]
  - - [1024, 3960, 1, 42720]
    - [44, 39.481]
  - - [4096, 3240, 1, 1024]
    - [55, 40.489]
  - - [4096, 3960, 1, 1024]
    - [35, 41.988]
  - - [64, 192, 64, 1280]
    - [329, 49.975]
  - - [64, 320, 64, 1280]
    - [342, 52.865]
  - - [64, 384, 64, 1280]
    - [342, 60.68]
  - - [64, 448, 64, 1280]
    - [348, 60.139]
  - - [64, 192, 64, 2048]
    - [341, 48.544]
  - - [64, 320, 64, 2048]
    - [360, 52.446]
  - - [64, 384, 64, 2048]
    - [342, 58.592]
  - - [64, 448, 64, 2048]
    - [361, 59.408]
  - - [1225, 32, 64, 192]
    - [338, 26.594]
  - - [1225, 48, 64, 192]
    - [349, 25.907]
  - - [1225, 64, 64, 192]
    - [355, 39.628]
  - - [1225, 48, 64, 256]
    - [359, 30.153]
  - - [1225, 64, 64, 256]
    - [351, 45.276]
  - - [1225, 48, 64, 288]
    - [358, 32.404]
  - - [1225, 64, 64, 288]
    - [343, 47.534]
  - - [5329, 80, 64, 64]
    - [369, 22.903]
  - - [289, 128, 64, 768]
    - [332, 50.869]
  - - [289, 160, 64, 768]
    - [331, 46.593]
  - - [289, 192, 64, 768]
    - [351, 55.547]
  - - [64, 192, 32, 1280]
    - [354, 40.259]
  - - [64, 320, 32, 1280]
    - [329, 44.604]
  - - [64, 384, 32, 1280]
    - [348, 51.76]
  - - [64, 448, 32, 1280]
    - [334, 58.616]
  - - [64, 192, 32, 2048]
    - [363, 41.07]
  - - [64, 320, 32, 2048]
    - [364, 47.942]
  - - [64, 384, 32, 2048]
    - [340, 53.735]
  - - [64, 448, 32, 2048]
    - [341, 58.714]
  - - [1225, 32, 32, 192]
    - [335, 22.882]
  - - [1225, 48, 32, 192]
    - [338, 22.316]
  - - [1225, 64, 32, 192]
    - [334, 33.766]
  - - [1225, 48, 32, 256]
    - [349, 25.759]
  - - [1225, 64, 32, 256]
    - [350, 36.538]
  - - [1225, 48, 32, 288]
    - [349, 26.621]
  - - [1225, 64, 32, 288]
    - [329, 40.248]
  - - [5329, 80, 32, 64]
    - [338, 21.759]
  - - [289, 128, 32, 768]
    - [332, 42.119]
  - - [289, 160, 32, 768]
    - [341, 40.982]
  - - [289, 192, 32, 768]
    - [329, 47.091]
  - - [3136, 256, 64, 64]
    - [367, 44.6]
  - - [3136, 64, 64, 64]
    - [333, 31.66]
  - - [3136, 64, 64, 256]
    - [330, 56.207]
  - - [784, 512, 64, 128]
    - [337, 52.694]
  - - [784, 128, 64, 512]
    - [345, 65.476]
  - - [196, 1024, 64, 256]
    - [336, 52.203]
  - - [196, 256, 64, 1024]
    - [353, 54.226]
  - - [49, 2048, 64, 512]
    - [344, 40.651]
  - - [49, 512, 64, 2048]
    - [328, 38.299]
  - - [3136, 256, 32, 64]
    - [367, 41.085]
  - - [3136, 64, 32, 64]
    - [370, 26.9]
  - - [3136, 64, 32, 256]
    - [346, 52.336]
  - - [784, 512, 32, 128]
    - [345, 49.002]
  - - [784, 128, 32, 512]
    - [347, 60.817]
  - - [196, 1024, 32, 256]
    - [353, 48.692]
  - - [196, 256, 32, 1024]
    - [357, 42.8]
  - - [49, 2048, 32, 512]
    - [362, 35.577]
  - - [49, 512, 32, 2048]
    - [365, 32.983]
  - - [3136, 128, 64, 64]
    - [347, 40.121]
  - - [3136, 256, 64, 128]
    - [337, 63.352]
  - - [784, 512, 64, 256]
    - [342, 68.653]
  - - [3136, 128, 64, 256]
    - [337, 73.182]
  - - [3136, 256, 64, 256]
    - [337, 77.466]
  - - [196, 1024, 64, 512]
    - [336, 59.869]
  - - [784, 256, 64, 512]
    - [342, 74.064]
  - - [784, 512, 64, 512]
    - [342, 78.005]
  - - [196, 512, 64, 1024]
    - [368, 62.231]
  - - [196, 1024, 64, 1024]
    - [357, 64.463]
  - - [49, 2048, 64, 1024]
    - [356, 46.573]
  - - [49, 1024, 64, 2048]
    - [366, 45.221]
  - - [3136, 128, 32, 64]
    - [347, 35.95]
  - - [3136, 256, 32, 128]
    - [347, 59.813]
  - - [784, 512, 32, 256]
    - [342, 65.198]
  - - [3136, 128, 32, 256]
    - [337, 68.767]
  - - [3136, 256, 32, 256]
    - [337, 74.783]
  - - [196, 1024, 32, 512]
    - [353, 57.36]
  - - [784, 256, 32, 512]
    - [342, 69.309]
  - - [784, 512, 32, 512]
    - [342, 74.467]
  - - [196, 512, 32, 1024]
    - [339, 54.178]
  - - [196, 1024, 32, 1024]
    - [353, 62.771]
  - - [49, 2048, 32, 1024]
    - [341, 41.196]
  - - [49, 1024, 32, 2048]
    - [352, 38.467]
  - - [64, 128, 624, 128]
    - [162, 30.314]
  - - [1024, 10, 1, 1024]
    - [197, 1.464]
  - - [2048, 2048, 1, 2048]
    - [274, 85.976]
  - - [1024, 10, 1, 2]
    - [275, 0.007]
  - - [1024, 5, 1, 2]
    - [166, 0.003]
  - - [1024, 5, 1, 1024]
    - [169, 0.726]
  - - [64, 512, 16, 512]
    - [172, 29.73]
  - - [1024, 1024, 1, 1024]
    - [173, 54.463]
  - - [1024, 9600, 1, 4096]
    - [179, 94.133]
  - - [1024, 8192, 1, 1024]
    - [192, 84.887]
  - - [1024, 1280, 1, 4096]
    - [281, 77.715]
  - - [512, 512, 1, 512]
    - [163, 19.937]
  - - [1024, 1152, 1, 1024]
    - [184, 57.676]
  - - [1024, 5248, 1, 2]
    - [181, 0.958]
  - - [1024, 820, 1, 1024]
    - [183, 51.746]
  - - [4096, 1152, 1, 1024]
    - [258, 79.609]
  - - [1024, 308, 1, 30522]
    - [283, 45.372]
  - - [1024, 39, 1, 1024]
    - [263, 5.546]
  - - [1024, 616, 1, 1024]
    - [284, 40.705]
  - - [64, 512, 96, 512]
    - [285, 51.531]
  - - [1024, 39, 1, 2]
    - [189, 0.028]
  - - [128, 128, 1, 64]
    - [236, 0.338]
  - - [1024, 160, 1, 30522]
    - [190, 34.692]
  - - [1024, 2560, 1, 1024]
    - [177, 71.98]
  - - [4096, 9600, 1, 1024]
    - [195, 91.917]
  - - [1024, 8, 1, 2]
    - [193, 0.006]
  - - [1024, 800, 1, 1024]
    - [287, 50.647]
  - - [64, 128, 640, 128]
    - [223, 30.487]
  - - [4096, 1024, 1, 1024]
    - [195, 80.307]
  - - [1024, 8, 1, 1024]
    - [197, 1.18]
  - - [1024, 1024, 1, 2]
    - [297, 0.431]
  - - [4096, 5248, 1, 1024]
    - [207, 89.836]
  - - [4096, 4096, 1, 4096]
    - [202, 91.721]
  - - [1024, 77, 1, 30522]
    - [203, 21.729]
  - - [1024, 9, 1, 2]
    - [217, 0.006]
  - - [1024, 1024, 1, 4096]
    - [230, 69.78]
  - - [1024, 9, 1, 1024]
    - [291, 1.309]
  - - [1024, 780, 1, 1024]
    - [292, 50.355]
  - - [64, 4, 38400, 4]
    - [175, 0.238]
  - - [1024, 4096, 1, 2]
    - [199, 0.801]
  - - [4096, 2560, 1, 1024]
    - [180, 84.37]
  - - [64, 128, 144, 128]
    - [167, 21.249]
  - - [1024, 780, 1, 30522]
    - [206, 75.27]
  - - [8192, 7680, 1, 8192]
    - [229, 96.915]
  - - [1024, 3072, 1, 2]
    - [277, 0.731]
  - - [8192, 8192, 1, 8192]
    - [204, 96.129]
  - - [1024, 180, 1, 1024]
    - [298, 21.807]
  - - [1024, 180, 1, 30522]
    - [299, 38.429]
  - - [1024, 512, 1, 2]
    - [210, 0.28]
  - - [1024, 8192, 1, 4096]
    - [192, 90.628]
  - - [1024, 385, 1, 30522]
    - [300, 52.158]
  - - [4096, 512, 1, 1024]
    - [182, 63.397]
  - - [1024, 160, 1, 1024]
    - [303, 20.524]
  - - [1024, 5120, 1, 4096]
    - [192, 84.441]
  - - [2048, 1920, 1, 2048]
    - [214, 89.187]
  - - [1024, 462, 1, 1024]
    - [222, 35.418]
  - - [1024, 462, 1, 30522]
    - [264, 55.256]
  - - [1024, 77, 1, 1024]
    - [197, 10.872]
  - - [960, 1024, 1, 1024]
    - [227, 65.648]
  - - [1024, 40, 1, 2]
    - [189, 0.028]
  - - [64, 5, 1, 5]
    - [228, 0.0]
  - - [1024, 40, 1, 1024]
    - [306, 5.859]
  - - [4096, 5120, 1, 1024]
    - [211, 88.222]
  - - [1024, 200, 1, 30522]
    - [234, 40.274]
  - - [1024, 41, 1, 2]
    - [210, 0.028]
  - - [1024, 200, 1, 1024]
    - [163, 21.686]
  - - [4096, 8192, 1, 1024]
    - [243, 90.387]
  - - [1024, 41, 1, 1024]
    - [197, 5.916]
  - - [1024, 4992, 1, 4096]
    - [192, 82.816]
  - - [4096, 1280, 1, 1024]
    - [201, 78.137]
  - - [1024, 2560, 1, 4096]
    - [192, 82.331]
  - - [1024, 4992, 1, 2]
    - [274, 0.919]
  - - [32, 33, 1, 33]
    - [217, 0.01]
  - - [7680, 8192, 1, 8192]
    - [229, 96.882]
  - - [4096, 3072, 1, 1024]
    - [211, 87.283]
  - - [1024, 9600, 1, 1024]
    - [200, 87.025]
  - - [1024, 385, 1, 1024]
    - [314, 35.641]
  - - [64, 4, 32768, 4]
    - [175, 0.235]
  - - [64, 128, 656, 128]
    - [279, 30.508]
  - - [64, 512, 128, 512]
    - [247, 51.203]
  - - [1024, 4992, 1, 1024]
    - [177, 78.004]
  - - [1024, 1152, 1, 2]
    - [248, 0.464]
  - - [1024, 5248, 1, 4096]
    - [192, 86.57]
  - - [1024, 9600, 1, 33712]
    - [179, 96.655]
  - - [1024, 3072, 1, 4096]
    - [316, 75.529]
  - - [4096, 3840, 1, 4096]
    - [209, 95.006]
  - - [1024, 6, 1, 1024]
    - [317, 0.847]
  - - [1024, 5120, 1, 1024]
    - [192, 77.775]
  - - [1024, 8192, 1, 33712]
    - [192, 92.17]
  - - [1024, 308, 1, 1024]
    - [282, 30.376]
  - - [3840, 4096, 1, 4096]
    - [233, 95.021]
  - - [1024, 2560, 1, 2]
    - [251, 0.672]
  - - [1024, 6, 1, 2]
    - [210, 0.004]
  - - [64, 128, 160, 128]
    - [318, 23.089]
  - - [1024, 512, 1, 4096]
    - [320, 54.389]
  - - [64, 128, 128, 128]
    - [250, 19.031]
  - - [1024, 5248, 1, 1024]
    - [204, 79.595]
  - - [1024, 820, 1, 30522]
    - [185, 77.507]
  - - [1024, 1280, 1, 2]
    - [322, 0.496]
  - - [1024, 1280, 1, 1024]
    - [177, 61.121]
  - - [1920, 2048, 1, 2048]
    - [250, 89.24]
  - - [1024, 3072, 1, 1024]
    - [167, 68.59]
  - - [1024, 800, 1, 30522]
    - [325, 77.021]
  - - [64, 128, 1, 128]
    - [208, 0.307]
  - - [64, 512, 80, 512]
    - [267, 49.744]
  - - [480, 512, 1, 512]
    - [208, 21.807]
  - - [512, 480, 1, 512]
    - [268, 21.607]
  - - [4096, 4992, 1, 1024]
    - [195, 90.736]
  - - [479, 32768, 1, 1024]
    - [272, 80.37]
  - - [1024, 1152, 1, 4096]
    - [273, 78.504]
  - - [1024, 5120, 1, 2]
    - [181, 0.934]
  - - [1024, 1024, 64, 64]
    - [177, 47.066]
  - - [64, 1024, 32, 1024]
    - [178, 52.133]
  - - [1024, 16384, 1, 3072]
    - [179, 90.876]
  - - [1024, 2048, 1, 30592]
    - [187, 88.346]
  - - [640, 2048, 1, 2560]
    - [188, 74.412]
  - - [1024, 1024, 64, 96]
    - [177, 61.996]
  - - [2048, 2, 1, 2048]
    - [169, 0.77]
  - - [2048, 2, 1, 2]
    - [166, 0.003]
  - - [1536, 4096, 1, 4608]
    - [198, 85.871]
  - - [512, 512, 256, 64]
    - [192, 44.462]
  - - [2048, 1024, 1, 8192]
    - [196, 80.368]
  - - [4096, 16384, 1, 1024]
    - [195, 92.486]
  - - [1024, 8192, 1, 50304]
    - [205, 92.299]
  - - [1536, 8192, 1, 50304]
    - [216, 94.994]
  - - [6144, 8192, 1, 1536]
    - [204, 93.149]
  - - [1024, 4096, 1, 30592]
    - [224, 92.103]
  - - [1536, 4096, 1, 6144]
    - [225, 86.294]
  - - [1024, 16384, 1, 4096]
    - [179, 91.903]
  - - [1024, 16384, 1, 50304]
    - [196, 94.991]
  - - [1024, 4096, 1, 3072]
    - [192, 87.951]
  - - [1536, 8192, 1, 1536]
    - [235, 89.897]
  - - [1024, 2048, 1, 3072]
    - [237, 80.657]
  - - [2560, 2048, 1, 7680]
    - [192, 85.504]
  - - [96, 1024, 64, 1024]
    - [249, 62.966]
  - - [2048, 1024, 1, 2048]
    - [252, 72.75]
  - - [2048, 1024, 1, 30592]
    - [255, 82.83]
  - - [64, 1024, 256, 1024]
    - [256, 69.21]
  - - [8192, 1024, 1, 2048]
    - [176, 87.927]
  - - [2560, 2048, 1, 2560]
    - [192, 83.017]
  - - [1536, 8192, 1, 4608]
    - [265, 92.597]
  - - [64, 512, 256, 512]
    - [271, 58.21]
  - - [1024, 2048, 1, 50304]
    - [225, 88.647]
  - - [1024, 1024, 32, 64]
    - [177, 44.462]
  - - [1536, 8192, 1, 6144]
    - [286, 92.868]
  - - [1024, 1024, 256, 64]
    - [177, 49.062]
  - - [512, 512, 40, 64]
    - [244, 34.039]
  - - [1536, 4096, 1, 50304]
    - [293, 88.65]
  - - [1024, 1024, 128, 96]
    - [177, 64.053]
  - - [1024, 8192, 1, 3072]
    - [192, 90.069]
  - - [64, 1024, 64, 1024]
    - [271, 58.72]
  - - [1024, 1024, 128, 64]
    - [177, 48.237]
  - - [64, 1024, 128, 1024]
    - [304, 66.546]
  - - [1024, 4096, 1, 50304]
    - [305, 92.112]
  - - [96, 1024, 128, 1024]
    - [274, 64.447]
  - - [6144, 4096, 1, 1536]
    - [310, 91.719]
  - - [1024, 16, 1, 2]
    - [189, 0.012]
  - - [1024, 16, 1, 1024]
    - [197, 2.379]
  - - [2560, 4, 1, 2]
    - [166, 0.006]
  - - [1024, 16384, 1, 1024]
    - [274, 87.639]
  - - [2560, 2048, 1, 1920]
    - [249, 82.238]
  - - [2048, 1024, 1, 6144]
    - [289, 79.434]
  - - [2560, 4, 1, 2560]
    - [169, 2.002]
  - - [512, 512, 128, 64]
    - [192, 42.087]
  - - [1024, 8192, 1, 30592]
    - [323, 92.276]
  - - [1536, 4096, 1, 1536]
    - [326, 83.159]
  - - [64, 512, 40, 512]
    - [167, 44.859]
- null
