library/src/blas3/Tensile/Logic/asm_full/arcturus_Cijk_Ailk_Bljk_HBH.yaml
- {MinimumRequiredVersion: 4.6.0}
- arcturus
- gfx908
- [Device 7380, Device 7388, Device 738c, Device 7390, Device 731f]
    SolutionIndex: 0
    SolutionNameMin: Cijk_Ailk_Bljk_HBH_MT016x016x16_PGR1_PLR1_TT02_02
    SolutionIndex: 1
    SolutionNameMin: Cijk_Ailk_Bljk_HBH_MT032x032x16_PGR1_PLR1_TT04_04
    SolutionIndex: 2
    SolutionNameMin: Cijk_Ailk_Bljk_HBH_MT064x016x16_PGR1_PLR1_TT04_04
    SolutionIndex: 3
    SolutionNameMin: Cijk_Ailk_Bljk_HBH_MT032x016x16_PGR1_PLR1_TT02_02
    SolutionIndex: 4
    SolutionNameMin: Cijk_Ailk_Bljk_HBH_MT064x016x16_PGR1_PLR1_TT04_02
    SolutionIndex: 5
    SolutionNameMin: Cijk_Ailk_Bljk_HBH_MT064x008x16_PGR1_PLR1_TT02_02
    SolutionIndex: 6
    SolutionNameMin: Cijk_Ailk_Bljk_HBH_MT064x016x16_PGR1_PLR1_TT02_02
    SolutionIndex: 7
    SolutionNameMin: Cijk_Ailk_Bljk_HBH_MT128x016x16_PGR1_PLR1_TT04_02
    SolutionIndex: 8
    SolutionNameMin: Cijk_Ailk_Bljk_HBH_MT016x016x32_PGR1_PLR1_TT02_02
    SolutionIndex: 9
    SolutionNameMin: Cijk_Ailk_Bljk_HBH_MT032x008x32_PGR1_PLR1_TT02_02
    SolutionIndex: 10
    SolutionNameMin: Cijk_Ailk_Bljk_HBH_MT032x016x32_PGR1_PLR1_TT02_02
    SolutionIndex: 11
    SolutionNameMin: Cijk_Ailk_Bljk_HBH_MT064x016x32_PGR1_PLR1_TT04_02
    SolutionIndex: 12
    SolutionNameMin: Cijk_Ailk_Bljk_HBH_MT064x008x32_PGR1_PLR1_TT02_02
    SolutionIndex: 13
    SolutionNameMin: Cijk_Ailk_Bljk_HBH_MT064x016x32_PGR1_PLR1_TT02_02
    SolutionIndex: 14
    SolutionNameMin: Cijk_Ailk_Bljk_HBH_MT128x016x32_PGR1_PLR1_TT04_02
    SolutionIndex: 15
    SolutionNameMin: Cijk_Ailk_Bljk_HBH_MT032x008x64_PGR1_PLR1_TT02_02
    SolutionIndex: 16
    SolutionNameMin: Cijk_Ailk_Bljk_HBH_MT064x008x64_PGR1_PLR1_TT02_02
    SolutionIndex: 17
    SolutionNameMin: Cijk_Ailk_Bljk_HBH_MT064x032x08_PGR1_PLR1_TT08_04
    SolutionIndex: 18
    SolutionNameMin: Cijk_Ailk_Bljk_HBH_MT032x032x08_PGR1_PLR1_TT04_04
    SolutionIndex: 19
    SolutionNameMin: Cijk_Ailk_Bljk_HBH_MT064x032x08_PGR1_PLR1_TT08_04
    SolutionIndex: 20
    SolutionNameMin: Cijk_Ailk_Bljk_HBH_MT032x016x16_PGR1_PLR1_TT04_02
    SolutionIndex: 21
    SolutionNameMin: Cijk_Ailk_Bljk_HBH_MT032x032x16_PGR1_PLR1_TT04_04
    SolutionIndex: 22
    SolutionNameMin: Cijk_Ailk_Bljk_HBH_MT064x064x16_PGR1_PLR1_TT08_08
    SolutionIndex: 23
    SolutionNameMin: Cijk_Ailk_Bljk_HBH_MT064x016x16_PGR1_PLR1_TT04_02
    SolutionIndex: 24
    SolutionNameMin: Cijk_Ailk_Bljk_HBH_MT064x016x16_PGR1_PLR1_TT02_02
    SolutionIndex: 25
    SolutionNameMin: Cijk_Ailk_Bljk_HBH_MT128x016x16_PGR1_PLR1_TT04_02
    SolutionIndex: 26
    SolutionNameMin: Cijk_Ailk_Bljk_HBH_MT064x016x16_PGR1_PLR1_TT04_04
    SolutionIndex: 27
    SolutionNameMin: Cijk_Ailk_Bljk_HBH_MT064x008x16_PGR1_PLR1_TT02_02
    SolutionIndex: 28
    SolutionNameMin: Cijk_Ailk_Bljk_HBH_MT016x016x24_PGR1_PLR1_TT02_02
    SolutionIndex: 29
    SolutionNameMin: Cijk_Ailk_Bljk_HBH_MT032x016x24_PGR1_PLR1_TT04_02
    SolutionIndex: 30
    SolutionNameMin: Cijk_Ailk_Bljk_HBH_MT016x016x24_PGR1_PLR1_TT02_02
    SolutionIndex: 31
    SolutionNameMin: Cijk_Ailk_Bljk_HBH_MT032x016x24_PGR1_PLR1_TT04_02
    SolutionIndex: 32
    SolutionNameMin: Cijk_Ailk_Bljk_HBH_MT032x032x24_PGR1_PLR1_TT04_04
    SolutionIndex: 33
    SolutionNameMin: Cijk_Ailk_Bljk_HBH_MT032x032x32_PGR1_PLR1_TT04_04
    SolutionIndex: 34
    SolutionNameMin: Cijk_Ailk_Bljk_HBH_MT064x016x32_PGR1_PLR1_TT02_02
    SolutionIndex: 35
    SolutionNameMin: Cijk_Ailk_Bljk_HBH_MT128x016x32_PGR1_PLR1_TT04_02
    SolutionIndex: 36
    SolutionNameMin: Cijk_Ailk_Bljk_HBH_MT032x008x32_PGR1_PLR1_TT02_02
    SolutionIndex: 37
    SolutionNameMin: Cijk_Ailk_Bljk_HBH_MT064x008x32_PGR1_PLR1_TT02_02
    SolutionIndex: 38
    SolutionNameMin: Cijk_Ailk_Bljk_HBH_MT032x008x64_PGR1_PLR1_TT02_02
    SolutionIndex: 39
    SolutionNameMin: Cijk_Ailk_Bljk_HBH_MT064x008x64_PGR1_PLR1_TT02_02
    SolutionIndex: 40
    SolutionNameMin: Cijk_Ailk_Bljk_HBH_MT064x064x08_PGR1_PLR1_TT04_04
    SolutionIndex: 41
    SolutionNameMin: Cijk_Ailk_Bljk_HBH_MT064x128x08_PGR1_PLR1_TT04_08
    SolutionIndex: 42
    SolutionNameMin: Cijk_Ailk_Bljk_HBH_MT128x064x08_PGR1_PLR1_TT08_04
    SolutionIndex: 43
    SolutionNameMin: Cijk_Ailk_Bljk_HBH_MT064x032x16_PGR0_PLR1_TT08_04
    SolutionIndex: 44
    SolutionNameMin: Cijk_Ailk_Bljk_HBH_MT064x064x16_PGR1_PLR1_TT04_04
    SolutionIndex: 45
    SolutionNameMin: Cijk_Ailk_Bljk_HBH_MT064x128x16_PGR1_PLR1_TT04_08
    SolutionIndex: 46
    SolutionNameMin: Cijk_Ailk_Bljk_HBH_MT128x064x16_PGR1_PLR1_TT08_04
    SolutionIndex: 47
    SolutionNameMin: Cijk_Ailk_Bljk_HBH_MT128x128x16_PGR1_PLR1_TT08_08
    SolutionIndex: 48
    SolutionNameMin: Cijk_Ailk_Bljk_HBH_MT064x032x16_PGR0_PLR0_TT04_04
    SolutionIndex: 49
    SolutionNameMin: Cijk_Ailk_Bljk_HBH_MT064x128x16_PGR0_PLR0_TT04_08
    SolutionIndex: 50
    SolutionNameMin: Cijk_Ailk_Bljk_HBH_MT032x128x16_PGR1_PLR0_TT04_04
    SolutionIndex: 51
    SolutionNameMin: Cijk_Ailk_Bljk_HBH_MT032x128x16_PGR0_PLR0_TT04_04
    SolutionIndex: 52
    SolutionNameMin: Cijk_Ailk_Bljk_HBH_MT064x064x04_PGR1_PLR1_TT04_04
    SolutionIndex: 53
    SolutionNameMin: Cijk_Ailk_Bljk_HBH_MT064x064x08_PGR1_PLR1_TT04_04
    SolutionIndex: 54
    SolutionNameMin: Cijk_Ailk_Bljk_HBH_MT064x064x16_PGR1_PLR1_TT04_04
    SolutionIndex: 55
    SolutionNameMin: Cijk_Ailk_Bljk_HBH_MT032x032x08_PGR0_PLR1_TT04_04
    SolutionIndex: 56
    SolutionNameMin: Cijk_Ailk_Bljk_HBH_MT032x032x16_PGR1_PLR1_TT04_04
    SolutionIndex: 57
    SolutionNameMin: Cijk_Ailk_Bljk_HBH_MT064x016x16_PGR1_PLR1_TT04_04
    SolutionIndex: 58
    SolutionNameMin: Cijk_Ailk_Bljk_HBH_MT064x032x16_PGR1_PLR1_TT04_04
    SolutionIndex: 59
    SolutionNameMin: Cijk_Ailk_Bljk_HBH_MT064x064x16_PGR1_PLR1_TT04_04
    SolutionIndex: 60
    SolutionNameMin: Cijk_Ailk_Bljk_HBH_MT032x032x32_PGR1_PLR1_TT04_04
    SolutionIndex: 61
    SolutionNameMin: Cijk_Ailk_Bljk_HBH_MT064x016x32_PGR1_PLR1_TT04_04
    SolutionIndex: 62
    SolutionNameMin: Cijk_Ailk_Bljk_HBH_MT064x032x32_PGR1_PLR1_TT04_04
    SolutionIndex: 63
    SolutionNameMin: Cijk_Ailk_Bljk_HBH_MT128x016x32_PGR1_PLR1_TT04_04
    SolutionIndex: 64
    SolutionNameMin: Cijk_Ailk_Bljk_HBH_MT128x032x32_PGR1_PLR1_TT04_04
    SolutionIndex: 65
    SolutionNameMin: Cijk_Ailk_Bljk_HBH_MT064x064x16_PGR1_PLR1_TT08_08
    SolutionIndex: 66
    SolutionNameMin: Cijk_Ailk_Bljk_HBH_MT128x128x16_PGR1_PLR1_TT08_08
    SolutionIndex: 67
    SolutionNameMin: Cijk_Ailk_Bljk_HBH_MT032x032x08_PGR1_PLR1_TT04_04
    SolutionIndex: 68
    SolutionNameMin: Cijk_Ailk_Bljk_HBH_MT064x032x08_PGR1_PLR1_TT08_04
    SolutionIndex: 69
    SolutionNameMin: Cijk_Ailk_Bljk_HBH_MT064x064x08_PGR1_PLR1_TT08_08
    SolutionIndex: 70
    SolutionNameMin: Cijk_Ailk_Bljk_HBH_MT128x128x08_PGR1_PLR1_TT08_08
    SolutionIndex: 71
    SolutionNameMin: Cijk_Ailk_Bljk_HBH_MT128x032x16_PGR1_PLR1_TT08_04
    SolutionIndex: 72
    SolutionNameMin: Cijk_Ailk_Bljk_HBH_MT032x032x16_PGR1_PLR1_TT04_04
    SolutionIndex: 73
    SolutionNameMin: Cijk_Ailk_Bljk_HBH_MT064x032x16_PGR1_PLR1_TT08_04
    SolutionIndex: 74
    SolutionNameMin: Cijk_Ailk_Bljk_HBH_MT064x064x16_PGR1_PLR1_TT04_04
    SolutionIndex: 75
    SolutionNameMin: Cijk_Ailk_Bljk_HBH_MT128x064x16_PGR1_PLR1_TT08_04
    SolutionIndex: 76
    SolutionNameMin: Cijk_Ailk_Bljk_HBH_MT128x128x16_PGR1_PLR1_TT08_08
    SolutionIndex: 77
    SolutionNameMin: Cijk_Ailk_Bljk_HBH_MT064x032x16_PGR1_PLR1_TT04_04
    SolutionIndex: 78
    SolutionNameMin: Cijk_Ailk_Bljk_HBH_MT128x032x16_PGR1_PLR1_TT08_04
    SolutionIndex: 79
    SolutionNameMin: Cijk_Ailk_Bljk_HBH_MT128x064x32_PGR1_PLR1_TT08_04
    SolutionIndex: 80
    SolutionNameMin: Cijk_Ailk_Bljk_HBH_MT128x032x32_PGR1_PLR1_TT04_04
    SolutionIndex: 81
    SolutionNameMin: Cijk_Ailk_Bljk_HBH_MT064x016x32_PGR1_PLR1_TT04_04
    SolutionIndex: 82
    SolutionNameMin: Cijk_Ailk_Bljk_HBH_MT064x064x16_PGR1_PLR1_TT08_08
    SolutionIndex: 83
    SolutionNameMin: Cijk_Ailk_Bljk_HBH_MT128x128x16_PGR1_PLR1_TT08_08
    SolutionIndex: 84
    SolutionNameMin: Cijk_Ailk_Bljk_HBH_MT064x064x32_PGR1_PLR1_TT08_08
    SolutionIndex: 85
    SolutionNameMin: Cijk_Ailk_Bljk_HBH_MT128x128x32_PGR1_PLR1_TT08_08
    SolutionIndex: 86
    SolutionNameMin: Cijk_Ailk_Bljk_HBH_MT064x032x16_PGR0_PLR1_TT08_04
    SolutionIndex: 87
    SolutionNameMin: Cijk_Ailk_Bljk_HBH_MT128x128x32_PGR0_PLR1_TT08_08
    SolutionIndex: 88
    SolutionNameMin: Cijk_Ailk_Bljk_HBH_MT064x128x16_PGR1_PLR1_TT04_08
    SolutionIndex: 89
    SolutionNameMin: Cijk_Ailk_Bljk_HBH_MT128x064x16_PGR1_PLR1_TT08_04
    SolutionIndex: 90
    SolutionNameMin: Cijk_Ailk_Bljk_HBH_MT128x128x16_PGR1_PLR1_TT08_08
    SolutionIndex: 91
    SolutionNameMin: Cijk_Ailk_Bljk_HBH_MT128x064x16_PGR1_PLR1_TT04_08
    SolutionIndex: 92
    SolutionNameMin: Cijk_Ailk_Bljk_HBH_MT128x064x16_PGR1_PLR1_TT04_08
    SolutionIndex: 93
    SolutionNameMin: Cijk_Ailk_Bljk_HBH_MT128x064x32_PGR1_PLR1_TT04_04
    SolutionIndex: 94
    SolutionNameMin: Cijk_Ailk_Bljk_HBH_MT256x128x32_PGR1_PLR1_TT08_08
    SolutionIndex: 95
    SolutionNameMin: Cijk_Ailk_Bljk_HBH_MT128x032x16_PGR0_PLR0_TT08_04
    SolutionIndex: 96
    SolutionNameMin: Cijk_Ailk_Bljk_HBH_MT064x128x16_PGR1_PLR0_TT04_08
    SolutionIndex: 97
    SolutionNameMin: Cijk_Ailk_Bljk_HBH_MT128x064x16_PGR1_PLR0_TT08_04
    SolutionIndex: 98
    SolutionNameMin: Cijk_Ailk_Bljk_HBH_MT128x064x16_PGR1_PLR0_TT04_08
    SolutionIndex: 99
    SolutionNameMin: Cijk_Ailk_Bljk_HBH_MT064x128x04_PGR0_PLR0_TT04_08
    SolutionIndex: 100
    SolutionNameMin: Cijk_Ailk_Bljk_HBH_MT064x064x04_PGR0_PLR0_TT04_04
    SolutionIndex: 101
    SolutionNameMin: Cijk_Ailk_Bljk_HBH_MT064x064x04_PGR1_PLR0_TT04_04
    SolutionIndex: 102
    SolutionNameMin: Cijk_Ailk_Bljk_HBH_MT064x064x04_PGR0_PLR1_TT04_04
    SolutionIndex: 103
    SolutionNameMin: Cijk_Ailk_Bljk_HBH_MT064x064x04_PGR1_PLR1_TT04_04
    SolutionIndex: 104
    SolutionNameMin: Cijk_Ailk_Bljk_HBH_MT064x128x08_PGR0_PLR0_TT04_08
    SolutionIndex: 105
    SolutionNameMin: Cijk_Ailk_Bljk_HBH_MT064x064x08_PGR0_PLR0_TT04_04
    SolutionIndex: 106
    SolutionNameMin: Cijk_Ailk_Bljk_HBH_MT064x128x08_PGR1_PLR0_TT04_08
    SolutionIndex: 107
    SolutionNameMin: Cijk_Ailk_Bljk_HBH_MT064x064x08_PGR1_PLR0_TT04_04
    SolutionIndex: 108
    SolutionNameMin: Cijk_Ailk_Bljk_HBH_MT064x128x08_PGR0_PLR1_TT04_08
    SolutionIndex: 109
    SolutionNameMin: Cijk_Ailk_Bljk_HBH_MT064x064x08_PGR0_PLR1_TT04_04
    SolutionIndex: 110
    SolutionNameMin: Cijk_Ailk_Bljk_HBH_MT064x064x08_PGR1_PLR1_TT04_04
    SolutionIndex: 111
    SolutionNameMin: Cijk_Ailk_Bljk_HBH_MT128x128x16_PGR0_PLR0_TT08_08
    SolutionIndex: 112
    SolutionNameMin: Cijk_Ailk_Bljk_HBH_MT064x128x16_PGR0_PLR0_TT04_08
    SolutionIndex: 113
    SolutionNameMin: Cijk_Ailk_Bljk_HBH_MT064x064x16_PGR1_PLR0_TT04_04
    SolutionIndex: 114
    SolutionNameMin: Cijk_Ailk_Bljk_HBH_MT064x064x16_PGR0_PLR1_TT04_04
    SolutionIndex: 115
    SolutionNameMin: Cijk_Ailk_Bljk_HBH_MT064x064x16_PGR1_PLR1_TT04_04
    SolutionIndex: 116
    SolutionNameMin: Cijk_Ailk_Bljk_HBH_MT128x128x04_PGR0_PLR0_TT08_08
    SolutionIndex: 117
    SolutionNameMin: Cijk_Ailk_Bljk_HBH_MT064x128x04_PGR0_PLR0_TT04_08
    SolutionIndex: 118
    SolutionNameMin: Cijk_Ailk_Bljk_HBH_MT064x064x04_PGR0_PLR0_TT04_04
    SolutionIndex: 119
    SolutionNameMin: Cijk_Ailk_Bljk_HBH_MT064x128x04_PGR1_PLR0_TT04_08
    SolutionIndex: 120
    SolutionNameMin: Cijk_Ailk_Bljk_HBH_MT064x064x04_PGR1_PLR0_TT04_04
    SolutionIndex: 121
    SolutionNameMin: Cijk_Ailk_Bljk_HBH_MT064x128x04_PGR0_PLR1_TT04_08
    SolutionIndex: 122
    SolutionNameMin: Cijk_Ailk_Bljk_HBH_MT064x064x04_PGR0_PLR1_TT04_04
    SolutionIndex: 123
    SolutionNameMin: Cijk_Ailk_Bljk_HBH_MT064x128x04_PGR1_PLR1_TT04_08
    SolutionIndex: 124
    SolutionNameMin: Cijk_Ailk_Bljk_HBH_MT064x064x04_PGR1_PLR1_TT04_04
    SolutionIndex: 125
    SolutionNameMin: Cijk_Ailk_Bljk_HBH_MT064x064x08_PGR0_PLR0_TT04_04
    SolutionIndex: 126
    SolutionNameMin: Cijk_Ailk_Bljk_HBH_MT064x128x08_PGR1_PLR0_TT04_08
    SolutionIndex: 127
    SolutionNameMin: Cijk_Ailk_Bljk_HBH_MT064x064x08_PGR1_PLR0_TT04_04
    SolutionIndex: 128
    SolutionNameMin: Cijk_Ailk_Bljk_HBH_MT064x128x08_PGR0_PLR1_TT04_08
    SolutionIndex: 129
    SolutionNameMin: Cijk_Ailk_Bljk_HBH_MT064x064x08_PGR0_PLR1_TT04_04
    SolutionIndex: 130
    SolutionNameMin: Cijk_Ailk_Bljk_HBH_MT064x064x08_PGR1_PLR1_TT04_04
    SolutionIndex: 131
    SolutionNameMin: Cijk_Ailk_Bljk_HBH_MT064x064x16_PGR0_PLR0_TT04_04
    SolutionIndex: 132
    SolutionNameMin: Cijk_Ailk_Bljk_HBH_MT128x128x16_PGR1_PLR0_TT08_08
    SolutionIndex: 133
    SolutionNameMin: Cijk_Ailk_Bljk_HBH_MT064x128x16_PGR1_PLR0_TT04_08
    SolutionIndex: 134
    SolutionNameMin: Cijk_Ailk_Bljk_HBH_MT064x064x16_PGR1_PLR1_TT04_04
    SolutionIndex: 135
    SolutionNameMin: Cijk_Ailk_Bljk_HBH_MT128x064x16_EPS1_GRVW08_LPB00_PGR1_PLR1_SNLL1_TT08_08_VW08_WG16_08_01_WGM01
    SolutionIndex: 136
    SolutionNameMin: Cijk_Ailk_Bljk_HBH_MT064x128x16_EPS1_GRVW04_LPB04_PGR1_PLR1_SNLL1_TT08_04_VW04_WG08_32_01_WGM01
    SolutionIndex: 137
    SolutionNameMin: Cijk_Ailk_Bljk_HBH_MT128x064x16_EPS1_GRVW04_LPB04_PGR1_PLR1_SNLL1_TT08_04_VW04_WG16_16_01_WGM01
    SolutionIndex: 138
    SolutionNameMin: Cijk_Ailk_Bljk_HBH_MT128x128x16_EPS1_GRVW04_LPB04_PGR1_PLR1_SNLL1_TT08_08_VW04_WG16_16_01_WGM01
    SolutionIndex: 139
    SolutionNameMin: Cijk_Ailk_Bljk_HBH_MT064x128x16_EPS1_GRVW04_LPB04_PGR1_PLR1_SNLL1_TT08_04_VW04_WG08_32_01_WGM08
    SolutionIndex: 140
    SolutionNameMin: Cijk_Ailk_Bljk_HBH_MT128x064x16_EPS1_GRVW04_LPB04_PGR1_PLR1_SNLL1_TT08_04_VW04_WG16_16_01_WGM08
    SolutionIndex: 141
    SolutionNameMin: Cijk_Ailk_Bljk_HBH_MT256x064x16_EPS1_GRVW04_LPB04_PGR1_PLR1_SNLL1_TT08_08_VW04_WG32_08_01_WGM64
    SolutionIndex: 142
    SolutionNameMin: Cijk_Ailk_Bljk_HBH_MT064x128x32_EPS0_GRVW04_LPB04_PGR0_PLR0_SNLL0_TT08_04_VW04_WG08_32_01_WGM01
    SolutionIndex: 143
    SolutionNameMin: Cijk_Ailk_Bljk_HBH_MT064x064x32_EPS0_GRVW04_LPB04_PGR0_PLR0_SNLL0_TT04_04_VW04_WG16_16_01_WGM01
    SolutionIndex: 144
    SolutionNameMin: Cijk_Ailk_Bljk_HBH_MT128x064x32_EPS1_GRVW04_LPB04_PGR1_PLR1_SNLL1_TT08_04_VW04_WG16_16_01_WGM01
    SolutionIndex: 145
    SolutionNameMin: Cijk_Ailk_Bljk_HBH_MT064x064x32_EPS0_GRVW04_LPB04_PGR0_PLR0_SNLL0_TT04_04_VW04_WG16_16_01_WGM08
    SolutionIndex: 146
    SolutionNameMin: Cijk_Ailk_Bljk_HBH_MT128x064x32_EPS0_GRVW08_LPB08_PGR0_PLR1_SNLL0_TT08_08_VW08_WG16_08_01_WGM01
    SolutionIndex: 147
    SolutionNameMin: Cijk_Ailk_Bljk_HBH_MT64x128x16_MI32x32x4x2_SE_AF0EM1_ASEM1_GRVW2_ONLL0_SNLL1
    SolutionIndex: 148
    SolutionNameMin: Cijk_Ailk_Bljk_HBH_MT64x128x16_MI32x32x4x2_SE_AF0EM1_ASEM2_GRVW2_ONLL0_SNLL1
    SolutionIndex: 149
    SolutionNameMin: Cijk_Ailk_Bljk_HBH_MT64x128x16_MI32x32x4x2_SE_AF0EM2_ASEM1_GRVW2_ONLL0_SNLL1
    SolutionIndex: 150
    SolutionNameMin: Cijk_Ailk_Bljk_HBH_MT64x128x16_MI32x32x4x2_SE_AF0EM1_ASEM1_GRVW2_ONLL0_SNLL0
    SolutionIndex: 151
    SolutionNameMin: Cijk_Ailk_Bljk_HBH_MT64x128x16_MI32x32x4x2_SE_AF0EM1_ASEM2_GRVW2_ONLL0_SNLL0
    SolutionIndex: 152
    SolutionNameMin: Cijk_Ailk_Bljk_HBH_MT64x128x16_MI32x32x4x2_SE_AF0EM2_ASEM1_GRVW2_ONLL0_SNLL0
    SolutionIndex: 153
    SolutionNameMin: Cijk_Ailk_Bljk_HBH_MT64x128x16_MI32x32x4x2_SE_AF0EM2_ASEM2_GRVW2_ONLL0_SNLL0
    SolutionIndex: 154
    SolutionNameMin: Cijk_Ailk_Bljk_HBH_MT64x128x32_MI32x32x4x2_SE_AF0EM2_ASEM2_GRVW2_ONLL0_SNLL0
    SolutionIndex: 155
    SolutionNameMin: Cijk_Ailk_Bljk_HBH_MT32x256x16_MI32x32x4x2_SE_AF0EM1_ASEM2_GRVW4_ONLL0_SNLL0
    SolutionIndex: 156
    SolutionNameMin: Cijk_Ailk_Bljk_HBH_MT64x128x16_MI32x32x4x2_SE_AF0EM1_ASEM1_GRVW2_ONLL1_SNLL1
    SolutionIndex: 157
    SolutionNameMin: Cijk_Ailk_Bljk_HBH_MT64x128x16_MI32x32x4x2_SE_AF0EM1_ASEM2_GRVW2_ONLL1_SNLL1
    SolutionIndex: 158
    SolutionNameMin: Cijk_Ailk_Bljk_HBH_MT64x128x16_MI32x32x4x2_SE_AF0EM2_ASEM1_GRVW2_ONLL1_SNLL1
    SolutionIndex: 159
    SolutionNameMin: Cijk_Ailk_Bljk_HBH_MT64x128x16_MI32x32x4x2_SE_AF0EM2_ASEM2_GRVW2_ONLL1_SNLL1
    SolutionIndex: 160
    SolutionNameMin: Cijk_Ailk_Bljk_HBH_MT64x128x16_MI32x32x4x2_SE_AF0EM1_ASEM1_GRVW2_ONLL1_SNLL0
    SolutionIndex: 161
    SolutionNameMin: Cijk_Ailk_Bljk_HBH_MT64x128x16_MI32x32x4x2_SE_AF0EM1_ASEM2_GRVW2_ONLL1_SNLL0
    SolutionIndex: 162
    SolutionNameMin: Cijk_Ailk_Bljk_HBH_MT64x128x16_MI32x32x4x2_SE_AF0EM2_ASEM1_GRVW2_ONLL1_SNLL0
    SolutionIndex: 163
    SolutionNameMin: Cijk_Ailk_Bljk_HBH_MT64x128x16_MI32x32x4x2_SE_AF0EM2_ASEM2_GRVW2_ONLL1_SNLL0
    SolutionIndex: 164
    SolutionNameMin: Cijk_Ailk_Bljk_HBH_MT64x128x8_MI32x32x4x2_SE_AF0EM2_ASEM1_GRVW4_ONLL1_SNLL0
    SolutionIndex: 165
    SolutionNameMin: Cijk_Ailk_Bljk_HBH_MT64x128x8_MI32x32x4x2_SE_AF0EM2_ASEM2_GRVW4_ONLL1_SNLL0
    SolutionIndex: 166
    SolutionNameMin: Cijk_Ailk_Bljk_HBH_MT32x256x16_MI32x32x4x2_SE_AF0EM2_ASEM2_GRVW4_ONLL1_SNLL0
    SolutionIndex: 167
    SolutionNameMin: Cijk_Ailk_Bljk_HBH_MT64x256x16_MI32x32x4x2_SE_AF0EM1_ASEM2_GRVW2_ONLL0_SNLL1
    SolutionIndex: 168
    SolutionNameMin: Cijk_Ailk_Bljk_HBH_MT64x256x16_MI32x32x4x2_SE_AF0EM1_ASEM1_GRVW2_ONLL0_SNLL0
    SolutionIndex: 169
    SolutionNameMin: Cijk_Ailk_Bljk_HBH_MT64x256x16_MI32x32x4x2_SE_AF0EM1_ASEM2_GRVW2_ONLL0_SNLL0
    SolutionIndex: 170
    SolutionNameMin: Cijk_Ailk_Bljk_HBH_MT64x256x16_MI32x32x4x2_SE_AF0EM1_ASEM1_GRVW2_ONLL1_SNLL1
    SolutionIndex: 171
    SolutionNameMin: Cijk_Ailk_Bljk_HBH_MT64x256x16_MI32x32x4x2_SE_AF0EM1_ASEM1_GRVW2_ONLL1_SNLL0
    SolutionIndex: 172
    SolutionNameMin: Cijk_Ailk_Bljk_HBH_MT64x256x16_MI32x32x4x2_SE_AF0EM1_ASEM2_GRVW2_ONLL1_SNLL0
    SolutionIndex: 173
    SolutionIndex: 174
    SolutionIndex: 175
    SolutionIndex: 176
    SolutionIndex: 177
    SolutionIndex: 178
    SolutionIndex: 179
    SolutionIndex: 180
    SolutionIndex: 181
    SolutionIndex: 182
    SolutionIndex: 183
    SolutionIndex: 184
    SolutionIndex: 185
    SolutionIndex: 186
    SolutionIndex: 187
    SolutionIndex: 188
    SolutionIndex: 189
    SolutionIndex: 190
    SolutionIndex: 191
    SolutionIndex: 192
    SolutionIndex: 193
    SolutionIndex: 194
    SolutionIndex: 195
    SolutionIndex: 196
    SolutionIndex: 197
    SolutionIndex: 198
    SolutionIndex: 199
    SolutionIndex: 200
    SolutionIndex: 201
    SolutionIndex: 202
    SolutionIndex: 203
    SolutionIndex: 204
    SolutionIndex: 205
    SolutionIndex: 206
    SolutionIndex: 207
    SolutionIndex: 208
    SolutionIndex: 209
    SolutionIndex: 210
    SolutionIndex: 211
    SolutionIndex: 212
    SolutionIndex: 213
    SolutionIndex: 214
    SolutionIndex: 215
    SolutionIndex: 216
    SolutionIndex: 217
    SolutionIndex: 218
    SolutionIndex: 219
    SolutionIndex: 220
    SolutionIndex: 221
    SolutionIndex: 222
    SolutionIndex: 223
    SolutionIndex: 224
    SolutionIndex: 225
    SolutionIndex: 226
    SolutionIndex: 227
    SolutionIndex: 228
    SolutionIndex: 229
    SolutionIndex: 230
    SolutionIndex: 231
    SolutionIndex: 232
    SolutionIndex: 233
    SolutionIndex: 234
    SolutionIndex: 235
    SolutionIndex: 236
    SolutionIndex: 237
    SolutionIndex: 238
    SolutionIndex: 239
    SolutionIndex: 240
    SolutionIndex: 241
    SolutionIndex: 242
    SolutionIndex: 243
    SolutionIndex: 244
    SolutionIndex: 245
    SolutionIndex: 246
    SolutionIndex: 247
    SolutionIndex: 248
    SolutionIndex: 249
    SolutionIndex: 250
    SolutionIndex: 251
    SolutionIndex: 252
    SolutionIndex: 253
    SolutionIndex: 254
    SolutionIndex: 255
    SolutionIndex: 256
    SolutionIndex: 257
    SolutionIndex: 258
    SolutionIndex: 259
    SolutionIndex: 260
    SolutionIndex: 261
    SolutionIndex: 262
    SolutionIndex: 263
    SolutionIndex: 264
    SolutionIndex: 265
    SolutionIndex: 266
    SolutionIndex: 267
    SolutionIndex: 268
    SolutionIndex: 269
    SolutionIndex: 270
    SolutionIndex: 271
    SolutionIndex: 272
    SolutionIndex: 273
    SolutionIndex: 274
    SolutionIndex: 275
    SolutionIndex: 276
    SolutionIndex: 277
    SolutionIndex: 278
    SolutionIndex: 279
    SolutionIndex: 280
    SolutionIndex: 281
    SolutionIndex: 282
    SolutionIndex: 283
    SolutionIndex: 284
    SolutionIndex: 285
    SolutionIndex: 286
    SolutionIndex: 287
    SolutionIndex: 288
    SolutionIndex: 289
    SolutionIndex: 290
    SolutionIndex: 291
    SolutionIndex: 292
    SolutionIndex: 293
    SolutionIndex: 294
    SolutionIndex: 295
    SolutionIndex: 296
    SolutionIndex: 297
    SolutionIndex: 298
    SolutionIndex: 299
    SolutionIndex: 300
    SolutionIndex: 301
    SolutionIndex: 302
    SolutionIndex: 303
    SolutionIndex: 304
    SolutionIndex: 305
    SolutionIndex: 306
    SolutionIndex: 307
    SolutionIndex: 308
    SolutionIndex: 309
    SolutionIndex: 310
    SolutionIndex: 311
    SolutionIndex: 312
    SolutionIndex: 313
    SolutionIndex: 314
    SolutionIndex: 315
    SolutionIndex: 316
    SolutionIndex: 317
    SolutionIndex: 318
    SolutionIndex: 319
    SolutionIndex: 320
    SolutionIndex: 321
    SolutionIndex: 322
    SolutionIndex: 323
    SolutionIndex: 324
    SolutionIndex: 325
    SolutionIndex: 326
    SolutionIndex: 327
    SolutionIndex: 328
    SolutionIndex: 329
    SolutionIndex: 330
    SolutionIndex: 331
    SolutionIndex: 332
    SolutionIndex: 333
    SolutionIndex: 334
    SolutionIndex: 335
    SolutionIndex: 336
    SolutionIndex: 337
    SolutionIndex: 338
    SolutionIndex: 339
    SolutionIndex: 340
    SolutionIndex: 341
    SolutionIndex: 342
    SolutionIndex: 343
    SolutionIndex: 344
    SolutionIndex: 345
    SolutionIndex: 346
    SolutionIndex: 347
    SolutionIndex: 348
    SolutionIndex: 349
    SolutionIndex: 350
    SolutionIndex: 351
    SolutionIndex: 352
    SolutionIndex: 353
    SolutionIndex: 354
    SolutionIndex: 355
    SolutionIndex: 356
    SolutionIndex: 357
    SolutionIndex: 358
    SolutionIndex: 359
    SolutionIndex: 360
    SolutionIndex: 361
    SolutionIndex: 362
    SolutionIndex: 363
    SolutionIndex: 364
    SolutionIndex: 365
    SolutionIndex: 366
    SolutionIndex: 367
    SolutionIndex: 368
    SolutionIndex: 369
    SolutionIndex: 370
    SolutionIndex: 371
    SolutionIndex: 372
    SolutionIndex: 373
    SolutionIndex: 374
    SolutionIndex: 375
    SolutionIndex: 376
    SolutionIndex: 377
    SolutionIndex: 378
    SolutionIndex: 379
    SolutionIndex: 380
    SolutionIndex: 381
    SolutionIndex: 382
    SolutionIndex: 383
    SolutionIndex: 384
    SolutionIndex: 385
    SolutionIndex: 386
    SolutionIndex: 387
    SolutionIndex: 388
    SolutionIndex: 389
    SolutionIndex: 390
    SolutionIndex: 391
    SolutionIndex: 392
    SolutionIndex: 393
    SolutionIndex: 394
    SolutionIndex: 395
    SolutionIndex: 396
    SolutionIndex: 397
    SolutionIndex: 398
    SolutionIndex: 399
    SolutionIndex: 400
    SolutionIndex: 401
    SolutionIndex: 402
    SolutionIndex: 403
    SolutionIndex: 404
    SolutionIndex: 405
    SolutionIndex: 406
    SolutionIndex: 407
    SolutionIndex: 408
    SolutionIndex: 409
    SolutionIndex: 410
    SolutionIndex: 411
    SolutionIndex: 412
    SolutionIndex: 413
- - - [1024, 1024, 1, 3328]
    - [21, 6.912]
  - - [2944, 4288, 1, 1280]
    - [44, 7.641]
  - - [2368, 64, 1, 3328]
    - [37, 3.688]
  - - [2368, 5888, 1, 256]
    - [41, 7.416]
  - - [256, 704, 1, 1280]
    - [21, 3.036]
  - - [128, 6784, 1, 3328]
    - [25, 6.204]
  - - [5888, 1856, 1, 3328]
    - [44, 7.754]
  - - [5888, 2944, 1, 3328]
    - [44, 7.758]
  - - [1856, 4288, 1, 256]
    - [40, 7.19]
  - - [5056, 5056, 1, 3328]
    - [44, 7.842]
  - - [1408, 5888, 1, 1280]
    - [46, 7.623]
  - - [1024, 3584, 1, 3328]
    - [44, 7.605]
  - - [448, 3584, 1, 3328]
    - [44, 6.405]
  - - [256, 4288, 1, 3328]
    - [44, 5.937]
  - - [5888, 1408, 1, 1280]
    - [46, 7.624]
  - - [704, 1856, 1, 3328]
    - [44, 7.059]
  - - [1024, 2368, 1, 256]
    - [46, 6.405]
  - - [5056, 6784, 1, 1280]
    - [40, 7.827]
  - - [1408, 64, 1, 1280]
    - [12, 2.607]
  - - [448, 1024, 1, 1280]
    - [32, 5.254]
  - - [5056, 5056, 1, 1280]
    - [44, 7.786]
  - - [4288, 6784, 1, 256]
    - [41, 7.546]
  - - [6784, 448, 1, 256]
    - [46, 6.78]
  - - [5056, 256, 1, 1280]
    - [44, 6.879]
  - - [5888, 704, 1, 1280]
    - [44, 7.476]
  - - [3584, 1024, 1, 256]
    - [46, 7.085]
  - - [6784, 4288, 1, 3328]
    - [44, 7.877]
  - - [1856, 2368, 1, 3328]
    - [44, 7.55]
  - - [5888, 2944, 1, 1280]
    - [40, 7.691]
  - - [5888, 1024, 1, 256]
    - [40, 7.244]
  - - [448, 64, 1, 1280]
    - [16, 0.949]
  - - [1024, 704, 1, 256]
    - [18, 5.155]
  - - [1408, 2944, 1, 256]
    - [46, 7.083]
  - - [256, 1856, 1, 1280]
    - [21, 5.436]
  - - [6784, 5056, 1, 3328]
    - [44, 7.883]
  - - [5056, 5056, 1, 256]
    - [19, 7.536]
  - - [256, 2944, 1, 3328]
    - [44, 6.342]
  - - [64, 1024, 1, 1280]
    - [34, 2.071]
  - - [1024, 3584, 1, 1280]
    - [44, 7.511]
  - - [2368, 2944, 1, 1280]
    - [44, 7.572]
  - - [128, 3584, 1, 1280]
    - [2, 5.356]
  - - [6784, 6784, 1, 1280]
    - [46, 7.849]
  - - [1024, 256, 1, 3328]
    - [32, 4.657]
  - - [1408, 4288, 1, 1280]
    - [44, 7.365]
  - - [3584, 4288, 1, 1280]
    - [44, 7.738]
  - - [2368, 704, 1, 1280]
    - [44, 6.547]
  - - [5056, 4288, 1, 3328]
    - [44, 7.841]
  - - [3584, 2368, 1, 3328]
    - [44, 7.64]
  - - [5888, 6784, 1, 1280]
    - [40, 7.81]
  - - [64, 704, 1, 1280]
    - [36, 1.424]
  - - [4288, 256, 1, 256]
    - [44, 5.302]
  - - [6784, 448, 1, 1280]
    - [44, 7.219]
  - - [2944, 5888, 1, 256]
    - [40, 7.385]
  - - [256, 128, 1, 256]
    - [16, 0.727]
  - - [4288, 2944, 1, 256]
    - [40, 7.31]
  - - [5888, 64, 1, 3328]
    - [25, 5.438]
  - - [2944, 256, 1, 3328]
    - [21, 6.359]
  - - [5056, 2368, 1, 1280]
    - [40, 7.703]
  - - [448, 3584, 1, 1280]
    - [44, 6.314]
  - - [6784, 5888, 1, 256]
    - [41, 7.564]
  - - [64, 1024, 1, 3328]
    - [34, 2.226]
  - - [704, 128, 1, 1280]
    - [12, 2.639]
  - - [1408, 448, 1, 1280]
    - [21, 5.255]
  - - [1024, 1408, 1, 256]
    - [40, 5.905]
  - - [2368, 2368, 1, 3328]
    - [44, 7.502]
  - - [5056, 704, 1, 3328]
    - [44, 7.372]
  - - [1408, 1856, 1, 256]
    - [46, 6.887]
  - - [1408, 256, 1, 1280]
    - [21, 4.204]
  - - [5888, 1856, 1, 256]
    - [46, 7.427]
  - - [704, 5888, 1, 256]
    - [41, 7.073]
  - - [6784, 64, 1, 256]
    - [26, 4.281]
  - - [3584, 704, 1, 3328]
    - [44, 7.202]
  - - [1408, 1408, 1, 256]
    - [47, 6.392]
  - - [1024, 64, 1, 1280]
    - [9, 2.082]
  - - [448, 4288, 1, 256]
    - [22, 6.178]
  - - [64, 3584, 1, 3328]
    - [29, 4.533]
  - - [704, 2368, 1, 1280]
    - [44, 6.554]
  - - [1856, 2368, 1, 1280]
    - [44, 7.475]
  - - [2368, 128, 1, 3328]
    - [24, 4.634]
  - - [1408, 1408, 1, 3328]
    - [44, 6.976]
  - - [2944, 128, 1, 256]
    - [7, 4.18]
  - - [448, 1408, 1, 256]
    - [44, 4.552]
  - - [64, 5056, 1, 3328]
    - [6, 4.935]
  - - [1408, 1024, 1, 1280]
    - [44, 6.512]
  - - [704, 6784, 1, 256]
    - [40, 6.922]
  - - [6784, 704, 1, 256]
    - [40, 6.909]
  - - [256, 3584, 1, 3328]
    - [44, 6.044]
  - - [5056, 704, 1, 256]
    - [19, 6.866]
  - - [1408, 3584, 1, 256]
    - [46, 6.992]
  - - [3584, 4288, 1, 3328]
    - [44, 7.799]
  - - [5888, 1856, 1, 1280]
    - [46, 7.699]
  - - [256, 1408, 1, 256]
    - [44, 3.496]
  - - [5056, 64, 1, 1280]
    - [24, 4.727]
  - - [2368, 128, 1, 256]
    - [6, 3.542]
  - - [2368, 3584, 1, 1280]
    - [44, 7.575]
  - - [1024, 256, 1, 256]
    - [21, 3.413]
  - - [448, 448, 1, 256]
    - [11, 3.024]
  - - [2944, 3584, 1, 3328]
    - [44, 7.667]
  - - [256, 256, 1, 3328]
    - [13, 2.231]
  - - [128, 1024, 1, 3328]
    - [12, 3.822]
  - - [6784, 2944, 1, 256]
    - [41, 7.418]
  - - [64, 1856, 1, 1280]
    - [12, 3.256]
  - - [448, 256, 1, 256]
    - [13, 2.271]
  - - [1856, 2368, 1, 256]
    - [40, 7.048]
  - - [3584, 6784, 1, 3328]
    - [44, 7.857]
  - - [256, 1024, 1, 256]
    - [21, 3.47]
  - - [1024, 128, 1, 1280]
    - [12, 3.568]
  - - [4288, 128, 1, 1280]
    - [4, 5.218]
  - - [5056, 4288, 1, 1280]
    - [44, 7.787]
  - - [5888, 64, 1, 256]
    - [7, 4.238]
  - - [6784, 1856, 1, 3328]
    - [44, 7.679]
  - - [1408, 5056, 1, 1280]
    - [44, 7.466]
  - - [1856, 256, 1, 1280]
    - [21, 5.452]
  - - [64, 5888, 1, 3328]
    - [6, 4.969]
  - - [6784, 5888, 1, 3328]
    - [44, 7.867]
  - - [448, 256, 1, 3328]
    - [12, 3.357]
  - - [2368, 5056, 1, 1280]
    - [44, 7.707]
  - - [1024, 704, 1, 1280]
    - [21, 5.976]
  - - [256, 1408, 1, 3328]
    - [21, 4.336]
  - - [6784, 128, 1, 3328]
    - [25, 6.197]
  - - [1024, 5056, 1, 1280]
    - [44, 7.522]
  - - [4288, 1024, 1, 256]
    - [40, 7.022]
  - - [2368, 1408, 1, 256]
    - [40, 6.862]
  - - [704, 704, 1, 3328]
    - [21, 5.878]
  - - [5888, 448, 1, 1280]
    - [44, 6.807]
  - - [3584, 256, 1, 3328]
    - [21, 6.094]
  - - [704, 5888, 1, 3328]
    - [44, 7.557]
  - - [1024, 6784, 1, 1280]
    - [44, 7.545]
  - - [128, 3584, 1, 3328]
    - [2, 5.531]
  - - [128, 704, 1, 1280]
    - [12, 2.614]
  - - [3584, 2944, 1, 1280]
    - [44, 7.606]
  - - [1856, 128, 1, 3328]
    - [35, 4.698]
  - - [128, 2944, 1, 1280]
    - [7, 5.231]
  - - [448, 1856, 1, 1280]
    - [21, 5.434]
  - - [1408, 5056, 1, 3328]
    - [44, 7.529]
  - - [1856, 1856, 1, 3328]
    - [44, 7.142]
  - - [3584, 128, 1, 256]
    - [26, 4.486]
  - - [448, 1408, 1, 3328]
    - [21, 5.376]
  - - [2368, 2368, 1, 256]
    - [19, 7.07]
  - - [4288, 4288, 1, 1280]
    - [40, 7.708]
  - - [64, 448, 1, 1280]
    - [15, 0.951]
  - - [5888, 1024, 1, 1280]
    - [44, 7.655]
  - - [704, 1024, 1, 256]
    - [44, 5.155]
  - - [704, 6784, 1, 3328]
    - [44, 7.372]
  - - [5888, 5888, 1, 3328]
    - [44, 7.851]
  - - [5056, 1024, 1, 1280]
    - [44, 7.528]
  - - [448, 5888, 1, 3328]
    - [44, 6.883]
  - - [1024, 2944, 1, 1280]
    - [44, 7.154]
  - - [5056, 5888, 1, 1280]
    - [41, 7.815]
  - - [448, 6784, 1, 256]
    - [45, 6.761]
  - - [256, 3584, 1, 256]
    - [44, 5.284]
  - - [256, 448, 1, 256]
    - [37, 2.29]
  - - [3584, 5888, 1, 256]
    - [40, 7.46]
  - - [2944, 3584, 1, 256]
    - [40, 7.266]
  - - [1408, 704, 1, 256]
    - [46, 5.681]
  - - [6784, 1024, 1, 3328]
    - [44, 7.613]
  - - [6784, 2944, 1, 3328]
    - [44, 7.784]
  - - [64, 64, 1, 3328]
    - [12, 0.142]
  - - [6784, 2368, 1, 1280]
    - [46, 7.71]
  - - [4288, 3584, 1, 256]
    - [40, 7.408]
  - - [4288, 5888, 1, 1280]
    - [44, 7.77]
  - - [448, 2944, 1, 3328]
    - [44, 6.054]
  - - [4288, 1856, 1, 1280]
    - [44, 7.549]
  - - [1856, 2944, 1, 3328]
    - [44, 7.654]
  - - [256, 6784, 1, 3328]
    - [44, 6.915]
  - - [64, 5888, 1, 256]
    - [20, 4.048]
  - - [5056, 1024, 1, 256]
    - [41, 7.174]
  - - [704, 64, 1, 3328]
    - [38, 1.549]
  - - [5056, 1856, 1, 3328]
    - [44, 7.755]
  - - [448, 448, 1, 3328]
    - [29, 3.987]
  - - [448, 2368, 1, 1280]
    - [44, 5.645]
  - - [1408, 128, 1, 1280]
    - [6, 3.932]
  - - [5056, 256, 1, 3328]
    - [44, 7.0]
  - - [704, 704, 1, 256]
    - [21, 4.731]
  - - [1024, 5888, 1, 1280]
    - [44, 7.656]
  - - [64, 128, 1, 256]
    - [3, 0.162]
  - - [128, 1856, 1, 1280]
    - [14, 4.453]
  - - [5056, 3584, 1, 256]
    - [41, 7.472]
  - - [1856, 1024, 1, 1280]
    - [44, 6.605]
  - - [1856, 1856, 1, 1280]
    - [44, 7.061]
  - - [128, 4288, 1, 3328]
    - [4, 5.315]
  - - [1856, 1024, 1, 3328]
    - [44, 6.691]
  - - [256, 2368, 1, 256]
    - [44, 4.414]
  - - [1024, 448, 1, 3328]
    - [21, 5.437]
  - - [1856, 704, 1, 1280]
    - [44, 6.929]
  - - [6784, 1024, 1, 256]
    - [40, 7.18]
  - - [5056, 5888, 1, 3328]
    - [44, 7.855]
  - - [1856, 1024, 1, 256]
    - [22, 6.12]
  - - [5056, 1408, 1, 3328]
    - [44, 7.532]
  - - [1024, 1024, 1, 1280]
    - [21, 6.764]
  - - [448, 5888, 1, 256]
    - [40, 6.383]
  - - [1408, 6784, 1, 3328]
    - [44, 7.685]
  - - [2944, 1408, 1, 3328]
    - [44, 7.555]
  - - [2944, 4288, 1, 3328]
    - [44, 7.697]
  - - [256, 2944, 1, 256]
    - [44, 5.39]
  - - [5056, 2944, 1, 256]
    - [40, 7.426]
  - - [2368, 1856, 1, 256]
    - [40, 7.043]
  - - [128, 6784, 1, 1280]
    - [7, 6.094]
  - - [1408, 3584, 1, 3328]
    - [44, 7.412]
  - - [2368, 6784, 1, 256]
    - [41, 7.464]
  - - [4288, 2368, 1, 3328]
    - [44, 7.757]
  - - [704, 3584, 1, 1280]
    - [44, 7.113]
  - - [1408, 5888, 1, 3328]
    - [44, 7.69]
  - - [1856, 5056, 1, 256]
    - [19, 7.364]
  - - [6784, 6784, 1, 256]
    - [41, 7.629]
  - - [1408, 704, 1, 3328]
    - [44, 6.524]
  - - [128, 5888, 1, 1280]
    - [1, 6.222]
  - - [2368, 4288, 1, 1280]
    - [44, 7.696]
  - - [3584, 1856, 1, 1280]
    - [44, 7.494]
  - - [704, 1408, 1, 3328]
    - [44, 6.524]
  - - [704, 64, 1, 1280]
    - [15, 1.42]
  - - [3584, 448, 1, 256]
    - [44, 5.802]
  - - [3584, 3584, 1, 1280]
    - [44, 7.77]
  - - [256, 6784, 1, 256]
    - [40, 6.238]
  - - [1856, 3584, 1, 3328]
    - [44, 7.566]
  - - [128, 448, 1, 256]
    - [34, 1.26]
  - - [3584, 3584, 1, 256]
    - [40, 7.43]
  - - [6784, 4288, 1, 1280]
    - [40, 7.826]
  - - [448, 704, 1, 1280]
    - [21, 3.693]
  - - [3584, 5056, 1, 256]
    - [46, 7.464]
  - - [6784, 128, 1, 256]
    - [7, 5.389]
  - - [64, 1408, 1, 3328]
    - [12, 2.838]
  - - [704, 448, 1, 256]
    - [21, 3.072]
  - - [2944, 2368, 1, 1280]
    - [44, 7.57]
  - - [448, 64, 1, 3328]
    - [39, 1.041]
  - - [6784, 3584, 1, 256]
    - [41, 7.501]
  - - [256, 1856, 1, 3328]
    - [32, 5.685]
  - - [256, 704, 1, 256]
    - [21, 2.347]
  - - [128, 1408, 1, 256]
    - [6, 2.859]
  - - [64, 128, 1, 3328]
    - [37, 0.284]
  - - [1856, 1408, 1, 256]
    - [41, 6.857]
  - - [2944, 2944, 1, 3328]
    - [44, 7.576]
  - - [5056, 6784, 1, 256]
    - [41, 7.565]
  - - [1408, 4288, 1, 3328]
    - [44, 7.426]
  - - [6784, 256, 1, 1280]
    - [44, 6.816]
  - - [1024, 704, 1, 3328]
    - [21, 6.075]
  - - [2368, 704, 1, 3328]
    - [44, 6.641]
  - - [128, 4288, 1, 256]
    - [4, 4.534]
  - - [3584, 6784, 1, 256]
    - [40, 7.495]
  - - [128, 128, 1, 3328]
    - [15, 0.595]
  - - [5056, 1856, 1, 256]
    - [19, 7.371]
  - - [704, 4288, 1, 256]
    - [19, 6.703]
  - - [256, 448, 1, 3328]
    - [12, 3.363]
  - - [1408, 6784, 1, 1280]
    - [44, 7.614]
  - - [64, 2368, 1, 1280]
    - [12, 3.451]
  - - [64, 6784, 1, 3328]
    - [2, 5.165]
  - - [2944, 256, 1, 1280]
    - [44, 6.196]
  - - [5056, 2368, 1, 3328]
    - [44, 7.767]
  - - [2944, 4288, 1, 256]
    - [40, 7.307]
  - - [1408, 3584, 1, 1280]
    - [44, 7.339]
  - - [2368, 64, 1, 256]
    - [12, 2.575]
  - - [256, 256, 1, 256]
    - [13, 1.402]
  - - [704, 128, 1, 3328]
    - [12, 2.841]
  - - [1856, 704, 1, 256]
    - [18, 6.199]
  - - [2368, 6784, 1, 3328]
    - [44, 7.762]
  - - [5056, 704, 1, 1280]
    - [44, 7.3]
  - - [1856, 4288, 1, 3328]
    - [44, 7.615]
  - - [1408, 5888, 1, 256]
    - [41, 7.332]
  - - [704, 2944, 1, 1280]
    - [44, 7.18]
  - - [4288, 64, 1, 1280]
    - [27, 4.074]
  - - [704, 1856, 1, 256]
    - [40, 6.199]
  - - [3584, 704, 1, 1280]
    - [44, 7.118]
  - - [5888, 5056, 1, 256]
    - [42, 7.572]
  - - [3584, 448, 1, 3328]
    - [44, 6.401]
  - - [704, 2368, 1, 3328]
    - [44, 6.642]
  - - [2944, 448, 1, 256]
    - [44, 5.457]
  - - [448, 5056, 1, 3328]
    - [44, 7.137]
  - - [2368, 128, 1, 1280]
    - [6, 4.46]
  - - [4288, 448, 1, 256]
    - [22, 6.169]
  - - [64, 6784, 1, 256]
    - [2, 4.298]
  - - [64, 5056, 1, 1280]
    - [6, 4.739]
  - - [5888, 2368, 1, 256]
    - [46, 7.406]
  - - [704, 448, 1, 3328]
    - [21, 3.807]
  - - [6784, 704, 1, 3328]
    - [44, 7.373]
  - - [128, 64, 1, 1280]
    - [28, 0.254]
  - - [2368, 256, 1, 1280]
    - [21, 5.043]
  - - [1408, 2944, 1, 3328]
    - [44, 7.552]
  - - [64, 1024, 1, 256]
    - [13, 1.414]
  - - [2368, 448, 1, 1280]
    - [21, 5.678]
  - - [128, 3584, 1, 256]
    - [2, 4.45]
  - - [1856, 448, 1, 3328]
    - [21, 5.523]
  - - [128, 5056, 1, 256]
    - [7, 5.168]
  - - [4288, 4288, 1, 256]
    - [40, 7.396]
  - - [2368, 704, 1, 256]
    - [40, 6.006]
  - - [3584, 2368, 1, 256]
    - [40, 7.22]
  - - [5888, 5056, 1, 1280]
    - [46, 7.819]
  - - [128, 1024, 1, 1280]
    - [12, 3.544]
  - - [64, 704, 1, 256]
    - [10, 0.981]
  - - [4288, 256, 1, 1280]
    - [44, 5.849]
  - - [3584, 3584, 1, 3328]
    - [44, 7.832]
  - - [128, 1024, 1, 256]
    - [37, 2.473]
  - - [5888, 6784, 1, 256]
    - [41, 7.56]
  - - [4288, 2944, 1, 3328]
    - [44, 7.699]
  - - [1856, 64, 1, 256]
    - [12, 2.333]
  - - [4288, 128, 1, 3328]
    - [4, 5.312]
  - - [256, 5056, 1, 1280]
    - [44, 6.851]
  - - [6784, 5888, 1, 1280]
    - [44, 7.814]
  - - [704, 128, 1, 256]
    - [13, 1.77]
  - - [5888, 4288, 1, 1280]
    - [44, 7.771]
  - - [448, 256, 1, 1280]
    - [12, 3.158]
  - - [448, 2368, 1, 3328]
    - [44, 5.744]
  - - [1, 1, 1, 1280]
    - [54, 0.0]
  - - [256, 1408, 1, 1280]
    - [21, 4.216]
  - - [1408, 1856, 1, 1280]
    - [44, 7.362]
  - - [5888, 448, 1, 3328]
    - [44, 6.887]
  - - [704, 5888, 1, 1280]
    - [44, 7.466]
  - - [256, 64, 1, 3328]
    - [38, 0.594]
  - - [128, 2368, 1, 256]
    - [6, 3.595]
  - - [6784, 64, 1, 3328]
    - [26, 5.239]
  - - [5056, 2944, 1, 3328]
    - [44, 7.815]
  - - [448, 128, 1, 256]
    - [34, 1.272]
  - - [1856, 128, 1, 1280]
    - [35, 4.482]
  - - [448, 4288, 1, 1280]
    - [44, 6.678]
  - - [64, 3584, 1, 256]
    - [11, 3.351]
  - - [128, 2944, 1, 3328]
    - [25, 5.428]
  - - [3584, 704, 1, 256]
    - [46, 6.628]
  - - [2944, 448, 1, 3328]
    - [44, 6.061]
  - - [3584, 1408, 1, 3328]
    - [44, 7.412]
  - - [2368, 1024, 1, 1280]
    - [44, 6.834]
  - - [2944, 6784, 1, 1280]
    - [44, 7.724]
  - - [1856, 6784, 1, 256]
    - [40, 7.295]
  - - [4288, 448, 1, 3328]
    - [44, 6.764]
  - - [6784, 704, 1, 1280]
    - [44, 7.298]
  - - [5888, 1024, 1, 3328]
    - [44, 7.727]
  - - [704, 6784, 1, 1280]
    - [44, 7.296]
  - - [5888, 128, 1, 256]
    - [21, 5.406]
  - - [5056, 1024, 1, 3328]
    - [44, 7.602]
  - - [704, 5056, 1, 1280]
    - [44, 7.286]
  - - [64, 704, 1, 3328]
    - [15, 1.549]
  - - [2944, 1856, 1, 256]
    - [40, 7.169]
  - - [5056, 64, 1, 256]
    - [6, 3.782]
  - - [5888, 5056, 1, 3328]
    - [46, 7.86]
  - - [128, 5056, 1, 3328]
    - [7, 6.2]
  - - [3584, 6784, 1, 1280]
    - [40, 7.803]
  - - [1856, 5888, 1, 256]
    - [41, 7.421]
  - - [64, 448, 1, 3328]
    - [39, 1.044]
  - - [4288, 4288, 1, 3328]
    - [44, 7.766]
  - - [4288, 1408, 1, 1280]
    - [44, 7.364]
  - - [64, 1856, 1, 256]
    - [12, 2.277]
  - - [4288, 2368, 1, 256]
    - [40, 7.343]
  - - [2944, 5056, 1, 1280]
    - [40, 7.754]
  - - [256, 4288, 1, 1280]
    - [44, 5.847]
  - - [6784, 2368, 1, 3328]
    - [44, 7.764]
  - - [256, 1024, 1, 1280]
    - [21, 4.417]
  - - [4288, 128, 1, 256]
    - [4, 4.503]
  - - [4288, 1856, 1, 3328]
    - [44, 7.621]
  - - [1856, 2944, 1, 1280]
    - [44, 7.575]
  - - [3584, 64, 1, 1280]
    - [14, 4.313]
  - - [4288, 6784, 1, 3328]
    - [44, 7.883]
  - - [3584, 1024, 1, 1280]
    - [44, 7.515]
  - - [1024, 4288, 1, 256]
    - [40, 7.018]
  - - [5888, 3584, 1, 3328]
    - [44, 7.822]
  - - [5056, 3584, 1, 3328]
    - [44, 7.765]
  - - [1408, 128, 1, 3328]
    - [6, 4.149]
  - - [2368, 1408, 1, 1280]
    - [44, 7.33]
  - - [5056, 2944, 1, 1280]
    - [40, 7.755]
  - - [3584, 256, 1, 256]
    - [44, 5.297]
  - - [1024, 6784, 1, 256]
    - [40, 7.158]
  - - [2944, 5056, 1, 3328]
    - [44, 7.818]
  - - [3584, 2944, 1, 256]
    - [40, 7.276]
  - - [448, 128, 1, 3328]
    - [13, 1.95]
  - - [64, 2944, 1, 3328]
    - [24, 4.347]
  - - [64, 4288, 1, 3328]
    - [27, 4.263]
  - - [5056, 6784, 1, 3328]
    - [44, 7.881]
  - - [128, 2944, 1, 256]
    - [7, 4.238]
  - - [3584, 4288, 1, 256]
    - [40, 7.419]
  - - [1856, 6784, 1, 3328]
    - [44, 7.679]
  - - [3584, 128, 1, 3328]
    - [26, 5.506]
  - - [128, 256, 1, 1280]
    - [16, 1.096]
  - - [64, 448, 1, 256]
    - [16, 0.654]
  - - [64, 256, 1, 1280]
    - [15, 0.545]
  - - [5056, 1408, 1, 1280]
    - [46, 7.459]
  - - [5888, 5888, 1, 256]
    - [41, 7.538]
  - - [4288, 1024, 1, 1280]
    - [44, 7.47]
  - - [5888, 128, 1, 3328]
    - [1, 6.359]
  - - [448, 6784, 1, 3328]
    - [44, 7.3]
  - - [2944, 1408, 1, 1280]
    - [44, 7.471]
  - - [64, 128, 1, 1280]
    - [12, 0.253]
  - - [2944, 1856, 1, 3328]
    - [44, 7.652]
  - - [448, 5056, 1, 256]
    - [40, 6.554]
  - - [64, 64, 1, 256]
    - [3, 0.082]
  - - [3584, 5888, 1, 1280]
    - [40, 7.765]
  - - [6784, 1856, 1, 1280]
    - [40, 7.619]
  - - [5888, 256, 1, 3328]
    - [44, 6.912]
  - - [1856, 5888, 1, 3328]
    - [44, 7.758]
  - - [3584, 1408, 1, 256]
    - [46, 6.984]
  - - [704, 3584, 1, 3328]
    - [44, 7.204]
  - - [5056, 448, 1, 1280]
    - [44, 7.046]
  - - [3584, 1856, 1, 3328]
    - [44, 7.566]
  - - [1408, 704, 1, 1280]
    - [21, 6.401]
  - - [2944, 1024, 1, 256]
    - [46, 6.75]
  - - [448, 1408, 1, 1280]
    - [21, 5.262]
  - - [2368, 4288, 1, 3328]
    - [44, 7.754]
  - - [1024, 1408, 1, 1280]
    - [44, 6.515]
  - - [256, 128, 1, 1280]
    - [16, 1.084]
  - - [704, 1408, 1, 1280]
    - [21, 6.397]
  - - [6784, 5056, 1, 256]
    - [42, 7.549]
  - - [4288, 5888, 1, 256]
    - [41, 7.482]
  - - [448, 2944, 1, 256]
    - [40, 5.495]
  - - [2944, 6784, 1, 256]
    - [40, 7.409]
  - - [2368, 2368, 1, 1280]
    - [44, 7.429]
  - - [1856, 3584, 1, 1280]
    - [44, 7.497]
  - - [64, 2944, 1, 256]
    - [6, 2.97]
  - - [3584, 1408, 1, 1280]
    - [44, 7.338]
  - - [5056, 3584, 1, 1280]
    - [46, 7.715]
  - - [256, 5888, 1, 256]
    - [46, 6.173]
  - - [128, 256, 1, 3328]
    - [16, 1.195]
  - - [1856, 1408, 1, 3328]
    - [44, 7.461]
  - - [1024, 4288, 1, 3328]
    - [44, 7.545]
  - - [448, 2368, 1, 256]
    - [44, 5.134]
  - - [64, 1408, 1, 1280]
    - [12, 2.646]
  - - [64, 6784, 1, 1280]
    - [26, 5.099]
  - - [2944, 2368, 1, 3328]
    - [44, 7.644]
  - - [704, 4288, 1, 3328]
    - [44, 7.25]
  - - [1024, 1856, 1, 1280]
    - [44, 6.605]
  - - [6784, 1856, 1, 256]
    - [40, 7.292]
  - - [128, 2368, 1, 3328]
    - [6, 4.643]
  - - [1024, 5888, 1, 256]
    - [40, 7.226]
  - - [64, 2944, 1, 1280]
    - [24, 4.074]
  - - [5056, 64, 1, 3328]
    - [24, 4.938]
  - - [1408, 2368, 1, 256]
    - [40, 6.845]
  - - [2944, 704, 1, 3328]
    - [44, 7.295]
  - - [256, 64, 1, 256]
    - [15, 0.367]
  - - [2944, 2944, 1, 1280]
    - [46, 7.516]
  - - [6784, 256, 1, 3328]
    - [44, 6.919]
  - - [1408, 5056, 1, 256]
    - [46, 7.166]
  - - [5056, 128, 1, 3328]
    - [25, 6.187]
  - - [128, 128, 1, 1280]
    - [15, 0.545]
  - - [448, 704, 1, 256]
    - [44, 3.084]
  - - [1856, 256, 1, 3328]
    - [32, 5.612]
  - - [2944, 128, 1, 3328]
    - [25, 5.413]
  - - [704, 256, 1, 256]
    - [21, 2.399]
  - - [256, 448, 1, 1280]
    - [12, 3.151]
  - - [704, 256, 1, 1280]
    - [33, 3.067]
  - - [64, 2368, 1, 3328]
    - [37, 3.693]
  - - [256, 704, 1, 3328]
    - [32, 3.209]
  - - [1024, 1024, 1, 256]
    - [21, 5.953]
  - - [1408, 4288, 1, 256]
    - [46, 7.045]
  - - [5888, 2368, 1, 1280]
    - [46, 7.672]
  - - [128, 256, 1, 256]
    - [10, 0.714]
  - - [256, 64, 1, 1280]
    - [15, 0.544]
  - - [2368, 5888, 1, 1280]
    - [40, 7.663]
  - - [5888, 256, 1, 1280]
    - [44, 6.798]
  - - [704, 1024, 1, 1280]
    - [44, 5.931]
  - - [2368, 1856, 1, 3328]
    - [44, 7.558]
  - - [2944, 704, 1, 256]
    - [22, 6.656]
  - - [2368, 6784, 1, 1280]
    - [41, 7.707]
  - - [2368, 1024, 1, 3328]
    - [44, 6.925]
  - - [1856, 4288, 1, 1280]
    - [44, 7.55]
  - - [704, 3584, 1, 256]
    - [40, 6.614]
  - - [704, 2944, 1, 3328]
    - [44, 7.292]
  - - [1856, 5056, 1, 3328]
    - [44, 7.756]
  - - [3584, 5056, 1, 1280]
    - [46, 7.719]
  - - [2944, 1024, 1, 3328]
    - [44, 7.241]
  - - [256, 4288, 1, 256]
    - [44, 5.291]
  - - [2368, 256, 1, 256]
    - [44, 4.428]
  - - [1408, 6784, 1, 256]
    - [40, 7.265]
  - - [6784, 1408, 1, 3328]
    - [44, 7.685]
  - - [1024, 2368, 1, 1280]
    - [44, 6.844]
  - - [704, 64, 1, 256]
    - [12, 0.99]
  - - [256, 2368, 1, 3328]
    - [21, 5.178]
  - - [6784, 2944, 1, 1280]
    - [44, 7.726]
  - - [3584, 448, 1, 1280]
    - [44, 6.31]
  - - [2944, 6784, 1, 3328]
    - [44, 7.785]
  - - [448, 5056, 1, 1280]
    - [44, 7.044]
  - - [4288, 5056, 1, 1280]
    - [40, 7.788]
  - - [128, 448, 1, 1280]
    - [34, 1.812]
  - - [4288, 704, 1, 256]
    - [19, 6.715]
  - - [64, 64, 1, 1280]
    - [34, 0.134]
  - - [5888, 704, 1, 256]
    - [46, 7.088]
  - - [256, 5888, 1, 3328]
    - [44, 6.913]
  - - [6784, 4288, 1, 256]
    - [42, 7.533]
  - - [5888, 256, 1, 256]
    - [40, 6.152]
  - - [6784, 1024, 1, 1280]
    - [44, 7.545]
  - - [704, 448, 1, 1280]
    - [21, 3.7]
  - - [128, 64, 1, 3328]
    - [12, 0.284]
  - - [448, 64, 1, 256]
    - [37, 0.654]
  - - [2944, 704, 1, 1280]
    - [44, 7.186]
  - - [6784, 3584, 1, 1280]
    - [40, 7.801]
  - - [2944, 64, 1, 1280]
    - [6, 4.096]
  - - [1408, 2944, 1, 1280]
    - [44, 7.476]
  - - [256, 1856, 1, 256]
    - [44, 4.499]
  - - [1408, 2368, 1, 3328]
    - [44, 7.417]
  - - [128, 1408, 1, 3328]
    - [6, 4.164]
  - - [2368, 2944, 1, 256]
    - [40, 7.199]
  - - [64, 5056, 1, 256]
    - [6, 3.727]
  - - [1408, 256, 1, 3328]
    - [32, 4.324]
  - - [3584, 1856, 1, 256]
    - [46, 7.182]
  - - [4288, 3584, 1, 1280]
    - [40, 7.739]
  - - [2368, 448, 1, 256]
    - [21, 5.155]
  - - [4288, 256, 1, 3328]
    - [44, 5.941]
  - - [1408, 64, 1, 256]
    - [13, 1.799]
  - - [4288, 2944, 1, 1280]
    - [44, 7.641]
  - - [5056, 448, 1, 3328]
    - [44, 7.142]
  - - [1024, 64, 1, 256]
    - [13, 1.414]
  - - [64, 2368, 1, 256]
    - [12, 2.539]
  - - [4288, 5056, 1, 3328]
    - [44, 7.845]
  - - [2944, 256, 1, 256]
    - [18, 5.342]
  - - [1024, 128, 1, 3328]
    - [37, 3.801]
  - - [256, 5056, 1, 3328]
    - [44, 6.994]
  - - [5056, 2368, 1, 256]
    - [19, 7.423]
  - - [4288, 704, 1, 3328]
    - [44, 7.249]
  - - [448, 3584, 1, 256]
    - [40, 5.802]
  - - [2368, 64, 1, 1280]
    - [12, 3.451]
  - - [1024, 1408, 1, 3328]
    - [44, 6.617]
  - - [2944, 5888, 1, 1280]
    - [40, 7.694]
  - - [5888, 3584, 1, 256]
    - [41, 7.451]
  - - [1408, 1856, 1, 3328]
    - [44, 7.464]
  - - [6784, 1408, 1, 1280]
    - [44, 7.621]
  - - [704, 2944, 1, 256]
    - [22, 6.638]
  - - [4288, 64, 1, 256]
    - [5, 3.321]
  - - [2944, 5888, 1, 3328]
    - [44, 7.754]
  - - [64, 4288, 1, 1280]
    - [5, 4.104]
  - - [6784, 64, 1, 1280]
    - [2, 5.099]
  - - [704, 1856, 1, 1280]
    - [44, 6.935]
  - - [1408, 64, 1, 3328]
    - [12, 2.829]
  - - [1408, 1408, 1, 1280]
    - [44, 6.891]
  - - [448, 1024, 1, 3328]
    - [32, 5.445]
  - - [448, 4288, 1, 3328]
    - [44, 6.763]
  - - [704, 2368, 1, 256]
    - [40, 6.033]
  - - [2944, 448, 1, 1280]
    - [21, 5.987]
  - - [5888, 2368, 1, 3328]
    - [44, 7.723]
  - - [4288, 5056, 1, 256]
    - [40, 7.476]
  - - [4288, 448, 1, 1280]
    - [44, 6.67]
  - - [5888, 704, 1, 3328]
    - [44, 7.553]
  - - [4288, 3584, 1, 3328]
    - [44, 7.799]
  - - [2944, 64, 1, 256]
    - [6, 2.97]
  - - [1024, 6784, 1, 3328]
    - [44, 7.615]
  - - [1408, 1024, 1, 256]
    - [44, 5.935]
  - - [448, 1024, 1, 256]
    - [44, 4.396]
  - - [6784, 6784, 1, 3328]
    - [46, 7.888]
  - - [1024, 448, 1, 1280]
    - [32, 5.279]
  - - [704, 5056, 1, 3328]
    - [44, 7.377]
  - - [256, 2368, 1, 1280]
    - [21, 5.053]
  - - [3584, 5056, 1, 3328]
    - [46, 7.761]
  - - [2368, 2944, 1, 3328]
    - [44, 7.639]
  - - [448, 448, 1, 1280]
    - [29, 3.786]
  - - [2368, 3584, 1, 256]
    - [40, 7.231]
  - - [1024, 256, 1, 1280]
    - [44, 4.41]
  - - [128, 5056, 1, 1280]
    - [7, 6.056]
  - - [3584, 2368, 1, 1280]
    - [44, 7.581]
  - - [1856, 1856, 1, 256]
    - [46, 6.645]
  - - [4288, 1408, 1, 3328]
    - [44, 7.43]
  - - [3584, 64, 1, 3328]
    - [29, 4.542]
  - - [1, 1, 1, 1]
    - [52, 0.0]
  - - [256, 1024, 1, 3328]
    - [32, 4.649]
  - - [1856, 64, 1, 3328]
    - [12, 3.477]
  - - [5888, 1408, 1, 3328]
    - [44, 7.692]
  - - [256, 5056, 1, 256]
    - [40, 6.128]
  - - [1856, 64, 1, 1280]
    - [37, 3.263]
  - - [1408, 256, 1, 256]
    - [44, 3.496]
  - - [2368, 5056, 1, 256]
    - [19, 7.421]
  - - [128, 5888, 1, 3328]
    - [44, 6.342]
  - - [1024, 5056, 1, 256]
    - [46, 7.17]
  - - [2368, 1408, 1, 3328]
    - [44, 7.413]
  - - [5888, 448, 1, 256]
    - [40, 6.383]
  - - [6784, 5056, 1, 1280]
    - [44, 7.825]
  - - [4288, 6784, 1, 1280]
    - [40, 7.828]
  - - [2368, 448, 1, 3328]
    - [44, 5.743]
  - - [1024, 128, 1, 256]
    - [13, 2.512]
  - - [448, 128, 1, 1280]
    - [13, 1.822]
  - - [1024, 64, 1, 3328]
    - [34, 2.228]
  - - [64, 3584, 1, 1280]
    - [29, 4.307]
  - - [6784, 1408, 1, 256]
    - [40, 7.267]
  - - [5888, 4288, 1, 256]
    - [40, 7.464]
  - - [5056, 5888, 1, 256]
    - [41, 7.587]
  - - [2368, 1024, 1, 256]
    - [40, 6.384]
  - - [1856, 6784, 1, 1280]
    - [40, 7.613]
  - - [3584, 128, 1, 1280]
    - [26, 5.361]
  - - [128, 64, 1, 256]
    - [3, 0.162]
  - - [1408, 448, 1, 256]
    - [44, 4.566]
  - - [64, 256, 1, 3328]
    - [15, 0.595]
  - - [6784, 448, 1, 3328]
    - [44, 7.296]
  - - [5056, 1856, 1, 1280]
    - [44, 7.693]
  - - [1408, 1024, 1, 3328]
    - [44, 6.617]
  - - [2368, 256, 1, 3328]
    - [21, 5.177]
  - - [5888, 3584, 1, 1280]
    - [40, 7.764]
  - - [5888, 128, 1, 1280]
    - [21, 6.218]
  - - [1024, 2944, 1, 256]
    - [46, 6.712]
  - - [448, 6784, 1, 1280]
    - [44, 7.212]
  - - [256, 3584, 1, 1280]
    - [21, 5.963]
  - - [704, 5056, 1, 256]
    - [19, 6.86]
  - - [3584, 1024, 1, 3328]
    - [44, 7.604]
  - - [2944, 1856, 1, 1280]
    - [44, 7.573]
  - - [5056, 256, 1, 256]
    - [18, 6.165]
  - - [128, 5888, 1, 256]
    - [1, 5.39]
  - - [2368, 3584, 1, 3328]
    - [44, 7.641]
  - - [3584, 5888, 1, 3328]
    - [44, 7.82]
  - - [2944, 3584, 1, 1280]
    - [44, 7.609]
  - - [1856, 5888, 1, 1280]
    - [44, 7.688]
  - - [256, 256, 1, 1280]
    - [34, 2.055]
  - - [4288, 1408, 1, 256]
    - [41, 7.032]
  - - [3584, 64, 1, 256]
    - [23, 3.351]
  - - [64, 1856, 1, 3328]
    - [12, 3.474]
  - - [1408, 128, 1, 256]
    - [24, 2.878]
  - - [4288, 2368, 1, 1280]
    - [44, 7.686]
  - - [2944, 5056, 1, 256]
    - [40, 7.426]
  - - [256, 128, 1, 3328]
    - [16, 1.195]
  - - [6784, 2368, 1, 256]
    - [42, 7.448]
  - - [1408, 448, 1, 3328]
    - [21, 5.388]
  - - [4288, 1856, 1, 256]
    - [40, 7.198]
  - - [1856, 2944, 1, 256]
    - [40, 7.165]
  - - [64, 5888, 1, 1280]
    - [20, 4.993]
  - - [1856, 1408, 1, 1280]
    - [44, 7.352]
  - - [128, 704, 1, 256]
    - [9, 1.784]
  - - [1024, 4288, 1, 1280]
    - [44, 7.466]
  - - [2368, 5056, 1, 3328]
    - [44, 7.773]
  - - [4288, 1024, 1, 3328]
    - [44, 7.548]
  - - [1024, 5056, 1, 3328]
    - [44, 7.603]
  - - [1024, 1856, 1, 3328]
    - [44, 6.69]
  - - [704, 704, 1, 1280]
    - [21, 5.692]
  - - [128, 2368, 1, 1280]
    - [6, 4.46]
  - - [3584, 256, 1, 1280]
    - [21, 5.973]
  - - [5888, 64, 1, 1280]
    - [25, 5.224]
  - - [128, 704, 1, 3328]
    - [37, 2.829]
  - - [3584, 2944, 1, 3328]
    - [44, 7.671]
  - - [128, 1856, 1, 256]
    - [23, 3.408]
  - - [64, 4288, 1, 256]
    - [5, 3.304]
  - - [5888, 2944, 1, 256]
    - [40, 7.383]
  - - [5056, 128, 1, 1280]
    - [7, 6.052]
  - - [448, 1856, 1, 3328]
    - [21, 5.53]
  - - [5056, 4288, 1, 256]
    - [40, 7.473]
  - - [1024, 448, 1, 256]
    - [21, 4.379]
  - - [1024, 3584, 1, 256]
    - [46, 7.051]
  - - [2944, 128, 1, 1280]
    - [25, 5.237]
  - - [64, 256, 1, 256]
    - [9, 0.36]
  - - [704, 256, 1, 3328]
    - [33, 3.186]
  - - [5056, 1408, 1, 256]
    - [41, 7.163]
  - - [5888, 5888, 1, 1280]
    - [44, 7.794]
  - - [448, 5888, 1, 1280]
    - [44, 6.807]
  - - [1, 1, 1, 256]
    - [53, 0.0]
  - - [4288, 704, 1, 1280]
    - [44, 7.166]
  - - [2944, 1408, 1, 256]
    - [42, 7.053]
  - - [256, 2944, 1, 1280]
    - [44, 6.213]
  - - [2368, 5888, 1, 3328]
    - [44, 7.725]
  - - [704, 1024, 1, 3328]
    - [21, 6.081]
  - - [2368, 1856, 1, 1280]
    - [44, 7.472]
  - - [1856, 448, 1, 1280]
    - [21, 5.437]
  - - [128, 6784, 1, 256]
    - [7, 5.432]
  - - [5888, 4288, 1, 3328]
    - [44, 7.826]
  - - [1856, 128, 1, 256]
    - [4, 3.492]
  - - [5056, 448, 1, 256]
    - [40, 6.538]
  - - [1856, 5056, 1, 1280]
    - [44, 7.688]
  - - [2944, 1024, 1, 1280]
    - [44, 7.157]
  - - [2368, 4288, 1, 256]
    - [40, 7.34]
  - - [1024, 2368, 1, 3328]
    - [44, 6.927]
  - - [4288, 64, 1, 3328]
    - [27, 4.235]
  - - [704, 1408, 1, 256]
    - [44, 5.695]
  - - [4288, 5888, 1, 3328]
    - [44, 7.824]
  - - [448, 2944, 1, 1280]
    - [44, 5.964]
  - - [1024, 2944, 1, 3328]
    - [44, 7.241]
  - - [256, 6784, 1, 1280]
    - [44, 6.814]
  - - [1856, 3584, 1, 256]
    - [41, 7.178]
  - - [128, 448, 1, 3328]
    - [9, 1.954]
  - - [1856, 256, 1, 256]
    - [21, 4.517]
  - - [5056, 128, 1, 256]
    - [7, 5.203]
  - - [256, 5888, 1, 1280]
    - [44, 6.803]
  - - [6784, 128, 1, 1280]
    - [25, 6.097]
  - - [64, 1408, 1, 256]
    - [12, 1.83]
  - - [2944, 2368, 1, 256]
    - [40, 7.196]
  - - [1856, 448, 1, 256]
    - [44, 4.859]
  - - [1024, 1856, 1, 256]
    - [22, 6.112]
  - - [6784, 3584, 1, 3328]
    - [44, 7.853]
  - - [2944, 64, 1, 3328]
    - [6, 4.34]
  - - [1024, 5888, 1, 3328]
    - [44, 7.73]
  - - [1408, 2368, 1, 1280]
    - [44, 7.334]
  - - [128, 1408, 1, 1280]
    - [6, 3.925]
  - - [128, 1856, 1, 3328]
    - [35, 4.71]
  - - [2944, 2944, 1, 256]
    - [41, 7.232]
  - - [6784, 256, 1, 256]
    - [40, 6.219]
  - - [128, 4288, 1, 1280]
    - [4, 5.222]
  - - [5888, 1408, 1, 256]
    - [46, 7.321]
  - - [128, 128, 1, 256]
    - [8, 0.37]
  - - [448, 704, 1, 3328]
    - [21, 3.8]
  - - [448, 1856, 1, 256]
    - [40, 4.823]
  - - [1856, 704, 1, 3328]
    - [44, 7.06]
  - - [5888, 6784, 1, 3328]
    - [44, 7.867]
  - - [704, 4288, 1, 1280]
    - [44, 7.166]
  - - [4096, 7000, 1, 4096]
    - [83, 12.773]
  - - [5124, 9124, 1, 1760]
    - [82, 13.175]
  - - [1760, 32, 1, 1760]
    - [61, 1.546]
  - - [1024, 1500, 1, 1536]
    - [75, 10.666]
  - - [512, 24000, 1, 2048]
    - [85, 11.656]
  - - [3072, 24000, 1, 1024]
    - [83, 13.246]
  - - [1024, 3000, 1, 2560]
    - [83, 12.434]
  - - [512, 3136, 1, 2048]
    - [94, 9.51]
  - - [7680, 4, 1, 2560]
    - [61, 0.845]
  - - [64, 193600, 1, 64]
    - [82, 10.056]
  - - [8448, 1500, 1, 2816]
    - [82, 12.603]
  - - [2560, 7000, 1, 2560]
    - [82, 12.934]
  - - [3072, 16, 1, 1024]
    - [56, 1.27]
  - - [512, 48000, 1, 2048]
    - [85, 11.976]
  - - [1760, 64, 1, 1760]
    - [77, 3.113]
  - - [1024, 16, 1, 512]
    - [58, 0.33]
  - - [196, 256, 64, 1024]
    - [95, 6.7]
  - - [512, 48000, 1, 1536]
    - [83, 13.24]
  - - [2560, 32, 1, 2560]
    - [61, 2.274]
  - - [4608, 1500, 1, 1536]
    - [83, 12.359]
  - - [2048, 128, 1, 2048]
    - [80, 6.344]
  - - [1024, 24000, 1, 2560]
    - [82, 13.286]
  - - [4608, 3000, 1, 1536]
    - [83, 12.652]
  - - [5124, 9124, 1, 2048]
    - [83, 12.228]
  - - [2048, 16, 1, 2048]
    - [60, 0.912]
  - - [1024, 700, 1, 512]
    - [74, 7.038]
  - - [3072, 1, 1, 128]
    - [56, 0.043]
  - - [5124, 700, 1, 2560]
    - [83, 11.017]
  - - [8448, 16, 1, 2816]
    - [57, 3.503]
  - - [6144, 6000, 1, 2560]
    - [76, 12.359]
  - - [4608, 32, 1, 1536]
    - [56, 3.84]
  - - [3072, 64, 1, 1024]
    - [72, 4.794]
  - - [512, 16, 1, 512]
    - [58, 0.165]
  - - [7680, 2, 1, 2560]
    - [61, 0.424]
  - - [4224, 1, 1, 128]
    - [56, 0.059]
  - - [7680, 1, 1, 2560]
    - [61, 0.212]
  - - [128, 1500, 1, 1280]
    - [56, 4.893]
  - - [1024, 1500, 1, 2816]
    - [75, 10.873]
  - - [6144, 2, 1, 2560]
    - [61, 0.337]
  - - [8448, 48000, 1, 2816]
    - [83, 11.618]
  - - [512, 6000, 1, 2048]
    - [87, 9.075]
  - - [4224, 1500, 1, 176]
    - [68, 10.499]
  - - [1024, 6000, 1, 2816]
    - [82, 13.17]
  - - [1024, 48000, 1, 1536]
    - [83, 13.536]
  - - [1024, 48000, 1, 2560]
    - [82, 13.667]
  - - [4096, 32, 1, 4096]
    - [62, 3.615]
  - - [512, 16, 1, 500000]
    - [58, 0.248]
  - - [2560, 128, 1, 2560]
    - [77, 6.493]
  - - [4608, 24000, 1, 1536]
    - [82, 13.7]
  - - [512, 2, 1, 500000]
    - [58, 0.031]
  - - [7680, 48000, 1, 2560]
    - [83, 11.713]
  - - [3072, 48000, 1, 1024]
    - [83, 13.466]
  - - [1760, 16, 1, 1760]
    - [56, 0.776]
  - - [1024, 1500, 1, 2048]
    - [79, 8.337]
  - - [1024, 16, 1, 500000]
    - [58, 0.495]
  - - [64, 193600, 1, 256]
    - [88, 11.737]
  - - [1024, 3000, 1, 2048]
    - [84, 9.114]
  - - [6144, 4, 1, 2560]
    - [61, 0.678]
  - - [1024, 6000, 1, 2048]
    - [85, 10.898]
  - - [512, 24000, 1, 2816]
    - [82, 13.314]
  - - [6144, 48000, 1, 2560]
    - [85, 10.807]
  - - [1760, 7000, 1, 1760]
    - [69, 12.493]
  - - [8448, 3000, 1, 2816]
    - [82, 13.199]
  - - [3072, 4, 1, 1024]
    - [56, 0.317]
  - - [4608, 48000, 1, 1536]
    - [82, 13.803]
  - - [2048, 32, 1, 2048]
    - [81, 1.802]
  - - [7680, 1500, 1, 2560]
    - [83, 12.174]
  - - [4096, 128, 1, 4096]
    - [73, 8.618]
  - - [4608, 16, 1, 1536]
    - [61, 1.988]
  - - [512, 3000, 1, 1536]
    - [75, 10.677]
  - - [3072, 2, 1, 1024]
    - [56, 0.161]
  - - [8448, 1, 1, 2816]
    - [57, 0.217]
  - - [1024, 3000, 1, 2816]
    - [82, 12.729]
  - - [128, 1, 1, 1408]
    - [56, 0.004]
  - - [64, 1, 1, 1216]
    - [58, 0.002]
  - - [1024, 2, 1, 512]
    - [58, 0.041]
  - - [1024, 4, 1, 500000]
    - [58, 0.124]
  - - [6144, 1, 1, 2560]
    - [61, 0.17]
  - - [5124, 9124, 1, 2560]
    - [83, 12.812]
  - - [512, 48000, 1, 2816]
    - [82, 13.521]
  - - [512, 3000, 1, 2816]
    - [75, 10.878]
  - - [1024, 24000, 1, 1536]
    - [83, 13.198]
  - - [7680, 6000, 1, 2560]
    - [82, 13.271]
  - - [1760, 128, 1, 1760]
    - [80, 5.613]
  - - [512, 1500, 1, 2816]
    - [74, 8.44]
  - - [512, 1, 1, 512]
    - [63, 0.012]
  - - [512, 6000, 1, 2560]
    - [83, 12.47]
  - - [512, 8, 1, 500000]
    - [58, 0.124]
  - - [512, 24000, 1, 2560]
    - [83, 13.148]
  - - [6144, 3000, 1, 2560]
    - [85, 12.058]
  - - [1024, 24000, 1, 2816]
    - [82, 13.579]
  - - [2048, 7000, 1, 2048]
    - [85, 11.849]
  - - [7680, 3000, 1, 2560]
    - [76, 12.113]
  - - [1024, 4, 1, 512]
    - [58, 0.083]
  - - [5124, 700, 1, 2048]
    - [85, 9.788]
  - - [5124, 9124, 1, 4096]
    - [76, 11.835]
  - - [4096, 64, 1, 4096]
    - [81, 6.296]
  - - [256, 193600, 1, 64]
    - [65, 10.826]
  - - [7680, 32, 1, 2560]
    - [64, 6.365]
  - - [2560, 64, 1, 2560]
    - [72, 4.4]
  - - [3072, 128, 1, 1024]
    - [77, 7.123]
  - - [8448, 6000, 1, 2816]
    - [83, 13.321]
  - - [7680, 64, 1, 2560]
    - [58, 8.357]
  - - [5124, 1500, 1, 2560]
    - [83, 12.081]
  - - [1024, 1500, 1, 2560]
    - [75, 10.817]
  - - [512, 4, 1, 512]
    - [63, 0.048]
  - - [1024, 6000, 1, 2560]
    - [83, 12.881]
  - - [3072, 32, 1, 1024]
    - [81, 2.519]
  - - [6144, 32, 1, 2560]
    - [72, 5.153]
  - - [196, 1024, 64, 256]
    - [98, 9.269]
  - - [512, 50176, 1, 128]
    - [90, 11.895]
  - - [4608, 1, 1, 1536]
    - [61, 0.124]
  - - [1024, 32, 1, 512]
    - [58, 0.68]
  - - [7680, 24000, 1, 2560]
    - [83, 12.896]
  - - [8448, 4, 1, 2816]
    - [61, 0.865]
  - - [512, 1, 1, 500000]
    - [58, 0.015]
  - - [176, 1500, 1, 1408]
    - [58, 5.049]
  - - [512, 3000, 1, 2560]
    - [75, 10.833]
  - - [8448, 24000, 1, 2816]
    - [83, 10.875]
  - - [4608, 2, 1, 1536]
    - [61, 0.247]
  - - [512, 6000, 1, 1536]
    - [83, 12.29]
  - - [7680, 128, 1, 2560]
    - [66, 10.352]
  - - [3072, 6000, 1, 1024]
    - [83, 12.559]
  - - [3072, 1500, 1, 128]
    - [82, 9.65]
  - - [2048, 3136, 1, 512]
    - [92, 11.759]
  - - [1024, 3000, 1, 1536]
    - [83, 12.253]
  - - [512, 4, 1, 500000]
    - [58, 0.062]
  - - [512, 6000, 1, 2816]
    - [83, 12.517]
  - - [128, 50176, 1, 512]
    - [89, 11.932]
  - - [256, 12544, 1, 1024]
    - [93, 10.481]
  - - [1024, 12544, 1, 256]
    - [91, 12.265]
  - - [512, 48000, 1, 2560]
    - [83, 13.287]
  - - [2560, 16, 1, 2560]
    - [56, 1.149]
  - - [2048, 64, 1, 2048]
    - [81, 3.533]
  - - [512, 2, 1, 512]
    - [63, 0.024]
  - - [1024, 1, 1, 512]
    - [58, 0.021]
  - - [512, 1500, 1, 2560]
    - [74, 8.273]
  - - [512, 24000, 1, 1536]
    - [83, 13.079]
  - - [1024, 1, 1, 500000]
    - [58, 0.031]
  - - [6144, 16, 1, 2560]
    - [61, 2.707]
  - - [1024, 24000, 1, 2048]
    - [85, 11.97]
  - - [4096, 16, 1, 4096]
    - [62, 1.878]
  - - [512, 32, 1, 512]
    - [58, 0.341]
  - - [5124, 1500, 1, 2048]
    - [85, 10.763]
  - - [3072, 1500, 1, 1024]
    - [75, 10.993]
  - - [1024, 2, 1, 500000]
    - [58, 0.062]
  - - [1024, 8, 1, 500000]
    - [58, 0.247]
  - - [7680, 16, 1, 2560]
    - [61, 3.38]
  - - [6144, 1500, 1, 2560]
    - [83, 12.713]
  - - [3072, 1, 1, 1024]
    - [56, 0.08]
  - - [1024, 48000, 1, 2816]
    - [82, 13.914]
  - - [8448, 2, 1, 2816]
    - [61, 0.434]
  - - [4608, 4, 1, 1536]
    - [61, 0.493]
  - - [1024, 6000, 1, 1536]
    - [83, 12.801]
  - - [8448, 32, 1, 2816]
    - [58, 5.401]
  - - [512, 3000, 1, 2048]
    - [85, 8.347]
  - - [6144, 24000, 1, 2560]
    - [85, 11.945]
  - - [4608, 6000, 1, 1536]
    - [83, 13.229]
  - - [1024, 1024, 1, 1024]
    - [85, 9.784]
  - - [512, 1500, 1, 2048]
    - [85, 6.937]
  - - [512, 1500, 1, 1536]
    - [74, 8.099]
  - - [128, 1, 1, 1024]
    - [56, 0.003]
  - - [3072, 3000, 1, 1024]
    - [85, 11.785]
  - - [1024, 48000, 1, 2048]
    - [83, 12.578]
  - - [3136, 64, 128, 64]
    - [143, 11.398]
  - - [784, 512, 64, 128]
    - [136, 14.155]
  - - [3136, 256, 64, 64]
    - [143, 13.485]
  - - [12544, 1024, 1, 256]
    - [139, 15.558]
  - - [784, 128, 128, 512]
    - [138, 14.852]
  - - [784, 512, 256, 128]
    - [142, 13.829]
  - - [3136, 64, 64, 256]
    - [140, 14.454]
  - - [3136, 512, 1, 2048]
    - [141, 11.648]
  - - [12544, 256, 1, 1024]
    - [144, 13.213]
  - - [3136, 2048, 1, 512]
    - [137, 14.598]
  - - [3136, 256, 256, 64]
    - [146, 13.548]
  - - [3136, 64, 128, 256]
    - [137, 14.906]
  - - [784, 128, 64, 512]
    - [138, 14.468]
  - - [3136, 64, 256, 64]
    - [143, 11.552]
  - - [784, 512, 128, 128]
    - [136, 14.327]
  - - [3136, 64, 64, 64]
    - [145, 10.991]
  - - [784, 128, 256, 512]
    - [138, 15.098]
  - - [3136, 64, 256, 256]
    - [140, 15.01]
  - - [3136, 256, 128, 64]
    - [135, 13.708]
  - - [64, 14, 1, 14]
    - [174, 0.001]
  - - [64, 14, 1, 15]
    - [174, 0.001]
  - - [64, 15, 1, 15]
    - [173, 0.001]
  - - [64, 15, 1, 15]
    - [173, 0.001]
  - - [64, 15, 1, 17]
    - [173, 0.001]
  - - [64, 17, 1, 17]
    - [173, 0.001]
  - - [64, 17, 1, 17]
    - [173, 0.001]
  - - [64, 17, 1, 21]
    - [174, 0.002]
  - - [64, 21, 1, 21]
    - [174, 0.003]
  - - [64, 24, 1, 24]
    - [174, 0.004]
  - - [64, 24, 1, 34]
    - [174, 0.004]
  - - [64, 30, 1, 30]
    - [174, 0.005]
  - - [64, 31, 1, 30]
    - [182, 0.006]
  - - [64, 31, 1, 31]
    - [185, 0.006]
  - - [64, 32, 1, 32]
    - [177, 0.007]
  - - [64, 34, 1, 34]
    - [181, 0.007]
  - - [64, 35, 1, 32]
    - [180, 0.007]
  - - [64, 35, 1, 35]
    - [174, 0.007]
  - - [64, 128, 512, 128]
    - [302, 15.318]
  - - [64, 512, 1, 512]
    - [310, 2.093]
  - - [64, 512, 64, 512]
    - [357, 21.94]
  - - [128, 128, 512, 64]
    - [400, 14.953]
  - - [512, 512, 1, 64]
    - [352, 3.019]
  - - [512, 512, 64, 64]
    - [412, 21.517]
  - - [1024, 4, 1, 2]
    - [287, 0.001]
  - - [1024, 4, 1, 1024]
    - [374, 0.322]
  - - [1024, 32, 1, 2]
    - [298, 0.013]
  - - [1024, 32, 1, 1024]
    - [374, 2.779]
  - - [1024, 2048, 1, 2]
    - [341, 0.311]
  - - [1024, 2048, 1, 1024]
    - [409, 37.919]
  - - [1024, 2048, 1, 4096]
    - [373, 43.88]
  - - [1024, 2048, 1, 30528]
    - [345, 50.641]
  - - [1024, 4096, 1, 1024]
    - [305, 42.088]
  - - [1024, 4096, 1, 4096]
    - [359, 44.697]
  - - [1024, 4096, 1, 30528]
    - [317, 50.392]
  - - [4096, 2048, 1, 1024]
    - [354, 51.663]
  - - [4096, 4096, 1, 1024]
    - [326, 61.552]
  - - [32, 33, 1600, 33]
    - [404, 2.015]
  - - [32, 200, 1, 1]
    - [289, 0.001]
  - - [64, 3, 512, 3]
    - [340, 0.034]
  - - [64, 5, 512, 5]
    - [289, 0.094]
  - - [64, 5, 960, 5]
    - [328, 0.134]
  - - [64, 9, 512, 9]
    - [287, 0.282]
  - - [64, 512, 1, 1]
    - [287, 0.007]
  - - [67, 512, 1, 2048]
    - [390, 3.254]
  - - [74, 512, 1, 2048]
    - [292, 3.649]
  - - [74, 960, 1, 2048]
    - [410, 6.275]
  - - [100, 512, 1, 2048]
    - [297, 4.858]
  - - [128, 27, 32768, 27]
    - [290, 2.727]
  - - [256, 1024, 1, 1]
    - [344, 0.042]
  - - [256, 8976, 1, 1536]
    - [364, 41.496]
  - - [256, 8976, 1, 2048]
    - [345, 44.173]
  - - [256, 8976, 1, 2304]
    - [396, 45.58]
  - - [256, 8976, 1, 2560]
    - [407, 46.183]
  - - [256, 8976, 1, 2816]
    - [364, 46.761]
  - - [256, 8976, 1, 3072]
    - [293, 47.628]
  - - [256, 8976, 1, 4352]
    - [317, 49.806]
  - - [256, 8976, 1, 4864]
    - [306, 50.094]
  - - [256, 8976, 1, 5376]
    - [389, 50.395]
  - - [256, 8976, 1, 5632]
    - [306, 50.994]
  - - [256, 8976, 1, 5888]
    - [317, 51.076]
  - - [256, 8976, 1, 6144]
    - [380, 51.369]
  - - [256, 8976, 1, 6656]
    - [306, 51.877]
  - - [256, 8976, 1, 7168]
    - [359, 51.934]
  - - [256, 8976, 1, 7424]
    - [407, 51.816]
  - - [256, 8976, 1, 8192]
    - [293, 52.476]
  - - [256, 8976, 1, 8448]
    - [373, 52.535]
  - - [256, 8976, 1, 8960]
    - [407, 52.372]
  - - [256, 8976, 1, 9472]
    - [306, 52.456]
  - - [256, 8976, 1, 9728]
    - [293, 52.933]
  - - [256, 8976, 1, 9984]
    - [407, 52.829]
  - - [256, 8976, 1, 10240]
    - [407, 53.254]
  - - [256, 8976, 1, 10496]
    - [306, 52.686]
  - - [256, 8976, 1, 11008]
    - [359, 53.099]
  - - [256, 8976, 1, 11520]
    - [306, 53.137]
  - - [256, 8976, 1, 12288]
    - [293, 53.653]
  - - [256, 8976, 1, 14336]
    - [403, 53.886]
  - - [256, 8976, 1, 14848]
    - [359, 53.971]
  - - [256, 8976, 1, 15104]
    - [306, 53.535]
  - - [256, 8976, 1, 15872]
    - [317, 54.219]
  - - [256, 8976, 1, 17152]
    - [407, 53.657]
  - - [256, 8976, 1, 19712]
    - [407, 53.875]
  - - [256, 8976, 1, 19968]
    - [293, 54.175]
  - - [256, 8976, 1, 20480]
    - [317, 54.552]
  - - [256, 8976, 1, 20992]
    - [306, 54.198]
  - - [256, 8976, 1, 22016]
    - [293, 54.493]
  - - [256, 8976, 1, 26112]
    - [293, 54.766]
  - - [256, 8976, 1, 33536]
    - [364, 54.113]
  - - [256, 8976, 1, 44505]
    - [407, 55.157]
  - - [256, 32768, 1, 128]
    - [371, 27.012]
  - - [257, 1024, 1, 4096]
    - [337, 16.701]
  - - [480, 32768, 1, 1024]
    - [375, 53.072]
  - - [512, 200, 1, 1]
    - [379, 0.017]
  - - [512, 200, 1, 32]
    - [309, 0.626]
  - - [512, 215, 1, 2048]
    - [395, 10.242]
  - - [512, 256, 1, 2048]
    - [367, 11.684]
  - - [512, 1600, 1, 32]
    - [350, 4.23]
  - - [512, 1600, 1, 512]
    - [366, 24.532]
  - - [512, 32768, 1, 256]
    - [305, 41.523]
  - - [560, 200, 1, 1024]
    - [397, 7.301]
  - - [560, 1600, 1, 1024]
    - [349, 30.998]
  - - [768, 215, 1, 2048]
    - [330, 13.297]
  - - [768, 256, 1, 2048]
    - [308, 15.571]
  - - [1024, 200, 1, 1]
    - [296, 0.032]
  - - [1024, 512, 1, 1]
    - [388, 0.076]
  - - [1024, 512, 1, 64]
    - [332, 5.234]
  - - [1024, 512, 1, 1024]
    - [324, 23.477]
  - - [1024, 960, 1, 64]
    - [311, 8.411]
  - - [1024, 960, 1, 1024]
    - [365, 34.009]
  - - [1024, 1600, 1, 1]
    - [353, 0.168]
  - - [1024, 1600, 1, 1024]
    - [413, 36.856]
  - - [1024, 1792, 1, 256]
    - [385, 28.001]
  - - [1024, 2048, 1, 256]
    - [300, 26.168]
  - - [1024, 2560, 1, 256]
    - [378, 30.049]
  - - [1024, 3072, 1, 256]
    - [361, 32.625]
  - - [1024, 3328, 1, 256]
    - [368, 34.018]
  - - [1024, 3840, 1, 256]
    - [392, 37.088]
  - - [1024, 4096, 1, 256]
    - [327, 32.31]
  - - [1024, 4608, 1, 256]
    - [323, 34.36]
  - - [1024, 4864, 1, 256]
    - [356, 35.096]
  - - [1024, 5120, 1, 256]
    - [301, 36.62]
  - - [1024, 5632, 1, 256]
    - [382, 35.247]
  - - [1024, 6144, 1, 256]
    - [384, 35.633]
  - - [1024, 6400, 1, 256]
    - [323, 36.176]
  - - [1024, 7168, 1, 256]
    - [305, 37.898]
  - - [1024, 7424, 1, 256]
    - [375, 38.424]
  - - [1024, 7680, 1, 256]
    - [383, 39.833]
  - - [1024, 7936, 1, 256]
    - [315, 36.665]
  - - [1024, 8192, 1, 256]
    - [333, 37.705]
  - - [1024, 8448, 1, 256]
    - [331, 38.522]
  - - [1024, 8704, 1, 256]
    - [313, 38.683]
  - - [1024, 8960, 1, 256]
    - [378, 38.699]
  - - [1024, 9728, 1, 256]
    - [301, 38.062]
  - - [1024, 9984, 1, 256]
    - [313, 38.94]
  - - [1024, 10240, 1, 256]
    - [323, 39.561]
  - - [1024, 10496, 1, 256]
    - [323, 40.046]
  - - [1024, 11008, 1, 256]
    - [391, 40.671]
  - - [1024, 11264, 1, 256]
    - [398, 41.367]
  - - [1024, 11520, 1, 256]
    - [381, 42.118]
  - - [1024, 12288, 1, 256]
    - [301, 40.248]
  - - [1024, 13312, 1, 256]
    - [331, 39.681]
  - - [1024, 13568, 1, 256]
    - [339, 40.248]
  - - [1024, 14336, 1, 256]
    - [398, 41.038]
  - - [1024, 14592, 1, 256]
    - [314, 41.337]
  - - [1024, 14848, 1, 256]
    - [391, 42.014]
  - - [1024, 15104, 1, 256]
    - [398, 42.787]
  - - [1024, 16128, 1, 256]
    - [376, 40.874]
  - - [1024, 17152, 1, 256]
    - [301, 40.892]
  - - [1024, 18944, 1, 256]
    - [391, 43.802]
  - - [1024, 19712, 1, 256]
    - [382, 41.226]
  - - [1024, 19968, 1, 256]
    - [376, 41.234]
  - - [1024, 20480, 1, 256]
    - [331, 41.216]
  - - [1024, 20992, 1, 256]
    - [331, 41.733]
  - - [1024, 21504, 1, 256]
    - [304, 42.305]
  - - [1024, 22016, 1, 256]
    - [360, 42.866]
  - - [1024, 23552, 1, 256]
    - [399, 41.508]
  - - [1024, 28672, 1, 256]
    - [347, 43.126]
  - - [1024, 32768, 1, 512]
    - [375, 56.771]
  - - [1024, 32768, 1, 1024]
    - [360, 64.156]
  - - [1024, 33536, 1, 256]
    - [338, 44.737]
  - - [1024, 40448, 1, 256]
    - [338, 44.698]
  - - [1600, 512, 1, 1024]
    - [348, 33.264]
  - - [2048, 512, 1, 1]
    - [319, 0.117]
  - - [2048, 512, 1, 2048]
    - [303, 33.054]
  - - [2048, 960, 1, 2048]
    - [363, 39.623]
  - - [2048, 1024, 1, 1]
    - [318, 0.154]
  - - [2048, 1024, 1, 256]
    - [346, 25.898]
  - - [3200, 1024, 1, 2048]
    - [381, 63.182]
  - - [4096, 1024, 1, 1]
    - [355, 0.214]
  - - [64, 14, 10880, 14]
    - [289, 1.176]
  - - [64, 14, 10880, 15]
    - [287, 1.253]
  - - [64, 15, 7680, 15]
    - [289, 1.246]
  - - [64, 15, 10880, 15]
    - [287, 1.297]
  - - [64, 15, 7680, 17]
    - [320, 1.38]
  - - [64, 17, 6144, 17]
    - [343, 1.223]
  - - [64, 17, 7680, 17]
    - [288, 1.238]
  - - [64, 17, 6144, 21]
    - [290, 1.483]
  - - [64, 21, 6144, 21]
    - [291, 1.719]
  - - [64, 24, 4736, 24]
    - [344, 2.048]
  - - [64, 24, 4736, 34]
    - [336, 2.627]
  - - [64, 30, 2048, 30]
    - [351, 2.521]
  - - [64, 31, 2048, 30]
    - [341, 2.546]
  - - [64, 31, 2048, 31]
    - [316, 2.643]
  - - [64, 32, 4608, 32]
    - [294, 6.681]
  - - [64, 34, 4736, 34]
    - [335, 3.221]
  - - [64, 35, 4608, 32]
    - [307, 4.97]
  - - [64, 35, 4608, 35]
    - [402, 3.116]
  - - [1024, 3840, 1, 1024]
    - [401, 57.972]
  - - [1024, 3840, 1, 4096]
    - [372, 70.499]
  - - [1024, 3968, 1, 1024]
    - [331, 41.556]
  - - [1024, 3968, 1, 4096]
    - [321, 43.578]
  - - [1024, 3968, 1, 42720]
    - [317, 49.134]
  - - [1024, 6528, 1, 1024]
    - [358, 53.561]
  - - [1024, 6528, 1, 4096]
    - [359, 67.644]
  - - [1024, 6528, 1, 42720]
    - [359, 79.789]
  - - [1024, 7104, 1, 1024]
    - [411, 54.377]
  - - [1024, 7104, 1, 4096]
    - [386, 68.613]
  - - [1024, 7104, 1, 42720]
    - [359, 84.312]
  - - [1024, 7200, 1, 1024]
    - [387, 55.896]
  - - [1024, 7200, 1, 4096]
    - [342, 68.28]
  - - [1024, 7200, 1, 42720]
    - [317, 83.718]
  - - [1024, 8064, 1, 1024]
    - [406, 48.046]
  - - [1024, 8064, 1, 4096]
    - [359, 59.441]
  - - [1024, 8160, 1, 1024]
    - [318, 47.102]
  - - [1024, 8160, 1, 4096]
    - [373, 57.359]
  - - [1024, 9216, 1, 1024]
    - [377, 54.545]
  - - [1024, 9216, 1, 4096]
    - [359, 66.78]
  - - [1024, 9520, 1, 1024]
    - [405, 53.813]
  - - [1024, 9520, 1, 4096]
    - [359, 68.439]
  - - [1024, 9520, 1, 42720]
    - [359, 77.823]
  - - [1024, 10064, 1, 1024]
    - [381, 56.53]
  - - [1024, 10064, 1, 4096]
    - [359, 69.437]
  - - [1024, 10080, 1, 1024]
    - [381, 56.233]
  - - [1024, 10080, 1, 4096]
    - [359, 68.894]
  - - [1024, 10080, 1, 42720]
    - [359, 81.978]
  - - [1024, 10200, 1, 1024]
    - [394, 55.391]
  - - [1024, 10200, 1, 4096]
    - [393, 70.166]
  - - [4096, 3840, 1, 1024]
    - [370, 59.529]
  - - [4096, 3968, 1, 1024]
    - [398, 58.796]
  - - [4096, 6528, 1, 1024]
    - [381, 62.957]
  - - [4096, 7104, 1, 1024]
    - [354, 64.787]
  - - [4096, 7200, 1, 1024]
    - [369, 63.238]
  - - [4096, 8064, 1, 1024]
    - [312, 65.088]
  - - [4096, 8160, 1, 1024]
    - [338, 64.942]
  - - [4096, 9216, 1, 1024]
    - [312, 67.717]
  - - [4096, 9520, 1, 1024]
    - [322, 64.661]
  - - [4096, 10064, 1, 1024]
    - [369, 64.663]
  - - [4096, 10080, 1, 1024]
    - [381, 64.576]
  - - [4096, 10200, 1, 1024]
    - [299, 64.784]
  - - [64, 27, 1920, 27]
    - [344, 2.194]
  - - [64, 33, 1920, 27]
    - [329, 2.334]
  - - [64, 33, 1920, 33]
    - [334, 2.746]
  - - [1024, 3240, 1, 1024]
    - [394, 46.687]
  - - [1024, 3240, 1, 4096]
    - [362, 61.646]
  - - [1024, 3960, 1, 1024]
    - [325, 40.819]
  - - [1024, 3960, 1, 4096]
    - [295, 42.95]
  - - [1024, 3960, 1, 42720]
    - [359, 48.607]
  - - [4096, 3240, 1, 1024]
    - [408, 57.754]
  - - [4096, 3960, 1, 1024]
    - [398, 59.012]
- null
