library/src/blas3/Tensile/Logic/asm_full/arcturus_Cijk_Ailk_Bjlk_HB.yaml
- {MinimumRequiredVersion: 4.6.0}
- arcturus
- gfx908
- [Device 7380, Device 7388, Device 738c, Device 7390]
    SolutionIndex: 0
    SolutionNameMin: Cijk_Ailk_Bjlk_HB_MT32x32x16_SN_APM1_EPS1_FL0_GRVW4_LRVW4_NLCA1_NLCB1_PGR1_TT4_4_USFGRO0_VW4_WG8_8_1_WGM8
    SolutionIndex: 1
    SolutionNameMin: Cijk_Ailk_Bjlk_HB_MT64x16x16_SN_APM1_EPS1_FL0_GRVW2_LRVW2_NLCA1_NLCB1_PGR1_TT4_2_USFGRO0_VW2_WG16_8_1_WGM1
    SolutionIndex: 2
    SolutionNameMin: Cijk_Ailk_Bjlk_HB_MT128x64x16_SN_APM1_EPS1_FL0_GRVW4_LRVW4_NLCA1_NLCB1_PGR1_TT8_4_USFGRO0_VW4_WG16_16_1_WGM8
    SolutionIndex: 3
    SolutionNameMin: Cijk_Ailk_Bjlk_HB_MT32x16x64_SN_APM1_EPS1_FL0_GRVW2_LRVW2_NLCA1_NLCB1_PGR1_TT2_2_USFGRO0_VW2_WG16_8_1_WGM1
    SolutionIndex: 4
    SolutionNameMin: Cijk_Ailk_Bjlk_HB_MT64x64x16_SN_APM1_EPS1_FL0_GRVW4_LRVW4_NLCA1_NLCB1_PGR1_TT4_4_USFGRO0_VW4_WG16_16_1_WGM1
    SolutionIndex: 5
    SolutionNameMin: Cijk_Ailk_Bjlk_HB_MT64x128x16_SN_APM1_EPS1_FL0_GRVW4_LRVW4_NLCA1_NLCB1_PGR1_TT4_8_USFGRO0_VW4_WG16_16_1_WGM8
    SolutionIndex: 6
    SolutionNameMin: Cijk_Ailk_Bjlk_HB_MT128x128x16_SN_APM1_EPS1_FL0_GRVW8_LRVW8_NLCA1_NLCB1_PGR1_TT8_8_USFGRO0_VW8_WG16_16_1_WGM8
    SolutionIndex: 7
    SolutionNameMin: Cijk_Ailk_Bjlk_HB_MT64x32x8_SN_APM1_EPS1_FL0_GRVW4_LRVW4_NLCA1_NLCB1_PGR1_TT8_4_USFGRO0_VW4_WG8_8_1_WGM8
    SolutionIndex: 8
    SolutionNameMin: Cijk_Ailk_Bjlk_HB_MT64x64x16_SN_APM0_EPS1_FL1_GRVW8_LRVW4_NLCA1_NLCB1_PGR1_TT4_4_USFGRO0_VW4_WG16_16_1_WGM1
    SolutionIndex: 9
    SolutionNameMin: Cijk_Ailk_Bjlk_HB_MT64x128x8_SN_APM0_EPS1_FL1_GRVW8_LRVW4_NLCA1_NLCB1_PGR1_TT8_4_USFGRO0_VW4_WG8_32_1_WGM1
    SolutionIndex: 10
    SolutionNameMin: Cijk_Ailk_Bjlk_HB_MT64x64x16_SN_APM1_EPS1_FL0_GRVW4_LRVW4_NLCA1_NLCB1_PGR1_TT4_4_USFGRO0_VW4_WG16_16_1_WGM8
    SolutionIndex: 11
    SolutionNameMin: Cijk_Ailk_Bjlk_HB_MT64x32x16_SN_APM1_EPS1_FL0_GRVW4_LRVW4_NLCA1_NLCB1_PGR1_TT4_4_USFGRO0_VW4_WG16_8_1_WGM8
    SolutionIndex: 12
    SolutionNameMin: Cijk_Ailk_Bjlk_HB_MT64x128x8_SN_APM1_EPS1_FL0_GRVW4_LRVW4_NLCA1_NLCB1_PGR1_TT4_8_USFGRO0_VW4_WG16_16_1_WGM8
    SolutionIndex: 13
    SolutionNameMin: Cijk_Ailk_Bjlk_HB_MT64x16x32_SN_APM1_EPS1_FL0_GRVW2_LRVW2_NLCA1_NLCB1_PGR1_TT4_2_USFGRO0_VW2_WG16_8_1_WGM1
    SolutionIndex: 14
    SolutionNameMin: Cijk_Ailk_Bjlk_HB_MT32x32x64_SN_APM1_EPS1_FL0_GRVW2_LRVW2_NLCA1_NLCB1_PGR1_TT2_2_USFGRO0_VW2_WG16_16_1_WGM1
    SolutionIndex: 15
    SolutionNameMin: Cijk_Ailk_Bjlk_HB_MT64x64x32_SN_APM1_EPS1_FL0_GRVW4_LRVW4_NLCA1_NLCB1_PGR1_TT4_4_USFGRO0_VW4_WG16_16_1_WGM1
    SolutionIndex: 16
    SolutionNameMin: Cijk_Ailk_Bjlk_HB_MT16x16x64_SN_APM1_EPS1_FL0_GRVW2_LRVW2_NLCA1_NLCB1_PGR1_TT2_2_USFGRO0_VW2_WG8_8_1_WGM1
    SolutionIndex: 17
    SolutionNameMin: Cijk_Ailk_Bjlk_HB_MT32x16x16_SN_APM1_EPS1_FL0_GRVW2_LRVW2_NLCA1_NLCB1_PGR1_TT2_2_USFGRO0_VW2_WG16_8_1_WGM8
    SolutionIndex: 18
    SolutionNameMin: Cijk_Ailk_Bjlk_HB_MT32x32x32_SN_APM1_EPS1_FL0_GRVW2_LRVW2_NLCA1_NLCB1_PGR1_TT2_2_USFGRO0_VW2_WG16_16_1_WGM1
    SolutionIndex: 19
    SolutionNameMin: Cijk_Ailk_Bjlk_HB_MT64x64x32_SN_APM1_EPS1_FL0_GRVW4_LRVW4_NLCA1_NLCB1_PGR1_TT4_4_USFGRO0_VW4_WG16_16_1_WGM8
    SolutionIndex: 20
    SolutionNameMin: Cijk_Ailk_Bjlk_HB_MT32x16x32_SN_APM1_EPS1_FL0_GRVW2_LRVW2_NLCA1_NLCB1_PGR1_TT2_2_USFGRO0_VW2_WG16_8_1_WGM8
    SolutionIndex: 21
    SolutionNameMin: Cijk_Ailk_Bjlk_HB_MT32x32x16_SN_APM1_EPS1_FL0_GRVW4_LRVW4_NLCA1_NLCB1_PGR1_TT4_4_USFGRO0_VW4_WG8_8_1_WGM1
    SolutionIndex: 22
    SolutionNameMin: Cijk_Ailk_Bjlk_HB_MT32x32x8_SN_APM1_EPS1_FL0_GRVW4_LRVW4_NLCA1_NLCB1_PGR1_TT4_4_USFGRO0_VW4_WG8_8_1_WGM1
    SolutionIndex: 23
    SolutionNameMin: Cijk_Ailk_Bjlk_HB_MT64x32x16_SN_APM1_EPS1_FL0_GRVW4_LRVW4_NLCA1_NLCB1_PGR1_TT4_4_USFGRO0_VW4_WG16_8_1_WGM1
    SolutionIndex: 24
    SolutionNameMin: Cijk_Ailk_Bjlk_HB_MT64x16x32_SN_APM1_EPS1_FL0_GRVW2_LRVW2_NLCA1_NLCB1_PGR1_TT2_2_USFGRO0_VW2_WG32_8_1_WGM1
    SolutionIndex: 25
    SolutionNameMin: Cijk_Ailk_Bjlk_HB_MT64x16x64_SN_APM1_EPS1_FL0_GRVW2_LRVW2_NLCA1_NLCB1_PGR1_TT2_2_USFGRO0_VW2_WG32_8_1_WGM1
    SolutionIndex: 26
    SolutionNameMin: Cijk_Ailk_Bjlk_HB_MT32x16x16_SN_APM1_EPS1_FL0_GRVW2_LRVW2_NLCA1_NLCB1_PGR1_TT2_2_USFGRO0_VW2_WG16_8_1_WGM1
    SolutionIndex: 27
    SolutionNameMin: Cijk_Ailk_Bjlk_HB_MT128x32x8_SN_APM1_EPS1_FL0_GRVW4_LRVW4_NLCA1_NLCB1_PGR1_TT4_4_USFGRO0_VW4_WG32_8_1_WGM1
    SolutionIndex: 28
    SolutionNameMin: Cijk_Ailk_Bjlk_HB_MT32x16x16_SN_APM1_EPS1_FL0_GRVW2_LRVW2_NLCA1_NLCB1_PGR1_TT4_2_USFGRO0_VW2_WG8_8_1_WGM1
    SolutionIndex: 29
    SolutionNameMin: Cijk_Ailk_Bjlk_HB_MT64x16x32_SN_APM1_EPS1_FL0_GRVW2_LRVW2_NLCA1_NLCB1_PGR1_TT2_2_USFGRO0_VW2_WG32_8_1_WGM8
    SolutionIndex: 30
    SolutionNameMin: Cijk_Ailk_Bjlk_HB_MT32x32x8_SN_APM1_EPS1_FL0_GRVW4_LRVW4_NLCA1_NLCB1_PGR1_TT4_4_USFGRO0_VW4_WG8_8_1_WGM8
    SolutionIndex: 31
    SolutionNameMin: Cijk_Ailk_Bjlk_HB_MT16x16x32_SN_APM1_EPS1_FL0_GRVW2_LRVW2_NLCA1_NLCB1_PGR1_TT2_2_USFGRO0_VW2_WG8_8_1_WGM1
    SolutionIndex: 32
    SolutionNameMin: Cijk_Ailk_Bjlk_HB_MT128x128x16_SN_APM0_EPS1_FL1_GRVW8_LRVW8_NLCA1_NLCB1_PGR1_TT8_8_USFGRO0_VW8_WG16_16_1_WGM1
    SolutionIndex: 33
    SolutionNameMin: Cijk_Ailk_Bjlk_HB_MT16x16x16_SN_APM1_EPS1_FL0_GRVW2_LRVW2_NLCA1_NLCB1_PGR1_TT2_2_USFGRO0_VW2_WG8_8_1_WGM1
    SolutionIndex: 34
    SolutionNameMin: Cijk_Ailk_Bjlk_HB_MT64x256x8_SN_APM0_EPS1_FL1_GRVW8_LRVW8_NLCA1_NLCB1_PGR1_TT8_8_USFGRO0_VW8_WG8_32_1_WGM1
    SolutionIndex: 35
    SolutionNameMin: Cijk_Ailk_Bjlk_HB_MT32x16x32_SN_APM1_EPS1_FL0_GRVW2_LRVW2_NLCA1_NLCB1_PGR1_TT2_2_USFGRO0_VW2_WG16_8_1_WGM1
    SolutionIndex: 36
    SolutionNameMin: Cijk_Ailk_Bjlk_HB_MT64x16x16_SN_APM1_EPS1_FL0_GRVW2_LRVW2_NLCA1_NLCB1_PGR1_TT4_2_USFGRO0_VW2_WG16_8_1_WGM8
    SolutionIndex: 37
    SolutionNameMin: Cijk_Ailk_Bjlk_HB_MT128x96x16_SN_APM1_EPS1_FL0_GRVW2_LRVW2_NLCA1_NLCB3_PGR1_TT8_6_USFGRO0_VW2_WG16_16_1_WGM8
    SolutionIndex: 38
    SolutionNameMin: Cijk_Ailk_Bjlk_HB_MT32x128x8_SN_APM0_EPS1_FL1_GRVW8_LRVW4_NLCA1_NLCB1_PGR1_TT4_4_USFGRO0_VW4_WG8_32_1_WGM1
    SolutionIndex: 39
    SolutionNameMin: Cijk_Ailk_Bjlk_HB_MT64x64x8_SN_APM1_EPS1_FL0_GRVW8_LRVW8_NLCA1_NLCB1_PGR1_TT8_8_USFGRO0_VW8_WG8_8_1_WGM8
    SolutionIndex: 40
    SolutionNameMin: Cijk_Ailk_Bjlk_HB_MT96x128x16_SN_APM1_EPS1_FL0_GRVW2_LRVW2_NLCA3_NLCB1_PGR1_TT6_8_USFGRO0_VW2_WG16_16_1_WGM8
    SolutionIndex: 41
    SolutionNameMin: Cijk_Ailk_Bjlk_HB_MT64x16x16_SN_APM1_EPS1_FL0_GRVW2_LRVW2_NLCA1_NLCB1_PGR1_TT2_2_USFGRO1_VW2_WG32_8_1_WGM1
    SolutionIndex: 42
    SolutionNameMin: Cijk_Ailk_Bjlk_HB_MT32x16x32_SN_APM1_EPS1_FL0_GRVW2_LRVW2_NLCA1_NLCB1_PGR1_TT4_2_USFGRO0_VW2_WG8_8_1_WGM8
    SolutionIndex: 43
    SolutionNameMin: Cijk_Ailk_Bjlk_HB_MT128x64x16_SN_APM0_EPS0_FL1_GRVW8_LRVW8_NLCA1_NLCB1_PGR0_TT8_8_USFGRO0_VW8_WG16_8_1_WGM1
    SolutionIndex: 44
    SolutionNameMin: Cijk_Ailk_Bjlk_HB_MT32x32x16_SN_APM1_EPS1_FL0_GRVW2_LRVW2_NLCA1_NLCB1_PGR1_TT2_2_USFGRO0_VW2_WG16_16_1_WGM1
    SolutionIndex: 45
    SolutionNameMin: Cijk_Ailk_Bjlk_HB_MT64x16x64_SN_APM1_EPS1_FL0_GRVW2_LRVW2_NLCA1_NLCB1_PGR1_TT2_2_USFGRO0_VW2_WG32_8_1_WGM8
    SolutionIndex: 46
    SolutionNameMin: Cijk_Ailk_Bjlk_HB_MT64x16x32_SN_APM1_EPS1_FL0_GRVW2_LRVW2_NLCA1_NLCB1_PGR1_TT4_2_USFGRO0_VW2_WG16_8_1_WGM8
- - - [1024, 1024, 1, 3328]
    - [0, 13.25]
  - - [64, 6784, 1, 256]
    - [1, 2.597]
  - - [2944, 4288, 1, 1280]
    - [2, 20.948]
  - - [2368, 64, 1, 3328]
    - [3, 3.78]
  - - [2368, 5888, 1, 256]
    - [4, 16.538]
  - - [1024, 5056, 1, 3328]
    - [4, 18.952]
  - - [5888, 1024, 1, 1280]
    - [5, 16.843]
  - - [128, 6784, 1, 3328]
    - [0, 13.025]
  - - [5888, 1856, 1, 3328]
    - [6, 20.812]
  - - [5056, 704, 1, 256]
    - [7, 10.491]
  - - [5888, 2944, 1, 3328]
    - [2, 22.614]
  - - [1856, 4288, 1, 256]
    - [8, 14.637]
  - - [5056, 5056, 1, 3328]
    - [9, 22.475]
  - - [1408, 5888, 1, 1280]
    - [7, 18.827]
  - - [448, 3584, 1, 3328]
    - [10, 14.767]
  - - [256, 4288, 1, 3328]
    - [11, 13.33]
  - - [5888, 1408, 1, 1280]
    - [8, 19.756]
  - - [704, 1856, 1, 3328]
    - [4, 14.103]
  - - [3584, 1856, 1, 3328]
    - [2, 21.208]
  - - [5056, 6784, 1, 1280]
    - [12, 23.061]
  - - [1408, 64, 1, 1280]
    - [3, 1.773]
  - - [448, 1024, 1, 1280]
    - [13, 6.002]
  - - [5056, 5056, 1, 1280]
    - [7, 21.567]
  - - [448, 5056, 1, 256]
    - [10, 9.925]
  - - [6784, 448, 1, 256]
    - [8, 11.188]
  - - [2368, 128, 1, 256]
    - [14, 2.004]
  - - [5888, 704, 1, 1280]
    - [10, 17.262]
  - - [3584, 1024, 1, 256]
    - [15, 10.423]
  - - [6784, 4288, 1, 3328]
    - [2, 22.865]
  - - [1856, 2368, 1, 3328]
    - [15, 19.504]
  - - [5888, 2944, 1, 1280]
    - [2, 21.983]
  - - [5888, 1024, 1, 256]
    - [10, 14.868]
  - - [448, 64, 1, 1280]
    - [16, 0.596]
  - - [2944, 64, 1, 256]
    - [17, 1.454]
  - - [1408, 2944, 1, 256]
    - [4, 13.151]
  - - [256, 1856, 1, 1280]
    - [8, 5.896]
  - - [6784, 5056, 1, 3328]
    - [2, 23.236]
  - - [5056, 5056, 1, 256]
    - [5, 18.489]
  - - [448, 704, 1, 1280]
    - [18, 4.845]
  - - [64, 1024, 1, 1280]
    - [3, 1.194]
  - - [1024, 3584, 1, 1280]
    - [12, 17.442]
  - - [2368, 2944, 1, 1280]
    - [12, 18.05]
  - - [128, 3584, 1, 1280]
    - [8, 6.584]
  - - [1024, 256, 1, 3328]
    - [14, 5.48]
  - - [1408, 4288, 1, 1280]
    - [19, 18.398]
  - - [3584, 4288, 1, 1280]
    - [5, 21.948]
  - - [2368, 704, 1, 1280]
    - [11, 14.387]
  - - [5056, 4288, 1, 3328]
    - [2, 22.108]
  - - [3584, 2368, 1, 3328]
    - [2, 20.825]
  - - [64, 704, 1, 1280]
    - [16, 0.743]
  - - [4288, 256, 1, 256]
    - [11, 5.721]
  - - [6784, 448, 1, 1280]
    - [2, 14.577]
  - - [64, 64, 1, 1280]
    - [20, 0.053]
  - - [4288, 2944, 1, 256]
    - [12, 15.032]
  - - [1856, 64, 1, 1280]
    - [14, 2.31]
  - - [5888, 64, 1, 3328]
    - [1, 5.699]
  - - [2944, 256, 1, 3328]
    - [21, 11.493]
  - - [5056, 2368, 1, 1280]
    - [9, 20.528]
  - - [448, 3584, 1, 1280]
    - [8, 13.121]
  - - [6784, 5888, 1, 256]
    - [12, 20.108]
  - - [256, 4288, 1, 1280]
    - [19, 11.816]
  - - [704, 128, 1, 1280]
    - [3, 1.823]
  - - [1408, 448, 1, 1280]
    - [19, 7.946]
  - - [1024, 1408, 1, 256]
    - [22, 7.074]
  - - [2368, 2368, 1, 3328]
    - [12, 19.85]
  - - [5056, 704, 1, 3328]
    - [7, 18.378]
  - - [1408, 1856, 1, 256]
    - [7, 9.747]
  - - [5888, 1856, 1, 256]
    - [4, 17.136]
  - - [4288, 64, 1, 3328]
    - [14, 5.697]
  - - [704, 5888, 1, 256]
    - [10, 12.88]
  - - [6784, 128, 1, 1280]
    - [8, 11.054]
  - - [4288, 6784, 1, 3328]
    - [9, 23.104]
  - - [3584, 704, 1, 3328]
    - [15, 16.657]
  - - [1408, 1408, 1, 256]
    - [23, 7.842]
  - - [1856, 128, 1, 256]
    - [24, 1.457]
  - - [2944, 64, 1, 1280]
    - [25, 3.874]
  - - [448, 4288, 1, 256]
    - [4, 7.974]
  - - [64, 3584, 1, 3328]
    - [25, 5.962]
  - - [704, 2368, 1, 1280]
    - [11, 14.529]
  - - [1856, 2368, 1, 1280]
    - [10, 18.416]
  - - [2368, 128, 1, 3328]
    - [20, 6.497]
  - - [2944, 128, 1, 256]
    - [26, 2.013]
  - - [448, 1408, 1, 256]
    - [0, 3.027]
  - - [64, 5056, 1, 3328]
    - [18, 6.45]
  - - [1408, 1024, 1, 1280]
    - [4, 14.649]
  - - [2368, 256, 1, 1280]
    - [19, 7.785]
  - - [6784, 704, 1, 256]
    - [27, 13.535]
  - - [256, 3584, 1, 3328]
    - [19, 13.799]
  - - [1408, 3584, 1, 256]
    - [4, 12.264]
  - - [3584, 4288, 1, 3328]
    - [12, 22.313]
  - - [5888, 1856, 1, 1280]
    - [6, 19.944]
  - - [5056, 1024, 1, 3328]
    - [15, 19.159]
  - - [5056, 64, 1, 1280]
    - [28, 4.849]
  - - [1024, 704, 1, 256]
    - [23, 2.342]
  - - [128, 448, 1, 256]
    - [20, 0.334]
  - - [2368, 3584, 1, 1280]
    - [5, 19.579]
  - - [1024, 256, 1, 256]
    - [14, 1.526]
  - - [448, 448, 1, 256]
    - [29, 1.182]
  - - [2944, 3584, 1, 3328]
    - [5, 21.803]
  - - [256, 256, 1, 3328]
    - [14, 1.624]
  - - [128, 1024, 1, 3328]
    - [3, 2.925]
  - - [6784, 2944, 1, 256]
    - [2, 16.214]
  - - [64, 1856, 1, 1280]
    - [14, 2.148]
  - - [1024, 2368, 1, 256]
    - [4, 8.907]
  - - [4288, 2368, 1, 3328]
    - [19, 20.916]
  - - [1856, 2368, 1, 256]
    - [30, 12.225]
  - - [3584, 6784, 1, 3328]
    - [5, 22.903]
  - - [6784, 1856, 1, 3328]
    - [2, 21.915]
  - - [1024, 128, 1, 1280]
    - [31, 2.427]
  - - [4288, 128, 1, 1280]
    - [4, 7.277]
  - - [5056, 4288, 1, 1280]
    - [12, 21.673]
  - - [5888, 64, 1, 256]
    - [28, 2.159]
  - - [1408, 5056, 1, 1280]
    - [32, 18.061]
  - - [1856, 256, 1, 1280]
    - [8, 6.551]
  - - [64, 5888, 1, 3328]
    - [19, 5.751]
  - - [6784, 5888, 1, 3328]
    - [2, 23.385]
  - - [448, 256, 1, 3328]
    - [14, 3.143]
  - - [2368, 5056, 1, 1280]
    - [2, 20.659]
  - - [256, 1408, 1, 3328]
    - [14, 6.897]
  - - [6784, 128, 1, 3328]
    - [15, 13.452]
  - - [1024, 5056, 1, 1280]
    - [19, 18.515]
  - - [4288, 1024, 1, 256]
    - [7, 12.126]
  - - [2368, 1408, 1, 256]
    - [27, 10.162]
  - - [704, 704, 1, 3328]
    - [15, 7.492]
  - - [5888, 448, 1, 1280]
    - [4, 15.257]
  - - [3584, 256, 1, 3328]
    - [15, 13.891]
  - - [704, 5888, 1, 3328]
    - [8, 18.24]
  - - [1024, 6784, 1, 1280]
    - [10, 18.608]
  - - [128, 3584, 1, 3328]
    - [19, 7.033]
  - - [6784, 2368, 1, 1280]
    - [12, 20.982]
  - - [128, 704, 1, 1280]
    - [16, 1.59]
  - - [3584, 2944, 1, 1280]
    - [12, 20.841]
  - - [1856, 128, 1, 3328]
    - [14, 5.992]
  - - [128, 2944, 1, 1280]
    - [13, 5.35]
  - - [2368, 1024, 1, 3328]
    - [15, 17.765]
  - - [448, 1856, 1, 1280]
    - [0, 10.568]
  - - [1408, 5056, 1, 3328]
    - [6, 19.892]
  - - [1856, 1856, 1, 3328]
    - [2, 18.508]
  - - [3584, 128, 1, 256]
    - [10, 2.629]
  - - [448, 1408, 1, 3328]
    - [15, 9.929]
  - - [2368, 2368, 1, 256]
    - [10, 13.587]
  - - [4288, 4288, 1, 1280]
    - [12, 21.62]
  - - [64, 448, 1, 1280]
    - [16, 0.508]
  - - [704, 6784, 1, 3328]
    - [5, 19.869]
  - - [5888, 5888, 1, 3328]
    - [9, 23.031]
  - - [5056, 1024, 1, 1280]
    - [4, 18.148]
  - - [448, 5888, 1, 3328]
    - [12, 17.382]
  - - [5056, 5888, 1, 1280]
    - [5, 22.302]
  - - [448, 6784, 1, 256]
    - [8, 9.462]
  - - [256, 3584, 1, 256]
    - [0, 4.723]
  - - [256, 2944, 1, 3328]
    - [15, 11.019]
  - - [256, 448, 1, 256]
    - [33, 0.653]
  - - [3584, 5888, 1, 256]
    - [5, 17.178]
  - - [2944, 3584, 1, 256]
    - [12, 16.702]
  - - [1408, 704, 1, 256]
    - [19, 4.602]
  - - [6784, 2944, 1, 3328]
    - [5, 22.319]
  - - [2944, 5056, 1, 3328]
    - [34, 21.62]
  - - [64, 64, 1, 3328]
    - [35, 0.105]
  - - [2048, 7133, 1, 2048]
    - [9, 21.95]
  - - [4288, 5888, 1, 1280]
    - [12, 22.152]
  - - [4288, 4288, 1, 256]
    - [5, 17.985]
  - - [448, 2944, 1, 3328]
    - [19, 13.991]
  - - [4288, 1856, 1, 1280]
    - [8, 18.151]
  - - [1856, 2944, 1, 3328]
    - [6, 19.505]
  - - [256, 6784, 1, 3328]
    - [4, 15.886]
  - - [64, 5888, 1, 256]
    - [13, 2.097]
  - - [5056, 1024, 1, 256]
    - [8, 14.283]
  - - [256, 1024, 1, 256]
    - [13, 1.896]
  - - [5056, 1856, 1, 3328]
    - [2, 21.465]
  - - [1856, 1408, 1, 256]
    - [4, 8.766]
  - - [448, 448, 1, 3328]
    - [14, 4.825]
  - - [448, 2368, 1, 1280]
    - [15, 11.045]
  - - [1408, 128, 1, 1280]
    - [18, 3.458]
  - - [5056, 256, 1, 3328]
    - [19, 15.304]
  - - [256, 64, 1, 1280]
    - [20, 0.293]
  - - [128, 1856, 1, 1280]
    - [14, 3.907]
  - - [5056, 3584, 1, 256]
    - [4, 17.501]
  - - [1856, 1024, 1, 1280]
    - [10, 14.896]
  - - [1856, 1856, 1, 1280]
    - [2, 16.445]
  - - [6784, 6784, 1, 1280]
    - [12, 23.249]
  - - [128, 4288, 1, 3328]
    - [23, 8.132]
  - - [1856, 1024, 1, 3328]
    - [11, 17.321]
  - - [256, 2368, 1, 256]
    - [4, 3.088]
  - - [1024, 448, 1, 3328]
    - [36, 6.987]
  - - [1856, 704, 1, 1280]
    - [10, 13.267]
  - - [6784, 1024, 1, 256]
    - [10, 15.198]
  - - [5056, 5888, 1, 3328]
    - [5, 22.885]
  - - [1856, 1024, 1, 256]
    - [10, 8.577]
  - - [5056, 1408, 1, 3328]
    - [10, 20.053]
  - - [1024, 1024, 1, 1280]
    - [11, 11.487]
  - - [4288, 1024, 1, 3328]
    - [4, 19.972]
  - - [2944, 1408, 1, 3328]
    - [4, 18.378]
  - - [2944, 4288, 1, 3328]
    - [2, 21.777]
  - - [256, 2944, 1, 256]
    - [21, 3.608]
  - - [5056, 2944, 1, 256]
    - [32, 17.063]
  - - [2368, 1856, 1, 256]
    - [4, 12.366]
  - - [128, 448, 1, 1280]
    - [18, 1.023]
  - - [128, 6784, 1, 1280]
    - [0, 10.836]
  - - [1408, 3584, 1, 3328]
    - [15, 18.727]
  - - [2368, 6784, 1, 256]
    - [9, 17.67]
  - - [5056, 1408, 1, 1280]
    - [19, 18.286]
  - - [1408, 5888, 1, 3328]
    - [4, 20.939]
  - - [1856, 5056, 1, 256]
    - [9, 16.77]
  - - [6784, 6784, 1, 256]
    - [37, 19.883]
  - - [1408, 704, 1, 3328]
    - [11, 12.258]
  - - [128, 5888, 1, 1280]
    - [0, 9.588]
  - - [2368, 4288, 1, 1280]
    - [19, 20.106]
  - - [3584, 1856, 1, 1280]
    - [5, 18.381]
  - - [704, 1408, 1, 3328]
    - [0, 12.152]
  - - [704, 64, 1, 1280]
    - [16, 0.965]
  - - [5888, 5056, 1, 256]
    - [32, 18.677]
  - - [3584, 448, 1, 256]
    - [11, 6.617]
  - - [3072, 7435, 1, 1024]
    - [32, 21.43]
  - - [256, 6784, 1, 256]
    - [4, 7.149]
  - - [1856, 3584, 1, 3328]
    - [2, 20.772]
  - - [5056, 256, 1, 1280]
    - [4, 12.79]
  - - [512, 32, 1, 512]
    - [33, 0.119]
  - - [3584, 3584, 1, 256]
    - [38, 15.411]
  - - [6784, 4288, 1, 1280]
    - [39, 22.372]
  - - [704, 5056, 1, 256]
    - [2, 10.276]
  - - [6784, 128, 1, 256]
    - [30, 4.54]
  - - [64, 1408, 1, 3328]
    - [16, 2.542]
  - - [704, 448, 1, 256]
    - [26, 2.158]
  - - [2944, 2368, 1, 1280]
    - [40, 17.747]
  - - [448, 64, 1, 3328]
    - [16, 0.749]
  - - [6784, 3584, 1, 256]
    - [2, 19.209]
  - - [256, 1856, 1, 3328]
    - [18, 7.03]
  - - [704, 6784, 1, 256]
    - [12, 11.318]
  - - [1024, 3584, 1, 3328]
    - [5, 19.336]
  - - [64, 128, 1, 3328]
    - [14, 0.23]
  - - [2944, 2944, 1, 3328]
    - [5, 21.636]
  - - [5056, 6784, 1, 256]
    - [10, 19.451]
  - - [1408, 4288, 1, 3328]
    - [8, 18.959]
  - - [6784, 256, 1, 1280]
    - [4, 14.914]
  - - [2368, 704, 1, 3328]
    - [10, 15.582]
  - - [128, 4288, 1, 256]
    - [0, 3.268]
  - - [3584, 6784, 1, 256]
    - [12, 18.45]
  - - [128, 128, 1, 3328]
    - [20, 0.419]
  - - [5056, 1856, 1, 256]
    - [32, 15.961]
  - - [256, 128, 1, 256]
    - [16, 0.195]
  - - [704, 4288, 1, 256]
    - [4, 10.929]
  - - [256, 448, 1, 3328]
    - [25, 3.057]
  - - [1408, 6784, 1, 1280]
    - [4, 19.999]
  - - [3584, 3584, 1, 1280]
    - [4, 20.159]
  - - [64, 2368, 1, 1280]
    - [18, 2.742]
  - - [64, 6784, 1, 3328]
    - [8, 6.812]
  - - [2944, 256, 1, 1280]
    - [15, 9.659]
  - - [5056, 2368, 1, 3328]
    - [12, 21.019]
  - - [2944, 4288, 1, 256]
    - [11, 15.277]
  - - [1408, 3584, 1, 1280]
    - [8, 18.024]
  - - [2368, 64, 1, 256]
    - [20, 1.052]
  - - [64, 448, 1, 3328]
    - [31, 0.731]
  - - [1024, 1408, 1, 1280]
    - [19, 14.9]
  - - [1856, 704, 1, 256]
    - [4, 5.873]
  - - [1408, 448, 1, 3328]
    - [15, 9.505]
  - - [2368, 256, 1, 256]
    - [0, 3.181]
  - - [2368, 6784, 1, 3328]
    - [5, 21.888]
  - - [5056, 704, 1, 1280]
    - [12, 16.748]
  - - [1856, 4288, 1, 3328]
    - [8, 19.915]
  - - [1408, 5888, 1, 256]
    - [4, 15.201]
  - - [4288, 64, 1, 1280]
    - [20, 4.013]
  - - [4096, 7133, 1, 4096]
    - [9, 23.204]
  - - [256, 64, 1, 256]
    - [41, 0.089]
  - - [704, 1856, 1, 256]
    - [8, 5.471]
  - - [5888, 64, 1, 1280]
    - [42, 5.258]
  - - [3584, 704, 1, 1280]
    - [7, 14.435]
  - - [256, 128, 1, 1280]
    - [16, 0.725]
  - - [256, 2368, 1, 1280]
    - [19, 7.494]
  - - [3584, 448, 1, 3328]
    - [4, 14.887]
  - - [704, 2368, 1, 3328]
    - [21, 15.326]
  - - [2944, 448, 1, 256]
    - [43, 5.207]
  - - [448, 5056, 1, 3328]
    - [10, 17.133]
  - - [2368, 128, 1, 1280]
    - [20, 5.072]
  - - [4288, 448, 1, 256]
    - [10, 9.137]
  - - [448, 5888, 1, 256]
    - [11, 8.687]
  - - [64, 5056, 1, 1280]
    - [14, 4.619]
  - - [5888, 2368, 1, 256]
    - [4, 17.031]
  - - [704, 448, 1, 3328]
    - [13, 6.42]
  - - [6784, 704, 1, 3328]
    - [8, 19.61]
  - - [128, 64, 1, 1280]
    - [18, 0.149]
  - - [1408, 2944, 1, 3328]
    - [15, 18.591]
  - - [64, 1024, 1, 256]
    - [31, 0.471]
  - - [5056, 64, 1, 3328]
    - [14, 6.663]
  - - [2368, 448, 1, 1280]
    - [0, 11.562]
  - - [128, 3584, 1, 256]
    - [21, 2.89]
  - - [1856, 448, 1, 3328]
    - [15, 12.942]
  - - [128, 5056, 1, 256]
    - [10, 3.347]
  - - [2368, 704, 1, 256]
    - [23, 8.374]
  - - [3584, 2368, 1, 256]
    - [27, 15.469]
  - - [5888, 5056, 1, 1280]
    - [12, 22.295]
  - - [128, 1024, 1, 1280]
    - [33, 2.227]
  - - [64, 704, 1, 256]
    - [44, 0.267]
  - - [4288, 256, 1, 1280]
    - [0, 11.909]
  - - [3584, 3584, 1, 3328]
    - [40, 21.294]
  - - [704, 704, 1, 256]
    - [15, 2.978]
  - - [5888, 6784, 1, 256]
    - [12, 20.522]
  - - [4288, 2944, 1, 3328]
    - [5, 22.308]
  - - [1856, 64, 1, 256]
    - [26, 0.785]
  - - [4288, 128, 1, 3328]
    - [15, 8.379]
  - - [4288, 704, 1, 1280]
    - [38, 14.87]
  - - [256, 5056, 1, 1280]
    - [4, 12.904]
  - - [6784, 5888, 1, 1280]
    - [9, 22.905]
  - - [704, 128, 1, 256]
    - [3, 0.506]
  - - [5888, 4288, 1, 1280]
    - [2, 22.132]
  - - [448, 256, 1, 1280]
    - [25, 2.136]
  - - [704, 64, 1, 3328]
    - [31, 1.165]
  - - [256, 1408, 1, 1280]
    - [18, 5.387]
  - - [512, 16, 1, 512]
    - [45, 0.086]
  - - [1408, 1856, 1, 1280]
    - [4, 15.273]
  - - [5888, 448, 1, 3328]
    - [19, 17.333]
  - - [704, 5888, 1, 1280]
    - [15, 16.858]
  - - [1024, 6784, 1, 3328]
    - [10, 19.533]
  - - [704, 2944, 1, 1280]
    - [12, 12.205]
  - - [6784, 64, 1, 3328]
    - [4, 6.812]
  - - [5056, 2944, 1, 3328]
    - [32, 21.62]
  - - [448, 128, 1, 256]
    - [33, 0.391]
  - - [1408, 1408, 1, 3328]
    - [10, 14.476]
  - - [1856, 128, 1, 1280]
    - [25, 4.397]
  - - [448, 4288, 1, 1280]
    - [15, 15.389]
  - - [64, 3584, 1, 256]
    - [24, 1.378]
  - - [128, 2944, 1, 3328]
    - [4, 5.927]
  - - [3584, 704, 1, 256]
    - [10, 9.846]
  - - [2944, 448, 1, 3328]
    - [10, 14.091]
  - - [3584, 1408, 1, 3328]
    - [15, 18.545]
  - - [2368, 1024, 1, 1280]
    - [30, 14.232]
  - - [1856, 6784, 1, 256]
    - [12, 14.834]
  - - [4288, 448, 1, 3328]
    - [4, 17.056]
  - - [4288, 3584, 1, 1280]
    - [6, 21.616]
  - - [1760, 7133, 1, 1760]
    - [5, 20.524]
  - - [5888, 1024, 1, 3328]
    - [10, 19.612]
  - - [704, 6784, 1, 1280]
    - [38, 17.227]
  - - [1024, 2944, 1, 3328]
    - [4, 17.144]
  - - [2368, 448, 1, 3328]
    - [11, 13.044]
  - - [704, 5056, 1, 1280]
    - [2, 17.22]
  - - [1024, 5888, 1, 1280]
    - [15, 17.945]
  - - [2944, 1856, 1, 256]
    - [8, 14.126]
  - - [5056, 64, 1, 256]
    - [33, 2.265]
  - - [3584, 5056, 1, 256]
    - [4, 17.111]
  - - [5888, 5056, 1, 3328]
    - [12, 22.981]
  - - [128, 5056, 1, 3328]
    - [15, 10.095]
  - - [3584, 6784, 1, 1280]
    - [5, 22.034]
  - - [1856, 5888, 1, 256]
    - [10, 16.884]
  - - [256, 256, 1, 256]
    - [31, 0.471]
  - - [4288, 4288, 1, 3328]
    - [5, 22.692]
  - - [4288, 1408, 1, 1280]
    - [10, 17.765]
  - - [64, 1856, 1, 256]
    - [13, 0.773]
  - - [4288, 2368, 1, 256]
    - [8, 16.661]
  - - [2944, 5056, 1, 1280]
    - [2, 21.194]
  - - [6784, 64, 1, 256]
    - [8, 2.383]
  - - [6784, 2368, 1, 3328]
    - [5, 21.855]
  - - [256, 1024, 1, 1280]
    - [26, 3.906]
  - - [4288, 1856, 1, 3328]
    - [10, 19.802]
  - - [1856, 2944, 1, 1280]
    - [4, 17.233]
  - - [3584, 64, 1, 1280]
    - [35, 4.194]
  - - [2944, 5888, 1, 1280]
    - [5, 21.975]
  - - [3584, 1024, 1, 1280]
    - [7, 17.827]
  - - [1024, 4288, 1, 256]
    - [30, 12.026]
  - - [5888, 3584, 1, 3328]
    - [32, 22.605]
  - - [5056, 3584, 1, 3328]
    - [5, 22.369]
  - - [1408, 128, 1, 3328]
    - [14, 4.568]
  - - [2368, 1408, 1, 1280]
    - [30, 16.357]
  - - [5056, 2944, 1, 1280]
    - [9, 21.081]
  - - [128, 2368, 1, 256]
    - [24, 2.228]
  - - [3584, 256, 1, 256]
    - [7, 3.051]
  - - [1024, 6784, 1, 256]
    - [4, 14.813]
  - - [3584, 2944, 1, 256]
    - [12, 16.638]
  - - [448, 128, 1, 3328]
    - [35, 1.472]
  - - [3584, 1408, 1, 1280]
    - [10, 18.002]
  - - [64, 4288, 1, 3328]
    - [35, 5.468]
  - - [5056, 6784, 1, 3328]
    - [12, 23.459]
  - - [128, 2944, 1, 256]
    - [0, 2.037]
  - - [3584, 4288, 1, 256]
    - [2, 18.247]
  - - [1856, 6784, 1, 3328]
    - [12, 21.97]
  - - [3584, 128, 1, 3328]
    - [1, 7.683]
  - - [128, 256, 1, 1280]
    - [16, 0.528]
  - - [1024, 448, 1, 1280]
    - [36, 6.507]
  - - [5056, 1408, 1, 256]
    - [8, 15.117]
  - - [64, 256, 1, 1280]
    - [33, 0.295]
  - - [256, 704, 1, 256]
    - [18, 1.252]
  - - [5888, 5888, 1, 256]
    - [12, 19.94]
  - - [4288, 1024, 1, 1280]
    - [19, 18.382]
  - - [5888, 128, 1, 3328]
    - [15, 11.396]
  - - [448, 6784, 1, 3328]
    - [10, 16.79]
  - - [2944, 1408, 1, 1280]
    - [19, 16.441]
  - - [1024, 32, 1, 512]
    - [16, 0.449]
  - - [2944, 1856, 1, 3328]
    - [5, 19.8]
  - - [128, 1024, 1, 256]
    - [17, 1.05]
  - - [3584, 5888, 1, 1280]
    - [2, 22.035]
  - - [6784, 1856, 1, 1280]
    - [2, 21.375]
  - - [5888, 256, 1, 3328]
    - [8, 13.827]
  - - [1856, 5888, 1, 3328]
    - [39, 20.665]
  - - [3584, 1408, 1, 256]
    - [8, 12.519]
  - - [64, 448, 1, 256]
    - [16, 0.177]
  - - [704, 3584, 1, 3328]
    - [15, 16.587]
  - - [5056, 448, 1, 1280]
    - [19, 13.6]
  - - [4288, 704, 1, 256]
    - [30, 9.512]
  - - [1408, 704, 1, 1280]
    - [10, 9.974]
  - - [2944, 1024, 1, 256]
    - [8, 9.015]
  - - [448, 1408, 1, 1280]
    - [8, 7.149]
  - - [2368, 4288, 1, 3328]
    - [2, 20.971]
  - - [64, 64, 1, 256]
    - [44, 0.021]
  - - [704, 1408, 1, 1280]
    - [15, 10.556]
  - - [6784, 5056, 1, 256]
    - [43, 19.441]
  - - [3584, 5056, 1, 3328]
    - [2, 22.422]
  - - [4288, 5888, 1, 256]
    - [39, 17.807]
  - - [448, 2944, 1, 256]
    - [4, 5.891]
  - - [2944, 6784, 1, 256]
    - [8, 16.641]
  - - [2368, 2368, 1, 1280]
    - [4, 18.123]
  - - [1856, 3584, 1, 1280]
    - [12, 19.449]
  - - [64, 2944, 1, 256]
    - [1, 0.625]
  - - [5056, 3584, 1, 1280]
    - [2, 21.5]
  - - [256, 5888, 1, 256]
    - [15, 7.11]
  - - [128, 256, 1, 3328]
    - [16, 0.846]
  - - [1856, 1408, 1, 3328]
    - [19, 17.395]
  - - [1024, 4288, 1, 3328]
    - [4, 19.798]
  - - [448, 2368, 1, 256]
    - [11, 5.416]
  - - [64, 1408, 1, 1280]
    - [3, 1.612]
  - - [2944, 2368, 1, 3328]
    - [2, 19.811]
  - - [704, 128, 1, 3328]
    - [16, 2.446]
  - - [1408, 128, 1, 256]
    - [14, 1.533]
  - - [1024, 1856, 1, 1280]
    - [8, 15.769]
  - - [6784, 1856, 1, 256]
    - [8, 15.357]
  - - [1024, 5888, 1, 256]
    - [8, 14.652]
  - - [64, 2944, 1, 1280]
    - [26, 3.507]
  - - [64, 5056, 1, 256]
    - [46, 1.884]
  - - [1408, 2368, 1, 256]
    - [7, 9.836]
  - - [2944, 704, 1, 3328]
    - [8, 15.201]
  - - [64, 128, 1, 1280]
    - [26, 0.135]
  - - [2944, 2944, 1, 1280]
    - [2, 20.044]
  - - [6784, 256, 1, 3328]
    - [19, 16.3]
  - - [1408, 5056, 1, 256]
    - [8, 15.586]
  - - [5056, 128, 1, 3328]
    - [4, 9.84]
  - - [128, 128, 1, 1280]
    - [33, 0.305]
  - - [448, 704, 1, 256]
    - [24, 1.824]
  - - [1856, 256, 1, 3328]
    - [19, 7.133]
  - - [2944, 128, 1, 3328]
    - [4, 5.967]
  - - [704, 256, 1, 1280]
    - [3, 3.042]
  - - [256, 448, 1, 1280]
    - [35, 2.265]
  - - [5056, 256, 1, 256]
    - [22, 6.091]
  - - [64, 2368, 1, 3328]
    - [35, 3.716]
  - - [256, 704, 1, 3328]
    - [16, 4.215]
  - - [64, 6784, 1, 1280]
    - [42, 5.794]
  - - [1408, 4288, 1, 256]
    - [4, 13.254]
  - - [5888, 2368, 1, 1280]
    - [7, 20.782]
  - - [128, 256, 1, 256]
    - [16, 0.254]
  - - [64, 128, 1, 256]
    - [41, 0.047]
  - - [2368, 5888, 1, 1280]
    - [7, 20.916]
  - - [5888, 256, 1, 1280]
    - [11, 12.587]
  - - [704, 1024, 1, 1280]
    - [0, 9.249]
  - - [2368, 1856, 1, 3328]
    - [8, 19.595]
  - - [2944, 704, 1, 256]
    - [23, 9.116]
  - - [2368, 6784, 1, 1280]
    - [9, 21.377]
  - - [1856, 4288, 1, 1280]
    - [5, 19.336]
  - - [704, 3584, 1, 256]
    - [7, 9.695]
  - - [704, 2944, 1, 3328]
    - [19, 14.738]
  - - [1856, 5056, 1, 3328]
    - [32, 21.25]
  - - [3584, 5056, 1, 1280]
    - [7, 21.364]
  - - [2944, 1024, 1, 3328]
    - [8, 16.309]
  - - [256, 4288, 1, 256]
    - [4, 6.319]
  - - [1408, 6784, 1, 256]
    - [12, 16.202]
  - - [6784, 1408, 1, 3328]
    - [32, 21.62]
  - - [1024, 2368, 1, 1280]
    - [2, 14.223]
  - - [704, 64, 1, 256]
    - [31, 0.258]
  - - [256, 2368, 1, 3328]
    - [23, 9.02]
  - - [6784, 2944, 1, 1280]
    - [12, 21.51]
  - - [3584, 448, 1, 1280]
    - [11, 12.966]
  - - [2944, 6784, 1, 3328]
    - [12, 22.302]
  - - [448, 5056, 1, 1280]
    - [2, 13.243]
  - - [64, 2944, 1, 3328]
    - [14, 4.633]
  - - [128, 1408, 1, 256]
    - [35, 0.935]
  - - [1408, 256, 1, 1280]
    - [18, 5.419]
  - - [5888, 704, 1, 256]
    - [4, 12.01]
  - - [256, 5888, 1, 3328]
    - [4, 13.809]
  - - [6784, 4288, 1, 256]
    - [37, 18.125]
  - - [5888, 256, 1, 256]
    - [29, 4.62]
  - - [128, 1408, 1, 3328]
    - [3, 4.515]
  - - [6784, 1024, 1, 1280]
    - [5, 17.671]
  - - [704, 448, 1, 1280]
    - [14, 4.477]
  - - [128, 64, 1, 3328]
    - [31, 0.179]
  - - [448, 64, 1, 256]
    - [31, 0.173]
  - - [2944, 704, 1, 1280]
    - [4, 12.17]
  - - [6784, 3584, 1, 1280]
    - [9, 22.178]
  - - [1024, 704, 1, 1280]
    - [19, 8.823]
  - - [1408, 2944, 1, 1280]
    - [37, 17.24]
  - - [256, 1856, 1, 256]
    - [1, 3.328]
  - - [1408, 2368, 1, 3328]
    - [15, 17.971]
  - - [1024, 3584, 1, 256]
    - [2, 11.272]
  - - [2368, 2944, 1, 256]
    - [4, 14.386]
  - - [704, 1856, 1, 1280]
    - [0, 12.205]
  - - [1408, 256, 1, 3328]
    - [14, 7.643]
  - - [1024, 16, 1, 512]
    - [17, 0.19]
  - - [5888, 128, 1, 256]
    - [0, 4.687]
  - - [2944, 5888, 1, 256]
    - [32, 17.134]
  - - [3584, 1856, 1, 256]
    - [4, 13.667]
  - - [2368, 448, 1, 256]
    - [15, 6.136]
  - - [4288, 256, 1, 3328]
    - [21, 13.947]
  - - [1408, 64, 1, 256]
    - [42, 0.638]
  - - [704, 4288, 1, 3328]
    - [19, 17.281]
  - - [4288, 2944, 1, 1280]
    - [9, 21.258]
  - - [1024, 64, 1, 256]
    - [35, 0.389]
  - - [64, 2368, 1, 256]
    - [26, 0.903]
  - - [4288, 5056, 1, 3328]
    - [40, 22.361]
  - - [2944, 256, 1, 256]
    - [15, 4.421]
  - - [1024, 128, 1, 3328]
    - [14, 3.332]
  - - [256, 5056, 1, 3328]
    - [19, 13.777]
  - - [5056, 2368, 1, 256]
    - [9, 14.344]
  - - [4288, 704, 1, 3328]
    - [10, 16.566]
  - - [448, 3584, 1, 256]
    - [22, 6.018]
  - - [2368, 64, 1, 1280]
    - [14, 2.754]
  - - [1408, 448, 1, 256]
    - [21, 3.522]
  - - [1024, 1408, 1, 3328]
    - [15, 15.495]
  - - [2560, 7133, 1, 2560]
    - [12, 22.358]
  - - [5888, 3584, 1, 256]
    - [43, 17.132]
  - - [1408, 1856, 1, 3328]
    - [15, 17.469]
  - - [6784, 1408, 1, 1280]
    - [6, 20.544]
  - - [704, 2944, 1, 256]
    - [11, 8.806]
  - - [4288, 64, 1, 256]
    - [18, 2.042]
  - - [2944, 5888, 1, 3328]
    - [32, 22.61]
  - - [64, 4288, 1, 1280]
    - [35, 4.201]
  - - [6784, 64, 1, 1280]
    - [42, 6.085]
  - - [1408, 6784, 1, 3328]
    - [5, 21.723]
  - - [1408, 64, 1, 3328]
    - [3, 2.296]
  - - [1408, 1408, 1, 1280]
    - [8, 12.096]
  - - [448, 1024, 1, 3328]
    - [36, 7.248]
  - - [448, 4288, 1, 3328]
    - [19, 17.482]
  - - [704, 2368, 1, 256]
    - [21, 6.715]
  - - [2944, 448, 1, 1280]
    - [15, 12.625]
  - - [5888, 2368, 1, 3328]
    - [12, 21.667]
  - - [4288, 5056, 1, 256]
    - [2, 18.16]
  - - [4288, 448, 1, 1280]
    - [10, 15.371]
  - - [5888, 704, 1, 3328]
    - [15, 18.663]
  - - [4288, 3584, 1, 3328]
    - [6, 22.346]
  - - [5056, 128, 1, 256]
    - [11, 3.993]
  - - [128, 64, 1, 256]
    - [35, 0.034]
  - - [448, 1024, 1, 256]
    - [8, 3.419]
  - - [6784, 6784, 1, 3328]
    - [12, 23.652]
  - - [704, 5056, 1, 3328]
    - [5, 19.249]
  - - [1024, 64, 1, 1280]
    - [16, 1.301]
  - - [64, 1024, 1, 3328]
    - [16, 1.792]
  - - [2368, 2944, 1, 3328]
    - [39, 19.61]
  - - [448, 448, 1, 1280]
    - [14, 3.375]
  - - [2368, 3584, 1, 256]
    - [12, 16.623]
  - - [1024, 256, 1, 1280]
    - [35, 4.488]
  - - [128, 5056, 1, 1280]
    - [22, 7.567]
  - - [3584, 2368, 1, 1280]
    - [12, 20.517]
  - - [1856, 1856, 1, 256]
    - [7, 12.009]
  - - [4288, 1408, 1, 3328]
    - [15, 19.337]
  - - [3584, 64, 1, 3328]
    - [25, 5.34]
  - - [4288, 5056, 1, 1280]
    - [12, 21.355]
  - - [5888, 6784, 1, 1280]
    - [12, 22.797]
  - - [256, 1024, 1, 3328]
    - [14, 5.407]
  - - [1856, 64, 1, 3328]
    - [45, 2.863]
  - - [5888, 1408, 1, 3328]
    - [2, 20.698]
  - - [256, 5056, 1, 256]
    - [15, 6.786]
  - - [1408, 1024, 1, 256]
    - [27, 6.559]
  - - [448, 256, 1, 256]
    - [18, 0.716]
  - - [1408, 256, 1, 256]
    - [28, 1.878]
  - - [2368, 5056, 1, 256]
    - [12, 14.216]
  - - [128, 5888, 1, 3328]
    - [19, 11.185]
  - - [1024, 5056, 1, 256]
    - [8, 12.377]
  - - [2368, 1408, 1, 3328]
    - [8, 18.269]
  - - [5888, 448, 1, 256]
    - [2, 10.109]
  - - [6784, 5056, 1, 1280]
    - [2, 22.467]
  - - [4288, 6784, 1, 1280]
    - [9, 22.536]
  - - [128, 704, 1, 256]
    - [35, 0.534]
  - - [1024, 128, 1, 256]
    - [25, 0.903]
  - - [448, 128, 1, 1280]
    - [3, 0.818]
  - - [1024, 64, 1, 3328]
    - [16, 1.673]
  - - [64, 3584, 1, 1280]
    - [14, 3.789]
  - - [6784, 1408, 1, 256]
    - [32, 17.286]
  - - [5888, 4288, 1, 256]
    - [43, 18.127]
  - - [5056, 5888, 1, 256]
    - [7, 18.536]
  - - [2368, 1024, 1, 256]
    - [8, 10.549]
  - - [1856, 6784, 1, 1280]
    - [9, 21.433]
  - - [3584, 128, 1, 1280]
    - [8, 6.891]
  - - [4288, 128, 1, 256]
    - [15, 3.369]
  - - [4288, 3584, 1, 256]
    - [2, 18.052]
  - - [64, 256, 1, 3328]
    - [44, 0.391]
  - - [5056, 1856, 1, 1280]
    - [12, 20.095]
  - - [1408, 1024, 1, 3328]
    - [19, 15.29]
  - - [2368, 256, 1, 3328]
    - [0, 8.976]
  - - [5888, 3584, 1, 1280]
    - [34, 21.885]
  - - [5888, 128, 1, 1280]
    - [0, 8.985]
  - - [1024, 2944, 1, 256]
    - [32, 8.749]
  - - [448, 6784, 1, 1280]
    - [2, 14.563]
  - - [256, 3584, 1, 1280]
    - [19, 12.273]
  - - [3584, 1024, 1, 3328]
    - [12, 18.66]
  - - [2944, 1856, 1, 1280]
    - [6, 17.339]
  - - [128, 5888, 1, 256]
    - [19, 4.925]
  - - [2368, 3584, 1, 3328]
    - [2, 21.337]
  - - [3584, 5888, 1, 3328]
    - [32, 22.683]
  - - [2944, 3584, 1, 1280]
    - [9, 20.937]
  - - [1856, 5888, 1, 1280]
    - [5, 20.544]
  - - [256, 256, 1, 1280]
    - [33, 1.22]
  - - [5056, 448, 1, 3328]
    - [4, 16.642]
  - - [4288, 1408, 1, 256]
    - [27, 14.094]
  - - [3584, 64, 1, 256]
    - [33, 1.613]
  - - [64, 1856, 1, 3328]
    - [14, 3.06]
  - - [1024, 1024, 1, 256]
    - [21, 5.675]
  - - [4288, 2368, 1, 1280]
    - [5, 20.326]
  - - [2944, 5056, 1, 256]
    - [7, 17.331]
  - - [256, 128, 1, 3328]
    - [16, 0.824]
  - - [6784, 2368, 1, 256]
    - [10, 15.776]
  - - [1024, 1024, 1, 1024]
    - [22, 10.138]
  - - [2944, 64, 1, 3328]
    - [14, 4.632]
  - - [4288, 1856, 1, 256]
    - [4, 15.914]
  - - [1856, 2944, 1, 256]
    - [12, 14.34]
  - - [64, 5888, 1, 1280]
    - [13, 5.5]
  - - [1856, 1408, 1, 1280]
    - [2, 14.801]
  - - [704, 1024, 1, 256]
    - [23, 4.257]
  - - [1024, 4288, 1, 1280]
    - [37, 18.224]
  - - [2368, 5056, 1, 3328]
    - [5, 21.236]
  - - [1024, 1856, 1, 3328]
    - [10, 17.489]
  - - [704, 704, 1, 1280]
    - [0, 6.797]
  - - [128, 2368, 1, 1280]
    - [26, 4.408]
  - - [3584, 256, 1, 1280]
    - [19, 10.931]
  - - [704, 3584, 1, 1280]
    - [15, 15.205]
  - - [128, 704, 1, 3328]
    - [16, 2.36]
  - - [4288, 6784, 1, 256]
    - [19, 17.992]
  - - [3584, 2944, 1, 3328]
    - [2, 21.992]
  - - [128, 1856, 1, 256]
    - [14, 1.34]
  - - [64, 4288, 1, 256]
    - [36, 1.792]
  - - [5888, 2944, 1, 256]
    - [2, 16.175]
  - - [5056, 128, 1, 1280]
    - [19, 7.907]
  - - [448, 1856, 1, 3328]
    - [0, 12.87]
  - - [5056, 4288, 1, 256]
    - [12, 18.194]
  - - [1024, 448, 1, 256]
    - [0, 2.96]
  - - [2944, 128, 1, 1280]
    - [13, 5.197]
  - - [6784, 1024, 1, 3328]
    - [7, 19.662]
  - - [64, 256, 1, 256]
    - [41, 0.089]
  - - [704, 256, 1, 3328]
    - [3, 4.4]
  - - [256, 704, 1, 1280]
    - [20, 3.07]
  - - [5888, 5888, 1, 1280]
    - [32, 22.562]
  - - [448, 5888, 1, 1280]
    - [4, 15.288]
  - - [2944, 1408, 1, 256]
    - [4, 12.581]
  - - [256, 2944, 1, 1280]
    - [21, 8.931]
  - - [1024, 2944, 1, 1280]
    - [27, 14.171]
  - - [2368, 5888, 1, 3328]
    - [5, 21.513]
  - - [704, 1024, 1, 3328]
    - [19, 10.845]
  - - [2368, 1856, 1, 1280]
    - [8, 17.928]
  - - [1856, 448, 1, 1280]
    - [15, 10.325]
  - - [128, 6784, 1, 256]
    - [23, 4.356]
  - - [5888, 4288, 1, 3328]
    - [2, 23.005]
  - - [6784, 704, 1, 1280]
    - [2, 16.743]
  - - [5056, 448, 1, 256]
    - [8, 8.353]
  - - [1856, 5056, 1, 1280]
    - [12, 20.194]
  - - [2944, 1024, 1, 1280]
    - [19, 15.26]
  - - [2368, 4288, 1, 256]
    - [8, 16.32]
  - - [1024, 2368, 1, 3328]
    - [15, 17.524]
  - - [64, 704, 1, 3328]
    - [16, 1.151]
  - - [704, 1408, 1, 256]
    - [0, 4.77]
  - - [4288, 5888, 1, 3328]
    - [9, 23.028]
  - - [256, 1408, 1, 256]
    - [18, 1.976]
  - - [448, 2944, 1, 1280]
    - [0, 12.555]
  - - [2944, 6784, 1, 1280]
    - [2, 21.608]
  - - [256, 6784, 1, 1280]
    - [4, 14.521]
  - - [1856, 3584, 1, 256]
    - [5, 13.965]
  - - [128, 448, 1, 3328]
    - [3, 1.443]
  - - [1856, 256, 1, 256]
    - [4, 2.501]
  - - [128, 2368, 1, 3328]
    - [20, 5.85]
  - - [256, 5888, 1, 1280]
    - [23, 12.461]
  - - [448, 2368, 1, 3328]
    - [0, 12.929]
  - - [64, 1408, 1, 256]
    - [16, 0.544]
  - - [7680, 5481, 1, 2560]
    - [12, 23.506]
  - - [2944, 2368, 1, 256]
    - [39, 14.629]
  - - [1856, 448, 1, 256]
    - [0, 4.078]
  - - [1024, 1856, 1, 256]
    - [10, 6.83]
  - - [6784, 3584, 1, 3328]
    - [12, 23.083]
  - - [1024, 704, 1, 3328]
    - [0, 10.54]
  - - [1024, 5888, 1, 3328]
    - [4, 19.076]
  - - [1408, 2368, 1, 1280]
    - [10, 17.263]
  - - [128, 1408, 1, 1280]
    - [33, 2.822]
  - - [256, 64, 1, 3328]
    - [33, 0.385]
  - - [128, 1856, 1, 3328]
    - [25, 5.817]
  - - [2944, 2944, 1, 256]
    - [12, 15.77]
  - - [6784, 256, 1, 256]
    - [11, 7.402]
  - - [128, 4288, 1, 1280]
    - [19, 6.483]
  - - [5888, 1408, 1, 256]
    - [8, 15.393]
  - - [128, 128, 1, 256]
    - [17, 0.094]
  - - [448, 704, 1, 3328]
    - [14, 6.366]
  - - [448, 1856, 1, 256]
    - [10, 4.282]
  - - [1856, 704, 1, 3328]
    - [19, 14.038]
  - - [5888, 6784, 1, 3328]
    - [2, 23.381]
  - - [704, 4288, 1, 1280]
    - [38, 14.929]
  - - [704, 256, 1, 256]
    - [46, 1.293]
  - - [6784, 448, 1, 3328]
    - [15, 16.943]
  - - [3136, 256, 64, 64]
    - [9, 14.171]
  - - [784, 512, 64, 128]
    - [12, 15.375]
  - - [784, 128, 64, 512]
    - [15, 15.397]
  - - [3136, 64, 128, 64]
    - [4, 10.528]
  - - [196, 256, 128, 1024]
    - [19, 14.364]
  - - [196, 256, 64, 1024]
    - [15, 12.336]
  - - [196, 1024, 128, 256]
    - [2, 14.422]
  - - [784, 128, 256, 512]
    - [12, 18.77]
  - - [3136, 64, 64, 256]
    - [43, 15.191]
  - - [3136, 64, 256, 256]
    - [2, 19.882]
  - - [3136, 256, 256, 64]
    - [32, 17.959]
  - - [3136, 64, 128, 256]
    - [10, 17.947]
  - - [784, 128, 128, 512]
    - [4, 18.034]
  - - [784, 512, 128, 128]
    - [39, 16.459]
  - - [784, 512, 256, 128]
    - [39, 19.265]
  - - [196, 1024, 64, 256]
    - [38, 13.324]
  - - [3136, 64, 64, 64]
    - [27, 8.781]
  - - [196, 1024, 256, 256]
    - [38, 16.118]
  - - [196, 256, 256, 1024]
    - [2, 16.114]
  - - [3136, 256, 128, 64]
    - [2, 15.954]
  - - [3136, 64, 256, 64]
    - [15, 12.063]
- null
