library/src/blas3/Tensile/Logic/asm_full/arcturus_Cijk_Alik_Bljk_BBH.yaml
- {MinimumRequiredVersion: 4.12.0}
- arcturus
- gfx908
- [Device 7380, Device 7388, Device 738c]
    SolutionIndex: 0
    SolutionNameMin: Cijk_Alik_Bljk_BBH_MT64x128x32_SE_
    SolutionIndex: 1
    SolutionNameMin: Cijk_Alik_Bljk_BBH_MT32x32x32_SE_
- - - [960, 1024, 1, 1024]
    - [0, 6890.99]
  - - [960, 1024, 1, 1024]
    - [0, 11008.7]
  - - [1024, 1024, 1, 1024]
    - [0, 7318.33]
  - - [2040, 2048, 1, 2048]
    - [0, 11103.0]
  - - [2048, 2048, 1, 2048]
    - [0, 13972.0]
  - - [3000, 3072, 1, 3072]
    - [0, 12650.4]
  - - [3072, 3072, 1, 3072]
    - [0, 12397.4]
  - - [4080, 4096, 1, 4096]
    - [0, 16821.5]
  - - [4096, 4096, 1, 4096]
    - [0, 16864.9]
  - - [64, 1024, 1, 1024]
    - [1, 1165.09]
- null
