library/src/blas3/Tensile/Logic/asm_full/arcturus_Cijk_Alik_Bljk_HBH.yaml
- {MinimumRequiredVersion: 4.6.0}
- arcturus
- gfx908
- [Device 7380, Device 7388, Device 738c, Device 7390]
    SolutionIndex: 0
    SolutionNameMin: Cijk_Alik_Bljk_HBH_MT032x016x08_PGR1_PLR1_TT04_02
    SolutionIndex: 1
    SolutionNameMin: Cijk_Alik_Bljk_HBH_MT032x016x08_PGR1_PLR1_TT02_02
    SolutionIndex: 2
    SolutionNameMin: Cijk_Alik_Bljk_HBH_MT032x032x08_PGR1_PLR1_TT02_02
    SolutionIndex: 3
    SolutionNameMin: Cijk_Alik_Bljk_HBH_MT016x016x16_PGR1_PLR1_TT02_02
    SolutionIndex: 4
    SolutionNameMin: Cijk_Alik_Bljk_HBH_MT032x032x16_PGR1_PLR1_TT04_04
    SolutionIndex: 5
    SolutionNameMin: Cijk_Alik_Bljk_HBH_MT032x016x16_PGR1_PLR1_TT02_02
    SolutionIndex: 6
    SolutionNameMin: Cijk_Alik_Bljk_HBH_MT064x032x16_PGR1_PLR1_TT04_04
    SolutionIndex: 7
    SolutionNameMin: Cijk_Alik_Bljk_HBH_MT016x016x32_PGR1_PLR1_TT02_02
    SolutionIndex: 8
    SolutionNameMin: Cijk_Alik_Bljk_HBH_MT032x032x32_PGR1_PLR1_TT04_04
    SolutionIndex: 9
    SolutionNameMin: Cijk_Alik_Bljk_HBH_MT064x016x32_PGR1_PLR1_TT02_02
    SolutionIndex: 10
    SolutionNameMin: Cijk_Alik_Bljk_HBH_MT032x016x08_PGR1_PLR1_TT04_02
    SolutionIndex: 11
    SolutionNameMin: Cijk_Alik_Bljk_HBH_MT016x016x16_PGR1_PLR1_TT02_02
    SolutionIndex: 12
    SolutionNameMin: Cijk_Alik_Bljk_HBH_MT032x032x16_PGR1_PLR1_TT04_04
    SolutionIndex: 13
    SolutionNameMin: Cijk_Alik_Bljk_HBH_MT064x064x16_PGR1_PLR1_TT08_08
    SolutionIndex: 14
    SolutionNameMin: Cijk_Alik_Bljk_HBH_MT064x032x16_PGR1_PLR1_TT04_04
    SolutionIndex: 15
    SolutionNameMin: Cijk_Alik_Bljk_HBH_MT016x016x24_PGR1_PLR1_TT02_02
    SolutionIndex: 16
    SolutionNameMin: Cijk_Alik_Bljk_HBH_MT032x016x24_PGR1_PLR1_TT04_02
    SolutionIndex: 17
    SolutionNameMin: Cijk_Alik_Bljk_HBH_MT032x032x24_PGR1_PLR1_TT04_04
    SolutionIndex: 18
    SolutionNameMin: Cijk_Alik_Bljk_HBH_MT016x016x24_PGR1_PLR1_TT02_02
    SolutionIndex: 19
    SolutionNameMin: Cijk_Alik_Bljk_HBH_MT032x016x24_PGR1_PLR1_TT04_02
    SolutionIndex: 20
    SolutionNameMin: Cijk_Alik_Bljk_HBH_MT032x032x24_PGR1_PLR1_TT04_04
    SolutionIndex: 21
    SolutionNameMin: Cijk_Alik_Bljk_HBH_MT064x064x24_PGR1_PLR1_TT08_08
    SolutionIndex: 22
    SolutionNameMin: Cijk_Alik_Bljk_HBH_MT032x032x32_PGR1_PLR1_TT04_04
    SolutionIndex: 23
    SolutionNameMin: Cijk_Alik_Bljk_HBH_MT064x064x08_PGR1_PLR1_TT04_04
    SolutionIndex: 24
    SolutionNameMin: Cijk_Alik_Bljk_HBH_MT064x128x08_PGR1_PLR1_TT04_08
    SolutionIndex: 25
    SolutionNameMin: Cijk_Alik_Bljk_HBH_MT128x064x08_PGR1_PLR1_TT08_04
    SolutionIndex: 26
    SolutionNameMin: Cijk_Alik_Bljk_HBH_MT064x064x16_PGR1_PLR1_TT04_04
    SolutionIndex: 27
    SolutionNameMin: Cijk_Alik_Bljk_HBH_MT064x128x16_PGR1_PLR1_TT04_08
    SolutionIndex: 28
    SolutionNameMin: Cijk_Alik_Bljk_HBH_MT128x064x16_PGR1_PLR1_TT08_04
    SolutionIndex: 29
    SolutionNameMin: Cijk_Alik_Bljk_HBH_MT128x128x16_PGR1_PLR1_TT08_08
    SolutionIndex: 30
    SolutionNameMin: Cijk_Alik_Bljk_HBH_MT064x064x32_PGR1_PLR1_TT04_04
    SolutionIndex: 31
    SolutionNameMin: Cijk_Alik_Bljk_HBH_MT128x064x32_PGR1_PLR1_TT08_04
    SolutionIndex: 32
    SolutionNameMin: Cijk_Alik_Bljk_HBH_MT128x128x32_PGR1_PLR1_TT08_08
    SolutionIndex: 33
    SolutionNameMin: Cijk_Alik_Bljk_HBH_MT064x128x04_PGR0_PLR0_TT04_08
    SolutionIndex: 34
    SolutionNameMin: Cijk_Alik_Bljk_HBH_MT064x064x04_PGR0_PLR0_TT04_04
    SolutionIndex: 35
    SolutionNameMin: Cijk_Alik_Bljk_HBH_MT064x064x04_PGR1_PLR0_TT04_04
    SolutionIndex: 36
    SolutionNameMin: Cijk_Alik_Bljk_HBH_MT064x064x04_PGR0_PLR1_TT04_04
    SolutionIndex: 37
    SolutionNameMin: Cijk_Alik_Bljk_HBH_MT064x064x08_PGR0_PLR0_TT04_04
    SolutionIndex: 38
    SolutionNameMin: Cijk_Alik_Bljk_HBH_MT064x064x08_PGR1_PLR0_TT04_04
    SolutionIndex: 39
    SolutionNameMin: Cijk_Alik_Bljk_HBH_MT128x128x08_PGR0_PLR1_TT08_08
    SolutionIndex: 40
    SolutionNameMin: Cijk_Alik_Bljk_HBH_MT064x128x08_PGR0_PLR1_TT04_08
    SolutionIndex: 41
    SolutionNameMin: Cijk_Alik_Bljk_HBH_MT064x064x08_PGR0_PLR1_TT04_04
    SolutionIndex: 42
    SolutionNameMin: Cijk_Alik_Bljk_HBH_MT064x064x08_PGR1_PLR1_TT04_04
    SolutionIndex: 43
    SolutionNameMin: Cijk_Alik_Bljk_HBH_MT064x064x16_PGR0_PLR0_TT04_04
    SolutionIndex: 44
    SolutionNameMin: Cijk_Alik_Bljk_HBH_MT064x064x16_PGR1_PLR0_TT04_04
    SolutionIndex: 45
    SolutionNameMin: Cijk_Alik_Bljk_HBH_MT064x064x16_PGR0_PLR1_TT04_04
    SolutionIndex: 46
    SolutionNameMin: Cijk_Alik_Bljk_HBH_MT064x064x16_PGR1_PLR1_TT04_04
    SolutionIndex: 47
    SolutionNameMin: Cijk_Alik_Bljk_HBH_MT064x128x04_PGR0_PLR0_TT04_08
    SolutionIndex: 48
    SolutionNameMin: Cijk_Alik_Bljk_HBH_MT064x064x04_PGR0_PLR0_TT04_04
    SolutionIndex: 49
    SolutionNameMin: Cijk_Alik_Bljk_HBH_MT064x128x04_PGR1_PLR0_TT04_08
    SolutionIndex: 50
    SolutionNameMin: Cijk_Alik_Bljk_HBH_MT064x064x04_PGR1_PLR0_TT04_04
    SolutionIndex: 51
    SolutionNameMin: Cijk_Alik_Bljk_HBH_MT128x128x04_PGR0_PLR1_TT08_08
    SolutionIndex: 52
    SolutionNameMin: Cijk_Alik_Bljk_HBH_MT064x128x04_PGR0_PLR1_TT04_08
    SolutionIndex: 53
    SolutionNameMin: Cijk_Alik_Bljk_HBH_MT064x064x04_PGR0_PLR1_TT04_04
    SolutionIndex: 54
    SolutionNameMin: Cijk_Alik_Bljk_HBH_MT064x128x04_PGR1_PLR1_TT04_08
    SolutionIndex: 55
    SolutionNameMin: Cijk_Alik_Bljk_HBH_MT064x064x04_PGR1_PLR1_TT04_04
    SolutionIndex: 56
    SolutionNameMin: Cijk_Alik_Bljk_HBH_MT128x128x08_PGR0_PLR0_TT08_08
    SolutionIndex: 57
    SolutionNameMin: Cijk_Alik_Bljk_HBH_MT064x128x08_PGR0_PLR0_TT04_08
    SolutionIndex: 58
    SolutionNameMin: Cijk_Alik_Bljk_HBH_MT064x064x08_PGR0_PLR0_TT04_04
    SolutionIndex: 59
    SolutionNameMin: Cijk_Alik_Bljk_HBH_MT064x064x08_PGR1_PLR0_TT04_04
    SolutionIndex: 60
    SolutionNameMin: Cijk_Alik_Bljk_HBH_MT064x128x08_PGR0_PLR1_TT04_08
    SolutionIndex: 61
    SolutionNameMin: Cijk_Alik_Bljk_HBH_MT064x064x08_PGR0_PLR1_TT04_04
    SolutionIndex: 62
    SolutionNameMin: Cijk_Alik_Bljk_HBH_MT064x128x08_PGR1_PLR1_TT04_08
    SolutionIndex: 63
    SolutionNameMin: Cijk_Alik_Bljk_HBH_MT064x064x08_PGR1_PLR1_TT04_04
    SolutionIndex: 64
    SolutionNameMin: Cijk_Alik_Bljk_HBH_MT064x064x16_PGR1_PLR1_TT04_04
    SolutionIndex: 65
    SolutionNameMin: Cijk_Alik_Bljk_HBH_MT064x032x16_EPS1_GRVW04_LPB04_PGR1_PLR1_SNLL1_TT04_04_VW04_WG16_08_01_WGM01
    SolutionIndex: 66
    SolutionNameMin: Cijk_Alik_Bljk_HBH_MT064x064x16_EPS1_GRVW04_LPB04_PGR1_PLR1_SNLL1_TT04_04_VW04_WG16_16_01_WGM01
    SolutionIndex: 67
    SolutionNameMin: Cijk_Alik_Bljk_HBH_MT064x032x16_EPS1_GRVW04_LPB04_PGR1_PLR1_SNLL1_TT04_04_VW04_WG16_08_01_WGM08
    SolutionIndex: 68
    SolutionNameMin: Cijk_Alik_Bljk_HBH_MT064x032x16_EPS1_GRVW04_LPB04_PGR1_PLR1_SNLL1_TT04_04_VW04_WG16_08_01_WGM64
    SolutionIndex: 69
    SolutionNameMin: Cijk_Alik_Bljk_HBH_MT032x128x32_EPS1_GRVW04_LPB04_PGR1_PLR1_SNLL1_TT04_04_VW04_WG08_32_01_WGM01
    SolutionIndex: 70
    SolutionNameMin: Cijk_Alik_Bljk_HBH_MT032x128x32_EPS1_GRVW04_LPB04_PGR1_PLR1_SNLL1_TT04_04_VW04_WG08_32_01_WGM64
    SolutionIndex: 71
    SolutionNameMin: Cijk_Alik_Bljk_HBH_MT032x032x08_PGR0_PLR1_TT04_04
    SolutionIndex: 72
    SolutionNameMin: Cijk_Alik_Bljk_HBH_MT032x032x08_PGR1_PLR1_TT04_04
    SolutionIndex: 73
    SolutionNameMin: Cijk_Alik_Bljk_HBH_MT032x032x16_PGR1_PLR1_TT04_04
    SolutionIndex: 74
    SolutionNameMin: Cijk_Alik_Bljk_HBH_MT064x016x16_PGR1_PLR1_TT04_04
    SolutionIndex: 75
    SolutionNameMin: Cijk_Alik_Bljk_HBH_MT064x064x16_PGR1_PLR1_TT04_04
    SolutionIndex: 76
    SolutionNameMin: Cijk_Alik_Bljk_HBH_MT032x032x32_PGR1_PLR1_TT04_04
    SolutionIndex: 77
    SolutionNameMin: Cijk_Alik_Bljk_HBH_MT064x016x32_PGR1_PLR1_TT04_04
    SolutionIndex: 78
    SolutionNameMin: Cijk_Alik_Bljk_HBH_MT064x064x16_PGR1_PLR1_TT08_08
    SolutionIndex: 79
    SolutionNameMin: Cijk_Alik_Bljk_HBH_MT032x032x16_PGR1_PLR1_TT04_04
    SolutionIndex: 80
    SolutionNameMin: Cijk_Alik_Bljk_HBH_MT064x032x16_PGR1_PLR1_TT04_04
    SolutionIndex: 81
    SolutionNameMin: Cijk_Alik_Bljk_HBH_MT032x032x32_PGR1_PLR1_TT04_04
    SolutionIndex: 82
    SolutionNameMin: Cijk_Alik_Bljk_HBH_MT064x032x32_PGR1_PLR1_TT04_04
    SolutionIndex: 83
    SolutionNameMin: Cijk_Alik_Bljk_HBH_MT064x064x08_PGR1_PLR1_TT08_08
    SolutionIndex: 84
    SolutionNameMin: Cijk_Alik_Bljk_HBH_MT064x064x16_PGR1_PLR1_TT08_08
    SolutionIndex: 85
    SolutionNameMin: Cijk_Alik_Bljk_HBH_MT064x064x32_PGR1_PLR1_TT08_08
    SolutionIndex: 86
    SolutionNameMin: Cijk_Alik_Bljk_HBH_MT128x128x08_PGR1_PLR1_TT08_08
    SolutionIndex: 87
    SolutionNameMin: Cijk_Alik_Bljk_HBH_MT032x064x16_PGR1_PLR1_TT04_08
    SolutionIndex: 88
    SolutionNameMin: Cijk_Alik_Bljk_HBH_MT064x064x16_PGR1_PLR1_TT04_04
    SolutionIndex: 89
    SolutionNameMin: Cijk_Alik_Bljk_HBH_MT064x128x16_PGR1_PLR1_TT04_08
    SolutionIndex: 90
    SolutionNameMin: Cijk_Alik_Bljk_HBH_MT128x064x16_PGR1_PLR1_TT08_04
    SolutionIndex: 91
    SolutionNameMin: Cijk_Alik_Bljk_HBH_MT128x128x32_PGR1_PLR1_TT08_08
    SolutionIndex: 92
    SolutionNameMin: Cijk_Alik_Bljk_HBH_MT128x128x16_PGR1_PLR1_TT08_08
    SolutionIndex: 93
    SolutionNameMin: Cijk_Alik_Bljk_HBH_MT128x128x32_PGR1_PLR1_TT08_08
    SolutionIndex: 94
    SolutionNameMin: Cijk_Alik_Bljk_HBH_MT064x128x04_PGR0_PLR0_TT04_08
    SolutionIndex: 95
    SolutionNameMin: Cijk_Alik_Bljk_HBH_MT064x064x04_PGR0_PLR0_TT04_04
    SolutionIndex: 96
    SolutionNameMin: Cijk_Alik_Bljk_HBH_MT064x064x04_PGR1_PLR0_TT04_04
    SolutionIndex: 97
    SolutionNameMin: Cijk_Alik_Bljk_HBH_MT064x064x04_PGR1_PLR1_TT04_04
    SolutionIndex: 98
    SolutionNameMin: Cijk_Alik_Bljk_HBH_MT128x128x08_PGR0_PLR0_TT08_08
    SolutionIndex: 99
    SolutionNameMin: Cijk_Alik_Bljk_HBH_MT064x064x08_PGR0_PLR0_TT04_04
    SolutionIndex: 100
    SolutionNameMin: Cijk_Alik_Bljk_HBH_MT064x128x08_PGR1_PLR0_TT04_08
    SolutionIndex: 101
    SolutionNameMin: Cijk_Alik_Bljk_HBH_MT064x064x08_PGR1_PLR0_TT04_04
    SolutionIndex: 102
    SolutionNameMin: Cijk_Alik_Bljk_HBH_MT064x064x08_PGR0_PLR1_TT04_04
    SolutionIndex: 103
    SolutionNameMin: Cijk_Alik_Bljk_HBH_MT064x064x08_PGR1_PLR1_TT04_04
    SolutionIndex: 104
    SolutionNameMin: Cijk_Alik_Bljk_HBH_MT064x064x16_PGR1_PLR0_TT04_04
    SolutionIndex: 105
    SolutionNameMin: Cijk_Alik_Bljk_HBH_MT064x128x16_PGR1_PLR1_TT04_08
    SolutionIndex: 106
    SolutionNameMin: Cijk_Alik_Bljk_HBH_MT064x064x16_PGR1_PLR1_TT04_04
    SolutionIndex: 107
    SolutionNameMin: Cijk_Alik_Bljk_HBH_MT128x128x04_PGR0_PLR0_TT08_08
    SolutionIndex: 108
    SolutionNameMin: Cijk_Alik_Bljk_HBH_MT064x128x04_PGR0_PLR0_TT04_08
    SolutionIndex: 109
    SolutionNameMin: Cijk_Alik_Bljk_HBH_MT064x064x04_PGR0_PLR0_TT04_04
    SolutionIndex: 110
    SolutionNameMin: Cijk_Alik_Bljk_HBH_MT064x128x04_PGR1_PLR0_TT04_08
    SolutionIndex: 111
    SolutionNameMin: Cijk_Alik_Bljk_HBH_MT064x064x04_PGR1_PLR0_TT04_04
    SolutionIndex: 112
    SolutionNameMin: Cijk_Alik_Bljk_HBH_MT064x128x04_PGR0_PLR1_TT04_08
    SolutionIndex: 113
    SolutionNameMin: Cijk_Alik_Bljk_HBH_MT064x064x04_PGR0_PLR1_TT04_04
    SolutionIndex: 114
    SolutionNameMin: Cijk_Alik_Bljk_HBH_MT064x128x04_PGR1_PLR1_TT04_08
    SolutionIndex: 115
    SolutionNameMin: Cijk_Alik_Bljk_HBH_MT064x064x04_PGR1_PLR1_TT04_04
    SolutionIndex: 116
    SolutionNameMin: Cijk_Alik_Bljk_HBH_MT128x128x08_PGR0_PLR0_TT08_08
    SolutionIndex: 117
    SolutionNameMin: Cijk_Alik_Bljk_HBH_MT064x128x08_PGR0_PLR0_TT04_08
    SolutionIndex: 118
    SolutionNameMin: Cijk_Alik_Bljk_HBH_MT064x064x08_PGR0_PLR0_TT04_04
    SolutionIndex: 119
    SolutionNameMin: Cijk_Alik_Bljk_HBH_MT064x064x08_PGR1_PLR0_TT04_04
    SolutionIndex: 120
    SolutionNameMin: Cijk_Alik_Bljk_HBH_MT064x064x08_PGR0_PLR1_TT04_04
    SolutionIndex: 121
    SolutionNameMin: Cijk_Alik_Bljk_HBH_MT064x064x08_PGR1_PLR1_TT04_04
    SolutionIndex: 122
    SolutionNameMin: Cijk_Alik_Bljk_HBH_MT064x064x16_PGR0_PLR0_TT04_04
    SolutionIndex: 123
    SolutionNameMin: Cijk_Alik_Bljk_HBH_MT064x064x16_PGR1_PLR1_TT04_04
    SolutionIndex: 124
    SolutionNameMin: Cijk_Alik_Bljk_HBH_MT128x32x16_SE_
    SolutionIndex: 125
    SolutionNameMin: Cijk_Alik_Bljk_HBH_MT128x64x16_SE_
    SolutionIndex: 126
    SolutionNameMin: Cijk_Alik_Bljk_HBH_MT256x128x16_SE_
    SolutionIndex: 127
    SolutionNameMin: Cijk_Alik_Bljk_HBH_MT64x16x16_SE_
    SolutionIndex: 128
    SolutionNameMin: Cijk_Alik_Bljk_HBH_MT64x32x16_SE_
    SolutionIndex: 129
    SolutionNameMin: Cijk_Alik_Bljk_HBH_MT64x128x32_SE_
    SolutionIndex: 130
    SolutionNameMin: Cijk_Alik_Bljk_HBH_MT128x256x32_SE_
    SolutionIndex: 131
    SolutionNameMin: Cijk_Alik_Bljk_HBH_MT128x256x16_SE_
    SolutionIndex: 132
    SolutionNameMin: Cijk_Alik_Bljk_HBH_MT128x32x16_SE_AF0EM1_ASEM1_GRVW1_ONLL1_SNLL0
    SolutionIndex: 133
    SolutionNameMin: Cijk_Alik_Bljk_HBH_MT128x64x16_SE_AF0EM1_ASEM1_GRVW1_ONLL1_SNLL0
    SolutionIndex: 134
    SolutionNameMin: Cijk_Alik_Bljk_HBH_MT64x128x16_SE_AF0EM1_ASEM1_GRVW1_ONLL1_SNLL0
    SolutionIndex: 135
    SolutionNameMin: Cijk_Alik_Bljk_HBH_MT256x64x16_SE_AF0EM1_ASEM1_GRVW1_ONLL1_SNLL0
    SolutionIndex: 136
    SolutionNameMin: Cijk_Alik_Bljk_HBH_MT256x128x16_SE_AF0EM1_ASEM1_GRVW1_ONLL1_SNLL0
    SolutionIndex: 137
    SolutionNameMin: Cijk_Alik_Bljk_HBH_MT128x256x16_SE_AF0EM1_ASEM1_GRVW1_ONLL1_SNLL0
    SolutionIndex: 138
    SolutionNameMin: Cijk_Alik_Bljk_HBH_MT64x32x16_SE_AF0EM1_ASEM1_GRVW1_ONLL1_SNLL0
    SolutionIndex: 139
    SolutionNameMin: Cijk_Alik_Bljk_HBH_MT64x128x32_SE_AF0EM8_ASEM8_GRVW4_ONLL1_SNLL0
    SolutionIndex: 140
    SolutionNameMin: Cijk_Alik_Bljk_HBH_MT128x256x32_SE_AF0EM8_ASEM8_GRVW8_ONLL1_SNLL0
    SolutionIndex: 141
    SolutionNameMin: Cijk_Alik_Bljk_HBH_MT64x128x8_MI32x32x4x2_SE_AF0EM1_ASEM2_GRVW2_ONLL0_SNLL1
    SolutionIndex: 142
    SolutionNameMin: Cijk_Alik_Bljk_HBH_MT64x128x16_MI32x32x4x2_SE_AF0EM2_ASEM1_GRVW2_ONLL0_SNLL1
    SolutionIndex: 143
    SolutionNameMin: Cijk_Alik_Bljk_HBH_MT64x128x16_MI32x32x4x2_SE_AF0EM1_ASEM1_GRVW4_ONLL0_SNLL1
    SolutionIndex: 144
    SolutionNameMin: Cijk_Alik_Bljk_HBH_MT64x128x16_MI32x32x4x2_SE_AF0EM1_ASEM2_GRVW4_ONLL0_SNLL1
    SolutionIndex: 145
    SolutionNameMin: Cijk_Alik_Bljk_HBH_MT64x128x16_MI32x32x4x2_SE_AF0EM2_ASEM1_GRVW4_ONLL0_SNLL1
    SolutionIndex: 146
    SolutionNameMin: Cijk_Alik_Bljk_HBH_MT64x128x16_MI32x32x4x2_SE_AF0EM2_ASEM2_GRVW4_ONLL0_SNLL1
    SolutionIndex: 147
    SolutionNameMin: Cijk_Alik_Bljk_HBH_MT64x128x16_MI32x32x4x2_SE_AF0EM1_ASEM2_GRVW2_ONLL0_SNLL0
    SolutionIndex: 148
    SolutionNameMin: Cijk_Alik_Bljk_HBH_MT64x128x16_MI32x32x4x2_SE_AF0EM2_ASEM1_GRVW2_ONLL0_SNLL0
    SolutionIndex: 149
    SolutionNameMin: Cijk_Alik_Bljk_HBH_MT32x256x16_MI32x32x4x2_SE_AF0EM2_ASEM2_GRVW4_ONLL0_SNLL0
    SolutionIndex: 150
    SolutionNameMin: Cijk_Alik_Bljk_HBH_MT64x128x16_MI32x32x4x2_SE_AF0EM1_ASEM1_GRVW4_ONLL0_SNLL0
    SolutionIndex: 151
    SolutionNameMin: Cijk_Alik_Bljk_HBH_MT64x128x16_MI32x32x4x2_SE_AF0EM1_ASEM2_GRVW4_ONLL0_SNLL0
    SolutionIndex: 152
    SolutionNameMin: Cijk_Alik_Bljk_HBH_MT64x128x16_MI32x32x4x2_SE_AF0EM2_ASEM1_GRVW4_ONLL0_SNLL0
    SolutionIndex: 153
    SolutionNameMin: Cijk_Alik_Bljk_HBH_MT64x128x16_MI32x32x4x2_SE_AF0EM2_ASEM2_GRVW4_ONLL0_SNLL0
    SolutionIndex: 154
    SolutionNameMin: Cijk_Alik_Bljk_HBH_MT64x128x32_MI32x32x4x2_SE_AF0EM1_ASEM1_GRVW4_ONLL0_SNLL0
    SolutionIndex: 155
    SolutionNameMin: Cijk_Alik_Bljk_HBH_MT64x128x32_MI32x32x4x2_SE_AF0EM1_ASEM2_GRVW4_ONLL0_SNLL0
    SolutionIndex: 156
    SolutionNameMin: Cijk_Alik_Bljk_HBH_MT64x128x32_MI32x32x4x2_SE_AF0EM2_ASEM1_GRVW4_ONLL0_SNLL0
    SolutionIndex: 157
    SolutionNameMin: Cijk_Alik_Bljk_HBH_MT64x128x32_MI32x32x4x2_SE_AF0EM2_ASEM2_GRVW4_ONLL0_SNLL0
    SolutionIndex: 158
    SolutionNameMin: Cijk_Alik_Bljk_HBH_MT64x128x16_MI32x32x4x2_SE_AF0EM1_ASEM1_GRVW2_ONLL1_SNLL1
    SolutionIndex: 159
    SolutionNameMin: Cijk_Alik_Bljk_HBH_MT64x128x16_MI32x32x4x2_SE_AF0EM2_ASEM1_GRVW2_ONLL1_SNLL1
    SolutionIndex: 160
    SolutionNameMin: Cijk_Alik_Bljk_HBH_MT64x128x8_MI32x32x4x2_SE_AF0EM1_ASEM1_GRVW4_ONLL1_SNLL1
    SolutionIndex: 161
    SolutionNameMin: Cijk_Alik_Bljk_HBH_MT64x128x16_MI32x32x4x2_SE_AF0EM1_ASEM2_GRVW4_ONLL1_SNLL1
    SolutionIndex: 162
    SolutionNameMin: Cijk_Alik_Bljk_HBH_MT64x128x16_MI32x32x4x2_SE_AF0EM2_ASEM1_GRVW4_ONLL1_SNLL1
    SolutionIndex: 163
    SolutionNameMin: Cijk_Alik_Bljk_HBH_MT64x128x16_MI32x32x4x2_SE_AF0EM2_ASEM1_GRVW2_ONLL1_SNLL0
    SolutionIndex: 164
    SolutionNameMin: Cijk_Alik_Bljk_HBH_MT64x128x8_MI32x32x4x2_SE_AF0EM1_ASEM2_GRVW4_ONLL1_SNLL0
    SolutionIndex: 165
    SolutionNameMin: Cijk_Alik_Bljk_HBH_MT32x256x16_MI32x32x4x2_SE_AF0EM2_ASEM1_GRVW4_ONLL1_SNLL0
    SolutionIndex: 166
    SolutionNameMin: Cijk_Alik_Bljk_HBH_MT64x128x16_MI32x32x4x2_SE_AF0EM1_ASEM1_GRVW4_ONLL1_SNLL0
    SolutionIndex: 167
    SolutionNameMin: Cijk_Alik_Bljk_HBH_MT64x128x16_MI32x32x4x2_SE_AF0EM1_ASEM2_GRVW4_ONLL1_SNLL0
    SolutionIndex: 168
    SolutionNameMin: Cijk_Alik_Bljk_HBH_MT64x128x16_MI32x32x4x2_SE_AF0EM2_ASEM1_GRVW4_ONLL1_SNLL0
    SolutionIndex: 169
    SolutionNameMin: Cijk_Alik_Bljk_HBH_MT64x128x16_MI32x32x4x2_SE_AF0EM2_ASEM2_GRVW4_ONLL1_SNLL0
    SolutionIndex: 170
    SolutionNameMin: Cijk_Alik_Bljk_HBH_MT64x128x32_MI32x32x4x2_SE_AF0EM1_ASEM1_GRVW4_ONLL1_SNLL0
    SolutionIndex: 171
    SolutionNameMin: Cijk_Alik_Bljk_HBH_MT64x128x32_MI32x32x4x2_SE_AF0EM1_ASEM2_GRVW4_ONLL1_SNLL0
    SolutionIndex: 172
    SolutionNameMin: Cijk_Alik_Bljk_HBH_MT64x128x32_MI32x32x4x2_SE_AF0EM2_ASEM1_GRVW4_ONLL1_SNLL0
    SolutionIndex: 173
    SolutionNameMin: Cijk_Alik_Bljk_HBH_MT64x128x32_MI32x32x4x2_SE_AF0EM2_ASEM2_GRVW4_ONLL1_SNLL0
    SolutionIndex: 174
    SolutionIndex: 175
    SolutionIndex: 176
    SolutionIndex: 177
    SolutionIndex: 178
    SolutionIndex: 179
    SolutionIndex: 180
    SolutionIndex: 181
    SolutionIndex: 182
    SolutionIndex: 183
    SolutionIndex: 184
    SolutionIndex: 185
    SolutionIndex: 186
    SolutionIndex: 187
    SolutionIndex: 188
    SolutionIndex: 189
    SolutionIndex: 190
    SolutionIndex: 191
    SolutionIndex: 192
    SolutionIndex: 193
    SolutionIndex: 194
    SolutionIndex: 195
    SolutionIndex: 196
    SolutionIndex: 197
    SolutionIndex: 198
    SolutionIndex: 199
    SolutionIndex: 200
    SolutionIndex: 201
    SolutionIndex: 202
    SolutionIndex: 203
    SolutionIndex: 204
    SolutionIndex: 205
    SolutionIndex: 206
    SolutionIndex: 207
    SolutionIndex: 208
    SolutionIndex: 209
    SolutionIndex: 210
    SolutionIndex: 211
    SolutionIndex: 212
    SolutionIndex: 213
    SolutionIndex: 214
    SolutionIndex: 215
    SolutionIndex: 216
    SolutionIndex: 217
    SolutionIndex: 218
    SolutionIndex: 219
    SolutionIndex: 220
    SolutionIndex: 221
    SolutionIndex: 222
    SolutionIndex: 223
    SolutionIndex: 224
    SolutionIndex: 225
    SolutionIndex: 226
    SolutionIndex: 227
    SolutionIndex: 228
    SolutionIndex: 229
    SolutionIndex: 230
    SolutionIndex: 231
    SolutionIndex: 232
    SolutionIndex: 233
    SolutionIndex: 234
    SolutionIndex: 235
    SolutionIndex: 236
    SolutionIndex: 237
    SolutionIndex: 238
    SolutionIndex: 239
    SolutionIndex: 240
    SolutionIndex: 241
    SolutionIndex: 242
    SolutionIndex: 243
    SolutionIndex: 244
    SolutionIndex: 245
    SolutionIndex: 246
    SolutionIndex: 247
    SolutionIndex: 248
    SolutionIndex: 249
    SolutionIndex: 250
    SolutionIndex: 251
    SolutionIndex: 252
    SolutionIndex: 253
    SolutionIndex: 254
    SolutionIndex: 255
    SolutionIndex: 256
    SolutionIndex: 257
    SolutionIndex: 258
    SolutionIndex: 259
    SolutionIndex: 260
    SolutionIndex: 261
    SolutionIndex: 262
    SolutionIndex: 263
    SolutionIndex: 264
    SolutionIndex: 265
    SolutionIndex: 266
    SolutionIndex: 267
    SolutionIndex: 268
    SolutionIndex: 269
    SolutionIndex: 270
    SolutionIndex: 271
    SolutionIndex: 272
    SolutionIndex: 273
    SolutionIndex: 274
    SolutionIndex: 275
    SolutionIndex: 276
    SolutionIndex: 277
    SolutionIndex: 278
    SolutionIndex: 279
    SolutionIndex: 280
    SolutionNameMin: Cijk_Alik_Bljk_HBH_MT032x016x08_PGR1_PLR1_TT04_02
    SolutionIndex: 281
    SolutionNameMin: Cijk_Alik_Bljk_HBH_MT032x016x08_PGR1_PLR1_TT02_02
    SolutionIndex: 282
    SolutionNameMin: Cijk_Alik_Bljk_HBH_MT032x032x08_PGR1_PLR1_TT02_02
    SolutionIndex: 283
    SolutionNameMin: Cijk_Alik_Bljk_HBH_MT016x016x16_PGR1_PLR1_TT02_02
    SolutionIndex: 284
    SolutionNameMin: Cijk_Alik_Bljk_HBH_MT032x032x16_PGR1_PLR1_TT04_04
    SolutionIndex: 285
    SolutionNameMin: Cijk_Alik_Bljk_HBH_MT032x016x16_PGR1_PLR1_TT02_02
    SolutionIndex: 286
    SolutionNameMin: Cijk_Alik_Bljk_HBH_MT064x032x16_PGR1_PLR1_TT04_04
    SolutionIndex: 287
    SolutionNameMin: Cijk_Alik_Bljk_HBH_MT016x016x32_PGR1_PLR1_TT02_02
    SolutionIndex: 288
    SolutionNameMin: Cijk_Alik_Bljk_HBH_MT032x032x32_PGR1_PLR1_TT04_04
    SolutionIndex: 289
    SolutionNameMin: Cijk_Alik_Bljk_HBH_MT064x016x32_PGR1_PLR1_TT02_02
    SolutionIndex: 290
    SolutionNameMin: Cijk_Alik_Bljk_HBH_MT032x016x08_PGR1_PLR1_TT04_02
    SolutionIndex: 291
    SolutionNameMin: Cijk_Alik_Bljk_HBH_MT016x016x16_PGR1_PLR1_TT02_02
    SolutionIndex: 292
    SolutionNameMin: Cijk_Alik_Bljk_HBH_MT032x032x16_PGR1_PLR1_TT04_04
    SolutionIndex: 293
    SolutionNameMin: Cijk_Alik_Bljk_HBH_MT064x064x16_PGR1_PLR1_TT08_08
    SolutionIndex: 294
    SolutionNameMin: Cijk_Alik_Bljk_HBH_MT064x032x16_PGR1_PLR1_TT04_04
    SolutionIndex: 295
    SolutionNameMin: Cijk_Alik_Bljk_HBH_MT016x016x24_PGR1_PLR1_TT02_02
    SolutionIndex: 296
    SolutionNameMin: Cijk_Alik_Bljk_HBH_MT032x016x24_PGR1_PLR1_TT04_02
    SolutionIndex: 297
    SolutionNameMin: Cijk_Alik_Bljk_HBH_MT032x032x24_PGR1_PLR1_TT04_04
    SolutionIndex: 298
    SolutionNameMin: Cijk_Alik_Bljk_HBH_MT016x016x24_PGR1_PLR1_TT02_02
    SolutionIndex: 299
    SolutionNameMin: Cijk_Alik_Bljk_HBH_MT032x016x24_PGR1_PLR1_TT04_02
    SolutionIndex: 300
    SolutionNameMin: Cijk_Alik_Bljk_HBH_MT032x032x24_PGR1_PLR1_TT04_04
    SolutionIndex: 301
    SolutionNameMin: Cijk_Alik_Bljk_HBH_MT064x064x24_PGR1_PLR1_TT08_08
    SolutionIndex: 302
    SolutionNameMin: Cijk_Alik_Bljk_HBH_MT032x032x32_PGR1_PLR1_TT04_04
    SolutionIndex: 303
    SolutionNameMin: Cijk_Alik_Bljk_HBH_MT064x064x08_PGR1_PLR1_TT04_04
    SolutionIndex: 304
    SolutionNameMin: Cijk_Alik_Bljk_HBH_MT064x128x08_PGR1_PLR1_TT04_08
    SolutionIndex: 305
    SolutionNameMin: Cijk_Alik_Bljk_HBH_MT128x064x08_PGR1_PLR1_TT08_04
    SolutionIndex: 306
    SolutionNameMin: Cijk_Alik_Bljk_HBH_MT064x064x16_PGR1_PLR1_TT04_04
    SolutionIndex: 307
    SolutionNameMin: Cijk_Alik_Bljk_HBH_MT064x128x16_PGR1_PLR1_TT04_08
    SolutionIndex: 308
    SolutionNameMin: Cijk_Alik_Bljk_HBH_MT128x064x16_PGR1_PLR1_TT08_04
    SolutionIndex: 309
    SolutionNameMin: Cijk_Alik_Bljk_HBH_MT128x128x16_PGR1_PLR1_TT08_08
    SolutionIndex: 310
    SolutionNameMin: Cijk_Alik_Bljk_HBH_MT064x064x32_PGR1_PLR1_TT04_04
    SolutionIndex: 311
    SolutionNameMin: Cijk_Alik_Bljk_HBH_MT128x064x32_PGR1_PLR1_TT08_04
    SolutionIndex: 312
    SolutionNameMin: Cijk_Alik_Bljk_HBH_MT128x128x32_PGR1_PLR1_TT08_08
    SolutionIndex: 313
    SolutionNameMin: Cijk_Alik_Bljk_HBH_MT064x128x04_PGR0_PLR0_TT04_08
    SolutionIndex: 314
    SolutionNameMin: Cijk_Alik_Bljk_HBH_MT064x064x04_PGR0_PLR0_TT04_04
    SolutionIndex: 315
    SolutionNameMin: Cijk_Alik_Bljk_HBH_MT064x064x04_PGR1_PLR0_TT04_04
    SolutionIndex: 316
    SolutionNameMin: Cijk_Alik_Bljk_HBH_MT064x064x04_PGR0_PLR1_TT04_04
    SolutionIndex: 317
    SolutionNameMin: Cijk_Alik_Bljk_HBH_MT064x064x08_PGR0_PLR0_TT04_04
    SolutionIndex: 318
    SolutionNameMin: Cijk_Alik_Bljk_HBH_MT064x064x08_PGR1_PLR0_TT04_04
    SolutionIndex: 319
    SolutionNameMin: Cijk_Alik_Bljk_HBH_MT128x128x08_PGR0_PLR1_TT08_08
    SolutionIndex: 320
    SolutionNameMin: Cijk_Alik_Bljk_HBH_MT064x128x08_PGR0_PLR1_TT04_08
    SolutionIndex: 321
    SolutionNameMin: Cijk_Alik_Bljk_HBH_MT064x064x08_PGR0_PLR1_TT04_04
    SolutionIndex: 322
    SolutionNameMin: Cijk_Alik_Bljk_HBH_MT064x064x08_PGR1_PLR1_TT04_04
    SolutionIndex: 323
    SolutionNameMin: Cijk_Alik_Bljk_HBH_MT064x064x16_PGR0_PLR0_TT04_04
    SolutionIndex: 324
    SolutionNameMin: Cijk_Alik_Bljk_HBH_MT064x064x16_PGR1_PLR0_TT04_04
    SolutionIndex: 325
    SolutionNameMin: Cijk_Alik_Bljk_HBH_MT064x064x16_PGR0_PLR1_TT04_04
    SolutionIndex: 326
    SolutionNameMin: Cijk_Alik_Bljk_HBH_MT064x064x16_PGR1_PLR1_TT04_04
    SolutionIndex: 327
    SolutionNameMin: Cijk_Alik_Bljk_HBH_MT064x128x04_PGR0_PLR0_TT04_08
    SolutionIndex: 328
    SolutionNameMin: Cijk_Alik_Bljk_HBH_MT064x064x04_PGR0_PLR0_TT04_04
    SolutionIndex: 329
    SolutionNameMin: Cijk_Alik_Bljk_HBH_MT064x128x04_PGR1_PLR0_TT04_08
    SolutionIndex: 330
    SolutionNameMin: Cijk_Alik_Bljk_HBH_MT064x064x04_PGR1_PLR0_TT04_04
    SolutionIndex: 331
    SolutionNameMin: Cijk_Alik_Bljk_HBH_MT128x128x04_PGR0_PLR1_TT08_08
    SolutionIndex: 332
    SolutionNameMin: Cijk_Alik_Bljk_HBH_MT064x128x04_PGR0_PLR1_TT04_08
    SolutionIndex: 333
    SolutionNameMin: Cijk_Alik_Bljk_HBH_MT064x064x04_PGR0_PLR1_TT04_04
    SolutionIndex: 334
    SolutionNameMin: Cijk_Alik_Bljk_HBH_MT064x128x04_PGR1_PLR1_TT04_08
    SolutionIndex: 335
    SolutionNameMin: Cijk_Alik_Bljk_HBH_MT064x064x04_PGR1_PLR1_TT04_04
    SolutionIndex: 336
    SolutionNameMin: Cijk_Alik_Bljk_HBH_MT128x128x08_PGR0_PLR0_TT08_08
    SolutionIndex: 337
    SolutionNameMin: Cijk_Alik_Bljk_HBH_MT064x128x08_PGR0_PLR0_TT04_08
    SolutionIndex: 338
    SolutionNameMin: Cijk_Alik_Bljk_HBH_MT064x064x08_PGR0_PLR0_TT04_04
    SolutionIndex: 339
    SolutionNameMin: Cijk_Alik_Bljk_HBH_MT064x064x08_PGR1_PLR0_TT04_04
    SolutionIndex: 340
    SolutionNameMin: Cijk_Alik_Bljk_HBH_MT064x128x08_PGR0_PLR1_TT04_08
    SolutionIndex: 341
    SolutionNameMin: Cijk_Alik_Bljk_HBH_MT064x064x08_PGR0_PLR1_TT04_04
    SolutionIndex: 342
    SolutionNameMin: Cijk_Alik_Bljk_HBH_MT064x128x08_PGR1_PLR1_TT04_08
    SolutionIndex: 343
    SolutionNameMin: Cijk_Alik_Bljk_HBH_MT064x064x08_PGR1_PLR1_TT04_04
    SolutionIndex: 344
    SolutionNameMin: Cijk_Alik_Bljk_HBH_MT064x064x16_PGR1_PLR1_TT04_04
    SolutionIndex: 345
    SolutionNameMin: Cijk_Alik_Bljk_HBH_MT064x032x16_EPS1_GRVW04_LPB04_PGR1_PLR1_SNLL1_TT04_04_VW04_WG16_08_01_WGM01
    SolutionIndex: 346
    SolutionNameMin: Cijk_Alik_Bljk_HBH_MT064x064x16_EPS1_GRVW04_LPB04_PGR1_PLR1_SNLL1_TT04_04_VW04_WG16_16_01_WGM01
    SolutionIndex: 347
    SolutionNameMin: Cijk_Alik_Bljk_HBH_MT064x032x16_EPS1_GRVW04_LPB04_PGR1_PLR1_SNLL1_TT04_04_VW04_WG16_08_01_WGM08
    SolutionIndex: 348
    SolutionNameMin: Cijk_Alik_Bljk_HBH_MT064x032x16_EPS1_GRVW04_LPB04_PGR1_PLR1_SNLL1_TT04_04_VW04_WG16_08_01_WGM64
    SolutionIndex: 349
    SolutionNameMin: Cijk_Alik_Bljk_HBH_MT032x128x32_EPS1_GRVW04_LPB04_PGR1_PLR1_SNLL1_TT04_04_VW04_WG08_32_01_WGM01
    SolutionIndex: 350
    SolutionNameMin: Cijk_Alik_Bljk_HBH_MT032x128x32_EPS1_GRVW04_LPB04_PGR1_PLR1_SNLL1_TT04_04_VW04_WG08_32_01_WGM64
    SolutionIndex: 351
    SolutionNameMin: Cijk_Alik_Bljk_HBH_MT032x032x08_PGR0_PLR1_TT04_04
    SolutionIndex: 352
    SolutionNameMin: Cijk_Alik_Bljk_HBH_MT032x032x08_PGR1_PLR1_TT04_04
    SolutionIndex: 353
    SolutionNameMin: Cijk_Alik_Bljk_HBH_MT032x032x16_PGR1_PLR1_TT04_04
    SolutionIndex: 354
    SolutionNameMin: Cijk_Alik_Bljk_HBH_MT064x016x16_PGR1_PLR1_TT04_04
    SolutionIndex: 355
    SolutionNameMin: Cijk_Alik_Bljk_HBH_MT064x064x16_PGR1_PLR1_TT04_04
    SolutionIndex: 356
    SolutionNameMin: Cijk_Alik_Bljk_HBH_MT032x032x32_PGR1_PLR1_TT04_04
    SolutionIndex: 357
    SolutionNameMin: Cijk_Alik_Bljk_HBH_MT064x016x32_PGR1_PLR1_TT04_04
    SolutionIndex: 358
    SolutionNameMin: Cijk_Alik_Bljk_HBH_MT064x064x16_PGR1_PLR1_TT08_08
    SolutionIndex: 359
    SolutionNameMin: Cijk_Alik_Bljk_HBH_MT032x032x16_PGR1_PLR1_TT04_04
    SolutionIndex: 360
    SolutionNameMin: Cijk_Alik_Bljk_HBH_MT064x032x16_PGR1_PLR1_TT04_04
    SolutionIndex: 361
    SolutionNameMin: Cijk_Alik_Bljk_HBH_MT032x032x32_PGR1_PLR1_TT04_04
    SolutionIndex: 362
    SolutionNameMin: Cijk_Alik_Bljk_HBH_MT064x032x32_PGR1_PLR1_TT04_04
    SolutionIndex: 363
    SolutionNameMin: Cijk_Alik_Bljk_HBH_MT064x064x08_PGR1_PLR1_TT08_08
    SolutionIndex: 364
    SolutionNameMin: Cijk_Alik_Bljk_HBH_MT064x064x16_PGR1_PLR1_TT08_08
    SolutionIndex: 365
    SolutionNameMin: Cijk_Alik_Bljk_HBH_MT064x064x32_PGR1_PLR1_TT08_08
    SolutionIndex: 366
    SolutionNameMin: Cijk_Alik_Bljk_HBH_MT128x128x08_PGR1_PLR1_TT08_08
    SolutionIndex: 367
    SolutionNameMin: Cijk_Alik_Bljk_HBH_MT032x064x16_PGR1_PLR1_TT04_08
    SolutionIndex: 368
    SolutionNameMin: Cijk_Alik_Bljk_HBH_MT064x064x16_PGR1_PLR1_TT04_04
    SolutionIndex: 369
    SolutionNameMin: Cijk_Alik_Bljk_HBH_MT064x128x16_PGR1_PLR1_TT04_08
    SolutionIndex: 370
    SolutionNameMin: Cijk_Alik_Bljk_HBH_MT128x064x16_PGR1_PLR1_TT08_04
    SolutionIndex: 371
    SolutionNameMin: Cijk_Alik_Bljk_HBH_MT128x128x32_PGR1_PLR1_TT08_08
    SolutionIndex: 372
    SolutionNameMin: Cijk_Alik_Bljk_HBH_MT128x128x16_PGR1_PLR1_TT08_08
    SolutionIndex: 373
    SolutionNameMin: Cijk_Alik_Bljk_HBH_MT128x128x32_PGR1_PLR1_TT08_08
    SolutionIndex: 374
    SolutionNameMin: Cijk_Alik_Bljk_HBH_MT064x128x04_PGR0_PLR0_TT04_08
    SolutionIndex: 375
    SolutionNameMin: Cijk_Alik_Bljk_HBH_MT064x064x04_PGR0_PLR0_TT04_04
    SolutionIndex: 376
    SolutionNameMin: Cijk_Alik_Bljk_HBH_MT064x064x04_PGR1_PLR0_TT04_04
    SolutionIndex: 377
    SolutionNameMin: Cijk_Alik_Bljk_HBH_MT064x064x04_PGR1_PLR1_TT04_04
    SolutionIndex: 378
    SolutionNameMin: Cijk_Alik_Bljk_HBH_MT128x128x08_PGR0_PLR0_TT08_08
    SolutionIndex: 379
    SolutionNameMin: Cijk_Alik_Bljk_HBH_MT064x064x08_PGR0_PLR0_TT04_04
    SolutionIndex: 380
    SolutionNameMin: Cijk_Alik_Bljk_HBH_MT064x128x08_PGR1_PLR0_TT04_08
    SolutionIndex: 381
    SolutionNameMin: Cijk_Alik_Bljk_HBH_MT064x064x08_PGR1_PLR0_TT04_04
    SolutionIndex: 382
    SolutionNameMin: Cijk_Alik_Bljk_HBH_MT064x064x08_PGR0_PLR1_TT04_04
    SolutionIndex: 383
    SolutionNameMin: Cijk_Alik_Bljk_HBH_MT064x064x08_PGR1_PLR1_TT04_04
    SolutionIndex: 384
    SolutionNameMin: Cijk_Alik_Bljk_HBH_MT064x064x16_PGR1_PLR0_TT04_04
    SolutionIndex: 385
    SolutionNameMin: Cijk_Alik_Bljk_HBH_MT064x128x16_PGR1_PLR1_TT04_08
    SolutionIndex: 386
    SolutionNameMin: Cijk_Alik_Bljk_HBH_MT064x064x16_PGR1_PLR1_TT04_04
    SolutionIndex: 387
    SolutionNameMin: Cijk_Alik_Bljk_HBH_MT128x128x04_PGR0_PLR0_TT08_08
    SolutionIndex: 388
    SolutionNameMin: Cijk_Alik_Bljk_HBH_MT064x128x04_PGR0_PLR0_TT04_08
    SolutionIndex: 389
    SolutionNameMin: Cijk_Alik_Bljk_HBH_MT064x064x04_PGR0_PLR0_TT04_04
    SolutionIndex: 390
    SolutionNameMin: Cijk_Alik_Bljk_HBH_MT064x128x04_PGR1_PLR0_TT04_08
    SolutionIndex: 391
    SolutionNameMin: Cijk_Alik_Bljk_HBH_MT064x064x04_PGR1_PLR0_TT04_04
    SolutionIndex: 392
    SolutionNameMin: Cijk_Alik_Bljk_HBH_MT064x128x04_PGR0_PLR1_TT04_08
    SolutionIndex: 393
    SolutionNameMin: Cijk_Alik_Bljk_HBH_MT064x064x04_PGR0_PLR1_TT04_04
    SolutionIndex: 394
    SolutionNameMin: Cijk_Alik_Bljk_HBH_MT064x128x04_PGR1_PLR1_TT04_08
    SolutionIndex: 395
    SolutionNameMin: Cijk_Alik_Bljk_HBH_MT064x064x04_PGR1_PLR1_TT04_04
    SolutionIndex: 396
    SolutionNameMin: Cijk_Alik_Bljk_HBH_MT128x128x08_PGR0_PLR0_TT08_08
    SolutionIndex: 397
    SolutionNameMin: Cijk_Alik_Bljk_HBH_MT064x128x08_PGR0_PLR0_TT04_08
    SolutionIndex: 398
    SolutionNameMin: Cijk_Alik_Bljk_HBH_MT064x064x08_PGR0_PLR0_TT04_04
    SolutionIndex: 399
    SolutionNameMin: Cijk_Alik_Bljk_HBH_MT064x064x08_PGR1_PLR0_TT04_04
    SolutionIndex: 400
    SolutionNameMin: Cijk_Alik_Bljk_HBH_MT064x064x08_PGR0_PLR1_TT04_04
    SolutionIndex: 401
    SolutionNameMin: Cijk_Alik_Bljk_HBH_MT064x064x08_PGR1_PLR1_TT04_04
    SolutionIndex: 402
    SolutionNameMin: Cijk_Alik_Bljk_HBH_MT064x064x16_PGR0_PLR0_TT04_04
    SolutionIndex: 403
    SolutionNameMin: Cijk_Alik_Bljk_HBH_MT064x064x16_PGR1_PLR1_TT04_04
    SolutionIndex: 404
    SolutionNameMin: Cijk_Alik_Bljk_HBH_MT128x32x16_SE_
    SolutionIndex: 405
    SolutionNameMin: Cijk_Alik_Bljk_HBH_MT128x64x16_SE_
    SolutionIndex: 406
    SolutionNameMin: Cijk_Alik_Bljk_HBH_MT256x128x16_SE_
    SolutionIndex: 407
    SolutionNameMin: Cijk_Alik_Bljk_HBH_MT64x16x16_SE_
    SolutionIndex: 408
    SolutionNameMin: Cijk_Alik_Bljk_HBH_MT64x32x16_SE_
    SolutionIndex: 409
    SolutionNameMin: Cijk_Alik_Bljk_HBH_MT64x128x32_SE_
    SolutionIndex: 410
    SolutionNameMin: Cijk_Alik_Bljk_HBH_MT128x256x32_SE_
    SolutionIndex: 411
    SolutionNameMin: Cijk_Alik_Bljk_HBH_MT128x256x16_SE_
    SolutionIndex: 412
    SolutionNameMin: Cijk_Alik_Bljk_HBH_MT128x32x16_SE_AF0EM1_ASEM1_GRVW1_ONLL1_SNLL0
    SolutionIndex: 413
    SolutionNameMin: Cijk_Alik_Bljk_HBH_MT128x64x16_SE_AF0EM1_ASEM1_GRVW1_ONLL1_SNLL0
    SolutionIndex: 414
    SolutionNameMin: Cijk_Alik_Bljk_HBH_MT64x128x16_SE_AF0EM1_ASEM1_GRVW1_ONLL1_SNLL0
    SolutionIndex: 415
    SolutionNameMin: Cijk_Alik_Bljk_HBH_MT256x64x16_SE_AF0EM1_ASEM1_GRVW1_ONLL1_SNLL0
    SolutionIndex: 416
    SolutionNameMin: Cijk_Alik_Bljk_HBH_MT256x128x16_SE_AF0EM1_ASEM1_GRVW1_ONLL1_SNLL0
    SolutionIndex: 417
    SolutionNameMin: Cijk_Alik_Bljk_HBH_MT128x256x16_SE_AF0EM1_ASEM1_GRVW1_ONLL1_SNLL0
    SolutionIndex: 418
    SolutionNameMin: Cijk_Alik_Bljk_HBH_MT64x32x16_SE_AF0EM1_ASEM1_GRVW1_ONLL1_SNLL0
    SolutionIndex: 419
    SolutionNameMin: Cijk_Alik_Bljk_HBH_MT64x128x32_SE_AF0EM8_ASEM8_GRVW4_ONLL1_SNLL0
    SolutionIndex: 420
    SolutionNameMin: Cijk_Alik_Bljk_HBH_MT128x256x32_SE_AF0EM8_ASEM8_GRVW8_ONLL1_SNLL0
    SolutionIndex: 421
    SolutionNameMin: Cijk_Alik_Bljk_HBH_MT64x128x8_MI32x32x4x2_SE_AF0EM1_ASEM2_GRVW2_ONLL0_SNLL1
    SolutionIndex: 422
    SolutionNameMin: Cijk_Alik_Bljk_HBH_MT64x128x16_MI32x32x4x2_SE_AF0EM2_ASEM1_GRVW2_ONLL0_SNLL1
    SolutionIndex: 423
    SolutionNameMin: Cijk_Alik_Bljk_HBH_MT64x128x16_MI32x32x4x2_SE_AF0EM1_ASEM1_GRVW4_ONLL0_SNLL1
    SolutionIndex: 424
    SolutionNameMin: Cijk_Alik_Bljk_HBH_MT64x128x16_MI32x32x4x2_SE_AF0EM1_ASEM2_GRVW4_ONLL0_SNLL1
    SolutionIndex: 425
    SolutionNameMin: Cijk_Alik_Bljk_HBH_MT64x128x16_MI32x32x4x2_SE_AF0EM2_ASEM1_GRVW4_ONLL0_SNLL1
    SolutionIndex: 426
    SolutionNameMin: Cijk_Alik_Bljk_HBH_MT64x128x16_MI32x32x4x2_SE_AF0EM2_ASEM2_GRVW4_ONLL0_SNLL1
    SolutionIndex: 427
    SolutionNameMin: Cijk_Alik_Bljk_HBH_MT64x128x16_MI32x32x4x2_SE_AF0EM1_ASEM2_GRVW2_ONLL0_SNLL0
    SolutionIndex: 428
    SolutionNameMin: Cijk_Alik_Bljk_HBH_MT64x128x16_MI32x32x4x2_SE_AF0EM2_ASEM1_GRVW2_ONLL0_SNLL0
    SolutionIndex: 429
    SolutionNameMin: Cijk_Alik_Bljk_HBH_MT32x256x16_MI32x32x4x2_SE_AF0EM2_ASEM2_GRVW4_ONLL0_SNLL0
    SolutionIndex: 430
    SolutionNameMin: Cijk_Alik_Bljk_HBH_MT64x128x16_MI32x32x4x2_SE_AF0EM1_ASEM1_GRVW4_ONLL0_SNLL0
    SolutionIndex: 431
    SolutionNameMin: Cijk_Alik_Bljk_HBH_MT64x128x16_MI32x32x4x2_SE_AF0EM1_ASEM2_GRVW4_ONLL0_SNLL0
    SolutionIndex: 432
    SolutionNameMin: Cijk_Alik_Bljk_HBH_MT64x128x16_MI32x32x4x2_SE_AF0EM2_ASEM1_GRVW4_ONLL0_SNLL0
    SolutionIndex: 433
    SolutionNameMin: Cijk_Alik_Bljk_HBH_MT64x128x16_MI32x32x4x2_SE_AF0EM2_ASEM2_GRVW4_ONLL0_SNLL0
    SolutionIndex: 434
    SolutionNameMin: Cijk_Alik_Bljk_HBH_MT64x128x32_MI32x32x4x2_SE_AF0EM1_ASEM1_GRVW4_ONLL0_SNLL0
    SolutionIndex: 435
    SolutionNameMin: Cijk_Alik_Bljk_HBH_MT64x128x32_MI32x32x4x2_SE_AF0EM1_ASEM2_GRVW4_ONLL0_SNLL0
    SolutionIndex: 436
    SolutionNameMin: Cijk_Alik_Bljk_HBH_MT64x128x32_MI32x32x4x2_SE_AF0EM2_ASEM1_GRVW4_ONLL0_SNLL0
    SolutionIndex: 437
    SolutionNameMin: Cijk_Alik_Bljk_HBH_MT64x128x32_MI32x32x4x2_SE_AF0EM2_ASEM2_GRVW4_ONLL0_SNLL0
    SolutionIndex: 438
    SolutionNameMin: Cijk_Alik_Bljk_HBH_MT64x128x16_MI32x32x4x2_SE_AF0EM1_ASEM1_GRVW2_ONLL1_SNLL1
    SolutionIndex: 439
    SolutionNameMin: Cijk_Alik_Bljk_HBH_MT64x128x16_MI32x32x4x2_SE_AF0EM2_ASEM1_GRVW2_ONLL1_SNLL1
    SolutionIndex: 440
    SolutionNameMin: Cijk_Alik_Bljk_HBH_MT64x128x8_MI32x32x4x2_SE_AF0EM1_ASEM1_GRVW4_ONLL1_SNLL1
    SolutionIndex: 441
    SolutionNameMin: Cijk_Alik_Bljk_HBH_MT64x128x16_MI32x32x4x2_SE_AF0EM1_ASEM2_GRVW4_ONLL1_SNLL1
    SolutionIndex: 442
    SolutionNameMin: Cijk_Alik_Bljk_HBH_MT64x128x16_MI32x32x4x2_SE_AF0EM2_ASEM1_GRVW4_ONLL1_SNLL1
    SolutionIndex: 443
    SolutionNameMin: Cijk_Alik_Bljk_HBH_MT64x128x16_MI32x32x4x2_SE_AF0EM2_ASEM1_GRVW2_ONLL1_SNLL0
    SolutionIndex: 444
    SolutionNameMin: Cijk_Alik_Bljk_HBH_MT64x128x8_MI32x32x4x2_SE_AF0EM1_ASEM2_GRVW4_ONLL1_SNLL0
    SolutionIndex: 445
    SolutionNameMin: Cijk_Alik_Bljk_HBH_MT32x256x16_MI32x32x4x2_SE_AF0EM2_ASEM1_GRVW4_ONLL1_SNLL0
    SolutionIndex: 446
    SolutionNameMin: Cijk_Alik_Bljk_HBH_MT64x128x16_MI32x32x4x2_SE_AF0EM1_ASEM1_GRVW4_ONLL1_SNLL0
    SolutionIndex: 447
    SolutionNameMin: Cijk_Alik_Bljk_HBH_MT64x128x16_MI32x32x4x2_SE_AF0EM1_ASEM2_GRVW4_ONLL1_SNLL0
    SolutionIndex: 448
    SolutionNameMin: Cijk_Alik_Bljk_HBH_MT64x128x16_MI32x32x4x2_SE_AF0EM2_ASEM1_GRVW4_ONLL1_SNLL0
    SolutionIndex: 449
    SolutionNameMin: Cijk_Alik_Bljk_HBH_MT64x128x16_MI32x32x4x2_SE_AF0EM2_ASEM2_GRVW4_ONLL1_SNLL0
    SolutionIndex: 450
    SolutionNameMin: Cijk_Alik_Bljk_HBH_MT64x128x32_MI32x32x4x2_SE_AF0EM1_ASEM1_GRVW4_ONLL1_SNLL0
    SolutionIndex: 451
    SolutionNameMin: Cijk_Alik_Bljk_HBH_MT64x128x32_MI32x32x4x2_SE_AF0EM1_ASEM2_GRVW4_ONLL1_SNLL0
    SolutionIndex: 452
    SolutionNameMin: Cijk_Alik_Bljk_HBH_MT64x128x32_MI32x32x4x2_SE_AF0EM2_ASEM1_GRVW4_ONLL1_SNLL0
    SolutionIndex: 453
    SolutionNameMin: Cijk_Alik_Bljk_HBH_MT64x128x32_MI32x32x4x2_SE_AF0EM2_ASEM2_GRVW4_ONLL1_SNLL0
    SolutionIndex: 454
    SolutionIndex: 455
    SolutionIndex: 456
    SolutionIndex: 457
    SolutionIndex: 458
    SolutionIndex: 459
    SolutionIndex: 460
    SolutionIndex: 461
    SolutionIndex: 462
    SolutionIndex: 463
    SolutionIndex: 464
    SolutionIndex: 465
    SolutionIndex: 466
    SolutionIndex: 467
    SolutionIndex: 468
    SolutionIndex: 469
    SolutionIndex: 470
    SolutionIndex: 471
    SolutionIndex: 472
    SolutionIndex: 473
    SolutionIndex: 474
    SolutionIndex: 475
    SolutionIndex: 476
    SolutionIndex: 477
    SolutionIndex: 478
    SolutionIndex: 479
    SolutionIndex: 480
    SolutionIndex: 481
    SolutionIndex: 482
    SolutionIndex: 483
    SolutionIndex: 484
    SolutionIndex: 485
    SolutionIndex: 486
    SolutionIndex: 487
    SolutionIndex: 488
    SolutionIndex: 489
    SolutionIndex: 490
    SolutionIndex: 491
    SolutionIndex: 492
    SolutionIndex: 493
    SolutionIndex: 494
    SolutionIndex: 495
    SolutionIndex: 496
    SolutionIndex: 497
    SolutionIndex: 498
    SolutionIndex: 499
    SolutionIndex: 500
    SolutionIndex: 501
    SolutionIndex: 502
    SolutionIndex: 503
    SolutionIndex: 504
    SolutionIndex: 505
    SolutionIndex: 506
    SolutionIndex: 507
    SolutionIndex: 508
    SolutionIndex: 509
    SolutionIndex: 510
    SolutionIndex: 511
    SolutionIndex: 512
    SolutionIndex: 513
    SolutionIndex: 514
    SolutionIndex: 515
    SolutionIndex: 516
    SolutionIndex: 517
    SolutionIndex: 518
    SolutionIndex: 519
    SolutionIndex: 520
    SolutionIndex: 521
    SolutionIndex: 522
    SolutionIndex: 523
    SolutionIndex: 524
    SolutionIndex: 525
    SolutionIndex: 526
    SolutionIndex: 527
    SolutionIndex: 528
    SolutionIndex: 529
    SolutionIndex: 530
    SolutionIndex: 531
    SolutionIndex: 532
    SolutionIndex: 533
    SolutionIndex: 534
    SolutionIndex: 535
    SolutionIndex: 536
    SolutionIndex: 537
    SolutionIndex: 538
    SolutionIndex: 539
    SolutionIndex: 540
    SolutionIndex: 541
    SolutionIndex: 542
    SolutionIndex: 543
    SolutionIndex: 544
    SolutionIndex: 545
    SolutionIndex: 546
    SolutionIndex: 547
    SolutionIndex: 548
    SolutionIndex: 549
    SolutionIndex: 550
    SolutionIndex: 551
    SolutionIndex: 552
    SolutionIndex: 553
    SolutionIndex: 554
    SolutionIndex: 555
    SolutionIndex: 556
    SolutionIndex: 557
    SolutionIndex: 558
    SolutionIndex: 559
- - - [2368, 1024, 1, 1]
    - [48, 0.0]
  - - [448, 1, 1, 256]
    - [63, 0.0]
  - - [5056, 1408, 1, 3328]
    - [29, 0.0]
  - - [5056, 1856, 1, 3328]
    - [26, 0.0]
  - - [5888, 128, 1, 1]
    - [52, 0.0]
  - - [448, 3584, 1, 3328]
    - [26, 0.0]
  - - [704, 64, 1, 3328]
    - [18, 0.0]
  - - [5056, 4288, 1, 32]
    - [33, 0.0]
  - - [3584, 1024, 1, 256]
    - [26, 0.0]
  - - [32, 5056, 1, 1280]
    - [46, 0.0]
  - - [1856, 256, 1, 1]
    - [48, 0.0]
  - - [256, 1856, 1, 32]
    - [41, 0.0]
  - - [1408, 3584, 1, 3328]
    - [26, 0.0]
  - - [128, 3584, 1, 1280]
    - [20, 0.0]
  - - [1024, 2368, 1, 3328]
    - [26, 0.0]
  - - [4288, 64, 1, 3328]
    - [18, 0.0]
  - - [1, 4288, 1, 1280]
    - [63, 0.0]
  - - [2368, 64, 1, 1]
    - [61, 0.0]
  - - [256, 128, 1, 256]
    - [3, 0.0]
  - - [448, 64, 1, 1]
    - [56, 0.0]
  - - [32, 1408, 1, 32]
    - [35, 0.0]
  - - [448, 3584, 1, 32]
    - [41, 0.0]
  - - [64, 1024, 1, 1280]
    - [18, 0.0]
  - - [1, 1408, 1, 3328]
    - [64, 0.0]
  - - [1408, 128, 1, 32]
    - [35, 0.0]
  - - [4288, 6784, 1, 3328]
    - [26, 0.0]
  - - [1024, 1, 1, 3328]
    - [64, 0.0]
  - - [2944, 128, 1, 32]
    - [42, 0.0]
  - - [64, 6784, 1, 1]
    - [48, 0.0]
  - - [1024, 64, 1, 1280]
    - [18, 0.0]
  - - [448, 128, 1, 256]
    - [3, 0.0]
  - - [64, 5056, 1, 3328]
    - [14, 0.0]
  - - [5888, 4288, 1, 3328]
    - [26, 0.0]
  - - [1, 2368, 1, 1280]
    - [64, 0.0]
  - - [704, 1024, 1, 1]
    - [53, 0.0]
  - - [2368, 1408, 1, 32]
    - [33, 0.0]
  - - [256, 1856, 1, 1280]
    - [20, 0.0]
  - - [1024, 2944, 1, 1]
    - [48, 0.0]
  - - [2944, 3584, 1, 3328]
    - [26, 0.0]
  - - [2368, 2944, 1, 1280]
    - [26, 0.0]
  - - [256, 1408, 1, 1]
    - [48, 0.0]
  - - [1, 1024, 1, 3328]
    - [64, 0.0]
  - - [6784, 5888, 1, 3328]
    - [24, 0.0]
  - - [3584, 1408, 1, 32]
    - [33, 0.0]
  - - [5056, 256, 1, 256]
    - [26, 0.0]
  - - [1856, 2368, 1, 256]
    - [26, 0.0]
  - - [2368, 1024, 1, 3328]
    - [26, 0.0]
  - - [3584, 4288, 1, 32]
    - [33, 0.0]
  - - [1024, 1024, 1, 1280]
    - [29, 0.0]
  - - [3584, 3584, 1, 1]
    - [52, 0.0]
  - - [32, 2944, 1, 3328]
    - [46, 0.0]
  - - [704, 1408, 1, 3328]
    - [21, 0.0]
  - - [1408, 704, 1, 256]
    - [26, 0.0]
  - - [704, 64, 1, 32]
    - [35, 0.0]
  - - [5888, 1, 1, 3328]
    - [63, 0.0]
  - - [2368, 32, 1, 256]
    - [42, 0.0]
  - - [6784, 128, 1, 3328]
    - [6, 0.0]
  - - [2944, 256, 1, 1]
    - [57, 0.0]
  - - [1408, 2368, 1, 1]
    - [53, 0.0]
  - - [32, 448, 1, 3328]
    - [46, 0.0]
  - - [5056, 1, 1, 3328]
    - [63, 0.0]
  - - [2944, 256, 1, 32]
    - [35, 0.0]
  - - [5056, 6784, 1, 1280]
    - [26, 0.0]
  - - [4288, 5056, 1, 1]
    - [48, 0.0]
  - - [5056, 4288, 1, 1]
    - [48, 0.0]
  - - [128, 4288, 1, 3328]
    - [20, 0.0]
  - - [5056, 128, 1, 256]
    - [14, 0.0]
  - - [1408, 4288, 1, 1280]
    - [26, 0.0]
  - - [1856, 704, 1, 1280]
    - [26, 0.0]
  - - [4288, 1024, 1, 3328]
    - [26, 0.0]
  - - [1, 5888, 1, 3328]
    - [63, 0.0]
  - - [1024, 128, 1, 32]
    - [35, 0.0]
  - - [32, 4288, 1, 1280]
    - [46, 0.0]
  - - [1024, 5056, 1, 1]
    - [48, 0.0]
  - - [704, 3584, 1, 1280]
    - [26, 0.0]
  - - [1856, 5056, 1, 256]
    - [26, 0.0]
  - - [1408, 1024, 1, 1280]
    - [26, 0.0]
  - - [5056, 5888, 1, 3328]
    - [25, 0.0]
  - - [448, 1, 1, 1]
    - [56, 0.0]
  - - [3584, 3584, 1, 1280]
    - [26, 0.0]
  - - [2368, 3584, 1, 32]
    - [33, 0.0]
  - - [2944, 2368, 1, 1]
    - [48, 0.0]
  - - [704, 4288, 1, 1]
    - [48, 0.0]
  - - [2368, 256, 1, 32]
    - [37, 0.0]
  - - [1024, 6784, 1, 1280]
    - [26, 0.0]
  - - [1024, 3584, 1, 1]
    - [54, 0.0]
  - - [32, 5056, 1, 32]
    - [37, 0.0]
  - - [5888, 32, 1, 32]
    - [35, 0.0]
  - - [64, 128, 1, 3328]
    - [15, 0.0]
  - - [256, 5056, 1, 32]
    - [41, 0.0]
  - - [5056, 64, 1, 32]
    - [42, 0.0]
  - - [2368, 5056, 1, 32]
    - [33, 0.0]
  - - [6784, 1856, 1, 32]
    - [33, 0.0]
  - - [64, 128, 1, 1]
    - [48, 0.0]
  - - [64, 2368, 1, 1280]
    - [15, 0.0]
  - - [128, 704, 1, 32]
    - [35, 0.0]
  - - [64, 6784, 1, 3328]
    - [17, 0.0]
  - - [2944, 256, 1, 1280]
    - [26, 0.0]
  - - [5056, 704, 1, 1]
    - [48, 0.0]
  - - [2944, 4288, 1, 256]
    - [26, 0.0]
  - - [1024, 1024, 1, 3328]
    - [29, 0.0]
  - - [5056, 704, 1, 32]
    - [37, 0.0]
  - - [1856, 4288, 1, 3328]
    - [26, 0.0]
  - - [1, 1856, 1, 256]
    - [63, 0.0]
  - - [6784, 4288, 1, 32]
    - [33, 0.0]
  - - [5888, 64, 1, 256]
    - [6, 0.0]
  - - [256, 128, 1, 1]
    - [60, 0.0]
  - - [5888, 5056, 1, 256]
    - [26, 0.0]
  - - [2944, 448, 1, 256]
    - [26, 0.0]
  - - [3584, 2368, 1, 3328]
    - [26, 0.0]
  - - [4288, 1856, 1, 1]
    - [53, 0.0]
  - - [1856, 2944, 1, 1]
    - [48, 0.0]
  - - [32, 4288, 1, 3328]
    - [46, 0.0]
  - - [1, 3584, 1, 3328]
    - [64, 0.0]
  - - [256, 32, 1, 3328]
    - [46, 0.0]
  - - [1856, 2368, 1, 32]
    - [33, 0.0]
  - - [4288, 1856, 1, 32]
    - [33, 0.0]
  - - [5056, 64, 1, 3328]
    - [6, 0.0]
  - - [6784, 1, 1, 1280]
    - [63, 0.0]
  - - [1024, 448, 1, 32]
    - [35, 0.0]
  - - [1408, 64, 1, 1]
    - [55, 0.0]
  - - [1, 1, 1, 3328]
    - [64, 0.0]
  - - [5056, 2368, 1, 256]
    - [26, 0.0]
  - - [1408, 5888, 1, 256]
    - [29, 0.0]
  - - [5056, 6784, 1, 1]
    - [53, 0.0]
  - - [32, 448, 1, 1280]
    - [46, 0.0]
  - - [32, 448, 1, 32]
    - [41, 0.0]
  - - [1856, 64, 1, 256]
    - [11, 0.0]
  - - [1024, 1408, 1, 3328]
    - [26, 0.0]
  - - [256, 5056, 1, 1280]
    - [26, 0.0]
  - - [704, 2368, 1, 1]
    - [50, 0.0]
  - - [64, 1024, 1, 32]
    - [35, 0.0]
  - - [1024, 256, 1, 256]
    - [12, 0.0]
  - - [128, 1, 1, 1]
    - [64, 0.0]
  - - [3584, 4288, 1, 1280]
    - [26, 0.0]
  - - [1856, 128, 1, 32]
    - [42, 0.0]
  - - [1856, 128, 1, 1280]
    - [20, 0.0]
  - - [128, 2944, 1, 3328]
    - [14, 0.0]
  - - [1, 6784, 1, 3328]
    - [63, 0.0]
  - - [3584, 2368, 1, 1]
    - [54, 0.0]
  - - [4288, 448, 1, 3328]
    - [26, 0.0]
  - - [4288, 32, 1, 3328]
    - [46, 0.0]
  - - [256, 1856, 1, 1]
    - [50, 0.0]
  - - [704, 6784, 1, 1280]
    - [26, 0.0]
  - - [2368, 4288, 1, 32]
    - [33, 0.0]
  - - [704, 5056, 1, 1280]
    - [26, 0.0]
  - - [256, 3584, 1, 3328]
    - [29, 0.0]
  - - [1024, 32, 1, 3328]
    - [46, 0.0]
  - - [3584, 6784, 1, 32]
    - [33, 0.0]
  - - [3584, 6784, 1, 1280]
    - [26, 0.0]
  - - [4288, 4288, 1, 3328]
    - [26, 0.0]
  - - [3584, 64, 1, 1280]
    - [20, 0.0]
  - - [64, 1856, 1, 256]
    - [3, 0.0]
  - - [3584, 64, 1, 32]
    - [42, 0.0]
  - - [448, 1, 1, 1280]
    - [64, 0.0]
  - - [256, 4288, 1, 1280]
    - [26, 0.0]
  - - [1408, 3584, 1, 1]
    - [47, 0.0]
  - - [4288, 1856, 1, 3328]
    - [26, 0.0]
  - - [1856, 2944, 1, 1280]
    - [26, 0.0]
  - - [4288, 256, 1, 256]
    - [26, 0.0]
  - - [128, 5888, 1, 32]
    - [41, 0.0]
  - - [128, 5888, 1, 1280]
    - [26, 0.0]
  - - [1408, 128, 1, 3328]
    - [18, 0.0]
  - - [3584, 256, 1, 256]
    - [26, 0.0]
  - - [32, 6784, 1, 3328]
    - [46, 0.0]
  - - [64, 64, 1, 1280]
    - [15, 0.0]
  - - [32, 3584, 1, 256]
    - [46, 0.0]
  - - [704, 256, 1, 32]
    - [35, 0.0]
  - - [448, 128, 1, 3328]
    - [15, 0.0]
  - - [64, 2944, 1, 3328]
    - [18, 0.0]
  - - [64, 4288, 1, 3328]
    - [2, 0.0]
  - - [5056, 1024, 1, 3328]
    - [29, 0.0]
  - - [128, 256, 1, 1280]
    - [15, 0.0]
  - - [1856, 256, 1, 256]
    - [12, 0.0]
  - - [3584, 704, 1, 1]
    - [53, 0.0]
  - - [256, 704, 1, 256]
    - [12, 0.0]
  - - [448, 5056, 1, 1]
    - [53, 0.0]
  - - [5888, 5888, 1, 256]
    - [26, 0.0]
  - - [3584, 704, 1, 32]
    - [41, 0.0]
  - - [448, 6784, 1, 3328]
    - [26, 0.0]
  - - [6784, 4288, 1, 1]
    - [49, 0.0]
  - - [3584, 6784, 1, 1]
    - [47, 0.0]
  - - [1408, 2368, 1, 32]
    - [33, 0.0]
  - - [448, 5056, 1, 32]
    - [37, 0.0]
  - - [4288, 4288, 1, 1280]
    - [26, 0.0]
  - - [6784, 1408, 1, 1]
    - [47, 0.0]
  - - [1856, 5888, 1, 3328]
    - [26, 0.0]
  - - [1024, 704, 1, 1]
    - [50, 0.0]
  - - [3584, 1856, 1, 3328]
    - [26, 0.0]
  - - [5056, 5888, 1, 1]
    - [48, 0.0]
  - - [2944, 1024, 1, 256]
    - [26, 0.0]
  - - [448, 1408, 1, 3328]
    - [26, 0.0]
  - - [5056, 32, 1, 3328]
    - [46, 0.0]
  - - [2368, 4288, 1, 3328]
    - [26, 0.0]
  - - [1024, 704, 1, 32]
    - [42, 0.0]
  - - [448, 2944, 1, 256]
    - [26, 0.0]
  - - [2944, 6784, 1, 256]
    - [26, 0.0]
  - - [2368, 2368, 1, 1280]
    - [26, 0.0]
  - - [5888, 128, 1, 3328]
    - [26, 0.0]
  - - [256, 256, 1, 32]
    - [35, 0.0]
  - - [1024, 1, 1, 256]
    - [63, 0.0]
  - - [3584, 3584, 1, 32]
    - [33, 0.0]
  - - [2944, 448, 1, 1]
    - [63, 0.0]
  - - [128, 32, 1, 32]
    - [35, 0.0]
  - - [5056, 64, 1, 1280]
    - [6, 0.0]
  - - [2944, 2944, 1, 1280]
    - [26, 0.0]
  - - [1, 2368, 1, 256]
    - [63, 0.0]
  - - [1408, 5056, 1, 1]
    - [47, 0.0]
  - - [2944, 32, 1, 1280]
    - [46, 0.0]
  - - [64, 1408, 1, 3328]
    - [15, 0.0]
  - - [256, 448, 1, 1280]
    - [15, 0.0]
  - - [2368, 6784, 1, 1]
    - [48, 0.0]
  - - [6784, 4288, 1, 1280]
    - [26, 0.0]
  - - [2944, 704, 1, 256]
    - [26, 0.0]
  - - [2368, 6784, 1, 1280]
    - [26, 0.0]
  - - [704, 2944, 1, 3328]
    - [13, 0.0]
  - - [5888, 256, 1, 1]
    - [48, 0.0]
  - - [704, 704, 1, 32]
    - [37, 0.0]
  - - [256, 4288, 1, 256]
    - [26, 0.0]
  - - [5056, 6784, 1, 32]
    - [33, 0.0]
  - - [5056, 128, 1, 1]
    - [48, 0.0]
  - - [448, 5056, 1, 1280]
    - [26, 0.0]
  - - [448, 448, 1, 256]
    - [12, 0.0]
  - - [256, 5888, 1, 3328]
    - [26, 0.0]
  - - [704, 448, 1, 1280]
    - [12, 0.0]
  - - [448, 64, 1, 256]
    - [3, 0.0]
  - - [1024, 704, 1, 1280]
    - [26, 0.0]
  - - [5888, 1024, 1, 1]
    - [52, 0.0]
  - - [5888, 448, 1, 32]
    - [41, 0.0]
  - - [6784, 2944, 1, 256]
    - [26, 0.0]
  - - [1024, 256, 1, 1]
    - [48, 0.0]
  - - [2368, 448, 1, 256]
    - [26, 0.0]
  - - [4288, 256, 1, 3328]
    - [26, 0.0]
  - - [4288, 2944, 1, 256]
    - [26, 0.0]
  - - [448, 5888, 1, 3328]
    - [26, 0.0]
  - - [128, 256, 1, 3328]
    - [15, 0.0]
  - - [128, 6784, 1, 32]
    - [37, 0.0]
  - - [1856, 64, 1, 32]
    - [35, 0.0]
  - - [1408, 4288, 1, 1]
    - [47, 0.0]
  - - [1408, 1856, 1, 3328]
    - [26, 0.0]
  - - [4288, 64, 1, 256]
    - [18, 0.0]
  - - [3584, 1024, 1, 3328]
    - [26, 0.0]
  - - [2944, 5888, 1, 3328]
    - [26, 0.0]
  - - [128, 6784, 1, 3328]
    - [6, 0.0]
  - - [448, 4288, 1, 3328]
    - [26, 0.0]
  - - [704, 2368, 1, 256]
    - [26, 0.0]
  - - [1, 64, 1, 3328]
    - [64, 0.0]
  - - [4288, 128, 1, 1]
    - [48, 0.0]
  - - [256, 2368, 1, 32]
    - [42, 0.0]
  - - [4288, 3584, 1, 3328]
    - [26, 0.0]
  - - [1408, 64, 1, 256]
    - [2, 0.0]
  - - [1408, 1024, 1, 1]
    - [47, 0.0]
  - - [64, 1024, 1, 1]
    - [55, 0.0]
  - - [1408, 1024, 1, 256]
    - [26, 0.0]
  - - [5056, 3584, 1, 1]
    - [53, 0.0]
  - - [448, 1024, 1, 256]
    - [26, 0.0]
  - - [6784, 6784, 1, 3328]
    - [29, 0.0]
  - - [6784, 32, 1, 32]
    - [41, 0.0]
  - - [64, 1024, 1, 3328]
    - [15, 0.0]
  - - [2368, 2944, 1, 3328]
    - [26, 0.0]
  - - [448, 448, 1, 1280]
    - [20, 0.0]
  - - [5056, 3584, 1, 32]
    - [33, 0.0]
  - - [5056, 3584, 1, 1280]
    - [26, 0.0]
  - - [1856, 1856, 1, 256]
    - [26, 0.0]
  - - [32, 5888, 1, 256]
    - [46, 0.0]
  - - [256, 1408, 1, 32]
    - [42, 0.0]
  - - [2944, 1, 1, 3328]
    - [64, 0.0]
  - - [32, 704, 1, 3328]
    - [46, 0.0]
  - - [5888, 4288, 1, 1]
    - [52, 0.0]
  - - [1024, 128, 1, 256]
    - [1, 0.0]
  - - [32, 1856, 1, 3328]
    - [46, 0.0]
  - - [5056, 704, 1, 256]
    - [26, 0.0]
  - - [2368, 5056, 1, 256]
    - [26, 0.0]
  - - [1024, 5056, 1, 256]
    - [26, 0.0]
  - - [32, 1024, 1, 3328]
    - [46, 0.0]
  - - [5888, 448, 1, 256]
    - [26, 0.0]
  - - [6784, 5056, 1, 1280]
    - [26, 0.0]
  - - [4288, 6784, 1, 1280]
    - [26, 0.0]
  - - [64, 1, 1, 256]
    - [63, 0.0]
  - - [1856, 64, 1, 1280]
    - [18, 0.0]
  - - [128, 1408, 1, 1]
    - [50, 0.0]
  - - [1024, 64, 1, 32]
    - [35, 0.0]
  - - [1024, 64, 1, 3328]
    - [15, 0.0]
  - - [704, 6784, 1, 3328]
    - [26, 0.0]
  - - [2944, 1856, 1, 1]
    - [48, 0.0]
  - - [5888, 4288, 1, 1280]
    - [26, 0.0]
  - - [5888, 3584, 1, 1280]
    - [26, 0.0]
  - - [32, 2368, 1, 1280]
    - [46, 0.0]
  - - [3584, 1408, 1, 1280]
    - [26, 0.0]
  - - [1024, 2944, 1, 256]
    - [29, 0.0]
  - - [1, 2944, 1, 1280]
    - [64, 0.0]
  - - [32, 1024, 1, 256]
    - [42, 0.0]
  - - [2944, 1856, 1, 1280]
    - [26, 0.0]
  - - [3584, 1, 1, 1280]
    - [64, 0.0]
  - - [256, 3584, 1, 32]
    - [41, 0.0]
  - - [1024, 2368, 1, 1]
    - [47, 0.0]
  - - [2944, 3584, 1, 1280]
    - [26, 0.0]
  - - [64, 1, 1, 1]
    - [53, 0.0]
  - - [1856, 4288, 1, 256]
    - [26, 0.0]
  - - [256, 1, 1, 256]
    - [63, 0.0]
  - - [256, 128, 1, 3328]
    - [15, 0.0]
  - - [1, 1856, 1, 3328]
    - [64, 0.0]
  - - [448, 3584, 1, 1]
    - [53, 0.0]
  - - [2368, 2944, 1, 32]
    - [33, 0.0]
  - - [128, 4288, 1, 32]
    - [42, 0.0]
  - - [448, 256, 1, 256]
    - [11, 0.0]
  - - [64, 64, 1, 1]
    - [53, 0.0]
  - - [1, 1408, 1, 1]
    - [48, 0.0]
  - - [2944, 32, 1, 32]
    - [35, 0.0]
  - - [448, 1856, 1, 1]
    - [59, 0.0]
  - - [4288, 704, 1, 256]
    - [26, 0.0]
  - - [1856, 1024, 1, 256]
    - [26, 0.0]
  - - [448, 1856, 1, 32]
    - [37, 0.0]
  - - [448, 1856, 1, 3328]
    - [21, 0.0]
  - - [448, 448, 1, 32]
    - [43, 0.0]
  - - [1024, 448, 1, 256]
    - [26, 0.0]
  - - [6784, 1, 1, 256]
    - [63, 0.0]
  - - [704, 6784, 1, 32]
    - [33, 0.0]
  - - [1024, 4288, 1, 1]
    - [48, 0.0]
  - - [704, 256, 1, 3328]
    - [20, 0.0]
  - - [704, 1856, 1, 32]
    - [41, 0.0]
  - - [1408, 5888, 1, 1280]
    - [26, 0.0]
  - - [32, 704, 1, 1280]
    - [46, 0.0]
  - - [5056, 1856, 1, 256]
    - [26, 0.0]
  - - [6784, 704, 1, 1280]
    - [26, 0.0]
  - - [704, 1408, 1, 32]
    - [41, 0.0]
  - - [5888, 1024, 1, 256]
    - [26, 0.0]
  - - [64, 2944, 1, 1]
    - [53, 0.0]
  - - [64, 2944, 1, 32]
    - [37, 0.0]
  - - [64, 2944, 1, 1280]
    - [15, 0.0]
  - - [6784, 1856, 1, 3328]
    - [26, 0.0]
  - - [2368, 5888, 1, 1280]
    - [26, 0.0]
  - - [5888, 6784, 1, 32]
    - [33, 0.0]
  - - [1, 6784, 1, 256]
    - [63, 0.0]
  - - [6784, 6784, 1, 32]
    - [33, 0.0]
  - - [256, 1, 1, 1280]
    - [64, 0.0]
  - - [5888, 128, 1, 32]
    - [37, 0.0]
  - - [6784, 256, 1, 256]
    - [26, 0.0]
  - - [2368, 3584, 1, 3328]
    - [26, 0.0]
  - - [128, 4288, 1, 1280]
    - [26, 0.0]
  - - [32, 3584, 1, 1280]
    - [46, 0.0]
  - - [5888, 1024, 1, 1280]
    - [26, 0.0]
  - - [1856, 704, 1, 3328]
    - [26, 0.0]
  - - [5888, 6784, 1, 3328]
    - [26, 0.0]
  - - [6784, 448, 1, 1]
    - [48, 0.0]
  - - [6784, 1856, 1, 1]
    - [49, 0.0]
  - - [128, 32, 1, 1280]
    - [46, 0.0]
  - - [2944, 2368, 1, 1280]
    - [26, 0.0]
  - - [128, 256, 1, 1]
    - [49, 0.0]
  - - [6784, 448, 1, 32]
    - [37, 0.0]
  - - [6784, 448, 1, 3328]
    - [26, 0.0]
  - - [1, 6784, 1, 1]
    - [53, 0.0]
  - - [448, 3584, 1, 1280]
    - [26, 0.0]
  - - [1408, 6784, 1, 1280]
    - [26, 0.0]
  - - [5056, 5888, 1, 1280]
    - [26, 0.0]
  - - [32, 2944, 1, 32]
    - [35, 0.0]
  - - [5888, 704, 1, 1]
    - [53, 0.0]
  - - [3584, 1856, 1, 1]
    - [53, 0.0]
  - - [1, 256, 1, 256]
    - [64, 0.0]
  - - [5056, 2944, 1, 32]
    - [33, 0.0]
  - - [32, 6784, 1, 256]
    - [46, 0.0]
  - - [4288, 6784, 1, 1]
    - [48, 0.0]
  - - [1, 4288, 1, 3328]
    - [63, 0.0]
  - - [1024, 6784, 1, 1]
    - [54, 0.0]
  - - [2368, 5888, 1, 32]
    - [33, 0.0]
  - - [448, 448, 1, 3328]
    - [20, 0.0]
  - - [1, 256, 1, 1]
    - [50, 0.0]
  - - [3584, 4288, 1, 1]
    - [54, 0.0]
  - - [5888, 1024, 1, 3328]
    - [26, 0.0]
  - - [6784, 5888, 1, 256]
    - [26, 0.0]
  - - [704, 128, 1, 1280]
    - [18, 0.0]
  - - [4288, 128, 1, 256]
    - [26, 0.0]
  - - [5056, 1024, 1, 1]
    - [48, 0.0]
  - - [32, 3584, 1, 3328]
    - [46, 0.0]
  - - [1024, 1, 1, 1280]
    - [64, 0.0]
  - - [4288, 2368, 1, 32]
    - [33, 0.0]
  - - [704, 3584, 1, 1]
    - [50, 0.0]
  - - [704, 1856, 1, 3328]
    - [26, 0.0]
  - - [2944, 128, 1, 1280]
    - [6, 0.0]
  - - [1, 2368, 1, 3328]
    - [64, 0.0]
  - - [6784, 704, 1, 32]
    - [33, 0.0]
  - - [4288, 1, 1, 1280]
    - [63, 0.0]
  - - [704, 5888, 1, 256]
    - [26, 0.0]
  - - [2368, 3584, 1, 1280]
    - [26, 0.0]
  - - [64, 448, 1, 256]
    - [3, 0.0]
  - - [1408, 448, 1, 1280]
    - [26, 0.0]
  - - [3584, 5056, 1, 32]
    - [33, 0.0]
  - - [1024, 32, 1, 1280]
    - [46, 0.0]
  - - [128, 2368, 1, 1]
    - [55, 0.0]
  - - [6784, 1856, 1, 1280]
    - [26, 0.0]
  - - [5056, 5056, 1, 3328]
    - [27, 0.0]
  - - [128, 704, 1, 1280]
    - [18, 0.0]
  - - [128, 2944, 1, 1280]
    - [6, 0.0]
  - - [2368, 5056, 1, 1]
    - [53, 0.0]
  - - [5888, 1408, 1, 256]
    - [29, 0.0]
  - - [2368, 1024, 1, 32]
    - [33, 0.0]
  - - [256, 256, 1, 3328]
    - [15, 0.0]
  - - [64, 4288, 1, 1]
    - [48, 0.0]
  - - [4288, 1024, 1, 256]
    - [26, 0.0]
  - - [3584, 32, 1, 32]
    - [42, 0.0]
  - - [3584, 64, 1, 1]
    - [59, 0.0]
  - - [704, 32, 1, 1280]
    - [46, 0.0]
  - - [32, 4288, 1, 32]
    - [46, 0.0]
  - - [64, 64, 1, 3328]
    - [15, 0.0]
  - - [64, 1408, 1, 1]
    - [55, 0.0]
  - - [4288, 5888, 1, 1280]
    - [26, 0.0]
  - - [1856, 2944, 1, 3328]
    - [26, 0.0]
  - - [256, 1024, 1, 256]
    - [12, 0.0]
  - - [5056, 5888, 1, 256]
    - [26, 0.0]
  - - [1408, 128, 1, 1280]
    - [18, 0.0]
  - - [5056, 256, 1, 3328]
    - [26, 0.0]
  - - [1024, 5888, 1, 1280]
    - [26, 0.0]
  - - [1024, 448, 1, 1]
    - [53, 0.0]
  - - [32, 32, 1, 32]
    - [37, 0.0]
  - - [5056, 1, 1, 1280]
    - [63, 0.0]
  - - [5888, 5056, 1, 1280]
    - [26, 0.0]
  - - [5888, 2944, 1, 1]
    - [47, 0.0]
  - - [64, 4288, 1, 1280]
    - [10, 0.0]
  - - [1408, 4288, 1, 3328]
    - [26, 0.0]
  - - [704, 2944, 1, 32]
    - [33, 0.0]
  - - [1, 5888, 1, 1280]
    - [63, 0.0]
  - - [2944, 4288, 1, 3328]
    - [26, 0.0]
  - - [256, 2944, 1, 256]
    - [26, 0.0]
  - - [704, 448, 1, 32]
    - [42, 0.0]
  - - [5056, 2944, 1, 256]
    - [26, 0.0]
  - - [704, 1024, 1, 256]
    - [26, 0.0]
  - - [2368, 1856, 1, 256]
    - [26, 0.0]
  - - [64, 3584, 1, 1]
    - [50, 0.0]
  - - [1024, 128, 1, 1280]
    - [18, 0.0]
  - - [2368, 4288, 1, 1280]
    - [26, 0.0]
  - - [3584, 448, 1, 256]
    - [26, 0.0]
  - - [256, 6784, 1, 256]
    - [26, 0.0]
  - - [1024, 32, 1, 32]
    - [35, 0.0]
  - - [1024, 1408, 1, 1]
    - [48, 0.0]
  - - [128, 64, 1, 32]
    - [35, 0.0]
  - - [64, 1, 1, 1280]
    - [64, 0.0]
  - - [2368, 32, 1, 32]
    - [35, 0.0]
  - - [256, 5888, 1, 1]
    - [53, 0.0]
  - - [2944, 2944, 1, 1]
    - [47, 0.0]
  - - [6784, 3584, 1, 256]
    - [26, 0.0]
  - - [1408, 1856, 1, 256]
    - [26, 0.0]
  - - [128, 1408, 1, 256]
    - [1, 0.0]
  - - [2944, 2944, 1, 32]
    - [33, 0.0]
  - - [2944, 2944, 1, 3328]
    - [26, 0.0]
  - - [1, 2944, 1, 256]
    - [63, 0.0]
  - - [448, 32, 1, 1280]
    - [46, 0.0]
  - - [3584, 1, 1, 256]
    - [59, 0.0]
  - - [704, 32, 1, 3328]
    - [46, 0.0]
  - - [256, 448, 1, 3328]
    - [18, 0.0]
  - - [128, 128, 1, 256]
    - [3, 0.0]
  - - [2368, 64, 1, 256]
    - [18, 0.0]
  - - [64, 448, 1, 1280]
    - [15, 0.0]
  - - [6784, 1408, 1, 32]
    - [33, 0.0]
  - - [1408, 448, 1, 3328]
    - [26, 0.0]
  - - [2368, 6784, 1, 3328]
    - [26, 0.0]
  - - [256, 2368, 1, 1]
    - [61, 0.0]
  - - [4288, 3584, 1, 32]
    - [33, 0.0]
  - - [5888, 64, 1, 3328]
    - [6, 0.0]
  - - [3584, 704, 1, 1280]
    - [26, 0.0]
  - - [448, 5056, 1, 3328]
    - [26, 0.0]
  - - [4288, 448, 1, 256]
    - [26, 0.0]
  - - [5056, 256, 1, 1280]
    - [26, 0.0]
  - - [704, 448, 1, 3328]
    - [20, 0.0]
  - - [2944, 5888, 1, 32]
    - [33, 0.0]
  - - [3584, 5056, 1, 256]
    - [26, 0.0]
  - - [6784, 1, 1, 3328]
    - [63, 0.0]
  - - [32, 2368, 1, 3328]
    - [46, 0.0]
  - - [4288, 256, 1, 1]
    - [49, 0.0]
  - - [64, 256, 1, 1]
    - [53, 0.0]
  - - [1856, 448, 1, 3328]
    - [26, 0.0]
  - - [3584, 2368, 1, 256]
    - [26, 0.0]
  - - [4288, 4288, 1, 256]
    - [26, 0.0]
  - - [4288, 256, 1, 1280]
    - [26, 0.0]
  - - [448, 5056, 1, 256]
    - [26, 0.0]
  - - [128, 1856, 1, 1]
    - [50, 0.0]
  - - [4288, 704, 1, 1280]
    - [26, 0.0]
  - - [128, 1856, 1, 32]
    - [46, 0.0]
  - - [2368, 704, 1, 1]
    - [53, 0.0]
  - - [3584, 32, 1, 256]
    - [46, 0.0]
  - - [448, 2368, 1, 1280]
    - [26, 0.0]
  - - [3584, 256, 1, 1]
    - [48, 0.0]
  - - [1408, 1856, 1, 1280]
    - [26, 0.0]
  - - [3584, 4288, 1, 3328]
    - [26, 0.0]
  - - [448, 4288, 1, 32]
    - [33, 0.0]
  - - [448, 4288, 1, 1280]
    - [26, 0.0]
  - - [64, 3584, 1, 256]
    - [12, 0.0]
  - - [1, 6784, 1, 1280]
    - [63, 0.0]
  - - [5056, 1024, 1, 256]
    - [26, 0.0]
  - - [2368, 448, 1, 32]
    - [37, 0.0]
  - - [4288, 3584, 1, 1280]
    - [26, 0.0]
  - - [32, 2944, 1, 1280]
    - [46, 0.0]
  - - [1408, 704, 1, 1]
    - [50, 0.0]
  - - [2368, 256, 1, 256]
    - [26, 0.0]
  - - [1, 5056, 1, 1]
    - [53, 0.0]
  - - [4288, 32, 1, 32]
    - [42, 0.0]
  - - [1856, 3584, 1, 32]
    - [33, 0.0]
  - - [5056, 3584, 1, 3328]
    - [24, 0.0]
  - - [4288, 5056, 1, 256]
    - [26, 0.0]
  - - [1856, 5888, 1, 256]
    - [26, 0.0]
  - - [256, 256, 1, 256]
    - [11, 0.0]
  - - [2368, 3584, 1, 1]
    - [48, 0.0]
  - - [4288, 2368, 1, 256]
    - [26, 0.0]
  - - [448, 1, 1, 3328]
    - [64, 0.0]
  - - [1856, 256, 1, 1280]
    - [20, 0.0]
  - - [256, 2944, 1, 1]
    - [49, 0.0]
  - - [1408, 2944, 1, 3328]
    - [26, 0.0]
  - - [32, 1856, 1, 32]
    - [35, 0.0]
  - - [5888, 3584, 1, 1]
    - [52, 0.0]
  - - [256, 1, 1, 1]
    - [55, 0.0]
  - - [6784, 5056, 1, 3328]
    - [26, 0.0]
  - - [6784, 5056, 1, 1]
    - [47, 0.0]
  - - [5888, 3584, 1, 32]
    - [33, 0.0]
  - - [5888, 3584, 1, 3328]
    - [26, 0.0]
  - - [32, 1024, 1, 1280]
    - [46, 0.0]
  - - [1, 256, 1, 3328]
    - [64, 0.0]
  - - [1024, 6784, 1, 256]
    - [26, 0.0]
  - - [6784, 5888, 1, 32]
    - [33, 0.0]
  - - [1408, 1, 1, 1280]
    - [64, 0.0]
  - - [2368, 6784, 1, 32]
    - [33, 0.0]
  - - [6784, 64, 1, 1]
    - [53, 0.0]
  - - [5056, 1408, 1, 1280]
    - [29, 0.0]
  - - [3584, 1408, 1, 3328]
    - [26, 0.0]
  - - [2944, 3584, 1, 1]
    - [47, 0.0]
  - - [2944, 1408, 1, 1280]
    - [26, 0.0]
  - - [1856, 64, 1, 1]
    - [48, 0.0]
  - - [3584, 1024, 1, 1]
    - [48, 0.0]
  - - [256, 32, 1, 256]
    - [46, 0.0]
  - - [2944, 1856, 1, 3328]
    - [26, 0.0]
  - - [128, 1024, 1, 3328]
    - [15, 0.0]
  - - [1408, 128, 1, 1]
    - [53, 0.0]
  - - [2944, 3584, 1, 32]
    - [33, 0.0]
  - - [5888, 256, 1, 32]
    - [40, 0.0]
  - - [6784, 64, 1, 256]
    - [26, 0.0]
  - - [256, 128, 1, 1280]
    - [15, 0.0]
  - - [6784, 5056, 1, 256]
    - [26, 0.0]
  - - [1408, 32, 1, 3328]
    - [46, 0.0]
  - - [1856, 3584, 1, 1280]
    - [26, 0.0]
  - - [256, 5888, 1, 256]
    - [26, 0.0]
  - - [5056, 32, 1, 256]
    - [46, 0.0]
  - - [1024, 4288, 1, 3328]
    - [26, 0.0]
  - - [448, 2368, 1, 256]
    - [26, 0.0]
  - - [64, 1408, 1, 1280]
    - [15, 0.0]
  - - [3584, 32, 1, 1280]
    - [46, 0.0]
  - - [128, 2368, 1, 3328]
    - [6, 0.0]
  - - [64, 5056, 1, 256]
    - [6, 0.0]
  - - [256, 64, 1, 256]
    - [3, 0.0]
  - - [32, 1408, 1, 256]
    - [42, 0.0]
  - - [2368, 448, 1, 3328]
    - [26, 0.0]
  - - [2368, 1408, 1, 1]
    - [48, 0.0]
  - - [1, 1, 1, 1]
    - [53, 0.0]
  - - [1024, 1856, 1, 32]
    - [33, 0.0]
  - - [32, 1024, 1, 32]
    - [34, 0.0]
  - - [4288, 1, 1, 256]
    - [63, 0.0]
  - - [1856, 128, 1, 3328]
    - [20, 0.0]
  - - [5888, 2368, 1, 1]
    - [53, 0.0]
  - - [2368, 2368, 1, 1]
    - [48, 0.0]
  - - [704, 256, 1, 1280]
    - [20, 0.0]
  - - [704, 4288, 1, 256]
    - [26, 0.0]
  - - [5888, 2368, 1, 32]
    - [33, 0.0]
  - - [5888, 2368, 1, 1280]
    - [25, 0.0]
  - - [128, 256, 1, 256]
    - [3, 0.0]
  - - [2944, 5056, 1, 3328]
    - [26, 0.0]
  - - [6784, 704, 1, 3328]
    - [26, 0.0]
  - - [1856, 1856, 1, 32]
    - [33, 0.0]
  - - [4288, 2944, 1, 32]
    - [33, 0.0]
  - - [256, 5056, 1, 1]
    - [49, 0.0]
  - - [704, 64, 1, 256]
    - [3, 0.0]
  - - [256, 2368, 1, 3328]
    - [26, 0.0]
  - - [704, 1, 1, 1]
    - [48, 0.0]
  - - [128, 448, 1, 1280]
    - [15, 0.0]
  - - [5056, 5056, 1, 256]
    - [26, 0.0]
  - - [5888, 256, 1, 256]
    - [26, 0.0]
  - - [5888, 64, 1, 1]
    - [50, 0.0]
  - - [6784, 6784, 1, 256]
    - [29, 0.0]
  - - [256, 3584, 1, 1]
    - [48, 0.0]
  - - [2368, 1, 1, 256]
    - [63, 0.0]
  - - [448, 32, 1, 32]
    - [35, 0.0]
  - - [704, 64, 1, 1]
    - [61, 0.0]
  - - [3584, 704, 1, 3328]
    - [26, 0.0]
  - - [4288, 704, 1, 3328]
    - [26, 0.0]
  - - [4288, 2944, 1, 1280]
    - [26, 0.0]
  - - [448, 3584, 1, 256]
    - [26, 0.0]
  - - [704, 32, 1, 256]
    - [42, 0.0]
  - - [6784, 256, 1, 32]
    - [41, 0.0]
  - - [1856, 128, 1, 1]
    - [50, 0.0]
  - - [1856, 32, 1, 32]
    - [35, 0.0]
  - - [6784, 1408, 1, 1280]
    - [26, 0.0]
  - - [2368, 5056, 1, 1280]
    - [26, 0.0]
  - - [704, 1856, 1, 1280]
    - [26, 0.0]
  - - [1408, 1408, 1, 1280]
    - [29, 0.0]
  - - [448, 1024, 1, 3328]
    - [26, 0.0]
  - - [32, 704, 1, 32]
    - [35, 0.0]
  - - [256, 704, 1, 1]
    - [53, 0.0]
  - - [5888, 1856, 1, 32]
    - [33, 0.0]
  - - [5888, 704, 1, 3328]
    - [26, 0.0]
  - - [5056, 1, 1, 256]
    - [63, 0.0]
  - - [448, 6784, 1, 256]
    - [26, 0.0]
  - - [1024, 128, 1, 1]
    - [55, 0.0]
  - - [128, 64, 1, 256]
    - [3, 0.0]
  - - [1856, 128, 1, 256]
    - [12, 0.0]
  - - [2944, 5888, 1, 256]
    - [26, 0.0]
  - - [1024, 256, 1, 1280]
    - [20, 0.0]
  - - [128, 5056, 1, 32]
    - [37, 0.0]
  - - [128, 5056, 1, 1280]
    - [26, 0.0]
  - - [448, 32, 1, 3328]
    - [46, 0.0]
  - - [1856, 1408, 1, 32]
    - [33, 0.0]
  - - [64, 704, 1, 32]
    - [35, 0.0]
  - - [64, 704, 1, 3328]
    - [15, 0.0]
  - - [64, 2368, 1, 32]
    - [35, 0.0]
  - - [5888, 64, 1, 32]
    - [44, 0.0]
  - - [2368, 256, 1, 1]
    - [63, 0.0]
  - - [5888, 64, 1, 1280]
    - [14, 0.0]
  - - [5056, 1, 1, 1]
    - [61, 0.0]
  - - [5888, 2944, 1, 1280]
    - [29, 0.0]
  - - [32, 2368, 1, 256]
    - [42, 0.0]
  - - [256, 1408, 1, 256]
    - [12, 0.0]
  - - [448, 5888, 1, 1]
    - [53, 0.0]
  - - [3584, 1408, 1, 1]
    - [47, 0.0]
  - - [32, 6784, 1, 1280]
    - [46, 0.0]
  - - [32, 6784, 1, 32]
    - [42, 0.0]
  - - [448, 5888, 1, 32]
    - [33, 0.0]
  - - [5056, 704, 1, 1280]
    - [26, 0.0]
  - - [1856, 6784, 1, 1]
    - [53, 0.0]
  - - [5056, 64, 1, 1]
    - [55, 0.0]
  - - [1, 5888, 1, 1]
    - [48, 0.0]
  - - [2368, 1024, 1, 256]
    - [26, 0.0]
  - - [1856, 6784, 1, 32]
    - [33, 0.0]
  - - [1856, 6784, 1, 1280]
    - [26, 0.0]
  - - [64, 3584, 1, 3328]
    - [17, 0.0]
  - - [5888, 5056, 1, 3328]
    - [24, 0.0]
  - - [1, 2944, 1, 3328]
    - [64, 0.0]
  - - [1408, 6784, 1, 32]
    - [33, 0.0]
  - - [32, 5888, 1, 1280]
    - [46, 0.0]
  - - [448, 256, 1, 1]
    - [48, 0.0]
  - - [3584, 5888, 1, 3328]
    - [26, 0.0]
  - - [4288, 1408, 1, 256]
    - [26, 0.0]
  - - [448, 64, 1, 1280]
    - [15, 0.0]
  - - [128, 448, 1, 32]
    - [45, 0.0]
  - - [6784, 2368, 1, 256]
    - [26, 0.0]
  - - [1408, 448, 1, 32]
    - [37, 0.0]
  - - [1856, 1408, 1, 1280]
    - [26, 0.0]
  - - [448, 256, 1, 3328]
    - [18, 0.0]
  - - [1856, 2368, 1, 1]
    - [48, 0.0]
  - - [1408, 5056, 1, 3328]
    - [26, 0.0]
  - - [128, 704, 1, 3328]
    - [15, 0.0]
  - - [5056, 128, 1, 1280]
    - [6, 0.0]
  - - [5056, 4288, 1, 256]
    - [26, 0.0]
  - - [5056, 5056, 1, 32]
    - [33, 0.0]
  - - [1856, 704, 1, 256]
    - [26, 0.0]
  - - [64, 256, 1, 256]
    - [3, 0.0]
  - - [448, 5888, 1, 1280]
    - [26, 0.0]
  - - [128, 6784, 1, 256]
    - [6, 0.0]
  - - [5056, 448, 1, 256]
    - [26, 0.0]
  - - [4288, 5888, 1, 1]
    - [48, 0.0]
  - - [1856, 5056, 1, 1280]
    - [26, 0.0]
  - - [2368, 4288, 1, 1]
    - [53, 0.0]
  - - [2368, 32, 1, 3328]
    - [46, 0.0]
  - - [3584, 1856, 1, 256]
    - [26, 0.0]
  - - [256, 3584, 1, 256]
    - [26, 0.0]
  - - [64, 704, 1, 1]
    - [53, 0.0]
  - - [4288, 5888, 1, 32]
    - [33, 0.0]
  - - [4288, 5888, 1, 3328]
    - [26, 0.0]
  - - [1, 1024, 1, 1]
    - [53, 0.0]
  - - [1024, 2944, 1, 3328]
    - [26, 0.0]
  - - [2944, 2368, 1, 256]
    - [26, 0.0]
  - - [1024, 1856, 1, 256]
    - [26, 0.0]
  - - [2944, 64, 1, 3328]
    - [19, 0.0]
  - - [1024, 5888, 1, 32]
    - [41, 0.0]
  - - [1024, 5888, 1, 3328]
    - [26, 0.0]
  - - [5056, 2368, 1, 32]
    - [33, 0.0]
  - - [1408, 2368, 1, 1280]
    - [26, 0.0]
  - - [256, 1, 1, 3328]
    - [64, 0.0]
  - - [128, 1024, 1, 32]
    - [35, 0.0]
  - - [5056, 6784, 1, 3328]
    - [26, 0.0]
  - - [448, 704, 1, 1]
    - [63, 0.0]
  - - [32, 64, 1, 32]
    - [35, 0.0]
  - - [448, 704, 1, 32]
    - [42, 0.0]
  - - [448, 704, 1, 3328]
    - [20, 0.0]
  - - [1408, 2944, 1, 256]
    - [29, 0.0]
  - - [64, 5888, 1, 1]
    - [58, 0.0]
  - - [2368, 128, 1, 32]
    - [42, 0.0]
  - - [2368, 256, 1, 1280]
    - [26, 0.0]
  - - [2368, 128, 1, 3328]
    - [14, 0.0]
  - - [704, 5056, 1, 32]
    - [33, 0.0]
  - - [32, 2368, 1, 32]
    - [35, 0.0]
  - - [1408, 1, 1, 256]
    - [63, 0.0]
  - - [4288, 256, 1, 32]
    - [41, 0.0]
  - - [448, 1408, 1, 1]
    - [59, 0.0]
  - - [5056, 4288, 1, 1280]
    - [26, 0.0]
  - - [1408, 256, 1, 256]
    - [26, 0.0]
  - - [4288, 448, 1, 1]
    - [48, 0.0]
  - - [256, 4288, 1, 32]
    - [37, 0.0]
  - - [1408, 256, 1, 1280]
    - [20, 0.0]
  - - [256, 256, 1, 1]
    - [48, 0.0]
  - - [1408, 1, 1, 1]
    - [55, 0.0]
  - - [448, 1408, 1, 256]
    - [26, 0.0]
  - - [5888, 5888, 1, 1]
    - [52, 0.0]
  - - [128, 2944, 1, 32]
    - [42, 0.0]
  - - [32, 256, 1, 32]
    - [42, 0.0]
  - - [2944, 704, 1, 1280]
    - [26, 0.0]
  - - [1024, 3584, 1, 1280]
    - [26, 0.0]
  - - [1856, 448, 1, 1]
    - [48, 0.0]
  - - [2368, 2944, 1, 1]
    - [53, 0.0]
  - - [5056, 256, 1, 32]
    - [41, 0.0]
  - - [4288, 1, 1, 3328]
    - [63, 0.0]
  - - [5056, 1024, 1, 1280]
    - [29, 0.0]
  - - [704, 704, 1, 1]
    - [53, 0.0]
  - - [1856, 448, 1, 1280]
    - [26, 0.0]
  - - [3584, 6784, 1, 256]
    - [26, 0.0]
  - - [64, 1856, 1, 1280]
    - [18, 0.0]
  - - [1856, 1408, 1, 256]
    - [26, 0.0]
  - - [4288, 4288, 1, 32]
    - [33, 0.0]
  - - [128, 1, 1, 256]
    - [63, 0.0]
  - - [32, 64, 1, 3328]
    - [46, 0.0]
  - - [5888, 448, 1, 1]
    - [48, 0.0]
  - - [128, 5888, 1, 256]
    - [26, 0.0]
  - - [3584, 256, 1, 3328]
    - [21, 0.0]
  - - [5056, 5056, 1, 1280]
    - [26, 0.0]
  - - [6784, 1408, 1, 3328]
    - [26, 0.0]
  - - [448, 2368, 1, 1]
    - [61, 0.0]
  - - [2368, 1, 1, 1280]
    - [64, 0.0]
  - - [32, 3584, 1, 32]
    - [42, 0.0]
  - - [128, 6784, 1, 1]
    - [53, 0.0]
  - - [1, 3584, 1, 1]
    - [48, 0.0]
  - - [5888, 5888, 1, 3328]
    - [24, 0.0]
  - - [256, 2944, 1, 3328]
    - [26, 0.0]
  - - [1, 128, 1, 3328]
    - [64, 0.0]
  - - [32, 256, 1, 256]
    - [46, 0.0]
  - - [5888, 1408, 1, 32]
    - [33, 0.0]
  - - [704, 256, 1, 1]
    - [53, 0.0]
  - - [1, 448, 1, 1]
    - [54, 0.0]
  - - [256, 6784, 1, 3328]
    - [26, 0.0]
  - - [64, 5888, 1, 256]
    - [6, 0.0]
  - - [1856, 1, 1, 1]
    - [48, 0.0]
  - - [1024, 256, 1, 3328]
    - [20, 0.0]
  - - [704, 704, 1, 256]
    - [26, 0.0]
  - - [448, 1024, 1, 32]
    - [37, 0.0]
  - - [6784, 2368, 1, 1280]
    - [26, 0.0]
  - - [128, 1856, 1, 1280]
    - [17, 0.0]
  - - [256, 2368, 1, 256]
    - [26, 0.0]
  - - [2944, 1408, 1, 1]
    - [48, 0.0]
  - - [6784, 1024, 1, 256]
    - [26, 0.0]
  - - [5056, 1408, 1, 32]
    - [33, 0.0]
  - - [1408, 6784, 1, 3328]
    - [26, 0.0]
  - - [2944, 1408, 1, 3328]
    - [26, 0.0]
  - - [1856, 32, 1, 256]
    - [42, 0.0]
  - - [704, 2368, 1, 32]
    - [37, 0.0]
  - - [448, 256, 1, 32]
    - [36, 0.0]
  - - [704, 6784, 1, 1]
    - [53, 0.0]
  - - [2368, 6784, 1, 256]
    - [26, 0.0]
  - - [1856, 3584, 1, 3328]
    - [26, 0.0]
  - - [1, 704, 1, 3328]
    - [64, 0.0]
  - - [64, 1, 1, 3328]
    - [64, 0.0]
  - - [448, 704, 1, 1280]
    - [12, 0.0]
  - - [704, 1856, 1, 1]
    - [55, 0.0]
  - - [704, 448, 1, 256]
    - [26, 0.0]
  - - [448, 64, 1, 3328]
    - [15, 0.0]
  - - [704, 6784, 1, 256]
    - [26, 0.0]
  - - [256, 32, 1, 1280]
    - [46, 0.0]
  - - [2368, 448, 1, 1280]
    - [26, 0.0]
  - - [6784, 2944, 1, 32]
    - [33, 0.0]
  - - [64, 4288, 1, 32]
    - [35, 0.0]
  - - [128, 704, 1, 1]
    - [55, 0.0]
  - - [128, 448, 1, 3328]
    - [18, 0.0]
  - - [5888, 2368, 1, 3328]
    - [26, 0.0]
  - - [2368, 704, 1, 1280]
    - [26, 0.0]
  - - [1024, 1408, 1, 1280]
    - [26, 0.0]
  - - [4288, 64, 1, 1280]
    - [18, 0.0]
  - - [128, 5056, 1, 1]
    - [59, 0.0]
  - - [2944, 5056, 1, 32]
    - [33, 0.0]
  - - [448, 448, 1, 1]
    - [63, 0.0]
  - - [256, 2368, 1, 1280]
    - [26, 0.0]
  - - [704, 2368, 1, 3328]
    - [26, 0.0]
  - - [3584, 2944, 1, 256]
    - [26, 0.0]
  - - [64, 6784, 1, 256]
    - [12, 0.0]
  - - [3584, 1024, 1, 1280]
    - [26, 0.0]
  - - [64, 1024, 1, 256]
    - [3, 0.0]
  - - [1408, 32, 1, 32]
    - [35, 0.0]
  - - [128, 3584, 1, 256]
    - [12, 0.0]
  - - [704, 1408, 1, 1]
    - [50, 0.0]
  - - [5056, 3584, 1, 256]
    - [26, 0.0]
  - - [2368, 704, 1, 256]
    - [26, 0.0]
  - - [1856, 1856, 1, 1280]
    - [26, 0.0]
  - - [32, 5888, 1, 32]
    - [35, 0.0]
  - - [64, 32, 1, 32]
    - [35, 0.0]
  - - [4288, 704, 1, 1]
    - [51, 0.0]
  - - [1856, 1024, 1, 1]
    - [53, 0.0]
  - - [4288, 2944, 1, 3328]
    - [26, 0.0]
  - - [1024, 128, 1, 3328]
    - [15, 0.0]
  - - [4288, 128, 1, 3328]
    - [20, 0.0]
  - - [4288, 704, 1, 32]
    - [41, 0.0]
  - - [1856, 1024, 1, 32]
    - [39, 0.0]
  - - [1, 448, 1, 3328]
    - [64, 0.0]
  - - [2944, 6784, 1, 1]
    - [52, 0.0]
  - - [6784, 2368, 1, 32]
    - [33, 0.0]
  - - [5888, 5056, 1, 1]
    - [47, 0.0]
  - - [128, 6784, 1, 1280]
    - [14, 0.0]
  - - [704, 5888, 1, 1]
    - [48, 0.0]
  - - [6784, 6784, 1, 1]
    - [52, 0.0]
  - - [1856, 32, 1, 1280]
    - [46, 0.0]
  - - [5888, 448, 1, 3328]
    - [26, 0.0]
  - - [704, 5888, 1, 32]
    - [33, 0.0]
  - - [704, 5888, 1, 1280]
    - [26, 0.0]
  - - [1024, 6784, 1, 3328]
    - [26, 0.0]
  - - [704, 2944, 1, 1280]
    - [26, 0.0]
  - - [4288, 6784, 1, 256]
    - [26, 0.0]
  - - [3584, 256, 1, 32]
    - [37, 0.0]
  - - [1408, 1408, 1, 32]
    - [33, 0.0]
  - - [1408, 1408, 1, 3328]
    - [29, 0.0]
  - - [1024, 64, 1, 256]
    - [3, 0.0]
  - - [4288, 64, 1, 32]
    - [42, 0.0]
  - - [1408, 256, 1, 32]
    - [42, 0.0]
  - - [5888, 128, 1, 256]
    - [26, 0.0]
  - - [64, 704, 1, 1280]
    - [15, 0.0]
  - - [2944, 1856, 1, 256]
    - [26, 0.0]
  - - [128, 5056, 1, 3328]
    - [6, 0.0]
  - - [4288, 2944, 1, 1]
    - [53, 0.0]
  - - [6784, 5056, 1, 32]
    - [33, 0.0]
  - - [1024, 448, 1, 3328]
    - [20, 0.0]
  - - [3584, 128, 1, 1]
    - [55, 0.0]
  - - [2944, 4288, 1, 1280]
    - [26, 0.0]
  - - [64, 32, 1, 3328]
    - [46, 0.0]
  - - [1024, 4288, 1, 256]
    - [26, 0.0]
  - - [128, 2368, 1, 256]
    - [0, 0.0]
  - - [2368, 64, 1, 32]
    - [35, 0.0]
  - - [1408, 1, 1, 3328]
    - [64, 0.0]
  - - [64, 1408, 1, 32]
    - [37, 0.0]
  - - [2368, 5888, 1, 1]
    - [53, 0.0]
  - - [1408, 1856, 1, 32]
    - [41, 0.0]
  - - [448, 1856, 1, 256]
    - [26, 0.0]
  - - [1856, 6784, 1, 3328]
    - [26, 0.0]
  - - [3584, 128, 1, 256]
    - [12, 0.0]
  - - [1024, 448, 1, 1280]
    - [26, 0.0]
  - - [1024, 2368, 1, 32]
    - [33, 0.0]
  - - [32, 2944, 1, 256]
    - [42, 0.0]
  - - [128, 5888, 1, 1]
    - [52, 0.0]
  - - [64, 5056, 1, 1]
    - [55, 0.0]
  - - [1856, 256, 1, 32]
    - [35, 0.0]
  - - [2368, 2368, 1, 3328]
    - [26, 0.0]
  - - [64, 448, 1, 1]
    - [62, 0.0]
  - - [3584, 5888, 1, 32]
    - [33, 0.0]
  - - [3584, 5888, 1, 1280]
    - [26, 0.0]
  - - [64, 5056, 1, 32]
    - [42, 0.0]
  - - [2944, 64, 1, 1]
    - [55, 0.0]
  - - [6784, 704, 1, 256]
    - [26, 0.0]
  - - [3584, 1024, 1, 32]
    - [33, 0.0]
  - - [1408, 704, 1, 32]
    - [37, 0.0]
  - - [1408, 704, 1, 1280]
    - [26, 0.0]
  - - [2368, 5888, 1, 256]
    - [26, 0.0]
  - - [2944, 64, 1, 32]
    - [35, 0.0]
  - - [1, 1408, 1, 256]
    - [63, 0.0]
  - - [64, 2944, 1, 256]
    - [1, 0.0]
  - - [5888, 5888, 1, 32]
    - [33, 0.0]
  - - [1856, 1408, 1, 3328]
    - [26, 0.0]
  - - [1024, 1024, 1, 32]
    - [37, 0.0]
  - - [4288, 1024, 1, 1]
    - [48, 0.0]
  - - [704, 4288, 1, 3328]
    - [26, 0.0]
  - - [2944, 5056, 1, 1280]
    - [26, 0.0]
  - - [6784, 2944, 1, 1280]
    - [26, 0.0]
  - - [6784, 256, 1, 3328]
    - [26, 0.0]
  - - [5056, 128, 1, 3328]
    - [6, 0.0]
  - - [128, 128, 1, 1280]
    - [15, 0.0]
  - - [128, 4288, 1, 1]
    - [61, 0.0]
  - - [1408, 5056, 1, 32]
    - [33, 0.0]
  - - [2944, 128, 1, 3328]
    - [6, 0.0]
  - - [5888, 1856, 1, 1280]
    - [26, 0.0]
  - - [64, 128, 1, 256]
    - [3, 0.0]
  - - [5888, 256, 1, 1280]
    - [26, 0.0]
  - - [1856, 5056, 1, 1]
    - [53, 0.0]
  - - [3584, 1856, 1, 1280]
    - [26, 0.0]
  - - [6784, 448, 1, 256]
    - [26, 0.0]
  - - [704, 3584, 1, 256]
    - [26, 0.0]
  - - [1856, 5056, 1, 32]
    - [33, 0.0]
  - - [1856, 5056, 1, 3328]
    - [26, 0.0]
  - - [1024, 2944, 1, 32]
    - [33, 0.0]
  - - [1408, 6784, 1, 256]
    - [26, 0.0]
  - - [1024, 2368, 1, 1280]
    - [26, 0.0]
  - - [1856, 3584, 1, 1]
    - [53, 0.0]
  - - [5888, 128, 1, 1280]
    - [26, 0.0]
  - - [2944, 5888, 1, 1280]
    - [26, 0.0]
  - - [1, 1856, 1, 1]
    - [58, 0.0]
  - - [3584, 3584, 1, 256]
    - [26, 0.0]
  - - [1856, 2368, 1, 3328]
    - [26, 0.0]
  - - [5888, 704, 1, 256]
    - [26, 0.0]
  - - [64, 448, 1, 32]
    - [35, 0.0]
  - - [6784, 4288, 1, 256]
    - [26, 0.0]
  - - [128, 64, 1, 3328]
    - [15, 0.0]
  - - [1, 5056, 1, 1280]
    - [63, 0.0]
  - - [32, 64, 1, 1280]
    - [46, 0.0]
  - - [1408, 2368, 1, 3328]
    - [26, 0.0]
  - - [1024, 3584, 1, 256]
    - [26, 0.0]
  - - [2944, 128, 1, 256]
    - [14, 0.0]
  - - [6784, 128, 1, 1]
    - [50, 0.0]
  - - [1408, 256, 1, 3328]
    - [20, 0.0]
  - - [448, 32, 1, 256]
    - [42, 0.0]
  - - [1024, 32, 1, 256]
    - [42, 0.0]
  - - [1, 5888, 1, 256]
    - [63, 0.0]
  - - [64, 2368, 1, 256]
    - [1, 0.0]
  - - [2944, 256, 1, 256]
    - [26, 0.0]
  - - [1, 128, 1, 256]
    - [63, 0.0]
  - - [32, 256, 1, 1280]
    - [46, 0.0]
  - - [5888, 1, 1, 256]
    - [63, 0.0]
  - - [32, 128, 1, 3328]
    - [46, 0.0]
  - - [6784, 128, 1, 256]
    - [26, 0.0]
  - - [6784, 64, 1, 1280]
    - [20, 0.0]
  - - [4288, 1024, 1, 32]
    - [33, 0.0]
  - - [1408, 64, 1, 3328]
    - [18, 0.0]
  - - [2944, 448, 1, 1280]
    - [26, 0.0]
  - - [6784, 32, 1, 1280]
    - [46, 0.0]
  - - [2944, 64, 1, 1280]
    - [18, 0.0]
  - - [704, 448, 1, 1]
    - [61, 0.0]
  - - [32, 128, 1, 32]
    - [35, 0.0]
  - - [1, 128, 1, 1]
    - [53, 0.0]
  - - [5888, 1, 1, 1]
    - [48, 0.0]
  - - [5888, 1856, 1, 3328]
    - [25, 0.0]
  - - [2368, 3584, 1, 256]
    - [26, 0.0]
  - - [4288, 1408, 1, 3328]
    - [26, 0.0]
  - - [1856, 32, 1, 3328]
    - [46, 0.0]
  - - [2944, 32, 1, 256]
    - [42, 0.0]
  - - [128, 64, 1, 1]
    - [64, 0.0]
  - - [256, 1024, 1, 3328]
    - [20, 0.0]
  - - [32, 448, 1, 256]
    - [42, 0.0]
  - - [1856, 64, 1, 3328]
    - [18, 0.0]
  - - [256, 5056, 1, 256]
    - [26, 0.0]
  - - [5888, 2944, 1, 3328]
    - [26, 0.0]
  - - [2368, 1408, 1, 3328]
    - [26, 0.0]
  - - [5888, 704, 1, 32]
    - [41, 0.0]
  - - [2944, 704, 1, 1]
    - [53, 0.0]
  - - [6784, 1856, 1, 256]
    - [26, 0.0]
  - - [1, 704, 1, 256]
    - [63, 0.0]
  - - [1856, 1856, 1, 1]
    - [48, 0.0]
  - - [5888, 32, 1, 256]
    - [46, 0.0]
  - - [128, 704, 1, 256]
    - [15, 0.0]
  - - [256, 1408, 1, 3328]
    - [20, 0.0]
  - - [2944, 128, 1, 1]
    - [63, 0.0]
  - - [32, 256, 1, 3328]
    - [46, 0.0]
  - - [2944, 704, 1, 3328]
    - [26, 0.0]
  - - [704, 1024, 1, 32]
    - [42, 0.0]
  - - [2368, 1856, 1, 32]
    - [33, 0.0]
  - - [5056, 4288, 1, 3328]
    - [24, 0.0]
  - - [3584, 448, 1, 3328]
    - [26, 0.0]
  - - [256, 32, 1, 32]
    - [42, 0.0]
  - - [64, 256, 1, 3328]
    - [15, 0.0]
  - - [256, 6784, 1, 1]
    - [48, 0.0]
  - - [1024, 3584, 1, 32]
    - [33, 0.0]
  - - [256, 6784, 1, 32]
    - [41, 0.0]
  - - [2944, 1408, 1, 32]
    - [33, 0.0]
  - - [4288, 3584, 1, 1]
    - [53, 0.0]
  - - [1, 704, 1, 1]
    - [55, 0.0]
  - - [5056, 448, 1, 3328]
    - [26, 0.0]
  - - [3584, 64, 1, 256]
    - [12, 0.0]
  - - [64, 1856, 1, 32]
    - [35, 0.0]
  - - [64, 1856, 1, 3328]
    - [18, 0.0]
  - - [6784, 3584, 1, 32]
    - [33, 0.0]
  - - [4288, 1856, 1, 256]
    - [26, 0.0]
  - - [1856, 2944, 1, 256]
    - [26, 0.0]
  - - [128, 448, 1, 1]
    - [55, 0.0]
  - - [64, 128, 1, 32]
    - [35, 0.0]
  - - [704, 1, 1, 1280]
    - [64, 0.0]
  - - [2944, 5888, 1, 1]
    - [52, 0.0]
  - - [1024, 1856, 1, 3328]
    - [29, 0.0]
  - - [5888, 1024, 1, 32]
    - [33, 0.0]
  - - [3584, 256, 1, 1280]
    - [26, 0.0]
  - - [1024, 1, 1, 1]
    - [58, 0.0]
  - - [1408, 5056, 1, 1280]
    - [26, 0.0]
  - - [3584, 128, 1, 1280]
    - [20, 0.0]
  - - [5056, 6784, 1, 256]
    - [26, 0.0]
  - - [256, 1856, 1, 256]
    - [26, 0.0]
  - - [5888, 32, 1, 1280]
    - [46, 0.0]
  - - [256, 128, 1, 32]
    - [37, 0.0]
  - - [32, 1856, 1, 1280]
    - [46, 0.0]
  - - [2944, 5056, 1, 1]
    - [47, 0.0]
  - - [448, 128, 1, 1]
    - [55, 0.0]
  - - [256, 704, 1, 32]
    - [38, 0.0]
  - - [256, 704, 1, 1280]
    - [20, 0.0]
  - - [1, 2368, 1, 1]
    - [59, 0.0]
  - - [5888, 5888, 1, 1280]
    - [26, 0.0]
  - - [256, 2944, 1, 1280]
    - [26, 0.0]
  - - [2944, 256, 1, 3328]
    - [26, 0.0]
  - - [5056, 2944, 1, 1280]
    - [26, 0.0]
  - - [704, 1024, 1, 3328]
    - [26, 0.0]
  - - [2368, 1856, 1, 1280]
    - [26, 0.0]
  - - [448, 2944, 1, 1]
    - [49, 0.0]
  - - [6784, 2944, 1, 1]
    - [47, 0.0]
  - - [2944, 1024, 1, 32]
    - [33, 0.0]
  - - [2944, 1024, 1, 1280]
    - [26, 0.0]
  - - [1408, 64, 1, 32]
    - [37, 0.0]
  - - [5056, 5056, 1, 1]
    - [48, 0.0]
  - - [2368, 4288, 1, 256]
    - [26, 0.0]
  - - [448, 1856, 1, 1280]
    - [26, 0.0]
  - - [2368, 448, 1, 1]
    - [57, 0.0]
  - - [448, 2944, 1, 32]
    - [41, 0.0]
  - - [448, 2944, 1, 1280]
    - [26, 0.0]
  - - [2944, 6784, 1, 1280]
    - [26, 0.0]
  - - [256, 6784, 1, 1280]
    - [26, 0.0]
  - - [128, 2368, 1, 1280]
    - [0, 0.0]
  - - [3584, 2368, 1, 32]
    - [33, 0.0]
  - - [704, 32, 1, 32]
    - [37, 0.0]
  - - [6784, 3584, 1, 3328]
    - [24, 0.0]
  - - [128, 32, 1, 256]
    - [42, 0.0]
  - - [128, 1408, 1, 1280]
    - [15, 0.0]
  - - [64, 32, 1, 1280]
    - [46, 0.0]
  - - [128, 1856, 1, 3328]
    - [17, 0.0]
  - - [2944, 2944, 1, 256]
    - [26, 0.0]
  - - [1408, 1024, 1, 3328]
    - [26, 0.0]
  - - [5056, 2368, 1, 1280]
    - [26, 0.0]
  - - [448, 128, 1, 32]
    - [35, 0.0]
  - - [2368, 64, 1, 3328]
    - [18, 0.0]
  - - [32, 5056, 1, 3328]
    - [46, 0.0]
  - - [448, 2944, 1, 3328]
    - [26, 0.0]
  - - [2944, 1024, 1, 1]
    - [48, 0.0]
  - - [2368, 128, 1, 1280]
    - [14, 0.0]
  - - [3584, 704, 1, 256]
    - [26, 0.0]
  - - [2368, 5888, 1, 3328]
    - [26, 0.0]
  - - [4288, 2368, 1, 1]
    - [48, 0.0]
  - - [1408, 3584, 1, 32]
    - [33, 0.0]
  - - [2944, 4288, 1, 32]
    - [37, 0.0]
  - - [5888, 1408, 1, 1280]
    - [29, 0.0]
  - - [3584, 5056, 1, 1280]
    - [26, 0.0]
  - - [5888, 6784, 1, 1280]
    - [25, 0.0]
  - - [64, 1856, 1, 1]
    - [55, 0.0]
  - - [704, 128, 1, 32]
    - [35, 0.0]
  - - [3584, 2944, 1, 1]
    - [49, 0.0]
  - - [128, 3584, 1, 3328]
    - [17, 0.0]
  - - [256, 4288, 1, 3328]
    - [26, 0.0]
  - - [4288, 64, 1, 1]
    - [48, 0.0]
  - - [1, 1408, 1, 1280]
    - [64, 0.0]
  - - [5056, 32, 1, 1280]
    - [46, 0.0]
  - - [1856, 704, 1, 32]
    - [41, 0.0]
  - - [1024, 1856, 1, 1]
    - [48, 0.0]
  - - [704, 5056, 1, 3328]
    - [26, 0.0]
  - - [1024, 3584, 1, 3328]
    - [26, 0.0]
  - - [5888, 256, 1, 3328]
    - [26, 0.0]
  - - [1856, 1408, 1, 1]
    - [53, 0.0]
  - - [2944, 448, 1, 32]
    - [41, 0.0]
  - - [128, 448, 1, 256]
    - [3, 0.0]
  - - [128, 1024, 1, 1]
    - [55, 0.0]
  - - [32, 32, 1, 256]
    - [42, 0.0]
  - - [4288, 5056, 1, 1280]
    - [26, 0.0]
  - - [1856, 1856, 1, 3328]
    - [26, 0.0]
  - - [1024, 2368, 1, 256]
    - [26, 0.0]
  - - [4288, 2368, 1, 3328]
    - [26, 0.0]
  - - [256, 64, 1, 32]
    - [42, 0.0]
  - - [1, 1024, 1, 1280]
    - [64, 0.0]
  - - [5056, 128, 1, 32]
    - [35, 0.0]
  - - [5888, 3584, 1, 256]
    - [26, 0.0]
  - - [1024, 5056, 1, 32]
    - [33, 0.0]
  - - [5888, 448, 1, 1280]
    - [26, 0.0]
  - - [704, 5888, 1, 3328]
    - [26, 0.0]
  - - [1024, 1408, 1, 256]
    - [26, 0.0]
  - - [3584, 2944, 1, 1280]
    - [26, 0.0]
  - - [1, 5056, 1, 256]
    - [63, 0.0]
  - - [256, 1024, 1, 1]
    - [53, 0.0]
  - - [32, 32, 1, 3328]
    - [46, 0.0]
  - - [2368, 1, 1, 3328]
    - [64, 0.0]
  - - [4288, 1856, 1, 1280]
    - [26, 0.0]
  - - [3584, 5888, 1, 1]
    - [47, 0.0]
  - - [5888, 4288, 1, 256]
    - [26, 0.0]
  - - [1024, 2944, 1, 1280]
    - [26, 0.0]
  - - [6784, 1, 1, 1]
    - [61, 0.0]
  - - [1408, 64, 1, 1280]
    - [18, 0.0]
  - - [1, 256, 1, 1280]
    - [64, 0.0]
  - - [2944, 3584, 1, 256]
    - [26, 0.0]
  - - [1, 128, 1, 1280]
    - [64, 0.0]
  - - [1024, 256, 1, 32]
    - [42, 0.0]
  - - [5888, 1, 1, 1280]
    - [63, 0.0]
  - - [2368, 32, 1, 1280]
    - [46, 0.0]
  - - [5888, 1856, 1, 1]
    - [47, 0.0]
  - - [6784, 128, 1, 1280]
    - [14, 0.0]
  - - [6784, 2368, 1, 3328]
    - [26, 0.0]
  - - [1, 64, 1, 256]
    - [63, 0.0]
  - - [704, 128, 1, 1]
    - [55, 0.0]
  - - [1408, 4288, 1, 32]
    - [33, 0.0]
  - - [256, 64, 1, 1280]
    - [15, 0.0]
  - - [256, 448, 1, 256]
    - [1, 0.0]
  - - [1856, 1024, 1, 1280]
    - [29, 0.0]
  - - [5888, 1856, 1, 256]
    - [26, 0.0]
  - - [5056, 1856, 1, 1]
    - [48, 0.0]
  - - [5888, 2368, 1, 256]
    - [26, 0.0]
  - - [1408, 1024, 1, 32]
    - [37, 0.0]
  - - [32, 704, 1, 256]
    - [46, 0.0]
  - - [2944, 1, 1, 256]
    - [63, 0.0]
  - - [32, 4288, 1, 256]
    - [42, 0.0]
  - - [5056, 1856, 1, 32]
    - [33, 0.0]
  - - [5056, 1856, 1, 1280]
    - [26, 0.0]
  - - [1, 64, 1, 1]
    - [48, 0.0]
  - - [1408, 5888, 1, 3328]
    - [26, 0.0]
  - - [1408, 704, 1, 3328]
    - [21, 0.0]
  - - [5056, 704, 1, 3328]
    - [26, 0.0]
  - - [704, 64, 1, 1280]
    - [18, 0.0]
  - - [1, 704, 1, 1280]
    - [64, 0.0]
  - - [5888, 6784, 1, 1]
    - [47, 0.0]
  - - [5888, 4288, 1, 32]
    - [33, 0.0]
  - - [1408, 3584, 1, 256]
    - [26, 0.0]
  - - [1856, 704, 1, 1]
    - [50, 0.0]
  - - [6784, 256, 1, 1]
    - [53, 0.0]
  - - [2944, 1, 1, 1]
    - [48, 0.0]
  - - [256, 1856, 1, 3328]
    - [20, 0.0]
  - - [4288, 128, 1, 1280]
    - [12, 0.0]
  - - [6784, 256, 1, 1280]
    - [26, 0.0]
  - - [128, 4288, 1, 256]
    - [14, 0.0]
  - - [128, 128, 1, 32]
    - [42, 0.0]
  - - [128, 1408, 1, 32]
    - [41, 0.0]
  - - [6784, 128, 1, 32]
    - [41, 0.0]
  - - [1408, 448, 1, 1]
    - [50, 0.0]
  - - [2368, 704, 1, 3328]
    - [26, 0.0]
  - - [704, 128, 1, 3328]
    - [18, 0.0]
  - - [2944, 1856, 1, 32]
    - [33, 0.0]
  - - [1024, 64, 1, 1]
    - [48, 0.0]
  - - [1408, 32, 1, 1280]
    - [46, 0.0]
  - - [704, 1, 1, 256]
    - [63, 0.0]
  - - [2368, 1408, 1, 256]
    - [26, 0.0]
  - - [2368, 1856, 1, 1]
    - [48, 0.0]
  - - [4288, 1408, 1, 1]
    - [61, 0.0]
  - - [3584, 2368, 1, 1280]
    - [26, 0.0]
  - - [64, 5056, 1, 1280]
    - [10, 0.0]
  - - [1408, 2944, 1, 1]
    - [47, 0.0]
  - - [4288, 1408, 1, 32]
    - [33, 0.0]
  - - [5888, 2944, 1, 256]
    - [26, 0.0]
  - - [128, 64, 1, 1280]
    - [3, 0.0]
  - - [1408, 2944, 1, 32]
    - [33, 0.0]
  - - [1, 3584, 1, 1280]
    - [64, 0.0]
  - - [64, 64, 1, 32]
    - [35, 0.0]
  - - [448, 1408, 1, 32]
    - [42, 0.0]
  - - [128, 5056, 1, 256]
    - [26, 0.0]
  - - [1, 1, 1, 1280]
    - [64, 0.0]
  - - [64, 704, 1, 256]
    - [3, 0.0]
  - - [5888, 6784, 1, 256]
    - [26, 0.0]
  - - [6784, 5888, 1, 1]
    - [47, 0.0]
  - - [64, 4288, 1, 256]
    - [1, 0.0]
  - - [1, 448, 1, 1280]
    - [64, 0.0]
  - - [1024, 1024, 1, 1]
    - [48, 0.0]
  - - [6784, 5888, 1, 1280]
    - [24, 0.0]
  - - [1024, 4288, 1, 32]
    - [41, 0.0]
  - - [1856, 1, 1, 1280]
    - [64, 0.0]
  - - [3584, 5888, 1, 256]
    - [26, 0.0]
  - - [5056, 2368, 1, 1]
    - [54, 0.0]
  - - [256, 1408, 1, 1280]
    - [20, 0.0]
  - - [64, 256, 1, 32]
    - [35, 0.0]
  - - [64, 5888, 1, 3328]
    - [6, 0.0]
  - - [6784, 64, 1, 3328]
    - [20, 0.0]
  - - [5056, 448, 1, 1]
    - [48, 0.0]
  - - [2944, 448, 1, 3328]
    - [26, 0.0]
  - - [2368, 1024, 1, 1280]
    - [26, 0.0]
  - - [1856, 6784, 1, 256]
    - [26, 0.0]
  - - [4288, 32, 1, 1280]
    - [46, 0.0]
  - - [448, 1408, 1, 1280]
    - [26, 0.0]
  - - [5056, 448, 1, 32]
    - [41, 0.0]
  - - [3584, 2944, 1, 32]
    - [33, 0.0]
  - - [2368, 128, 1, 1]
    - [55, 0.0]
  - - [32, 128, 1, 1280]
    - [46, 0.0]
  - - [3584, 1856, 1, 32]
    - [33, 0.0]
  - - [128, 128, 1, 3328]
    - [15, 0.0]
  - - [5056, 64, 1, 256]
    - [6, 0.0]
  - - [64, 448, 1, 3328]
    - [15, 0.0]
  - - [4288, 1408, 1, 1280]
    - [26, 0.0]
  - - [6784, 2368, 1, 1]
    - [57, 0.0]
  - - [32, 5056, 1, 256]
    - [46, 0.0]
  - - [704, 128, 1, 256]
    - [11, 0.0]
  - - [704, 5056, 1, 1]
    - [53, 0.0]
  - - [256, 1024, 1, 32]
    - [44, 0.0]
  - - [256, 1024, 1, 1280]
    - [20, 0.0]
  - - [2368, 128, 1, 256]
    - [14, 0.0]
  - - [32, 64, 1, 256]
    - [42, 0.0]
  - - [2368, 1408, 1, 1280]
    - [26, 0.0]
  - - [128, 256, 1, 32]
    - [35, 0.0]
  - - [64, 6784, 1, 32]
    - [42, 0.0]
  - - [6784, 32, 1, 256]
    - [46, 0.0]
  - - [256, 4288, 1, 1]
    - [49, 0.0]
  - - [5888, 1408, 1, 1]
    - [52, 0.0]
  - - [1024, 4288, 1, 1280]
    - [26, 0.0]
  - - [1856, 4288, 1, 1]
    - [48, 0.0]
  - - [128, 2944, 1, 256]
    - [14, 0.0]
  - - [3584, 4288, 1, 256]
    - [26, 0.0]
  - - [2368, 2944, 1, 256]
    - [26, 0.0]
  - - [3584, 128, 1, 32]
    - [37, 0.0]
  - - [3584, 128, 1, 3328]
    - [20, 0.0]
  - - [704, 5056, 1, 256]
    - [26, 0.0]
  - - [1856, 4288, 1, 32]
    - [33, 0.0]
  - - [64, 256, 1, 1280]
    - [15, 0.0]
  - - [4288, 1024, 1, 1280]
    - [26, 0.0]
  - - [1, 4288, 1, 256]
    - [63, 0.0]
  - - [64, 2368, 1, 1]
    - [55, 0.0]
  - - [4288, 6784, 1, 32]
    - [33, 0.0]
  - - [704, 704, 1, 3328]
    - [26, 0.0]
  - - [128, 2944, 1, 1]
    - [61, 0.0]
  - - [3584, 1408, 1, 256]
    - [29, 0.0]
  - - [704, 3584, 1, 3328]
    - [26, 0.0]
  - - [5056, 448, 1, 1280]
    - [26, 0.0]
  - - [1408, 2944, 1, 1280]
    - [26, 0.0]
  - - [5888, 704, 1, 1280]
    - [26, 0.0]
  - - [64, 64, 1, 256]
    - [3, 0.0]
  - - [704, 1408, 1, 1280]
    - [13, 0.0]
  - - [4288, 5888, 1, 256]
    - [26, 0.0]
  - - [6784, 64, 1, 32]
    - [38, 0.0]
  - - [3584, 3584, 1, 3328]
    - [26, 0.0]
  - - [2944, 6784, 1, 32]
    - [33, 0.0]
  - - [448, 64, 1, 32]
    - [35, 0.0]
  - - [5056, 256, 1, 1]
    - [49, 0.0]
  - - [64, 6784, 1, 1280]
    - [20, 0.0]
  - - [2944, 2368, 1, 3328]
    - [26, 0.0]
  - - [1, 4288, 1, 1]
    - [61, 0.0]
  - - [1408, 128, 1, 256]
    - [12, 0.0]
  - - [1024, 1856, 1, 1280]
    - [29, 0.0]
  - - [448, 5888, 1, 256]
    - [26, 0.0]
  - - [1024, 5888, 1, 256]
    - [26, 0.0]
  - - [704, 1408, 1, 256]
    - [26, 0.0]
  - - [6784, 2944, 1, 3328]
    - [26, 0.0]
  - - [1408, 2368, 1, 256]
    - [26, 0.0]
  - - [64, 128, 1, 1280]
    - [3, 0.0]
  - - [5888, 32, 1, 3328]
    - [46, 0.0]
  - - [1408, 5056, 1, 256]
    - [26, 0.0]
  - - [1024, 1408, 1, 32]
    - [41, 0.0]
  - - [4288, 128, 1, 32]
    - [35, 0.0]
  - - [6784, 704, 1, 1]
    - [48, 0.0]
  - - [448, 704, 1, 256]
    - [26, 0.0]
  - - [704, 3584, 1, 32]
    - [33, 0.0]
  - - [1856, 256, 1, 3328]
    - [20, 0.0]
  - - [448, 1024, 1, 1280]
    - [26, 0.0]
  - - [4288, 4288, 1, 1]
    - [48, 0.0]
  - - [5056, 2944, 1, 1]
    - [48, 0.0]
  - - [64, 2368, 1, 3328]
    - [15, 0.0]
  - - [256, 704, 1, 3328]
    - [20, 0.0]
  - - [1, 2944, 1, 1]
    - [53, 0.0]
  - - [1024, 1024, 1, 256]
    - [26, 0.0]
  - - [3584, 1, 1, 1]
    - [48, 0.0]
  - - [256, 2944, 1, 32]
    - [41, 0.0]
  - - [6784, 4288, 1, 3328]
    - [25, 0.0]
  - - [5056, 2944, 1, 3328]
    - [25, 0.0]
  - - [704, 1024, 1, 1280]
    - [26, 0.0]
  - - [256, 3584, 1, 1280]
    - [26, 0.0]
  - - [2368, 1856, 1, 3328]
    - [26, 0.0]
  - - [1856, 4288, 1, 1280]
    - [26, 0.0]
  - - [1, 1024, 1, 256]
    - [63, 0.0]
  - - [3584, 448, 1, 1]
    - [59, 0.0]
  - - [2944, 1024, 1, 3328]
    - [26, 0.0]
  - - [32, 1408, 1, 3328]
    - [46, 0.0]
  - - [128, 1, 1, 3328]
    - [64, 0.0]
  - - [5888, 5056, 1, 32]
    - [33, 0.0]
  - - [704, 2944, 1, 1]
    - [55, 0.0]
  - - [3584, 448, 1, 32]
    - [41, 0.0]
  - - [3584, 448, 1, 1280]
    - [26, 0.0]
  - - [2944, 6784, 1, 3328]
    - [26, 0.0]
  - - [1856, 2368, 1, 1280]
    - [26, 0.0]
  - - [6784, 1024, 1, 1280]
    - [26, 0.0]
  - - [6784, 3584, 1, 1280]
    - [26, 0.0]
  - - [1, 5056, 1, 3328]
    - [63, 0.0]
  - - [128, 128, 1, 1]
    - [63, 0.0]
  - - [128, 2368, 1, 32]
    - [42, 0.0]
  - - [128, 1408, 1, 3328]
    - [15, 0.0]
  - - [2944, 32, 1, 3328]
    - [46, 0.0]
  - - [704, 1856, 1, 256]
    - [26, 0.0]
  - - [1408, 1408, 1, 1]
    - [48, 0.0]
  - - [1408, 4288, 1, 256]
    - [26, 0.0]
  - - [256, 5056, 1, 3328]
    - [26, 0.0]
  - - [2368, 64, 1, 1280]
    - [18, 0.0]
  - - [1856, 448, 1, 32]
    - [41, 0.0]
  - - [1408, 448, 1, 256]
    - [26, 0.0]
  - - [32, 128, 1, 256]
    - [42, 0.0]
  - - [448, 1024, 1, 1]
    - [53, 0.0]
  - - [128, 1024, 1, 1280]
    - [15, 0.0]
  - - [448, 6784, 1, 1]
    - [48, 0.0]
  - - [704, 2944, 1, 256]
    - [26, 0.0]
  - - [1408, 1408, 1, 256]
    - [29, 0.0]
  - - [448, 6784, 1, 32]
    - [41, 0.0]
  - - [1, 64, 1, 1280]
    - [64, 0.0]
  - - [1408, 1856, 1, 1]
    - [53, 0.0]
  - - [4288, 448, 1, 32]
    - [41, 0.0]
  - - [4288, 448, 1, 1280]
    - [26, 0.0]
  - - [2944, 704, 1, 32]
    - [37, 0.0]
  - - [1024, 704, 1, 256]
    - [26, 0.0]
  - - [448, 4288, 1, 1]
    - [48, 0.0]
  - - [3584, 5056, 1, 1]
    - [48, 0.0]
  - - [1408, 3584, 1, 1280]
    - [26, 0.0]
  - - [6784, 448, 1, 1280]
    - [26, 0.0]
  - - [3584, 5056, 1, 3328]
    - [26, 0.0]
  - - [2368, 2368, 1, 32]
    - [33, 0.0]
  - - [64, 5888, 1, 32]
    - [42, 0.0]
  - - [1856, 448, 1, 256]
    - [26, 0.0]
  - - [128, 1024, 1, 256]
    - [15, 0.0]
  - - [3584, 64, 1, 3328]
    - [20, 0.0]
  - - [5888, 2944, 1, 32]
    - [33, 0.0]
  - - [2944, 1, 1, 1280]
    - [64, 0.0]
  - - [1856, 2944, 1, 32]
    - [33, 0.0]
  - - [5056, 1408, 1, 1]
    - [53, 0.0]
  - - [5888, 1408, 1, 3328]
    - [26, 0.0]
  - - [448, 4288, 1, 256]
    - [26, 0.0]
  - - [6784, 1024, 1, 1]
    - [54, 0.0]
  - - [256, 448, 1, 1]
    - [55, 0.0]
  - - [128, 5888, 1, 3328]
    - [26, 0.0]
  - - [6784, 1024, 1, 32]
    - [33, 0.0]
  - - [256, 448, 1, 32]
    - [37, 0.0]
  - - [6784, 3584, 1, 1]
    - [53, 0.0]
  - - [2944, 2368, 1, 32]
    - [33, 0.0]
  - - [3584, 6784, 1, 3328]
    - [26, 0.0]
  - - [448, 128, 1, 1280]
    - [18, 0.0]
  - - [64, 3584, 1, 32]
    - [35, 0.0]
  - - [64, 3584, 1, 1280]
    - [20, 0.0]
  - - [6784, 1408, 1, 256]
    - [26, 0.0]
  - - [5056, 1024, 1, 32]
    - [37, 0.0]
  - - [1024, 5056, 1, 1280]
    - [26, 0.0]
  - - [4288, 3584, 1, 256]
    - [26, 0.0]
  - - [2368, 256, 1, 3328]
    - [26, 0.0]
  - - [448, 6784, 1, 1280]
    - [26, 0.0]
  - - [1856, 5888, 1, 1]
    - [53, 0.0]
  - - [256, 5888, 1, 32]
    - [33, 0.0]
  - - [3584, 1, 1, 3328]
    - [64, 0.0]
  - - [4288, 32, 1, 256]
    - [46, 0.0]
  - - [256, 64, 1, 1]
    - [55, 0.0]
  - - [4288, 5056, 1, 32]
    - [33, 0.0]
  - - [4288, 5056, 1, 3328]
    - [26, 0.0]
  - - [1856, 5888, 1, 32]
    - [33, 0.0]
  - - [1856, 5888, 1, 1280]
    - [26, 0.0]
  - - [256, 256, 1, 1280]
    - [15, 0.0]
  - - [704, 2368, 1, 1280]
    - [26, 0.0]
  - - [4288, 2368, 1, 1280]
    - [26, 0.0]
  - - [2944, 5056, 1, 256]
    - [26, 0.0]
  - - [32, 1856, 1, 256]
    - [42, 0.0]
  - - [64, 5888, 1, 1280]
    - [14, 0.0]
  - - [1, 1856, 1, 1280]
    - [64, 0.0]
  - - [2944, 4288, 1, 1]
    - [54, 0.0]
  - - [5056, 5888, 1, 32]
    - [33, 0.0]
  - - [704, 1, 1, 3328]
    - [64, 0.0]
  - - [448, 256, 1, 1280]
    - [18, 0.0]
  - - [1408, 256, 1, 1]
    - [55, 0.0]
  - - [2368, 5056, 1, 3328]
    - [26, 0.0]
  - - [1024, 5056, 1, 3328]
    - [26, 0.0]
  - - [704, 704, 1, 1280]
    - [26, 0.0]
  - - [128, 32, 1, 3328]
    - [46, 0.0]
  - - [1024, 6784, 1, 32]
    - [33, 0.0]
  - - [3584, 2944, 1, 3328]
    - [26, 0.0]
  - - [128, 1856, 1, 256]
    - [4, 0.0]
  - - [32, 32, 1, 1280]
    - [46, 0.0]
  - - [1408, 5888, 1, 1]
    - [52, 0.0]
  - - [1, 3584, 1, 256]
    - [64, 0.0]
  - - [704, 4288, 1, 32]
    - [33, 0.0]
  - - [1408, 5888, 1, 32]
    - [33, 0.0]
  - - [6784, 1024, 1, 3328]
    - [26, 0.0]
  - - [1856, 1, 1, 3328]
    - [64, 0.0]
  - - [5056, 1408, 1, 256]
    - [26, 0.0]
  - - [1, 1, 1, 256]
    - [63, 0.0]
  - - [2944, 1408, 1, 256]
    - [26, 0.0]
  - - [4288, 1, 1, 1]
    - [55, 0.0]
  - - [2368, 2368, 1, 256]
    - [26, 0.0]
  - - [1, 448, 1, 256]
    - [63, 0.0]
  - - [1408, 6784, 1, 1]
    - [47, 0.0]
  - - [3584, 32, 1, 3328]
    - [46, 0.0]
  - - [128, 3584, 1, 1]
    - [55, 0.0]
  - - [1856, 1, 1, 256]
    - [63, 0.0]
  - - [6784, 6784, 1, 1280]
    - [26, 0.0]
  - - [1024, 5888, 1, 1]
    - [47, 0.0]
  - - [6784, 32, 1, 3328]
    - [46, 0.0]
  - - [1408, 32, 1, 256]
    - [42, 0.0]
  - - [128, 3584, 1, 32]
    - [41, 0.0]
  - - [1856, 3584, 1, 256]
    - [26, 0.0]
  - - [2944, 64, 1, 256]
    - [4, 0.0]
  - - [2368, 704, 1, 32]
    - [37, 0.0]
  - - [256, 5888, 1, 1280]
    - [26, 0.0]
  - - [448, 2368, 1, 32]
    - [41, 0.0]
  - - [448, 2368, 1, 3328]
    - [26, 0.0]
  - - [64, 1408, 1, 256]
    - [3, 0.0]
  - - [5056, 32, 1, 32]
    - [35, 0.0]
  - - [1024, 704, 1, 3328]
    - [26, 0.0]
  - - [32, 5888, 1, 3328]
    - [46, 0.0]
  - - [256, 64, 1, 3328]
    - [15, 0.0]
  - - [32, 1408, 1, 1280]
    - [46, 0.0]
  - - [64, 32, 1, 256]
    - [42, 0.0]
  - - [1856, 1024, 1, 3328]
    - [29, 0.0]
  - - [2368, 1, 1, 1]
    - [53, 0.0]
  - - [5056, 2368, 1, 3328]
    - [26, 0.0]
  - - [128, 1, 1, 1280]
    - [64, 0.0]
  - - [704, 4288, 1, 1280]
    - [26, 0.0]
  - - [704, 256, 1, 256]
    - [12, 0.0]
  - - [512, 128, 1, 784]
    - [65, 0.0]
  - - [1024, 256, 1, 196]
    - [69, 0.0]
  - - [256, 64, 1, 3136]
    - [67, 0.0]
  - - [256, 1024, 1, 196]
    - [66, 0.0]
  - - [64, 256, 1, 3136]
    - [70, 0.0]
  - - [128, 512, 1, 784]
    - [68, 0.0]
  - - [64, 64, 1, 3136]
    - [69, 0.0]
  - - [2560, 7000, 1, 2560]
    - [92, 0.0]
  - - [7680, 12000, 1, 2560]
    - [92, 0.0]
  - - [5124, 9124, 1, 1760]
    - [86, 0.0]
  - - [1760, 32, 1, 1760]
    - [73, 0.0]
  - - [512, 24000, 1, 1536]
    - [92, 0.0]
  - - [3072, 24000, 1, 1024]
    - [92, 0.0]
  - - [2048, 400, 1, 512]
    - [93, 0.0]
  - - [2560, 128, 1, 2560]
    - [79, 0.0]
  - - [3072, 16, 1, 1024]
    - [81, 0.0]
  - - [512, 48000, 1, 2816]
    - [92, 0.0]
  - - [512, 48000, 1, 2048]
    - [93, 0.0]
  - - [1760, 64, 1, 1760]
    - [73, 0.0]
  - - [2048, 1600, 1, 2048]
    - [93, 0.0]
  - - [512, 48000, 1, 1536]
    - [92, 0.0]
  - - [2560, 32, 1, 2560]
    - [73, 0.0]
  - - [8448, 5984, 1, 2816]
    - [92, 0.0]
  - - [4096, 3200, 1, 1024]
    - [93, 0.0]
  - - [1024, 24000, 1, 2560]
    - [92, 0.0]
  - - [1760, 6400, 1, 1760]
    - [86, 0.0]
  - - [5124, 9124, 1, 2048]
    - [93, 0.0]
  - - [1024, 700, 1, 512]
    - [85, 0.0]
  - - [4608, 32, 1, 1536]
    - [73, 0.0]
  - - [3072, 64, 1, 1024]
    - [81, 0.0]
  - - [16384, 3200, 1, 4096]
    - [93, 0.0]
  - - [2560, 16, 1, 2560]
    - [79, 0.0]
  - - [1024, 48000, 1, 2560]
    - [92, 0.0]
  - - [8448, 48000, 1, 2816]
    - [92, 0.0]
  - - [2048, 32, 1, 2048]
    - [76, 0.0]
  - - [2560, 3200, 1, 2560]
    - [92, 0.0]
  - - [16384, 800, 1, 4096]
    - [93, 0.0]
  - - [4608, 24000, 1, 1536]
    - [92, 0.0]
  - - [7680, 48000, 1, 2560]
    - [92, 0.0]
  - - [3072, 48000, 1, 1024]
    - [92, 0.0]
  - - [1760, 16, 1, 1760]
    - [76, 0.0]
  - - [8192, 3200, 1, 2048]
    - [93, 0.0]
  - - [512, 24000, 1, 2816]
    - [92, 0.0]
  - - [4096, 400, 1, 1024]
    - [93, 0.0]
  - - [6144, 48000, 1, 2560]
    - [92, 0.0]
  - - [4608, 48000, 1, 1536]
    - [92, 0.0]
  - - [4096, 128, 1, 4096]
    - [81, 0.0]
  - - [2048, 800, 1, 512]
    - [92, 0.0]
  - - [4608, 5984, 1, 1536]
    - [92, 0.0]
  - - [4096, 1600, 1, 1024]
    - [93, 0.0]
  - - [6144, 5984, 1, 2048]
    - [93, 0.0]
  - - [7680, 24000, 1, 2560]
    - [92, 0.0]
  - - [6144, 48000, 1, 2048]
    - [93, 0.0]
  - - [2048, 3200, 1, 2048]
    - [93, 0.0]
  - - [5124, 9124, 1, 2560]
    - [92, 0.0]
  - - [1024, 24000, 1, 1536]
    - [92, 0.0]
  - - [7680, 16, 1, 2560]
    - [76, 0.0]
  - - [2560, 6400, 1, 2560]
    - [92, 0.0]
  - - [2048, 128, 1, 2048]
    - [76, 0.0]
  - - [512, 16, 1, 500000]
    - [76, 0.0]
  - - [1024, 8, 1, 500000]
    - [73, 0.0]
  - - [512, 24000, 1, 2560]
    - [92, 0.0]
  - - [1024, 24000, 1, 2816]
    - [92, 0.0]
  - - [7680, 5984, 1, 2560]
    - [92, 0.0]
  - - [2048, 1600, 1, 512]
    - [93, 0.0]
  - - [2048, 7000, 1, 2048]
    - [93, 0.0]
  - - [1760, 800, 1, 1760]
    - [83, 0.0]
  - - [4096, 64, 1, 4096]
    - [76, 0.0]
  - - [7680, 32, 1, 2560]
    - [76, 0.0]
  - - [2560, 64, 1, 2560]
    - [79, 0.0]
  - - [3072, 128, 1, 1024]
    - [81, 0.0]
  - - [7680, 64, 1, 2560]
    - [85, 0.0]
  - - [1760, 128, 1, 1760]
    - [73, 0.0]
  - - [2560, 1600, 1, 2560]
    - [92, 0.0]
  - - [2048, 3200, 1, 512]
    - [93, 0.0]
  - - [2560, 800, 1, 2560]
    - [92, 0.0]
  - - [3072, 32, 1, 1024]
    - [76, 0.0]
  - - [6144, 32, 1, 2560]
    - [73, 0.0]
  - - [4608, 12000, 1, 1536]
    - [92, 0.0]
  - - [4096, 32, 1, 4096]
    - [82, 0.0]
  - - [6144, 24000, 1, 2048]
    - [93, 0.0]
  - - [8192, 800, 1, 2048]
    - [93, 0.0]
  - - [5124, 9124, 1, 4096]
    - [93, 0.0]
  - - [8448, 24000, 1, 2816]
    - [92, 0.0]
  - - [1024, 48000, 1, 1536]
    - [92, 0.0]
  - - [7680, 128, 1, 2560]
    - [85, 0.0]
  - - [8192, 1600, 1, 2048]
    - [93, 0.0]
  - - [4096, 800, 1, 1024]
    - [93, 0.0]
  - - [1024, 16, 1, 500000]
    - [76, 0.0]
  - - [2048, 800, 1, 2048]
    - [91, 0.0]
  - - [1760, 3200, 1, 1760]
    - [86, 0.0]
  - - [512, 48000, 1, 2560]
    - [92, 0.0]
  - - [8448, 16, 1, 2816]
    - [74, 0.0]
  - - [2048, 64, 1, 2048]
    - [76, 0.0]
  - - [512, 24000, 1, 2048]
    - [93, 0.0]
  - - [16384, 1600, 1, 4096]
    - [93, 0.0]
  - - [4608, 16, 1, 1536]
    - [73, 0.0]
  - - [1024, 24000, 1, 2048]
    - [93, 0.0]
  - - [8192, 400, 1, 2048]
    - [93, 0.0]
  - - [2048, 6400, 1, 2048]
    - [93, 0.0]
  - - [6144, 12000, 1, 2048]
    - [93, 0.0]
  - - [512, 8, 1, 500000]
    - [73, 0.0]
  - - [1760, 7000, 1, 1760]
    - [86, 0.0]
  - - [1024, 48000, 1, 2816]
    - [92, 0.0]
  - - [6144, 16, 1, 2560]
    - [79, 0.0]
  - - [8448, 32, 1, 2816]
    - [79, 0.0]
  - - [4096, 7000, 1, 4096]
    - [93, 0.0]
  - - [4096, 16, 1, 4096]
    - [77, 0.0]
  - - [6144, 24000, 1, 2560]
    - [92, 0.0]
  - - [2048, 16, 1, 2048]
    - [81, 0.0]
  - - [8448, 12000, 1, 2816]
    - [92, 0.0]
  - - [16384, 400, 1, 4096]
    - [93, 0.0]
  - - [1760, 1600, 1, 1760]
    - [84, 0.0]
  - - [1024, 48000, 1, 2048]
    - [93, 0.0]
  - - [3073, 3072, 1, 3072]
    - [133, 0.0]
  - - [3072, 512, 1, 3072]
    - [140, 0.0]
  - - [511, 2048, 1, 2048]
    - [132, 0.0]
  - - [4096, 4096, 1, 4096]
    - [140, 0.0]
  - - [4096, 513, 1, 4096]
    - [136, 0.0]
  - - [513, 1024, 1, 1024]
    - [133, 0.0]
  - - [512, 2048, 1, 2047]
    - [138, 0.0]
  - - [512, 512, 1, 512]
    - [140, 0.0]
  - - [512, 1025, 1, 1024]
    - [132, 0.0]
  - - [3840, 4097, 1, 4096]
    - [133, 0.0]
  - - [1024, 1024, 1, 1024]
    - [140, 0.0]
  - - [960, 1025, 1, 1024]
    - [132, 0.0]
  - - [4096, 511, 1, 4096]
    - [132, 0.0]
  - - [512, 3072, 1, 3072]
    - [140, 0.0]
  - - [2049, 512, 1, 2048]
    - [132, 0.0]
  - - [7681, 8192, 1, 8192]
    - [136, 0.0]
  - - [8192, 512, 1, 8191]
    - [138, 0.0]
  - - [2048, 2048, 1, 2049]
    - [133, 0.0]
  - - [2880, 3072, 1, 3072]
    - [139, 0.0]
  - - [7680, 8193, 1, 8192]
    - [136, 0.0]
  - - [8192, 512, 1, 8193]
    - [133, 0.0]
  - - [1023, 512, 1, 1024]
    - [132, 0.0]
  - - [513, 2048, 1, 2048]
    - [132, 0.0]
  - - [8192, 8191, 1, 8192]
    - [133, 0.0]
  - - [512, 1023, 1, 1024]
    - [132, 0.0]
  - - [512, 4097, 1, 4096]
    - [133, 0.0]
  - - [1920, 2048, 1, 2047]
    - [133, 0.0]
  - - [1920, 2049, 1, 2048]
    - [133, 0.0]
  - - [3073, 512, 1, 3072]
    - [133, 0.0]
  - - [3841, 4096, 1, 4096]
    - [133, 0.0]
  - - [8192, 512, 1, 8192]
    - [140, 0.0]
  - - [511, 512, 1, 512]
    - [132, 0.0]
  - - [1024, 512, 1, 1025]
    - [132, 0.0]
  - - [4095, 512, 1, 4096]
    - [132, 0.0]
  - - [1919, 2048, 1, 2048]
    - [137, 0.0]
  - - [2879, 3072, 1, 3072]
    - [133, 0.0]
  - - [8192, 8192, 1, 8192]
    - [140, 0.0]
  - - [1024, 1024, 1, 1023]
    - [132, 0.0]
  - - [8191, 512, 1, 8192]
    - [133, 0.0]
  - - [512, 8193, 1, 8192]
    - [133, 0.0]
  - - [1024, 1025, 1, 1024]
    - [132, 0.0]
  - - [512, 512, 1, 511]
    - [132, 0.0]
  - - [2047, 2048, 1, 2048]
    - [132, 0.0]
  - - [1024, 1023, 1, 1024]
    - [132, 0.0]
  - - [512, 1024, 1, 1024]
    - [140, 0.0]
  - - [2880, 3072, 1, 3071]
    - [134, 0.0]
  - - [2048, 511, 1, 2048]
    - [132, 0.0]
  - - [7680, 8192, 1, 8193]
    - [136, 0.0]
  - - [512, 8191, 1, 8192]
    - [133, 0.0]
  - - [512, 4096, 1, 4096]
    - [140, 0.0]
  - - [4097, 512, 1, 4096]
    - [133, 0.0]
  - - [1921, 2048, 1, 2048]
    - [133, 0.0]
  - - [2048, 2049, 1, 2048]
    - [133, 0.0]
  - - [3072, 512, 1, 3071]
    - [133, 0.0]
  - - [8192, 8192, 1, 8191]
    - [136, 0.0]
  - - [2880, 3072, 1, 3073]
    - [134, 0.0]
  - - [2047, 512, 1, 2048]
    - [132, 0.0]
  - - [1025, 1024, 1, 1024]
    - [138, 0.0]
  - - [3072, 513, 1, 3072]
    - [133, 0.0]
  - - [512, 513, 1, 512]
    - [132, 0.0]
  - - [512, 511, 1, 512]
    - [132, 0.0]
  - - [3839, 4096, 1, 4096]
    - [136, 0.0]
  - - [512, 4096, 1, 4097]
    - [133, 0.0]
  - - [3072, 3073, 1, 3072]
    - [133, 0.0]
  - - [512, 4096, 1, 4095]
    - [136, 0.0]
  - - [8191, 8192, 1, 8192]
    - [136, 0.0]
  - - [2880, 3071, 1, 3072]
    - [133, 0.0]
  - - [4096, 512, 1, 4097]
    - [132, 0.0]
  - - [1920, 2047, 1, 2048]
    - [133, 0.0]
  - - [512, 2049, 1, 2048]
    - [132, 0.0]
  - - [3072, 3072, 1, 3071]
    - [133, 0.0]
  - - [8192, 8193, 1, 8192]
    - [133, 0.0]
  - - [4096, 512, 1, 4095]
    - [136, 0.0]
  - - [960, 1024, 1, 1024]
    - [139, 0.0]
  - - [961, 1024, 1, 1024]
    - [132, 0.0]
  - - [4096, 4097, 1, 4096]
    - [132, 0.0]
  - - [512, 8192, 1, 8192]
    - [140, 0.0]
  - - [8192, 8192, 1, 8193]
    - [136, 0.0]
  - - [4096, 4095, 1, 4096]
    - [136, 0.0]
  - - [511, 8192, 1, 8192]
    - [132, 0.0]
  - - [512, 3071, 1, 3072]
    - [133, 0.0]
  - - [3840, 4096, 1, 4096]
    - [140, 0.0]
  - - [7680, 8191, 1, 8192]
    - [136, 0.0]
  - - [7680, 8192, 1, 8192]
    - [140, 0.0]
  - - [4096, 4096, 1, 4097]
    - [133, 0.0]
  - - [512, 8192, 1, 8193]
    - [133, 0.0]
  - - [8192, 513, 1, 8192]
    - [133, 0.0]
  - - [1024, 1024, 1, 1025]
    - [132, 0.0]
  - - [960, 1024, 1, 1023]
    - [134, 0.0]
  - - [512, 2048, 1, 2049]
    - [132, 0.0]
  - - [8192, 511, 1, 8192]
    - [133, 0.0]
  - - [513, 4096, 1, 4096]
    - [133, 0.0]
  - - [511, 1024, 1, 1024]
    - [132, 0.0]
  - - [513, 512, 1, 512]
    - [132, 0.0]
  - - [3072, 3072, 1, 3073]
    - [135, 0.0]
  - - [960, 1024, 1, 1025]
    - [138, 0.0]
  - - [959, 1024, 1, 1024]
    - [138, 0.0]
  - - [2048, 2048, 1, 2048]
    - [140, 0.0]
  - - [512, 3072, 1, 3073]
    - [133, 0.0]
  - - [511, 3072, 1, 3072]
    - [133, 0.0]
  - - [513, 8192, 1, 8192]
    - [138, 0.0]
  - - [4095, 4096, 1, 4096]
    - [136, 0.0]
  - - [8193, 8192, 1, 8192]
    - [133, 0.0]
  - - [3840, 4095, 1, 4096]
    - [137, 0.0]
  - - [512, 3073, 1, 3072]
    - [133, 0.0]
  - - [4096, 4096, 1, 4095]
    - [133, 0.0]
  - - [512, 8192, 1, 8191]
    - [134, 0.0]
  - - [1025, 512, 1, 1024]
    - [132, 0.0]
  - - [2881, 3072, 1, 3072]
    - [133, 0.0]
  - - [1024, 512, 1, 1023]
    - [133, 0.0]
  - - [3840, 4096, 1, 4097]
    - [136, 0.0]
  - - [2048, 513, 1, 2048]
    - [132, 0.0]
  - - [1920, 2048, 1, 2048]
    - [140, 0.0]
  - - [3072, 512, 1, 3073]
    - [133, 0.0]
  - - [513, 3072, 1, 3072]
    - [134, 0.0]
  - - [3072, 511, 1, 3072]
    - [133, 0.0]
  - - [511, 4096, 1, 4096]
    - [133, 0.0]
  - - [2049, 2048, 1, 2048]
    - [133, 0.0]
  - - [2048, 2047, 1, 2048]
    - [133, 0.0]
  - - [960, 1023, 1, 1024]
    - [138, 0.0]
  - - [2880, 3073, 1, 3072]
    - [133, 0.0]
  - - [1024, 511, 1, 1024]
    - [138, 0.0]
  - - [512, 2048, 1, 2048]
    - [140, 0.0]
  - - [8193, 512, 1, 8192]
    - [133, 0.0]
  - - [2048, 512, 1, 2047]
    - [132, 0.0]
  - - [3071, 3072, 1, 3072]
    - [136, 0.0]
  - - [4096, 512, 1, 4096]
    - [140, 0.0]
  - - [512, 4095, 1, 4096]
    - [133, 0.0]
  - - [512, 1024, 1, 1025]
    - [132, 0.0]
  - - [3071, 512, 1, 3072]
    - [133, 0.0]
  - - [2048, 2048, 1, 2047]
    - [133, 0.0]
  - - [512, 2047, 1, 2048]
    - [132, 0.0]
  - - [512, 3072, 1, 3071]
    - [135, 0.0]
  - - [3072, 3071, 1, 3072]
    - [134, 0.0]
  - - [4097, 4096, 1, 4096]
    - [133, 0.0]
  - - [1024, 513, 1, 1024]
    - [132, 0.0]
  - - [3840, 4096, 1, 4095]
    - [136, 0.0]
  - - [3072, 3072, 1, 3072]
    - [140, 0.0]
  - - [512, 512, 1, 513]
    - [132, 0.0]
  - - [7679, 8192, 1, 8192]
    - [133, 0.0]
  - - [2048, 512, 1, 2049]
    - [132, 0.0]
  - - [512, 1024, 1, 1023]
    - [132, 0.0]
  - - [7680, 8192, 1, 8191]
    - [136, 0.0]
  - - [1023, 1024, 1, 1024]
    - [132, 0.0]
  - - [1920, 2048, 1, 2049]
    - [133, 0.0]
  - - [2, 4, 1, 1024]
    - [237, 0.0]
  - - [2, 32, 1, 1024]
    - [175, 0.0]
  - - [2, 2048, 1, 1024]
    - [187, 0.0]
  - - [64, 128, 512, 128]
    - [174, 0.0]
  - - [64, 512, 1, 512]
    - [261, 0.0]
  - - [64, 512, 64, 512]
    - [191, 0.0]
  - - [128, 128, 512, 64]
    - [212, 0.0]
  - - [512, 512, 1, 64]
    - [188, 0.0]
  - - [512, 512, 64, 64]
    - [235, 0.0]
  - - [1024, 4, 1, 1024]
    - [188, 0.0]
  - - [1024, 4, 1, 1024]
    - [188, 0.0]
  - - [1024, 32, 1, 1024]
    - [251, 0.0]
  - - [1024, 2048, 1, 1024]
    - [216, 0.0]
  - - [1024, 2048, 1, 4096]
    - [190, 0.0]
  - - [1024, 4096, 1, 1024]
    - [226, 0.0]
  - - [1024, 4096, 1, 4096]
    - [264, 0.0]
  - - [4096, 2048, 1, 1024]
    - [193, 0.0]
  - - [4096, 4096, 1, 1024]
    - [203, 0.0]
  - - [30528, 2048, 1, 1024]
    - [203, 0.0]
  - - [30528, 4096, 1, 1024]
    - [203, 0.0]
  - - [3, 3, 512, 64]
    - [178, 0.0]
  - - [5, 5, 512, 64]
    - [185, 0.0]
  - - [5, 5, 960, 64]
    - [183, 0.0]
  - - [9, 9, 512, 64]
    - [186, 0.0]
  - - [27, 27, 32768, 128]
    - [184, 0.0]
  - - [32, 1600, 1, 512]
    - [219, 0.0]
  - - [33, 33, 1600, 32]
    - [179, 0.0]
  - - [64, 512, 1, 1024]
    - [261, 0.0]
  - - [64, 960, 1, 1024]
    - [188, 0.0]
  - - [128, 32768, 1, 256]
    - [242, 0.0]
  - - [256, 684, 1, 1024]
    - [188, 0.0]
  - - [256, 1280, 1, 1024]
    - [248, 0.0]
  - - [256, 1536, 1, 1024]
    - [268, 0.0]
  - - [256, 2304, 1, 1024]
    - [256, 0.0]
  - - [256, 2560, 1, 1024]
    - [249, 0.0]
  - - [256, 2816, 1, 1024]
    - [256, 0.0]
  - - [256, 3328, 1, 1024]
    - [266, 0.0]
  - - [256, 3584, 1, 1024]
    - [182, 0.0]
  - - [256, 4608, 1, 1024]
    - [259, 0.0]
  - - [256, 4864, 1, 1024]
    - [255, 0.0]
  - - [256, 5376, 1, 1024]
    - [218, 0.0]
  - - [256, 5888, 1, 1024]
    - [218, 0.0]
  - - [256, 6144, 1, 1024]
    - [218, 0.0]
  - - [256, 6400, 1, 1024]
    - [218, 0.0]
  - - [256, 6656, 1, 1024]
    - [267, 0.0]
  - - [256, 7168, 1, 1024]
    - [215, 0.0]
  - - [256, 7424, 1, 1024]
    - [200, 0.0]
  - - [256, 7936, 1, 1024]
    - [265, 0.0]
  - - [256, 8192, 1, 1024]
    - [222, 0.0]
  - - [256, 8448, 1, 1024]
    - [265, 0.0]
  - - [256, 8960, 1, 1024]
    - [222, 0.0]
  - - [256, 9984, 1, 1024]
    - [222, 0.0]
  - - [256, 10496, 1, 1024]
    - [222, 0.0]
  - - [256, 11264, 1, 1024]
    - [258, 0.0]
  - - [256, 11520, 1, 1024]
    - [222, 0.0]
  - - [256, 11776, 1, 1024]
    - [222, 0.0]
  - - [256, 12544, 1, 1024]
    - [199, 0.0]
  - - [256, 13312, 1, 1024]
    - [253, 0.0]
  - - [256, 14336, 1, 1024]
    - [222, 0.0]
  - - [256, 14592, 1, 1024]
    - [199, 0.0]
  - - [256, 14848, 1, 1024]
    - [201, 0.0]
  - - [256, 15104, 1, 1024]
    - [199, 0.0]
  - - [256, 16128, 1, 1024]
    - [225, 0.0]
  - - [256, 18176, 1, 1024]
    - [180, 0.0]
  - - [256, 18944, 1, 1024]
    - [221, 0.0]
  - - [256, 19200, 1, 1024]
    - [225, 0.0]
  - - [256, 20480, 1, 1024]
    - [218, 0.0]
  - - [256, 20992, 1, 1024]
    - [215, 0.0]
  - - [256, 21248, 1, 1024]
    - [222, 0.0]
  - - [256, 21504, 1, 1024]
    - [218, 0.0]
  - - [256, 22016, 1, 1024]
    - [247, 0.0]
  - - [256, 22344, 1, 1024]
    - [204, 0.0]
  - - [256, 23296, 1, 1024]
    - [222, 0.0]
  - - [256, 23552, 1, 1024]
    - [247, 0.0]
  - - [256, 31488, 1, 1024]
    - [181, 0.0]
  - - [256, 32768, 1, 512]
    - [221, 0.0]
  - - [256, 33536, 1, 1024]
    - [181, 0.0]
  - - [256, 44505, 1, 1024]
    - [199, 0.0]
  - - [512, 1600, 1, 512]
    - [241, 0.0]
  - - [512, 32768, 1, 13]
    - [238, 0.0]
  - - [512, 32768, 1, 1024]
    - [222, 0.0]
  - - [684, 8976, 1, 256]
    - [194, 0.0]
  - - [1024, 200, 1, 560]
    - [217, 0.0]
  - - [1024, 512, 1, 1024]
    - [250, 0.0]
  - - [1024, 512, 1, 1600]
    - [177, 0.0]
  - - [1024, 960, 1, 1024]
    - [263, 0.0]
  - - [1024, 960, 1, 1600]
    - [245, 0.0]
  - - [1024, 1600, 1, 560]
    - [232, 0.0]
  - - [1024, 1600, 1, 1024]
    - [243, 0.0]
  - - [1024, 32768, 1, 480]
    - [236, 0.0]
  - - [1024, 32768, 1, 1024]
    - [222, 0.0]
  - - [1280, 8976, 1, 256]
    - [230, 0.0]
  - - [1792, 8976, 1, 256]
    - [213, 0.0]
  - - [2048, 114, 1, 512]
    - [176, 0.0]
  - - [2048, 114, 1, 768]
    - [188, 0.0]
  - - [2048, 215, 1, 512]
    - [183, 0.0]
  - - [2048, 215, 1, 768]
    - [224, 0.0]
  - - [2048, 256, 1, 512]
    - [224, 0.0]
  - - [2048, 256, 1, 768]
    - [183, 0.0]
  - - [2048, 512, 1, 67]
    - [241, 0.0]
  - - [2048, 512, 1, 74]
    - [234, 0.0]
  - - [2048, 512, 1, 100]
    - [235, 0.0]
  - - [2048, 512, 1, 2048]
    - [194, 0.0]
  - - [2048, 684, 1, 512]
    - [241, 0.0]
  - - [2048, 684, 1, 768]
    - [228, 0.0]
  - - [2048, 960, 1, 74]
    - [230, 0.0]
  - - [2048, 960, 1, 2048]
    - [223, 0.0]
  - - [2048, 1536, 1, 512]
    - [260, 0.0]
  - - [2048, 1536, 1, 768]
    - [233, 0.0]
  - - [2048, 8976, 1, 256]
    - [199, 0.0]
  - - [2304, 8976, 1, 256]
    - [213, 0.0]
  - - [2560, 8976, 1, 256]
    - [233, 0.0]
  - - [2816, 8976, 1, 256]
    - [196, 0.0]
  - - [3072, 8976, 1, 256]
    - [213, 0.0]
  - - [3328, 8976, 1, 256]
    - [222, 0.0]
  - - [3840, 8976, 1, 256]
    - [222, 0.0]
  - - [4096, 8976, 1, 256]
    - [222, 0.0]
  - - [4352, 8976, 1, 256]
    - [195, 0.0]
  - - [4608, 8976, 1, 256]
    - [233, 0.0]
  - - [4864, 8976, 1, 256]
    - [205, 0.0]
  - - [5120, 8976, 1, 256]
    - [233, 0.0]
  - - [5376, 8976, 1, 256]
    - [205, 0.0]
  - - [5632, 8976, 1, 256]
    - [229, 0.0]
  - - [5888, 8976, 1, 256]
    - [222, 0.0]
  - - [6144, 8976, 1, 256]
    - [211, 0.0]
  - - [6400, 8976, 1, 256]
    - [222, 0.0]
  - - [7168, 8976, 1, 256]
    - [233, 0.0]
  - - [7936, 8976, 1, 256]
    - [239, 0.0]
  - - [8192, 8976, 1, 256]
    - [227, 0.0]
  - - [8448, 8976, 1, 256]
    - [222, 0.0]
  - - [8960, 8976, 1, 256]
    - [222, 0.0]
  - - [9472, 8976, 1, 256]
    - [222, 0.0]
  - - [9728, 8976, 1, 256]
    - [233, 0.0]
  - - [9984, 8976, 1, 256]
    - [222, 0.0]
  - - [10240, 8976, 1, 256]
    - [214, 0.0]
  - - [10496, 8976, 1, 256]
    - [222, 0.0]
  - - [11264, 8976, 1, 256]
    - [233, 0.0]
  - - [11776, 8976, 1, 256]
    - [239, 0.0]
  - - [12544, 8976, 1, 256]
    - [239, 0.0]
  - - [13312, 8976, 1, 256]
    - [233, 0.0]
  - - [13568, 8976, 1, 256]
    - [239, 0.0]
  - - [13824, 8976, 1, 256]
    - [239, 0.0]
  - - [15104, 8976, 1, 256]
    - [239, 0.0]
  - - [15360, 8976, 1, 256]
    - [231, 0.0]
  - - [15872, 8976, 1, 256]
    - [239, 0.0]
  - - [16128, 8976, 1, 256]
    - [239, 0.0]
  - - [17152, 8976, 1, 256]
    - [239, 0.0]
  - - [18176, 8976, 1, 256]
    - [239, 0.0]
  - - [18688, 8976, 1, 256]
    - [239, 0.0]
  - - [18944, 8976, 1, 256]
    - [239, 0.0]
  - - [19712, 8976, 1, 256]
    - [246, 0.0]
  - - [19968, 8976, 1, 256]
    - [239, 0.0]
  - - [20480, 8976, 1, 256]
    - [197, 0.0]
  - - [20992, 8976, 1, 256]
    - [239, 0.0]
  - - [21248, 8976, 1, 256]
    - [239, 0.0]
  - - [23552, 8976, 1, 256]
    - [231, 0.0]
  - - [28672, 8976, 1, 256]
    - [210, 0.0]
  - - [31488, 8976, 1, 256]
    - [239, 0.0]
  - - [33536, 8976, 1, 256]
    - [239, 0.0]
  - - [44505, 8976, 1, 256]
    - [246, 0.0]
  - - [1024, 3840, 1, 1024]
    - [244, 0.0]
  - - [1024, 3840, 1, 4096]
    - [240, 0.0]
  - - [1024, 3968, 1, 1024]
    - [221, 0.0]
  - - [1024, 3968, 1, 4096]
    - [254, 0.0]
  - - [1024, 6528, 1, 1024]
    - [253, 0.0]
  - - [1024, 6528, 1, 4096]
    - [220, 0.0]
  - - [1024, 7104, 1, 1024]
    - [199, 0.0]
  - - [1024, 7104, 1, 4096]
    - [220, 0.0]
  - - [1024, 7200, 1, 1024]
    - [262, 0.0]
  - - [1024, 7200, 1, 4096]
    - [190, 0.0]
  - - [1024, 8064, 1, 1024]
    - [202, 0.0]
  - - [1024, 8064, 1, 4096]
    - [220, 0.0]
  - - [1024, 8160, 1, 1024]
    - [204, 0.0]
  - - [1024, 8160, 1, 4096]
    - [208, 0.0]
  - - [1024, 9216, 1, 1024]
    - [222, 0.0]
  - - [1024, 9216, 1, 4096]
    - [220, 0.0]
  - - [1024, 9520, 1, 1024]
    - [222, 0.0]
  - - [1024, 9520, 1, 4096]
    - [189, 0.0]
  - - [1024, 10064, 1, 1024]
    - [222, 0.0]
  - - [1024, 10064, 1, 4096]
    - [208, 0.0]
  - - [1024, 10080, 1, 1024]
    - [216, 0.0]
  - - [1024, 10080, 1, 4096]
    - [220, 0.0]
  - - [1024, 10200, 1, 1024]
    - [222, 0.0]
  - - [1024, 10200, 1, 4096]
    - [220, 0.0]
  - - [4096, 3840, 1, 1024]
    - [252, 0.0]
  - - [4096, 3968, 1, 1024]
    - [209, 0.0]
  - - [4096, 6528, 1, 1024]
    - [211, 0.0]
  - - [4096, 7104, 1, 1024]
    - [193, 0.0]
  - - [4096, 7200, 1, 1024]
    - [211, 0.0]
  - - [4096, 8064, 1, 1024]
    - [209, 0.0]
  - - [4096, 8160, 1, 1024]
    - [209, 0.0]
  - - [4096, 9216, 1, 1024]
    - [211, 0.0]
  - - [4096, 9520, 1, 1024]
    - [207, 0.0]
  - - [4096, 10064, 1, 1024]
    - [193, 0.0]
  - - [4096, 10080, 1, 1024]
    - [193, 0.0]
  - - [4096, 10200, 1, 1024]
    - [193, 0.0]
  - - [42720, 3968, 1, 1024]
    - [220, 0.0]
  - - [42720, 6528, 1, 1024]
    - [252, 0.0]
  - - [42720, 7104, 1, 1024]
    - [192, 0.0]
  - - [42720, 7200, 1, 1024]
    - [257, 0.0]
  - - [42720, 9520, 1, 1024]
    - [220, 0.0]
  - - [42720, 10080, 1, 1024]
    - [203, 0.0]
  - - [1024, 3240, 1, 1024]
    - [216, 0.0]
  - - [1024, 3240, 1, 4096]
    - [190, 0.0]
  - - [1024, 3960, 1, 1024]
    - [206, 0.0]
  - - [1024, 3960, 1, 4096]
    - [198, 0.0]
  - - [4096, 3240, 1, 1024]
    - [211, 0.0]
  - - [4096, 3960, 1, 1024]
    - [193, 0.0]
  - - [42720, 3960, 1, 1024]
    - [192, 0.0]
  - - [14, 14, 1, 64]
    - [270, 0.0]
  - - [15, 14, 1, 64]
    - [269, 0.0]
  - - [15, 15, 1, 64]
    - [269, 0.0]
  - - [15, 15, 1, 64]
    - [269, 0.0]
  - - [17, 15, 1, 64]
    - [272, 0.0]
  - - [17, 17, 1, 64]
    - [270, 0.0]
  - - [17, 17, 1, 64]
    - [270, 0.0]
  - - [21, 17, 1, 64]
    - [273, 0.0]
  - - [21, 21, 1, 64]
    - [269, 0.0]
  - - [24, 24, 1, 64]
    - [272, 0.0]
  - - [30, 30, 1, 64]
    - [272, 0.0]
  - - [30, 31, 1, 64]
    - [272, 0.0]
  - - [31, 31, 1, 64]
    - [271, 0.0]
  - - [32, 32, 1, 64]
    - [272, 0.0]
  - - [32, 35, 1, 64]
    - [272, 0.0]
  - - [34, 24, 1, 64]
    - [271, 0.0]
  - - [34, 34, 1, 64]
    - [272, 0.0]
  - - [35, 35, 1, 64]
    - [272, 0.0]
  - - [27, 27, 1, 64]
    - [271, 0.0]
  - - [27, 33, 1, 64]
    - [272, 0.0]
  - - [33, 33, 1, 64]
    - [183, 0.0]
  - - [30, 30, 2048, 64]
    - [279, 0.0]
  - - [30, 31, 2048, 64]
    - [277, 0.0]
  - - [31, 31, 2048, 64]
    - [274, 0.0]
  - - [27, 27, 1920, 64]
    - [276, 0.0]
  - - [27, 33, 1920, 64]
    - [279, 0.0]
  - - [33, 33, 1920, 64]
    - [278, 0.0]
  - - [14, 14, 10880, 64]
    - [276, 0.0]
  - - [15, 14, 10880, 64]
    - [275, 0.0]
  - - [15, 15, 7680, 64]
    - [275, 0.0]
  - - [15, 15, 10880, 64]
    - [275, 0.0]
  - - [17, 15, 7680, 64]
    - [275, 0.0]
  - - [17, 17, 7680, 64]
    - [276, 0.0]
  - - [2368, 1024, 1, 1]
    - [328, 0.0]
  - - [448, 1, 1, 256]
    - [343, 0.0]
  - - [5056, 1408, 1, 3328]
    - [309, 0.0]
  - - [5056, 1856, 1, 3328]
    - [306, 0.0]
  - - [5888, 128, 1, 1]
    - [332, 0.0]
  - - [448, 3584, 1, 3328]
    - [306, 0.0]
  - - [704, 64, 1, 3328]
    - [298, 0.0]
  - - [5056, 4288, 1, 32]
    - [313, 0.0]
  - - [3584, 1024, 1, 256]
    - [306, 0.0]
  - - [32, 5056, 1, 1280]
    - [326, 0.0]
  - - [1856, 256, 1, 1]
    - [328, 0.0]
  - - [256, 1856, 1, 32]
    - [321, 0.0]
  - - [1408, 3584, 1, 3328]
    - [306, 0.0]
  - - [128, 3584, 1, 1280]
    - [300, 0.0]
  - - [1024, 2368, 1, 3328]
    - [306, 0.0]
  - - [4288, 64, 1, 3328]
    - [298, 0.0]
  - - [1, 4288, 1, 1280]
    - [343, 0.0]
  - - [2368, 64, 1, 1]
    - [341, 0.0]
  - - [256, 128, 1, 256]
    - [283, 0.0]
  - - [448, 64, 1, 1]
    - [336, 0.0]
  - - [32, 1408, 1, 32]
    - [315, 0.0]
  - - [448, 3584, 1, 32]
    - [321, 0.0]
  - - [64, 1024, 1, 1280]
    - [298, 0.0]
  - - [1, 1408, 1, 3328]
    - [344, 0.0]
  - - [1408, 128, 1, 32]
    - [315, 0.0]
  - - [4288, 6784, 1, 3328]
    - [306, 0.0]
  - - [1024, 1, 1, 3328]
    - [344, 0.0]
  - - [2944, 128, 1, 32]
    - [322, 0.0]
  - - [64, 6784, 1, 1]
    - [328, 0.0]
  - - [1024, 64, 1, 1280]
    - [298, 0.0]
  - - [448, 128, 1, 256]
    - [283, 0.0]
  - - [64, 5056, 1, 3328]
    - [294, 0.0]
  - - [5888, 4288, 1, 3328]
    - [306, 0.0]
  - - [1, 2368, 1, 1280]
    - [344, 0.0]
  - - [704, 1024, 1, 1]
    - [333, 0.0]
  - - [2368, 1408, 1, 32]
    - [313, 0.0]
  - - [256, 1856, 1, 1280]
    - [300, 0.0]
  - - [1024, 2944, 1, 1]
    - [328, 0.0]
  - - [2944, 3584, 1, 3328]
    - [306, 0.0]
  - - [2368, 2944, 1, 1280]
    - [306, 0.0]
  - - [256, 1408, 1, 1]
    - [328, 0.0]
  - - [1, 1024, 1, 3328]
    - [344, 0.0]
  - - [6784, 5888, 1, 3328]
    - [304, 0.0]
  - - [3584, 1408, 1, 32]
    - [313, 0.0]
  - - [5056, 256, 1, 256]
    - [306, 0.0]
  - - [1856, 2368, 1, 256]
    - [306, 0.0]
  - - [2368, 1024, 1, 3328]
    - [306, 0.0]
  - - [3584, 4288, 1, 32]
    - [313, 0.0]
  - - [1024, 1024, 1, 1280]
    - [309, 0.0]
  - - [3584, 3584, 1, 1]
    - [332, 0.0]
  - - [32, 2944, 1, 3328]
    - [326, 0.0]
  - - [704, 1408, 1, 3328]
    - [301, 0.0]
  - - [1408, 704, 1, 256]
    - [306, 0.0]
  - - [704, 64, 1, 32]
    - [315, 0.0]
  - - [5888, 1, 1, 3328]
    - [343, 0.0]
  - - [2368, 32, 1, 256]
    - [322, 0.0]
  - - [6784, 128, 1, 3328]
    - [286, 0.0]
  - - [2944, 256, 1, 1]
    - [337, 0.0]
  - - [1408, 2368, 1, 1]
    - [333, 0.0]
  - - [32, 448, 1, 3328]
    - [326, 0.0]
  - - [5056, 1, 1, 3328]
    - [343, 0.0]
  - - [2944, 256, 1, 32]
    - [315, 0.0]
  - - [5056, 6784, 1, 1280]
    - [306, 0.0]
  - - [4288, 5056, 1, 1]
    - [328, 0.0]
  - - [5056, 4288, 1, 1]
    - [328, 0.0]
  - - [128, 4288, 1, 3328]
    - [300, 0.0]
  - - [5056, 128, 1, 256]
    - [294, 0.0]
  - - [1408, 4288, 1, 1280]
    - [306, 0.0]
  - - [1856, 704, 1, 1280]
    - [306, 0.0]
  - - [4288, 1024, 1, 3328]
    - [306, 0.0]
  - - [1, 5888, 1, 3328]
    - [343, 0.0]
  - - [1024, 128, 1, 32]
    - [315, 0.0]
  - - [32, 4288, 1, 1280]
    - [326, 0.0]
  - - [1024, 5056, 1, 1]
    - [328, 0.0]
  - - [704, 3584, 1, 1280]
    - [306, 0.0]
  - - [1856, 5056, 1, 256]
    - [306, 0.0]
  - - [1408, 1024, 1, 1280]
    - [306, 0.0]
  - - [5056, 5888, 1, 3328]
    - [305, 0.0]
  - - [448, 1, 1, 1]
    - [336, 0.0]
  - - [3584, 3584, 1, 1280]
    - [306, 0.0]
  - - [2368, 3584, 1, 32]
    - [313, 0.0]
  - - [2944, 2368, 1, 1]
    - [328, 0.0]
  - - [704, 4288, 1, 1]
    - [328, 0.0]
  - - [2368, 256, 1, 32]
    - [317, 0.0]
  - - [1024, 6784, 1, 1280]
    - [306, 0.0]
  - - [1024, 3584, 1, 1]
    - [334, 0.0]
  - - [32, 5056, 1, 32]
    - [317, 0.0]
  - - [5888, 32, 1, 32]
    - [315, 0.0]
  - - [64, 128, 1, 3328]
    - [295, 0.0]
  - - [256, 5056, 1, 32]
    - [321, 0.0]
  - - [5056, 64, 1, 32]
    - [322, 0.0]
  - - [2368, 5056, 1, 32]
    - [313, 0.0]
  - - [6784, 1856, 1, 32]
    - [313, 0.0]
  - - [64, 128, 1, 1]
    - [328, 0.0]
  - - [64, 2368, 1, 1280]
    - [295, 0.0]
  - - [128, 704, 1, 32]
    - [315, 0.0]
  - - [64, 6784, 1, 3328]
    - [297, 0.0]
  - - [2944, 256, 1, 1280]
    - [306, 0.0]
  - - [5056, 704, 1, 1]
    - [328, 0.0]
  - - [2944, 4288, 1, 256]
    - [306, 0.0]
  - - [1024, 1024, 1, 3328]
    - [309, 0.0]
  - - [5056, 704, 1, 32]
    - [317, 0.0]
  - - [1856, 4288, 1, 3328]
    - [306, 0.0]
  - - [1, 1856, 1, 256]
    - [343, 0.0]
  - - [6784, 4288, 1, 32]
    - [313, 0.0]
  - - [5888, 64, 1, 256]
    - [286, 0.0]
  - - [256, 128, 1, 1]
    - [340, 0.0]
  - - [5888, 5056, 1, 256]
    - [306, 0.0]
  - - [2944, 448, 1, 256]
    - [306, 0.0]
  - - [3584, 2368, 1, 3328]
    - [306, 0.0]
  - - [4288, 1856, 1, 1]
    - [333, 0.0]
  - - [1856, 2944, 1, 1]
    - [328, 0.0]
  - - [32, 4288, 1, 3328]
    - [326, 0.0]
  - - [1, 3584, 1, 3328]
    - [344, 0.0]
  - - [256, 32, 1, 3328]
    - [326, 0.0]
  - - [1856, 2368, 1, 32]
    - [313, 0.0]
  - - [4288, 1856, 1, 32]
    - [313, 0.0]
  - - [5056, 64, 1, 3328]
    - [286, 0.0]
  - - [6784, 1, 1, 1280]
    - [343, 0.0]
  - - [1024, 448, 1, 32]
    - [315, 0.0]
  - - [1408, 64, 1, 1]
    - [335, 0.0]
  - - [1, 1, 1, 3328]
    - [344, 0.0]
  - - [5056, 2368, 1, 256]
    - [306, 0.0]
  - - [1408, 5888, 1, 256]
    - [309, 0.0]
  - - [5056, 6784, 1, 1]
    - [333, 0.0]
  - - [32, 448, 1, 1280]
    - [326, 0.0]
  - - [32, 448, 1, 32]
    - [321, 0.0]
  - - [1856, 64, 1, 256]
    - [291, 0.0]
  - - [1024, 1408, 1, 3328]
    - [306, 0.0]
  - - [256, 5056, 1, 1280]
    - [306, 0.0]
  - - [704, 2368, 1, 1]
    - [330, 0.0]
  - - [64, 1024, 1, 32]
    - [315, 0.0]
  - - [1024, 256, 1, 256]
    - [292, 0.0]
  - - [128, 1, 1, 1]
    - [344, 0.0]
  - - [3584, 4288, 1, 1280]
    - [306, 0.0]
  - - [1856, 128, 1, 32]
    - [322, 0.0]
  - - [1856, 128, 1, 1280]
    - [300, 0.0]
  - - [128, 2944, 1, 3328]
    - [294, 0.0]
  - - [1, 6784, 1, 3328]
    - [343, 0.0]
  - - [3584, 2368, 1, 1]
    - [334, 0.0]
  - - [4288, 448, 1, 3328]
    - [306, 0.0]
  - - [4288, 32, 1, 3328]
    - [326, 0.0]
  - - [256, 1856, 1, 1]
    - [330, 0.0]
  - - [704, 6784, 1, 1280]
    - [306, 0.0]
  - - [2368, 4288, 1, 32]
    - [313, 0.0]
  - - [704, 5056, 1, 1280]
    - [306, 0.0]
  - - [256, 3584, 1, 3328]
    - [309, 0.0]
  - - [1024, 32, 1, 3328]
    - [326, 0.0]
  - - [3584, 6784, 1, 32]
    - [313, 0.0]
  - - [3584, 6784, 1, 1280]
    - [306, 0.0]
  - - [4288, 4288, 1, 3328]
    - [306, 0.0]
  - - [3584, 64, 1, 1280]
    - [300, 0.0]
  - - [64, 1856, 1, 256]
    - [283, 0.0]
  - - [3584, 64, 1, 32]
    - [322, 0.0]
  - - [448, 1, 1, 1280]
    - [344, 0.0]
  - - [256, 4288, 1, 1280]
    - [306, 0.0]
  - - [1408, 3584, 1, 1]
    - [327, 0.0]
  - - [4288, 1856, 1, 3328]
    - [306, 0.0]
  - - [1856, 2944, 1, 1280]
    - [306, 0.0]
  - - [4288, 256, 1, 256]
    - [306, 0.0]
  - - [128, 5888, 1, 32]
    - [321, 0.0]
  - - [128, 5888, 1, 1280]
    - [306, 0.0]
  - - [1408, 128, 1, 3328]
    - [298, 0.0]
  - - [3584, 256, 1, 256]
    - [306, 0.0]
  - - [32, 6784, 1, 3328]
    - [326, 0.0]
  - - [64, 64, 1, 1280]
    - [295, 0.0]
  - - [32, 3584, 1, 256]
    - [326, 0.0]
  - - [704, 256, 1, 32]
    - [315, 0.0]
  - - [448, 128, 1, 3328]
    - [295, 0.0]
  - - [64, 2944, 1, 3328]
    - [298, 0.0]
  - - [64, 4288, 1, 3328]
    - [282, 0.0]
  - - [5056, 1024, 1, 3328]
    - [309, 0.0]
  - - [128, 256, 1, 1280]
    - [295, 0.0]
  - - [1856, 256, 1, 256]
    - [292, 0.0]
  - - [3584, 704, 1, 1]
    - [333, 0.0]
  - - [256, 704, 1, 256]
    - [292, 0.0]
  - - [448, 5056, 1, 1]
    - [333, 0.0]
  - - [5888, 5888, 1, 256]
    - [306, 0.0]
  - - [3584, 704, 1, 32]
    - [321, 0.0]
  - - [448, 6784, 1, 3328]
    - [306, 0.0]
  - - [6784, 4288, 1, 1]
    - [329, 0.0]
  - - [3584, 6784, 1, 1]
    - [327, 0.0]
  - - [1408, 2368, 1, 32]
    - [313, 0.0]
  - - [448, 5056, 1, 32]
    - [317, 0.0]
  - - [4288, 4288, 1, 1280]
    - [306, 0.0]
  - - [6784, 1408, 1, 1]
    - [327, 0.0]
  - - [1856, 5888, 1, 3328]
    - [306, 0.0]
  - - [1024, 704, 1, 1]
    - [330, 0.0]
  - - [3584, 1856, 1, 3328]
    - [306, 0.0]
  - - [5056, 5888, 1, 1]
    - [328, 0.0]
  - - [2944, 1024, 1, 256]
    - [306, 0.0]
  - - [448, 1408, 1, 3328]
    - [306, 0.0]
  - - [5056, 32, 1, 3328]
    - [326, 0.0]
  - - [2368, 4288, 1, 3328]
    - [306, 0.0]
  - - [1024, 704, 1, 32]
    - [322, 0.0]
  - - [448, 2944, 1, 256]
    - [306, 0.0]
  - - [2944, 6784, 1, 256]
    - [306, 0.0]
  - - [2368, 2368, 1, 1280]
    - [306, 0.0]
  - - [5888, 128, 1, 3328]
    - [306, 0.0]
  - - [256, 256, 1, 32]
    - [315, 0.0]
  - - [1024, 1, 1, 256]
    - [343, 0.0]
  - - [3584, 3584, 1, 32]
    - [313, 0.0]
  - - [2944, 448, 1, 1]
    - [343, 0.0]
  - - [128, 32, 1, 32]
    - [315, 0.0]
  - - [5056, 64, 1, 1280]
    - [286, 0.0]
  - - [2944, 2944, 1, 1280]
    - [306, 0.0]
  - - [1, 2368, 1, 256]
    - [343, 0.0]
  - - [1408, 5056, 1, 1]
    - [327, 0.0]
  - - [2944, 32, 1, 1280]
    - [326, 0.0]
  - - [64, 1408, 1, 3328]
    - [295, 0.0]
  - - [256, 448, 1, 1280]
    - [295, 0.0]
  - - [2368, 6784, 1, 1]
    - [328, 0.0]
  - - [6784, 4288, 1, 1280]
    - [306, 0.0]
  - - [2944, 704, 1, 256]
    - [306, 0.0]
  - - [2368, 6784, 1, 1280]
    - [306, 0.0]
  - - [704, 2944, 1, 3328]
    - [293, 0.0]
  - - [5888, 256, 1, 1]
    - [328, 0.0]
  - - [704, 704, 1, 32]
    - [317, 0.0]
  - - [256, 4288, 1, 256]
    - [306, 0.0]
  - - [5056, 6784, 1, 32]
    - [313, 0.0]
  - - [5056, 128, 1, 1]
    - [328, 0.0]
  - - [448, 5056, 1, 1280]
    - [306, 0.0]
  - - [448, 448, 1, 256]
    - [292, 0.0]
  - - [256, 5888, 1, 3328]
    - [306, 0.0]
  - - [704, 448, 1, 1280]
    - [292, 0.0]
  - - [448, 64, 1, 256]
    - [283, 0.0]
  - - [1024, 704, 1, 1280]
    - [306, 0.0]
  - - [5888, 1024, 1, 1]
    - [332, 0.0]
  - - [5888, 448, 1, 32]
    - [321, 0.0]
  - - [6784, 2944, 1, 256]
    - [306, 0.0]
  - - [1024, 256, 1, 1]
    - [328, 0.0]
  - - [2368, 448, 1, 256]
    - [306, 0.0]
  - - [4288, 256, 1, 3328]
    - [306, 0.0]
  - - [4288, 2944, 1, 256]
    - [306, 0.0]
  - - [448, 5888, 1, 3328]
    - [306, 0.0]
  - - [128, 256, 1, 3328]
    - [295, 0.0]
  - - [128, 6784, 1, 32]
    - [317, 0.0]
  - - [1856, 64, 1, 32]
    - [315, 0.0]
  - - [1408, 4288, 1, 1]
    - [327, 0.0]
  - - [1408, 1856, 1, 3328]
    - [306, 0.0]
  - - [4288, 64, 1, 256]
    - [298, 0.0]
  - - [3584, 1024, 1, 3328]
    - [306, 0.0]
  - - [2944, 5888, 1, 3328]
    - [306, 0.0]
  - - [128, 6784, 1, 3328]
    - [286, 0.0]
  - - [448, 4288, 1, 3328]
    - [306, 0.0]
  - - [704, 2368, 1, 256]
    - [306, 0.0]
  - - [1, 64, 1, 3328]
    - [344, 0.0]
  - - [4288, 128, 1, 1]
    - [328, 0.0]
  - - [256, 2368, 1, 32]
    - [322, 0.0]
  - - [4288, 3584, 1, 3328]
    - [306, 0.0]
  - - [1408, 64, 1, 256]
    - [282, 0.0]
  - - [1408, 1024, 1, 1]
    - [327, 0.0]
  - - [64, 1024, 1, 1]
    - [335, 0.0]
  - - [1408, 1024, 1, 256]
    - [306, 0.0]
  - - [5056, 3584, 1, 1]
    - [333, 0.0]
  - - [448, 1024, 1, 256]
    - [306, 0.0]
  - - [6784, 6784, 1, 3328]
    - [309, 0.0]
  - - [6784, 32, 1, 32]
    - [321, 0.0]
  - - [64, 1024, 1, 3328]
    - [295, 0.0]
  - - [2368, 2944, 1, 3328]
    - [306, 0.0]
  - - [448, 448, 1, 1280]
    - [300, 0.0]
  - - [5056, 3584, 1, 32]
    - [313, 0.0]
  - - [5056, 3584, 1, 1280]
    - [306, 0.0]
  - - [1856, 1856, 1, 256]
    - [306, 0.0]
  - - [32, 5888, 1, 256]
    - [326, 0.0]
  - - [256, 1408, 1, 32]
    - [322, 0.0]
  - - [2944, 1, 1, 3328]
    - [344, 0.0]
  - - [32, 704, 1, 3328]
    - [326, 0.0]
  - - [5888, 4288, 1, 1]
    - [332, 0.0]
  - - [1024, 128, 1, 256]
    - [281, 0.0]
  - - [32, 1856, 1, 3328]
    - [326, 0.0]
  - - [5056, 704, 1, 256]
    - [306, 0.0]
  - - [2368, 5056, 1, 256]
    - [306, 0.0]
  - - [1024, 5056, 1, 256]
    - [306, 0.0]
  - - [32, 1024, 1, 3328]
    - [326, 0.0]
  - - [5888, 448, 1, 256]
    - [306, 0.0]
  - - [6784, 5056, 1, 1280]
    - [306, 0.0]
  - - [4288, 6784, 1, 1280]
    - [306, 0.0]
  - - [64, 1, 1, 256]
    - [343, 0.0]
  - - [1856, 64, 1, 1280]
    - [298, 0.0]
  - - [128, 1408, 1, 1]
    - [330, 0.0]
  - - [1024, 64, 1, 32]
    - [315, 0.0]
  - - [1024, 64, 1, 3328]
    - [295, 0.0]
  - - [704, 6784, 1, 3328]
    - [306, 0.0]
  - - [2944, 1856, 1, 1]
    - [328, 0.0]
  - - [5888, 4288, 1, 1280]
    - [306, 0.0]
  - - [5888, 3584, 1, 1280]
    - [306, 0.0]
  - - [32, 2368, 1, 1280]
    - [326, 0.0]
  - - [3584, 1408, 1, 1280]
    - [306, 0.0]
  - - [1024, 2944, 1, 256]
    - [309, 0.0]
  - - [1, 2944, 1, 1280]
    - [344, 0.0]
  - - [32, 1024, 1, 256]
    - [322, 0.0]
  - - [2944, 1856, 1, 1280]
    - [306, 0.0]
  - - [3584, 1, 1, 1280]
    - [344, 0.0]
  - - [256, 3584, 1, 32]
    - [321, 0.0]
  - - [1024, 2368, 1, 1]
    - [327, 0.0]
  - - [2944, 3584, 1, 1280]
    - [306, 0.0]
  - - [64, 1, 1, 1]
    - [333, 0.0]
  - - [1856, 4288, 1, 256]
    - [306, 0.0]
  - - [256, 1, 1, 256]
    - [343, 0.0]
  - - [256, 128, 1, 3328]
    - [295, 0.0]
  - - [1, 1856, 1, 3328]
    - [344, 0.0]
  - - [448, 3584, 1, 1]
    - [333, 0.0]
  - - [2368, 2944, 1, 32]
    - [313, 0.0]
  - - [128, 4288, 1, 32]
    - [322, 0.0]
  - - [448, 256, 1, 256]
    - [291, 0.0]
  - - [64, 64, 1, 1]
    - [333, 0.0]
  - - [1, 1408, 1, 1]
    - [328, 0.0]
  - - [2944, 32, 1, 32]
    - [315, 0.0]
  - - [448, 1856, 1, 1]
    - [339, 0.0]
  - - [4288, 704, 1, 256]
    - [306, 0.0]
  - - [1856, 1024, 1, 256]
    - [306, 0.0]
  - - [448, 1856, 1, 32]
    - [317, 0.0]
  - - [448, 1856, 1, 3328]
    - [301, 0.0]
  - - [448, 448, 1, 32]
    - [323, 0.0]
  - - [1024, 448, 1, 256]
    - [306, 0.0]
  - - [6784, 1, 1, 256]
    - [343, 0.0]
  - - [704, 6784, 1, 32]
    - [313, 0.0]
  - - [1024, 4288, 1, 1]
    - [328, 0.0]
  - - [704, 256, 1, 3328]
    - [300, 0.0]
  - - [704, 1856, 1, 32]
    - [321, 0.0]
  - - [1408, 5888, 1, 1280]
    - [306, 0.0]
  - - [32, 704, 1, 1280]
    - [326, 0.0]
  - - [5056, 1856, 1, 256]
    - [306, 0.0]
  - - [6784, 704, 1, 1280]
    - [306, 0.0]
  - - [704, 1408, 1, 32]
    - [321, 0.0]
  - - [5888, 1024, 1, 256]
    - [306, 0.0]
  - - [64, 2944, 1, 1]
    - [333, 0.0]
  - - [64, 2944, 1, 32]
    - [317, 0.0]
  - - [64, 2944, 1, 1280]
    - [295, 0.0]
  - - [6784, 1856, 1, 3328]
    - [306, 0.0]
  - - [2368, 5888, 1, 1280]
    - [306, 0.0]
  - - [5888, 6784, 1, 32]
    - [313, 0.0]
  - - [1, 6784, 1, 256]
    - [343, 0.0]
  - - [6784, 6784, 1, 32]
    - [313, 0.0]
  - - [256, 1, 1, 1280]
    - [344, 0.0]
  - - [5888, 128, 1, 32]
    - [317, 0.0]
  - - [6784, 256, 1, 256]
    - [306, 0.0]
  - - [2368, 3584, 1, 3328]
    - [306, 0.0]
  - - [128, 4288, 1, 1280]
    - [306, 0.0]
  - - [32, 3584, 1, 1280]
    - [326, 0.0]
  - - [5888, 1024, 1, 1280]
    - [306, 0.0]
  - - [1856, 704, 1, 3328]
    - [306, 0.0]
  - - [5888, 6784, 1, 3328]
    - [306, 0.0]
  - - [6784, 448, 1, 1]
    - [328, 0.0]
  - - [6784, 1856, 1, 1]
    - [329, 0.0]
  - - [128, 32, 1, 1280]
    - [326, 0.0]
  - - [2944, 2368, 1, 1280]
    - [306, 0.0]
  - - [128, 256, 1, 1]
    - [329, 0.0]
  - - [6784, 448, 1, 32]
    - [317, 0.0]
  - - [6784, 448, 1, 3328]
    - [306, 0.0]
  - - [1, 6784, 1, 1]
    - [333, 0.0]
  - - [448, 3584, 1, 1280]
    - [306, 0.0]
  - - [1408, 6784, 1, 1280]
    - [306, 0.0]
  - - [5056, 5888, 1, 1280]
    - [306, 0.0]
  - - [32, 2944, 1, 32]
    - [315, 0.0]
  - - [5888, 704, 1, 1]
    - [333, 0.0]
  - - [3584, 1856, 1, 1]
    - [333, 0.0]
  - - [1, 256, 1, 256]
    - [344, 0.0]
  - - [5056, 2944, 1, 32]
    - [313, 0.0]
  - - [32, 6784, 1, 256]
    - [326, 0.0]
  - - [4288, 6784, 1, 1]
    - [328, 0.0]
  - - [1, 4288, 1, 3328]
    - [343, 0.0]
  - - [1024, 6784, 1, 1]
    - [334, 0.0]
  - - [2368, 5888, 1, 32]
    - [313, 0.0]
  - - [448, 448, 1, 3328]
    - [300, 0.0]
  - - [1, 256, 1, 1]
    - [330, 0.0]
  - - [3584, 4288, 1, 1]
    - [334, 0.0]
  - - [5888, 1024, 1, 3328]
    - [306, 0.0]
  - - [6784, 5888, 1, 256]
    - [306, 0.0]
  - - [704, 128, 1, 1280]
    - [298, 0.0]
  - - [4288, 128, 1, 256]
    - [306, 0.0]
  - - [5056, 1024, 1, 1]
    - [328, 0.0]
  - - [32, 3584, 1, 3328]
    - [326, 0.0]
  - - [1024, 1, 1, 1280]
    - [344, 0.0]
  - - [4288, 2368, 1, 32]
    - [313, 0.0]
  - - [704, 3584, 1, 1]
    - [330, 0.0]
  - - [704, 1856, 1, 3328]
    - [306, 0.0]
  - - [2944, 128, 1, 1280]
    - [286, 0.0]
  - - [1, 2368, 1, 3328]
    - [344, 0.0]
  - - [6784, 704, 1, 32]
    - [313, 0.0]
  - - [4288, 1, 1, 1280]
    - [343, 0.0]
  - - [704, 5888, 1, 256]
    - [306, 0.0]
  - - [2368, 3584, 1, 1280]
    - [306, 0.0]
  - - [64, 448, 1, 256]
    - [283, 0.0]
  - - [1408, 448, 1, 1280]
    - [306, 0.0]
  - - [3584, 5056, 1, 32]
    - [313, 0.0]
  - - [1024, 32, 1, 1280]
    - [326, 0.0]
  - - [128, 2368, 1, 1]
    - [335, 0.0]
  - - [6784, 1856, 1, 1280]
    - [306, 0.0]
  - - [5056, 5056, 1, 3328]
    - [307, 0.0]
  - - [128, 704, 1, 1280]
    - [298, 0.0]
  - - [128, 2944, 1, 1280]
    - [286, 0.0]
  - - [2368, 5056, 1, 1]
    - [333, 0.0]
  - - [5888, 1408, 1, 256]
    - [309, 0.0]
  - - [2368, 1024, 1, 32]
    - [313, 0.0]
  - - [256, 256, 1, 3328]
    - [295, 0.0]
  - - [64, 4288, 1, 1]
    - [328, 0.0]
  - - [4288, 1024, 1, 256]
    - [306, 0.0]
  - - [3584, 32, 1, 32]
    - [322, 0.0]
  - - [3584, 64, 1, 1]
    - [339, 0.0]
  - - [704, 32, 1, 1280]
    - [326, 0.0]
  - - [32, 4288, 1, 32]
    - [326, 0.0]
  - - [64, 64, 1, 3328]
    - [295, 0.0]
  - - [64, 1408, 1, 1]
    - [335, 0.0]
  - - [4288, 5888, 1, 1280]
    - [306, 0.0]
  - - [1856, 2944, 1, 3328]
    - [306, 0.0]
  - - [256, 1024, 1, 256]
    - [292, 0.0]
  - - [5056, 5888, 1, 256]
    - [306, 0.0]
  - - [1408, 128, 1, 1280]
    - [298, 0.0]
  - - [5056, 256, 1, 3328]
    - [306, 0.0]
  - - [1024, 5888, 1, 1280]
    - [306, 0.0]
  - - [1024, 448, 1, 1]
    - [333, 0.0]
  - - [32, 32, 1, 32]
    - [317, 0.0]
  - - [5056, 1, 1, 1280]
    - [343, 0.0]
  - - [5888, 5056, 1, 1280]
    - [306, 0.0]
  - - [5888, 2944, 1, 1]
    - [327, 0.0]
  - - [64, 4288, 1, 1280]
    - [290, 0.0]
  - - [1408, 4288, 1, 3328]
    - [306, 0.0]
  - - [704, 2944, 1, 32]
    - [313, 0.0]
  - - [1, 5888, 1, 1280]
    - [343, 0.0]
  - - [2944, 4288, 1, 3328]
    - [306, 0.0]
  - - [256, 2944, 1, 256]
    - [306, 0.0]
  - - [704, 448, 1, 32]
    - [322, 0.0]
  - - [5056, 2944, 1, 256]
    - [306, 0.0]
  - - [704, 1024, 1, 256]
    - [306, 0.0]
  - - [2368, 1856, 1, 256]
    - [306, 0.0]
  - - [64, 3584, 1, 1]
    - [330, 0.0]
  - - [1024, 128, 1, 1280]
    - [298, 0.0]
  - - [2368, 4288, 1, 1280]
    - [306, 0.0]
  - - [3584, 448, 1, 256]
    - [306, 0.0]
  - - [256, 6784, 1, 256]
    - [306, 0.0]
  - - [1024, 32, 1, 32]
    - [315, 0.0]
  - - [1024, 1408, 1, 1]
    - [328, 0.0]
  - - [128, 64, 1, 32]
    - [315, 0.0]
  - - [64, 1, 1, 1280]
    - [344, 0.0]
  - - [2368, 32, 1, 32]
    - [315, 0.0]
  - - [256, 5888, 1, 1]
    - [333, 0.0]
  - - [2944, 2944, 1, 1]
    - [327, 0.0]
  - - [6784, 3584, 1, 256]
    - [306, 0.0]
  - - [1408, 1856, 1, 256]
    - [306, 0.0]
  - - [128, 1408, 1, 256]
    - [281, 0.0]
  - - [2944, 2944, 1, 32]
    - [313, 0.0]
  - - [2944, 2944, 1, 3328]
    - [306, 0.0]
  - - [1, 2944, 1, 256]
    - [343, 0.0]
  - - [448, 32, 1, 1280]
    - [326, 0.0]
  - - [3584, 1, 1, 256]
    - [339, 0.0]
  - - [704, 32, 1, 3328]
    - [326, 0.0]
  - - [256, 448, 1, 3328]
    - [298, 0.0]
  - - [128, 128, 1, 256]
    - [283, 0.0]
  - - [2368, 64, 1, 256]
    - [298, 0.0]
  - - [64, 448, 1, 1280]
    - [295, 0.0]
  - - [6784, 1408, 1, 32]
    - [313, 0.0]
  - - [1408, 448, 1, 3328]
    - [306, 0.0]
  - - [2368, 6784, 1, 3328]
    - [306, 0.0]
  - - [256, 2368, 1, 1]
    - [341, 0.0]
  - - [4288, 3584, 1, 32]
    - [313, 0.0]
  - - [5888, 64, 1, 3328]
    - [286, 0.0]
  - - [3584, 704, 1, 1280]
    - [306, 0.0]
  - - [448, 5056, 1, 3328]
    - [306, 0.0]
  - - [4288, 448, 1, 256]
    - [306, 0.0]
  - - [5056, 256, 1, 1280]
    - [306, 0.0]
  - - [704, 448, 1, 3328]
    - [300, 0.0]
  - - [2944, 5888, 1, 32]
    - [313, 0.0]
  - - [3584, 5056, 1, 256]
    - [306, 0.0]
  - - [6784, 1, 1, 3328]
    - [343, 0.0]
  - - [32, 2368, 1, 3328]
    - [326, 0.0]
  - - [4288, 256, 1, 1]
    - [329, 0.0]
  - - [64, 256, 1, 1]
    - [333, 0.0]
  - - [1856, 448, 1, 3328]
    - [306, 0.0]
  - - [3584, 2368, 1, 256]
    - [306, 0.0]
  - - [4288, 4288, 1, 256]
    - [306, 0.0]
  - - [4288, 256, 1, 1280]
    - [306, 0.0]
  - - [448, 5056, 1, 256]
    - [306, 0.0]
  - - [128, 1856, 1, 1]
    - [330, 0.0]
  - - [4288, 704, 1, 1280]
    - [306, 0.0]
  - - [128, 1856, 1, 32]
    - [326, 0.0]
  - - [2368, 704, 1, 1]
    - [333, 0.0]
  - - [3584, 32, 1, 256]
    - [326, 0.0]
  - - [448, 2368, 1, 1280]
    - [306, 0.0]
  - - [3584, 256, 1, 1]
    - [328, 0.0]
  - - [1408, 1856, 1, 1280]
    - [306, 0.0]
  - - [3584, 4288, 1, 3328]
    - [306, 0.0]
  - - [448, 4288, 1, 32]
    - [313, 0.0]
  - - [448, 4288, 1, 1280]
    - [306, 0.0]
  - - [64, 3584, 1, 256]
    - [292, 0.0]
  - - [1, 6784, 1, 1280]
    - [343, 0.0]
  - - [5056, 1024, 1, 256]
    - [306, 0.0]
  - - [2368, 448, 1, 32]
    - [317, 0.0]
  - - [4288, 3584, 1, 1280]
    - [306, 0.0]
  - - [32, 2944, 1, 1280]
    - [326, 0.0]
  - - [1408, 704, 1, 1]
    - [330, 0.0]
  - - [2368, 256, 1, 256]
    - [306, 0.0]
  - - [1, 5056, 1, 1]
    - [333, 0.0]
  - - [4288, 32, 1, 32]
    - [322, 0.0]
  - - [1856, 3584, 1, 32]
    - [313, 0.0]
  - - [5056, 3584, 1, 3328]
    - [304, 0.0]
  - - [4288, 5056, 1, 256]
    - [306, 0.0]
  - - [1856, 5888, 1, 256]
    - [306, 0.0]
  - - [256, 256, 1, 256]
    - [291, 0.0]
  - - [2368, 3584, 1, 1]
    - [328, 0.0]
  - - [4288, 2368, 1, 256]
    - [306, 0.0]
  - - [448, 1, 1, 3328]
    - [344, 0.0]
  - - [1856, 256, 1, 1280]
    - [300, 0.0]
  - - [256, 2944, 1, 1]
    - [329, 0.0]
  - - [1408, 2944, 1, 3328]
    - [306, 0.0]
  - - [32, 1856, 1, 32]
    - [315, 0.0]
  - - [5888, 3584, 1, 1]
    - [332, 0.0]
  - - [256, 1, 1, 1]
    - [335, 0.0]
  - - [6784, 5056, 1, 3328]
    - [306, 0.0]
  - - [6784, 5056, 1, 1]
    - [327, 0.0]
  - - [5888, 3584, 1, 32]
    - [313, 0.0]
  - - [5888, 3584, 1, 3328]
    - [306, 0.0]
  - - [32, 1024, 1, 1280]
    - [326, 0.0]
  - - [1, 256, 1, 3328]
    - [344, 0.0]
  - - [1024, 6784, 1, 256]
    - [306, 0.0]
  - - [6784, 5888, 1, 32]
    - [313, 0.0]
  - - [1408, 1, 1, 1280]
    - [344, 0.0]
  - - [2368, 6784, 1, 32]
    - [313, 0.0]
  - - [6784, 64, 1, 1]
    - [333, 0.0]
  - - [5056, 1408, 1, 1280]
    - [309, 0.0]
  - - [3584, 1408, 1, 3328]
    - [306, 0.0]
  - - [2944, 3584, 1, 1]
    - [327, 0.0]
  - - [2944, 1408, 1, 1280]
    - [306, 0.0]
  - - [1856, 64, 1, 1]
    - [328, 0.0]
  - - [3584, 1024, 1, 1]
    - [328, 0.0]
  - - [256, 32, 1, 256]
    - [326, 0.0]
  - - [2944, 1856, 1, 3328]
    - [306, 0.0]
  - - [128, 1024, 1, 3328]
    - [295, 0.0]
  - - [1408, 128, 1, 1]
    - [333, 0.0]
  - - [2944, 3584, 1, 32]
    - [313, 0.0]
  - - [5888, 256, 1, 32]
    - [320, 0.0]
  - - [6784, 64, 1, 256]
    - [306, 0.0]
  - - [256, 128, 1, 1280]
    - [295, 0.0]
  - - [6784, 5056, 1, 256]
    - [306, 0.0]
  - - [1408, 32, 1, 3328]
    - [326, 0.0]
  - - [1856, 3584, 1, 1280]
    - [306, 0.0]
  - - [256, 5888, 1, 256]
    - [306, 0.0]
  - - [5056, 32, 1, 256]
    - [326, 0.0]
  - - [1024, 4288, 1, 3328]
    - [306, 0.0]
  - - [448, 2368, 1, 256]
    - [306, 0.0]
  - - [64, 1408, 1, 1280]
    - [295, 0.0]
  - - [3584, 32, 1, 1280]
    - [326, 0.0]
  - - [128, 2368, 1, 3328]
    - [286, 0.0]
  - - [64, 5056, 1, 256]
    - [286, 0.0]
  - - [256, 64, 1, 256]
    - [283, 0.0]
  - - [32, 1408, 1, 256]
    - [322, 0.0]
  - - [2368, 448, 1, 3328]
    - [306, 0.0]
  - - [2368, 1408, 1, 1]
    - [328, 0.0]
  - - [1, 1, 1, 1]
    - [333, 0.0]
  - - [1024, 1856, 1, 32]
    - [313, 0.0]
  - - [32, 1024, 1, 32]
    - [314, 0.0]
  - - [4288, 1, 1, 256]
    - [343, 0.0]
  - - [1856, 128, 1, 3328]
    - [300, 0.0]
  - - [5888, 2368, 1, 1]
    - [333, 0.0]
  - - [2368, 2368, 1, 1]
    - [328, 0.0]
  - - [704, 256, 1, 1280]
    - [300, 0.0]
  - - [704, 4288, 1, 256]
    - [306, 0.0]
  - - [5888, 2368, 1, 32]
    - [313, 0.0]
  - - [5888, 2368, 1, 1280]
    - [305, 0.0]
  - - [128, 256, 1, 256]
    - [283, 0.0]
  - - [2944, 5056, 1, 3328]
    - [306, 0.0]
  - - [6784, 704, 1, 3328]
    - [306, 0.0]
  - - [1856, 1856, 1, 32]
    - [313, 0.0]
  - - [4288, 2944, 1, 32]
    - [313, 0.0]
  - - [256, 5056, 1, 1]
    - [329, 0.0]
  - - [704, 64, 1, 256]
    - [283, 0.0]
  - - [256, 2368, 1, 3328]
    - [306, 0.0]
  - - [704, 1, 1, 1]
    - [328, 0.0]
  - - [128, 448, 1, 1280]
    - [295, 0.0]
  - - [5056, 5056, 1, 256]
    - [306, 0.0]
  - - [5888, 256, 1, 256]
    - [306, 0.0]
  - - [5888, 64, 1, 1]
    - [330, 0.0]
  - - [6784, 6784, 1, 256]
    - [309, 0.0]
  - - [256, 3584, 1, 1]
    - [328, 0.0]
  - - [2368, 1, 1, 256]
    - [343, 0.0]
  - - [448, 32, 1, 32]
    - [315, 0.0]
  - - [704, 64, 1, 1]
    - [341, 0.0]
  - - [3584, 704, 1, 3328]
    - [306, 0.0]
  - - [4288, 704, 1, 3328]
    - [306, 0.0]
  - - [4288, 2944, 1, 1280]
    - [306, 0.0]
  - - [448, 3584, 1, 256]
    - [306, 0.0]
  - - [704, 32, 1, 256]
    - [322, 0.0]
  - - [6784, 256, 1, 32]
    - [321, 0.0]
  - - [1856, 128, 1, 1]
    - [330, 0.0]
  - - [1856, 32, 1, 32]
    - [315, 0.0]
  - - [6784, 1408, 1, 1280]
    - [306, 0.0]
  - - [2368, 5056, 1, 1280]
    - [306, 0.0]
  - - [704, 1856, 1, 1280]
    - [306, 0.0]
  - - [1408, 1408, 1, 1280]
    - [309, 0.0]
  - - [448, 1024, 1, 3328]
    - [306, 0.0]
  - - [32, 704, 1, 32]
    - [315, 0.0]
  - - [256, 704, 1, 1]
    - [333, 0.0]
  - - [5888, 1856, 1, 32]
    - [313, 0.0]
  - - [5888, 704, 1, 3328]
    - [306, 0.0]
  - - [5056, 1, 1, 256]
    - [343, 0.0]
  - - [448, 6784, 1, 256]
    - [306, 0.0]
  - - [1024, 128, 1, 1]
    - [335, 0.0]
  - - [128, 64, 1, 256]
    - [283, 0.0]
  - - [1856, 128, 1, 256]
    - [292, 0.0]
  - - [2944, 5888, 1, 256]
    - [306, 0.0]
  - - [1024, 256, 1, 1280]
    - [300, 0.0]
  - - [128, 5056, 1, 32]
    - [317, 0.0]
  - - [128, 5056, 1, 1280]
    - [306, 0.0]
  - - [448, 32, 1, 3328]
    - [326, 0.0]
  - - [1856, 1408, 1, 32]
    - [313, 0.0]
  - - [64, 704, 1, 32]
    - [315, 0.0]
  - - [64, 704, 1, 3328]
    - [295, 0.0]
  - - [64, 2368, 1, 32]
    - [315, 0.0]
  - - [5888, 64, 1, 32]
    - [324, 0.0]
  - - [2368, 256, 1, 1]
    - [343, 0.0]
  - - [5888, 64, 1, 1280]
    - [294, 0.0]
  - - [5056, 1, 1, 1]
    - [341, 0.0]
  - - [5888, 2944, 1, 1280]
    - [309, 0.0]
  - - [32, 2368, 1, 256]
    - [322, 0.0]
  - - [256, 1408, 1, 256]
    - [292, 0.0]
  - - [448, 5888, 1, 1]
    - [333, 0.0]
  - - [3584, 1408, 1, 1]
    - [327, 0.0]
  - - [32, 6784, 1, 1280]
    - [326, 0.0]
  - - [32, 6784, 1, 32]
    - [322, 0.0]
  - - [448, 5888, 1, 32]
    - [313, 0.0]
  - - [5056, 704, 1, 1280]
    - [306, 0.0]
  - - [1856, 6784, 1, 1]
    - [333, 0.0]
  - - [5056, 64, 1, 1]
    - [335, 0.0]
  - - [1, 5888, 1, 1]
    - [328, 0.0]
  - - [2368, 1024, 1, 256]
    - [306, 0.0]
  - - [1856, 6784, 1, 32]
    - [313, 0.0]
  - - [1856, 6784, 1, 1280]
    - [306, 0.0]
  - - [64, 3584, 1, 3328]
    - [297, 0.0]
  - - [5888, 5056, 1, 3328]
    - [304, 0.0]
  - - [1, 2944, 1, 3328]
    - [344, 0.0]
  - - [1408, 6784, 1, 32]
    - [313, 0.0]
  - - [32, 5888, 1, 1280]
    - [326, 0.0]
  - - [448, 256, 1, 1]
    - [328, 0.0]
  - - [3584, 5888, 1, 3328]
    - [306, 0.0]
  - - [4288, 1408, 1, 256]
    - [306, 0.0]
  - - [448, 64, 1, 1280]
    - [295, 0.0]
  - - [128, 448, 1, 32]
    - [325, 0.0]
  - - [6784, 2368, 1, 256]
    - [306, 0.0]
  - - [1408, 448, 1, 32]
    - [317, 0.0]
  - - [1856, 1408, 1, 1280]
    - [306, 0.0]
  - - [448, 256, 1, 3328]
    - [298, 0.0]
  - - [1856, 2368, 1, 1]
    - [328, 0.0]
  - - [1408, 5056, 1, 3328]
    - [306, 0.0]
  - - [128, 704, 1, 3328]
    - [295, 0.0]
  - - [5056, 128, 1, 1280]
    - [286, 0.0]
  - - [5056, 4288, 1, 256]
    - [306, 0.0]
  - - [5056, 5056, 1, 32]
    - [313, 0.0]
  - - [1856, 704, 1, 256]
    - [306, 0.0]
  - - [64, 256, 1, 256]
    - [283, 0.0]
  - - [448, 5888, 1, 1280]
    - [306, 0.0]
  - - [128, 6784, 1, 256]
    - [286, 0.0]
  - - [5056, 448, 1, 256]
    - [306, 0.0]
  - - [4288, 5888, 1, 1]
    - [328, 0.0]
  - - [1856, 5056, 1, 1280]
    - [306, 0.0]
  - - [2368, 4288, 1, 1]
    - [333, 0.0]
  - - [2368, 32, 1, 3328]
    - [326, 0.0]
  - - [3584, 1856, 1, 256]
    - [306, 0.0]
  - - [256, 3584, 1, 256]
    - [306, 0.0]
  - - [64, 704, 1, 1]
    - [333, 0.0]
  - - [4288, 5888, 1, 32]
    - [313, 0.0]
  - - [4288, 5888, 1, 3328]
    - [306, 0.0]
  - - [1, 1024, 1, 1]
    - [333, 0.0]
  - - [1024, 2944, 1, 3328]
    - [306, 0.0]
  - - [2944, 2368, 1, 256]
    - [306, 0.0]
  - - [1024, 1856, 1, 256]
    - [306, 0.0]
  - - [2944, 64, 1, 3328]
    - [299, 0.0]
  - - [1024, 5888, 1, 32]
    - [321, 0.0]
  - - [1024, 5888, 1, 3328]
    - [306, 0.0]
  - - [5056, 2368, 1, 32]
    - [313, 0.0]
  - - [1408, 2368, 1, 1280]
    - [306, 0.0]
  - - [256, 1, 1, 3328]
    - [344, 0.0]
  - - [128, 1024, 1, 32]
    - [315, 0.0]
  - - [5056, 6784, 1, 3328]
    - [306, 0.0]
  - - [448, 704, 1, 1]
    - [343, 0.0]
  - - [32, 64, 1, 32]
    - [315, 0.0]
  - - [448, 704, 1, 32]
    - [322, 0.0]
  - - [448, 704, 1, 3328]
    - [300, 0.0]
  - - [1408, 2944, 1, 256]
    - [309, 0.0]
  - - [64, 5888, 1, 1]
    - [338, 0.0]
  - - [2368, 128, 1, 32]
    - [322, 0.0]
  - - [2368, 256, 1, 1280]
    - [306, 0.0]
  - - [2368, 128, 1, 3328]
    - [294, 0.0]
  - - [704, 5056, 1, 32]
    - [313, 0.0]
  - - [32, 2368, 1, 32]
    - [315, 0.0]
  - - [1408, 1, 1, 256]
    - [343, 0.0]
  - - [4288, 256, 1, 32]
    - [321, 0.0]
  - - [448, 1408, 1, 1]
    - [339, 0.0]
  - - [5056, 4288, 1, 1280]
    - [306, 0.0]
  - - [1408, 256, 1, 256]
    - [306, 0.0]
  - - [4288, 448, 1, 1]
    - [328, 0.0]
  - - [256, 4288, 1, 32]
    - [317, 0.0]
  - - [1408, 256, 1, 1280]
    - [300, 0.0]
  - - [256, 256, 1, 1]
    - [328, 0.0]
  - - [1408, 1, 1, 1]
    - [335, 0.0]
  - - [448, 1408, 1, 256]
    - [306, 0.0]
  - - [5888, 5888, 1, 1]
    - [332, 0.0]
  - - [128, 2944, 1, 32]
    - [322, 0.0]
  - - [32, 256, 1, 32]
    - [322, 0.0]
  - - [2944, 704, 1, 1280]
    - [306, 0.0]
  - - [1024, 3584, 1, 1280]
    - [306, 0.0]
  - - [1856, 448, 1, 1]
    - [328, 0.0]
  - - [2368, 2944, 1, 1]
    - [333, 0.0]
  - - [5056, 256, 1, 32]
    - [321, 0.0]
  - - [4288, 1, 1, 3328]
    - [343, 0.0]
  - - [5056, 1024, 1, 1280]
    - [309, 0.0]
  - - [704, 704, 1, 1]
    - [333, 0.0]
  - - [1856, 448, 1, 1280]
    - [306, 0.0]
  - - [3584, 6784, 1, 256]
    - [306, 0.0]
  - - [64, 1856, 1, 1280]
    - [298, 0.0]
  - - [1856, 1408, 1, 256]
    - [306, 0.0]
  - - [4288, 4288, 1, 32]
    - [313, 0.0]
  - - [128, 1, 1, 256]
    - [343, 0.0]
  - - [32, 64, 1, 3328]
    - [326, 0.0]
  - - [5888, 448, 1, 1]
    - [328, 0.0]
  - - [128, 5888, 1, 256]
    - [306, 0.0]
  - - [3584, 256, 1, 3328]
    - [301, 0.0]
  - - [5056, 5056, 1, 1280]
    - [306, 0.0]
  - - [6784, 1408, 1, 3328]
    - [306, 0.0]
  - - [448, 2368, 1, 1]
    - [341, 0.0]
  - - [2368, 1, 1, 1280]
    - [344, 0.0]
  - - [32, 3584, 1, 32]
    - [322, 0.0]
  - - [128, 6784, 1, 1]
    - [333, 0.0]
  - - [1, 3584, 1, 1]
    - [328, 0.0]
  - - [5888, 5888, 1, 3328]
    - [304, 0.0]
  - - [256, 2944, 1, 3328]
    - [306, 0.0]
  - - [1, 128, 1, 3328]
    - [344, 0.0]
  - - [32, 256, 1, 256]
    - [326, 0.0]
  - - [5888, 1408, 1, 32]
    - [313, 0.0]
  - - [704, 256, 1, 1]
    - [333, 0.0]
  - - [1, 448, 1, 1]
    - [334, 0.0]
  - - [256, 6784, 1, 3328]
    - [306, 0.0]
  - - [64, 5888, 1, 256]
    - [286, 0.0]
  - - [1856, 1, 1, 1]
    - [328, 0.0]
  - - [1024, 256, 1, 3328]
    - [300, 0.0]
  - - [704, 704, 1, 256]
    - [306, 0.0]
  - - [448, 1024, 1, 32]
    - [317, 0.0]
  - - [6784, 2368, 1, 1280]
    - [306, 0.0]
  - - [128, 1856, 1, 1280]
    - [297, 0.0]
  - - [256, 2368, 1, 256]
    - [306, 0.0]
  - - [2944, 1408, 1, 1]
    - [328, 0.0]
  - - [6784, 1024, 1, 256]
    - [306, 0.0]
  - - [5056, 1408, 1, 32]
    - [313, 0.0]
  - - [1408, 6784, 1, 3328]
    - [306, 0.0]
  - - [2944, 1408, 1, 3328]
    - [306, 0.0]
  - - [1856, 32, 1, 256]
    - [322, 0.0]
  - - [704, 2368, 1, 32]
    - [317, 0.0]
  - - [448, 256, 1, 32]
    - [316, 0.0]
  - - [704, 6784, 1, 1]
    - [333, 0.0]
  - - [2368, 6784, 1, 256]
    - [306, 0.0]
  - - [1856, 3584, 1, 3328]
    - [306, 0.0]
  - - [1, 704, 1, 3328]
    - [344, 0.0]
  - - [64, 1, 1, 3328]
    - [344, 0.0]
  - - [448, 704, 1, 1280]
    - [292, 0.0]
  - - [704, 1856, 1, 1]
    - [335, 0.0]
  - - [704, 448, 1, 256]
    - [306, 0.0]
  - - [448, 64, 1, 3328]
    - [295, 0.0]
  - - [704, 6784, 1, 256]
    - [306, 0.0]
  - - [256, 32, 1, 1280]
    - [326, 0.0]
  - - [2368, 448, 1, 1280]
    - [306, 0.0]
  - - [6784, 2944, 1, 32]
    - [313, 0.0]
  - - [64, 4288, 1, 32]
    - [315, 0.0]
  - - [128, 704, 1, 1]
    - [335, 0.0]
  - - [128, 448, 1, 3328]
    - [298, 0.0]
  - - [5888, 2368, 1, 3328]
    - [306, 0.0]
  - - [2368, 704, 1, 1280]
    - [306, 0.0]
  - - [1024, 1408, 1, 1280]
    - [306, 0.0]
  - - [4288, 64, 1, 1280]
    - [298, 0.0]
  - - [128, 5056, 1, 1]
    - [339, 0.0]
  - - [2944, 5056, 1, 32]
    - [313, 0.0]
  - - [448, 448, 1, 1]
    - [343, 0.0]
  - - [256, 2368, 1, 1280]
    - [306, 0.0]
  - - [704, 2368, 1, 3328]
    - [306, 0.0]
  - - [3584, 2944, 1, 256]
    - [306, 0.0]
  - - [64, 6784, 1, 256]
    - [292, 0.0]
  - - [3584, 1024, 1, 1280]
    - [306, 0.0]
  - - [64, 1024, 1, 256]
    - [283, 0.0]
  - - [1408, 32, 1, 32]
    - [315, 0.0]
  - - [128, 3584, 1, 256]
    - [292, 0.0]
  - - [704, 1408, 1, 1]
    - [330, 0.0]
  - - [5056, 3584, 1, 256]
    - [306, 0.0]
  - - [2368, 704, 1, 256]
    - [306, 0.0]
  - - [1856, 1856, 1, 1280]
    - [306, 0.0]
  - - [32, 5888, 1, 32]
    - [315, 0.0]
  - - [64, 32, 1, 32]
    - [315, 0.0]
  - - [4288, 704, 1, 1]
    - [331, 0.0]
  - - [1856, 1024, 1, 1]
    - [333, 0.0]
  - - [4288, 2944, 1, 3328]
    - [306, 0.0]
  - - [1024, 128, 1, 3328]
    - [295, 0.0]
  - - [4288, 128, 1, 3328]
    - [300, 0.0]
  - - [4288, 704, 1, 32]
    - [321, 0.0]
  - - [1856, 1024, 1, 32]
    - [319, 0.0]
  - - [1, 448, 1, 3328]
    - [344, 0.0]
  - - [2944, 6784, 1, 1]
    - [332, 0.0]
  - - [6784, 2368, 1, 32]
    - [313, 0.0]
  - - [5888, 5056, 1, 1]
    - [327, 0.0]
  - - [128, 6784, 1, 1280]
    - [294, 0.0]
  - - [704, 5888, 1, 1]
    - [328, 0.0]
  - - [6784, 6784, 1, 1]
    - [332, 0.0]
  - - [1856, 32, 1, 1280]
    - [326, 0.0]
  - - [5888, 448, 1, 3328]
    - [306, 0.0]
  - - [704, 5888, 1, 32]
    - [313, 0.0]
  - - [704, 5888, 1, 1280]
    - [306, 0.0]
  - - [1024, 6784, 1, 3328]
    - [306, 0.0]
  - - [704, 2944, 1, 1280]
    - [306, 0.0]
  - - [4288, 6784, 1, 256]
    - [306, 0.0]
  - - [3584, 256, 1, 32]
    - [317, 0.0]
  - - [1408, 1408, 1, 32]
    - [313, 0.0]
  - - [1408, 1408, 1, 3328]
    - [309, 0.0]
  - - [1024, 64, 1, 256]
    - [283, 0.0]
  - - [4288, 64, 1, 32]
    - [322, 0.0]
  - - [1408, 256, 1, 32]
    - [322, 0.0]
  - - [5888, 128, 1, 256]
    - [306, 0.0]
  - - [64, 704, 1, 1280]
    - [295, 0.0]
  - - [2944, 1856, 1, 256]
    - [306, 0.0]
  - - [128, 5056, 1, 3328]
    - [286, 0.0]
  - - [4288, 2944, 1, 1]
    - [333, 0.0]
  - - [6784, 5056, 1, 32]
    - [313, 0.0]
  - - [1024, 448, 1, 3328]
    - [300, 0.0]
  - - [3584, 128, 1, 1]
    - [335, 0.0]
  - - [2944, 4288, 1, 1280]
    - [306, 0.0]
  - - [64, 32, 1, 3328]
    - [326, 0.0]
  - - [1024, 4288, 1, 256]
    - [306, 0.0]
  - - [128, 2368, 1, 256]
    - [280, 0.0]
  - - [2368, 64, 1, 32]
    - [315, 0.0]
  - - [1408, 1, 1, 3328]
    - [344, 0.0]
  - - [64, 1408, 1, 32]
    - [317, 0.0]
  - - [2368, 5888, 1, 1]
    - [333, 0.0]
  - - [1408, 1856, 1, 32]
    - [321, 0.0]
  - - [448, 1856, 1, 256]
    - [306, 0.0]
  - - [1856, 6784, 1, 3328]
    - [306, 0.0]
  - - [3584, 128, 1, 256]
    - [292, 0.0]
  - - [1024, 448, 1, 1280]
    - [306, 0.0]
  - - [1024, 2368, 1, 32]
    - [313, 0.0]
  - - [32, 2944, 1, 256]
    - [322, 0.0]
  - - [128, 5888, 1, 1]
    - [332, 0.0]
  - - [64, 5056, 1, 1]
    - [335, 0.0]
  - - [1856, 256, 1, 32]
    - [315, 0.0]
  - - [2368, 2368, 1, 3328]
    - [306, 0.0]
  - - [64, 448, 1, 1]
    - [342, 0.0]
  - - [3584, 5888, 1, 32]
    - [313, 0.0]
  - - [3584, 5888, 1, 1280]
    - [306, 0.0]
  - - [64, 5056, 1, 32]
    - [322, 0.0]
  - - [2944, 64, 1, 1]
    - [335, 0.0]
  - - [6784, 704, 1, 256]
    - [306, 0.0]
  - - [3584, 1024, 1, 32]
    - [313, 0.0]
  - - [1408, 704, 1, 32]
    - [317, 0.0]
  - - [1408, 704, 1, 1280]
    - [306, 0.0]
  - - [2368, 5888, 1, 256]
    - [306, 0.0]
  - - [2944, 64, 1, 32]
    - [315, 0.0]
  - - [1, 1408, 1, 256]
    - [343, 0.0]
  - - [64, 2944, 1, 256]
    - [281, 0.0]
  - - [5888, 5888, 1, 32]
    - [313, 0.0]
  - - [1856, 1408, 1, 3328]
    - [306, 0.0]
  - - [1024, 1024, 1, 32]
    - [317, 0.0]
  - - [4288, 1024, 1, 1]
    - [328, 0.0]
  - - [704, 4288, 1, 3328]
    - [306, 0.0]
  - - [2944, 5056, 1, 1280]
    - [306, 0.0]
  - - [6784, 2944, 1, 1280]
    - [306, 0.0]
  - - [6784, 256, 1, 3328]
    - [306, 0.0]
  - - [5056, 128, 1, 3328]
    - [286, 0.0]
  - - [128, 128, 1, 1280]
    - [295, 0.0]
  - - [128, 4288, 1, 1]
    - [341, 0.0]
  - - [1408, 5056, 1, 32]
    - [313, 0.0]
  - - [2944, 128, 1, 3328]
    - [286, 0.0]
  - - [5888, 1856, 1, 1280]
    - [306, 0.0]
  - - [64, 128, 1, 256]
    - [283, 0.0]
  - - [5888, 256, 1, 1280]
    - [306, 0.0]
  - - [1856, 5056, 1, 1]
    - [333, 0.0]
  - - [3584, 1856, 1, 1280]
    - [306, 0.0]
  - - [6784, 448, 1, 256]
    - [306, 0.0]
  - - [704, 3584, 1, 256]
    - [306, 0.0]
  - - [1856, 5056, 1, 32]
    - [313, 0.0]
  - - [1856, 5056, 1, 3328]
    - [306, 0.0]
  - - [1024, 2944, 1, 32]
    - [313, 0.0]
  - - [1408, 6784, 1, 256]
    - [306, 0.0]
  - - [1024, 2368, 1, 1280]
    - [306, 0.0]
  - - [1856, 3584, 1, 1]
    - [333, 0.0]
  - - [5888, 128, 1, 1280]
    - [306, 0.0]
  - - [2944, 5888, 1, 1280]
    - [306, 0.0]
  - - [1, 1856, 1, 1]
    - [338, 0.0]
  - - [3584, 3584, 1, 256]
    - [306, 0.0]
  - - [1856, 2368, 1, 3328]
    - [306, 0.0]
  - - [5888, 704, 1, 256]
    - [306, 0.0]
  - - [64, 448, 1, 32]
    - [315, 0.0]
  - - [6784, 4288, 1, 256]
    - [306, 0.0]
  - - [128, 64, 1, 3328]
    - [295, 0.0]
  - - [1, 5056, 1, 1280]
    - [343, 0.0]
  - - [32, 64, 1, 1280]
    - [326, 0.0]
  - - [1408, 2368, 1, 3328]
    - [306, 0.0]
  - - [1024, 3584, 1, 256]
    - [306, 0.0]
  - - [2944, 128, 1, 256]
    - [294, 0.0]
  - - [6784, 128, 1, 1]
    - [330, 0.0]
  - - [1408, 256, 1, 3328]
    - [300, 0.0]
  - - [448, 32, 1, 256]
    - [322, 0.0]
  - - [1024, 32, 1, 256]
    - [322, 0.0]
  - - [1, 5888, 1, 256]
    - [343, 0.0]
  - - [64, 2368, 1, 256]
    - [281, 0.0]
  - - [2944, 256, 1, 256]
    - [306, 0.0]
  - - [1, 128, 1, 256]
    - [343, 0.0]
  - - [32, 256, 1, 1280]
    - [326, 0.0]
  - - [5888, 1, 1, 256]
    - [343, 0.0]
  - - [32, 128, 1, 3328]
    - [326, 0.0]
  - - [6784, 128, 1, 256]
    - [306, 0.0]
  - - [6784, 64, 1, 1280]
    - [300, 0.0]
  - - [4288, 1024, 1, 32]
    - [313, 0.0]
  - - [1408, 64, 1, 3328]
    - [298, 0.0]
  - - [2944, 448, 1, 1280]
    - [306, 0.0]
  - - [6784, 32, 1, 1280]
    - [326, 0.0]
  - - [2944, 64, 1, 1280]
    - [298, 0.0]
  - - [704, 448, 1, 1]
    - [341, 0.0]
  - - [32, 128, 1, 32]
    - [315, 0.0]
  - - [1, 128, 1, 1]
    - [333, 0.0]
  - - [5888, 1, 1, 1]
    - [328, 0.0]
  - - [5888, 1856, 1, 3328]
    - [305, 0.0]
  - - [2368, 3584, 1, 256]
    - [306, 0.0]
  - - [4288, 1408, 1, 3328]
    - [306, 0.0]
  - - [1856, 32, 1, 3328]
    - [326, 0.0]
  - - [2944, 32, 1, 256]
    - [322, 0.0]
  - - [128, 64, 1, 1]
    - [344, 0.0]
  - - [256, 1024, 1, 3328]
    - [300, 0.0]
  - - [32, 448, 1, 256]
    - [322, 0.0]
  - - [1856, 64, 1, 3328]
    - [298, 0.0]
  - - [256, 5056, 1, 256]
    - [306, 0.0]
  - - [5888, 2944, 1, 3328]
    - [306, 0.0]
  - - [2368, 1408, 1, 3328]
    - [306, 0.0]
  - - [5888, 704, 1, 32]
    - [321, 0.0]
  - - [2944, 704, 1, 1]
    - [333, 0.0]
  - - [6784, 1856, 1, 256]
    - [306, 0.0]
  - - [1, 704, 1, 256]
    - [343, 0.0]
  - - [1856, 1856, 1, 1]
    - [328, 0.0]
  - - [5888, 32, 1, 256]
    - [326, 0.0]
  - - [128, 704, 1, 256]
    - [295, 0.0]
  - - [256, 1408, 1, 3328]
    - [300, 0.0]
  - - [2944, 128, 1, 1]
    - [343, 0.0]
  - - [32, 256, 1, 3328]
    - [326, 0.0]
  - - [2944, 704, 1, 3328]
    - [306, 0.0]
  - - [704, 1024, 1, 32]
    - [322, 0.0]
  - - [2368, 1856, 1, 32]
    - [313, 0.0]
  - - [5056, 4288, 1, 3328]
    - [304, 0.0]
  - - [3584, 448, 1, 3328]
    - [306, 0.0]
  - - [256, 32, 1, 32]
    - [322, 0.0]
  - - [64, 256, 1, 3328]
    - [295, 0.0]
  - - [256, 6784, 1, 1]
    - [328, 0.0]
  - - [1024, 3584, 1, 32]
    - [313, 0.0]
  - - [256, 6784, 1, 32]
    - [321, 0.0]
  - - [2944, 1408, 1, 32]
    - [313, 0.0]
  - - [4288, 3584, 1, 1]
    - [333, 0.0]
  - - [1, 704, 1, 1]
    - [335, 0.0]
  - - [5056, 448, 1, 3328]
    - [306, 0.0]
  - - [3584, 64, 1, 256]
    - [292, 0.0]
  - - [64, 1856, 1, 32]
    - [315, 0.0]
  - - [64, 1856, 1, 3328]
    - [298, 0.0]
  - - [6784, 3584, 1, 32]
    - [313, 0.0]
  - - [4288, 1856, 1, 256]
    - [306, 0.0]
  - - [1856, 2944, 1, 256]
    - [306, 0.0]
  - - [128, 448, 1, 1]
    - [335, 0.0]
  - - [64, 128, 1, 32]
    - [315, 0.0]
  - - [704, 1, 1, 1280]
    - [344, 0.0]
  - - [2944, 5888, 1, 1]
    - [332, 0.0]
  - - [1024, 1856, 1, 3328]
    - [309, 0.0]
  - - [5888, 1024, 1, 32]
    - [313, 0.0]
  - - [3584, 256, 1, 1280]
    - [306, 0.0]
  - - [1024, 1, 1, 1]
    - [338, 0.0]
  - - [1408, 5056, 1, 1280]
    - [306, 0.0]
  - - [3584, 128, 1, 1280]
    - [300, 0.0]
  - - [5056, 6784, 1, 256]
    - [306, 0.0]
  - - [256, 1856, 1, 256]
    - [306, 0.0]
  - - [5888, 32, 1, 1280]
    - [326, 0.0]
  - - [256, 128, 1, 32]
    - [317, 0.0]
  - - [32, 1856, 1, 1280]
    - [326, 0.0]
  - - [2944, 5056, 1, 1]
    - [327, 0.0]
  - - [448, 128, 1, 1]
    - [335, 0.0]
  - - [256, 704, 1, 32]
    - [318, 0.0]
  - - [256, 704, 1, 1280]
    - [300, 0.0]
  - - [1, 2368, 1, 1]
    - [339, 0.0]
  - - [5888, 5888, 1, 1280]
    - [306, 0.0]
  - - [256, 2944, 1, 1280]
    - [306, 0.0]
  - - [2944, 256, 1, 3328]
    - [306, 0.0]
  - - [5056, 2944, 1, 1280]
    - [306, 0.0]
  - - [704, 1024, 1, 3328]
    - [306, 0.0]
  - - [2368, 1856, 1, 1280]
    - [306, 0.0]
  - - [448, 2944, 1, 1]
    - [329, 0.0]
  - - [6784, 2944, 1, 1]
    - [327, 0.0]
  - - [2944, 1024, 1, 32]
    - [313, 0.0]
  - - [2944, 1024, 1, 1280]
    - [306, 0.0]
  - - [1408, 64, 1, 32]
    - [317, 0.0]
  - - [5056, 5056, 1, 1]
    - [328, 0.0]
  - - [2368, 4288, 1, 256]
    - [306, 0.0]
  - - [448, 1856, 1, 1280]
    - [306, 0.0]
  - - [2368, 448, 1, 1]
    - [337, 0.0]
  - - [448, 2944, 1, 32]
    - [321, 0.0]
  - - [448, 2944, 1, 1280]
    - [306, 0.0]
  - - [2944, 6784, 1, 1280]
    - [306, 0.0]
  - - [256, 6784, 1, 1280]
    - [306, 0.0]
  - - [128, 2368, 1, 1280]
    - [280, 0.0]
  - - [3584, 2368, 1, 32]
    - [313, 0.0]
  - - [704, 32, 1, 32]
    - [317, 0.0]
  - - [6784, 3584, 1, 3328]
    - [304, 0.0]
  - - [128, 32, 1, 256]
    - [322, 0.0]
  - - [128, 1408, 1, 1280]
    - [295, 0.0]
  - - [64, 32, 1, 1280]
    - [326, 0.0]
  - - [128, 1856, 1, 3328]
    - [297, 0.0]
  - - [2944, 2944, 1, 256]
    - [306, 0.0]
  - - [1408, 1024, 1, 3328]
    - [306, 0.0]
  - - [5056, 2368, 1, 1280]
    - [306, 0.0]
  - - [448, 128, 1, 32]
    - [315, 0.0]
  - - [2368, 64, 1, 3328]
    - [298, 0.0]
  - - [32, 5056, 1, 3328]
    - [326, 0.0]
  - - [448, 2944, 1, 3328]
    - [306, 0.0]
  - - [2944, 1024, 1, 1]
    - [328, 0.0]
  - - [2368, 128, 1, 1280]
    - [294, 0.0]
  - - [3584, 704, 1, 256]
    - [306, 0.0]
  - - [2368, 5888, 1, 3328]
    - [306, 0.0]
  - - [4288, 2368, 1, 1]
    - [328, 0.0]
  - - [1408, 3584, 1, 32]
    - [313, 0.0]
  - - [2944, 4288, 1, 32]
    - [317, 0.0]
  - - [5888, 1408, 1, 1280]
    - [309, 0.0]
  - - [3584, 5056, 1, 1280]
    - [306, 0.0]
  - - [5888, 6784, 1, 1280]
    - [305, 0.0]
  - - [64, 1856, 1, 1]
    - [335, 0.0]
  - - [704, 128, 1, 32]
    - [315, 0.0]
  - - [3584, 2944, 1, 1]
    - [329, 0.0]
  - - [128, 3584, 1, 3328]
    - [297, 0.0]
  - - [256, 4288, 1, 3328]
    - [306, 0.0]
  - - [4288, 64, 1, 1]
    - [328, 0.0]
  - - [1, 1408, 1, 1280]
    - [344, 0.0]
  - - [5056, 32, 1, 1280]
    - [326, 0.0]
  - - [1856, 704, 1, 32]
    - [321, 0.0]
  - - [1024, 1856, 1, 1]
    - [328, 0.0]
  - - [704, 5056, 1, 3328]
    - [306, 0.0]
  - - [1024, 3584, 1, 3328]
    - [306, 0.0]
  - - [5888, 256, 1, 3328]
    - [306, 0.0]
  - - [1856, 1408, 1, 1]
    - [333, 0.0]
  - - [2944, 448, 1, 32]
    - [321, 0.0]
  - - [128, 448, 1, 256]
    - [283, 0.0]
  - - [128, 1024, 1, 1]
    - [335, 0.0]
  - - [32, 32, 1, 256]
    - [322, 0.0]
  - - [4288, 5056, 1, 1280]
    - [306, 0.0]
  - - [1856, 1856, 1, 3328]
    - [306, 0.0]
  - - [1024, 2368, 1, 256]
    - [306, 0.0]
  - - [4288, 2368, 1, 3328]
    - [306, 0.0]
  - - [256, 64, 1, 32]
    - [322, 0.0]
  - - [1, 1024, 1, 1280]
    - [344, 0.0]
  - - [5056, 128, 1, 32]
    - [315, 0.0]
  - - [5888, 3584, 1, 256]
    - [306, 0.0]
  - - [1024, 5056, 1, 32]
    - [313, 0.0]
  - - [5888, 448, 1, 1280]
    - [306, 0.0]
  - - [704, 5888, 1, 3328]
    - [306, 0.0]
  - - [1024, 1408, 1, 256]
    - [306, 0.0]
  - - [3584, 2944, 1, 1280]
    - [306, 0.0]
  - - [1, 5056, 1, 256]
    - [343, 0.0]
  - - [256, 1024, 1, 1]
    - [333, 0.0]
  - - [32, 32, 1, 3328]
    - [326, 0.0]
  - - [2368, 1, 1, 3328]
    - [344, 0.0]
  - - [4288, 1856, 1, 1280]
    - [306, 0.0]
  - - [3584, 5888, 1, 1]
    - [327, 0.0]
  - - [5888, 4288, 1, 256]
    - [306, 0.0]
  - - [1024, 2944, 1, 1280]
    - [306, 0.0]
  - - [6784, 1, 1, 1]
    - [341, 0.0]
  - - [1408, 64, 1, 1280]
    - [298, 0.0]
  - - [1, 256, 1, 1280]
    - [344, 0.0]
  - - [2944, 3584, 1, 256]
    - [306, 0.0]
  - - [1, 128, 1, 1280]
    - [344, 0.0]
  - - [1024, 256, 1, 32]
    - [322, 0.0]
  - - [5888, 1, 1, 1280]
    - [343, 0.0]
  - - [2368, 32, 1, 1280]
    - [326, 0.0]
  - - [5888, 1856, 1, 1]
    - [327, 0.0]
  - - [6784, 128, 1, 1280]
    - [294, 0.0]
  - - [6784, 2368, 1, 3328]
    - [306, 0.0]
  - - [1, 64, 1, 256]
    - [343, 0.0]
  - - [704, 128, 1, 1]
    - [335, 0.0]
  - - [1408, 4288, 1, 32]
    - [313, 0.0]
  - - [256, 64, 1, 1280]
    - [295, 0.0]
  - - [256, 448, 1, 256]
    - [281, 0.0]
  - - [1856, 1024, 1, 1280]
    - [309, 0.0]
  - - [5888, 1856, 1, 256]
    - [306, 0.0]
  - - [5056, 1856, 1, 1]
    - [328, 0.0]
  - - [5888, 2368, 1, 256]
    - [306, 0.0]
  - - [1408, 1024, 1, 32]
    - [317, 0.0]
  - - [32, 704, 1, 256]
    - [326, 0.0]
  - - [2944, 1, 1, 256]
    - [343, 0.0]
  - - [32, 4288, 1, 256]
    - [322, 0.0]
  - - [5056, 1856, 1, 32]
    - [313, 0.0]
  - - [5056, 1856, 1, 1280]
    - [306, 0.0]
  - - [1, 64, 1, 1]
    - [328, 0.0]
  - - [1408, 5888, 1, 3328]
    - [306, 0.0]
  - - [1408, 704, 1, 3328]
    - [301, 0.0]
  - - [5056, 704, 1, 3328]
    - [306, 0.0]
  - - [704, 64, 1, 1280]
    - [298, 0.0]
  - - [1, 704, 1, 1280]
    - [344, 0.0]
  - - [5888, 6784, 1, 1]
    - [327, 0.0]
  - - [5888, 4288, 1, 32]
    - [313, 0.0]
  - - [1408, 3584, 1, 256]
    - [306, 0.0]
  - - [1856, 704, 1, 1]
    - [330, 0.0]
  - - [6784, 256, 1, 1]
    - [333, 0.0]
  - - [2944, 1, 1, 1]
    - [328, 0.0]
  - - [256, 1856, 1, 3328]
    - [300, 0.0]
  - - [4288, 128, 1, 1280]
    - [292, 0.0]
  - - [6784, 256, 1, 1280]
    - [306, 0.0]
  - - [128, 4288, 1, 256]
    - [294, 0.0]
  - - [128, 128, 1, 32]
    - [322, 0.0]
  - - [128, 1408, 1, 32]
    - [321, 0.0]
  - - [6784, 128, 1, 32]
    - [321, 0.0]
  - - [1408, 448, 1, 1]
    - [330, 0.0]
  - - [2368, 704, 1, 3328]
    - [306, 0.0]
  - - [704, 128, 1, 3328]
    - [298, 0.0]
  - - [2944, 1856, 1, 32]
    - [313, 0.0]
  - - [1024, 64, 1, 1]
    - [328, 0.0]
  - - [1408, 32, 1, 1280]
    - [326, 0.0]
  - - [704, 1, 1, 256]
    - [343, 0.0]
  - - [2368, 1408, 1, 256]
    - [306, 0.0]
  - - [2368, 1856, 1, 1]
    - [328, 0.0]
  - - [4288, 1408, 1, 1]
    - [341, 0.0]
  - - [3584, 2368, 1, 1280]
    - [306, 0.0]
  - - [64, 5056, 1, 1280]
    - [290, 0.0]
  - - [1408, 2944, 1, 1]
    - [327, 0.0]
  - - [4288, 1408, 1, 32]
    - [313, 0.0]
  - - [5888, 2944, 1, 256]
    - [306, 0.0]
  - - [128, 64, 1, 1280]
    - [283, 0.0]
  - - [1408, 2944, 1, 32]
    - [313, 0.0]
  - - [1, 3584, 1, 1280]
    - [344, 0.0]
  - - [64, 64, 1, 32]
    - [315, 0.0]
  - - [448, 1408, 1, 32]
    - [322, 0.0]
  - - [128, 5056, 1, 256]
    - [306, 0.0]
  - - [1, 1, 1, 1280]
    - [344, 0.0]
  - - [64, 704, 1, 256]
    - [283, 0.0]
  - - [5888, 6784, 1, 256]
    - [306, 0.0]
  - - [6784, 5888, 1, 1]
    - [327, 0.0]
  - - [64, 4288, 1, 256]
    - [281, 0.0]
  - - [1, 448, 1, 1280]
    - [344, 0.0]
  - - [1024, 1024, 1, 1]
    - [328, 0.0]
  - - [6784, 5888, 1, 1280]
    - [304, 0.0]
  - - [1024, 4288, 1, 32]
    - [321, 0.0]
  - - [1856, 1, 1, 1280]
    - [344, 0.0]
  - - [3584, 5888, 1, 256]
    - [306, 0.0]
  - - [5056, 2368, 1, 1]
    - [334, 0.0]
  - - [256, 1408, 1, 1280]
    - [300, 0.0]
  - - [64, 256, 1, 32]
    - [315, 0.0]
  - - [64, 5888, 1, 3328]
    - [286, 0.0]
  - - [6784, 64, 1, 3328]
    - [300, 0.0]
  - - [5056, 448, 1, 1]
    - [328, 0.0]
  - - [2944, 448, 1, 3328]
    - [306, 0.0]
  - - [2368, 1024, 1, 1280]
    - [306, 0.0]
  - - [1856, 6784, 1, 256]
    - [306, 0.0]
  - - [4288, 32, 1, 1280]
    - [326, 0.0]
  - - [448, 1408, 1, 1280]
    - [306, 0.0]
  - - [5056, 448, 1, 32]
    - [321, 0.0]
  - - [3584, 2944, 1, 32]
    - [313, 0.0]
  - - [2368, 128, 1, 1]
    - [335, 0.0]
  - - [32, 128, 1, 1280]
    - [326, 0.0]
  - - [3584, 1856, 1, 32]
    - [313, 0.0]
  - - [128, 128, 1, 3328]
    - [295, 0.0]
  - - [5056, 64, 1, 256]
    - [286, 0.0]
  - - [64, 448, 1, 3328]
    - [295, 0.0]
  - - [4288, 1408, 1, 1280]
    - [306, 0.0]
  - - [6784, 2368, 1, 1]
    - [337, 0.0]
  - - [32, 5056, 1, 256]
    - [326, 0.0]
  - - [704, 128, 1, 256]
    - [291, 0.0]
  - - [704, 5056, 1, 1]
    - [333, 0.0]
  - - [256, 1024, 1, 32]
    - [324, 0.0]
  - - [256, 1024, 1, 1280]
    - [300, 0.0]
  - - [2368, 128, 1, 256]
    - [294, 0.0]
  - - [32, 64, 1, 256]
    - [322, 0.0]
  - - [2368, 1408, 1, 1280]
    - [306, 0.0]
  - - [128, 256, 1, 32]
    - [315, 0.0]
  - - [64, 6784, 1, 32]
    - [322, 0.0]
  - - [6784, 32, 1, 256]
    - [326, 0.0]
  - - [256, 4288, 1, 1]
    - [329, 0.0]
  - - [5888, 1408, 1, 1]
    - [332, 0.0]
  - - [1024, 4288, 1, 1280]
    - [306, 0.0]
  - - [1856, 4288, 1, 1]
    - [328, 0.0]
  - - [128, 2944, 1, 256]
    - [294, 0.0]
  - - [3584, 4288, 1, 256]
    - [306, 0.0]
  - - [2368, 2944, 1, 256]
    - [306, 0.0]
  - - [3584, 128, 1, 32]
    - [317, 0.0]
  - - [3584, 128, 1, 3328]
    - [300, 0.0]
  - - [704, 5056, 1, 256]
    - [306, 0.0]
  - - [1856, 4288, 1, 32]
    - [313, 0.0]
  - - [64, 256, 1, 1280]
    - [295, 0.0]
  - - [4288, 1024, 1, 1280]
    - [306, 0.0]
  - - [1, 4288, 1, 256]
    - [343, 0.0]
  - - [64, 2368, 1, 1]
    - [335, 0.0]
  - - [4288, 6784, 1, 32]
    - [313, 0.0]
  - - [704, 704, 1, 3328]
    - [306, 0.0]
  - - [128, 2944, 1, 1]
    - [341, 0.0]
  - - [3584, 1408, 1, 256]
    - [309, 0.0]
  - - [704, 3584, 1, 3328]
    - [306, 0.0]
  - - [5056, 448, 1, 1280]
    - [306, 0.0]
  - - [1408, 2944, 1, 1280]
    - [306, 0.0]
  - - [5888, 704, 1, 1280]
    - [306, 0.0]
  - - [64, 64, 1, 256]
    - [283, 0.0]
  - - [704, 1408, 1, 1280]
    - [293, 0.0]
  - - [4288, 5888, 1, 256]
    - [306, 0.0]
  - - [6784, 64, 1, 32]
    - [318, 0.0]
  - - [3584, 3584, 1, 3328]
    - [306, 0.0]
  - - [2944, 6784, 1, 32]
    - [313, 0.0]
  - - [448, 64, 1, 32]
    - [315, 0.0]
  - - [5056, 256, 1, 1]
    - [329, 0.0]
  - - [64, 6784, 1, 1280]
    - [300, 0.0]
  - - [2944, 2368, 1, 3328]
    - [306, 0.0]
  - - [1, 4288, 1, 1]
    - [341, 0.0]
  - - [1408, 128, 1, 256]
    - [292, 0.0]
  - - [1024, 1856, 1, 1280]
    - [309, 0.0]
  - - [448, 5888, 1, 256]
    - [306, 0.0]
  - - [1024, 5888, 1, 256]
    - [306, 0.0]
  - - [704, 1408, 1, 256]
    - [306, 0.0]
  - - [6784, 2944, 1, 3328]
    - [306, 0.0]
  - - [1408, 2368, 1, 256]
    - [306, 0.0]
  - - [64, 128, 1, 1280]
    - [283, 0.0]
  - - [5888, 32, 1, 3328]
    - [326, 0.0]
  - - [1408, 5056, 1, 256]
    - [306, 0.0]
  - - [1024, 1408, 1, 32]
    - [321, 0.0]
  - - [4288, 128, 1, 32]
    - [315, 0.0]
  - - [6784, 704, 1, 1]
    - [328, 0.0]
  - - [448, 704, 1, 256]
    - [306, 0.0]
  - - [704, 3584, 1, 32]
    - [313, 0.0]
  - - [1856, 256, 1, 3328]
    - [300, 0.0]
  - - [448, 1024, 1, 1280]
    - [306, 0.0]
  - - [4288, 4288, 1, 1]
    - [328, 0.0]
  - - [5056, 2944, 1, 1]
    - [328, 0.0]
  - - [64, 2368, 1, 3328]
    - [295, 0.0]
  - - [256, 704, 1, 3328]
    - [300, 0.0]
  - - [1, 2944, 1, 1]
    - [333, 0.0]
  - - [1024, 1024, 1, 256]
    - [306, 0.0]
  - - [3584, 1, 1, 1]
    - [328, 0.0]
  - - [256, 2944, 1, 32]
    - [321, 0.0]
  - - [6784, 4288, 1, 3328]
    - [305, 0.0]
  - - [5056, 2944, 1, 3328]
    - [305, 0.0]
  - - [704, 1024, 1, 1280]
    - [306, 0.0]
  - - [256, 3584, 1, 1280]
    - [306, 0.0]
  - - [2368, 1856, 1, 3328]
    - [306, 0.0]
  - - [1856, 4288, 1, 1280]
    - [306, 0.0]
  - - [1, 1024, 1, 256]
    - [343, 0.0]
  - - [3584, 448, 1, 1]
    - [339, 0.0]
  - - [2944, 1024, 1, 3328]
    - [306, 0.0]
  - - [32, 1408, 1, 3328]
    - [326, 0.0]
  - - [128, 1, 1, 3328]
    - [344, 0.0]
  - - [5888, 5056, 1, 32]
    - [313, 0.0]
  - - [704, 2944, 1, 1]
    - [335, 0.0]
  - - [3584, 448, 1, 32]
    - [321, 0.0]
  - - [3584, 448, 1, 1280]
    - [306, 0.0]
  - - [2944, 6784, 1, 3328]
    - [306, 0.0]
  - - [1856, 2368, 1, 1280]
    - [306, 0.0]
  - - [6784, 1024, 1, 1280]
    - [306, 0.0]
  - - [6784, 3584, 1, 1280]
    - [306, 0.0]
  - - [1, 5056, 1, 3328]
    - [343, 0.0]
  - - [128, 128, 1, 1]
    - [343, 0.0]
  - - [128, 2368, 1, 32]
    - [322, 0.0]
  - - [128, 1408, 1, 3328]
    - [295, 0.0]
  - - [2944, 32, 1, 3328]
    - [326, 0.0]
  - - [704, 1856, 1, 256]
    - [306, 0.0]
  - - [1408, 1408, 1, 1]
    - [328, 0.0]
  - - [1408, 4288, 1, 256]
    - [306, 0.0]
  - - [256, 5056, 1, 3328]
    - [306, 0.0]
  - - [2368, 64, 1, 1280]
    - [298, 0.0]
  - - [1856, 448, 1, 32]
    - [321, 0.0]
  - - [1408, 448, 1, 256]
    - [306, 0.0]
  - - [32, 128, 1, 256]
    - [322, 0.0]
  - - [448, 1024, 1, 1]
    - [333, 0.0]
  - - [128, 1024, 1, 1280]
    - [295, 0.0]
  - - [448, 6784, 1, 1]
    - [328, 0.0]
  - - [704, 2944, 1, 256]
    - [306, 0.0]
  - - [1408, 1408, 1, 256]
    - [309, 0.0]
  - - [448, 6784, 1, 32]
    - [321, 0.0]
  - - [1, 64, 1, 1280]
    - [344, 0.0]
  - - [1408, 1856, 1, 1]
    - [333, 0.0]
  - - [4288, 448, 1, 32]
    - [321, 0.0]
  - - [4288, 448, 1, 1280]
    - [306, 0.0]
  - - [2944, 704, 1, 32]
    - [317, 0.0]
  - - [1024, 704, 1, 256]
    - [306, 0.0]
  - - [448, 4288, 1, 1]
    - [328, 0.0]
  - - [3584, 5056, 1, 1]
    - [328, 0.0]
  - - [1408, 3584, 1, 1280]
    - [306, 0.0]
  - - [6784, 448, 1, 1280]
    - [306, 0.0]
  - - [3584, 5056, 1, 3328]
    - [306, 0.0]
  - - [2368, 2368, 1, 32]
    - [313, 0.0]
  - - [64, 5888, 1, 32]
    - [322, 0.0]
  - - [1856, 448, 1, 256]
    - [306, 0.0]
  - - [128, 1024, 1, 256]
    - [295, 0.0]
  - - [3584, 64, 1, 3328]
    - [300, 0.0]
  - - [5888, 2944, 1, 32]
    - [313, 0.0]
  - - [2944, 1, 1, 1280]
    - [344, 0.0]
  - - [1856, 2944, 1, 32]
    - [313, 0.0]
  - - [5056, 1408, 1, 1]
    - [333, 0.0]
  - - [5888, 1408, 1, 3328]
    - [306, 0.0]
  - - [448, 4288, 1, 256]
    - [306, 0.0]
  - - [6784, 1024, 1, 1]
    - [334, 0.0]
  - - [256, 448, 1, 1]
    - [335, 0.0]
  - - [128, 5888, 1, 3328]
    - [306, 0.0]
  - - [6784, 1024, 1, 32]
    - [313, 0.0]
  - - [256, 448, 1, 32]
    - [317, 0.0]
  - - [6784, 3584, 1, 1]
    - [333, 0.0]
  - - [2944, 2368, 1, 32]
    - [313, 0.0]
  - - [3584, 6784, 1, 3328]
    - [306, 0.0]
  - - [448, 128, 1, 1280]
    - [298, 0.0]
  - - [64, 3584, 1, 32]
    - [315, 0.0]
  - - [64, 3584, 1, 1280]
    - [300, 0.0]
  - - [6784, 1408, 1, 256]
    - [306, 0.0]
  - - [5056, 1024, 1, 32]
    - [317, 0.0]
  - - [1024, 5056, 1, 1280]
    - [306, 0.0]
  - - [4288, 3584, 1, 256]
    - [306, 0.0]
  - - [2368, 256, 1, 3328]
    - [306, 0.0]
  - - [448, 6784, 1, 1280]
    - [306, 0.0]
  - - [1856, 5888, 1, 1]
    - [333, 0.0]
  - - [256, 5888, 1, 32]
    - [313, 0.0]
  - - [3584, 1, 1, 3328]
    - [344, 0.0]
  - - [4288, 32, 1, 256]
    - [326, 0.0]
  - - [256, 64, 1, 1]
    - [335, 0.0]
  - - [4288, 5056, 1, 32]
    - [313, 0.0]
  - - [4288, 5056, 1, 3328]
    - [306, 0.0]
  - - [1856, 5888, 1, 32]
    - [313, 0.0]
  - - [1856, 5888, 1, 1280]
    - [306, 0.0]
  - - [256, 256, 1, 1280]
    - [295, 0.0]
  - - [704, 2368, 1, 1280]
    - [306, 0.0]
  - - [4288, 2368, 1, 1280]
    - [306, 0.0]
  - - [2944, 5056, 1, 256]
    - [306, 0.0]
  - - [32, 1856, 1, 256]
    - [322, 0.0]
  - - [64, 5888, 1, 1280]
    - [294, 0.0]
  - - [1, 1856, 1, 1280]
    - [344, 0.0]
  - - [2944, 4288, 1, 1]
    - [334, 0.0]
  - - [5056, 5888, 1, 32]
    - [313, 0.0]
  - - [704, 1, 1, 3328]
    - [344, 0.0]
  - - [448, 256, 1, 1280]
    - [298, 0.0]
  - - [1408, 256, 1, 1]
    - [335, 0.0]
  - - [2368, 5056, 1, 3328]
    - [306, 0.0]
  - - [1024, 5056, 1, 3328]
    - [306, 0.0]
  - - [704, 704, 1, 1280]
    - [306, 0.0]
  - - [128, 32, 1, 3328]
    - [326, 0.0]
  - - [1024, 6784, 1, 32]
    - [313, 0.0]
  - - [3584, 2944, 1, 3328]
    - [306, 0.0]
  - - [128, 1856, 1, 256]
    - [284, 0.0]
  - - [32, 32, 1, 1280]
    - [326, 0.0]
  - - [1408, 5888, 1, 1]
    - [332, 0.0]
  - - [1, 3584, 1, 256]
    - [344, 0.0]
  - - [704, 4288, 1, 32]
    - [313, 0.0]
  - - [1408, 5888, 1, 32]
    - [313, 0.0]
  - - [6784, 1024, 1, 3328]
    - [306, 0.0]
  - - [1856, 1, 1, 3328]
    - [344, 0.0]
  - - [5056, 1408, 1, 256]
    - [306, 0.0]
  - - [1, 1, 1, 256]
    - [343, 0.0]
  - - [2944, 1408, 1, 256]
    - [306, 0.0]
  - - [4288, 1, 1, 1]
    - [335, 0.0]
  - - [2368, 2368, 1, 256]
    - [306, 0.0]
  - - [1, 448, 1, 256]
    - [343, 0.0]
  - - [1408, 6784, 1, 1]
    - [327, 0.0]
  - - [3584, 32, 1, 3328]
    - [326, 0.0]
  - - [128, 3584, 1, 1]
    - [335, 0.0]
  - - [1856, 1, 1, 256]
    - [343, 0.0]
  - - [6784, 6784, 1, 1280]
    - [306, 0.0]
  - - [1024, 5888, 1, 1]
    - [327, 0.0]
  - - [6784, 32, 1, 3328]
    - [326, 0.0]
  - - [1408, 32, 1, 256]
    - [322, 0.0]
  - - [128, 3584, 1, 32]
    - [321, 0.0]
  - - [1856, 3584, 1, 256]
    - [306, 0.0]
  - - [2944, 64, 1, 256]
    - [284, 0.0]
  - - [2368, 704, 1, 32]
    - [317, 0.0]
  - - [256, 5888, 1, 1280]
    - [306, 0.0]
  - - [448, 2368, 1, 32]
    - [321, 0.0]
  - - [448, 2368, 1, 3328]
    - [306, 0.0]
  - - [64, 1408, 1, 256]
    - [283, 0.0]
  - - [5056, 32, 1, 32]
    - [315, 0.0]
  - - [1024, 704, 1, 3328]
    - [306, 0.0]
  - - [32, 5888, 1, 3328]
    - [326, 0.0]
  - - [256, 64, 1, 3328]
    - [295, 0.0]
  - - [32, 1408, 1, 1280]
    - [326, 0.0]
  - - [64, 32, 1, 256]
    - [322, 0.0]
  - - [1856, 1024, 1, 3328]
    - [309, 0.0]
  - - [2368, 1, 1, 1]
    - [333, 0.0]
  - - [5056, 2368, 1, 3328]
    - [306, 0.0]
  - - [128, 1, 1, 1280]
    - [344, 0.0]
  - - [704, 4288, 1, 1280]
    - [306, 0.0]
  - - [704, 256, 1, 256]
    - [292, 0.0]
  - - [512, 128, 1, 784]
    - [345, 0.0]
  - - [1024, 256, 1, 196]
    - [349, 0.0]
  - - [256, 64, 1, 3136]
    - [347, 0.0]
  - - [256, 1024, 1, 196]
    - [346, 0.0]
  - - [64, 256, 1, 3136]
    - [350, 0.0]
  - - [128, 512, 1, 784]
    - [348, 0.0]
  - - [64, 64, 1, 3136]
    - [349, 0.0]
  - - [2560, 7000, 1, 2560]
    - [372, 0.0]
  - - [7680, 12000, 1, 2560]
    - [372, 0.0]
  - - [5124, 9124, 1, 1760]
    - [366, 0.0]
  - - [1760, 32, 1, 1760]
    - [353, 0.0]
  - - [512, 24000, 1, 1536]
    - [372, 0.0]
  - - [3072, 24000, 1, 1024]
    - [372, 0.0]
  - - [2048, 400, 1, 512]
    - [373, 0.0]
  - - [2560, 128, 1, 2560]
    - [359, 0.0]
  - - [3072, 16, 1, 1024]
    - [361, 0.0]
  - - [512, 48000, 1, 2816]
    - [372, 0.0]
  - - [512, 48000, 1, 2048]
    - [373, 0.0]
  - - [1760, 64, 1, 1760]
    - [353, 0.0]
  - - [2048, 1600, 1, 2048]
    - [373, 0.0]
  - - [512, 48000, 1, 1536]
    - [372, 0.0]
  - - [2560, 32, 1, 2560]
    - [353, 0.0]
  - - [8448, 5984, 1, 2816]
    - [372, 0.0]
  - - [4096, 3200, 1, 1024]
    - [373, 0.0]
  - - [1024, 24000, 1, 2560]
    - [372, 0.0]
  - - [1760, 6400, 1, 1760]
    - [366, 0.0]
  - - [5124, 9124, 1, 2048]
    - [373, 0.0]
  - - [1024, 700, 1, 512]
    - [365, 0.0]
  - - [4608, 32, 1, 1536]
    - [353, 0.0]
  - - [3072, 64, 1, 1024]
    - [361, 0.0]
  - - [16384, 3200, 1, 4096]
    - [373, 0.0]
  - - [2560, 16, 1, 2560]
    - [359, 0.0]
  - - [1024, 48000, 1, 2560]
    - [372, 0.0]
  - - [8448, 48000, 1, 2816]
    - [372, 0.0]
  - - [2048, 32, 1, 2048]
    - [356, 0.0]
  - - [2560, 3200, 1, 2560]
    - [372, 0.0]
  - - [16384, 800, 1, 4096]
    - [373, 0.0]
  - - [4608, 24000, 1, 1536]
    - [372, 0.0]
  - - [7680, 48000, 1, 2560]
    - [372, 0.0]
  - - [3072, 48000, 1, 1024]
    - [372, 0.0]
  - - [1760, 16, 1, 1760]
    - [356, 0.0]
  - - [8192, 3200, 1, 2048]
    - [373, 0.0]
  - - [512, 24000, 1, 2816]
    - [372, 0.0]
  - - [4096, 400, 1, 1024]
    - [373, 0.0]
  - - [6144, 48000, 1, 2560]
    - [372, 0.0]
  - - [4608, 48000, 1, 1536]
    - [372, 0.0]
  - - [4096, 128, 1, 4096]
    - [361, 0.0]
  - - [2048, 800, 1, 512]
    - [372, 0.0]
  - - [4608, 5984, 1, 1536]
    - [372, 0.0]
  - - [4096, 1600, 1, 1024]
    - [373, 0.0]
  - - [6144, 5984, 1, 2048]
    - [373, 0.0]
  - - [7680, 24000, 1, 2560]
    - [372, 0.0]
  - - [6144, 48000, 1, 2048]
    - [373, 0.0]
  - - [2048, 3200, 1, 2048]
    - [373, 0.0]
  - - [5124, 9124, 1, 2560]
    - [372, 0.0]
  - - [1024, 24000, 1, 1536]
    - [372, 0.0]
  - - [7680, 16, 1, 2560]
    - [356, 0.0]
  - - [2560, 6400, 1, 2560]
    - [372, 0.0]
  - - [2048, 128, 1, 2048]
    - [356, 0.0]
  - - [512, 16, 1, 500000]
    - [356, 0.0]
  - - [1024, 8, 1, 500000]
    - [353, 0.0]
  - - [512, 24000, 1, 2560]
    - [372, 0.0]
  - - [1024, 24000, 1, 2816]
    - [372, 0.0]
  - - [7680, 5984, 1, 2560]
    - [372, 0.0]
  - - [2048, 1600, 1, 512]
    - [373, 0.0]
  - - [2048, 7000, 1, 2048]
    - [373, 0.0]
  - - [1760, 800, 1, 1760]
    - [363, 0.0]
  - - [4096, 64, 1, 4096]
    - [356, 0.0]
  - - [7680, 32, 1, 2560]
    - [356, 0.0]
  - - [2560, 64, 1, 2560]
    - [359, 0.0]
  - - [3072, 128, 1, 1024]
    - [361, 0.0]
  - - [7680, 64, 1, 2560]
    - [365, 0.0]
  - - [1760, 128, 1, 1760]
    - [353, 0.0]
  - - [2560, 1600, 1, 2560]
    - [372, 0.0]
  - - [2048, 3200, 1, 512]
    - [373, 0.0]
  - - [2560, 800, 1, 2560]
    - [372, 0.0]
  - - [3072, 32, 1, 1024]
    - [356, 0.0]
  - - [6144, 32, 1, 2560]
    - [353, 0.0]
  - - [4608, 12000, 1, 1536]
    - [372, 0.0]
  - - [4096, 32, 1, 4096]
    - [362, 0.0]
  - - [6144, 24000, 1, 2048]
    - [373, 0.0]
  - - [8192, 800, 1, 2048]
    - [373, 0.0]
  - - [5124, 9124, 1, 4096]
    - [373, 0.0]
  - - [8448, 24000, 1, 2816]
    - [372, 0.0]
  - - [1024, 48000, 1, 1536]
    - [372, 0.0]
  - - [7680, 128, 1, 2560]
    - [365, 0.0]
  - - [8192, 1600, 1, 2048]
    - [373, 0.0]
  - - [4096, 800, 1, 1024]
    - [373, 0.0]
  - - [1024, 16, 1, 500000]
    - [356, 0.0]
  - - [2048, 800, 1, 2048]
    - [371, 0.0]
  - - [1760, 3200, 1, 1760]
    - [366, 0.0]
  - - [512, 48000, 1, 2560]
    - [372, 0.0]
  - - [8448, 16, 1, 2816]
    - [354, 0.0]
  - - [2048, 64, 1, 2048]
    - [356, 0.0]
  - - [512, 24000, 1, 2048]
    - [373, 0.0]
  - - [16384, 1600, 1, 4096]
    - [373, 0.0]
  - - [4608, 16, 1, 1536]
    - [353, 0.0]
  - - [1024, 24000, 1, 2048]
    - [373, 0.0]
  - - [8192, 400, 1, 2048]
    - [373, 0.0]
  - - [2048, 6400, 1, 2048]
    - [373, 0.0]
  - - [6144, 12000, 1, 2048]
    - [373, 0.0]
  - - [512, 8, 1, 500000]
    - [353, 0.0]
  - - [1760, 7000, 1, 1760]
    - [366, 0.0]
  - - [1024, 48000, 1, 2816]
    - [372, 0.0]
  - - [6144, 16, 1, 2560]
    - [359, 0.0]
  - - [8448, 32, 1, 2816]
    - [359, 0.0]
  - - [4096, 7000, 1, 4096]
    - [373, 0.0]
  - - [4096, 16, 1, 4096]
    - [357, 0.0]
  - - [6144, 24000, 1, 2560]
    - [372, 0.0]
  - - [2048, 16, 1, 2048]
    - [361, 0.0]
  - - [8448, 12000, 1, 2816]
    - [372, 0.0]
  - - [16384, 400, 1, 4096]
    - [373, 0.0]
  - - [1760, 1600, 1, 1760]
    - [364, 0.0]
  - - [1024, 48000, 1, 2048]
    - [373, 0.0]
  - - [3073, 3072, 1, 3072]
    - [413, 0.0]
  - - [3072, 512, 1, 3072]
    - [420, 0.0]
  - - [511, 2048, 1, 2048]
    - [412, 0.0]
  - - [4096, 4096, 1, 4096]
    - [420, 0.0]
  - - [4096, 513, 1, 4096]
    - [416, 0.0]
  - - [513, 1024, 1, 1024]
    - [413, 0.0]
  - - [512, 2048, 1, 2047]
    - [418, 0.0]
  - - [512, 512, 1, 512]
    - [420, 0.0]
  - - [512, 1025, 1, 1024]
    - [412, 0.0]
  - - [3840, 4097, 1, 4096]
    - [413, 0.0]
  - - [1024, 1024, 1, 1024]
    - [420, 0.0]
  - - [960, 1025, 1, 1024]
    - [412, 0.0]
  - - [4096, 511, 1, 4096]
    - [412, 0.0]
  - - [512, 3072, 1, 3072]
    - [420, 0.0]
  - - [2049, 512, 1, 2048]
    - [412, 0.0]
  - - [7681, 8192, 1, 8192]
    - [416, 0.0]
  - - [8192, 512, 1, 8191]
    - [418, 0.0]
  - - [2048, 2048, 1, 2049]
    - [413, 0.0]
  - - [2880, 3072, 1, 3072]
    - [419, 0.0]
  - - [7680, 8193, 1, 8192]
    - [416, 0.0]
  - - [8192, 512, 1, 8193]
    - [413, 0.0]
  - - [1023, 512, 1, 1024]
    - [412, 0.0]
  - - [513, 2048, 1, 2048]
    - [412, 0.0]
  - - [8192, 8191, 1, 8192]
    - [413, 0.0]
  - - [512, 1023, 1, 1024]
    - [412, 0.0]
  - - [512, 4097, 1, 4096]
    - [413, 0.0]
  - - [1920, 2048, 1, 2047]
    - [413, 0.0]
  - - [1920, 2049, 1, 2048]
    - [413, 0.0]
  - - [3073, 512, 1, 3072]
    - [413, 0.0]
  - - [3841, 4096, 1, 4096]
    - [413, 0.0]
  - - [8192, 512, 1, 8192]
    - [420, 0.0]
  - - [511, 512, 1, 512]
    - [412, 0.0]
  - - [1024, 512, 1, 1025]
    - [412, 0.0]
  - - [4095, 512, 1, 4096]
    - [412, 0.0]
  - - [1919, 2048, 1, 2048]
    - [417, 0.0]
  - - [2879, 3072, 1, 3072]
    - [413, 0.0]
  - - [8192, 8192, 1, 8192]
    - [420, 0.0]
  - - [1024, 1024, 1, 1023]
    - [412, 0.0]
  - - [8191, 512, 1, 8192]
    - [413, 0.0]
  - - [512, 8193, 1, 8192]
    - [413, 0.0]
  - - [1024, 1025, 1, 1024]
    - [412, 0.0]
  - - [512, 512, 1, 511]
    - [412, 0.0]
  - - [2047, 2048, 1, 2048]
    - [412, 0.0]
  - - [1024, 1023, 1, 1024]
    - [412, 0.0]
  - - [512, 1024, 1, 1024]
    - [420, 0.0]
  - - [2880, 3072, 1, 3071]
    - [414, 0.0]
  - - [2048, 511, 1, 2048]
    - [412, 0.0]
  - - [7680, 8192, 1, 8193]
    - [416, 0.0]
  - - [512, 8191, 1, 8192]
    - [413, 0.0]
  - - [512, 4096, 1, 4096]
    - [420, 0.0]
  - - [4097, 512, 1, 4096]
    - [413, 0.0]
  - - [1921, 2048, 1, 2048]
    - [413, 0.0]
  - - [2048, 2049, 1, 2048]
    - [413, 0.0]
  - - [3072, 512, 1, 3071]
    - [413, 0.0]
  - - [8192, 8192, 1, 8191]
    - [416, 0.0]
  - - [2880, 3072, 1, 3073]
    - [414, 0.0]
  - - [2047, 512, 1, 2048]
    - [412, 0.0]
  - - [1025, 1024, 1, 1024]
    - [418, 0.0]
  - - [3072, 513, 1, 3072]
    - [413, 0.0]
  - - [512, 513, 1, 512]
    - [412, 0.0]
  - - [512, 511, 1, 512]
    - [412, 0.0]
  - - [3839, 4096, 1, 4096]
    - [416, 0.0]
  - - [512, 4096, 1, 4097]
    - [413, 0.0]
  - - [3072, 3073, 1, 3072]
    - [413, 0.0]
  - - [512, 4096, 1, 4095]
    - [416, 0.0]
  - - [8191, 8192, 1, 8192]
    - [416, 0.0]
  - - [2880, 3071, 1, 3072]
    - [413, 0.0]
  - - [4096, 512, 1, 4097]
    - [412, 0.0]
  - - [1920, 2047, 1, 2048]
    - [413, 0.0]
  - - [512, 2049, 1, 2048]
    - [412, 0.0]
  - - [3072, 3072, 1, 3071]
    - [413, 0.0]
  - - [8192, 8193, 1, 8192]
    - [413, 0.0]
  - - [4096, 512, 1, 4095]
    - [416, 0.0]
  - - [960, 1024, 1, 1024]
    - [419, 0.0]
  - - [961, 1024, 1, 1024]
    - [412, 0.0]
  - - [4096, 4097, 1, 4096]
    - [412, 0.0]
  - - [512, 8192, 1, 8192]
    - [420, 0.0]
  - - [8192, 8192, 1, 8193]
    - [416, 0.0]
  - - [4096, 4095, 1, 4096]
    - [416, 0.0]
  - - [511, 8192, 1, 8192]
    - [412, 0.0]
  - - [512, 3071, 1, 3072]
    - [413, 0.0]
  - - [3840, 4096, 1, 4096]
    - [420, 0.0]
  - - [7680, 8191, 1, 8192]
    - [416, 0.0]
  - - [7680, 8192, 1, 8192]
    - [420, 0.0]
  - - [4096, 4096, 1, 4097]
    - [413, 0.0]
  - - [512, 8192, 1, 8193]
    - [413, 0.0]
  - - [8192, 513, 1, 8192]
    - [413, 0.0]
  - - [1024, 1024, 1, 1025]
    - [412, 0.0]
  - - [960, 1024, 1, 1023]
    - [414, 0.0]
  - - [512, 2048, 1, 2049]
    - [412, 0.0]
  - - [8192, 511, 1, 8192]
    - [413, 0.0]
  - - [513, 4096, 1, 4096]
    - [413, 0.0]
  - - [511, 1024, 1, 1024]
    - [412, 0.0]
  - - [513, 512, 1, 512]
    - [412, 0.0]
  - - [3072, 3072, 1, 3073]
    - [415, 0.0]
  - - [960, 1024, 1, 1025]
    - [418, 0.0]
  - - [959, 1024, 1, 1024]
    - [418, 0.0]
  - - [2048, 2048, 1, 2048]
    - [420, 0.0]
  - - [512, 3072, 1, 3073]
    - [413, 0.0]
  - - [511, 3072, 1, 3072]
    - [413, 0.0]
  - - [513, 8192, 1, 8192]
    - [418, 0.0]
  - - [4095, 4096, 1, 4096]
    - [416, 0.0]
  - - [8193, 8192, 1, 8192]
    - [413, 0.0]
  - - [3840, 4095, 1, 4096]
    - [417, 0.0]
  - - [512, 3073, 1, 3072]
    - [413, 0.0]
  - - [4096, 4096, 1, 4095]
    - [413, 0.0]
  - - [512, 8192, 1, 8191]
    - [414, 0.0]
  - - [1025, 512, 1, 1024]
    - [412, 0.0]
  - - [2881, 3072, 1, 3072]
    - [413, 0.0]
  - - [1024, 512, 1, 1023]
    - [413, 0.0]
  - - [3840, 4096, 1, 4097]
    - [416, 0.0]
  - - [2048, 513, 1, 2048]
    - [412, 0.0]
  - - [1920, 2048, 1, 2048]
    - [420, 0.0]
  - - [3072, 512, 1, 3073]
    - [413, 0.0]
  - - [513, 3072, 1, 3072]
    - [414, 0.0]
  - - [3072, 511, 1, 3072]
    - [413, 0.0]
  - - [511, 4096, 1, 4096]
    - [413, 0.0]
  - - [2049, 2048, 1, 2048]
    - [413, 0.0]
  - - [2048, 2047, 1, 2048]
    - [413, 0.0]
  - - [960, 1023, 1, 1024]
    - [418, 0.0]
  - - [2880, 3073, 1, 3072]
    - [413, 0.0]
  - - [1024, 511, 1, 1024]
    - [418, 0.0]
  - - [512, 2048, 1, 2048]
    - [420, 0.0]
  - - [8193, 512, 1, 8192]
    - [413, 0.0]
  - - [2048, 512, 1, 2047]
    - [412, 0.0]
  - - [3071, 3072, 1, 3072]
    - [416, 0.0]
  - - [4096, 512, 1, 4096]
    - [420, 0.0]
  - - [512, 4095, 1, 4096]
    - [413, 0.0]
  - - [512, 1024, 1, 1025]
    - [412, 0.0]
  - - [3071, 512, 1, 3072]
    - [413, 0.0]
  - - [2048, 2048, 1, 2047]
    - [413, 0.0]
  - - [512, 2047, 1, 2048]
    - [412, 0.0]
  - - [512, 3072, 1, 3071]
    - [415, 0.0]
  - - [3072, 3071, 1, 3072]
    - [414, 0.0]
  - - [4097, 4096, 1, 4096]
    - [413, 0.0]
  - - [1024, 513, 1, 1024]
    - [412, 0.0]
  - - [3840, 4096, 1, 4095]
    - [416, 0.0]
  - - [3072, 3072, 1, 3072]
    - [420, 0.0]
  - - [512, 512, 1, 513]
    - [412, 0.0]
  - - [7679, 8192, 1, 8192]
    - [413, 0.0]
  - - [2048, 512, 1, 2049]
    - [412, 0.0]
  - - [512, 1024, 1, 1023]
    - [412, 0.0]
  - - [7680, 8192, 1, 8191]
    - [416, 0.0]
  - - [1023, 1024, 1, 1024]
    - [412, 0.0]
  - - [1920, 2048, 1, 2049]
    - [413, 0.0]
  - - [2, 4, 1, 1024]
    - [517, 0.0]
  - - [2, 32, 1, 1024]
    - [455, 0.0]
  - - [2, 2048, 1, 1024]
    - [467, 0.0]
  - - [64, 128, 512, 128]
    - [454, 0.0]
  - - [64, 512, 1, 512]
    - [541, 0.0]
  - - [64, 512, 64, 512]
    - [471, 0.0]
  - - [128, 128, 512, 64]
    - [492, 0.0]
  - - [512, 512, 1, 64]
    - [468, 0.0]
  - - [512, 512, 64, 64]
    - [515, 0.0]
  - - [1024, 4, 1, 1024]
    - [468, 0.0]
  - - [1024, 4, 1, 1024]
    - [468, 0.0]
  - - [1024, 32, 1, 1024]
    - [531, 0.0]
  - - [1024, 2048, 1, 1024]
    - [496, 0.0]
  - - [1024, 2048, 1, 4096]
    - [470, 0.0]
  - - [1024, 4096, 1, 1024]
    - [506, 0.0]
  - - [1024, 4096, 1, 4096]
    - [544, 0.0]
  - - [4096, 2048, 1, 1024]
    - [473, 0.0]
  - - [4096, 4096, 1, 1024]
    - [483, 0.0]
  - - [30528, 2048, 1, 1024]
    - [483, 0.0]
  - - [30528, 4096, 1, 1024]
    - [483, 0.0]
  - - [3, 3, 512, 64]
    - [458, 0.0]
  - - [5, 5, 512, 64]
    - [465, 0.0]
  - - [5, 5, 960, 64]
    - [463, 0.0]
  - - [9, 9, 512, 64]
    - [466, 0.0]
  - - [27, 27, 32768, 128]
    - [464, 0.0]
  - - [32, 1600, 1, 512]
    - [499, 0.0]
  - - [33, 33, 1600, 32]
    - [459, 0.0]
  - - [64, 512, 1, 1024]
    - [541, 0.0]
  - - [64, 960, 1, 1024]
    - [468, 0.0]
  - - [128, 32768, 1, 256]
    - [522, 0.0]
  - - [256, 684, 1, 1024]
    - [468, 0.0]
  - - [256, 1280, 1, 1024]
    - [528, 0.0]
  - - [256, 1536, 1, 1024]
    - [548, 0.0]
  - - [256, 2304, 1, 1024]
    - [536, 0.0]
  - - [256, 2560, 1, 1024]
    - [529, 0.0]
  - - [256, 2816, 1, 1024]
    - [536, 0.0]
  - - [256, 3328, 1, 1024]
    - [546, 0.0]
  - - [256, 3584, 1, 1024]
    - [462, 0.0]
  - - [256, 4608, 1, 1024]
    - [539, 0.0]
  - - [256, 4864, 1, 1024]
    - [535, 0.0]
  - - [256, 5376, 1, 1024]
    - [498, 0.0]
  - - [256, 5888, 1, 1024]
    - [498, 0.0]
  - - [256, 6144, 1, 1024]
    - [498, 0.0]
  - - [256, 6400, 1, 1024]
    - [498, 0.0]
  - - [256, 6656, 1, 1024]
    - [547, 0.0]
  - - [256, 7168, 1, 1024]
    - [495, 0.0]
  - - [256, 7424, 1, 1024]
    - [480, 0.0]
  - - [256, 7936, 1, 1024]
    - [545, 0.0]
  - - [256, 8192, 1, 1024]
    - [502, 0.0]
  - - [256, 8448, 1, 1024]
    - [545, 0.0]
  - - [256, 8960, 1, 1024]
    - [502, 0.0]
  - - [256, 9984, 1, 1024]
    - [502, 0.0]
  - - [256, 10496, 1, 1024]
    - [502, 0.0]
  - - [256, 11264, 1, 1024]
    - [538, 0.0]
  - - [256, 11520, 1, 1024]
    - [502, 0.0]
  - - [256, 11776, 1, 1024]
    - [502, 0.0]
  - - [256, 12544, 1, 1024]
    - [479, 0.0]
  - - [256, 13312, 1, 1024]
    - [533, 0.0]
  - - [256, 14336, 1, 1024]
    - [502, 0.0]
  - - [256, 14592, 1, 1024]
    - [479, 0.0]
  - - [256, 14848, 1, 1024]
    - [481, 0.0]
  - - [256, 15104, 1, 1024]
    - [479, 0.0]
  - - [256, 16128, 1, 1024]
    - [505, 0.0]
  - - [256, 18176, 1, 1024]
    - [460, 0.0]
  - - [256, 18944, 1, 1024]
    - [501, 0.0]
  - - [256, 19200, 1, 1024]
    - [505, 0.0]
  - - [256, 20480, 1, 1024]
    - [498, 0.0]
  - - [256, 20992, 1, 1024]
    - [495, 0.0]
  - - [256, 21248, 1, 1024]
    - [502, 0.0]
  - - [256, 21504, 1, 1024]
    - [498, 0.0]
  - - [256, 22016, 1, 1024]
    - [527, 0.0]
  - - [256, 22344, 1, 1024]
    - [484, 0.0]
  - - [256, 23296, 1, 1024]
    - [502, 0.0]
  - - [256, 23552, 1, 1024]
    - [527, 0.0]
  - - [256, 31488, 1, 1024]
    - [461, 0.0]
  - - [256, 32768, 1, 512]
    - [501, 0.0]
  - - [256, 33536, 1, 1024]
    - [461, 0.0]
  - - [256, 44505, 1, 1024]
    - [479, 0.0]
  - - [512, 1600, 1, 512]
    - [521, 0.0]
  - - [512, 32768, 1, 13]
    - [518, 0.0]
  - - [512, 32768, 1, 1024]
    - [502, 0.0]
  - - [684, 8976, 1, 256]
    - [474, 0.0]
  - - [1024, 200, 1, 560]
    - [497, 0.0]
  - - [1024, 512, 1, 1024]
    - [530, 0.0]
  - - [1024, 512, 1, 1600]
    - [457, 0.0]
  - - [1024, 960, 1, 1024]
    - [543, 0.0]
  - - [1024, 960, 1, 1600]
    - [525, 0.0]
  - - [1024, 1600, 1, 560]
    - [512, 0.0]
  - - [1024, 1600, 1, 1024]
    - [523, 0.0]
  - - [1024, 32768, 1, 480]
    - [516, 0.0]
  - - [1024, 32768, 1, 1024]
    - [502, 0.0]
  - - [1280, 8976, 1, 256]
    - [510, 0.0]
  - - [1792, 8976, 1, 256]
    - [493, 0.0]
  - - [2048, 114, 1, 512]
    - [456, 0.0]
  - - [2048, 114, 1, 768]
    - [468, 0.0]
  - - [2048, 215, 1, 512]
    - [463, 0.0]
  - - [2048, 215, 1, 768]
    - [504, 0.0]
  - - [2048, 256, 1, 512]
    - [504, 0.0]
  - - [2048, 256, 1, 768]
    - [463, 0.0]
  - - [2048, 512, 1, 67]
    - [521, 0.0]
  - - [2048, 512, 1, 74]
    - [514, 0.0]
  - - [2048, 512, 1, 100]
    - [515, 0.0]
  - - [2048, 512, 1, 2048]
    - [474, 0.0]
  - - [2048, 684, 1, 512]
    - [521, 0.0]
  - - [2048, 684, 1, 768]
    - [508, 0.0]
  - - [2048, 960, 1, 74]
    - [510, 0.0]
  - - [2048, 960, 1, 2048]
    - [503, 0.0]
  - - [2048, 1536, 1, 512]
    - [540, 0.0]
  - - [2048, 1536, 1, 768]
    - [513, 0.0]
  - - [2048, 8976, 1, 256]
    - [479, 0.0]
  - - [2304, 8976, 1, 256]
    - [493, 0.0]
  - - [2560, 8976, 1, 256]
    - [513, 0.0]
  - - [2816, 8976, 1, 256]
    - [476, 0.0]
  - - [3072, 8976, 1, 256]
    - [493, 0.0]
  - - [3328, 8976, 1, 256]
    - [502, 0.0]
  - - [3840, 8976, 1, 256]
    - [502, 0.0]
  - - [4096, 8976, 1, 256]
    - [502, 0.0]
  - - [4352, 8976, 1, 256]
    - [475, 0.0]
  - - [4608, 8976, 1, 256]
    - [513, 0.0]
  - - [4864, 8976, 1, 256]
    - [485, 0.0]
  - - [5120, 8976, 1, 256]
    - [513, 0.0]
  - - [5376, 8976, 1, 256]
    - [485, 0.0]
  - - [5632, 8976, 1, 256]
    - [509, 0.0]
  - - [5888, 8976, 1, 256]
    - [502, 0.0]
  - - [6144, 8976, 1, 256]
    - [491, 0.0]
  - - [6400, 8976, 1, 256]
    - [502, 0.0]
  - - [7168, 8976, 1, 256]
    - [513, 0.0]
  - - [7936, 8976, 1, 256]
    - [519, 0.0]
  - - [8192, 8976, 1, 256]
    - [507, 0.0]
  - - [8448, 8976, 1, 256]
    - [502, 0.0]
  - - [8960, 8976, 1, 256]
    - [502, 0.0]
  - - [9472, 8976, 1, 256]
    - [502, 0.0]
  - - [9728, 8976, 1, 256]
    - [513, 0.0]
  - - [9984, 8976, 1, 256]
    - [502, 0.0]
  - - [10240, 8976, 1, 256]
    - [494, 0.0]
  - - [10496, 8976, 1, 256]
    - [502, 0.0]
  - - [11264, 8976, 1, 256]
    - [513, 0.0]
  - - [11776, 8976, 1, 256]
    - [519, 0.0]
  - - [12544, 8976, 1, 256]
    - [519, 0.0]
  - - [13312, 8976, 1, 256]
    - [513, 0.0]
  - - [13568, 8976, 1, 256]
    - [519, 0.0]
  - - [13824, 8976, 1, 256]
    - [519, 0.0]
  - - [15104, 8976, 1, 256]
    - [519, 0.0]
  - - [15360, 8976, 1, 256]
    - [511, 0.0]
  - - [15872, 8976, 1, 256]
    - [519, 0.0]
  - - [16128, 8976, 1, 256]
    - [519, 0.0]
  - - [17152, 8976, 1, 256]
    - [519, 0.0]
  - - [18176, 8976, 1, 256]
    - [519, 0.0]
  - - [18688, 8976, 1, 256]
    - [519, 0.0]
  - - [18944, 8976, 1, 256]
    - [519, 0.0]
  - - [19712, 8976, 1, 256]
    - [526, 0.0]
  - - [19968, 8976, 1, 256]
    - [519, 0.0]
  - - [20480, 8976, 1, 256]
    - [477, 0.0]
  - - [20992, 8976, 1, 256]
    - [519, 0.0]
  - - [21248, 8976, 1, 256]
    - [519, 0.0]
  - - [23552, 8976, 1, 256]
    - [511, 0.0]
  - - [28672, 8976, 1, 256]
    - [490, 0.0]
  - - [31488, 8976, 1, 256]
    - [519, 0.0]
  - - [33536, 8976, 1, 256]
    - [519, 0.0]
  - - [44505, 8976, 1, 256]
    - [526, 0.0]
  - - [1024, 3840, 1, 1024]
    - [524, 0.0]
  - - [1024, 3840, 1, 4096]
    - [520, 0.0]
  - - [1024, 3968, 1, 1024]
    - [501, 0.0]
  - - [1024, 3968, 1, 4096]
    - [534, 0.0]
  - - [1024, 6528, 1, 1024]
    - [533, 0.0]
  - - [1024, 6528, 1, 4096]
    - [500, 0.0]
  - - [1024, 7104, 1, 1024]
    - [479, 0.0]
  - - [1024, 7104, 1, 4096]
    - [500, 0.0]
  - - [1024, 7200, 1, 1024]
    - [542, 0.0]
  - - [1024, 7200, 1, 4096]
    - [470, 0.0]
  - - [1024, 8064, 1, 1024]
    - [482, 0.0]
  - - [1024, 8064, 1, 4096]
    - [500, 0.0]
  - - [1024, 8160, 1, 1024]
    - [484, 0.0]
  - - [1024, 8160, 1, 4096]
    - [488, 0.0]
  - - [1024, 9216, 1, 1024]
    - [502, 0.0]
  - - [1024, 9216, 1, 4096]
    - [500, 0.0]
  - - [1024, 9520, 1, 1024]
    - [502, 0.0]
  - - [1024, 9520, 1, 4096]
    - [469, 0.0]
  - - [1024, 10064, 1, 1024]
    - [502, 0.0]
  - - [1024, 10064, 1, 4096]
    - [488, 0.0]
  - - [1024, 10080, 1, 1024]
    - [496, 0.0]
  - - [1024, 10080, 1, 4096]
    - [500, 0.0]
  - - [1024, 10200, 1, 1024]
    - [502, 0.0]
  - - [1024, 10200, 1, 4096]
    - [500, 0.0]
  - - [4096, 3840, 1, 1024]
    - [532, 0.0]
  - - [4096, 3968, 1, 1024]
    - [489, 0.0]
  - - [4096, 6528, 1, 1024]
    - [491, 0.0]
  - - [4096, 7104, 1, 1024]
    - [473, 0.0]
  - - [4096, 7200, 1, 1024]
    - [491, 0.0]
  - - [4096, 8064, 1, 1024]
    - [489, 0.0]
  - - [4096, 8160, 1, 1024]
    - [489, 0.0]
  - - [4096, 9216, 1, 1024]
    - [491, 0.0]
  - - [4096, 9520, 1, 1024]
    - [487, 0.0]
  - - [4096, 10064, 1, 1024]
    - [473, 0.0]
  - - [4096, 10080, 1, 1024]
    - [473, 0.0]
  - - [4096, 10200, 1, 1024]
    - [473, 0.0]
  - - [42720, 3968, 1, 1024]
    - [500, 0.0]
  - - [42720, 6528, 1, 1024]
    - [532, 0.0]
  - - [42720, 7104, 1, 1024]
    - [472, 0.0]
  - - [42720, 7200, 1, 1024]
    - [537, 0.0]
  - - [42720, 9520, 1, 1024]
    - [500, 0.0]
  - - [42720, 10080, 1, 1024]
    - [483, 0.0]
  - - [1024, 3240, 1, 1024]
    - [496, 0.0]
  - - [1024, 3240, 1, 4096]
    - [470, 0.0]
  - - [1024, 3960, 1, 1024]
    - [486, 0.0]
  - - [1024, 3960, 1, 4096]
    - [478, 0.0]
  - - [4096, 3240, 1, 1024]
    - [491, 0.0]
  - - [4096, 3960, 1, 1024]
    - [473, 0.0]
  - - [42720, 3960, 1, 1024]
    - [472, 0.0]
  - - [14, 14, 1, 64]
    - [550, 0.0]
  - - [15, 14, 1, 64]
    - [549, 0.0]
  - - [15, 15, 1, 64]
    - [549, 0.0]
  - - [15, 15, 1, 64]
    - [549, 0.0]
  - - [17, 15, 1, 64]
    - [552, 0.0]
  - - [17, 17, 1, 64]
    - [550, 0.0]
  - - [17, 17, 1, 64]
    - [550, 0.0]
  - - [21, 17, 1, 64]
    - [553, 0.0]
  - - [21, 21, 1, 64]
    - [549, 0.0]
  - - [24, 24, 1, 64]
    - [552, 0.0]
  - - [30, 30, 1, 64]
    - [552, 0.0]
  - - [30, 31, 1, 64]
    - [552, 0.0]
  - - [31, 31, 1, 64]
    - [551, 0.0]
  - - [32, 32, 1, 64]
    - [552, 0.0]
  - - [32, 35, 1, 64]
    - [552, 0.0]
  - - [34, 24, 1, 64]
    - [551, 0.0]
  - - [34, 34, 1, 64]
    - [552, 0.0]
  - - [35, 35, 1, 64]
    - [552, 0.0]
  - - [27, 27, 1, 64]
    - [551, 0.0]
  - - [27, 33, 1, 64]
    - [552, 0.0]
  - - [33, 33, 1, 64]
    - [463, 0.0]
  - - [30, 30, 2048, 64]
    - [559, 0.0]
  - - [30, 31, 2048, 64]
    - [557, 0.0]
  - - [31, 31, 2048, 64]
    - [554, 0.0]
  - - [27, 27, 1920, 64]
    - [556, 0.0]
  - - [27, 33, 1920, 64]
    - [559, 0.0]
  - - [33, 33, 1920, 64]
    - [558, 0.0]
  - - [14, 14, 10880, 64]
    - [556, 0.0]
  - - [15, 14, 10880, 64]
    - [555, 0.0]
  - - [15, 15, 7680, 64]
    - [555, 0.0]
  - - [15, 15, 10880, 64]
    - [555, 0.0]
  - - [17, 15, 7680, 64]
    - [555, 0.0]
  - - [17, 17, 7680, 64]
    - [556, 0.0]
- null
