library/src/blas3/Tensile/Logic/asm_full/arcturus_Cijk_Ailk_Bljk_DB_GB.yaml
- {MinimumRequiredVersion: 4.26.0}
- arcturus
- gfx908
- [Device 7380, Device 7388, Device 738c, Device 7390]
    SolutionIndex: 0
    SolutionNameMin: Cijk_Ailk_Bljk_DB_GB_MT32x128x8_SN_PLR1_SU0_SUM0_SUS256_SNLL1_TT4_4_WG8_32_1_WGM1
    SolutionIndex: 1
    SolutionNameMin: Cijk_Ailk_Bljk_DB_GB_MT64x64x8_SN_PLR1_SU0_SUM0_SUS256_SNLL1_TT4_4_WG16_16_1_WGM1
    SolutionIndex: 2
    SolutionNameMin: Cijk_Ailk_Bljk_DB_GB_MT128x32x8_SN_PLR1_SU0_SUM0_SUS256_SNLL1_TT4_4_WG32_8_1_WGM1
    SolutionIndex: 3
    SolutionNameMin: Cijk_Ailk_Bljk_DB_GB_MT64x64x16_SN_PLR1_SU0_SUM0_SUS256_SNLL1_TT4_4_WG16_16_1_WGM1
    SolutionIndex: 4
    SolutionNameMin: Cijk_Ailk_Bljk_DB_GB_MT128x32x16_SN_PLR1_SU0_SUM0_SUS256_SNLL1_TT4_4_WG32_8_1_WGM1
    SolutionIndex: 5
    SolutionNameMin: Cijk_Ailk_Bljk_DB_GB_MT32x128x8_SN_PLR1_SU32_SUM0_SUS128_SNLL1_TT4_4_WG8_32_1_WGM1
    SolutionIndex: 6
    SolutionNameMin: Cijk_Ailk_Bljk_DB_GB_MT128x32x8_SN_PLR1_SU32_SUM0_SUS128_SNLL1_TT4_4_WG32_8_1_WGM1
    SolutionIndex: 7
    SolutionNameMin: Cijk_Ailk_Bljk_DB_GB_MT64x64x8_SN_PLR1_SU32_SUM3_SUS128_SNLL1_TT4_4_WG16_16_1_WGM1
    SolutionIndex: 8
    SolutionNameMin: Cijk_Ailk_Bljk_DB_GB_MT64x64x8_SN_PLR1_SU32_SUM0_SUS256_SNLL1_TT4_4_WG16_16_1_WGM1
    SolutionIndex: 9
    SolutionNameMin: Cijk_Ailk_Bljk_DB_GB_MT64x64x8_SN_PLR1_SU32_SUM3_SUS256_SNLL1_TT4_4_WG16_16_1_WGM1
    SolutionIndex: 10
    SolutionNameMin: Cijk_Ailk_Bljk_DB_GB_MT32x128x8_SN_PLR1_SU0_SUM0_SUS256_SNLL1_TT4_4_WG8_32_1_WGM8
    SolutionIndex: 11
    SolutionNameMin: Cijk_Ailk_Bljk_DB_GB_MT64x64x8_SN_PLR1_SU0_SUM0_SUS256_SNLL1_TT4_4_WG16_16_1_WGM8
    SolutionIndex: 12
    SolutionNameMin: Cijk_Ailk_Bljk_DB_GB_MT128x32x8_SN_PLR1_SU0_SUM0_SUS256_SNLL1_TT4_4_WG32_8_1_WGM8
    SolutionIndex: 13
    SolutionNameMin: Cijk_Ailk_Bljk_DB_GB_MT192x32x8_SN_PLR1_SU0_SUM0_SUS256_SNLL1_TT6_4_WG32_8_1_WGM8
    SolutionIndex: 14
    SolutionNameMin: Cijk_Ailk_Bljk_DB_GB_MT128x32x16_SN_PLR1_SU0_SUM0_SUS256_SNLL1_TT4_4_WG32_8_1_WGM8
    SolutionIndex: 15
    SolutionNameMin: Cijk_Ailk_Bljk_DB_GB_MT64x64x8_SN_PLR1_SU32_SUM0_SUS128_SNLL1_TT4_4_WG16_16_1_WGM8
    SolutionIndex: 16
    SolutionNameMin: Cijk_Ailk_Bljk_DB_GB_MT64x64x8_SN_PLR1_SU32_SUM0_SUS256_SNLL1_TT4_4_WG16_16_1_WGM8
    SolutionIndex: 17
    SolutionNameMin: Cijk_Ailk_Bljk_DB_GB_MT32x128x8_SN_PLR1_SU0_SUM0_SUS256_SNLL1_TT4_4_WG8_32_1_WGM15
    SolutionIndex: 18
    SolutionNameMin: Cijk_Ailk_Bljk_DB_GB_MT64x64x8_SN_PLR1_SU0_SUM0_SUS256_SNLL1_TT4_4_WG16_16_1_WGM15
    SolutionIndex: 19
    SolutionNameMin: Cijk_Ailk_Bljk_DB_GB_MT128x32x8_SN_PLR1_SU0_SUM0_SUS256_SNLL1_TT4_4_WG32_8_1_WGM15
    SolutionIndex: 20
    SolutionNameMin: Cijk_Ailk_Bljk_DB_GB_MT64x64x8_SN_PLR1_SU32_SUM3_SUS128_SNLL1_TT4_4_WG16_16_1_WGM15
    SolutionIndex: 21
    SolutionNameMin: Cijk_Ailk_Bljk_DB_GB_MT32x128x8_SN_PLR1_SU32_SUM0_SUS256_SNLL1_TT4_4_WG8_32_1_WGM15
    SolutionIndex: 22
    SolutionNameMin: Cijk_Ailk_Bljk_DB_GB_MT128x32x8_SN_PLR1_SU32_SUM0_SUS256_SNLL1_TT4_4_WG32_8_1_WGM15
    SolutionIndex: 23
    SolutionNameMin: Cijk_Ailk_Bljk_DB_GB_MT32x128x8_SN_PLR1_SU0_SUM0_SUS256_SNLL0_TT4_4_WG8_32_1_WGM1
    SolutionIndex: 24
    SolutionNameMin: Cijk_Ailk_Bljk_DB_GB_MT64x64x8_SN_PLR1_SU0_SUM0_SUS256_SNLL0_TT4_4_WG16_16_1_WGM1
    SolutionIndex: 25
    SolutionNameMin: Cijk_Ailk_Bljk_DB_GB_MT64x64x8_SN_PLR0_SU0_SUM0_SUS256_SNLL0_TT4_4_WG16_16_1_WGM1
    SolutionIndex: 26
    SolutionNameMin: Cijk_Ailk_Bljk_DB_GB_MT128x32x8_SN_PLR1_SU0_SUM0_SUS256_SNLL0_TT4_4_WG32_8_1_WGM1
    SolutionIndex: 27
    SolutionNameMin: Cijk_Ailk_Bljk_DB_GB_MT192x32x8_SN_PLR0_SU0_SUM0_SUS256_SNLL0_TT6_4_WG32_8_1_WGM1
    SolutionIndex: 28
    SolutionNameMin: Cijk_Ailk_Bljk_DB_GB_MT32x128x16_SN_PLR1_SU0_SUM0_SUS256_SNLL0_TT4_4_WG8_32_1_WGM1
    SolutionIndex: 29
    SolutionNameMin: Cijk_Ailk_Bljk_DB_GB_MT32x128x8_SN_PLR1_SU32_SUM0_SUS128_SNLL0_TT4_4_WG8_32_1_WGM1
    SolutionIndex: 30
    SolutionNameMin: Cijk_Ailk_Bljk_DB_GB_MT64x64x8_SN_PLR1_SU32_SUM0_SUS128_SNLL0_TT4_4_WG16_16_1_WGM1
    SolutionIndex: 31
    SolutionNameMin: Cijk_Ailk_Bljk_DB_GB_MT128x32x8_SN_PLR1_SU32_SUM0_SUS128_SNLL0_TT4_4_WG32_8_1_WGM1
    SolutionIndex: 32
    SolutionNameMin: Cijk_Ailk_Bljk_DB_GB_MT64x64x8_SN_PLR1_SU32_SUM3_SUS128_SNLL0_TT4_4_WG16_16_1_WGM1
    SolutionIndex: 33
    SolutionNameMin: Cijk_Ailk_Bljk_DB_GB_MT32x128x8_SN_PLR1_SU32_SUM0_SUS256_SNLL0_TT4_4_WG8_32_1_WGM1
    SolutionIndex: 34
    SolutionNameMin: Cijk_Ailk_Bljk_DB_GB_MT64x64x8_SN_PLR1_SU32_SUM0_SUS256_SNLL0_TT4_4_WG16_16_1_WGM1
    SolutionIndex: 35
    SolutionNameMin: Cijk_Ailk_Bljk_DB_GB_MT128x32x8_SN_PLR1_SU32_SUM0_SUS256_SNLL0_TT4_4_WG32_8_1_WGM1
    SolutionIndex: 36
    SolutionNameMin: Cijk_Ailk_Bljk_DB_GB_MT64x64x8_SN_PLR1_SU32_SUM3_SUS256_SNLL0_TT4_4_WG16_16_1_WGM1
    SolutionIndex: 37
    SolutionNameMin: Cijk_Ailk_Bljk_DB_GB_MT64x64x8_SN_PLR0_SU32_SUM3_SUS256_SNLL0_TT4_4_WG16_16_1_WGM1
    SolutionIndex: 38
    SolutionNameMin: Cijk_Ailk_Bljk_DB_GB_MT128x32x8_SN_PLR1_SU32_SUM3_SUS256_SNLL0_TT4_4_WG32_8_1_WGM1
    SolutionIndex: 39
    SolutionNameMin: Cijk_Ailk_Bljk_DB_GB_MT32x128x8_SN_PLR1_SU0_SUM0_SUS256_SNLL0_TT4_4_WG8_32_1_WGM8
    SolutionIndex: 40
    SolutionNameMin: Cijk_Ailk_Bljk_DB_GB_MT64x64x8_SN_PLR1_SU0_SUM0_SUS256_SNLL0_TT4_4_WG16_16_1_WGM8
    SolutionIndex: 41
    SolutionNameMin: Cijk_Ailk_Bljk_DB_GB_MT64x64x8_SN_PLR0_SU0_SUM0_SUS256_SNLL0_TT4_4_WG16_16_1_WGM8
    SolutionIndex: 42
    SolutionNameMin: Cijk_Ailk_Bljk_DB_GB_MT128x32x8_SN_PLR1_SU0_SUM0_SUS256_SNLL0_TT4_4_WG32_8_1_WGM8
    SolutionIndex: 43
    SolutionNameMin: Cijk_Ailk_Bljk_DB_GB_MT64x64x8_SN_PLR1_SU32_SUM0_SUS128_SNLL0_TT4_4_WG16_16_1_WGM8
    SolutionIndex: 44
    SolutionNameMin: Cijk_Ailk_Bljk_DB_GB_MT64x64x8_SN_PLR0_SU32_SUM0_SUS128_SNLL0_TT4_4_WG16_16_1_WGM8
    SolutionIndex: 45
    SolutionNameMin: Cijk_Ailk_Bljk_DB_GB_MT32x128x8_SN_PLR1_SU32_SUM3_SUS128_SNLL0_TT4_4_WG8_32_1_WGM8
    SolutionIndex: 46
    SolutionNameMin: Cijk_Ailk_Bljk_DB_GB_MT64x64x8_SN_PLR1_SU32_SUM3_SUS128_SNLL0_TT4_4_WG16_16_1_WGM8
    SolutionIndex: 47
    SolutionNameMin: Cijk_Ailk_Bljk_DB_GB_MT64x64x8_SN_PLR1_SU32_SUM0_SUS256_SNLL0_TT4_4_WG16_16_1_WGM8
    SolutionIndex: 48
    SolutionNameMin: Cijk_Ailk_Bljk_DB_GB_MT128x32x8_SN_PLR1_SU32_SUM0_SUS256_SNLL0_TT4_4_WG32_8_1_WGM8
    SolutionIndex: 49
    SolutionNameMin: Cijk_Ailk_Bljk_DB_GB_MT32x128x8_SN_PLR1_SU32_SUM3_SUS256_SNLL0_TT4_4_WG8_32_1_WGM8
    SolutionIndex: 50
    SolutionNameMin: Cijk_Ailk_Bljk_DB_GB_MT64x64x8_SN_PLR1_SU32_SUM3_SUS256_SNLL0_TT4_4_WG16_16_1_WGM8
    SolutionIndex: 51
    SolutionNameMin: Cijk_Ailk_Bljk_DB_GB_MT64x64x8_SN_PLR1_SU0_SUM0_SUS256_SNLL0_TT4_4_WG16_16_1_WGM15
    SolutionIndex: 52
    SolutionNameMin: Cijk_Ailk_Bljk_DB_GB_MT64x64x8_SN_PLR0_SU0_SUM0_SUS256_SNLL0_TT4_4_WG16_16_1_WGM15
    SolutionIndex: 53
    SolutionNameMin: Cijk_Ailk_Bljk_DB_GB_MT128x32x8_SN_PLR1_SU0_SUM0_SUS256_SNLL0_TT4_4_WG32_8_1_WGM15
    SolutionIndex: 54
    SolutionNameMin: Cijk_Ailk_Bljk_DB_GB_MT32x128x8_SN_PLR1_SU32_SUM0_SUS128_SNLL0_TT4_4_WG8_32_1_WGM15
    SolutionIndex: 55
    SolutionNameMin: Cijk_Ailk_Bljk_DB_GB_MT64x64x8_SN_PLR1_SU32_SUM0_SUS128_SNLL0_TT4_4_WG16_16_1_WGM15
    SolutionIndex: 56
    SolutionNameMin: Cijk_Ailk_Bljk_DB_GB_MT64x64x8_SN_PLR1_SU32_SUM3_SUS128_SNLL0_TT4_4_WG16_16_1_WGM15
    SolutionIndex: 57
    SolutionNameMin: Cijk_Ailk_Bljk_DB_GB_MT64x64x8_SN_PLR0_SU32_SUM3_SUS128_SNLL0_TT4_4_WG16_16_1_WGM15
    SolutionIndex: 58
    SolutionNameMin: Cijk_Ailk_Bljk_DB_GB_MT64x64x8_SN_PLR1_SU32_SUM0_SUS256_SNLL0_TT4_4_WG16_16_1_WGM15
    SolutionIndex: 59
    SolutionNameMin: Cijk_Ailk_Bljk_DB_GB_MT64x64x8_SN_PLR1_SU32_SUM3_SUS256_SNLL0_TT4_4_WG16_16_1_WGM15
    SolutionIndex: 60
    SolutionNameMin: Cijk_Ailk_Bljk_DB_GB_MT64x64x8_SN_PLR0_SU32_SUM3_SUS256_SNLL0_TT4_4_WG16_16_1_WGM15
    SolutionIndex: 61
    SolutionNameMin: Cijk_Ailk_Bljk_DB_GB_MT128x32x8_SN_PLR1_SU32_SUM3_SUS256_SNLL0_TT4_4_WG32_8_1_WGM15
    SolutionIndex: 62
    SolutionNameMin: Cijk_Ailk_Bljk_DB_GB_MT16x16x4_SN_PLR1_SU0_SUM0_SUS256_SNLL1_TT2_2_WG8_8_1_WGM1
    SolutionIndex: 63
    SolutionNameMin: Cijk_Ailk_Bljk_DB_GB_MT8x8x8_SN_PLR1_SU0_SUM0_SUS256_SNLL1_TT1_1_WG8_8_1_WGM1
    SolutionIndex: 64
    SolutionNameMin: Cijk_Ailk_Bljk_DB_GB_MT16x8x8_SN_PLR1_SU0_SUM0_SUS256_SNLL1_TT2_1_WG8_8_1_WGM1
    SolutionIndex: 65
    SolutionNameMin: Cijk_Ailk_Bljk_DB_GB_MT16x16x4_SN_PLR1_SU0_SUM0_SUS256_SNLL0_TT2_2_WG8_8_1_WGM1
    SolutionIndex: 66
    SolutionNameMin: Cijk_Ailk_Bljk_DB_GB_MT8x8x8_SN_PLR0_SU0_SUM0_SUS256_SNLL0_TT1_1_WG8_8_1_WGM1
    SolutionIndex: 67
    SolutionNameMin: Cijk_Ailk_Bljk_DB_GB_MT8x16x8_SN_PLR1_SU0_SUM0_SUS256_SNLL0_TT1_2_WG8_8_1_WGM1
    SolutionIndex: 68
    SolutionNameMin: Cijk_Ailk_Bljk_DB_GB_MT32x32x8_SN_PLR1_SU32_SUM0_SUS128_SNLL0_TT2_2_WG16_16_1_WGM1
    SolutionIndex: 69
    SolutionNameMin: Cijk_Ailk_Bljk_DB_GB_MT32x32x8_SN_PLR1_SU32_SUM3_SUS128_SNLL0_TT2_2_WG16_16_1_WGM1
    SolutionIndex: 70
    SolutionNameMin: Cijk_Ailk_Bljk_DB_GB_MT32x32x8_SN_PLR0_SU32_SUM3_SUS128_SNLL0_TT2_2_WG16_16_1_WGM1
    SolutionIndex: 71
    SolutionNameMin: Cijk_Ailk_Bljk_DB_GB_MT16x16x4_SN_PLR1_SU32_SUM0_SUS256_SNLL0_TT2_2_WG8_8_1_WGM1
    SolutionIndex: 72
    SolutionNameMin: Cijk_Ailk_Bljk_DB_GB_MT8x8x8_SN_PLR1_SU32_SUM0_SUS256_SNLL0_TT1_1_WG8_8_1_WGM1
    SolutionIndex: 73
    SolutionNameMin: Cijk_Ailk_Bljk_DB_GB_MT32x32x8_SN_PLR1_SU32_SUM0_SUS256_SNLL0_TT2_2_WG16_16_1_WGM1
    SolutionIndex: 74
    SolutionNameMin: Cijk_Ailk_Bljk_DB_GB_MT16x16x8_SN_PLR0_SU32_SUM0_SUS128_SNLL0_TT2_1_WG8_16_1_WGM8
    SolutionIndex: 75
    SolutionNameMin: Cijk_Ailk_Bljk_DB_GB_MT32x32x8_SN_PLR1_SU32_SUM0_SUS128_SNLL0_TT2_2_WG16_16_1_WGM8
    SolutionIndex: 76
    SolutionNameMin: Cijk_Ailk_Bljk_DB_GB_MT16x16x8_SN_PLR1_SU32_SUM3_SUS128_SNLL0_TT2_1_WG8_16_1_WGM8
    SolutionIndex: 77
    SolutionNameMin: Cijk_Ailk_Bljk_DB_GB_MT32x32x8_SN_PLR0_SU32_SUM3_SUS128_SNLL0_TT2_2_WG16_16_1_WGM8
    SolutionIndex: 78
    SolutionNameMin: Cijk_Ailk_Bljk_DB_GB_MT32x32x8_SN_PLR1_SU32_SUM0_SUS256_SNLL0_TT2_2_WG16_16_1_WGM8
    SolutionIndex: 79
    SolutionNameMin: Cijk_Ailk_Bljk_DB_GB_MT32x32x8_SN_PLR1_SU32_SUM3_SUS256_SNLL0_TT2_2_WG16_16_1_WGM8
    SolutionIndex: 80
    SolutionNameMin: Cijk_Ailk_Bljk_DB_GB_MT16x16x8_SN_PLR1_SU0_SUM0_SUS256_SNLL0_TT2_2_WG8_8_1_WGM15
    SolutionIndex: 81
    SolutionNameMin: Cijk_Ailk_Bljk_DB_GB_MT16x8x8_SN_PLR1_SU32_SUM0_SUS128_SNLL0_TT2_1_WG8_8_1_WGM15
    SolutionIndex: 82
    SolutionNameMin: Cijk_Ailk_Bljk_DB_GB_MT16x16x8_SN_PLR1_SU32_SUM0_SUS128_SNLL0_TT2_2_WG8_8_1_WGM15
    SolutionIndex: 83
    SolutionNameMin: Cijk_Ailk_Bljk_DB_GB_MT32x32x8_SN_PLR1_SU32_SUM0_SUS128_SNLL0_TT2_2_WG16_16_1_WGM15
    SolutionIndex: 84
    SolutionNameMin: Cijk_Ailk_Bljk_DB_GB_MT16x16x4_SN_PLR1_SU32_SUM3_SUS128_SNLL0_TT2_2_WG8_8_1_WGM15
    SolutionIndex: 85
    SolutionNameMin: Cijk_Ailk_Bljk_DB_GB_MT32x32x8_SN_PLR1_SU32_SUM0_SUS256_SNLL0_TT2_2_WG16_16_1_WGM15
    SolutionIndex: 86
    SolutionNameMin: Cijk_Ailk_Bljk_DB_GB_MT32x32x8_SN_PLR1_SU0_SUM0_SUS256_SNLL1_TT4_4_WG8_8_1_WGM8
    SolutionIndex: 87
    SolutionNameMin: Cijk_Ailk_Bljk_DB_GB_MT32x32x8_SN_PLR1_SU0_SUM0_SUS256_SNLL1_TT4_4_WG8_8_1_WGM15
    SolutionIndex: 88
    SolutionNameMin: Cijk_Ailk_Bljk_DB_GB_MT24x24x8_SN_PLR1_SU0_SUM0_SUS256_SNLL0_TT3_3_WG8_8_1_WGM1
    SolutionIndex: 89
    SolutionNameMin: Cijk_Ailk_Bljk_DB_GB_MT32x32x8_SN_PLR1_SU0_SUM0_SUS256_SNLL0_TT4_4_WG8_8_1_WGM1
    SolutionIndex: 90
    SolutionNameMin: Cijk_Ailk_Bljk_DB_GB_MT40x40x8_SN_PLR1_SU0_SUM0_SUS256_SNLL0_TT5_5_WG8_8_1_WGM1
    SolutionIndex: 91
    SolutionNameMin: Cijk_Ailk_Bljk_DB_GB_MT48x48x8_SN_PLR1_SU0_SUM0_SUS256_SNLL0_TT6_6_WG8_8_1_WGM1
    SolutionIndex: 92
    SolutionNameMin: Cijk_Ailk_Bljk_DB_GB_MT48x48x16_SN_PLR1_SU0_SUM0_SUS256_SNLL0_TT3_3_WG16_16_1_WGM1
    SolutionIndex: 93
    SolutionNameMin: Cijk_Ailk_Bljk_DB_GB_MT24x24x8_SN_PLR1_SU32_SUM0_SUS256_SNLL0_TT3_3_WG8_8_1_WGM1
    SolutionIndex: 94
    SolutionNameMin: Cijk_Ailk_Bljk_DB_GB_MT32x32x8_SN_PLR1_SU32_SUM0_SUS256_SNLL0_TT4_4_WG8_8_1_WGM1
    SolutionIndex: 95
    SolutionNameMin: Cijk_Ailk_Bljk_DB_GB_MT24x24x8_SN_PLR1_SU32_SUM3_SUS256_SNLL0_TT3_3_WG8_8_1_WGM1
    SolutionIndex: 96
    SolutionNameMin: Cijk_Ailk_Bljk_DB_GB_MT24x24x8_SN_PLR1_SU0_SUM0_SUS256_SNLL0_TT3_3_WG8_8_1_WGM8
    SolutionIndex: 97
    SolutionNameMin: Cijk_Ailk_Bljk_DB_GB_MT32x32x8_SN_PLR1_SU0_SUM0_SUS256_SNLL0_TT4_4_WG8_8_1_WGM8
    SolutionIndex: 98
    SolutionNameMin: Cijk_Ailk_Bljk_DB_GB_MT48x48x8_SN_PLR1_SU0_SUM0_SUS256_SNLL0_TT6_6_WG8_8_1_WGM8
    SolutionIndex: 99
    SolutionNameMin: Cijk_Ailk_Bljk_DB_GB_MT40x40x8_SN_PLR1_SU32_SUM0_SUS128_SNLL0_TT5_5_WG8_8_1_WGM8
    SolutionIndex: 100
    SolutionNameMin: Cijk_Ailk_Bljk_DB_GB_MT24x24x8_SN_PLR1_SU32_SUM0_SUS256_SNLL0_TT3_3_WG8_8_1_WGM8
    SolutionIndex: 101
    SolutionNameMin: Cijk_Ailk_Bljk_DB_GB_MT40x40x8_SN_PLR1_SU32_SUM3_SUS256_SNLL0_TT5_5_WG8_8_1_WGM8
    SolutionIndex: 102
    SolutionNameMin: Cijk_Ailk_Bljk_DB_GB_MT24x24x8_SN_PLR1_SU0_SUM0_SUS256_SNLL0_TT3_3_WG8_8_1_WGM15
    SolutionIndex: 103
    SolutionNameMin: Cijk_Ailk_Bljk_DB_GB_MT32x32x8_SN_PLR1_SU0_SUM0_SUS256_SNLL0_TT4_4_WG8_8_1_WGM15
    SolutionIndex: 104
    SolutionNameMin: Cijk_Ailk_Bljk_DB_GB_MT40x40x8_SN_PLR1_SU0_SUM0_SUS256_SNLL0_TT5_5_WG8_8_1_WGM15
    SolutionIndex: 105
    SolutionNameMin: Cijk_Ailk_Bljk_DB_GB_MT48x48x8_SN_PLR1_SU0_SUM0_SUS256_SNLL0_TT6_6_WG8_8_1_WGM15
    SolutionIndex: 106
    SolutionNameMin: Cijk_Ailk_Bljk_DB_GB_MT24x24x8_SN_PLR1_SU32_SUM0_SUS256_SNLL0_TT3_3_WG8_8_1_WGM15
    SolutionIndex: 107
    SolutionNameMin: Cijk_Ailk_Bljk_DB_GB_MT128x64x8_SN_PLR0_SU0_SUM0_SUS256_SNLL0_TT8_4_WG16_16_1_WGM1
    SolutionIndex: 108
    SolutionNameMin: Cijk_Ailk_Bljk_DB_GB_MT128x64x8_SN_PLR0_SU0_SUM0_SUS256_SNLL0_TT8_4_WG16_16_1_WGM8
    SolutionIndex: 109
    SolutionNameMin: Cijk_Ailk_Bljk_DB_GB_MT128x64x8_SN_PLR0_SU0_SUM0_SUS256_SNLL0_TT4_8_WG32_8_1_WGM8
    SolutionIndex: 110
    SolutionNameMin: Cijk_Ailk_Bljk_DB_GB_MT128x64x8_SN_PLR0_SU32_SUM0_SUS128_SNLL0_TT8_4_WG16_16_1_WGM8
    SolutionIndex: 111
    SolutionNameMin: Cijk_Ailk_Bljk_DB_GB_MT128x64x8_SN_PLR0_SU0_SUM0_SUS256_SNLL0_TT8_4_WG16_16_1_WGM15
    SolutionIndex: 112
    SolutionNameMin: Cijk_Ailk_Bljk_DB_GB_MT128x64x8_SN_PLR0_SU32_SUM0_SUS128_SNLL0_TT4_8_WG32_8_1_WGM15
    SolutionIndex: 113
    SolutionNameMin: Cijk_Ailk_Bljk_DB_GB_MT128x64x8_SN_PLR0_SU32_SUM0_SUS256_SNLL0_TT8_4_WG16_16_1_WGM15
- - - [192, 192, 1000, 32, 192, 192, 192, 32]
    - [24, 4998.0]
  - - [1536, 1536, 168, 32, 1536, 1536, 1536, 32]
    - [41, 5532.0]
  - - [1536, 32, 168, 1536, 1536, 1536, 1536, 1536]
    - [27, 6493.0]
  - - [32, 1536, 168, 32, 32, 32, 32, 32]
    - [23, 3093.0]
  - - [384, 384, 1024, 384, 384, 384, 384, 384]
    - [13, 6954.0]
  - - [1, 1, 1000, 1, 1, 1, 1, 1]
    - [62, 0.0]
  - - [2, 2, 1000, 2, 2, 2, 2, 2]
    - [62, 2.0]
  - - [3, 3, 1000, 3, 3, 3, 3, 3]
    - [67, 8.0]
  - - [4, 4, 1000, 4, 4, 4, 4, 4]
    - [65, 18.0]
  - - [5, 5, 1000, 5, 5, 5, 5, 5]
    - [63, 34.0]
  - - [6, 6, 1000, 6, 6, 6, 6, 6]
    - [64, 56.0]
  - - [7, 7, 1000, 7, 7, 7, 7, 7]
    - [66, 89.0]
  - - [8, 8, 1000, 8, 8, 8, 8, 8]
    - [72, 139.0]
  - - [9, 9, 1000, 9, 9, 9, 9, 9]
    - [65, 154.0]
  - - [10, 10, 1000, 10, 10, 10, 10, 10]
    - [82, 205.0]
  - - [11, 11, 1000, 11, 11, 11, 11, 11]
    - [80, 260.0]
  - - [12, 12, 1000, 12, 12, 12, 12, 12]
    - [84, 354.0]
  - - [13, 13, 1000, 13, 13, 13, 13, 13]
    - [74, 381.0]
  - - [14, 14, 1000, 14, 14, 14, 14, 14]
    - [76, 445.0]
  - - [15, 15, 1000, 15, 15, 15, 15, 15]
    - [81, 527.0]
  - - [16, 16, 1000, 16, 16, 16, 16, 16]
    - [71, 731.0]
  - - [17, 17, 1000, 17, 17, 17, 17, 17]
    - [75, 476.0]
  - - [18, 18, 1000, 18, 18, 18, 18, 18]
    - [69, 544.0]
  - - [19, 19, 1000, 19, 19, 19, 19, 19]
    - [75, 621.0]
  - - [20, 20, 1000, 20, 20, 20, 20, 20]
    - [70, 704.0]
  - - [21, 21, 1000, 21, 21, 21, 21, 21]
    - [77, 787.0]
  - - [22, 22, 1000, 22, 22, 22, 22, 22]
    - [78, 870.0]
  - - [23, 23, 1000, 23, 23, 23, 23, 23]
    - [77, 951.0]
  - - [24, 24, 1000, 24, 24, 24, 24, 24]
    - [75, 1144.0]
  - - [25, 25, 1000, 25, 25, 25, 25, 25]
    - [83, 1122.0]
  - - [26, 26, 1000, 26, 26, 26, 26, 26]
    - [68, 1194.0]
  - - [27, 27, 1000, 27, 27, 27, 27, 27]
    - [83, 1268.0]
  - - [28, 28, 1000, 28, 28, 28, 28, 28]
    - [78, 1400.0]
  - - [29, 29, 1000, 29, 29, 29, 29, 29]
    - [78, 1418.0]
  - - [30, 30, 1000, 30, 30, 30, 30, 30]
    - [85, 1534.0]
  - - [31, 31, 1000, 31, 31, 31, 31, 31]
    - [73, 1585.0]
  - - [32, 32, 1000, 32, 32, 32, 32, 32]
    - [79, 2028.0]
  - - [33, 33, 1000, 33, 33, 33, 33, 33]
    - [90, 1231.0]
  - - [34, 34, 1000, 34, 34, 34, 34, 34]
    - [90, 1317.0]
  - - [35, 35, 1000, 35, 35, 35, 35, 35]
    - [90, 1378.0]
  - - [36, 36, 1000, 36, 36, 36, 36, 36]
    - [104, 1539.0]
  - - [37, 37, 1000, 37, 37, 37, 37, 37]
    - [90, 1533.0]
  - - [38, 38, 1000, 38, 38, 38, 38, 38]
    - [88, 1622.0]
  - - [39, 39, 1000, 39, 39, 39, 39, 39]
    - [101, 1681.0]
  - - [40, 40, 1000, 40, 40, 40, 40, 40]
    - [99, 2145.0]
  - - [41, 41, 1000, 41, 41, 41, 41, 41]
    - [92, 1733.0]
  - - [42, 42, 1000, 42, 42, 42, 42, 42]
    - [88, 1909.0]
  - - [43, 43, 1000, 43, 43, 43, 43, 43]
    - [88, 1922.0]
  - - [44, 44, 1000, 44, 44, 44, 44, 44]
    - [93, 2223.0]
  - - [45, 45, 1000, 45, 45, 45, 45, 45]
    - [88, 2052.0]
  - - [46, 46, 1000, 46, 46, 46, 46, 46]
    - [95, 2237.0]
  - - [47, 47, 1000, 47, 47, 47, 47, 47]
    - [88, 2277.0]
  - - [48, 48, 1000, 48, 48, 48, 48, 48]
    - [93, 2941.0]
  - - [49, 49, 1000, 49, 49, 49, 49, 49]
    - [40, 2323.0]
  - - [50, 50, 1000, 50, 50, 50, 50, 50]
    - [40, 2438.0]
  - - [51, 51, 1000, 51, 51, 51, 51, 51]
    - [40, 2490.0]
  - - [52, 52, 1000, 52, 52, 52, 52, 52]
    - [47, 2683.0]
  - - [53, 53, 1000, 53, 53, 53, 53, 53]
    - [40, 2659.0]
  - - [54, 54, 1000, 54, 54, 54, 54, 54]
    - [40, 2764.0]
  - - [55, 55, 1000, 55, 55, 55, 55, 55]
    - [34, 2857.0]
  - - [56, 56, 1000, 56, 56, 56, 56, 56]
    - [58, 3311.0]
  - - [57, 57, 1000, 57, 57, 57, 57, 57]
    - [18, 3018.0]
  - - [58, 58, 1000, 58, 58, 58, 58, 58]
    - [36, 3159.0]
  - - [59, 59, 1000, 59, 59, 59, 59, 59]
    - [18, 3154.0]
  - - [60, 60, 1000, 60, 60, 60, 60, 60]
    - [20, 3401.0]
  - - [61, 61, 1000, 61, 61, 61, 61, 61]
    - [15, 3366.0]
  - - [62, 62, 1000, 62, 62, 62, 62, 62]
    - [18, 3505.0]
  - - [63, 63, 1000, 63, 63, 63, 63, 63]
    - [9, 3540.0]
  - - [64, 64, 1000, 64, 64, 64, 64, 64]
    - [36, 4317.0]
  - - [65, 65, 1000, 65, 65, 65, 65, 65]
    - [96, 2356.0]
  - - [66, 66, 1000, 66, 66, 66, 66, 66]
    - [96, 2572.0]
  - - [67, 67, 1000, 67, 67, 67, 67, 67]
    - [102, 2503.0]
  - - [68, 68, 1000, 68, 68, 68, 68, 68]
    - [106, 2914.0]
  - - [69, 69, 1000, 69, 69, 69, 69, 69]
    - [96, 2644.0]
  - - [70, 70, 1000, 70, 70, 70, 70, 70]
    - [96, 2864.0]
  - - [71, 71, 1000, 71, 71, 71, 71, 71]
    - [100, 2774.0]
  - - [72, 72, 1000, 72, 72, 72, 72, 72]
    - [88, 3766.0]
  - - [73, 73, 1000, 73, 73, 73, 73, 73]
    - [103, 2673.0]
  - - [74, 74, 1000, 74, 74, 74, 74, 74]
    - [89, 2828.0]
  - - [75, 75, 1000, 75, 75, 75, 75, 75]
    - [89, 2807.0]
  - - [76, 76, 1000, 76, 76, 76, 76, 76]
    - [97, 3095.0]
  - - [77, 77, 1000, 77, 77, 77, 77, 77]
    - [103, 2928.0]
  - - [78, 78, 1000, 78, 78, 78, 78, 78]
    - [103, 3067.0]
  - - [79, 79, 1000, 79, 79, 79, 79, 79]
    - [90, 3074.0]
  - - [80, 80, 1000, 80, 80, 80, 80, 80]
    - [89, 3670.0]
  - - [81, 81, 1000, 81, 81, 81, 81, 81]
    - [89, 3075.0]
  - - [82, 82, 1000, 82, 82, 82, 82, 82]
    - [97, 3233.0]
  - - [83, 83, 1000, 83, 83, 83, 83, 83]
    - [89, 3178.0]
  - - [84, 84, 1000, 84, 84, 84, 84, 84]
    - [97, 3583.0]
  - - [85, 85, 1000, 85, 85, 85, 85, 85]
    - [94, 3145.0]
  - - [86, 86, 1000, 86, 86, 86, 86, 86]
    - [89, 3448.0]
  - - [87, 87, 1000, 87, 87, 87, 87, 87]
    - [103, 3400.0]
  - - [88, 88, 1000, 88, 88, 88, 88, 88]
    - [97, 4395.0]
  - - [89, 89, 1000, 89, 89, 89, 89, 89]
    - [89, 3449.0]
  - - [90, 90, 1000, 90, 90, 90, 90, 90]
    - [86, 3626.0]
  - - [91, 91, 1000, 91, 91, 91, 91, 91]
    - [89, 3560.0]
  - - [92, 92, 1000, 92, 92, 92, 92, 92]
    - [97, 4088.0]
  - - [93, 93, 1000, 93, 93, 93, 93, 93]
    - [98, 3710.0]
  - - [94, 94, 1000, 94, 94, 94, 94, 94]
    - [105, 3818.0]
  - - [95, 95, 1000, 95, 95, 95, 95, 95]
    - [98, 3804.0]
  - - [96, 96, 1000, 96, 96, 96, 96, 96]
    - [89, 5187.0]
  - - [97, 97, 1000, 97, 97, 97, 97, 97]
    - [25, 3487.0]
  - - [98, 98, 1000, 98, 98, 98, 98, 98]
    - [24, 3580.0]
  - - [99, 99, 1000, 99, 99, 99, 99, 99]
    - [25, 3636.0]
  - - [100, 100, 1000, 100, 100, 100, 100, 100]
    - [25, 3763.0]
  - - [101, 101, 1000, 101, 101, 101, 101, 101]
    - [25, 3807.0]
  - - [102, 102, 1000, 102, 102, 102, 102, 102]
    - [25, 3871.0]
  - - [103, 103, 1000, 103, 103, 103, 103, 103]
    - [25, 3940.0]
  - - [104, 104, 1000, 104, 104, 104, 104, 104]
    - [25, 4153.0]
  - - [105, 105, 1000, 105, 105, 105, 105, 105]
    - [25, 4031.0]
  - - [106, 106, 1000, 106, 106, 106, 106, 106]
    - [25, 4122.0]
  - - [107, 107, 1000, 107, 107, 107, 107, 107]
    - [25, 4218.0]
  - - [108, 108, 1000, 108, 108, 108, 108, 108]
    - [41, 4356.0]
  - - [109, 109, 1000, 109, 109, 109, 109, 109]
    - [25, 4392.0]
  - - [110, 110, 1000, 110, 110, 110, 110, 110]
    - [52, 4492.0]
  - - [111, 111, 1000, 111, 111, 111, 111, 111]
    - [25, 4530.0]
  - - [112, 112, 1000, 112, 112, 112, 112, 112]
    - [25, 4772.0]
  - - [113, 113, 1000, 113, 113, 113, 113, 113]
    - [25, 4615.0]
  - - [114, 114, 1000, 114, 114, 114, 114, 114]
    - [25, 4715.0]
  - - [115, 115, 1000, 115, 115, 115, 115, 115]
    - [25, 4795.0]
  - - [116, 116, 1000, 116, 116, 116, 116, 116]
    - [52, 4989.0]
  - - [117, 117, 1000, 117, 117, 117, 117, 117]
    - [25, 4983.0]
  - - [118, 118, 1000, 118, 118, 118, 118, 118]
    - [25, 5086.0]
  - - [119, 119, 1000, 119, 119, 119, 119, 119]
    - [25, 5110.0]
  - - [120, 120, 1000, 120, 120, 120, 120, 120]
    - [25, 5437.0]
  - - [121, 121, 1000, 121, 121, 121, 121, 121]
    - [51, 5198.0]
  - - [122, 122, 1000, 122, 122, 122, 122, 122]
    - [51, 5311.0]
  - - [123, 123, 1000, 123, 123, 123, 123, 123]
    - [51, 5345.0]
  - - [124, 124, 1000, 124, 124, 124, 124, 124]
    - [25, 5574.0]
  - - [125, 125, 1000, 125, 125, 125, 125, 125]
    - [25, 5483.0]
  - - [126, 126, 1000, 126, 126, 126, 126, 126]
    - [52, 5601.0]
  - - [127, 127, 1000, 127, 127, 127, 127, 127]
    - [24, 5525.0]
  - - [128, 128, 1000, 128, 128, 128, 128, 128]
    - [51, 6308.0]
  - - [129, 129, 1000, 129, 129, 129, 129, 129]
    - [91, 3888.0]
  - - [130, 130, 1000, 130, 130, 130, 130, 130]
    - [91, 3979.0]
  - - [131, 131, 1000, 131, 131, 131, 131, 131]
    - [91, 4035.0]
  - - [132, 132, 1000, 132, 132, 132, 132, 132]
    - [98, 4171.0]
  - - [133, 133, 1000, 133, 133, 133, 133, 133]
    - [91, 4165.0]
  - - [134, 134, 1000, 134, 134, 134, 134, 134]
    - [91, 4247.0]
  - - [135, 135, 1000, 135, 135, 135, 135, 135]
    - [98, 4279.0]
  - - [136, 136, 1000, 136, 136, 136, 136, 136]
    - [91, 4637.0]
  - - [137, 137, 1000, 137, 137, 137, 137, 137]
    - [91, 4427.0]
  - - [138, 138, 1000, 138, 138, 138, 138, 138]
    - [91, 4512.0]
  - - [139, 139, 1000, 139, 139, 139, 139, 139]
    - [105, 4542.0]
  - - [140, 140, 1000, 140, 140, 140, 140, 140]
    - [91, 4699.0]
  - - [141, 141, 1000, 141, 141, 141, 141, 141]
    - [105, 4666.0]
  - - [142, 142, 1000, 142, 142, 142, 142, 142]
    - [98, 4764.0]
  - - [143, 143, 1000, 143, 143, 143, 143, 143]
    - [98, 4778.0]
  - - [144, 144, 1000, 144, 144, 144, 144, 144]
    - [91, 5323.0]
  - - [145, 145, 1000, 145, 145, 145, 145, 145]
    - [86, 3790.0]
  - - [146, 146, 1000, 146, 146, 146, 146, 146]
    - [89, 3966.0]
  - - [147, 147, 1000, 147, 147, 147, 147, 147]
    - [25, 3848.0]
  - - [148, 148, 1000, 148, 148, 148, 148, 148]
    - [97, 4525.0]
  - - [149, 149, 1000, 149, 149, 149, 149, 149]
    - [103, 3985.0]
  - - [150, 150, 1000, 150, 150, 150, 150, 150]
    - [87, 4219.0]
  - - [32, 32, 8, 32, 32, 32, 32, 32]
    - [5, 21.0]
  - - [32, 32, 8, 64, 32, 32, 32, 64]
    - [20, 34.0]
  - - [32, 32, 8, 128, 32, 32, 32, 128]
    - [1, 47.0]
  - - [32, 32, 8, 256, 32, 32, 32, 256]
    - [1, 59.0]
  - - [32, 32, 8, 512, 32, 32, 32, 512]
    - [11, 68.0]
  - - [32, 32, 8, 1024, 32, 32, 32, 1024]
    - [11, 74.0]
  - - [32, 32, 8, 2048, 32, 32, 32, 2048]
    - [18, 77.0]
  - - [32, 64, 8, 32, 32, 32, 32, 32]
    - [17, 43.0]
  - - [32, 64, 8, 64, 32, 32, 32, 64]
    - [1, 67.0]
  - - [32, 64, 8, 128, 32, 32, 32, 128]
    - [20, 92.0]
  - - [32, 64, 8, 256, 32, 32, 32, 256]
    - [12, 115.0]
  - - [32, 64, 8, 512, 32, 32, 32, 512]
    - [12, 131.0]
  - - [32, 64, 8, 1024, 32, 32, 32, 1024]
    - [4, 142.0]
  - - [32, 64, 8, 2048, 32, 32, 32, 2048]
    - [4, 150.0]
  - - [32, 128, 8, 32, 32, 32, 32, 32]
    - [0, 96.0]
  - - [32, 128, 8, 64, 32, 32, 32, 64]
    - [21, 139.0]
  - - [32, 128, 8, 128, 32, 32, 32, 128]
    - [1, 185.0]
  - - [32, 128, 8, 256, 32, 32, 32, 256]
    - [16, 234.0]
  - - [32, 128, 8, 512, 32, 32, 32, 512]
    - [1, 267.0]
  - - [32, 128, 8, 1024, 32, 32, 32, 1024]
    - [24, 289.0]
  - - [32, 128, 8, 2048, 32, 32, 32, 2048]
    - [4, 300.0]
  - - [32, 256, 8, 32, 32, 32, 32, 32]
    - [0, 193.0]
  - - [32, 256, 8, 64, 32, 32, 32, 64]
    - [0, 283.0]
  - - [32, 256, 8, 128, 32, 32, 32, 128]
    - [18, 372.0]
  - - [32, 256, 8, 256, 32, 32, 32, 256]
    - [11, 476.0]
  - - [32, 256, 8, 512, 32, 32, 32, 512]
    - [1, 536.0]
  - - [32, 256, 8, 1024, 32, 32, 32, 1024]
    - [40, 581.0]
  - - [32, 256, 8, 2048, 32, 32, 32, 2048]
    - [18, 601.0]
  - - [32, 512, 8, 32, 32, 32, 32, 32]
    - [53, 448.0]
  - - [32, 512, 8, 64, 32, 32, 32, 64]
    - [26, 596.0]
  - - [32, 512, 8, 128, 32, 32, 32, 128]
    - [1, 744.0]
  - - [32, 512, 8, 256, 32, 32, 32, 256]
    - [11, 932.0]
  - - [32, 512, 8, 512, 32, 32, 32, 512]
    - [1, 1081.0]
  - - [32, 512, 8, 1024, 32, 32, 32, 1024]
    - [40, 1159.0]
  - - [32, 512, 8, 2048, 32, 32, 32, 2048]
    - [40, 1207.0]
  - - [32, 1024, 8, 32, 32, 32, 32, 32]
    - [58, 874.0]
  - - [32, 1024, 8, 64, 32, 32, 32, 64]
    - [55, 1192.0]
  - - [32, 1024, 8, 128, 32, 32, 32, 128]
    - [0, 1456.0]
  - - [32, 1024, 8, 256, 32, 32, 32, 256]
    - [10, 1698.0]
  - - [32, 1024, 8, 512, 32, 32, 32, 512]
    - [39, 1868.0]
  - - [32, 1024, 8, 1024, 32, 32, 32, 1024]
    - [39, 1968.0]
  - - [32, 1024, 8, 2048, 32, 32, 32, 2048]
    - [28, 2072.0]
  - - [32, 2048, 8, 32, 32, 32, 32, 32]
    - [49, 1691.0]
  - - [32, 2048, 8, 64, 32, 32, 32, 64]
    - [45, 2108.0]
  - - [32, 2048, 8, 128, 32, 32, 32, 128]
    - [29, 2497.0]
  - - [32, 2048, 8, 256, 32, 32, 32, 256]
    - [33, 2715.0]
  - - [32, 2048, 8, 512, 32, 32, 32, 512]
    - [23, 2836.0]
  - - [32, 2048, 8, 1024, 32, 32, 32, 1024]
    - [54, 2913.0]
  - - [32, 2048, 8, 2048, 32, 32, 32, 2048]
    - [45, 2932.0]
  - - [64, 32, 8, 32, 64, 64, 64, 32]
    - [12, 43.0]
  - - [64, 32, 8, 64, 64, 64, 64, 64]
    - [0, 67.0]
  - - [64, 32, 8, 128, 64, 64, 64, 128]
    - [1, 94.0]
  - - [64, 32, 8, 256, 64, 64, 64, 256]
    - [18, 120.0]
  - - [64, 32, 8, 512, 64, 64, 64, 512]
    - [11, 136.0]
  - - [64, 32, 8, 1024, 64, 64, 64, 1024]
    - [1, 146.0]
  - - [64, 32, 8, 2048, 64, 64, 64, 2048]
    - [11, 153.0]
  - - [64, 64, 8, 32, 64, 64, 64, 32]
    - [1, 97.0]
  - - [64, 64, 8, 64, 64, 64, 64, 64]
    - [15, 142.0]
  - - [64, 64, 8, 128, 64, 64, 64, 128]
    - [20, 190.0]
  - - [64, 64, 8, 256, 64, 64, 64, 256]
    - [12, 229.0]
  - - [64, 64, 8, 512, 64, 64, 64, 512]
    - [19, 263.0]
  - - [64, 64, 8, 1024, 64, 64, 64, 1024]
    - [4, 286.0]
  - - [64, 64, 8, 2048, 64, 64, 64, 2048]
    - [4, 300.0]
  - - [64, 128, 8, 32, 64, 64, 64, 32]
    - [0, 196.0]
  - - [64, 128, 8, 64, 64, 64, 64, 64]
    - [7, 291.0]
  - - [64, 128, 8, 128, 64, 64, 64, 128]
    - [1, 394.0]
  - - [64, 128, 8, 256, 64, 64, 64, 256]
    - [40, 476.0]
  - - [64, 128, 8, 512, 64, 64, 64, 512]
    - [34, 538.0]
  - - [64, 128, 8, 1024, 64, 64, 64, 1024]
    - [4, 571.0]
  - - [64, 128, 8, 2048, 64, 64, 64, 2048]
    - [4, 601.0]
  - - [64, 256, 8, 32, 64, 64, 64, 32]
    - [0, 388.0]
  - - [64, 256, 8, 64, 64, 64, 64, 64]
    - [1, 592.0]
  - - [64, 256, 8, 128, 64, 64, 64, 128]
    - [15, 780.0]
  - - [64, 256, 8, 256, 64, 64, 64, 256]
    - [55, 949.0]
  - - [64, 256, 8, 512, 64, 64, 64, 512]
    - [40, 1066.0]
  - - [64, 256, 8, 1024, 64, 64, 64, 1024]
    - [4, 1137.0]
  - - [64, 256, 8, 2048, 64, 64, 64, 2048]
    - [4, 1199.0]
  - - [64, 512, 8, 32, 64, 64, 64, 32]
    - [26, 896.0]
  - - [64, 512, 8, 64, 64, 64, 64, 64]
    - [31, 1185.0]
  - - [64, 512, 8, 128, 64, 64, 64, 128]
    - [1, 1565.0]
  - - [64, 512, 8, 256, 64, 64, 64, 256]
    - [11, 1920.0]
  - - [64, 512, 8, 512, 64, 64, 64, 512]
    - [40, 2143.0]
  - - [64, 512, 8, 1024, 64, 64, 64, 1024]
    - [40, 2264.0]
  - - [64, 512, 8, 2048, 64, 64, 64, 2048]
    - [3, 2356.0]
  - - [64, 1024, 8, 32, 64, 64, 64, 32]
    - [40, 1889.0]
  - - [64, 1024, 8, 64, 64, 64, 64, 64]
    - [24, 2439.0]
  - - [64, 1024, 8, 128, 64, 64, 64, 128]
    - [43, 2943.0]
  - - [64, 1024, 8, 256, 64, 64, 64, 256]
    - [40, 3208.0]
  - - [64, 1024, 8, 512, 64, 64, 64, 512]
    - [8, 3396.0]
  - - [64, 1024, 8, 1024, 64, 64, 64, 1024]
    - [43, 3504.0]
  - - [64, 1024, 8, 2048, 64, 64, 64, 2048]
    - [43, 3540.0]
  - - [64, 2048, 8, 32, 64, 64, 64, 32]
    - [57, 2724.0]
  - - [64, 2048, 8, 64, 64, 64, 64, 64]
    - [25, 3481.0]
  - - [64, 2048, 8, 128, 64, 64, 64, 128]
    - [40, 4043.0]
  - - [64, 2048, 8, 256, 64, 64, 64, 256]
    - [43, 4375.0]
  - - [64, 2048, 8, 512, 64, 64, 64, 512]
    - [47, 4541.0]
  - - [64, 2048, 8, 1024, 64, 64, 64, 1024]
    - [47, 4635.0]
  - - [64, 2048, 8, 2048, 64, 64, 64, 2048]
    - [47, 4680.0]
  - - [128, 32, 8, 32, 128, 128, 128, 32]
    - [12, 93.0]
  - - [128, 32, 8, 64, 128, 128, 128, 64]
    - [6, 142.0]
  - - [128, 32, 8, 128, 128, 128, 128, 128]
    - [19, 193.0]
  - - [128, 32, 8, 256, 128, 128, 128, 256]
    - [18, 238.0]
  - - [128, 32, 8, 512, 128, 128, 128, 512]
    - [1, 271.0]
  - - [128, 32, 8, 1024, 128, 128, 128, 1024]
    - [11, 293.0]
  - - [128, 32, 8, 2048, 128, 128, 128, 2048]
    - [11, 305.0]
  - - [128, 64, 8, 32, 128, 128, 128, 32]
    - [12, 189.0]
  - - [128, 64, 8, 64, 128, 128, 128, 64]
    - [12, 293.0]
  - - [128, 64, 8, 128, 128, 128, 128, 128]
    - [12, 393.0]
  - - [128, 64, 8, 256, 128, 128, 128, 256]
    - [12, 473.0]
  - - [128, 64, 8, 512, 128, 128, 128, 512]
    - [26, 534.0]
  - - [128, 64, 8, 1024, 128, 128, 128, 1024]
    - [14, 577.0]
  - - [128, 64, 8, 2048, 128, 128, 128, 2048]
    - [4, 606.0]
  - - [128, 128, 8, 32, 128, 128, 128, 32]
    - [0, 388.0]
  - - [128, 128, 8, 64, 128, 128, 128, 64]
    - [12, 579.0]
  - - [128, 128, 8, 128, 128, 128, 128, 128]
    - [43, 794.0]
  - - [128, 128, 8, 256, 128, 128, 128, 256]
    - [12, 958.0]
  - - [128, 128, 8, 512, 128, 128, 128, 512]
    - [12, 1075.0]
  - - [128, 128, 8, 1024, 128, 128, 128, 1024]
    - [4, 1152.0]
  - - [128, 128, 8, 2048, 128, 128, 128, 2048]
    - [4, 1209.0]
  - - [128, 256, 8, 32, 128, 128, 128, 32]
    - [6, 765.0]
  - - [128, 256, 8, 64, 128, 128, 128, 64]
    - [15, 1165.0]
  - - [128, 256, 8, 128, 128, 128, 128, 128]
    - [11, 1589.0]
  - - [128, 256, 8, 256, 128, 128, 128, 256]
    - [2, 1902.0]
  - - [128, 256, 8, 512, 128, 128, 128, 512]
    - [12, 2145.0]
  - - [128, 256, 8, 1024, 128, 128, 128, 1024]
    - [4, 2305.0]
  - - [128, 256, 8, 2048, 128, 128, 128, 2048]
    - [4, 2424.0]
  - - [128, 512, 8, 32, 128, 128, 128, 32]
    - [51, 1907.0]
  - - [128, 512, 8, 64, 128, 128, 128, 64]
    - [24, 2497.0]
  - - [128, 512, 8, 128, 128, 128, 128, 128]
    - [58, 2964.0]
  - - [128, 512, 8, 256, 128, 128, 128, 256]
    - [34, 3239.0]
  - - [128, 512, 8, 512, 128, 128, 128, 512]
    - [24, 3424.0]
  - - [128, 512, 8, 1024, 128, 128, 128, 1024]
    - [24, 3497.0]
  - - [128, 512, 8, 2048, 128, 128, 128, 2048]
    - [40, 3545.0]
  - - [128, 1024, 8, 32, 128, 128, 128, 32]
    - [25, 2759.0]
  - - [128, 1024, 8, 64, 128, 128, 128, 64]
    - [52, 3525.0]
  - - [128, 1024, 8, 128, 128, 128, 128, 128]
    - [30, 4043.0]
  - - [128, 1024, 8, 256, 128, 128, 128, 256]
    - [47, 4352.0]
  - - [128, 1024, 8, 512, 128, 128, 128, 512]
    - [43, 4534.0]
  - - [128, 1024, 8, 1024, 128, 128, 128, 1024]
    - [30, 4628.0]
  - - [128, 1024, 8, 2048, 128, 128, 128, 2048]
    - [34, 4679.0]
  - - [128, 2048, 8, 32, 128, 128, 128, 32]
    - [47, 3410.0]
  - - [128, 2048, 8, 64, 128, 128, 128, 64]
    - [24, 4438.0]
  - - [128, 2048, 8, 128, 128, 128, 128, 128]
    - [51, 5131.0]
  - - [128, 2048, 8, 256, 128, 128, 128, 256]
    - [51, 5447.0]
  - - [128, 2048, 8, 512, 128, 128, 128, 512]
    - [40, 5613.0]
  - - [128, 2048, 8, 1024, 128, 128, 128, 1024]
    - [55, 5702.0]
  - - [128, 2048, 8, 2048, 128, 128, 128, 2048]
    - [43, 5738.0]
  - - [256, 32, 8, 32, 256, 256, 256, 32]
    - [2, 186.0]
  - - [256, 32, 8, 64, 256, 256, 256, 64]
    - [12, 291.0]
  - - [256, 32, 8, 128, 256, 256, 256, 128]
    - [26, 387.0]
  - - [256, 32, 8, 256, 256, 256, 256, 256]
    - [12, 472.0]
  - - [256, 32, 8, 512, 256, 256, 256, 512]
    - [18, 537.0]
  - - [256, 32, 8, 1024, 256, 256, 256, 1024]
    - [18, 588.0]
  - - [256, 32, 8, 2048, 256, 256, 256, 2048]
    - [11, 610.0]
  - - [256, 64, 8, 32, 256, 256, 256, 32]
    - [12, 391.0]
  - - [256, 64, 8, 64, 256, 256, 256, 64]
    - [2, 579.0]
  - - [256, 64, 8, 128, 256, 256, 256, 128]
    - [2, 777.0]
  - - [256, 64, 8, 256, 256, 256, 256, 256]
    - [19, 949.0]
  - - [256, 64, 8, 512, 256, 256, 256, 512]
    - [22, 1063.0]
  - - [256, 64, 8, 1024, 256, 256, 256, 1024]
    - [14, 1154.0]
  - - [256, 64, 8, 2048, 256, 256, 256, 2048]
    - [14, 1210.0]
  - - [256, 128, 8, 32, 256, 256, 256, 32]
    - [19, 749.0]
  - - [256, 128, 8, 64, 256, 256, 256, 64]
    - [6, 1134.0]
  - - [256, 128, 8, 128, 256, 256, 256, 128]
    - [12, 1559.0]
  - - [256, 128, 8, 256, 256, 256, 256, 256]
    - [12, 1894.0]
  - - [256, 128, 8, 512, 256, 256, 256, 512]
    - [19, 2135.0]
  - - [256, 128, 8, 1024, 256, 256, 256, 1024]
    - [4, 2313.0]
  - - [256, 128, 8, 2048, 256, 256, 256, 2048]
    - [4, 2421.0]
  - - [256, 256, 8, 32, 256, 256, 256, 32]
    - [26, 1889.0]
  - - [256, 256, 8, 64, 256, 256, 256, 64]
    - [24, 2482.0]
  - - [256, 256, 8, 128, 256, 256, 256, 128]
    - [30, 2923.0]
  - - [256, 256, 8, 256, 256, 256, 256, 256]
    - [24, 3233.0]
  - - [256, 256, 8, 512, 256, 256, 256, 512]
    - [30, 3424.0]
  - - [256, 256, 8, 1024, 256, 256, 256, 1024]
    - [43, 3486.0]
  - - [256, 256, 8, 2048, 256, 256, 256, 2048]
    - [43, 3533.0]
  - - [256, 512, 8, 32, 256, 256, 256, 32]
    - [25, 2573.0]
  - - [256, 512, 8, 64, 256, 256, 256, 64]
    - [25, 3495.0]
  - - [256, 512, 8, 128, 256, 256, 256, 128]
    - [40, 3985.0]
  - - [256, 512, 8, 256, 256, 256, 256, 256]
    - [47, 4346.0]
  - - [256, 512, 8, 512, 256, 256, 256, 512]
    - [55, 4534.0]
  - - [256, 512, 8, 1024, 256, 256, 256, 1024]
    - [47, 4630.0]
  - - [256, 512, 8, 2048, 256, 256, 256, 2048]
    - [58, 4675.0]
  - - [256, 1024, 8, 32, 256, 256, 256, 32]
    - [47, 3214.0]
  - - [256, 1024, 8, 64, 256, 256, 256, 64]
    - [47, 4358.0]
  - - [256, 1024, 8, 128, 256, 256, 256, 128]
    - [40, 5038.0]
  - - [256, 1024, 8, 256, 256, 256, 256, 256]
    - [40, 5421.0]
  - - [256, 1024, 8, 512, 256, 256, 256, 512]
    - [40, 5604.0]
  - - [256, 1024, 8, 1024, 256, 256, 256, 1024]
    - [40, 5687.0]
  - - [256, 1024, 8, 2048, 256, 256, 256, 2048]
    - [40, 5725.0]
  - - [256, 2048, 8, 32, 256, 256, 256, 32]
    - [40, 3875.0]
  - - [256, 2048, 8, 64, 256, 256, 256, 64]
    - [47, 5139.0]
  - - [256, 2048, 8, 128, 256, 256, 256, 128]
    - [40, 5760.0]
  - - [256, 2048, 8, 256, 256, 256, 256, 256]
    - [40, 6104.0]
  - - [256, 2048, 8, 512, 256, 256, 256, 512]
    - [40, 6297.0]
  - - [256, 2048, 8, 1024, 256, 256, 256, 1024]
    - [40, 6366.0]
  - - [256, 2048, 8, 2048, 256, 256, 256, 2048]
    - [40, 6410.0]
  - - [512, 32, 8, 32, 512, 512, 512, 32]
    - [29, 430.0]
  - - [512, 32, 8, 64, 512, 512, 512, 64]
    - [12, 570.0]
  - - [512, 32, 8, 128, 512, 512, 512, 128]
    - [2, 765.0]
  - - [512, 32, 8, 256, 512, 512, 512, 256]
    - [12, 938.0]
  - - [512, 32, 8, 512, 512, 512, 512, 512]
    - [18, 1071.0]
  - - [512, 32, 8, 1024, 512, 512, 512, 1024]
    - [1, 1167.0]
  - - [512, 32, 8, 2048, 512, 512, 512, 2048]
    - [11, 1219.0]
  - - [512, 64, 8, 32, 512, 512, 512, 32]
    - [23, 771.0]
  - - [512, 64, 8, 64, 512, 512, 512, 64]
    - [12, 1134.0]
  - - [512, 64, 8, 128, 512, 512, 512, 128]
    - [12, 1542.0]
  - - [512, 64, 8, 256, 512, 512, 512, 256]
    - [26, 1907.0]
  - - [512, 64, 8, 512, 512, 512, 512, 512]
    - [53, 2137.0]
  - - [512, 64, 8, 1024, 512, 512, 512, 1024]
    - [4, 2303.0]
  - - [512, 64, 8, 2048, 512, 512, 512, 2048]
    - [4, 2412.0]
  - - [512, 128, 8, 32, 512, 512, 512, 32]
    - [26, 1872.0]
  - - [512, 128, 8, 64, 512, 512, 512, 64]
    - [24, 2482.0]
  - - [512, 128, 8, 128, 512, 512, 512, 128]
    - [30, 2964.0]
  - - [512, 128, 8, 256, 512, 512, 512, 256]
    - [30, 3251.0]
  - - [512, 128, 8, 512, 512, 512, 512, 512]
    - [24, 3376.0]
  - - [512, 128, 8, 1024, 512, 512, 512, 1024]
    - [58, 3495.0]
  - - [512, 128, 8, 2048, 512, 512, 512, 2048]
    - [40, 3513.0]
  - - [512, 256, 8, 32, 512, 512, 512, 32]
    - [60, 2655.0]
  - - [512, 256, 8, 64, 512, 512, 512, 64]
    - [44, 3539.0]
  - - [512, 256, 8, 128, 512, 512, 512, 128]
    - [43, 4014.0]
  - - [512, 256, 8, 256, 512, 512, 512, 256]
    - [43, 4346.0]
  - - [512, 256, 8, 512, 512, 512, 512, 512]
    - [58, 4522.0]
  - - [512, 256, 8, 1024, 512, 512, 512, 1024]
    - [55, 4612.0]
  - - [512, 256, 8, 2048, 512, 512, 512, 2048]
    - [58, 4662.0]
  - - [512, 512, 8, 32, 512, 512, 512, 32]
    - [24, 3329.0]
  - - [512, 512, 8, 64, 512, 512, 512, 64]
    - [56, 4415.0]
  - - [512, 512, 8, 128, 512, 512, 512, 128]
    - [24, 5092.0]
  - - [512, 512, 8, 256, 512, 512, 512, 256]
    - [40, 5434.0]
  - - [512, 512, 8, 512, 512, 512, 512, 512]
    - [40, 5611.0]
  - - [512, 512, 8, 1024, 512, 512, 512, 1024]
    - [55, 5685.0]
  - - [512, 512, 8, 2048, 512, 512, 512, 2048]
    - [11, 5720.0]
  - - [512, 1024, 8, 32, 512, 512, 512, 32]
    - [51, 3985.0]
  - - [512, 1024, 8, 64, 512, 512, 512, 64]
    - [40, 5162.0]
  - - [512, 1024, 8, 128, 512, 512, 512, 128]
    - [40, 5836.0]
  - - [512, 1024, 8, 256, 512, 512, 512, 256]
    - [40, 6115.0]
  - - [512, 1024, 8, 512, 512, 512, 512, 512]
    - [40, 6300.0]
  - - [512, 1024, 8, 1024, 512, 512, 512, 1024]
    - [40, 6373.0]
  - - [512, 1024, 8, 2048, 512, 512, 512, 2048]
    - [43, 6414.0]
  - - [512, 2048, 8, 32, 512, 512, 512, 32]
    - [50, 4450.0]
  - - [512, 2048, 8, 64, 512, 512, 512, 64]
    - [50, 5606.0]
  - - [512, 2048, 8, 128, 512, 512, 512, 128]
    - [40, 6123.0]
  - - [512, 2048, 8, 256, 512, 512, 512, 256]
    - [43, 6315.0]
  - - [512, 2048, 8, 512, 512, 512, 512, 512]
    - [40, 6411.0]
  - - [512, 2048, 8, 1024, 512, 512, 512, 1024]
    - [40, 6466.0]
  - - [512, 2048, 8, 2048, 512, 512, 512, 2048]
    - [40, 6489.0]
  - - [1024, 32, 8, 32, 1024, 1024, 1024, 32]
    - [24, 881.0]
  - - [1024, 32, 8, 64, 1024, 1024, 1024, 64]
    - [55, 1205.0]
  - - [1024, 32, 8, 128, 1024, 1024, 1024, 128]
    - [12, 1542.0]
  - - [1024, 32, 8, 256, 1024, 1024, 1024, 256]
    - [2, 1881.0]
  - - [1024, 32, 8, 512, 1024, 1024, 1024, 512]
    - [26, 2124.0]
  - - [1024, 32, 8, 1024, 1024, 1024, 1024, 1024]
    - [14, 2295.0]
  - - [1024, 32, 8, 2048, 1024, 1024, 1024, 2048]
    - [14, 2411.0]
  - - [1024, 64, 8, 32, 1024, 1024, 1024, 32]
    - [35, 1856.0]
  - - [1024, 64, 8, 64, 1024, 1024, 1024, 64]
    - [40, 2424.0]
  - - [1024, 64, 8, 128, 1024, 1024, 1024, 128]
    - [40, 2853.0]
  - - [1024, 64, 8, 256, 1024, 1024, 1024, 256]
    - [51, 3171.0]
  - - [1024, 64, 8, 512, 1024, 1024, 1024, 512]
    - [51, 3335.0]
  - - [1024, 64, 8, 1024, 1024, 1024, 1024, 1024]
    - [24, 3427.0]
  - - [1024, 64, 8, 2048, 1024, 1024, 1024, 2048]
    - [40, 3472.0]
  - - [1024, 128, 8, 32, 1024, 1024, 1024, 32]
    - [56, 2672.0]
  - - [1024, 128, 8, 64, 1024, 1024, 1024, 64]
    - [60, 3510.0]
  - - [1024, 128, 8, 128, 1024, 1024, 1024, 128]
    - [47, 3995.0]
  - - [1024, 128, 8, 256, 1024, 1024, 1024, 256]
    - [40, 4318.0]
  - - [1024, 128, 8, 512, 1024, 1024, 1024, 512]
    - [58, 4495.0]
  - - [1024, 128, 8, 1024, 1024, 1024, 1024, 1024]
    - [47, 4585.0]
  - - [1024, 128, 8, 2048, 1024, 1024, 1024, 2048]
    - [58, 4644.0]
  - - [1024, 256, 8, 32, 1024, 1024, 1024, 32]
    - [40, 3383.0]
  - - [1024, 256, 8, 64, 1024, 1024, 1024, 64]
    - [24, 4427.0]
  - - [1024, 256, 8, 128, 1024, 1024, 1024, 128]
    - [47, 5076.0]
  - - [1024, 256, 8, 256, 1024, 1024, 1024, 256]
    - [24, 5412.0]
  - - [1024, 256, 8, 512, 1024, 1024, 1024, 512]
    - [40, 5574.0]
  - - [1024, 256, 8, 1024, 1024, 1024, 1024, 1024]
    - [51, 5658.0]
  - - [1024, 256, 8, 2048, 1024, 1024, 1024, 2048]
    - [40, 5700.0]
  - - [1024, 512, 8, 32, 1024, 1024, 1024, 32]
    - [51, 4072.0]
  - - [1024, 512, 8, 64, 1024, 1024, 1024, 64]
    - [40, 5178.0]
  - - [1024, 512, 8, 128, 1024, 1024, 1024, 128]
    - [51, 5836.0]
  - - [1024, 512, 8, 256, 1024, 1024, 1024, 256]
    - [40, 6131.0]
  - - [1024, 512, 8, 512, 1024, 1024, 1024, 512]
    - [40, 6275.0]
  - - [1024, 512, 8, 1024, 1024, 1024, 1024, 1024]
    - [40, 6358.0]
  - - [1024, 512, 8, 2048, 1024, 1024, 1024, 2048]
    - [40, 6395.0]
  - - [1024, 1024, 8, 32, 1024, 1024, 1024, 32]
    - [36, 4480.0]
  - - [1024, 1024, 8, 64, 1024, 1024, 1024, 64]
    - [25, 5616.0]
  - - [1024, 1024, 8, 128, 1024, 1024, 1024, 128]
    - [24, 6126.0]
  - - [1024, 1024, 8, 256, 1024, 1024, 1024, 256]
    - [47, 6324.0]
  - - [1024, 1024, 8, 512, 1024, 1024, 1024, 512]
    - [40, 6404.0]
  - - [1024, 1024, 8, 1024, 1024, 1024, 1024, 1024]
    - [40, 6462.0]
  - - [1024, 1024, 8, 2048, 1024, 1024, 1024, 2048]
    - [40, 6483.0]
  - - [1024, 2048, 8, 32, 1024, 1024, 1024, 32]
    - [40, 4800.0]
  - - [1024, 2048, 8, 64, 1024, 1024, 1024, 64]
    - [41, 5997.0]
  - - [1024, 2048, 8, 128, 1024, 1024, 1024, 128]
    - [24, 6405.0]
  - - [1024, 2048, 8, 256, 1024, 1024, 1024, 256]
    - [109, 6587.0]
  - - [1024, 2048, 8, 512, 1024, 1024, 1024, 512]
    - [108, 6880.0]
  - - [1024, 2048, 8, 1024, 1024, 1024, 1024, 1024]
    - [111, 7000.0]
  - - [1024, 2048, 8, 2048, 1024, 1024, 1024, 2048]
    - [110, 7076.0]
  - - [2048, 32, 8, 32, 2048, 2048, 2048, 32]
    - [26, 1777.0]
  - - [2048, 32, 8, 64, 2048, 2048, 2048, 64]
    - [38, 2317.0]
  - - [2048, 32, 8, 128, 2048, 2048, 2048, 128]
    - [38, 2724.0]
  - - [2048, 32, 8, 256, 2048, 2048, 2048, 256]
    - [42, 3023.0]
  - - [2048, 32, 8, 512, 2048, 2048, 2048, 512]
    - [61, 3196.0]
  - - [2048, 32, 8, 1024, 2048, 2048, 2048, 1024]
    - [61, 3299.0]
  - - [2048, 32, 8, 2048, 2048, 2048, 2048, 2048]
    - [48, 3347.0]
  - - [2048, 64, 8, 32, 2048, 2048, 2048, 32]
    - [41, 2638.0]
  - - [2048, 64, 8, 64, 2048, 2048, 2048, 64]
    - [37, 3424.0]
  - - [2048, 64, 8, 128, 2048, 2048, 2048, 128]
    - [40, 3976.0]
  - - [2048, 64, 8, 256, 2048, 2048, 2048, 256]
    - [30, 4291.0]
  - - [2048, 64, 8, 512, 2048, 2048, 2048, 512]
    - [47, 4468.0]
  - - [2048, 64, 8, 1024, 2048, 2048, 2048, 1024]
    - [46, 4565.0]
  - - [2048, 64, 8, 2048, 2048, 2048, 2048, 2048]
    - [30, 4619.0]
  - - [2048, 128, 8, 32, 2048, 2048, 2048, 32]
    - [55, 3355.0]
  - - [2048, 128, 8, 64, 2048, 2048, 2048, 64]
    - [40, 4438.0]
  - - [2048, 128, 8, 128, 2048, 2048, 2048, 128]
    - [40, 5099.0]
  - - [2048, 128, 8, 256, 2048, 2048, 2048, 256]
    - [51, 5390.0]
  - - [2048, 128, 8, 512, 2048, 2048, 2048, 512]
    - [40, 5558.0]
  - - [2048, 128, 8, 1024, 2048, 2048, 2048, 1024]
    - [51, 5636.0]
  - - [2048, 128, 8, 2048, 2048, 2048, 2048, 2048]
    - [43, 5679.0]
  - - [2048, 256, 8, 32, 2048, 2048, 2048, 32]
    - [40, 4062.0]
  - - [2048, 256, 8, 64, 2048, 2048, 2048, 64]
    - [47, 5210.0]
  - - [2048, 256, 8, 128, 2048, 2048, 2048, 128]
    - [59, 5836.0]
  - - [2048, 256, 8, 256, 2048, 2048, 2048, 256]
    - [51, 6115.0]
  - - [2048, 256, 8, 512, 2048, 2048, 2048, 512]
    - [40, 6262.0]
  - - [2048, 256, 8, 1024, 2048, 2048, 2048, 1024]
    - [40, 6340.0]
  - - [2048, 256, 8, 2048, 2048, 2048, 2048, 2048]
    - [51, 6381.0]
  - - [2048, 512, 8, 32, 2048, 2048, 2048, 32]
    - [32, 4547.0]
  - - [2048, 512, 8, 64, 2048, 2048, 2048, 64]
    - [30, 5635.0]
  - - [2048, 512, 8, 128, 2048, 2048, 2048, 128]
    - [24, 6092.0]
  - - [2048, 512, 8, 256, 2048, 2048, 2048, 256]
    - [43, 6322.0]
  - - [2048, 512, 8, 512, 2048, 2048, 2048, 512]
    - [47, 6419.0]
  - - [2048, 512, 8, 1024, 2048, 2048, 2048, 1024]
    - [40, 6464.0]
  - - [2048, 512, 8, 2048, 2048, 2048, 2048, 2048]
    - [40, 6484.0]
  - - [2048, 1024, 8, 32, 2048, 2048, 2048, 32]
    - [24, 4913.0]
  - - [2048, 1024, 8, 64, 2048, 2048, 2048, 64]
    - [25, 6076.0]
  - - [2048, 1024, 8, 128, 2048, 2048, 2048, 128]
    - [25, 6417.0]
  - - [2048, 1024, 8, 256, 2048, 2048, 2048, 256]
    - [107, 6582.0]
  - - [2048, 1024, 8, 512, 2048, 2048, 2048, 512]
    - [108, 6875.0]
  - - [2048, 1024, 8, 1024, 2048, 2048, 2048, 1024]
    - [108, 7001.0]
  - - [2048, 1024, 8, 2048, 2048, 2048, 2048, 2048]
    - [113, 7080.0]
  - - [2048, 2048, 8, 32, 2048, 2048, 2048, 32]
    - [25, 5192.0]
  - - [2048, 2048, 8, 64, 2048, 2048, 2048, 64]
    - [25, 6334.0]
  - - [2048, 2048, 8, 128, 2048, 2048, 2048, 128]
    - [25, 6596.0]
  - - [2048, 2048, 8, 256, 2048, 2048, 2048, 256]
    - [109, 6741.0]
  - - [2048, 2048, 8, 512, 2048, 2048, 2048, 512]
    - [109, 6981.0]
  - - [2048, 2048, 8, 1024, 2048, 2048, 2048, 1024]
    - [111, 7102.0]
  - - [2048, 2048, 8, 2048, 2048, 2048, 2048, 2048]
    - [112, 7161.0]
- null
