library/src/blas3/Tensile/Logic/asm_full/arcturus_Cijk_Alik_Bljk_BBH.yaml
- {MinimumRequiredVersion: 4.14.0}
- arcturus
- gfx908
- [Device 7380, Device 7388, Device 738c, Device 7390]
    SolutionIndex: 0
    SolutionNameMin: Cijk_Alik_Bljk_BBH_MT64x128x16_MI32x32x2x2_SE_GRVW4_ONLL0_SNLL1
    SolutionIndex: 1
    SolutionNameMin: Cijk_Alik_Bljk_BBH_MT64x128x16_MI32x32x2x2_SE_GRVW2_ONLL0_SNLL0
    SolutionIndex: 2
    SolutionNameMin: Cijk_Alik_Bljk_BBH_MT64x128x16_MI32x32x2x2_SE_GRVW4_ONLL0_SNLL0
    SolutionIndex: 3
    SolutionNameMin: Cijk_Alik_Bljk_BBH_MT64x128x32_MI32x32x2x2_SE_GRVW4_ONLL0_SNLL0
    SolutionIndex: 4
    SolutionNameMin: Cijk_Alik_Bljk_BBH_MT64x128x16_MI32x32x2x2_SE_GRVW4_ONLL1_SNLL1
    SolutionIndex: 5
    SolutionNameMin: Cijk_Alik_Bljk_BBH_MT64x128x16_MI32x32x2x2_SE_GRVW2_ONLL1_SNLL0
    SolutionIndex: 6
    SolutionNameMin: Cijk_Alik_Bljk_BBH_MT32x256x16_MI32x32x2x2_SE_GRVW4_ONLL1_SNLL0
    SolutionIndex: 7
    SolutionNameMin: Cijk_Alik_Bljk_BBH_MT64x128x16_MI32x32x2x2_SE_GRVW4_ONLL1_SNLL0
    SolutionIndex: 8
    SolutionNameMin: Cijk_Alik_Bljk_BBH_MT64x128x32_MI32x32x2x2_SE_GRVW4_ONLL1_SNLL0
    SolutionIndex: 9
    SolutionNameMin: Cijk_Alik_Bljk_BBH_MT64x256x16_MI32x32x2x2_SE_GRVW4_ONLL0_SNLL0
    SolutionIndex: 10
    SolutionNameMin: Cijk_Alik_Bljk_BBH_MT64x256x16_MI32x32x2x2_SE_GRVW4_ONLL1_SNLL1
    SolutionIndex: 11
    SolutionNameMin: Cijk_Alik_Bljk_BBH_MT128x32x16_SE_
    SolutionIndex: 12
    SolutionNameMin: Cijk_Alik_Bljk_BBH_MT128x64x16_SE_
    SolutionIndex: 13
    SolutionNameMin: Cijk_Alik_Bljk_BBH_MT32x128x16_SE_
    SolutionIndex: 14
    SolutionNameMin: Cijk_Alik_Bljk_BBH_MT64x128x16_SE_
    SolutionIndex: 15
    SolutionNameMin: Cijk_Alik_Bljk_BBH_MT256x128x16_SE_
    SolutionIndex: 16
    SolutionNameMin: Cijk_Alik_Bljk_BBH_MT128x256x16_SE_
    SolutionIndex: 17
    SolutionNameMin: Cijk_Alik_Bljk_BBH_MT64x16x16_SE_
    SolutionIndex: 18
    SolutionNameMin: Cijk_Alik_Bljk_BBH_MT16x64x16_SE_
    SolutionIndex: 19
    SolutionNameMin: Cijk_Alik_Bljk_BBH_MT64x128x32_SE_
    SolutionIndex: 20
    SolutionNameMin: Cijk_Alik_Bljk_BBH_MT64x128x64_SE_
    SolutionIndex: 21
    SolutionNameMin: Cijk_Alik_Bljk_BBH_MT32x32x32_SE_
    SolutionIndex: 22
    SolutionNameMin: Cijk_Alik_Bljk_BBH_MT128x64x16_SE_
    SolutionIndex: 23
    SolutionNameMin: Cijk_Alik_Bljk_BBH_MT32x128x16_SE_
    SolutionIndex: 24
    SolutionNameMin: Cijk_Alik_Bljk_BBH_MT64x128x16_SE_
    SolutionIndex: 25
    SolutionNameMin: Cijk_Alik_Bljk_BBH_MT256x128x16_SE_
    SolutionIndex: 26
    SolutionNameMin: Cijk_Alik_Bljk_BBH_MT128x256x16_SE_
    SolutionIndex: 27
    SolutionNameMin: Cijk_Alik_Bljk_BBH_MT64x16x16_SE_
    SolutionIndex: 28
    SolutionNameMin: Cijk_Alik_Bljk_BBH_MT16x64x16_SE_
    SolutionIndex: 29
    SolutionNameMin: Cijk_Alik_Bljk_BBH_MT64x128x32_SE_
    SolutionIndex: 30
    SolutionNameMin: Cijk_Alik_Bljk_BBH_MT64x128x64_SE_
    SolutionIndex: 31
    SolutionNameMin: Cijk_Alik_Bljk_BBH_MT32x32x32_SE_
- - - [32, 1600, 1, 512]
    - [2, 527.665]
  - - [64, 512, 1, 1024]
    - [0, 371.177]
  - - [256, 684, 1, 1024]
    - [7, 1985.24]
  - - [256, 1280, 1, 1024]
    - [7, 3597.17]
  - - [256, 1536, 1, 1024]
    - [7, 4353.95]
  - - [256, 2304, 1, 1024]
    - [7, 6514.02]
  - - [256, 2560, 1, 1024]
    - [2, 7157.52]
  - - [256, 2816, 1, 1024]
    - [2, 7800.06]
  - - [256, 3328, 1, 1024]
    - [2, 9087.66]
  - - [256, 3584, 1, 1024]
    - [7, 9697.81]
  - - [256, 4608, 1, 1024]
    - [2, 10573.9]
  - - [256, 4864, 1, 1024]
    - [0, 11130.1]
  - - [256, 5376, 1, 1024]
    - [0, 11506.3]
  - - [256, 5888, 1, 1024]
    - [4, 11491.2]
  - - [256, 6144, 1, 1024]
    - [2, 11898.7]
  - - [256, 6400, 1, 1024]
    - [8, 12453.4]
  - - [256, 6656, 1, 1024]
    - [3, 12951.5]
  - - [256, 7168, 1, 1024]
    - [8, 13865.5]
  - - [256, 7424, 1, 1024]
    - [8, 14301.6]
  - - [256, 7936, 1, 1024]
    - [0, 11793.5]
  - - [256, 8192, 1, 1024]
    - [7, 11999.8]
  - - [256, 8448, 1, 1024]
    - [7, 11113.0]
  - - [256, 8960, 1, 1024]
    - [7, 11322.8]
  - - [256, 9984, 1, 1024]
    - [8, 11459.0]
  - - [256, 10496, 1, 1024]
    - [5, 12309.7]
  - - [256, 11264, 1, 1024]
    - [8, 12762.8]
  - - [256, 11520, 1, 1024]
    - [1, 12705.7]
  - - [256, 11776, 1, 1024]
    - [10, 12195.8]
  - - [256, 12544, 1, 1024]
    - [9, 12873.2]
  - - [256, 13312, 1, 1024]
    - [10, 13278.8]
  - - [256, 14336, 1, 1024]
    - [8, 14230.9]
  - - [256, 14592, 1, 1024]
    - [8, 14428.2]
  - - [256, 14848, 1, 1024]
    - [3, 14606.4]
  - - [256, 15104, 1, 1024]
    - [3, 14916.5]
  - - [256, 16128, 1, 1024]
    - [3, 12041.1]
  - - [256, 18176, 1, 1024]
    - [3, 13429.3]
  - - [256, 18944, 1, 1024]
    - [8, 13921.4]
  - - [256, 19200, 1, 1024]
    - [3, 14002.8]
  - - [256, 20480, 1, 1024]
    - [3, 13726.5]
  - - [256, 20992, 1, 1024]
    - [3, 14006.6]
  - - [256, 21248, 1, 1024]
    - [8, 14194.8]
  - - [256, 21504, 1, 1024]
    - [8, 14322.0]
  - - [256, 22016, 1, 1024]
    - [3, 14574.1]
  - - [256, 22344, 1, 1024]
    - [3, 14690.4]
  - - [256, 23296, 1, 1024]
    - [8, 12806.0]
  - - [256, 23552, 1, 1024]
    - [3, 12918.5]
  - - [256, 31488, 1, 1024]
    - [8, 13608.5]
  - - [256, 33536, 1, 1024]
    - [3, 14385.5]
  - - [256, 44505, 1, 1024]
    - [8, 14957.3]
  - - [512, 1600, 1, 512]
    - [2, 8004.4]
  - - [684, 8976, 1, 256]
    - [7, 15066.5]
  - - [1024, 200, 1, 560]
    - [7, 2007.84]
  - - [1024, 512, 1, 1600]
    - [2, 6324.34]
  - - [1024, 1600, 1, 560]
    - [7, 13751.6]
  - - [1024, 1600, 1, 1024]
    - [7, 14841.8]
  - - [1280, 8976, 1, 256]
    - [7, 16047.9]
  - - [1792, 8976, 1, 256]
    - [7, 16350.7]
  - - [2048, 114, 1, 512]
    - [6, 1928.03]
  - - [2048, 114, 1, 768]
    - [7, 2190.94]
  - - [2048, 215, 1, 512]
    - [2, 3886.96]
  - - [2048, 215, 1, 768]
    - [7, 4357.81]
  - - [2048, 256, 1, 512]
    - [2, 5076.31]
  - - [2048, 256, 1, 768]
    - [7, 5543.13]
  - - [2048, 512, 1, 74]
    - [4, 2803.27]
  - - [2048, 512, 1, 100]
    - [0, 3532.94]
  - - [2048, 684, 1, 512]
    - [2, 11109.4]
  - - [2048, 684, 1, 768]
    - [2, 12498.1]
  - - [2048, 1536, 1, 512]
    - [2, 15069.4]
  - - [2048, 1536, 1, 768]
    - [2, 16777.2]
  - - [2048, 8976, 1, 256]
    - [7, 14582.3]
  - - [2304, 8976, 1, 256]
    - [2, 16830.7]
  - - [2560, 8976, 1, 256]
    - [2, 16822.6]
  - - [2816, 8976, 1, 256]
    - [2, 17024.7]
  - - [3072, 8976, 1, 256]
    - [7, 16554.9]
  - - [3328, 8976, 1, 256]
    - [2, 17143.3]
  - - [3840, 8976, 1, 256]
    - [7, 17328.7]
  - - [4096, 8976, 1, 256]
    - [0, 11255.2]
  - - [4352, 8976, 1, 256]
    - [2, 17354.3]
  - - [4608, 8976, 1, 256]
    - [7, 17424.5]
  - - [4864, 8976, 1, 256]
    - [7, 17476.8]
  - - [5120, 8976, 1, 256]
    - [7, 16857.3]
  - - [5376, 8976, 1, 256]
    - [7, 17549.3]
  - - [5632, 8976, 1, 256]
    - [2, 17539.7]
  - - [5888, 8976, 1, 256]
    - [2, 17578.4]
  - - [6144, 8976, 1, 256]
    - [2, 14681.8]
  - - [6400, 8976, 1, 256]
    - [2, 17645.3]
  - - [7168, 8976, 1, 256]
    - [2, 16927.4]
  - - [7936, 8976, 1, 256]
    - [2, 17699.2]
  - - [8192, 8976, 1, 256]
    - [2, 11535.5]
  - - [8448, 8976, 1, 256]
    - [2, 17732.7]
  - - [8960, 8976, 1, 256]
    - [2, 17751.4]
  - - [9472, 8976, 1, 256]
    - [7, 17800.7]
  - - [9728, 8976, 1, 256]
    - [2, 17739.8]
  - - [9984, 8976, 1, 256]
    - [7, 17783.2]
  - - [10240, 8976, 1, 256]
    - [7, 14723.2]
  - - [10496, 8976, 1, 256]
    - [7, 17816.8]
  - - [11264, 8976, 1, 256]
    - [7, 17030.1]
  - - [11776, 8976, 1, 256]
    - [7, 17844.6]
  - - [12544, 8976, 1, 256]
    - [2, 17843.9]
  - - [13312, 8976, 1, 256]
    - [2, 17060.7]
  - - [13568, 8976, 1, 256]
    - [7, 17855.6]
  - - [13824, 8976, 1, 256]
    - [2, 17884.4]
  - - [15104, 8976, 1, 256]
    - [2, 17917.5]
  - - [15360, 8976, 1, 256]
    - [7, 17080.5]
  - - [15872, 8976, 1, 256]
    - [2, 17913.4]
  - - [16128, 8976, 1, 256]
    - [7, 17991.6]
  - - [17152, 8976, 1, 256]
    - [2, 17929.3]
  - - [18176, 8976, 1, 256]
    - [2, 17946.8]
  - - [18688, 8976, 1, 256]
    - [2, 17938.7]
  - - [18944, 8976, 1, 256]
    - [7, 17946.9]
  - - [19712, 8976, 1, 256]
    - [2, 17933.9]
  - - [19968, 8976, 1, 256]
    - [2, 17927.8]
  - - [20480, 8976, 1, 256]
    - [0, 11923.4]
  - - [20992, 8976, 1, 256]
    - [2, 17956.4]
  - - [21248, 8976, 1, 256]
    - [7, 17950.3]
  - - [23552, 8976, 1, 256]
    - [2, 17140.2]
  - - [28672, 8976, 1, 256]
    - [0, 12047.3]
  - - [31488, 8976, 1, 256]
    - [7, 18000.2]
  - - [33536, 8976, 1, 256]
    - [7, 17997.5]
  - - [3072, 512, 1, 3072]
    - [30, 28733.7]
  - - [511, 4096, 1, 4096]
    - [22, 2670.57]
  - - [512, 3071, 1, 3072]
    - [22, 3189.39]
  - - [2880, 3073, 1, 3072]
    - [22, 3883.37]
  - - [960, 1024, 1, 1024]
    - [30, 24105.2]
  - - [511, 3072, 1, 3072]
    - [22, 3175.98]
  - - [3072, 3072, 1, 3072]
    - [29, 32762.8]
  - - [1024, 512, 1, 1025]
    - [22, 1532.26]
  - - [511, 2048, 1, 2048]
    - [23, 2153.8]
  - - [8192, 8193, 1, 8192]
    - [25, 4374.36]
  - - [3072, 3072, 1, 3071]
    - [22, 4159.1]
  - - [8192, 8192, 1, 8193]
    - [25, 4631.22]
  - - [513, 1024, 1, 1024]
    - [22, 1511.35]
  - - [512, 1023, 1, 1024]
    - [22, 1497.51]
  - - [512, 2048, 1, 2047]
    - [23, 2191.32]
  - - [7680, 8192, 1, 8193]
    - [25, 4847.64]
  - - [513, 4096, 1, 4096]
    - [22, 2655.48]
  - - [3073, 512, 1, 3072]
    - [22, 3180.55]
  - - [4096, 4096, 1, 4097]
    - [22, 4148.5]
  - - [1025, 1024, 1, 1024]
    - [23, 2150.96]
  - - [2048, 2048, 1, 2048]
    - [29, 29959.4]
  - - [8192, 8191, 1, 8192]
    - [25, 4411.15]
  - - [8192, 512, 1, 8193]
    - [22, 3586.69]
  - - [7681, 8192, 1, 8192]
    - [25, 4321.58]
  - - [2880, 3071, 1, 3072]
    - [24, 4177.63]
  - - [512, 1025, 1, 1024]
    - [22, 1549.23]
  - - [2048, 513, 1, 2048]
    - [23, 2184.71]
  - - [1024, 1024, 1, 1025]
    - [23, 2128.47]
  - - [960, 1024, 1, 1023]
    - [24, 2675.74]
  - - [3072, 512, 1, 3071]
    - [22, 3198.18]
  - - [960, 1025, 1, 1024]
    - [23, 2035.43]
  - - [3072, 3071, 1, 3072]
    - [22, 4139.24]
  - - [512, 2048, 1, 2049]
    - [23, 2170.06]
  - - [3072, 511, 1, 3072]
    - [22, 3187.23]
  - - [512, 1024, 1, 1024]
    - [30, 16054.8]
  - - [2049, 512, 1, 2048]
    - [23, 2173.05]
  - - [512, 8191, 1, 8192]
    - [22, 3417.57]
  - - [513, 3072, 1, 3072]
    - [22, 3170.54]
  - - [512, 2048, 1, 2048]
    - [30, 21423.4]
  - - [4096, 4095, 1, 4096]
    - [22, 4091.87]
  - - [511, 1024, 1, 1024]
    - [22, 1492.04]
  - - [512, 3072, 1, 3072]
    - [30, 32367.6]
  - - [513, 512, 1, 512]
    - [27, 887.07]
  - - [1024, 511, 1, 1024]
    - [22, 1538.66]
  - - [3072, 3072, 1, 3073]
    - [22, 4161.95]
  - - [960, 1024, 1, 1025]
    - [24, 2660.02]
  - - [1024, 1024, 1, 1024]
    - [29, 18667.3]
  - - [959, 1024, 1, 1024]
    - [23, 2622.54]
  - - [1920, 2048, 1, 2048]
    - [30, 39693.8]
  - - [7680, 8193, 1, 8192]
    - [25, 4367.72]
  - - [512, 3072, 1, 3073]
    - [22, 3183.4]
  - - [1023, 512, 1, 1024]
    - [22, 1540.52]
  - - [3072, 512, 1, 3073]
    - [22, 3205.52]
  - - [512, 2049, 1, 2048]
    - [23, 2174.63]
  - - [513, 8192, 1, 8192]
    - [24, 3315.12]
  - - [7679, 8192, 1, 8192]
    - [25, 4618.12]
  - - [1024, 513, 1, 1024]
    - [22, 1554.68]
  - - [8192, 511, 1, 8192]
    - [22, 3500.51]
  - - [4096, 4097, 1, 4096]
    - [22, 4074.92]
  - - [512, 3072, 1, 3071]
    - [22, 3179.99]
  - - [7680, 8192, 1, 8191]
    - [26, 4554.42]
  - - [2048, 2047, 1, 2048]
    - [22, 3532.88]
  - - [4096, 4096, 1, 4096]
    - [29, 36062.0]
  - - [8193, 8192, 1, 8192]
    - [25, 4413.04]
  - - [512, 4096, 1, 4095]
    - [23, 2664.92]
  - - [1024, 1023, 1, 1024]
    - [23, 2144.36]
  - - [3073, 3072, 1, 3072]
    - [22, 4139.9]
  - - [512, 3073, 1, 3072]
    - [22, 3189.28]
  - - [4096, 4096, 1, 4095]
    - [25, 4132.33]
  - - [1920, 2048, 1, 2047]
    - [26, 4502.97]
  - - [1920, 2049, 1, 2048]
    - [22, 3332.65]
  - - [512, 8192, 1, 8191]
    - [24, 3384.44]
  - - [8192, 512, 1, 8192]
    - [30, 28986.8]
  - - [8191, 512, 1, 8192]
    - [22, 3504.38]
  - - [1025, 512, 1, 1024]
    - [22, 1556.4]
  - - [2881, 3072, 1, 3072]
    - [22, 3893.51]
  - - [64, 1024, 1, 1024]
    - [31, 4686.37]
  - - [1024, 512, 1, 1023]
    - [22, 1540.52]
  - - [513, 2048, 1, 2048]
    - [23, 2177.29]
  - - [3841, 4096, 1, 4096]
    - [22, 4052.65]
  - - [1024, 512, 1, 1024]
    - [30, 17706.8]
  - - [2880, 3072, 1, 3073]
    - [24, 4156.93]
  - - [512, 512, 1, 513]
    - [27, 872.793]
  - - [4095, 512, 1, 4096]
    - [22, 2749.41]
  - - [1919, 2048, 1, 2048]
    - [26, 4184.45]
  - - [1024, 1025, 1, 1024]
    - [23, 2137.27]
  - - [2880, 3072, 1, 3072]
    - [30, 39679.9]
  - - [2879, 3072, 1, 3072]
    - [24, 4180.36]
  - - [512, 8192, 1, 8193]
    - [22, 3556.85]
  - - [511, 8192, 1, 8192]
    - [22, 3399.76]
  - - [8192, 513, 1, 8192]
    - [22, 3505.17]
  - - [512, 8193, 1, 8192]
    - [22, 3382.47]
  - - [7680, 8191, 1, 8192]
    - [25, 4614.26]
  - - [512, 512, 1, 511]
    - [27, 890.189]
  - - [2047, 2048, 1, 2048]
    - [22, 3533.35]
  - - [2049, 2048, 1, 2048]
    - [22, 3534.82]
  - - [3840, 4096, 1, 4096]
    - [30, 42116.4]
  - - [3840, 4095, 1, 4096]
    - [25, 4490.73]
  - - [960, 1023, 1, 1024]
    - [24, 2637.01]
  - - [2880, 3072, 1, 3071]
    - [24, 4159.56]
  - - [64, 1025, 1, 1024]
    - [27, 268.698]
  - - [2048, 511, 1, 2048]
    - [23, 2129.32]
  - - [4096, 513, 1, 4096]
    - [22, 2757.79]
  - - [4097, 512, 1, 4096]
    - [22, 2754.78]
  - - [8192, 512, 1, 8191]
    - [24, 3401.11]
  - - [1921, 2048, 1, 2048]
    - [22, 3301.18]
  - - [512, 4096, 1, 4096]
    - [30, 30314.6]
  - - [2048, 2049, 1, 2048]
    - [22, 3532.15]
  - - [2048, 512, 1, 2047]
    - [23, 2168.47]
  - - [3071, 3072, 1, 3072]
    - [22, 4141.32]
  - - [3840, 4097, 1, 4096]
    - [22, 4068.63]
  - - [4096, 511, 1, 4096]
    - [22, 2748.3]
  - - [64, 1024, 1, 1025]
    - [27, 272.093]
  - - [2047, 512, 1, 2048]
    - [23, 2166.19]
  - - [63, 1024, 1, 1024]
    - [27, 266.115]
  - - [3072, 513, 1, 3072]
    - [22, 3178.7]
  - - [512, 512, 1, 512]
    - [29, 5162.22]
  - - [7680, 8192, 1, 8192]
    - [30, 43341.0]
  - - [512, 4095, 1, 4096]
    - [22, 2689.42]
  - - [512, 1024, 1, 1025]
    - [22, 1530.87]
  - - [3071, 512, 1, 3072]
    - [22, 3184.01]
  - - [3840, 4096, 1, 4097]
    - [25, 4812.66]
  - - [512, 511, 1, 512]
    - [27, 905.105]
  - - [4096, 512, 1, 4096]
    - [30, 22491.5]
  - - [4097, 4096, 1, 4096]
    - [22, 4089.15]
  - - [2048, 2048, 1, 2047]
    - [22, 3513.91]
  - - [3839, 4096, 1, 4096]
    - [25, 4481.35]
  - - [512, 4096, 1, 4097]
    - [22, 2809.69]
  - - [3072, 3073, 1, 3072]
    - [22, 4137.92]
  - - [512, 2047, 1, 2048]
    - [23, 2161.31]
  - - [2048, 2048, 1, 2049]
    - [22, 3560.48]
  - - [8191, 8192, 1, 8192]
    - [25, 4413.6]
  - - [64, 1023, 1, 1024]
    - [27, 269.988]
  - - [8192, 8192, 1, 8192]
    - [29, 31697.9]
  - - [4096, 512, 1, 4097]
    - [22, 2843.99]
  - - [3840, 4096, 1, 4095]
    - [25, 4800.53]
  - - [65, 1024, 1, 1024]
    - [28, 260.541]
  - - [1920, 2047, 1, 2048]
    - [26, 4193.31]
  - - [512, 513, 1, 512]
    - [27, 917.075]
  - - [8192, 8192, 1, 8191]
    - [25, 4634.15]
  - - [1024, 1024, 1, 1023]
    - [23, 2154.7]
  - - [512, 4097, 1, 4096]
    - [22, 2697.96]
  - - [511, 512, 1, 512]
    - [27, 901.693]
  - - [4096, 512, 1, 4095]
    - [24, 2674.08]
  - - [8193, 512, 1, 8192]
    - [22, 3510.08]
  - - [961, 1024, 1, 1024]
    - [23, 2028.35]
  - - [512, 1024, 1, 1023]
    - [22, 1539.46]
  - - [4095, 4096, 1, 4096]
    - [22, 4090.81]
  - - [64, 1024, 1, 1023]
    - [27, 264.283]
  - - [512, 8192, 1, 8192]
    - [30, 37009.7]
  - - [2048, 512, 1, 2049]
    - [23, 2190.95]
  - - [1023, 1024, 1, 1024]
    - [23, 2144.02]
  - - [2048, 512, 1, 2048]
    - [30, 19708.9]
  - - [1920, 2048, 1, 2049]
    - [26, 4475.52]
- null
