library/src/blas3/Tensile/Logic/asm_full/arcturus_Cijk_Alik_Bljk_SB.yaml
- {MinimumRequiredVersion: 4.20.0}
- arcturus
- gfx908
- [Device 7380, Device 7388, Device 738c, Device 7390]
    SolutionIndex: 0
    SolutionIndex: 1
    SolutionIndex: 2
    SolutionIndex: 3
    SolutionIndex: 4
    SolutionIndex: 5
    SolutionIndex: 6
    SolutionIndex: 7
    SolutionIndex: 8
    SolutionIndex: 9
    SolutionIndex: 10
    SolutionIndex: 11
    SolutionIndex: 12
    SolutionIndex: 13
    SolutionIndex: 14
    SolutionIndex: 15
    SolutionIndex: 16
    SolutionIndex: 17
    SolutionIndex: 18
    SolutionIndex: 19
    SolutionIndex: 20
    SolutionIndex: 21
    SolutionIndex: 22
    SolutionIndex: 23
    SolutionIndex: 24
    SolutionNameMin: Cijk_Alik_Bljk_SB_MT032x016x08_GRVW02_GSU01_SNLL0_TT02_02_VW02_WG16_08_01
    SolutionIndex: 25
    SolutionNameMin: Cijk_Alik_Bljk_SB_MT016x016x16_GRVW02_GSU04_SNLL0_TT02_02_VW02_WG08_08_04
    SolutionIndex: 26
    SolutionNameMin: Cijk_Alik_Bljk_SB_MT016x016x16_GRVW02_GSU08_SNLL0_TT02_02_VW02_WG08_08_04
    SolutionIndex: 27
    SolutionNameMin: Cijk_Alik_Bljk_SB_MT128x128x24_GRVW04_GSU01_SNLL1_TT08_08_VW04_WG16_16_01
    SolutionIndex: 28
    SolutionNameMin: Cijk_Alik_Bljk_SB_MT128x128x08_GRVW04_GSU01_SNLL1_TT08_08_VW04_WG16_16_01
    SolutionIndex: 29
    SolutionNameMin: Cijk_Alik_Bljk_SB_MT032x032x16_GRVW04_GSU02_SNLL0_TT04_04_VW04_WG08_08_02
    SolutionIndex: 30
    SolutionNameMin: Cijk_Alik_Bljk_SB_MT032x032x32_GRVW04_GSU02_SNLL0_TT04_04_VW04_WG08_08_04
    SolutionIndex: 31
    SolutionNameMin: Cijk_Alik_Bljk_SB_MT128x128x16_GRVW04_GSU01_SNLL1_TT08_08_VW04_WG16_16_01
    SolutionIndex: 32
    SolutionNameMin: Cijk_Alik_Bljk_SB_MT032x008x32_GRVW02_GSU04_SNLL0_TT02_02_VW02_WG16_04_04
    SolutionIndex: 33
    SolutionNameMin: Cijk_Alik_Bljk_SB_MT128x128x16_GRVW04_GSU01_SNLL1_TT08_08_VW04_WG16_16_01
    SolutionIndex: 34
    SolutionNameMin: Cijk_Alik_Bljk_SB_MT128x128x32_GRVW04_GSU01_SNLL1_TT08_08_VW04_WG16_16_01
    SolutionIndex: 35
    SolutionNameMin: Cijk_Alik_Bljk_SB_MT064x064x16_GRVW04_GSU01_SNLL0_TT04_04_VW04_WG16_16_01
    SolutionIndex: 36
    SolutionNameMin: Cijk_Alik_Bljk_SB_MT064x064x16_GRVW04_GSU01_SNLL1_TT04_04_VW04_WG16_16_01
    SolutionIndex: 37
    SolutionNameMin: Cijk_Alik_Bljk_SB_MT064x064x16_GRVW04_GSU01_SNLL0_TT04_04_VW04_WG16_16_01
    SolutionIndex: 38
    SolutionNameMin: Cijk_Alik_Bljk_SB_MT064x128x16_GRVW04_GSU01_SNLL1_TT04_08_VW04_WG16_16_01
    SolutionIndex: 39
    SolutionNameMin: Cijk_Alik_Bljk_SB_MT064x064x16_GRVW04_GSU01_SNLL1_TT04_04_VW04_WG16_16_01
    SolutionIndex: 40
    SolutionNameMin: Cijk_Alik_Bljk_SB_MT016x016x04_GRVW02_GSU01_SNLL0_TT02_02_VW02_WG08_08_01
    SolutionIndex: 41
    SolutionNameMin: Cijk_Alik_Bljk_SB_MT064x128x16_GRVW04_GSU01_SNLL1_TT04_08_VW04_WG16_16_01
    SolutionIndex: 42
    SolutionNameMin: Cijk_Alik_Bljk_SB_MT008x008x08_GRVW02_GSU08_SNLL0_TT02_02_VW02_WG04_04_04
    SolutionIndex: 43
    SolutionNameMin: Cijk_Alik_Bljk_SB_MT128x064x16_GRVW04_GSU01_SNLL1_TT08_04_VW04_WG16_16_01
    SolutionIndex: 44
    SolutionNameMin: Cijk_Alik_Bljk_SB_MT032x032x32_GRVW04_GSU02_SNLL0_TT04_04_VW04_WG08_08_04
    SolutionIndex: 45
    SolutionNameMin: Cijk_Alik_Bljk_SB_MT064x064x32_GRVW04_GSU01_SNLL1_TT04_04_VW04_WG16_16_01
    SolutionIndex: 46
    SolutionNameMin: Cijk_Alik_Bljk_SB_MT064x032x16_GRVW04_GSU01_SNLL0_TT04_04_VW04_WG16_08_01
    SolutionIndex: 47
    SolutionNameMin: Cijk_Alik_Bljk_SB_MT128x064x16_GRVW04_GSU01_SNLL0_TT08_04_VW04_WG16_16_01
    SolutionIndex: 48
    SolutionNameMin: Cijk_Alik_Bljk_SB_MT032x008x16_GRVW02_GSU01_SNLL0_TT02_02_VW02_WG16_04_01
    SolutionIndex: 49
    SolutionNameMin: Cijk_Alik_Bljk_SB_MT128x096x16_GRVW02_GSU01_SNLL1_TT08_06_VW02_WG16_16_01
    SolutionIndex: 50
    SolutionNameMin: Cijk_Alik_Bljk_SB_MT128x096x16_GRVW02_GSU01_SNLL1_TT08_06_VW02_WG16_16_01
    SolutionIndex: 51
    SolutionNameMin: Cijk_Alik_Bljk_SB_MT032x032x32_GRVW04_GSU04_SNLL0_TT04_04_VW04_WG08_08_04
    SolutionIndex: 52
    SolutionNameMin: Cijk_Alik_Bljk_SB_MT032x016x16_GRVW02_GSU04_SNLL0_TT02_02_VW02_WG16_08_02
    SolutionIndex: 53
    SolutionNameMin: Cijk_Alik_Bljk_SB_MT128x128x08_GRVW04_GSU01_SNLL1_TT08_08_VW04_WG16_16_01
    SolutionIndex: 54
    SolutionNameMin: Cijk_Alik_Bljk_SB_MT128x064x16_GRVW04_GSU01_SNLL1_TT08_04_VW04_WG16_16_01
    SolutionIndex: 55
    SolutionNameMin: Cijk_Alik_Bljk_SB_MT064x128x16_GRVW04_GSU01_SNLL0_TT04_08_VW04_WG16_16_01
    SolutionIndex: 56
    SolutionNameMin: Cijk_Alik_Bljk_SB_MT008x008x08_GRVW02_GSU16_SNLL0_TT02_02_VW02_WG04_04_04
    SolutionIndex: 57
    SolutionNameMin: Cijk_Alik_Bljk_SB_MT064x032x32_GRVW04_GSU02_SNLL0_TT08_04_VW04_WG08_08_04
    SolutionIndex: 58
    SolutionNameMin: Cijk_Alik_Bljk_SB_MT016x016x16_GRVW02_GSU02_SNLL0_TT02_02_VW02_WG08_08_04
    SolutionIndex: 59
    SolutionNameMin: Cijk_Alik_Bljk_SB_MT032x016x16_GRVW02_GSU04_SNLL0_TT04_02_VW02_WG08_08_02
    SolutionIndex: 60
    SolutionNameMin: Cijk_Alik_Bljk_SB_MT064x064x24_GRVW04_GSU04_SNLL0_TT08_08_VW04_WG08_08_02
    SolutionIndex: 61
    SolutionNameMin: Cijk_Alik_Bljk_SB_MT032x032x32_GRVW04_GSU02_SNLL0_TT04_04_VW04_WG08_08_02
    SolutionIndex: 62
    SolutionNameMin: Cijk_Alik_Bljk_SB_MT032x032x16_GRVW04_GSU04_SNLL0_TT04_04_VW04_WG08_08_02
    SolutionIndex: 63
    SolutionNameMin: Cijk_Alik_Bljk_SB_MT008x008x08_GRVW02_GSU04_SNLL0_TT02_02_VW02_WG04_04_04
    SolutionIndex: 64
    SolutionNameMin: Cijk_Alik_Bljk_SB_MT064x064x32_GRVW04_GSU01_SNLL1_TT04_04_VW04_WG16_16_01
    SolutionIndex: 65
    SolutionNameMin: Cijk_Alik_Bljk_SB_MT064x128x16_GRVW04_GSU01_SNLL0_TT04_08_VW04_WG16_16_01
    SolutionIndex: 66
    SolutionNameMin: Cijk_Alik_Bljk_SB_MT016x016x16_GRVW02_GSU01_SNLL1_TT02_02_VW02_WG08_08_04
    SolutionIndex: 67
    SolutionNameMin: Cijk_Alik_Bljk_SB_MT064x032x16_GRVW04_GSU02_SNLL0_TT08_04_VW04_WG08_08_02
    SolutionIndex: 68
    SolutionNameMin: Cijk_Alik_Bljk_SB_MT064x032x32_GRVW04_GSU04_SNLL0_TT08_04_VW04_WG08_08_04
    SolutionIndex: 69
    SolutionNameMin: Cijk_Alik_Bljk_SB_MT016x016x16_GRVW02_GSU16_SNLL0_TT02_02_VW02_WG08_08_04
    SolutionIndex: 70
    SolutionNameMin: Cijk_Alik_Bljk_SB_MT032x016x08_GRVW02_GSU01_SNLL0_TT04_02_VW02_WG08_08_01
    SolutionIndex: 71
    SolutionNameMin: Cijk_Alik_Bljk_SB_MT016x016x08_GRVW02_GSU08_SNLL0_TT02_02_VW02_WG08_08_02
    SolutionIndex: 72
    SolutionNameMin: Cijk_Alik_Bljk_SB_MT032x032x08_GRVW04_GSU01_SNLL0_TT04_04_VW04_WG08_08_01
    SolutionIndex: 73
    SolutionNameMin: Cijk_Alik_Bljk_SB_MT032x032x16_GRVW04_GSU02_SNLL0_TT04_04_VW04_WG08_08_02
    SolutionIndex: 74
    SolutionNameMin: Cijk_Alik_Bljk_SB_MT128x032x32_GRVW04_GSU02_SNLL0_TT08_04_VW04_WG16_08_02
    SolutionIndex: 75
    SolutionNameMin: Cijk_Alik_Bljk_SB_MT032x016x16_GRVW02_GSU04_SNLL0_TT04_02_VW02_WG08_08_04
    SolutionIndex: 76
    SolutionNameMin: Cijk_Alik_Bljk_SB_MT032x016x16_GRVW02_GSU02_SNLL0_TT04_02_VW02_WG08_08_04
    SolutionIndex: 77
    SolutionNameMin: Cijk_Alik_Bljk_SB_MT064x064x24_GRVW04_GSU04_SNLL0_TT08_08_VW04_WG08_08_02
    SolutionIndex: 78
    SolutionNameMin: Cijk_Alik_Bljk_SB_MT064x064x32_GRVW04_GSU01_SNLL0_TT04_04_VW04_WG16_16_01
    SolutionIndex: 79
    SolutionNameMin: Cijk_Alik_Bljk_SB_MT064x032x16_GRVW04_GSU04_SNLL0_TT08_04_VW04_WG08_08_02
    SolutionIndex: 80
    SolutionNameMin: Cijk_Alik_Bljk_SB_MT032x016x16_GRVW02_GSU01_SNLL0_TT02_02_VW02_WG16_08_01
    SolutionIndex: 81
    SolutionNameMin: Cijk_Alik_Bljk_SB_MT064x064x24_GRVW04_GSU02_SNLL0_TT08_08_VW04_WG08_08_02
    SolutionIndex: 82
    SolutionNameMin: Cijk_Alik_Bljk_SB_MT032x032x02_GRVW04_GSU01_SNLL0_TT04_04_VW04_WG08_08_01
    SolutionIndex: 83
    SolutionNameMin: Cijk_Alik_Bljk_SB_MT064x064x24_GRVW04_GSU02_SNLL0_TT08_08_VW04_WG08_08_02
    SolutionIndex: 84
    SolutionNameMin: Cijk_Alik_Bljk_SB_MT032x016x16_GRVW02_GSU02_SNLL0_TT04_02_VW02_WG08_08_04
    SolutionIndex: 85
    SolutionNameMin: Cijk_Alik_Bljk_SB_MT128x128x32_GRVW04_GSU01_SNLL1_TT08_08_VW04_WG16_16_01
    SolutionIndex: 86
    SolutionNameMin: Cijk_Alik_Bljk_SB_MT036x048x16_GRVW01_GSU02_SNLL0_TT03_03_VW01_WG12_16_01
    SolutionIndex: 87
    SolutionNameMin: Cijk_Alik_Bljk_SB_MT032x016x16_GRVW02_GSU02_SNLL0_TT04_02_VW02_WG08_08_02
    SolutionIndex: 88
    SolutionNameMin: Cijk_Alik_Bljk_SB_MT128x064x16_GRVW04_GSU01_SNLL0_TT08_04_VW04_WG16_16_01
    SolutionIndex: 89
    SolutionNameMin: Cijk_Alik_Bljk_SB_MT096x128x16_GRVW02_GSU01_SNLL1_TT06_08_VW02_WG16_16_01
    SolutionIndex: 90
    SolutionNameMin: Cijk_Alik_Bljk_SB_MT064x016x16_GRVW04_GSU04_SNLL0_TT04_04_VW04_WG16_04_04
    SolutionIndex: 91
    SolutionNameMin: Cijk_Alik_Bljk_SB_MT032x016x16_GRVW02_GSU04_SNLL0_TT02_02_VW02_WG16_08_02
    SolutionIndex: 92
    SolutionNameMin: Cijk_Alik_Bljk_SB_MT096x128x16_GRVW02_GSU01_SNLL1_TT06_08_VW02_WG16_16_01
    SolutionIndex: 93
    SolutionNameMin: Cijk_Alik_Bljk_SB_MT016x016x08_GRVW02_GSU01_SNLL0_TT02_02_VW02_WG08_08_01
    SolutionIndex: 94
    SolutionNameMin: Cijk_Alik_Bljk_SB_MT064x064x32_GRVW04_GSU01_SNLL0_TT04_04_VW04_WG16_16_01
    SolutionIndex: 95
    SolutionNameMin: Cijk_Alik_Bljk_SB_MT032x016x08_GRVW02_GSU01_SNLL0_TT02_02_VW02_WG16_08_01
    SolutionIndex: 96
    SolutionNameMin: Cijk_Alik_Bljk_SB_MT032x016x16_GRVW02_GSU01_SNLL0_TT02_02_VW02_WG16_08_01
    SolutionIndex: 97
    SolutionNameMin: Cijk_Alik_Bljk_SB_MT032x032x32_GRVW04_GSU04_SNLL0_TT04_04_VW04_WG08_08_04
    SolutionIndex: 98
    SolutionNameMin: Cijk_Alik_Bljk_SB_MT128x064x16_GRVW04_GSU02_SNLL0_TT08_08_VW04_WG16_08_02
    SolutionIndex: 99
    SolutionNameMin: Cijk_Alik_Bljk_SB_MT032x016x16_GRVW02_GSU02_SNLL0_TT04_02_VW02_WG08_08_02
    SolutionIndex: 100
    SolutionNameMin: Cijk_Alik_Bljk_SB_MT064x032x16_GRVW04_GSU04_SNLL0_TT08_04_VW04_WG08_08_02
    SolutionIndex: 101
    SolutionNameMin: Cijk_Alik_Bljk_SB_MT064x008x16_GRVW02_GSU01_SNLL0_TT02_02_VW02_WG32_04_01
    SolutionIndex: 102
    SolutionNameMin: Cijk_Alik_Bljk_SB_MT032x016x16_GRVW02_GSU08_SNLL0_TT02_02_VW02_WG16_08_02
    SolutionIndex: 103
    SolutionNameMin: Cijk_Alik_Bljk_SB_MT064x128x32_GRVW04_GSU01_SNLL1_TT04_08_VW04_WG16_16_01
    SolutionIndex: 104
    SolutionNameMin: Cijk_Alik_Bljk_SB_MT048x036x16_GRVW01_GSU08_SNLL0_TT06_03_VW01_WG08_12_02
    SolutionIndex: 105
    SolutionNameMin: Cijk_Alik_Bljk_SB_MT128x128x24_GRVW04_GSU01_SNLL1_TT08_08_VW04_WG16_16_01
    SolutionIndex: 106
    SolutionNameMin: Cijk_Alik_Bljk_SB_MT016x016x16_GRVW02_GSU02_SNLL0_TT02_02_VW02_WG08_08_04
    SolutionIndex: 107
    SolutionNameMin: Cijk_Alik_Bljk_SB_MT008x008x08_GRVW02_GSU02_SNLL0_TT02_02_VW02_WG04_04_04
    SolutionIndex: 108
    SolutionNameMin: Cijk_Alik_Bljk_SB_MT064x016x64_GRVW04_GSU32_SNLL0_TT04_04_VW04_WG16_04_04
    SolutionIndex: 109
    SolutionNameMin: Cijk_Alik_Bljk_SB_MT128x064x16_GRVW04_GSU02_SNLL0_TT08_08_VW04_WG16_08_02
    SolutionIndex: 110
    SolutionNameMin: Cijk_Alik_Bljk_SB_MT032x016x16_GRVW02_GSU04_SNLL0_TT04_02_VW02_WG08_08_04
    SolutionIndex: 111
    SolutionNameMin: Cijk_Alik_Bljk_SB_MT064x008x16_GRVW02_GSU01_SNLL0_TT02_02_VW02_WG32_04_01
    SolutionIndex: 112
    SolutionNameMin: Cijk_Alik_Bljk_SB_MT032x008x16_GRVW02_GSU01_SNLL0_TT02_02_VW02_WG16_04_01
    SolutionIndex: 113
    SolutionNameMin: Cijk_Alik_Bljk_SB_MT016x016x16_GRVW02_GSU08_SNLL0_TT02_02_VW02_WG08_08_04
    SolutionIndex: 114
    SolutionNameMin: Cijk_Alik_Bljk_SB_MT032x016x16_GRVW02_GSU02_SNLL0_TT02_02_VW02_WG16_08_02
    SolutionIndex: 115
    SolutionNameMin: Cijk_Alik_Bljk_SB_MT048x048x16_GRVW01_GSU08_SNLL0_TT03_03_VW01_WG16_16_01
    SolutionIndex: 116
    SolutionNameMin: Cijk_Alik_Bljk_SB_MT048x048x16_GRVW02_GSU08_SNLL0_TT06_04_VW02_WG08_12_02
    SolutionIndex: 117
    SolutionNameMin: Cijk_Alik_Bljk_SB_MT064x032x32_GRVW04_GSU02_SNLL0_TT04_04_VW04_WG16_08_02
    SolutionIndex: 118
    SolutionNameMin: Cijk_Alik_Bljk_SB_MT016x016x16_GRVW02_GSU01_SNLL0_TT02_02_VW02_WG08_08_01
    SolutionIndex: 119
    SolutionNameMin: Cijk_Alik_Bljk_SB_MT064x008x32_GRVW02_GSU32_SNLL0_TT04_02_VW02_WG16_04_04
    SolutionIndex: 120
    SolutionNameMin: Cijk_Alik_Bljk_SB_MT032x032x08_GRVW04_GSU02_SNLL0_TT04_04_VW04_WG08_08_04
    SolutionIndex: 121
    SolutionNameMin: Cijk_Alik_Bljk_SB_MT016x016x08_GRVW02_GSU01_SNLL0_TT02_02_VW02_WG08_08_01
    SolutionIndex: 122
    SolutionNameMin: Cijk_Alik_Bljk_SB_MT128x064x16_GRVW04_GSU04_SNLL0_TT08_08_VW04_WG16_08_02
    SolutionIndex: 123
    SolutionNameMin: Cijk_Alik_Bljk_SB_MT064x032x16_GRVW04_GSU02_SNLL0_TT08_04_VW04_WG08_08_02
    SolutionIndex: 124
    SolutionNameMin: Cijk_Alik_Bljk_SB_MT032x032x08_GRVW04_GSU01_SNLL0_TT04_04_VW04_WG08_08_01
    SolutionIndex: 125
    SolutionNameMin: Cijk_Alik_Bljk_SB_MT096x128x16_GRVW02_GSU01_SNLL0_TT06_08_VW02_WG16_16_01
    SolutionIndex: 126
    SolutionNameMin: Cijk_Alik_Bljk_SB_MT064x016x64_GRVW04_GSU32_SNLL0_TT04_04_VW04_WG16_04_04
    SolutionIndex: 127
    SolutionNameMin: Cijk_Alik_Bljk_SB_MT032x016x16_GRVW02_GSU02_SNLL0_TT02_02_VW02_WG16_08_02
    SolutionIndex: 128
    SolutionNameMin: Cijk_Alik_Bljk_SB_MT032x008x08_GRVW02_GSU01_SNLL0_TT02_02_VW02_WG16_04_01
    SolutionIndex: 129
    SolutionNameMin: Cijk_Alik_Bljk_SB_MT032x032x16_GRVW04_GSU01_SNLL0_TT04_04_VW04_WG08_08_01
    SolutionIndex: 130
    SolutionNameMin: Cijk_Alik_Bljk_SB_MT032x032x08_GRVW04_GSU08_SNLL0_TT04_04_VW04_WG08_08_04
    SolutionIndex: 131
    SolutionNameMin: Cijk_Alik_Bljk_SB_MT064x032x32_GRVW04_GSU02_SNLL0_TT08_04_VW04_WG08_08_04
    SolutionIndex: 132
    SolutionNameMin: Cijk_Alik_Bljk_SB_MT064x064x32_GRVW04_GSU04_SNLL0_TT08_08_VW04_WG08_08_02
    SolutionIndex: 133
    SolutionNameMin: Cijk_Alik_Bljk_SB_MT064x008x32_GRVW04_GSU32_SNLL0_TT04_04_VW04_WG16_02_08
    SolutionIndex: 134
    SolutionNameMin: Cijk_Alik_Bljk_SB_MT016x016x16_GRVW02_GSU04_SNLL0_TT02_02_VW02_WG08_08_04
    SolutionIndex: 135
    SolutionNameMin: Cijk_Alik_Bljk_SB_MT032x016x16_GRVW02_GSU01_SNLL0_TT04_02_VW02_WG08_08_01
    SolutionIndex: 136
    SolutionNameMin: Cijk_Alik_Bljk_SB_MT032x032x16_GRVW04_GSU04_SNLL0_TT04_04_VW04_WG08_08_02
    SolutionIndex: 137
    SolutionNameMin: Cijk_Alik_Bljk_SB_MT064x064x32_GRVW04_GSU02_SNLL0_TT08_08_VW04_WG08_08_04
    SolutionIndex: 138
    SolutionNameMin: Cijk_Alik_Bljk_SB_MT064x032x16_GRVW04_GSU01_SNLL0_TT04_04_VW04_WG16_08_01
    SolutionIndex: 139
    SolutionNameMin: Cijk_Alik_Bljk_SB_MT064x032x32_GRVW04_GSU04_SNLL0_TT04_04_VW04_WG16_08_02
    SolutionIndex: 140
    SolutionNameMin: Cijk_Alik_Bljk_SB_MT064x016x16_GRVW02_GSU02_SNLL0_TT04_02_VW02_WG16_08_02
    SolutionIndex: 141
    SolutionNameMin: Cijk_Alik_Bljk_SB_MT064x016x16_GRVW02_GSU01_SNLL0_TT04_02_VW02_WG16_08_01
    SolutionIndex: 142
    SolutionNameMin: Cijk_Alik_Bljk_SB_MT064x016x32_GRVW01_GSU08_LPA01_LPB01_PGR1_PLR1_TT04_04_USFGRO01_VW01_WG16_04_04_WGM01
    SolutionIndex: 143
    SolutionNameMin: Cijk_Alik_Bljk_SB_MT064x032x16_GRVW01_GSU01_LPA04_LPB04_PGR1_PLR1_TT04_04_USFGRO01_VW04_WG16_08_02_WGM01
    SolutionIndex: 144
    SolutionNameMin: Cijk_Alik_Bljk_SB_MT128x64x16_EPS1_GSU1_LPA4_LPB4_PGR1_SNLL1_TT4_8_VW4_WG32_8_1_WGM8
    SolutionIndex: 145
    SolutionNameMin: Cijk_Alik_Bljk_SB_MT64x64x16_EPS1_GSU1_LPA4_LPB4_PGR1_SNLL1_TT4_4_VW4_WG16_16_1_WGM64
    SolutionIndex: 146
    SolutionNameMin: Cijk_Alik_Bljk_SB_MT64x64x16_EPS1_GSU3_LPA0_LPB0_PGR1_SNLL0_TT4_4_VW4_WG16_16_1_WGM1
    SolutionIndex: 147
    SolutionNameMin: Cijk_Alik_Bljk_SB_MT128x64x16_EPS1_GSU1_LPA4_LPB4_PGR1_SNLL1_TT4_8_VW4_WG32_8_1_WGM64
    SolutionIndex: 148
    SolutionNameMin: Cijk_Alik_Bljk_SB_MT64x32x16_EPS1_GSU5_LPA2_LPB2_PGR1_SNLL0_TT4_4_VW2_WG16_8_1_WGM64
    SolutionIndex: 149
    SolutionNameMin: Cijk_Alik_Bljk_SB_MT64x64x16_EPS1_GSU5_LPA0_LPB2_PGR1_SNLL0_TT4_4_VW2_WG16_16_1_WGM1
    SolutionIndex: 150
    SolutionNameMin: Cijk_Alik_Bljk_SB_MT64x64x16_EPS1_GSU1_LPA4_LPB4_PGR1_SNLL1_TT4_4_VW4_WG16_16_1_WGM8
    SolutionIndex: 151
    SolutionNameMin: Cijk_Alik_Bljk_SB_MT128x32x16_EPS0_GSU1_LPA4_LPB4_PGR0_SNLL0_TT4_4_VW4_WG32_8_1_WGM8
    SolutionIndex: 152
    SolutionNameMin: Cijk_Alik_Bljk_SB_MT64x128x16_EPS1_GSU3_LPA2_LPB2_PGR1_SNLL0_TT4_8_VW2_WG16_16_1_WGM64
    SolutionIndex: 153
    SolutionNameMin: Cijk_Alik_Bljk_SB_MT64x128x16_EPS1_GSU1_LPA4_LPB4_PGR1_SNLL1_TT8_4_VW4_WG8_32_1_WGM64
    SolutionIndex: 154
    SolutionNameMin: Cijk_Alik_Bljk_SB_MT128x128x16_EPS1_GSU1_LPA0_LPB0_PGR1_SNLL1_TT8_8_VW4_WG16_16_1_WGM8
    SolutionIndex: 155
    SolutionNameMin: Cijk_Alik_Bljk_SB_MT64x64x16_EPS1_GSU5_LPA0_LPB0_PGR1_SNLL0_TT4_4_VW2_WG16_16_1_WGM1
    SolutionIndex: 156
    SolutionNameMin: Cijk_Alik_Bljk_SB_MT64x64x16_EPS1_GSU5_LPA0_LPB4_PGR1_SNLL0_TT4_4_VW4_WG16_16_1_WGM8
    SolutionIndex: 157
    SolutionNameMin: Cijk_Alik_Bljk_SB_MT128x128x16_EPS1_GSU1_LPA0_LPB0_PGR1_SNLL1_TT8_8_VW4_WG16_16_1_WGM64
    SolutionIndex: 158
    SolutionNameMin: Cijk_Alik_Bljk_SB_MT128x32x16_EPS1_GSU1_LPA4_LPB4_PGR1_SNLL1_TT4_4_VW4_WG32_8_1_WGM8
    SolutionIndex: 159
    SolutionNameMin: Cijk_Alik_Bljk_SB_MT64x128x16_EPS1_GSU1_LPA4_LPB4_PGR1_SNLL1_TT4_8_VW4_WG16_16_1_WGM64
    SolutionIndex: 160
    SolutionNameMin: Cijk_Alik_Bljk_SB_MT128x64x16_EPS1_GSU1_LPA4_LPB4_PGR1_SNLL1_TT8_4_VW4_WG16_16_1_WGM8
    SolutionIndex: 161
    SolutionNameMin: Cijk_Alik_Bljk_SB_MT128x128x16_EPS1_GSU1_LPA0_LPB0_PGR1_SNLL1_TT8_8_VW4_WG16_16_1_WGM1
    SolutionIndex: 162
    SolutionNameMin: Cijk_Alik_Bljk_SB_MT64x64x16_EPS1_GSU5_LPA2_LPB0_PGR1_SNLL0_TT4_4_VW2_WG16_16_1_WGM1
    SolutionIndex: 163
    SolutionNameMin: Cijk_Alik_Bljk_SB_MT64x128x16_EPS1_GSU1_LPA4_LPB4_PGR1_SNLL1_TT4_8_VW4_WG16_16_1_WGM8
    SolutionIndex: 164
    SolutionNameMin: Cijk_Alik_Bljk_SB_MT64x64x16_EPS1_GSU3_LPA2_LPB2_PGR1_SNLL0_TT4_4_VW2_WG16_16_1_WGM1
    SolutionIndex: 165
    SolutionNameMin: Cijk_Alik_Bljk_SB_MT128x64x16_EPS1_GSU1_LPA4_LPB4_PGR1_SNLL1_TT8_4_VW4_WG16_16_1_WGM64
    SolutionIndex: 166
    SolutionNameMin: Cijk_Alik_Bljk_SB_MT64x64x16_EPS1_GSU5_LPA0_LPB0_PGR1_SNLL0_TT4_4_VW2_WG16_16_1_WGM8
    SolutionIndex: 167
    SolutionNameMin: Cijk_Alik_Bljk_SB_MT128x32x16_EPS0_GSU1_LPA0_LPB4_PGR0_SNLL0_TT4_4_VW4_WG32_8_1_WGM8
    SolutionIndex: 168
    SolutionNameMin: Cijk_Alik_Bljk_SB_MT64x64x16_EPS1_GSU5_LPA0_LPB0_PGR1_SNLL0_TT4_4_VW2_WG16_16_1_WGM64
    SolutionIndex: 169
    SolutionNameMin: Cijk_Alik_Bljk_SB_MT64x64x16_EPS1_GSU5_LPA2_LPB2_PGR1_SNLL0_TT4_4_VW2_WG16_16_1_WGM64
    SolutionIndex: 170
    SolutionNameMin: Cijk_Alik_Bljk_SB_MT64x32x16_EPS1_GSU5_LPA2_LPB2_PGR1_SNLL0_TT4_4_VW2_WG16_8_1_WGM1
    SolutionIndex: 171
    SolutionNameMin: Cijk_Alik_Bljk_SB_MT64x32x16_EPS1_GSU3_LPA2_LPB0_PGR1_SNLL0_TT4_4_VW2_WG16_8_1_WGM8
    SolutionIndex: 172
    SolutionNameMin: Cijk_Alik_Bljk_SB_MT128x64x16_EPS1_GSU5_LPA2_LPB2_PGR1_SNLL0_TT8_4_VW2_WG16_16_1_WGM1
    SolutionIndex: 173
    SolutionNameMin: Cijk_Alik_Bljk_SB_MT64x64x16_EPS1_GSU3_LPA0_LPB2_PGR1_SNLL0_TT4_4_VW2_WG16_16_1_WGM64
    SolutionIndex: 174
    SolutionNameMin: Cijk_Alik_Bljk_SB_MT64x32x16_EPS1_GSU5_LPA0_LPB4_PGR1_SNLL0_TT4_4_VW4_WG16_8_1_WGM64
    SolutionIndex: 175
    SolutionNameMin: Cijk_Alik_Bljk_SB_MT64x32x16_EPS1_GSU1_LPA4_LPB4_PGR1_SNLL1_TT4_4_VW4_WG16_8_1_WGM1
    SolutionIndex: 176
    SolutionNameMin: Cijk_Alik_Bljk_SB_MT64x32x16_EPS1_GSU3_LPA2_LPB0_PGR1_SNLL0_TT4_4_VW2_WG16_8_1_WGM1
    SolutionIndex: 177
    SolutionNameMin: Cijk_Alik_Bljk_SB_MT64x256x16_EPS1_GSU1_LPA0_LPB4_PGR1_SNLL1_TT8_8_VW4_WG8_32_1_WGM8
    SolutionIndex: 178
    SolutionNameMin: Cijk_Alik_Bljk_SB_MT64x64x16_EPS1_GSU3_LPA0_LPB0_PGR1_SNLL0_TT4_4_VW2_WG16_16_1_WGM64
    SolutionIndex: 179
    SolutionNameMin: Cijk_Alik_Bljk_SB_MT64x128x32_EPS1_GSU1_LPA4_LPB4_PGR1_SNLL1_TT4_8_VW4_WG16_16_1_WGM8
    SolutionIndex: 180
    SolutionNameMin: Cijk_Alik_Bljk_SB_MT128x32x16_EPS1_GSU1_LPA4_LPB4_PGR1_SNLL1_TT4_4_VW4_WG32_8_1_WGM1
    SolutionIndex: 181
    SolutionNameMin: Cijk_Alik_Bljk_SB_MT64x128x32_EPS1_GSU1_LPA4_LPB4_PGR1_SNLL1_TT4_8_VW4_WG16_16_1_WGM64
    SolutionIndex: 182
    SolutionNameMin: Cijk_Alik_Bljk_SB_MT64x32x16_EPS1_GSU5_LPA0_LPB4_PGR1_SNLL0_TT4_4_VW4_WG16_8_1_WGM8
    SolutionIndex: 183
    SolutionNameMin: Cijk_Alik_Bljk_SB_MT32x128x16_EPS1_GSU1_LPA4_LPB4_PGR1_SNLL1_TT4_4_VW4_WG8_32_1_WGM64
    SolutionIndex: 184
    SolutionNameMin: Cijk_Alik_Bljk_SB_MT128x32x16_EPS1_GSU3_LPA2_LPB2_PGR1_SNLL0_TT4_4_VW2_WG32_8_1_WGM1
    SolutionIndex: 185
    SolutionNameMin: Cijk_Alik_Bljk_SB_MT64x32x16_EPS1_GSU5_LPA0_LPB4_PGR1_SNLL0_TT4_4_VW4_WG16_8_1_WGM1
    SolutionIndex: 186
    SolutionNameMin: Cijk_Alik_Bljk_SB_MT128x128x16_EPS1_GSU1_LPA4_LPB4_PGR1_SNLL1_TT8_8_VW4_WG16_16_1_WGM8
    SolutionIndex: 187
    SolutionNameMin: Cijk_Alik_Bljk_SB_MT64x64x16_EPS1_GSU5_LPA2_LPB2_PGR1_SNLL0_TT4_4_VW2_WG16_16_1_WGM1
    SolutionIndex: 188
    SolutionNameMin: Cijk_Alik_Bljk_SB_MT128x64x16_EPS0_GSU1_LPA0_LPB4_PGR0_SNLL0_TT8_4_VW4_WG16_16_1_WGM1
    SolutionIndex: 189
    SolutionNameMin: Cijk_Alik_Bljk_SB_MT128x64x16_EPS1_GSU5_LPA2_LPB2_PGR1_SNLL0_TT4_8_VW2_WG32_8_1_WGM1
    SolutionIndex: 190
    SolutionNameMin: Cijk_Alik_Bljk_SB_MT64x64x32_EPS1_GSU5_LPA2_LPB2_PGR1_SNLL0_TT4_4_VW2_WG16_16_1_WGM64
    SolutionIndex: 191
    SolutionNameMin: Cijk_Alik_Bljk_SB_MT64x64x16_EPS1_GSU1_LPA4_LPB4_PGR1_SNLL1_TT4_4_VW4_WG16_16_1_WGM1
    SolutionIndex: 192
    SolutionNameMin: Cijk_Alik_Bljk_SB_MT128x64x16_EPS1_GSU1_LPA4_LPB4_PGR1_SNLL1_TT4_8_VW4_WG32_8_1_WGM1
    SolutionIndex: 193
    SolutionNameMin: Cijk_Alik_Bljk_SB_MT64x64x16_EPS1_GSU5_LPA4_LPB0_PGR1_SNLL0_TT4_4_VW4_WG16_16_1_WGM1
    SolutionIndex: 194
    SolutionNameMin: Cijk_Alik_Bljk_SB_MT64x64x16_EPS1_GSU1_LPA2_LPB2_PGR1_SNLL1_TT4_4_VW2_WG16_16_1_WGM8
    SolutionIndex: 195
    SolutionNameMin: Cijk_Alik_Bljk_SB_MT256x32x16_EPS0_GSU1_LPA4_LPB4_PGR0_SNLL0_TT8_4_VW4_WG32_8_1_WGM1
    SolutionIndex: 196
    SolutionNameMin: Cijk_Alik_Bljk_SB_MT64x32x16_EPS1_GSU1_LPA0_LPB4_PGR1_SNLL1_TT4_4_VW4_WG16_8_1_WGM64
    SolutionIndex: 197
    SolutionNameMin: Cijk_Alik_Bljk_SB_MT128x32x8_EPS1_GSU1_LPA0_LPB0_PGR1_SNLL1_TT4_4_VW4_WG32_8_1_WGM1
    SolutionIndex: 198
    SolutionNameMin: Cijk_Alik_Bljk_SB_MT128x32x16_EPS1_GSU1_LPA4_LPB4_PGR1_SNLL1_TT4_4_VW4_WG32_8_1_WGM64
    SolutionIndex: 199
    SolutionNameMin: Cijk_Alik_Bljk_SB_MT64x32x16_EPS1_GSU5_LPA4_LPB4_PGR1_SNLL0_TT4_4_VW4_WG16_8_1_WGM1
    SolutionIndex: 200
    SolutionNameMin: Cijk_Alik_Bljk_SB_MT64x64x16_EPS0_GSU5_LPA2_LPB2_PGR0_SNLL0_TT4_4_VW2_WG16_16_1_WGM1
    SolutionIndex: 201
    SolutionNameMin: Cijk_Alik_Bljk_SB_MT32x128x16_EPS1_GSU5_LPA4_LPB4_PGR1_SNLL0_TT4_4_VW4_WG8_32_1_WGM64
    SolutionIndex: 202
    SolutionNameMin: Cijk_Alik_Bljk_SB_MT64x128x16_EPS1_GSU5_LPA2_LPB2_PGR1_SNLL0_TT4_8_VW2_WG16_16_1_WGM8
    SolutionIndex: 203
    SolutionNameMin: Cijk_Alik_Bljk_SB_MT64x128x16_EPS1_GSU1_LPA0_LPB4_PGR1_SNLL1_TT4_8_VW4_WG16_16_1_WGM8
    SolutionIndex: 204
    SolutionNameMin: Cijk_Alik_Bljk_SB_MT128x128x16_EPS1_GSU5_LPA0_LPB0_PGR1_SNLL0_TT8_8_VW2_WG16_16_1_WGM1
    SolutionIndex: 205
    SolutionNameMin: Cijk_Alik_Bljk_SB_MT64x32x16_EPS1_GSU3_LPA2_LPB2_PGR1_SNLL0_TT4_4_VW2_WG16_8_1_WGM1
    SolutionIndex: 206
    SolutionNameMin: Cijk_Alik_Bljk_SB_MT64x32x16_EPS1_GSU1_LPA4_LPB4_PGR1_SNLL1_TT4_4_VW4_WG16_8_1_WGM64
    SolutionIndex: 207
    SolutionNameMin: Cijk_Alik_Bljk_SB_MT64x64x16_EPS1_GSU3_LPA0_LPB0_PGR1_SNLL0_TT4_4_VW2_WG16_16_1_WGM1
    SolutionIndex: 208
    SolutionNameMin: Cijk_Alik_Bljk_SB_MT128x32x16_EPS0_GSU1_LPA4_LPB0_PGR0_SNLL0_TT4_4_VW4_WG32_8_1_WGM64
    SolutionIndex: 209
    SolutionNameMin: Cijk_Alik_Bljk_SB_MT64x128x16_EPS1_GSU3_LPA2_LPB2_PGR1_SNLL0_TT8_4_VW2_WG8_32_1_WGM8
    SolutionIndex: 210
    SolutionNameMin: Cijk_Alik_Bljk_SB_MT64x32x16_EPS1_GSU5_LPA0_LPB2_PGR1_SNLL0_TT4_4_VW2_WG16_8_1_WGM1
    SolutionIndex: 211
    SolutionNameMin: Cijk_Alik_Bljk_SB_MT128x128x16_EPS1_GSU3_LPA0_LPB0_PGR1_SNLL0_TT8_8_VW2_WG16_16_1_WGM1
    SolutionIndex: 212
    SolutionNameMin: Cijk_Alik_Bljk_SB_MT64x32x16_EPS1_GSU1_LPA0_LPB0_PGR1_SNLL1_TT4_4_VW4_WG16_8_1_WGM64
    SolutionIndex: 213
    SolutionNameMin: Cijk_Alik_Bljk_SB_MT64x128x16_EPS1_GSU1_LPA0_LPB4_PGR1_SNLL1_TT4_8_VW4_WG16_16_1_WGM64
    SolutionIndex: 214
    SolutionNameMin: Cijk_Alik_Bljk_SB_MT128x64x16_EPS0_GSU1_LPA4_LPB0_PGR0_SNLL0_TT4_8_VW4_WG32_8_1_WGM8
    SolutionIndex: 215
    SolutionNameMin: Cijk_Alik_Bljk_SB_MT128x64x16_EPS1_GSU1_LPA4_LPB4_PGR1_SNLL1_TT8_4_VW4_WG16_16_1_WGM1
    SolutionIndex: 216
    SolutionNameMin: Cijk_Alik_Bljk_SB_MT32x128x16_EPS1_GSU5_LPA2_LPB2_PGR1_SNLL0_TT4_4_VW2_WG8_32_1_WGM8
    SolutionIndex: 217
    SolutionNameMin: Cijk_Alik_Bljk_SB_MT64x128x16_EPS1_GSU1_LPA4_LPB4_PGR1_SNLL1_TT8_4_VW4_WG8_32_1_WGM8
    SolutionIndex: 218
    SolutionNameMin: Cijk_Alik_Bljk_SB_MT64x64x16_EPS1_GSU1_LPA4_LPB0_PGR1_SNLL1_TT4_4_VW4_WG16_16_1_WGM8
    SolutionIndex: 219
    SolutionNameMin: Cijk_Alik_Bljk_SB_MT64x64x8_EPS1_GSU1_LPA2_LPB0_PGR1_SNLL1_TT4_8_VW2_WG16_8_1_WGM8
    SolutionIndex: 220
    SolutionNameMin: Cijk_Alik_Bljk_SB_MT64x64x32_EPS1_GSU1_LPA4_LPB4_PGR1_SNLL1_TT4_4_VW4_WG16_16_1_WGM8
    SolutionIndex: 221
    SolutionNameMin: Cijk_Alik_Bljk_SB_MT128x64x16_EPS1_GSU1_LPA4_LPB0_PGR1_SNLL1_TT8_4_VW4_WG16_16_1_WGM8
    SolutionIndex: 222
    SolutionNameMin: Cijk_Alik_Bljk_SB_MT128x64x16_EPS1_GSU1_LPA4_LPB0_PGR1_SNLL1_TT4_8_VW4_WG32_8_1_WGM8
    SolutionIndex: 223
    SolutionNameMin: Cijk_Alik_Bljk_SB_MT128x64x16_EPS0_GSU1_LPA0_LPB0_PGR0_SNLL0_TT4_8_VW4_WG32_8_1_WGM8
    SolutionIndex: 224
    SolutionNameMin: Cijk_Alik_Bljk_SB_MT64x32x16_EPS1_GSU1_LPA0_LPB4_PGR1_SNLL1_TT4_4_VW4_WG16_8_1_WGM1
    SolutionIndex: 225
    SolutionNameMin: Cijk_Alik_Bljk_SB_MT128x64x16_EPS1_GSU3_LPA4_LPB4_PGR1_SNLL0_TT8_4_VW4_WG16_16_1_WGM1
    SolutionIndex: 226
    SolutionNameMin: Cijk_Alik_Bljk_SB_MT128x32x8_EPS1_GSU1_LPA2_LPB2_PGR1_SNLL1_TT4_4_VW2_WG32_8_1_WGM64
    SolutionIndex: 227
    SolutionNameMin: Cijk_Alik_Bljk_SB_MT64x128x16_EPS1_GSU5_LPA2_LPB2_PGR1_SNLL0_TT8_4_VW2_WG8_32_1_WGM8
    SolutionIndex: 228
    SolutionNameMin: Cijk_Alik_Bljk_SB_MT64x128x32_EPS1_GSU1_LPA2_LPB2_PGR1_SNLL1_TT8_4_VW2_WG8_32_1_WGM8
    SolutionIndex: 229
    SolutionNameMin: Cijk_Alik_Bljk_SB_MT64x64x32_EPS1_GSU1_LPA4_LPB4_PGR1_SNLL1_TT4_4_VW4_WG16_16_1_WGM64
    SolutionIndex: 230
    SolutionNameMin: Cijk_Alik_Bljk_SB_MT128x64x8_EPS1_GSU1_LPA0_LPB4_PGR1_SNLL1_TT4_8_VW4_WG32_8_1_WGM8
    SolutionIndex: 231
    SolutionNameMin: Cijk_Alik_Bljk_SB_MT64x32x16_EPS1_GSU5_LPA0_LPB2_PGR1_SNLL0_TT4_4_VW2_WG16_8_1_WGM64
    SolutionIndex: 232
    SolutionNameMin: Cijk_Alik_Bljk_SB_MT128x128x16_EPS1_GSU1_LPA0_LPB0_PGR1_SNLL1_TT8_8_VW2_WG16_16_1_WGM1
    SolutionIndex: 233
    SolutionNameMin: Cijk_Alik_Bljk_SB_MT64x64x16_EPS0_GSU1_LPA2_LPB0_PGR0_SNLL0_TT4_4_VW2_WG16_16_1_WGM8
    SolutionIndex: 234
    SolutionNameMin: Cijk_Alik_Bljk_SB_MT64x64x16_EPS1_GSU5_LPA0_LPB4_PGR1_SNLL0_TT4_4_VW4_WG16_16_1_WGM1
    SolutionIndex: 235
    SolutionNameMin: Cijk_Alik_Bljk_SB_MT256x64x8_EPS1_GSU1_LPA4_LPB0_PGR1_SNLL1_TT8_8_VW4_WG32_8_1_WGM1
    SolutionIndex: 236
    SolutionNameMin: Cijk_Alik_Bljk_SB_MT128x64x16_EPS1_GSU1_LPA0_LPB4_PGR1_SNLL1_TT4_8_VW4_WG32_8_1_WGM64
    SolutionIndex: 237
    SolutionNameMin: Cijk_Alik_Bljk_SB_MT128x32x16_EPS1_GSU3_LPA2_LPB0_PGR1_SNLL0_TT4_4_VW2_WG32_8_1_WGM1
    SolutionIndex: 238
    SolutionNameMin: Cijk_Alik_Bljk_SB_MT64x64x16_EPS1_GSU1_LPA2_LPB2_PGR1_SNLL1_TT4_4_VW2_WG16_16_1_WGM64
    SolutionIndex: 239
    SolutionNameMin: Cijk_Alik_Bljk_SB_MT64x32x16_EPS1_GSU5_LPA2_LPB0_PGR1_SNLL0_TT4_4_VW2_WG16_8_1_WGM64
    SolutionIndex: 240
    SolutionNameMin: Cijk_Alik_Bljk_SB_MT64x32x16_EPS1_GSU5_LPA4_LPB0_PGR1_SNLL0_TT4_4_VW4_WG16_8_1_WGM64
    SolutionIndex: 241
    SolutionNameMin: Cijk_Alik_Bljk_SB_MT128x64x16_EPS1_GSU1_LPA2_LPB2_PGR1_SNLL1_TT8_4_VW2_WG16_16_1_WGM8
    SolutionIndex: 242
    SolutionNameMin: Cijk_Alik_Bljk_SB_MT64x32x16_EPS1_GSU3_LPA0_LPB0_PGR1_SNLL0_TT4_4_VW2_WG16_8_1_WGM1
    SolutionIndex: 243
    SolutionNameMin: Cijk_Alik_Bljk_SB_MT64x64x16_EPS1_GSU5_LPA2_LPB0_PGR1_SNLL0_TT4_4_VW2_WG16_16_1_WGM8
    SolutionIndex: 244
    SolutionNameMin: Cijk_Alik_Bljk_SB_MT128x32x16_EPS1_GSU1_LPA2_LPB0_PGR1_SNLL1_TT4_4_VW2_WG32_8_1_WGM64
    SolutionIndex: 245
    SolutionNameMin: Cijk_Alik_Bljk_SB_MT64x32x16_EPS1_GSU5_LPA4_LPB4_PGR1_SNLL0_TT4_4_VW4_WG16_8_1_WGM8
    SolutionIndex: 246
    SolutionNameMin: Cijk_Alik_Bljk_SB_MT32x128x16_EPS1_GSU3_LPA2_LPB2_PGR1_SNLL0_TT4_4_VW2_WG8_32_1_WGM1
    SolutionIndex: 247
    SolutionNameMin: Cijk_Alik_Bljk_SB_MT64x32x16_EPS1_GSU1_LPA2_LPB2_PGR1_SNLL1_TT4_4_VW2_WG16_8_1_WGM8
    SolutionIndex: 248
    SolutionNameMin: Cijk_Alik_Bljk_SB_MT32x128x32_EPS1_GSU5_LPA0_LPB4_PGR1_SNLL0_TT4_4_VW4_WG8_32_1_WGM8
    SolutionIndex: 249
    SolutionNameMin: Cijk_Alik_Bljk_SB_MT32x128x16_EPS1_GSU1_LPA4_LPB4_PGR1_SNLL1_TT4_4_VW4_WG8_32_1_WGM1
    SolutionIndex: 250
    SolutionNameMin: Cijk_Alik_Bljk_SB_MT128x64x8_EPS1_GSU1_LPA4_LPB4_PGR1_SNLL1_TT4_8_VW4_WG32_8_1_WGM8
    SolutionIndex: 251
    SolutionNameMin: Cijk_Alik_Bljk_SB_MT128x128x16_EPS1_GSU1_LPA4_LPB4_PGR1_SNLL1_TT8_8_VW4_WG16_16_1_WGM64
    SolutionIndex: 252
    SolutionNameMin: Cijk_Alik_Bljk_SB_MT64x64x16_EPS1_GSU1_LPA4_LPB0_PGR1_SNLL1_TT4_4_VW4_WG16_16_1_WGM64
    SolutionIndex: 253
    SolutionNameMin: Cijk_Alik_Bljk_SB_MT32x128x32_EPS1_GSU5_LPA4_LPB4_PGR1_SNLL0_TT4_4_VW4_WG8_32_1_WGM1
    SolutionIndex: 254
    SolutionNameMin: Cijk_Alik_Bljk_SB_MT128x128x8_EPS1_GSU1_LPA4_LPB0_PGR1_SNLL1_TT8_8_VW4_WG16_16_1_WGM8
    SolutionIndex: 255
    SolutionNameMin: Cijk_Alik_Bljk_SB_MT64x128x16_EPS1_GSU1_LPA2_LPB2_PGR1_SNLL1_TT4_8_VW2_WG16_16_1_WGM64
    SolutionIndex: 256
    SolutionNameMin: Cijk_Alik_Bljk_SB_MT128x32x8_EPS1_GSU1_LPA4_LPB4_PGR1_SNLL1_TT4_4_VW4_WG32_8_1_WGM8
    SolutionIndex: 257
    SolutionNameMin: Cijk_Alik_Bljk_SB_MT32x128x32_EPS1_GSU1_LPA4_LPB4_PGR1_SNLL1_TT4_4_VW4_WG8_32_1_WGM1
    SolutionIndex: 258
    SolutionNameMin: Cijk_Alik_Bljk_SB_MT64x64x32_EPS1_GSU1_LPA4_LPB4_PGR1_SNLL1_TT4_4_VW4_WG16_16_1_WGM1
    SolutionIndex: 259
    SolutionNameMin: Cijk_Alik_Bljk_SB_MT64x32x16_EPS0_GSU1_LPA2_LPB0_PGR0_SNLL0_TT4_4_VW2_WG16_8_1_WGM8
    SolutionIndex: 260
    SolutionNameMin: Cijk_Alik_Bljk_SB_MT128x64x8_EPS1_GSU1_LPA0_LPB2_PGR1_SNLL1_TT8_4_VW2_WG16_16_1_WGM8
    SolutionIndex: 261
    SolutionNameMin: Cijk_Alik_Bljk_SB_MT32x128x32_EPS1_GSU1_LPA0_LPB4_PGR1_SNLL1_TT4_4_VW4_WG8_32_1_WGM64
    SolutionIndex: 262
    SolutionNameMin: Cijk_Alik_Bljk_SB_MT32x128x32_EPS1_GSU1_LPA4_LPB0_PGR1_SNLL1_TT4_4_VW4_WG8_32_1_WGM64
    SolutionIndex: 263
    SolutionNameMin: Cijk_Alik_Bljk_SB_MT128x64x16_EPS1_GSU3_LPA2_LPB2_PGR1_SNLL0_TT8_4_VW2_WG16_16_1_WGM64
    SolutionIndex: 264
    SolutionNameMin: Cijk_Alik_Bljk_SB_MT64x128x16_EPS1_GSU1_LPA0_LPB4_PGR1_SNLL1_TT8_4_VW4_WG8_32_1_WGM64
    SolutionIndex: 265
    SolutionNameMin: Cijk_Alik_Bljk_SB_MT128x64x16_EPS1_GSU1_LPA0_LPB0_PGR1_SNLL1_TT4_8_VW4_WG32_8_1_WGM64
    SolutionIndex: 266
    SolutionNameMin: Cijk_Alik_Bljk_SB_MT64x64x16_EPS1_GSU5_LPA2_LPB2_PGR1_SNLL0_TT4_4_VW2_WG16_16_1_WGM8
    SolutionIndex: 267
    SolutionNameMin: Cijk_Alik_Bljk_SB_MT64x128x16_EPS1_GSU3_LPA2_LPB2_PGR1_SNLL0_TT4_8_VW2_WG16_16_1_WGM1
    SolutionIndex: 268
    SolutionNameMin: Cijk_Alik_Bljk_SB_MT32x128x32_EPS1_GSU5_LPA2_LPB2_PGR1_SNLL0_TT4_4_VW2_WG8_32_1_WGM1
    SolutionIndex: 269
    SolutionNameMin: Cijk_Alik_Bljk_SB_MT64x128x16_EPS1_GSU1_LPA0_LPB4_PGR1_SNLL1_TT8_4_VW4_WG8_32_1_WGM8
    SolutionIndex: 270
    SolutionNameMin: Cijk_Alik_Bljk_SB_MT16x16x32_SE_EPS1_GSU1_PGR1_SNLL1_TT4_4_VW4_WG4_4_8_WGM1
    SolutionIndex: 271
    SolutionNameMin: Cijk_Alik_Bljk_SB_MT32x32x8_SE_EPS1_GSU1_PGR1_SNLL1_TT4_4_VW4_WG8_8_1_WGM8
    SolutionIndex: 272
    SolutionNameMin: Cijk_Alik_Bljk_SB_MT16x32x16_SE_EPS1_GSU1_PGR1_SNLL1_TT8_4_VW4_WG2_8_4_WGM64
    SolutionIndex: 273
    SolutionNameMin: Cijk_Alik_Bljk_SB_MT16x8x32_SE_EPS1_GSU1_PGR1_SNLL1_TT4_2_VW2_WG4_4_8_WGM16
    SolutionIndex: 274
    SolutionNameMin: Cijk_Alik_Bljk_SB_MT64x64x16_SE_EPS1_GSU1_PGR1_SNLL1_TT4_4_VW4_WG16_16_1_WGM16
    SolutionIndex: 275
    SolutionNameMin: Cijk_Alik_Bljk_SB_MT16x16x32_SE_EPS1_GSU8_PGR1_SNLL0_TT4_4_VW4_WG4_4_8_WGM8
    SolutionIndex: 276
    SolutionNameMin: Cijk_Alik_Bljk_SB_MT32x32x8_SE_EPS1_GSU1_PGR1_SNLL1_TT4_4_VW4_WG8_8_1_WGM1
    SolutionIndex: 277
    SolutionNameMin: Cijk_Alik_Bljk_SB_MT128x64x8_SE_EPS1_GSU1_PGR1_SNLL1_TT8_4_VW4_WG16_16_1_WGM1
    SolutionIndex: 278
    SolutionNameMin: Cijk_Alik_Bljk_SB_MT32x8x8_SE_EPS1_GSU1_PGR1_SNLL1_TT4_4_VW4_WG8_2_4_WGM8
    SolutionIndex: 279
    SolutionNameMin: Cijk_Alik_Bljk_SB_MT16x8x32_SE_EPS1_GSU1_PGR1_SNLL1_TT4_2_VW2_WG4_4_8_WGM8
    SolutionIndex: 280
    SolutionNameMin: Cijk_Alik_Bljk_SB_MT16x16x32_SE_EPS1_GSU1_PGR1_SNLL1_TT4_4_VW4_WG4_4_8_WGM64
    SolutionIndex: 281
    SolutionNameMin: Cijk_Alik_Bljk_SB_MT64x128x16_SE_EPS1_FL0_GRVW2_LPA4_LPB4_PGR1_PLR1_SNLL1_TT4_8_USFGRO0_VW4_WG16_16_1_WGM1
    SolutionIndex: 282
    SolutionNameMin: Cijk_Alik_Bljk_SB_MT64x128x16_SE_EPS1_FL1_GRVW2_LPA4_LPB4_PGR1_PLR1_SNLL1_TT4_8_USFGRO0_VW4_WG16_16_1_WGM1
    SolutionIndex: 283
    SolutionNameMin: Cijk_Alik_Bljk_SB_MT64x128x16_SE_EPS1_FL0_GRVW2_LPA0_LPB4_PGR1_PLR1_SNLL1_TT4_8_USFGRO1_VW4_WG16_16_1_WGM1
    SolutionIndex: 284
    SolutionNameMin: Cijk_Alik_Bljk_SB_MT64x32x16_SE_EPS0_FL0_GRVW4_LPA4_LPB4_PGR0_PLR1_SNLL0_TT4_4_USFGRO1_VW4_WG16_8_1_WGM1
    SolutionIndex: 285
    SolutionNameMin: Cijk_Alik_Bljk_SB_MT64x64x16_SE_EPS0_FL1_GRVW4_LPA1_LPB1_PGR0_PLR1_SNLL0_TT4_4_USFGRO1_VW1_WG16_16_1_WGM1
    SolutionIndex: 286
    SolutionNameMin: Cijk_Alik_Bljk_SB_MT128x128x16_SE_EPS1_FL0_GRVW4_LPA0_LPB0_PGR1_PLR1_SNLL1_TT8_8_USFGRO1_VW4_WG16_16_1_WGM1
    SolutionIndex: 287
    SolutionNameMin: Cijk_Alik_Bljk_SB_MT128x128x16_SE_EPS1_FL1_GRVW4_LPA0_LPB0_PGR1_PLR1_SNLL1_TT8_8_USFGRO0_VW4_WG16_16_1_WGM1
    SolutionIndex: 288
    SolutionNameMin: Cijk_Alik_Bljk_SB_MT128x128x16_SE_EPS1_FL0_GRVW4_LPA0_LPB0_PGR1_PLR1_SNLL1_TT8_8_USFGRO1_VW4_WG16_16_1_WGM8
    SolutionIndex: 289
    SolutionNameMin: Cijk_Alik_Bljk_SB_MT32x32x16_SE_EPS0_FL0_GRVW4_LPA1_LPB1_PGR0_PLR1_SNLL0_TT4_2_USFGRO1_VW1_WG8_16_1_WGM8
    SolutionIndex: 290
    SolutionNameMin: Cijk_Alik_Bljk_SB_MT64x128x16_SE_EPS1_FL1_GRVW2_LPA4_LPB4_PGR1_PLR1_SNLL1_TT4_8_USFGRO1_VW4_WG16_16_1_WGM1
    SolutionIndex: 291
    SolutionNameMin: Cijk_Alik_Bljk_SB_MT64x64x16_SE_EPS0_FL0_GRVW4_LPA1_LPB1_PGR0_PLR1_SNLL0_TT4_4_USFGRO1_VW1_WG16_16_1_WGM1
    SolutionIndex: 292
    SolutionNameMin: Cijk_Alik_Bljk_SB_MT64x128x16_SE_EPS1_FL0_GRVW2_LPA2_LPB2_PGR1_PLR1_SNLL1_TT4_8_USFGRO1_VW2_WG16_16_1_WGM1
    SolutionIndex: 293
    SolutionNameMin: Cijk_Alik_Bljk_SB_MT128x128x16_SE_EPS1_FL1_GRVW4_LPA0_LPB0_PGR1_PLR1_SNLL1_TT8_8_USFGRO1_VW4_WG16_16_1_WGM1
    SolutionIndex: 294
    SolutionNameMin: Cijk_Alik_Bljk_SB_MT128x128x16_SE_EPS1_FL0_GRVW4_LPA0_LPB0_PGR1_PLR1_SNLL1_TT8_8_USFGRO0_VW4_WG16_16_1_WGM1
    SolutionIndex: 295
    SolutionNameMin: Cijk_Alik_Bljk_SB_MT64x128x16_SE_EPS1_FL0_GRVW2_LPA4_LPB4_PGR1_PLR1_SNLL1_TT4_8_USFGRO1_VW4_WG16_16_1_WGM1
    SolutionIndex: 296
    SolutionNameMin: Cijk_Alik_Bljk_SB_MT32x32x16_SE_EPS0_FL0_GRVW1_LPA1_LPB1_PGR0_PLR1_SNLL0_TT2_4_USFGRO1_VW1_WG16_8_1_WGM1
    SolutionIndex: 297
    SolutionNameMin: Cijk_Alik_Bljk_SB_MT64x128x16_SE_EPS1_FL0_GRVW4_LPA4_LPB4_PGR1_PLR1_SNLL1_TT4_8_USFGRO0_VW4_WG16_16_1_WGM1
    SolutionIndex: 298
    SolutionNameMin: Cijk_Alik_Bljk_SB_MT128x128x16_SE_EPS1_FL1_GRVW4_LPA0_LPB0_PGR1_PLR1_SNLL1_TT8_8_USFGRO1_VW4_WG16_16_1_WGM8
    SolutionIndex: 299
    SolutionNameMin: Cijk_Alik_Bljk_SB_MT64x128x16_SE_EPS1_FL0_GRVW2_LPA2_LPB2_PGR1_PLR1_SNLL1_TT4_8_USFGRO0_VW2_WG16_16_1_WGM1
    SolutionIndex: 300
    SolutionNameMin: Cijk_Alik_Bljk_SB_MT32x64x16_SE_EPS0_FL1_GRVW4_LPA4_LPB4_PGR0_PLR1_SNLL0_TT4_4_USFGRO1_VW4_WG8_16_1_WGM1
    SolutionIndex: 301
    SolutionNameMin: Cijk_Alik_Bljk_SB_MT64x128x16_SE_EPS1_FL1_GRVW2_LPA0_LPB4_PGR1_PLR1_SNLL1_TT4_8_USFGRO0_VW4_WG16_16_1_WGM1
    SolutionIndex: 302
    SolutionNameMin: Cijk_Alik_Bljk_SB_MT128x128x16_SE_EPS1_FL0_GRVW4_LPA0_LPB0_PGR1_PLR1_SNLL1_TT8_8_USFGRO0_VW4_WG16_16_1_WGM8
    SolutionIndex: 303
    SolutionNameMin: Cijk_Alik_Bljk_SB_MT128x128x16_SE_EPS1_FL1_GRVW4_LPA0_LPB0_PGR1_PLR1_SNLL1_TT8_8_USFGRO0_VW4_WG16_16_1_WGM8
    SolutionIndex: 304
    SolutionNameMin: Cijk_Alik_Bljk_SB_MT64x32x16_SE_EPS0_FL1_GRVW4_LPA4_LPB4_PGR0_PLR1_SNLL0_TT4_4_USFGRO1_VW4_WG16_8_1_WGM1
    SolutionIndex: 305
    SolutionNameMin: Cijk_Alik_Bljk_SB_MT32x32x32_SE_EPS0_FL0_GRVW4_LPA1_LPB1_PGR0_PLR1_SNLL0_TT2_4_USFGRO1_VW1_WG16_8_1_WGM1
    SolutionIndex: 306
    SolutionNameMin: Cijk_Alik_Bljk_SB_MT128x64x16_SE_EPS1_FL0_GRVW2_LPA4_LPB4_PGR1_PLR1_SNLL1_TT8_4_USFGRO1_VW4_WG16_16_1_WGM8
    SolutionIndex: 307
    SolutionNameMin: Cijk_Alik_Bljk_SB_MT64x128x16_SE_EPS1_FL1_GRVW4_LPA4_LPB4_PGR1_PLR1_SNLL1_TT4_8_USFGRO1_VW4_WG16_16_1_WGM1
    SolutionIndex: 308
    SolutionNameMin: Cijk_Alik_Bljk_SB_MT64x128x16_SE_EPS1_FL1_GRVW4_LPA0_LPB2_PGR1_PLR1_SNLL1_TT4_8_USFGRO1_VW2_WG16_16_1_WGM1
    SolutionIndex: 309
    SolutionNameMin: Cijk_Alik_Bljk_SB_MT32x32x16_SE_EPS0_FL0_GRVW4_LPA1_LPB1_PGR0_PLR1_SNLL0_TT2_4_USFGRO1_VW1_WG16_8_1_WGM1
    SolutionIndex: 310
    SolutionNameMin: Cijk_Alik_Bljk_SB_MT64x128x16_SE_EPS1_FL0_GRVW1_LPA4_LPB4_PGR1_PLR1_SNLL1_TT4_8_USFGRO0_VW4_WG16_16_1_WGM1
    SolutionIndex: 311
    SolutionNameMin: Cijk_Alik_Bljk_SB_MT64x128x16_SE_EPS1_FL0_GRVW1_LPA4_LPB4_PGR1_PLR1_SNLL1_TT4_8_USFGRO1_VW4_WG16_16_1_WGM1
    SolutionIndex: 312
    SolutionNameMin: Cijk_Alik_Bljk_SB_MT64x128x16_SE_EPS1_FL1_GRVW2_LPA0_LPB4_PGR1_PLR1_SNLL1_TT4_8_USFGRO1_VW4_WG16_16_1_WGM1
    SolutionIndex: 313
    SolutionNameMin: Cijk_Alik_Bljk_SB_MT128x128x16_SE_EPS1_FL0_GRVW4_LPA0_LPB0_PGR1_PLR1_SNLL1_TT8_8_USFGRO0_VW2_WG16_16_1_WGM8
    SolutionIndex: 314
    SolutionNameMin: Cijk_Alik_Bljk_SB_MT128x64x16_SE_EPS1_FL1_GRVW2_LPA4_LPB4_PGR1_PLR1_SNLL1_TT8_4_USFGRO1_VW4_WG16_16_1_WGM8
    SolutionIndex: 315
    SolutionNameMin: Cijk_Alik_Bljk_SB_MT64x128x16_SE_EPS1_FL0_GRVW2_LPA0_LPB4_PGR1_PLR1_SNLL1_TT4_8_USFGRO0_VW4_WG16_16_1_WGM1
    SolutionIndex: 316
    SolutionNameMin: Cijk_Alik_Bljk_SB_MT64x128x16_SE_EPS1_FL1_GRVW2_LPA2_LPB2_PGR1_PLR1_SNLL1_TT4_8_USFGRO0_VW2_WG16_16_1_WGM1
    SolutionIndex: 317
    SolutionNameMin: Cijk_Alik_Bljk_SB_MT64x32x16_SE_EPS0_FL1_GRVW4_LPA4_LPB4_PGR0_PLR1_SNLL0_TT4_4_USFGRO1_VW4_WG16_8_1_WGM8
    SolutionIndex: 318
    SolutionNameMin: Cijk_Alik_Bljk_SB_MT64x32x8_SE_EPS0_FL1_GRVW4_LPA4_LPB4_PGR0_PLR0_SNLL0_TT4_4_USFGRO1_VW4_WG16_8_1_WGM8
    SolutionIndex: 319
    SolutionNameMin: Cijk_Alik_Bljk_SB_MT64x64x16_SE_EPS0_FL0_GRVW4_LPA1_LPB1_PGR0_PLR1_SNLL0_TT4_4_USFGRO1_VW1_WG16_16_1_WGM8
    SolutionIndex: 320
    SolutionNameMin: Cijk_Alik_Bljk_SB_MT32x32x16_SE_EPS0_FL0_GRVW1_LPA1_LPB1_PGR0_PLR1_SNLL0_TT2_4_USFGRO1_VW1_WG16_8_1_WGM8
    SolutionIndex: 321
    SolutionNameMin: Cijk_Alik_Bljk_SB_MT128x64x16_SE_EPS1_FL1_GRVW2_LPA4_LPB4_PGR1_PLR1_SNLL1_TT8_4_USFGRO0_VW4_WG16_16_1_WGM1
    SolutionIndex: 322
    SolutionNameMin: Cijk_Alik_Bljk_SB_MT32x32x16_SE_EPS0_FL1_GRVW4_LPA1_LPB1_PGR0_PLR1_SNLL0_TT4_2_USFGRO1_VW1_WG8_16_1_WGM1
    SolutionIndex: 323
    SolutionNameMin: Cijk_Alik_Bljk_SB_MT32x32x16_SE_EPS0_FL1_GRVW4_LPA1_LPB1_PGR0_PLR1_SNLL0_TT2_4_USFGRO1_VW1_WG16_8_1_WGM1
    SolutionIndex: 324
    SolutionNameMin: Cijk_Alik_Bljk_SB_MT64x64x16_SE_EPS0_FL1_GRVW4_LPA1_LPB1_PGR0_PLR1_SNLL0_TT4_4_USFGRO1_VW1_WG16_16_1_WGM8
    SolutionIndex: 325
    SolutionNameMin: Cijk_Alik_Bljk_SB_MT64x128x16_SE_EPS1_FL1_GRVW2_LPA2_LPB2_PGR1_PLR1_SNLL1_TT4_8_USFGRO1_VW2_WG16_16_1_WGM1
    SolutionIndex: 326
    SolutionNameMin: Cijk_Alik_Bljk_SB_MT32x32x16_SE_EPS0_FL0_GRVW4_LPA1_LPB1_PGR0_PLR1_SNLL0_TT2_4_USFGRO1_VW1_WG16_8_1_WGM8
    SolutionIndex: 327
    SolutionNameMin: Cijk_Alik_Bljk_SB_MT128x128x16_SE_EPS1_FL1_GRVW4_LPA0_LPB0_PGR1_PLR1_SNLL1_TT8_8_USFGRO0_VW2_WG16_16_1_WGM8
    SolutionIndex: 328
    SolutionNameMin: Cijk_Alik_Bljk_SB_MT32x32x16_SE_EPS0_FL0_GRVW4_LPA1_LPB1_PGR0_PLR1_SNLL0_TT4_2_USFGRO1_VW1_WG8_16_1_WGM1
    SolutionIndex: 329
    SolutionNameMin: Cijk_Alik_Bljk_SB_MT32x32x16_SE_EPS0_FL1_GRVW4_LPA1_LPB1_PGR0_PLR1_SNLL0_TT2_4_USFGRO1_VW1_WG16_8_1_WGM8
    SolutionIndex: 330
    SolutionNameMin: Cijk_Alik_Bljk_SB_MT128x64x16_SE_EPS1_FL0_GRVW2_LPA4_LPB4_PGR1_PLR1_SNLL1_TT8_4_USFGRO0_VW4_WG16_16_1_WGM1
    SolutionIndex: 331
    SolutionNameMin: Cijk_Alik_Bljk_SB_MT128x64x16_SE_EPS1_FL0_GRVW2_LPA4_LPB4_PGR1_PLR1_SNLL1_TT8_4_USFGRO1_VW4_WG16_16_1_WGM1
    SolutionIndex: 332
    SolutionNameMin: Cijk_Alik_Bljk_SB_MT128x128x16_SE_EPS1_FL1_GRVW4_LPA0_LPB0_PGR1_PLR1_SNLL1_TT8_8_USFGRO0_VW2_WG16_16_1_WGM1
    SolutionIndex: 333
    SolutionNameMin: Cijk_Alik_Bljk_SB_MT128x128x16_SE_EPS1_FL0_GRVW4_LPA0_LPB0_PGR1_PLR1_SNLL1_TT8_8_USFGRO1_VW2_WG16_16_1_WGM8
    SolutionIndex: 334
    SolutionNameMin: Cijk_Alik_Bljk_SB_MT128x128x16_SE_EPS1_FL1_GRVW4_LPA0_LPB0_PGR1_PLR1_SNLL1_TT8_8_USFGRO1_VW2_WG16_16_1_WGM8
    SolutionIndex: 335
    SolutionNameMin: Cijk_Alik_Bljk_SB_MT64x128x16_SE_EPS1_FL0_GRVW1_LPA2_LPB2_PGR1_PLR1_SNLL1_TT4_8_USFGRO1_VW2_WG16_16_1_WGM1
    SolutionIndex: 336
    SolutionNameMin: Cijk_Alik_Bljk_SB_MT32x32x16_SE_EPS0_FL1_GRVW4_LPA1_LPB0_PGR0_PLR1_SNLL0_TT2_4_USFGRO1_VW1_WG16_8_1_WGM8
    SolutionIndex: 337
    SolutionNameMin: Cijk_Alik_Bljk_SB_MT64x32x16_SE_EPS1_FL1_GRVW4_GSU1_PGR1_PLR1_TT4_4_VW2_WG16_8_2_WGM8
    SolutionIndex: 338
    SolutionNameMin: Cijk_Alik_Bljk_SB_MT128x128x16_SE_EPS1_FL0_GRVW2_GSU1_PGR1_PLR1_TT8_8_VW4_WG16_16_1_WGM8
    SolutionIndex: 339
    SolutionNameMin: Cijk_Alik_Bljk_SB_MT16x64x16_SE_EPS1_FL1_GRVW4_GSU1_PGR1_PLR1_TT4_4_VW4_WG4_16_4_WGM8
    SolutionIndex: 340
    SolutionNameMin: Cijk_Alik_Bljk_SB_MT96x64x16_SE_EPS1_FL1_GRVW4_GSU1_PGR1_PLR1_TT6_4_VW2_WG16_16_1_WGM8
    SolutionIndex: 341
    SolutionNameMin: Cijk_Alik_Bljk_SB_MT128x128x16_SE_EPS1_FL0_GRVW4_GSU1_PGR1_PLR0_TT8_8_VW4_WG16_16_1_WGM8
    SolutionIndex: 342
    SolutionNameMin: Cijk_Alik_Bljk_SB_MT8x32x32_SE_EPS1_FL0_GRVW4_LPA2_LPB2_PGR1_PLR1_TT2_2_USFGRO1_VW2_WG4_16_4_WGM1
    SolutionIndex: 343
    SolutionNameMin: Cijk_Alik_Bljk_SB_MT8x32x32_SE_EPS1_FL0_GRVW1_LPA0_LPB2_PGR1_PLR1_TT2_2_USFGRO1_VW2_WG4_16_4_WGM1
    SolutionIndex: 344
    SolutionNameMin: Cijk_Alik_Bljk_SB_MT64x64x16_SE_EPS1_FL0_GRVW4_GSU1_LPA0_LPB0_PGR1_PLR1_TT4_4_WG16_16_1_WGM1
    SolutionIndex: 345
    SolutionNameMin: Cijk_Alik_Bljk_SB_MT16x64x16_SE_EPS1_FL0_GRVW4_GSU1_LPA0_LPB0_PGR1_PLR1_TT4_4_WG4_16_4_WGM1
    SolutionIndex: 346
    SolutionNameMin: Cijk_Alik_Bljk_SB_MT64x32x16_SE_EPS1_FL0_GRVW4_GSU8_LPA0_LPB0_PGR1_PLR1_TT4_4_WG16_8_2_WGM8
    SolutionIndex: 347
    SolutionNameMin: Cijk_Alik_Bljk_SB_MT64x16x16_SE_EPS1_FL0_GRVW4_GSU1_LPA0_LPB0_PGR1_PLR1_TT4_4_WG16_4_4_WGM1
    SolutionIndex: 348
    SolutionNameMin: Cijk_Alik_Bljk_SB_MT8x64x16_SE_EPS1_FL1_GRVW4_GSU1_LPA0_LPB0_PGR1_PLR1_TT2_4_WG4_16_4_WGM1
    SolutionIndex: 349
    SolutionNameMin: Cijk_Alik_Bljk_SB_MT64x64x8_SE_EPS1_FL0_GRVW4_GSU1_LPA0_LPB0_PGR1_PLR1_TT4_4_WG16_16_1_WGM1
    SolutionIndex: 350
    SolutionNameMin: Cijk_Alik_Bljk_SB_MT8x32x32_SE_EPS1_FL0_GRVW4_GSU1_LPA2_LPB2_PGR1_PLR1_TT2_2_WG4_16_4_WGM1
    SolutionIndex: 351
    SolutionNameMin: Cijk_Alik_Bljk_SB_MT64x128x8_SE_EPS1_FL1_GRVW2_GSU1_LPA0_LPB0_PGR1_PLR1_TT4_8_WG16_16_1_WGM1
    SolutionIndex: 352
    SolutionNameMin: Cijk_Alik_Bljk_SB_MT64x128x16_SE_EPS1_FL0_GRVW4_GSU1_LPA2_LPB2_PGR1_PLR1_TT4_8_WG16_16_1_WGM1
    SolutionIndex: 353
    SolutionNameMin: Cijk_Alik_Bljk_SB_MT64x32x8_SE_EPS1_FL0_GRVW2_GSU1_LPA0_LPB0_PGR1_PLR1_TT4_4_WG16_8_2_WGM8
    SolutionIndex: 354
    SolutionNameMin: Cijk_Alik_Bljk_SB_MT64x16x16_SE_EPS1_FL0_GRVW4_GSU1_LPA0_LPB0_PGR1_PLR1_TT4_4_WG16_4_4_WGM1
    SolutionIndex: 355
    SolutionNameMin: Cijk_Alik_Bljk_SB_MT32x16x32_SE_EPS1_FL0_GRVW1_GSU8_LPA2_LPB2_PGR1_PLR1_TT2_4_WG16_4_4_WGM1
    SolutionIndex: 356
    SolutionNameMin: Cijk_Alik_Bljk_SB_MT64x16x16_SE_EPS1_FL0_GRVW4_GSU1_LPA0_LPB0_PGR1_PLR1_TT4_4_WG16_4_4_WGM8
    SolutionIndex: 357
    SolutionNameMin: Cijk_Alik_Bljk_SB_MT64x32x16_SE_EPS1_FL1_GRVW4_GSU1_LPA0_LPB0_PGR1_PLR1_TT4_4_WG16_8_2_WGM1
    SolutionIndex: 358
    SolutionNameMin: Cijk_Alik_Bljk_SB_MT16x64x16_SE_EPS1_FL0_GRVW4_GSU8_LPA0_LPB0_PGR1_PLR1_TT4_4_WG4_16_4_WGM1
    SolutionIndex: 359
    SolutionNameMin: Cijk_Alik_Bljk_SB_MT8x32x32_SE_EPS1_FL0_GRVW4_GSU1_LPA2_LPB2_PGR1_PLR1_TT2_2_WG4_16_4_WGM8
    SolutionIndex: 360
    SolutionNameMin: Cijk_Alik_Bljk_SB_MT64x16x32_SE_EPS1_FL1_GRVW4_GSU8_LPA2_LPB2_PGR1_PLR1_TT4_4_WG16_4_4_WGM1
    SolutionIndex: 361
    SolutionNameMin: Cijk_Alik_Bljk_SB_MT64x128x8_SE_EPS1_FL0_GRVW4_GSU1_LPA0_LPB0_PGR1_PLR1_TT4_8_WG16_16_1_WGM1
    SolutionIndex: 362
    SolutionNameMin: Cijk_Alik_Bljk_SB_MT96x64x8_SE_EPS1_FL1_GRVW4_GSU1_LPA0_LPB0_PGR1_PLR1_TT6_4_WG16_16_1_WGM8
    SolutionIndex: 363
    SolutionNameMin: Cijk_Alik_Bljk_SB_MT64x16x16_SE_EPS1_FL0_GRVW4_GSU1_LPA0_LPB0_PGR1_PLR1_TT4_4_WG16_4_4_WGM8
    SolutionIndex: 364
    SolutionNameMin: Cijk_Alik_Bljk_SB_MT32x16x16_SE_EPS1_FL1_GRVW4_GSU1_LPA0_LPB0_PGR1_PLR1_TT2_4_WG16_4_4_WGM8
    SolutionIndex: 365
    SolutionNameMin: Cijk_Alik_Bljk_SB_MT64x32x8_SE_EPS1_FL1_GRVW2_GSU1_LPA0_LPB0_PGR1_PLR1_TT4_4_WG16_8_2_WGM1
    SolutionIndex: 366
    SolutionNameMin: Cijk_Alik_Bljk_SB_MT64x32x8_SE_EPS1_FL1_GRVW2_GSU1_LPA0_LPB0_PGR1_PLR1_TT4_4_WG16_8_2_WGM8
    SolutionIndex: 367
    SolutionNameMin: Cijk_Alik_Bljk_SB_MT32x8x32_SE_EPS1_FL0_GRVW4_GSU1_LPA2_LPB2_PGR1_PLR1_TT2_2_WG16_4_4_WGM8
    SolutionIndex: 368
    SolutionNameMin: Cijk_Alik_Bljk_SB_MT32x16x16_SE_EPS1_FL0_GRVW2_GSU1_LPA0_LPB0_PGR1_PLR1_TT2_4_WG16_4_4_WGM1
    SolutionIndex: 369
    SolutionNameMin: Cijk_Alik_Bljk_SB_MT128x64x16_SE_EPS1_FL0_GRVW4_GSU1_LPA2_LPB2_PGR1_PLR1_TT8_4_WG16_16_1_WGM8
    SolutionIndex: 370
    SolutionNameMin: Cijk_Alik_Bljk_SB_MT8x32x16_SE_EPS1_FL1_GRVW4_GSU1_LPA0_LPB0_PGR1_PLR1_TT2_2_WG4_16_4_WGM8
    SolutionIndex: 371
    SolutionNameMin: Cijk_Alik_Bljk_SB_MT64x128x8_SE_EPS1_FL0_GRVW4_GSU1_LPA4_LPB0_PGR1_PLR1_TT4_8_WG16_16_1_WGM1
    SolutionIndex: 372
    SolutionNameMin: Cijk_Alik_Bljk_SB_MT64x128x8_SE_EPS1_FL0_GRVW2_GSU1_LPA0_LPB0_PGR1_PLR1_TT4_8_WG16_16_1_WGM1
    SolutionIndex: 373
    SolutionNameMin: Cijk_Alik_Bljk_SB_MT64x16x16_SE_EPS1_FL0_GRVW4_GSU8_LPA0_LPB0_PGR1_PLR1_TT4_4_WG16_4_4_WGM8
    SolutionIndex: 374
    SolutionNameMin: Cijk_Alik_Bljk_SB_MT16x32x16_SE_EPS1_FL0_GRVW4_GSU1_LPA0_LPB0_PGR1_PLR1_TT4_2_WG4_16_4_WGM1
    SolutionIndex: 375
    SolutionNameMin: Cijk_Alik_Bljk_SB_MT16x64x16_SE_EPS1_FL0_GRVW4_GSU1_LPA0_LPB0_PGR1_PLR1_TT4_4_WG4_16_4_WGM1
    SolutionIndex: 376
    SolutionNameMin: Cijk_Alik_Bljk_SB_MT8x32x32_SE_EPS1_FL0_GRVW2_GSU1_LPA2_LPB2_PGR1_PLR1_TT2_2_WG4_16_4_WGM8
    SolutionIndex: 377
    SolutionNameMin: Cijk_Alik_Bljk_SB_MT64x64x8_SE_EPS1_FL0_GRVW2_GSU1_LPA0_LPB0_PGR1_PLR1_TT4_4_WG16_16_1_WGM8
    SolutionIndex: 378
    SolutionNameMin: Cijk_Alik_Bljk_SB_MT64x32x16_SE_EPS1_FL1_GRVW4_GSU8_LPA0_LPB0_PGR1_PLR1_TT4_4_WG16_8_2_WGM1
    SolutionIndex: 379
    SolutionNameMin: Cijk_Alik_Bljk_SB_MT32x64x8_SE_EPS1_FL0_GRVW4_GSU1_LPA0_LPB0_PGR1_PLR1_TT4_4_WG8_16_2_WGM1
    SolutionIndex: 380
    SolutionNameMin: Cijk_Alik_Bljk_SB_MT128x64x8_SE_EPS1_FL0_GRVW4_GSU1_LPA0_LPB0_PGR1_PLR0_TT8_4_WG16_16_1_WGM8
    SolutionIndex: 381
    SolutionNameMin: Cijk_Alik_Bljk_SB_MT64x64x16_SE_EPS1_FL0_GRVW2_GSU1_LPA4_LPB4_PGR1_PLR1_TT4_4_WG16_16_1_WGM1
    SolutionIndex: 382
    SolutionNameMin: Cijk_Alik_Bljk_SB_MT32x64x8_SE_EPS1_FL0_GRVW2_GSU1_LPA0_LPB0_PGR1_PLR1_TT4_4_WG8_16_2_WGM1
    SolutionIndex: 383
    SolutionNameMin: Cijk_Alik_Bljk_SB_MT64x64x8_SE_EPS1_FL1_GRVW2_GSU1_LPA0_LPB0_PGR1_PLR1_TT4_4_WG16_16_1_WGM1
    SolutionIndex: 384
    SolutionNameMin: Cijk_Alik_Bljk_SB_MT64x64x8_SE_EPS1_FL1_GRVW4_GSU1_LPA0_LPB0_PGR1_PLR1_TT4_4_WG16_16_1_WGM8
    SolutionIndex: 385
    SolutionNameMin: Cijk_Alik_Bljk_SB_MT64x128x8_SE_EPS1_FL0_GRVW4_GSU1_LPA0_LPB0_PGR1_PLR1_TT4_8_WG16_16_1_WGM8
    SolutionIndex: 386
    SolutionNameMin: Cijk_Alik_Bljk_SB_MT96x64x8_SE_EPS1_FL1_GRVW4_GSU1_LPA0_LPB0_PGR1_PLR1_TT6_4_WG16_16_1_WGM1
    SolutionIndex: 387
    SolutionNameMin: Cijk_Alik_Bljk_SB_MT32x8x32_SE_EPS1_FL0_GRVW1_GSU1_LPA2_LPB2_PGR1_PLR1_TT2_2_WG16_4_4_WGM1
    SolutionIndex: 388
    SolutionNameMin: Cijk_Alik_Bljk_SB_MT16x32x16_SE_EPS1_FL0_GRVW2_GSU1_LPA0_LPB0_PGR1_PLR1_TT4_2_WG4_16_4_WGM1
    SolutionIndex: 389
    SolutionNameMin: Cijk_Alik_Bljk_SB_MT128x64x16_SE_EPS1_FL1_GRVW4_GSU1_LPA0_LPB0_PGR1_PLR1_TT8_4_WG16_16_1_WGM1
    SolutionIndex: 390
    SolutionNameMin: Cijk_Alik_Bljk_SB_MT8x32x32_SE_EPS1_FL0_GRVW4_GSU4_LPA0_LPB2_PGR1_PLR1_TT2_2_WG4_16_4_WGM8
    SolutionIndex: 391
    SolutionNameMin: Cijk_Alik_Bljk_SB_MT32x64x16_SE_EPS1_FL0_GRVW4_GSU1_LPA0_LPB0_PGR1_PLR1_TT4_4_WG8_16_2_WGM1
    SolutionIndex: 392
    SolutionNameMin: Cijk_Alik_Bljk_SB_MT64x64x8_SE_EPS1_FL0_GRVW2_GSU1_LPA0_LPB0_PGR1_PLR1_TT4_4_WG16_16_1_WGM1
    SolutionIndex: 393
    SolutionNameMin: Cijk_Alik_Bljk_SB_MT32x16x16_SE_EPS1_FL0_GRVW4_GSU1_LPA0_LPB0_PGR1_PLR1_TT2_4_WG16_4_4_WGM1
    SolutionIndex: 394
    SolutionNameMin: Cijk_Alik_Bljk_SB_MT32x64x8_SE_EPS1_FL1_GRVW2_GSU1_LPA0_LPB0_PGR1_PLR1_TT4_4_WG8_16_2_WGM8
    SolutionIndex: 395
    SolutionNameMin: Cijk_Alik_Bljk_SB_MT64x64x8_SE_EPS1_FL0_GRVW4_GSU1_LPA0_LPB0_PGR1_PLR1_TT4_4_WG16_16_1_WGM8
    SolutionIndex: 396
    SolutionNameMin: Cijk_Alik_Bljk_SB_MT16x64x16_SE_EPS1_FL0_GRVW4_GSU1_LPA0_LPB0_PGR1_PLR1_TT4_4_WG4_16_4_WGM8
    SolutionIndex: 397
    SolutionNameMin: Cijk_Alik_Bljk_SB_MT64x64x16_SE_EPS1_FL1_GRVW4_GSU8_LPA0_LPB0_PGR1_PLR1_TT4_4_WG16_16_1_WGM8
    SolutionIndex: 398
    SolutionNameMin: Cijk_Alik_Bljk_SB_MT32x8x32_SE_EPS1_FL0_GRVW2_GSU1_LPA2_LPB2_PGR1_PLR1_TT2_2_WG16_4_4_WGM8
    SolutionIndex: 399
    SolutionNameMin: Cijk_Alik_Bljk_SB_MT16x32x32_SE_EPS1_FL0_GRVW2_GSU8_LPA2_LPB2_PGR1_PLR0_TT4_2_WG4_16_4_WGM1
    SolutionIndex: 400
    SolutionNameMin: Cijk_Alik_Bljk_SB_MT128x64x8_SE_EPS1_FL0_GRVW4_GSU1_LPA0_LPB0_PGR1_PLR1_TT8_4_WG16_16_1_WGM1
    SolutionIndex: 401
    SolutionNameMin: Cijk_Alik_Bljk_SB_MT32x32x32_SE_EPS1_FL0_GRVW4_GSU1_LPA2_LPB2_PGR1_PLR1_TT2_4_WG16_8_1_WGM1
    SolutionIndex: 402
    SolutionNameMin: Cijk_Alik_Bljk_SB_MT64x128x8_SE_EPS1_FL0_GRVW4_GSU1_LPA0_LPB0_PGR1_PLR1_TT4_8_WG16_16_1_WGM1
    SolutionIndex: 403
    SolutionNameMin: Cijk_Alik_Bljk_SB_MT64x64x8_SE_EPS1_FL1_GRVW4_GSU1_LPA0_LPB0_PGR1_PLR1_TT4_4_WG16_16_1_WGM1
    SolutionIndex: 404
    SolutionNameMin: Cijk_Alik_Bljk_SB_MT128x64x8_SE_EPS0_FL1_GRVW4_GSU1_LPA0_LPB0_PGR0_PLR1_TT8_4_WG16_16_1_WGM8
    SolutionIndex: 405
    SolutionNameMin: Cijk_Alik_Bljk_SB_MT64x64x16_SE_EPS1_FL0_GRVW4_GSU1_LPA0_LPB0_PGR1_PLR1_TT4_4_WG16_16_1_WGM8
    SolutionIndex: 406
    SolutionNameMin: Cijk_Alik_Bljk_SB_MT32x16x16_SE_EPS1_FL0_GRVW2_GSU1_LPA0_LPB0_PGR1_PLR1_TT2_4_WG16_4_4_WGM8
    SolutionIndex: 407
    SolutionNameMin: Cijk_Alik_Bljk_SB_MT16x64x16_SE_EPS1_FL0_GRVW4_GSU1_LPA0_LPB0_PGR1_PLR1_TT4_4_WG4_16_4_WGM8
    SolutionIndex: 408
    SolutionNameMin: Cijk_Alik_Bljk_SB_MT64x32x8_SE_EPS1_FL0_GRVW4_GSU1_LPA0_LPB0_PGR1_PLR1_TT4_4_WG16_8_2_WGM1
    SolutionIndex: 409
    SolutionNameMin: Cijk_Alik_Bljk_SB_MT32x64x16_SE_EPS1_FL1_GRVW4_GSU1_LPA2_LPB2_PGR1_PLR1_TT2_4_WG16_16_1_WGM8
    SolutionIndex: 410
    SolutionNameMin: Cijk_Alik_Bljk_SB_MT64x32x16_SE_EPS1_FL0_GRVW1_GSU1_LPA4_LPB4_PGR1_PLR1_TT4_4_WG16_8_1_WGM8
    SolutionIndex: 411
    SolutionNameMin: Cijk_Alik_Bljk_SB_MT64x32x8_SE_EPS1_FL0_GRVW2_GSU1_LPA0_LPB0_PGR1_PLR1_TT4_4_WG16_8_2_WGM1
    SolutionIndex: 412
    SolutionNameMin: Cijk_Alik_Bljk_SB_MT64x64x8_SE_EPS1_FL1_GRVW2_GSU1_LPA0_LPB0_PGR1_PLR0_TT4_4_WG16_16_1_WGM1
    SolutionIndex: 413
    SolutionNameMin: Cijk_Alik_Bljk_SB_MT64x64x16_SE_EPS0_FL0_GRVW4_GSU1_LPA0_LPB0_PGR0_PLR1_TT4_4_WG16_16_1_WGM1
    SolutionIndex: 414
    SolutionNameMin: Cijk_Alik_Bljk_SB_MT32x8x32_SE_EPS1_FL0_GRVW4_GSU1_LPA2_LPB2_PGR1_PLR1_TT2_2_WG16_4_4_WGM1
    SolutionIndex: 415
    SolutionNameMin: Cijk_Alik_Bljk_SB_MT8x32x32_SE_EPS1_FL0_GRVW2_GSU1_LPA0_LPB2_PGR1_PLR1_TT2_2_WG4_16_4_WGM8
    SolutionIndex: 416
    SolutionNameMin: Cijk_Alik_Bljk_SB_MT64x32x16_SE_EPS1_FL0_GRVW1_GSU1_LPA4_LPB4_PGR1_PLR1_TT4_4_WG16_8_1_WGM1
    SolutionIndex: 417
    SolutionNameMin: Cijk_Alik_Bljk_SB_MT64x64x8_SE_EPS1_FL1_GRVW2_GSU1_LPA4_LPB4_PGR1_PLR0_TT4_4_WG16_16_1_WGM1
    SolutionIndex: 418
    SolutionNameMin: Cijk_Alik_Bljk_SB_MT64x64x16_SE_EPS1_FL1_GRVW4_GSU1_LPA0_LPB0_PGR1_PLR0_TT4_4_WG16_16_1_WGM1
    SolutionIndex: 419
    SolutionNameMin: Cijk_Alik_Bljk_SB_MT64x16x32_SE_EPS1_FL0_GRVW4_GSU8_LPA2_LPB2_PGR1_PLR1_TT4_4_WG16_4_4_WGM8
    SolutionIndex: 420
    SolutionNameMin: Cijk_Alik_Bljk_SB_MT128x128x8_SE_EPS1_FL1_GRVW4_GSU1_LPA0_LPB0_PGR1_PLR0_TT8_8_WG16_16_1_WGM8
    SolutionIndex: 421
    SolutionNameMin: Cijk_Alik_Bljk_SB_MT64x32x32_SE_EPS1_FL1_GRVW4_GSU1_LPA2_LPB2_PGR1_PLR1_TT4_2_WG16_16_1_WGM8
    SolutionIndex: 422
    SolutionNameMin: Cijk_Alik_Bljk_SB_MT8x32x32_SE_EPS1_FL0_GRVW2_GSU8_LPA2_LPB2_PGR1_PLR1_TT2_2_WG4_16_4_WGM1
    SolutionIndex: 423
    SolutionNameMin: Cijk_Alik_Bljk_SB_MT8x32x16_SE_EPS1_FL1_GRVW4_GSU1_LPA0_LPB0_PGR1_PLR1_TT2_2_WG4_16_4_WGM1
    SolutionIndex: 424
    SolutionNameMin: Cijk_Alik_Bljk_SB_MT16x64x16_SE_EPS1_FL0_GRVW4_LPA0_LPB0_PGR1_PLR1_TT4_4_USFGRO1_VW4_WG4_16_4_WGM1
    SolutionIndex: 425
    SolutionNameMin: Cijk_Alik_Bljk_SB_MT64x32x16_SE_EPS1_FL0_GRVW4_LPA0_LPB0_PGR1_PLR1_TT4_4_USFGRO1_VW4_WG16_8_2_WGM8
    SolutionIndex: 426
    SolutionNameMin: Cijk_Alik_Bljk_SB_MT16x64x16_SE_EPS1_FL0_GRVW4_LPA0_LPB0_PGR1_PLR1_TT4_4_USFGRO1_VW4_WG4_16_4_WGM8
    SolutionIndex: 427
    SolutionNameMin: Cijk_Alik_Bljk_SB_MT32x32x32_SE_EPS1_FL0_GRVW4_LPA2_LPB2_PGR1_PLR1_TT2_4_USFGRO1_VW2_WG16_8_1_WGM1
    SolutionIndex: 428
    SolutionNameMin: Cijk_Alik_Bljk_SB_MT128x64x16_SE_EPS1_FL1_GRVW4_LPA2_LPB2_PGR1_PLR1_TT8_4_USFGRO1_VW2_WG16_16_1_WGM8
    SolutionIndex: 429
    SolutionNameMin: Cijk_Alik_Bljk_SB_MT32x32x32_SE_EPS1_FL1_GRVW4_LPA2_LPB2_PGR1_PLR1_TT2_4_USFGRO1_VW2_WG16_8_1_WGM1
    SolutionIndex: 430
    SolutionNameMin: Cijk_Alik_Bljk_SB_MT128x64x16_SE_EPS1_FL0_GRVW4_LPA2_LPB2_PGR1_PLR1_TT8_4_USFGRO1_VW2_WG16_16_1_WGM8
    SolutionIndex: 431
    SolutionNameMin: Cijk_Alik_Bljk_SB_MT64x128x16_SE_EPS1_FL1_GRVW4_LPA2_LPB2_PGR1_PLR1_TT4_8_USFGRO1_VW2_WG16_16_1_WGM1
    SolutionIndex: 432
    SolutionNameMin: Cijk_Alik_Bljk_SB_MT128x64x16_SE_EPS0_FL0_GRVW4_LPA4_LPB4_PGR0_PLR1_TT8_4_USFGRO1_VW4_WG16_16_1_WGM1
    SolutionIndex: 433
    SolutionNameMin: Cijk_Alik_Bljk_SB_MT64x64x16_SE_EPS1_FL0_GRVW4_LPA4_LPB4_PGR1_PLR1_TT4_4_USFGRO1_VW4_WG16_16_1_WGM1
    SolutionIndex: 434
    SolutionNameMin: Cijk_Alik_Bljk_SB_MT32x32x32_SE_EPS0_FL0_GRVW4_LPA2_LPB2_PGR0_PLR1_TT2_4_USFGRO1_VW2_WG16_8_1_WGM1
    SolutionIndex: 435
    SolutionNameMin: Cijk_Alik_Bljk_SB_MT64x32x32_SE_EPS1_FL1_GRVW4_LPA2_LPB2_PGR1_PLR1_TT4_2_USFGRO1_VW2_WG16_16_1_WGM8
    SolutionIndex: 436
    SolutionNameMin: Cijk_Alik_Bljk_SB_MT128x64x16_SE_EPS0_FL0_GRVW1_LPA4_LPB4_PGR0_PLR1_TT8_4_USFGRO1_VW4_WG16_16_1_WGM1
    SolutionIndex: 437
    SolutionNameMin: Cijk_Alik_Bljk_SB_MT32x64x16_SE_EPS1_FL1_GRVW4_LPA2_LPB2_PGR1_PLR1_TT2_4_USFGRO1_VW2_WG16_16_1_WGM8
    SolutionIndex: 438
    SolutionNameMin: Cijk_Alik_Bljk_SB_MT32x64x32_SE_EPS1_FL1_GRVW4_LPA2_LPB2_PGR1_PLR1_TT2_4_USFGRO1_VW2_WG16_16_1_WGM8
    SolutionIndex: 439
    SolutionNameMin: Cijk_Alik_Bljk_SB_MT32x64x16_SE_EPS1_FL0_GRVW2_LPA4_LPB4_PGR1_PLR1_TT4_4_USFGRO1_VW4_WG8_16_1_WGM1
    SolutionIndex: 440
    SolutionNameMin: Cijk_Alik_Bljk_SB_MT64x32x32_SE_EPS1_FL0_GRVW4_LPA2_LPB2_PGR1_PLR1_TT4_2_USFGRO1_VW2_WG16_16_1_WGM8
    SolutionIndex: 441
    SolutionNameMin: Cijk_Alik_Bljk_SB_MT128x64x8_SE_EPS1_FL1_GRVW2_LPA4_LPB0_PGR1_PLR0_TT8_4_USFGRO1_VW4_WG16_16_1_WGM8
    SolutionIndex: 442
    SolutionNameMin: Cijk_Alik_Bljk_SB_MT32x32x32_SE_EPS0_FL0_GRVW2_LPA2_LPB2_PGR0_PLR0_TT2_4_USFGRO1_VW2_WG16_8_1_WGM8
    SolutionIndex: 443
    SolutionNameMin: Cijk_Alik_Bljk_SB_MT128x64x16_SE_EPS1_FL1_GRVW2_LPA4_LPB4_PGR1_PLR1_TT8_4_USFGRO1_VW4_WG16_16_1_WGM1
    SolutionIndex: 444
    SolutionNameMin: Cijk_Alik_Bljk_SB_MT64x32x16_SE_EPS1_FL0_GRVW1_LPA4_LPB4_PGR1_PLR1_TT4_4_USFGRO1_VW4_WG16_8_1_WGM1
    SolutionIndex: 445
    SolutionNameMin: Cijk_Alik_Bljk_SB_MT32x64x16_SE_EPS1_FL0_GRVW4_LPA2_LPB2_PGR1_PLR1_TT2_4_USFGRO1_VW2_WG16_16_1_WGM1
    SolutionIndex: 446
    SolutionNameMin: Cijk_Alik_Bljk_SB_MT128x64x16_SE_EPS1_FL1_GRVW4_LPA4_LPB4_PGR1_PLR1_TT8_4_USFGRO1_VW4_WG16_16_1_WGM1
    SolutionIndex: 447
    SolutionNameMin: Cijk_Alik_Bljk_SB_MT32x32x32_SE_EPS1_FL0_GRVW4_LPA2_LPB2_PGR1_PLR1_TT4_2_USFGRO1_VW2_WG8_16_1_WGM1
    SolutionIndex: 448
    SolutionNameMin: Cijk_Alik_Bljk_SB_MT64x64x16_SE_EPS1_FL1_GRVW2_LPA4_LPB4_PGR1_PLR1_TT4_4_USFGRO1_VW4_WG16_16_1_WGM8
    SolutionIndex: 449
    SolutionNameMin: Cijk_Alik_Bljk_SB_MT64x128x16_SE_EPS1_FL1_GRVW2_LPA2_LPB2_PGR1_PLR0_TT4_8_USFGRO1_VW2_WG16_16_1_WGM8
    SolutionIndex: 450
    SolutionNameMin: Cijk_Alik_Bljk_SB_MT64x64x16_SE_EPS1_FL1_GRVW2_LPA2_LPB2_PGR1_PLR1_TT4_4_USFGRO1_VW2_WG16_16_1_WGM1
    SolutionIndex: 451
    SolutionNameMin: Cijk_Alik_Bljk_SB_MT32x64x32_SE_EPS1_FL1_GRVW4_LPA2_LPB2_PGR1_PLR1_TT2_4_USFGRO1_VW2_WG16_16_1_WGM1
    SolutionIndex: 452
    SolutionNameMin: Cijk_Alik_Bljk_SB_MT64x64x16_SE_EPS1_FL0_GRVW1_LPA4_LPB4_PGR1_PLR1_TT4_4_USFGRO1_VW4_WG16_16_1_WGM1
    SolutionIndex: 453
    SolutionNameMin: Cijk_Alik_Bljk_SB_MT32x32x32_SE_EPS1_FL1_GRVW4_LPA2_LPB2_PGR1_PLR1_TT4_2_USFGRO1_VW2_WG8_16_1_WGM1
    SolutionIndex: 454
    SolutionNameMin: Cijk_Alik_Bljk_SB_MT32x64x16_SE_EPS1_FL1_GRVW2_LPA2_LPB2_PGR1_PLR1_TT4_4_USFGRO1_VW2_WG8_16_1_WGM8
    SolutionIndex: 455
    SolutionNameMin: Cijk_Alik_Bljk_SB_MT64x128x16_SE_EPS1_FL0_GRVW2_LPA4_LPB4_PGR1_PLR1_TT4_8_USFGRO1_VW4_WG16_16_1_WGM1
    SolutionIndex: 456
    SolutionNameMin: Cijk_Alik_Bljk_SB_MT32x32x32_SE_EPS1_FL0_GRVW4_LPA2_LPB2_PGR1_PLR1_TT2_4_USFGRO1_VW2_WG16_8_1_WGM1
    SolutionIndex: 457
    SolutionNameMin: Cijk_Alik_Bljk_SB_MT64x64x16_SE_EPS0_FL1_GRVW2_LPA4_LPB4_PGR0_PLR1_TT4_4_USFGRO1_VW4_WG16_16_1_WGM1
    SolutionIndex: 458
    SolutionNameMin: Cijk_Alik_Bljk_SB_MT64x32x32_SE_EPS0_FL1_GRVW2_LPA2_LPB2_PGR0_PLR1_TT4_4_USFGRO1_VW2_WG16_8_1_WGM1
    SolutionIndex: 459
    SolutionNameMin: Cijk_Alik_Bljk_SB_MT32x32x16_SE_EPS1_FL0_GRVW1_LPA2_LPB2_PGR1_PLR1_TT2_4_USFGRO1_VW2_WG16_8_1_WGM8
    SolutionIndex: 460
    SolutionNameMin: Cijk_Alik_Bljk_SB_MT64x32x32_SE_EPS0_FL0_GRVW4_LPA2_LPB2_PGR0_PLR1_TT4_4_USFGRO1_VW2_WG16_8_1_WGM1
    SolutionIndex: 461
    SolutionNameMin: Cijk_Alik_Bljk_SB_MT64x64x32_SE_EPS0_FL0_GRVW4_LPA2_LPB2_PGR0_PLR1_TT4_4_USFGRO1_VW2_WG16_16_1_WGM1
    SolutionIndex: 462
    SolutionNameMin: Cijk_Alik_Bljk_SB_MT128x64x32_SE_EPS1_FL1_GRVW2_LPA4_LPB4_PGR1_PLR1_TT8_4_USFGRO1_VW4_WG16_16_1_WGM1
    SolutionIndex: 463
    SolutionNameMin: Cijk_Alik_Bljk_SB_MT64x64x16_SE_EPS1_FL0_GRVW2_LPA4_LPB4_PGR1_PLR1_TT4_4_USFGRO1_VW4_WG16_16_1_WGM1
    SolutionIndex: 464
    SolutionNameMin: Cijk_Alik_Bljk_SB_MT32x32x32_SE_EPS1_FL0_GRVW4_LPA2_LPB2_PGR1_PLR1_TT4_2_USFGRO1_VW2_WG8_16_1_WGM1
    SolutionIndex: 465
    SolutionNameMin: Cijk_Alik_Bljk_SB_MT32x32x32_SE_EPS1_FL1_GRVW4_LPA2_LPB2_PGR1_PLR1_TT2_4_USFGRO1_VW2_WG16_8_1_WGM1
    SolutionIndex: 466
    SolutionNameMin: Cijk_Alik_Bljk_SB_MT64x32x16_SE_EPS1_FL1_GRVW2_LPA4_LPB4_PGR1_PLR1_TT4_4_USFGRO1_VW4_WG16_8_1_WGM1
    SolutionIndex: 467
    SolutionNameMin: Cijk_Alik_Bljk_SB_MT64x32x16_SE_EPS1_FL0_GRVW1_LPA4_LPB4_PGR1_PLR1_TT4_4_USFGRO1_VW4_WG16_8_1_WGM8
    SolutionIndex: 468
    SolutionNameMin: Cijk_Alik_Bljk_SB_MT32x32x16_SE_EPS1_FL0_GRVW1_LPA2_LPB2_PGR1_PLR1_TT4_2_USFGRO1_VW2_WG8_16_1_WGM8
    SolutionIndex: 469
    SolutionNameMin: Cijk_Alik_Bljk_SB_MT32x32x32_SE_EPS0_FL0_GRVW1_LPA2_LPB2_PGR0_PLR1_TT2_4_USFGRO1_VW2_WG16_8_1_WGM8
    SolutionIndex: 470
    SolutionNameMin: Cijk_Alik_Bljk_SB_MT64x32x16_SE_EPS1_FL0_GRVW2_LPA4_LPB4_PGR1_PLR1_TT4_4_USFGRO1_VW4_WG16_8_1_WGM8
    SolutionIndex: 471
    SolutionNameMin: Cijk_Alik_Bljk_SB_MT64x64x16_SE_EPS0_FL1_GRVW2_LPA4_LPB4_PGR0_PLR1_TT4_4_USFGRO1_VW4_WG16_16_1_WGM8
    SolutionIndex: 472
    SolutionNameMin: Cijk_Alik_Bljk_SB_MT32x64x16_SE_EPS1_FL0_GRVW1_LPA2_LPB2_PGR1_PLR1_TT4_4_USFGRO1_VW2_WG8_16_1_WGM8
    SolutionIndex: 473
    SolutionNameMin: Cijk_Alik_Bljk_SB_MT32x64x16_SE_EPS1_FL0_GRVW1_LPA4_LPB4_PGR1_PLR1_TT4_4_USFGRO1_VW4_WG8_16_1_WGM1
    SolutionIndex: 474
    SolutionNameMin: Cijk_Alik_Bljk_SB_MT32x64x32_SE_EPS0_FL0_GRVW2_LPA2_LPB2_PGR0_PLR1_TT4_4_USFGRO1_VW2_WG8_16_1_WGM1
    SolutionIndex: 475
    SolutionNameMin: Cijk_Alik_Bljk_SB_MT64x64x16_SE_EPS0_FL0_GRVW2_LPA4_LPB4_PGR0_PLR1_TT4_4_USFGRO1_VW4_WG16_16_1_WGM8
    SolutionIndex: 476
    SolutionNameMin: Cijk_Alik_Bljk_SB_MT64x128x16_SE_EPS1_FL1_GRVW4_LPA4_LPB4_PGR1_PLR1_TT4_8_USFGRO1_VW4_WG16_16_1_WGM1
    SolutionIndex: 477
    SolutionNameMin: Cijk_Alik_Bljk_SB_MT64x32x16_SE_EPS1_FL1_GRVW2_LPA4_LPB4_PGR1_PLR1_TT4_4_USFGRO1_VW4_WG16_8_1_WGM8
    SolutionIndex: 478
    SolutionNameMin: Cijk_Alik_Bljk_SB_MT64x32x32_SE_EPS0_FL1_GRVW4_LPA2_LPB2_PGR0_PLR1_TT4_4_USFGRO1_VW2_WG16_8_1_WGM1
    SolutionIndex: 479
    SolutionNameMin: Cijk_Alik_Bljk_SB_MT64x64x32_SE_EPS1_FL0_GRVW1_LPA4_LPB4_PGR1_PLR1_TT4_4_USFGRO1_VW4_WG16_16_1_WGM8
    SolutionIndex: 480
    SolutionNameMin: Cijk_Alik_Bljk_SB_MT64x32x32_SE_EPS0_FL1_GRVW2_LPA2_LPB2_PGR0_PLR1_TT4_4_USFGRO1_VW2_WG16_8_1_WGM8
    SolutionIndex: 481
    SolutionNameMin: Cijk_Alik_Bljk_SB_MT32x64x16_SE_EPS1_FL0_GRVW1_LPA4_LPB4_PGR1_PLR1_TT4_4_USFGRO1_VW4_WG8_16_1_WGM8
    SolutionIndex: 482
    SolutionNameMin: Cijk_Alik_Bljk_SB_MT32x32x32_SE_EPS0_FL0_GRVW4_LPA2_LPB2_PGR0_PLR1_TT2_4_USFGRO1_VW2_WG16_8_1_WGM1
    SolutionIndex: 483
    SolutionNameMin: Cijk_Alik_Bljk_SB_MT64x32x16_SE_EPS1_FL0_GRVW2_LPA4_LPB4_PGR1_PLR1_TT4_4_USFGRO1_VW4_WG16_8_1_WGM1
    SolutionIndex: 484
    SolutionNameMin: Cijk_Alik_Bljk_SB_MT64x64x16_SE_EPS1_FL1_GRVW2_LPA4_LPB4_PGR1_PLR1_TT4_4_USFGRO1_VW4_WG16_16_1_WGM1
    SolutionIndex: 485
    SolutionNameMin: Cijk_Alik_Bljk_SB_MT64x64x16_SE_EPS0_FL0_GRVW2_LPA4_LPB4_PGR0_PLR1_TT4_4_USFGRO1_VW4_WG16_16_1_WGM1
    SolutionIndex: 486
    SolutionNameMin: Cijk_Alik_Bljk_SB_MT64x128x16_SE_EPS1_FL1_GRVW2_LPA4_LPB4_PGR1_PLR1_TT4_8_USFGRO1_VW4_WG16_16_1_WGM8
    SolutionIndex: 487
    SolutionNameMin: Cijk_Alik_Bljk_SB_MT64x32x16_SE_EPS1_FL0_GRVW1_LPA2_LPB2_PGR1_PLR1_TT4_4_USFGRO1_VW2_WG16_8_1_WGM1
    SolutionIndex: 488
    SolutionNameMin: Cijk_Alik_Bljk_SB_MT64x128x8_SE_EPS1_FL0_GRVW2_LPA0_LPB0_PGR1_PLR1_TT4_8_USFGRO1_VW4_WG16_16_1_WGM8
    SolutionIndex: 489
    SolutionNameMin: Cijk_Alik_Bljk_SB_MT64x32x32_SE_EPS1_FL0_GRVW4_LPA2_LPB2_PGR1_PLR1_TT4_2_USFGRO1_VW2_WG16_16_1_WGM8
    SolutionIndex: 490
    SolutionNameMin: Cijk_Alik_Bljk_SB_MT64x32x16_SE_EPS1_FL0_GRVW4_LPA4_LPB4_PGR1_PLR1_TT4_4_USFGRO1_VW4_WG16_8_1_WGM1
    SolutionIndex: 491
    SolutionNameMin: Cijk_Alik_Bljk_SB_MT64x32x32_SE_EPS0_FL0_GRVW2_LPA2_LPB2_PGR0_PLR1_TT4_4_USFGRO1_VW2_WG16_8_1_WGM1
    SolutionIndex: 492
    SolutionNameMin: Cijk_Alik_Bljk_SB_MT32x64x16_SE_EPS1_FL0_GRVW2_LPA4_LPB4_PGR1_PLR1_TT4_4_USFGRO1_VW4_WG8_16_1_WGM1
    SolutionIndex: 493
    SolutionNameMin: Cijk_Alik_Bljk_SB_MT64x32x32_SE_EPS0_FL1_GRVW4_LPA2_LPB2_PGR0_PLR1_TT4_4_USFGRO1_VW2_WG16_8_1_WGM8
    SolutionIndex: 494
    SolutionNameMin: Cijk_Alik_Bljk_SB_MT32x32x32_SE_EPS0_FL0_GRVW1_LPA2_LPB2_PGR0_PLR1_TT4_2_USFGRO1_VW2_WG8_16_1_WGM1
    SolutionIndex: 495
    SolutionNameMin: Cijk_Alik_Bljk_SB_MT64x64x16_SE_EPS1_FL0_GRVW2_LPA4_LPB4_PGR1_PLR1_TT4_4_USFGRO1_VW4_WG16_16_1_WGM8
    SolutionIndex: 496
    SolutionNameMin: Cijk_Alik_Bljk_SB_MT128x64x16_SE_EPS0_FL1_GRVW2_GSU1_PGR0_PLR1_TT8_4_VW2_WG16_16_1_WGM1
    SolutionIndex: 497
    SolutionNameMin: Cijk_Alik_Bljk_SB_MT128x128x16_SE_EPS1_FL0_GRVW2_GSU1_PGR1_PLR1_TT8_8_VW2_WG16_16_1_WGM1
    SolutionIndex: 498
    SolutionNameMin: Cijk_Alik_Bljk_SB_MT64x32x16_SE_EPS1_FL1_GRVW4_GSU1_PGR1_PLR1_TT4_4_VW4_WG16_8_2_WGM8
    SolutionIndex: 499
    SolutionNameMin: Cijk_Alik_Bljk_SB_MT32x32x16_SE_EPS0_FL1_GRVW4_LPA2_LPB2_PGR0_PLR1_TT2_4_USFGRO1_VW2_WG16_8_1_WGM8
    SolutionIndex: 500
    SolutionNameMin: Cijk_Alik_Bljk_SB_MT64x32x8_SE_EPS1_FL1_GRVW4_LPA2_LPB0_PGR1_PLR1_TT4_4_USFGRO1_VW2_WG16_8_1_WGM1
    SolutionIndex: 501
    SolutionNameMin: Cijk_Alik_Bljk_SB_MT32x64x32_SE_EPS0_FL0_GRVW4_LPA2_LPB2_PGR0_PLR1_TT2_4_USFGRO1_VW2_WG16_16_1_WGM1
    SolutionIndex: 502
    SolutionNameMin: Cijk_Alik_Bljk_SB_MT64x32x32_SE_EPS0_FL0_GRVW4_LPA2_LPB2_PGR0_PLR1_TT4_2_USFGRO1_VW2_WG16_16_1_WGM1
    SolutionIndex: 503
    SolutionNameMin: Cijk_Alik_Bljk_SB_MT64x64x16_SE_EPS0_FL0_GRVW4_LPA0_LPB0_PGR0_PLR1_TT4_8_USFGRO1_VW2_WG16_8_1_WGM8
    SolutionIndex: 504
    SolutionNameMin: Cijk_Alik_Bljk_SB_MT64x16x8_SE_EPS1_FL0_GRVW1_LPA2_LPB0_PGR1_PLR1_TT4_2_USFGRO1_VW2_WG16_8_1_WGM1
    SolutionIndex: 505
    SolutionNameMin: Cijk_Alik_Bljk_SB_MT32x64x16_SE_EPS0_FL1_GRVW2_LPA4_LPB4_PGR0_PLR0_TT4_4_USFGRO1_VW4_WG8_16_1_WGM1
    SolutionIndex: 506
    SolutionNameMin: Cijk_Alik_Bljk_SB_MT128x128x16_SE_EPS1_FL1_GRVW4_LPA0_LPB0_PGR1_PLR1_TT8_8_USFGRO1_VW4_WG16_16_1_WGM1
    SolutionIndex: 507
    SolutionNameMin: Cijk_Alik_Bljk_SB_MT128x128x16_SE_EPS1_FL0_GRVW2_LPA0_LPB0_PGR1_PLR1_TT8_8_USFGRO1_VW4_WG16_16_1_WGM8
    SolutionIndex: 508
    SolutionNameMin: Cijk_Alik_Bljk_SB_MT128x128x16_SE_EPS1_FL0_GRVW4_LPA0_LPB0_PGR1_PLR1_TT8_8_USFGRO1_VW4_WG16_16_1_WGM1
    SolutionIndex: 509
    SolutionNameMin: Cijk_Alik_Bljk_SB_MT128x128x16_SE_EPS1_FL1_GRVW2_LPA0_LPB0_PGR1_PLR1_TT8_8_USFGRO1_VW4_WG16_16_1_WGM8
    SolutionIndex: 510
    SolutionNameMin: Cijk_Alik_Bljk_SB_MT128x128x16_SE_EPS1_FL1_GRVW4_LPA0_LPB0_PGR1_PLR1_TT8_8_USFGRO1_VW4_WG16_16_1_WGM8
    SolutionIndex: 511
    SolutionNameMin: Cijk_Alik_Bljk_SB_MT128x128x16_SE_EPS1_FL0_GRVW4_LPA0_LPB0_PGR1_PLR1_TT8_8_USFGRO1_VW2_WG16_16_1_WGM1
    SolutionIndex: 512
    SolutionNameMin: Cijk_Alik_Bljk_SB_MT128x128x16_SE_EPS1_FL0_GRVW4_LPA0_LPB0_PGR1_PLR1_TT8_8_USFGRO1_VW4_WG16_16_1_WGM8
    SolutionIndex: 513
    SolutionNameMin: Cijk_Alik_Bljk_SB_MT128x128x8_SE_EPS1_FL0_GRVW2_LPA0_LPB0_PGR1_PLR1_TT8_8_USFGRO1_VW2_WG16_16_1_WGM1
    SolutionIndex: 514
    SolutionNameMin: Cijk_Alik_Bljk_SB_MT128x64x16_SE_EPS1_FL1_GRVW4_LPA0_LPB0_PGR1_PLR1_TT8_4_USFGRO1_VW4_WG16_16_1_WGM1
    SolutionIndex: 515
    SolutionNameMin: Cijk_Alik_Bljk_SB_MT128x64x16_SE_EPS1_FL0_GRVW4_LPA0_LPB0_PGR1_PLR1_TT8_4_USFGRO1_VW4_WG16_16_1_WGM1
    SolutionIndex: 516
    SolutionNameMin: Cijk_Alik_Bljk_SB_MT128x128x16_SE_EPS1_FL0_GRVW2_LPA0_LPB0_PGR1_PLR1_TT8_8_USFGRO1_VW2_WG16_16_1_WGM1
    SolutionIndex: 517
    SolutionNameMin: Cijk_Alik_Bljk_SB_MT128x128x8_SE_EPS1_FL0_GRVW4_LPA0_LPB0_PGR1_PLR1_TT8_8_USFGRO1_VW4_WG16_16_1_WGM1
    SolutionIndex: 518
    SolutionNameMin: Cijk_Alik_Bljk_SB_MT128x64x8_SE_EPS1_FL1_GRVW2_LPA0_LPB0_PGR1_PLR0_TT8_4_USFGRO1_VW2_WG16_16_1_WGM8
    SolutionIndex: 519
    SolutionNameMin: Cijk_Alik_Bljk_SB_MT128x128x16_SE_EPS1_FL0_GRVW2_LPA0_LPB0_PGR1_PLR1_TT8_8_USFGRO1_VW4_WG16_16_1_WGM1
    SolutionIndex: 520
    SolutionNameMin: Cijk_Alik_Bljk_SB_MT32x32x16_SE_EPS0_FL1_GRVW2_LPA2_LPB2_PGR0_PLR1_TT4_2_USFGRO1_VW2_WG8_16_1_WGM1
    SolutionIndex: 521
    SolutionNameMin: Cijk_Alik_Bljk_SB_MT32x32x16_SE_EPS0_FL0_GRVW4_LPA0_LPB2_PGR0_PLR1_TT4_2_USFGRO1_VW2_WG8_16_1_WGM1
    SolutionIndex: 522
    SolutionNameMin: Cijk_Alik_Bljk_SB_MT32x32x8_SE_EPS1_FL1_GRVW4_LPA2_LPB2_PGR1_PLR1_TT2_4_USFGRO1_VW2_WG16_8_1_WGM8
    SolutionIndex: 523
    SolutionNameMin: Cijk_Alik_Bljk_SB_MT32x32x16_SE_EPS0_FL1_GRVW4_LPA2_LPB2_PGR0_PLR1_TT2_4_USFGRO1_VW2_WG16_8_1_WGM1
    SolutionIndex: 524
    SolutionNameMin: Cijk_Alik_Bljk_SB_MT16x64x8_SE_EPS1_FL0_GRVW4_LPA2_LPB2_PGR1_PLR1_TT2_4_USFGRO1_VW2_WG8_16_1_WGM1
    SolutionIndex: 525
    SolutionNameMin: Cijk_Alik_Bljk_SB_MT32x32x16_SE_EPS0_FL0_GRVW4_LPA2_LPB2_PGR0_PLR1_TT4_2_USFGRO1_VW2_WG8_16_1_WGM8
    SolutionIndex: 526
    SolutionNameMin: Cijk_Alik_Bljk_SB_MT16x64x8_SE_EPS1_FL0_GRVW1_LPA2_LPB2_PGR1_PLR1_TT2_4_USFGRO1_VW2_WG8_16_1_WGM1
    SolutionIndex: 527
    SolutionNameMin: Cijk_Alik_Bljk_SB_MT32x32x16_SE_EPS0_FL0_GRVW4_LPA2_LPB2_PGR0_PLR1_TT2_4_USFGRO1_VW2_WG16_8_1_WGM8
    SolutionIndex: 528
    SolutionNameMin: Cijk_Alik_Bljk_SB_MT32x32x8_SE_EPS1_FL1_GRVW2_LPA2_LPB2_PGR1_PLR1_TT4_2_USFGRO1_VW2_WG8_16_1_WGM1
    SolutionIndex: 529
    SolutionNameMin: Cijk_Alik_Bljk_SB_MT32x32x8_SE_EPS1_FL1_GRVW2_LPA2_LPB2_PGR1_PLR1_TT2_4_USFGRO1_VW2_WG16_8_1_WGM8
    SolutionIndex: 530
    SolutionNameMin: Cijk_Alik_Bljk_SB_MT32x32x16_SE_EPS0_FL1_GRVW4_LPA2_LPB2_PGR0_PLR0_TT2_4_USFGRO1_VW2_WG16_8_1_WGM8
    SolutionIndex: 531
    SolutionNameMin: Cijk_Alik_Bljk_SB_MT32x32x8_SE_EPS1_FL1_GRVW4_LPA2_LPB2_PGR1_PLR1_TT2_4_USFGRO1_VW2_WG16_8_1_WGM1
    SolutionIndex: 532
    SolutionNameMin: Cijk_Alik_Bljk_SB_MT32x32x16_SE_EPS0_FL0_GRVW2_LPA2_LPB2_PGR0_PLR1_TT2_4_USFGRO1_VW2_WG16_8_1_WGM8
    SolutionIndex: 533
    SolutionNameMin: Cijk_Alik_Bljk_SB_MT32x32x16_SE_EPS0_FL1_GRVW2_LPA2_LPB2_PGR0_PLR1_TT2_4_USFGRO1_VW2_WG16_8_1_WGM1
    SolutionIndex: 534
    SolutionNameMin: Cijk_Alik_Bljk_SB_MT32x32x8_SE_EPS1_FL1_GRVW4_LPA0_LPB2_PGR1_PLR1_TT2_4_USFGRO1_VW2_WG16_8_1_WGM1
    SolutionIndex: 535
    SolutionNameMin: Cijk_Alik_Bljk_SB_MT32x32x8_SE_EPS1_FL0_GRVW1_LPA0_LPB2_PGR1_PLR1_TT2_4_USFGRO1_VW2_WG16_8_1_WGM1
    SolutionIndex: 536
    SolutionNameMin: Cijk_Alik_Bljk_SB_MT32x32x32_SE_EPS0_FL0_GRVW2_LPA2_LPB2_PGR0_PLR1_TT2_4_USFGRO1_VW2_WG16_8_1_WGM1
    SolutionIndex: 537
    SolutionNameMin: Cijk_Alik_Bljk_SB_MT32x32x16_SE_EPS0_FL1_GRVW2_LPA2_LPB2_PGR0_PLR1_TT2_4_USFGRO1_VW2_WG16_8_1_WGM8
    SolutionIndex: 538
    SolutionNameMin: Cijk_Alik_Bljk_SB_MT32x32x32_SE_EPS0_FL1_GRVW4_LPA2_LPB2_PGR0_PLR1_TT2_4_USFGRO1_VW2_WG16_8_1_WGM8
    SolutionIndex: 539
    SolutionNameMin: Cijk_Alik_Bljk_SB_MT32x32x8_SE_EPS1_FL1_GRVW2_LPA0_LPB0_PGR1_PLR1_TT4_2_USFGRO1_VW2_WG8_16_1_WGM1
    SolutionIndex: 540
    SolutionNameMin: Cijk_Alik_Bljk_SB_MT32x32x32_SE_EPS0_FL1_GRVW2_LPA2_LPB2_PGR0_PLR1_TT2_4_USFGRO1_VW2_WG16_8_1_WGM1
    SolutionIndex: 541
    SolutionNameMin: Cijk_Alik_Bljk_SB_MT32x32x8_SE_EPS1_FL1_GRVW4_LPA2_LPB2_PGR1_PLR1_TT4_2_USFGRO1_VW2_WG8_16_1_WGM1
    SolutionIndex: 542
    SolutionNameMin: Cijk_Alik_Bljk_SB_MT32x32x32_SE_EPS0_FL1_GRVW2_LPA2_LPB2_PGR0_PLR1_TT2_4_USFGRO1_VW2_WG16_8_1_WGM8
    SolutionIndex: 543
    SolutionNameMin: Cijk_Alik_Bljk_SB_MT32x32x16_SE_EPS0_FL0_GRVW4_LPA2_LPB2_PGR0_PLR1_TT4_2_USFGRO1_VW2_WG8_16_1_WGM1
    SolutionIndex: 544
    SolutionNameMin: Cijk_Alik_Bljk_SB_MT64x64x8_SE_EPS1_FL1_GRVW4_LPA0_LPB0_PGR1_PLR1_TT8_4_USFGRO1_VW2_WG8_16_1_WGM1
    SolutionIndex: 545
    SolutionNameMin: Cijk_Alik_Bljk_SB_MT64x64x16_SE_EPS0_FL0_GRVW2_LPA2_LPB2_PGR0_PLR0_TT4_4_USFGRO1_VW2_WG16_16_1_WGM8
    SolutionIndex: 546
    SolutionNameMin: Cijk_Alik_Bljk_SB_MT16x64x16_SE_EPS0_FL0_GRVW4_LPA2_LPB2_PGR0_PLR1_TT2_4_USFGRO1_VW2_WG8_16_1_WGM8
    SolutionIndex: 547
    SolutionNameMin: Cijk_Alik_Bljk_SB_MT64x64x16_SE_EPS0_FL1_GRVW4_LPA2_LPB2_PGR0_PLR0_TT4_4_USFGRO1_VW2_WG16_16_1_WGM8
    SolutionIndex: 548
    SolutionNameMin: Cijk_Alik_Bljk_SB_MT64x16x16_SE_EPS0_FL0_GRVW4_LPA2_LPB2_PGR0_PLR1_TT4_2_USFGRO1_VW2_WG16_8_1_WGM8
    SolutionIndex: 549
    SolutionNameMin: Cijk_Alik_Bljk_SB_MT64x64x16_SE_EPS0_FL0_GRVW4_LPA2_LPB2_PGR0_PLR1_TT4_4_USFGRO1_VW2_WG16_16_1_WGM8
    SolutionIndex: 550
    SolutionNameMin: Cijk_Alik_Bljk_SB_MT64x16x16_SE_EPS0_FL1_GRVW2_LPA2_LPB2_PGR0_PLR1_TT4_2_USFGRO1_VW2_WG16_8_1_WGM1
    SolutionIndex: 551
    SolutionNameMin: Cijk_Alik_Bljk_SB_MT64x16x16_SE_EPS0_FL0_GRVW4_LPA2_LPB2_PGR0_PLR1_TT4_2_USFGRO1_VW2_WG16_8_1_WGM1
    SolutionIndex: 552
    SolutionNameMin: Cijk_Alik_Bljk_SB_MT64x64x16_SE_EPS0_FL1_GRVW4_LPA0_LPB2_PGR0_PLR1_TT4_4_USFGRO1_VW2_WG16_16_1_WGM8
    SolutionIndex: 553
    SolutionNameMin: Cijk_Alik_Bljk_SB_MT32x32x16_SE_EPS0_FL0_GRVW1_LPA2_LPB2_PGR0_PLR1_TT2_4_USFGRO1_VW2_WG16_8_1_WGM1
    SolutionIndex: 554
    SolutionNameMin: Cijk_Alik_Bljk_SB_MT32x64x32_SE_EPS0_FL0_GRVW4_LPA2_LPB2_PGR0_PLR1_TT2_4_USFGRO1_VW2_WG16_16_1_WGM8
    SolutionIndex: 555
    SolutionNameMin: Cijk_Alik_Bljk_SB_MT64x32x16_SE_EPS0_FL0_GRVW4_LPA4_LPB4_PGR0_PLR1_TT4_4_USFGRO1_VW4_WG16_8_1_WGM1
    SolutionIndex: 556
    SolutionNameMin: Cijk_Alik_Bljk_SB_MT32x32x16_SE_EPS0_FL0_GRVW4_LPA2_LPB2_PGR0_PLR1_TT2_4_USFGRO1_VW2_WG16_8_1_WGM1
    SolutionIndex: 557
    SolutionNameMin: Cijk_Alik_Bljk_SB_MT32x32x16_SE_EPS0_FL0_GRVW2_LPA2_LPB2_PGR0_PLR1_TT4_2_USFGRO1_VW2_WG8_16_1_WGM1
    SolutionIndex: 558
    SolutionNameMin: Cijk_Alik_Bljk_SB_MT32x32x16_SE_EPS0_FL0_GRVW1_LPA2_LPB2_PGR0_PLR1_TT4_2_USFGRO1_VW2_WG8_16_1_WGM1
    SolutionIndex: 559
    SolutionNameMin: Cijk_Alik_Bljk_SB_MT32x32x16_SE_EPS0_FL1_GRVW4_LPA2_LPB2_PGR0_PLR1_TT4_2_USFGRO1_VW2_WG8_16_1_WGM1
    SolutionIndex: 560
    SolutionNameMin: Cijk_Alik_Bljk_SB_MT32x32x16_SE_EPS0_FL1_GRVW4_LPA2_LPB2_PGR0_PLR1_TT4_2_USFGRO1_VW2_WG8_16_1_WGM8
    SolutionIndex: 561
    SolutionNameMin: Cijk_Alik_Bljk_SB_MT32x32x16_SE_EPS0_FL0_GRVW1_LPA2_LPB2_PGR0_PLR1_TT4_2_USFGRO1_VW2_WG8_16_1_WGM8
    SolutionIndex: 562
    SolutionNameMin: Cijk_Alik_Bljk_SB_MT64x32x8_SE_EPS1_FL0_GRVW4_LPA2_LPB0_PGR1_PLR1_TT4_4_USFGRO1_VW2_WG16_8_1_WGM8
    SolutionIndex: 563
    SolutionNameMin: Cijk_Alik_Bljk_SB_MT32x32x32_SE_EPS0_FL0_GRVW1_LPA2_LPB2_PGR0_PLR0_TT2_4_USFGRO1_VW2_WG16_8_1_WGM1
    SolutionIndex: 564
    SolutionNameMin: Cijk_Alik_Bljk_SB_MT32x32x32_SE_EPS0_FL1_GRVW4_LPA2_LPB2_PGR0_PLR0_TT2_4_USFGRO1_VW2_WG16_8_1_WGM8
    SolutionIndex: 565
    SolutionNameMin: Cijk_Alik_Bljk_SB_MT64x32x16_SE_EPS0_FL0_GRVW2_LPA2_LPB2_PGR0_PLR1_TT4_4_USFGRO1_VW2_WG16_8_1_WGM8
    SolutionIndex: 566
    SolutionNameMin: Cijk_Alik_Bljk_SB_MT64x64x16_SE_EPS0_FL1_GRVW4_LPA2_LPB2_PGR0_PLR0_TT4_4_USFGRO1_VW2_WG16_16_1_WGM1
    SolutionIndex: 567
    SolutionNameMin: Cijk_Alik_Bljk_SB_MT32x32x8_SE_EPS1_FL1_GRVW4_LPA2_LPB0_PGR1_PLR1_TT4_2_USFGRO1_VW2_WG8_16_1_WGM1
    SolutionIndex: 568
    SolutionNameMin: Cijk_Alik_Bljk_SB_MT32x32x8_SE_EPS1_FL0_GRVW4_LPA2_LPB2_PGR1_PLR1_TT2_4_USFGRO1_VW2_WG16_8_1_WGM8
    SolutionIndex: 569
    SolutionNameMin: Cijk_Alik_Bljk_SB_MT64x16x16_SE_EPS0_FL1_GRVW4_LPA2_LPB2_PGR0_PLR1_TT4_2_USFGRO1_VW2_WG16_8_1_WGM1
    SolutionIndex: 570
    SolutionNameMin: Cijk_Alik_Bljk_SB_MT64x64x16_SE_EPS0_FL0_GRVW4_LPA2_LPB2_PGR0_PLR0_TT4_4_USFGRO1_VW2_WG16_16_1_WGM1
    SolutionIndex: 571
    SolutionNameMin: Cijk_Alik_Bljk_SB_MT32x32x8_SE_EPS1_FL0_GRVW4_LPA0_LPB2_PGR1_PLR1_TT2_4_USFGRO1_VW2_WG16_8_1_WGM8
    SolutionIndex: 572
    SolutionNameMin: Cijk_Alik_Bljk_SB_MT64x64x8_SE_EPS1_FL1_GRVW4_LPA2_LPB2_PGR1_PLR1_TT4_4_USFGRO1_VW2_WG16_16_1_WGM1
    SolutionIndex: 573
    SolutionNameMin: Cijk_Alik_Bljk_SB_MT64x32x16_SE_EPS0_FL0_GRVW4_LPA2_LPB2_PGR0_PLR1_TT4_4_USFGRO1_VW2_WG16_8_1_WGM1
    SolutionIndex: 574
    SolutionNameMin: Cijk_Alik_Bljk_SB_MT64x64x16_SE_EPS0_FL1_GRVW4_LPA2_LPB2_PGR0_PLR1_TT4_4_USFGRO1_VW2_WG16_16_1_WGM1
    SolutionIndex: 575
    SolutionNameMin: Cijk_Alik_Bljk_SB_MT64x64x16_SE_EPS0_FL1_GRVW4_LPA2_LPB0_PGR0_PLR1_TT4_4_USFGRO1_VW2_WG16_16_1_WGM1
    SolutionIndex: 576
    SolutionNameMin: Cijk_Alik_Bljk_SB_MT32x64x8_SE_EPS1_FL1_GRVW4_LPA0_LPB2_PGR1_PLR1_TT2_4_USFGRO1_VW2_WG16_16_1_WGM1
    SolutionIndex: 577
    SolutionNameMin: Cijk_Alik_Bljk_SB_MT64x64x16_SE_EPS0_FL0_GRVW4_LPA0_LPB0_PGR0_PLR1_TT4_4_USFGRO1_VW2_WG16_16_1_WGM8
    SolutionIndex: 578
    SolutionNameMin: Cijk_Alik_Bljk_SB_MT32x64x16_SE_EPS0_FL0_GRVW4_LPA4_LPB4_PGR0_PLR1_TT4_4_USFGRO1_VW4_WG8_16_1_WGM1
    SolutionIndex: 579
    SolutionNameMin: Cijk_Alik_Bljk_SB_MT64x32x16_SE_EPS0_FL1_GRVW4_LPA4_LPB4_PGR0_PLR1_TT4_4_USFGRO1_VW4_WG16_8_1_WGM8
    SolutionIndex: 580
    SolutionNameMin: Cijk_Alik_Bljk_SB_MT64x32x16_SE_EPS0_FL1_GRVW4_LPA4_LPB4_PGR0_PLR1_TT4_4_USFGRO1_VW4_WG16_8_1_WGM1
    SolutionIndex: 581
    SolutionNameMin: Cijk_Alik_Bljk_SB_MT32x32x8_SE_EPS0_FL0_GRVW1_GSU1_LPA0_LPB0_PGR0_PLR0_TT2_2_WG16_16_1_WGM1
    SolutionIndex: 582
    SolutionNameMin: Cijk_Alik_Bljk_SB_MT32x32x8_SE_EPS0_FL0_GRVW1_LPA0_LPB0_PGR0_PLR0_TT2_2_VW2_WGM1
    SolutionIndex: 583
    SolutionNameMin: Cijk_Alik_Bljk_SB_MT128x64x16_SE_EPS1_FL1_GRVW4_PGR1_PLR1_TT8_4_VW4_WGM8
    SolutionIndex: 584
    SolutionNameMin: Cijk_Alik_Bljk_SB_MT64x128x16_SE_EPS1_FL0_GRVW4_PGR1_PLR1_TT4_8_VW4_WGM1
    SolutionIndex: 585
    SolutionNameMin: Cijk_Alik_Bljk_SB_MT64x128x16_SE_EPS1_FL1_GRVW4_PGR1_PLR1_TT4_8_VW4_WGM1
    SolutionIndex: 586
    SolutionNameMin: Cijk_Alik_Bljk_SB_MT128x64x16_SE_EPS1_FL1_GRVW4_PGR1_PLR1_TT8_4_VW4_WGM1
    SolutionIndex: 587
    SolutionNameMin: Cijk_Alik_Bljk_SB_MT128x64x16_SE_EPS1_FL0_GRVW4_PGR1_PLR1_TT8_4_VW4_WGM8
    SolutionIndex: 588
    SolutionNameMin: Cijk_Alik_Bljk_SB_MT128x64x16_SE_EPS1_FL0_GRVW4_PGR1_PLR1_TT8_4_VW4_WGM1
    SolutionIndex: 589
    SolutionNameMin: Cijk_Alik_Bljk_SB_MT64x128x16_SE_EPS1_FL0_GRVW4_PGR1_PLR0_TT4_8_VW4_WGM1
    SolutionIndex: 590
    SolutionNameMin: Cijk_Alik_Bljk_SB_MT128x128x16_SE_EPS1_FL1_GRVW4_PGR1_PLR1_TT8_8_VW4_WGM1
    SolutionIndex: 591
    SolutionNameMin: Cijk_Alik_Bljk_SB_MT128x128x16_SE_EPS1_FL0_GRVW4_PGR1_PLR1_TT8_8_VW4_WGM8
    SolutionIndex: 592
    SolutionNameMin: Cijk_Alik_Bljk_SB_MT128x128x16_SE_EPS1_FL0_GRVW4_PGR1_PLR1_TT8_8_VW4_WGM1
    SolutionIndex: 593
    SolutionNameMin: Cijk_Alik_Bljk_SB_MT128x128x16_SE_EPS1_FL0_GRVW2_PGR1_PLR1_TT8_8_VW4_WGM1
    SolutionIndex: 594
    SolutionNameMin: Cijk_Alik_Bljk_SB_MT128x128x32_SE_EPS1_FL0_GRVW4_PGR1_PLR1_TT8_8_VW4_WGM8
    SolutionIndex: 595
    SolutionNameMin: Cijk_Alik_Bljk_SB_MT128x128x32_SE_EPS1_FL1_GRVW4_PGR1_PLR1_TT8_8_VW4_WGM8
    SolutionIndex: 596
    SolutionNameMin: Cijk_Alik_Bljk_SB_MT128x64x16_SE_EPS1_FL0_GRVW4_PGR1_PLR1_TT8_4_VW2_WGM8
    SolutionIndex: 597
    SolutionNameMin: Cijk_Alik_Bljk_SB_MT128x128x16_SE_EPS1_FL1_GRVW2_PGR1_PLR1_TT8_8_VW4_WGM1
    SolutionIndex: 598
    SolutionNameMin: Cijk_Alik_Bljk_SB_MT128x128x16_SE_EPS1_FL1_GRVW4_PGR1_PLR1_TT8_8_VW4_WGM8
    SolutionIndex: 599
    SolutionNameMin: Cijk_Alik_Bljk_SB_MT128x128x16_SE_EPS1_FL0_GRVW4_PGR1_PLR1_TT8_8_VW2_WGM1
    SolutionIndex: 600
    SolutionNameMin: Cijk_Alik_Bljk_SB_MT64x128x8_SE_EPS1_FL1_GRVW2_PGR1_PLR1_TT4_8_VW4_WGM8
    SolutionIndex: 601
    SolutionNameMin: Cijk_Alik_Bljk_SB_MT64x128x8_SE_EPS1_FL1_GRVW2_PGR1_PLR1_TT4_8_VW2_WGM8
    SolutionIndex: 602
    SolutionNameMin: Cijk_Alik_Bljk_SB_MT64x128x8_SE_EPS1_FL0_GRVW4_PGR1_PLR1_TT4_8_VW4_WGM8
    SolutionIndex: 603
    SolutionNameMin: Cijk_Alik_Bljk_SB_MT64x128x8_SE_EPS1_FL1_GRVW4_PGR1_PLR1_TT4_8_VW4_WGM8
    SolutionIndex: 604
    SolutionNameMin: Cijk_Alik_Bljk_SB_MT64x128x8_SE_EPS1_FL0_GRVW2_PGR1_PLR1_TT4_8_VW4_WGM8
    SolutionIndex: 605
    SolutionNameMin: Cijk_Alik_Bljk_SB_MT64x128x8_SE_EPS1_FL1_GRVW4_PGR1_PLR1_TT4_8_VW2_WGM8
    SolutionIndex: 606
    SolutionNameMin: Cijk_Alik_Bljk_SB_MT64x128x8_SE_EPS1_FL0_GRVW4_PGR1_PLR1_TT4_8_VW2_WGM8
    SolutionIndex: 607
    SolutionNameMin: Cijk_Alik_Bljk_SB_MT128x64x16_SE_EPS1_FL1_GRVW4_PGR1_PLR1_TT8_4_VW2_WGM8
    SolutionIndex: 608
    SolutionNameMin: Cijk_Alik_Bljk_SB_MT128x64x8_SE_EPS1_FL0_GRVW2_PGR1_PLR0_TT8_4_VW4_WGM8
    SolutionIndex: 609
    SolutionNameMin: Cijk_Alik_Bljk_SB_MT128x64x8_SE_EPS1_FL1_GRVW2_PGR1_PLR0_TT8_4_VW4_WGM8
    SolutionIndex: 610
    SolutionNameMin: Cijk_Alik_Bljk_SB_MT128x64x8_SE_EPS1_FL0_GRVW2_PGR1_PLR0_TT8_4_VW2_WGM8
    SolutionIndex: 611
    SolutionNameMin: Cijk_Alik_Bljk_SB_MT128x64x8_SE_EPS1_FL0_GRVW2_PGR1_PLR1_TT8_4_VW4_WGM8
    SolutionIndex: 612
    SolutionNameMin: Cijk_Alik_Bljk_SB_MT128x64x8_SE_EPS1_FL1_GRVW2_PGR1_PLR1_TT8_4_VW4_WGM8
    SolutionIndex: 613
    SolutionNameMin: Cijk_Alik_Bljk_SB_MT128x64x8_SE_EPS1_FL1_GRVW2_PGR1_PLR0_TT8_4_VW2_WGM8
    SolutionIndex: 614
    SolutionNameMin: Cijk_Alik_Bljk_SB_MT128x64x8_SE_EPS1_FL1_GRVW4_PGR1_PLR1_TT8_4_VW4_WGM8
    SolutionIndex: 615
    SolutionNameMin: Cijk_Alik_Bljk_SB_MT128x64x8_SE_EPS1_FL1_GRVW4_PGR1_PLR0_TT8_4_VW2_WGM8
    SolutionIndex: 616
    SolutionNameMin: Cijk_Alik_Bljk_SB_MT128x64x8_SE_EPS1_FL1_GRVW4_PGR1_PLR0_TT8_4_VW4_WGM8
    SolutionIndex: 617
    SolutionNameMin: Cijk_Alik_Bljk_SB_MT128x64x8_SE_EPS1_FL0_GRVW4_PGR1_PLR0_TT8_4_VW4_WGM8
    SolutionIndex: 618
    SolutionNameMin: Cijk_Alik_Bljk_SB_MT128x64x8_SE_EPS1_FL0_GRVW4_PGR1_PLR1_TT8_4_VW4_WGM8
    SolutionIndex: 619
    SolutionNameMin: Cijk_Alik_Bljk_SB_MT128x64x8_SE_EPS1_FL0_GRVW4_PGR1_PLR0_TT8_4_VW2_WGM8
    SolutionIndex: 620
    SolutionNameMin: Cijk_Alik_Bljk_SB_MT128x128x8_SE_EPS1_FL0_GRVW4_PGR1_PLR1_TT8_8_VW4_WGM8
    SolutionIndex: 621
    SolutionNameMin: Cijk_Alik_Bljk_SB_MT128x128x8_SE_EPS1_FL0_GRVW2_PGR1_PLR1_TT8_8_VW4_WGM8
    SolutionIndex: 622
    SolutionNameMin: Cijk_Alik_Bljk_SB_MT128x128x8_SE_EPS1_FL1_GRVW4_PGR1_PLR1_TT8_8_VW2_WGM8
    SolutionIndex: 623
    SolutionNameMin: Cijk_Alik_Bljk_SB_MT128x128x8_SE_EPS1_FL1_GRVW4_PGR1_PLR0_TT8_8_VW4_WGM8
    SolutionIndex: 624
    SolutionNameMin: Cijk_Alik_Bljk_SB_MT128x128x8_SE_EPS1_FL1_GRVW4_PGR1_PLR1_TT8_8_VW4_WGM8
    SolutionIndex: 625
    SolutionNameMin: Cijk_Alik_Bljk_SB_MT128x64x8_SE_EPS1_FL0_GRVW4_PGR1_PLR1_TT8_4_VW2_WGM8
    SolutionIndex: 626
    SolutionNameMin: Cijk_Alik_Bljk_SB_MT128x64x8_SE_EPS1_FL1_GRVW4_PGR1_PLR1_TT8_4_VW2_WGM8
    SolutionIndex: 627
    SolutionNameMin: Cijk_Alik_Bljk_SB_MT64x128x8_SE_EPS1_FL0_GRVW4_PGR1_PLR0_TT4_8_VW4_WGM8
    SolutionIndex: 628
    SolutionNameMin: Cijk_Alik_Bljk_SB_MT64x128x8_SE_EPS1_FL1_GRVW4_PGR1_PLR0_TT4_8_VW4_WGM8
    SolutionIndex: 629
    SolutionNameMin: Cijk_Alik_Bljk_SB_MT8x32x16_SE_EPS1_FL1_GRVW2_LPA2_LPB2_PGR1_PLR0_TT2_2_VW2_WGM1
    SolutionIndex: 630
    SolutionNameMin: Cijk_Alik_Bljk_SB_MT64x128x32_SE_
    SolutionIndex: 631
    SolutionNameMin: Cijk_Alik_Bljk_SB_MT128x64x16_SE_
    SolutionIndex: 632
    SolutionNameMin: Cijk_Alik_Bljk_SB_MT128x64x16_SE_
    SolutionIndex: 633
    SolutionNameMin: Cijk_Alik_Bljk_SB_MT256x128x16_SE_
    SolutionIndex: 634
    SolutionNameMin: Cijk_Alik_Bljk_SB_MT256x128x16_SE_
    SolutionIndex: 635
    SolutionNameMin: Cijk_Alik_Bljk_SB_MT64x128x16_SE_
    SolutionIndex: 636
    SolutionNameMin: Cijk_Alik_Bljk_SB_MT64x128x16_SE_
    SolutionIndex: 637
    SolutionNameMin: Cijk_Alik_Bljk_SB_MT128x32x16_SE_
    SolutionIndex: 638
    SolutionNameMin: Cijk_Alik_Bljk_SB_MT32x128x16_SE_
    SolutionIndex: 639
    SolutionNameMin: Cijk_Alik_Bljk_SB_MT32x128x16_SE_GRVW1_ONLL1_SNLL0
    SolutionIndex: 640
    SolutionNameMin: Cijk_Alik_Bljk_SB_MT64x128x16_SE_GRVW1_ONLL1_SNLL0
    SolutionIndex: 641
    SolutionNameMin: Cijk_Alik_Bljk_SB_MT128x64x16_SE_GRVW1_ONLL1_SNLL0
    SolutionIndex: 642
    SolutionNameMin: Cijk_Alik_Bljk_SB_MT256x64x16_SE_GRVW1_ONLL1_SNLL0
    SolutionIndex: 643
    SolutionNameMin: Cijk_Alik_Bljk_SB_MT64x256x16_SE_GRVW1_ONLL1_SNLL0
    SolutionIndex: 644
    SolutionNameMin: Cijk_Alik_Bljk_SB_MT128x64x16_SE_GRVW1_ONLL1_SNLL0
    SolutionIndex: 645
    SolutionNameMin: Cijk_Alik_Bljk_SB_MT256x128x16_SE_GRVW1_ONLL1_SNLL0
    SolutionIndex: 646
    SolutionNameMin: Cijk_Alik_Bljk_SB_MT128x32x16_SE_GRVW1_ONLL1_SNLL0
    SolutionIndex: 647
    SolutionNameMin: Cijk_Alik_Bljk_SB_MT64x128x16_SE_GRVW1_ONLL1_SNLL0
    SolutionIndex: 648
    SolutionNameMin: Cijk_Alik_Bljk_SB_MT32x64x32_SE_GRVW2_ONLL1_SNLL0
    SolutionIndex: 649
    SolutionNameMin: Cijk_Alik_Bljk_SB_MT64x32x32_SE_GRVW2_ONLL1_SNLL0
    SolutionIndex: 650
    SolutionNameMin: Cijk_Alik_Bljk_SB_MT64x128x16_MI32x32x1x2_SE_GRVW4_ONLL1_SNLL0
    SolutionIndex: 651
    SolutionNameMin: Cijk_Alik_Bljk_SB_MT64x128x16_MI32x32x1x2_SE_GRVW2_ONLL1_SNLL0
    SolutionIndex: 652
    SolutionNameMin: Cijk_Alik_Bljk_SB_MT64x128x16_MI32x32x1x2_SE_FL0_GRVW2_LPA0_LPB1_ONLL0_PLR0_SNLL0_TT1_32_USFGRO1_WG64_4_1
    SolutionIndex: 653
    SolutionNameMin: Cijk_Alik_Bljk_SB_MT128x256x16_MI32x32x1x2_SE_FL0_GRVW2_LPA1_LPB1_ONLL0_PLR1_SNLL0_TT2_64_USFGRO1_WG64_4_1
    SolutionIndex: 654
    SolutionNameMin: Cijk_Alik_Bljk_SB_MT64x128x16_MI32x32x1x2_SE_FL0_GRVW4_LPA1_LPB1_ONLL1_PLR1_SNLL0_TT1_32_USFGRO0_WG64_4_1
    SolutionIndex: 655
    SolutionNameMin: Cijk_Alik_Bljk_SB_MT128x128x16_MI32x32x1x2_SE_FL1_GRVW4_LPA0_LPB0_ONLL0_PLR0_SNLL1_TT2_32_USFGRO1_WG64_4_1
    SolutionIndex: 656
    SolutionNameMin: Cijk_Alik_Bljk_SB_MT128x128x16_MI32x32x1x2_SE_FL1_GRVW4_LPA0_LPB0_ONLL1_PLR1_SNLL1_TT2_32_USFGRO0_WG64_4_1
    SolutionIndex: 657
    SolutionNameMin: Cijk_Alik_Bljk_SB_MT256x128x16_MI32x32x1x2_SE_FL0_GRVW2_LPA1_LPB1_ONLL1_PLR0_SNLL1_TT4_32_USFGRO0_WG64_4_1
    SolutionIndex: 658
    SolutionNameMin: Cijk_Alik_Bljk_SB_MT64x128x16_MI32x32x1x2_SE_FL0_GRVW1_LPA1_LPB1_ONLL1_PLR0_SNLL0_TT1_32_USFGRO1_WG64_4_1
    SolutionIndex: 659
    SolutionNameMin: Cijk_Alik_Bljk_SB_MT128x128x16_MI32x32x1x2_SE_FL1_GRVW4_LPA0_LPB0_ONLL1_PLR1_SNLL0_TT2_32_USFGRO0_WG64_4_1
    SolutionIndex: 660
    SolutionNameMin: Cijk_Alik_Bljk_SB_MT256x128x16_MI32x32x1x2_SE_FL0_GRVW4_LPA1_LPB0_ONLL1_PLR1_SNLL1_TT4_32_USFGRO1_WG64_4_1
    SolutionIndex: 661
    SolutionNameMin: Cijk_Alik_Bljk_SB_MT128x128x16_MI32x32x1x2_SE_FL1_GRVW4_LPA0_LPB0_ONLL0_PLR1_SNLL0_TT2_32_USFGRO0_WG64_4_1
    SolutionIndex: 662
    SolutionNameMin: Cijk_Alik_Bljk_SB_MT256x128x16_MI32x32x1x2_SE_FL1_GRVW4_LPA1_LPB1_ONLL0_PLR1_SNLL1_TT4_32_USFGRO1_WG64_4_1
    SolutionIndex: 663
    SolutionNameMin: Cijk_Alik_Bljk_SB_MT256x128x16_MI32x32x1x2_SE_FL0_GRVW4_LPA0_LPB0_ONLL1_PLR1_SNLL1_TT4_32_USFGRO1_WG64_4_1
    SolutionIndex: 664
    SolutionNameMin: Cijk_Alik_Bljk_SB_MT128x128x16_MI32x32x1x2_SE_FL1_GRVW4_LPA0_LPB0_ONLL0_PLR1_SNLL1_TT2_32_USFGRO1_WG64_4_1
    SolutionIndex: 665
    SolutionNameMin: Cijk_Alik_Bljk_SB_MT128x128x16_MI32x32x1x2_SE_FL0_GRVW4_LPA0_LPB0_ONLL0_PLR0_SNLL0_TT2_32_USFGRO1_WG64_4_1
    SolutionIndex: 666
    SolutionNameMin: Cijk_Alik_Bljk_SB_MT128x128x16_MI32x32x1x2_SE_FL1_GRVW4_LPA0_LPB0_ONLL1_PLR0_SNLL0_TT2_32_USFGRO0_WG64_4_1
    SolutionIndex: 667
    SolutionNameMin: Cijk_Alik_Bljk_SB_MT128x128x16_MI32x32x1x2_SE_FL1_GRVW4_LPA0_LPB0_ONLL1_PLR0_SNLL1_TT2_32_USFGRO0_WG64_4_1
    SolutionIndex: 668
    SolutionNameMin: Cijk_Alik_Bljk_SB_MT128x128x16_MI32x32x1x2_SE_FL0_GRVW4_LPA0_LPB0_ONLL1_PLR0_SNLL0_TT2_32_USFGRO0_WG64_4_1
    SolutionIndex: 669
    SolutionNameMin: Cijk_Alik_Bljk_SB_MT128x128x16_MI32x32x1x2_SE_FL0_GRVW4_LPA0_LPB0_ONLL1_PLR0_SNLL1_TT2_32_USFGRO0_WG64_4_1
    SolutionIndex: 670
    SolutionNameMin: Cijk_Alik_Bljk_SB_MT32x256x8_MI32x32x1x2_SE_FL0_GRVW4_LPA1_LPB0_ONLL1_PLR1_SNLL1_TT1_32_USFGRO0_WG16_16_1
    SolutionIndex: 671
    SolutionNameMin: Cijk_Alik_Bljk_SB_MT32x256x8_MI32x32x1x2_SE_FL0_GRVW4_LPA0_LPB0_ONLL1_PLR0_SNLL0_TT1_32_USFGRO0_WG16_16_1
    SolutionIndex: 672
    SolutionNameMin: Cijk_Alik_Bljk_SB_MT32x256x8_MI32x32x1x2_SE_FL0_GRVW4_LPA0_LPB0_ONLL0_PLR0_SNLL1_TT1_32_USFGRO0_WG16_16_1
    SolutionIndex: 673
    SolutionNameMin: Cijk_Alik_Bljk_SB_MT32x256x8_MI32x32x1x2_SE_FL0_GRVW1_LPA0_LPB0_ONLL0_PLR0_SNLL1_TT1_32_USFGRO0_WG16_16_1
    SolutionIndex: 674
    SolutionNameMin: Cijk_Alik_Bljk_SB_MT32x256x8_MI32x32x1x2_SE_FL0_GRVW4_LPA1_LPB1_ONLL1_PLR0_SNLL1_TT1_32_USFGRO0_WG16_16_1
    SolutionIndex: 675
    SolutionNameMin: Cijk_Alik_Bljk_SB_MT64x128x8_MI32x32x1x2_SE_FL0_GRVW4_LPA0_LPB0_ONLL0_PLR1_SNLL1_TT1_32_USFGRO1_WG64_4_1
    SolutionIndex: 676
    SolutionNameMin: Cijk_Alik_Bljk_SB_MT64x128x8_MI32x32x1x2_SE_FL0_GRVW4_LPA0_LPB0_ONLL0_PLR1_SNLL1_TT1_32_USFGRO0_WG64_4_1
    SolutionIndex: 677
    SolutionNameMin: Cijk_Alik_Bljk_SB_MT32x128x32_MI32x32x2x1_SE_FL0_GRVW4_LPA1_LPB1_ONLL1_PLR1_SNLL1_TT1_32_USFGRO1
    SolutionIndex: 678
    SolutionNameMin: Cijk_Alik_Bljk_SB_MT32x128x32_MI32x32x2x1_SE_FL0_GRVW4_LPA0_LPB1_ONLL0_PLR0_SNLL1_TT1_32_USFGRO0
    SolutionIndex: 679
    SolutionNameMin: Cijk_Alik_Bljk_SB_MT32x128x32_MI32x32x2x1_SE_FL0_GRVW4_LPA1_LPB1_ONLL0_PLR1_SNLL0_TT1_32_USFGRO1
    SolutionIndex: 680
    SolutionIndex: 681
    SolutionIndex: 682
    SolutionIndex: 683
    SolutionIndex: 684
    SolutionIndex: 685
    SolutionIndex: 686
    SolutionIndex: 687
    SolutionIndex: 688
    SolutionIndex: 689
    SolutionIndex: 690
    SolutionIndex: 691
    SolutionIndex: 692
    SolutionIndex: 693
    SolutionIndex: 694
    SolutionIndex: 695
    SolutionIndex: 696
    SolutionIndex: 697
    SolutionIndex: 698
    SolutionIndex: 765
    SolutionIndex: 766
    SolutionIndex: 767
    SolutionIndex: 774
    SolutionIndex: 775
    SolutionIndex: 776
    SolutionIndex: 777
    SolutionIndex: 778
    SolutionNameMin: Cijk_Alik_Bljk_SB_MT64x128x32_SE_
- - - [1024, 512, 1, 1600]
    - [1, 37.472]
  - - [2048, 512, 1, 100]
    - [15, 21.878]
  - - [1024, 4096, 1, 1024]
    - [682, 67.768]
  - - [4096, 4096, 1, 1024]
    - [684, 83.337]
  - - [1024, 4096, 1, 4096]
    - [683, 70.761]
  - - [30528, 4096, 1, 1024]
    - [686, 89.817]
  - - [1024, 2048, 1, 1024]
    - [681, 56.24]
  - - [4096, 2048, 1, 1024]
    - [685, 78.896]
  - - [1024, 2048, 1, 4096]
    - [778, 66.108]
  - - [30528, 2048, 1, 1024]
    - [686, 87.136]
  - - [30522, 320, 1, 768]
    - [8, 55.311]
  - - [3072, 4096, 1, 768]
    - [0, 75.045]
  - - [768, 4096, 1, 3072]
    - [4, 70.133]
  - - [768, 4096, 1, 768]
    - [15, 65.32]
  - - [30522, 160, 1, 768]
    - [7, 41.605]
  - - [30522, 640, 1, 768]
    - [6, 65.799]
  - - [768, 640, 1, 768]
    - [23, 41.14]
  - - [30522, 1280, 1, 768]
    - [8, 70.082]
  - - [768, 1280, 1, 768]
    - [778, 73.512]
  - - [1024, 3072, 1, 1024]
    - [778, 66.081]
  - - [1024, 512, 1, 1024]
    - [3, 37.259]
  - - [1024, 2048, 1, 3072]
    - [680, 58.68]
  - - [1024, 3072, 1, 3072]
    - [686, 73.745]
  - - [1024, 512, 1, 3072]
    - [3, 40.509]
  - - [3072, 2048, 1, 1024]
    - [687, 75.647]
  - - [3072, 3072, 1, 1024]
    - [684, 83.488]
  - - [3072, 512, 1, 1024]
    - [778, 64.109]
  - - [30522, 120, 1, 1024]
    - [5, 50.876]
  - - [30522, 20, 1, 1024]
    - [17, 19.285]
  - - [30522, 80, 1, 1024]
    - [6, 37.672]
  - - [30522, 160, 1, 1024]
    - [7, 43.475]
  - - [1024, 200, 1, 560]
    - [765, 21.523]
  - - [768, 320, 1, 768]
    - [13, 25.801]
  - - [768, 32, 1, 768]
    - [22, 2.745]
  - - [768, 64, 1, 768]
    - [22, 5.392]
  - - [1024, 80, 1, 1024]
    - [22, 9.502]
  - - [1024, 120, 1, 1024]
    - [22, 13.127]
  - - [1024, 20, 1, 1024]
    - [21, 2.375]
  - - [768, 16, 1, 768]
    - [21, 1.411]
  - - [1024, 4, 1, 1024]
    - [21, 0.467]
  - - [1024, 6, 1, 1024]
    - [21, 0.723]
  - - [128, 128, 512, 64]
    - [12, 31.129]
  - - [64, 128, 512, 128]
    - [19, 31.474]
  - - [64, 512, 64, 512]
    - [2, 41.478]
  - - [512, 512, 64, 64]
    - [10, 42.513]
  - - [256, 256, 192, 64]
    - [11, 38.007]
  - - [256, 256, 96, 64]
    - [14, 34.328]
  - - [128, 128, 384, 64]
    - [10, 31.07]
  - - [128, 128, 96, 64]
    - [9, 21.284]
  - - [64, 64, 768, 64]
    - [20, 20.336]
  - - [64, 64, 96, 64]
    - [13, 9.281]
  - - [512, 512, 16, 64]
    - [16, 31.415]
  - - [512, 512, 96, 64]
    - [18, 43.921]
  - - [512, 512, 128, 64]
    - [18, 43.883]
  - - [1024, 128, 1, 128]
    - [24, 0.0]
  - - [4, 704, 1, 1280]
    - [25, 0.0]
  - - [4, 1856, 1, 3328]
    - [26, 0.0]
  - - [1856, 448, 1, 3328]
    - [27, 0.0]
  - - [2944, 4288, 1, 1280]
    - [28, 0.0]
  - - [2368, 64, 1, 3328]
    - [29, 0.0]
  - - [1760, 32, 1, 1760]
    - [30, 0.0]
  - - [2368, 5888, 1, 256]
    - [28, 0.0]
  - - [5888, 1856, 1, 256]
    - [31, 0.0]
  - - [128, 64, 1, 256]
    - [32, 0.0]
  - - [512, 24000, 1, 1536]
    - [33, 0.0]
  - - [128, 6784, 1, 3328]
    - [33, 0.0]
  - - [5888, 1408, 1, 256]
    - [34, 0.0]
  - - [5888, 1856, 1, 3328]
    - [33, 0.0]
  - - [5056, 704, 1, 256]
    - [33, 0.0]
  - - [2048, 400, 1, 512]
    - [31, 0.0]
  - - [5888, 2944, 1, 3328]
    - [31, 0.0]
  - - [1856, 4288, 1, 256]
    - [31, 0.0]
  - - [1024, 5056, 1, 128]
    - [35, 0.0]
  - - [5056, 5056, 1, 3328]
    - [33, 0.0]
  - - [1408, 5888, 1, 1280]
    - [36, 0.0]
  - - [2368, 448, 1, 128]
    - [35, 0.0]
  - - [2368, 6784, 1, 128]
    - [37, 0.0]
  - - [1024, 3584, 1, 3328]
    - [38, 0.0]
  - - [512, 48000, 1, 2048]
    - [33, 0.0]
  - - [128, 448, 1, 1280]
    - [30, 0.0]
  - - [256, 4288, 1, 3328]
    - [39, 0.0]
  - - [5888, 1408, 1, 1280]
    - [33, 0.0]
  - - [704, 1856, 1, 3328]
    - [36, 0.0]
  - - [4, 1408, 1, 128]
    - [40, 0.0]
  - - [1024, 2368, 1, 256]
    - [41, 0.0]
  - - [64, 4, 1, 256]
    - [42, 0.0]
  - - [1408, 1856, 1, 1280]
    - [43, 0.0]
  - - [1408, 64, 1, 1280]
    - [44, 0.0]
  - - [448, 1024, 1, 1280]
    - [41, 0.0]
  - - [6144, 24000, 1, 2048]
    - [31, 0.0]
  - - [4096, 32, 1, 4096]
    - [29, 0.0]
  - - [256, 1408, 1, 3328]
    - [41, 0.0]
  - - [5056, 5056, 1, 1280]
    - [31, 0.0]
  - - [448, 5056, 1, 256]
    - [45, 0.0]
  - - [704, 1856, 1, 1280]
    - [43, 0.0]
  - - [128, 5056, 1, 128]
    - [46, 0.0]
  - - [2368, 128, 1, 256]
    - [36, 0.0]
  - - [1760, 6400, 1, 1760]
    - [28, 0.0]
  - - [1856, 1408, 1, 128]
    - [47, 0.0]
  - - [64, 5056, 1, 256]
    - [38, 0.0]
  - - [6784, 256, 1, 3328]
    - [28, 0.0]
  - - [6784, 4288, 1, 3328]
    - [38, 0.0]
  - - [4288, 448, 1, 256]
    - [45, 0.0]
  - - [64, 704, 1, 128]
    - [48, 0.0]
  - - [1856, 2368, 1, 3328]
    - [49, 0.0]
  - - [4288, 2944, 1, 1280]
    - [31, 0.0]
  - - [704, 5056, 1, 1280]
    - [41, 0.0]
  - - [2368, 704, 1, 3328]
    - [39, 0.0]
  - - [256, 5888, 1, 256]
    - [50, 0.0]
  - - [1856, 4288, 1, 3328]
    - [49, 0.0]
  - - [256, 2944, 1, 256]
    - [39, 0.0]
  - - [5888, 1024, 1, 256]
    - [31, 0.0]
  - - [448, 64, 1, 1280]
    - [51, 0.0]
  - - [3072, 64, 1, 1024]
    - [52, 0.0]
  - - [3584, 4, 1, 1280]
    - [25, 0.0]
  - - [16384, 3200, 1, 4096]
    - [53, 0.0]
  - - [2944, 64, 1, 256]
    - [39, 0.0]
  - - [128, 4, 1, 1280]
    - [26, 0.0]
  - - [1408, 2944, 1, 256]
    - [33, 0.0]
  - - [256, 1856, 1, 1280]
    - [36, 0.0]
  - - [6784, 5056, 1, 3328]
    - [54, 0.0]
  - - [5056, 5056, 1, 256]
    - [45, 0.0]
  - - [1408, 6784, 1, 128]
    - [55, 0.0]
  - - [64, 1024, 1, 1280]
    - [30, 0.0]
  - - [2944, 4, 1, 256]
    - [42, 0.0]
  - - [704, 5056, 1, 128]
    - [35, 0.0]
  - - [4, 2368, 1, 1280]
    - [56, 0.0]
  - - [2368, 2944, 1, 1280]
    - [33, 0.0]
  - - [128, 3584, 1, 1280]
    - [39, 0.0]
  - - [6784, 6784, 1, 1280]
    - [31, 0.0]
  - - [1408, 4288, 1, 1280]
    - [31, 0.0]
  - - [3584, 4288, 1, 1280]
    - [39, 0.0]
  - - [2368, 704, 1, 1280]
    - [28, 0.0]
  - - [5056, 4288, 1, 3328]
    - [33, 0.0]
  - - [3584, 2368, 1, 3328]
    - [49, 0.0]
  - - [64, 704, 1, 1280]
    - [44, 0.0]
  - - [4288, 256, 1, 256]
    - [41, 0.0]
  - - [2944, 128, 1, 128]
    - [46, 0.0]
  - - [6144, 32, 1, 2560]
    - [57, 0.0]
  - - [6784, 448, 1, 1280]
    - [54, 0.0]
  - - [1408, 2944, 1, 128]
    - [37, 0.0]
  - - [4288, 2944, 1, 256]
    - [28, 0.0]
  - - [5888, 704, 1, 1280]
    - [36, 0.0]
  - - [5056, 4, 1, 3328]
    - [58, 0.0]
  - - [1856, 64, 1, 1280]
    - [29, 0.0]
  - - [1760, 16, 1, 1760]
    - [59, 0.0]
  - - [448, 5888, 1, 128]
    - [55, 0.0]
  - - [5888, 64, 1, 3328]
    - [60, 0.0]
  - - [2944, 256, 1, 3328]
    - [39, 0.0]
  - - [1024, 64, 1, 128]
    - [24, 0.0]
  - - [5056, 2368, 1, 1280]
    - [36, 0.0]
  - - [448, 3584, 1, 1280]
    - [33, 0.0]
  - - [6784, 5888, 1, 256]
    - [33, 0.0]
  - - [704, 1024, 1, 128]
    - [35, 0.0]
  - - [704, 128, 1, 1280]
    - [30, 0.0]
  - - [4, 3584, 1, 128]
    - [40, 0.0]
  - - [1408, 448, 1, 1280]
    - [36, 0.0]
  - - [1024, 1408, 1, 256]
    - [50, 0.0]
  - - [2368, 2368, 1, 3328]
    - [53, 0.0]
  - - [1856, 6784, 1, 128]
    - [35, 0.0]
  - - [5056, 704, 1, 3328]
    - [54, 0.0]
  - - [1408, 1856, 1, 256]
    - [31, 0.0]
  - - [1408, 704, 1, 3328]
    - [43, 0.0]
  - - [2368, 5056, 1, 256]
    - [31, 0.0]
  - - [1408, 256, 1, 1280]
    - [39, 0.0]
  - - [3072, 128, 1, 1024]
    - [61, 0.0]
  - - [3584, 2368, 1, 1280]
    - [41, 0.0]
  - - [4288, 64, 1, 3328]
    - [62, 0.0]
  - - [2368, 4, 1, 1280]
    - [63, 0.0]
  - - [704, 5888, 1, 256]
    - [64, 0.0]
  - - [6784, 2944, 1, 128]
    - [65, 0.0]
  - - [2560, 1600, 1, 2560]
    - [38, 0.0]
  - - [4288, 6784, 1, 3328]
    - [53, 0.0]
  - - [2944, 256, 1, 256]
    - [39, 0.0]
  - - [2944, 6784, 1, 3328]
    - [31, 0.0]
  - - [704, 1408, 1, 3328]
    - [39, 0.0]
  - - [6144, 5984, 1, 2048]
    - [33, 0.0]
  - - [3584, 704, 1, 3328]
    - [31, 0.0]
  - - [2944, 256, 1, 128]
    - [65, 0.0]
  - - [6784, 4, 1, 1280]
    - [66, 0.0]
  - - [1024, 64, 1, 1280]
    - [30, 0.0]
  - - [2048, 1600, 1, 512]
    - [43, 0.0]
  - - [448, 4288, 1, 256]
    - [38, 0.0]
  - - [64, 3584, 1, 3328]
    - [67, 0.0]
  - - [1856, 4288, 1, 128]
    - [47, 0.0]
  - - [704, 2368, 1, 1280]
    - [45, 0.0]
  - - [1856, 2368, 1, 1280]
    - [64, 0.0]
  - - [2368, 128, 1, 3328]
    - [68, 0.0]
  - - [2944, 128, 1, 256]
    - [64, 0.0]
  - - [448, 1408, 1, 256]
    - [39, 0.0]
  - - [1856, 4288, 1, 1280]
    - [38, 0.0]
  - - [64, 5056, 1, 3328]
    - [57, 0.0]
  - - [4, 704, 1, 256]
    - [63, 0.0]
  - - [1024, 448, 1, 128]
    - [35, 0.0]
  - - [704, 4, 1, 1280]
    - [42, 0.0]
  - - [704, 256, 1, 128]
    - [37, 0.0]
  - - [704, 2944, 1, 128]
    - [37, 0.0]
  - - [1408, 1024, 1, 1280]
    - [38, 0.0]
  - - [704, 6784, 1, 256]
    - [33, 0.0]
  - - [6784, 704, 1, 256]
    - [38, 0.0]
  - - [5056, 1408, 1, 128]
    - [55, 0.0]
  - - [2048, 7000, 1, 2048]
    - [33, 0.0]
  - - [256, 3584, 1, 3328]
    - [54, 0.0]
  - - [4, 5888, 1, 3328]
    - [69, 0.0]
  - - [128, 1408, 1, 128]
    - [70, 0.0]
  - - [3584, 4288, 1, 3328]
    - [31, 0.0]
  - - [5888, 1856, 1, 1280]
    - [28, 0.0]
  - - [256, 1408, 1, 256]
    - [36, 0.0]
  - - [5056, 64, 1, 1280]
    - [36, 0.0]
  - - [1024, 704, 1, 256]
    - [36, 0.0]
  - - [448, 128, 1, 128]
    - [24, 0.0]
  - - [2368, 3584, 1, 1280]
    - [33, 0.0]
  - - [2368, 6784, 1, 1280]
    - [53, 0.0]
  - - [1856, 4, 1, 1280]
    - [71, 0.0]
  - - [448, 448, 1, 256]
    - [36, 0.0]
  - - [2944, 3584, 1, 3328]
    - [33, 0.0]
  - - [7680, 32, 1, 2560]
    - [57, 0.0]
  - - [128, 4288, 1, 128]
    - [72, 0.0]
  - - [256, 256, 1, 3328]
    - [30, 0.0]
  - - [128, 1024, 1, 3328]
    - [29, 0.0]
  - - [4, 1408, 1, 3328]
    - [26, 0.0]
  - - [6784, 2944, 1, 256]
    - [28, 0.0]
  - - [64, 1856, 1, 1280]
    - [73, 0.0]
  - - [6784, 64, 1, 128]
    - [35, 0.0]
  - - [4288, 2368, 1, 3328]
    - [54, 0.0]
  - - [1856, 2368, 1, 256]
    - [43, 0.0]
  - - [3584, 256, 1, 128]
    - [37, 0.0]
  - - [3584, 6784, 1, 3328]
    - [33, 0.0]
  - - [256, 1024, 1, 256]
    - [39, 0.0]
  - - [4, 6784, 1, 3328]
    - [26, 0.0]
  - - [1024, 5888, 1, 3328]
    - [33, 0.0]
  - - [1024, 128, 1, 1280]
    - [74, 0.0]
  - - [3072, 32, 1, 1024]
    - [75, 0.0]
  - - [6144, 24000, 1, 2560]
    - [33, 0.0]
  - - [5056, 4288, 1, 1280]
    - [43, 0.0]
  - - [5888, 64, 1, 256]
    - [76, 0.0]
  - - [6784, 1856, 1, 3328]
    - [28, 0.0]
  - - [1408, 5056, 1, 1280]
    - [38, 0.0]
  - - [1856, 256, 1, 1280]
    - [39, 0.0]
  - - [64, 5888, 1, 3328]
    - [77, 0.0]
  - - [2368, 2368, 1, 1280]
    - [43, 0.0]
  - - [2944, 5888, 1, 128]
    - [78, 0.0]
  - - [704, 5888, 1, 1280]
    - [38, 0.0]
  - - [2368, 3584, 1, 128]
    - [37, 0.0]
  - - [1856, 5056, 1, 128]
    - [65, 0.0]
  - - [704, 1024, 1, 1280]
    - [64, 0.0]
  - - [448, 256, 1, 3328]
    - [79, 0.0]
  - - [448, 1856, 1, 128]
    - [65, 0.0]
  - - [8192, 3200, 1, 2048]
    - [28, 0.0]
  - - [128, 1024, 1, 128]
    - [80, 0.0]
  - - [2944, 4, 1, 128]
    - [40, 0.0]
  - - [1024, 704, 1, 1280]
    - [39, 0.0]
  - - [128, 5888, 1, 256]
    - [39, 0.0]
  - - [1024, 5056, 1, 1280]
    - [33, 0.0]
  - - [4288, 1024, 1, 256]
    - [31, 0.0]
  - - [2944, 2368, 1, 128]
    - [35, 0.0]
  - - [704, 704, 1, 3328]
    - [39, 0.0]
  - - [704, 1408, 1, 1280]
    - [41, 0.0]
  - - [5888, 448, 1, 1280]
    - [33, 0.0]
  - - [3584, 256, 1, 3328]
    - [43, 0.0]
  - - [704, 5888, 1, 3328]
    - [41, 0.0]
  - - [704, 1856, 1, 128]
    - [37, 0.0]
  - - [448, 448, 1, 3328]
    - [81, 0.0]
  - - [4, 4288, 1, 128]
    - [82, 0.0]
  - - [128, 704, 1, 1280]
    - [73, 0.0]
  - - [3584, 2944, 1, 256]
    - [31, 0.0]
  - - [3584, 4, 1, 128]
    - [40, 0.0]
  - - [1856, 128, 1, 3328]
    - [83, 0.0]
  - - [4, 64, 1, 1280]
    - [56, 0.0]
  - - [2944, 448, 1, 128]
    - [35, 0.0]
  - - [128, 2944, 1, 1280]
    - [36, 0.0]
  - - [64, 64, 1, 3328]
    - [26, 0.0]
  - - [448, 2944, 1, 1280]
    - [54, 0.0]
  - - [512, 24000, 1, 2048]
    - [33, 0.0]
  - - [128, 256, 1, 3328]
    - [51, 0.0]
  - - [1408, 5056, 1, 3328]
    - [31, 0.0]
  - - [1856, 1856, 1, 3328]
    - [38, 0.0]
  - - [3584, 128, 1, 256]
    - [39, 0.0]
  - - [2560, 800, 1, 2560]
    - [38, 0.0]
  - - [448, 1408, 1, 3328]
    - [45, 0.0]
  - - [2368, 2368, 1, 256]
    - [34, 0.0]
  - - [4288, 4288, 1, 1280]
    - [53, 0.0]
  - - [64, 448, 1, 1280]
    - [84, 0.0]
  - - [5888, 1024, 1, 1280]
    - [85, 0.0]
  - - [1408, 4288, 1, 256]
    - [28, 0.0]
  - - [448, 4, 1, 256]
    - [63, 0.0]
  - - [5888, 448, 1, 128]
    - [37, 0.0]
  - - [512, 48000, 1, 2560]
    - [31, 0.0]
  - - [35, 8457, 1, 1760]
    - [86, 0.0]
  - - [704, 6784, 1, 3328]
    - [53, 0.0]
  - - [2560, 6400, 1, 2560]
    - [28, 0.0]
  - - [5056, 1024, 1, 1280]
    - [38, 0.0]
  - - [448, 5888, 1, 3328]
    - [33, 0.0]
  - - [128, 4, 1, 128]
    - [40, 0.0]
  - - [1024, 2944, 1, 1280]
    - [33, 0.0]
  - - [5056, 5888, 1, 1280]
    - [33, 0.0]
  - - [4288, 5888, 1, 128]
    - [65, 0.0]
  - - [256, 3584, 1, 256]
    - [38, 0.0]
  - - [1408, 3584, 1, 128]
    - [35, 0.0]
  - - [256, 2944, 1, 3328]
    - [54, 0.0]
  - - [448, 3584, 1, 128]
    - [37, 0.0]
  - - [5888, 2944, 1, 1280]
    - [31, 0.0]
  - - [4, 6784, 1, 1280]
    - [25, 0.0]
  - - [2368, 5888, 1, 128]
    - [35, 0.0]
  - - [8448, 16, 1, 2816]
    - [87, 0.0]
  - - [64, 2944, 1, 128]
    - [24, 0.0]
  - - [2368, 4, 1, 256]
    - [58, 0.0]
  - - [3584, 5888, 1, 256]
    - [34, 0.0]
  - - [2368, 1024, 1, 128]
    - [65, 0.0]
  - - [2368, 704, 1, 128]
    - [65, 0.0]
  - - [3584, 2944, 1, 1280]
    - [38, 0.0]
  - - [3584, 2368, 1, 128]
    - [65, 0.0]
  - - [5056, 704, 1, 128]
    - [37, 0.0]
  - - [448, 2368, 1, 128]
    - [88, 0.0]
  - - [5056, 1408, 1, 3328]
    - [43, 0.0]
  - - [1408, 704, 1, 256]
    - [54, 0.0]
  - - [6784, 1024, 1, 3328]
    - [31, 0.0]
  - - [6784, 2944, 1, 3328]
    - [89, 0.0]
  - - [2944, 5056, 1, 3328]
    - [53, 0.0]
  - - [1856, 1856, 1, 256]
    - [38, 0.0]
  - - [1024, 5888, 1, 128]
    - [47, 0.0]
  - - [6784, 2368, 1, 1280]
    - [38, 0.0]
  - - [256, 4, 1, 128]
    - [40, 0.0]
  - - [4288, 5888, 1, 1280]
    - [33, 0.0]
  - - [4288, 4288, 1, 256]
    - [33, 0.0]
  - - [8448, 32, 1, 2816]
    - [30, 0.0]
  - - [448, 2944, 1, 3328]
    - [54, 0.0]
  - - [5888, 4, 1, 128]
    - [40, 0.0]
  - - [4288, 1856, 1, 1280]
    - [33, 0.0]
  - - [1856, 2944, 1, 3328]
    - [33, 0.0]
  - - [256, 6784, 1, 3328]
    - [39, 0.0]
  - - [64, 5888, 1, 256]
    - [36, 0.0]
  - - [256, 5056, 1, 128]
    - [37, 0.0]
  - - [5056, 1024, 1, 256]
    - [31, 0.0]
  - - [704, 64, 1, 3328]
    - [90, 0.0]
  - - [5056, 1856, 1, 3328]
    - [54, 0.0]
  - - [4, 2944, 1, 3328]
    - [26, 0.0]
  - - [4, 5056, 1, 256]
    - [58, 0.0]
  - - [1856, 1408, 1, 256]
    - [31, 0.0]
  - - [8448, 12000, 1, 2816]
    - [54, 0.0]
  - - [6784, 128, 1, 3328]
    - [39, 0.0]
  - - [4288, 1408, 1, 128]
    - [35, 0.0]
  - - [1856, 5888, 1, 3328]
    - [41, 0.0]
  - - [4288, 5056, 1, 256]
    - [31, 0.0]
  - - [1408, 128, 1, 1280]
    - [29, 0.0]
  - - [4096, 800, 1, 1024]
    - [36, 0.0]
  - - [5056, 256, 1, 3328]
    - [39, 0.0]
  - - [704, 704, 1, 256]
    - [39, 0.0]
  - - [1024, 5888, 1, 1280]
    - [31, 0.0]
  - - [6784, 2368, 1, 128]
    - [35, 0.0]
  - - [4, 5056, 1, 1280]
    - [25, 0.0]
  - - [256, 64, 1, 1280]
    - [91, 0.0]
  - - [128, 1856, 1, 1280]
    - [36, 0.0]
  - - [1856, 1024, 1, 1280]
    - [33, 0.0]
  - - [6784, 4288, 1, 1280]
    - [31, 0.0]
  - - [2560, 64, 1, 2560]
    - [67, 0.0]
  - - [1856, 1856, 1, 1280]
    - [38, 0.0]
  - - [4096, 400, 1, 1024]
    - [31, 0.0]
  - - [3072, 24000, 1, 1024]
    - [31, 0.0]
  - - [128, 4288, 1, 3328]
    - [79, 0.0]
  - - [4, 2368, 1, 3328]
    - [26, 0.0]
  - - [5888, 1856, 1, 128]
    - [37, 0.0]
  - - [448, 704, 1, 1280]
    - [39, 0.0]
  - - [128, 5056, 1, 1280]
    - [29, 0.0]
  - - [1024, 448, 1, 3328]
    - [54, 0.0]
  - - [1856, 704, 1, 1280]
    - [45, 0.0]
  - - [5056, 3584, 1, 128]
    - [65, 0.0]
  - - [5888, 5888, 1, 3328]
    - [31, 0.0]
  - - [6784, 1024, 1, 256]
    - [31, 0.0]
  - - [2944, 2368, 1, 256]
    - [92, 0.0]
  - - [256, 448, 1, 256]
    - [76, 0.0]
  - - [5056, 5888, 1, 3328]
    - [50, 0.0]
  - - [1856, 1024, 1, 256]
    - [31, 0.0]
  - - [512, 48000, 1, 1536]
    - [33, 0.0]
  - - [3584, 448, 1, 1280]
    - [36, 0.0]
  - - [8448, 5984, 1, 2816]
    - [33, 0.0]
  - - [448, 5888, 1, 256]
    - [33, 0.0]
  - - [704, 64, 1, 128]
    - [93, 0.0]
  - - [1408, 6784, 1, 3328]
    - [53, 0.0]
  - - [448, 1024, 1, 128]
    - [94, 0.0]
  - - [4288, 704, 1, 128]
    - [37, 0.0]
  - - [128, 1856, 1, 128]
    - [95, 0.0]
  - - [448, 2368, 1, 3328]
    - [43, 0.0]
  - - [5056, 64, 1, 128]
    - [35, 0.0]
  - - [5056, 2944, 1, 256]
    - [33, 0.0]
  - - [6784, 5888, 1, 128]
    - [35, 0.0]
  - - [1024, 700, 1, 512]
    - [43, 0.0]
  - - [704, 1024, 1, 256]
    - [38, 0.0]
  - - [1024, 4, 1, 256]
    - [58, 0.0]
  - - [2944, 704, 1, 128]
    - [37, 0.0]
  - - [128, 6784, 1, 1280]
    - [38, 0.0]
  - - [1408, 3584, 1, 3328]
    - [33, 0.0]
  - - [2368, 6784, 1, 256]
    - [38, 0.0]
  - - [5056, 1408, 1, 1280]
    - [33, 0.0]
  - - [256, 256, 1, 128]
    - [96, 0.0]
  - - [5056, 4288, 1, 128]
    - [94, 0.0]
  - - [1408, 1856, 1, 128]
    - [35, 0.0]
  - - [1408, 5888, 1, 3328]
    - [33, 0.0]
  - - [1856, 256, 1, 256]
    - [38, 0.0]
  - - [6784, 6784, 1, 256]
    - [38, 0.0]
  - - [64, 256, 1, 128]
    - [80, 0.0]
  - - [4288, 2368, 1, 128]
    - [65, 0.0]
  - - [256, 4288, 1, 1280]
    - [36, 0.0]
  - - [2368, 2944, 1, 256]
    - [33, 0.0]
  - - [4, 1856, 1, 256]
    - [66, 0.0]
  - - [3584, 1856, 1, 1280]
    - [38, 0.0]
  - - [6784, 6784, 1, 128]
    - [65, 0.0]
  - - [256, 1856, 1, 128]
    - [78, 0.0]
  - - [704, 64, 1, 1280]
    - [97, 0.0]
  - - [5888, 5056, 1, 256]
    - [33, 0.0]
  - - [8448, 48000, 1, 2816]
    - [31, 0.0]
  - - [3584, 448, 1, 256]
    - [33, 0.0]
  - - [448, 4288, 1, 128]
    - [37, 0.0]
  - - [7680, 64, 1, 2560]
    - [98, 0.0]
  - - [256, 6784, 1, 256]
    - [33, 0.0]
  - - [1408, 4288, 1, 128]
    - [37, 0.0]
  - - [2944, 704, 1, 3328]
    - [36, 0.0]
  - - [128, 448, 1, 256]
    - [99, 0.0]
  - - [5056, 256, 1, 1280]
    - [41, 0.0]
  - - [2560, 32, 1, 2560]
    - [100, 0.0]
  - - [3584, 3584, 1, 256]
    - [31, 0.0]
  - - [448, 1408, 1, 128]
    - [35, 0.0]
  - - [128, 256, 1, 1280]
    - [84, 0.0]
  - - [3584, 5056, 1, 256]
    - [31, 0.0]
  - - [6784, 128, 1, 256]
    - [38, 0.0]
  - - [4288, 4, 1, 256]
    - [58, 0.0]
  - - [704, 448, 1, 256]
    - [39, 0.0]
  - - [2944, 2368, 1, 1280]
    - [27, 0.0]
  - - [448, 64, 1, 3328]
    - [97, 0.0]
  - - [1408, 3584, 1, 256]
    - [31, 0.0]
  - - [3584, 4, 1, 3328]
    - [63, 0.0]
  - - [6784, 3584, 1, 256]
    - [38, 0.0]
  - - [256, 128, 1, 128]
    - [101, 0.0]
  - - [704, 1408, 1, 128]
    - [65, 0.0]
  - - [4, 2368, 1, 256]
    - [63, 0.0]
  - - [4288, 128, 1, 1280]
    - [39, 0.0]
  - - [128, 1408, 1, 256]
    - [36, 0.0]
  - - [4, 2944, 1, 256]
    - [66, 0.0]
  - - [64, 128, 1, 3328]
    - [102, 0.0]
  - - [5056, 2368, 1, 128]
    - [55, 0.0]
  - - [2944, 2944, 1, 3328]
    - [53, 0.0]
  - - [5056, 6784, 1, 256]
    - [103, 0.0]
  - - [1856, 3584, 1, 128]
    - [88, 0.0]
  - - [128, 2944, 1, 128]
    - [70, 0.0]
  - - [35, 8457, 1, 2560]
    - [104, 0.0]
  - - [1024, 704, 1, 3328]
    - [36, 0.0]
  - - [6784, 448, 1, 256]
    - [54, 0.0]
  - - [3584, 6784, 1, 128]
    - [35, 0.0]
  - - [128, 4288, 1, 256]
    - [43, 0.0]
  - - [704, 448, 1, 3328]
    - [36, 0.0]
  - - [128, 128, 1, 3328]
    - [97, 0.0]
  - - [5056, 1856, 1, 256]
    - [34, 0.0]
  - - [4608, 5984, 1, 1536]
    - [89, 0.0]
  - - [256, 128, 1, 256]
    - [84, 0.0]
  - - [1760, 3200, 1, 1760]
    - [38, 0.0]
  - - [1024, 1856, 1, 256]
    - [31, 0.0]
  - - [4096, 1600, 1, 1024]
    - [34, 0.0]
  - - [4288, 64, 1, 128]
    - [95, 0.0]
  - - [256, 448, 1, 3328]
    - [100, 0.0]
  - - [1408, 6784, 1, 1280]
    - [33, 0.0]
  - - [3584, 3584, 1, 1280]
    - [33, 0.0]
  - - [7680, 24000, 1, 2560]
    - [53, 0.0]
  - - [64, 2368, 1, 1280]
    - [29, 0.0]
  - - [448, 2368, 1, 1280]
    - [36, 0.0]
  - - [4608, 48000, 1, 1536]
    - [33, 0.0]
  - - [5888, 5888, 1, 128]
    - [65, 0.0]
  - - [64, 6784, 1, 3328]
    - [36, 0.0]
  - - [2944, 256, 1, 1280]
    - [39, 0.0]
  - - [2048, 16, 1, 2048]
    - [25, 0.0]
  - - [256, 2368, 1, 128]
    - [37, 0.0]
  - - [5056, 2368, 1, 3328]
    - [31, 0.0]
  - - [2944, 4288, 1, 256]
    - [33, 0.0]
  - - [1408, 3584, 1, 1280]
    - [38, 0.0]
  - - [2368, 64, 1, 256]
    - [36, 0.0]
  - - [64, 448, 1, 3328]
    - [51, 0.0]
  - - [704, 128, 1, 3328]
    - [79, 0.0]
  - - [8192, 1600, 1, 2048]
    - [33, 0.0]
  - - [1856, 704, 1, 256]
    - [41, 0.0]
  - - [4, 4288, 1, 1280]
    - [25, 0.0]
  - - [1408, 448, 1, 3328]
    - [105, 0.0]
  - - [1024, 4, 1, 3328]
    - [71, 0.0]
  - - [512, 24000, 1, 2560]
    - [31, 0.0]
  - - [2368, 6784, 1, 3328]
    - [31, 0.0]
  - - [1856, 1408, 1, 1280]
    - [38, 0.0]
  - - [1856, 448, 1, 1280]
    - [43, 0.0]
  - - [6784, 704, 1, 128]
    - [35, 0.0]
  - - [4, 4, 1, 256]
    - [25, 0.0]
  - - [128, 5888, 1, 128]
    - [35, 0.0]
  - - [1408, 5888, 1, 256]
    - [36, 0.0]
  - - [704, 2944, 1, 1280]
    - [38, 0.0]
  - - [4288, 64, 1, 1280]
    - [30, 0.0]
  - - [256, 64, 1, 256]
    - [106, 0.0]
  - - [704, 1856, 1, 256]
    - [54, 0.0]
  - - [704, 6784, 1, 128]
    - [35, 0.0]
  - - [3584, 704, 1, 1280]
    - [54, 0.0]
  - - [256, 128, 1, 1280]
    - [84, 0.0]
  - - [5888, 2368, 1, 256]
    - [31, 0.0]
  - - [256, 2368, 1, 1280]
    - [39, 0.0]
  - - [2944, 6784, 1, 128]
    - [55, 0.0]
  - - [3584, 448, 1, 3328]
    - [33, 0.0]
  - - [1408, 4, 1, 256]
    - [107, 0.0]
  - - [704, 2368, 1, 3328]
    - [39, 0.0]
  - - [2944, 448, 1, 256]
    - [92, 0.0]
  - - [1856, 448, 1, 128]
    - [65, 0.0]
  - - [4288, 4, 1, 3328]
    - [25, 0.0]
  - - [2368, 128, 1, 1280]
    - [44, 0.0]
  - - [256, 5888, 1, 128]
    - [55, 0.0]
  - - [64, 6784, 1, 256]
    - [41, 0.0]
  - - [64, 5056, 1, 1280]
    - [39, 0.0]
  - - [4, 6784, 1, 128]
    - [40, 0.0]
  - - [2048, 3200, 1, 512]
    - [41, 0.0]
  - - [2944, 2944, 1, 1280]
    - [28, 0.0]
  - - [5056, 448, 1, 3328]
    - [36, 0.0]
  - - [4, 3584, 1, 1280]
    - [25, 0.0]
  - - [1408, 128, 1, 128]
    - [80, 0.0]
  - - [6784, 704, 1, 3328]
    - [39, 0.0]
  - - [128, 64, 1, 1280]
    - [25, 0.0]
  - - [2368, 256, 1, 1280]
    - [39, 0.0]
  - - [4, 448, 1, 3328]
    - [56, 0.0]
  - - [5888, 4288, 1, 128]
    - [55, 0.0]
  - - [4, 5888, 1, 256]
    - [25, 0.0]
  - - [1408, 2944, 1, 3328]
    - [28, 0.0]
  - - [3584, 704, 1, 128]
    - [35, 0.0]
  - - [4608, 12000, 1, 1536]
    - [53, 0.0]
  - - [64, 1024, 1, 256]
    - [84, 0.0]
  - - [5056, 5056, 1, 128]
    - [35, 0.0]
  - - [2368, 448, 1, 1280]
    - [36, 0.0]
  - - [128, 3584, 1, 256]
    - [39, 0.0]
  - - [704, 448, 1, 1280]
    - [43, 0.0]
  - - [8192, 800, 1, 2048]
    - [38, 0.0]
  - - [448, 5056, 1, 128]
    - [37, 0.0]
  - - [256, 4, 1, 1280]
    - [42, 0.0]
  - - [5056, 3584, 1, 256]
    - [53, 0.0]
  - - [2368, 4, 1, 3328]
    - [25, 0.0]
  - - [1408, 5056, 1, 128]
    - [37, 0.0]
  - - [2944, 3584, 1, 128]
    - [35, 0.0]
  - - [3584, 2368, 1, 256]
    - [31, 0.0]
  - - [128, 3584, 1, 3328]
    - [38, 0.0]
  - - [128, 1024, 1, 1280]
    - [73, 0.0]
  - - [8448, 24000, 1, 2816]
    - [31, 0.0]
  - - [64, 704, 1, 256]
    - [84, 0.0]
  - - [4288, 256, 1, 1280]
    - [36, 0.0]
  - - [3584, 3584, 1, 3328]
    - [33, 0.0]
  - - [4, 704, 1, 128]
    - [40, 0.0]
  - - [5888, 6784, 1, 256]
    - [41, 0.0]
  - - [4288, 2944, 1, 3328]
    - [33, 0.0]
  - - [2944, 64, 1, 128]
    - [95, 0.0]
  - - [1024, 128, 1, 3328]
    - [29, 0.0]
  - - [1024, 16, 1, 500000]
    - [108, 0.0]
  - - [4288, 128, 1, 3328]
    - [29, 0.0]
  - - [7680, 128, 1, 2560]
    - [109, 0.0]
  - - [256, 5056, 1, 1280]
    - [41, 0.0]
  - - [1408, 256, 1, 128]
    - [37, 0.0]
  - - [2944, 5888, 1, 3328]
    - [92, 0.0]
  - - [6784, 5888, 1, 1280]
    - [31, 0.0]
  - - [2048, 800, 1, 512]
    - [39, 0.0]
  - - [704, 128, 1, 256]
    - [106, 0.0]
  - - [5888, 4288, 1, 1280]
    - [33, 0.0]
  - - [1024, 24000, 1, 2048]
    - [41, 0.0]
  - - [448, 256, 1, 1280]
    - [73, 0.0]
  - - [5888, 3584, 1, 128]
    - [55, 0.0]
  - - [1024, 2944, 1, 128]
    - [35, 0.0]
  - - [5056, 4, 1, 1280]
    - [66, 0.0]
  - - [256, 1408, 1, 1280]
    - [36, 0.0]
  - - [3072, 16, 1, 1024]
    - [25, 0.0]
  - - [704, 3584, 1, 128]
    - [35, 0.0]
  - - [5888, 448, 1, 3328]
    - [34, 0.0]
  - - [2368, 4288, 1, 1280]
    - [38, 0.0]
  - - [4288, 2944, 1, 128]
    - [37, 0.0]
  - - [1024, 6784, 1, 3328]
    - [41, 0.0]
  - - [128, 2368, 1, 256]
    - [39, 0.0]
  - - [6784, 64, 1, 3328]
    - [36, 0.0]
  - - [5056, 2944, 1, 3328]
    - [31, 0.0]
  - - [448, 128, 1, 256]
    - [84, 0.0]
  - - [2944, 3584, 1, 256]
    - [41, 0.0]
  - - [1408, 1408, 1, 3328]
    - [31, 0.0]
  - - [1856, 128, 1, 1280]
    - [39, 0.0]
  - - [3584, 3584, 1, 128]
    - [65, 0.0]
  - - [64, 3584, 1, 256]
    - [45, 0.0]
  - - [1408, 4, 1, 3328]
    - [26, 0.0]
  - - [128, 2944, 1, 3328]
    - [77, 0.0]
  - - [3584, 704, 1, 256]
    - [39, 0.0]
  - - [2944, 448, 1, 3328]
    - [39, 0.0]
  - - [3584, 1408, 1, 3328]
    - [31, 0.0]
  - - [704, 3584, 1, 1280]
    - [38, 0.0]
  - - [2944, 6784, 1, 1280]
    - [31, 0.0]
  - - [1856, 6784, 1, 256]
    - [31, 0.0]
  - - [4288, 448, 1, 3328]
    - [43, 0.0]
  - - [6784, 4288, 1, 128]
    - [35, 0.0]
  - - [6784, 704, 1, 1280]
    - [28, 0.0]
  - - [256, 4288, 1, 256]
    - [43, 0.0]
  - - [3584, 6784, 1, 256]
    - [31, 0.0]
  - - [6144, 12000, 1, 2048]
    - [49, 0.0]
  - - [6144, 16, 1, 2560]
    - [110, 0.0]
  - - [3584, 64, 1, 128]
    - [96, 0.0]
  - - [5888, 1024, 1, 3328]
    - [53, 0.0]
  - - [448, 64, 1, 128]
    - [24, 0.0]
  - - [704, 6784, 1, 1280]
    - [33, 0.0]
  - - [4, 1024, 1, 1280]
    - [25, 0.0]
  - - [5888, 128, 1, 256]
    - [39, 0.0]
  - - [4096, 16, 1, 4096]
    - [25, 0.0]
  - - [1856, 5056, 1, 3328]
    - [28, 0.0]
  - - [4, 6784, 1, 256]
    - [58, 0.0]
  - - [1024, 3584, 1, 128]
    - [37, 0.0]
  - - [1024, 1408, 1, 128]
    - [88, 0.0]
  - - [2368, 2944, 1, 128]
    - [47, 0.0]
  - - [5056, 64, 1, 256]
    - [39, 0.0]
  - - [4, 448, 1, 1280]
    - [56, 0.0]
  - - [5056, 2944, 1, 128]
    - [94, 0.0]
  - - [5888, 5056, 1, 3328]
    - [31, 0.0]
  - - [1024, 704, 1, 128]
    - [37, 0.0]
  - - [5888, 2368, 1, 128]
    - [78, 0.0]
  - - [128, 5056, 1, 3328]
    - [36, 0.0]
  - - [3584, 6784, 1, 1280]
    - [53, 0.0]
  - - [448, 4, 1, 1280]
    - [56, 0.0]
  - - [1856, 5888, 1, 256]
    - [31, 0.0]
  - - [256, 256, 1, 256]
    - [84, 0.0]
  - - [256, 64, 1, 128]
    - [111, 0.0]
  - - [4288, 4288, 1, 3328]
    - [31, 0.0]
  - - [4288, 1408, 1, 1280]
    - [28, 0.0]
  - - [3584, 5056, 1, 128]
    - [35, 0.0]
  - - [4, 1024, 1, 3328]
    - [71, 0.0]
  - - [4288, 2368, 1, 256]
    - [34, 0.0]
  - - [2944, 5056, 1, 1280]
    - [31, 0.0]
  - - [448, 6784, 1, 256]
    - [38, 0.0]
  - - [64, 128, 1, 128]
    - [112, 0.0]
  - - [1856, 2368, 1, 128]
    - [37, 0.0]
  - - [6784, 2368, 1, 3328]
    - [31, 0.0]
  - - [256, 1024, 1, 1280]
    - [36, 0.0]
  - - [704, 4, 1, 128]
    - [40, 0.0]
  - - [256, 4, 1, 256]
    - [25, 0.0]
  - - [4288, 128, 1, 256]
    - [39, 0.0]
  - - [4288, 1856, 1, 3328]
    - [38, 0.0]
  - - [3584, 448, 1, 128]
    - [55, 0.0]
  - - [2048, 1600, 1, 2048]
    - [45, 0.0]
  - - [256, 4, 1, 3328]
    - [69, 0.0]
  - - [4, 1408, 1, 1280]
    - [42, 0.0]
  - - [3584, 64, 1, 1280]
    - [64, 0.0]
  - - [1408, 448, 1, 128]
    - [35, 0.0]
  - - [3584, 1024, 1, 1280]
    - [31, 0.0]
  - - [1856, 5056, 1, 256]
    - [33, 0.0]
  - - [4, 3584, 1, 256]
    - [66, 0.0]
  - - [4, 2944, 1, 1280]
    - [25, 0.0]
  - - [1024, 4288, 1, 256]
    - [49, 0.0]
  - - [5888, 3584, 1, 3328]
    - [28, 0.0]
  - - [1856, 4, 1, 256]
    - [25, 0.0]
  - - [4, 256, 1, 256]
    - [58, 0.0]
  - - [5056, 3584, 1, 3328]
    - [50, 0.0]
  - - [704, 448, 1, 128]
    - [94, 0.0]
  - - [2368, 1408, 1, 1280]
    - [33, 0.0]
  - - [5056, 2944, 1, 1280]
    - [31, 0.0]
  - - [4, 4, 1, 128]
    - [82, 0.0]
  - - [3584, 256, 1, 256]
    - [43, 0.0]
  - - [1024, 6784, 1, 256]
    - [33, 0.0]
  - - [4, 128, 1, 256]
    - [25, 0.0]
  - - [64, 64, 1, 1280]
    - [113, 0.0]
  - - [5124, 9124, 1, 2048]
    - [31, 0.0]
  - - [6784, 4, 1, 128]
    - [40, 0.0]
  - - [2944, 1408, 1, 128]
    - [35, 0.0]
  - - [448, 128, 1, 3328]
    - [62, 0.0]
  - - [3584, 1408, 1, 1280]
    - [31, 0.0]
  - - [64, 4288, 1, 3328]
    - [79, 0.0]
  - - [5056, 6784, 1, 3328]
    - [53, 0.0]
  - - [128, 2944, 1, 256]
    - [38, 0.0]
  - - [128, 6784, 1, 128]
    - [70, 0.0]
  - - [3584, 4288, 1, 256]
    - [33, 0.0]
  - - [448, 1856, 1, 256]
    - [38, 0.0]
  - - [1856, 6784, 1, 3328]
    - [43, 0.0]
  - - [3584, 128, 1, 3328]
    - [109, 0.0]
  - - [64, 1856, 1, 256]
    - [99, 0.0]
  - - [64, 448, 1, 256]
    - [114, 0.0]
  - - [5888, 4288, 1, 256]
    - [54, 0.0]
  - - [4, 448, 1, 128]
    - [40, 0.0]
  - - [5056, 1408, 1, 256]
    - [31, 0.0]
  - - [35, 8457, 1, 2048]
    - [115, 0.0]
  - - [64, 256, 1, 1280]
    - [75, 0.0]
  - - [3584, 1024, 1, 256]
    - [38, 0.0]
  - - [256, 704, 1, 256]
    - [36, 0.0]
  - - [5888, 5888, 1, 256]
    - [54, 0.0]
  - - [4288, 1024, 1, 1280]
    - [43, 0.0]
  - - [5888, 128, 1, 3328]
    - [39, 0.0]
  - - [448, 6784, 1, 3328]
    - [36, 0.0]
  - - [2944, 1408, 1, 1280]
    - [54, 0.0]
  - - [64, 128, 1, 1280]
    - [25, 0.0]
  - - [2944, 1856, 1, 3328]
    - [28, 0.0]
  - - [2368, 64, 1, 128]
    - [96, 0.0]
  - - [256, 1024, 1, 128]
    - [35, 0.0]
  - - [3584, 5888, 1, 1280]
    - [53, 0.0]
  - - [64, 4, 1, 128]
    - [82, 0.0]
  - - [6784, 1856, 1, 1280]
    - [53, 0.0]
  - - [2944, 5056, 1, 256]
    - [31, 0.0]
  - - [4288, 4, 1, 128]
    - [40, 0.0]
  - - [5888, 256, 1, 3328]
    - [41, 0.0]
  - - [2944, 4288, 1, 128]
    - [47, 0.0]
  - - [3584, 1408, 1, 256]
    - [92, 0.0]
  - - [704, 3584, 1, 3328]
    - [38, 0.0]
  - - [4096, 3200, 1, 1024]
    - [85, 0.0]
  - - [5056, 448, 1, 1280]
    - [64, 0.0]
  - - [3584, 1856, 1, 3328]
    - [28, 0.0]
  - - [4288, 6784, 1, 1280]
    - [33, 0.0]
  - - [2560, 7000, 1, 2560]
    - [41, 0.0]
  - - [1408, 704, 1, 1280]
    - [43, 0.0]
  - - [2944, 1024, 1, 256]
    - [31, 0.0]
  - - [6784, 64, 1, 256]
    - [39, 0.0]
  - - [2368, 4288, 1, 3328]
    - [41, 0.0]
  - - [4, 1408, 1, 256]
    - [63, 0.0]
  - - [1024, 1408, 1, 1280]
    - [38, 0.0]
  - - [64, 64, 1, 256]
    - [25, 0.0]
  - - [704, 256, 1, 3328]
    - [36, 0.0]
  - - [6784, 5056, 1, 256]
    - [31, 0.0]
  - - [1856, 1856, 1, 128]
    - [88, 0.0]
  - - [3584, 5056, 1, 3328]
    - [31, 0.0]
  - - [448, 6784, 1, 128]
    - [37, 0.0]
  - - [4, 704, 1, 3328]
    - [56, 0.0]
  - - [35, 8457, 1, 4096]
    - [116, 0.0]
  - - [448, 2944, 1, 256]
    - [54, 0.0]
  - - [4, 4288, 1, 3328]
    - [26, 0.0]
  - - [2944, 6784, 1, 256]
    - [33, 0.0]
  - - [2944, 2944, 1, 128]
    - [35, 0.0]
  - - [4, 4, 1, 1280]
    - [26, 0.0]
  - - [1856, 3584, 1, 1280]
    - [33, 0.0]
  - - [64, 2944, 1, 256]
    - [45, 0.0]
  - - [448, 256, 1, 128]
    - [112, 0.0]
  - - [4288, 448, 1, 128]
    - [47, 0.0]
  - - [4608, 24000, 1, 1536]
    - [49, 0.0]
  - - [1856, 1408, 1, 3328]
    - [27, 0.0]
  - - [128, 128, 1, 128]
    - [93, 0.0]
  - - [1024, 4288, 1, 3328]
    - [38, 0.0]
  - - [448, 2368, 1, 256]
    - [54, 0.0]
  - - [1024, 4, 1, 128]
    - [82, 0.0]
  - - [64, 1408, 1, 1280]
    - [73, 0.0]
  - - [64, 6784, 1, 1280]
    - [39, 0.0]
  - - [5056, 448, 1, 256]
    - [36, 0.0]
  - - [2944, 2368, 1, 3328]
    - [31, 0.0]
  - - [704, 4288, 1, 3328]
    - [45, 0.0]
  - - [1408, 128, 1, 256]
    - [36, 0.0]
  - - [1024, 1856, 1, 1280]
    - [31, 0.0]
  - - [2048, 6400, 1, 2048]
    - [41, 0.0]
  - - [512, 48000, 1, 2816]
    - [31, 0.0]
  - - [5124, 9124, 1, 2560]
    - [43, 0.0]
  - - [128, 2368, 1, 3328]
    - [79, 0.0]
  - - [1024, 5888, 1, 256]
    - [33, 0.0]
  - - [64, 2944, 1, 1280]
    - [73, 0.0]
  - - [5056, 64, 1, 3328]
    - [117, 0.0]
  - - [128, 704, 1, 128]
    - [118, 0.0]
  - - [1408, 2368, 1, 256]
    - [39, 0.0]
  - - [1408, 1408, 1, 256]
    - [31, 0.0]
  - - [4, 64, 1, 128]
    - [40, 0.0]
  - - [64, 1024, 1, 128]
    - [70, 0.0]
  - - [1024, 8, 1, 500000]
    - [119, 0.0]
  - - [2368, 2368, 1, 128]
    - [65, 0.0]
  - - [64, 5888, 1, 128]
    - [70, 0.0]
  - - [5888, 4, 1, 3328]
    - [120, 0.0]
  - - [6784, 1408, 1, 128]
    - [37, 0.0]
  - - [4288, 5888, 1, 256]
    - [31, 0.0]
  - - [1408, 5056, 1, 256]
    - [33, 0.0]
  - - [5056, 128, 1, 3328]
    - [62, 0.0]
  - - [128, 128, 1, 1280]
    - [75, 0.0]
  - - [448, 704, 1, 256]
    - [39, 0.0]
  - - [4288, 3584, 1, 128]
    - [65, 0.0]
  - - [2944, 128, 1, 3328]
    - [62, 0.0]
  - - [64, 1408, 1, 3328]
    - [100, 0.0]
  - - [3584, 5056, 1, 1280]
    - [89, 0.0]
  - - [256, 448, 1, 1280]
    - [73, 0.0]
  - - [704, 704, 1, 128]
    - [35, 0.0]
  - - [5056, 4, 1, 128]
    - [40, 0.0]
  - - [704, 256, 1, 1280]
    - [54, 0.0]
  - - [64, 2368, 1, 3328]
    - [73, 0.0]
  - - [1856, 1024, 1, 128]
    - [65, 0.0]
  - - [1856, 64, 1, 128]
    - [121, 0.0]
  - - [4096, 64, 1, 4096]
    - [122, 0.0]
  - - [1024, 24000, 1, 1536]
    - [43, 0.0]
  - - [704, 4288, 1, 256]
    - [41, 0.0]
  - - [5888, 2368, 1, 1280]
    - [53, 0.0]
  - - [128, 256, 1, 256]
    - [76, 0.0]
  - - [64, 128, 1, 256]
    - [25, 0.0]
  - - [2368, 5888, 1, 1280]
    - [38, 0.0]
  - - [5888, 256, 1, 1280]
    - [54, 0.0]
  - - [1760, 128, 1, 1760]
    - [123, 0.0]
  - - [4, 5888, 1, 1280]
    - [25, 0.0]
  - - [704, 128, 1, 128]
    - [96, 0.0]
  - - [1024, 4, 1, 1280]
    - [25, 0.0]
  - - [2368, 1856, 1, 3328]
    - [38, 0.0]
  - - [2368, 128, 1, 128]
    - [124, 0.0]
  - - [2944, 704, 1, 256]
    - [54, 0.0]
  - - [5056, 128, 1, 128]
    - [35, 0.0]
  - - [2368, 1024, 1, 3328]
    - [45, 0.0]
  - - [256, 704, 1, 3328]
    - [36, 0.0]
  - - [704, 3584, 1, 256]
    - [31, 0.0]
  - - [704, 2944, 1, 3328]
    - [38, 0.0]
  - - [6784, 1024, 1, 128]
    - [37, 0.0]
  - - [256, 448, 1, 128]
    - [96, 0.0]
  - - [448, 1024, 1, 3328]
    - [103, 0.0]
  - - [2944, 1024, 1, 3328]
    - [31, 0.0]
  - - [2944, 5056, 1, 128]
    - [35, 0.0]
  - - [2368, 256, 1, 256]
    - [39, 0.0]
  - - [1408, 6784, 1, 256]
    - [33, 0.0]
  - - [6784, 1408, 1, 3328]
    - [33, 0.0]
  - - [4288, 6784, 1, 128]
    - [78, 0.0]
  - - [704, 64, 1, 256]
    - [84, 0.0]
  - - [5888, 4, 1, 1280]
    - [58, 0.0]
  - - [256, 2368, 1, 3328]
    - [39, 0.0]
  - - [6784, 2944, 1, 1280]
    - [31, 0.0]
  - - [4288, 1856, 1, 128]
    - [35, 0.0]
  - - [1856, 2944, 1, 128]
    - [35, 0.0]
  - - [6784, 448, 1, 128]
    - [37, 0.0]
  - - [64, 3584, 1, 128]
    - [70, 0.0]
  - - [448, 5056, 1, 1280]
    - [54, 0.0]
  - - [2368, 1856, 1, 128]
    - [47, 0.0]
  - - [64, 2944, 1, 3328]
    - [67, 0.0]
  - - [4288, 704, 1, 256]
    - [41, 0.0]
  - - [256, 3584, 1, 128]
    - [65, 0.0]
  - - [5888, 704, 1, 256]
    - [39, 0.0]
  - - [3584, 1024, 1, 128]
    - [37, 0.0]
  - - [256, 5888, 1, 3328]
    - [54, 0.0]
  - - [1408, 4288, 1, 3328]
    - [33, 0.0]
  - - [6784, 4288, 1, 256]
    - [31, 0.0]
  - - [4288, 256, 1, 128]
    - [125, 0.0]
  - - [5888, 256, 1, 256]
    - [54, 0.0]
  - - [6784, 1024, 1, 1280]
    - [33, 0.0]
  - - [5888, 1024, 1, 128]
    - [65, 0.0]
  - - [1024, 128, 1, 256]
    - [99, 0.0]
  - - [512, 16, 1, 500000]
    - [126, 0.0]
  - - [128, 64, 1, 3328]
    - [26, 0.0]
  - - [448, 64, 1, 256]
    - [25, 0.0]
  - - [2368, 256, 1, 128]
    - [37, 0.0]
  - - [6784, 3584, 1, 1280]
    - [33, 0.0]
  - - [1024, 6784, 1, 1280]
    - [31, 0.0]
  - - [2944, 64, 1, 1280]
    - [29, 0.0]
  - - [1408, 2944, 1, 1280]
    - [38, 0.0]
  - - [256, 1856, 1, 256]
    - [36, 0.0]
  - - [2048, 800, 1, 2048]
    - [34, 0.0]
  - - [1408, 2368, 1, 3328]
    - [54, 0.0]
  - - [2944, 4, 1, 3328]
    - [25, 0.0]
  - - [128, 1408, 1, 3328]
    - [123, 0.0]
  - - [2944, 1856, 1, 128]
    - [35, 0.0]
  - - [256, 2944, 1, 128]
    - [35, 0.0]
  - - [256, 6784, 1, 128]
    - [35, 0.0]
  - - [2368, 4, 1, 128]
    - [82, 0.0]
  - - [1408, 256, 1, 3328]
    - [36, 0.0]
  - - [1856, 4, 1, 128]
    - [82, 0.0]
  - - [5056, 6784, 1, 128]
    - [35, 0.0]
  - - [4288, 5056, 1, 128]
    - [47, 0.0]
  - - [1856, 5888, 1, 128]
    - [35, 0.0]
  - - [2944, 5888, 1, 256]
    - [43, 0.0]
  - - [3584, 1856, 1, 256]
    - [33, 0.0]
  - - [4288, 3584, 1, 1280]
    - [53, 0.0]
  - - [2368, 448, 1, 256]
    - [39, 0.0]
  - - [4288, 256, 1, 3328]
    - [41, 0.0]
  - - [1856, 704, 1, 128]
    - [37, 0.0]
  - - [1408, 64, 1, 256]
    - [127, 0.0]
  - - [64, 1856, 1, 128]
    - [128, 0.0]
  - - [4, 256, 1, 128]
    - [40, 0.0]
  - - [2560, 16, 1, 2560]
    - [75, 0.0]
  - - [704, 5888, 1, 128]
    - [55, 0.0]
  - - [6784, 3584, 1, 128]
    - [37, 0.0]
  - - [1024, 64, 1, 256]
    - [25, 0.0]
  - - [64, 2368, 1, 256]
    - [36, 0.0]
  - - [4288, 5056, 1, 3328]
    - [33, 0.0]
  - - [4, 1856, 1, 1280]
    - [25, 0.0]
  - - [4288, 128, 1, 128]
    - [124, 0.0]
  - - [1408, 1408, 1, 128]
    - [37, 0.0]
  - - [7680, 16, 1, 2560]
    - [59, 0.0]
  - - [1856, 128, 1, 128]
    - [124, 0.0]
  - - [5056, 2368, 1, 256]
    - [33, 0.0]
  - - [4288, 704, 1, 3328]
    - [31, 0.0]
  - - [448, 3584, 1, 256]
    - [31, 0.0]
  - - [2368, 64, 1, 1280]
    - [73, 0.0]
  - - [2368, 1024, 1, 1280]
    - [41, 0.0]
  - - [2944, 1408, 1, 3328]
    - [53, 0.0]
  - - [1408, 448, 1, 256]
    - [36, 0.0]
  - - [1024, 1408, 1, 3328]
    - [54, 0.0]
  - - [2944, 5888, 1, 1280]
    - [28, 0.0]
  - - [1408, 4, 1, 1280]
    - [71, 0.0]
  - - [5888, 3584, 1, 256]
    - [28, 0.0]
  - - [2368, 5056, 1, 128]
    - [78, 0.0]
  - - [1408, 1856, 1, 3328]
    - [36, 0.0]
  - - [4, 4, 1, 3328]
    - [69, 0.0]
  - - [6784, 1408, 1, 1280]
    - [36, 0.0]
  - - [4096, 7000, 1, 4096]
    - [105, 0.0]
  - - [704, 2944, 1, 256]
    - [38, 0.0]
  - - [4288, 64, 1, 256]
    - [52, 0.0]
  - - [6784, 5888, 1, 3328]
    - [33, 0.0]
  - - [2368, 4288, 1, 128]
    - [35, 0.0]
  - - [64, 4288, 1, 1280]
    - [44, 0.0]
  - - [6784, 64, 1, 1280]
    - [36, 0.0]
  - - [3584, 128, 1, 128]
    - [129, 0.0]
  - - [1024, 6784, 1, 128]
    - [65, 0.0]
  - - [4, 1856, 1, 128]
    - [82, 0.0]
  - - [1408, 64, 1, 3328]
    - [62, 0.0]
  - - [6784, 4, 1, 256]
    - [25, 0.0]
  - - [1408, 1408, 1, 1280]
    - [33, 0.0]
  - - [16384, 400, 1, 4096]
    - [54, 0.0]
  - - [256, 2368, 1, 256]
    - [36, 0.0]
  - - [448, 4288, 1, 3328]
    - [41, 0.0]
  - - [2368, 1408, 1, 256]
    - [43, 0.0]
  - - [5888, 5056, 1, 128]
    - [65, 0.0]
  - - [704, 2368, 1, 256]
    - [33, 0.0]
  - - [1024, 24000, 1, 2560]
    - [27, 0.0]
  - - [2944, 448, 1, 1280]
    - [64, 0.0]
  - - [5888, 2368, 1, 3328]
    - [28, 0.0]
  - - [5124, 9124, 1, 1760]
    - [39, 0.0]
  - - [448, 1408, 1, 1280]
    - [36, 0.0]
  - - [448, 1856, 1, 1280]
    - [41, 0.0]
  - - [4288, 448, 1, 1280]
    - [54, 0.0]
  - - [5888, 704, 1, 3328]
    - [43, 0.0]
  - - [5056, 256, 1, 128]
    - [55, 0.0]
  - - [1856, 256, 1, 128]
    - [78, 0.0]
  - - [64, 1408, 1, 128]
    - [128, 0.0]
  - - [704, 4, 1, 256]
    - [25, 0.0]
  - - [1408, 5888, 1, 128]
    - [35, 0.0]
  - - [7680, 12000, 1, 2560]
    - [33, 0.0]
  - - [1408, 1024, 1, 256]
    - [92, 0.0]
  - - [8192, 400, 1, 2048]
    - [64, 0.0]
  - - [1024, 1856, 1, 128]
    - [35, 0.0]
  - - [256, 704, 1, 128]
    - [35, 0.0]
  - - [2560, 128, 1, 2560]
    - [122, 0.0]
  - - [448, 1024, 1, 256]
    - [36, 0.0]
  - - [128, 4, 1, 3328]
    - [56, 0.0]
  - - [5056, 6784, 1, 1280]
    - [89, 0.0]
  - - [1408, 64, 1, 128]
    - [96, 0.0]
  - - [1024, 448, 1, 1280]
    - [54, 0.0]
  - - [704, 5056, 1, 3328]
    - [38, 0.0]
  - - [128, 5056, 1, 256]
    - [36, 0.0]
  - - [64, 1024, 1, 3328]
    - [97, 0.0]
  - - [1856, 4, 1, 3328]
    - [130, 0.0]
  - - [4, 2944, 1, 128]
    - [82, 0.0]
  - - [2368, 2944, 1, 3328]
    - [28, 0.0]
  - - [448, 448, 1, 1280]
    - [73, 0.0]
  - - [2368, 3584, 1, 256]
    - [31, 0.0]
  - - [5056, 3584, 1, 1280]
    - [53, 0.0]
  - - [5124, 9124, 1, 4096]
    - [31, 0.0]
  - - [7680, 48000, 1, 2560]
    - [33, 0.0]
  - - [448, 4, 1, 3328]
    - [56, 0.0]
  - - [1856, 2944, 1, 1280]
    - [53, 0.0]
  - - [1024, 48000, 1, 2816]
    - [33, 0.0]
  - - [128, 1024, 1, 256]
    - [84, 0.0]
  - - [2944, 1408, 1, 256]
    - [41, 0.0]
  - - [4288, 1408, 1, 3328]
    - [38, 0.0]
  - - [3584, 64, 1, 3328]
    - [109, 0.0]
  - - [5888, 2944, 1, 128]
    - [78, 0.0]
  - - [2944, 1024, 1, 128]
    - [37, 0.0]
  - - [4288, 5056, 1, 1280]
    - [33, 0.0]
  - - [5888, 6784, 1, 1280]
    - [28, 0.0]
  - - [6784, 5056, 1, 128]
    - [65, 0.0]
  - - [256, 1024, 1, 3328]
    - [64, 0.0]
  - - [3584, 4, 1, 256]
    - [25, 0.0]
  - - [1760, 1600, 1, 1760]
    - [38, 0.0]
  - - [1856, 64, 1, 3328]
    - [62, 0.0]
  - - [4, 128, 1, 3328]
    - [56, 0.0]
  - - [5888, 1408, 1, 3328]
    - [28, 0.0]
  - - [448, 2944, 1, 128]
    - [47, 0.0]
  - - [2368, 1856, 1, 256]
    - [36, 0.0]
  - - [256, 5056, 1, 256]
    - [92, 0.0]
  - - [128, 3584, 1, 128]
    - [24, 0.0]
  - - [448, 3584, 1, 3328]
    - [53, 0.0]
  - - [4, 5056, 1, 3328]
    - [26, 0.0]
  - - [704, 2368, 1, 128]
    - [35, 0.0]
  - - [5888, 256, 1, 128]
    - [55, 0.0]
  - - [4, 5056, 1, 128]
    - [40, 0.0]
  - - [448, 256, 1, 256]
    - [39, 0.0]
  - - [704, 4, 1, 3328]
    - [25, 0.0]
  - - [1408, 256, 1, 256]
    - [38, 0.0]
  - - [3584, 1856, 1, 128]
    - [94, 0.0]
  - - [4288, 4288, 1, 128]
    - [37, 0.0]
  - - [1856, 1024, 1, 3328]
    - [45, 0.0]
  - - [128, 5888, 1, 3328]
    - [81, 0.0]
  - - [1024, 5056, 1, 256]
    - [31, 0.0]
  - - [5888, 5888, 1, 1280]
    - [31, 0.0]
  - - [5056, 5888, 1, 128]
    - [65, 0.0]
  - - [2368, 1408, 1, 3328]
    - [54, 0.0]
  - - [1024, 48000, 1, 1536]
    - [54, 0.0]
  - - [5888, 448, 1, 256]
    - [49, 0.0]
  - - [2560, 3200, 1, 2560]
    - [36, 0.0]
  - - [5888, 6784, 1, 128]
    - [65, 0.0]
  - - [6144, 48000, 1, 2048]
    - [31, 0.0]
  - - [6784, 5056, 1, 1280]
    - [92, 0.0]
  - - [5056, 704, 1, 1280]
    - [39, 0.0]
  - - [1024, 48000, 1, 2560]
    - [31, 0.0]
  - - [4608, 32, 1, 1536]
    - [44, 0.0]
  - - [1024, 2368, 1, 128]
    - [35, 0.0]
  - - [128, 704, 1, 256]
    - [99, 0.0]
  - - [2368, 448, 1, 3328]
    - [39, 0.0]
  - - [128, 5888, 1, 1280]
    - [36, 0.0]
  - - [16384, 800, 1, 4096]
    - [33, 0.0]
  - - [448, 128, 1, 1280]
    - [44, 0.0]
  - - [6784, 4, 1, 3328]
    - [25, 0.0]
  - - [5888, 5056, 1, 1280]
    - [33, 0.0]
  - - [1024, 64, 1, 3328]
    - [131, 0.0]
  - - [3072, 48000, 1, 1024]
    - [33, 0.0]
  - - [64, 3584, 1, 1280]
    - [67, 0.0]
  - - [6784, 1408, 1, 256]
    - [33, 0.0]
  - - [3584, 5888, 1, 128]
    - [47, 0.0]
  - - [5056, 5888, 1, 256]
    - [31, 0.0]
  - - [2368, 1024, 1, 256]
    - [43, 0.0]
  - - [2944, 1856, 1, 256]
    - [31, 0.0]
  - - [1856, 6784, 1, 1280]
    - [38, 0.0]
  - - [64, 5056, 1, 128]
    - [24, 0.0]
  - - [64, 6784, 1, 128]
    - [70, 0.0]
  - - [448, 704, 1, 128]
    - [125, 0.0]
  - - [4, 1024, 1, 128]
    - [40, 0.0]
  - - [4288, 3584, 1, 256]
    - [33, 0.0]
  - - [1408, 704, 1, 128]
    - [35, 0.0]
  - - [64, 256, 1, 3328]
    - [97, 0.0]
  - - [6784, 448, 1, 3328]
    - [31, 0.0]
  - - [5056, 1856, 1, 1280]
    - [43, 0.0]
  - - [1408, 1024, 1, 3328]
    - [38, 0.0]
  - - [2368, 256, 1, 3328]
    - [39, 0.0]
  - - [5888, 3584, 1, 1280]
    - [53, 0.0]
  - - [1856, 3584, 1, 3328]
    - [27, 0.0]
  - - [5888, 128, 1, 1280]
    - [39, 0.0]
  - - [1024, 2944, 1, 256]
    - [31, 0.0]
  - - [448, 6784, 1, 1280]
    - [41, 0.0]
  - - [256, 3584, 1, 1280]
    - [43, 0.0]
  - - [704, 5056, 1, 256]
    - [89, 0.0]
  - - [3584, 1024, 1, 3328]
    - [36, 0.0]
  - - [2944, 1856, 1, 1280]
    - [33, 0.0]
  - - [128, 256, 1, 128]
    - [93, 0.0]
  - - [5056, 256, 1, 256]
    - [92, 0.0]
  - - [2944, 4288, 1, 3328]
    - [31, 0.0]
  - - [2368, 3584, 1, 3328]
    - [31, 0.0]
  - - [2944, 704, 1, 1280]
    - [45, 0.0]
  - - [128, 4, 1, 256]
    - [25, 0.0]
  - - [2944, 3584, 1, 1280]
    - [33, 0.0]
  - - [1856, 5888, 1, 1280]
    - [28, 0.0]
  - - [256, 256, 1, 1280]
    - [44, 0.0]
  - - [2048, 3200, 1, 2048]
    - [41, 0.0]
  - - [4288, 1408, 1, 256]
    - [33, 0.0]
  - - [3584, 64, 1, 256]
    - [39, 0.0]
  - - [64, 1856, 1, 3328]
    - [73, 0.0]
  - - [256, 1408, 1, 128]
    - [35, 0.0]
  - - [5888, 1408, 1, 128]
    - [55, 0.0]
  - - [4288, 2368, 1, 1280]
    - [43, 0.0]
  - - [4, 4288, 1, 256]
    - [63, 0.0]
  - - [256, 4288, 1, 128]
    - [35, 0.0]
  - - [2048, 128, 1, 2048]
    - [132, 0.0]
  - - [256, 128, 1, 3328]
    - [51, 0.0]
  - - [512, 8, 1, 500000]
    - [133, 0.0]
  - - [6784, 2368, 1, 256]
    - [33, 0.0]
  - - [5888, 128, 1, 128]
    - [37, 0.0]
  - - [1024, 24000, 1, 2816]
    - [43, 0.0]
  - - [7680, 5984, 1, 2560]
    - [41, 0.0]
  - - [4288, 1856, 1, 256]
    - [34, 0.0]
  - - [1856, 256, 1, 3328]
    - [36, 0.0]
  - - [1856, 2944, 1, 256]
    - [33, 0.0]
  - - [5056, 1024, 1, 128]
    - [88, 0.0]
  - - [64, 5888, 1, 1280]
    - [36, 0.0]
  - - [1760, 800, 1, 1760]
    - [43, 0.0]
  - - [6784, 256, 1, 128]
    - [37, 0.0]
  - - [5888, 704, 1, 128]
    - [35, 0.0]
  - - [1408, 2368, 1, 128]
    - [65, 0.0]
  - - [1024, 4288, 1, 1280]
    - [54, 0.0]
  - - [2368, 5056, 1, 3328]
    - [105, 0.0]
  - - [448, 4, 1, 128]
    - [40, 0.0]
  - - [4, 256, 1, 3328]
    - [69, 0.0]
  - - [4288, 1024, 1, 3328]
    - [39, 0.0]
  - - [6144, 48000, 1, 2560]
    - [33, 0.0]
  - - [1024, 5056, 1, 3328]
    - [28, 0.0]
  - - [1024, 1856, 1, 3328]
    - [33, 0.0]
  - - [704, 704, 1, 1280]
    - [45, 0.0]
  - - [128, 2368, 1, 1280]
    - [30, 0.0]
  - - [1408, 128, 1, 3328]
    - [29, 0.0]
  - - [3584, 256, 1, 1280]
    - [38, 0.0]
  - - [4, 128, 1, 128]
    - [40, 0.0]
  - - [5888, 64, 1, 1280]
    - [29, 0.0]
  - - [3584, 128, 1, 1280]
    - [39, 0.0]
  - - [4, 256, 1, 1280]
    - [42, 0.0]
  - - [128, 704, 1, 3328]
    - [29, 0.0]
  - - [4288, 6784, 1, 256]
    - [28, 0.0]
  - - [3584, 2944, 1, 3328]
    - [33, 0.0]
  - - [128, 1856, 1, 256]
    - [39, 0.0]
  - - [64, 4288, 1, 256]
    - [36, 0.0]
  - - [4, 3584, 1, 3328]
    - [25, 0.0]
  - - [64, 4, 1, 3328]
    - [69, 0.0]
  - - [4, 64, 1, 3328]
    - [69, 0.0]
  - - [5888, 2944, 1, 256]
    - [33, 0.0]
  - - [1856, 64, 1, 256]
    - [106, 0.0]
  - - [5056, 128, 1, 1280]
    - [39, 0.0]
  - - [448, 4288, 1, 1280]
    - [41, 0.0]
  - - [448, 1856, 1, 3328]
    - [41, 0.0]
  - - [1024, 4288, 1, 128]
    - [47, 0.0]
  - - [4, 1024, 1, 256]
    - [42, 0.0]
  - - [5056, 4288, 1, 256]
    - [33, 0.0]
  - - [1024, 448, 1, 256]
    - [54, 0.0]
  - - [1024, 3584, 1, 256]
    - [33, 0.0]
  - - [2944, 128, 1, 1280]
    - [29, 0.0]
  - - [2048, 32, 1, 2048]
    - [134, 0.0]
  - - [64, 256, 1, 256]
    - [25, 0.0]
  - - [1408, 4, 1, 128]
    - [82, 0.0]
  - - [128, 2368, 1, 128]
    - [24, 0.0]
  - - [256, 704, 1, 1280]
    - [36, 0.0]
  - - [64, 2368, 1, 128]
    - [135, 0.0]
  - - [6784, 6784, 1, 3328]
    - [33, 0.0]
  - - [448, 5888, 1, 1280]
    - [31, 0.0]
  - - [5056, 448, 1, 128]
    - [37, 0.0]
  - - [4288, 704, 1, 1280]
    - [43, 0.0]
  - - [3584, 2944, 1, 128]
    - [88, 0.0]
  - - [6784, 256, 1, 1280]
    - [31, 0.0]
  - - [256, 2944, 1, 1280]
    - [36, 0.0]
  - - [64, 4288, 1, 128]
    - [70, 0.0]
  - - [2368, 5888, 1, 3328]
    - [38, 0.0]
  - - [4, 64, 1, 256]
    - [71, 0.0]
  - - [704, 1024, 1, 3328]
    - [39, 0.0]
  - - [2368, 1856, 1, 1280]
    - [43, 0.0]
  - - [448, 5056, 1, 3328]
    - [39, 0.0]
  - - [128, 448, 1, 128]
    - [24, 0.0]
  - - [128, 6784, 1, 256]
    - [38, 0.0]
  - - [3584, 4288, 1, 128]
    - [47, 0.0]
  - - [64, 448, 1, 128]
    - [24, 0.0]
  - - [5888, 4288, 1, 3328]
    - [53, 0.0]
  - - [2368, 704, 1, 256]
    - [33, 0.0]
  - - [256, 1856, 1, 3328]
    - [36, 0.0]
  - - [1856, 128, 1, 256]
    - [64, 0.0]
  - - [6784, 128, 1, 128]
    - [55, 0.0]
  - - [3584, 1408, 1, 128]
    - [88, 0.0]
  - - [1856, 5056, 1, 1280]
    - [38, 0.0]
  - - [2944, 1024, 1, 1280]
    - [31, 0.0]
  - - [5056, 4, 1, 256]
    - [42, 0.0]
  - - [3584, 5888, 1, 3328]
    - [43, 0.0]
  - - [2368, 4288, 1, 256]
    - [41, 0.0]
  - - [1024, 2368, 1, 3328]
    - [38, 0.0]
  - - [64, 704, 1, 3328]
    - [136, 0.0]
  - - [704, 1408, 1, 256]
    - [38, 0.0]
  - - [4096, 128, 1, 4096]
    - [137, 0.0]
  - - [1024, 3584, 1, 1280]
    - [31, 0.0]
  - - [4288, 5888, 1, 3328]
    - [33, 0.0]
  - - [4288, 4, 1, 1280]
    - [25, 0.0]
  - - [4608, 16, 1, 1536]
    - [110, 0.0]
  - - [5888, 64, 1, 128]
    - [138, 0.0]
  - - [4, 5888, 1, 128]
    - [82, 0.0]
  - - [1024, 2944, 1, 3328]
    - [54, 0.0]
  - - [6784, 1856, 1, 256]
    - [33, 0.0]
  - - [2048, 64, 1, 2048]
    - [139, 0.0]
  - - [256, 6784, 1, 1280]
    - [33, 0.0]
  - - [1856, 3584, 1, 256]
    - [31, 0.0]
  - - [128, 448, 1, 3328]
    - [136, 0.0]
  - - [6784, 1856, 1, 128]
    - [37, 0.0]
  - - [4, 448, 1, 256]
    - [25, 0.0]
  - - [5056, 128, 1, 256]
    - [39, 0.0]
  - - [512, 24000, 1, 2816]
    - [28, 0.0]
  - - [256, 5888, 1, 1280]
    - [53, 0.0]
  - - [4, 128, 1, 1280]
    - [56, 0.0]
  - - [16384, 1600, 1, 4096]
    - [33, 0.0]
  - - [6784, 128, 1, 1280]
    - [54, 0.0]
  - - [64, 1408, 1, 256]
    - [140, 0.0]
  - - [2368, 1408, 1, 128]
    - [37, 0.0]
  - - [1856, 448, 1, 256]
    - [39, 0.0]
  - - [1408, 1024, 1, 128]
    - [35, 0.0]
  - - [128, 64, 1, 128]
    - [93, 0.0]
  - - [6784, 3584, 1, 3328]
    - [31, 0.0]
  - - [1760, 7000, 1, 1760]
    - [54, 0.0]
  - - [2944, 64, 1, 3328]
    - [67, 0.0]
  - - [64, 64, 1, 128]
    - [93, 0.0]
  - - [2368, 5056, 1, 1280]
    - [33, 0.0]
  - - [64, 4, 1, 1280]
    - [69, 0.0]
  - - [1408, 2368, 1, 1280]
    - [39, 0.0]
  - - [128, 1408, 1, 1280]
    - [73, 0.0]
  - - [256, 64, 1, 3328]
    - [52, 0.0]
  - - [704, 4288, 1, 128]
    - [35, 0.0]
  - - [128, 1856, 1, 3328]
    - [83, 0.0]
  - - [2944, 2944, 1, 256]
    - [31, 0.0]
  - - [2944, 4, 1, 1280]
    - [25, 0.0]
  - - [5888, 4, 1, 256]
    - [58, 0.0]
  - - [6784, 256, 1, 256]
    - [45, 0.0]
  - - [256, 5056, 1, 3328]
    - [36, 0.0]
  - - [128, 4288, 1, 1280]
    - [73, 0.0]
  - - [5056, 1856, 1, 128]
    - [37, 0.0]
  - - [5056, 1024, 1, 3328]
    - [33, 0.0]
  - - [128, 128, 1, 256]
    - [58, 0.0]
  - - [1760, 64, 1, 1760]
    - [29, 0.0]
  - - [4288, 3584, 1, 3328]
    - [31, 0.0]
  - - [448, 704, 1, 3328]
    - [36, 0.0]
  - - [448, 448, 1, 128]
    - [141, 0.0]
  - - [1024, 2368, 1, 1280]
    - [54, 0.0]
  - - [1856, 704, 1, 3328]
    - [36, 0.0]
  - - [4, 2368, 1, 128]
    - [40, 0.0]
  - - [5888, 6784, 1, 3328]
    - [33, 0.0]
  - - [704, 4288, 1, 1280]
    - [41, 0.0]
  - - [704, 256, 1, 256]
    - [36, 0.0]
  - - [1024, 48000, 1, 2048]
    - [50, 0.0]
  - - [4288, 1024, 1, 128]
    - [35, 0.0]
  - - [256, 64, 1, 3136]
    - [142, 0.0]
  - - [256, 1024, 1, 196]
    - [143, 0.0]
  - - [1024, 1024, 1, 3328]
    - [144, 0.0]
  - - [2048, 200, 1, 3200]
    - [145, 0.0]
  - - [1024, 200, 1, 13312]
    - [146, 0.0]
  - - [1024, 256, 1, 1536]
    - [145, 0.0]
  - - [4096, 256, 1, 12288]
    - [147, 0.0]
  - - [64, 200, 1, 1024]
    - [148, 0.0]
  - - [32, 512, 1, 1024]
    - [149, 0.0]
  - - [2048, 256, 1, 3328]
    - [150, 0.0]
  - - [4096, 512, 1, 32]
    - [151, 0.0]
  - - [2048, 256, 1, 13312]
    - [152, 0.0]
  - - [4096, 200, 1, 11264]
    - [147, 0.0]
  - - [2048, 512, 1, 1024]
    - [153, 0.0]
  - - [2048, 1024, 1, 1664]
    - [154, 0.0]
  - - [1024, 1024, 1, 64]
    - [144, 0.0]
  - - [512, 1024, 1, 1536]
    - [150, 0.0]
  - - [1024, 256, 1, 15360]
    - [155, 0.0]
  - - [1, 512, 1, 1024]
    - [156, 0.0]
  - - [4096, 512, 1, 1408]
    - [157, 0.0]
  - - [1024, 200, 1, 1408]
    - [145, 0.0]
  - - [1024, 512, 1, 512]
    - [158, 0.0]
  - - [4096, 256, 1, 15360]
    - [159, 0.0]
  - - [2048, 512, 1, 640]
    - [160, 0.0]
  - - [4096, 1024, 1, 1280]
    - [161, 0.0]
  - - [1024, 200, 1, 6144]
    - [150, 0.0]
  - - [1024, 1024, 1, 512]
    - [160, 0.0]
  - - [128, 512, 1, 2048]
    - [162, 0.0]
  - - [2048, 1024, 1, 640]
    - [161, 0.0]
  - - [1024, 256, 1, 3328]
    - [150, 0.0]
  - - [4096, 1024, 1, 13312]
    - [157, 0.0]
  - - [2048, 256, 1, 2048]
    - [150, 0.0]
  - - [2048, 1024, 1, 13312]
    - [157, 0.0]
  - - [2048, 512, 1, 16640]
    - [163, 0.0]
  - - [1024, 512, 1, 128]
    - [158, 0.0]
  - - [2048, 1024, 1, 3584]
    - [161, 0.0]
  - - [2048, 512, 1, 256]
    - [147, 0.0]
  - - [512, 256, 1, 3200]
    - [164, 0.0]
  - - [4096, 1024, 1, 1920]
    - [161, 0.0]
  - - [4096, 200, 1, 2560]
    - [165, 0.0]
  - - [1024, 256, 1, 16384]
    - [166, 0.0]
  - - [1024, 1024, 1, 1152]
    - [144, 0.0]
  - - [2048, 200, 1, 32]
    - [167, 0.0]
  - - [512, 1024, 1, 2816]
    - [150, 0.0]
  - - [4096, 256, 1, 14336]
    - [159, 0.0]
  - - [1024, 200, 1, 4608]
    - [145, 0.0]
  - - [1024, 200, 1, 16384]
    - [168, 0.0]
  - - [64, 256, 1, 1024]
    - [169, 0.0]
  - - [1, 200, 1, 1024]
    - [170, 0.0]
  - - [2048, 200, 1, 2080]
    - [145, 0.0]
  - - [512, 256, 1, 1792]
    - [171, 0.0]
  - - [2048, 200, 1, 1024]
    - [145, 0.0]
  - - [4096, 1024, 1, 12288]
    - [161, 0.0]
  - - [4096, 200, 1, 4096]
    - [160, 0.0]
  - - [1024, 512, 1, 11264]
    - [172, 0.0]
  - - [128, 512, 1, 1024]
    - [173, 0.0]
  - - [32, 256, 1, 2048]
    - [174, 0.0]
  - - [1024, 200, 1, 1792]
    - [145, 0.0]
  - - [1024, 1024, 1, 1792]
    - [144, 0.0]
  - - [32, 256, 1, 512]
    - [175, 0.0]
  - - [512, 200, 1, 2816]
    - [176, 0.0]
  - - [512, 200, 1, 3072]
    - [155, 0.0]
  - - [1024, 1024, 1, 8192]
    - [177, 0.0]
  - - [1024, 256, 1, 12288]
    - [178, 0.0]
  - - [4096, 200, 1, 768]
    - [144, 0.0]
  - - [1024, 512, 1, 16384]
    - [179, 0.0]
  - - [4096, 256, 1, 1024]
    - [160, 0.0]
  - - [1024, 512, 1, 256]
    - [158, 0.0]
  - - [4096, 1024, 1, 8320]
    - [161, 0.0]
  - - [4096, 256, 1, 9216]
    - [153, 0.0]
  - - [1024, 512, 1, 1408]
    - [150, 0.0]
  - - [1024, 512, 1, 5632]
    - [145, 0.0]
  - - [4096, 200, 1, 256]
    - [147, 0.0]
  - - [1024, 200, 1, 128]
    - [180, 0.0]
  - - [256, 200, 1, 1024]
    - [164, 0.0]
  - - [1024, 200, 1, 5120]
    - [145, 0.0]
  - - [512, 1024, 1, 3072]
    - [181, 0.0]
  - - [4096, 1024, 1, 15360]
    - [161, 0.0]
  - - [1, 256, 1, 2048]
    - [182, 0.0]
  - - [1024, 1024, 1, 4160]
    - [160, 0.0]
  - - [1024, 256, 1, 256]
    - [183, 0.0]
  - - [2048, 256, 1, 384]
    - [145, 0.0]
  - - [512, 256, 1, 2560]
    - [184, 0.0]
  - - [4096, 512, 1, 3072]
    - [157, 0.0]
  - - [1024, 256, 1, 4160]
    - [150, 0.0]
  - - [4096, 512, 1, 13312]
    - [154, 0.0]
  - - [4096, 1024, 1, 3840]
    - [161, 0.0]
  - - [4096, 200, 1, 640]
    - [144, 0.0]
  - - [32, 200, 1, 2048]
    - [185, 0.0]
  - - [1024, 200, 1, 512]
    - [150, 0.0]
  - - [1024, 1024, 1, 7168]
    - [186, 0.0]
  - - [2048, 1024, 1, 3200]
    - [161, 0.0]
  - - [512, 512, 1, 1536]
    - [145, 0.0]
  - - [4096, 256, 1, 768]
    - [147, 0.0]
  - - [2048, 256, 1, 6656]
    - [150, 0.0]
  - - [1024, 256, 1, 896]
    - [150, 0.0]
  - - [2048, 200, 1, 3072]
    - [145, 0.0]
  - - [128, 200, 1, 1024]
    - [187, 0.0]
  - - [4096, 512, 1, 3840]
    - [157, 0.0]
  - - [1024, 200, 1, 3200]
    - [145, 0.0]
  - - [4096, 512, 1, 5632]
    - [161, 0.0]
  - - [4096, 512, 1, 64]
    - [188, 0.0]
  - - [1024, 512, 1, 2816]
    - [150, 0.0]
  - - [4096, 256, 1, 7680]
    - [144, 0.0]
  - - [4096, 200, 1, 1024]
    - [147, 0.0]
  - - [1024, 512, 1, 12288]
    - [189, 0.0]
  - - [2048, 1024, 1, 512]
    - [157, 0.0]
  - - [128, 256, 1, 2048]
    - [190, 0.0]
  - - [2048, 200, 1, 1792]
    - [145, 0.0]
  - - [1024, 1024, 1, 2816]
    - [160, 0.0]
  - - [2048, 512, 1, 1536]
    - [165, 0.0]
  - - [4096, 256, 1, 3072]
    - [153, 0.0]
  - - [1024, 200, 1, 1536]
    - [191, 0.0]
  - - [1024, 256, 1, 1024]
    - [150, 0.0]
  - - [4096, 512, 1, 8192]
    - [157, 0.0]
  - - [128, 1024, 1, 512]
    - [145, 0.0]
  - - [4096, 512, 1, 2304]
    - [161, 0.0]
  - - [2048, 256, 1, 5632]
    - [145, 0.0]
  - - [1024, 256, 1, 5120]
    - [145, 0.0]
  - - [1024, 512, 1, 6656]
    - [145, 0.0]
  - - [4096, 512, 1, 2816]
    - [161, 0.0]
  - - [4096, 200, 1, 2080]
    - [192, 0.0]
  - - [1024, 200, 1, 2304]
    - [145, 0.0]
  - - [2048, 200, 1, 13312]
    - [150, 0.0]
  - - [64, 1024, 1, 1024]
    - [169, 0.0]
  - - [4096, 256, 1, 3584]
    - [144, 0.0]
  - - [2048, 1024, 1, 7680]
    - [161, 0.0]
  - - [1024, 256, 1, 1664]
    - [150, 0.0]
  - - [1, 512, 1, 2048]
    - [193, 0.0]
  - - [512, 512, 1, 1024]
    - [150, 0.0]
  - - [2048, 256, 1, 8192]
    - [194, 0.0]
  - - [2048, 512, 1, 512]
    - [160, 0.0]
  - - [4096, 512, 1, 1920]
    - [161, 0.0]
  - - [4096, 200, 1, 12288]
    - [147, 0.0]
  - - [2048, 512, 1, 1152]
    - [144, 0.0]
  - - [1024, 256, 1, 2080]
    - [150, 0.0]
  - - [4096, 1024, 1, 32]
    - [195, 0.0]
  - - [4096, 512, 1, 16640]
    - [161, 0.0]
  - - [2048, 200, 1, 9216]
    - [150, 0.0]
  - - [2048, 200, 1, 2560]
    - [150, 0.0]
  - - [2048, 1024, 1, 1024]
    - [161, 0.0]
  - - [2048, 256, 1, 4608]
    - [150, 0.0]
  - - [512, 200, 1, 768]
    - [196, 0.0]
  - - [128, 256, 1, 512]
    - [196, 0.0]
  - - [4096, 512, 1, 1792]
    - [157, 0.0]
  - - [4096, 1024, 1, 8192]
    - [161, 0.0]
  - - [1024, 256, 1, 2816]
    - [145, 0.0]
  - - [1024, 1024, 1, 13312]
    - [186, 0.0]
  - - [2048, 1024, 1, 4160]
    - [161, 0.0]
  - - [2048, 256, 1, 3584]
    - [150, 0.0]
  - - [128, 200, 1, 2048]
    - [187, 0.0]
  - - [4096, 512, 1, 10240]
    - [154, 0.0]
  - - [4096, 512, 1, 512]
    - [161, 0.0]
  - - [2048, 1024, 1, 6656]
    - [161, 0.0]
  - - [1024, 512, 1, 640]
    - [150, 0.0]
  - - [2048, 512, 1, 768]
    - [160, 0.0]
  - - [2048, 200, 1, 1408]
    - [150, 0.0]
  - - [4096, 200, 1, 2048]
    - [147, 0.0]
  - - [1024, 1024, 1, 5632]
    - [160, 0.0]
  - - [2048, 512, 1, 3584]
    - [144, 0.0]
  - - [64, 200, 1, 512]
    - [196, 0.0]
  - - [1024, 200, 1, 64]
    - [197, 0.0]
  - - [512, 512, 1, 2304]
    - [150, 0.0]
  - - [2048, 1024, 1, 14336]
    - [161, 0.0]
  - - [4096, 512, 1, 11264]
    - [154, 0.0]
  - - [4096, 512, 1, 128]
    - [192, 0.0]
  - - [1024, 512, 1, 64]
    - [198, 0.0]
  - - [4096, 512, 1, 768]
    - [161, 0.0]
  - - [4096, 1024, 1, 11264]
    - [161, 0.0]
  - - [1, 256, 1, 1024]
    - [199, 0.0]
  - - [4096, 200, 1, 7680]
    - [192, 0.0]
  - - [1024, 200, 1, 12288]
    - [200, 0.0]
  - - [1024, 1024, 1, 1280]
    - [160, 0.0]
  - - [4096, 1024, 1, 16640]
    - [161, 0.0]
  - - [2048, 1024, 1, 5632]
    - [161, 0.0]
  - - [1024, 200, 1, 15360]
    - [200, 0.0]
  - - [1, 1024, 1, 1024]
    - [201, 0.0]
  - - [2048, 256, 1, 16384]
    - [202, 0.0]
  - - [4096, 512, 1, 12288]
    - [154, 0.0]
  - - [2048, 200, 1, 896]
    - [145, 0.0]
  - - [4096, 1024, 1, 5632]
    - [161, 0.0]
  - - [2048, 256, 1, 32]
    - [151, 0.0]
  - - [2048, 256, 1, 1280]
    - [150, 0.0]
  - - [4096, 256, 1, 4096]
    - [160, 0.0]
  - - [2048, 256, 1, 11264]
    - [150, 0.0]
  - - [4096, 200, 1, 9216]
    - [160, 0.0]
  - - [1024, 512, 1, 4096]
    - [203, 0.0]
  - - [2048, 1024, 1, 10240]
    - [154, 0.0]
  - - [4096, 1024, 1, 640]
    - [161, 0.0]
  - - [128, 1024, 1, 2048]
    - [155, 0.0]
  - - [4096, 200, 1, 3840]
    - [192, 0.0]
  - - [1024, 1024, 1, 1920]
    - [144, 0.0]
  - - [2048, 200, 1, 7168]
    - [145, 0.0]
  - - [2048, 512, 1, 16384]
    - [204, 0.0]
  - - [2048, 1024, 1, 12288]
    - [161, 0.0]
  - - [4096, 1024, 1, 10240]
    - [161, 0.0]
  - - [1024, 1024, 1, 8320]
    - [153, 0.0]
  - - [1024, 256, 1, 9216]
    - [150, 0.0]
  - - [4096, 256, 1, 1152]
    - [192, 0.0]
  - - [512, 200, 1, 2560]
    - [205, 0.0]
  - - [2048, 256, 1, 1920]
    - [150, 0.0]
  - - [2048, 1024, 1, 4608]
    - [161, 0.0]
  - - [512, 256, 1, 1024]
    - [206, 0.0]
  - - [1024, 256, 1, 1920]
    - [191, 0.0]
  - - [4096, 512, 1, 3584]
    - [161, 0.0]
  - - [2048, 512, 1, 4160]
    - [165, 0.0]
  - - [2048, 512, 1, 5632]
    - [147, 0.0]
  - - [4096, 1024, 1, 4608]
    - [161, 0.0]
  - - [4096, 1024, 1, 3328]
    - [161, 0.0]
  - - [4096, 256, 1, 7168]
    - [160, 0.0]
  - - [4096, 200, 1, 128]
    - [147, 0.0]
  - - [2048, 200, 1, 5120]
    - [150, 0.0]
  - - [1024, 1024, 1, 6656]
    - [160, 0.0]
  - - [512, 1024, 1, 3200]
    - [145, 0.0]
  - - [512, 200, 1, 2304]
    - [155, 0.0]
  - - [2048, 1024, 1, 9216]
    - [157, 0.0]
  - - [2048, 256, 1, 1536]
    - [145, 0.0]
  - - [4096, 256, 1, 256]
    - [147, 0.0]
  - - [2048, 512, 1, 1408]
    - [165, 0.0]
  - - [1024, 256, 1, 384]
    - [158, 0.0]
  - - [2048, 1024, 1, 2304]
    - [161, 0.0]
  - - [4096, 512, 1, 6144]
    - [154, 0.0]
  - - [1024, 200, 1, 14336]
    - [207, 0.0]
  - - [1024, 512, 1, 2080]
    - [145, 0.0]
  - - [2048, 512, 1, 2304]
    - [165, 0.0]
  - - [4096, 512, 1, 15360]
    - [157, 0.0]
  - - [1024, 256, 1, 32]
    - [208, 0.0]
  - - [1024, 200, 1, 2816]
    - [145, 0.0]
  - - [4096, 200, 1, 512]
    - [160, 0.0]
  - - [4096, 1024, 1, 7168]
    - [157, 0.0]
  - - [2048, 256, 1, 14336]
    - [209, 0.0]
  - - [1024, 200, 1, 3072]
    - [145, 0.0]
  - - [2048, 200, 1, 1280]
    - [145, 0.0]
  - - [1024, 1024, 1, 2304]
    - [160, 0.0]
  - - [4096, 1024, 1, 9216]
    - [161, 0.0]
  - - [2048, 512, 1, 4608]
    - [165, 0.0]
  - - [4096, 1024, 1, 7680]
    - [161, 0.0]
  - - [4096, 256, 1, 6144]
    - [165, 0.0]
  - - [4096, 256, 1, 896]
    - [144, 0.0]
  - - [512, 256, 1, 1536]
    - [175, 0.0]
  - - [1024, 256, 1, 512]
    - [150, 0.0]
  - - [2048, 256, 1, 640]
    - [150, 0.0]
  - - [256, 256, 1, 2048]
    - [210, 0.0]
  - - [2048, 1024, 1, 8192]
    - [161, 0.0]
  - - [4096, 200, 1, 16640]
    - [211, 0.0]
  - - [256, 512, 1, 512]
    - [212, 0.0]
  - - [2048, 512, 1, 384]
    - [165, 0.0]
  - - [2048, 200, 1, 16384]
    - [152, 0.0]
  - - [4096, 200, 1, 10240]
    - [144, 0.0]
  - - [1024, 512, 1, 9216]
    - [213, 0.0]
  - - [4096, 1024, 1, 64]
    - [214, 0.0]
  - - [4096, 200, 1, 1920]
    - [147, 0.0]
  - - [2048, 1024, 1, 1280]
    - [161, 0.0]
  - - [1024, 200, 1, 3840]
    - [150, 0.0]
  - - [256, 1024, 1, 512]
    - [145, 0.0]
  - - [2048, 1024, 1, 3328]
    - [161, 0.0]
  - - [1024, 256, 1, 16640]
    - [184, 0.0]
  - - [4096, 512, 1, 14336]
    - [157, 0.0]
  - - [1024, 1024, 1, 16640]
    - [153, 0.0]
  - - [1024, 256, 1, 1152]
    - [145, 0.0]
  - - [4096, 512, 1, 8320]
    - [157, 0.0]
  - - [2048, 512, 1, 7680]
    - [147, 0.0]
  - - [4096, 1024, 1, 6656]
    - [161, 0.0]
  - - [1024, 512, 1, 3584]
    - [145, 0.0]
  - - [1024, 1024, 1, 32]
    - [195, 0.0]
  - - [512, 512, 1, 2816]
    - [191, 0.0]
  - - [2048, 512, 1, 1664]
    - [147, 0.0]
  - - [1024, 1024, 1, 14336]
    - [204, 0.0]
  - - [2048, 200, 1, 2048]
    - [145, 0.0]
  - - [1024, 1024, 1, 3584]
    - [160, 0.0]
  - - [512, 200, 1, 1280]
    - [176, 0.0]
  - - [4096, 256, 1, 6656]
    - [147, 0.0]
  - - [4096, 256, 1, 4160]
    - [215, 0.0]
  - - [128, 256, 1, 1024]
    - [216, 0.0]
  - - [512, 200, 1, 3200]
    - [176, 0.0]
  - - [2048, 512, 1, 9216]
    - [217, 0.0]
  - - [2048, 1024, 1, 256]
    - [192, 0.0]
  - - [1024, 256, 1, 2304]
    - [145, 0.0]
  - - [1024, 200, 1, 8192]
    - [145, 0.0]
  - - [2048, 256, 1, 3072]
    - [218, 0.0]
  - - [2048, 256, 1, 8320]
    - [150, 0.0]
  - - [4096, 512, 1, 1024]
    - [154, 0.0]
  - - [1024, 512, 1, 3200]
    - [150, 0.0]
  - - [1024, 512, 1, 896]
    - [191, 0.0]
  - - [2048, 512, 1, 1280]
    - [144, 0.0]
  - - [4096, 200, 1, 64]
    - [219, 0.0]
  - - [1024, 256, 1, 6144]
    - [220, 0.0]
  - - [1024, 200, 1, 2560]
    - [150, 0.0]
  - - [1024, 1024, 1, 5120]
    - [221, 0.0]
  - - [2048, 512, 1, 6656]
    - [144, 0.0]
  - - [4096, 1024, 1, 1536]
    - [161, 0.0]
  - - [1024, 1024, 1, 128]
    - [222, 0.0]
  - - [512, 1024, 1, 1792]
    - [150, 0.0]
  - - [2048, 1024, 1, 32]
    - [223, 0.0]
  - - [4096, 256, 1, 2816]
    - [192, 0.0]
  - - [1024, 1024, 1, 15360]
    - [204, 0.0]
  - - [1024, 256, 1, 5632]
    - [150, 0.0]
  - - [1024, 1024, 1, 4096]
    - [186, 0.0]
  - - [2048, 200, 1, 4160]
    - [145, 0.0]
  - - [512, 256, 1, 768]
    - [224, 0.0]
  - - [4096, 512, 1, 640]
    - [157, 0.0]
  - - [2048, 512, 1, 8192]
    - [213, 0.0]
  - - [1024, 512, 1, 768]
    - [150, 0.0]
  - - [4096, 200, 1, 8320]
    - [192, 0.0]
  - - [2048, 512, 1, 896]
    - [160, 0.0]
  - - [4096, 200, 1, 7168]
    - [165, 0.0]
  - - [2048, 512, 1, 13312]
    - [163, 0.0]
  - - [2048, 200, 1, 3840]
    - [150, 0.0]
  - - [1024, 1024, 1, 768]
    - [215, 0.0]
  - - [4096, 512, 1, 16384]
    - [157, 0.0]
  - - [4096, 256, 1, 2304]
    - [215, 0.0]
  - - [1, 256, 1, 4096]
    - [199, 0.0]
  - - [1024, 1024, 1, 11264]
    - [186, 0.0]
  - - [2048, 200, 1, 16640]
    - [225, 0.0]
  - - [1024, 256, 1, 3072]
    - [145, 0.0]
  - - [4096, 1024, 1, 512]
    - [161, 0.0]
  - - [2048, 256, 1, 2816]
    - [150, 0.0]
  - - [32, 512, 1, 512]
    - [212, 0.0]
  - - [256, 512, 1, 2048]
    - [164, 0.0]
  - - [1024, 512, 1, 384]
    - [145, 0.0]
  - - [2048, 200, 1, 7680]
    - [150, 0.0]
  - - [1024, 512, 1, 4608]
    - [145, 0.0]
  - - [4096, 200, 1, 32]
    - [226, 0.0]
  - - [4096, 200, 1, 3328]
    - [192, 0.0]
  - - [1024, 200, 1, 1152]
    - [150, 0.0]
  - - [1024, 1024, 1, 1408]
    - [160, 0.0]
  - - [2048, 200, 1, 15360]
    - [227, 0.0]
  - - [512, 1024, 1, 2048]
    - [228, 0.0]
  - - [1024, 200, 1, 10240]
    - [150, 0.0]
  - - [4096, 256, 1, 5632]
    - [165, 0.0]
  - - [512, 512, 1, 3072]
    - [229, 0.0]
  - - [2048, 256, 1, 1408]
    - [150, 0.0]
  - - [2048, 256, 1, 6144]
    - [145, 0.0]
  - - [4096, 256, 1, 3328]
    - [144, 0.0]
  - - [1024, 200, 1, 1664]
    - [150, 0.0]
  - - [2048, 1024, 1, 1152]
    - [161, 0.0]
  - - [2048, 512, 1, 6144]
    - [163, 0.0]
  - - [2048, 512, 1, 3200]
    - [160, 0.0]
  - - [4096, 1024, 1, 2080]
    - [230, 0.0]
  - - [4096, 1024, 1, 768]
    - [161, 0.0]
  - - [4096, 1024, 1, 2560]
    - [161, 0.0]
  - - [64, 200, 1, 2048]
    - [231, 0.0]
  - - [2048, 200, 1, 4608]
    - [145, 0.0]
  - - [1024, 1024, 1, 6144]
    - [186, 0.0]
  - - [4096, 256, 1, 1664]
    - [144, 0.0]
  - - [2048, 200, 1, 384]
    - [145, 0.0]
  - - [1, 200, 1, 2048]
    - [174, 0.0]
  - - [4096, 256, 1, 1792]
    - [147, 0.0]
  - - [2048, 1024, 1, 64]
    - [214, 0.0]
  - - [4096, 1024, 1, 16384]
    - [232, 0.0]
  - - [1024, 512, 1, 16640]
    - [145, 0.0]
  - - [2048, 512, 1, 10240]
    - [163, 0.0]
  - - [4096, 512, 1, 6656]
    - [161, 0.0]
  - - [2048, 256, 1, 16640]
    - [150, 0.0]
  - - [2048, 512, 1, 2816]
    - [160, 0.0]
  - - [1024, 200, 1, 32]
    - [233, 0.0]
  - - [1, 512, 1, 4096]
    - [234, 0.0]
  - - [256, 256, 1, 1024]
    - [196, 0.0]
  - - [2048, 1024, 1, 128]
    - [235, 0.0]
  - - [2048, 1024, 1, 2080]
    - [161, 0.0]
  - - [2048, 1024, 1, 16640]
    - [161, 0.0]
  - - [1024, 200, 1, 384]
    - [145, 0.0]
  - - [4096, 256, 1, 384]
    - [236, 0.0]
  - - [4096, 256, 1, 13312]
    - [153, 0.0]
  - - [2048, 256, 1, 128]
    - [158, 0.0]
  - - [512, 256, 1, 2304]
    - [237, 0.0]
  - - [2048, 1024, 1, 3072]
    - [154, 0.0]
  - - [1024, 1024, 1, 640]
    - [144, 0.0]
  - - [256, 512, 1, 1024]
    - [145, 0.0]
  - - [4096, 1024, 1, 1408]
    - [161, 0.0]
  - - [4096, 200, 1, 5632]
    - [165, 0.0]
  - - [4096, 1024, 1, 2048]
    - [161, 0.0]
  - - [2048, 1024, 1, 2560]
    - [157, 0.0]
  - - [4096, 1024, 1, 128]
    - [192, 0.0]
  - - [1024, 200, 1, 3328]
    - [145, 0.0]
  - - [2048, 200, 1, 1152]
    - [150, 0.0]
  - - [1024, 200, 1, 9216]
    - [207, 0.0]
  - - [4096, 256, 1, 512]
    - [215, 0.0]
  - - [4096, 1024, 1, 14336]
    - [161, 0.0]
  - - [1024, 1024, 1, 384]
    - [222, 0.0]
  - - [2048, 200, 1, 512]
    - [150, 0.0]
  - - [2048, 256, 1, 9216]
    - [238, 0.0]
  - - [2048, 256, 1, 1792]
    - [150, 0.0]
  - - [4096, 512, 1, 9216]
    - [154, 0.0]
  - - [4096, 200, 1, 15360]
    - [211, 0.0]
  - - [64, 256, 1, 2048]
    - [239, 0.0]
  - - [4096, 200, 1, 1792]
    - [160, 0.0]
  - - [1, 200, 1, 4096]
    - [240, 0.0]
  - - [2048, 1024, 1, 2048]
    - [157, 0.0]
  - - [1024, 200, 1, 2080]
    - [191, 0.0]
  - - [2048, 200, 1, 1536]
    - [145, 0.0]
  - - [1024, 1024, 1, 3072]
    - [241, 0.0]
  - - [512, 200, 1, 1792]
    - [242, 0.0]
  - - [1024, 256, 1, 11264]
    - [155, 0.0]
  - - [2048, 512, 1, 12288]
    - [203, 0.0]
  - - [1024, 256, 1, 1792]
    - [145, 0.0]
  - - [1024, 200, 1, 7168]
    - [145, 0.0]
  - - [32, 256, 1, 1024]
    - [243, 0.0]
  - - [512, 256, 1, 3072]
    - [184, 0.0]
  - - [1024, 1024, 1, 2080]
    - [160, 0.0]
  - - [2048, 200, 1, 2304]
    - [145, 0.0]
  - - [4096, 512, 1, 1536]
    - [161, 0.0]
  - - [2048, 256, 1, 7168]
    - [145, 0.0]
  - - [2048, 512, 1, 1792]
    - [165, 0.0]
  - - [1024, 200, 1, 2048]
    - [150, 0.0]
  - - [1024, 1024, 1, 4608]
    - [144, 0.0]
  - - [4096, 256, 1, 8192]
    - [160, 0.0]
  - - [512, 1024, 1, 1280]
    - [191, 0.0]
  - - [2048, 1024, 1, 16384]
    - [204, 0.0]
  - - [512, 512, 1, 1280]
    - [150, 0.0]
  - - [1024, 200, 1, 1280]
    - [191, 0.0]
  - - [2048, 256, 1, 3200]
    - [150, 0.0]
  - - [2048, 512, 1, 15360]
    - [203, 0.0]
  - - [1024, 512, 1, 3328]
    - [150, 0.0]
  - - [1024, 512, 1, 4160]
    - [150, 0.0]
  - - [4096, 200, 1, 6656]
    - [160, 0.0]
  - - [4096, 1024, 1, 1024]
    - [161, 0.0]
  - - [2048, 200, 1, 3328]
    - [145, 0.0]
  - - [1024, 1024, 1, 256]
    - [222, 0.0]
  - - [512, 200, 1, 512]
    - [196, 0.0]
  - - [2048, 256, 1, 64]
    - [244, 0.0]
  - - [1024, 256, 1, 2560]
    - [150, 0.0]
  - - [2048, 512, 1, 11264]
    - [159, 0.0]
  - - [32, 200, 1, 1024]
    - [245, 0.0]
  - - [32, 512, 1, 2048]
    - [156, 0.0]
  - - [2048, 256, 1, 2304]
    - [150, 0.0]
  - - [2048, 256, 1, 12288]
    - [238, 0.0]
  - - [4096, 200, 1, 8192]
    - [160, 0.0]
  - - [1024, 512, 1, 7168]
    - [203, 0.0]
  - - [1024, 512, 1, 1792]
    - [150, 0.0]
  - - [4096, 1024, 1, 1664]
    - [161, 0.0]
  - - [4096, 200, 1, 2816]
    - [192, 0.0]
  - - [1024, 1024, 1, 896]
    - [160, 0.0]
  - - [1024, 200, 1, 8320]
    - [164, 0.0]
  - - [1024, 1024, 1, 12288]
    - [186, 0.0]
  - - [1024, 256, 1, 8320]
    - [191, 0.0]
  - - [1024, 200, 1, 1024]
    - [150, 0.0]
  - - [1024, 200, 1, 16640]
    - [246, 0.0]
  - - [4096, 256, 1, 5120]
    - [147, 0.0]
  - - [1024, 256, 1, 3200]
    - [145, 0.0]
  - - [512, 512, 1, 2560]
    - [145, 0.0]
  - - [4096, 256, 1, 2048]
    - [147, 0.0]
  - - [1024, 256, 1, 640]
    - [150, 0.0]
  - - [2048, 256, 1, 5120]
    - [218, 0.0]
  - - [2048, 256, 1, 7680]
    - [145, 0.0]
  - - [4096, 512, 1, 384]
    - [144, 0.0]
  - - [2048, 200, 1, 3584]
    - [150, 0.0]
  - - [1024, 512, 1, 1536]
    - [150, 0.0]
  - - [4096, 512, 1, 3328]
    - [161, 0.0]
  - - [4096, 1024, 1, 256]
    - [161, 0.0]
  - - [2048, 200, 1, 64]
    - [247, 0.0]
  - - [2048, 200, 1, 4096]
    - [145, 0.0]
  - - [1024, 1024, 1, 1536]
    - [160, 0.0]
  - - [2048, 1024, 1, 7168]
    - [154, 0.0]
  - - [1024, 256, 1, 3584]
    - [150, 0.0]
  - - [4096, 256, 1, 32]
    - [151, 0.0]
  - - [4096, 256, 1, 1280]
    - [165, 0.0]
  - - [512, 512, 1, 3200]
    - [145, 0.0]
  - - [2048, 1024, 1, 1536]
    - [154, 0.0]
  - - [2048, 256, 1, 1024]
    - [150, 0.0]
  - - [128, 200, 1, 512]
    - [175, 0.0]
  - - [4096, 512, 1, 7168]
    - [157, 0.0]
  - - [1024, 512, 1, 1152]
    - [150, 0.0]
  - - [64, 1024, 1, 2048]
    - [162, 0.0]
  - - [2048, 512, 1, 3328]
    - [160, 0.0]
  - - [4096, 1024, 1, 896]
    - [161, 0.0]
  - - [1, 1024, 1, 2048]
    - [248, 0.0]
  - - [4096, 200, 1, 3584]
    - [144, 0.0]
  - - [4096, 1024, 1, 4096]
    - [161, 0.0]
  - - [1024, 256, 1, 14336]
    - [155, 0.0]
  - - [2048, 200, 1, 256]
    - [150, 0.0]
  - - [4096, 256, 1, 16384]
    - [204, 0.0]
  - - [4096, 256, 1, 1920]
    - [215, 0.0]
  - - [32, 1024, 1, 512]
    - [249, 0.0]
  - - [1024, 256, 1, 7680]
    - [145, 0.0]
  - - [2048, 256, 1, 1664]
    - [145, 0.0]
  - - [512, 200, 1, 1536]
    - [176, 0.0]
  - - [2048, 1024, 1, 6144]
    - [232, 0.0]
  - - [512, 256, 1, 2816]
    - [164, 0.0]
  - - [4096, 512, 1, 4160]
    - [154, 0.0]
  - - [4096, 512, 1, 2080]
    - [250, 0.0]
  - - [2048, 256, 1, 15360]
    - [209, 0.0]
  - - [4096, 200, 1, 5120]
    - [165, 0.0]
  - - [1024, 512, 1, 8192]
    - [217, 0.0]
  - - [4096, 200, 1, 896]
    - [147, 0.0]
  - - [2048, 512, 1, 8320]
    - [144, 0.0]
  - - [1024, 1024, 1, 10240]
    - [251, 0.0]
  - - [1024, 200, 1, 768]
    - [150, 0.0]
  - - [2048, 200, 1, 640]
    - [145, 0.0]
  - - [512, 200, 1, 2048]
    - [184, 0.0]
  - - [1024, 1024, 1, 9216]
    - [186, 0.0]
  - - [4096, 200, 1, 1408]
    - [165, 0.0]
  - - [1024, 256, 1, 13312]
    - [155, 0.0]
  - - [1024, 256, 1, 128]
    - [252, 0.0]
  - - [2048, 200, 1, 5632]
    - [145, 0.0]
  - - [64, 1024, 1, 512]
    - [175, 0.0]
  - - [1024, 512, 1, 2560]
    - [145, 0.0]
  - - [4096, 200, 1, 1280]
    - [215, 0.0]
  - - [1024, 200, 1, 4096]
    - [145, 0.0]
  - - [1024, 1024, 1, 2560]
    - [160, 0.0]
  - - [2048, 512, 1, 64]
    - [144, 0.0]
  - - [2048, 200, 1, 8192]
    - [150, 0.0]
  - - [2048, 512, 1, 3072]
    - [153, 0.0]
  - - [4096, 1024, 1, 5120]
    - [161, 0.0]
  - - [4096, 256, 1, 640]
    - [192, 0.0]
  - - [1024, 256, 1, 1280]
    - [150, 0.0]
  - - [2048, 1024, 1, 1920]
    - [154, 0.0]
  - - [2048, 256, 1, 4096]
    - [150, 0.0]
  - - [2048, 1024, 1, 15360]
    - [157, 0.0]
  - - [4096, 200, 1, 16384]
    - [204, 0.0]
  - - [1, 1024, 1, 4096]
    - [253, 0.0]
  - - [4096, 1024, 1, 2816]
    - [161, 0.0]
  - - [4096, 200, 1, 1664]
    - [192, 0.0]
  - - [4096, 512, 1, 256]
    - [254, 0.0]
  - - [1024, 200, 1, 896]
    - [150, 0.0]
  - - [2048, 200, 1, 6656]
    - [145, 0.0]
  - - [2048, 1024, 1, 5120]
    - [154, 0.0]
  - - [512, 1024, 1, 768]
    - [150, 0.0]
  - - [2048, 512, 1, 14336]
    - [255, 0.0]
  - - [2048, 200, 1, 8320]
    - [150, 0.0]
  - - [4096, 256, 1, 3840]
    - [147, 0.0]
  - - [2048, 1024, 1, 4096]
    - [232, 0.0]
  - - [1024, 1024, 1, 3200]
    - [144, 0.0]
  - - [1024, 256, 1, 4608]
    - [150, 0.0]
  - - [4096, 512, 1, 4608]
    - [161, 0.0]
  - - [4096, 512, 1, 1664]
    - [161, 0.0]
  - - [4096, 256, 1, 4608]
    - [192, 0.0]
  - - [1024, 512, 1, 32]
    - [256, 0.0]
  - - [1024, 512, 1, 3840]
    - [150, 0.0]
  - - [2048, 512, 1, 1920]
    - [147, 0.0]
  - - [2048, 1024, 1, 896]
    - [161, 0.0]
  - - [4096, 200, 1, 6144]
    - [147, 0.0]
  - - [1024, 512, 1, 13312]
    - [172, 0.0]
  - - [4096, 1024, 1, 4160]
    - [161, 0.0]
  - - [2048, 200, 1, 2816]
    - [150, 0.0]
  - - [1024, 1024, 1, 3840]
    - [192, 0.0]
  - - [128, 1024, 1, 1024]
    - [257, 0.0]
  - - [2048, 1024, 1, 11264]
    - [157, 0.0]
  - - [2048, 1024, 1, 384]
    - [160, 0.0]
  - - [1024, 256, 1, 2048]
    - [229, 0.0]
  - - [2048, 1024, 1, 3840]
    - [154, 0.0]
  - - [4096, 256, 1, 8320]
    - [147, 0.0]
  - - [2048, 256, 1, 3840]
    - [191, 0.0]
  - - [64, 256, 1, 512]
    - [175, 0.0]
  - - [4096, 512, 1, 1280]
    - [154, 0.0]
  - - [512, 256, 1, 1280]
    - [224, 0.0]
  - - [1024, 512, 1, 7680]
    - [150, 0.0]
  - - [4096, 1024, 1, 1152]
    - [161, 0.0]
  - - [256, 200, 1, 512]
    - [224, 0.0]
  - - [256, 1024, 1, 2048]
    - [258, 0.0]
  - - [2048, 200, 1, 10240]
    - [145, 0.0]
  - - [2048, 512, 1, 5120]
    - [159, 0.0]
  - - [2048, 1024, 1, 1408]
    - [154, 0.0]
  - - [512, 1024, 1, 512]
    - [150, 0.0]
  - - [1024, 200, 1, 11264]
    - [200, 0.0]
  - - [2048, 512, 1, 32]
    - [259, 0.0]
  - - [4096, 256, 1, 2560]
    - [160, 0.0]
  - - [4096, 256, 1, 64]
    - [260, 0.0]
  - - [32, 1024, 1, 1024]
    - [210, 0.0]
  - - [2048, 200, 1, 768]
    - [145, 0.0]
  - - [512, 512, 1, 2048]
    - [261, 0.0]
  - - [2048, 512, 1, 2560]
    - [165, 0.0]
  - - [512, 256, 1, 512]
    - [191, 0.0]
  - - [1024, 200, 1, 7680]
    - [200, 0.0]
  - - [4096, 512, 1, 896]
    - [161, 0.0]
  - - [4096, 1024, 1, 3072]
    - [161, 0.0]
  - - [4096, 200, 1, 13312]
    - [211, 0.0]
  - - [2048, 512, 1, 7168]
    - [163, 0.0]
  - - [2048, 1024, 1, 2816]
    - [157, 0.0]
  - - [2048, 512, 1, 128]
    - [222, 0.0]
  - - [1024, 256, 1, 8192]
    - [229, 0.0]
  - - [4096, 1024, 1, 1792]
    - [161, 0.0]
  - - [1024, 200, 1, 6656]
    - [191, 0.0]
  - - [4096, 200, 1, 2304]
    - [165, 0.0]
  - - [4096, 512, 1, 1152]
    - [161, 0.0]
  - - [512, 200, 1, 1024]
    - [175, 0.0]
  - - [1024, 256, 1, 3840]
    - [145, 0.0]
  - - [512, 512, 1, 768]
    - [150, 0.0]
  - - [2048, 512, 1, 4096]
    - [153, 0.0]
  - - [2048, 256, 1, 2560]
    - [150, 0.0]
  - - [2048, 256, 1, 4160]
    - [145, 0.0]
  - - [1024, 256, 1, 64]
    - [197, 0.0]
  - - [4096, 512, 1, 7680]
    - [161, 0.0]
  - - [1024, 512, 1, 1664]
    - [145, 0.0]
  - - [2048, 512, 1, 2080]
    - [160, 0.0]
  - - [2048, 512, 1, 3840]
    - [165, 0.0]
  - - [4096, 1024, 1, 384]
    - [161, 0.0]
  - - [4096, 200, 1, 3072]
    - [160, 0.0]
  - - [1024, 512, 1, 14336]
    - [189, 0.0]
  - - [1024, 200, 1, 1920]
    - [191, 0.0]
  - - [1024, 1024, 1, 1664]
    - [144, 0.0]
  - - [512, 1024, 1, 2304]
    - [150, 0.0]
  - - [2048, 1024, 1, 1792]
    - [161, 0.0]
  - - [32, 200, 1, 512]
    - [206, 0.0]
  - - [4096, 256, 1, 11264]
    - [165, 0.0]
  - - [4096, 256, 1, 1408]
    - [165, 0.0]
  - - [1024, 256, 1, 7168]
    - [150, 0.0]
  - - [2048, 256, 1, 1152]
    - [145, 0.0]
  - - [256, 256, 1, 512]
    - [175, 0.0]
  - - [1024, 512, 1, 1280]
    - [150, 0.0]
  - - [512, 512, 1, 1792]
    - [191, 0.0]
  - - [2048, 200, 1, 12288]
    - [209, 0.0]
  - - [2048, 200, 1, 1664]
    - [145, 0.0]
  - - [4096, 200, 1, 4608]
    - [144, 0.0]
  - - [512, 1024, 1, 2560]
    - [150, 0.0]
  - - [4096, 200, 1, 384]
    - [215, 0.0]
  - - [128, 512, 1, 512]
    - [175, 0.0]
  - - [1024, 200, 1, 256]
    - [180, 0.0]
  - - [256, 1024, 1, 1024]
    - [262, 0.0]
  - - [2048, 200, 1, 128]
    - [150, 0.0]
  - - [2048, 200, 1, 11264]
    - [152, 0.0]
  - - [1024, 512, 1, 1920]
    - [145, 0.0]
  - - [4096, 256, 1, 1536]
    - [144, 0.0]
  - - [4096, 1024, 1, 3584]
    - [161, 0.0]
  - - [2048, 256, 1, 256]
    - [150, 0.0]
  - - [2048, 1024, 1, 768]
    - [161, 0.0]
  - - [4096, 256, 1, 10240]
    - [160, 0.0]
  - - [2048, 256, 1, 10240]
    - [263, 0.0]
  - - [4096, 200, 1, 14336]
    - [147, 0.0]
  - - [1024, 512, 1, 5120]
    - [264, 0.0]
  - - [1024, 512, 1, 8320]
    - [145, 0.0]
  - - [256, 200, 1, 2048]
    - [170, 0.0]
  - - [1024, 200, 1, 640]
    - [180, 0.0]
  - - [1024, 512, 1, 10240]
    - [217, 0.0]
  - - [1024, 200, 1, 4160]
    - [145, 0.0]
  - - [1024, 200, 1, 5632]
    - [191, 0.0]
  - - [1024, 1024, 1, 2048]
    - [177, 0.0]
  - - [1024, 256, 1, 6656]
    - [145, 0.0]
  - - [2048, 1024, 1, 8320]
    - [161, 0.0]
  - - [1024, 256, 1, 10240]
    - [150, 0.0]
  - - [2048, 256, 1, 2080]
    - [150, 0.0]
  - - [4096, 256, 1, 128]
    - [265, 0.0]
  - - [1024, 256, 1, 768]
    - [158, 0.0]
  - - [2048, 256, 1, 896]
    - [145, 0.0]
  - - [64, 512, 1, 2048]
    - [266, 0.0]
  - - [4096, 512, 1, 2048]
    - [154, 0.0]
  - - [512, 256, 1, 2048]
    - [164, 0.0]
  - - [4096, 256, 1, 16640]
    - [192, 0.0]
  - - [4096, 512, 1, 2560]
    - [157, 0.0]
  - - [1024, 512, 1, 15360]
    - [267, 0.0]
  - - [4096, 1024, 1, 2304]
    - [161, 0.0]
  - - [4096, 200, 1, 1152]
    - [165, 0.0]
  - - [2048, 200, 1, 6144]
    - [145, 0.0]
  - - [1024, 1024, 1, 7680]
    - [144, 0.0]
  - - [2048, 200, 1, 1920]
    - [145, 0.0]
  - - [32, 1024, 1, 2048]
    - [268, 0.0]
  - - [1024, 200, 1, 3584]
    - [191, 0.0]
  - - [4096, 256, 1, 2080]
    - [217, 0.0]
  - - [1024, 1024, 1, 16384]
    - [211, 0.0]
  - - [1024, 256, 1, 1408]
    - [145, 0.0]
  - - [1024, 256, 1, 4096]
    - [220, 0.0]
  - - [2048, 200, 1, 14336]
    - [145, 0.0]
  - - [4096, 512, 1, 5120]
    - [154, 0.0]
  - - [1024, 512, 1, 6144]
    - [269, 0.0]
  - - [1024, 512, 1, 2304]
    - [145, 0.0]
  - - [4096, 200, 1, 4160]
    - [192, 0.0]
  - - [4096, 200, 1, 1536]
    - [144, 0.0]
  - - [4096, 1024, 1, 6144]
    - [161, 0.0]
  - - [256, 64, 1, 1225]
    - [270, 0.0]
  - - [2048, 320, 1, 64]
    - [271, 0.0]
  - - [1024, 128, 1, 289]
    - [272, 0.0]
  - - [384, 64, 1, 1225]
    - [273, 0.0]
  - - [2048, 384, 1, 64]
    - [274, 0.0]
  - - [64, 80, 1, 5329]
    - [275, 0.0]
  - - [1024, 384, 1, 289]
    - [276, 0.0]
  - - [2048, 448, 1, 64]
    - [277, 0.0]
  - - [768, 192, 1, 289]
    - [278, 0.0]
  - - [288, 64, 1, 1225]
    - [279, 0.0]
  - - [384, 96, 1, 1225]
    - [280, 0.0]
  - - [1024, 3392, 1, 4096]
    - [281, 0.0]
  - - [1024, 3301, 1, 4096]
    - [282, 0.0]
  - - [1024, 3443, 1, 4096]
    - [283, 0.0]
  - - [132, 134, 480, 64]
    - [284, 0.0]
  - - [162, 162, 400, 64]
    - [285, 0.0]
  - - [4096, 3548, 1, 1024]
    - [286, 0.0]
  - - [4096, 2977, 1, 1024]
    - [287, 0.0]
  - - [132, 135, 480, 64]
    - [284, 0.0]
  - - [1024, 2985, 1, 4096]
    - [288, 0.0]
  - - [33708, 3681, 1, 1024]
    - [287, 0.0]
  - - [4096, 3443, 1, 1024]
    - [287, 0.0]
  - - [11, 11, 5456, 64]
    - [289, 0.0]
  - - [1024, 3400, 1, 4096]
    - [290, 0.0]
  - - [4096, 3995, 1, 1024]
    - [286, 0.0]
  - - [4096, 3190, 1, 1024]
    - [286, 0.0]
  - - [4096, 3594, 1, 1024]
    - [287, 0.0]
  - - [159, 162, 400, 64]
    - [291, 0.0]
  - - [1024, 3565, 1, 4096]
    - [292, 0.0]
  - - [4096, 3422, 1, 1024]
    - [287, 0.0]
  - - [1024, 3214, 1, 4096]
    - [282, 0.0]
  - - [33708, 3584, 1, 1024]
    - [293, 0.0]
  - - [33708, 3640, 1, 1024]
    - [294, 0.0]
  - - [4096, 3263, 1, 1024]
    - [294, 0.0]
  - - [4096, 3296, 1, 1024]
    - [294, 0.0]
  - - [1024, 3557, 1, 4096]
    - [295, 0.0]
  - - [4096, 3463, 1, 1024]
    - [294, 0.0]
  - - [4096, 3528, 1, 1024]
    - [294, 0.0]
  - - [14, 14, 4368, 64]
    - [296, 0.0]
  - - [4096, 3226, 1, 1024]
    - [294, 0.0]
  - - [4096, 3439, 1, 1024]
    - [293, 0.0]
  - - [1024, 3523, 1, 4096]
    - [290, 0.0]
  - - [1024, 3098, 1, 4096]
    - [297, 0.0]
  - - [4096, 3121, 1, 1024]
    - [294, 0.0]
  - - [33708, 3894, 1, 1024]
    - [286, 0.0]
  - - [1024, 3548, 1, 4096]
    - [298, 0.0]
  - - [1024, 3451, 1, 4096]
    - [281, 0.0]
  - - [4096, 3353, 1, 1024]
    - [287, 0.0]
  - - [4096, 3402, 1, 1024]
    - [287, 0.0]
  - - [4096, 3939, 1, 1024]
    - [294, 0.0]
  - - [133, 133, 480, 64]
    - [284, 0.0]
  - - [1024, 3559, 1, 4096]
    - [282, 0.0]
  - - [1024, 2977, 1, 4096]
    - [288, 0.0]
  - - [1024, 3478, 1, 4096]
    - [299, 0.0]
  - - [134, 134, 480, 64]
    - [300, 0.0]
  - - [1024, 3368, 1, 4096]
    - [282, 0.0]
  - - [4096, 4012, 1, 1024]
    - [287, 0.0]
  - - [4096, 3486, 1, 1024]
    - [294, 0.0]
  - - [1024, 3479, 1, 4096]
    - [301, 0.0]
  - - [1024, 3505, 1, 4096]
    - [282, 0.0]
  - - [4096, 3381, 1, 1024]
    - [293, 0.0]
  - - [4096, 3430, 1, 1024]
    - [294, 0.0]
  - - [1024, 3554, 1, 4096]
    - [282, 0.0]
  - - [4096, 3271, 1, 1024]
    - [294, 0.0]
  - - [1024, 3063, 1, 4096]
    - [302, 0.0]
  - - [1024, 3209, 1, 4096]
    - [282, 0.0]
  - - [4096, 3503, 1, 1024]
    - [287, 0.0]
  - - [4096, 3344, 1, 1024]
    - [294, 0.0]
  - - [1024, 3147, 1, 4096]
    - [290, 0.0]
  - - [1024, 3322, 1, 4096]
    - [295, 0.0]
  - - [1024, 3341, 1, 4096]
    - [282, 0.0]
  - - [1024, 3516, 1, 4096]
    - [302, 0.0]
  - - [102, 101, 624, 64]
    - [285, 0.0]
  - - [1024, 3454, 1, 4096]
    - [295, 0.0]
  - - [4096, 3969, 1, 1024]
    - [287, 0.0]
  - - [4096, 3466, 1, 1024]
    - [287, 0.0]
  - - [1024, 3999, 1, 1024]
    - [288, 0.0]
  - - [1024, 4032, 1, 1024]
    - [303, 0.0]
  - - [1024, 3403, 1, 4096]
    - [281, 0.0]
  - - [4096, 3361, 1, 1024]
    - [287, 0.0]
  - - [1024, 3527, 1, 4096]
    - [295, 0.0]
  - - [1024, 3822, 1, 4096]
    - [288, 0.0]
  - - [4096, 3315, 1, 1024]
    - [294, 0.0]
  - - [232, 232, 272, 64]
    - [291, 0.0]
  - - [1024, 3336, 1, 4096]
    - [290, 0.0]
  - - [228, 232, 272, 64]
    - [285, 0.0]
  - - [4096, 3547, 1, 1024]
    - [294, 0.0]
  - - [4096, 3340, 1, 1024]
    - [287, 0.0]
  - - [1024, 3906, 1, 1024]
    - [303, 0.0]
  - - [1024, 3295, 1, 4096]
    - [281, 0.0]
  - - [4096, 3294, 1, 1024]
    - [293, 0.0]
  - - [33708, 3968, 1, 1024]
    - [293, 0.0]
  - - [1024, 3473, 1, 4096]
    - [283, 0.0]
  - - [1024, 3072, 1, 4096]
    - [303, 0.0]
  - - [4096, 3189, 1, 1024]
    - [294, 0.0]
  - - [4096, 3494, 1, 1024]
    - [294, 0.0]
  - - [1024, 3522, 1, 4096]
    - [290, 0.0]
  - - [33708, 3944, 1, 1024]
    - [293, 0.0]
  - - [135, 135, 480, 64]
    - [304, 0.0]
  - - [4096, 3421, 1, 1024]
    - [294, 0.0]
  - - [32, 32, 1984, 64]
    - [305, 0.0]
  - - [4096, 3311, 1, 1024]
    - [294, 0.0]
  - - [1024, 3990, 1, 1024]
    - [298, 0.0]
  - - [1024, 3290, 1, 4096]
    - [281, 0.0]
  - - [4096, 3565, 1, 1024]
    - [286, 0.0]
  - - [1024, 3484, 1, 4096]
    - [301, 0.0]
  - - [4096, 3384, 1, 1024]
    - [294, 0.0]
  - - [1024, 3422, 1, 4096]
    - [281, 0.0]
  - - [4096, 3681, 1, 1024]
    - [286, 0.0]
  - - [1024, 3584, 1, 1024]
    - [306, 0.0]
  - - [4096, 4050, 1, 1024]
    - [287, 0.0]
  - - [1024, 3996, 1, 4096]
    - [293, 0.0]
  - - [4096, 3169, 1, 1024]
    - [286, 0.0]
  - - [4096, 3538, 1, 1024]
    - [286, 0.0]
  - - [1024, 3495, 1, 4096]
    - [298, 0.0]
  - - [4096, 3401, 1, 1024]
    - [294, 0.0]
  - - [1024, 3560, 1, 4096]
    - [295, 0.0]
  - - [133, 135, 480, 64]
    - [304, 0.0]
  - - [1024, 3263, 1, 4096]
    - [282, 0.0]
  - - [1024, 3870, 1, 4096]
    - [287, 0.0]
  - - [4096, 3555, 1, 1024]
    - [293, 0.0]
  - - [4096, 3412, 1, 1024]
    - [294, 0.0]
  - - [101, 101, 624, 64]
    - [291, 0.0]
  - - [1024, 3296, 1, 4096]
    - [295, 0.0]
  - - [1024, 3379, 1, 4096]
    - [290, 0.0]
  - - [4096, 3302, 1, 1024]
    - [294, 0.0]
  - - [1024, 3490, 1, 4096]
    - [281, 0.0]
  - - [1024, 3428, 1, 4096]
    - [295, 0.0]
  - - [1024, 3976, 1, 4096]
    - [287, 0.0]
  - - [4096, 3485, 1, 1024]
    - [294, 0.0]
  - - [4096, 3534, 1, 1024]
    - [294, 0.0]
  - - [1024, 3064, 1, 4096]
    - [303, 0.0]
  - - [4096, 3216, 1, 1024]
    - [287, 0.0]
  - - [1024, 3450, 1, 4096]
    - [307, 0.0]
  - - [1024, 3533, 1, 4096]
    - [295, 0.0]
  - - [1024, 4030, 1, 1024]
    - [303, 0.0]
  - - [1024, 3311, 1, 4096]
    - [295, 0.0]
  - - [1024, 3468, 1, 4096]
    - [308, 0.0]
  - - [23, 23, 2720, 64]
    - [309, 0.0]
  - - [4096, 3359, 1, 1024]
    - [287, 0.0]
  - - [4096, 3392, 1, 1024]
    - [287, 0.0]
  - - [1024, 3925, 1, 1024]
    - [302, 0.0]
  - - [4096, 3233, 1, 1024]
    - [294, 0.0]
  - - [4096, 3956, 1, 1024]
    - [286, 0.0]
  - - [1024, 3463, 1, 4096]
    - [282, 0.0]
  - - [1024, 3126, 1, 4096]
    - [295, 0.0]
  - - [1024, 3363, 1, 4096]
    - [310, 0.0]
  - - [4096, 3465, 1, 1024]
    - [294, 0.0]
  - - [33708, 3996, 1, 1024]
    - [286, 0.0]
  - - [1024, 3231, 1, 4096]
    - [282, 0.0]
  - - [33708, 3978, 1, 1024]
    - [286, 0.0]
  - - [4096, 3476, 1, 1024]
    - [294, 0.0]
  - - [85, 85, 752, 64]
    - [296, 0.0]
  - - [4096, 3339, 1, 1024]
    - [287, 0.0]
  - - [4096, 3452, 1, 1024]
    - [294, 0.0]
  - - [1024, 3396, 1, 4096]
    - [295, 0.0]
  - - [4096, 3293, 1, 1024]
    - [287, 0.0]
  - - [54, 54, 1184, 64]
    - [291, 0.0]
  - - [1024, 3432, 1, 4096]
    - [311, 0.0]
  - - [4096, 3493, 1, 1024]
    - [293, 0.0]
  - - [4096, 3350, 1, 1024]
    - [287, 0.0]
  - - [1024, 3079, 1, 4096]
    - [307, 0.0]
  - - [1024, 3101, 1, 4096]
    - [307, 0.0]
  - - [33708, 3939, 1, 1024]
    - [293, 0.0]
  - - [4096, 3256, 1, 1024]
    - [287, 0.0]
  - - [1024, 3439, 1, 4096]
    - [295, 0.0]
  - - [1024, 3510, 1, 4096]
    - [281, 0.0]
  - - [4096, 3900, 1, 1024]
    - [286, 0.0]
  - - [1024, 3470, 1, 4096]
    - [282, 0.0]
  - - [4096, 3456, 1, 1024]
    - [287, 0.0]
  - - [4096, 3014, 1, 1024]
    - [286, 0.0]
  - - [4096, 3367, 1, 1024]
    - [293, 0.0]
  - - [4096, 3432, 1, 1024]
    - [294, 0.0]
  - - [33708, 4026, 1, 1024]
    - [293, 0.0]
  - - [4096, 3273, 1, 1024]
    - [294, 0.0]
  - - [4096, 3130, 1, 1024]
    - [294, 0.0]
  - - [1024, 3496, 1, 4096]
    - [312, 0.0]
  - - [1024, 3995, 1, 4096]
    - [313, 0.0]
  - - [1024, 3939, 1, 4096]
    - [302, 0.0]
  - - [1024, 3121, 1, 4096]
    - [314, 0.0]
  - - [1024, 3232, 1, 4096]
    - [282, 0.0]
  - - [4096, 3147, 1, 1024]
    - [287, 0.0]
  - - [4096, 3516, 1, 1024]
    - [294, 0.0]
  - - [1024, 3969, 1, 1024]
    - [303, 0.0]
  - - [1024, 3364, 1, 4096]
    - [301, 0.0]
  - - [4096, 3411, 1, 1024]
    - [293, 0.0]
  - - [147, 147, 432, 64]
    - [284, 0.0]
  - - [4096, 3301, 1, 1024]
    - [287, 0.0]
  - - [112, 111, 576, 64]
    - [291, 0.0]
  - - [1024, 3513, 1, 4096]
    - [295, 0.0]
  - - [1024, 3469, 1, 4096]
    - [286, 0.0]
  - - [1024, 3095, 1, 4096]
    - [282, 0.0]
  - - [4096, 3533, 1, 1024]
    - [286, 0.0]
  - - [4096, 3390, 1, 1024]
    - [294, 0.0]
  - - [4096, 3582, 1, 1024]
    - [294, 0.0]
  - - [1024, 3956, 1, 1024]
    - [303, 0.0]
  - - [4096, 3585, 1, 1024]
    - [287, 0.0]
  - - [4096, 3231, 1, 1024]
    - [286, 0.0]
  - - [1024, 3205, 1, 4096]
    - [281, 0.0]
  - - [4096, 3496, 1, 1024]
    - [286, 0.0]
  - - [1024, 3143, 1, 4096]
    - [281, 0.0]
  - - [1024, 3318, 1, 4096]
    - [292, 0.0]
  - - [1024, 3353, 1, 4096]
    - [295, 0.0]
  - - [1024, 3464, 1, 4096]
    - [281, 0.0]
  - - [4096, 2736, 1, 1024]
    - [287, 0.0]
  - - [1024, 3402, 1, 4096]
    - [292, 0.0]
  - - [4096, 3138, 1, 1024]
    - [287, 0.0]
  - - [1024, 3860, 1, 4096]
    - [288, 0.0]
  - - [148, 148, 432, 64]
    - [284, 0.0]
  - - [1024, 3539, 1, 4096]
    - [292, 0.0]
  - - [4096, 3211, 1, 1024]
    - [287, 0.0]
  - - [1024, 3332, 1, 4096]
    - [301, 0.0]
  - - [1024, 3466, 1, 4096]
    - [295, 0.0]
  - - [4096, 3475, 1, 1024]
    - [294, 0.0]
  - - [4096, 3524, 1, 1024]
    - [293, 0.0]
  - - [4096, 2985, 1, 1024]
    - [293, 0.0]
  - - [4096, 3222, 1, 1024]
    - [294, 0.0]
  - - [4096, 3451, 1, 1024]
    - [287, 0.0]
  - - [1024, 3181, 1, 4096]
    - [281, 0.0]
  - - [1024, 3640, 1, 4096]
    - [288, 0.0]
  - - [1024, 3375, 1, 4096]
    - [283, 0.0]
  - - [1024, 3550, 1, 4096]
    - [282, 0.0]
  - - [1024, 4020, 1, 1024]
    - [303, 0.0]
  - - [4096, 3349, 1, 1024]
    - [294, 0.0]
  - - [4096, 3398, 1, 1024]
    - [286, 0.0]
  - - [33708, 3976, 1, 1024]
    - [287, 0.0]
  - - [1024, 2917, 1, 4096]
    - [298, 0.0]
  - - [33708, 3910, 1, 1024]
    - [294, 0.0]
  - - [4096, 3860, 1, 1024]
    - [286, 0.0]
  - - [4096, 3304, 1, 1024]
    - [293, 0.0]
  - - [1024, 3286, 1, 4096]
    - [315, 0.0]
  - - [1024, 3460, 1, 4096]
    - [316, 0.0]
  - - [1024, 4026, 1, 4096]
    - [302, 0.0]
  - - [4096, 3471, 1, 1024]
    - [287, 0.0]
  - - [193, 193, 320, 64]
    - [317, 0.0]
  - - [1024, 3894, 1, 1024]
    - [302, 0.0]
  - - [65, 65, 992, 64]
    - [318, 0.0]
  - - [1024, 3506, 1, 4096]
    - [316, 0.0]
  - - [35, 35, 1808, 64]
    - [319, 0.0]
  - - [1024, 4000, 1, 1024]
    - [302, 0.0]
  - - [1024, 3900, 1, 4096]
    - [294, 0.0]
  - - [1024, 3445, 1, 4096]
    - [290, 0.0]
  - - [4096, 3442, 1, 1024]
    - [286, 0.0]
  - - [1024, 3358, 1, 4096]
    - [282, 0.0]
  - - [13, 13, 4672, 64]
    - [320, 0.0]
  - - [1024, 3211, 1, 4096]
    - [321, 0.0]
  - - [4096, 3515, 1, 1024]
    - [287, 0.0]
  - - [1024, 3564, 1, 4096]
    - [315, 0.0]
  - - [4096, 3057, 1, 1024]
    - [287, 0.0]
  - - [1024, 3343, 1, 4096]
    - [281, 0.0]
  - - [4096, 3262, 1, 1024]
    - [286, 0.0]
  - - [1024, 3518, 1, 4096]
    - [281, 0.0]
  - - [77, 77, 816, 64]
    - [322, 0.0]
  - - [33708, 3876, 1, 1024]
    - [286, 0.0]
  - - [4096, 3462, 1, 1024]
    - [287, 0.0]
  - - [1024, 3265, 1, 4096]
    - [281, 0.0]
  - - [4096, 3389, 1, 1024]
    - [286, 0.0]
  - - [4096, 3438, 1, 1024]
    - [287, 0.0]
  - - [1024, 3955, 1, 1024]
    - [302, 0.0]
  - - [1024, 3545, 1, 4096]
    - [290, 0.0]
  - - [1024, 3144, 1, 4096]
    - [290, 0.0]
  - - [1024, 3417, 1, 4096]
    - [295, 0.0]
  - - [4096, 3543, 1, 1024]
    - [294, 0.0]
  - - [4096, 3352, 1, 1024]
    - [287, 0.0]
  - - [33708, 3975, 1, 1024]
    - [293, 0.0]
  - - [148, 147, 432, 64]
    - [284, 0.0]
  - - [4096, 3137, 1, 1024]
    - [294, 0.0]
  - - [4096, 3506, 1, 1024]
    - [293, 0.0]
  - - [1024, 3975, 1, 1024]
    - [303, 0.0]
  - - [1024, 3859, 1, 4096]
    - [302, 0.0]
  - - [4096, 3369, 1, 1024]
    - [287, 0.0]
  - - [1024, 3434, 1, 4096]
    - [281, 0.0]
  - - [1024, 3292, 1, 4096]
    - [281, 0.0]
  - - [4096, 3523, 1, 1024]
    - [294, 0.0]
  - - [4096, 3380, 1, 1024]
    - [287, 0.0]
  - - [1024, 3408, 1, 4096]
    - [290, 0.0]
  - - [4096, 3221, 1, 1024]
    - [287, 0.0]
  - - [4096, 3270, 1, 1024]
    - [287, 0.0]
  - - [143, 143, 432, 64]
    - [304, 0.0]
  - - [111, 111, 576, 64]
    - [319, 0.0]
  - - [1024, 3303, 1, 4096]
    - [282, 0.0]
  - - [4096, 3502, 1, 1024]
    - [287, 0.0]
  - - [1024, 3222, 1, 4096]
    - [282, 0.0]
  - - [4096, 2505, 1, 1024]
    - [294, 0.0]
  - - [4096, 3397, 1, 1024]
    - [294, 0.0]
  - - [4096, 3562, 1, 1024]
    - [294, 0.0]
  - - [4096, 3095, 1, 1024]
    - [287, 0.0]
  - - [1024, 3226, 1, 4096]
    - [316, 0.0]
  - - [177, 177, 352, 64]
    - [285, 0.0]
  - - [4096, 3360, 1, 1024]
    - [286, 0.0]
  - - [1024, 3942, 1, 1024]
    - [303, 0.0]
  - - [1024, 3298, 1, 4096]
    - [290, 0.0]
  - - [1024, 3381, 1, 4096]
    - [282, 0.0]
  - - [4096, 3314, 1, 1024]
    - [287, 0.0]
  - - [1024, 3492, 1, 4096]
    - [301, 0.0]
  - - [1024, 3430, 1, 4096]
    - [301, 0.0]
  - - [4096, 3977, 1, 1024]
    - [287, 0.0]
  - - [4096, 3546, 1, 1024]
    - [294, 0.0]
  - - [4096, 3640, 1, 1024]
    - [294, 0.0]
  - - [4096, 3441, 1, 1024]
    - [286, 0.0]
  - - [33708, 4059, 1, 1024]
    - [293, 0.0]
  - - [1024, 3978, 1, 1024]
    - [302, 0.0]
  - - [1024, 3376, 1, 4096]
    - [282, 0.0]
  - - [1024, 3482, 1, 4096]
    - [290, 0.0]
  - - [1024, 3563, 1, 4096]
    - [303, 0.0]
  - - [4096, 4020, 1, 1024]
    - [293, 0.0]
  - - [1024, 3271, 1, 4096]
    - [295, 0.0]
  - - [1024, 3291, 1, 4096]
    - [295, 0.0]
  - - [1024, 3431, 1, 4096]
    - [299, 0.0]
  - - [1024, 3481, 1, 4096]
    - [282, 0.0]
  - - [84, 85, 752, 64]
    - [323, 0.0]
  - - [4096, 3461, 1, 1024]
    - [294, 0.0]
  - - [1024, 3574, 1, 4096]
    - [290, 0.0]
  - - [1024, 4059, 1, 1024]
    - [302, 0.0]
  - - [84, 84, 752, 64]
    - [289, 0.0]
  - - [1024, 3421, 1, 4096]
    - [290, 0.0]
  - - [4096, 3224, 1, 1024]
    - [287, 0.0]
  - - [4096, 3437, 1, 1024]
    - [287, 0.0]
  - - [45, 45, 1424, 64]
    - [291, 0.0]
  - - [4096, 3168, 1, 1024]
    - [287, 0.0]
  - - [33708, 3990, 1, 1024]
    - [294, 0.0]
  - - [1024, 3349, 1, 4096]
    - [282, 0.0]
  - - [4096, 3335, 1, 1024]
    - [294, 0.0]
  - - [4096, 3400, 1, 1024]
    - [287, 0.0]
  - - [160, 159, 400, 64]
    - [300, 0.0]
  - - [1024, 3398, 1, 4096]
    - [282, 0.0]
  - - [1024, 3780, 1, 4096]
    - [287, 0.0]
  - - [29, 29, 2176, 64]
    - [305, 0.0]
  - - [4096, 3098, 1, 1024]
    - [294, 0.0]
  - - [1024, 4012, 1, 4096]
    - [303, 0.0]
  - - [4096, 3505, 1, 1024]
    - [287, 0.0]
  - - [4096, 3554, 1, 1024]
    - [287, 0.0]
  - - [4096, 3063, 1, 1024]
    - [287, 0.0]
  - - [1024, 3503, 1, 4096]
    - [281, 0.0]
  - - [1024, 3166, 1, 4096]
    - [290, 0.0]
  - - [1024, 3425, 1, 4096]
    - [290, 0.0]
  - - [1024, 3344, 1, 4096]
    - [310, 0.0]
  - - [4096, 3484, 1, 1024]
    - [287, 0.0]
  - - [1024, 3681, 1, 1024]
    - [288, 0.0]
  - - [1024, 4050, 1, 1024]
    - [303, 0.0]
  - - [4096, 3379, 1, 1024]
    - [294, 0.0]
  - - [4096, 3428, 1, 1024]
    - [286, 0.0]
  - - [12, 12, 5040, 64]
    - [322, 0.0]
  - - [27, 27, 2336, 64]
    - [305, 0.0]
  - - [1024, 3304, 1, 4096]
    - [290, 0.0]
  - - [1024, 3387, 1, 4096]
    - [295, 0.0]
  - - [4096, 3126, 1, 1024]
    - [293, 0.0]
  - - [1024, 3498, 1, 4096]
    - [281, 0.0]
  - - [1024, 3436, 1, 4096]
    - [282, 0.0]
  - - [4096, 3501, 1, 1024]
    - [294, 0.0]
  - - [4096, 3358, 1, 1024]
    - [287, 0.0]
  - - [4096, 3232, 1, 1024]
    - [294, 0.0]
  - - [1024, 3585, 1, 4096]
    - [302, 0.0]
  - - [4096, 3143, 1, 1024]
    - [293, 0.0]
  - - [4096, 3464, 1, 1024]
    - [287, 0.0]
  - - [1024, 3366, 1, 4096]
    - [301, 0.0]
  - - [4096, 3375, 1, 1024]
    - [294, 0.0]
  - - [4096, 2917, 1, 1024]
    - [294, 0.0]
  - - [4096, 4026, 1, 1024]
    - [287, 0.0]
  - - [49, 49, 1296, 64]
    - [324, 0.0]
  - - [1024, 3277, 1, 4096]
    - [295, 0.0]
  - - [1024, 3103, 1, 4096]
    - [282, 0.0]
  - - [33708, 3995, 1, 1024]
    - [287, 0.0]
  - - [1024, 3297, 1, 4096]
    - [295, 0.0]
  - - [4096, 3545, 1, 1024]
    - [287, 0.0]
  - - [1024, 3399, 1, 4096]
    - [295, 0.0]
  - - [33708, 3796, 1, 1024]
    - [286, 0.0]
  - - [4096, 3292, 1, 1024]
    - [287, 0.0]
  - - [71, 71, 896, 64]
    - [309, 0.0]
  - - [33708, 3859, 1, 1024]
    - [293, 0.0]
  - - [4096, 3566, 1, 1024]
    - [287, 0.0]
  - - [4096, 3894, 1, 1024]
    - [294, 0.0]
  - - [4096, 3492, 1, 1024]
    - [294, 0.0]
  - - [1024, 3977, 1, 1024]
    - [303, 0.0]
  - - [1024, 3272, 1, 4096]
    - [290, 0.0]
  - - [135, 134, 480, 64]
    - [284, 0.0]
  - - [1024, 3355, 1, 4096]
    - [295, 0.0]
  - - [4096, 3419, 1, 1024]
    - [293, 0.0]
  - - [1024, 3404, 1, 4096]
    - [282, 0.0]
  - - [4096, 3999, 1, 1024]
    - [287, 0.0]
  - - [4096, 3166, 1, 1024]
    - [294, 0.0]
  - - [33708, 3840, 1, 1024]
    - [293, 0.0]
  - - [4096, 4032, 1, 1024]
    - [293, 0.0]
  - - [1024, 3573, 1, 4096]
    - [295, 0.0]
  - - [4096, 3366, 1, 1024]
    - [293, 0.0]
  - - [1024, 3541, 1, 4096]
    - [290, 0.0]
  - - [4096, 3207, 1, 1024]
    - [294, 0.0]
  - - [4096, 3272, 1, 1024]
    - [287, 0.0]
  - - [1024, 3334, 1, 4096]
    - [281, 0.0]
  - - [228, 228, 272, 64]
    - [285, 0.0]
  - - [4096, 3183, 1, 1024]
    - [287, 0.0]
  - - [4096, 3536, 1, 1024]
    - [286, 0.0]
  - - [1024, 4005, 1, 1024]
    - [288, 0.0]
  - - [1024, 3245, 1, 4096]
    - [282, 0.0]
  - - [4096, 3447, 1, 1024]
    - [286, 0.0]
  - - [1024, 3183, 1, 4096]
    - [295, 0.0]
  - - [1024, 3361, 1, 4096]
    - [290, 0.0]
  - - [33708, 3870, 1, 1024]
    - [286, 0.0]
  - - [1024, 3321, 1, 4096]
    - [282, 0.0]
  - - [1024, 3486, 1, 4096]
    - [316, 0.0]
  - - [4096, 4005, 1, 1024]
    - [287, 0.0]
  - - [4096, 3410, 1, 1024]
    - [293, 0.0]
  - - [1024, 3944, 1, 1024]
    - [303, 0.0]
  - - [4096, 3300, 1, 1024]
    - [286, 0.0]
  - - [4096, 3579, 1, 1024]
    - [293, 0.0]
  - - [4096, 3483, 1, 1024]
    - [293, 0.0]
  - - [4096, 3532, 1, 1024]
    - [287, 0.0]
  - - [1024, 3140, 1, 4096]
    - [282, 0.0]
  - - [1024, 3372, 1, 4096]
    - [281, 0.0]
  - - [1024, 3224, 1, 4096]
    - [290, 0.0]
  - - [4096, 3230, 1, 1024]
    - [287, 0.0]
  - - [4096, 3427, 1, 1024]
    - [287, 0.0]
  - - [1024, 3796, 1, 1024]
    - [303, 0.0]
  - - [143, 148, 432, 64]
    - [284, 0.0]
  - - [1024, 3616, 1, 4096]
    - [288, 0.0]
  - - [1024, 3315, 1, 4096]
    - [282, 0.0]
  - - [1024, 3476, 1, 4096]
    - [281, 0.0]
  - - [1024, 3509, 1, 4096]
    - [281, 0.0]
  - - [4096, 3357, 1, 1024]
    - [287, 0.0]
  - - [4096, 3406, 1, 1024]
    - [287, 0.0]
  - - [1024, 3558, 1, 4096]
    - [295, 0.0]
  - - [4096, 3593, 1, 1024]
    - [287, 0.0]
  - - [4096, 3247, 1, 1024]
    - [287, 0.0]
  - - [4096, 3088, 1, 1024]
    - [287, 0.0]
  - - [1024, 3213, 1, 4096]
    - [281, 0.0]
  - - [4096, 3511, 1, 1024]
    - [294, 0.0]
  - - [122, 122, 528, 64]
    - [324, 0.0]
  - - [1024, 3365, 1, 4096]
    - [292, 0.0]
  - - [1024, 3504, 1, 4096]
    - [325, 0.0]
  - - [1024, 3442, 1, 4096]
    - [282, 0.0]
  - - [4096, 3474, 1, 1024]
    - [294, 0.0]
  - - [4096, 2984, 1, 1024]
    - [286, 0.0]
  - - [1024, 3876, 1, 4096]
    - [302, 0.0]
  - - [4096, 3337, 1, 1024]
    - [287, 0.0]
  - - [4096, 3450, 1, 1024]
    - [287, 0.0]
  - - [1024, 3547, 1, 4096]
    - [282, 0.0]
  - - [4096, 3291, 1, 1024]
    - [286, 0.0]
  - - [1024, 3340, 1, 4096]
    - [295, 0.0]
  - - [4096, 3491, 1, 1024]
    - [287, 0.0]
  - - [4096, 3348, 1, 1024]
    - [287, 0.0]
  - - [78, 78, 816, 64]
    - [326, 0.0]
  - - [4096, 3906, 1, 1024]
    - [293, 0.0]
  - - [1024, 3477, 1, 4096]
    - [301, 0.0]
  - - [1024, 3397, 1, 4096]
    - [281, 0.0]
  - - [4096, 3165, 1, 1024]
    - [286, 0.0]
  - - [4096, 3470, 1, 1024]
    - [294, 0.0]
  - - [1024, 3526, 1, 4096]
    - [281, 0.0]
  - - [112, 112, 576, 64]
    - [285, 0.0]
  - - [4096, 3365, 1, 1024]
    - [294, 0.0]
  - - [4096, 3319, 1, 1024]
    - [294, 0.0]
  - - [1024, 3401, 1, 4096]
    - [282, 0.0]
  - - [1024, 3294, 1, 4096]
    - [295, 0.0]
  - - [159, 159, 400, 64]
    - [323, 0.0]
  - - [1024, 3472, 1, 4096]
    - [311, 0.0]
  - - [4096, 3328, 1, 1024]
    - [286, 0.0]
  - - [1024, 3861, 1, 1024]
    - [303, 0.0]
  - - [1024, 3910, 1, 1024]
    - [302, 0.0]
  - - [1024, 3410, 1, 4096]
    - [282, 0.0]
  - - [1024, 3395, 1, 4096]
    - [281, 0.0]
  - - [4096, 3282, 1, 1024]
    - [294, 0.0]
  - - [1024, 3751, 1, 1024]
    - [298, 0.0]
  - - [4096, 3145, 1, 1024]
    - [287, 0.0]
  - - [4096, 3514, 1, 1024]
    - [287, 0.0]
  - - [4096, 3944, 1, 1024]
    - [287, 0.0]
  - - [1024, 3515, 1, 4096]
    - [295, 0.0]
  - - [4096, 3409, 1, 1024]
    - [286, 0.0]
  - - [4096, 3564, 1, 1024]
    - [294, 0.0]
  - - [4096, 3299, 1, 1024]
    - [287, 0.0]
  - - [1024, 3057, 1, 4096]
    - [327, 0.0]
  - - [4096, 3531, 1, 1024]
    - [294, 0.0]
  - - [4096, 3388, 1, 1024]
    - [287, 0.0]
  - - [1024, 3189, 1, 4096]
    - [282, 0.0]
  - - [1024, 3300, 1, 4096]
    - [282, 0.0]
  - - [1024, 3720, 1, 4096]
    - [286, 0.0]
  - - [1024, 3383, 1, 4096]
    - [311, 0.0]
  - - [1024, 3494, 1, 4096]
    - [282, 0.0]
  - - [77, 78, 816, 64]
    - [328, 0.0]
  - - [1024, 3448, 1, 4096]
    - [281, 0.0]
  - - [4096, 3542, 1, 1024]
    - [294, 0.0]
  - - [1024, 3488, 1, 4096]
    - [281, 0.0]
  - - [4096, 3405, 1, 1024]
    - [287, 0.0]
  - - [1024, 3262, 1, 4096]
    - [282, 0.0]
  - - [33708, 4005, 1, 1024]
    - [293, 0.0]
  - - [1024, 3594, 1, 4096]
    - [298, 0.0]
  - - [4096, 3103, 1, 1024]
    - [293, 0.0]
  - - [4096, 3136, 1, 1024]
    - [287, 0.0]
  - - [1024, 3378, 1, 4096]
    - [290, 0.0]
  - - [10, 10, 5952, 64]
    - [329, 0.0]
  - - [7, 7, 8192, 64]
    - [329, 0.0]
  - - [4096, 3559, 1, 1024]
    - [287, 0.0]
  - - [4096, 3368, 1, 1024]
    - [293, 0.0]
  - - [4096, 3209, 1, 1024]
    - [294, 0.0]
  - - [4096, 3322, 1, 1024]
    - [287, 0.0]
  - - [1024, 3483, 1, 4096]
    - [315, 0.0]
  - - [4096, 3473, 1, 1024]
    - [286, 0.0]
  - - [4096, 3522, 1, 1024]
    - [293, 0.0]
  - - [1024, 3532, 1, 4096]
    - [295, 0.0]
  - - [4096, 3449, 1, 1024]
    - [287, 0.0]
  - - [1024, 3351, 1, 4096]
    - [290, 0.0]
  - - [1024, 3462, 1, 4096]
    - [281, 0.0]
  - - [4096, 3396, 1, 1024]
    - [287, 0.0]
  - - [132, 132, 480, 64]
    - [304, 0.0]
  - - [111, 112, 576, 64]
    - [291, 0.0]
  - - [1024, 3416, 1, 4096]
    - [295, 0.0]
  - - [4096, 3469, 1, 1024]
    - [293, 0.0]
  - - [1024, 3582, 1, 4096]
    - [302, 0.0]
  - - [1024, 3230, 1, 4096]
    - [295, 0.0]
  - - [1024, 3489, 1, 4096]
    - [282, 0.0]
  - - [1024, 3427, 1, 4096]
    - [282, 0.0]
  - - [1024, 3346, 1, 4096]
    - [295, 0.0]
  - - [33708, 3977, 1, 1024]
    - [293, 0.0]
  - - [4096, 3796, 1, 1024]
    - [287, 0.0]
  - - [4096, 3176, 1, 1024]
    - [287, 0.0]
  - - [4096, 3990, 1, 1024]
    - [294, 0.0]
  - - [1024, 3257, 1, 4096]
    - [290, 0.0]
  - - [4096, 3343, 1, 1024]
    - [330, 0.0]
  - - [4096, 3440, 1, 1024]
    - [294, 0.0]
  - - [33708, 4030, 1, 1024]
    - [286, 0.0]
  - - [1024, 3190, 1, 4096]
    - [282, 0.0]
  - - [1024, 3389, 1, 4096]
    - [290, 0.0]
  - - [1024, 3500, 1, 4096]
    - [295, 0.0]
  - - [1024, 3471, 1, 4096]
    - [301, 0.0]
  - - [1024, 3438, 1, 4096]
    - [290, 0.0]
  - - [4096, 3513, 1, 1024]
    - [294, 0.0]
  - - [1024, 3562, 1, 4096]
    - [311, 0.0]
  - - [4096, 3616, 1, 1024]
    - [287, 0.0]
  - - [4096, 3955, 1, 1024]
    - [286, 0.0]
  - - [1024, 3441, 1, 4096]
    - [312, 0.0]
  - - [1024, 3236, 1, 4096]
    - [331, 0.0]
  - - [1024, 3524, 1, 4096]
    - [281, 0.0]
  - - [4096, 3460, 1, 1024]
    - [294, 0.0]
  - - [16, 16, 3840, 64]
    - [296, 0.0]
  - - [92, 93, 688, 64]
    - [309, 0.0]
  - - [1024, 3384, 1, 4096]
    - [312, 0.0]
  - - [4096, 3387, 1, 1024]
    - [287, 0.0]
  - - [4096, 3436, 1, 1024]
    - [294, 0.0]
  - - [4096, 3277, 1, 1024]
    - [294, 0.0]
  - - [1024, 3457, 1, 4096]
    - [281, 0.0]
  - - [1024, 3999, 1, 4096]
    - [332, 0.0]
  - - [1024, 4032, 1, 4096]
    - [302, 0.0]
  - - [4096, 3541, 1, 1024]
    - [294, 0.0]
  - - [4096, 3334, 1, 1024]
    - [294, 0.0]
  - - [1024, 3393, 1, 4096]
    - [282, 0.0]
  - - [17, 17, 3632, 64]
    - [289, 0.0]
  - - [1024, 3411, 1, 4096]
    - [301, 0.0]
  - - [1024, 3822, 1, 1024]
    - [298, 0.0]
  - - [1024, 3593, 1, 4096]
    - [298, 0.0]
  - - [33708, 3822, 1, 1024]
    - [286, 0.0]
  - - [4096, 3504, 1, 1024]
    - [293, 0.0]
  - - [1024, 3163, 1, 4096]
    - [282, 0.0]
  - - [1024, 3357, 1, 4096]
    - [290, 0.0]
  - - [1024, 3906, 1, 4096]
    - [302, 0.0]
  - - [4096, 3415, 1, 1024]
    - [294, 0.0]
  - - [1024, 3406, 1, 4096]
    - [290, 0.0]
  - - [4096, 3321, 1, 1024]
    - [287, 0.0]
  - - [4096, 3584, 1, 1024]
    - [293, 0.0]
  - - [1024, 2736, 1, 4096]
    - [303, 0.0]
  - - [1024, 3110, 1, 4096]
    - [290, 0.0]
  - - [33708, 3999, 1, 1024]
    - [293, 0.0]
  - - [1024, 3093, 1, 4096]
    - [295, 0.0]
  - - [4096, 3378, 1, 1024]
    - [293, 0.0]
  - - [1024, 3543, 1, 4096]
    - [292, 0.0]
  - - [33708, 3925, 1, 1024]
    - [287, 0.0]
  - - [1024, 3352, 1, 4096]
    - [290, 0.0]
  - - [4096, 3780, 1, 1024]
    - [294, 0.0]
  - - [1024, 3990, 1, 4096]
    - [333, 0.0]
  - - [4096, 3500, 1, 1024]
    - [294, 0.0]
  - - [4096, 3996, 1, 1024]
    - [286, 0.0]
  - - [1024, 3247, 1, 4096]
    - [321, 0.0]
  - - [4096, 3395, 1, 1024]
    - [287, 0.0]
  - - [1024, 3169, 1, 4096]
    - [295, 0.0]
  - - [1024, 3088, 1, 4096]
    - [295, 0.0]
  - - [1024, 3584, 1, 4096]
    - [290, 0.0]
  - - [4096, 3093, 1, 1024]
    - [287, 0.0]
  - - [1024, 3538, 1, 4096]
    - [302, 0.0]
  - - [1024, 3996, 1, 1024]
    - [288, 0.0]
  - - [1024, 3581, 1, 4096]
    - [292, 0.0]
  - - [4096, 3374, 1, 1024]
    - [287, 0.0]
  - - [33708, 3751, 1, 1024]
    - [287, 0.0]
  - - [59, 59, 1088, 64]
    - [319, 0.0]
  - - [4096, 3215, 1, 1024]
    - [287, 0.0]
  - - [4096, 3312, 1, 1024]
    - [294, 0.0]
  - - [4096, 3581, 1, 1024]
    - [287, 0.0]
  - - [4096, 3479, 1, 1024]
    - [287, 0.0]
  - - [4096, 3544, 1, 1024]
    - [294, 0.0]
  - - [1024, 3870, 1, 1024]
    - [288, 0.0]
  - - [1024, 3374, 1, 4096]
    - [282, 0.0]
  - - [1024, 2967, 1, 4096]
    - [288, 0.0]
  - - [41, 41, 1552, 64]
    - [291, 0.0]
  - - [4096, 3455, 1, 1024]
    - [294, 0.0]
  - - [4096, 3942, 1, 1024]
    - [286, 0.0]
  - - [1024, 3528, 1, 4096]
    - [281, 0.0]
  - - [4096, 3186, 1, 1024]
    - [286, 0.0]
  - - [1024, 3976, 1, 1024]
    - [288, 0.0]
  - - [1024, 3511, 1, 4096]
    - [298, 0.0]
  - - [4096, 3573, 1, 1024]
    - [294, 0.0]
  - - [4096, 3561, 1, 1024]
    - [294, 0.0]
  - - [4096, 3418, 1, 1024]
    - [286, 0.0]
  - - [33708, 3906, 1, 1024]
    - [293, 0.0]
  - - [4096, 3259, 1, 1024]
    - [294, 0.0]
  - - [4096, 3308, 1, 1024]
    - [287, 0.0]
  - - [1024, 3419, 1, 4096]
    - [282, 0.0]
  - - [1024, 3215, 1, 4096]
    - [295, 0.0]
  - - [1024, 4030, 1, 4096]
    - [293, 0.0]
  - - [4096, 3459, 1, 1024]
    - [294, 0.0]
  - - [1024, 3572, 1, 4096]
    - [281, 0.0]
  - - [1024, 3137, 1, 4096]
    - [282, 0.0]
  - - [1024, 3312, 1, 4096]
    - [290, 0.0]
  - - [1024, 3925, 1, 4096]
    - [288, 0.0]
  - - [1024, 3453, 1, 4096]
    - [282, 0.0]
  - - [4096, 3435, 1, 1024]
    - [286, 0.0]
  - - [1024, 3176, 1, 4096]
    - [282, 0.0]
  - - [1024, 3444, 1, 4096]
    - [310, 0.0]
  - - [4096, 3975, 1, 1024]
    - [293, 0.0]
  - - [4096, 3182, 1, 1024]
    - [287, 0.0]
  - - [1024, 3475, 1, 4096]
    - [295, 0.0]
  - - [9, 9, 6544, 64]
    - [309, 0.0]
  - - [33708, 3955, 1, 1024]
    - [293, 0.0]
  - - [4096, 3446, 1, 1024]
    - [287, 0.0]
  - - [1024, 3138, 1, 4096]
    - [295, 0.0]
  - - [1024, 3549, 1, 4096]
    - [298, 0.0]
  - - [4096, 3287, 1, 1024]
    - [293, 0.0]
  - - [1024, 3342, 1, 4096]
    - [281, 0.0]
  - - [102, 102, 624, 64]
    - [285, 0.0]
  - - [4096, 3519, 1, 1024]
    - [287, 0.0]
  - - [4096, 3552, 1, 1024]
    - [294, 0.0]
  - - [4096, 3859, 1, 1024]
    - [294, 0.0]
  - - [33708, 3969, 1, 1024]
    - [294, 0.0]
  - - [1024, 3369, 1, 4096]
    - [295, 0.0]
  - - [4096, 3482, 1, 1024]
    - [294, 0.0]
  - - [1024, 3306, 1, 4096]
    - [290, 0.0]
  - - [1024, 3474, 1, 4096]
    - [282, 0.0]
  - - [99, 99, 624, 64]
    - [291, 0.0]
  - - [4096, 3377, 1, 1024]
    - [294, 0.0]
  - - [4096, 3426, 1, 1024]
    - [294, 0.0]
  - - [4096, 2935, 1, 1024]
    - [286, 0.0]
  - - [4096, 3267, 1, 1024]
    - [294, 0.0]
  - - [1024, 3299, 1, 4096]
    - [295, 0.0]
  - - [1024, 3456, 1, 4096]
    - [281, 0.0]
  - - [1024, 3280, 1, 4096]
    - [295, 0.0]
  - - [1024, 3555, 1, 4096]
    - [281, 0.0]
  - - [4096, 3499, 1, 1024]
    - [287, 0.0]
  - - [4096, 3356, 1, 1024]
    - [287, 0.0]
  - - [100, 102, 624, 64]
    - [285, 0.0]
  - - [1024, 3412, 1, 4096]
    - [290, 0.0]
  - - [1024, 2984, 1, 4096]
    - [303, 0.0]
  - - [4096, 3141, 1, 1024]
    - [287, 0.0]
  - - [4096, 3510, 1, 1024]
    - [294, 0.0]
  - - [1024, 3995, 1, 1024]
    - [302, 0.0]
  - - [1024, 3517, 1, 4096]
    - [282, 0.0]
  - - [1024, 3455, 1, 4096]
    - [282, 0.0]
  - - [1024, 3939, 1, 1024]
    - [288, 0.0]
  - - [38, 38, 1680, 64]
    - [291, 0.0]
  - - [1024, 3447, 1, 4096]
    - [281, 0.0]
  - - [1024, 3969, 1, 4096]
    - [298, 0.0]
  - - [4096, 3527, 1, 1024]
    - [287, 0.0]
  - - [4096, 3336, 1, 1024]
    - [287, 0.0]
  - - [1024, 3191, 1, 4096]
    - [281, 0.0]
  - - [1024, 3302, 1, 4096]
    - [295, 0.0]
  - - [1024, 3337, 1, 4096]
    - [290, 0.0]
  - - [4096, 3290, 1, 1024]
    - [287, 0.0]
  - - [1024, 3512, 1, 4096]
    - [312, 0.0]
  - - [1024, 3433, 1, 4096]
    - [295, 0.0]
  - - [4096, 3876, 1, 1024]
    - [286, 0.0]
  - - [4096, 3490, 1, 1024]
    - [287, 0.0]
  - - [4096, 3064, 1, 1024]
    - [287, 0.0]
  - - [1024, 3508, 1, 4096]
    - [292, 0.0]
  - - [1024, 3956, 1, 4096]
    - [287, 0.0]
  - - [4096, 3417, 1, 1024]
    - [287, 0.0]
  - - [1024, 3248, 1, 4096]
    - [295, 0.0]
  - - [1024, 2499, 1, 4096]
    - [295, 0.0]
  - - [1024, 3186, 1, 4096]
    - [295, 0.0]
  - - [1024, 3180, 1, 4096]
    - [290, 0.0]
  - - [4096, 3364, 1, 1024]
    - [287, 0.0]
  - - [4096, 3976, 1, 1024]
    - [287, 0.0]
  - - [4096, 3205, 1, 1024]
    - [293, 0.0]
  - - [4096, 3318, 1, 1024]
    - [294, 0.0]
  - - [1024, 3377, 1, 4096]
    - [290, 0.0]
  - - [1024, 3485, 1, 4096]
    - [281, 0.0]
  - - [4096, 3181, 1, 1024]
    - [293, 0.0]
  - - [4096, 3550, 1, 1024]
    - [294, 0.0]
  - - [1024, 3534, 1, 4096]
    - [283, 0.0]
  - - [1024, 3860, 1, 1024]
    - [302, 0.0]
  - - [160, 160, 400, 64]
    - [284, 0.0]
  - - [4096, 3445, 1, 1024]
    - [287, 0.0]
  - - [1024, 3391, 1, 4096]
    - [290, 0.0]
  - - [1024, 3221, 1, 4096]
    - [295, 0.0]
  - - [4096, 3079, 1, 1024]
    - [294, 0.0]
  - - [4096, 3144, 1, 1024]
    - [287, 0.0]
  - - [1024, 3270, 1, 4096]
    - [282, 0.0]
  - - [1024, 3561, 1, 4096]
    - [282, 0.0]
  - - [1024, 3480, 1, 4096]
    - [283, 0.0]
  - - [4096, 3408, 1, 1024]
    - [287, 0.0]
  - - [1024, 3418, 1, 4096]
    - [290, 0.0]
  - - [4096, 3298, 1, 1024]
    - [293, 0.0]
  - - [1024, 3640, 1, 1024]
    - [303, 0.0]
  - - [1024, 3449, 1, 4096]
    - [295, 0.0]
  - - [1024, 4020, 1, 4096]
    - [334, 0.0]
  - - [4096, 3481, 1, 1024]
    - [294, 0.0]
  - - [4096, 3530, 1, 1024]
    - [287, 0.0]
  - - [1024, 3216, 1, 4096]
    - [290, 0.0]
  - - [1024, 3491, 1, 4096]
    - [283, 0.0]
  - - [1024, 3154, 1, 4096]
    - [282, 0.0]
  - - [4096, 3425, 1, 1024]
    - [287, 0.0]
  - - [1024, 3348, 1, 4096]
    - [281, 0.0]
  - - [1024, 3415, 1, 4096]
    - [295, 0.0]
  - - [1024, 4026, 1, 1024]
    - [302, 0.0]
  - - [1024, 3367, 1, 4096]
    - [290, 0.0]
  - - [1024, 3259, 1, 4096]
    - [290, 0.0]
  - - [1024, 3894, 1, 4096]
    - [303, 0.0]
  - - [4096, 3355, 1, 1024]
    - [286, 0.0]
  - - [4096, 3404, 1, 1024]
    - [287, 0.0]
  - - [1024, 3308, 1, 4096]
    - [290, 0.0]
  - - [4096, 3245, 1, 1024]
    - [286, 0.0]
  - - [1024, 3502, 1, 4096]
    - [282, 0.0]
  - - [33708, 4032, 1, 1024]
    - [286, 0.0]
  - - [8, 8, 7280, 64]
    - [328, 0.0]
  - - [1024, 3424, 1, 4096]
    - [283, 0.0]
  - - [4096, 3509, 1, 1024]
    - [286, 0.0]
  - - [4096, 3558, 1, 1024]
    - [287, 0.0]
  - - [1024, 3900, 1, 1024]
    - [288, 0.0]
  - - [1024, 2505, 1, 4096]
    - [325, 0.0]
  - - [4096, 3472, 1, 1024]
    - [294, 0.0]
  - - [1024, 3386, 1, 4096]
    - [281, 0.0]
  - - [4096, 3383, 1, 1024]
    - [287, 0.0]
  - - [4096, 3448, 1, 1024]
    - [293, 0.0]
  - - [4096, 4030, 1, 1024]
    - [293, 0.0]
  - - [4096, 3289, 1, 1024]
    - [294, 0.0]
  - - [1024, 3459, 1, 4096]
    - [282, 0.0]
  - - [1024, 2918, 1, 4096]
    - [298, 0.0]
  - - [4096, 3489, 1, 1024]
    - [294, 0.0]
  - - [4096, 3346, 1, 1024]
    - [287, 0.0]
  - - [4096, 3572, 1, 1024]
    - [287, 0.0]
  - - [1024, 3955, 1, 4096]
    - [293, 0.0]
  - - [4096, 3236, 1, 1024]
    - [294, 0.0]
  - - [4096, 3163, 1, 1024]
    - [294, 0.0]
  - - [4096, 3468, 1, 1024]
    - [294, 0.0]
  - - [1024, 3165, 1, 4096]
    - [282, 0.0]
  - - [1024, 3276, 1, 4096]
    - [282, 0.0]
  - - [1024, 3359, 1, 4096]
    - [281, 0.0]
  - - [4096, 3363, 1, 1024]
    - [287, 0.0]
  - - [1024, 3385, 1, 4096]
    - [310, 0.0]
  - - [1024, 3207, 1, 4096]
    - [290, 0.0]
  - - [1024, 3458, 1, 4096]
    - [282, 0.0]
  - - [21, 21, 2976, 64]
    - [328, 0.0]
  - - [4096, 3110, 1, 1024]
    - [294, 0.0]
  - - [4096, 3925, 1, 1024]
    - [293, 0.0]
  - - [1024, 3975, 1, 4096]
    - [327, 0.0]
  - - [4096, 3549, 1, 1024]
    - [287, 0.0]
  - - [4096, 3342, 1, 1024]
    - [286, 0.0]
  - - [1024, 3859, 1, 1024]
    - [302, 0.0]
  - - [1024, 3497, 1, 4096]
    - [295, 0.0]
  - - [4096, 3280, 1, 1024]
    - [287, 0.0]
  - - [1024, 3435, 1, 4096]
    - [295, 0.0]
  - - [1024, 3354, 1, 4096]
    - [295, 0.0]
  - - [4096, 3191, 1, 1024]
    - [286, 0.0]
  - - [4096, 3512, 1, 1024]
    - [294, 0.0]
  - - [1024, 3055, 1, 4096]
    - [298, 0.0]
  - - [4096, 2499, 1, 1024]
    - [287, 0.0]
  - - [1024, 3233, 1, 4096]
    - [281, 0.0]
  - - [4096, 3423, 1, 1024]
    - [293, 0.0]
  - - [1024, 3319, 1, 4096]
    - [290, 0.0]
  - - [4096, 3297, 1, 1024]
    - [294, 0.0]
  - - [4096, 3154, 1, 1024]
    - [287, 0.0]
  - - [1024, 3540, 1, 4096]
    - [290, 0.0]
  - - [1024, 3289, 1, 4096]
    - [290, 0.0]
  - - [4096, 3529, 1, 1024]
    - [287, 0.0]
  - - [4096, 3386, 1, 1024]
    - [287, 0.0]
  - - [4096, 3276, 1, 1024]
    - [294, 0.0]
  - - [1024, 3244, 1, 4096]
    - [290, 0.0]
  - - [1024, 3182, 1, 4096]
    - [281, 0.0]
  - - [4096, 3540, 1, 1024]
    - [294, 0.0]
  - - [1024, 3360, 1, 4096]
    - [282, 0.0]
  - - [1024, 3942, 1, 4096]
    - [286, 0.0]
  - - [4096, 3403, 1, 1024]
    - [293, 0.0]
  - - [4096, 3101, 1, 1024]
    - [293, 0.0]
  - - [4096, 2918, 1, 1024]
    - [287, 0.0]
  - - [1024, 3465, 1, 4096]
    - [290, 0.0]
  - - [33708, 3780, 1, 1024]
    - [287, 0.0]
  - - [4096, 3557, 1, 1024]
    - [294, 0.0]
  - - [4096, 3414, 1, 1024]
    - [294, 0.0]
  - - [1024, 3948, 1, 1024]
    - [302, 0.0]
  - - [4096, 3320, 1, 1024]
    - [287, 0.0]
  - - [4096, 2765, 1, 1024]
    - [287, 0.0]
  - - [1024, 3978, 1, 4096]
    - [333, 0.0]
  - - [4096, 3487, 1, 1024]
    - [294, 0.0]
  - - [4096, 3520, 1, 1024]
    - [287, 0.0]
  - - [1024, 3139, 1, 4096]
    - [282, 0.0]
  - - [1024, 3314, 1, 4096]
    - [281, 0.0]
  - - [4096, 3431, 1, 1024]
    - [287, 0.0]
  - - [123, 122, 528, 64]
    - [285, 0.0]
  - - [1024, 3446, 1, 4096]
    - [299, 0.0]
  - - [1024, 4059, 1, 4096]
    - [293, 0.0]
  - - [99, 102, 624, 64]
    - [285, 0.0]
  - - [4096, 3345, 1, 1024]
    - [294, 0.0]
  - - [4096, 3394, 1, 1024]
    - [294, 0.0]
  - - [1024, 3927, 1, 1024]
    - [288, 0.0]
  - - [4096, 3235, 1, 1024]
    - [294, 0.0]
  - - [1024, 3328, 1, 4096]
    - [295, 0.0]
  - - [33708, 3956, 1, 1024]
    - [286, 0.0]
  - - [4096, 3467, 1, 1024]
    - [287, 0.0]
  - - [1024, 3287, 1, 4096]
    - [282, 0.0]
  - - [4096, 3214, 1, 1024]
    - [293, 0.0]
  - - [4096, 3910, 1, 1024]
    - [294, 0.0]
  - - [1024, 3780, 1, 1024]
    - [298, 0.0]
  - - [1024, 3371, 1, 4096]
    - [290, 0.0]
  - - [4096, 3478, 1, 1024]
    - [293, 0.0]
  - - [1024, 3546, 1, 4096]
    - [295, 0.0]
  - - [1024, 4012, 1, 1024]
    - [302, 0.0]
  - - [4096, 3341, 1, 1024]
    - [287, 0.0]
  - - [4096, 3454, 1, 1024]
    - [294, 0.0]
  - - [4096, 3295, 1, 1024]
    - [293, 0.0]
  - - [4096, 3072, 1, 1024]
    - [294, 0.0]
  - - [1024, 3282, 1, 4096]
    - [315, 0.0]
  - - [33708, 3720, 1, 1024]
    - [293, 0.0]
  - - [1024, 3681, 1, 4096]
    - [288, 0.0]
  - - [1024, 4050, 1, 4096]
    - [293, 0.0]
  - - [4096, 3495, 1, 1024]
    - [287, 0.0]
  - - [4096, 3560, 1, 1024]
    - [286, 0.0]
  - - [4096, 3751, 1, 1024]
    - [294, 0.0]
  - - [1024, 3414, 1, 4096]
    - [295, 0.0]
  - - [33708, 3860, 1, 1024]
    - [294, 0.0]
  - - [1024, 3325, 1, 4096]
    - [301, 0.0]
  - - [4096, 3458, 1, 1024]
    - [294, 0.0]
  - - [4096, 2967, 1, 1024]
    - [294, 0.0]
  - - [1024, 3519, 1, 4096]
    - [290, 0.0]
  - - [4096, 3385, 1, 1024]
    - [287, 0.0]
  - - [4096, 3434, 1, 1024]
    - [294, 0.0]
  - - [1024, 3552, 1, 4096]
    - [295, 0.0]
  - - [4096, 3822, 1, 1024]
    - [286, 0.0]
  - - [1024, 3544, 1, 4096]
    - [281, 0.0]
  - - [4096, 3539, 1, 1024]
    - [287, 0.0]
  - - [4096, 3332, 1, 1024]
    - [294, 0.0]
  - - [1024, 3145, 1, 4096]
    - [281, 0.0]
  - - [1024, 3535, 1, 4096]
    - [315, 0.0]
  - - [1024, 3320, 1, 4096]
    - [295, 0.0]
  - - [33708, 4012, 1, 1024]
    - [293, 0.0]
  - - [4096, 3286, 1, 1024]
    - [287, 0.0]
  - - [1024, 3514, 1, 4096]
    - [295, 0.0]
  - - [93, 93, 688, 64]
    - [326, 0.0]
  - - [1024, 2765, 1, 4096]
    - [298, 0.0]
  - - [1024, 3452, 1, 4096]
    - [281, 0.0]
  - - [4096, 3518, 1, 1024]
    - [294, 0.0]
  - - [1024, 3529, 1, 4096]
    - [281, 0.0]
  - - [4096, 3413, 1, 1024]
    - [294, 0.0]
  - - [33708, 4050, 1, 1024]
    - [287, 0.0]
  - - [1024, 3525, 1, 4096]
    - [335, 0.0]
  - - [4096, 3303, 1, 1024]
    - [294, 0.0]
  - - [1024, 3382, 1, 4096]
    - [295, 0.0]
  - - [1024, 3390, 1, 4096]
    - [281, 0.0]
  - - [1024, 3977, 1, 4096]
    - [287, 0.0]
  - - [1024, 3184, 1, 4096]
    - [281, 0.0]
  - - [4096, 3535, 1, 1024]
    - [287, 0.0]
  - - [4096, 3376, 1, 1024]
    - [293, 0.0]
  - - [4096, 3978, 1, 1024]
    - [293, 0.0]
  - - [1024, 3136, 1, 4096]
    - [282, 0.0]
  - - [1024, 3293, 1, 4096]
    - [281, 0.0]
  - - [4096, 3266, 1, 1024]
    - [286, 0.0]
  - - [1024, 3487, 1, 4096]
    - [281, 0.0]
  - - [1024, 3409, 1, 4096]
    - [282, 0.0]
  - - [4096, 3498, 1, 1024]
    - [286, 0.0]
  - - [1024, 3520, 1, 4096]
    - [290, 0.0]
  - - [1024, 3530, 1, 4096]
    - [302, 0.0]
  - - [4096, 3393, 1, 1024]
    - [287, 0.0]
  - - [4096, 3140, 1, 1024]
    - [287, 0.0]
  - - [1024, 3536, 1, 4096]
    - [290, 0.0]
  - - [1024, 3288, 1, 4096]
    - [290, 0.0]
  - - [1024, 4005, 1, 4096]
    - [288, 0.0]
  - - [1024, 3579, 1, 4096]
    - [283, 0.0]
  - - [4096, 3372, 1, 1024]
    - [294, 0.0]
  - - [1024, 3440, 1, 4096]
    - [281, 0.0]
  - - [4096, 3213, 1, 1024]
    - [293, 0.0]
  - - [123, 123, 528, 64]
    - [285, 0.0]
  - - [100, 100, 624, 64]
    - [291, 0.0]
  - - [4096, 3477, 1, 1024]
    - [286, 0.0]
  - - [4096, 3526, 1, 1024]
    - [294, 0.0]
  - - [1024, 3493, 1, 4096]
    - [295, 0.0]
  - - [1024, 3944, 1, 4096]
    - [313, 0.0]
  - - [4096, 3453, 1, 1024]
    - [286, 0.0]
  - - [1024, 3350, 1, 4096]
    - [290, 0.0]
  - - [4096, 3184, 1, 1024]
    - [287, 0.0]
  - - [1024, 3423, 1, 4096]
    - [295, 0.0]
  - - [4096, 3351, 1, 1024]
    - [294, 0.0]
  - - [4096, 3416, 1, 1024]
    - [294, 0.0]
  - - [1024, 3796, 1, 4096]
    - [287, 0.0]
  - - [4096, 3257, 1, 1024]
    - [294, 0.0]
  - - [4096, 3306, 1, 1024]
    - [287, 0.0]
  - - [33708, 4020, 1, 1024]
    - [287, 0.0]
  - - [19, 19, 3264, 64]
    - [296, 0.0]
  - - [1024, 3426, 1, 4096]
    - [281, 0.0]
  - - [4096, 3457, 1, 1024]
    - [294, 0.0]
  - - [1024, 2935, 1, 4096]
    - [288, 0.0]
  - - [1024, 3046, 1, 4096]
    - [288, 0.0]
  - - [4096, 3433, 1, 1024]
    - [287, 0.0]
  - - [1024, 3256, 1, 4096]
    - [290, 0.0]
  - - [1024, 3531, 1, 4096]
    - [281, 0.0]
  - - [4096, 3180, 1, 1024]
    - [294, 0.0]
  - - [1024, 3388, 1, 4096]
    - [282, 0.0]
  - - [4096, 3444, 1, 1024]
    - [293, 0.0]
  - - [1024, 3501, 1, 4096]
    - [301, 0.0]
  - - [1024, 3266, 1, 4096]
    - [315, 0.0]
  - - [1024, 3267, 1, 4096]
    - [290, 0.0]
  - - [1024, 3461, 1, 4096]
    - [298, 0.0]
  - - [4096, 3870, 1, 1024]
    - [287, 0.0]
  - - [4096, 3517, 1, 1024]
    - [294, 0.0]
  - - [1024, 3566, 1, 4096]
    - [290, 0.0]
  - - [4096, 3574, 1, 1024]
    - [294, 0.0]
  - - [1024, 3876, 1, 1024]
    - [288, 0.0]
  - - [25, 25, 2512, 64]
    - [336, 0.0]
  - - [4096, 3720, 1, 1024]
    - [294, 0.0]
  - - [4096, 3248, 1, 1024]
    - [287, 0.0]
  - - [4096, 4059, 1, 1024]
    - [294, 0.0]
  - - [1024, 3380, 1, 4096]
    - [295, 0.0]
  - - [4096, 3480, 1, 1024]
    - [287, 0.0]
  - - [1024, 3335, 1, 4096]
    - [282, 0.0]
  - - [1024, 3345, 1, 4096]
    - [282, 0.0]
  - - [4096, 3391, 1, 1024]
    - [294, 0.0]
  - - [4096, 3424, 1, 1024]
    - [287, 0.0]
  - - [1024, 3394, 1, 4096]
    - [315, 0.0]
  - - [4096, 3265, 1, 1024]
    - [287, 0.0]
  - - [1024, 3014, 1, 4096]
    - [288, 0.0]
  - - [4096, 3497, 1, 1024]
    - [294, 0.0]
  - - [4096, 3354, 1, 1024]
    - [287, 0.0]
  - - [4096, 3055, 1, 1024]
    - [286, 0.0]
  - - [1024, 3499, 1, 4096]
    - [310, 0.0]
  - - [1024, 3162, 1, 4096]
    - [282, 0.0]
  - - [4096, 3244, 1, 1024]
    - [287, 0.0]
  - - [1024, 3437, 1, 4096]
    - [295, 0.0]
  - - [1024, 3356, 1, 4096]
    - [290, 0.0]
  - - [4096, 3139, 1, 1024]
    - [287, 0.0]
  - - [4096, 3508, 1, 1024]
    - [287, 0.0]
  - - [1024, 3235, 1, 4096]
    - [281, 0.0]
  - - [1024, 3910, 1, 4096]
    - [298, 0.0]
  - - [4096, 3371, 1, 1024]
    - [294, 0.0]
  - - [1024, 3751, 1, 4096]
    - [298, 0.0]
  - - [4096, 3325, 1, 1024]
    - [294, 0.0]
  - - [1024, 3413, 1, 4096]
    - [315, 0.0]
  - - [1024, 3542, 1, 4096]
    - [281, 0.0]
  - - [18, 18, 3440, 64]
    - [309, 0.0]
  - - [101, 102, 624, 64]
    - [291, 0.0]
  - - [33708, 3900, 1, 1024]
    - [294, 0.0]
  - - [4096, 3525, 1, 1024]
    - [286, 0.0]
  - - [4096, 3382, 1, 1024]
    - [286, 0.0]
  - - [102, 100, 624, 64]
    - [285, 0.0]
  - - [15, 15, 4096, 64]
    - [322, 0.0]
  - - [1024, 3339, 1, 4096]
    - [283, 0.0]
  - - [4096, 3288, 1, 1024]
    - [287, 0.0]
  - - [92, 92, 688, 64]
    - [326, 0.0]
  - - [1024, 3141, 1, 4096]
    - [281, 0.0]
  - - [1024, 3168, 1, 4096]
    - [281, 0.0]
  - - [4096, 3488, 1, 1024]
    - [287, 0.0]
  - - [4096, 3046, 1, 1024]
    - [286, 0.0]
  - - [1024, 3362, 1, 4096]
    - [290, 0.0]
  - - [33708, 3942, 1, 1024]
    - [286, 0.0]
  - - [4096, 3399, 1, 1024]
    - [287, 0.0]
  - - [1024, 3720, 1, 1024]
    - [302, 0.0]
  - - [4096, 3563, 1, 1024]
    - [294, 0.0]
  - - [1024, 3273, 1, 4096]
    - [290, 0.0]
  - - [4096, 3162, 1, 1024]
    - [287, 0.0]
  - - [1024, 3467, 1, 4096]
    - [295, 0.0]
  - - [1024, 3130, 1, 4096]
    - [282, 0.0]
  - - [1024, 3405, 1, 4096]
    - [297, 0.0]
  - - [4096, 3362, 1, 1024]
    - [294, 0.0]
  - - [1024, 3960, 1, 1024]
    - [302, 0.0]
  - - [2048, 128, 1, 4096]
    - [337, 0.0]
  - - [1024, 3712, 1, 36548]
    - [338, 0.0]
  - - [1024, 128, 1, 1024]
    - [339, 0.0]
  - - [3072, 128, 1, 4096]
    - [340, 0.0]
  - - [1024, 3712, 1, 1024]
    - [341, 0.0]
  - - [2, 16, 1, 768]
    - [342, 0.0]
  - - [2, 8, 1, 768]
    - [343, 0.0]
  - - [2, 64, 1, 768]
    - [342, 0.0]
  - - [1728, 320, 1, 64]
    - [344, 0.0]
  - - [1152, 128, 1, 784]
    - [345, 0.0]
  - - [576, 96, 1, 5329]
    - [346, 0.0]
  - - [864, 96, 1, 1225]
    - [347, 0.0]
  - - [256, 128, 1, 784]
    - [348, 0.0]
  - - [1440, 320, 1, 196]
    - [349, 0.0]
  - - [192, 48, 1, 1225]
    - [350, 0.0]
  - - [2592, 384, 1, 289]
    - [351, 0.0]
  - - [192, 80, 36, 10368]
    - [352, 0.0]
  - - [896, 192, 1, 289]
    - [353, 0.0]
  - - [768, 128, 1, 289]
    - [354, 0.0]
  - - [64, 256, 1, 3136]
    - [355, 0.0]
  - - [1280, 384, 1, 64]
    - [349, 0.0]
  - - [512, 144, 1, 196]
    - [356, 0.0]
  - - [1344, 192, 1, 289]
    - [357, 0.0]
  - - [288, 64, 1, 21609]
    - [358, 0.0]
  - - [400, 32, 1, 784]
    - [359, 0.0]
  - - [288, 32, 1, 21609]
    - [360, 0.0]
  - - [1280, 448, 1, 64]
    - [344, 0.0]
  - - [3456, 256, 1, 169]
    - [361, 0.0]
  - - [2304, 256, 1, 196]
    - [362, 0.0]
  - - [384, 192, 1, 1225]
    - [363, 0.0]
  - - [832, 48, 1, 49]
    - [364, 0.0]
  - - [832, 192, 1, 49]
    - [365, 0.0]
  - - [1280, 192, 1, 64]
    - [366, 0.0]
  - - [192, 32, 1, 784]
    - [350, 0.0]
  - - [288, 48, 1, 1225]
    - [367, 0.0]
  - - [512, 112, 1, 196]
    - [368, 0.0]
  - - [224, 192, 36, 2592]
    - [369, 0.0]
  - - [528, 32, 1, 196]
    - [370, 0.0]
  - - [192, 128, 36, 1568]
    - [371, 0.0]
  - - [4032, 384, 1, 64]
    - [372, 0.0]
  - - [576, 64, 1, 3136]
    - [373, 0.0]
  - - [2048, 32, 1, 1001]
    - [363, 0.0]
  - - [480, 64, 1, 196]
    - [374, 0.0]
  - - [512, 256, 1, 196]
    - [375, 0.0]
  - - [864, 96, 1, 289]
    - [356, 0.0]
  - - [896, 128, 1, 289]
    - [363, 0.0]
  - - [192, 64, 1, 784]
    - [376, 0.0]
  - - [1200, 64, 1, 1225]
    - [354, 0.0]
  - - [1296, 288, 1, 196]
    - [377, 0.0]
  - - [576, 96, 1, 5041]
    - [378, 0.0]
  - - [1024, 256, 1, 289]
    - [379, 0.0]
  - - [1024, 2048, 1, 49]
    - [380, 0.0]
  - - [192, 64, 36, 6272]
    - [381, 0.0]
  - - [192, 32, 1, 1225]
    - [359, 0.0]
  - - [1024, 256, 1, 196]
    - [366, 0.0]
  - - [1120, 192, 1, 289]
    - [382, 0.0]
  - - [400, 48, 1, 196]
    - [368, 0.0]
  - - [1728, 224, 1, 1225]
    - [383, 0.0]
  - - [800, 96, 1, 784]
    - [354, 0.0]
  - - [1152, 384, 1, 64]
    - [384, 0.0]
  - - [4608, 512, 1, 49]
    - [385, 0.0]
  - - [1792, 256, 1, 289]
    - [384, 0.0]
  - - [864, 128, 1, 784]
    - [354, 0.0]
  - - [1728, 384, 1, 169]
    - [386, 0.0]
  - - [480, 16, 1, 196]
    - [387, 0.0]
  - - [1568, 256, 1, 289]
    - [349, 0.0]
  - - [1152, 448, 1, 64]
    - [383, 0.0]
  - - [512, 64, 1, 196]
    - [388, 0.0]
  - - [1344, 224, 1, 289]
    - [349, 0.0]
  - - [9216, 512, 1, 4096]
    - [389, 0.0]
  - - [27, 32, 1, 22201]
    - [390, 0.0]
  - - [1152, 192, 1, 784]
    - [391, 0.0]
  - - [1536, 256, 1, 64]
    - [392, 0.0]
  - - [800, 128, 1, 196]
    - [354, 0.0]
  - - [800, 64, 1, 196]
    - [393, 0.0]
  - - [864, 208, 1, 196]
    - [394, 0.0]
  - - [1440, 320, 1, 49]
    - [395, 0.0]
  - - [512, 128, 1, 784]
    - [396, 0.0]
  - - [720, 192, 1, 5041]
    - [397, 0.0]
  - - [256, 64, 1, 784]
    - [398, 0.0]
  - - [256, 48, 1, 1225]
    - [350, 0.0]
  - - [576, 192, 1, 3136]
    - [397, 0.0]
  - - [160, 64, 1, 5329]
    - [399, 0.0]
  - - [3456, 384, 1, 289]
    - [400, 0.0]
  - - [32, 32, 36, 43808]
    - [401, 0.0]
  - - [1344, 512, 1, 64]
    - [377, 0.0]
  - - [192, 16, 1, 784]
    - [359, 0.0]
  - - [3456, 384, 1, 169]
    - [402, 0.0]
  - - [1152, 256, 1, 196]
    - [403, 0.0]
  - - [1728, 192, 1, 1225]
    - [384, 0.0]
  - - [2048, 512, 1, 49]
    - [404, 0.0]
  - - [576, 96, 1, 1225]
    - [368, 0.0]
  - - [512, 2048, 1, 49]
    - [405, 0.0]
  - - [1728, 192, 1, 64]
    - [377, 0.0]
  - - [832, 256, 1, 49]
    - [379, 0.0]
  - - [512, 128, 1, 196]
    - [406, 0.0]
  - - [1200, 128, 1, 49]
    - [407, 0.0]
  - - [528, 256, 1, 196]
    - [408, 0.0]
  - - [256, 512, 1, 784]
    - [354, 0.0]
  - - [480, 192, 1, 196]
    - [354, 0.0]
  - - [96, 64, 36, 2592]
    - [409, 0.0]
  - - [96, 96, 36, 2592]
    - [410, 0.0]
  - - [1024, 192, 1, 289]
    - [411, 0.0]
  - - [1536, 384, 1, 64]
    - [412, 0.0]
  - - [192, 96, 1, 784]
    - [388, 0.0]
  - - [2048, 192, 1, 64]
    - [413, 0.0]
  - - [192, 64, 1, 1225]
    - [414, 0.0]
  - - [512, 32, 1, 196]
    - [415, 0.0]
  - - [128, 96, 36, 1568]
    - [416, 0.0]
  - - [528, 128, 1, 196]
    - [347, 0.0]
  - - [128, 512, 1, 784]
    - [348, 0.0]
  - - [128, 128, 36, 3136]
    - [417, 0.0]
  - - [528, 160, 1, 196]
    - [363, 0.0]
  - - [448, 64, 1, 5329]
    - [346, 0.0]
  - - [1280, 320, 1, 64]
    - [349, 0.0]
  - - [1792, 320, 1, 289]
    - [386, 0.0]
  - - [2880, 320, 1, 64]
    - [418, 0.0]
  - - [147, 64, 1, 12544]
    - [419, 0.0]
  - - [4096, 512, 1, 1001]
    - [420, 0.0]
  - - [1536, 32, 1, 1001]
    - [363, 0.0]
  - - [512, 160, 1, 196]
    - [347, 0.0]
  - - [768, 160, 1, 289]
    - [356, 0.0]
  - - [1728, 384, 1, 49]
    - [384, 0.0]
  - - [64, 32, 36, 43808]
    - [421, 0.0]
  - - [64, 64, 1, 3136]
    - [422, 0.0]
  - - [256, 32, 1, 784]
    - [350, 0.0]
  - - [480, 96, 1, 196]
    - [368, 0.0]
  - - [1024, 32, 1, 1001]
    - [423, 0.0]
  - - [832, 160, 1, 49]
    - [356, 0.0]
  - - [512, 1024, 1, 196]
    - [395, 0.0]
  - - [2048, 64, 1, 1001]
    - [424, 0.0]
  - - [2048, 128, 1, 1001]
    - [425, 0.0]
  - - [1536, 64, 1, 1001]
    - [426, 0.0]
  - - [32, 32, 64, 40000]
    - [427, 0.0]
  - - [224, 192, 36, 5184]
    - [428, 0.0]
  - - [32, 32, 49, 115200]
    - [429, 0.0]
  - - [384, 448, 49, 512]
    - [430, 0.0]
  - - [192, 80, 36, 20736]
    - [431, 0.0]
  - - [384, 448, 64, 256]
    - [432, 0.0]
  - - [96, 64, 64, 18432]
    - [433, 0.0]
  - - [224, 192, 64, 4608]
    - [428, 0.0]
  - - [96, 96, 49, 3136]
    - [434, 0.0]
  - - [224, 192, 64, 2304]
    - [430, 0.0]
  - - [64, 32, 49, 57600]
    - [435, 0.0]
  - - [384, 448, 36, 256]
    - [436, 0.0]
  - - [96, 64, 36, 10368]
    - [437, 0.0]
  - - [96, 64, 36, 20736]
    - [438, 0.0]
  - - [192, 80, 49, 14400]
    - [435, 0.0]
  - - [96, 64, 49, 6272]
    - [439, 0.0]
  - - [64, 32, 49, 115200]
    - [440, 0.0]
  - - [384, 448, 49, 256]
    - [441, 0.0]
  - - [96, 96, 64, 2304]
    - [431, 0.0]
  - - [96, 96, 49, 6272]
    - [442, 0.0]
  - - [224, 192, 49, 6272]
    - [443, 0.0]
  - - [96, 96, 36, 10368]
    - [444, 0.0]
  - - [96, 64, 36, 5184]
    - [445, 0.0]
  - - [384, 448, 64, 512]
    - [436, 0.0]
  - - [224, 192, 49, 3136]
    - [443, 0.0]
  - - [384, 448, 36, 512]
    - [446, 0.0]
  - - [32, 32, 36, 175232]
    - [447, 0.0]
  - - [224, 192, 36, 10368]
    - [428, 0.0]
  - - [64, 32, 64, 40000]
    - [440, 0.0]
  - - [96, 64, 64, 4608]
    - [448, 0.0]
  - - [32, 32, 49, 57600]
    - [429, 0.0]
  - - [192, 80, 36, 41472]
    - [449, 0.0]
  - - [32, 32, 36, 87616]
    - [427, 0.0]
  - - [192, 80, 49, 28800]
    - [440, 0.0]
  - - [96, 64, 49, 28800]
    - [450, 0.0]
  - - [96, 64, 36, 41472]
    - [451, 0.0]
  - - [192, 80, 64, 9216]
    - [452, 0.0]
  - - [96, 96, 36, 5184]
    - [444, 0.0]
  - - [32, 32, 64, 80000]
    - [453, 0.0]
  - - [96, 64, 64, 2304]
    - [454, 0.0]
  - - [96, 64, 49, 3136]
    - [439, 0.0]
  - - [64, 32, 36, 87616]
    - [440, 0.0]
  - - [64, 32, 64, 80000]
    - [440, 0.0]
  - - [96, 96, 64, 4608]
    - [455, 0.0]
  - - [64, 32, 36, 175232]
    - [435, 0.0]
  - - [64, 64, 11, 233600]
    - [456, 0.0]
  - - [320, 256, 9, 19584]
    - [457, 0.0]
  - - [256, 224, 9, 9792]
    - [458, 0.0]
  - - [128, 128, 11, 3264]
    - [459, 0.0]
  - - [256, 256, 9, 4896]
    - [460, 0.0]
  - - [320, 256, 9, 4896]
    - [461, 0.0]
  - - [224, 192, 9, 19584]
    - [462, 0.0]
  - - [192, 192, 11, 3264]
    - [463, 0.0]
  - - [64, 64, 11, 116800]
    - [464, 0.0]
  - - [64, 64, 9, 172864]
    - [465, 0.0]
  - - [192, 128, 11, 6528]
    - [466, 0.0]
  - - [64, 64, 11, 58400]
    - [464, 0.0]
  - - [192, 160, 9, 19584]
    - [467, 0.0]
  - - [128, 128, 9, 9792]
    - [468, 0.0]
  - - [128, 128, 11, 6528]
    - [468, 0.0]
  - - [192, 192, 11, 6528]
    - [463, 0.0]
  - - [160, 160, 9, 4896]
    - [469, 0.0]
  - - [192, 192, 9, 4896]
    - [470, 0.0]
  - - [256, 256, 11, 13056]
    - [471, 0.0]
  - - [224, 192, 11, 6528]
    - [472, 0.0]
  - - [192, 192, 9, 19584]
    - [473, 0.0]
  - - [256, 224, 11, 13056]
    - [457, 0.0]
  - - [224, 192, 11, 13056]
    - [474, 0.0]
  - - [256, 256, 11, 3264]
    - [475, 0.0]
  - - [192, 160, 11, 13056]
    - [467, 0.0]
  - - [320, 256, 11, 6528]
    - [476, 0.0]
  - - [192, 192, 9, 9792]
    - [467, 0.0]
  - - [192, 160, 11, 6528]
    - [477, 0.0]
  - - [224, 224, 9, 9792]
    - [478, 0.0]
  - - [64, 64, 9, 86432]
    - [456, 0.0]
  - - [224, 192, 11, 3264]
    - [473, 0.0]
  - - [128, 128, 9, 19584]
    - [479, 0.0]
  - - [224, 224, 11, 6528]
    - [480, 0.0]
  - - [160, 160, 11, 13056]
    - [481, 0.0]
  - - [160, 160, 9, 19584]
    - [482, 0.0]
  - - [192, 128, 9, 19584]
    - [479, 0.0]
  - - [192, 160, 9, 9792]
    - [483, 0.0]
  - - [224, 224, 9, 19584]
    - [478, 0.0]
  - - [192, 192, 11, 13056]
    - [484, 0.0]
  - - [192, 128, 9, 4896]
    - [484, 0.0]
  - - [320, 256, 9, 9792]
    - [485, 0.0]
  - - [320, 256, 11, 13056]
    - [486, 0.0]
  - - [64, 64, 9, 345728]
    - [464, 0.0]
  - - [128, 128, 9, 4896]
    - [468, 0.0]
  - - [256, 256, 9, 9792]
    - [480, 0.0]
  - - [224, 224, 9, 4896]
    - [487, 0.0]
  - - [320, 256, 11, 3264]
    - [488, 0.0]
  - - [256, 256, 11, 6528]
    - [463, 0.0]
  - - [224, 192, 9, 4896]
    - [481, 0.0]
  - - [256, 224, 9, 19584]
    - [489, 0.0]
  - - [192, 128, 11, 3264]
    - [490, 0.0]
  - - [224, 224, 11, 13056]
    - [480, 0.0]
  - - [224, 224, 11, 3264]
    - [478, 0.0]
  - - [160, 160, 11, 3264]
    - [466, 0.0]
  - - [256, 224, 11, 6528]
    - [491, 0.0]
  - - [128, 128, 11, 13056]
    - [484, 0.0]
  - - [192, 160, 9, 4896]
    - [492, 0.0]
  - - [256, 224, 11, 3264]
    - [493, 0.0]
  - - [160, 160, 9, 9792]
    - [494, 0.0]
  - - [192, 160, 11, 3264]
    - [483, 0.0]
  - - [256, 256, 9, 19584]
    - [457, 0.0]
  - - [192, 128, 11, 13056]
    - [483, 0.0]
  - - [224, 192, 9, 9792]
    - [495, 0.0]
  - - [160, 160, 11, 6528]
    - [466, 0.0]
  - - [256, 224, 9, 4896]
    - [491, 0.0]
  - - [192, 128, 9, 9792]
    - [484, 0.0]
  - - [1024, 6400, 1, 65]
    - [496, 0.0]
  - - [4096, 6400, 1, 256]
    - [497, 0.0]
  - - [4096, 64, 1, 1024]
    - [498, 0.0]
  - - [18, 18, 648, 64]
    - [499, 0.0]
  - - [49, 49, 160, 64]
    - [500, 0.0]
  - - [54, 54, 592, 64]
    - [501, 0.0]
  - - [59, 59, 512, 64]
    - [502, 0.0]
  - - [64, 64, 496, 64]
    - [503, 0.0]
  - - [104, 104, 16, 64]
    - [504, 0.0]
  - - [135, 135, 32, 64]
    - [505, 0.0]
  - - [512, 3194, 1, 2048]
    - [506, 0.0]
  - - [512, 3222, 1, 2048]
    - [507, 0.0]
  - - [512, 3234, 1, 2048]
    - [508, 0.0]
  - - [512, 3242, 1, 2048]
    - [509, 0.0]
  - - [512, 3257, 1, 2048]
    - [506, 0.0]
  - - [512, 3332, 1, 2048]
    - [508, 0.0]
  - - [512, 3336, 1, 2048]
    - [510, 0.0]
  - - [512, 3378, 1, 2048]
    - [508, 0.0]
  - - [512, 3396, 1, 2048]
    - [506, 0.0]
  - - [512, 3399, 1, 2048]
    - [508, 0.0]
  - - [512, 3451, 1, 2048]
    - [511, 0.0]
  - - [512, 3456, 1, 2048]
    - [508, 0.0]
  - - [512, 3458, 1, 2048]
    - [510, 0.0]
  - - [512, 3467, 1, 2048]
    - [512, 0.0]
  - - [512, 3468, 1, 2048]
    - [510, 0.0]
  - - [512, 3470, 1, 2048]
    - [506, 0.0]
  - - [512, 3477, 1, 2048]
    - [510, 0.0]
  - - [512, 3478, 1, 2048]
    - [506, 0.0]
  - - [512, 3495, 1, 2048]
    - [510, 0.0]
  - - [512, 3507, 1, 2048]
    - [508, 0.0]
  - - [512, 3515, 1, 2048]
    - [508, 0.0]
  - - [512, 3517, 1, 2048]
    - [508, 0.0]
  - - [2048, 2864, 1, 512]
    - [513, 0.0]
  - - [2048, 3287, 1, 512]
    - [514, 0.0]
  - - [2048, 3412, 1, 512]
    - [515, 0.0]
  - - [2048, 3456, 1, 512]
    - [515, 0.0]
  - - [2048, 3466, 1, 512]
    - [515, 0.0]
  - - [2048, 3476, 1, 512]
    - [516, 0.0]
  - - [2048, 3999, 1, 512]
    - [517, 0.0]
  - - [33708, 189, 1, 512]
    - [518, 0.0]
  - - [33708, 2496, 1, 512]
    - [519, 0.0]
  - - [33708, 3864, 1, 512]
    - [508, 0.0]
  - - [33708, 3969, 1, 512]
    - [506, 0.0]
  - - [33708, 3995, 1, 512]
    - [508, 0.0]
  - - [7, 7, 736, 64]
    - [520, 0.0]
  - - [8, 8, 264, 64]
    - [521, 0.0]
  - - [9, 9, 416, 64]
    - [482, 0.0]
  - - [10, 10, 448, 64]
    - [522, 0.0]
  - - [11, 11, 568, 64]
    - [523, 0.0]
  - - [12, 12, 480, 64]
    - [524, 0.0]
  - - [12, 12, 2520, 64]
    - [525, 0.0]
  - - [13, 13, 576, 64]
    - [526, 0.0]
  - - [13, 13, 2336, 64]
    - [527, 0.0]
  - - [14, 14, 704, 64]
    - [528, 0.0]
  - - [14, 14, 2184, 64]
    - [520, 0.0]
  - - [15, 15, 688, 64]
    - [529, 0.0]
  - - [15, 15, 2048, 64]
    - [530, 0.0]
  - - [16, 16, 712, 64]
    - [531, 0.0]
  - - [16, 16, 1920, 64]
    - [532, 0.0]
  - - [17, 17, 688, 64]
    - [531, 0.0]
  - - [17, 17, 1816, 64]
    - [520, 0.0]
  - - [18, 18, 1720, 64]
    - [533, 0.0]
  - - [19, 19, 680, 64]
    - [534, 0.0]
  - - [19, 19, 1632, 64]
    - [533, 0.0]
  - - [21, 21, 1472, 64]
    - [523, 0.0]
  - - [21, 21, 1488, 64]
    - [527, 0.0]
  - - [23, 23, 64, 64]
    - [535, 0.0]
  - - [23, 23, 1360, 64]
    - [536, 0.0]
  - - [25, 25, 176, 64]
    - [482, 0.0]
  - - [25, 25, 1256, 64]
    - [537, 0.0]
  - - [26, 26, 56, 64]
    - [538, 0.0]
  - - [26, 27, 56, 64]
    - [482, 0.0]
  - - [27, 27, 56, 64]
    - [539, 0.0]
  - - [27, 27, 1168, 64]
    - [540, 0.0]
  - - [29, 29, 136, 64]
    - [541, 0.0]
  - - [29, 29, 1088, 64]
    - [542, 0.0]
  - - [32, 32, 624, 64]
    - [543, 0.0]
  - - [32, 32, 992, 64]
    - [538, 0.0]
  - - [35, 35, 384, 64]
    - [544, 0.0]
  - - [35, 35, 904, 64]
    - [545, 0.0]
  - - [38, 38, 320, 64]
    - [546, 0.0]
  - - [38, 38, 840, 64]
    - [547, 0.0]
  - - [41, 41, 312, 64]
    - [548, 0.0]
  - - [41, 41, 776, 64]
    - [549, 0.0]
  - - [45, 45, 392, 64]
    - [550, 0.0]
  - - [45, 45, 712, 64]
    - [551, 0.0]
  - - [49, 49, 648, 64]
    - [552, 0.0]
  - - [54, 54, 200, 64]
    - [553, 0.0]
  - - [59, 59, 544, 64]
    - [554, 0.0]
  - - [64, 65, 496, 64]
    - [555, 0.0]
  - - [65, 65, 472, 64]
    - [499, 0.0]
  - - [65, 65, 496, 64]
    - [527, 0.0]
  - - [70, 70, 216, 64]
    - [556, 0.0]
  - - [70, 71, 216, 64]
    - [532, 0.0]
  - - [71, 71, 216, 64]
    - [557, 0.0]
  - - [71, 71, 448, 64]
    - [553, 0.0]
  - - [77, 77, 248, 64]
    - [558, 0.0]
  - - [77, 77, 408, 64]
    - [525, 0.0]
  - - [77, 78, 248, 64]
    - [556, 0.0]
  - - [77, 78, 408, 64]
    - [559, 0.0]
  - - [78, 78, 248, 64]
    - [560, 0.0]
  - - [78, 78, 408, 64]
    - [561, 0.0]
  - - [80, 80, 152, 64]
    - [553, 0.0]
  - - [80, 84, 152, 64]
    - [560, 0.0]
  - - [84, 84, 152, 64]
    - [527, 0.0]
  - - [85, 85, 376, 64]
    - [499, 0.0]
  - - [91, 91, 40, 64]
    - [562, 0.0]
  - - [91, 93, 40, 64]
    - [563, 0.0]
  - - [93, 93, 40, 64]
    - [564, 0.0]
  - - [93, 93, 344, 64]
    - [499, 0.0]
  - - [102, 102, 56, 64]
    - [565, 0.0]
  - - [102, 102, 312, 64]
    - [566, 0.0]
  - - [103, 103, 16, 64]
    - [567, 0.0]
  - - [103, 104, 16, 64]
    - [568, 0.0]
  - - [112, 112, 16, 64]
    - [569, 0.0]
  - - [112, 112, 288, 64]
    - [570, 0.0]
  - - [112, 123, 16, 64]
    - [571, 0.0]
  - - [119, 119, 32, 64]
    - [572, 0.0]
  - - [119, 135, 32, 64]
    - [573, 0.0]
  - - [122, 122, 264, 64]
    - [574, 0.0]
  - - [123, 122, 264, 64]
    - [575, 0.0]
  - - [123, 123, 16, 64]
    - [576, 0.0]
  - - [123, 123, 264, 64]
    - [577, 0.0]
  - - [134, 134, 240, 64]
    - [578, 0.0]
  - - [135, 134, 240, 64]
    - [579, 0.0]
  - - [135, 135, 240, 64]
    - [580, 0.0]
  - - [256, 1, 1, 4]
    - [581, 0.0]
  - - [2, 1, 1, 1024]
    - [582, 0.0]
  - - [1024, 1, 1, 1024]
    - [582, 0.0]
  - - [512, 2790, 1, 2048]
    - [583, 0.0]
  - - [512, 2864, 1, 2048]
    - [584, 0.0]
  - - [512, 3092, 1, 2048]
    - [585, 0.0]
  - - [512, 3113, 1, 2048]
    - [585, 0.0]
  - - [512, 3137, 1, 2048]
    - [586, 0.0]
  - - [512, 3165, 1, 2048]
    - [586, 0.0]
  - - [512, 3166, 1, 2048]
    - [587, 0.0]
  - - [512, 3219, 1, 2048]
    - [585, 0.0]
  - - [512, 3237, 1, 2048]
    - [583, 0.0]
  - - [512, 3246, 1, 2048]
    - [584, 0.0]
  - - [512, 3249, 1, 2048]
    - [584, 0.0]
  - - [512, 3251, 1, 2048]
    - [588, 0.0]
  - - [512, 3262, 1, 2048]
    - [584, 0.0]
  - - [512, 3268, 1, 2048]
    - [587, 0.0]
  - - [512, 3282, 1, 2048]
    - [583, 0.0]
  - - [512, 3286, 1, 2048]
    - [587, 0.0]
  - - [512, 3287, 1, 2048]
    - [587, 0.0]
  - - [512, 3293, 1, 2048]
    - [585, 0.0]
  - - [512, 3297, 1, 2048]
    - [583, 0.0]
  - - [512, 3307, 1, 2048]
    - [585, 0.0]
  - - [512, 3314, 1, 2048]
    - [583, 0.0]
  - - [512, 3315, 1, 2048]
    - [587, 0.0]
  - - [512, 3319, 1, 2048]
    - [588, 0.0]
  - - [512, 3322, 1, 2048]
    - [589, 0.0]
  - - [512, 3323, 1, 2048]
    - [583, 0.0]
  - - [512, 3324, 1, 2048]
    - [587, 0.0]
  - - [512, 3325, 1, 2048]
    - [587, 0.0]
  - - [512, 3327, 1, 2048]
    - [590, 0.0]
  - - [512, 3329, 1, 2048]
    - [591, 0.0]
  - - [512, 3339, 1, 2048]
    - [591, 0.0]
  - - [512, 3342, 1, 2048]
    - [592, 0.0]
  - - [512, 3344, 1, 2048]
    - [593, 0.0]
  - - [512, 3358, 1, 2048]
    - [594, 0.0]
  - - [512, 3360, 1, 2048]
    - [591, 0.0]
  - - [512, 3364, 1, 2048]
    - [592, 0.0]
  - - [512, 3365, 1, 2048]
    - [595, 0.0]
  - - [512, 3369, 1, 2048]
    - [590, 0.0]
  - - [512, 3371, 1, 2048]
    - [592, 0.0]
  - - [512, 3374, 1, 2048]
    - [593, 0.0]
  - - [512, 3376, 1, 2048]
    - [594, 0.0]
  - - [512, 3377, 1, 2048]
    - [583, 0.0]
  - - [512, 3381, 1, 2048]
    - [593, 0.0]
  - - [512, 3382, 1, 2048]
    - [592, 0.0]
  - - [512, 3383, 1, 2048]
    - [596, 0.0]
  - - [512, 3384, 1, 2048]
    - [593, 0.0]
  - - [512, 3385, 1, 2048]
    - [594, 0.0]
  - - [512, 3386, 1, 2048]
    - [587, 0.0]
  - - [512, 3388, 1, 2048]
    - [595, 0.0]
  - - [512, 3390, 1, 2048]
    - [586, 0.0]
  - - [512, 3391, 1, 2048]
    - [590, 0.0]
  - - [512, 3402, 1, 2048]
    - [592, 0.0]
  - - [512, 3410, 1, 2048]
    - [594, 0.0]
  - - [512, 3412, 1, 2048]
    - [584, 0.0]
  - - [512, 3414, 1, 2048]
    - [588, 0.0]
  - - [512, 3415, 1, 2048]
    - [590, 0.0]
  - - [512, 3418, 1, 2048]
    - [583, 0.0]
  - - [512, 3420, 1, 2048]
    - [595, 0.0]
  - - [512, 3422, 1, 2048]
    - [592, 0.0]
  - - [512, 3425, 1, 2048]
    - [595, 0.0]
  - - [512, 3426, 1, 2048]
    - [596, 0.0]
  - - [512, 3427, 1, 2048]
    - [594, 0.0]
  - - [512, 3428, 1, 2048]
    - [594, 0.0]
  - - [512, 3430, 1, 2048]
    - [587, 0.0]
  - - [512, 3431, 1, 2048]
    - [587, 0.0]
  - - [512, 3432, 1, 2048]
    - [587, 0.0]
  - - [512, 3438, 1, 2048]
    - [584, 0.0]
  - - [512, 3439, 1, 2048]
    - [595, 0.0]
  - - [512, 3440, 1, 2048]
    - [588, 0.0]
  - - [512, 3443, 1, 2048]
    - [584, 0.0]
  - - [512, 3445, 1, 2048]
    - [593, 0.0]
  - - [512, 3447, 1, 2048]
    - [584, 0.0]
  - - [512, 3448, 1, 2048]
    - [587, 0.0]
  - - [512, 3450, 1, 2048]
    - [590, 0.0]
  - - [512, 3452, 1, 2048]
    - [593, 0.0]
  - - [512, 3453, 1, 2048]
    - [597, 0.0]
  - - [512, 3455, 1, 2048]
    - [590, 0.0]
  - - [512, 3457, 1, 2048]
    - [591, 0.0]
  - - [512, 3459, 1, 2048]
    - [598, 0.0]
  - - [512, 3460, 1, 2048]
    - [591, 0.0]
  - - [512, 3461, 1, 2048]
    - [591, 0.0]
  - - [512, 3462, 1, 2048]
    - [597, 0.0]
  - - [512, 3466, 1, 2048]
    - [598, 0.0]
  - - [512, 3471, 1, 2048]
    - [598, 0.0]
  - - [512, 3472, 1, 2048]
    - [590, 0.0]
  - - [512, 3475, 1, 2048]
    - [598, 0.0]
  - - [512, 3476, 1, 2048]
    - [591, 0.0]
  - - [512, 3479, 1, 2048]
    - [597, 0.0]
  - - [512, 3480, 1, 2048]
    - [598, 0.0]
  - - [512, 3481, 1, 2048]
    - [597, 0.0]
  - - [512, 3483, 1, 2048]
    - [591, 0.0]
  - - [512, 3484, 1, 2048]
    - [590, 0.0]
  - - [512, 3487, 1, 2048]
    - [592, 0.0]
  - - [512, 3489, 1, 2048]
    - [591, 0.0]
  - - [512, 3490, 1, 2048]
    - [597, 0.0]
  - - [512, 3491, 1, 2048]
    - [599, 0.0]
  - - [512, 3493, 1, 2048]
    - [598, 0.0]
  - - [512, 3494, 1, 2048]
    - [597, 0.0]
  - - [512, 3497, 1, 2048]
    - [597, 0.0]
  - - [512, 3498, 1, 2048]
    - [592, 0.0]
  - - [512, 3499, 1, 2048]
    - [599, 0.0]
  - - [512, 3501, 1, 2048]
    - [586, 0.0]
  - - [512, 3503, 1, 2048]
    - [592, 0.0]
  - - [512, 3508, 1, 2048]
    - [597, 0.0]
  - - [512, 3509, 1, 2048]
    - [590, 0.0]
  - - [512, 3511, 1, 2048]
    - [592, 0.0]
  - - [512, 3514, 1, 2048]
    - [595, 0.0]
  - - [512, 3518, 1, 2048]
    - [597, 0.0]
  - - [512, 3519, 1, 2048]
    - [590, 0.0]
  - - [512, 3520, 1, 2048]
    - [590, 0.0]
  - - [512, 3523, 1, 2048]
    - [595, 0.0]
  - - [512, 3528, 1, 2048]
    - [592, 0.0]
  - - [512, 3529, 1, 2048]
    - [590, 0.0]
  - - [512, 3530, 1, 2048]
    - [595, 0.0]
  - - [512, 3532, 1, 2048]
    - [590, 0.0]
  - - [512, 3533, 1, 2048]
    - [597, 0.0]
  - - [512, 3534, 1, 2048]
    - [597, 0.0]
  - - [512, 3538, 1, 2048]
    - [594, 0.0]
  - - [512, 3539, 1, 2048]
    - [584, 0.0]
  - - [512, 3541, 1, 2048]
    - [584, 0.0]
  - - [512, 3547, 1, 2048]
    - [585, 0.0]
  - - [512, 3548, 1, 2048]
    - [594, 0.0]
  - - [512, 3552, 1, 2048]
    - [592, 0.0]
  - - [512, 3564, 1, 2048]
    - [584, 0.0]
  - - [512, 3575, 1, 2048]
    - [585, 0.0]
  - - [512, 3598, 1, 2048]
    - [598, 0.0]
  - - [512, 3599, 1, 2048]
    - [591, 0.0]
  - - [512, 3608, 1, 2048]
    - [592, 0.0]
  - - [512, 3780, 1, 512]
    - [600, 0.0]
  - - [512, 3780, 1, 2048]
    - [590, 0.0]
  - - [512, 3796, 1, 512]
    - [601, 0.0]
  - - [512, 3796, 1, 2048]
    - [590, 0.0]
  - - [512, 3822, 1, 512]
    - [602, 0.0]
  - - [512, 3822, 1, 2048]
    - [597, 0.0]
  - - [512, 3840, 1, 512]
    - [603, 0.0]
  - - [512, 3840, 1, 2048]
    - [594, 0.0]
  - - [512, 3859, 1, 512]
    - [600, 0.0]
  - - [512, 3859, 1, 2048]
    - [587, 0.0]
  - - [512, 3870, 1, 512]
    - [603, 0.0]
  - - [512, 3870, 1, 2048]
    - [587, 0.0]
  - - [512, 3876, 1, 512]
    - [600, 0.0]
  - - [512, 3876, 1, 2048]
    - [583, 0.0]
  - - [512, 3906, 1, 512]
    - [604, 0.0]
  - - [512, 3906, 1, 2048]
    - [583, 0.0]
  - - [512, 3910, 1, 512]
    - [603, 0.0]
  - - [512, 3910, 1, 2048]
    - [583, 0.0]
  - - [512, 3925, 1, 512]
    - [602, 0.0]
  - - [512, 3925, 1, 2048]
    - [587, 0.0]
  - - [512, 3927, 1, 512]
    - [602, 0.0]
  - - [512, 3942, 1, 512]
    - [605, 0.0]
  - - [512, 3942, 1, 2048]
    - [587, 0.0]
  - - [512, 3944, 1, 512]
    - [606, 0.0]
  - - [512, 3944, 1, 2048]
    - [587, 0.0]
  - - [512, 3955, 1, 512]
    - [603, 0.0]
  - - [512, 3955, 1, 2048]
    - [587, 0.0]
  - - [512, 3968, 1, 512]
    - [602, 0.0]
  - - [512, 3968, 1, 2048]
    - [596, 0.0]
  - - [512, 3969, 1, 512]
    - [602, 0.0]
  - - [512, 3969, 1, 2048]
    - [583, 0.0]
  - - [512, 3976, 1, 512]
    - [605, 0.0]
  - - [512, 3976, 1, 2048]
    - [583, 0.0]
  - - [512, 3977, 1, 512]
    - [600, 0.0]
  - - [512, 3977, 1, 2048]
    - [607, 0.0]
  - - [512, 3978, 1, 512]
    - [602, 0.0]
  - - [512, 3978, 1, 2048]
    - [587, 0.0]
  - - [512, 3990, 1, 512]
    - [605, 0.0]
  - - [512, 3990, 1, 2048]
    - [587, 0.0]
  - - [512, 3995, 1, 512]
    - [600, 0.0]
  - - [512, 3995, 1, 2048]
    - [583, 0.0]
  - - [512, 3996, 1, 512]
    - [604, 0.0]
  - - [512, 3996, 1, 2048]
    - [587, 0.0]
  - - [512, 3999, 1, 512]
    - [602, 0.0]
  - - [512, 3999, 1, 2048]
    - [587, 0.0]
  - - [512, 4005, 1, 512]
    - [605, 0.0]
  - - [512, 4005, 1, 2048]
    - [583, 0.0]
  - - [512, 4012, 1, 512]
    - [604, 0.0]
  - - [512, 4012, 1, 2048]
    - [587, 0.0]
  - - [512, 4020, 1, 512]
    - [603, 0.0]
  - - [512, 4020, 1, 2048]
    - [587, 0.0]
  - - [512, 4026, 1, 512]
    - [602, 0.0]
  - - [512, 4026, 1, 2048]
    - [587, 0.0]
  - - [512, 4030, 1, 512]
    - [602, 0.0]
  - - [512, 4030, 1, 2048]
    - [587, 0.0]
  - - [512, 4032, 1, 512]
    - [604, 0.0]
  - - [512, 4032, 1, 2048]
    - [583, 0.0]
  - - [512, 4050, 1, 512]
    - [603, 0.0]
  - - [512, 4059, 1, 512]
    - [600, 0.0]
  - - [2048, 2790, 1, 512]
    - [587, 0.0]
  - - [2048, 3092, 1, 512]
    - [608, 0.0]
  - - [2048, 3113, 1, 512]
    - [609, 0.0]
  - - [2048, 3137, 1, 512]
    - [610, 0.0]
  - - [2048, 3165, 1, 512]
    - [611, 0.0]
  - - [2048, 3166, 1, 512]
    - [609, 0.0]
  - - [2048, 3194, 1, 512]
    - [612, 0.0]
  - - [2048, 3219, 1, 512]
    - [611, 0.0]
  - - [2048, 3222, 1, 512]
    - [613, 0.0]
  - - [2048, 3234, 1, 512]
    - [608, 0.0]
  - - [2048, 3237, 1, 512]
    - [612, 0.0]
  - - [2048, 3242, 1, 512]
    - [614, 0.0]
  - - [2048, 3246, 1, 512]
    - [615, 0.0]
  - - [2048, 3249, 1, 512]
    - [613, 0.0]
  - - [2048, 3251, 1, 512]
    - [608, 0.0]
  - - [2048, 3257, 1, 512]
    - [612, 0.0]
  - - [2048, 3262, 1, 512]
    - [612, 0.0]
  - - [2048, 3268, 1, 512]
    - [583, 0.0]
  - - [2048, 3282, 1, 512]
    - [583, 0.0]
  - - [2048, 3286, 1, 512]
    - [587, 0.0]
  - - [2048, 3293, 1, 512]
    - [587, 0.0]
  - - [2048, 3297, 1, 512]
    - [587, 0.0]
  - - [2048, 3307, 1, 512]
    - [587, 0.0]
  - - [2048, 3314, 1, 512]
    - [587, 0.0]
  - - [2048, 3315, 1, 512]
    - [587, 0.0]
  - - [2048, 3319, 1, 512]
    - [587, 0.0]
  - - [2048, 3322, 1, 512]
    - [583, 0.0]
  - - [2048, 3323, 1, 512]
    - [587, 0.0]
  - - [2048, 3324, 1, 512]
    - [587, 0.0]
  - - [2048, 3325, 1, 512]
    - [583, 0.0]
  - - [2048, 3327, 1, 512]
    - [583, 0.0]
  - - [2048, 3329, 1, 512]
    - [616, 0.0]
  - - [2048, 3332, 1, 512]
    - [617, 0.0]
  - - [2048, 3336, 1, 512]
    - [614, 0.0]
  - - [2048, 3339, 1, 512]
    - [618, 0.0]
  - - [2048, 3342, 1, 512]
    - [614, 0.0]
  - - [2048, 3344, 1, 512]
    - [618, 0.0]
  - - [2048, 3358, 1, 512]
    - [618, 0.0]
  - - [2048, 3360, 1, 512]
    - [614, 0.0]
  - - [2048, 3364, 1, 512]
    - [614, 0.0]
  - - [2048, 3365, 1, 512]
    - [618, 0.0]
  - - [2048, 3369, 1, 512]
    - [614, 0.0]
  - - [2048, 3371, 1, 512]
    - [616, 0.0]
  - - [2048, 3374, 1, 512]
    - [619, 0.0]
  - - [2048, 3376, 1, 512]
    - [614, 0.0]
  - - [2048, 3377, 1, 512]
    - [617, 0.0]
  - - [2048, 3378, 1, 512]
    - [618, 0.0]
  - - [2048, 3381, 1, 512]
    - [614, 0.0]
  - - [2048, 3382, 1, 512]
    - [612, 0.0]
  - - [2048, 3383, 1, 512]
    - [616, 0.0]
  - - [2048, 3384, 1, 512]
    - [614, 0.0]
  - - [2048, 3385, 1, 512]
    - [614, 0.0]
  - - [2048, 3386, 1, 512]
    - [617, 0.0]
  - - [2048, 3388, 1, 512]
    - [618, 0.0]
  - - [2048, 3390, 1, 512]
    - [614, 0.0]
  - - [2048, 3391, 1, 512]
    - [615, 0.0]
  - - [2048, 3396, 1, 512]
    - [614, 0.0]
  - - [2048, 3399, 1, 512]
    - [614, 0.0]
  - - [2048, 3402, 1, 512]
    - [616, 0.0]
  - - [2048, 3410, 1, 512]
    - [617, 0.0]
  - - [2048, 3414, 1, 512]
    - [616, 0.0]
  - - [2048, 3415, 1, 512]
    - [616, 0.0]
  - - [2048, 3418, 1, 512]
    - [619, 0.0]
  - - [2048, 3420, 1, 512]
    - [618, 0.0]
  - - [2048, 3422, 1, 512]
    - [614, 0.0]
  - - [2048, 3425, 1, 512]
    - [616, 0.0]
  - - [2048, 3426, 1, 512]
    - [609, 0.0]
  - - [2048, 3427, 1, 512]
    - [614, 0.0]
  - - [2048, 3428, 1, 512]
    - [617, 0.0]
  - - [2048, 3430, 1, 512]
    - [608, 0.0]
  - - [2048, 3431, 1, 512]
    - [616, 0.0]
  - - [2048, 3432, 1, 512]
    - [617, 0.0]
  - - [2048, 3438, 1, 512]
    - [616, 0.0]
  - - [2048, 3439, 1, 512]
    - [618, 0.0]
  - - [2048, 3440, 1, 512]
    - [618, 0.0]
  - - [2048, 3443, 1, 512]
    - [617, 0.0]
  - - [2048, 3445, 1, 512]
    - [617, 0.0]
  - - [2048, 3447, 1, 512]
    - [618, 0.0]
  - - [2048, 3448, 1, 512]
    - [618, 0.0]
  - - [2048, 3450, 1, 512]
    - [615, 0.0]
  - - [2048, 3451, 1, 512]
    - [617, 0.0]
  - - [2048, 3452, 1, 512]
    - [616, 0.0]
  - - [2048, 3453, 1, 512]
    - [615, 0.0]
  - - [2048, 3455, 1, 512]
    - [617, 0.0]
  - - [2048, 3457, 1, 512]
    - [608, 0.0]
  - - [2048, 3458, 1, 512]
    - [608, 0.0]
  - - [2048, 3459, 1, 512]
    - [615, 0.0]
  - - [2048, 3460, 1, 512]
    - [618, 0.0]
  - - [2048, 3461, 1, 512]
    - [609, 0.0]
  - - [2048, 3462, 1, 512]
    - [617, 0.0]
  - - [2048, 3467, 1, 512]
    - [609, 0.0]
  - - [2048, 3468, 1, 512]
    - [608, 0.0]
  - - [2048, 3470, 1, 512]
    - [616, 0.0]
  - - [2048, 3471, 1, 512]
    - [616, 0.0]
  - - [2048, 3472, 1, 512]
    - [609, 0.0]
  - - [2048, 3475, 1, 512]
    - [609, 0.0]
  - - [2048, 3477, 1, 512]
    - [609, 0.0]
  - - [2048, 3478, 1, 512]
    - [617, 0.0]
  - - [2048, 3479, 1, 512]
    - [617, 0.0]
  - - [2048, 3480, 1, 512]
    - [617, 0.0]
  - - [2048, 3481, 1, 512]
    - [609, 0.0]
  - - [2048, 3483, 1, 512]
    - [616, 0.0]
  - - [2048, 3484, 1, 512]
    - [619, 0.0]
  - - [2048, 3487, 1, 512]
    - [617, 0.0]
  - - [2048, 3489, 1, 512]
    - [609, 0.0]
  - - [2048, 3490, 1, 512]
    - [616, 0.0]
  - - [2048, 3491, 1, 512]
    - [609, 0.0]
  - - [2048, 3493, 1, 512]
    - [616, 0.0]
  - - [2048, 3494, 1, 512]
    - [608, 0.0]
  - - [2048, 3495, 1, 512]
    - [609, 0.0]
  - - [2048, 3497, 1, 512]
    - [617, 0.0]
  - - [2048, 3498, 1, 512]
    - [619, 0.0]
  - - [2048, 3499, 1, 512]
    - [617, 0.0]
  - - [2048, 3501, 1, 512]
    - [619, 0.0]
  - - [2048, 3503, 1, 512]
    - [616, 0.0]
  - - [2048, 3507, 1, 512]
    - [608, 0.0]
  - - [2048, 3508, 1, 512]
    - [615, 0.0]
  - - [2048, 3509, 1, 512]
    - [616, 0.0]
  - - [2048, 3511, 1, 512]
    - [619, 0.0]
  - - [2048, 3514, 1, 512]
    - [617, 0.0]
  - - [2048, 3515, 1, 512]
    - [609, 0.0]
  - - [2048, 3517, 1, 512]
    - [609, 0.0]
  - - [2048, 3518, 1, 512]
    - [619, 0.0]
  - - [2048, 3519, 1, 512]
    - [617, 0.0]
  - - [2048, 3520, 1, 512]
    - [609, 0.0]
  - - [2048, 3523, 1, 512]
    - [609, 0.0]
  - - [2048, 3528, 1, 512]
    - [609, 0.0]
  - - [2048, 3529, 1, 512]
    - [609, 0.0]
  - - [2048, 3530, 1, 512]
    - [616, 0.0]
  - - [2048, 3532, 1, 512]
    - [608, 0.0]
  - - [2048, 3533, 1, 512]
    - [615, 0.0]
  - - [2048, 3534, 1, 512]
    - [619, 0.0]
  - - [2048, 3538, 1, 512]
    - [609, 0.0]
  - - [2048, 3539, 1, 512]
    - [615, 0.0]
  - - [2048, 3541, 1, 512]
    - [608, 0.0]
  - - [2048, 3547, 1, 512]
    - [615, 0.0]
  - - [2048, 3548, 1, 512]
    - [619, 0.0]
  - - [2048, 3552, 1, 512]
    - [608, 0.0]
  - - [2048, 3564, 1, 512]
    - [617, 0.0]
  - - [2048, 3575, 1, 512]
    - [615, 0.0]
  - - [2048, 3598, 1, 512]
    - [620, 0.0]
  - - [2048, 3599, 1, 512]
    - [621, 0.0]
  - - [2048, 3608, 1, 512]
    - [622, 0.0]
  - - [2048, 3780, 1, 512]
    - [623, 0.0]
  - - [2048, 3796, 1, 512]
    - [624, 0.0]
  - - [2048, 3822, 1, 512]
    - [621, 0.0]
  - - [2048, 3840, 1, 512]
    - [620, 0.0]
  - - [2048, 3859, 1, 512]
    - [614, 0.0]
  - - [2048, 3870, 1, 512]
    - [614, 0.0]
  - - [2048, 3876, 1, 512]
    - [625, 0.0]
  - - [2048, 3906, 1, 512]
    - [614, 0.0]
  - - [2048, 3910, 1, 512]
    - [618, 0.0]
  - - [2048, 3925, 1, 512]
    - [612, 0.0]
  - - [2048, 3942, 1, 512]
    - [612, 0.0]
  - - [2048, 3944, 1, 512]
    - [614, 0.0]
  - - [2048, 3955, 1, 512]
    - [618, 0.0]
  - - [2048, 3968, 1, 512]
    - [618, 0.0]
  - - [2048, 3969, 1, 512]
    - [614, 0.0]
  - - [2048, 3976, 1, 512]
    - [626, 0.0]
  - - [2048, 3977, 1, 512]
    - [614, 0.0]
  - - [2048, 3978, 1, 512]
    - [614, 0.0]
  - - [2048, 3990, 1, 512]
    - [611, 0.0]
  - - [2048, 3995, 1, 512]
    - [611, 0.0]
  - - [2048, 3996, 1, 512]
    - [625, 0.0]
  - - [2048, 4005, 1, 512]
    - [614, 0.0]
  - - [2048, 4012, 1, 512]
    - [611, 0.0]
  - - [2048, 4020, 1, 512]
    - [625, 0.0]
  - - [2048, 4026, 1, 512]
    - [612, 0.0]
  - - [2048, 4030, 1, 512]
    - [611, 0.0]
  - - [2048, 4032, 1, 512]
    - [612, 0.0]
  - - [33708, 184, 1, 512]
    - [610, 0.0]
  - - [33708, 208, 1, 512]
    - [612, 0.0]
  - - [33708, 246, 1, 512]
    - [626, 0.0]
  - - [33708, 264, 1, 512]
    - [618, 0.0]
  - - [33708, 465, 1, 512]
    - [618, 0.0]
  - - [33708, 468, 1, 512]
    - [614, 0.0]
  - - [33708, 493, 1, 512]
    - [626, 0.0]
  - - [33708, 540, 1, 512]
    - [618, 0.0]
  - - [33708, 550, 1, 512]
    - [618, 0.0]
  - - [33708, 560, 1, 512]
    - [618, 0.0]
  - - [33708, 644, 1, 512]
    - [614, 0.0]
  - - [33708, 714, 1, 512]
    - [603, 0.0]
  - - [33708, 720, 1, 512]
    - [602, 0.0]
  - - [33708, 781, 1, 512]
    - [609, 0.0]
  - - [33708, 936, 1, 512]
    - [618, 0.0]
  - - [33708, 980, 1, 512]
    - [618, 0.0]
  - - [33708, 1232, 1, 512]
    - [603, 0.0]
  - - [33708, 1290, 1, 512]
    - [616, 0.0]
  - - [33708, 1350, 1, 512]
    - [616, 0.0]
  - - [33708, 1424, 1, 512]
    - [614, 0.0]
  - - [33708, 1458, 1, 512]
    - [617, 0.0]
  - - [33708, 1462, 1, 512]
    - [618, 0.0]
  - - [33708, 1520, 1, 512]
    - [615, 0.0]
  - - [33708, 1596, 1, 512]
    - [609, 0.0]
  - - [33708, 1599, 1, 512]
    - [618, 0.0]
  - - [33708, 1615, 1, 512]
    - [627, 0.0]
  - - [33708, 1680, 1, 512]
    - [608, 0.0]
  - - [33708, 1917, 1, 512]
    - [627, 0.0]
  - - [33708, 2205, 1, 512]
    - [617, 0.0]
  - - [33708, 2418, 1, 512]
    - [627, 0.0]
  - - [33708, 3776, 1, 512]
    - [617, 0.0]
  - - [33708, 3780, 1, 512]
    - [628, 0.0]
  - - [33708, 3796, 1, 512]
    - [627, 0.0]
  - - [33708, 3822, 1, 512]
    - [628, 0.0]
  - - [33708, 3835, 1, 512]
    - [628, 0.0]
  - - [33708, 3840, 1, 512]
    - [627, 0.0]
  - - [33708, 3859, 1, 512]
    - [614, 0.0]
  - - [33708, 3870, 1, 512]
    - [608, 0.0]
  - - [33708, 3876, 1, 512]
    - [608, 0.0]
  - - [33708, 3906, 1, 512]
    - [628, 0.0]
  - - [33708, 3910, 1, 512]
    - [628, 0.0]
  - - [33708, 3925, 1, 512]
    - [628, 0.0]
  - - [33708, 3942, 1, 512]
    - [628, 0.0]
  - - [33708, 3944, 1, 512]
    - [627, 0.0]
  - - [33708, 3955, 1, 512]
    - [627, 0.0]
  - - [33708, 3968, 1, 512]
    - [627, 0.0]
  - - [33708, 3976, 1, 512]
    - [618, 0.0]
  - - [33708, 3977, 1, 512]
    - [608, 0.0]
  - - [33708, 3978, 1, 512]
    - [609, 0.0]
  - - [33708, 3990, 1, 512]
    - [608, 0.0]
  - - [33708, 3996, 1, 512]
    - [616, 0.0]
  - - [33708, 3999, 1, 512]
    - [608, 0.0]
  - - [33708, 4005, 1, 512]
    - [617, 0.0]
  - - [33708, 4012, 1, 512]
    - [609, 0.0]
  - - [33708, 4020, 1, 512]
    - [609, 0.0]
  - - [33708, 4026, 1, 512]
    - [614, 0.0]
  - - [33708, 4030, 1, 512]
    - [608, 0.0]
  - - [33708, 4032, 1, 512]
    - [618, 0.0]
  - - [2, 6, 1, 1024]
    - [629, 0.0]
  - - [2, 8, 1, 1024]
    - [629, 0.0]
  - - [3072, 512, 1, 3072]
    - [630, 0.0]
  - - [511, 8192, 1, 8192]
    - [631, 0.0]
  - - [512, 512, 1, 512]
    - [630, 0.0]
  - - [511, 2048, 1, 2048]
    - [631, 0.0]
  - - [4096, 4096, 1, 4096]
    - [630, 0.0]
  - - [1024, 512, 1, 1025]
    - [631, 0.0]
  - - [8192, 8193, 1, 8192]
    - [631, 0.0]
  - - [3072, 3072, 1, 3071]
    - [632, 0.0]
  - - [8192, 8192, 1, 8193]
    - [633, 0.0]
  - - [7681, 8192, 1, 8192]
    - [631, 0.0]
  - - [512, 1023, 1, 1024]
    - [631, 0.0]
  - - [7680, 8192, 1, 8193]
    - [634, 0.0]
  - - [513, 4096, 1, 4096]
    - [635, 0.0]
  - - [3073, 512, 1, 3072]
    - [631, 0.0]
  - - [7680, 8192, 1, 8192]
    - [630, 0.0]
  - - [4096, 4096, 1, 4097]
    - [632, 0.0]
  - - [1025, 1024, 1, 1024]
    - [631, 0.0]
  - - [8192, 8191, 1, 8192]
    - [631, 0.0]
  - - [8192, 512, 1, 8193]
    - [635, 0.0]
  - - [2880, 3071, 1, 3072]
    - [636, 0.0]
  - - [2048, 513, 1, 2048]
    - [631, 0.0]
  - - [1024, 1024, 1, 1025]
    - [631, 0.0]
  - - [960, 1024, 1, 1023]
    - [635, 0.0]
  - - [1024, 1024, 1, 1024]
    - [630, 0.0]
  - - [960, 1025, 1, 1024]
    - [631, 0.0]
  - - [2880, 3072, 1, 3072]
    - [630, 0.0]
  - - [4096, 511, 1, 4096]
    - [631, 0.0]
  - - [512, 3072, 1, 3072]
    - [630, 0.0]
  - - [2049, 512, 1, 2048]
    - [635, 0.0]
  - - [512, 8191, 1, 8192]
    - [631, 0.0]
  - - [513, 1024, 1, 1024]
    - [631, 0.0]
  - - [512, 2048, 1, 2048]
    - [630, 0.0]
  - - [4096, 4095, 1, 4096]
    - [631, 0.0]
  - - [8192, 511, 1, 8192]
    - [631, 0.0]
  - - [513, 512, 1, 512]
    - [637, 0.0]
  - - [1024, 511, 1, 1024]
    - [631, 0.0]
  - - [1024, 512, 1, 1023]
    - [631, 0.0]
  - - [960, 1024, 1, 1025]
    - [635, 0.0]
  - - [8192, 512, 1, 8192]
    - [630, 0.0]
  - - [959, 1024, 1, 1024]
    - [635, 0.0]
  - - [511, 3072, 1, 3072]
    - [631, 0.0]
  - - [7680, 8193, 1, 8192]
    - [631, 0.0]
  - - [2048, 2048, 1, 2048]
    - [630, 0.0]
  - - [2048, 512, 1, 2049]
    - [631, 0.0]
  - - [511, 1024, 1, 1024]
    - [631, 0.0]
  - - [3072, 512, 1, 3073]
    - [631, 0.0]
  - - [512, 2049, 1, 2048]
    - [631, 0.0]
  - - [513, 8192, 1, 8192]
    - [635, 0.0]
  - - [7679, 8192, 1, 8192]
    - [631, 0.0]
  - - [1024, 513, 1, 1024]
    - [631, 0.0]
  - - [3840, 4096, 1, 4097]
    - [634, 0.0]
  - - [2048, 512, 1, 2047]
    - [635, 0.0]
  - - [512, 3072, 1, 3071]
    - [631, 0.0]
  - - [7680, 8192, 1, 8191]
    - [634, 0.0]
  - - [3072, 511, 1, 3072]
    - [631, 0.0]
  - - [8193, 8192, 1, 8192]
    - [631, 0.0]
  - - [512, 4096, 1, 4095]
    - [631, 0.0]
  - - [512, 3071, 1, 3072]
    - [631, 0.0]
  - - [3073, 3072, 1, 3072]
    - [632, 0.0]
  - - [512, 3073, 1, 3072]
    - [631, 0.0]
  - - [4096, 4096, 1, 4095]
    - [632, 0.0]
  - - [1920, 2048, 1, 2047]
    - [632, 0.0]
  - - [1920, 2049, 1, 2048]
    - [631, 0.0]
  - - [512, 8192, 1, 8191]
    - [631, 0.0]
  - - [3840, 4096, 1, 4096]
    - [630, 0.0]
  - - [8191, 512, 1, 8192]
    - [631, 0.0]
  - - [1025, 512, 1, 1024]
    - [631, 0.0]
  - - [2881, 3072, 1, 3072]
    - [631, 0.0]
  - - [512, 4096, 1, 4096]
    - [630, 0.0]
  - - [1024, 1024, 1, 1023]
    - [631, 0.0]
  - - [513, 2048, 1, 2048]
    - [635, 0.0]
  - - [3841, 4096, 1, 4096]
    - [632, 0.0]
  - - [2880, 3072, 1, 3073]
    - [636, 0.0]
  - - [512, 512, 1, 513]
    - [637, 0.0]
  - - [4095, 512, 1, 4096]
    - [631, 0.0]
  - - [1919, 2048, 1, 2048]
    - [632, 0.0]
  - - [1024, 1025, 1, 1024]
    - [631, 0.0]
  - - [1920, 2048, 1, 2048]
    - [630, 0.0]
  - - [8192, 8192, 1, 8192]
    - [630, 0.0]
  - - [512, 2048, 1, 2049]
    - [631, 0.0]
  - - [511, 4096, 1, 4096]
    - [631, 0.0]
  - - [8192, 513, 1, 8192]
    - [631, 0.0]
  - - [513, 3072, 1, 3072]
    - [631, 0.0]
  - - [7680, 8191, 1, 8192]
    - [631, 0.0]
  - - [512, 4097, 1, 4096]
    - [631, 0.0]
  - - [512, 512, 1, 511]
    - [637, 0.0]
  - - [2047, 2048, 1, 2048]
    - [635, 0.0]
  - - [1024, 1023, 1, 1024]
    - [631, 0.0]
  - - [2049, 2048, 1, 2048]
    - [632, 0.0]
  - - [3840, 4095, 1, 4096]
    - [632, 0.0]
  - - [960, 1023, 1, 1024]
    - [635, 0.0]
  - - [2880, 3072, 1, 3071]
    - [636, 0.0]
  - - [3072, 3072, 1, 3073]
    - [632, 0.0]
  - - [2880, 3073, 1, 3072]
    - [631, 0.0]
  - - [2048, 511, 1, 2048]
    - [631, 0.0]
  - - [4096, 513, 1, 4096]
    - [631, 0.0]
  - - [4097, 512, 1, 4096]
    - [631, 0.0]
  - - [8192, 512, 1, 8191]
    - [635, 0.0]
  - - [1921, 2048, 1, 2048]
    - [635, 0.0]
  - - [512, 3072, 1, 3073]
    - [631, 0.0]
  - - [2048, 2049, 1, 2048]
    - [631, 0.0]
  - - [3072, 512, 1, 3071]
    - [631, 0.0]
  - - [3071, 3072, 1, 3072]
    - [632, 0.0]
  - - [3840, 4097, 1, 4096]
    - [631, 0.0]
  - - [1023, 512, 1, 1024]
    - [635, 0.0]
  - - [2048, 2047, 1, 2048]
    - [631, 0.0]
  - - [2047, 512, 1, 2048]
    - [635, 0.0]
  - - [2879, 3072, 1, 3072]
    - [636, 0.0]
  - - [3072, 513, 1, 3072]
    - [631, 0.0]
  - - [512, 1024, 1, 1024]
    - [630, 0.0]
  - - [512, 4095, 1, 4096]
    - [631, 0.0]
  - - [512, 1024, 1, 1025]
    - [631, 0.0]
  - - [3071, 512, 1, 3072]
    - [631, 0.0]
  - - [512, 513, 1, 512]
    - [637, 0.0]
  - - [512, 511, 1, 512]
    - [638, 0.0]
  - - [4096, 512, 1, 4096]
    - [630, 0.0]
  - - [4097, 4096, 1, 4096]
    - [632, 0.0]
  - - [2048, 2048, 1, 2047]
    - [632, 0.0]
  - - [3839, 4096, 1, 4096]
    - [632, 0.0]
  - - [512, 4096, 1, 4097]
    - [631, 0.0]
  - - [3072, 3073, 1, 3072]
    - [632, 0.0]
  - - [512, 2047, 1, 2048]
    - [631, 0.0]
  - - [2048, 2048, 1, 2049]
    - [631, 0.0]
  - - [8191, 8192, 1, 8192]
    - [631, 0.0]
  - - [3072, 3071, 1, 3072]
    - [631, 0.0]
  - - [4096, 512, 1, 4097]
    - [631, 0.0]
  - - [3840, 4096, 1, 4095]
    - [634, 0.0]
  - - [1920, 2047, 1, 2048]
    - [632, 0.0]
  - - [512, 1025, 1, 1024]
    - [631, 0.0]
  - - [8192, 8192, 1, 8191]
    - [633, 0.0]
  - - [512, 2048, 1, 2047]
    - [635, 0.0]
  - - [3072, 3072, 1, 3072]
    - [630, 0.0]
  - - [512, 8193, 1, 8192]
    - [631, 0.0]
  - - [511, 512, 1, 512]
    - [637, 0.0]
  - - [4096, 512, 1, 4095]
    - [635, 0.0]
  - - [960, 1024, 1, 1024]
    - [630, 0.0]
  - - [8193, 512, 1, 8192]
    - [631, 0.0]
  - - [961, 1024, 1, 1024]
    - [631, 0.0]
  - - [512, 1024, 1, 1023]
    - [635, 0.0]
  - - [4095, 4096, 1, 4096]
    - [631, 0.0]
  - - [4096, 4097, 1, 4096]
    - [631, 0.0]
  - - [512, 8192, 1, 8192]
    - [630, 0.0]
  - - [512, 8192, 1, 8193]
    - [631, 0.0]
  - - [1023, 1024, 1, 1024]
    - [631, 0.0]
  - - [1920, 2048, 1, 2049]
    - [632, 0.0]
  - - [479, 512, 1, 512]
    - [639, 0.0]
  - - [479, 1024, 1, 1024]
    - [640, 0.0]
  - - [479, 2048, 1, 2048]
    - [640, 0.0]
  - - [479, 3072, 1, 3072]
    - [641, 0.0]
  - - [479, 4096, 1, 4096]
    - [641, 0.0]
  - - [479, 8192, 1, 8192]
    - [642, 0.0]
  - - [480, 511, 1, 512]
    - [639, 0.0]
  - - [480, 512, 1, 511]
    - [639, 0.0]
  - - [480, 512, 1, 513]
    - [639, 0.0]
  - - [480, 513, 1, 512]
    - [639, 0.0]
  - - [480, 1023, 1, 1024]
    - [641, 0.0]
  - - [480, 1024, 1, 1023]
    - [640, 0.0]
  - - [480, 1024, 1, 1025]
    - [641, 0.0]
  - - [480, 1025, 1, 1024]
    - [641, 0.0]
  - - [480, 2047, 1, 2048]
    - [640, 0.0]
  - - [480, 2048, 1, 2047]
    - [643, 0.0]
  - - [480, 2048, 1, 2049]
    - [640, 0.0]
  - - [480, 2049, 1, 2048]
    - [640, 0.0]
  - - [480, 3071, 1, 3072]
    - [640, 0.0]
  - - [480, 3072, 1, 3071]
    - [640, 0.0]
  - - [480, 3072, 1, 3073]
    - [641, 0.0]
  - - [480, 3073, 1, 3072]
    - [641, 0.0]
  - - [480, 4095, 1, 4096]
    - [640, 0.0]
  - - [480, 4096, 1, 4095]
    - [640, 0.0]
  - - [480, 4096, 1, 4097]
    - [640, 0.0]
  - - [480, 4097, 1, 4096]
    - [641, 0.0]
  - - [480, 8191, 1, 8192]
    - [643, 0.0]
  - - [480, 8192, 1, 8191]
    - [644, 0.0]
  - - [480, 8192, 1, 8193]
    - [645, 0.0]
  - - [480, 8193, 1, 8192]
    - [642, 0.0]
  - - [481, 512, 1, 512]
    - [646, 0.0]
  - - [481, 1024, 1, 1024]
    - [641, 0.0]
  - - [481, 2048, 1, 2048]
    - [640, 0.0]
  - - [481, 3072, 1, 3072]
    - [641, 0.0]
  - - [481, 4096, 1, 4096]
    - [641, 0.0]
  - - [481, 8192, 1, 8192]
    - [643, 0.0]
  - - [511, 480, 1, 512]
    - [646, 0.0]
  - - [512, 479, 1, 512]
    - [646, 0.0]
  - - [512, 480, 1, 511]
    - [639, 0.0]
  - - [512, 480, 1, 513]
    - [639, 0.0]
  - - [512, 481, 1, 512]
    - [646, 0.0]
  - - [513, 480, 1, 512]
    - [639, 0.0]
  - - [1023, 480, 1, 1024]
    - [641, 0.0]
  - - [1024, 479, 1, 1024]
    - [641, 0.0]
  - - [1024, 480, 1, 1023]
    - [641, 0.0]
  - - [1024, 480, 1, 1025]
    - [641, 0.0]
  - - [1024, 481, 1, 1024]
    - [641, 0.0]
  - - [1025, 480, 1, 1024]
    - [640, 0.0]
  - - [2047, 480, 1, 2048]
    - [640, 0.0]
  - - [2048, 479, 1, 2048]
    - [642, 0.0]
  - - [2048, 480, 1, 2047]
    - [640, 0.0]
  - - [2048, 480, 1, 2049]
    - [642, 0.0]
  - - [2048, 481, 1, 2048]
    - [641, 0.0]
  - - [2049, 480, 1, 2048]
    - [643, 0.0]
  - - [3071, 480, 1, 3072]
    - [640, 0.0]
  - - [3072, 479, 1, 3072]
    - [640, 0.0]
  - - [3072, 480, 1, 3071]
    - [641, 0.0]
  - - [3072, 480, 1, 3073]
    - [640, 0.0]
  - - [3072, 481, 1, 3072]
    - [640, 0.0]
  - - [3073, 480, 1, 3072]
    - [647, 0.0]
  - - [480, 512, 1, 512]
    - [648, 0.0]
  - - [480, 1024, 1, 1024]
    - [774, 48.434]
  - - [480, 2048, 1, 2048]
    - [775, 72.885]
  - - [480, 3072, 1, 3072]
    - [648, 0.0]
  - - [480, 4096, 1, 4096]
    - [648, 0.0]
  - - [480, 8192, 1, 8192]
    - [648, 0.0]
  - - [512, 480, 1, 512]
    - [649, 0.0]
  - - [1024, 480, 1, 1024]
    - [776, 51.761]
  - - [2048, 480, 1, 2048]
    - [777, 72.674]
  - - [3072, 480, 1, 3072]
    - [649, 0.0]
  - - [4096, 480, 1, 4096]
    - [650, 0.0]
  - - [8192, 480, 1, 8192]
    - [651, 0.0]
  - - [1024, 3840, 1, 1024]
    - [652, 0.0]
  - - [1024, 3840, 1, 4096]
    - [653, 0.0]
  - - [1024, 3968, 1, 1024]
    - [654, 0.0]
  - - [1024, 3968, 1, 4096]
    - [655, 0.0]
  - - [1024, 7200, 1, 1024]
    - [656, 0.0]
  - - [1024, 7200, 1, 4096]
    - [657, 0.0]
  - - [1024, 8160, 1, 1024]
    - [658, 0.0]
  - - [1024, 8160, 1, 4096]
    - [655, 0.0]
  - - [1024, 9520, 1, 1024]
    - [659, 0.0]
  - - [1024, 9520, 1, 4096]
    - [660, 0.0]
  - - [1024, 10200, 1, 1024]
    - [661, 0.0]
  - - [1024, 10200, 1, 4096]
    - [662, 0.0]
  - - [4096, 3840, 1, 1024]
    - [663, 0.0]
  - - [4096, 3968, 1, 1024]
    - [664, 0.0]
  - - [4096, 7200, 1, 1024]
    - [665, 0.0]
  - - [4096, 8160, 1, 1024]
    - [767, 82.968]
  - - [4096, 9520, 1, 1024]
    - [766, 85.594]
  - - [4096, 10200, 1, 1024]
    - [666, 0.0]
  - - [42720, 3968, 1, 1024]
    - [667, 0.0]
  - - [42720, 7200, 1, 1024]
    - [668, 0.0]
  - - [42720, 9520, 1, 1024]
    - [669, 0.0]
  - - [14, 14, 1, 64]
    - [670, 0.0]
  - - [15, 14, 1, 64]
    - [671, 0.0]
  - - [15, 15, 1, 64]
    - [672, 0.0]
  - - [17, 15, 1, 64]
    - [673, 0.0]
  - - [17, 17, 1, 64]
    - [673, 0.0]
  - - [30, 30, 1, 64]
    - [674, 0.0]
  - - [30, 31, 1, 64]
    - [675, 0.0]
  - - [31, 31, 1, 64]
    - [676, 0.0]
  - - [1024, 32, 1, 1024]
    - [677, 0.0]
  - - [2, 32, 1, 1024]
    - [678, 0.0]
  - - [2, 4, 1, 1024]
    - [679, 0.0]
  - - [512, 512, 1, 64]
    - [688, 9.335]
  - - [64, 512, 1, 512]
    - [689, 0.0]
  - - [1024, 512, 1, 2048]
    - [690, 34.02]
  - - [1024, 960, 1, 1024]
    - [690, 57.94]
  - - [1024, 960, 1, 1024]
    - [691, 58.471]
  - - [1024, 960, 1, 1600]
    - [692, 59.669]
  - - [64, 960, 1, 1024]
    - [693, 5.717]
  - - [2048, 960, 1, 2048]
    - [694, 76.194]
  - - [2048, 960, 1, 74]
    - [695, 25.634]
  - - [1024, 1024, 1, 960]
    - [691, 46.068]
  - - [1600, 1024, 1, 960]
    - [696, 62.354]
  - - [2048, 2048, 1, 960]
    - [697, 68.473]
  - - [4096, 1024, 1, 257]
    - [696, 46.959]
  - - [10240, 8976, 1, 256]
    - [698, 67.602]
