library/src/blas3/Tensile/Logic/asm_full/arcturus_Cijk_Alik_Bljk_BBH.yaml
- {MinimumRequiredVersion: 4.14.0}
- arcturus
- gfx908
- [Device 7380, Device 7388, Device 738c, Device 7390]
    SolutionIndex: 0
    SolutionNameMin: Cijk_Alik_Bljk_BBH_MT128x32x16_SE_
    SolutionIndex: 1
    SolutionNameMin: Cijk_Alik_Bljk_BBH_MT128x64x16_SE_
    SolutionIndex: 2
    SolutionNameMin: Cijk_Alik_Bljk_BBH_MT32x128x16_SE_
    SolutionIndex: 3
    SolutionNameMin: Cijk_Alik_Bljk_BBH_MT64x128x16_SE_
    SolutionIndex: 4
    SolutionNameMin: Cijk_Alik_Bljk_BBH_MT256x128x16_SE_
    SolutionIndex: 5
    SolutionNameMin: Cijk_Alik_Bljk_BBH_MT128x256x16_SE_
    SolutionIndex: 6
    SolutionNameMin: Cijk_Alik_Bljk_BBH_MT64x16x16_SE_
    SolutionIndex: 7
    SolutionNameMin: Cijk_Alik_Bljk_BBH_MT16x64x16_SE_
    SolutionIndex: 8
    SolutionNameMin: Cijk_Alik_Bljk_BBH_MT64x128x32_SE_
    SolutionIndex: 9
    SolutionNameMin: Cijk_Alik_Bljk_BBH_MT64x128x64_SE_
    SolutionIndex: 10
    SolutionNameMin: Cijk_Alik_Bljk_BBH_MT32x32x32_SE_
- - - [511, 512, 1, 512]
    - [0, 892.561]
  - - [2048, 2049, 1, 2048]
    - [1, 3453.91]
  - - [64, 1023, 1, 1024]
    - [6, 266.468]
  - - [961, 1024, 1, 1024]
    - [2, 2002.55]
  - - [4096, 4096, 1, 4096]
    - [8, 42006.8]
  - - [65, 1024, 1, 1024]
    - [7, 256.927]
  - - [8192, 8193, 1, 8192]
    - [4, 4257.31]
  - - [7680, 8191, 1, 8192]
    - [4, 4446.94]
  - - [8192, 8192, 1, 8193]
    - [4, 4479.14]
  - - [3840, 4097, 1, 4096]
    - [1, 3999.29]
  - - [1024, 1025, 1, 1024]
    - [0, 2111.41]
  - - [7680, 8192, 1, 8192]
    - [9, 44119.3]
  - - [512, 512, 1, 511]
    - [6, 882.215]
  - - [1025, 1024, 1, 1024]
    - [2, 2112.41]
  - - [959, 1024, 1, 1024]
    - [3, 2601.91]
  - - [1024, 1023, 1, 1024]
    - [0, 2107.95]
  - - [2047, 2048, 1, 2048]
    - [1, 3452.2]
  - - [2049, 2048, 1, 2048]
    - [1, 3450.69]
  - - [3840, 4096, 1, 4096]
    - [9, 41406.2]
  - - [2048, 2047, 1, 2048]
    - [1, 3444.44]
  - - [7681, 8192, 1, 8192]
    - [4, 4232.02]
  - - [960, 1023, 1, 1024]
    - [3, 2578.6]
  - - [1024, 1024, 1, 1025]
    - [0, 2128.47]
  - - [64, 1024, 1, 1023]
    - [6, 267.148]
  - - [3072, 3072, 1, 3072]
    - [8, 39592.4]
  - - [960, 1025, 1, 1024]
    - [0, 1940.11]
  - - [3072, 3071, 1, 3072]
    - [1, 4121.44]
  - - [1920, 2047, 1, 2048]
    - [5, 4269.83]
  - - [4096, 4097, 1, 4096]
    - [1, 4019.99]
  - - [960, 1024, 1, 1025]
    - [3, 2580.46]
  - - [8191, 8192, 1, 8192]
    - [4, 4280.14]
  - - [1921, 2048, 1, 2048]
    - [1, 3236.48]
  - - [4096, 4095, 1, 4096]
    - [1, 4021.17]
  - - [1920, 2048, 1, 2049]
    - [5, 4367.8]
  - - [512, 512, 1, 512]
    - [8, 5555.37]
  - - [3072, 3072, 1, 3073]
    - [1, 4116.12]
  - - [3071, 3072, 1, 3072]
    - [1, 4122.76]
  - - [2880, 3073, 1, 3072]
    - [1, 3878.59]
  - - [8192, 8192, 1, 8191]
    - [4, 4476.16]
  - - [2880, 3072, 1, 3073]
    - [3, 4121.14]
  - - [2880, 3072, 1, 3072]
    - [9, 42366.8]
  - - [63, 1024, 1, 1024]
    - [6, 261.067]
  - - [1920, 2049, 1, 2048]
    - [1, 3253.62]
  - - [960, 1024, 1, 1024]
    - [9, 26772.2]
  - - [7680, 8193, 1, 8192]
    - [4, 4255.26]
  - - [1920, 2048, 1, 2048]
    - [9, 40185.0]
  - - [4096, 4096, 1, 4097]
    - [1, 4073.2]
  - - [2048, 2048, 1, 2048]
    - [8, 34261.1]
  - - [3072, 3072, 1, 3071]
    - [1, 4106.96]
  - - [3840, 4095, 1, 4096]
    - [4, 4405.39]
  - - [3840, 4096, 1, 4097]
    - [4, 4650.42]
  - - [3841, 4096, 1, 4096]
    - [1, 3990.06]
  - - [2048, 2048, 1, 2047]
    - [1, 3440.47]
  - - [3839, 4096, 1, 4096]
    - [4, 4420.56]
  - - [64, 1025, 1, 1024]
    - [6, 267.585]
  - - [7680, 8192, 1, 8193]
    - [4, 4709.65]
  - - [3072, 3073, 1, 3072]
    - [1, 4125.86]
  - - [1919, 2048, 1, 2048]
    - [5, 4269.15]
  - - [8193, 8192, 1, 8192]
    - [4, 4262.93]
  - - [2879, 3072, 1, 3072]
    - [3, 4126.63]
  - - [8192, 8192, 1, 8192]
    - [8, 44226.9]
  - - [4095, 4096, 1, 4096]
    - [1, 4021.3]
  - - [7680, 8192, 1, 8191]
    - [4, 4710.51]
  - - [2880, 3071, 1, 3072]
    - [3, 4117.71]
  - - [4097, 4096, 1, 4096]
    - [1, 4015.15]
  - - [3840, 4096, 1, 4095]
    - [4, 4662.91]
  - - [512, 511, 1, 512]
    - [0, 897.826]
  - - [3073, 3072, 1, 3072]
    - [1, 4132.87]
  - - [4096, 4096, 1, 4095]
    - [4, 3980.47]
  - - [1024, 1024, 1, 1023]
    - [2, 2110.94]
  - - [1024, 1024, 1, 1024]
    - [8, 20397.8]
  - - [512, 513, 1, 512]
    - [0, 904.249]
  - - [7679, 8192, 1, 8192]
    - [4, 4462.87]
  - - [960, 1024, 1, 1023]
    - [3, 2570.16]
  - - [513, 512, 1, 512]
    - [0, 898.93]
  - - [8192, 8191, 1, 8192]
    - [4, 4275.5]
  - - [2881, 3072, 1, 3072]
    - [1, 3885.28]
  - - [64, 1024, 1, 1025]
    - [6, 266.396]
  - - [64, 1024, 1, 1024]
    - [10, 3165.51]
  - - [1920, 2048, 1, 2047]
    - [5, 4447.83]
  - - [2880, 3072, 1, 3071]
    - [1, 3865.66]
  - - [2048, 2048, 1, 2049]
    - [1, 3477.95]
  - - [1023, 1024, 1, 1024]
    - [2, 2106.96]
  - - [512, 512, 1, 513]
    - [0, 881.026]
- null
