library/src/blas3/Tensile/Logic/asm_full/arcturus_Cijk_Ailk_Bjlk_HBH.yaml
- {MinimumRequiredVersion: 4.6.0}
- arcturus
- gfx908
- [Device 7380, Device 7388, Device 738c, Device 7390, Device 731f]
    SolutionIndex: 0
    SolutionNameMin: Cijk_Ailk_Bjlk_HBH_MT016x016x08_PGR1_PLR1_TT02_02
    SolutionIndex: 1
    SolutionNameMin: Cijk_Ailk_Bjlk_HBH_MT016x016x16_PGR1_PLR1_TT02_02
    SolutionIndex: 2
    SolutionNameMin: Cijk_Ailk_Bjlk_HBH_MT032x016x16_PGR1_PLR1_TT04_02
    SolutionIndex: 3
    SolutionNameMin: Cijk_Ailk_Bjlk_HBH_MT016x016x24_PGR1_PLR1_TT02_02
    SolutionIndex: 4
    SolutionNameMin: Cijk_Ailk_Bjlk_HBH_MT032x016x24_PGR1_PLR1_TT04_02
    SolutionIndex: 5
    SolutionNameMin: Cijk_Ailk_Bjlk_HBH_MT016x016x32_PGR1_PLR1_TT02_02
    SolutionIndex: 6
    SolutionNameMin: Cijk_Ailk_Bjlk_HBH_MT032x016x32_PGR1_PLR1_TT02_02
    SolutionIndex: 7
    SolutionNameMin: Cijk_Ailk_Bjlk_HBH_MT064x016x32_PGR1_PLR1_TT02_02
    SolutionIndex: 8
    SolutionNameMin: Cijk_Ailk_Bjlk_HBH_MT016x016x32_PGR1_PLR1_TT02_02
    SolutionIndex: 9
    SolutionNameMin: Cijk_Ailk_Bjlk_HBH_MT064x016x32_PGR1_PLR1_TT02_02
    SolutionIndex: 10
    SolutionNameMin: Cijk_Ailk_Bjlk_HBH_MT016x016x64_PGR1_PLR1_TT02_02
    SolutionIndex: 11
    SolutionNameMin: Cijk_Ailk_Bjlk_HBH_MT032x016x64_PGR1_PLR1_TT02_02
    SolutionIndex: 12
    SolutionNameMin: Cijk_Ailk_Bjlk_HBH_MT064x016x64_PGR1_PLR1_TT02_02
    SolutionIndex: 13
    SolutionNameMin: Cijk_Ailk_Bjlk_HBH_MT016x016x64_PGR1_PLR1_TT02_02
    SolutionIndex: 14
    SolutionNameMin: Cijk_Ailk_Bjlk_HBH_MT032x016x64_PGR1_PLR1_TT02_02
    SolutionIndex: 15
    SolutionNameMin: Cijk_Ailk_Bjlk_HBH_MT032x032x08_PGR1_PLR1_TT02_02
    SolutionIndex: 16
    SolutionNameMin: Cijk_Ailk_Bjlk_HBH_MT032x032x16_PGR1_PLR1_TT02_02
    SolutionIndex: 17
    SolutionNameMin: Cijk_Ailk_Bjlk_HBH_MT032x032x32_PGR1_PLR1_TT02_02
    SolutionIndex: 18
    SolutionNameMin: Cijk_Ailk_Bjlk_HBH_MT032x032x64_PGR1_PLR1_TT02_02
    SolutionIndex: 19
    SolutionNameMin: Cijk_Ailk_Bjlk_HBH_MT064x064x04_PGR0_PLR1_TT04_04
    SolutionIndex: 20
    SolutionNameMin: Cijk_Ailk_Bjlk_HBH_MT064x064x04_PGR1_PLR1_TT04_04
    SolutionIndex: 21
    SolutionNameMin: Cijk_Ailk_Bjlk_HBH_MT064x064x08_PGR0_PLR1_TT04_04
    SolutionIndex: 22
    SolutionNameMin: Cijk_Ailk_Bjlk_HBH_MT064x064x16_PGR1_PLR1_TT04_04
    SolutionIndex: 23
    SolutionNameMin: Cijk_Ailk_Bjlk_HBH_MT032x032x08_PGR1_PLR1_TT04_04
    SolutionIndex: 24
    SolutionNameMin: Cijk_Ailk_Bjlk_HBH_MT064x064x08_PGR1_PLR1_TT08_08
    SolutionIndex: 25
    SolutionNameMin: Cijk_Ailk_Bjlk_HBH_MT032x032x16_PGR1_PLR1_TT04_04
    SolutionIndex: 26
    SolutionNameMin: Cijk_Ailk_Bjlk_HBH_MT064x032x16_PGR1_PLR1_TT04_04
    SolutionIndex: 27
    SolutionNameMin: Cijk_Ailk_Bjlk_HBH_MT032x032x16_PGR1_PLR1_TT04_04
    SolutionIndex: 28
    SolutionNameMin: Cijk_Ailk_Bjlk_HBH_MT064x032x16_PGR1_PLR1_TT04_04
    SolutionIndex: 29
    SolutionNameMin: Cijk_Ailk_Bjlk_HBH_MT032x032x32_PGR1_PLR1_TT04_04
    SolutionIndex: 30
    SolutionNameMin: Cijk_Ailk_Bjlk_HBH_MT064x032x32_PGR1_PLR1_TT04_04
    SolutionIndex: 31
    SolutionNameMin: Cijk_Ailk_Bjlk_HBH_MT128x032x32_PGR1_PLR1_TT04_04
    SolutionIndex: 32
    SolutionNameMin: Cijk_Ailk_Bjlk_HBH_MT128x016x32_PGR1_PLR1_TT04_04
    SolutionIndex: 33
    SolutionNameMin: Cijk_Ailk_Bjlk_HBH_MT032x032x32_PGR1_PLR1_TT04_04
    SolutionIndex: 34
    SolutionNameMin: Cijk_Ailk_Bjlk_HBH_MT064x032x32_PGR1_PLR1_TT04_04
    SolutionIndex: 35
    SolutionNameMin: Cijk_Ailk_Bjlk_HBH_MT128x032x32_PGR1_PLR1_TT04_04
    SolutionIndex: 36
    SolutionNameMin: Cijk_Ailk_Bjlk_HBH_MT128x016x32_PGR1_PLR1_TT04_04
    SolutionIndex: 37
    SolutionNameMin: Cijk_Ailk_Bjlk_HBH_MT032x032x64_PGR1_PLR1_TT04_04
    SolutionIndex: 38
    SolutionNameMin: Cijk_Ailk_Bjlk_HBH_MT032x032x64_PGR1_PLR1_TT04_04
    SolutionIndex: 39
    SolutionNameMin: Cijk_Ailk_Bjlk_HBH_MT064x032x64_PGR1_PLR1_TT04_04
    SolutionIndex: 40
    SolutionNameMin: Cijk_Ailk_Bjlk_HBH_MT064x064x08_PGR1_PLR1_TT08_08
    SolutionIndex: 41
    SolutionNameMin: Cijk_Ailk_Bjlk_HBH_MT064x064x16_PGR1_PLR1_TT08_08
    SolutionIndex: 42
    SolutionNameMin: Cijk_Ailk_Bjlk_HBH_MT064x064x16_PGR1_PLR1_TT08_08
    SolutionIndex: 43
    SolutionNameMin: Cijk_Ailk_Bjlk_HBH_MT128x064x32_PGR1_PLR1_TT08_08
    SolutionIndex: 44
    SolutionNameMin: Cijk_Ailk_Bjlk_HBH_MT064x064x16_PGR1_PLR1_TT04_04
    SolutionIndex: 45
    SolutionNameMin: Cijk_Ailk_Bjlk_HBH_MT064x128x16_PGR1_PLR1_TT04_08
    SolutionIndex: 46
    SolutionNameMin: Cijk_Ailk_Bjlk_HBH_MT128x064x16_PGR1_PLR1_TT08_04
    SolutionIndex: 47
    SolutionNameMin: Cijk_Ailk_Bjlk_HBH_MT128x128x16_PGR1_PLR1_TT08_08
    SolutionIndex: 48
    SolutionNameMin: Cijk_Ailk_Bjlk_HBH_MT064x064x32_PGR1_PLR1_TT04_04
    SolutionIndex: 49
    SolutionNameMin: Cijk_Ailk_Bjlk_HBH_MT064x128x32_PGR1_PLR1_TT04_08
    SolutionIndex: 50
    SolutionNameMin: Cijk_Ailk_Bjlk_HBH_MT128x064x32_PGR1_PLR1_TT08_04
    SolutionIndex: 51
    SolutionNameMin: Cijk_Ailk_Bjlk_HBH_MT128x128x32_PGR1_PLR1_TT08_08
    SolutionIndex: 52
    SolutionNameMin: Cijk_Ailk_Bjlk_HBH_MT064x064x16_PGR1_PLR1_TT04_04
    SolutionIndex: 53
    SolutionNameMin: Cijk_Ailk_Bjlk_HBH_MT064x064x32_PGR1_PLR1_TT04_04
    SolutionIndex: 54
    SolutionNameMin: Cijk_Ailk_Bjlk_HBH_MT064x064x64_PGR1_PLR1_TT04_04
    SolutionIndex: 55
    SolutionNameMin: Cijk_Ailk_Bjlk_HBH_MT064x128x04_PGR0_PLR0_TT04_08
    SolutionIndex: 56
    SolutionNameMin: Cijk_Ailk_Bjlk_HBH_MT064x064x04_PGR1_PLR0_TT04_04
    SolutionIndex: 57
    SolutionNameMin: Cijk_Ailk_Bjlk_HBH_MT128x128x04_PGR1_PLR1_TT08_08
    SolutionIndex: 58
    SolutionNameMin: Cijk_Ailk_Bjlk_HBH_MT128x128x08_PGR0_PLR0_TT08_08
    SolutionIndex: 59
    SolutionNameMin: Cijk_Ailk_Bjlk_HBH_MT064x064x08_PGR0_PLR0_TT04_04
    SolutionIndex: 60
    SolutionNameMin: Cijk_Ailk_Bjlk_HBH_MT064x128x08_PGR1_PLR0_TT04_08
    SolutionIndex: 61
    SolutionNameMin: Cijk_Ailk_Bjlk_HBH_MT064x064x08_PGR1_PLR0_TT04_04
    SolutionIndex: 62
    SolutionNameMin: Cijk_Ailk_Bjlk_HBH_MT064x128x08_PGR0_PLR1_TT04_08
    SolutionIndex: 63
    SolutionNameMin: Cijk_Ailk_Bjlk_HBH_MT064x064x08_PGR0_PLR1_TT04_04
    SolutionIndex: 64
    SolutionNameMin: Cijk_Ailk_Bjlk_HBH_MT064x128x08_PGR1_PLR1_TT04_08
    SolutionIndex: 65
    SolutionNameMin: Cijk_Ailk_Bjlk_HBH_MT064x064x08_PGR1_PLR1_TT04_04
    SolutionIndex: 66
    SolutionNameMin: Cijk_Ailk_Bjlk_HBH_MT064x128x16_PGR0_PLR0_TT04_08
    SolutionIndex: 67
    SolutionNameMin: Cijk_Ailk_Bjlk_HBH_MT064x064x16_PGR0_PLR0_TT04_04
    SolutionIndex: 68
    SolutionNameMin: Cijk_Ailk_Bjlk_HBH_MT064x064x16_PGR1_PLR0_TT04_04
    SolutionIndex: 69
    SolutionNameMin: Cijk_Ailk_Bjlk_HBH_MT064x128x16_PGR0_PLR1_TT04_08
    SolutionIndex: 70
    SolutionNameMin: Cijk_Ailk_Bjlk_HBH_MT064x064x16_PGR0_PLR1_TT04_04
    SolutionIndex: 71
    SolutionNameMin: Cijk_Ailk_Bjlk_HBH_MT064x128x16_PGR1_PLR1_TT04_08
    SolutionIndex: 72
    SolutionNameMin: Cijk_Ailk_Bjlk_HBH_MT064x064x16_PGR1_PLR1_TT04_04
    SolutionIndex: 73
    SolutionNameMin: Cijk_Ailk_Bjlk_HBH_MT128x128x04_PGR0_PLR0_TT08_08
    SolutionIndex: 74
    SolutionNameMin: Cijk_Ailk_Bjlk_HBH_MT064x128x04_PGR0_PLR0_TT04_08
    SolutionIndex: 75
    SolutionNameMin: Cijk_Ailk_Bjlk_HBH_MT064x064x04_PGR0_PLR0_TT04_04
    SolutionIndex: 76
    SolutionNameMin: Cijk_Ailk_Bjlk_HBH_MT128x128x04_PGR1_PLR0_TT08_08
    SolutionIndex: 77
    SolutionNameMin: Cijk_Ailk_Bjlk_HBH_MT064x128x04_PGR1_PLR0_TT04_08
    SolutionIndex: 78
    SolutionNameMin: Cijk_Ailk_Bjlk_HBH_MT064x064x04_PGR1_PLR0_TT04_04
    SolutionIndex: 79
    SolutionNameMin: Cijk_Ailk_Bjlk_HBH_MT128x128x04_PGR0_PLR1_TT08_08
    SolutionIndex: 80
    SolutionNameMin: Cijk_Ailk_Bjlk_HBH_MT064x128x04_PGR0_PLR1_TT04_08
    SolutionIndex: 81
    SolutionNameMin: Cijk_Ailk_Bjlk_HBH_MT064x064x04_PGR0_PLR1_TT04_04
    SolutionIndex: 82
    SolutionNameMin: Cijk_Ailk_Bjlk_HBH_MT128x128x04_PGR1_PLR1_TT08_08
    SolutionIndex: 83
    SolutionNameMin: Cijk_Ailk_Bjlk_HBH_MT064x128x04_PGR1_PLR1_TT04_08
    SolutionIndex: 84
    SolutionNameMin: Cijk_Ailk_Bjlk_HBH_MT064x064x04_PGR1_PLR1_TT04_04
    SolutionIndex: 85
    SolutionNameMin: Cijk_Ailk_Bjlk_HBH_MT064x128x08_PGR0_PLR0_TT04_08
    SolutionIndex: 86
    SolutionNameMin: Cijk_Ailk_Bjlk_HBH_MT064x064x08_PGR0_PLR0_TT04_04
    SolutionIndex: 87
    SolutionNameMin: Cijk_Ailk_Bjlk_HBH_MT064x064x08_PGR1_PLR0_TT04_04
    SolutionIndex: 88
    SolutionNameMin: Cijk_Ailk_Bjlk_HBH_MT128x128x08_PGR0_PLR1_TT08_08
    SolutionIndex: 89
    SolutionNameMin: Cijk_Ailk_Bjlk_HBH_MT064x128x08_PGR0_PLR1_TT04_08
    SolutionIndex: 90
    SolutionNameMin: Cijk_Ailk_Bjlk_HBH_MT064x064x08_PGR0_PLR1_TT04_04
    SolutionIndex: 91
    SolutionNameMin: Cijk_Ailk_Bjlk_HBH_MT064x128x08_PGR1_PLR1_TT04_08
    SolutionIndex: 92
    SolutionNameMin: Cijk_Ailk_Bjlk_HBH_MT064x064x08_PGR1_PLR1_TT04_04
    SolutionIndex: 93
    SolutionNameMin: Cijk_Ailk_Bjlk_HBH_MT064x064x16_PGR0_PLR0_TT04_04
    SolutionIndex: 94
    SolutionNameMin: Cijk_Ailk_Bjlk_HBH_MT064x064x16_PGR1_PLR0_TT04_04
    SolutionIndex: 95
    SolutionNameMin: Cijk_Ailk_Bjlk_HBH_MT064x128x16_PGR0_PLR1_TT04_08
    SolutionIndex: 96
    SolutionNameMin: Cijk_Ailk_Bjlk_HBH_MT064x064x16_PGR0_PLR1_TT04_04
    SolutionIndex: 97
    SolutionNameMin: Cijk_Ailk_Bjlk_HBH_MT064x064x16_PGR1_PLR1_TT04_04
    SolutionIndex: 98
    SolutionNameMin: Cijk_Ailk_Bjlk_HBH_MT064x128x16_EPS1_GRVW04_PGR1_PLR1_SNLL1_TT08_04_VW04_WG08_32_01_WGM01
    SolutionIndex: 99
    SolutionNameMin: Cijk_Ailk_Bjlk_HBH_MT128x128x16_EPS1_GRVW04_PGR1_PLR1_SNLL1_TT08_08_VW04_WG16_16_01_WGM01
    SolutionIndex: 100
    SolutionNameMin: Cijk_Ailk_Bjlk_HBH_MT064x128x16_EPS1_GRVW04_PGR1_PLR1_SNLL1_TT08_04_VW04_WG08_32_01_WGM08
    SolutionIndex: 101
    SolutionNameMin: Cijk_Ailk_Bjlk_HBH_MT128x064x16_EPS1_GRVW04_PGR1_PLR1_SNLL1_TT08_04_VW04_WG16_16_01_WGM08
    SolutionIndex: 102
    SolutionNameMin: Cijk_Ailk_Bjlk_HBH_MT128x128x16_EPS1_GRVW04_PGR1_PLR1_SNLL1_TT08_08_VW04_WG16_16_01_WGM08
    SolutionIndex: 103
    SolutionNameMin: Cijk_Ailk_Bjlk_HBH_MT128x064x16_EPS1_GRVW04_PGR1_PLR1_SNLL1_TT08_04_VW04_WG16_16_01_WGM64
    SolutionIndex: 104
    SolutionNameMin: Cijk_Ailk_Bjlk_HBH_MT064x064x32_EPS0_GRVW04_PGR0_PLR0_SNLL0_TT04_04_VW04_WG16_16_01_WGM01
    SolutionIndex: 105
    SolutionNameMin: Cijk_Ailk_Bjlk_HBH_MT128x064x16_EPS1_GRVW08_PGR1_PLR1_SNLL1_TT08_08_VW08_WG16_08_01_WGM64
    SolutionIndex: 106
    SolutionNameMin: Cijk_Ailk_Bjlk_HBH_MT128x128x32_EPS1_GRVW08_PGR1_PLR1_SNLL1_TT08_08_VW08_WG16_16_01_WGM64
    SolutionIndex: 107
    SolutionNameMin: Cijk_Ailk_Bjlk_HBH_MT64x128x16_MI32x32x4x2_SE_AF0EM1_ASEM1_ONLL0_SNLL1
    SolutionIndex: 108
    SolutionNameMin: Cijk_Ailk_Bjlk_HBH_MT64x128x16_MI32x32x4x2_SE_AF0EM1_ASEM2_ONLL0_SNLL1
    SolutionIndex: 109
    SolutionNameMin: Cijk_Ailk_Bjlk_HBH_MT64x128x16_MI32x32x4x2_SE_AF0EM2_ASEM1_ONLL0_SNLL1
    SolutionIndex: 110
    SolutionNameMin: Cijk_Ailk_Bjlk_HBH_MT64x128x16_MI32x32x4x2_SE_AF0EM2_ASEM2_ONLL0_SNLL1
    SolutionIndex: 111
    SolutionNameMin: Cijk_Ailk_Bjlk_HBH_MT64x128x32_MI32x32x4x2_SE_AF0EM2_ASEM2_ONLL0_SNLL1
    SolutionIndex: 112
    SolutionNameMin: Cijk_Ailk_Bjlk_HBH_MT64x128x8_MI32x32x4x2_SE_AF0EM1_ASEM1_ONLL0_SNLL0
    SolutionIndex: 113
    SolutionNameMin: Cijk_Ailk_Bjlk_HBH_MT32x256x16_MI32x32x4x2_SE_AF0EM2_ASEM1_ONLL0_SNLL0
    SolutionIndex: 114
    SolutionNameMin: Cijk_Ailk_Bjlk_HBH_MT32x256x16_MI32x32x4x2_SE_AF0EM2_ASEM2_ONLL0_SNLL0
    SolutionIndex: 115
    SolutionNameMin: Cijk_Ailk_Bjlk_HBH_MT64x128x16_MI32x32x4x2_SE_AF0EM1_ASEM1_ONLL0_SNLL0
    SolutionIndex: 116
    SolutionNameMin: Cijk_Ailk_Bjlk_HBH_MT64x128x16_MI32x32x4x2_SE_AF0EM1_ASEM2_ONLL0_SNLL0
    SolutionIndex: 117
    SolutionNameMin: Cijk_Ailk_Bjlk_HBH_MT64x128x16_MI32x32x4x2_SE_AF0EM2_ASEM1_ONLL0_SNLL0
    SolutionIndex: 118
    SolutionNameMin: Cijk_Ailk_Bjlk_HBH_MT64x128x16_MI32x32x4x2_SE_AF0EM2_ASEM2_ONLL0_SNLL0
    SolutionIndex: 119
    SolutionNameMin: Cijk_Ailk_Bjlk_HBH_MT64x128x32_MI32x32x4x2_SE_AF0EM2_ASEM1_ONLL0_SNLL0
    SolutionIndex: 120
    SolutionNameMin: Cijk_Ailk_Bjlk_HBH_MT64x128x32_MI32x32x4x2_SE_AF0EM2_ASEM2_ONLL0_SNLL0
    SolutionIndex: 121
    SolutionNameMin: Cijk_Ailk_Bjlk_HBH_MT64x128x16_MI32x32x4x2_SE_AF0EM1_ASEM1_ONLL1_SNLL1
    SolutionIndex: 122
    SolutionNameMin: Cijk_Ailk_Bjlk_HBH_MT64x128x16_MI32x32x4x2_SE_AF0EM1_ASEM2_ONLL1_SNLL1
    SolutionIndex: 123
    SolutionNameMin: Cijk_Ailk_Bjlk_HBH_MT64x128x16_MI32x32x4x2_SE_AF0EM2_ASEM1_ONLL1_SNLL1
    SolutionIndex: 124
    SolutionNameMin: Cijk_Ailk_Bjlk_HBH_MT64x128x16_MI32x32x4x2_SE_AF0EM2_ASEM2_ONLL1_SNLL1
    SolutionIndex: 125
    SolutionNameMin: Cijk_Ailk_Bjlk_HBH_MT64x128x32_MI32x32x4x2_SE_AF0EM2_ASEM1_ONLL1_SNLL1
    SolutionIndex: 126
    SolutionNameMin: Cijk_Ailk_Bjlk_HBH_MT64x128x8_MI32x32x4x2_SE_AF0EM1_ASEM1_ONLL1_SNLL0
    SolutionIndex: 127
    SolutionNameMin: Cijk_Ailk_Bjlk_HBH_MT32x256x16_MI32x32x4x2_SE_AF0EM1_ASEM1_ONLL1_SNLL0
    SolutionIndex: 128
    SolutionNameMin: Cijk_Ailk_Bjlk_HBH_MT64x128x16_MI32x32x4x2_SE_AF0EM1_ASEM1_ONLL1_SNLL0
    SolutionIndex: 129
    SolutionNameMin: Cijk_Ailk_Bjlk_HBH_MT64x128x16_MI32x32x4x2_SE_AF0EM2_ASEM1_ONLL1_SNLL0
    SolutionIndex: 130
    SolutionNameMin: Cijk_Ailk_Bjlk_HBH_MT64x128x16_MI32x32x4x2_SE_AF0EM2_ASEM2_ONLL1_SNLL0
    SolutionIndex: 131
    SolutionNameMin: Cijk_Ailk_Bjlk_HBH_MT64x128x32_MI32x32x4x2_SE_AF0EM2_ASEM1_ONLL1_SNLL0
    SolutionIndex: 132
    SolutionNameMin: Cijk_Ailk_Bjlk_HBH_MT64x128x32_MI32x32x4x2_SE_AF0EM2_ASEM2_ONLL1_SNLL0
    SolutionIndex: 133
    SolutionNameMin: Cijk_Ailk_Bjlk_HBH_MT64x256x16_MI32x32x4x2_SE_AF0EM1_ASEM1_ONLL0_SNLL1
    SolutionIndex: 134
    SolutionNameMin: Cijk_Ailk_Bjlk_HBH_MT64x256x16_MI32x32x4x2_SE_AF0EM1_ASEM2_ONLL0_SNLL1
    SolutionIndex: 135
    SolutionNameMin: Cijk_Ailk_Bjlk_HBH_MT64x256x16_MI32x32x4x2_SE_AF0EM2_ASEM1_ONLL0_SNLL1
    SolutionIndex: 136
    SolutionNameMin: Cijk_Ailk_Bjlk_HBH_MT64x256x16_MI32x32x4x2_SE_AF0EM2_ASEM2_ONLL0_SNLL1
    SolutionIndex: 137
    SolutionNameMin: Cijk_Ailk_Bjlk_HBH_MT64x256x8_MI32x32x4x2_SE_AF0EM1_ASEM2_ONLL0_SNLL0
    SolutionIndex: 138
    SolutionNameMin: Cijk_Ailk_Bjlk_HBH_MT64x256x16_MI32x32x4x2_SE_AF0EM1_ASEM1_ONLL0_SNLL0
    SolutionIndex: 139
    SolutionNameMin: Cijk_Ailk_Bjlk_HBH_MT64x256x16_MI32x32x4x2_SE_AF0EM1_ASEM2_ONLL0_SNLL0
    SolutionIndex: 140
    SolutionIndex: 141
    SolutionIndex: 142
    SolutionIndex: 143
    SolutionIndex: 144
    SolutionIndex: 145
    SolutionIndex: 146
    SolutionIndex: 147
    SolutionIndex: 148
    SolutionIndex: 149
    SolutionIndex: 150
    SolutionIndex: 151
    SolutionIndex: 152
    SolutionIndex: 153
    SolutionIndex: 154
    SolutionIndex: 155
    SolutionIndex: 156
    SolutionIndex: 157
    SolutionIndex: 158
    SolutionIndex: 159
    SolutionIndex: 160
    SolutionIndex: 161
    SolutionIndex: 162
    SolutionIndex: 163
    SolutionIndex: 164
    SolutionIndex: 165
    SolutionIndex: 166
    SolutionIndex: 167
    SolutionIndex: 168
    SolutionIndex: 169
    SolutionIndex: 170
    SolutionIndex: 171
    SolutionIndex: 172
    SolutionIndex: 173
    SolutionIndex: 174
    SolutionIndex: 175
    SolutionIndex: 176
    SolutionIndex: 177
    SolutionIndex: 178
    SolutionIndex: 179
    SolutionIndex: 180
    SolutionIndex: 181
    SolutionIndex: 182
    SolutionIndex: 183
    SolutionIndex: 184
    SolutionIndex: 185
    SolutionIndex: 186
    SolutionIndex: 187
    SolutionIndex: 188
    SolutionIndex: 189
    SolutionIndex: 190
    SolutionIndex: 191
    SolutionIndex: 192
    SolutionIndex: 193
    SolutionIndex: 194
    SolutionIndex: 195
    SolutionIndex: 196
    SolutionIndex: 197
    SolutionIndex: 198
    SolutionIndex: 199
    SolutionIndex: 200
    SolutionIndex: 201
    SolutionIndex: 202
    SolutionIndex: 203
    SolutionIndex: 204
    SolutionIndex: 205
    SolutionIndex: 206
    SolutionIndex: 207
    SolutionIndex: 208
    SolutionIndex: 209
    SolutionIndex: 210
    SolutionIndex: 211
    SolutionIndex: 212
    SolutionIndex: 213
    SolutionIndex: 214
    SolutionIndex: 215
    SolutionIndex: 216
    SolutionIndex: 217
    SolutionIndex: 218
    SolutionIndex: 219
    SolutionIndex: 220
    SolutionIndex: 221
    SolutionIndex: 222
    SolutionIndex: 223
    SolutionIndex: 224
    SolutionIndex: 225
    SolutionIndex: 226
    SolutionIndex: 227
    SolutionIndex: 228
    SolutionIndex: 229
    SolutionIndex: 230
    SolutionIndex: 231
    SolutionIndex: 232
    SolutionIndex: 233
    SolutionIndex: 234
    SolutionIndex: 235
    SolutionIndex: 236
    SolutionIndex: 237
    SolutionIndex: 238
    SolutionIndex: 239
    SolutionIndex: 240
    SolutionIndex: 241
    SolutionIndex: 242
    SolutionIndex: 243
    SolutionIndex: 244
    SolutionIndex: 245
    SolutionIndex: 246
    SolutionIndex: 247
    SolutionIndex: 248
    SolutionIndex: 249
    SolutionIndex: 250
    SolutionIndex: 251
    SolutionIndex: 252
    SolutionIndex: 253
    SolutionIndex: 254
    SolutionIndex: 255
    SolutionIndex: 256
    SolutionIndex: 257
    SolutionIndex: 258
    SolutionIndex: 259
    SolutionIndex: 260
    SolutionIndex: 261
    SolutionIndex: 262
    SolutionIndex: 263
    SolutionIndex: 264
    SolutionIndex: 265
    SolutionIndex: 266
    SolutionIndex: 267
    SolutionIndex: 268
    SolutionIndex: 269
    SolutionIndex: 270
    SolutionIndex: 271
    SolutionIndex: 272
    SolutionIndex: 273
    SolutionIndex: 274
    SolutionIndex: 275
    SolutionIndex: 276
    SolutionIndex: 277
    SolutionIndex: 278
    SolutionIndex: 279
    SolutionIndex: 280
    SolutionIndex: 281
    SolutionIndex: 282
    SolutionIndex: 283
    SolutionIndex: 284
    SolutionIndex: 285
    SolutionIndex: 286
    SolutionIndex: 287
    SolutionIndex: 288
    SolutionIndex: 289
    SolutionIndex: 290
    SolutionIndex: 291
    SolutionIndex: 292
    SolutionIndex: 293
    SolutionIndex: 294
    SolutionIndex: 295
    SolutionIndex: 296
    SolutionIndex: 297
    SolutionIndex: 298
    SolutionIndex: 299
    SolutionIndex: 300
    SolutionIndex: 301
    SolutionIndex: 302
    SolutionIndex: 303
    SolutionIndex: 304
    SolutionIndex: 305
    SolutionIndex: 306
    SolutionIndex: 307
    SolutionIndex: 308
    SolutionIndex: 309
    SolutionIndex: 310
    SolutionIndex: 311
    SolutionIndex: 312
    SolutionIndex: 313
    SolutionIndex: 314
    SolutionIndex: 315
    SolutionIndex: 316
    SolutionIndex: 317
    SolutionIndex: 318
    SolutionIndex: 319
    SolutionIndex: 320
    SolutionIndex: 321
    SolutionIndex: 322
    SolutionIndex: 323
    SolutionIndex: 324
    SolutionIndex: 325
    SolutionIndex: 326
    SolutionIndex: 327
    SolutionIndex: 328
    SolutionIndex: 329
    SolutionIndex: 330
    SolutionIndex: 331
    SolutionIndex: 332
    SolutionIndex: 333
    SolutionIndex: 334
    SolutionIndex: 335
    SolutionIndex: 336
    SolutionIndex: 337
    SolutionIndex: 338
    SolutionIndex: 339
    SolutionIndex: 340
    SolutionIndex: 341
    SolutionIndex: 342
    SolutionIndex: 343
    SolutionIndex: 344
    SolutionIndex: 345
    SolutionIndex: 346
    SolutionIndex: 347
    SolutionIndex: 348
    SolutionIndex: 349
    SolutionIndex: 350
    SolutionIndex: 351
    SolutionIndex: 352
    SolutionIndex: 353
    SolutionIndex: 354
    SolutionIndex: 355
    SolutionIndex: 356
    SolutionIndex: 357
    SolutionIndex: 358
    SolutionIndex: 359
    SolutionIndex: 360
    SolutionIndex: 361
    SolutionIndex: 362
    SolutionIndex: 363
    SolutionIndex: 364
    SolutionIndex: 365
    SolutionIndex: 366
    SolutionIndex: 367
    SolutionIndex: 368
    SolutionIndex: 369
    SolutionIndex: 370
    SolutionIndex: 371
    SolutionIndex: 372
    SolutionIndex: 373
    SolutionIndex: 374
    SolutionIndex: 375
    SolutionIndex: 376
    SolutionIndex: 377
    SolutionIndex: 378
    SolutionIndex: 379
    SolutionIndex: 380
    SolutionIndex: 381
    SolutionIndex: 382
    SolutionIndex: 383
- - - [64, 448, 1, 3328]
    - [10, 1.084]
  - - [1, 64, 1, 256]
    - [20, 0.0]
  - - [3584, 64, 1, 1280]
    - [17, 4.354]
  - - [64, 128, 1, 256]
    - [1, 0.158]
  - - [64, 5888, 1, 1280]
    - [17, 5.261]
  - - [64, 4288, 1, 1280]
    - [18, 4.395]
  - - [3584, 64, 1, 3328]
    - [17, 4.663]
  - - [64, 1024, 1, 3328]
    - [18, 2.468]
  - - [1, 64, 1, 1280]
    - [22, 0.001]
  - - [704, 64, 1, 3328]
    - [10, 1.617]
  - - [64, 448, 1, 1280]
    - [6, 0.993]
  - - [64, 704, 1, 3328]
    - [11, 1.645]
  - - [64, 64, 1, 1280]
    - [9, 0.136]
  - - [64, 5056, 1, 256]
    - [0, 3.674]
  - - [64, 4288, 1, 3328]
    - [17, 4.673]
  - - [1856, 64, 1, 3328]
    - [18, 4.101]
  - - [1, 64, 1, 1]
    - [19, 0.0]
  - - [448, 64, 1, 1280]
    - [5, 0.993]
  - - [5888, 64, 1, 1280]
    - [17, 5.218]
  - - [2944, 64, 1, 256]
    - [1, 2.931]
  - - [64, 1856, 1, 256]
    - [12, 2.453]
  - - [64, 1024, 1, 1280]
    - [18, 2.295]
  - - [64, 256, 1, 1280]
    - [10, 0.582]
  - - [704, 64, 1, 1280]
    - [3, 1.405]
  - - [64, 128, 1, 1280]
    - [5, 0.264]
  - - [2368, 64, 1, 256]
    - [5, 2.593]
  - - [2368, 64, 1, 3328]
    - [18, 3.966]
  - - [64, 1408, 1, 3328]
    - [11, 3.118]
  - - [1856, 64, 1, 1280]
    - [18, 3.63]
  - - [64, 3584, 1, 1280]
    - [4, 4.504]
  - - [448, 64, 1, 3328]
    - [10, 1.085]
  - - [5888, 64, 1, 3328]
    - [17, 5.505]
  - - [128, 64, 1, 256]
    - [16, 0.158]
  - - [64, 128, 1, 3328]
    - [6, 0.295]
  - - [64, 256, 1, 3328]
    - [13, 0.619]
  - - [4288, 64, 1, 3328]
    - [17, 4.645]
  - - [64, 2944, 1, 256]
    - [16, 3.113]
  - - [6784, 64, 1, 256]
    - [17, 4.464]
  - - [1024, 64, 1, 1280]
    - [18, 2.336]
  - - [64, 2368, 1, 1280]
    - [6, 3.751]
  - - [64, 3584, 1, 3328]
    - [17, 4.657]
  - - [64, 6784, 1, 3328]
    - [17, 5.581]
  - - [3584, 64, 1, 256]
    - [17, 3.271]
  - - [64, 1856, 1, 3328]
    - [18, 4.079]
  - - [448, 64, 1, 256]
    - [5, 0.63]
  - - [64, 5056, 1, 3328]
    - [17, 5.401]
  - - [256, 64, 1, 256]
    - [1, 0.381]
  - - [4288, 64, 1, 1280]
    - [17, 4.516]
  - - [1, 1, 1, 1]
    - [21, 0.0]
  - - [5056, 64, 1, 1280]
    - [18, 5.161]
  - - [1024, 64, 1, 3328]
    - [17, 2.43]
  - - [1408, 64, 1, 256]
    - [16, 1.877]
  - - [64, 1408, 1, 256]
    - [7, 1.91]
  - - [64, 2368, 1, 3328]
    - [6, 3.973]
  - - [64, 448, 1, 256]
    - [5, 0.66]
  - - [64, 6784, 1, 1280]
    - [18, 5.345]
  - - [64, 1856, 1, 1280]
    - [14, 3.63]
  - - [64, 6784, 1, 256]
    - [17, 4.426]
  - - [64, 5056, 1, 1280]
    - [18, 5.047]
  - - [64, 4288, 1, 256]
    - [16, 3.497]
  - - [128, 64, 1, 1280]
    - [5, 0.258]
  - - [5888, 64, 1, 256]
    - [16, 3.858]
  - - [64, 5888, 1, 3328]
    - [17, 5.567]
  - - [64, 1024, 1, 256]
    - [11, 1.427]
  - - [5056, 64, 1, 3328]
    - [17, 5.504]
  - - [256, 64, 1, 1280]
    - [10, 0.574]
  - - [64, 256, 1, 256]
    - [5, 0.374]
  - - [704, 64, 1, 256]
    - [5, 0.981]
  - - [64, 1408, 1, 1280]
    - [18, 2.894]
  - - [1, 1, 1, 256]
    - [20, 0.0]
  - - [64, 704, 1, 256]
    - [8, 1.009]
  - - [64, 2944, 1, 3328]
    - [18, 4.919]
  - - [64, 64, 1, 256]
    - [1, 0.08]
  - - [1856, 64, 1, 256]
    - [17, 2.541]
  - - [128, 64, 1, 3328]
    - [17, 0.294]
  - - [2944, 64, 1, 1280]
    - [17, 4.434]
  - - [4288, 64, 1, 256]
    - [18, 3.424]
  - - [1, 1, 1, 1280]
    - [22, 0.0]
  - - [64, 2944, 1, 1280]
    - [18, 4.634]
  - - [1408, 64, 1, 1280]
    - [18, 2.902]
  - - [6784, 64, 1, 3328]
    - [17, 5.551]
  - - [1024, 64, 1, 256]
    - [18, 1.555]
  - - [64, 2368, 1, 256]
    - [7, 2.71]
  - - [64, 3584, 1, 256]
    - [2, 3.351]
  - - [2944, 64, 1, 3328]
    - [18, 4.911]
  - - [2368, 64, 1, 1280]
    - [5, 3.667]
  - - [256, 64, 1, 3328]
    - [10, 0.62]
  - - [64, 64, 1, 3328]
    - [17, 0.152]
  - - [1, 1, 1, 3328]
    - [22, 0.0]
  - - [64, 5888, 1, 256]
    - [17, 4.104]
  - - [64, 704, 1, 1280]
    - [13, 1.483]
  - - [6784, 64, 1, 1280]
    - [17, 5.269]
  - - [5056, 64, 1, 256]
    - [15, 3.461]
  - - [1408, 64, 1, 3328]
    - [18, 3.091]
  - - [4096, 7133, 1, 4096]
    - [47, 14.1]
  - - [512, 16, 1, 512]
    - [32, 0.198]
  - - [2048, 7133, 1, 2048]
    - [42, 13.977]
  - - [2560, 7133, 1, 2560]
    - [45, 13.724]
  - - [1024, 1024, 1, 1024]
    - [45, 10.77]
  - - [3072, 7435, 1, 1024]
    - [42, 13.851]
  - - [1024, 32, 1, 512]
    - [26, 0.674]
  - - [1760, 7133, 1, 1760]
    - [45, 13.094]
  - - [7680, 5481, 1, 2560]
    - [42, 13.968]
  - - [1024, 16, 1, 512]
    - [26, 0.333]
  - - [512, 32, 1, 512]
    - [31, 0.387]
  - - [3136, 256, 64, 64]
    - [99, 13.247]
  - - [784, 512, 64, 128]
    - [100, 14.103]
  - - [784, 128, 64, 512]
    - [98, 15.511]
  - - [3136, 64, 128, 64]
    - [104, 11.517]
  - - [196, 256, 128, 1024]
    - [99, 13.29]
  - - [196, 256, 64, 1024]
    - [99, 12.849]
  - - [196, 1024, 128, 256]
    - [99, 12.602]
  - - [784, 128, 256, 512]
    - [98, 16.038]
  - - [3136, 64, 64, 256]
    - [103, 14.939]
  - - [3136, 64, 256, 256]
    - [101, 15.705]
  - - [3136, 256, 256, 64]
    - [106, 14.128]
  - - [3136, 64, 128, 256]
    - [105, 15.605]
  - - [784, 128, 128, 512]
    - [98, 15.875]
  - - [784, 512, 128, 128]
    - [98, 14.414]
  - - [784, 512, 256, 128]
    - [100, 14.421]
  - - [196, 1024, 64, 256]
    - [99, 12.454]
  - - [3136, 64, 64, 64]
    - [104, 11.215]
  - - [196, 1024, 256, 256]
    - [102, 12.724]
  - - [196, 256, 256, 1024]
    - [99, 13.524]
  - - [3136, 256, 128, 64]
    - [105, 13.599]
  - - [3136, 64, 256, 64]
    - [104, 11.71]
  - - [14, 64, 1, 14]
    - [140, 0.001]
  - - [15, 64, 1, 14]
    - [140, 0.001]
  - - [15, 64, 1, 15]
    - [140, 0.001]
  - - [15, 64, 1, 15]
    - [140, 0.001]
  - - [17, 64, 1, 15]
    - [140, 0.002]
  - - [17, 64, 1, 17]
    - [140, 0.002]
  - - [17, 64, 1, 17]
    - [140, 0.002]
  - - [21, 64, 1, 17]
    - [150, 0.003]
  - - [21, 64, 1, 21]
    - [140, 0.003]
  - - [24, 64, 1, 24]
    - [140, 0.004]
  - - [30, 64, 1, 30]
    - [228, 0.007]
  - - [30, 64, 1, 31]
    - [150, 0.007]
  - - [31, 64, 1, 31]
    - [156, 0.007]
  - - [32, 64, 1, 32]
    - [150, 0.007]
  - - [32, 64, 1, 35]
    - [143, 0.007]
  - - [34, 64, 1, 24]
    - [229, 0.007]
  - - [34, 64, 1, 34]
    - [150, 0.008]
  - - [35, 64, 1, 35]
    - [180, 0.008]
  - - [64, 14, 1, 14]
    - [140, 0.001]
  - - [64, 15, 1, 14]
    - [141, 0.001]
  - - [64, 15, 1, 15]
    - [141, 0.001]
  - - [64, 15, 1, 15]
    - [141, 0.001]
  - - [64, 17, 1, 15]
    - [140, 0.001]
  - - [64, 17, 1, 17]
    - [184, 0.002]
  - - [64, 17, 1, 17]
    - [147, 0.002]
  - - [64, 21, 1, 17]
    - [141, 0.002]
  - - [64, 21, 1, 21]
    - [141, 0.003]
  - - [64, 24, 1, 24]
    - [141, 0.004]
  - - [64, 30, 1, 30]
    - [142, 0.005]
  - - [64, 30, 1, 31]
    - [141, 0.005]
  - - [64, 31, 1, 31]
    - [145, 0.006]
  - - [64, 32, 1, 32]
    - [143, 0.007]
  - - [64, 32, 1, 35]
    - [147, 0.007]
  - - [64, 34, 1, 24]
    - [141, 0.005]
  - - [64, 34, 1, 34]
    - [142, 0.007]
  - - [64, 35, 1, 35]
    - [142, 0.007]
  - - [64, 128, 512, 128]
    - [267, 17.147]
  - - [64, 512, 1, 512]
    - [308, 1.892]
  - - [64, 512, 64, 512]
    - [358, 27.913]
  - - [128, 64, 512, 128]
    - [342, 16.473]
  - - [512, 64, 1, 512]
    - [352, 1.869]
  - - [512, 64, 64, 512]
    - [349, 23.868]
  - - [1024, 2, 1, 4]
    - [256, 0.001]
  - - [1024, 2, 1, 32]
    - [256, 0.012]
  - - [1024, 2, 1, 2048]
    - [380, 0.18]
  - - [1024, 1024, 1, 4]
    - [266, 0.517]
  - - [1024, 1024, 1, 32]
    - [379, 3.694]
  - - [1024, 1024, 1, 2048]
    - [322, 33.551]
  - - [1024, 1024, 1, 4096]
    - [381, 39.252]
  - - [1024, 4096, 1, 2048]
    - [334, 48.339]
  - - [1024, 4096, 1, 4096]
    - [305, 53.325]
  - - [1024, 30528, 1, 2048]
    - [325, 72.675]
  - - [1024, 30528, 1, 4096]
    - [328, 76.847]
  - - [4096, 1024, 1, 2048]
    - [341, 48.165]
  - - [4096, 1024, 1, 4096]
    - [334, 53.556]
  - - [3, 64, 512, 3]
    - [304, 0.027]
  - - [5, 64, 512, 5]
    - [333, 0.087]
  - - [5, 64, 960, 5]
    - [317, 0.127]
  - - [9, 64, 512, 9]
    - [268, 0.249]
  - - [13, 512, 1, 32768]
    - [280, 0.57]
  - - [27, 128, 32768, 27]
    - [366, 5.198]
  - - [33, 32, 200, 33]
    - [336, 0.659]
  - - [33, 32, 1600, 33]
    - [357, 2.202]
  - - [67, 2048, 1, 512]
    - [372, 4.907]
  - - [74, 2048, 1, 512]
    - [309, 5.379]
  - - [74, 2048, 1, 960]
    - [313, 7.359]
  - - [100, 2048, 1, 512]
    - [308, 6.675]
  - - [256, 128, 1, 32768]
    - [348, 3.019]
  - - [256, 1280, 1, 8976]
    - [374, 23.072]
  - - [256, 2560, 1, 8976]
    - [368, 35.562]
  - - [256, 2816, 1, 8976]
    - [264, 38.595]
  - - [256, 3328, 1, 8976]
    - [324, 42.122]
  - - [256, 3584, 1, 8976]
    - [314, 44.447]
  - - [256, 3840, 1, 8976]
    - [351, 43.552]
  - - [256, 4096, 1, 8976]
    - [301, 41.178]
  - - [256, 4352, 1, 8976]
    - [289, 44.228]
  - - [256, 4864, 1, 8976]
    - [307, 49.176]
  - - [256, 5120, 1, 8976]
    - [289, 51.69]
  - - [256, 5632, 1, 8976]
    - [338, 56.044]
  - - [256, 5888, 1, 8976]
    - [376, 57.71]
  - - [256, 6144, 1, 8976]
    - [322, 59.783]
  - - [256, 7168, 1, 8976]
    - [350, 67.844]
  - - [256, 8192, 1, 8976]
    - [276, 47.127]
  - - [256, 8960, 1, 8976]
    - [354, 51.739]
  - - [256, 9728, 1, 8976]
    - [312, 55.725]
  - - [256, 9984, 1, 8976]
    - [343, 57.1]
  - - [256, 10240, 1, 8976]
    - [320, 58.487]
  - - [256, 10496, 1, 8976]
    - [286, 59.933]
  - - [256, 11008, 1, 8976]
    - [325, 62.657]
  - - [256, 11264, 1, 8976]
    - [354, 64.267]
  - - [256, 11520, 1, 8976]
    - [272, 65.484]
  - - [256, 11776, 1, 8976]
    - [354, 67.063]
  - - [256, 12544, 1, 8976]
    - [321, 71.267]
  - - [256, 12800, 1, 8976]
    - [321, 72.53]
  - - [256, 13312, 1, 8976]
    - [325, 75.253]
  - - [256, 13568, 1, 8976]
    - [278, 76.001]
  - - [256, 14336, 1, 8976]
    - [303, 79.845]
  - - [256, 14848, 1, 8976]
    - [353, 82.718]
  - - [256, 15104, 1, 8976]
    - [360, 83.026]
  - - [256, 15872, 1, 8976]
    - [307, 54.627]
  - - [256, 16128, 1, 8976]
    - [307, 55.402]
  - - [256, 17152, 1, 8976]
    - [307, 58.939]
  - - [256, 17408, 1, 8976]
    - [307, 59.828]
  - - [256, 18688, 1, 8976]
    - [307, 63.88]
  - - [256, 19968, 1, 8976]
    - [273, 67.525]
  - - [256, 20480, 1, 8976]
    - [344, 68.29]
  - - [256, 20992, 1, 8976]
    - [307, 70.588]
  - - [256, 21248, 1, 8976]
    - [273, 66.713]
  - - [256, 22016, 1, 8976]
    - [289, 70.916]
  - - [256, 26112, 1, 8976]
    - [320, 74.59]
  - - [256, 32512, 1, 8976]
    - [307, 67.102]
  - - [256, 32768, 1, 1]
    - [285, 0.454]
  - - [256, 33536, 1, 8976]
    - [260, 68.794]
  - - [256, 44505, 1, 8976]
    - [360, 81.938]
  - - [257, 4096, 1, 1024]
    - [381, 25.283]
  - - [480, 1024, 1, 32768]
    - [337, 28.396]
  - - [512, 32, 1, 200]
    - [316, 0.388]
  - - [512, 32, 1, 1600]
    - [323, 1.443]
  - - [512, 256, 1, 32768]
    - [323, 10.467]
  - - [512, 512, 1, 200]
    - [331, 4.629]
  - - [512, 512, 1, 1600]
    - [375, 16.153]
  - - [512, 2048, 1, 256]
    - [335, 18.073]
  - - [560, 1024, 1, 200]
    - [330, 7.95]
  - - [560, 1024, 1, 1600]
    - [288, 23.851]
  - - [768, 2048, 1, 256]
    - [315, 22.166]
  - - [1024, 64, 1, 512]
    - [259, 3.451]
  - - [1024, 64, 1, 960]
    - [280, 4.673]
  - - [1024, 256, 1, 1024]
    - [296, 13.653]
  - - [1024, 256, 1, 1280]
    - [296, 14.812]
  - - [1024, 256, 1, 2304]
    - [355, 16.012]
  - - [1024, 256, 1, 2816]
    - [263, 15.736]
  - - [1024, 256, 1, 3072]
    - [340, 15.668]
  - - [1024, 256, 1, 3328]
    - [258, 15.792]
  - - [1024, 256, 1, 3584]
    - [300, 15.813]
  - - [1024, 256, 1, 4096]
    - [370, 17.002]
  - - [1024, 256, 1, 4352]
    - [370, 17.028]
  - - [1024, 256, 1, 4608]
    - [318, 17.338]
  - - [1024, 256, 1, 5120]
    - [363, 17.691]
  - - [1024, 256, 1, 5376]
    - [295, 17.75]
  - - [1024, 256, 1, 5632]
    - [318, 17.874]
  - - [1024, 256, 1, 6144]
    - [318, 18.181]
  - - [1024, 256, 1, 6400]
    - [318, 18.13]
  - - [1024, 256, 1, 7680]
    - [318, 18.691]
  - - [1024, 256, 1, 7936]
    - [318, 18.631]
  - - [1024, 256, 1, 8192]
    - [318, 18.87]
  - - [1024, 256, 1, 8448]
    - [318, 18.554]
  - - [1024, 256, 1, 9728]
    - [279, 18.777]
  - - [1024, 256, 1, 9984]
    - [318, 19.075]
  - - [1024, 256, 1, 10496]
    - [318, 19.031]
  - - [1024, 256, 1, 11520]
    - [318, 19.277]
  - - [1024, 256, 1, 12032]
    - [279, 19.155]
  - - [1024, 256, 1, 13568]
    - [318, 19.33]
  - - [1024, 256, 1, 14336]
    - [318, 19.334]
  - - [1024, 256, 1, 14848]
    - [318, 19.396]
  - - [1024, 256, 1, 15104]
    - [318, 19.595]
  - - [1024, 256, 1, 15872]
    - [318, 19.656]
  - - [1024, 256, 1, 16128]
    - [318, 19.51]
  - - [1024, 256, 1, 17152]
    - [279, 19.59]
  - - [1024, 256, 1, 17408]
    - [318, 19.608]
  - - [1024, 256, 1, 18944]
    - [318, 19.852]
  - - [1024, 256, 1, 19712]
    - [318, 19.666]
  - - [1024, 256, 1, 19968]
    - [318, 19.784]
  - - [1024, 256, 1, 21248]
    - [318, 19.767]
  - - [1024, 256, 1, 21504]
    - [318, 19.832]
  - - [1024, 256, 1, 22016]
    - [318, 19.791]
  - - [1024, 256, 1, 28672]
    - [318, 20.04]
  - - [1024, 256, 1, 33536]
    - [318, 19.998]
  - - [1024, 512, 1, 32768]
    - [298, 30.694]
  - - [1024, 1024, 1, 200]
    - [345, 13.629]
  - - [1024, 1024, 1, 512]
    - [362, 23.699]
  - - [1024, 1024, 1, 960]
    - [326, 28.461]
  - - [1024, 1024, 1, 1600]
    - [281, 31.029]
  - - [1024, 1024, 1, 32768]
    - [341, 45.327]
  - - [1600, 1024, 1, 512]
    - [383, 31.152]
  - - [1600, 1024, 1, 960]
    - [329, 35.64]
  - - [2048, 256, 1, 1024]
    - [277, 21.471]
  - - [2048, 960, 1, 1]
    - [377, 0.198]
  - - [2048, 2048, 1, 512]
    - [294, 38.947]
  - - [2048, 2048, 1, 960]
    - [327, 42.869]
  - - [2048, 2048, 1, 1024]
    - [284, 42.533]
  - - [3200, 2048, 1, 1024]
    - [328, 59.813]
  - - [4096, 4096, 1, 1024]
    - [286, 64.542]
  - - [14, 64, 10880, 14]
    - [257, 1.306]
  - - [15, 64, 10880, 14]
    - [257, 1.354]
  - - [15, 64, 7680, 15]
    - [255, 1.384]
  - - [15, 64, 10880, 15]
    - [257, 1.459]
  - - [17, 64, 7680, 15]
    - [299, 1.518]
  - - [17, 64, 6144, 17]
    - [290, 1.616]
  - - [17, 64, 7680, 17]
    - [261, 1.67]
  - - [21, 64, 6144, 17]
    - [291, 1.976]
  - - [21, 64, 6144, 21]
    - [310, 2.359]
  - - [24, 64, 4736, 24]
    - [270, 3.235]
  - - [30, 64, 2048, 30]
    - [339, 3.505]
  - - [30, 64, 2048, 31]
    - [261, 3.633]
  - - [31, 64, 2048, 31]
    - [293, 3.639]
  - - [32, 64, 4608, 32]
    - [292, 6.351]
  - - [32, 64, 4608, 35]
    - [369, 5.034]
  - - [34, 64, 4736, 24]
    - [359, 4.401]
  - - [34, 64, 4736, 34]
    - [310, 5.255]
  - - [35, 64, 4608, 35]
    - [339, 5.258]
  - - [64, 14, 10880, 14]
    - [261, 1.199]
  - - [64, 15, 10880, 14]
    - [261, 1.286]
  - - [64, 15, 7680, 15]
    - [293, 1.329]
  - - [64, 15, 10880, 15]
    - [261, 1.379]
  - - [64, 17, 7680, 15]
    - [373, 1.5]
  - - [64, 17, 6144, 17]
    - [357, 1.533]
  - - [64, 17, 7680, 17]
    - [382, 1.58]
  - - [64, 21, 6144, 17]
    - [302, 1.783]
  - - [64, 21, 6144, 21]
    - [361, 2.173]
  - - [64, 24, 4736, 24]
    - [346, 2.992]
  - - [64, 30, 2048, 30]
    - [262, 3.172]
  - - [64, 30, 2048, 31]
    - [282, 3.241]
  - - [64, 31, 2048, 31]
    - [275, 3.302]
  - - [64, 32, 4608, 32]
    - [356, 6.294]
  - - [64, 32, 4608, 35]
    - [269, 4.586]
  - - [64, 34, 4736, 24]
    - [369, 3.782]
  - - [64, 34, 4736, 34]
    - [274, 4.473]
  - - [64, 35, 4608, 35]
    - [283, 4.6]
  - - [1024, 1024, 1, 3840]
    - [347, 38.687]
  - - [1024, 1024, 1, 3968]
    - [344, 39.134]
  - - [1024, 1024, 1, 6528]
    - [347, 41.382]
  - - [1024, 1024, 1, 7104]
    - [341, 41.743]
  - - [1024, 1024, 1, 7200]
    - [297, 39.94]
  - - [1024, 1024, 1, 8064]
    - [344, 42.407]
  - - [1024, 1024, 1, 8160]
    - [367, 40.771]
  - - [1024, 1024, 1, 9216]
    - [371, 42.78]
  - - [1024, 1024, 1, 9520]
    - [381, 41.009]
  - - [1024, 1024, 1, 10064]
    - [341, 41.669]
  - - [1024, 1024, 1, 10080]
    - [367, 41.595]
  - - [1024, 1024, 1, 10200]
    - [341, 41.827]
  - - [1024, 4096, 1, 3840]
    - [334, 52.979]
  - - [1024, 4096, 1, 3968]
    - [281, 53.394]
  - - [1024, 4096, 1, 6528]
    - [334, 55.438]
  - - [1024, 4096, 1, 7104]
    - [334, 55.47]
  - - [1024, 4096, 1, 7200]
    - [281, 53.545]
  - - [1024, 4096, 1, 8064]
    - [334, 56.022]
  - - [1024, 4096, 1, 8160]
    - [281, 54.159]
  - - [1024, 4096, 1, 9216]
    - [334, 56.566]
  - - [1024, 4096, 1, 9520]
    - [334, 54.791]
  - - [1024, 4096, 1, 10064]
    - [334, 54.782]
  - - [1024, 4096, 1, 10080]
    - [334, 54.998]
  - - [1024, 4096, 1, 10200]
    - [334, 55.154]
  - - [1024, 42720, 1, 3968]
    - [320, 80.152]
  - - [1024, 42720, 1, 6528]
    - [320, 81.972]
  - - [1024, 42720, 1, 7104]
    - [320, 82.231]
  - - [1024, 42720, 1, 7200]
    - [325, 82.157]
  - - [1024, 42720, 1, 9520]
    - [325, 81.802]
  - - [1024, 42720, 1, 10080]
    - [320, 82.94]
  - - [4096, 1024, 1, 3840]
    - [334, 52.942]
  - - [4096, 1024, 1, 3968]
    - [365, 53.34]
  - - [4096, 1024, 1, 6528]
    - [365, 55.849]
  - - [4096, 1024, 1, 7104]
    - [334, 56.196]
  - - [4096, 1024, 1, 7200]
    - [347, 53.739]
  - - [4096, 1024, 1, 8064]
    - [381, 56.482]
  - - [4096, 1024, 1, 8160]
    - [365, 54.499]
  - - [4096, 1024, 1, 9216]
    - [334, 56.851]
  - - [4096, 1024, 1, 9520]
    - [381, 55.017]
  - - [4096, 1024, 1, 10064]
    - [381, 55.233]
  - - [4096, 1024, 1, 10080]
    - [365, 55.523]
  - - [4096, 1024, 1, 10200]
    - [381, 55.491]
  - - [27, 64, 1920, 27]
    - [265, 2.881]
  - - [27, 64, 1920, 33]
    - [319, 3.326]
  - - [33, 64, 1920, 33]
    - [311, 3.901]
  - - [64, 27, 1920, 27]
    - [378, 2.563]
  - - [64, 27, 1920, 33]
    - [271, 2.987]
  - - [64, 33, 1920, 33]
    - [261, 3.488]
  - - [1024, 1024, 1, 3240]
    - [338, 33.538]
  - - [1024, 1024, 1, 3960]
    - [341, 35.455]
  - - [1024, 4096, 1, 3240]
    - [287, 48.172]
  - - [1024, 4096, 1, 3960]
    - [306, 49.597]
  - - [1024, 42720, 1, 3960]
    - [325, 76.971]
  - - [4096, 1024, 1, 3240]
    - [332, 48.503]
  - - [4096, 1024, 1, 3960]
    - [364, 49.111]
- null
