library/src/blas3/Tensile/Logic/asm_full/arcturus_Cijk_Ailk_Bjlk_BBH.yaml
- {MinimumRequiredVersion: 4.14.0}
- arcturus
- gfx908
- [Device 7380, Device 7388, Device 738c, Device 7390]
    SolutionIndex: 0
    SolutionNameMin: Cijk_Ailk_Bjlk_BBH_MT32x256x8_MI32x32x2x2_SE_ONLL0_SNLL1
    SolutionIndex: 1
    SolutionNameMin: Cijk_Ailk_Bjlk_BBH_MT64x128x8_MI32x32x2x2_SE_ONLL0_SNLL1
    SolutionIndex: 2
    SolutionNameMin: Cijk_Ailk_Bjlk_BBH_MT64x128x16_MI32x32x2x2_SE_ONLL0_SNLL1
    SolutionIndex: 3
    SolutionNameMin: Cijk_Ailk_Bjlk_BBH_MT32x256x8_MI32x32x2x2_SE_ONLL0_SNLL0
    SolutionIndex: 4
    SolutionNameMin: Cijk_Ailk_Bjlk_BBH_MT64x128x8_MI32x32x2x2_SE_ONLL0_SNLL0
    SolutionIndex: 5
    SolutionNameMin: Cijk_Ailk_Bjlk_BBH_MT64x128x16_MI32x32x2x2_SE_ONLL0_SNLL0
    SolutionIndex: 6
    SolutionNameMin: Cijk_Ailk_Bjlk_BBH_MT64x128x32_MI32x32x2x2_SE_ONLL0_SNLL0
    SolutionIndex: 7
    SolutionNameMin: Cijk_Ailk_Bjlk_BBH_MT64x128x16_MI32x32x2x2_SE_ONLL1_SNLL1
    SolutionIndex: 8
    SolutionNameMin: Cijk_Ailk_Bjlk_BBH_MT64x128x32_MI32x32x2x2_SE_ONLL1_SNLL1
    SolutionIndex: 9
    SolutionNameMin: Cijk_Ailk_Bjlk_BBH_MT32x256x8_MI32x32x2x2_SE_ONLL1_SNLL0
    SolutionIndex: 10
    SolutionNameMin: Cijk_Ailk_Bjlk_BBH_MT64x128x8_MI32x32x2x2_SE_ONLL1_SNLL0
    SolutionIndex: 11
    SolutionNameMin: Cijk_Ailk_Bjlk_BBH_MT32x256x16_MI32x32x2x2_SE_ONLL1_SNLL0
    SolutionIndex: 12
    SolutionNameMin: Cijk_Ailk_Bjlk_BBH_MT64x128x16_MI32x32x2x2_SE_ONLL1_SNLL0
    SolutionIndex: 13
    SolutionNameMin: Cijk_Ailk_Bjlk_BBH_MT64x128x32_MI32x32x2x2_SE_ONLL1_SNLL0
    SolutionIndex: 14
    SolutionNameMin: Cijk_Ailk_Bjlk_BBH_MT64x256x8_MI32x32x2x2_SE_ONLL0_SNLL0
    SolutionIndex: 15
    SolutionNameMin: Cijk_Ailk_Bjlk_BBH_MT64x256x16_MI32x32x2x2_SE_ONLL0_SNLL0
    SolutionIndex: 16
    SolutionNameMin: Cijk_Ailk_Bjlk_BBH_MT64x256x16_MI32x32x2x2_SE_ONLL1_SNLL1
    SolutionIndex: 17
    SolutionNameMin: Cijk_Ailk_Bjlk_BBH_MT64x128x8_MI32x32x2x2_SE_AF0EM1_ASEM1_ONLL0_SNLL1
    SolutionIndex: 18
    SolutionNameMin: Cijk_Ailk_Bjlk_BBH_MT64x128x8_MI32x32x2x2_SE_AF0EM1_ASEM1_ONLL0_SNLL0
    SolutionIndex: 19
    SolutionNameMin: Cijk_Ailk_Bjlk_BBH_MT64x128x32_MI32x32x2x2_SE_AF0EM1_ASEM2_ONLL0_SNLL0
    SolutionIndex: 20
    SolutionNameMin: Cijk_Ailk_Bjlk_BBH_MT64x128x8_MI32x32x2x2_SE_AF0EM1_ASEM1_ONLL1_SNLL1
    SolutionIndex: 21
    SolutionNameMin: Cijk_Ailk_Bjlk_BBH_MT64x128x8_MI32x32x2x2_SE_AF0EM1_ASEM1_ONLL1_SNLL0
    SolutionIndex: 22
    SolutionNameMin: Cijk_Ailk_Bjlk_BBH_MT64x128x32_MI32x32x2x2_SE_AF0EM1_ASEM2_ONLL1_SNLL0
    SolutionIndex: 23
    SolutionIndex: 24
    SolutionIndex: 25
    SolutionIndex: 26
    SolutionIndex: 27
    SolutionIndex: 28
    SolutionIndex: 29
    SolutionIndex: 30
    SolutionIndex: 31
    SolutionIndex: 32
    SolutionIndex: 33
    SolutionIndex: 34
    SolutionIndex: 35
    SolutionIndex: 36
    SolutionIndex: 37
    SolutionIndex: 38
    SolutionIndex: 39
    SolutionIndex: 40
    SolutionIndex: 41
    SolutionIndex: 42
    SolutionIndex: 43
    SolutionIndex: 44
    SolutionIndex: 45
    SolutionIndex: 46
    SolutionIndex: 47
    SolutionIndex: 48
    SolutionIndex: 49
    SolutionIndex: 50
    SolutionIndex: 51
    SolutionIndex: 52
    SolutionIndex: 53
    SolutionIndex: 54
    SolutionIndex: 55
    SolutionIndex: 56
    SolutionIndex: 57
    SolutionIndex: 58
    SolutionIndex: 59
    SolutionIndex: 60
    SolutionIndex: 61
    SolutionIndex: 62
    SolutionIndex: 63
    SolutionIndex: 64
    SolutionIndex: 65
    SolutionIndex: 66
    SolutionIndex: 67
    SolutionIndex: 68
    SolutionIndex: 69
    SolutionIndex: 70
    SolutionIndex: 71
    SolutionIndex: 72
    SolutionIndex: 73
    SolutionIndex: 74
    SolutionIndex: 75
    SolutionIndex: 76
    SolutionIndex: 77
    SolutionIndex: 78
    SolutionIndex: 79
    SolutionIndex: 80
    SolutionIndex: 81
    SolutionIndex: 82
    SolutionIndex: 83
    SolutionIndex: 84
    SolutionIndex: 85
    SolutionIndex: 86
    SolutionIndex: 87
    SolutionIndex: 88
    SolutionIndex: 89
    SolutionIndex: 90
    SolutionIndex: 91
    SolutionNameMin: Cijk_Ailk_Bjlk_BBH_MT32x256x8_MI32x32x2x2_SE_ONLL0_SNLL1
    SolutionIndex: 92
    SolutionNameMin: Cijk_Ailk_Bjlk_BBH_MT64x128x8_MI32x32x2x2_SE_ONLL0_SNLL1
    SolutionIndex: 93
    SolutionNameMin: Cijk_Ailk_Bjlk_BBH_MT64x128x16_MI32x32x2x2_SE_ONLL0_SNLL1
    SolutionIndex: 94
    SolutionNameMin: Cijk_Ailk_Bjlk_BBH_MT32x256x8_MI32x32x2x2_SE_ONLL0_SNLL0
    SolutionIndex: 95
    SolutionNameMin: Cijk_Ailk_Bjlk_BBH_MT64x128x8_MI32x32x2x2_SE_ONLL0_SNLL0
    SolutionIndex: 96
    SolutionNameMin: Cijk_Ailk_Bjlk_BBH_MT64x128x16_MI32x32x2x2_SE_ONLL0_SNLL0
    SolutionIndex: 97
    SolutionNameMin: Cijk_Ailk_Bjlk_BBH_MT64x128x32_MI32x32x2x2_SE_ONLL0_SNLL0
    SolutionIndex: 98
    SolutionNameMin: Cijk_Ailk_Bjlk_BBH_MT64x128x16_MI32x32x2x2_SE_ONLL1_SNLL1
    SolutionIndex: 99
    SolutionNameMin: Cijk_Ailk_Bjlk_BBH_MT64x128x32_MI32x32x2x2_SE_ONLL1_SNLL1
    SolutionIndex: 100
    SolutionNameMin: Cijk_Ailk_Bjlk_BBH_MT32x256x8_MI32x32x2x2_SE_ONLL1_SNLL0
    SolutionIndex: 101
    SolutionNameMin: Cijk_Ailk_Bjlk_BBH_MT64x128x8_MI32x32x2x2_SE_ONLL1_SNLL0
    SolutionIndex: 102
    SolutionNameMin: Cijk_Ailk_Bjlk_BBH_MT32x256x16_MI32x32x2x2_SE_ONLL1_SNLL0
    SolutionIndex: 103
    SolutionNameMin: Cijk_Ailk_Bjlk_BBH_MT64x128x16_MI32x32x2x2_SE_ONLL1_SNLL0
    SolutionIndex: 104
    SolutionNameMin: Cijk_Ailk_Bjlk_BBH_MT64x128x32_MI32x32x2x2_SE_ONLL1_SNLL0
    SolutionIndex: 105
    SolutionNameMin: Cijk_Ailk_Bjlk_BBH_MT64x256x8_MI32x32x2x2_SE_ONLL0_SNLL0
    SolutionIndex: 106
    SolutionNameMin: Cijk_Ailk_Bjlk_BBH_MT64x256x16_MI32x32x2x2_SE_ONLL0_SNLL0
    SolutionIndex: 107
    SolutionNameMin: Cijk_Ailk_Bjlk_BBH_MT64x256x16_MI32x32x2x2_SE_ONLL1_SNLL1
    SolutionIndex: 108
    SolutionNameMin: Cijk_Ailk_Bjlk_BBH_MT64x128x8_MI32x32x2x2_SE_AF0EM1_ASEM1_ONLL0_SNLL1
    SolutionIndex: 109
    SolutionNameMin: Cijk_Ailk_Bjlk_BBH_MT64x128x8_MI32x32x2x2_SE_AF0EM1_ASEM1_ONLL0_SNLL0
    SolutionIndex: 110
    SolutionNameMin: Cijk_Ailk_Bjlk_BBH_MT64x128x32_MI32x32x2x2_SE_AF0EM1_ASEM2_ONLL0_SNLL0
    SolutionIndex: 111
    SolutionNameMin: Cijk_Ailk_Bjlk_BBH_MT64x128x8_MI32x32x2x2_SE_AF0EM1_ASEM1_ONLL1_SNLL1
    SolutionIndex: 112
    SolutionNameMin: Cijk_Ailk_Bjlk_BBH_MT64x128x8_MI32x32x2x2_SE_AF0EM1_ASEM1_ONLL1_SNLL0
    SolutionIndex: 113
    SolutionNameMin: Cijk_Ailk_Bjlk_BBH_MT64x128x32_MI32x32x2x2_SE_AF0EM1_ASEM2_ONLL1_SNLL0
    SolutionIndex: 114
    SolutionIndex: 115
    SolutionIndex: 116
    SolutionIndex: 117
    SolutionIndex: 118
    SolutionIndex: 119
    SolutionIndex: 120
    SolutionIndex: 121
    SolutionIndex: 122
    SolutionIndex: 123
    SolutionIndex: 124
    SolutionIndex: 125
    SolutionIndex: 126
    SolutionIndex: 127
    SolutionIndex: 128
    SolutionIndex: 129
    SolutionIndex: 130
    SolutionIndex: 131
    SolutionIndex: 132
    SolutionIndex: 133
    SolutionIndex: 134
    SolutionIndex: 135
    SolutionIndex: 136
    SolutionIndex: 137
    SolutionIndex: 138
    SolutionIndex: 139
    SolutionIndex: 140
    SolutionIndex: 141
    SolutionIndex: 142
    SolutionIndex: 143
    SolutionIndex: 144
    SolutionIndex: 145
    SolutionIndex: 146
    SolutionIndex: 147
    SolutionIndex: 148
    SolutionIndex: 149
    SolutionIndex: 150
    SolutionIndex: 151
    SolutionIndex: 152
    SolutionIndex: 153
    SolutionIndex: 154
    SolutionIndex: 155
    SolutionIndex: 156
    SolutionIndex: 157
    SolutionIndex: 158
    SolutionIndex: 159
    SolutionIndex: 160
    SolutionIndex: 161
    SolutionIndex: 162
    SolutionIndex: 163
    SolutionIndex: 164
    SolutionIndex: 165
    SolutionIndex: 166
    SolutionIndex: 167
    SolutionIndex: 168
    SolutionIndex: 169
    SolutionIndex: 170
    SolutionIndex: 171
    SolutionIndex: 172
    SolutionIndex: 173
    SolutionIndex: 174
    SolutionIndex: 175
    SolutionIndex: 176
    SolutionIndex: 177
    SolutionIndex: 178
    SolutionIndex: 179
    SolutionIndex: 180
    SolutionIndex: 181
- - - [34, 64, 1, 34]
    - [33, 0.0]
  - - [64, 15, 10880, 15]
    - [32, 0.0]
  - - [32, 64, 1, 35]
    - [32, 0.0]
  - - [512, 32, 1, 1600]
    - [70, 0.0]
  - - [256, 13568, 1, 8976]
    - [59, 0.0]
  - - [256, 9728, 1, 8976]
    - [82, 0.0]
  - - [1024, 256, 1, 3072]
    - [35, 0.0]
  - - [74, 2048, 1, 512]
    - [79, 0.0]
  - - [1024, 4096, 1, 10080]
    - [65, 0.0]
  - - [1024, 256, 1, 2816]
    - [60, 0.0]
  - - [64, 21, 1, 17]
    - [28, 0.0]
  - - [64, 30, 2048, 30]
    - [57, 0.0]
  - - [100, 2048, 1, 512]
    - [79, 0.0]
  - - [64, 32, 1, 35]
    - [32, 0.0]
  - - [1024, 256, 1, 9728]
    - [35, 0.0]
  - - [1024, 64, 1, 960]
    - [70, 0.0]
  - - [4096, 1024, 1, 10064]
    - [81, 0.0]
  - - [1024, 256, 1, 11520]
    - [35, 0.0]
  - - [1024, 1024, 1, 3840]
    - [84, 0.0]
  - - [1024, 42720, 1, 6528]
    - [62, 0.0]
  - - [21, 64, 1, 21]
    - [30, 0.0]
  - - [1024, 64, 1, 512]
    - [70, 0.0]
  - - [17, 64, 7680, 17]
    - [33, 0.0]
  - - [256, 21248, 1, 8976]
    - [49, 0.0]
  - - [4096, 1024, 1, 3840]
    - [81, 0.0]
  - - [64, 30, 1, 31]
    - [32, 0.0]
  - - [30, 64, 2048, 31]
    - [33, 0.0]
  - - [1024, 4096, 1, 4096]
    - [65, 0.0]
  - - [5, 64, 960, 5]
    - [33, 0.0]
  - - [1024, 1024, 1, 3968]
    - [84, 0.0]
  - - [4096, 1024, 1, 3960]
    - [43, 0.0]
  - - [1024, 4096, 1, 7104]
    - [43, 0.0]
  - - [256, 6144, 1, 8976]
    - [80, 0.0]
  - - [15, 64, 1, 15]
    - [23, 0.0]
  - - [15, 64, 7680, 15]
    - [33, 0.0]
  - - [64, 24, 1, 24]
    - [32, 0.0]
  - - [17, 64, 1, 15]
    - [51, 0.0]
  - - [4096, 1024, 1, 7200]
    - [81, 0.0]
  - - [64, 33, 1920, 33]
    - [72, 0.0]
  - - [4096, 1024, 1, 9216]
    - [81, 0.0]
  - - [2048, 2048, 1, 960]
    - [65, 0.0]
  - - [64, 35, 1, 35]
    - [28, 0.0]
  - - [32, 64, 1, 32]
    - [33, 0.0]
  - - [256, 11264, 1, 8976]
    - [46, 0.0]
  - - [1024, 256, 1, 5376]
    - [35, 0.0]
  - - [1024, 42720, 1, 3968]
    - [63, 0.0]
  - - [64, 17, 7680, 17]
    - [57, 0.0]
  - - [64, 34, 1, 24]
    - [32, 0.0]
  - - [256, 4096, 1, 8976]
    - [63, 0.0]
  - - [4096, 1024, 1, 2048]
    - [78, 0.0]
  - - [256, 2560, 1, 8976]
    - [61, 0.0]
  - - [256, 4864, 1, 8976]
    - [63, 0.0]
  - - [1024, 1024, 1, 4096]
    - [76, 0.0]
  - - [1024, 256, 1, 7936]
    - [35, 0.0]
  - - [1024, 4096, 1, 3240]
    - [65, 0.0]
  - - [4096, 1024, 1, 8064]
    - [81, 0.0]
  - - [1024, 256, 1, 14848]
    - [35, 0.0]
  - - [64, 15, 7680, 15]
    - [68, 0.0]
  - - [512, 512, 1, 1600]
    - [66, 0.0]
  - - [1024, 256, 1, 8448]
    - [35, 0.0]
  - - [560, 1024, 1, 1600]
    - [48, 0.0]
  - - [256, 22016, 1, 8976]
    - [49, 0.0]
  - - [1024, 1024, 1, 3960]
    - [63, 0.0]
  - - [1024, 2, 1, 2048]
    - [48, 0.0]
  - - [1024, 256, 1, 15104]
    - [35, 0.0]
  - - [256, 19968, 1, 8976]
    - [49, 0.0]
  - - [4096, 1024, 1, 7104]
    - [81, 0.0]
  - - [1024, 4096, 1, 3960]
    - [43, 0.0]
  - - [1024, 256, 1, 22016]
    - [35, 0.0]
  - - [1024, 256, 1, 15872]
    - [35, 0.0]
  - - [1024, 1024, 1, 32]
    - [89, 0.0]
  - - [64, 15, 1, 15]
    - [26, 0.0]
  - - [256, 12800, 1, 8976]
    - [69, 0.0]
  - - [1024, 1024, 1, 6528]
    - [84, 0.0]
  - - [1024, 42720, 1, 3960]
    - [63, 0.0]
  - - [256, 11008, 1, 8976]
    - [87, 0.0]
  - - [1024, 256, 1, 6144]
    - [35, 0.0]
  - - [1024, 4096, 1, 10200]
    - [43, 0.0]
  - - [64, 512, 64, 512]
    - [88, 0.0]
  - - [30, 64, 1, 30]
    - [73, 0.0]
  - - [1024, 1024, 1, 3240]
    - [63, 0.0]
  - - [1024, 2, 1, 32]
    - [31, 0.0]
  - - [256, 15104, 1, 8976]
    - [59, 0.0]
  - - [1024, 4096, 1, 3840]
    - [43, 0.0]
  - - [30, 64, 1, 31]
    - [51, 0.0]
  - - [34, 64, 1, 24]
    - [77, 0.0]
  - - [1024, 1024, 1, 8064]
    - [63, 0.0]
  - - [64, 30, 1, 30]
    - [32, 0.0]
  - - [3200, 2048, 1, 1024]
    - [56, 0.0]
  - - [27, 64, 1920, 27]
    - [51, 0.0]
  - - [14, 64, 1, 14]
    - [23, 0.0]
  - - [1024, 256, 1, 1024]
    - [90, 0.0]
  - - [1024, 256, 1, 18944]
    - [35, 0.0]
  - - [1024, 256, 1, 10496]
    - [35, 0.0]
  - - [256, 11776, 1, 8976]
    - [69, 0.0]
  - - [64, 17, 1, 17]
    - [24, 0.0]
  - - [1024, 256, 1, 17152]
    - [35, 0.0]
  - - [64, 14, 10880, 14]
    - [68, 0.0]
  - - [64, 27, 1920, 33]
    - [57, 0.0]
  - - [17, 64, 7680, 15]
    - [33, 0.0]
  - - [1024, 256, 1, 17408]
    - [35, 0.0]
  - - [1024, 1024, 1, 9216]
    - [63, 0.0]
  - - [256, 4352, 1, 8976]
    - [63, 0.0]
  - - [64, 17, 1, 15]
    - [24, 0.0]
  - - [1024, 1024, 1, 960]
    - [63, 0.0]
  - - [1024, 256, 1, 33536]
    - [35, 0.0]
  - - [1024, 4096, 1, 2048]
    - [39, 0.0]
  - - [768, 2048, 1, 256]
    - [87, 0.0]
  - - [1024, 256, 1, 7680]
    - [35, 0.0]
  - - [15, 64, 10880, 15]
    - [33, 0.0]
  - - [64, 32, 1, 32]
    - [29, 0.0]
  - - [1024, 256, 1, 1280]
    - [38, 0.0]
  - - [1024, 256, 1, 4096]
    - [35, 0.0]
  - - [256, 9984, 1, 8976]
    - [60, 0.0]
  - - [1024, 4096, 1, 6528]
    - [43, 0.0]
  - - [256, 128, 1, 32768]
    - [35, 0.0]
  - - [1024, 4096, 1, 7200]
    - [75, 0.0]
  - - [1024, 1024, 1, 2048]
    - [76, 0.0]
  - - [1024, 256, 1, 19712]
    - [35, 0.0]
  - - [4096, 4096, 1, 1024]
    - [36, 0.0]
  - - [560, 1024, 1, 200]
    - [58, 0.0]
  - - [256, 13312, 1, 8976]
    - [53, 0.0]
  - - [256, 3840, 1, 8976]
    - [40, 0.0]
  - - [1024, 4096, 1, 8064]
    - [65, 0.0]
  - - [9, 64, 512, 9]
    - [33, 0.0]
  - - [4096, 1024, 1, 10080]
    - [41, 0.0]
  - - [64, 31, 1, 31]
    - [32, 0.0]
  - - [33, 32, 1600, 33]
    - [33, 0.0]
  - - [256, 1280, 1, 8976]
    - [35, 0.0]
  - - [64, 30, 2048, 31]
    - [74, 0.0]
  - - [256, 5632, 1, 8976]
    - [86, 0.0]
  - - [256, 18688, 1, 8976]
    - [87, 0.0]
  - - [2048, 2048, 1, 1024]
    - [75, 0.0]
  - - [1024, 256, 1, 3584]
    - [60, 0.0]
  - - [17, 64, 1, 17]
    - [30, 0.0]
  - - [1024, 2, 1, 4]
    - [23, 0.0]
  - - [33, 32, 200, 33]
    - [30, 0.0]
  - - [30, 64, 2048, 30]
    - [51, 0.0]
  - - [1024, 256, 1, 19968]
    - [35, 0.0]
  - - [64, 21, 1, 21]
    - [24, 0.0]
  - - [15, 64, 10880, 14]
    - [33, 0.0]
  - - [1024, 1024, 1, 1600]
    - [84, 0.0]
  - - [1024, 1024, 1, 7104]
    - [63, 0.0]
  - - [1024, 256, 1, 3328]
    - [35, 0.0]
  - - [64, 15, 10880, 14]
    - [68, 0.0]
  - - [35, 64, 1, 35]
    - [33, 0.0]
  - - [256, 2816, 1, 8976]
    - [82, 0.0]
  - - [4096, 1024, 1, 4096]
    - [41, 0.0]
  - - [4096, 1024, 1, 10200]
    - [81, 0.0]
  - - [1024, 42720, 1, 9520]
    - [62, 0.0]
  - - [3, 64, 512, 3]
    - [33, 0.0]
  - - [4096, 1024, 1, 3240]
    - [75, 0.0]
  - - [1024, 42720, 1, 7104]
    - [62, 0.0]
  - - [1024, 256, 1, 4608]
    - [35, 0.0]
  - - [256, 15872, 1, 8976]
    - [35, 0.0]
  - - [33, 64, 1920, 33]
    - [33, 0.0]
  - - [480, 1024, 1, 32768]
    - [60, 0.0]
  - - [1024, 256, 1, 6400]
    - [35, 0.0]
  - - [1024, 42720, 1, 10080]
    - [44, 0.0]
  - - [1024, 1024, 1, 4]
    - [45, 0.0]
  - - [256, 44505, 1, 8976]
    - [59, 0.0]
  - - [1024, 256, 1, 5120]
    - [35, 0.0]
  - - [74, 2048, 1, 960]
    - [79, 0.0]
  - - [256, 33536, 1, 8976]
    - [87, 0.0]
  - - [4096, 1024, 1, 9520]
    - [81, 0.0]
  - - [1024, 256, 1, 21248]
    - [35, 0.0]
  - - [4096, 1024, 1, 8160]
    - [81, 0.0]
  - - [256, 8192, 1, 8976]
    - [87, 0.0]
  - - [1024, 1024, 1, 512]
    - [76, 0.0]
  - - [31, 64, 1, 31]
    - [51, 0.0]
  - - [21, 64, 1, 17]
    - [33, 0.0]
  - - [512, 256, 1, 32768]
    - [35, 0.0]
  - - [1024, 1024, 1, 8160]
    - [76, 0.0]
  - - [1024, 1024, 1, 10080]
    - [76, 0.0]
  - - [2048, 960, 1, 1]
    - [37, 0.0]
  - - [1024, 256, 1, 13568]
    - [35, 0.0]
  - - [256, 32768, 1, 1]
    - [42, 0.0]
  - - [1024, 256, 1, 28672]
    - [35, 0.0]
  - - [64, 15, 1, 15]
    - [26, 0.0]
  - - [1024, 1024, 1, 10200]
    - [63, 0.0]
  - - [128, 64, 512, 128]
    - [87, 0.0]
  - - [31, 64, 2048, 31]
    - [33, 0.0]
  - - [256, 20992, 1, 8976]
    - [49, 0.0]
  - - [64, 17, 1, 17]
    - [24, 0.0]
  - - [1024, 256, 1, 16128]
    - [35, 0.0]
  - - [256, 3584, 1, 8976]
    - [47, 0.0]
  - - [512, 64, 1, 512]
    - [34, 0.0]
  - - [4096, 1024, 1, 6528]
    - [81, 0.0]
  - - [1024, 4096, 1, 3968]
    - [65, 0.0]
  - - [512, 32, 1, 200]
    - [58, 0.0]
  - - [256, 14336, 1, 8976]
    - [46, 0.0]
  - - [64, 27, 1920, 27]
    - [72, 0.0]
  - - [17, 64, 1, 17]
    - [30, 0.0]
  - - [64, 34, 1, 34]
    - [83, 0.0]
  - - [1024, 4096, 1, 10064]
    - [65, 0.0]
  - - [1600, 1024, 1, 960]
    - [87, 0.0]
  - - [64, 17, 7680, 15]
    - [68, 0.0]
  - - [1024, 1024, 1, 32768]
    - [63, 0.0]
  - - [15, 64, 1, 14]
    - [27, 0.0]
  - - [24, 64, 1, 24]
    - [33, 0.0]
  - - [1024, 1024, 1, 10064]
    - [63, 0.0]
  - - [256, 5120, 1, 8976]
    - [76, 0.0]
  - - [256, 3328, 1, 8976]
    - [88, 0.0]
  - - [1024, 256, 1, 5632]
    - [35, 0.0]
  - - [2048, 2048, 1, 512]
    - [43, 0.0]
  - - [64, 14, 1, 14]
    - [27, 0.0]
  - - [256, 8960, 1, 8976]
    - [35, 0.0]
  - - [1600, 1024, 1, 512]
    - [87, 0.0]
  - - [13, 512, 1, 32768]
    - [64, 0.0]
  - - [1024, 30528, 1, 2048]
    - [55, 0.0]
  - - [256, 26112, 1, 8976]
    - [59, 0.0]
  - - [256, 32512, 1, 8976]
    - [87, 0.0]
  - - [1024, 4096, 1, 9216]
    - [65, 0.0]
  - - [257, 4096, 1, 1024]
    - [78, 0.0]
  - - [1024, 256, 1, 14336]
    - [35, 0.0]
  - - [512, 64, 64, 512]
    - [63, 0.0]
  - - [1024, 1024, 1, 9520]
    - [63, 0.0]
  - - [1024, 256, 1, 9984]
    - [35, 0.0]
  - - [1024, 512, 1, 32768]
    - [35, 0.0]
  - - [27, 64, 1920, 33]
    - [33, 0.0]
  - - [1024, 42720, 1, 7200]
    - [62, 0.0]
  - - [1024, 30528, 1, 4096]
    - [55, 0.0]
  - - [27, 128, 32768, 27]
    - [33, 0.0]
  - - [256, 7168, 1, 8976]
    - [67, 0.0]
  - - [1024, 256, 1, 4352]
    - [60, 0.0]
  - - [512, 2048, 1, 256]
    - [63, 0.0]
  - - [256, 12544, 1, 8976]
    - [54, 0.0]
  - - [2048, 256, 1, 1024]
    - [38, 0.0]
  - - [1024, 256, 1, 21504]
    - [35, 0.0]
  - - [256, 17152, 1, 8976]
    - [87, 0.0]
  - - [64, 31, 2048, 31]
    - [57, 0.0]
  - - [14, 64, 10880, 14]
    - [33, 0.0]
  - - [256, 11520, 1, 8976]
    - [87, 0.0]
  - - [1024, 4096, 1, 9520]
    - [43, 0.0]
  - - [256, 10496, 1, 8976]
    - [87, 0.0]
  - - [1024, 4096, 1, 8160]
    - [43, 0.0]
  - - [67, 2048, 1, 512]
    - [52, 0.0]
  - - [256, 5888, 1, 8976]
    - [41, 0.0]
  - - [256, 17408, 1, 8976]
    - [76, 0.0]
  - - [1024, 1024, 1, 7200]
    - [63, 0.0]
  - - [1024, 256, 1, 8192]
    - [35, 0.0]
  - - [15, 64, 1, 15]
    - [23, 0.0]
  - - [256, 10240, 1, 8976]
    - [71, 0.0]
  - - [256, 14848, 1, 8976]
    - [85, 0.0]
  - - [256, 20480, 1, 8976]
    - [25, 0.0]
  - - [64, 15, 1, 14]
    - [28, 0.0]
  - - [64, 512, 1, 512]
    - [90, 0.0]
  - - [512, 512, 1, 200]
    - [50, 0.0]
  - - [5, 64, 512, 5]
    - [33, 0.0]
  - - [1024, 256, 1, 12032]
    - [35, 0.0]
  - - [64, 128, 512, 128]
    - [88, 0.0]
  - - [4096, 1024, 1, 3968]
    - [43, 0.0]
  - - [1024, 256, 1, 2304]
    - [60, 0.0]
  - - [1024, 1024, 1, 200]
    - [72, 0.0]
  - - [256, 16128, 1, 8976]
    - [87, 0.0]
  - - [34, 64, 1, 34]
    - [124, 0.0]
  - - [64, 15, 10880, 15]
    - [123, 0.0]
  - - [32, 64, 1, 35]
    - [123, 0.0]
  - - [512, 32, 1, 1600]
    - [161, 0.0]
  - - [256, 13568, 1, 8976]
    - [150, 0.0]
  - - [256, 9728, 1, 8976]
    - [173, 0.0]
  - - [1024, 256, 1, 3072]
    - [126, 0.0]
  - - [74, 2048, 1, 512]
    - [170, 0.0]
  - - [1024, 4096, 1, 10080]
    - [156, 0.0]
  - - [1024, 256, 1, 2816]
    - [151, 0.0]
  - - [64, 21, 1, 17]
    - [119, 0.0]
  - - [64, 30, 2048, 30]
    - [148, 0.0]
  - - [100, 2048, 1, 512]
    - [170, 0.0]
  - - [64, 32, 1, 35]
    - [123, 0.0]
  - - [1024, 256, 1, 9728]
    - [126, 0.0]
  - - [1024, 64, 1, 960]
    - [161, 0.0]
  - - [4096, 1024, 1, 10064]
    - [172, 0.0]
  - - [1024, 256, 1, 11520]
    - [126, 0.0]
  - - [1024, 1024, 1, 3840]
    - [175, 0.0]
  - - [1024, 42720, 1, 6528]
    - [153, 0.0]
  - - [21, 64, 1, 21]
    - [121, 0.0]
  - - [1024, 64, 1, 512]
    - [161, 0.0]
  - - [17, 64, 7680, 17]
    - [124, 0.0]
  - - [256, 21248, 1, 8976]
    - [140, 0.0]
  - - [4096, 1024, 1, 3840]
    - [172, 0.0]
  - - [64, 30, 1, 31]
    - [123, 0.0]
  - - [30, 64, 2048, 31]
    - [124, 0.0]
  - - [1024, 4096, 1, 4096]
    - [156, 0.0]
  - - [5, 64, 960, 5]
    - [124, 0.0]
  - - [1024, 1024, 1, 3968]
    - [175, 0.0]
  - - [4096, 1024, 1, 3960]
    - [134, 0.0]
  - - [1024, 4096, 1, 7104]
    - [134, 0.0]
  - - [256, 6144, 1, 8976]
    - [171, 0.0]
  - - [15, 64, 1, 15]
    - [114, 0.0]
  - - [15, 64, 7680, 15]
    - [124, 0.0]
  - - [64, 24, 1, 24]
    - [123, 0.0]
  - - [17, 64, 1, 15]
    - [142, 0.0]
  - - [4096, 1024, 1, 7200]
    - [172, 0.0]
  - - [64, 33, 1920, 33]
    - [163, 0.0]
  - - [4096, 1024, 1, 9216]
    - [172, 0.0]
  - - [2048, 2048, 1, 960]
    - [156, 0.0]
  - - [64, 35, 1, 35]
    - [119, 0.0]
  - - [32, 64, 1, 32]
    - [124, 0.0]
  - - [256, 11264, 1, 8976]
    - [137, 0.0]
  - - [1024, 256, 1, 5376]
    - [126, 0.0]
  - - [1024, 42720, 1, 3968]
    - [154, 0.0]
  - - [64, 17, 7680, 17]
    - [148, 0.0]
  - - [64, 34, 1, 24]
    - [123, 0.0]
  - - [256, 4096, 1, 8976]
    - [154, 0.0]
  - - [4096, 1024, 1, 2048]
    - [169, 0.0]
  - - [256, 2560, 1, 8976]
    - [152, 0.0]
  - - [256, 4864, 1, 8976]
    - [154, 0.0]
  - - [1024, 1024, 1, 4096]
    - [167, 0.0]
  - - [1024, 256, 1, 7936]
    - [126, 0.0]
  - - [1024, 4096, 1, 3240]
    - [156, 0.0]
  - - [4096, 1024, 1, 8064]
    - [172, 0.0]
  - - [1024, 256, 1, 14848]
    - [126, 0.0]
  - - [64, 15, 7680, 15]
    - [159, 0.0]
  - - [512, 512, 1, 1600]
    - [157, 0.0]
  - - [1024, 256, 1, 8448]
    - [126, 0.0]
  - - [560, 1024, 1, 1600]
    - [139, 0.0]
  - - [256, 22016, 1, 8976]
    - [140, 0.0]
  - - [1024, 1024, 1, 3960]
    - [154, 0.0]
  - - [1024, 2, 1, 2048]
    - [139, 0.0]
  - - [1024, 256, 1, 15104]
    - [126, 0.0]
  - - [256, 19968, 1, 8976]
    - [140, 0.0]
  - - [4096, 1024, 1, 7104]
    - [172, 0.0]
  - - [1024, 4096, 1, 3960]
    - [134, 0.0]
  - - [1024, 256, 1, 22016]
    - [126, 0.0]
  - - [1024, 256, 1, 15872]
    - [126, 0.0]
  - - [1024, 1024, 1, 32]
    - [180, 0.0]
  - - [64, 15, 1, 15]
    - [117, 0.0]
  - - [256, 12800, 1, 8976]
    - [160, 0.0]
  - - [1024, 1024, 1, 6528]
    - [175, 0.0]
  - - [1024, 42720, 1, 3960]
    - [154, 0.0]
  - - [256, 11008, 1, 8976]
    - [178, 0.0]
  - - [1024, 256, 1, 6144]
    - [126, 0.0]
  - - [1024, 4096, 1, 10200]
    - [134, 0.0]
  - - [64, 512, 64, 512]
    - [179, 0.0]
  - - [30, 64, 1, 30]
    - [164, 0.0]
  - - [1024, 1024, 1, 3240]
    - [154, 0.0]
  - - [1024, 2, 1, 32]
    - [122, 0.0]
  - - [256, 15104, 1, 8976]
    - [150, 0.0]
  - - [1024, 4096, 1, 3840]
    - [134, 0.0]
  - - [30, 64, 1, 31]
    - [142, 0.0]
  - - [34, 64, 1, 24]
    - [168, 0.0]
  - - [1024, 1024, 1, 8064]
    - [154, 0.0]
  - - [64, 30, 1, 30]
    - [123, 0.0]
  - - [3200, 2048, 1, 1024]
    - [147, 0.0]
  - - [27, 64, 1920, 27]
    - [142, 0.0]
  - - [14, 64, 1, 14]
    - [114, 0.0]
  - - [1024, 256, 1, 1024]
    - [181, 0.0]
  - - [1024, 256, 1, 18944]
    - [126, 0.0]
  - - [1024, 256, 1, 10496]
    - [126, 0.0]
  - - [256, 11776, 1, 8976]
    - [160, 0.0]
  - - [64, 17, 1, 17]
    - [115, 0.0]
  - - [1024, 256, 1, 17152]
    - [126, 0.0]
  - - [64, 14, 10880, 14]
    - [159, 0.0]
  - - [64, 27, 1920, 33]
    - [148, 0.0]
  - - [17, 64, 7680, 15]
    - [124, 0.0]
  - - [1024, 256, 1, 17408]
    - [126, 0.0]
  - - [1024, 1024, 1, 9216]
    - [154, 0.0]
  - - [256, 4352, 1, 8976]
    - [154, 0.0]
  - - [64, 17, 1, 15]
    - [115, 0.0]
  - - [1024, 1024, 1, 960]
    - [154, 0.0]
  - - [1024, 256, 1, 33536]
    - [126, 0.0]
  - - [1024, 4096, 1, 2048]
    - [130, 0.0]
  - - [768, 2048, 1, 256]
    - [178, 0.0]
  - - [1024, 256, 1, 7680]
    - [126, 0.0]
  - - [15, 64, 10880, 15]
    - [124, 0.0]
  - - [64, 32, 1, 32]
    - [120, 0.0]
  - - [1024, 256, 1, 1280]
    - [129, 0.0]
  - - [1024, 256, 1, 4096]
    - [126, 0.0]
  - - [256, 9984, 1, 8976]
    - [151, 0.0]
  - - [1024, 4096, 1, 6528]
    - [134, 0.0]
  - - [256, 128, 1, 32768]
    - [126, 0.0]
  - - [1024, 4096, 1, 7200]
    - [166, 0.0]
  - - [1024, 1024, 1, 2048]
    - [167, 0.0]
  - - [1024, 256, 1, 19712]
    - [126, 0.0]
  - - [4096, 4096, 1, 1024]
    - [127, 0.0]
  - - [560, 1024, 1, 200]
    - [149, 0.0]
  - - [256, 13312, 1, 8976]
    - [144, 0.0]
  - - [256, 3840, 1, 8976]
    - [131, 0.0]
  - - [1024, 4096, 1, 8064]
    - [156, 0.0]
  - - [9, 64, 512, 9]
    - [124, 0.0]
  - - [4096, 1024, 1, 10080]
    - [132, 0.0]
  - - [64, 31, 1, 31]
    - [123, 0.0]
  - - [33, 32, 1600, 33]
    - [124, 0.0]
  - - [256, 1280, 1, 8976]
    - [126, 0.0]
  - - [64, 30, 2048, 31]
    - [165, 0.0]
  - - [256, 5632, 1, 8976]
    - [177, 0.0]
  - - [256, 18688, 1, 8976]
    - [178, 0.0]
  - - [2048, 2048, 1, 1024]
    - [166, 0.0]
  - - [1024, 256, 1, 3584]
    - [151, 0.0]
  - - [17, 64, 1, 17]
    - [121, 0.0]
  - - [1024, 2, 1, 4]
    - [114, 0.0]
  - - [33, 32, 200, 33]
    - [121, 0.0]
  - - [30, 64, 2048, 30]
    - [142, 0.0]
  - - [1024, 256, 1, 19968]
    - [126, 0.0]
  - - [64, 21, 1, 21]
    - [115, 0.0]
  - - [15, 64, 10880, 14]
    - [124, 0.0]
  - - [1024, 1024, 1, 1600]
    - [175, 0.0]
  - - [1024, 1024, 1, 7104]
    - [154, 0.0]
  - - [1024, 256, 1, 3328]
    - [126, 0.0]
  - - [64, 15, 10880, 14]
    - [159, 0.0]
  - - [35, 64, 1, 35]
    - [124, 0.0]
  - - [256, 2816, 1, 8976]
    - [173, 0.0]
  - - [4096, 1024, 1, 4096]
    - [132, 0.0]
  - - [4096, 1024, 1, 10200]
    - [172, 0.0]
  - - [1024, 42720, 1, 9520]
    - [153, 0.0]
  - - [3, 64, 512, 3]
    - [124, 0.0]
  - - [4096, 1024, 1, 3240]
    - [166, 0.0]
  - - [1024, 42720, 1, 7104]
    - [153, 0.0]
  - - [1024, 256, 1, 4608]
    - [126, 0.0]
  - - [256, 15872, 1, 8976]
    - [126, 0.0]
  - - [33, 64, 1920, 33]
    - [124, 0.0]
  - - [480, 1024, 1, 32768]
    - [151, 0.0]
  - - [1024, 256, 1, 6400]
    - [126, 0.0]
  - - [1024, 42720, 1, 10080]
    - [135, 0.0]
  - - [1024, 1024, 1, 4]
    - [136, 0.0]
  - - [256, 44505, 1, 8976]
    - [150, 0.0]
  - - [1024, 256, 1, 5120]
    - [126, 0.0]
  - - [74, 2048, 1, 960]
    - [170, 0.0]
  - - [256, 33536, 1, 8976]
    - [178, 0.0]
  - - [4096, 1024, 1, 9520]
    - [172, 0.0]
  - - [1024, 256, 1, 21248]
    - [126, 0.0]
  - - [4096, 1024, 1, 8160]
    - [172, 0.0]
  - - [256, 8192, 1, 8976]
    - [178, 0.0]
  - - [1024, 1024, 1, 512]
    - [167, 0.0]
  - - [31, 64, 1, 31]
    - [142, 0.0]
  - - [21, 64, 1, 17]
    - [124, 0.0]
  - - [512, 256, 1, 32768]
    - [126, 0.0]
  - - [1024, 1024, 1, 8160]
    - [167, 0.0]
  - - [1024, 1024, 1, 10080]
    - [167, 0.0]
  - - [2048, 960, 1, 1]
    - [128, 0.0]
  - - [1024, 256, 1, 13568]
    - [126, 0.0]
  - - [256, 32768, 1, 1]
    - [133, 0.0]
  - - [1024, 256, 1, 28672]
    - [126, 0.0]
  - - [64, 15, 1, 15]
    - [117, 0.0]
  - - [1024, 1024, 1, 10200]
    - [154, 0.0]
  - - [128, 64, 512, 128]
    - [178, 0.0]
  - - [31, 64, 2048, 31]
    - [124, 0.0]
  - - [256, 20992, 1, 8976]
    - [140, 0.0]
  - - [64, 17, 1, 17]
    - [115, 0.0]
  - - [1024, 256, 1, 16128]
    - [126, 0.0]
  - - [256, 3584, 1, 8976]
    - [138, 0.0]
  - - [512, 64, 1, 512]
    - [125, 0.0]
  - - [4096, 1024, 1, 6528]
    - [172, 0.0]
  - - [1024, 4096, 1, 3968]
    - [156, 0.0]
  - - [512, 32, 1, 200]
    - [149, 0.0]
  - - [256, 14336, 1, 8976]
    - [137, 0.0]
  - - [64, 27, 1920, 27]
    - [163, 0.0]
  - - [17, 64, 1, 17]
    - [121, 0.0]
  - - [64, 34, 1, 34]
    - [174, 0.0]
  - - [1024, 4096, 1, 10064]
    - [156, 0.0]
  - - [1600, 1024, 1, 960]
    - [178, 0.0]
  - - [64, 17, 7680, 15]
    - [159, 0.0]
  - - [1024, 1024, 1, 32768]
    - [154, 0.0]
  - - [15, 64, 1, 14]
    - [118, 0.0]
  - - [24, 64, 1, 24]
    - [124, 0.0]
  - - [1024, 1024, 1, 10064]
    - [154, 0.0]
  - - [256, 5120, 1, 8976]
    - [167, 0.0]
  - - [256, 3328, 1, 8976]
    - [179, 0.0]
  - - [1024, 256, 1, 5632]
    - [126, 0.0]
  - - [2048, 2048, 1, 512]
    - [134, 0.0]
  - - [64, 14, 1, 14]
    - [118, 0.0]
  - - [256, 8960, 1, 8976]
    - [126, 0.0]
  - - [1600, 1024, 1, 512]
    - [178, 0.0]
  - - [13, 512, 1, 32768]
    - [155, 0.0]
  - - [1024, 30528, 1, 2048]
    - [146, 0.0]
  - - [256, 26112, 1, 8976]
    - [150, 0.0]
  - - [256, 32512, 1, 8976]
    - [178, 0.0]
  - - [1024, 4096, 1, 9216]
    - [156, 0.0]
  - - [257, 4096, 1, 1024]
    - [169, 0.0]
  - - [1024, 256, 1, 14336]
    - [126, 0.0]
  - - [512, 64, 64, 512]
    - [154, 0.0]
  - - [1024, 1024, 1, 9520]
    - [154, 0.0]
  - - [1024, 256, 1, 9984]
    - [126, 0.0]
  - - [1024, 512, 1, 32768]
    - [126, 0.0]
  - - [27, 64, 1920, 33]
    - [124, 0.0]
  - - [1024, 42720, 1, 7200]
    - [153, 0.0]
  - - [1024, 30528, 1, 4096]
    - [146, 0.0]
  - - [27, 128, 32768, 27]
    - [124, 0.0]
  - - [256, 7168, 1, 8976]
    - [158, 0.0]
  - - [1024, 256, 1, 4352]
    - [151, 0.0]
  - - [512, 2048, 1, 256]
    - [154, 0.0]
  - - [256, 12544, 1, 8976]
    - [145, 0.0]
  - - [2048, 256, 1, 1024]
    - [129, 0.0]
  - - [1024, 256, 1, 21504]
    - [126, 0.0]
  - - [256, 17152, 1, 8976]
    - [178, 0.0]
  - - [64, 31, 2048, 31]
    - [148, 0.0]
  - - [14, 64, 10880, 14]
    - [124, 0.0]
  - - [256, 11520, 1, 8976]
    - [178, 0.0]
  - - [1024, 4096, 1, 9520]
    - [134, 0.0]
  - - [256, 10496, 1, 8976]
    - [178, 0.0]
  - - [1024, 4096, 1, 8160]
    - [134, 0.0]
  - - [67, 2048, 1, 512]
    - [143, 0.0]
  - - [256, 5888, 1, 8976]
    - [132, 0.0]
  - - [256, 17408, 1, 8976]
    - [167, 0.0]
  - - [1024, 1024, 1, 7200]
    - [154, 0.0]
  - - [1024, 256, 1, 8192]
    - [126, 0.0]
  - - [15, 64, 1, 15]
    - [114, 0.0]
  - - [256, 10240, 1, 8976]
    - [162, 0.0]
  - - [256, 14848, 1, 8976]
    - [176, 0.0]
  - - [256, 20480, 1, 8976]
    - [116, 0.0]
  - - [64, 15, 1, 14]
    - [119, 0.0]
  - - [64, 512, 1, 512]
    - [181, 0.0]
  - - [512, 512, 1, 200]
    - [141, 0.0]
  - - [5, 64, 512, 5]
    - [124, 0.0]
  - - [1024, 256, 1, 12032]
    - [126, 0.0]
  - - [64, 128, 512, 128]
    - [179, 0.0]
  - - [4096, 1024, 1, 3968]
    - [134, 0.0]
  - - [1024, 256, 1, 2304]
    - [151, 0.0]
  - - [1024, 1024, 1, 200]
    - [163, 0.0]
  - - [256, 16128, 1, 8976]
    - [178, 0.0]
- null
