library/src/blas3/Tensile/Logic/asm_full/arcturus_Cijk_Ailk_Bljk_HB.yaml
- {MinimumRequiredVersion: 4.6.0}
- arcturus
- gfx908
- [Device 7380, Device 7388, Device 738c, Device 7390]
    SolutionIndex: 0
    SolutionNameMin: Cijk_Ailk_Bljk_HB_MT032x008x64_EPS1_GRVW02_LPB00_PGR1_SNLL1_TT02_02_USFGRO01_VW02_WG16_04_01
    SolutionIndex: 1
    SolutionNameMin: Cijk_Ailk_Bljk_HB_MT128x64x32_SN_APM0_EPS0_FL1_GRVW2_GSU5_LPB4_LRVW4_NLCB1_PGR0_PLR1_TT8_4_USFGRO1_VW4_WG16_16_1_WGM8
    SolutionIndex: 2
    SolutionNameMin: Cijk_Ailk_Bljk_HB_MT128x64x16_SN_APM1_EPS1_FL0_GRVW4_GSU1_LPB4_LRVW4_NLCB1_PGR1_PLR1_TT8_4_USFGRO0_VW4_WG16_16_1_WGM8
    SolutionIndex: 3
    SolutionNameMin: Cijk_Ailk_Bljk_HB_MT64x8x32_SN_APM1_EPS1_FL0_GRVW2_GSU1_LPB0_LRVW2_NLCB1_PGR1_PLR1_TT2_2_USFGRO1_VW2_WG32_4_1_WGM8
    SolutionIndex: 4
    SolutionNameMin: Cijk_Ailk_Bljk_HB_MT128x64x8_SN_APM1_EPS1_FL0_GRVW4_GSU1_LPB0_LRVW4_NLCB1_PGR1_PLR1_TT8_4_USFGRO0_VW4_WG16_16_1_WGM8
    SolutionIndex: 5
    SolutionNameMin: Cijk_Ailk_Bljk_HB_MT64x8x32_SN_APM1_EPS1_FL0_GRVW2_GSU1_LPB0_LRVW2_NLCB1_PGR1_PLR1_TT2_2_USFGRO1_VW2_WG32_4_1_WGM1
    SolutionIndex: 6
    SolutionNameMin: Cijk_Ailk_Bljk_HB_MT128x64x16_SN_APM0_EPS1_FL1_GRVW2_GSU1_LPB4_LRVW4_NLCB1_PGR1_PLR1_TT8_4_USFGRO1_VW4_WG16_16_1_WGM64
    SolutionIndex: 7
    SolutionNameMin: Cijk_Ailk_Bljk_HB_MT64x64x16_SN_APM1_EPS1_FL0_GRVW4_GSU1_LPB0_LRVW4_NLCB1_PGR1_PLR1_TT4_4_USFGRO0_VW4_WG16_16_1_WGM8
    SolutionIndex: 8
    SolutionNameMin: Cijk_Ailk_Bljk_HB_MT64x8x64_SN_APM1_EPS1_FL0_GRVW2_GSU1_LPB0_LRVW2_NLCB1_PGR1_PLR1_TT2_2_USFGRO1_VW2_WG32_4_1_WGM1
    SolutionIndex: 9
    SolutionNameMin: Cijk_Ailk_Bljk_HB_MT128x64x16_SN_APM1_EPS1_FL0_GRVW4_GSU1_LPB4_LRVW4_NLCB1_PGR1_PLR1_TT4_8_USFGRO0_VW4_WG32_8_1_WGM1
    SolutionIndex: 10
    SolutionNameMin: Cijk_Ailk_Bljk_HB_MT64x64x16_SN_APM1_EPS1_FL0_GRVW4_GSU1_LPB4_LRVW4_NLCB1_PGR1_PLR1_TT4_4_USFGRO0_VW4_WG16_16_1_WGM1
    SolutionIndex: 11
    SolutionNameMin: Cijk_Ailk_Bljk_HB_MT128x128x16_SN_APM0_EPS1_FL1_GRVW8_GSU1_LPB0_LRVW8_NLCB1_PGR1_PLR1_TT8_8_USFGRO0_VW8_WG16_16_1_WGM1
    SolutionIndex: 12
    SolutionNameMin: Cijk_Ailk_Bljk_HB_MT128x64x16_SN_APM1_EPS1_FL0_GRVW4_GSU1_LPB0_LRVW4_NLCB1_PGR1_PLR1_TT8_4_USFGRO0_VW4_WG16_16_1_WGM8
    SolutionIndex: 13
    SolutionNameMin: Cijk_Ailk_Bljk_HB_MT128x64x32_SN_APM1_EPS1_FL0_GRVW4_GSU1_LPB4_LRVW4_NLCB1_PGR1_PLR1_TT4_4_USFGRO0_VW4_WG32_16_1_WGM1
    SolutionIndex: 14
    SolutionNameMin: Cijk_Ailk_Bljk_HB_MT64x128x16_SN_APM1_EPS1_FL0_GRVW4_GSU1_LPB4_LRVW4_NLCB1_PGR1_PLR1_TT4_8_USFGRO0_VW4_WG16_16_1_WGM8
    SolutionIndex: 15
    SolutionNameMin: Cijk_Ailk_Bljk_HB_MT64x16x16_SN_APM1_EPS1_FL0_GRVW2_GSU1_LPB0_LRVW2_NLCB1_PGR1_PLR1_TT4_2_USFGRO1_VW2_WG16_8_1_WGM8
    SolutionIndex: 16
    SolutionNameMin: Cijk_Ailk_Bljk_HB_MT256x32x8_SN_APM1_EPS1_FL0_GRVW4_GSU1_LPB0_LRVW4_NLCB1_PGR1_PLR1_TT8_4_USFGRO0_VW4_WG32_8_1_WGM1
    SolutionIndex: 17
    SolutionNameMin: Cijk_Ailk_Bljk_HB_MT32x8x32_SN_APM1_EPS1_FL0_GRVW2_GSU1_LPB0_LRVW2_NLCB1_PGR1_PLR1_TT2_2_USFGRO1_VW2_WG16_4_1_WGM8
    SolutionIndex: 18
    SolutionNameMin: Cijk_Ailk_Bljk_HB_MT64x16x16_SN_APM1_EPS1_FL0_GRVW4_GSU1_LPB0_LRVW4_NLCB1_PGR1_PLR1_TT4_4_USFGRO0_VW4_WG16_4_1_WGM1
    SolutionIndex: 19
    SolutionNameMin: Cijk_Ailk_Bljk_HB_MT64x32x16_SN_APM1_EPS1_FL0_GRVW4_GSU1_LPB0_LRVW4_NLCB1_PGR1_PLR1_TT4_4_USFGRO0_VW4_WG16_8_1_WGM8
    SolutionIndex: 20
    SolutionNameMin: Cijk_Ailk_Bljk_HB_MT256x64x16_SN_APM1_EPS1_FL0_GRVW4_GSU1_LPB4_LRVW4_NLCB1_PGR1_PLR1_TT8_4_USFGRO0_VW4_WG32_16_1_WGM1
    SolutionIndex: 21
    SolutionNameMin: Cijk_Ailk_Bljk_HB_MT64x16x16_SN_APM1_EPS1_FL0_GRVW2_GSU1_LPB0_LRVW2_NLCB1_PGR1_PLR1_TT4_2_USFGRO1_VW2_WG16_8_1_WGM1
    SolutionIndex: 22
    SolutionNameMin: Cijk_Ailk_Bljk_HB_MT256x64x8_SN_APM1_EPS1_FL0_GRVW8_GSU1_LPB0_LRVW8_NLCB1_PGR1_PLR1_TT8_8_USFGRO0_VW8_WG32_8_1_WGM1
    SolutionIndex: 23
    SolutionNameMin: Cijk_Ailk_Bljk_HB_MT32x16x16_SN_APM1_EPS1_FL0_GRVW2_GSU1_LPB0_LRVW2_NLCB1_PGR1_PLR1_TT2_2_USFGRO1_VW2_WG16_8_1_WGM8
    SolutionIndex: 24
    SolutionNameMin: Cijk_Ailk_Bljk_HB_MT128x64x16_SN_APM0_EPS0_FL1_GRVW2_GSU1_LPB4_LRVW4_NLCB1_PGR0_PLR1_TT8_4_USFGRO1_VW4_WG16_16_1_WGM1
    SolutionIndex: 25
    SolutionNameMin: Cijk_Ailk_Bljk_HB_MT16x16x16_SN_APM1_EPS1_FL0_GRVW2_GSU1_LPB0_LRVW2_NLCB1_PGR1_PLR1_TT2_2_USFGRO1_VW2_WG8_8_1_WGM1
    SolutionIndex: 26
    SolutionNameMin: Cijk_Ailk_Bljk_HB_MT128x32x8_SN_APM1_EPS1_FL0_GRVW4_GSU1_LPB0_LRVW4_NLCB1_PGR1_PLR1_TT4_4_USFGRO0_VW4_WG32_8_1_WGM8
    SolutionIndex: 27
    SolutionNameMin: Cijk_Ailk_Bljk_HB_MT128x128x16_SN_APM1_EPS1_FL0_GRVW8_GSU1_LPB0_LRVW8_NLCB1_PGR1_PLR1_TT8_8_USFGRO0_VW8_WG16_16_1_WGM8
    SolutionIndex: 28
    SolutionNameMin: Cijk_Ailk_Bljk_HB_MT64x32x16_SN_APM1_EPS1_FL0_GRVW4_GSU1_LPB0_LRVW4_NLCB1_PGR1_PLR1_TT4_4_USFGRO0_VW4_WG16_8_1_WGM1
    SolutionIndex: 29
    SolutionNameMin: Cijk_Ailk_Bljk_HB_MT32x8x32_SN_APM1_EPS1_FL0_GRVW2_GSU1_LPB0_LRVW2_NLCB1_PGR1_PLR1_TT2_2_USFGRO1_VW2_WG16_4_1_WGM1
    SolutionIndex: 30
    SolutionNameMin: Cijk_Ailk_Bljk_HB_MT64x16x32_SN_APM1_EPS1_FL0_GRVW2_GSU1_LPB0_LRVW2_NLCB1_PGR1_PLR1_TT2_2_USFGRO1_VW2_WG32_8_1_WGM1
    SolutionIndex: 31
    SolutionNameMin: Cijk_Ailk_Bljk_HB_MT64x16x32_SN_APM1_EPS1_FL0_GRVW2_GSU1_LPB0_LRVW2_NLCB1_PGR1_PLR1_TT2_2_USFGRO1_VW2_WG32_8_1_WGM8
    SolutionIndex: 32
    SolutionNameMin: Cijk_Ailk_Bljk_HB_MT128x128x8_SN_APM0_EPS1_FL1_GRVW2_GSU1_LPB8_LRVW8_NLCB1_PGR1_PLR1_TT8_8_USFGRO1_VW8_WG16_16_1_WGM1
    SolutionIndex: 33
    SolutionNameMin: Cijk_Ailk_Bljk_HB_MT32x32x16_SN_APM1_EPS1_FL0_GRVW4_GSU1_LPB0_LRVW4_NLCB1_PGR1_PLR1_TT4_4_USFGRO0_VW4_WG8_8_1_WGM8
    SolutionIndex: 34
    SolutionNameMin: Cijk_Ailk_Bljk_HB_MT32x16x16_SN_APM1_EPS1_FL0_GRVW2_GSU1_LPB0_LRVW2_NLCB1_PGR1_PLR1_TT2_2_USFGRO1_VW2_WG16_8_1_WGM1
    SolutionIndex: 35
    SolutionNameMin: Cijk_Ailk_Bljk_HB_MT128x64x16_SN_APM1_EPS0_FL0_GRVW4_GSU1_LPB4_LRVW4_NLCB1_PGR0_PLR0_TT4_8_USFGRO0_VW4_WG32_8_1_WGM8
    SolutionIndex: 36
    SolutionNameMin: Cijk_Ailk_Bljk_HB_MT64x32x16_SN_APM1_EPS1_FL0_GRVW4_GSU1_LPB0_LRVW4_NLCB1_PGR1_PLR1_TT8_4_USFGRO0_VW4_WG8_8_1_WGM8
    SolutionIndex: 37
    SolutionNameMin: Cijk_Ailk_Bljk_HB_MT32x32x24_SN_APM1_EPS1_FL0_GRVW4_GSU1_LPB0_LRVW4_NLCB3_PGR1_PLR1_TT4_4_USFGRO0_VW4_WG8_8_1_WGM1
    SolutionIndex: 38
    SolutionNameMin: Cijk_Ailk_Bljk_HB_MT32x8x64_SN_APM1_EPS1_FL0_GRVW2_GSU1_LPB0_LRVW2_NLCB1_PGR1_PLR1_TT2_2_USFGRO1_VW2_WG16_4_1_WGM1
    SolutionIndex: 39
    SolutionNameMin: Cijk_Ailk_Bljk_HB_MT16x16x24_SN_APM1_EPS1_FL0_GRVW2_GSU1_LPB0_LRVW2_NLCB3_PGR1_PLR1_TT2_2_USFGRO1_VW2_WG8_8_1_WGM1
    SolutionIndex: 40
    SolutionNameMin: Cijk_Ailk_Bljk_HB_MT32x32x24_SN_APM1_EPS1_FL0_GRVW4_GSU1_LPB0_LRVW4_NLCB3_PGR1_PLR1_TT4_4_USFGRO0_VW4_WG8_8_1_WGM8
    SolutionIndex: 41
    SolutionNameMin: Cijk_Ailk_Bljk_HB_MT64x64x16_SN_APM1_EPS0_FL0_GRVW8_GSU1_LPB0_LRVW8_NLCB1_PGR0_PLR1_TT8_8_USFGRO0_VW8_WG8_8_1_WGM8
    SolutionIndex: 42
    SolutionNameMin: Cijk_Ailk_Bljk_HB_MT128x64x32_SN_APM0_EPS0_FL1_GRVW2_GSU3_LPB4_LRVW4_NLCB1_PGR0_PLR1_TT8_4_USFGRO1_VW4_WG16_16_1_WGM8
    SolutionIndex: 43
    SolutionNameMin: Cijk_Ailk_Bljk_HB_MT32x8x16_SN_APM1_EPS1_FL0_GRVW2_GSU1_LPB0_LRVW2_NLCB1_PGR1_PLR1_TT2_2_USFGRO1_VW2_WG16_4_1_WGM1
    SolutionIndex: 44
    SolutionNameMin: Cijk_Ailk_Bljk_HB_MT128x16x16_SN_APM1_EPS1_FL0_GRVW4_GSU1_LPB0_LRVW4_NLCB1_PGR1_PLR1_TT4_4_USFGRO0_VW4_WG32_4_1_WGM1
    SolutionIndex: 45
    SolutionNameMin: Cijk_Ailk_Bljk_HB_MT128x32x8_SN_APM1_EPS1_FL0_GRVW4_GSU1_LPB0_LRVW4_NLCB1_PGR1_PLR1_TT4_4_USFGRO0_VW4_WG32_8_1_WGM1
    SolutionIndex: 46
    SolutionNameMin: Cijk_Ailk_Bljk_HB_MT128x64x16_SN_APM1_EPS0_FL0_GRVW4_GSU1_LPB4_LRVW4_NLCB1_PGR0_PLR0_TT8_4_USFGRO0_VW4_WG16_16_1_WGM8
    SolutionIndex: 47
    SolutionNameMin: Cijk_Ailk_Bljk_HB_MT64x16x16_SN_APM1_EPS1_FL0_GRVW4_GSU1_LPB0_LRVW4_NLCB1_PGR1_PLR1_TT4_4_USFGRO0_VW4_WG16_4_1_WGM8
    SolutionIndex: 48
    SolutionNameMin: Cijk_Ailk_Bljk_HB_MT16x16x8_SN_APM1_EPS1_FL0_GRVW2_GSU1_LPB0_LRVW2_NLCB1_PGR1_PLR1_TT2_2_USFGRO1_VW2_WG8_8_1_WGM1
    SolutionIndex: 49
    SolutionNameMin: Cijk_Ailk_Bljk_HB_MT128x16x8_SN_APM1_EPS1_FL0_GRVW4_GSU1_LPB0_LRVW4_NLCB1_PGR1_PLR1_TT4_4_USFGRO0_VW4_WG32_4_1_WGM8
    SolutionIndex: 50
    SolutionNameMin: Cijk_Ailk_Bljk_HB_MT64x16x8_SN_APM1_EPS1_FL0_GRVW2_GSU1_LPB0_LRVW2_NLCB1_PGR1_PLR1_TT4_2_USFGRO1_VW2_WG16_8_1_WGM8
    SolutionIndex: 51
    SolutionNameMin: Cijk_Ailk_Bljk_HB_MT32x8x8_SN_APM1_EPS1_FL0_GRVW2_GSU1_LPB0_LRVW2_NLCB1_PGR1_PLR1_TT2_2_USFGRO1_VW2_WG16_4_1_WGM1
    SolutionIndex: 52
    SolutionNameMin: Cijk_Ailk_Bljk_HB_MT64x16x8_SN_APM1_EPS1_FL0_GRVW4_GSU1_LPB0_LRVW4_NLCB1_PGR1_PLR1_TT4_4_USFGRO0_VW4_WG16_4_1_WGM1
    SolutionIndex: 53
    SolutionNameMin: Cijk_Ailk_Bljk_HB_MT64x128x16_SN_APM1_EPS1_FL0_GRVW4_GSU1_LPB0_LRVW4_NLCB1_PGR1_PLR1_TT4_8_USFGRO0_VW4_WG16_16_1_WGM8
    SolutionIndex: 54
    SolutionNameMin: Cijk_Ailk_Bljk_HB_MT64x16x16_SN_APM1_EPS1_FL0_GRVW2_GSU1_LPB0_LRVW2_NLCB1_PGR1_PLR1_TT2_2_USFGRO1_VW2_WG32_8_1_WGM1
    SolutionIndex: 55
    SolutionNameMin: Cijk_Ailk_Bljk_HB_MT64x128x16_SN_APM0_EPS0_FL1_GRVW2_GSU1_LPB4_LRVW4_NLCB1_PGR0_PLR1_TT8_4_USFGRO1_VW4_WG8_32_1_WGM1
    SolutionIndex: 56
    SolutionNameMin: Cijk_Ailk_Bljk_HB_MT32x16x32_SN_APM1_EPS1_FL0_GRVW2_GSU1_LPB0_LRVW2_NLCB1_PGR1_PLR1_TT2_2_USFGRO1_VW2_WG16_8_1_WGM1
    SolutionIndex: 57
    SolutionNameMin: Cijk_Ailk_Bljk_HB_MT64x16x16_SN_APM1_EPS1_FL0_GRVW2_GSU1_LPB0_LRVW2_NLCB1_PGR1_PLR1_TT2_2_USFGRO1_VW2_WG32_8_1_WGM8
    SolutionIndex: 58
    SolutionNameMin: Cijk_Ailk_Bljk_HB_MT64x64x16_SN_APM1_EPS1_FL0_GRVW8_GSU1_LPB0_LRVW8_NLCB1_PGR1_PLR1_TT8_8_USFGRO0_VW8_WG8_8_1_WGM8
    SolutionIndex: 59
    SolutionNameMin: Cijk_Ailk_Bljk_HB_MT256x32x16_SN_APM1_EPS0_FL0_GRVW4_GSU1_LPB4_LRVW4_NLCB1_PGR0_PLR0_TT8_4_USFGRO0_VW4_WG32_8_1_WGM8
- - - [1024, 1024, 1, 3328]
    - [1, 12.817]
  - - [2944, 4288, 1, 1280]
    - [2, 21.523]
  - - [2368, 64, 1, 3328]
    - [1, 4.079]
  - - [1760, 32, 1, 1760]
    - [3, 1.121]
  - - [2368, 5888, 1, 256]
    - [4, 16.175]
  - - [256, 704, 1, 1280]
    - [5, 2.946]
  - - [512, 24000, 1, 1536]
    - [6, 20.806]
  - - [128, 6784, 1, 3328]
    - [7, 10.812]
  - - [5888, 1856, 1, 3328]
    - [2, 20.868]
  - - [512, 4, 1, 512]
    - [8, 0.021]
  - - [5888, 2944, 1, 3328]
    - [2, 22.501]
  - - [1856, 4288, 1, 256]
    - [9, 14.912]
  - - [5056, 5056, 1, 3328]
    - [4, 22.51]
  - - [1408, 5888, 1, 1280]
    - [10, 18.637]
  - - [6144, 6000, 1, 2560]
    - [11, 23.101]
  - - [1024, 3584, 1, 3328]
    - [12, 18.68]
  - - [512, 48000, 1, 2048]
    - [9, 22.594]
  - - [448, 3584, 1, 3328]
    - [13, 14.399]
  - - [256, 4288, 1, 3328]
    - [1, 12.717]
  - - [5888, 1408, 1, 1280]
    - [6, 19.265]
  - - [704, 1856, 1, 3328]
    - [10, 13.982]
  - - [1024, 2368, 1, 256]
    - [6, 9.03]
  - - [5056, 6784, 1, 1280]
    - [14, 22.469]
  - - [1408, 64, 1, 1280]
    - [3, 1.721]
  - - [448, 1024, 1, 1280]
    - [15, 6.634]
  - - [4096, 32, 1, 4096]
    - [1, 3.741]
  - - [5056, 5056, 1, 1280]
    - [16, 21.694]
  - - [4288, 6784, 1, 256]
    - [4, 18.267]
  - - [6784, 448, 1, 256]
    - [13, 9.889]
  - - [5056, 256, 1, 1280]
    - [10, 13.153]
  - - [5888, 704, 1, 1280]
    - [16, 14.62]
  - - [3584, 1024, 1, 256]
    - [9, 12.236]
  - - [6784, 4288, 1, 3328]
    - [2, 23.051]
  - - [1856, 2368, 1, 3328]
    - [4, 18.276]
  - - [5888, 2944, 1, 1280]
    - [16, 21.408]
  - - [5888, 1024, 1, 256]
    - [2, 14.104]
  - - [448, 64, 1, 1280]
    - [17, 0.494]
  - - [3072, 64, 1, 1024]
    - [3, 2.969]
  - - [2560, 16, 1, 2560]
    - [1, 1.025]
  - - [1024, 704, 1, 256]
    - [18, 3.964]
  - - [1408, 2944, 1, 256]
    - [6, 12.112]
  - - [256, 1856, 1, 1280]
    - [19, 6.703]
  - - [6784, 5056, 1, 3328]
    - [4, 23.291]
  - - [5056, 5056, 1, 256]
    - [12, 17.878]
  - - [256, 2944, 1, 3328]
    - [1, 11.536]
  - - [64, 1024, 1, 1280]
    - [3, 1.133]
  - - [1024, 3584, 1, 1280]
    - [9, 17.565]
  - - [2368, 2944, 1, 1280]
    - [20, 18.545]
  - - [128, 3584, 1, 1280]
    - [21, 6.172]
  - - [6784, 6784, 1, 1280]
    - [4, 22.943]
  - - [1024, 256, 1, 3328]
    - [1, 6.328]
  - - [1408, 4288, 1, 1280]
    - [2, 17.042]
  - - [3584, 4288, 1, 1280]
    - [22, 20.847]
  - - [512, 6000, 1, 2560]
    - [20, 15.902]
  - - [2368, 704, 1, 1280]
    - [13, 13.704]
  - - [5056, 4288, 1, 3328]
    - [4, 22.119]
  - - [3584, 2368, 1, 3328]
    - [2, 20.79]
  - - [5888, 6784, 1, 1280]
    - [4, 22.71]
  - - [64, 704, 1, 1280]
    - [23, 0.804]
  - - [4288, 256, 1, 256]
    - [19, 5.694]
  - - [6144, 32, 1, 2560]
    - [1, 4.78]
  - - [6784, 448, 1, 1280]
    - [2, 14.65]
  - - [2944, 5888, 1, 256]
    - [24, 17.388]
  - - [256, 128, 1, 256]
    - [25, 0.256]
  - - [4288, 2944, 1, 256]
    - [26, 15.249]
  - - [1760, 16, 1, 1760]
    - [1, 0.54]
  - - [6144, 24000, 1, 2560]
    - [22, 23.931]
  - - [5888, 64, 1, 3328]
    - [1, 9.204]
  - - [2944, 256, 1, 3328]
    - [1, 11.008]
  - - [5056, 2368, 1, 1280]
    - [2, 20.404]
  - - [448, 3584, 1, 1280]
    - [13, 13.231]
  - - [6784, 5888, 1, 256]
    - [27, 20.47]
  - - [64, 1024, 1, 3328]
    - [1, 1.973]
  - - [704, 128, 1, 1280]
    - [17, 1.573]
  - - [1408, 448, 1, 1280]
    - [28, 8.109]
  - - [1024, 1408, 1, 256]
    - [26, 6.877]
  - - [2368, 2368, 1, 3328]
    - [9, 19.915]
  - - [5056, 704, 1, 3328]
    - [16, 18.157]
  - - [1408, 1856, 1, 256]
    - [2, 9.333]
  - - [1408, 256, 1, 1280]
    - [1, 5.206]
  - - [3072, 128, 1, 1024]
    - [1, 5.608]
  - - [5888, 1856, 1, 256]
    - [28, 13.323]
  - - [704, 5888, 1, 256]
    - [10, 11.15]
  - - [6784, 64, 1, 256]
    - [28, 2.258]
  - - [128, 1, 1, 1408]
    - [1, 0.003]
  - - [3584, 704, 1, 3328]
    - [6, 16.411]
  - - [1408, 1408, 1, 256]
    - [10, 8.038]
  - - [1024, 64, 1, 1280]
    - [17, 1.281]
  - - [8448, 4, 1, 2816]
    - [29, 0.811]
  - - [448, 4288, 1, 256]
    - [7, 7.784]
  - - [64, 3584, 1, 3328]
    - [30, 4.96]
  - - [704, 2368, 1, 1280]
    - [13, 13.663]
  - - [7680, 16, 1, 2560]
    - [31, 2.696]
  - - [1856, 2368, 1, 1280]
    - [12, 15.64]
  - - [2368, 128, 1, 3328]
    - [1, 8.066]
  - - [1408, 1408, 1, 3328]
    - [1, 15.798]
  - - [2944, 128, 1, 256]
    - [21, 1.956]
  - - [448, 1408, 1, 256]
    - [10, 3.002]
  - - [64, 5056, 1, 3328]
    - [19, 5.186]
  - - [512, 1500, 1, 2816]
    - [13, 9.939]
  - - [256, 193600, 1, 64]
    - [32, 12.116]
  - - [1408, 1024, 1, 1280]
    - [10, 13.956]
  - - [704, 6784, 1, 256]
    - [10, 12.905]
  - - [6784, 704, 1, 256]
    - [4, 12.817]
  - - [2048, 7000, 1, 2048]
    - [6, 21.372]
  - - [256, 3584, 1, 3328]
    - [19, 11.79]
  - - [5056, 704, 1, 256]
    - [2, 10.587]
  - - [1408, 3584, 1, 256]
    - [27, 12.748]
  - - [3584, 4288, 1, 3328]
    - [4, 22.242]
  - - [5888, 1856, 1, 1280]
    - [22, 20.068]
  - - [256, 1408, 1, 256]
    - [21, 1.976]
  - - [5056, 64, 1, 1280]
    - [1, 5.482]
  - - [2368, 128, 1, 256]
    - [33, 1.803]
  - - [2368, 3584, 1, 1280]
    - [2, 19.747]
  - - [1024, 256, 1, 256]
    - [34, 1.671]
  - - [448, 448, 1, 256]
    - [3, 1.333]
  - - [2944, 3584, 1, 3328]
    - [4, 21.494]
  - - [7680, 32, 1, 2560]
    - [5, 4.818]
  - - [256, 256, 1, 3328]
    - [1, 1.916]
  - - [128, 1024, 1, 3328]
    - [1, 3.728]
  - - [6784, 2944, 1, 256]
    - [35, 16.403]
  - - [64, 1856, 1, 1280]
    - [3, 2.239]
  - - [448, 256, 1, 256]
    - [30, 0.811]
  - - [1024, 1500, 1, 2560]
    - [36, 12.571]
  - - [1856, 2368, 1, 256]
    - [10, 11.805]
  - - [3584, 6784, 1, 3328]
    - [9, 22.852]
  - - [256, 1024, 1, 256]
    - [31, 1.666]
  - - [1024, 128, 1, 1280]
    - [5, 2.344]
  - - [3072, 32, 1, 1024]
    - [29, 1.753]
  - - [4288, 128, 1, 1280]
    - [1, 7.989]
  - - [5056, 4288, 1, 1280]
    - [4, 21.472]
  - - [5888, 64, 1, 256]
    - [19, 1.911]
  - - [6784, 1856, 1, 3328]
    - [4, 22.017]
  - - [1408, 5056, 1, 1280]
    - [6, 18.25]
  - - [1856, 256, 1, 1280]
    - [1, 7.243]
  - - [64, 5888, 1, 3328]
    - [37, 5.98]
  - - [196, 1024, 64, 256]
    - [6, 12.418]
  - - [6784, 5888, 1, 3328]
    - [4, 23.264]
  - - [4608, 1, 1, 1536]
    - [38, 0.103]
  - - [448, 256, 1, 3328]
    - [1, 3.519]
  - - [2368, 5056, 1, 1280]
    - [14, 20.091]
  - - [7680, 4, 1, 2560]
    - [39, 0.725]
  - - [1024, 704, 1, 1280]
    - [40, 9.391]
  - - [256, 1408, 1, 3328]
    - [1, 8.749]
  - - [6784, 128, 1, 3328]
    - [1, 13.146]
  - - [1024, 5056, 1, 1280]
    - [41, 16.105]
  - - [4288, 1024, 1, 256]
    - [10, 12.8]
  - - [2368, 1408, 1, 256]
    - [9, 10.848]
  - - [704, 704, 1, 3328]
    - [1, 10.732]
  - - [5888, 448, 1, 1280]
    - [4, 15.776]
  - - [3584, 256, 1, 3328]
    - [42, 11.878]
  - - [704, 5888, 1, 3328]
    - [4, 17.314]
  - - [1024, 6784, 1, 1280]
    - [13, 17.465]
  - - [128, 3584, 1, 3328]
    - [1, 9.174]
  - - [128, 704, 1, 1280]
    - [8, 1.466]
  - - [3584, 2944, 1, 1280]
    - [9, 20.821]
  - - [1856, 128, 1, 3328]
    - [1, 6.889]
  - - [512, 6000, 1, 2816]
    - [42, 16.257]
  - - [128, 2944, 1, 1280]
    - [1, 5.748]
  - - [512, 24000, 1, 2048]
    - [6, 21.007]
  - - [448, 1856, 1, 1280]
    - [13, 10.6]
  - - [1408, 5056, 1, 3328]
    - [2, 19.945]
  - - [1856, 1856, 1, 3328]
    - [20, 18.421]
  - - [3584, 128, 1, 256]
    - [10, 2.769]
  - - [448, 1408, 1, 3328]
    - [1, 9.603]
  - - [2368, 2368, 1, 256]
    - [4, 12.942]
  - - [4288, 4288, 1, 1280]
    - [9, 21.538]
  - - [64, 448, 1, 1280]
    - [38, 0.419]
  - - [5888, 1024, 1, 1280]
    - [9, 17.42]
  - - [704, 1024, 1, 256]
    - [10, 3.756]
  - - [1024, 12544, 1, 256]
    - [20, 15.085]
  - - [512, 48000, 1, 2560]
    - [4, 22.856]
  - - [8448, 16, 1, 2816]
    - [3, 3.038]
  - - [704, 6784, 1, 3328]
    - [14, 18.759]
  - - [5888, 5888, 1, 3328]
    - [11, 23.073]
  - - [5056, 1024, 1, 1280]
    - [4, 17.569]
  - - [448, 5888, 1, 3328]
    - [14, 17.037]
  - - [3072, 2, 1, 1024]
    - [1, 0.12]
  - - [1024, 2944, 1, 1280]
    - [2, 14.419]
  - - [5056, 5888, 1, 1280]
    - [4, 21.939]
  - - [448, 6784, 1, 256]
    - [10, 10.505]
  - - [256, 3584, 1, 256]
    - [13, 5.101]
  - - [256, 448, 1, 256]
    - [30, 0.986]
  - - [6144, 16, 1, 2560]
    - [38, 2.451]
  - - [3584, 5888, 1, 256]
    - [16, 17.379]
  - - [2944, 3584, 1, 256]
    - [2, 16.936]
  - - [512, 32, 1, 512]
    - [43, 0.184]
  - - [3072, 1500, 1, 1024]
    - [26, 15.279]
  - - [1408, 704, 1, 256]
    - [10, 4.979]
  - - [6784, 1024, 1, 3328]
    - [6, 19.311]
  - - [6784, 2944, 1, 3328]
    - [2, 22.295]
  - - [7680, 1, 1, 2560]
    - [3, 0.183]
  - - [64, 64, 1, 3328]
    - [1, 0.113]
  - - [512, 1, 1, 512]
    - [25, 0.004]
  - - [6784, 2368, 1, 1280]
    - [9, 21.302]
  - - [512, 2, 1, 512]
    - [30, 0.011]
  - - [4288, 3584, 1, 256]
    - [11, 17.741]
  - - [4288, 5888, 1, 1280]
    - [14, 21.746]
  - - [4608, 4, 1, 1536]
    - [1, 0.377]
  - - [1024, 6000, 1, 1536]
    - [2, 18.547]
  - - [8448, 32, 1, 2816]
    - [1, 5.421]
  - - [448, 2944, 1, 3328]
    - [10, 14.151]
  - - [4288, 1856, 1, 1280]
    - [2, 18.179]
  - - [1856, 2944, 1, 3328]
    - [2, 19.403]
  - - [256, 6784, 1, 3328]
    - [13, 16.241]
  - - [512, 3000, 1, 1536]
    - [10, 11.362]
  - - [64, 5888, 1, 256]
    - [19, 2.493]
  - - [5056, 1024, 1, 256]
    - [10, 13.678]
  - - [704, 64, 1, 3328]
    - [1, 1.245]
  - - [5056, 1856, 1, 3328]
    - [2, 21.19]
  - - [512, 1500, 1, 2048]
    - [10, 9.978]
  - - [1024, 1, 1, 500000]
    - [0, 0.0]
  - - [448, 448, 1, 3328]
    - [1, 5.69]
  - - [448, 2368, 1, 1280]
    - [10, 10.858]
  - - [1408, 128, 1, 1280]
    - [1, 3.569]
  - - [4096, 7000, 1, 4096]
    - [27, 22.746]
  - - [5056, 256, 1, 3328]
    - [26, 13.626]
  - - [704, 704, 1, 256]
    - [44, 2.319]
  - - [1024, 5888, 1, 1280]
    - [14, 16.86]
  - - [64, 128, 1, 256]
    - [1, 0.038]
  - - [128, 1856, 1, 1280]
    - [31, 4.019]
  - - [5056, 3584, 1, 256]
    - [24, 17.539]
  - - [1856, 1024, 1, 1280]
    - [13, 15.04]
  - - [64, 193600, 1, 64]
    - [7, 9.774]
  - - [1856, 1856, 1, 1280]
    - [20, 16.543]
  - - [3072, 24000, 1, 1024]
    - [9, 23.149]
  - - [128, 4288, 1, 3328]
    - [1, 11.234]
  - - [1856, 1024, 1, 3328]
    - [13, 17.324]
  - - [256, 2368, 1, 256]
    - [44, 3.188]
  - - [1024, 448, 1, 3328]
    - [1, 8.827]
  - - [1856, 704, 1, 1280]
    - [10, 12.933]
  - - [6784, 1024, 1, 256]
    - [9, 15.157]
  - - [5056, 5888, 1, 3328]
    - [9, 22.767]
  - - [1856, 1024, 1, 256]
    - [10, 8.856]
  - - [512, 48000, 1, 1536]
    - [2, 22.556]
  - - [5056, 1408, 1, 3328]
    - [2, 20.012]
  - - [1024, 1024, 1, 1280]
    - [44, 9.92]
  - - [448, 5888, 1, 256]
    - [10, 9.654]
  - - [2048, 128, 1, 2048]
    - [1, 5.702]
  - - [1408, 6784, 1, 3328]
    - [2, 21.697]
  - - [1024, 24000, 1, 2560]
    - [2, 22.961]
  - - [2944, 1408, 1, 3328]
    - [1, 17.916]
  - - [2944, 4288, 1, 3328]
    - [2, 22.07]
  - - [256, 2944, 1, 256]
    - [44, 3.907]
  - - [5056, 2944, 1, 256]
    - [9, 17.673]
  - - [1024, 700, 1, 512]
    - [10, 5.382]
  - - [3072, 1, 1, 128]
    - [25, 0.012]
  - - [2368, 1856, 1, 256]
    - [10, 12.955]
  - - [128, 6784, 1, 1280]
    - [10, 10.824]
  - - [1408, 3584, 1, 3328]
    - [1, 18.436]
  - - [2368, 6784, 1, 256]
    - [7, 15.657]
  - - [4288, 2368, 1, 3328]
    - [9, 20.902]
  - - [704, 3584, 1, 1280]
    - [12, 15.101]
  - - [1408, 5888, 1, 3328]
    - [4, 20.743]
  - - [1856, 5056, 1, 256]
    - [4, 16.176]
  - - [6784, 6784, 1, 256]
    - [9, 20.068]
  - - [1408, 704, 1, 3328]
    - [1, 12.307]
  - - [128, 5888, 1, 1280]
    - [1, 9.389]
  - - [2368, 4288, 1, 1280]
    - [2, 20.124]
  - - [3584, 1856, 1, 1280]
    - [16, 18.726]
  - - [704, 1408, 1, 3328]
    - [1, 12.218]
  - - [704, 64, 1, 1280]
    - [39, 0.866]
  - - [8448, 48000, 1, 2816]
    - [27, 24.073]
  - - [512, 6000, 1, 2048]
    - [9, 15.278]
  - - [3584, 448, 1, 256]
    - [13, 7.632]
  - - [3584, 3584, 1, 1280]
    - [6, 20.162]
  - - [7680, 64, 1, 2560]
    - [1, 9.399]
  - - [256, 6784, 1, 256]
    - [45, 7.029]
  - - [1856, 3584, 1, 3328]
    - [9, 20.839]
  - - [128, 448, 1, 256]
    - [5, 0.462]
  - - [2048, 32, 1, 2048]
    - [1, 1.669]
  - - [3584, 3584, 1, 256]
    - [46, 14.914]
  - - [6784, 4288, 1, 1280]
    - [2, 22.129]
  - - [448, 704, 1, 1280]
    - [1, 5.394]
  - - [3584, 5056, 1, 256]
    - [2, 17.626]
  - - [6784, 128, 1, 256]
    - [19, 4.266]
  - - [64, 1408, 1, 3328]
    - [1, 2.683]
  - - [704, 448, 1, 256]
    - [19, 1.638]
  - - [2944, 2368, 1, 1280]
    - [6, 18.03]
  - - [448, 64, 1, 3328]
    - [1, 0.832]
  - - [6784, 3584, 1, 256]
    - [22, 16.896]
  - - [256, 1856, 1, 3328]
    - [1, 9.915]
  - - [256, 704, 1, 256]
    - [23, 0.986]
  - - [128, 1408, 1, 256]
    - [21, 1.057]
  - - [64, 128, 1, 3328]
    - [1, 0.246]
  - - [1856, 1408, 1, 256]
    - [14, 9.917]
  - - [2944, 2944, 1, 3328]
    - [9, 21.318]
  - - [5056, 6784, 1, 256]
    - [35, 18.82]
  - - [1408, 4288, 1, 3328]
    - [9, 18.945]
  - - [6784, 256, 1, 1280]
    - [13, 14.092]
  - - [1024, 704, 1, 3328]
    - [1, 10.674]
  - - [2368, 704, 1, 3328]
    - [13, 15.257]
  - - [128, 4288, 1, 256]
    - [21, 2.616]
  - - [3584, 6784, 1, 256]
    - [12, 17.26]
  - - [128, 128, 1, 3328]
    - [1, 0.481]
  - - [5056, 1856, 1, 256]
    - [9, 16.055]
  - - [1024, 3000, 1, 2816]
    - [1, 17.084]
  - - [64, 1, 1, 1216]
    - [1, 0.001]
  - - [704, 4288, 1, 256]
    - [10, 10.708]
  - - [256, 448, 1, 3328]
    - [1, 3.515]
  - - [1408, 6784, 1, 1280]
    - [27, 20.106]
  - - [7680, 24000, 1, 2560]
    - [27, 23.936]
  - - [64, 2368, 1, 1280]
    - [1, 2.531]
  - - [4608, 48000, 1, 1536]
    - [4, 23.889]
  - - [64, 6784, 1, 3328]
    - [33, 6.897]
  - - [2944, 256, 1, 1280]
    - [47, 9.198]
  - - [2048, 16, 1, 2048]
    - [1, 0.744]
  - - [1024, 24000, 1, 1536]
    - [2, 22.758]
  - - [5056, 2368, 1, 3328]
    - [9, 21.056]
  - - [2944, 4288, 1, 256]
    - [45, 14.748]
  - - [1408, 3584, 1, 1280]
    - [13, 16.069]
  - - [2368, 64, 1, 256]
    - [17, 1.071]
  - - [256, 256, 1, 256]
    - [17, 0.497]
  - - [704, 128, 1, 3328]
    - [1, 2.474]
  - - [1856, 704, 1, 256]
    - [10, 6.879]
  - - [1024, 1500, 1, 2816]
    - [13, 13.683]
  - - [8448, 1, 1, 2816]
    - [1, 0.177]
  - - [1024, 6000, 1, 2048]
    - [14, 18.398]
  - - [512, 24000, 1, 2560]
    - [6, 21.325]
  - - [6144, 3000, 1, 2560]
    - [6, 22.313]
  - - [2368, 6784, 1, 3328]
    - [2, 21.818]
  - - [5056, 704, 1, 1280]
    - [20, 17.246]
  - - [1856, 4288, 1, 3328]
    - [6, 19.613]
  - - [1408, 5888, 1, 256]
    - [2, 15.148]
  - - [704, 2944, 1, 1280]
    - [4, 12.394]
  - - [4288, 64, 1, 1280]
    - [1, 4.34]
  - - [704, 1856, 1, 256]
    - [10, 6.616]
  - - [2560, 64, 1, 2560]
    - [1, 3.993]
  - - [3584, 704, 1, 1280]
    - [4, 14.992]
  - - [5888, 5056, 1, 256]
    - [2, 18.739]
  - - [3584, 448, 1, 3328]
    - [13, 14.812]
  - - [704, 2368, 1, 3328]
    - [13, 14.622]
  - - [2944, 448, 1, 256]
    - [10, 6.581]
  - - [448, 5056, 1, 3328]
    - [10, 16.108]
  - - [2368, 128, 1, 1280]
    - [1, 5.063]
  - - [4288, 448, 1, 256]
    - [10, 8.686]
  - - [64, 6784, 1, 256]
    - [10, 2.06]
  - - [64, 5056, 1, 1280]
    - [1, 4.217]
  - - [5888, 2368, 1, 256]
    - [46, 16.495]
  - - [704, 448, 1, 3328]
    - [43, 4.89]
  - - [6784, 704, 1, 3328]
    - [6, 19.894]
  - - [128, 64, 1, 1280]
    - [23, 0.146]
  - - [2368, 256, 1, 1280]
    - [42, 7.629]
  - - [1408, 2944, 1, 3328]
    - [1, 18.095]
  - - [64, 1024, 1, 256]
    - [48, 0.346]
  - - [2368, 448, 1, 1280]
    - [10, 10.138]
  - - [128, 3584, 1, 256]
    - [10, 2.794]
  - - [1856, 448, 1, 3328]
    - [1, 12.663]
  - - [6144, 4, 1, 2560]
    - [1, 0.602]
  - - [128, 5056, 1, 256]
    - [44, 4.238]
  - - [4288, 4288, 1, 256]
    - [4, 18.165]
  - - [2368, 704, 1, 256]
    - [13, 7.926]
  - - [3584, 2368, 1, 256]
    - [9, 15.74]
  - - [5888, 5056, 1, 1280]
    - [4, 22.353]
  - - [128, 1024, 1, 1280]
    - [5, 2.511]
  - - [8448, 24000, 1, 2816]
    - [4, 23.939]
  - - [64, 704, 1, 256]
    - [29, 0.335]
  - - [4288, 256, 1, 1280]
    - [44, 10.82]
  - - [3584, 3584, 1, 3328]
    - [11, 21.048]
  - - [128, 1024, 1, 256]
    - [43, 0.751]
  - - [3072, 1500, 1, 128]
    - [6, 9.796]
  - - [2048, 3136, 1, 512]
    - [4, 15.441]
  - - [5888, 6784, 1, 256]
    - [2, 20.389]
  - - [4288, 2944, 1, 3328]
    - [14, 21.274]
  - - [1856, 64, 1, 256]
    - [17, 0.713]
  - - [1024, 16, 1, 500000]
    - [0, 0.0]
  - - [4288, 128, 1, 3328]
    - [1, 11.468]
  - - [7680, 128, 1, 2560]
    - [37, 12.038]
  - - [256, 5056, 1, 1280]
    - [10, 12.548]
  - - [6784, 5888, 1, 1280]
    - [2, 22.856]
  - - [3072, 1, 1, 1024]
    - [1, 0.057]
  - - [704, 128, 1, 256]
    - [3, 0.665]
  - - [5888, 4288, 1, 1280]
    - [9, 22.365]
  - - [1024, 24000, 1, 2048]
    - [4, 22.852]
  - - [448, 256, 1, 1280]
    - [31, 2.111]
  - - [448, 2368, 1, 3328]
    - [49, 11.26]
  - - [256, 1408, 1, 1280]
    - [1, 5.293]
  - - [3072, 16, 1, 1024]
    - [29, 0.828]
  - - [1408, 1856, 1, 1280]
    - [12, 15.711]
  - - [1024, 2, 1, 512]
    - [1, 0.017]
  - - [5888, 448, 1, 3328]
    - [4, 17.518]
  - - [704, 5888, 1, 1280]
    - [16, 16.013]
  - - [256, 64, 1, 3328]
    - [1, 0.481]
  - - [128, 2368, 1, 256]
    - [43, 1.877]
  - - [6784, 64, 1, 3328]
    - [1, 8.982]
  - - [5056, 2944, 1, 3328]
    - [4, 21.651]
  - - [448, 128, 1, 256]
    - [5, 0.416]
  - - [4096, 16, 1, 4096]
    - [17, 1.761]
  - - [1856, 128, 1, 1280]
    - [30, 4.076]
  - - [448, 4288, 1, 1280]
    - [10, 14.664]
  - - [64, 3584, 1, 256]
    - [31, 1.73]
  - - [128, 2944, 1, 3328]
    - [1, 9.582]
  - - [3584, 704, 1, 256]
    - [45, 9.043]
  - - [2944, 448, 1, 3328]
    - [26, 13.87]
  - - [1024, 2, 1, 500000]
    - [0, 0.0]
  - - [3584, 1408, 1, 3328]
    - [1, 18.465]
  - - [2368, 1024, 1, 1280]
    - [2, 14.534]
  - - [2944, 6784, 1, 1280]
    - [9, 21.612]
  - - [1856, 6784, 1, 256]
    - [4, 14.754]
  - - [4288, 448, 1, 3328]
    - [13, 17.704]
  - - [6784, 704, 1, 1280]
    - [12, 18.259]
  - - [6144, 1, 1, 2560]
    - [1, 0.164]
  - - [5888, 1024, 1, 3328]
    - [4, 19.021]
  - - [704, 6784, 1, 1280]
    - [10, 17.149]
  - - [5888, 128, 1, 256]
    - [44, 4.643]
  - - [512, 3000, 1, 2048]
    - [19, 11.809]
  - - [5056, 1024, 1, 3328]
    - [42, 18.732]
  - - [704, 5056, 1, 1280]
    - [4, 16.988]
  - - [64, 704, 1, 3328]
    - [1, 1.283]
  - - [2944, 1856, 1, 256]
    - [6, 13.711]
  - - [5056, 64, 1, 256]
    - [50, 1.697]
  - - [512, 1500, 1, 1536]
    - [18, 9.555]
  - - [512, 1, 1, 500000]
    - [0, 0.0]
  - - [5888, 5056, 1, 3328]
    - [4, 22.85]
  - - [128, 5056, 1, 3328]
    - [1, 9.538]
  - - [3584, 6784, 1, 1280]
    - [6, 21.879]
  - - [1856, 5888, 1, 256]
    - [27, 13.387]
  - - [64, 448, 1, 3328]
    - [1, 0.82]
  - - [4288, 4288, 1, 3328]
    - [9, 22.645]
  - - [4288, 1408, 1, 1280]
    - [16, 17.151]
  - - [64, 1856, 1, 256]
    - [30, 0.954]
  - - [4288, 2368, 1, 256]
    - [9, 16.557]
  - - [2944, 5056, 1, 1280]
    - [9, 20.911]
  - - [256, 4288, 1, 1280]
    - [10, 11.074]
  - - [6784, 2368, 1, 3328]
    - [2, 21.822]
  - - [256, 1024, 1, 1280]
    - [1, 4.496]
  - - [4288, 128, 1, 256]
    - [44, 3.556]
  - - [4288, 1856, 1, 3328]
    - [4, 19.917]
  - - [1856, 2944, 1, 1280]
    - [4, 18.187]
  - - [3584, 64, 1, 1280]
    - [31, 3.871]
  - - [4288, 6784, 1, 3328]
    - [14, 22.508]
  - - [3584, 1024, 1, 1280]
    - [9, 17.511]
  - - [1024, 4288, 1, 256]
    - [10, 12.565]
  - - [5888, 3584, 1, 3328]
    - [16, 22.397]
  - - [5056, 3584, 1, 3328]
    - [2, 22.279]
  - - [1408, 128, 1, 3328]
    - [1, 4.818]
  - - [2368, 1408, 1, 1280]
    - [14, 15.96]
  - - [5056, 2944, 1, 1280]
    - [9, 20.418]
  - - [8448, 6000, 1, 2816]
    - [11, 23.437]
  - - [3584, 256, 1, 256]
    - [19, 4.639]
  - - [1024, 6784, 1, 256]
    - [27, 14.312]
  - - [2944, 5056, 1, 3328]
    - [9, 21.644]
  - - [3584, 2944, 1, 256]
    - [4, 16.848]
  - - [448, 128, 1, 3328]
    - [1, 1.748]
  - - [64, 2944, 1, 3328]
    - [1, 4.876]
  - - [64, 4288, 1, 3328]
    - [1, 5.859]
  - - [5056, 6784, 1, 3328]
    - [14, 22.943]
  - - [128, 2944, 1, 256]
    - [33, 1.982]
  - - [3584, 4288, 1, 256]
    - [9, 18.645]
  - - [1856, 6784, 1, 3328]
    - [14, 21.946]
  - - [3584, 128, 1, 3328]
    - [1, 10.167]
  - - [128, 256, 1, 1280]
    - [43, 0.598]
  - - [64, 448, 1, 256]
    - [29, 0.223]
  - - [128, 1500, 1, 1280]
    - [1, 3.694]
  - - [64, 256, 1, 1280]
    - [25, 0.285]
  - - [512, 6000, 1, 1536]
    - [14, 15.134]
  - - [5056, 1408, 1, 1280]
    - [22, 18.464]
  - - [5888, 5888, 1, 256]
    - [4, 19.214]
  - - [4288, 1024, 1, 1280]
    - [6, 15.747]
  - - [5888, 128, 1, 3328]
    - [1, 11.656]
  - - [448, 6784, 1, 3328]
    - [16, 15.581]
  - - [2944, 1408, 1, 1280]
    - [14, 15.29]
  - - [64, 128, 1, 1280]
    - [17, 0.132]
  - - [3072, 6000, 1, 1024]
    - [16, 20.719]
  - - [1024, 32, 1, 512]
    - [38, 0.355]
  - - [2944, 1856, 1, 3328]
    - [16, 19.403]
  - - [448, 5056, 1, 256]
    - [10, 9.344]
  - - [64, 64, 1, 256]
    - [51, 0.025]
  - - [3584, 5888, 1, 1280]
    - [22, 21.613]
  - - [6784, 1856, 1, 1280]
    - [6, 21.007]
  - - [5888, 256, 1, 3328]
    - [1, 14.152]
  - - [1856, 5888, 1, 3328]
    - [11, 20.713]
  - - [3584, 1408, 1, 256]
    - [27, 12.525]
  - - [704, 3584, 1, 3328]
    - [13, 16.264]
  - - [5056, 448, 1, 1280]
    - [26, 13.697]
  - - [3584, 1856, 1, 3328]
    - [9, 20.791]
  - - [64, 193600, 1, 256]
    - [10, 15.165]
  - - [1024, 3000, 1, 2048]
    - [12, 15.619]
  - - [1408, 704, 1, 1280]
    - [1, 10.177]
  - - [2944, 1024, 1, 256]
    - [4, 10.681]
  - - [448, 1408, 1, 1280]
    - [47, 7.351]
  - - [2368, 4288, 1, 3328]
    - [6, 20.934]
  - - [1024, 1408, 1, 1280]
    - [10, 13.593]
  - - [256, 128, 1, 1280]
    - [1, 0.504]
  - - [704, 1408, 1, 1280]
    - [44, 9.373]
  - - [6784, 5056, 1, 256]
    - [2, 19.217]
  - - [4288, 5888, 1, 256]
    - [16, 17.858]
  - - [448, 2944, 1, 256]
    - [10, 6.296]
  - - [2944, 6784, 1, 256]
    - [16, 16.499]
  - - [2368, 2368, 1, 1280]
    - [6, 17.213]
  - - [1856, 3584, 1, 1280]
    - [4, 19.327]
  - - [64, 2944, 1, 256]
    - [25, 1.231]
  - - [3584, 1408, 1, 1280]
    - [9, 16.319]
  - - [5056, 3584, 1, 1280]
    - [16, 21.278]
  - - [256, 5888, 1, 256]
    - [13, 7.051]
  - - [128, 256, 1, 3328]
    - [1, 0.99]
  - - [1856, 1408, 1, 3328]
    - [12, 16.668]
  - - [1024, 4288, 1, 3328]
    - [10, 18.415]
  - - [448, 2368, 1, 256]
    - [44, 5.291]
  - - [64, 1408, 1, 1280]
    - [1, 1.728]
  - - [64, 6784, 1, 1280]
    - [7, 5.866]
  - - [2944, 2368, 1, 3328]
    - [2, 19.629]
  - - [704, 4288, 1, 3328]
    - [1, 16.675]
  - - [1024, 48000, 1, 2816]
    - [27, 23.616]
  - - [1024, 1856, 1, 1280]
    - [13, 15.837]
  - - [6784, 1856, 1, 256]
    - [4, 15.146]
  - - [512, 48000, 1, 2816]
    - [16, 22.894]
  - - [512, 3000, 1, 2816]
    - [13, 13.683]
  - - [128, 2368, 1, 3328]
    - [10, 4.592]
  - - [1024, 5888, 1, 256]
    - [2, 13.671]
  - - [64, 2944, 1, 1280]
    - [5, 3.194]
  - - [5056, 64, 1, 3328]
    - [1, 8.912]
  - - [1408, 2368, 1, 256]
    - [10, 11.583]
  - - [2944, 704, 1, 3328]
    - [1, 15.546]
  - - [256, 64, 1, 256]
    - [7, 0.088]
  - - [1024, 8, 1, 500000]
    - [0, 0.0]
  - - [2944, 2944, 1, 1280]
    - [9, 20.011]
  - - [6784, 256, 1, 3328]
    - [1, 16.051]
  - - [1408, 5056, 1, 256]
    - [6, 14.869]
  - - [512, 50176, 1, 128]
    - [4, 15.359]
  - - [5056, 128, 1, 3328]
    - [1, 9.624]
  - - [128, 128, 1, 1280]
    - [17, 0.293]
  - - [448, 704, 1, 256]
    - [15, 2.095]
  - - [1856, 256, 1, 3328]
    - [1, 10.177]
  - - [2944, 128, 1, 3328]
    - [1, 9.93]
  - - [704, 256, 1, 256]
    - [52, 1.058]
  - - [256, 448, 1, 1280]
    - [1, 1.81]
  - - [704, 256, 1, 1280]
    - [3, 3.221]
  - - [64, 2368, 1, 3328]
    - [1, 3.955]
  - - [256, 704, 1, 3328]
    - [5, 4.318]
  - - [1024, 1024, 1, 256]
    - [19, 5.517]
  - - [4096, 64, 1, 4096]
    - [1, 7.527]
  - - [1408, 4288, 1, 256]
    - [6, 13.918]
  - - [5888, 2368, 1, 1280]
    - [6, 20.828]
  - - [128, 256, 1, 256]
    - [29, 0.249]
  - - [256, 64, 1, 1280]
    - [31, 0.277]
  - - [2368, 5888, 1, 1280]
    - [4, 20.712]
  - - [5888, 256, 1, 1280]
    - [13, 12.069]
  - - [1760, 128, 1, 1760]
    - [1, 4.352]
  - - [704, 1024, 1, 1280]
    - [28, 8.908]
  - - [2368, 1856, 1, 3328]
    - [4, 18.054]
  - - [2944, 704, 1, 256]
    - [10, 8.709]
  - - [2368, 6784, 1, 1280]
    - [9, 21.326]
  - - [2368, 1024, 1, 3328]
    - [10, 17.124]
  - - [1856, 4288, 1, 1280]
    - [16, 18.349]
  - - [704, 3584, 1, 256]
    - [9, 9.786]
  - - [704, 2944, 1, 3328]
    - [1, 15.27]
  - - [1856, 5056, 1, 3328]
    - [2, 21.226]
  - - [196, 256, 64, 1024]
    - [10, 12.485]
  - - [3584, 5056, 1, 1280]
    - [16, 20.841]
  - - [2944, 1024, 1, 3328]
    - [1, 17.545]
  - - [256, 4288, 1, 256]
    - [10, 5.388]
  - - [2368, 256, 1, 256]
    - [21, 3.344]
  - - [1408, 6784, 1, 256]
    - [9, 16.626]
  - - [6784, 1408, 1, 3328]
    - [2, 21.662]
  - - [1024, 2368, 1, 1280]
    - [4, 14.531]
  - - [704, 64, 1, 256]
    - [17, 0.348]
  - - [3072, 4, 1, 1024]
    - [1, 0.225]
  - - [256, 2368, 1, 3328]
    - [1, 9.233]
  - - [6784, 2944, 1, 1280]
    - [4, 21.549]
  - - [3584, 448, 1, 1280]
    - [13, 13.494]
  - - [2944, 6784, 1, 3328]
    - [2, 22.286]
  - - [448, 5056, 1, 1280]
    - [9, 13.092]
  - - [4288, 5056, 1, 1280]
    - [4, 21.527]
  - - [128, 448, 1, 1280]
    - [39, 1.028]
  - - [4288, 704, 1, 256]
    - [12, 9.456]
  - - [64, 64, 1, 1280]
    - [1, 0.072]
  - - [5888, 704, 1, 256]
    - [2, 12.175]
  - - [256, 5888, 1, 3328]
    - [13, 13.82]
  - - [6784, 4288, 1, 256]
    - [46, 18.698]
  - - [5888, 256, 1, 256]
    - [9, 6.664]
  - - [1024, 4, 1, 500000]
    - [0, 0.0]
  - - [6784, 1024, 1, 1280]
    - [12, 17.548]
  - - [704, 448, 1, 1280]
    - [1, 4.825]
  - - [512, 16, 1, 500000]
    - [0, 0.0]
  - - [128, 64, 1, 3328]
    - [1, 0.238]
  - - [448, 64, 1, 256]
    - [25, 0.217]
  - - [2944, 704, 1, 1280]
    - [12, 12.657]
  - - [6784, 3584, 1, 1280]
    - [14, 21.965]
  - - [2944, 64, 1, 1280]
    - [1, 2.845]
  - - [1408, 2944, 1, 1280]
    - [53, 14.719]
  - - [256, 1856, 1, 256]
    - [37, 2.766]
  - - [1408, 2368, 1, 3328]
    - [1, 17.899]
  - - [128, 1408, 1, 3328]
    - [1, 5.192]
  - - [2368, 2944, 1, 256]
    - [9, 13.812]
  - - [64, 5056, 1, 256]
    - [30, 1.745]
  - - [1408, 256, 1, 3328]
    - [1, 9.646]
  - - [1024, 16, 1, 512]
    - [54, 0.161]
  - - [7680, 2, 1, 2560]
    - [3, 0.368]
  - - [3584, 1856, 1, 256]
    - [6, 14.92]
  - - [4288, 3584, 1, 1280]
    - [16, 21.338]
  - - [2368, 448, 1, 256]
    - [44, 5.002]
  - - [4288, 256, 1, 3328]
    - [42, 12.568]
  - - [1408, 64, 1, 256]
    - [3, 0.562]
  - - [512, 16, 1, 512]
    - [30, 0.079]
  - - [4288, 2944, 1, 1280]
    - [14, 20.055]
  - - [5056, 448, 1, 3328]
    - [42, 16.454]
  - - [1024, 64, 1, 256]
    - [29, 0.488]
  - - [64, 2368, 1, 256]
    - [43, 1.026]
  - - [5124, 1500, 1, 2048]
    - [2, 18.59]
  - - [4288, 5056, 1, 3328]
    - [4, 22.147]
  - - [512, 2, 1, 500000]
    - [0, 0.0]
  - - [2944, 256, 1, 256]
    - [19, 4.43]
  - - [1024, 128, 1, 3328]
    - [1, 3.962]
  - - [256, 5056, 1, 3328]
    - [26, 13.884]
  - - [5056, 2368, 1, 256]
    - [45, 14.177]
  - - [4288, 704, 1, 3328]
    - [1, 16.643]
  - - [448, 3584, 1, 256]
    - [10, 7.513]
  - - [2368, 64, 1, 1280]
    - [3, 2.943]
  - - [6144, 1500, 1, 2560]
    - [32, 20.426]
  - - [4224, 1, 1, 128]
    - [29, 0.019]
  - - [1024, 1408, 1, 3328]
    - [10, 15.144]
  - - [2944, 5888, 1, 1280]
    - [4, 21.537]
  - - [8448, 2, 1, 2816]
    - [17, 0.405]
  - - [5888, 3584, 1, 256]
    - [55, 17.378]
  - - [1408, 1856, 1, 3328]
    - [2, 16.744]
  - - [7680, 6000, 1, 2560]
    - [4, 23.409]
  - - [6784, 1408, 1, 1280]
    - [16, 20.321]
  - - [512, 3000, 1, 2560]
    - [1, 14.387]
  - - [704, 2944, 1, 256]
    - [10, 8.992]
  - - [4288, 64, 1, 256]
    - [34, 2.026]
  - - [2944, 5888, 1, 3328]
    - [9, 22.353]
  - - [64, 4288, 1, 1280]
    - [5, 4.096]
  - - [6784, 64, 1, 1280]
    - [1, 6.057]
  - - [704, 1856, 1, 1280]
    - [10, 12.344]
  - - [1024, 1500, 1, 1536]
    - [36, 11.108]
  - - [1408, 64, 1, 3328]
    - [1, 2.791]
  - - [1408, 1408, 1, 1280]
    - [4, 12.142]
  - - [448, 1024, 1, 3328]
    - [1, 9.703]
  - - [3072, 3000, 1, 1024]
    - [22, 18.647]
  - - [448, 4288, 1, 3328]
    - [10, 15.209]
  - - [704, 2368, 1, 256]
    - [10, 6.863]
  - - [2944, 448, 1, 1280]
    - [45, 11.971]
  - - [5888, 2368, 1, 3328]
    - [4, 21.413]
  - - [5124, 9124, 1, 1760]
    - [4, 22.569]
  - - [4288, 5056, 1, 256]
    - [2, 17.841]
  - - [4288, 448, 1, 1280]
    - [13, 15.782]
  - - [5888, 704, 1, 3328]
    - [1, 18.272]
  - - [4288, 3584, 1, 3328]
    - [11, 22.006]
  - - [2944, 64, 1, 256]
    - [31, 1.268]
  - - [1024, 6784, 1, 3328]
    - [20, 19.542]
  - - [512, 3136, 1, 2048]
    - [36, 12.572]
  - - [1408, 1024, 1, 256]
    - [45, 5.904]
  - - [8448, 1500, 1, 2816]
    - [16, 21.485]
  - - [2560, 7000, 1, 2560]
    - [4, 21.866]
  - - [448, 1024, 1, 256]
    - [19, 2.468]
  - - [6784, 6784, 1, 3328]
    - [4, 23.576]
  - - [1024, 448, 1, 1280]
    - [19, 6.749]
  - - [704, 5056, 1, 3328]
    - [4, 18.013]
  - - [256, 2368, 1, 1280]
    - [44, 7.746]
  - - [3584, 5056, 1, 3328]
    - [16, 22.152]
  - - [2368, 2944, 1, 3328]
    - [27, 19.462]
  - - [448, 448, 1, 1280]
    - [1, 3.414]
  - - [2368, 3584, 1, 256]
    - [9, 15.939]
  - - [4608, 3000, 1, 1536]
    - [4, 20.615]
  - - [1024, 256, 1, 1280]
    - [1, 4.321]
  - - [128, 5056, 1, 1280]
    - [42, 8.163]
  - - [5124, 9124, 1, 4096]
    - [9, 22.822]
  - - [7680, 48000, 1, 2560]
    - [27, 24.071]
  - - [4608, 1500, 1, 1536]
    - [16, 17.594]
  - - [3584, 2368, 1, 1280]
    - [6, 19.829]
  - - [5124, 9124, 1, 2560]
    - [2, 22.712]
  - - [1856, 1856, 1, 256]
    - [9, 12.024]
  - - [4288, 1408, 1, 3328]
    - [9, 19.077]
  - - [3584, 64, 1, 3328]
    - [1, 5.897]
  - - [5124, 9124, 1, 2048]
    - [6, 22.58]
  - - [128, 1, 1, 1024]
    - [1, 0.002]
  - - [5124, 700, 1, 2048]
    - [2, 18.104]
  - - [256, 1024, 1, 3328]
    - [1, 7.202]
  - - [1856, 64, 1, 3328]
    - [1, 3.599]
  - - [256, 12544, 1, 1024]
    - [2, 15.595]
  - - [5888, 1408, 1, 3328]
    - [2, 20.474]
  - - [256, 5056, 1, 256]
    - [7, 6.845]
  - - [1856, 64, 1, 1280]
    - [39, 1.969]
  - - [1408, 256, 1, 256]
    - [23, 2.029]
  - - [2368, 5056, 1, 256]
    - [9, 13.82]
  - - [128, 5888, 1, 3328]
    - [1, 11.163]
  - - [1024, 6000, 1, 2560]
    - [9, 18.599]
  - - [1024, 5056, 1, 256]
    - [10, 12.95]
  - - [4224, 1500, 1, 176]
    - [9, 11.731]
  - - [2368, 1408, 1, 3328]
    - [14, 16.954]
  - - [1024, 48000, 1, 1536]
    - [27, 23.322]
  - - [5888, 448, 1, 256]
    - [4, 10.38]
  - - [6784, 5056, 1, 1280]
    - [9, 22.624]
  - - [1024, 48000, 1, 2560]
    - [27, 23.63]
  - - [4608, 32, 1, 1536]
    - [1, 2.602]
  - - [4288, 6784, 1, 1280]
    - [14, 22.074]
  - - [2368, 448, 1, 3328]
    - [1, 13.234]
  - - [1024, 128, 1, 256]
    - [43, 0.771]
  - - [448, 128, 1, 1280]
    - [8, 0.984]
  - - [1024, 64, 1, 3328]
    - [1, 1.759]
  - - [3072, 48000, 1, 1024]
    - [27, 23.661]
  - - [64, 3584, 1, 1280]
    - [31, 3.655]
  - - [6784, 1408, 1, 256]
    - [11, 15.91]
  - - [5888, 4288, 1, 256]
    - [24, 18.906]
  - - [5056, 5888, 1, 256]
    - [22, 18.497]
  - - [2368, 1024, 1, 256]
    - [10, 10.051]
  - - [1856, 6784, 1, 1280]
    - [14, 20.107]
  - - [3584, 128, 1, 1280]
    - [1, 6.6]
  - - [128, 64, 1, 256]
    - [50, 0.045]
  - - [1408, 448, 1, 256]
    - [7, 3.166]
  - - [64, 256, 1, 3328]
    - [1, 0.454]
  - - [8448, 3000, 1, 2816]
    - [4, 22.981]
  - - [6784, 448, 1, 3328]
    - [1, 17.203]
  - - [5056, 1856, 1, 1280]
    - [11, 19.852]
  - - [1408, 1024, 1, 3328]
    - [10, 15.473]
  - - [2368, 256, 1, 3328]
    - [42, 9.191]
  - - [7680, 1500, 1, 2560]
    - [16, 21.653]
  - - [5888, 3584, 1, 1280]
    - [2, 21.593]
  - - [5888, 128, 1, 1280]
    - [10, 9.126]
  - - [1024, 2944, 1, 256]
    - [20, 9.879]
  - - [448, 6784, 1, 1280]
    - [20, 14.406]
  - - [256, 3584, 1, 1280]
    - [13, 11.451]
  - - [704, 5056, 1, 256]
    - [9, 11.861]
  - - [3584, 1024, 1, 3328]
    - [12, 18.967]
  - - [2944, 1856, 1, 1280]
    - [16, 18.05]
  - - [5056, 256, 1, 256]
    - [7, 6.899]
  - - [128, 5888, 1, 256]
    - [10, 4.684]
  - - [2368, 3584, 1, 3328]
    - [6, 20.845]
  - - [3584, 5888, 1, 3328]
    - [22, 22.467]
  - - [2944, 3584, 1, 1280]
    - [14, 20.492]
  - - [1856, 5888, 1, 1280]
    - [4, 19.514]
  - - [256, 256, 1, 1280]
    - [3, 1.158]
  - - [4608, 24000, 1, 1536]
    - [22, 23.465]
  - - [4288, 1408, 1, 256]
    - [10, 13.482]
  - - [3584, 64, 1, 256]
    - [5, 1.205]
  - - [64, 1856, 1, 3328]
    - [1, 3.277]
  - - [1408, 128, 1, 256]
    - [56, 1.279]
  - - [4288, 2368, 1, 1280]
    - [6, 19.807]
  - - [2944, 5056, 1, 256]
    - [4, 17.126]
  - - [256, 128, 1, 3328]
    - [1, 0.953]
  - - [512, 8, 1, 500000]
    - [0, 0.0]
  - - [6784, 2368, 1, 256]
    - [24, 17.226]
  - - [1024, 1024, 1, 1024]
    - [10, 10.242]
  - - [1408, 448, 1, 3328]
    - [42, 9.646]
  - - [1024, 24000, 1, 2816]
    - [4, 22.965]
  - - [4288, 1856, 1, 256]
    - [9, 15.195]
  - - [1856, 2944, 1, 256]
    - [2, 13.551]
  - - [4608, 6000, 1, 1536]
    - [9, 22.095]
  - - [64, 5888, 1, 1280]
    - [28, 4.847]
  - - [7680, 3000, 1, 2560]
    - [4, 22.448]
  - - [5124, 700, 1, 2560]
    - [16, 18.385]
  - - [1856, 1408, 1, 1280]
    - [2, 16.014]
  - - [128, 704, 1, 256]
    - [5, 0.617]
  - - [1024, 4288, 1, 1280]
    - [6, 15.508]
  - - [2368, 5056, 1, 3328]
    - [4, 21.077]
  - - [4288, 1024, 1, 3328]
    - [1, 18.223]
  - - [6144, 48000, 1, 2560]
    - [22, 24.07]
  - - [1024, 5056, 1, 3328]
    - [11, 18.248]
  - - [1024, 1856, 1, 3328]
    - [13, 17.208]
  - - [704, 704, 1, 1280]
    - [1, 6.163]
  - - [128, 2368, 1, 1280]
    - [1, 4.351]
  - - [3584, 256, 1, 1280]
    - [13, 11.969]
  - - [5888, 64, 1, 1280]
    - [1, 6.31]
  - - [5124, 1500, 1, 2560]
    - [2, 18.763]
  - - [128, 704, 1, 3328]
    - [1, 2.521]
  - - [3584, 2944, 1, 3328]
    - [4, 21.752]
  - - [128, 1856, 1, 256]
    - [17, 1.78]
  - - [64, 4288, 1, 256]
    - [39, 1.885]
  - - [5888, 2944, 1, 256]
    - [6, 16.943]
  - - [5056, 128, 1, 1280]
    - [1, 8.687]
  - - [448, 1856, 1, 3328]
    - [40, 10.8]
  - - [5056, 4288, 1, 256]
    - [2, 17.864]
  - - [1024, 448, 1, 256]
    - [10, 3.291]
  - - [1024, 3584, 1, 256]
    - [2, 12.722]
  - - [2944, 128, 1, 1280]
    - [1, 6.638]
  - - [2560, 32, 1, 2560]
    - [1, 2.051]
  - - [64, 256, 1, 256]
    - [23, 0.089]
  - - [1024, 4, 1, 512]
    - [57, 0.038]
  - - [704, 256, 1, 3328]
    - [1, 5.413]
  - - [5056, 1408, 1, 256]
    - [2, 14.07]
  - - [5888, 5888, 1, 1280]
    - [4, 22.604]
  - - [176, 1500, 1, 1408]
    - [1, 4.649]
  - - [448, 5888, 1, 1280]
    - [14, 14.85]
  - - [1024, 3000, 1, 2560]
    - [4, 15.534]
  - - [4288, 704, 1, 1280]
    - [12, 14.247]
  - - [2944, 1408, 1, 256]
    - [10, 11.122]
  - - [4608, 2, 1, 1536]
    - [1, 0.186]
  - - [256, 2944, 1, 1280]
    - [1, 8.54]
  - - [2560, 128, 1, 2560]
    - [1, 7.057]
  - - [2368, 5888, 1, 3328]
    - [4, 21.392]
  - - [704, 1024, 1, 3328]
    - [1, 10.84]
  - - [2368, 1856, 1, 1280]
    - [6, 15.341]
  - - [1856, 448, 1, 1280]
    - [10, 9.296]
  - - [128, 6784, 1, 256]
    - [44, 4.22]
  - - [512, 4, 1, 500000]
    - [0, 0.0]
  - - [1024, 6000, 1, 2816]
    - [2, 19.037]
  - - [5888, 4288, 1, 3328]
    - [4, 22.917]
  - - [1856, 128, 1, 256]
    - [23, 1.337]
  - - [5056, 448, 1, 256]
    - [10, 9.319]
  - - [1856, 5056, 1, 1280]
    - [12, 19.981]
  - - [2944, 1024, 1, 1280]
    - [20, 14.793]
  - - [2368, 4288, 1, 256]
    - [4, 15.932]
  - - [1024, 2368, 1, 3328]
    - [4, 16.111]
  - - [4288, 64, 1, 3328]
    - [1, 6.73]
  - - [704, 1408, 1, 256]
    - [10, 5.149]
  - - [4096, 128, 1, 4096]
    - [42, 9.955]
  - - [4288, 5888, 1, 3328]
    - [14, 22.445]
  - - [4608, 16, 1, 1536]
    - [39, 1.471]
  - - [448, 2944, 1, 1280]
    - [10, 12.78]
  - - [1024, 2944, 1, 3328]
    - [42, 16.531]
  - - [2048, 64, 1, 2048]
    - [5, 2.827]
  - - [6144, 2, 1, 2560]
    - [1, 0.306]
  - - [256, 6784, 1, 1280]
    - [13, 13.853]
  - - [1856, 3584, 1, 256]
    - [2, 13.36]
  - - [128, 448, 1, 3328]
    - [1, 1.599]
  - - [1856, 256, 1, 256]
    - [10, 2.502]
  - - [1024, 1500, 1, 2048]
    - [9, 11.728]
  - - [5056, 128, 1, 256]
    - [28, 4.02]
  - - [512, 24000, 1, 2816]
    - [2, 21.727]
  - - [256, 5888, 1, 1280]
    - [13, 12.099]
  - - [6784, 128, 1, 1280]
    - [13, 10.322]
  - - [64, 1408, 1, 256]
    - [23, 0.477]
  - - [2944, 2368, 1, 256]
    - [2, 13.671]
  - - [1856, 448, 1, 256]
    - [44, 4.107]
  - - [1024, 1856, 1, 256]
    - [13, 7.507]
  - - [6784, 3584, 1, 3328]
    - [2, 22.923]
  - - [1760, 7000, 1, 1760]
    - [16, 20.861]
  - - [2944, 64, 1, 3328]
    - [1, 5.729]
  - - [1024, 5888, 1, 3328]
    - [6, 18.871]
  - - [1408, 2368, 1, 1280]
    - [16, 16.08]
  - - [128, 1408, 1, 1280]
    - [5, 3.013]
  - - [1024, 1, 1, 512]
    - [54, 0.011]
  - - [128, 1856, 1, 3328]
    - [1, 6.209]
  - - [2944, 2944, 1, 256]
    - [6, 16.463]
  - - [6784, 256, 1, 256]
    - [13, 7.924]
  - - [128, 4288, 1, 1280]
    - [1, 7.67]
  - - [1024, 3000, 1, 1536]
    - [4, 15.21]
  - - [5888, 1408, 1, 256]
    - [6, 15.404]
  - - [128, 128, 1, 256]
    - [34, 0.08]
  - - [1760, 64, 1, 1760]
    - [17, 2.413]
  - - [448, 704, 1, 3328]
    - [1, 8.394]
  - - [448, 1856, 1, 256]
    - [7, 4.981]
  - - [1856, 704, 1, 3328]
    - [45, 13.698]
  - - [512, 1500, 1, 2560]
    - [1, 11.64]
  - - [5888, 6784, 1, 3328]
    - [4, 23.388]
  - - [704, 4288, 1, 1280]
    - [4, 14.825]
  - - [128, 50176, 1, 512]
    - [53, 15.621]
  - - [1024, 48000, 1, 2048]
    - [27, 23.51]
  - - [3136, 64, 128, 64]
    - [12, 10.708]
  - - [784, 512, 64, 128]
    - [27, 12.523]
  - - [3136, 256, 64, 64]
    - [58, 12.374]
  - - [12544, 1024, 1, 256]
    - [59, 15.007]
  - - [784, 128, 128, 512]
    - [14, 18.274]
  - - [784, 512, 256, 128]
    - [27, 17.871]
  - - [3136, 64, 64, 256]
    - [12, 15.695]
  - - [3136, 512, 1, 2048]
    - [26, 12.689]
  - - [12544, 256, 1, 1024]
    - [10, 15.379]
  - - [3136, 2048, 1, 512]
    - [27, 15.139]
  - - [3136, 256, 256, 64]
    - [35, 17.282]
  - - [3136, 64, 128, 256]
    - [35, 17.406]
  - - [784, 128, 64, 512]
    - [4, 15.455]
  - - [3136, 64, 256, 64]
    - [9, 12.535]
  - - [784, 512, 128, 128]
    - [14, 15.879]
  - - [3136, 64, 64, 64]
    - [6, 8.99]
  - - [784, 128, 256, 512]
    - [14, 18.757]
  - - [3136, 64, 256, 256]
    - [9, 19.941]
  - - [3136, 256, 128, 64]
    - [11, 15.589]
- null
