library/src/blas3/Tensile/Logic/asm_full/arcturus_Cijk_Ailk_Bljk_BBH.yaml
- {MinimumRequiredVersion: 4.14.0}
- arcturus
- gfx908
- [Device 7380, Device 7388, Device 738c, Device 7390]
    SolutionIndex: 0
    SolutionNameMin: Cijk_Ailk_Bljk_BBH_MT64x128x16_MI32x32x2x2_SE_GRVW2_ONLL0_SNLL1
    SolutionIndex: 1
    SolutionNameMin: Cijk_Ailk_Bljk_BBH_MT64x128x16_MI32x32x2x2_SE_GRVW2_ONLL0_SNLL0
    SolutionIndex: 2
    SolutionNameMin: Cijk_Ailk_Bljk_BBH_MT64x128x8_MI32x32x2x2_SE_GRVW2_ONLL1_SNLL1
    SolutionIndex: 3
    SolutionNameMin: Cijk_Ailk_Bljk_BBH_MT64x128x32_MI32x32x2x2_SE_GRVW2_ONLL1_SNLL1
    SolutionIndex: 4
    SolutionNameMin: Cijk_Ailk_Bljk_BBH_MT64x128x16_MI32x32x2x2_SE_GRVW2_ONLL1_SNLL0
    SolutionIndex: 5
    SolutionNameMin: Cijk_Ailk_Bljk_BBH_MT32x256x16_MI32x32x2x2_SE_GRVW4_ONLL1_SNLL0
    SolutionIndex: 6
    SolutionNameMin: Cijk_Ailk_Bljk_BBH_MT64x256x16_MI32x32x2x2_SE_GRVW2_ONLL1_SNLL1
    SolutionIndex: 7
    SolutionNameMin: Cijk_Ailk_Bljk_BBH_MT64x128x8_MI32x32x2x2_SE_AF0EM1_ASEM1_GRVW2_ONLL0_SNLL1
    SolutionIndex: 8
    SolutionNameMin: Cijk_Ailk_Bljk_BBH_MT64x128x8_MI32x32x2x2_SE_AF0EM2_ASEM1_GRVW4_ONLL0_SNLL1
    SolutionIndex: 9
    SolutionNameMin: Cijk_Ailk_Bljk_BBH_MT64x128x8_MI32x32x2x2_SE_AF0EM1_ASEM1_GRVW4_ONLL1_SNLL1
    SolutionIndex: 10
    SolutionNameMin: Cijk_Ailk_Bljk_BBH_MT64x128x32_MI32x32x2x2_SE_AF0EM2_ASEM1_GRVW2_ONLL1_SNLL0
    SolutionIndex: 11
    SolutionNameMin: Cijk_Ailk_Bljk_BBH_MT64x256x8_MI32x32x2x2_SE_AF0EM2_ASEM1_GRVW2_ONLL0_SNLL0
    SolutionIndex: 12
    SolutionIndex: 13
    SolutionIndex: 14
    SolutionIndex: 15
    SolutionIndex: 16
    SolutionIndex: 17
    SolutionIndex: 18
    SolutionIndex: 19
    SolutionIndex: 20
    SolutionIndex: 21
    SolutionIndex: 22
    SolutionIndex: 23
    SolutionIndex: 24
    SolutionIndex: 25
    SolutionIndex: 26
    SolutionIndex: 27
    SolutionIndex: 28
    SolutionIndex: 29
    SolutionIndex: 30
    SolutionIndex: 31
    SolutionIndex: 32
    SolutionIndex: 33
    SolutionIndex: 34
    SolutionIndex: 35
    SolutionIndex: 36
    SolutionIndex: 37
    SolutionIndex: 38
    SolutionIndex: 39
    SolutionIndex: 40
    SolutionIndex: 41
    SolutionIndex: 42
    SolutionIndex: 43
    SolutionIndex: 44
    SolutionIndex: 45
    SolutionIndex: 46
    SolutionIndex: 47
    SolutionIndex: 48
    SolutionIndex: 49
    SolutionIndex: 50
    SolutionIndex: 51
    SolutionIndex: 52
    SolutionIndex: 53
    SolutionIndex: 54
    SolutionIndex: 55
    SolutionIndex: 56
    SolutionIndex: 57
    SolutionIndex: 58
    SolutionIndex: 59
    SolutionIndex: 60
    SolutionIndex: 61
    SolutionIndex: 62
    SolutionIndex: 63
    SolutionIndex: 64
    SolutionIndex: 65
    SolutionIndex: 66
    SolutionIndex: 67
    SolutionIndex: 68
    SolutionIndex: 69
    SolutionIndex: 70
    SolutionIndex: 71
    SolutionIndex: 72
    SolutionIndex: 73
    SolutionIndex: 74
    SolutionIndex: 75
    SolutionIndex: 76
    SolutionIndex: 77
    SolutionIndex: 78
    SolutionIndex: 79
    SolutionIndex: 80
    SolutionIndex: 81
    SolutionIndex: 82
    SolutionIndex: 83
    SolutionIndex: 84
    SolutionIndex: 85
    SolutionIndex: 86
    SolutionIndex: 87
    SolutionIndex: 88
    SolutionIndex: 89
    SolutionIndex: 90
    SolutionIndex: 91
    SolutionIndex: 92
    SolutionIndex: 93
    SolutionIndex: 94
    SolutionIndex: 95
    SolutionIndex: 96
    SolutionIndex: 97
    SolutionIndex: 98
    SolutionIndex: 99
    SolutionIndex: 100
    SolutionIndex: 101
    SolutionIndex: 102
    SolutionIndex: 103
    SolutionIndex: 104
    SolutionIndex: 105
    SolutionIndex: 106
    SolutionIndex: 107
    SolutionIndex: 108
    SolutionIndex: 109
    SolutionIndex: 110
    SolutionIndex: 111
    SolutionIndex: 112
    SolutionIndex: 113
    SolutionIndex: 114
    SolutionIndex: 115
    SolutionIndex: 116
    SolutionIndex: 117
    SolutionIndex: 118
    SolutionIndex: 119
    SolutionIndex: 120
    SolutionIndex: 121
    SolutionIndex: 122
    SolutionIndex: 123
    SolutionIndex: 124
    SolutionIndex: 125
    SolutionIndex: 126
    SolutionIndex: 127
    SolutionIndex: 128
    SolutionIndex: 129
    SolutionIndex: 130
    SolutionIndex: 131
    SolutionIndex: 132
    SolutionIndex: 133
    SolutionIndex: 134
    SolutionIndex: 135
    SolutionIndex: 136
    SolutionIndex: 137
    SolutionIndex: 138
    SolutionIndex: 139
    SolutionIndex: 140
    SolutionIndex: 141
    SolutionIndex: 142
    SolutionIndex: 143
    SolutionIndex: 144
    SolutionIndex: 145
    SolutionIndex: 146
    SolutionIndex: 147
    SolutionIndex: 148
    SolutionIndex: 149
    SolutionIndex: 150
    SolutionIndex: 151
    SolutionIndex: 152
    SolutionIndex: 153
    SolutionIndex: 154
    SolutionIndex: 155
    SolutionIndex: 156
    SolutionIndex: 157
    SolutionIndex: 158
    SolutionIndex: 159
    SolutionIndex: 160
    SolutionIndex: 161
    SolutionIndex: 162
    SolutionIndex: 163
    SolutionIndex: 164
    SolutionIndex: 165
    SolutionIndex: 166
    SolutionIndex: 167
    SolutionIndex: 168
    SolutionIndex: 169
    SolutionIndex: 170
    SolutionIndex: 171
    SolutionIndex: 172
    SolutionIndex: 173
    SolutionIndex: 174
    SolutionIndex: 175
    SolutionIndex: 176
    SolutionIndex: 177
    SolutionIndex: 178
    SolutionIndex: 179
    SolutionIndex: 180
    SolutionIndex: 181
    SolutionIndex: 182
    SolutionIndex: 183
    SolutionIndex: 184
    SolutionIndex: 185
    SolutionIndex: 186
    SolutionIndex: 187
    SolutionIndex: 188
    SolutionIndex: 189
    SolutionIndex: 190
    SolutionIndex: 191
    SolutionIndex: 192
    SolutionIndex: 193
    SolutionIndex: 194
    SolutionIndex: 195
    SolutionIndex: 196
    SolutionIndex: 197
    SolutionIndex: 198
    SolutionIndex: 199
    SolutionIndex: 200
    SolutionIndex: 201
    SolutionIndex: 202
    SolutionIndex: 203
    SolutionIndex: 204
    SolutionIndex: 205
    SolutionIndex: 206
    SolutionIndex: 207
    SolutionIndex: 208
    SolutionIndex: 209
    SolutionIndex: 210
    SolutionIndex: 211
    SolutionIndex: 212
    SolutionIndex: 213
    SolutionIndex: 214
    SolutionIndex: 215
    SolutionIndex: 216
    SolutionIndex: 217
    SolutionIndex: 218
    SolutionIndex: 219
    SolutionIndex: 220
    SolutionIndex: 221
    SolutionIndex: 222
    SolutionIndex: 223
    SolutionIndex: 224
    SolutionIndex: 225
    SolutionIndex: 226
    SolutionIndex: 227
    SolutionIndex: 228
    SolutionIndex: 229
    SolutionIndex: 230
    SolutionIndex: 231
    SolutionIndex: 232
    SolutionIndex: 233
    SolutionIndex: 234
    SolutionIndex: 235
    SolutionIndex: 236
    SolutionIndex: 237
    SolutionIndex: 238
    SolutionIndex: 239
    SolutionIndex: 240
    SolutionIndex: 241
    SolutionIndex: 242
    SolutionIndex: 243
    SolutionIndex: 244
    SolutionIndex: 245
    SolutionIndex: 246
    SolutionIndex: 247
    SolutionIndex: 248
    SolutionIndex: 249
    SolutionIndex: 250
    SolutionIndex: 251
    SolutionIndex: 252
    SolutionIndex: 253
    SolutionIndex: 254
    SolutionIndex: 255
    SolutionIndex: 256
    SolutionIndex: 257
    SolutionIndex: 258
    SolutionIndex: 259
    SolutionIndex: 260
    SolutionIndex: 261
    SolutionIndex: 262
    SolutionIndex: 263
    SolutionIndex: 264
    SolutionIndex: 265
    SolutionIndex: 266
    SolutionIndex: 267
    SolutionIndex: 268
    SolutionIndex: 269
    SolutionIndex: 270
    SolutionIndex: 271
    SolutionIndex: 272
    SolutionIndex: 273
    SolutionIndex: 274
    SolutionIndex: 275
    SolutionIndex: 276
    SolutionIndex: 277
    SolutionIndex: 278
    SolutionIndex: 279
    SolutionIndex: 280
    SolutionIndex: 281
    SolutionIndex: 282
    SolutionIndex: 283
    SolutionIndex: 284
    SolutionIndex: 285
    SolutionIndex: 286
    SolutionIndex: 287
    SolutionIndex: 288
    SolutionIndex: 289
    SolutionIndex: 290
    SolutionIndex: 291
    SolutionIndex: 292
    SolutionIndex: 293
    SolutionIndex: 294
    SolutionIndex: 295
    SolutionIndex: 296
    SolutionIndex: 297
    SolutionIndex: 298
    SolutionIndex: 299
    SolutionIndex: 300
    SolutionIndex: 301
    SolutionIndex: 302
    SolutionIndex: 303
    SolutionIndex: 304
    SolutionIndex: 305
    SolutionIndex: 306
    SolutionIndex: 307
    SolutionIndex: 308
    SolutionIndex: 309
    SolutionIndex: 310
    SolutionIndex: 311
    SolutionIndex: 312
    SolutionIndex: 313
- - - [64, 35, 1, 35]
    - [15, 0.005]
  - - [64, 35, 1, 32]
    - [14, 0.005]
  - - [64, 15, 1, 15]
    - [12, 0.001]
  - - [64, 15, 1, 17]
    - [18, 0.001]
  - - [64, 17, 1, 17]
    - [14, 0.001]
  - - [64, 30, 1, 30]
    - [12, 0.004]
  - - [64, 32, 1, 32]
    - [43, 0.005]
  - - [64, 31, 1, 31]
    - [28, 0.004]
  - - [64, 24, 1, 24]
    - [18, 0.003]
  - - [64, 15, 1, 15]
    - [21, 0.001]
  - - [64, 17, 1, 17]
    - [14, 0.001]
  - - [64, 34, 1, 34]
    - [14, 0.004]
  - - [64, 14, 1, 15]
    - [12, 0.001]
  - - [64, 17, 1, 21]
    - [12, 0.001]
  - - [64, 14, 1, 14]
    - [12, 0.001]
  - - [64, 24, 1, 34]
    - [45, 0.004]
  - - [64, 21, 1, 21]
    - [15, 0.002]
  - - [64, 31, 1, 30]
    - [40, 0.004]
  - - [64, 128, 512, 128]
    - [312, 27.758]
  - - [64, 512, 1, 512]
    - [295, 2.908]
  - - [64, 512, 64, 512]
    - [237, 40.765]
  - - [128, 128, 512, 64]
    - [248, 25.248]
  - - [512, 512, 1, 64]
    - [251, 4.302]
  - - [512, 512, 64, 64]
    - [166, 35.196]
  - - [1024, 4, 1, 2]
    - [309, 0.001]
  - - [1024, 4, 1, 1024]
    - [311, 0.47]
  - - [1024, 32, 1, 2]
    - [183, 0.018]
  - - [1024, 32, 1, 1024]
    - [299, 4.079]
  - - [1024, 2048, 1, 2]
    - [188, 0.485]
  - - [1024, 2048, 1, 1024]
    - [284, 57.833]
  - - [1024, 2048, 1, 4096]
    - [246, 63.875]
  - - [1024, 2048, 1, 30528]
    - [219, 68.57]
  - - [1024, 4096, 1, 1024]
    - [190, 72.356]
  - - [1024, 4096, 1, 4096]
    - [294, 76.797]
  - - [1024, 4096, 1, 30528]
    - [276, 82.229]
  - - [4096, 2048, 1, 1024]
    - [186, 82.66]
  - - [4096, 4096, 1, 1024]
    - [210, 85.291]
  - - [32, 33, 1600, 33]
    - [254, 3.598]
  - - [32, 200, 1, 1]
    - [292, 0.001]
  - - [64, 3, 512, 3]
    - [173, 0.042]
  - - [64, 5, 512, 5]
    - [173, 0.117]
  - - [64, 5, 960, 5]
    - [181, 0.186]
  - - [64, 9, 512, 9]
    - [217, 0.362]
  - - [64, 512, 1, 1]
    - [173, 0.009]
  - - [67, 512, 1, 2048]
    - [267, 5.643]
  - - [74, 512, 1, 2048]
    - [176, 6.398]
  - - [74, 960, 1, 2048]
    - [249, 11.441]
  - - [100, 512, 1, 2048]
    - [238, 8.761]
  - - [128, 27, 32768, 27]
    - [188, 6.349]
  - - [256, 1024, 1, 1]
    - [241, 0.063]
  - - [256, 8976, 1, 1536]
    - [218, 64.701]
  - - [256, 8976, 1, 2048]
    - [212, 65.342]
  - - [256, 8976, 1, 2304]
    - [223, 67.272]
  - - [256, 8976, 1, 2560]
    - [174, 68.006]
  - - [256, 8976, 1, 2816]
    - [213, 68.696]
  - - [256, 8976, 1, 3072]
    - [214, 68.069]
  - - [256, 8976, 1, 4352]
    - [174, 70.98]
  - - [256, 8976, 1, 4864]
    - [174, 71.568]
  - - [256, 8976, 1, 5376]
    - [174, 72.097]
  - - [256, 8976, 1, 5632]
    - [265, 72.24]
  - - [256, 8976, 1, 5888]
    - [174, 72.085]
  - - [256, 8976, 1, 6144]
    - [189, 70.899]
  - - [256, 8976, 1, 6656]
    - [240, 73.082]
  - - [256, 8976, 1, 7168]
    - [265, 72.811]
  - - [256, 8976, 1, 7424]
    - [174, 73.25]
  - - [256, 8976, 1, 8192]
    - [283, 71.408]
  - - [256, 8976, 1, 8448]
    - [174, 73.283]
  - - [256, 8976, 1, 8960]
    - [265, 73.317]
  - - [256, 8976, 1, 9472]
    - [174, 73.467]
  - - [256, 8976, 1, 9728]
    - [189, 73.777]
  - - [256, 8976, 1, 9984]
    - [174, 73.413]
  - - [256, 8976, 1, 10240]
    - [265, 73.304]
  - - [256, 8976, 1, 10496]
    - [265, 73.521]
  - - [256, 8976, 1, 11008]
    - [240, 73.549]
  - - [256, 8976, 1, 11520]
    - [174, 73.772]
  - - [256, 8976, 1, 12288]
    - [224, 73.289]
  - - [256, 8976, 1, 14336]
    - [213, 73.672]
  - - [256, 8976, 1, 14848]
    - [304, 74.091]
  - - [256, 8976, 1, 15104]
    - [174, 73.768]
  - - [256, 8976, 1, 15872]
    - [195, 74.135]
  - - [256, 8976, 1, 17152]
    - [197, 73.879]
  - - [256, 8976, 1, 19712]
    - [197, 74.165]
  - - [256, 8976, 1, 19968]
    - [197, 74.129]
  - - [256, 8976, 1, 20480]
    - [197, 74.154]
  - - [256, 8976, 1, 20992]
    - [197, 74.283]
  - - [256, 8976, 1, 22016]
    - [197, 74.352]
  - - [256, 8976, 1, 26112]
    - [197, 74.63]
  - - [256, 8976, 1, 33536]
    - [197, 75.0]
  - - [256, 8976, 1, 44505]
    - [259, 73.545]
  - - [256, 32768, 1, 128]
    - [216, 44.462]
  - - [257, 1024, 1, 4096]
    - [293, 30.248]
  - - [480, 32768, 1, 1024]
    - [216, 79.94]
  - - [512, 200, 1, 1]
    - [217, 0.025]
  - - [512, 200, 1, 32]
    - [178, 0.84]
  - - [512, 215, 1, 2048]
    - [176, 17.014]
  - - [512, 256, 1, 2048]
    - [180, 19.398]
  - - [512, 1600, 1, 32]
    - [305, 6.373]
  - - [512, 1600, 1, 512]
    - [281, 40.888]
  - - [512, 32768, 1, 256]
    - [167, 70.701]
  - - [560, 200, 1, 1024]
    - [300, 13.009]
  - - [560, 1600, 1, 1024]
    - [212, 48.238]
  - - [768, 215, 1, 2048]
    - [201, 22.932]
  - - [768, 256, 1, 2048]
    - [277, 26.443]
  - - [1024, 200, 1, 1]
    - [245, 0.049]
  - - [1024, 512, 1, 1]
    - [217, 0.115]
  - - [1024, 512, 1, 64]
    - [183, 7.949]
  - - [1024, 512, 1, 1024]
    - [177, 34.891]
  - - [1024, 960, 1, 64]
    - [289, 12.94]
  - - [1024, 960, 1, 1024]
    - [239, 60.388]
  - - [1024, 1600, 1, 1]
    - [172, 0.222]
  - - [1024, 1600, 1, 1024]
    - [187, 61.692]
  - - [1024, 1792, 1, 256]
    - [266, 46.521]
  - - [1024, 2048, 1, 256]
    - [253, 38.947]
  - - [1024, 2560, 1, 256]
    - [209, 46.178]
  - - [1024, 3072, 1, 256]
    - [175, 48.002]
  - - [1024, 3328, 1, 256]
    - [186, 51.673]
  - - [1024, 3840, 1, 256]
    - [190, 56.921]
  - - [1024, 4096, 1, 256]
    - [256, 52.61]
  - - [1024, 4608, 1, 256]
    - [167, 57.972]
  - - [1024, 4864, 1, 256]
    - [167, 54.988]
  - - [1024, 5120, 1, 256]
    - [166, 57.486]
  - - [1024, 5632, 1, 256]
    - [186, 60.732]
  - - [1024, 6144, 1, 256]
    - [268, 59.931]
  - - [1024, 6400, 1, 256]
    - [167, 61.692]
  - - [1024, 7168, 1, 256]
    - [166, 63.141]
  - - [1024, 7424, 1, 256]
    - [167, 64.017]
  - - [1024, 7680, 1, 256]
    - [186, 63.225]
  - - [1024, 7936, 1, 256]
    - [167, 63.623]
  - - [1024, 8192, 1, 256]
    - [166, 64.621]
  - - [1024, 8448, 1, 256]
    - [222, 65.275]
  - - [1024, 8704, 1, 256]
    - [170, 64.219]
  - - [1024, 8960, 1, 256]
    - [166, 65.42]
  - - [1024, 9728, 1, 256]
    - [167, 65.926]
  - - [1024, 9984, 1, 256]
    - [279, 66.739]
  - - [1024, 10240, 1, 256]
    - [166, 67.44]
  - - [1024, 10496, 1, 256]
    - [170, 66.536]
  - - [1024, 11008, 1, 256]
    - [166, 68.109]
  - - [1024, 11264, 1, 256]
    - [166, 68.147]
  - - [1024, 11520, 1, 256]
    - [175, 67.289]
  - - [1024, 12288, 1, 256]
    - [175, 68.356]
  - - [1024, 13312, 1, 256]
    - [186, 68.97]
  - - [1024, 13568, 1, 256]
    - [166, 69.708]
  - - [1024, 14336, 1, 256]
    - [170, 69.851]
  - - [1024, 14592, 1, 256]
    - [167, 70.468]
  - - [1024, 14848, 1, 256]
    - [167, 70.867]
  - - [1024, 15104, 1, 256]
    - [170, 70.444]
  - - [1024, 16128, 1, 256]
    - [170, 70.843]
  - - [1024, 17152, 1, 256]
    - [166, 71.439]
  - - [1024, 18944, 1, 256]
    - [167, 71.941]
  - - [1024, 19712, 1, 256]
    - [167, 72.338]
  - - [1024, 19968, 1, 256]
    - [167, 72.411]
  - - [1024, 20480, 1, 256]
    - [166, 73.133]
  - - [1024, 20992, 1, 256]
    - [167, 72.788]
  - - [1024, 21504, 1, 256]
    - [167, 73.423]
  - - [1024, 22016, 1, 256]
    - [167, 73.434]
  - - [1024, 23552, 1, 256]
    - [166, 73.792]
  - - [1024, 28672, 1, 256]
    - [166, 74.949]
  - - [1024, 32768, 1, 512]
    - [256, 85.179]
  - - [1024, 32768, 1, 1024]
    - [248, 88.813]
  - - [1024, 33536, 1, 256]
    - [166, 75.827]
  - - [1024, 40448, 1, 256]
    - [166, 76.066]
  - - [1600, 512, 1, 1024]
    - [263, 51.648]
  - - [2048, 512, 1, 1]
    - [173, 0.166]
  - - [2048, 512, 1, 2048]
    - [280, 46.307]
  - - [2048, 960, 1, 2048]
    - [227, 75.894]
  - - [2048, 1024, 1, 1]
    - [236, 0.243]
  - - [2048, 1024, 1, 256]
    - [202, 38.947]
  - - [3200, 1024, 1, 2048]
    - [205, 73.799]
  - - [4096, 1024, 1, 1]
    - [208, 0.344]
  - - [64, 14, 10880, 14]
    - [188, 1.918]
  - - [64, 14, 10880, 15]
    - [188, 2.047]
  - - [64, 15, 7680, 15]
    - [188, 2.099]
  - - [64, 15, 10880, 15]
    - [188, 2.182]
  - - [64, 15, 7680, 17]
    - [188, 2.255]
  - - [64, 17, 6144, 17]
    - [188, 2.465]
  - - [64, 17, 7680, 17]
    - [188, 2.556]
  - - [64, 17, 6144, 21]
    - [188, 2.962]
  - - [64, 21, 6144, 21]
    - [188, 3.639]
  - - [64, 24, 4736, 24]
    - [188, 4.526]
  - - [64, 24, 4736, 34]
    - [298, 5.605]
  - - [64, 30, 2048, 30]
    - [188, 5.465]
  - - [64, 31, 2048, 30]
    - [188, 5.593]
  - - [64, 31, 2048, 31]
    - [226, 5.708]
  - - [64, 32, 4608, 32]
    - [235, 12.13]
  - - [64, 34, 4736, 34]
    - [181, 6.049]
  - - [64, 35, 4608, 32]
    - [296, 9.255]
  - - [64, 35, 4608, 35]
    - [275, 5.784]
  - - [1024, 3840, 1, 1024]
    - [175, 76.98]
  - - [1024, 3840, 1, 4096]
    - [185, 91.212]
  - - [1024, 3968, 1, 1024]
    - [301, 70.095]
  - - [1024, 3968, 1, 4096]
    - [196, 74.611]
  - - [1024, 3968, 1, 42720]
    - [276, 79.3]
  - - [1024, 6528, 1, 1024]
    - [186, 82.391]
  - - [1024, 6528, 1, 4096]
    - [196, 86.158]
  - - [1024, 6528, 1, 42720]
    - [310, 92.466]
  - - [1024, 7104, 1, 1024]
    - [229, 79.762]
  - - [1024, 7104, 1, 4096]
    - [248, 85.234]
  - - [1024, 7104, 1, 42720]
    - [234, 90.063]
  - - [1024, 7200, 1, 1024]
    - [175, 80.015]
  - - [1024, 7200, 1, 4096]
    - [208, 85.124]
  - - [1024, 7200, 1, 42720]
    - [234, 91.354]
  - - [1024, 8064, 1, 1024]
    - [186, 81.705]
  - - [1024, 8064, 1, 4096]
    - [248, 86.294]
  - - [1024, 8160, 1, 1024]
    - [255, 80.274]
  - - [1024, 8160, 1, 4096]
    - [308, 86.136]
  - - [1024, 9216, 1, 1024]
    - [175, 83.971]
  - - [1024, 9216, 1, 4096]
    - [185, 89.619]
  - - [1024, 9520, 1, 1024]
    - [220, 80.429]
  - - [1024, 9520, 1, 4096]
    - [185, 90.49]
  - - [1024, 9520, 1, 42720]
    - [302, 95.767]
  - - [1024, 10064, 1, 1024]
    - [171, 82.16]
  - - [1024, 10064, 1, 4096]
    - [248, 87.26]
  - - [1024, 10080, 1, 1024]
    - [171, 82.292]
  - - [1024, 10080, 1, 4096]
    - [291, 87.38]
  - - [1024, 10080, 1, 42720]
    - [276, 91.355]
  - - [1024, 10200, 1, 1024]
    - [171, 82.994]
  - - [1024, 10200, 1, 4096]
    - [252, 87.34]
  - - [4096, 3840, 1, 1024]
    - [171, 84.725]
  - - [4096, 3968, 1, 1024]
    - [166, 85.696]
  - - [4096, 6528, 1, 1024]
    - [207, 87.169]
  - - [4096, 7104, 1, 1024]
    - [207, 86.531]
  - - [4096, 7200, 1, 1024]
    - [207, 85.874]
  - - [4096, 8064, 1, 1024]
    - [171, 87.693]
  - - [4096, 8160, 1, 1024]
    - [186, 86.895]
  - - [4096, 9216, 1, 1024]
    - [264, 87.727]
  - - [4096, 9520, 1, 1024]
    - [264, 87.287]
  - - [4096, 10064, 1, 1024]
    - [207, 87.444]
  - - [4096, 10080, 1, 1024]
    - [207, 87.671]
  - - [4096, 10200, 1, 1024]
    - [207, 87.79]
  - - [64, 27, 1920, 27]
    - [53, 2.212]
  - - [64, 33, 1920, 27]
    - [67, 2.176]
  - - [64, 33, 1920, 33]
    - [71, 2.734]
  - - [1024, 3240, 1, 1024]
    - [77, 34.747]
  - - [1024, 3240, 1, 4096]
    - [97, 38.008]
  - - [1024, 3960, 1, 1024]
    - [83, 34.758]
  - - [1024, 3960, 1, 4096]
    - [86, 37.079]
  - - [1024, 3960, 1, 42720]
    - [81, 39.481]
  - - [4096, 3240, 1, 1024]
    - [101, 40.489]
  - - [4096, 3960, 1, 1024]
    - [64, 41.988]
  - - [64, 192, 64, 1280]
    - [111, 48.684]
  - - [64, 320, 64, 1280]
    - [112, 51.478]
  - - [64, 384, 64, 1280]
    - [113, 60.388]
  - - [64, 448, 64, 1280]
    - [114, 60.139]
  - - [64, 192, 64, 2048]
    - [115, 48.699]
  - - [64, 320, 64, 2048]
    - [116, 51.796]
  - - [64, 384, 64, 2048]
    - [117, 58.878]
  - - [64, 448, 64, 2048]
    - [118, 59.813]
  - - [1225, 32, 64, 192]
    - [119, 26.992]
  - - [1225, 48, 64, 192]
    - [120, 26.007]
  - - [1225, 64, 64, 192]
    - [121, 39.542]
  - - [1225, 48, 64, 256]
    - [122, 29.755]
  - - [1225, 64, 64, 256]
    - [123, 45.022]
  - - [1225, 48, 64, 288]
    - [124, 32.301]
  - - [1225, 64, 64, 288]
    - [125, 47.202]
  - - [5329, 80, 64, 64]
    - [126, 23.098]
  - - [289, 128, 64, 768]
    - [127, 51.098]
  - - [289, 160, 64, 768]
    - [128, 47.004]
  - - [289, 192, 64, 768]
    - [128, 56.53]
  - - [64, 192, 32, 1280]
    - [129, 40.431]
  - - [64, 320, 32, 1280]
    - [130, 46.868]
  - - [64, 384, 32, 1280]
    - [131, 53.223]
  - - [64, 448, 32, 1280]
    - [132, 56.217]
  - - [64, 192, 32, 2048]
    - [133, 42.22]
  - - [64, 320, 32, 2048]
    - [134, 50.546]
  - - [64, 384, 32, 2048]
    - [131, 56.878]
  - - [64, 448, 32, 2048]
    - [135, 57.373]
  - - [1225, 32, 32, 192]
    - [136, 22.427]
  - - [1225, 48, 32, 192]
    - [137, 23.236]
  - - [1225, 64, 32, 192]
    - [111, 33.145]
  - - [1225, 48, 32, 256]
    - [120, 26.362]
  - - [1225, 64, 32, 256]
    - [138, 37.101]
  - - [1225, 48, 32, 288]
    - [139, 27.561]
  - - [1225, 64, 32, 288]
    - [111, 39.892]
  - - [5329, 80, 32, 64]
    - [126, 22.083]
  - - [289, 128, 32, 768]
    - [140, 43.297]
  - - [289, 160, 32, 768]
    - [141, 41.705]
  - - [289, 192, 32, 768]
    - [111, 47.886]
  - - [3136, 256, 64, 64]
    - [142, 45.089]
  - - [3136, 64, 64, 64]
    - [143, 31.148]
  - - [3136, 64, 64, 256]
    - [144, 56.002]
  - - [784, 512, 64, 128]
    - [145, 51.547]
  - - [784, 128, 64, 512]
    - [146, 65.128]
  - - [196, 1024, 64, 256]
    - [147, 50.531]
  - - [196, 256, 64, 1024]
    - [148, 53.519]
  - - [49, 2048, 64, 512]
    - [149, 40.813]
  - - [49, 512, 64, 2048]
    - [150, 38.11]
  - - [3136, 256, 32, 64]
    - [151, 41.812]
  - - [3136, 64, 32, 64]
    - [152, 27.874]
  - - [3136, 64, 32, 256]
    - [153, 51.203]
  - - [784, 512, 32, 128]
    - [154, 48.009]
  - - [784, 128, 32, 512]
    - [155, 59.988]
  - - [196, 1024, 32, 256]
    - [147, 47.199]
  - - [196, 256, 32, 1024]
    - [156, 42.98]
  - - [49, 2048, 32, 512]
    - [157, 35.993]
  - - [49, 512, 32, 2048]
    - [158, 33.09]
  - - [3136, 128, 64, 64]
    - [142, 41.085]
  - - [3136, 256, 64, 128]
    - [154, 62.611]
  - - [784, 512, 64, 256]
    - [142, 67.671]
  - - [3136, 128, 64, 256]
    - [154, 72.408]
  - - [3136, 256, 64, 256]
    - [154, 76.527]
  - - [196, 1024, 64, 512]
    - [147, 57.763]
  - - [784, 256, 64, 512]
    - [155, 73.357]
  - - [784, 512, 64, 512]
    - [155, 77.661]
  - - [196, 512, 64, 1024]
    - [128, 61.241]
  - - [196, 1024, 64, 1024]
    - [159, 63.45]
  - - [49, 2048, 64, 1024]
    - [149, 46.573]
  - - [49, 1024, 64, 2048]
    - [160, 45.878]
  - - [3136, 128, 32, 64]
    - [161, 37.529]
  - - [3136, 256, 32, 128]
    - [154, 59.065]
  - - [784, 512, 32, 256]
    - [155, 64.582]
  - - [3136, 128, 32, 256]
    - [154, 67.933]
  - - [3136, 256, 32, 256]
    - [154, 74.242]
  - - [196, 1024, 32, 512]
    - [162, 55.298]
  - - [784, 256, 32, 512]
    - [163, 67.933]
  - - [784, 512, 32, 512]
    - [151, 74.019]
  - - [196, 512, 32, 1024]
    - [128, 53.799]
  - - [196, 1024, 32, 1024]
    - [128, 61.241]
  - - [49, 2048, 32, 1024]
    - [164, 40.678]
  - - [49, 1024, 32, 2048]
    - [165, 38.66]
  - - [64, 128, 624, 128]
    - [168, 29.089]
  - - [1024, 10, 1, 1024]
    - [169, 1.211]
  - - [2048, 2048, 1, 2048]
    - [170, 77.782]
  - - [1024, 10, 1, 2]
    - [173, 0.004]
  - - [1024, 5, 1, 2]
    - [173, 0.003]
  - - [1024, 5, 1, 1024]
    - [179, 0.599]
  - - [64, 512, 16, 512]
    - [182, 26.868]
  - - [1024, 1024, 1, 1024]
    - [184, 44.76]
  - - [1024, 9600, 1, 4096]
    - [185, 92.788]
  - - [1024, 8192, 1, 1024]
    - [175, 83.089]
  - - [1024, 1280, 1, 4096]
    - [191, 59.706]
  - - [512, 512, 1, 512]
    - [192, 17.691]
  - - [1024, 1152, 1, 1024]
    - [193, 47.597]
  - - [1024, 5248, 1, 2]
    - [194, 0.815]
  - - [1024, 820, 1, 1024]
    - [174, 48.328]
  - - [4096, 1152, 1, 1024]
    - [166, 79.122]
  - - [1024, 308, 1, 30522]
    - [198, 44.83]
  - - [1024, 39, 1, 1024]
    - [199, 4.696]
  - - [1024, 616, 1, 1024]
    - [200, 38.625]
  - - [64, 512, 96, 512]
    - [202, 49.744]
  - - [1024, 39, 1, 2]
    - [203, 0.021]
  - - [128, 128, 1, 64]
    - [204, 0.293]
  - - [1024, 160, 1, 30522]
    - [206, 34.512]
  - - [1024, 2560, 1, 1024]
    - [207, 70.963]
  - - [4096, 9600, 1, 1024]
    - [210, 87.939]
  - - [1024, 8, 1, 2]
    - [173, 0.004]
  - - [1024, 800, 1, 1024]
    - [211, 46.043]
  - - [64, 128, 640, 128]
    - [181, 29.486]
  - - [4096, 1024, 1, 1024]
    - [207, 72.552]
  - - [1024, 8, 1, 1024]
    - [215, 0.952]
  - - [1024, 1024, 1, 2]
    - [217, 0.326]
  - - [4096, 5248, 1, 1024]
    - [171, 86.154]
  - - [4096, 4096, 1, 4096]
    - [202, 90.514]
  - - [1024, 77, 1, 30522]
    - [221, 21.551]
  - - [1024, 9, 1, 2]
    - [173, 0.004]
  - - [1024, 1024, 1, 4096]
    - [224, 49.318]
  - - [1024, 9, 1, 1024]
    - [225, 1.077]
  - - [1024, 780, 1, 1024]
    - [228, 45.425]
  - - [64, 4, 38400, 4]
    - [181, 0.21]
  - - [1024, 4096, 1, 2]
    - [230, 0.674]
  - - [4096, 2560, 1, 1024]
    - [167, 84.441]
  - - [64, 128, 144, 128]
    - [231, 19.096]
  - - [1024, 780, 1, 30522]
    - [232, 74.961]
  - - [8192, 7680, 1, 8192]
    - [233, 96.855]
  - - [1024, 3072, 1, 2]
    - [172, 0.609]
  - - [8192, 8192, 1, 8192]
    - [242, 95.407]
  - - [1024, 180, 1, 1024]
    - [243, 19.626]
  - - [1024, 180, 1, 30522]
    - [244, 37.686]
  - - [1024, 512, 1, 2]
    - [247, 0.226]
  - - [1024, 8192, 1, 4096]
    - [248, 86.789]
  - - [1024, 385, 1, 30522]
    - [250, 52.498]
  - - [4096, 512, 1, 1024]
    - [253, 57.42]
  - - [1024, 160, 1, 1024]
    - [199, 18.691]
  - - [1024, 5120, 1, 4096]
    - [185, 82.517]
  - - [2048, 1920, 1, 2048]
    - [256, 88.35]
  - - [1024, 462, 1, 1024]
    - [257, 32.852]
  - - [1024, 462, 1, 30522]
    - [258, 45.498]
  - - [1024, 77, 1, 1024]
    - [225, 9.104]
  - - [960, 1024, 1, 1024]
    - [260, 63.438]
  - - [1024, 40, 1, 2]
    - [261, 0.021]
  - - [64, 5, 1, 5]
    - [261, 0.0]
  - - [1024, 40, 1, 1024]
    - [262, 4.815]
  - - [4096, 5120, 1, 1024]
    - [186, 86.513]
  - - [1024, 200, 1, 30522]
    - [269, 39.741]
  - - [1024, 41, 1, 2]
    - [173, 0.021]
  - - [1024, 200, 1, 1024]
    - [270, 20.659]
  - - [4096, 8192, 1, 1024]
    - [264, 87.675]
  - - [1024, 41, 1, 1024]
    - [271, 4.847]
  - - [1024, 4992, 1, 4096]
    - [272, 80.669]
  - - [4096, 1280, 1, 1024]
    - [186, 76.357]
  - - [1024, 2560, 1, 4096]
    - [273, 77.593]
  - - [1024, 4992, 1, 2]
    - [274, 0.785]
  - - [32, 33, 1, 33]
    - [203, 0.009]
  - - [7680, 8192, 1, 8192]
    - [233, 96.767]
  - - [4096, 3072, 1, 1024]
    - [278, 84.117]
  - - [1024, 9600, 1, 1024]
    - [185, 82.202]
  - - [1024, 385, 1, 1024]
    - [282, 31.222]
  - - [64, 4, 32768, 4]
    - [181, 0.207]
  - - [64, 128, 656, 128]
    - [235, 29.596]
  - - [64, 512, 128, 512]
    - [285, 48.897]
  - - [1024, 4992, 1, 1024]
    - [193, 75.364]
  - - [1024, 1152, 1, 2]
    - [203, 0.353]
  - - [1024, 5248, 1, 4096]
    - [185, 84.423]
  - - [1024, 9600, 1, 33712]
    - [286, 95.871]
  - - [1024, 3072, 1, 4096]
    - [272, 73.682]
  - - [4096, 3840, 1, 4096]
    - [210, 94.811]
  - - [1024, 6, 1, 1024]
    - [287, 0.701]
  - - [1024, 5120, 1, 1024]
    - [193, 77.177]
  - - [1024, 8192, 1, 33712]
    - [227, 89.951]
  - - [1024, 308, 1, 1024]
    - [288, 27.476]
  - - [3840, 4096, 1, 4096]
    - [166, 94.894]
  - - [1024, 2560, 1, 2]
    - [181, 0.551]
  - - [1024, 6, 1, 2]
    - [173, 0.003]
  - - [64, 128, 160, 128]
    - [231, 20.259]
  - - [1024, 512, 1, 4096]
    - [290, 43.784]
  - - [64, 128, 128, 128]
    - [296, 17.324]
  - - [1024, 5248, 1, 1024]
    - [193, 78.684]
  - - [1024, 820, 1, 30522]
    - [297, 76.165]
  - - [1024, 1280, 1, 2]
    - [248, 0.377]
  - - [1024, 1280, 1, 1024]
    - [256, 51.69]
  - - [1920, 2048, 1, 2048]
    - [256, 88.663]
  - - [1024, 3072, 1, 1024]
    - [193, 67.515]
  - - [1024, 800, 1, 30522]
    - [258, 75.202]
  - - [64, 128, 1, 128]
    - [303, 0.258]
  - - [64, 512, 80, 512]
    - [213, 46.955]
  - - [480, 512, 1, 512]
    - [306, 19.79]
  - - [512, 480, 1, 512]
    - [307, 19.464]
  - - [4096, 4992, 1, 1024]
    - [171, 85.941]
  - - [479, 32768, 1, 1024]
    - [248, 77.273]
  - - [1024, 1152, 1, 4096]
    - [313, 54.382]
  - - [1024, 5120, 1, 2]
    - [274, 0.792]
- null
