library/src/blas3/Tensile/Logic/asm_full/arcturus_Cijk_Ailk_Bjlk_BBH.yaml
- {MinimumRequiredVersion: 4.14.0}
- arcturus
- gfx908
- [Device 7380, Device 7388, Device 738c, Device 7390]
    SolutionIndex: 0
    SolutionNameMin: Cijk_Ailk_Bjlk_BBH_MT32x256x8_MI32x32x2x2_SE_ONLL0_SNLL1
    SolutionIndex: 1
    SolutionNameMin: Cijk_Ailk_Bjlk_BBH_MT64x128x8_MI32x32x2x2_SE_ONLL0_SNLL1
    SolutionIndex: 2
    SolutionNameMin: Cijk_Ailk_Bjlk_BBH_MT64x128x16_MI32x32x2x2_SE_ONLL0_SNLL1
    SolutionIndex: 3
    SolutionNameMin: Cijk_Ailk_Bjlk_BBH_MT32x256x8_MI32x32x2x2_SE_ONLL0_SNLL0
    SolutionIndex: 4
    SolutionNameMin: Cijk_Ailk_Bjlk_BBH_MT64x128x8_MI32x32x2x2_SE_ONLL0_SNLL0
    SolutionIndex: 5
    SolutionNameMin: Cijk_Ailk_Bjlk_BBH_MT64x128x16_MI32x32x2x2_SE_ONLL0_SNLL0
    SolutionIndex: 6
    SolutionNameMin: Cijk_Ailk_Bjlk_BBH_MT64x128x32_MI32x32x2x2_SE_ONLL0_SNLL0
    SolutionIndex: 7
    SolutionNameMin: Cijk_Ailk_Bjlk_BBH_MT64x128x16_MI32x32x2x2_SE_ONLL1_SNLL1
    SolutionIndex: 8
    SolutionNameMin: Cijk_Ailk_Bjlk_BBH_MT64x128x32_MI32x32x2x2_SE_ONLL1_SNLL1
    SolutionIndex: 9
    SolutionNameMin: Cijk_Ailk_Bjlk_BBH_MT32x256x8_MI32x32x2x2_SE_ONLL1_SNLL0
    SolutionIndex: 10
    SolutionNameMin: Cijk_Ailk_Bjlk_BBH_MT64x128x8_MI32x32x2x2_SE_ONLL1_SNLL0
    SolutionIndex: 11
    SolutionNameMin: Cijk_Ailk_Bjlk_BBH_MT32x256x16_MI32x32x2x2_SE_ONLL1_SNLL0
    SolutionIndex: 12
    SolutionNameMin: Cijk_Ailk_Bjlk_BBH_MT64x128x16_MI32x32x2x2_SE_ONLL1_SNLL0
    SolutionIndex: 13
    SolutionNameMin: Cijk_Ailk_Bjlk_BBH_MT64x128x32_MI32x32x2x2_SE_ONLL1_SNLL0
    SolutionIndex: 14
    SolutionNameMin: Cijk_Ailk_Bjlk_BBH_MT64x256x8_MI32x32x2x2_SE_ONLL0_SNLL0
    SolutionIndex: 15
    SolutionNameMin: Cijk_Ailk_Bjlk_BBH_MT64x256x16_MI32x32x2x2_SE_ONLL0_SNLL0
    SolutionIndex: 16
    SolutionNameMin: Cijk_Ailk_Bjlk_BBH_MT64x256x16_MI32x32x2x2_SE_ONLL1_SNLL1
    SolutionIndex: 17
    SolutionNameMin: Cijk_Ailk_Bjlk_BBH_MT64x128x8_MI32x32x2x2_SE_AF0EM1_ASEM1_ONLL0_SNLL1
    SolutionIndex: 18
    SolutionNameMin: Cijk_Ailk_Bjlk_BBH_MT64x128x8_MI32x32x2x2_SE_AF0EM1_ASEM1_ONLL0_SNLL0
    SolutionIndex: 19
    SolutionNameMin: Cijk_Ailk_Bjlk_BBH_MT64x128x32_MI32x32x2x2_SE_AF0EM1_ASEM2_ONLL0_SNLL0
    SolutionIndex: 20
    SolutionNameMin: Cijk_Ailk_Bjlk_BBH_MT64x128x8_MI32x32x2x2_SE_AF0EM1_ASEM1_ONLL1_SNLL1
    SolutionIndex: 21
    SolutionNameMin: Cijk_Ailk_Bjlk_BBH_MT64x128x8_MI32x32x2x2_SE_AF0EM1_ASEM1_ONLL1_SNLL0
    SolutionIndex: 22
    SolutionNameMin: Cijk_Ailk_Bjlk_BBH_MT64x128x32_MI32x32x2x2_SE_AF0EM1_ASEM2_ONLL1_SNLL0
- - - [74, 2048, 1, 512]
    - [4, 1692.73]
  - - [100, 2048, 1, 512]
    - [12, 2236.72]
  - - [256, 1280, 1, 8976]
    - [6, 4769.2]
  - - [256, 2560, 1, 8976]
    - [5, 9507.56]
  - - [256, 2816, 1, 8976]
    - [5, 10452.9]
  - - [256, 3328, 1, 8976]
    - [6, 12377.4]
  - - [256, 3584, 1, 8976]
    - [6, 13312.3]
  - - [256, 3840, 1, 8976]
    - [6, 14261.3]
  - - [256, 4096, 1, 8976]
    - [12, 14031.0]
  - - [256, 4352, 1, 8976]
    - [10, 14952.6]
  - - [256, 4864, 1, 8976]
    - [2, 16616.3]
  - - [256, 5120, 1, 8976]
    - [12, 17364.8]
  - - [256, 5632, 1, 8976]
    - [10, 19132.9]
  - - [256, 5888, 1, 8976]
    - [5, 20000.3]
  - - [256, 6144, 1, 8976]
    - [8, 19612.7]
  - - [256, 7168, 1, 8976]
    - [11, 21683.8]
  - - [256, 8192, 1, 8976]
    - [5, 20570.0]
  - - [256, 8960, 1, 8976]
    - [12, 25787.6]
  - - [256, 9728, 1, 8976]
    - [12, 27928.0]
  - - [256, 9984, 1, 8976]
    - [5, 28503.4]
  - - [256, 10240, 1, 8976]
    - [4, 19965.1]
  - - [256, 10496, 1, 8976]
    - [12, 29890.8]
  - - [256, 11008, 1, 8976]
    - [12, 31074.7]
  - - [256, 11264, 1, 8976]
    - [9, 22207.3]
  - - [256, 11520, 1, 8976]
    - [12, 32313.6]
  - - [256, 11776, 1, 8976]
    - [10, 27001.2]
  - - [256, 12544, 1, 8976]
    - [4, 28520.9]
  - - [256, 12800, 1, 8976]
    - [10, 29109.8]
  - - [256, 13312, 1, 8976]
    - [15, 22443.1]
  - - [256, 13568, 1, 8976]
    - [5, 30380.1]
  - - [256, 14336, 1, 8976]
    - [14, 22414.5]
  - - [256, 14848, 1, 8976]
    - [10, 32950.8]
  - - [256, 15104, 1, 8976]
    - [10, 33069.2]
  - - [256, 15872, 1, 8976]
    - [7, 23806.5]
  - - [256, 16128, 1, 8976]
    - [5, 24189.2]
  - - [256, 17152, 1, 8976]
    - [12, 25584.8]
  - - [256, 17408, 1, 8976]
    - [0, 17566.5]
  - - [256, 18688, 1, 8976]
    - [5, 27597.9]
  - - [256, 19968, 1, 8976]
    - [12, 28210.4]
  - - [256, 20480, 1, 8976]
    - [1, 17864.8]
  - - [256, 20992, 1, 8976]
    - [7, 29490.2]
  - - [256, 21248, 1, 8976]
    - [5, 29871.8]
  - - [256, 22016, 1, 8976]
    - [5, 30642.5]
  - - [256, 26112, 1, 8976]
    - [10, 32825.1]
  - - [256, 32512, 1, 8976]
    - [5, 30217.7]
  - - [256, 33536, 1, 8976]
    - [5, 30702.5]
  - - [256, 44505, 1, 8976]
    - [2, 33189.5]
  - - [512, 32, 1, 200]
    - [1, 144.225]
  - - [512, 32, 1, 1600]
    - [4, 225.675]
  - - [512, 512, 1, 200]
    - [1, 1927.53]
  - - [512, 512, 1, 1600]
    - [4, 3476.71]
  - - [512, 2048, 1, 256]
    - [6, 7749.29]
  - - [560, 1024, 1, 200]
    - [5, 4624.52]
  - - [560, 1024, 1, 1600]
    - [5, 7775.46]
  - - [768, 2048, 1, 256]
    - [10, 10573.9]
  - - [1024, 64, 1, 512]
    - [3, 678.69]
  - - [1024, 256, 1, 1024]
    - [4, 3264.05]
  - - [1024, 256, 1, 1280]
    - [4, 3377.06]
  - - [1024, 256, 1, 2304]
    - [10, 3586.58]
  - - [1024, 256, 1, 2816]
    - [10, 3637.16]
  - - [1024, 256, 1, 3072]
    - [10, 3664.48]
  - - [1024, 256, 1, 3328]
    - [10, 3677.97]
  - - [1024, 256, 1, 3584]
    - [4, 3696.59]
  - - [1024, 256, 1, 4096]
    - [8, 3717.94]
  - - [1024, 256, 1, 4352]
    - [8, 3725.35]
  - - [1024, 256, 1, 4608]
    - [8, 3738.42]
  - - [1024, 256, 1, 5120]
    - [8, 3753.29]
  - - [1024, 256, 1, 5376]
    - [8, 3765.73]
  - - [1024, 256, 1, 5632]
    - [8, 3770.16]
  - - [1024, 256, 1, 6144]
    - [8, 3780.07]
  - - [1024, 256, 1, 6400]
    - [5, 3782.74]
  - - [1024, 256, 1, 7680]
    - [8, 3806.66]
  - - [1024, 256, 1, 7936]
    - [8, 3811.33]
  - - [1024, 256, 1, 8192]
    - [8, 3814.09]
  - - [1024, 256, 1, 8448]
    - [8, 3815.11]
  - - [1024, 256, 1, 9728]
    - [13, 3827.66]
  - - [1024, 256, 1, 9984]
    - [8, 3832.66]
  - - [1024, 256, 1, 10496]
    - [8, 3837.25]
  - - [1024, 256, 1, 11520]
    - [8, 3844.85]
  - - [1024, 256, 1, 12032]
    - [6, 3845.36]
  - - [1024, 256, 1, 13568]
    - [13, 3850.32]
  - - [1024, 256, 1, 14336]
    - [13, 3854.3]
  - - [1024, 256, 1, 14848]
    - [8, 3855.0]
  - - [1024, 256, 1, 15104]
    - [8, 3856.38]
  - - [1024, 256, 1, 15872]
    - [6, 3858.84]
  - - [1024, 256, 1, 16128]
    - [13, 3859.79]
  - - [1024, 256, 1, 17152]
    - [13, 3863.86]
  - - [1024, 256, 1, 17408]
    - [13, 3863.1]
  - - [1024, 256, 1, 18944]
    - [13, 3867.41]
  - - [1024, 256, 1, 19712]
    - [13, 3870.12]
  - - [1024, 256, 1, 19968]
    - [13, 3870.98]
  - - [1024, 256, 1, 21248]
    - [13, 3872.82]
  - - [1024, 256, 1, 21504]
    - [8, 3873.16]
  - - [1024, 256, 1, 22016]
    - [6, 3873.61]
  - - [1024, 256, 1, 28672]
    - [13, 3884.26]
  - - [1024, 256, 1, 33536]
    - [13, 3887.88]
  - - [1024, 1024, 1, 200]
    - [13, 6721.64]
  - - [1024, 1024, 1, 512]
    - [13, 10168.0]
  - - [1024, 1024, 1, 1600]
    - [5, 12725.4]
  - - [1600, 1024, 1, 512]
    - [4, 16008.8]
  - - [2048, 256, 1, 1024]
    - [4, 6342.99]
  - - [2048, 2048, 1, 512]
    - [2, 12590.8]
  - - [2048, 2048, 1, 1024]
    - [12, 14401.0]
  - - [3200, 2048, 1, 1024]
    - [14, 17798.9]
  - - [4096, 4096, 1, 1024]
    - [16, 9488.71]
  - - [67, 2048, 1, 512]
    - [22, 1712.0]
  - - [33, 32, 1600, 33]
    - [21, 825.0]
  - - [5, 64, 512, 5]
    - [17, 37.0]
  - - [3, 64, 512, 3]
    - [20, 14.0]
  - - [9, 64, 512, 9]
    - [17, 116.0]
  - - [33, 32, 200, 33]
    - [18, 403.0]
  - - [257, 4096, 1, 1024]
    - [19, 12095.0]
- null
