library/src/blas3/Tensile/Logic/asm_full/arcturus_Cijk_Alik_Bjlk_CB_GB.yaml
- {MinimumRequiredVersion: 4.25.0}
- arcturus
- gfx908
- [Device 7380, Device 7388, Device 738c, Device 7390]
    SolutionIndex: 0
    SolutionNameMin: Cijk_Alik_Bjlk_CB_GB_MT32x32x16_MI16x16x4x1_SN_1LDSB0_EPS1_GRVW2_LBSPP128_LPA4_NLCB1_PGR1_PLR5_SU0_SUS128_SRVW1_TT1_16_WG32_8_1_WGM1
    SolutionIndex: 1
    SolutionNameMin: Cijk_Alik_Bjlk_CB_GB_MT32x32x16_MI16x16x4x1_SN_1LDSB0_EPS0_GRVW2_LBSPP128_LPA4_NLCB1_PGR2_PLR5_SU0_SUS128_SRVW1_TT1_16_WG32_8_1_WGM1
    SolutionIndex: 2
    SolutionNameMin: Cijk_Alik_Bjlk_CB_GB_MT32x32x16_MI16x16x4x1_SN_1LDSB0_EPS1_GRVW1_LBSPP128_LPA4_NLCB1_PGR1_PLR5_SU0_SUS256_SRVW1_TT1_16_WG32_8_1_WGM1
    SolutionIndex: 3
    SolutionNameMin: Cijk_Alik_Bjlk_CB_GB_MT32x32x16_MI16x16x4x1_SN_1LDSB0_EPS1_GRVW2_LBSPP128_LPA4_NLCB1_PGR1_PLR5_SU0_SUS256_SRVW1_TT1_16_WG32_8_1_WGM1
    SolutionIndex: 4
    SolutionNameMin: Cijk_Alik_Bjlk_CB_GB_MT32x32x16_MI16x16x4x1_SN_1LDSB0_EPS0_GRVW2_LBSPP128_LPA4_NLCB1_PGR2_PLR5_SU0_SUS256_SRVW1_TT1_16_WG32_8_1_WGM1
    SolutionIndex: 5
    SolutionNameMin: Cijk_Alik_Bjlk_CB_GB_MT32x32x32_MI16x16x4x1_SN_1LDSB0_EPS1_GRVW2_LBSPP256_LPA4_NLCB1_PGR1_PLR9_SU0_SUS256_SRVW1_TT1_16_WG32_8_1_WGM1
    SolutionIndex: 6
    SolutionNameMin: Cijk_Alik_Bjlk_CB_GB_MT32x32x32_MI16x16x4x1_SN_1LDSB0_EPS0_GRVW2_LBSPP256_LPA4_NLCB1_PGR2_PLR9_SU0_SUS256_SRVW1_TT1_16_WG32_8_1_WGM1
    SolutionIndex: 7
    SolutionNameMin: Cijk_Alik_Bjlk_CB_GB_MT32x32x32_MI16x16x4x1_SN_1LDSB0_EPS1_GRVW2_LBSPP256_LPA4_NLCB1_PGR1_PLR9_SU32_SUS256_SRVW1_TT1_16_WG32_8_1_WGM1
    SolutionIndex: 8
    SolutionNameMin: Cijk_Alik_Bjlk_CB_GB_MT32x32x16_MI16x16x4x1_SN_1LDSB0_EPS0_GRVW1_LBSPP128_LPA4_NLCB1_PGR2_PLR5_SU0_SUS128_SRVW1_TT1_16_WG32_8_1_WGM2
    SolutionIndex: 9
    SolutionNameMin: Cijk_Alik_Bjlk_CB_GB_MT32x32x16_MI16x16x4x1_SN_1LDSB0_EPS0_GRVW2_LBSPP128_LPA4_NLCB1_PGR2_PLR5_SU0_SUS256_SRVW1_TT1_16_WG32_8_1_WGM2
    SolutionIndex: 10
    SolutionNameMin: Cijk_Alik_Bjlk_CB_GB_MT32x32x32_MI16x16x4x1_SN_1LDSB0_EPS1_GRVW2_LBSPP256_LPA4_NLCB1_PGR1_PLR9_SU0_SUS256_SRVW1_TT1_16_WG32_8_1_WGM2
    SolutionIndex: 11
    SolutionNameMin: Cijk_Alik_Bjlk_CB_GB_MT32x32x32_MI16x16x4x1_SN_1LDSB0_EPS0_GRVW2_LBSPP256_LPA4_NLCB1_PGR2_PLR9_SU0_SUS256_SRVW1_TT1_16_WG32_8_1_WGM2
    SolutionIndex: 12
    SolutionNameMin: Cijk_Alik_Bjlk_CB_GB_MT32x32x16_MI16x16x4x1_SN_1LDSB0_EPS1_GRVW2_LBSPP128_LPA4_NLCB1_PGR1_PLR5_SU0_SUS128_SRVW1_TT1_16_WG32_8_1_WGM15
    SolutionIndex: 13
    SolutionNameMin: Cijk_Alik_Bjlk_CB_GB_MT32x32x16_MI16x16x4x1_SN_1LDSB0_EPS0_GRVW2_LBSPP128_LPA4_NLCB1_PGR2_PLR5_SU0_SUS128_SRVW1_TT1_16_WG32_8_1_WGM15
    SolutionIndex: 14
    SolutionNameMin: Cijk_Alik_Bjlk_CB_GB_MT32x32x16_MI16x16x4x1_SN_1LDSB0_EPS0_GRVW2_LBSPP128_LPA4_NLCB1_PGR2_PLR5_SU0_SUS256_SRVW1_TT1_16_WG32_8_1_WGM15
    SolutionIndex: 15
    SolutionNameMin: Cijk_Alik_Bjlk_CB_GB_MT32x32x32_MI16x16x4x1_SN_1LDSB0_EPS1_GRVW2_LBSPP256_LPA4_NLCB1_PGR1_PLR9_SU0_SUS256_SRVW1_TT1_16_WG32_8_1_WGM15
    SolutionIndex: 16
    SolutionNameMin: Cijk_Alik_Bjlk_CB_GB_MT64x32x16_MI16x16x4x1_SN_1LDSB1_EPS1_GRVW2_LBSPP128_LPA4_NLCB1_PGR1_PLR5_SU0_SUS128_SRVW1_TT2_16_WG32_8_1_WGM1
    SolutionIndex: 17
    SolutionNameMin: Cijk_Alik_Bjlk_CB_GB_MT32x64x16_MI16x16x4x1_SN_1LDSB1_EPS1_GRVW2_LBSPP128_LPA4_NLCB1_PGR1_PLR5_SU0_SUS256_SRVW1_TT1_32_WG32_8_1_WGM1
    SolutionIndex: 18
    SolutionNameMin: Cijk_Alik_Bjlk_CB_GB_MT32x64x16_MI16x16x4x1_SN_1LDSB1_EPS1_GRVW2_LBSPP128_LPA4_NLCB1_PGR1_PLR5_SU0_SUS128_SRVW1_TT1_32_WG32_8_1_WGM15
    SolutionIndex: 19
    SolutionNameMin: Cijk_Alik_Bjlk_CB_GB_MT32x64x16_MI16x16x4x1_SN_1LDSB1_EPS1_GRVW2_LBSPP128_LPA4_NLCB1_PGR1_PLR5_SU32_SUS128_SRVW1_TT1_32_WG32_8_1_WGM15
    SolutionIndex: 20
    SolutionNameMin: Cijk_Alik_Bjlk_CB_GB_MT32x64x16_MI16x16x4x1_SN_1LDSB1_EPS1_GRVW2_LBSPP128_LPA4_NLCB1_PGR1_PLR5_SU32_SUS256_SRVW1_TT1_32_WG32_8_1_WGM15
- - - [32, 32, 8, 128, 32, 32, 128, 32]
    - [1, 122.0]
  - - [128, 128, 8, 128, 128, 128, 128, 128]
    - [12, 1638.0]
  - - [256, 256, 8, 128, 256, 256, 128, 256]
    - [17, 3329.0]
  - - [512, 512, 8, 128, 512, 512, 128, 512]
    - [20, 5492.0]
  - - [32, 32, 8, 512, 32, 32, 512, 32]
    - [6, 239.0]
  - - [128, 128, 8, 512, 128, 128, 512, 128]
    - [0, 2715.0]
  - - [256, 256, 8, 512, 256, 256, 512, 256]
    - [16, 4528.0]
  - - [512, 512, 8, 512, 512, 512, 512, 512]
    - [20, 6782.0]
  - - [32, 32, 8, 1024, 32, 32, 1024, 32]
    - [11, 287.0]
  - - [128, 128, 8, 1024, 128, 128, 1024, 128]
    - [3, 3090.0]
  - - [256, 256, 8, 1024, 256, 256, 1024, 256]
    - [18, 4852.0]
  - - [512, 512, 8, 1024, 512, 512, 1024, 512]
    - [19, 7011.0]
  - - [32, 128, 8, 128, 32, 32, 128, 128]
    - [4, 485.0]
  - - [32, 256, 8, 128, 32, 32, 128, 256]
    - [14, 962.0]
  - - [32, 512, 8, 128, 32, 32, 128, 512]
    - [8, 1638.0]
  - - [32, 128, 8, 512, 32, 32, 512, 128]
    - [15, 980.0]
  - - [32, 256, 8, 512, 32, 32, 512, 256]
    - [7, 2007.0]
  - - [32, 512, 8, 512, 32, 32, 512, 512]
    - [13, 2715.0]
  - - [32, 128, 8, 1024, 32, 32, 1024, 128]
    - [10, 1192.0]
  - - [32, 256, 8, 1024, 32, 32, 1024, 256]
    - [5, 2424.0]
  - - [32, 512, 8, 1024, 32, 32, 1024, 512]
    - [9, 3039.0]
  - - [128, 32, 8, 128, 128, 128, 128, 32]
    - [1, 468.0]
  - - [256, 32, 8, 128, 256, 256, 128, 32]
    - [4, 953.0]
  - - [512, 32, 8, 128, 512, 512, 128, 32]
    - [2, 1638.0]
  - - [128, 32, 8, 512, 128, 128, 512, 32]
    - [6, 953.0]
  - - [256, 32, 8, 512, 256, 256, 512, 32]
    - [7, 1924.0]
  - - [512, 32, 8, 512, 512, 512, 512, 32]
    - [1, 2621.0]
  - - [128, 32, 8, 1024, 128, 128, 1024, 32]
    - [11, 1155.0]
  - - [256, 32, 8, 1024, 256, 256, 1024, 32]
    - [6, 2305.0]
  - - [512, 32, 8, 1024, 512, 512, 1024, 32]
    - [12, 2985.0]
- null
