library/src/blas3/Tensile/Logic/asm_full/arcturus_Cijk_Alik_Bjlk_ZB_GB.yaml
- {MinimumRequiredVersion: 4.26.0}
- arcturus
- gfx908
- [Device 7380, Device 7388, Device 738c, Device 7390]
    SolutionIndex: 0
    SolutionNameMin: Cijk_Alik_Bjlk_ZB_GB_MT32x128x8_SN_PLR1_SU0_SUM0_SUS256_SNLL1_TT4_4_WG8_32_1_WGM1
    SolutionIndex: 1
    SolutionNameMin: Cijk_Alik_Bjlk_ZB_GB_MT64x64x8_SN_PLR1_SU0_SUM0_SUS256_SNLL1_TT4_4_WG16_16_1_WGM1
    SolutionIndex: 2
    SolutionNameMin: Cijk_Alik_Bjlk_ZB_GB_MT64x64x8_SN_PLR0_SU0_SUM0_SUS256_SNLL1_TT4_4_WG16_16_1_WGM1
    SolutionIndex: 3
    SolutionNameMin: Cijk_Alik_Bjlk_ZB_GB_MT128x32x8_SN_PLR1_SU0_SUM0_SUS256_SNLL1_TT4_4_WG32_8_1_WGM1
    SolutionIndex: 4
    SolutionNameMin: Cijk_Alik_Bjlk_ZB_GB_MT64x64x16_SN_PLR1_SU0_SUM0_SUS256_SNLL1_TT4_4_WG16_16_1_WGM1
    SolutionIndex: 5
    SolutionNameMin: Cijk_Alik_Bjlk_ZB_GB_MT32x128x8_SN_PLR1_SU32_SUM0_SUS128_SNLL1_TT4_4_WG8_32_1_WGM1
    SolutionIndex: 6
    SolutionNameMin: Cijk_Alik_Bjlk_ZB_GB_MT64x64x8_SN_PLR1_SU32_SUM0_SUS128_SNLL1_TT4_4_WG16_16_1_WGM1
    SolutionIndex: 7
    SolutionNameMin: Cijk_Alik_Bjlk_ZB_GB_MT64x64x8_SN_PLR0_SU32_SUM0_SUS128_SNLL1_TT4_4_WG16_16_1_WGM1
    SolutionIndex: 8
    SolutionNameMin: Cijk_Alik_Bjlk_ZB_GB_MT64x64x8_SN_PLR1_SU32_SUM3_SUS128_SNLL1_TT4_4_WG16_16_1_WGM1
    SolutionIndex: 9
    SolutionNameMin: Cijk_Alik_Bjlk_ZB_GB_MT32x128x8_SN_PLR1_SU32_SUM0_SUS256_SNLL1_TT4_4_WG8_32_1_WGM1
    SolutionIndex: 10
    SolutionNameMin: Cijk_Alik_Bjlk_ZB_GB_MT64x64x8_SN_PLR1_SU32_SUM0_SUS256_SNLL1_TT4_4_WG16_16_1_WGM1
    SolutionIndex: 11
    SolutionNameMin: Cijk_Alik_Bjlk_ZB_GB_MT64x64x8_SN_PLR0_SU32_SUM0_SUS256_SNLL1_TT4_4_WG16_16_1_WGM1
    SolutionIndex: 12
    SolutionNameMin: Cijk_Alik_Bjlk_ZB_GB_MT128x32x8_SN_PLR1_SU32_SUM0_SUS256_SNLL1_TT4_4_WG32_8_1_WGM1
    SolutionIndex: 13
    SolutionNameMin: Cijk_Alik_Bjlk_ZB_GB_MT64x64x8_SN_PLR0_SU32_SUM3_SUS256_SNLL1_TT4_4_WG16_16_1_WGM1
    SolutionIndex: 14
    SolutionNameMin: Cijk_Alik_Bjlk_ZB_GB_MT64x64x16_SN_PLR1_SU32_SUM3_SUS256_SNLL1_TT4_4_WG16_16_1_WGM1
    SolutionIndex: 15
    SolutionNameMin: Cijk_Alik_Bjlk_ZB_GB_MT32x128x8_SN_PLR1_SU0_SUM0_SUS256_SNLL1_TT4_4_WG8_32_1_WGM8
    SolutionIndex: 16
    SolutionNameMin: Cijk_Alik_Bjlk_ZB_GB_MT64x64x8_SN_PLR1_SU0_SUM0_SUS256_SNLL1_TT4_4_WG16_16_1_WGM8
    SolutionIndex: 17
    SolutionNameMin: Cijk_Alik_Bjlk_ZB_GB_MT64x64x8_SN_PLR0_SU0_SUM0_SUS256_SNLL1_TT4_4_WG16_16_1_WGM8
    SolutionIndex: 18
    SolutionNameMin: Cijk_Alik_Bjlk_ZB_GB_MT128x32x8_SN_PLR1_SU0_SUM0_SUS256_SNLL1_TT4_4_WG32_8_1_WGM8
    SolutionIndex: 19
    SolutionNameMin: Cijk_Alik_Bjlk_ZB_GB_MT64x64x16_SN_PLR1_SU0_SUM0_SUS256_SNLL1_TT4_4_WG16_16_1_WGM8
    SolutionIndex: 20
    SolutionNameMin: Cijk_Alik_Bjlk_ZB_GB_MT64x64x8_SN_PLR1_SU32_SUM0_SUS128_SNLL1_TT4_4_WG16_16_1_WGM8
    SolutionIndex: 21
    SolutionNameMin: Cijk_Alik_Bjlk_ZB_GB_MT64x64x8_SN_PLR0_SU32_SUM0_SUS128_SNLL1_TT4_4_WG16_16_1_WGM8
    SolutionIndex: 22
    SolutionNameMin: Cijk_Alik_Bjlk_ZB_GB_MT128x32x8_SN_PLR1_SU32_SUM0_SUS128_SNLL1_TT4_4_WG32_8_1_WGM8
    SolutionIndex: 23
    SolutionNameMin: Cijk_Alik_Bjlk_ZB_GB_MT64x64x8_SN_PLR1_SU32_SUM3_SUS128_SNLL1_TT4_4_WG16_16_1_WGM8
    SolutionIndex: 24
    SolutionNameMin: Cijk_Alik_Bjlk_ZB_GB_MT32x128x8_SN_PLR1_SU32_SUM0_SUS256_SNLL1_TT4_4_WG8_32_1_WGM8
    SolutionIndex: 25
    SolutionNameMin: Cijk_Alik_Bjlk_ZB_GB_MT64x64x8_SN_PLR1_SU32_SUM0_SUS256_SNLL1_TT4_4_WG16_16_1_WGM8
    SolutionIndex: 26
    SolutionNameMin: Cijk_Alik_Bjlk_ZB_GB_MT64x64x8_SN_PLR0_SU32_SUM0_SUS256_SNLL1_TT4_4_WG16_16_1_WGM8
    SolutionIndex: 27
    SolutionNameMin: Cijk_Alik_Bjlk_ZB_GB_MT64x64x8_SN_PLR0_SU32_SUM3_SUS256_SNLL1_TT4_4_WG16_16_1_WGM8
    SolutionIndex: 28
    SolutionNameMin: Cijk_Alik_Bjlk_ZB_GB_MT128x32x8_SN_PLR1_SU32_SUM3_SUS256_SNLL1_TT4_4_WG32_8_1_WGM8
    SolutionIndex: 29
    SolutionNameMin: Cijk_Alik_Bjlk_ZB_GB_MT64x64x16_SN_PLR1_SU32_SUM3_SUS256_SNLL1_TT4_4_WG16_16_1_WGM8
    SolutionIndex: 30
    SolutionNameMin: Cijk_Alik_Bjlk_ZB_GB_MT64x64x8_SN_PLR1_SU0_SUM0_SUS256_SNLL1_TT4_4_WG16_16_1_WGM15
    SolutionIndex: 31
    SolutionNameMin: Cijk_Alik_Bjlk_ZB_GB_MT64x64x8_SN_PLR0_SU0_SUM0_SUS256_SNLL1_TT4_4_WG16_16_1_WGM15
    SolutionIndex: 32
    SolutionNameMin: Cijk_Alik_Bjlk_ZB_GB_MT128x32x8_SN_PLR1_SU0_SUM0_SUS256_SNLL1_TT4_4_WG32_8_1_WGM15
    SolutionIndex: 33
    SolutionNameMin: Cijk_Alik_Bjlk_ZB_GB_MT64x64x16_SN_PLR1_SU0_SUM0_SUS256_SNLL1_TT4_4_WG16_16_1_WGM15
    SolutionIndex: 34
    SolutionNameMin: Cijk_Alik_Bjlk_ZB_GB_MT64x64x8_SN_PLR0_SU32_SUM0_SUS128_SNLL1_TT4_4_WG16_16_1_WGM15
    SolutionIndex: 35
    SolutionNameMin: Cijk_Alik_Bjlk_ZB_GB_MT32x128x8_SN_PLR1_SU32_SUM3_SUS128_SNLL1_TT4_4_WG8_32_1_WGM15
    SolutionIndex: 36
    SolutionNameMin: Cijk_Alik_Bjlk_ZB_GB_MT64x64x8_SN_PLR1_SU32_SUM3_SUS128_SNLL1_TT4_4_WG16_16_1_WGM15
    SolutionIndex: 37
    SolutionNameMin: Cijk_Alik_Bjlk_ZB_GB_MT64x64x8_SN_PLR0_SU32_SUM3_SUS128_SNLL1_TT4_4_WG16_16_1_WGM15
    SolutionIndex: 38
    SolutionNameMin: Cijk_Alik_Bjlk_ZB_GB_MT32x128x8_SN_PLR1_SU32_SUM0_SUS256_SNLL1_TT4_4_WG8_32_1_WGM15
    SolutionIndex: 39
    SolutionNameMin: Cijk_Alik_Bjlk_ZB_GB_MT64x64x8_SN_PLR1_SU32_SUM0_SUS256_SNLL1_TT4_4_WG16_16_1_WGM15
    SolutionIndex: 40
    SolutionNameMin: Cijk_Alik_Bjlk_ZB_GB_MT64x64x8_SN_PLR0_SU32_SUM0_SUS256_SNLL1_TT4_4_WG16_16_1_WGM15
    SolutionIndex: 41
    SolutionNameMin: Cijk_Alik_Bjlk_ZB_GB_MT64x64x8_SN_PLR0_SU32_SUM3_SUS256_SNLL1_TT4_4_WG16_16_1_WGM15
    SolutionIndex: 42
    SolutionNameMin: Cijk_Alik_Bjlk_ZB_GB_MT32x128x8_SN_PLR1_SU0_SUM0_SUS256_SNLL0_TT4_4_WG8_32_1_WGM1
    SolutionIndex: 43
    SolutionNameMin: Cijk_Alik_Bjlk_ZB_GB_MT64x64x8_SN_PLR1_SU0_SUM0_SUS256_SNLL0_TT4_4_WG16_16_1_WGM1
    SolutionIndex: 44
    SolutionNameMin: Cijk_Alik_Bjlk_ZB_GB_MT64x64x8_SN_PLR0_SU0_SUM0_SUS256_SNLL0_TT4_4_WG16_16_1_WGM1
    SolutionIndex: 45
    SolutionNameMin: Cijk_Alik_Bjlk_ZB_GB_MT128x32x8_SN_PLR1_SU0_SUM0_SUS256_SNLL0_TT4_4_WG32_8_1_WGM1
    SolutionIndex: 46
    SolutionNameMin: Cijk_Alik_Bjlk_ZB_GB_MT64x64x8_SN_PLR1_SU32_SUM0_SUS128_SNLL0_TT4_4_WG16_16_1_WGM1
    SolutionIndex: 47
    SolutionNameMin: Cijk_Alik_Bjlk_ZB_GB_MT64x64x8_SN_PLR0_SU32_SUM0_SUS128_SNLL0_TT4_4_WG16_16_1_WGM1
    SolutionIndex: 48
    SolutionNameMin: Cijk_Alik_Bjlk_ZB_GB_MT128x32x8_SN_PLR1_SU32_SUM0_SUS128_SNLL0_TT4_4_WG32_8_1_WGM1
    SolutionIndex: 49
    SolutionNameMin: Cijk_Alik_Bjlk_ZB_GB_MT32x128x8_SN_PLR1_SU32_SUM3_SUS128_SNLL0_TT4_4_WG8_32_1_WGM1
    SolutionIndex: 50
    SolutionNameMin: Cijk_Alik_Bjlk_ZB_GB_MT64x64x8_SN_PLR0_SU32_SUM3_SUS128_SNLL0_TT4_4_WG16_16_1_WGM1
    SolutionIndex: 51
    SolutionNameMin: Cijk_Alik_Bjlk_ZB_GB_MT32x128x8_SN_PLR1_SU32_SUM0_SUS256_SNLL0_TT4_4_WG8_32_1_WGM1
    SolutionIndex: 52
    SolutionNameMin: Cijk_Alik_Bjlk_ZB_GB_MT64x64x8_SN_PLR1_SU32_SUM0_SUS256_SNLL0_TT4_4_WG16_16_1_WGM1
    SolutionIndex: 53
    SolutionNameMin: Cijk_Alik_Bjlk_ZB_GB_MT64x64x8_SN_PLR0_SU32_SUM0_SUS256_SNLL0_TT4_4_WG16_16_1_WGM1
    SolutionIndex: 54
    SolutionNameMin: Cijk_Alik_Bjlk_ZB_GB_MT128x32x8_SN_PLR1_SU32_SUM0_SUS256_SNLL0_TT4_4_WG32_8_1_WGM1
    SolutionIndex: 55
    SolutionNameMin: Cijk_Alik_Bjlk_ZB_GB_MT64x64x8_SN_PLR0_SU32_SUM3_SUS256_SNLL0_TT4_4_WG16_16_1_WGM1
    SolutionIndex: 56
    SolutionNameMin: Cijk_Alik_Bjlk_ZB_GB_MT32x128x8_SN_PLR1_SU0_SUM0_SUS256_SNLL0_TT4_4_WG8_32_1_WGM8
    SolutionIndex: 57
    SolutionNameMin: Cijk_Alik_Bjlk_ZB_GB_MT64x64x8_SN_PLR0_SU0_SUM0_SUS256_SNLL0_TT4_4_WG16_16_1_WGM8
    SolutionIndex: 58
    SolutionNameMin: Cijk_Alik_Bjlk_ZB_GB_MT128x32x8_SN_PLR1_SU0_SUM0_SUS256_SNLL0_TT4_4_WG32_8_1_WGM8
    SolutionIndex: 59
    SolutionNameMin: Cijk_Alik_Bjlk_ZB_GB_MT64x64x8_SN_PLR0_SU32_SUM0_SUS128_SNLL0_TT4_4_WG16_16_1_WGM8
    SolutionIndex: 60
    SolutionNameMin: Cijk_Alik_Bjlk_ZB_GB_MT32x128x8_SN_PLR1_SU32_SUM3_SUS128_SNLL0_TT4_4_WG8_32_1_WGM8
    SolutionIndex: 61
    SolutionNameMin: Cijk_Alik_Bjlk_ZB_GB_MT64x64x8_SN_PLR0_SU32_SUM3_SUS128_SNLL0_TT4_4_WG16_16_1_WGM8
    SolutionIndex: 62
    SolutionNameMin: Cijk_Alik_Bjlk_ZB_GB_MT64x64x8_SN_PLR0_SU32_SUM0_SUS256_SNLL0_TT4_4_WG16_16_1_WGM8
    SolutionIndex: 63
    SolutionNameMin: Cijk_Alik_Bjlk_ZB_GB_MT64x64x8_SN_PLR0_SU32_SUM3_SUS256_SNLL0_TT4_4_WG16_16_1_WGM8
    SolutionIndex: 64
    SolutionNameMin: Cijk_Alik_Bjlk_ZB_GB_MT128x32x8_SN_PLR1_SU32_SUM3_SUS256_SNLL0_TT4_4_WG32_8_1_WGM8
    SolutionIndex: 65
    SolutionNameMin: Cijk_Alik_Bjlk_ZB_GB_MT32x128x8_SN_PLR1_SU0_SUM0_SUS256_SNLL0_TT4_4_WG8_32_1_WGM15
    SolutionIndex: 66
    SolutionNameMin: Cijk_Alik_Bjlk_ZB_GB_MT64x64x8_SN_PLR1_SU0_SUM0_SUS256_SNLL0_TT4_4_WG16_16_1_WGM15
    SolutionIndex: 67
    SolutionNameMin: Cijk_Alik_Bjlk_ZB_GB_MT64x64x8_SN_PLR0_SU0_SUM0_SUS256_SNLL0_TT4_4_WG16_16_1_WGM15
    SolutionIndex: 68
    SolutionNameMin: Cijk_Alik_Bjlk_ZB_GB_MT64x64x8_SN_PLR0_SU32_SUM0_SUS128_SNLL0_TT4_4_WG16_16_1_WGM15
    SolutionIndex: 69
    SolutionNameMin: Cijk_Alik_Bjlk_ZB_GB_MT32x128x8_SN_PLR1_SU32_SUM0_SUS256_SNLL0_TT4_4_WG8_32_1_WGM15
    SolutionIndex: 70
    SolutionNameMin: Cijk_Alik_Bjlk_ZB_GB_MT64x64x8_SN_PLR0_SU32_SUM0_SUS256_SNLL0_TT4_4_WG16_16_1_WGM15
    SolutionIndex: 71
    SolutionNameMin: Cijk_Alik_Bjlk_ZB_GB_MT64x64x16_SN_PLR1_SU32_SUM0_SUS256_SNLL0_TT4_4_WG16_16_1_WGM15
    SolutionIndex: 72
    SolutionNameMin: Cijk_Alik_Bjlk_ZB_GB_MT32x128x8_SN_PLR1_SU32_SUM3_SUS256_SNLL0_TT4_4_WG8_32_1_WGM15
    SolutionIndex: 73
    SolutionNameMin: Cijk_Alik_Bjlk_ZB_GB_MT64x64x8_SN_PLR0_SU32_SUM3_SUS256_SNLL0_TT4_4_WG16_16_1_WGM15
    SolutionIndex: 74
    SolutionNameMin: Cijk_Alik_Bjlk_ZB_GB_MT128x32x8_SN_PLR1_SU32_SUM3_SUS256_SNLL0_TT4_4_WG32_8_1_WGM15
    SolutionIndex: 75
    SolutionNameMin: Cijk_Alik_Bjlk_ZB_GB_MT16x16x4_SN_PLR1_SU0_SUM0_SUS256_SNLL1_TT2_2_WG8_8_1_WGM1
    SolutionIndex: 76
    SolutionNameMin: Cijk_Alik_Bjlk_ZB_GB_MT8x8x8_SN_PLR1_SU0_SUM0_SUS256_SNLL1_TT1_1_WG8_8_1_WGM1
    SolutionIndex: 77
    SolutionNameMin: Cijk_Alik_Bjlk_ZB_GB_MT8x8x8_SN_PLR0_SU0_SUM0_SUS256_SNLL1_TT1_1_WG8_8_1_WGM1
    SolutionIndex: 78
    SolutionNameMin: Cijk_Alik_Bjlk_ZB_GB_MT8x8x8_SN_PLR1_SU0_SUM0_SUS256_SNLL1_TT1_1_WG8_8_1_WGM8
    SolutionIndex: 79
    SolutionNameMin: Cijk_Alik_Bjlk_ZB_GB_MT16x16x4_SN_PLR0_SU0_SUM0_SUS256_SNLL1_TT2_2_WG8_8_1_WGM15
    SolutionIndex: 80
    SolutionNameMin: Cijk_Alik_Bjlk_ZB_GB_MT16x16x4_SN_PLR1_SU0_SUM0_SUS256_SNLL0_TT2_2_WG8_8_1_WGM1
    SolutionIndex: 81
    SolutionNameMin: Cijk_Alik_Bjlk_ZB_GB_MT16x16x4_SN_PLR0_SU0_SUM0_SUS256_SNLL0_TT2_2_WG8_8_1_WGM1
    SolutionIndex: 82
    SolutionNameMin: Cijk_Alik_Bjlk_ZB_GB_MT8x8x8_SN_PLR1_SU0_SUM0_SUS256_SNLL0_TT1_1_WG8_8_1_WGM1
    SolutionIndex: 83
    SolutionNameMin: Cijk_Alik_Bjlk_ZB_GB_MT8x8x8_SN_PLR0_SU0_SUM0_SUS256_SNLL0_TT1_1_WG8_8_1_WGM1
    SolutionIndex: 84
    SolutionNameMin: Cijk_Alik_Bjlk_ZB_GB_MT16x16x8_SN_PLR1_SU0_SUM0_SUS256_SNLL0_TT2_2_WG8_8_1_WGM1
    SolutionIndex: 85
    SolutionNameMin: Cijk_Alik_Bjlk_ZB_GB_MT32x32x8_SN_PLR1_SU0_SUM0_SUS256_SNLL0_TT2_2_WG16_16_1_WGM1
    SolutionIndex: 86
    SolutionNameMin: Cijk_Alik_Bjlk_ZB_GB_MT16x16x4_SN_PLR1_SU32_SUM0_SUS128_SNLL0_TT2_2_WG8_8_1_WGM1
    SolutionIndex: 87
    SolutionNameMin: Cijk_Alik_Bjlk_ZB_GB_MT32x32x8_SN_PLR1_SU32_SUM0_SUS128_SNLL0_TT2_2_WG16_16_1_WGM1
    SolutionIndex: 88
    SolutionNameMin: Cijk_Alik_Bjlk_ZB_GB_MT16x16x4_SN_PLR1_SU32_SUM3_SUS128_SNLL0_TT2_2_WG8_8_1_WGM1
    SolutionIndex: 89
    SolutionNameMin: Cijk_Alik_Bjlk_ZB_GB_MT32x32x8_SN_PLR1_SU32_SUM3_SUS128_SNLL0_TT2_2_WG16_16_1_WGM1
    SolutionIndex: 90
    SolutionNameMin: Cijk_Alik_Bjlk_ZB_GB_MT16x16x4_SN_PLR1_SU32_SUM0_SUS256_SNLL0_TT2_2_WG8_8_1_WGM1
    SolutionIndex: 91
    SolutionNameMin: Cijk_Alik_Bjlk_ZB_GB_MT8x8x8_SN_PLR0_SU32_SUM0_SUS256_SNLL0_TT1_1_WG8_8_1_WGM1
    SolutionIndex: 92
    SolutionNameMin: Cijk_Alik_Bjlk_ZB_GB_MT16x16x4_SN_PLR1_SU0_SUM0_SUS256_SNLL0_TT2_2_WG8_8_1_WGM8
    SolutionIndex: 93
    SolutionNameMin: Cijk_Alik_Bjlk_ZB_GB_MT16x16x8_SN_PLR1_SU0_SUM0_SUS256_SNLL0_TT2_2_WG8_8_1_WGM8
    SolutionIndex: 94
    SolutionNameMin: Cijk_Alik_Bjlk_ZB_GB_MT32x32x8_SN_PLR1_SU0_SUM0_SUS256_SNLL0_TT2_2_WG16_16_1_WGM8
    SolutionIndex: 95
    SolutionNameMin: Cijk_Alik_Bjlk_ZB_GB_MT16x16x4_SN_PLR1_SU32_SUM0_SUS128_SNLL0_TT2_2_WG8_8_1_WGM8
    SolutionIndex: 96
    SolutionNameMin: Cijk_Alik_Bjlk_ZB_GB_MT32x32x8_SN_PLR1_SU32_SUM0_SUS128_SNLL0_TT2_2_WG16_16_1_WGM8
    SolutionIndex: 97
    SolutionNameMin: Cijk_Alik_Bjlk_ZB_GB_MT16x16x4_SN_PLR1_SU0_SUM0_SUS256_SNLL0_TT2_2_WG8_8_1_WGM15
    SolutionIndex: 98
    SolutionNameMin: Cijk_Alik_Bjlk_ZB_GB_MT32x32x8_SN_PLR1_SU0_SUM0_SUS256_SNLL0_TT2_2_WG16_16_1_WGM15
    SolutionIndex: 99
    SolutionNameMin: Cijk_Alik_Bjlk_ZB_GB_MT16x16x4_SN_PLR0_SU32_SUM0_SUS128_SNLL0_TT2_2_WG8_8_1_WGM15
    SolutionIndex: 100
    SolutionNameMin: Cijk_Alik_Bjlk_ZB_GB_MT32x32x8_SN_PLR1_SU32_SUM0_SUS128_SNLL0_TT2_2_WG16_16_1_WGM15
    SolutionIndex: 101
    SolutionNameMin: Cijk_Alik_Bjlk_ZB_GB_MT32x32x8_SN_PLR1_SU32_SUM3_SUS128_SNLL0_TT2_2_WG16_16_1_WGM15
    SolutionIndex: 102
    SolutionNameMin: Cijk_Alik_Bjlk_ZB_GB_MT16x16x4_SN_PLR1_SU32_SUM0_SUS256_SNLL0_TT2_2_WG8_8_1_WGM15
    SolutionIndex: 103
    SolutionNameMin: Cijk_Alik_Bjlk_ZB_GB_MT32x32x8_SN_PLR1_SU32_SUM0_SUS256_SNLL0_TT2_2_WG16_16_1_WGM15
    SolutionIndex: 104
    SolutionNameMin: Cijk_Alik_Bjlk_ZB_GB_MT16x16x4_SN_PLR1_SU32_SUM3_SUS256_SNLL0_TT2_2_WG8_8_1_WGM15
    SolutionIndex: 105
    SolutionNameMin: Cijk_Alik_Bjlk_ZB_GB_MT24x24x8_SN_PLR1_SU0_SUM0_SUS256_SNLL0_TT3_3_WG8_8_1_WGM1
    SolutionIndex: 106
    SolutionNameMin: Cijk_Alik_Bjlk_ZB_GB_MT48x48x16_SN_PLR1_SU0_SUM0_SUS256_SNLL0_TT3_3_WG16_16_1_WGM1
    SolutionIndex: 107
    SolutionNameMin: Cijk_Alik_Bjlk_ZB_GB_MT24x24x8_SN_PLR1_SU0_SUM0_SUS256_SNLL0_TT3_3_WG8_8_1_WGM8
    SolutionIndex: 108
    SolutionNameMin: Cijk_Alik_Bjlk_ZB_GB_MT48x48x16_SN_PLR1_SU0_SUM0_SUS256_SNLL0_TT3_3_WG16_16_1_WGM8
    SolutionIndex: 109
    SolutionNameMin: Cijk_Alik_Bjlk_ZB_GB_MT24x24x8_SN_PLR1_SU0_SUM0_SUS256_SNLL0_TT3_3_WG8_8_1_WGM15
    SolutionIndex: 110
    SolutionNameMin: Cijk_Alik_Bjlk_ZB_GB_MT48x48x16_SN_PLR1_SU0_SUM0_SUS256_SNLL0_TT3_3_WG16_16_1_WGM15
- - - [192, 192, 1000, 32, 192, 192, 32, 192]
    - [44, 1605.0]
  - - [1536, 1536, 168, 32, 1536, 1536, 32, 1536]
    - [67, 1623.0]
  - - [1536, 32, 168, 1536, 1536, 1536, 1536, 32]
    - [32, 1424.0]
  - - [32, 1536, 168, 32, 32, 32, 32, 1536]
    - [42, 1161.0]
  - - [384, 384, 1024, 384, 384, 384, 384, 384]
    - [2, 1985.0]
  - - [1, 1, 1000, 1, 1, 1, 1, 1]
    - [75, 0.0]
  - - [2, 2, 1000, 2, 2, 2, 2, 2]
    - [75, 2.0]
  - - [3, 3, 1000, 3, 3, 3, 3, 3]
    - [76, 7.0]
  - - [4, 4, 1000, 4, 4, 4, 4, 4]
    - [82, 17.0]
  - - [5, 5, 1000, 5, 5, 5, 5, 5]
    - [77, 31.0]
  - - [6, 6, 1000, 6, 6, 6, 6, 6]
    - [83, 54.0]
  - - [7, 7, 1000, 7, 7, 7, 7, 7]
    - [78, 79.0]
  - - [8, 8, 1000, 8, 8, 8, 8, 8]
    - [91, 112.0]
  - - [9, 9, 1000, 9, 9, 9, 9, 9]
    - [92, 118.0]
  - - [10, 10, 1000, 10, 10, 10, 10, 10]
    - [92, 158.0]
  - - [11, 11, 1000, 11, 11, 11, 11, 11]
    - [92, 189.0]
  - - [12, 12, 1000, 12, 12, 12, 12, 12]
    - [88, 257.0]
  - - [13, 13, 1000, 13, 13, 13, 13, 13]
    - [102, 277.0]
  - - [14, 14, 1000, 14, 14, 14, 14, 14]
    - [86, 333.0]
  - - [15, 15, 1000, 15, 15, 15, 15, 15]
    - [75, 380.0]
  - - [16, 16, 1000, 16, 16, 16, 16, 16]
    - [104, 497.0]
  - - [17, 17, 1000, 17, 17, 17, 17, 17]
    - [85, 265.0]
  - - [18, 18, 1000, 18, 18, 18, 18, 18]
    - [98, 302.0]
  - - [19, 19, 1000, 19, 19, 19, 19, 19]
    - [94, 339.0]
  - - [20, 20, 1000, 20, 20, 20, 20, 20]
    - [102, 417.0]
  - - [21, 21, 1000, 21, 21, 21, 21, 21]
    - [94, 430.0]
  - - [22, 22, 1000, 22, 22, 22, 22, 22]
    - [87, 475.0]
  - - [23, 23, 1000, 23, 23, 23, 23, 23]
    - [85, 517.0]
  - - [24, 24, 1000, 24, 24, 24, 24, 24]
    - [89, 633.0]
  - - [25, 25, 1000, 25, 25, 25, 25, 25]
    - [101, 624.0]
  - - [26, 26, 1000, 26, 26, 26, 26, 26]
    - [85, 672.0]
  - - [27, 27, 1000, 27, 27, 27, 27, 27]
    - [85, 711.0]
  - - [28, 28, 1000, 28, 28, 28, 28, 28]
    - [97, 829.0]
  - - [29, 29, 1000, 29, 29, 29, 29, 29]
    - [85, 807.0]
  - - [30, 30, 1000, 30, 30, 30, 30, 30]
    - [94, 868.0]
  - - [31, 31, 1000, 31, 31, 31, 31, 31]
    - [85, 926.0]
  - - [32, 32, 1000, 32, 32, 32, 32, 32]
    - [85, 1061.0]
  - - [33, 33, 1000, 33, 33, 33, 33, 33]
    - [80, 569.0]
  - - [34, 34, 1000, 34, 34, 34, 34, 34]
    - [90, 638.0]
  - - [35, 35, 1000, 35, 35, 35, 35, 35]
    - [95, 635.0]
  - - [36, 36, 1000, 36, 36, 36, 36, 36]
    - [80, 771.0]
  - - [37, 37, 1000, 37, 37, 37, 37, 37]
    - [97, 684.0]
  - - [38, 38, 1000, 38, 38, 38, 38, 38]
    - [92, 783.0]
  - - [39, 39, 1000, 39, 39, 39, 39, 39]
    - [99, 744.0]
  - - [40, 40, 1000, 40, 40, 40, 40, 40]
    - [97, 949.0]
  - - [41, 41, 1000, 41, 41, 41, 41, 41]
    - [80, 799.0]
  - - [42, 42, 1000, 42, 42, 42, 42, 42]
    - [75, 919.0]
  - - [43, 43, 1000, 43, 43, 43, 43, 43]
    - [79, 864.0]
  - - [44, 44, 1000, 44, 44, 44, 44, 44]
    - [80, 1150.0]
  - - [45, 45, 1000, 45, 45, 45, 45, 45]
    - [75, 913.0]
  - - [46, 46, 1000, 46, 46, 46, 46, 46]
    - [81, 1049.0]
  - - [47, 47, 1000, 47, 47, 47, 47, 47]
    - [92, 985.0]
  - - [48, 48, 1000, 48, 48, 48, 48, 48]
    - [97, 1329.0]
  - - [49, 49, 1000, 49, 49, 49, 49, 49]
    - [85, 833.0]
  - - [50, 50, 1000, 50, 50, 50, 50, 50]
    - [98, 872.0]
  - - [51, 51, 1000, 51, 51, 51, 51, 51]
    - [94, 907.0]
  - - [52, 52, 1000, 52, 52, 52, 52, 52]
    - [98, 956.0]
  - - [53, 53, 1000, 53, 53, 53, 53, 53]
    - [98, 989.0]
  - - [54, 54, 1000, 54, 54, 54, 54, 54]
    - [85, 1032.0]
  - - [55, 55, 1000, 55, 55, 55, 55, 55]
    - [85, 1071.0]
  - - [56, 56, 1000, 56, 56, 56, 56, 56]
    - [98, 1134.0]
  - - [57, 57, 1000, 57, 57, 57, 57, 57]
    - [94, 1141.0]
  - - [58, 58, 1000, 58, 58, 58, 58, 58]
    - [85, 1189.0]
  - - [59, 59, 1000, 59, 59, 59, 59, 59]
    - [85, 1230.0]
  - - [60, 60, 1000, 60, 60, 60, 60, 60]
    - [85, 1281.0]
  - - [61, 61, 1000, 61, 61, 61, 61, 61]
    - [85, 1318.0]
  - - [62, 62, 1000, 62, 62, 62, 62, 62]
    - [85, 1367.0]
  - - [63, 63, 1000, 63, 63, 63, 63, 63]
    - [85, 1412.0]
  - - [64, 64, 1000, 64, 64, 64, 64, 64]
    - [98, 1490.0]
  - - [65, 65, 1000, 65, 65, 65, 65, 65]
    - [107, 841.0]
  - - [66, 66, 1000, 66, 66, 66, 66, 66]
    - [107, 870.0]
  - - [67, 67, 1000, 67, 67, 67, 67, 67]
    - [107, 892.0]
  - - [68, 68, 1000, 68, 68, 68, 68, 68]
    - [109, 925.0]
  - - [69, 69, 1000, 69, 69, 69, 69, 69]
    - [109, 941.0]
  - - [70, 70, 1000, 70, 70, 70, 70, 70]
    - [107, 976.0]
  - - [71, 71, 1000, 71, 71, 71, 71, 71]
    - [109, 997.0]
  - - [72, 72, 1000, 72, 72, 72, 72, 72]
    - [105, 1098.0]
  - - [73, 73, 1000, 73, 73, 73, 73, 73]
    - [84, 956.0]
  - - [74, 74, 1000, 74, 74, 74, 74, 74]
    - [93, 992.0]
  - - [75, 75, 1000, 75, 75, 75, 75, 75]
    - [84, 1019.0]
  - - [76, 76, 1000, 76, 76, 76, 76, 76]
    - [93, 1060.0]
  - - [77, 77, 1000, 77, 77, 77, 77, 77]
    - [93, 1077.0]
  - - [78, 78, 1000, 78, 78, 78, 78, 78]
    - [84, 1116.0]
  - - [79, 79, 1000, 79, 79, 79, 79, 79]
    - [84, 1139.0]
  - - [80, 80, 1000, 80, 80, 80, 80, 80]
    - [84, 1209.0]
  - - [81, 81, 1000, 81, 81, 81, 81, 81]
    - [85, 1077.0]
  - - [82, 82, 1000, 82, 82, 82, 82, 82]
    - [94, 1108.0]
  - - [83, 83, 1000, 83, 83, 83, 83, 83]
    - [85, 1137.0]
  - - [84, 84, 1000, 84, 84, 84, 84, 84]
    - [94, 1171.0]
  - - [85, 85, 1000, 85, 85, 85, 85, 85]
    - [103, 1199.0]
  - - [86, 86, 1000, 86, 86, 86, 86, 86]
    - [85, 1235.0]
  - - [87, 87, 1000, 87, 87, 87, 87, 87]
    - [98, 1264.0]
  - - [88, 88, 1000, 88, 88, 88, 88, 88]
    - [85, 1300.0]
  - - [89, 89, 1000, 89, 89, 89, 89, 89]
    - [100, 1302.0]
  - - [90, 90, 1000, 90, 90, 90, 90, 90]
    - [85, 1337.0]
  - - [91, 91, 1000, 91, 91, 91, 91, 91]
    - [94, 1369.0]
  - - [92, 92, 1000, 92, 92, 92, 92, 92]
    - [98, 1408.0]
  - - [93, 93, 1000, 93, 93, 93, 93, 93]
    - [85, 1433.0]
  - - [94, 94, 1000, 94, 94, 94, 94, 94]
    - [85, 1471.0]
  - - [95, 95, 1000, 95, 95, 95, 95, 95]
    - [98, 1502.0]
  - - [96, 96, 1000, 96, 96, 96, 96, 96]
    - [96, 1554.0]
  - - [97, 97, 1000, 97, 97, 97, 97, 97]
    - [31, 1028.0]
  - - [98, 98, 1000, 98, 98, 98, 98, 98]
    - [68, 1054.0]
  - - [99, 99, 1000, 99, 99, 99, 99, 99]
    - [31, 1070.0]
  - - [100, 100, 1000, 100, 100, 100, 100, 100]
    - [2, 1103.0]
  - - [101, 101, 1000, 101, 101, 101, 101, 101]
    - [7, 1108.0]
  - - [102, 102, 1000, 102, 102, 102, 102, 102]
    - [31, 1134.0]
  - - [103, 103, 1000, 103, 103, 103, 103, 103]
    - [2, 1153.0]
  - - [104, 104, 1000, 104, 104, 104, 104, 104]
    - [2, 1209.0]
  - - [105, 105, 1000, 105, 105, 105, 105, 105]
    - [57, 1208.0]
  - - [106, 106, 1000, 106, 106, 106, 106, 106]
    - [44, 1236.0]
  - - [107, 107, 1000, 107, 107, 107, 107, 107]
    - [17, 1249.0]
  - - [108, 108, 1000, 108, 108, 108, 108, 108]
    - [2, 1284.0]
  - - [109, 109, 1000, 109, 109, 109, 109, 109]
    - [47, 1292.0]
  - - [110, 110, 1000, 110, 110, 110, 110, 110]
    - [2, 1327.0]
  - - [111, 111, 1000, 111, 111, 111, 111, 111]
    - [68, 1343.0]
  - - [112, 112, 1000, 112, 112, 112, 112, 112]
    - [2, 1395.0]
  - - [113, 113, 1000, 113, 113, 113, 113, 113]
    - [31, 1392.0]
  - - [114, 114, 1000, 114, 114, 114, 114, 114]
    - [67, 1423.0]
  - - [115, 115, 1000, 115, 115, 115, 115, 115]
    - [68, 1442.0]
  - - [116, 116, 1000, 116, 116, 116, 116, 116]
    - [17, 1484.0]
  - - [117, 117, 1000, 117, 117, 117, 117, 117]
    - [17, 1493.0]
  - - [118, 118, 1000, 118, 118, 118, 118, 118]
    - [7, 1522.0]
  - - [119, 119, 1000, 119, 119, 119, 119, 119]
    - [31, 1541.0]
  - - [120, 120, 1000, 120, 120, 120, 120, 120]
    - [47, 1604.0]
  - - [121, 121, 1000, 121, 121, 121, 121, 121]
    - [31, 1597.0]
  - - [122, 122, 1000, 122, 122, 122, 122, 122]
    - [2, 1628.0]
  - - [123, 123, 1000, 123, 123, 123, 123, 123]
    - [62, 1647.0]
  - - [124, 124, 1000, 124, 124, 124, 124, 124]
    - [70, 1693.0]
  - - [125, 125, 1000, 125, 125, 125, 125, 125]
    - [53, 1701.0]
  - - [126, 126, 1000, 126, 126, 126, 126, 126]
    - [57, 1733.0]
  - - [127, 127, 1000, 127, 127, 127, 127, 127]
    - [68, 1750.0]
  - - [128, 128, 1000, 128, 128, 128, 128, 128]
    - [67, 1841.0]
  - - [129, 129, 1000, 129, 129, 129, 129, 129]
    - [106, 1026.0]
  - - [130, 130, 1000, 130, 130, 130, 130, 130]
    - [108, 1043.0]
  - - [131, 131, 1000, 131, 131, 131, 131, 131]
    - [108, 1056.0]
  - - [132, 132, 1000, 132, 132, 132, 132, 132]
    - [108, 1076.0]
  - - [133, 133, 1000, 133, 133, 133, 133, 133]
    - [108, 1088.0]
  - - [134, 134, 1000, 134, 134, 134, 134, 134]
    - [110, 1105.0]
  - - [135, 135, 1000, 135, 135, 135, 135, 135]
    - [108, 1118.0]
  - - [136, 136, 1000, 136, 136, 136, 136, 136]
    - [108, 1141.0]
  - - [137, 137, 1000, 137, 137, 137, 137, 137]
    - [108, 1149.0]
  - - [138, 138, 1000, 138, 138, 138, 138, 138]
    - [108, 1169.0]
  - - [139, 139, 1000, 139, 139, 139, 139, 139]
    - [108, 1178.0]
  - - [140, 140, 1000, 140, 140, 140, 140, 140]
    - [108, 1203.0]
  - - [141, 141, 1000, 141, 141, 141, 141, 141]
    - [110, 1213.0]
  - - [142, 142, 1000, 142, 142, 142, 142, 142]
    - [110, 1232.0]
  - - [143, 143, 1000, 143, 143, 143, 143, 143]
    - [87, 1246.0]
  - - [144, 144, 1000, 144, 144, 144, 144, 144]
    - [108, 1349.0]
  - - [145, 145, 1000, 145, 145, 145, 145, 145]
    - [85, 1264.0]
  - - [146, 146, 1000, 146, 146, 146, 146, 146]
    - [85, 1286.0]
  - - [147, 147, 1000, 147, 147, 147, 147, 147]
    - [96, 1306.0]
  - - [148, 148, 1000, 148, 148, 148, 148, 148]
    - [87, 1328.0]
  - - [149, 149, 1000, 149, 149, 149, 149, 149]
    - [85, 1347.0]
  - - [150, 150, 1000, 150, 150, 150, 150, 150]
    - [85, 1367.0]
  - - [32, 32, 8, 32, 32, 32, 32, 32]
    - [5, 18.0]
  - - [32, 32, 8, 64, 32, 32, 64, 32]
    - [43, 22.0]
  - - [32, 32, 8, 128, 32, 32, 128, 32]
    - [0, 24.0]
  - - [32, 32, 8, 256, 32, 32, 256, 32]
    - [12, 25.0]
  - - [32, 32, 8, 512, 32, 32, 512, 32]
    - [1, 26.0]
  - - [32, 32, 8, 1024, 32, 32, 1024, 32]
    - [5, 26.0]
  - - [32, 32, 8, 2048, 32, 32, 2048, 32]
    - [19, 27.0]
  - - [32, 64, 8, 32, 32, 32, 32, 64]
    - [0, 36.0]
  - - [32, 64, 8, 64, 32, 32, 64, 64]
    - [16, 43.0]
  - - [32, 64, 8, 128, 32, 32, 128, 64]
    - [66, 48.0]
  - - [32, 64, 8, 256, 32, 32, 256, 64]
    - [4, 50.0]
  - - [32, 64, 8, 512, 32, 32, 512, 64]
    - [43, 52.0]
  - - [32, 64, 8, 1024, 32, 32, 1024, 64]
    - [0, 52.0]
  - - [32, 64, 8, 2048, 32, 32, 2048, 64]
    - [16, 53.0]
  - - [32, 128, 8, 32, 32, 32, 32, 128]
    - [72, 71.0]
  - - [32, 128, 8, 64, 32, 32, 64, 128]
    - [42, 83.0]
  - - [32, 128, 8, 128, 32, 32, 128, 128]
    - [69, 89.0]
  - - [32, 128, 8, 256, 32, 32, 256, 128]
    - [60, 94.0]
  - - [32, 128, 8, 512, 32, 32, 512, 128]
    - [0, 97.0]
  - - [32, 128, 8, 1024, 32, 32, 1024, 128]
    - [1, 101.0]
  - - [32, 128, 8, 2048, 32, 32, 2048, 128]
    - [1, 103.0]
  - - [32, 256, 8, 32, 32, 32, 32, 256]
    - [5, 81.0]
  - - [32, 256, 8, 64, 32, 32, 64, 256]
    - [5, 115.0]
  - - [32, 256, 8, 128, 32, 32, 128, 256]
    - [1, 148.0]
  - - [32, 256, 8, 256, 32, 32, 256, 256]
    - [6, 174.0]
  - - [32, 256, 8, 512, 32, 32, 512, 256]
    - [1, 191.0]
  - - [32, 256, 8, 1024, 32, 32, 1024, 256]
    - [1, 201.0]
  - - [32, 256, 8, 2048, 32, 32, 2048, 256]
    - [1, 207.0]
  - - [32, 512, 8, 32, 32, 32, 32, 512]
    - [38, 157.0]
  - - [32, 512, 8, 64, 32, 32, 64, 512]
    - [5, 231.0]
  - - [32, 512, 8, 128, 32, 32, 128, 512]
    - [39, 297.0]
  - - [32, 512, 8, 256, 32, 32, 256, 512]
    - [25, 347.0]
  - - [32, 512, 8, 512, 32, 32, 512, 512]
    - [16, 382.0]
  - - [32, 512, 8, 1024, 32, 32, 1024, 512]
    - [1, 403.0]
  - - [32, 512, 8, 2048, 32, 32, 2048, 512]
    - [1, 413.0]
  - - [32, 1024, 8, 32, 32, 32, 32, 1024]
    - [2, 396.0]
  - - [32, 1024, 8, 64, 32, 32, 64, 1024]
    - [31, 462.0]
  - - [32, 1024, 8, 128, 32, 32, 128, 1024]
    - [9, 583.0]
  - - [32, 1024, 8, 256, 32, 32, 256, 1024]
    - [35, 681.0]
  - - [32, 1024, 8, 512, 32, 32, 512, 1024]
    - [15, 746.0]
  - - [32, 1024, 8, 1024, 32, 32, 1024, 1024]
    - [0, 787.0]
  - - [32, 1024, 8, 2048, 32, 32, 2048, 1024]
    - [42, 808.0]
  - - [32, 2048, 8, 32, 32, 32, 32, 2048]
    - [51, 583.0]
  - - [32, 2048, 8, 64, 32, 32, 64, 2048]
    - [49, 675.0]
  - - [32, 2048, 8, 128, 32, 32, 128, 2048]
    - [51, 744.0]
  - - [32, 2048, 8, 256, 32, 32, 256, 2048]
    - [42, 783.0]
  - - [32, 2048, 8, 512, 32, 32, 512, 2048]
    - [56, 803.0]
  - - [32, 2048, 8, 1024, 32, 32, 1024, 2048]
    - [42, 814.0]
  - - [32, 2048, 8, 2048, 32, 32, 2048, 2048]
    - [65, 820.0]
  - - [64, 32, 8, 32, 64, 64, 32, 32]
    - [4, 36.0]
  - - [64, 32, 8, 64, 64, 64, 64, 32]
    - [32, 42.0]
  - - [64, 32, 8, 128, 64, 64, 128, 32]
    - [18, 46.0]
  - - [64, 32, 8, 256, 64, 64, 256, 32]
    - [33, 50.0]
  - - [64, 32, 8, 512, 64, 64, 512, 32]
    - [19, 52.0]
  - - [64, 32, 8, 1024, 64, 64, 1024, 32]
    - [4, 53.0]
  - - [64, 32, 8, 2048, 64, 64, 2048, 32]
    - [32, 52.0]
  - - [64, 64, 8, 32, 64, 64, 32, 64]
    - [29, 71.0]
  - - [64, 64, 8, 64, 64, 64, 64, 64]
    - [46, 84.0]
  - - [64, 64, 8, 128, 64, 64, 128, 64]
    - [71, 97.0]
  - - [64, 64, 8, 256, 64, 64, 256, 64]
    - [0, 86.0]
  - - [64, 64, 8, 512, 64, 64, 512, 64]
    - [16, 98.0]
  - - [64, 64, 8, 1024, 64, 64, 1024, 64]
    - [19, 105.0]
  - - [64, 64, 8, 2048, 64, 64, 2048, 64]
    - [14, 103.0]
  - - [64, 128, 8, 32, 64, 64, 32, 128]
    - [16, 81.0]
  - - [64, 128, 8, 64, 64, 64, 64, 128]
    - [16, 117.0]
  - - [64, 128, 8, 128, 64, 64, 128, 128]
    - [8, 150.0]
  - - [64, 128, 8, 256, 64, 64, 256, 128]
    - [30, 172.0]
  - - [64, 128, 8, 512, 64, 64, 512, 128]
    - [3, 189.0]
  - - [64, 128, 8, 1024, 64, 64, 1024, 128]
    - [3, 198.0]
  - - [64, 128, 8, 2048, 64, 64, 2048, 128]
    - [4, 205.0]
  - - [64, 256, 8, 32, 64, 64, 32, 256]
    - [16, 162.0]
  - - [64, 256, 8, 64, 64, 64, 64, 256]
    - [1, 236.0]
  - - [64, 256, 8, 128, 64, 64, 128, 256]
    - [6, 297.0]
  - - [64, 256, 8, 256, 64, 64, 256, 256]
    - [30, 346.0]
  - - [64, 256, 8, 512, 64, 64, 512, 256]
    - [3, 378.0]
  - - [64, 256, 8, 1024, 64, 64, 1024, 256]
    - [3, 396.0]
  - - [64, 256, 8, 2048, 64, 64, 2048, 256]
    - [19, 410.0]
  - - [64, 512, 8, 32, 64, 64, 32, 512]
    - [39, 323.0]
  - - [64, 512, 8, 64, 64, 64, 64, 512]
    - [39, 465.0]
  - - [64, 512, 8, 128, 64, 64, 128, 512]
    - [6, 596.0]
  - - [64, 512, 8, 256, 64, 64, 256, 512]
    - [1, 695.0]
  - - [64, 512, 8, 512, 64, 64, 512, 512]
    - [16, 753.0]
  - - [64, 512, 8, 1024, 64, 64, 1024, 512]
    - [1, 793.0]
  - - [64, 512, 8, 2048, 64, 64, 2048, 512]
    - [19, 818.0]
  - - [64, 1024, 8, 32, 64, 64, 32, 1024]
    - [31, 765.0]
  - - [64, 1024, 8, 64, 64, 64, 64, 1024]
    - [44, 904.0]
  - - [64, 1024, 8, 128, 64, 64, 128, 1024]
    - [68, 990.0]
  - - [64, 1024, 8, 256, 64, 64, 256, 1024]
    - [2, 1040.0]
  - - [64, 1024, 8, 512, 64, 64, 512, 1024]
    - [44, 1070.0]
  - - [64, 1024, 8, 1024, 64, 64, 1024, 1024]
    - [57, 1085.0]
  - - [64, 1024, 8, 2048, 64, 64, 2048, 1024]
    - [31, 1092.0]
  - - [64, 2048, 8, 32, 64, 64, 32, 2048]
    - [63, 842.0]
  - - [64, 2048, 8, 64, 64, 64, 64, 2048]
    - [68, 1009.0]
  - - [64, 2048, 8, 128, 64, 64, 128, 2048]
    - [68, 1102.0]
  - - [64, 2048, 8, 256, 64, 64, 256, 2048]
    - [59, 1159.0]
  - - [64, 2048, 8, 512, 64, 64, 512, 2048]
    - [44, 1191.0]
  - - [64, 2048, 8, 1024, 64, 64, 1024, 2048]
    - [44, 1208.0]
  - - [64, 2048, 8, 2048, 64, 64, 2048, 2048]
    - [17, 1215.0]
  - - [128, 32, 8, 32, 128, 128, 32, 32]
    - [10, 39.0]
  - - [128, 32, 8, 64, 128, 128, 64, 32]
    - [1, 56.0]
  - - [128, 32, 8, 128, 128, 128, 128, 32]
    - [20, 73.0]
  - - [128, 32, 8, 256, 128, 128, 256, 32]
    - [15, 87.0]
  - - [128, 32, 8, 512, 128, 128, 512, 32]
    - [0, 95.0]
  - - [128, 32, 8, 1024, 128, 128, 1024, 32]
    - [0, 100.0]
  - - [128, 32, 8, 2048, 128, 128, 2048, 32]
    - [14, 103.0]
  - - [128, 64, 8, 32, 128, 128, 32, 64]
    - [39, 80.0]
  - - [128, 64, 8, 64, 128, 128, 64, 64]
    - [39, 116.0]
  - - [128, 64, 8, 128, 128, 128, 128, 64]
    - [8, 148.0]
  - - [128, 64, 8, 256, 128, 128, 256, 64]
    - [5, 171.0]
  - - [128, 64, 8, 512, 128, 128, 512, 64]
    - [0, 189.0]
  - - [128, 64, 8, 1024, 128, 128, 1024, 64]
    - [0, 199.0]
  - - [128, 64, 8, 2048, 128, 128, 2048, 64]
    - [0, 205.0]
  - - [128, 128, 8, 32, 128, 128, 32, 128]
    - [16, 159.0]
  - - [128, 128, 8, 64, 128, 128, 64, 128]
    - [8, 231.0]
  - - [128, 128, 8, 128, 128, 128, 128, 128]
    - [8, 295.0]
  - - [128, 128, 8, 256, 128, 128, 256, 128]
    - [30, 343.0]
  - - [128, 128, 8, 512, 128, 128, 512, 128]
    - [16, 372.0]
  - - [128, 128, 8, 1024, 128, 128, 1024, 128]
    - [4, 394.0]
  - - [128, 128, 8, 2048, 128, 128, 2048, 128]
    - [4, 409.0]
  - - [128, 256, 8, 32, 128, 128, 32, 256]
    - [22, 315.0]
  - - [128, 256, 8, 64, 128, 128, 64, 256]
    - [30, 467.0]
  - - [128, 256, 8, 128, 128, 128, 128, 256]
    - [16, 596.0]
  - - [128, 256, 8, 256, 128, 128, 256, 256]
    - [1, 686.0]
  - - [128, 256, 8, 512, 128, 128, 512, 256]
    - [16, 746.0]
  - - [128, 256, 8, 1024, 128, 128, 1024, 256]
    - [52, 788.0]
  - - [128, 256, 8, 2048, 128, 128, 2048, 256]
    - [19, 819.0]
  - - [128, 512, 8, 32, 128, 128, 32, 512]
    - [44, 777.0]
  - - [128, 512, 8, 64, 128, 128, 64, 512]
    - [11, 904.0]
  - - [128, 512, 8, 128, 128, 128, 128, 512]
    - [59, 989.0]
  - - [128, 512, 8, 256, 128, 128, 256, 512]
    - [34, 1040.0]
  - - [128, 512, 8, 512, 128, 128, 512, 512]
    - [26, 1069.0]
  - - [128, 512, 8, 1024, 128, 128, 1024, 512]
    - [59, 1084.0]
  - - [128, 512, 8, 2048, 128, 128, 2048, 512]
    - [11, 1091.0]
  - - [128, 1024, 8, 32, 128, 128, 32, 1024]
    - [57, 851.0]
  - - [128, 1024, 8, 64, 128, 128, 64, 1024]
    - [2, 1007.0]
  - - [128, 1024, 8, 128, 128, 128, 128, 1024]
    - [44, 1112.0]
  - - [128, 1024, 8, 256, 128, 128, 256, 1024]
    - [44, 1161.0]
  - - [128, 1024, 8, 512, 128, 128, 512, 1024]
    - [57, 1192.0]
  - - [128, 1024, 8, 1024, 128, 128, 1024, 1024]
    - [44, 1209.0]
  - - [128, 1024, 8, 2048, 128, 128, 2048, 1024]
    - [31, 1216.0]
  - - [128, 2048, 8, 32, 128, 128, 32, 2048]
    - [73, 1073.0]
  - - [128, 2048, 8, 64, 128, 128, 64, 2048]
    - [17, 1279.0]
  - - [128, 2048, 8, 128, 128, 128, 128, 2048]
    - [2, 1411.0]
  - - [128, 2048, 8, 256, 128, 128, 256, 2048]
    - [17, 1478.0]
  - - [128, 2048, 8, 512, 128, 128, 512, 2048]
    - [59, 1521.0]
  - - [128, 2048, 8, 1024, 128, 128, 1024, 2048]
    - [31, 1542.0]
  - - [128, 2048, 8, 2048, 128, 128, 2048, 2048]
    - [26, 1552.0]
  - - [256, 32, 8, 32, 256, 256, 32, 32]
    - [18, 79.0]
  - - [256, 32, 8, 64, 256, 256, 64, 32]
    - [0, 113.0]
  - - [256, 32, 8, 128, 256, 256, 128, 32]
    - [15, 146.0]
  - - [256, 32, 8, 256, 256, 256, 256, 32]
    - [15, 172.0]
  - - [256, 32, 8, 512, 256, 256, 512, 32]
    - [15, 190.0]
  - - [256, 32, 8, 1024, 256, 256, 1024, 32]
    - [0, 200.0]
  - - [256, 32, 8, 2048, 256, 256, 2048, 32]
    - [0, 205.0]
  - - [256, 64, 8, 32, 256, 256, 32, 64]
    - [22, 160.0]
  - - [256, 64, 8, 64, 256, 256, 64, 64]
    - [16, 229.0]
  - - [256, 64, 8, 128, 256, 256, 128, 64]
    - [1, 293.0]
  - - [256, 64, 8, 256, 256, 256, 256, 64]
    - [15, 345.0]
  - - [256, 64, 8, 512, 256, 256, 512, 64]
    - [24, 379.0]
  - - [256, 64, 8, 1024, 256, 256, 1024, 64]
    - [15, 399.0]
  - - [256, 64, 8, 2048, 256, 256, 2048, 64]
    - [4, 410.0]
  - - [256, 128, 8, 32, 256, 256, 32, 128]
    - [16, 313.0]
  - - [256, 128, 8, 64, 256, 256, 64, 128]
    - [16, 467.0]
  - - [256, 128, 8, 128, 256, 256, 128, 128]
    - [1, 592.0]
  - - [256, 128, 8, 256, 256, 256, 256, 128]
    - [36, 681.0]
  - - [256, 128, 8, 512, 256, 256, 512, 128]
    - [43, 743.0]
  - - [256, 128, 8, 1024, 256, 256, 1024, 128]
    - [4, 787.0]
  - - [256, 128, 8, 2048, 256, 256, 2048, 128]
    - [4, 819.0]
  - - [256, 256, 8, 32, 256, 256, 32, 256]
    - [53, 777.0]
  - - [256, 256, 8, 64, 256, 256, 64, 256]
    - [50, 902.0]
  - - [256, 256, 8, 128, 256, 256, 128, 256]
    - [44, 986.0]
  - - [256, 256, 8, 256, 256, 256, 256, 256]
    - [44, 1039.0]
  - - [256, 256, 8, 512, 256, 256, 512, 256]
    - [21, 1067.0]
  - - [256, 256, 8, 1024, 256, 256, 1024, 256]
    - [62, 1084.0]
  - - [256, 256, 8, 2048, 256, 256, 2048, 256]
    - [21, 1091.0]
  - - [256, 512, 8, 32, 256, 256, 32, 512]
    - [44, 870.0]
  - - [256, 512, 8, 64, 256, 256, 64, 512]
    - [67, 1011.0]
  - - [256, 512, 8, 128, 256, 256, 128, 512]
    - [44, 1112.0]
  - - [256, 512, 8, 256, 256, 256, 256, 512]
    - [31, 1169.0]
  - - [256, 512, 8, 512, 256, 256, 512, 512]
    - [26, 1193.0]
  - - [256, 512, 8, 1024, 256, 256, 1024, 512]
    - [62, 1210.0]
  - - [256, 512, 8, 2048, 256, 256, 2048, 512]
    - [57, 1217.0]
  - - [256, 1024, 8, 32, 256, 256, 32, 1024]
    - [17, 1091.0]
  - - [256, 1024, 8, 64, 256, 256, 64, 1024]
    - [47, 1292.0]
  - - [256, 1024, 8, 128, 256, 256, 128, 1024]
    - [57, 1424.0]
  - - [256, 1024, 8, 256, 256, 256, 256, 1024]
    - [57, 1483.0]
  - - [256, 1024, 8, 512, 256, 256, 512, 1024]
    - [21, 1518.0]
  - - [256, 1024, 8, 1024, 256, 256, 1024, 1024]
    - [26, 1543.0]
  - - [256, 1024, 8, 2048, 256, 256, 2048, 1024]
    - [2, 1553.0]
  - - [256, 2048, 8, 32, 256, 256, 32, 2048]
    - [44, 1259.0]
  - - [256, 2048, 8, 64, 256, 256, 64, 2048]
    - [57, 1478.0]
  - - [256, 2048, 8, 128, 256, 256, 128, 2048]
    - [57, 1601.0]
  - - [256, 2048, 8, 256, 256, 256, 256, 2048]
    - [70, 1664.0]
  - - [256, 2048, 8, 512, 256, 256, 512, 2048]
    - [57, 1705.0]
  - - [256, 2048, 8, 1024, 256, 256, 1024, 2048]
    - [11, 1722.0]
  - - [256, 2048, 8, 2048, 256, 256, 2048, 2048]
    - [17, 1730.0]
  - - [512, 32, 8, 32, 512, 512, 32, 32]
    - [42, 158.0]
  - - [512, 32, 8, 64, 512, 512, 64, 32]
    - [18, 221.0]
  - - [512, 32, 8, 128, 512, 512, 128, 32]
    - [30, 289.0]
  - - [512, 32, 8, 256, 512, 512, 256, 32]
    - [16, 338.0]
  - - [512, 32, 8, 512, 512, 512, 512, 32]
    - [16, 370.0]
  - - [512, 32, 8, 1024, 512, 512, 1024, 32]
    - [19, 393.0]
  - - [512, 32, 8, 2048, 512, 512, 2048, 32]
    - [33, 410.0]
  - - [512, 64, 8, 32, 512, 512, 32, 64]
    - [3, 308.0]
  - - [512, 64, 8, 64, 512, 512, 64, 64]
    - [3, 452.0]
  - - [512, 64, 8, 128, 512, 512, 128, 64]
    - [23, 579.0]
  - - [512, 64, 8, 256, 512, 512, 256, 64]
    - [8, 672.0]
  - - [512, 64, 8, 512, 512, 512, 512, 64]
    - [16, 736.0]
  - - [512, 64, 8, 1024, 512, 512, 1024, 64]
    - [4, 787.0]
  - - [512, 64, 8, 2048, 512, 512, 2048, 64]
    - [4, 821.0]
  - - [512, 128, 8, 32, 512, 512, 32, 128]
    - [44, 777.0]
  - - [512, 128, 8, 64, 512, 512, 64, 128]
    - [31, 910.0]
  - - [512, 128, 8, 128, 512, 512, 128, 128]
    - [44, 980.0]
  - - [512, 128, 8, 256, 512, 512, 256, 128]
    - [2, 1036.0]
  - - [512, 128, 8, 512, 512, 512, 512, 128]
    - [53, 1054.0]
  - - [512, 128, 8, 1024, 512, 512, 1024, 128]
    - [55, 1079.0]
  - - [512, 128, 8, 2048, 512, 512, 2048, 128]
    - [7, 1088.0]
  - - [512, 256, 8, 32, 512, 512, 32, 256]
    - [73, 856.0]
  - - [512, 256, 8, 64, 512, 512, 64, 256]
    - [67, 1022.0]
  - - [512, 256, 8, 128, 512, 512, 128, 256]
    - [67, 1109.0]
  - - [512, 256, 8, 256, 512, 512, 256, 256]
    - [57, 1168.0]
  - - [512, 256, 8, 512, 512, 512, 512, 256]
    - [59, 1195.0]
  - - [512, 256, 8, 1024, 512, 512, 1024, 256]
    - [67, 1210.0]
  - - [512, 256, 8, 2048, 512, 512, 2048, 256]
    - [67, 1216.0]
  - - [512, 512, 8, 32, 512, 512, 32, 512]
    - [31, 1080.0]
  - - [512, 512, 8, 64, 512, 512, 64, 512]
    - [44, 1288.0]
  - - [512, 512, 8, 128, 512, 512, 128, 512]
    - [67, 1413.0]
  - - [512, 512, 8, 256, 512, 512, 256, 512]
    - [17, 1481.0]
  - - [512, 512, 8, 512, 512, 512, 512, 512]
    - [67, 1519.0]
  - - [512, 512, 8, 1024, 512, 512, 1024, 512]
    - [40, 1544.0]
  - - [512, 512, 8, 2048, 512, 512, 2048, 512]
    - [40, 1552.0]
  - - [512, 1024, 8, 32, 512, 512, 32, 1024]
    - [57, 1294.0]
  - - [512, 1024, 8, 64, 512, 512, 64, 1024]
    - [57, 1465.0]
  - - [512, 1024, 8, 128, 512, 512, 128, 1024]
    - [17, 1596.0]
  - - [512, 1024, 8, 256, 512, 512, 256, 1024]
    - [57, 1667.0]
  - - [512, 1024, 8, 512, 512, 512, 512, 1024]
    - [17, 1702.0]
  - - [512, 1024, 8, 1024, 512, 512, 1024, 1024]
    - [62, 1721.0]
  - - [512, 1024, 8, 2048, 512, 512, 2048, 1024]
    - [17, 1731.0]
  - - [512, 2048, 8, 32, 512, 512, 32, 2048]
    - [17, 1419.0]
  - - [512, 2048, 8, 64, 512, 512, 64, 2048]
    - [57, 1640.0]
  - - [512, 2048, 8, 128, 512, 512, 128, 2048]
    - [50, 1770.0]
  - - [512, 2048, 8, 256, 512, 512, 256, 2048]
    - [17, 1848.0]
  - - [512, 2048, 8, 512, 512, 512, 512, 2048]
    - [17, 1891.0]
  - - [512, 2048, 8, 1024, 512, 512, 1024, 2048]
    - [44, 1908.0]
  - - [512, 2048, 8, 2048, 512, 512, 2048, 2048]
    - [57, 1920.0]
  - - [1024, 32, 8, 32, 1024, 1024, 32, 32]
    - [41, 388.0]
  - - [1024, 32, 8, 64, 1024, 1024, 64, 32]
    - [7, 454.0]
  - - [1024, 32, 8, 128, 1024, 1024, 128, 32]
    - [18, 555.0]
  - - [1024, 32, 8, 256, 1024, 1024, 256, 32]
    - [28, 635.0]
  - - [1024, 32, 8, 512, 1024, 1024, 512, 32]
    - [3, 683.0]
  - - [1024, 32, 8, 1024, 1024, 1024, 1024, 32]
    - [32, 735.0]
  - - [1024, 32, 8, 2048, 1024, 1024, 2048, 32]
    - [64, 756.0]
  - - [1024, 64, 8, 32, 1024, 1024, 32, 64]
    - [27, 763.0]
  - - [1024, 64, 8, 64, 1024, 1024, 64, 64]
    - [11, 891.0]
  - - [1024, 64, 8, 128, 1024, 1024, 128, 64]
    - [44, 975.0]
  - - [1024, 64, 8, 256, 1024, 1024, 256, 64]
    - [44, 1019.0]
  - - [1024, 64, 8, 512, 1024, 1024, 512, 64]
    - [73, 1049.0]
  - - [1024, 64, 8, 1024, 1024, 1024, 1024, 64]
    - [63, 1077.0]
  - - [1024, 64, 8, 2048, 1024, 1024, 2048, 64]
    - [17, 1085.0]
  - - [1024, 128, 8, 32, 1024, 1024, 32, 128]
    - [62, 834.0]
  - - [1024, 128, 8, 64, 1024, 1024, 64, 128]
    - [67, 994.0]
  - - [1024, 128, 8, 128, 1024, 1024, 128, 128]
    - [55, 1098.0]
  - - [1024, 128, 8, 256, 1024, 1024, 256, 128]
    - [44, 1156.0]
  - - [1024, 128, 8, 512, 1024, 1024, 512, 128]
    - [57, 1191.0]
  - - [1024, 128, 8, 1024, 1024, 1024, 1024, 128]
    - [57, 1209.0]
  - - [1024, 128, 8, 2048, 1024, 1024, 2048, 128]
    - [67, 1215.0]
  - - [1024, 256, 8, 32, 1024, 1024, 32, 256]
    - [67, 1077.0]
  - - [1024, 256, 8, 64, 1024, 1024, 64, 256]
    - [57, 1275.0]
  - - [1024, 256, 8, 128, 1024, 1024, 128, 256]
    - [61, 1401.0]
  - - [1024, 256, 8, 256, 1024, 1024, 256, 256]
    - [57, 1474.0]
  - - [1024, 256, 8, 512, 1024, 1024, 512, 256]
    - [7, 1508.0]
  - - [1024, 256, 8, 1024, 1024, 1024, 1024, 256]
    - [17, 1545.0]
  - - [1024, 256, 8, 2048, 1024, 1024, 2048, 256]
    - [50, 1547.0]
  - - [1024, 512, 8, 32, 1024, 1024, 32, 512]
    - [57, 1255.0]
  - - [1024, 512, 8, 64, 1024, 1024, 64, 512]
    - [67, 1474.0]
  - - [1024, 512, 8, 128, 1024, 1024, 128, 512]
    - [67, 1585.0]
  - - [1024, 512, 8, 256, 1024, 1024, 256, 512]
    - [57, 1659.0]
  - - [1024, 512, 8, 512, 1024, 1024, 512, 512]
    - [26, 1699.0]
  - - [1024, 512, 8, 1024, 1024, 1024, 1024, 512]
    - [41, 1721.0]
  - - [1024, 512, 8, 2048, 1024, 1024, 2048, 512]
    - [11, 1796.0]
  - - [1024, 1024, 8, 32, 1024, 1024, 32, 1024]
    - [57, 1439.0]
  - - [1024, 1024, 8, 64, 1024, 1024, 64, 1024]
    - [57, 1645.0]
  - - [1024, 1024, 8, 128, 1024, 1024, 128, 1024]
    - [57, 1771.0]
  - - [1024, 1024, 8, 256, 1024, 1024, 256, 1024]
    - [57, 1844.0]
  - - [1024, 1024, 8, 512, 1024, 1024, 512, 1024]
    - [57, 1885.0]
  - - [1024, 1024, 8, 1024, 1024, 1024, 1024, 1024]
    - [21, 1904.0]
  - - [1024, 1024, 8, 2048, 1024, 1024, 2048, 1024]
    - [17, 1915.0]
  - - [1024, 2048, 8, 32, 1024, 1024, 32, 2048]
    - [17, 1497.0]
  - - [1024, 2048, 8, 64, 1024, 1024, 64, 2048]
    - [57, 1715.0]
  - - [1024, 2048, 8, 128, 1024, 1024, 128, 2048]
    - [37, 1818.0]
  - - [1024, 2048, 8, 256, 1024, 1024, 256, 2048]
    - [13, 1877.0]
  - - [1024, 2048, 8, 512, 1024, 1024, 512, 2048]
    - [53, 1911.0]
  - - [1024, 2048, 8, 1024, 1024, 1024, 1024, 2048]
    - [73, 1928.0]
  - - [1024, 2048, 8, 2048, 1024, 1024, 2048, 2048]
    - [21, 1935.0]
  - - [2048, 32, 8, 32, 2048, 2048, 32, 32]
    - [54, 546.0]
  - - [2048, 32, 8, 64, 2048, 2048, 64, 32]
    - [48, 633.0]
  - - [2048, 32, 8, 128, 2048, 2048, 128, 32]
    - [74, 693.0]
  - - [2048, 32, 8, 256, 2048, 2048, 256, 32]
    - [74, 726.0]
  - - [2048, 32, 8, 512, 2048, 2048, 512, 32]
    - [45, 744.0]
  - - [2048, 32, 8, 1024, 2048, 2048, 1024, 32]
    - [58, 759.0]
  - - [2048, 32, 8, 2048, 2048, 2048, 2048, 32]
    - [64, 762.0]
  - - [2048, 64, 8, 32, 2048, 2048, 32, 64]
    - [62, 829.0]
  - - [2048, 64, 8, 64, 2048, 2048, 64, 64]
    - [2, 981.0]
  - - [2048, 64, 8, 128, 2048, 2048, 128, 64]
    - [44, 1085.0]
  - - [2048, 64, 8, 256, 2048, 2048, 256, 64]
    - [44, 1151.0]
  - - [2048, 64, 8, 512, 2048, 2048, 512, 64]
    - [31, 1187.0]
  - - [2048, 64, 8, 1024, 2048, 2048, 1024, 64]
    - [57, 1203.0]
  - - [2048, 64, 8, 2048, 2048, 2048, 2048, 64]
    - [57, 1210.0]
  - - [2048, 128, 8, 32, 2048, 2048, 32, 128]
    - [62, 1062.0]
  - - [2048, 128, 8, 64, 2048, 2048, 64, 128]
    - [61, 1260.0]
  - - [2048, 128, 8, 128, 2048, 2048, 128, 128]
    - [67, 1393.0]
  - - [2048, 128, 8, 256, 2048, 2048, 256, 128]
    - [17, 1473.0]
  - - [2048, 128, 8, 512, 2048, 2048, 512, 128]
    - [41, 1507.0]
  - - [2048, 128, 8, 1024, 2048, 2048, 1024, 128]
    - [55, 1531.0]
  - - [2048, 128, 8, 2048, 2048, 2048, 2048, 128]
    - [21, 1544.0]
  - - [2048, 256, 8, 32, 2048, 2048, 32, 256]
    - [59, 1252.0]
  - - [2048, 256, 8, 64, 2048, 2048, 64, 256]
    - [67, 1447.0]
  - - [2048, 256, 8, 128, 2048, 2048, 128, 256]
    - [67, 1576.0]
  - - [2048, 256, 8, 256, 2048, 2048, 256, 256]
    - [57, 1656.0]
  - - [2048, 256, 8, 512, 2048, 2048, 512, 256]
    - [40, 1696.0]
  - - [2048, 256, 8, 1024, 2048, 2048, 1024, 256]
    - [17, 1718.0]
  - - [2048, 256, 8, 2048, 2048, 2048, 2048, 256]
    - [31, 1728.0]
  - - [2048, 512, 8, 32, 2048, 2048, 32, 512]
    - [63, 1371.0]
  - - [2048, 512, 8, 64, 2048, 2048, 64, 512]
    - [67, 1607.0]
  - - [2048, 512, 8, 128, 2048, 2048, 128, 512]
    - [67, 1749.0]
  - - [2048, 512, 8, 256, 2048, 2048, 256, 512]
    - [55, 1836.0]
  - - [2048, 512, 8, 512, 2048, 2048, 512, 512]
    - [70, 1881.0]
  - - [2048, 512, 8, 1024, 2048, 2048, 1024, 512]
    - [26, 1904.0]
  - - [2048, 512, 8, 2048, 2048, 2048, 2048, 512]
    - [26, 1913.0]
  - - [2048, 1024, 8, 32, 2048, 2048, 32, 1024]
    - [53, 1473.0]
  - - [2048, 1024, 8, 64, 2048, 2048, 64, 1024]
    - [47, 1700.0]
  - - [2048, 1024, 8, 128, 2048, 2048, 128, 1024]
    - [13, 1808.0]
  - - [2048, 1024, 8, 256, 2048, 2048, 256, 1024]
    - [7, 1874.0]
  - - [2048, 1024, 8, 512, 2048, 2048, 512, 1024]
    - [11, 1910.0]
  - - [2048, 1024, 8, 1024, 2048, 2048, 1024, 1024]
    - [26, 1928.0]
  - - [2048, 1024, 8, 2048, 2048, 2048, 2048, 1024]
    - [37, 1935.0]
  - - [2048, 2048, 8, 32, 2048, 2048, 32, 2048]
    - [11, 1545.0]
  - - [2048, 2048, 8, 64, 2048, 2048, 64, 2048]
    - [44, 1759.0]
  - - [2048, 2048, 8, 128, 2048, 2048, 128, 2048]
    - [59, 1856.0]
  - - [2048, 2048, 8, 256, 2048, 2048, 256, 2048]
    - [13, 1915.0]
  - - [2048, 2048, 8, 512, 2048, 2048, 512, 2048]
    - [55, 1944.0]
  - - [2048, 2048, 8, 1024, 2048, 2048, 1024, 2048]
    - [2, 1965.0]
  - - [2048, 2048, 8, 2048, 2048, 2048, 2048, 2048]
    - [55, 1976.0]
- null
