library/src/blas3/Tensile/Logic/asm_full/arcturus_Cijk_Alik_Bljk_BBH.yaml
- {MinimumRequiredVersion: 4.14.0}
- arcturus
- gfx908
- [Device 7380, Device 7388, Device 738c, Device 7390]
    SolutionIndex: 0
    SolutionNameMin: Cijk_Alik_Bljk_BBH_MT64x128x16_MI32x32x2x2_SE_GRVW4_ONLL0_SNLL1
    SolutionIndex: 1
    SolutionNameMin: Cijk_Alik_Bljk_BBH_MT64x128x16_MI32x32x2x2_SE_GRVW2_ONLL0_SNLL0
    SolutionIndex: 2
    SolutionNameMin: Cijk_Alik_Bljk_BBH_MT64x128x16_MI32x32x2x2_SE_GRVW4_ONLL0_SNLL0
    SolutionIndex: 3
    SolutionNameMin: Cijk_Alik_Bljk_BBH_MT64x128x32_MI32x32x2x2_SE_GRVW4_ONLL0_SNLL0
    SolutionIndex: 4
    SolutionNameMin: Cijk_Alik_Bljk_BBH_MT64x128x16_MI32x32x2x2_SE_GRVW4_ONLL1_SNLL1
    SolutionIndex: 5
    SolutionNameMin: Cijk_Alik_Bljk_BBH_MT64x128x16_MI32x32x2x2_SE_GRVW2_ONLL1_SNLL0
    SolutionIndex: 6
    SolutionNameMin: Cijk_Alik_Bljk_BBH_MT32x256x16_MI32x32x2x2_SE_GRVW4_ONLL1_SNLL0
    SolutionIndex: 7
    SolutionNameMin: Cijk_Alik_Bljk_BBH_MT64x128x16_MI32x32x2x2_SE_GRVW4_ONLL1_SNLL0
    SolutionIndex: 8
    SolutionNameMin: Cijk_Alik_Bljk_BBH_MT64x128x32_MI32x32x2x2_SE_GRVW4_ONLL1_SNLL0
    SolutionIndex: 9
    SolutionNameMin: Cijk_Alik_Bljk_BBH_MT64x256x16_MI32x32x2x2_SE_GRVW4_ONLL0_SNLL0
    SolutionIndex: 10
    SolutionNameMin: Cijk_Alik_Bljk_BBH_MT64x256x16_MI32x32x2x2_SE_GRVW4_ONLL1_SNLL1
    SolutionIndex: 11
    SolutionNameMin: Cijk_Alik_Bljk_BBH_MT128x32x16_SE_
    SolutionIndex: 12
    SolutionNameMin: Cijk_Alik_Bljk_BBH_MT128x64x16_SE_
    SolutionIndex: 13
    SolutionNameMin: Cijk_Alik_Bljk_BBH_MT32x128x16_SE_
    SolutionIndex: 14
    SolutionNameMin: Cijk_Alik_Bljk_BBH_MT64x128x16_SE_
    SolutionIndex: 15
    SolutionNameMin: Cijk_Alik_Bljk_BBH_MT256x128x16_SE_
    SolutionIndex: 16
    SolutionNameMin: Cijk_Alik_Bljk_BBH_MT128x256x16_SE_
    SolutionIndex: 17
    SolutionNameMin: Cijk_Alik_Bljk_BBH_MT64x16x16_SE_
    SolutionIndex: 18
    SolutionNameMin: Cijk_Alik_Bljk_BBH_MT16x64x16_SE_
    SolutionIndex: 19
    SolutionNameMin: Cijk_Alik_Bljk_BBH_MT64x128x32_SE_
    SolutionIndex: 20
    SolutionNameMin: Cijk_Alik_Bljk_BBH_MT64x128x64_SE_
    SolutionIndex: 21
    SolutionNameMin: Cijk_Alik_Bljk_BBH_MT32x32x32_SE_
    SolutionIndex: 22
    SolutionNameMin: Cijk_Alik_Bljk_BBH_MT128x64x16_SE_
    SolutionIndex: 23
    SolutionNameMin: Cijk_Alik_Bljk_BBH_MT32x128x16_SE_
    SolutionIndex: 24
    SolutionNameMin: Cijk_Alik_Bljk_BBH_MT64x128x16_SE_
    SolutionIndex: 25
    SolutionNameMin: Cijk_Alik_Bljk_BBH_MT256x128x16_SE_
    SolutionIndex: 26
    SolutionNameMin: Cijk_Alik_Bljk_BBH_MT128x256x16_SE_
    SolutionIndex: 27
    SolutionNameMin: Cijk_Alik_Bljk_BBH_MT64x16x16_SE_
    SolutionIndex: 28
    SolutionNameMin: Cijk_Alik_Bljk_BBH_MT16x64x16_SE_
    SolutionIndex: 29
    SolutionNameMin: Cijk_Alik_Bljk_BBH_MT64x128x32_SE_
    SolutionIndex: 30
    SolutionNameMin: Cijk_Alik_Bljk_BBH_MT64x128x64_SE_
    SolutionIndex: 31
    SolutionNameMin: Cijk_Alik_Bljk_BBH_MT32x32x32_SE_
    SolutionIndex: 32
    SolutionNameMin: Cijk_Alik_Bljk_BBH_MT64x128x8_MI32x32x2x2_SE_GRVW4_ONLL0_SNLL1
    SolutionIndex: 33
    SolutionNameMin: Cijk_Alik_Bljk_BBH_MT64x128x8_MI32x32x2x2_SE_GRVW4_ONLL1_SNLL0
    SolutionIndex: 34
    SolutionNameMin: Cijk_Alik_Bljk_BBH_MT64x128x16_MI32x32x2x2_SE_GRVW4_ONLL1_SNLL0
    SolutionIndex: 35
    SolutionNameMin: Cijk_Alik_Bljk_BBH_MT64x128x64_SE_
    SolutionIndex: 36
    SolutionNameMin: Cijk_Alik_Bljk_BBH_MT128x64x16_SE_AF0EM1_ASEM1_GRVW1_WGM8
    SolutionIndex: 37
    SolutionNameMin: Cijk_Alik_Bljk_BBH_MT32x128x16_SE_AF0EM1_ASEM1_GRVW1_WGM8
    SolutionIndex: 38
    SolutionNameMin: Cijk_Alik_Bljk_BBH_MT64x16x16_SE_AF0EM1_ASEM1_GRVW1_WGM8
    SolutionIndex: 39
    SolutionNameMin: Cijk_Alik_Bljk_BBH_MT64x32x16_SE_AF0EM1_ASEM1_GRVW1_WGM8
    SolutionIndex: 40
    SolutionNameMin: Cijk_Alik_Bljk_BBH_MT32x64x64_SE_AF0EM8_ASEM8_GRVW2_WGM8
    SolutionIndex: 41
    SolutionNameMin: Cijk_Alik_Bljk_BBH_MT64x32x64_SE_AF0EM8_ASEM8_GRVW2_WGM8
    SolutionIndex: 42
    SolutionNameMin: Cijk_Alik_Bljk_BBH_MT64x128x32_MI32x32x2x2_SE_AF0EM2_ASEM1_GRVW4_WGM1
    SolutionIndex: 43
    SolutionNameMin: Cijk_Alik_Bljk_BBH_MT64x128x32_MI32x32x2x2_SE_AF0EM2_ASEM2_GRVW4_WGM1
    SolutionIndex: 44
    SolutionNameMin: Cijk_Alik_Bljk_BBH_MT32x256x32_MI32x32x2x2_SE_AF0EM2_ASEM1_GRVW4_WGM8
    SolutionIndex: 45
    SolutionNameMin: Cijk_Alik_Bljk_BBH_MT64x128x32_MI32x32x2x2_SE_AF0EM2_ASEM1_GRVW4_WGM8
    SolutionIndex: 46
    SolutionNameMin: Cijk_Alik_Bljk_BBH_MT64x128x32_MI32x32x2x2_SE_AF0EM2_ASEM2_GRVW4_WGM8
    SolutionIndex: 47
    SolutionIndex: 48
    SolutionIndex: 49
    SolutionIndex: 50
    SolutionIndex: 51
    SolutionIndex: 52
    SolutionIndex: 53
    SolutionIndex: 54
    SolutionIndex: 55
    SolutionIndex: 56
    SolutionIndex: 57
    SolutionIndex: 58
    SolutionIndex: 59
    SolutionIndex: 60
    SolutionIndex: 61
    SolutionIndex: 62
    SolutionIndex: 63
    SolutionIndex: 64
    SolutionIndex: 65
    SolutionIndex: 66
    SolutionIndex: 67
    SolutionIndex: 68
    SolutionIndex: 69
    SolutionIndex: 70
    SolutionIndex: 71
    SolutionIndex: 72
    SolutionIndex: 73
    SolutionIndex: 74
    SolutionIndex: 75
    SolutionIndex: 76
    SolutionIndex: 77
    SolutionIndex: 78
    SolutionIndex: 79
    SolutionIndex: 80
    SolutionIndex: 81
    SolutionIndex: 82
    SolutionIndex: 83
    SolutionIndex: 84
    SolutionIndex: 85
    SolutionIndex: 86
    SolutionIndex: 87
    SolutionIndex: 88
    SolutionIndex: 89
    SolutionNameMin: Cijk_Alik_Bljk_BBH_MT64x128x16_MI32x32x2x2_SE_GRVW4_ONLL0_SNLL1
    SolutionIndex: 90
    SolutionNameMin: Cijk_Alik_Bljk_BBH_MT64x128x16_MI32x32x2x2_SE_GRVW2_ONLL0_SNLL0
    SolutionIndex: 91
    SolutionNameMin: Cijk_Alik_Bljk_BBH_MT64x128x16_MI32x32x2x2_SE_GRVW4_ONLL0_SNLL0
    SolutionIndex: 92
    SolutionNameMin: Cijk_Alik_Bljk_BBH_MT64x128x32_MI32x32x2x2_SE_GRVW4_ONLL0_SNLL0
    SolutionIndex: 93
    SolutionNameMin: Cijk_Alik_Bljk_BBH_MT64x128x16_MI32x32x2x2_SE_GRVW4_ONLL1_SNLL1
    SolutionIndex: 94
    SolutionNameMin: Cijk_Alik_Bljk_BBH_MT64x128x16_MI32x32x2x2_SE_GRVW2_ONLL1_SNLL0
    SolutionIndex: 95
    SolutionNameMin: Cijk_Alik_Bljk_BBH_MT32x256x16_MI32x32x2x2_SE_GRVW4_ONLL1_SNLL0
    SolutionIndex: 96
    SolutionNameMin: Cijk_Alik_Bljk_BBH_MT64x128x16_MI32x32x2x2_SE_GRVW4_ONLL1_SNLL0
    SolutionIndex: 97
    SolutionNameMin: Cijk_Alik_Bljk_BBH_MT64x128x32_MI32x32x2x2_SE_GRVW4_ONLL1_SNLL0
    SolutionIndex: 98
    SolutionNameMin: Cijk_Alik_Bljk_BBH_MT64x256x16_MI32x32x2x2_SE_GRVW4_ONLL0_SNLL0
    SolutionIndex: 99
    SolutionNameMin: Cijk_Alik_Bljk_BBH_MT64x256x16_MI32x32x2x2_SE_GRVW4_ONLL1_SNLL1
    SolutionIndex: 100
    SolutionNameMin: Cijk_Alik_Bljk_BBH_MT128x32x16_SE_
    SolutionIndex: 101
    SolutionNameMin: Cijk_Alik_Bljk_BBH_MT128x64x16_SE_
    SolutionIndex: 102
    SolutionNameMin: Cijk_Alik_Bljk_BBH_MT32x128x16_SE_
    SolutionIndex: 103
    SolutionNameMin: Cijk_Alik_Bljk_BBH_MT64x128x16_SE_
    SolutionIndex: 104
    SolutionNameMin: Cijk_Alik_Bljk_BBH_MT256x128x16_SE_
    SolutionIndex: 105
    SolutionNameMin: Cijk_Alik_Bljk_BBH_MT128x256x16_SE_
    SolutionIndex: 106
    SolutionNameMin: Cijk_Alik_Bljk_BBH_MT64x16x16_SE_
    SolutionIndex: 107
    SolutionNameMin: Cijk_Alik_Bljk_BBH_MT16x64x16_SE_
    SolutionIndex: 108
    SolutionNameMin: Cijk_Alik_Bljk_BBH_MT64x128x32_SE_
    SolutionIndex: 109
    SolutionNameMin: Cijk_Alik_Bljk_BBH_MT64x128x64_SE_
    SolutionIndex: 110
    SolutionNameMin: Cijk_Alik_Bljk_BBH_MT32x32x32_SE_
    SolutionIndex: 111
    SolutionNameMin: Cijk_Alik_Bljk_BBH_MT128x64x16_SE_
    SolutionIndex: 112
    SolutionNameMin: Cijk_Alik_Bljk_BBH_MT32x128x16_SE_
    SolutionIndex: 113
    SolutionNameMin: Cijk_Alik_Bljk_BBH_MT64x128x16_SE_
    SolutionIndex: 114
    SolutionNameMin: Cijk_Alik_Bljk_BBH_MT256x128x16_SE_
    SolutionIndex: 115
    SolutionNameMin: Cijk_Alik_Bljk_BBH_MT128x256x16_SE_
    SolutionIndex: 116
    SolutionNameMin: Cijk_Alik_Bljk_BBH_MT64x16x16_SE_
    SolutionIndex: 117
    SolutionNameMin: Cijk_Alik_Bljk_BBH_MT16x64x16_SE_
    SolutionIndex: 118
    SolutionNameMin: Cijk_Alik_Bljk_BBH_MT64x128x32_SE_
    SolutionIndex: 119
    SolutionNameMin: Cijk_Alik_Bljk_BBH_MT64x128x64_SE_
    SolutionIndex: 120
    SolutionNameMin: Cijk_Alik_Bljk_BBH_MT32x32x32_SE_
    SolutionIndex: 121
    SolutionNameMin: Cijk_Alik_Bljk_BBH_MT64x128x8_MI32x32x2x2_SE_GRVW4_ONLL0_SNLL1
    SolutionIndex: 122
    SolutionNameMin: Cijk_Alik_Bljk_BBH_MT64x128x8_MI32x32x2x2_SE_GRVW4_ONLL1_SNLL0
    SolutionIndex: 123
    SolutionNameMin: Cijk_Alik_Bljk_BBH_MT64x128x16_MI32x32x2x2_SE_GRVW4_ONLL1_SNLL0
    SolutionIndex: 124
    SolutionNameMin: Cijk_Alik_Bljk_BBH_MT64x128x64_SE_
    SolutionIndex: 125
    SolutionNameMin: Cijk_Alik_Bljk_BBH_MT128x64x16_SE_AF0EM1_ASEM1_GRVW1_WGM8
    SolutionIndex: 126
    SolutionNameMin: Cijk_Alik_Bljk_BBH_MT32x128x16_SE_AF0EM1_ASEM1_GRVW1_WGM8
    SolutionIndex: 127
    SolutionNameMin: Cijk_Alik_Bljk_BBH_MT64x16x16_SE_AF0EM1_ASEM1_GRVW1_WGM8
    SolutionIndex: 128
    SolutionNameMin: Cijk_Alik_Bljk_BBH_MT64x32x16_SE_AF0EM1_ASEM1_GRVW1_WGM8
    SolutionIndex: 129
    SolutionNameMin: Cijk_Alik_Bljk_BBH_MT32x64x64_SE_AF0EM8_ASEM8_GRVW2_WGM8
    SolutionIndex: 130
    SolutionNameMin: Cijk_Alik_Bljk_BBH_MT64x32x64_SE_AF0EM8_ASEM8_GRVW2_WGM8
    SolutionIndex: 131
    SolutionNameMin: Cijk_Alik_Bljk_BBH_MT64x128x32_MI32x32x2x2_SE_AF0EM2_ASEM1_GRVW4_WGM1
    SolutionIndex: 132
    SolutionNameMin: Cijk_Alik_Bljk_BBH_MT64x128x32_MI32x32x2x2_SE_AF0EM2_ASEM2_GRVW4_WGM1
    SolutionIndex: 133
    SolutionNameMin: Cijk_Alik_Bljk_BBH_MT32x256x32_MI32x32x2x2_SE_AF0EM2_ASEM1_GRVW4_WGM8
    SolutionIndex: 134
    SolutionNameMin: Cijk_Alik_Bljk_BBH_MT64x128x32_MI32x32x2x2_SE_AF0EM2_ASEM1_GRVW4_WGM8
    SolutionIndex: 135
    SolutionNameMin: Cijk_Alik_Bljk_BBH_MT64x128x32_MI32x32x2x2_SE_AF0EM2_ASEM2_GRVW4_WGM8
    SolutionIndex: 136
    SolutionIndex: 137
    SolutionIndex: 138
    SolutionIndex: 139
    SolutionIndex: 140
    SolutionIndex: 141
    SolutionIndex: 142
    SolutionIndex: 143
    SolutionIndex: 144
    SolutionIndex: 145
    SolutionIndex: 146
    SolutionIndex: 147
    SolutionIndex: 148
    SolutionIndex: 149
    SolutionIndex: 150
    SolutionIndex: 151
    SolutionIndex: 152
    SolutionIndex: 153
    SolutionIndex: 154
    SolutionIndex: 155
    SolutionIndex: 156
    SolutionIndex: 157
    SolutionIndex: 158
    SolutionIndex: 159
    SolutionIndex: 160
    SolutionIndex: 161
    SolutionIndex: 162
    SolutionIndex: 163
    SolutionIndex: 164
    SolutionIndex: 165
    SolutionIndex: 166
    SolutionIndex: 167
    SolutionIndex: 168
    SolutionIndex: 169
    SolutionIndex: 170
    SolutionIndex: 171
    SolutionIndex: 172
    SolutionIndex: 173
    SolutionIndex: 174
    SolutionIndex: 175
    SolutionIndex: 176
    SolutionIndex: 177
    SolutionIndex: 178
    SolutionIndex: 179
    SolutionIndex: 180
    SolutionIndex: 181
    SolutionIndex: 182
    SolutionIndex: 183
    SolutionIndex: 184
    SolutionIndex: 185
    SolutionIndex: 186
    SolutionIndex: 187
    SolutionIndex: 188
    SolutionIndex: 189
    SolutionIndex: 190
    SolutionIndex: 191
    SolutionIndex: 192
    SolutionIndex: 193
    SolutionIndex: 194
    SolutionIndex: 195
    SolutionIndex: 196
    SolutionIndex: 197
    SolutionIndex: 198
    SolutionIndex: 199
    SolutionIndex: 200
    SolutionIndex: 201
    SolutionIndex: 202
    SolutionIndex: 203
    SolutionIndex: 204
    SolutionIndex: 205
    SolutionIndex: 206
    SolutionIndex: 207
    SolutionIndex: 208
    SolutionIndex: 209
    SolutionIndex: 210
    SolutionIndex: 211
    SolutionIndex: 212
    SolutionIndex: 213
    SolutionIndex: 214
    SolutionIndex: 215
    SolutionIndex: 216
    SolutionIndex: 217
    SolutionIndex: 218
    SolutionIndex: 219
    SolutionIndex: 220
    SolutionIndex: 221
    SolutionIndex: 222
    SolutionIndex: 223
    SolutionIndex: 224
    SolutionIndex: 225
    SolutionIndex: 226
    SolutionIndex: 227
    SolutionIndex: 228
    SolutionIndex: 229
    SolutionIndex: 230
    SolutionIndex: 231
    SolutionIndex: 232
    SolutionIndex: 233
    SolutionIndex: 234
    SolutionIndex: 235
    SolutionIndex: 236
    SolutionIndex: 237
    SolutionIndex: 238
    SolutionIndex: 239
    SolutionIndex: 240
    SolutionIndex: 241
    SolutionIndex: 242
    SolutionIndex: 243
    SolutionIndex: 244
    SolutionIndex: 245
    SolutionIndex: 246
    SolutionIndex: 247
    SolutionIndex: 248
    SolutionIndex: 249
    SolutionIndex: 250
    SolutionIndex: 251
    SolutionIndex: 252
    SolutionIndex: 253
    SolutionIndex: 254
    SolutionIndex: 255
    SolutionIndex: 256
    SolutionIndex: 257
    SolutionIndex: 258
    SolutionIndex: 259
    SolutionIndex: 260
    SolutionIndex: 261
    SolutionIndex: 262
    SolutionIndex: 263
    SolutionIndex: 264
    SolutionIndex: 265
    SolutionIndex: 266
    SolutionIndex: 267
    SolutionIndex: 268
    SolutionIndex: 269
    SolutionIndex: 270
    SolutionIndex: 271
    SolutionIndex: 272
    SolutionIndex: 273
    SolutionIndex: 274
    SolutionIndex: 275
    SolutionIndex: 276
    SolutionIndex: 277
    SolutionIndex: 278
    SolutionIndex: 279
    SolutionIndex: 280
    SolutionIndex: 281
    SolutionIndex: 282
    SolutionIndex: 283
    SolutionIndex: 284
    SolutionIndex: 285
    SolutionIndex: 286
    SolutionIndex: 287
    SolutionIndex: 288
    SolutionIndex: 289
    SolutionIndex: 290
    SolutionIndex: 291
    SolutionIndex: 292
    SolutionIndex: 293
    SolutionIndex: 294
    SolutionIndex: 295
    SolutionIndex: 296
    SolutionIndex: 297
    SolutionIndex: 298
    SolutionIndex: 299
    SolutionIndex: 300
    SolutionIndex: 301
    SolutionIndex: 302
    SolutionIndex: 303
    SolutionIndex: 304
    SolutionIndex: 305
    SolutionIndex: 306
    SolutionIndex: 307
    SolutionIndex: 308
    SolutionIndex: 309
    SolutionIndex: 310
    SolutionIndex: 311
    SolutionIndex: 312
    SolutionIndex: 313
    SolutionIndex: 314
- - - [511, 4096, 1, 4096]
    - [22, 0.0]
  - - [512, 3071, 1, 3072]
    - [22, 0.0]
  - - [2880, 3073, 1, 3072]
    - [22, 0.0]
  - - [511, 3072, 1, 3072]
    - [22, 0.0]
  - - [1024, 512, 1, 1025]
    - [22, 0.0]
  - - [511, 2048, 1, 2048]
    - [23, 0.0]
  - - [8192, 8193, 1, 8192]
    - [25, 0.0]
  - - [3072, 3072, 1, 3071]
    - [22, 0.0]
  - - [8192, 8192, 1, 8193]
    - [25, 0.0]
  - - [513, 1024, 1, 1024]
    - [22, 0.0]
  - - [512, 1023, 1, 1024]
    - [22, 0.0]
  - - [512, 2048, 1, 2047]
    - [23, 0.0]
  - - [7680, 8192, 1, 8193]
    - [25, 0.0]
  - - [513, 4096, 1, 4096]
    - [22, 0.0]
  - - [3073, 512, 1, 3072]
    - [22, 0.0]
  - - [4096, 4096, 1, 4097]
    - [22, 0.0]
  - - [1025, 1024, 1, 1024]
    - [23, 0.0]
  - - [8192, 8191, 1, 8192]
    - [25, 0.0]
  - - [8192, 512, 1, 8193]
    - [22, 0.0]
  - - [7681, 8192, 1, 8192]
    - [25, 0.0]
  - - [2880, 3071, 1, 3072]
    - [24, 0.0]
  - - [512, 1025, 1, 1024]
    - [22, 0.0]
  - - [2048, 513, 1, 2048]
    - [23, 0.0]
  - - [1024, 1024, 1, 1025]
    - [23, 0.0]
  - - [960, 1024, 1, 1023]
    - [24, 0.0]
  - - [3072, 512, 1, 3071]
    - [22, 0.0]
  - - [960, 1025, 1, 1024]
    - [23, 0.0]
  - - [3072, 3071, 1, 3072]
    - [22, 0.0]
  - - [512, 2048, 1, 2049]
    - [23, 0.0]
  - - [3072, 511, 1, 3072]
    - [22, 0.0]
  - - [2049, 512, 1, 2048]
    - [23, 0.0]
  - - [512, 8191, 1, 8192]
    - [22, 0.0]
  - - [513, 3072, 1, 3072]
    - [22, 0.0]
  - - [4096, 4095, 1, 4096]
    - [22, 0.0]
  - - [511, 1024, 1, 1024]
    - [22, 0.0]
  - - [513, 512, 1, 512]
    - [27, 0.0]
  - - [1024, 511, 1, 1024]
    - [22, 0.0]
  - - [3072, 3072, 1, 3073]
    - [22, 0.0]
  - - [960, 1024, 1, 1025]
    - [24, 0.0]
  - - [959, 1024, 1, 1024]
    - [23, 0.0]
  - - [7680, 8193, 1, 8192]
    - [25, 0.0]
  - - [512, 3072, 1, 3073]
    - [22, 0.0]
  - - [1023, 512, 1, 1024]
    - [22, 0.0]
  - - [3072, 512, 1, 3073]
    - [22, 0.0]
  - - [512, 2049, 1, 2048]
    - [23, 0.0]
  - - [513, 8192, 1, 8192]
    - [24, 0.0]
  - - [7679, 8192, 1, 8192]
    - [25, 0.0]
  - - [1024, 513, 1, 1024]
    - [22, 0.0]
  - - [8192, 511, 1, 8192]
    - [22, 0.0]
  - - [4096, 4097, 1, 4096]
    - [22, 0.0]
  - - [512, 3072, 1, 3071]
    - [22, 0.0]
  - - [7680, 8192, 1, 8191]
    - [26, 0.0]
  - - [2048, 2047, 1, 2048]
    - [22, 0.0]
  - - [8193, 8192, 1, 8192]
    - [25, 0.0]
  - - [512, 4096, 1, 4095]
    - [23, 0.0]
  - - [1024, 1023, 1, 1024]
    - [23, 0.0]
  - - [3073, 3072, 1, 3072]
    - [22, 0.0]
  - - [512, 3073, 1, 3072]
    - [22, 0.0]
  - - [4096, 4096, 1, 4095]
    - [25, 0.0]
  - - [1920, 2048, 1, 2047]
    - [26, 0.0]
  - - [1920, 2049, 1, 2048]
    - [22, 0.0]
  - - [512, 8192, 1, 8191]
    - [24, 0.0]
  - - [8191, 512, 1, 8192]
    - [22, 0.0]
  - - [1025, 512, 1, 1024]
    - [22, 0.0]
  - - [2881, 3072, 1, 3072]
    - [22, 0.0]
  - - [64, 1024, 1, 1024]
    - [31, 0.0]
  - - [1024, 512, 1, 1023]
    - [22, 0.0]
  - - [513, 2048, 1, 2048]
    - [23, 0.0]
  - - [3841, 4096, 1, 4096]
    - [22, 0.0]
  - - [2880, 3072, 1, 3073]
    - [24, 0.0]
  - - [512, 512, 1, 513]
    - [27, 0.0]
  - - [4095, 512, 1, 4096]
    - [22, 0.0]
  - - [1919, 2048, 1, 2048]
    - [26, 0.0]
  - - [1024, 1025, 1, 1024]
    - [23, 0.0]
  - - [2879, 3072, 1, 3072]
    - [24, 0.0]
  - - [512, 8192, 1, 8193]
    - [22, 0.0]
  - - [511, 8192, 1, 8192]
    - [22, 0.0]
  - - [8192, 513, 1, 8192]
    - [22, 0.0]
  - - [512, 8193, 1, 8192]
    - [22, 0.0]
  - - [7680, 8191, 1, 8192]
    - [25, 0.0]
  - - [512, 512, 1, 511]
    - [27, 0.0]
  - - [2047, 2048, 1, 2048]
    - [22, 0.0]
  - - [2049, 2048, 1, 2048]
    - [22, 0.0]
  - - [3840, 4095, 1, 4096]
    - [25, 0.0]
  - - [960, 1023, 1, 1024]
    - [24, 0.0]
  - - [2880, 3072, 1, 3071]
    - [24, 0.0]
  - - [64, 1025, 1, 1024]
    - [27, 0.0]
  - - [2048, 511, 1, 2048]
    - [23, 0.0]
  - - [4096, 513, 1, 4096]
    - [22, 0.0]
  - - [4097, 512, 1, 4096]
    - [22, 0.0]
  - - [8192, 512, 1, 8191]
    - [24, 0.0]
  - - [1921, 2048, 1, 2048]
    - [22, 0.0]
  - - [2048, 2049, 1, 2048]
    - [22, 0.0]
  - - [2048, 512, 1, 2047]
    - [23, 0.0]
  - - [3071, 3072, 1, 3072]
    - [22, 0.0]
  - - [3840, 4097, 1, 4096]
    - [22, 0.0]
  - - [4096, 511, 1, 4096]
    - [22, 0.0]
  - - [64, 1024, 1, 1025]
    - [27, 0.0]
  - - [2047, 512, 1, 2048]
    - [23, 0.0]
  - - [63, 1024, 1, 1024]
    - [27, 0.0]
  - - [3072, 513, 1, 3072]
    - [22, 0.0]
  - - [512, 4095, 1, 4096]
    - [22, 0.0]
  - - [512, 1024, 1, 1025]
    - [22, 0.0]
  - - [3071, 512, 1, 3072]
    - [22, 0.0]
  - - [3840, 4096, 1, 4097]
    - [25, 0.0]
  - - [512, 511, 1, 512]
    - [27, 0.0]
  - - [4097, 4096, 1, 4096]
    - [22, 0.0]
  - - [2048, 2048, 1, 2047]
    - [22, 0.0]
  - - [3839, 4096, 1, 4096]
    - [25, 0.0]
  - - [512, 4096, 1, 4097]
    - [22, 0.0]
  - - [3072, 3073, 1, 3072]
    - [22, 0.0]
  - - [512, 2047, 1, 2048]
    - [23, 0.0]
  - - [2048, 2048, 1, 2049]
    - [22, 0.0]
  - - [8191, 8192, 1, 8192]
    - [25, 0.0]
  - - [64, 1023, 1, 1024]
    - [27, 0.0]
  - - [4096, 512, 1, 4097]
    - [22, 0.0]
  - - [3840, 4096, 1, 4095]
    - [25, 0.0]
  - - [65, 1024, 1, 1024]
    - [28, 0.0]
  - - [1920, 2047, 1, 2048]
    - [26, 0.0]
  - - [512, 513, 1, 512]
    - [27, 0.0]
  - - [8192, 8192, 1, 8191]
    - [25, 0.0]
  - - [1024, 1024, 1, 1023]
    - [23, 0.0]
  - - [512, 4097, 1, 4096]
    - [22, 0.0]
  - - [511, 512, 1, 512]
    - [27, 0.0]
  - - [4096, 512, 1, 4095]
    - [24, 0.0]
  - - [8193, 512, 1, 8192]
    - [22, 0.0]
  - - [961, 1024, 1, 1024]
    - [23, 0.0]
  - - [512, 1024, 1, 1023]
    - [22, 0.0]
  - - [4095, 4096, 1, 4096]
    - [22, 0.0]
  - - [64, 1024, 1, 1023]
    - [27, 0.0]
  - - [2048, 512, 1, 2049]
    - [23, 0.0]
  - - [1023, 1024, 1, 1024]
    - [23, 0.0]
  - - [1920, 2048, 1, 2049]
    - [26, 0.0]
  - - [512, 512, 1, 512]
    - [35, 0.0]
  - - [512, 1024, 1, 1024]
    - [35, 0.0]
  - - [512, 2048, 1, 2048]
    - [35, 0.0]
  - - [512, 3072, 1, 3072]
    - [35, 0.0]
  - - [512, 4096, 1, 4096]
    - [35, 0.0]
  - - [512, 8192, 1, 8192]
    - [35, 0.0]
  - - [960, 1024, 1, 1024]
    - [35, 0.0]
  - - [1024, 1024, 1, 1024]
    - [35, 0.0]
  - - [1920, 2048, 1, 2048]
    - [35, 0.0]
  - - [2048, 2048, 1, 2048]
    - [35, 0.0]
  - - [2880, 3072, 1, 3072]
    - [35, 0.0]
  - - [3072, 512, 1, 3072]
    - [35, 0.0]
  - - [3072, 3072, 1, 3072]
    - [35, 0.0]
  - - [3840, 4096, 1, 4096]
    - [35, 0.0]
  - - [4096, 512, 1, 4096]
    - [35, 0.0]
  - - [4096, 4096, 1, 4096]
    - [35, 0.0]
  - - [7680, 8192, 1, 8192]
    - [35, 0.0]
  - - [8192, 512, 1, 8192]
    - [35, 0.0]
  - - [8192, 8192, 1, 8192]
    - [35, 0.0]
  - - [479, 512, 1, 512]
    - [38, 0.0]
  - - [479, 1024, 1, 1024]
    - [37, 0.0]
  - - [479, 2048, 1, 2048]
    - [37, 0.0]
  - - [480, 511, 1, 512]
    - [38, 0.0]
  - - [480, 512, 1, 511]
    - [38, 0.0]
  - - [480, 512, 1, 513]
    - [38, 0.0]
  - - [480, 513, 1, 512]
    - [38, 0.0]
  - - [480, 1023, 1, 1024]
    - [37, 0.0]
  - - [480, 1024, 1, 1023]
    - [37, 0.0]
  - - [480, 1024, 1, 1025]
    - [37, 0.0]
  - - [480, 1025, 1, 1024]
    - [36, 0.0]
  - - [480, 2047, 1, 2048]
    - [37, 0.0]
  - - [480, 2048, 1, 2047]
    - [37, 0.0]
  - - [480, 2048, 1, 2049]
    - [37, 0.0]
  - - [480, 2049, 1, 2048]
    - [37, 0.0]
  - - [481, 512, 1, 512]
    - [38, 0.0]
  - - [481, 1024, 1, 1024]
    - [36, 0.0]
  - - [481, 2048, 1, 2048]
    - [37, 0.0]
  - - [511, 480, 1, 512]
    - [38, 0.0]
  - - [512, 479, 1, 512]
    - [38, 0.0]
  - - [512, 480, 1, 511]
    - [38, 0.0]
  - - [512, 480, 1, 513]
    - [38, 0.0]
  - - [512, 481, 1, 512]
    - [38, 0.0]
  - - [513, 480, 1, 512]
    - [38, 0.0]
  - - [1023, 480, 1, 1024]
    - [38, 0.0]
  - - [1024, 479, 1, 1024]
    - [38, 0.0]
  - - [1024, 480, 1, 1023]
    - [38, 0.0]
  - - [1024, 480, 1, 1025]
    - [38, 0.0]
  - - [1024, 481, 1, 1024]
    - [36, 0.0]
  - - [1025, 480, 1, 1024]
    - [36, 0.0]
  - - [2047, 480, 1, 2048]
    - [39, 0.0]
  - - [2048, 479, 1, 2048]
    - [39, 0.0]
  - - [2048, 480, 1, 2047]
    - [39, 0.0]
  - - [2048, 480, 1, 2049]
    - [39, 0.0]
  - - [2048, 481, 1, 2048]
    - [37, 0.0]
  - - [2049, 480, 1, 2048]
    - [37, 0.0]
  - - [480, 512, 1, 512]
    - [40, 0.0]
  - - [480, 1024, 1, 1024]
    - [40, 0.0]
  - - [480, 2048, 1, 2048]
    - [40, 0.0]
  - - [512, 480, 1, 512]
    - [41, 0.0]
  - - [1024, 480, 1, 1024]
    - [41, 0.0]
  - - [2048, 480, 1, 2048]
    - [41, 0.0]
  - - [480, 3072, 1, 3072]
    - [42, 0.0]
  - - [480, 4096, 1, 4096]
    - [44, 0.0]
  - - [480, 8192, 1, 8192]
    - [43, 0.0]
  - - [3072, 480, 1, 3072]
    - [45, 0.0]
  - - [4096, 480, 1, 4096]
    - [45, 0.0]
  - - [8192, 480, 1, 8192]
    - [46, 0.0]
  - - [17, 17, 1, 64]
    - [57, 0.0]
  - - [24, 24, 1, 64]
    - [75, 0.0]
  - - [30, 31, 1, 64]
    - [75, 0.0]
  - - [32, 32, 1, 64]
    - [65, 0.0]
  - - [32, 35, 1, 64]
    - [80, 0.0]
  - - [31, 31, 1, 64]
    - [68, 0.0]
  - - [34, 34, 1, 64]
    - [63, 0.0]
  - - [30, 30, 1, 64]
    - [61, 0.0]
  - - [17, 15, 1, 64]
    - [86, 0.0]
  - - [35, 35, 1, 64]
    - [75, 0.0]
  - - [21, 17, 1, 64]
    - [61, 0.0]
  - - [21, 21, 1, 64]
    - [57, 0.0]
  - - [15, 14, 1, 64]
    - [57, 0.0]
  - - [14, 14, 1, 64]
    - [55, 0.0]
  - - [15, 15, 1, 64]
    - [57, 0.0]
  - - [34, 24, 1, 64]
    - [49, 0.0]
  - - [511, 4096, 1, 4096]
    - [111, 0.0]
  - - [512, 3071, 1, 3072]
    - [111, 0.0]
  - - [2880, 3073, 1, 3072]
    - [111, 0.0]
  - - [511, 3072, 1, 3072]
    - [111, 0.0]
  - - [1024, 512, 1, 1025]
    - [111, 0.0]
  - - [511, 2048, 1, 2048]
    - [112, 0.0]
  - - [8192, 8193, 1, 8192]
    - [114, 0.0]
  - - [3072, 3072, 1, 3071]
    - [111, 0.0]
  - - [8192, 8192, 1, 8193]
    - [114, 0.0]
  - - [513, 1024, 1, 1024]
    - [111, 0.0]
  - - [512, 1023, 1, 1024]
    - [111, 0.0]
  - - [512, 2048, 1, 2047]
    - [112, 0.0]
  - - [7680, 8192, 1, 8193]
    - [114, 0.0]
  - - [513, 4096, 1, 4096]
    - [111, 0.0]
  - - [3073, 512, 1, 3072]
    - [111, 0.0]
  - - [4096, 4096, 1, 4097]
    - [111, 0.0]
  - - [1025, 1024, 1, 1024]
    - [112, 0.0]
  - - [8192, 8191, 1, 8192]
    - [114, 0.0]
  - - [8192, 512, 1, 8193]
    - [111, 0.0]
  - - [7681, 8192, 1, 8192]
    - [114, 0.0]
  - - [2880, 3071, 1, 3072]
    - [113, 0.0]
  - - [512, 1025, 1, 1024]
    - [111, 0.0]
  - - [2048, 513, 1, 2048]
    - [112, 0.0]
  - - [1024, 1024, 1, 1025]
    - [112, 0.0]
  - - [960, 1024, 1, 1023]
    - [113, 0.0]
  - - [3072, 512, 1, 3071]
    - [111, 0.0]
  - - [960, 1025, 1, 1024]
    - [112, 0.0]
  - - [3072, 3071, 1, 3072]
    - [111, 0.0]
  - - [512, 2048, 1, 2049]
    - [112, 0.0]
  - - [3072, 511, 1, 3072]
    - [111, 0.0]
  - - [2049, 512, 1, 2048]
    - [112, 0.0]
  - - [512, 8191, 1, 8192]
    - [111, 0.0]
  - - [513, 3072, 1, 3072]
    - [111, 0.0]
  - - [4096, 4095, 1, 4096]
    - [111, 0.0]
  - - [511, 1024, 1, 1024]
    - [111, 0.0]
  - - [513, 512, 1, 512]
    - [116, 0.0]
  - - [1024, 511, 1, 1024]
    - [111, 0.0]
  - - [3072, 3072, 1, 3073]
    - [111, 0.0]
  - - [960, 1024, 1, 1025]
    - [113, 0.0]
  - - [959, 1024, 1, 1024]
    - [112, 0.0]
  - - [7680, 8193, 1, 8192]
    - [114, 0.0]
  - - [512, 3072, 1, 3073]
    - [111, 0.0]
  - - [1023, 512, 1, 1024]
    - [111, 0.0]
  - - [3072, 512, 1, 3073]
    - [111, 0.0]
  - - [512, 2049, 1, 2048]
    - [112, 0.0]
  - - [513, 8192, 1, 8192]
    - [113, 0.0]
  - - [7679, 8192, 1, 8192]
    - [114, 0.0]
  - - [1024, 513, 1, 1024]
    - [111, 0.0]
  - - [8192, 511, 1, 8192]
    - [111, 0.0]
  - - [4096, 4097, 1, 4096]
    - [111, 0.0]
  - - [512, 3072, 1, 3071]
    - [111, 0.0]
  - - [7680, 8192, 1, 8191]
    - [115, 0.0]
  - - [2048, 2047, 1, 2048]
    - [111, 0.0]
  - - [8193, 8192, 1, 8192]
    - [114, 0.0]
  - - [512, 4096, 1, 4095]
    - [112, 0.0]
  - - [1024, 1023, 1, 1024]
    - [112, 0.0]
  - - [3073, 3072, 1, 3072]
    - [111, 0.0]
  - - [512, 3073, 1, 3072]
    - [111, 0.0]
  - - [4096, 4096, 1, 4095]
    - [114, 0.0]
  - - [1920, 2048, 1, 2047]
    - [115, 0.0]
  - - [1920, 2049, 1, 2048]
    - [111, 0.0]
  - - [512, 8192, 1, 8191]
    - [113, 0.0]
  - - [8191, 512, 1, 8192]
    - [111, 0.0]
  - - [1025, 512, 1, 1024]
    - [111, 0.0]
  - - [2881, 3072, 1, 3072]
    - [111, 0.0]
  - - [64, 1024, 1, 1024]
    - [120, 0.0]
  - - [1024, 512, 1, 1023]
    - [111, 0.0]
  - - [513, 2048, 1, 2048]
    - [112, 0.0]
  - - [3841, 4096, 1, 4096]
    - [111, 0.0]
  - - [2880, 3072, 1, 3073]
    - [113, 0.0]
  - - [512, 512, 1, 513]
    - [116, 0.0]
  - - [4095, 512, 1, 4096]
    - [111, 0.0]
  - - [1919, 2048, 1, 2048]
    - [115, 0.0]
  - - [1024, 1025, 1, 1024]
    - [112, 0.0]
  - - [2879, 3072, 1, 3072]
    - [113, 0.0]
  - - [512, 8192, 1, 8193]
    - [111, 0.0]
  - - [511, 8192, 1, 8192]
    - [111, 0.0]
  - - [8192, 513, 1, 8192]
    - [111, 0.0]
  - - [512, 8193, 1, 8192]
    - [111, 0.0]
  - - [7680, 8191, 1, 8192]
    - [114, 0.0]
  - - [512, 512, 1, 511]
    - [116, 0.0]
  - - [2047, 2048, 1, 2048]
    - [111, 0.0]
  - - [2049, 2048, 1, 2048]
    - [111, 0.0]
  - - [3840, 4095, 1, 4096]
    - [114, 0.0]
  - - [960, 1023, 1, 1024]
    - [113, 0.0]
  - - [2880, 3072, 1, 3071]
    - [113, 0.0]
  - - [64, 1025, 1, 1024]
    - [116, 0.0]
  - - [2048, 511, 1, 2048]
    - [112, 0.0]
  - - [4096, 513, 1, 4096]
    - [111, 0.0]
  - - [4097, 512, 1, 4096]
    - [111, 0.0]
  - - [8192, 512, 1, 8191]
    - [113, 0.0]
  - - [1921, 2048, 1, 2048]
    - [111, 0.0]
  - - [2048, 2049, 1, 2048]
    - [111, 0.0]
  - - [2048, 512, 1, 2047]
    - [112, 0.0]
  - - [3071, 3072, 1, 3072]
    - [111, 0.0]
  - - [3840, 4097, 1, 4096]
    - [111, 0.0]
  - - [4096, 511, 1, 4096]
    - [111, 0.0]
  - - [64, 1024, 1, 1025]
    - [116, 0.0]
  - - [2047, 512, 1, 2048]
    - [112, 0.0]
  - - [63, 1024, 1, 1024]
    - [116, 0.0]
  - - [3072, 513, 1, 3072]
    - [111, 0.0]
  - - [512, 4095, 1, 4096]
    - [111, 0.0]
  - - [512, 1024, 1, 1025]
    - [111, 0.0]
  - - [3071, 512, 1, 3072]
    - [111, 0.0]
  - - [3840, 4096, 1, 4097]
    - [114, 0.0]
  - - [512, 511, 1, 512]
    - [116, 0.0]
  - - [4097, 4096, 1, 4096]
    - [111, 0.0]
  - - [2048, 2048, 1, 2047]
    - [111, 0.0]
  - - [3839, 4096, 1, 4096]
    - [114, 0.0]
  - - [512, 4096, 1, 4097]
    - [111, 0.0]
  - - [3072, 3073, 1, 3072]
    - [111, 0.0]
  - - [512, 2047, 1, 2048]
    - [112, 0.0]
  - - [2048, 2048, 1, 2049]
    - [111, 0.0]
  - - [8191, 8192, 1, 8192]
    - [114, 0.0]
  - - [64, 1023, 1, 1024]
    - [116, 0.0]
  - - [4096, 512, 1, 4097]
    - [111, 0.0]
  - - [3840, 4096, 1, 4095]
    - [114, 0.0]
  - - [65, 1024, 1, 1024]
    - [117, 0.0]
  - - [1920, 2047, 1, 2048]
    - [115, 0.0]
  - - [512, 513, 1, 512]
    - [116, 0.0]
  - - [8192, 8192, 1, 8191]
    - [114, 0.0]
  - - [1024, 1024, 1, 1023]
    - [112, 0.0]
  - - [512, 4097, 1, 4096]
    - [111, 0.0]
  - - [511, 512, 1, 512]
    - [116, 0.0]
  - - [4096, 512, 1, 4095]
    - [113, 0.0]
  - - [8193, 512, 1, 8192]
    - [111, 0.0]
  - - [961, 1024, 1, 1024]
    - [112, 0.0]
  - - [512, 1024, 1, 1023]
    - [111, 0.0]
  - - [4095, 4096, 1, 4096]
    - [111, 0.0]
  - - [64, 1024, 1, 1023]
    - [116, 0.0]
  - - [2048, 512, 1, 2049]
    - [112, 0.0]
  - - [1023, 1024, 1, 1024]
    - [112, 0.0]
  - - [1920, 2048, 1, 2049]
    - [115, 0.0]
  - - [512, 512, 1, 512]
    - [124, 0.0]
  - - [512, 1024, 1, 1024]
    - [124, 0.0]
  - - [512, 2048, 1, 2048]
    - [124, 0.0]
  - - [512, 3072, 1, 3072]
    - [124, 0.0]
  - - [512, 4096, 1, 4096]
    - [124, 0.0]
  - - [512, 8192, 1, 8192]
    - [124, 0.0]
  - - [960, 1024, 1, 1024]
    - [124, 0.0]
  - - [1024, 1024, 1, 1024]
    - [124, 0.0]
  - - [1920, 2048, 1, 2048]
    - [124, 0.0]
  - - [2048, 2048, 1, 2048]
    - [124, 0.0]
  - - [2880, 3072, 1, 3072]
    - [124, 0.0]
  - - [3072, 512, 1, 3072]
    - [124, 0.0]
  - - [3072, 3072, 1, 3072]
    - [124, 0.0]
  - - [3840, 4096, 1, 4096]
    - [124, 0.0]
  - - [4096, 512, 1, 4096]
    - [124, 0.0]
  - - [4096, 4096, 1, 4096]
    - [124, 0.0]
  - - [7680, 8192, 1, 8192]
    - [124, 0.0]
  - - [8192, 512, 1, 8192]
    - [124, 0.0]
  - - [8192, 8192, 1, 8192]
    - [124, 0.0]
  - - [479, 512, 1, 512]
    - [127, 0.0]
  - - [479, 1024, 1, 1024]
    - [126, 0.0]
  - - [479, 2048, 1, 2048]
    - [126, 0.0]
  - - [480, 511, 1, 512]
    - [127, 0.0]
  - - [480, 512, 1, 511]
    - [127, 0.0]
  - - [480, 512, 1, 513]
    - [127, 0.0]
  - - [480, 513, 1, 512]
    - [127, 0.0]
  - - [480, 1023, 1, 1024]
    - [126, 0.0]
  - - [480, 1024, 1, 1023]
    - [126, 0.0]
  - - [480, 1024, 1, 1025]
    - [126, 0.0]
  - - [480, 1025, 1, 1024]
    - [125, 0.0]
  - - [480, 2047, 1, 2048]
    - [126, 0.0]
  - - [480, 2048, 1, 2047]
    - [126, 0.0]
  - - [480, 2048, 1, 2049]
    - [126, 0.0]
  - - [480, 2049, 1, 2048]
    - [126, 0.0]
  - - [481, 512, 1, 512]
    - [127, 0.0]
  - - [481, 1024, 1, 1024]
    - [125, 0.0]
  - - [481, 2048, 1, 2048]
    - [126, 0.0]
  - - [511, 480, 1, 512]
    - [127, 0.0]
  - - [512, 479, 1, 512]
    - [127, 0.0]
  - - [512, 480, 1, 511]
    - [127, 0.0]
  - - [512, 480, 1, 513]
    - [127, 0.0]
  - - [512, 481, 1, 512]
    - [127, 0.0]
  - - [513, 480, 1, 512]
    - [127, 0.0]
  - - [1023, 480, 1, 1024]
    - [127, 0.0]
  - - [1024, 479, 1, 1024]
    - [127, 0.0]
  - - [1024, 480, 1, 1023]
    - [127, 0.0]
  - - [1024, 480, 1, 1025]
    - [127, 0.0]
  - - [1024, 481, 1, 1024]
    - [125, 0.0]
  - - [1025, 480, 1, 1024]
    - [125, 0.0]
  - - [2047, 480, 1, 2048]
    - [128, 0.0]
  - - [2048, 479, 1, 2048]
    - [128, 0.0]
  - - [2048, 480, 1, 2047]
    - [128, 0.0]
  - - [2048, 480, 1, 2049]
    - [128, 0.0]
  - - [2048, 481, 1, 2048]
    - [126, 0.0]
  - - [2049, 480, 1, 2048]
    - [126, 0.0]
  - - [480, 512, 1, 512]
    - [129, 0.0]
  - - [480, 1024, 1, 1024]
    - [129, 0.0]
  - - [480, 2048, 1, 2048]
    - [129, 0.0]
  - - [512, 480, 1, 512]
    - [130, 0.0]
  - - [1024, 480, 1, 1024]
    - [130, 0.0]
  - - [2048, 480, 1, 2048]
    - [130, 0.0]
  - - [480, 3072, 1, 3072]
    - [131, 0.0]
  - - [480, 4096, 1, 4096]
    - [133, 0.0]
  - - [480, 8192, 1, 8192]
    - [132, 0.0]
  - - [3072, 480, 1, 3072]
    - [134, 0.0]
  - - [4096, 480, 1, 4096]
    - [134, 0.0]
  - - [8192, 480, 1, 8192]
    - [135, 0.0]
  - - [17, 17, 1, 64]
    - [146, 0.0]
  - - [24, 24, 1, 64]
    - [164, 0.0]
  - - [30, 31, 1, 64]
    - [164, 0.0]
  - - [32, 32, 1, 64]
    - [154, 0.0]
  - - [32, 35, 1, 64]
    - [169, 0.0]
  - - [31, 31, 1, 64]
    - [157, 0.0]
  - - [34, 34, 1, 64]
    - [152, 0.0]
  - - [30, 30, 1, 64]
    - [150, 0.0]
  - - [17, 15, 1, 64]
    - [175, 0.0]
  - - [35, 35, 1, 64]
    - [164, 0.0]
  - - [21, 17, 1, 64]
    - [150, 0.0]
  - - [21, 21, 1, 64]
    - [146, 0.0]
  - - [15, 14, 1, 64]
    - [146, 0.0]
  - - [14, 14, 1, 64]
    - [144, 0.0]
  - - [15, 15, 1, 64]
    - [146, 0.0]
  - - [34, 24, 1, 64]
    - [138, 0.0]
  - - [2, 4, 1, 1024]
    - [178, 0.001]
  - - [2, 32, 1, 1024]
    - [180, 0.006]
  - - [2, 2048, 1, 1024]
    - [231, 0.371]
  - - [64, 128, 512, 128]
    - [214, 14.437]
  - - [64, 512, 1, 512]
    - [181, 2.275]
  - - [64, 512, 64, 512]
    - [237, 21.154]
  - - [128, 128, 512, 64]
    - [267, 14.396]
  - - [512, 512, 1, 64]
    - [222, 3.079]
  - - [512, 512, 64, 64]
    - [194, 19.067]
  - - [1024, 4, 1, 1024]
    - [223, 0.374]
  - - [1024, 4, 1, 1024]
    - [261, 0.374]
  - - [1024, 32, 1, 1024]
    - [256, 3.079]
  - - [1024, 2048, 1, 1024]
    - [288, 30.496]
  - - [1024, 2048, 1, 4096]
    - [302, 32.467]
  - - [1024, 4096, 1, 1024]
    - [233, 36.909]
  - - [1024, 4096, 1, 4096]
    - [293, 38.778]
  - - [4096, 2048, 1, 1024]
    - [270, 42.154]
  - - [4096, 4096, 1, 1024]
    - [292, 43.207]
  - - [30528, 2048, 1, 1024]
    - [292, 45.458]
  - - [30528, 4096, 1, 1024]
    - [292, 45.899]
  - - [3, 3, 512, 64]
    - [282, 0.042]
  - - [5, 5, 512, 64]
    - [179, 0.115]
  - - [5, 5, 960, 64]
    - [187, 0.167]
  - - [9, 9, 512, 64]
    - [228, 0.377]
  - - [27, 27, 32768, 128]
    - [184, 7.92]
  - - [32, 1600, 1, 512]
    - [188, 3.608]
  - - [33, 33, 1600, 32]
    - [191, 1.999]
  - - [64, 512, 1, 1024]
    - [188, 3.14]
  - - [64, 960, 1, 1024]
    - [213, 5.402]
  - - [128, 32768, 1, 256]
    - [252, 26.724]
  - - [256, 684, 1, 1024]
    - [237, 11.04]
  - - [256, 1280, 1, 1024]
    - [250, 17.943]
  - - [256, 1536, 1, 1024]
    - [241, 19.832]
  - - [256, 2304, 1, 1024]
    - [284, 21.249]
  - - [256, 2560, 1, 1024]
    - [253, 23.522]
  - - [256, 2816, 1, 1024]
    - [281, 25.682]
  - - [256, 3328, 1, 1024]
    - [296, 30.239]
  - - [256, 3584, 1, 1024]
    - [278, 31.068]
  - - [256, 4608, 1, 1024]
    - [310, 24.9]
  - - [256, 4864, 1, 1024]
    - [236, 25.174]
  - - [256, 5376, 1, 1024]
    - [186, 27.476]
  - - [256, 5888, 1, 1024]
    - [245, 29.783]
  - - [256, 6144, 1, 1024]
    - [285, 30.886]
  - - [256, 6400, 1, 1024]
    - [193, 32.042]
  - - [256, 6656, 1, 1024]
    - [264, 33.188]
  - - [256, 7168, 1, 1024]
    - [215, 35.382]
  - - [256, 7424, 1, 1024]
    - [280, 36.793]
  - - [256, 7936, 1, 1024]
    - [229, 28.339]
  - - [256, 8192, 1, 1024]
    - [246, 29.296]
  - - [256, 8448, 1, 1024]
    - [279, 30.08]
  - - [256, 8960, 1, 1024]
    - [279, 31.491]
  - - [256, 9984, 1, 1024]
    - [252, 34.208]
  - - [256, 10496, 1, 1024]
    - [219, 35.419]
  - - [256, 11264, 1, 1024]
    - [217, 37.242]
  - - [256, 11520, 1, 1024]
    - [314, 37.582]
  - - [256, 11776, 1, 1024]
    - [210, 32.351]
  - - [256, 12544, 1, 1024]
    - [210, 34.117]
  - - [256, 13312, 1, 1024]
    - [245, 35.769]
  - - [256, 14336, 1, 1024]
    - [245, 37.898]
  - - [256, 14592, 1, 1024]
    - [305, 38.002]
  - - [256, 14848, 1, 1024]
    - [313, 38.383]
  - - [256, 15104, 1, 1024]
    - [314, 38.8]
  - - [256, 16128, 1, 1024]
    - [207, 35.517]
  - - [256, 18176, 1, 1024]
    - [242, 39.012]
  - - [256, 18944, 1, 1024]
    - [252, 39.418]
  - - [256, 19200, 1, 1024]
    - [313, 39.122]
  - - [256, 20480, 1, 1024]
    - [245, 37.919]
  - - [256, 20992, 1, 1024]
    - [245, 38.72]
  - - [256, 21248, 1, 1024]
    - [245, 38.958]
  - - [256, 21504, 1, 1024]
    - [242, 39.399]
  - - [256, 22016, 1, 1024]
    - [242, 39.86]
  - - [256, 22344, 1, 1024]
    - [251, 39.578]
  - - [256, 23296, 1, 1024]
    - [242, 37.451]
  - - [256, 23552, 1, 1024]
    - [242, 37.714]
  - - [256, 31488, 1, 1024]
    - [245, 39.675]
  - - [256, 32768, 1, 512]
    - [311, 37.74]
  - - [256, 33536, 1, 1024]
    - [300, 41.322]
  - - [256, 44505, 1, 1024]
    - [305, 41.388]
  - - [512, 1600, 1, 512]
    - [260, 22.429]
  - - [512, 32768, 1, 13]
    - [211, 3.495]
  - - [512, 32768, 1, 1024]
    - [308, 42.342]
  - - [684, 8976, 1, 256]
    - [243, 29.417]
  - - [1024, 200, 1, 560]
    - [266, 8.518]
  - - [1024, 512, 1, 1024]
    - [232, 19.399]
  - - [1024, 512, 1, 1600]
    - [299, 21.746]
  - - [1024, 960, 1, 1024]
    - [249, 32.824]
  - - [1024, 960, 1, 1600]
    - [269, 36.344]
  - - [1024, 1600, 1, 560]
    - [303, 24.393]
  - - [1024, 1600, 1, 1024]
    - [201, 32.44]
  - - [1024, 32768, 1, 480]
    - [192, 44.098]
  - - [1024, 32768, 1, 1024]
    - [271, 44.248]
  - - [1280, 8976, 1, 256]
    - [212, 34.975]
  - - [1792, 8976, 1, 256]
    - [273, 37.743]
  - - [2048, 114, 1, 512]
    - [283, 10.757]
  - - [2048, 114, 1, 768]
    - [226, 12.617]
  - - [2048, 215, 1, 512]
    - [206, 14.963]
  - - [2048, 215, 1, 768]
    - [287, 18.293]
  - - [2048, 256, 1, 512]
    - [216, 16.001]
  - - [2048, 256, 1, 768]
    - [226, 18.381]
  - - [2048, 512, 1, 67]
    - [277, 5.668]
  - - [2048, 512, 1, 74]
    - [203, 6.154]
  - - [2048, 512, 1, 100]
    - [265, 7.851]
  - - [2048, 512, 1, 2048]
    - [286, 24.689]
  - - [2048, 684, 1, 512]
    - [313, 23.145]
  - - [2048, 684, 1, 768]
    - [182, 27.812]
  - - [2048, 960, 1, 74]
    - [263, 9.725]
  - - [2048, 960, 1, 2048]
    - [248, 39.748]
  - - [2048, 1536, 1, 512]
    - [209, 31.866]
  - - [2048, 1536, 1, 768]
    - [247, 33.897]
  - - [2048, 8976, 1, 256]
    - [190, 36.277]
  - - [2304, 8976, 1, 256]
    - [272, 38.053]
  - - [2560, 8976, 1, 256]
    - [200, 38.256]
  - - [2816, 8976, 1, 256]
    - [238, 38.473]
  - - [3072, 8976, 1, 256]
    - [192, 38.452]
  - - [3328, 8976, 1, 256]
    - [192, 39.15]
  - - [3840, 8976, 1, 256]
    - [190, 38.804]
  - - [4096, 8976, 1, 256]
    - [190, 38.015]
  - - [4352, 8976, 1, 256]
    - [195, 39.892]
  - - [4608, 8976, 1, 256]
    - [190, 39.892]
  - - [4864, 8976, 1, 256]
    - [194, 40.09]
  - - [5120, 8976, 1, 256]
    - [195, 39.505]
  - - [5376, 8976, 1, 256]
    - [192, 39.768]
  - - [5632, 8976, 1, 256]
    - [192, 39.501]
  - - [5888, 8976, 1, 256]
    - [194, 39.273]
  - - [6144, 8976, 1, 256]
    - [192, 38.632]
  - - [6400, 8976, 1, 256]
    - [192, 38.823]
  - - [7168, 8976, 1, 256]
    - [192, 37.835]
  - - [7936, 8976, 1, 256]
    - [212, 38.093]
  - - [8192, 8976, 1, 256]
    - [294, 37.048]
  - - [8448, 8976, 1, 256]
    - [205, 37.934]
  - - [8960, 8976, 1, 256]
    - [205, 38.169]
  - - [9472, 8976, 1, 256]
    - [199, 38.201]
  - - [9728, 8976, 1, 256]
    - [239, 37.788]
  - - [9984, 8976, 1, 256]
    - [205, 38.067]
  - - [10240, 8976, 1, 256]
    - [199, 37.803]
  - - [10496, 8976, 1, 256]
    - [200, 38.056]
  - - [11264, 8976, 1, 256]
    - [272, 38.163]
  - - [11776, 8976, 1, 256]
    - [238, 37.791]
  - - [12544, 8976, 1, 256]
    - [268, 38.17]
  - - [13312, 8976, 1, 256]
    - [204, 38.017]
  - - [13568, 8976, 1, 256]
    - [234, 37.838]
  - - [13824, 8976, 1, 256]
    - [273, 37.84]
  - - [15104, 8976, 1, 256]
    - [292, 38.252]
  - - [15360, 8976, 1, 256]
    - [268, 37.865]
  - - [15872, 8976, 1, 256]
    - [297, 38.174]
  - - [16128, 8976, 1, 256]
    - [295, 38.032]
  - - [17152, 8976, 1, 256]
    - [295, 38.115]
  - - [18176, 8976, 1, 256]
    - [204, 38.114]
  - - [18688, 8976, 1, 256]
    - [205, 38.597]
  - - [18944, 8976, 1, 256]
    - [298, 38.041]
  - - [19712, 8976, 1, 256]
    - [205, 38.299]
  - - [19968, 8976, 1, 256]
    - [239, 38.199]
  - - [20480, 8976, 1, 256]
    - [204, 38.266]
  - - [20992, 8976, 1, 256]
    - [234, 37.838]
  - - [21248, 8976, 1, 256]
    - [200, 37.887]
  - - [23552, 8976, 1, 256]
    - [239, 38.077]
  - - [28672, 8976, 1, 256]
    - [307, 38.112]
  - - [31488, 8976, 1, 256]
    - [204, 38.118]
  - - [33536, 8976, 1, 256]
    - [235, 38.229]
  - - [44505, 8976, 1, 256]
    - [306, 37.325]
  - - [14, 14, 10880, 64]
    - [254, 2.34]
  - - [15, 14, 10880, 64]
    - [179, 2.479]
  - - [15, 15, 7680, 64]
    - [179, 2.519]
  - - [15, 15, 10880, 64]
    - [179, 2.647]
  - - [17, 15, 7680, 64]
    - [179, 2.799]
  - - [17, 17, 7680, 64]
    - [179, 3.15]
  - - [21, 17, 6144, 64]
    - [255, 3.317]
  - - [21, 21, 6144, 64]
    - [274, 3.818]
  - - [24, 24, 4736, 64]
    - [230, 4.136]
  - - [30, 30, 2048, 64]
    - [185, 4.524]
  - - [30, 31, 2048, 64]
    - [259, 4.619]
  - - [31, 31, 2048, 64]
    - [227, 4.623]
  - - [32, 32, 4608, 64]
    - [240, 6.65]
  - - [32, 35, 4608, 64]
    - [276, 6.061]
  - - [34, 24, 4736, 64]
    - [198, 4.592]
  - - [34, 34, 4736, 64]
    - [224, 4.029]
  - - [35, 35, 4608, 64]
    - [189, 4.044]
  - - [1024, 3840, 1, 1024]
    - [289, 40.606]
  - - [1024, 3840, 1, 4096]
    - [202, 46.136]
  - - [1024, 3968, 1, 1024]
    - [270, 35.756]
  - - [1024, 3968, 1, 4096]
    - [244, 37.923]
  - - [1024, 6528, 1, 1024]
    - [270, 41.732]
  - - [1024, 6528, 1, 4096]
    - [275, 42.749]
  - - [1024, 7104, 1, 1024]
    - [257, 40.46]
  - - [1024, 7104, 1, 4096]
    - [218, 42.663]
  - - [1024, 7200, 1, 1024]
    - [291, 40.675]
  - - [1024, 7200, 1, 4096]
    - [220, 43.087]
  - - [1024, 8064, 1, 1024]
    - [292, 41.214]
  - - [1024, 8064, 1, 4096]
    - [242, 42.983]
  - - [1024, 8160, 1, 1024]
    - [257, 41.19]
  - - [1024, 8160, 1, 4096]
    - [300, 43.207]
  - - [1024, 9216, 1, 1024]
    - [258, 42.22]
  - - [1024, 9216, 1, 4096]
    - [301, 44.61]
  - - [1024, 9520, 1, 1024]
    - [291, 41.911]
  - - [1024, 9520, 1, 4096]
    - [208, 45.587]
  - - [1024, 10064, 1, 1024]
    - [192, 41.9]
  - - [1024, 10064, 1, 4096]
    - [242, 43.683]
  - - [1024, 10080, 1, 1024]
    - [292, 41.913]
  - - [1024, 10080, 1, 4096]
    - [207, 43.792]
  - - [1024, 10200, 1, 1024]
    - [270, 42.268]
  - - [1024, 10200, 1, 4096]
    - [242, 43.339]
  - - [4096, 3840, 1, 1024]
    - [270, 42.893]
  - - [4096, 3968, 1, 1024]
    - [291, 43.763]
  - - [4096, 6528, 1, 1024]
    - [271, 44.431]
  - - [4096, 7104, 1, 1024]
    - [304, 43.809]
  - - [4096, 7200, 1, 1024]
    - [292, 44.117]
  - - [4096, 8064, 1, 1024]
    - [270, 44.575]
  - - [4096, 8160, 1, 1024]
    - [292, 44.393]
  - - [4096, 9216, 1, 1024]
    - [292, 44.809]
  - - [4096, 9520, 1, 1024]
    - [271, 44.475]
  - - [4096, 10064, 1, 1024]
    - [291, 44.692]
  - - [4096, 10080, 1, 1024]
    - [270, 44.727]
  - - [4096, 10200, 1, 1024]
    - [271, 44.445]
  - - [42720, 3968, 1, 1024]
    - [291, 45.959]
  - - [42720, 6528, 1, 1024]
    - [292, 46.123]
  - - [42720, 7104, 1, 1024]
    - [291, 45.616]
  - - [42720, 7200, 1, 1024]
    - [291, 45.565]
  - - [42720, 9520, 1, 1024]
    - [291, 45.804]
  - - [42720, 10080, 1, 1024]
    - [292, 45.986]
  - - [27, 27, 1920, 64]
    - [196, 4.213]
  - - [27, 33, 1920, 64]
    - [183, 4.595]
  - - [33, 33, 1920, 64]
    - [224, 3.385]
  - - [27, 27, 1920, 64]
    - [221, 4.299]
  - - [27, 33, 1920, 64]
    - [225, 4.637]
  - - [33, 33, 1920, 64]
    - [262, 3.488]
  - - [1024, 3240, 1, 1024]
    - [309, 35.327]
  - - [1024, 3240, 1, 4096]
    - [197, 38.283]
  - - [1024, 3960, 1, 1024]
    - [238, 35.104]
  - - [1024, 3960, 1, 4096]
    - [290, 37.527]
  - - [4096, 3240, 1, 1024]
    - [312, 42.293]
  - - [4096, 3960, 1, 1024]
    - [271, 43.442]
  - - [42720, 3960, 1, 1024]
    - [291, 45.756]
- null
