library/src/blas3/Tensile/Logic/asm_full/arcturus_Cijk_Alik_Bljk_ZB_GB.yaml
- {MinimumRequiredVersion: 4.26.0}
- arcturus
- gfx908
- [Device 7380, Device 7388, Device 738c, Device 7390]
    SolutionIndex: 0
    SolutionNameMin: Cijk_Alik_Bljk_ZB_GB_MT32x128x8_SN_PLR1_SU0_SUM0_SUS256_SNLL1_TT4_4_WG8_32_1_WGM1
    SolutionIndex: 1
    SolutionNameMin: Cijk_Alik_Bljk_ZB_GB_MT64x64x8_SN_PLR1_SU0_SUM0_SUS256_SNLL1_TT4_4_WG16_16_1_WGM1
    SolutionIndex: 2
    SolutionNameMin: Cijk_Alik_Bljk_ZB_GB_MT64x64x8_SN_PLR0_SU0_SUM0_SUS256_SNLL1_TT4_4_WG16_16_1_WGM1
    SolutionIndex: 3
    SolutionNameMin: Cijk_Alik_Bljk_ZB_GB_MT128x32x8_SN_PLR1_SU0_SUM0_SUS256_SNLL1_TT4_4_WG32_8_1_WGM1
    SolutionIndex: 4
    SolutionNameMin: Cijk_Alik_Bljk_ZB_GB_MT64x64x16_SN_PLR1_SU0_SUM0_SUS256_SNLL1_TT4_4_WG16_16_1_WGM1
    SolutionIndex: 5
    SolutionNameMin: Cijk_Alik_Bljk_ZB_GB_MT32x128x8_SN_PLR1_SU32_SUM0_SUS128_SNLL1_TT4_4_WG8_32_1_WGM1
    SolutionIndex: 6
    SolutionNameMin: Cijk_Alik_Bljk_ZB_GB_MT64x64x8_SN_PLR1_SU32_SUM0_SUS128_SNLL1_TT4_4_WG16_16_1_WGM1
    SolutionIndex: 7
    SolutionNameMin: Cijk_Alik_Bljk_ZB_GB_MT64x64x8_SN_PLR0_SU32_SUM0_SUS128_SNLL1_TT4_4_WG16_16_1_WGM1
    SolutionIndex: 8
    SolutionNameMin: Cijk_Alik_Bljk_ZB_GB_MT64x64x8_SN_PLR1_SU32_SUM3_SUS128_SNLL1_TT4_4_WG16_16_1_WGM1
    SolutionIndex: 9
    SolutionNameMin: Cijk_Alik_Bljk_ZB_GB_MT64x64x8_SN_PLR0_SU32_SUM3_SUS128_SNLL1_TT4_4_WG16_16_1_WGM1
    SolutionIndex: 10
    SolutionNameMin: Cijk_Alik_Bljk_ZB_GB_MT128x32x8_SN_PLR1_SU32_SUM3_SUS128_SNLL1_TT4_4_WG32_8_1_WGM1
    SolutionIndex: 11
    SolutionNameMin: Cijk_Alik_Bljk_ZB_GB_MT64x64x8_SN_PLR1_SU32_SUM0_SUS256_SNLL1_TT4_4_WG16_16_1_WGM1
    SolutionIndex: 12
    SolutionNameMin: Cijk_Alik_Bljk_ZB_GB_MT64x64x8_SN_PLR0_SU32_SUM0_SUS256_SNLL1_TT4_4_WG16_16_1_WGM1
    SolutionIndex: 13
    SolutionNameMin: Cijk_Alik_Bljk_ZB_GB_MT64x64x8_SN_PLR1_SU32_SUM3_SUS256_SNLL1_TT4_4_WG16_16_1_WGM1
    SolutionIndex: 14
    SolutionNameMin: Cijk_Alik_Bljk_ZB_GB_MT64x64x8_SN_PLR0_SU32_SUM3_SUS256_SNLL1_TT4_4_WG16_16_1_WGM1
    SolutionIndex: 15
    SolutionNameMin: Cijk_Alik_Bljk_ZB_GB_MT128x32x8_SN_PLR1_SU32_SUM3_SUS256_SNLL1_TT4_4_WG32_8_1_WGM1
    SolutionIndex: 16
    SolutionNameMin: Cijk_Alik_Bljk_ZB_GB_MT64x64x16_SN_PLR1_SU32_SUM3_SUS256_SNLL1_TT4_4_WG16_16_1_WGM1
    SolutionIndex: 17
    SolutionNameMin: Cijk_Alik_Bljk_ZB_GB_MT32x128x8_SN_PLR1_SU0_SUM0_SUS256_SNLL1_TT4_4_WG8_32_1_WGM8
    SolutionIndex: 18
    SolutionNameMin: Cijk_Alik_Bljk_ZB_GB_MT64x64x8_SN_PLR1_SU0_SUM0_SUS256_SNLL1_TT4_4_WG16_16_1_WGM8
    SolutionIndex: 19
    SolutionNameMin: Cijk_Alik_Bljk_ZB_GB_MT64x64x8_SN_PLR0_SU0_SUM0_SUS256_SNLL1_TT4_4_WG16_16_1_WGM8
    SolutionIndex: 20
    SolutionNameMin: Cijk_Alik_Bljk_ZB_GB_MT128x32x8_SN_PLR1_SU0_SUM0_SUS256_SNLL1_TT4_4_WG32_8_1_WGM8
    SolutionIndex: 21
    SolutionNameMin: Cijk_Alik_Bljk_ZB_GB_MT64x64x16_SN_PLR1_SU0_SUM0_SUS256_SNLL1_TT4_4_WG16_16_1_WGM8
    SolutionIndex: 22
    SolutionNameMin: Cijk_Alik_Bljk_ZB_GB_MT32x128x8_SN_PLR1_SU32_SUM0_SUS128_SNLL1_TT4_4_WG8_32_1_WGM8
    SolutionIndex: 23
    SolutionNameMin: Cijk_Alik_Bljk_ZB_GB_MT64x64x8_SN_PLR1_SU32_SUM0_SUS128_SNLL1_TT4_4_WG16_16_1_WGM8
    SolutionIndex: 24
    SolutionNameMin: Cijk_Alik_Bljk_ZB_GB_MT64x64x8_SN_PLR0_SU32_SUM0_SUS128_SNLL1_TT4_4_WG16_16_1_WGM8
    SolutionIndex: 25
    SolutionNameMin: Cijk_Alik_Bljk_ZB_GB_MT32x128x8_SN_PLR1_SU32_SUM3_SUS128_SNLL1_TT4_4_WG8_32_1_WGM8
    SolutionIndex: 26
    SolutionNameMin: Cijk_Alik_Bljk_ZB_GB_MT64x64x8_SN_PLR1_SU32_SUM3_SUS128_SNLL1_TT4_4_WG16_16_1_WGM8
    SolutionIndex: 27
    SolutionNameMin: Cijk_Alik_Bljk_ZB_GB_MT64x64x8_SN_PLR0_SU32_SUM3_SUS128_SNLL1_TT4_4_WG16_16_1_WGM8
    SolutionIndex: 28
    SolutionNameMin: Cijk_Alik_Bljk_ZB_GB_MT128x32x8_SN_PLR1_SU32_SUM3_SUS128_SNLL1_TT4_4_WG32_8_1_WGM8
    SolutionIndex: 29
    SolutionNameMin: Cijk_Alik_Bljk_ZB_GB_MT64x64x8_SN_PLR0_SU32_SUM0_SUS256_SNLL1_TT4_4_WG16_16_1_WGM8
    SolutionIndex: 30
    SolutionNameMin: Cijk_Alik_Bljk_ZB_GB_MT64x64x8_SN_PLR1_SU32_SUM3_SUS256_SNLL1_TT4_4_WG16_16_1_WGM8
    SolutionIndex: 31
    SolutionNameMin: Cijk_Alik_Bljk_ZB_GB_MT64x64x8_SN_PLR0_SU32_SUM3_SUS256_SNLL1_TT4_4_WG16_16_1_WGM8
    SolutionIndex: 32
    SolutionNameMin: Cijk_Alik_Bljk_ZB_GB_MT128x32x8_SN_PLR1_SU32_SUM3_SUS256_SNLL1_TT4_4_WG32_8_1_WGM8
    SolutionIndex: 33
    SolutionNameMin: Cijk_Alik_Bljk_ZB_GB_MT64x64x16_SN_PLR1_SU32_SUM3_SUS256_SNLL1_TT4_4_WG16_16_1_WGM8
    SolutionIndex: 34
    SolutionNameMin: Cijk_Alik_Bljk_ZB_GB_MT32x128x8_SN_PLR1_SU0_SUM0_SUS256_SNLL1_TT4_4_WG8_32_1_WGM15
    SolutionIndex: 35
    SolutionNameMin: Cijk_Alik_Bljk_ZB_GB_MT64x64x8_SN_PLR1_SU0_SUM0_SUS256_SNLL1_TT4_4_WG16_16_1_WGM15
    SolutionIndex: 36
    SolutionNameMin: Cijk_Alik_Bljk_ZB_GB_MT64x64x8_SN_PLR0_SU0_SUM0_SUS256_SNLL1_TT4_4_WG16_16_1_WGM15
    SolutionIndex: 37
    SolutionNameMin: Cijk_Alik_Bljk_ZB_GB_MT64x64x16_SN_PLR1_SU0_SUM0_SUS256_SNLL1_TT4_4_WG16_16_1_WGM15
    SolutionIndex: 38
    SolutionNameMin: Cijk_Alik_Bljk_ZB_GB_MT64x64x8_SN_PLR1_SU32_SUM0_SUS128_SNLL1_TT4_4_WG16_16_1_WGM15
    SolutionIndex: 39
    SolutionNameMin: Cijk_Alik_Bljk_ZB_GB_MT64x64x8_SN_PLR0_SU32_SUM0_SUS128_SNLL1_TT4_4_WG16_16_1_WGM15
    SolutionIndex: 40
    SolutionNameMin: Cijk_Alik_Bljk_ZB_GB_MT64x64x8_SN_PLR1_SU32_SUM3_SUS128_SNLL1_TT4_4_WG16_16_1_WGM15
    SolutionIndex: 41
    SolutionNameMin: Cijk_Alik_Bljk_ZB_GB_MT64x64x8_SN_PLR0_SU32_SUM3_SUS128_SNLL1_TT4_4_WG16_16_1_WGM15
    SolutionIndex: 42
    SolutionNameMin: Cijk_Alik_Bljk_ZB_GB_MT128x32x8_SN_PLR1_SU32_SUM3_SUS128_SNLL1_TT4_4_WG32_8_1_WGM15
    SolutionIndex: 43
    SolutionNameMin: Cijk_Alik_Bljk_ZB_GB_MT64x64x8_SN_PLR0_SU32_SUM0_SUS256_SNLL1_TT4_4_WG16_16_1_WGM15
    SolutionIndex: 44
    SolutionNameMin: Cijk_Alik_Bljk_ZB_GB_MT128x32x8_SN_PLR1_SU32_SUM0_SUS256_SNLL1_TT4_4_WG32_8_1_WGM15
    SolutionIndex: 45
    SolutionNameMin: Cijk_Alik_Bljk_ZB_GB_MT64x64x8_SN_PLR0_SU32_SUM3_SUS256_SNLL1_TT4_4_WG16_16_1_WGM15
    SolutionIndex: 46
    SolutionNameMin: Cijk_Alik_Bljk_ZB_GB_MT128x32x8_SN_PLR1_SU32_SUM3_SUS256_SNLL1_TT4_4_WG32_8_1_WGM15
    SolutionIndex: 47
    SolutionNameMin: Cijk_Alik_Bljk_ZB_GB_MT32x128x8_SN_PLR1_SU0_SUM0_SUS256_SNLL0_TT4_4_WG8_32_1_WGM1
    SolutionIndex: 48
    SolutionNameMin: Cijk_Alik_Bljk_ZB_GB_MT64x64x8_SN_PLR1_SU0_SUM0_SUS256_SNLL0_TT4_4_WG16_16_1_WGM1
    SolutionIndex: 49
    SolutionNameMin: Cijk_Alik_Bljk_ZB_GB_MT64x64x8_SN_PLR0_SU0_SUM0_SUS256_SNLL0_TT4_4_WG16_16_1_WGM1
    SolutionIndex: 50
    SolutionNameMin: Cijk_Alik_Bljk_ZB_GB_MT128x32x8_SN_PLR1_SU0_SUM0_SUS256_SNLL0_TT4_4_WG32_8_1_WGM1
    SolutionIndex: 51
    SolutionNameMin: Cijk_Alik_Bljk_ZB_GB_MT64x64x8_SN_PLR0_SU32_SUM0_SUS128_SNLL0_TT4_4_WG16_16_1_WGM1
    SolutionIndex: 52
    SolutionNameMin: Cijk_Alik_Bljk_ZB_GB_MT32x128x8_SN_PLR1_SU32_SUM3_SUS128_SNLL0_TT4_4_WG8_32_1_WGM1
    SolutionIndex: 53
    SolutionNameMin: Cijk_Alik_Bljk_ZB_GB_MT64x64x8_SN_PLR0_SU32_SUM3_SUS128_SNLL0_TT4_4_WG16_16_1_WGM1
    SolutionIndex: 54
    SolutionNameMin: Cijk_Alik_Bljk_ZB_GB_MT128x32x8_SN_PLR1_SU32_SUM3_SUS128_SNLL0_TT4_4_WG32_8_1_WGM1
    SolutionIndex: 55
    SolutionNameMin: Cijk_Alik_Bljk_ZB_GB_MT64x64x8_SN_PLR0_SU32_SUM0_SUS256_SNLL0_TT4_4_WG16_16_1_WGM1
    SolutionIndex: 56
    SolutionNameMin: Cijk_Alik_Bljk_ZB_GB_MT32x128x8_SN_PLR1_SU32_SUM3_SUS256_SNLL0_TT4_4_WG8_32_1_WGM1
    SolutionIndex: 57
    SolutionNameMin: Cijk_Alik_Bljk_ZB_GB_MT64x64x8_SN_PLR0_SU32_SUM3_SUS256_SNLL0_TT4_4_WG16_16_1_WGM1
    SolutionIndex: 58
    SolutionNameMin: Cijk_Alik_Bljk_ZB_GB_MT32x128x8_SN_PLR1_SU0_SUM0_SUS256_SNLL0_TT4_4_WG8_32_1_WGM8
    SolutionIndex: 59
    SolutionNameMin: Cijk_Alik_Bljk_ZB_GB_MT64x64x8_SN_PLR1_SU0_SUM0_SUS256_SNLL0_TT4_4_WG16_16_1_WGM8
    SolutionIndex: 60
    SolutionNameMin: Cijk_Alik_Bljk_ZB_GB_MT64x64x8_SN_PLR0_SU0_SUM0_SUS256_SNLL0_TT4_4_WG16_16_1_WGM8
    SolutionIndex: 61
    SolutionNameMin: Cijk_Alik_Bljk_ZB_GB_MT128x32x8_SN_PLR1_SU0_SUM0_SUS256_SNLL0_TT4_4_WG32_8_1_WGM8
    SolutionIndex: 62
    SolutionNameMin: Cijk_Alik_Bljk_ZB_GB_MT64x64x16_SN_PLR1_SU0_SUM0_SUS256_SNLL0_TT4_4_WG16_16_1_WGM8
    SolutionIndex: 63
    SolutionNameMin: Cijk_Alik_Bljk_ZB_GB_MT32x128x8_SN_PLR1_SU32_SUM0_SUS128_SNLL0_TT4_4_WG8_32_1_WGM8
    SolutionIndex: 64
    SolutionNameMin: Cijk_Alik_Bljk_ZB_GB_MT64x64x8_SN_PLR0_SU32_SUM0_SUS128_SNLL0_TT4_4_WG16_16_1_WGM8
    SolutionIndex: 65
    SolutionNameMin: Cijk_Alik_Bljk_ZB_GB_MT64x64x8_SN_PLR0_SU32_SUM3_SUS128_SNLL0_TT4_4_WG16_16_1_WGM8
    SolutionIndex: 66
    SolutionNameMin: Cijk_Alik_Bljk_ZB_GB_MT32x128x8_SN_PLR1_SU32_SUM0_SUS256_SNLL0_TT4_4_WG8_32_1_WGM8
    SolutionIndex: 67
    SolutionNameMin: Cijk_Alik_Bljk_ZB_GB_MT64x64x8_SN_PLR0_SU32_SUM0_SUS256_SNLL0_TT4_4_WG16_16_1_WGM8
    SolutionIndex: 68
    SolutionNameMin: Cijk_Alik_Bljk_ZB_GB_MT128x32x8_SN_PLR1_SU32_SUM0_SUS256_SNLL0_TT4_4_WG32_8_1_WGM8
    SolutionIndex: 69
    SolutionNameMin: Cijk_Alik_Bljk_ZB_GB_MT64x64x16_SN_PLR1_SU32_SUM0_SUS256_SNLL0_TT4_4_WG16_16_1_WGM8
    SolutionIndex: 70
    SolutionNameMin: Cijk_Alik_Bljk_ZB_GB_MT64x64x8_SN_PLR0_SU32_SUM3_SUS256_SNLL0_TT4_4_WG16_16_1_WGM8
    SolutionIndex: 71
    SolutionNameMin: Cijk_Alik_Bljk_ZB_GB_MT32x128x8_SN_PLR1_SU0_SUM0_SUS256_SNLL0_TT4_4_WG8_32_1_WGM15
    SolutionIndex: 72
    SolutionNameMin: Cijk_Alik_Bljk_ZB_GB_MT64x64x8_SN_PLR0_SU0_SUM0_SUS256_SNLL0_TT4_4_WG16_16_1_WGM15
    SolutionIndex: 73
    SolutionNameMin: Cijk_Alik_Bljk_ZB_GB_MT128x32x8_SN_PLR1_SU0_SUM0_SUS256_SNLL0_TT4_4_WG32_8_1_WGM15
    SolutionIndex: 74
    SolutionNameMin: Cijk_Alik_Bljk_ZB_GB_MT64x64x16_SN_PLR1_SU0_SUM0_SUS256_SNLL0_TT4_4_WG16_16_1_WGM15
    SolutionIndex: 75
    SolutionNameMin: Cijk_Alik_Bljk_ZB_GB_MT64x64x8_SN_PLR1_SU32_SUM0_SUS128_SNLL0_TT4_4_WG16_16_1_WGM15
    SolutionIndex: 76
    SolutionNameMin: Cijk_Alik_Bljk_ZB_GB_MT64x64x8_SN_PLR0_SU32_SUM0_SUS128_SNLL0_TT4_4_WG16_16_1_WGM15
    SolutionIndex: 77
    SolutionNameMin: Cijk_Alik_Bljk_ZB_GB_MT64x64x8_SN_PLR0_SU32_SUM3_SUS128_SNLL0_TT4_4_WG16_16_1_WGM15
    SolutionIndex: 78
    SolutionNameMin: Cijk_Alik_Bljk_ZB_GB_MT128x32x8_SN_PLR1_SU32_SUM3_SUS128_SNLL0_TT4_4_WG32_8_1_WGM15
    SolutionIndex: 79
    SolutionNameMin: Cijk_Alik_Bljk_ZB_GB_MT64x64x8_SN_PLR0_SU32_SUM0_SUS256_SNLL0_TT4_4_WG16_16_1_WGM15
    SolutionIndex: 80
    SolutionNameMin: Cijk_Alik_Bljk_ZB_GB_MT64x64x8_SN_PLR0_SU32_SUM3_SUS256_SNLL0_TT4_4_WG16_16_1_WGM15
    SolutionIndex: 81
    SolutionNameMin: Cijk_Alik_Bljk_ZB_GB_MT16x16x4_SN_PLR1_SU0_SUM0_SUS256_SNLL1_TT2_2_WG8_8_1_WGM1
    SolutionIndex: 82
    SolutionNameMin: Cijk_Alik_Bljk_ZB_GB_MT8x8x8_SN_PLR1_SU0_SUM0_SUS256_SNLL1_TT1_1_WG8_8_1_WGM1
    SolutionIndex: 83
    SolutionNameMin: Cijk_Alik_Bljk_ZB_GB_MT16x16x4_SN_PLR1_SU32_SUM0_SUS128_SNLL1_TT2_2_WG8_8_1_WGM1
    SolutionIndex: 84
    SolutionNameMin: Cijk_Alik_Bljk_ZB_GB_MT8x8x8_SN_PLR1_SU0_SUM0_SUS256_SNLL1_TT1_1_WG8_8_1_WGM8
    SolutionIndex: 85
    SolutionNameMin: Cijk_Alik_Bljk_ZB_GB_MT16x16x4_SN_PLR0_SU0_SUM0_SUS256_SNLL1_TT2_2_WG8_8_1_WGM15
    SolutionIndex: 86
    SolutionNameMin: Cijk_Alik_Bljk_ZB_GB_MT16x16x4_SN_PLR1_SU0_SUM0_SUS256_SNLL0_TT2_2_WG8_8_1_WGM1
    SolutionIndex: 87
    SolutionNameMin: Cijk_Alik_Bljk_ZB_GB_MT16x16x4_SN_PLR0_SU0_SUM0_SUS256_SNLL0_TT2_2_WG8_8_1_WGM1
    SolutionIndex: 88
    SolutionNameMin: Cijk_Alik_Bljk_ZB_GB_MT8x8x8_SN_PLR0_SU0_SUM0_SUS256_SNLL0_TT1_1_WG8_8_1_WGM1
    SolutionIndex: 89
    SolutionNameMin: Cijk_Alik_Bljk_ZB_GB_MT16x16x8_SN_PLR1_SU0_SUM0_SUS256_SNLL0_TT2_2_WG8_8_1_WGM1
    SolutionIndex: 90
    SolutionNameMin: Cijk_Alik_Bljk_ZB_GB_MT32x32x8_SN_PLR1_SU0_SUM0_SUS256_SNLL0_TT2_2_WG16_16_1_WGM1
    SolutionIndex: 91
    SolutionNameMin: Cijk_Alik_Bljk_ZB_GB_MT16x16x4_SN_PLR1_SU32_SUM0_SUS128_SNLL0_TT2_2_WG8_8_1_WGM1
    SolutionIndex: 92
    SolutionNameMin: Cijk_Alik_Bljk_ZB_GB_MT32x32x8_SN_PLR1_SU32_SUM0_SUS128_SNLL0_TT2_2_WG16_16_1_WGM1
    SolutionIndex: 93
    SolutionNameMin: Cijk_Alik_Bljk_ZB_GB_MT8x8x8_SN_PLR1_SU32_SUM3_SUS128_SNLL0_TT1_1_WG8_8_1_WGM1
    SolutionIndex: 94
    SolutionNameMin: Cijk_Alik_Bljk_ZB_GB_MT32x32x8_SN_PLR1_SU32_SUM3_SUS128_SNLL0_TT2_2_WG16_16_1_WGM1
    SolutionIndex: 95
    SolutionNameMin: Cijk_Alik_Bljk_ZB_GB_MT16x16x4_SN_PLR1_SU32_SUM0_SUS256_SNLL0_TT2_2_WG8_8_1_WGM1
    SolutionIndex: 96
    SolutionNameMin: Cijk_Alik_Bljk_ZB_GB_MT16x16x4_SN_PLR1_SU32_SUM3_SUS256_SNLL0_TT2_2_WG8_8_1_WGM1
    SolutionIndex: 97
    SolutionNameMin: Cijk_Alik_Bljk_ZB_GB_MT32x32x8_SN_PLR1_SU32_SUM3_SUS256_SNLL0_TT2_2_WG16_16_1_WGM1
    SolutionIndex: 98
    SolutionNameMin: Cijk_Alik_Bljk_ZB_GB_MT16x16x4_SN_PLR1_SU0_SUM0_SUS256_SNLL0_TT2_2_WG8_8_1_WGM8
    SolutionIndex: 99
    SolutionNameMin: Cijk_Alik_Bljk_ZB_GB_MT16x16x8_SN_PLR1_SU0_SUM0_SUS256_SNLL0_TT2_2_WG8_8_1_WGM8
    SolutionIndex: 100
    SolutionNameMin: Cijk_Alik_Bljk_ZB_GB_MT32x32x8_SN_PLR1_SU0_SUM0_SUS256_SNLL0_TT2_2_WG16_16_1_WGM8
    SolutionIndex: 101
    SolutionNameMin: Cijk_Alik_Bljk_ZB_GB_MT16x16x4_SN_PLR1_SU32_SUM3_SUS128_SNLL0_TT2_2_WG8_8_1_WGM8
    SolutionIndex: 102
    SolutionNameMin: Cijk_Alik_Bljk_ZB_GB_MT16x16x4_SN_PLR0_SU32_SUM3_SUS256_SNLL0_TT2_2_WG8_8_1_WGM8
    SolutionIndex: 103
    SolutionNameMin: Cijk_Alik_Bljk_ZB_GB_MT16x16x4_SN_PLR1_SU0_SUM0_SUS256_SNLL0_TT2_2_WG8_8_1_WGM15
    SolutionIndex: 104
    SolutionNameMin: Cijk_Alik_Bljk_ZB_GB_MT16x16x8_SN_PLR1_SU0_SUM0_SUS256_SNLL0_TT2_2_WG8_8_1_WGM15
    SolutionIndex: 105
    SolutionNameMin: Cijk_Alik_Bljk_ZB_GB_MT32x32x8_SN_PLR1_SU0_SUM0_SUS256_SNLL0_TT2_2_WG16_16_1_WGM15
    SolutionIndex: 106
    SolutionNameMin: Cijk_Alik_Bljk_ZB_GB_MT32x32x8_SN_PLR1_SU32_SUM0_SUS128_SNLL0_TT2_2_WG16_16_1_WGM15
    SolutionIndex: 107
    SolutionNameMin: Cijk_Alik_Bljk_ZB_GB_MT16x16x4_SN_PLR1_SU32_SUM3_SUS128_SNLL0_TT2_2_WG8_8_1_WGM15
    SolutionIndex: 108
    SolutionNameMin: Cijk_Alik_Bljk_ZB_GB_MT32x32x8_SN_PLR1_SU32_SUM3_SUS128_SNLL0_TT2_2_WG16_16_1_WGM15
    SolutionIndex: 109
    SolutionNameMin: Cijk_Alik_Bljk_ZB_GB_MT8x8x8_SN_PLR1_SU32_SUM0_SUS256_SNLL0_TT1_1_WG8_8_1_WGM15
    SolutionIndex: 110
    SolutionNameMin: Cijk_Alik_Bljk_ZB_GB_MT32x32x8_SN_PLR1_SU32_SUM0_SUS256_SNLL0_TT2_2_WG16_16_1_WGM15
    SolutionIndex: 111
    SolutionNameMin: Cijk_Alik_Bljk_ZB_GB_MT24x24x8_SN_PLR1_SU0_SUM0_SUS256_SNLL0_TT3_3_WG8_8_1_WGM1
    SolutionIndex: 112
    SolutionNameMin: Cijk_Alik_Bljk_ZB_GB_MT32x32x8_SN_PLR1_SU0_SUM0_SUS256_SNLL0_TT4_4_WG8_8_1_WGM1
    SolutionIndex: 113
    SolutionNameMin: Cijk_Alik_Bljk_ZB_GB_MT48x48x16_SN_PLR1_SU0_SUM0_SUS256_SNLL0_TT3_3_WG16_16_1_WGM1
    SolutionIndex: 114
    SolutionNameMin: Cijk_Alik_Bljk_ZB_GB_MT24x24x8_SN_PLR1_SU0_SUM0_SUS256_SNLL0_TT3_3_WG8_8_1_WGM8
    SolutionIndex: 115
    SolutionNameMin: Cijk_Alik_Bljk_ZB_GB_MT32x32x8_SN_PLR1_SU0_SUM0_SUS256_SNLL0_TT4_4_WG8_8_1_WGM8
    SolutionIndex: 116
    SolutionNameMin: Cijk_Alik_Bljk_ZB_GB_MT48x48x16_SN_PLR1_SU0_SUM0_SUS256_SNLL0_TT3_3_WG16_16_1_WGM8
    SolutionIndex: 117
    SolutionNameMin: Cijk_Alik_Bljk_ZB_GB_MT24x24x8_SN_PLR1_SU0_SUM0_SUS256_SNLL0_TT3_3_WG8_8_1_WGM15
    SolutionIndex: 118
    SolutionNameMin: Cijk_Alik_Bljk_ZB_GB_MT32x32x8_SN_PLR1_SU0_SUM0_SUS256_SNLL0_TT4_4_WG8_8_1_WGM15
    SolutionIndex: 119
    SolutionNameMin: Cijk_Alik_Bljk_ZB_GB_MT48x48x16_SN_PLR1_SU0_SUM0_SUS256_SNLL0_TT3_3_WG16_16_1_WGM15
- - - [192, 192, 1000, 32, 192, 192, 32, 32]
    - [49, 1584.0]
  - - [1536, 1536, 168, 32, 1536, 1536, 32, 32]
    - [36, 1591.0]
  - - [1536, 32, 168, 1536, 1536, 1536, 1536, 1536]
    - [61, 1430.0]
  - - [32, 1536, 168, 32, 32, 32, 32, 32]
    - [47, 1077.0]
  - - [384, 384, 1024, 384, 384, 384, 384, 384]
    - [49, 1979.0]
  - - [1, 1, 1000, 1, 1, 1, 1, 1]
    - [81, 0.0]
  - - [2, 2, 1000, 2, 2, 2, 2, 2]
    - [81, 2.0]
  - - [3, 3, 1000, 3, 3, 3, 3, 3]
    - [82, 7.0]
  - - [4, 4, 1000, 4, 4, 4, 4, 4]
    - [88, 17.0]
  - - [5, 5, 1000, 5, 5, 5, 5, 5]
    - [82, 31.0]
  - - [6, 6, 1000, 6, 6, 6, 6, 6]
    - [93, 52.0]
  - - [7, 7, 1000, 7, 7, 7, 7, 7]
    - [84, 79.0]
  - - [8, 8, 1000, 8, 8, 8, 8, 8]
    - [109, 114.0]
  - - [9, 9, 1000, 9, 9, 9, 9, 9]
    - [91, 114.0]
  - - [10, 10, 1000, 10, 10, 10, 10, 10]
    - [101, 151.0]
  - - [11, 11, 1000, 11, 11, 11, 11, 11]
    - [102, 185.0]
  - - [12, 12, 1000, 12, 12, 12, 12, 12]
    - [95, 254.0]
  - - [13, 13, 1000, 13, 13, 13, 13, 13]
    - [91, 257.0]
  - - [14, 14, 1000, 14, 14, 14, 14, 14]
    - [107, 321.0]
  - - [15, 15, 1000, 15, 15, 15, 15, 15]
    - [86, 367.0]
  - - [16, 16, 1000, 16, 16, 16, 16, 16]
    - [95, 470.0]
  - - [17, 17, 1000, 17, 17, 17, 17, 17]
    - [100, 239.0]
  - - [18, 18, 1000, 18, 18, 18, 18, 18]
    - [96, 277.0]
  - - [19, 19, 1000, 19, 19, 19, 19, 19]
    - [90, 306.0]
  - - [20, 20, 1000, 20, 20, 20, 20, 20]
    - [86, 395.0]
  - - [21, 21, 1000, 21, 21, 21, 21, 21]
    - [90, 387.0]
  - - [22, 22, 1000, 22, 22, 22, 22, 22]
    - [105, 436.0]
  - - [23, 23, 1000, 23, 23, 23, 23, 23]
    - [97, 477.0]
  - - [24, 24, 1000, 24, 24, 24, 24, 24]
    - [92, 584.0]
  - - [25, 25, 1000, 25, 25, 25, 25, 25]
    - [108, 546.0]
  - - [26, 26, 1000, 26, 26, 26, 26, 26]
    - [110, 597.0]
  - - [27, 27, 1000, 27, 27, 27, 27, 27]
    - [94, 639.0]
  - - [28, 28, 1000, 28, 28, 28, 28, 28]
    - [98, 798.0]
  - - [29, 29, 1000, 29, 29, 29, 29, 29]
    - [106, 731.0]
  - - [30, 30, 1000, 30, 30, 30, 30, 30]
    - [94, 805.0]
  - - [31, 31, 1000, 31, 31, 31, 31, 31]
    - [90, 839.0]
  - - [32, 32, 1000, 32, 32, 32, 32, 32]
    - [90, 1019.0]
  - - [33, 33, 1000, 33, 33, 33, 33, 33]
    - [86, 544.0]
  - - [34, 34, 1000, 34, 34, 34, 34, 34]
    - [86, 601.0]
  - - [35, 35, 1000, 35, 35, 35, 35, 35]
    - [98, 614.0]
  - - [36, 36, 1000, 36, 36, 36, 36, 36]
    - [98, 698.0]
  - - [37, 37, 1000, 37, 37, 37, 37, 37]
    - [86, 642.0]
  - - [38, 38, 1000, 38, 38, 38, 38, 38]
    - [86, 736.0]
  - - [39, 39, 1000, 39, 39, 39, 39, 39]
    - [83, 707.0]
  - - [40, 40, 1000, 40, 40, 40, 40, 40]
    - [86, 864.0]
  - - [41, 41, 1000, 41, 41, 41, 41, 41]
    - [87, 721.0]
  - - [42, 42, 1000, 42, 42, 42, 42, 42]
    - [103, 862.0]
  - - [43, 43, 1000, 43, 43, 43, 43, 43]
    - [85, 774.0]
  - - [44, 44, 1000, 44, 44, 44, 44, 44]
    - [86, 1049.0]
  - - [45, 45, 1000, 45, 45, 45, 45, 45]
    - [98, 826.0]
  - - [46, 46, 1000, 46, 46, 46, 46, 46]
    - [98, 976.0]
  - - [47, 47, 1000, 47, 47, 47, 47, 47]
    - [86, 876.0]
  - - [48, 48, 1000, 48, 48, 48, 48, 48]
    - [103, 1208.0]
  - - [49, 49, 1000, 49, 49, 49, 49, 49]
    - [19, 782.0]
  - - [50, 50, 1000, 50, 50, 50, 50, 50]
    - [19, 828.0]
  - - [51, 51, 1000, 51, 51, 51, 51, 51]
    - [2, 850.0]
  - - [52, 52, 1000, 52, 52, 52, 52, 52]
    - [2, 908.0]
  - - [53, 53, 1000, 53, 53, 53, 53, 53]
    - [2, 916.0]
  - - [54, 54, 1000, 54, 54, 54, 54, 54]
    - [29, 959.0]
  - - [55, 55, 1000, 55, 55, 55, 55, 55]
    - [19, 977.0]
  - - [56, 56, 1000, 56, 56, 56, 56, 56]
    - [2, 1081.0]
  - - [57, 57, 1000, 57, 57, 57, 57, 57]
    - [79, 1061.0]
  - - [58, 58, 1000, 58, 58, 58, 58, 58]
    - [27, 1110.0]
  - - [59, 59, 1000, 59, 59, 59, 59, 59]
    - [7, 1131.0]
  - - [60, 60, 1000, 60, 60, 60, 60, 60]
    - [49, 1204.0]
  - - [61, 61, 1000, 61, 61, 61, 61, 61]
    - [49, 1198.0]
  - - [62, 62, 1000, 62, 62, 62, 62, 62]
    - [57, 1259.0]
  - - [63, 63, 1000, 63, 63, 63, 63, 63]
    - [19, 1271.0]
  - - [64, 64, 1000, 64, 64, 64, 64, 64]
    - [77, 1412.0]
  - - [65, 65, 1000, 65, 65, 65, 65, 65]
    - [117, 806.0]
  - - [66, 66, 1000, 66, 66, 66, 66, 66]
    - [114, 832.0]
  - - [67, 67, 1000, 67, 67, 67, 67, 67]
    - [117, 855.0]
  - - [68, 68, 1000, 68, 68, 68, 68, 68]
    - [114, 891.0]
  - - [69, 69, 1000, 69, 69, 69, 69, 69]
    - [111, 903.0]
  - - [70, 70, 1000, 70, 70, 70, 70, 70]
    - [111, 934.0]
  - - [71, 71, 1000, 71, 71, 71, 71, 71]
    - [117, 960.0]
  - - [72, 72, 1000, 72, 72, 72, 72, 72]
    - [111, 1065.0]
  - - [73, 73, 1000, 73, 73, 73, 73, 73]
    - [89, 782.0]
  - - [74, 74, 1000, 74, 74, 74, 74, 74]
    - [104, 810.0]
  - - [75, 75, 1000, 75, 75, 75, 75, 75]
    - [89, 835.0]
  - - [76, 76, 1000, 76, 76, 76, 76, 76]
    - [89, 866.0]
  - - [77, 77, 1000, 77, 77, 77, 77, 77]
    - [89, 888.0]
  - - [78, 78, 1000, 78, 78, 78, 78, 78]
    - [99, 919.0]
  - - [79, 79, 1000, 79, 79, 79, 79, 79]
    - [99, 945.0]
  - - [80, 80, 1000, 80, 80, 80, 80, 80]
    - [89, 987.0]
  - - [81, 81, 1000, 81, 81, 81, 81, 81]
    - [112, 939.0]
  - - [82, 82, 1000, 82, 82, 82, 82, 82]
    - [112, 969.0]
  - - [83, 83, 1000, 83, 83, 83, 83, 83]
    - [90, 984.0]
  - - [84, 84, 1000, 84, 84, 84, 84, 84]
    - [112, 1021.0]
  - - [85, 85, 1000, 85, 85, 85, 85, 85]
    - [90, 1036.0]
  - - [86, 86, 1000, 86, 86, 86, 86, 86]
    - [105, 1070.0]
  - - [87, 87, 1000, 87, 87, 87, 87, 87]
    - [100, 1097.0]
  - - [88, 88, 1000, 88, 88, 88, 88, 88]
    - [112, 1166.0]
  - - [89, 89, 1000, 89, 89, 89, 89, 89]
    - [118, 1134.0]
  - - [90, 90, 1000, 90, 90, 90, 90, 90]
    - [112, 1168.0]
  - - [91, 91, 1000, 91, 91, 91, 91, 91]
    - [112, 1183.0]
  - - [92, 92, 1000, 92, 92, 92, 92, 92]
    - [115, 1229.0]
  - - [93, 93, 1000, 93, 93, 93, 93, 93]
    - [90, 1243.0]
  - - [94, 94, 1000, 94, 94, 94, 94, 94]
    - [90, 1276.0]
  - - [95, 95, 1000, 95, 95, 95, 95, 95]
    - [105, 1307.0]
  - - [96, 96, 1000, 96, 96, 96, 96, 96]
    - [112, 1400.0]
  - - [97, 97, 1000, 97, 97, 97, 97, 97]
    - [72, 1013.0]
  - - [98, 98, 1000, 98, 98, 98, 98, 98]
    - [49, 1040.0]
  - - [99, 99, 1000, 99, 99, 99, 99, 99]
    - [49, 1053.0]
  - - [100, 100, 1000, 100, 100, 100, 100, 100]
    - [49, 1087.0]
  - - [101, 101, 1000, 101, 101, 101, 101, 101]
    - [2, 1093.0]
  - - [102, 102, 1000, 102, 102, 102, 102, 102]
    - [36, 1122.0]
  - - [103, 103, 1000, 103, 103, 103, 103, 103]
    - [2, 1146.0]
  - - [104, 104, 1000, 104, 104, 104, 104, 104]
    - [60, 1209.0]
  - - [105, 105, 1000, 105, 105, 105, 105, 105]
    - [72, 1190.0]
  - - [106, 106, 1000, 106, 106, 106, 106, 106]
    - [49, 1222.0]
  - - [107, 107, 1000, 107, 107, 107, 107, 107]
    - [60, 1232.0]
  - - [108, 108, 1000, 108, 108, 108, 108, 108]
    - [72, 1274.0]
  - - [109, 109, 1000, 109, 109, 109, 109, 109]
    - [2, 1273.0]
  - - [110, 110, 1000, 110, 110, 110, 110, 110]
    - [49, 1310.0]
  - - [111, 111, 1000, 111, 111, 111, 111, 111]
    - [72, 1331.0]
  - - [112, 112, 1000, 112, 112, 112, 112, 112]
    - [19, 1389.0]
  - - [113, 113, 1000, 113, 113, 113, 113, 113]
    - [72, 1378.0]
  - - [114, 114, 1000, 114, 114, 114, 114, 114]
    - [60, 1406.0]
  - - [115, 115, 1000, 115, 115, 115, 115, 115]
    - [49, 1420.0]
  - - [116, 116, 1000, 116, 116, 116, 116, 116]
    - [2, 1467.0]
  - - [117, 117, 1000, 117, 117, 117, 117, 117]
    - [19, 1474.0]
  - - [118, 118, 1000, 118, 118, 118, 118, 118]
    - [72, 1510.0]
  - - [119, 119, 1000, 119, 119, 119, 119, 119]
    - [19, 1529.0]
  - - [120, 120, 1000, 120, 120, 120, 120, 120]
    - [27, 1599.0]
  - - [121, 121, 1000, 121, 121, 121, 121, 121]
    - [60, 1580.0]
  - - [122, 122, 1000, 122, 122, 122, 122, 122]
    - [60, 1618.0]
  - - [123, 123, 1000, 123, 123, 123, 123, 123]
    - [72, 1627.0]
  - - [124, 124, 1000, 124, 124, 124, 124, 124]
    - [72, 1678.0]
  - - [125, 125, 1000, 125, 125, 125, 125, 125]
    - [72, 1679.0]
  - - [126, 126, 1000, 126, 126, 126, 126, 126]
    - [36, 1714.0]
  - - [127, 127, 1000, 127, 127, 127, 127, 127]
    - [60, 1731.0]
  - - [128, 128, 1000, 128, 128, 128, 128, 128]
    - [55, 1829.0]
  - - [129, 129, 1000, 129, 129, 129, 129, 129]
    - [113, 975.0]
  - - [130, 130, 1000, 130, 130, 130, 130, 130]
    - [113, 993.0]
  - - [131, 131, 1000, 131, 131, 131, 131, 131]
    - [113, 1006.0]
  - - [132, 132, 1000, 132, 132, 132, 132, 132]
    - [113, 1026.0]
  - - [133, 133, 1000, 133, 133, 133, 133, 133]
    - [116, 1036.0]
  - - [134, 134, 1000, 134, 134, 134, 134, 134]
    - [119, 1053.0]
  - - [135, 135, 1000, 135, 135, 135, 135, 135]
    - [116, 1065.0]
  - - [136, 136, 1000, 136, 136, 136, 136, 136]
    - [116, 1089.0]
  - - [137, 137, 1000, 137, 137, 137, 137, 137]
    - [116, 1097.0]
  - - [138, 138, 1000, 138, 138, 138, 138, 138]
    - [116, 1113.0]
  - - [139, 139, 1000, 139, 139, 139, 139, 139]
    - [119, 1128.0]
  - - [140, 140, 1000, 140, 140, 140, 140, 140]
    - [116, 1152.0]
  - - [141, 141, 1000, 141, 141, 141, 141, 141]
    - [119, 1161.0]
  - - [142, 142, 1000, 142, 142, 142, 142, 142]
    - [119, 1179.0]
  - - [143, 143, 1000, 143, 143, 143, 143, 143]
    - [116, 1195.0]
  - - [144, 144, 1000, 144, 144, 144, 144, 144]
    - [113, 1299.0]
  - - [145, 145, 1000, 145, 145, 145, 145, 145]
    - [112, 1149.0]
  - - [146, 146, 1000, 146, 146, 146, 146, 146]
    - [112, 1174.0]
  - - [147, 147, 1000, 147, 147, 147, 147, 147]
    - [112, 1176.0]
  - - [148, 148, 1000, 148, 148, 148, 148, 148]
    - [112, 1209.0]
  - - [149, 149, 1000, 149, 149, 149, 149, 149]
    - [112, 1208.0]
  - - [150, 150, 1000, 150, 150, 150, 150, 150]
    - [112, 1231.0]
  - - [32, 32, 8, 32, 32, 32, 32, 32]
    - [40, 10.0]
  - - [32, 32, 8, 64, 32, 32, 64, 64]
    - [0, 14.0]
  - - [32, 32, 8, 128, 32, 32, 128, 128]
    - [0, 18.0]
  - - [32, 32, 8, 256, 32, 32, 256, 256]
    - [1, 22.0]
  - - [32, 32, 8, 512, 32, 32, 512, 512]
    - [1, 24.0]
  - - [32, 32, 8, 1024, 32, 32, 1024, 1024]
    - [1, 25.0]
  - - [32, 32, 8, 2048, 32, 32, 2048, 2048]
    - [1, 26.0]
  - - [32, 64, 8, 32, 32, 32, 32, 32]
    - [5, 19.0]
  - - [32, 64, 8, 64, 32, 32, 64, 64]
    - [1, 28.0]
  - - [32, 64, 8, 128, 32, 32, 128, 128]
    - [11, 37.0]
  - - [32, 64, 8, 256, 32, 32, 256, 256]
    - [1, 43.0]
  - - [32, 64, 8, 512, 32, 32, 512, 512]
    - [1, 48.0]
  - - [32, 64, 8, 1024, 32, 32, 1024, 1024]
    - [1, 50.0]
  - - [32, 64, 8, 2048, 32, 32, 2048, 2048]
    - [1, 52.0]
  - - [32, 128, 8, 32, 32, 32, 32, 32]
    - [1, 39.0]
  - - [32, 128, 8, 64, 32, 32, 64, 64]
    - [8, 57.0]
  - - [32, 128, 8, 128, 32, 32, 128, 128]
    - [8, 74.0]
  - - [32, 128, 8, 256, 32, 32, 256, 256]
    - [6, 87.0]
  - - [32, 128, 8, 512, 32, 32, 512, 512]
    - [1, 95.0]
  - - [32, 128, 8, 1024, 32, 32, 1024, 1024]
    - [1, 100.0]
  - - [32, 128, 8, 2048, 32, 32, 2048, 2048]
    - [1, 103.0]
  - - [32, 256, 8, 32, 32, 32, 32, 32]
    - [5, 78.0]
  - - [32, 256, 8, 64, 32, 32, 64, 64]
    - [6, 112.0]
  - - [32, 256, 8, 128, 32, 32, 128, 128]
    - [23, 146.0]
  - - [32, 256, 8, 256, 32, 32, 256, 256]
    - [1, 173.0]
  - - [32, 256, 8, 512, 32, 32, 512, 512]
    - [1, 191.0]
  - - [32, 256, 8, 1024, 32, 32, 1024, 1024]
    - [1, 200.0]
  - - [32, 256, 8, 2048, 32, 32, 2048, 2048]
    - [1, 206.0]
  - - [32, 512, 8, 32, 32, 32, 32, 32]
    - [22, 157.0]
  - - [32, 512, 8, 64, 32, 32, 64, 64]
    - [40, 226.0]
  - - [32, 512, 8, 128, 32, 32, 128, 128]
    - [1, 293.0]
  - - [32, 512, 8, 256, 32, 32, 256, 256]
    - [1, 343.0]
  - - [32, 512, 8, 512, 32, 32, 512, 512]
    - [1, 381.0]
  - - [32, 512, 8, 1024, 32, 32, 1024, 1024]
    - [1, 401.0]
  - - [32, 512, 8, 2048, 32, 32, 2048, 2048]
    - [1, 412.0]
  - - [32, 1024, 8, 32, 32, 32, 32, 32]
    - [2, 390.0]
  - - [32, 1024, 8, 64, 32, 32, 64, 64]
    - [14, 456.0]
  - - [32, 1024, 8, 128, 32, 32, 128, 128]
    - [0, 567.0]
  - - [32, 1024, 8, 256, 32, 32, 256, 256]
    - [34, 647.0]
  - - [32, 1024, 8, 512, 32, 32, 512, 512]
    - [58, 683.0]
  - - [32, 1024, 8, 1024, 32, 32, 1024, 1024]
    - [25, 736.0]
  - - [32, 1024, 8, 2048, 32, 32, 2048, 2048]
    - [56, 757.0]
  - - [32, 2048, 8, 32, 32, 32, 32, 32]
    - [52, 546.0]
  - - [32, 2048, 8, 64, 32, 32, 64, 64]
    - [63, 629.0]
  - - [32, 2048, 8, 128, 32, 32, 128, 128]
    - [58, 694.0]
  - - [32, 2048, 8, 256, 32, 32, 256, 256]
    - [66, 728.0]
  - - [32, 2048, 8, 512, 32, 32, 512, 512]
    - [71, 746.0]
  - - [32, 2048, 8, 1024, 32, 32, 1024, 1024]
    - [52, 760.0]
  - - [32, 2048, 8, 2048, 32, 32, 2048, 2048]
    - [56, 755.0]
  - - [64, 32, 8, 32, 64, 64, 32, 32]
    - [54, 35.0]
  - - [64, 32, 8, 64, 64, 64, 64, 64]
    - [50, 42.0]
  - - [64, 32, 8, 128, 64, 64, 128, 128]
    - [15, 45.0]
  - - [64, 32, 8, 256, 64, 64, 256, 256]
    - [10, 48.0]
  - - [64, 32, 8, 512, 64, 64, 512, 512]
    - [3, 50.0]
  - - [64, 32, 8, 1024, 64, 64, 1024, 1024]
    - [16, 51.0]
  - - [64, 32, 8, 2048, 64, 64, 2048, 2048]
    - [4, 51.0]
  - - [64, 64, 8, 32, 64, 64, 32, 32]
    - [75, 70.0]
  - - [64, 64, 8, 64, 64, 64, 64, 64]
    - [33, 83.0]
  - - [64, 64, 8, 128, 64, 64, 128, 128]
    - [74, 93.0]
  - - [64, 64, 8, 256, 64, 64, 256, 256]
    - [62, 98.0]
  - - [64, 64, 8, 512, 64, 64, 512, 512]
    - [69, 100.0]
  - - [64, 64, 8, 1024, 64, 64, 1024, 1024]
    - [37, 101.0]
  - - [64, 64, 8, 2048, 64, 64, 2048, 2048]
    - [21, 102.0]
  - - [64, 128, 8, 32, 64, 64, 32, 32]
    - [6, 80.0]
  - - [64, 128, 8, 64, 64, 64, 64, 64]
    - [35, 116.0]
  - - [64, 128, 8, 128, 64, 64, 128, 128]
    - [1, 146.0]
  - - [64, 128, 8, 256, 64, 64, 256, 256]
    - [6, 168.0]
  - - [64, 128, 8, 512, 64, 64, 512, 512]
    - [3, 185.0]
  - - [64, 128, 8, 1024, 64, 64, 1024, 1024]
    - [3, 194.0]
  - - [64, 128, 8, 2048, 64, 64, 2048, 2048]
    - [3, 200.0]
  - - [64, 256, 8, 32, 64, 64, 32, 32]
    - [1, 159.0]
  - - [64, 256, 8, 64, 64, 64, 64, 64]
    - [8, 229.0]
  - - [64, 256, 8, 128, 64, 64, 128, 128]
    - [35, 289.0]
  - - [64, 256, 8, 256, 64, 64, 256, 256]
    - [1, 335.0]
  - - [64, 256, 8, 512, 64, 64, 512, 512]
    - [20, 369.0]
  - - [64, 256, 8, 1024, 64, 64, 1024, 1024]
    - [3, 389.0]
  - - [64, 256, 8, 2048, 64, 64, 2048, 2048]
    - [3, 399.0]
  - - [64, 512, 8, 32, 64, 64, 32, 32]
    - [35, 320.0]
  - - [64, 512, 8, 64, 64, 64, 64, 64]
    - [18, 457.0]
  - - [64, 512, 8, 128, 64, 64, 128, 128]
    - [13, 579.0]
  - - [64, 512, 8, 256, 64, 64, 256, 256]
    - [1, 669.0]
  - - [64, 512, 8, 512, 64, 64, 512, 512]
    - [23, 732.0]
  - - [64, 512, 8, 1024, 64, 64, 1024, 1024]
    - [48, 769.0]
  - - [64, 512, 8, 2048, 64, 64, 2048, 2048]
    - [1, 795.0]
  - - [64, 1024, 8, 32, 64, 64, 32, 32]
    - [14, 765.0]
  - - [64, 1024, 8, 64, 64, 64, 64, 64]
    - [12, 900.0]
  - - [64, 1024, 8, 128, 64, 64, 128, 128]
    - [64, 978.0]
  - - [64, 1024, 8, 256, 64, 64, 256, 256]
    - [60, 1034.0]
  - - [64, 1024, 8, 512, 64, 64, 512, 512]
    - [55, 1062.0]
  - - [64, 1024, 8, 1024, 64, 64, 1024, 1024]
    - [12, 1081.0]
  - - [64, 1024, 8, 2048, 64, 64, 2048, 2048]
    - [12, 1089.0]
  - - [64, 2048, 8, 32, 64, 64, 32, 32]
    - [55, 834.0]
  - - [64, 2048, 8, 64, 64, 64, 64, 64]
    - [60, 990.0]
  - - [64, 2048, 8, 128, 64, 64, 128, 128]
    - [43, 1087.0]
  - - [64, 2048, 8, 256, 64, 64, 256, 256]
    - [49, 1144.0]
  - - [64, 2048, 8, 512, 64, 64, 512, 512]
    - [79, 1174.0]
  - - [64, 2048, 8, 1024, 64, 64, 1024, 1024]
    - [36, 1191.0]
  - - [64, 2048, 8, 2048, 64, 64, 2048, 2048]
    - [2, 1197.0]
  - - [128, 32, 8, 32, 128, 128, 32, 32]
    - [3, 39.0]
  - - [128, 32, 8, 64, 128, 128, 64, 64]
    - [1, 56.0]
  - - [128, 32, 8, 128, 128, 128, 128, 128]
    - [13, 72.0]
  - - [128, 32, 8, 256, 128, 128, 256, 256]
    - [0, 84.0]
  - - [128, 32, 8, 512, 128, 128, 512, 512]
    - [34, 93.0]
  - - [128, 32, 8, 1024, 128, 128, 1024, 1024]
    - [0, 97.0]
  - - [128, 32, 8, 2048, 128, 128, 2048, 2048]
    - [0, 100.0]
  - - [128, 64, 8, 32, 128, 128, 32, 32]
    - [8, 81.0]
  - - [128, 64, 8, 64, 128, 128, 64, 64]
    - [1, 115.0]
  - - [128, 64, 8, 128, 128, 128, 128, 128]
    - [8, 146.0]
  - - [128, 64, 8, 256, 128, 128, 256, 256]
    - [1, 165.0]
  - - [128, 64, 8, 512, 128, 128, 512, 512]
    - [26, 179.0]
  - - [128, 64, 8, 1024, 128, 128, 1024, 1024]
    - [4, 190.0]
  - - [128, 64, 8, 2048, 128, 128, 2048, 2048]
    - [4, 197.0]
  - - [128, 128, 8, 32, 128, 128, 32, 32]
    - [18, 157.0]
  - - [128, 128, 8, 64, 128, 128, 64, 64]
    - [23, 228.0]
  - - [128, 128, 8, 128, 128, 128, 128, 128]
    - [40, 290.0]
  - - [128, 128, 8, 256, 128, 128, 256, 256]
    - [1, 331.0]
  - - [128, 128, 8, 512, 128, 128, 512, 512]
    - [18, 359.0]
  - - [128, 128, 8, 1024, 128, 128, 1024, 1024]
    - [18, 380.0]
  - - [128, 128, 8, 2048, 128, 128, 2048, 2048]
    - [4, 394.0]
  - - [128, 256, 8, 32, 128, 128, 32, 32]
    - [18, 313.0]
  - - [128, 256, 8, 64, 128, 128, 64, 64]
    - [38, 462.0]
  - - [128, 256, 8, 128, 128, 128, 128, 128]
    - [26, 585.0]
  - - [128, 256, 8, 256, 128, 128, 256, 256]
    - [18, 669.0]
  - - [128, 256, 8, 512, 128, 128, 512, 512]
    - [48, 724.0]
  - - [128, 256, 8, 1024, 128, 128, 1024, 1024]
    - [48, 766.0]
  - - [128, 256, 8, 2048, 128, 128, 2048, 2048]
    - [75, 791.0]
  - - [128, 512, 8, 32, 128, 128, 32, 32]
    - [29, 765.0]
  - - [128, 512, 8, 64, 128, 128, 64, 64]
    - [79, 906.0]
  - - [128, 512, 8, 128, 128, 128, 128, 128]
    - [76, 981.0]
  - - [128, 512, 8, 256, 128, 128, 256, 256]
    - [24, 1036.0]
  - - [128, 512, 8, 512, 128, 128, 512, 512]
    - [76, 1068.0]
  - - [128, 512, 8, 1024, 128, 128, 1024, 1024]
    - [24, 1084.0]
  - - [128, 512, 8, 2048, 128, 128, 2048, 2048]
    - [24, 1092.0]
  - - [128, 1024, 8, 32, 128, 128, 32, 32]
    - [49, 837.0]
  - - [128, 1024, 8, 64, 128, 128, 64, 64]
    - [49, 993.0]
  - - [128, 1024, 8, 128, 128, 128, 128, 128]
    - [2, 1094.0]
  - - [128, 1024, 8, 256, 128, 128, 256, 256]
    - [55, 1144.0]
  - - [128, 1024, 8, 512, 128, 128, 512, 512]
    - [51, 1176.0]
  - - [128, 1024, 8, 1024, 128, 128, 1024, 1024]
    - [60, 1196.0]
  - - [128, 1024, 8, 2048, 128, 128, 2048, 2048]
    - [19, 1201.0]
  - - [128, 2048, 8, 32, 128, 128, 32, 32]
    - [76, 1058.0]
  - - [128, 2048, 8, 64, 128, 128, 64, 64]
    - [60, 1260.0]
  - - [128, 2048, 8, 128, 128, 128, 128, 128]
    - [76, 1388.0]
  - - [128, 2048, 8, 256, 128, 128, 256, 256]
    - [7, 1464.0]
  - - [128, 2048, 8, 512, 128, 128, 512, 512]
    - [24, 1506.0]
  - - [128, 2048, 8, 1024, 128, 128, 1024, 1024]
    - [60, 1529.0]
  - - [128, 2048, 8, 2048, 128, 128, 2048, 2048]
    - [64, 1537.0]
  - - [256, 32, 8, 32, 256, 256, 32, 32]
    - [3, 77.0]
  - - [256, 32, 8, 64, 256, 256, 64, 64]
    - [42, 112.0]
  - - [256, 32, 8, 128, 256, 256, 128, 128]
    - [1, 142.0]
  - - [256, 32, 8, 256, 256, 256, 256, 256]
    - [5, 167.0]
  - - [256, 32, 8, 512, 256, 256, 512, 512]
    - [0, 185.0]
  - - [256, 32, 8, 1024, 256, 256, 1024, 1024]
    - [0, 194.0]
  - - [256, 32, 8, 2048, 256, 256, 2048, 2048]
    - [17, 200.0]
  - - [256, 64, 8, 32, 256, 256, 32, 32]
    - [35, 157.0]
  - - [256, 64, 8, 64, 256, 256, 64, 64]
    - [26, 224.0]
  - - [256, 64, 8, 128, 256, 256, 128, 128]
    - [30, 289.0]
  - - [256, 64, 8, 256, 256, 256, 256, 256]
    - [6, 329.0]
  - - [256, 64, 8, 512, 256, 256, 512, 512]
    - [18, 356.0]
  - - [256, 64, 8, 1024, 256, 256, 1024, 1024]
    - [4, 379.0]
  - - [256, 64, 8, 2048, 256, 256, 2048, 2048]
    - [4, 395.0]
  - - [256, 128, 8, 32, 256, 256, 32, 32]
    - [35, 310.0]
  - - [256, 128, 8, 64, 256, 256, 64, 64]
    - [18, 459.0]
  - - [256, 128, 8, 128, 256, 256, 128, 128]
    - [11, 577.0]
  - - [256, 128, 8, 256, 256, 256, 256, 256]
    - [48, 664.0]
  - - [256, 128, 8, 512, 256, 256, 512, 512]
    - [48, 718.0]
  - - [256, 128, 8, 1024, 256, 256, 1024, 1024]
    - [18, 761.0]
  - - [256, 128, 8, 2048, 256, 256, 2048, 2048]
    - [59, 790.0]
  - - [256, 256, 8, 32, 256, 256, 32, 32]
    - [7, 774.0]
  - - [256, 256, 8, 64, 256, 256, 64, 64]
    - [64, 904.0]
  - - [256, 256, 8, 128, 256, 256, 128, 128]
    - [2, 982.0]
  - - [256, 256, 8, 256, 256, 256, 256, 256]
    - [49, 1032.0]
  - - [256, 256, 8, 512, 256, 256, 512, 512]
    - [49, 1065.0]
  - - [256, 256, 8, 1024, 256, 256, 1024, 1024]
    - [65, 1079.0]
  - - [256, 256, 8, 2048, 256, 256, 2048, 2048]
    - [12, 1090.0]
  - - [256, 512, 8, 32, 256, 256, 32, 32]
    - [49, 861.0]
  - - [256, 512, 8, 64, 256, 256, 64, 64]
    - [2, 999.0]
  - - [256, 512, 8, 128, 256, 256, 128, 128]
    - [2, 1094.0]
  - - [256, 512, 8, 256, 256, 256, 256, 256]
    - [67, 1146.0]
  - - [256, 512, 8, 512, 256, 256, 512, 512]
    - [57, 1174.0]
  - - [256, 512, 8, 1024, 256, 256, 1024, 1024]
    - [72, 1195.0]
  - - [256, 512, 8, 2048, 256, 256, 2048, 2048]
    - [64, 1203.0]
  - - [256, 1024, 8, 32, 256, 256, 32, 32]
    - [2, 1080.0]
  - - [256, 1024, 8, 64, 256, 256, 64, 64]
    - [60, 1272.0]
  - - [256, 1024, 8, 128, 256, 256, 128, 128]
    - [49, 1406.0]
  - - [256, 1024, 8, 256, 256, 256, 256, 256]
    - [60, 1467.0]
  - - [256, 1024, 8, 512, 256, 256, 512, 512]
    - [60, 1508.0]
  - - [256, 1024, 8, 1024, 256, 256, 1024, 1024]
    - [24, 1528.0]
  - - [256, 1024, 8, 2048, 256, 256, 2048, 2048]
    - [64, 1539.0]
  - - [256, 2048, 8, 32, 256, 256, 32, 32]
    - [49, 1252.0]
  - - [256, 2048, 8, 64, 256, 256, 64, 64]
    - [19, 1474.0]
  - - [256, 2048, 8, 128, 256, 256, 128, 128]
    - [19, 1622.0]
  - - [256, 2048, 8, 256, 256, 256, 256, 256]
    - [49, 1661.0]
  - - [256, 2048, 8, 512, 256, 256, 512, 512]
    - [79, 1699.0]
  - - [256, 2048, 8, 1024, 256, 256, 1024, 1024]
    - [72, 1719.0]
  - - [256, 2048, 8, 2048, 256, 256, 2048, 2048]
    - [64, 1728.0]
  - - [512, 32, 8, 32, 512, 512, 32, 32]
    - [20, 154.0]
  - - [512, 32, 8, 64, 512, 512, 64, 64]
    - [6, 221.0]
  - - [512, 32, 8, 128, 512, 512, 128, 128]
    - [30, 283.0]
  - - [512, 32, 8, 256, 512, 512, 256, 256]
    - [8, 331.0]
  - - [512, 32, 8, 512, 512, 512, 512, 512]
    - [23, 355.0]
  - - [512, 32, 8, 1024, 512, 512, 1024, 1024]
    - [21, 378.0]
  - - [512, 32, 8, 2048, 512, 512, 2048, 2048]
    - [4, 395.0]
  - - [512, 64, 8, 32, 512, 512, 32, 32]
    - [3, 311.0]
  - - [512, 64, 8, 64, 512, 512, 64, 64]
    - [40, 446.0]
  - - [512, 64, 8, 128, 512, 512, 128, 128]
    - [40, 571.0]
  - - [512, 64, 8, 256, 512, 512, 256, 256]
    - [30, 661.0]
  - - [512, 64, 8, 512, 512, 512, 512, 512]
    - [8, 712.0]
  - - [512, 64, 8, 1024, 512, 512, 1024, 1024]
    - [6, 758.0]
  - - [512, 64, 8, 2048, 512, 512, 2048, 2048]
    - [4, 789.0]
  - - [512, 128, 8, 32, 512, 512, 32, 32]
    - [64, 774.0]
  - - [512, 128, 8, 64, 512, 512, 64, 64]
    - [57, 900.0]
  - - [512, 128, 8, 128, 512, 512, 128, 128]
    - [29, 973.0]
  - - [512, 128, 8, 256, 512, 512, 256, 256]
    - [2, 1025.0]
  - - [512, 128, 8, 512, 512, 512, 512, 512]
    - [55, 1058.0]
  - - [512, 128, 8, 1024, 512, 512, 1024, 1024]
    - [9, 1077.0]
  - - [512, 128, 8, 2048, 512, 512, 2048, 2048]
    - [67, 1089.0]
  - - [512, 256, 8, 32, 512, 512, 32, 32]
    - [39, 846.0]
  - - [512, 256, 8, 64, 512, 512, 64, 64]
    - [60, 1000.0]
  - - [512, 256, 8, 128, 512, 512, 128, 128]
    - [49, 1101.0]
  - - [512, 256, 8, 256, 512, 512, 256, 256]
    - [72, 1148.0]
  - - [512, 256, 8, 512, 512, 512, 512, 512]
    - [72, 1175.0]
  - - [512, 256, 8, 1024, 512, 512, 1024, 1024]
    - [72, 1190.0]
  - - [512, 256, 8, 2048, 512, 512, 2048, 2048]
    - [49, 1200.0]
  - - [512, 512, 8, 32, 512, 512, 32, 32]
    - [49, 1056.0]
  - - [512, 512, 8, 64, 512, 512, 64, 64]
    - [49, 1270.0]
  - - [512, 512, 8, 128, 512, 512, 128, 128]
    - [60, 1392.0]
  - - [512, 512, 8, 256, 512, 512, 256, 256]
    - [49, 1464.0]
  - - [512, 512, 8, 512, 512, 512, 512, 512]
    - [49, 1508.0]
  - - [512, 512, 8, 1024, 512, 512, 1024, 1024]
    - [24, 1527.0]
  - - [512, 512, 8, 2048, 512, 512, 2048, 2048]
    - [64, 1537.0]
  - - [512, 1024, 8, 32, 512, 512, 32, 32]
    - [49, 1242.0]
  - - [512, 1024, 8, 64, 512, 512, 64, 64]
    - [2, 1445.0]
  - - [512, 1024, 8, 128, 512, 512, 128, 128]
    - [53, 1582.0]
  - - [512, 1024, 8, 256, 512, 512, 256, 256]
    - [60, 1653.0]
  - - [512, 1024, 8, 512, 512, 512, 512, 512]
    - [60, 1697.0]
  - - [512, 1024, 8, 1024, 512, 512, 1024, 1024]
    - [67, 1717.0]
  - - [512, 1024, 8, 2048, 512, 512, 2048, 2048]
    - [64, 1726.0]
  - - [512, 2048, 8, 32, 512, 512, 32, 32]
    - [49, 1384.0]
  - - [512, 2048, 8, 64, 512, 512, 64, 64]
    - [49, 1624.0]
  - - [512, 2048, 8, 128, 512, 512, 128, 128]
    - [49, 1753.0]
  - - [512, 2048, 8, 256, 512, 512, 256, 256]
    - [67, 1839.0]
  - - [512, 2048, 8, 512, 512, 512, 512, 512]
    - [67, 1883.0]
  - - [512, 2048, 8, 1024, 512, 512, 1024, 1024]
    - [60, 1903.0]
  - - [512, 2048, 8, 2048, 512, 512, 2048, 2048]
    - [49, 1914.0]
  - - [1024, 32, 8, 32, 1024, 1024, 32, 32]
    - [2, 387.0]
  - - [1024, 32, 8, 64, 1024, 1024, 64, 64]
    - [12, 451.0]
  - - [1024, 32, 8, 128, 1024, 1024, 128, 128]
    - [32, 554.0]
  - - [1024, 32, 8, 256, 1024, 1024, 256, 256]
    - [44, 634.0]
  - - [1024, 32, 8, 512, 1024, 1024, 512, 512]
    - [20, 683.0]
  - - [1024, 32, 8, 1024, 1024, 1024, 1024, 1024]
    - [28, 735.0]
  - - [1024, 32, 8, 2048, 1024, 1024, 2048, 2048]
    - [46, 758.0]
  - - [1024, 64, 8, 32, 1024, 1024, 32, 32]
    - [76, 771.0]
  - - [1024, 64, 8, 64, 1024, 1024, 64, 64]
    - [49, 896.0]
  - - [1024, 64, 8, 128, 1024, 1024, 128, 128]
    - [53, 965.0]
  - - [1024, 64, 8, 256, 1024, 1024, 256, 256]
    - [64, 1024.0]
  - - [1024, 64, 8, 512, 1024, 1024, 512, 512]
    - [2, 1052.0]
  - - [1024, 64, 8, 1024, 1024, 1024, 1024, 1024]
    - [51, 1077.0]
  - - [1024, 64, 8, 2048, 1024, 1024, 2048, 2048]
    - [27, 1087.0]
  - - [1024, 128, 8, 32, 1024, 1024, 32, 32]
    - [80, 834.0]
  - - [1024, 128, 8, 64, 1024, 1024, 64, 64]
    - [49, 980.0]
  - - [1024, 128, 8, 128, 1024, 1024, 128, 128]
    - [72, 1085.0]
  - - [1024, 128, 8, 256, 1024, 1024, 256, 256]
    - [49, 1138.0]
  - - [1024, 128, 8, 512, 1024, 1024, 512, 512]
    - [80, 1171.0]
  - - [1024, 128, 8, 1024, 1024, 1024, 1024, 1024]
    - [49, 1189.0]
  - - [1024, 128, 8, 2048, 1024, 1024, 2048, 2048]
    - [49, 1200.0]
  - - [1024, 256, 8, 32, 1024, 1024, 32, 32]
    - [60, 1063.0]
  - - [1024, 256, 8, 64, 1024, 1024, 64, 64]
    - [60, 1267.0]
  - - [1024, 256, 8, 128, 1024, 1024, 128, 128]
    - [79, 1384.0]
  - - [1024, 256, 8, 256, 1024, 1024, 256, 256]
    - [19, 1460.0]
  - - [1024, 256, 8, 512, 1024, 1024, 512, 512]
    - [72, 1507.0]
  - - [1024, 256, 8, 1024, 1024, 1024, 1024, 1024]
    - [36, 1523.0]
  - - [1024, 256, 8, 2048, 1024, 1024, 2048, 2048]
    - [55, 1534.0]
  - - [1024, 512, 8, 32, 1024, 1024, 32, 32]
    - [36, 1219.0]
  - - [1024, 512, 8, 64, 1024, 1024, 64, 64]
    - [60, 1449.0]
  - - [1024, 512, 8, 128, 1024, 1024, 128, 128]
    - [19, 1576.0]
  - - [1024, 512, 8, 256, 1024, 1024, 256, 256]
    - [80, 1652.0]
  - - [1024, 512, 8, 512, 1024, 1024, 512, 512]
    - [36, 1694.0]
  - - [1024, 512, 8, 1024, 1024, 1024, 1024, 1024]
    - [19, 1717.0]
  - - [1024, 512, 8, 2048, 1024, 1024, 2048, 2048]
    - [19, 1727.0]
  - - [1024, 1024, 8, 32, 1024, 1024, 32, 32]
    - [49, 1341.0]
  - - [1024, 1024, 8, 64, 1024, 1024, 64, 64]
    - [60, 1600.0]
  - - [1024, 1024, 8, 128, 1024, 1024, 128, 128]
    - [19, 1746.0]
  - - [1024, 1024, 8, 256, 1024, 1024, 256, 256]
    - [70, 1833.0]
  - - [1024, 1024, 8, 512, 1024, 1024, 512, 512]
    - [55, 1878.0]
  - - [1024, 1024, 8, 1024, 1024, 1024, 1024, 1024]
    - [19, 1901.0]
  - - [1024, 1024, 8, 2048, 1024, 1024, 2048, 2048]
    - [60, 1914.0]
  - - [1024, 2048, 8, 32, 1024, 1024, 32, 32]
    - [2, 1480.0]
  - - [1024, 2048, 8, 64, 1024, 1024, 64, 64]
    - [67, 1687.0]
  - - [1024, 2048, 8, 128, 1024, 1024, 128, 128]
    - [60, 1803.0]
  - - [1024, 2048, 8, 256, 1024, 1024, 256, 256]
    - [51, 1872.0]
  - - [1024, 2048, 8, 512, 1024, 1024, 512, 512]
    - [2, 1904.0]
  - - [1024, 2048, 8, 1024, 1024, 1024, 1024, 1024]
    - [49, 1925.0]
  - - [1024, 2048, 8, 2048, 1024, 1024, 2048, 2048]
    - [2, 1932.0]
  - - [2048, 32, 8, 32, 2048, 2048, 32, 32]
    - [78, 542.0]
  - - [2048, 32, 8, 64, 2048, 2048, 64, 64]
    - [68, 622.0]
  - - [2048, 32, 8, 128, 2048, 2048, 128, 128]
    - [54, 689.0]
  - - [2048, 32, 8, 256, 2048, 2048, 256, 256]
    - [61, 728.0]
  - - [2048, 32, 8, 512, 2048, 2048, 512, 512]
    - [61, 749.0]
  - - [2048, 32, 8, 1024, 2048, 2048, 1024, 1024]
    - [73, 762.0]
  - - [2048, 32, 8, 2048, 2048, 2048, 2048, 2048]
    - [32, 753.0]
  - - [2048, 64, 8, 32, 2048, 2048, 32, 32]
    - [49, 824.0]
  - - [2048, 64, 8, 64, 2048, 2048, 64, 64]
    - [49, 980.0]
  - - [2048, 64, 8, 128, 2048, 2048, 128, 128]
    - [49, 1081.0]
  - - [2048, 64, 8, 256, 2048, 2048, 256, 256]
    - [36, 1136.0]
  - - [2048, 64, 8, 512, 2048, 2048, 512, 512]
    - [60, 1171.0]
  - - [2048, 64, 8, 1024, 2048, 2048, 1024, 1024]
    - [49, 1191.0]
  - - [2048, 64, 8, 2048, 2048, 2048, 2048, 2048]
    - [72, 1196.0]
  - - [2048, 128, 8, 32, 2048, 2048, 32, 32]
    - [79, 1061.0]
  - - [2048, 128, 8, 64, 2048, 2048, 64, 64]
    - [64, 1248.0]
  - - [2048, 128, 8, 128, 2048, 2048, 128, 128]
    - [60, 1380.0]
  - - [2048, 128, 8, 256, 2048, 2048, 256, 256]
    - [80, 1451.0]
  - - [2048, 128, 8, 512, 2048, 2048, 512, 512]
    - [19, 1500.0]
  - - [2048, 128, 8, 1024, 2048, 2048, 1024, 1024]
    - [45, 1520.0]
  - - [2048, 128, 8, 2048, 2048, 2048, 2048, 2048]
    - [51, 1531.0]
  - - [2048, 256, 8, 32, 2048, 2048, 32, 32]
    - [36, 1223.0]
  - - [2048, 256, 8, 64, 2048, 2048, 64, 64]
    - [60, 1435.0]
  - - [2048, 256, 8, 128, 2048, 2048, 128, 128]
    - [49, 1568.0]
  - - [2048, 256, 8, 256, 2048, 2048, 256, 256]
    - [60, 1651.0]
  - - [2048, 256, 8, 512, 2048, 2048, 512, 512]
    - [36, 1691.0]
  - - [2048, 256, 8, 1024, 2048, 2048, 1024, 1024]
    - [72, 1713.0]
  - - [2048, 256, 8, 2048, 2048, 2048, 2048, 2048]
    - [31, 1723.0]
  - - [2048, 512, 8, 32, 2048, 2048, 32, 32]
    - [57, 1320.0]
  - - [2048, 512, 8, 64, 2048, 2048, 64, 64]
    - [51, 1581.0]
  - - [2048, 512, 8, 128, 2048, 2048, 128, 128]
    - [55, 1736.0]
  - - [2048, 512, 8, 256, 2048, 2048, 256, 256]
    - [12, 1825.0]
  - - [2048, 512, 8, 512, 2048, 2048, 512, 512]
    - [57, 1877.0]
  - - [2048, 512, 8, 1024, 2048, 2048, 1024, 1024]
    - [67, 1898.0]
  - - [2048, 512, 8, 2048, 2048, 2048, 2048, 2048]
    - [67, 1910.0]
  - - [2048, 1024, 8, 32, 2048, 2048, 32, 32]
    - [12, 1437.0]
  - - [2048, 1024, 8, 64, 2048, 2048, 64, 64]
    - [49, 1679.0]
  - - [2048, 1024, 8, 128, 2048, 2048, 128, 128]
    - [53, 1791.0]
  - - [2048, 1024, 8, 256, 2048, 2048, 256, 256]
    - [51, 1867.0]
  - - [2048, 1024, 8, 512, 2048, 2048, 512, 512]
    - [57, 1905.0]
  - - [2048, 1024, 8, 1024, 2048, 2048, 1024, 1024]
    - [7, 1920.0]
  - - [2048, 1024, 8, 2048, 2048, 2048, 2048, 2048]
    - [41, 1927.0]
  - - [2048, 2048, 8, 32, 2048, 2048, 32, 32]
    - [51, 1466.0]
  - - [2048, 2048, 8, 64, 2048, 2048, 64, 64]
    - [55, 1734.0]
  - - [2048, 2048, 8, 128, 2048, 2048, 128, 128]
    - [51, 1849.0]
  - - [2048, 2048, 8, 256, 2048, 2048, 256, 256]
    - [60, 1908.0]
  - - [2048, 2048, 8, 512, 2048, 2048, 512, 512]
    - [51, 1941.0]
  - - [2048, 2048, 8, 1024, 2048, 2048, 1024, 1024]
    - [7, 1956.0]
  - - [2048, 2048, 8, 2048, 2048, 2048, 2048, 2048]
    - [60, 1965.0]
- null
