library/src/blas3/Tensile/Logic/asm_full/arcturus_Cijk_Ailk_Bljk_BBH.yaml
- {MinimumRequiredVersion: 4.14.0}
- arcturus
- gfx908
- [Device 7380, Device 7388, Device 738c, Device 7390]
    SolutionIndex: 0
    SolutionNameMin: Cijk_Ailk_Bljk_BBH_MT64x128x8_MI32x32x2x2_SE_GRVW2_ONLL0_SNLL1
    SolutionIndex: 1
    SolutionNameMin: Cijk_Ailk_Bljk_BBH_MT64x128x16_MI32x32x2x2_SE_GRVW2_ONLL0_SNLL1
    SolutionIndex: 2
    SolutionNameMin: Cijk_Ailk_Bljk_BBH_MT64x128x8_MI32x32x2x2_SE_GRVW4_ONLL0_SNLL1
    SolutionIndex: 3
    SolutionNameMin: Cijk_Ailk_Bljk_BBH_MT64x128x16_MI32x32x2x2_SE_GRVW2_ONLL0_SNLL0
    SolutionIndex: 4
    SolutionNameMin: Cijk_Ailk_Bljk_BBH_MT64x128x8_MI32x32x2x2_SE_GRVW4_ONLL0_SNLL0
    SolutionIndex: 5
    SolutionNameMin: Cijk_Ailk_Bljk_BBH_MT64x128x8_MI32x32x2x2_SE_GRVW2_ONLL1_SNLL1
    SolutionIndex: 6
    SolutionNameMin: Cijk_Ailk_Bljk_BBH_MT64x128x16_MI32x32x2x2_SE_GRVW2_ONLL1_SNLL1
    SolutionIndex: 7
    SolutionNameMin: Cijk_Ailk_Bljk_BBH_MT64x128x32_MI32x32x2x2_SE_GRVW2_ONLL1_SNLL1
    SolutionIndex: 8
    SolutionNameMin: Cijk_Ailk_Bljk_BBH_MT64x128x8_MI32x32x2x2_SE_GRVW2_ONLL1_SNLL0
    SolutionIndex: 9
    SolutionNameMin: Cijk_Ailk_Bljk_BBH_MT64x128x16_MI32x32x2x2_SE_GRVW2_ONLL1_SNLL0
    SolutionIndex: 10
    SolutionNameMin: Cijk_Ailk_Bljk_BBH_MT64x128x8_MI32x32x2x2_SE_GRVW4_ONLL1_SNLL0
    SolutionIndex: 11
    SolutionNameMin: Cijk_Ailk_Bljk_BBH_MT32x256x16_MI32x32x2x2_SE_GRVW4_ONLL1_SNLL0
    SolutionIndex: 12
    SolutionNameMin: Cijk_Ailk_Bljk_BBH_MT64x256x16_MI32x32x2x2_SE_GRVW2_ONLL0_SNLL1
    SolutionIndex: 13
    SolutionNameMin: Cijk_Ailk_Bljk_BBH_MT64x256x16_MI32x32x2x2_SE_GRVW2_ONLL1_SNLL1
    SolutionIndex: 14
    SolutionNameMin: Cijk_Ailk_Bljk_BBH_MT64x256x16_MI32x32x2x2_SE_GRVW2_ONLL1_SNLL0
- - - [74, 512, 1, 2048, 74, 74, 74, 2048]
    - [9, 410.988]
  - - [100, 512, 1, 2048, 100, 100, 100, 2048]
    - [1, 556.333]
  - - [256, 8976, 1, 1536, 256, 256, 256, 1536]
    - [9, 15042.2]
  - - [256, 8976, 1, 2048, 256, 256, 256, 2048]
    - [1, 9963.61]
  - - [256, 8976, 1, 2304, 256, 256, 256, 2304]
    - [0, 15749.2]
  - - [256, 8976, 1, 2560, 256, 256, 256, 2560]
    - [3, 15648.3]
  - - [256, 8976, 1, 2816, 256, 256, 256, 2816]
    - [0, 15881.5]
  - - [256, 8976, 1, 3072, 256, 256, 256, 3072]
    - [3, 15332.3]
  - - [256, 8976, 1, 4352, 256, 256, 256, 4352]
    - [10, 16123.2]
  - - [256, 8976, 1, 4864, 256, 256, 256, 4864]
    - [4, 16043.8]
  - - [256, 8976, 1, 5376, 256, 256, 256, 5376]
    - [2, 16100.1]
  - - [256, 8976, 1, 5632, 256, 256, 256, 5632]
    - [3, 16096.4]
  - - [256, 8976, 1, 5888, 256, 256, 256, 5888]
    - [4, 16116.1]
  - - [256, 8976, 1, 6144, 256, 256, 256, 6144]
    - [3, 12825.2]
  - - [256, 8976, 1, 6656, 256, 256, 256, 6656]
    - [9, 16177.2]
  - - [256, 8976, 1, 7168, 256, 256, 256, 7168]
    - [3, 15907.3]
  - - [256, 8976, 1, 7424, 256, 256, 256, 7424]
    - [3, 15850.8]
  - - [256, 8976, 1, 8192, 256, 256, 256, 8192]
    - [3, 9042.02]
  - - [256, 8976, 1, 8448, 256, 256, 256, 8448]
    - [9, 16283.3]
  - - [256, 8976, 1, 8960, 256, 256, 256, 8960]
    - [1, 16180.1]
  - - [256, 8976, 1, 9472, 256, 256, 256, 9472]
    - [9, 16193.5]
  - - [256, 8976, 1, 9728, 256, 256, 256, 9728]
    - [1, 15957.7]
  - - [256, 8976, 1, 9984, 256, 256, 256, 9984]
    - [3, 16104.5]
  - - [256, 8976, 1, 10240, 256, 256, 256, 10240]
    - [9, 13574.8]
  - - [256, 8976, 1, 10496, 256, 256, 256, 10496]
    - [1, 15569.0]
  - - [256, 8976, 1, 11008, 256, 256, 256, 11008]
    - [6, 16094.9]
  - - [256, 8976, 1, 11520, 256, 256, 256, 11520]
    - [9, 15470.2]
  - - [256, 8976, 1, 12288, 256, 256, 256, 12288]
    - [6, 10547.5]
  - - [256, 8976, 1, 14336, 256, 256, 256, 14336]
    - [9, 13873.4]
  - - [256, 8976, 1, 14848, 256, 256, 256, 14848]
    - [1, 14700.7]
  - - [256, 8976, 1, 15104, 256, 256, 256, 15104]
    - [1, 14511.5]
  - - [256, 8976, 1, 15872, 256, 256, 256, 15872]
    - [3, 14427.1]
  - - [256, 8976, 1, 17152, 256, 256, 256, 17152]
    - [3, 12155.2]
  - - [256, 8976, 1, 19712, 256, 256, 256, 19712]
    - [14, 9629.44]
  - - [256, 8976, 1, 19968, 256, 256, 256, 19968]
    - [13, 9612.59]
  - - [256, 8976, 1, 20480, 256, 256, 256, 20480]
    - [3, 11634.7]
  - - [256, 8976, 1, 20992, 256, 256, 256, 20992]
    - [12, 9521.04]
  - - [256, 8976, 1, 22016, 256, 256, 256, 22016]
    - [12, 9567.16]
  - - [256, 8976, 1, 26112, 256, 256, 256, 26112]
    - [14, 9476.3]
  - - [256, 8976, 1, 33536, 256, 256, 256, 33536]
    - [7, 8813.01]
  - - [512, 200, 1, 32, 512, 512, 512, 32]
    - [8, 181.239]
  - - [512, 215, 1, 2048, 512, 512, 512, 2048]
    - [3, 1165.45]
  - - [512, 256, 1, 2048, 512, 512, 512, 2048]
    - [3, 1403.95]
  - - [512, 1600, 1, 32, 512, 512, 512, 32]
    - [11, 1689.07]
  - - [512, 1600, 1, 512, 512, 512, 512, 512]
    - [11, 7231.56]
  - - [560, 200, 1, 1024, 560, 560, 560, 1024]
    - [3, 1148.72]
  - - [560, 1600, 1, 1024, 560, 560, 560, 1024]
    - [3, 9059.08]
  - - [768, 215, 1, 2048, 768, 768, 768, 2048]
    - [3, 1752.52]
  - - [768, 256, 1, 2048, 768, 768, 768, 2048]
    - [3, 2118.34]
  - - [1024, 512, 1, 64, 1024, 1024, 1024, 64]
    - [5, 1784.81]
  - - [1024, 512, 1, 1024, 1024, 1024, 1024, 1024]
    - [3, 5242.88]
  - - [1024, 1600, 1, 1024, 1024, 1024, 1024, 1024]
    - [4, 13156.5]
  - - [1024, 1792, 1, 256, 1024, 1024, 1024, 256]
    - [3, 10176.8]
  - - [1024, 2048, 1, 256, 1024, 1024, 1024, 256]
    - [8, 10122.0]
  - - [1024, 2560, 1, 256, 1024, 1024, 1024, 256]
    - [9, 11444.2]
  - - [1024, 3072, 1, 256, 1024, 1024, 1024, 256]
    - [3, 11413.1]
  - - [1024, 3328, 1, 256, 1024, 1024, 1024, 256]
    - [3, 12090.0]
  - - [1024, 3840, 1, 256, 1024, 1024, 1024, 256]
    - [3, 13662.2]
  - - [1024, 4096, 1, 256, 1024, 1024, 1024, 256]
    - [3, 11481.4]
  - - [1024, 4608, 1, 256, 1024, 1024, 1024, 256]
    - [3, 12699.3]
  - - [1024, 4864, 1, 256, 1024, 1024, 1024, 256]
    - [9, 12241.4]
  - - [1024, 5120, 1, 256, 1024, 1024, 1024, 256]
    - [9, 12548.4]
  - - [1024, 5632, 1, 256, 1024, 1024, 1024, 256]
    - [3, 13700.8]
  - - [1024, 6144, 1, 256, 1024, 1024, 1024, 256]
    - [9, 13457.7]
  - - [1024, 6400, 1, 256, 1024, 1024, 1024, 256]
    - [3, 13733.8]
  - - [1024, 7168, 1, 256, 1024, 1024, 1024, 256]
    - [3, 13906.5]
  - - [1024, 7424, 1, 256, 1024, 1024, 1024, 256]
    - [3, 14318.4]
  - - [1024, 7680, 1, 256, 1024, 1024, 1024, 256]
    - [9, 14496.4]
  - - [1024, 7936, 1, 256, 1024, 1024, 1024, 256]
    - [3, 13672.3]
  - - [1024, 8192, 1, 256, 1024, 1024, 1024, 256]
    - [3, 13887.0]
  - - [1024, 8448, 1, 256, 1024, 1024, 1024, 256]
    - [3, 14225.3]
  - - [1024, 8704, 1, 256, 1024, 1024, 1024, 256]
    - [9, 13940.0]
  - - [1024, 8960, 1, 256, 1024, 1024, 1024, 256]
    - [3, 14047.9]
  - - [1024, 9728, 1, 256, 1024, 1024, 1024, 256]
    - [3, 14218.0]
  - - [1024, 9984, 1, 256, 1024, 1024, 1024, 256]
    - [3, 14437.6]
  - - [1024, 10240, 1, 256, 1024, 1024, 1024, 256]
    - [3, 14525.7]
  - - [1024, 10496, 1, 256, 1024, 1024, 1024, 256]
    - [9, 14666.6]
  - - [1024, 11008, 1, 256, 1024, 1024, 1024, 256]
    - [3, 14591.8]
  - - [1024, 11264, 1, 256, 1024, 1024, 1024, 256]
    - [9, 14746.3]
  - - [1024, 11520, 1, 256, 1024, 1024, 1024, 256]
    - [3, 14597.3]
  - - [1024, 12288, 1, 256, 1024, 1024, 1024, 256]
    - [3, 14700.7]
  - - [1024, 13312, 1, 256, 1024, 1024, 1024, 256]
    - [3, 14867.3]
  - - [1024, 13568, 1, 256, 1024, 1024, 1024, 256]
    - [3, 14726.6]
  - - [1024, 14336, 1, 256, 1024, 1024, 1024, 256]
    - [9, 14643.5]
  - - [1024, 14592, 1, 256, 1024, 1024, 1024, 256]
    - [9, 14867.9]
  - - [1024, 14848, 1, 256, 1024, 1024, 1024, 256]
    - [3, 14975.0]
  - - [1024, 15104, 1, 256, 1024, 1024, 1024, 256]
    - [9, 14912.0]
  - - [1024, 16128, 1, 256, 1024, 1024, 1024, 256]
    - [3, 14886.8]
  - - [1024, 17152, 1, 256, 1024, 1024, 1024, 256]
    - [9, 14975.7]
  - - [1024, 18944, 1, 256, 1024, 1024, 1024, 256]
    - [9, 15088.9]
  - - [1024, 19712, 1, 256, 1024, 1024, 1024, 256]
    - [3, 15180.3]
  - - [1024, 19968, 1, 256, 1024, 1024, 1024, 256]
    - [3, 15059.0]
  - - [1024, 20480, 1, 256, 1024, 1024, 1024, 256]
    - [9, 15217.4]
  - - [1024, 20992, 1, 256, 1024, 1024, 1024, 256]
    - [9, 15068.3]
  - - [1024, 21504, 1, 256, 1024, 1024, 1024, 256]
    - [9, 15196.1]
  - - [1024, 22016, 1, 256, 1024, 1024, 1024, 256]
    - [3, 15136.8]
  - - [1024, 23552, 1, 256, 1024, 1024, 1024, 256]
    - [3, 15203.9]
  - - [1024, 28672, 1, 256, 1024, 1024, 1024, 256]
    - [3, 15286.8]
  - - [1024, 33536, 1, 256, 1024, 1024, 1024, 256]
    - [9, 15406.0]
  - - [1024, 40448, 1, 256, 1024, 1024, 1024, 256]
    - [3, 15429.6]
  - - [1600, 512, 1, 1024, 1600, 1600, 1600, 1024]
    - [9, 8348.54]
  - - [2048, 512, 1, 2048, 2048, 2048, 2048, 2048]
    - [3, 8879.77]
  - - [2048, 1024, 1, 256, 2048, 2048, 2048, 256]
    - [0, 9020.01]
  - - [3200, 1024, 1, 2048, 3200, 3200, 3200, 2048]
    - [3, 17652.8]
- null
