library/src/blas3/Tensile/Logic/asm_full/arcturus_Cijk_Ailk_Bjlk_HBH.yaml
- {MinimumRequiredVersion: 4.6.0}
- arcturus
- gfx908
- [Device 7380, Device 7388, Device 738c, Device 7390]
    SolutionIndex: 0
    SolutionNameMin: Cijk_Ailk_Bjlk_HBH_MT016x016x08_PGR1_PLR1_TT02_02
    SolutionIndex: 1
    SolutionNameMin: Cijk_Ailk_Bjlk_HBH_MT016x016x16_PGR1_PLR1_TT02_02
    SolutionIndex: 2
    SolutionNameMin: Cijk_Ailk_Bjlk_HBH_MT032x016x16_PGR1_PLR1_TT04_02
    SolutionIndex: 3
    SolutionNameMin: Cijk_Ailk_Bjlk_HBH_MT016x016x24_PGR1_PLR1_TT02_02
    SolutionIndex: 4
    SolutionNameMin: Cijk_Ailk_Bjlk_HBH_MT032x016x24_PGR1_PLR1_TT04_02
    SolutionIndex: 5
    SolutionNameMin: Cijk_Ailk_Bjlk_HBH_MT016x016x32_PGR1_PLR1_TT02_02
    SolutionIndex: 6
    SolutionNameMin: Cijk_Ailk_Bjlk_HBH_MT032x016x32_PGR1_PLR1_TT02_02
    SolutionIndex: 7
    SolutionNameMin: Cijk_Ailk_Bjlk_HBH_MT064x016x32_PGR1_PLR1_TT02_02
    SolutionIndex: 8
    SolutionNameMin: Cijk_Ailk_Bjlk_HBH_MT016x016x32_PGR1_PLR1_TT02_02
    SolutionIndex: 9
    SolutionNameMin: Cijk_Ailk_Bjlk_HBH_MT064x016x32_PGR1_PLR1_TT02_02
    SolutionIndex: 10
    SolutionNameMin: Cijk_Ailk_Bjlk_HBH_MT016x016x64_PGR1_PLR1_TT02_02
    SolutionIndex: 11
    SolutionNameMin: Cijk_Ailk_Bjlk_HBH_MT032x016x64_PGR1_PLR1_TT02_02
    SolutionIndex: 12
    SolutionNameMin: Cijk_Ailk_Bjlk_HBH_MT064x016x64_PGR1_PLR1_TT02_02
    SolutionIndex: 13
    SolutionNameMin: Cijk_Ailk_Bjlk_HBH_MT016x016x64_PGR1_PLR1_TT02_02
    SolutionIndex: 14
    SolutionNameMin: Cijk_Ailk_Bjlk_HBH_MT032x016x64_PGR1_PLR1_TT02_02
    SolutionIndex: 15
    SolutionNameMin: Cijk_Ailk_Bjlk_HBH_MT032x032x08_PGR1_PLR1_TT02_02
    SolutionIndex: 16
    SolutionNameMin: Cijk_Ailk_Bjlk_HBH_MT032x032x16_PGR1_PLR1_TT02_02
    SolutionIndex: 17
    SolutionNameMin: Cijk_Ailk_Bjlk_HBH_MT032x032x32_PGR1_PLR1_TT02_02
    SolutionIndex: 18
    SolutionNameMin: Cijk_Ailk_Bjlk_HBH_MT032x032x64_PGR1_PLR1_TT02_02
    SolutionIndex: 19
    SolutionNameMin: Cijk_Ailk_Bjlk_HBH_MT064x064x04_PGR0_PLR1_TT04_04
    SolutionIndex: 20
    SolutionNameMin: Cijk_Ailk_Bjlk_HBH_MT064x064x04_PGR1_PLR1_TT04_04
    SolutionIndex: 21
    SolutionNameMin: Cijk_Ailk_Bjlk_HBH_MT064x064x08_PGR0_PLR1_TT04_04
    SolutionIndex: 22
    SolutionNameMin: Cijk_Ailk_Bjlk_HBH_MT064x064x16_PGR1_PLR1_TT04_04
    SolutionIndex: 23
    SolutionNameMin: Cijk_Ailk_Bjlk_HBH_MT064x032x16_PGR1_PLR1_TT04_04
    SolutionIndex: 24
    SolutionNameMin: Cijk_Ailk_Bjlk_HBH_MT128x032x32_PGR1_PLR1_TT04_04
    SolutionIndex: 25
    SolutionNameMin: Cijk_Ailk_Bjlk_HBH_MT128x016x32_PGR1_PLR1_TT04_04
    SolutionIndex: 26
    SolutionNameMin: Cijk_Ailk_Bjlk_HBH_MT064x064x08_PGR1_PLR1_TT08_08
    SolutionIndex: 27
    SolutionNameMin: Cijk_Ailk_Bjlk_HBH_MT064x064x16_PGR1_PLR1_TT08_08
    SolutionIndex: 28
    SolutionNameMin: Cijk_Ailk_Bjlk_HBH_MT064x128x16_PGR1_PLR1_TT04_08
    SolutionIndex: 29
    SolutionNameMin: Cijk_Ailk_Bjlk_HBH_MT128x128x16_PGR1_PLR1_TT08_08
    SolutionIndex: 30
    SolutionNameMin: Cijk_Ailk_Bjlk_HBH_MT064x128x04_PGR0_PLR0_TT04_08
    SolutionIndex: 31
    SolutionNameMin: Cijk_Ailk_Bjlk_HBH_MT064x064x08_PGR0_PLR1_TT04_04
    SolutionIndex: 32
    SolutionNameMin: Cijk_Ailk_Bjlk_HBH_MT064x128x16_PGR1_PLR1_TT04_08
    SolutionIndex: 33
    SolutionNameMin: Cijk_Ailk_Bjlk_HBH_MT128x128x04_PGR0_PLR1_TT08_08
    SolutionIndex: 34
    SolutionNameMin: Cijk_Ailk_Bjlk_HBH_MT064x064x08_PGR1_PLR0_TT04_04
    SolutionIndex: 35
    SolutionNameMin: Cijk_Ailk_Bjlk_HBH_MT064x128x16_PGR0_PLR1_TT04_08
    SolutionIndex: 36
    SolutionNameMin: Cijk_Ailk_Bjlk_HBH_MT064x128x16_EPS1_GRVW04_PGR1_PLR1_SNLL1_TT08_04_VW04_WG08_32_01_WGM01
    SolutionIndex: 37
    SolutionNameMin: Cijk_Ailk_Bjlk_HBH_MT128x128x16_EPS1_GRVW04_PGR1_PLR1_SNLL1_TT08_08_VW04_WG16_16_01_WGM01
    SolutionIndex: 38
    SolutionNameMin: Cijk_Ailk_Bjlk_HBH_MT064x128x16_EPS1_GRVW04_PGR1_PLR1_SNLL1_TT08_04_VW04_WG08_32_01_WGM08
    SolutionIndex: 39
    SolutionNameMin: Cijk_Ailk_Bjlk_HBH_MT128x064x16_EPS1_GRVW04_PGR1_PLR1_SNLL1_TT08_04_VW04_WG16_16_01_WGM08
    SolutionIndex: 40
    SolutionNameMin: Cijk_Ailk_Bjlk_HBH_MT128x128x16_EPS1_GRVW04_PGR1_PLR1_SNLL1_TT08_08_VW04_WG16_16_01_WGM08
    SolutionIndex: 41
    SolutionNameMin: Cijk_Ailk_Bjlk_HBH_MT064x064x32_EPS0_GRVW04_PGR0_PLR0_SNLL0_TT04_04_VW04_WG16_16_01_WGM01
    SolutionIndex: 42
    SolutionNameMin: Cijk_Ailk_Bjlk_HBH_MT128x064x16_EPS1_GRVW08_PGR1_PLR1_SNLL1_TT08_08_VW08_WG16_08_01_WGM64
    SolutionIndex: 43
    SolutionNameMin: Cijk_Ailk_Bjlk_HBH_MT128x128x32_EPS1_GRVW08_PGR1_PLR1_SNLL1_TT08_08_VW08_WG16_16_01_WGM64
    SolutionIndex: 44
    SolutionNameMin: Cijk_Ailk_Bjlk_HBH_MT32x256x16_MI32x32x4x2_SE_AF0EM2_ASEM2_ONLL0_SNLL0
    SolutionIndex: 45
    SolutionNameMin: Cijk_Ailk_Bjlk_HBH_MT64x128x16_MI32x32x4x2_SE_AF0EM1_ASEM2_ONLL1_SNLL1
    SolutionIndex: 46
    SolutionNameMin: Cijk_Ailk_Bjlk_HBH_MT64x128x16_MI32x32x4x2_SE_AF0EM2_ASEM2_ONLL1_SNLL0
    SolutionIndex: 47
    SolutionNameMin: Cijk_Ailk_Bjlk_HBH_MT64x256x16_MI32x32x4x2_SE_AF0EM1_ASEM1_ONLL0_SNLL0
    SolutionIndex: 48
    SolutionIndex: 49
    SolutionIndex: 50
    SolutionIndex: 51
    SolutionIndex: 52
    SolutionIndex: 53
    SolutionIndex: 54
    SolutionIndex: 55
    SolutionIndex: 56
    SolutionIndex: 57
    SolutionIndex: 58
    SolutionIndex: 59
    SolutionIndex: 60
    SolutionIndex: 61
    SolutionIndex: 62
    SolutionIndex: 63
    SolutionIndex: 64
    SolutionIndex: 65
    SolutionIndex: 66
    SolutionIndex: 67
    SolutionIndex: 68
    SolutionIndex: 69
    SolutionIndex: 70
    SolutionIndex: 71
    SolutionIndex: 72
    SolutionIndex: 73
    SolutionIndex: 74
    SolutionIndex: 75
    SolutionIndex: 76
    SolutionIndex: 77
    SolutionIndex: 78
    SolutionIndex: 79
    SolutionIndex: 80
    SolutionIndex: 81
    SolutionIndex: 82
    SolutionIndex: 83
    SolutionIndex: 84
    SolutionIndex: 85
    SolutionIndex: 86
    SolutionIndex: 87
    SolutionIndex: 88
    SolutionIndex: 89
    SolutionIndex: 90
    SolutionIndex: 91
    SolutionIndex: 92
    SolutionIndex: 93
    SolutionIndex: 94
    SolutionIndex: 95
    SolutionIndex: 96
    SolutionIndex: 97
    SolutionIndex: 98
    SolutionIndex: 99
    SolutionIndex: 100
    SolutionIndex: 101
    SolutionIndex: 102
    SolutionIndex: 103
    SolutionIndex: 104
    SolutionIndex: 105
    SolutionIndex: 106
    SolutionIndex: 107
    SolutionIndex: 108
    SolutionIndex: 109
    SolutionIndex: 110
    SolutionIndex: 111
    SolutionIndex: 112
    SolutionIndex: 113
    SolutionIndex: 114
    SolutionIndex: 115
    SolutionIndex: 116
    SolutionIndex: 117
    SolutionIndex: 118
    SolutionIndex: 119
    SolutionIndex: 120
    SolutionIndex: 121
    SolutionIndex: 122
    SolutionIndex: 123
    SolutionIndex: 124
    SolutionIndex: 125
    SolutionIndex: 126
    SolutionIndex: 127
    SolutionIndex: 128
    SolutionIndex: 129
    SolutionIndex: 130
    SolutionIndex: 131
    SolutionIndex: 132
    SolutionIndex: 133
    SolutionIndex: 134
    SolutionIndex: 135
    SolutionIndex: 136
    SolutionIndex: 137
    SolutionIndex: 138
    SolutionIndex: 139
    SolutionIndex: 140
    SolutionNameMin: Cijk_Ailk_Bjlk_HBH_MT256x256x32_MI32x32x8x1_SE_AF0EM4_GRVW8_NLCA1_NLCB1_SU0_SUS256_SRVW4_TT4_128_WG64_4_1_WGM15
    SolutionIndex: 141
    SolutionNameMin: Cijk_Ailk_Bjlk_HBH_MT64x128x16_MI32x32x4x2_SE_AF0EM4_GRVW2_NLCA1_NLCB1_SU16_SUS256_SRVW4_TT1_32_WG64_4_1_WGM2
    SolutionIndex: 142
    SolutionNameMin: Cijk_Ailk_Bjlk_HBH_MT32x64x16_MI16x16x16x1_SE_AF0EM4_GRVW4_NLCA1_NLCB1_SU0_SUS256_SRVW4_TT1_32_WG32_8_1_WGM1
    SolutionIndex: 143
    SolutionNameMin: Cijk_Ailk_Bjlk_HBH_MT128x288x32_MI32x32x8x1_SE_AF0EM4_GRVW2_NLCA1_NLCB9_SU32_SUS128_SRVW4_TT1_288_WG128_2_1_WGM15
    SolutionIndex: 144
    SolutionNameMin: Cijk_Ailk_Bjlk_HBH_MT128x128x16_MI32x32x8x1_SE_AF0EM1_GRVW8_NLCA1_NLCB1_SU32_SUS128_SRVW4_TT2_64_WG64_4_1_WGM15
    SolutionIndex: 145
    SolutionNameMin: Cijk_Ailk_Bjlk_HBH_MT32x32x16_MI16x16x16x1_SE_AF0EM4_GRVW2_NLCA1_NLCB1_SU0_SUS256_SRVW0_TT1_16_WG32_8_1_WGM2
    SolutionIndex: 146
    SolutionNameMin: Cijk_Ailk_Bjlk_HBH_MT32x32x64_MI16x16x16x1_SE_AF0EM1_GRVW8_NLCA1_NLCB1_SU0_SUS256_SRVW0_TT1_16_WG32_8_1_WGM2
    SolutionIndex: 147
    SolutionNameMin: Cijk_Ailk_Bjlk_HBH_MT32x32x16_MI16x16x16x1_SE_AF0EM1_GRVW2_NLCA1_NLCB1_SU0_SUS256_SRVW0_TT1_16_WG32_8_1_WGM1
    SolutionIndex: 148
    SolutionNameMin: Cijk_Ailk_Bjlk_HBH_MT64x32x16_MI16x16x16x1_SE_AF0EM4_GRVW2_NLCA1_NLCB1_SU16_SUS128_SRVW0_TT2_16_WG32_8_1_WGM1
    SolutionIndex: 149
    SolutionNameMin: Cijk_Ailk_Bjlk_HBH_MT32x32x128_MI16x16x16x1_SE_AF0EM1_GRVW8_NLCA1_NLCB1_SU16_SUS256_SRVW0_TT1_16_WG32_8_1_WGM1
    SolutionIndex: 150
    SolutionNameMin: Cijk_Ailk_Bjlk_HBH_MT64x128x16_MI32x32x8x1_SE_AF0EM1_GRVW4_NLCA1_NLCB1_SU0_SUS256_SRVW4_TT1_64_WG64_4_1_WGM15
    SolutionIndex: 151
    SolutionNameMin: Cijk_Ailk_Bjlk_HBH_MT64x64x32_MI32x32x8x1_SE_AF0EM1_GRVW4_NLCA1_NLCB1_SU0_SUS256_SRVW4_TT1_32_WG64_4_1_WGM15
    SolutionIndex: 152
    SolutionNameMin: Cijk_Ailk_Bjlk_HBH_MT256x128x32_MI32x32x8x1_SE_AF0EM1_GRVW8_NLCA1_NLCB1_SU0_SUS256_SRVW4_TT4_64_WG64_4_1_WGM15
    SolutionIndex: 153
    SolutionNameMin: Cijk_Ailk_Bjlk_HBH_MT128x96x64_MI32x32x8x1_SE_AF0EM4_GRVW4_NLCA1_NLCB3_SU32_SUS256_SRVW4_TT1_96_WG128_2_1_WGM15
    SolutionIndex: 154
    SolutionNameMin: Cijk_Ailk_Bjlk_HBH_MT64x32x16_MI16x16x16x1_SE_AF0EM4_GRVW4_NLCA1_NLCB1_SU32_SUS256_SRVW0_TT2_16_WG32_8_1_WGM15
    SolutionIndex: 155
    SolutionNameMin: Cijk_Ailk_Bjlk_HBH_MT128x128x32_MI32x32x8x1_SE_AF0EM4_GRVW8_NLCA1_NLCB1_SU16_SUS128_SRVW4_TT2_64_WG64_4_1_WGM15
    SolutionIndex: 156
    SolutionNameMin: Cijk_Ailk_Bjlk_HBH_MT64x64x32_MI32x32x8x1_SE_AF0EM1_GRVW8_NLCA1_NLCB1_SU32_SUS256_SRVW4_TT1_32_WG64_4_1_WGM15
    SolutionIndex: 157
    SolutionNameMin: Cijk_Ailk_Bjlk_HBH_MT32x64x16_MI16x16x16x1_SE_AF0EM4_GRVW4_NLCA1_NLCB1_SU0_SUS256_SRVW0_TT1_32_WG32_8_1_WGM1
    SolutionIndex: 158
    SolutionNameMin: Cijk_Ailk_Bjlk_HBH_MT128x64x16_MI32x32x4x2_SE_AF0EM1_GRVW4_NLCA1_NLCB1_SU0_SUS256_SRVW4_TT1_32_WG128_2_1_WGM2
    SolutionIndex: 159
    SolutionNameMin: Cijk_Ailk_Bjlk_HBH_MT64x64x16_MI32x32x8x1_SE_AF0EM4_GRVW2_NLCA1_NLCB1_SU32_SUS256_SRVW4_TT1_32_WG64_4_1_WGM1
    SolutionIndex: 160
    SolutionNameMin: Cijk_Ailk_Bjlk_HBH_MT128x64x16_MI32x32x8x1_SE_AF0EM4_GRVW4_NLCA1_NLCB1_SU0_SUS256_SRVW4_TT2_32_WG64_4_1_WGM15
    SolutionIndex: 161
    SolutionNameMin: Cijk_Ailk_Bjlk_HBH_MT32x32x64_MI16x16x16x1_SE_AF0EM4_GRVW2_NLCA1_NLCB1_SU16_SUS256_SRVW0_TT1_16_WG32_8_1_WGM1
    SolutionIndex: 162
    SolutionNameMin: Cijk_Ailk_Bjlk_HBH_MT64x64x128_MI32x32x8x1_SE_AF0EM4_GRVW8_NLCA1_NLCB1_SU32_SUS256_SRVW4_TT1_32_WG64_4_1_WGM15
    SolutionIndex: 163
    SolutionNameMin: Cijk_Ailk_Bjlk_HBH_MT32x64x16_MI16x16x16x1_SE_AF0EM1_GRVW4_NLCA1_NLCB1_SU0_SUS256_SRVW0_TT1_32_WG32_8_1_WGM1
    SolutionIndex: 164
    SolutionNameMin: Cijk_Ailk_Bjlk_HBH_MT256x256x16_MI32x32x4x2_SE_AF0EM4_GRVW8_NLCA1_NLCB1_SU0_SUS256_SRVW4_TT2_128_WG128_2_1_WGM15
    SolutionIndex: 165
    SolutionNameMin: Cijk_Ailk_Bjlk_HBH_MT32x64x16_MI16x16x16x1_SE_AF0EM1_GRVW2_NLCA1_NLCB1_SU0_SUS256_SRVW4_TT1_32_WG32_8_1_WGM2
    SolutionIndex: 166
    SolutionNameMin: Cijk_Ailk_Bjlk_HBH_MT128x128x32_MI32x32x8x1_SE_AF0EM4_GRVW8_NLCA1_NLCB1_SU32_SUS128_SRVW4_TT2_64_WG64_4_1_WGM15
    SolutionIndex: 167
    SolutionNameMin: Cijk_Ailk_Bjlk_HBH_MT32x64x16_MI16x16x16x1_SE_AF0EM1_GRVW2_NLCA1_NLCB1_SU32_SUS128_SRVW4_TT1_32_WG32_8_1_WGM15
    SolutionIndex: 168
    SolutionNameMin: Cijk_Ailk_Bjlk_HBH_MT64x64x64_MI32x32x8x1_SE_AF0EM4_GRVW4_NLCA1_NLCB1_SU32_SUS128_SRVW4_TT1_32_WG64_4_1_WGM15
    SolutionIndex: 169
    SolutionNameMin: Cijk_Ailk_Bjlk_HBH_MT256x256x32_MI32x32x8x1_SE_AF0EM4_GRVW8_NLCA1_NLCB1_SU16_SUS128_SRVW4_TT4_128_WG64_4_1_WGM15
    SolutionIndex: 170
    SolutionNameMin: Cijk_Ailk_Bjlk_HBH_MT64x32x16_MI16x16x16x1_SE_AF0EM4_GRVW2_NLCA1_NLCB1_SU0_SUS256_SRVW4_TT2_16_WG32_8_1_WGM1
    SolutionIndex: 171
    SolutionNameMin: Cijk_Ailk_Bjlk_HBH_MT64x64x128_MI32x32x8x1_SE_AF0EM4_GRVW8_NLCA1_NLCB1_SU32_SUS256_SRVW4_TT1_32_WG64_4_1_WGM2
    SolutionIndex: 172
    SolutionNameMin: Cijk_Ailk_Bjlk_HBH_MT64x32x16_MI16x16x16x1_SE_AF0EM4_GRVW2_NLCA1_NLCB1_SU32_SUS128_SRVW4_TT2_16_WG32_8_1_WGM1
    SolutionIndex: 173
    SolutionNameMin: Cijk_Ailk_Bjlk_HBH_MT128x128x64_MI32x32x8x1_SE_AF0EM1_GRVW8_NLCA1_NLCB1_SU16_SUS128_SRVW4_TT2_64_WG64_4_1_WGM2
    SolutionIndex: 174
    SolutionNameMin: Cijk_Ailk_Bjlk_HBH_MT32x64x16_MI16x16x16x1_SE_AF0EM1_GRVW2_NLCA1_NLCB1_SU16_SUS256_SRVW0_TT1_32_WG32_8_1_WGM2
    SolutionIndex: 175
    SolutionNameMin: Cijk_Ailk_Bjlk_HBH_MT64x128x16_MI32x32x4x2_SE_AF0EM1_GRVW2_NLCA1_NLCB1_SU32_SUS128_SRVW4_TT1_32_WG64_4_1_WGM2
    SolutionIndex: 176
    SolutionNameMin: Cijk_Ailk_Bjlk_HBH_MT256x128x32_MI32x32x8x1_SE_AF0EM4_GRVW8_NLCA1_NLCB1_SU0_SUS256_SRVW4_TT4_64_WG64_4_1_WGM2
    SolutionIndex: 177
    SolutionNameMin: Cijk_Ailk_Bjlk_HBH_MT64x64x64_MI32x32x8x1_SE_AF0EM1_GRVW8_NLCA1_NLCB1_SU0_SUS256_SRVW4_TT1_32_WG64_4_1_WGM1
    SolutionIndex: 178
    SolutionNameMin: Cijk_Ailk_Bjlk_HBH_MT128x128x64_MI32x32x8x1_SE_AF0EM4_GRVW8_NLCA1_NLCB1_SU0_SUS256_SRVW4_TT2_64_WG64_4_1_WGM2
    SolutionIndex: 179
    SolutionNameMin: Cijk_Ailk_Bjlk_HBH_MT128x128x32_MI32x32x8x1_SE_AF0EM4_GRVW8_NLCA1_NLCB1_SU32_SUS128_SRVW4_TT2_64_WG64_4_1_WGM2
    SolutionIndex: 180
    SolutionNameMin: Cijk_Ailk_Bjlk_HBH_MT64x64x128_MI32x32x8x1_SE_AF0EM4_GRVW8_NLCA1_NLCB1_SU32_SUS256_SRVW4_TT1_32_WG64_4_1_WGM1
    SolutionIndex: 181
    SolutionNameMin: Cijk_Ailk_Bjlk_HBH_MT128x288x32_MI32x32x8x1_SE_AF0EM4_GRVW4_NLCA1_NLCB9_SU32_SUS256_SRVW4_TT1_288_WG128_2_1_WGM15
    SolutionIndex: 182
    SolutionNameMin: Cijk_Ailk_Bjlk_HBH_MT32x32x16_MI16x16x16x1_SE_AF0EM1_GRVW8_NLCA1_NLCB1_SU0_SUS256_SRVW0_TT1_16_WG32_8_1_WGM1
    SolutionIndex: 183
    SolutionNameMin: Cijk_Ailk_Bjlk_HBH_MT64x64x16_MI32x32x8x1_SE_AF0EM4_GRVW4_NLCA1_NLCB1_SU0_SUS256_SRVW4_TT1_32_WG64_4_1_WGM15
    SolutionIndex: 184
    SolutionNameMin: Cijk_Ailk_Bjlk_HBH_MT32x32x64_MI16x16x16x1_SE_AF0EM4_GRVW8_NLCA1_NLCB1_SU16_SUS128_SRVW0_TT1_16_WG32_8_1_WGM1
    SolutionIndex: 185
    SolutionNameMin: Cijk_Ailk_Bjlk_HBH_MT256x256x16_MI32x32x4x2_SE_AF0EM4_GRVW8_NLCA1_NLCB1_SU0_SUS256_SRVW4_TT2_128_WG128_2_1_WGM1
    SolutionIndex: 186
    SolutionNameMin: Cijk_Ailk_Bjlk_HBH_MT64x64x16_MI32x32x8x1_SE_AF0EM4_GRVW2_NLCA1_NLCB1_SU0_SUS256_SRVW4_TT1_32_WG64_4_1_WGM2
    SolutionIndex: 187
    SolutionNameMin: Cijk_Ailk_Bjlk_HBH_MT32x64x16_MI16x16x16x1_SE_AF0EM1_GRVW2_NLCA1_NLCB1_SU32_SUS256_SRVW0_TT1_32_WG32_8_1_WGM1
    SolutionIndex: 188
    SolutionNameMin: Cijk_Ailk_Bjlk_HBH_MT64x32x16_MI16x16x16x1_SE_AF0EM4_GRVW2_NLCA1_NLCB1_SU0_SUS256_SRVW0_TT2_16_WG32_8_1_WGM1
    SolutionIndex: 189
    SolutionNameMin: Cijk_Ailk_Bjlk_HBH_MT64x64x16_MI32x32x8x1_SE_AF0EM4_GRVW2_NLCA1_NLCB1_SU0_SUS256_SRVW4_TT1_32_WG64_4_1_WGM15
    SolutionIndex: 190
    SolutionNameMin: Cijk_Ailk_Bjlk_HBH_MT64x64x128_MI32x32x8x1_SE_AF0EM1_GRVW8_NLCA1_NLCB1_SU16_SUS256_SRVW0_TT1_32_WG64_4_1_WGM15
    SolutionIndex: 191
    SolutionNameMin: Cijk_Ailk_Bjlk_HBH_MT64x64x16_MI32x32x8x1_SE_AF0EM4_GRVW4_NLCA1_NLCB1_SU0_SUS256_SRVW4_TT1_32_WG64_4_1_WGM1
    SolutionIndex: 192
    SolutionNameMin: Cijk_Ailk_Bjlk_HBH_MT128x256x32_MI32x32x8x1_SE_AF0EM1_GRVW8_NLCA1_NLCB1_SU0_SUS256_SRVW4_TT2_128_WG64_4_1_WGM15
    SolutionIndex: 193
    SolutionNameMin: Cijk_Ailk_Bjlk_HBH_MT64x32x16_MI16x16x16x1_SE_AF0EM4_GRVW4_NLCA1_NLCB1_SU0_SUS256_SRVW0_TT2_16_WG32_8_1_WGM1
    SolutionIndex: 194
    SolutionNameMin: Cijk_Ailk_Bjlk_HBH_MT64x64x32_MI32x32x8x1_SE_AF0EM1_GRVW8_NLCA1_NLCB1_SU0_SUS256_SRVW4_TT1_32_WG64_4_1_WGM1
    SolutionIndex: 195
    SolutionNameMin: Cijk_Ailk_Bjlk_HBH_MT64x128x32_MI32x32x8x1_SE_AF0EM4_GRVW4_NLCA1_NLCB1_SU32_SUS256_SRVW4_TT1_64_WG64_4_1_WGM15
    SolutionIndex: 196
    SolutionNameMin: Cijk_Ailk_Bjlk_HBH_MT128x96x32_MI32x32x8x1_SE_AF0EM4_GRVW4_NLCA1_NLCB3_SU16_SUS256_SRVW0_TT1_96_WG128_2_1_WGM15
    SolutionIndex: 197
    SolutionNameMin: Cijk_Ailk_Bjlk_HBH_MT32x64x16_MI16x16x16x1_SE_AF0EM1_GRVW2_NLCA1_NLCB1_SU0_SUS256_SRVW0_TT1_32_WG32_8_1_WGM15
    SolutionIndex: 198
    SolutionNameMin: Cijk_Ailk_Bjlk_HBH_MT128x288x32_MI32x32x8x1_SE_AF0EM4_GRVW4_NLCA1_NLCB9_SU0_SUS256_SRVW4_TT1_288_WG128_2_1_WGM1
    SolutionIndex: 199
    SolutionNameMin: Cijk_Ailk_Bjlk_HBH_MT128x128x64_MI32x32x8x1_SE_AF0EM4_GRVW8_NLCA1_NLCB1_SU32_SUS256_SRVW4_TT2_64_WG64_4_1_WGM15
    SolutionIndex: 200
    SolutionNameMin: Cijk_Ailk_Bjlk_HBH_MT128x128x64_MI32x32x8x1_SE_AF0EM4_GRVW8_NLCA1_NLCB1_SU16_SUS128_SRVW4_TT2_64_WG64_4_1_WGM1
    SolutionIndex: 201
    SolutionNameMin: Cijk_Ailk_Bjlk_HBH_MT128x128x64_MI32x32x8x1_SE_AF0EM4_GRVW8_NLCA1_NLCB1_SU0_SUS256_SRVW4_TT2_64_WG64_4_1_WGM15
    SolutionIndex: 202
    SolutionNameMin: Cijk_Ailk_Bjlk_HBH_MT128x288x32_MI32x32x8x1_SE_AF0EM4_GRVW4_NLCA1_NLCB9_SU16_SUS128_SRVW4_TT1_288_WG128_2_1_WGM15
    SolutionIndex: 203
    SolutionNameMin: Cijk_Ailk_Bjlk_HBH_MT128x256x16_MI32x32x8x1_SE_AF0EM4_GRVW8_NLCA1_NLCB1_SU16_SUS128_SRVW4_TT2_128_WG64_4_1_WGM15
    SolutionIndex: 204
    SolutionNameMin: Cijk_Ailk_Bjlk_HBH_MT128x160x32_MI32x32x8x1_SE_AF0EM1_GRVW2_NLCA1_NLCB5_SU32_SUS128_SRVW4_TT1_160_WG128_2_1_WGM2
    SolutionIndex: 205
    SolutionNameMin: Cijk_Ailk_Bjlk_HBH_MT128x64x16_MI32x32x8x1_SE_AF0EM4_GRVW8_NLCA1_NLCB1_SU16_SUS128_SRVW4_TT2_32_WG64_4_1_WGM2
    SolutionIndex: 206
    SolutionNameMin: Cijk_Ailk_Bjlk_HBH_MT256x256x32_MI32x32x8x1_SE_AF0EM1_GRVW8_NLCA1_NLCB1_SU0_SUS256_SRVW4_TT4_128_WG64_4_1_WGM1
    SolutionIndex: 207
    SolutionNameMin: Cijk_Ailk_Bjlk_HBH_MT32x32x16_MI16x16x16x1_SE_AF0EM4_GRVW2_NLCA1_NLCB1_SU32_SUS128_SRVW0_TT1_16_WG32_8_1_WGM15
    SolutionIndex: 208
    SolutionNameMin: Cijk_Ailk_Bjlk_HBH_MT64x64x32_MI32x32x8x1_SE_AF0EM4_GRVW4_NLCA1_NLCB1_SU0_SUS256_SRVW4_TT1_32_WG64_4_1_WGM15
    SolutionIndex: 209
    SolutionNameMin: Cijk_Ailk_Bjlk_HBH_MT64x64x64_MI32x32x8x1_SE_AF0EM4_GRVW8_NLCA1_NLCB1_SU32_SUS128_SRVW4_TT1_32_WG64_4_1_WGM1
    SolutionIndex: 210
    SolutionNameMin: Cijk_Ailk_Bjlk_HBH_MT128x96x32_MI32x32x8x1_SE_AF0EM1_GRVW4_NLCA1_NLCB3_SU0_SUS256_SRVW0_TT1_96_WG128_2_1_WGM2
    SolutionIndex: 211
    SolutionNameMin: Cijk_Ailk_Bjlk_HBH_MT64x128x16_MI32x32x4x2_SE_AF0EM1_GRVW4_NLCA1_NLCB1_SU0_SUS256_SRVW4_TT1_32_WG64_4_1_WGM15
    SolutionIndex: 212
    SolutionNameMin: Cijk_Ailk_Bjlk_HBH_MT256x128x32_MI32x32x4x2_SE_AF0EM4_GRVW8_NLCA1_NLCB1_SU32_SUS128_SRVW4_TT2_64_WG128_2_1_WGM2
    SolutionIndex: 213
    SolutionNameMin: Cijk_Ailk_Bjlk_HBH_MT32x64x16_MI16x16x16x1_SE_AF0EM4_GRVW2_NLCA1_NLCB1_SU32_SUS256_SRVW0_TT1_32_WG32_8_1_WGM15
    SolutionIndex: 214
    SolutionNameMin: Cijk_Ailk_Bjlk_HBH_MT128x64x16_MI32x32x4x2_SE_AF0EM4_GRVW2_NLCA1_NLCB1_SU0_SUS256_SRVW4_TT1_32_WG128_2_1_WGM15
    SolutionIndex: 215
    SolutionNameMin: Cijk_Ailk_Bjlk_HBH_MT128x96x64_MI32x32x8x1_SE_AF0EM4_GRVW8_NLCA1_NLCB3_SU16_SUS128_SRVW4_TT1_96_WG128_2_1_WGM15
    SolutionIndex: 216
    SolutionNameMin: Cijk_Ailk_Bjlk_HBH_MT128x96x32_MI32x32x8x1_SE_AF0EM1_GRVW2_NLCA1_NLCB3_SU0_SUS256_SRVW4_TT1_96_WG128_2_1_WGM2
    SolutionIndex: 217
    SolutionNameMin: Cijk_Ailk_Bjlk_HBH_MT64x64x128_MI32x32x8x1_SE_AF0EM1_GRVW8_NLCA1_NLCB1_SU16_SUS256_SRVW4_TT1_32_WG64_4_1_WGM15
    SolutionIndex: 218
    SolutionNameMin: Cijk_Ailk_Bjlk_HBH_MT64x64x32_MI32x32x8x1_SE_AF0EM1_GRVW4_NLCA1_NLCB1_SU16_SUS256_SRVW4_TT1_32_WG64_4_1_WGM15
    SolutionIndex: 219
    SolutionNameMin: Cijk_Ailk_Bjlk_HBH_MT64x128x16_MI32x32x4x2_SE_AF0EM1_GRVW2_NLCA1_NLCB1_SU16_SUS128_SRVW4_TT1_32_WG64_4_1_WGM1
    SolutionIndex: 220
    SolutionNameMin: Cijk_Ailk_Bjlk_HBH_MT32x32x64_MI16x16x16x1_SE_AF0EM1_GRVW8_NLCA1_NLCB1_SU0_SUS256_SRVW0_TT1_16_WG32_8_1_WGM1
    SolutionIndex: 221
    SolutionNameMin: Cijk_Ailk_Bjlk_HBH_MT32x32x64_MI16x16x16x1_SE_AF0EM4_GRVW8_NLCA1_NLCB1_SU0_SUS256_SRVW0_TT1_16_WG32_8_1_WGM15
    SolutionIndex: 222
    SolutionNameMin: Cijk_Ailk_Bjlk_HBH_MT64x128x16_MI32x32x4x2_SE_AF0EM1_GRVW2_NLCA1_NLCB1_SU32_SUS128_SRVW4_TT1_32_WG64_4_1_WGM1
    SolutionIndex: 223
    SolutionNameMin: Cijk_Ailk_Bjlk_HBH_MT64x32x16_MI16x16x16x1_SE_AF0EM4_GRVW2_NLCA1_NLCB1_SU32_SUS128_SRVW0_TT2_16_WG32_8_1_WGM2
    SolutionIndex: 224
    SolutionNameMin: Cijk_Ailk_Bjlk_HBH_MT128x256x16_MI32x32x8x1_SE_AF0EM4_GRVW8_NLCA1_NLCB1_SU16_SUS128_SRVW4_TT2_128_WG64_4_1_WGM2
    SolutionIndex: 225
    SolutionNameMin: Cijk_Ailk_Bjlk_HBH_MT64x128x16_MI32x32x4x2_SE_AF0EM1_GRVW8_NLCA1_NLCB1_SU32_SUS128_SRVW4_TT1_32_WG64_4_1_WGM15
    SolutionIndex: 226
    SolutionNameMin: Cijk_Ailk_Bjlk_HBH_MT64x64x32_MI32x32x8x1_SE_AF0EM4_GRVW4_NLCA1_NLCB1_SU32_SUS256_SRVW4_TT1_32_WG64_4_1_WGM15
    SolutionIndex: 227
    SolutionNameMin: Cijk_Ailk_Bjlk_HBH_MT128x128x64_MI32x32x8x1_SE_AF0EM1_GRVW8_NLCA1_NLCB1_SU32_SUS128_SRVW4_TT2_64_WG64_4_1_WGM2
    SolutionIndex: 228
    SolutionNameMin: Cijk_Ailk_Bjlk_HBH_MT64x32x16_MI16x16x16x1_SE_AF0EM4_GRVW4_NLCA1_NLCB1_SU32_SUS256_SRVW0_TT2_16_WG32_8_1_WGM1
    SolutionIndex: 229
    SolutionNameMin: Cijk_Ailk_Bjlk_HBH_MT128x288x32_MI32x32x8x1_SE_AF0EM4_GRVW2_NLCA1_NLCB9_SU0_SUS256_SRVW4_TT1_288_WG128_2_1_WGM15
    SolutionIndex: 230
    SolutionNameMin: Cijk_Ailk_Bjlk_HBH_MT32x32x16_MI16x16x16x1_SE_AF0EM1_GRVW2_NLCA1_NLCB1_SU32_SUS256_SRVW0_TT1_16_WG32_8_1_WGM1
    SolutionIndex: 231
    SolutionNameMin: Cijk_Ailk_Bjlk_HBH_MT64x64x128_MI32x32x8x1_SE_AF0EM4_GRVW8_NLCA1_NLCB1_SU16_SUS256_SRVW4_TT1_32_WG64_4_1_WGM1
    SolutionIndex: 232
    SolutionNameMin: Cijk_Ailk_Bjlk_HBH_MT64x128x64_MI32x32x8x1_SE_AF0EM1_GRVW8_NLCA1_NLCB1_SU0_SUS256_SRVW4_TT1_64_WG64_4_1_WGM1
    SolutionIndex: 233
    SolutionNameMin: Cijk_Ailk_Bjlk_HBH_MT64x128x64_MI32x32x8x1_SE_AF0EM1_GRVW8_NLCA1_NLCB1_SU16_SUS128_SRVW4_TT1_64_WG64_4_1_WGM1
    SolutionIndex: 234
    SolutionNameMin: Cijk_Ailk_Bjlk_HBH_MT128x288x32_MI32x32x8x1_SE_AF0EM4_GRVW4_NLCA1_NLCB9_SU32_SUS128_SRVW4_TT1_288_WG128_2_1_WGM15
    SolutionIndex: 235
    SolutionNameMin: Cijk_Ailk_Bjlk_HBH_MT64x32x16_MI16x16x16x1_SE_AF0EM4_GRVW8_NLCA1_NLCB1_SU32_SUS128_SRVW4_TT2_16_WG32_8_1_WGM15
    SolutionIndex: 236
    SolutionNameMin: Cijk_Ailk_Bjlk_HBH_MT64x32x16_MI16x16x16x1_SE_AF0EM4_GRVW2_NLCA1_NLCB1_SU32_SUS256_SRVW0_TT2_16_WG32_8_1_WGM1
    SolutionIndex: 237
    SolutionNameMin: Cijk_Ailk_Bjlk_HBH_MT128x160x16_MI32x32x8x1_SE_AF0EM4_GRVW2_NLCA1_NLCB5_SU0_SUS256_SRVW4_TT1_160_WG128_2_1_WGM2
    SolutionIndex: 238
    SolutionNameMin: Cijk_Ailk_Bjlk_HBH_MT128x160x32_MI32x32x8x1_SE_AF0EM4_GRVW2_NLCA1_NLCB5_SU0_SUS256_SRVW4_TT1_160_WG128_2_1_WGM15
    SolutionIndex: 239
    SolutionNameMin: Cijk_Ailk_Bjlk_HBH_MT128x288x32_MI32x32x8x1_SE_AF0EM4_GRVW2_NLCA1_NLCB9_SU0_SUS256_SRVW0_TT1_288_WG128_2_1_WGM15
    SolutionIndex: 240
    SolutionNameMin: Cijk_Ailk_Bjlk_HBH_MT32x64x16_MI16x16x16x1_SE_AF0EM1_GRVW2_NLCA1_NLCB1_SU16_SUS256_SRVW4_TT1_32_WG32_8_1_WGM2
    SolutionIndex: 241
    SolutionNameMin: Cijk_Ailk_Bjlk_HBH_MT128x128x32_MI32x32x8x1_SE_AF0EM1_GRVW8_NLCA1_NLCB1_SU32_SUS256_SRVW4_TT2_64_WG64_4_1_WGM1
    SolutionIndex: 242
    SolutionNameMin: Cijk_Ailk_Bjlk_HBH_MT128x96x64_MI32x32x8x1_SE_AF0EM4_GRVW8_NLCA1_NLCB3_SU32_SUS128_SRVW4_TT1_96_WG128_2_1_WGM15
    SolutionIndex: 243
    SolutionNameMin: Cijk_Ailk_Bjlk_HBH_MT32x64x16_MI16x16x16x1_SE_AF0EM1_GRVW8_NLCA1_NLCB1_SU32_SUS128_SRVW0_TT1_32_WG32_8_1_WGM15
    SolutionIndex: 244
    SolutionNameMin: Cijk_Ailk_Bjlk_HBH_MT128x256x32_MI32x32x8x1_SE_AF0EM4_GRVW8_NLCA1_NLCB1_SU0_SUS256_SRVW4_TT2_128_WG64_4_1_WGM15
    SolutionIndex: 245
    SolutionNameMin: Cijk_Ailk_Bjlk_HBH_MT128x128x64_MI32x32x8x1_SE_AF0EM1_GRVW8_NLCA1_NLCB1_SU16_SUS256_SRVW4_TT2_64_WG64_4_1_WGM15
    SolutionIndex: 246
    SolutionNameMin: Cijk_Ailk_Bjlk_HBH_MT128x128x16_MI32x32x8x1_SE_AF0EM4_GRVW8_NLCA1_NLCB1_SU16_SUS128_SRVW4_TT2_64_WG64_4_1_WGM15
    SolutionIndex: 247
    SolutionNameMin: Cijk_Ailk_Bjlk_HBH_MT128x96x32_MI32x32x8x1_SE_AF0EM4_GRVW4_NLCA1_NLCB3_SU0_SUS256_SRVW0_TT1_96_WG128_2_1_WGM15
    SolutionIndex: 248
    SolutionNameMin: Cijk_Ailk_Bjlk_HBH_MT256x256x16_MI32x32x4x2_SE_AF0EM4_GRVW8_NLCA1_NLCB1_SU0_SUS256_SRVW4_TT2_128_WG128_2_1_WGM2
    SolutionIndex: 249
    SolutionNameMin: Cijk_Ailk_Bjlk_HBH_MT64x64x32_MI32x32x8x1_SE_AF0EM4_GRVW4_NLCA1_NLCB1_SU16_SUS128_SRVW4_TT1_32_WG64_4_1_WGM15
    SolutionIndex: 250
    SolutionNameMin: Cijk_Ailk_Bjlk_HBH_MT64x128x16_MI32x32x4x2_SE_AF0EM4_GRVW8_NLCA1_NLCB1_SU32_SUS256_SRVW4_TT1_32_WG64_4_1_WGM2
    SolutionIndex: 251
    SolutionNameMin: Cijk_Ailk_Bjlk_HBH_MT64x32x16_MI16x16x16x1_SE_AF0EM4_GRVW2_NLCA1_NLCB1_SU32_SUS128_SRVW0_TT2_16_WG32_8_1_WGM1
    SolutionIndex: 252
    SolutionNameMin: Cijk_Ailk_Bjlk_HBH_MT64x32x16_MI16x16x16x1_SE_AF0EM4_GRVW2_NLCA1_NLCB1_SU16_SUS256_SRVW0_TT2_16_WG32_8_1_WGM2
    SolutionIndex: 253
    SolutionNameMin: Cijk_Ailk_Bjlk_HBH_MT64x64x32_MI32x32x8x1_SE_AF0EM1_GRVW2_NLCA1_NLCB1_SU16_SUS256_SRVW4_TT1_32_WG64_4_1_WGM1
    SolutionIndex: 254
    SolutionNameMin: Cijk_Ailk_Bjlk_HBH_MT256x144x32_MI16x16x16x1_SE_AF0EM4_GRVW2_NLCA2_NLCB9_SU0_SUS256_SRVW0_TT4_144_WG64_4_1_WGM1
    SolutionIndex: 255
    SolutionNameMin: Cijk_Ailk_Bjlk_HBH_MT32x64x16_MI16x16x16x1_SE_AF0EM1_GRVW8_NLCA1_NLCB1_SU0_SUS256_SRVW0_TT1_32_WG32_8_1_WGM2
    SolutionIndex: 256
    SolutionNameMin: Cijk_Ailk_Bjlk_HBH_MT128x96x64_MI32x32x8x1_SE_AF0EM4_GRVW8_NLCA1_NLCB3_SU32_SUS128_SRVW4_TT1_96_WG128_2_1_WGM2
    SolutionIndex: 257
    SolutionNameMin: Cijk_Ailk_Bjlk_HBH_MT128x96x16_MI32x32x8x1_SE_AF0EM4_GRVW2_NLCA1_NLCB3_SU0_SUS256_SRVW4_TT1_96_WG128_2_1_WGM2
    SolutionIndex: 258
    SolutionNameMin: Cijk_Ailk_Bjlk_HBH_MT64x64x64_MI32x32x8x1_SE_AF0EM4_GRVW8_NLCA1_NLCB1_SU32_SUS256_SRVW4_TT1_32_WG64_4_1_WGM1
    SolutionIndex: 259
    SolutionNameMin: Cijk_Ailk_Bjlk_HBH_MT64x64x32_MI32x32x8x1_SE_AF0EM4_GRVW8_NLCA1_NLCB1_SU0_SUS256_SRVW4_TT1_32_WG64_4_1_WGM15
    SolutionIndex: 260
    SolutionNameMin: Cijk_Ailk_Bjlk_HBH_MT64x64x128_MI32x32x8x1_SE_AF0EM1_GRVW8_NLCA1_NLCB1_SU32_SUS256_SRVW4_TT1_32_WG64_4_1_WGM15
    SolutionIndex: 261
    SolutionNameMin: Cijk_Ailk_Bjlk_HBH_MT128x128x64_MI32x32x8x1_SE_AF0EM4_GRVW4_NLCA1_NLCB1_SU0_SUS256_SRVW4_TT2_64_WG64_4_1_WGM15
    SolutionIndex: 262
    SolutionNameMin: Cijk_Ailk_Bjlk_HBH_MT32x32x128_MI16x16x16x1_SE_AF0EM4_GRVW4_NLCA1_NLCB1_SU0_SUS256_SRVW0_TT1_16_WG32_8_1_WGM15
    SolutionIndex: 263
    SolutionNameMin: Cijk_Ailk_Bjlk_HBH_MT128x64x32_MI32x32x8x1_SE_AF0EM4_GRVW4_NLCA1_NLCB1_SU0_SUS256_SRVW4_TT2_32_WG64_4_1_WGM1
    SolutionIndex: 264
    SolutionNameMin: Cijk_Ailk_Bjlk_HBH_MT128x128x32_MI32x32x8x1_SE_AF0EM4_ASBE01_GRVW4_PBD0_SRVW4_TT2_64_WG64_4_1_WGM1
    SolutionIndex: 265
    SolutionNameMin: Cijk_Ailk_Bjlk_HBH_MT128x128x32_MI32x32x8x1_SE_AF0EM8_ASBE01_GRVW8_PBD0_SRVW4_TT2_64_WG64_4_1_WGM10
    SolutionIndex: 266
    SolutionNameMin: Cijk_Ailk_Bjlk_HBH_MT64x64x32_MI16x16x16x1_SE_AF0EM1_ASBE01_GRVW2_PBD0_SRVW4_TT2_32_WG32_8_1_WGM1
    SolutionIndex: 267
    SolutionNameMin: Cijk_Ailk_Bjlk_HBH_MT64x128x32_MI32x32x8x1_SE_AF0EM8_ASBE01_GRVW8_PBD0_SRVW4_TT2_32_WG32_8_1_WGM120
    SolutionIndex: 268
    SolutionNameMin: Cijk_Ailk_Bjlk_HBH_MT128x128x32_MI32x32x8x1_SE_AF0EM8_ASBE01_GRVW8_PBD0_SRVW4_TT2_64_WG64_4_1_WGM1
    SolutionIndex: 269
    SolutionNameMin: Cijk_Ailk_Bjlk_HBH_MT64x128x32_MI32x32x8x1_SE_AF0EM8_ASBE01_GRVW8_PBD0_SRVW4_TT2_32_WG32_8_1_WGM10
    SolutionIndex: 270
    SolutionNameMin: Cijk_Ailk_Bjlk_HBH_MT128x256x32_MI32x32x4x2_SE_AF0EM4_ASBE01_GRVW4_PBD0_SRVW4_TT2_64_WG64_4_1_WGM120
    SolutionIndex: 271
    SolutionNameMin: Cijk_Ailk_Bjlk_HBH_MT64x128x32_MI32x32x4x2_SE_AF0EM8_ASBE01_GRVW8_PBD0_SRVW4_TT1_32_WG64_4_1_WGM1
    SolutionIndex: 272
    SolutionNameMin: Cijk_Ailk_Bjlk_HBH_MT128x128x32_MI32x32x8x1_SE_AF0EM4_ASBE01_GRVW4_PBD0_SRVW4_TT2_64_WG64_4_1_WGM10
    SolutionIndex: 273
    SolutionNameMin: Cijk_Ailk_Bjlk_HBH_MT128x128x32_MI32x32x8x1_SE_AF0EM8_ASBE01_GRVW8_PBD0_SRVW4_TT2_64_WG64_4_1_WGM120
    SolutionIndex: 274
    SolutionNameMin: Cijk_Ailk_Bjlk_HBH_MT64x64x32_MI32x32x8x1_SE_AF0EM1_ASBE01_GRVW4_PBD0_SRVW4_TT1_32_WG64_4_1_WGM120
    SolutionIndex: 275
    SolutionNameMin: Cijk_Ailk_Bjlk_HBH_MT128x128x32_MI32x32x8x1_SE_AF0EM1_ASBE01_GRVW2_PBD0_SRVW4_TT2_64_WG64_4_1_WGM1
    SolutionIndex: 276
    SolutionNameMin: Cijk_Ailk_Bjlk_HBH_MT64x128x32_MI32x32x8x1_SE_AF0EM4_ASBE01_GRVW4_PBD0_SRVW4_TT2_32_WG32_8_1_WGM1
    SolutionIndex: 277
    SolutionNameMin: Cijk_Ailk_Bjlk_HBH_MT64x64x64_MI32x32x8x1_SE_AF0EM1_ASBE01_GRVW4_PBD0_SRVW4_TT1_32_WG64_4_1_WGM120
    SolutionIndex: 278
    SolutionNameMin: Cijk_Ailk_Bjlk_HBH_MT64x64x32_MI32x32x8x1_SE_AF0EM8_ASBE01_GRVW8_PBD0_SRVW4_TT1_32_WG64_4_1_WGM1
    SolutionIndex: 279
    SolutionNameMin: Cijk_Ailk_Bjlk_HBH_MT64x128x32_MI32x32x4x2_SE_AF0EM8_ASBE01_GRVW4_PBD0_SRVW4_TT1_32_WG64_4_1_WGM10
    SolutionIndex: 280
    SolutionNameMin: Cijk_Ailk_Bjlk_HBH_MT64x64x32_MI32x32x8x1_SE_AF0EM4_ASBE01_GRVW2_PBD0_SRVW4_TT1_32_WG64_4_1_WGM120
    SolutionIndex: 281
    SolutionNameMin: Cijk_Ailk_Bjlk_HBH_MT64x128x32_MI32x32x8x1_SE_AF0EM4_ASBE01_GRVW2_PBD0_SRVW4_TT2_32_WG32_8_1_WGM120
    SolutionIndex: 282
    SolutionNameMin: Cijk_Ailk_Bjlk_HBH_MT256x256x32_MI32x32x8x1_SE_AF0EM8_GRVW8_GSU1_SU0_SUS256_SRVW4_VAW2_WG64_4_1_WGM1
    SolutionIndex: 283
    SolutionNameMin: Cijk_Ailk_Bjlk_HBH_MT128x256x32_MI32x32x8x1_SE_AF0EM8_GRVW8_GSU1_SU32_SUS128_SRVW4_VAW2_WG64_4_1_WGM1
    SolutionIndex: 284
    SolutionNameMin: Cijk_Ailk_Bjlk_HBH_MT64x128x64_MI32x32x8x1_SE_AF0EM8_GRVW8_GSU1_SU32_SUS256_SRVW4_VAW2_WG64_4_1_WGM2
    SolutionIndex: 285
    SolutionNameMin: Cijk_Ailk_Bjlk_HBH_MT32x64x64_MI16x16x16x1_SE_AF0EM8_GRVW8_GSU1_SU0_SUS256_SRVW4_VAW2_WG32_8_1_WGM15
    SolutionIndex: 286
    SolutionNameMin: Cijk_Ailk_Bjlk_HBH_MT256x256x32_MI32x32x8x1_SE_AF0EM8_GRVW8_GSU1_SU0_SUS256_SRVW4_VAW2_WG64_4_1_WGM15
    SolutionIndex: 287
    SolutionNameMin: Cijk_Ailk_Bjlk_HBH_MT256x128x32_MI32x32x8x1_SE_AF0EM8_GRVW8_GSU1_SU0_SUS256_SRVW4_VAW2_WG64_4_1_WGM15
    SolutionIndex: 288
    SolutionNameMin: Cijk_Ailk_Bjlk_HBH_MT128x64x64_MI32x32x8x1_SE_AF0EM8_GRVW8_GSU1_SU0_SUS256_SRVW4_VAW2_WG64_4_1_WGM15
    SolutionIndex: 289
    SolutionNameMin: Cijk_Ailk_Bjlk_HBH_MT64x32x64_MI16x16x16x1_SE_AF0EM8_GRVW8_GSU1_SU0_SUS256_SRVW4_VAW2_WG32_8_1_WGM1
    SolutionIndex: 290
    SolutionNameMin: Cijk_Ailk_Bjlk_HBH_MT256x160x32_MI32x32x8x1_SE_AF0EM8_GRVW4_GSU1_SU0_SUS256_SRVW4_VAW2_WG128_2_1_WGM15
    SolutionIndex: 291
    SolutionNameMin: Cijk_Ailk_Bjlk_HBH_MT128x288x32_MI32x32x8x1_SE_AF0EM8_GRVW4_GSU1_SU32_SUS128_SRVW4_VAW2_WG128_2_1_WGM15
    SolutionIndex: 292
    SolutionNameMin: Cijk_Ailk_Bjlk_HBH_MT144x256x32_MI16x16x16x1_SE_AF0EM8_GRVW2_GSU1_SU0_SUS256_SRVW0_VAW2_WG16_16_1_WGM1
    SolutionIndex: 293
    SolutionNameMin: Cijk_Ailk_Bjlk_HBH_MT128x96x64_MI32x32x8x1_SE_AF0EM8_GRVW8_GSU1_SU0_SUS256_SRVW4_VAW2_WG128_2_1_WGM2
    SolutionIndex: 294
    SolutionNameMin: Cijk_Ailk_Bjlk_HBH_MT64x64x64_MI32x32x8x1_SE_AF0EM8_GRVW8_GSU1_SU32_SUS128_SRVW4_VAW2_WG64_4_1_WGM1
    SolutionIndex: 295
    SolutionNameMin: Cijk_Ailk_Bjlk_HBH_MT64x64x64_MI32x32x8x1_SE_AF0EM8_GRVW8_GSU1_SU0_SUS256_SRVW4_VAW2_WG64_4_1_WGM1
    SolutionIndex: 296
    SolutionNameMin: Cijk_Ailk_Bjlk_HBH_MT16x16x64_MI16x16x16x1_SE_AF0EM8_GRVW2_GSU1_SU0_SUS256_SRVW0_VAW2_WG16_4_1_WGM2
    SolutionIndex: 297
    SolutionNameMin: Cijk_Ailk_Bjlk_HBH_MT64x64x16_MI32x32x8x1_SE_AF0EM8_GRVW8_GSU1_SU0_SUS256_SRVW4_VAW2_WG64_4_1_WGM1
    SolutionIndex: 298
    SolutionNameMin: Cijk_Ailk_Bjlk_HBH_MT64x64x16_MI32x32x8x1_SE_AF0EM8_GRVW4_GSU1_SU0_SUS256_SRVW4_VAW2_WG64_4_1_WGM15
    SolutionIndex: 299
    SolutionNameMin: Cijk_Ailk_Bjlk_HBH_MT128x288x32_MI32x32x8x1_SE_AF0EM8_GRVW4_GSU1_SU0_SUS256_SRVW4_VAW2_WG128_2_1_WGM15
    SolutionIndex: 300
    SolutionNameMin: Cijk_Ailk_Bjlk_HBH_MT128x256x16_MI32x32x8x1_SE_AF0EM8_GRVW4_GSU1_SU0_SUS256_SRVW4_VAW2_WG64_4_1_WGM2
    SolutionIndex: 301
    SolutionNameMin: Cijk_Ailk_Bjlk_HBH_MT128x128x32_MI32x32x8x1_SE_AF0EM8_GRVW8_GSU1_SU32_SUS256_SRVW4_VAW2_WG64_4_1_WGM2
    SolutionIndex: 302
    SolutionNameMin: Cijk_Ailk_Bjlk_HBH_MT64x64x32_MI32x32x8x1_SE_AF0EM8_GRVW8_GSU1_SU32_SUS256_SRVW4_VAW2_WG64_4_1_WGM15
    SolutionIndex: 303
    SolutionNameMin: Cijk_Ailk_Bjlk_HBH_MT32x32x16_MI16x16x16x1_SE_AF0EM8_GRVW2_GSU1_SU0_SUS256_SRVW4_VAW2_WG32_8_1_WGM1
    SolutionIndex: 304
    SolutionNameMin: Cijk_Ailk_Bjlk_HBH_MT64x16x32_MI16x16x16x1_SE_AF0EM8_GRVW8_GSU15_SU32_SUS128_SRVW0_VAW1_WG64_4_1_WGM15
    SolutionIndex: 305
    SolutionNameMin: Cijk_Ailk_Bjlk_HBH_MT64x32x16_MI16x16x16x1_SE_AF0EM8_GRVW2_GSU1_SU0_SUS256_SRVW4_VAW2_WG32_8_1_WGM1
    SolutionIndex: 306
    SolutionNameMin: Cijk_Ailk_Bjlk_HBH_MT128x288x32_MI32x32x8x1_SE_AF0EM8_GRVW2_GSU1_SU0_SUS256_SRVW4_VAW2_WG128_2_1_WGM15
    SolutionIndex: 307
    SolutionNameMin: Cijk_Ailk_Bjlk_HBH_MT128x256x16_MI32x32x8x1_SE_AF0EM8_GRVW8_GSU1_SU0_SUS256_SRVW4_VAW2_WG64_4_1_WGM2
    SolutionIndex: 308
    SolutionNameMin: Cijk_Ailk_Bjlk_HBH_MT16x16x16_MI16x16x16x1_SE_AF0EM8_GRVW2_GSU1_SU0_SUS256_SRVW0_VAW2_WG16_4_1_WGM1
    SolutionIndex: 309
    SolutionNameMin: Cijk_Ailk_Bjlk_HBH_MT64x16x64_MI16x16x16x1_SE_AF0EM1_GRVW2_GSU15_SU0_SUS256_SRVW0_VAW1_WG64_4_1_WGM1
    SolutionIndex: 310
    SolutionNameMin: Cijk_Ailk_Bjlk_HBH_MT64x64x16_MI32x32x8x1_SE_AF0EM8_GRVW8_GSU1_SU0_SUS256_SRVW4_VAW2_WG64_4_1_WGM15
    SolutionIndex: 311
    SolutionNameMin: Cijk_Ailk_Bjlk_HBH_MT128x96x64_MI32x32x8x1_SE_AF0EM8_GRVW8_GSU1_SU32_SUS128_SRVW4_VAW2_WG128_2_1_WGM2
    SolutionIndex: 312
    SolutionNameMin: Cijk_Ailk_Bjlk_HBH_MT128x96x64_MI32x32x8x1_SE_AF0EM8_GRVW8_GSU1_SU32_SUS256_SRVW4_VAW2_WG128_2_1_WGM15
    SolutionIndex: 313
    SolutionNameMin: Cijk_Ailk_Bjlk_HBH_MT256x256x16_MI32x32x8x1_SE_AF0EM8_GRVW4_GSU1_SU0_SUS256_SRVW4_VAW2_WG64_4_1_WGM15
    SolutionIndex: 314
    SolutionNameMin: Cijk_Ailk_Bjlk_HBH_MT64x128x16_MI32x32x8x1_SE_AF0EM8_GRVW8_GSU1_SU0_SUS256_SRVW4_VAW2_WG64_4_1_WGM15
    SolutionIndex: 315
    SolutionNameMin: Cijk_Ailk_Bjlk_HBH_MT64x16x32_MI16x16x16x1_SE_AF0EM8_GRVW8_GSU15_SU32_SUS128_SRVW0_VAW1_WG64_4_1_WGM1
    SolutionIndex: 316
    SolutionNameMin: Cijk_Ailk_Bjlk_HBH_MT64x64x16_MI32x32x8x1_SE_AF0EM8_GRVW4_GSU1_SU0_SUS256_SRVW4_VAW2_WG64_4_1_WGM1
    SolutionIndex: 317
    SolutionNameMin: Cijk_Ailk_Bjlk_HBH_MT128x256x16_MI32x32x8x1_SE_AF0EM8_GRVW8_GSU1_SU0_SUS256_SRVW4_VAW2_WG64_4_1_WGM15
    SolutionIndex: 318
    SolutionNameMin: Cijk_Ailk_Bjlk_HBH_MT16x64x32_MI16x16x16x1_SE_AF0EM8_GRVW2_GSU1_SU0_SUS256_SRVW0_VAW2_WG16_16_1_WGM1
    SolutionIndex: 319
    SolutionNameMin: Cijk_Ailk_Bjlk_HBH_MT64x16x64_MI16x16x16x1_SE_AF0EM8_GRVW2_GSU15_SU0_SUS256_SRVW0_VAW1_WG64_4_1_WGM1
    SolutionIndex: 320
    SolutionNameMin: Cijk_Ailk_Bjlk_HBH_MT64x64x16_MI32x32x8x1_SE_AF0EM8_GRVW2_GSU1_SU0_SUS256_SRVW4_VAW2_WG64_4_1_WGM15
    SolutionIndex: 321
    SolutionNameMin: Cijk_Ailk_Bjlk_HBH_MT128x128x32_MI32x32x8x1_SE_AF0EM8_GRVW8_GSU1_SU32_SUS256_SRVW4_VAW2_WG64_4_1_WGM15
    SolutionIndex: 322
    SolutionNameMin: Cijk_Ailk_Bjlk_HBH_MT128x96x64_MI32x32x8x1_SE_AF0EM8_GRVW8_GSU1_SU32_SUS256_SRVW4_VAW2_WG128_2_1_WGM2
    SolutionIndex: 323
    SolutionNameMin: Cijk_Ailk_Bjlk_HBH_MT256x256x32_MI32x32x8x1_SE_AF0EM8_GRVW8_GSU1_SU0_SUS256_SRVW4_VAW2_WG64_4_1_WGM2
    SolutionIndex: 324
    SolutionNameMin: Cijk_Ailk_Bjlk_HBH_MT160x256x32_MI32x32x8x1_SE_AF0EM8_GRVW4_GSU1_SU0_SUS256_SRVW0_VAW2_WG32_8_1_WGM1
    SolutionIndex: 325
    SolutionNameMin: Cijk_Ailk_Bjlk_HBH_MT32x32x16_MI16x16x16x1_SE_AF0EM8_GRVW8_GSU1_SU0_SUS256_SRVW4_VAW2_WG32_8_1_WGM1
    SolutionIndex: 326
    SolutionNameMin: Cijk_Ailk_Bjlk_HBH_MT64x16x64_MI16x16x16x1_SE_AF0EM1_GRVW2_GSU15_SU0_SUS256_SRVW0_VAW1_WG64_4_1_WGM2
    SolutionIndex: 327
    SolutionNameMin: Cijk_Ailk_Bjlk_HBH_MT128x96x32_MI32x32x8x1_SE_AF0EM8_GRVW4_GSU1_SU0_SUS256_SRVW4_VAW2_WG128_2_1_WGM2
    SolutionIndex: 328
    SolutionNameMin: Cijk_Ailk_Bjlk_HBH_MT256x160x32_MI32x32x8x1_SE_AF0EM8_GRVW4_GSU1_SU32_SUS256_SRVW4_VAW2_WG128_2_1_WGM15
    SolutionIndex: 329
    SolutionNameMin: Cijk_Ailk_Bjlk_HBH_MT64x16x32_MI16x16x16x1_SE_AF0EM1_GRVW8_GSU15_SU0_SUS256_SRVW0_VAW1_WG64_4_1_WGM1
    SolutionIndex: 330
    SolutionNameMin: Cijk_Ailk_Bjlk_HBH_MT64x64x16_MI32x32x8x1_SE_AF0EM8_GRVW2_GSU1_SU0_SUS256_SRVW4_VAW2_WG64_4_1_WGM1
    SolutionIndex: 331
    SolutionNameMin: Cijk_Ailk_Bjlk_HBH_MT128x256x16_MI32x32x8x1_SE_AF0EM8_GRVW8_GSU1_SU32_SUS128_SRVW4_VAW2_WG64_4_1_WGM15
    SolutionIndex: 332
    SolutionNameMin: Cijk_Ailk_Bjlk_HBH_MT64x256x16_MI32x32x8x1_SE_AF0EM8_GRVW4_GSU1_SU32_SUS256_SRVW4_VAW2_WG64_4_1_WGM1
    SolutionIndex: 333
    SolutionNameMin: Cijk_Ailk_Bjlk_HBH_MT64x128x32_MI32x32x8x1_SE_AF0EM8_GRVW8_GSU1_SU32_SUS128_SRVW4_VAW2_WG64_4_1_WGM15
    SolutionIndex: 334
    SolutionNameMin: Cijk_Ailk_Bjlk_HBH_MT32x32x16_MI16x16x16x1_SE_AF0EM8_GRVW2_GSU1_SU0_SUS256_SRVW4_VAW2_WG32_8_1_WGM2
    SolutionIndex: 335
    SolutionNameMin: Cijk_Ailk_Bjlk_HBH_MT64x16x32_MI16x16x16x1_SE_AF0EM8_GRVW2_GSU15_SU0_SUS256_SRVW0_VAW1_WG64_4_1_WGM1
    SolutionIndex: 336
    SolutionNameMin: Cijk_Ailk_Bjlk_HBH_MT128x64x32_MI32x32x8x1_SE_AF0EM8_GRVW8_GSU1_SU0_SUS256_SRVW4_VAW2_WG64_4_1_WGM15
    SolutionIndex: 337
    SolutionNameMin: Cijk_Ailk_Bjlk_HBH_MT128x288x32_MI32x32x8x1_SE_AF0EM8_GRVW2_GSU1_SU0_SUS256_SRVW4_VAW2_WG128_2_1_WGM15
    SolutionIndex: 338
    SolutionNameMin: Cijk_Ailk_Bjlk_HBH_MT128x256x16_MI32x32x8x1_SE_AF0EM8_GRVW4_GSU1_SU32_SUS256_SRVW4_VAW2_WG64_4_1_WGM2
    SolutionIndex: 339
    SolutionNameMin: Cijk_Ailk_Bjlk_HBH_MT64x64x32_MI32x32x8x1_SE_AF0EM8_GRVW8_GSU1_SU32_SUS128_SRVW4_VAW2_WG64_4_1_WGM1
    SolutionIndex: 340
    SolutionNameMin: Cijk_Ailk_Bjlk_HBH_MT64x16x32_MI16x16x16x1_SE_AF0EM1_GRVW8_GSU15_SU0_SUS256_SRVW0_VAW1_WG64_4_1_WGM2
    SolutionIndex: 341
    SolutionNameMin: Cijk_Ailk_Bjlk_HBH_MT128x96x64_MI32x32x8x1_SE_AF0EM8_GRVW8_GSU1_SU0_SUS256_SRVW4_VAW2_WG128_2_1_WGM15
    SolutionIndex: 342
    SolutionNameMin: Cijk_Ailk_Bjlk_HBH_MT128x256x16_MI32x32x8x1_SE_AF0EM8_GRVW8_GSU1_SU32_SUS128_SRVW4_VAW2_WG64_4_1_WGM15
    SolutionIndex: 343
    SolutionNameMin: Cijk_Ailk_Bjlk_HBH_MT64x64x64_MI32x32x8x1_SE_AF0EM8_GRVW8_GSU15_SU32_SUS128_SRVW0_VAW1_WG64_4_1_WGM1
    SolutionIndex: 344
    SolutionNameMin: Cijk_Ailk_Bjlk_HBH_MT128x128x64_MI32x32x8x1_SE_AF0EM8_GRVW8_GSU15_SU32_SUS256_SRVW0_VAW1_WG64_4_1_WGM2
    SolutionIndex: 345
    SolutionNameMin: Cijk_Ailk_Bjlk_HBH_MT256x128x32_MI32x32x8x1_SE_AF0EM8_GRVW8_GSU7_SU32_SUS128_SRVW0_VAW1_WG64_4_1_WGM15
    SolutionIndex: 346
    SolutionNameMin: Cijk_Ailk_Bjlk_HBH_MT128x256x32_MI32x32x8x1_SE_AF0EM8_GRVW8_GSU3_SU0_SUS256_SRVW0_VAW1_WG64_4_1_WGM15
    SolutionIndex: 347
    SolutionNameMin: Cijk_Ailk_Bjlk_HBH_MT64x64x16_MI32x32x8x1_SE_AF0EM8_GRVW2_GSU1_SU32_SUS128_SRVW4_VAW2_WG64_4_1_WGM2
    SolutionIndex: 348
    SolutionNameMin: Cijk_Ailk_Bjlk_HBH_MT64x64x16_MI32x32x8x1_SE_AF0EM8_GRVW2_GSU1_SU0_SUS256_SRVW4_VAW2_WG64_4_1_WGM2
    SolutionIndex: 349
    SolutionNameMin: Cijk_Ailk_Bjlk_HBH_MT64x16x32_MI16x16x16x1_SE_AF0EM8_GRVW2_GSU1_SU0_SUS256_SRVW0_VAW2_WG64_4_1_WGM1
    SolutionIndex: 350
    SolutionNameMin: Cijk_Ailk_Bjlk_HBH_MT64x64x32_MI32x32x8x1_SE_AF0EM8_GRVW8_GSU1_SU0_SUS256_SRVW4_VAW2_WG64_4_1_WGM15
    SolutionIndex: 351
    SolutionNameMin: Cijk_Ailk_Bjlk_HBH_MT256x256x32_MI32x32x8x1_SE_AF0EM8_GRVW8_GSU1_SU32_SUS256_SRVW4_VAW2_WG64_4_1_WGM1
    SolutionIndex: 352
    SolutionNameMin: Cijk_Ailk_Bjlk_HBH_MT128x256x16_MI32x32x8x1_SE_AF0EM8_GRVW8_GSU1_SU32_SUS128_SRVW4_VAW2_WG64_4_1_WGM2
    SolutionIndex: 353
    SolutionNameMin: Cijk_Ailk_Bjlk_HBH_MT160x256x32_MI32x32x8x1_SE_AF0EM8_GRVW4_GSU1_SU32_SUS128_SRVW0_VAW2_WG32_8_1_WGM1
    SolutionIndex: 354
    SolutionNameMin: Cijk_Ailk_Bjlk_HBH_MT128x96x64_MI32x32x8x1_SE_AF0EM8_GRVW8_GSU1_SU32_SUS128_SRVW4_VAW2_WG128_2_1_WGM15
    SolutionIndex: 355
    SolutionNameMin: Cijk_Ailk_Bjlk_HBH_MT128x96x64_MI32x32x8x1_SE_AF0EM8_GRVW4_GSU1_SU32_SUS256_SRVW4_VAW2_WG128_2_1_WGM15
    SolutionIndex: 356
    SolutionNameMin: Cijk_Ailk_Bjlk_HBH_MT160x256x32_MI32x32x8x1_SE_AF0EM8_GRVW4_GSU1_SU32_SUS256_SRVW0_VAW2_WG32_8_1_WGM2
    SolutionIndex: 357
    SolutionNameMin: Cijk_Ailk_Bjlk_HBH_MT32x64x16_MI16x16x16x1_SE_AF0EM8_GRVW4_GSU1_SU32_SUS128_SRVW4_VAW2_WG32_8_1_WGM2
    SolutionIndex: 358
    SolutionNameMin: Cijk_Ailk_Bjlk_HBH_MT64x32x16_MI16x16x16x1_SE_AF0EM8_GRVW2_GSU1_SU32_SUS128_SRVW4_VAW2_WG32_8_1_WGM15
    SolutionIndex: 359
    SolutionNameMin: Cijk_Ailk_Bjlk_HBH_MT64x32x16_MI16x16x16x1_SE_AF0EM8_GRVW2_GSU1_SU32_SUS256_SRVW4_VAW2_WG32_8_1_WGM15
    SolutionIndex: 360
    SolutionNameMin: Cijk_Ailk_Bjlk_HBH_MT64x64x16_MI32x32x8x1_SE_AF0EM8_GRVW2_GSU1_SU32_SUS256_SRVW4_VAW2_WG64_4_1_WGM2
    SolutionIndex: 361
    SolutionNameMin: Cijk_Ailk_Bjlk_HBH_MT32x32x64_MI16x16x16x1_SE_AF0EM8_GRVW4_GSU1_SU0_SUS256_SRVW4_VAW2_WG32_8_1_WGM1
    SolutionIndex: 362
    SolutionNameMin: Cijk_Ailk_Bjlk_HBH_MT32x32x64_MI16x16x16x1_SE_AF0EM8_GRVW8_GSU1_SU0_SUS256_SRVW4_VAW2_WG32_8_1_WGM1
    SolutionIndex: 363
    SolutionNameMin: Cijk_Ailk_Bjlk_HBH_MT32x32x64_MI16x16x16x1_SE_AF0EM8_GRVW8_GSU1_SU0_SUS256_SRVW4_VAW2_WG32_8_1_WGM15
    SolutionIndex: 364
    SolutionNameMin: Cijk_Ailk_Bjlk_HBH_MT256x144x32_MI16x16x16x1_SE_AF0EM8_GRVW2_GSU1_SU0_SUS256_SRVW4_VAW2_WG64_4_1_WGM15
    SolutionIndex: 365
    SolutionNameMin: Cijk_Ailk_Bjlk_HBH_MT128x128x64_MI32x32x8x1_SE_AF0EM8_GRVW4_GSU1_SU32_SUS128_SRVW4_VAW2_WG64_4_1_WGM15
    SolutionIndex: 366
    SolutionNameMin: Cijk_Ailk_Bjlk_HBH_MT64x128x64_MI32x32x8x1_SE_AF0EM8_GRVW8_GSU1_SU32_SUS256_SRVW4_VAW2_WG64_4_1_WGM15
    SolutionIndex: 367
    SolutionNameMin: Cijk_Ailk_Bjlk_HBH_MT64x64x64_MI32x32x8x1_SE_AF0EM8_GRVW8_GSU1_SU32_SUS128_SRVW4_VAW2_WG64_4_1_WGM15
    SolutionIndex: 368
    SolutionNameMin: Cijk_Ailk_Bjlk_HBH_MT160x160x32_MI16x16x16x1_SE_AF0EM8_GRVW2_GSU7_SU32_SUS256_SRVW0_VAW1_WG32_8_1_WGM2
    SolutionIndex: 369
    SolutionNameMin: Cijk_Ailk_Bjlk_HBH_MT128x128x64_MI32x32x8x1_SE_AF0EM8_GRVW8_GSU3_SU0_SUS256_SRVW0_VAW1_WG64_4_1_WGM2
    SolutionIndex: 370
    SolutionNameMin: Cijk_Ailk_Bjlk_HBH_MT64x128x64_MI32x32x8x1_SE_AF0EM8_GRVW2_GSU1_SU0_SUS256_SRVW4_VAW2_WG64_4_1_WGM1
    SolutionIndex: 371
    SolutionNameMin: Cijk_Ailk_Bjlk_HBH_MT128x128x64_MI32x32x8x1_SE_AF0EM8_GRVW8_GSU1_SU0_SUS256_SRVW4_VAW2_WG64_4_1_WGM2
    SolutionIndex: 372
    SolutionNameMin: Cijk_Ailk_Bjlk_HBH_MT128x160x32_MI32x32x8x1_SE_AF0EM8_GRVW4_GSU1_SU32_SUS128_SRVW4_VAW2_WG128_2_1_WGM15
    SolutionIndex: 373
    SolutionNameMin: Cijk_Ailk_Bjlk_HBH_MT128x160x32_MI32x32x8x1_SE_AF0EM8_GRVW4_GSU1_SU0_SUS256_SRVW4_VAW2_WG128_2_1_WGM2
    SolutionIndex: 374
    SolutionNameMin: Cijk_Ailk_Bjlk_HBH_MT128x256x32_MI32x32x8x1_SE_AF0EM8_GRVW4_GSU1_SU0_SUS256_SRVW4_VAW2_WG64_4_1_WGM1
    SolutionIndex: 375
    SolutionNameMin: Cijk_Ailk_Bjlk_HBH_MT256x128x32_MI32x32x8x1_SE_AF0EM8_GRVW8_GSU1_SU0_SUS256_SRVW4_VAW2_WG64_4_1_WGM2
    SolutionIndex: 376
    SolutionNameMin: Cijk_Ailk_Bjlk_HBH_MT128x256x32_MI32x32x8x1_SE_AF0EM8_GRVW8_GSU1_SU0_SUS256_SRVW4_VAW2_WG64_4_1_WGM15
    SolutionIndex: 377
    SolutionNameMin: Cijk_Ailk_Bjlk_HBH_MT128x256x32_MI32x32x8x1_SE_AF0EM8_GRVW8_GSU1_SU32_SUS256_SRVW4_VAW2_WG64_4_1_WGM2
    SolutionIndex: 378
    SolutionNameMin: Cijk_Ailk_Bjlk_HBH_MT128x256x32_MI32x32x8x1_SE_AF0EM8_GRVW8_GSU1_SU32_SUS256_SRVW4_VAW2_WG64_4_1_WGM1
    SolutionIndex: 379
    SolutionNameMin: Cijk_Ailk_Bjlk_HBH_MT256x128x32_MI32x32x8x1_SE_AF0EM8_GRVW8_GSU1_SU32_SUS256_SRVW4_VAW2_WG64_4_1_WGM15
    SolutionIndex: 380
    SolutionNameMin: Cijk_Ailk_Bjlk_HBH_MT256x128x32_MI32x32x8x1_SE_AF0EM8_GRVW8_GSU1_SU32_SUS256_SRVW4_VAW2_WG64_4_1_WGM2
    SolutionIndex: 381
    SolutionNameMin: Cijk_Ailk_Bjlk_HBH_MT128x288x32_MI32x32x8x1_SE_AF0EM8_GRVW4_GSU1_SU0_SUS256_SRVW4_VAW2_WG128_2_1_WGM2
    SolutionIndex: 382
    SolutionNameMin: Cijk_Ailk_Bjlk_HBH_MT256x160x32_MI32x32x8x1_SE_AF0EM8_GRVW4_GSU1_SU0_SUS256_SRVW4_VAW2_WG128_2_1_WGM2
    SolutionIndex: 383
    SolutionNameMin: Cijk_Ailk_Bjlk_HBH_MT128x128x32_MI32x32x8x1_SE_AF0EM8_GRVW8_GSU1_SU0_SUS256_SRVW4_VAW2_WG64_4_1_WGM15
    SolutionIndex: 384
    SolutionNameMin: Cijk_Ailk_Bjlk_HBH_MT128x128x32_MI32x32x8x1_SE_AF0EM8_GRVW8_GSU1_SU0_SUS256_SRVW4_VAW2_WG64_4_1_WGM2
    SolutionIndex: 385
    SolutionNameMin: Cijk_Ailk_Bjlk_HBH_MT256x256x16_MI32x32x8x1_SE_AF0EM8_GRVW4_GSU1_SU0_SUS256_SRVW4_VAW2_WG64_4_1_WGM2
    SolutionIndex: 386
    SolutionNameMin: Cijk_Ailk_Bjlk_HBH_MT128x256x32_MI32x32x8x1_SE_AF0EM8_GRVW8_GSU7_SU0_SUS256_SRVW0_VAW1_WG64_4_1_WGM2
    SolutionIndex: 387
    SolutionNameMin: Cijk_Ailk_Bjlk_HBH_MT64x32x32_MI16x16x16x1_SE_AF0EM8_GRVW2_GSU1_SU0_SUS256_SRVW4_VAW2_WG32_8_1_WGM1
    SolutionIndex: 388
    SolutionNameMin: Cijk_Ailk_Bjlk_HBH_MT64x64x32_MI32x32x8x1_SE_AF0EM8_GRVW4_GSU1_SU0_SUS256_SRVW4_VAW2_WG64_4_1_WGM15
    SolutionIndex: 389
    SolutionNameMin: Cijk_Ailk_Bjlk_HBH_MT128x128x32_MI32x32x8x1_SE_AF0EM8_GRVW8_GSU1_SU32_SUS128_SRVW4_VAW2_WG64_4_1_WGM1
    SolutionIndex: 390
    SolutionNameMin: Cijk_Ailk_Bjlk_HBH_MT64x64x64_MI32x32x8x1_SE_AF0EM8_GRVW8_GSU1_SU0_SUS256_SRVW4_VAW2_WG64_4_1_WGM2
    SolutionIndex: 391
    SolutionNameMin: Cijk_Ailk_Bjlk_HBH_MT64x64x64_MI32x32x8x1_SE_AF0EM8_GRVW8_GSU1_SU32_SUS128_SRVW4_VAW2_WG64_4_1_WGM2
    SolutionIndex: 392
    SolutionNameMin: Cijk_Ailk_Bjlk_HBH_MT96x96x64_MI16x16x16x1_SE_AF0EM8_GRVW8_GSU3_SU0_SUS256_SRVW0_VAW1_WG32_8_1_WGM1
    SolutionIndex: 393
    SolutionNameMin: Cijk_Ailk_Bjlk_HBH_MT96x96x64_MI16x16x16x1_SE_AF0EM8_GRVW8_GSU3_SU32_SUS128_SRVW0_VAW1_WG32_8_1_WGM2
    SolutionIndex: 394
    SolutionNameMin: Cijk_Ailk_Bjlk_HBH_MT96x96x64_MI16x16x16x1_SE_AF0EM8_GRVW8_GSU3_SU32_SUS256_SRVW0_VAW1_WG32_8_1_WGM1
    SolutionIndex: 395
    SolutionNameMin: Cijk_Ailk_Bjlk_HBH_MT96x96x64_MI16x16x16x1_SE_AF0EM8_GRVW8_GSU3_SU32_SUS128_SRVW0_VAW1_WG32_8_1_WGM15
    SolutionIndex: 396
    SolutionNameMin: Cijk_Ailk_Bjlk_HBH_MT96x96x64_MI16x16x16x1_SE_AF0EM8_GRVW8_GSU3_SU0_SUS256_SRVW0_VAW1_WG32_8_1_WGM2
    SolutionIndex: 397
    SolutionNameMin: Cijk_Ailk_Bjlk_HBH_MT128x128x64_MI32x32x8x1_SE_AF0EM8_GRVW8_GSU7_SU32_SUS128_SRVW0_VAW1_WG64_4_1_WGM1
    SolutionIndex: 398
    SolutionNameMin: Cijk_Ailk_Bjlk_HBH_MT128x128x64_MI32x32x8x1_SE_AF0EM8_GRVW4_GSU7_SU32_SUS128_SRVW0_VAW1_WG64_4_1_WGM1
    SolutionIndex: 399
    SolutionNameMin: Cijk_Ailk_Bjlk_HBH_MT128x128x64_MI32x32x8x1_SE_AF0EM8_GRVW8_GSU7_SU0_SUS256_SRVW0_VAW1_WG64_4_1_WGM1
    SolutionIndex: 400
    SolutionNameMin: Cijk_Ailk_Bjlk_HBH_MT128x128x64_MI32x32x8x1_SE_AF0EM8_GRVW2_GSU7_SU32_SUS128_SRVW0_VAW1_WG64_4_1_WGM1
    SolutionIndex: 401
    SolutionNameMin: Cijk_Ailk_Bjlk_HBH_MT128x128x64_MI32x32x8x1_SE_AF0EM8_GRVW4_GSU7_SU0_SUS256_SRVW0_VAW1_WG64_4_1_WGM1
    SolutionIndex: 402
    SolutionNameMin: Cijk_Ailk_Bjlk_HBH_MT128x128x64_MI32x32x8x1_SE_AF0EM8_GRVW2_GSU7_SU0_SUS256_SRVW0_VAW1_WG64_4_1_WGM1
    SolutionIndex: 403
    SolutionNameMin: Cijk_Ailk_Bjlk_HBH_MT128x128x64_MI32x32x8x1_SE_AF0EM8_GRVW8_GSU7_SU0_SUS256_SRVW0_VAW1_WG64_4_1_WGM15
    SolutionIndex: 404
    SolutionNameMin: Cijk_Ailk_Bjlk_HBH_MT128x128x64_MI32x32x8x1_SE_AF0EM8_GRVW2_GSU7_SU32_SUS128_SRVW0_VAW1_WG64_4_1_WGM2
    SolutionIndex: 405
    SolutionNameMin: Cijk_Ailk_Bjlk_HBH_MT256x144x32_MI16x16x16x1_SE_AF0EM8_GRVW2_GSU15_SU32_SUS128_SRVW0_VAW1_WG64_4_1_WGM2
    SolutionIndex: 406
    SolutionNameMin: Cijk_Ailk_Bjlk_HBH_MT128x128x64_MI32x32x8x1_SE_AF0EM8_GRVW8_GSU1_SU32_SUS256_SRVW4_VAW2_WG64_4_1_WGM1
    SolutionIndex: 407
    SolutionNameMin: Cijk_Ailk_Bjlk_HBH_MT64x128x64_MI32x32x8x1_SE_AF0EM8_GRVW8_GSU1_SU32_SUS256_SRVW4_VAW2_WG64_4_1_WGM1
    SolutionIndex: 408
    SolutionNameMin: Cijk_Ailk_Bjlk_HBH_MT64x64x16_MI32x32x8x1_SE_AF0EM8_GRVW8_GSU1_SU0_SUS256_SRVW4_VAW2_WG64_4_1_WGM2
    SolutionIndex: 409
    SolutionNameMin: Cijk_Ailk_Bjlk_HBH_MT128x256x32_MI32x32x8x1_SE_AF0EM8_GRVW8_GSU1_SU32_SUS256_SRVW4_VAW2_WG64_4_1_WGM15
    SolutionIndex: 410
    SolutionNameMin: Cijk_Ailk_Bjlk_HBH_MT256x128x32_MI32x32x8x1_SE_AF0EM8_GRVW4_GSU1_SU32_SUS128_SRVW4_VAW2_WG64_4_1_WGM2
    SolutionIndex: 411
    SolutionNameMin: Cijk_Ailk_Bjlk_HBH_MT16x16x16_MI16x16x16x1_SE_AF0EM8_GRVW2_GSU1_SU32_SUS256_SRVW0_VAW2_WG16_4_1_WGM1
    SolutionIndex: 412
    SolutionNameMin: Cijk_Ailk_Bjlk_HBH_MT256x256x16_MI32x32x8x1_SE_AF0EM8_GRVW8_GSU1_SU0_SUS256_SRVW4_VAW2_WG64_4_1_WGM15
    SolutionIndex: 413
    SolutionNameMin: Cijk_Ailk_Bjlk_HBH_MT128x256x16_MI32x32x8x1_SE_AF0EM8_GRVW8_GSU1_SU32_SUS256_SRVW4_VAW2_WG64_4_1_WGM2
    SolutionIndex: 414
    SolutionNameMin: Cijk_Ailk_Bjlk_HBH_MT128x64x16_MI32x32x8x1_SE_AF0EM8_GRVW2_GSU1_SU0_SUS256_SRVW4_VAW2_WG64_4_1_WGM1
    SolutionIndex: 415
    SolutionNameMin: Cijk_Ailk_Bjlk_HBH_MT256x256x16_MI32x32x8x1_SE_AF0EM8_GRVW8_GSU1_SU0_SUS256_SRVW4_VAW2_WG64_4_1_WGM1
    SolutionIndex: 416
    SolutionNameMin: Cijk_Ailk_Bjlk_HBH_MT64x128x32_MI32x32x8x1_SE_AF0EM8_GRVW8_GSU1_SU0_SUS256_SRVW4_VAW2_WG64_4_1_WGM1
    SolutionIndex: 417
    SolutionNameMin: Cijk_Ailk_Bjlk_HBH_MT256x256x16_MI32x32x8x1_SE_AF0EM8_GRVW4_GSU1_SU32_SUS128_SRVW4_VAW2_WG64_4_1_WGM1
    SolutionIndex: 418
    SolutionNameMin: Cijk_Ailk_Bjlk_HBH_MT64x64x16_MI32x32x8x1_SE_AF0EM8_GRVW4_GSU1_SU32_SUS256_SRVW4_VAW2_WG64_4_1_WGM15
    SolutionIndex: 419
    SolutionNameMin: Cijk_Ailk_Bjlk_HBH_MT128x160x32_MI32x32x8x1_SE_AF0EM8_GRVW4_GSU1_SU0_SUS256_SRVW4_VAW2_WG128_2_1_WGM1
    SolutionIndex: 420
    SolutionNameMin: Cijk_Ailk_Bjlk_HBH_MT256x256x16_MI32x32x8x1_SE_AF0EM8_GRVW8_GSU1_SU0_SUS256_SRVW4_VAW2_WG64_4_1_WGM1
    SolutionIndex: 421
    SolutionNameMin: Cijk_Ailk_Bjlk_HBH_MT128x96x64_MI32x32x8x1_SE_AF0EM8_GRVW8_GSU1_SU0_SUS256_SRVW4_VAW2_WG128_2_1_WGM1
    SolutionIndex: 422
    SolutionNameMin: Cijk_Ailk_Bjlk_HBH_MT256x256x32_MI32x32x8x1_SE_AF0EM8_GRVW8_GSU1_SU32_SUS128_SRVW4_VAW2_WG64_4_1_WGM15
    SolutionIndex: 423
    SolutionNameMin: Cijk_Ailk_Bjlk_HBH_MT128x128x32_MI32x32x8x1_SE_AF0EM8_GRVW8_GSU1_SU0_SUS256_SRVW4_VAW2_WG64_4_1_WGM1
    SolutionIndex: 424
    SolutionNameMin: Cijk_Ailk_Bjlk_HBH_MT256x64x32_MI32x32x8x1_SE_AF0EM8_GRVW8_GSU1_SU0_SUS256_SRVW4_VAW2_WG64_4_1_WGM15
    SolutionIndex: 425
    SolutionNameMin: Cijk_Ailk_Bjlk_HBH_MT128x256x16_MI32x32x8x1_SE_AF0EM8_GRVW8_GSU1_SU0_SUS256_SRVW4_VAW2_WG64_4_1_WGM1
    SolutionIndex: 426
    SolutionNameMin: Cijk_Ailk_Bjlk_HBH_MT128x64x32_MI32x32x8x1_SE_AF0EM8_GRVW8_GSU1_SU0_SUS256_SRVW4_VAW2_WG64_4_1_WGM1
    SolutionIndex: 427
    SolutionNameMin: Cijk_Ailk_Bjlk_HBH_MT128x64x16_MI32x32x8x1_SE_AF0EM8_GRVW4_GSU1_SU0_SUS256_SRVW4_VAW2_WG64_4_1_WGM15
    SolutionIndex: 428
    SolutionNameMin: Cijk_Ailk_Bjlk_HBH_MT64x16x32_MI16x16x16x1_SE_AF0EM8_GRVW4_GSU1_SU0_SUS256_SRVW0_VAW2_WG64_4_1_WGM1
    SolutionIndex: 429
    SolutionNameMin: Cijk_Ailk_Bjlk_HBH_MT256x256x32_MI32x32x8x1_SE_AF0EM8_GRVW8_GSU1_SU32_SUS256_SRVW4_VAW2_WG64_4_1_WGM2
    SolutionIndex: 430
    SolutionNameMin: Cijk_Ailk_Bjlk_HBH_MT64x128x16_MI32x32x8x1_SE_AF0EM8_GRVW2_GSU1_SU0_SUS256_SRVW4_VAW2_WG64_4_1_WGM1
    SolutionIndex: 431
    SolutionNameMin: Cijk_Ailk_Bjlk_HBH_MT128x64x16_MI32x32x8x1_SE_AF0EM8_GRVW2_GSU1_SU32_SUS256_SRVW4_VAW2_WG64_4_1_WGM15
    SolutionIndex: 432
    SolutionNameMin: Cijk_Ailk_Bjlk_HBH_MT128x64x64_MI32x32x8x1_SE_AF0EM8_GRVW8_GSU1_SU32_SUS256_SRVW4_VAW2_WG64_4_1_WGM15
    SolutionIndex: 433
    SolutionNameMin: Cijk_Ailk_Bjlk_HBH_MT128x64x64_MI32x32x8x1_SE_AF0EM8_GRVW8_GSU1_SU32_SUS128_SRVW4_VAW2_WG64_4_1_WGM15
    SolutionIndex: 434
    SolutionNameMin: Cijk_Ailk_Bjlk_HBH_MT128x64x64_MI32x32x8x1_SE_AF0EM8_GRVW8_GSU1_SU32_SUS128_SRVW4_VAW2_WG64_4_1_WGM2
    SolutionIndex: 435
    SolutionNameMin: Cijk_Ailk_Bjlk_HBH_MT64x32x64_MI16x16x16x1_SE_AF0EM8_GRVW8_GSU7_SU32_SUS256_SRVW0_VAW1_WG32_8_1_WGM1
    SolutionIndex: 436
    SolutionNameMin: Cijk_Ailk_Bjlk_HBH_MT64x32x64_MI16x16x16x1_SE_AF0EM8_GRVW8_GSU7_SU32_SUS256_SRVW0_VAW1_WG32_8_1_WGM2
    SolutionIndex: 437
    SolutionNameMin: Cijk_Ailk_Bjlk_HBH_MT64x64x64_MI32x32x8x1_SE_AF0EM8_GRVW8_GSU15_SU32_SUS128_SRVW0_VAW1_WG64_4_1_WGM15
    SolutionIndex: 438
    SolutionNameMin: Cijk_Ailk_Bjlk_HBH_MT64x32x64_MI16x16x16x1_SE_AF0EM8_GRVW8_GSU15_SU32_SUS256_SRVW0_VAW1_WG32_8_1_WGM2
    SolutionIndex: 439
    SolutionNameMin: Cijk_Ailk_Bjlk_HBH_MT64x32x16_MI16x16x16x1_SE_AF0EM8_GRVW2_GSU1_SU0_SUS256_SRVW4_VAW2_WG32_8_1_WGM1
    SolutionIndex: 440
    SolutionNameMin: Cijk_Ailk_Bjlk_HBH_MT64x128x64_MI32x32x8x1_SE_AF0EM8_GRVW8_GSU1_SU32_SUS128_SRVW4_VAW2_WG64_4_1_WGM15
    SolutionIndex: 441
    SolutionNameMin: Cijk_Ailk_Bjlk_HBH_MT96x128x64_MI32x32x8x1_SE_AF0EM8_GRVW2_GSU3_SU32_SUS128_SRVW0_VAW1_WG32_8_1_WGM2
    SolutionIndex: 442
    SolutionNameMin: Cijk_Ailk_Bjlk_HBH_MT128x64x32_MI32x32x8x1_SE_AF0EM8_GRVW8_GSU1_SU32_SUS128_SRVW4_VAW2_WG64_4_1_WGM1
    SolutionIndex: 443
    SolutionNameMin: Cijk_Ailk_Bjlk_HBH_MT96x96x64_MI16x16x16x1_SE_AF0EM8_GRVW8_GSU5_SU32_SUS128_SRVW0_VAW1_WG32_8_1_WGM2
    SolutionIndex: 444
    SolutionNameMin: Cijk_Ailk_Bjlk_HBH_MT96x96x64_MI16x16x16x1_SE_AF0EM8_GRVW8_GSU5_SU32_SUS256_SRVW0_VAW1_WG32_8_1_WGM2
    SolutionIndex: 445
    SolutionNameMin: Cijk_Ailk_Bjlk_HBH_MT128x128x32_MI32x32x8x1_SE_AF0EM8_GRVW8_GSU15_SU0_SUS256_SRVW0_VAW1_WG64_4_1_WGM2
    SolutionIndex: 446
    SolutionNameMin: Cijk_Ailk_Bjlk_HBH_MT128x64x64_MI32x32x8x1_SE_AF0EM8_GRVW8_GSU7_SU0_SUS256_SRVW0_VAW1_WG64_4_1_WGM2
    SolutionIndex: 447
    SolutionNameMin: Cijk_Ailk_Bjlk_HBH_MT32x32x64_MI16x16x16x1_SE_AF0EM8_GRVW4_GSU1_SU0_SUS256_SRVW4_VAW2_WG32_8_1_WGM15
    SolutionIndex: 448
    SolutionNameMin: Cijk_Ailk_Bjlk_HBH_MT256x256x16_MI32x32x8x1_SE_AF0EM8_GRVW8_GSU1_SU32_SUS128_SRVW4_VAW2_WG64_4_1_WGM2
    SolutionIndex: 449
    SolutionNameMin: Cijk_Ailk_Bjlk_HBH_MT256x256x16_MI32x32x8x1_SE_AF0EM8_GRVW8_GSU1_SU0_SUS256_SRVW4_VAW2_WG64_4_1_WGM15
    SolutionIndex: 450
    SolutionNameMin: Cijk_Ailk_Bjlk_HBH_MT256x256x16_MI32x32x8x1_SE_AF0EM8_GRVW8_GSU1_SU32_SUS256_SRVW4_VAW2_WG64_4_1_WGM2
    SolutionIndex: 451
    SolutionNameMin: Cijk_Ailk_Bjlk_HBH_MT16x16x16_MI16x16x16x1_SE_AF0EM8_GRVW2_GSU1_SU0_SUS256_SRVW0_VAW2_WG16_4_1_WGM15
    SolutionIndex: 452
    SolutionNameMin: Cijk_Ailk_Bjlk_HBH_MT128x96x64_MI32x32x8x1_SE_AF0EM8_GRVW4_GSU1_SU0_SUS256_SRVW4_VAW2_WG128_2_1_WGM15
    SolutionIndex: 453
    SolutionNameMin: Cijk_Ailk_Bjlk_HBH_MT64x64x16_MI32x32x8x1_SE_AF0EM8_GRVW4_GSU1_SU0_SUS256_SRVW4_VAW2_WG64_4_1_WGM2
    SolutionIndex: 454
    SolutionNameMin: Cijk_Ailk_Bjlk_HBH_MT16x16x16_MI16x16x16x1_SE_AF0EM8_GRVW2_GSU1_SU0_SUS256_SRVW0_VAW2_WG16_4_1_WGM2
    SolutionIndex: 455
    SolutionNameMin: Cijk_Ailk_Bjlk_HBH_MT128x64x16_MI32x32x8x1_SE_AF0EM8_GRVW2_GSU1_SU32_SUS128_SRVW4_VAW2_WG64_4_1_WGM1
    SolutionIndex: 456
    SolutionNameMin: Cijk_Ailk_Bjlk_HBH_MT64x128x16_MI32x32x8x1_SE_AF0EM8_GRVW2_GSU1_SU32_SUS256_SRVW4_VAW2_WG64_4_1_WGM15
    SolutionIndex: 457
    SolutionNameMin: Cijk_Ailk_Bjlk_HBH_MT256x256x16_MI32x32x8x1_SE_AF0EM8_GRVW4_GSU1_SU32_SUS128_SRVW4_VAW2_WG64_4_1_WGM2
    SolutionIndex: 458
    SolutionNameMin: Cijk_Ailk_Bjlk_HBH_MT32x32x16_MI16x16x16x1_SE_AF0EM8_GRVW4_GSU1_SU0_SUS256_SRVW4_VAW2_WG32_8_1_WGM1
    SolutionIndex: 459
    SolutionNameMin: Cijk_Ailk_Bjlk_HBH_MT64x128x16_MI32x32x8x1_SE_AF0EM8_GRVW2_GSU1_SU32_SUS128_SRVW4_VAW2_WG64_4_1_WGM1
    SolutionIndex: 460
    SolutionNameMin: Cijk_Ailk_Bjlk_HBH_MT16x64x64_MI16x16x16x1_SE_AF0EM1_GRVW8_GSU15_SU0_SUS256_SRVW0_VAW1_WG16_16_1_WGM1
    SolutionIndex: 461
    SolutionNameMin: Cijk_Ailk_Bjlk_HBH_MT128x256x32_MI32x32x8x1_SE_AF0EM1_GRVW8_GSU7_SU32_SUS128_SRVW0_VAW1_WG64_4_1_WGM1
    SolutionIndex: 462
    SolutionNameMin: Cijk_Ailk_Bjlk_HBH_MT16x16x16_MI16x16x16x1_SE_AF0EM1_GRVW2_GSU1_SU0_SUS256_SRVW4_VAW2_WG16_4_1_WGM1
    SolutionIndex: 463
    SolutionNameMin: Cijk_Ailk_Bjlk_HBH_MT16x16x16_MI16x16x16x1_SE_AF0EM1_GRVW2_GSU1_SU32_SUS128_SRVW4_VAW2_WG16_4_1_WGM1
    SolutionIndex: 464
    SolutionNameMin: Cijk_Ailk_Bjlk_HBH_MT32x64x16_MI16x16x16x1_SE_AF0EM1_GRVW8_GSU1_SU32_SUS256_SRVW4_VAW2_WG32_8_1_WGM2
    SolutionIndex: 465
    SolutionNameMin: Cijk_Ailk_Bjlk_HBH_MT32x64x16_MI16x16x16x1_SE_AF0EM1_GRVW4_GSU1_SU32_SUS256_SRVW4_VAW2_WG32_8_1_WGM2
    SolutionIndex: 466
    SolutionNameMin: Cijk_Ailk_Bjlk_HBH_MT32x64x16_MI16x16x16x1_SE_AF0EM1_GRVW2_GSU1_SU32_SUS128_SRVW4_VAW2_WG32_8_1_WGM2
    SolutionIndex: 467
    SolutionNameMin: Cijk_Ailk_Bjlk_HBH_MT32x32x16_MI16x16x16x1_SE_AF0EM1_GRVW2_GSU1_SU32_SUS128_SRVW4_VAW2_WG32_8_1_WGM1
    SolutionIndex: 468
    SolutionNameMin: Cijk_Ailk_Bjlk_HBH_MT64x64x16_MI32x32x8x1_SE_AF0EM1_GRVW2_GSU1_SU32_SUS128_SRVW4_VAW2_WG64_4_1_WGM2
    SolutionIndex: 469
    SolutionNameMin: Cijk_Ailk_Bjlk_HBH_MT32x32x64_MI16x16x16x1_SE_AF0EM1_GRVW2_GSU1_SU32_SUS128_SRVW4_VAW2_WG32_8_1_WGM1
    SolutionIndex: 470
    SolutionNameMin: Cijk_Ailk_Bjlk_HBH_MT16x16x16_MI16x16x16x1_SE_AF0EM1_GRVW4_GSU1_SU0_SUS256_SRVW0_VAW2_WG16_4_1_WGM1
    SolutionIndex: 471
    SolutionNameMin: Cijk_Ailk_Bjlk_HBH_MT32x32x16_MI16x16x16x1_SE_AF0EM1_GRVW2_GSU1_SU0_SUS256_SRVW4_VAW2_WG32_8_1_WGM1
    SolutionIndex: 472
    SolutionNameMin: Cijk_Ailk_Bjlk_HBH_MT16x16x16_MI16x16x16x1_SE_AF0EM1_GRVW2_GSU1_SU0_SUS256_SRVW0_VAW2_WG16_4_1_WGM1
    SolutionIndex: 473
    SolutionNameMin: Cijk_Ailk_Bjlk_HBH_MT16x16x16_MI16x16x16x1_SE_AF0EM1_GRVW4_GSU1_SU32_SUS128_SRVW0_VAW2_WG16_4_1_WGM1
    SolutionIndex: 474
    SolutionNameMin: Cijk_Ailk_Bjlk_HBH_MT32x64x16_MI16x16x16x1_SE_AF0EM1_GRVW2_GSU1_SU32_SUS256_SRVW4_VAW2_WG32_8_1_WGM2
    SolutionIndex: 475
    SolutionNameMin: Cijk_Ailk_Bjlk_HBH_MT64x32x16_MI16x16x16x1_SE_AF0EM1_GRVW2_GSU1_SU0_SUS256_SRVW4_VAW2_WG32_8_1_WGM1
    SolutionIndex: 476
    SolutionNameMin: Cijk_Ailk_Bjlk_HBH_MT64x32x16_MI16x16x16x1_SE_AF0EM1_GRVW4_GSU1_SU32_SUS128_SRVW4_VAW2_WG32_8_1_WGM1
    SolutionIndex: 477
    SolutionNameMin: Cijk_Ailk_Bjlk_HBH_MT32x32x64_MI16x16x16x1_SE_AF0EM1_GRVW2_GSU1_SU0_SUS256_SRVW4_VAW2_WG32_8_1_WGM2
    SolutionIndex: 478
    SolutionNameMin: Cijk_Ailk_Bjlk_HBH_MT32x32x64_MI16x16x16x1_SE_AF0EM1_GRVW4_GSU1_SU0_SUS256_SRVW4_VAW2_WG32_8_1_WGM1
    SolutionIndex: 479
    SolutionNameMin: Cijk_Ailk_Bjlk_HBH_MT64x64x64_MI32x32x8x1_SE_AF0EM1_GRVW4_GSU1_SU32_SUS128_SRVW4_VAW2_WG64_4_1_WGM2
    SolutionIndex: 480
    SolutionNameMin: Cijk_Ailk_Bjlk_HBH_MT96x128x64_MI32x32x8x1_SE_AF0EM1_GRVW4_GSU1_SU32_SUS256_SRVW0_VAW2_WG32_8_1_WGM15
    SolutionIndex: 481
    SolutionNameMin: Cijk_Ailk_Bjlk_HBH_MT16x64x64_MI16x16x16x1_SE_AF0EM1_GRVW8_GSU15_SU0_SUS256_SRVW0_VAW1_WG16_16_1_WGM15
    SolutionIndex: 482
    SolutionNameMin: Cijk_Ailk_Bjlk_HBH_MT16x64x64_MI16x16x16x1_SE_AF0EM1_GRVW2_GSU15_SU32_SUS256_SRVW0_VAW1_WG16_16_1_WGM15
    SolutionIndex: 483
    SolutionNameMin: Cijk_Ailk_Bjlk_HBH_MT16x64x64_MI16x16x16x1_SE_AF0EM1_GRVW8_GSU15_SU0_SUS256_SRVW0_VAW1_WG16_16_1_WGM2
    SolutionIndex: 484
    SolutionNameMin: Cijk_Ailk_Bjlk_HBH_MT16x16x32_MI16x16x16x1_SE_AF0EM1_GRVW2_GSU1_SU0_SUS256_SRVW0_VAW2_WG16_4_1_WGM2
    SolutionIndex: 485
    SolutionNameMin: Cijk_Ailk_Bjlk_HBH_MT64x64x16_MI32x32x8x1_SE_1LDSB0_GRVW8_NLCA1_NLCB1_SU32_SUS256_SRVW4_TT1_32_WG64_4_1_WGM2
    SolutionIndex: 486
    SolutionNameMin: Cijk_Ailk_Bjlk_HBH_MT128x64x16_MI32x32x8x1_SE_1LDSB0_GRVW8_NLCA1_NLCB1_SU0_SUS256_SRVW4_TT2_32_WG64_4_1_WGM2
    SolutionIndex: 487
    SolutionNameMin: Cijk_Ailk_Bjlk_HBH_MT128x128x32_MI32x32x8x1_SE_1LDSB0_GRVW8_NLCA1_NLCB1_SU0_SUS256_SRVW4_TT2_64_WG64_4_1_WGM1
    SolutionIndex: 488
    SolutionNameMin: Cijk_Ailk_Bjlk_HBH_MT128x256x16_MI32x32x8x1_SE_1LDSB1_GRVW8_NLCA1_NLCB1_SU0_SUS256_SRVW4_TT2_128_WG64_4_1_WGM2
    SolutionIndex: 489
    SolutionNameMin: Cijk_Ailk_Bjlk_HBH_MT128x256x32_MI32x32x8x1_SE_1LDSB1_GRVW2_NLCA1_NLCB2_SU0_SUS256_SRVW4_TT2_128_WG64_4_1_WGM1
    SolutionIndex: 490
    SolutionNameMin: Cijk_Ailk_Bjlk_HBH_MT128x256x16_MI32x32x8x1_SE_1LDSB1_GRVW8_NLCA1_NLCB1_SU0_SUS256_SRVW4_TT2_128_WG64_4_1_WGM15
    SolutionIndex: 491
    SolutionNameMin: Cijk_Ailk_Bjlk_HBH_MT128x256x16_MI32x32x8x1_SE_1LDSB0_GRVW8_NLCA1_NLCB1_SU0_SUS256_SRVW4_TT2_128_WG64_4_1_WGM2
    SolutionIndex: 492
    SolutionNameMin: Cijk_Ailk_Bjlk_HBH_MT64x64x16_MI32x32x8x1_SE_1LDSB0_GRVW8_NLCA1_NLCB1_SU32_SUS256_SRVW4_TT1_32_WG64_4_1_WGM1
    SolutionIndex: 493
    SolutionNameMin: Cijk_Ailk_Bjlk_HBH_MT64x64x32_MI32x32x8x1_SE_1LDSB0_GRVW4_NLCA1_NLCB1_SU0_SUS256_SRVW4_TT1_32_WG64_4_1_WGM1
    SolutionIndex: 494
    SolutionNameMin: Cijk_Ailk_Bjlk_HBH_MT128x128x32_MI32x32x8x1_SE_1LDSB0_GRVW8_NLCA1_NLCB1_SU32_SUS128_SRVW4_TT2_64_WG64_4_1_WGM15
    SolutionIndex: 495
    SolutionNameMin: Cijk_Ailk_Bjlk_HBH_MT128x256x32_MI32x32x8x1_SE_1LDSB1_GRVW2_NLCA1_NLCB2_SU0_SUS256_SRVW4_TT2_128_WG64_4_1_WGM2
    SolutionIndex: 496
    SolutionNameMin: Cijk_Ailk_Bjlk_HBH_MT128x128x32_MI32x32x8x1_SE_1LDSB0_GRVW8_NLCA1_NLCB1_SU32_SUS256_SRVW4_TT2_64_WG64_4_1_WGM15
    SolutionIndex: 497
    SolutionNameMin: Cijk_Ailk_Bjlk_HBH_MT128x256x16_MI32x32x8x1_SE_1LDSB1_GRVW8_NLCA1_NLCB1_SU0_SUS256_SRVW4_TT2_128_WG64_4_1_WGM1
    SolutionIndex: 498
    SolutionNameMin: Cijk_Ailk_Bjlk_HBH_MT64x64x32_MI32x32x8x1_SE_1LDSB0_GRVW8_NLCA1_NLCB1_SU0_SUS256_SRVW4_TT1_32_WG64_4_1_WGM1
    SolutionIndex: 499
    SolutionNameMin: Cijk_Ailk_Bjlk_HBH_MT128x128x16_MI32x32x8x1_SE_1LDSB0_GRVW8_NLCA1_NLCB1_SU0_SUS256_SRVW4_TT2_64_WG64_4_1_WGM1
    SolutionIndex: 500
    SolutionNameMin: Cijk_Ailk_Bjlk_HBH_MT128x128x32_MI32x32x8x1_SE_1LDSB0_GRVW8_NLCA1_NLCB1_SU32_SUS256_SRVW4_TT2_64_WG64_4_1_WGM1
    SolutionIndex: 501
    SolutionNameMin: Cijk_Ailk_Bjlk_HBH_MT128x128x32_MI32x32x8x1_SE_1LDSB0_GRVW8_NLCA1_NLCB1_SU0_SUS256_SRVW4_TT2_64_WG64_4_1_WGM15
    SolutionIndex: 502
    SolutionNameMin: Cijk_Ailk_Bjlk_HBH_MT64x128x16_MI32x32x8x1_SE_1LDSB0_GRVW2_NLCA1_NLCB1_SU32_SUS256_SRVW4_TT1_64_WG64_4_1_WGM2
    SolutionIndex: 503
    SolutionNameMin: Cijk_Ailk_Bjlk_HBH_MT64x128x16_MI32x32x8x1_SE_1LDSB0_GRVW8_NLCA1_NLCB1_SU0_SUS256_SRVW4_TT1_64_WG64_4_1_WGM2
    SolutionIndex: 504
    SolutionNameMin: Cijk_Ailk_Bjlk_HBH_MT64x128x32_MI32x32x8x1_SE_1LDSB0_GRVW8_NLCA1_NLCB1_SU32_SUS128_SRVW4_TT1_64_WG64_4_1_WGM1
    SolutionIndex: 505
    SolutionNameMin: Cijk_Ailk_Bjlk_HBH_MT64x128x16_MI32x32x8x1_SE_1LDSB0_GRVW2_NLCA1_NLCB1_SU0_SUS256_SRVW4_TT1_64_WG64_4_1_WGM15
    SolutionIndex: 506
    SolutionNameMin: Cijk_Ailk_Bjlk_HBH_MT64x128x16_MI32x32x8x1_SE_1LDSB0_GRVW4_NLCA1_NLCB1_SU0_SUS256_SRVW4_TT1_64_WG64_4_1_WGM1
    SolutionIndex: 507
    SolutionNameMin: Cijk_Ailk_Bjlk_HBH_MT64x128x32_MI32x32x8x1_SE_1LDSB0_GRVW8_NLCA1_NLCB1_SU0_SUS256_SRVW4_TT1_64_WG64_4_1_WGM15
    SolutionIndex: 508
    SolutionNameMin: Cijk_Ailk_Bjlk_HBH_MT64x128x32_MI32x32x8x1_SE_1LDSB0_GRVW8_NLCA1_NLCB1_SU0_SUS256_SRVW4_TT1_64_WG64_4_1_WGM1
    SolutionIndex: 509
    SolutionNameMin: Cijk_Ailk_Bjlk_HBH_MT64x128x16_MI32x32x8x1_SE_1LDSB0_GRVW2_NLCA1_NLCB1_SU32_SUS128_SRVW4_TT1_64_WG64_4_1_WGM2
    SolutionIndex: 510
    SolutionNameMin: Cijk_Ailk_Bjlk_HBH_MT64x256x16_MI32x32x8x1_SE_1LDSB0_GRVW8_NLCA1_NLCB1_SU32_SUS256_SRVW4_TT1_128_WG64_4_1_WGM1
    SolutionIndex: 511
    SolutionNameMin: Cijk_Ailk_Bjlk_HBH_MT64x256x16_MI32x32x8x1_SE_1LDSB0_GRVW8_NLCA1_NLCB1_SU0_SUS256_SRVW4_TT1_128_WG64_4_1_WGM2
    SolutionIndex: 512
    SolutionNameMin: Cijk_Ailk_Bjlk_HBH_MT64x128x16_MI32x32x8x1_SE_1LDSB0_GRVW8_NLCA1_NLCB1_SU32_SUS256_SRVW4_TT1_64_WG64_4_1_WGM1
    SolutionIndex: 513
    SolutionNameMin: Cijk_Ailk_Bjlk_HBH_MT64x128x32_MI32x32x8x1_SE_1LDSB0_GRVW8_NLCA1_NLCB1_SU32_SUS256_SRVW4_TT1_64_WG64_4_1_WGM1
    SolutionIndex: 514
    SolutionNameMin: Cijk_Ailk_Bjlk_HBH_MT64x128x32_MI32x32x8x1_SE_1LDSB0_GRVW8_NLCA1_NLCB1_SU32_SUS256_SRVW4_TT1_64_WG64_4_1_WGM15
    SolutionIndex: 515
    SolutionNameMin: Cijk_Ailk_Bjlk_HBH_MT128x128x32_MI32x32x8x1_SE_1LDSB0_GRVW8_NLCA1_NLCB1_SU0_SUS256_SRVW4_TT2_64_WG64_4_1_WGM15
    SolutionIndex: 516
    SolutionNameMin: Cijk_Ailk_Bjlk_HBH_MT128x256x16_MI32x32x8x1_SE_1LDSB1_GRVW8_NLCA1_NLCB1_SU0_SUS256_SRVW4_TT2_128_WG64_4_1_WGM2
    SolutionIndex: 517
    SolutionNameMin: Cijk_Ailk_Bjlk_HBH_MT64x128x64_MI32x32x8x1_SE_1LDSB0_GRVW8_NLCA1_NLCB1_SU32_SUS128_SRVW4_TT1_64_WG64_4_1_WGM1
    SolutionIndex: 518
    SolutionNameMin: Cijk_Ailk_Bjlk_HBH_MT64x128x32_MI32x32x8x1_SE_1LDSB0_GRVW8_NLCA1_NLCB1_SU0_SUS256_SRVW4_TT1_64_WG64_4_1_WGM2
    SolutionIndex: 519
    SolutionNameMin: Cijk_Ailk_Bjlk_HBH_MT128x128x32_MI32x32x8x1_SE_1LDSB0_GRVW8_NLCA1_NLCB1_SU0_SUS256_SRVW4_TT2_64_WG64_4_1_WGM2
    SolutionIndex: 520
    SolutionNameMin: Cijk_Ailk_Bjlk_HBH_MT128x128x32_MI32x32x8x1_SE_1LDSB0_GRVW8_NLCA1_NLCB1_SU0_SUS256_SRVW4_TT2_64_WG64_4_1_WGM1
    SolutionIndex: 521
    SolutionNameMin: Cijk_Ailk_Bjlk_HBH_MT256x160x32_MI32x32x8x1_SE_1LDSB0_GRVW4_NLCA1_NLCB5_SU32_SUS128_SRVW4_TT2_160_WG128_2_1_WGM1
    SolutionIndex: 522
    SolutionNameMin: Cijk_Ailk_Bjlk_HBH_MT64x128x16_MI32x32x8x1_SE_1LDSB0_GRVW8_NLCA1_NLCB1_SU32_SUS128_SRVW4_TT1_64_WG64_4_1_WGM15
    SolutionIndex: 523
    SolutionNameMin: Cijk_Ailk_Bjlk_HBH_MT64x128x32_MI32x32x8x1_SE_1LDSB0_GRVW8_NLCA1_NLCB1_SU0_SUS256_SRVW4_TT1_64_WG64_4_1_WGM15
    SolutionIndex: 524
    SolutionNameMin: Cijk_Ailk_Bjlk_HBH_MT96x128x32_MI32x32x8x1_SE_1LDSB0_GRVW4_NLCA3_NLCB1_SU0_SUS256_SRVW0_TT3_32_WG32_8_1_WGM1
    SolutionIndex: 525
    SolutionNameMin: Cijk_Ailk_Bjlk_HBH_MT64x128x32_MI32x32x8x1_SE_1LDSB0_GRVW8_NLCA1_NLCB1_SU32_SUS128_SRVW4_TT1_64_WG64_4_1_WGM2
    SolutionIndex: 526
    SolutionNameMin: Cijk_Ailk_Bjlk_HBH_MT64x128x32_MI32x32x8x1_SE_1LDSB0_GRVW8_NLCA1_NLCB1_SU32_SUS256_SRVW4_TT1_64_WG64_4_1_WGM2
    SolutionIndex: 527
    SolutionNameMin: Cijk_Ailk_Bjlk_HBH_MT64x128x16_MI32x32x8x1_SE_1LDSB0_GRVW8_NLCA1_NLCB1_SU0_SUS256_SRVW4_TT1_64_WG64_4_1_WGM1
    SolutionIndex: 528
    SolutionNameMin: Cijk_Ailk_Bjlk_HBH_MT64x128x16_MI32x32x8x1_SE_1LDSB0_GRVW8_NLCA1_NLCB1_SU32_SUS128_SRVW4_TT1_64_WG64_4_1_WGM2
    SolutionIndex: 529
    SolutionNameMin: Cijk_Ailk_Bjlk_HBH_MT64x64x16_MI32x32x8x1_SE_1LDSB0_GRVW8_NLCA1_NLCB1_SU0_SUS256_SRVW4_TT1_32_WG64_4_1_WGM1
    SolutionIndex: 530
    SolutionNameMin: Cijk_Ailk_Bjlk_HBH_MT128x96x16_MI32x32x8x1_SE_1LDSB0_GRVW2_NLCA1_NLCB3_SU0_SUS256_SRVW4_TT1_96_WG128_2_1_WGM1
    SolutionIndex: 531
    SolutionNameMin: Cijk_Ailk_Bjlk_HBH_MT128x96x32_MI32x32x8x1_SE_1LDSB0_GRVW4_NLCA1_NLCB3_SU0_SUS256_SRVW4_TT1_96_WG128_2_1_WGM2
    SolutionIndex: 532
    SolutionNameMin: Cijk_Ailk_Bjlk_HBH_MT64x128x16_MI32x32x8x1_SE_1LDSB0_GRVW8_NLCA1_NLCB1_SU0_SUS256_SRVW4_TT1_64_WG64_4_1_WGM15
    SolutionIndex: 533
    SolutionNameMin: Cijk_Ailk_Bjlk_HBH_MT128x96x16_MI32x32x8x1_SE_1LDSB0_GRVW2_NLCA1_NLCB3_SU32_SUS256_SRVW4_TT1_96_WG128_2_1_WGM2
    SolutionIndex: 534
    SolutionNameMin: Cijk_Ailk_Bjlk_HBH_MT128x64x16_MI32x32x8x1_SE_1LDSB0_GRVW2_NLCA1_NLCB1_SU0_SUS256_SRVW4_TT2_32_WG64_4_1_WGM1
    SolutionIndex: 535
    SolutionNameMin: Cijk_Ailk_Bjlk_HBH_MT128x128x16_MI32x32x8x1_SE_1LDSB0_GRVW8_NLCA1_NLCB1_SU0_SUS256_SRVW4_TT2_64_WG64_4_1_WGM15
    SolutionIndex: 536
    SolutionNameMin: Cijk_Ailk_Bjlk_HBH_MT128x256x16_MI32x32x8x1_SE_1LDSB1_GRVW8_NLCA1_NLCB1_SU32_SUS256_SRVW4_TT2_128_WG64_4_1_WGM2
    SolutionIndex: 537
    SolutionNameMin: Cijk_Ailk_Bjlk_HBH_MT128x256x16_MI32x32x8x1_SE_1LDSB0_GRVW8_NLCA1_NLCB1_SU32_SUS256_SRVW4_TT2_128_WG64_4_1_WGM1
    SolutionIndex: 538
    SolutionNameMin: Cijk_Ailk_Bjlk_HBH_MT64x64x16_MI32x32x8x1_SE_1LDSB0_GRVW8_NLCA1_NLCB1_SU32_SUS128_SRVW4_TT1_32_WG64_4_1_WGM15
    SolutionIndex: 539
    SolutionNameMin: Cijk_Ailk_Bjlk_HBH_MT64x64x16_MI32x32x8x1_SE_1LDSB0_GRVW8_NLCA1_NLCB1_SU32_SUS256_SRVW4_TT1_32_WG64_4_1_WGM2
    SolutionIndex: 540
    SolutionNameMin: Cijk_Ailk_Bjlk_HBH_MT64x64x32_MI32x32x8x1_SE_1LDSB0_GRVW8_NLCA1_NLCB1_SU0_SUS256_SRVW4_TT1_32_WG64_4_1_WGM2
    SolutionIndex: 541
    SolutionNameMin: Cijk_Ailk_Bjlk_HBH_MT64x128x16_MI32x32x8x1_SE_1LDSB0_GRVW8_NLCA1_NLCB1_SU32_SUS256_SRVW4_TT1_64_WG64_4_1_WGM1
    SolutionIndex: 542
    SolutionNameMin: Cijk_Ailk_Bjlk_HBH_MT128x96x16_MI32x32x8x1_SE_1LDSB0_GRVW2_NLCA1_NLCB3_SU32_SUS128_SRVW4_TT1_96_WG128_2_1_WGM1
    SolutionIndex: 543
    SolutionNameMin: Cijk_Ailk_Bjlk_HBH_MT64x64x16_MI32x32x8x1_SE_1LDSB0_GRVW4_NLCA1_NLCB1_SU32_SUS128_SRVW4_TT1_32_WG64_4_1_WGM15
    SolutionIndex: 544
    SolutionNameMin: Cijk_Ailk_Bjlk_HBH_MT128x128x16_MI32x32x8x1_SE_1LDSB0_GRVW4_NLCA1_NLCB1_SU32_SUS256_SRVW4_TT2_64_WG64_4_1_WGM15
    SolutionIndex: 545
    SolutionNameMin: Cijk_Ailk_Bjlk_HBH_MT128x128x16_MI32x32x8x1_SE_1LDSB0_GRVW8_NLCA1_NLCB1_SU0_SUS256_SRVW4_TT2_64_WG64_4_1_WGM1
- - - [64, 448, 1, 3328]
    - [10, 1.084]
  - - [1, 64, 1, 256]
    - [20, 0.0]
  - - [3584, 64, 1, 1280]
    - [17, 4.354]
  - - [64, 128, 1, 256]
    - [1, 0.158]
  - - [64, 5888, 1, 1280]
    - [17, 5.261]
  - - [64, 4288, 1, 1280]
    - [18, 4.395]
  - - [3584, 64, 1, 3328]
    - [17, 4.663]
  - - [64, 1024, 1, 3328]
    - [18, 2.468]
  - - [1, 64, 1, 1280]
    - [22, 0.001]
  - - [704, 64, 1, 3328]
    - [10, 1.617]
  - - [64, 448, 1, 1280]
    - [6, 0.993]
  - - [64, 704, 1, 3328]
    - [11, 1.645]
  - - [64, 64, 1, 1280]
    - [9, 0.136]
  - - [64, 5056, 1, 256]
    - [0, 3.674]
  - - [64, 4288, 1, 3328]
    - [17, 4.673]
  - - [1856, 64, 1, 3328]
    - [18, 4.101]
  - - [1, 64, 1, 1]
    - [19, 0.0]
  - - [448, 64, 1, 1280]
    - [5, 0.993]
  - - [5888, 64, 1, 1280]
    - [17, 5.218]
  - - [2944, 64, 1, 256]
    - [1, 2.931]
  - - [64, 1856, 1, 256]
    - [12, 2.453]
  - - [64, 1024, 1, 1280]
    - [18, 2.295]
  - - [64, 256, 1, 1280]
    - [10, 0.582]
  - - [704, 64, 1, 1280]
    - [3, 1.405]
  - - [64, 128, 1, 1280]
    - [5, 0.264]
  - - [2368, 64, 1, 256]
    - [5, 2.593]
  - - [2368, 64, 1, 3328]
    - [18, 3.966]
  - - [64, 1408, 1, 3328]
    - [11, 3.118]
  - - [1856, 64, 1, 1280]
    - [18, 3.63]
  - - [64, 3584, 1, 1280]
    - [4, 4.504]
  - - [448, 64, 1, 3328]
    - [10, 1.085]
  - - [5888, 64, 1, 3328]
    - [17, 5.505]
  - - [128, 64, 1, 256]
    - [16, 0.158]
  - - [64, 128, 1, 3328]
    - [6, 0.295]
  - - [64, 256, 1, 3328]
    - [13, 0.619]
  - - [4288, 64, 1, 3328]
    - [17, 4.645]
  - - [64, 2944, 1, 256]
    - [16, 3.113]
  - - [6784, 64, 1, 256]
    - [17, 4.464]
  - - [1024, 64, 1, 1280]
    - [18, 2.336]
  - - [64, 2368, 1, 1280]
    - [6, 3.751]
  - - [64, 3584, 1, 3328]
    - [17, 4.657]
  - - [64, 6784, 1, 3328]
    - [17, 5.581]
  - - [3584, 64, 1, 256]
    - [17, 3.271]
  - - [64, 1856, 1, 3328]
    - [18, 4.079]
  - - [448, 64, 1, 256]
    - [5, 0.63]
  - - [64, 5056, 1, 3328]
    - [17, 5.401]
  - - [256, 64, 1, 256]
    - [1, 0.381]
  - - [4288, 64, 1, 1280]
    - [17, 4.516]
  - - [1, 1, 1, 1]
    - [21, 0.0]
  - - [5056, 64, 1, 1280]
    - [18, 5.161]
  - - [1024, 64, 1, 3328]
    - [17, 2.43]
  - - [1408, 64, 1, 256]
    - [16, 1.877]
  - - [64, 1408, 1, 256]
    - [7, 1.91]
  - - [64, 2368, 1, 3328]
    - [6, 3.973]
  - - [64, 448, 1, 256]
    - [5, 0.66]
  - - [64, 6784, 1, 1280]
    - [18, 5.345]
  - - [64, 1856, 1, 1280]
    - [14, 3.63]
  - - [64, 6784, 1, 256]
    - [17, 4.426]
  - - [64, 5056, 1, 1280]
    - [18, 5.047]
  - - [64, 4288, 1, 256]
    - [16, 3.497]
  - - [128, 64, 1, 1280]
    - [5, 0.258]
  - - [5888, 64, 1, 256]
    - [16, 3.858]
  - - [64, 5888, 1, 3328]
    - [17, 5.567]
  - - [64, 1024, 1, 256]
    - [11, 1.427]
  - - [5056, 64, 1, 3328]
    - [17, 5.504]
  - - [256, 64, 1, 1280]
    - [10, 0.574]
  - - [64, 256, 1, 256]
    - [5, 0.374]
  - - [704, 64, 1, 256]
    - [5, 0.981]
  - - [64, 1408, 1, 1280]
    - [18, 2.894]
  - - [1, 1, 1, 256]
    - [20, 0.0]
  - - [64, 704, 1, 256]
    - [8, 1.009]
  - - [64, 2944, 1, 3328]
    - [18, 4.919]
  - - [64, 64, 1, 256]
    - [1, 0.08]
  - - [1856, 64, 1, 256]
    - [17, 2.541]
  - - [128, 64, 1, 3328]
    - [17, 0.294]
  - - [2944, 64, 1, 1280]
    - [17, 4.434]
  - - [4288, 64, 1, 256]
    - [18, 3.424]
  - - [1, 1, 1, 1280]
    - [22, 0.0]
  - - [64, 2944, 1, 1280]
    - [18, 4.634]
  - - [1408, 64, 1, 1280]
    - [18, 2.902]
  - - [6784, 64, 1, 3328]
    - [17, 5.551]
  - - [1024, 64, 1, 256]
    - [18, 1.555]
  - - [64, 2368, 1, 256]
    - [7, 2.71]
  - - [64, 3584, 1, 256]
    - [2, 3.351]
  - - [2944, 64, 1, 3328]
    - [18, 4.911]
  - - [2368, 64, 1, 1280]
    - [5, 3.667]
  - - [256, 64, 1, 3328]
    - [10, 0.62]
  - - [64, 64, 1, 3328]
    - [17, 0.152]
  - - [1, 1, 1, 3328]
    - [22, 0.0]
  - - [64, 5888, 1, 256]
    - [17, 4.104]
  - - [64, 704, 1, 1280]
    - [13, 1.483]
  - - [6784, 64, 1, 1280]
    - [17, 5.269]
  - - [5056, 64, 1, 256]
    - [15, 3.461]
  - - [1408, 64, 1, 3328]
    - [18, 3.091]
  - - [4096, 7133, 1, 4096]
    - [29, 14.1]
  - - [512, 16, 1, 512]
    - [25, 0.198]
  - - [2048, 7133, 1, 2048]
    - [27, 13.977]
  - - [2560, 7133, 1, 2560]
    - [28, 13.724]
  - - [1024, 1024, 1, 1024]
    - [293, 42.044]
  - - [3072, 7435, 1, 1024]
    - [27, 13.851]
  - - [1024, 32, 1, 512]
    - [23, 0.674]
  - - [1760, 7133, 1, 1760]
    - [28, 13.094]
  - - [7680, 5481, 1, 2560]
    - [27, 13.968]
  - - [1024, 16, 1, 512]
    - [23, 0.333]
  - - [512, 32, 1, 512]
    - [24, 0.387]
  - - [3136, 256, 64, 64]
    - [500, 32.223]
  - - [784, 512, 64, 128]
    - [489, 43.161]
  - - [784, 128, 64, 512]
    - [501, 48.847]
  - - [3136, 64, 128, 64]
    - [41, 11.517]
  - - [196, 256, 128, 1024]
    - [37, 13.29]
  - - [196, 256, 64, 1024]
    - [519, 36.635]
  - - [196, 1024, 128, 256]
    - [37, 12.602]
  - - [784, 128, 256, 512]
    - [36, 16.038]
  - - [3136, 64, 64, 256]
    - [486, 30.866]
  - - [3136, 64, 256, 256]
    - [39, 15.705]
  - - [3136, 256, 256, 64]
    - [43, 14.128]
  - - [3136, 64, 128, 256]
    - [42, 15.605]
  - - [784, 128, 128, 512]
    - [36, 15.875]
  - - [784, 512, 128, 128]
    - [36, 14.414]
  - - [784, 512, 256, 128]
    - [38, 14.421]
  - - [196, 1024, 64, 256]
    - [264, 35.741]
  - - [3136, 64, 64, 64]
    - [498, 19.983]
  - - [196, 1024, 256, 256]
    - [40, 12.724]
  - - [196, 256, 256, 1024]
    - [37, 13.524]
  - - [3136, 256, 128, 64]
    - [42, 13.599]
  - - [3136, 64, 256, 64]
    - [41, 11.71]
  - - [14, 64, 1, 14]
    - [48, 0.001]
  - - [15, 64, 1, 14]
    - [48, 0.001]
  - - [15, 64, 1, 15]
    - [48, 0.001]
  - - [15, 64, 1, 15]
    - [48, 0.001]
  - - [17, 64, 1, 15]
    - [48, 0.002]
  - - [17, 64, 1, 17]
    - [48, 0.002]
  - - [17, 64, 1, 17]
    - [48, 0.002]
  - - [21, 64, 1, 17]
    - [54, 0.003]
  - - [21, 64, 1, 21]
    - [48, 0.003]
  - - [24, 64, 1, 24]
    - [48, 0.004]
  - - [30, 64, 1, 30]
    - [65, 0.007]
  - - [30, 64, 1, 31]
    - [54, 0.007]
  - - [31, 64, 1, 31]
    - [55, 0.007]
  - - [32, 64, 1, 32]
    - [54, 0.007]
  - - [32, 64, 1, 35]
    - [51, 0.007]
  - - [34, 64, 1, 24]
    - [66, 0.007]
  - - [34, 64, 1, 34]
    - [54, 0.008]
  - - [35, 64, 1, 35]
    - [58, 0.008]
  - - [64, 14, 1, 14]
    - [48, 0.001]
  - - [64, 15, 1, 14]
    - [49, 0.001]
  - - [64, 15, 1, 15]
    - [49, 0.001]
  - - [64, 15, 1, 15]
    - [49, 0.001]
  - - [64, 17, 1, 15]
    - [48, 0.001]
  - - [64, 17, 1, 17]
    - [59, 0.002]
  - - [64, 17, 1, 17]
    - [53, 0.002]
  - - [64, 21, 1, 17]
    - [49, 0.002]
  - - [64, 21, 1, 21]
    - [49, 0.003]
  - - [64, 24, 1, 24]
    - [49, 0.004]
  - - [64, 30, 1, 30]
    - [50, 0.005]
  - - [64, 30, 1, 31]
    - [49, 0.005]
  - - [64, 31, 1, 31]
    - [52, 0.006]
  - - [64, 32, 1, 32]
    - [51, 0.007]
  - - [64, 32, 1, 35]
    - [53, 0.007]
  - - [64, 34, 1, 24]
    - [49, 0.005]
  - - [64, 34, 1, 34]
    - [50, 0.007]
  - - [64, 35, 1, 35]
    - [50, 0.007]
  - - [64, 128, 512, 128]
    - [347, 18.073]
  - - [64, 512, 1, 512]
    - [362, 2.151]
  - - [64, 512, 64, 512]
    - [314, 28.147]
  - - [128, 64, 512, 128]
    - [348, 17.691]
  - - [512, 64, 1, 512]
    - [361, 2.151]
  - - [512, 64, 64, 512]
    - [205, 27.99]
  - - [1024, 2, 1, 4]
    - [303, 0.002]
  - - [1024, 2, 1, 32]
    - [349, 0.019]
  - - [1024, 2, 1, 2048]
    - [315, 0.319]
  - - [1024, 1024, 1, 4]
    - [316, 0.818]
  - - [1024, 1024, 1, 32]
    - [350, 7.659]
  - - [1024, 1024, 1, 2048]
    - [312, 43.312]
  - - [1024, 1024, 1, 4096]
    - [293, 46.36]
  - - [1024, 4096, 1, 2048]
    - [306, 70.146]
  - - [1024, 4096, 1, 4096]
    - [290, 73.413]
  - - [1024, 30528, 1, 2048]
    - [351, 87.338]
  - - [1024, 30528, 1, 4096]
    - [351, 91.492]
  - - [4096, 1024, 1, 2048]
    - [290, 65.676]
  - - [4096, 1024, 1, 4096]
    - [290, 73.113]
  - - [3, 64, 512, 3]
    - [472, 0.049]
  - - [5, 64, 512, 5]
    - [473, 0.137]
  - - [5, 64, 960, 5]
    - [470, 0.189]
  - - [9, 64, 512, 9]
    - [470, 0.443]
  - - [13, 512, 1, 32768]
    - [460, 4.942]
  - - [27, 128, 32768, 27]
    - [474, 5.364]
  - - [33, 32, 200, 33]
    - [475, 1.254]
  - - [33, 32, 1600, 33]
    - [476, 2.982]
  - - [67, 2048, 1, 512]
    - [477, 6.383]
  - - [74, 2048, 1, 512]
    - [469, 7.119]
  - - [74, 2048, 1, 960]
    - [478, 8.509]
  - - [100, 2048, 1, 512]
    - [479, 8.608]
  - - [256, 128, 1, 32768]
    - [343, 18.712]
  - - [256, 1280, 1, 8976]
    - [368, 30.148]
  - - [256, 2560, 1, 8976]
    - [369, 39.238]
  - - [256, 2816, 1, 8976]
    - [366, 40.916]
  - - [256, 3328, 1, 8976]
    - [370, 43.112]
  - - [256, 3584, 1, 8976]
    - [293, 45.416]
  - - [256, 3840, 1, 8976]
    - [354, 47.159]
  - - [256, 4096, 1, 8976]
    - [341, 46.043]
  - - [256, 4352, 1, 8976]
    - [322, 49.36]
  - - [256, 4864, 1, 8976]
    - [199, 51.601]
  - - [256, 5120, 1, 8976]
    - [201, 54.614]
  - - [256, 5632, 1, 8976]
    - [178, 59.368]
  - - [256, 5888, 1, 8976]
    - [201, 61.915]
  - - [256, 6144, 1, 8976]
    - [371, 62.528]
  - - [256, 7168, 1, 8976]
    - [371, 68.023]
  - - [256, 8192, 1, 8976]
    - [372, 59.655]
  - - [256, 8960, 1, 8976]
    - [373, 66.971]
  - - [256, 9728, 1, 8976]
    - [210, 59.48]
  - - [256, 9984, 1, 8976]
    - [196, 59.031]
  - - [256, 10240, 1, 8976]
    - [247, 61.049]
  - - [256, 10496, 1, 8976]
    - [287, 61.889]
  - - [256, 11008, 1, 8976]
    - [374, 64.73]
  - - [256, 11264, 1, 8976]
    - [375, 66.199]
  - - [256, 11520, 1, 8976]
    - [376, 67.611]
  - - [256, 11776, 1, 8976]
    - [376, 69.038]
  - - [256, 12544, 1, 8976]
    - [176, 73.182]
  - - [256, 12800, 1, 8976]
    - [377, 75.681]
  - - [256, 13312, 1, 8976]
    - [378, 78.514]
  - - [256, 13568, 1, 8976]
    - [379, 81.409]
  - - [256, 14336, 1, 8976]
    - [375, 86.065]
  - - [256, 14848, 1, 8976]
    - [380, 89.163]
  - - [256, 15104, 1, 8976]
    - [380, 90.473]
  - - [256, 15872, 1, 8976]
    - [381, 81.478]
  - - [256, 16128, 1, 8976]
    - [299, 83.995]
  - - [256, 17152, 1, 8976]
    - [299, 89.199]
  - - [256, 17408, 1, 8976]
    - [290, 81.985]
  - - [256, 18688, 1, 8976]
    - [382, 87.744]
  - - [256, 19968, 1, 8976]
    - [383, 70.694]
  - - [256, 20480, 1, 8976]
    - [383, 70.713]
  - - [256, 20992, 1, 8976]
    - [383, 73.115]
  - - [256, 21248, 1, 8976]
    - [384, 72.024]
  - - [256, 22016, 1, 8976]
    - [384, 73.072]
  - - [256, 26112, 1, 8976]
    - [385, 79.908]
  - - [256, 32512, 1, 8976]
    - [381, 83.88]
  - - [256, 32768, 1, 1]
    - [316, 0.464]
  - - [256, 33536, 1, 8976]
    - [299, 86.793]
  - - [256, 44505, 1, 8976]
    - [375, 87.465]
  - - [257, 4096, 1, 1024]
    - [480, 27.045]
  - - [480, 1024, 1, 32768]
    - [386, 60.533]
  - - [512, 32, 1, 200]
    - [361, 0.502]
  - - [512, 32, 1, 1600]
    - [363, 1.434]
  - - [512, 256, 1, 32768]
    - [344, 36.875]
  - - [512, 512, 1, 200]
    - [387, 5.983]
  - - [512, 512, 1, 1600]
    - [367, 19.528]
  - - [512, 2048, 1, 256]
    - [341, 22.837]
  - - [560, 1024, 1, 200]
    - [388, 11.418]
  - - [560, 1024, 1, 1600]
    - [366, 29.71]
  - - [768, 2048, 1, 256]
    - [389, 32.207]
  - - [1024, 64, 1, 512]
    - [362, 4.302]
  - - [1024, 64, 1, 960]
    - [363, 5.165]
  - - [1024, 256, 1, 1024]
    - [295, 17.325]
  - - [1024, 256, 1, 1280]
    - [390, 18.151]
  - - [1024, 256, 1, 2304]
    - [391, 17.338]
  - - [1024, 256, 1, 2816]
    - [171, 18.979]
  - - [1024, 256, 1, 3072]
    - [217, 19.373]
  - - [1024, 256, 1, 3328]
    - [180, 19.486]
  - - [1024, 256, 1, 3584]
    - [190, 19.626]
  - - [1024, 256, 1, 4096]
    - [231, 19.898]
  - - [1024, 256, 1, 4352]
    - [171, 20.144]
  - - [1024, 256, 1, 4608]
    - [260, 20.223]
  - - [1024, 256, 1, 5120]
    - [392, 21.508]
  - - [1024, 256, 1, 5376]
    - [393, 21.763]
  - - [1024, 256, 1, 5632]
    - [392, 22.393]
  - - [1024, 256, 1, 6144]
    - [394, 23.047]
  - - [1024, 256, 1, 6400]
    - [392, 23.646]
  - - [1024, 256, 1, 7680]
    - [395, 25.739]
  - - [1024, 256, 1, 7936]
    - [393, 26.063]
  - - [1024, 256, 1, 8192]
    - [392, 26.305]
  - - [1024, 256, 1, 8448]
    - [396, 26.201]
  - - [1024, 256, 1, 9728]
    - [393, 28.011]
  - - [1024, 256, 1, 9984]
    - [397, 27.992]
  - - [1024, 256, 1, 10496]
    - [395, 28.61]
  - - [1024, 256, 1, 11520]
    - [398, 30.034]
  - - [1024, 256, 1, 12032]
    - [399, 31.468]
  - - [1024, 256, 1, 13568]
    - [399, 32.411]
  - - [1024, 256, 1, 14336]
    - [399, 34.245]
  - - [1024, 256, 1, 14848]
    - [400, 33.759]
  - - [1024, 256, 1, 15104]
    - [399, 34.597]
  - - [1024, 256, 1, 15872]
    - [397, 34.55]
  - - [1024, 256, 1, 16128]
    - [401, 34.922]
  - - [1024, 256, 1, 17152]
    - [402, 36.149]
  - - [1024, 256, 1, 17408]
    - [402, 35.948]
  - - [1024, 256, 1, 18944]
    - [403, 38.408]
  - - [1024, 256, 1, 19712]
    - [397, 39.316]
  - - [1024, 256, 1, 19968]
    - [403, 39.41]
  - - [1024, 256, 1, 21248]
    - [404, 40.502]
  - - [1024, 256, 1, 21504]
    - [404, 39.457]
  - - [1024, 256, 1, 22016]
    - [400, 39.86]
  - - [1024, 256, 1, 28672]
    - [405, 44.045]
  - - [1024, 256, 1, 33536]
    - [405, 46.533]
  - - [1024, 512, 1, 32768]
    - [345, 56.651]
  - - [1024, 1024, 1, 200]
    - [298, 16.774]
  - - [1024, 1024, 1, 512]
    - [293, 32.002]
  - - [1024, 1024, 1, 960]
    - [311, 38.928]
  - - [1024, 1024, 1, 1600]
    - [322, 41.757]
  - - [1024, 1024, 1, 32768]
    - [346, 59.846]
  - - [1600, 1024, 1, 512]
    - [365, 41.536]
  - - [1600, 1024, 1, 960]
    - [406, 49.394]
  - - [2048, 256, 1, 1024]
    - [407, 25.121]
  - - [2048, 960, 1, 1]
    - [408, 0.347]
  - - [2048, 2048, 1, 512]
    - [364, 54.91]
  - - [2048, 2048, 1, 960]
    - [364, 61.073]
  - - [2048, 2048, 1, 1024]
    - [364, 60.9]
  - - [3200, 2048, 1, 1024]
    - [409, 67.602]
  - - [4096, 4096, 1, 1024]
    - [410, 70.888]
  - - [14, 64, 10880, 14]
    - [462, 1.906]
  - - [15, 64, 10880, 14]
    - [463, 1.98]
  - - [15, 64, 7680, 15]
    - [463, 2.042]
  - - [15, 64, 10880, 15]
    - [462, 2.104]
  - - [17, 64, 7680, 15]
    - [187, 2.033]
  - - [17, 64, 6144, 17]
    - [174, 1.896]
  - - [17, 64, 7680, 17]
    - [464, 2.033]
  - - [21, 64, 6144, 17]
    - [465, 2.253]
  - - [21, 64, 6144, 21]
    - [466, 2.718]
  - - [24, 64, 4736, 24]
    - [213, 4.311]
  - - [30, 64, 2048, 30]
    - [467, 4.044]
  - - [30, 64, 2048, 31]
    - [467, 4.21]
  - - [31, 64, 2048, 31]
    - [467, 4.21]
  - - [32, 64, 4608, 32]
    - [357, 7.517]
  - - [32, 64, 4608, 35]
    - [145, 5.865]
  - - [34, 64, 4736, 24]
    - [468, 3.628]
  - - [34, 64, 4736, 34]
    - [163, 4.455]
  - - [35, 64, 4608, 35]
    - [255, 4.391]
  - - [64, 14, 10880, 14]
    - [188, 2.322]
  - - [64, 15, 10880, 14]
    - [188, 2.47]
  - - [64, 15, 7680, 15]
    - [188, 2.5]
  - - [64, 15, 10880, 15]
    - [188, 2.618]
  - - [64, 17, 7680, 15]
    - [188, 2.793]
  - - [64, 17, 6144, 17]
    - [154, 2.385]
  - - [64, 17, 7680, 17]
    - [228, 2.68]
  - - [64, 21, 6144, 17]
    - [223, 2.825]
  - - [64, 21, 6144, 21]
    - [252, 3.424]
  - - [64, 24, 4736, 24]
    - [358, 4.392]
  - - [64, 30, 2048, 30]
    - [148, 4.821]
  - - [64, 30, 2048, 31]
    - [251, 4.938]
  - - [64, 31, 2048, 31]
    - [236, 4.953]
  - - [64, 32, 4608, 32]
    - [359, 7.618]
  - - [64, 32, 4608, 35]
    - [145, 5.757]
  - - [64, 34, 4736, 24]
    - [360, 4.733]
  - - [64, 34, 4736, 34]
    - [347, 5.272]
  - - [64, 35, 4608, 35]
    - [347, 5.325]
  - - [1024, 1024, 1, 3840]
    - [322, 46.578]
  - - [1024, 1024, 1, 3968]
    - [354, 47.659]
  - - [1024, 1024, 1, 6528]
    - [355, 48.975]
  - - [1024, 1024, 1, 7104]
    - [293, 49.196]
  - - [1024, 1024, 1, 7200]
    - [341, 47.578]
  - - [1024, 1024, 1, 8064]
    - [341, 49.831]
  - - [1024, 1024, 1, 8160]
    - [341, 48.237]
  - - [1024, 1024, 1, 9216]
    - [341, 50.242]
  - - [1024, 1024, 1, 9520]
    - [355, 48.055]
  - - [1024, 1024, 1, 10064]
    - [341, 49.577]
  - - [1024, 1024, 1, 10080]
    - [341, 48.798]
  - - [1024, 1024, 1, 10200]
    - [312, 49.089]
  - - [1024, 4096, 1, 3840]
    - [290, 72.604]
  - - [1024, 4096, 1, 3968]
    - [290, 73.468]
  - - [1024, 4096, 1, 6528]
    - [290, 76.671]
  - - [1024, 4096, 1, 7104]
    - [290, 77.221]
  - - [1024, 4096, 1, 7200]
    - [290, 77.216]
  - - [1024, 4096, 1, 8064]
    - [290, 77.713]
  - - [1024, 4096, 1, 8160]
    - [290, 77.798]
  - - [1024, 4096, 1, 9216]
    - [290, 78.571]
  - - [1024, 4096, 1, 9520]
    - [290, 77.238]
  - - [1024, 4096, 1, 10064]
    - [290, 78.038]
  - - [1024, 4096, 1, 10080]
    - [290, 77.748]
  - - [1024, 4096, 1, 10200]
    - [290, 78.181]
  - - [1024, 42720, 1, 3968]
    - [290, 91.6]
  - - [1024, 42720, 1, 6528]
    - [290, 92.434]
  - - [1024, 42720, 1, 7104]
    - [290, 92.803]
  - - [1024, 42720, 1, 7200]
    - [290, 93.153]
  - - [1024, 42720, 1, 9520]
    - [290, 92.443]
  - - [1024, 42720, 1, 10080]
    - [290, 92.605]
  - - [4096, 1024, 1, 3840]
    - [290, 73.097]
  - - [4096, 1024, 1, 3968]
    - [290, 73.398]
  - - [4096, 1024, 1, 6528]
    - [290, 74.035]
  - - [4096, 1024, 1, 7104]
    - [324, 73.944]
  - - [4096, 1024, 1, 7200]
    - [290, 74.844]
  - - [4096, 1024, 1, 8064]
    - [353, 74.232]
  - - [4096, 1024, 1, 8160]
    - [324, 74.957]
  - - [4096, 1024, 1, 9216]
    - [324, 75.916]
  - - [4096, 1024, 1, 9520]
    - [324, 75.065]
  - - [4096, 1024, 1, 10064]
    - [356, 74.142]
  - - [4096, 1024, 1, 10080]
    - [324, 76.693]
  - - [4096, 1024, 1, 10200]
    - [324, 75.541]
  - - [27, 64, 1920, 27]
    - [71, 2.881]
  - - [27, 64, 1920, 33]
    - [79, 3.326]
  - - [33, 64, 1920, 33]
    - [78, 3.901]
  - - [64, 27, 1920, 27]
    - [88, 2.563]
  - - [64, 27, 1920, 33]
    - [72, 2.987]
  - - [64, 33, 1920, 33]
    - [70, 3.488]
  - - [1024, 1024, 1, 3240]
    - [82, 33.538]
  - - [1024, 1024, 1, 3960]
    - [83, 35.455]
  - - [1024, 4096, 1, 3240]
    - [74, 48.172]
  - - [1024, 4096, 1, 3960]
    - [77, 49.597]
  - - [1024, 42720, 1, 3960]
    - [80, 76.971]
  - - [4096, 1024, 1, 3240]
    - [81, 48.503]
  - - [4096, 1024, 1, 3960]
    - [86, 49.111]
  - - [64, 1280, 64, 192]
    - [502, 26.915]
  - - [64, 1280, 64, 320]
    - [503, 30.968]
  - - [64, 1280, 64, 384]
    - [503, 32.881]
  - - [64, 1280, 64, 448]
    - [504, 33.974]
  - - [64, 2048, 64, 192]
    - [505, 28.601]
  - - [64, 2048, 64, 320]
    - [506, 32.498]
  - - [64, 2048, 64, 384]
    - [507, 33.795]
  - - [64, 2048, 64, 448]
    - [508, 35.597]
  - - [1225, 192, 64, 32]
    - [529, 13.578]
  - - [1225, 192, 64, 48]
    - [530, 17.841]
  - - [1225, 192, 64, 64]
    - [531, 21.114]
  - - [1225, 256, 64, 48]
    - [532, 19.599]
  - - [1225, 256, 64, 64]
    - [527, 23.117]
  - - [1225, 288, 64, 48]
    - [533, 19.927]
  - - [1225, 288, 64, 64]
    - [533, 24.814]
  - - [5329, 64, 64, 80]
    - [534, 19.808]
  - - [289, 768, 64, 128]
    - [535, 29.748]
  - - [289, 768, 64, 160]
    - [536, 33.39]
  - - [289, 768, 64, 192]
    - [537, 36.358]
  - - [64, 1280, 32, 192]
    - [509, 24.155]
  - - [64, 1280, 32, 320]
    - [510, 28.547]
  - - [64, 1280, 32, 384]
    - [511, 29.811]
  - - [64, 1280, 32, 448]
    - [512, 31.857]
  - - [64, 2048, 32, 192]
    - [503, 24.709]
  - - [64, 2048, 32, 320]
    - [513, 28.875]
  - - [64, 2048, 32, 384]
    - [507, 30.635]
  - - [64, 2048, 32, 448]
    - [514, 31.799]
  - - [1225, 192, 32, 32]
    - [538, 12.118]
  - - [1225, 192, 32, 48]
    - [539, 15.509]
  - - [1225, 192, 32, 64]
    - [540, 17.96]
  - - [1225, 256, 32, 48]
    - [527, 18.104]
  - - [1225, 256, 32, 64]
    - [541, 21.163]
  - - [1225, 288, 32, 48]
    - [542, 16.627]
  - - [1225, 288, 32, 64]
    - [542, 20.49]
  - - [5329, 64, 32, 80]
    - [543, 18.157]
  - - [289, 768, 32, 128]
    - [544, 26.504]
  - - [289, 768, 32, 160]
    - [535, 29.957]
  - - [289, 768, 32, 192]
    - [545, 31.825]
  - - [49, 512, 64, 2048]
    - [527, 26.235]
  - - [49, 2048, 64, 512]
    - [528, 25.101]
  - - [3136, 64, 32, 256]
    - [493, 28.232]
  - - [3136, 64, 32, 64]
    - [498, 17.249]
  - - [3136, 256, 32, 64]
    - [487, 30.111]
  - - [784, 128, 32, 512]
    - [273, 45.931]
  - - [784, 512, 32, 128]
    - [499, 38.954]
  - - [196, 256, 32, 1024]
    - [524, 31.53]
  - - [196, 1024, 32, 256]
    - [264, 30.052]
  - - [49, 512, 32, 2048]
    - [526, 22.107]
  - - [49, 2048, 32, 512]
    - [525, 21.825]
  - - [3136, 64, 64, 128]
    - [485, 24.618]
  - - [3136, 128, 64, 256]
    - [487, 48.808]
  - - [784, 256, 64, 512]
    - [488, 57.899]
  - - [3136, 256, 64, 128]
    - [489, 49.595]
  - - [3136, 256, 64, 256]
    - [490, 64.144]
  - - [196, 512, 64, 1024]
    - [515, 46.415]
  - - [784, 512, 64, 256]
    - [491, 54.904]
  - - [784, 512, 64, 512]
    - [488, 64.111]
  - - [196, 1024, 64, 512]
    - [264, 43.435]
  - - [196, 1024, 64, 1024]
    - [516, 49.755]
  - - [49, 1024, 64, 2048]
    - [517, 28.271]
  - - [49, 2048, 64, 1024]
    - [518, 29.378]
  - - [3136, 64, 32, 128]
    - [492, 22.171]
  - - [3136, 128, 32, 256]
    - [494, 45.931]
  - - [784, 256, 32, 512]
    - [268, 51.72]
  - - [3136, 256, 32, 128]
    - [495, 45.255]
  - - [3136, 256, 32, 256]
    - [496, 58.505]
  - - [196, 512, 32, 1024]
    - [519, 37.483]
  - - [784, 512, 32, 256]
    - [488, 49.957]
  - - [784, 512, 32, 512]
    - [497, 60.28]
  - - [196, 1024, 32, 512]
    - [520, 39.003]
  - - [196, 1024, 32, 1024]
    - [521, 45.422]
  - - [49, 1024, 32, 2048]
    - [522, 26.37]
  - - [49, 2048, 32, 1024]
    - [523, 26.035]
  - - [7680, 8192, 1, 8192]
    - [282, 95.591]
  - - [3840, 4096, 1, 4096]
    - [282, 93.517]
  - - [1920, 2048, 1, 2048]
    - [283, 81.828]
  - - [960, 1024, 1, 1024]
    - [284, 42.435]
  - - [480, 512, 1, 512]
    - [285, 13.381]
  - - [8192, 7680, 1, 8192]
    - [286, 95.372]
  - - [4096, 3840, 1, 4096]
    - [282, 93.315]
  - - [2048, 1920, 1, 2048]
    - [287, 82.455]
  - - [1024, 960, 1, 1024]
    - [288, 42.82]
  - - [512, 480, 1, 512]
    - [289, 13.692]
  - - [8192, 8192, 1, 8192]
    - [290, 92.358]
  - - [4096, 4096, 1, 4096]
    - [291, 82.259]
  - - [2048, 2048, 1, 2048]
    - [292, 73.213]
  - - [512, 512, 1, 512]
    - [294, 13.653]
  - - [64, 512, 16, 512]
    - [295, 19.031]
  - - [1024, 2, 1, 1]
    - [207, 0.001]
  - - [1024, 2, 1, 512]
    - [296, 0.126]
  - - [1024, 1024, 1, 1]
    - [297, 0.218]
  - - [1024, 1024, 1, 77]
    - [298, 10.35]
  - - [1024, 4096, 1, 512]
    - [299, 57.585]
  - - [1024, 30522, 1, 77]
    - [300, 28.223]
  - - [4096, 1024, 1, 512]
    - [301, 47.065]
  - - [64, 128, 160, 128]
    - [302, 14.674]
  - - [1024, 2, 1, 10]
    - [303, 0.005]
  - - [1024, 2, 1, 1280]
    - [304, 0.213]
  - - [1024, 1024, 1, 10]
    - [305, 1.924]
  - - [1024, 1024, 1, 1280]
    - [293, 41.048]
  - - [1024, 4096, 1, 1280]
    - [306, 66.195]
  - - [1024, 30522, 1, 200]
    - [307, 49.616]
  - - [4096, 1024, 1, 1280]
    - [292, 60.826]
  - - [64, 128, 624, 128]
    - [141, 18.279]
  - - [1024, 2, 1, 39]
    - [308, 0.018]
  - - [1024, 2, 1, 4992]
    - [309, 0.576]
  - - [1024, 1024, 1, 39]
    - [310, 6.714]
  - - [1024, 1024, 1, 780]
    - [311, 29.552]
  - - [1024, 1024, 1, 4992]
    - [312, 47.978]
  - - [1024, 4096, 1, 4992]
    - [290, 74.96]
  - - [1024, 30522, 1, 780]
    - [313, 70.83]
  - - [4096, 1024, 1, 4992]
    - [290, 75.189]
  - - [1024, 1024, 1, 308]
    - [310, 19.626]
  - - [1024, 30522, 1, 308]
    - [317, 57.417]
  - - [64, 128, 640, 128]
    - [175, 18.417]
  - - [1024, 2, 1, 40]
    - [318, 0.019]
  - - [1024, 2, 1, 5120]
    - [319, 0.598]
  - - [1024, 1024, 1, 40]
    - [320, 7.009]
  - - [1024, 1024, 1, 800]
    - [321, 31.912]
  - - [1024, 1024, 1, 5120]
    - [322, 48.449]
  - - [1024, 4096, 1, 5120]
    - [290, 75.269]
  - - [1024, 30522, 1, 800]
    - [323, 76.668]
  - - [4096, 1024, 1, 5120]
    - [324, 71.954]
  - - [64, 128, 656, 128]
    - [222, 18.551]
  - - [1024, 2, 1, 41]
    - [325, 0.019]
  - - [1024, 2, 1, 5248]
    - [326, 0.595]
  - - [1024, 1024, 1, 41]
    - [320, 6.596]
  - - [1024, 1024, 1, 820]
    - [327, 27.747]
  - - [1024, 1024, 1, 5248]
    - [293, 48.355]
  - - [1024, 4096, 1, 5248]
    - [328, 75.07]
  - - [1024, 30522, 1, 820]
    - [313, 72.416]
  - - [4096, 1024, 1, 5248]
    - [290, 74.125]
  - - [64, 512, 80, 512]
    - [211, 30.194]
  - - [1024, 2, 1, 5]
    - [325, 0.003]
  - - [1024, 2, 1, 2560]
    - [329, 0.363]
  - - [1024, 1024, 1, 5]
    - [330, 1.044]
  - - [1024, 1024, 1, 385]
    - [327, 22.759]
  - - [1024, 1024, 1, 2560]
    - [312, 45.02]
  - - [1024, 4096, 1, 2560]
    - [306, 71.469]
  - - [1024, 30522, 1, 385]
    - [331, 62.009]
  - - [4096, 1024, 1, 2560]
    - [290, 69.252]
  - - [64, 512, 96, 512]
    - [332, 30.698]
  - - [1024, 2, 1, 6]
    - [303, 0.003]
  - - [1024, 2, 1, 3072]
    - [326, 0.427]
  - - [1024, 1024, 1, 6]
    - [330, 1.226]
  - - [1024, 1024, 1, 462]
    - [327, 23.131]
  - - [1024, 1024, 1, 3072]
    - [312, 45.331]
  - - [1024, 4096, 1, 3072]
    - [306, 72.552]
  - - [1024, 30522, 1, 462]
    - [331, 62.91]
  - - [4096, 1024, 1, 3072]
    - [290, 70.639]
  - - [64, 128, 128, 128]
    - [333, 14.437]
  - - [1024, 2, 1, 8]
    - [334, 0.004]
  - - [1024, 2, 1, 1024]
    - [335, 0.178]
  - - [1024, 1024, 1, 8]
    - [330, 1.67]
  - - [1024, 1024, 1, 160]
    - [336, 18.256]
  - - [1024, 4096, 1, 1024]
    - [337, 64.516]
  - - [1024, 30522, 1, 160]
    - [338, 49.366]
  - - [4096, 1024, 1, 1024]
    - [292, 56.771]
  - - [64, 128, 144, 128]
    - [339, 14.568]
  - - [1024, 2, 1, 9]
    - [303, 0.004]
  - - [1024, 2, 1, 1152]
    - [340, 0.197]
  - - [1024, 1024, 1, 9]
    - [320, 1.732]
  - - [1024, 1024, 1, 180]
    - [310, 16.205]
  - - [1024, 1024, 1, 1152]
    - [341, 39.804]
  - - [1024, 4096, 1, 1152]
    - [306, 65.533]
  - - [1024, 30522, 1, 180]
    - [342, 46.264]
  - - [4096, 1024, 1, 1152]
    - [292, 59.186]
  - - [479, 1024, 1, 32768]
    - [461, 54.875]
  - - [4, 64, 32768, 4]
    - [157, 0.219]
  - - [4, 64, 38400, 4]
    - [157, 0.22]
  - - [64, 4, 32768, 4]
    - [193, 0.225]
  - - [64, 4, 38400, 4]
    - [193, 0.228]
  - - [1024, 1024, 1, 8192]
    - [341, 49.257]
  - - [1024, 1024, 1, 9600]
    - [293, 50.43]
  - - [1024, 4096, 1, 8192]
    - [290, 78.008]
  - - [1024, 4096, 1, 9600]
    - [290, 78.356]
  - - [1024, 33712, 1, 8192]
    - [212, 87.468]
  - - [1024, 33712, 1, 9600]
    - [352, 86.963]
  - - [4096, 1024, 1, 8192]
    - [353, 75.304]
  - - [4096, 1024, 1, 9600]
    - [353, 75.213]
  - - [64, 128, 1, 128]
    - [363, 0.252]
  - - [128, 64, 1, 128]
    - [362, 0.265]
  - - [5, 64, 1, 5]
    - [470, 0.001]
  - - [2048, 512, 1, 1]
    - [330, 0.213]
  - - [33, 32, 1, 33]
    - [471, 0.007]
  - - [1024, 1600, 1, 1]
    - [316, 0.301]
  - - [64, 1024, 32, 1024]
    - [150, 33.439]
  - - [2560, 1920, 1, 2048]
    - [382, 87.632]
  - - [1024, 3072, 1, 4096]
    - [287, 69.58]
  - - [2560, 2560, 1, 2048]
    - [417, 75.033]
  - - [2048, 2, 1, 2]
    - [411, 0.003]
  - - [1024, 64, 128, 1024]
    - [427, 39.737]
  - - [2048, 2048, 1, 2]
    - [330, 0.818]
  - - [1024, 64, 32, 1024]
    - [160, 33.0]
  - - [1024, 96, 64, 1024]
    - [421, 48.858]
  - - [1024, 30592, 1, 2048]
    - [415, 88.463]
  - - [1024, 3072, 1, 16384]
    - [287, 75.011]
  - - [6144, 1536, 1, 4096]
    - [382, 85.782]
  - - [1024, 1024, 1, 16]
    - [316, 4.026]
  - - [1536, 4608, 1, 8192]
    - [282, 86.211]
  - - [640, 2560, 1, 2048]
    - [173, 55.284]
  - - [1024, 4096, 1, 16384]
    - [290, 78.35]
  - - [64, 512, 40, 512]
    - [416, 26.277]
  - - [1024, 1024, 1, 16384]
    - [341, 51.497]
  - - [1536, 6144, 1, 4096]
    - [290, 85.925]
  - - [1024, 30592, 1, 4096]
    - [286, 91.677]
  - - [2560, 2560, 1, 4]
    - [418, 1.872]
  - - [1536, 1536, 1, 4096]
    - [419, 66.06]
  - - [2560, 7680, 1, 2048]
    - [382, 89.166]
  - - [64, 1024, 256, 1024]
    - [195, 40.682]
  - - [96, 1024, 64, 1024]
    - [383, 46.992]
  - - [1536, 50304, 1, 4096]
    - [286, 91.75]
  - - [2048, 8192, 1, 1024]
    - [374, 70.857]
  - - [1024, 30592, 1, 8192]
    - [323, 94.316]
  - - [512, 64, 256, 512]
    - [414, 33.948]
  - - [1024, 96, 128, 1024]
    - [327, 52.679]
  - - [64, 512, 128, 512]
    - [416, 30.085]
  - - [4096, 1024, 1, 16384]
    - [324, 77.98]
  - - [8192, 2048, 1, 1024]
    - [413, 71.36]
  - - [64, 1024, 64, 1024]
    - [416, 36.081]
  - - [1024, 50304, 1, 4096]
    - [382, 88.282]
  - - [1536, 4608, 1, 4096]
    - [420, 84.1]
  - - [512, 64, 128, 512]
    - [414, 29.339]
  - - [6144, 1536, 1, 8192]
    - [290, 88.739]
  - - [1024, 3072, 1, 8192]
    - [376, 73.57]
  - - [1536, 1536, 1, 8192]
    - [419, 67.263]
  - - [1536, 50304, 1, 8192]
    - [422, 93.608]
  - - [2560, 2, 1, 4]
    - [308, 0.007]
  - - [2048, 6144, 1, 1024]
    - [412, 69.259]
  - - [64, 1024, 128, 1024]
    - [225, 39.816]
  - - [1024, 64, 64, 1024]
    - [426, 35.664]
  - - [1024, 2, 1, 16]
    - [308, 0.01]
  - - [96, 1024, 128, 1024]
    - [423, 51.708]
  - - [2048, 30592, 1, 1024]
    - [323, 83.376]
  - - [64, 512, 256, 512]
    - [250, 33.692]
  - - [1536, 6144, 1, 8192]
    - [290, 89.165]
  - - [1024, 50304, 1, 2048]
    - [425, 84.867]
  - - [1024, 50304, 1, 8192]
    - [290, 90.352]
  - - [1024, 3072, 1, 2048]
    - [152, 62.934]
  - - [1024, 64, 256, 1024]
    - [424, 40.447]
  - - [1024, 50304, 1, 16384]
    - [290, 91.224]
  - - [512, 64, 40, 512]
    - [336, 25.845]
  - - [1024, 2, 1, 64]
    - [428, 0.034]
  - - [1024, 30528, 1, 8192]
    - [429, 93.968]
  - - [1024, 1024, 1, 64]
    - [388, 11.85]
  - - [64, 128, 1024, 128]
    - [430, 19.287]
  - - [128, 64, 1024, 128]
    - [431, 19.361]
  - - [1024, 1024, 1, 3456]
    - [312, 46.078]
  - - [1024, 1024, 1, 6912]
    - [293, 49.69]
  - - [1024, 1024, 1, 864]
    - [321, 32.115]
  - - [1024, 512, 1, 3456]
    - [432, 28.838]
  - - [1024, 512, 1, 4096]
    - [433, 29.168]
  - - [1024, 512, 1, 6912]
    - [434, 30.719]
  - - [1024, 512, 1, 864]
    - [416, 21.303]
  - - [256, 128, 1, 3456]
    - [435, 4.839]
  - - [256, 128, 1, 4096]
    - [436, 5.368]
  - - [256, 128, 1, 55296]
    - [437, 23.683]
  - - [256, 128, 1, 6912]
    - [438, 7.821]
  - - [256, 128, 1, 864]
    - [361, 2.119]
  - - [256, 3456, 1, 1]
    - [330, 0.202]
  - - [256, 4096, 1, 1]
    - [330, 0.213]
  - - [256, 6912, 1, 1]
    - [316, 0.318]
  - - [256, 864, 1, 1]
    - [439, 0.063]
  - - [480, 1024, 1, 3456]
    - [440, 27.267]
  - - [480, 1024, 1, 4096]
    - [440, 27.871]
  - - [480, 1024, 1, 6912]
    - [441, 34.224]
  - - [480, 1024, 1, 864]
    - [442, 19.674]
  - - [512, 256, 1, 3456]
    - [443, 11.52]
  - - [512, 256, 1, 4096]
    - [444, 12.498]
  - - [512, 256, 1, 55296]
    - [445, 44.623]
  - - [512, 256, 1, 6912]
    - [446, 16.69]
  - - [512, 256, 1, 864]
    - [447, 7.019]
  - - [30528, 1024, 1, 640]
    - [448, 75.588]
  - - [30528, 1024, 1, 1280]
    - [449, 84.548]
  - - [4096, 1024, 1, 10240]
    - [356, 75.752]
  - - [1024, 4096, 1, 10240]
    - [290, 78.122]
  - - [30528, 1024, 1, 1600]
    - [450, 85.917]
  - - [1024, 2, 1, 80]
    - [451, 0.04]
  - - [1024, 1024, 1, 10240]
    - [293, 50.242]
  - - [1024, 1024, 1, 80]
    - [298, 12.461]
  - - [64, 128, 1280, 128]
    - [430, 19.718]
  - - [128, 64, 1280, 128]
    - [414, 19.504]
  - - [1024, 4096, 1, 10496]
    - [290, 78.94]
  - - [30528, 1024, 1, 1640]
    - [449, 81.874]
  - - [4096, 1024, 1, 10496]
    - [324, 75.998]
  - - [1024, 1024, 1, 10496]
    - [452, 49.926]
  - - [1024, 1024, 1, 82]
    - [453, 10.316]
  - - [1024, 2, 1, 82]
    - [454, 0.034]
  - - [128, 64, 1312, 128]
    - [455, 19.656]
  - - [64, 128, 1312, 128]
    - [456, 19.93]
  - - [30528, 1024, 1, 160]
    - [313, 47.09]
  - - [1024, 4096, 1, 6144]
    - [290, 76.125]
  - - [30528, 1024, 1, 240]
    - [457, 55.547]
  - - [4096, 1024, 1, 6144]
    - [290, 74.756]
  - - [1024, 1024, 1, 12]
    - [330, 2.309]
  - - [1024, 2, 1, 12]
    - [458, 0.007]
  - - [1024, 1024, 1, 6144]
    - [311, 48.583]
  - - [64, 512, 192, 512]
    - [459, 32.946]
  - - [512, 64, 192, 512]
    - [336, 32.036]
  - - [13, 512, 1, 3456]
    - [481, 1.722]
  - - [13, 512, 1, 4096]
    - [460, 1.918]
  - - [13, 512, 1, 55296]
    - [482, 5.628]
  - - [13, 512, 1, 6912]
    - [483, 2.563]
  - - [13, 512, 1, 864]
    - [484, 0.417]
- null
