library/src/blas3/Tensile/Logic/asm_full/arcturus_Cijk_Alik_Bljk_HBH.yaml
- {MinimumRequiredVersion: 4.6.0}
- arcturus
- gfx908
- [Device 7380, Device 7388, Device 738c, Device 7390, Device 731f]
    SolutionIndex: 0
    SolutionNameMin: Cijk_Alik_Bljk_HBH_MT032x016x08_PGR1_PLR1_TT04_02
    SolutionIndex: 1
    SolutionNameMin: Cijk_Alik_Bljk_HBH_MT032x016x08_PGR1_PLR1_TT02_02
    SolutionIndex: 2
    SolutionNameMin: Cijk_Alik_Bljk_HBH_MT032x032x08_PGR1_PLR1_TT02_02
    SolutionIndex: 3
    SolutionNameMin: Cijk_Alik_Bljk_HBH_MT016x016x16_PGR1_PLR1_TT02_02
    SolutionIndex: 4
    SolutionNameMin: Cijk_Alik_Bljk_HBH_MT032x032x16_PGR1_PLR1_TT04_04
    SolutionIndex: 5
    SolutionNameMin: Cijk_Alik_Bljk_HBH_MT032x016x16_PGR1_PLR1_TT02_02
    SolutionIndex: 6
    SolutionNameMin: Cijk_Alik_Bljk_HBH_MT064x032x16_PGR1_PLR1_TT04_04
    SolutionIndex: 7
    SolutionNameMin: Cijk_Alik_Bljk_HBH_MT016x016x32_PGR1_PLR1_TT02_02
    SolutionIndex: 8
    SolutionNameMin: Cijk_Alik_Bljk_HBH_MT032x032x32_PGR1_PLR1_TT04_04
    SolutionIndex: 9
    SolutionNameMin: Cijk_Alik_Bljk_HBH_MT064x016x32_PGR1_PLR1_TT02_02
    SolutionIndex: 10
    SolutionNameMin: Cijk_Alik_Bljk_HBH_MT032x016x08_PGR1_PLR1_TT04_02
    SolutionIndex: 11
    SolutionNameMin: Cijk_Alik_Bljk_HBH_MT016x016x16_PGR1_PLR1_TT02_02
    SolutionIndex: 12
    SolutionNameMin: Cijk_Alik_Bljk_HBH_MT032x032x16_PGR1_PLR1_TT04_04
    SolutionIndex: 13
    SolutionNameMin: Cijk_Alik_Bljk_HBH_MT064x064x16_PGR1_PLR1_TT08_08
    SolutionIndex: 14
    SolutionNameMin: Cijk_Alik_Bljk_HBH_MT064x032x16_PGR1_PLR1_TT04_04
    SolutionIndex: 15
    SolutionNameMin: Cijk_Alik_Bljk_HBH_MT016x016x24_PGR1_PLR1_TT02_02
    SolutionIndex: 16
    SolutionNameMin: Cijk_Alik_Bljk_HBH_MT032x016x24_PGR1_PLR1_TT04_02
    SolutionIndex: 17
    SolutionNameMin: Cijk_Alik_Bljk_HBH_MT032x032x24_PGR1_PLR1_TT04_04
    SolutionIndex: 18
    SolutionNameMin: Cijk_Alik_Bljk_HBH_MT016x016x24_PGR1_PLR1_TT02_02
    SolutionIndex: 19
    SolutionNameMin: Cijk_Alik_Bljk_HBH_MT032x016x24_PGR1_PLR1_TT04_02
    SolutionIndex: 20
    SolutionNameMin: Cijk_Alik_Bljk_HBH_MT032x032x24_PGR1_PLR1_TT04_04
    SolutionIndex: 21
    SolutionNameMin: Cijk_Alik_Bljk_HBH_MT064x064x24_PGR1_PLR1_TT08_08
    SolutionIndex: 22
    SolutionNameMin: Cijk_Alik_Bljk_HBH_MT032x032x32_PGR1_PLR1_TT04_04
    SolutionIndex: 23
    SolutionNameMin: Cijk_Alik_Bljk_HBH_MT064x064x08_PGR1_PLR1_TT04_04
    SolutionIndex: 24
    SolutionNameMin: Cijk_Alik_Bljk_HBH_MT064x128x08_PGR1_PLR1_TT04_08
    SolutionIndex: 25
    SolutionNameMin: Cijk_Alik_Bljk_HBH_MT128x064x08_PGR1_PLR1_TT08_04
    SolutionIndex: 26
    SolutionNameMin: Cijk_Alik_Bljk_HBH_MT064x064x16_PGR1_PLR1_TT04_04
    SolutionIndex: 27
    SolutionNameMin: Cijk_Alik_Bljk_HBH_MT064x128x16_PGR1_PLR1_TT04_08
    SolutionIndex: 28
    SolutionNameMin: Cijk_Alik_Bljk_HBH_MT128x064x16_PGR1_PLR1_TT08_04
    SolutionIndex: 29
    SolutionNameMin: Cijk_Alik_Bljk_HBH_MT128x128x16_PGR1_PLR1_TT08_08
    SolutionIndex: 30
    SolutionNameMin: Cijk_Alik_Bljk_HBH_MT064x064x32_PGR1_PLR1_TT04_04
    SolutionIndex: 31
    SolutionNameMin: Cijk_Alik_Bljk_HBH_MT128x064x32_PGR1_PLR1_TT08_04
    SolutionIndex: 32
    SolutionNameMin: Cijk_Alik_Bljk_HBH_MT128x128x32_PGR1_PLR1_TT08_08
    SolutionIndex: 33
    SolutionNameMin: Cijk_Alik_Bljk_HBH_MT064x128x04_PGR0_PLR0_TT04_08
    SolutionIndex: 34
    SolutionNameMin: Cijk_Alik_Bljk_HBH_MT064x064x04_PGR0_PLR0_TT04_04
    SolutionIndex: 35
    SolutionNameMin: Cijk_Alik_Bljk_HBH_MT064x064x04_PGR1_PLR0_TT04_04
    SolutionIndex: 36
    SolutionNameMin: Cijk_Alik_Bljk_HBH_MT064x064x04_PGR0_PLR1_TT04_04
    SolutionIndex: 37
    SolutionNameMin: Cijk_Alik_Bljk_HBH_MT064x064x08_PGR0_PLR0_TT04_04
    SolutionIndex: 38
    SolutionNameMin: Cijk_Alik_Bljk_HBH_MT064x064x08_PGR1_PLR0_TT04_04
    SolutionIndex: 39
    SolutionNameMin: Cijk_Alik_Bljk_HBH_MT128x128x08_PGR0_PLR1_TT08_08
    SolutionIndex: 40
    SolutionNameMin: Cijk_Alik_Bljk_HBH_MT064x128x08_PGR0_PLR1_TT04_08
    SolutionIndex: 41
    SolutionNameMin: Cijk_Alik_Bljk_HBH_MT064x064x08_PGR0_PLR1_TT04_04
    SolutionIndex: 42
    SolutionNameMin: Cijk_Alik_Bljk_HBH_MT064x064x08_PGR1_PLR1_TT04_04
    SolutionIndex: 43
    SolutionNameMin: Cijk_Alik_Bljk_HBH_MT064x064x16_PGR0_PLR0_TT04_04
    SolutionIndex: 44
    SolutionNameMin: Cijk_Alik_Bljk_HBH_MT064x064x16_PGR1_PLR0_TT04_04
    SolutionIndex: 45
    SolutionNameMin: Cijk_Alik_Bljk_HBH_MT064x064x16_PGR0_PLR1_TT04_04
    SolutionIndex: 46
    SolutionNameMin: Cijk_Alik_Bljk_HBH_MT064x064x16_PGR1_PLR1_TT04_04
    SolutionIndex: 47
    SolutionNameMin: Cijk_Alik_Bljk_HBH_MT064x128x04_PGR0_PLR0_TT04_08
    SolutionIndex: 48
    SolutionNameMin: Cijk_Alik_Bljk_HBH_MT064x064x04_PGR0_PLR0_TT04_04
    SolutionIndex: 49
    SolutionNameMin: Cijk_Alik_Bljk_HBH_MT064x128x04_PGR1_PLR0_TT04_08
    SolutionIndex: 50
    SolutionNameMin: Cijk_Alik_Bljk_HBH_MT064x064x04_PGR1_PLR0_TT04_04
    SolutionIndex: 51
    SolutionNameMin: Cijk_Alik_Bljk_HBH_MT128x128x04_PGR0_PLR1_TT08_08
    SolutionIndex: 52
    SolutionNameMin: Cijk_Alik_Bljk_HBH_MT064x128x04_PGR0_PLR1_TT04_08
    SolutionIndex: 53
    SolutionNameMin: Cijk_Alik_Bljk_HBH_MT064x064x04_PGR0_PLR1_TT04_04
    SolutionIndex: 54
    SolutionNameMin: Cijk_Alik_Bljk_HBH_MT064x128x04_PGR1_PLR1_TT04_08
    SolutionIndex: 55
    SolutionNameMin: Cijk_Alik_Bljk_HBH_MT064x064x04_PGR1_PLR1_TT04_04
    SolutionIndex: 56
    SolutionNameMin: Cijk_Alik_Bljk_HBH_MT128x128x08_PGR0_PLR0_TT08_08
    SolutionIndex: 57
    SolutionNameMin: Cijk_Alik_Bljk_HBH_MT064x128x08_PGR0_PLR0_TT04_08
    SolutionIndex: 58
    SolutionNameMin: Cijk_Alik_Bljk_HBH_MT064x064x08_PGR0_PLR0_TT04_04
    SolutionIndex: 59
    SolutionNameMin: Cijk_Alik_Bljk_HBH_MT064x064x08_PGR1_PLR0_TT04_04
    SolutionIndex: 60
    SolutionNameMin: Cijk_Alik_Bljk_HBH_MT064x128x08_PGR0_PLR1_TT04_08
    SolutionIndex: 61
    SolutionNameMin: Cijk_Alik_Bljk_HBH_MT064x064x08_PGR0_PLR1_TT04_04
    SolutionIndex: 62
    SolutionNameMin: Cijk_Alik_Bljk_HBH_MT064x128x08_PGR1_PLR1_TT04_08
    SolutionIndex: 63
    SolutionNameMin: Cijk_Alik_Bljk_HBH_MT064x064x08_PGR1_PLR1_TT04_04
    SolutionIndex: 64
    SolutionNameMin: Cijk_Alik_Bljk_HBH_MT064x064x16_PGR1_PLR1_TT04_04
    SolutionIndex: 65
    SolutionNameMin: Cijk_Alik_Bljk_HBH_MT064x032x16_EPS1_GRVW04_LPB04_PGR1_PLR1_SNLL1_TT04_04_VW04_WG16_08_01_WGM01
    SolutionIndex: 66
    SolutionNameMin: Cijk_Alik_Bljk_HBH_MT064x064x16_EPS1_GRVW04_LPB04_PGR1_PLR1_SNLL1_TT04_04_VW04_WG16_16_01_WGM01
    SolutionIndex: 67
    SolutionNameMin: Cijk_Alik_Bljk_HBH_MT064x032x16_EPS1_GRVW04_LPB04_PGR1_PLR1_SNLL1_TT04_04_VW04_WG16_08_01_WGM08
    SolutionIndex: 68
    SolutionNameMin: Cijk_Alik_Bljk_HBH_MT064x032x16_EPS1_GRVW04_LPB04_PGR1_PLR1_SNLL1_TT04_04_VW04_WG16_08_01_WGM64
    SolutionIndex: 69
    SolutionNameMin: Cijk_Alik_Bljk_HBH_MT032x128x32_EPS1_GRVW04_LPB04_PGR1_PLR1_SNLL1_TT04_04_VW04_WG08_32_01_WGM01
    SolutionIndex: 70
    SolutionNameMin: Cijk_Alik_Bljk_HBH_MT032x128x32_EPS1_GRVW04_LPB04_PGR1_PLR1_SNLL1_TT04_04_VW04_WG08_32_01_WGM64
    SolutionIndex: 71
    SolutionNameMin: Cijk_Alik_Bljk_HBH_MT032x032x08_PGR0_PLR1_TT04_04
    SolutionIndex: 72
    SolutionNameMin: Cijk_Alik_Bljk_HBH_MT032x032x08_PGR1_PLR1_TT04_04
    SolutionIndex: 73
    SolutionNameMin: Cijk_Alik_Bljk_HBH_MT032x032x16_PGR1_PLR1_TT04_04
    SolutionIndex: 74
    SolutionNameMin: Cijk_Alik_Bljk_HBH_MT064x016x16_PGR1_PLR1_TT04_04
    SolutionIndex: 75
    SolutionNameMin: Cijk_Alik_Bljk_HBH_MT064x064x16_PGR1_PLR1_TT04_04
    SolutionIndex: 76
    SolutionNameMin: Cijk_Alik_Bljk_HBH_MT032x032x32_PGR1_PLR1_TT04_04
    SolutionIndex: 77
    SolutionNameMin: Cijk_Alik_Bljk_HBH_MT064x016x32_PGR1_PLR1_TT04_04
    SolutionIndex: 78
    SolutionNameMin: Cijk_Alik_Bljk_HBH_MT064x064x16_PGR1_PLR1_TT08_08
    SolutionIndex: 79
    SolutionNameMin: Cijk_Alik_Bljk_HBH_MT032x032x16_PGR1_PLR1_TT04_04
    SolutionIndex: 80
    SolutionNameMin: Cijk_Alik_Bljk_HBH_MT064x032x16_PGR1_PLR1_TT04_04
    SolutionIndex: 81
    SolutionNameMin: Cijk_Alik_Bljk_HBH_MT032x032x32_PGR1_PLR1_TT04_04
    SolutionIndex: 82
    SolutionNameMin: Cijk_Alik_Bljk_HBH_MT064x032x32_PGR1_PLR1_TT04_04
    SolutionIndex: 83
    SolutionNameMin: Cijk_Alik_Bljk_HBH_MT064x064x08_PGR1_PLR1_TT08_08
    SolutionIndex: 84
    SolutionNameMin: Cijk_Alik_Bljk_HBH_MT064x064x16_PGR1_PLR1_TT08_08
    SolutionIndex: 85
    SolutionNameMin: Cijk_Alik_Bljk_HBH_MT064x064x32_PGR1_PLR1_TT08_08
    SolutionIndex: 86
    SolutionNameMin: Cijk_Alik_Bljk_HBH_MT128x128x08_PGR1_PLR1_TT08_08
    SolutionIndex: 87
    SolutionNameMin: Cijk_Alik_Bljk_HBH_MT032x064x16_PGR1_PLR1_TT04_08
    SolutionIndex: 88
    SolutionNameMin: Cijk_Alik_Bljk_HBH_MT064x064x16_PGR1_PLR1_TT04_04
    SolutionIndex: 89
    SolutionNameMin: Cijk_Alik_Bljk_HBH_MT064x128x16_PGR1_PLR1_TT04_08
    SolutionIndex: 90
    SolutionNameMin: Cijk_Alik_Bljk_HBH_MT128x064x16_PGR1_PLR1_TT08_04
    SolutionIndex: 91
    SolutionNameMin: Cijk_Alik_Bljk_HBH_MT128x128x32_PGR1_PLR1_TT08_08
    SolutionIndex: 92
    SolutionNameMin: Cijk_Alik_Bljk_HBH_MT128x128x16_PGR1_PLR1_TT08_08
    SolutionIndex: 93
    SolutionNameMin: Cijk_Alik_Bljk_HBH_MT128x128x32_PGR1_PLR1_TT08_08
    SolutionIndex: 94
    SolutionNameMin: Cijk_Alik_Bljk_HBH_MT064x128x04_PGR0_PLR0_TT04_08
    SolutionIndex: 95
    SolutionNameMin: Cijk_Alik_Bljk_HBH_MT064x064x04_PGR0_PLR0_TT04_04
    SolutionIndex: 96
    SolutionNameMin: Cijk_Alik_Bljk_HBH_MT064x064x04_PGR1_PLR0_TT04_04
    SolutionIndex: 97
    SolutionNameMin: Cijk_Alik_Bljk_HBH_MT064x064x04_PGR1_PLR1_TT04_04
    SolutionIndex: 98
    SolutionNameMin: Cijk_Alik_Bljk_HBH_MT128x128x08_PGR0_PLR0_TT08_08
    SolutionIndex: 99
    SolutionNameMin: Cijk_Alik_Bljk_HBH_MT064x064x08_PGR0_PLR0_TT04_04
    SolutionIndex: 100
    SolutionNameMin: Cijk_Alik_Bljk_HBH_MT064x128x08_PGR1_PLR0_TT04_08
    SolutionIndex: 101
    SolutionNameMin: Cijk_Alik_Bljk_HBH_MT064x064x08_PGR1_PLR0_TT04_04
    SolutionIndex: 102
    SolutionNameMin: Cijk_Alik_Bljk_HBH_MT064x064x08_PGR0_PLR1_TT04_04
    SolutionIndex: 103
    SolutionNameMin: Cijk_Alik_Bljk_HBH_MT064x064x08_PGR1_PLR1_TT04_04
    SolutionIndex: 104
    SolutionNameMin: Cijk_Alik_Bljk_HBH_MT064x064x16_PGR1_PLR0_TT04_04
    SolutionIndex: 105
    SolutionNameMin: Cijk_Alik_Bljk_HBH_MT064x128x16_PGR1_PLR1_TT04_08
    SolutionIndex: 106
    SolutionNameMin: Cijk_Alik_Bljk_HBH_MT064x064x16_PGR1_PLR1_TT04_04
    SolutionIndex: 107
    SolutionNameMin: Cijk_Alik_Bljk_HBH_MT128x128x04_PGR0_PLR0_TT08_08
    SolutionIndex: 108
    SolutionNameMin: Cijk_Alik_Bljk_HBH_MT064x128x04_PGR0_PLR0_TT04_08
    SolutionIndex: 109
    SolutionNameMin: Cijk_Alik_Bljk_HBH_MT064x064x04_PGR0_PLR0_TT04_04
    SolutionIndex: 110
    SolutionNameMin: Cijk_Alik_Bljk_HBH_MT064x128x04_PGR1_PLR0_TT04_08
    SolutionIndex: 111
    SolutionNameMin: Cijk_Alik_Bljk_HBH_MT064x064x04_PGR1_PLR0_TT04_04
    SolutionIndex: 112
    SolutionNameMin: Cijk_Alik_Bljk_HBH_MT064x128x04_PGR0_PLR1_TT04_08
    SolutionIndex: 113
    SolutionNameMin: Cijk_Alik_Bljk_HBH_MT064x064x04_PGR0_PLR1_TT04_04
    SolutionIndex: 114
    SolutionNameMin: Cijk_Alik_Bljk_HBH_MT064x128x04_PGR1_PLR1_TT04_08
    SolutionIndex: 115
    SolutionNameMin: Cijk_Alik_Bljk_HBH_MT064x064x04_PGR1_PLR1_TT04_04
    SolutionIndex: 116
    SolutionNameMin: Cijk_Alik_Bljk_HBH_MT128x128x08_PGR0_PLR0_TT08_08
    SolutionIndex: 117
    SolutionNameMin: Cijk_Alik_Bljk_HBH_MT064x128x08_PGR0_PLR0_TT04_08
    SolutionIndex: 118
    SolutionNameMin: Cijk_Alik_Bljk_HBH_MT064x064x08_PGR0_PLR0_TT04_04
    SolutionIndex: 119
    SolutionNameMin: Cijk_Alik_Bljk_HBH_MT064x064x08_PGR1_PLR0_TT04_04
    SolutionIndex: 120
    SolutionNameMin: Cijk_Alik_Bljk_HBH_MT064x064x08_PGR0_PLR1_TT04_04
    SolutionIndex: 121
    SolutionNameMin: Cijk_Alik_Bljk_HBH_MT064x064x08_PGR1_PLR1_TT04_04
    SolutionIndex: 122
    SolutionNameMin: Cijk_Alik_Bljk_HBH_MT064x064x16_PGR0_PLR0_TT04_04
    SolutionIndex: 123
    SolutionNameMin: Cijk_Alik_Bljk_HBH_MT064x064x16_PGR1_PLR1_TT04_04
    SolutionIndex: 124
    SolutionNameMin: Cijk_Alik_Bljk_HBH_MT128x32x16_SE_
    SolutionIndex: 125
    SolutionNameMin: Cijk_Alik_Bljk_HBH_MT128x64x16_SE_
    SolutionIndex: 126
    SolutionNameMin: Cijk_Alik_Bljk_HBH_MT256x128x16_SE_
    SolutionIndex: 127
    SolutionNameMin: Cijk_Alik_Bljk_HBH_MT64x16x16_SE_
    SolutionIndex: 128
    SolutionNameMin: Cijk_Alik_Bljk_HBH_MT64x32x16_SE_
    SolutionIndex: 129
    SolutionNameMin: Cijk_Alik_Bljk_HBH_MT64x128x32_SE_
    SolutionIndex: 130
    SolutionNameMin: Cijk_Alik_Bljk_HBH_MT128x256x32_SE_
    SolutionIndex: 131
    SolutionNameMin: Cijk_Alik_Bljk_HBH_MT128x256x16_SE_
    SolutionIndex: 132
    SolutionNameMin: Cijk_Alik_Bljk_HBH_MT128x32x16_SE_AF0EM1_ASEM1_GRVW1_ONLL1_SNLL0
    SolutionIndex: 133
    SolutionNameMin: Cijk_Alik_Bljk_HBH_MT128x64x16_SE_AF0EM1_ASEM1_GRVW1_ONLL1_SNLL0
    SolutionIndex: 134
    SolutionNameMin: Cijk_Alik_Bljk_HBH_MT64x128x16_SE_AF0EM1_ASEM1_GRVW1_ONLL1_SNLL0
    SolutionIndex: 135
    SolutionNameMin: Cijk_Alik_Bljk_HBH_MT256x64x16_SE_AF0EM1_ASEM1_GRVW1_ONLL1_SNLL0
    SolutionIndex: 136
    SolutionNameMin: Cijk_Alik_Bljk_HBH_MT256x128x16_SE_AF0EM1_ASEM1_GRVW1_ONLL1_SNLL0
    SolutionIndex: 137
    SolutionNameMin: Cijk_Alik_Bljk_HBH_MT128x256x16_SE_AF0EM1_ASEM1_GRVW1_ONLL1_SNLL0
    SolutionIndex: 138
    SolutionNameMin: Cijk_Alik_Bljk_HBH_MT64x32x16_SE_AF0EM1_ASEM1_GRVW1_ONLL1_SNLL0
    SolutionIndex: 139
    SolutionNameMin: Cijk_Alik_Bljk_HBH_MT64x128x32_SE_AF0EM8_ASEM8_GRVW4_ONLL1_SNLL0
    SolutionIndex: 140
    SolutionNameMin: Cijk_Alik_Bljk_HBH_MT128x256x32_SE_AF0EM8_ASEM8_GRVW8_ONLL1_SNLL0
    SolutionIndex: 141
    SolutionNameMin: Cijk_Alik_Bljk_HBH_MT64x128x8_MI32x32x4x2_SE_AF0EM1_ASEM2_GRVW2_ONLL0_SNLL1
    SolutionIndex: 142
    SolutionNameMin: Cijk_Alik_Bljk_HBH_MT64x128x16_MI32x32x4x2_SE_AF0EM2_ASEM1_GRVW2_ONLL0_SNLL1
    SolutionIndex: 143
    SolutionNameMin: Cijk_Alik_Bljk_HBH_MT64x128x16_MI32x32x4x2_SE_AF0EM1_ASEM1_GRVW4_ONLL0_SNLL1
    SolutionIndex: 144
    SolutionNameMin: Cijk_Alik_Bljk_HBH_MT64x128x16_MI32x32x4x2_SE_AF0EM1_ASEM2_GRVW4_ONLL0_SNLL1
    SolutionIndex: 145
    SolutionNameMin: Cijk_Alik_Bljk_HBH_MT64x128x16_MI32x32x4x2_SE_AF0EM2_ASEM1_GRVW4_ONLL0_SNLL1
    SolutionIndex: 146
    SolutionNameMin: Cijk_Alik_Bljk_HBH_MT64x128x16_MI32x32x4x2_SE_AF0EM2_ASEM2_GRVW4_ONLL0_SNLL1
    SolutionIndex: 147
    SolutionNameMin: Cijk_Alik_Bljk_HBH_MT64x128x16_MI32x32x4x2_SE_AF0EM1_ASEM2_GRVW2_ONLL0_SNLL0
    SolutionIndex: 148
    SolutionNameMin: Cijk_Alik_Bljk_HBH_MT64x128x16_MI32x32x4x2_SE_AF0EM2_ASEM1_GRVW2_ONLL0_SNLL0
    SolutionIndex: 149
    SolutionNameMin: Cijk_Alik_Bljk_HBH_MT32x256x16_MI32x32x4x2_SE_AF0EM2_ASEM2_GRVW4_ONLL0_SNLL0
    SolutionIndex: 150
    SolutionNameMin: Cijk_Alik_Bljk_HBH_MT64x128x16_MI32x32x4x2_SE_AF0EM1_ASEM1_GRVW4_ONLL0_SNLL0
    SolutionIndex: 151
    SolutionNameMin: Cijk_Alik_Bljk_HBH_MT64x128x16_MI32x32x4x2_SE_AF0EM1_ASEM2_GRVW4_ONLL0_SNLL0
    SolutionIndex: 152
    SolutionNameMin: Cijk_Alik_Bljk_HBH_MT64x128x16_MI32x32x4x2_SE_AF0EM2_ASEM1_GRVW4_ONLL0_SNLL0
    SolutionIndex: 153
    SolutionNameMin: Cijk_Alik_Bljk_HBH_MT64x128x16_MI32x32x4x2_SE_AF0EM2_ASEM2_GRVW4_ONLL0_SNLL0
    SolutionIndex: 154
    SolutionNameMin: Cijk_Alik_Bljk_HBH_MT64x128x32_MI32x32x4x2_SE_AF0EM1_ASEM1_GRVW4_ONLL0_SNLL0
    SolutionIndex: 155
    SolutionNameMin: Cijk_Alik_Bljk_HBH_MT64x128x32_MI32x32x4x2_SE_AF0EM1_ASEM2_GRVW4_ONLL0_SNLL0
    SolutionIndex: 156
    SolutionNameMin: Cijk_Alik_Bljk_HBH_MT64x128x32_MI32x32x4x2_SE_AF0EM2_ASEM1_GRVW4_ONLL0_SNLL0
    SolutionIndex: 157
    SolutionNameMin: Cijk_Alik_Bljk_HBH_MT64x128x32_MI32x32x4x2_SE_AF0EM2_ASEM2_GRVW4_ONLL0_SNLL0
    SolutionIndex: 158
    SolutionNameMin: Cijk_Alik_Bljk_HBH_MT64x128x16_MI32x32x4x2_SE_AF0EM1_ASEM1_GRVW2_ONLL1_SNLL1
    SolutionIndex: 159
    SolutionNameMin: Cijk_Alik_Bljk_HBH_MT64x128x16_MI32x32x4x2_SE_AF0EM2_ASEM1_GRVW2_ONLL1_SNLL1
    SolutionIndex: 160
    SolutionNameMin: Cijk_Alik_Bljk_HBH_MT64x128x8_MI32x32x4x2_SE_AF0EM1_ASEM1_GRVW4_ONLL1_SNLL1
    SolutionIndex: 161
    SolutionNameMin: Cijk_Alik_Bljk_HBH_MT64x128x16_MI32x32x4x2_SE_AF0EM1_ASEM2_GRVW4_ONLL1_SNLL1
    SolutionIndex: 162
    SolutionNameMin: Cijk_Alik_Bljk_HBH_MT64x128x16_MI32x32x4x2_SE_AF0EM2_ASEM1_GRVW4_ONLL1_SNLL1
    SolutionIndex: 163
    SolutionNameMin: Cijk_Alik_Bljk_HBH_MT64x128x16_MI32x32x4x2_SE_AF0EM2_ASEM1_GRVW2_ONLL1_SNLL0
    SolutionIndex: 164
    SolutionNameMin: Cijk_Alik_Bljk_HBH_MT64x128x8_MI32x32x4x2_SE_AF0EM1_ASEM2_GRVW4_ONLL1_SNLL0
    SolutionIndex: 165
    SolutionNameMin: Cijk_Alik_Bljk_HBH_MT32x256x16_MI32x32x4x2_SE_AF0EM2_ASEM1_GRVW4_ONLL1_SNLL0
    SolutionIndex: 166
    SolutionNameMin: Cijk_Alik_Bljk_HBH_MT64x128x16_MI32x32x4x2_SE_AF0EM1_ASEM1_GRVW4_ONLL1_SNLL0
    SolutionIndex: 167
    SolutionNameMin: Cijk_Alik_Bljk_HBH_MT64x128x16_MI32x32x4x2_SE_AF0EM1_ASEM2_GRVW4_ONLL1_SNLL0
    SolutionIndex: 168
    SolutionNameMin: Cijk_Alik_Bljk_HBH_MT64x128x16_MI32x32x4x2_SE_AF0EM2_ASEM1_GRVW4_ONLL1_SNLL0
    SolutionIndex: 169
    SolutionNameMin: Cijk_Alik_Bljk_HBH_MT64x128x16_MI32x32x4x2_SE_AF0EM2_ASEM2_GRVW4_ONLL1_SNLL0
    SolutionIndex: 170
    SolutionNameMin: Cijk_Alik_Bljk_HBH_MT64x128x32_MI32x32x4x2_SE_AF0EM1_ASEM1_GRVW4_ONLL1_SNLL0
    SolutionIndex: 171
    SolutionNameMin: Cijk_Alik_Bljk_HBH_MT64x128x32_MI32x32x4x2_SE_AF0EM1_ASEM2_GRVW4_ONLL1_SNLL0
    SolutionIndex: 172
    SolutionNameMin: Cijk_Alik_Bljk_HBH_MT64x128x32_MI32x32x4x2_SE_AF0EM2_ASEM1_GRVW4_ONLL1_SNLL0
    SolutionIndex: 173
    SolutionNameMin: Cijk_Alik_Bljk_HBH_MT64x128x32_MI32x32x4x2_SE_AF0EM2_ASEM2_GRVW4_ONLL1_SNLL0
    SolutionIndex: 174
    SolutionIndex: 175
    SolutionIndex: 176
    SolutionIndex: 177
    SolutionIndex: 178
    SolutionIndex: 179
    SolutionIndex: 180
    SolutionIndex: 181
    SolutionIndex: 182
    SolutionIndex: 183
    SolutionIndex: 184
    SolutionIndex: 185
    SolutionIndex: 186
    SolutionIndex: 187
    SolutionIndex: 188
    SolutionIndex: 189
    SolutionIndex: 190
    SolutionIndex: 191
    SolutionIndex: 192
    SolutionIndex: 193
    SolutionIndex: 194
    SolutionIndex: 195
    SolutionIndex: 196
    SolutionIndex: 197
    SolutionIndex: 198
    SolutionIndex: 199
    SolutionIndex: 200
    SolutionIndex: 201
    SolutionIndex: 202
    SolutionIndex: 203
    SolutionIndex: 204
    SolutionIndex: 205
    SolutionIndex: 206
    SolutionIndex: 207
    SolutionIndex: 208
    SolutionIndex: 209
    SolutionIndex: 210
    SolutionIndex: 211
    SolutionIndex: 212
    SolutionIndex: 213
    SolutionIndex: 214
    SolutionIndex: 215
    SolutionIndex: 216
    SolutionIndex: 217
    SolutionIndex: 218
    SolutionIndex: 219
    SolutionIndex: 220
    SolutionIndex: 221
    SolutionIndex: 222
    SolutionIndex: 223
    SolutionIndex: 224
    SolutionIndex: 225
    SolutionIndex: 226
    SolutionIndex: 227
    SolutionIndex: 228
    SolutionIndex: 229
    SolutionIndex: 230
    SolutionIndex: 231
    SolutionIndex: 232
    SolutionIndex: 233
    SolutionIndex: 234
    SolutionIndex: 235
    SolutionIndex: 236
    SolutionIndex: 237
    SolutionIndex: 238
    SolutionIndex: 239
    SolutionIndex: 240
    SolutionIndex: 241
    SolutionIndex: 242
    SolutionIndex: 243
    SolutionIndex: 244
    SolutionIndex: 245
    SolutionIndex: 246
    SolutionIndex: 247
    SolutionIndex: 248
    SolutionIndex: 249
    SolutionIndex: 250
    SolutionIndex: 251
    SolutionIndex: 252
    SolutionIndex: 253
    SolutionIndex: 254
    SolutionIndex: 255
    SolutionIndex: 256
    SolutionIndex: 257
    SolutionIndex: 258
    SolutionIndex: 259
    SolutionIndex: 260
    SolutionIndex: 261
    SolutionIndex: 262
    SolutionIndex: 263
    SolutionIndex: 264
    SolutionIndex: 265
    SolutionIndex: 266
    SolutionIndex: 267
    SolutionIndex: 268
    SolutionIndex: 269
    SolutionIndex: 270
    SolutionIndex: 271
    SolutionIndex: 272
    SolutionIndex: 273
    SolutionIndex: 274
    SolutionIndex: 275
    SolutionIndex: 276
    SolutionIndex: 277
    SolutionIndex: 278
    SolutionIndex: 279
    SolutionIndex: 280
    SolutionIndex: 281
    SolutionIndex: 282
    SolutionIndex: 283
    SolutionIndex: 284
    SolutionIndex: 285
    SolutionIndex: 286
    SolutionIndex: 287
    SolutionIndex: 288
    SolutionIndex: 289
    SolutionIndex: 290
    SolutionIndex: 291
    SolutionIndex: 292
    SolutionIndex: 293
    SolutionIndex: 294
    SolutionIndex: 295
    SolutionIndex: 296
    SolutionIndex: 297
    SolutionIndex: 298
    SolutionIndex: 299
    SolutionIndex: 300
    SolutionIndex: 301
    SolutionIndex: 302
    SolutionIndex: 303
    SolutionIndex: 304
    SolutionIndex: 305
    SolutionIndex: 306
    SolutionIndex: 307
    SolutionIndex: 308
    SolutionIndex: 309
    SolutionIndex: 310
    SolutionIndex: 311
    SolutionIndex: 312
    SolutionIndex: 313
    SolutionIndex: 314
    SolutionIndex: 315
    SolutionIndex: 316
    SolutionIndex: 317
    SolutionIndex: 318
    SolutionIndex: 319
    SolutionIndex: 320
    SolutionIndex: 321
    SolutionIndex: 322
    SolutionIndex: 323
    SolutionIndex: 324
    SolutionIndex: 325
    SolutionIndex: 326
    SolutionIndex: 327
    SolutionIndex: 328
    SolutionIndex: 329
    SolutionIndex: 330
    SolutionIndex: 331
    SolutionIndex: 332
    SolutionIndex: 333
    SolutionIndex: 334
    SolutionIndex: 335
    SolutionIndex: 336
    SolutionIndex: 337
    SolutionIndex: 338
    SolutionIndex: 339
    SolutionIndex: 340
    SolutionIndex: 341
    SolutionIndex: 342
    SolutionIndex: 343
    SolutionIndex: 344
    SolutionIndex: 345
    SolutionIndex: 346
    SolutionIndex: 347
    SolutionIndex: 348
    SolutionIndex: 349
    SolutionIndex: 350
    SolutionIndex: 351
    SolutionIndex: 352
    SolutionIndex: 353
    SolutionIndex: 354
    SolutionIndex: 355
    SolutionIndex: 356
    SolutionIndex: 357
    SolutionIndex: 358
    SolutionIndex: 359
    SolutionIndex: 360
    SolutionIndex: 361
    SolutionIndex: 362
    SolutionIndex: 363
    SolutionIndex: 364
    SolutionIndex: 365
    SolutionIndex: 366
    SolutionIndex: 367
    SolutionIndex: 368
    SolutionIndex: 369
    SolutionIndex: 370
    SolutionIndex: 371
    SolutionIndex: 372
    SolutionIndex: 373
    SolutionIndex: 374
    SolutionIndex: 375
    SolutionIndex: 376
    SolutionIndex: 377
    SolutionIndex: 378
    SolutionIndex: 379
    SolutionIndex: 380
    SolutionIndex: 381
    SolutionIndex: 382
    SolutionIndex: 383
    SolutionIndex: 384
    SolutionIndex: 385
    SolutionIndex: 386
    SolutionIndex: 387
    SolutionIndex: 388
    SolutionIndex: 389
    SolutionIndex: 390
    SolutionIndex: 391
    SolutionIndex: 392
    SolutionIndex: 393
    SolutionIndex: 394
    SolutionIndex: 395
    SolutionIndex: 396
    SolutionIndex: 397
    SolutionIndex: 398
    SolutionIndex: 399
    SolutionIndex: 400
    SolutionIndex: 401
    SolutionIndex: 402
    SolutionIndex: 403
    SolutionIndex: 404
    SolutionIndex: 405
    SolutionIndex: 406
    SolutionIndex: 407
    SolutionIndex: 408
    SolutionIndex: 409
    SolutionIndex: 410
    SolutionIndex: 411
    SolutionIndex: 412
    SolutionIndex: 413
    SolutionIndex: 414
    SolutionIndex: 415
    SolutionIndex: 416
    SolutionIndex: 417
- - - [2368, 1024, 1, 1]
    - [48, 0.102]
  - - [448, 1, 1, 256]
    - [63, 0.002]
  - - [5056, 1408, 1, 3328]
    - [29, 7.272]
  - - [5056, 1856, 1, 3328]
    - [26, 7.471]
  - - [5888, 128, 1, 1]
    - [52, 0.047]
  - - [448, 3584, 1, 3328]
    - [26, 6.164]
  - - [704, 64, 1, 3328]
    - [18, 1.486]
  - - [5056, 4288, 1, 32]
    - [33, 2.75]
  - - [3584, 1024, 1, 256]
    - [26, 6.864]
  - - [32, 5056, 1, 1280]
    - [46, 0.886]
  - - [1856, 256, 1, 1]
    - [48, 0.031]
  - - [256, 1856, 1, 32]
    - [41, 0.697]
  - - [1408, 3584, 1, 3328]
    - [26, 7.263]
  - - [128, 3584, 1, 1280]
    - [20, 4.85]
  - - [1024, 2368, 1, 3328]
    - [26, 6.724]
  - - [4288, 64, 1, 3328]
    - [18, 3.36]
  - - [1, 4288, 1, 1280]
    - [63, 0.021]
  - - [2368, 64, 1, 1]
    - [61, 0.009]
  - - [256, 128, 1, 256]
    - [3, 0.707]
  - - [448, 64, 1, 1]
    - [56, 0.002]
  - - [32, 1408, 1, 32]
    - [35, 0.071]
  - - [448, 3584, 1, 32]
    - [41, 1.507]
  - - [64, 1024, 1, 1280]
    - [18, 1.934]
  - - [1, 1408, 1, 3328]
    - [64, 0.01]
  - - [1408, 128, 1, 32]
    - [35, 0.257]
  - - [4288, 6784, 1, 3328]
    - [26, 7.768]
  - - [1024, 1, 1, 3328]
    - [64, 0.008]
  - - [2944, 128, 1, 32]
    - [42, 0.623]
  - - [64, 6784, 1, 1]
    - [48, 0.03]
  - - [1024, 64, 1, 1280]
    - [18, 1.924]
  - - [448, 128, 1, 256]
    - [3, 1.126]
  - - [64, 5056, 1, 3328]
    - [14, 3.642]
  - - [5888, 4288, 1, 3328]
    - [26, 7.564]
  - - [1, 2368, 1, 1280]
    - [64, 0.016]
  - - [704, 1024, 1, 1]
    - [53, 0.046]
  - - [2368, 1408, 1, 32]
    - [33, 2.021]
  - - [256, 1856, 1, 1280]
    - [20, 5.01]
  - - [1024, 2944, 1, 1]
    - [48, 0.113]
  - - [2944, 3584, 1, 3328]
    - [26, 7.548]
  - - [2368, 2944, 1, 1280]
    - [26, 7.448]
  - - [256, 1408, 1, 1]
    - [48, 0.024]
  - - [1, 1024, 1, 3328]
    - [64, 0.008]
  - - [6784, 5888, 1, 3328]
    - [24, 7.545]
  - - [3584, 1408, 1, 32]
    - [33, 2.279]
  - - [5056, 256, 1, 256]
    - [26, 5.818]
  - - [1856, 2368, 1, 256]
    - [26, 6.886]
  - - [2368, 1024, 1, 3328]
    - [26, 6.712]
  - - [3584, 4288, 1, 32]
    - [33, 2.651]
  - - [1024, 1024, 1, 1280]
    - [29, 6.386]
  - - [3584, 3584, 1, 1]
    - [52, 0.176]
  - - [32, 2944, 1, 3328]
    - [46, 0.791]
  - - [704, 1408, 1, 3328]
    - [21, 6.156]
  - - [1408, 704, 1, 256]
    - [26, 5.447]
  - - [704, 64, 1, 32]
    - [35, 0.067]
  - - [5888, 1, 1, 3328]
    - [63, 0.03]
  - - [2368, 32, 1, 256]
    - [42, 0.396]
  - - [6784, 128, 1, 3328]
    - [6, 5.435]
  - - [2944, 256, 1, 1]
    - [57, 0.041]
  - - [1408, 2368, 1, 1]
    - [53, 0.118]
  - - [32, 448, 1, 3328]
    - [46, 0.123]
  - - [5056, 1, 1, 3328]
    - [63, 0.026]
  - - [2944, 256, 1, 32]
    - [35, 1.012]
  - - [5056, 6784, 1, 1280]
    - [26, 7.582]
  - - [4288, 5056, 1, 1]
    - [48, 0.182]
  - - [5056, 4288, 1, 1]
    - [48, 0.182]
  - - [128, 4288, 1, 3328]
    - [20, 4.336]
  - - [5056, 128, 1, 256]
    - [14, 4.405]
  - - [1408, 4288, 1, 1280]
    - [26, 7.244]
  - - [1856, 704, 1, 1280]
    - [26, 6.59]
  - - [4288, 1024, 1, 3328]
    - [26, 7.366]
  - - [1, 5888, 1, 3328]
    - [63, 0.03]
  - - [1024, 128, 1, 32]
    - [35, 0.199]
  - - [32, 4288, 1, 1280]
    - [46, 0.741]
  - - [1024, 5056, 1, 1]
    - [48, 0.141]
  - - [704, 3584, 1, 1280]
    - [26, 6.891]
  - - [1856, 5056, 1, 256]
    - [26, 7.219]
  - - [1408, 1024, 1, 1280]
    - [26, 6.242]
  - - [5056, 5888, 1, 3328]
    - [25, 7.437]
  - - [448, 1, 1, 1]
    - [56, 0.0]
  - - [3584, 3584, 1, 1280]
    - [26, 7.649]
  - - [2368, 3584, 1, 32]
    - [33, 2.516]
  - - [2944, 2368, 1, 1]
    - [48, 0.153]
  - - [704, 4288, 1, 1]
    - [48, 0.113]
  - - [2368, 256, 1, 32]
    - [37, 0.886]
  - - [1024, 6784, 1, 1280]
    - [26, 7.419]
  - - [1024, 3584, 1, 1]
    - [54, 0.124]
  - - [32, 5056, 1, 32]
    - [37, 0.285]
  - - [5888, 32, 1, 32]
    - [35, 0.332]
  - - [64, 128, 1, 3328]
    - [15, 0.271]
  - - [256, 5056, 1, 32]
    - [41, 1.379]
  - - [5056, 64, 1, 32]
    - [42, 0.58]
  - - [2368, 5056, 1, 32]
    - [33, 2.568]
  - - [6784, 1856, 1, 32]
    - [33, 2.572]
  - - [64, 128, 1, 1]
    - [48, 0.001]
  - - [64, 2368, 1, 1280]
    - [15, 3.061]
  - - [128, 704, 1, 32]
    - [35, 0.134]
  - - [64, 6784, 1, 3328]
    - [17, 4.778]
  - - [2944, 256, 1, 1280]
    - [26, 5.791]
  - - [5056, 704, 1, 1]
    - [48, 0.122]
  - - [2944, 4288, 1, 256]
    - [26, 7.225]
  - - [1024, 1024, 1, 3328]
    - [29, 6.513]
  - - [5056, 704, 1, 32]
    - [37, 1.992]
  - - [1856, 4288, 1, 3328]
    - [26, 7.488]
  - - [1, 1856, 1, 256]
    - [63, 0.009]
  - - [6784, 4288, 1, 32]
    - [33, 2.783]
  - - [5888, 64, 1, 256]
    - [6, 3.42]
  - - [256, 128, 1, 1]
    - [60, 0.002]
  - - [5888, 5056, 1, 256]
    - [26, 7.275]
  - - [2944, 448, 1, 256]
    - [26, 5.249]
  - - [3584, 2368, 1, 3328]
    - [26, 7.502]
  - - [4288, 1856, 1, 1]
    - [53, 0.158]
  - - [1856, 2944, 1, 1]
    - [48, 0.141]
  - - [32, 4288, 1, 3328]
    - [46, 0.772]
  - - [1, 3584, 1, 3328]
    - [64, 0.027]
  - - [256, 32, 1, 3328]
    - [46, 0.072]
  - - [1856, 2368, 1, 32]
    - [33, 2.161]
  - - [4288, 1856, 1, 32]
    - [33, 2.437]
  - - [5056, 64, 1, 3328]
    - [6, 3.647]
  - - [6784, 1, 1, 1280]
    - [63, 0.033]
  - - [1024, 448, 1, 32]
    - [35, 0.719]
  - - [1408, 64, 1, 1]
    - [55, 0.006]
  - - [1, 1, 1, 3328]
    - [64, 0.0]
  - - [5056, 2368, 1, 256]
    - [26, 7.139]
  - - [1408, 5888, 1, 256]
    - [29, 7.147]
  - - [5056, 6784, 1, 1]
    - [53, 0.192]
  - - [32, 448, 1, 1280]
    - [46, 0.111]
  - - [32, 448, 1, 32]
    - [41, 0.022]
  - - [1856, 64, 1, 256]
    - [11, 1.976]
  - - [1024, 1408, 1, 3328]
    - [26, 6.331]
  - - [256, 5056, 1, 1280]
    - [26, 6.523]
  - - [704, 2368, 1, 1]
    - [50, 0.083]
  - - [64, 1024, 1, 32]
    - [35, 0.099]
  - - [1024, 256, 1, 256]
    - [12, 3.204]
  - - [128, 1, 1, 1]
    - [64, 0.0]
  - - [3584, 4288, 1, 1280]
    - [26, 7.632]
  - - [1856, 128, 1, 32]
    - [42, 0.404]
  - - [1856, 128, 1, 1280]
    - [20, 3.952]
  - - [128, 2944, 1, 3328]
    - [14, 4.226]
  - - [1, 6784, 1, 3328]
    - [63, 0.034]
  - - [3584, 2368, 1, 1]
    - [54, 0.16]
  - - [4288, 448, 1, 3328]
    - [26, 6.515]
  - - [4288, 32, 1, 3328]
    - [46, 0.773]
  - - [256, 1856, 1, 1]
    - [50, 0.031]
  - - [704, 6784, 1, 1280]
    - [26, 7.158]
  - - [2368, 4288, 1, 32]
    - [33, 2.511]
  - - [704, 5056, 1, 1280]
    - [26, 7.117]
  - - [256, 3584, 1, 3328]
    - [29, 5.701]
  - - [1024, 32, 1, 3328]
    - [46, 0.279]
  - - [3584, 6784, 1, 32]
    - [33, 2.779]
  - - [3584, 6784, 1, 1280]
    - [26, 7.702]
  - - [4288, 4288, 1, 3328]
    - [26, 7.649]
  - - [3584, 64, 1, 1280]
    - [20, 3.795]
  - - [64, 1856, 1, 256]
    - [3, 2.018]
  - - [3584, 64, 1, 32]
    - [42, 0.404]
  - - [448, 1, 1, 1280]
    - [64, 0.003]
  - - [256, 4288, 1, 1280]
    - [26, 5.562]
  - - [1408, 3584, 1, 1]
    - [47, 0.139]
  - - [4288, 1856, 1, 3328]
    - [26, 7.475]
  - - [1856, 2944, 1, 1280]
    - [26, 7.428]
  - - [4288, 256, 1, 256]
    - [26, 5.038]
  - - [128, 5888, 1, 32]
    - [41, 0.999]
  - - [128, 5888, 1, 1280]
    - [26, 5.769]
  - - [1408, 128, 1, 3328]
    - [18, 3.517]
  - - [3584, 256, 1, 256]
    - [26, 5.053]
  - - [32, 6784, 1, 3328]
    - [46, 1.213]
  - - [64, 64, 1, 1280]
    - [15, 0.122]
  - - [32, 3584, 1, 256]
    - [46, 0.685]
  - - [704, 256, 1, 32]
    - [35, 0.255]
  - - [448, 128, 1, 3328]
    - [15, 1.853]
  - - [64, 2944, 1, 3328]
    - [18, 3.707]
  - - [64, 4288, 1, 3328]
    - [2, 3.343]
  - - [5056, 1024, 1, 3328]
    - [29, 7.331]
  - - [128, 256, 1, 1280]
    - [15, 1.028]
  - - [1856, 256, 1, 256]
    - [12, 4.124]
  - - [3584, 704, 1, 1]
    - [53, 0.104]
  - - [256, 704, 1, 256]
    - [12, 2.385]
  - - [448, 5056, 1, 1]
    - [53, 0.099]
  - - [5888, 5888, 1, 256]
    - [26, 7.279]
  - - [3584, 704, 1, 32]
    - [41, 1.812]
  - - [448, 6784, 1, 3328]
    - [26, 7.097]
  - - [6784, 4288, 1, 1]
    - [49, 0.187]
  - - [3584, 6784, 1, 1]
    - [47, 0.189]
  - - [1408, 2368, 1, 32]
    - [33, 1.989]
  - - [448, 5056, 1, 32]
    - [37, 1.735]
  - - [4288, 4288, 1, 1280]
    - [26, 7.612]
  - - [6784, 1408, 1, 1]
    - [47, 0.166]
  - - [1856, 5888, 1, 3328]
    - [26, 7.639]
  - - [1024, 704, 1, 1]
    - [50, 0.046]
  - - [3584, 1856, 1, 3328]
    - [26, 7.41]
  - - [5056, 5888, 1, 1]
    - [48, 0.189]
  - - [2944, 1024, 1, 256]
    - [26, 6.542]
  - - [448, 1408, 1, 3328]
    - [26, 4.955]
  - - [5056, 32, 1, 3328]
    - [46, 0.912]
  - - [2368, 4288, 1, 3328]
    - [26, 7.628]
  - - [1024, 704, 1, 32]
    - [42, 0.977]
  - - [448, 2944, 1, 256]
    - [26, 5.223]
  - - [2944, 6784, 1, 256]
    - [26, 7.323]
  - - [2368, 2368, 1, 1280]
    - [26, 7.299]
  - - [5888, 128, 1, 3328]
    - [26, 5.845]
  - - [256, 256, 1, 32]
    - [35, 0.096]
  - - [1024, 1, 1, 256]
    - [63, 0.005]
  - - [3584, 3584, 1, 32]
    - [33, 2.64]
  - - [2944, 448, 1, 1]
    - [63, 0.066]
  - - [128, 32, 1, 32]
    - [35, 0.006]
  - - [5056, 64, 1, 1280]
    - [6, 3.527]
  - - [2944, 2944, 1, 1280]
    - [26, 7.406]
  - - [1, 2368, 1, 256]
    - [63, 0.011]
  - - [1408, 5056, 1, 1]
    - [47, 0.154]
  - - [2944, 32, 1, 1280]
    - [46, 0.74]
  - - [64, 1408, 1, 3328]
    - [15, 2.587]
  - - [256, 448, 1, 1280]
    - [15, 2.886]
  - - [2368, 6784, 1, 1]
    - [48, 0.165]
  - - [6784, 4288, 1, 1280]
    - [26, 7.576]
  - - [2944, 704, 1, 256]
    - [26, 6.382]
  - - [2368, 6784, 1, 1280]
    - [26, 7.605]
  - - [704, 2944, 1, 3328]
    - [13, 7.032]
  - - [5888, 256, 1, 1]
    - [48, 0.078]
  - - [704, 704, 1, 32]
    - [37, 0.742]
  - - [256, 4288, 1, 256]
    - [26, 5.107]
  - - [5056, 6784, 1, 32]
    - [33, 2.819]
  - - [5056, 128, 1, 1]
    - [48, 0.043]
  - - [448, 5056, 1, 1280]
    - [26, 6.807]
  - - [448, 448, 1, 256]
    - [12, 2.657]
  - - [256, 5888, 1, 3328]
    - [26, 6.606]
  - - [704, 448, 1, 1280]
    - [12, 3.388]
  - - [448, 64, 1, 256]
    - [3, 0.613]
  - - [1024, 704, 1, 1280]
    - [26, 5.514]
  - - [5888, 1024, 1, 1]
    - [52, 0.147]
  - - [5888, 448, 1, 32]
    - [41, 1.771]
  - - [6784, 2944, 1, 256]
    - [26, 7.204]
  - - [1024, 256, 1, 1]
    - [48, 0.018]
  - - [2368, 448, 1, 256]
    - [26, 4.85]
  - - [4288, 256, 1, 3328]
    - [26, 5.651]
  - - [4288, 2944, 1, 256]
    - [26, 7.196]
  - - [448, 5888, 1, 3328]
    - [26, 6.696]
  - - [128, 256, 1, 3328]
    - [15, 1.097]
  - - [128, 6784, 1, 32]
    - [37, 1.107]
  - - [1856, 64, 1, 32]
    - [35, 0.18]
  - - [1408, 4288, 1, 1]
    - [47, 0.147]
  - - [1408, 1856, 1, 3328]
    - [26, 7.226]
  - - [4288, 64, 1, 256]
    - [18, 2.599]
  - - [3584, 1024, 1, 3328]
    - [26, 7.407]
  - - [2944, 5888, 1, 3328]
    - [26, 7.648]
  - - [128, 6784, 1, 3328]
    - [6, 5.467]
  - - [448, 4288, 1, 3328]
    - [26, 6.524]
  - - [704, 2368, 1, 256]
    - [26, 5.788]
  - - [1, 64, 1, 3328]
    - [64, 0.0]
  - - [4288, 128, 1, 1]
    - [48, 0.037]
  - - [256, 2368, 1, 32]
    - [42, 0.886]
  - - [4288, 3584, 1, 3328]
    - [26, 7.675]
  - - [1408, 64, 1, 256]
    - [2, 1.564]
  - - [1408, 1024, 1, 1]
    - [47, 0.075]
  - - [64, 1024, 1, 1]
    - [55, 0.004]
  - - [1408, 1024, 1, 256]
    - [26, 5.719]
  - - [5056, 3584, 1, 1]
    - [53, 0.174]
  - - [448, 1024, 1, 256]
    - [26, 4.041]
  - - [6784, 6784, 1, 3328]
    - [29, 7.612]
  - - [6784, 32, 1, 32]
    - [41, 0.363]
  - - [64, 1024, 1, 3328]
    - [15, 2.06]
  - - [2368, 2944, 1, 3328]
    - [26, 7.494]
  - - [448, 448, 1, 1280]
    - [20, 3.325]
  - - [5056, 3584, 1, 32]
    - [33, 2.702]
  - - [5056, 3584, 1, 1280]
    - [26, 7.465]
  - - [1856, 1856, 1, 256]
    - [26, 6.508]
  - - [32, 5888, 1, 256]
    - [46, 0.831]
  - - [256, 1408, 1, 32]
    - [42, 0.565]
  - - [2944, 1, 1, 3328]
    - [64, 0.022]
  - - [32, 704, 1, 3328]
    - [46, 0.189]
  - - [5888, 4288, 1, 1]
    - [52, 0.188]
  - - [1024, 128, 1, 256]
    - [1, 2.166]
  - - [32, 1856, 1, 3328]
    - [46, 0.5]
  - - [5056, 704, 1, 256]
    - [26, 6.585]
  - - [2368, 5056, 1, 256]
    - [26, 7.254]
  - - [1024, 5056, 1, 256]
    - [26, 6.96]
  - - [32, 1024, 1, 3328]
    - [46, 0.276]
  - - [5888, 448, 1, 256]
    - [26, 6.076]
  - - [6784, 5056, 1, 1280]
    - [26, 7.58]
  - - [4288, 6784, 1, 1280]
    - [26, 7.733]
  - - [64, 1, 1, 256]
    - [63, 0.0]
  - - [1856, 64, 1, 1280]
    - [18, 2.964]
  - - [128, 1408, 1, 1]
    - [50, 0.01]
  - - [1024, 64, 1, 32]
    - [35, 0.1]
  - - [1024, 64, 1, 3328]
    - [15, 2.055]
  - - [704, 6784, 1, 3328]
    - [26, 7.221]
  - - [2944, 1856, 1, 1]
    - [48, 0.143]
  - - [5888, 4288, 1, 1280]
    - [26, 7.521]
  - - [5888, 3584, 1, 1280]
    - [26, 7.517]
  - - [32, 2368, 1, 1280]
    - [46, 0.598]
  - - [3584, 1408, 1, 1280]
    - [26, 7.194]
  - - [1024, 2944, 1, 256]
    - [29, 6.483]
  - - [1, 2944, 1, 1280]
    - [64, 0.02]
  - - [32, 1024, 1, 256]
    - [42, 0.161]
  - - [2944, 1856, 1, 1280]
    - [26, 7.43]
  - - [3584, 1, 1, 1280]
    - [64, 0.025]
  - - [256, 3584, 1, 32]
    - [41, 1.15]
  - - [1024, 2368, 1, 1]
    - [47, 0.102]
  - - [2944, 3584, 1, 1280]
    - [26, 7.503]
  - - [64, 1, 1, 1]
    - [53, 0.0]
  - - [1856, 4288, 1, 256]
    - [26, 7.088]
  - - [256, 1, 1, 256]
    - [63, 0.001]
  - - [256, 128, 1, 3328]
    - [15, 1.102]
  - - [1, 1856, 1, 3328]
    - [64, 0.014]
  - - [448, 3584, 1, 1]
    - [53, 0.083]
  - - [2368, 2944, 1, 32]
    - [33, 2.419]
  - - [128, 4288, 1, 32]
    - [42, 0.81]
  - - [448, 256, 1, 256]
    - [11, 1.844]
  - - [64, 64, 1, 1]
    - [53, 0.0]
  - - [1, 1408, 1, 1]
    - [48, 0.0]
  - - [2944, 32, 1, 32]
    - [35, 0.134]
  - - [448, 1856, 1, 1]
    - [59, 0.05]
  - - [4288, 704, 1, 256]
    - [26, 6.533]
  - - [1856, 1024, 1, 256]
    - [26, 5.913]
  - - [448, 1856, 1, 32]
    - [37, 1.078]
  - - [448, 1856, 1, 3328]
    - [21, 5.177]
  - - [448, 448, 1, 32]
    - [43, 0.247]
  - - [1024, 448, 1, 256]
    - [26, 4.041]
  - - [6784, 1, 1, 256]
    - [63, 0.028]
  - - [704, 6784, 1, 32]
    - [33, 2.135]
  - - [1024, 4288, 1, 1]
    - [48, 0.133]
  - - [704, 256, 1, 3328]
    - [20, 3.177]
  - - [704, 1856, 1, 32]
    - [41, 1.408]
  - - [1408, 5888, 1, 1280]
    - [26, 7.504]
  - - [32, 704, 1, 1280]
    - [46, 0.178]
  - - [5056, 1856, 1, 256]
    - [26, 7.092]
  - - [6784, 704, 1, 1280]
    - [26, 7.033]
  - - [704, 1408, 1, 32]
    - [41, 1.187]
  - - [5888, 1024, 1, 256]
    - [26, 6.978]
  - - [64, 2944, 1, 1]
    - [53, 0.011]
  - - [64, 2944, 1, 32]
    - [37, 0.259]
  - - [64, 2944, 1, 1280]
    - [15, 3.472]
  - - [6784, 1856, 1, 3328]
    - [26, 7.413]
  - - [2368, 5888, 1, 1280]
    - [26, 7.568]
  - - [5888, 6784, 1, 32]
    - [33, 2.836]
  - - [1, 6784, 1, 256]
    - [63, 0.028]
  - - [6784, 6784, 1, 32]
    - [33, 2.843]
  - - [256, 1, 1, 1280]
    - [64, 0.002]
  - - [5888, 128, 1, 32]
    - [37, 0.952]
  - - [6784, 256, 1, 256]
    - [26, 5.944]
  - - [2368, 3584, 1, 3328]
    - [26, 7.507]
  - - [128, 4288, 1, 1280]
    - [26, 4.239]
  - - [32, 3584, 1, 1280]
    - [46, 0.946]
  - - [5888, 1024, 1, 1280]
    - [26, 7.366]
  - - [1856, 704, 1, 3328]
    - [26, 6.709]
  - - [5888, 6784, 1, 3328]
    - [26, 7.604]
  - - [6784, 448, 1, 1]
    - [48, 0.112]
  - - [6784, 1856, 1, 1]
    - [49, 0.173]
  - - [128, 32, 1, 1280]
    - [46, 0.032]
  - - [2944, 2368, 1, 1280]
    - [26, 7.437]
  - - [128, 256, 1, 1]
    - [49, 0.002]
  - - [6784, 448, 1, 32]
    - [37, 1.88]
  - - [6784, 448, 1, 3328]
    - [26, 6.963]
  - - [1, 6784, 1, 1]
    - [53, 0.001]
  - - [448, 3584, 1, 1280]
    - [26, 6.069]
  - - [1408, 6784, 1, 1280]
    - [26, 7.509]
  - - [5056, 5888, 1, 1280]
    - [26, 7.554]
  - - [32, 2944, 1, 32]
    - [35, 0.139]
  - - [5888, 704, 1, 1]
    - [53, 0.128]
  - - [3584, 1856, 1, 1]
    - [53, 0.15]
  - - [1, 256, 1, 256]
    - [64, 0.001]
  - - [5056, 2944, 1, 32]
    - [33, 2.725]
  - - [32, 6784, 1, 256]
    - [46, 0.935]
  - - [4288, 6784, 1, 1]
    - [48, 0.189]
  - - [1, 4288, 1, 3328]
    - [63, 0.022]
  - - [1024, 6784, 1, 1]
    - [54, 0.14]
  - - [2368, 5888, 1, 32]
    - [33, 2.703]
  - - [448, 448, 1, 3328]
    - [20, 3.524]
  - - [1, 256, 1, 1]
    - [50, 0.0]
  - - [3584, 4288, 1, 1]
    - [54, 0.18]
  - - [5888, 1024, 1, 3328]
    - [26, 7.088]
  - - [6784, 5888, 1, 256]
    - [26, 7.297]
  - - [704, 128, 1, 1280]
    - [18, 2.42]
  - - [4288, 128, 1, 256]
    - [26, 3.768]
  - - [5056, 1024, 1, 1]
    - [48, 0.14]
  - - [32, 3584, 1, 3328]
    - [46, 0.995]
  - - [1024, 1, 1, 1280]
    - [64, 0.007]
  - - [4288, 2368, 1, 32]
    - [33, 2.566]
  - - [704, 3584, 1, 1]
    - [50, 0.103]
  - - [704, 1856, 1, 3328]
    - [26, 6.712]
  - - [2944, 128, 1, 1280]
    - [6, 4.111]
  - - [1, 2368, 1, 3328]
    - [64, 0.018]
  - - [6784, 704, 1, 32]
    - [33, 2.132]
  - - [4288, 1, 1, 1280]
    - [63, 0.021]
  - - [704, 5888, 1, 256]
    - [26, 6.835]
  - - [2368, 3584, 1, 1280]
    - [26, 7.46]
  - - [64, 448, 1, 256]
    - [3, 0.613]
  - - [1408, 448, 1, 1280]
    - [26, 4.828]
  - - [3584, 5056, 1, 32]
    - [33, 2.68]
  - - [1024, 32, 1, 1280]
    - [46, 0.259]
  - - [128, 2368, 1, 1]
    - [55, 0.021]
  - - [6784, 1856, 1, 1280]
    - [26, 7.376]
  - - [5056, 5056, 1, 3328]
    - [27, 7.252]
  - - [128, 704, 1, 1280]
    - [18, 2.409]
  - - [128, 2944, 1, 1280]
    - [6, 4.111]
  - - [2368, 5056, 1, 1]
    - [53, 0.173]
  - - [5888, 1408, 1, 256]
    - [29, 7.061]
  - - [2368, 1024, 1, 32]
    - [33, 1.767]
  - - [256, 256, 1, 3328]
    - [15, 2.051]
  - - [64, 4288, 1, 1]
    - [48, 0.019]
  - - [4288, 1024, 1, 256]
    - [26, 6.884]
  - - [3584, 32, 1, 32]
    - [42, 0.208]
  - - [3584, 64, 1, 1]
    - [59, 0.017]
  - - [704, 32, 1, 1280]
    - [46, 0.175]
  - - [32, 4288, 1, 32]
    - [46, 0.231]
  - - [64, 64, 1, 3328]
    - [15, 0.136]
  - - [64, 1408, 1, 1]
    - [55, 0.006]
  - - [4288, 5888, 1, 1280]
    - [26, 7.668]
  - - [1856, 2944, 1, 3328]
    - [26, 7.497]
  - - [256, 1024, 1, 256]
    - [12, 3.358]
  - - [5056, 5888, 1, 256]
    - [26, 7.278]
  - - [1408, 128, 1, 1280]
    - [18, 3.4]
  - - [5056, 256, 1, 3328]
    - [26, 6.547]
  - - [1024, 5888, 1, 1280]
    - [26, 7.517]
  - - [1024, 448, 1, 1]
    - [53, 0.032]
  - - [32, 32, 1, 32]
    - [37, 0.002]
  - - [5056, 1, 1, 1280]
    - [63, 0.025]
  - - [5888, 5056, 1, 1280]
    - [26, 7.553]
  - - [5888, 2944, 1, 1]
    - [47, 0.18]
  - - [64, 4288, 1, 1280]
    - [10, 3.354]
  - - [1408, 4288, 1, 3328]
    - [26, 7.287]
  - - [704, 2944, 1, 32]
    - [33, 1.763]
  - - [1, 5888, 1, 1280]
    - [63, 0.029]
  - - [2944, 4288, 1, 3328]
    - [26, 7.585]
  - - [256, 2944, 1, 256]
    - [26, 5.058]
  - - [704, 448, 1, 32]
    - [42, 0.534]
  - - [5056, 2944, 1, 256]
    - [26, 7.2]
  - - [704, 1024, 1, 256]
    - [26, 4.893]
  - - [2368, 1856, 1, 256]
    - [26, 6.9]
  - - [64, 3584, 1, 1]
    - [50, 0.012]
  - - [1024, 128, 1, 1280]
    - [18, 3.237]
  - - [2368, 4288, 1, 1280]
    - [26, 7.575]
  - - [3584, 448, 1, 256]
    - [26, 5.583]
  - - [256, 6784, 1, 256]
    - [26, 6.03]
  - - [1024, 32, 1, 32]
    - [35, 0.052]
  - - [1024, 1408, 1, 1]
    - [48, 0.076]
  - - [128, 64, 1, 32]
    - [35, 0.013]
  - - [64, 1, 1, 1280]
    - [64, 0.0]
  - - [2368, 32, 1, 32]
    - [35, 0.117]
  - - [256, 5888, 1, 1]
    - [53, 0.078]
  - - [2944, 2944, 1, 1]
    - [47, 0.164]
  - - [6784, 3584, 1, 256]
    - [26, 7.266]
  - - [1408, 1856, 1, 256]
    - [26, 6.604]
  - - [128, 1408, 1, 256]
    - [1, 2.359]
  - - [2944, 2944, 1, 32]
    - [33, 2.463]
  - - [2944, 2944, 1, 3328]
    - [26, 7.454]
  - - [1, 2944, 1, 256]
    - [63, 0.014]
  - - [448, 32, 1, 1280]
    - [46, 0.113]
  - - [3584, 1, 1, 256]
    - [59, 0.017]
  - - [704, 32, 1, 3328]
    - [46, 0.193]
  - - [256, 448, 1, 3328]
    - [18, 3.077]
  - - [128, 128, 1, 256]
    - [3, 0.36]
  - - [2368, 64, 1, 256]
    - [18, 2.111]
  - - [64, 448, 1, 1280]
    - [15, 0.899]
  - - [6784, 1408, 1, 32]
    - [33, 2.547]
  - - [1408, 448, 1, 3328]
    - [26, 4.947]
  - - [2368, 6784, 1, 3328]
    - [26, 7.649]
  - - [256, 2368, 1, 1]
    - [61, 0.039]
  - - [4288, 3584, 1, 32]
    - [33, 2.616]
  - - [5888, 64, 1, 3328]
    - [6, 4.225]
  - - [3584, 704, 1, 1280]
    - [26, 6.893]
  - - [448, 5056, 1, 3328]
    - [26, 6.906]
  - - [4288, 448, 1, 256]
    - [26, 5.885]
  - - [5056, 256, 1, 1280]
    - [26, 6.431]
  - - [704, 448, 1, 3328]
    - [20, 3.507]
  - - [2944, 5888, 1, 32]
    - [33, 2.731]
  - - [3584, 5056, 1, 256]
    - [26, 7.293]
  - - [6784, 1, 1, 3328]
    - [63, 0.034]
  - - [32, 2368, 1, 3328]
    - [46, 0.641]
  - - [4288, 256, 1, 1]
    - [49, 0.062]
  - - [64, 256, 1, 1]
    - [53, 0.001]
  - - [1856, 448, 1, 3328]
    - [26, 5.163]
  - - [3584, 2368, 1, 256]
    - [26, 7.094]
  - - [4288, 4288, 1, 256]
    - [26, 7.279]
  - - [4288, 256, 1, 1280]
    - [26, 5.562]
  - - [448, 5056, 1, 256]
    - [26, 6.216]
  - - [128, 1856, 1, 1]
    - [50, 0.017]
  - - [4288, 704, 1, 1280]
    - [26, 6.975]
  - - [128, 1856, 1, 32]
    - [46, 0.409]
  - - [2368, 704, 1, 1]
    - [53, 0.082]
  - - [3584, 32, 1, 256]
    - [46, 0.632]
  - - [448, 2368, 1, 1280]
    - [26, 5.362]
  - - [3584, 256, 1, 1]
    - [48, 0.055]
  - - [1408, 1856, 1, 1280]
    - [26, 7.135]
  - - [3584, 4288, 1, 3328]
    - [26, 7.682]
  - - [448, 4288, 1, 32]
    - [33, 1.667]
  - - [448, 4288, 1, 1280]
    - [26, 6.424]
  - - [64, 3584, 1, 256]
    - [12, 2.987]
  - - [1, 6784, 1, 1280]
    - [63, 0.033]
  - - [5056, 1024, 1, 256]
    - [26, 6.868]
  - - [2368, 448, 1, 32]
    - [37, 1.217]
  - - [4288, 3584, 1, 1280]
    - [26, 7.629]
  - - [32, 2944, 1, 1280]
    - [46, 0.718]
  - - [1408, 704, 1, 1]
    - [50, 0.056]
  - - [2368, 256, 1, 256]
    - [26, 4.185]
  - - [1, 5056, 1, 1]
    - [53, 0.0]
  - - [4288, 32, 1, 32]
    - [42, 0.258]
  - - [1856, 3584, 1, 32]
    - [33, 2.282]
  - - [5056, 3584, 1, 3328]
    - [24, 7.429]
  - - [4288, 5056, 1, 256]
    - [26, 7.381]
  - - [1856, 5888, 1, 256]
    - [26, 7.25]
  - - [256, 256, 1, 256]
    - [11, 1.331]
  - - [2368, 3584, 1, 1]
    - [48, 0.161]
  - - [4288, 2368, 1, 256]
    - [26, 7.21]
  - - [448, 1, 1, 3328]
    - [64, 0.003]
  - - [1856, 256, 1, 1280]
    - [20, 4.953]
  - - [256, 2944, 1, 1]
    - [49, 0.046]
  - - [1408, 2944, 1, 3328]
    - [26, 7.375]
  - - [32, 1856, 1, 32]
    - [35, 0.091]
  - - [5888, 3584, 1, 1]
    - [52, 0.185]
  - - [256, 1, 1, 1]
    - [55, 0.0]
  - - [6784, 5056, 1, 3328]
    - [26, 7.608]
  - - [6784, 5056, 1, 1]
    - [47, 0.193]
  - - [5888, 3584, 1, 32]
    - [33, 2.769]
  - - [5888, 3584, 1, 3328]
    - [26, 7.554]
  - - [32, 1024, 1, 1280]
    - [46, 0.254]
  - - [1, 256, 1, 3328]
    - [64, 0.002]
  - - [1024, 6784, 1, 256]
    - [26, 7.055]
  - - [6784, 5888, 1, 32]
    - [33, 2.825]
  - - [1408, 1, 1, 1280]
    - [64, 0.01]
  - - [2368, 6784, 1, 32]
    - [33, 2.701]
  - - [6784, 64, 1, 1]
    - [53, 0.032]
  - - [5056, 1408, 1, 1280]
    - [29, 7.211]
  - - [3584, 1408, 1, 3328]
    - [26, 7.252]
  - - [2944, 3584, 1, 1]
    - [47, 0.172]
  - - [2944, 1408, 1, 1280]
    - [26, 7.304]
  - - [1856, 64, 1, 1]
    - [48, 0.007]
  - - [3584, 1024, 1, 1]
    - [48, 0.123]
  - - [256, 32, 1, 256]
    - [46, 0.053]
  - - [2944, 1856, 1, 3328]
    - [26, 7.491]
  - - [128, 1024, 1, 3328]
    - [15, 3.486]
  - - [1408, 128, 1, 1]
    - [53, 0.01]
  - - [2944, 3584, 1, 32]
    - [33, 2.596]
  - - [5888, 256, 1, 32]
    - [40, 1.456]
  - - [6784, 64, 1, 256]
    - [26, 3.852]
  - - [256, 128, 1, 1280]
    - [15, 1.03]
  - - [6784, 5056, 1, 256]
    - [26, 7.304]
  - - [1408, 32, 1, 3328]
    - [46, 0.38]
  - - [1856, 3584, 1, 1280]
    - [26, 7.368]
  - - [256, 5888, 1, 256]
    - [26, 5.91]
  - - [5056, 32, 1, 256]
    - [46, 0.733]
  - - [1024, 4288, 1, 3328]
    - [26, 7.379]
  - - [448, 2368, 1, 256]
    - [26, 4.906]
  - - [64, 1408, 1, 1280]
    - [15, 2.42]
  - - [3584, 32, 1, 1280]
    - [46, 0.92]
  - - [128, 2368, 1, 3328]
    - [6, 3.414]
  - - [64, 5056, 1, 256]
    - [6, 3.028]
  - - [256, 64, 1, 256]
    - [3, 0.35]
  - - [32, 1408, 1, 256]
    - [42, 0.239]
  - - [2368, 448, 1, 3328]
    - [26, 5.473]
  - - [2368, 1408, 1, 1]
    - [48, 0.118]
  - - [1, 1, 1, 1]
    - [53, 0.0]
  - - [1024, 1856, 1, 32]
    - [33, 1.612]
  - - [32, 1024, 1, 32]
    - [34, 0.049]
  - - [4288, 1, 1, 256]
    - [63, 0.018]
  - - [1856, 128, 1, 3328]
    - [20, 4.173]
  - - [5888, 2368, 1, 1]
    - [53, 0.177]
  - - [2368, 2368, 1, 1]
    - [48, 0.144]
  - - [704, 256, 1, 1280]
    - [20, 2.994]
  - - [704, 4288, 1, 256]
    - [26, 6.486]
  - - [5888, 2368, 1, 32]
    - [33, 2.592]
  - - [5888, 2368, 1, 1280]
    - [25, 7.196]
  - - [128, 256, 1, 256]
    - [3, 0.701]
  - - [2944, 5056, 1, 3328]
    - [26, 7.699]
  - - [6784, 704, 1, 3328]
    - [26, 7.083]
  - - [1856, 1856, 1, 32]
    - [33, 2.023]
  - - [4288, 2944, 1, 32]
    - [33, 2.566]
  - - [256, 5056, 1, 1]
    - [49, 0.069]
  - - [704, 64, 1, 256]
    - [3, 0.947]
  - - [256, 2368, 1, 3328]
    - [26, 4.764]
  - - [704, 1, 1, 1]
    - [48, 0.0]
  - - [128, 448, 1, 1280]
    - [15, 1.73]
  - - [5056, 5056, 1, 256]
    - [26, 7.257]
  - - [5888, 256, 1, 256]
    - [26, 5.862]
  - - [5888, 64, 1, 1]
    - [50, 0.028]
  - - [6784, 6784, 1, 256]
    - [29, 7.385]
  - - [256, 3584, 1, 1]
    - [48, 0.054]
  - - [2368, 1, 1, 256]
    - [63, 0.011]
  - - [448, 32, 1, 32]
    - [35, 0.023]
  - - [704, 64, 1, 1]
    - [61, 0.003]
  - - [3584, 704, 1, 3328]
    - [26, 6.974]
  - - [4288, 704, 1, 3328]
    - [26, 7.041]
  - - [4288, 2944, 1, 1280]
    - [26, 7.527]
  - - [448, 3584, 1, 256]
    - [26, 5.583]
  - - [704, 32, 1, 256]
    - [42, 0.119]
  - - [6784, 256, 1, 32]
    - [41, 1.59]
  - - [1856, 128, 1, 1]
    - [50, 0.016]
  - - [1856, 32, 1, 32]
    - [35, 0.096]
  - - [6784, 1408, 1, 1280]
    - [26, 7.367]
  - - [2368, 5056, 1, 1280]
    - [26, 7.595]
  - - [704, 1856, 1, 1280]
    - [26, 6.563]
  - - [1408, 1408, 1, 1280]
    - [29, 6.701]
  - - [448, 1024, 1, 3328]
    - [26, 4.932]
  - - [32, 704, 1, 32]
    - [35, 0.035]
  - - [256, 704, 1, 1]
    - [53, 0.01]
  - - [5888, 1856, 1, 32]
    - [33, 2.575]
  - - [5888, 704, 1, 3328]
    - [26, 7.241]
  - - [5056, 1, 1, 256]
    - [63, 0.021]
  - - [448, 6784, 1, 256]
    - [26, 6.524]
  - - [1024, 128, 1, 1]
    - [55, 0.008]
  - - [128, 64, 1, 256]
    - [3, 0.157]
  - - [1856, 128, 1, 256]
    - [12, 3.11]
  - - [2944, 5888, 1, 256]
    - [26, 7.296]
  - - [1024, 256, 1, 1280]
    - [20, 4.325]
  - - [128, 5056, 1, 32]
    - [37, 0.919]
  - - [128, 5056, 1, 1280]
    - [26, 4.985]
  - - [448, 32, 1, 3328]
    - [46, 0.119]
  - - [1856, 1408, 1, 32]
    - [33, 1.877]
  - - [64, 704, 1, 32]
    - [35, 0.068]
  - - [64, 704, 1, 3328]
    - [15, 1.482]
  - - [64, 2368, 1, 32]
    - [35, 0.222]
  - - [5888, 64, 1, 32]
    - [44, 0.567]
  - - [2368, 256, 1, 1]
    - [63, 0.036]
  - - [5888, 64, 1, 1280]
    - [14, 4.081]
  - - [5056, 1, 1, 1]
    - [61, 0.0]
  - - [5888, 2944, 1, 1280]
    - [29, 7.343]
  - - [32, 2368, 1, 256]
    - [42, 0.396]
  - - [256, 1408, 1, 256]
    - [12, 3.283]
  - - [448, 5888, 1, 1]
    - [53, 0.107]
  - - [3584, 1408, 1, 1]
    - [47, 0.138]
  - - [32, 6784, 1, 1280]
    - [46, 1.169]
  - - [32, 6784, 1, 32]
    - [42, 0.361]
  - - [448, 5888, 1, 32]
    - [33, 1.816]
  - - [5056, 704, 1, 1280]
    - [26, 6.993]
  - - [1856, 6784, 1, 1]
    - [53, 0.173]
  - - [5056, 64, 1, 1]
    - [55, 0.023]
  - - [1, 5888, 1, 1]
    - [48, 0.0]
  - - [2368, 1024, 1, 256]
    - [26, 6.206]
  - - [1856, 6784, 1, 32]
    - [33, 2.626]
  - - [1856, 6784, 1, 1280]
    - [26, 7.529]
  - - [64, 3584, 1, 3328]
    - [17, 4.029]
  - - [5888, 5056, 1, 3328]
    - [24, 7.423]
  - - [1, 2944, 1, 3328]
    - [64, 0.022]
  - - [1408, 6784, 1, 32]
    - [33, 2.507]
  - - [32, 5888, 1, 1280]
    - [46, 1.014]
  - - [448, 256, 1, 1]
    - [48, 0.007]
  - - [3584, 5888, 1, 3328]
    - [26, 7.707]
  - - [4288, 1408, 1, 256]
    - [26, 6.881]
  - - [448, 64, 1, 1280]
    - [15, 0.904]
  - - [128, 448, 1, 32]
    - [45, 0.08]
  - - [6784, 2368, 1, 256]
    - [26, 7.164]
  - - [1408, 448, 1, 32]
    - [37, 0.908]
  - - [1856, 1408, 1, 1280]
    - [26, 7.142]
  - - [448, 256, 1, 3328]
    - [18, 3.066]
  - - [1856, 2368, 1, 1]
    - [48, 0.133]
  - - [1408, 5056, 1, 3328]
    - [26, 7.4]
  - - [128, 704, 1, 3328]
    - [15, 2.603]
  - - [5056, 128, 1, 1280]
    - [6, 4.989]
  - - [5056, 4288, 1, 256]
    - [26, 7.245]
  - - [5056, 5056, 1, 32]
    - [33, 2.788]
  - - [1856, 704, 1, 256]
    - [26, 5.895]
  - - [64, 256, 1, 256]
    - [3, 0.363]
  - - [448, 5888, 1, 1280]
    - [26, 6.612]
  - - [128, 6784, 1, 256]
    - [6, 4.782]
  - - [5056, 448, 1, 256]
    - [26, 6.181]
  - - [4288, 5888, 1, 1]
    - [48, 0.187]
  - - [1856, 5056, 1, 1280]
    - [26, 7.573]
  - - [2368, 4288, 1, 1]
    - [53, 0.167]
  - - [2368, 32, 1, 3328]
    - [46, 0.637]
  - - [3584, 1856, 1, 256]
    - [26, 7.002]
  - - [256, 3584, 1, 256]
    - [26, 5.018]
  - - [64, 704, 1, 1]
    - [53, 0.003]
  - - [4288, 5888, 1, 32]
    - [33, 2.749]
  - - [4288, 5888, 1, 3328]
    - [26, 7.706]
  - - [1, 1024, 1, 1]
    - [53, 0.0]
  - - [1024, 2944, 1, 3328]
    - [26, 7.045]
  - - [2944, 2368, 1, 256]
    - [26, 7.077]
  - - [1024, 1856, 1, 256]
    - [26, 5.906]
  - - [2944, 64, 1, 3328]
    - [19, 3.468]
  - - [1024, 5888, 1, 32]
    - [41, 2.226]
  - - [1024, 5888, 1, 3328]
    - [26, 7.581]
  - - [5056, 2368, 1, 32]
    - [33, 2.5]
  - - [1408, 2368, 1, 1280]
    - [26, 7.151]
  - - [256, 1, 1, 3328]
    - [64, 0.002]
  - - [128, 1024, 1, 32]
    - [35, 0.194]
  - - [5056, 6784, 1, 3328]
    - [26, 7.62]
  - - [448, 704, 1, 1]
    - [63, 0.021]
  - - [32, 64, 1, 32]
    - [35, 0.003]
  - - [448, 704, 1, 32]
    - [42, 0.508]
  - - [448, 704, 1, 3328]
    - [20, 3.513]
  - - [1408, 2944, 1, 256]
    - [29, 6.896]
  - - [64, 5888, 1, 1]
    - [58, 0.026]
  - - [2368, 128, 1, 32]
    - [42, 0.513]
  - - [2368, 256, 1, 1280]
    - [26, 4.682]
  - - [2368, 128, 1, 3328]
    - [14, 3.412]
  - - [704, 5056, 1, 32]
    - [33, 2.086]
  - - [32, 2368, 1, 32]
    - [35, 0.114]
  - - [1408, 1, 1, 256]
    - [63, 0.007]
  - - [4288, 256, 1, 32]
    - [41, 1.294]
  - - [448, 1408, 1, 1]
    - [59, 0.04]
  - - [5056, 4288, 1, 1280]
    - [26, 7.535]
  - - [1408, 256, 1, 256]
    - [26, 3.296]
  - - [4288, 448, 1, 1]
    - [48, 0.065]
  - - [256, 4288, 1, 32]
    - [37, 1.274]
  - - [1408, 256, 1, 1280]
    - [20, 3.821]
  - - [256, 256, 1, 1]
    - [48, 0.004]
  - - [1408, 1, 1, 1]
    - [55, 0.0]
  - - [448, 1408, 1, 256]
    - [26, 4.305]
  - - [5888, 5888, 1, 1]
    - [52, 0.196]
  - - [128, 2944, 1, 32]
    - [42, 0.613]
  - - [32, 256, 1, 32]
    - [42, 0.018]
  - - [2944, 704, 1, 1280]
    - [26, 6.935]
  - - [1024, 3584, 1, 1280]
    - [26, 7.337]
  - - [1856, 448, 1, 1]
    - [48, 0.05]
  - - [2368, 2944, 1, 1]
    - [53, 0.153]
  - - [5056, 256, 1, 32]
    - [41, 1.425]
  - - [4288, 1, 1, 3328]
    - [63, 0.022]
  - - [5056, 1024, 1, 1280]
    - [29, 7.244]
  - - [704, 704, 1, 1]
    - [53, 0.033]
  - - [1856, 448, 1, 1280]
    - [26, 5.077]
  - - [3584, 6784, 1, 256]
    - [26, 7.395]
  - - [64, 1856, 1, 1280]
    - [18, 2.983]
  - - [1856, 1408, 1, 256]
    - [26, 6.611]
  - - [4288, 4288, 1, 32]
    - [33, 2.716]
  - - [128, 1, 1, 256]
    - [63, 0.001]
  - - [32, 64, 1, 3328]
    - [46, 0.017]
  - - [5888, 448, 1, 1]
    - [48, 0.104]
  - - [128, 5888, 1, 256]
    - [26, 4.974]
  - - [3584, 256, 1, 3328]
    - [21, 5.703]
  - - [5056, 5056, 1, 1280]
    - [26, 7.537]
  - - [6784, 1408, 1, 3328]
    - [26, 7.409]
  - - [448, 2368, 1, 1]
    - [61, 0.06]
  - - [2368, 1, 1, 1280]
    - [64, 0.016]
  - - [32, 3584, 1, 32]
    - [42, 0.204]
  - - [128, 6784, 1, 1]
    - [53, 0.055]
  - - [1, 3584, 1, 1]
    - [48, 0.0]
  - - [5888, 5888, 1, 3328]
    - [24, 7.505]
  - - [256, 2944, 1, 3328]
    - [26, 5.912]
  - - [1, 128, 1, 3328]
    - [64, 0.001]
  - - [32, 256, 1, 256]
    - [46, 0.053]
  - - [5888, 1408, 1, 32]
    - [33, 2.539]
  - - [704, 256, 1, 1]
    - [53, 0.011]
  - - [1, 448, 1, 1]
    - [54, 0.0]
  - - [256, 6784, 1, 3328]
    - [26, 6.655]
  - - [64, 5888, 1, 256]
    - [6, 3.472]
  - - [1856, 1, 1, 1]
    - [48, 0.0]
  - - [1024, 256, 1, 3328]
    - [20, 4.592]
  - - [704, 704, 1, 256]
    - [26, 4.302]
  - - [448, 1024, 1, 32]
    - [37, 0.673]
  - - [6784, 2368, 1, 1280]
    - [26, 7.451]
  - - [128, 1856, 1, 1280]
    - [17, 3.947]
  - - [256, 2368, 1, 256]
    - [26, 4.161]
  - - [2944, 1408, 1, 1]
    - [48, 0.13]
  - - [6784, 1024, 1, 256]
    - [26, 6.94]
  - - [5056, 1408, 1, 32]
    - [33, 2.379]
  - - [1408, 6784, 1, 3328]
    - [26, 7.561]
  - - [2944, 1408, 1, 3328]
    - [26, 7.374]
  - - [1856, 32, 1, 256]
    - [42, 0.318]
  - - [704, 2368, 1, 32]
    - [37, 1.522]
  - - [448, 256, 1, 32]
    - [36, 0.165]
  - - [704, 6784, 1, 1]
    - [53, 0.137]
  - - [2368, 6784, 1, 256]
    - [26, 7.271]
  - - [1856, 3584, 1, 3328]
    - [26, 7.423]
  - - [1, 704, 1, 3328]
    - [64, 0.005]
  - - [64, 1, 1, 3328]
    - [64, 0.0]
  - - [448, 704, 1, 1280]
    - [12, 3.401]
  - - [704, 1856, 1, 1]
    - [55, 0.07]
  - - [704, 448, 1, 256]
    - [26, 2.895]
  - - [448, 64, 1, 3328]
    - [15, 0.969]
  - - [704, 6784, 1, 256]
    - [26, 6.766]
  - - [256, 32, 1, 1280]
    - [46, 0.065]
  - - [2368, 448, 1, 1280]
    - [26, 5.387]
  - - [6784, 2944, 1, 32]
    - [33, 2.759]
  - - [64, 4288, 1, 32]
    - [35, 0.464]
  - - [128, 704, 1, 1]
    - [55, 0.006]
  - - [128, 448, 1, 3328]
    - [18, 1.862]
  - - [5888, 2368, 1, 3328]
    - [26, 7.457]
  - - [2368, 704, 1, 1280]
    - [26, 6.313]
  - - [1024, 1408, 1, 1280]
    - [26, 6.233]
  - - [4288, 64, 1, 1280]
    - [18, 3.236]
  - - [128, 5056, 1, 1]
    - [59, 0.043]
  - - [2944, 5056, 1, 32]
    - [33, 2.672]
  - - [448, 448, 1, 1]
    - [63, 0.011]
  - - [256, 2368, 1, 1280]
    - [26, 4.673]
  - - [704, 2368, 1, 3328]
    - [26, 6.389]
  - - [3584, 2944, 1, 256]
    - [26, 7.157]
  - - [64, 6784, 1, 256]
    - [12, 3.896]
  - - [3584, 1024, 1, 1280]
    - [26, 7.322]
  - - [64, 1024, 1, 256]
    - [3, 1.298]
  - - [1408, 32, 1, 32]
    - [35, 0.071]
  - - [128, 3584, 1, 256]
    - [12, 4.056]
  - - [704, 1408, 1, 1]
    - [50, 0.057]
  - - [5056, 3584, 1, 256]
    - [26, 7.178]
  - - [2368, 704, 1, 256]
    - [26, 5.805]
  - - [1856, 1856, 1, 1280]
    - [26, 6.903]
  - - [32, 5888, 1, 32]
    - [35, 0.33]
  - - [64, 32, 1, 32]
    - [35, 0.003]
  - - [4288, 704, 1, 1]
    - [51, 0.088]
  - - [1856, 1024, 1, 1]
    - [53, 0.088]
  - - [4288, 2944, 1, 3328]
    - [26, 7.575]
  - - [1024, 128, 1, 3328]
    - [15, 3.495]
  - - [4288, 128, 1, 3328]
    - [20, 4.331]
  - - [4288, 704, 1, 32]
    - [41, 1.911]
  - - [1856, 1024, 1, 32]
    - [39, 1.577]
  - - [1, 448, 1, 3328]
    - [64, 0.003]
  - - [2944, 6784, 1, 1]
    - [52, 0.189]
  - - [6784, 2368, 1, 32]
    - [33, 2.667]
  - - [5888, 5056, 1, 1]
    - [47, 0.191]
  - - [128, 6784, 1, 1280]
    - [14, 5.351]
  - - [704, 5888, 1, 1]
    - [48, 0.131]
  - - [6784, 6784, 1, 1]
    - [52, 0.189]
  - - [1856, 32, 1, 1280]
    - [46, 0.472]
  - - [5888, 448, 1, 3328]
    - [26, 6.579]
  - - [704, 5888, 1, 32]
    - [33, 2.174]
  - - [704, 5888, 1, 1280]
    - [26, 7.302]
  - - [1024, 6784, 1, 3328]
    - [26, 7.482]
  - - [704, 2944, 1, 1280]
    - [26, 6.927]
  - - [4288, 6784, 1, 256]
    - [26, 7.421]
  - - [3584, 256, 1, 32]
    - [37, 1.15]
  - - [1408, 1408, 1, 32]
    - [33, 1.682]
  - - [1408, 1408, 1, 3328]
    - [29, 6.772]
  - - [1024, 64, 1, 256]
    - [3, 1.308]
  - - [4288, 64, 1, 32]
    - [42, 0.462]
  - - [1408, 256, 1, 32]
    - [42, 0.6]
  - - [5888, 128, 1, 256]
    - [26, 5.058]
  - - [64, 704, 1, 1280]
    - [15, 1.377]
  - - [2944, 1856, 1, 256]
    - [26, 7.027]
  - - [128, 5056, 1, 3328]
    - [6, 5.09]
  - - [4288, 2944, 1, 1]
    - [53, 0.173]
  - - [6784, 5056, 1, 32]
    - [33, 2.805]
  - - [1024, 448, 1, 3328]
    - [20, 4.977]
  - - [3584, 128, 1, 1]
    - [55, 0.033]
  - - [2944, 4288, 1, 1280]
    - [26, 7.536]
  - - [64, 32, 1, 3328]
    - [46, 0.017]
  - - [1024, 4288, 1, 256]
    - [26, 6.884]
  - - [128, 2368, 1, 256]
    - [0, 2.882]
  - - [2368, 64, 1, 32]
    - [35, 0.224]
  - - [1408, 1, 1, 3328]
    - [64, 0.01]
  - - [64, 1408, 1, 32]
    - [37, 0.135]
  - - [2368, 5888, 1, 1]
    - [53, 0.176]
  - - [1408, 1856, 1, 32]
    - [41, 1.783]
  - - [448, 1856, 1, 256]
    - [26, 4.569]
  - - [1856, 6784, 1, 3328]
    - [26, 7.567]
  - - [3584, 128, 1, 256]
    - [12, 4.056]
  - - [1024, 448, 1, 1280]
    - [26, 4.795]
  - - [1024, 2368, 1, 32]
    - [33, 1.78]
  - - [32, 2944, 1, 256]
    - [42, 0.449]
  - - [128, 5888, 1, 1]
    - [52, 0.047]
  - - [64, 5056, 1, 1]
    - [55, 0.022]
  - - [1856, 256, 1, 32]
    - [35, 0.711]
  - - [2368, 2368, 1, 3328]
    - [26, 7.358]
  - - [64, 448, 1, 1]
    - [62, 0.002]
  - - [3584, 5888, 1, 32]
    - [33, 2.71]
  - - [3584, 5888, 1, 1280]
    - [26, 7.665]
  - - [64, 5056, 1, 32]
    - [42, 0.554]
  - - [2944, 64, 1, 1]
    - [55, 0.011]
  - - [6784, 704, 1, 256]
    - [26, 6.668]
  - - [3584, 1024, 1, 32]
    - [33, 2.109]
  - - [1408, 704, 1, 32]
    - [37, 1.197]
  - - [1408, 704, 1, 1280]
    - [26, 6.021]
  - - [2368, 5888, 1, 256]
    - [26, 7.247]
  - - [2944, 64, 1, 32]
    - [35, 0.26]
  - - [1, 1408, 1, 256]
    - [63, 0.007]
  - - [64, 2944, 1, 256]
    - [1, 2.536]
  - - [5888, 5888, 1, 32]
    - [33, 2.809]
  - - [1856, 1408, 1, 3328]
    - [26, 7.231]
  - - [1024, 1024, 1, 32]
    - [37, 1.251]
  - - [4288, 1024, 1, 1]
    - [48, 0.131]
  - - [704, 4288, 1, 3328]
    - [26, 7.053]
  - - [2944, 5056, 1, 1280]
    - [26, 7.654]
  - - [6784, 2944, 1, 1280]
    - [26, 7.483]
  - - [6784, 256, 1, 3328]
    - [26, 6.552]
  - - [5056, 128, 1, 3328]
    - [6, 5.091]
  - - [128, 128, 1, 1280]
    - [15, 0.514]
  - - [128, 4288, 1, 1]
    - [61, 0.036]
  - - [1408, 5056, 1, 32]
    - [33, 2.302]
  - - [2944, 128, 1, 3328]
    - [6, 4.234]
  - - [5888, 1856, 1, 1280]
    - [26, 7.435]
  - - [64, 128, 1, 256]
    - [3, 0.166]
  - - [5888, 256, 1, 1280]
    - [26, 6.421]
  - - [1856, 5056, 1, 1]
    - [53, 0.152]
  - - [3584, 1856, 1, 1280]
    - [26, 7.366]
  - - [6784, 448, 1, 256]
    - [26, 6.398]
  - - [704, 3584, 1, 256]
    - [26, 6.363]
  - - [1856, 5056, 1, 32]
    - [33, 2.514]
  - - [1856, 5056, 1, 3328]
    - [26, 7.628]
  - - [1024, 2944, 1, 32]
    - [33, 1.925]
  - - [1408, 6784, 1, 256]
    - [26, 7.169]
  - - [1024, 2368, 1, 1280]
    - [26, 6.642]
  - - [1856, 3584, 1, 1]
    - [53, 0.151]
  - - [5888, 128, 1, 1280]
    - [26, 5.743]
  - - [2944, 5888, 1, 1280]
    - [26, 7.607]
  - - [1, 1856, 1, 1]
    - [58, 0.0]
  - - [3584, 3584, 1, 256]
    - [26, 7.299]
  - - [1856, 2368, 1, 3328]
    - [26, 7.384]
  - - [5888, 704, 1, 256]
    - [26, 6.769]
  - - [64, 448, 1, 32]
    - [35, 0.044]
  - - [6784, 4288, 1, 256]
    - [26, 7.297]
  - - [128, 64, 1, 3328]
    - [15, 0.271]
  - - [1, 5056, 1, 1280]
    - [63, 0.025]
  - - [32, 64, 1, 1280]
    - [46, 0.016]
  - - [1408, 2368, 1, 3328]
    - [26, 7.222]
  - - [1024, 3584, 1, 256]
    - [26, 6.858]
  - - [2944, 128, 1, 256]
    - [14, 3.407]
  - - [6784, 128, 1, 1]
    - [50, 0.053]
  - - [1408, 256, 1, 3328]
    - [20, 3.928]
  - - [448, 32, 1, 256]
    - [42, 0.075]
  - - [1024, 32, 1, 256]
    - [42, 0.174]
  - - [1, 5888, 1, 256]
    - [63, 0.024]
  - - [64, 2368, 1, 256]
    - [1, 2.255]
  - - [2944, 256, 1, 256]
    - [26, 5.086]
  - - [1, 128, 1, 256]
    - [63, 0.001]
  - - [32, 256, 1, 1280]
    - [46, 0.069]
  - - [5888, 1, 1, 256]
    - [63, 0.024]
  - - [32, 128, 1, 3328]
    - [46, 0.035]
  - - [6784, 128, 1, 256]
    - [26, 4.696]
  - - [6784, 64, 1, 1280]
    - [20, 4.57]
  - - [4288, 1024, 1, 32]
    - [33, 2.188]
  - - [1408, 64, 1, 3328]
    - [18, 2.591]
  - - [2944, 448, 1, 1280]
    - [26, 5.735]
  - - [6784, 32, 1, 1280]
    - [46, 1.154]
  - - [2944, 64, 1, 1280]
    - [18, 3.456]
  - - [704, 448, 1, 1]
    - [61, 0.022]
  - - [32, 128, 1, 32]
    - [35, 0.006]
  - - [1, 128, 1, 1]
    - [53, 0.0]
  - - [5888, 1, 1, 1]
    - [48, 0.0]
  - - [5888, 1856, 1, 3328]
    - [25, 7.356]
  - - [2368, 3584, 1, 256]
    - [26, 7.102]
  - - [4288, 1408, 1, 3328]
    - [26, 7.279]
  - - [1856, 32, 1, 3328]
    - [46, 0.5]
  - - [2944, 32, 1, 256]
    - [42, 0.478]
  - - [128, 64, 1, 1]
    - [64, 0.001]
  - - [256, 1024, 1, 3328]
    - [20, 4.602]
  - - [32, 448, 1, 256]
    - [42, 0.075]
  - - [1856, 64, 1, 3328]
    - [18, 3.192]
  - - [256, 5056, 1, 256]
    - [26, 5.884]
  - - [5888, 2944, 1, 3328]
    - [26, 7.493]
  - - [2368, 1408, 1, 3328]
    - [26, 7.221]
  - - [5888, 704, 1, 32]
    - [41, 2.076]
  - - [2944, 704, 1, 1]
    - [53, 0.092]
  - - [6784, 1856, 1, 256]
    - [26, 7.078]
  - - [1, 704, 1, 256]
    - [63, 0.003]
  - - [1856, 1856, 1, 1]
    - [48, 0.121]
  - - [5888, 32, 1, 256]
    - [46, 0.837]
  - - [128, 704, 1, 256]
    - [15, 1.599]
  - - [256, 1408, 1, 3328]
    - [20, 3.925]
  - - [2944, 128, 1, 1]
    - [63, 0.023]
  - - [32, 256, 1, 3328]
    - [46, 0.071]
  - - [2944, 704, 1, 3328]
    - [26, 7.031]
  - - [704, 1024, 1, 32]
    - [42, 0.977]
  - - [2368, 1856, 1, 32]
    - [33, 2.151]
  - - [5056, 4288, 1, 3328]
    - [24, 7.435]
  - - [3584, 448, 1, 3328]
    - [26, 6.157]
  - - [256, 32, 1, 32]
    - [42, 0.018]
  - - [64, 256, 1, 3328]
    - [15, 0.553]
  - - [256, 6784, 1, 1]
    - [48, 0.086]
  - - [1024, 3584, 1, 32]
    - [33, 2.093]
  - - [256, 6784, 1, 32]
    - [41, 1.581]
  - - [2944, 1408, 1, 32]
    - [33, 2.17]
  - - [4288, 3584, 1, 1]
    - [53, 0.18]
  - - [1, 704, 1, 1]
    - [55, 0.0]
  - - [5056, 448, 1, 3328]
    - [26, 6.785]
  - - [3584, 64, 1, 256]
    - [12, 2.987]
  - - [64, 1856, 1, 32]
    - [35, 0.181]
  - - [64, 1856, 1, 3328]
    - [18, 3.184]
  - - [6784, 3584, 1, 32]
    - [33, 2.812]
  - - [4288, 1856, 1, 256]
    - [26, 7.067]
  - - [1856, 2944, 1, 256]
    - [26, 7.027]
  - - [128, 448, 1, 1]
    - [55, 0.004]
  - - [64, 128, 1, 32]
    - [35, 0.012]
  - - [704, 1, 1, 1280]
    - [64, 0.005]
  - - [2944, 5888, 1, 1]
    - [52, 0.18]
  - - [1024, 1856, 1, 3328]
    - [29, 6.497]
  - - [5888, 1024, 1, 32]
    - [33, 2.37]
  - - [3584, 256, 1, 1280]
    - [26, 5.585]
  - - [1024, 1, 1, 1]
    - [58, 0.0]
  - - [1408, 5056, 1, 1280]
    - [26, 7.349]
  - - [3584, 128, 1, 1280]
    - [20, 4.804]
  - - [5056, 6784, 1, 256]
    - [26, 7.3]
  - - [256, 1856, 1, 256]
    - [26, 4.185]
  - - [5888, 32, 1, 1280]
    - [46, 1.014]
  - - [256, 128, 1, 32]
    - [37, 0.048]
  - - [32, 1856, 1, 1280]
    - [46, 0.46]
  - - [2944, 5056, 1, 1]
    - [47, 0.18]
  - - [448, 128, 1, 1]
    - [55, 0.004]
  - - [256, 704, 1, 32]
    - [38, 0.232]
  - - [256, 704, 1, 1280]
    - [20, 2.998]
  - - [1, 2368, 1, 1]
    - [59, 0.0]
  - - [5888, 5888, 1, 1280]
    - [26, 7.553]
  - - [256, 2944, 1, 1280]
    - [26, 5.772]
  - - [2944, 256, 1, 3328]
    - [26, 5.91]
  - - [5056, 2944, 1, 1280]
    - [26, 7.496]
  - - [704, 1024, 1, 3328]
    - [26, 5.655]
  - - [2368, 1856, 1, 1280]
    - [26, 7.316]
  - - [448, 2944, 1, 1]
    - [49, 0.072]
  - - [6784, 2944, 1, 1]
    - [47, 0.187]
  - - [2944, 1024, 1, 32]
    - [33, 1.993]
  - - [2944, 1024, 1, 1280]
    - [26, 6.965]
  - - [1408, 64, 1, 32]
    - [37, 0.137]
  - - [5056, 5056, 1, 1]
    - [48, 0.186]
  - - [2368, 4288, 1, 256]
    - [26, 7.229]
  - - [448, 1856, 1, 1280]
    - [26, 5.058]
  - - [2368, 448, 1, 1]
    - [57, 0.057]
  - - [448, 2944, 1, 32]
    - [41, 1.376]
  - - [448, 2944, 1, 1280]
    - [26, 5.722]
  - - [2944, 6784, 1, 1280]
    - [26, 7.63]
  - - [256, 6784, 1, 1280]
    - [26, 6.571]
  - - [128, 2368, 1, 1280]
    - [0, 3.508]
  - - [3584, 2368, 1, 32]
    - [33, 2.492]
  - - [704, 32, 1, 32]
    - [37, 0.035]
  - - [6784, 3584, 1, 3328]
    - [24, 7.469]
  - - [128, 32, 1, 256]
    - [42, 0.021]
  - - [128, 1408, 1, 1280]
    - [15, 3.389]
  - - [64, 32, 1, 1280]
    - [46, 0.016]
  - - [128, 1856, 1, 3328]
    - [17, 4.171]
  - - [2944, 2944, 1, 256]
    - [26, 7.08]
  - - [1408, 1024, 1, 3328]
    - [26, 6.329]
  - - [5056, 2368, 1, 1280]
    - [26, 7.449]
  - - [448, 128, 1, 32]
    - [35, 0.084]
  - - [2368, 64, 1, 3328]
    - [18, 3.198]
  - - [32, 5056, 1, 3328]
    - [46, 0.907]
  - - [448, 2944, 1, 3328]
    - [26, 5.808]
  - - [2944, 1024, 1, 1]
    - [48, 0.114]
  - - [2368, 128, 1, 1280]
    - [14, 3.328]
  - - [3584, 704, 1, 256]
    - [26, 6.424]
  - - [2368, 5888, 1, 3328]
    - [26, 7.608]
  - - [4288, 2368, 1, 1]
    - [48, 0.168]
  - - [1408, 3584, 1, 32]
    - [33, 2.279]
  - - [2944, 4288, 1, 32]
    - [37, 2.476]
  - - [5888, 1408, 1, 1280]
    - [29, 7.387]
  - - [3584, 5056, 1, 1280]
    - [26, 7.603]
  - - [5888, 6784, 1, 1280]
    - [25, 7.504]
  - - [64, 1856, 1, 1]
    - [55, 0.008]
  - - [704, 128, 1, 32]
    - [35, 0.138]
  - - [3584, 2944, 1, 1]
    - [49, 0.171]
  - - [128, 3584, 1, 3328]
    - [17, 5.038]
  - - [256, 4288, 1, 3328]
    - [26, 5.647]
  - - [4288, 64, 1, 1]
    - [48, 0.02]
  - - [1, 1408, 1, 1280]
    - [64, 0.01]
  - - [5056, 32, 1, 1280]
    - [46, 0.888]
  - - [1856, 704, 1, 32]
    - [41, 1.397]
  - - [1024, 1856, 1, 1]
    - [48, 0.09]
  - - [704, 5056, 1, 3328]
    - [26, 7.195]
  - - [1024, 3584, 1, 3328]
    - [26, 7.419]
  - - [5888, 256, 1, 3328]
    - [26, 6.511]
  - - [1856, 1408, 1, 1]
    - [53, 0.106]
  - - [2944, 448, 1, 32]
    - [41, 1.386]
  - - [128, 448, 1, 256]
    - [3, 1.205]
  - - [128, 1024, 1, 1]
    - [55, 0.008]
  - - [32, 32, 1, 256]
    - [42, 0.005]
  - - [4288, 5056, 1, 1280]
    - [26, 7.683]
  - - [1856, 1856, 1, 3328]
    - [26, 6.963]
  - - [1024, 2368, 1, 256]
    - [26, 6.226]
  - - [4288, 2368, 1, 3328]
    - [26, 7.622]
  - - [256, 64, 1, 32]
    - [42, 0.033]
  - - [1, 1024, 1, 1280]
    - [64, 0.007]
  - - [5056, 128, 1, 32]
    - [35, 0.945]
  - - [5888, 3584, 1, 256]
    - [26, 7.233]
  - - [1024, 5056, 1, 32]
    - [33, 2.202]
  - - [5888, 448, 1, 1280]
    - [26, 6.507]
  - - [704, 5888, 1, 3328]
    - [26, 7.378]
  - - [1024, 1408, 1, 256]
    - [26, 5.681]
  - - [3584, 2944, 1, 1280]
    - [26, 7.494]
  - - [1, 5056, 1, 256]
    - [63, 0.021]
  - - [256, 1024, 1, 1]
    - [53, 0.017]
  - - [32, 32, 1, 3328]
    - [46, 0.009]
  - - [2368, 1, 1, 3328]
    - [64, 0.018]
  - - [4288, 1856, 1, 1280]
    - [26, 7.421]
  - - [3584, 5888, 1, 1]
    - [47, 0.185]
  - - [5888, 4288, 1, 256]
    - [26, 7.244]
  - - [1024, 2944, 1, 1280]
    - [26, 6.973]
  - - [6784, 1, 1, 1]
    - [61, 0.001]
  - - [1408, 64, 1, 1280]
    - [18, 2.399]
  - - [1, 256, 1, 1280]
    - [64, 0.002]
  - - [2944, 3584, 1, 256]
    - [26, 7.177]
  - - [1, 128, 1, 1280]
    - [64, 0.001]
  - - [1024, 256, 1, 32]
    - [42, 0.454]
  - - [5888, 1, 1, 1280]
    - [63, 0.029]
  - - [2368, 32, 1, 1280]
    - [46, 0.598]
  - - [5888, 1856, 1, 1]
    - [47, 0.152]
  - - [6784, 128, 1, 1280]
    - [14, 5.34]
  - - [6784, 2368, 1, 3328]
    - [26, 7.495]
  - - [1, 64, 1, 256]
    - [63, 0.0]
  - - [704, 128, 1, 1]
    - [55, 0.006]
  - - [1408, 4288, 1, 32]
    - [33, 2.36]
  - - [256, 64, 1, 1280]
    - [15, 0.51]
  - - [256, 448, 1, 256]
    - [1, 2.006]
  - - [1856, 1024, 1, 1280]
    - [29, 6.397]
  - - [5888, 1856, 1, 256]
    - [26, 7.116]
  - - [5056, 1856, 1, 1]
    - [48, 0.165]
  - - [5888, 2368, 1, 256]
    - [26, 7.122]
  - - [1408, 1024, 1, 32]
    - [37, 1.459]
  - - [32, 704, 1, 256]
    - [46, 0.117]
  - - [2944, 1, 1, 256]
    - [63, 0.014]
  - - [32, 4288, 1, 256]
    - [42, 0.593]
  - - [5056, 1856, 1, 32]
    - [33, 2.437]
  - - [5056, 1856, 1, 1280]
    - [26, 7.422]
  - - [1, 64, 1, 1]
    - [48, 0.0]
  - - [1408, 5888, 1, 3328]
    - [26, 7.561]
  - - [1408, 704, 1, 3328]
    - [21, 6.148]
  - - [5056, 704, 1, 3328]
    - [26, 7.06]
  - - [704, 64, 1, 1280]
    - [18, 1.377]
  - - [1, 704, 1, 1280]
    - [64, 0.005]
  - - [5888, 6784, 1, 1]
    - [47, 0.198]
  - - [5888, 4288, 1, 32]
    - [33, 2.782]
  - - [1408, 3584, 1, 256]
    - [26, 6.842]
  - - [1856, 704, 1, 1]
    - [50, 0.069]
  - - [6784, 256, 1, 1]
    - [53, 0.086]
  - - [2944, 1, 1, 1]
    - [48, 0.0]
  - - [256, 1856, 1, 3328]
    - [20, 5.207]
  - - [4288, 128, 1, 1280]
    - [12, 4.244]
  - - [6784, 256, 1, 1280]
    - [26, 6.453]
  - - [128, 4288, 1, 256]
    - [14, 3.822]
  - - [128, 128, 1, 32]
    - [42, 0.032]
  - - [128, 1408, 1, 32]
    - [41, 0.249]
  - - [6784, 128, 1, 32]
    - [41, 1.136]
  - - [1408, 448, 1, 1]
    - [50, 0.04]
  - - [2368, 704, 1, 3328]
    - [26, 6.393]
  - - [704, 128, 1, 3328]
    - [18, 2.589]
  - - [2944, 1856, 1, 32]
    - [33, 2.229]
  - - [1024, 64, 1, 1]
    - [48, 0.004]
  - - [1408, 32, 1, 1280]
    - [46, 0.352]
  - - [704, 1, 1, 256]
    - [63, 0.003]
  - - [2368, 1408, 1, 256]
    - [26, 6.712]
  - - [2368, 1856, 1, 1]
    - [48, 0.132]
  - - [4288, 1408, 1, 1]
    - [61, 0.14]
  - - [3584, 2368, 1, 1280]
    - [26, 7.452]
  - - [64, 5056, 1, 1280]
    - [10, 3.685]
  - - [1408, 2944, 1, 1]
    - [47, 0.13]
  - - [4288, 1408, 1, 32]
    - [33, 2.373]
  - - [5888, 2944, 1, 256]
    - [26, 7.165]
  - - [128, 64, 1, 1280]
    - [3, 0.244]
  - - [1408, 2944, 1, 32]
    - [33, 2.166]
  - - [1, 3584, 1, 1280]
    - [64, 0.025]
  - - [64, 64, 1, 32]
    - [35, 0.006]
  - - [448, 1408, 1, 32]
    - [42, 0.9]
  - - [128, 5056, 1, 256]
    - [26, 4.43]
  - - [1, 1, 1, 1280]
    - [64, 0.0]
  - - [64, 704, 1, 256]
    - [3, 0.947]
  - - [5888, 6784, 1, 256]
    - [26, 7.294]
  - - [6784, 5888, 1, 1]
    - [47, 0.197]
  - - [64, 4288, 1, 256]
    - [1, 2.822]
  - - [1, 448, 1, 1280]
    - [64, 0.003]
  - - [1024, 1024, 1, 1]
    - [48, 0.059]
  - - [6784, 5888, 1, 1280]
    - [24, 7.47]
  - - [1024, 4288, 1, 32]
    - [41, 2.117]
  - - [1856, 1, 1, 1280]
    - [64, 0.013]
  - - [3584, 5888, 1, 256]
    - [26, 7.354]
  - - [5056, 2368, 1, 1]
    - [54, 0.16]
  - - [256, 1408, 1, 1280]
    - [20, 3.831]
  - - [64, 256, 1, 32]
    - [35, 0.025]
  - - [64, 5888, 1, 3328]
    - [6, 4.238]
  - - [6784, 64, 1, 3328]
    - [20, 4.75]
  - - [5056, 448, 1, 1]
    - [48, 0.098]
  - - [2944, 448, 1, 3328]
    - [26, 5.816]
  - - [2368, 1024, 1, 1280]
    - [26, 6.641]
  - - [1856, 6784, 1, 256]
    - [26, 7.217]
  - - [4288, 32, 1, 1280]
    - [46, 0.744]
  - - [448, 1408, 1, 1280]
    - [26, 4.856]
  - - [5056, 448, 1, 32]
    - [41, 1.726]
  - - [3584, 2944, 1, 32]
    - [33, 2.616]
  - - [2368, 128, 1, 1]
    - [55, 0.019]
  - - [32, 128, 1, 1280]
    - [46, 0.032]
  - - [3584, 1856, 1, 32]
    - [33, 2.346]
  - - [128, 128, 1, 3328]
    - [15, 0.549]
  - - [5056, 64, 1, 256]
    - [6, 3.005]
  - - [64, 448, 1, 3328]
    - [15, 0.97]
  - - [4288, 1408, 1, 1280]
    - [26, 7.221]
  - - [6784, 2368, 1, 1]
    - [57, 0.175]
  - - [32, 5056, 1, 256]
    - [46, 0.719]
  - - [704, 128, 1, 256]
    - [11, 1.599]
  - - [704, 5056, 1, 1]
    - [53, 0.122]
  - - [256, 1024, 1, 32]
    - [44, 0.411]
  - - [256, 1024, 1, 1280]
    - [20, 4.349]
  - - [2368, 128, 1, 256]
    - [14, 2.815]
  - - [32, 64, 1, 256]
    - [42, 0.011]
  - - [2368, 1408, 1, 1280]
    - [26, 7.14]
  - - [128, 256, 1, 32]
    - [35, 0.05]
  - - [64, 6784, 1, 32]
    - [42, 0.681]
  - - [6784, 32, 1, 256]
    - [46, 0.947]
  - - [256, 4288, 1, 1]
    - [49, 0.062]
  - - [5888, 1408, 1, 1]
    - [52, 0.142]
  - - [1024, 4288, 1, 1280]
    - [26, 7.314]
  - - [1856, 4288, 1, 1]
    - [48, 0.158]
  - - [128, 2944, 1, 256]
    - [14, 3.42]
  - - [3584, 4288, 1, 256]
    - [26, 7.289]
  - - [2368, 2944, 1, 256]
    - [26, 7.074]
  - - [3584, 128, 1, 32]
    - [37, 0.712]
  - - [3584, 128, 1, 3328]
    - [20, 5.013]
  - - [704, 5056, 1, 256]
    - [26, 6.657]
  - - [1856, 4288, 1, 32]
    - [33, 2.465]
  - - [64, 256, 1, 1280]
    - [15, 0.512]
  - - [4288, 1024, 1, 1280]
    - [26, 7.301]
  - - [1, 4288, 1, 256]
    - [63, 0.018]
  - - [64, 2368, 1, 1]
    - [55, 0.009]
  - - [4288, 6784, 1, 32]
    - [33, 2.766]
  - - [704, 704, 1, 3328]
    - [26, 5.323]
  - - [128, 2944, 1, 1]
    - [61, 0.027]
  - - [3584, 1408, 1, 256]
    - [29, 6.803]
  - - [704, 3584, 1, 3328]
    - [26, 6.983]
  - - [5056, 448, 1, 1280]
    - [26, 6.693]
  - - [1408, 2944, 1, 1280]
    - [26, 7.307]
  - - [5888, 704, 1, 1280]
    - [26, 7.165]
  - - [64, 64, 1, 256]
    - [3, 0.078]
  - - [704, 1408, 1, 1280]
    - [13, 6.04]
  - - [4288, 5888, 1, 256]
    - [26, 7.343]
  - - [6784, 64, 1, 32]
    - [38, 0.688]
  - - [3584, 3584, 1, 3328]
    - [26, 7.706]
  - - [2944, 6784, 1, 32]
    - [33, 2.736]
  - - [448, 64, 1, 32]
    - [35, 0.043]
  - - [5056, 256, 1, 1]
    - [49, 0.07]
  - - [64, 6784, 1, 1280]
    - [20, 4.574]
  - - [2944, 2368, 1, 3328]
    - [26, 7.498]
  - - [1, 4288, 1, 1]
    - [61, 0.0]
  - - [1408, 128, 1, 256]
    - [12, 2.347]
  - - [1024, 1856, 1, 1280]
    - [29, 6.4]
  - - [448, 5888, 1, 256]
    - [26, 6.165]
  - - [1024, 5888, 1, 256]
    - [26, 7.088]
  - - [704, 1408, 1, 256]
    - [26, 5.325]
  - - [6784, 2944, 1, 3328]
    - [26, 7.52]
  - - [1408, 2368, 1, 256]
    - [26, 6.668]
  - - [64, 128, 1, 1280]
    - [3, 0.245]
  - - [5888, 32, 1, 3328]
    - [46, 1.06]
  - - [1408, 5056, 1, 256]
    - [26, 7.013]
  - - [1024, 1408, 1, 32]
    - [41, 1.411]
  - - [4288, 128, 1, 32]
    - [35, 0.81]
  - - [6784, 704, 1, 1]
    - [48, 0.135]
  - - [448, 704, 1, 256]
    - [26, 2.895]
  - - [704, 3584, 1, 32]
    - [33, 1.834]
  - - [1856, 256, 1, 3328]
    - [20, 5.214]
  - - [448, 1024, 1, 1280]
    - [26, 4.787]
  - - [4288, 4288, 1, 1]
    - [48, 0.179]
  - - [5056, 2944, 1, 1]
    - [48, 0.179]
  - - [64, 2368, 1, 3328]
    - [15, 3.224]
  - - [256, 704, 1, 3328]
    - [20, 3.171]
  - - [1, 2944, 1, 1]
    - [53, 0.0]
  - - [1024, 1024, 1, 256]
    - [26, 5.658]
  - - [3584, 1, 1, 1]
    - [48, 0.0]
  - - [256, 2944, 1, 32]
    - [41, 0.994]
  - - [6784, 4288, 1, 3328]
    - [25, 7.541]
  - - [5056, 2944, 1, 3328]
    - [25, 7.335]
  - - [704, 1024, 1, 1280]
    - [26, 5.539]
  - - [256, 3584, 1, 1280]
    - [26, 5.573]
  - - [2368, 1856, 1, 3328]
    - [26, 7.378]
  - - [1856, 4288, 1, 1280]
    - [26, 7.438]
  - - [1, 1024, 1, 256]
    - [63, 0.005]
  - - [3584, 448, 1, 1]
    - [59, 0.078]
  - - [2944, 1024, 1, 3328]
    - [26, 7.041]
  - - [32, 1408, 1, 3328]
    - [46, 0.379]
  - - [128, 1, 1, 3328]
    - [64, 0.001]
  - - [5888, 5056, 1, 32]
    - [33, 2.774]
  - - [704, 2944, 1, 1]
    - [55, 0.093]
  - - [3584, 448, 1, 32]
    - [41, 1.507]
  - - [3584, 448, 1, 1280]
    - [26, 6.06]
  - - [2944, 6784, 1, 3328]
    - [26, 7.675]
  - - [1856, 2368, 1, 1280]
    - [26, 7.314]
  - - [6784, 1024, 1, 1280]
    - [26, 7.278]
  - - [6784, 3584, 1, 1280]
    - [26, 7.55]
  - - [1, 5056, 1, 3328]
    - [63, 0.026]
  - - [128, 128, 1, 1]
    - [63, 0.001]
  - - [128, 2368, 1, 32]
    - [42, 0.516]
  - - [128, 1408, 1, 3328]
    - [15, 3.513]
  - - [2944, 32, 1, 3328]
    - [46, 0.79]
  - - [704, 1856, 1, 256]
    - [26, 5.873]
  - - [1408, 1408, 1, 1]
    - [48, 0.09]
  - - [1408, 4288, 1, 256]
    - [26, 6.891]
  - - [256, 5056, 1, 3328]
    - [26, 6.645]
  - - [2368, 64, 1, 1280]
    - [18, 3.036]
  - - [1856, 448, 1, 32]
    - [41, 1.073]
  - - [1408, 448, 1, 256]
    - [26, 4.281]
  - - [32, 128, 1, 256]
    - [42, 0.02]
  - - [448, 1024, 1, 1]
    - [53, 0.029]
  - - [128, 1024, 1, 1280]
    - [15, 3.278]
  - - [448, 6784, 1, 1]
    - [48, 0.115]
  - - [704, 2944, 1, 256]
    - [26, 6.309]
  - - [1408, 1408, 1, 256]
    - [29, 6.217]
  - - [448, 6784, 1, 32]
    - [41, 1.854]
  - - [1, 64, 1, 1280]
    - [64, 0.0]
  - - [1408, 1856, 1, 1]
    - [53, 0.105]
  - - [4288, 448, 1, 32]
    - [41, 1.598]
  - - [4288, 448, 1, 1280]
    - [26, 6.41]
  - - [2944, 704, 1, 32]
    - [37, 1.677]
  - - [1024, 704, 1, 256]
    - [26, 4.771]
  - - [448, 4288, 1, 1]
    - [48, 0.09]
  - - [3584, 5056, 1, 1]
    - [48, 0.183]
  - - [1408, 3584, 1, 1280]
    - [26, 7.193]
  - - [6784, 448, 1, 1280]
    - [26, 6.889]
  - - [3584, 5056, 1, 3328]
    - [26, 7.655]
  - - [2368, 2368, 1, 32]
    - [33, 2.332]
  - - [64, 5888, 1, 32]
    - [42, 0.617]
  - - [1856, 448, 1, 256]
    - [26, 4.622]
  - - [128, 1024, 1, 256]
    - [15, 2.136]
  - - [3584, 64, 1, 3328]
    - [20, 4.02]
  - - [5888, 2944, 1, 32]
    - [33, 2.716]
  - - [2944, 1, 1, 1280]
    - [64, 0.02]
  - - [1856, 2944, 1, 32]
    - [33, 2.298]
  - - [5056, 1408, 1, 1]
    - [53, 0.153]
  - - [5888, 1408, 1, 3328]
    - [26, 7.408]
  - - [448, 4288, 1, 256]
    - [26, 5.923]
  - - [6784, 1024, 1, 1]
    - [54, 0.154]
  - - [256, 448, 1, 1]
    - [55, 0.007]
  - - [128, 5888, 1, 3328]
    - [26, 5.917]
  - - [6784, 1024, 1, 32]
    - [33, 2.43]
  - - [256, 448, 1, 32]
    - [37, 0.168]
  - - [6784, 3584, 1, 1]
    - [53, 0.189]
  - - [2944, 2368, 1, 32]
    - [33, 2.359]
  - - [3584, 6784, 1, 3328]
    - [26, 7.748]
  - - [448, 128, 1, 1280]
    - [18, 1.743]
  - - [64, 3584, 1, 32]
    - [35, 0.297]
  - - [64, 3584, 1, 1280]
    - [20, 3.827]
  - - [6784, 1408, 1, 256]
    - [26, 7.045]
  - - [5056, 1024, 1, 32]
    - [37, 2.218]
  - - [1024, 5056, 1, 1280]
    - [26, 7.386]
  - - [4288, 3584, 1, 256]
    - [26, 7.311]
  - - [2368, 256, 1, 3328]
    - [26, 4.763]
  - - [448, 6784, 1, 1280]
    - [26, 7.015]
  - - [1856, 5888, 1, 1]
    - [53, 0.169]
  - - [256, 5888, 1, 32]
    - [33, 1.48]
  - - [3584, 1, 1, 3328]
    - [64, 0.027]
  - - [4288, 32, 1, 256]
    - [46, 0.623]
  - - [256, 64, 1, 1]
    - [55, 0.001]
  - - [4288, 5056, 1, 32]
    - [33, 2.752]
  - - [4288, 5056, 1, 3328]
    - [26, 7.725]
  - - [1856, 5888, 1, 32]
    - [33, 2.589]
  - - [1856, 5888, 1, 1280]
    - [26, 7.586]
  - - [256, 256, 1, 1280]
    - [15, 1.943]
  - - [704, 2368, 1, 1280]
    - [26, 6.303]
  - - [4288, 2368, 1, 1280]
    - [26, 7.571]
  - - [2944, 5056, 1, 256]
    - [26, 7.33]
  - - [32, 1856, 1, 256]
    - [42, 0.293]
  - - [64, 5888, 1, 1280]
    - [14, 4.122]
  - - [1, 1856, 1, 1280]
    - [64, 0.013]
  - - [2944, 4288, 1, 1]
    - [54, 0.174]
  - - [5056, 5888, 1, 32]
    - [33, 2.788]
  - - [704, 1, 1, 3328]
    - [64, 0.005]
  - - [448, 256, 1, 1280]
    - [18, 2.838]
  - - [1408, 256, 1, 1]
    - [55, 0.024]
  - - [2368, 5056, 1, 3328]
    - [26, 7.65]
  - - [1024, 5056, 1, 3328]
    - [26, 7.451]
  - - [704, 704, 1, 1280]
    - [26, 5.162]
  - - [128, 32, 1, 3328]
    - [46, 0.035]
  - - [1024, 6784, 1, 32]
    - [33, 2.324]
  - - [3584, 2944, 1, 3328]
    - [26, 7.549]
  - - [128, 1856, 1, 256]
    - [4, 3.093]
  - - [32, 32, 1, 1280]
    - [46, 0.008]
  - - [1408, 5888, 1, 1]
    - [52, 0.148]
  - - [1, 3584, 1, 256]
    - [64, 0.02]
  - - [704, 4288, 1, 32]
    - [33, 1.97]
  - - [1408, 5888, 1, 32]
    - [33, 2.528]
  - - [6784, 1024, 1, 3328]
    - [26, 7.329]
  - - [1856, 1, 1, 3328]
    - [64, 0.014]
  - - [5056, 1408, 1, 256]
    - [26, 6.888]
  - - [1, 1, 1, 256]
    - [63, 0.0]
  - - [2944, 1408, 1, 256]
    - [26, 6.877]
  - - [4288, 1, 1, 1]
    - [55, 0.0]
  - - [2368, 2368, 1, 256]
    - [26, 6.935]
  - - [1, 448, 1, 256]
    - [63, 0.002]
  - - [1408, 6784, 1, 1]
    - [47, 0.157]
  - - [3584, 32, 1, 3328]
    - [46, 0.997]
  - - [128, 3584, 1, 1]
    - [55, 0.032]
  - - [1856, 1, 1, 256]
    - [63, 0.009]
  - - [6784, 6784, 1, 1280]
    - [26, 7.584]
  - - [1024, 5888, 1, 1]
    - [47, 0.127]
  - - [6784, 32, 1, 3328]
    - [46, 1.21]
  - - [1408, 32, 1, 256]
    - [42, 0.237]
  - - [128, 3584, 1, 32]
    - [41, 0.708]
  - - [1856, 3584, 1, 256]
    - [26, 7.014]
  - - [2944, 64, 1, 256]
    - [4, 2.453]
  - - [2368, 704, 1, 32]
    - [37, 1.508]
  - - [256, 5888, 1, 1280]
    - [26, 6.528]
  - - [448, 2368, 1, 32]
    - [41, 1.107]
  - - [448, 2368, 1, 3328]
    - [26, 5.465]
  - - [64, 1408, 1, 256]
    - [3, 1.674]
  - - [5056, 32, 1, 32]
    - [35, 0.299]
  - - [1024, 704, 1, 3328]
    - [26, 5.655]
  - - [32, 5888, 1, 3328]
    - [46, 1.055]
  - - [256, 64, 1, 3328]
    - [15, 0.553]
  - - [32, 1408, 1, 1280]
    - [46, 0.357]
  - - [64, 32, 1, 256]
    - [42, 0.011]
  - - [1856, 1024, 1, 3328]
    - [29, 6.497]
  - - [2368, 1, 1, 1]
    - [53, 0.0]
  - - [5056, 2368, 1, 3328]
    - [26, 7.495]
  - - [128, 1, 1, 1280]
    - [64, 0.001]
  - - [704, 4288, 1, 1280]
    - [26, 6.978]
  - - [704, 256, 1, 256]
    - [12, 2.261]
  - - [512, 128, 1, 784]
    - [65, 1.748]
  - - [1024, 256, 1, 196]
    - [69, 4.808]
  - - [256, 64, 1, 3136]
    - [67, 0.524]
  - - [256, 1024, 1, 196]
    - [66, 4.906]
  - - [64, 256, 1, 3136]
    - [70, 0.558]
  - - [128, 512, 1, 784]
    - [68, 1.755]
  - - [64, 64, 1, 3136]
    - [69, 0.13]
  - - [2560, 7000, 1, 2560]
    - [92, 12.082]
  - - [7680, 12000, 1, 2560]
    - [92, 13.04]
  - - [5124, 9124, 1, 1760]
    - [86, 12.552]
  - - [1760, 32, 1, 1760]
    - [73, 1.541]
  - - [512, 24000, 1, 1536]
    - [92, 11.7]
  - - [3072, 24000, 1, 1024]
    - [92, 11.963]
  - - [2048, 400, 1, 512]
    - [93, 6.414]
  - - [2560, 128, 1, 2560]
    - [79, 4.81]
  - - [3072, 16, 1, 1024]
    - [81, 1.04]
  - - [512, 48000, 1, 2816]
    - [92, 12.758]
  - - [512, 48000, 1, 2048]
    - [93, 10.232]
  - - [1760, 64, 1, 1760]
    - [73, 2.978]
  - - [2048, 1600, 1, 2048]
    - [93, 6.088]
  - - [512, 48000, 1, 1536]
    - [92, 12.287]
  - - [2560, 32, 1, 2560]
    - [73, 2.186]
  - - [8448, 5984, 1, 2816]
    - [92, 12.759]
  - - [4096, 3200, 1, 1024]
    - [93, 10.152]
  - - [1024, 24000, 1, 2560]
    - [92, 12.402]
  - - [1760, 6400, 1, 1760]
    - [86, 12.673]
  - - [5124, 9124, 1, 2048]
    - [93, 10.267]
  - - [1024, 700, 1, 512]
    - [85, 5.469]
  - - [4608, 32, 1, 1536]
    - [73, 3.322]
  - - [3072, 64, 1, 1024]
    - [81, 3.015]
  - - [16384, 3200, 1, 4096]
    - [93, 10.63]
  - - [2560, 16, 1, 2560]
    - [79, 1.129]
  - - [1024, 48000, 1, 2560]
    - [92, 12.882]
  - - [8448, 48000, 1, 2816]
    - [92, 11.709]
  - - [2048, 32, 1, 2048]
    - [76, 1.215]
  - - [2560, 3200, 1, 2560]
    - [92, 11.639]
  - - [16384, 800, 1, 4096]
    - [93, 8.686]
  - - [4608, 24000, 1, 1536]
    - [92, 12.921]
  - - [7680, 48000, 1, 2560]
    - [92, 12.276]
  - - [3072, 48000, 1, 1024]
    - [92, 12.454]
  - - [1760, 16, 1, 1760]
    - [76, 0.734]
  - - [8192, 3200, 1, 2048]
    - [93, 10.168]
  - - [512, 24000, 1, 2816]
    - [92, 12.625]
  - - [4096, 400, 1, 1024]
    - [93, 7.625]
  - - [6144, 48000, 1, 2560]
    - [92, 13.067]
  - - [4608, 48000, 1, 1536]
    - [92, 13.057]
  - - [4096, 128, 1, 4096]
    - [81, 3.428]
  - - [2048, 800, 1, 512]
    - [92, 7.788]
  - - [4608, 5984, 1, 1536]
    - [92, 12.254]
  - - [4096, 1600, 1, 1024]
    - [93, 9.132]
  - - [6144, 5984, 1, 2048]
    - [93, 10.445]
  - - [7680, 24000, 1, 2560]
    - [92, 12.975]
  - - [6144, 48000, 1, 2048]
    - [93, 11.058]
  - - [2048, 3200, 1, 2048]
    - [93, 8.487]
  - - [5124, 9124, 1, 2560]
    - [92, 12.325]
  - - [1024, 24000, 1, 1536]
    - [92, 12.236]
  - - [7680, 16, 1, 2560]
    - [76, 2.186]
  - - [2560, 6400, 1, 2560]
    - [92, 12.244]
  - - [2048, 128, 1, 2048]
    - [76, 2.63]
  - - [512, 16, 1, 500000]
    - [76, 0.23]
  - - [1024, 8, 1, 500000]
    - [73, 0.231]
  - - [512, 24000, 1, 2560]
    - [92, 12.043]
  - - [1024, 24000, 1, 2816]
    - [92, 12.737]
  - - [7680, 5984, 1, 2560]
    - [92, 12.764]
  - - [2048, 1600, 1, 512]
    - [93, 7.866]
  - - [2048, 7000, 1, 2048]
    - [93, 9.591]
  - - [1760, 800, 1, 1760]
    - [83, 8.65]
  - - [4096, 64, 1, 4096]
    - [76, 2.672]
  - - [7680, 32, 1, 2560]
    - [76, 4.317]
  - - [2560, 64, 1, 2560]
    - [79, 3.933]
  - - [3072, 128, 1, 1024]
    - [81, 3.841]
  - - [7680, 64, 1, 2560]
    - [85, 4.992]
  - - [1760, 128, 1, 1760]
    - [73, 5.19]
  - - [2560, 1600, 1, 2560]
    - [92, 9.133]
  - - [2048, 3200, 1, 512]
    - [93, 9.263]
  - - [2560, 800, 1, 2560]
    - [92, 7.858]
  - - [3072, 32, 1, 1024]
    - [76, 2.004]
  - - [6144, 32, 1, 2560]
    - [73, 4.009]
  - - [4608, 12000, 1, 1536]
    - [92, 12.701]
  - - [4096, 32, 1, 4096]
    - [82, 1.746]
  - - [6144, 24000, 1, 2048]
    - [93, 10.943]
  - - [8192, 800, 1, 2048]
    - [93, 7.666]
  - - [5124, 9124, 1, 4096]
    - [93, 10.35]
  - - [8448, 24000, 1, 2816]
    - [92, 12.94]
  - - [1024, 48000, 1, 1536]
    - [92, 12.669]
  - - [7680, 128, 1, 2560]
    - [85, 8.749]
  - - [8192, 1600, 1, 2048]
    - [93, 9.136]
  - - [4096, 800, 1, 1024]
    - [93, 7.802]
  - - [1024, 16, 1, 500000]
    - [76, 0.46]
  - - [2048, 800, 1, 2048]
    - [91, 5.62]
  - - [1760, 3200, 1, 1760]
    - [86, 11.354]
  - - [512, 48000, 1, 2560]
    - [92, 12.509]
  - - [8448, 16, 1, 2816]
    - [74, 2.552]
  - - [2048, 64, 1, 2048]
    - [76, 2.169]
  - - [512, 24000, 1, 2048]
    - [93, 9.372]
  - - [16384, 1600, 1, 4096]
    - [93, 9.853]
  - - [4608, 16, 1, 1536]
    - [73, 1.685]
  - - [1024, 24000, 1, 2048]
    - [93, 10.192]
  - - [8192, 400, 1, 2048]
    - [93, 6.087]
  - - [2048, 6400, 1, 2048]
    - [93, 9.487]
  - - [6144, 12000, 1, 2048]
    - [93, 10.796]
  - - [512, 8, 1, 500000]
    - [73, 0.116]
  - - [1760, 7000, 1, 1760]
    - [86, 11.811]
  - - [1024, 48000, 1, 2816]
    - [92, 13.051]
  - - [6144, 16, 1, 2560]
    - [79, 2.077]
  - - [8448, 32, 1, 2816]
    - [79, 4.543]
  - - [4096, 7000, 1, 4096]
    - [93, 10.357]
  - - [4096, 16, 1, 4096]
    - [77, 0.885]
  - - [6144, 24000, 1, 2560]
    - [92, 12.895]
  - - [2048, 16, 1, 2048]
    - [81, 0.643]
  - - [8448, 12000, 1, 2816]
    - [92, 12.941]
  - - [16384, 400, 1, 4096]
    - [93, 7.144]
  - - [1760, 1600, 1, 1760]
    - [84, 11.099]
  - - [1024, 48000, 1, 2048]
    - [93, 10.643]
  - - [3073, 3072, 1, 3072]
    - [133, 2.988]
  - - [3072, 512, 1, 3072]
    - [140, 22.872]
  - - [511, 2048, 1, 2048]
    - [132, 1.637]
  - - [4096, 4096, 1, 4096]
    - [140, 52.61]
  - - [4096, 513, 1, 4096]
    - [136, 1.678]
  - - [513, 1024, 1, 1024]
    - [133, 1.11]
  - - [512, 2048, 1, 2047]
    - [138, 1.54]
  - - [512, 512, 1, 512]
    - [140, 2.548]
  - - [512, 1025, 1, 1024]
    - [132, 1.107]
  - - [3840, 4097, 1, 4096]
    - [133, 2.921]
  - - [1024, 1024, 1, 1024]
    - [140, 14.416]
  - - [960, 1025, 1, 1024]
    - [132, 1.533]
  - - [4096, 511, 1, 4096]
    - [132, 2.024]
  - - [512, 3072, 1, 3072]
    - [140, 24.548]
  - - [2049, 512, 1, 2048]
    - [132, 1.632]
  - - [7681, 8192, 1, 8192]
    - [136, 2.97]
  - - [8192, 512, 1, 8191]
    - [138, 2.248]
  - - [2048, 2048, 1, 2049]
    - [133, 2.544]
  - - [2880, 3072, 1, 3072]
    - [139, 38.26]
  - - [7680, 8193, 1, 8192]
    - [136, 3.007]
  - - [8192, 512, 1, 8193]
    - [133, 2.513]
  - - [1023, 512, 1, 1024]
    - [132, 1.106]
  - - [513, 2048, 1, 2048]
    - [132, 1.637]
  - - [8192, 8191, 1, 8192]
    - [133, 3.027]
  - - [512, 1023, 1, 1024]
    - [132, 1.104]
  - - [512, 4097, 1, 4096]
    - [133, 1.934]
  - - [1920, 2048, 1, 2047]
    - [133, 2.938]
  - - [1920, 2049, 1, 2048]
    - [133, 2.381]
  - - [3073, 512, 1, 3072]
    - [133, 2.328]
  - - [3841, 4096, 1, 4096]
    - [133, 2.912]
  - - [8192, 512, 1, 8192]
    - [140, 22.381]
  - - [511, 512, 1, 512]
    - [132, 0.707]
  - - [1024, 512, 1, 1025]
    - [132, 1.104]
  - - [4095, 512, 1, 4096]
    - [132, 2.026]
  - - [1919, 2048, 1, 2048]
    - [137, 2.756]
  - - [2879, 3072, 1, 3072]
    - [133, 2.808]
  - - [8192, 8192, 1, 8192]
    - [140, 60.301]
  - - [1024, 1024, 1, 1023]
    - [132, 1.637]
  - - [8191, 512, 1, 8192]
    - [133, 2.486]
  - - [512, 8193, 1, 8192]
    - [133, 2.441]
  - - [1024, 1025, 1, 1024]
    - [132, 1.63]
  - - [512, 512, 1, 511]
    - [132, 0.744]
  - - [2047, 2048, 1, 2048]
    - [132, 2.361]
  - - [1024, 1023, 1, 1024]
    - [132, 1.629]
  - - [512, 1024, 1, 1024]
    - [140, 6.594]
  - - [2880, 3072, 1, 3071]
    - [134, 2.676]
  - - [2048, 511, 1, 2048]
    - [132, 1.639]
  - - [7680, 8192, 1, 8193]
    - [136, 3.353]
  - - [512, 8191, 1, 8192]
    - [133, 2.449]
  - - [512, 4096, 1, 4096]
    - [140, 33.734]
  - - [4097, 512, 1, 4096]
    - [133, 1.982]
  - - [1921, 2048, 1, 2048]
    - [133, 2.362]
  - - [2048, 2049, 1, 2048]
    - [133, 2.373]
  - - [3072, 512, 1, 3071]
    - [133, 2.336]
  - - [8192, 8192, 1, 8191]
    - [136, 3.088]
  - - [2880, 3072, 1, 3073]
    - [134, 2.591]
  - - [2047, 512, 1, 2048]
    - [132, 1.641]
  - - [1025, 1024, 1, 1024]
    - [138, 1.467]
  - - [3072, 513, 1, 3072]
    - [133, 2.327]
  - - [512, 513, 1, 512]
    - [132, 0.726]
  - - [512, 511, 1, 512]
    - [132, 0.722]
  - - [3839, 4096, 1, 4096]
    - [136, 3.137]
  - - [512, 4096, 1, 4097]
    - [133, 1.974]
  - - [3072, 3073, 1, 3072]
    - [133, 2.989]
  - - [512, 4096, 1, 4095]
    - [136, 1.709]
  - - [8191, 8192, 1, 8192]
    - [136, 2.89]
  - - [2880, 3071, 1, 3072]
    - [133, 2.807]
  - - [4096, 512, 1, 4097]
    - [132, 2.042]
  - - [1920, 2047, 1, 2048]
    - [133, 2.934]
  - - [512, 2049, 1, 2048]
    - [132, 1.643]
  - - [3072, 3072, 1, 3071]
    - [133, 2.99]
  - - [8192, 8193, 1, 8192]
    - [133, 3.099]
  - - [4096, 512, 1, 4095]
    - [136, 1.765]
  - - [960, 1024, 1, 1024]
    - [139, 30.586]
  - - [961, 1024, 1, 1024]
    - [132, 1.531]
  - - [4096, 4097, 1, 4096]
    - [132, 2.525]
  - - [512, 8192, 1, 8192]
    - [140, 34.413]
  - - [8192, 8192, 1, 8193]
    - [136, 3.117]
  - - [4096, 4095, 1, 4096]
    - [136, 2.688]
  - - [511, 8192, 1, 8192]
    - [132, 2.275]
  - - [512, 3071, 1, 3072]
    - [133, 2.308]
  - - [3840, 4096, 1, 4096]
    - [140, 60.051]
  - - [7680, 8191, 1, 8192]
    - [136, 3.189]
  - - [7680, 8192, 1, 8192]
    - [140, 62.168]
  - - [4096, 4096, 1, 4097]
    - [133, 2.977]
  - - [512, 8192, 1, 8193]
    - [133, 2.551]
  - - [8192, 513, 1, 8192]
    - [133, 2.483]
  - - [1024, 1024, 1, 1025]
    - [132, 1.637]
  - - [960, 1024, 1, 1023]
    - [134, 1.668]
  - - [512, 2048, 1, 2049]
    - [132, 1.651]
  - - [8192, 511, 1, 8192]
    - [133, 2.443]
  - - [513, 4096, 1, 4096]
    - [133, 1.89]
  - - [511, 1024, 1, 1024]
    - [132, 1.104]
  - - [513, 512, 1, 512]
    - [132, 0.728]
  - - [3072, 3072, 1, 3073]
    - [135, 2.65]
  - - [960, 1024, 1, 1025]
    - [138, 1.86]
  - - [959, 1024, 1, 1024]
    - [138, 1.863]
  - - [2048, 2048, 1, 2048]
    - [140, 30.99]
  - - [512, 3072, 1, 3073]
    - [133, 2.326]
  - - [511, 3072, 1, 3072]
    - [133, 2.319]
  - - [513, 8192, 1, 8192]
    - [138, 2.206]
  - - [4095, 4096, 1, 4096]
    - [136, 2.721]
  - - [8193, 8192, 1, 8192]
    - [133, 3.062]
  - - [3840, 4095, 1, 4096]
    - [137, 2.852]
  - - [512, 3073, 1, 3072]
    - [133, 2.318]
  - - [4096, 4096, 1, 4095]
    - [133, 2.911]
  - - [512, 8192, 1, 8191]
    - [134, 2.151]
  - - [1025, 512, 1, 1024]
    - [132, 1.111]
  - - [2881, 3072, 1, 3072]
    - [133, 2.808]
  - - [1024, 512, 1, 1023]
    - [133, 1.101]
  - - [3840, 4096, 1, 4097]
    - [136, 3.292]
  - - [2048, 513, 1, 2048]
    - [132, 1.604]
  - - [1920, 2048, 1, 2048]
    - [140, 53.148]
  - - [3072, 512, 1, 3073]
    - [133, 2.334]
  - - [513, 3072, 1, 3072]
    - [134, 2.071]
  - - [3072, 511, 1, 3072]
    - [133, 2.327]
  - - [511, 4096, 1, 4096]
    - [133, 1.932]
  - - [2049, 2048, 1, 2048]
    - [133, 2.516]
  - - [2048, 2047, 1, 2048]
    - [133, 2.516]
  - - [960, 1023, 1, 1024]
    - [138, 1.871]
  - - [2880, 3073, 1, 3072]
    - [133, 2.812]
  - - [1024, 511, 1, 1024]
    - [138, 1.094]
  - - [512, 2048, 1, 2048]
    - [140, 15.134]
  - - [8193, 512, 1, 8192]
    - [133, 2.525]
  - - [2048, 512, 1, 2047]
    - [132, 1.634]
  - - [3071, 3072, 1, 3072]
    - [136, 2.593]
  - - [4096, 512, 1, 4096]
    - [140, 14.925]
  - - [512, 4095, 1, 4096]
    - [133, 1.932]
  - - [512, 1024, 1, 1025]
    - [132, 1.113]
  - - [3071, 512, 1, 3072]
    - [133, 2.329]
  - - [2048, 2048, 1, 2047]
    - [133, 2.523]
  - - [512, 2047, 1, 2048]
    - [132, 1.634]
  - - [512, 3072, 1, 3071]
    - [135, 2.169]
  - - [3072, 3071, 1, 3072]
    - [134, 2.605]
  - - [4097, 4096, 1, 4096]
    - [133, 2.935]
  - - [1024, 513, 1, 1024]
    - [132, 1.111]
  - - [3840, 4096, 1, 4095]
    - [136, 3.312]
  - - [3072, 3072, 1, 3072]
    - [140, 48.276]
  - - [512, 512, 1, 513]
    - [132, 0.733]
  - - [7679, 8192, 1, 8192]
    - [133, 3.113]
  - - [2048, 512, 1, 2049]
    - [132, 1.621]
  - - [512, 1024, 1, 1023]
    - [132, 1.112]
  - - [7680, 8192, 1, 8191]
    - [136, 3.29]
  - - [1023, 1024, 1, 1024]
    - [132, 1.63]
  - - [1920, 2048, 1, 2049]
    - [133, 2.971]
  - - [14, 14, 1, 64]
    - [270, 0.001]
  - - [15, 14, 1, 64]
    - [269, 0.001]
  - - [15, 15, 1, 64]
    - [269, 0.001]
  - - [15, 15, 1, 64]
    - [269, 0.001]
  - - [17, 15, 1, 64]
    - [272, 0.002]
  - - [17, 17, 1, 64]
    - [270, 0.002]
  - - [17, 17, 1, 64]
    - [270, 0.002]
  - - [21, 17, 1, 64]
    - [273, 0.003]
  - - [21, 21, 1, 64]
    - [269, 0.003]
  - - [24, 24, 1, 64]
    - [272, 0.004]
  - - [30, 30, 1, 64]
    - [272, 0.007]
  - - [30, 31, 1, 64]
    - [272, 0.007]
  - - [31, 31, 1, 64]
    - [271, 0.007]
  - - [32, 32, 1, 64]
    - [272, 0.007]
  - - [32, 35, 1, 64]
    - [272, 0.008]
  - - [34, 24, 1, 64]
    - [271, 0.006]
  - - [34, 34, 1, 64]
    - [272, 0.008]
  - - [35, 35, 1, 64]
    - [272, 0.009]
  - - [27, 27, 1, 64]
    - [271, 0.005]
  - - [27, 33, 1, 64]
    - [272, 0.007]
  - - [33, 33, 1, 64]
    - [183, 0.008]
  - - [2, 4, 1, 1024]
    - [280, 0.001]
  - - [2, 32, 1, 1024]
    - [285, 0.006]
  - - [2, 2048, 1, 1024]
    - [307, 0.35]
  - - [64, 128, 512, 128]
    - [363, 15.603]
  - - [64, 512, 1, 512]
    - [338, 2.309]
  - - [64, 512, 64, 512]
    - [366, 23.811]
  - - [128, 128, 512, 64]
    - [374, 17.629]
  - - [512, 512, 1, 64]
    - [388, 2.661]
  - - [512, 512, 64, 64]
    - [374, 22.994]
  - - [1024, 4, 1, 1024]
    - [338, 0.389]
  - - [1024, 4, 1, 1024]
    - [327, 0.389]
  - - [1024, 32, 1, 1024]
    - [318, 3.079]
  - - [1024, 2048, 1, 1024]
    - [309, 40.034]
  - - [1024, 2048, 1, 4096]
    - [319, 40.254]
  - - [1024, 4096, 1, 1024]
    - [372, 44.266]
  - - [1024, 4096, 1, 4096]
    - [407, 45.315]
  - - [4096, 2048, 1, 1024]
    - [350, 52.166]
  - - [4096, 4096, 1, 1024]
    - [368, 62.124]
  - - [30528, 2048, 1, 1024]
    - [401, 70.379]
  - - [30528, 4096, 1, 1024]
    - [399, 74.803]
  - - [3, 3, 512, 64]
    - [299, 0.036]
  - - [5, 5, 512, 64]
    - [284, 0.087]
  - - [5, 5, 960, 64]
    - [283, 0.15]
  - - [9, 9, 512, 64]
    - [318, 0.279]
  - - [27, 27, 32768, 128]
    - [349, 7.859]
  - - [32, 1600, 1, 512]
    - [360, 3.505]
  - - [33, 33, 1600, 32]
    - [320, 2.138]
  - - [64, 512, 1, 1024]
    - [297, 3.019]
  - - [64, 960, 1, 1024]
    - [329, 5.033]
  - - [128, 32768, 1, 256]
    - [380, 29.296]
  - - [256, 684, 1, 1024]
    - [387, 11.261]
  - - [256, 1280, 1, 1024]
    - [386, 19.031]
  - - [256, 1536, 1, 1024]
    - [385, 20.819]
  - - [256, 2304, 1, 1024]
    - [356, 26.915]
  - - [256, 2560, 1, 1024]
    - [416, 28.941]
  - - [256, 2816, 1, 1024]
    - [408, 30.979]
  - - [256, 3328, 1, 1024]
    - [354, 33.46]
  - - [256, 3584, 1, 1024]
    - [417, 34.752]
  - - [256, 4608, 1, 1024]
    - [346, 33.445]
  - - [256, 4864, 1, 1024]
    - [311, 34.487]
  - - [256, 5376, 1, 1024]
    - [328, 35.936]
  - - [256, 5888, 1, 1024]
    - [298, 39.039]
  - - [256, 6144, 1, 1024]
    - [351, 40.409]
  - - [256, 6400, 1, 1024]
    - [381, 41.757]
  - - [256, 6656, 1, 1024]
    - [384, 43.312]
  - - [256, 7168, 1, 1024]
    - [369, 45.556]
  - - [256, 7424, 1, 1024]
    - [413, 47.061]
  - - [256, 7936, 1, 1024]
    - [412, 36.255]
  - - [256, 8192, 1, 1024]
    - [316, 37.705]
  - - [256, 8448, 1, 1024]
    - [336, 38.594]
  - - [256, 8960, 1, 1024]
    - [403, 41.317]
  - - [256, 9984, 1, 1024]
    - [378, 45.611]
  - - [256, 10496, 1, 1024]
    - [316, 47.246]
  - - [256, 11264, 1, 1024]
    - [378, 50.518]
  - - [256, 11520, 1, 1024]
    - [336, 50.921]
  - - [256, 11776, 1, 1024]
    - [403, 51.959]
  - - [256, 12544, 1, 1024]
    - [316, 54.952]
  - - [256, 13312, 1, 1024]
    - [403, 56.5]
  - - [256, 14336, 1, 1024]
    - [403, 58.91]
  - - [256, 14592, 1, 1024]
    - [403, 59.962]
  - - [256, 14848, 1, 1024]
    - [370, 59.911]
  - - [256, 15104, 1, 1024]
    - [370, 61.654]
  - - [256, 16128, 1, 1024]
    - [397, 43.194]
  - - [256, 18176, 1, 1024]
    - [396, 45.315]
  - - [256, 18944, 1, 1024]
    - [396, 46.335]
  - - [256, 19200, 1, 1024]
    - [396, 46.59]
  - - [256, 20480, 1, 1024]
    - [343, 47.443]
  - - [256, 20992, 1, 1024]
    - [316, 48.86]
  - - [256, 21248, 1, 1024]
    - [384, 48.945]
  - - [256, 21504, 1, 1024]
    - [384, 49.721]
  - - [256, 22016, 1, 1024]
    - [316, 50.809]
  - - [256, 22344, 1, 1024]
    - [384, 49.427]
  - - [256, 23296, 1, 1024]
    - [325, 53.462]
  - - [256, 23552, 1, 1024]
    - [394, 53.697]
  - - [256, 31488, 1, 1024]
    - [316, 49.933]
  - - [256, 32768, 1, 512]
    - [405, 42.988]
  - - [256, 33536, 1, 1024]
    - [316, 52.536]
  - - [256, 44505, 1, 1024]
    - [403, 61.894]
  - - [512, 1600, 1, 512]
    - [295, 25.824]
  - - [512, 32768, 1, 13]
    - [310, 3.994]
  - - [512, 32768, 1, 1024]
    - [316, 62.003]
  - - [684, 8976, 1, 256]
    - [332, 33.128]
  - - [1024, 200, 1, 560]
    - [379, 7.666]
  - - [1024, 512, 1, 1024]
    - [393, 26.443]
  - - [1024, 512, 1, 1600]
    - [296, 31.152]
  - - [1024, 960, 1, 1024]
    - [389, 34.132]
  - - [1024, 960, 1, 1600]
    - [355, 40.662]
  - - [1024, 1600, 1, 560]
    - [362, 28.431]
  - - [1024, 1600, 1, 1024]
    - [414, 41.536]
  - - [1024, 32768, 1, 480]
    - [322, 67.53]
  - - [1024, 32768, 1, 1024]
    - [316, 68.648]
  - - [1280, 8976, 1, 256]
    - [402, 41.705]
  - - [1792, 8976, 1, 256]
    - [377, 42.115]
  - - [2048, 114, 1, 512]
    - [313, 9.48]
  - - [2048, 114, 1, 768]
    - [398, 12.809]
  - - [2048, 215, 1, 512]
    - [409, 15.178]
  - - [2048, 215, 1, 768]
    - [375, 18.293]
  - - [2048, 256, 1, 512]
    - [383, 19.031]
  - - [2048, 256, 1, 768]
    - [303, 24.791]
  - - [2048, 512, 1, 67]
    - [400, 5.62]
  - - [2048, 512, 1, 74]
    - [302, 6.37]
  - - [2048, 512, 1, 100]
    - [289, 8.044]
  - - [2048, 512, 1, 2048]
    - [290, 34.472]
  - - [2048, 684, 1, 512]
    - [417, 28.202]
  - - [2048, 684, 1, 768]
    - [308, 34.598]
  - - [2048, 960, 1, 74]
    - [347, 10.555]
  - - [2048, 960, 1, 2048]
    - [341, 40.301]
  - - [2048, 1536, 1, 512]
    - [391, 48.937]
  - - [2048, 1536, 1, 768]
    - [411, 55.279]
  - - [2048, 8976, 1, 256]
    - [312, 40.891]
  - - [2304, 8976, 1, 256]
    - [305, 43.923]
  - - [2560, 8976, 1, 256]
    - [392, 44.939]
  - - [2816, 8976, 1, 256]
    - [358, 44.363]
  - - [3072, 8976, 1, 256]
    - [359, 44.129]
  - - [3328, 8976, 1, 256]
    - [323, 44.701]
  - - [3840, 8976, 1, 256]
    - [315, 43.76]
  - - [4096, 8976, 1, 256]
    - [368, 43.691]
  - - [4352, 8976, 1, 256]
    - [315, 44.459]
  - - [4608, 8976, 1, 256]
    - [315, 44.837]
  - - [4864, 8976, 1, 256]
    - [288, 44.49]
  - - [5120, 8976, 1, 256]
    - [286, 44.253]
  - - [5376, 8976, 1, 256]
    - [401, 45.389]
  - - [5632, 8976, 1, 256]
    - [330, 44.608]
  - - [5888, 8976, 1, 256]
    - [335, 44.427]
  - - [6144, 8976, 1, 256]
    - [333, 44.188]
  - - [6400, 8976, 1, 256]
    - [300, 44.409]
  - - [7168, 8976, 1, 256]
    - [330, 45.017]
  - - [7936, 8976, 1, 256]
    - [364, 45.123]
  - - [8192, 8976, 1, 256]
    - [333, 43.155]
  - - [8448, 8976, 1, 256]
    - [330, 45.134]
  - - [8960, 8976, 1, 256]
    - [330, 45.272]
  - - [9472, 8976, 1, 256]
    - [361, 45.083]
  - - [9728, 8976, 1, 256]
    - [364, 45.407]
  - - [9984, 8976, 1, 256]
    - [364, 45.228]
  - - [10240, 8976, 1, 256]
    - [333, 45.188]
  - - [10496, 8976, 1, 256]
    - [364, 45.259]
  - - [11264, 8976, 1, 256]
    - [333, 45.462]
  - - [11776, 8976, 1, 256]
    - [334, 45.276]
  - - [12544, 8976, 1, 256]
    - [364, 45.297]
  - - [13312, 8976, 1, 256]
    - [333, 45.758]
  - - [13568, 8976, 1, 256]
    - [361, 45.242]
  - - [13824, 8976, 1, 256]
    - [331, 45.812]
  - - [15104, 8976, 1, 256]
    - [324, 46.997]
  - - [15360, 8976, 1, 256]
    - [361, 45.603]
  - - [15872, 8976, 1, 256]
    - [333, 45.375]
  - - [16128, 8976, 1, 256]
    - [365, 47.412]
  - - [17152, 8976, 1, 256]
    - [334, 45.75]
  - - [18176, 8976, 1, 256]
    - [334, 45.848]
  - - [18688, 8976, 1, 256]
    - [330, 45.833]
  - - [18944, 8976, 1, 256]
    - [334, 45.854]
  - - [19712, 8976, 1, 256]
    - [331, 46.055]
  - - [19968, 8976, 1, 256]
    - [301, 45.695]
  - - [20480, 8976, 1, 256]
    - [331, 45.851]
  - - [20992, 8976, 1, 256]
    - [301, 45.824]
  - - [21248, 8976, 1, 256]
    - [331, 45.972]
  - - [23552, 8976, 1, 256]
    - [334, 46.105]
  - - [28672, 8976, 1, 256]
    - [301, 46.133]
  - - [31488, 8976, 1, 256]
    - [334, 46.22]
  - - [33536, 8976, 1, 256]
    - [301, 46.413]
  - - [44505, 8976, 1, 256]
    - [322, 44.509]
  - - [14, 14, 10880, 64]
    - [291, 2.285]
  - - [15, 14, 10880, 64]
    - [291, 2.426]
  - - [15, 15, 7680, 64]
    - [281, 2.337]
  - - [15, 15, 10880, 64]
    - [371, 2.572]
  - - [17, 15, 7680, 64]
    - [291, 2.601]
  - - [17, 17, 7680, 64]
    - [317, 2.921]
  - - [21, 17, 6144, 64]
    - [340, 2.432]
  - - [21, 21, 6144, 64]
    - [306, 2.755]
  - - [24, 24, 4736, 64]
    - [291, 2.965]
  - - [30, 30, 2048, 64]
    - [306, 3.942]
  - - [30, 31, 2048, 64]
    - [326, 4.074]
  - - [31, 31, 2048, 64]
    - [344, 4.065]
  - - [32, 32, 4608, 64]
    - [283, 5.975]
  - - [32, 35, 4608, 64]
    - [345, 5.442]
  - - [34, 24, 4736, 64]
    - [282, 4.401]
  - - [34, 34, 4736, 64]
    - [287, 4.099]
  - - [35, 35, 4608, 64]
    - [352, 3.723]
  - - [1024, 3840, 1, 1024]
    - [367, 63.224]
  - - [1024, 3840, 1, 4096]
    - [339, 70.334]
  - - [1024, 3968, 1, 1024]
    - [380, 44.399]
  - - [1024, 3968, 1, 4096]
    - [404, 45.568]
  - - [1024, 6528, 1, 1024]
    - [336, 59.424]
  - - [1024, 6528, 1, 4096]
    - [342, 65.166]
  - - [1024, 7104, 1, 1024]
    - [403, 58.482]
  - - [1024, 7104, 1, 4096]
    - [342, 68.293]
  - - [1024, 7200, 1, 1024]
    - [403, 60.439]
  - - [1024, 7200, 1, 4096]
    - [309, 69.729]
  - - [1024, 8064, 1, 1024]
    - [406, 50.242]
  - - [1024, 8064, 1, 4096]
    - [382, 56.032]
  - - [1024, 8160, 1, 1024]
    - [380, 50.203]
  - - [1024, 8160, 1, 4096]
    - [357, 54.085]
  - - [1024, 9216, 1, 1024]
    - [325, 56.736]
  - - [1024, 9216, 1, 4096]
    - [294, 61.074]
  - - [1024, 9520, 1, 1024]
    - [394, 55.773]
  - - [1024, 9520, 1, 4096]
    - [353, 65.078]
  - - [1024, 10064, 1, 1024]
    - [304, 57.585]
  - - [1024, 10064, 1, 4096]
    - [321, 67.526]
  - - [1024, 10080, 1, 1024]
    - [336, 57.576]
  - - [1024, 10080, 1, 4096]
    - [321, 67.564]
  - - [1024, 10200, 1, 1024]
    - [336, 58.912]
  - - [1024, 10200, 1, 4096]
    - [399, 65.602]
  - - [4096, 3840, 1, 1024]
    - [376, 66.604]
  - - [4096, 3968, 1, 1024]
    - [410, 61.031]
  - - [4096, 6528, 1, 1024]
    - [314, 66.85]
  - - [4096, 7104, 1, 1024]
    - [373, 65.41]
  - - [4096, 7200, 1, 1024]
    - [373, 66.419]
  - - [4096, 8064, 1, 1024]
    - [373, 66.288]
  - - [4096, 8160, 1, 1024]
    - [399, 67.049]
  - - [4096, 9216, 1, 1024]
    - [350, 70.01]
  - - [4096, 9520, 1, 1024]
    - [331, 65.927]
  - - [4096, 10064, 1, 1024]
    - [348, 68.463]
  - - [4096, 10080, 1, 1024]
    - [348, 68.417]
  - - [4096, 10200, 1, 1024]
    - [348, 68.721]
  - - [42720, 3968, 1, 1024]
    - [365, 72.142]
  - - [42720, 6528, 1, 1024]
    - [401, 74.367]
  - - [42720, 7104, 1, 1024]
    - [399, 72.841]
  - - [42720, 7200, 1, 1024]
    - [365, 74.305]
  - - [42720, 9520, 1, 1024]
    - [399, 73.936]
  - - [42720, 10080, 1, 1024]
    - [401, 74.928]
  - - [27, 27, 1920, 64]
    - [337, 4.05]
  - - [27, 33, 1920, 64]
    - [293, 4.765]
  - - [33, 33, 1920, 64]
    - [292, 3.46]
  - - [1024, 3240, 1, 1024]
    - [395, 49.756]
  - - [1024, 3240, 1, 4096]
    - [415, 62.865]
  - - [1024, 3960, 1, 1024]
    - [390, 42.377]
  - - [1024, 3960, 1, 4096]
    - [404, 45.238]
  - - [4096, 3240, 1, 1024]
    - [368, 59.015]
  - - [4096, 3960, 1, 1024]
    - [342, 61.195]
  - - [42720, 3960, 1, 1024]
    - [401, 72.574]
- null
