library/src/blas3/Tensile/Logic/asm_full/arcturus_Cijk_Ailk_Bjlk_DB.yaml
- {MinimumRequiredVersion: 4.8.1}
- arcturus
- gfx908
- [Device 7380, Device 7388, Device 738c, Device 7390]
    SolutionIndex: 0
    SolutionNameMin: Cijk_Ailk_Bjlk_DB_MT64x32x4_SE_PLR0_SNLL0_TT4_4_WG16_8_1_WGM1
    SolutionIndex: 1
    SolutionNameMin: Cijk_Ailk_Bjlk_DB_MT64x48x4_SE_PLR1_SNLL0_TT4_6_WG16_8_1_WGM1
    SolutionIndex: 3
    SolutionNameMin: Cijk_Ailk_Bjlk_DB_MT128x32x4_SE_PLR0_SNLL0_TT8_4_WG16_8_1_WGM1
    SolutionIndex: 5
    SolutionNameMin: Cijk_Ailk_Bjlk_DB_MT64x64x4_SE_PLR1_SNLL0_TT4_8_WG16_8_1_WGM1
    SolutionIndex: 6
    SolutionNameMin: Cijk_Ailk_Bjlk_DB_MT128x64x4_SE_PLR1_SNLL0_TT8_4_WG16_16_1_WGM1
    SolutionIndex: 7
    SolutionNameMin: Cijk_Ailk_Bjlk_DB_MT64x128x4_SE_PLR1_SNLL1_TT4_8_WG16_16_1_WGM1
    SolutionIndex: 10
    SolutionNameMin: Cijk_Ailk_Bjlk_DB_MT64x48x4_SE_PLR0_SNLL1_TT4_6_WG16_8_1_WGM4
    SolutionIndex: 11
    SolutionNameMin: Cijk_Ailk_Bjlk_DB_MT64x48x4_SE_PLR0_SNLL0_TT4_6_WG16_8_1_WGM4
    SolutionIndex: 12
    SolutionNameMin: Cijk_Ailk_Bjlk_DB_MT128x32x4_SE_PLR0_SNLL1_TT8_4_WG16_8_1_WGM4
    SolutionIndex: 13
    SolutionNameMin: Cijk_Ailk_Bjlk_DB_MT48x64x4_SE_PLR0_SNLL0_TT6_4_WG8_16_1_WGM4
    SolutionIndex: 15
    SolutionNameMin: Cijk_Ailk_Bjlk_DB_MT64x48x4_SE_PLR0_SNLL1_TT4_6_WG16_8_1_WGM8
    SolutionIndex: 16
    SolutionNameMin: Cijk_Ailk_Bjlk_DB_MT64x48x4_SE_PLR0_SNLL0_TT4_6_WG16_8_1_WGM8
    SolutionIndex: 19
    SolutionNameMin: Cijk_Ailk_Bjlk_DB_MT48x64x4_SE_PLR0_SNLL0_TT6_4_WG8_16_1_WGM8
    SolutionIndex: 20
    SolutionNameMin: Cijk_Ailk_Bjlk_DB_MT64x32x8_SE_PLR1_SNLL1_TT4_4_WG16_8_1_WGM1
    SolutionIndex: 21
    SolutionNameMin: Cijk_Ailk_Bjlk_DB_MT64x32x8_SE_PLR1_SNLL0_TT4_4_WG16_8_1_WGM1
    SolutionIndex: 22
    SolutionNameMin: Cijk_Ailk_Bjlk_DB_MT64x64x8_SE_PLR1_SNLL1_TT4_4_WG16_16_1_WGM1
    SolutionIndex: 23
    SolutionNameMin: Cijk_Ailk_Bjlk_DB_MT64x64x8_SE_PLR0_SNLL1_TT4_4_WG16_16_1_WGM1
    SolutionIndex: 24
    SolutionNameMin: Cijk_Ailk_Bjlk_DB_MT64x64x8_SE_PLR1_SNLL0_TT4_4_WG16_16_1_WGM1
    SolutionIndex: 25
    SolutionNameMin: Cijk_Ailk_Bjlk_DB_MT64x64x8_SE_PLR0_SNLL0_TT4_4_WG16_16_1_WGM1
    SolutionIndex: 27
    SolutionNameMin: Cijk_Ailk_Bjlk_DB_MT96x32x8_SE_PLR1_SNLL1_TT6_4_WG16_8_1_WGM4
    SolutionIndex: 29
    SolutionNameMin: Cijk_Ailk_Bjlk_DB_MT64x64x8_SE_PLR0_SNLL1_TT4_4_WG16_16_1_WGM4
    SolutionIndex: 30
    SolutionNameMin: Cijk_Ailk_Bjlk_DB_MT64x64x8_SE_PLR0_SNLL0_TT4_4_WG16_16_1_WGM4
    SolutionIndex: 33
    SolutionNameMin: Cijk_Ailk_Bjlk_DB_MT64x64x8_SE_PLR0_SNLL1_TT4_4_WG16_16_1_WGM8
    SolutionIndex: 35
    SolutionNameMin: Cijk_Ailk_Bjlk_DB_MT64x64x8_SE_PLR0_SNLL0_TT4_4_WG16_16_1_WGM8
    SolutionIndex: 36
    SolutionNameMin: Cijk_Ailk_Bjlk_DB_MT64x32x4_SE_PLR0_SNLL1_TT4_4_WG16_8_1_WGM1
    SolutionIndex: 53
    SolutionNameMin: Cijk_Ailk_Bjlk_DB_MT64x32x8_SE_PLR1_SNLL1_TT4_4_WG16_8_1_WGM8
    SolutionIndex: 82
    SolutionNameMin: Cijk_Ailk_Bjlk_DB_MT64x48x4_SE_AF0EM1_AF1EM1_AMAS3_ASEM1_EPS1_FL1_GRVW2_IU1_LRVW2_PK0_PGR1_PLR0_SU0_SUM0_SUS256_SVW2_SNLL0_TT4_6_USFGRO0_VS1_VW2_WG16_8_1_WGM8
    SolutionIndex: 83
    SolutionNameMin: Cijk_Ailk_Bjlk_DB_MT64x48x4_SN_AF0EM1_AF1EM1_AMAS3_ASEM1_EPS1_FL1_GRVW2_IU1_LRVW2_PK0_PGR1_PLR0_SU0_SUM0_SUS256_SVW2_SNLL0_TT4_6_USFGRO0_VS1_VW2_WG16_8_1_WGM8
    SolutionIndex: 84
    SolutionNameMin: Cijk_Ailk_Bjlk_DB_MT64x48x4_SE_AF0EM1_AF1EM1_AMAS3_ASEM1_EPS1_FL1_GRVW2_IU1_LRVW2_PK0_PGR1_PLR0_SU0_SUM0_SUS256_SVW2_SNLL0_TT4_6_USFGRO0_VS1_VW2_WG16_8_1_WGM4
    SolutionIndex: 85
    SolutionNameMin: Cijk_Ailk_Bjlk_DB_MT64x48x4_SN_AF0EM1_AF1EM1_AMAS3_ASEM1_EPS1_FL1_GRVW2_IU1_LRVW2_PK0_PGR1_PLR0_SU0_SUM0_SUS256_SVW2_SNLL1_TT4_6_USFGRO0_VS1_VW2_WG16_8_1_WGM8
    SolutionIndex: 86
    SolutionNameMin: Cijk_Ailk_Bjlk_DB_MT64x48x4_SE_AF0EM1_AF1EM1_AMAS3_ASEM1_EPS1_FL1_GRVW2_IU1_LRVW2_PK0_PGR1_PLR0_SU0_SUM0_SUS256_SVW2_SNLL1_TT4_6_USFGRO0_VS1_VW2_WG16_8_1_WGM4
    SolutionIndex: 87
    SolutionNameMin: Cijk_Ailk_Bjlk_DB_MT64x48x4_SE_AF0EM1_AF1EM1_AMAS3_ASEM1_EPS1_FL1_GRVW2_IU1_LRVW2_PK0_PGR1_PLR0_SU0_SUM0_SUS256_SVW2_SNLL1_TT4_6_USFGRO0_VS1_VW2_WG16_8_1_WGM8
    SolutionIndex: 88
    SolutionNameMin: Cijk_Ailk_Bjlk_DB_MT64x96x4_SN_AF0EM1_AF1EM1_AMAS3_ASEM1_EPS1_FL1_GRVW2_IU1_LRVW2_PK0_PGR1_PLR0_SU0_SUM0_SUS256_SVW2_SNLL1_TT4_6_USFGRO0_VS1_VW2_WG16_16_1_WGM8
    SolutionIndex: 89
    SolutionNameMin: Cijk_Ailk_Bjlk_DB_MT64x48x4_SN_AF0EM1_AF1EM1_AMAS3_ASEM1_EPS1_FL1_GRVW2_IU1_LRVW2_PK0_PGR1_PLR0_SU0_SUM0_SUS256_SVW2_SNLL0_TT4_6_USFGRO0_VS1_VW2_WG16_8_1_WGM1
    SolutionIndex: 90
    SolutionNameMin: Cijk_Ailk_Bjlk_DB_MT48x64x4_SE_AF0EM1_AF1EM1_AMAS3_ASEM1_EPS1_FL1_GRVW2_IU1_LRVW2_PK0_PGR1_PLR0_SU0_SUM0_SUS256_SVW2_SNLL1_TT6_4_USFGRO0_VS1_VW2_WG8_16_1_WGM1
    SolutionIndex: 91
    SolutionNameMin: Cijk_Ailk_Bjlk_DB_MT48x64x4_SN_AF0EM1_AF1EM1_AMAS3_ASEM1_EPS1_FL1_GRVW2_IU1_LRVW2_PK0_PGR1_PLR0_SU0_SUM0_SUS256_SVW2_SNLL0_TT6_4_USFGRO0_VS1_VW2_WG8_16_1_WGM8
    SolutionIndex: 92
    SolutionNameMin: Cijk_Ailk_Bjlk_DB_MT64x64x8_SE_AF0EM1_AF1EM1_AMAS3_ASEM1_EPS1_FL1_GRVW2_IU1_LRVW2_PK0_PGR1_PLR0_SU0_SUM0_SUS256_SVW2_SNLL0_TT4_4_USFGRO0_VS1_VW2_WG16_16_1_WGM4
    SolutionIndex: 93
    SolutionNameMin: Cijk_Ailk_Bjlk_DB_MT64x64x8_SN_AF0EM1_AF1EM1_AMAS3_ASEM1_EPS1_FL1_GRVW2_IU1_LRVW2_PK0_PGR1_PLR0_SU0_SUM0_SUS256_SVW2_SNLL0_TT4_4_USFGRO0_VS1_VW2_WG16_16_1_WGM1
    SolutionIndex: 94
    SolutionNameMin: Cijk_Ailk_Bjlk_DB_MT48x64x4_SE_AF0EM1_AF1EM1_AMAS3_ASEM1_EPS1_FL1_GRVW2_IU1_LRVW2_PK0_PGR1_PLR0_SU0_SUM0_SUS256_SVW2_SNLL1_TT6_4_USFGRO0_VS1_VW2_WG8_16_1_WGM4
    SolutionIndex: 95
    SolutionNameMin: Cijk_Ailk_Bjlk_DB_MT96x64x8_SN_AF0EM1_AF1EM1_AMAS3_ASEM1_EPS1_FL1_GRVW2_IU1_LRVW2_PK2_PGR1_PLR1_SU0_SUM0_SUS256_SVW2_SNLL1_TT6_4_USFGRO0_VS1_VW2_WG16_16_1_WGM8
    SolutionIndex: 96
    SolutionNameMin: Cijk_Ailk_Bjlk_DB_MT96x64x4_SE_AF0EM1_AF1EM1_AMAS3_ASEM1_EPS1_FL1_GRVW2_IU1_LRVW2_PK0_PGR1_PLR0_SU0_SUM0_SUS256_SVW2_SNLL0_TT6_4_USFGRO0_VS1_VW2_WG16_16_1_WGM1
    SolutionIndex: 97
    SolutionNameMin: Cijk_Ailk_Bjlk_DB_MT64x64x8_SE_AF0EM1_AF1EM1_AMAS3_ASEM1_EPS1_FL1_GRVW2_IU1_LRVW2_PK0_PGR1_PLR1_SU0_SUM0_SUS256_SVW2_SNLL0_TT4_4_USFGRO0_VS1_VW2_WG16_16_1_WGM1
    SolutionIndex: 98
    SolutionNameMin: Cijk_Ailk_Bjlk_DB_MT64x64x8_SN_AF0EM1_AF1EM1_AMAS3_ASEM1_EPS1_FL1_GRVW2_IU1_LRVW2_PK0_PGR1_PLR1_SU0_SUM0_SUS256_SVW2_SNLL1_TT4_4_USFGRO0_VS1_VW2_WG16_16_1_WGM1
    SolutionIndex: 99
    SolutionNameMin: Cijk_Ailk_Bjlk_DB_MT64x64x8_SN_AF0EM2_AF1EM2_AMAS3_ASEM2_EPS1_FL1_GRVW2_IU1_LRVW2_PK0_PGR1_PLR1_SU0_SUM0_SUS256_SVW2_SNLL1_TT4_4_USFGRO1_VS1_VW2_WG16_16_1_WGM8
    SolutionIndex: 100
    SolutionNameMin: Cijk_Ailk_Bjlk_DB_MT64x64x8_SN_AF0EM1_AF1EM1_AMAS3_ASEM1_EPS1_FL1_GRVW2_IU1_LRVW2_PK0_PGR1_PLR0_SU0_SUM0_SUS256_SVW2_SNLL0_TT4_4_USFGRO0_VS1_VW2_WG16_16_1_WGM8
    SolutionIndex: 101
    SolutionNameMin: Cijk_Ailk_Bjlk_DB_MT48x64x4_SN_AF0EM1_AF1EM1_AMAS3_ASEM1_EPS1_FL1_GRVW2_IU1_LRVW2_PK0_PGR1_PLR0_SU0_SUM0_SUS256_SVW2_SNLL1_TT6_4_USFGRO0_VS1_VW2_WG8_16_1_WGM8
    SolutionIndex: 102
    SolutionNameMin: Cijk_Ailk_Bjlk_DB_MT48x64x4_SE_AF0EM1_AF1EM1_AMAS3_ASEM1_EPS1_FL1_GRVW2_IU1_LRVW2_PK0_PGR1_PLR0_SU0_SUM0_SUS256_SVW2_SNLL0_TT6_4_USFGRO0_VS1_VW2_WG8_16_1_WGM8
    SolutionIndex: 103
    SolutionNameMin: Cijk_Ailk_Bjlk_DB_MT48x64x4_SN_AF0EM2_AF1EM2_AMAS3_ASEM2_EPS1_FL1_GRVW2_IU1_LRVW2_PK0_PGR1_PLR0_SU0_SUM0_SUS256_SVW2_SNLL1_TT6_4_USFGRO1_VS1_VW2_WG8_16_1_WGM8
    SolutionIndex: 104
    SolutionNameMin: Cijk_Ailk_Bjlk_DB_MT96x64x8_SN_AF0EM1_AF1EM1_AMAS3_ASEM1_EPS1_FL1_GRVW2_IU1_LRVW2_PK2_PGR1_PLR1_SU0_SUM0_SUS256_SVW2_SNLL0_TT6_4_USFGRO0_VS1_VW2_WG16_16_1_WGM1
    SolutionIndex: 105
    SolutionNameMin: Cijk_Ailk_Bjlk_DB_MT96x64x4_SN_AF0EM1_AF1EM1_AMAS3_ASEM1_EPS1_FL1_GRVW2_IU1_LRVW2_PK0_PGR1_PLR0_SU0_SUM0_SUS256_SVW2_SNLL1_TT6_4_USFGRO0_VS1_VW2_WG16_16_1_WGM8
    SolutionIndex: 106
    SolutionNameMin: Cijk_Ailk_Bjlk_DB_MT64x64x8_SN_AF0EM1_AF1EM1_AMAS3_ASEM1_EPS1_FL1_GRVW2_IU1_LRVW2_PK0_PGR1_PLR1_SU0_SUM0_SUS256_SVW2_SNLL1_TT4_4_USFGRO0_VS1_VW2_WG16_16_1_WGM8
    SolutionIndex: 107
    SolutionNameMin: Cijk_Ailk_Bjlk_DB_MT48x64x4_SE_AF0EM1_AF1EM1_AMAS3_ASEM1_EPS1_FL1_GRVW2_IU1_LRVW2_PK0_PGR1_PLR0_SU0_SUM0_SUS256_SVW2_SNLL0_TT6_4_USFGRO0_VS1_VW2_WG8_16_1_WGM4
    SolutionIndex: 108
    SolutionNameMin: Cijk_Ailk_Bjlk_DB_MT64x32x4_SN_AF0EM1_AF1EM1_AMAS3_ASEM1_EPS1_FL1_GRVW2_IU1_LRVW2_PK0_PGR1_PLR0_SU0_SUM0_SUS256_SVW2_SNLL1_TT4_4_USFGRO0_VS1_VW2_WG16_8_1_WGM1
    SolutionIndex: 109
    SolutionNameMin: Cijk_Ailk_Bjlk_DB_MT64x64x8_SN_AF0EM2_AF1EM2_AMAS3_ASEM2_EPS1_FL1_GRVW2_IU1_LRVW2_PK0_PGR1_PLR0_SU0_SUM0_SUS256_SVW2_SNLL1_TT4_4_USFGRO1_VS1_VW2_WG16_16_1_WGM8
    SolutionIndex: 110
    SolutionNameMin: Cijk_Ailk_Bjlk_DB_MT48x64x4_SE_AF0EM1_AF1EM1_AMAS3_ASEM1_EPS1_FL1_GRVW2_IU1_LRVW2_PK0_PGR1_PLR0_SU0_SUM0_SUS256_SVW2_SNLL1_TT6_4_USFGRO0_VS1_VW2_WG8_16_1_WGM8
    SolutionIndex: 111
    SolutionNameMin: Cijk_Ailk_Bjlk_DB_MT64x64x8_SN_AF0EM1_AF1EM1_AMAS3_ASEM1_EPS1_FL1_GRVW2_IU1_LRVW2_PK4_PGR1_PLR0_SU0_SUM0_SUS256_SVW2_SNLL1_TT4_4_USFGRO0_VS1_VW2_WG16_16_1_WGM1
    SolutionIndex: 112
    SolutionNameMin: Cijk_Ailk_Bjlk_DB_MT64x96x4_SN_AF0EM1_AF1EM1_AMAS3_ASEM1_EPS1_FL1_GRVW2_IU1_LRVW2_PK0_PGR1_PLR0_SU0_SUM0_SUS256_SVW2_SNLL0_TT4_6_USFGRO0_VS1_VW2_WG16_16_1_WGM8
    SolutionIndex: 113
    SolutionNameMin: Cijk_Ailk_Bjlk_DB_MT64x48x4_SN_AF0EM1_AF1EM1_AMAS3_ASEM1_EPS1_FL1_GRVW2_IU1_LRVW2_PK0_PGR1_PLR0_SU0_SUM0_SUS256_SVW2_SNLL1_TT4_6_USFGRO0_VS1_VW2_WG16_8_1_WGM1
    SolutionIndex: 114
    SolutionNameMin: Cijk_Ailk_Bjlk_DB_MT64x64x8_SN_AF0EM1_AF1EM1_AMAS3_ASEM1_EPS1_FL1_GRVW2_IU1_LRVW2_PK0_PGR1_PLR1_SU0_SUM0_SUS256_SVW2_SNLL0_TT4_4_USFGRO0_VS1_VW2_WG16_16_1_WGM8
    SolutionIndex: 115
    SolutionNameMin: Cijk_Ailk_Bjlk_DB_MT64x32x4_SE_AF0EM1_AF1EM1_AMAS3_ASEM1_EPS1_FL1_GRVW2_IU1_LRVW2_PK0_PGR1_PLR0_SU0_SUM0_SUS256_SVW2_SNLL0_TT4_4_USFGRO0_VS1_VW2_WG16_8_1_WGM4
    SolutionIndex: 116
    SolutionNameMin: Cijk_Ailk_Bjlk_DB_MT64x96x8_SN_AF0EM1_AF1EM1_AMAS3_ASEM1_EPS1_FL1_GRVW2_IU1_LRVW2_PK0_PGR1_PLR1_SU0_SUM0_SUS256_SVW2_SNLL1_TT4_6_USFGRO0_VS1_VW2_WG16_16_1_WGM1
    SolutionIndex: 117
    SolutionNameMin: Cijk_Ailk_Bjlk_DB_MT64x96x4_SE_AF0EM1_AF1EM1_AMAS3_ASEM1_EPS1_FL1_GRVW2_IU1_LRVW2_PK0_PGR1_PLR0_SU0_SUM0_SUS256_SVW2_SNLL0_TT4_6_USFGRO0_VS1_VW2_WG16_16_1_WGM8
    SolutionIndex: 118
    SolutionNameMin: Cijk_Ailk_Bjlk_DB_MT64x64x8_SN_AF0EM1_AF1EM1_AMAS3_ASEM1_EPS1_FL1_GRVW2_IU1_LRVW2_PK0_PGR1_PLR0_SU0_SUM0_SUS256_SVW2_SNLL1_TT4_4_USFGRO0_VS1_VW2_WG16_16_1_WGM8
    SolutionIndex: 119
    SolutionNameMin: Cijk_Ailk_Bjlk_DB_MT64x128x4_SN_AF0EM1_AF1EM1_AMAS3_ASEM1_EPS1_FL1_GRVW2_IU1_LRVW2_PK4_PGR1_PLR1_SU0_SUM0_SUS256_SVW2_SNLL0_TT4_8_USFGRO0_VS1_VW2_WG16_16_1_WGM1
    SolutionIndex: 120
    SolutionNameMin: Cijk_Ailk_Bjlk_DB_MT64x64x8_SE_AF0EM1_AF1EM1_AMAS3_ASEM1_EPS1_FL1_GRVW2_IU1_LRVW2_PK0_PGR1_PLR0_SU0_SUM0_SUS256_SVW2_SNLL0_TT4_4_USFGRO0_VS1_VW2_WG16_16_1_WGM8
    SolutionIndex: 121
    SolutionNameMin: Cijk_Ailk_Bjlk_DB_MT64x64x8_SE_AF0EM1_AF1EM1_AMAS3_ASEM1_EPS1_FL1_GRVW2_IU1_LRVW2_PK0_PGR1_PLR0_SU0_SUM0_SUS256_SVW2_SNLL1_TT4_4_USFGRO0_VS1_VW2_WG16_16_1_WGM8
    SolutionIndex: 122
    SolutionNameMin: Cijk_Ailk_Bjlk_DB_MT96x64x4_SE_AF0EM1_AF1EM1_AMAS3_ASEM1_EPS1_FL1_GRVW2_IU1_LRVW2_PK0_PGR1_PLR0_SU0_SUM0_SUS256_SVW2_SNLL0_TT6_4_USFGRO0_VS1_VW2_WG16_16_1_WGM8
    SolutionIndex: 123
    SolutionNameMin: Cijk_Ailk_Bjlk_DB_MT96x64x4_SE_AF0EM1_AF1EM1_AMAS3_ASEM1_EPS1_FL1_GRVW2_IU1_LRVW2_PK0_PGR1_PLR0_SU0_SUM0_SUS256_SVW2_SNLL1_TT6_4_USFGRO0_VS1_VW2_WG16_16_1_WGM8
    SolutionIndex: 124
    SolutionNameMin: Cijk_Ailk_Bjlk_DB_MT64x64x8_SE_AF0EM1_AF1EM1_AMAS3_ASEM1_EPS1_FL1_GRVW2_IU1_LRVW2_PK0_PGR1_PLR0_SU0_SUM0_SUS256_SVW2_SNLL1_TT4_4_USFGRO0_VS1_VW2_WG16_16_1_WGM4
    SolutionIndex: 125
    SolutionNameMin: Cijk_Ailk_Bjlk_DB_MT96x64x4_SN_AF0EM2_AF1EM2_AMAS3_ASEM2_EPS1_FL1_GRVW2_IU1_LRVW2_PK0_PGR1_PLR0_SU0_SUM0_SUS256_SVW2_SNLL1_TT6_4_USFGRO1_VS1_VW2_WG16_16_1_WGM8
    SolutionIndex: 126
    SolutionNameMin: Cijk_Ailk_Bjlk_DB_MT64x64x8_SN_AF0EM1_AF1EM1_AMAS3_ASEM1_EPS1_FL1_GRVW2_IU1_LRVW2_PK0_PGR1_PLR0_SU0_SUM0_SUS256_SVW2_SNLL1_TT4_4_USFGRO0_VS1_VW2_WG16_16_1_WGM1
    SolutionIndex: 127
    SolutionNameMin: Cijk_Ailk_Bjlk_DB_MT128x64x8_SN_AF0EM1_AF1EM1_AMAS3_ASEM1_EPS1_FL1_GRVW2_IU1_LRVW2_PK2_PGR1_PLR0_SU0_SUM0_SUS256_SVW2_SNLL0_TT8_4_USFGRO0_VS1_VW2_WG16_16_1_WGM1
    SolutionIndex: 128
    SolutionNameMin: Cijk_Ailk_Bjlk_DB_MT64x64x8_SE_AF0EM1_AF1EM1_AMAS3_ASEM1_EPS1_FL1_GRVW2_IU1_LRVW2_PK0_PGR1_PLR1_SU0_SUM0_SUS256_SVW2_SNLL0_TT4_4_USFGRO0_VS1_VW2_WG16_16_1_WGM8
    SolutionIndex: 129
    SolutionNameMin: Cijk_Ailk_Bjlk_DB_MT96x64x4_SE_AF0EM1_AF1EM1_AMAS3_ASEM1_EPS1_FL1_GRVW2_IU1_LRVW2_PK0_PGR1_PLR0_SU0_SUM0_SUS256_SVW2_SNLL0_TT6_4_USFGRO0_VS1_VW2_WG16_16_1_WGM4
    SolutionIndex: 130
    SolutionNameMin: Cijk_Ailk_Bjlk_DB_MT32x64x4_SN_AF0EM1_AF1EM1_AMAS3_ASEM1_EPS1_FL1_GRVW2_IU1_LRVW2_PK0_PGR1_PLR0_SU0_SUM0_SUS256_SVW2_SNLL1_TT4_4_USFGRO0_VS1_VW2_WG8_16_1_WGM8
    SolutionIndex: 131
    SolutionNameMin: Cijk_Ailk_Bjlk_DB_MT64x64x8_SE_AF0EM1_AF1EM1_AMAS3_ASEM1_EPS1_FL1_GRVW2_IU1_LRVW2_PK0_PGR1_PLR0_SU0_SUM0_SUS256_SVW2_SNLL0_TT4_4_USFGRO0_VS1_VW2_WG16_16_1_WGM1
    SolutionIndex: 132
    SolutionNameMin: Cijk_Ailk_Bjlk_DB_MT64x64x8_SE_AF0EM1_AF1EM1_AMAS3_ASEM1_EPS1_FL1_GRVW2_IU1_LRVW2_PK0_PGR1_PLR1_SU0_SUM0_SUS256_SVW2_SNLL1_TT4_4_USFGRO0_VS1_VW2_WG16_16_1_WGM8
    SolutionIndex: 133
    SolutionNameMin: Cijk_Ailk_Bjlk_DB_MT96x64x4_SE_AF0EM1_AF1EM1_AMAS3_ASEM1_EPS1_FL1_GRVW2_IU1_LRVW2_PK0_PGR1_PLR0_SU0_SUM0_SUS256_SVW2_SNLL1_TT6_4_USFGRO0_VS1_VW2_WG16_16_1_WGM4
    SolutionIndex: 134
    SolutionNameMin: Cijk_Ailk_Bjlk_DB_MT64x64x8_SE_AF0EM1_AF1EM1_AMAS3_ASEM1_EPS1_FL1_GRVW2_IU1_LRVW2_PK0_PGR1_PLR1_SU0_SUM0_SUS256_SVW2_SNLL1_TT4_4_USFGRO0_VS1_VW2_WG16_16_1_WGM4
    SolutionIndex: 135
    SolutionNameMin: Cijk_Ailk_Bjlk_DB_MT64x64x8_SE_AF0EM1_AF1EM1_AMAS3_ASEM1_EPS1_FL1_GRVW2_IU1_LRVW2_PK0_PGR1_PLR0_SU0_SUM0_SUS256_SVW2_SNLL1_TT4_4_USFGRO0_VS1_VW2_WG16_16_1_WGM1
    SolutionIndex: 136
    SolutionNameMin: Cijk_Ailk_Bjlk_DB_MT128x32x4_SN_AF0EM1_AF1EM1_AMAS3_ASEM1_EPS1_FL1_GRVW2_IU1_LRVW2_PK4_PGR1_PLR0_SU0_SUM0_SUS256_SVW2_SNLL1_TT8_4_USFGRO0_VS1_VW2_WG16_8_1_WGM1
    SolutionIndex: 137
    SolutionNameMin: Cijk_Ailk_Bjlk_DB_MT64x64x8_SE_AF0EM1_AF1EM1_AMAS3_ASEM1_EPS1_FL1_GRVW2_IU1_LRVW2_PK0_PGR1_PLR1_SU0_SUM0_SUS256_SVW2_SNLL0_TT4_4_USFGRO0_VS1_VW2_WG16_16_1_WGM4
    SolutionIndex: 138
    SolutionNameMin: Cijk_Ailk_Bjlk_DB_MT32x32x16_SE_AF0EM1_AF1EM1_AMAS3_ASEM1_EPS0_FL0_GRVW2_IU1_LRVW2_PK0_PGR0_PLR1_SU16_SUM1_SUS128_SVW4_SNLL0_TT2_4_USFGROn1_VSn1_VW2_WG16_8_1_WGM8
    SolutionIndex: 139
    SolutionNameMin: Cijk_Ailk_Bjlk_DB_MT64x64x8_SN_AF0EM1_AF1EM1_AMAS3_ASEM1_EPS1_FL0_GRVW2_IU1_LRVW2_PK0_PGR1_PLR1_SU0_SUM0_SUS256_SVW2_SNLL1_TT4_4_USFGRO0_VS1_VW2_WG16_16_1_WGM8
    SolutionIndex: 140
    SolutionNameMin: Cijk_Ailk_Bjlk_DB_MT64x64x8_SN_AF0EM1_AF1EM1_AMAS3_ASEM1_EPS1_FL1_GRVW2_IU1_LRVW2_PK4_PGR1_PLR1_SU0_SUM0_SUS256_SVW2_SNLL1_TT4_4_USFGRO0_VS1_VW2_WG16_16_1_WGM8
    SolutionIndex: 141
    SolutionNameMin: Cijk_Ailk_Bjlk_DB_MT64x32x8_SE_AF0EM1_AF1EM1_AMAS3_ASEM1_EPS1_FL1_GRVW2_IU1_LRVW2_PK0_PGR1_PLR1_SU0_SUM0_SUS256_SVW2_SNLL1_TT4_4_USFGRO0_VS1_VW2_WG16_8_1_WGM4
    SolutionIndex: 142
    SolutionNameMin: Cijk_Ailk_Bjlk_DB_MT64x32x8_SE_AF0EM1_AF1EM1_AMAS3_ASEM1_EPS1_FL1_GRVW2_IU1_LRVW2_PK0_PGR1_PLR1_SU0_SUM0_SUS256_SVW2_SNLL0_TT4_4_USFGRO0_VS1_VW2_WG16_8_1_WGM1
    SolutionIndex: 143
    SolutionNameMin: Cijk_Ailk_Bjlk_DB_MT64x32x8_SE_AF0EM1_AF1EM1_AMAS3_ASEM1_EPS1_FL1_GRVW2_IU1_LRVW2_PK0_PGR1_PLR1_SU0_SUM0_SUS256_SVW2_SNLL1_TT4_4_USFGRO0_VS1_VW2_WG16_8_1_WGM1
    SolutionIndex: 144
    SolutionNameMin: Cijk_Ailk_Bjlk_DB_MT64x32x4_SE_AF0EM1_AF1EM1_AMAS3_ASEM1_EPS1_FL1_GRVW2_IU1_LRVW2_PK0_PGR1_PLR0_SU0_SUM0_SUS256_SVW2_SNLL1_TT4_4_USFGRO0_VS1_VW2_WG16_8_1_WGM8
    SolutionIndex: 145
    SolutionNameMin: Cijk_Ailk_Bjlk_DB_MT64x32x4_SN_AF0EM1_AF1EM1_AMAS3_ASEM1_EPS1_FL1_GRVW2_IU1_LRVW2_PK0_PGR1_PLR1_SU0_SUM0_SUS256_SVW2_SNLL1_TT4_4_USFGRO0_VS1_VW2_WG16_8_1_WGM1
    SolutionIndex: 146
    SolutionNameMin: Cijk_Ailk_Bjlk_DB_MT96x32x4_SN_AF0EM1_AF1EM1_AMAS3_ASEM1_EPS1_FL1_GRVW2_IU1_LRVW2_PK0_PGR1_PLR1_SU0_SUM0_SUS256_SVW2_SNLL1_TT6_4_USFGRO0_VS1_VW2_WG16_8_1_WGM1
    SolutionIndex: 147
    SolutionNameMin: Cijk_Ailk_Bjlk_DB_MT64x64x8_SE_AF0EM1_AF1EM1_AMAS3_ASEM1_EPS1_FL1_GRVW2_IU1_LRVW2_PK0_PGR1_PLR1_SU0_SUM0_SUS256_SVW2_SNLL1_TT4_4_USFGRO0_VS1_VW2_WG16_16_1_WGM1
    SolutionIndex: 148
    SolutionNameMin: Cijk_Ailk_Bjlk_DB_MT64x32x8_SN_AF0EM1_AF1EM1_AMAS3_ASEM1_EPS1_FL1_GRVW2_IU1_LRVW2_PK0_PGR1_PLR1_SU0_SUM0_SUS256_SVW2_SNLL1_TT4_4_USFGRO0_VS1_VW2_WG16_8_1_WGM1
    SolutionIndex: 149
    SolutionNameMin: Cijk_Ailk_Bjlk_DB_MT128x64x8_SE_AF0EM1_AF1EM1_AMAS3_ASEM1_EPS1_FL1_GRVW2_IU1_LRVW2_PK0_PGR1_PLR0_SU0_SUM0_SUS256_SVW2_SNLL1_TT4_4_USFGRO0_VS1_VW2_WG32_16_1_WGM4
    SolutionIndex: 150
    SolutionNameMin: Cijk_Ailk_Bjlk_DB_MT64x128x4_SN_AF0EM1_AF1EM1_AMAS3_ASEM1_EPS1_FL1_GRVW2_IU1_LRVW2_PK0_PGR1_PLR1_SU0_SUM0_SUS256_SVW2_SNLL0_TT4_8_USFGRO0_VS1_VW2_WG16_16_1_WGM1
    SolutionIndex: 151
    SolutionNameMin: Cijk_Ailk_Bjlk_DB_MT64x64x8_SN_AF0EM1_AF1EM1_AMAS3_ASEM1_EPS1_FL1_GRVW2_IU1_LRVW2_PK0_PGR1_PLR1_SU0_SUM0_SUS256_SVW2_SNLL0_TT4_4_USFGRO0_VS1_VW2_WG16_16_1_WGM1
    SolutionIndex: 152
    SolutionNameMin: Cijk_Ailk_Bjlk_DB_MT64x32x4_SE_AF0EM1_AF1EM1_AMAS3_ASEM1_EPS1_FL1_GRVW2_IU1_LRVW2_PK0_PGR1_PLR1_SU0_SUM0_SUS256_SVW2_SNLL1_TT4_4_USFGRO0_VS1_VW2_WG16_8_1_WGM4
    SolutionIndex: 153
    SolutionNameMin: Cijk_Ailk_Bjlk_DB_MT64x64x8_SN_AF0EM1_AF1EM1_AMAS3_ASEM1_EPS1_FL1_GRVW2_IU1_LRVW2_PK4_PGR1_PLR0_SU0_SUM0_SUS256_SVW2_SNLL0_TT4_4_USFGRO0_VS1_VW2_WG16_16_1_WGM8
    SolutionIndex: 154
    SolutionNameMin: Cijk_Ailk_Bjlk_DB_MT64x64x4_SN_AF0EM1_AF1EM1_AMAS3_ASEM1_EPS1_FL0_GRVW2_IU1_LRVW2_PK0_PGR1_PLR1_SU0_SUM0_SUS256_SVW2_SNLL1_TT4_4_USFGRO1_VS1_VW2_WG16_16_1_WGM8
    SolutionIndex: 155
    SolutionNameMin: Cijk_Ailk_Bjlk_DB_MT32x64x4_SE_AF0EM1_AF1EM1_AMAS3_ASEM1_EPS1_FL1_GRVW2_IU1_LRVW2_PK0_PGR1_PLR0_SU0_SUM0_SUS256_SVW2_SNLL1_TT4_4_USFGRO0_VS1_VW2_WG8_16_1_WGM1
    SolutionIndex: 156
    SolutionNameMin: Cijk_Ailk_Bjlk_DB_MT64x32x4_SE_AF0EM1_AF1EM1_AMAS3_ASEM1_EPS1_FL1_GRVW2_IU1_LRVW2_PK0_PGR1_PLR0_SU0_SUM0_SUS256_SVW2_SNLL0_TT4_4_USFGRO0_VS1_VW2_WG16_8_1_WGM8
    SolutionIndex: 157
    SolutionNameMin: Cijk_Ailk_Bjlk_DB_MT64x64x8_SN_AF0EM1_AF1EM1_AMAS3_ASEM1_EPS1_FL1_GRVW2_IU1_LRVW2_PK4_PGR1_PLR0_SU0_SUM0_SUS256_SVW2_SNLL0_TT4_4_USFGRO0_VS1_VW2_WG16_16_1_WGM1
    SolutionIndex: 158
    SolutionNameMin: Cijk_Ailk_Bjlk_DB_MT32x64x4_SE_AF0EM1_AF1EM1_AMAS3_ASEM1_EPS1_FL1_GRVW2_IU1_LRVW2_PK0_PGR1_PLR0_SU0_SUM0_SUS256_SVW2_SNLL0_TT4_4_USFGRO0_VS1_VW2_WG8_16_1_WGM1
    SolutionIndex: 159
    SolutionNameMin: Cijk_Ailk_Bjlk_DB_MT32x64x8_SE_AF0EM1_AF1EM1_AMAS3_ASEM1_EPS1_FL1_GRVW2_IU1_LRVW2_PK0_PGR1_PLR1_SU0_SUM0_SUS256_SVW2_SNLL0_TT4_4_USFGRO0_VS1_VW2_WG8_16_1_WGM8
    SolutionIndex: 160
    SolutionNameMin: Cijk_Ailk_Bjlk_DB_MT128x64x8_SE_AF0EM1_AF1EM1_AMAS3_ASEM1_EPS1_FL1_GRVW2_IU1_LRVW2_PK0_PGR1_PLR0_SU0_SUM0_SUS256_SVW2_SNLL0_TT4_4_USFGRO0_VS1_VW2_WG32_16_1_WGM4
    SolutionIndex: 161
    SolutionNameMin: Cijk_Ailk_Bjlk_DB_MT96x64x8_SN_AF0EM1_AF1EM1_AMAS3_ASEM1_EPS1_FL1_GRVW2_IU1_LRVW2_PK4_PGR1_PLR1_SU0_SUM0_SUS256_SVW2_SNLL0_TT6_4_USFGRO0_VS1_VW2_WG16_16_1_WGM8
    SolutionIndex: 162
    SolutionNameMin: Cijk_Ailk_Bjlk_DB_MT32x64x8_SE_AF0EM1_AF1EM1_AMAS3_ASEM1_EPS1_FL1_GRVW2_IU1_LRVW2_PK0_PGR1_PLR1_SU0_SUM0_SUS256_SVW2_SNLL1_TT4_4_USFGRO0_VS1_VW2_WG8_16_1_WGM8
    SolutionIndex: 163
    SolutionNameMin: Cijk_Ailk_Bjlk_DB_MT64x64x8_SN_AF0EM1_AF1EM1_AMAS3_ASEM1_EPS1_FL1_GRVW2_IU1_LRVW2_PK4_PGR1_PLR0_SU0_SUM0_SUS256_SVW2_SNLL1_TT4_4_USFGRO0_VS1_VW2_WG16_16_1_WGM8
    SolutionIndex: 164
    SolutionNameMin: Cijk_Ailk_Bjlk_DB_MT64x32x4_SN_AF0EM1_AF1EM1_AMAS3_ASEM1_EPS1_FL1_GRVW2_IU1_LRVW2_PK0_PGR1_PLR0_SU0_SUM0_SUS256_SVW2_SNLL0_TT4_4_USFGRO0_VS1_VW2_WG16_8_1_WGM8
    SolutionIndex: 165
    SolutionNameMin: Cijk_Ailk_Bjlk_DB_MT32x64x8_SE_AF0EM1_AF1EM1_AMAS3_ASEM1_EPS1_FL1_GRVW2_IU1_LRVW2_PK0_PGR1_PLR1_SU0_SUM0_SUS256_SVW2_SNLL1_TT4_4_USFGRO0_VS1_VW2_WG8_16_1_WGM4
    SolutionIndex: 166
    SolutionNameMin: Cijk_Ailk_Bjlk_DB_MT96x64x4_SN_AF0EM1_AF1EM1_AMAS3_ASEM1_EPS1_FL1_GRVW2_IU1_LRVW2_PK4_PGR1_PLR0_SU0_SUM0_SUS256_SVW2_SNLL0_TT6_4_USFGRO0_VS1_VW2_WG16_16_1_WGM8
    SolutionIndex: 167
    SolutionNameMin: Cijk_Ailk_Bjlk_DB_MT128x64x8_SE_AF0EM1_AF1EM1_AMAS3_ASEM1_EPS1_FL1_GRVW2_IU1_LRVW2_PK0_PGR1_PLR0_SU0_SUM0_SUS256_SVW2_SNLL0_TT4_4_USFGRO0_VS1_VW2_WG32_16_1_WGM1
    SolutionIndex: 168
    SolutionNameMin: Cijk_Ailk_Bjlk_DB_MT96x64x8_SN_AF0EM1_AF1EM1_AMAS3_ASEM1_EPS1_FL1_GRVW2_IU1_LRVW2_PK2_PGR1_PLR1_SU0_SUM0_SUS256_SVW2_SNLL0_TT6_4_USFGRO0_VS1_VW2_WG16_16_1_WGM8
    SolutionIndex: 169
    SolutionNameMin: Cijk_Ailk_Bjlk_DB_MT32x64x8_SN_AF0EM1_AF1EM1_AMAS3_ASEM1_EPS1_FL1_GRVW2_IU1_LRVW2_PK0_PGR1_PLR1_SU0_SUM0_SUS256_SVW2_SNLL1_TT4_4_USFGRO0_VS1_VW2_WG8_16_1_WGM1
    SolutionIndex: 170
    SolutionNameMin: Cijk_Ailk_Bjlk_DB_MT128x64x4_SE_AF0EM1_AF1EM1_AMAS3_ASEM1_EPS1_FL1_GRVW2_IU1_LRVW2_PK0_PGR1_PLR1_SU0_SUM0_SUS256_SVW2_SNLL1_TT8_4_USFGRO0_VS1_VW2_WG16_16_1_WGM4
    SolutionIndex: 171
    SolutionNameMin: Cijk_Ailk_Bjlk_DB_MT64x32x12_SN_AF0EM2_AF1EM2_AMAS3_ASEM2_EPS1_FL1_GRVW2_IU1_LRVW2_PK0_PGR1_PLR1_SU0_SUM0_SUS256_SVW2_SNLL1_TT4_4_USFGRO1_VS1_VW2_WG16_8_1_WGM8
    SolutionIndex: 172
    SolutionNameMin: Cijk_Ailk_Bjlk_DB_MT64x32x4_SE_AF0EM1_AF1EM1_AMAS3_ASEM1_EPS1_FL1_GRVW2_IU1_LRVW2_PK0_PGR1_PLR1_SU0_SUM0_SUS256_SVW2_SNLL0_TT4_4_USFGRO0_VS1_VW2_WG16_8_1_WGM1
    SolutionIndex: 173
    SolutionNameMin: Cijk_Ailk_Bjlk_DB_MT64x32x4_SN_AF0EM1_AF1EM1_AMAS3_ASEM1_EPS1_FL1_GRVW2_IU1_LRVW2_PK0_PGR1_PLR0_SU0_SUM0_SUS256_SVW2_SNLL0_TT4_4_USFGRO0_VS1_VW2_WG16_8_1_WGM1
    SolutionIndex: 174
    SolutionNameMin: Cijk_Ailk_Bjlk_DB_MT32x64x8_SE_AF0EM1_AF1EM1_AMAS3_ASEM1_EPS1_FL1_GRVW2_IU1_LRVW2_PK0_PGR1_PLR1_SU0_SUM0_SUS256_SVW2_SNLL1_TT4_4_USFGRO0_VS1_VW2_WG8_16_1_WGM1
    SolutionIndex: 175
    SolutionNameMin: Cijk_Ailk_Bjlk_DB_MT96x64x8_SE_AF0EM1_AF1EM1_AMAS3_ASEM1_EPS1_FL1_GRVW2_IU1_LRVW2_PK0_PGR1_PLR1_SU0_SUM0_SUS256_SVW2_SNLL1_TT6_4_USFGRO0_VS1_VW2_WG16_16_1_WGM8
    SolutionIndex: 176
    SolutionNameMin: Cijk_Ailk_Bjlk_DB_MT48x64x4_SE_AF0EM1_AF1EM1_AMAS3_ASEM1_EPS1_FL1_GRVW2_IU1_LRVW2_PK0_PGR1_PLR0_SU0_SUM0_SUS256_SVW2_SNLL0_TT6_4_USFGRO0_VS1_VW2_WG8_16_1_WGM1
    SolutionIndex: 177
    SolutionNameMin: Cijk_Ailk_Bjlk_DB_MT64x32x4_SE_AF0EM1_AF1EM1_AMAS3_ASEM1_EPS1_FL1_GRVW2_IU1_LRVW2_PK0_PGR1_PLR1_SU0_SUM0_SUS256_SVW2_SNLL1_TT4_4_USFGRO0_VS1_VW2_WG16_8_1_WGM8
    SolutionIndex: 178
    SolutionNameMin: Cijk_Ailk_Bjlk_DB_MT64x128x4_SN_AF0EM1_AF1EM1_AMAS3_ASEM1_EPS1_FL1_GRVW2_IU1_LRVW2_PK0_PGR1_PLR1_SU0_SUM0_SUS256_SVW2_SNLL1_TT4_8_USFGRO0_VS1_VW2_WG16_16_1_WGM1
    SolutionIndex: 179
    SolutionNameMin: Cijk_Ailk_Bjlk_DB_MT96x32x8_SN_AF0EM1_AF1EM1_AMAS3_ASEM1_EPS1_FL1_GRVW2_IU1_LRVW2_PK0_PGR1_PLR1_SU0_SUM0_SUS256_SVW2_SNLL1_TT6_4_USFGRO0_VS1_VW2_WG16_8_1_WGM8
    SolutionIndex: 180
    SolutionNameMin: Cijk_Ailk_Bjlk_DB_MT64x128x4_SE_AF0EM1_AF1EM1_AMAS3_ASEM1_EPS1_FL1_GRVW2_IU1_LRVW2_PK0_PGR1_PLR1_SU0_SUM0_SUS256_SVW2_SNLL0_TT4_8_USFGRO0_VS1_VW2_WG16_16_1_WGM4
    SolutionIndex: 181
    SolutionNameMin: Cijk_Ailk_Bjlk_DB_MT96x96x4_SE_AF0EM1_AF1EM1_AMAS3_ASEM1_EPS1_FL1_GRVW2_IU1_LRVW2_PK0_PGR1_PLR0_SU0_SUM0_SUS256_SVW2_SNLL0_TT6_6_USFGRO0_VS1_VW2_WG16_16_1_WGM8
    SolutionIndex: 182
    SolutionNameMin: Cijk_Ailk_Bjlk_DB_MT128x64x4_SE_AF0EM1_AF1EM1_AMAS3_ASEM1_EPS1_FL1_GRVW2_IU1_LRVW2_PK0_PGR1_PLR1_SU0_SUM0_SUS256_SVW2_SNLL0_TT8_4_USFGRO0_VS1_VW2_WG16_16_1_WGM4
    SolutionIndex: 183
    SolutionNameMin: Cijk_Ailk_Bjlk_DB_MT96x32x8_SE_AF0EM1_AF1EM1_AMAS3_ASEM1_EPS1_FL1_GRVW2_IU1_LRVW2_PK0_PGR1_PLR1_SU0_SUM0_SUS256_SVW2_SNLL0_TT6_4_USFGRO0_VS1_VW2_WG16_8_1_WGM4
    SolutionIndex: 184
    SolutionNameMin: Cijk_Ailk_Bjlk_DB_MT96x32x8_SE_AF0EM1_AF1EM1_AMAS3_ASEM1_EPS1_FL1_GRVW2_IU1_LRVW2_PK0_PGR1_PLR1_SU0_SUM0_SUS256_SVW2_SNLL1_TT6_4_USFGRO0_VS1_VW2_WG16_8_1_WGM8
    SolutionIndex: 185
    SolutionNameMin: Cijk_Ailk_Bjlk_DB_MT64x64x4_SN_AF0EM1_AF1EM1_AMAS3_ASEM1_EPS1_FL1_GRVW2_IU1_LRVW2_PK4_PGR1_PLR1_SU0_SUM0_SUS256_SVW2_SNLL1_TT4_8_USFGRO0_VS1_VW2_WG16_8_1_WGM8
    SolutionIndex: 186
    SolutionNameMin: Cijk_Ailk_Bjlk_DB_MT128x64x4_SE_AF0EM1_AF1EM1_AMAS3_ASEM1_EPS1_FL1_GRVW2_IU1_LRVW2_PK0_PGR1_PLR1_SU0_SUM0_SUS256_SVW2_SNLL0_TT8_4_USFGRO0_VS1_VW2_WG16_16_1_WGM1
    SolutionIndex: 187
    SolutionNameMin: Cijk_Ailk_Bjlk_DB_MT64x32x8_SE_AF0EM1_AF1EM1_AMAS0_ASEM1_EPS1_FL0_GRVW1_IU1_LRVW1_PK0_PGR1_PLR1_SU0_SUM0_SUS256_SVW2_SNLL1_TT4_4_USFGRO1_VS1_VW1_WG16_8_1_WGM1
    SolutionIndex: 188
    SolutionNameMin: Cijk_Ailk_Bjlk_DB_MT64x32x8_SE_AF0EM1_AF1EM1_AMAS3_ASEM1_EPS1_FL1_GRVW2_IU1_LRVW2_PK0_PGR1_PLR1_SU0_SUM0_SUS256_SVW2_SNLL1_TT4_4_USFGRO0_VS1_VW2_WG16_8_1_WGM8
    SolutionIndex: 189
    SolutionNameMin: Cijk_Ailk_Bjlk_DB_MT64x32x8_SE_AF0EM1_AF1EM1_AMAS3_ASEM1_EPS1_FL1_GRVW2_IU1_LRVW2_PK0_PGR1_PLR1_SU0_SUM0_SUS256_SVW2_SNLL0_TT4_4_USFGRO0_VS1_VW2_WG16_8_1_WGM8
    SolutionIndex: 190
    SolutionNameMin: Cijk_Ailk_Bjlk_DB_MT64x64x8_SN_AF0EM1_AF1EM1_AMAS3_ASEM1_EPS1_FL1_GRVW2_IU1_LRVW2_PK2_PGR1_PLR1_SU0_SUM0_SUS256_SVW2_SNLL1_TT4_4_USFGRO0_VS1_VW2_WG16_16_1_WGM1
    SolutionIndex: 191
    SolutionNameMin: Cijk_Ailk_Bjlk_DB_MT64x32x8_SN_AF0EM1_AF1EM1_AMAS3_ASEM1_EPS1_FL1_GRVW2_IU1_LRVW2_PK0_PGR1_PLR1_SU0_SUM0_SUS256_SVW2_SNLL0_TT4_4_USFGRO0_VS1_VW2_WG16_8_1_WGM1
    SolutionIndex: 192
    SolutionNameMin: Cijk_Ailk_Bjlk_DB_MT64x128x4_SE_AF0EM1_AF1EM1_AMAS3_ASEM1_EPS1_FL1_GRVW2_IU1_LRVW2_PK0_PGR1_PLR1_SU0_SUM0_SUS256_SVW2_SNLL1_TT4_8_USFGRO0_VS1_VW2_WG16_16_1_WGM1
    SolutionIndex: 193
    SolutionNameMin: Cijk_Ailk_Bjlk_DB_MT96x64x8_SE_AF0EM1_AF1EM1_AMAS3_ASEM1_EPS1_FL1_GRVW2_IU1_LRVW2_PK0_PGR1_PLR1_SU0_SUM0_SUS256_SVW2_SNLL1_TT6_4_USFGRO0_VS1_VW2_WG16_16_1_WGM4
    SolutionIndex: 194
    SolutionNameMin: Cijk_Ailk_Bjlk_DB_MT96x64x8_SE_AF0EM1_AF1EM1_AMAS3_ASEM1_EPS1_FL1_GRVW2_IU1_LRVW2_PK0_PGR1_PLR1_SU0_SUM0_SUS256_SVW2_SNLL0_TT6_4_USFGRO0_VS1_VW2_WG16_16_1_WGM8
    SolutionIndex: 195
    SolutionNameMin: Cijk_Ailk_Bjlk_DB_MT96x64x4_SE_AF0EM1_AF1EM1_AMAS3_ASEM1_EPS1_FL1_GRVW2_IU1_LRVW2_PK0_PGR1_PLR1_SU0_SUM0_SUS256_SVW2_SNLL0_TT6_4_USFGRO0_VS1_VW2_WG16_16_1_WGM1
    SolutionIndex: 196
    SolutionNameMin: Cijk_Ailk_Bjlk_DB_MT64x32x8_SE_AF0EM1_AF1EM1_AMAS3_ASEM1_EPS1_FL1_GRVW2_IU1_LRVW2_PK0_PGR1_PLR1_SU0_SUM0_SUS256_SVW2_SNLL0_TT4_4_USFGRO0_VS1_VW2_WG16_8_1_WGM4
    SolutionIndex: 197
    SolutionNameMin: Cijk_Ailk_Bjlk_DB_MT64x32x4_SE_AF0EM1_AF1EM1_AMAS3_ASEM1_EPS1_FL1_GRVW2_IU1_LRVW2_PK0_PGR1_PLR0_SU0_SUM0_SUS256_SVW2_SNLL1_TT4_4_USFGRO0_VS1_VW2_WG16_8_1_WGM4
    SolutionIndex: 198
    SolutionNameMin: Cijk_Ailk_Bjlk_DB_MT128x64x4_SE_AF0EM1_AF1EM1_AMAS3_ASEM1_EPS1_FL1_GRVW2_IU1_LRVW2_PK0_PGR1_PLR1_SU0_SUM0_SUS256_SVW2_SNLL1_TT8_4_USFGRO0_VS1_VW2_WG16_16_1_WGM1
    SolutionIndex: 199
    SolutionNameMin: Cijk_Ailk_Bjlk_DB_MT96x64x8_SE_AF0EM1_AF1EM1_AMAS3_ASEM1_EPS1_FL1_GRVW2_IU1_LRVW2_PK0_PGR1_PLR1_SU0_SUM0_SUS256_SVW2_SNLL1_TT6_4_USFGRO0_VS1_VW2_WG16_16_1_WGM1
    SolutionIndex: 200
    SolutionNameMin: Cijk_Ailk_Bjlk_DB_MT96x64x8_SE_AF0EM1_AF1EM1_AMAS3_ASEM1_EPS1_FL1_GRVW2_IU1_LRVW2_PK0_PGR1_PLR1_SU0_SUM0_SUS256_SVW2_SNLL0_TT6_4_USFGRO0_VS1_VW2_WG16_16_1_WGM4
    SolutionIndex: 201
    SolutionNameMin: Cijk_Ailk_Bjlk_DB_MT64x128x4_SE_AF0EM1_AF1EM1_AMAS3_ASEM1_EPS1_FL1_GRVW2_IU1_LRVW2_PK0_PGR1_PLR1_SU0_SUM0_SUS256_SVW2_SNLL1_TT4_8_USFGRO0_VS1_VW2_WG16_16_1_WGM4
    SolutionIndex: 202
    SolutionNameMin: Cijk_Ailk_Bjlk_DB_MT64x64x4_SN_AF0EM1_AF1EM1_AMAS3_ASEM1_EPS1_FL1_GRVW2_IU1_LRVW2_PK0_PGR1_PLR1_SU0_SUM0_SUS256_SVW2_SNLL1_TT4_8_USFGRO0_VS1_VW2_WG16_8_1_WGM1
    SolutionIndex: 203
    SolutionNameMin: Cijk_Ailk_Bjlk_DB_MT32x64x4_SE_AF0EM1_AF1EM1_AMAS3_ASEM1_EPS1_FL1_GRVW2_IU1_LRVW2_PK0_PGR1_PLR0_SU0_SUM0_SUS256_SVW2_SNLL0_TT4_4_USFGRO0_VS1_VW2_WG8_16_1_WGM8
    SolutionIndex: 204
    SolutionNameMin: Cijk_Ailk_Bjlk_DB_MT96x64x4_SE_AF0EM1_AF1EM1_AMAS3_ASEM1_EPS1_FL1_GRVW2_IU1_LRVW2_PK0_PGR1_PLR0_SU0_SUM0_SUS256_SVW2_SNLL1_TT6_4_USFGRO0_VS1_VW2_WG16_16_1_WGM1
    SolutionIndex: 205
    SolutionNameMin: Cijk_Ailk_Bjlk_DB_MT64x32x4_SE_AF0EM1_AF1EM1_AMAS3_ASEM1_EPS1_FL1_GRVW2_IU1_LRVW2_PK0_PGR1_PLR0_SU0_SUM0_SUS256_SVW2_SNLL1_TT4_4_USFGRO0_VS1_VW2_WG16_8_1_WGM1
    SolutionIndex: 206
    SolutionNameMin: Cijk_Ailk_Bjlk_DB_MT32x64x8_SE_AF0EM1_AF1EM1_AMAS3_ASEM1_EPS1_FL1_GRVW2_IU1_LRVW2_PK0_PGR1_PLR1_SU0_SUM0_SUS256_SVW2_SNLL0_TT4_4_USFGRO0_VS1_VW2_WG8_16_1_WGM4
    SolutionIndex: 207
    SolutionNameMin: Cijk_Ailk_Bjlk_DB_MT64x64x8_SN_AF0EM1_AF1EM1_AMAS3_ASEM1_EPS1_FL1_GRVW2_IU1_LRVW2_PK4_PGR1_PLR1_SU0_SUM0_SUS256_SVW2_SNLL0_TT4_4_USFGRO0_VS1_VW2_WG16_16_1_WGM1
    SolutionIndex: 208
    SolutionNameMin: Cijk_Ailk_Bjlk_DB_MT96x64x4_SE_AF0EM1_AF1EM1_AMAS3_ASEM1_EPS1_FL1_GRVW2_IU1_LRVW2_PK0_PGR1_PLR1_SU0_SUM0_SUS256_SVW2_SNLL0_TT6_4_USFGRO0_VS1_VW2_WG16_16_1_WGM8
    SolutionIndex: 209
    SolutionNameMin: Cijk_Ailk_Bjlk_DB_MT64x32x4_SE_AF0EM1_AF1EM1_AMAS3_ASEM1_EPS1_FL1_GRVW2_IU1_LRVW2_PK0_PGR1_PLR1_SU0_SUM0_SUS256_SVW2_SNLL0_TT4_4_USFGRO0_VS1_VW2_WG16_8_1_WGM4
    SolutionIndex: 210
    SolutionNameMin: Cijk_Ailk_Bjlk_DB_MT64x64x4_SE_AF0EM1_AF1EM1_AMAS3_ASEM1_EPS1_FL1_GRVW2_IU1_LRVW2_PK0_PGR1_PLR1_SU0_SUM0_SUS256_SVW2_SNLL1_TT4_8_USFGRO0_VS1_VW2_WG16_8_1_WGM4
    SolutionIndex: 211
    SolutionNameMin: Cijk_Ailk_Bjlk_DB_MT64x32x4_SE_AF0EM1_AF1EM1_AMAS3_ASEM1_EPS1_FL1_GRVW2_IU1_LRVW2_PK0_PGR1_PLR0_SU0_SUM0_SUS256_SVW2_SNLL0_TT4_4_USFGRO0_VS1_VW2_WG16_8_1_WGM1
    SolutionIndex: 212
    SolutionNameMin: Cijk_Ailk_Bjlk_DB_MT64x32x8_SN_AF0EM2_AF1EM2_AMAS3_ASEM2_EPS1_FL1_GRVW2_IU1_LRVW2_PK0_PGR1_PLR1_SU0_SUM0_SUS256_SVW2_SNLL1_TT4_4_USFGRO1_VS1_VW2_WG16_8_1_WGM8
    SolutionIndex: 213
    SolutionNameMin: Cijk_Ailk_Bjlk_DB_MT64x128x4_SE_AF0EM1_AF1EM1_AMAS3_ASEM1_EPS1_FL1_GRVW2_IU1_LRVW2_PK0_PGR1_PLR1_SU0_SUM0_SUS256_SVW2_SNLL1_TT4_8_USFGRO0_VS1_VW2_WG16_16_1_WGM8
    SolutionIndex: 214
    SolutionNameMin: Cijk_Ailk_Bjlk_DB_MT64x32x8_SE_AF0EM1_AF1EM1_AMAS0_ASEM1_EPS1_FL0_GRVW1_IU1_LRVW1_PK0_PGR1_PLR1_SU32_SUM0_SUS256_SVW2_SNLL0_TT4_4_USFGRO1_VS1_VW1_WG16_8_1_WGM1
    SolutionIndex: 215
    SolutionNameMin: Cijk_Ailk_Bjlk_DB_MT64x64x4_SN_AF0EM1_AF1EM1_AMAS3_ASEM1_EPS1_FL1_GRVW2_IU1_LRVW2_PK0_PGR1_PLR1_SU0_SUM0_SUS256_SVW2_SNLL0_TT4_8_USFGRO0_VS1_VW2_WG16_8_1_WGM8
    SolutionIndex: 216
    SolutionNameMin: Cijk_Ailk_Bjlk_DB_MT64x32x4_SE_AF0EM1_AF1EM1_AMAS3_ASEM1_EPS1_FL1_GRVW2_IU1_LRVW2_PK0_PGR1_PLR1_SU0_SUM0_SUS256_SVW2_SNLL1_TT4_4_USFGRO0_VS1_VW2_WG16_8_1_WGM1
- - - [38144, 38144, 1, 256]
    - [82, 90.975]
  - - [29568, 128, 1, 384]
    - [114, 71.387]
  - - [30848, 128, 1, 256]
    - [129, 64.205]
  - - [25728, 128, 1, 384]
    - [153, 69.696]
  - - [32256, 32256, 1, 256]
    - [83, 91.056]
  - - [7680, 7680, 1, 256]
    - [83, 87.823]
  - - [41984, 41984, 1, 256]
    - [82, 90.822]
  - - [40448, 40448, 1, 256]
    - [84, 90.864]
  - - [25728, 128, 1, 256]
    - [103, 63.06]
  - - [64, 64, 1, 64]
    - [138, 0.101]
  - - [15104, 15104, 1, 256]
    - [82, 90.504]
  - - [17280, 17280, 1, 384]
    - [84, 92.267]
  - - [34688, 128, 1, 384]
    - [157, 71.731]
  - - [27392, 27392, 1, 256]
    - [85, 91.068]
  - - [6528, 128, 1, 256]
    - [174, 41.315]
  - - [35328, 35328, 1, 256]
    - [82, 91.029]
  - - [18432, 18432, 1, 384]
    - [86, 92.291]
  - - [31232, 31232, 1, 256]
    - [82, 91.252]
  - - [7808, 128, 1, 256]
    - [175, 39.333]
  - - [38400, 38400, 1, 384]
    - [83, 92.531]
  - - [16128, 16128, 1, 256]
    - [83, 90.721]
  - - [9472, 9472, 1, 256]
    - [86, 88.543]
  - - [21888, 21888, 1, 384]
    - [83, 92.578]
  - - [38656, 38656, 1, 256]
    - [84, 91.059]
  - - [20224, 20224, 1, 256]
    - [82, 90.892]
  - - [8960, 8960, 1, 256]
    - [85, 88.85]
  - - [29952, 29952, 1, 384]
    - [83, 92.467]
  - - [36864, 36864, 1, 384]
    - [83, 92.33]
  - - [33408, 33408, 1, 384]
    - [84, 92.325]
  - - [20608, 128, 1, 384]
    - [128, 61.514]
  - - [23424, 23424, 1, 384]
    - [82, 92.535]
  - - [4864, 4864, 1, 256]
    - [85, 83.275]
  - - [21504, 21504, 1, 384]
    - [83, 92.561]
  - - [25600, 25600, 1, 256]
    - [87, 91.013]
  - - [40960, 40960, 1, 256]
    - [84, 89.972]
  - - [19200, 19200, 1, 384]
    - [84, 92.409]
  - - [64, 1, 1, 64]
    - [108, 0.001]
  - - [25088, 25088, 1, 256]
    - [84, 91.145]
  - - [41728, 41728, 1, 256]
    - [82, 90.735]
  - - [35840, 35840, 1, 256]
    - [83, 91.106]
  - - [34560, 34560, 1, 256]
    - [82, 91.092]
  - - [26368, 26368, 1, 256]
    - [84, 91.111]
  - - [5888, 5888, 1, 256]
    - [86, 85.143]
  - - [28032, 28032, 1, 384]
    - [83, 92.507]
  - - [42496, 42496, 1, 256]
    - [84, 90.795]
  - - [27008, 128, 1, 256]
    - [91, 62.798]
  - - [38400, 38400, 1, 256]
    - [82, 91.158]
  - - [11008, 11008, 1, 256]
    - [83, 89.463]
  - - [32000, 32000, 1, 256]
    - [82, 91.147]
  - - [37248, 37248, 1, 384]
    - [83, 92.522]
  - - [10496, 10496, 1, 256]
    - [84, 89.659]
  - - [16640, 16640, 1, 256]
    - [83, 90.738]
  - - [24960, 24960, 1, 384]
    - [84, 92.609]
  - - [18688, 18688, 1, 256]
    - [83, 90.851]
  - - [22272, 22272, 1, 384]
    - [82, 92.533]
  - - [15488, 128, 1, 256]
    - [176, 58.444]
  - - [28416, 28416, 1, 384]
    - [82, 92.656]
  - - [3840, 3840, 1, 256]
    - [88, 80.67]
  - - [19968, 19968, 1, 384]
    - [83, 92.455]
  - - [43776, 43776, 1, 256]
    - [85, 90.819]
  - - [35072, 35072, 1, 256]
    - [82, 90.995]
  - - [20736, 20736, 1, 256]
    - [82, 91.025]
  - - [7168, 7168, 1, 256]
    - [82, 87.064]
  - - [18432, 18432, 1, 256]
    - [83, 90.935]
  - - [38016, 38016, 1, 384]
    - [83, 92.38]
  - - [35328, 35328, 1, 384]
    - [82, 92.58]
  - - [38784, 38784, 1, 384]
    - [82, 92.409]
  - - [26112, 26112, 1, 384]
    - [83, 92.609]
  - - [27264, 27264, 1, 384]
    - [82, 92.566]
  - - [44928, 44928, 1, 384]
    - [83, 92.249]
  - - [41088, 128, 1, 384]
    - [120, 73.571]
  - - [42368, 128, 1, 256]
    - [92, 65.475]
  - - [10752, 10752, 1, 256]
    - [87, 89.678]
  - - [9088, 128, 1, 384]
    - [177, 53.354]
  - - [17152, 17152, 1, 256]
    - [85, 90.757]
  - - [44928, 128, 1, 384]
    - [101, 76.183]
  - - [7808, 128, 1, 384]
    - [156, 47.635]
  - - [29184, 29184, 1, 256]
    - [82, 91.303]
  - - [11776, 11776, 1, 256]
    - [84, 89.44]
  - - [1, 64, 1, 64]
    - [155, 0.001]
  - - [27136, 27136, 1, 256]
    - [82, 91.209]
  - - [33408, 128, 1, 256]
    - [163, 67.033]
  - - [33792, 33792, 1, 384]
    - [84, 92.43]
  - - [43520, 43520, 1, 256]
    - [82, 90.8]
  - - [14592, 14592, 1, 384]
    - [87, 92.139]
  - - [41472, 41472, 1, 256]
    - [83, 90.881]
  - - [14080, 14080, 1, 256]
    - [82, 90.332]
  - - [34688, 128, 1, 256]
    - [126, 64.654]
  - - [16896, 16896, 1, 256]
    - [83, 90.754]
  - - [15744, 15744, 1, 384]
    - [83, 92.235]
  - - [28416, 28416, 1, 256]
    - [85, 91.168]
  - - [23808, 23808, 1, 256]
    - [85, 91.074]
  - - [27648, 27648, 1, 256]
    - [85, 91.149]
  - - [1152, 3072, 1, 384]
    - [89, 68.786]
  - - [21888, 128, 1, 256]
    - [178, 52.522]
  - - [34816, 34816, 1, 256]
    - [83, 90.787]
  - - [43776, 43776, 1, 384]
    - [83, 92.357]
  - - [36096, 36096, 1, 256]
    - [85, 91.006]
  - - [24320, 24320, 1, 256]
    - [82, 91.108]
  - - [12544, 12544, 1, 256]
    - [82, 90.003]
  - - [29184, 29184, 1, 384]
    - [82, 92.5]
  - - [29568, 29568, 1, 384]
    - [84, 92.451]
  - - [12928, 128, 1, 384]
    - [179, 47.127]
  - - [36480, 36480, 1, 384]
    - [82, 92.513]
  - - [30720, 30720, 1, 256]
    - [82, 91.173]
  - - [25728, 25728, 1, 384]
    - [82, 92.54]
  - - [34048, 34048, 1, 256]
    - [83, 90.929]
  - - [12928, 128, 1, 256]
    - [156, 54.99]
  - - [9728, 9728, 1, 256]
    - [84, 89.406]
  - - [128, 128, 1, 256]
    - [138, 1.073]
  - - [33024, 33024, 1, 256]
    - [85, 91.09]
  - - [15488, 128, 1, 384]
    - [90, 55.426]
  - - [39808, 128, 1, 384]
    - [132, 70.542]
  - - [18176, 18176, 1, 256]
    - [83, 90.911]
  - - [21504, 21504, 1, 256]
    - [82, 91.065]
  - - [16384, 16384, 1, 256]
    - [90, 87.746]
  - - [27008, 128, 1, 384]
    - [103, 67.425]
  - - [27904, 27904, 1, 256]
    - [85, 91.05]
  - - [24448, 128, 1, 384]
    - [85, 64.928]
  - - [35968, 128, 1, 384]
    - [134, 68.926]
  - - [37632, 37632, 1, 256]
    - [83, 91.139]
  - - [14848, 14848, 1, 256]
    - [82, 90.413]
  - - [23552, 23552, 1, 256]
    - [83, 91.22]
  - - [4608, 4608, 1, 50000]
    - [150, 94.558]
  - - [13056, 13056, 1, 256]
    - [82, 90.286]
  - - [38528, 128, 1, 256]
    - [164, 65.138]
  - - [19584, 19584, 1, 384]
    - [83, 92.496]
  - - [16768, 128, 1, 384]
    - [97, 62.57]
  - - [22784, 22784, 1, 256]
    - [82, 91.066]
  - - [44160, 44160, 1, 384]
    - [84, 92.213]
  - - [28160, 28160, 1, 256]
    - [83, 91.093]
  - - [14592, 14592, 1, 256]
    - [83, 90.702]
  - - [20992, 20992, 1, 256]
    - [82, 91.089]
  - - [41216, 41216, 1, 256]
    - [84, 90.918]
  - - [21760, 21760, 1, 256]
    - [82, 90.906]
  - - [25344, 25344, 1, 256]
    - [82, 91.052]
  - - [4608, 4608, 1, 256]
    - [91, 83.399]
  - - [2560, 2048, 1, 256]
    - [92, 69.043]
  - - [30464, 30464, 1, 256]
    - [82, 91.207]
  - - [19200, 19200, 1, 256]
    - [84, 90.851]
  - - [22272, 22272, 1, 256]
    - [83, 90.865]
  - - [29952, 29952, 1, 256]
    - [83, 91.197]
  - - [20480, 20480, 1, 256]
    - [82, 90.578]
  - - [17408, 17408, 1, 256]
    - [84, 90.741]
  - - [32768, 32768, 1, 256]
    - [93, 87.243]
  - - [18816, 18816, 1, 384]
    - [83, 92.34]
  - - [34944, 34944, 1, 384]
    - [83, 92.281]
  - - [18048, 18048, 1, 384]
    - [83, 92.425]
  - - [34560, 34560, 1, 384]
    - [82, 92.583]
  - - [9088, 128, 1, 256]
    - [156, 49.909]
  - - [24576, 24576, 1, 256]
    - [84, 90.302]
  - - [32128, 128, 1, 384]
    - [103, 70.067]
  - - [8448, 8448, 1, 256]
    - [86, 88.776]
  - - [42752, 42752, 1, 256]
    - [83, 90.901]
  - - [5376, 5376, 1, 256]
    - [94, 84.088]
  - - [18048, 128, 1, 256]
    - [106, 63.004]
  - - [3584, 3584, 1, 256]
    - [89, 78.773]
  - - [37120, 37120, 1, 256]
    - [83, 90.995]
  - - [39936, 39936, 1, 384]
    - [82, 92.457]
  - - [20736, 20736, 1, 384]
    - [84, 92.333]
  - - [35584, 35584, 1, 256]
    - [83, 91.04]
  - - [26112, 26112, 1, 256]
    - [85, 90.987]
  - - [16896, 16896, 1, 384]
    - [82, 92.29]
  - - [40704, 40704, 1, 384]
    - [82, 92.382]
  - - [33280, 33280, 1, 256]
    - [86, 91.027]
  - - [5632, 5632, 1, 256]
    - [82, 83.743]
  - - [19456, 19456, 1, 256]
    - [82, 90.921]
  - - [22016, 22016, 1, 256]
    - [87, 91.036]
  - - [14208, 128, 1, 256]
    - [180, 57.66]
  - - [13568, 13568, 1, 256]
    - [84, 90.051]
  - - [30848, 128, 1, 384]
    - [102, 67.952]
  - - [1408, 128, 1, 384]
    - [138, 15.11]
  - - [5760, 5760, 1, 5760]
    - [181, 95.65]
  - - [39936, 39936, 1, 256]
    - [82, 91.167]
  - - [1920, 3072, 1, 384]
    - [95, 74.957]
  - - [9984, 9984, 1, 256]
    - [82, 89.122]
  - - [2816, 2048, 1, 256]
    - [96, 66.583]
  - - [23168, 128, 1, 256]
    - [115, 57.576]
  - - [19968, 19968, 1, 256]
    - [84, 91.069]
  - - [44800, 44800, 1, 256]
    - [83, 90.747]
  - - [14976, 14976, 1, 384]
    - [83, 92.099]
  - - [35712, 35712, 1, 384]
    - [82, 92.348]
  - - [43008, 43008, 1, 384]
    - [83, 92.319]
  - - [41088, 41088, 1, 384]
    - [83, 92.389]
  - - [16128, 16128, 1, 384]
    - [87, 92.194]
  - - [5120, 5120, 1, 256]
    - [97, 82.156]
  - - [25856, 25856, 1, 256]
    - [82, 91.104]
  - - [12288, 12288, 1, 256]
    - [86, 89.803]
  - - [6400, 6400, 1, 256]
    - [83, 86.16]
  - - [2688, 128, 1, 256]
    - [148, 23.47]
  - - [11648, 128, 1, 256]
    - [182, 50.621]
  - - [43264, 43264, 1, 256]
    - [82, 90.892]
  - - [19712, 19712, 1, 256]
    - [87, 90.879]
  - - [34176, 34176, 1, 384]
    - [82, 92.454]
  - - [31104, 31104, 1, 384]
    - [84, 92.384]
  - - [36608, 36608, 1, 256]
    - [84, 91.142]
  - - [39808, 128, 1, 256]
    - [153, 67.273]
  - - [13824, 13824, 1, 384]
    - [83, 91.967]
  - - [42624, 42624, 1, 384]
    - [82, 92.367]
  - - [21120, 21120, 1, 384]
    - [83, 92.431]
  - - [23296, 23296, 1, 256]
    - [83, 90.895]
  - - [42240, 42240, 1, 256]
    - [87, 90.794]
  - - [33408, 128, 1, 384]
    - [103, 73.415]
  - - [43648, 128, 1, 256]
    - [164, 65.542]
  - - [19328, 128, 1, 384]
    - [111, 57.962]
  - - [33792, 33792, 1, 256]
    - [83, 91.038]
  - - [31488, 31488, 1, 256]
    - [82, 91.183]
  - - [768, 3072, 1, 384]
    - [98, 67.056]
  - - [6144, 6144, 1, 256]
    - [83, 85.595]
  - - [20352, 20352, 1, 384]
    - [86, 92.3]
  - - [23168, 128, 1, 384]
    - [178, 57.734]
  - - [33536, 33536, 1, 256]
    - [82, 91.164]
  - - [32640, 32640, 1, 384]
    - [83, 92.177]
  - - [1536, 3072, 1, 384]
    - [99, 70.955]
  - - [19328, 128, 1, 256]
    - [130, 50.173]
  - - [2688, 3072, 1, 384]
    - [100, 78.488]
  - - [24192, 24192, 1, 384]
    - [84, 92.529]
  - - [6912, 6912, 1, 256]
    - [101, 86.852]
  - - [15360, 15360, 1, 256]
    - [82, 90.63]
  - - [18944, 18944, 1, 256]
    - [82, 90.841]
  - - [37376, 37376, 1, 256]
    - [83, 91.199]
  - - [31488, 31488, 1, 384]
    - [82, 92.562]
  - - [26880, 26880, 1, 256]
    - [82, 91.009]
  - - [44928, 128, 1, 128]
    - [106, 55.588]
  - - [24448, 128, 1, 256]
    - [164, 58.632]
  - - [31872, 31872, 1, 384]
    - [83, 91.394]
  - - [1408, 128, 1, 256]
    - [138, 11.951]
  - - [38528, 128, 1, 384]
    - [107, 68.84]
  - - [15616, 15616, 1, 256]
    - [82, 90.53]
  - - [39552, 39552, 1, 384]
    - [82, 92.411]
  - - [4352, 4352, 1, 256]
    - [89, 82.729]
  - - [28288, 128, 1, 384]
    - [180, 71.022]
  - - [10368, 128, 1, 256]
    - [183, 49.627]
  - - [32128, 128, 1, 256]
    - [184, 63.178]
  - - [4608, 4608, 1, 4608]
    - [185, 93.487]
  - - [8704, 8704, 1, 256]
    - [102, 88.328]
  - - [17664, 17664, 1, 256]
    - [85, 90.843]
  - - [24576, 24576, 1, 384]
    - [84, 92.317]
  - - [37248, 128, 1, 384]
    - [157, 72.879]
  - - [34304, 34304, 1, 256]
    - [82, 91.099]
  - - [42368, 128, 1, 384]
    - [103, 72.71]
  - - [17664, 17664, 1, 384]
    - [82, 92.337]
  - - [12800, 12800, 1, 256]
    - [87, 90.142]
  - - [26624, 26624, 1, 256]
    - [82, 91.215]
  - - [36864, 36864, 1, 256]
    - [84, 90.794]
  - - [40704, 40704, 1, 256]
    - [83, 90.885]
  - - [12032, 12032, 1, 256]
    - [87, 89.696]
  - - [33024, 33024, 1, 384]
    - [87, 92.42]
  - - [28800, 28800, 1, 384]
    - [82, 92.431]
  - - [22656, 22656, 1, 384]
    - [82, 92.468]
  - - [41472, 41472, 1, 384]
    - [83, 92.338]
  - - [39680, 39680, 1, 256]
    - [82, 91.014]
  - - [44032, 44032, 1, 256]
    - [82, 90.879]
  - - [43392, 43392, 1, 384]
    - [83, 92.368]
  - - [42240, 42240, 1, 384]
    - [85, 92.255]
  - - [38912, 38912, 1, 256]
    - [84, 91.003]
  - - [23040, 23040, 1, 384]
    - [83, 92.559]
  - - [13312, 13312, 1, 256]
    - [82, 90.111]
  - - [128, 128, 1, 384]
    - [138, 1.327]
  - - [39168, 39168, 1, 256]
    - [83, 91.024]
  - - [25344, 25344, 1, 384]
    - [83, 92.586]
  - - [5248, 128, 1, 256]
    - [165, 36.867]
  - - [30208, 30208, 1, 256]
    - [82, 91.192]
  - - [40192, 40192, 1, 256]
    - [82, 90.93]
  - - [15872, 15872, 1, 256]
    - [83, 90.772]
  - - [44544, 44544, 1, 256]
    - [83, 90.742]
  - - [11520, 11520, 1, 256]
    - [87, 89.974]
  - - [15360, 15360, 1, 384]
    - [83, 92.285]
  - - [23040, 23040, 1, 256]
    - [83, 91.279]
  - - [26496, 26496, 1, 384]
    - [82, 92.545]
  - - [11264, 11264, 1, 256]
    - [103, 89.478]
  - - [18048, 128, 1, 384]
    - [114, 65.003]
  - - [30976, 30976, 1, 256]
    - [85, 91.061]
  - - [11648, 128, 1, 384]
    - [186, 56.371]
  - - [2304, 3072, 1, 384]
    - [98, 74.235]
  - - [28928, 28928, 1, 256]
    - [82, 91.172]
  - - [43008, 43008, 1, 256]
    - [82, 91.046]
  - - [29440, 29440, 1, 256]
    - [82, 91.145]
  - - [36352, 36352, 1, 256]
    - [82, 91.024]
  - - [32256, 32256, 1, 384]
    - [84, 92.541]
  - - [23808, 23808, 1, 384]
    - [82, 92.564]
  - - [37248, 128, 1, 256]
    - [99, 67.895]
  - - [1, 1, 1, 64]
    - [187, 0.0]
  - - [37888, 37888, 1, 256]
    - [87, 91.025]
  - - [35968, 128, 1, 256]
    - [100, 64.35]
  - - [13824, 13824, 1, 256]
    - [87, 90.21]
  - - [39168, 39168, 1, 384]
    - [83, 92.501]
  - - [37632, 37632, 1, 384]
    - [82, 92.581]
  - - [29568, 128, 1, 256]
    - [153, 64.793]
  - - [14336, 14336, 1, 256]
    - [83, 90.272]
  - - [28288, 128, 1, 256]
    - [120, 61.94]
  - - [16512, 16512, 1, 384]
    - [83, 92.141]
  - - [30720, 30720, 1, 384]
    - [83, 92.466]
  - - [21248, 21248, 1, 256]
    - [85, 90.837]
  - - [29696, 29696, 1, 256]
    - [82, 91.106]
  - - [384, 3072, 1, 384]
    - [115, 56.4]
  - - [28672, 28672, 1, 256]
    - [84, 90.821]
  - - [32512, 32512, 1, 256]
    - [87, 90.985]
  - - [9216, 9216, 1, 256]
    - [103, 88.718]
  - - [6656, 6656, 1, 256]
    - [82, 86.103]
  - - [30336, 30336, 1, 384]
    - [82, 92.529]
  - - [20608, 128, 1, 256]
    - [118, 56.511]
  - - [7936, 7936, 1, 256]
    - [103, 87.798]
  - - [41856, 41856, 1, 384]
    - [82, 92.379]
  - - [44288, 44288, 1, 256]
    - [87, 90.8]
  - - [7744, 7744, 1, 7744]
    - [175, 94.68]
  - - [7424, 7424, 1, 256]
    - [102, 87.035]
  - - [39424, 39424, 1, 256]
    - [83, 90.932]
  - - [43648, 128, 1, 384]
    - [91, 74.461]
  - - [14208, 14208, 1, 384]
    - [84, 91.991]
  - - [36096, 36096, 1, 384]
    - [84, 92.446]
  - - [44544, 44544, 1, 384]
    - [82, 92.215]
  - - [22528, 22528, 1, 256]
    - [83, 90.925]
  - - [4096, 4096, 1, 256]
    - [83, 80.129]
  - - [31744, 31744, 1, 256]
    - [82, 91.094]
  - - [3968, 128, 1, 384]
    - [162, 32.827]
  - - [17920, 17920, 1, 256]
    - [84, 90.591]
  - - [5248, 128, 1, 384]
    - [159, 42.426]
  - - [26880, 26880, 1, 384]
    - [83, 92.544]
  - - [8192, 8192, 1, 256]
    - [86, 87.348]
  - - [3968, 128, 1, 256]
    - [188, 27.655]
  - - [41088, 128, 1, 256]
    - [99, 68.956]
  - - [21888, 128, 1, 384]
    - [169, 64.987]
  - - [16768, 128, 1, 256]
    - [107, 62.917]
  - - [24064, 24064, 1, 256]
    - [82, 91.093]
  - - [44928, 128, 1, 256]
    - [105, 69.229]
  - - [27648, 27648, 1, 384]
    - [83, 92.573]
  - - [24832, 24832, 1, 256]
    - [82, 90.909]
  - - [10240, 10240, 1, 256]
    - [86, 89.005]
  - - [40320, 40320, 1, 384]
    - [82, 92.436]
  - - [18432, 2688, 1, 384]
    - [84, 89.58]
  - - [43008, 2304, 1, 384]
    - [102, 90.78]
  - - [3840, 3072, 1, 384]
    - [104, 82.762]
  - - [33408, 1920, 1, 384]
    - [85, 89.942]
  - - [33792, 2688, 1, 384]
    - [84, 90.756]
  - - [8064, 2688, 1, 384]
    - [84, 85.662]
  - - [33408, 2304, 1, 384]
    - [83, 90.454]
  - - [31872, 1536, 1, 384]
    - [85, 88.998]
  - - [41088, 1920, 1, 384]
    - [84, 90.555]
  - - [41088, 2304, 1, 384]
    - [86, 90.836]
  - - [5376, 1536, 1, 384]
    - [83, 78.762]
  - - [16128, 1536, 1, 384]
    - [94, 86.695]
  - - [36480, 2688, 1, 384]
    - [83, 91.124]
  - - [15360, 768, 1, 384]
    - [84, 82.716]
  - - [42624, 768, 1, 384]
    - [84, 88.534]
  - - [4992, 1536, 1, 384]
    - [85, 78.286]
  - - [29952, 1536, 1, 384]
    - [83, 89.182]
  - - [10752, 2688, 1, 384]
    - [101, 86.219]
  - - [42240, 2688, 1, 384]
    - [82, 91.2]
  - - [36096, 1536, 1, 384]
    - [82, 89.634]
  - - [26496, 1536, 1, 384]
    - [83, 88.712]
  - - [42624, 2688, 1, 384]
    - [83, 91.165]
  - - [17664, 2688, 1, 384]
    - [85, 88.877]
  - - [37248, 1536, 1, 384]
    - [83, 90.288]
  - - [16896, 2304, 1, 384]
    - [83, 89.274]
  - - [22272, 1920, 1, 384]
    - [87, 89.536]
  - - [26880, 2688, 1, 384]
    - [83, 90.636]
  - - [384, 768, 1, 384]
    - [189, 24.157]
  - - [16896, 1920, 1, 384]
    - [83, 88.395]
  - - [32640, 2304, 1, 384]
    - [82, 90.201]
  - - [5760, 2304, 1, 384]
    - [91, 84.549]
  - - [11904, 2304, 1, 384]
    - [102, 87.053]
  - - [24576, 2304, 1, 384]
    - [84, 88.56]
  - - [33024, 1536, 1, 384]
    - [85, 89.605]
  - - [36096, 2304, 1, 384]
    - [83, 90.552]
  - - [20352, 2688, 1, 384]
    - [83, 89.897]
  - - [14592, 2304, 1, 384]
    - [87, 88.179]
  - - [16128, 1920, 1, 384]
    - [82, 88.063]
  - - [16512, 1920, 1, 384]
    - [84, 87.702]
  - - [35712, 1920, 1, 384]
    - [86, 90.054]
  - - [9216, 2688, 1, 384]
    - [102, 86.86]
  - - [23808, 2688, 1, 384]
    - [85, 90.042]
  - - [18048, 768, 1, 384]
    - [87, 83.999]
  - - [14592, 2688, 1, 384]
    - [83, 89.06]
  - - [14208, 1920, 1, 384]
    - [83, 88.099]
  - - [14976, 2688, 1, 384]
    - [103, 88.593]
  - - [17280, 2304, 1, 384]
    - [85, 88.993]
  - - [11520, 2304, 1, 384]
    - [83, 87.537]
  - - [18432, 768, 1, 384]
    - [84, 83.338]
  - - [4608, 768, 1, 384]
    - [91, 70.353]
  - - [34944, 1920, 1, 384]
    - [85, 90.338]
  - - [13824, 2688, 1, 384]
    - [83, 88.953]
  - - [39936, 2304, 1, 384]
    - [83, 90.936]
  - - [7680, 2688, 1, 384]
    - [105, 86.122]
  - - [19968, 2304, 1, 384]
    - [84, 88.645]
  - - [27648, 2688, 1, 384]
    - [82, 90.703]
  - - [4224, 768, 1, 384]
    - [106, 61.614]
  - - [24192, 1920, 1, 384]
    - [82, 89.273]
  - - [32640, 1920, 1, 384]
    - [85, 89.603]
  - - [34176, 2688, 1, 384]
    - [84, 90.763]
  - - [35328, 1536, 1, 384]
    - [85, 89.798]
  - - [8832, 2688, 1, 384]
    - [94, 85.509]
  - - [18048, 1920, 1, 384]
    - [107, 88.305]
  - - [31488, 768, 1, 384]
    - [103, 87.322]
  - - [21504, 2304, 1, 384]
    - [82, 89.503]
  - - [11136, 2688, 1, 384]
    - [86, 88.228]
  - - [768, 1152, 1, 384]
    - [108, 46.759]
  - - [29184, 2688, 1, 384]
    - [84, 90.502]
  - - [4608, 2688, 1, 384]
    - [107, 83.739]
  - - [21504, 2688, 1, 384]
    - [87, 89.629]
  - - [34176, 768, 1, 384]
    - [91, 87.367]
  - - [23808, 1536, 1, 384]
    - [83, 88.734]
  - - [43392, 1536, 1, 384]
    - [87, 90.046]
  - - [13824, 768, 1, 384]
    - [109, 80.688]
  - - [38016, 1536, 1, 384]
    - [110, 89.806]
  - - [20736, 2688, 1, 384]
    - [87, 90.038]
  - - [15744, 1536, 1, 384]
    - [85, 87.66]
  - - [16512, 1536, 1, 384]
    - [107, 86.075]
  - - [3072, 2304, 1, 384]
    - [111, 76.701]
  - - [5760, 2688, 1, 384]
    - [112, 85.126]
  - - [38400, 2304, 1, 384]
    - [85, 90.776]
  - - [15360, 2688, 1, 384]
    - [85, 88.642]
  - - [29952, 2688, 1, 384]
    - [87, 90.697]
  - - [43008, 2688, 1, 384]
    - [82, 91.151]
  - - [13440, 1920, 1, 384]
    - [101, 87.561]
  - - [6528, 2688, 1, 384]
    - [87, 85.216]
  - - [2304, 1536, 1, 384]
    - [113, 69.141]
  - - [40320, 1536, 1, 384]
    - [82, 89.744]
  - - [13440, 1536, 1, 384]
    - [91, 85.949]
  - - [40320, 2688, 1, 384]
    - [82, 91.247]
  - - [30336, 2304, 1, 384]
    - [91, 90.597]
  - - [24192, 2688, 1, 384]
    - [85, 90.411]
  - - [35328, 768, 1, 384]
    - [94, 87.503]
  - - [23040, 768, 1, 384]
    - [82, 85.557]
  - - [29952, 2304, 1, 384]
    - [82, 90.335]
  - - [33024, 1920, 1, 384]
    - [82, 89.999]
  - - [14976, 768, 1, 384]
    - [110, 82.346]
  - - [42624, 1920, 1, 384]
    - [83, 90.393]
  - - [32640, 2688, 1, 384]
    - [87, 90.401]
  - - [11520, 1536, 1, 384]
    - [103, 85.837]
  - - [6912, 768, 1, 384]
    - [114, 72.326]
  - - [39552, 1920, 1, 384]
    - [82, 90.361]
  - - [32256, 1920, 1, 384]
    - [82, 90.09]
  - - [10752, 1536, 1, 384]
    - [94, 84.029]
  - - [24576, 2688, 1, 384]
    - [84, 89.538]
  - - [12672, 2688, 1, 384]
    - [107, 88.232]
  - - [10752, 1920, 1, 384]
    - [110, 84.651]
  - - [40704, 1536, 1, 384]
    - [83, 90.069]
  - - [32256, 768, 1, 384]
    - [91, 86.72]
  - - [18816, 2688, 1, 384]
    - [107, 89.486]
  - - [11520, 2688, 1, 384]
    - [94, 88.719]
  - - [35712, 2688, 1, 384]
    - [82, 90.728]
  - - [29952, 1920, 1, 384]
    - [85, 90.171]
  - - [26880, 1920, 1, 384]
    - [82, 89.45]
  - - [33408, 2688, 1, 384]
    - [103, 90.59]
  - - [35328, 2688, 1, 384]
    - [86, 91.035]
  - - [21120, 2688, 1, 384]
    - [102, 89.584]
  - - [19584, 1920, 1, 384]
    - [83, 88.799]
  - - [17664, 1536, 1, 384]
    - [83, 87.638]
  - - [36864, 768, 1, 384]
    - [84, 87.711]
  - - [14592, 1536, 1, 384]
    - [91, 86.507]
  - - [11136, 2304, 1, 384]
    - [84, 87.671]
  - - [9600, 2688, 1, 384]
    - [86, 88.13]
  - - [9216, 2304, 1, 384]
    - [87, 86.658]
  - - [21120, 768, 1, 384]
    - [83, 84.754]
  - - [4992, 2688, 1, 384]
    - [82, 82.842]
  - - [41472, 768, 1, 384]
    - [94, 87.631]
  - - [37632, 1536, 1, 384]
    - [87, 89.535]
  - - [38784, 2304, 1, 384]
    - [87, 90.904]
  - - [8448, 2688, 1, 384]
    - [84, 87.107]
  - - [36864, 2304, 1, 384]
    - [84, 90.663]
  - - [40704, 1920, 1, 384]
    - [85, 90.552]
  - - [39552, 2688, 1, 384]
    - [82, 91.107]
  - - [26112, 768, 1, 384]
    - [110, 84.333]
  - - [29184, 1536, 1, 384]
    - [91, 88.818]
  - - [32640, 1536, 1, 384]
    - [101, 89.252]
  - - [5376, 2688, 1, 384]
    - [101, 83.929]
  - - [13056, 768, 1, 384]
    - [102, 80.944]
  - - [13824, 2304, 1, 384]
    - [103, 87.923]
  - - [16896, 768, 1, 384]
    - [103, 83.444]
  - - [30336, 1920, 1, 384]
    - [83, 89.923]
  - - [27264, 2304, 1, 384]
    - [85, 90.067]
  - - [7680, 1536, 1, 384]
    - [98, 81.287]
  - - [30720, 2688, 1, 384]
    - [84, 90.773]
  - - [36096, 2688, 1, 384]
    - [107, 90.8]
  - - [5760, 1920, 1, 384]
    - [91, 84.148]
  - - [42240, 1536, 1, 384]
    - [83, 89.947]
  - - [8448, 1920, 1, 384]
    - [85, 83.404]
  - - [32256, 1536, 1, 384]
    - [85, 89.259]
  - - [44160, 2304, 1, 384]
    - [103, 90.893]
  - - [30336, 2688, 1, 384]
    - [84, 90.595]
  - - [6144, 2688, 1, 384]
    - [105, 83.778]
  - - [39168, 1536, 1, 384]
    - [84, 90.153]
  - - [11904, 1920, 1, 384]
    - [91, 86.636]
  - - [8064, 1536, 1, 384]
    - [87, 83.89]
  - - [21120, 1920, 1, 384]
    - [83, 88.923]
  - - [22656, 2304, 1, 384]
    - [83, 89.691]
  - - [19968, 2688, 1, 384]
    - [85, 89.541]
  - - [10752, 768, 1, 384]
    - [109, 77.414]
  - - [18432, 2304, 1, 384]
    - [85, 88.664]
  - - [14976, 1920, 1, 384]
    - [87, 88.501]
  - - [33024, 2688, 1, 384]
    - [103, 90.651]
  - - [1536, 768, 1, 384]
    - [115, 55.619]
  - - [33024, 2304, 1, 384]
    - [87, 90.56]
  - - [14208, 2688, 1, 384]
    - [91, 88.532]
  - - [38016, 2304, 1, 384]
    - [84, 90.791]
  - - [16896, 2688, 1, 384]
    - [82, 89.376]
  - - [31104, 768, 1, 384]
    - [103, 86.295]
  - - [41472, 2304, 1, 384]
    - [83, 91.009]
  - - [23424, 2688, 1, 384]
    - [83, 90.241]
  - - [26496, 2688, 1, 384]
    - [82, 90.719]
  - - [16512, 2304, 1, 384]
    - [84, 88.592]
  - - [11520, 1920, 1, 384]
    - [102, 87.563]
  - - [39552, 768, 1, 384]
    - [83, 87.724]
  - - [6144, 2304, 1, 384]
    - [97, 82.207]
  - - [14208, 2304, 1, 384]
    - [107, 87.714]
  - - [19584, 2304, 1, 384]
    - [85, 89.025]
  - - [36480, 768, 1, 384]
    - [83, 87.253]
  - - [15744, 2688, 1, 384]
    - [83, 88.268]
  - - [34560, 1536, 1, 384]
    - [91, 89.332]
  - - [8448, 2304, 1, 384]
    - [82, 84.573]
  - - [26112, 2688, 1, 384]
    - [83, 90.518]
  - - [39936, 768, 1, 384]
    - [101, 87.415]
  - - [19200, 1920, 1, 384]
    - [101, 88.535]
  - - [38400, 768, 1, 384]
    - [102, 87.473]
  - - [8448, 1536, 1, 384]
    - [83, 83.548]
  - - [13824, 1536, 1, 384]
    - [107, 86.019]
  - - [9600, 768, 1, 384]
    - [116, 74.829]
  - - [10368, 768, 1, 384]
    - [84, 78.929]
  - - [20736, 1536, 1, 384]
    - [84, 88.024]
  - - [28800, 768, 1, 384]
    - [102, 86.015]
  - - [10368, 1536, 1, 384]
    - [110, 84.047]
  - - [21888, 1536, 1, 384]
    - [82, 88.804]
  - - [38784, 2688, 1, 384]
    - [83, 91.125]
  - - [27648, 2304, 1, 384]
    - [85, 89.978]
  - - [11136, 1920, 1, 384]
    - [112, 86.243]
  - - [37248, 768, 1, 384]
    - [85, 87.494]
  - - [23040, 2688, 1, 384]
    - [91, 90.016]
  - - [37632, 1920, 1, 384]
    - [87, 90.047]
  - - [7680, 768, 1, 384]
    - [117, 77.351]
  - - [38016, 1920, 1, 384]
    - [82, 90.445]
  - - [35712, 2304, 1, 384]
    - [103, 90.521]
  - - [37248, 2688, 1, 384]
    - [82, 91.024]
  - - [29568, 1920, 1, 384]
    - [86, 89.795]
  - - [38400, 2688, 1, 384]
    - [83, 91.086]
  - - [25728, 768, 1, 384]
    - [85, 87.329]
  - - [8832, 1920, 1, 384]
    - [91, 84.874]
  - - [43776, 1920, 1, 384]
    - [82, 90.985]
  - - [15744, 768, 1, 384]
    - [84, 81.943]
  - - [27264, 1920, 1, 384]
    - [83, 89.609]
  - - [33792, 2304, 1, 384]
    - [83, 90.486]
  - - [8832, 2304, 1, 384]
    - [85, 85.934]
  - - [39168, 2688, 1, 384]
    - [83, 91.355]
  - - [35328, 1920, 1, 384]
    - [84, 90.386]
  - - [35328, 2304, 1, 384]
    - [82, 90.69]
  - - [29184, 768, 1, 384]
    - [103, 86.546]
  - - [18048, 2688, 1, 384]
    - [83, 89.627]
  - - [32256, 2688, 1, 384]
    - [86, 90.843]
  - - [18816, 1536, 1, 384]
    - [83, 87.172]
  - - [13056, 1536, 1, 384]
    - [86, 85.106]
  - - [34944, 1536, 1, 384]
    - [107, 89.379]
  - - [38400, 1920, 1, 384]
    - [82, 90.076]
  - - [15360, 2304, 1, 384]
    - [83, 88.404]
  - - [27264, 2688, 1, 384]
    - [84, 90.505]
  - - [11136, 1536, 1, 384]
    - [101, 83.833]
  - - [30720, 2304, 1, 384]
    - [85, 90.307]
  - - [24960, 2688, 1, 384]
    - [84, 90.03]
  - - [13824, 1920, 1, 384]
    - [83, 86.59]
  - - [17280, 2688, 1, 384]
    - [102, 88.961]
  - - [31872, 768, 1, 384]
    - [83, 85.63]
  - - [11904, 2688, 1, 384]
    - [103, 87.466]
  - - [7296, 768, 1, 384]
    - [91, 76.145]
  - - [19200, 1536, 1, 384]
    - [82, 87.561]
  - - [12288, 768, 1, 384]
    - [84, 79.406]
  - - [33792, 768, 1, 384]
    - [82, 86.98]
  - - [21888, 2688, 1, 384]
    - [83, 90.296]
  - - [2688, 1920, 1, 384]
    - [118, 69.19]
  - - [19968, 768, 1, 384]
    - [84, 85.255]
  - - [12288, 2688, 1, 384]
    - [86, 88.187]
  - - [12288, 2304, 1, 384]
    - [87, 86.642]
  - - [28416, 768, 1, 384]
    - [107, 86.2]
  - - [34560, 768, 1, 384]
    - [110, 87.996]
  - - [39936, 2688, 1, 384]
    - [87, 90.999]
  - - [8064, 1920, 1, 384]
    - [91, 85.861]
  - - [26880, 1536, 1, 384]
    - [86, 89.155]
  - - [28032, 2688, 1, 384]
    - [85, 90.693]
  - - [41472, 2688, 1, 384]
    - [87, 91.06]
  - - [29568, 2688, 1, 384]
    - [83, 90.683]
  - - [31104, 2688, 1, 384]
    - [91, 90.536]
  - - [5376, 1920, 1, 384]
    - [114, 80.36]
  - - [41856, 2688, 1, 384]
    - [82, 91.528]
  - - [9984, 768, 1, 384]
    - [106, 77.242]
  - - [3456, 2688, 1, 384]
    - [82, 79.87]
  - - [43392, 2688, 1, 384]
    - [84, 91.317]
  - - [36480, 1920, 1, 384]
    - [85, 90.445]
  - - [29568, 1536, 1, 384]
    - [85, 88.808]
  - - [36864, 2688, 1, 384]
    - [87, 90.797]
  - - [12672, 768, 1, 384]
    - [119, 78.85]
  - - [24064, 3072, 1, 256]
    - [19, 0.0]
  - - [256, 512, 1, 256]
    - [20, 0.0]
  - - [40960, 27648, 1, 256]
    - [19, 0.0]
  - - [31744, 3072, 1, 256]
    - [19, 0.0]
  - - [13056, 1792, 1, 256]
    - [13, 0.0]
  - - [35328, 22785, 1, 256]
    - [13, 0.0]
  - - [28160, 15872, 1, 256]
    - [19, 0.0]
  - - [39168, 1792, 1, 256]
    - [13, 0.0]
  - - [23808, 11265, 1, 256]
    - [19, 0.0]
  - - [16640, 4353, 1, 256]
    - [13, 0.0]
  - - [38912, 26624, 1, 256]
    - [19, 0.0]
  - - [6912, 3585, 1, 256]
    - [19, 0.0]
  - - [32768, 1792, 1, 256]
    - [13, 0.0]
  - - [30976, 18688, 1, 256]
    - [13, 0.0]
  - - [512, 2048, 1, 256]
    - [7, 0.0]
  - - [15872, 3584, 1, 256]
    - [19, 0.0]
  - - [6400, 1792, 1, 256]
    - [19, 0.0]
  - - [39680, 27393, 1, 256]
    - [13, 0.0]
  - - [36864, 24577, 1, 256]
    - [19, 0.0]
  - - [26112, 1536, 1, 256]
    - [19, 0.0]
  - - [26368, 1536, 1, 256]
    - [19, 0.0]
  - - [16896, 4353, 1, 256]
    - [13, 0.0]
  - - [14336, 1793, 1, 256]
    - [13, 0.0]
  - - [3840, 3072, 1, 256]
    - [19, 0.0]
  - - [2560, 3072, 1, 256]
    - [25, 0.0]
  - - [6656, 1536, 1, 256]
    - [35, 0.0]
  - - [27136, 1792, 1, 256]
    - [13, 0.0]
  - - [43776, 3072, 1, 256]
    - [19, 0.0]
  - - [23296, 1792, 1, 256]
    - [13, 0.0]
  - - [11264, 7937, 1, 256]
    - [13, 0.0]
  - - [768, 3072, 1, 256]
    - [13, 0.0]
  - - [6912, 3841, 1, 256]
    - [13, 0.0]
  - - [40960, 769, 1, 256]
    - [13, 0.0]
  - - [40448, 9216, 1, 256]
    - [19, 0.0]
  - - [7680, 4353, 1, 256]
    - [13, 0.0]
  - - [23296, 3072, 1, 256]
    - [19, 0.0]
  - - [7936, 4609, 1, 256]
    - [19, 0.0]
  - - [20736, 8448, 1, 256]
    - [13, 0.0]
  - - [768, 1024, 1, 256]
    - [27, 0.0]
  - - [38656, 3072, 1, 256]
    - [19, 0.0]
  - - [28160, 1792, 1, 256]
    - [13, 0.0]
  - - [13824, 3072, 1, 256]
    - [19, 0.0]
  - - [42752, 1792, 1, 256]
    - [13, 0.0]
  - - [35584, 23041, 1, 256]
    - [19, 0.0]
  - - [13056, 3072, 1, 256]
    - [19, 0.0]
  - - [37888, 768, 1, 256]
    - [13, 0.0]
  - - [19456, 3072, 1, 256]
    - [19, 0.0]
  - - [15872, 9216, 1, 256]
    - [19, 0.0]
  - - [30976, 1792, 1, 256]
    - [13, 0.0]
  - - [26368, 14081, 1, 256]
    - [13, 0.0]
  - - [35328, 23041, 1, 256]
    - [19, 0.0]
  - - [27648, 15105, 1, 256]
    - [13, 0.0]
  - - [25856, 13568, 1, 256]
    - [13, 0.0]
  - - [23296, 9216, 1, 256]
    - [19, 0.0]
  - - [2048, 1024, 1, 256]
    - [5, 0.0]
  - - [12032, 1792, 1, 256]
    - [13, 0.0]
  - - [11520, 1536, 1, 256]
    - [19, 0.0]
  - - [16128, 768, 1, 256]
    - [13, 0.0]
  - - [15360, 3072, 1, 256]
    - [19, 0.0]
  - - [38912, 26369, 1, 256]
    - [13, 0.0]
  - - [25344, 13056, 1, 256]
    - [13, 0.0]
  - - [39168, 26880, 1, 256]
    - [13, 0.0]
  - - [39424, 768, 1, 256]
    - [13, 0.0]
  - - [10496, 1792, 1, 256]
    - [13, 0.0]
  - - [28672, 3072, 1, 256]
    - [19, 0.0]
  - - [27392, 768, 1, 256]
    - [13, 0.0]
  - - [39680, 768, 1, 256]
    - [13, 0.0]
  - - [11520, 8193, 1, 256]
    - [19, 0.0]
  - - [17408, 4865, 1, 256]
    - [13, 0.0]
  - - [14080, 1537, 1, 256]
    - [19, 0.0]
  - - [29184, 768, 1, 256]
    - [19, 0.0]
  - - [19200, 6913, 1, 256]
    - [13, 0.0]
  - - [33536, 9216, 1, 256]
    - [19, 0.0]
  - - [5632, 3072, 1, 256]
    - [19, 0.0]
  - - [32768, 20480, 1, 256]
    - [19, 0.0]
  - - [29440, 9216, 1, 256]
    - [19, 0.0]
  - - [40960, 1792, 1, 256]
    - [13, 0.0]
  - - [10240, 3072, 1, 256]
    - [19, 0.0]
  - - [20992, 1792, 1, 256]
    - [13, 0.0]
  - - [42240, 9216, 1, 256]
    - [19, 0.0]
  - - [19200, 6912, 1, 256]
    - [13, 0.0]
  - - [27392, 1792, 1, 256]
    - [13, 0.0]
  - - [42496, 1536, 1, 256]
    - [19, 0.0]
  - - [29440, 16897, 1, 256]
    - [19, 0.0]
  - - [20480, 8192, 1, 256]
    - [19, 0.0]
  - - [11264, 8193, 1, 256]
    - [19, 0.0]
  - - [26880, 14337, 1, 256]
    - [19, 0.0]
  - - [28928, 16641, 1, 256]
    - [13, 0.0]
  - - [15360, 2817, 1, 256]
    - [13, 0.0]
  - - [44288, 1536, 1, 256]
    - [19, 0.0]
  - - [7936, 1536, 1, 256]
    - [19, 0.0]
  - - [18176, 5633, 1, 256]
    - [19, 0.0]
  - - [8448, 3072, 1, 256]
    - [19, 0.0]
  - - [17920, 5632, 1, 256]
    - [19, 0.0]
  - - [1792, 2048, 1, 256]
    - [30, 0.0]
  - - [39936, 3072, 1, 256]
    - [19, 0.0]
  - - [20480, 3072, 1, 256]
    - [19, 0.0]
  - - [24832, 1792, 1, 256]
    - [13, 0.0]
  - - [37376, 25088, 1, 256]
    - [19, 0.0]
  - - [7168, 4097, 1, 256]
    - [19, 0.0]
  - - [21504, 768, 1, 256]
    - [13, 0.0]
  - - [13312, 3072, 1, 256]
    - [19, 0.0]
  - - [40960, 1025, 1, 256]
    - [16, 0.0]
  - - [12032, 1536, 1, 256]
    - [19, 0.0]
  - - [9216, 768, 1, 256]
    - [19, 0.0]
  - - [44288, 27648, 1, 256]
    - [19, 0.0]
  - - [32512, 1792, 1, 256]
    - [13, 0.0]
  - - [23808, 11520, 1, 256]
    - [13, 0.0]
  - - [25600, 13057, 1, 256]
    - [13, 0.0]
  - - [40448, 1792, 1, 256]
    - [13, 0.0]
  - - [25088, 12800, 1, 256]
    - [19, 0.0]
  - - [22784, 10496, 1, 256]
    - [13, 0.0]
  - - [38400, 26113, 1, 256]
    - [19, 0.0]
  - - [9728, 3072, 1, 256]
    - [19, 0.0]
  - - [20736, 1792, 1, 256]
    - [13, 0.0]
  - - [7680, 3072, 1, 256]
    - [19, 0.0]
  - - [5376, 2305, 1, 256]
    - [13, 0.0]
  - - [12800, 3072, 1, 256]
    - [19, 0.0]
  - - [43520, 3584, 1, 256]
    - [19, 0.0]
  - - [12288, 3072, 1, 256]
    - [19, 0.0]
  - - [12800, 1536, 1, 256]
    - [19, 0.0]
  - - [21504, 8961, 1, 256]
    - [13, 0.0]
  - - [39680, 9216, 1, 256]
    - [19, 0.0]
  - - [3584, 513, 1, 256]
    - [5, 0.0]
  - - [1280, 3072, 1, 256]
    - [25, 0.0]
  - - [13056, 9216, 1, 256]
    - [19, 0.0]
  - - [22016, 768, 1, 256]
    - [19, 0.0]
  - - [33024, 1536, 1, 256]
    - [19, 0.0]
  - - [26880, 9216, 1, 256]
    - [19, 0.0]
  - - [44032, 27648, 1, 256]
    - [19, 0.0]
  - - [7680, 768, 1, 256]
    - [13, 0.0]
  - - [32000, 19712, 1, 256]
    - [13, 0.0]
  - - [26880, 14593, 1, 256]
    - [13, 0.0]
  - - [24064, 9216, 1, 256]
    - [19, 0.0]
  - - [39424, 26881, 1, 256]
    - [13, 0.0]
  - - [27392, 3072, 1, 256]
    - [19, 0.0]
  - - [10752, 1792, 1, 256]
    - [13, 0.0]
  - - [8960, 5633, 1, 256]
    - [19, 0.0]
  - - [34560, 3072, 1, 256]
    - [19, 0.0]
  - - [23808, 9216, 1, 256]
    - [19, 0.0]
  - - [29696, 17153, 1, 256]
    - [13, 0.0]
  - - [11776, 1536, 1, 256]
    - [19, 0.0]
  - - [13568, 1536, 1, 256]
    - [19, 0.0]
  - - [30208, 9216, 1, 256]
    - [19, 0.0]
  - - [36608, 1536, 1, 256]
    - [19, 0.0]
  - - [12800, 513, 1, 256]
    - [16, 0.0]
  - - [7680, 1792, 1, 256]
    - [13, 0.0]
  - - [42496, 2305, 1, 256]
    - [13, 0.0]
  - - [37376, 1536, 1, 256]
    - [19, 0.0]
  - - [20224, 1792, 1, 256]
    - [13, 0.0]
  - - [43520, 1536, 1, 256]
    - [19, 0.0]
  - - [26368, 768, 1, 256]
    - [19, 0.0]
  - - [18176, 3072, 1, 256]
    - [19, 0.0]
  - - [24320, 12033, 1, 256]
    - [13, 0.0]
  - - [17408, 9216, 1, 256]
    - [19, 0.0]
  - - [36352, 1792, 1, 256]
    - [13, 0.0]
  - - [20992, 8705, 1, 256]
    - [19, 0.0]
  - - [19712, 7424, 1, 256]
    - [13, 0.0]
  - - [38144, 768, 1, 256]
    - [13, 0.0]
  - - [10752, 1536, 1, 256]
    - [19, 0.0]
  - - [4096, 3072, 1, 256]
    - [19, 0.0]
  - - [29696, 17409, 1, 256]
    - [19, 0.0]
  - - [10240, 6913, 1, 256]
    - [13, 0.0]
  - - [18944, 1536, 1, 256]
    - [19, 0.0]
  - - [38656, 26113, 1, 256]
    - [19, 0.0]
  - - [37376, 25089, 1, 256]
    - [19, 0.0]
  - - [38400, 1536, 1, 256]
    - [19, 0.0]
  - - [8448, 1792, 1, 256]
    - [13, 0.0]
  - - [13056, 769, 1, 256]
    - [19, 0.0]
  - - [24320, 11777, 1, 256]
    - [19, 0.0]
  - - [17664, 9216, 1, 256]
    - [19, 0.0]
  - - [8192, 4865, 1, 256]
    - [13, 0.0]
  - - [17920, 1792, 1, 256]
    - [13, 0.0]
  - - [32000, 19713, 1, 256]
    - [13, 0.0]
  - - [8960, 768, 1, 256]
    - [13, 0.0]
  - - [31232, 3072, 1, 256]
    - [19, 0.0]
  - - [12544, 257, 1, 256]
    - [15, 0.0]
  - - [43776, 3585, 1, 256]
    - [19, 0.0]
  - - [11008, 1792, 1, 256]
    - [13, 0.0]
  - - [29696, 17408, 1, 256]
    - [19, 0.0]
  - - [34560, 22272, 1, 256]
    - [13, 0.0]
  - - [256, 2048, 1, 256]
    - [22, 0.0]
  - - [32768, 20481, 1, 256]
    - [19, 0.0]
  - - [14336, 3072, 1, 256]
    - [19, 0.0]
  - - [19456, 7168, 1, 256]
    - [19, 0.0]
  - - [13312, 9216, 1, 256]
    - [19, 0.0]
  - - [22272, 768, 1, 256]
    - [13, 0.0]
  - - [24064, 1792, 1, 256]
    - [13, 0.0]
  - - [16896, 1792, 1, 256]
    - [13, 0.0]
  - - [27904, 15616, 1, 256]
    - [13, 0.0]
  - - [37888, 3072, 1, 256]
    - [19, 0.0]
  - - [13056, 513, 1, 256]
    - [15, 0.0]
  - - [36608, 24065, 1, 256]
    - [19, 0.0]
  - - [40704, 3072, 1, 256]
    - [19, 0.0]
  - - [28928, 16640, 1, 256]
    - [13, 0.0]
  - - [24576, 12288, 1, 256]
    - [19, 0.0]
  - - [17152, 3072, 1, 256]
    - [19, 0.0]
  - - [17152, 4864, 1, 256]
    - [13, 0.0]
  - - [42496, 9216, 1, 256]
    - [19, 0.0]
  - - [32256, 768, 1, 256]
    - [13, 0.0]
  - - [4352, 1792, 1, 256]
    - [13, 0.0]
  - - [5632, 768, 1, 256]
    - [35, 0.0]
  - - [40704, 513, 1, 256]
    - [15, 0.0]
  - - [19712, 768, 1, 256]
    - [13, 0.0]
  - - [33536, 20993, 1, 256]
    - [19, 0.0]
  - - [2816, 3072, 1, 256]
    - [25, 0.0]
  - - [3584, 3072, 1, 256]
    - [19, 0.0]
  - - [4608, 1537, 1, 256]
    - [19, 0.0]
  - - [44032, 9216, 1, 256]
    - [19, 0.0]
  - - [33792, 21249, 1, 256]
    - [13, 0.0]
  - - [32512, 20225, 1, 256]
    - [13, 0.0]
  - - [38656, 9216, 1, 256]
    - [19, 0.0]
  - - [17664, 5377, 1, 256]
    - [13, 0.0]
  - - [19456, 7169, 1, 256]
    - [19, 0.0]
  - - [8448, 5121, 1, 256]
    - [19, 0.0]
  - - [29440, 17152, 1, 256]
    - [13, 0.0]
  - - [40448, 513, 1, 256]
    - [16, 0.0]
  - - [41472, 1792, 1, 256]
    - [13, 0.0]
  - - [17920, 3072, 1, 256]
    - [19, 0.0]
  - - [35072, 9216, 1, 256]
    - [19, 0.0]
  - - [34816, 22273, 1, 256]
    - [13, 0.0]
  - - [35072, 22785, 1, 256]
    - [13, 0.0]
  - - [39168, 9216, 1, 256]
    - [19, 0.0]
  - - [42752, 2817, 1, 256]
    - [13, 0.0]
  - - [11776, 3072, 1, 256]
    - [19, 0.0]
  - - [24832, 12289, 1, 256]
    - [19, 0.0]
  - - [24576, 12033, 1, 256]
    - [13, 0.0]
  - - [6400, 1536, 1, 256]
    - [19, 0.0]
  - - [32512, 3072, 1, 256]
    - [19, 0.0]
  - - [30976, 3072, 1, 256]
    - [19, 0.0]
  - - [22016, 9473, 1, 256]
    - [13, 0.0]
  - - [19968, 1792, 1, 256]
    - [13, 0.0]
  - - [29440, 3072, 1, 256]
    - [19, 0.0]
  - - [43776, 3840, 1, 256]
    - [13, 0.0]
  - - [41472, 768, 1, 256]
    - [13, 0.0]
  - - [8192, 1792, 1, 256]
    - [13, 0.0]
  - - [35840, 3072, 1, 256]
    - [19, 0.0]
  - - [8704, 3072, 1, 256]
    - [19, 0.0]
  - - [9728, 1792, 1, 256]
    - [13, 0.0]
  - - [22272, 9729, 1, 256]
    - [19, 0.0]
  - - [32768, 3072, 1, 256]
    - [19, 0.0]
  - - [3072, 2048, 1, 256]
    - [19, 0.0]
  - - [36864, 24576, 1, 256]
    - [19, 0.0]
  - - [9984, 1536, 1, 256]
    - [19, 0.0]
  - - [12032, 8961, 1, 256]
    - [13, 0.0]
  - - [38400, 25857, 1, 256]
    - [13, 0.0]
  - - [20224, 7937, 1, 256]
    - [13, 0.0]
  - - [34304, 21761, 1, 256]
    - [13, 0.0]
  - - [30720, 18432, 1, 256]
    - [19, 0.0]
  - - [31744, 9216, 1, 256]
    - [19, 0.0]
  - - [27136, 14848, 1, 256]
    - [19, 0.0]
  - - [34048, 9216, 1, 256]
    - [19, 0.0]
  - - [3584, 257, 1, 256]
    - [3, 0.0]
  - - [18688, 6145, 1, 256]
    - [19, 0.0]
  - - [36096, 768, 1, 256]
    - [13, 0.0]
  - - [36608, 9216, 1, 256]
    - [19, 0.0]
  - - [35584, 9216, 1, 256]
    - [19, 0.0]
  - - [29952, 17664, 1, 256]
    - [13, 0.0]
  - - [34816, 1792, 1, 256]
    - [13, 0.0]
  - - [24064, 11776, 1, 256]
    - [19, 0.0]
  - - [40448, 3072, 1, 256]
    - [19, 0.0]
  - - [18688, 6401, 1, 256]
    - [13, 0.0]
  - - [20480, 1536, 1, 256]
    - [19, 0.0]
  - - [18432, 3072, 1, 256]
    - [19, 0.0]
  - - [20224, 768, 1, 256]
    - [19, 0.0]
  - - [25344, 768, 1, 256]
    - [13, 0.0]
  - - [36608, 24320, 1, 256]
    - [13, 0.0]
  - - [34816, 9216, 1, 256]
    - [19, 0.0]
  - - [41216, 27648, 1, 256]
    - [19, 0.0]
  - - [30464, 9216, 1, 256]
    - [19, 0.0]
  - - [7424, 3072, 1, 256]
    - [19, 0.0]
  - - [20480, 1792, 1, 256]
    - [13, 0.0]
  - - [41984, 1793, 1, 256]
    - [13, 0.0]
  - - [18688, 1792, 1, 256]
    - [13, 0.0]
  - - [13824, 1792, 1, 256]
    - [13, 0.0]
  - - [38144, 3072, 1, 256]
    - [19, 0.0]
  - - [33280, 3072, 1, 256]
    - [19, 0.0]
  - - [35584, 23296, 1, 256]
    - [13, 0.0]
  - - [43520, 768, 1, 256]
    - [13, 0.0]
  - - [40704, 1536, 1, 256]
    - [19, 0.0]
  - - [29696, 3072, 1, 256]
    - [19, 0.0]
  - - [32256, 19969, 1, 256]
    - [19, 0.0]
  - - [40960, 9216, 1, 256]
    - [19, 0.0]
  - - [37632, 9216, 1, 256]
    - [19, 0.0]
  - - [42240, 2305, 1, 256]
    - [13, 0.0]
  - - [17920, 5377, 1, 256]
    - [13, 0.0]
  - - [27904, 9216, 1, 256]
    - [19, 0.0]
  - - [34304, 22016, 1, 256]
    - [19, 0.0]
  - - [11776, 8705, 1, 256]
    - [19, 0.0]
  - - [22272, 1536, 1, 256]
    - [19, 0.0]
  - - [25856, 9216, 1, 256]
    - [19, 0.0]
  - - [19712, 3072, 1, 256]
    - [19, 0.0]
  - - [41472, 9216, 1, 256]
    - [19, 0.0]
  - - [42496, 27648, 1, 256]
    - [19, 0.0]
  - - [44288, 4352, 1, 256]
    - [13, 0.0]
  - - [42496, 2561, 1, 256]
    - [19, 0.0]
  - - [9984, 6657, 1, 256]
    - [19, 0.0]
  - - [43008, 3073, 1, 256]
    - [19, 0.0]
  - - [36352, 24065, 1, 256]
    - [19, 0.0]
  - - [24832, 3072, 1, 256]
    - [19, 0.0]
  - - [29184, 16641, 1, 256]
    - [13, 0.0]
  - - [1024, 2048, 1, 256]
    - [23, 0.0]
  - - [42240, 27648, 1, 256]
    - [19, 0.0]
  - - [9984, 1792, 1, 256]
    - [13, 0.0]
  - - [44288, 3072, 1, 256]
    - [19, 0.0]
  - - [11008, 768, 1, 256]
    - [13, 0.0]
  - - [28672, 16129, 1, 256]
    - [13, 0.0]
  - - [17920, 9216, 1, 256]
    - [19, 0.0]
  - - [25088, 12801, 1, 256]
    - [19, 0.0]
  - - [19712, 9216, 1, 256]
    - [19, 0.0]
  - - [31744, 19457, 1, 256]
    - [19, 0.0]
  - - [36864, 1792, 1, 256]
    - [13, 0.0]
  - - [42496, 1792, 1, 256]
    - [13, 0.0]
  - - [39936, 9216, 1, 256]
    - [19, 0.0]
  - - [8960, 1792, 1, 256]
    - [13, 0.0]
  - - [17664, 5121, 1, 256]
    - [19, 0.0]
  - - [38144, 25601, 1, 256]
    - [19, 0.0]
  - - [27136, 14849, 1, 256]
    - [19, 0.0]
  - - [31744, 19456, 1, 256]
    - [19, 0.0]
  - - [33024, 3072, 1, 256]
    - [19, 0.0]
  - - [37888, 9216, 1, 256]
    - [19, 0.0]
  - - [6912, 1792, 1, 256]
    - [13, 0.0]
  - - [42240, 2049, 1, 256]
    - [19, 0.0]
  - - [34048, 3072, 1, 256]
    - [19, 0.0]
  - - [37120, 9216, 1, 256]
    - [19, 0.0]
  - - [14080, 9216, 1, 256]
    - [19, 0.0]
  - - [38400, 1792, 1, 256]
    - [13, 0.0]
  - - [43776, 9216, 1, 256]
    - [19, 0.0]
  - - [14336, 2049, 1, 256]
    - [19, 0.0]
  - - [37120, 24577, 1, 256]
    - [19, 0.0]
  - - [30976, 18433, 1, 256]
    - [19, 0.0]
  - - [37632, 3072, 1, 256]
    - [19, 0.0]
  - - [34560, 1792, 1, 256]
    - [13, 0.0]
  - - [5120, 3072, 1, 256]
    - [19, 0.0]
  - - [21760, 9217, 1, 256]
    - [19, 0.0]
  - - [24064, 11521, 1, 256]
    - [13, 0.0]
  - - [7936, 3072, 1, 256]
    - [19, 0.0]
  - - [21760, 9472, 1, 256]
    - [13, 0.0]
  - - [9216, 6145, 1, 256]
    - [19, 0.0]
  - - [8192, 1536, 1, 256]
    - [19, 0.0]
  - - [39936, 27648, 1, 256]
    - [19, 0.0]
  - - [21248, 9216, 1, 256]
    - [19, 0.0]
  - - [5376, 2049, 1, 256]
    - [19, 0.0]
  - - [35072, 22529, 1, 256]
    - [19, 0.0]
  - - [13312, 769, 1, 256]
    - [16, 0.0]
  - - [35840, 9216, 1, 256]
    - [19, 0.0]
  - - [39424, 27136, 1, 256]
    - [19, 0.0]
  - - [26368, 9216, 1, 256]
    - [19, 0.0]
  - - [34048, 21505, 1, 256]
    - [19, 0.0]
  - - [26112, 1792, 1, 256]
    - [13, 0.0]
  - - [23296, 768, 1, 256]
    - [13, 0.0]
  - - [43264, 27648, 1, 256]
    - [19, 0.0]
  - - [18432, 9216, 1, 256]
    - [19, 0.0]
  - - [38912, 3072, 1, 256]
    - [19, 0.0]
  - - [30464, 17921, 1, 256]
    - [19, 0.0]
  - - [37376, 9216, 1, 256]
    - [19, 0.0]
  - - [256, 3072, 1, 256]
    - [23, 0.0]
  - - [9472, 3072, 1, 256]
    - [19, 0.0]
  - - [35840, 23552, 1, 256]
    - [19, 0.0]
  - - [8960, 3072, 1, 256]
    - [19, 0.0]
  - - [34816, 3072, 1, 256]
    - [19, 0.0]
  - - [11008, 3072, 1, 256]
    - [19, 0.0]
  - - [36864, 1536, 1, 256]
    - [19, 0.0]
  - - [23552, 9216, 1, 256]
    - [19, 0.0]
  - - [31232, 18945, 1, 256]
    - [19, 0.0]
  - - [27136, 9216, 1, 256]
    - [19, 0.0]
  - - [19968, 7681, 1, 256]
    - [19, 0.0]
  - - [31488, 18945, 1, 256]
    - [19, 0.0]
  - - [33280, 1792, 1, 256]
    - [13, 0.0]
  - - [14592, 3072, 1, 256]
    - [19, 0.0]
  - - [30976, 18689, 1, 256]
    - [13, 0.0]
  - - [4096, 769, 1, 256]
    - [13, 0.0]
  - - [31488, 3072, 1, 256]
    - [19, 0.0]
  - - [33024, 1792, 1, 256]
    - [13, 0.0]
  - - [11520, 8449, 1, 256]
    - [13, 0.0]
  - - [44544, 4353, 1, 256]
    - [13, 0.0]
  - - [18176, 5889, 1, 256]
    - [13, 0.0]
  - - [5632, 2305, 1, 256]
    - [13, 0.0]
  - - [39936, 27393, 1, 256]
    - [13, 0.0]
  - - [10240, 7169, 1, 256]
    - [19, 0.0]
  - - [39168, 26625, 1, 256]
    - [19, 0.0]
  - - [10752, 7681, 1, 256]
    - [19, 0.0]
  - - [13824, 1536, 1, 256]
    - [19, 0.0]
  - - [14336, 9216, 1, 256]
    - [19, 0.0]
  - - [37632, 25345, 1, 256]
    - [13, 0.0]
  - - [35840, 23553, 1, 256]
    - [19, 0.0]
  - - [23552, 3072, 1, 256]
    - [19, 0.0]
  - - [19712, 7169, 1, 256]
    - [19, 0.0]
  - - [5888, 2561, 1, 256]
    - [19, 0.0]
  - - [27136, 768, 1, 256]
    - [13, 0.0]
  - - [22272, 1792, 1, 256]
    - [13, 0.0]
  - - [15616, 1536, 1, 256]
    - [19, 0.0]
  - - [3840, 769, 1, 256]
    - [1, 0.0]
  - - [42240, 2304, 1, 256]
    - [13, 0.0]
  - - [24576, 3072, 1, 256]
    - [19, 0.0]
  - - [27136, 1536, 1, 256]
    - [19, 0.0]
  - - [25344, 12801, 1, 256]
    - [19, 0.0]
  - - [32512, 20224, 1, 256]
    - [13, 0.0]
  - - [17664, 3072, 1, 256]
    - [19, 0.0]
  - - [28160, 15873, 1, 256]
    - [19, 0.0]
  - - [40960, 3072, 1, 256]
    - [19, 0.0]
  - - [14592, 9216, 1, 256]
    - [19, 0.0]
  - - [22784, 10497, 1, 256]
    - [13, 0.0]
  - - [22272, 3072, 1, 256]
    - [19, 0.0]
  - - [39680, 27137, 1, 256]
    - [19, 0.0]
  - - [20992, 8704, 1, 256]
    - [19, 0.0]
  - - [24320, 1536, 1, 256]
    - [19, 0.0]
  - - [7936, 4865, 1, 256]
    - [13, 0.0]
  - - [17664, 5376, 1, 256]
    - [13, 0.0]
  - - [37888, 25345, 1, 256]
    - [13, 0.0]
  - - [23296, 10753, 1, 256]
    - [19, 0.0]
  - - [28416, 15873, 1, 256]
    - [19, 0.0]
  - - [27648, 15361, 1, 256]
    - [19, 0.0]
  - - [39424, 1536, 1, 256]
    - [19, 0.0]
  - - [15104, 2817, 1, 256]
    - [13, 0.0]
  - - [19456, 9216, 1, 256]
    - [19, 0.0]
  - - [24064, 11777, 1, 256]
    - [19, 0.0]
  - - [40448, 1536, 1, 256]
    - [19, 0.0]
  - - [512, 3072, 1, 256]
    - [25, 0.0]
  - - [38912, 9216, 1, 256]
    - [19, 0.0]
  - - [19456, 6913, 1, 256]
    - [13, 0.0]
  - - [29440, 1792, 1, 256]
    - [13, 0.0]
  - - [41984, 9216, 1, 256]
    - [19, 0.0]
  - - [14080, 1793, 1, 256]
    - [13, 0.0]
  - - [20992, 8449, 1, 256]
    - [13, 0.0]
  - - [17920, 768, 1, 256]
    - [13, 0.0]
  - - [10496, 7169, 1, 256]
    - [19, 0.0]
  - - [40704, 27648, 1, 256]
    - [19, 0.0]
  - - [13568, 1025, 1, 256]
    - [16, 0.0]
  - - [38144, 9216, 1, 256]
    - [19, 0.0]
  - - [27392, 15104, 1, 256]
    - [13, 0.0]
  - - [2304, 3072, 1, 256]
    - [13, 0.0]
  - - [9472, 6401, 1, 256]
    - [13, 0.0]
  - - [39424, 1792, 1, 256]
    - [13, 0.0]
  - - [41728, 768, 1, 256]
    - [13, 0.0]
  - - [11264, 3072, 1, 256]
    - [19, 0.0]
  - - [25344, 3072, 1, 256]
    - [19, 0.0]
  - - [24576, 1792, 1, 256]
    - [13, 0.0]
  - - [27392, 14849, 1, 256]
    - [19, 0.0]
  - - [14848, 2561, 1, 256]
    - [19, 0.0]
  - - [28160, 3072, 1, 256]
    - [19, 0.0]
  - - [23552, 11009, 1, 256]
    - [13, 0.0]
  - - [11776, 8449, 1, 256]
    - [13, 0.0]
  - - [16640, 1792, 1, 256]
    - [13, 0.0]
  - - [24576, 12289, 1, 256]
    - [19, 0.0]
  - - [38656, 26369, 1, 256]
    - [13, 0.0]
  - - [13824, 9216, 1, 256]
    - [19, 0.0]
  - - [28928, 1792, 1, 256]
    - [13, 0.0]
  - - [27904, 15361, 1, 256]
    - [19, 0.0]
  - - [3840, 1792, 1, 256]
    - [19, 0.0]
  - - [14848, 3072, 1, 256]
    - [19, 0.0]
  - - [27904, 1536, 1, 256]
    - [19, 0.0]
  - - [34816, 1536, 1, 256]
    - [19, 0.0]
  - - [14592, 2305, 1, 256]
    - [13, 0.0]
  - - [22528, 9985, 1, 256]
    - [13, 0.0]
  - - [26368, 13825, 1, 256]
    - [19, 0.0]
  - - [4096, 1792, 1, 256]
    - [13, 0.0]
  - - [30720, 18177, 1, 256]
    - [13, 0.0]
  - - [37120, 24833, 1, 256]
    - [13, 0.0]
  - - [24320, 3072, 1, 256]
    - [19, 0.0]
  - - [2560, 1536, 1, 256]
    - [23, 0.0]
  - - [44032, 4097, 1, 256]
    - [19, 0.0]
  - - [44544, 27648, 1, 256]
    - [19, 0.0]
  - - [34048, 21761, 1, 256]
    - [13, 0.0]
  - - [24064, 1536, 1, 256]
    - [19, 0.0]
  - - [24832, 12545, 1, 256]
    - [13, 0.0]
  - - [44032, 3841, 1, 256]
    - [13, 0.0]
  - - [40448, 257, 1, 256]
    - [15, 0.0]
  - - [26624, 14337, 1, 256]
    - [19, 0.0]
  - - [8192, 5121, 1, 256]
    - [19, 0.0]
  - - [42240, 1536, 1, 256]
    - [19, 0.0]
  - - [5888, 2817, 1, 256]
    - [13, 0.0]
  - - [6144, 1792, 1, 256]
    - [13, 0.0]
  - - [16384, 1792, 1, 256]
    - [13, 0.0]
  - - [35584, 23297, 1, 256]
    - [13, 0.0]
  - - [36352, 24064, 1, 256]
    - [19, 0.0]
  - - [23040, 1536, 1, 256]
    - [19, 0.0]
  - - [8704, 1536, 1, 256]
    - [19, 0.0]
  - - [18432, 6145, 1, 256]
    - [19, 0.0]
  - - [12032, 3072, 1, 256]
    - [19, 0.0]
  - - [39168, 3072, 1, 256]
    - [19, 0.0]
  - - [28160, 1536, 1, 256]
    - [19, 0.0]
  - - [41728, 27648, 1, 256]
    - [19, 0.0]
  - - [28416, 1792, 1, 256]
    - [13, 0.0]
  - - [24320, 12032, 1, 256]
    - [13, 0.0]
  - - [28928, 16385, 1, 256]
    - [19, 0.0]
  - - [34816, 22528, 1, 256]
    - [19, 0.0]
  - - [26368, 1792, 1, 256]
    - [13, 0.0]
  - - [25856, 13569, 1, 256]
    - [13, 0.0]
  - - [25600, 13312, 1, 256]
    - [19, 0.0]
  - - [31232, 18689, 1, 256]
    - [13, 0.0]
  - - [20736, 9216, 1, 256]
    - [19, 0.0]
  - - [34304, 9216, 1, 256]
    - [19, 0.0]
  - - [43264, 3073, 1, 256]
    - [19, 0.0]
  - - [8704, 5633, 1, 256]
    - [19, 0.0]
  - - [4864, 1793, 1, 256]
    - [15, 0.0]
  - - [41984, 3072, 1, 256]
    - [19, 0.0]
  - - [20992, 3072, 1, 256]
    - [19, 0.0]
  - - [9728, 6401, 1, 256]
    - [13, 0.0]
  - - [16640, 4097, 1, 256]
    - [19, 0.0]
  - - [38400, 9216, 1, 256]
    - [19, 0.0]
  - - [38656, 1536, 1, 256]
    - [19, 0.0]
  - - [1536, 3072, 1, 256]
    - [19, 0.0]
  - - [12544, 1792, 1, 256]
    - [13, 0.0]
  - - [37632, 1792, 1, 256]
    - [13, 0.0]
  - - [17152, 4609, 1, 256]
    - [19, 0.0]
  - - [18944, 6656, 1, 256]
    - [19, 0.0]
  - - [34560, 22017, 1, 256]
    - [19, 0.0]
  - - [23296, 11008, 1, 256]
    - [13, 0.0]
  - - [14848, 768, 1, 256]
    - [13, 0.0]
  - - [38656, 1792, 1, 256]
    - [13, 0.0]
  - - [8448, 5377, 1, 256]
    - [13, 0.0]
  - - [29952, 17665, 1, 256]
    - [13, 0.0]
  - - [33792, 21504, 1, 256]
    - [19, 0.0]
  - - [24576, 1536, 1, 256]
    - [19, 0.0]
  - - [37376, 1792, 1, 256]
    - [13, 0.0]
  - - [42752, 768, 1, 256]
    - [13, 0.0]
  - - [4096, 1025, 1, 256]
    - [35, 0.0]
  - - [35840, 768, 1, 256]
    - [19, 0.0]
  - - [19200, 3072, 1, 256]
    - [19, 0.0]
  - - [33536, 1792, 1, 256]
    - [13, 0.0]
  - - [36864, 9216, 1, 256]
    - [19, 0.0]
  - - [38656, 26368, 1, 256]
    - [13, 0.0]
  - - [44288, 9216, 1, 256]
    - [19, 0.0]
  - - [44288, 4097, 1, 256]
    - [19, 0.0]
  - - [26112, 3072, 1, 256]
    - [19, 0.0]
  - - [512, 768, 1, 256]
    - [21, 0.0]
  - - [36096, 3072, 1, 256]
    - [19, 0.0]
  - - [4864, 1537, 1, 256]
    - [19, 0.0]
  - - [31232, 18944, 1, 256]
    - [19, 0.0]
  - - [20224, 7681, 1, 256]
    - [19, 0.0]
  - - [26112, 9216, 1, 256]
    - [19, 0.0]
  - - [21504, 3072, 1, 256]
    - [19, 0.0]
  - - [12544, 3072, 1, 256]
    - [19, 0.0]
  - - [32256, 19713, 1, 256]
    - [13, 0.0]
  - - [40704, 1792, 1, 256]
    - [13, 0.0]
  - - [18176, 5888, 1, 256]
    - [13, 0.0]
  - - [33792, 9216, 1, 256]
    - [19, 0.0]
  - - [26624, 14336, 1, 256]
    - [19, 0.0]
  - - [38912, 1792, 1, 256]
    - [13, 0.0]
  - - [7936, 1792, 1, 256]
    - [19, 0.0]
  - - [28672, 16385, 1, 256]
    - [19, 0.0]
  - - [18944, 3072, 1, 256]
    - [19, 0.0]
  - - [33280, 20993, 1, 256]
    - [19, 0.0]
  - - [37120, 24832, 1, 256]
    - [13, 0.0]
  - - [43520, 1792, 1, 256]
    - [13, 0.0]
  - - [16896, 4609, 1, 256]
    - [19, 0.0]
  - - [41472, 1536, 1, 256]
    - [19, 0.0]
  - - [39936, 768, 1, 256]
    - [13, 0.0]
  - - [23296, 11009, 1, 256]
    - [13, 0.0]
  - - [26624, 9216, 1, 256]
    - [19, 0.0]
  - - [29184, 9216, 1, 256]
    - [19, 0.0]
  - - [36352, 9216, 1, 256]
    - [19, 0.0]
  - - [37632, 25344, 1, 256]
    - [13, 0.0]
  - - [37888, 25600, 1, 256]
    - [19, 0.0]
  - - [16640, 9216, 1, 256]
    - [19, 0.0]
  - - [44544, 9216, 1, 256]
    - [19, 0.0]
  - - [14080, 1792, 1, 256]
    - [13, 0.0]
  - - [33536, 21249, 1, 256]
    - [13, 0.0]
  - - [34048, 21760, 1, 256]
    - [13, 0.0]
  - - [9984, 768, 1, 256]
    - [13, 0.0]
  - - [40192, 1536, 1, 256]
    - [19, 0.0]
  - - [41728, 3072, 1, 256]
    - [19, 0.0]
  - - [35328, 9216, 1, 256]
    - [19, 0.0]
  - - [32512, 768, 1, 256]
    - [13, 0.0]
  - - [14592, 2049, 1, 256]
    - [19, 0.0]
  - - [14848, 9216, 1, 256]
    - [19, 0.0]
  - - [23808, 3072, 1, 256]
    - [19, 0.0]
  - - [13568, 9216, 1, 256]
    - [19, 0.0]
  - - [42496, 2560, 1, 256]
    - [19, 0.0]
  - - [42752, 3072, 1, 256]
    - [19, 0.0]
  - - [39680, 27392, 1, 256]
    - [13, 0.0]
  - - [14592, 1792, 1, 256]
    - [13, 0.0]
  - - [25600, 13313, 1, 256]
    - [19, 0.0]
  - - [26624, 1792, 1, 256]
    - [13, 0.0]
  - - [20480, 8193, 1, 256]
    - [19, 0.0]
  - - [36096, 23808, 1, 256]
    - [13, 0.0]
  - - [15104, 2561, 1, 256]
    - [19, 0.0]
  - - [43520, 3072, 1, 256]
    - [19, 0.0]
  - - [1280, 2048, 1, 256]
    - [23, 0.0]
  - - [43008, 1792, 1, 256]
    - [13, 0.0]
  - - [18688, 3072, 1, 256]
    - [19, 0.0]
  - - [35328, 23040, 1, 256]
    - [19, 0.0]
  - - [18944, 6401, 1, 256]
    - [13, 0.0]
  - - [16128, 3585, 1, 256]
    - [19, 0.0]
  - - [29952, 1536, 1, 256]
    - [19, 0.0]
  - - [17408, 5121, 1, 256]
    - [19, 0.0]
  - - [36608, 1792, 1, 256]
    - [13, 0.0]
  - - [13056, 768, 1, 256]
    - [19, 0.0]
  - - [26112, 13824, 1, 256]
    - [19, 0.0]
  - - [43520, 3585, 1, 256]
    - [19, 0.0]
  - - [40704, 9216, 1, 256]
    - [19, 0.0]
  - - [27904, 15617, 1, 256]
    - [13, 0.0]
  - - [21248, 3072, 1, 256]
    - [19, 0.0]
  - - [38912, 1536, 1, 256]
    - [19, 0.0]
  - - [28672, 1792, 1, 256]
    - [13, 0.0]
  - - [18432, 1792, 1, 256]
    - [13, 0.0]
  - - [29952, 9216, 1, 256]
    - [19, 0.0]
  - - [4352, 1025, 1, 256]
    - [15, 0.0]
  - - [34304, 22017, 1, 256]
    - [19, 0.0]
  - - [28160, 15617, 1, 256]
    - [13, 0.0]
  - - [19968, 9216, 1, 256]
    - [19, 0.0]
  - - [7424, 4353, 1, 256]
    - [13, 0.0]
  - - [19200, 1792, 1, 256]
    - [13, 0.0]
  - - [27648, 15360, 1, 256]
    - [19, 0.0]
  - - [23040, 10497, 1, 256]
    - [13, 0.0]
  - - [21248, 8961, 1, 256]
    - [13, 0.0]
  - - [32256, 1792, 1, 256]
    - [13, 0.0]
  - - [26112, 13569, 1, 256]
    - [13, 0.0]
  - - [12288, 8961, 1, 256]
    - [13, 0.0]
  - - [6656, 3585, 1, 256]
    - [19, 0.0]
  - - [19968, 7425, 1, 256]
    - [13, 0.0]
  - - [9472, 768, 1, 256]
    - [13, 0.0]
  - - [33792, 3072, 1, 256]
    - [19, 0.0]
  - - [15616, 3072, 1, 256]
    - [19, 0.0]
  - - [8704, 5377, 1, 256]
    - [13, 0.0]
  - - [11520, 3072, 1, 256]
    - [19, 0.0]
  - - [25856, 1536, 1, 256]
    - [19, 0.0]
  - - [28416, 768, 1, 256]
    - [13, 0.0]
  - - [32256, 3072, 1, 256]
    - [19, 0.0]
  - - [20736, 1536, 1, 256]
    - [19, 0.0]
  - - [22784, 10241, 1, 256]
    - [19, 0.0]
  - - [36608, 24321, 1, 256]
    - [13, 0.0]
  - - [36096, 9216, 1, 256]
    - [19, 0.0]
  - - [10752, 768, 1, 256]
    - [13, 0.0]
  - - [38400, 26112, 1, 256]
    - [19, 0.0]
  - - [9216, 5889, 1, 256]
    - [13, 0.0]
  - - [41472, 27648, 1, 256]
    - [19, 0.0]
  - - [38144, 25856, 1, 256]
    - [13, 0.0]
  - - [15360, 3073, 1, 256]
    - [19, 0.0]
  - - [29184, 16896, 1, 256]
    - [19, 0.0]
  - - [16128, 1792, 1, 256]
    - [13, 0.0]
  - - [32768, 20225, 1, 256]
    - [13, 0.0]
  - - [23040, 10752, 1, 256]
    - [19, 0.0]
  - - [15872, 3585, 1, 256]
    - [19, 0.0]
  - - [11008, 7681, 1, 256]
    - [19, 0.0]
  - - [15360, 9216, 1, 256]
    - [19, 0.0]
  - - [28416, 16128, 1, 256]
    - [13, 0.0]
  - - [30208, 1792, 1, 256]
    - [13, 0.0]
  - - [41728, 1792, 1, 256]
    - [13, 0.0]
  - - [32256, 19968, 1, 256]
    - [19, 0.0]
  - - [18944, 1792, 1, 256]
    - [13, 0.0]
  - - [41728, 1793, 1, 256]
    - [13, 0.0]
  - - [31488, 19201, 1, 256]
    - [13, 0.0]
  - - [40192, 257, 1, 256]
    - [16, 0.0]
  - - [42752, 27648, 1, 256]
    - [19, 0.0]
  - - [40704, 768, 1, 256]
    - [13, 0.0]
  - - [25088, 12545, 1, 256]
    - [13, 0.0]
  - - [24576, 9216, 1, 256]
    - [19, 0.0]
  - - [33024, 20737, 1, 256]
    - [13, 0.0]
  - - [29696, 9216, 1, 256]
    - [19, 0.0]
  - - [31232, 1536, 1, 256]
    - [19, 0.0]
  - - [30208, 17920, 1, 256]
    - [19, 0.0]
  - - [44544, 4609, 1, 256]
    - [19, 0.0]
  - - [22016, 9728, 1, 256]
    - [19, 0.0]
  - - [30208, 17921, 1, 256]
    - [19, 0.0]
  - - [19200, 6657, 1, 256]
    - [19, 0.0]
  - - [22016, 9729, 1, 256]
    - [19, 0.0]
  - - [18176, 768, 1, 256]
    - [13, 0.0]
  - - [29184, 1792, 1, 256]
    - [13, 0.0]
  - - [12288, 1792, 1, 256]
    - [13, 0.0]
  - - [22528, 1536, 1, 256]
    - [19, 0.0]
  - - [14848, 2305, 1, 256]
    - [13, 0.0]
  - - [41216, 1025, 1, 256]
    - [16, 0.0]
  - - [8192, 3072, 1, 256]
    - [19, 0.0]
  - - [5888, 1792, 1, 256]
    - [13, 0.0]
  - - [21760, 3072, 1, 256]
    - [19, 0.0]
  - - [22272, 9985, 1, 256]
    - [13, 0.0]
  - - [29184, 1536, 1, 256]
    - [19, 0.0]
  - - [22016, 3072, 1, 256]
    - [19, 0.0]
  - - [30720, 9216, 1, 256]
    - [19, 0.0]
  - - [39680, 1792, 1, 256]
    - [13, 0.0]
  - - [9728, 1536, 1, 256]
    - [19, 0.0]
  - - [34560, 9216, 1, 256]
    - [19, 0.0]
  - - [12032, 8705, 1, 256]
    - [19, 0.0]
  - - [10752, 7425, 1, 256]
    - [13, 0.0]
  - - [18688, 1536, 1, 256]
    - [19, 0.0]
  - - [16128, 3840, 1, 256]
    - [13, 0.0]
  - - [38656, 768, 1, 256]
    - [13, 0.0]
  - - [21248, 1792, 1, 256]
    - [13, 0.0]
  - - [36352, 3072, 1, 256]
    - [19, 0.0]
  - - [19968, 7680, 1, 256]
    - [19, 0.0]
  - - [3840, 513, 1, 256]
    - [15, 0.0]
  - - [38400, 3072, 1, 256]
    - [19, 0.0]
  - - [5376, 768, 1, 256]
    - [13, 0.0]
  - - [20224, 9216, 1, 256]
    - [19, 0.0]
  - - [17408, 5120, 1, 256]
    - [19, 0.0]
  - - [28928, 9216, 1, 256]
    - [19, 0.0]
  - - [35072, 1792, 1, 256]
    - [13, 0.0]
  - - [31488, 19200, 1, 256]
    - [13, 0.0]
  - - [11008, 7937, 1, 256]
    - [13, 0.0]
  - - [21248, 8705, 1, 256]
    - [19, 0.0]
  - - [13568, 3072, 1, 256]
    - [19, 0.0]
  - - [34560, 22273, 1, 256]
    - [13, 0.0]
  - - [34048, 768, 1, 256]
    - [13, 0.0]
  - - [40448, 27648, 1, 256]
    - [19, 0.0]
  - - [28416, 16129, 1, 256]
    - [13, 0.0]
  - - [34816, 22529, 1, 256]
    - [19, 0.0]
  - - [22528, 3072, 1, 256]
    - [19, 0.0]
  - - [27136, 14593, 1, 256]
    - [13, 0.0]
  - - [35584, 3072, 1, 256]
    - [19, 0.0]
  - - [43008, 3072, 1, 256]
    - [19, 0.0]
  - - [30464, 1792, 1, 256]
    - [13, 0.0]
  - - [16384, 4097, 1, 256]
    - [19, 0.0]
  - - [20992, 9216, 1, 256]
    - [19, 0.0]
  - - [31488, 1792, 1, 256]
    - [13, 0.0]
  - - [31488, 9216, 1, 256]
    - [19, 0.0]
  - - [22272, 9984, 1, 256]
    - [13, 0.0]
  - - [41728, 1537, 1, 256]
    - [19, 0.0]
  - - [26880, 1792, 1, 256]
    - [13, 0.0]
  - - [30464, 768, 1, 256]
    - [13, 0.0]
  - - [2816, 1792, 1, 256]
    - [13, 0.0]
  - - [41472, 1537, 1, 256]
    - [19, 0.0]
  - - [43008, 27648, 1, 256]
    - [19, 0.0]
  - - [39424, 27137, 1, 256]
    - [19, 0.0]
  - - [24320, 1792, 1, 256]
    - [13, 0.0]
  - - [32000, 3072, 1, 256]
    - [19, 0.0]
  - - [12800, 1792, 1, 256]
    - [13, 0.0]
  - - [15872, 3072, 1, 256]
    - [19, 0.0]
  - - [15872, 1792, 1, 256]
    - [13, 0.0]
  - - [10496, 7425, 1, 256]
    - [13, 0.0]
  - - [16896, 4608, 1, 256]
    - [19, 0.0]
  - - [9984, 6913, 1, 256]
    - [13, 0.0]
  - - [21248, 8960, 1, 256]
    - [13, 0.0]
  - - [14336, 1792, 1, 256]
    - [19, 0.0]
  - - [24832, 12544, 1, 256]
    - [13, 0.0]
  - - [30464, 18176, 1, 256]
    - [13, 0.0]
  - - [31744, 19201, 1, 256]
    - [13, 0.0]
  - - [1792, 768, 1, 256]
    - [33, 0.0]
  - - [1536, 2048, 1, 256]
    - [13, 0.0]
  - - [40192, 3072, 1, 256]
    - [19, 0.0]
  - - [42240, 3072, 1, 256]
    - [19, 0.0]
  - - [32256, 9216, 1, 256]
    - [19, 0.0]
  - - [41984, 2049, 1, 256]
    - [19, 0.0]
  - - [6656, 1792, 1, 256]
    - [13, 0.0]
  - - [13824, 1537, 1, 256]
    - [19, 0.0]
  - - [20736, 3072, 1, 256]
    - [19, 0.0]
  - - [36096, 23809, 1, 256]
    - [13, 0.0]
  - - [41728, 9216, 1, 256]
    - [19, 0.0]
  - - [25600, 768, 1, 256]
    - [13, 0.0]
  - - [37632, 768, 1, 256]
    - [13, 0.0]
  - - [25600, 9216, 1, 256]
    - [19, 0.0]
  - - [19968, 3072, 1, 256]
    - [19, 0.0]
  - - [15616, 9216, 1, 256]
    - [19, 0.0]
  - - [29184, 16897, 1, 256]
    - [19, 0.0]
  - - [7168, 3841, 1, 256]
    - [13, 0.0]
  - - [40704, 769, 1, 256]
    - [13, 0.0]
  - - [6144, 3073, 1, 256]
    - [19, 0.0]
  - - [34304, 1792, 1, 256]
    - [13, 0.0]
  - - [18688, 6400, 1, 256]
    - [13, 0.0]
  - - [20992, 1536, 1, 256]
    - [19, 0.0]
  - - [21760, 768, 1, 256]
    - [13, 0.0]
  - - [43264, 3072, 1, 256]
    - [19, 0.0]
  - - [21760, 9216, 1, 256]
    - [19, 0.0]
  - - [11264, 768, 1, 256]
    - [33, 0.0]
  - - [42496, 3072, 1, 256]
    - [19, 0.0]
  - - [30208, 17665, 1, 256]
    - [13, 0.0]
  - - [27392, 15105, 1, 256]
    - [13, 0.0]
  - - [29952, 17409, 1, 256]
    - [19, 0.0]
  - - [44032, 3072, 1, 256]
    - [19, 0.0]
  - - [41216, 9216, 1, 256]
    - [19, 0.0]
  - - [8448, 1536, 1, 256]
    - [19, 0.0]
  - - [36352, 768, 1, 256]
    - [13, 0.0]
  - - [23552, 768, 1, 256]
    - [13, 0.0]
  - - [7168, 3072, 1, 256]
    - [19, 0.0]
  - - [44288, 4353, 1, 256]
    - [13, 0.0]
  - - [36608, 768, 1, 256]
    - [19, 0.0]
  - - [15616, 3073, 1, 256]
    - [19, 0.0]
  - - [37376, 24833, 1, 256]
    - [13, 0.0]
  - - [38144, 25857, 1, 256]
    - [13, 0.0]
  - - [26880, 14592, 1, 256]
    - [13, 0.0]
  - - [6144, 2817, 1, 256]
    - [13, 0.0]
  - - [23808, 768, 1, 256]
    - [13, 0.0]
  - - [39168, 26881, 1, 256]
    - [13, 0.0]
  - - [5120, 1793, 1, 256]
    - [13, 0.0]
  - - [32512, 19969, 1, 256]
    - [19, 0.0]
  - - [43008, 2817, 1, 256]
    - [13, 0.0]
  - - [26112, 13825, 1, 256]
    - [19, 0.0]
  - - [33536, 3072, 1, 256]
    - [19, 0.0]
  - - [9728, 6657, 1, 256]
    - [19, 0.0]
  - - [2048, 3072, 1, 256]
    - [25, 0.0]
  - - [24832, 9216, 1, 256]
    - [19, 0.0]
  - - [5632, 2561, 1, 256]
    - [19, 0.0]
  - - [33280, 20992, 1, 256]
    - [19, 0.0]
  - - [20224, 7936, 1, 256]
    - [13, 0.0]
  - - [28672, 16384, 1, 256]
    - [19, 0.0]
  - - [28416, 9216, 1, 256]
    - [19, 0.0]
  - - [7936, 768, 1, 256]
    - [13, 0.0]
  - - [23552, 11265, 1, 256]
    - [19, 0.0]
  - - [25088, 3072, 1, 256]
    - [19, 0.0]
  - - [32000, 19457, 1, 256]
    - [19, 0.0]
  - - [44800, 3072, 1, 256]
    - [19, 0.0]
  - - [37120, 1792, 1, 256]
    - [13, 0.0]
  - - [30464, 18177, 1, 256]
    - [13, 0.0]
  - - [44544, 4608, 1, 256]
    - [19, 0.0]
  - - [7168, 768, 1, 256]
    - [35, 0.0]
  - - [18944, 9216, 1, 256]
    - [19, 0.0]
  - - [33280, 20737, 1, 256]
    - [13, 0.0]
  - - [25856, 3072, 1, 256]
    - [19, 0.0]
  - - [27648, 9216, 1, 256]
    - [19, 0.0]
  - - [5120, 2049, 1, 256]
    - [19, 0.0]
  - - [28160, 9216, 1, 256]
    - [19, 0.0]
  - - [37632, 25089, 1, 256]
    - [19, 0.0]
  - - [22016, 1792, 1, 256]
    - [13, 0.0]
  - - [16384, 9216, 1, 256]
    - [19, 0.0]
  - - [21504, 9217, 1, 256]
    - [19, 0.0]
  - - [20480, 7937, 1, 256]
    - [13, 0.0]
  - - [33536, 21248, 1, 256]
    - [13, 0.0]
  - - [12800, 768, 1, 256]
    - [19, 0.0]
  - - [28672, 9216, 1, 256]
    - [19, 0.0]
  - - [32000, 9216, 1, 256]
    - [19, 0.0]
  - - [44544, 3072, 1, 256]
    - [19, 0.0]
  - - [5376, 3072, 1, 256]
    - [19, 0.0]
  - - [35840, 23297, 1, 256]
    - [13, 0.0]
  - - [23808, 11521, 1, 256]
    - [13, 0.0]
  - - [13312, 1025, 1, 256]
    - [15, 0.0]
  - - [18176, 9216, 1, 256]
    - [19, 0.0]
  - - [17920, 5633, 1, 256]
    - [19, 0.0]
  - - [27648, 3072, 1, 256]
    - [19, 0.0]
  - - [1024, 3072, 1, 256]
    - [25, 0.0]
  - - [22016, 9216, 1, 256]
    - [19, 0.0]
  - - [21760, 9473, 1, 256]
    - [13, 0.0]
  - - [6144, 1536, 1, 256]
    - [19, 0.0]
  - - [16896, 1536, 1, 256]
    - [19, 0.0]
  - - [19968, 768, 1, 256]
    - [13, 0.0]
  - - [23552, 11264, 1, 256]
    - [19, 0.0]
  - - [27904, 3072, 1, 256]
    - [19, 0.0]
  - - [19712, 7425, 1, 256]
    - [13, 0.0]
  - - [26624, 14081, 1, 256]
    - [13, 0.0]
  - - [3328, 257, 1, 256]
    - [12, 0.0]
  - - [24320, 9216, 1, 256]
    - [19, 0.0]
  - - [14080, 3072, 1, 256]
    - [19, 0.0]
  - - [17408, 3072, 1, 256]
    - [19, 0.0]
  - - [21504, 9216, 1, 256]
    - [19, 0.0]
  - - [14848, 2560, 1, 256]
    - [19, 0.0]
  - - [34304, 3072, 1, 256]
    - [19, 0.0]
  - - [15104, 9216, 1, 256]
    - [19, 0.0]
  - - [17152, 4865, 1, 256]
    - [13, 0.0]
  - - [38912, 26625, 1, 256]
    - [19, 0.0]
  - - [41216, 1792, 1, 256]
    - [13, 0.0]
  - - [39424, 3072, 1, 256]
    - [19, 0.0]
  - - [30720, 18433, 1, 256]
    - [19, 0.0]
  - - [18944, 6657, 1, 256]
    - [19, 0.0]
  - - [5632, 1792, 1, 256]
    - [13, 0.0]
  - - [18176, 1792, 1, 256]
    - [13, 0.0]
  - - [31232, 9216, 1, 256]
    - [19, 0.0]
  - - [42752, 2561, 1, 256]
    - [19, 0.0]
  - - [18688, 9216, 1, 256]
    - [19, 0.0]
  - - [43776, 1792, 1, 256]
    - [13, 0.0]
  - - [10240, 1792, 1, 256]
    - [13, 0.0]
  - - [33792, 21505, 1, 256]
    - [19, 0.0]
  - - [25856, 13313, 1, 256]
    - [19, 0.0]
  - - [29952, 3072, 1, 256]
    - [19, 0.0]
  - - [5888, 768, 1, 256]
    - [13, 0.0]
  - - [20480, 9216, 1, 256]
    - [19, 0.0]
  - - [17152, 1792, 1, 256]
    - [13, 0.0]
  - - [23040, 10753, 1, 256]
    - [19, 0.0]
  - - [8960, 5889, 1, 256]
    - [13, 0.0]
  - - [16640, 4352, 1, 256]
    - [13, 0.0]
  - - [30464, 3072, 1, 256]
    - [19, 0.0]
  - - [16128, 9216, 1, 256]
    - [19, 0.0]
  - - [25344, 13057, 1, 256]
    - [13, 0.0]
  - - [39424, 9216, 1, 256]
    - [19, 0.0]
  - - [25600, 3072, 1, 256]
    - [19, 0.0]
  - - [28416, 3072, 1, 256]
    - [19, 0.0]
  - - [12800, 257, 1, 256]
    - [15, 0.0]
  - - [43264, 1792, 1, 256]
    - [13, 0.0]
  - - [20736, 8193, 1, 256]
    - [19, 0.0]
  - - [30976, 9216, 1, 256]
    - [19, 0.0]
  - - [40192, 27648, 1, 256]
    - [19, 0.0]
  - - [31232, 1792, 1, 256]
    - [13, 0.0]
  - - [36352, 23809, 1, 256]
    - [13, 0.0]
  - - [9984, 3072, 1, 256]
    - [19, 0.0]
  - - [11776, 1792, 1, 256]
    - [19, 0.0]
  - - [37120, 1536, 1, 256]
    - [19, 0.0]
  - - [14592, 2304, 1, 256]
    - [13, 0.0]
  - - [7424, 768, 1, 256]
    - [19, 0.0]
  - - [10240, 1536, 1, 256]
    - [19, 0.0]
  - - [27392, 9216, 1, 256]
    - [19, 0.0]
  - - [15104, 3072, 1, 256]
    - [19, 0.0]
  - - [19200, 9216, 1, 256]
    - [19, 0.0]
  - - [36096, 23553, 1, 256]
    - [19, 0.0]
  - - [16128, 3841, 1, 256]
    - [13, 0.0]
  - - [18432, 5889, 1, 256]
    - [13, 0.0]
  - - [43776, 3841, 1, 256]
    - [13, 0.0]
  - - [22528, 10241, 1, 256]
    - [19, 0.0]
  - - [20224, 3072, 1, 256]
    - [19, 0.0]
  - - [39680, 3072, 1, 256]
    - [19, 0.0]
  - - [20736, 8449, 1, 256]
    - [13, 0.0]
  - - [30720, 1792, 1, 256]
    - [13, 0.0]
  - - [36864, 24321, 1, 256]
    - [13, 0.0]
  - - [22784, 1536, 1, 256]
    - [19, 0.0]
  - - [7424, 4097, 1, 256]
    - [19, 0.0]
  - - [7680, 4609, 1, 256]
    - [19, 0.0]
  - - [12032, 768, 1, 256]
    - [13, 0.0]
  - - [1792, 3072, 1, 256]
    - [25, 0.0]
  - - [6400, 3073, 1, 256]
    - [19, 0.0]
  - - [29440, 17153, 1, 256]
    - [13, 0.0]
  - - [8704, 1792, 1, 256]
    - [19, 0.0]
  - - [30720, 3072, 1, 256]
    - [19, 0.0]
  - - [16384, 3841, 1, 256]
    - [13, 0.0]
  - - [40192, 9216, 1, 256]
    - [19, 0.0]
  - - [23040, 1792, 1, 256]
    - [13, 0.0]
  - - [37888, 25601, 1, 256]
    - [19, 0.0]
  - - [26368, 14080, 1, 256]
    - [13, 0.0]
  - - [30208, 3072, 1, 256]
    - [19, 0.0]
  - - [33024, 20736, 1, 256]
    - [13, 0.0]
  - - [35072, 22784, 1, 256]
    - [13, 0.0]
  - - [9472, 6145, 1, 256]
    - [19, 0.0]
  - - [22784, 1792, 1, 256]
    - [13, 0.0]
  - - [768, 2048, 1, 256]
    - [23, 0.0]
  - - [1024, 1280, 1, 256]
    - [24, 0.0]
  - - [41984, 27648, 1, 256]
    - [19, 0.0]
  - - [33024, 20481, 1, 256]
    - [19, 0.0]
  - - [33280, 1536, 1, 256]
    - [19, 0.0]
  - - [9216, 3072, 1, 256]
    - [19, 0.0]
  - - [22528, 1792, 1, 256]
    - [13, 0.0]
  - - [25088, 768, 1, 256]
    - [13, 0.0]
  - - [15745, 128, 1, 256]
    - [101, 59.428]
  - - [6017, 128, 1, 256]
    - [98, 40.968]
  - - [641, 128, 1, 256]
    - [143, 5.573]
  - - [21377, 128, 1, 256]
    - [168, 53.12]
  - - [18305, 128, 1, 256]
    - [128, 61.9]
  - - [23681, 128, 1, 128]
    - [163, 49.918]
  - - [10753, 128, 1, 256]
    - [194, 55.087]
  - - [641, 128, 1, 128]
    - [188, 3.63]
  - - [7169, 128, 1, 256]
    - [132, 48.156]
  - - [14593, 128, 1, 256]
    - [150, 58.644]
  - - [19073, 128, 1, 128]
    - [140, 47.606]
  - - [15617, 128, 1, 128]
    - [123, 46.591]
  - - [24833, 128, 1, 256]
    - [135, 62.135]
  - - [6145, 128, 1, 128]
    - [134, 31.083]
  - - [10369, 128, 1, 256]
    - [200, 53.388]
  - - [12545, 128, 1, 256]
    - [115, 53.887]
  - - [11905, 128, 1, 256]
    - [144, 51.675]
  - - [27521, 128, 1, 256]
    - [169, 55.954]
  - - [24449, 128, 1, 128]
    - [153, 50.784]
  - - [6913, 128, 1, 128]
    - [196, 33.299]
  - - [6401, 128, 1, 128]
    - [141, 31.442]
  - - [19841, 128, 1, 256]
    - [128, 57.665]
  - - [7553, 128, 1, 256]
    - [132, 49.474]
  - - [18689, 128, 1, 128]
    - [97, 49.053]
  - - [28673, 128, 1, 256]
    - [124, 59.301]
  - - [13825, 128, 1, 128]
    - [92, 43.997]
  - - [1409, 128, 1, 128]
    - [138, 9.058]
  - - [4993, 128, 1, 128]
    - [188, 26.438]
  - - [16129, 128, 1, 256]
    - [110, 61.151]
  - - [22145, 128, 1, 256]
    - [150, 54.457]
  - - [23297, 128, 1, 128]
    - [153, 48.328]
  - - [4865, 128, 1, 128]
    - [142, 25.166]
  - - [17153, 128, 1, 256]
    - [102, 62.327]
  - - [25217, 128, 1, 128]
    - [157, 52.093]
  - - [9857, 128, 1, 256]
    - [93, 49.776]
  - - [5633, 128, 1, 128]
    - [147, 27.149]
  - - [12545, 128, 1, 128]
    - [115, 42.141]
  - - [14465, 128, 1, 128]
    - [204, 41.669]
  - - [11777, 128, 1, 256]
    - [192, 51.458]
  - - [10753, 128, 1, 128]
    - [114, 39.849]
  - - [23681, 128, 1, 256]
    - [90, 57.936]
  - - [7297, 128, 1, 128]
    - [141, 30.571]
  - - [28289, 128, 1, 256]
    - [170, 60.835]
  - - [13057, 128, 1, 128]
    - [197, 41.262]
  - - [8833, 128, 1, 128]
    - [115, 32.693]
  - - [1793, 128, 1, 128]
    - [189, 9.5]
  - - [385, 128, 1, 256]
    - [138, 3.541]
  - - [25985, 128, 1, 128]
    - [163, 52.597]
  - - [22529, 128, 1, 256]
    - [120, 59.888]
  - - [12161, 128, 1, 256]
    - [144, 51.217]
  - - [9601, 128, 1, 256]
    - [193, 47.785]
  - - [4097, 128, 1, 256]
    - [188, 31.373]
  - - [3841, 128, 1, 256]
    - [142, 29.638]
  - - [6401, 128, 1, 256]
    - [141, 43.552]
  - - [27905, 128, 1, 128]
    - [121, 51.779]
  - - [11009, 128, 1, 256]
    - [193, 53.175]
  - - [21761, 128, 1, 128]
    - [163, 50.393]
  - - [7681, 128, 1, 256]
    - [179, 40.372]
  - - [2305, 128, 1, 128]
    - [165, 12.835]
  - - [17153, 128, 1, 128]
    - [102, 47.579]
  - - [7553, 128, 1, 128]
    - [98, 35.24]
  - - [26369, 128, 1, 128]
    - [97, 54.173]
  - - [6017, 128, 1, 128]
    - [151, 29.877]
  - - [14209, 128, 1, 128]
    - [126, 42.771]
  - - [4097, 128, 1, 128]
    - [143, 21.972]
  - - [384, 128, 1, 256]
    - [138, 3.099]
  - - [2177, 128, 1, 128]
    - [162, 12.381]
  - - [15361, 128, 1, 128]
    - [107, 45.845]
  - - [28673, 128, 1, 128]
    - [106, 52.345]
  - - [13057, 128, 1, 256]
    - [173, 54.785]
  - - [9217, 128, 1, 128]
    - [177, 36.401]
  - - [17537, 128, 1, 256]
    - [140, 61.041]
  - - [16001, 128, 1, 128]
    - [176, 43.964]
  - - [21761, 128, 1, 256]
    - [104, 61.173]
  - - [4481, 128, 1, 256]
    - [143, 29.39]
  - - [385, 128, 1, 128]
    - [138, 2.011]
  - - [16769, 128, 1, 128]
    - [102, 43.478]
  - - [22913, 128, 1, 256]
    - [190, 58.949]
  - - [19457, 128, 1, 256]
    - [202, 47.215]
  - - [6145, 128, 1, 256]
    - [106, 43.617]
  - - [1537, 128, 1, 128]
    - [138, 9.951]
  - - [3329, 128, 1, 128]
    - [189, 20.468]
  - - [25985, 128, 1, 256]
    - [163, 64.937]
  - - [9089, 128, 1, 128]
    - [203, 35.78]
  - - [26753, 128, 1, 128]
    - [163, 52.674]
  - - [20225, 128, 1, 256]
    - [118, 52.702]
  - - [19457, 128, 1, 128]
    - [207, 45.666]
  - - [6913, 128, 1, 256]
    - [189, 46.979]
  - - [2689, 128, 1, 256]
    - [191, 21.776]
  - - [11521, 128, 1, 256]
    - [205, 50.794]
  - - [23297, 128, 1, 256]
    - [121, 56.278]
  - - [11393, 128, 1, 128]
    - [195, 39.449]
  - - [13697, 128, 1, 256]
    - [192, 54.345]
  - - [14209, 128, 1, 256]
    - [201, 58.87]
  - - [16769, 128, 1, 256]
    - [94, 62.601]
  - - [11393, 128, 1, 256]
    - [114, 56.514]
  - - [13441, 128, 1, 256]
    - [150, 55.817]
  - - [257, 128, 1, 128]
    - [138, 1.298]
  - - [15233, 128, 1, 256]
    - [190, 58.926]
  - - [5377, 128, 1, 128]
    - [196, 28.544]
  - - [27521, 128, 1, 128]
    - [137, 50.659]
  - - [4609, 128, 1, 256]
    - [191, 34.225]
  - - [3073, 128, 1, 128]
    - [148, 18.229]
  - - [11521, 128, 1, 128]
    - [85, 37.758]
  - - [25601, 128, 1, 256]
    - [126, 63.286]
  - - [16385, 128, 1, 128]
    - [176, 42.811]
  - - [20993, 128, 1, 128]
    - [163, 48.955]
  - - [14465, 128, 1, 256]
    - [190, 58.005]
  - - [27137, 128, 1, 256]
    - [166, 63.111]
  - - [1153, 128, 1, 256]
    - [138, 9.832]
  - - [8705, 128, 1, 256]
    - [152, 47.309]
  - - [22913, 128, 1, 128]
    - [163, 50.858]
  - - [20609, 128, 1, 256]
    - [97, 51.415]
  - - [25217, 128, 1, 256]
    - [114, 62.015]
  - - [8321, 128, 1, 128]
    - [145, 31.931]
  - - [16385, 128, 1, 256]
    - [176, 60.913]
  - - [1921, 128, 1, 256]
    - [143, 16.889]
  - - [7937, 128, 1, 256]
    - [179, 43.126]
  - - [11137, 128, 1, 256]
    - [194, 51.198]
  - - [4225, 128, 1, 128]
    - [134, 21.264]
  - - [14081, 128, 1, 256]
    - [182, 54.174]
  - - [12929, 128, 1, 256]
    - [205, 55.339]
  - - [6529, 128, 1, 128]
    - [189, 32.457]
  - - [25601, 128, 1, 128]
    - [153, 52.772]
  - - [1409, 128, 1, 256]
    - [138, 13.282]
  - - [9985, 128, 1, 128]
    - [128, 38.308]
  - - [9857, 128, 1, 128]
    - [92, 36.37]
  - - [26369, 128, 1, 256]
    - [92, 65.947]
  - - [4225, 128, 1, 256]
    - [159, 31.082]
  - - [1153, 128, 1, 128]
    - [138, 7.494]
  - - [5249, 128, 1, 128]
    - [148, 25.757]
  - - [7297, 128, 1, 256]
    - [132, 47.861]
  - - [9985, 128, 1, 256]
    - [126, 51.539]
  - - [14593, 128, 1, 128]
    - [96, 40.533]
  - - [14081, 128, 1, 128]
    - [186, 41.802]
  - - [12929, 128, 1, 128]
    - [197, 38.103]
  - - [3457, 128, 1, 128]
    - [142, 19.758]
  - - [5761, 128, 1, 128]
    - [187, 27.89]
  - - [24065, 128, 1, 256]
    - [115, 59.935]
  - - [15233, 128, 1, 128]
    - [105, 44.118]
  - - [8705, 128, 1, 128]
    - [156, 31.504]
  - - [4865, 128, 1, 256]
    - [142, 34.616]
  - - [1025, 128, 1, 128]
    - [138, 5.976]
  - - [11009, 128, 1, 128]
    - [197, 38.12]
  - - [15361, 128, 1, 256]
    - [101, 56.546]
  - - [14977, 128, 1, 256]
    - [178, 59.517]
  - - [28289, 128, 1, 128]
    - [114, 52.082]
  - - [4481, 128, 1, 128]
    - [174, 22.049]
  - - [3457, 128, 1, 256]
    - [191, 30.762]
  - - [12289, 128, 1, 128]
    - [197, 35.869]
  - - [18689, 128, 1, 256]
    - [106, 61.968]
  - - [2177, 128, 1, 256]
    - [162, 20.012]
  - - [20993, 128, 1, 256]
    - [96, 53.157]
  - - [8065, 128, 1, 128]
    - [156, 34.272]
  - - [13313, 128, 1, 256]
    - [115, 56.442]
  - - [12673, 128, 1, 256]
    - [130, 54.975]
  - - [7937, 128, 1, 128]
    - [156, 32.251]
  - - [17921, 128, 1, 128]
    - [140, 45.603]
  - - [20225, 128, 1, 128]
    - [153, 46.958]
  - - [9473, 128, 1, 256]
    - [115, 51.164]
  - - [21377, 128, 1, 128]
    - [137, 48.196]
  - - [6785, 128, 1, 256]
    - [147, 44.046]
  - - [10241, 128, 1, 128]
    - [147, 37.169]
  - - [4609, 128, 1, 128]
    - [189, 24.912]
  - - [24449, 128, 1, 256]
    - [156, 60.088]
  - - [14977, 128, 1, 128]
    - [90, 40.763]
  - - [13697, 128, 1, 128]
    - [121, 42.582]
  - - [9601, 128, 1, 128]
    - [128, 36.867]
  - - [26753, 128, 1, 256]
    - [137, 63.647]
  - - [24065, 128, 1, 128]
    - [118, 50.993]
  - - [4993, 128, 1, 256]
    - [162, 34.836]
  - - [2945, 128, 1, 256]
    - [206, 26.23]
  - - [11777, 128, 1, 128]
    - [198, 38.984]
  - - [11905, 128, 1, 128]
    - [156, 38.886]
  - - [8065, 128, 1, 256]
    - [183, 44.25]
  - - [8321, 128, 1, 256]
    - [115, 45.01]
  - - [15617, 128, 1, 256]
    - [107, 59.726]
  - - [15745, 128, 1, 128]
    - [133, 43.315]
  - - [8449, 128, 1, 256]
    - [156, 44.999]
  - - [19841, 128, 1, 128]
    - [140, 47.502]
  - - [3841, 128, 1, 128]
    - [174, 20.094]
  - - [11137, 128, 1, 128]
    - [97, 39.608]
  - - [18305, 128, 1, 128]
    - [140, 48.985]
  - - [22145, 128, 1, 128]
    - [153, 52.206]
  - - [5761, 128, 1, 256]
    - [98, 39.935]
  - - [24833, 128, 1, 128]
    - [153, 53.079]
  - - [2945, 128, 1, 128]
    - [189, 16.616]
  - - [14849, 128, 1, 128]
    - [201, 43.441]
  - - [14849, 128, 1, 256]
    - [186, 60.799]
  - - [3713, 128, 1, 256]
    - [189, 31.296]
  - - [20609, 128, 1, 128]
    - [153, 49.326]
  - - [6529, 128, 1, 256]
    - [147, 43.834]
  - - [8449, 128, 1, 128]
    - [173, 33.72]
  - - [17537, 128, 1, 128]
    - [134, 45.524]
  - - [27137, 128, 1, 128]
    - [151, 51.196]
  - - [10241, 128, 1, 256]
    - [98, 52.023]
  - - [7681, 128, 1, 128]
    - [121, 31.308]
  - - [10625, 128, 1, 128]
    - [106, 37.766]
  - - [3713, 128, 1, 128]
    - [196, 22.915]
  - - [2689, 128, 1, 128]
    - [138, 16.251]
  - - [13313, 128, 1, 128]
    - [197, 43.817]
  - - [7169, 128, 1, 128]
    - [174, 34.312]
  - - [2561, 128, 1, 128]
    - [138, 15.583]
  - - [9089, 128, 1, 256]
    - [199, 48.457]
  - - [13441, 128, 1, 128]
    - [123, 41.627]
  - - [12289, 128, 1, 256]
    - [144, 52.406]
  - - [12161, 128, 1, 128]
    - [156, 40.157]
  - - [6785, 128, 1, 128]
    - [128, 32.978]
  - - [17921, 128, 1, 256]
    - [97, 61.578]
  - - [13825, 128, 1, 256]
    - [198, 55.58]
  - - [19073, 128, 1, 256]
    - [114, 65.234]
  - - [8833, 128, 1, 256]
    - [144, 48.86]
  - - [16129, 128, 1, 128]
    - [107, 46.32]
  - - [27905, 128, 1, 256]
    - [147, 61.997]
  - - [5377, 128, 1, 256]
    - [141, 37.899]
  - - [9473, 128, 1, 128]
    - [209, 37.639]
  - - [22529, 128, 1, 128]
    - [153, 51.666]
  - - [9217, 128, 1, 256]
    - [177, 49.768]
  - - [16001, 128, 1, 256]
    - [107, 61.293]
  - - [5633, 128, 1, 256]
    - [187, 40.742]
  - - [10625, 128, 1, 256]
    - [208, 52.305]
  - - [1921, 128, 1, 128]
    - [188, 12.018]
  - - [5249, 128, 1, 256]
    - [148, 38.801]
  - - [12673, 128, 1, 128]
    - [164, 41.453]
  - - [10369, 128, 1, 128]
    - [92, 38.911]
  - - [30976, 1024, 1, 128]
    - [100, 76.906]
  - - [42240, 26369, 1, 128]
    - [87, 85.914]
  - - [33024, 17025, 1, 128]
    - [82, 86.014]
  - - [39168, 512, 1, 128]
    - [100, 72.387]
  - - [30848, 1024, 1, 128]
    - [120, 76.89]
  - - [41728, 8192, 1, 128]
    - [87, 85.542]
  - - [39552, 23553, 1, 128]
    - [82, 85.937]
  - - [35072, 512, 1, 128]
    - [109, 72.655]
  - - [29952, 14081, 1, 128]
    - [87, 85.653]
  - - [33280, 2048, 1, 128]
    - [92, 81.155]
  - - [40320, 128, 1, 128]
    - [123, 47.428]
  - - [35456, 1024, 1, 128]
    - [120, 76.323]
  - - [36096, 1024, 1, 128]
    - [109, 77.458]
  - - [36992, 20993, 1, 128]
    - [83, 85.694]
  - - [36096, 20097, 1, 128]
    - [82, 86.032]
  - - [31488, 15489, 1, 128]
    - [82, 85.793]
  - - [39552, 23681, 1, 128]
    - [83, 85.93]
  - - [36864, 128, 1, 128]
    - [210, 45.609]
  - - [40320, 4096, 1, 128]
    - [100, 84.083]
  - - [35200, 2048, 1, 128]
    - [109, 81.658]
  - - [29824, 2048, 1, 128]
    - [100, 80.323]
  - - [34688, 2048, 1, 128]
    - [109, 82.209]
  - - [42752, 26753, 1, 128]
    - [83, 85.747]
  - - [34304, 4096, 1, 128]
    - [85, 83.756]
  - - [36480, 20481, 1, 128]
    - [83, 85.871]
  - - [33408, 128, 1, 128]
    - [163, 57.55]
  - - [38784, 4096, 1, 128]
    - [109, 83.774]
  - - [43264, 27393, 1, 128]
    - [82, 86.012]
  - - [34560, 128, 1, 128]
    - [163, 59.419]
  - - [30336, 4096, 1, 128]
    - [109, 83.781]
  - - [29056, 2048, 1, 128]
    - [118, 80.535]
  - - [34816, 512, 1, 128]
    - [120, 71.72]
  - - [38272, 2048, 1, 128]
    - [92, 81.847]
  - - [39808, 23937, 1, 128]
    - [83, 85.783]
  - - [30848, 512, 1, 128]
    - [109, 69.854]
  - - [40448, 512, 1, 128]
    - [109, 72.801]
  - - [40448, 24577, 1, 128]
    - [82, 85.765]
  - - [44544, 28545, 1, 128]
    - [82, 85.462]
  - - [30208, 14209, 1, 128]
    - [87, 85.546]
  - - [34688, 18689, 1, 128]
    - [92, 85.096]
  - - [31360, 512, 1, 128]
    - [92, 70.409]
  - - [38912, 512, 1, 128]
    - [109, 74.121]
  - - [39680, 1024, 1, 128]
    - [120, 75.437]
  - - [34048, 1024, 1, 128]
    - [92, 76.094]
  - - [39552, 4096, 1, 128]
    - [109, 84.293]
  - - [40320, 24321, 1, 128]
    - [85, 85.831]
  - - [40832, 24833, 1, 128]
    - [84, 85.607]
  - - [36736, 1024, 1, 128]
    - [121, 75.627]
  - - [44672, 1024, 1, 128]
    - [120, 77.308]
  - - [32000, 128, 1, 128]
    - [163, 55.209]
  - - [40704, 4096, 1, 128]
    - [100, 84.364]
  - - [38144, 1024, 1, 128]
    - [122, 76.065]
  - - [30720, 14849, 1, 128]
    - [82, 85.629]
  - - [38144, 8192, 1, 128]
    - [85, 85.362]
  - - [30208, 1024, 1, 128]
    - [120, 76.652]
  - - [43136, 1024, 1, 128]
    - [120, 77.491]
  - - [38528, 1024, 1, 128]
    - [121, 76.267]
  - - [43264, 2048, 1, 128]
    - [100, 82.284]
  - - [38400, 22529, 1, 128]
    - [83, 85.996]
  - - [37120, 128, 1, 128]
    - [151, 49.43]
  - - [32256, 128, 1, 128]
    - [163, 54.884]
  - - [29952, 13953, 1, 128]
    - [83, 85.513]
  - - [34560, 8192, 1, 128]
    - [109, 85.473]
  - - [37504, 21505, 1, 128]
    - [87, 85.778]
  - - [33536, 128, 1, 128]
    - [153, 59.303]
  - - [41856, 2048, 1, 128]
    - [109, 82.981]
  - - [32896, 4096, 1, 128]
    - [120, 83.783]
  - - [41856, 8192, 1, 128]
    - [109, 85.344]
  - - [29440, 4096, 1, 128]
    - [100, 83.744]
  - - [33664, 8192, 1, 128]
    - [109, 84.847]
  - - [36992, 512, 1, 128]
    - [109, 72.63]
  - - [33280, 512, 1, 128]
    - [123, 68.822]
  - - [41728, 128, 1, 128]
    - [106, 50.84]
  - - [31744, 128, 1, 128]
    - [153, 55.544]
  - - [31360, 1024, 1, 128]
    - [120, 76.792]
  - - [29952, 8192, 1, 128]
    - [83, 85.264]
  - - [38016, 2048, 1, 128]
    - [100, 81.485]
  - - [34176, 8192, 1, 128]
    - [100, 84.957]
  - - [30464, 512, 1, 128]
    - [106, 69.526]
  - - [41984, 2048, 1, 128]
    - [124, 81.658]
  - - [40448, 4096, 1, 128]
    - [92, 84.009]
  - - [33920, 4096, 1, 128]
    - [109, 83.201]
  - - [41088, 8192, 1, 128]
    - [85, 85.461]
  - - [39808, 8192, 1, 128]
    - [86, 85.205]
  - - [40832, 4096, 1, 128]
    - [109, 84.292]
  - - [30592, 2048, 1, 128]
    - [92, 81.308]
  - - [36352, 1024, 1, 128]
    - [120, 75.314]
  - - [30336, 2048, 1, 128]
    - [120, 80.707]
  - - [30976, 512, 1, 128]
    - [92, 71.045]
  - - [42368, 1024, 1, 128]
    - [109, 76.375]
  - - [29056, 1024, 1, 128]
    - [118, 74.945]
  - - [38784, 22913, 1, 128]
    - [87, 85.512]
  - - [28928, 512, 1, 128]
    - [125, 65.87]
  - - [40576, 512, 1, 128]
    - [120, 72.405]
  - - [34816, 4096, 1, 128]
    - [109, 84.339]
  - - [41600, 2048, 1, 128]
    - [118, 82.784]
  - - [29696, 8192, 1, 128]
    - [87, 85.113]
  - - [41856, 4096, 1, 128]
    - [120, 83.899]
  - - [35584, 2048, 1, 128]
    - [109, 81.365]
  - - [30848, 14849, 1, 128]
    - [120, 84.848]
  - - [33280, 17281, 1, 128]
    - [85, 85.887]
  - - [43776, 2048, 1, 128]
    - [109, 82.703]
  - - [42112, 8192, 1, 128]
    - [83, 85.366]
  - - [37376, 128, 1, 128]
    - [108, 45.564]
  - - [41600, 4096, 1, 128]
    - [109, 84.027]
  - - [36224, 20353, 1, 128]
    - [82, 85.452]
  - - [29952, 1024, 1, 128]
    - [121, 75.789]
  - - [34176, 1024, 1, 128]
    - [118, 75.162]
  - - [31744, 512, 1, 128]
    - [124, 72.095]
  - - [42624, 8192, 1, 128]
    - [85, 85.521]
  - - [41216, 128, 1, 128]
    - [123, 51.05]
  - - [42624, 26753, 1, 128]
    - [83, 85.717]
  - - [32512, 2048, 1, 128]
    - [126, 80.495]
  - - [40064, 4096, 1, 128]
    - [109, 84.477]
  - - [32640, 4096, 1, 128]
    - [109, 83.09]
  - - [42112, 26241, 1, 128]
    - [83, 85.764]
  - - [32256, 512, 1, 128]
    - [92, 72.767]
  - - [40960, 1024, 1, 128]
    - [127, 72.235]
  - - [35968, 128, 1, 128]
    - [109, 58.104]
  - - [32384, 8192, 1, 128]
    - [109, 85.154]
  - - [42880, 512, 1, 128]
    - [109, 72.828]
  - - [33024, 8192, 1, 128]
    - [83, 85.694]
  - - [43904, 1024, 1, 128]
    - [118, 77.023]
  - - [33664, 17665, 1, 128]
    - [83, 84.47]
  - - [41856, 512, 1, 128]
    - [118, 72.877]
  - - [40704, 128, 1, 128]
    - [123, 50.649]
  - - [33408, 17537, 1, 128]
    - [92, 84.927]
  - - [37120, 512, 1, 128]
    - [114, 70.434]
  - - [41216, 25345, 1, 128]
    - [83, 85.777]
  - - [39680, 8192, 1, 128]
    - [109, 85.654]
  - - [40192, 24193, 1, 128]
    - [82, 85.769]
  - - [33024, 17153, 1, 128]
    - [82, 85.861]
  - - [38272, 1024, 1, 128]
    - [118, 77.631]
  - - [35328, 1024, 1, 128]
    - [118, 76.717]
  - - [31104, 8192, 1, 128]
    - [100, 84.723]
  - - [40320, 8192, 1, 128]
    - [83, 85.527]
  - - [29312, 2048, 1, 128]
    - [109, 81.704]
  - - [36608, 20737, 1, 128]
    - [82, 85.746]
  - - [42240, 4096, 1, 128]
    - [100, 83.845]
  - - [43520, 2048, 1, 128]
    - [100, 82.224]
  - - [29056, 512, 1, 128]
    - [99, 69.612]
  - - [35328, 19329, 1, 128]
    - [83, 86.11]
  - - [30464, 128, 1, 128]
    - [114, 57.08]
  - - [29696, 13697, 1, 128]
    - [83, 85.63]
  - - [43904, 28033, 1, 128]
    - [84, 85.432]
  - - [35584, 19713, 1, 128]
    - [83, 85.883]
  - - [41088, 4096, 1, 128]
    - [124, 84.24]
  - - [42368, 2048, 1, 128]
    - [83, 82.628]
  - - [36736, 128, 1, 128]
    - [124, 47.31]
  - - [30336, 8192, 1, 128]
    - [109, 85.291]
  - - [43008, 128, 1, 128]
    - [99, 53.267]
  - - [37120, 1024, 1, 128]
    - [105, 75.831]
  - - [31104, 2048, 1, 128]
    - [120, 81.247]
  - - [33152, 4096, 1, 128]
    - [120, 83.255]
  - - [43392, 27521, 1, 128]
    - [82, 85.889]
  - - [37248, 21249, 1, 128]
    - [83, 85.522]
  - - [33920, 17921, 1, 128]
    - [83, 84.684]
  - - [39680, 4096, 1, 128]
    - [100, 84.068]
  - - [43264, 512, 1, 128]
    - [124, 74.45]
  - - [35712, 8192, 1, 128]
    - [84, 84.967]
  - - [31616, 2048, 1, 128]
    - [109, 81.705]
  - - [35328, 512, 1, 128]
    - [114, 72.311]
  - - [43136, 27265, 1, 128]
    - [83, 85.853]
  - - [30208, 128, 1, 128]
    - [163, 56.118]
  - - [40320, 24449, 1, 128]
    - [83, 85.725]
  - - [44288, 2048, 1, 128]
    - [100, 81.976]
  - - [35072, 1024, 1, 128]
    - [92, 75.451]
  - - [30464, 14465, 1, 128]
    - [82, 85.704]
  - - [44160, 8192, 1, 128]
    - [83, 85.573]
  - - [33792, 17793, 1, 128]
    - [85, 85.775]
  - - [37632, 1024, 1, 128]
    - [120, 76.727]
  - - [35968, 2048, 1, 128]
    - [100, 81.24]
  - - [38400, 8192, 1, 128]
    - [82, 85.428]
  - - [32512, 4096, 1, 128]
    - [92, 84.004]
  - - [32512, 16641, 1, 128]
    - [83, 85.97]
  - - [39424, 128, 1, 128]
    - [210, 48.248]
  - - [30976, 8192, 1, 128]
    - [83, 85.089]
  - - [35968, 20097, 1, 128]
    - [83, 85.557]
  - - [38656, 512, 1, 128]
    - [100, 73.755]
  - - [34944, 18945, 1, 128]
    - [83, 85.125]
  - - [33664, 17793, 1, 128]
    - [92, 84.635]
  - - [38656, 22657, 1, 128]
    - [83, 85.736]
  - - [34944, 1024, 1, 128]
    - [100, 76.697]
  - - [31872, 16001, 1, 128]
    - [82, 84.578]
  - - [43392, 8192, 1, 128]
    - [85, 85.278]
  - - [38016, 512, 1, 128]
    - [118, 73.965]
  - - [29440, 8192, 1, 128]
    - [87, 85.099]
  - - [35200, 1024, 1, 128]
    - [120, 76.541]
  - - [34304, 18433, 1, 128]
    - [85, 85.837]
  - - [44672, 28801, 1, 128]
    - [85, 85.633]
  - - [29184, 4096, 1, 128]
    - [100, 83.486]
  - - [33408, 8192, 1, 128]
    - [109, 85.186]
  - - [39040, 128, 1, 128]
    - [211, 46.472]
  - - [39680, 23681, 1, 128]
    - [82, 85.86]
  - - [38144, 4096, 1, 128]
    - [109, 84.124]
  - - [42368, 26497, 1, 128]
    - [83, 85.699]
  - - [42368, 4096, 1, 128]
    - [109, 84.211]
  - - [31872, 128, 1, 128]
    - [114, 52.903]
  - - [41984, 512, 1, 128]
    - [118, 75.979]
  - - [39296, 2048, 1, 128]
    - [92, 81.838]
  - - [33920, 2048, 1, 128]
    - [109, 80.731]
  - - [36736, 20865, 1, 128]
    - [83, 85.539]
  - - [34432, 8192, 1, 128]
    - [83, 84.856]
  - - [30848, 14977, 1, 128]
    - [120, 84.961]
  - - [31744, 15873, 1, 128]
    - [82, 85.806]
  - - [42880, 27009, 1, 128]
    - [83, 85.628]
  - - [42240, 26241, 1, 128]
    - [83, 85.917]
  - - [38400, 4096, 1, 128]
    - [109, 83.867]
  - - [42624, 26625, 1, 128]
    - [82, 86.02]
  - - [35072, 4096, 1, 128]
    - [100, 83.883]
  - - [40576, 4096, 1, 128]
    - [100, 83.914]
  - - [39296, 8192, 1, 128]
    - [85, 85.37]
  - - [42624, 512, 1, 128]
    - [128, 73.271]
  - - [32768, 8192, 1, 128]
    - [127, 78.606]
  - - [36864, 1024, 1, 128]
    - [109, 76.44]
  - - [43392, 128, 1, 128]
    - [120, 53.116]
  - - [41344, 2048, 1, 128]
    - [92, 81.705]
  - - [35584, 4096, 1, 128]
    - [109, 84.259]
  - - [40064, 2048, 1, 128]
    - [100, 83.01]
  - - [40576, 24705, 1, 128]
    - [82, 85.879]
  - - [39808, 1024, 1, 128]
    - [109, 75.065]
  - - [36992, 1024, 1, 128]
    - [118, 75.995]
  - - [42496, 1024, 1, 128]
    - [118, 76.599]
  - - [43904, 128, 1, 128]
    - [163, 54.461]
  - - [31232, 512, 1, 128]
    - [100, 70.893]
  - - [42112, 128, 1, 128]
    - [100, 56.304]
  - - [37376, 2048, 1, 128]
    - [109, 82.114]
  - - [38016, 128, 1, 128]
    - [151, 47.288]
  - - [42368, 8192, 1, 128]
    - [82, 85.623]
  - - [43392, 512, 1, 128]
    - [109, 76.245]
  - - [41984, 1024, 1, 128]
    - [121, 76.447]
  - - [42240, 2048, 1, 128]
    - [100, 82.518]
  - - [29952, 128, 1, 128]
    - [163, 53.287]
  - - [36608, 8192, 1, 128]
    - [83, 85.601]
  - - [32512, 16513, 1, 128]
    - [85, 85.917]
  - - [29568, 512, 1, 128]
    - [122, 67.708]
  - - [34304, 1024, 1, 128]
    - [109, 75.828]
  - - [41984, 4096, 1, 128]
    - [82, 84.143]
  - - [30464, 4096, 1, 128]
    - [100, 84.18]
  - - [41216, 2048, 1, 128]
    - [121, 82.094]
  - - [36480, 20609, 1, 128]
    - [83, 85.619]
  - - [44800, 4096, 1, 128]
    - [109, 83.946]
  - - [36864, 512, 1, 128]
    - [129, 69.002]
  - - [39680, 2048, 1, 128]
    - [109, 82.664]
  - - [43648, 4096, 1, 128]
    - [100, 84.11]
  - - [33664, 128, 1, 128]
    - [163, 55.537]
  - - [41600, 512, 1, 128]
    - [125, 72.982]
  - - [43776, 1024, 1, 128]
    - [109, 78.594]
  - - [37632, 512, 1, 128]
    - [118, 71.639]
  - - [44160, 128, 1, 128]
    - [129, 52.736]
  - - [37248, 8192, 1, 128]
    - [82, 85.188]
  - - [34816, 18817, 1, 128]
    - [84, 85.528]
  - - [38528, 22529, 1, 128]
    - [82, 85.869]
  - - [40192, 24321, 1, 128]
    - [83, 86.064]
  - - [40832, 128, 1, 128]
    - [114, 50.408]
  - - [29312, 8192, 1, 128]
    - [109, 85.248]
  - - [43776, 27777, 1, 128]
    - [82, 85.749]
  - - [37632, 21633, 1, 128]
    - [82, 86.004]
  - - [33792, 4096, 1, 128]
    - [93, 83.551]
  - - [35968, 1024, 1, 128]
    - [109, 77.122]
  - - [37888, 512, 1, 128]
    - [109, 74.268]
  - - [35968, 512, 1, 128]
    - [109, 73.983]
  - - [30592, 1024, 1, 128]
    - [120, 74.703]
  - - [38400, 512, 1, 128]
    - [106, 70.633]
  - - [43264, 1024, 1, 128]
    - [100, 77.241]
  - - [38528, 4096, 1, 128]
    - [100, 84.026]
  - - [28928, 1024, 1, 128]
    - [100, 75.413]
  - - [33152, 1024, 1, 128]
    - [124, 76.42]
  - - [41344, 1024, 1, 128]
    - [118, 77.903]
  - - [30848, 8192, 1, 128]
    - [109, 85.397]
  - - [41344, 4096, 1, 128]
    - [109, 84.868]
  - - [38912, 2048, 1, 128]
    - [121, 81.959]
  - - [38272, 128, 1, 128]
    - [135, 47.275]
  - - [31488, 4096, 1, 128]
    - [100, 83.907]
  - - [44416, 4096, 1, 128]
    - [109, 84.157]
  - - [39552, 2048, 1, 128]
    - [109, 82.643]
  - - [37760, 1024, 1, 128]
    - [109, 76.85]
  - - [34304, 18305, 1, 128]
    - [82, 85.931]
  - - [44544, 28673, 1, 128]
    - [83, 85.713]
  - - [44416, 8192, 1, 128]
    - [83, 85.65]
  - - [38144, 512, 1, 128]
    - [109, 75.22]
  - - [30208, 14337, 1, 128]
    - [82, 85.625]
  - - [38144, 2048, 1, 128]
    - [109, 82.414]
  - - [40448, 128, 1, 128]
    - [189, 50.91]
  - - [42240, 8192, 1, 128]
    - [82, 85.594]
  - - [39424, 2048, 1, 128]
    - [100, 82.383]
  - - [41088, 512, 1, 128]
    - [121, 73.771]
  - - [36224, 2048, 1, 128]
    - [124, 81.254]
  - - [31744, 4096, 1, 128]
    - [100, 83.413]
  - - [44160, 512, 1, 128]
    - [118, 73.223]
  - - [32000, 1024, 1, 128]
    - [109, 75.191]
  - - [42752, 1024, 1, 128]
    - [109, 77.41]
  - - [42496, 2048, 1, 128]
    - [109, 82.396]
  - - [32640, 2048, 1, 128]
    - [109, 81.33]
  - - [42752, 26881, 1, 128]
    - [83, 85.883]
  - - [32256, 8192, 1, 128]
    - [84, 85.168]
  - - [44800, 512, 1, 128]
    - [121, 75.301]
  - - [34816, 128, 1, 128]
    - [99, 57.648]
  - - [38272, 8192, 1, 128]
    - [83, 85.487]
  - - [44800, 28929, 1, 128]
    - [83, 85.986]
  - - [37120, 8192, 1, 128]
    - [109, 85.41]
  - - [43776, 512, 1, 128]
    - [124, 74.587]
  - - [43008, 1024, 1, 128]
    - [120, 79.001]
  - - [34432, 18561, 1, 128]
    - [83, 85.479]
  - - [36736, 4096, 1, 128]
    - [92, 83.526]
  - - [36224, 512, 1, 128]
    - [121, 73.455]
  - - [32768, 512, 1, 128]
    - [98, 63.204]
  - - [30592, 128, 1, 128]
    - [109, 54.594]
  - - [43008, 27137, 1, 128]
    - [83, 85.556]
  - - [34048, 18177, 1, 128]
    - [82, 85.846]
  - - [43136, 2048, 1, 128]
    - [118, 82.339]
  - - [29184, 13313, 1, 128]
    - [83, 85.532]
  - - [40064, 24193, 1, 128]
    - [83, 85.709]
  - - [40960, 128, 1, 128]
    - [157, 49.745]
  - - [29184, 2048, 1, 128]
    - [100, 81.38]
  - - [37248, 128, 1, 128]
    - [90, 45.874]
  - - [35328, 128, 1, 128]
    - [109, 55.049]
  - - [43264, 128, 1, 128]
    - [153, 53.51]
  - - [29952, 4096, 1, 128]
    - [100, 84.149]
  - - [36736, 20737, 1, 128]
    - [83, 85.332]
  - - [34176, 4096, 1, 128]
    - [92, 84.304]
  - - [32768, 1024, 1, 128]
    - [126, 68.747]
  - - [44160, 4096, 1, 128]
    - [109, 84.63]
  - - [31104, 1024, 1, 128]
    - [125, 75.784]
  - - [33792, 512, 1, 128]
    - [100, 72.161]
  - - [41216, 25217, 1, 128]
    - [83, 85.982]
  - - [31872, 1024, 1, 128]
    - [100, 74.177]
  - - [38528, 8192, 1, 128]
    - [109, 85.365]
  - - [44672, 4096, 1, 128]
    - [109, 84.467]
  - - [32512, 1024, 1, 128]
    - [122, 76.381]
  - - [39168, 8192, 1, 128]
    - [85, 85.329]
  - - [31360, 15361, 1, 128]
    - [100, 85.038]
  - - [38016, 22145, 1, 128]
    - [82, 85.776]
  - - [35712, 128, 1, 128]
    - [118, 57.241]
  - - [30208, 4096, 1, 128]
    - [120, 83.703]
  - - [33920, 128, 1, 128]
    - [163, 57.861]
  - - [30336, 128, 1, 128]
    - [109, 57.588]
  - - [42368, 128, 1, 128]
    - [134, 52.79]
  - - [38912, 4096, 1, 128]
    - [120, 84.068]
  - - [34176, 512, 1, 128]
    - [92, 71.757]
  - - [42752, 8192, 1, 128]
    - [109, 85.553]
  - - [31488, 1024, 1, 128]
    - [100, 76.454]
  - - [36608, 1024, 1, 128]
    - [100, 76.52]
  - - [41856, 128, 1, 128]
    - [134, 51.665]
  - - [29312, 13441, 1, 128]
    - [83, 85.344]
  - - [43520, 128, 1, 128]
    - [114, 53.963]
  - - [31616, 8192, 1, 128]
    - [109, 85.146]
  - - [40448, 2048, 1, 128]
    - [92, 82.369]
  - - [35328, 2048, 1, 128]
    - [109, 81.905]
  - - [36864, 20865, 1, 128]
    - [92, 84.903]
  - - [32000, 2048, 1, 128]
    - [92, 80.602]
  - - [34176, 18177, 1, 128]
    - [83, 85.253]
  - - [37504, 128, 1, 128]
    - [98, 46.855]
  - - [33792, 1024, 1, 128]
    - [100, 77.167]
  - - [31872, 8192, 1, 128]
    - [109, 84.536]
  - - [40704, 512, 1, 128]
    - [121, 73.775]
  - - [37632, 128, 1, 128]
    - [194, 46.666]
  - - [32640, 1024, 1, 128]
    - [120, 74.832]
  - - [44544, 8192, 1, 128]
    - [83, 85.206]
  - - [39424, 8192, 1, 128]
    - [83, 85.3]
  - - [39296, 512, 1, 128]
    - [121, 73.168]
  - - [35840, 128, 1, 128]
    - [153, 56.527]
  - - [39168, 1024, 1, 128]
    - [100, 77.224]
  - - [35712, 19841, 1, 128]
    - [87, 85.391]
  - - [29568, 13569, 1, 128]
    - [83, 85.031]
  - - [34944, 4096, 1, 128]
    - [109, 84.443]
  - - [32768, 2048, 1, 128]
    - [127, 74.555]
  - - [39296, 128, 1, 128]
    - [156, 48.066]
  - - [29568, 4096, 1, 128]
    - [100, 83.092]
  - - [39040, 1024, 1, 128]
    - [120, 76.428]
  - - [37376, 1024, 1, 128]
    - [109, 77.903]
  - - [33536, 2048, 1, 128]
    - [109, 81.138]
  - - [31488, 8192, 1, 128]
    - [83, 85.313]
  - - [37888, 1024, 1, 128]
    - [118, 77.123]
  - - [41472, 4096, 1, 128]
    - [85, 84.016]
  - - [30592, 512, 1, 128]
    - [99, 70.447]
  - - [34560, 18561, 1, 128]
    - [85, 85.83]
  - - [29184, 512, 1, 128]
    - [109, 71.033]
  - - [32256, 16257, 1, 128]
    - [82, 85.942]
  - - [43392, 27393, 1, 128]
    - [82, 85.892]
  - - [29312, 4096, 1, 128]
    - [109, 84.342]
  - - [43648, 2048, 1, 128]
    - [118, 82.625]
  - - [44288, 1024, 1, 128]
    - [100, 76.99]
  - - [35456, 128, 1, 128]
    - [153, 57.86]
  - - [44160, 28289, 1, 128]
    - [83, 85.89]
  - - [40320, 1024, 1, 128]
    - [120, 75.651]
  - - [37888, 22017, 1, 128]
    - [83, 86.167]
  - - [29696, 512, 1, 128]
    - [99, 67.962]
  - - [35840, 2048, 1, 128]
    - [109, 82.67]
  - - [37504, 2048, 1, 128]
    - [109, 81.648]
  - - [41728, 4096, 1, 128]
    - [93, 83.881]
  - - [42752, 4096, 1, 128]
    - [92, 83.852]
  - - [29824, 4096, 1, 128]
    - [100, 83.555]
  - - [44800, 1024, 1, 128]
    - [109, 77.859]
  - - [30592, 4096, 1, 128]
    - [109, 83.395]
  - - [43904, 4096, 1, 128]
    - [100, 84.052]
  - - [39552, 8192, 1, 128]
    - [83, 85.318]
  - - [37632, 2048, 1, 128]
    - [120, 82.277]
  - - [29312, 128, 1, 128]
    - [99, 56.767]
  - - [30080, 512, 1, 128]
    - [109, 68.796]
  - - [33664, 2048, 1, 128]
    - [120, 80.888]
  - - [43520, 27521, 1, 128]
    - [82, 85.697]
  - - [36224, 128, 1, 128]
    - [109, 58.658]
  - - [28928, 12929, 1, 128]
    - [82, 85.641]
  - - [29440, 1024, 1, 128]
    - [109, 75.986]
  - - [35840, 19969, 1, 128]
    - [83, 85.76]
  - - [42880, 4096, 1, 128]
    - [100, 84.235]
  - - [42496, 8192, 1, 128]
    - [82, 85.525]
  - - [39936, 24065, 1, 128]
    - [83, 86.087]
  - - [33408, 1024, 1, 128]
    - [100, 76.71]
  - - [32256, 2048, 1, 128]
    - [109, 81.871]
  - - [35712, 19713, 1, 128]
    - [83, 85.551]
  - - [40192, 4096, 1, 128]
    - [100, 84.033]
  - - [32000, 16129, 1, 128]
    - [83, 85.664]
  - - [44032, 512, 1, 128]
    - [109, 75.549]
  - - [35584, 128, 1, 128]
    - [163, 57.99]
  - - [35584, 8192, 1, 128]
    - [82, 85.264]
  - - [37888, 21889, 1, 128]
    - [83, 85.917]
  - - [37504, 1024, 1, 128]
    - [120, 76.809]
  - - [33664, 512, 1, 128]
    - [124, 70.061]
  - - [32384, 1024, 1, 128]
    - [105, 74.381]
  - - [38400, 1024, 1, 128]
    - [109, 77.093]
  - - [35200, 128, 1, 128]
    - [109, 55.327]
  - - [43648, 1024, 1, 128]
    - [109, 77.961]
  - - [36608, 128, 1, 128]
    - [109, 59.466]
  - - [32768, 128, 1, 128]
    - [111, 55.167]
  - - [28928, 4096, 1, 128]
    - [109, 82.917]
  - - [35200, 19329, 1, 128]
    - [82, 85.485]
  - - [41216, 8192, 1, 128]
    - [83, 85.478]
  - - [36864, 8192, 1, 128]
    - [109, 84.832]
  - - [40064, 128, 1, 128]
    - [185, 50.019]
  - - [42624, 1024, 1, 128]
    - [109, 77.51]
  - - [34688, 128, 1, 128]
    - [128, 58.409]
  - - [43648, 27777, 1, 128]
    - [82, 85.849]
  - - [37888, 8192, 1, 128]
    - [85, 85.399]
  - - [41472, 25601, 1, 128]
    - [85, 85.68]
  - - [38272, 512, 1, 128]
    - [118, 75.01]
  - - [35456, 4096, 1, 128]
    - [92, 83.999]
  - - [42496, 26625, 1, 128]
    - [82, 85.862]
  - - [43136, 4096, 1, 128]
    - [109, 84.162]
  - - [44800, 8192, 1, 128]
    - [85, 85.543]
  - - [36480, 8192, 1, 128]
    - [85, 85.222]
  - - [37504, 4096, 1, 128]
    - [109, 84.683]
  - - [39040, 8192, 1, 128]
    - [83, 85.199]
  - - [31104, 512, 1, 128]
    - [118, 72.148]
  - - [34176, 2048, 1, 128]
    - [109, 81.252]
  - - [31616, 512, 1, 128]
    - [120, 71.707]
  - - [35456, 2048, 1, 128]
    - [124, 82.327]
  - - [43136, 8192, 1, 128]
    - [109, 85.495]
  - - [33024, 128, 1, 128]
    - [111, 57.956]
  - - [38656, 4096, 1, 128]
    - [109, 84.253]
  - - [33408, 17409, 1, 128]
    - [83, 84.935]
  - - [39424, 1024, 1, 128]
    - [100, 76.861]
  - - [29312, 13313, 1, 128]
    - [83, 85.219]
  - - [35840, 4096, 1, 128]
    - [120, 83.8]
  - - [42496, 512, 1, 128]
    - [124, 72.861]
  - - [37632, 8192, 1, 128]
    - [82, 85.425]
  - - [41088, 2048, 1, 128]
    - [109, 82.448]
  - - [38528, 512, 1, 128]
    - [130, 70.68]
  - - [35072, 2048, 1, 128]
    - [121, 81.653]
  - - [31104, 4096, 1, 128]
    - [92, 83.305]
  - - [33280, 4096, 1, 128]
    - [83, 83.508]
  - - [43904, 8192, 1, 128]
    - [109, 85.296]
  - - [34816, 8192, 1, 128]
    - [87, 85.252]
  - - [38016, 1024, 1, 128]
    - [129, 75.987]
  - - [33152, 128, 1, 128]
    - [163, 58.595]
  - - [42496, 128, 1, 128]
    - [163, 52.554]
  - - [40832, 24961, 1, 128]
    - [84, 85.506]
  - - [41728, 1024, 1, 128]
    - [118, 77.404]
  - - [41472, 25473, 1, 128]
    - [83, 85.873]
  - - [34560, 2048, 1, 128]
    - [92, 81.588]
  - - [31616, 15617, 1, 128]
    - [120, 84.671]
  - - [33664, 4096, 1, 128]
    - [92, 83.186]
  - - [35328, 8192, 1, 128]
    - [83, 85.522]
  - - [39808, 4096, 1, 128]
    - [100, 83.926]
  - - [37248, 512, 1, 128]
    - [128, 71.391]
  - - [31360, 4096, 1, 128]
    - [109, 83.66]
  - - [41344, 8192, 1, 128]
    - [83, 85.265]
  - - [32000, 512, 1, 128]
    - [100, 72.722]
  - - [35968, 19969, 1, 128]
    - [82, 85.401]
  - - [30080, 14081, 1, 128]
    - [85, 85.414]
  - - [35840, 8192, 1, 128]
    - [109, 85.385]
  - - [44672, 2048, 1, 128]
    - [100, 82.567]
  - - [31872, 2048, 1, 128]
    - [100, 80.449]
  - - [42496, 4096, 1, 128]
    - [109, 84.616]
  - - [43776, 128, 1, 128]
    - [128, 56.352]
  - - [40704, 2048, 1, 128]
    - [100, 82.52]
  - - [34432, 128, 1, 128]
    - [106, 59.423]
  - - [44544, 2048, 1, 128]
    - [109, 82.787]
  - - [32384, 16385, 1, 128]
    - [100, 85.021]
  - - [43776, 27905, 1, 128]
    - [82, 85.859]
  - - [44032, 4096, 1, 128]
    - [109, 84.497]
  - - [36480, 512, 1, 128]
    - [121, 73.894]
  - - [44160, 1024, 1, 128]
    - [109, 78.776]
  - - [41216, 4096, 1, 128]
    - [109, 84.345]
  - - [44032, 2048, 1, 128]
    - [100, 81.652]
  - - [33152, 2048, 1, 128]
    - [109, 81.649]
  - - [41984, 25985, 1, 128]
    - [82, 85.867]
  - - [39552, 512, 1, 128]
    - [118, 73.248]
  - - [41344, 25473, 1, 128]
    - [82, 86.078]
  - - [40960, 4096, 1, 128]
    - [131, 82.43]
  - - [32640, 128, 1, 128]
    - [109, 54.468]
  - - [35968, 4096, 1, 128]
    - [92, 83.976]
  - - [33536, 4096, 1, 128]
    - [100, 83.472]
  - - [30976, 15105, 1, 128]
    - [85, 85.806]
  - - [35072, 8192, 1, 128]
    - [83, 85.528]
  - - [39424, 23425, 1, 128]
    - [83, 85.866]
  - - [43520, 1024, 1, 128]
    - [125, 76.344]
  - - [44288, 28417, 1, 128]
    - [82, 85.855]
  - - [30848, 128, 1, 128]
    - [114, 53.858]
  - - [35712, 512, 1, 128]
    - [121, 73.012]
  - - [44160, 2048, 1, 128]
    - [120, 82.194]
  - - [34048, 8192, 1, 128]
    - [82, 85.248]
  - - [40448, 24449, 1, 128]
    - [83, 85.915]
  - - [39168, 23297, 1, 128]
    - [83, 86.03]
  - - [32128, 1024, 1, 128]
    - [120, 76.308]
  - - [36864, 20993, 1, 128]
    - [92, 84.887]
  - - [40064, 1024, 1, 128]
    - [100, 75.487]
  - - [38784, 8192, 1, 128]
    - [109, 85.299]
  - - [37248, 2048, 1, 128]
    - [92, 81.947]
  - - [34560, 4096, 1, 128]
    - [109, 84.121]
  - - [39040, 23041, 1, 128]
    - [82, 85.797]
  - - [36480, 1024, 1, 128]
    - [118, 76.505]
  - - [39040, 2048, 1, 128]
    - [120, 82.058]
  - - [39808, 23809, 1, 128]
    - [83, 85.498]
  - - [36992, 4096, 1, 128]
    - [92, 84.01]
  - - [32768, 16897, 1, 128]
    - [127, 78.636]
  - - [30976, 2048, 1, 128]
    - [109, 80.44]
  - - [32640, 16769, 1, 128]
    - [92, 84.95]
  - - [29824, 13953, 1, 128]
    - [82, 85.07]
  - - [29184, 128, 1, 128]
    - [99, 56.206]
  - - [30720, 8192, 1, 128]
    - [109, 85.299]
  - - [30848, 2048, 1, 128]
    - [92, 80.524]
  - - [38016, 4096, 1, 128]
    - [109, 84.398]
  - - [35456, 8192, 1, 128]
    - [83, 85.116]
  - - [36992, 21121, 1, 128]
    - [82, 85.581]
  - - [36736, 2048, 1, 128]
    - [109, 82.382]
  - - [37888, 128, 1, 128]
    - [114, 50.534]
  - - [39808, 2048, 1, 128]
    - [120, 81.193]
  - - [41856, 25985, 1, 128]
    - [82, 85.678]
  - - [34688, 4096, 1, 128]
    - [109, 83.899]
  - - [38784, 1024, 1, 128]
    - [125, 75.985]
  - - [40960, 25089, 1, 128]
    - [93, 83.182]
  - - [32000, 4096, 1, 128]
    - [109, 83.972]
  - - [41600, 25601, 1, 128]
    - [82, 85.945]
  - - [37504, 512, 1, 128]
    - [109, 74.695]
  - - [32128, 16129, 1, 128]
    - [120, 84.962]
  - - [37248, 21377, 1, 128]
    - [83, 85.73]
  - - [35840, 512, 1, 128]
    - [120, 74.285]
  - - [36096, 128, 1, 128]
    - [153, 60.855]
  - - [32512, 8192, 1, 128]
    - [83, 85.473]
  - - [36736, 8192, 1, 128]
    - [109, 85.333]
  - - [42880, 1024, 1, 128]
    - [109, 77.028]
  - - [44288, 8192, 1, 128]
    - [82, 85.343]
  - - [36224, 1024, 1, 128]
    - [109, 75.825]
  - - [41344, 25345, 1, 128]
    - [83, 85.943]
  - - [32384, 512, 1, 128]
    - [124, 72.553]
  - - [38272, 4096, 1, 128]
    - [83, 83.803]
  - - [37120, 2048, 1, 128]
    - [109, 81.052]
  - - [33152, 8192, 1, 128]
    - [109, 84.783]
  - - [36096, 4096, 1, 128]
    - [120, 83.993]
  - - [34560, 18689, 1, 128]
    - [82, 85.947]
  - - [36864, 4096, 1, 128]
    - [109, 83.334]
  - - [34944, 512, 1, 128]
    - [114, 71.187]
  - - [37760, 128, 1, 128]
    - [164, 48.228]
  - - [31616, 128, 1, 128]
    - [163, 53.016]
  - - [36224, 4096, 1, 128]
    - [109, 84.453]
  - - [40576, 24577, 1, 128]
    - [83, 85.791]
  - - [34688, 1024, 1, 128]
    - [109, 75.518]
  - - [40192, 1024, 1, 128]
    - [109, 78.165]
  - - [44672, 512, 1, 128]
    - [109, 74.069]
  - - [33664, 1024, 1, 128]
    - [100, 73.964]
  - - [39424, 512, 1, 128]
    - [118, 74.053]
  - - [44416, 1024, 1, 128]
    - [129, 77.163]
  - - [33408, 2048, 1, 128]
    - [121, 81.876]
  - - [43648, 8192, 1, 128]
    - [83, 85.384]
  - - [43520, 27649, 1, 128]
    - [82, 85.707]
  - - [40448, 1024, 1, 128]
    - [100, 76.177]
  - - [33152, 17153, 1, 128]
    - [92, 85.136]
  - - [33024, 512, 1, 128]
    - [99, 69.558]
  - - [39680, 128, 1, 128]
    - [178, 46.941]
  - - [29696, 4096, 1, 128]
    - [109, 83.62]
  - - [42112, 2048, 1, 128]
    - [124, 81.911]
  - - [38016, 8192, 1, 128]
    - [82, 85.373]
  - - [30464, 8192, 1, 128]
    - [83, 85.248]
  - - [43648, 128, 1, 128]
    - [106, 51.676]
  - - [32896, 16897, 1, 128]
    - [120, 84.903]
  - - [43008, 8192, 1, 128]
    - [109, 85.257]
  - - [34304, 512, 1, 128]
    - [100, 71.442]
  - - [38528, 128, 1, 128]
    - [212, 45.761]
  - - [41216, 1024, 1, 128]
    - [120, 76.562]
  - - [38272, 22401, 1, 128]
    - [82, 85.903]
  - - [34048, 4096, 1, 128]
    - [120, 83.966]
  - - [30720, 512, 1, 128]
    - [120, 69.678]
  - - [41728, 512, 1, 128]
    - [99, 71.959]
  - - [43136, 512, 1, 128]
    - [120, 74.363]
  - - [41088, 1024, 1, 128]
    - [105, 76.642]
  - - [33536, 1024, 1, 128]
    - [100, 77.179]
  - - [41088, 25089, 1, 128]
    - [83, 85.89]
  - - [36352, 20353, 1, 128]
    - [82, 85.955]
  - - [29184, 1024, 1, 128]
    - [118, 76.707]
  - - [44800, 128, 1, 128]
    - [151, 53.394]
  - - [41600, 8192, 1, 128]
    - [83, 85.262]
  - - [44416, 28545, 1, 128]
    - [83, 85.759]
  - - [34048, 512, 1, 128]
    - [99, 70.584]
  - - [32128, 16257, 1, 128]
    - [83, 84.961]
  - - [44288, 4096, 1, 128]
    - [92, 83.915]
  - - [34432, 18433, 1, 128]
    - [82, 85.148]
  - - [41856, 25857, 1, 128]
    - [82, 85.857]
  - - [32128, 2048, 1, 128]
    - [124, 80.144]
  - - [34688, 512, 1, 128]
    - [132, 70.293]
  - - [39936, 4096, 1, 128]
    - [109, 84.319]
  - - [38656, 1024, 1, 128]
    - [120, 77.422]
  - - [37760, 512, 1, 128]
    - [114, 71.431]
  - - [30336, 512, 1, 128]
    - [120, 71.811]
  - - [38016, 22017, 1, 128]
    - [83, 85.847]
  - - [44544, 4096, 1, 128]
    - [109, 84.35]
  - - [38912, 8192, 1, 128]
    - [109, 85.389]
  - - [39936, 128, 1, 128]
    - [137, 48.383]
  - - [36480, 2048, 1, 128]
    - [118, 81.857]
  - - [35200, 4096, 1, 128]
    - [109, 84.305]
  - - [30976, 14977, 1, 128]
    - [82, 85.852]
  - - [31104, 15105, 1, 128]
    - [83, 85.296]
  - - [40832, 1024, 1, 128]
    - [109, 77.027]
  - - [32384, 16513, 1, 128]
    - [120, 84.985]
  - - [43392, 4096, 1, 128]
    - [83, 84.209]
  - - [32768, 4096, 1, 128]
    - [93, 77.242]
  - - [38272, 22273, 1, 128]
    - [87, 85.531]
  - - [32128, 512, 1, 128]
    - [109, 74.243]
  - - [32896, 2048, 1, 128]
    - [120, 80.856]
  - - [37376, 21505, 1, 128]
    - [83, 85.897]
  - - [41856, 1024, 1, 128]
    - [133, 75.909]
  - - [33536, 8192, 1, 128]
    - [92, 85.179]
  - - [29568, 1024, 1, 128]
    - [124, 76.148]
  - - [44032, 28033, 1, 128]
    - [83, 85.589]
  - - [33280, 8192, 1, 128]
    - [83, 85.702]
  - - [39296, 4096, 1, 128]
    - [118, 84.159]
  - - [30592, 14593, 1, 128]
    - [120, 84.984]
  - - [37504, 8192, 1, 128]
    - [82, 85.681]
  - - [30336, 14465, 1, 128]
    - [100, 85.25]
  - - [29952, 2048, 1, 128]
    - [109, 81.533]
  - - [40832, 512, 1, 128]
    - [109, 70.942]
  - - [44672, 28673, 1, 128]
    - [83, 85.949]
  - - [30080, 4096, 1, 128]
    - [100, 83.702]
  - - [37888, 2048, 1, 128]
    - [118, 81.718]
  - - [37632, 21761, 1, 128]
    - [82, 85.752]
  - - [29824, 8192, 1, 128]
    - [109, 85.313]
  - - [35328, 19457, 1, 128]
    - [85, 85.902]
  - - [37376, 4096, 1, 128]
    - [120, 83.907]
  - - [33792, 17921, 1, 128]
    - [87, 85.549]
  - - [34304, 8192, 1, 128]
    - [87, 85.199]
  - - [42752, 512, 1, 128]
    - [100, 75.774]
  - - [36992, 2048, 1, 128]
    - [120, 81.548]
  - - [39168, 4096, 1, 128]
    - [100, 84.232]
  - - [31360, 15489, 1, 128]
    - [83, 85.206]
  - - [43520, 8192, 1, 128]
    - [83, 85.61]
  - - [30080, 2048, 1, 128]
    - [92, 81.753]
  - - [30720, 4096, 1, 128]
    - [109, 83.712]
  - - [34176, 128, 1, 128]
    - [153, 59.203]
  - - [32768, 16769, 1, 128]
    - [127, 78.608]
  - - [35072, 128, 1, 128]
    - [97, 57.191]
  - - [35712, 4096, 1, 128]
    - [109, 83.869]
  - - [36480, 4096, 1, 128]
    - [92, 84.11]
  - - [39424, 4096, 1, 128]
    - [120, 83.965]
  - - [38400, 128, 1, 128]
    - [202, 47.98]
  - - [34432, 2048, 1, 128]
    - [120, 81.285]
  - - [41344, 512, 1, 128]
    - [118, 73.671]
  - - [35200, 512, 1, 128]
    - [100, 72.17]
  - - [39936, 8192, 1, 128]
    - [84, 85.44]
  - - [31488, 128, 1, 128]
    - [128, 55.687]
  - - [43008, 512, 1, 128]
    - [92, 73.157]
  - - [33024, 4096, 1, 128]
    - [120, 83.993]
  - - [36608, 512, 1, 128]
    - [109, 70.387]
  - - [37376, 8192, 1, 128]
    - [85, 85.401]
  - - [29824, 13825, 1, 128]
    - [120, 84.988]
  - - [36352, 2048, 1, 128]
    - [120, 82.057]
  - - [30336, 1024, 1, 128]
    - [128, 73.824]
  - - [44416, 28417, 1, 128]
    - [82, 85.715]
  - - [38144, 22273, 1, 128]
    - [83, 85.644]
  - - [28928, 2048, 1, 128]
    - [120, 80.705]
  - - [29568, 13697, 1, 128]
    - [83, 85.091]
  - - [43136, 27137, 1, 128]
    - [82, 85.893]
  - - [42112, 4096, 1, 128]
    - [109, 84.458]
  - - [40960, 512, 1, 128]
    - [131, 64.88]
  - - [35584, 1024, 1, 128]
    - [100, 76.349]
  - - [31232, 15361, 1, 128]
    - [83, 85.75]
  - - [40960, 8192, 1, 128]
    - [131, 83.427]
  - - [31232, 1024, 1, 128]
    - [123, 76.431]
  - - [29312, 512, 1, 128]
    - [118, 71.746]
  - - [44416, 512, 1, 128]
    - [120, 75.103]
  - - [42240, 512, 1, 128]
    - [121, 73.438]
  - - [31232, 8192, 1, 128]
    - [109, 85.076]
  - - [35072, 19201, 1, 128]
    - [83, 85.857]
  - - [29568, 128, 1, 128]
    - [99, 56.217]
  - - [33792, 2048, 1, 128]
    - [100, 81.235]
  - - [35712, 2048, 1, 128]
    - [109, 82.156]
  - - [40576, 128, 1, 128]
    - [156, 52.081]
  - - [40704, 1024, 1, 128]
    - [100, 76.933]
  - - [29824, 1024, 1, 128]
    - [121, 75.481]
  - - [33536, 17665, 1, 128]
    - [82, 85.898]
  - - [43008, 27009, 1, 128]
    - [84, 85.551]
  - - [34304, 2048, 1, 128]
    - [92, 81.194]
  - - [37120, 21249, 1, 128]
    - [83, 85.497]
  - - [41600, 1024, 1, 128]
    - [109, 77.423]
  - - [33024, 1024, 1, 128]
    - [118, 76.1]
  - - [42368, 512, 1, 128]
    - [118, 73.834]
  - - [30592, 14721, 1, 128]
    - [82, 85.142]
  - - [29696, 2048, 1, 128]
    - [109, 80.691]
  - - [31232, 128, 1, 128]
    - [163, 57.286]
  - - [38784, 22785, 1, 128]
    - [82, 85.374]
  - - [32896, 1024, 1, 128]
    - [105, 75.639]
  - - [32128, 128, 1, 128]
    - [163, 57.252]
  - - [35968, 8192, 1, 128]
    - [109, 85.362]
  - - [38400, 2048, 1, 128]
    - [92, 82.275]
  - - [36864, 2048, 1, 128]
    - [92, 81.277]
  - - [31616, 4096, 1, 128]
    - [109, 83.645]
  - - [34688, 18817, 1, 128]
    - [92, 85.083]
  - - [42624, 4096, 1, 128]
    - [100, 84.113]
  - - [29312, 1024, 1, 128]
    - [118, 75.952]
  - - [37760, 2048, 1, 128]
    - [120, 80.904]
  - - [39808, 512, 1, 128]
    - [120, 73.567]
  - - [41472, 128, 1, 128]
    - [118, 51.896]
  - - [32128, 4096, 1, 128]
    - [124, 83.163]
  - - [43520, 4096, 1, 128]
    - [100, 83.509]
  - - [41472, 512, 1, 128]
    - [134, 70.648]
  - - [38912, 22913, 1, 128]
    - [87, 85.612]
  - - [30464, 1024, 1, 128]
    - [118, 75.834]
  - - [33280, 128, 1, 128]
    - [163, 59.671]
  - - [31872, 15873, 1, 128]
    - [85, 84.669]
  - - [36352, 4096, 1, 128]
    - [92, 83.667]
  - - [30720, 2048, 1, 128]
    - [92, 80.768]
  - - [33792, 128, 1, 128]
    - [163, 58.915]
  - - [36096, 8192, 1, 128]
    - [83, 85.328]
  - - [38784, 128, 1, 128]
    - [102, 47.79]
  - - [30208, 2048, 1, 128]
    - [121, 80.927]
  - - [34432, 4096, 1, 128]
    - [92, 83.839]
  - - [42880, 128, 1, 128]
    - [135, 52.826]
  - - [31616, 15745, 1, 128]
    - [92, 84.629]
  - - [40960, 2048, 1, 128]
    - [135, 81.178]
  - - [41344, 128, 1, 128]
    - [163, 50.838]
  - - [41728, 25857, 1, 128]
    - [82, 86.025]
  - - [32896, 512, 1, 128]
    - [124, 72.31]
  - - [41728, 2048, 1, 128]
    - [120, 82.026]
  - - [42368, 26369, 1, 128]
    - [83, 85.87]
  - - [30720, 14721, 1, 128]
    - [85, 85.628]
  - - [37376, 512, 1, 128]
    - [105, 70.843]
  - - [35456, 19457, 1, 128]
    - [82, 85.417]
  - - [29184, 13185, 1, 128]
    - [82, 85.821]
  - - [34944, 128, 1, 128]
    - [153, 57.945]
  - - [36608, 20609, 1, 128]
    - [83, 85.993]
  - - [35584, 19585, 1, 128]
    - [82, 85.786]
  - - [42880, 8192, 1, 128]
    - [83, 85.555]
  - - [39936, 1024, 1, 128]
    - [100, 77.934]
  - - [34944, 19073, 1, 128]
    - [83, 85.335]
  - - [32512, 128, 1, 128]
    - [163, 57.449]
  - - [40064, 512, 1, 128]
    - [121, 73.67]
  - - [30464, 2048, 1, 128]
    - [92, 80.314]
  - - [30592, 8192, 1, 128]
    - [100, 84.871]
  - - [39040, 512, 1, 128]
    - [124, 72.056]
  - - [41088, 128, 1, 128]
    - [163, 50.61]
  - - [29824, 128, 1, 128]
    - [132, 55.645]
  - - [32384, 128, 1, 128]
    - [100, 56.834]
  - - [41728, 25729, 1, 128]
    - [83, 85.794]
  - - [30976, 4096, 1, 128]
    - [109, 83.909]
  - - [42624, 128, 1, 128]
    - [99, 51.798]
  - - [42112, 512, 1, 128]
    - [120, 73.266]
  - - [38784, 2048, 1, 128]
    - [109, 81.514]
  - - [35200, 8192, 1, 128]
    - [120, 85.38]
  - - [30976, 128, 1, 128]
    - [163, 53.909]
  - - [32640, 16641, 1, 128]
    - [92, 84.998]
  - - [41984, 8192, 1, 128]
    - [83, 85.512]
  - - [30080, 128, 1, 128]
    - [109, 56.285]
  - - [35584, 512, 1, 128]
    - [124, 73.12]
  - - [44800, 2048, 1, 128]
    - [100, 82.493]
  - - [34048, 128, 1, 128]
    - [163, 56.388]
  - - [35712, 1024, 1, 128]
    - [120, 75.559]
  - - [43136, 128, 1, 128]
    - [106, 52.716]
  - - [33280, 1024, 1, 128]
    - [100, 76.76]
  - - [34816, 18945, 1, 128]
    - [82, 85.722]
  - - [40704, 8192, 1, 128]
    - [87, 85.417]
  - - [34304, 128, 1, 128]
    - [153, 59.802]
  - - [39936, 512, 1, 128]
    - [121, 74.592]
  - - [36096, 2048, 1, 128]
    - [109, 82.097]
  - - [40832, 8192, 1, 128]
    - [86, 85.204]
  - - [37760, 4096, 1, 128]
    - [121, 83.757]
  - - [36736, 512, 1, 128]
    - [92, 68.56]
  - - [31744, 8192, 1, 128]
    - [87, 85.14]
  - - [33920, 1024, 1, 128]
    - [114, 73.05]
  - - [39808, 128, 1, 128]
    - [213, 48.012]
  - - [36608, 2048, 1, 128]
    - [109, 81.841]
  - - [30464, 14593, 1, 128]
    - [83, 85.708]
  - - [35200, 19201, 1, 128]
    - [82, 85.526]
  - - [41472, 1024, 1, 128]
    - [118, 77.555]
  - - [30720, 128, 1, 128]
    - [109, 56.662]
  - - [41600, 128, 1, 128]
    - [165, 50.997]
  - - [38144, 22145, 1, 128]
    - [82, 86.119]
  - - [37120, 4096, 1, 128]
    - [100, 83.908]
  - - [40704, 24705, 1, 128]
    - [82, 85.986]
  - - [41088, 25217, 1, 128]
    - [83, 85.945]
  - - [43776, 8192, 1, 128]
    - [83, 85.779]
  - - [38912, 1024, 1, 128]
    - [118, 78.142]
  - - [43008, 2048, 1, 128]
    - [92, 81.801]
  - - [42496, 26497, 1, 128]
    - [83, 85.611]
  - - [33536, 512, 1, 128]
    - [100, 68.884]
  - - [43520, 512, 1, 128]
    - [109, 75.965]
  - - [39040, 23169, 1, 128]
    - [82, 85.685]
  - - [29568, 2048, 1, 128]
    - [92, 80.495]
  - - [44672, 8192, 1, 128]
    - [85, 85.433]
  - - [29824, 512, 1, 128]
    - [125, 69.272]
  - - [34944, 2048, 1, 128]
    - [92, 81.01]
  - - [33408, 4096, 1, 128]
    - [118, 83.034]
  - - [41600, 25729, 1, 128]
    - [83, 85.761]
  - - [40832, 2048, 1, 128]
    - [92, 82.591]
  - - [38912, 128, 1, 128]
    - [109, 47.693]
  - - [34048, 2048, 1, 128]
    - [120, 81.031]
  - - [43904, 2048, 1, 128]
    - [126, 81.22]
  - - [39296, 23297, 1, 128]
    - [83, 85.836]
  - - [31232, 4096, 1, 128]
    - [120, 84.132]
  - - [35840, 1024, 1, 128]
    - [100, 77.702]
  - - [28928, 128, 1, 128]
    - [109, 55.279]
  - - [42752, 2048, 1, 128]
    - [109, 82.796]
  - - [44032, 1024, 1, 128]
    - [120, 78.836]
  - - [29440, 13569, 1, 128]
    - [83, 85.599]
  - - [35456, 19585, 1, 128]
    - [82, 85.311]
  - - [35840, 19841, 1, 128]
    - [83, 85.991]
  - - [31360, 128, 1, 128]
    - [99, 54.072]
  - - [40192, 2048, 1, 128]
    - [120, 81.835]
  - - [33920, 8192, 1, 128]
    - [109, 84.669]
  - - [43648, 512, 1, 128]
    - [100, 74.135]
  - - [30080, 14209, 1, 128]
    - [100, 85.243]
  - - [39680, 23809, 1, 128]
    - [87, 85.926]
  - - [32512, 512, 1, 128]
    - [109, 73.598]
  - - [34816, 2048, 1, 128]
    - [120, 81.819]
  - - [43392, 1024, 1, 128]
    - [124, 78.267]
  - - [39040, 4096, 1, 128]
    - [109, 83.633]
  - - [43264, 4096, 1, 128]
    - [109, 84.614]
  - - [44416, 2048, 1, 128]
    - [120, 82.367]
  - - [31488, 512, 1, 128]
    - [100, 70.507]
  - - [31616, 1024, 1, 128]
    - [109, 75.857]
  - - [44032, 8192, 1, 128]
    - [82, 85.522]
  - - [39424, 23553, 1, 128]
    - [82, 85.953]
  - - [31360, 8192, 1, 128]
    - [120, 84.966]
  - - [42752, 128, 1, 128]
    - [135, 52.937]
  - - [40192, 512, 1, 128]
    - [121, 74.662]
  - - [36096, 20225, 1, 128]
    - [87, 85.861]
  - - [41984, 26113, 1, 128]
    - [82, 85.758]
  - - [39936, 2048, 1, 128]
    - [120, 81.645]
  - - [42880, 2048, 1, 128]
    - [109, 82.61]
  - - [29440, 128, 1, 128]
    - [99, 54.852]
  - - [40192, 128, 1, 128]
    - [134, 50.389]
  - - [36608, 4096, 1, 128]
    - [109, 84.236]
  - - [37760, 21761, 1, 128]
    - [85, 85.139]
  - - [44160, 28161, 1, 128]
    - [83, 85.912]
  - - [44288, 512, 1, 128]
    - [100, 74.224]
  - - [29056, 13185, 1, 128]
    - [83, 85.473]
  - - [43904, 512, 1, 128]
    - [109, 73.155]
  - - [29696, 128, 1, 128]
    - [137, 52.57]
  - - [36224, 8192, 1, 128]
    - [83, 85.346]
  - - [33024, 2048, 1, 128]
    - [109, 80.852]
  - - [44032, 28161, 1, 128]
    - [82, 85.884]
  - - [44032, 128, 1, 128]
    - [106, 52.88]
  - - [38784, 512, 1, 128]
    - [118, 72.41]
  - - [29056, 8192, 1, 128]
    - [92, 84.871]
  - - [33920, 18049, 1, 128]
    - [82, 84.641]
  - - [34816, 1024, 1, 128]
    - [118, 76.93]
  - - [29056, 128, 1, 128]
    - [128, 55.052]
  - - [39552, 1024, 1, 128]
    - [109, 76.357]
  - - [36992, 8192, 1, 128]
    - [82, 85.055]
  - - [44544, 1024, 1, 128]
    - [100, 77.904]
  - - [43904, 27905, 1, 128]
    - [84, 85.484]
  - - [29440, 512, 1, 128]
    - [121, 67.557]
  - - [29568, 8192, 1, 128]
    - [109, 85.477]
  - - [41472, 2048, 1, 128]
    - [109, 82.164]
  - - [29184, 8192, 1, 128]
    - [100, 85.096]
  - - [33408, 512, 1, 128]
    - [120, 75.032]
  - - [38656, 22785, 1, 128]
    - [83, 85.881]
  - - [31744, 15745, 1, 128]
    - [83, 85.664]
  - - [38656, 2048, 1, 128]
    - [120, 82.112]
  - - [30080, 8192, 1, 128]
    - [109, 85.239]
  - - [44672, 128, 1, 128]
    - [109, 54.758]
  - - [40704, 24833, 1, 128]
    - [82, 85.836]
  - - [33792, 8192, 1, 128]
    - [109, 85.167]
  - - [33920, 512, 1, 128]
    - [129, 69.777]
  - - [40576, 1024, 1, 128]
    - [120, 76.321]
  - - [36224, 20225, 1, 128]
    - [83, 85.807]
  - - [34432, 1024, 1, 128]
    - [105, 74.705]
  - - [31488, 15617, 1, 128]
    - [82, 85.768]
  - - [40576, 2048, 1, 128]
    - [92, 81.905]
  - - [30208, 512, 1, 128]
    - [121, 68.272]
  - - [36480, 128, 1, 128]
    - [153, 59.549]
  - - [37504, 21633, 1, 128]
    - [87, 85.78]
  - - [32896, 17025, 1, 128]
    - [120, 84.855]
  - - [39168, 2048, 1, 128]
    - [109, 82.458]
  - - [29440, 2048, 1, 128]
    - [109, 80.935]
  - - [29440, 13441, 1, 128]
    - [82, 85.602]
  - - [32640, 8192, 1, 128]
    - [92, 84.731]
  - - [35072, 19073, 1, 128]
    - [83, 85.666]
  - - [33152, 512, 1, 128]
    - [87, 68.128]
  - - [40576, 8192, 1, 128]
    - [82, 85.639]
  - - [34944, 8192, 1, 128]
    - [100, 84.817]
  - - [38656, 128, 1, 128]
    - [158, 48.806]
  - - [33536, 17537, 1, 128]
    - [82, 85.894]
  - - [29952, 512, 1, 128]
    - [120, 68.327]
  - - [31488, 2048, 1, 128]
    - [121, 80.843]
  - - [31872, 4096, 1, 128]
    - [118, 83.122]
  - - [31232, 15233, 1, 128]
    - [85, 85.726]
  - - [38912, 23041, 1, 128]
    - [85, 85.591]
  - - [31232, 2048, 1, 128]
    - [124, 80.572]
  - - [40448, 8192, 1, 128]
    - [82, 85.558]
  - - [36352, 128, 1, 128]
    - [153, 56.417]
  - - [43776, 4096, 1, 128]
    - [100, 84.03]
  - - [32000, 8192, 1, 128]
    - [109, 85.166]
  - - [37760, 8192, 1, 128]
    - [82, 85.111]
  - - [30080, 1024, 1, 128]
    - [121, 74.179]
  - - [44544, 128, 1, 128]
    - [132, 55.717]
  - - [29696, 1024, 1, 128]
    - [109, 76.885]
  - - [32640, 512, 1, 128]
    - [118, 71.159]
  - - [44416, 128, 1, 128]
    - [135, 53.224]
  - - [41216, 512, 1, 128]
    - [105, 71.464]
  - - [31872, 512, 1, 128]
    - [121, 70.91]
  - - [34432, 512, 1, 128]
    - [118, 70.223]
  - - [34560, 1024, 1, 128]
    - [100, 75.844]
  - - [42240, 128, 1, 128]
    - [93, 53.645]
  - - [44288, 28289, 1, 128]
    - [85, 85.706]
  - - [30336, 14337, 1, 128]
    - [82, 85.387]
  - - [32384, 2048, 1, 128]
    - [120, 80.891]
  - - [38400, 22401, 1, 128]
    - [87, 86.048]
  - - [39296, 1024, 1, 128]
    - [100, 76.752]
  - - [28928, 8192, 1, 128]
    - [85, 85.029]
  - - [40320, 2048, 1, 128]
    - [100, 82.298]
  - - [31104, 15233, 1, 128]
    - [83, 85.128]
  - - [39680, 512, 1, 128]
    - [109, 73.355]
  - - [34048, 18049, 1, 128]
    - [87, 85.805]
  - - [30720, 1024, 1, 128]
    - [100, 75.581]
  - - [42880, 26881, 1, 128]
    - [83, 85.635]
  - - [32896, 8192, 1, 128]
    - [100, 84.795]
  - - [43264, 8192, 1, 128]
    - [83, 85.311]
  - - [37632, 4096, 1, 128]
    - [92, 83.772]
  - - [32256, 4096, 1, 128]
    - [100, 83.412]
  - - [37248, 4096, 1, 128]
    - [109, 83.943]
  - - [33280, 17409, 1, 128]
    - [83, 86.124]
  - - [36096, 512, 1, 128]
    - [118, 74.116]
  - - [37120, 21121, 1, 128]
    - [85, 85.855]
  - - [32896, 128, 1, 128]
    - [153, 55.096]
  - - [36352, 20481, 1, 128]
    - [83, 86.045]
  - - [43392, 2048, 1, 128]
    - [92, 82.829]
  - - [36352, 512, 1, 128]
    - [118, 74.441]
  - - [29056, 13057, 1, 128]
    - [83, 85.291]
  - - [29056, 4096, 1, 128]
    - [120, 83.771]
  - - [37888, 4096, 1, 128]
    - [109, 84.367]
  - - [40320, 512, 1, 128]
    - [118, 74.981]
  - - [39168, 128, 1, 128]
    - [109, 48.478]
  - - [41472, 8192, 1, 128]
    - [85, 85.533]
  - - [34560, 512, 1, 128]
    - [128, 71.026]
  - - [34176, 18305, 1, 128]
    - [82, 85.336]
  - - [34688, 8192, 1, 128]
    - [109, 84.87]
  - - [29696, 13825, 1, 128]
    - [87, 85.449]
  - - [33152, 17281, 1, 128]
    - [92, 84.959]
  - - [30208, 8192, 1, 128]
    - [87, 85.103]
  - - [43648, 27649, 1, 128]
    - [82, 85.69]
  - - [31360, 2048, 1, 128]
    - [100, 81.271]
  - - [41984, 128, 1, 128]
    - [109, 52.553]
  - - [38528, 2048, 1, 128]
    - [124, 81.301]
  - - [32256, 16385, 1, 128]
    - [83, 85.811]
  - - [42240, 1024, 1, 128]
    - [125, 75.962]
  - - [32000, 16001, 1, 128]
    - [82, 85.827]
  - - [37248, 1024, 1, 128]
    - [118, 76.666]
  - - [32256, 1024, 1, 128]
    - [120, 77.825]
  - - [39296, 23425, 1, 128]
    - [82, 85.808]
  - - [43008, 4096, 1, 128]
    - [109, 84.17]
  - - [31104, 128, 1, 128]
    - [99, 56.889]
  - - [38656, 8192, 1, 128]
    - [85, 85.487]
  - - [44288, 128, 1, 128]
    - [128, 54.485]
  - - [38528, 22657, 1, 128]
    - [83, 85.766]
  - - [39552, 128, 1, 128]
    - [157, 50.115]
  - - [37376, 21377, 1, 128]
    - [83, 86.043]
  - - [28928, 13057, 1, 128]
    - [85, 85.296]
  - - [43264, 27265, 1, 128]
    - [83, 85.921]
  - - [35328, 4096, 1, 128]
    - [92, 84.03]
  - - [30848, 4096, 1, 128]
    - [109, 83.64]
  - - [44800, 28801, 1, 128]
    - [85, 85.58]
  - - [35456, 512, 1, 128]
    - [121, 72.517]
  - - [40960, 24961, 1, 128]
    - [131, 83.239]
  - - [39936, 23937, 1, 128]
    - [83, 86.185]
  - - [31744, 1024, 1, 128]
    - [121, 76.925]
  - - [32128, 8192, 1, 128]
    - [109, 84.788]
  - - [42112, 26113, 1, 128]
    - [83, 85.575]
  - - [31744, 2048, 1, 128]
    - [120, 81.476]
  - - [42112, 1024, 1, 128]
    - [109, 78.091]
  - - [40064, 8192, 1, 128]
    - [83, 85.677]
  - - [38144, 128, 1, 128]
    - [153, 46.841]
  - - [42624, 2048, 1, 128]
    - [118, 81.999]
  - - [36992, 128, 1, 128]
    - [163, 49.479]
  - - [40192, 8192, 1, 128]
    - [85, 85.527]
  - - [40064, 24065, 1, 128]
    - [82, 85.797]
  - - [37760, 21889, 1, 128]
    - [82, 85.547]
  - - [36352, 8192, 1, 128]
    - [83, 85.45]
  - - [44544, 512, 1, 128]
    - [121, 75.518]
  - - [32384, 4096, 1, 128]
    - [120, 83.545]
  - - [39168, 23169, 1, 128]
    - [87, 85.931]
  - - [1408, 897, 1, 128]
    - [83, 31.373]
  - - [16512, 512, 1, 128]
    - [92, 59.797]
  - - [20480, 12673, 1, 128]
    - [93, 84.288]
  - - [20992, 512, 1, 128]
    - [109, 63.202]
  - - [9344, 512, 1, 128]
    - [136, 44.663]
  - - [18048, 2048, 1, 128]
    - [100, 79.212]
  - - [20352, 12673, 1, 128]
    - [85, 85.116]
  - - [640, 128, 1, 128]
    - [159, 3.344]
  - - [28160, 512, 1, 128]
    - [118, 67.28]
  - - [20608, 4096, 1, 128]
    - [100, 82.465]
  - - [19328, 1024, 1, 128]
    - [100, 72.393]
  - - [26496, 4096, 1, 128]
    - [109, 83.773]
  - - [10624, 512, 1, 128]
    - [83, 49.503]
  - - [20352, 1024, 1, 128]
    - [121, 72.049]
  - - [10240, 6529, 1, 128]
    - [100, 80.466]
  - - [22144, 14465, 1, 128]
    - [82, 85.398]
  - - [13184, 2048, 1, 128]
    - [109, 74.895]
  - - [14720, 6913, 1, 128]
    - [84, 82.539]
  - - [21248, 512, 1, 128]
    - [109, 62.702]
  - - [10496, 128, 1, 128]
    - [175, 39.237]
  - - [13056, 5377, 1, 128]
    - [84, 81.385]
  - - [10880, 128, 1, 128]
    - [114, 40.989]
  - - [18688, 512, 1, 128]
    - [121, 63.971]
  - - [22656, 4096, 1, 128]
    - [100, 83.256]
  - - [15232, 1024, 1, 128]
    - [137, 69.458]
  - - [20224, 4096, 1, 128]
    - [120, 82.411]
  - - [6016, 2305, 1, 128]
    - [132, 64.011]
  - - [13184, 4096, 1, 128]
    - [93, 81.088]
  - - [256, 129, 1, 128]
    - [138, 1.261]
  - - [11264, 7553, 1, 128]
    - [86, 82.685]
  - - [18176, 128, 1, 128]
    - [140, 50.786]
  - - [15872, 8193, 1, 128]
    - [100, 83.729]
  - - [26112, 4096, 1, 128]
    - [109, 83.963]
  - - [22784, 2048, 1, 128]
    - [109, 79.535]
  - - [10880, 7297, 1, 128]
    - [83, 81.477]
  - - [14720, 2048, 1, 128]
    - [120, 76.594]
  - - [9216, 5633, 1, 128]
    - [84, 80.392]
  - - [23040, 15233, 1, 128]
    - [85, 85.678]
  - - [8832, 5121, 1, 128]
    - [85, 79.075]
  - - [18816, 1024, 1, 128]
    - [132, 71.119]
  - - [128, 129, 1, 128]
    - [188, 0.772]
  - - [15488, 512, 1, 128]
    - [139, 58.988]
  - - [18176, 1024, 1, 128]
    - [118, 71.147]
  - - [16128, 8449, 1, 128]
    - [83, 84.337]
  - - [16000, 2048, 1, 128]
    - [100, 78.931]
  - - [24960, 9089, 1, 128]
    - [83, 85.116]
  - - [14336, 1024, 1, 128]
    - [109, 68.549]
  - - [25472, 8192, 1, 128]
    - [120, 85.091]
  - - [23040, 128, 1, 128]
    - [163, 55.127]
  - - [9472, 512, 1, 128]
    - [119, 45.683]
  - - [19072, 128, 1, 128]
    - [140, 51.437]
  - - [10624, 6913, 1, 128]
    - [100, 81.048]
  - - [7808, 1024, 1, 128]
    - [114, 56.031]
  - - [27008, 11137, 1, 128]
    - [120, 84.907]
  - - [21504, 4096, 1, 128]
    - [100, 82.959]
  - - [7936, 1024, 1, 128]
    - [100, 57.938]
  - - [12928, 5121, 1, 128]
    - [92, 80.418]
  - - [26240, 8192, 1, 128]
    - [109, 85.345]
  - - [18304, 2048, 1, 128]
    - [100, 79.237]
  - - [24576, 1024, 1, 128]
    - [124, 67.696]
  - - [10624, 128, 1, 128]
    - [128, 40.428]
  - - [24576, 128, 1, 128]
    - [131, 51.016]
  - - [25600, 9601, 1, 128]
    - [82, 85.153]
  - - [5248, 128, 1, 128]
    - [214, 27.632]
  - - [24448, 4096, 1, 128]
    - [100, 83.802]
  - - [19328, 128, 1, 128]
    - [140, 47.67]
  - - [24064, 512, 1, 128]
    - [139, 66.786]
  - - [11136, 512, 1, 128]
    - [109, 53.347]
  - - [14592, 1024, 1, 128]
    - [120, 70.52]
  - - [12544, 4737, 1, 128]
    - [121, 81.114]
  - - [17280, 128, 1, 128]
    - [194, 44.7]
  - - [25344, 8192, 1, 128]
    - [109, 85.479]
  - - [4608, 512, 1, 128]
    - [140, 49.46]
  - - [4608, 128, 1, 128]
    - [98, 24.838]
  - - [21760, 512, 1, 128]
    - [128, 65.725]
  - - [7936, 128, 1, 128]
    - [115, 33.542]
  - - [11008, 7425, 1, 128]
    - [129, 81.691]
  - - [13824, 2048, 1, 128]
    - [139, 76.277]
  - - [18048, 512, 1, 128]
    - [100, 60.857]
  - - [19584, 11905, 1, 128]
    - [83, 84.692]
  - - [22656, 512, 1, 128]
    - [139, 64.014]
  - - [4608, 3073, 1, 128]
    - [100, 66.007]
  - - [5504, 128, 1, 128]
    - [187, 25.15]
  - - [4864, 1024, 1, 128]
    - [119, 46.288]
  - - [17664, 1024, 1, 128]
    - [120, 71.76]
  - - [18176, 2048, 1, 128]
    - [121, 78.881]
  - - [2048, 1537, 1, 128]
    - [111, 47.179]
  - - [22528, 128, 1, 128]
    - [153, 49.249]
  - - [21760, 13953, 1, 128]
    - [82, 85.152]
  - - [7040, 128, 1, 128]
    - [132, 30.931]
  - - [3328, 1665, 1, 128]
    - [141, 52.544]
  - - [768, 512, 1, 128]
    - [134, 14.295]
  - - [21504, 13697, 1, 128]
    - [82, 84.984]
  - - [18560, 10881, 1, 128]
    - [84, 83.944]
  - - [2560, 128, 1, 128]
    - [148, 14.217]
  - - [15616, 1024, 1, 128]
    - [120, 70.576]
  - - [19456, 4096, 1, 128]
    - [100, 82.64]
  - - [25600, 2048, 1, 128]
    - [100, 80.8]
  - - [2304, 128, 1, 128]
    - [138, 11.731]
  - - [1664, 1025, 1, 128]
    - [89, 40.498]
  - - [23168, 15361, 1, 128]
    - [85, 85.49]
  - - [9856, 128, 1, 128]
    - [131, 36.757]
  - - [13312, 2048, 1, 128]
    - [114, 76.972]
  - - [19200, 512, 1, 128]
    - [109, 58.914]
  - - [19200, 2048, 1, 128]
    - [92, 78.622]
  - - [23168, 2048, 1, 128]
    - [109, 79.378]
  - - [18688, 128, 1, 128]
    - [140, 47.411]
  - - [13568, 1024, 1, 128]
    - [100, 66.719]
  - - [17792, 9985, 1, 128]
    - [83, 84.541]
  - - [20608, 1024, 1, 128]
    - [105, 71.505]
  - - [11648, 8065, 1, 128]
    - [83, 82.983]
  - - [1280, 128, 1, 128]
    - [138, 7.46]
  - - [16256, 4096, 1, 128]
    - [100, 81.209]
  - - [17024, 1024, 1, 128]
    - [92, 70.403]
  - - [19456, 128, 1, 128]
    - [153, 47.17]
  - - [20736, 512, 1, 128]
    - [109, 63.977]
  - - [14464, 6785, 1, 128]
    - [83, 83.044]
  - - [20736, 13057, 1, 128]
    - [83, 84.932]
  - - [8704, 2048, 1, 128]
    - [137, 72.302]
  - - [640, 512, 1, 128]
    - [142, 11.629]
  - - [768, 129, 1, 128]
    - [143, 3.647]
  - - [27776, 1024, 1, 128]
    - [109, 73.235]
  - - [19200, 11521, 1, 128]
    - [82, 85.128]
  - - [6400, 2048, 1, 128]
    - [114, 63.873]
  - - [14976, 7297, 1, 128]
    - [83, 83.037]
  - - [7040, 2048, 1, 128]
    - [124, 67.26]
  - - [25984, 128, 1, 128]
    - [163, 54.82]
  - - [13696, 128, 1, 128]
    - [204, 43.509]
  - - [2688, 1153, 1, 128]
    - [111, 49.41]
  - - [15232, 2048, 1, 128]
    - [120, 78.394]
  - - [11776, 128, 1, 128]
    - [205, 38.1]
  - - [3328, 512, 1, 128]
    - [144, 41.675]
  - - [11648, 7937, 1, 128]
    - [120, 82.734]
  - - [19456, 2048, 1, 128]
    - [124, 78.681]
  - - [11008, 128, 1, 128]
    - [137, 36.454]
  - - [9984, 6401, 1, 128]
    - [121, 79.953]
  - - [25856, 9857, 1, 128]
    - [85, 84.773]
  - - [4224, 512, 1, 128]
    - [145, 40.036]
  - - [13568, 5761, 1, 128]
    - [84, 81.923]
  - - [5632, 2049, 1, 128]
    - [139, 63.843]
  - - [8832, 2048, 1, 128]
    - [118, 72.415]
  - - [5632, 3969, 1, 128]
    - [120, 75.644]
  - - [25856, 2048, 1, 128]
    - [109, 80.499]
  - - [25472, 2048, 1, 128]
    - [120, 80.6]
  - - [20736, 12929, 1, 128]
    - [85, 85.312]
  - - [14592, 128, 1, 128]
    - [204, 45.332]
  - - [1792, 512, 1, 128]
    - [137, 26.758]
  - - [14208, 2048, 1, 128]
    - [109, 78.038]
  - - [15360, 7681, 1, 128]
    - [82, 83.234]
  - - [5760, 2048, 1, 128]
    - [106, 67.303]
  - - [6400, 512, 1, 128]
    - [135, 48.998]
  - - [5248, 3713, 1, 128]
    - [93, 72.263]
  - - [16768, 1024, 1, 128]
    - [109, 69.075]
  - - [10752, 512, 1, 128]
    - [139, 51.085]
  - - [26624, 2048, 1, 128]
    - [109, 81.184]
  - - [384, 128, 1, 128]
    - [138, 1.822]
  - - [27392, 8192, 1, 128]
    - [83, 85.305]
  - - [24448, 512, 1, 128]
    - [100, 64.065]
  - - [11136, 7553, 1, 128]
    - [131, 81.995]
  - - [17024, 9345, 1, 128]
    - [85, 84.388]
  - - [16000, 8193, 1, 128]
    - [82, 83.986]
  - - [5888, 2048, 1, 128]
    - [139, 65.665]
  - - [18304, 10497, 1, 128]
    - [87, 84.86]
  - - [3968, 128, 1, 128]
    - [97, 17.362]
  - - [14336, 6529, 1, 128]
    - [100, 82.653]
  - - [19840, 128, 1, 128]
    - [163, 48.715]
  - - [25600, 8192, 1, 128]
    - [109, 85.166]
  - - [18688, 11009, 1, 128]
    - [82, 84.892]
  - - [7680, 1024, 1, 128]
    - [99, 58.858]
  - - [7168, 128, 1, 128]
    - [189, 32.655]
  - - [1664, 512, 1, 128]
    - [145, 26.738]
  - - [12544, 1024, 1, 128]
    - [124, 62.228]
  - - [6528, 2048, 1, 128]
    - [98, 66.966]
  - - [19072, 4096, 1, 128]
    - [109, 82.862]
  - - [2048, 512, 1, 128]
    - [146, 29.636]
  - - [13568, 5889, 1, 128]
    - [84, 81.565]
  - - [23680, 16001, 1, 128]
    - [83, 85.381]
  - - [26112, 10113, 1, 128]
    - [83, 85.334]
  - - [15872, 128, 1, 128]
    - [90, 47.839]
  - - [16384, 512, 1, 128]
    - [93, 51.398]
  - - [9856, 6273, 1, 128]
    - [83, 81.178]
  - - [26368, 1024, 1, 128]
    - [109, 73.429]
  - - [16256, 2048, 1, 128]
    - [118, 78.847]
  - - [3968, 2305, 1, 128]
    - [147, 59.747]
  - - [28672, 8192, 1, 128]
    - [109, 84.804]
  - - [10368, 1024, 1, 128]
    - [120, 58.455]
  - - [11008, 1024, 1, 128]
    - [114, 61.964]
  - - [11776, 4097, 1, 128]
    - [126, 78.784]
  - - [26496, 2048, 1, 128]
    - [120, 79.508]
  - - [17792, 4096, 1, 128]
    - [118, 82.428]
  - - [2304, 512, 1, 128]
    - [145, 30.887]
  - - [9216, 2048, 1, 128]
    - [139, 69.781]
  - - [12416, 512, 1, 128]
    - [99, 55.699]
  - - [18048, 128, 1, 128]
    - [137, 45.403]
  - - [21888, 14209, 1, 128]
    - [83, 85.357]
  - - [9344, 5761, 1, 128]
    - [120, 79.901]
  - - [19712, 2048, 1, 128]
    - [109, 79.116]
  - - [12288, 1024, 1, 128]
    - [109, 65.253]
  - - [3584, 1921, 1, 128]
    - [114, 59.272]
  - - [22784, 128, 1, 128]
    - [137, 52.299]
  - - [26880, 128, 1, 128]
    - [153, 52.114]
  - - [17408, 1024, 1, 128]
    - [118, 71.218]
  - - [15488, 4096, 1, 128]
    - [120, 82.085]
  - - [13312, 5633, 1, 128]
    - [100, 81.866]
  - - [22016, 14337, 1, 128]
    - [82, 85.649]
  - - [19328, 2048, 1, 128]
    - [100, 78.957]
  - - [25600, 128, 1, 128]
    - [153, 50.678]
  - - [22784, 15105, 1, 128]
    - [82, 85.552]
  - - [5376, 3713, 1, 128]
    - [114, 72.496]
  - - [14208, 512, 1, 128]
    - [114, 53.713]
  - - [12928, 4096, 1, 128]
    - [109, 80.309]
  - - [768, 257, 1, 128]
    - [148, 8.122]
  - - [27776, 11777, 1, 128]
    - [87, 84.917]
  - - [12032, 1024, 1, 128]
    - [100, 65.339]
  - - [14208, 4096, 1, 128]
    - [109, 80.882]
  - - [19840, 12161, 1, 128]
    - [85, 85.146]
  - - [17536, 512, 1, 128]
    - [109, 58.991]
  - - [19840, 4096, 1, 128]
    - [118, 82.63]
  - - [26624, 512, 1, 128]
    - [106, 67.428]
  - - [27136, 11137, 1, 128]
    - [83, 84.988]
  - - [11008, 512, 1, 128]
    - [149, 49.965]
  - - [1024, 513, 1, 128]
    - [143, 18.58]
  - - [15744, 512, 1, 128]
    - [139, 60.473]
  - - [22016, 128, 1, 128]
    - [137, 52.955]
  - - [9344, 1024, 1, 128]
    - [106, 58.943]
  - - [28544, 1024, 1, 128]
    - [100, 73.198]
  - - [13440, 5633, 1, 128]
    - [93, 82.387]
  - - [21632, 13825, 1, 128]
    - [92, 85.078]
  - - [24064, 4096, 1, 128]
    - [118, 83.884]
  - - [24192, 512, 1, 128]
    - [139, 66.917]
  - - [22912, 15233, 1, 128]
    - [83, 85.512]
  - - [20864, 13185, 1, 128]
    - [85, 85.486]
  - - [8064, 4353, 1, 128]
    - [118, 76.368]
  - - [8704, 5121, 1, 128]
    - [100, 78.538]
  - - [19840, 1024, 1, 128]
    - [120, 73.926]
  - - [15616, 128, 1, 128]
    - [176, 46.167]
  - - [21632, 512, 1, 128]
    - [139, 61.409]
  - - [13440, 512, 1, 128]
    - [118, 55.232]
  - - [23936, 128, 1, 128]
    - [163, 48.575]
  - - [8960, 5377, 1, 128]
    - [86, 78.665]
  - - [27008, 512, 1, 128]
    - [139, 67.156]
  - - [13440, 5761, 1, 128]
    - [118, 81.135]
  - - [3072, 512, 1, 128]
    - [150, 38.841]
  - - [4096, 1024, 1, 128]
    - [112, 43.653]
  - - [7296, 3585, 1, 128]
    - [118, 75.519]
  - - [12416, 4737, 1, 128]
    - [83, 81.972]
  - - [6912, 512, 1, 128]
    - [124, 48.731]
  - - [11136, 2048, 1, 128]
    - [124, 75.083]
  - - [18176, 10369, 1, 128]
    - [100, 84.448]
  - - [14976, 4096, 1, 128]
    - [100, 81.999]
  - - [19712, 4096, 1, 128]
    - [120, 82.265]
  - - [8064, 1024, 1, 128]
    - [125, 51.925]
  - - [9600, 128, 1, 128]
    - [121, 32.881]
  - - [26240, 1024, 1, 128]
    - [109, 73.709]
  - - [5248, 3585, 1, 128]
    - [151, 72.276]
  - - [16768, 2048, 1, 128]
    - [106, 76.664]
  - - [13184, 128, 1, 128]
    - [197, 41.34]
  - - [19328, 11521, 1, 128]
    - [87, 84.817]
  - - [4864, 512, 1, 128]
    - [139, 43.938]
  - - [3584, 2049, 1, 128]
    - [100, 58.042]
  - - [18560, 128, 1, 128]
    - [137, 47.831]
  - - [27392, 11393, 1, 128]
    - [87, 85.208]
  - - [27520, 512, 1, 128]
    - [100, 65.268]
  - - [18176, 4096, 1, 128]
    - [131, 81.724]
  - - [7808, 4225, 1, 128]
    - [92, 78.343]
  - - [15232, 128, 1, 128]
    - [96, 46.692]
  - - [25728, 1024, 1, 128]
    - [109, 74.373]
  - - [23936, 512, 1, 128]
    - [118, 64.663]
  - - [23424, 2048, 1, 128]
    - [120, 79.867]
  - - [28032, 12161, 1, 128]
    - [85, 85.131]
  - - [27136, 512, 1, 128]
    - [121, 71.066]
  - - [14336, 6657, 1, 128]
    - [87, 83.09]
  - - [15616, 4096, 1, 128]
    - [92, 81.938]
  - - [3328, 1793, 1, 128]
    - [139, 56.895]
  - - [28416, 512, 1, 128]
    - [109, 69.288]
  - - [16384, 8705, 1, 128]
    - [126, 79.282]
  - - [3200, 1537, 1, 128]
    - [152, 46.928]
  - - [26368, 128, 1, 128]
    - [163, 55.164]
  - - [16000, 512, 1, 128]
    - [92, 62.123]
  - - [25216, 9345, 1, 128]
    - [83, 84.785]
  - - [28288, 4096, 1, 128]
    - [109, 83.577]
  - - [24832, 512, 1, 128]
    - [118, 65.822]
  - - [18048, 10369, 1, 128]
    - [83, 84.566]
  - - [20480, 4096, 1, 128]
    - [93, 82.236]
  - - [17792, 10113, 1, 128]
    - [87, 84.373]
  - - [13312, 5505, 1, 128]
    - [83, 82.284]
  - - [17024, 2048, 1, 128]
    - [121, 77.795]
  - - [20608, 12929, 1, 128]
    - [87, 85.115]
  - - [16896, 4096, 1, 128]
    - [121, 82.385]
  - - [27776, 2048, 1, 128]
    - [109, 80.193]
  - - [6912, 3201, 1, 128]
    - [100, 74.685]
  - - [15744, 2048, 1, 128]
    - [114, 77.18]
  - - [24448, 128, 1, 128]
    - [118, 52.307]
  - - [2688, 128, 1, 128]
    - [162, 15.011]
  - - [7808, 2048, 1, 128]
    - [100, 71.569]
  - - [1408, 512, 1, 128]
    - [145, 24.667]
  - - [12032, 512, 1, 128]
    - [153, 57.904]
  - - [26752, 512, 1, 128]
    - [114, 67.889]
  - - [16128, 8321, 1, 128]
    - [85, 83.684]
  - - [25856, 128, 1, 128]
    - [128, 54.07]
  - - [24064, 8192, 1, 128]
    - [83, 85.175]
  - - [28160, 4096, 1, 128]
    - [109, 83.935]
  - - [13312, 128, 1, 128]
    - [173, 41.963]
  - - [10112, 6401, 1, 128]
    - [92, 81.136]
  - - [16384, 4096, 1, 128]
    - [93, 78.674]
  - - [16512, 2048, 1, 128]
    - [100, 76.917]
  - - [27520, 11521, 1, 128]
    - [84, 84.957]
  - - [8192, 4481, 1, 128]
    - [135, 74.809]
  - - [16768, 512, 1, 128]
    - [92, 55.197]
  - - [6144, 128, 1, 128]
    - [137, 25.84]
  - - [13568, 512, 1, 128]
    - [99, 52.304]
  - - [9344, 5633, 1, 128]
    - [100, 79.968]
  - - [13440, 4096, 1, 128]
    - [100, 81.925]
  - - [2176, 1665, 1, 128]
    - [139, 45.586]
  - - [28288, 128, 1, 128]
    - [114, 55.357]
  - - [11776, 4096, 1, 128]
    - [92, 80.044]
  - - [17280, 512, 1, 128]
    - [109, 61.933]
  - - [5504, 3841, 1, 128]
    - [114, 72.434]
  - - [14848, 7041, 1, 128]
    - [83, 83.47]
  - - [3584, 128, 1, 128]
    - [141, 22.302]
  - - [26880, 8192, 1, 128]
    - [83, 85.443]
  - - [2944, 1409, 1, 128]
    - [153, 51.371]
  - - [26368, 10369, 1, 128]
    - [83, 85.232]
  - - [21888, 512, 1, 128]
    - [109, 63.801]
  - - [15872, 2048, 1, 128]
    - [100, 77.824]
  - - [20224, 512, 1, 128]
    - [120, 61.826]
  - - [24320, 8449, 1, 128]
    - [85, 84.535]
  - - [5632, 1024, 1, 128]
    - [139, 52.884]
  - - [17152, 9473, 1, 128]
    - [83, 84.502]
  - - [4096, 128, 1, 128]
    - [174, 18.358]
  - - [8832, 128, 1, 128]
    - [156, 31.666]
  - - [2048, 1409, 1, 128]
    - [85, 45.639]
  - - [28160, 12289, 1, 128]
    - [82, 85.098]
  - - [9088, 5505, 1, 128]
    - [92, 80.236]
  - - [19200, 1024, 1, 128]
    - [114, 71.922]
  - - [18048, 4096, 1, 128]
    - [118, 81.601]
  - - [12928, 512, 1, 128]
    - [132, 56.35]
  - - [20864, 4096, 1, 128]
    - [120, 82.932]
  - - [27008, 2048, 1, 128]
    - [83, 79.906]
  - - [16640, 128, 1, 128]
    - [90, 45.557]
  - - [24960, 8192, 1, 128]
    - [109, 85.088]
  - - [24320, 1024, 1, 128]
    - [120, 74.702]
  - - [23552, 15873, 1, 128]
    - [83, 85.939]
  - - [26240, 4096, 1, 128]
    - [100, 83.574]
  - - [24320, 128, 1, 128]
    - [100, 51.128]
  - - [26240, 128, 1, 128]
    - [153, 52.43]
  - - [3200, 1665, 1, 128]
    - [113, 51.764]
  - - [11776, 2048, 1, 128]
    - [120, 75.528]
  - - [6144, 512, 1, 128]
    - [113, 47.41]
  - - [24960, 128, 1, 128]
    - [153, 49.607]
  - - [23424, 128, 1, 128]
    - [163, 49.823]
  - - [11776, 8065, 1, 128]
    - [92, 82.593]
  - - [19072, 11265, 1, 128]
    - [82, 85.02]
  - - [8192, 4609, 1, 128]
    - [126, 77.135]
  - - [21888, 4096, 1, 128]
    - [109, 83.235]
  - - [14976, 2048, 1, 128]
    - [124, 78.369]
  - - [23680, 4096, 1, 128]
    - [92, 83.104]
  - - [14080, 1024, 1, 128]
    - [109, 68.096]
  - - [19968, 4096, 1, 128]
    - [120, 82.838]
  - - [8704, 128, 1, 128]
    - [144, 32.556]
  - - [23424, 15745, 1, 128]
    - [82, 85.5]
  - - [8320, 2048, 1, 128]
    - [121, 73.814]
  - - [6144, 2433, 1, 128]
    - [86, 69.323]
  - - [19200, 11393, 1, 128]
    - [85, 85.01]
  - - [28416, 128, 1, 128]
    - [109, 55.179]
  - - [14080, 2048, 1, 128]
    - [120, 77.059]
  - - [12544, 4096, 1, 128]
    - [85, 80.594]
  - - [17024, 128, 1, 128]
    - [123, 48.577]
  - - [23936, 16257, 1, 128]
    - [82, 85.779]
  - - [12288, 128, 1, 128]
    - [115, 37.776]
  - - [28800, 1024, 1, 128]
    - [120, 75.708]
  - - [13824, 6017, 1, 128]
    - [83, 82.379]
  - - [23040, 2048, 1, 128]
    - [120, 79.249]
  - - [9984, 6273, 1, 128]
    - [120, 81.39]
  - - [23680, 512, 1, 128]
    - [120, 67.846]
  - - [7936, 4353, 1, 128]
    - [85, 78.803]
  - - [24192, 2048, 1, 128]
    - [120, 79.812]
  - - [8448, 512, 1, 128]
    - [153, 50.113]
  - - [5760, 2177, 1, 128]
    - [92, 66.558]
  - - [22656, 14977, 1, 128]
    - [120, 85.275]
  - - [17024, 4096, 1, 128]
    - [109, 82.338]
  - - [24960, 8961, 1, 128]
    - [83, 84.551]
  - - [5888, 1024, 1, 128]
    - [154, 52.401]
  - - [9344, 2048, 1, 128]
    - [121, 72.232]
  - - [11520, 1024, 1, 128]
    - [118, 62.81]
  - - [17024, 9217, 1, 128]
    - [85, 84.332]
  - - [10368, 6657, 1, 128]
    - [92, 81.776]
  - - [21632, 2048, 1, 128]
    - [109, 80.397]
  - - [26880, 2048, 1, 128]
    - [92, 79.658]
  - - [20736, 4096, 1, 128]
    - [109, 84.007]
  - - [26624, 8192, 1, 128]
    - [109, 85.022]
  - - [26752, 2048, 1, 128]
    - [92, 79.966]
  - - [24192, 8321, 1, 128]
    - [82, 84.585]
  - - [4736, 1024, 1, 128]
    - [92, 45.417]
  - - [27648, 8192, 1, 128]
    - [100, 85.36]
  - - [27392, 11521, 1, 128]
    - [85, 85.347]
  - - [27776, 4096, 1, 128]
    - [100, 83.604]
  - - [28672, 12801, 1, 128]
    - [92, 84.74]
  - - [13056, 512, 1, 128]
    - [139, 50.435]
  - - [25088, 2048, 1, 128]
    - [109, 80.665]
  - - [17408, 9601, 1, 128]
    - [82, 84.251]
  - - [5120, 3585, 1, 128]
    - [100, 73.662]
  - - [13824, 512, 1, 128]
    - [93, 54.94]
  - - [8576, 1024, 1, 128]
    - [134, 58.615]
  - - [16768, 4096, 1, 128]
    - [131, 82.097]
  - - [25728, 9729, 1, 128]
    - [85, 85.155]
  - - [27392, 512, 1, 128]
    - [114, 66.278]
  - - [13824, 128, 1, 128]
    - [92, 42.194]
  - - [27264, 1024, 1, 128]
    - [92, 73.893]
  - - [22272, 14465, 1, 128]
    - [87, 85.276]
  - - [19840, 2048, 1, 128]
    - [121, 79.596]
  - - [18176, 10497, 1, 128]
    - [83, 85.034]
  - - [4992, 3329, 1, 128]
    - [155, 67.403]
  - - [14976, 7169, 1, 128]
    - [83, 83.733]
  - - [10112, 512, 1, 128]
    - [150, 48.278]
  - - [24704, 128, 1, 128]
    - [163, 51.203]
  - - [16896, 128, 1, 128]
    - [94, 48.18]
  - - [10880, 7169, 1, 128]
    - [100, 82.251]
  - - [9600, 512, 1, 128]
    - [125, 45.129]
  - - [22528, 1024, 1, 128]
    - [120, 72.717]
  - - [27008, 128, 1, 128]
    - [99, 54.387]
  - - [4480, 2945, 1, 128]
    - [89, 66.047]
  - - [15872, 8065, 1, 128]
    - [83, 83.63]
  - - [28672, 128, 1, 128]
    - [106, 54.329]
  - - [9344, 128, 1, 128]
    - [156, 38.935]
  - - [15360, 2048, 1, 128]
    - [92, 77.676]
  - - [11392, 512, 1, 128]
    - [156, 52.211]
  - - [9216, 128, 1, 128]
    - [203, 37.491]
  - - [8192, 2048, 1, 128]
    - [126, 68.061]
  - - [14464, 1024, 1, 128]
    - [114, 69.303]
  - - [4096, 2433, 1, 128]
    - [97, 59.059]
  - - [6528, 2945, 1, 128]
    - [85, 71.626]
  - - [12672, 512, 1, 128]
    - [124, 59.809]
  - - [26624, 128, 1, 128]
    - [118, 55.801]
  - - [19712, 1024, 1, 128]
    - [109, 73.553]
  - - [4480, 2817, 1, 128]
    - [93, 65.937]
  - - [13440, 2048, 1, 128]
    - [133, 74.711]
  - - [256, 257, 1, 128]
    - [143, 2.727]
  - - [16000, 128, 1, 128]
    - [94, 48.281]
  - - [7552, 3969, 1, 128]
    - [100, 76.683]
  - - [12416, 2048, 1, 128]
    - [120, 75.598]
  - - [18432, 512, 1, 128]
    - [121, 61.447]
  - - [14464, 512, 1, 128]
    - [109, 57.552]
  - - [1280, 769, 1, 128]
    - [89, 29.494]
  - - [14976, 512, 1, 128]
    - [139, 55.825]
  - - [28032, 4096, 1, 128]
    - [109, 83.372]
  - - [27904, 128, 1, 128]
    - [137, 54.217]
  - - [20224, 12545, 1, 128]
    - [83, 85.367]
  - - [15872, 4096, 1, 128]
    - [92, 81.438]
  - - [3456, 1793, 1, 128]
    - [157, 54.306]
  - - [14336, 128, 1, 128]
    - [135, 46.098]
  - - [21248, 2048, 1, 128]
    - [124, 80.387]
  - - [23040, 1024, 1, 128]
    - [128, 73.21]
  - - [15232, 7425, 1, 128]
    - [85, 83.444]
  - - [14592, 512, 1, 128]
    - [109, 58.556]
  - - [22912, 15105, 1, 128]
    - [87, 85.487]
  - - [22528, 2048, 1, 128]
    - [93, 77.654]
  - - [3072, 1024, 1, 128]
    - [99, 48.407]
  - - [17536, 4096, 1, 128]
    - [92, 81.991]
  - - [384, 257, 1, 128]
    - [138, 4.708]
  - - [14464, 6657, 1, 128]
    - [85, 82.653]
  - - [20096, 1024, 1, 128]
    - [118, 73.816]
  - - [26880, 4096, 1, 128]
    - [109, 83.47]
  - - [18816, 2048, 1, 128]
    - [92, 77.33]
  - - [17152, 512, 1, 128]
    - [139, 56.224]
  - - [18432, 4096, 1, 128]
    - [109, 82.717]
  - - [10368, 2048, 1, 128]
    - [132, 74.296]
  - - [1408, 769, 1, 128]
    - [158, 32.205]
  - - [7168, 2048, 1, 128]
    - [109, 69.431]
  - - [17664, 128, 1, 128]
    - [137, 44.442]
  - - [1152, 513, 1, 128]
    - [159, 19.891]
  - - [7296, 3713, 1, 128]
    - [92, 75.368]
  - - [24064, 2048, 1, 128]
    - [109, 80.114]
  - - [8576, 2048, 1, 128]
    - [100, 70.738]
  - - [23168, 15489, 1, 128]
    - [82, 85.603]
  - - [14848, 7169, 1, 128]
    - [87, 82.399]
  - - [2432, 512, 1, 128]
    - [85, 32.743]
  - - [19712, 12033, 1, 128]
    - [83, 85.124]
  - - [25856, 4096, 1, 128]
    - [100, 83.773]
  - - [17152, 9345, 1, 128]
    - [82, 84.448]
  - - [3712, 128, 1, 128]
    - [169, 19.565]
  - - [22272, 128, 1, 128]
    - [109, 52.67]
  - - [25600, 9729, 1, 128]
    - [83, 85.175]
  - - [6016, 2433, 1, 128]
    - [131, 69.135]
  - - [12928, 128, 1, 128]
    - [115, 40.373]
  - - [25088, 8192, 1, 128]
    - [109, 85.46]
  - - [7040, 1024, 1, 128]
    - [99, 57.682]
  - - [4736, 3201, 1, 128]
    - [92, 67.524]
  - - [16000, 1024, 1, 128]
    - [109, 69.432]
  - - [1920, 512, 1, 128]
    - [116, 28.147]
  - - [8192, 1024, 1, 128]
    - [134, 51.676]
  - - [8448, 4865, 1, 128]
    - [83, 77.769]
  - - [11136, 7425, 1, 128]
    - [100, 82.348]
  - - [23296, 4096, 1, 128]
    - [100, 83.099]
  - - [27904, 2048, 1, 128]
    - [92, 80.039]
  - - [23552, 4096, 1, 128]
    - [92, 82.616]
  - - [24960, 2048, 1, 128]
    - [82, 80.077]
  - - [2816, 128, 1, 128]
    - [191, 17.484]
  - - [7424, 3841, 1, 128]
    - [93, 76.459]
  - - [20480, 128, 1, 128]
    - [140, 44.859]
  - - [18816, 11137, 1, 128]
    - [100, 84.677]
  - - [26496, 128, 1, 128]
    - [111, 57.016]
  - - [16896, 9217, 1, 128]
    - [83, 84.753]
  - - [23296, 512, 1, 128]
    - [124, 64.418]
  - - [8064, 2048, 1, 128]
    - [109, 72.914]
  - - [19968, 128, 1, 128]
    - [140, 46.958]
  - - [8320, 4737, 1, 128]
    - [120, 78.048]
  - - [27648, 1024, 1, 128]
    - [118, 75.883]
  - - [3712, 512, 1, 128]
    - [85, 44.756]
  - - [256, 128, 1, 128]
    - [138, 1.4]
  - - [3072, 1537, 1, 128]
    - [119, 44.476]
  - - [5504, 1024, 1, 128]
    - [160, 49.798]
  - - [20992, 2048, 1, 128]
    - [109, 79.387]
  - - [20480, 1024, 1, 128]
    - [92, 70.413]
  - - [20864, 128, 1, 128]
    - [140, 47.872]
  - - [28544, 12545, 1, 128]
    - [82, 85.263]
  - - [1152, 512, 1, 128]
    - [143, 22.455]
  - - [24320, 8321, 1, 128]
    - [87, 84.634]
  - - [2688, 512, 1, 128]
    - [85, 38.025]
  - - [27904, 8192, 1, 128]
    - [109, 85.082]
  - - [3840, 2177, 1, 128]
    - [92, 57.314]
  - - [25344, 128, 1, 128]
    - [153, 55.282]
  - - [13184, 512, 1, 128]
    - [100, 55.441]
  - - [7680, 512, 1, 128]
    - [109, 48.419]
  - - [11904, 2048, 1, 128]
    - [109, 76.972]
  - - [12544, 512, 1, 128]
    - [99, 53.427]
  - - [8448, 4737, 1, 128]
    - [100, 79.775]
  - - [28544, 128, 1, 128]
    - [137, 54.336]
  - - [21760, 14081, 1, 128]
    - [83, 85.109]
  - - [12800, 128, 1, 128]
    - [211, 42.079]
  - - [17664, 4096, 1, 128]
    - [126, 82.126]
  - - [2432, 1793, 1, 128]
    - [133, 42.389]
  - - [16384, 8577, 1, 128]
    - [135, 78.949]
  - - [28544, 512, 1, 128]
    - [100, 69.034]
  - - [28032, 12033, 1, 128]
    - [83, 85.433]
  - - [4864, 3329, 1, 128]
    - [120, 71.043]
  - - [12928, 5249, 1, 128]
    - [92, 81.463]
  - - [4736, 512, 1, 128]
    - [140, 43.084]
  - - [27264, 2048, 1, 128]
    - [100, 81.952]
  - - [19840, 12033, 1, 128]
    - [82, 85.551]
  - - [19584, 4096, 1, 128]
    - [109, 83.207]
  - - [21376, 4096, 1, 128]
    - [120, 83.987]
  - - [20352, 4096, 1, 128]
    - [121, 83.231]
  - - [6400, 2689, 1, 128]
    - [89, 69.697]
  - - [24704, 8192, 1, 128]
    - [100, 84.85]
  - - [22528, 14849, 1, 128]
    - [84, 85.261]
  - - [18304, 512, 1, 128]
    - [109, 66.191]
  - - [6656, 1024, 1, 128]
    - [161, 55.798]
  - - [13568, 4096, 1, 128]
    - [109, 82.113]
  - - [6016, 512, 1, 128]
    - [121, 46.159]
  - - [17664, 2048, 1, 128]
    - [121, 76.56]
  - - [17408, 512, 1, 128]
    - [139, 55.597]
  - - [24960, 4096, 1, 128]
    - [109, 83.518]
  - - [20608, 12801, 1, 128]
    - [85, 85.228]
  - - [27648, 11649, 1, 128]
    - [82, 85.247]
  - - [5760, 128, 1, 128]
    - [97, 28.615]
  - - [17792, 512, 1, 128]
    - [120, 58.767]
  - - [17664, 512, 1, 128]
    - [83, 59.813]
  - - [19968, 12161, 1, 128]
    - [83, 85.596]
  - - [19840, 512, 1, 128]
    - [92, 65.306]
  - - [12032, 4353, 1, 128]
    - [93, 80.214]
  - - [25984, 512, 1, 128]
    - [128, 67.104]
  - - [27648, 4096, 1, 128]
    - [109, 83.877]
  - - [10752, 7041, 1, 128]
    - [82, 82.878]
  - - [28544, 2048, 1, 128]
    - [109, 81.047]
  - - [7680, 2048, 1, 128]
    - [125, 69.958]
  - - [13184, 5377, 1, 128]
    - [84, 80.506]
  - - [6784, 3201, 1, 128]
    - [135, 73.571]
  - - [16384, 2048, 1, 128]
    - [126, 76.192]
  - - [22656, 1024, 1, 128]
    - [121, 71.155]
  - - [12800, 512, 1, 128]
    - [118, 58.223]
  - - [23936, 1024, 1, 128]
    - [120, 73.753]
  - - [15360, 1024, 1, 128]
    - [118, 69.538]
  - - [15488, 2048, 1, 128]
    - [109, 79.742]
  - - [11392, 1024, 1, 128]
    - [139, 63.918]
  - - [15744, 1024, 1, 128]
    - [120, 70.621]
  - - [9856, 2048, 1, 128]
    - [109, 75.651]
  - - [5888, 2305, 1, 128]
    - [92, 66.493]
  - - [10496, 512, 1, 128]
    - [83, 48.799]
  - - [1664, 1153, 1, 128]
    - [83, 38.125]
  - - [3456, 1024, 1, 128]
    - [99, 44.049]
  - - [20992, 13313, 1, 128]
    - [85, 85.529]
  - - [11904, 4096, 1, 128]
    - [100, 79.657]
  - - [13056, 1024, 1, 128]
    - [139, 65.114]
  - - [12800, 2048, 1, 128]
    - [131, 75.045]
  - - [12160, 512, 1, 128]
    - [118, 59.045]
  - - [5760, 2049, 1, 128]
    - [85, 64.209]
  - - [11392, 128, 1, 128]
    - [91, 41.099]
  - - [5632, 128, 1, 128]
    - [114, 26.51]
  - - [11520, 2048, 1, 128]
    - [118, 76.062]
  - - [11648, 2048, 1, 128]
    - [99, 74.237]
  - - [28544, 8192, 1, 128]
    - [109, 85.225]
  - - [22912, 1024, 1, 128]
    - [99, 72.918]
  - - [10752, 7169, 1, 128]
    - [100, 82.342]
  - - [8320, 128, 1, 128]
    - [92, 34.467]
  - - [23808, 1024, 1, 128]
    - [109, 75.725]
  - - [25984, 8192, 1, 128]
    - [109, 85.137]
  - - [22656, 2048, 1, 128]
    - [109, 80.593]
  - - [7296, 1024, 1, 128]
    - [85, 54.952]
  - - [28032, 512, 1, 128]
    - [109, 66.757]
  - - [22400, 2048, 1, 128]
    - [121, 79.339]
  - - [22144, 512, 1, 128]
    - [137, 66.193]
  - - [13312, 4096, 1, 128]
    - [135, 81.61]
  - - [10240, 2048, 1, 128]
    - [109, 76.222]
  - - [12672, 128, 1, 128]
    - [203, 41.616]
  - - [10752, 2048, 1, 128]
    - [118, 74.224]
  - - [1152, 128, 1, 128]
    - [138, 6.048]
  - - [13696, 5889, 1, 128]
    - [100, 82.177]
  - - [9216, 1024, 1, 128]
    - [132, 62.116]
  - - [17152, 128, 1, 128]
    - [176, 47.533]
  - - [24320, 2048, 1, 128]
    - [109, 80.693]
  - - [16512, 8705, 1, 128]
    - [82, 84.301]
  - - [3072, 1409, 1, 128]
    - [85, 41.888]
  - - [1024, 128, 1, 128]
    - [174, 5.62]
  - - [22400, 14593, 1, 128]
    - [82, 85.365]
  - - [4096, 512, 1, 128]
    - [89, 45.366]
  - - [4992, 128, 1, 128]
    - [188, 24.408]
  - - [9472, 5889, 1, 128]
    - [92, 80.441]
  - - [9472, 5761, 1, 128]
    - [120, 79.296]
  - - [27136, 1024, 1, 128]
    - [100, 74.382]
  - - [6528, 1024, 1, 128]
    - [154, 50.637]
  - - [25472, 1024, 1, 128]
    - [100, 75.125]
  - - [5120, 512, 1, 128]
    - [111, 47.79]
  - - [5504, 512, 1, 128]
    - [139, 46.255]
  - - [21120, 13441, 1, 128]
    - [82, 85.36]
  - - [4352, 128, 1, 128]
    - [128, 22.985]
  - - [8832, 5249, 1, 128]
    - [137, 78.349]
  - - [1536, 1025, 1, 128]
    - [115, 37.742]
  - - [11520, 512, 1, 128]
    - [139, 56.073]
  - - [5632, 2048, 1, 128]
    - [126, 64.682]
  - - [7424, 128, 1, 128]
    - [132, 30.355]
  - - [18432, 128, 1, 128]
    - [97, 50.333]
  - - [12672, 2048, 1, 128]
    - [92, 76.777]
  - - [14208, 128, 1, 128]
    - [204, 45.415]
  - - [15360, 7553, 1, 128]
    - [83, 83.478]
  - - [26496, 1024, 1, 128]
    - [118, 74.079]
  - - [27136, 128, 1, 128]
    - [106, 54.397]
  - - [12032, 2048, 1, 128]
    - [124, 76.545]
  - - [11648, 1024, 1, 128]
    - [100, 62.508]
  - - [11776, 512, 1, 128]
    - [139, 55.154]
  - - [1024, 512, 1, 128]
    - [159, 13.367]
  - - [11264, 7681, 1, 128]
    - [120, 82.248]
  - - [19456, 11777, 1, 128]
    - [82, 85.075]
  - - [14080, 4096, 1, 128]
    - [135, 80.637]
  - - [7040, 3329, 1, 128]
    - [87, 73.952]
  - - [27392, 4096, 1, 128]
    - [92, 83.568]
  - - [14720, 7041, 1, 128]
    - [82, 83.135]
  - - [19584, 1024, 1, 128]
    - [100, 72.381]
  - - [21376, 13569, 1, 128]
    - [82, 85.368]
  - - [20480, 12801, 1, 128]
    - [92, 84.365]
  - - [21248, 128, 1, 128]
    - [163, 52.31]
  - - [9728, 1024, 1, 128]
    - [118, 61.215]
  - - [18688, 10881, 1, 128]
    - [120, 84.558]
  - - [21120, 13313, 1, 128]
    - [87, 85.118]
  - - [20096, 2048, 1, 128]
    - [124, 78.759]
  - - [16640, 4096, 1, 128]
    - [109, 82.049]
  - - [28160, 12161, 1, 128]
    - [83, 85.725]
  - - [640, 129, 1, 128]
    - [162, 2.608]
  - - [28672, 512, 1, 128]
    - [92, 68.38]
  - - [12416, 4096, 1, 128]
    - [120, 80.246]
  - - [25344, 9473, 1, 128]
    - [82, 84.672]
  - - [18304, 1024, 1, 128]
    - [121, 71.676]
  - - [25600, 4096, 1, 128]
    - [93, 83.046]
  - - [22272, 512, 1, 128]
    - [139, 61.944]
  - - [21504, 13825, 1, 128]
    - [83, 85.412]
  - - [4736, 128, 1, 128]
    - [142, 24.18]
  - - [26496, 10625, 1, 128]
    - [83, 85.036]
  - - [7040, 512, 1, 128]
    - [150, 46.846]
  - - [14336, 4096, 1, 128]
    - [121, 80.51]
  - - [9216, 512, 1, 128]
    - [126, 46.119]
  - - [1280, 641, 1, 128]
    - [145, 25.325]
  - - [16768, 8961, 1, 128]
    - [83, 84.824]
  - - [18944, 11137, 1, 128]
    - [83, 84.614]
  - - [21504, 2048, 1, 128]
    - [109, 78.941]
  - - [21888, 1024, 1, 128]
    - [109, 75.241]
  - - [11264, 512, 1, 128]
    - [139, 51.335]
  - - [27776, 8192, 1, 128]
    - [82, 85.264]
  - - [10368, 6785, 1, 128]
    - [92, 81.408]
  - - [18432, 10753, 1, 128]
    - [83, 84.825]
  - - [19968, 2048, 1, 128]
    - [100, 79.103]
  - - [16640, 512, 1, 128]
    - [118, 61.585]
  - - [24576, 8577, 1, 128]
    - [131, 83.254]
  - - [28672, 2048, 1, 128]
    - [92, 81.211]
  - - [11136, 128, 1, 128]
    - [147, 42.082]
  - - [12288, 4609, 1, 128]
    - [124, 79.039]
  - - [14848, 1024, 1, 128]
    - [153, 67.569]
  - - [14848, 128, 1, 128]
    - [122, 44.082]
  - - [7424, 1024, 1, 128]
    - [139, 58.815]
  - - [2560, 1024, 1, 128]
    - [145, 44.834]
  - - [6400, 128, 1, 128]
    - [142, 27.866]
  - - [15488, 7809, 1, 128]
    - [83, 83.737]
  - - [17920, 2048, 1, 128]
    - [118, 78.551]
  - - [5760, 512, 1, 128]
    - [118, 49.612]
  - - [16640, 1024, 1, 128]
    - [109, 72.257]
  - - [28160, 2048, 1, 128]
    - [92, 80.426]
  - - [5504, 3969, 1, 128]
    - [97, 73.796]
  - - [11776, 1024, 1, 128]
    - [120, 62.345]
  - - [18816, 128, 1, 128]
    - [207, 46.635]
  - - [27904, 12033, 1, 128]
    - [85, 85.532]
  - - [11520, 7937, 1, 128]
    - [86, 82.799]
  - - [18944, 11265, 1, 128]
    - [83, 85.286]
  - - [5376, 1024, 1, 128]
    - [100, 48.945]
  - - [12032, 4225, 1, 128]
    - [121, 79.224]
  - - [5376, 128, 1, 128]
    - [165, 28.659]
  - - [9856, 1024, 1, 128]
    - [132, 61.854]
  - - [26752, 10881, 1, 128]
    - [92, 84.53]
  - - [20352, 128, 1, 128]
    - [140, 49.034]
  - - [14464, 128, 1, 128]
    - [129, 43.767]
  - - [1024, 385, 1, 128]
    - [114, 14.819]
  - - [3840, 128, 1, 128]
    - [151, 22.081]
  - - [24192, 128, 1, 128]
    - [163, 53.489]
  - - [28544, 12673, 1, 128]
    - [85, 85.202]
  - - [1664, 128, 1, 128]
    - [142, 9.461]
  - - [26752, 8192, 1, 128]
    - [85, 85.141]
  - - [16896, 1024, 1, 128]
    - [122, 69.616]
  - - [9728, 128, 1, 128]
    - [93, 38.108]
  - - [11264, 2048, 1, 128]
    - [134, 72.073]
  - - [11392, 2048, 1, 128]
    - [120, 72.538]
  - - [20224, 2048, 1, 128]
    - [92, 78.582]
  - - [26880, 1024, 1, 128]
    - [100, 74.79]
  - - [15104, 512, 1, 128]
    - [122, 58.887]
  - - [26368, 2048, 1, 128]
    - [100, 80.788]
  - - [6784, 3073, 1, 128]
    - [106, 70.875]
  - - [23168, 128, 1, 128]
    - [137, 52.237]
  - - [8448, 1024, 1, 128]
    - [92, 57.545]
  - - [16896, 9089, 1, 128]
    - [85, 84.1]
  - - [17536, 128, 1, 128]
    - [207, 49.286]
  - - [22912, 512, 1, 128]
    - [120, 64.969]
  - - [28032, 128, 1, 128]
    - [114, 54.433]
  - - [19584, 512, 1, 128]
    - [99, 66.126]
  - - [27136, 11265, 1, 128]
    - [83, 85.416]
  - - [4992, 512, 1, 128]
    - [144, 44.98]
  - - [8448, 128, 1, 128]
    - [205, 33.723]
  - - [27648, 128, 1, 128]
    - [137, 49.658]
  - - [16640, 2048, 1, 128]
    - [118, 77.918]
  - - [26752, 10753, 1, 128]
    - [87, 84.883]
  - - [2944, 1281, 1, 128]
    - [156, 50.823]
  - - [5376, 3841, 1, 128]
    - [132, 72.17]
  - - [10496, 6913, 1, 128]
    - [83, 82.066]
  - - [17024, 512, 1, 128]
    - [124, 60.007]
  - - [11008, 7297, 1, 128]
    - [121, 81.925]
  - - [14080, 128, 1, 128]
    - [204, 42.124]
  - - [5888, 512, 1, 128]
    - [93, 41.536]
  - - [19200, 128, 1, 128]
    - [207, 49.709]
  - - [14208, 6529, 1, 128]
    - [92, 82.531]
  - - [22912, 4096, 1, 128]
    - [120, 83.314]
  - - [14336, 2048, 1, 128]
    - [100, 78.106]
  - - [17792, 128, 1, 128]
    - [207, 47.108]
  - - [22656, 14849, 1, 128]
    - [82, 85.217]
  - - [19712, 512, 1, 128]
    - [132, 60.421]
  - - [5248, 1024, 1, 128]
    - [123, 50.919]
  - - [3712, 2049, 1, 128]
    - [157, 54.932]
  - - [24448, 8449, 1, 128]
    - [87, 84.377]
  - - [8192, 512, 1, 128]
    - [113, 39.56]
  - - [25472, 4096, 1, 128]
    - [109, 83.951]
  - - [25088, 512, 1, 128]
    - [92, 64.434]
  - - [23168, 1024, 1, 128]
    - [114, 73.387]
  - - [24320, 8192, 1, 128]
    - [120, 85.049]
  - - [24192, 8192, 1, 128]
    - [100, 84.991]
  - - [2176, 512, 1, 128]
    - [93, 34.752]
  - - [4992, 3457, 1, 128]
    - [91, 70.478]
  - - [896, 257, 1, 128]
    - [138, 10.576]
  - - [28288, 1024, 1, 128]
    - [118, 75.392]
  - - [20864, 1024, 1, 128]
    - [118, 75.154]
  - - [18432, 2048, 1, 128]
    - [109, 80.459]
  - - [17280, 9601, 1, 128]
    - [82, 84.419]
  - - [18944, 4096, 1, 128]
    - [109, 82.807]
  - - [13440, 128, 1, 128]
    - [123, 43.624]
  - - [7424, 2048, 1, 128]
    - [135, 68.463]
  - - [768, 128, 1, 128]
    - [138, 4.065]
  - - [16128, 512, 1, 128]
    - [109, 59.997]
  - - [28288, 12289, 1, 128]
    - [85, 85.165]
  - - [23552, 128, 1, 128]
    - [163, 47.707]
  - - [24832, 8192, 1, 128]
    - [109, 84.975]
  - - [10240, 1024, 1, 128]
    - [114, 62.698]
  - - [8960, 2048, 1, 128]
    - [109, 73.267]
  - - [17664, 9985, 1, 128]
    - [120, 84.391]
  - - [25088, 4096, 1, 128]
    - [83, 83.483]
  - - [7552, 2048, 1, 128]
    - [109, 69.465]
  - - [15104, 7297, 1, 128]
    - [85, 83.154]
  - - [7168, 1024, 1, 128]
    - [163, 57.165]
  - - [26112, 8192, 1, 128]
    - [100, 84.74]
  - - [24192, 1024, 1, 128]
    - [120, 75.569]
  - - [22912, 2048, 1, 128]
    - [118, 79.043]
  - - [10368, 512, 1, 128]
    - [119, 50.556]
  - - [22528, 4096, 1, 128]
    - [109, 83.286]
  - - [6528, 128, 1, 128]
    - [114, 32.126]
  - - [26752, 4096, 1, 128]
    - [92, 83.189]
  - - [2816, 512, 1, 128]
    - [139, 37.584]
  - - [22016, 14209, 1, 128]
    - [87, 85.489]
  - - [8832, 1024, 1, 128]
    - [118, 60.527]
  - - [16384, 128, 1, 128]
    - [176, 45.73]
  - - [5120, 1024, 1, 128]
    - [83, 49.784]
  - - [24832, 8833, 1, 128]
    - [83, 84.717]
  - - [11520, 128, 1, 128]
    - [124, 41.093]
  - - [24960, 512, 1, 128]
    - [120, 66.541]
  - - [27520, 2048, 1, 128]
    - [118, 80.882]
  - - [22272, 14593, 1, 128]
    - [100, 85.061]
  - - [2048, 128, 1, 128]
    - [141, 9.91]
  - - [2176, 1537, 1, 128]
    - [92, 50.155]
  - - [10496, 1024, 1, 128]
    - [121, 64.303]
  - - [12160, 4353, 1, 128]
    - [83, 80.568]
  - - [6144, 1024, 1, 128]
    - [100, 51.42]
  - - [26752, 1024, 1, 128]
    - [129, 74.409]
  - - [17280, 4096, 1, 128]
    - [118, 82.323]
  - - [16896, 512, 1, 128]
    - [121, 60.691]
  - - [4480, 128, 1, 128]
    - [189, 24.095]
  - - [18944, 128, 1, 128]
    - [207, 50.767]
  - - [9600, 2048, 1, 128]
    - [86, 71.928]
  - - [19456, 1024, 1, 128]
    - [100, 70.204]
  - - [9984, 2048, 1, 128]
    - [100, 74.925]
  - - [25216, 9217, 1, 128]
    - [120, 84.818]
  - - [19968, 1024, 1, 128]
    - [109, 74.404]
  - - [13952, 2048, 1, 128]
    - [109, 78.547]
  - - [10496, 2048, 1, 128]
    - [126, 72.148]
  - - [12672, 1024, 1, 128]
    - [118, 65.472]
  - - [19072, 11393, 1, 128]
    - [83, 84.831]
  - - [11008, 2048, 1, 128]
    - [124, 75.55]
  - - [27520, 11649, 1, 128]
    - [83, 85.243]
  - - [10880, 512, 1, 128]
    - [164, 51.09]
  - - [14592, 6785, 1, 128]
    - [92, 82.585]
  - - [7424, 512, 1, 128]
    - [128, 51.286]
  - - [13056, 5249, 1, 128]
    - [100, 81.601]
  - - [23296, 15489, 1, 128]
    - [85, 85.316]
  - - [28416, 8192, 1, 128]
    - [83, 85.228]
  - - [11392, 7681, 1, 128]
    - [100, 82.458]
  - - [18048, 1024, 1, 128]
    - [109, 72.275]
  - - [15616, 7809, 1, 128]
    - [86, 83.404]
  - - [128, 128, 1, 128]
    - [212, 0.774]
  - - [24704, 512, 1, 128]
    - [109, 67.616]
  - - [7680, 4097, 1, 128]
    - [135, 77.533]
  - - [16640, 8961, 1, 128]
    - [83, 84.671]
  - - [18944, 1024, 1, 128]
    - [114, 70.83]
  - - [12928, 2048, 1, 128]
    - [139, 76.822]
  - - [22272, 2048, 1, 128]
    - [92, 79.839]
  - - [27904, 11905, 1, 128]
    - [87, 85.337]
  - - [26240, 2048, 1, 128]
    - [100, 80.646]
  - - [9728, 6017, 1, 128]
    - [120, 80.528]
  - - [20736, 1024, 1, 128]
    - [109, 74.575]
  - - [3456, 1921, 1, 128]
    - [115, 53.948]
  - - [8064, 512, 1, 128]
    - [139, 49.64]
  - - [4224, 1024, 1, 128]
    - [85, 39.928]
  - - [25984, 10113, 1, 128]
    - [83, 85.211]
  - - [13696, 6017, 1, 128]
    - [82, 81.917]
  - - [27520, 8192, 1, 128]
    - [109, 85.338]
  - - [18944, 512, 1, 128]
    - [139, 61.173]
  - - [6272, 128, 1, 128]
    - [147, 31.522]
  - - [27264, 4096, 1, 128]
    - [85, 83.265]
  - - [1792, 1153, 1, 128]
    - [89, 46.476]
  - - [17536, 9729, 1, 128]
    - [82, 84.539]
  - - [13184, 5505, 1, 128]
    - [87, 81.759]
  - - [2944, 128, 1, 128]
    - [196, 16.786]
  - - [25344, 512, 1, 128]
    - [118, 66.139]
  - - [23040, 15361, 1, 128]
    - [87, 85.373]
  - - [8704, 512, 1, 128]
    - [89, 43.247]
  - - [20864, 13057, 1, 128]
    - [82, 85.078]
  - - [19328, 4096, 1, 128]
    - [83, 82.242]
  - - [28288, 8192, 1, 128]
    - [85, 85.161]
  - - [10112, 1024, 1, 128]
    - [128, 61.946]
  - - [17536, 2048, 1, 128]
    - [120, 78.456]
  - - [7552, 128, 1, 128]
    - [106, 35.076]
  - - [15616, 7937, 1, 128]
    - [83, 83.899]
  - - [23040, 512, 1, 128]
    - [121, 67.559]
  - - [25984, 2048, 1, 128]
    - [121, 80.299]
  - - [14720, 128, 1, 128]
    - [96, 43.627]
  - - [23424, 1024, 1, 128]
    - [109, 74.296]
  - - [1920, 1281, 1, 128]
    - [139, 43.873]
  - - [27136, 2048, 1, 128]
    - [121, 80.506]
  - - [28800, 8192, 1, 128]
    - [109, 85.194]
  - - [15488, 128, 1, 128]
    - [176, 44.313]
  - - [28800, 12929, 1, 128]
    - [83, 85.071]
  - - [21888, 14081, 1, 128]
    - [85, 85.548]
  - - [25600, 1024, 1, 128]
    - [92, 74.298]
  - - [21632, 1024, 1, 128]
    - [92, 73.11]
  - - [24448, 1024, 1, 128]
    - [100, 74.508]
  - - [4352, 2689, 1, 128]
    - [83, 65.414]
  - - [20480, 512, 1, 128]
    - [92, 62.871]
  - - [7296, 128, 1, 128]
    - [132, 30.264]
  - - [4992, 1024, 1, 128]
    - [119, 48.61]
  - - [27264, 11393, 1, 128]
    - [85, 85.042]
  - - [26752, 128, 1, 128]
    - [109, 51.697]
  - - [24960, 1024, 1, 128]
    - [120, 76.169]
  - - [21504, 512, 1, 128]
    - [109, 65.654]
  - - [6272, 2561, 1, 128]
    - [93, 71.209]
  - - [25088, 9089, 1, 128]
    - [83, 84.619]
  - - [20864, 512, 1, 128]
    - [114, 61.756]
  - - [4224, 2561, 1, 128]
    - [123, 62.155]
  - - [15744, 8065, 1, 128]
    - [83, 83.627]
  - - [21632, 128, 1, 128]
    - [163, 47.609]
  - - [15104, 4096, 1, 128]
    - [120, 81.02]
  - - [20352, 512, 1, 128]
    - [118, 62.363]
  - - [25472, 9601, 1, 128]
    - [87, 84.611]
  - - [27904, 512, 1, 128]
    - [114, 66.532]
  - - [19968, 512, 1, 128]
    - [92, 60.63]
  - - [5760, 1024, 1, 128]
    - [139, 51.965]
  - - [28416, 12545, 1, 128]
    - [85, 85.406]
  - - [16512, 8833, 1, 128]
    - [83, 83.704]
  - - [6016, 128, 1, 128]
    - [189, 25.875]
  - - [13056, 4096, 1, 128]
    - [126, 81.457]
  - - [19968, 12289, 1, 128]
    - [85, 85.255]
  - - [7424, 3713, 1, 128]
    - [100, 75.442]
  - - [28800, 128, 1, 128]
    - [99, 53.571]
  - - [512, 512, 1, 128]
    - [141, 11.204]
  - - [24832, 2048, 1, 128]
    - [109, 80.152]
  - - [20736, 128, 1, 128]
    - [163, 46.222]
  - - [26368, 512, 1, 128]
    - [109, 66.933]
  - - [26496, 8192, 1, 128]
    - [82, 85.097]
  - - [13824, 4096, 1, 128]
    - [100, 80.738]
  - - [27264, 128, 1, 128]
    - [132, 51.322]
  - - [21760, 1024, 1, 128]
    - [120, 74.061]
  - - [2432, 1921, 1, 128]
    - [113, 45.039]
  - - [27136, 8192, 1, 128]
    - [82, 84.971]
  - - [6784, 2048, 1, 128]
    - [98, 65.487]
  - - [11264, 128, 1, 128]
    - [211, 40.829]
  - - [7552, 512, 1, 128]
    - [83, 47.291]
  - - [19328, 11649, 1, 128]
    - [83, 84.949]
  - - [17152, 2048, 1, 128]
    - [120, 77.841]
  - - [23808, 16129, 1, 128]
    - [83, 85.672]
  - - [20224, 12417, 1, 128]
    - [82, 85.465]
  - - [27904, 1024, 1, 128]
    - [109, 76.15]
  - - [3456, 512, 1, 128]
    - [85, 42.976]
  - - [13312, 512, 1, 128]
    - [139, 55.089]
  - - [26368, 4096, 1, 128]
    - [109, 84.014]
  - - [23296, 15617, 1, 128]
    - [87, 85.766]
  - - [26112, 10241, 1, 128]
    - [85, 84.892]
  - - [26240, 512, 1, 128]
    - [114, 65.189]
  - - [4352, 1024, 1, 128]
    - [113, 42.985]
  - - [10624, 2048, 1, 128]
    - [118, 73.929]
  - - [23808, 16001, 1, 128]
    - [83, 85.715]
  - - [17536, 9857, 1, 128]
    - [82, 84.843]
  - - [23936, 4096, 1, 128]
    - [109, 83.586]
  - - [1408, 128, 1, 128]
    - [138, 9.233]
  - - [14848, 512, 1, 128]
    - [99, 60.499]
  - - [8704, 4993, 1, 128]
    - [121, 79.224]
  - - [15104, 2048, 1, 128]
    - [109, 77.555]
  - - [2560, 512, 1, 128]
    - [83, 36.136]
  - - [27264, 8192, 1, 128]
    - [82, 85.176]
  - - [23808, 4096, 1, 128]
    - [109, 83.194]
  - - [14080, 6273, 1, 128]
    - [83, 83.269]
  - - [10112, 6529, 1, 128]
    - [82, 81.128]
  - - [27648, 512, 1, 128]
    - [109, 67.492]
  - - [20992, 128, 1, 128]
    - [163, 51.316]
  - - [15104, 128, 1, 128]
    - [204, 47.308]
  - - [7808, 128, 1, 128]
    - [205, 32.254]
  - - [3584, 1024, 1, 128]
    - [150, 46.477]
  - - [15232, 512, 1, 128]
    - [139, 57.009]
  - - [21376, 13697, 1, 128]
    - [83, 85.375]
  - - [11392, 7809, 1, 128]
    - [83, 83.581]
  - - [11904, 1024, 1, 128]
    - [121, 65.046]
  - - [28800, 2048, 1, 128]
    - [120, 80.768]
  - - [8960, 512, 1, 128]
    - [139, 47.935]
  - - [19456, 11649, 1, 128]
    - [82, 84.958]
  - - [11904, 128, 1, 128]
    - [215, 38.134]
  - - [18560, 512, 1, 128]
    - [99, 62.219]
  - - [6656, 128, 1, 128]
    - [143, 32.954]
  - - [17792, 2048, 1, 128]
    - [131, 77.186]
  - - [21632, 4096, 1, 128]
    - [109, 83.338]
  - - [25728, 4096, 1, 128]
    - [109, 83.285]
  - - [18048, 10241, 1, 128]
    - [92, 84.404]
  - - [1792, 1281, 1, 128]
    - [140, 40.297]
  - - [512, 385, 1, 128]
    - [141, 7.311]
  - - [26112, 512, 1, 128]
    - [120, 67.188]
  - - [16128, 1024, 1, 128]
    - [100, 69.869]
  - - [4480, 1024, 1, 128]
    - [119, 43.669]
  - - [14720, 4096, 1, 128]
    - [100, 81.281]
  - - [23552, 2048, 1, 128]
    - [124, 80.736]
  - - [22528, 512, 1, 128]
    - [139, 62.72]
  - - [22912, 128, 1, 128]
    - [151, 53.361]
  - - [25344, 1024, 1, 128]
    - [109, 75.89]
  - - [24064, 16257, 1, 128]
    - [82, 85.918]
  - - [9088, 5377, 1, 128]
    - [83, 78.925]
  - - [27776, 128, 1, 128]
    - [137, 53.649]
  - - [15616, 512, 1, 128]
    - [134, 61.929]
  - - [13568, 128, 1, 128]
    - [204, 43.66]
  - - [15488, 7681, 1, 128]
    - [83, 83.65]
  - - [20096, 512, 1, 128]
    - [139, 64.421]
  - - [24832, 4096, 1, 128]
    - [118, 82.827]
  - - [28800, 4096, 1, 128]
    - [120, 83.371]
  - - [11904, 4225, 1, 128]
    - [100, 78.912]
  - - [3968, 1024, 1, 128]
    - [134, 49.536]
  - - [6400, 2817, 1, 128]
    - [131, 72.198]
  - - [24576, 4096, 1, 128]
    - [126, 81.858]
  - - [9088, 128, 1, 128]
    - [158, 37.291]
  - - [17152, 4096, 1, 128]
    - [120, 82.471]
  - - [22528, 14721, 1, 128]
    - [84, 85.425]
  - - [27392, 2048, 1, 128]
    - [109, 81.07]
  - - [8832, 512, 1, 128]
    - [165, 44.771]
  - - [8960, 5249, 1, 128]
    - [121, 79.357]
  - - [3200, 1024, 1, 128]
    - [113, 49.688]
  - - [4736, 3073, 1, 128]
    - [134, 67.774]
  - - [28032, 2048, 1, 128]
    - [124, 80.608]
  - - [14592, 2048, 1, 128]
    - [139, 75.642]
  - - [13440, 1024, 1, 128]
    - [134, 63.04]
  - - [14464, 2048, 1, 128]
    - [83, 76.344]
  - - [6912, 2048, 1, 128]
    - [100, 67.318]
  - - [19584, 2048, 1, 128]
    - [100, 78.564]
  - - [17920, 128, 1, 128]
    - [134, 48.776]
  - - [19584, 11777, 1, 128]
    - [85, 85.015]
  - - [23936, 16129, 1, 128]
    - [87, 85.649]
  - - [10496, 6785, 1, 128]
    - [85, 82.388]
  - - [27648, 2048, 1, 128]
    - [109, 81.267]
  - - [23808, 128, 1, 128]
    - [114, 48.116]
  - - [20864, 2048, 1, 128]
    - [100, 78.853]
  - - [9088, 512, 1, 128]
    - [128, 42.842]
  - - [3584, 512, 1, 128]
    - [83, 38.803]
  - - [8576, 4993, 1, 128]
    - [85, 79.177]
  - - [3328, 1024, 1, 128]
    - [89, 44.852]
  - - [20608, 2048, 1, 128]
    - [100, 77.708]
  - - [23552, 15745, 1, 128]
    - [83, 85.54]
  - - [23424, 15617, 1, 128]
    - [83, 85.719]
  - - [21120, 512, 1, 128]
    - [120, 61.205]
  - - [6656, 512, 1, 128]
    - [166, 50.716]
  - - [12544, 128, 1, 128]
    - [155, 42.56]
  - - [24448, 8577, 1, 128]
    - [87, 85.173]
  - - [9984, 512, 1, 128]
    - [119, 49.625]
  - - [18304, 4096, 1, 128]
    - [100, 82.506]
  - - [17920, 512, 1, 128]
    - [156, 59.283]
  - - [12160, 4096, 1, 128]
    - [100, 80.852]
  - - [3968, 2433, 1, 128]
    - [139, 61.183]
  - - [27008, 4096, 1, 128]
    - [118, 83.302]
  - - [22272, 1024, 1, 128]
    - [137, 70.817]
  - - [14336, 512, 1, 128]
    - [139, 53.523]
  - - [18560, 10753, 1, 128]
    - [87, 84.521]
  - - [6272, 2048, 1, 128]
    - [100, 66.09]
  - - [12800, 1024, 1, 128]
    - [132, 67.431]
  - - [9600, 5889, 1, 128]
    - [120, 81.564]
  - - [13056, 128, 1, 128]
    - [156, 37.58]
  - - [7296, 2048, 1, 128]
    - [118, 69.616]
  - - [21376, 512, 1, 128]
    - [121, 62.177]
  - - [11904, 512, 1, 128]
    - [139, 53.957]
  - - [6400, 1024, 1, 128]
    - [137, 54.912]
  - - [27008, 1024, 1, 128]
    - [109, 74.622]
  - - [22400, 14721, 1, 128]
    - [83, 85.239]
  - - [6272, 1024, 1, 128]
    - [121, 52.442]
  - - [17408, 128, 1, 128]
    - [140, 48.95]
  - - [26624, 10625, 1, 128]
    - [87, 84.643]
  - - [22400, 1024, 1, 128]
    - [100, 75.917]
  - - [18304, 10625, 1, 128]
    - [84, 84.767]
  - - [15872, 1024, 1, 128]
    - [109, 72.118]
  - - [21120, 128, 1, 128]
    - [163, 50.383]
  - - [22784, 4096, 1, 128]
    - [120, 83.126]
  - - [25728, 9857, 1, 128]
    - [83, 85.195]
  - - [16256, 1024, 1, 128]
    - [95, 66.879]
  - - [18560, 4096, 1, 128]
    - [109, 81.828]
  - - [7936, 4225, 1, 128]
    - [120, 78.579]
  - - [7680, 3969, 1, 128]
    - [118, 76.946]
  - - [9472, 2048, 1, 128]
    - [101, 70.597]
  - - [28160, 128, 1, 128]
    - [109, 51.972]
  - - [18816, 512, 1, 128]
    - [92, 57.146]
  - - [9856, 512, 1, 128]
    - [83, 48.958]
  - - [17664, 9857, 1, 128]
    - [83, 84.873]
  - - [27392, 128, 1, 128]
    - [114, 51.874]
  - - [24448, 2048, 1, 128]
    - [109, 81.099]
  - - [7808, 512, 1, 128]
    - [128, 51.436]
  - - [13952, 512, 1, 128]
    - [118, 54.426]
  - - [24576, 512, 1, 128]
    - [104, 61.41]
  - - [27520, 128, 1, 128]
    - [97, 53.084]
  - - [26496, 512, 1, 128]
    - [122, 65.534]
  - - [8576, 512, 1, 128]
    - [163, 50.243]
  - - [11648, 512, 1, 128]
    - [139, 53.759]
  - - [17408, 2048, 1, 128]
    - [100, 79.389]
  - - [17920, 10241, 1, 128]
    - [83, 84.657]
  - - [16384, 1024, 1, 128]
    - [167, 64.169]
  - - [6016, 2048, 1, 128]
    - [124, 69.194]
  - - [9728, 512, 1, 128]
    - [126, 48.274]
  - - [19712, 128, 1, 128]
    - [140, 47.77]
  - - [26112, 1024, 1, 128]
    - [109, 73.26]
  - - [16768, 128, 1, 128]
    - [91, 48.416]
  - - [8960, 1024, 1, 128]
    - [100, 60.971]
  - - [6784, 128, 1, 128]
    - [196, 31.287]
  - - [12800, 4993, 1, 128]
    - [85, 80.854]
  - - [6144, 2561, 1, 128]
    - [126, 71.354]
  - - [26880, 10881, 1, 128]
    - [86, 84.907]
  - - [12928, 1024, 1, 128]
    - [124, 65.466]
  - - [7040, 3457, 1, 128]
    - [135, 74.9]
  - - [15744, 4096, 1, 128]
    - [109, 81.296]
  - - [20096, 4096, 1, 128]
    - [92, 82.023]
  - - [21760, 128, 1, 128]
    - [109, 49.789]
  - - [7936, 2048, 1, 128]
    - [92, 72.546]
  - - [24448, 8192, 1, 128]
    - [120, 85.117]
  - - [21120, 2048, 1, 128]
    - [109, 79.48]
  - - [12160, 1024, 1, 128]
    - [154, 60.087]
  - - [7168, 3457, 1, 128]
    - [92, 73.495]
  - - [15232, 7553, 1, 128]
    - [82, 83.539]
  - - [26624, 1024, 1, 128]
    - [120, 77.253]
  - - [25344, 2048, 1, 128]
    - [92, 80.898]
  - - [12544, 4865, 1, 128]
    - [83, 80.918]
  - - [21120, 4096, 1, 128]
    - [126, 83.278]
  - - [20224, 128, 1, 128]
    - [140, 48.281]
  - - [14592, 4096, 1, 128]
    - [109, 81.394]
  - - [16256, 8577, 1, 128]
    - [83, 84.473]
  - - [24192, 4096, 1, 128]
    - [109, 83.535]
  - - [21248, 1024, 1, 128]
    - [100, 73.129]
  - - [25216, 1024, 1, 128]
    - [109, 74.497]
  - - [5888, 2177, 1, 128]
    - [106, 66.187]
  - - [21504, 1024, 1, 128]
    - [114, 73.995]
  - - [17536, 1024, 1, 128]
    - [100, 72.375]
  - - [9728, 2048, 1, 128]
    - [114, 73.025]
  - - [13952, 6273, 1, 128]
    - [100, 82.471]
  - - [28800, 512, 1, 128]
    - [103, 66.213]
  - - [2304, 1793, 1, 128]
    - [153, 51.81]
  - - [12416, 128, 1, 128]
    - [197, 40.725]
  - - [20224, 1024, 1, 128]
    - [124, 72.981]
  - - [22144, 128, 1, 128]
    - [153, 51.114]
  - - [22784, 1024, 1, 128]
    - [109, 71.854]
  - - [27136, 4096, 1, 128]
    - [124, 83.692]
  - - [27264, 512, 1, 128]
    - [118, 67.59]
  - - [26240, 10241, 1, 128]
    - [83, 84.847]
  - - [27904, 4096, 1, 128]
    - [109, 83.996]
  - - [21504, 128, 1, 128]
    - [163, 50.656]
  - - [3712, 2177, 1, 128]
    - [126, 58.358]
  - - [18432, 1024, 1, 128]
    - [118, 70.554]
  - - [28672, 4096, 1, 128]
    - [131, 82.976]
  - - [25344, 4096, 1, 128]
    - [109, 84.011]
  - - [26880, 512, 1, 128]
    - [95, 64.972]
  - - [21888, 2048, 1, 128]
    - [120, 79.062]
  - - [1792, 128, 1, 128]
    - [189, 11.495]
  - - [6016, 1024, 1, 128]
    - [109, 54.035]
  - - [15104, 7425, 1, 128]
    - [87, 83.413]
  - - [22016, 2048, 1, 128]
    - [118, 79.247]
  - - [13952, 4096, 1, 128]
    - [100, 80.8]
  - - [20992, 4096, 1, 128]
    - [100, 82.844]
  - - [8064, 4481, 1, 128]
    - [85, 77.242]
  - - [12672, 4096, 1, 128]
    - [93, 80.372]
  - - [20096, 12289, 1, 128]
    - [82, 84.841]
  - - [14848, 2048, 1, 128]
    - [124, 77.801]
  - - [23168, 512, 1, 128]
    - [100, 62.653]
  - - [7680, 128, 1, 128]
    - [169, 35.713]
  - - [13312, 1024, 1, 128]
    - [109, 64.526]
  - - [10624, 1024, 1, 128]
    - [105, 57.571]
  - - [3840, 512, 1, 128]
    - [105, 38.75]
  - - [22144, 14337, 1, 128]
    - [85, 85.622]
  - - [3200, 128, 1, 128]
    - [159, 19.336]
  - - [25472, 9473, 1, 128]
    - [85, 84.897]
  - - [16768, 9089, 1, 128]
    - [85, 84.196]
  - - [12288, 2048, 1, 128]
    - [100, 72.086]
  - - [20608, 512, 1, 128]
    - [100, 64.403]
  - - [2816, 1024, 1, 128]
    - [139, 47.546]
  - - [7552, 1024, 1, 128]
    - [100, 60.263]
  - - [5120, 3457, 1, 128]
    - [106, 69.511]
  - - [25216, 2048, 1, 128]
    - [100, 79.943]
  - - [12672, 4865, 1, 128]
    - [82, 80.853]
  - - [10880, 2048, 1, 128]
    - [109, 75.319]
  - - [18176, 512, 1, 128]
    - [139, 58.028]
  - - [8320, 4609, 1, 128]
    - [128, 77.491]
  - - [16000, 4096, 1, 128]
    - [109, 81.71]
  - - [22144, 2048, 1, 128]
    - [100, 79.349]
  - - [22784, 512, 1, 128]
    - [139, 64.404]
  - - [4096, 2561, 1, 128]
    - [93, 63.003]
  - - [24576, 2048, 1, 128]
    - [126, 78.198]
  - - [26624, 4096, 1, 128]
    - [109, 83.782]
  - - [18560, 2048, 1, 128]
    - [100, 80.401]
  - - [19584, 128, 1, 128]
    - [140, 47.111]
  - - [23936, 2048, 1, 128]
    - [100, 79.306]
  - - [23552, 512, 1, 128]
    - [100, 63.758]
  - - [12032, 4096, 1, 128]
    - [120, 81.542]
  - - [3840, 2305, 1, 128]
    - [93, 59.483]
  - - [25088, 128, 1, 128]
    - [109, 55.144]
  - - [16640, 8833, 1, 128]
    - [87, 83.911]
  - - [896, 128, 1, 128]
    - [138, 5.494]
  - - [17280, 2048, 1, 128]
    - [139, 77.313]
  - - [16896, 2048, 1, 128]
    - [118, 76.752]
  - - [22656, 128, 1, 128]
    - [134, 52.655]
  - - [25728, 8192, 1, 128]
    - [109, 85.028]
  - - [16128, 128, 1, 128]
    - [105, 47.043]
  - - [3840, 1024, 1, 128]
    - [99, 48.52]
  - - [2944, 512, 1, 128]
    - [143, 33.343]
  - - [24064, 1024, 1, 128]
    - [120, 75.699]
  - - [896, 385, 1, 128]
    - [145, 10.844]
  - - [8064, 128, 1, 128]
    - [194, 29.875]
  - - [12416, 1024, 1, 128]
    - [139, 61.185]
  - - [20608, 128, 1, 128]
    - [121, 48.446]
  - - [2944, 1024, 1, 128]
    - [113, 47.176]
  - - [6656, 2048, 1, 128]
    - [139, 65.997]
  - - [24064, 128, 1, 128]
    - [111, 50.816]
  - - [15744, 7937, 1, 128]
    - [82, 83.774]
  - - [2688, 1024, 1, 128]
    - [153, 40.125]
  - - [24192, 8193, 1, 128]
    - [100, 83.972]
  - - [24320, 4096, 1, 128]
    - [100, 83.115]
  - - [24576, 8705, 1, 128]
    - [93, 82.994]
  - - [13824, 1024, 1, 128]
    - [121, 64.82]
  - - [27776, 512, 1, 128]
    - [121, 67.194]
  - - [10240, 128, 1, 128]
    - [128, 33.545]
  - - [26240, 10369, 1, 128]
    - [83, 85.01]
  - - [16512, 4096, 1, 128]
    - [118, 81.379]
  - - [9856, 6145, 1, 128]
    - [120, 80.757]
  - - [27392, 1024, 1, 128]
    - [109, 77.059]
  - - [14976, 1024, 1, 128]
    - [105, 67.73]
  - - [1280, 512, 1, 128]
    - [89, 19.718]
  - - [6528, 2817, 1, 128]
    - [124, 72.905]
  - - [12288, 512, 1, 128]
    - [139, 54.149]
  - - [5248, 512, 1, 128]
    - [118, 46.695]
  - - [28544, 4096, 1, 128]
    - [109, 83.979]
  - - [21248, 13569, 1, 128]
    - [83, 85.341]
  - - [26112, 2048, 1, 128]
    - [121, 80.127]
  - - [14208, 6401, 1, 128]
    - [85, 83.195]
  - - [13952, 128, 1, 128]
    - [109, 45.64]
  - - [2304, 1665, 1, 128]
    - [145, 47.787]
  - - [6912, 1024, 1, 128]
    - [168, 49.638]
  - - [28672, 1024, 1, 128]
    - [121, 74.466]
  - - [14592, 6913, 1, 128]
    - [100, 82.654]
  - - [24704, 1024, 1, 128]
    - [120, 74.359]
  - - [22400, 512, 1, 128]
    - [109, 60.686]
  - - [23424, 4096, 1, 128]
    - [109, 83.77]
  - - [24832, 128, 1, 128]
    - [109, 54.7]
  - - [23680, 2048, 1, 128]
    - [120, 79.13]
  - - [25984, 9985, 1, 128]
    - [100, 84.533]
  - - [15360, 512, 1, 128]
    - [163, 55.279]
  - - [21376, 2048, 1, 128]
    - [92, 80.136]
  - - [16128, 2048, 1, 128]
    - [109, 78.844]
  - - [15872, 512, 1, 128]
    - [100, 56.6]
  - - [3072, 128, 1, 128]
    - [206, 18.738]
  - - [27520, 4096, 1, 128]
    - [109, 83.604]
  - - [25216, 4096, 1, 128]
    - [109, 83.247]
  - - [28672, 12673, 1, 128]
    - [92, 84.686]
  - - [28288, 512, 1, 128]
    - [92, 67.376]
  - - [22400, 4096, 1, 128]
    - [92, 83.092]
  - - [25344, 9345, 1, 128]
    - [83, 84.885]
  - - [9984, 128, 1, 128]
    - [132, 39.252]
  - - [28416, 1024, 1, 128]
    - [100, 75.318]
  - - [27008, 8192, 1, 128]
    - [120, 85.01]
  - - [13184, 1024, 1, 128]
    - [114, 66.576]
  - - [10240, 512, 1, 128]
    - [134, 54.582]
  - - [3456, 128, 1, 128]
    - [141, 21.343]
  - - [16000, 8321, 1, 128]
    - [83, 84.173]
  - - [27520, 1024, 1, 128]
    - [92, 74.643]
  - - [25088, 1024, 1, 128]
    - [109, 74.57]
  - - [6784, 512, 1, 128]
    - [106, 44.167]
  - - [18432, 10625, 1, 128]
    - [85, 84.08]
  - - [16128, 4096, 1, 128]
    - [100, 82.863]
  - - [26880, 11009, 1, 128]
    - [85, 85.212]
  - - [28800, 12801, 1, 128]
    - [82, 85.468]
  - - [12288, 4096, 1, 128]
    - [124, 79.572]
  - - [20096, 12417, 1, 128]
    - [85, 84.983]
  - - [1920, 128, 1, 128]
    - [171, 11.072]
  - - [13056, 2048, 1, 128]
    - [124, 76.175]
  - - [384, 385, 1, 128]
    - [169, 6.032]
  - - [9088, 1024, 1, 128]
    - [139, 58.01]
  - - [6784, 1024, 1, 128]
    - [109, 58.443]
  - - [21760, 4096, 1, 128]
    - [118, 82.495]
  - - [27008, 11009, 1, 128]
    - [83, 85.289]
  - - [14208, 1024, 1, 128]
    - [125, 64.858]
  - - [25600, 512, 1, 128]
    - [139, 63.274]
  - - [23680, 1024, 1, 128]
    - [121, 74.28]
  - - [28160, 8192, 1, 128]
    - [83, 85.179]
  - - [22016, 4096, 1, 128]
    - [109, 82.953]
  - - [18688, 4096, 1, 128]
    - [120, 82.234]
  - - [10752, 1024, 1, 128]
    - [139, 59.617]
  - - [2432, 128, 1, 128]
    - [188, 12.501]
  - - [7296, 512, 1, 128]
    - [170, 47.277]
  - - [19200, 4096, 1, 128]
    - [121, 82.893]
  - - [4608, 2945, 1, 128]
    - [85, 68.401]
  - - [18816, 11009, 1, 128]
    - [85, 84.647]
  - - [9600, 1024, 1, 128]
    - [139, 60.395]
  - - [7168, 512, 1, 128]
    - [139, 47.832]
  - - [11904, 4097, 1, 128]
    - [84, 78.747]
  - - [17920, 1024, 1, 128]
    - [109, 72.969]
  - - [11520, 7809, 1, 128]
    - [83, 83.062]
  - - [22784, 14977, 1, 128]
    - [82, 85.296]
  - - [13696, 1024, 1, 128]
    - [100, 65.649]
  - - [15104, 1024, 1, 128]
    - [118, 69.918]
  - - [25216, 512, 1, 128]
    - [92, 63.377]
  - - [5376, 512, 1, 128]
    - [163, 47.742]
  - - [17408, 4096, 1, 128]
    - [109, 82.619]
  - - [25728, 512, 1, 128]
    - [132, 65.352]
  - - [896, 512, 1, 128]
    - [171, 16.517]
  - - [6912, 3329, 1, 128]
    - [85, 72.746]
  - - [22016, 512, 1, 128]
    - [101, 60.927]
  - - [22144, 4096, 1, 128]
    - [93, 82.625]
  - - [10368, 128, 1, 128]
    - [193, 35.743]
  - - [23296, 2048, 1, 128]
    - [118, 80.157]
  - - [17920, 10113, 1, 128]
    - [87, 84.816]
  - - [14848, 4096, 1, 128]
    - [120, 82.382]
  - - [26112, 128, 1, 128]
    - [153, 55.556]
  - - [28032, 8192, 1, 128]
    - [109, 85.351]
  - - [20096, 128, 1, 128]
    - [151, 49.664]
  - - [15360, 4096, 1, 128]
    - [100, 82.703]
  - - [3328, 128, 1, 128]
    - [188, 20.504]
  - - [25472, 512, 1, 128]
    - [99, 64.56]
  - - [18304, 128, 1, 128]
    - [140, 49.687]
  - - [20352, 12545, 1, 128]
    - [87, 84.914]
  - - [26624, 10753, 1, 128]
    - [85, 85.018]
  - - [20480, 2048, 1, 128]
    - [109, 77.71]
  - - [26496, 10497, 1, 128]
    - [84, 84.91]
  - - [22400, 128, 1, 128]
    - [106, 47.881]
  - - [9216, 5505, 1, 128]
    - [93, 79.451]
  - - [24064, 8193, 1, 128]
    - [82, 85.065]
  - - [4224, 128, 1, 128]
    - [188, 19.062]
  - - [6656, 3073, 1, 128]
    - [92, 72.141]
  - - [10880, 1024, 1, 128]
    - [139, 63.495]
  - - [23808, 512, 1, 128]
    - [118, 69.412]
  - - [15488, 1024, 1, 128]
    - [132, 70.235]
  - - [24704, 8705, 1, 128]
    - [86, 84.321]
  - - [12416, 4609, 1, 128]
    - [83, 79.35]
  - - [3712, 1024, 1, 128]
    - [139, 47.022]
  - - [25856, 8192, 1, 128]
    - [83, 84.871]
  - - [8320, 1024, 1, 128]
    - [139, 53.913]
  - - [16256, 512, 1, 128]
    - [153, 60.183]
  - - [18944, 2048, 1, 128]
    - [109, 80.103]
  - - [23168, 4096, 1, 128]
    - [92, 82.813]
  - - [15616, 2048, 1, 128]
    - [93, 76.846]
  - - [24320, 512, 1, 128]
    - [100, 64.365]
  - - [2688, 1025, 1, 128]
    - [157, 41.492]
  - - [12800, 5121, 1, 128]
    - [84, 80.894]
  - - [5120, 128, 1, 128]
    - [142, 27.959]
  - - [4352, 512, 1, 128]
    - [145, 43.656]
  - - [24576, 8192, 1, 128]
    - [131, 83.726]
  - - [8320, 512, 1, 128]
    - [153, 51.02]
  - - [12160, 4481, 1, 128]
    - [88, 79.167]
  - - [2560, 1025, 1, 128]
    - [93, 44.128]
  - - [19072, 1024, 1, 128]
    - [92, 71.413]
  - - [2816, 1153, 1, 128]
    - [111, 54.03]
  - - [6912, 128, 1, 128]
    - [189, 32.524]
  - - [9088, 2048, 1, 128]
    - [120, 74.369]
  - - [26368, 8192, 1, 128]
    - [83, 85.105]
  - - [17408, 9729, 1, 128]
    - [83, 84.644]
  - - [18816, 4096, 1, 128]
    - [120, 82.293]
  - - [4480, 512, 1, 128]
    - [140, 44.406]
  - - [11648, 128, 1, 128]
    - [158, 38.606]
  - - [1536, 897, 1, 128]
    - [172, 36.868]
  - - [11136, 1024, 1, 128]
    - [106, 59.645]
  - - [8704, 1024, 1, 128]
    - [106, 62.098]
  - - [19072, 2048, 1, 128]
    - [124, 78.543]
  - - [25856, 1024, 1, 128]
    - [121, 76.389]
  - - [7552, 3841, 1, 128]
    - [92, 76.518]
  - - [23296, 128, 1, 128]
    - [114, 51.852]
  - - [23424, 512, 1, 128]
    - [120, 64.504]
  - - [26368, 10497, 1, 128]
    - [83, 85.382]
  - - [18560, 1024, 1, 128]
    - [114, 69.986]
  - - [8192, 128, 1, 128]
    - [92, 33.215]
  - - [27776, 11905, 1, 128]
    - [92, 84.86]
  - - [18688, 1024, 1, 128]
    - [121, 72.051]
  - - [21248, 4096, 1, 128]
    - [109, 82.725]
  - - [16256, 8449, 1, 128]
    - [83, 84.124]
  - - [1920, 1409, 1, 128]
    - [111, 47.211]
  - - [24704, 4096, 1, 128]
    - [109, 83.321]
  - - [13824, 6145, 1, 128]
    - [83, 82.271]
  - - [6528, 512, 1, 128]
    - [106, 47.397]
  - - [21376, 128, 1, 128]
    - [163, 47.342]
  - - [11264, 1024, 1, 128]
    - [109, 64.573]
  - - [4352, 2817, 1, 128]
    - [137, 64.247]
  - - [22272, 4096, 1, 128]
    - [92, 82.884]
  - - [27264, 11265, 1, 128]
    - [87, 85.028]
  - - [28160, 1024, 1, 128]
    - [121, 76.287]
  - - [16256, 128, 1, 128]
    - [94, 43.061]
  - - [18688, 2048, 1, 128]
    - [118, 77.916]
  - - [9600, 6017, 1, 128]
    - [85, 81.108]
  - - [23552, 1024, 1, 128]
    - [92, 75.686]
  - - [8576, 128, 1, 128]
    - [115, 32.281]
  - - [20992, 13185, 1, 128]
    - [83, 85.43]
  - - [20992, 1024, 1, 128]
    - [109, 72.314]
  - - [14720, 512, 1, 128]
    - [139, 56.168]
  - - [28032, 1024, 1, 128]
    - [121, 75.748]
  - - [20352, 2048, 1, 128]
    - [109, 80.278]
  - - [15360, 128, 1, 128]
    - [96, 45.142]
  - - [8448, 2048, 1, 128]
    - [125, 70.044]
  - - [6272, 2689, 1, 128]
    - [89, 68.836]
  - - [7808, 4097, 1, 128]
    - [132, 76.224]
  - - [25472, 128, 1, 128]
    - [121, 55.081]
  - - [12288, 4481, 1, 128]
    - [93, 79.536]
  - - [28416, 4096, 1, 128]
    - [109, 83.755]
  - - [2176, 128, 1, 128]
    - [138, 13.076]
  - - [21760, 2048, 1, 128]
    - [100, 79.15]
  - - [21376, 1024, 1, 128]
    - [109, 74.354]
  - - [13696, 2048, 1, 128]
    - [137, 75.443]
  - - [28288, 12417, 1, 128]
    - [82, 85.258]
  - - [5632, 512, 1, 128]
    - [153, 47.061]
  - - [22016, 1024, 1, 128]
    - [109, 73.356]
  - - [25216, 128, 1, 128]
    - [99, 51.992]
  - - [25216, 8192, 1, 128]
    - [82, 85.241]
  - - [12032, 128, 1, 128]
    - [197, 36.008]
  - - [6144, 2048, 1, 128]
    - [92, 65.036]
  - - [23680, 128, 1, 128]
    - [92, 51.432]
  - - [15744, 128, 1, 128]
    - [125, 46.184]
  - - [3968, 512, 1, 128]
    - [89, 46.639]
  - - [16512, 1024, 1, 128]
    - [124, 71.341]
  - - [1536, 128, 1, 128]
    - [138, 9.109]
  - - [25984, 4096, 1, 128]
    - [109, 84.101]
  - - [19456, 512, 1, 128]
    - [139, 62.672]
  - - [9984, 1024, 1, 128]
    - [100, 62.239]
  - - [14080, 6401, 1, 128]
    - [84, 82.622]
  - - [20736, 2048, 1, 128]
    - [118, 78.851]
  - - [4224, 2689, 1, 128]
    - [83, 63.487]
  - - [13696, 512, 1, 128]
    - [100, 56.363]
  - - [17280, 1024, 1, 128]
    - [105, 70.913]
  - - [10752, 128, 1, 128]
    - [151, 39.811]
  - - [1536, 512, 1, 128]
    - [145, 24.702]
  - - [25728, 2048, 1, 128]
    - [121, 79.223]
  - - [9472, 128, 1, 128]
    - [164, 37.076]
  - - [7168, 3585, 1, 128]
    - [126, 75.066]
  - - [14720, 1024, 1, 128]
    - [118, 65.762]
  - - [25728, 128, 1, 128]
    - [153, 53.998]
  - - [14976, 128, 1, 128]
    - [129, 45.839]
  - - [24832, 1024, 1, 128]
    - [120, 75.379]
  - - [14080, 512, 1, 128]
    - [110, 55.168]
  - - [17152, 1024, 1, 128]
    - [129, 70.235]
  - - [19072, 512, 1, 128]
    - [109, 64.396]
  - - [21120, 1024, 1, 128]
    - [129, 73.163]
  - - [4864, 128, 1, 128]
    - [196, 25.507]
  - - [7936, 512, 1, 128]
    - [163, 51.578]
  - - [21248, 13441, 1, 128]
    - [83, 85.121]
  - - [12160, 2048, 1, 128]
    - [121, 77.406]
  - - [19712, 11905, 1, 128]
    - [85, 84.865]
  - - [23296, 1024, 1, 128]
    - [109, 73.527]
  - - [24832, 8961, 1, 128]
    - [85, 84.937]
  - - [13568, 2048, 1, 128]
    - [139, 75.302]
  - - [13696, 4096, 1, 128]
    - [100, 80.317]
  - - [5888, 128, 1, 128]
    - [141, 27.909]
  - - [10112, 2048, 1, 128]
    - [137, 74.353]
  - - [21632, 13953, 1, 128]
    - [83, 85.443]
  - - [19328, 512, 1, 128]
    - [100, 64.155]
  - - [6272, 512, 1, 128]
    - [113, 48.417]
  - - [4864, 3201, 1, 128]
    - [132, 69.329]
  - - [15232, 4096, 1, 128]
    - [124, 80.872]
  - - [23040, 4096, 1, 128]
    - [131, 82.793]
  - - [2816, 1281, 1, 128]
    - [145, 47.966]
  - - [8960, 128, 1, 128]
    - [197, 32.028]
  - - [9472, 1024, 1, 128]
    - [139, 63.644]
  - - [27648, 11777, 1, 128]
    - [82, 85.608]
  - - [28416, 2048, 1, 128]
    - [92, 81.463]
  - - [13952, 6145, 1, 128]
    - [100, 82.033]
  - - [13952, 1024, 1, 128]
    - [120, 67.879]
  - - [12544, 2048, 1, 128]
    - [105, 74.211]
  - - [10624, 7041, 1, 128]
    - [85, 81.739]
  - - [24704, 2048, 1, 128]
    - [92, 80.36]
  - - [17280, 9473, 1, 128]
    - [83, 84.397]
  - - [25088, 9217, 1, 128]
    - [84, 84.561]
  - - [10240, 6657, 1, 128]
    - [92, 80.719]
  - - [12800, 4096, 1, 128]
    - [124, 81.097]
  - - [17792, 1024, 1, 128]
    - [109, 73.933]
  - - [12160, 128, 1, 128]
    - [211, 37.066]
  - - [16512, 128, 1, 128]
    - [102, 43.938]
  - - [25856, 512, 1, 128]
    - [124, 66.742]
  - - [8576, 4865, 1, 128]
    - [139, 77.795]
  - - [25984, 1024, 1, 128]
    - [109, 75.671]
  - - [512, 128, 1, 128]
    - [138, 3.185]
  - - [10112, 128, 1, 128]
    - [106, 39.194]
  - - [28288, 2048, 1, 128]
    - [120, 80.107]
  - - [1152, 641, 1, 128]
    - [173, 22.09]
  - - [17920, 4096, 1, 128]
    - [109, 82.51]
  - - [2560, 1921, 1, 128]
    - [154, 46.564]
  - - [24704, 8833, 1, 128]
    - [83, 84.539]
  - - [3200, 512, 1, 128]
    - [108, 41.189]
  - - [6656, 2945, 1, 128]
    - [85, 72.601]
  - - [12672, 4993, 1, 128]
    - [82, 80.637]
  - - [4608, 1024, 1, 128]
    - [149, 44.163]
  - - [25856, 9985, 1, 128]
    - [82, 85.026]
  - - [23808, 2048, 1, 128]
    - [109, 79.671]
  - - [9728, 6145, 1, 128]
    - [131, 79.515]
  - - [28416, 12417, 1, 128]
    - [87, 85.269]
  - - [14464, 4096, 1, 128]
    - [118, 80.858]
  - - [21888, 128, 1, 128]
    - [163, 53.234]
  - - [23680, 15873, 1, 128]
    - [84, 85.311]
  - - [22144, 1024, 1, 128]
    - [121, 73.543]
  - - [17664, 512, 1, 256]
    - [30, 0.0]
  - - [25600, 1024, 1, 256]
    - [30, 0.0]
  - - [28928, 512, 1, 256]
    - [30, 0.0]
  - - [15104, 512, 1, 256]
    - [30, 0.0]
  - - [38912, 1024, 1, 256]
    - [35, 0.0]
  - - [34304, 8192, 1, 256]
    - [35, 0.0]
  - - [23552, 1024, 1, 256]
    - [30, 0.0]
  - - [39424, 23552, 1, 256]
    - [35, 0.0]
  - - [9472, 1024, 1, 256]
    - [30, 0.0]
  - - [28928, 13056, 1, 256]
    - [11, 0.0]
  - - [42496, 1024, 1, 256]
    - [30, 0.0]
  - - [18432, 1024, 1, 256]
    - [30, 0.0]
  - - [40192, 24320, 1, 256]
    - [11, 0.0]
  - - [33280, 17152, 1, 256]
    - [11, 0.0]
  - - [27904, 512, 1, 256]
    - [30, 0.0]
  - - [39680, 8192, 1, 256]
    - [35, 0.0]
  - - [28160, 8192, 1, 256]
    - [35, 0.0]
  - - [25088, 8192, 1, 256]
    - [35, 0.0]
  - - [23040, 15360, 1, 256]
    - [35, 0.0]
  - - [19712, 11776, 1, 256]
    - [30, 0.0]
  - - [43520, 27648, 1, 256]
    - [35, 0.0]
  - - [44544, 4096, 1, 256]
    - [35, 0.0]
  - - [20224, 4096, 1, 256]
    - [35, 0.0]
  - - [31744, 4096, 1, 256]
    - [35, 0.0]
  - - [33024, 16896, 1, 256]
    - [30, 0.0]
  - - [32768, 8192, 1, 256]
    - [35, 0.0]
  - - [42752, 4096, 1, 256]
    - [35, 0.0]
  - - [19968, 512, 1, 256]
    - [30, 0.0]
  - - [10496, 512, 1, 256]
    - [29, 0.0]
  - - [36864, 4096, 1, 256]
    - [35, 0.0]
  - - [12288, 1024, 1, 256]
    - [30, 0.0]
  - - [22784, 14848, 1, 256]
    - [30, 0.0]
  - - [17152, 9472, 1, 256]
    - [11, 0.0]
  - - [31488, 1024, 1, 256]
    - [30, 0.0]
  - - [25344, 1024, 1, 256]
    - [30, 0.0]
  - - [33536, 512, 1, 256]
    - [30, 0.0]
  - - [28672, 8192, 1, 256]
    - [35, 0.0]
  - - [15104, 7168, 1, 256]
    - [30, 0.0]
  - - [38144, 22272, 1, 256]
    - [11, 0.0]
  - - [25344, 4096, 1, 256]
    - [35, 0.0]
  - - [6400, 2560, 1, 256]
    - [30, 0.0]
  - - [21248, 13568, 1, 256]
    - [11, 0.0]
  - - [2304, 1536, 1, 256]
    - [23, 0.0]
  - - [20992, 512, 1, 256]
    - [30, 0.0]
  - - [3072, 1024, 1, 256]
    - [30, 0.0]
  - - [36864, 20736, 1, 256]
    - [11, 0.0]
  - - [39936, 24064, 1, 256]
    - [35, 0.0]
  - - [2816, 512, 1, 256]
    - [30, 0.0]
  - - [37888, 512, 1, 256]
    - [30, 0.0]
  - - [39680, 1024, 1, 256]
    - [30, 0.0]
  - - [35584, 19712, 1, 256]
    - [11, 0.0]
  - - [25600, 9728, 1, 256]
    - [35, 0.0]
  - - [2816, 1024, 1, 256]
    - [23, 0.0]
  - - [13056, 1024, 1, 256]
    - [30, 0.0]
  - - [39680, 4096, 1, 256]
    - [35, 0.0]
  - - [4864, 3072, 1, 256]
    - [30, 0.0]
  - - [27648, 11776, 1, 256]
    - [35, 0.0]
  - - [13056, 4096, 1, 256]
    - [30, 0.0]
  - - [4096, 2304, 1, 256]
    - [25, 0.0]
  - - [34048, 1024, 1, 256]
    - [30, 0.0]
  - - [6400, 512, 1, 256]
    - [29, 0.0]
  - - [15872, 4096, 1, 256]
    - [35, 0.0]
  - - [29440, 1024, 1, 256]
    - [30, 0.0]
  - - [7424, 512, 1, 256]
    - [29, 0.0]
  - - [19200, 4096, 1, 256]
    - [35, 0.0]
  - - [37376, 21504, 1, 256]
    - [35, 0.0]
  - - [37888, 1024, 1, 256]
    - [35, 0.0]
  - - [40704, 24832, 1, 256]
    - [11, 0.0]
  - - [26112, 1024, 1, 256]
    - [30, 0.0]
  - - [25088, 8960, 1, 256]
    - [11, 0.0]
  - - [27136, 512, 1, 256]
    - [29, 0.0]
  - - [4608, 512, 1, 256]
    - [29, 0.0]
  - - [31232, 8192, 1, 256]
    - [35, 0.0]
  - - [33024, 512, 1, 256]
    - [30, 0.0]
  - - [27648, 512, 1, 256]
    - [30, 0.0]
  - - [28928, 4096, 1, 256]
    - [30, 0.0]
  - - [44544, 2048, 1, 256]
    - [35, 0.0]
  - - [43776, 27648, 1, 256]
    - [35, 0.0]
  - - [19456, 4096, 1, 256]
    - [35, 0.0]
  - - [33536, 17664, 1, 256]
    - [11, 0.0]
  - - [35328, 4096, 1, 256]
    - [35, 0.0]
  - - [13312, 5376, 1, 256]
    - [11, 0.0]
  - - [32768, 1024, 1, 256]
    - [35, 0.0]
  - - [39168, 4096, 1, 256]
    - [35, 0.0]
  - - [15616, 7936, 1, 256]
    - [11, 0.0]
  - - [41472, 25600, 1, 256]
    - [35, 0.0]
  - - [14592, 4096, 1, 256]
    - [35, 0.0]
  - - [37632, 21760, 1, 256]
    - [11, 0.0]
  - - [37376, 21248, 1, 256]
    - [11, 0.0]
  - - [14336, 6656, 1, 256]
    - [35, 0.0]
  - - [36608, 20480, 1, 256]
    - [35, 0.0]
  - - [32256, 16384, 1, 256]
    - [35, 0.0]
  - - [44544, 28416, 1, 256]
    - [11, 0.0]
  - - [26112, 512, 1, 256]
    - [30, 0.0]
  - - [41216, 25344, 1, 256]
    - [11, 0.0]
  - - [16640, 512, 1, 256]
    - [30, 0.0]
  - - [30464, 14336, 1, 256]
    - [30, 0.0]
  - - [13312, 4096, 1, 256]
    - [35, 0.0]
  - - [22528, 1024, 1, 256]
    - [30, 0.0]
  - - [5632, 1024, 1, 256]
    - [30, 0.0]
  - - [27392, 1024, 1, 256]
    - [30, 0.0]
  - - [27648, 8192, 1, 256]
    - [35, 0.0]
  - - [26368, 1024, 1, 256]
    - [30, 0.0]
  - - [43776, 4096, 1, 256]
    - [35, 0.0]
  - - [23552, 15872, 1, 256]
    - [35, 0.0]
  - - [26624, 10496, 1, 256]
    - [11, 0.0]
  - - [27392, 8192, 1, 256]
    - [35, 0.0]
  - - [17408, 9728, 1, 256]
    - [35, 0.0]
  - - [16896, 9216, 1, 256]
    - [30, 0.0]
  - - [26880, 11008, 1, 256]
    - [11, 0.0]
  - - [31488, 512, 1, 256]
    - [30, 0.0]
  - - [14336, 6400, 1, 256]
    - [10, 0.0]
  - - [17152, 512, 1, 256]
    - [30, 0.0]
  - - [7168, 512, 1, 256]
    - [30, 0.0]
  - - [41984, 26112, 1, 256]
    - [35, 0.0]
  - - [11776, 512, 1, 256]
    - [30, 0.0]
  - - [16128, 8448, 1, 256]
    - [11, 0.0]
  - - [11520, 1024, 1, 256]
    - [29, 0.0]
  - - [27904, 1024, 1, 256]
    - [30, 0.0]
  - - [37888, 8192, 1, 256]
    - [35, 0.0]
  - - [20480, 12544, 1, 256]
    - [11, 0.0]
  - - [23552, 15616, 1, 256]
    - [11, 0.0]
  - - [21504, 13824, 1, 256]
    - [35, 0.0]
  - - [27136, 11008, 1, 256]
    - [11, 0.0]
  - - [32000, 512, 1, 256]
    - [30, 0.0]
  - - [26624, 1024, 1, 256]
    - [30, 0.0]
  - - [34816, 8192, 1, 256]
    - [35, 0.0]
  - - [23040, 512, 1, 256]
    - [30, 0.0]
  - - [36608, 1024, 1, 256]
    - [35, 0.0]
  - - [43264, 8192, 1, 256]
    - [35, 0.0]
  - - [30208, 14336, 1, 256]
    - [35, 0.0]
  - - [43520, 512, 1, 256]
    - [30, 0.0]
  - - [32256, 4096, 1, 256]
    - [35, 0.0]
  - - [33792, 17664, 1, 256]
    - [11, 0.0]
  - - [10752, 6912, 1, 256]
    - [11, 0.0]
  - - [29696, 8192, 1, 256]
    - [35, 0.0]
  - - [41472, 512, 1, 256]
    - [30, 0.0]
  - - [44544, 8192, 1, 256]
    - [35, 0.0]
  - - [41472, 8192, 1, 256]
    - [35, 0.0]
  - - [38656, 4096, 1, 256]
    - [35, 0.0]
  - - [44800, 512, 1, 256]
    - [29, 0.0]
  - - [37376, 4096, 1, 256]
    - [35, 0.0]
  - - [19200, 1024, 1, 256]
    - [30, 0.0]
  - - [39680, 23552, 1, 256]
    - [35, 0.0]
  - - [30976, 8192, 1, 256]
    - [35, 0.0]
  - - [25856, 1024, 1, 256]
    - [30, 0.0]
  - - [22016, 14336, 1, 256]
    - [35, 0.0]
  - - [17152, 9216, 1, 256]
    - [30, 0.0]
  - - [18432, 10752, 1, 256]
    - [35, 0.0]
  - - [5376, 1024, 1, 256]
    - [30, 0.0]
  - - [21760, 13824, 1, 256]
    - [30, 0.0]
  - - [15360, 512, 1, 256]
    - [30, 0.0]
  - - [2560, 512, 1, 256]
    - [1, 0.0]
  - - [36096, 8192, 1, 256]
    - [35, 0.0]
  - - [42752, 26624, 1, 256]
    - [35, 0.0]
  - - [35584, 19456, 1, 256]
    - [35, 0.0]
  - - [6144, 2304, 1, 256]
    - [30, 0.0]
  - - [42240, 1024, 1, 256]
    - [30, 0.0]
  - - [26880, 4096, 1, 256]
    - [35, 0.0]
  - - [28160, 12032, 1, 256]
    - [11, 0.0]
  - - [18688, 10752, 1, 256]
    - [30, 0.0]
  - - [43520, 8192, 1, 256]
    - [35, 0.0]
  - - [8192, 4352, 1, 256]
    - [30, 0.0]
  - - [6912, 3072, 1, 256]
    - [30, 0.0]
  - - [31744, 15616, 1, 256]
    - [11, 0.0]
  - - [36352, 20224, 1, 256]
    - [11, 0.0]
  - - [41216, 25088, 1, 256]
    - [30, 0.0]
  - - [37632, 1024, 1, 256]
    - [35, 0.0]
  - - [18944, 512, 1, 256]
    - [30, 0.0]
  - - [15616, 1024, 1, 256]
    - [30, 0.0]
  - - [44288, 512, 1, 256]
    - [30, 0.0]
  - - [24832, 8704, 1, 256]
    - [30, 0.0]
  - - [21504, 13568, 1, 256]
    - [11, 0.0]
  - - [18176, 10496, 1, 256]
    - [11, 0.0]
  - - [21248, 1024, 1, 256]
    - [30, 0.0]
  - - [16384, 1024, 1, 256]
    - [30, 0.0]
  - - [25600, 8192, 1, 256]
    - [35, 0.0]
  - - [28672, 12544, 1, 256]
    - [11, 0.0]
  - - [16128, 1024, 1, 256]
    - [30, 0.0]
  - - [22272, 14592, 1, 256]
    - [11, 0.0]
  - - [1280, 512, 1, 256]
    - [23, 0.0]
  - - [36864, 20992, 1, 256]
    - [35, 0.0]
  - - [3584, 1792, 1, 256]
    - [23, 0.0]
  - - [35072, 19200, 1, 256]
    - [11, 0.0]
  - - [32000, 4096, 1, 256]
    - [35, 0.0]
  - - [28416, 1024, 1, 256]
    - [35, 0.0]
  - - [20480, 12800, 1, 256]
    - [35, 0.0]
  - - [21760, 4096, 1, 256]
    - [30, 0.0]
  - - [44288, 8192, 1, 256]
    - [35, 0.0]
  - - [33280, 4096, 1, 256]
    - [35, 0.0]
  - - [32512, 1024, 1, 256]
    - [30, 0.0]
  - - [38400, 22528, 1, 256]
    - [35, 0.0]
  - - [40448, 1024, 1, 256]
    - [35, 0.0]
  - - [5120, 512, 1, 256]
    - [29, 0.0]
  - - [29952, 8192, 1, 256]
    - [35, 0.0]
  - - [40448, 24576, 1, 256]
    - [35, 0.0]
  - - [29696, 4096, 1, 256]
    - [35, 0.0]
  - - [21504, 1024, 1, 256]
    - [29, 0.0]
  - - [19968, 1024, 1, 256]
    - [30, 0.0]
  - - [16896, 512, 1, 256]
    - [29, 0.0]
  - - [33536, 17408, 1, 256]
    - [35, 0.0]
  - - [19712, 512, 1, 256]
    - [30, 0.0]
  - - [16384, 8704, 1, 256]
    - [35, 0.0]
  - - [29952, 13824, 1, 256]
    - [30, 0.0]
  - - [14592, 6656, 1, 256]
    - [30, 0.0]
  - - [36864, 1024, 1, 256]
    - [35, 0.0]
  - - [31744, 15872, 1, 256]
    - [35, 0.0]
  - - [24832, 8960, 1, 256]
    - [11, 0.0]
  - - [23808, 1024, 1, 256]
    - [30, 0.0]
  - - [19200, 11264, 1, 256]
    - [30, 0.0]
  - - [23296, 15360, 1, 256]
    - [35, 0.0]
  - - [34304, 18432, 1, 256]
    - [35, 0.0]
  - - [22016, 1024, 1, 256]
    - [30, 0.0]
  - - [40704, 4096, 1, 256]
    - [35, 0.0]
  - - [25600, 4096, 1, 256]
    - [35, 0.0]
  - - [3328, 1024, 1, 256]
    - [29, 0.0]
  - - [30464, 8192, 1, 256]
    - [35, 0.0]
  - - [39424, 8192, 1, 256]
    - [35, 0.0]
  - - [23808, 15872, 1, 256]
    - [35, 0.0]
  - - [8960, 1024, 1, 256]
    - [30, 0.0]
  - - [44032, 4096, 1, 256]
    - [35, 0.0]
  - - [35584, 8192, 1, 256]
    - [35, 0.0]
  - - [29184, 8192, 1, 256]
    - [35, 0.0]
  - - [13824, 1024, 1, 256]
    - [30, 0.0]
  - - [36608, 8192, 1, 256]
    - [35, 0.0]
  - - [30976, 512, 1, 256]
    - [30, 0.0]
  - - [33024, 4096, 1, 256]
    - [35, 0.0]
  - - [11776, 7936, 1, 256]
    - [30, 0.0]
  - - [23808, 16128, 1, 256]
    - [11, 0.0]
  - - [22272, 14336, 1, 256]
    - [35, 0.0]
  - - [27392, 11520, 1, 256]
    - [11, 0.0]
  - - [30464, 4096, 1, 256]
    - [35, 0.0]
  - - [20992, 13312, 1, 256]
    - [35, 0.0]
  - - [44800, 1024, 1, 256]
    - [35, 0.0]
  - - [32512, 4096, 1, 256]
    - [35, 0.0]
  - - [23296, 15616, 1, 256]
    - [11, 0.0]
  - - [9216, 1024, 1, 256]
    - [30, 0.0]
  - - [20224, 12544, 1, 256]
    - [11, 0.0]
  - - [32256, 1024, 1, 256]
    - [30, 0.0]
  - - [38400, 512, 1, 256]
    - [30, 0.0]
  - - [29952, 1024, 1, 256]
    - [30, 0.0]
  - - [36352, 512, 1, 256]
    - [30, 0.0]
  - - [41728, 25600, 1, 256]
    - [35, 0.0]
  - - [32000, 1024, 1, 256]
    - [30, 0.0]
  - - [38144, 22016, 1, 256]
    - [35, 0.0]
  - - [27136, 11264, 1, 256]
    - [35, 0.0]
  - - [34048, 18176, 1, 256]
    - [11, 0.0]
  - - [22016, 14080, 1, 256]
    - [11, 0.0]
  - - [19712, 12032, 1, 256]
    - [11, 0.0]
  - - [23552, 4096, 1, 256]
    - [35, 0.0]
  - - [15872, 1024, 1, 256]
    - [30, 0.0]
  - - [37120, 512, 1, 256]
    - [29, 0.0]
  - - [9984, 1024, 1, 256]
    - [30, 0.0]
  - - [32512, 8192, 1, 256]
    - [35, 0.0]
  - - [15360, 4096, 1, 256]
    - [35, 0.0]
  - - [13056, 512, 1, 256]
    - [30, 0.0]
  - - [44032, 8192, 1, 256]
    - [35, 0.0]
  - - [24576, 8192, 1, 256]
    - [35, 0.0]
  - - [36352, 8192, 1, 256]
    - [35, 0.0]
  - - [26368, 8192, 1, 256]
    - [35, 0.0]
  - - [20480, 1024, 1, 256]
    - [30, 0.0]
  - - [35072, 8192, 1, 256]
    - [35, 0.0]
  - - [32000, 15872, 1, 256]
    - [35, 0.0]
  - - [40704, 24576, 1, 256]
    - [35, 0.0]
  - - [15104, 7424, 1, 256]
    - [11, 0.0]
  - - [25856, 4096, 1, 256]
    - [35, 0.0]
  - - [14848, 512, 1, 256]
    - [30, 0.0]
  - - [39424, 4096, 1, 256]
    - [35, 0.0]
  - - [24832, 512, 1, 256]
    - [30, 0.0]
  - - [44288, 28416, 1, 256]
    - [11, 0.0]
  - - [12544, 4608, 1, 256]
    - [30, 0.0]
  - - [12800, 4864, 1, 256]
    - [30, 0.0]
  - - [29440, 512, 1, 256]
    - [29, 0.0]
  - - [40192, 24064, 1, 256]
    - [35, 0.0]
  - - [18176, 4096, 1, 256]
    - [35, 0.0]
  - - [40960, 8192, 1, 256]
    - [35, 0.0]
  - - [42240, 512, 1, 256]
    - [30, 0.0]
  - - [9728, 512, 1, 256]
    - [29, 0.0]
  - - [14848, 7168, 1, 256]
    - [30, 0.0]
  - - [44800, 28672, 1, 256]
    - [35, 0.0]
  - - [15616, 7680, 1, 256]
    - [30, 0.0]
  - - [33280, 17408, 1, 256]
    - [35, 0.0]
  - - [42752, 1024, 1, 256]
    - [35, 0.0]
  - - [35328, 8192, 1, 256]
    - [35, 0.0]
  - - [36352, 1024, 1, 256]
    - [30, 0.0]
  - - [35840, 1024, 1, 256]
    - [30, 0.0]
  - - [41472, 4096, 1, 256]
    - [35, 0.0]
  - - [3584, 1024, 1, 256]
    - [29, 0.0]
  - - [22528, 14592, 1, 256]
    - [11, 0.0]
  - - [44032, 512, 1, 256]
    - [29, 0.0]
  - - [30720, 1024, 1, 256]
    - [30, 0.0]
  - - [39680, 512, 1, 256]
    - [30, 0.0]
  - - [22272, 1024, 1, 256]
    - [30, 0.0]
  - - [42240, 26368, 1, 256]
    - [11, 0.0]
  - - [10240, 6400, 1, 256]
    - [11, 0.0]
  - - [30976, 14848, 1, 256]
    - [35, 0.0]
  - - [41728, 25856, 1, 256]
    - [11, 0.0]
  - - [28928, 12800, 1, 256]
    - [30, 0.0]
  - - [21760, 14080, 1, 256]
    - [11, 0.0]
  - - [5888, 1024, 1, 256]
    - [30, 0.0]
  - - [24576, 8704, 1, 256]
    - [35, 0.0]
  - - [38912, 4096, 1, 256]
    - [35, 0.0]
  - - [15360, 1024, 1, 256]
    - [30, 0.0]
  - - [18688, 512, 1, 256]
    - [30, 0.0]
  - - [27392, 512, 1, 256]
    - [30, 0.0]
  - - [22784, 512, 1, 256]
    - [30, 0.0]
  - - [40448, 4096, 1, 256]
    - [35, 0.0]
  - - [19200, 512, 1, 256]
    - [30, 0.0]
  - - [26368, 10496, 1, 256]
    - [11, 0.0]
  - - [25088, 9216, 1, 256]
    - [35, 0.0]
  - - [33536, 1024, 1, 256]
    - [30, 0.0]
  - - [25600, 9472, 1, 256]
    - [11, 0.0]
  - - [13824, 4096, 1, 256]
    - [30, 0.0]
  - - [5632, 3840, 1, 256]
    - [30, 0.0]
  - - [9216, 5376, 1, 256]
    - [11, 0.0]
  - - [8960, 5120, 1, 256]
    - [30, 0.0]
  - - [19456, 512, 1, 256]
    - [30, 0.0]
  - - [24576, 4096, 1, 256]
    - [30, 0.0]
  - - [27392, 11264, 1, 256]
    - [35, 0.0]
  - - [35072, 4096, 1, 256]
    - [35, 0.0]
  - - [44288, 4096, 1, 256]
    - [35, 0.0]
  - - [40448, 8192, 1, 256]
    - [35, 0.0]
  - - [33280, 512, 1, 256]
    - [30, 0.0]
  - - [22272, 4096, 1, 256]
    - [35, 0.0]
  - - [35584, 512, 1, 256]
    - [30, 0.0]
  - - [10752, 512, 1, 256]
    - [30, 0.0]
  - - [19968, 4096, 1, 256]
    - [35, 0.0]
  - - [34304, 1024, 1, 256]
    - [30, 0.0]
  - - [41216, 8192, 1, 256]
    - [35, 0.0]
  - - [35840, 19712, 1, 256]
    - [11, 0.0]
  - - [43520, 27392, 1, 256]
    - [11, 0.0]
  - - [30720, 14848, 1, 256]
    - [35, 0.0]
  - - [38400, 22272, 1, 256]
    - [11, 0.0]
  - - [1536, 1024, 1, 256]
    - [23, 0.0]
  - - [40192, 1024, 1, 256]
    - [35, 0.0]
  - - [44800, 256, 1, 256]
    - [33, 0.0]
  - - [1536, 512, 1, 256]
    - [0, 0.0]
  - - [34560, 18432, 1, 256]
    - [35, 0.0]
  - - [1792, 1024, 1, 256]
    - [23, 0.0]
  - - [5376, 3584, 1, 256]
    - [30, 0.0]
  - - [30208, 1024, 1, 256]
    - [30, 0.0]
  - - [31232, 512, 1, 256]
    - [29, 0.0]
  - - [23040, 4096, 1, 256]
    - [35, 0.0]
  - - [35840, 4096, 1, 256]
    - [35, 0.0]
  - - [38144, 512, 1, 256]
    - [30, 0.0]
  - - [31744, 512, 1, 256]
    - [30, 0.0]
  - - [14592, 6912, 1, 256]
    - [11, 0.0]
  - - [19456, 11520, 1, 256]
    - [11, 0.0]
  - - [7168, 1024, 1, 256]
    - [29, 0.0]
  - - [18944, 11264, 1, 256]
    - [35, 0.0]
  - - [19712, 1024, 1, 256]
    - [30, 0.0]
  - - [26112, 9984, 1, 256]
    - [11, 0.0]
  - - [38656, 22784, 1, 256]
    - [11, 0.0]
  - - [24320, 8192, 1, 256]
    - [35, 0.0]
  - - [4864, 1024, 1, 256]
    - [29, 0.0]
  - - [20480, 4096, 1, 256]
    - [35, 0.0]
  - - [10240, 1024, 1, 256]
    - [30, 0.0]
  - - [31232, 15360, 1, 256]
    - [35, 0.0]
  - - [24320, 4096, 1, 256]
    - [33, 0.0]
  - - [33792, 1024, 1, 256]
    - [30, 0.0]
  - - [12032, 1024, 1, 256]
    - [30, 0.0]
  - - [39168, 512, 1, 256]
    - [30, 0.0]
  - - [16896, 4096, 1, 256]
    - [35, 0.0]
  - - [36096, 1024, 1, 256]
    - [35, 0.0]
  - - [28416, 12544, 1, 256]
    - [11, 0.0]
  - - [30720, 4096, 1, 256]
    - [35, 0.0]
  - - [19712, 4096, 1, 256]
    - [35, 0.0]
  - - [37120, 21248, 1, 256]
    - [11, 0.0]
  - - [16384, 4096, 1, 256]
    - [35, 0.0]
  - - [18688, 11008, 1, 256]
    - [11, 0.0]
  - - [38400, 8192, 1, 256]
    - [35, 0.0]
  - - [11264, 7424, 1, 256]
    - [11, 0.0]
  - - [23296, 512, 1, 256]
    - [30, 0.0]
  - - [25344, 512, 1, 256]
    - [30, 0.0]
  - - [44544, 256, 1, 256]
    - [30, 0.0]
  - - [43264, 4096, 1, 256]
    - [35, 0.0]
  - - [32512, 16640, 1, 256]
    - [11, 0.0]
  - - [39936, 8192, 1, 256]
    - [35, 0.0]
  - - [43264, 512, 1, 256]
    - [29, 0.0]
  - - [16640, 8704, 1, 256]
    - [30, 0.0]
  - - [26624, 8192, 1, 256]
    - [35, 0.0]
  - - [35328, 19456, 1, 256]
    - [35, 0.0]
  - - [42752, 26880, 1, 256]
    - [11, 0.0]
  - - [25344, 9216, 1, 256]
    - [35, 0.0]
  - - [34048, 8192, 1, 256]
    - [35, 0.0]
  - - [18688, 4096, 1, 256]
    - [35, 0.0]
  - - [37632, 8192, 1, 256]
    - [35, 0.0]
  - - [19968, 12032, 1, 256]
    - [11, 0.0]
  - - [8448, 4608, 1, 256]
    - [30, 0.0]
  - - [2048, 1536, 1, 256]
    - [23, 0.0]
  - - [31488, 15616, 1, 256]
    - [11, 0.0]
  - - [35328, 512, 1, 256]
    - [30, 0.0]
  - - [37376, 8192, 1, 256]
    - [35, 0.0]
  - - [33792, 8192, 1, 256]
    - [35, 0.0]
  - - [36608, 4096, 1, 256]
    - [35, 0.0]
  - - [28416, 8192, 1, 256]
    - [35, 0.0]
  - - [5632, 512, 1, 256]
    - [6, 0.0]
  - - [13568, 4096, 1, 256]
    - [30, 0.0]
  - - [17664, 9728, 1, 256]
    - [30, 0.0]
  - - [13568, 1024, 1, 256]
    - [30, 0.0]
  - - [8448, 512, 1, 256]
    - [30, 0.0]
  - - [22528, 4096, 1, 256]
    - [35, 0.0]
  - - [33536, 8192, 1, 256]
    - [35, 0.0]
  - - [23296, 1024, 1, 256]
    - [30, 0.0]
  - - [43520, 4096, 1, 256]
    - [35, 0.0]
  - - [39936, 23808, 1, 256]
    - [11, 0.0]
  - - [12544, 4096, 1, 256]
    - [30, 0.0]
  - - [22016, 4096, 1, 256]
    - [35, 0.0]
  - - [14592, 512, 1, 256]
    - [29, 0.0]
  - - [39936, 4096, 1, 256]
    - [35, 0.0]
  - - [18176, 1024, 1, 256]
    - [30, 0.0]
  - - [44800, 2048, 1, 256]
    - [33, 0.0]
  - - [14848, 4096, 1, 256]
    - [35, 0.0]
  - - [20224, 12288, 1, 256]
    - [35, 0.0]
  - - [16896, 8960, 1, 256]
    - [11, 0.0]
  - - [43264, 27392, 1, 256]
    - [11, 0.0]
  - - [24064, 16128, 1, 256]
    - [11, 0.0]
  - - [1024, 512, 1, 256]
    - [36, 0.0]
  - - [24576, 8448, 1, 256]
    - [11, 0.0]
  - - [25344, 9472, 1, 256]
    - [11, 0.0]
  - - [3328, 1536, 1, 256]
    - [30, 0.0]
  - - [31488, 4096, 1, 256]
    - [35, 0.0]
  - - [43008, 8192, 1, 256]
    - [35, 0.0]
  - - [28672, 12800, 1, 256]
    - [35, 0.0]
  - - [20736, 13056, 1, 256]
    - [11, 0.0]
  - - [17664, 9984, 1, 256]
    - [11, 0.0]
  - - [17920, 1024, 1, 256]
    - [30, 0.0]
  - - [11008, 1024, 1, 256]
    - [29, 0.0]
  - - [44800, 4096, 1, 256]
    - [35, 0.0]
  - - [29952, 14080, 1, 256]
    - [11, 0.0]
  - - [39168, 23296, 1, 256]
    - [11, 0.0]
  - - [9472, 512, 1, 256]
    - [30, 0.0]
  - - [27904, 8192, 1, 256]
    - [35, 0.0]
  - - [5120, 1024, 1, 256]
    - [30, 0.0]
  - - [15872, 7936, 1, 256]
    - [30, 0.0]
  - - [13568, 5632, 1, 256]
    - [30, 0.0]
  - - [17920, 9984, 1, 256]
    - [11, 0.0]
  - - [16640, 8960, 1, 256]
    - [11, 0.0]
  - - [41984, 4096, 1, 256]
    - [35, 0.0]
  - - [6912, 512, 1, 256]
    - [30, 0.0]
  - - [28416, 4096, 1, 256]
    - [35, 0.0]
  - - [27648, 11520, 1, 256]
    - [11, 0.0]
  - - [7680, 3840, 1, 256]
    - [30, 0.0]
  - - [34048, 4096, 1, 256]
    - [35, 0.0]
  - - [11264, 512, 1, 256]
    - [29, 0.0]
  - - [26368, 4096, 1, 256]
    - [35, 0.0]
  - - [21248, 13312, 1, 256]
    - [35, 0.0]
  - - [15104, 1024, 1, 256]
    - [30, 0.0]
  - - [35072, 18944, 1, 256]
    - [35, 0.0]
  - - [6144, 1024, 1, 256]
    - [30, 0.0]
  - - [44800, 8192, 1, 256]
    - [35, 0.0]
  - - [25088, 512, 1, 256]
    - [30, 0.0]
  - - [27904, 12032, 1, 256]
    - [11, 0.0]
  - - [27648, 1024, 1, 256]
    - [30, 0.0]
  - - [28928, 8192, 1, 256]
    - [35, 0.0]
  - - [29440, 13312, 1, 256]
    - [35, 0.0]
  - - [43264, 27136, 1, 256]
    - [35, 0.0]
  - - [23552, 512, 1, 256]
    - [30, 0.0]
  - - [26880, 10752, 1, 256]
    - [30, 0.0]
  - - [44032, 28160, 1, 256]
    - [35, 0.0]
  - - [36096, 512, 1, 256]
    - [30, 0.0]
  - - [4352, 2560, 1, 256]
    - [30, 0.0]
  - - [38912, 8192, 1, 256]
    - [35, 0.0]
  - - [12032, 4096, 1, 256]
    - [30, 0.0]
  - - [37632, 512, 1, 256]
    - [30, 0.0]
  - - [30208, 512, 1, 256]
    - [30, 0.0]
  - - [2304, 512, 1, 256]
    - [24, 0.0]
  - - [24320, 8448, 1, 256]
    - [11, 0.0]
  - - [39424, 512, 1, 256]
    - [30, 0.0]
  - - [37632, 21504, 1, 256]
    - [35, 0.0]
  - - [17152, 1024, 1, 256]
    - [30, 0.0]
  - - [22784, 15104, 1, 256]
    - [11, 0.0]
  - - [27904, 11776, 1, 256]
    - [30, 0.0]
  - - [43008, 26880, 1, 256]
    - [11, 0.0]
  - - [41728, 4096, 1, 256]
    - [35, 0.0]
  - - [25344, 8192, 1, 256]
    - [35, 0.0]
  - - [44800, 28928, 1, 256]
    - [11, 0.0]
  - - [38912, 22784, 1, 256]
    - [11, 0.0]
  - - [44032, 1024, 1, 256]
    - [35, 0.0]
  - - [30976, 4096, 1, 256]
    - [35, 0.0]
  - - [15872, 8192, 1, 256]
    - [30, 0.0]
  - - [40960, 4096, 1, 256]
    - [35, 0.0]
  - - [35584, 1024, 1, 256]
    - [35, 0.0]
  - - [18944, 4096, 1, 256]
    - [30, 0.0]
  - - [36096, 20224, 1, 256]
    - [11, 0.0]
  - - [11008, 7168, 1, 256]
    - [30, 0.0]
  - - [7936, 1024, 1, 256]
    - [30, 0.0]
  - - [44288, 1024, 1, 256]
    - [30, 0.0]
  - - [38656, 8192, 1, 256]
    - [35, 0.0]
  - - [38144, 1024, 1, 256]
    - [30, 0.0]
  - - [41984, 1024, 1, 256]
    - [35, 0.0]
  - - [20736, 512, 1, 256]
    - [29, 0.0]
  - - [32768, 16640, 1, 256]
    - [11, 0.0]
  - - [40960, 1024, 1, 256]
    - [35, 0.0]
  - - [25856, 9984, 1, 256]
    - [11, 0.0]
  - - [29696, 13824, 1, 256]
    - [35, 0.0]
  - - [37120, 4096, 1, 256]
    - [35, 0.0]
  - - [37120, 20992, 1, 256]
    - [35, 0.0]
  - - [35072, 512, 1, 256]
    - [30, 0.0]
  - - [38656, 1024, 1, 256]
    - [30, 0.0]
  - - [37376, 512, 1, 256]
    - [30, 0.0]
  - - [32000, 16128, 1, 256]
    - [11, 0.0]
  - - [41984, 25856, 1, 256]
    - [11, 0.0]
  - - [23040, 15104, 1, 256]
    - [11, 0.0]
  - - [31232, 15104, 1, 256]
    - [11, 0.0]
  - - [25088, 4096, 1, 256]
    - [30, 0.0]
  - - [15360, 7424, 1, 256]
    - [11, 0.0]
  - - [16384, 8448, 1, 256]
    - [11, 0.0]
  - - [26624, 4096, 1, 256]
    - [35, 0.0]
  - - [14080, 6400, 1, 256]
    - [30, 0.0]
  - - [16128, 4096, 1, 256]
    - [35, 0.0]
  - - [43776, 27904, 1, 256]
    - [11, 0.0]
  - - [15872, 512, 1, 256]
    - [30, 0.0]
  - - [43776, 8192, 1, 256]
    - [35, 0.0]
  - - [10496, 6656, 1, 256]
    - [30, 0.0]
  - - [13312, 512, 1, 256]
    - [29, 0.0]
  - - [29184, 512, 1, 256]
    - [30, 0.0]
  - - [15360, 7680, 1, 256]
    - [35, 0.0]
  - - [40192, 8192, 1, 256]
    - [35, 0.0]
  - - [34560, 8192, 1, 256]
    - [35, 0.0]
  - - [25856, 8192, 1, 256]
    - [35, 0.0]
  - - [32512, 16384, 1, 256]
    - [35, 0.0]
  - - [12288, 4352, 1, 256]
    - [11, 0.0]
  - - [29440, 13568, 1, 256]
    - [11, 0.0]
  - - [28160, 1024, 1, 256]
    - [30, 0.0]
  - - [32768, 4096, 1, 256]
    - [35, 0.0]
  - - [24832, 4096, 1, 256]
    - [35, 0.0]
  - - [39680, 23808, 1, 256]
    - [11, 0.0]
  - - [22784, 4096, 1, 256]
    - [35, 0.0]
  - - [7936, 4096, 1, 256]
    - [30, 0.0]
  - - [8704, 4864, 1, 256]
    - [30, 0.0]
  - - [29696, 512, 1, 256]
    - [30, 0.0]
  - - [39424, 23296, 1, 256]
    - [11, 0.0]
  - - [17408, 9472, 1, 256]
    - [11, 0.0]
  - - [33792, 4096, 1, 256]
    - [35, 0.0]
  - - [17920, 512, 1, 256]
    - [30, 0.0]
  - - [25856, 512, 1, 256]
    - [30, 0.0]
  - - [44288, 28160, 1, 256]
    - [35, 0.0]
  - - [40192, 4096, 1, 256]
    - [35, 0.0]
  - - [21248, 512, 1, 256]
    - [30, 0.0]
  - - [3072, 512, 1, 256]
    - [30, 0.0]
  - - [29184, 13312, 1, 256]
    - [35, 0.0]
  - - [44544, 1024, 1, 256]
    - [35, 0.0]
  - - [37888, 21760, 1, 256]
    - [10, 0.0]
  - - [33792, 17920, 1, 256]
    - [35, 0.0]
  - - [6912, 1024, 1, 256]
    - [29, 0.0]
  - - [41216, 512, 1, 256]
    - [30, 0.0]
  - - [42240, 26112, 1, 256]
    - [35, 0.0]
  - - [30720, 8192, 1, 256]
    - [35, 0.0]
  - - [11776, 1024, 1, 256]
    - [30, 0.0]
  - - [43008, 4096, 1, 256]
    - [35, 0.0]
  - - [34560, 18688, 1, 256]
    - [11, 0.0]
  - - [41984, 512, 1, 256]
    - [30, 0.0]
  - - [41728, 512, 1, 256]
    - [30, 0.0]
  - - [2560, 1792, 1, 256]
    - [25, 0.0]
  - - [36864, 8192, 1, 256]
    - [35, 0.0]
  - - [40704, 8192, 1, 256]
    - [35, 0.0]
  - - [30720, 14592, 1, 256]
    - [10, 0.0]
  - - [32256, 512, 1, 256]
    - [30, 0.0]
  - - [40192, 512, 1, 256]
    - [30, 0.0]
  - - [8960, 512, 1, 256]
    - [29, 0.0]
  - - [16640, 4096, 1, 256]
    - [30, 0.0]
  - - [30976, 15104, 1, 256]
    - [11, 0.0]
  - - [27136, 8192, 1, 256]
    - [35, 0.0]
  - - [30208, 8192, 1, 256]
    - [35, 0.0]
  - - [21504, 512, 1, 256]
    - [30, 0.0]
  - - [9728, 5888, 1, 256]
    - [30, 0.0]
  - - [38912, 23040, 1, 256]
    - [35, 0.0]
  - - [7424, 1024, 1, 256]
    - [30, 0.0]
  - - [38656, 22528, 1, 256]
    - [35, 0.0]
  - - [26880, 512, 1, 256]
    - [30, 0.0]
  - - [29184, 13056, 1, 256]
    - [11, 0.0]
  - - [44032, 27904, 1, 256]
    - [11, 0.0]
  - - [38144, 8192, 1, 256]
    - [35, 0.0]
  - - [29952, 512, 1, 256]
    - [30, 0.0]
  - - [18432, 4096, 1, 256]
    - [35, 0.0]
  - - [28160, 12288, 1, 256]
    - [35, 0.0]
  - - [29696, 1024, 1, 256]
    - [30, 0.0]
  - - [39936, 1024, 1, 256]
    - [35, 0.0]
  - - [25600, 512, 1, 256]
    - [29, 0.0]
  - - [40448, 24320, 1, 256]
    - [11, 0.0]
  - - [40448, 512, 1, 256]
    - [29, 0.0]
  - - [7424, 3584, 1, 256]
    - [30, 0.0]
  - - [5376, 512, 1, 256]
    - [29, 0.0]
  - - [27136, 4096, 1, 256]
    - [35, 0.0]
  - - [35840, 19968, 1, 256]
    - [35, 0.0]
  - - [18944, 11008, 1, 256]
    - [11, 0.0]
  - - [34816, 18688, 1, 256]
    - [11, 0.0]
  - - [38400, 1024, 1, 256]
    - [35, 0.0]
  - - [36352, 20480, 1, 256]
    - [35, 0.0]
  - - [36608, 20736, 1, 256]
    - [11, 0.0]
  - - [28672, 1024, 1, 256]
    - [30, 0.0]
  - - [42496, 26624, 1, 256]
    - [35, 0.0]
  - - [31488, 15360, 1, 256]
    - [30, 0.0]
  - - [20992, 4096, 1, 256]
    - [35, 0.0]
  - - [12544, 512, 1, 256]
    - [30, 0.0]
  - - [24064, 8192, 1, 256]
    - [35, 0.0]
  - - [26880, 8192, 1, 256]
    - [35, 0.0]
  - - [4352, 512, 1, 256]
    - [30, 0.0]
  - - [7680, 1024, 1, 256]
    - [30, 0.0]
  - - [16128, 8192, 1, 256]
    - [30, 0.0]
  - - [39168, 8192, 1, 256]
    - [35, 0.0]
  - - [29440, 4096, 1, 256]
    - [35, 0.0]
  - - [33536, 4096, 1, 256]
    - [35, 0.0]
  - - [33024, 17152, 1, 256]
    - [11, 0.0]
  - - [34816, 18944, 1, 256]
    - [35, 0.0]
  - - [22016, 512, 1, 256]
    - [30, 0.0]
  - - [14848, 6912, 1, 256]
    - [11, 0.0]
  - - [20736, 12800, 1, 256]
    - [30, 0.0]
  - - [32256, 16128, 1, 256]
    - [11, 0.0]
  - - [7680, 512, 1, 256]
    - [29, 0.0]
  - - [19968, 12288, 1, 256]
    - [35, 0.0]
  - - [29184, 4096, 1, 256]
    - [35, 0.0]
  - - [15616, 4096, 1, 256]
    - [30, 0.0]
  - - [44544, 28672, 1, 256]
    - [35, 0.0]
  - - [26112, 4096, 1, 256]
    - [35, 0.0]
  - - [26624, 10752, 1, 256]
    - [35, 0.0]
  - - [15104, 4096, 1, 256]
    - [30, 0.0]
  - - [23296, 4096, 1, 256]
    - [35, 0.0]
  - - [37888, 22016, 1, 256]
    - [35, 0.0]
  - - [11520, 7680, 1, 256]
    - [30, 0.0]
  - - [41728, 1024, 1, 256]
    - [35, 0.0]
  - - [2304, 1792, 1, 256]
    - [23, 0.0]
  - - [34048, 17920, 1, 256]
    - [35, 0.0]
  - - [1536, 768, 1, 256]
    - [22, 0.0]
  - - [33280, 8192, 1, 256]
    - [35, 0.0]
  - - [11264, 1024, 1, 256]
    - [30, 0.0]
  - - [21760, 1024, 1, 256]
    - [30, 0.0]
  - - [18432, 10496, 1, 256]
    - [11, 0.0]
  - - [41216, 4096, 1, 256]
    - [35, 0.0]
  - - [41472, 25344, 1, 256]
    - [11, 0.0]
  - - [17408, 1024, 1, 256]
    - [30, 0.0]
  - - [19456, 1024, 1, 256]
    - [30, 0.0]
  - - [36096, 19968, 1, 256]
    - [35, 0.0]
  - - [8704, 512, 1, 256]
    - [29, 0.0]
  - - [30464, 1024, 1, 256]
    - [30, 0.0]
  - - [8192, 1024, 1, 256]
    - [30, 0.0]
  - - [11520, 512, 1, 256]
    - [30, 0.0]
  - - [44544, 512, 1, 256]
    - [29, 0.0]
  - - [20736, 4096, 1, 256]
    - [30, 0.0]
  - - [42752, 8192, 1, 256]
    - [35, 0.0]
  - - [39936, 512, 1, 256]
    - [30, 0.0]
  - - [42496, 26368, 1, 256]
    - [11, 0.0]
  - - [28672, 4096, 1, 256]
    - [35, 0.0]
  - - [35840, 8192, 1, 256]
    - [35, 0.0]
  - - [17664, 1024, 1, 256]
    - [30, 0.0]
  - - [21248, 4096, 1, 256]
    - [35, 0.0]
  - - [1280, 768, 1, 256]
    - [24, 0.0]
  - - [28160, 512, 1, 256]
    - [30, 0.0]
  - - [34304, 18176, 1, 256]
    - [11, 0.0]
  - - [19200, 11520, 1, 256]
    - [11, 0.0]
  - - [25856, 9728, 1, 256]
    - [30, 0.0]
  - - [35328, 19200, 1, 256]
    - [11, 0.0]
  - - [29440, 8192, 1, 256]
    - [35, 0.0]
  - - [20992, 13056, 1, 256]
    - [11, 0.0]
  - - [21760, 512, 1, 256]
    - [30, 0.0]
  - - [12800, 512, 1, 256]
    - [29, 0.0]
  - - [28416, 12288, 1, 256]
    - [30, 0.0]
  - - [29696, 13568, 1, 256]
    - [11, 0.0]
  - - [21504, 4096, 1, 256]
    - [35, 0.0]
  - - [30464, 14592, 1, 256]
    - [11, 0.0]
  - - [13056, 5120, 1, 256]
    - [30, 0.0]
  - - [34560, 4096, 1, 256]
    - [35, 0.0]
  - - [32768, 16896, 1, 256]
    - [35, 0.0]
  - - [13824, 5888, 1, 256]
    - [11, 0.0]
  - - [33024, 8192, 1, 256]
    - [35, 0.0]
  - - [14080, 4096, 1, 256]
    - [30, 0.0]
  - - [43008, 1024, 1, 256]
    - [35, 0.0]
  - - [31744, 1024, 1, 256]
    - [30, 0.0]
  - - [11008, 512, 1, 256]
    - [30, 0.0]
  - - [24832, 8192, 1, 256]
    - [35, 0.0]
  - - [43776, 512, 1, 256]
    - [30, 0.0]
  - - [24064, 1024, 1, 256]
    - [29, 0.0]
  - - [12800, 4096, 1, 256]
    - [30, 0.0]
  - - [19456, 11776, 1, 256]
    - [35, 0.0]
  - - [22528, 14848, 1, 256]
    - [35, 0.0]
  - - [30208, 14080, 1, 256]
    - [11, 0.0]
  - - [40704, 1024, 1, 256]
    - [35, 0.0]
  - - [35584, 4096, 1, 256]
    - [35, 0.0]
  - - [26112, 8192, 1, 256]
    - [35, 0.0]
  - - [9472, 5632, 1, 256]
    - [30, 0.0]
  - - [15616, 512, 1, 256]
    - [30, 0.0]
  - - [34816, 4096, 1, 256]
    - [35, 0.0]
  - - [31232, 4096, 1, 256]
    - [35, 0.0]
  - - [9728, 1024, 1, 256]
    - [29, 0.0]
  - - [13312, 1024, 1, 256]
    - [30, 0.0]
  - - [20224, 1024, 1, 256]
    - [30, 0.0]
  - - [4864, 512, 1, 256]
    - [30, 0.0]
  - - [34304, 4096, 1, 256]
    - [35, 0.0]
  - - [43776, 1024, 1, 256]
    - [35, 0.0]
  - - [37120, 8192, 1, 256]
    - [35, 0.0]
  - - [33792, 512, 1, 256]
    - [30, 0.0]
  - - [42496, 512, 1, 256]
    - [30, 0.0]
  - - [9216, 512, 1, 256]
    - [29, 0.0]
  - - [14336, 4096, 1, 256]
    - [30, 0.0]
  - - [43008, 27136, 1, 256]
    - [35, 0.0]
  - - [35840, 512, 1, 256]
    - [30, 0.0]
  - - [40960, 25088, 1, 256]
    - [35, 0.0]
  - - [17408, 512, 1, 256]
    - [30, 0.0]
  - - [12288, 4096, 1, 256]
    - [30, 0.0]
  - - [6656, 512, 1, 256]
    - [30, 0.0]
  - - [40960, 24832, 1, 256]
    - [11, 0.0]
  - - [39168, 23040, 1, 256]
    - [35, 0.0]
  - - [512, 1, 1, 128]
    - [187, 0.021]
  - - [384, 1, 1, 384]
    - [214, 0.026]
  - - [256, 1, 1, 256]
    - [146, 0.009]
  - - [128, 1, 1, 128]
    - [216, 0.003]
  - - [640, 1, 1, 128]
    - [149, 0.013]
  - - [1, 128, 1, 256]
    - [187, 0.004]
  - - [512, 128, 1, 256]
    - [53, 0.0]
