library/src/blas3/Tensile/Logic/asm_full/arcturus_Cijk_Alik_Bljk_BH.yaml
- {MinimumRequiredVersion: 4.12.0}
- arcturus
- gfx908
- [Device 7380, Device 7388, Device 738c]
    SolutionIndex: 0
    SolutionNameMin: Cijk_Alik_Bljk_BH_MT128x32x16_SE_
    SolutionIndex: 1
    SolutionNameMin: Cijk_Alik_Bljk_BH_MT128x64x16_SE_
    SolutionIndex: 2
    SolutionNameMin: Cijk_Alik_Bljk_BH_MT32x128x16_SE_
    SolutionIndex: 3
    SolutionNameMin: Cijk_Alik_Bljk_BH_MT64x128x16_SE_
    SolutionIndex: 4
    SolutionNameMin: Cijk_Alik_Bljk_BH_MT256x128x16_SE_
    SolutionIndex: 5
    SolutionNameMin: Cijk_Alik_Bljk_BH_MT64x128x32_SE_
    SolutionIndex: 6
    SolutionNameMin: Cijk_Alik_Bljk_BH_MT64x16x16_SE_
    SolutionIndex: 7
    SolutionNameMin: Cijk_Alik_Bljk_BH_MT16x64x16_SE_
    SolutionIndex: 8
    SolutionNameMin: Cijk_Alik_Bljk_BH_MT32x32x32_SE_
- - - [959, 1024, 1, 1024]
    - [3, 1069.96]
  - - [960, 1023, 1, 1024]
    - [3, 1077.18]
  - - [960, 1024, 1, 1023]
    - [3, 1072.31]
  - - [960, 1024, 1, 1025]
    - [3, 1085.42]
  - - [960, 1025, 1, 1024]
    - [2, 822.091]
  - - [961, 1024, 1, 1024]
    - [2, 816.019]
  - - [1023, 1024, 1, 1024]
    - [0, 870.244]
  - - [1024, 1023, 1, 1024]
    - [0, 872.396]
  - - [1024, 1024, 1, 1023]
    - [2, 871.035]
  - - [1024, 1024, 1, 1025]
    - [0, 869.969]
  - - [1024, 1025, 1, 1024]
    - [0, 872.002]
  - - [1025, 1024, 1, 1024]
    - [0, 870.588]
  - - [2039, 2048, 1, 2048]
    - [1, 1385.94]
  - - [2040, 2047, 1, 2048]
    - [1, 1386.89]
  - - [2040, 2048, 1, 2047]
    - [1, 1374.9]
  - - [2040, 2048, 1, 2049]
    - [1, 1392.64]
  - - [2040, 2049, 1, 2048]
    - [1, 1389.45]
  - - [2041, 2048, 1, 2048]
    - [1, 1386.7]
  - - [2047, 2048, 1, 2048]
    - [1, 1389.61]
  - - [2048, 2047, 1, 2048]
    - [1, 1392.28]
  - - [2048, 2048, 1, 2047]
    - [1, 1382.82]
  - - [2048, 2048, 1, 2049]
    - [1, 1396.64]
  - - [2048, 2049, 1, 2048]
    - [1, 1393.76]
  - - [2049, 2048, 1, 2048]
    - [1, 1390.61]
  - - [2999, 3072, 1, 3072]
    - [1, 1618.27]
  - - [3000, 3071, 1, 3072]
    - [1, 1619.77]
  - - [3000, 3072, 1, 3071]
    - [1, 1606.4]
  - - [3000, 3072, 1, 3073]
    - [1, 1613.78]
  - - [3000, 3073, 1, 3072]
    - [1, 1618.01]
  - - [3001, 3072, 1, 3072]
    - [1, 1619.37]
  - - [3071, 3072, 1, 3072]
    - [1, 1655.81]
  - - [3072, 3071, 1, 3072]
    - [1, 1655.8]
  - - [3072, 3072, 1, 3071]
    - [1, 1641.6]
  - - [3072, 3072, 1, 3073]
    - [1, 1651.49]
  - - [3072, 3073, 1, 3072]
    - [1, 1655.85]
  - - [3073, 3072, 1, 3072]
    - [1, 1656.62]
  - - [4079, 4096, 1, 4096]
    - [1, 1605.54]
  - - [4080, 4095, 1, 4096]
    - [1, 1605.01]
  - - [4080, 4096, 1, 4095]
    - [4, 1614.56]
  - - [4080, 4096, 1, 4097]
    - [1, 1624.91]
  - - [4080, 4097, 1, 4096]
    - [1, 1605.97]
  - - [4081, 4096, 1, 4096]
    - [1, 1603.2]
  - - [4095, 4096, 1, 4096]
    - [1, 1607.15]
  - - [4096, 4095, 1, 4096]
    - [1, 1606.4]
  - - [4096, 4096, 1, 4095]
    - [4, 1618.29]
  - - [4096, 4096, 1, 4097]
    - [1, 1626.69]
  - - [4096, 4097, 1, 4096]
    - [1, 1607.94]
  - - [4097, 4096, 1, 4096]
    - [1, 1606.33]
  - - [960, 1024, 1, 1024]
    - [5, 9231.82]
  - - [1024, 1024, 1, 1024]
    - [5, 7523.44]
  - - [2040, 2048, 1, 2048]
    - [5, 11226.5]
  - - [2048, 2048, 1, 2048]
    - [5, 14214.3]
  - - [3000, 3072, 1, 3072]
    - [5, 12725.0]
  - - [3072, 3072, 1, 3072]
    - [5, 12566.4]
  - - [4080, 4096, 1, 4096]
    - [5, 16766.1]
  - - [4096, 4096, 1, 4096]
    - [5, 16883.5]
  - - [63, 1024, 1, 1024]
    - [6, 112.839]
  - - [64, 1023, 1, 1024]
    - [6, 114.974]
  - - [64, 1024, 1, 1023]
    - [6, 116.736]
  - - [64, 1024, 1, 1025]
    - [6, 116.251]
  - - [64, 1025, 1, 1024]
    - [6, 114.274]
  - - [65, 1024, 1, 1024]
    - [7, 107.545]
  - - [64, 1024, 1, 1024]
    - [8, 1823.61]
- null
