library/src/blas3/Tensile/Logic/asm_full/arcturus_Cijk_Ailk_Bjlk_BBH.yaml
- {MinimumRequiredVersion: 4.14.0}
- arcturus
- gfx908
- [Device 7380, Device 7388, Device 738c, Device 7390]
    SolutionIndex: 0
    SolutionNameMin: Cijk_Ailk_Bjlk_BBH_MT64x128x16_MI32x32x2x2_SE_ONLL1_SNLL1
    SolutionIndex: 1
    SolutionNameMin: Cijk_Ailk_Bjlk_BBH_MT64x256x16_MI32x32x2x2_SE_ONLL0_SNLL0
    SolutionIndex: 2
    SolutionIndex: 3
    SolutionIndex: 4
    SolutionIndex: 5
    SolutionIndex: 6
    SolutionIndex: 7
    SolutionIndex: 8
    SolutionIndex: 9
    SolutionIndex: 10
    SolutionIndex: 11
    SolutionIndex: 12
    SolutionIndex: 13
    SolutionIndex: 14
    SolutionIndex: 15
    SolutionIndex: 16
    SolutionIndex: 17
    SolutionIndex: 18
    SolutionIndex: 19
    SolutionIndex: 20
    SolutionIndex: 21
    SolutionIndex: 22
    SolutionIndex: 23
    SolutionIndex: 24
    SolutionIndex: 25
    SolutionIndex: 26
    SolutionIndex: 27
    SolutionIndex: 28
    SolutionIndex: 29
    SolutionIndex: 30
    SolutionIndex: 31
    SolutionIndex: 32
    SolutionIndex: 33
    SolutionIndex: 34
    SolutionIndex: 35
    SolutionIndex: 36
    SolutionIndex: 37
    SolutionIndex: 38
    SolutionIndex: 39
    SolutionIndex: 40
    SolutionIndex: 41
    SolutionIndex: 42
    SolutionIndex: 43
    SolutionIndex: 44
    SolutionIndex: 45
    SolutionIndex: 46
    SolutionIndex: 47
    SolutionIndex: 48
    SolutionIndex: 49
    SolutionIndex: 50
    SolutionIndex: 51
    SolutionIndex: 52
    SolutionIndex: 53
    SolutionIndex: 54
    SolutionIndex: 55
    SolutionIndex: 56
    SolutionIndex: 57
    SolutionIndex: 58
    SolutionIndex: 59
    SolutionIndex: 60
    SolutionIndex: 61
    SolutionIndex: 62
    SolutionIndex: 63
    SolutionIndex: 64
    SolutionIndex: 65
    SolutionIndex: 66
    SolutionIndex: 67
    SolutionIndex: 68
    SolutionIndex: 69
    SolutionIndex: 70
    SolutionIndex: 71
    SolutionIndex: 72
    SolutionIndex: 73
    SolutionIndex: 74
    SolutionIndex: 75
    SolutionIndex: 76
    SolutionIndex: 77
    SolutionIndex: 78
    SolutionIndex: 79
    SolutionIndex: 80
    SolutionIndex: 81
    SolutionIndex: 82
    SolutionIndex: 83
    SolutionIndex: 84
    SolutionIndex: 85
    SolutionIndex: 86
    SolutionIndex: 87
    SolutionIndex: 88
    SolutionIndex: 89
    SolutionIndex: 90
    SolutionIndex: 91
    SolutionIndex: 92
    SolutionIndex: 93
    SolutionIndex: 94
    SolutionIndex: 95
    SolutionIndex: 96
    SolutionIndex: 97
    SolutionIndex: 98
    SolutionIndex: 99
    SolutionIndex: 100
    SolutionIndex: 101
    SolutionIndex: 102
    SolutionIndex: 103
    SolutionNameMin: Cijk_Ailk_Bjlk_BBH_MT64x128x16_MI32x32x2x2_SE_AF0EM4_GRVW2_NLCA1_NLCB1_SU0_SUS256_SRVW4_TT1_32_WG64_4_1_WGM15
    SolutionIndex: 104
    SolutionNameMin: Cijk_Ailk_Bjlk_BBH_MT128x96x32_MI32x32x4x1_SE_AF0EM4_GRVW4_NLCA1_NLCB3_SU16_SUS128_SRVW4_TT1_96_WG128_2_1_WGM15
    SolutionIndex: 105
    SolutionNameMin: Cijk_Ailk_Bjlk_BBH_MT64x32x16_MI16x16x8x1_SE_AF0EM4_GRVW2_NLCA1_NLCB1_SU0_SUS256_SRVW4_TT2_16_WG32_8_1_WGM15
    SolutionIndex: 106
    SolutionNameMin: Cijk_Ailk_Bjlk_BBH_MT128x80x64_MI16x16x8x1_SE_AF0EM4_GRVW2_NLCA1_NLCB5_SU32_SUS128_SRVW0_TT2_80_WG64_4_1_WGM2
    SolutionIndex: 107
    SolutionNameMin: Cijk_Ailk_Bjlk_BBH_MT128x96x32_MI32x32x4x1_SE_AF0EM4_GRVW4_NLCA1_NLCB3_SU32_SUS128_SRVW4_TT1_96_WG128_2_1_WGM15
    SolutionIndex: 108
    SolutionNameMin: Cijk_Ailk_Bjlk_BBH_MT64x64x128_MI32x32x4x1_SE_AF0EM4_GRVW8_NLCA1_NLCB1_SU16_SUS256_SRVW4_TT1_32_WG64_4_1_WGM2
    SolutionIndex: 109
    SolutionNameMin: Cijk_Ailk_Bjlk_BBH_MT64x64x128_MI32x32x4x1_SE_AF0EM4_GRVW8_NLCA1_NLCB1_SU32_SUS256_SRVW4_TT1_32_WG64_4_1_WGM15
    SolutionIndex: 110
    SolutionNameMin: Cijk_Ailk_Bjlk_BBH_MT32x32x16_MI16x16x8x1_SE_AF0EM4_GRVW4_NLCA1_NLCB1_SU0_SUS256_SRVW0_TT1_16_WG32_8_1_WGM2
    SolutionIndex: 111
    SolutionNameMin: Cijk_Ailk_Bjlk_BBH_MT64x64x32_MI32x32x4x1_SE_AF0EM4_GRVW8_NLCA1_NLCB1_SU0_SUS256_SRVW4_TT1_32_WG64_4_1_WGM1
    SolutionIndex: 112
    SolutionNameMin: Cijk_Ailk_Bjlk_BBH_MT32x32x64_MI16x16x8x1_SE_AF0EM1_GRVW8_NLCA1_NLCB1_SU0_SUS256_SRVW0_TT1_16_WG32_8_1_WGM2
    SolutionIndex: 113
    SolutionNameMin: Cijk_Ailk_Bjlk_BBH_MT32x32x16_MI16x16x8x1_SE_AF0EM4_GRVW2_NLCA1_NLCB1_SU0_SUS256_SRVW0_TT1_16_WG32_8_1_WGM1
    SolutionIndex: 114
    SolutionNameMin: Cijk_Ailk_Bjlk_BBH_MT64x32x16_MI16x16x8x1_SE_AF0EM4_GRVW2_NLCA1_NLCB1_SU32_SUS256_SRVW0_TT2_16_WG32_8_1_WGM2
    SolutionIndex: 115
    SolutionNameMin: Cijk_Ailk_Bjlk_BBH_MT128x80x64_MI16x16x8x1_SE_AF0EM4_GRVW2_NLCA1_NLCB5_SU32_SUS256_SRVW0_TT2_80_WG64_4_1_WGM2
    SolutionIndex: 116
    SolutionNameMin: Cijk_Ailk_Bjlk_BBH_MT128x80x64_MI16x16x8x1_SE_AF0EM4_GRVW2_NLCA1_NLCB5_SU0_SUS256_SRVW0_TT2_80_WG64_4_1_WGM15
    SolutionIndex: 117
    SolutionNameMin: Cijk_Ailk_Bjlk_BBH_MT32x32x64_MI16x16x8x1_SE_AF0EM4_GRVW8_NLCA1_NLCB1_SU16_SUS128_SRVW0_TT1_16_WG32_8_1_WGM1
    SolutionIndex: 118
    SolutionNameMin: Cijk_Ailk_Bjlk_BBH_MT128x128x32_MI32x32x4x1_SE_AF0EM4_GRVW4_NLCA1_NLCB1_SU0_SUS256_SRVW4_TT2_64_WG64_4_1_WGM15
    SolutionIndex: 119
    SolutionNameMin: Cijk_Ailk_Bjlk_BBH_MT64x64x32_MI32x32x4x1_SE_AF0EM1_GRVW8_NLCA1_NLCB1_SU16_SUS256_SRVW4_TT1_32_WG64_4_1_WGM1
    SolutionIndex: 120
    SolutionNameMin: Cijk_Ailk_Bjlk_BBH_MT64x128x32_MI32x32x4x1_SE_AF0EM1_GRVW8_NLCA1_NLCB1_SU32_SUS128_SRVW4_TT1_64_WG64_4_1_WGM1
    SolutionIndex: 121
    SolutionNameMin: Cijk_Ailk_Bjlk_BBH_MT64x64x32_MI32x32x4x1_SE_AF0EM1_GRVW4_NLCA1_NLCB1_SU0_SUS256_SRVW4_TT1_32_WG64_4_1_WGM2
    SolutionIndex: 122
    SolutionNameMin: Cijk_Ailk_Bjlk_BBH_MT32x64x16_MI16x16x8x1_SE_AF0EM1_GRVW4_NLCA1_NLCB1_SU16_SUS256_SRVW0_TT1_32_WG32_8_1_WGM1
    SolutionIndex: 123
    SolutionNameMin: Cijk_Ailk_Bjlk_BBH_MT64x128x32_MI32x32x4x1_SE_AF0EM4_GRVW8_NLCA1_NLCB1_SU0_SUS256_SRVW4_TT1_64_WG64_4_1_WGM15
    SolutionIndex: 124
    SolutionNameMin: Cijk_Ailk_Bjlk_BBH_MT64x32x16_MI16x16x8x1_SE_AF0EM4_GRVW2_NLCA1_NLCB1_SU16_SUS256_SRVW0_TT2_16_WG32_8_1_WGM2
    SolutionIndex: 125
    SolutionNameMin: Cijk_Ailk_Bjlk_BBH_MT128x96x32_MI32x32x4x1_SE_AF0EM4_GRVW4_NLCA1_NLCB3_SU16_SUS256_SRVW4_TT1_96_WG128_2_1_WGM2
    SolutionIndex: 126
    SolutionNameMin: Cijk_Ailk_Bjlk_BBH_MT32x32x16_MI16x16x8x1_SE_AF0EM1_GRVW2_NLCA1_NLCB1_SU0_SUS256_SRVW0_TT1_16_WG32_8_1_WGM1
    SolutionIndex: 127
    SolutionNameMin: Cijk_Ailk_Bjlk_BBH_MT128x80x64_MI16x16x8x1_SE_AF0EM4_GRVW2_NLCA1_NLCB5_SU16_SUS256_SRVW0_TT2_80_WG64_4_1_WGM2
    SolutionIndex: 128
    SolutionNameMin: Cijk_Ailk_Bjlk_BBH_MT64x64x32_MI32x32x4x1_SE_AF0EM4_GRVW4_NLCA1_NLCB1_SU32_SUS256_SRVW4_TT1_32_WG64_4_1_WGM15
    SolutionIndex: 129
    SolutionNameMin: Cijk_Ailk_Bjlk_BBH_MT128x96x32_MI32x32x4x1_SE_AF0EM4_GRVW4_NLCA1_NLCB3_SU0_SUS256_SRVW4_TT1_96_WG128_2_1_WGM2
    SolutionIndex: 130
    SolutionNameMin: Cijk_Ailk_Bjlk_BBH_MT32x64x16_MI16x16x8x1_SE_AF0EM4_GRVW4_NLCA1_NLCB1_SU0_SUS256_SRVW0_TT1_32_WG32_8_1_WGM1
    SolutionIndex: 131
    SolutionNameMin: Cijk_Ailk_Bjlk_BBH_MT32x32x64_MI16x16x8x1_SE_AF0EM4_GRVW8_NLCA1_NLCB1_SU32_SUS128_SRVW0_TT1_16_WG32_8_1_WGM1
    SolutionIndex: 132
    SolutionNameMin: Cijk_Ailk_Bjlk_BBH_MT128x64x32_MI32x32x2x2_SE_AF0EM4_GRVW8_NLCA1_NLCB1_SU0_SUS256_SRVW4_TT1_32_WG128_2_1_WGM1
    SolutionIndex: 133
    SolutionNameMin: Cijk_Ailk_Bjlk_BBH_MT64x64x16_MI32x32x4x1_SE_AF0EM4_GRVW4_NLCA1_NLCB1_SU0_SUS256_SRVW4_TT1_32_WG64_4_1_WGM1
    SolutionIndex: 134
    SolutionNameMin: Cijk_Ailk_Bjlk_BBH_MT64x64x32_MI32x32x4x1_SE_AF0EM1_GRVW8_NLCA1_NLCB1_SU0_SUS256_SRVW4_TT1_32_WG64_4_1_WGM1
    SolutionIndex: 135
    SolutionNameMin: Cijk_Ailk_Bjlk_BBH_MT128x96x32_MI32x32x4x1_SE_AF0EM4_GRVW4_NLCA1_NLCB3_SU0_SUS256_SRVW4_TT1_96_WG128_2_1_WGM15
    SolutionIndex: 136
    SolutionNameMin: Cijk_Ailk_Bjlk_BBH_MT32x32x64_MI16x16x8x1_SE_AF0EM4_GRVW2_NLCA1_NLCB1_SU32_SUS128_SRVW0_TT1_16_WG32_8_1_WGM2
    SolutionIndex: 137
    SolutionNameMin: Cijk_Ailk_Bjlk_BBH_MT64x64x128_MI32x32x4x1_SE_AF0EM1_GRVW8_NLCA1_NLCB1_SU32_SUS256_SRVW4_TT1_32_WG64_4_1_WGM2
    SolutionIndex: 138
    SolutionNameMin: Cijk_Ailk_Bjlk_BBH_MT64x64x128_MI32x32x4x1_SE_AF0EM1_GRVW8_NLCA1_NLCB1_SU16_SUS256_SRVW4_TT1_32_WG64_4_1_WGM15
    SolutionIndex: 139
    SolutionNameMin: Cijk_Ailk_Bjlk_BBH_MT32x32x64_MI16x16x8x1_SE_AF0EM4_GRVW8_NLCA1_NLCB1_SU0_SUS256_SRVW0_TT1_16_WG32_8_1_WGM1
    SolutionIndex: 140
    SolutionNameMin: Cijk_Ailk_Bjlk_BBH_MT32x64x16_MI16x16x8x1_SE_AF0EM1_GRVW2_NLCA1_NLCB1_SU0_SUS256_SRVW0_TT1_32_WG32_8_1_WGM1
    SolutionIndex: 141
    SolutionNameMin: Cijk_Ailk_Bjlk_BBH_MT32x32x16_MI16x16x8x1_SE_AF0EM4_GRVW4_NLCA1_NLCB1_SU0_SUS256_SRVW0_TT1_16_WG32_8_1_WGM15
    SolutionIndex: 142
    SolutionNameMin: Cijk_Ailk_Bjlk_BBH_MT64x64x32_MI32x32x4x1_SE_AF0EM1_GRVW8_NLCA1_NLCB1_SU32_SUS128_SRVW4_TT1_32_WG64_4_1_WGM1
    SolutionIndex: 143
    SolutionNameMin: Cijk_Ailk_Bjlk_BBH_MT32x64x16_MI16x16x8x1_SE_AF0EM1_GRVW2_NLCA1_NLCB1_SU16_SUS256_SRVW4_TT1_32_WG32_8_1_WGM1
    SolutionIndex: 144
    SolutionNameMin: Cijk_Ailk_Bjlk_BBH_MT64x32x16_MI16x16x8x1_SE_AF0EM4_GRVW8_NLCA1_NLCB1_SU0_SUS256_SRVW4_TT2_16_WG32_8_1_WGM1
    SolutionIndex: 145
    SolutionNameMin: Cijk_Ailk_Bjlk_BBH_MT32x64x16_MI16x16x8x1_SE_AF0EM1_GRVW8_NLCA1_NLCB1_SU32_SUS128_SRVW4_TT1_32_WG32_8_1_WGM2
    SolutionIndex: 146
    SolutionNameMin: Cijk_Ailk_Bjlk_BBH_MT64x64x128_MI32x32x4x1_SE_AF0EM4_GRVW8_NLCA1_NLCB1_SU16_SUS256_SRVW4_TT1_32_WG64_4_1_WGM15
    SolutionIndex: 147
    SolutionNameMin: Cijk_Ailk_Bjlk_BBH_MT64x32x16_MI16x16x8x1_SE_AF0EM1_GRVW2_NLCA1_NLCB1_SU0_SUS256_SRVW4_TT2_16_WG32_8_1_WGM1
    SolutionIndex: 148
    SolutionNameMin: Cijk_Ailk_Bjlk_BBH_MT128x96x32_MI32x32x4x1_SE_AF0EM1_GRVW4_NLCA1_NLCB3_SU0_SUS256_SRVW4_TT1_96_WG128_2_1_WGM1
    SolutionIndex: 149
    SolutionNameMin: Cijk_Ailk_Bjlk_BBH_MT64x64x128_MI32x32x4x1_SE_AF0EM1_GRVW8_NLCA1_NLCB1_SU16_SUS256_SRVW4_TT1_32_WG64_4_1_WGM1
    SolutionIndex: 150
    SolutionNameMin: Cijk_Ailk_Bjlk_BBH_MT64x128x32_MI32x32x4x1_SE_AF0EM1_GRVW8_NLCA1_NLCB1_SU0_SUS256_SRVW4_TT1_64_WG64_4_1_WGM1
    SolutionIndex: 151
    SolutionNameMin: Cijk_Ailk_Bjlk_BBH_MT32x64x16_MI16x16x8x1_SE_AF0EM1_GRVW8_NLCA1_NLCB1_SU16_SUS128_SRVW0_TT1_32_WG32_8_1_WGM2
    SolutionIndex: 152
    SolutionNameMin: Cijk_Ailk_Bjlk_BBH_MT64x128x16_MI32x32x4x1_SE_AF0EM1_GRVW2_NLCA1_NLCB1_SU0_SUS256_SRVW4_TT1_64_WG64_4_1_WGM1
    SolutionIndex: 153
    SolutionNameMin: Cijk_Ailk_Bjlk_BBH_MT128x96x32_MI32x32x4x1_SE_AF0EM1_GRVW4_NLCA1_NLCB3_SU0_SUS256_SRVW4_TT1_96_WG128_2_1_WGM15
    SolutionIndex: 154
    SolutionNameMin: Cijk_Ailk_Bjlk_BBH_MT32x64x16_MI16x16x8x1_SE_AF0EM1_GRVW2_NLCA1_NLCB1_SU0_SUS256_SRVW4_TT1_32_WG32_8_1_WGM1
    SolutionIndex: 155
    SolutionNameMin: Cijk_Ailk_Bjlk_BBH_MT64x32x16_MI16x16x8x1_SE_AF0EM1_GRVW2_NLCA1_NLCB1_SU0_SUS256_SRVW4_TT2_16_WG32_8_1_WGM15
    SolutionIndex: 156
    SolutionNameMin: Cijk_Ailk_Bjlk_BBH_MT128x96x32_MI32x32x4x1_SE_AF0EM4_GRVW4_NLCA1_NLCB3_SU0_SUS256_SRVW4_TT1_96_WG128_2_1_WGM1
    SolutionIndex: 157
    SolutionNameMin: Cijk_Ailk_Bjlk_BBH_MT128x96x32_MI32x32x4x1_SE_AF0EM4_GRVW4_NLCA1_NLCB3_SU16_SUS128_SRVW4_TT1_96_WG128_2_1_WGM2
    SolutionIndex: 158
    SolutionNameMin: Cijk_Ailk_Bjlk_BBH_MT128x288x32_MI32x32x4x1_SE_AF0EM4_GRVW2_NLCA1_NLCB9_SU0_SUS256_SRVW0_TT1_288_WG128_2_1_WGM2
    SolutionIndex: 159
    SolutionNameMin: Cijk_Ailk_Bjlk_BBH_MT128x80x64_MI16x16x8x1_SE_AF0EM4_GRVW2_NLCA1_NLCB5_SU0_SUS256_SRVW0_TT2_80_WG64_4_1_WGM2
    SolutionIndex: 160
    SolutionNameMin: Cijk_Ailk_Bjlk_BBH_MT32x32x16_MI16x16x8x1_SE_AF0EM1_GRVW8_NLCA1_NLCB1_SU0_SUS256_SRVW0_TT1_16_WG32_8_1_WGM2
    SolutionIndex: 161
    SolutionNameMin: Cijk_Ailk_Bjlk_BBH_MT128x80x64_MI16x16x8x1_SE_AF0EM4_GRVW2_NLCA1_NLCB5_SU16_SUS128_SRVW0_TT2_80_WG64_4_1_WGM2
    SolutionIndex: 162
    SolutionNameMin: Cijk_Ailk_Bjlk_BBH_MT64x64x16_MI32x32x4x1_SE_AF0EM4_GRVW2_NLCA1_NLCB1_SU0_SUS256_SRVW4_TT1_32_WG64_4_1_WGM15
    SolutionIndex: 163
    SolutionNameMin: Cijk_Ailk_Bjlk_BBH_MT128x128x32_MI32x32x4x1_SE_AF0EM4_GRVW4_NLCA1_NLCB1_SU0_SUS256_SRVW4_TT2_64_WG64_4_1_WGM2
    SolutionIndex: 164
    SolutionNameMin: Cijk_Ailk_Bjlk_BBH_MT32x32x64_MI16x16x8x1_SE_AF0EM1_GRVW8_NLCA1_NLCB1_SU32_SUS128_SRVW4_TT1_16_WG32_8_1_WGM1
    SolutionIndex: 165
    SolutionNameMin: Cijk_Ailk_Bjlk_BBH_MT128x96x32_MI32x32x4x1_SE_AF0EM4_GRVW4_NLCA1_NLCB3_SU0_SUS256_SRVW0_TT1_96_WG128_2_1_WGM2
    SolutionIndex: 166
    SolutionNameMin: Cijk_Ailk_Bjlk_BBH_MT64x64x16_MI32x32x4x1_SE_AF0EM4_GRVW4_NLCA1_NLCB1_SU32_SUS256_SRVW0_TT1_32_WG64_4_1_WGM2
    SolutionIndex: 167
    SolutionNameMin: Cijk_Ailk_Bjlk_BBH_MT32x64x16_MI16x16x8x1_SE_AF0EM1_GRVW2_NLCA1_NLCB1_SU32_SUS256_SRVW0_TT1_32_WG32_8_1_WGM1
    SolutionIndex: 168
    SolutionNameMin: Cijk_Ailk_Bjlk_BBH_MT64x32x16_MI16x16x8x1_SE_AF0EM4_GRVW2_NLCA1_NLCB1_SU0_SUS256_SRVW0_TT2_16_WG32_8_1_WGM1
    SolutionIndex: 169
    SolutionNameMin: Cijk_Ailk_Bjlk_BBH_MT32x64x16_MI16x16x8x1_SE_AF0EM1_GRVW2_NLCA1_NLCB1_SU16_SUS128_SRVW4_TT1_32_WG32_8_1_WGM2
    SolutionIndex: 170
    SolutionNameMin: Cijk_Ailk_Bjlk_BBH_MT128x64x32_MI32x32x4x1_SE_AF0EM4_GRVW8_NLCA1_NLCB1_SU16_SUS128_SRVW4_TT2_32_WG64_4_1_WGM2
    SolutionIndex: 171
    SolutionNameMin: Cijk_Ailk_Bjlk_BBH_MT128x96x32_MI32x32x4x1_SE_AF0EM4_GRVW4_NLCA1_NLCB3_SU32_SUS128_SRVW4_TT1_96_WG128_2_1_WGM2
    SolutionIndex: 172
    SolutionNameMin: Cijk_Ailk_Bjlk_BBH_MT64x64x128_MI32x32x4x1_SE_AF0EM4_GRVW8_NLCA1_NLCB1_SU32_SUS256_SRVW4_TT1_32_WG64_4_1_WGM2
    SolutionIndex: 173
    SolutionNameMin: Cijk_Ailk_Bjlk_BBH_MT64x64x16_MI32x32x4x1_SE_AF0EM4_GRVW8_NLCA1_NLCB1_SU0_SUS256_SRVW4_TT1_32_WG64_4_1_WGM1
    SolutionIndex: 174
    SolutionNameMin: Cijk_Ailk_Bjlk_BBH_MT128x160x32_MI32x32x4x1_SE_AF0EM4_GRVW4_NLCA1_NLCB5_SU0_SUS256_SRVW0_TT1_160_WG128_2_1_WGM15
    SolutionIndex: 175
    SolutionNameMin: Cijk_Ailk_Bjlk_BBH_MT64x32x16_MI16x16x8x1_SE_AF0EM4_GRVW4_NLCA1_NLCB1_SU0_SUS256_SRVW0_TT2_16_WG32_8_1_WGM1
    SolutionIndex: 176
    SolutionNameMin: Cijk_Ailk_Bjlk_BBH_MT64x64x16_MI32x32x4x1_SE_AF0EM4_GRVW8_NLCA1_NLCB1_SU32_SUS256_SRVW0_TT1_32_WG64_4_1_WGM2
    SolutionIndex: 177
    SolutionNameMin: Cijk_Ailk_Bjlk_BBH_MT64x128x16_MI32x32x4x1_SE_AF0EM4_GRVW2_NLCA1_NLCB1_SU16_SUS256_SRVW4_TT1_64_WG64_4_1_WGM1
    SolutionIndex: 178
    SolutionNameMin: Cijk_Ailk_Bjlk_BBH_MT128x64x64_MI32x32x4x1_SE_AF0EM4_GRVW4_NLCA1_NLCB1_SU0_SUS256_SRVW4_TT2_32_WG64_4_1_WGM15
    SolutionIndex: 179
    SolutionNameMin: Cijk_Ailk_Bjlk_BBH_MT128x96x32_MI32x32x4x1_SE_AF0EM1_GRVW4_NLCA1_NLCB3_SU0_SUS256_SRVW4_TT1_96_WG128_2_1_WGM2
    SolutionIndex: 180
    SolutionNameMin: Cijk_Ailk_Bjlk_BBH_MT32x64x32_MI16x16x8x1_SE_AF0EM4_GRVW4_NLCA1_NLCB1_SU16_SUS128_SRVW0_TT1_32_WG32_8_1_WGM15
    SolutionIndex: 181
    SolutionNameMin: Cijk_Ailk_Bjlk_BBH_MT128x288x16_MI32x32x4x1_SE_AF0EM4_GRVW2_NLCA1_NLCB9_SU0_SUS256_SRVW0_TT1_288_WG128_2_1_WGM15
    SolutionIndex: 182
    SolutionNameMin: Cijk_Ailk_Bjlk_BBH_MT128x64x32_MI32x32x4x1_SE_AF0EM4_GRVW8_NLCA1_NLCB1_SU16_SUS256_SRVW4_TT2_32_WG64_4_1_WGM1
    SolutionIndex: 183
    SolutionNameMin: Cijk_Ailk_Bjlk_BBH_MT64x64x16_MI32x32x4x1_SE_AF0EM4_GRVW2_NLCA1_NLCB1_SU32_SUS256_SRVW4_TT1_32_WG64_4_1_WGM2
    SolutionIndex: 184
    SolutionNameMin: Cijk_Ailk_Bjlk_BBH_MT128x96x32_MI32x32x4x1_SE_AF0EM4_GRVW4_NLCA1_NLCB3_SU0_SUS256_SRVW0_TT1_96_WG128_2_1_WGM1
    SolutionIndex: 185
    SolutionNameMin: Cijk_Ailk_Bjlk_BBH_MT64x128x64_MI32x32x4x1_SE_AF0EM4_GRVW4_NLCA1_NLCB1_SU16_SUS128_SRVW4_TT1_64_WG64_4_1_WGM1
    SolutionIndex: 186
    SolutionNameMin: Cijk_Ailk_Bjlk_BBH_MT128x128x16_MI32x32x4x1_SE_AF0EM4_GRVW8_NLCA1_NLCB1_SU16_SUS256_SRVW4_TT2_64_WG64_4_1_WGM15
    SolutionIndex: 187
    SolutionNameMin: Cijk_Ailk_Bjlk_BBH_MT128x128x16_MI32x32x4x1_SE_AF0EM4_GRVW8_NLCA1_NLCB1_SU16_SUS128_SRVW4_TT2_64_WG64_4_1_WGM15
    SolutionIndex: 188
    SolutionNameMin: Cijk_Ailk_Bjlk_BBH_MT128x160x32_MI32x32x4x1_SE_AF0EM4_GRVW4_NLCA1_NLCB5_SU0_SUS256_SRVW4_TT1_160_WG128_2_1_WGM2
    SolutionIndex: 189
    SolutionNameMin: Cijk_Ailk_Bjlk_BBH_MT128x128x16_MI32x32x4x1_SE_AF0EM4_GRVW8_NLCA1_NLCB1_SU32_SUS256_SRVW4_TT2_64_WG64_4_1_WGM15
    SolutionIndex: 190
    SolutionNameMin: Cijk_Ailk_Bjlk_BBH_MT64x64x64_MI32x32x4x1_SE_AF0EM1_GRVW4_NLCA1_NLCB1_SU32_SUS128_SRVW4_TT1_32_WG64_4_1_WGM1
    SolutionIndex: 191
    SolutionNameMin: Cijk_Ailk_Bjlk_BBH_MT64x64x32_MI32x32x4x1_SE_AF0EM1_GRVW4_NLCA1_NLCB1_SU16_SUS128_SRVW4_TT1_32_WG64_4_1_WGM15
    SolutionIndex: 192
    SolutionNameMin: Cijk_Ailk_Bjlk_BBH_MT64x32x16_MI16x16x8x1_SE_AF0EM4_GRVW2_NLCA1_NLCB1_SU0_SUS256_SRVW4_TT2_16_WG32_8_1_WGM2
    SolutionIndex: 193
    SolutionNameMin: Cijk_Ailk_Bjlk_BBH_MT64x128x16_MI32x32x2x2_SE_AF0EM1_GRVW2_NLCA1_NLCB1_SU0_SUS256_SRVW0_TT1_32_WG64_4_1_WGM1
    SolutionIndex: 194
    SolutionNameMin: Cijk_Ailk_Bjlk_BBH_MT64x64x16_MI32x32x4x1_SE_AF0EM4_GRVW4_NLCA1_NLCB1_SU0_SUS256_SRVW4_TT1_32_WG64_4_1_WGM15
    SolutionIndex: 195
    SolutionNameMin: Cijk_Ailk_Bjlk_BBH_MT64x32x16_MI16x16x8x1_SE_AF0EM4_GRVW2_NLCA1_NLCB1_SU16_SUS256_SRVW4_TT2_16_WG32_8_1_WGM15
    SolutionIndex: 196
    SolutionNameMin: Cijk_Ailk_Bjlk_BBH_MT64x64x64_MI32x32x4x1_SE_AF0EM4_GRVW8_NLCA1_NLCB1_SU16_SUS256_SRVW4_TT1_32_WG64_4_1_WGM1
    SolutionIndex: 197
    SolutionNameMin: Cijk_Ailk_Bjlk_BBH_MT32x64x16_MI16x16x8x1_SE_AF0EM4_GRVW2_NLCA1_NLCB1_SU32_SUS256_SRVW4_TT1_32_WG32_8_1_WGM2
    SolutionIndex: 198
    SolutionNameMin: Cijk_Ailk_Bjlk_BBH_MT128x96x32_MI32x32x4x1_SE_AF0EM4_GRVW4_NLCA1_NLCB3_SU32_SUS256_SRVW4_TT1_96_WG128_2_1_WGM2
    SolutionIndex: 199
    SolutionNameMin: Cijk_Ailk_Bjlk_BBH_MT128x128x32_MI32x32x4x1_SE_AF0EM4_GRVW8_NLCA1_NLCB1_SU32_SUS128_SRVW4_TT2_64_WG64_4_1_WGM15
    SolutionIndex: 200
    SolutionNameMin: Cijk_Ailk_Bjlk_BBH_MT64x128x16_MI32x32x2x2_SE_AF0EM1_GRVW8_NLCA1_NLCB1_SU32_SUS128_SRVW4_TT1_32_WG64_4_1_WGM1
    SolutionIndex: 201
    SolutionNameMin: Cijk_Ailk_Bjlk_BBH_MT128x144x32_MI16x16x8x1_SE_AF0EM4_GRVW2_NLCA1_NLCB9_SU0_SUS256_SRVW0_TT2_144_WG64_4_1_WGM1
    SolutionIndex: 202
    SolutionNameMin: Cijk_Ailk_Bjlk_BBH_MT32x64x16_MI16x16x8x1_SE_AF0EM4_GRVW2_NLCA1_NLCB1_SU32_SUS256_SRVW0_TT1_32_WG32_8_1_WGM2
    SolutionIndex: 203
    SolutionNameMin: Cijk_Ailk_Bjlk_BBH_MT32x32x128_MI16x16x8x1_SE_AF0EM4_GRVW2_NLCA1_NLCB1_SU0_SUS256_SRVW0_TT1_16_WG32_8_1_WGM1
    SolutionIndex: 204
    SolutionNameMin: Cijk_Ailk_Bjlk_BBH_MT64x64x32_MI32x32x4x1_SE_AF0EM4_GRVW4_NLCA1_NLCB1_SU16_SUS128_SRVW4_TT1_32_WG64_4_1_WGM15
    SolutionIndex: 205
    SolutionNameMin: Cijk_Ailk_Bjlk_BBH_MT128x64x32_MI32x32x4x1_SE_AF0EM1_GRVW8_NLCA1_NLCB1_SU0_SUS256_SRVW4_TT2_32_WG64_4_1_WGM1
    SolutionIndex: 206
    SolutionNameMin: Cijk_Ailk_Bjlk_BBH_MT32x64x16_MI16x16x8x1_SE_AF0EM1_GRVW4_NLCA1_NLCB1_SU32_SUS256_SRVW0_TT1_32_WG32_8_1_WGM1
    SolutionIndex: 207
    SolutionNameMin: Cijk_Ailk_Bjlk_BBH_MT64x64x32_MI32x32x4x1_SE_AF0EM1_GRVW8_NLCA1_NLCB1_SU0_SUS256_SRVW4_TT1_32_WG64_4_1_WGM2
    SolutionIndex: 208
    SolutionNameMin: Cijk_Ailk_Bjlk_BBH_MT128x96x32_MI32x32x4x1_SE_AF0EM4_GRVW4_NLCA1_NLCB3_SU32_SUS128_SRVW4_TT1_96_WG128_2_1_WGM1
    SolutionIndex: 209
    SolutionNameMin: Cijk_Ailk_Bjlk_BBH_MT32x32x32_MI16x16x8x1_SE_AF0EM4_GRVW4_NLCA1_NLCB1_SU0_SUS256_SRVW0_TT1_16_WG32_8_1_WGM1
    SolutionIndex: 210
    SolutionNameMin: Cijk_Ailk_Bjlk_BBH_MT32x32x64_MI16x16x8x1_SE_AF0EM4_GRVW8_NLCA1_NLCB1_SU0_SUS256_SRVW0_TT1_16_WG32_8_1_WGM15
    SolutionIndex: 211
    SolutionNameMin: Cijk_Ailk_Bjlk_BBH_MT64x128x16_MI32x32x2x2_SE_AF0EM1_GRVW2_NLCA1_NLCB1_SU0_SUS256_SRVW4_TT1_32_WG64_4_1_WGM15
    SolutionIndex: 212
    SolutionNameMin: Cijk_Ailk_Bjlk_BBH_MT32x32x64_MI16x16x8x1_SE_AF0EM1_GRVW4_NLCA1_NLCB1_SU16_SUS256_SRVW0_TT1_16_WG32_8_1_WGM2
    SolutionIndex: 213
    SolutionNameMin: Cijk_Ailk_Bjlk_BBH_MT32x32x128_MI16x16x8x1_SE_AF0EM4_GRVW2_NLCA1_NLCB1_SU16_SUS256_SRVW0_TT1_16_WG32_8_1_WGM1
    SolutionIndex: 214
    SolutionNameMin: Cijk_Ailk_Bjlk_BBH_MT32x64x16_MI16x16x8x1_SE_AF0EM1_GRVW4_NLCA1_NLCB1_SU0_SUS256_SRVW0_TT1_32_WG32_8_1_WGM1
    SolutionIndex: 215
    SolutionNameMin: Cijk_Ailk_Bjlk_BBH_MT128x96x32_MI32x32x4x1_SE_AF0EM4_GRVW4_NLCA1_NLCB3_SU32_SUS256_SRVW4_TT1_96_WG128_2_1_WGM15
    SolutionIndex: 216
    SolutionNameMin: Cijk_Ailk_Bjlk_BBH_MT128x96x32_MI32x32x4x1_SE_AF0EM4_GRVW4_NLCA1_NLCB3_SU16_SUS128_SRVW4_TT1_96_WG128_2_1_WGM1
    SolutionIndex: 217
    SolutionNameMin: Cijk_Ailk_Bjlk_BBH_MT64x32x16_MI16x16x8x1_SE_AF0EM4_GRVW8_NLCA1_NLCB1_SU16_SUS128_SRVW0_TT2_16_WG32_8_1_WGM1
    SolutionIndex: 218
    SolutionNameMin: Cijk_Ailk_Bjlk_BBH_MT64x128x16_MI32x32x4x1_SE_AF0EM4_GRVW8_NLCA1_NLCB1_SU0_SUS256_SRVW4_TT1_64_WG64_4_1_WGM15
    SolutionIndex: 219
    SolutionNameMin: Cijk_Ailk_Bjlk_BBH_MT64x128x64_MI32x32x4x1_SE_AF0EM4_GRVW8_NLCA1_NLCB1_SU0_SUS256_SRVW4_TT1_64_WG64_4_1_WGM15
    SolutionIndex: 220
    SolutionNameMin: Cijk_Ailk_Bjlk_BBH_MT32x64x16_MI16x16x8x1_SE_AF0EM4_GRVW4_NLCA1_NLCB1_SU16_SUS128_SRVW4_TT1_32_WG32_8_1_WGM1
    SolutionIndex: 221
    SolutionNameMin: Cijk_Ailk_Bjlk_BBH_MT64x32x16_MI16x16x8x1_SE_AF0EM4_GRVW2_NLCA1_NLCB1_SU0_SUS256_SRVW4_TT2_16_WG32_8_1_WGM1
    SolutionIndex: 222
    SolutionNameMin: Cijk_Ailk_Bjlk_BBH_MT128x64x16_MI32x32x2x2_SE_AF0EM1_GRVW8_NLCA1_NLCB1_SU0_SUS256_SRVW4_TT1_32_WG128_2_1_WGM2
    SolutionIndex: 223
    SolutionNameMin: Cijk_Ailk_Bjlk_BBH_MT128x128x16_MI32x32x4x1_SE_AF0EM4_GRVW8_NLCA1_NLCB1_SU32_SUS128_SRVW4_TT2_64_WG64_4_1_WGM15
    SolutionIndex: 224
    SolutionNameMin: Cijk_Ailk_Bjlk_BBH_MT64x128x64_MI32x32x4x1_SE_AF0EM4_GRVW4_NLCA1_NLCB1_SU0_SUS256_SRVW4_TT1_64_WG64_4_1_WGM2
    SolutionIndex: 225
    SolutionNameMin: Cijk_Ailk_Bjlk_BBH_MT64x64x64_MI32x32x4x1_SE_AF0EM4_GRVW4_NLCA1_NLCB1_SU16_SUS128_SRVW4_TT1_32_WG64_4_1_WGM2
    SolutionIndex: 226
    SolutionNameMin: Cijk_Ailk_Bjlk_BBH_MT128x96x32_MI32x32x4x1_SE_AF0EM1_GRVW4_NLCA1_NLCB3_SU16_SUS128_SRVW4_TT1_96_WG128_2_1_WGM15
    SolutionIndex: 227
    SolutionNameMin: Cijk_Ailk_Bjlk_BBH_MT64x32x16_MI16x16x8x1_SE_AF0EM4_GRVW2_NLCA1_NLCB1_SU32_SUS256_SRVW4_TT2_16_WG32_8_1_WGM2
    SolutionIndex: 228
    SolutionNameMin: Cijk_Ailk_Bjlk_BBH_MT64x32x16_MI16x16x8x1_SE_AF0EM4_GRVW2_NLCA1_NLCB1_SU16_SUS256_SRVW0_TT2_16_WG32_8_1_WGM1
    SolutionIndex: 229
    SolutionNameMin: Cijk_Ailk_Bjlk_BBH_MT128x160x32_MI32x32x4x1_SE_AF0EM4_GRVW4_NLCA1_NLCB5_SU0_SUS256_SRVW0_TT1_160_WG128_2_1_WGM2
    SolutionIndex: 230
    SolutionNameMin: Cijk_Ailk_Bjlk_BBH_MT64x64x32_MI32x32x4x1_SE_AF0EM4_GRVW2_NLCA1_NLCB1_SU0_SUS256_SRVW4_TT1_32_WG64_4_1_WGM1
    SolutionIndex: 231
    SolutionNameMin: Cijk_Ailk_Bjlk_BBH_MT64x64x128_MI32x32x4x1_SE_AF0EM1_GRVW8_NLCA1_NLCB1_SU32_SUS256_SRVW0_TT1_32_WG64_4_1_WGM2
    SolutionIndex: 232
    SolutionNameMin: Cijk_Ailk_Bjlk_BBH_MT128x96x32_MI32x32x4x1_SE_AF0EM4_GRVW4_NLCA1_NLCB3_SU32_SUS128_SRVW0_TT1_96_WG128_2_1_WGM2
    SolutionIndex: 233
    SolutionNameMin: Cijk_Ailk_Bjlk_BBH_MT32x64x16_MI16x16x8x1_SE_AF0EM1_GRVW2_NLCA1_NLCB1_SU32_SUS256_SRVW4_TT1_32_WG32_8_1_WGM1
    SolutionIndex: 234
    SolutionNameMin: Cijk_Ailk_Bjlk_BBH_MT64x128x32_MI32x32x4x1_SE_AF0EM4_GRVW8_NLCA1_NLCB1_SU16_SUS128_SRVW4_TT1_64_WG64_4_1_WGM1
    SolutionIndex: 235
    SolutionNameMin: Cijk_Ailk_Bjlk_BBH_MT32x32x16_MI16x16x8x1_SE_AF0EM4_GRVW2_NLCA1_NLCB1_SU16_SUS128_SRVW0_TT1_16_WG32_8_1_WGM2
    SolutionIndex: 236
    SolutionNameMin: Cijk_Ailk_Bjlk_BBH_MT32x64x16_MI16x16x8x1_SE_AF0EM1_GRVW4_NLCA1_NLCB1_SU16_SUS256_SRVW0_TT1_32_WG32_8_1_WGM2
    SolutionIndex: 237
    SolutionNameMin: Cijk_Ailk_Bjlk_BBH_MT64x128x32_MI32x32x4x1_SE_AF0EM1_GRVW8_NLCA1_NLCB1_SU32_SUS256_SRVW4_TT1_64_WG64_4_1_WGM1
    SolutionIndex: 238
    SolutionNameMin: Cijk_Ailk_Bjlk_BBH_MT128x64x32_MI32x32x4x1_SE_AF0EM1_GRVW8_NLCA1_NLCB1_SU0_SUS256_SRVW4_TT2_32_WG64_4_1_WGM2
    SolutionIndex: 239
    SolutionNameMin: Cijk_Ailk_Bjlk_BBH_MT32x32x16_MI16x16x8x1_SE_AF0EM4_GRVW2_NLCA1_NLCB1_SU16_SUS256_SRVW0_TT1_16_WG32_8_1_WGM15
    SolutionIndex: 240
    SolutionNameMin: Cijk_Ailk_Bjlk_BBH_MT64x64x32_MI32x32x4x1_SE_AF0EM4_GRVW4_NLCA1_NLCB1_SU0_SUS256_SRVW4_TT1_32_WG64_4_1_WGM15
    SolutionIndex: 241
    SolutionNameMin: Cijk_Ailk_Bjlk_BBH_MT128x128x16_MI32x32x4x1_SE_AF0EM4_GRVW8_NLCA1_NLCB1_SU32_SUS256_SRVW4_TT2_64_WG64_4_1_WGM1
    SolutionIndex: 242
    SolutionNameMin: Cijk_Ailk_Bjlk_BBH_MT64x64x32_MI32x32x4x1_SE_AF0EM4_GRVW4_NLCA1_NLCB1_SU16_SUS256_SRVW4_TT1_32_WG64_4_1_WGM15
    SolutionIndex: 243
    SolutionNameMin: Cijk_Ailk_Bjlk_BBH_MT64x64x32_MI32x32x4x1_SE_AF0EM1_GRVW8_NLCA1_NLCB1_SU0_SUS256_SRVW4_TT1_32_WG64_4_1_WGM15
    SolutionIndex: 244
    SolutionNameMin: Cijk_Ailk_Bjlk_BBH_MT128x96x32_MI32x32x4x1_SE_AF0EM1_GRVW4_NLCA1_NLCB3_SU32_SUS128_SRVW4_TT1_96_WG128_2_1_WGM15
    SolutionIndex: 245
    SolutionNameMin: Cijk_Ailk_Bjlk_BBH_MT32x32x64_MI16x16x8x1_SE_AF0EM1_GRVW8_NLCA1_NLCB1_SU32_SUS256_SRVW0_TT1_16_WG32_8_1_WGM2
    SolutionIndex: 246
    SolutionNameMin: Cijk_Ailk_Bjlk_BBH_MT64x64x64_MI32x32x4x1_SE_AF0EM1_GRVW8_NLCA1_NLCB1_SU16_SUS128_SRVW4_TT1_32_WG64_4_1_WGM1
    SolutionIndex: 247
    SolutionNameMin: Cijk_Ailk_Bjlk_BBH_MT64x128x32_MI32x32x4x1_SE_AF0EM4_GRVW8_NLCA1_NLCB1_SU16_SUS128_SRVW4_TT1_64_WG64_4_1_WGM15
    SolutionIndex: 248
    SolutionNameMin: Cijk_Ailk_Bjlk_BBH_MT32x64x16_MI16x16x8x1_SE_AF0EM4_GRVW2_NLCA1_NLCB1_SU0_SUS256_SRVW4_TT1_32_WG32_8_1_WGM2
    SolutionIndex: 249
    SolutionNameMin: Cijk_Ailk_Bjlk_BBH_MT64x64x16_MI32x32x4x1_SE_AF0EM1_GRVW2_NLCA1_NLCB1_SU0_SUS256_SRVW4_TT1_32_WG64_4_1_WGM15
    SolutionIndex: 250
    SolutionNameMin: Cijk_Ailk_Bjlk_BBH_MT128x96x32_MI32x32x4x1_SE_AF0EM1_GRVW4_NLCA1_NLCB3_SU32_SUS128_SRVW4_TT1_96_WG128_2_1_WGM2
    SolutionIndex: 251
    SolutionNameMin: Cijk_Ailk_Bjlk_BBH_MT32x32x16_MI16x16x8x1_SE_AF0EM4_GRVW2_NLCA1_NLCB1_SU16_SUS256_SRVW0_TT1_16_WG32_8_1_WGM2
    SolutionIndex: 252
    SolutionNameMin: Cijk_Ailk_Bjlk_BBH_MT64x64x32_MI32x32x4x1_SE_AF0EM1_GRVW8_NLCA1_NLCB1_SU32_SUS128_SRVW4_TT1_32_WG64_4_1_WGM2
    SolutionIndex: 253
    SolutionNameMin: Cijk_Ailk_Bjlk_BBH_MT64x64x32_MI32x32x4x1_SE_AF0EM1_GRVW4_NLCA1_NLCB1_SU32_SUS256_SRVW4_TT1_32_WG64_4_1_WGM2
    SolutionIndex: 254
    SolutionNameMin: Cijk_Ailk_Bjlk_BBH_MT128x96x32_MI32x32x4x1_SE_AF0EM1_GRVW4_NLCA1_NLCB3_SU16_SUS256_SRVW4_TT1_96_WG128_2_1_WGM15
    SolutionIndex: 255
    SolutionNameMin: Cijk_Ailk_Bjlk_BBH_MT128x96x16_MI32x32x4x1_SE_AF0EM4_GRVW2_NLCA1_NLCB3_SU16_SUS128_SRVW4_TT1_96_WG128_2_1_WGM2
    SolutionIndex: 256
    SolutionNameMin: Cijk_Ailk_Bjlk_BBH_MT32x64x16_MI16x16x8x1_SE_AF0EM1_GRVW2_NLCA1_NLCB1_SU16_SUS128_SRVW4_TT1_32_WG32_8_1_WGM1
    SolutionIndex: 257
    SolutionNameMin: Cijk_Ailk_Bjlk_BBH_MT64x64x64_MI32x32x4x1_SE_AF0EM4_GRVW8_NLCA1_NLCB1_SU32_SUS256_SRVW0_TT1_32_WG64_4_1_WGM1
    SolutionIndex: 258
    SolutionNameMin: Cijk_Ailk_Bjlk_BBH_MT64x64x64_MI32x32x4x1_SE_AF0EM4_GRVW8_NLCA1_NLCB1_SU0_SUS256_SRVW4_TT1_32_WG64_4_1_WGM15
    SolutionIndex: 259
    SolutionNameMin: Cijk_Ailk_Bjlk_BBH_MT64x64x32_MI32x32x4x1_SE_AF0EM4_GRVW4_NLCA1_NLCB1_SU0_SUS256_SRVW4_TT1_32_WG64_4_1_WGM1
    SolutionIndex: 260
    SolutionNameMin: Cijk_Ailk_Bjlk_BBH_MT128x80x64_MI16x16x8x1_SE_AF0EM4_GRVW2_NLCA1_NLCB5_SU16_SUS128_SRVW0_TT2_80_WG64_4_1_WGM15
    SolutionIndex: 261
    SolutionNameMin: Cijk_Ailk_Bjlk_BBH_MT64x64x64_MI32x32x4x1_SE_AF0EM1_GRVW8_NLCA1_NLCB1_SU32_SUS256_SRVW4_TT1_32_WG64_4_1_WGM1
    SolutionIndex: 262
    SolutionNameMin: Cijk_Ailk_Bjlk_BBH_MT64x64x32_MI32x32x4x1_SE_AF0EM1_GRVW8_NLCA1_NLCB1_SU16_SUS256_SRVW4_TT1_32_WG64_4_1_WGM2
    SolutionIndex: 263
    SolutionNameMin: Cijk_Ailk_Bjlk_BBH_MT32x32x64_MI16x16x8x1_SE_AF0EM1_GRVW4_NLCA1_NLCB1_SU0_SUS256_SRVW0_TT1_16_WG32_8_1_WGM1
    SolutionIndex: 264
    SolutionNameMin: Cijk_Ailk_Bjlk_BBH_MT64x32x16_MI16x16x8x1_SE_AF0EM4_GRVW2_NLCA1_NLCB1_SU0_SUS256_SRVW0_TT2_16_WG32_8_1_WGM2
    SolutionIndex: 265
    SolutionNameMin: Cijk_Ailk_Bjlk_BBH_MT64x32x16_MI16x16x8x1_SE_AF0EM1_GRVW4_NLCA1_NLCB1_SU0_SUS256_SRVW4_TT2_16_WG32_8_1_WGM1
    SolutionIndex: 266
    SolutionNameMin: Cijk_Ailk_Bjlk_BBH_MT128x128x32_MI32x32x4x1_SE_AF0EM4_GRVW8_NLCA1_NLCB1_SU32_SUS256_SRVW4_TT2_64_WG64_4_1_WGM15
    SolutionIndex: 267
    SolutionNameMin: Cijk_Ailk_Bjlk_BBH_MT64x64x32_MI32x32x4x1_SE_AF0EM4_GRVW4_NLCA1_NLCB1_SU0_SUS256_SRVW4_TT1_32_WG64_4_1_WGM2
    SolutionIndex: 268
    SolutionNameMin: Cijk_Ailk_Bjlk_BBH_MT64x64x64_MI32x32x4x1_SE_AF0EM1_GRVW8_NLCA1_NLCB1_SU16_SUS256_SRVW4_TT1_32_WG64_4_1_WGM15
    SolutionIndex: 269
    SolutionNameMin: Cijk_Ailk_Bjlk_BBH_MT128x64x32_MI32x32x2x2_SE_AF0EM4_ASBE01_GRVW4_PBD0_SRVW4_TT1_32_WG128_2_1_WGM4
    SolutionIndex: 270
    SolutionNameMin: Cijk_Ailk_Bjlk_BBH_MT64x64x32_MI32x32x4x1_SE_AF0EM1_ASBE01_GRVW4_PBD0_SRVW4_TT1_32_WG64_4_1_WGM1
    SolutionIndex: 271
    SolutionNameMin: Cijk_Ailk_Bjlk_BBH_MT64x64x32_MI32x32x4x1_SE_AF0EM4_ASBE01_GRVW2_PBD0_SRVW4_TT1_32_WG64_4_1_WGM10
    SolutionIndex: 272
    SolutionNameMin: Cijk_Ailk_Bjlk_BBH_MT64x128x32_MI32x32x4x1_SE_AF0EM1_ASBE01_GRVW4_PBD0_SRVW4_TT2_32_WG32_8_1_WGM4
    SolutionIndex: 273
    SolutionNameMin: Cijk_Ailk_Bjlk_BBH_MT64x128x32_MI32x32x4x1_SE_AF0EM8_ASBE01_GRVW8_PBD0_SRVW4_TT2_32_WG32_8_1_WGM4
    SolutionIndex: 274
    SolutionNameMin: Cijk_Ailk_Bjlk_BBH_MT64x64x32_MI32x32x4x1_SE_AF0EM1_ASBE01_GRVW4_PBD0_SRVW4_TT1_32_WG64_4_1_WGM10
    SolutionIndex: 275
    SolutionNameMin: Cijk_Ailk_Bjlk_BBH_MT64x128x32_MI32x32x4x1_SE_AF0EM8_ASBE01_GRVW8_PBD0_SRVW4_TT2_32_WG32_8_1_WGM1
    SolutionIndex: 276
    SolutionNameMin: Cijk_Ailk_Bjlk_BBH_MT64x64x32_MI16x16x8x1_SE_AF0EM1_ASBE01_GRVW4_PBD0_SRVW4_TT2_32_WG32_8_1_WGM1
    SolutionIndex: 277
    SolutionNameMin: Cijk_Ailk_Bjlk_BBH_MT128x128x32_MI32x32x4x1_SE_AF0EM4_ASBE01_GRVW4_PBD0_SRVW4_TT2_64_WG64_4_1_WGM10
    SolutionIndex: 278
    SolutionNameMin: Cijk_Ailk_Bjlk_BBH_MT64x128x32_MI32x32x4x1_SE_AF0EM8_ASBE01_GRVW8_PBD0_SRVW4_TT2_32_WG32_8_1_WGM10
    SolutionIndex: 279
    SolutionNameMin: Cijk_Ailk_Bjlk_BBH_MT64x64x32_MI32x32x4x1_SE_AF0EM1_ASBE01_GRVW4_PBD0_SRVW4_TT1_32_WG64_4_1_WGM4
    SolutionIndex: 280
    SolutionNameMin: Cijk_Ailk_Bjlk_BBH_MT64x64x32_MI32x32x4x1_SE_AF0EM8_ASBE01_GRVW8_PBD0_SRVW4_TT1_32_WG64_4_1_WGM1
    SolutionIndex: 281
    SolutionNameMin: Cijk_Ailk_Bjlk_BBH_MT64x128x32_MI32x32x4x1_SE_AF0EM1_ASBE01_GRVW4_PBD0_SRVW4_TT2_32_WG32_8_1_WGM1
    SolutionIndex: 282
    SolutionNameMin: Cijk_Ailk_Bjlk_BBH_MT64x64x32_MI16x16x8x1_SE_AF0EM1_ASBE01_GRVW2_PBD0_SRVW4_TT2_32_WG32_8_1_WGM10
    SolutionIndex: 283
    SolutionNameMin: Cijk_Ailk_Bjlk_BBH_MT128x64x32_MI32x32x4x1_SE_AF0EM4_ASBE01_GRVW4_PBD0_SRVW4_TT2_32_WG64_4_1_WGM10
    SolutionIndex: 284
    SolutionNameMin: Cijk_Ailk_Bjlk_BBH_MT128x64x32_MI32x32x4x1_SE_AF0EM4_ASBE01_GRVW4_PBD0_SRVW4_TT2_32_WG64_4_1_WGM4
    SolutionIndex: 285
    SolutionNameMin: Cijk_Ailk_Bjlk_BBH_MT64x64x32_MI32x32x4x1_SE_AF0EM8_ASBE01_GRVW4_PBD0_SRVW4_TT1_32_WG64_4_1_WGM1
    SolutionIndex: 286
    SolutionNameMin: Cijk_Ailk_Bjlk_BBH_MT128x128x32_MI32x32x4x1_SE_AF0EM4_ASBE01_GRVW4_PBD0_SRVW4_TT2_64_WG64_4_1_WGM1
    SolutionIndex: 287
    SolutionNameMin: Cijk_Ailk_Bjlk_BBH_MT64x64x32_MI32x32x4x1_SE_AF0EM4_ASBE01_GRVW2_PBD0_SRVW4_TT1_32_WG64_4_1_WGM1
    SolutionIndex: 288
    SolutionNameMin: Cijk_Ailk_Bjlk_BBH_MT64x64x32_MI16x16x8x1_SE_AF0EM1_ASBE01_GRVW4_PBD0_SRVW4_TT2_32_WG32_8_1_WGM4
    SolutionIndex: 289
    SolutionNameMin: Cijk_Ailk_Bjlk_BBH_MT64x64x32_MI32x32x4x1_SE_AF0EM8_ASBE01_GRVW8_PBD0_SRVW4_TT1_32_WG64_4_1_WGM10
    SolutionIndex: 290
    SolutionNameMin: Cijk_Ailk_Bjlk_BBH_MT64x64x32_MI32x32x4x1_SE_AF0EM8_ASBE01_GRVW2_PBD0_SRVW4_TT1_32_WG64_4_1_WGM10
    SolutionIndex: 291
    SolutionNameMin: Cijk_Ailk_Bjlk_BBH_MT128x128x32_MI32x32x4x1_SE_AF0EM4_ASBE01_GRVW4_PBD0_SRVW4_TT2_64_WG64_4_1_WGM4
    SolutionIndex: 292
    SolutionNameMin: Cijk_Ailk_Bjlk_BBH_MT64x64x32_MI16x16x8x1_SE_AF0EM8_ASBE01_GRVW8_PBD0_SRVW4_TT2_32_WG32_8_1_WGM1
    SolutionIndex: 293
    SolutionNameMin: Cijk_Ailk_Bjlk_BBH_MT128x256x32_MI32x32x4x1_SE_AF0EM8_GRVW8_GSU1_SU32_SUS128_SRVW4_WG64_4_1_WGM15
    SolutionIndex: 294
    SolutionNameMin: Cijk_Ailk_Bjlk_BBH_MT128x256x16_MI32x32x4x1_SE_AF0EM8_GRVW8_GSU1_SU0_SUS256_SRVW4_WG64_4_1_WGM1
    SolutionIndex: 295
    SolutionNameMin: Cijk_Ailk_Bjlk_BBH_MT128x256x16_MI32x32x4x1_SE_AF0EM8_GRVW8_GSU1_SU0_SUS256_SRVW4_WG64_4_1_WGM15
    SolutionIndex: 296
    SolutionNameMin: Cijk_Ailk_Bjlk_BBH_MT128x160x16_MI32x32x4x1_SE_AF0EM8_GRVW2_GSU1_SU32_SUS128_SRVW4_WG128_2_1_WGM1
    SolutionIndex: 297
    SolutionNameMin: Cijk_Ailk_Bjlk_BBH_MT32x32x16_MI16x16x8x1_SE_AF0EM8_GRVW2_GSU15_SU0_SUS256_SRVW0_WG32_8_1_WGM2
    SolutionIndex: 298
    SolutionNameMin: Cijk_Ailk_Bjlk_BBH_MT64x16x64_MI16x16x8x1_SE_AF0EM8_GRVW2_GSU15_SU0_SUS256_SRVW0_WG64_4_1_WGM1
    SolutionIndex: 299
    SolutionNameMin: Cijk_Ailk_Bjlk_BBH_MT64x16x32_MI16x16x8x1_SE_AF0EM8_GRVW8_GSU15_SU0_SUS256_SRVW0_WG64_4_1_WGM1
    SolutionIndex: 300
    SolutionNameMin: Cijk_Ailk_Bjlk_BBH_MT64x16x32_MI16x16x8x1_SE_AF0EM1_GRVW8_GSU15_SU0_SUS256_SRVW0_WG64_4_1_WGM1
    SolutionIndex: 301
    SolutionNameMin: Cijk_Ailk_Bjlk_BBH_MT128x128x16_MI32x32x4x1_SE_AF0EM8_GRVW8_GSU1_SU32_SUS256_SRVW4_WG64_4_1_WGM15
    SolutionIndex: 302
    SolutionNameMin: Cijk_Ailk_Bjlk_BBH_MT64x16x32_MI16x16x8x1_SE_AF0EM8_GRVW4_GSU15_SU0_SUS256_SRVW0_WG64_4_1_WGM2
    SolutionIndex: 303
    SolutionNameMin: Cijk_Ailk_Bjlk_BBH_MT64x64x64_MI32x32x4x1_SE_AF0EM8_GRVW8_GSU15_SU32_SUS128_SRVW0_WG64_4_1_WGM15
    SolutionIndex: 304
    SolutionNameMin: Cijk_Ailk_Bjlk_BBH_MT128x64x64_MI32x32x4x1_SE_AF0EM8_GRVW8_GSU7_SU0_SUS256_SRVW0_WG64_4_1_WGM2
    SolutionIndex: 305
    SolutionNameMin: Cijk_Ailk_Bjlk_BBH_MT128x128x16_MI32x32x4x1_SE_AF0EM8_GRVW8_GSU7_SU0_SUS256_SRVW0_WG64_4_1_WGM1
    SolutionIndex: 306
    SolutionNameMin: Cijk_Ailk_Bjlk_BBH_MT128x160x32_MI32x32x4x1_SE_AF0EM8_GRVW2_GSU2_SU32_SUS256_SRVW0_WG128_2_1_WGM1
    SolutionIndex: 307
    SolutionNameMin: Cijk_Ailk_Bjlk_BBH_MT128x256x32_MI32x32x4x1_SE_AF0EM8_GRVW8_GSU1_SU0_SUS256_SRVW4_WG64_4_1_WGM1
    SolutionIndex: 308
    SolutionNameMin: Cijk_Ailk_Bjlk_BBH_MT128x128x16_MI32x32x4x1_SE_AF0EM8_GRVW8_GSU1_SU32_SUS128_SRVW4_WG64_4_1_WGM15
    SolutionIndex: 309
    SolutionNameMin: Cijk_Ailk_Bjlk_BBH_MT128x96x32_MI32x32x4x1_SE_AF0EM8_GRVW4_GSU1_SU32_SUS128_SRVW4_WG128_2_1_WGM15
    SolutionIndex: 310
    SolutionNameMin: Cijk_Ailk_Bjlk_BBH_MT128x96x32_MI32x32x4x1_SE_AF0EM8_GRVW4_GSU1_SU32_SUS256_SRVW4_WG128_2_1_WGM2
    SolutionIndex: 311
    SolutionNameMin: Cijk_Ailk_Bjlk_BBH_MT16x16x16_MI16x16x8x1_SE_AF0EM8_GRVW2_GSU1_SU0_SUS256_SRVW0_WG16_4_1_WGM2
    SolutionIndex: 312
    SolutionNameMin: Cijk_Ailk_Bjlk_BBH_MT32x32x64_MI16x16x8x1_SE_AF0EM8_GRVW8_GSU15_SU0_SUS256_SRVW0_WG32_8_1_WGM1
    SolutionIndex: 313
    SolutionNameMin: Cijk_Ailk_Bjlk_BBH_MT128x64x32_MI32x32x4x1_SE_AF0EM8_GRVW8_GSU3_SU0_SUS256_SRVW0_WG64_4_1_WGM15
    SolutionIndex: 314
    SolutionNameMin: Cijk_Ailk_Bjlk_BBH_MT128x128x16_MI32x32x4x1_SE_AF0EM8_GRVW8_GSU3_SU0_SUS256_SRVW0_WG64_4_1_WGM2
    SolutionIndex: 315
    SolutionNameMin: Cijk_Ailk_Bjlk_BBH_MT128x144x32_MI16x16x8x1_SE_AF0EM8_GRVW2_GSU1_SU0_SUS256_SRVW4_WG64_4_1_WGM1
    SolutionIndex: 316
    SolutionNameMin: Cijk_Ailk_Bjlk_BBH_MT64x64x64_MI32x32x4x1_SE_AF0EM8_GRVW8_GSU1_SU0_SUS256_SRVW4_WG64_4_1_WGM1
    SolutionIndex: 317
    SolutionNameMin: Cijk_Ailk_Bjlk_BBH_MT128x128x32_MI32x32x4x1_SE_AF0EM8_GRVW8_GSU1_SU32_SUS128_SRVW4_WG64_4_1_WGM15
    SolutionIndex: 318
    SolutionNameMin: Cijk_Ailk_Bjlk_BBH_MT128x128x16_MI32x32x4x1_SE_AF0EM8_GRVW8_GSU1_SU0_SUS256_SRVW4_WG64_4_1_WGM1
    SolutionIndex: 319
    SolutionNameMin: Cijk_Ailk_Bjlk_BBH_MT128x128x16_MI32x32x4x1_SE_AF0EM8_GRVW8_GSU1_SU0_SUS256_SRVW4_WG64_4_1_WGM1
    SolutionIndex: 320
    SolutionNameMin: Cijk_Ailk_Bjlk_BBH_MT128x128x32_MI32x32x4x1_SE_AF0EM8_GRVW8_GSU1_SU32_SUS256_SRVW4_WG64_4_1_WGM15
    SolutionIndex: 321
    SolutionNameMin: Cijk_Ailk_Bjlk_BBH_MT128x64x32_MI32x32x4x1_SE_AF0EM8_GRVW8_GSU1_SU32_SUS128_SRVW4_WG64_4_1_WGM15
    SolutionIndex: 322
    SolutionNameMin: Cijk_Ailk_Bjlk_BBH_MT96x128x64_MI32x32x4x1_SE_AF0EM8_GRVW8_GSU3_SU0_SUS256_SRVW0_WG32_8_1_WGM2
    SolutionIndex: 323
    SolutionNameMin: Cijk_Ailk_Bjlk_BBH_MT96x96x32_MI16x16x8x1_SE_AF0EM8_GRVW4_GSU7_SU0_SUS256_SRVW0_WG32_8_1_WGM1
    SolutionIndex: 324
    SolutionNameMin: Cijk_Ailk_Bjlk_BBH_MT96x96x32_MI16x16x8x1_SE_AF0EM8_GRVW4_GSU7_SU0_SUS256_SRVW0_WG32_8_1_WGM15
    SolutionIndex: 325
    SolutionNameMin: Cijk_Ailk_Bjlk_BBH_MT96x128x32_MI32x32x4x1_SE_AF0EM8_GRVW4_GSU5_SU0_SUS256_SRVW0_WG32_8_1_WGM15
    SolutionIndex: 326
    SolutionNameMin: Cijk_Ailk_Bjlk_BBH_MT128x96x32_MI32x32x4x1_SE_AF0EM8_GRVW4_GSU5_SU0_SUS256_SRVW0_WG128_2_1_WGM1
    SolutionIndex: 327
    SolutionNameMin: Cijk_Ailk_Bjlk_BBH_MT96x128x32_MI32x32x4x1_SE_AF0EM8_GRVW4_GSU5_SU0_SUS256_SRVW0_WG32_8_1_WGM1
    SolutionIndex: 328
    SolutionNameMin: Cijk_Ailk_Bjlk_BBH_MT96x128x32_MI32x32x4x1_SE_AF0EM8_GRVW4_GSU5_SU32_SUS128_SRVW0_WG32_8_1_WGM1
    SolutionIndex: 329
    SolutionNameMin: Cijk_Ailk_Bjlk_BBH_MT96x128x32_MI32x32x4x1_SE_AF0EM8_GRVW4_GSU5_SU32_SUS128_SRVW0_WG32_8_1_WGM2
    SolutionIndex: 330
    SolutionNameMin: Cijk_Ailk_Bjlk_BBH_MT256x64x32_MI32x32x4x1_SE_AF0EM8_GRVW8_GSU7_SU32_SUS128_SRVW0_WG64_4_1_WGM2
    SolutionIndex: 331
    SolutionNameMin: Cijk_Ailk_Bjlk_BBH_MT256x64x32_MI32x32x4x1_SE_AF0EM8_GRVW8_GSU7_SU32_SUS128_SRVW0_WG64_4_1_WGM1
    SolutionIndex: 332
    SolutionNameMin: Cijk_Ailk_Bjlk_BBH_MT128x64x32_MI32x32x4x1_SE_AF0EM8_GRVW8_GSU1_SU32_SUS128_SRVW4_WG64_4_1_WGM1
    SolutionIndex: 333
    SolutionNameMin: Cijk_Ailk_Bjlk_BBH_MT128x128x16_MI32x32x4x1_SE_AF0EM8_GRVW8_GSU1_SU32_SUS128_SRVW4_WG64_4_1_WGM2
    SolutionIndex: 334
    SolutionNameMin: Cijk_Ailk_Bjlk_BBH_MT128x128x16_MI32x32x4x1_SE_AF0EM8_GRVW8_GSU1_SU32_SUS128_SRVW4_WG64_4_1_WGM15
    SolutionIndex: 335
    SolutionNameMin: Cijk_Ailk_Bjlk_BBH_MT128x128x16_MI32x32x4x1_SE_AF0EM8_GRVW8_GSU1_SU32_SUS128_SRVW4_WG64_4_1_WGM2
    SolutionIndex: 336
    SolutionNameMin: Cijk_Ailk_Bjlk_BBH_MT96x96x64_MI16x16x8x1_SE_AF0EM8_GRVW2_GSU1_SU0_SUS256_SRVW0_WG32_8_1_WGM2
    SolutionIndex: 337
    SolutionNameMin: Cijk_Ailk_Bjlk_BBH_MT96x96x32_MI16x16x8x1_SE_AF0EM8_GRVW4_GSU1_SU0_SUS256_SRVW0_WG32_8_1_WGM1
    SolutionIndex: 338
    SolutionNameMin: Cijk_Ailk_Bjlk_BBH_MT96x96x32_MI16x16x8x1_SE_AF0EM8_GRVW2_GSU1_SU0_SUS256_SRVW0_WG32_8_1_WGM1
    SolutionIndex: 339
    SolutionNameMin: Cijk_Ailk_Bjlk_BBH_MT64x64x32_MI32x32x4x1_SE_AF0EM8_GRVW8_GSU1_SU0_SUS256_SRVW4_WG64_4_1_WGM2
    SolutionIndex: 340
    SolutionNameMin: Cijk_Ailk_Bjlk_BBH_MT128x128x32_MI32x32x4x1_SE_AF0EM8_GRVW8_GSU1_SU32_SUS128_SRVW4_WG64_4_1_WGM2
    SolutionIndex: 341
    SolutionNameMin: Cijk_Ailk_Bjlk_BBH_MT96x96x32_MI16x16x8x1_SE_AF0EM8_GRVW4_GSU1_SU0_SUS256_SRVW0_WG32_8_1_WGM15
    SolutionIndex: 342
    SolutionNameMin: Cijk_Ailk_Bjlk_BBH_MT96x128x32_MI32x32x4x1_SE_AF0EM8_GRVW4_GSU1_SU0_SUS256_SRVW0_WG32_8_1_WGM1
    SolutionIndex: 343
    SolutionNameMin: Cijk_Ailk_Bjlk_BBH_MT128x160x32_MI32x32x4x1_SE_AF0EM8_GRVW2_GSU1_SU0_SUS256_SRVW4_WG128_2_1_WGM2
    SolutionIndex: 344
    SolutionNameMin: Cijk_Ailk_Bjlk_BBH_MT128x64x32_MI32x32x4x1_SE_AF0EM8_GRVW8_GSU1_SU0_SUS256_SRVW4_WG64_4_1_WGM15
    SolutionIndex: 345
    SolutionNameMin: Cijk_Ailk_Bjlk_BBH_MT64x16x32_MI16x16x8x1_SE_AF0EM8_GRVW4_GSU1_SU0_SUS256_SRVW0_WG64_4_1_WGM1
    SolutionIndex: 346
    SolutionNameMin: Cijk_Ailk_Bjlk_BBH_MT64x32x16_MI16x16x8x1_SE_AF0EM8_GRVW4_GSU1_SU0_SUS256_SRVW4_WG32_8_1_WGM1
    SolutionIndex: 347
    SolutionNameMin: Cijk_Ailk_Bjlk_BBH_MT64x128x16_MI32x32x4x1_SE_AF0EM8_GRVW2_GSU1_SU32_SUS256_SRVW4_WG64_4_1_WGM1
    SolutionIndex: 348
    SolutionNameMin: Cijk_Ailk_Bjlk_BBH_MT128x64x16_MI32x32x4x1_SE_AF0EM8_GRVW2_GSU1_SU0_SUS256_SRVW4_WG64_4_1_WGM1
    SolutionIndex: 349
    SolutionNameMin: Cijk_Ailk_Bjlk_BBH_MT64x64x32_MI32x32x4x1_SE_AF0EM8_GRVW8_GSU1_SU32_SUS256_SRVW4_WG64_4_1_WGM15
    SolutionIndex: 350
    SolutionNameMin: Cijk_Ailk_Bjlk_BBH_MT64x64x64_MI32x32x4x1_SE_AF0EM8_GRVW8_GSU1_SU0_SUS256_SRVW4_WG64_4_1_WGM2
    SolutionIndex: 351
    SolutionNameMin: Cijk_Ailk_Bjlk_BBH_MT64x64x64_MI32x32x4x1_SE_AF0EM8_GRVW8_GSU1_SU32_SUS128_SRVW4_WG64_4_1_WGM2
    SolutionIndex: 352
    SolutionNameMin: Cijk_Ailk_Bjlk_BBH_MT64x32x64_MI16x16x8x1_SE_AF0EM8_GRVW8_GSU15_SU0_SUS256_SRVW0_WG32_8_1_WGM2
    SolutionIndex: 353
    SolutionNameMin: Cijk_Ailk_Bjlk_BBH_MT64x32x32_MI16x16x8x1_SE_AF0EM8_GRVW8_GSU15_SU32_SUS256_SRVW0_WG32_8_1_WGM2
    SolutionIndex: 354
    SolutionNameMin: Cijk_Ailk_Bjlk_BBH_MT64x64x64_MI32x32x4x1_SE_AF0EM8_GRVW8_GSU15_SU32_SUS128_SRVW0_WG64_4_1_WGM1
    SolutionIndex: 355
    SolutionNameMin: Cijk_Ailk_Bjlk_BBH_MT64x32x64_MI16x16x8x1_SE_AF0EM8_GRVW8_GSU15_SU32_SUS128_SRVW0_WG32_8_1_WGM2
    SolutionIndex: 356
    SolutionNameMin: Cijk_Ailk_Bjlk_BBH_MT32x32x64_MI16x16x8x1_SE_AF0EM8_GRVW8_GSU1_SU32_SUS128_SRVW4_WG32_8_1_WGM2
    SolutionIndex: 357
    SolutionNameMin: Cijk_Ailk_Bjlk_BBH_MT64x32x16_MI16x16x8x1_SE_AF0EM8_GRVW2_GSU1_SU0_SUS256_SRVW4_WG32_8_1_WGM1
    SolutionIndex: 358
    SolutionNameMin: Cijk_Ailk_Bjlk_BBH_MT32x64x16_MI16x16x8x1_SE_AF0EM8_GRVW4_GSU1_SU0_SUS256_SRVW4_WG32_8_1_WGM1
    SolutionIndex: 359
    SolutionNameMin: Cijk_Ailk_Bjlk_BBH_MT32x32x32_MI16x16x8x1_SE_AF0EM8_GRVW8_GSU1_SU0_SUS256_SRVW4_WG32_8_1_WGM1
    SolutionIndex: 360
    SolutionNameMin: Cijk_Ailk_Bjlk_BBH_MT32x64x64_MI16x16x8x1_SE_AF0EM8_GRVW8_GSU1_SU32_SUS128_SRVW4_WG32_8_1_WGM1
    SolutionIndex: 361
    SolutionNameMin: Cijk_Ailk_Bjlk_BBH_MT96x128x32_MI32x32x4x1_SE_AF0EM8_GRVW4_GSU3_SU0_SUS256_SRVW0_WG32_8_1_WGM1
    SolutionIndex: 362
    SolutionNameMin: Cijk_Ailk_Bjlk_BBH_MT32x64x32_MI16x16x8x1_SE_AF0EM8_GRVW8_GSU1_SU0_SUS256_SRVW4_WG32_8_1_WGM15
    SolutionIndex: 363
    SolutionNameMin: Cijk_Ailk_Bjlk_BBH_MT32x64x64_MI16x16x8x1_SE_AF0EM8_GRVW8_GSU3_SU32_SUS128_SRVW0_WG32_8_1_WGM1
    SolutionIndex: 364
    SolutionNameMin: Cijk_Ailk_Bjlk_BBH_MT32x64x64_MI16x16x8x1_SE_AF0EM8_GRVW8_GSU3_SU0_SUS256_SRVW0_WG32_8_1_WGM15
    SolutionIndex: 365
    SolutionNameMin: Cijk_Ailk_Bjlk_BBH_MT128x64x64_MI32x32x4x1_SE_AF0EM8_GRVW4_GSU7_SU32_SUS128_SRVW0_WG64_4_1_WGM1
    SolutionIndex: 366
    SolutionNameMin: Cijk_Ailk_Bjlk_BBH_MT64x64x64_MI32x32x4x1_SE_AF0EM8_GRVW8_GSU3_SU32_SUS256_SRVW0_WG64_4_1_WGM1
    SolutionIndex: 367
    SolutionNameMin: Cijk_Ailk_Bjlk_BBH_MT32x32x64_MI16x16x8x1_SE_AF0EM8_GRVW8_GSU1_SU32_SUS128_SRVW4_WG32_8_1_WGM1
    SolutionIndex: 368
    SolutionNameMin: Cijk_Ailk_Bjlk_BBH_MT128x96x32_MI32x32x4x1_SE_AF0EM8_GRVW4_GSU1_SU32_SUS128_SRVW4_WG128_2_1_WGM1
    SolutionIndex: 369
    SolutionNameMin: Cijk_Ailk_Bjlk_BBH_MT128x96x32_MI32x32x4x1_SE_AF0EM8_GRVW4_GSU1_SU32_SUS256_SRVW4_WG128_2_1_WGM15
    SolutionIndex: 370
    SolutionNameMin: Cijk_Ailk_Bjlk_BBH_MT32x32x16_MI16x16x8x1_SE_AF0EM8_GRVW4_GSU1_SU0_SUS256_SRVW4_WG32_8_1_WGM1
    SolutionIndex: 371
    SolutionNameMin: Cijk_Ailk_Bjlk_BBH_MT32x64x16_MI16x16x8x1_SE_AF0EM8_GRVW8_GSU1_SU0_SUS256_SRVW4_WG32_8_1_WGM15
    SolutionIndex: 372
    SolutionNameMin: Cijk_Ailk_Bjlk_BBH_MT64x128x16_MI32x32x4x1_SE_AF0EM8_GRVW2_GSU1_SU0_SUS256_SRVW4_WG64_4_1_WGM2
    SolutionIndex: 373
    SolutionNameMin: Cijk_Ailk_Bjlk_BBH_MT16x64x32_MI16x16x8x1_SE_AF0EM8_GRVW2_GSU1_SU0_SUS256_SRVW0_WG16_16_1_WGM2
    SolutionIndex: 374
    SolutionNameMin: Cijk_Ailk_Bjlk_BBH_MT128x64x16_MI32x32x4x1_SE_AF0EM8_GRVW4_GSU1_SU0_SUS256_SRVW4_WG64_4_1_WGM2
    SolutionIndex: 375
    SolutionNameMin: Cijk_Ailk_Bjlk_BBH_MT128x96x16_MI32x32x4x1_SE_AF0EM8_GRVW2_GSU1_SU32_SUS128_SRVW4_WG128_2_1_WGM2
    SolutionIndex: 376
    SolutionNameMin: Cijk_Ailk_Bjlk_BBH_MT128x64x16_MI32x32x4x1_SE_AF0EM8_GRVW8_GSU1_SU0_SUS256_SRVW4_WG64_4_1_WGM15
    SolutionIndex: 377
    SolutionNameMin: Cijk_Ailk_Bjlk_BBH_MT16x64x64_MI16x16x8x1_SE_AF0EM1_GRVW8_GSU15_SU0_SUS256_SRVW0_WG16_16_1_WGM2
    SolutionIndex: 378
    SolutionNameMin: Cijk_Ailk_Bjlk_BBH_MT96x128x64_MI32x32x4x1_SE_AF0EM1_GRVW8_GSU3_SU32_SUS128_SRVW0_WG32_8_1_WGM2
    SolutionIndex: 379
    SolutionNameMin: Cijk_Ailk_Bjlk_BBH_MT16x16x16_MI16x16x8x1_SE_AF0EM1_GRVW2_GSU1_SU32_SUS128_SRVW0_WG16_4_1_WGM1
    SolutionIndex: 380
    SolutionNameMin: Cijk_Ailk_Bjlk_BBH_MT16x16x16_MI16x16x8x1_SE_AF0EM1_GRVW2_GSU1_SU0_SUS256_SRVW0_WG16_4_1_WGM1
    SolutionIndex: 381
    SolutionNameMin: Cijk_Ailk_Bjlk_BBH_MT16x16x16_MI16x16x8x1_SE_AF0EM1_GRVW2_GSU1_SU32_SUS256_SRVW0_WG16_4_1_WGM2
    SolutionIndex: 382
    SolutionNameMin: Cijk_Ailk_Bjlk_BBH_MT16x16x16_MI16x16x8x1_SE_AF0EM1_GRVW2_GSU1_SU32_SUS128_SRVW0_WG16_4_1_WGM15
    SolutionIndex: 383
    SolutionNameMin: Cijk_Ailk_Bjlk_BBH_MT32x64x16_MI16x16x8x1_SE_AF0EM1_GRVW2_GSU1_SU32_SUS128_SRVW4_WG32_8_1_WGM2
    SolutionIndex: 384
    SolutionNameMin: Cijk_Ailk_Bjlk_BBH_MT32x32x64_MI16x16x8x1_SE_AF0EM1_GRVW8_GSU15_SU0_SUS256_SRVW0_WG32_8_1_WGM1
    SolutionIndex: 385
    SolutionNameMin: Cijk_Ailk_Bjlk_BBH_MT32x32x64_MI16x16x8x1_SE_AF0EM1_GRVW4_GSU15_SU0_SUS256_SRVW0_WG32_8_1_WGM1
    SolutionIndex: 386
    SolutionNameMin: Cijk_Ailk_Bjlk_BBH_MT16x64x64_MI16x16x8x1_SE_AF0EM1_GRVW8_GSU15_SU0_SUS256_SRVW0_WG16_16_1_WGM1
    SolutionIndex: 387
    SolutionNameMin: Cijk_Ailk_Bjlk_BBH_MT32x32x64_MI16x16x8x1_SE_AF0EM1_GRVW8_GSU15_SU0_SUS256_SRVW0_WG32_8_1_WGM15
    SolutionIndex: 388
    SolutionNameMin: Cijk_Ailk_Bjlk_BBH_MT16x16x64_MI16x16x8x1_SE_AF0EM1_GRVW8_GSU1_SU0_SUS256_SRVW0_WG16_4_1_WGM1
    SolutionIndex: 389
    SolutionNameMin: Cijk_Ailk_Bjlk_BBH_MT128x128x16_MI32x32x4x1_SE_1LDSB0_GRVW8_NLCA1_NLCB1_SU0_SUS256_SRVW4_TT2_64_WG64_4_1_WGM1
    SolutionIndex: 390
    SolutionNameMin: Cijk_Ailk_Bjlk_BBH_MT64x128x16_MI32x32x4x1_SE_1LDSB0_GRVW8_NLCA1_NLCB1_SU0_SUS256_SRVW4_TT1_64_WG64_4_1_WGM1
    SolutionIndex: 391
    SolutionNameMin: Cijk_Ailk_Bjlk_BBH_MT128x128x16_MI32x32x4x1_SE_1LDSB1_GRVW8_NLCA1_NLCB1_SU0_SUS256_SRVW4_TT2_64_WG64_4_1_WGM1
    SolutionIndex: 392
    SolutionNameMin: Cijk_Ailk_Bjlk_BBH_MT128x128x16_MI32x32x4x1_SE_1LDSB1_GRVW8_NLCA1_NLCB1_SU32_SUS256_SRVW4_TT2_64_WG64_4_1_WGM2
    SolutionIndex: 393
    SolutionNameMin: Cijk_Ailk_Bjlk_BBH_MT64x128x16_MI32x32x4x1_SE_1LDSB0_GRVW8_NLCA1_NLCB1_SU32_SUS256_SRVW4_TT1_64_WG64_4_1_WGM1
    SolutionIndex: 394
    SolutionNameMin: Cijk_Ailk_Bjlk_BBH_MT128x128x16_MI32x32x4x1_SE_1LDSB0_GRVW8_NLCA1_NLCB1_SU32_SUS128_SRVW4_TT2_64_WG64_4_1_WGM2
    SolutionIndex: 395
    SolutionNameMin: Cijk_Ailk_Bjlk_BBH_MT64x128x16_MI32x32x4x1_SE_1LDSB0_GRVW8_NLCA1_NLCB1_SU32_SUS128_SRVW4_TT1_64_WG64_4_1_WGM1
    SolutionIndex: 396
    SolutionNameMin: Cijk_Ailk_Bjlk_BBH_MT64x128x32_MI32x32x4x1_SE_1LDSB0_GRVW8_NLCA1_NLCB1_SU0_SUS256_SRVW4_TT1_64_WG64_4_1_WGM1
    SolutionIndex: 397
    SolutionNameMin: Cijk_Ailk_Bjlk_BBH_MT64x128x32_MI32x32x4x1_SE_1LDSB0_GRVW8_NLCA1_NLCB1_SU32_SUS128_SRVW4_TT1_64_WG64_4_1_WGM2
    SolutionIndex: 398
    SolutionNameMin: Cijk_Ailk_Bjlk_BBH_MT64x128x32_MI32x32x4x1_SE_1LDSB0_GRVW8_NLCA1_NLCB1_SU32_SUS256_SRVW4_TT1_64_WG64_4_1_WGM15
    SolutionIndex: 399
    SolutionNameMin: Cijk_Ailk_Bjlk_BBH_MT128x96x32_MI32x32x4x1_SE_1LDSB0_GRVW4_NLCA1_NLCB3_SU0_SUS256_SRVW4_TT1_96_WG128_2_1_WGM15
    SolutionIndex: 400
    SolutionNameMin: Cijk_Ailk_Bjlk_BBH_MT64x128x16_MI32x32x4x1_SE_1LDSB0_GRVW8_NLCA1_NLCB1_SU32_SUS128_SRVW4_TT1_64_WG64_4_1_WGM1
    SolutionIndex: 401
    SolutionNameMin: Cijk_Ailk_Bjlk_BBH_MT64x64x16_MI32x32x4x1_SE_1LDSB0_GRVW8_NLCA1_NLCB1_SU0_SUS256_SRVW4_TT1_32_WG64_4_1_WGM15
    SolutionIndex: 402
    SolutionNameMin: Cijk_Ailk_Bjlk_BBH_MT64x64x16_MI32x32x4x1_SE_1LDSB0_GRVW8_NLCA1_NLCB1_SU0_SUS256_SRVW4_TT1_32_WG64_4_1_WGM1
    SolutionIndex: 403
    SolutionNameMin: Cijk_Ailk_Bjlk_BBH_MT64x128x16_MI32x32x4x1_SE_1LDSB0_GRVW8_NLCA1_NLCB1_SU0_SUS256_SRVW4_TT1_64_WG64_4_1_WGM1
    SolutionIndex: 404
    SolutionNameMin: Cijk_Ailk_Bjlk_BBH_MT128x96x16_MI32x32x4x1_SE_1LDSB0_GRVW2_NLCA1_NLCB3_SU32_SUS256_SRVW4_TT1_96_WG128_2_1_WGM15
    SolutionIndex: 405
    SolutionNameMin: Cijk_Ailk_Bjlk_BBH_MT64x64x16_MI32x32x4x1_SE_1LDSB0_GRVW8_NLCA1_NLCB1_SU32_SUS256_SRVW4_TT1_32_WG64_4_1_WGM1
    SolutionIndex: 406
    SolutionNameMin: Cijk_Ailk_Bjlk_BBH_MT64x128x16_MI32x32x4x1_SE_1LDSB0_GRVW8_NLCA1_NLCB1_SU0_SUS256_SRVW4_TT1_64_WG64_4_1_WGM2
    SolutionIndex: 407
    SolutionNameMin: Cijk_Ailk_Bjlk_BBH_MT64x128x16_MI32x32x4x1_SE_1LDSB0_GRVW8_NLCA1_NLCB1_SU0_SUS256_SRVW4_TT1_64_WG64_4_1_WGM15
    SolutionIndex: 408
    SolutionNameMin: Cijk_Ailk_Bjlk_BBH_MT64x64x16_MI32x32x4x1_SE_1LDSB0_GRVW2_NLCA1_NLCB1_SU0_SUS256_SRVW4_TT1_32_WG64_4_1_WGM1
    SolutionIndex: 409
    SolutionNameMin: Cijk_Ailk_Bjlk_BBH_MT64x64x16_MI32x32x4x1_SE_1LDSB0_GRVW4_NLCA1_NLCB1_SU0_SUS256_SRVW4_TT1_32_WG64_4_1_WGM1
    SolutionIndex: 410
    SolutionNameMin: Cijk_Ailk_Bjlk_BBH_MT128x96x16_MI32x32x4x1_SE_1LDSB0_GRVW2_NLCA1_NLCB3_SU0_SUS256_SRVW4_TT1_96_WG128_2_1_WGM15
    SolutionIndex: 411
    SolutionNameMin: Cijk_Ailk_Bjlk_BBH_MT64x128x16_MI32x32x4x1_SE_1LDSB0_GRVW8_NLCA1_NLCB1_SU32_SUS256_SRVW4_TT1_64_WG64_4_1_WGM2
- - - [34, 64, 1, 34]
    - [10, 0.008]
  - - [32, 64, 1, 35]
    - [9, 0.006]
  - - [64, 21, 1, 17]
    - [6, 0.002]
  - - [64, 32, 1, 35]
    - [9, 0.006]
  - - [21, 64, 1, 21]
    - [8, 0.003]
  - - [64, 30, 1, 31]
    - [9, 0.005]
  - - [15, 64, 1, 15]
    - [2, 0.001]
  - - [64, 24, 1, 24]
    - [9, 0.004]
  - - [17, 64, 1, 15]
    - [13, 0.002]
  - - [64, 35, 1, 35]
    - [6, 0.006]
  - - [32, 64, 1, 32]
    - [10, 0.007]
  - - [64, 34, 1, 24]
    - [9, 0.005]
  - - [64, 15, 1, 15]
    - [4, 0.001]
  - - [30, 64, 1, 30]
    - [16, 0.006]
  - - [30, 64, 1, 31]
    - [13, 0.007]
  - - [34, 64, 1, 24]
    - [17, 0.007]
  - - [64, 30, 1, 30]
    - [9, 0.005]
  - - [14, 64, 1, 14]
    - [2, 0.001]
  - - [64, 17, 1, 17]
    - [3, 0.001]
  - - [64, 17, 1, 15]
    - [3, 0.001]
  - - [64, 32, 1, 32]
    - [7, 0.007]
  - - [64, 31, 1, 31]
    - [9, 0.005]
  - - [17, 64, 1, 17]
    - [8, 0.002]
  - - [64, 21, 1, 21]
    - [3, 0.002]
  - - [35, 64, 1, 35]
    - [10, 0.008]
  - - [31, 64, 1, 31]
    - [13, 0.007]
  - - [21, 64, 1, 17]
    - [10, 0.003]
  - - [64, 15, 1, 15]
    - [4, 0.001]
  - - [64, 17, 1, 17]
    - [3, 0.001]
  - - [17, 64, 1, 17]
    - [8, 0.002]
  - - [64, 34, 1, 34]
    - [18, 0.007]
  - - [15, 64, 1, 14]
    - [5, 0.001]
  - - [24, 64, 1, 24]
    - [10, 0.004]
  - - [64, 14, 1, 14]
    - [5, 0.001]
  - - [15, 64, 1, 15]
    - [2, 0.001]
  - - [64, 15, 1, 14]
    - [6, 0.001]
  - - [64, 128, 512, 128]
    - [249, 33.606]
  - - [64, 512, 1, 512]
    - [112, 3.108]
  - - [64, 512, 64, 512]
    - [142, 48.31]
  - - [128, 64, 512, 128]
    - [162, 33.383]
  - - [512, 64, 1, 512]
    - [131, 3.171]
  - - [512, 64, 64, 512]
    - [191, 48.544]
  - - [1024, 2, 1, 4]
    - [126, 0.003]
  - - [1024, 2, 1, 32]
    - [113, 0.021]
  - - [1024, 2, 1, 2048]
    - [299, 0.47]
  - - [1024, 1024, 1, 4]
    - [105, 1.006]
  - - [1024, 1024, 1, 32]
    - [265, 8.264]
  - - [1024, 1024, 1, 2048]
    - [184, 57.174]
  - - [1024, 1024, 1, 4096]
    - [161, 64.004]
  - - [1024, 4096, 1, 2048]
    - [104, 84.977]
  - - [1024, 4096, 1, 4096]
    - [215, 87.401]
  - - [1024, 30528, 1, 2048]
    - [308, 95.283]
  - - [1024, 30528, 1, 4096]
    - [307, 96.795]
  - - [4096, 1024, 1, 2048]
    - [198, 84.797]
  - - [4096, 1024, 1, 4096]
    - [198, 87.952]
  - - [3, 64, 512, 3]
    - [140, 0.064]
  - - [5, 64, 512, 5]
    - [206, 0.178]
  - - [5, 64, 960, 5]
    - [380, 0.277]
  - - [9, 64, 512, 9]
    - [140, 0.541]
  - - [13, 512, 1, 32768]
    - [377, 9.516]
  - - [27, 128, 32768, 27]
    - [383, 9.875]
  - - [33, 32, 200, 33]
    - [160, 1.693]
  - - [33, 32, 1600, 33]
    - [155, 5.018]
  - - [67, 2048, 1, 512]
    - [263, 10.354]
  - - [74, 2048, 1, 512]
    - [212, 11.258]
  - - [74, 2048, 1, 960]
    - [245, 14.183]
  - - [100, 2048, 1, 512]
    - [210, 13.919]
  - - [256, 128, 1, 32768]
    - [303, 37.99]
  - - [256, 1280, 1, 8976]
    - [313, 51.886]
  - - [256, 2560, 1, 8976]
    - [314, 59.45]
  - - [256, 2816, 1, 8976]
    - [224, 64.318]
  - - [256, 3328, 1, 8976]
    - [185, 75.214]
  - - [256, 3584, 1, 8976]
    - [178, 81.127]
  - - [256, 3840, 1, 8976]
    - [219, 86.061]
  - - [256, 4096, 1, 8976]
    - [159, 66.982]
  - - [256, 4352, 1, 8976]
    - [159, 71.495]
  - - [256, 4864, 1, 8976]
    - [232, 77.021]
  - - [256, 5120, 1, 8976]
    - [184, 81.106]
  - - [256, 5632, 1, 8976]
    - [156, 88.693]
  - - [256, 5888, 1, 8976]
    - [199, 71.716]
  - - [256, 6144, 1, 8976]
    - [266, 74.603]
  - - [256, 7168, 1, 8976]
    - [163, 86.694]
  - - [256, 8192, 1, 8976]
    - [315, 82.395]
  - - [256, 8960, 1, 8976]
    - [188, 86.753]
  - - [256, 9728, 1, 8976]
    - [156, 80.104]
  - - [256, 9984, 1, 8976]
    - [153, 82.544]
  - - [256, 10240, 1, 8976]
    - [156, 83.902]
  - - [256, 10496, 1, 8976]
    - [165, 85.952]
  - - [256, 11008, 1, 8976]
    - [184, 90.092]
  - - [256, 11264, 1, 8976]
    - [129, 92.134]
  - - [256, 11520, 1, 8976]
    - [153, 94.698]
  - - [256, 11776, 1, 8976]
    - [316, 78.267]
  - - [256, 12544, 1, 8976]
    - [316, 81.494]
  - - [256, 12800, 1, 8976]
    - [230, 80.355]
  - - [256, 13312, 1, 8976]
    - [118, 83.252]
  - - [256, 13568, 1, 8976]
    - [118, 84.878]
  - - [256, 14336, 1, 8976]
    - [317, 89.448]
  - - [256, 14848, 1, 8976]
    - [118, 92.495]
  - - [256, 15104, 1, 8976]
    - [163, 94.036]
  - - [256, 15872, 1, 8976]
    - [135, 87.561]
  - - [256, 16128, 1, 8976]
    - [153, 89.225]
  - - [256, 17152, 1, 8976]
    - [156, 94.368]
  - - [256, 17408, 1, 8976]
    - [229, 85.136]
  - - [256, 18688, 1, 8976]
    - [174, 91.034]
  - - [256, 19968, 1, 8976]
    - [318, 83.833]
  - - [256, 20480, 1, 8976]
    - [163, 85.874]
  - - [256, 20992, 1, 8976]
    - [319, 87.961]
  - - [256, 21248, 1, 8976]
    - [318, 88.981]
  - - [256, 22016, 1, 8976]
    - [320, 92.046]
  - - [256, 26112, 1, 8976]
    - [321, 90.779]
  - - [256, 32512, 1, 8976]
    - [135, 90.393]
  - - [256, 32768, 1, 1]
    - [162, 0.744]
  - - [256, 33536, 1, 8976]
    - [156, 93.155]
  - - [256, 44505, 1, 8976]
    - [294, 93.75]
  - - [257, 4096, 1, 1024]
    - [190, 42.565]
  - - [480, 1024, 1, 32768]
    - [322, 83.482]
  - - [512, 32, 1, 200]
    - [131, 0.681]
  - - [512, 32, 1, 1600]
    - [312, 2.836]
  - - [512, 256, 1, 32768]
    - [304, 62.219]
  - - [512, 512, 1, 200]
    - [209, 9.716]
  - - [512, 512, 1, 1600]
    - [268, 27.258]
  - - [512, 2048, 1, 256]
    - [259, 33.72]
  - - [560, 1024, 1, 200]
    - [180, 16.64]
  - - [560, 1024, 1, 1600]
    - [257, 43.366]
  - - [768, 2048, 1, 256]
    - [170, 43.065]
  - - [1024, 64, 1, 512]
    - [117, 6.28]
  - - [1024, 64, 1, 960]
    - [164, 8.011]
  - - [1024, 256, 1, 1024]
    - [196, 22.734]
  - - [1024, 256, 1, 1280]
    - [246, 25.324]
  - - [1024, 256, 1, 2304]
    - [109, 31.142]
  - - [1024, 256, 1, 2816]
    - [108, 33.374]
  - - [1024, 256, 1, 3072]
    - [172, 34.024]
  - - [1024, 256, 1, 3328]
    - [149, 35.267]
  - - [1024, 256, 1, 3584]
    - [172, 35.887]
  - - [1024, 256, 1, 4096]
    - [146, 36.942]
  - - [1024, 256, 1, 4352]
    - [138, 37.462]
  - - [1024, 256, 1, 4608]
    - [172, 38.127]
  - - [1024, 256, 1, 5120]
    - [146, 38.768]
  - - [1024, 256, 1, 5376]
    - [108, 39.019]
  - - [1024, 256, 1, 5632]
    - [137, 39.876]
  - - [1024, 256, 1, 6144]
    - [231, 39.98]
  - - [1024, 256, 1, 6400]
    - [146, 40.31]
  - - [1024, 256, 1, 7680]
    - [323, 42.244]
  - - [1024, 256, 1, 7936]
    - [324, 42.93]
  - - [1024, 256, 1, 8192]
    - [324, 43.593]
  - - [1024, 256, 1, 8448]
    - [323, 44.095]
  - - [1024, 256, 1, 9728]
    - [323, 46.612]
  - - [1024, 256, 1, 9984]
    - [323, 47.102]
  - - [1024, 256, 1, 10496]
    - [324, 47.951]
  - - [1024, 256, 1, 11520]
    - [323, 49.538]
  - - [1024, 256, 1, 12032]
    - [323, 49.945]
  - - [1024, 256, 1, 13568]
    - [325, 52.625]
  - - [1024, 256, 1, 14336]
    - [326, 53.735]
  - - [1024, 256, 1, 14848]
    - [327, 54.448]
  - - [1024, 256, 1, 15104]
    - [325, 54.894]
  - - [1024, 256, 1, 15872]
    - [326, 55.665]
  - - [1024, 256, 1, 16128]
    - [327, 56.282]
  - - [1024, 256, 1, 17152]
    - [328, 57.054]
  - - [1024, 256, 1, 17408]
    - [329, 57.439]
  - - [1024, 256, 1, 18944]
    - [325, 59.052]
  - - [1024, 256, 1, 19712]
    - [326, 59.555]
  - - [1024, 256, 1, 19968]
    - [327, 59.922]
  - - [1024, 256, 1, 21248]
    - [326, 61.001]
  - - [1024, 256, 1, 21504]
    - [326, 61.165]
  - - [1024, 256, 1, 22016]
    - [326, 61.656]
  - - [1024, 256, 1, 28672]
    - [330, 65.953]
  - - [1024, 256, 1, 33536]
    - [331, 69.135]
  - - [1024, 512, 1, 32768]
    - [305, 71.203]
  - - [1024, 1024, 1, 200]
    - [267, 26.885]
  - - [1024, 1024, 1, 512]
    - [204, 43.689]
  - - [1024, 1024, 1, 960]
    - [252, 51.059]
  - - [1024, 1024, 1, 1600]
    - [207, 54.802]
  - - [1024, 1024, 1, 32768]
    - [306, 74.235]
  - - [1600, 1024, 1, 512]
    - [234, 55.285]
  - - [1600, 1024, 1, 960]
    - [182, 63.858]
  - - [2048, 256, 1, 1024]
    - [261, 36.942]
  - - [2048, 960, 1, 1]
    - [173, 0.413]
  - - [2048, 2048, 1, 512]
    - [135, 69.419]
  - - [2048, 2048, 1, 960]
    - [107, 78.832]
  - - [2048, 2048, 1, 1024]
    - [135, 79.908]
  - - [3200, 2048, 1, 1024]
    - [332, 82.581]
  - - [4096, 4096, 1, 1024]
    - [333, 88.606]
  - - [14, 64, 10880, 14]
    - [379, 3.583]
  - - [15, 64, 10880, 14]
    - [380, 3.683]
  - - [15, 64, 7680, 15]
    - [381, 3.703]
  - - [15, 64, 10880, 15]
    - [382, 3.884]
  - - [17, 64, 7680, 15]
    - [167, 3.871]
  - - [17, 64, 6144, 17]
    - [151, 3.839]
  - - [17, 64, 7680, 17]
    - [236, 4.053]
  - - [21, 64, 6144, 17]
    - [145, 4.287]
  - - [21, 64, 6144, 21]
    - [169, 5.235]
  - - [24, 64, 4736, 24]
    - [202, 8.785]
  - - [30, 64, 2048, 30]
    - [233, 7.311]
  - - [30, 64, 2048, 31]
    - [154, 7.481]
  - - [31, 64, 2048, 31]
    - [143, 7.391]
  - - [32, 64, 4608, 32]
    - [197, 14.06]
  - - [32, 64, 4608, 35]
    - [110, 11.687]
  - - [34, 64, 4736, 24]
    - [214, 7.024]
  - - [34, 64, 4736, 34]
    - [140, 8.851]
  - - [35, 64, 4608, 35]
    - [140, 8.816]
  - - [64, 14, 10880, 14]
    - [311, 4.113]
  - - [64, 15, 10880, 14]
    - [264, 4.338]
  - - [64, 15, 7680, 15]
    - [168, 4.443]
  - - [64, 15, 10880, 15]
    - [168, 4.663]
  - - [64, 17, 7680, 15]
    - [168, 4.98]
  - - [64, 17, 6144, 17]
    - [124, 4.727]
  - - [64, 17, 7680, 17]
    - [217, 5.275]
  - - [64, 21, 6144, 17]
    - [114, 5.651]
  - - [64, 21, 6144, 21]
    - [124, 6.804]
  - - [64, 24, 4736, 24]
    - [114, 8.599]
  - - [64, 30, 2048, 30]
    - [168, 9.316]
  - - [64, 30, 2048, 31]
    - [168, 9.546]
  - - [64, 31, 2048, 31]
    - [228, 9.583]
  - - [64, 32, 4608, 32]
    - [227, 14.382]
  - - [64, 32, 4608, 35]
    - [141, 11.513]
  - - [64, 34, 4736, 24]
    - [183, 8.009]
  - - [64, 34, 4736, 34]
    - [176, 10.167]
  - - [64, 35, 4608, 35]
    - [166, 10.418]
  - - [1024, 1024, 1, 3840]
    - [115, 63.49]
  - - [1024, 1024, 1, 3968]
    - [106, 63.885]
  - - [1024, 1024, 1, 6528]
    - [116, 67.465]
  - - [1024, 1024, 1, 7104]
    - [159, 68.144]
  - - [1024, 1024, 1, 7200]
    - [116, 65.877]
  - - [1024, 1024, 1, 8064]
    - [161, 68.87]
  - - [1024, 1024, 1, 8160]
    - [161, 66.7]
  - - [1024, 1024, 1, 9216]
    - [106, 69.46]
  - - [1024, 1024, 1, 9520]
    - [127, 67.474]
  - - [1024, 1024, 1, 10064]
    - [159, 68.085]
  - - [1024, 1024, 1, 10080]
    - [127, 67.982]
  - - [1024, 1024, 1, 10200]
    - [159, 68.112]
  - - [1024, 4096, 1, 3840]
    - [107, 87.1]
  - - [1024, 4096, 1, 3968]
    - [104, 87.822]
  - - [1024, 4096, 1, 6528]
    - [104, 88.97]
  - - [1024, 4096, 1, 7104]
    - [104, 89.373]
  - - [1024, 4096, 1, 7200]
    - [107, 89.138]
  - - [1024, 4096, 1, 8064]
    - [107, 89.389]
  - - [1024, 4096, 1, 8160]
    - [107, 89.355]
  - - [1024, 4096, 1, 9216]
    - [107, 89.74]
  - - [1024, 4096, 1, 9520]
    - [181, 89.097]
  - - [1024, 4096, 1, 10064]
    - [181, 89.535]
  - - [1024, 4096, 1, 10080]
    - [158, 89.728]
  - - [1024, 4096, 1, 10200]
    - [104, 89.228]
  - - [1024, 42720, 1, 3968]
    - [129, 95.377]
  - - [1024, 42720, 1, 6528]
    - [153, 95.744]
  - - [1024, 42720, 1, 7104]
    - [153, 95.8]
  - - [1024, 42720, 1, 7200]
    - [153, 95.812]
  - - [1024, 42720, 1, 9520]
    - [153, 95.729]
  - - [1024, 42720, 1, 10080]
    - [153, 95.96]
  - - [4096, 1024, 1, 3840]
    - [198, 87.377]
  - - [4096, 1024, 1, 3968]
    - [309, 87.549]
  - - [4096, 1024, 1, 6528]
    - [208, 88.894]
  - - [4096, 1024, 1, 7104]
    - [104, 89.074]
  - - [4096, 1024, 1, 7200]
    - [107, 89.026]
  - - [4096, 1024, 1, 8064]
    - [107, 89.439]
  - - [4096, 1024, 1, 8160]
    - [104, 89.33]
  - - [4096, 1024, 1, 9216]
    - [125, 89.541]
  - - [4096, 1024, 1, 9520]
    - [310, 88.77]
  - - [4096, 1024, 1, 10064]
    - [125, 89.192]
  - - [4096, 1024, 1, 10080]
    - [107, 89.494]
  - - [4096, 1024, 1, 10200]
    - [157, 88.921]
  - - [27, 64, 1920, 27]
    - [41, 3.275]
  - - [27, 64, 1920, 33]
    - [39, 3.57]
  - - [33, 64, 1920, 33]
    - [24, 3.548]
  - - [64, 27, 1920, 27]
    - [31, 2.525]
  - - [64, 27, 1920, 33]
    - [38, 2.903]
  - - [64, 33, 1920, 33]
    - [21, 3.716]
  - - [1024, 1024, 1, 3240]
    - [43, 26.989]
  - - [1024, 1024, 1, 3960]
    - [33, 27.424]
  - - [1024, 4096, 1, 3240]
    - [44, 38.306]
  - - [1024, 4096, 1, 3960]
    - [32, 38.342]
  - - [1024, 42720, 1, 3960]
    - [40, 45.984]
  - - [4096, 1024, 1, 3240]
    - [30, 38.398]
  - - [4096, 1024, 1, 3960]
    - [30, 38.589]
  - - [64, 1280, 64, 192]
    - [395, 50.376]
  - - [64, 1280, 64, 320]
    - [390, 58.805]
  - - [64, 1280, 64, 384]
    - [395, 60.876]
  - - [64, 1280, 64, 448]
    - [393, 63.074]
  - - [64, 2048, 64, 192]
    - [393, 53.26]
  - - [64, 2048, 64, 320]
    - [275, 60.753]
  - - [64, 2048, 64, 384]
    - [275, 64.002]
  - - [64, 2048, 64, 448]
    - [273, 66.609]
  - - [1225, 192, 64, 32]
    - [401, 21.777]
  - - [1225, 192, 64, 48]
    - [402, 28.652]
  - - [1225, 192, 64, 64]
    - [402, 34.085]
  - - [1225, 256, 64, 48]
    - [403, 30.613]
  - - [1225, 256, 64, 64]
    - [400, 37.216]
  - - [1225, 288, 64, 48]
    - [404, 31.499]
  - - [1225, 288, 64, 64]
    - [404, 38.583]
  - - [5329, 64, 64, 80]
    - [405, 36.114]
  - - [289, 768, 64, 128]
    - [406, 47.596]
  - - [289, 768, 64, 160]
    - [407, 52.518]
  - - [289, 768, 64, 192]
    - [403, 55.911]
  - - [64, 1280, 32, 192]
    - [287, 42.056]
  - - [64, 1280, 32, 320]
    - [390, 51.648]
  - - [64, 1280, 32, 384]
    - [395, 54.611]
  - - [64, 1280, 32, 448]
    - [278, 56.798]
  - - [64, 2048, 32, 192]
    - [393, 45.399]
  - - [64, 2048, 32, 320]
    - [278, 53.563]
  - - [64, 2048, 32, 384]
    - [273, 56.664]
  - - [64, 2048, 32, 448]
    - [275, 59.813]
  - - [1225, 192, 32, 32]
    - [276, 17.678]
  - - [1225, 192, 32, 48]
    - [402, 23.478]
  - - [1225, 192, 32, 64]
    - [276, 28.713]
  - - [1225, 256, 32, 48]
    - [408, 25.468]
  - - [1225, 256, 32, 64]
    - [409, 31.305]
  - - [1225, 288, 32, 48]
    - [404, 24.206]
  - - [1225, 288, 32, 64]
    - [410, 30.321]
  - - [5329, 64, 32, 80]
    - [409, 32.814]
  - - [289, 768, 32, 128]
    - [406, 40.903]
  - - [289, 768, 32, 160]
    - [411, 45.062]
  - - [289, 768, 32, 192]
    - [406, 49.084]
  - - [3136, 64, 64, 256]
    - [290, 58.173]
  - - [3136, 64, 64, 64]
    - [280, 35.866]
  - - [3136, 256, 64, 64]
    - [389, 56.465]
  - - [784, 128, 64, 512]
    - [273, 71.152]
  - - [784, 512, 64, 128]
    - [389, 63.647]
  - - [196, 256, 64, 1024]
    - [283, 54.903]
  - - [196, 1024, 64, 256]
    - [277, 57.682]
  - - [49, 512, 64, 2048]
    - [270, 45.624]
  - - [49, 2048, 64, 512]
    - [400, 45.827]
  - - [3136, 64, 32, 256]
    - [285, 54.178]
  - - [3136, 64, 32, 64]
    - [289, 29.704]
  - - [3136, 256, 32, 64]
    - [395, 50.448]
  - - [784, 128, 32, 512]
    - [278, 61.794]
  - - [784, 512, 32, 128]
    - [390, 57.412]
  - - [196, 256, 32, 1024]
    - [279, 47.126]
  - - [196, 1024, 32, 256]
    - [286, 49.396]
  - - [49, 512, 32, 2048]
    - [270, 38.562]
  - - [49, 2048, 32, 512]
    - [270, 41.642]
  - - [3136, 64, 64, 128]
    - [280, 46.91]
  - - [3136, 128, 64, 256]
    - [389, 79.931]
  - - [784, 256, 64, 512]
    - [390, 79.058]
  - - [3136, 256, 64, 128]
    - [391, 75.984]
  - - [3136, 256, 64, 256]
    - [392, 85.929]
  - - [196, 512, 64, 1024]
    - [396, 62.771]
  - - [784, 512, 64, 256]
    - [393, 75.057]
  - - [784, 512, 64, 512]
    - [390, 82.035]
  - - [196, 1024, 64, 512]
    - [291, 64.111]
  - - [196, 1024, 64, 1024]
    - [277, 67.209]
  - - [49, 1024, 64, 2048]
    - [397, 53.449]
  - - [49, 2048, 64, 1024]
    - [398, 54.611]
  - - [3136, 64, 32, 128]
    - [292, 42.271]
  - - [3136, 128, 32, 256]
    - [389, 72.579]
  - - [784, 256, 32, 512]
    - [390, 73.271]
  - - [3136, 256, 32, 128]
    - [394, 68.921]
  - - [3136, 256, 32, 256]
    - [391, 80.876]
  - - [196, 512, 32, 1024]
    - [284, 55.1]
  - - [784, 512, 32, 256]
    - [393, 70.662]
  - - [784, 512, 32, 512]
    - [390, 79.16]
  - - [196, 1024, 32, 512]
    - [269, 57.2]
  - - [196, 1024, 32, 1024]
    - [399, 62.803]
  - - [49, 1024, 32, 2048]
    - [274, 48.121]
  - - [49, 2048, 32, 1024]
    - [396, 48.5]
  - - [64, 128, 624, 128]
    - [103, 34.891]
  - - [1024, 1024, 1, 1024]
    - [207, 52.61]
  - - [1024, 1024, 1, 1280]
    - [119, 52.555]
  - - [1024, 1024, 1, 39]
    - [105, 8.601]
  - - [1024, 4096, 1, 2560]
    - [104, 85.737]
  - - [1024, 4096, 1, 1024]
    - [107, 79.2]
  - - [33, 32, 1, 33]
    - [126, 0.009]
  - - [1024, 2, 1, 4992]
    - [298, 0.886]
  - - [64, 128, 144, 128]
    - [111, 24.574]
  - - [512, 512, 1, 512]
    - [112, 17.944]
  - - [1024, 2, 1, 39]
    - [113, 0.022]
  - - [1024, 1024, 1, 8192]
    - [116, 68.795]
  - - [1024, 960, 1, 1024]
    - [258, 62.595]
  - - [1024, 1024, 1, 308]
    - [121, 32.324]
  - - [1024, 2, 1, 5]
    - [126, 0.003]
  - - [1024, 1024, 1, 4992]
    - [115, 65.886]
  - - [4096, 3840, 1, 4096]
    - [295, 97.18]
  - - [4096, 1024, 1, 3072]
    - [157, 86.407]
  - - [64, 512, 96, 512]
    - [218, 54.415]
  - - [1024, 1024, 1, 5248]
    - [115, 66.151]
  - - [4096, 1024, 1, 4992]
    - [125, 88.362]
  - - [1024, 1024, 1, 180]
    - [194, 24.878]
  - - [5, 64, 1, 5]
    - [193, 0.0]
  - - [4096, 1024, 1, 2560]
    - [125, 85.994]
  - - [1024, 33712, 1, 9600]
    - [307, 95.931]
  - - [64, 128, 640, 128]
    - [152, 35.184]
  - - [1024, 1024, 1, 5]
    - [221, 1.243]
  - - [4, 64, 32768, 4]
    - [130, 0.418]
  - - [1024, 2, 1, 40]
    - [113, 0.024]
  - - [1024, 30522, 1, 160]
    - [223, 74.166]
  - - [1024, 1024, 1, 800]
    - [253, 48.759]
  - - [1024, 1024, 1, 41]
    - [144, 8.56]
  - - [1024, 2, 1, 5248]
    - [299, 0.936]
  - - [4096, 4096, 1, 4096]
    - [296, 92.432]
  - - [1024, 30522, 1, 385]
    - [187, 86.125]
  - - [1024, 4096, 1, 9600]
    - [226, 89.717]
  - - [2048, 512, 1, 1]
    - [105, 0.273]
  - - [1024, 4096, 1, 1152]
    - [107, 80.245]
  - - [1024, 2, 1, 512]
    - [136, 0.178]
  - - [64, 4, 38400, 4]
    - [175, 0.437]
  - - [1024, 30522, 1, 180]
    - [187, 75.211]
  - - [4096, 1024, 1, 512]
    - [104, 70.024]
  - - [4096, 1024, 1, 1024]
    - [215, 78.967]
  - - [4, 64, 38400, 4]
    - [130, 0.421]
  - - [1024, 2, 1, 9]
    - [113, 0.006]
  - - [8192, 8192, 1, 8192]
    - [135, 95.991]
  - - [4096, 1024, 1, 1280]
    - [216, 80.97]
  - - [1024, 1024, 1, 3072]
    - [115, 61.647]
  - - [64, 128, 656, 128]
    - [200, 35.762]
  - - [1024, 4096, 1, 4992]
    - [107, 88.064]
  - - [1024, 1024, 1, 9]
    - [105, 2.209]
  - - [1024, 4096, 1, 512]
    - [107, 68.59]
  - - [64, 512, 16, 512]
    - [134, 29.554]
  - - [1024, 2, 1, 6]
    - [113, 0.004]
  - - [2048, 1920, 1, 2048]
    - [118, 91.294]
  - - [1024, 30522, 1, 780]
    - [189, 91.111]
  - - [64, 128, 128, 128]
    - [134, 22.632]
  - - [1024, 30522, 1, 800]
    - [301, 92.032]
  - - [960, 1024, 1, 1024]
    - [119, 66.109]
  - - [1024, 1024, 1, 6]
    - [105, 1.55]
  - - [8192, 7680, 1, 8192]
    - [294, 98.372]
  - - [1024, 2, 1, 1152]
    - [302, 0.29]
  - - [1024, 1024, 1, 2560]
    - [106, 59.318]
  - - [1024, 1024, 1, 77]
    - [162, 13.738]
  - - [1024, 1024, 1, 160]
    - [240, 27.305]
  - - [1024, 4096, 1, 8192]
    - [244, 89.419]
  - - [1024, 2, 1, 41]
    - [235, 0.024]
  - - [128, 64, 1, 128]
    - [139, 0.298]
  - - [480, 512, 1, 512]
    - [139, 21.217]
  - - [1024, 1024, 1, 462]
    - [242, 38.583]
  - - [1024, 1024, 1, 780]
    - [243, 45.696]
  - - [1024, 4096, 1, 5248]
    - [107, 88.371]
  - - [1024, 4096, 1, 1280]
    - [104, 81.036]
  - - [4096, 1024, 1, 9600]
    - [107, 89.644]
  - - [64, 512, 80, 512]
    - [200, 55.333]
  - - [4096, 1024, 1, 1152]
    - [171, 80.387]
  - - [1024, 1600, 1, 1]
    - [220, 0.379]
  - - [1024, 1024, 1, 820]
    - [207, 46.112]
  - - [1024, 2, 1, 2560]
    - [299, 0.567]
  - - [4096, 1024, 1, 5248]
    - [198, 88.334]
  - - [1024, 33712, 1, 8192]
    - [294, 95.838]
  - - [1024, 1024, 1, 385]
    - [128, 36.327]
  - - [1024, 1024, 1, 1]
    - [248, 0.27]
  - - [1024, 2, 1, 10]
    - [126, 0.006]
  - - [64, 4, 32768, 4]
    - [175, 0.433]
  - - [1024, 1024, 1, 10]
    - [105, 2.393]
  - - [1024, 2, 1, 5120]
    - [300, 0.904]
  - - [1920, 2048, 1, 2048]
    - [163, 91.405]
  - - [2048, 2048, 1, 2048]
    - [129, 85.428]
  - - [3840, 4096, 1, 4096]
    - [294, 97.18]
  - - [1024, 4096, 1, 5120]
    - [104, 88.416]
  - - [64, 128, 160, 128]
    - [134, 26.611]
  - - [1024, 30522, 1, 308]
    - [186, 83.801]
  - - [1024, 30522, 1, 820]
    - [186, 91.736]
  - - [1024, 30522, 1, 200]
    - [187, 77.021]
  - - [1024, 30522, 1, 462]
    - [187, 87.293]
  - - [1024, 2, 1, 1024]
    - [203, 0.258]
  - - [1024, 30522, 1, 77]
    - [255, 47.767]
  - - [1024, 1024, 1, 40]
    - [192, 8.626]
  - - [1024, 2, 1, 1]
    - [193, 0.0]
  - - [1024, 2, 1, 8]
    - [251, 0.006]
  - - [1024, 1024, 1, 8]
    - [195, 2.012]
  - - [1024, 1024, 1, 9600]
    - [260, 69.446]
  - - [4096, 1024, 1, 5120]
    - [107, 88.26]
  - - [1024, 4096, 1, 3072]
    - [215, 86.16]
  - - [1024, 1024, 1, 1152]
    - [262, 51.737]
  - - [512, 480, 1, 512]
    - [210, 20.659]
  - - [64, 128, 1, 128]
    - [112, 0.302]
  - - [1024, 1024, 1, 5120]
    - [159, 65.935]
  - - [1024, 2, 1, 3072]
    - [299, 0.633]
  - - [7680, 8192, 1, 8192]
    - [293, 98.329]
  - - [4096, 1024, 1, 8192]
    - [226, 89.431]
  - - [1024, 2, 1, 1280]
    - [297, 0.305]
  - - [479, 1024, 1, 32768]
    - [378, 80.585]
  - - [64, 1024, 32, 1024]
    - [119, 59.546]
  - - [2560, 1920, 1, 2048]
    - [120, 89.336]
  - - [1024, 3072, 1, 4096]
    - [338, 80.334]
  - - [2560, 2560, 1, 2048]
    - [123, 87.928]
  - - [2048, 2, 1, 2]
    - [126, 0.003]
  - - [1024, 64, 128, 1024]
    - [132, 75.058]
  - - [2048, 2048, 1, 2]
    - [133, 1.189]
  - - [1024, 64, 32, 1024]
    - [134, 60.533]
  - - [1024, 96, 64, 1024]
    - [135, 74.71]
  - - [1024, 30592, 1, 2048]
    - [308, 95.704]
  - - [1024, 3072, 1, 16384]
    - [336, 85.142]
  - - [6144, 1536, 1, 4096]
    - [317, 92.529]
  - - [1024, 1024, 1, 16]
    - [147, 4.55]
  - - [1536, 4608, 1, 8192]
    - [148, 92.604]
  - - [640, 2560, 1, 2048]
    - [150, 72.022]
  - - [1024, 4096, 1, 16384]
    - [158, 90.968]
  - - [64, 512, 40, 512]
    - [142, 46.868]
  - - [1024, 1024, 1, 16384]
    - [116, 71.234]
  - - [1536, 6144, 1, 4096]
    - [340, 92.708]
  - - [1024, 30592, 1, 4096]
    - [307, 96.779]
  - - [2560, 2560, 1, 4]
    - [162, 2.757]
  - - [1536, 1536, 1, 4096]
    - [174, 85.884]
  - - [2560, 7680, 1, 2048]
    - [307, 96.719]
  - - [64, 1024, 256, 1024]
    - [177, 77.725]
  - - [96, 1024, 64, 1024]
    - [341, 74.112]
  - - [1536, 50304, 1, 4096]
    - [307, 96.387]
  - - [2048, 8192, 1, 1024]
    - [318, 89.023]
  - - [1024, 30592, 1, 8192]
    - [307, 97.758]
  - - [512, 64, 256, 512]
    - [205, 63.447]
  - - [1024, 96, 128, 1024]
    - [179, 83.912]
  - - [64, 512, 128, 512]
    - [211, 56.532]
  - - [4096, 1024, 1, 16384]
    - [309, 90.171]
  - - [8192, 2048, 1, 1024]
    - [335, 88.678]
  - - [64, 1024, 64, 1024]
    - [150, 67.78]
  - - [1024, 50304, 1, 4096]
    - [129, 95.695]
  - - [1536, 4608, 1, 4096]
    - [156, 91.55]
  - - [512, 64, 128, 512]
    - [222, 55.903]
  - - [6144, 1536, 1, 8192]
    - [317, 93.353]
  - - [1024, 3072, 1, 8192]
    - [336, 82.96]
  - - [1536, 1536, 1, 8192]
    - [229, 89.43]
  - - [1536, 50304, 1, 8192]
    - [307, 96.756]
  - - [2560, 2, 1, 4]
    - [126, 0.006]
  - - [2048, 6144, 1, 1024]
    - [179, 87.251]
  - - [64, 1024, 128, 1024]
    - [237, 75.093]
  - - [1024, 64, 64, 1024]
    - [238, 67.102]
  - - [1024, 2, 1, 16]
    - [239, 0.012]
  - - [96, 1024, 128, 1024]
    - [342, 79.67]
  - - [2048, 30592, 1, 1024]
    - [334, 94.796]
  - - [64, 512, 256, 512]
    - [247, 63.951]
  - - [1536, 6144, 1, 8192]
    - [340, 93.462]
  - - [1024, 50304, 1, 2048]
    - [250, 94.519]
  - - [1024, 50304, 1, 8192]
    - [254, 96.213]
  - - [1024, 3072, 1, 2048]
    - [337, 76.658]
  - - [1024, 64, 256, 1024]
    - [344, 77.951]
  - - [1024, 50304, 1, 16384]
    - [343, 96.681]
  - - [512, 64, 40, 512]
    - [339, 45.675]
  - - [1024, 2, 1, 64]
    - [345, 0.033]
  - - [1024, 30528, 1, 8192]
    - [307, 97.49]
  - - [1024, 1024, 1, 64]
    - [346, 12.949]
  - - [64, 128, 1024, 128]
    - [347, 36.607]
  - - [128, 64, 1024, 128]
    - [348, 36.015]
  - - [1024, 1024, 1, 3456]
    - [342, 58.929]
  - - [1024, 1024, 1, 6912]
    - [342, 64.108]
  - - [1024, 1024, 1, 864]
    - [349, 47.498]
  - - [1024, 512, 1, 3456]
    - [350, 44.044]
  - - [1024, 512, 1, 4096]
    - [351, 44.511]
  - - [1024, 512, 1, 6912]
    - [350, 46.362]
  - - [1024, 512, 1, 864]
    - [349, 33.118]
  - - [256, 128, 1, 3456]
    - [352, 10.094]
  - - [256, 128, 1, 4096]
    - [353, 11.264]
  - - [256, 128, 1, 55296]
    - [354, 47.969]
  - - [256, 128, 1, 6912]
    - [355, 16.823]
  - - [256, 128, 1, 864]
    - [356, 2.864]
  - - [256, 3456, 1, 1]
    - [357, 0.207]
  - - [256, 4096, 1, 1]
    - [358, 0.24]
  - - [256, 6912, 1, 1]
    - [357, 0.341]
  - - [256, 864, 1, 1]
    - [359, 0.061]
  - - [480, 1024, 1, 3456]
    - [360, 41.615]
  - - [480, 1024, 1, 4096]
    - [361, 43.363]
  - - [480, 1024, 1, 6912]
    - [361, 55.779]
  - - [480, 1024, 1, 864]
    - [362, 32.05]
  - - [512, 256, 1, 3456]
    - [363, 22.608]
  - - [512, 256, 1, 4096]
    - [364, 24.568]
  - - [512, 256, 1, 55296]
    - [365, 70.727]
  - - [512, 256, 1, 6912]
    - [366, 31.696]
  - - [512, 256, 1, 864]
    - [367, 10.926]
  - - [30528, 1024, 1, 640]
    - [334, 90.015]
  - - [30528, 1024, 1, 1280]
    - [301, 93.862]
  - - [4096, 1024, 1, 10240]
    - [368, 89.21]
  - - [1024, 4096, 1, 10240]
    - [369, 89.648]
  - - [30528, 1024, 1, 1600]
    - [301, 94.437]
  - - [1024, 2, 1, 80]
    - [370, 0.036]
  - - [1024, 1024, 1, 10240]
    - [342, 66.0]
  - - [1024, 1024, 1, 80]
    - [371, 14.674]
  - - [64, 128, 1280, 128]
    - [372, 38.062]
  - - [128, 64, 1280, 128]
    - [348, 36.303]
  - - [1024, 4096, 1, 10496]
    - [310, 89.494]
  - - [30528, 1024, 1, 1640]
    - [301, 94.093]
  - - [4096, 1024, 1, 10496]
    - [309, 89.174]
  - - [1024, 1024, 1, 10496]
    - [342, 66.13]
  - - [1024, 1024, 1, 82]
    - [346, 13.873]
  - - [1024, 2, 1, 82]
    - [373, 0.034]
  - - [128, 64, 1312, 128]
    - [374, 37.102]
  - - [64, 128, 1312, 128]
    - [372, 38.26]
  - - [30528, 1024, 1, 160]
    - [375, 70.599]
  - - [1024, 4096, 1, 6144]
    - [309, 88.695]
  - - [30528, 1024, 1, 240]
    - [334, 78.625]
  - - [4096, 1024, 1, 6144]
    - [309, 88.647]
  - - [1024, 1024, 1, 12]
    - [357, 2.56]
  - - [1024, 2, 1, 12]
    - [357, 0.006]
  - - [1024, 1024, 1, 6144]
    - [310, 63.364]
  - - [64, 512, 192, 512]
    - [372, 59.576]
  - - [512, 64, 192, 512]
    - [376, 58.252]
  - - [13, 512, 1, 3456]
    - [384, 2.379]
  - - [13, 512, 1, 4096]
    - [385, 2.728]
  - - [13, 512, 1, 55296]
    - [386, 11.348]
  - - [13, 512, 1, 6912]
    - [387, 4.062]
  - - [13, 512, 1, 864]
    - [388, 0.511]
- null
