library/src/blas3/Tensile/Logic/asm_full/arcturus_Cijk_Ailk_Bjlk_ZB_GB.yaml
- {MinimumRequiredVersion: 4.25.0}
- arcturus
- gfx908
- [Device 7380, Device 7388, Device 738c, Device 7390]
    SolutionIndex: 0
    SolutionNameMin: Cijk_Ailk_Bjlk_ZB_GB_MT16x16x8_SN_NLCA1_NLCB1_TT2_2_WG8_8_1
    SolutionIndex: 1
    SolutionNameMin: Cijk_Ailk_Bjlk_ZB_GB_MT32x16x8_SN_NLCA1_NLCB1_TT2_2_WG16_8_1
    SolutionIndex: 2
    SolutionNameMin: Cijk_Ailk_Bjlk_ZB_GB_MT16x32x8_SN_NLCA1_NLCB1_TT2_2_WG8_16_1
    SolutionIndex: 3
    SolutionNameMin: Cijk_Ailk_Bjlk_ZB_GB_MT32x32x8_SN_NLCA1_NLCB1_TT2_2_WG16_16_1
- - - [32, 32, 8, 128, 32, 32, 32, 32]
    - [0, 49.0]
  - - [128, 128, 8, 128, 128, 128, 128, 128]
    - [1, 697.0]
  - - [256, 256, 8, 128, 256, 256, 256, 256]
    - [3, 1323.0]
  - - [512, 512, 8, 128, 512, 512, 512, 512]
    - [3, 1639.0]
  - - [32, 32, 8, 512, 32, 32, 32, 32]
    - [0, 70.0]
  - - [128, 128, 8, 512, 128, 128, 128, 128]
    - [2, 923.0]
  - - [256, 256, 8, 512, 256, 256, 256, 256]
    - [3, 1484.0]
  - - [512, 512, 8, 512, 512, 512, 512, 512]
    - [3, 1736.0]
  - - [32, 32, 8, 1024, 32, 32, 32, 32]
    - [0, 76.0]
  - - [128, 128, 8, 1024, 128, 128, 128, 128]
    - [1, 979.0]
  - - [256, 256, 8, 1024, 256, 256, 256, 256]
    - [3, 1516.0]
  - - [512, 512, 8, 1024, 512, 512, 512, 512]
    - [3, 1757.0]
  - - [32, 128, 8, 128, 32, 32, 32, 128]
    - [0, 193.0]
  - - [32, 256, 8, 128, 32, 32, 32, 256]
    - [3, 376.0]
  - - [32, 512, 8, 128, 32, 32, 32, 512]
    - [1, 694.0]
  - - [32, 128, 8, 512, 32, 32, 32, 128]
    - [2, 283.0]
  - - [32, 256, 8, 512, 32, 32, 32, 256]
    - [1, 556.0]
  - - [32, 512, 8, 512, 32, 32, 32, 512]
    - [2, 925.0]
  - - [32, 128, 8, 1024, 32, 32, 32, 128]
    - [0, 306.0]
  - - [32, 256, 8, 1024, 32, 32, 32, 256]
    - [1, 607.0]
  - - [32, 512, 8, 1024, 32, 32, 32, 512]
    - [2, 971.0]
  - - [128, 32, 8, 128, 128, 128, 128, 32]
    - [0, 190.0]
  - - [256, 32, 8, 128, 256, 256, 256, 32]
    - [3, 376.0]
  - - [512, 32, 8, 128, 512, 512, 512, 32]
    - [3, 692.0]
  - - [128, 32, 8, 512, 128, 128, 128, 32]
    - [0, 282.0]
  - - [256, 32, 8, 512, 256, 256, 256, 32]
    - [1, 565.0]
  - - [512, 32, 8, 512, 512, 512, 512, 32]
    - [2, 908.0]
  - - [128, 32, 8, 1024, 128, 128, 128, 32]
    - [0, 305.0]
  - - [256, 32, 8, 1024, 256, 256, 256, 32]
    - [1, 610.0]
  - - [512, 32, 8, 1024, 512, 512, 512, 32]
    - [2, 969.0]
- null
