library/src/blas3/Tensile/Logic/asm_full/arcturus_Cijk_Ailk_Bljk_HBH.yaml
- {MinimumRequiredVersion: 4.6.0}
- arcturus
- gfx908
- [Device 7380, Device 7388, Device 738c, Device 7390]
    SolutionIndex: 0
    SolutionNameMin: Cijk_Ailk_Bljk_HBH_MT032x032x16_PGR1_PLR1_TT04_04
    SolutionIndex: 1
    SolutionNameMin: Cijk_Ailk_Bljk_HBH_MT064x016x16_PGR1_PLR1_TT04_04
    SolutionIndex: 2
    SolutionNameMin: Cijk_Ailk_Bljk_HBH_MT032x016x16_PGR1_PLR1_TT02_02
    SolutionIndex: 3
    SolutionNameMin: Cijk_Ailk_Bljk_HBH_MT064x016x16_PGR1_PLR1_TT04_02
    SolutionIndex: 4
    SolutionNameMin: Cijk_Ailk_Bljk_HBH_MT064x008x16_PGR1_PLR1_TT02_02
    SolutionIndex: 5
    SolutionNameMin: Cijk_Ailk_Bljk_HBH_MT064x016x16_PGR1_PLR1_TT02_02
    SolutionIndex: 6
    SolutionNameMin: Cijk_Ailk_Bljk_HBH_MT128x016x16_PGR1_PLR1_TT04_02
    SolutionIndex: 7
    SolutionNameMin: Cijk_Ailk_Bljk_HBH_MT016x016x32_PGR1_PLR1_TT02_02
    SolutionIndex: 8
    SolutionNameMin: Cijk_Ailk_Bljk_HBH_MT032x008x32_PGR1_PLR1_TT02_02
    SolutionIndex: 9
    SolutionNameMin: Cijk_Ailk_Bljk_HBH_MT032x016x32_PGR1_PLR1_TT02_02
    SolutionIndex: 10
    SolutionNameMin: Cijk_Ailk_Bljk_HBH_MT064x016x32_PGR1_PLR1_TT04_02
    SolutionIndex: 11
    SolutionNameMin: Cijk_Ailk_Bljk_HBH_MT064x008x32_PGR1_PLR1_TT02_02
    SolutionIndex: 12
    SolutionNameMin: Cijk_Ailk_Bljk_HBH_MT064x016x32_PGR1_PLR1_TT02_02
    SolutionIndex: 13
    SolutionNameMin: Cijk_Ailk_Bljk_HBH_MT128x016x32_PGR1_PLR1_TT04_02
    SolutionIndex: 14
    SolutionNameMin: Cijk_Ailk_Bljk_HBH_MT032x008x64_PGR1_PLR1_TT02_02
    SolutionIndex: 15
    SolutionNameMin: Cijk_Ailk_Bljk_HBH_MT064x008x64_PGR1_PLR1_TT02_02
    SolutionIndex: 16
    SolutionNameMin: Cijk_Ailk_Bljk_HBH_MT032x032x08_PGR1_PLR1_TT04_04
    SolutionIndex: 17
    SolutionNameMin: Cijk_Ailk_Bljk_HBH_MT064x032x08_PGR1_PLR1_TT08_04
    SolutionIndex: 18
    SolutionNameMin: Cijk_Ailk_Bljk_HBH_MT032x016x16_PGR1_PLR1_TT04_02
    SolutionIndex: 19
    SolutionNameMin: Cijk_Ailk_Bljk_HBH_MT032x032x16_PGR1_PLR1_TT04_04
    SolutionIndex: 20
    SolutionNameMin: Cijk_Ailk_Bljk_HBH_MT064x064x16_PGR1_PLR1_TT08_08
    SolutionIndex: 21
    SolutionNameMin: Cijk_Ailk_Bljk_HBH_MT064x016x16_PGR1_PLR1_TT04_02
    SolutionIndex: 22
    SolutionNameMin: Cijk_Ailk_Bljk_HBH_MT064x016x16_PGR1_PLR1_TT02_02
    SolutionIndex: 23
    SolutionNameMin: Cijk_Ailk_Bljk_HBH_MT128x016x16_PGR1_PLR1_TT04_02
    SolutionIndex: 24
    SolutionNameMin: Cijk_Ailk_Bljk_HBH_MT064x016x16_PGR1_PLR1_TT04_04
    SolutionIndex: 25
    SolutionNameMin: Cijk_Ailk_Bljk_HBH_MT064x008x16_PGR1_PLR1_TT02_02
    SolutionIndex: 26
    SolutionNameMin: Cijk_Ailk_Bljk_HBH_MT016x016x24_PGR1_PLR1_TT02_02
    SolutionIndex: 27
    SolutionNameMin: Cijk_Ailk_Bljk_HBH_MT032x016x24_PGR1_PLR1_TT04_02
    SolutionIndex: 28
    SolutionNameMin: Cijk_Ailk_Bljk_HBH_MT032x032x24_PGR1_PLR1_TT04_04
    SolutionIndex: 29
    SolutionNameMin: Cijk_Ailk_Bljk_HBH_MT032x032x32_PGR1_PLR1_TT04_04
    SolutionIndex: 30
    SolutionNameMin: Cijk_Ailk_Bljk_HBH_MT064x016x32_PGR1_PLR1_TT02_02
    SolutionIndex: 31
    SolutionNameMin: Cijk_Ailk_Bljk_HBH_MT128x016x32_PGR1_PLR1_TT04_02
    SolutionIndex: 32
    SolutionNameMin: Cijk_Ailk_Bljk_HBH_MT032x008x32_PGR1_PLR1_TT02_02
    SolutionIndex: 33
    SolutionNameMin: Cijk_Ailk_Bljk_HBH_MT064x008x32_PGR1_PLR1_TT02_02
    SolutionIndex: 34
    SolutionNameMin: Cijk_Ailk_Bljk_HBH_MT032x008x64_PGR1_PLR1_TT02_02
    SolutionIndex: 35
    SolutionNameMin: Cijk_Ailk_Bljk_HBH_MT064x008x64_PGR1_PLR1_TT02_02
    SolutionIndex: 36
    SolutionNameMin: Cijk_Ailk_Bljk_HBH_MT064x064x08_PGR1_PLR1_TT04_04
    SolutionIndex: 37
    SolutionNameMin: Cijk_Ailk_Bljk_HBH_MT064x128x08_PGR1_PLR1_TT04_08
    SolutionIndex: 38
    SolutionNameMin: Cijk_Ailk_Bljk_HBH_MT128x064x08_PGR1_PLR1_TT08_04
    SolutionIndex: 39
    SolutionNameMin: Cijk_Ailk_Bljk_HBH_MT064x064x16_PGR1_PLR1_TT04_04
    SolutionIndex: 40
    SolutionNameMin: Cijk_Ailk_Bljk_HBH_MT064x128x16_PGR1_PLR1_TT04_08
    SolutionIndex: 41
    SolutionNameMin: Cijk_Ailk_Bljk_HBH_MT128x064x16_PGR1_PLR1_TT08_04
    SolutionIndex: 42
    SolutionNameMin: Cijk_Ailk_Bljk_HBH_MT128x128x16_PGR1_PLR1_TT08_08
    SolutionIndex: 43
    SolutionNameMin: Cijk_Ailk_Bljk_HBH_MT032x128x16_PGR0_PLR0_TT04_04
    SolutionIndex: 44
    SolutionNameMin: Cijk_Ailk_Bljk_HBH_MT064x064x04_PGR1_PLR1_TT04_04
    SolutionIndex: 45
    SolutionNameMin: Cijk_Ailk_Bljk_HBH_MT064x064x08_PGR1_PLR1_TT04_04
    SolutionIndex: 46
    SolutionNameMin: Cijk_Ailk_Bljk_HBH_MT064x064x16_PGR1_PLR1_TT04_04
    SolutionIndex: 47
    SolutionNameMin: Cijk_Ailk_Bljk_HBH_MT032x032x16_PGR1_PLR1_TT04_04
    SolutionIndex: 48
    SolutionNameMin: Cijk_Ailk_Bljk_HBH_MT064x016x16_PGR1_PLR1_TT04_04
    SolutionIndex: 49
    SolutionNameMin: Cijk_Ailk_Bljk_HBH_MT064x032x16_PGR1_PLR1_TT04_04
    SolutionIndex: 50
    SolutionNameMin: Cijk_Ailk_Bljk_HBH_MT032x032x32_PGR1_PLR1_TT04_04
    SolutionIndex: 51
    SolutionNameMin: Cijk_Ailk_Bljk_HBH_MT064x016x32_PGR1_PLR1_TT04_04
    SolutionIndex: 52
    SolutionNameMin: Cijk_Ailk_Bljk_HBH_MT064x032x32_PGR1_PLR1_TT04_04
    SolutionIndex: 53
    SolutionNameMin: Cijk_Ailk_Bljk_HBH_MT128x016x32_PGR1_PLR1_TT04_04
    SolutionIndex: 54
    SolutionNameMin: Cijk_Ailk_Bljk_HBH_MT128x032x32_PGR1_PLR1_TT04_04
    SolutionIndex: 55
    SolutionNameMin: Cijk_Ailk_Bljk_HBH_MT064x064x16_PGR1_PLR1_TT08_08
    SolutionIndex: 56
    SolutionNameMin: Cijk_Ailk_Bljk_HBH_MT128x128x16_PGR1_PLR1_TT08_08
    SolutionIndex: 57
    SolutionNameMin: Cijk_Ailk_Bljk_HBH_MT064x032x08_PGR1_PLR1_TT08_04
    SolutionIndex: 58
    SolutionNameMin: Cijk_Ailk_Bljk_HBH_MT064x064x08_PGR1_PLR1_TT08_08
    SolutionIndex: 59
    SolutionNameMin: Cijk_Ailk_Bljk_HBH_MT032x032x16_PGR1_PLR1_TT04_04
    SolutionIndex: 60
    SolutionNameMin: Cijk_Ailk_Bljk_HBH_MT064x032x16_PGR1_PLR1_TT08_04
    SolutionIndex: 61
    SolutionNameMin: Cijk_Ailk_Bljk_HBH_MT064x064x16_PGR1_PLR1_TT04_04
    SolutionIndex: 62
    SolutionNameMin: Cijk_Ailk_Bljk_HBH_MT128x064x16_PGR1_PLR1_TT08_04
    SolutionIndex: 63
    SolutionNameMin: Cijk_Ailk_Bljk_HBH_MT128x128x16_PGR1_PLR1_TT08_08
    SolutionIndex: 64
    SolutionNameMin: Cijk_Ailk_Bljk_HBH_MT064x032x16_PGR1_PLR1_TT04_04
    SolutionIndex: 65
    SolutionNameMin: Cijk_Ailk_Bljk_HBH_MT128x064x32_PGR1_PLR1_TT08_04
    SolutionIndex: 66
    SolutionNameMin: Cijk_Ailk_Bljk_HBH_MT128x032x32_PGR1_PLR1_TT04_04
    SolutionIndex: 67
    SolutionNameMin: Cijk_Ailk_Bljk_HBH_MT064x016x32_PGR1_PLR1_TT04_04
    SolutionIndex: 68
    SolutionNameMin: Cijk_Ailk_Bljk_HBH_MT064x064x16_PGR1_PLR1_TT08_08
    SolutionIndex: 69
    SolutionNameMin: Cijk_Ailk_Bljk_HBH_MT128x128x16_PGR1_PLR1_TT08_08
    SolutionIndex: 70
    SolutionNameMin: Cijk_Ailk_Bljk_HBH_MT064x064x32_PGR1_PLR1_TT08_08
    SolutionIndex: 71
    SolutionNameMin: Cijk_Ailk_Bljk_HBH_MT128x128x32_PGR1_PLR1_TT08_08
    SolutionIndex: 72
    SolutionNameMin: Cijk_Ailk_Bljk_HBH_MT128x128x32_PGR0_PLR1_TT08_08
    SolutionIndex: 73
    SolutionNameMin: Cijk_Ailk_Bljk_HBH_MT064x128x16_PGR1_PLR1_TT04_08
    SolutionIndex: 74
    SolutionNameMin: Cijk_Ailk_Bljk_HBH_MT128x064x16_PGR1_PLR1_TT08_04
    SolutionIndex: 75
    SolutionNameMin: Cijk_Ailk_Bljk_HBH_MT128x128x16_PGR1_PLR1_TT08_08
    SolutionIndex: 76
    SolutionNameMin: Cijk_Ailk_Bljk_HBH_MT128x064x16_PGR1_PLR1_TT04_08
    SolutionIndex: 77
    SolutionNameMin: Cijk_Ailk_Bljk_HBH_MT128x064x16_PGR1_PLR1_TT04_08
    SolutionIndex: 78
    SolutionNameMin: Cijk_Ailk_Bljk_HBH_MT128x064x32_PGR1_PLR1_TT04_04
    SolutionIndex: 79
    SolutionNameMin: Cijk_Ailk_Bljk_HBH_MT256x128x32_PGR1_PLR1_TT08_08
    SolutionIndex: 80
    SolutionNameMin: Cijk_Ailk_Bljk_HBH_MT128x064x16_PGR1_PLR0_TT04_08
    SolutionIndex: 81
    SolutionNameMin: Cijk_Ailk_Bljk_HBH_MT064x064x04_PGR0_PLR1_TT04_04
    SolutionIndex: 82
    SolutionNameMin: Cijk_Ailk_Bljk_HBH_MT064x128x08_PGR1_PLR0_TT04_08
    SolutionIndex: 83
    SolutionNameMin: Cijk_Ailk_Bljk_HBH_MT064x064x08_PGR1_PLR1_TT04_04
    SolutionIndex: 84
    SolutionNameMin: Cijk_Ailk_Bljk_HBH_MT064x064x16_PGR0_PLR1_TT04_04
    SolutionIndex: 85
    SolutionNameMin: Cijk_Ailk_Bljk_HBH_MT064x064x04_PGR0_PLR0_TT04_04
    SolutionIndex: 86
    SolutionNameMin: Cijk_Ailk_Bljk_HBH_MT064x064x04_PGR0_PLR1_TT04_04
    SolutionIndex: 87
    SolutionNameMin: Cijk_Ailk_Bljk_HBH_MT064x128x08_PGR1_PLR0_TT04_08
    SolutionIndex: 88
    SolutionNameMin: Cijk_Ailk_Bljk_HBH_MT064x064x08_PGR1_PLR1_TT04_04
    SolutionIndex: 89
    SolutionNameMin: Cijk_Ailk_Bljk_HBH_MT064x064x16_PGR1_PLR1_TT04_04
    SolutionIndex: 90
    SolutionNameMin: Cijk_Ailk_Bljk_HBH_MT128x064x16_EPS1_GRVW08_LPB00_PGR1_PLR1_SNLL1_TT08_08_VW08_WG16_08_01_WGM01
    SolutionIndex: 91
    SolutionNameMin: Cijk_Ailk_Bljk_HBH_MT064x128x16_EPS1_GRVW04_LPB04_PGR1_PLR1_SNLL1_TT08_04_VW04_WG08_32_01_WGM01
    SolutionIndex: 92
    SolutionNameMin: Cijk_Ailk_Bljk_HBH_MT128x064x16_EPS1_GRVW04_LPB04_PGR1_PLR1_SNLL1_TT08_04_VW04_WG16_16_01_WGM01
    SolutionIndex: 93
    SolutionNameMin: Cijk_Ailk_Bljk_HBH_MT128x128x16_EPS1_GRVW04_LPB04_PGR1_PLR1_SNLL1_TT08_08_VW04_WG16_16_01_WGM01
    SolutionIndex: 94
    SolutionNameMin: Cijk_Ailk_Bljk_HBH_MT064x128x16_EPS1_GRVW04_LPB04_PGR1_PLR1_SNLL1_TT08_04_VW04_WG08_32_01_WGM08
    SolutionIndex: 95
    SolutionNameMin: Cijk_Ailk_Bljk_HBH_MT128x064x16_EPS1_GRVW04_LPB04_PGR1_PLR1_SNLL1_TT08_04_VW04_WG16_16_01_WGM08
    SolutionIndex: 96
    SolutionNameMin: Cijk_Ailk_Bljk_HBH_MT256x064x16_EPS1_GRVW04_LPB04_PGR1_PLR1_SNLL1_TT08_08_VW04_WG32_08_01_WGM64
    SolutionIndex: 97
    SolutionNameMin: Cijk_Ailk_Bljk_HBH_MT064x128x32_EPS0_GRVW04_LPB04_PGR0_PLR0_SNLL0_TT08_04_VW04_WG08_32_01_WGM01
    SolutionIndex: 98
    SolutionNameMin: Cijk_Ailk_Bljk_HBH_MT064x064x32_EPS0_GRVW04_LPB04_PGR0_PLR0_SNLL0_TT04_04_VW04_WG16_16_01_WGM01
    SolutionIndex: 99
    SolutionNameMin: Cijk_Ailk_Bljk_HBH_MT128x064x32_EPS1_GRVW04_LPB04_PGR1_PLR1_SNLL1_TT08_04_VW04_WG16_16_01_WGM01
    SolutionIndex: 100
    SolutionNameMin: Cijk_Ailk_Bljk_HBH_MT128x064x32_EPS0_GRVW08_LPB08_PGR0_PLR1_SNLL0_TT08_08_VW08_WG16_08_01_WGM01
    SolutionIndex: 101
    SolutionNameMin: Cijk_Ailk_Bljk_HBH_MT64x128x16_MI32x32x4x2_SE_AF0EM1_ASEM1_GRVW2_ONLL0_SNLL0
    SolutionIndex: 102
    SolutionNameMin: Cijk_Ailk_Bljk_HBH_MT64x128x32_MI32x32x4x2_SE_AF0EM2_ASEM2_GRVW2_ONLL0_SNLL0
    SolutionIndex: 103
    SolutionNameMin: Cijk_Ailk_Bljk_HBH_MT64x128x16_MI32x32x4x2_SE_AF0EM2_ASEM1_GRVW2_ONLL1_SNLL1
    SolutionIndex: 104
    SolutionNameMin: Cijk_Ailk_Bljk_HBH_MT64x128x16_MI32x32x4x2_SE_AF0EM2_ASEM1_GRVW2_ONLL1_SNLL0
    SolutionIndex: 105
    SolutionNameMin: Cijk_Ailk_Bljk_HBH_MT32x256x16_MI32x32x4x2_SE_AF0EM2_ASEM2_GRVW4_ONLL1_SNLL0
    SolutionIndex: 106
    SolutionNameMin: Cijk_Ailk_Bljk_HBH_MT64x256x16_MI32x32x4x2_SE_AF0EM1_ASEM1_GRVW2_ONLL1_SNLL1
    SolutionIndex: 107
    SolutionIndex: 108
    SolutionIndex: 109
    SolutionIndex: 110
    SolutionIndex: 111
    SolutionIndex: 112
    SolutionIndex: 113
    SolutionIndex: 114
    SolutionIndex: 115
    SolutionIndex: 116
    SolutionIndex: 117
    SolutionIndex: 118
    SolutionIndex: 119
    SolutionIndex: 120
    SolutionIndex: 121
    SolutionIndex: 122
    SolutionIndex: 123
    SolutionIndex: 124
    SolutionIndex: 125
    SolutionIndex: 126
    SolutionIndex: 127
    SolutionIndex: 128
    SolutionIndex: 129
    SolutionIndex: 130
    SolutionIndex: 131
    SolutionIndex: 132
    SolutionIndex: 133
    SolutionIndex: 134
    SolutionIndex: 135
    SolutionIndex: 136
    SolutionIndex: 137
    SolutionIndex: 138
    SolutionIndex: 139
    SolutionIndex: 140
    SolutionIndex: 141
    SolutionIndex: 142
    SolutionIndex: 143
    SolutionIndex: 144
    SolutionIndex: 145
    SolutionIndex: 146
    SolutionIndex: 147
    SolutionIndex: 148
    SolutionIndex: 149
    SolutionIndex: 150
    SolutionIndex: 151
    SolutionIndex: 152
    SolutionIndex: 153
    SolutionIndex: 154
    SolutionIndex: 155
    SolutionIndex: 156
    SolutionIndex: 157
    SolutionIndex: 158
    SolutionIndex: 159
    SolutionIndex: 160
    SolutionIndex: 161
    SolutionIndex: 162
    SolutionIndex: 163
    SolutionIndex: 164
    SolutionIndex: 165
    SolutionIndex: 166
    SolutionIndex: 167
    SolutionIndex: 168
    SolutionIndex: 169
    SolutionIndex: 170
    SolutionIndex: 171
    SolutionIndex: 172
    SolutionIndex: 173
    SolutionIndex: 174
    SolutionIndex: 175
    SolutionIndex: 176
    SolutionIndex: 177
    SolutionIndex: 178
    SolutionIndex: 179
    SolutionIndex: 180
    SolutionIndex: 181
    SolutionIndex: 182
    SolutionIndex: 183
    SolutionIndex: 184
    SolutionIndex: 185
    SolutionIndex: 186
    SolutionIndex: 187
    SolutionIndex: 188
    SolutionIndex: 189
    SolutionIndex: 190
    SolutionIndex: 191
    SolutionIndex: 192
    SolutionIndex: 193
    SolutionIndex: 194
    SolutionIndex: 195
    SolutionIndex: 196
    SolutionIndex: 197
    SolutionIndex: 198
    SolutionIndex: 199
    SolutionIndex: 200
    SolutionIndex: 201
    SolutionIndex: 202
    SolutionIndex: 203
    SolutionIndex: 204
    SolutionIndex: 205
    SolutionIndex: 206
    SolutionIndex: 207
    SolutionIndex: 208
    SolutionIndex: 209
    SolutionIndex: 210
    SolutionIndex: 211
    SolutionIndex: 212
    SolutionIndex: 213
    SolutionIndex: 214
    SolutionIndex: 215
    SolutionIndex: 216
    SolutionIndex: 217
    SolutionIndex: 218
    SolutionIndex: 219
    SolutionIndex: 220
    SolutionIndex: 221
    SolutionIndex: 222
    SolutionIndex: 223
    SolutionIndex: 224
    SolutionIndex: 225
    SolutionIndex: 226
    SolutionIndex: 227
    SolutionIndex: 228
    SolutionIndex: 229
    SolutionIndex: 230
    SolutionIndex: 231
    SolutionIndex: 232
    SolutionIndex: 233
    SolutionIndex: 234
    SolutionIndex: 235
    SolutionIndex: 236
    SolutionIndex: 237
    SolutionIndex: 238
    SolutionIndex: 239
    SolutionIndex: 240
    SolutionIndex: 241
    SolutionIndex: 242
    SolutionIndex: 243
    SolutionIndex: 244
    SolutionIndex: 245
    SolutionIndex: 246
    SolutionIndex: 247
    SolutionIndex: 248
    SolutionIndex: 249
    SolutionIndex: 250
    SolutionIndex: 251
    SolutionIndex: 252
    SolutionIndex: 253
    SolutionIndex: 254
    SolutionIndex: 255
    SolutionIndex: 256
    SolutionIndex: 257
    SolutionIndex: 258
    SolutionIndex: 259
    SolutionIndex: 260
    SolutionIndex: 261
    SolutionIndex: 262
    SolutionIndex: 263
    SolutionIndex: 264
    SolutionIndex: 265
    SolutionIndex: 266
    SolutionIndex: 267
    SolutionIndex: 268
    SolutionIndex: 269
    SolutionIndex: 270
    SolutionIndex: 271
    SolutionIndex: 272
    SolutionIndex: 273
    SolutionIndex: 274
    SolutionIndex: 275
    SolutionIndex: 276
    SolutionIndex: 277
    SolutionIndex: 278
    SolutionIndex: 279
    SolutionNameMin: Cijk_Ailk_Bljk_HBH_MT64x128x32_MI32x32x4x2_SE_AF0EM4_GRVW2_LBSPP128_LPB4_NLCA1_SU0_SUS256_SRVW4_TT1_32_WG64_4_1_WGM1
    SolutionIndex: 280
    SolutionNameMin: Cijk_Ailk_Bljk_HBH_MT32x64x64_MI16x16x16x1_SE_AF0EM1_GRVW8_LBSPP128_LPB8_NLCA1_SU32_SUS128_SRVW0_TT1_32_WG32_8_1_WGM1
    SolutionIndex: 281
    SolutionNameMin: Cijk_Ailk_Bljk_HBH_MT64x128x32_MI32x32x4x2_SE_AF0EM4_GRVW4_LBSPP128_LPB4_NLCA1_SU16_SUS256_SRVW4_TT1_32_WG64_4_1_WGM15
    SolutionIndex: 282
    SolutionNameMin: Cijk_Ailk_Bljk_HBH_MT128x96x32_MI32x32x8x1_SE_AF0EM1_GRVW2_LBSPP128_LPB4_NLCA1_SU0_SUS256_SRVW4_TT1_96_WG128_2_1_WGM2
    SolutionIndex: 283
    SolutionNameMin: Cijk_Ailk_Bljk_HBH_MT32x32x32_MI16x16x16x1_SE_AF0EM1_GRVW2_LBSPP128_LPB4_NLCA1_SU0_SUS256_SRVW0_TT1_16_WG32_8_1_WGM1
    SolutionIndex: 284
    SolutionNameMin: Cijk_Ailk_Bljk_HBH_MT256x128x32_MI32x32x4x2_SE_AF0EM1_GRVW8_LBSPP128_LPB8_NLCA1_SU0_SUS256_SRVW4_TT2_64_WG128_2_1_WGM15
    SolutionIndex: 285
    SolutionNameMin: Cijk_Ailk_Bljk_HBH_MT256x144x32_MI16x16x16x1_SE_AF0EM4_GRVW2_LBSPP128_LPB4_NLCA2_SU16_SUS128_SRVW4_TT4_144_WG64_4_1_WGM15
    SolutionIndex: 286
    SolutionNameMin: Cijk_Ailk_Bljk_HBH_MT32x32x128_MI16x16x16x1_SE_AF0EM4_GRVW2_LBSPP256_LPB4_NLCA1_SU0_SUS256_SRVW0_TT1_16_WG32_8_1_WGM15
    SolutionIndex: 287
    SolutionNameMin: Cijk_Ailk_Bljk_HBH_MT32x64x128_MI16x16x16x1_SE_AF0EM4_GRVW8_LBSPP256_LPB8_NLCA1_SU32_SUS256_SRVW0_TT1_32_WG32_8_1_WGM2
    SolutionIndex: 288
    SolutionNameMin: Cijk_Ailk_Bljk_HBH_MT32x32x128_MI16x16x16x1_SE_AF0EM1_GRVW8_LBSPP256_LPB8_NLCA1_SU16_SUS256_SRVW0_TT1_16_WG32_8_1_WGM2
    SolutionIndex: 289
    SolutionNameMin: Cijk_Ailk_Bljk_HBH_MT64x80x64_MI16x16x16x1_SE_AF0EM4_GRVW4_LBSPP128_LPB4_NLCA1_SU0_SUS256_SRVW0_TT1_80_WG64_4_1_WGM1
    SolutionIndex: 290
    SolutionNameMin: Cijk_Ailk_Bljk_HBH_MT128x96x64_MI32x32x8x1_SE_AF0EM4_GRVW8_LBSPP128_LPB8_NLCA1_SU16_SUS128_SRVW0_TT1_96_WG128_2_1_WGM15
    SolutionIndex: 291
    SolutionNameMin: Cijk_Ailk_Bljk_HBH_MT128x128x32_MI32x32x8x1_SE_AF0EM4_GRVW8_LBSPP128_LPB8_NLCA1_SU0_SUS256_SRVW4_TT2_64_WG64_4_1_WGM15
    SolutionIndex: 292
    SolutionNameMin: Cijk_Ailk_Bljk_HBH_MT64x32x32_MI16x16x16x1_SE_AF0EM4_GRVW2_LBSPP128_LPB4_NLCA1_SU0_SUS256_SRVW0_TT2_16_WG32_8_1_WGM1
    SolutionIndex: 293
    SolutionNameMin: Cijk_Ailk_Bljk_HBH_MT128x96x64_MI32x32x8x1_SE_AF0EM1_GRVW8_LBSPP128_LPB8_NLCA1_SU0_SUS256_SRVW4_TT1_96_WG128_2_1_WGM15
    SolutionIndex: 294
    SolutionNameMin: Cijk_Ailk_Bljk_HBH_MT256x128x32_MI32x32x4x2_SE_AF0EM4_GRVW8_LBSPP128_LPB8_NLCA1_SU0_SUS256_SRVW4_TT2_64_WG128_2_1_WGM15
    SolutionIndex: 295
    SolutionNameMin: Cijk_Ailk_Bljk_HBH_MT128x96x32_MI32x32x8x1_SE_AF0EM4_GRVW4_LBSPP128_LPB4_NLCA1_SU0_SUS256_SRVW4_TT1_96_WG128_2_1_WGM2
    SolutionIndex: 296
    SolutionNameMin: Cijk_Ailk_Bljk_HBH_MT64x80x32_MI16x16x16x1_SE_AF0EM4_GRVW2_LBSPP128_LPB4_NLCA1_SU0_SUS256_SRVW4_TT1_80_WG64_4_1_WGM1
    SolutionIndex: 297
    SolutionNameMin: Cijk_Ailk_Bljk_HBH_MT256x128x32_MI32x32x4x2_SE_AF0EM4_GRVW8_LBSPP128_LPB8_NLCA1_SU16_SUS128_SRVW4_TT2_64_WG128_2_1_WGM2
    SolutionIndex: 298
    SolutionNameMin: Cijk_Ailk_Bljk_HBH_MT128x64x32_MI32x32x4x2_SE_AF0EM4_GRVW2_LBSPP128_LPB4_NLCA1_SU0_SUS256_SRVW4_TT1_32_WG128_2_1_WGM1
    SolutionIndex: 299
    SolutionNameMin: Cijk_Ailk_Bljk_HBH_MT128x256x32_MI32x32x4x2_SE_AF0EM1_GRVW8_LBSPP128_LPB8_NLCA1_SU32_SUS256_SRVW4_TT2_64_WG64_4_1_WGM15
    SolutionIndex: 300
    SolutionNameMin: Cijk_Ailk_Bljk_HBH_MT64x128x64_MI32x32x8x1_SE_AF0EM4_GRVW8_LBSPP128_LPB8_NLCA1_SU0_SUS256_SRVW4_TT1_64_WG64_4_1_WGM15
    SolutionIndex: 301
    SolutionNameMin: Cijk_Ailk_Bljk_HBH_MT128x96x64_MI32x32x8x1_SE_AF0EM4_GRVW4_LBSPP128_LPB4_NLCA1_SU16_SUS128_SRVW4_TT1_96_WG128_2_1_WGM15
    SolutionIndex: 302
    SolutionNameMin: Cijk_Ailk_Bljk_HBH_MT128x96x64_MI32x32x8x1_SE_AF0EM1_GRVW4_LBSPP128_LPB4_NLCA1_SU0_SUS256_SRVW0_TT1_96_WG128_2_1_WGM15
    SolutionIndex: 303
    SolutionNameMin: Cijk_Ailk_Bljk_HBH_MT128x160x32_MI32x32x8x1_SE_AF0EM4_GRVW2_LBSPP128_LPB4_NLCA1_SU32_SUS256_SRVW0_TT1_160_WG128_2_1_WGM15
    SolutionIndex: 304
    SolutionNameMin: Cijk_Ailk_Bljk_HBH_MT160x128x32_MI32x32x8x1_SE_AF0EM1_GRVW2_LBSPP128_LPB4_NLCA5_SU0_SUS256_SRVW0_TT5_32_WG32_8_1_WGM1
    SolutionIndex: 305
    SolutionNameMin: Cijk_Ailk_Bljk_HBH_MT128x96x64_MI32x32x8x1_SE_AF0EM4_GRVW8_LBSPP128_LPB8_NLCA1_SU0_SUS256_SRVW4_TT1_96_WG128_2_1_WGM2
    SolutionIndex: 306
    SolutionNameMin: Cijk_Ailk_Bljk_HBH_MT32x32x32_MI16x16x16x1_SE_AF0EM4_GRVW2_LBSPP128_LPB4_NLCA1_SU16_SUS128_SRVW0_TT1_16_WG32_8_1_WGM1
    SolutionIndex: 307
    SolutionNameMin: Cijk_Ailk_Bljk_HBH_MT32x64x128_MI16x16x16x1_SE_AF0EM1_GRVW2_LBSPP256_LPB4_NLCA1_SU32_SUS256_SRVW4_TT1_32_WG32_8_1_WGM15
    SolutionIndex: 308
    SolutionNameMin: Cijk_Ailk_Bljk_HBH_MT128x96x64_MI32x32x8x1_SE_AF0EM4_GRVW8_LBSPP128_LPB8_NLCA1_SU16_SUS128_SRVW4_TT1_96_WG128_2_1_WGM15
    SolutionIndex: 309
    SolutionNameMin: Cijk_Ailk_Bljk_HBH_MT128x96x32_MI32x32x8x1_SE_AF0EM4_GRVW4_LBSPP128_LPB4_NLCA1_SU32_SUS128_SRVW4_TT1_96_WG128_2_1_WGM2
    SolutionIndex: 310
    SolutionNameMin: Cijk_Ailk_Bljk_HBH_MT32x32x32_MI16x16x16x1_SE_AF0EM4_GRVW2_LBSPP128_LPB4_NLCA1_SU0_SUS256_SRVW0_TT1_16_WG32_8_1_WGM1
    SolutionIndex: 311
    SolutionNameMin: Cijk_Ailk_Bljk_HBH_MT256x128x32_MI32x32x4x2_SE_AF0EM1_GRVW4_LBSPP128_LPB4_NLCA1_SU0_SUS256_SRVW4_TT2_64_WG128_2_1_WGM15
    SolutionIndex: 312
    SolutionNameMin: Cijk_Ailk_Bljk_HBH_MT128x96x32_MI32x32x8x1_SE_AF0EM4_GRVW4_LBSPP128_LPB4_NLCA1_SU16_SUS128_SRVW4_TT1_96_WG128_2_1_WGM2
    SolutionIndex: 313
    SolutionNameMin: Cijk_Ailk_Bljk_HBH_MT32x32x128_MI16x16x16x1_SE_AF0EM4_GRVW8_LBSPP256_LPB8_NLCA1_SU16_SUS256_SRVW0_TT1_16_WG32_8_1_WGM1
    SolutionIndex: 314
    SolutionNameMin: Cijk_Ailk_Bljk_HBH_MT128x96x32_MI32x32x8x1_SE_AF0EM4_GRVW4_LBSPP128_LPB4_NLCA1_SU0_SUS256_SRVW4_TT1_96_WG128_2_1_WGM1
    SolutionIndex: 315
    SolutionNameMin: Cijk_Ailk_Bljk_HBH_MT64x128x32_MI32x32x4x2_SE_AF0EM4_GRVW8_LBSPP128_LPB8_NLCA1_SU0_SUS256_SRVW4_TT1_32_WG64_4_1_WGM1
    SolutionIndex: 316
    SolutionNameMin: Cijk_Ailk_Bljk_HBH_MT128x288x32_MI32x32x8x1_SE_AF0EM4_GRVW4_LBSPP128_LPB4_NLCA1_SU0_SUS256_SRVW4_TT1_288_WG128_2_1_WGM15
    SolutionIndex: 317
    SolutionNameMin: Cijk_Ailk_Bljk_HBH_MT128x96x32_MI32x32x8x1_SE_AF0EM4_GRVW4_LBSPP128_LPB4_NLCA1_SU0_SUS256_SRVW4_TT1_96_WG128_2_1_WGM15
    SolutionIndex: 318
    SolutionNameMin: Cijk_Ailk_Bljk_HBH_MT128x288x32_MI32x32x8x1_SE_AF0EM4_GRVW4_LBSPP128_LPB4_NLCA1_SU0_SUS256_SRVW4_TT1_288_WG128_2_1_WGM1
    SolutionIndex: 319
    SolutionNameMin: Cijk_Ailk_Bljk_HBH_MT32x32x128_MI16x16x16x1_SE_AF0EM1_GRVW2_LBSPP256_LPB4_NLCA1_SU16_SUS256_SRVW4_TT1_16_WG32_8_1_WGM15
    SolutionIndex: 320
    SolutionNameMin: Cijk_Ailk_Bljk_HBH_MT128x80x32_MI16x16x16x1_SE_AF0EM1_GRVW2_LBSPP128_LPB4_NLCA1_SU0_SUS256_SRVW4_TT2_80_WG64_4_1_WGM15
    SolutionIndex: 321
    SolutionNameMin: Cijk_Ailk_Bljk_HBH_MT128x160x32_MI32x32x8x1_SE_AF0EM1_GRVW4_LBSPP128_LPB4_NLCA1_SU0_SUS256_SRVW4_TT1_160_WG128_2_1_WGM15
    SolutionIndex: 322
    SolutionNameMin: Cijk_Ailk_Bljk_HBH_MT256x128x32_MI32x32x4x2_SE_AF0EM1_GRVW8_LBSPP128_LPB8_NLCA1_SU0_SUS256_SRVW4_TT2_64_WG128_2_1_WGM1
    SolutionIndex: 323
    SolutionNameMin: Cijk_Ailk_Bljk_HBH_MT256x128x32_MI32x32x4x2_SE_AF0EM4_GRVW8_LBSPP128_LPB8_NLCA1_SU32_SUS128_SRVW4_TT2_64_WG128_2_1_WGM2
    SolutionIndex: 324
    SolutionNameMin: Cijk_Ailk_Bljk_HBH_MT256x128x32_MI32x32x4x2_SE_AF0EM4_GRVW8_LBSPP128_LPB8_NLCA1_SU16_SUS256_SRVW4_TT2_64_WG128_2_1_WGM15
    SolutionIndex: 325
    SolutionNameMin: Cijk_Ailk_Bljk_HBH_MT128x96x64_MI32x32x8x1_SE_AF0EM1_GRVW8_LBSPP128_LPB8_NLCA1_SU0_SUS256_SRVW0_TT1_96_WG128_2_1_WGM2
    SolutionIndex: 326
    SolutionNameMin: Cijk_Ailk_Bljk_HBH_MT32x32x64_MI16x16x16x1_SE_AF0EM4_GRVW8_LBSPP128_LPB8_NLCA1_SU16_SUS128_SRVW0_TT1_16_WG32_8_1_WGM1
    SolutionIndex: 327
    SolutionNameMin: Cijk_Ailk_Bljk_HBH_MT32x32x32_MI16x16x16x1_SE_AF0EM4_GRVW2_LBSPP128_LPB4_NLCA1_SU32_SUS256_SRVW0_TT1_16_WG32_8_1_WGM1
    SolutionIndex: 328
    SolutionNameMin: Cijk_Ailk_Bljk_HBH_MT128x96x32_MI32x32x8x1_SE_AF0EM1_GRVW2_LBSPP128_LPB4_NLCA1_SU0_SUS256_SRVW4_TT1_96_WG128_2_1_WGM15
    SolutionIndex: 329
    SolutionNameMin: Cijk_Ailk_Bljk_HBH_MT256x128x32_MI32x32x4x2_SE_AF0EM4_GRVW4_LBSPP128_LPB4_NLCA1_SU16_SUS128_SRVW4_TT2_64_WG128_2_1_WGM2
    SolutionIndex: 330
    SolutionNameMin: Cijk_Ailk_Bljk_HBH_MT128x96x64_MI32x32x8x1_SE_AF0EM4_GRVW8_LBSPP128_LPB8_NLCA1_SU0_SUS256_SRVW4_TT1_96_WG128_2_1_WGM15
    SolutionIndex: 331
    SolutionNameMin: Cijk_Ailk_Bljk_HBH_MT128x80x32_MI16x16x16x1_SE_AF0EM4_GRVW2_LBSPP128_LPB4_NLCA1_SU16_SUS256_SRVW4_TT2_80_WG64_4_1_WGM2
    SolutionIndex: 332
    SolutionNameMin: Cijk_Ailk_Bljk_HBH_MT32x32x32_MI16x16x16x1_SE_AF0EM4_GRVW8_LBSPP128_LPB8_NLCA1_SU0_SUS256_SRVW4_TT1_16_WG32_8_1_WGM1
    SolutionIndex: 333
    SolutionNameMin: Cijk_Ailk_Bljk_HBH_MT256x128x32_MI32x32x8x1_SE_AF0EM4_GRVW8_LBSPP128_LPB8_NLCA1_SU16_SUS128_SRVW4_TT4_64_WG64_4_1_WGM2
    SolutionIndex: 334
    SolutionNameMin: Cijk_Ailk_Bljk_HBH_MT256x128x32_MI32x32x4x2_SE_AF0EM1_GRVW4_LBSPP128_LPB4_NLCA1_SU16_SUS128_SRVW4_TT2_64_WG128_2_1_WGM2
    SolutionIndex: 335
    SolutionNameMin: Cijk_Ailk_Bljk_HBH_MT128x96x32_MI32x32x8x1_SE_AF0EM4_GRVW2_LBSPP128_LPB4_NLCA1_SU0_SUS256_SRVW4_TT1_96_WG128_2_1_WGM15
    SolutionIndex: 336
    SolutionNameMin: Cijk_Ailk_Bljk_HBH_MT32x32x32_MI16x16x16x1_SE_AF0EM4_GRVW4_LBSPP128_LPB4_NLCA1_SU0_SUS256_SRVW0_TT1_16_WG32_8_1_WGM1
    SolutionIndex: 337
    SolutionNameMin: Cijk_Ailk_Bljk_HBH_MT64x128x32_MI32x32x4x2_SE_AF0EM4_GRVW4_LBSPP128_LPB4_NLCA1_SU16_SUS256_SRVW4_TT1_32_WG64_4_1_WGM2
    SolutionIndex: 338
    SolutionNameMin: Cijk_Ailk_Bljk_HBH_MT64x128x32_MI32x32x4x2_SE_AF0EM1_GRVW8_LBSPP128_LPB8_NLCA1_SU0_SUS256_SRVW4_TT1_32_WG64_4_1_WGM1
    SolutionIndex: 339
    SolutionNameMin: Cijk_Ailk_Bljk_HBH_MT32x64x64_MI16x16x16x1_SE_AF0EM4_GRVW8_LBSPP128_LPB8_NLCA1_SU0_SUS256_SRVW0_TT1_32_WG32_8_1_WGM2
    SolutionIndex: 340
    SolutionNameMin: Cijk_Ailk_Bljk_HBH_MT256x128x32_MI32x32x4x2_SE_AF0EM4_GRVW4_LBSPP128_LPB4_NLCA1_SU0_SUS256_SRVW4_TT2_64_WG128_2_1_WGM2
    SolutionIndex: 341
    SolutionNameMin: Cijk_Ailk_Bljk_HBH_MT128x96x64_MI32x32x8x1_SE_AF0EM4_GRVW8_LBSPP128_LPB8_NLCA1_SU16_SUS256_SRVW4_TT1_96_WG128_2_1_WGM15
    SolutionIndex: 342
    SolutionNameMin: Cijk_Ailk_Bljk_HBH_MT32x64x32_MI16x16x16x1_SE_AF0EM4_GRVW2_LBSPP128_LPB4_NLCA1_SU0_SUS256_SRVW0_TT1_32_WG32_8_1_WGM15
    SolutionIndex: 343
    SolutionNameMin: Cijk_Ailk_Bljk_HBH_MT256x128x32_MI32x32x4x2_SE_AF0EM4_GRVW4_LBSPP128_LPB4_NLCA1_SU0_SUS256_SRVW4_TT2_64_WG128_2_1_WGM15
    SolutionIndex: 344
    SolutionNameMin: Cijk_Ailk_Bljk_HBH_MT64x64x32_MI32x32x8x1_SE_AF0EM4_GRVW2_LBSPP128_LPB4_NLCA1_SU0_SUS256_SRVW4_TT1_32_WG64_4_1_WGM2
    SolutionIndex: 345
    SolutionNameMin: Cijk_Ailk_Bljk_HBH_MT64x128x64_MI32x32x8x1_SE_AF0EM4_GRVW8_LBSPP128_LPB8_NLCA1_SU16_SUS128_SRVW4_TT1_64_WG64_4_1_WGM2
    SolutionIndex: 346
    SolutionNameMin: Cijk_Ailk_Bljk_HBH_MT64x128x32_MI32x32x8x1_SE_AF0EM4_GRVW8_LBSPP128_LPB8_NLCA1_SU16_SUS128_SRVW4_TT1_64_WG64_4_1_WGM1
    SolutionIndex: 347
    SolutionNameMin: Cijk_Ailk_Bljk_HBH_MT128x96x32_MI32x32x8x1_SE_AF0EM4_GRVW4_LBSPP128_LPB4_NLCA1_SU16_SUS256_SRVW4_TT1_96_WG128_2_1_WGM15
    SolutionIndex: 348
    SolutionNameMin: Cijk_Ailk_Bljk_HBH_MT256x128x32_MI32x32x4x2_SE_AF0EM4_GRVW8_LBSPP128_LPB8_NLCA1_SU0_SUS256_SRVW4_TT2_64_WG128_2_1_WGM1
    SolutionIndex: 349
    SolutionNameMin: Cijk_Ailk_Bljk_HBH_MT64x128x64_MI32x32x8x1_SE_AF0EM4_GRVW8_LBSPP128_LPB8_NLCA1_SU0_SUS256_SRVW4_TT1_64_WG64_4_1_WGM1
    SolutionIndex: 350
    SolutionNameMin: Cijk_Ailk_Bljk_HBH_MT64x128x32_MI32x32x4x2_SE_AF0EM1_GRVW2_LBSPP128_LPB4_NLCA1_SU0_SUS256_SRVW0_TT1_32_WG64_4_1_WGM1
    SolutionIndex: 351
    SolutionNameMin: Cijk_Ailk_Bljk_HBH_MT128x256x32_MI32x32x4x2_SE_AF0EM1_GRVW8_LBSPP128_LPB8_NLCA1_SU16_SUS128_SRVW4_TT2_64_WG64_4_1_WGM2
    SolutionIndex: 352
    SolutionNameMin: Cijk_Ailk_Bljk_HBH_MT32x64x128_MI16x16x16x1_SE_AF0EM4_GRVW8_LBSPP256_LPB8_NLCA1_SU32_SUS256_SRVW4_TT1_32_WG32_8_1_WGM1
    SolutionIndex: 353
    SolutionNameMin: Cijk_Ailk_Bljk_HBH_MT256x128x32_MI32x32x4x2_SE_AF0EM4_GRVW8_LBSPP128_LPB8_NLCA1_SU0_SUS256_SRVW0_TT2_64_WG128_2_1_WGM1
    SolutionIndex: 354
    SolutionNameMin: Cijk_Ailk_Bljk_HBH_MT128x256x32_MI32x32x4x2_SE_AF0EM4_GRVW4_LBSPP128_LPB4_NLCA1_SU0_SUS256_SRVW4_TT2_64_WG64_4_1_WGM1
    SolutionIndex: 355
    SolutionNameMin: Cijk_Ailk_Bljk_HBH_MT64x32x128_MI16x16x16x1_SE_AF0EM1_GRVW2_LBSPP256_LPB4_NLCA1_SU32_SUS256_SRVW0_TT2_16_WG32_8_1_WGM15
    SolutionIndex: 356
    SolutionNameMin: Cijk_Ailk_Bljk_HBH_MT32x32x32_MI16x16x16x1_SE_AF0EM4_GRVW2_LBSPP128_LPB4_NLCA1_SU32_SUS128_SRVW0_TT1_16_WG32_8_1_WGM1
    SolutionIndex: 357
    SolutionNameMin: Cijk_Ailk_Bljk_HBH_MT32x32x32_MI16x16x16x1_SE_AF0EM4_GRVW8_LBSPP128_LPB8_NLCA1_SU0_SUS256_SRVW0_TT1_16_WG32_8_1_WGM15
    SolutionIndex: 358
    SolutionNameMin: Cijk_Ailk_Bljk_HBH_MT32x32x128_MI16x16x16x1_SE_AF0EM4_GRVW8_LBSPP256_LPB8_NLCA1_SU16_SUS256_SRVW4_TT1_16_WG32_8_1_WGM1
    SolutionIndex: 359
    SolutionNameMin: Cijk_Ailk_Bljk_HBH_MT256x128x32_MI32x32x4x2_SE_AF0EM4_GRVW8_LBSPP128_LPB8_NLCA1_SU32_SUS128_SRVW4_TT2_64_WG128_2_1_WGM1
    SolutionIndex: 360
    SolutionNameMin: Cijk_Ailk_Bljk_HBH_MT32x32x64_MI16x16x16x1_SE_AF0EM4_GRVW4_LBSPP128_LPB4_NLCA1_SU0_SUS256_SRVW0_TT1_16_WG32_8_1_WGM1
    SolutionIndex: 361
    SolutionNameMin: Cijk_Ailk_Bljk_HBH_MT128x160x32_MI32x32x8x1_SE_AF0EM4_GRVW4_LBSPP128_LPB4_NLCA1_SU0_SUS256_SRVW4_TT1_160_WG128_2_1_WGM2
    SolutionIndex: 362
    SolutionNameMin: Cijk_Ailk_Bljk_HBH_MT64x64x32_MI32x32x8x1_SE_AF0EM4_GRVW4_LBSPP128_LPB4_NLCA1_SU0_SUS256_SRVW0_TT1_32_WG64_4_1_WGM1
    SolutionIndex: 363
    SolutionNameMin: Cijk_Ailk_Bljk_HBH_MT32x64x32_MI16x16x16x1_SE_AF0EM4_GRVW4_LBSPP128_LPB4_NLCA1_SU32_SUS256_SRVW4_TT1_32_WG32_8_1_WGM1
    SolutionIndex: 364
    SolutionNameMin: Cijk_Ailk_Bljk_HBH_MT128x96x64_MI32x32x8x1_SE_AF0EM1_GRVW8_LBSPP128_LPB8_NLCA1_SU32_SUS256_SRVW4_TT1_96_WG128_2_1_WGM15
    SolutionIndex: 365
    SolutionNameMin: Cijk_Ailk_Bljk_HBH_MT128x96x32_MI32x32x8x1_SE_AF0EM1_GRVW2_LBSPP128_LPB4_NLCA1_SU0_SUS256_SRVW4_TT1_96_WG128_2_1_WGM1
    SolutionIndex: 366
    SolutionNameMin: Cijk_Ailk_Bljk_HBH_MT256x128x32_MI32x32x4x2_SE_AF0EM4_GRVW8_LBSPP128_LPB8_NLCA1_SU16_SUS128_SRVW4_TT2_64_WG128_2_1_WGM15
    SolutionIndex: 367
    SolutionNameMin: Cijk_Ailk_Bljk_HBH_MT128x288x32_MI32x32x8x1_SE_AF0EM1_GRVW4_LBSPP128_LPB4_NLCA1_SU32_SUS128_SRVW4_TT1_288_WG128_2_1_WGM15
    SolutionIndex: 368
    SolutionNameMin: Cijk_Ailk_Bljk_HBH_MT64x32x32_MI16x16x16x1_SE_AF0EM4_GRVW2_LBSPP128_LPB4_NLCA1_SU0_SUS256_SRVW0_TT2_16_WG32_8_1_WGM15
    SolutionIndex: 369
    SolutionNameMin: Cijk_Ailk_Bljk_HBH_MT128x96x64_MI32x32x8x1_SE_AF0EM4_GRVW8_LBSPP128_LPB8_NLCA1_SU32_SUS256_SRVW4_TT1_96_WG128_2_1_WGM15
    SolutionIndex: 370
    SolutionNameMin: Cijk_Ailk_Bljk_HBH_MT256x128x32_MI32x32x4x2_SE_AF0EM1_GRVW4_LBSPP128_LPB4_NLCA1_SU0_SUS256_SRVW4_TT2_64_WG128_2_1_WGM2
    SolutionIndex: 371
    SolutionNameMin: Cijk_Ailk_Bljk_HBH_MT256x128x32_MI32x32x4x2_SE_AF0EM1_GRVW8_LBSPP128_LPB8_NLCA1_SU16_SUS128_SRVW4_TT2_64_WG128_2_1_WGM1
    SolutionIndex: 372
    SolutionNameMin: Cijk_Ailk_Bljk_HBH_MT128x96x64_MI32x32x8x1_SE_AF0EM4_GRVW8_LBSPP128_LPB8_NLCA1_SU16_SUS256_SRVW0_TT1_96_WG128_2_1_WGM15
    SolutionIndex: 373
    SolutionNameMin: Cijk_Ailk_Bljk_HBH_MT256x144x32_MI16x16x16x1_SE_AF0EM4_GRVW2_LBSPP128_LPB4_NLCA2_SU16_SUS256_SRVW4_TT4_144_WG64_4_1_WGM2
    SolutionIndex: 374
    SolutionNameMin: Cijk_Ailk_Bljk_HBH_MT64x64x32_MI32x32x8x1_SE_AF0EM4_GRVW2_LBSPP128_LPB4_NLCA1_SU0_SUS256_SRVW0_TT1_32_WG64_4_1_WGM1
    SolutionIndex: 375
    SolutionNameMin: Cijk_Ailk_Bljk_HBH_MT64x128x64_MI32x32x8x1_SE_AF0EM4_GRVW8_LBSPP128_LPB8_NLCA1_SU16_SUS128_SRVW4_TT1_64_WG64_4_1_WGM15
    SolutionIndex: 376
    SolutionNameMin: Cijk_Ailk_Bljk_HBH_MT64x128x32_MI32x32x4x2_SE_AF0EM4_GRVW8_LBSPP128_LPB8_NLCA1_SU16_SUS128_SRVW4_TT1_32_WG64_4_1_WGM1
    SolutionIndex: 377
    SolutionNameMin: Cijk_Ailk_Bljk_HBH_MT128x96x32_MI32x32x8x1_SE_AF0EM4_GRVW2_LBSPP128_LPB4_NLCA1_SU16_SUS256_SRVW4_TT1_96_WG128_2_1_WGM15
    SolutionIndex: 378
    SolutionNameMin: Cijk_Ailk_Bljk_HBH_MT256x128x32_MI32x32x4x2_SE_AF0EM1_GRVW8_LBSPP128_LPB8_NLCA1_SU0_SUS256_SRVW4_TT2_64_WG128_2_1_WGM2
    SolutionIndex: 379
    SolutionNameMin: Cijk_Ailk_Bljk_HBH_MT128x256x32_MI32x32x8x1_SE_AF0EM1_GRVW8_LBSPP128_LPB8_NLCA1_SU0_SUS256_SRVW4_TT2_128_WG64_4_1_WGM2
    SolutionIndex: 380
    SolutionNameMin: Cijk_Ailk_Bljk_HBH_MT128x96x32_MI32x32x8x1_SE_AF0EM4_GRVW2_LBSPP128_LPB4_NLCA1_SU32_SUS128_SRVW4_TT1_96_WG128_2_1_WGM1
    SolutionIndex: 381
    SolutionNameMin: Cijk_Ailk_Bljk_HBH_MT128x160x32_MI32x32x8x1_SE_AF0EM4_GRVW4_LBSPP128_LPB4_NLCA1_SU0_SUS256_SRVW4_TT1_160_WG128_2_1_WGM15
    SolutionIndex: 382
    SolutionNameMin: Cijk_Ailk_Bljk_HBH_MT160x128x32_MI32x32x8x1_SE_AF0EM4_GRVW2_LBSPP128_LPB4_NLCA5_SU0_SUS256_SRVW0_TT5_32_WG32_8_1_WGM1
    SolutionIndex: 383
    SolutionNameMin: Cijk_Ailk_Bljk_HBH_MT64x80x64_MI16x16x16x1_SE_AF0EM4_GRVW4_LBSPP128_LPB4_NLCA1_SU16_SUS128_SRVW0_TT1_80_WG64_4_1_WGM15
    SolutionIndex: 384
    SolutionNameMin: Cijk_Ailk_Bljk_HBH_MT128x96x32_MI32x32x8x1_SE_AF0EM1_GRVW4_LBSPP128_LPB4_NLCA1_SU32_SUS256_SRVW4_TT1_96_WG128_2_1_WGM2
    SolutionIndex: 385
    SolutionNameMin: Cijk_Ailk_Bljk_HBH_MT256x128x32_MI32x32x4x2_SE_AF0EM4_GRVW8_LBSPP128_LPB8_NLCA1_SU32_SUS256_SRVW4_TT2_64_WG128_2_1_WGM15
    SolutionIndex: 386
    SolutionNameMin: Cijk_Ailk_Bljk_HBH_MT64x64x64_MI32x32x8x1_SE_AF0EM1_GRVW2_LBSPP128_LPB4_NLCA1_SU0_SUS256_SRVW0_TT1_32_WG64_4_1_WGM1
    SolutionIndex: 387
    SolutionNameMin: Cijk_Ailk_Bljk_HBH_MT256x128x32_MI32x32x4x2_SE_AF0EM4_GRVW4_LBSPP128_LPB4_NLCA1_SU32_SUS128_SRVW4_TT2_64_WG128_2_1_WGM2
    SolutionIndex: 388
    SolutionNameMin: Cijk_Ailk_Bljk_HBH_MT128x96x64_MI32x32x8x1_SE_AF0EM4_GRVW4_LBSPP128_LPB4_NLCA1_SU16_SUS128_SRVW4_TT1_96_WG128_2_1_WGM1
    SolutionIndex: 389
    SolutionNameMin: Cijk_Ailk_Bljk_HBH_MT128x256x32_MI32x32x8x1_SE_AF0EM1_GRVW8_LBSPP128_LPB8_NLCA1_SU16_SUS256_SRVW4_TT2_128_WG64_4_1_WGM2
    SolutionIndex: 390
    SolutionNameMin: Cijk_Ailk_Bljk_HBH_MT256x128x32_MI32x32x4x2_SE_AF0EM1_GRVW8_LBSPP128_LPB8_NLCA1_SU32_SUS128_SRVW4_TT2_64_WG128_2_1_WGM1
    SolutionIndex: 391
    SolutionNameMin: Cijk_Ailk_Bljk_HBH_MT64x32x32_MI16x16x16x1_SE_AF0EM4_GRVW8_LBSPP128_LPB8_NLCA1_SU0_SUS256_SRVW0_TT2_16_WG32_8_1_WGM15
    SolutionIndex: 392
    SolutionNameMin: Cijk_Ailk_Bljk_HBH_MT128x64x64_MI32x32x4x2_SE_AF0EM4_GRVW8_LBSPP128_LPB8_NLCA1_SU32_SUS128_SRVW4_TT1_32_WG128_2_1_WGM2
    SolutionIndex: 393
    SolutionNameMin: Cijk_Ailk_Bljk_HBH_MT128x288x32_MI32x32x8x1_SE_AF0EM1_GRVW4_LBSPP128_LPB4_NLCA1_SU0_SUS256_SRVW4_TT1_288_WG128_2_1_WGM15
    SolutionIndex: 394
    SolutionNameMin: Cijk_Ailk_Bljk_HBH_MT256x128x32_MI32x32x4x2_SE_AF0EM4_GRVW8_LBSPP128_LPB8_NLCA1_SU16_SUS128_SRVW4_TT2_64_WG128_2_1_WGM1
    SolutionIndex: 395
    SolutionNameMin: Cijk_Ailk_Bljk_HBH_MT128x256x32_MI32x32x8x1_SE_AF0EM4_GRVW8_LBSPP128_LPB8_NLCA1_SU32_SUS256_SRVW4_TT2_128_WG64_4_1_WGM15
    SolutionIndex: 396
    SolutionNameMin: Cijk_Ailk_Bljk_HBH_MT128x80x32_MI16x16x16x1_SE_AF0EM4_GRVW2_LBSPP128_LPB4_NLCA1_SU0_SUS256_SRVW4_TT2_80_WG64_4_1_WGM1
    SolutionIndex: 397
    SolutionNameMin: Cijk_Ailk_Bljk_HBH_MT32x32x64_MI16x16x16x1_SE_AF0EM4_GRVW8_LBSPP128_LPB8_NLCA1_SU32_SUS256_SRVW0_TT1_16_WG32_8_1_WGM15
    SolutionIndex: 398
    SolutionNameMin: Cijk_Ailk_Bljk_HBH_MT32x32x128_MI16x16x16x1_SE_AF0EM4_GRVW2_LBSPP256_LPB4_NLCA1_SU0_SUS256_SRVW0_TT1_16_WG32_8_1_WGM1
    SolutionIndex: 399
    SolutionNameMin: Cijk_Ailk_Bljk_HBH_MT64x128x32_MI32x32x4x2_SE_AF0EM4_GRVW4_LBSPP128_LPB4_NLCA1_SU0_SUS256_SRVW4_TT1_32_WG64_4_1_WGM2
    SolutionIndex: 400
    SolutionNameMin: Cijk_Ailk_Bljk_HBH_MT128x96x32_MI32x32x8x1_SE_AF0EM1_GRVW4_LBSPP128_LPB4_NLCA1_SU0_SUS256_SRVW4_TT1_96_WG128_2_1_WGM2
    SolutionIndex: 401
    SolutionNameMin: Cijk_Ailk_Bljk_HBH_MT64x128x32_MI32x32x4x2_SE_AF0EM4_GRVW4_LBSPP128_LPB4_NLCA1_SU16_SUS128_SRVW4_TT1_32_WG64_4_1_WGM15
    SolutionIndex: 402
    SolutionNameMin: Cijk_Ailk_Bljk_HBH_MT64x128x32_MI32x32x8x1_SE_AF0EM4_GRVW4_LBSPP128_LPB4_NLCA1_SU0_SUS256_SRVW4_TT1_64_WG64_4_1_WGM2
    SolutionIndex: 403
    SolutionNameMin: Cijk_Ailk_Bljk_HBH_MT32x32x128_MI16x16x16x1_SE_AF0EM4_GRVW8_LBSPP256_LPB8_NLCA1_SU32_SUS256_SRVW0_TT1_16_WG32_8_1_WGM1
    SolutionIndex: 404
    SolutionNameMin: Cijk_Ailk_Bljk_HBH_MT256x144x32_MI16x16x16x1_SE_AF0EM4_GRVW2_LBSPP128_LPB4_NLCA2_SU32_SUS128_SRVW0_TT4_144_WG64_4_1_WGM15
    SolutionIndex: 405
    SolutionNameMin: Cijk_Ailk_Bljk_HBH_MT64x128x32_MI32x32x8x1_SE_AF0EM4_GRVW8_LBSPP128_LPB8_NLCA1_SU0_SUS256_SRVW4_TT1_64_WG64_4_1_WGM1
    SolutionIndex: 406
    SolutionNameMin: Cijk_Ailk_Bljk_HBH_MT64x32x32_MI16x16x16x1_SE_AF0EM4_GRVW4_LBSPP128_LPB4_NLCA1_SU0_SUS256_SRVW0_TT2_16_WG32_8_1_WGM2
    SolutionIndex: 407
    SolutionNameMin: Cijk_Ailk_Bljk_HBH_MT128x288x32_MI32x32x8x1_SE_AF0EM4_GRVW4_LBSPP128_LPB4_NLCA1_SU0_SUS256_SRVW4_TT1_288_WG128_2_1_WGM2
    SolutionIndex: 408
    SolutionNameMin: Cijk_Ailk_Bljk_HBH_MT128x96x64_MI32x32x8x1_SE_AF0EM4_GRVW8_LBSPP128_LPB8_NLCA1_SU16_SUS128_SRVW4_TT1_96_WG128_2_1_WGM2
    SolutionIndex: 409
    SolutionNameMin: Cijk_Ailk_Bljk_HBH_MT128x96x64_MI32x32x8x1_SE_AF0EM1_GRVW8_LBSPP128_LPB8_NLCA1_SU0_SUS256_SRVW4_TT1_96_WG128_2_1_WGM2
    SolutionIndex: 410
    SolutionNameMin: Cijk_Ailk_Bljk_HBH_MT32x64x64_MI16x16x16x1_SE_AF0EM4_GRVW4_LBSPP128_LPB4_NLCA1_SU16_SUS256_SRVW4_TT1_32_WG32_8_1_WGM15
    SolutionIndex: 411
    SolutionNameMin: Cijk_Ailk_Bljk_HBH_MT256x128x32_MI32x32x8x1_SE_AF0EM4_GRVW4_LBSPP128_LPB4_NLCA1_SU0_SUS256_SRVW4_TT4_64_WG64_4_1_WGM2
    SolutionIndex: 412
    SolutionNameMin: Cijk_Ailk_Bljk_HBH_MT128x96x64_MI32x32x8x1_SE_AF0EM1_GRVW8_LBSPP128_LPB8_NLCA1_SU32_SUS128_SRVW0_TT1_96_WG128_2_1_WGM15
    SolutionIndex: 413
    SolutionNameMin: Cijk_Ailk_Bljk_HBH_MT64x64x64_MI32x32x8x1_SE_AF0EM1_GRVW2_LBSPP128_LPB4_NLCA1_SU16_SUS128_SRVW4_TT1_32_WG64_4_1_WGM2
    SolutionIndex: 414
    SolutionNameMin: Cijk_Ailk_Bljk_HBH_MT64x128x32_MI32x32x4x2_SE_AF0EM4_GRVW2_LBSPP128_LPB4_NLCA1_SU32_SUS128_SRVW4_TT1_32_WG64_4_1_WGM2
    SolutionIndex: 415
    SolutionNameMin: Cijk_Ailk_Bljk_HBH_MT128x96x32_MI32x32x8x1_SE_AF0EM1_GRVW4_LBSPP128_LPB4_NLCA1_SU32_SUS128_SRVW4_TT1_96_WG128_2_1_WGM2
    SolutionIndex: 416
    SolutionNameMin: Cijk_Ailk_Bljk_HBH_MT256x128x32_MI32x32x4x2_SE_AF0EM4_GRVW4_LBSPP128_LPB4_NLCA1_SU0_SUS256_SRVW4_TT2_64_WG128_2_1_WGM1
    SolutionIndex: 417
    SolutionNameMin: Cijk_Ailk_Bljk_HBH_MT128x256x32_MI32x32x4x2_SE_AF0EM4_GRVW8_LBSPP128_LPB8_NLCA1_SU0_SUS256_SRVW4_TT2_64_WG64_4_1_WGM1
    SolutionIndex: 418
    SolutionNameMin: Cijk_Ailk_Bljk_HBH_MT128x96x32_MI32x32x8x1_SE_AF0EM1_GRVW4_LBSPP128_LPB4_NLCA1_SU0_SUS256_SRVW4_TT1_96_WG128_2_1_WGM15
    SolutionIndex: 419
    SolutionNameMin: Cijk_Ailk_Bljk_HBH_MT128x160x32_MI32x32x8x1_SE_AF0EM4_GRVW2_LBSPP128_LPB4_NLCA1_SU0_SUS256_SRVW0_TT1_160_WG128_2_1_WGM15
    SolutionIndex: 420
    SolutionNameMin: Cijk_Ailk_Bljk_HBH_MT64x128x64_MI32x32x8x1_SE_AF0EM4_GRVW8_LBSPP128_LPB8_NLCA1_SU16_SUS256_SRVW4_TT1_64_WG64_4_1_WGM2
    SolutionIndex: 421
    SolutionNameMin: Cijk_Ailk_Bljk_HBH_MT256x128x32_MI32x32x4x2_SE_AF0EM1_GRVW4_LBSPP128_LPB4_NLCA1_SU32_SUS256_SRVW4_TT2_64_WG128_2_1_WGM2
    SolutionIndex: 422
    SolutionNameMin: Cijk_Ailk_Bljk_HBH_MT256x128x32_MI32x32x4x2_SE_AF0EM1_GRVW4_LBSPP128_LPB4_NLCA1_SU0_SUS256_SRVW0_TT2_64_WG128_2_1_WGM15
    SolutionIndex: 423
    SolutionNameMin: Cijk_Ailk_Bljk_HBH_MT32x32x128_MI16x16x16x1_SE_AF0EM4_GRVW4_LBSPP256_LPB4_NLCA1_SU32_SUS256_SRVW0_TT1_16_WG32_8_1_WGM15
    SolutionIndex: 424
    SolutionNameMin: Cijk_Ailk_Bljk_HBH_MT32x64x128_MI16x16x16x1_SE_AF0EM4_GRVW8_LBSPP256_LPB8_NLCA1_SU16_SUS256_SRVW4_TT1_32_WG32_8_1_WGM1
    SolutionIndex: 425
    SolutionNameMin: Cijk_Ailk_Bljk_HBH_MT64x32x128_MI16x16x16x1_SE_AF0EM4_GRVW8_LBSPP256_LPB8_NLCA1_SU32_SUS256_SRVW4_TT2_16_WG32_8_1_WGM15
    SolutionIndex: 426
    SolutionNameMin: Cijk_Ailk_Bljk_HBH_MT128x160x32_MI32x32x8x1_SE_AF0EM4_GRVW4_LBSPP128_LPB4_NLCA1_SU16_SUS128_SRVW4_TT1_160_WG128_2_1_WGM2
    SolutionIndex: 427
    SolutionNameMin: Cijk_Ailk_Bljk_HBH_MT64x80x64_MI16x16x16x1_SE_AF0EM1_GRVW2_LBSPP128_LPB4_NLCA1_SU16_SUS128_SRVW4_TT1_80_WG64_4_1_WGM15
    SolutionIndex: 428
    SolutionNameMin: Cijk_Ailk_Bljk_HBH_MT32x64x128_MI16x16x16x1_SE_AF0EM4_GRVW8_LBSPP256_LPB8_NLCA1_SU32_SUS256_SRVW0_TT1_32_WG32_8_1_WGM1
    SolutionIndex: 429
    SolutionNameMin: Cijk_Ailk_Bljk_HBH_MT128x96x32_MI32x32x8x1_SE_AF0EM1_GRVW2_LBSPP128_LPB4_NLCA1_SU32_SUS128_SRVW4_TT1_96_WG128_2_1_WGM15
    SolutionIndex: 430
    SolutionNameMin: Cijk_Ailk_Bljk_HBH_MT128x160x32_MI32x32x8x1_SE_AF0EM4_GRVW2_LBSPP128_LPB4_NLCA1_SU0_SUS256_SRVW4_TT1_160_WG128_2_1_WGM15
    SolutionIndex: 431
    SolutionNameMin: Cijk_Ailk_Bljk_HBH_MT64x128x32_MI32x32x8x1_SE_AF0EM4_GRVW4_LBSPP128_LPB4_NLCA1_SU0_SUS256_SRVW4_TT1_64_WG64_4_1_WGM1
    SolutionIndex: 432
    SolutionNameMin: Cijk_Ailk_Bljk_HBH_MT64x128x64_MI32x32x8x1_SE_AF0EM4_GRVW4_LBSPP128_LPB4_NLCA1_SU0_SUS256_SRVW4_TT1_64_WG64_4_1_WGM1
    SolutionIndex: 433
    SolutionNameMin: Cijk_Ailk_Bljk_HBH_MT32x32x128_MI16x16x16x1_SE_AF0EM4_GRVW8_LBSPP256_LPB8_NLCA1_SU32_SUS256_SRVW4_TT1_16_WG32_8_1_WGM2
    SolutionIndex: 434
    SolutionNameMin: Cijk_Ailk_Bljk_HBH_MT256x144x32_MI16x16x16x1_SE_AF0EM1_GRVW2_LBSPP128_LPB4_NLCA2_SU16_SUS256_SRVW0_TT4_144_WG64_4_1_WGM15
    SolutionIndex: 435
    SolutionNameMin: Cijk_Ailk_Bljk_HBH_MT32x32x128_MI16x16x16x1_SE_AF0EM4_GRVW8_LBSPP256_LPB8_NLCA1_SU16_SUS256_SRVW0_TT1_16_WG32_8_1_WGM2
    SolutionIndex: 436
    SolutionNameMin: Cijk_Ailk_Bljk_HBH_MT256x128x32_MI32x32x4x2_SE_AF0EM4_GRVW8_LBSPP128_LPB8_NLCA1_SU0_SUS256_SRVW4_TT2_64_WG128_2_1_WGM2
    SolutionIndex: 437
    SolutionNameMin: Cijk_Ailk_Bljk_HBH_MT128x64x32_MI32x32x4x2_SE_AF0EM4_GRVW8_LBSPP128_LPB8_NLCA1_SU0_SUS256_SRVW4_TT1_32_WG128_2_1_WGM15
    SolutionIndex: 438
    SolutionNameMin: Cijk_Ailk_Bljk_HBH_MT256x128x32_MI32x32x4x2_SE_AF0EM4_GRVW8_LBSPP128_LPB8_NLCA1_SU32_SUS128_SRVW4_TT2_64_WG128_2_1_WGM15
    SolutionIndex: 439
    SolutionNameMin: Cijk_Ailk_Bljk_HBH_MT128x96x32_MI32x32x8x1_SE_AF0EM4_GRVW4_LBSPP128_LPB4_NLCA1_SU32_SUS128_SRVW4_TT1_96_WG128_2_1_WGM15
    SolutionIndex: 440
    SolutionNameMin: Cijk_Ailk_Bljk_HBH_MT128x160x32_MI32x32x8x1_SE_AF0EM4_GRVW2_LBSPP128_LPB4_NLCA1_SU32_SUS256_SRVW4_TT1_160_WG128_2_1_WGM15
    SolutionIndex: 441
    SolutionNameMin: Cijk_Ailk_Bljk_HBH_MT128x96x64_MI32x32x8x1_SE_AF0EM1_GRVW8_LBSPP128_LPB8_NLCA1_SU0_SUS256_SRVW0_TT1_96_WG128_2_1_WGM15
    SolutionIndex: 442
    SolutionNameMin: Cijk_Ailk_Bljk_HBH_MT64x32x128_MI16x16x16x1_SE_AF0EM4_GRVW8_LBSPP256_LPB8_NLCA1_SU16_SUS256_SRVW0_TT2_16_WG32_8_1_WGM2
    SolutionIndex: 443
    SolutionNameMin: Cijk_Ailk_Bljk_HBH_MT128x288x32_MI32x32x8x1_SE_AF0EM1_GRVW4_LBSPP128_LPB4_NLCA1_SU0_SUS256_SRVW4_TT1_288_WG128_2_1_WGM2
    SolutionIndex: 444
    SolutionNameMin: Cijk_Ailk_Bljk_HBH_MT128x96x32_MI32x32x8x1_SE_AF0EM4_GRVW2_LBSPP128_LPB4_NLCA1_SU16_SUS256_SRVW4_TT1_96_WG128_2_1_WGM1
    SolutionIndex: 445
    SolutionNameMin: Cijk_Ailk_Bljk_HBH_MT32x32x32_MI16x16x16x1_SE_AF0EM4_GRVW8_LBSPP128_LPB8_NLCA1_SU16_SUS128_SRVW0_TT1_16_WG32_8_1_WGM1
    SolutionIndex: 446
    SolutionNameMin: Cijk_Ailk_Bljk_HBH_MT128x96x32_MI32x32x8x1_SE_AF0EM1_GRVW4_LBSPP128_LPB4_NLCA1_SU16_SUS128_SRVW4_TT1_96_WG128_2_1_WGM15
    SolutionIndex: 447
    SolutionNameMin: Cijk_Ailk_Bljk_HBH_MT128x256x32_MI32x32x8x1_SE_AF0EM4_GRVW8_LBSPP128_LPB8_NLCA1_SU32_SUS128_SRVW4_TT2_128_WG64_4_1_WGM2
    SolutionIndex: 448
    SolutionNameMin: Cijk_Ailk_Bljk_HBH_MT128x96x32_MI32x32x8x1_SE_AF0EM4_GRVW4_LBSPP128_LPB4_NLCA1_SU32_SUS256_SRVW4_TT1_96_WG128_2_1_WGM2
    SolutionIndex: 449
    SolutionNameMin: Cijk_Ailk_Bljk_HBH_MT128x96x32_MI32x32x8x1_SE_AF0EM4_GRVW2_LBSPP128_LPB4_NLCA1_SU32_SUS128_SRVW4_TT1_96_WG128_2_1_WGM2
    SolutionIndex: 450
    SolutionNameMin: Cijk_Ailk_Bljk_HBH_MT64x64x64_MI32x32x8x1_SE_AF0EM4_GRVW8_LBSPP128_LPB8_NLCA1_SU0_SUS256_SRVW4_TT1_32_WG64_4_1_WGM15
    SolutionIndex: 451
    SolutionNameMin: Cijk_Ailk_Bljk_HBH_MT64x32x32_MI16x16x16x1_SE_AF0EM4_GRVW2_LBSPP128_LPB4_NLCA1_SU16_SUS128_SRVW4_TT2_16_WG32_8_1_WGM1
    SolutionIndex: 452
    SolutionNameMin: Cijk_Ailk_Bljk_HBH_MT128x256x32_MI32x32x8x1_SE_AF0EM4_GRVW8_LBSPP128_LPB8_NLCA1_SU16_SUS128_SRVW4_TT2_128_WG64_4_1_WGM2
    SolutionIndex: 453
    SolutionNameMin: Cijk_Ailk_Bljk_HBH_MT128x160x32_MI32x32x8x1_SE_AF0EM4_GRVW2_LBSPP128_LPB4_NLCA1_SU32_SUS256_SRVW4_TT1_160_WG128_2_1_WGM1
    SolutionIndex: 454
    SolutionNameMin: Cijk_Ailk_Bljk_HBH_MT64x64x32_MI32x32x8x1_SE_AF0EM4_GRVW8_LBSPP128_LPB8_NLCA1_SU16_SUS128_SRVW4_TT1_32_WG64_4_1_WGM15
    SolutionIndex: 455
    SolutionNameMin: Cijk_Ailk_Bljk_HBH_MT64x80x64_MI16x16x16x1_SE_AF0EM4_GRVW2_LBSPP128_LPB4_NLCA1_SU32_SUS256_SRVW0_TT1_80_WG64_4_1_WGM15
    SolutionIndex: 456
    SolutionNameMin: Cijk_Ailk_Bljk_HBH_MT128x160x32_MI32x32x8x1_SE_AF0EM4_GRVW2_LBSPP128_LPB4_NLCA1_SU0_SUS256_SRVW0_TT1_160_WG128_2_1_WGM1
    SolutionIndex: 457
    SolutionNameMin: Cijk_Ailk_Bljk_HBH_MT32x32x128_MI16x16x16x1_SE_AF0EM4_GRVW2_LBSPP256_LPB4_NLCA1_SU0_SUS256_SRVW0_TT1_16_WG32_8_1_WGM2
    SolutionIndex: 458
    SolutionNameMin: Cijk_Ailk_Bljk_HBH_MT64x128x32_MI32x32x4x2_SE_AF0EM4_GRVW8_LBSPP128_LPB8_NLCA1_SU32_SUS128_SRVW4_TT1_32_WG64_4_1_WGM1
    SolutionIndex: 459
    SolutionNameMin: Cijk_Ailk_Bljk_HBH_MT128x288x32_MI32x32x8x1_SE_AF0EM1_GRVW4_LBSPP128_LPB4_NLCA1_SU0_SUS256_SRVW0_TT1_288_WG128_2_1_WGM15
    SolutionIndex: 460
    SolutionNameMin: Cijk_Ailk_Bljk_HBH_MT128x96x32_MI32x32x8x1_SE_AF0EM1_GRVW2_LBSPP128_LPB4_NLCA1_SU0_SUS256_SRVW0_TT1_96_WG128_2_1_WGM1
    SolutionIndex: 461
    SolutionNameMin: Cijk_Ailk_Bljk_HBH_MT128x96x64_MI32x32x8x1_SE_AF0EM4_GRVW4_LBSPP128_LPB4_NLCA1_SU0_SUS256_SRVW4_TT1_96_WG128_2_1_WGM15
    SolutionIndex: 462
    SolutionNameMin: Cijk_Ailk_Bljk_HBH_MT32x32x128_MI16x16x16x1_SE_AF0EM4_GRVW4_LBSPP256_LPB4_NLCA1_SU0_SUS256_SRVW0_TT1_16_WG32_8_1_WGM1
    SolutionIndex: 463
    SolutionNameMin: Cijk_Ailk_Bljk_HBH_MT128x96x32_MI32x32x8x1_SE_AF0EM4_GRVW4_LBSPP128_LPB4_NLCA1_SU16_SUS128_SRVW4_TT1_96_WG128_2_1_WGM1
    SolutionIndex: 464
    SolutionNameMin: Cijk_Ailk_Bljk_HBH_MT32x32x128_MI16x16x16x1_SE_AF0EM4_GRVW8_LBSPP256_LPB8_NLCA1_SU0_SUS256_SRVW0_TT1_16_WG32_8_1_WGM1
    SolutionIndex: 465
    SolutionNameMin: Cijk_Ailk_Bljk_HBH_MT64x32x64_MI16x16x16x1_SE_AF0EM1_ASBE01_GRVW4_LPB4_PBD0_SRVW4_TT1_32_WG64_4_1_WGM10
    SolutionIndex: 466
    SolutionNameMin: Cijk_Ailk_Bljk_HBH_MT64x64x32_MI32x32x8x1_SE_AF0EM8_ASBE01_GRVW2_LPB4_PBD0_SRVW4_TT1_32_WG64_4_1_WGM1
    SolutionIndex: 467
    SolutionNameMin: Cijk_Ailk_Bljk_HBH_MT128x64x32_MI32x32x4x2_SE_AF0EM8_ASBE01_GRVW8_LPB8_PBD0_SRVW4_TT1_32_WG128_2_1_WGM1
    SolutionIndex: 468
    SolutionNameMin: Cijk_Ailk_Bljk_HBH_MT128x64x32_MI32x32x4x2_SE_AF0EM1_ASBE01_GRVW4_LPB4_PBD0_SRVW4_TT1_32_WG128_2_1_WGM120
    SolutionIndex: 469
    SolutionNameMin: Cijk_Ailk_Bljk_HBH_MT128x64x32_MI32x32x8x1_SE_AF0EM1_ASBE01_GRVW4_LPB4_PBD0_SRVW4_TT2_32_WG64_4_1_WGM1
    SolutionIndex: 470
    SolutionNameMin: Cijk_Ailk_Bljk_HBH_MT64x32x32_MI16x16x16x1_SE_AF0EM1_ASBE01_GRVW4_LPB4_PBD0_SRVW4_TT1_32_WG128_2_1_WGM10
    SolutionIndex: 471
    SolutionNameMin: Cijk_Ailk_Bljk_HBH_MT128x64x32_MI32x32x4x2_SE_AF0EM4_ASBE01_GRVW2_LPB4_PBD0_SRVW4_TT1_32_WG128_2_1_WGM120
    SolutionIndex: 472
    SolutionNameMin: Cijk_Ailk_Bljk_HBH_MT256x128x32_MI32x32x4x2_SE_AF0EM8_ASBE01_GRVW8_LPB8_PBD0_SRVW4_TT2_64_WG128_2_1_WGM120
    SolutionIndex: 473
    SolutionNameMin: Cijk_Ailk_Bljk_HBH_MT64x32x32_MI16x16x16x1_SE_AF0EM1_ASBE01_GRVW4_LPB4_PBD0_SRVW4_TT1_32_WG128_2_1_WGM120
    SolutionIndex: 474
    SolutionNameMin: Cijk_Ailk_Bljk_HBH_MT128x64x32_MI32x32x4x2_SE_AF0EM1_ASBE01_GRVW2_LPB4_PBD0_SRVW4_TT1_32_WG128_2_1_WGM120
    SolutionIndex: 475
    SolutionNameMin: Cijk_Ailk_Bljk_HBH_MT64x128x64_MI32x32x8x1_SE_AF0EM8_ASBE01_GRVW8_LPB8_PBD0_SRVW4_TT2_32_WG32_8_1_WGM120
    SolutionIndex: 476
    SolutionNameMin: Cijk_Ailk_Bljk_HBH_MT64x128x64_MI32x32x4x2_SE_AF0EM1_ASBE01_GRVW4_LPB4_PBD0_SRVW4_TT1_32_WG64_4_1_WGM1
    SolutionIndex: 477
    SolutionNameMin: Cijk_Ailk_Bljk_HBH_MT128x256x32_MI32x32x4x2_SE_AF0EM8_ASBE01_GRVW8_LPB8_PBD0_SRVW4_TT2_64_WG64_4_1_WGM120
    SolutionIndex: 478
    SolutionNameMin: Cijk_Ailk_Bljk_HBH_MT128x64x32_MI32x32x4x2_SE_AF0EM1_ASBE01_GRVW4_LPB4_PBD0_SRVW4_TT1_32_WG128_2_1_WGM1
    SolutionIndex: 479
    SolutionNameMin: Cijk_Ailk_Bljk_HBH_MT64x128x32_MI16x16x4x4_SE_AF0EM1_ASBE01_GRVW2_LPB4_PBD0_SRVW4_TT1_32_WG64_4_1_WGM10
    SolutionIndex: 480
    SolutionNameMin: Cijk_Ailk_Bljk_HBH_MT128x256x32_MI32x32x4x2_SE_AF0EM8_ASBE01_GRVW8_LPB8_PBD0_SRVW4_TT2_64_WG64_4_1_WGM1
    SolutionIndex: 481
    SolutionNameMin: Cijk_Ailk_Bljk_HBH_MT64x128x32_MI32x32x8x1_SE_AF0EM8_ASBE01_GRVW8_LPB8_PBD0_SRVW4_TT2_32_WG32_8_1_WGM1
    SolutionIndex: 482
    SolutionNameMin: Cijk_Ailk_Bljk_HBH_MT128x64x32_MI16x16x16x1_SE_AF0EM8_ASBE01_GRVW8_LPB8_PBD0_SRVW4_TT2_64_WG64_4_1_WGM1
    SolutionIndex: 483
    SolutionNameMin: Cijk_Ailk_Bljk_HBH_MT128x64x32_MI32x32x4x2_SE_AF0EM8_ASBE01_GRVW8_LPB8_PBD0_SRVW4_TT1_32_WG128_2_1_WGM10
    SolutionIndex: 484
    SolutionNameMin: Cijk_Ailk_Bljk_HBH_MT64x128x64_MI16x16x16x1_SE_AF0EM8_ASBE01_GRVW8_LPB8_PBD0_SRVW0_TT2_64_WG32_8_1_WGM120
    SolutionIndex: 485
    SolutionNameMin: Cijk_Ailk_Bljk_HBH_MT128x64x32_MI16x16x16x1_SE_AF0EM1_ASBE01_GRVW4_LPB4_PBD0_SRVW4_TT2_64_WG128_2_1_WGM1
    SolutionIndex: 486
    SolutionNameMin: Cijk_Ailk_Bljk_HBH_MT128x64x32_MI32x32x8x1_SE_AF0EM1_ASBE01_GRVW2_LPB4_PBD0_SRVW4_TT2_32_WG64_4_1_WGM10
    SolutionIndex: 487
    SolutionNameMin: Cijk_Ailk_Bljk_HBH_MT64x128x64_MI32x32x8x1_SE_AF0EM1_ASBE01_GRVW4_LPB4_PBD0_SRVW4_TT2_32_WG32_8_1_WGM120
    SolutionIndex: 488
    SolutionNameMin: Cijk_Ailk_Bljk_HBH_MT64x64x32_MI32x32x8x1_SE_AF0EM1_ASBE01_GRVW2_LPB4_PBD0_SRVW4_TT1_32_WG64_4_1_WGM10
    SolutionIndex: 489
    SolutionNameMin: Cijk_Ailk_Bljk_HBH_MT128x64x32_MI16x16x16x1_SE_AF0EM1_ASBE01_GRVW4_LPB4_PBD0_SRVW4_TT2_64_WG64_4_1_WGM1
    SolutionIndex: 490
    SolutionNameMin: Cijk_Ailk_Bljk_HBH_MT64x64x32_MI32x32x8x1_SE_AF0EM8_ASBE01_GRVW8_LPB8_PBD0_SRVW4_TT1_32_WG64_4_1_WGM10
    SolutionIndex: 491
    SolutionNameMin: Cijk_Ailk_Bljk_HBH_MT32x64x64_MI16x16x16x1_SE_AF0EM8_ASBE01_GRVW8_LPB8_PBD0_SRVW4_TT1_32_WG32_8_1_WGM120
    SolutionIndex: 492
    SolutionNameMin: Cijk_Ailk_Bljk_HBH_MT64x128x32_MI32x32x8x1_SE_AF0EM8_ASBE01_GRVW2_LPB4_PBD0_SRVW4_TT2_32_WG32_8_1_WGM120
    SolutionIndex: 493
    SolutionNameMin: Cijk_Ailk_Bljk_HBH_MT256x128x32_MI32x32x4x2_SE_AF0EM4_ASBE01_GRVW4_LPB4_PBD0_SRVW4_TT2_64_WG128_2_1_WGM120
    SolutionIndex: 494
    SolutionNameMin: Cijk_Ailk_Bljk_HBH_MT64x128x32_MI32x32x8x1_SE_AF0EM1_ASBE01_GRVW2_LPB4_PBD0_SRVW4_TT2_32_WG32_8_1_WGM1
    SolutionIndex: 495
    SolutionNameMin: Cijk_Ailk_Bljk_HBH_MT128x64x32_MI16x16x16x1_SE_AF0EM1_ASBE01_GRVW4_LPB4_PBD0_SRVW4_TT2_64_WG64_4_1_WGM120
    SolutionIndex: 496
    SolutionNameMin: Cijk_Ailk_Bljk_HBH_MT128x64x32_MI32x32x4x2_SE_AF0EM8_ASBE01_GRVW8_LPB8_PBD0_SRVW4_TT1_32_WG128_2_1_WGM120
    SolutionIndex: 497
    SolutionNameMin: Cijk_Ailk_Bljk_HBH_MT128x64x32_MI16x16x16x1_SE_AF0EM1_ASBE01_GRVW2_LPB4_PBD0_SRVW4_TT2_64_WG128_2_1_WGM1
    SolutionIndex: 498
    SolutionNameMin: Cijk_Ailk_Bljk_HBH_MT256x128x32_MI32x32x4x2_SE_AF0EM8_ASBE01_GRVW8_LPB8_PBD0_SRVW4_TT2_64_WG128_2_1_WGM10
    SolutionIndex: 499
    SolutionNameMin: Cijk_Ailk_Bljk_HBH_MT64x128x32_MI32x32x4x2_SE_AF0EM4_ASBE01_GRVW2_LPB4_PBD0_SRVW4_TT1_32_WG64_4_1_WGM1
    SolutionIndex: 500
    SolutionNameMin: Cijk_Ailk_Bljk_HBH_MT64x128x32_MI32x32x4x2_SE_AF0EM1_ASBE01_GRVW2_LPB4_PBD0_SRVW4_TT1_32_WG64_4_1_WGM1
    SolutionIndex: 501
    SolutionNameMin: Cijk_Ailk_Bljk_HBH_MT64x64x64_MI32x32x8x1_SE_AF0EM4_ASBE01_GRVW2_LPB4_PBD0_SRVW4_TT1_32_WG64_4_1_WGM10
    SolutionIndex: 502
    SolutionNameMin: Cijk_Ailk_Bljk_HBH_MT64x128x64_MI32x32x4x2_SE_AF0EM8_ASBE01_GRVW4_LPB4_PBD0_SRVW4_TT1_32_WG64_4_1_WGM1
    SolutionIndex: 503
    SolutionNameMin: Cijk_Ailk_Bljk_HBH_MT64x128x64_MI32x32x4x2_SE_AF0EM1_ASBE01_GRVW4_LPB4_PBD0_SRVW4_TT1_32_WG64_4_1_WGM120
    SolutionIndex: 504
    SolutionNameMin: Cijk_Ailk_Bljk_HBH_MT64x128x32_MI32x32x4x2_SE_AF0EM4_ASBE01_GRVW2_LPB4_PBD0_SRVW4_TT1_32_WG64_4_1_WGM10
    SolutionIndex: 505
    SolutionNameMin: Cijk_Ailk_Bljk_HBH_MT256x128x32_MI32x32x4x2_SE_AF0EM4_ASBE01_GRVW4_LPB4_PBD0_SRVW0_TT2_64_WG128_2_1_WGM10
    SolutionIndex: 506
    SolutionNameMin: Cijk_Ailk_Bljk_HBH_MT64x128x32_MI32x32x4x2_SE_AF0EM8_ASBE01_GRVW8_LPB8_PBD0_SRVW4_TT1_32_WG64_4_1_WGM1
    SolutionIndex: 507
    SolutionNameMin: Cijk_Ailk_Bljk_HBH_MT64x128x32_MI32x32x4x2_SE_AF0EM8_ASBE01_GRVW8_LPB8_PBD0_SRVW4_TT1_32_WG64_4_1_WGM120
    SolutionIndex: 508
    SolutionNameMin: Cijk_Ailk_Bljk_HBH_MT64x128x32_MI16x16x16x1_SE_AF0EM8_ASBE01_GRVW8_LPB8_PBD0_SRVW4_TT2_64_WG32_8_1_WGM10
    SolutionIndex: 509
    SolutionNameMin: Cijk_Ailk_Bljk_HBH_MT64x64x32_MI32x32x8x1_SE_AF0EM1_ASBE01_GRVW2_LPB4_PBD0_SRVW4_TT1_32_WG64_4_1_WGM120
    SolutionIndex: 510
    SolutionNameMin: Cijk_Ailk_Bljk_HBH_MT64x32x32_MI16x16x16x1_SE_AF0EM1_ASBE01_GRVW2_LPB4_PBD0_SRVW4_TT1_32_WG128_2_1_WGM1
    SolutionIndex: 511
    SolutionNameMin: Cijk_Ailk_Bljk_HBH_MT128x64x32_MI32x32x8x1_SE_AF0EM8_ASBE01_GRVW8_LPB8_PBD0_SRVW4_TT2_32_WG64_4_1_WGM1
    SolutionIndex: 512
    SolutionNameMin: Cijk_Ailk_Bljk_HBH_MT128x64x32_MI32x32x8x1_SE_AF0EM1_ASBE01_GRVW2_LPB4_PBD0_SRVW4_TT2_32_WG64_4_1_WGM1
    SolutionIndex: 513
    SolutionNameMin: Cijk_Ailk_Bljk_HBH_MT64x128x64_MI32x32x4x2_SE_AF0EM8_ASBE01_GRVW8_LPB8_PBD0_SRVW4_TT1_32_WG64_4_1_WGM120
    SolutionIndex: 514
    SolutionNameMin: Cijk_Ailk_Bljk_HBH_MT128x64x32_MI32x32x4x2_SE_AF0EM8_ASBE01_GRVW4_LPB4_PBD0_SRVW4_TT1_32_WG128_2_1_WGM1
    SolutionIndex: 515
    SolutionNameMin: Cijk_Ailk_Bljk_HBH_MT256x128x32_MI32x32x4x2_SE_AF0EM4_ASBE01_GRVW4_LPB4_PBD0_SRVW4_TT2_64_WG128_2_1_WGM10
    SolutionIndex: 516
    SolutionNameMin: Cijk_Ailk_Bljk_HBH_MT128x32x32_MI16x16x4x4_SE_AF0EM1_ASBE01_GRVW4_LPB4_PBD0_SRVW4_TT1_16_WG128_2_1_WGM1
- - - [1024, 1024, 1, 3328]
    - [19, 6.912]
  - - [2944, 4288, 1, 1280]
    - [39, 7.641]
  - - [2368, 64, 1, 3328]
    - [33, 3.688]
  - - [2368, 5888, 1, 256]
    - [37, 7.416]
  - - [256, 704, 1, 1280]
    - [19, 3.036]
  - - [128, 6784, 1, 3328]
    - [23, 6.204]
  - - [5888, 1856, 1, 3328]
    - [39, 7.754]
  - - [5888, 2944, 1, 3328]
    - [39, 7.758]
  - - [1856, 4288, 1, 256]
    - [36, 7.19]
  - - [5056, 5056, 1, 3328]
    - [39, 7.842]
  - - [1408, 5888, 1, 1280]
    - [41, 7.623]
  - - [1024, 3584, 1, 3328]
    - [39, 7.605]
  - - [448, 3584, 1, 3328]
    - [39, 6.405]
  - - [256, 4288, 1, 3328]
    - [39, 5.937]
  - - [5888, 1408, 1, 1280]
    - [41, 7.624]
  - - [704, 1856, 1, 3328]
    - [39, 7.059]
  - - [1024, 2368, 1, 256]
    - [41, 6.405]
  - - [5056, 6784, 1, 1280]
    - [36, 7.827]
  - - [1408, 64, 1, 1280]
    - [11, 2.607]
  - - [448, 1024, 1, 1280]
    - [28, 5.254]
  - - [5056, 5056, 1, 1280]
    - [39, 7.786]
  - - [4288, 6784, 1, 256]
    - [37, 7.546]
  - - [6784, 448, 1, 256]
    - [41, 6.78]
  - - [5056, 256, 1, 1280]
    - [39, 6.879]
  - - [5888, 704, 1, 1280]
    - [39, 7.476]
  - - [3584, 1024, 1, 256]
    - [41, 7.085]
  - - [6784, 4288, 1, 3328]
    - [39, 7.877]
  - - [1856, 2368, 1, 3328]
    - [39, 7.55]
  - - [5888, 2944, 1, 1280]
    - [36, 7.691]
  - - [5888, 1024, 1, 256]
    - [36, 7.244]
  - - [448, 64, 1, 1280]
    - [15, 0.949]
  - - [1024, 704, 1, 256]
    - [16, 5.155]
  - - [1408, 2944, 1, 256]
    - [41, 7.083]
  - - [256, 1856, 1, 1280]
    - [19, 5.436]
  - - [6784, 5056, 1, 3328]
    - [39, 7.883]
  - - [5056, 5056, 1, 256]
    - [17, 7.536]
  - - [256, 2944, 1, 3328]
    - [39, 6.342]
  - - [64, 1024, 1, 1280]
    - [30, 2.071]
  - - [1024, 3584, 1, 1280]
    - [39, 7.511]
  - - [2368, 2944, 1, 1280]
    - [39, 7.572]
  - - [128, 3584, 1, 1280]
    - [1, 5.356]
  - - [6784, 6784, 1, 1280]
    - [41, 7.849]
  - - [1024, 256, 1, 3328]
    - [28, 4.657]
  - - [1408, 4288, 1, 1280]
    - [39, 7.365]
  - - [3584, 4288, 1, 1280]
    - [39, 7.738]
  - - [2368, 704, 1, 1280]
    - [39, 6.547]
  - - [5056, 4288, 1, 3328]
    - [39, 7.841]
  - - [3584, 2368, 1, 3328]
    - [39, 7.64]
  - - [5888, 6784, 1, 1280]
    - [36, 7.81]
  - - [64, 704, 1, 1280]
    - [32, 1.424]
  - - [4288, 256, 1, 256]
    - [39, 5.302]
  - - [6784, 448, 1, 1280]
    - [39, 7.219]
  - - [2944, 5888, 1, 256]
    - [36, 7.385]
  - - [256, 128, 1, 256]
    - [15, 0.727]
  - - [4288, 2944, 1, 256]
    - [36, 7.31]
  - - [5888, 64, 1, 3328]
    - [23, 5.438]
  - - [2944, 256, 1, 3328]
    - [19, 6.359]
  - - [5056, 2368, 1, 1280]
    - [36, 7.703]
  - - [448, 3584, 1, 1280]
    - [39, 6.314]
  - - [6784, 5888, 1, 256]
    - [37, 7.564]
  - - [64, 1024, 1, 3328]
    - [30, 2.226]
  - - [704, 128, 1, 1280]
    - [11, 2.639]
  - - [1408, 448, 1, 1280]
    - [19, 5.255]
  - - [1024, 1408, 1, 256]
    - [36, 5.905]
  - - [2368, 2368, 1, 3328]
    - [39, 7.502]
  - - [5056, 704, 1, 3328]
    - [39, 7.372]
  - - [1408, 1856, 1, 256]
    - [41, 6.887]
  - - [1408, 256, 1, 1280]
    - [19, 4.204]
  - - [5888, 1856, 1, 256]
    - [41, 7.427]
  - - [704, 5888, 1, 256]
    - [37, 7.073]
  - - [6784, 64, 1, 256]
    - [24, 4.281]
  - - [3584, 704, 1, 3328]
    - [39, 7.202]
  - - [1408, 1408, 1, 256]
    - [42, 6.392]
  - - [1024, 64, 1, 1280]
    - [8, 2.082]
  - - [448, 4288, 1, 256]
    - [20, 6.178]
  - - [64, 3584, 1, 3328]
    - [27, 4.533]
  - - [704, 2368, 1, 1280]
    - [39, 6.554]
  - - [1856, 2368, 1, 1280]
    - [39, 7.475]
  - - [2368, 128, 1, 3328]
    - [22, 4.634]
  - - [1408, 1408, 1, 3328]
    - [39, 6.976]
  - - [2944, 128, 1, 256]
    - [6, 4.18]
  - - [448, 1408, 1, 256]
    - [39, 4.552]
  - - [64, 5056, 1, 3328]
    - [5, 4.935]
  - - [1408, 1024, 1, 1280]
    - [39, 6.512]
  - - [704, 6784, 1, 256]
    - [36, 6.922]
  - - [6784, 704, 1, 256]
    - [36, 6.909]
  - - [256, 3584, 1, 3328]
    - [39, 6.044]
  - - [5056, 704, 1, 256]
    - [17, 6.866]
  - - [1408, 3584, 1, 256]
    - [41, 6.992]
  - - [3584, 4288, 1, 3328]
    - [39, 7.799]
  - - [5888, 1856, 1, 1280]
    - [41, 7.699]
  - - [256, 1408, 1, 256]
    - [39, 3.496]
  - - [5056, 64, 1, 1280]
    - [22, 4.727]
  - - [2368, 128, 1, 256]
    - [5, 3.542]
  - - [2368, 3584, 1, 1280]
    - [39, 7.575]
  - - [1024, 256, 1, 256]
    - [19, 3.413]
  - - [448, 448, 1, 256]
    - [10, 3.024]
  - - [2944, 3584, 1, 3328]
    - [39, 7.667]
  - - [256, 256, 1, 3328]
    - [12, 2.231]
  - - [128, 1024, 1, 3328]
    - [11, 3.822]
  - - [6784, 2944, 1, 256]
    - [37, 7.418]
  - - [64, 1856, 1, 1280]
    - [11, 3.256]
  - - [448, 256, 1, 256]
    - [12, 2.271]
  - - [1856, 2368, 1, 256]
    - [36, 7.048]
  - - [3584, 6784, 1, 3328]
    - [39, 7.857]
  - - [256, 1024, 1, 256]
    - [19, 3.47]
  - - [1024, 128, 1, 1280]
    - [11, 3.568]
  - - [4288, 128, 1, 1280]
    - [3, 5.218]
  - - [5056, 4288, 1, 1280]
    - [39, 7.787]
  - - [5888, 64, 1, 256]
    - [6, 4.238]
  - - [6784, 1856, 1, 3328]
    - [39, 7.679]
  - - [1408, 5056, 1, 1280]
    - [39, 7.466]
  - - [1856, 256, 1, 1280]
    - [19, 5.452]
  - - [64, 5888, 1, 3328]
    - [5, 4.969]
  - - [6784, 5888, 1, 3328]
    - [39, 7.867]
  - - [448, 256, 1, 3328]
    - [11, 3.357]
  - - [2368, 5056, 1, 1280]
    - [39, 7.707]
  - - [1024, 704, 1, 1280]
    - [19, 5.976]
  - - [256, 1408, 1, 3328]
    - [19, 4.336]
  - - [6784, 128, 1, 3328]
    - [23, 6.197]
  - - [1024, 5056, 1, 1280]
    - [39, 7.522]
  - - [4288, 1024, 1, 256]
    - [36, 7.022]
  - - [2368, 1408, 1, 256]
    - [36, 6.862]
  - - [704, 704, 1, 3328]
    - [19, 5.878]
  - - [5888, 448, 1, 1280]
    - [39, 6.807]
  - - [3584, 256, 1, 3328]
    - [19, 6.094]
  - - [704, 5888, 1, 3328]
    - [39, 7.557]
  - - [1024, 6784, 1, 1280]
    - [39, 7.545]
  - - [128, 3584, 1, 3328]
    - [1, 5.531]
  - - [128, 704, 1, 1280]
    - [11, 2.614]
  - - [3584, 2944, 1, 1280]
    - [39, 7.606]
  - - [1856, 128, 1, 3328]
    - [31, 4.698]
  - - [128, 2944, 1, 1280]
    - [6, 5.231]
  - - [448, 1856, 1, 1280]
    - [19, 5.434]
  - - [1408, 5056, 1, 3328]
    - [39, 7.529]
  - - [1856, 1856, 1, 3328]
    - [39, 7.142]
  - - [3584, 128, 1, 256]
    - [24, 4.486]
  - - [448, 1408, 1, 3328]
    - [19, 5.376]
  - - [2368, 2368, 1, 256]
    - [17, 7.07]
  - - [4288, 4288, 1, 1280]
    - [36, 7.708]
  - - [64, 448, 1, 1280]
    - [14, 0.951]
  - - [5888, 1024, 1, 1280]
    - [39, 7.655]
  - - [704, 1024, 1, 256]
    - [39, 5.155]
  - - [704, 6784, 1, 3328]
    - [39, 7.372]
  - - [5888, 5888, 1, 3328]
    - [39, 7.851]
  - - [5056, 1024, 1, 1280]
    - [39, 7.528]
  - - [448, 5888, 1, 3328]
    - [39, 6.883]
  - - [1024, 2944, 1, 1280]
    - [39, 7.154]
  - - [5056, 5888, 1, 1280]
    - [37, 7.815]
  - - [448, 6784, 1, 256]
    - [40, 6.761]
  - - [256, 3584, 1, 256]
    - [39, 5.284]
  - - [256, 448, 1, 256]
    - [33, 2.29]
  - - [3584, 5888, 1, 256]
    - [36, 7.46]
  - - [2944, 3584, 1, 256]
    - [36, 7.266]
  - - [1408, 704, 1, 256]
    - [41, 5.681]
  - - [6784, 1024, 1, 3328]
    - [39, 7.613]
  - - [6784, 2944, 1, 3328]
    - [39, 7.784]
  - - [64, 64, 1, 3328]
    - [11, 0.142]
  - - [6784, 2368, 1, 1280]
    - [41, 7.71]
  - - [4288, 3584, 1, 256]
    - [36, 7.408]
  - - [4288, 5888, 1, 1280]
    - [39, 7.77]
  - - [448, 2944, 1, 3328]
    - [39, 6.054]
  - - [4288, 1856, 1, 1280]
    - [39, 7.549]
  - - [1856, 2944, 1, 3328]
    - [39, 7.654]
  - - [256, 6784, 1, 3328]
    - [39, 6.915]
  - - [64, 5888, 1, 256]
    - [18, 4.048]
  - - [5056, 1024, 1, 256]
    - [37, 7.174]
  - - [704, 64, 1, 3328]
    - [34, 1.549]
  - - [5056, 1856, 1, 3328]
    - [39, 7.755]
  - - [448, 448, 1, 3328]
    - [27, 3.987]
  - - [448, 2368, 1, 1280]
    - [39, 5.645]
  - - [1408, 128, 1, 1280]
    - [5, 3.932]
  - - [5056, 256, 1, 3328]
    - [39, 7.0]
  - - [704, 704, 1, 256]
    - [19, 4.731]
  - - [1024, 5888, 1, 1280]
    - [39, 7.656]
  - - [64, 128, 1, 256]
    - [2, 0.162]
  - - [128, 1856, 1, 1280]
    - [13, 4.453]
  - - [5056, 3584, 1, 256]
    - [37, 7.472]
  - - [1856, 1024, 1, 1280]
    - [39, 6.605]
  - - [1856, 1856, 1, 1280]
    - [39, 7.061]
  - - [128, 4288, 1, 3328]
    - [3, 5.315]
  - - [1856, 1024, 1, 3328]
    - [39, 6.691]
  - - [256, 2368, 1, 256]
    - [39, 4.414]
  - - [1024, 448, 1, 3328]
    - [19, 5.437]
  - - [1856, 704, 1, 1280]
    - [39, 6.929]
  - - [6784, 1024, 1, 256]
    - [36, 7.18]
  - - [5056, 5888, 1, 3328]
    - [39, 7.855]
  - - [1856, 1024, 1, 256]
    - [20, 6.12]
  - - [5056, 1408, 1, 3328]
    - [39, 7.532]
  - - [1024, 1024, 1, 1280]
    - [19, 6.764]
  - - [448, 5888, 1, 256]
    - [36, 6.383]
  - - [1408, 6784, 1, 3328]
    - [39, 7.685]
  - - [2944, 1408, 1, 3328]
    - [39, 7.555]
  - - [2944, 4288, 1, 3328]
    - [39, 7.697]
  - - [256, 2944, 1, 256]
    - [39, 5.39]
  - - [5056, 2944, 1, 256]
    - [36, 7.426]
  - - [2368, 1856, 1, 256]
    - [36, 7.043]
  - - [128, 6784, 1, 1280]
    - [6, 6.094]
  - - [1408, 3584, 1, 3328]
    - [39, 7.412]
  - - [2368, 6784, 1, 256]
    - [37, 7.464]
  - - [4288, 2368, 1, 3328]
    - [39, 7.757]
  - - [704, 3584, 1, 1280]
    - [39, 7.113]
  - - [1408, 5888, 1, 3328]
    - [39, 7.69]
  - - [1856, 5056, 1, 256]
    - [17, 7.364]
  - - [6784, 6784, 1, 256]
    - [37, 7.629]
  - - [1408, 704, 1, 3328]
    - [39, 6.524]
  - - [128, 5888, 1, 1280]
    - [0, 6.222]
  - - [2368, 4288, 1, 1280]
    - [39, 7.696]
  - - [3584, 1856, 1, 1280]
    - [39, 7.494]
  - - [704, 1408, 1, 3328]
    - [39, 6.524]
  - - [704, 64, 1, 1280]
    - [14, 1.42]
  - - [3584, 448, 1, 256]
    - [39, 5.802]
  - - [3584, 3584, 1, 1280]
    - [39, 7.77]
  - - [256, 6784, 1, 256]
    - [36, 6.238]
  - - [1856, 3584, 1, 3328]
    - [39, 7.566]
  - - [128, 448, 1, 256]
    - [30, 1.26]
  - - [3584, 3584, 1, 256]
    - [36, 7.43]
  - - [6784, 4288, 1, 1280]
    - [36, 7.826]
  - - [448, 704, 1, 1280]
    - [19, 3.693]
  - - [3584, 5056, 1, 256]
    - [41, 7.464]
  - - [6784, 128, 1, 256]
    - [6, 5.389]
  - - [64, 1408, 1, 3328]
    - [11, 2.838]
  - - [704, 448, 1, 256]
    - [19, 3.072]
  - - [2944, 2368, 1, 1280]
    - [39, 7.57]
  - - [448, 64, 1, 3328]
    - [35, 1.041]
  - - [6784, 3584, 1, 256]
    - [37, 7.501]
  - - [256, 1856, 1, 3328]
    - [28, 5.685]
  - - [256, 704, 1, 256]
    - [19, 2.347]
  - - [128, 1408, 1, 256]
    - [5, 2.859]
  - - [64, 128, 1, 3328]
    - [33, 0.284]
  - - [1856, 1408, 1, 256]
    - [37, 6.857]
  - - [2944, 2944, 1, 3328]
    - [39, 7.576]
  - - [5056, 6784, 1, 256]
    - [37, 7.565]
  - - [1408, 4288, 1, 3328]
    - [39, 7.426]
  - - [6784, 256, 1, 1280]
    - [39, 6.816]
  - - [1024, 704, 1, 3328]
    - [19, 6.075]
  - - [2368, 704, 1, 3328]
    - [39, 6.641]
  - - [128, 4288, 1, 256]
    - [3, 4.534]
  - - [3584, 6784, 1, 256]
    - [36, 7.495]
  - - [128, 128, 1, 3328]
    - [14, 0.595]
  - - [5056, 1856, 1, 256]
    - [17, 7.371]
  - - [704, 4288, 1, 256]
    - [17, 6.703]
  - - [256, 448, 1, 3328]
    - [11, 3.363]
  - - [1408, 6784, 1, 1280]
    - [39, 7.614]
  - - [64, 2368, 1, 1280]
    - [11, 3.451]
  - - [64, 6784, 1, 3328]
    - [1, 5.165]
  - - [2944, 256, 1, 1280]
    - [39, 6.196]
  - - [5056, 2368, 1, 3328]
    - [39, 7.767]
  - - [2944, 4288, 1, 256]
    - [36, 7.307]
  - - [1408, 3584, 1, 1280]
    - [39, 7.339]
  - - [2368, 64, 1, 256]
    - [11, 2.575]
  - - [256, 256, 1, 256]
    - [12, 1.402]
  - - [704, 128, 1, 3328]
    - [11, 2.841]
  - - [1856, 704, 1, 256]
    - [16, 6.199]
  - - [2368, 6784, 1, 3328]
    - [39, 7.762]
  - - [5056, 704, 1, 1280]
    - [39, 7.3]
  - - [1856, 4288, 1, 3328]
    - [39, 7.615]
  - - [1408, 5888, 1, 256]
    - [37, 7.332]
  - - [704, 2944, 1, 1280]
    - [39, 7.18]
  - - [4288, 64, 1, 1280]
    - [25, 4.074]
  - - [704, 1856, 1, 256]
    - [36, 6.199]
  - - [3584, 704, 1, 1280]
    - [39, 7.118]
  - - [5888, 5056, 1, 256]
    - [38, 7.572]
  - - [3584, 448, 1, 3328]
    - [39, 6.401]
  - - [704, 2368, 1, 3328]
    - [39, 6.642]
  - - [2944, 448, 1, 256]
    - [39, 5.457]
  - - [448, 5056, 1, 3328]
    - [39, 7.137]
  - - [2368, 128, 1, 1280]
    - [5, 4.46]
  - - [4288, 448, 1, 256]
    - [20, 6.169]
  - - [64, 6784, 1, 256]
    - [1, 4.298]
  - - [64, 5056, 1, 1280]
    - [5, 4.739]
  - - [5888, 2368, 1, 256]
    - [41, 7.406]
  - - [704, 448, 1, 3328]
    - [19, 3.807]
  - - [6784, 704, 1, 3328]
    - [39, 7.373]
  - - [128, 64, 1, 1280]
    - [26, 0.254]
  - - [2368, 256, 1, 1280]
    - [19, 5.043]
  - - [1408, 2944, 1, 3328]
    - [39, 7.552]
  - - [64, 1024, 1, 256]
    - [12, 1.414]
  - - [2368, 448, 1, 1280]
    - [19, 5.678]
  - - [128, 3584, 1, 256]
    - [1, 4.45]
  - - [1856, 448, 1, 3328]
    - [19, 5.523]
  - - [128, 5056, 1, 256]
    - [6, 5.168]
  - - [4288, 4288, 1, 256]
    - [36, 7.396]
  - - [2368, 704, 1, 256]
    - [36, 6.006]
  - - [3584, 2368, 1, 256]
    - [36, 7.22]
  - - [5888, 5056, 1, 1280]
    - [41, 7.819]
  - - [128, 1024, 1, 1280]
    - [11, 3.544]
  - - [64, 704, 1, 256]
    - [9, 0.981]
  - - [4288, 256, 1, 1280]
    - [39, 5.849]
  - - [3584, 3584, 1, 3328]
    - [39, 7.832]
  - - [128, 1024, 1, 256]
    - [33, 2.473]
  - - [5888, 6784, 1, 256]
    - [37, 7.56]
  - - [4288, 2944, 1, 3328]
    - [39, 7.699]
  - - [1856, 64, 1, 256]
    - [11, 2.333]
  - - [4288, 128, 1, 3328]
    - [3, 5.312]
  - - [256, 5056, 1, 1280]
    - [39, 6.851]
  - - [6784, 5888, 1, 1280]
    - [39, 7.814]
  - - [704, 128, 1, 256]
    - [12, 1.77]
  - - [5888, 4288, 1, 1280]
    - [39, 7.771]
  - - [448, 256, 1, 1280]
    - [11, 3.158]
  - - [448, 2368, 1, 3328]
    - [39, 5.744]
  - - [1, 1, 1, 1280]
    - [46, 0.0]
  - - [256, 1408, 1, 1280]
    - [19, 4.216]
  - - [1408, 1856, 1, 1280]
    - [39, 7.362]
  - - [5888, 448, 1, 3328]
    - [39, 6.887]
  - - [704, 5888, 1, 1280]
    - [39, 7.466]
  - - [256, 64, 1, 3328]
    - [34, 0.594]
  - - [128, 2368, 1, 256]
    - [5, 3.595]
  - - [6784, 64, 1, 3328]
    - [24, 5.239]
  - - [5056, 2944, 1, 3328]
    - [39, 7.815]
  - - [448, 128, 1, 256]
    - [30, 1.272]
  - - [1856, 128, 1, 1280]
    - [31, 4.482]
  - - [448, 4288, 1, 1280]
    - [39, 6.678]
  - - [64, 3584, 1, 256]
    - [10, 3.351]
  - - [128, 2944, 1, 3328]
    - [23, 5.428]
  - - [3584, 704, 1, 256]
    - [41, 6.628]
  - - [2944, 448, 1, 3328]
    - [39, 6.061]
  - - [3584, 1408, 1, 3328]
    - [39, 7.412]
  - - [2368, 1024, 1, 1280]
    - [39, 6.834]
  - - [2944, 6784, 1, 1280]
    - [39, 7.724]
  - - [1856, 6784, 1, 256]
    - [36, 7.295]
  - - [4288, 448, 1, 3328]
    - [39, 6.764]
  - - [6784, 704, 1, 1280]
    - [39, 7.298]
  - - [5888, 1024, 1, 3328]
    - [39, 7.727]
  - - [704, 6784, 1, 1280]
    - [39, 7.296]
  - - [5888, 128, 1, 256]
    - [19, 5.406]
  - - [5056, 1024, 1, 3328]
    - [39, 7.602]
  - - [704, 5056, 1, 1280]
    - [39, 7.286]
  - - [64, 704, 1, 3328]
    - [14, 1.549]
  - - [2944, 1856, 1, 256]
    - [36, 7.169]
  - - [5056, 64, 1, 256]
    - [5, 3.782]
  - - [5888, 5056, 1, 3328]
    - [41, 7.86]
  - - [128, 5056, 1, 3328]
    - [6, 6.2]
  - - [3584, 6784, 1, 1280]
    - [36, 7.803]
  - - [1856, 5888, 1, 256]
    - [37, 7.421]
  - - [64, 448, 1, 3328]
    - [35, 1.044]
  - - [4288, 4288, 1, 3328]
    - [39, 7.766]
  - - [4288, 1408, 1, 1280]
    - [39, 7.364]
  - - [64, 1856, 1, 256]
    - [11, 2.277]
  - - [4288, 2368, 1, 256]
    - [36, 7.343]
  - - [2944, 5056, 1, 1280]
    - [36, 7.754]
  - - [256, 4288, 1, 1280]
    - [39, 5.847]
  - - [6784, 2368, 1, 3328]
    - [39, 7.764]
  - - [256, 1024, 1, 1280]
    - [19, 4.417]
  - - [4288, 128, 1, 256]
    - [3, 4.503]
  - - [4288, 1856, 1, 3328]
    - [39, 7.621]
  - - [1856, 2944, 1, 1280]
    - [39, 7.575]
  - - [3584, 64, 1, 1280]
    - [13, 4.313]
  - - [4288, 6784, 1, 3328]
    - [39, 7.883]
  - - [3584, 1024, 1, 1280]
    - [39, 7.515]
  - - [1024, 4288, 1, 256]
    - [36, 7.018]
  - - [5888, 3584, 1, 3328]
    - [39, 7.822]
  - - [5056, 3584, 1, 3328]
    - [39, 7.765]
  - - [1408, 128, 1, 3328]
    - [5, 4.149]
  - - [2368, 1408, 1, 1280]
    - [39, 7.33]
  - - [5056, 2944, 1, 1280]
    - [36, 7.755]
  - - [3584, 256, 1, 256]
    - [39, 5.297]
  - - [1024, 6784, 1, 256]
    - [36, 7.158]
  - - [2944, 5056, 1, 3328]
    - [39, 7.818]
  - - [3584, 2944, 1, 256]
    - [36, 7.276]
  - - [448, 128, 1, 3328]
    - [12, 1.95]
  - - [64, 2944, 1, 3328]
    - [22, 4.347]
  - - [64, 4288, 1, 3328]
    - [25, 4.263]
  - - [5056, 6784, 1, 3328]
    - [39, 7.881]
  - - [128, 2944, 1, 256]
    - [6, 4.238]
  - - [3584, 4288, 1, 256]
    - [36, 7.419]
  - - [1856, 6784, 1, 3328]
    - [39, 7.679]
  - - [3584, 128, 1, 3328]
    - [24, 5.506]
  - - [128, 256, 1, 1280]
    - [15, 1.096]
  - - [64, 448, 1, 256]
    - [15, 0.654]
  - - [64, 256, 1, 1280]
    - [14, 0.545]
  - - [5056, 1408, 1, 1280]
    - [41, 7.459]
  - - [5888, 5888, 1, 256]
    - [37, 7.538]
  - - [4288, 1024, 1, 1280]
    - [39, 7.47]
  - - [5888, 128, 1, 3328]
    - [0, 6.359]
  - - [448, 6784, 1, 3328]
    - [39, 7.3]
  - - [2944, 1408, 1, 1280]
    - [39, 7.471]
  - - [64, 128, 1, 1280]
    - [11, 0.253]
  - - [2944, 1856, 1, 3328]
    - [39, 7.652]
  - - [448, 5056, 1, 256]
    - [36, 6.554]
  - - [64, 64, 1, 256]
    - [2, 0.082]
  - - [3584, 5888, 1, 1280]
    - [36, 7.765]
  - - [6784, 1856, 1, 1280]
    - [36, 7.619]
  - - [5888, 256, 1, 3328]
    - [39, 6.912]
  - - [1856, 5888, 1, 3328]
    - [39, 7.758]
  - - [3584, 1408, 1, 256]
    - [41, 6.984]
  - - [704, 3584, 1, 3328]
    - [39, 7.204]
  - - [5056, 448, 1, 1280]
    - [39, 7.046]
  - - [3584, 1856, 1, 3328]
    - [39, 7.566]
  - - [1408, 704, 1, 1280]
    - [19, 6.401]
  - - [2944, 1024, 1, 256]
    - [41, 6.75]
  - - [448, 1408, 1, 1280]
    - [19, 5.262]
  - - [2368, 4288, 1, 3328]
    - [39, 7.754]
  - - [1024, 1408, 1, 1280]
    - [39, 6.515]
  - - [256, 128, 1, 1280]
    - [15, 1.084]
  - - [704, 1408, 1, 1280]
    - [19, 6.397]
  - - [6784, 5056, 1, 256]
    - [38, 7.549]
  - - [4288, 5888, 1, 256]
    - [37, 7.482]
  - - [448, 2944, 1, 256]
    - [36, 5.495]
  - - [2944, 6784, 1, 256]
    - [36, 7.409]
  - - [2368, 2368, 1, 1280]
    - [39, 7.429]
  - - [1856, 3584, 1, 1280]
    - [39, 7.497]
  - - [64, 2944, 1, 256]
    - [5, 2.97]
  - - [3584, 1408, 1, 1280]
    - [39, 7.338]
  - - [5056, 3584, 1, 1280]
    - [41, 7.715]
  - - [256, 5888, 1, 256]
    - [41, 6.173]
  - - [128, 256, 1, 3328]
    - [15, 1.195]
  - - [1856, 1408, 1, 3328]
    - [39, 7.461]
  - - [1024, 4288, 1, 3328]
    - [39, 7.545]
  - - [448, 2368, 1, 256]
    - [39, 5.134]
  - - [64, 1408, 1, 1280]
    - [11, 2.646]
  - - [64, 6784, 1, 1280]
    - [24, 5.099]
  - - [2944, 2368, 1, 3328]
    - [39, 7.644]
  - - [704, 4288, 1, 3328]
    - [39, 7.25]
  - - [1024, 1856, 1, 1280]
    - [39, 6.605]
  - - [6784, 1856, 1, 256]
    - [36, 7.292]
  - - [128, 2368, 1, 3328]
    - [5, 4.643]
  - - [1024, 5888, 1, 256]
    - [36, 7.226]
  - - [64, 2944, 1, 1280]
    - [22, 4.074]
  - - [5056, 64, 1, 3328]
    - [22, 4.938]
  - - [1408, 2368, 1, 256]
    - [36, 6.845]
  - - [2944, 704, 1, 3328]
    - [39, 7.295]
  - - [256, 64, 1, 256]
    - [14, 0.367]
  - - [2944, 2944, 1, 1280]
    - [41, 7.516]
  - - [6784, 256, 1, 3328]
    - [39, 6.919]
  - - [1408, 5056, 1, 256]
    - [41, 7.166]
  - - [5056, 128, 1, 3328]
    - [23, 6.187]
  - - [128, 128, 1, 1280]
    - [14, 0.545]
  - - [448, 704, 1, 256]
    - [39, 3.084]
  - - [1856, 256, 1, 3328]
    - [28, 5.612]
  - - [2944, 128, 1, 3328]
    - [23, 5.413]
  - - [704, 256, 1, 256]
    - [19, 2.399]
  - - [256, 448, 1, 1280]
    - [11, 3.151]
  - - [704, 256, 1, 1280]
    - [29, 3.067]
  - - [64, 2368, 1, 3328]
    - [33, 3.693]
  - - [256, 704, 1, 3328]
    - [28, 3.209]
  - - [1024, 1024, 1, 256]
    - [19, 5.953]
  - - [1408, 4288, 1, 256]
    - [41, 7.045]
  - - [5888, 2368, 1, 1280]
    - [41, 7.672]
  - - [128, 256, 1, 256]
    - [9, 0.714]
  - - [256, 64, 1, 1280]
    - [14, 0.544]
  - - [2368, 5888, 1, 1280]
    - [36, 7.663]
  - - [5888, 256, 1, 1280]
    - [39, 6.798]
  - - [704, 1024, 1, 1280]
    - [39, 5.931]
  - - [2368, 1856, 1, 3328]
    - [39, 7.558]
  - - [2944, 704, 1, 256]
    - [20, 6.656]
  - - [2368, 6784, 1, 1280]
    - [37, 7.707]
  - - [2368, 1024, 1, 3328]
    - [39, 6.925]
  - - [1856, 4288, 1, 1280]
    - [39, 7.55]
  - - [704, 3584, 1, 256]
    - [36, 6.614]
  - - [704, 2944, 1, 3328]
    - [39, 7.292]
  - - [1856, 5056, 1, 3328]
    - [39, 7.756]
  - - [3584, 5056, 1, 1280]
    - [41, 7.719]
  - - [2944, 1024, 1, 3328]
    - [39, 7.241]
  - - [256, 4288, 1, 256]
    - [39, 5.291]
  - - [2368, 256, 1, 256]
    - [39, 4.428]
  - - [1408, 6784, 1, 256]
    - [36, 7.265]
  - - [6784, 1408, 1, 3328]
    - [39, 7.685]
  - - [1024, 2368, 1, 1280]
    - [39, 6.844]
  - - [704, 64, 1, 256]
    - [11, 0.99]
  - - [256, 2368, 1, 3328]
    - [19, 5.178]
  - - [6784, 2944, 1, 1280]
    - [39, 7.726]
  - - [3584, 448, 1, 1280]
    - [39, 6.31]
  - - [2944, 6784, 1, 3328]
    - [39, 7.785]
  - - [448, 5056, 1, 1280]
    - [39, 7.044]
  - - [4288, 5056, 1, 1280]
    - [36, 7.788]
  - - [128, 448, 1, 1280]
    - [30, 1.812]
  - - [4288, 704, 1, 256]
    - [17, 6.715]
  - - [64, 64, 1, 1280]
    - [30, 0.134]
  - - [5888, 704, 1, 256]
    - [41, 7.088]
  - - [256, 5888, 1, 3328]
    - [39, 6.913]
  - - [6784, 4288, 1, 256]
    - [38, 7.533]
  - - [5888, 256, 1, 256]
    - [36, 6.152]
  - - [6784, 1024, 1, 1280]
    - [39, 7.545]
  - - [704, 448, 1, 1280]
    - [19, 3.7]
  - - [128, 64, 1, 3328]
    - [11, 0.284]
  - - [448, 64, 1, 256]
    - [33, 0.654]
  - - [2944, 704, 1, 1280]
    - [39, 7.186]
  - - [6784, 3584, 1, 1280]
    - [36, 7.801]
  - - [2944, 64, 1, 1280]
    - [5, 4.096]
  - - [1408, 2944, 1, 1280]
    - [39, 7.476]
  - - [256, 1856, 1, 256]
    - [39, 4.499]
  - - [1408, 2368, 1, 3328]
    - [39, 7.417]
  - - [128, 1408, 1, 3328]
    - [5, 4.164]
  - - [2368, 2944, 1, 256]
    - [36, 7.199]
  - - [64, 5056, 1, 256]
    - [5, 3.727]
  - - [1408, 256, 1, 3328]
    - [28, 4.324]
  - - [3584, 1856, 1, 256]
    - [41, 7.182]
  - - [4288, 3584, 1, 1280]
    - [36, 7.739]
  - - [2368, 448, 1, 256]
    - [19, 5.155]
  - - [4288, 256, 1, 3328]
    - [39, 5.941]
  - - [1408, 64, 1, 256]
    - [12, 1.799]
  - - [4288, 2944, 1, 1280]
    - [39, 7.641]
  - - [5056, 448, 1, 3328]
    - [39, 7.142]
  - - [1024, 64, 1, 256]
    - [12, 1.414]
  - - [64, 2368, 1, 256]
    - [11, 2.539]
  - - [4288, 5056, 1, 3328]
    - [39, 7.845]
  - - [2944, 256, 1, 256]
    - [16, 5.342]
  - - [1024, 128, 1, 3328]
    - [33, 3.801]
  - - [256, 5056, 1, 3328]
    - [39, 6.994]
  - - [5056, 2368, 1, 256]
    - [17, 7.423]
  - - [4288, 704, 1, 3328]
    - [39, 7.249]
  - - [448, 3584, 1, 256]
    - [36, 5.802]
  - - [2368, 64, 1, 1280]
    - [11, 3.451]
  - - [1024, 1408, 1, 3328]
    - [39, 6.617]
  - - [2944, 5888, 1, 1280]
    - [36, 7.694]
  - - [5888, 3584, 1, 256]
    - [37, 7.451]
  - - [1408, 1856, 1, 3328]
    - [39, 7.464]
  - - [6784, 1408, 1, 1280]
    - [39, 7.621]
  - - [704, 2944, 1, 256]
    - [20, 6.638]
  - - [4288, 64, 1, 256]
    - [4, 3.321]
  - - [2944, 5888, 1, 3328]
    - [39, 7.754]
  - - [64, 4288, 1, 1280]
    - [4, 4.104]
  - - [6784, 64, 1, 1280]
    - [1, 5.099]
  - - [704, 1856, 1, 1280]
    - [39, 6.935]
  - - [1408, 64, 1, 3328]
    - [11, 2.829]
  - - [1408, 1408, 1, 1280]
    - [39, 6.891]
  - - [448, 1024, 1, 3328]
    - [28, 5.445]
  - - [448, 4288, 1, 3328]
    - [39, 6.763]
  - - [704, 2368, 1, 256]
    - [36, 6.033]
  - - [2944, 448, 1, 1280]
    - [19, 5.987]
  - - [5888, 2368, 1, 3328]
    - [39, 7.723]
  - - [4288, 5056, 1, 256]
    - [36, 7.476]
  - - [4288, 448, 1, 1280]
    - [39, 6.67]
  - - [5888, 704, 1, 3328]
    - [39, 7.553]
  - - [4288, 3584, 1, 3328]
    - [39, 7.799]
  - - [2944, 64, 1, 256]
    - [5, 2.97]
  - - [1024, 6784, 1, 3328]
    - [39, 7.615]
  - - [1408, 1024, 1, 256]
    - [39, 5.935]
  - - [448, 1024, 1, 256]
    - [39, 4.396]
  - - [6784, 6784, 1, 3328]
    - [41, 7.888]
  - - [1024, 448, 1, 1280]
    - [28, 5.279]
  - - [704, 5056, 1, 3328]
    - [39, 7.377]
  - - [256, 2368, 1, 1280]
    - [19, 5.053]
  - - [3584, 5056, 1, 3328]
    - [41, 7.761]
  - - [2368, 2944, 1, 3328]
    - [39, 7.639]
  - - [448, 448, 1, 1280]
    - [27, 3.786]
  - - [2368, 3584, 1, 256]
    - [36, 7.231]
  - - [1024, 256, 1, 1280]
    - [39, 4.41]
  - - [128, 5056, 1, 1280]
    - [6, 6.056]
  - - [3584, 2368, 1, 1280]
    - [39, 7.581]
  - - [1856, 1856, 1, 256]
    - [41, 6.645]
  - - [4288, 1408, 1, 3328]
    - [39, 7.43]
  - - [3584, 64, 1, 3328]
    - [27, 4.542]
  - - [1, 1, 1, 1]
    - [44, 0.0]
  - - [256, 1024, 1, 3328]
    - [28, 4.649]
  - - [1856, 64, 1, 3328]
    - [11, 3.477]
  - - [5888, 1408, 1, 3328]
    - [39, 7.692]
  - - [256, 5056, 1, 256]
    - [36, 6.128]
  - - [1856, 64, 1, 1280]
    - [33, 3.263]
  - - [1408, 256, 1, 256]
    - [39, 3.496]
  - - [2368, 5056, 1, 256]
    - [17, 7.421]
  - - [128, 5888, 1, 3328]
    - [39, 6.342]
  - - [1024, 5056, 1, 256]
    - [41, 7.17]
  - - [2368, 1408, 1, 3328]
    - [39, 7.413]
  - - [5888, 448, 1, 256]
    - [36, 6.383]
  - - [6784, 5056, 1, 1280]
    - [39, 7.825]
  - - [4288, 6784, 1, 1280]
    - [36, 7.828]
  - - [2368, 448, 1, 3328]
    - [39, 5.743]
  - - [1024, 128, 1, 256]
    - [12, 2.512]
  - - [448, 128, 1, 1280]
    - [12, 1.822]
  - - [1024, 64, 1, 3328]
    - [30, 2.228]
  - - [64, 3584, 1, 1280]
    - [27, 4.307]
  - - [6784, 1408, 1, 256]
    - [36, 7.267]
  - - [5888, 4288, 1, 256]
    - [36, 7.464]
  - - [5056, 5888, 1, 256]
    - [37, 7.587]
  - - [2368, 1024, 1, 256]
    - [36, 6.384]
  - - [1856, 6784, 1, 1280]
    - [36, 7.613]
  - - [3584, 128, 1, 1280]
    - [24, 5.361]
  - - [128, 64, 1, 256]
    - [2, 0.162]
  - - [1408, 448, 1, 256]
    - [39, 4.566]
  - - [64, 256, 1, 3328]
    - [14, 0.595]
  - - [6784, 448, 1, 3328]
    - [39, 7.296]
  - - [5056, 1856, 1, 1280]
    - [39, 7.693]
  - - [1408, 1024, 1, 3328]
    - [39, 6.617]
  - - [2368, 256, 1, 3328]
    - [19, 5.177]
  - - [5888, 3584, 1, 1280]
    - [36, 7.764]
  - - [5888, 128, 1, 1280]
    - [19, 6.218]
  - - [1024, 2944, 1, 256]
    - [41, 6.712]
  - - [448, 6784, 1, 1280]
    - [39, 7.212]
  - - [256, 3584, 1, 1280]
    - [19, 5.963]
  - - [704, 5056, 1, 256]
    - [17, 6.86]
  - - [3584, 1024, 1, 3328]
    - [39, 7.604]
  - - [2944, 1856, 1, 1280]
    - [39, 7.573]
  - - [5056, 256, 1, 256]
    - [16, 6.165]
  - - [128, 5888, 1, 256]
    - [0, 5.39]
  - - [2368, 3584, 1, 3328]
    - [39, 7.641]
  - - [3584, 5888, 1, 3328]
    - [39, 7.82]
  - - [2944, 3584, 1, 1280]
    - [39, 7.609]
  - - [1856, 5888, 1, 1280]
    - [39, 7.688]
  - - [256, 256, 1, 1280]
    - [30, 2.055]
  - - [4288, 1408, 1, 256]
    - [37, 7.032]
  - - [3584, 64, 1, 256]
    - [21, 3.351]
  - - [64, 1856, 1, 3328]
    - [11, 3.474]
  - - [1408, 128, 1, 256]
    - [22, 2.878]
  - - [4288, 2368, 1, 1280]
    - [39, 7.686]
  - - [2944, 5056, 1, 256]
    - [36, 7.426]
  - - [256, 128, 1, 3328]
    - [15, 1.195]
  - - [6784, 2368, 1, 256]
    - [38, 7.448]
  - - [1408, 448, 1, 3328]
    - [19, 5.388]
  - - [4288, 1856, 1, 256]
    - [36, 7.198]
  - - [1856, 2944, 1, 256]
    - [36, 7.165]
  - - [64, 5888, 1, 1280]
    - [18, 4.993]
  - - [1856, 1408, 1, 1280]
    - [39, 7.352]
  - - [128, 704, 1, 256]
    - [8, 1.784]
  - - [1024, 4288, 1, 1280]
    - [39, 7.466]
  - - [2368, 5056, 1, 3328]
    - [39, 7.773]
  - - [4288, 1024, 1, 3328]
    - [39, 7.548]
  - - [1024, 5056, 1, 3328]
    - [39, 7.603]
  - - [1024, 1856, 1, 3328]
    - [39, 6.69]
  - - [704, 704, 1, 1280]
    - [19, 5.692]
  - - [128, 2368, 1, 1280]
    - [5, 4.46]
  - - [3584, 256, 1, 1280]
    - [19, 5.973]
  - - [5888, 64, 1, 1280]
    - [23, 5.224]
  - - [128, 704, 1, 3328]
    - [33, 2.829]
  - - [3584, 2944, 1, 3328]
    - [39, 7.671]
  - - [128, 1856, 1, 256]
    - [21, 3.408]
  - - [64, 4288, 1, 256]
    - [4, 3.304]
  - - [5888, 2944, 1, 256]
    - [36, 7.383]
  - - [5056, 128, 1, 1280]
    - [6, 6.052]
  - - [448, 1856, 1, 3328]
    - [19, 5.53]
  - - [5056, 4288, 1, 256]
    - [36, 7.473]
  - - [1024, 448, 1, 256]
    - [19, 4.379]
  - - [1024, 3584, 1, 256]
    - [41, 7.051]
  - - [2944, 128, 1, 1280]
    - [23, 5.237]
  - - [64, 256, 1, 256]
    - [8, 0.36]
  - - [704, 256, 1, 3328]
    - [29, 3.186]
  - - [5056, 1408, 1, 256]
    - [37, 7.163]
  - - [5888, 5888, 1, 1280]
    - [39, 7.794]
  - - [448, 5888, 1, 1280]
    - [39, 6.807]
  - - [1, 1, 1, 256]
    - [45, 0.0]
  - - [4288, 704, 1, 1280]
    - [39, 7.166]
  - - [2944, 1408, 1, 256]
    - [38, 7.053]
  - - [256, 2944, 1, 1280]
    - [39, 6.213]
  - - [2368, 5888, 1, 3328]
    - [39, 7.725]
  - - [704, 1024, 1, 3328]
    - [19, 6.081]
  - - [2368, 1856, 1, 1280]
    - [39, 7.472]
  - - [1856, 448, 1, 1280]
    - [19, 5.437]
  - - [128, 6784, 1, 256]
    - [6, 5.432]
  - - [5888, 4288, 1, 3328]
    - [39, 7.826]
  - - [1856, 128, 1, 256]
    - [3, 3.492]
  - - [5056, 448, 1, 256]
    - [36, 6.538]
  - - [1856, 5056, 1, 1280]
    - [39, 7.688]
  - - [2944, 1024, 1, 1280]
    - [39, 7.157]
  - - [2368, 4288, 1, 256]
    - [36, 7.34]
  - - [1024, 2368, 1, 3328]
    - [39, 6.927]
  - - [4288, 64, 1, 3328]
    - [25, 4.235]
  - - [704, 1408, 1, 256]
    - [39, 5.695]
  - - [4288, 5888, 1, 3328]
    - [39, 7.824]
  - - [448, 2944, 1, 1280]
    - [39, 5.964]
  - - [1024, 2944, 1, 3328]
    - [39, 7.241]
  - - [256, 6784, 1, 1280]
    - [39, 6.814]
  - - [1856, 3584, 1, 256]
    - [37, 7.178]
  - - [128, 448, 1, 3328]
    - [8, 1.954]
  - - [1856, 256, 1, 256]
    - [19, 4.517]
  - - [5056, 128, 1, 256]
    - [6, 5.203]
  - - [256, 5888, 1, 1280]
    - [39, 6.803]
  - - [6784, 128, 1, 1280]
    - [23, 6.097]
  - - [64, 1408, 1, 256]
    - [11, 1.83]
  - - [2944, 2368, 1, 256]
    - [36, 7.196]
  - - [1856, 448, 1, 256]
    - [39, 4.859]
  - - [1024, 1856, 1, 256]
    - [20, 6.112]
  - - [6784, 3584, 1, 3328]
    - [39, 7.853]
  - - [2944, 64, 1, 3328]
    - [5, 4.34]
  - - [1024, 5888, 1, 3328]
    - [39, 7.73]
  - - [1408, 2368, 1, 1280]
    - [39, 7.334]
  - - [128, 1408, 1, 1280]
    - [5, 3.925]
  - - [128, 1856, 1, 3328]
    - [31, 4.71]
  - - [2944, 2944, 1, 256]
    - [37, 7.232]
  - - [6784, 256, 1, 256]
    - [36, 6.219]
  - - [128, 4288, 1, 1280]
    - [3, 5.222]
  - - [5888, 1408, 1, 256]
    - [41, 7.321]
  - - [128, 128, 1, 256]
    - [7, 0.37]
  - - [448, 704, 1, 3328]
    - [19, 3.8]
  - - [448, 1856, 1, 256]
    - [36, 4.823]
  - - [1856, 704, 1, 3328]
    - [39, 7.06]
  - - [5888, 6784, 1, 3328]
    - [39, 7.867]
  - - [704, 4288, 1, 1280]
    - [39, 7.166]
  - - [4096, 7000, 1, 4096]
    - [69, 12.773]
  - - [5124, 9124, 1, 1760]
    - [68, 13.175]
  - - [1760, 32, 1, 1760]
    - [51, 1.546]
  - - [1024, 1500, 1, 1536]
    - [62, 10.666]
  - - [512, 24000, 1, 2048]
    - [71, 11.656]
  - - [3072, 24000, 1, 1024]
    - [69, 13.246]
  - - [1024, 3000, 1, 2560]
    - [69, 12.434]
  - - [512, 3136, 1, 2048]
    - [79, 9.51]
  - - [7680, 4, 1, 2560]
    - [51, 0.845]
  - - [64, 193600, 1, 64]
    - [68, 10.056]
  - - [8448, 1500, 1, 2816]
    - [68, 12.603]
  - - [2560, 7000, 1, 2560]
    - [68, 12.934]
  - - [3072, 16, 1, 1024]
    - [47, 1.27]
  - - [512, 48000, 1, 2048]
    - [71, 11.976]
  - - [1760, 64, 1, 1760]
    - [64, 3.113]
  - - [1024, 16, 1, 512]
    - [49, 0.33]
  - - [196, 256, 64, 1024]
    - [471, 29.704]
  - - [512, 48000, 1, 1536]
    - [69, 13.24]
  - - [2560, 32, 1, 2560]
    - [51, 2.274]
  - - [4608, 1500, 1, 1536]
    - [69, 12.359]
  - - [2048, 128, 1, 2048]
    - [66, 6.344]
  - - [1024, 24000, 1, 2560]
    - [68, 13.286]
  - - [4608, 3000, 1, 1536]
    - [69, 12.652]
  - - [5124, 9124, 1, 2048]
    - [69, 12.228]
  - - [2048, 16, 1, 2048]
    - [50, 0.912]
  - - [1024, 700, 1, 512]
    - [61, 7.038]
  - - [3072, 1, 1, 128]
    - [47, 0.043]
  - - [5124, 700, 1, 2560]
    - [69, 11.017]
  - - [8448, 16, 1, 2816]
    - [48, 3.503]
  - - [6144, 6000, 1, 2560]
    - [63, 12.359]
  - - [4608, 32, 1, 1536]
    - [47, 3.84]
  - - [3072, 64, 1, 1024]
    - [59, 4.794]
  - - [512, 16, 1, 512]
    - [49, 0.165]
  - - [7680, 2, 1, 2560]
    - [51, 0.424]
  - - [4224, 1, 1, 128]
    - [47, 0.059]
  - - [7680, 1, 1, 2560]
    - [51, 0.212]
  - - [128, 1500, 1, 1280]
    - [47, 4.893]
  - - [1024, 1500, 1, 2816]
    - [62, 10.873]
  - - [6144, 2, 1, 2560]
    - [51, 0.337]
  - - [8448, 48000, 1, 2816]
    - [69, 11.618]
  - - [512, 6000, 1, 2048]
    - [72, 9.075]
  - - [4224, 1500, 1, 176]
    - [57, 10.499]
  - - [1024, 6000, 1, 2816]
    - [68, 13.17]
  - - [1024, 48000, 1, 1536]
    - [69, 13.536]
  - - [1024, 48000, 1, 2560]
    - [68, 13.667]
  - - [4096, 32, 1, 4096]
    - [52, 3.615]
  - - [512, 16, 1, 500000]
    - [49, 0.248]
  - - [2560, 128, 1, 2560]
    - [64, 6.493]
  - - [4608, 24000, 1, 1536]
    - [68, 13.7]
  - - [512, 2, 1, 500000]
    - [49, 0.031]
  - - [7680, 48000, 1, 2560]
    - [69, 11.713]
  - - [3072, 48000, 1, 1024]
    - [69, 13.466]
  - - [1760, 16, 1, 1760]
    - [47, 0.776]
  - - [1024, 1500, 1, 2048]
    - [65, 8.337]
  - - [1024, 16, 1, 500000]
    - [49, 0.495]
  - - [64, 193600, 1, 256]
    - [73, 11.737]
  - - [1024, 3000, 1, 2048]
    - [70, 9.114]
  - - [6144, 4, 1, 2560]
    - [51, 0.678]
  - - [1024, 6000, 1, 2048]
    - [71, 10.898]
  - - [512, 24000, 1, 2816]
    - [68, 13.314]
  - - [6144, 48000, 1, 2560]
    - [71, 10.807]
  - - [1760, 7000, 1, 1760]
    - [58, 12.493]
  - - [8448, 3000, 1, 2816]
    - [68, 13.199]
  - - [3072, 4, 1, 1024]
    - [47, 0.317]
  - - [4608, 48000, 1, 1536]
    - [68, 13.803]
  - - [2048, 32, 1, 2048]
    - [67, 1.802]
  - - [7680, 1500, 1, 2560]
    - [69, 12.174]
  - - [4096, 128, 1, 4096]
    - [60, 8.618]
  - - [4608, 16, 1, 1536]
    - [51, 1.988]
  - - [512, 3000, 1, 1536]
    - [62, 10.677]
  - - [3072, 2, 1, 1024]
    - [47, 0.161]
  - - [8448, 1, 1, 2816]
    - [48, 0.217]
  - - [1024, 3000, 1, 2816]
    - [68, 12.729]
  - - [128, 1, 1, 1408]
    - [47, 0.004]
  - - [64, 1, 1, 1216]
    - [49, 0.002]
  - - [1024, 2, 1, 512]
    - [49, 0.041]
  - - [1024, 4, 1, 500000]
    - [49, 0.124]
  - - [6144, 1, 1, 2560]
    - [51, 0.17]
  - - [5124, 9124, 1, 2560]
    - [69, 12.812]
  - - [512, 48000, 1, 2816]
    - [68, 13.521]
  - - [512, 3000, 1, 2816]
    - [62, 10.878]
  - - [1024, 24000, 1, 1536]
    - [69, 13.198]
  - - [7680, 6000, 1, 2560]
    - [68, 13.271]
  - - [1760, 128, 1, 1760]
    - [66, 5.613]
  - - [512, 1500, 1, 2816]
    - [61, 8.44]
  - - [512, 1, 1, 512]
    - [53, 0.012]
  - - [512, 6000, 1, 2560]
    - [69, 12.47]
  - - [512, 8, 1, 500000]
    - [49, 0.124]
  - - [512, 24000, 1, 2560]
    - [69, 13.148]
  - - [6144, 3000, 1, 2560]
    - [71, 12.058]
  - - [1024, 24000, 1, 2816]
    - [68, 13.579]
  - - [2048, 7000, 1, 2048]
    - [71, 11.849]
  - - [7680, 3000, 1, 2560]
    - [63, 12.113]
  - - [1024, 4, 1, 512]
    - [49, 0.083]
  - - [5124, 700, 1, 2048]
    - [71, 9.788]
  - - [5124, 9124, 1, 4096]
    - [63, 11.835]
  - - [4096, 64, 1, 4096]
    - [67, 6.296]
  - - [256, 193600, 1, 64]
    - [55, 10.826]
  - - [7680, 32, 1, 2560]
    - [54, 6.365]
  - - [2560, 64, 1, 2560]
    - [59, 4.4]
  - - [3072, 128, 1, 1024]
    - [64, 7.123]
  - - [8448, 6000, 1, 2816]
    - [69, 13.321]
  - - [7680, 64, 1, 2560]
    - [49, 8.357]
  - - [5124, 1500, 1, 2560]
    - [69, 12.081]
  - - [1024, 1500, 1, 2560]
    - [62, 10.817]
  - - [512, 4, 1, 512]
    - [53, 0.048]
  - - [1024, 6000, 1, 2560]
    - [69, 12.881]
  - - [3072, 32, 1, 1024]
    - [67, 2.519]
  - - [6144, 32, 1, 2560]
    - [59, 5.153]
  - - [196, 1024, 64, 256]
    - [471, 29.505]
  - - [512, 50176, 1, 128]
    - [75, 11.895]
  - - [4608, 1, 1, 1536]
    - [51, 0.124]
  - - [1024, 32, 1, 512]
    - [49, 0.68]
  - - [7680, 24000, 1, 2560]
    - [69, 12.896]
  - - [8448, 4, 1, 2816]
    - [51, 0.865]
  - - [512, 1, 1, 500000]
    - [49, 0.015]
  - - [176, 1500, 1, 1408]
    - [49, 5.049]
  - - [512, 3000, 1, 2560]
    - [62, 10.833]
  - - [8448, 24000, 1, 2816]
    - [69, 10.875]
  - - [4608, 2, 1, 1536]
    - [51, 0.247]
  - - [512, 6000, 1, 1536]
    - [69, 12.29]
  - - [7680, 128, 1, 2560]
    - [56, 10.352]
  - - [3072, 6000, 1, 1024]
    - [69, 12.559]
  - - [3072, 1500, 1, 128]
    - [68, 9.65]
  - - [2048, 3136, 1, 512]
    - [77, 11.759]
  - - [1024, 3000, 1, 1536]
    - [69, 12.253]
  - - [512, 4, 1, 500000]
    - [49, 0.062]
  - - [512, 6000, 1, 2816]
    - [69, 12.517]
  - - [128, 50176, 1, 512]
    - [74, 11.932]
  - - [256, 12544, 1, 1024]
    - [78, 10.481]
  - - [1024, 12544, 1, 256]
    - [76, 12.265]
  - - [512, 48000, 1, 2560]
    - [69, 13.287]
  - - [2560, 16, 1, 2560]
    - [47, 1.149]
  - - [2048, 64, 1, 2048]
    - [67, 3.533]
  - - [512, 2, 1, 512]
    - [53, 0.024]
  - - [1024, 1, 1, 512]
    - [49, 0.021]
  - - [512, 1500, 1, 2560]
    - [61, 8.273]
  - - [512, 24000, 1, 1536]
    - [69, 13.079]
  - - [1024, 1, 1, 500000]
    - [49, 0.031]
  - - [6144, 16, 1, 2560]
    - [51, 2.707]
  - - [1024, 24000, 1, 2048]
    - [71, 11.97]
  - - [4096, 16, 1, 4096]
    - [52, 1.878]
  - - [512, 32, 1, 512]
    - [49, 0.341]
  - - [5124, 1500, 1, 2048]
    - [71, 10.763]
  - - [3072, 1500, 1, 1024]
    - [62, 10.993]
  - - [1024, 2, 1, 500000]
    - [49, 0.062]
  - - [1024, 8, 1, 500000]
    - [49, 0.247]
  - - [7680, 16, 1, 2560]
    - [51, 3.38]
  - - [6144, 1500, 1, 2560]
    - [69, 12.713]
  - - [3072, 1, 1, 1024]
    - [47, 0.08]
  - - [1024, 48000, 1, 2816]
    - [68, 13.914]
  - - [8448, 2, 1, 2816]
    - [51, 0.434]
  - - [4608, 4, 1, 1536]
    - [51, 0.493]
  - - [1024, 6000, 1, 1536]
    - [69, 12.801]
  - - [8448, 32, 1, 2816]
    - [49, 5.401]
  - - [512, 3000, 1, 2048]
    - [71, 8.347]
  - - [6144, 24000, 1, 2560]
    - [71, 11.945]
  - - [4608, 6000, 1, 1536]
    - [69, 13.229]
  - - [1024, 1024, 1, 1024]
    - [290, 36.539]
  - - [512, 1500, 1, 2048]
    - [71, 6.937]
  - - [512, 1500, 1, 1536]
    - [61, 8.099]
  - - [128, 1, 1, 1024]
    - [47, 0.003]
  - - [3072, 3000, 1, 1024]
    - [71, 11.785]
  - - [1024, 48000, 1, 2048]
    - [69, 12.578]
  - - [3136, 64, 128, 64]
    - [98, 11.398]
  - - [784, 512, 64, 128]
    - [481, 28.949]
  - - [3136, 256, 64, 64]
    - [506, 24.443]
  - - [12544, 1024, 1, 256]
    - [94, 15.558]
  - - [784, 128, 128, 512]
    - [93, 14.852]
  - - [784, 512, 256, 128]
    - [97, 13.829]
  - - [3136, 64, 64, 256]
    - [467, 29.28]
  - - [3136, 512, 1, 2048]
    - [96, 11.648]
  - - [12544, 256, 1, 1024]
    - [99, 13.213]
  - - [3136, 2048, 1, 512]
    - [92, 14.598]
  - - [3136, 256, 256, 64]
    - [100, 13.548]
  - - [3136, 64, 128, 256]
    - [92, 14.906]
  - - [784, 128, 64, 512]
    - [512, 37.992]
  - - [3136, 64, 256, 64]
    - [98, 11.552]
  - - [784, 512, 128, 128]
    - [91, 14.327]
  - - [3136, 64, 64, 64]
    - [467, 17.686]
  - - [784, 128, 256, 512]
    - [93, 15.098]
  - - [3136, 64, 256, 256]
    - [95, 15.01]
  - - [3136, 256, 128, 64]
    - [90, 13.708]
  - - [64, 14, 1, 14]
    - [108, 0.001]
  - - [64, 14, 1, 15]
    - [108, 0.001]
  - - [64, 15, 1, 15]
    - [107, 0.001]
  - - [64, 15, 1, 15]
    - [107, 0.001]
  - - [64, 15, 1, 17]
    - [107, 0.001]
  - - [64, 17, 1, 17]
    - [107, 0.001]
  - - [64, 17, 1, 17]
    - [107, 0.001]
  - - [64, 17, 1, 21]
    - [108, 0.002]
  - - [64, 21, 1, 21]
    - [108, 0.003]
  - - [64, 24, 1, 24]
    - [108, 0.004]
  - - [64, 24, 1, 34]
    - [108, 0.004]
  - - [64, 30, 1, 30]
    - [108, 0.005]
  - - [64, 31, 1, 30]
    - [112, 0.006]
  - - [64, 31, 1, 31]
    - [113, 0.006]
  - - [64, 32, 1, 32]
    - [109, 0.007]
  - - [64, 34, 1, 34]
    - [111, 0.007]
  - - [64, 35, 1, 32]
    - [110, 0.007]
  - - [64, 35, 1, 35]
    - [108, 0.007]
  - - [64, 128, 512, 128]
    - [401, 15.271]
  - - [64, 512, 1, 512]
    - [464, 1.805]
  - - [64, 512, 64, 512]
    - [296, 25.121]
  - - [128, 128, 512, 64]
    - [431, 15.318]
  - - [512, 512, 1, 64]
    - [339, 2.492]
  - - [512, 512, 64, 64]
    - [295, 22.89]
  - - [1024, 4, 1, 2]
    - [283, 0.001]
  - - [1024, 4, 1, 1024]
    - [398, 0.299]
  - - [1024, 32, 1, 2]
    - [306, 0.011]
  - - [1024, 32, 1, 1024]
    - [288, 2.473]
  - - [1024, 2048, 1, 2]
    - [396, 0.327]
  - - [1024, 2048, 1, 1024]
    - [361, 41.956]
  - - [1024, 2048, 1, 4096]
    - [430, 50.117]
  - - [1024, 2048, 1, 30528]
    - [419, 57.966]
  - - [1024, 4096, 1, 1024]
    - [316, 57.833]
  - - [1024, 4096, 1, 4096]
    - [316, 66.053]
  - - [1024, 4096, 1, 30528]
    - [285, 71.313]
  - - [4096, 2048, 1, 1024]
    - [373, 56.098]
  - - [4096, 4096, 1, 1024]
    - [329, 66.326]
  - - [32, 33, 1600, 33]
    - [342, 2.268]
  - - [32, 200, 1, 1]
    - [350, 0.001]
  - - [64, 3, 512, 3]
    - [310, 0.027]
  - - [64, 5, 512, 5]
    - [310, 0.073]
  - - [64, 5, 960, 5]
    - [406, 0.116]
  - - [64, 9, 512, 9]
    - [391, 0.23]
  - - [64, 512, 1, 1]
    - [327, 0.006]
  - - [67, 512, 1, 2048]
    - [288, 3.192]
  - - [74, 512, 1, 2048]
    - [288, 3.649]
  - - [74, 960, 1, 2048]
    - [288, 5.971]
  - - [100, 512, 1, 2048]
    - [288, 5.22]
  - - [128, 27, 32768, 27]
    - [292, 4.318]
  - - [256, 1024, 1, 1]
    - [356, 0.042]
  - - [256, 8976, 1, 1536]
    - [317, 50.582]
  - - [256, 8976, 1, 2048]
    - [317, 51.57]
  - - [256, 8976, 1, 2304]
    - [320, 52.877]
  - - [256, 8976, 1, 2560]
    - [317, 53.343]
  - - [256, 8976, 1, 2816]
    - [317, 54.067]
  - - [256, 8976, 1, 3072]
    - [295, 54.06]
  - - [256, 8976, 1, 4352]
    - [321, 54.889]
  - - [256, 8976, 1, 4864]
    - [328, 54.993]
  - - [256, 8976, 1, 5376]
    - [426, 55.208]
  - - [256, 8976, 1, 5632]
    - [321, 55.276]
  - - [256, 8976, 1, 5888]
    - [328, 55.026]
  - - [256, 8976, 1, 6144]
    - [429, 55.234]
  - - [256, 8976, 1, 6656]
    - [328, 55.477]
  - - [256, 8976, 1, 7168]
    - [400, 56.587]
  - - [256, 8976, 1, 7424]
    - [282, 55.684]
  - - [256, 8976, 1, 8192]
    - [282, 55.189]
  - - [256, 8976, 1, 8448]
    - [282, 55.914]
  - - [256, 8976, 1, 8960]
    - [282, 56.141]
  - - [256, 8976, 1, 9472]
    - [328, 56.051]
  - - [256, 8976, 1, 9728]
    - [293, 56.174]
  - - [256, 8976, 1, 9984]
    - [321, 55.794]
  - - [256, 8976, 1, 10240]
    - [282, 56.088]
  - - [256, 8976, 1, 10496]
    - [282, 55.882]
  - - [256, 8976, 1, 11008]
    - [330, 55.896]
  - - [256, 8976, 1, 11520]
    - [295, 56.417]
  - - [256, 8976, 1, 12288]
    - [365, 56.595]
  - - [256, 8976, 1, 14336]
    - [293, 56.071]
  - - [256, 8976, 1, 14848]
    - [282, 56.602]
  - - [256, 8976, 1, 15104]
    - [365, 56.664]
  - - [256, 8976, 1, 15872]
    - [282, 56.565]
  - - [256, 8976, 1, 17152]
    - [460, 57.442]
  - - [256, 8976, 1, 19712]
    - [453, 56.301]
  - - [256, 8976, 1, 19968]
    - [441, 56.218]
  - - [256, 8976, 1, 20480]
    - [372, 55.931]
  - - [256, 8976, 1, 20992]
    - [308, 56.314]
  - - [256, 8976, 1, 22016]
    - [364, 56.415]
  - - [256, 8976, 1, 26112]
    - [456, 56.638]
  - - [256, 8976, 1, 33536]
    - [303, 56.584]
  - - [256, 8976, 1, 44505]
    - [422, 55.941]
  - - [256, 32768, 1, 128]
    - [335, 29.995]
  - - [257, 1024, 1, 4096]
    - [386, 16.245]
  - - [480, 32768, 1, 1024]
    - [438, 61.471]
  - - [512, 200, 1, 1]
    - [327, 0.018]
  - - [512, 200, 1, 32]
    - [310, 0.558]
  - - [512, 215, 1, 2048]
    - [423, 10.549]
  - - [512, 256, 1, 2048]
    - [287, 11.115]
  - - [512, 1600, 1, 32]
    - [344, 3.833]
  - - [512, 1600, 1, 512]
    - [300, 23.789]
  - - [512, 32768, 1, 256]
    - [347, 46.956]
  - - [560, 200, 1, 1024]
    - [287, 7.612]
  - - [560, 1600, 1, 1024]
    - [349, 31.919]
  - - [768, 215, 1, 2048]
    - [352, 13.582]
  - - [768, 256, 1, 2048]
    - [287, 15.571]
  - - [1024, 200, 1, 1]
    - [357, 0.034]
  - - [1024, 512, 1, 1]
    - [445, 0.073]
  - - [1024, 512, 1, 64]
    - [363, 4.551]
  - - [1024, 512, 1, 1024]
    - [383, 22.036]
  - - [1024, 960, 1, 64]
    - [454, 7.747]
  - - [1024, 960, 1, 1024]
    - [408, 36.093]
  - - [1024, 1600, 1, 1]
    - [281, 0.168]
  - - [1024, 1600, 1, 1024]
    - [291, 39.849]
  - - [1024, 1792, 1, 256]
    - [437, 26.325]
  - - [1024, 2048, 1, 256]
    - [317, 27.012]
  - - [1024, 2560, 1, 256]
    - [317, 30.635]
  - - [1024, 3072, 1, 256]
    - [405, 31.533]
  - - [1024, 3328, 1, 256]
    - [389, 33.877]
  - - [1024, 3840, 1, 256]
    - [395, 37.531]
  - - [1024, 4096, 1, 256]
    - [317, 34.063]
  - - [1024, 4608, 1, 256]
    - [418, 38.062]
  - - [1024, 4864, 1, 256]
    - [317, 38.245]
  - - [1024, 5120, 1, 256]
    - [335, 39.499]
  - - [1024, 5632, 1, 256]
    - [317, 39.14]
  - - [1024, 6144, 1, 256]
    - [446, 38.353]
  - - [1024, 6400, 1, 256]
    - [439, 38.294]
  - - [1024, 7168, 1, 256]
    - [439, 40.057]
  - - [1024, 7424, 1, 256]
    - [317, 41.02]
  - - [1024, 7680, 1, 256]
    - [317, 42.149]
  - - [1024, 7936, 1, 256]
    - [347, 41.69]
  - - [1024, 8192, 1, 256]
    - [335, 41.869]
  - - [1024, 8448, 1, 256]
    - [317, 41.45]
  - - [1024, 8704, 1, 256]
    - [463, 40.595]
  - - [1024, 8960, 1, 256]
    - [309, 41.71]
  - - [1024, 9728, 1, 256]
    - [317, 42.239]
  - - [1024, 9984, 1, 256]
    - [317, 43.046]
  - - [1024, 10240, 1, 256]
    - [448, 42.796]
  - - [1024, 10496, 1, 256]
    - [317, 43.131]
  - - [1024, 11008, 1, 256]
    - [317, 42.934]
  - - [1024, 11264, 1, 256]
    - [324, 43.517]
  - - [1024, 11520, 1, 256]
    - [284, 44.296]
  - - [1024, 12288, 1, 256]
    - [312, 44.462]
  - - [1024, 13312, 1, 256]
    - [449, 44.192]
  - - [1024, 13568, 1, 256]
    - [309, 44.559]
  - - [1024, 14336, 1, 256]
    - [312, 44.859]
  - - [1024, 14592, 1, 256]
    - [415, 45.428]
  - - [1024, 14848, 1, 256]
    - [294, 45.249]
  - - [1024, 15104, 1, 256]
    - [312, 45.187]
  - - [1024, 16128, 1, 256]
    - [415, 46.168]
  - - [1024, 17152, 1, 256]
    - [309, 45.786]
  - - [1024, 18944, 1, 256]
    - [284, 46.708]
  - - [1024, 19712, 1, 256]
    - [309, 46.232]
  - - [1024, 19968, 1, 256]
    - [312, 47.147]
  - - [1024, 20480, 1, 256]
    - [309, 46.781]
  - - [1024, 20992, 1, 256]
    - [312, 46.732]
  - - [1024, 21504, 1, 256]
    - [312, 47.314]
  - - [1024, 22016, 1, 256]
    - [309, 47.713]
  - - [1024, 23552, 1, 256]
    - [309, 47.166]
  - - [1024, 28672, 1, 256]
    - [312, 48.178]
  - - [1024, 32768, 1, 512]
    - [294, 61.317]
  - - [1024, 32768, 1, 1024]
    - [284, 71.855]
  - - [1024, 33536, 1, 256]
    - [312, 48.567]
  - - [1024, 40448, 1, 256]
    - [309, 49.074]
  - - [1600, 512, 1, 1024]
    - [375, 32.306]
  - - [2048, 512, 1, 1]
    - [298, 0.114]
  - - [2048, 512, 1, 2048]
    - [369, 40.682]
  - - [2048, 960, 1, 2048]
    - [440, 46.235]
  - - [2048, 1024, 1, 1]
    - [331, 0.166]
  - - [2048, 1024, 1, 256]
    - [347, 27.158]
  - - [3200, 1024, 1, 2048]
    - [299, 64.946]
  - - [4096, 1024, 1, 1]
    - [337, 0.221]
  - - [64, 14, 10880, 14]
    - [292, 1.312]
  - - [64, 14, 10880, 15]
    - [292, 1.393]
  - - [64, 15, 7680, 15]
    - [292, 1.431]
  - - [64, 15, 10880, 15]
    - [292, 1.475]
  - - [64, 15, 7680, 17]
    - [292, 1.509]
  - - [64, 17, 6144, 17]
    - [292, 1.664]
  - - [64, 17, 7680, 17]
    - [292, 1.672]
  - - [64, 17, 6144, 21]
    - [292, 1.997]
  - - [64, 21, 6144, 21]
    - [292, 2.441]
  - - [64, 24, 4736, 24]
    - [292, 3.065]
  - - [64, 24, 4736, 34]
    - [368, 3.728]
  - - [64, 30, 2048, 30]
    - [292, 3.73]
  - - [64, 31, 2048, 30]
    - [368, 3.777]
  - - [64, 31, 2048, 31]
    - [368, 3.904]
  - - [64, 32, 4608, 32]
    - [451, 6.527]
  - - [64, 34, 4736, 34]
    - [374, 3.423]
  - - [64, 35, 4608, 32]
    - [292, 5.33]
  - - [64, 35, 4608, 35]
    - [362, 3.446]
  - - [1024, 3840, 1, 1024]
    - [311, 64.856]
  - - [1024, 3840, 1, 4096]
    - [294, 77.894]
  - - [1024, 3968, 1, 1024]
    - [407, 54.534]
  - - [1024, 3968, 1, 4096]
    - [393, 64.095]
  - - [1024, 3968, 1, 42720]
    - [285, 71.325]
  - - [1024, 6528, 1, 1024]
    - [284, 61.477]
  - - [1024, 6528, 1, 4096]
    - [294, 73.694]
  - - [1024, 6528, 1, 42720]
    - [311, 81.02]
  - - [1024, 7104, 1, 1024]
    - [343, 62.803]
  - - [1024, 7104, 1, 4096]
    - [294, 78.239]
  - - [1024, 7104, 1, 42720]
    - [311, 86.181]
  - - [1024, 7200, 1, 1024]
    - [294, 64.172]
  - - [1024, 7200, 1, 4096]
    - [294, 73.982]
  - - [1024, 7200, 1, 42720]
    - [422, 85.615]
  - - [1024, 8064, 1, 1024]
    - [316, 57.508]
  - - [1024, 8064, 1, 4096]
    - [367, 65.384]
  - - [1024, 8160, 1, 1024]
    - [316, 58.067]
  - - [1024, 8160, 1, 4096]
    - [393, 65.809]
  - - [1024, 9216, 1, 1024]
    - [284, 59.341]
  - - [1024, 9216, 1, 4096]
    - [378, 70.542]
  - - [1024, 9520, 1, 1024]
    - [324, 60.154]
  - - [1024, 9520, 1, 4096]
    - [438, 72.083]
  - - [1024, 9520, 1, 42720]
    - [343, 78.739]
  - - [1024, 10064, 1, 1024]
    - [348, 62.19]
  - - [1024, 10064, 1, 4096]
    - [294, 75.186]
  - - [1024, 10080, 1, 1024]
    - [385, 62.842]
  - - [1024, 10080, 1, 4096]
    - [438, 75.32]
  - - [1024, 10080, 1, 42720]
    - [343, 83.2]
  - - [1024, 10200, 1, 1024]
    - [348, 63.591]
  - - [1024, 10200, 1, 4096]
    - [294, 76.159]
  - - [4096, 3840, 1, 1024]
    - [417, 65.165]
  - - [4096, 3968, 1, 1024]
    - [297, 64.546]
  - - [4096, 6528, 1, 1024]
    - [411, 67.483]
  - - [4096, 7104, 1, 1024]
    - [340, 70.522]
  - - [4096, 7200, 1, 1024]
    - [370, 68.913]
  - - [4096, 8064, 1, 1024]
    - [436, 71.645]
  - - [4096, 8160, 1, 1024]
    - [436, 70.379]
  - - [4096, 9216, 1, 1024]
    - [340, 70.986]
  - - [4096, 9520, 1, 1024]
    - [387, 70.359]
  - - [4096, 10064, 1, 1024]
    - [436, 69.979]
  - - [4096, 10080, 1, 1024]
    - [340, 69.953]
  - - [4096, 10200, 1, 1024]
    - [323, 69.545]
  - - [64, 27, 1920, 27]
    - [155, 2.194]
  - - [64, 33, 1920, 27]
    - [150, 2.334]
  - - [64, 33, 1920, 33]
    - [152, 2.746]
  - - [1024, 3240, 1, 1024]
    - [168, 46.687]
  - - [1024, 3240, 1, 4096]
    - [160, 61.646]
  - - [1024, 3960, 1, 1024]
    - [149, 40.819]
  - - [1024, 3960, 1, 4096]
    - [141, 42.95]
  - - [1024, 3960, 1, 42720]
    - [159, 48.607]
  - - [4096, 3240, 1, 1024]
    - [172, 57.754]
  - - [4096, 3960, 1, 1024]
    - [169, 59.012]
  - - [64, 192, 64, 1280]
    - [466, 25.188]
  - - [64, 320, 64, 1280]
    - [504, 27.211]
  - - [64, 384, 64, 1280]
    - [508, 31.039]
  - - [64, 448, 64, 1280]
    - [490, 30.361]
  - - [64, 192, 64, 2048]
    - [509, 24.508]
  - - [64, 320, 64, 2048]
    - [499, 27.545]
  - - [64, 384, 64, 2048]
    - [492, 30.45]
  - - [64, 448, 64, 2048]
    - [466, 30.85]
  - - [1225, 32, 64, 192]
    - [473, 13.701]
  - - [1225, 48, 64, 192]
    - [485, 13.605]
  - - [1225, 64, 64, 192]
    - [474, 21.724]
  - - [1225, 48, 64, 256]
    - [489, 15.929]
  - - [1225, 64, 64, 256]
    - [486, 24.433]
  - - [1225, 48, 64, 288]
    - [495, 16.765]
  - - [1225, 64, 64, 288]
    - [478, 26.107]
  - - [5329, 80, 64, 64]
    - [478, 12.287]
  - - [289, 128, 64, 768]
    - [469, 29.086]
  - - [289, 160, 64, 768]
    - [468, 26.389]
  - - [289, 192, 64, 768]
    - [486, 30.862]
  - - [64, 192, 32, 1280]
    - [491, 20.479]
  - - [64, 320, 32, 1280]
    - [513, 24.532]
  - - [64, 384, 32, 1280]
    - [484, 27.148]
  - - [64, 448, 32, 1280]
    - [466, 28.923]
  - - [64, 192, 32, 2048]
    - [501, 20.704]
  - - [64, 320, 32, 2048]
    - [502, 25.634]
  - - [64, 384, 32, 2048]
    - [475, 27.913]
  - - [64, 448, 32, 2048]
    - [466, 30.215]
  - - [1225, 32, 32, 192]
    - [470, 11.926]
  - - [1225, 48, 32, 192]
    - [510, 11.78]
  - - [1225, 64, 32, 192]
    - [497, 17.818]
  - - [1225, 48, 32, 256]
    - [516, 13.181]
  - - [1225, 64, 32, 256]
    - [478, 20.169]
  - - [1225, 48, 32, 288]
    - [489, 13.97]
  - - [1225, 64, 32, 288]
    - [478, 21.742]
  - - [5329, 80, 32, 64]
    - [478, 11.443]
  - - [289, 128, 32, 768]
    - [469, 27.534]
  - - [289, 160, 32, 768]
    - [488, 20.894]
  - - [289, 192, 32, 768]
    - [474, 23.988]
  - - [49, 2048, 64, 512]
    - [479, 20.765]
  - - [49, 512, 64, 2048]
    - [465, 19.576]
  - - [3136, 256, 32, 64]
    - [514, 23.103]
  - - [3136, 64, 32, 64]
    - [511, 14.626]
  - - [3136, 64, 32, 256]
    - [482, 27.042]
  - - [784, 512, 32, 128]
    - [481, 27.137]
  - - [784, 128, 32, 512]
    - [478, 34.576]
  - - [196, 1024, 32, 256]
    - [471, 26.9]
  - - [196, 256, 32, 1024]
    - [505, 26.257]
  - - [49, 2048, 32, 512]
    - [500, 18.187]
  - - [49, 512, 32, 2048]
    - [494, 17.788]
  - - [3136, 128, 64, 64]
    - [467, 22.561]
  - - [3136, 256, 64, 128]
    - [467, 34.558]
  - - [784, 512, 64, 256]
    - [481, 37.597]
  - - [3136, 128, 64, 256]
    - [467, 39.58]
  - - [3136, 256, 64, 256]
    - [472, 45.913]
  - - [196, 1024, 64, 512]
    - [493, 38.491]
  - - [784, 256, 64, 512]
    - [477, 43.161]
  - - [784, 512, 64, 512]
    - [498, 48.064]
  - - [196, 512, 64, 1024]
    - [493, 38.157]
  - - [196, 1024, 64, 1024]
    - [493, 46.206]
  - - [49, 2048, 64, 1024]
    - [494, 23.745]
  - - [49, 1024, 64, 2048]
    - [503, 23.635]
  - - [3136, 128, 32, 64]
    - [507, 20.963]
  - - [3136, 256, 32, 128]
    - [483, 32.634]
  - - [784, 512, 32, 256]
    - [467, 35.494]
  - - [3136, 128, 32, 256]
    - [496, 37.391]
  - - [3136, 256, 32, 256]
    - [472, 43.775]
  - - [196, 1024, 32, 512]
    - [468, 31.369]
  - - [784, 256, 32, 512]
    - [477, 40.598]
  - - [784, 512, 32, 512]
    - [480, 44.794]
  - - [196, 512, 32, 1024]
    - [474, 31.242]
  - - [196, 1024, 32, 1024]
    - [515, 37.829]
  - - [49, 2048, 32, 1024]
    - [476, 20.963]
  - - [49, 1024, 32, 2048]
    - [487, 19.739]
  - - [7680, 8192, 1, 8192]
    - [447, 91.918]
  - - [3840, 4096, 1, 4096]
    - [354, 90.147]
  - - [1920, 2048, 1, 2048]
    - [379, 80.516]
  - - [960, 1024, 1, 1024]
    - [349, 38.139]
  - - [480, 512, 1, 512]
    - [326, 10.904]
  - - [8192, 7680, 1, 8192]
    - [351, 90.676]
  - - [4096, 3840, 1, 4096]
    - [452, 89.758]
  - - [2048, 1920, 1, 2048]
    - [284, 78.504]
  - - [512, 480, 1, 512]
    - [397, 10.705]
  - - [8192, 8192, 1, 8192]
    - [333, 88.805]
  - - [4096, 4096, 1, 4096]
    - [318, 86.045]
  - - [2048, 2048, 1, 2048]
    - [404, 65.946]
  - - [512, 512, 1, 512]
    - [280, 10.296]
  - - [64, 512, 16, 512]
    - [289, 16.974]
  - - [64, 512, 128, 512]
    - [375, 26.168]
  - - [1024, 8, 1, 1024]
    - [313, 0.623]
  - - [1024, 77, 1, 1024]
    - [433, 5.858]
  - - [1024, 77, 1, 30522]
    - [319, 10.594]
  - - [1024, 512, 1, 2]
    - [332, 0.142]
  - - [1024, 512, 1, 4096]
    - [455, 28.669]
  - - [1024, 616, 1, 1024]
    - [345, 25.292]
  - - [1024, 4096, 1, 2]
    - [315, 0.441]
  - - [4096, 512, 1, 1024]
    - [341, 39.561]
  - - [64, 128, 128, 128]
    - [338, 10.645]
  - - [64, 128, 160, 128]
    - [338, 12.765]
  - - [1024, 10, 1, 2]
    - [306, 0.004]
  - - [1024, 10, 1, 1024]
    - [403, 0.767]
  - - [1024, 160, 1, 1024]
    - [428, 10.001]
  - - [1024, 200, 1, 1024]
    - [442, 11.477]
  - - [1024, 200, 1, 30522]
    - [355, 19.87]
  - - [1024, 1024, 1, 2]
    - [405, 0.223]
  - - [1024, 1024, 1, 4096]
    - [330, 43.406]
  - - [1024, 1280, 1, 2]
    - [458, 0.279]
  - - [1024, 1280, 1, 1024]
    - [341, 40.388]
  - - [1024, 1280, 1, 4096]
    - [409, 47.533]
  - - [4096, 1024, 1, 1024]
    - [312, 47.51]
  - - [4096, 1280, 1, 1024]
    - [371, 50.192]
  - - [64, 128, 624, 128]
    - [279, 16.114]
  - - [1024, 39, 1, 2]
    - [306, 0.013]
  - - [1024, 39, 1, 1024]
    - [358, 3.013]
  - - [1024, 780, 1, 1024]
    - [420, 32.026]
  - - [1024, 780, 1, 30522]
    - [325, 39.906]
  - - [1024, 4992, 1, 2]
    - [314, 0.538]
  - - [1024, 4992, 1, 1024]
    - [418, 55.041]
  - - [1024, 4992, 1, 4096]
    - [294, 57.445]
  - - [4096, 4992, 1, 1024]
    - [387, 67.801]
  - - [1024, 308, 1, 1024]
    - [410, 15.5]
  - - [1024, 308, 1, 30522]
    - [413, 22.981]
  - - [64, 128, 640, 128]
    - [346, 16.313]
  - - [1024, 40, 1, 2]
    - [306, 0.014]
  - - [1024, 40, 1, 1024]
    - [435, 3.115]
  - - [1024, 800, 1, 1024]
    - [349, 32.173]
  - - [1024, 800, 1, 30522]
    - [461, 40.067]
  - - [1024, 5120, 1, 2]
    - [402, 0.511]
  - - [1024, 5120, 1, 1024]
    - [317, 51.85]
  - - [1024, 5120, 1, 4096]
    - [294, 59.004]
  - - [4096, 5120, 1, 1024]
    - [323, 69.085]
  - - [64, 128, 656, 128]
    - [338, 16.506]
  - - [1024, 41, 1, 2]
    - [356, 0.014]
  - - [1024, 41, 1, 1024]
    - [358, 3.193]
  - - [1024, 820, 1, 1024]
    - [300, 32.71]
  - - [1024, 820, 1, 30522]
    - [302, 41.04]
  - - [1024, 5248, 1, 2]
    - [298, 0.516]
  - - [1024, 5248, 1, 1024]
    - [388, 52.018]
  - - [1024, 5248, 1, 4096]
    - [284, 60.126]
  - - [4096, 5248, 1, 1024]
    - [387, 69.639]
  - - [64, 512, 80, 512]
    - [375, 25.792]
  - - [1024, 5, 1, 2]
    - [283, 0.001]
  - - [1024, 5, 1, 1024]
    - [286, 0.386]
  - - [1024, 385, 1, 1024]
    - [450, 19.178]
  - - [1024, 385, 1, 30522]
    - [427, 25.965]
  - - [1024, 2560, 1, 2]
    - [380, 0.386]
  - - [1024, 2560, 1, 1024]
    - [308, 46.179]
  - - [1024, 2560, 1, 4096]
    - [294, 57.452]
  - - [4096, 2560, 1, 1024]
    - [421, 65.676]
  - - [64, 512, 96, 512]
    - [414, 27.555]
  - - [1024, 6, 1, 2]
    - [310, 0.002]
  - - [1024, 6, 1, 1024]
    - [286, 0.453]
  - - [1024, 462, 1, 1024]
    - [345, 20.149]
  - - [1024, 462, 1, 30522]
    - [392, 28.855]
  - - [1024, 3072, 1, 2]
    - [402, 0.412]
  - - [1024, 3072, 1, 1024]
    - [294, 54.219]
  - - [1024, 3072, 1, 4096]
    - [294, 67.894]
  - - [4096, 3072, 1, 1024]
    - [366, 61.932]
  - - [1024, 8, 1, 2]
    - [310, 0.003]
  - - [1024, 160, 1, 30522]
    - [307, 17.521]
  - - [64, 128, 144, 128]
    - [338, 11.776]
  - - [1024, 9, 1, 2]
    - [310, 0.003]
  - - [1024, 9, 1, 1024]
    - [313, 0.707]
  - - [1024, 180, 1, 1024]
    - [424, 11.621]
  - - [1024, 180, 1, 30522]
    - [425, 19.082]
  - - [1024, 1152, 1, 2]
    - [376, 0.248]
  - - [1024, 1152, 1, 1024]
    - [301, 38.714]
  - - [1024, 1152, 1, 4096]
    - [293, 44.859]
  - - [4096, 1152, 1, 1024]
    - [384, 50.523]
  - - [479, 32768, 1, 1024]
    - [400, 53.357]
  - - [64, 4, 32768, 4]
    - [292, 0.121]
  - - [64, 4, 38400, 4]
    - [292, 0.121]
  - - [1024, 8192, 1, 1024]
    - [316, 58.422]
  - - [1024, 8192, 1, 4096]
    - [443, 65.77]
  - - [1024, 8192, 1, 33712]
    - [348, 66.747]
  - - [1024, 9600, 1, 1024]
    - [284, 61.814]
  - - [1024, 9600, 1, 4096]
    - [284, 72.941]
  - - [1024, 9600, 1, 33712]
    - [394, 77.254]
  - - [4096, 8192, 1, 1024]
    - [340, 70.671]
  - - [4096, 9600, 1, 1024]
    - [416, 71.097]
  - - [128, 128, 1, 64]
    - [360, 0.175]
  - - [64, 128, 1, 128]
    - [462, 0.161]
  - - [64, 5, 1, 5]
    - [350, 0.0]
  - - [32, 33, 1, 33]
    - [336, 0.005]
  - - [1024, 1024, 64, 64]
    - [295, 26.724]
  - - [64, 1024, 32, 1024]
    - [296, 29.126]
  - - [1024, 16384, 1, 3072]
    - [294, 74.445]
  - - [1024, 2048, 1, 30592]
    - [304, 54.636]
  - - [640, 2048, 1, 2560]
    - [305, 53.313]
  - - [1024, 1024, 64, 96]
    - [295, 34.83]
  - - [2048, 2, 1, 2048]
    - [286, 0.385]
  - - [2048, 2, 1, 2]
    - [283, 0.001]
  - - [1536, 4096, 1, 4608]
    - [294, 71.794]
  - - [512, 512, 256, 64]
    - [314, 26.219]
  - - [2048, 1024, 1, 8192]
    - [321, 54.079]
  - - [4096, 16384, 1, 1024]
    - [322, 71.75]
  - - [1024, 8192, 1, 50304]
    - [323, 66.668]
  - - [1536, 8192, 1, 50304]
    - [334, 74.829]
  - - [6144, 8192, 1, 1536]
    - [311, 78.512]
  - - [1024, 4096, 1, 30592]
    - [316, 70.009]
  - - [1536, 4096, 1, 6144]
    - [284, 72.815]
  - - [1024, 16384, 1, 4096]
    - [348, 75.784]
  - - [1024, 16384, 1, 50304]
    - [353, 79.543]
  - - [1024, 4096, 1, 3072]
    - [318, 65.964]
  - - [1536, 8192, 1, 1536]
    - [359, 66.205]
  - - [1024, 2048, 1, 3072]
    - [361, 49.54]
  - - [2560, 2048, 1, 7680]
    - [301, 64.336]
  - - [96, 1024, 64, 1024]
    - [377, 39.561]
  - - [2048, 1024, 1, 2048]
    - [381, 49.378]
  - - [2048, 1024, 1, 30592]
    - [382, 53.92]
  - - [64, 1024, 256, 1024]
    - [300, 35.752]
  - - [8192, 1024, 1, 2048]
    - [390, 60.465]
  - - [2560, 2048, 1, 2560]
    - [328, 61.722]
  - - [1536, 8192, 1, 4608]
    - [394, 72.747]
  - - [64, 512, 256, 512]
    - [399, 29.598]
  - - [1024, 2048, 1, 50304]
    - [412, 55.309]
  - - [1024, 1024, 32, 64]
    - [295, 25.601]
  - - [1536, 8192, 1, 6144]
    - [394, 73.75]
  - - [1024, 1024, 256, 64]
    - [295, 27.701]
  - - [512, 512, 40, 64]
    - [314, 20.325]
  - - [1536, 4096, 1, 50304]
    - [284, 75.394]
  - - [1024, 1024, 128, 96]
    - [295, 35.823]
  - - [1024, 8192, 1, 3072]
    - [316, 66.473]
  - - [64, 1024, 64, 1024]
    - [349, 32.078]
  - - [1024, 1024, 128, 64]
    - [295, 27.305]
  - - [64, 1024, 128, 1024]
    - [432, 35.15]
  - - [1024, 4096, 1, 50304]
    - [434, 67.834]
  - - [96, 1024, 128, 1024]
    - [444, 41.81]
  - - [6144, 4096, 1, 1536]
    - [297, 75.933]
  - - [1024, 16, 1, 2]
    - [356, 0.006]
  - - [1024, 16, 1, 1024]
    - [403, 1.217]
  - - [2560, 4, 1, 2]
    - [283, 0.003]
  - - [1024, 16384, 1, 1024]
    - [436, 64.724]
  - - [2560, 2048, 1, 1920]
    - [328, 59.548]
  - - [2048, 1024, 1, 6144]
    - [321, 53.307]
  - - [2560, 4, 1, 2560]
    - [457, 1.014]
  - - [512, 512, 128, 64]
    - [295, 24.934]
  - - [1024, 8192, 1, 30592]
    - [459, 69.419]
  - - [1536, 4096, 1, 1536]
    - [294, 64.23]
  - - [64, 512, 40, 512]
    - [399, 23.789]
- null
