library/src/blas3/Tensile/Logic/asm_full/arcturus_Cijk_Alik_Bljk_HBH.yaml
- {MinimumRequiredVersion: 4.6.0}
- arcturus
- gfx908
- [Device 7380, Device 7388, Device 738c, Device 7390]
    SolutionIndex: 0
    SolutionNameMin: Cijk_Alik_Bljk_HBH_MT032x016x08_PGR1_PLR1_TT04_02
    SolutionIndex: 1
    SolutionNameMin: Cijk_Alik_Bljk_HBH_MT032x016x08_PGR1_PLR1_TT02_02
    SolutionIndex: 2
    SolutionNameMin: Cijk_Alik_Bljk_HBH_MT032x032x08_PGR1_PLR1_TT02_02
    SolutionIndex: 3
    SolutionNameMin: Cijk_Alik_Bljk_HBH_MT016x016x16_PGR1_PLR1_TT02_02
    SolutionIndex: 4
    SolutionNameMin: Cijk_Alik_Bljk_HBH_MT032x032x16_PGR1_PLR1_TT04_04
    SolutionIndex: 5
    SolutionNameMin: Cijk_Alik_Bljk_HBH_MT064x032x16_PGR1_PLR1_TT04_04
    SolutionIndex: 6
    SolutionNameMin: Cijk_Alik_Bljk_HBH_MT032x016x08_PGR1_PLR1_TT04_02
    SolutionIndex: 7
    SolutionNameMin: Cijk_Alik_Bljk_HBH_MT016x016x16_PGR1_PLR1_TT02_02
    SolutionIndex: 8
    SolutionNameMin: Cijk_Alik_Bljk_HBH_MT032x032x16_PGR1_PLR1_TT04_04
    SolutionIndex: 9
    SolutionNameMin: Cijk_Alik_Bljk_HBH_MT064x064x16_PGR1_PLR1_TT08_08
    SolutionIndex: 10
    SolutionNameMin: Cijk_Alik_Bljk_HBH_MT064x032x16_PGR1_PLR1_TT04_04
    SolutionIndex: 11
    SolutionNameMin: Cijk_Alik_Bljk_HBH_MT016x016x24_PGR1_PLR1_TT02_02
    SolutionIndex: 12
    SolutionNameMin: Cijk_Alik_Bljk_HBH_MT032x032x24_PGR1_PLR1_TT04_04
    SolutionIndex: 13
    SolutionNameMin: Cijk_Alik_Bljk_HBH_MT016x016x24_PGR1_PLR1_TT02_02
    SolutionIndex: 14
    SolutionNameMin: Cijk_Alik_Bljk_HBH_MT032x016x24_PGR1_PLR1_TT04_02
    SolutionIndex: 15
    SolutionNameMin: Cijk_Alik_Bljk_HBH_MT032x032x24_PGR1_PLR1_TT04_04
    SolutionIndex: 16
    SolutionNameMin: Cijk_Alik_Bljk_HBH_MT064x064x24_PGR1_PLR1_TT08_08
    SolutionIndex: 17
    SolutionNameMin: Cijk_Alik_Bljk_HBH_MT064x128x08_PGR1_PLR1_TT04_08
    SolutionIndex: 18
    SolutionNameMin: Cijk_Alik_Bljk_HBH_MT128x064x08_PGR1_PLR1_TT08_04
    SolutionIndex: 19
    SolutionNameMin: Cijk_Alik_Bljk_HBH_MT064x064x16_PGR1_PLR1_TT04_04
    SolutionIndex: 20
    SolutionNameMin: Cijk_Alik_Bljk_HBH_MT064x128x16_PGR1_PLR1_TT04_08
    SolutionIndex: 21
    SolutionNameMin: Cijk_Alik_Bljk_HBH_MT128x128x16_PGR1_PLR1_TT08_08
    SolutionIndex: 22
    SolutionNameMin: Cijk_Alik_Bljk_HBH_MT064x128x04_PGR0_PLR0_TT04_08
    SolutionIndex: 23
    SolutionNameMin: Cijk_Alik_Bljk_HBH_MT064x064x04_PGR0_PLR0_TT04_04
    SolutionIndex: 24
    SolutionNameMin: Cijk_Alik_Bljk_HBH_MT064x064x04_PGR1_PLR0_TT04_04
    SolutionIndex: 25
    SolutionNameMin: Cijk_Alik_Bljk_HBH_MT064x064x04_PGR0_PLR1_TT04_04
    SolutionIndex: 26
    SolutionNameMin: Cijk_Alik_Bljk_HBH_MT064x064x08_PGR0_PLR0_TT04_04
    SolutionIndex: 27
    SolutionNameMin: Cijk_Alik_Bljk_HBH_MT064x064x08_PGR1_PLR0_TT04_04
    SolutionIndex: 28
    SolutionNameMin: Cijk_Alik_Bljk_HBH_MT128x128x08_PGR0_PLR1_TT08_08
    SolutionIndex: 29
    SolutionNameMin: Cijk_Alik_Bljk_HBH_MT064x128x08_PGR0_PLR1_TT04_08
    SolutionIndex: 30
    SolutionNameMin: Cijk_Alik_Bljk_HBH_MT064x064x08_PGR0_PLR1_TT04_04
    SolutionIndex: 31
    SolutionNameMin: Cijk_Alik_Bljk_HBH_MT064x064x08_PGR1_PLR1_TT04_04
    SolutionIndex: 32
    SolutionNameMin: Cijk_Alik_Bljk_HBH_MT064x064x16_PGR0_PLR0_TT04_04
    SolutionIndex: 33
    SolutionNameMin: Cijk_Alik_Bljk_HBH_MT064x064x16_PGR1_PLR0_TT04_04
    SolutionIndex: 34
    SolutionNameMin: Cijk_Alik_Bljk_HBH_MT064x064x16_PGR0_PLR1_TT04_04
    SolutionIndex: 35
    SolutionNameMin: Cijk_Alik_Bljk_HBH_MT064x064x16_PGR1_PLR1_TT04_04
    SolutionIndex: 36
    SolutionNameMin: Cijk_Alik_Bljk_HBH_MT064x128x04_PGR0_PLR0_TT04_08
    SolutionIndex: 37
    SolutionNameMin: Cijk_Alik_Bljk_HBH_MT064x064x04_PGR0_PLR0_TT04_04
    SolutionIndex: 38
    SolutionNameMin: Cijk_Alik_Bljk_HBH_MT064x128x04_PGR1_PLR0_TT04_08
    SolutionIndex: 39
    SolutionNameMin: Cijk_Alik_Bljk_HBH_MT064x064x04_PGR1_PLR0_TT04_04
    SolutionIndex: 40
    SolutionNameMin: Cijk_Alik_Bljk_HBH_MT128x128x04_PGR0_PLR1_TT08_08
    SolutionIndex: 41
    SolutionNameMin: Cijk_Alik_Bljk_HBH_MT064x128x04_PGR0_PLR1_TT04_08
    SolutionIndex: 42
    SolutionNameMin: Cijk_Alik_Bljk_HBH_MT064x064x04_PGR0_PLR1_TT04_04
    SolutionIndex: 43
    SolutionNameMin: Cijk_Alik_Bljk_HBH_MT064x128x04_PGR1_PLR1_TT04_08
    SolutionIndex: 44
    SolutionNameMin: Cijk_Alik_Bljk_HBH_MT064x064x04_PGR1_PLR1_TT04_04
    SolutionIndex: 45
    SolutionNameMin: Cijk_Alik_Bljk_HBH_MT128x128x08_PGR0_PLR0_TT08_08
    SolutionIndex: 46
    SolutionNameMin: Cijk_Alik_Bljk_HBH_MT064x128x08_PGR0_PLR0_TT04_08
    SolutionIndex: 47
    SolutionNameMin: Cijk_Alik_Bljk_HBH_MT064x064x08_PGR0_PLR0_TT04_04
    SolutionIndex: 48
    SolutionNameMin: Cijk_Alik_Bljk_HBH_MT064x064x08_PGR1_PLR0_TT04_04
    SolutionIndex: 49
    SolutionNameMin: Cijk_Alik_Bljk_HBH_MT064x128x08_PGR0_PLR1_TT04_08
    SolutionIndex: 50
    SolutionNameMin: Cijk_Alik_Bljk_HBH_MT064x064x08_PGR0_PLR1_TT04_04
    SolutionIndex: 51
    SolutionNameMin: Cijk_Alik_Bljk_HBH_MT064x128x08_PGR1_PLR1_TT04_08
    SolutionIndex: 52
    SolutionNameMin: Cijk_Alik_Bljk_HBH_MT064x064x08_PGR1_PLR1_TT04_04
    SolutionIndex: 53
    SolutionNameMin: Cijk_Alik_Bljk_HBH_MT064x064x16_PGR1_PLR1_TT04_04
    SolutionIndex: 54
    SolutionNameMin: Cijk_Alik_Bljk_HBH_MT064x064x16_EPS1_GRVW04_LPB04_PGR1_PLR1_SNLL1_TT04_04_VW04_WG16_16_01_WGM01
    SolutionIndex: 55
    SolutionNameMin: Cijk_Alik_Bljk_HBH_MT064x032x16_EPS1_GRVW04_LPB04_PGR1_PLR1_SNLL1_TT04_04_VW04_WG16_08_01_WGM64
    SolutionIndex: 56
    SolutionNameMin: Cijk_Alik_Bljk_HBH_MT032x128x32_EPS1_GRVW04_LPB04_PGR1_PLR1_SNLL1_TT04_04_VW04_WG08_32_01_WGM64
    SolutionIndex: 57
    SolutionNameMin: Cijk_Alik_Bljk_HBH_MT032x032x16_PGR1_PLR1_TT04_04
    SolutionIndex: 58
    SolutionNameMin: Cijk_Alik_Bljk_HBH_MT064x016x16_PGR1_PLR1_TT04_04
    SolutionIndex: 59
    SolutionNameMin: Cijk_Alik_Bljk_HBH_MT032x032x32_PGR1_PLR1_TT04_04
    SolutionIndex: 60
    SolutionNameMin: Cijk_Alik_Bljk_HBH_MT064x016x32_PGR1_PLR1_TT04_04
    SolutionIndex: 61
    SolutionNameMin: Cijk_Alik_Bljk_HBH_MT032x032x16_PGR1_PLR1_TT04_04
    SolutionIndex: 62
    SolutionNameMin: Cijk_Alik_Bljk_HBH_MT032x032x32_PGR1_PLR1_TT04_04
    SolutionIndex: 63
    SolutionNameMin: Cijk_Alik_Bljk_HBH_MT064x032x32_PGR1_PLR1_TT04_04
    SolutionIndex: 64
    SolutionNameMin: Cijk_Alik_Bljk_HBH_MT064x064x08_PGR1_PLR1_TT08_08
    SolutionIndex: 65
    SolutionNameMin: Cijk_Alik_Bljk_HBH_MT064x064x16_PGR1_PLR1_TT08_08
    SolutionIndex: 66
    SolutionNameMin: Cijk_Alik_Bljk_HBH_MT064x064x32_PGR1_PLR1_TT08_08
    SolutionIndex: 67
    SolutionNameMin: Cijk_Alik_Bljk_HBH_MT128x128x08_PGR1_PLR1_TT08_08
    SolutionIndex: 68
    SolutionNameMin: Cijk_Alik_Bljk_HBH_MT128x128x32_PGR1_PLR1_TT08_08
    SolutionIndex: 69
    SolutionNameMin: Cijk_Alik_Bljk_HBH_MT128x128x16_PGR1_PLR1_TT08_08
    SolutionIndex: 70
    SolutionNameMin: Cijk_Alik_Bljk_HBH_MT128x128x32_PGR1_PLR1_TT08_08
    SolutionIndex: 71
    SolutionNameMin: Cijk_Alik_Bljk_HBH_MT064x064x04_PGR0_PLR0_TT04_04
    SolutionIndex: 72
    SolutionNameMin: Cijk_Alik_Bljk_HBH_MT128x64x16_SE_
    SolutionIndex: 73
    SolutionNameMin: Cijk_Alik_Bljk_HBH_MT128x32x16_SE_AF0EM1_ASEM1_GRVW1_ONLL1_SNLL0
    SolutionIndex: 74
    SolutionNameMin: Cijk_Alik_Bljk_HBH_MT128x64x16_SE_AF0EM1_ASEM1_GRVW1_ONLL1_SNLL0
    SolutionIndex: 75
    SolutionNameMin: Cijk_Alik_Bljk_HBH_MT256x64x16_SE_AF0EM1_ASEM1_GRVW1_ONLL1_SNLL0
    SolutionIndex: 76
    SolutionNameMin: Cijk_Alik_Bljk_HBH_MT256x128x16_SE_AF0EM1_ASEM1_GRVW1_ONLL1_SNLL0
    SolutionIndex: 77
    SolutionNameMin: Cijk_Alik_Bljk_HBH_MT64x32x16_SE_AF0EM1_ASEM1_GRVW1_ONLL1_SNLL0
    SolutionIndex: 78
    SolutionNameMin: Cijk_Alik_Bljk_HBH_MT128x256x32_SE_AF0EM8_ASEM8_GRVW8_ONLL1_SNLL0
    SolutionIndex: 79
    SolutionNameMin: Cijk_Alik_Bljk_HBH_MT64x128x32_MI32x32x4x2_SE_AF0EM2_ASEM1_GRVW4_ONLL0_SNLL0
    SolutionIndex: 80
    SolutionNameMin: Cijk_Alik_Bljk_HBH_MT64x128x32_MI32x32x4x2_SE_AF0EM2_ASEM1_GRVW4_ONLL1_SNLL0
    SolutionIndex: 81
    SolutionIndex: 82
    SolutionIndex: 83
    SolutionIndex: 84
    SolutionIndex: 85
    SolutionIndex: 86
    SolutionIndex: 87
    SolutionIndex: 88
    SolutionIndex: 89
    SolutionIndex: 90
    SolutionIndex: 91
    SolutionIndex: 92
    SolutionIndex: 93
    SolutionIndex: 94
    SolutionIndex: 95
    SolutionIndex: 96
    SolutionIndex: 97
    SolutionIndex: 98
    SolutionIndex: 99
    SolutionIndex: 100
    SolutionIndex: 101
    SolutionIndex: 102
    SolutionIndex: 103
    SolutionIndex: 104
    SolutionIndex: 105
    SolutionIndex: 106
    SolutionIndex: 107
    SolutionIndex: 108
    SolutionIndex: 109
    SolutionIndex: 110
    SolutionIndex: 111
    SolutionIndex: 112
    SolutionIndex: 113
    SolutionIndex: 114
    SolutionIndex: 115
    SolutionIndex: 116
    SolutionIndex: 117
    SolutionIndex: 118
    SolutionIndex: 119
    SolutionIndex: 120
    SolutionIndex: 121
    SolutionIndex: 122
    SolutionIndex: 123
    SolutionIndex: 124
    SolutionIndex: 125
    SolutionIndex: 126
    SolutionIndex: 127
    SolutionIndex: 128
    SolutionNameMin: Cijk_Alik_Bljk_HBH_MT32x32x128_MI16x16x16x1_SE_1LDSB0_AF0EM1_GRVW2_LBSPP256_PLR9_SU0_SUS256_SRVW0_TT1_16_WG32_8_1_WGM1
    SolutionIndex: 129
    SolutionNameMin: Cijk_Alik_Bljk_HBH_MT128x96x32_MI32x32x8x1_SE_1LDSB0_AF0EM4_GRVW2_LBSPP128_PLR5_SU0_SUS256_SRVW4_TT1_96_WG128_2_1_WGM1
    SolutionIndex: 130
    SolutionNameMin: Cijk_Alik_Bljk_HBH_MT64x80x128_MI16x16x16x1_SE_1LDSB1_AF0EM4_GRVW8_LBSPP256_PLR9_SU16_SUS256_SRVW0_TT1_80_WG64_4_1_WGM2
    SolutionIndex: 131
    SolutionNameMin: Cijk_Alik_Bljk_HBH_MT128x128x64_MI32x32x4x2_SE_1LDSB1_AF0EM1_GRVW8_LBSPP128_PLR17_SU16_SUS128_SRVW4_TT2_32_WG64_4_1_WGM15
    SolutionIndex: 132
    SolutionNameMin: Cijk_Alik_Bljk_HBH_MT128x256x64_MI32x32x8x1_SE_1LDSB1_AF0EM4_GRVW2_LBSPP128_PLR9_SU32_SUS256_SRVW4_TT2_128_WG64_4_1_WGM15
    SolutionIndex: 133
    SolutionNameMin: Cijk_Alik_Bljk_HBH_MT64x128x128_MI32x32x8x1_SE_1LDSB1_AF0EM1_GRVW8_LBSPP256_PLR17_SU0_SUS256_SRVW4_TT1_64_WG64_4_1_WGM1
    SolutionIndex: 134
    SolutionNameMin: Cijk_Alik_Bljk_HBH_MT256x256x32_MI32x32x4x2_SE_1LDSB1_AF0EM4_GRVW2_LBSPP128_PLR9_SU0_SUS256_SRVW4_TT2_128_WG128_2_1_WGM1
    SolutionIndex: 135
    SolutionNameMin: Cijk_Alik_Bljk_HBH_MT128x160x64_MI32x32x8x1_SE_1LDSB1_AF0EM4_GRVW8_LBSPP128_PLR9_SU0_SUS256_SRVW4_TT1_160_WG128_2_1_WGM2
    SolutionIndex: 136
    SolutionNameMin: Cijk_Alik_Bljk_HBH_MT128x288x64_MI32x32x8x1_SE_1LDSB1_AF0EM4_GRVW4_LBSPP128_PLR9_SU16_SUS128_SRVW4_TT1_288_WG128_2_1_WGM15
    SolutionIndex: 137
    SolutionNameMin: Cijk_Alik_Bljk_HBH_MT128x96x128_MI32x32x8x1_SE_1LDSB1_AF0EM4_GRVW8_LBSPP256_PLR17_SU0_SUS256_SRVW4_TT1_96_WG128_2_1_WGM2
    SolutionIndex: 138
    SolutionNameMin: Cijk_Alik_Bljk_HBH_MT128x160x64_MI32x32x8x1_SE_1LDSB1_AF0EM4_GRVW8_LBSPP128_PLR9_SU16_SUS128_SRVW4_TT1_160_WG128_2_1_WGM15
    SolutionIndex: 139
    SolutionNameMin: Cijk_Alik_Bljk_HBH_MT128x96x128_MI32x32x8x1_SE_1LDSB1_AF0EM4_GRVW8_LBSPP256_PLR17_SU32_SUS256_SRVW4_TT1_96_WG128_2_1_WGM15
    SolutionIndex: 140
    SolutionNameMin: Cijk_Alik_Bljk_HBH_MT128x96x128_MI32x32x8x1_SE_1LDSB1_AF0EM4_GRVW8_LBSPP256_PLR17_SU0_SUS256_SRVW4_TT1_96_WG128_2_1_WGM15
    SolutionIndex: 141
    SolutionNameMin: Cijk_Alik_Bljk_HBH_MT32x32x32_MI16x16x16x1_SE_1LDSB0_AF0EM1_GRVW2_LBSPP128_PLR2_SU32_SUS256_SRVW4_TT1_16_WG32_8_1_WGM15
    SolutionIndex: 142
    SolutionNameMin: Cijk_Alik_Bljk_HBH_MT256x256x32_MI32x32x4x2_SE_1LDSB1_AF0EM1_GRVW2_LBSPP128_PLR9_SU16_SUS128_SRVW4_TT2_128_WG128_2_1_WGM15
    SolutionIndex: 143
    SolutionNameMin: Cijk_Alik_Bljk_HBH_MT128x128x64_MI32x32x4x2_SE_1LDSB1_AF0EM4_GRVW8_LBSPP128_PLR17_SU32_SUS128_SRVW4_TT2_32_WG64_4_1_WGM15
    SolutionIndex: 144
    SolutionNameMin: Cijk_Alik_Bljk_HBH_MT128x64x64_MI32x32x8x1_SE_1LDSB0_AF0EM4_GRVW8_LBSPP128_PLR9_SU0_SUS256_SRVW4_TT2_32_WG64_4_1_WGM15
    SolutionIndex: 145
    SolutionNameMin: Cijk_Alik_Bljk_HBH_MT128x256x32_MI32x32x4x2_SE_1LDSB0_AF0EM4_GRVW8_LBSPP128_PLR9_SU16_SUS128_SRVW4_TT2_64_WG64_4_1_WGM2
    SolutionIndex: 146
    SolutionNameMin: Cijk_Alik_Bljk_HBH_MT256x256x32_MI32x32x4x2_SE_1LDSB1_AF0EM4_GRVW2_LBSPP128_PLR9_SU0_SUS256_SRVW4_TT2_128_WG128_2_1_WGM2
    SolutionIndex: 147
    SolutionNameMin: Cijk_Alik_Bljk_HBH_MT128x64x32_MI32x32x4x2_SE_1LDSB0_AF0EM4_GRVW4_LBSPP128_PLR9_SU0_SUS256_SRVW4_TT1_32_WG128_2_1_WGM1
    SolutionIndex: 148
    SolutionNameMin: Cijk_Alik_Bljk_HBH_MT128x160x64_MI32x32x8x1_SE_1LDSB1_AF0EM1_GRVW8_LBSPP128_PLR9_SU32_SUS128_SRVW4_TT1_160_WG128_2_1_WGM15
    SolutionIndex: 149
    SolutionNameMin: Cijk_Alik_Bljk_HBH_MT128x96x32_MI32x32x8x1_SE_1LDSB0_AF0EM1_GRVW2_LBSPP128_PLR5_SU0_SUS256_SRVW4_TT1_96_WG128_2_1_WGM15
    SolutionIndex: 150
    SolutionNameMin: Cijk_Alik_Bljk_HBH_MT64x80x32_MI16x16x16x1_SE_1LDSB0_AF0EM4_GRVW2_LBSPP128_PLR2_SU0_SUS256_SRVW4_TT1_80_WG64_4_1_WGM15
    SolutionIndex: 151
    SolutionNameMin: Cijk_Alik_Bljk_HBH_MT128x96x128_MI32x32x8x1_SE_1LDSB1_AF0EM4_GRVW8_LBSPP256_PLR17_SU32_SUS256_SRVW4_TT1_96_WG128_2_1_WGM2
    SolutionIndex: 152
    SolutionNameMin: Cijk_Alik_Bljk_HBH_MT256x144x64_MI16x16x16x1_SE_1LDSB1_AF0EM4_GRVW2_LBSPP128_PLR5_SU32_SUS128_SRVW0_TT4_144_WG64_4_1_WGM15
    SolutionIndex: 153
    SolutionNameMin: Cijk_Alik_Bljk_HBH_MT64x32x128_MI16x16x16x1_SE_1LDSB0_AF0EM1_GRVW8_LBSPP256_PLR9_SU0_SUS256_SRVW4_TT2_16_WG32_8_1_WGM15
    SolutionIndex: 154
    SolutionNameMin: Cijk_Alik_Bljk_HBH_MT128x256x64_MI32x32x8x1_SE_1LDSB1_AF0EM4_GRVW4_LBSPP128_PLR9_SU16_SUS128_SRVW4_TT2_128_WG64_4_1_WGM1
    SolutionIndex: 155
    SolutionNameMin: Cijk_Alik_Bljk_HBH_MT64x128x128_MI32x32x8x1_SE_1LDSB1_AF0EM1_GRVW8_LBSPP256_PLR17_SU0_SUS256_SRVW4_TT1_64_WG64_4_1_WGM15
    SolutionIndex: 156
    SolutionNameMin: Cijk_Alik_Bljk_HBH_MT32x32x32_MI16x16x16x1_SE_1LDSB0_AF0EM1_GRVW2_LBSPP128_PLR2_SU0_SUS256_SRVW0_TT1_16_WG32_8_1_WGM1
    SolutionIndex: 157
    SolutionNameMin: Cijk_Alik_Bljk_HBH_MT64x128x128_MI32x32x4x2_SE_1LDSB1_AF0EM1_GRVW8_LBSPP256_PLR33_SU16_SUS256_SRVW4_TT1_32_WG64_4_1_WGM1
    SolutionIndex: 158
    SolutionNameMin: Cijk_Alik_Bljk_HBH_MT128x96x32_MI32x32x8x1_SE_1LDSB0_AF0EM1_GRVW4_LBSPP128_PLR5_SU0_SUS256_SRVW4_TT1_96_WG128_2_1_WGM15
    SolutionIndex: 159
    SolutionNameMin: Cijk_Alik_Bljk_HBH_MT128x128x64_MI32x32x4x2_SE_1LDSB1_AF0EM4_GRVW4_LBSPP128_PLR17_SU0_SUS256_SRVW4_TT2_32_WG64_4_1_WGM15
    SolutionIndex: 160
    SolutionNameMin: Cijk_Alik_Bljk_HBH_MT128x160x64_MI32x32x8x1_SE_1LDSB1_AF0EM4_GRVW8_LBSPP128_PLR9_SU16_SUS256_SRVW4_TT1_160_WG128_2_1_WGM15
    SolutionIndex: 161
    SolutionNameMin: Cijk_Alik_Bljk_HBH_MT256x128x32_MI32x32x4x2_SE_1LDSB0_AF0EM1_GRVW2_LBSPP128_PLR9_SU0_SUS256_SRVW4_TT2_64_WG128_2_1_WGM2
    SolutionIndex: 162
    SolutionNameMin: Cijk_Alik_Bljk_HBH_MT128x128x64_MI32x32x4x2_SE_1LDSB1_AF0EM4_GRVW8_LBSPP128_PLR17_SU16_SUS128_SRVW4_TT2_32_WG64_4_1_WGM15
    SolutionIndex: 163
    SolutionNameMin: Cijk_Alik_Bljk_HBH_MT128x256x64_MI32x32x8x1_SE_1LDSB1_AF0EM1_GRVW2_LBSPP128_PLR9_SU0_SUS256_SRVW4_TT2_128_WG64_4_1_WGM2
    SolutionIndex: 164
    SolutionNameMin: Cijk_Alik_Bljk_HBH_MT64x128x32_MI32x32x8x1_SE_1LDSB0_AF0EM4_GRVW4_LBSPP128_PLR5_SU32_SUS256_SRVW4_TT1_64_WG64_4_1_WGM1
    SolutionIndex: 165
    SolutionNameMin: Cijk_Alik_Bljk_HBH_MT128x288x64_MI32x32x8x1_SE_1LDSB1_AF0EM4_GRVW8_LBSPP128_PLR9_SU32_SUS128_SRVW4_TT1_288_WG128_2_1_WGM15
    SolutionIndex: 166
    SolutionNameMin: Cijk_Alik_Bljk_HBH_MT256x256x32_MI32x32x4x2_SE_1LDSB1_AF0EM1_GRVW2_LBSPP128_PLR9_SU16_SUS128_SRVW4_TT2_128_WG128_2_1_WGM2
    SolutionIndex: 167
    SolutionNameMin: Cijk_Alik_Bljk_HBH_MT64x128x128_MI32x32x8x1_SE_1LDSB1_AF0EM1_GRVW8_LBSPP256_PLR17_SU16_SUS256_SRVW4_TT1_64_WG64_4_1_WGM1
    SolutionIndex: 168
    SolutionNameMin: Cijk_Alik_Bljk_HBH_MT128x288x64_MI32x32x8x1_SE_1LDSB1_AF0EM4_GRVW4_LBSPP128_PLR9_SU32_SUS128_SRVW4_TT1_288_WG128_2_1_WGM1
    SolutionIndex: 169
    SolutionNameMin: Cijk_Alik_Bljk_HBH_MT256x256x32_MI32x32x4x2_SE_1LDSB1_AF0EM4_GRVW2_LBSPP128_PLR9_SU16_SUS128_SRVW4_TT2_128_WG128_2_1_WGM1
    SolutionIndex: 170
    SolutionNameMin: Cijk_Alik_Bljk_HBH_MT128x160x64_MI32x32x8x1_SE_1LDSB1_AF0EM1_GRVW8_LBSPP128_PLR9_SU16_SUS128_SRVW4_TT1_160_WG128_2_1_WGM1
    SolutionIndex: 171
    SolutionNameMin: Cijk_Alik_Bljk_HBH_MT256x256x32_MI32x32x4x2_SE_1LDSB1_AF0EM1_GRVW2_LBSPP128_PLR9_SU32_SUS128_SRVW4_TT2_128_WG128_2_1_WGM2
    SolutionIndex: 172
    SolutionNameMin: Cijk_Alik_Bljk_HBH_MT32x32x32_MI16x16x16x1_SE_1LDSB0_AF0EM1_GRVW4_LBSPP128_PLR2_SU0_SUS256_SRVW0_TT1_16_WG32_8_1_WGM2
    SolutionIndex: 173
    SolutionNameMin: Cijk_Alik_Bljk_HBH_MT128x256x64_MI32x32x4x2_SE_1LDSB1_AF0EM1_GRVW2_LBSPP128_PLR17_SU0_SUS256_SRVW4_TT2_64_WG64_4_1_WGM2
    SolutionIndex: 174
    SolutionNameMin: Cijk_Alik_Bljk_HBH_MT128x96x64_MI32x32x8x1_SE_1LDSB0_AF0EM4_GRVW8_LBSPP128_PLR9_SU32_SUS128_SRVW4_TT1_96_WG128_2_1_WGM15
    SolutionIndex: 175
    SolutionNameMin: Cijk_Alik_Bljk_HBH_MT64x32x64_MI16x16x16x1_SE_1LDSB0_AF0EM4_GRVW8_LBSPP128_PLR5_SU16_SUS128_SRVW0_TT2_16_WG32_8_1_WGM15
    SolutionIndex: 176
    SolutionNameMin: Cijk_Alik_Bljk_HBH_MT64x80x128_MI16x16x16x1_SE_1LDSB1_AF0EM4_GRVW8_LBSPP256_PLR9_SU0_SUS256_SRVW4_TT1_80_WG64_4_1_WGM15
    SolutionIndex: 177
    SolutionNameMin: Cijk_Alik_Bljk_HBH_MT128x96x32_MI32x32x8x1_SE_1LDSB0_AF0EM4_GRVW4_LBSPP128_PLR5_SU0_SUS256_SRVW4_TT1_96_WG128_2_1_WGM1
    SolutionIndex: 178
    SolutionNameMin: Cijk_Alik_Bljk_HBH_MT128x96x128_MI32x32x8x1_SE_1LDSB1_AF0EM1_GRVW4_LBSPP256_PLR17_SU32_SUS256_SRVW4_TT1_96_WG128_2_1_WGM15
    SolutionIndex: 179
    SolutionNameMin: Cijk_Alik_Bljk_HBH_MT64x128x32_MI32x32x4x2_SE_1LDSB0_AF0EM4_GRVW8_LBSPP128_PLR9_SU0_SUS256_SRVW4_TT1_32_WG64_4_1_WGM2
    SolutionIndex: 180
    SolutionNameMin: Cijk_Alik_Bljk_HBH_MT128x256x32_MI32x32x4x2_SE_1LDSB0_AF0EM1_GRVW2_LBSPP128_PLR9_SU0_SUS256_SRVW4_TT2_64_WG64_4_1_WGM1
    SolutionIndex: 181
    SolutionNameMin: Cijk_Alik_Bljk_HBH_MT64x128x128_MI32x32x8x1_SE_1LDSB1_AF0EM4_GRVW8_LBSPP256_PLR17_SU0_SUS256_SRVW4_TT1_64_WG64_4_1_WGM1
    SolutionIndex: 182
    SolutionNameMin: Cijk_Alik_Bljk_HBH_MT128x160x64_MI32x32x8x1_SE_1LDSB1_AF0EM4_GRVW4_LBSPP128_PLR9_SU16_SUS128_SRVW4_TT1_160_WG128_2_1_WGM15
    SolutionIndex: 183
    SolutionNameMin: Cijk_Alik_Bljk_HBH_MT128x64x32_MI32x32x8x1_SE_1LDSB0_AF0EM4_GRVW8_LBSPP128_PLR5_SU16_SUS256_SRVW4_TT2_32_WG64_4_1_WGM1
    SolutionIndex: 184
    SolutionNameMin: Cijk_Alik_Bljk_HBH_MT128x64x32_MI32x32x4x2_SE_1LDSB0_AF0EM1_GRVW2_LBSPP128_PLR9_SU0_SUS256_SRVW4_TT1_32_WG128_2_1_WGM1
    SolutionIndex: 185
    SolutionNameMin: Cijk_Alik_Bljk_HBH_MT128x288x64_MI32x32x8x1_SE_1LDSB1_AF0EM4_GRVW4_LBSPP128_PLR9_SU0_SUS256_SRVW4_TT1_288_WG128_2_1_WGM15
    SolutionIndex: 186
    SolutionNameMin: Cijk_Alik_Bljk_HBH_MT256x256x32_MI32x32x8x1_SE_1LDSB1_AF0EM8_GRVW2_GSU1_LBSPP128_PLR5_SU0_SUS256_SRVW4_TT4_128_VAW2_WG64_4_1_WGM1
    SolutionIndex: 187
    SolutionNameMin: Cijk_Alik_Bljk_HBH_MT256x256x32_MI32x32x8x1_SE_1LDSB1_AF0EM8_GRVW2_GSU1_LBSPP128_PLR5_SU0_SUS256_SRVW4_TT4_128_VAW2_WG64_4_1_WGM2
    SolutionIndex: 188
    SolutionNameMin: Cijk_Alik_Bljk_HBH_MT128x256x32_MI32x32x8x1_SE_1LDSB1_AF0EM8_GRVW8_GSU1_LBSPP128_PLR5_SU0_SUS256_SRVW4_TT2_128_VAW2_WG64_4_1_WGM1
    SolutionIndex: 189
    SolutionNameMin: Cijk_Alik_Bljk_HBH_MT64x64x64_MI32x32x8x1_SE_1LDSB1_AF0EM8_GRVW8_GSU1_LBSPP128_PLR9_SU0_SUS256_SRVW4_TT1_32_VAW2_WG64_4_1_WGM1
    SolutionIndex: 190
    SolutionNameMin: Cijk_Alik_Bljk_HBH_MT32x64x64_MI16x16x16x1_SE_1LDSB0_AF0EM8_GRVW8_GSU1_LBSPP128_PLR5_SU32_SUS128_SRVW4_TT1_32_VAW2_WG32_8_1_WGM1
    SolutionIndex: 191
    SolutionNameMin: Cijk_Alik_Bljk_HBH_MT256x128x32_MI32x32x8x1_SE_1LDSB1_AF0EM8_GRVW8_GSU1_LBSPP128_PLR5_SU0_SUS256_SRVW4_TT4_64_VAW2_WG64_4_1_WGM15
    SolutionIndex: 192
    SolutionNameMin: Cijk_Alik_Bljk_HBH_MT128x96x64_MI32x32x8x1_SE_1LDSB1_AF0EM8_GRVW8_GSU1_LBSPP128_PLR9_SU32_SUS128_SRVW4_TT1_96_VAW2_WG128_2_1_WGM15
    SolutionIndex: 193
    SolutionNameMin: Cijk_Alik_Bljk_HBH_MT64x64x64_MI32x32x8x1_SE_1LDSB1_AF0EM8_GRVW8_GSU1_LBSPP128_PLR9_SU32_SUS128_SRVW4_TT1_32_VAW2_WG64_4_1_WGM1
    SolutionIndex: 194
    SolutionNameMin: Cijk_Alik_Bljk_HBH_MT256x160x64_MI32x32x8x1_SE_1LDSB1_AF0EM8_GRVW4_GSU1_LBSPP128_PLR9_SU0_SUS256_SRVW4_TT2_160_VAW2_WG128_2_1_WGM15
    SolutionIndex: 195
    SolutionNameMin: Cijk_Alik_Bljk_HBH_MT128x288x32_MI32x32x8x1_SE_1LDSB1_AF0EM8_GRVW4_GSU1_LBSPP128_PLR5_SU0_SUS256_SRVW4_TT1_288_VAW2_WG128_2_1_WGM2
    SolutionIndex: 196
    SolutionNameMin: Cijk_Alik_Bljk_HBH_MT128x96x64_MI32x32x8x1_SE_1LDSB0_AF0EM8_GRVW8_GSU1_LBSPP128_PLR9_SU32_SUS128_SRVW4_TT1_96_VAW2_WG128_2_1_WGM1
    SolutionIndex: 197
    SolutionNameMin: Cijk_Alik_Bljk_HBH_MT128x128x32_MI32x32x8x1_SE_1LDSB1_AF0EM8_GRVW2_GSU1_LBSPP128_PLR5_SU0_SUS256_SRVW4_TT2_64_VAW2_WG64_4_1_WGM15
    SolutionIndex: 198
    SolutionNameMin: Cijk_Alik_Bljk_HBH_MT16x16x128_MI16x16x16x1_SE_1LDSB0_AF0EM1_GRVW8_GSU1_LBSPP256_PLR9_SU0_SUS256_SRVW0_TT1_16_VAW2_WG16_4_1_WGM2
    SolutionIndex: 199
    SolutionNameMin: Cijk_Alik_Bljk_HBH_MT32x32x64_MI16x16x16x1_SE_1LDSB0_AF0EM8_GRVW8_GSU1_LBSPP128_PLR5_SU32_SUS128_SRVW4_TT1_16_VAW2_WG32_8_1_WGM2
    SolutionIndex: 200
    SolutionNameMin: Cijk_Alik_Bljk_HBH_MT64x128x64_MI32x32x8x1_SE_1LDSB0_AF0EM8_GRVW4_GSU1_LBSPP128_PLR9_SU32_SUS256_SRVW4_TT1_64_VAW2_WG64_4_1_WGM15
    SolutionIndex: 201
    SolutionNameMin: Cijk_Alik_Bljk_HBH_MT64x64x64_MI32x32x8x1_SE_1LDSB1_AF0EM8_GRVW8_GSU1_LBSPP128_PLR9_SU0_SUS256_SRVW4_TT1_32_VAW2_WG64_4_1_WGM15
    SolutionIndex: 202
    SolutionNameMin: Cijk_Alik_Bljk_HBH_MT16x16x128_MI16x16x16x1_SE_1LDSB1_AF0EM8_GRVW8_GSU1_LBSPP256_PLR9_SU32_SUS256_SRVW0_TT1_16_VAW2_WG16_4_1_WGM1
    SolutionIndex: 203
    SolutionNameMin: Cijk_Alik_Bljk_HBH_MT64x32x64_MI16x16x16x1_SE_1LDSB0_AF0EM8_GRVW8_GSU1_LBSPP128_PLR5_SU32_SUS128_SRVW4_TT2_16_VAW2_WG32_8_1_WGM15
    SolutionIndex: 204
    SolutionNameMin: Cijk_Alik_Bljk_HBH_MT128x96x64_MI32x32x8x1_SE_1LDSB1_AF0EM8_GRVW8_GSU1_LBSPP128_PLR9_SU0_SUS256_SRVW4_TT1_96_VAW2_WG128_2_1_WGM15
    SolutionIndex: 205
    SolutionNameMin: Cijk_Alik_Bljk_HBH_MT128x128x64_MI32x32x8x1_SE_1LDSB1_AF0EM8_GRVW8_GSU1_LBSPP128_PLR9_SU32_SUS128_SRVW4_TT2_64_VAW2_WG64_4_1_WGM2
    SolutionIndex: 206
    SolutionNameMin: Cijk_Alik_Bljk_HBH_MT64x64x64_MI32x32x8x1_SE_1LDSB1_AF0EM8_GRVW2_GSU1_LBSPP128_PLR9_SU0_SUS256_SRVW4_TT1_32_VAW2_WG64_4_1_WGM1
    SolutionIndex: 207
    SolutionNameMin: Cijk_Alik_Bljk_HBH_MT32x32x64_MI16x16x16x1_SE_1LDSB0_AF0EM8_GRVW8_GSU1_LBSPP128_PLR5_SU32_SUS128_SRVW4_TT1_16_VAW2_WG32_8_1_WGM1
    SolutionIndex: 208
    SolutionNameMin: Cijk_Alik_Bljk_HBH_MT64x128x64_MI32x32x8x1_SE_1LDSB1_AF0EM8_GRVW8_GSU1_LBSPP128_PLR9_SU32_SUS128_SRVW4_TT1_64_VAW2_WG64_4_1_WGM15
    SolutionIndex: 209
    SolutionNameMin: Cijk_Alik_Bljk_HBH_MT128x96x64_MI32x32x8x1_SE_1LDSB1_AF0EM8_GRVW8_GSU1_LBSPP128_PLR9_SU0_SUS256_SRVW4_TT1_96_VAW2_WG128_2_1_WGM2
    SolutionIndex: 210
    SolutionNameMin: Cijk_Alik_Bljk_HBH_MT128x128x32_MI32x32x8x1_SE_1LDSB1_AF0EM8_GRVW4_GSU1_LBSPP128_PLR5_SU0_SUS256_SRVW4_TT2_64_VAW2_WG64_4_1_WGM15
    SolutionIndex: 211
    SolutionNameMin: Cijk_Alik_Bljk_HBH_MT128x128x32_MI32x32x8x1_SE_1LDSB1_AF0EM8_GRVW4_GSU1_LBSPP128_PLR5_SU32_SUS128_SRVW4_TT2_64_VAW2_WG64_4_1_WGM1
    SolutionIndex: 212
    SolutionNameMin: Cijk_Alik_Bljk_HBH_MT16x16x128_MI16x16x16x1_SE_1LDSB1_AF0EM1_GRVW8_GSU1_LBSPP256_PLR9_SU0_SUS256_SRVW0_TT1_16_VAW2_WG16_4_1_WGM2
    SolutionIndex: 213
    SolutionNameMin: Cijk_Alik_Bljk_HBH_MT64x64x64_MI32x32x8x1_SE_1LDSB1_AF0EM8_GRVW8_GSU1_LBSPP128_PLR9_SU32_SUS128_SRVW4_TT1_32_VAW2_WG64_4_1_WGM2
    SolutionIndex: 214
    SolutionNameMin: Cijk_Alik_Bljk_HBH_MT128x160x64_MI32x32x8x1_SE_1LDSB1_AF0EM8_GRVW2_GSU1_LBSPP128_PLR9_SU32_SUS128_SRVW4_TT1_160_VAW2_WG128_2_1_WGM2
    SolutionIndex: 215
    SolutionNameMin: Cijk_Alik_Bljk_HBH_MT128x160x32_MI32x32x8x1_SE_1LDSB1_AF0EM8_GRVW4_GSU1_LBSPP128_PLR5_SU0_SUS256_SRVW4_TT1_160_VAW2_WG128_2_1_WGM15
    SolutionIndex: 216
    SolutionNameMin: Cijk_Alik_Bljk_HBH_MT32x32x64_MI16x16x16x1_SE_1LDSB0_AF0EM8_GRVW4_GSU1_LBSPP128_PLR5_SU32_SUS128_SRVW4_TT1_16_VAW2_WG32_8_1_WGM1
    SolutionIndex: 217
    SolutionNameMin: Cijk_Alik_Bljk_HBH_MT128x64x64_MI32x32x8x1_SE_1LDSB1_AF0EM8_GRVW8_GSU1_LBSPP128_PLR9_SU32_SUS256_SRVW4_TT2_32_VAW2_WG64_4_1_WGM15
    SolutionIndex: 218
    SolutionNameMin: Cijk_Alik_Bljk_HBH_MT160x160x64_MI16x16x16x1_SE_1LDSB1_AF0EM8_GRVW2_GSU1_LBSPP128_PLR5_SU0_SUS256_SRVW0_TT5_80_VAW2_WG32_8_1_WGM1
    SolutionIndex: 219
    SolutionNameMin: Cijk_Alik_Bljk_HBH_MT128x256x32_MI32x32x8x1_SE_1LDSB1_AF0EM8_GRVW8_GSU1_LBSPP128_PLR5_SU0_SUS256_SRVW4_TT2_128_VAW2_WG64_4_1_WGM2
    SolutionIndex: 220
    SolutionNameMin: Cijk_Alik_Bljk_HBH_MT64x64x64_MI32x32x8x1_SE_1LDSB1_AF0EM8_GRVW2_GSU1_LBSPP128_PLR9_SU0_SUS256_SRVW4_TT1_32_VAW2_WG64_4_1_WGM2
    SolutionIndex: 221
    SolutionNameMin: Cijk_Alik_Bljk_HBH_MT128x64x64_MI32x32x8x1_SE_1LDSB0_AF0EM8_GRVW4_GSU1_LBSPP128_PLR9_SU32_SUS256_SRVW4_TT2_32_VAW2_WG64_4_1_WGM15
    SolutionIndex: 222
    SolutionNameMin: Cijk_Alik_Bljk_HBH_MT128x128x32_MI32x32x8x1_SE_1LDSB1_AF0EM8_GRVW4_GSU1_LBSPP128_PLR5_SU32_SUS256_SRVW4_TT2_64_VAW2_WG64_4_1_WGM15
    SolutionIndex: 223
    SolutionNameMin: Cijk_Alik_Bljk_HBH_MT16x16x128_MI16x16x16x1_SE_1LDSB0_AF0EM8_GRVW8_GSU1_LBSPP256_PLR9_SU32_SUS256_SRVW0_TT1_16_VAW2_WG16_4_1_WGM1
    SolutionIndex: 224
    SolutionNameMin: Cijk_Alik_Bljk_HBH_MT128x256x32_MI32x32x8x1_SE_1LDSB1_AF0EM8_GRVW8_GSU1_LBSPP128_PLR5_SU32_SUS256_SRVW4_TT2_128_VAW2_WG64_4_1_WGM2
    SolutionIndex: 225
    SolutionNameMin: Cijk_Alik_Bljk_HBH_MT64x128x64_MI32x32x8x1_SE_1LDSB1_AF0EM8_GRVW8_GSU1_LBSPP128_PLR9_SU32_SUS256_SRVW4_TT1_64_VAW2_WG64_4_1_WGM15
    SolutionIndex: 226
    SolutionNameMin: Cijk_Alik_Bljk_HBH_MT128x128x32_MI32x32x8x1_SE_1LDSB1_AF0EM8_GRVW8_GSU1_LBSPP128_PLR5_SU0_SUS256_SRVW4_TT2_64_VAW2_WG64_4_1_WGM15
    SolutionIndex: 227
    SolutionNameMin: Cijk_Alik_Bljk_HBH_MT64x32x64_MI16x16x16x1_SE_1LDSB0_AF0EM8_GRVW8_GSU1_LBSPP128_PLR5_SU0_SUS256_SRVW4_TT2_16_VAW2_WG32_8_1_WGM15
    SolutionIndex: 228
    SolutionNameMin: Cijk_Alik_Bljk_HBH_MT64x64x64_MI32x32x8x1_SE_1LDSB1_AF0EM8_GRVW8_GSU1_LBSPP128_PLR9_SU0_SUS256_SRVW4_TT1_32_VAW2_WG64_4_1_WGM2
    SolutionIndex: 229
    SolutionNameMin: Cijk_Alik_Bljk_HBH_MT16x16x128_MI16x16x16x1_SE_1LDSB1_AF0EM1_GRVW8_GSU1_LBSPP256_PLR9_SU32_SUS256_SRVW0_TT1_16_VAW2_WG16_4_1_WGM1
    SolutionIndex: 230
    SolutionNameMin: Cijk_Alik_Bljk_HBH_MT128x96x64_MI32x32x8x1_SE_1LDSB0_AF0EM8_GRVW8_GSU1_LBSPP128_PLR9_SU32_SUS256_SRVW4_TT1_96_VAW2_WG128_2_1_WGM15
    SolutionIndex: 231
    SolutionNameMin: Cijk_Alik_Bljk_HBH_MT128x128x64_MI32x32x8x1_SE_1LDSB1_AF0EM8_GRVW8_GSU1_LBSPP128_PLR9_SU32_SUS128_SRVW4_TT2_64_VAW2_WG64_4_1_WGM15
    SolutionIndex: 232
    SolutionNameMin: Cijk_Alik_Bljk_HBH_MT128x96x64_MI32x32x8x1_SE_1LDSB1_AF0EM8_GRVW8_GSU1_LBSPP128_PLR9_SU32_SUS256_SRVW4_TT1_96_VAW2_WG128_2_1_WGM15
    SolutionIndex: 233
    SolutionNameMin: Cijk_Alik_Bljk_HBH_MT128x160x32_MI32x32x8x1_SE_1LDSB1_AF0EM8_GRVW2_GSU1_LBSPP128_PLR5_SU0_SUS256_SRVW4_TT1_160_VAW2_WG128_2_1_WGM2
    SolutionIndex: 234
    SolutionNameMin: Cijk_Alik_Bljk_HBH_MT128x256x32_MI32x32x8x1_SE_1LDSB1_AF0EM8_GRVW2_GSU1_LBSPP128_PLR5_SU0_SUS256_SRVW4_TT2_128_VAW2_WG64_4_1_WGM2
    SolutionIndex: 235
    SolutionNameMin: Cijk_Alik_Bljk_HBH_MT64x4x64_MI4x4x4x16_SE_1LDSB1_AF0EM8_GRVW8_GSU1_LBSPP128_PLR17_SU32_SUS256_SRVW0_TT1_4_VAW2_WG64_1_1_WGM1
    SolutionIndex: 236
    SolutionNameMin: Cijk_Alik_Bljk_HBH_MT32x32x64_MI16x16x16x1_SE_1LDSB0_AF0EM8_GRVW8_GSU1_LBSPP128_PLR5_SU0_SUS256_SRVW4_TT1_16_VAW2_WG32_8_1_WGM1
    SolutionIndex: 237
    SolutionNameMin: Cijk_Alik_Bljk_HBH_MT128x288x64_MI32x32x8x1_SE_1LDSB1_AF0EM8_GRVW4_GSU1_LBSPP128_PLR9_SU0_SUS256_SRVW4_TT1_288_VAW2_WG128_2_1_WGM15
    SolutionIndex: 238
    SolutionNameMin: Cijk_Alik_Bljk_HBH_MT256x160x64_MI32x32x8x1_SE_1LDSB1_AF0EM8_GRVW2_GSU1_LBSPP128_PLR9_SU0_SUS256_SRVW4_TT2_160_VAW2_WG128_2_1_WGM1
    SolutionIndex: 239
    SolutionNameMin: Cijk_Alik_Bljk_HBH_MT128x256x32_MI32x32x8x1_SE_1LDSB1_AF0EM8_GRVW8_GSU1_LBSPP128_PLR5_SU32_SUS128_SRVW4_TT2_128_VAW2_WG64_4_1_WGM15
    SolutionIndex: 240
    SolutionNameMin: Cijk_Alik_Bljk_HBH_MT128x256x32_MI32x32x8x1_SE_1LDSB1_AF0EM8_GRVW8_GSU1_LBSPP128_PLR5_SU32_SUS128_SRVW4_TT2_128_VAW2_WG64_4_1_WGM2
    SolutionIndex: 241
    SolutionNameMin: Cijk_Alik_Bljk_HBH_MT256x160x64_MI32x32x8x1_SE_1LDSB1_AF0EM8_GRVW2_GSU1_LBSPP128_PLR9_SU0_SUS256_SRVW4_TT2_160_VAW2_WG128_2_1_WGM2
    SolutionIndex: 242
    SolutionNameMin: Cijk_Alik_Bljk_HBH_MT256x160x64_MI32x32x8x1_SE_1LDSB1_AF0EM8_GRVW2_GSU1_LBSPP128_PLR9_SU0_SUS256_SRVW4_TT2_160_VAW2_WG128_2_1_WGM15
    SolutionIndex: 243
    SolutionNameMin: Cijk_Alik_Bljk_HBH_MT128x256x32_MI32x32x8x1_SE_1LDSB1_AF0EM8_GRVW8_GSU1_LBSPP128_PLR5_SU0_SUS256_SRVW4_TT2_128_VAW2_WG64_4_1_WGM15
    SolutionIndex: 244
    SolutionNameMin: Cijk_Alik_Bljk_HBH_MT128x256x64_MI32x32x8x1_SE_1LDSB1_AF0EM8_GRVW2_GSU1_LBSPP128_PLR9_SU0_SUS256_SRVW4_TT2_128_VAW2_WG64_4_1_WGM2
    SolutionIndex: 245
    SolutionNameMin: Cijk_Alik_Bljk_HBH_MT256x256x32_MI32x32x8x1_SE_1LDSB1_AF0EM8_GRVW2_GSU1_LBSPP128_PLR5_SU0_SUS256_SRVW4_TT4_128_VAW2_WG64_4_1_WGM15
    SolutionIndex: 246
    SolutionNameMin: Cijk_Alik_Bljk_HBH_MT256x160x64_MI32x32x8x1_SE_1LDSB1_AF0EM8_GRVW4_GSU1_LBSPP128_PLR9_SU32_SUS128_SRVW4_TT2_160_VAW2_WG128_2_1_WGM15
    SolutionIndex: 247
    SolutionNameMin: Cijk_Alik_Bljk_HBH_MT32x32x32_MI16x16x16x1_SE_1LDSB1_AF0EM8_GRVW4_GSU1_LBSPP128_PLR2_SU32_SUS256_SRVW4_TT1_16_VAW2_WG32_8_1_WGM15
    SolutionIndex: 248
    SolutionNameMin: Cijk_Alik_Bljk_HBH_MT32x64x32_MI16x16x16x1_SE_1LDSB1_AF0EM8_GRVW4_GSU1_LBSPP128_PLR2_SU32_SUS128_SRVW4_TT1_32_VAW2_WG32_8_1_WGM1
    SolutionIndex: 249
    SolutionNameMin: Cijk_Alik_Bljk_HBH_MT32x32x64_MI16x16x16x1_SE_1LDSB0_AF0EM8_GRVW4_GSU1_LBSPP128_PLR5_SU0_SUS256_SRVW4_TT1_16_VAW2_WG32_8_1_WGM1
    SolutionIndex: 250
    SolutionNameMin: Cijk_Alik_Bljk_HBH_MT64x32x32_MI16x16x16x1_SE_1LDSB0_AF0EM8_GRVW8_GSU1_LBSPP128_PLR2_SU0_SUS256_SRVW4_TT2_16_VAW2_WG32_8_1_WGM1
    SolutionIndex: 251
    SolutionNameMin: Cijk_Alik_Bljk_HBH_MT32x32x32_MI16x16x16x1_SE_1LDSB0_AF0EM8_GRVW2_GSU1_LBSPP128_PLR2_SU0_SUS256_SRVW4_TT1_16_VAW2_WG32_8_1_WGM1
    SolutionIndex: 252
    SolutionNameMin: Cijk_Alik_Bljk_HBH_MT32x32x32_MI16x16x16x1_SE_1LDSB1_AF0EM8_GRVW2_GSU1_LBSPP128_PLR2_SU0_SUS256_SRVW4_TT1_16_VAW2_WG32_8_1_WGM15
    SolutionIndex: 253
    SolutionNameMin: Cijk_Alik_Bljk_HBH_MT128x96x64_MI32x32x8x1_SE_1LDSB0_AF0EM8_GRVW2_GSU1_LBSPP128_PLR9_SU32_SUS256_SRVW4_TT1_96_VAW2_WG128_2_1_WGM15
    SolutionIndex: 254
    SolutionNameMin: Cijk_Alik_Bljk_HBH_MT64x64x32_MI32x32x8x1_SE_1LDSB1_AF0EM8_GRVW2_GSU1_LBSPP128_PLR5_SU0_SUS256_SRVW4_TT1_32_VAW2_WG64_4_1_WGM15
    SolutionIndex: 255
    SolutionNameMin: Cijk_Alik_Bljk_HBH_MT32x32x64_MI16x16x16x1_SE_1LDSB0_AF0EM8_GRVW8_GSU15_LBSPP128_PLR5_SU0_SUS256_SRVW0_TT1_16_VAW1_WG32_8_1_WGM1
    SolutionIndex: 256
    SolutionNameMin: Cijk_Alik_Bljk_HBH_MT32x32x64_MI16x16x16x1_SE_1LDSB0_AF0EM8_GRVW4_GSU1_LBSPP128_PLR5_SU0_SUS256_SRVW4_TT1_16_VAW2_WG32_8_1_WGM2
    SolutionIndex: 257
    SolutionNameMin: Cijk_Alik_Bljk_HBH_MT128x128x32_MI32x32x8x1_SE_1LDSB0_AF0EM8_GRVW8_GSU1_LBSPP128_PLR5_SU0_SUS256_SRVW4_TT2_64_VAW2_WG64_4_1_WGM15
    SolutionIndex: 258
    SolutionNameMin: Cijk_Alik_Bljk_HBH_MT16x16x128_MI16x16x16x1_SE_1LDSB0_AF0EM1_GRVW8_GSU1_LBSPP256_PLR9_SU0_SUS256_SRVW0_TT1_16_VAW2_WG16_4_1_WGM1
    SolutionIndex: 259
    SolutionNameMin: Cijk_Alik_Bljk_HBH_MT64x128x64_MI32x32x8x1_SE_1LDSB0_AF0EM8_GRVW8_GSU1_LBSPP128_PLR9_SU0_SUS256_SRVW4_TT1_64_VAW2_WG64_4_1_WGM15
    SolutionIndex: 260
    SolutionNameMin: Cijk_Alik_Bljk_HBH_MT32x64x64_MI16x16x16x1_SE_1LDSB0_AF0EM8_GRVW8_GSU1_LBSPP128_PLR5_SU0_SUS256_SRVW4_TT1_32_VAW2_WG32_8_1_WGM15
    SolutionIndex: 261
    SolutionNameMin: Cijk_Alik_Bljk_HBH_MT64x64x64_MI32x32x8x1_SE_1LDSB0_AF0EM8_GRVW2_GSU1_LBSPP128_PLR9_SU0_SUS256_SRVW4_TT1_32_VAW2_WG64_4_1_WGM15
    SolutionIndex: 262
    SolutionNameMin: Cijk_Alik_Bljk_HBH_MT64x128x64_MI32x32x8x1_SE_1LDSB0_AF0EM8_GRVW2_GSU1_LBSPP128_PLR9_SU32_SUS128_SRVW4_TT1_64_VAW2_WG64_4_1_WGM15
    SolutionIndex: 263
    SolutionNameMin: Cijk_Alik_Bljk_HBH_MT64x128x64_MI32x32x8x1_SE_1LDSB1_AF0EM8_GRVW2_GSU1_LBSPP128_PLR9_SU0_SUS256_SRVW4_TT1_64_VAW2_WG64_4_1_WGM15
    SolutionIndex: 264
    SolutionNameMin: Cijk_Alik_Bljk_HBH_MT64x128x64_MI32x32x8x1_SE_1LDSB0_AF0EM8_GRVW2_GSU1_LBSPP128_PLR9_SU0_SUS256_SRVW4_TT1_64_VAW2_WG64_4_1_WGM15
    SolutionIndex: 265
    SolutionNameMin: Cijk_Alik_Bljk_HBH_MT128x96x64_MI32x32x8x1_SE_1LDSB0_AF0EM8_GRVW2_GSU1_LBSPP128_PLR9_SU0_SUS256_SRVW4_TT1_96_VAW2_WG128_2_1_WGM2
    SolutionIndex: 266
    SolutionNameMin: Cijk_Alik_Bljk_HBH_MT128x128x64_MI32x32x8x1_SE_1LDSB1_AF0EM8_GRVW8_GSU1_LBSPP128_PLR9_SU32_SUS256_SRVW4_TT2_64_VAW2_WG64_4_1_WGM15
    SolutionIndex: 267
    SolutionNameMin: Cijk_Alik_Bljk_HBH_MT128x128x64_MI32x32x8x1_SE_1LDSB1_AF0EM8_GRVW8_GSU1_LBSPP128_PLR9_SU0_SUS256_SRVW4_TT2_64_VAW2_WG64_4_1_WGM2
    SolutionIndex: 268
    SolutionNameMin: Cijk_Alik_Bljk_HBH_MT128x128x64_MI32x32x8x1_SE_1LDSB1_AF0EM8_GRVW4_GSU1_LBSPP128_PLR9_SU0_SUS256_SRVW4_TT2_64_VAW2_WG64_4_1_WGM2
    SolutionIndex: 269
    SolutionNameMin: Cijk_Alik_Bljk_HBH_MT128x160x64_MI32x32x8x1_SE_1LDSB1_AF0EM8_GRVW8_GSU1_LBSPP128_PLR9_SU0_SUS256_SRVW4_TT1_160_VAW2_WG128_2_1_WGM15
    SolutionIndex: 270
    SolutionNameMin: Cijk_Alik_Bljk_HBH_MT128x96x32_MI32x32x8x1_SE_1LDSB1_AF0EM8_GRVW4_GSU1_LBSPP128_PLR5_SU0_SUS256_SRVW4_TT1_96_VAW2_WG128_2_1_WGM2
    SolutionIndex: 271
    SolutionNameMin: Cijk_Alik_Bljk_HBH_MT128x96x32_MI32x32x8x1_SE_1LDSB1_AF0EM8_GRVW4_GSU1_LBSPP128_PLR5_SU0_SUS256_SRVW4_TT1_96_VAW2_WG128_2_1_WGM15
    SolutionIndex: 272
    SolutionNameMin: Cijk_Alik_Bljk_HBH_MT128x256x64_MI32x32x8x1_SE_1LDSB1_AF0EM8_GRVW2_GSU1_LBSPP128_PLR9_SU0_SUS256_SRVW4_TT2_128_VAW2_WG64_4_1_WGM15
    SolutionIndex: 273
    SolutionNameMin: Cijk_Alik_Bljk_HBH_MT128x160x64_MI32x32x8x1_SE_1LDSB1_AF0EM8_GRVW8_GSU1_LBSPP128_PLR9_SU32_SUS128_SRVW4_TT1_160_VAW2_WG128_2_1_WGM2
    SolutionIndex: 274
    SolutionNameMin: Cijk_Alik_Bljk_HBH_MT128x96x64_MI32x32x8x1_SE_1LDSB1_AF0EM8_GRVW4_GSU1_LBSPP128_PLR9_SU0_SUS256_SRVW4_TT1_96_VAW2_WG128_2_1_WGM2
    SolutionIndex: 275
    SolutionNameMin: Cijk_Alik_Bljk_HBH_MT64x32x32_MI16x16x16x1_SE_1LDSB1_AF0EM8_GRVW8_GSU1_LBSPP128_PLR2_SU0_SUS256_SRVW4_TT2_16_VAW2_WG32_8_1_WGM1
    SolutionIndex: 276
    SolutionNameMin: Cijk_Alik_Bljk_HBH_MT128x128x32_MI32x32x8x1_SE_1LDSB1_AF0EM8_GRVW8_GSU1_LBSPP128_PLR5_SU32_SUS128_SRVW4_TT2_64_VAW2_WG64_4_1_WGM1
    SolutionIndex: 277
    SolutionNameMin: Cijk_Alik_Bljk_HBH_MT128x128x32_MI32x32x8x1_SE_1LDSB1_AF0EM8_GRVW8_GSU1_LBSPP128_PLR5_SU32_SUS128_SRVW4_TT2_64_VAW2_WG64_4_1_WGM2
    SolutionIndex: 278
    SolutionNameMin: Cijk_Alik_Bljk_HBH_MT64x64x64_MI32x32x8x1_SE_1LDSB1_AF0EM8_GRVW8_GSU1_LBSPP128_PLR9_SU32_SUS128_SRVW4_TT1_32_VAW2_WG64_4_1_WGM15
    SolutionIndex: 279
    SolutionNameMin: Cijk_Alik_Bljk_HBH_MT64x64x64_MI32x32x8x1_SE_1LDSB1_AF0EM8_GRVW8_GSU1_LBSPP128_PLR9_SU32_SUS256_SRVW4_TT1_32_VAW2_WG64_4_1_WGM1
    SolutionIndex: 280
    SolutionNameMin: Cijk_Alik_Bljk_HBH_MT128x64x64_MI32x32x8x1_SE_1LDSB1_AF0EM8_GRVW8_GSU1_LBSPP128_PLR9_SU32_SUS128_SRVW4_TT2_32_VAW2_WG64_4_1_WGM15
    SolutionIndex: 281
    SolutionNameMin: Cijk_Alik_Bljk_HBH_MT64x128x64_MI32x32x8x1_SE_1LDSB0_AF0EM8_GRVW8_GSU1_LBSPP128_PLR9_SU32_SUS128_SRVW4_TT1_64_VAW2_WG64_4_1_WGM2
    SolutionIndex: 282
    SolutionNameMin: Cijk_Alik_Bljk_HBH_MT128x64x64_MI32x32x8x1_SE_1LDSB1_AF0EM8_GRVW8_GSU1_LBSPP128_PLR9_SU32_SUS256_SRVW4_TT2_32_VAW2_WG64_4_1_WGM1
    SolutionIndex: 283
    SolutionNameMin: Cijk_Alik_Bljk_HBH_MT64x128x64_MI32x32x8x1_SE_1LDSB1_AF0EM8_GRVW8_GSU1_LBSPP128_PLR9_SU32_SUS128_SRVW4_TT1_64_VAW2_WG64_4_1_WGM1
    SolutionIndex: 284
    SolutionNameMin: Cijk_Alik_Bljk_HBH_MT64x64x32_MI32x32x8x1_SE_1LDSB1_AF0EM8_GRVW4_GSU1_LBSPP128_PLR5_SU0_SUS256_SRVW4_TT1_32_VAW2_WG64_4_1_WGM15
    SolutionIndex: 285
    SolutionNameMin: Cijk_Alik_Bljk_HBH_MT128x128x64_MI32x32x8x1_SE_1LDSB1_AF0EM8_GRVW8_GSU1_LBSPP128_PLR9_SU32_SUS256_SRVW4_TT2_64_VAW2_WG64_4_1_WGM1
    SolutionIndex: 286
    SolutionNameMin: Cijk_Alik_Bljk_HBH_MT128x64x32_MI32x32x8x1_SE_1LDSB0_AF0EM8_GRVW4_GSU1_LBSPP128_PLR5_SU0_SUS256_SRVW4_TT2_32_VAW2_WG64_4_1_WGM15
    SolutionIndex: 287
    SolutionNameMin: Cijk_Alik_Bljk_HBH_MT128x128x32_MI32x32x8x1_SE_1LDSB1_AF0EM8_GRVW8_GSU1_LBSPP128_PLR5_SU32_SUS256_SRVW4_TT2_64_VAW2_WG64_4_1_WGM1
    SolutionIndex: 288
    SolutionNameMin: Cijk_Alik_Bljk_HBH_MT128x128x32_MI32x32x8x1_SE_1LDSB1_AF0EM8_GRVW8_GSU1_LBSPP128_PLR5_SU0_SUS256_SRVW4_TT2_64_VAW2_WG64_4_1_WGM1
    SolutionIndex: 289
    SolutionNameMin: Cijk_Alik_Bljk_HBH_MT128x128x32_MI32x32x8x1_SE_1LDSB1_AF0EM8_GRVW8_GSU1_LBSPP128_PLR5_SU32_SUS256_SRVW4_TT2_64_VAW2_WG64_4_1_WGM2
    SolutionIndex: 290
    SolutionNameMin: Cijk_Alik_Bljk_HBH_MT128x128x32_MI32x32x8x1_SE_1LDSB1_AF0EM8_GRVW8_GSU1_LBSPP128_PLR5_SU32_SUS128_SRVW4_TT2_64_VAW2_WG64_4_1_WGM15
    SolutionIndex: 291
    SolutionNameMin: Cijk_Alik_Bljk_HBH_MT16x16x128_MI16x16x16x1_SE_1LDSB0_AF0EM8_GRVW8_GSU1_LBSPP256_PLR9_SU0_SUS256_SRVW0_TT1_16_VAW2_WG16_4_1_WGM15
    SolutionIndex: 292
    SolutionNameMin: Cijk_Alik_Bljk_HBH_MT64x128x64_MI32x32x8x1_SE_1LDSB1_AF0EM8_GRVW8_GSU1_LBSPP128_PLR9_SU0_SUS256_SRVW4_TT1_64_VAW2_WG64_4_1_WGM1
    SolutionIndex: 293
    SolutionNameMin: Cijk_Alik_Bljk_HBH_MT128x128x32_MI32x32x8x1_SE_1LDSB1_AF0EM8_GRVW4_GSU1_LBSPP128_PLR5_SU32_SUS128_SRVW4_TT2_64_VAW2_WG64_4_1_WGM15
    SolutionIndex: 294
    SolutionNameMin: Cijk_Alik_Bljk_HBH_MT128x128x64_MI32x32x8x1_SE_1LDSB1_AF0EM8_GRVW8_GSU1_LBSPP128_PLR9_SU32_SUS128_SRVW4_TT2_64_VAW2_WG64_4_1_WGM1
    SolutionIndex: 295
    SolutionNameMin: Cijk_Alik_Bljk_HBH_MT16x16x128_MI16x16x16x1_SE_1LDSB0_AF0EM8_GRVW4_GSU1_LBSPP256_PLR9_SU32_SUS256_SRVW0_TT1_16_VAW2_WG16_4_1_WGM2
    SolutionIndex: 296
    SolutionNameMin: Cijk_Alik_Bljk_HBH_MT256x256x32_MI32x32x8x1_SE_1LDSB1_AF0EM8_GRVW2_GSU1_LBSPP128_PLR5_SU32_SUS256_SRVW4_TT4_128_VAW2_WG64_4_1_WGM2
    SolutionIndex: 297
    SolutionNameMin: Cijk_Alik_Bljk_HBH_MT128x96x64_MI32x32x8x1_SE_1LDSB1_AF0EM8_GRVW4_GSU1_LBSPP128_PLR9_SU0_SUS256_SRVW4_TT1_96_VAW2_WG128_2_1_WGM1
    SolutionIndex: 298
    SolutionNameMin: Cijk_Alik_Bljk_HBH_MT96x128x64_MI32x32x8x1_SE_1LDSB1_AF0EM8_GRVW8_GSU1_LBSPP128_PLR9_SU32_SUS256_SRVW0_TT3_32_VAW2_WG32_8_1_WGM15
    SolutionIndex: 299
    SolutionNameMin: Cijk_Alik_Bljk_HBH_MT96x128x64_MI32x32x8x1_SE_1LDSB1_AF0EM8_GRVW8_GSU1_LBSPP128_PLR9_SU32_SUS256_SRVW0_TT3_32_VAW2_WG32_8_1_WGM2
    SolutionIndex: 300
    SolutionNameMin: Cijk_Alik_Bljk_HBH_MT128x128x32_MI32x32x8x1_SE_1LDSB1_AF0EM8_GRVW4_GSU1_LBSPP128_PLR5_SU0_SUS256_SRVW4_TT2_64_VAW2_WG64_4_1_WGM1
    SolutionIndex: 301
    SolutionNameMin: Cijk_Alik_Bljk_HBH_MT32x32x64_MI16x16x16x1_SE_1LDSB0_AF0EM8_GRVW8_GSU1_LBSPP128_PLR5_SU0_SUS256_SRVW4_TT1_16_VAW2_WG32_8_1_WGM15
    SolutionIndex: 302
    SolutionNameMin: Cijk_Alik_Bljk_HBH_MT256x128x32_MI32x32x8x1_SE_1LDSB1_AF0EM8_GRVW8_GSU1_LBSPP128_PLR5_SU32_SUS256_SRVW4_TT4_64_VAW2_WG64_4_1_WGM15
    SolutionIndex: 303
    SolutionNameMin: Cijk_Alik_Bljk_HBH_MT128x64x32_MI32x32x8x1_SE_1LDSB1_AF0EM8_GRVW8_GSU1_LBSPP128_PLR5_SU32_SUS256_SRVW4_TT2_32_VAW2_WG64_4_1_WGM15
    SolutionIndex: 304
    SolutionNameMin: Cijk_Alik_Bljk_HBH_MT64x64x64_MI32x32x8x1_SE_1LDSB0_AF0EM8_GRVW8_GSU1_LBSPP128_PLR9_SU32_SUS256_SRVW4_TT1_32_VAW2_WG64_4_1_WGM15
    SolutionIndex: 305
    SolutionNameMin: Cijk_Alik_Bljk_HBH_MT64x64x64_MI32x32x8x1_SE_1LDSB1_AF0EM8_GRVW8_GSU1_LBSPP128_PLR9_SU32_SUS256_SRVW4_TT1_32_VAW2_WG64_4_1_WGM2
    SolutionIndex: 306
    SolutionNameMin: Cijk_Alik_Bljk_HBH_MT64x128x64_MI32x32x8x1_SE_1LDSB0_AF0EM8_GRVW4_GSU1_LBSPP128_PLR9_SU32_SUS256_SRVW4_TT1_64_VAW2_WG64_4_1_WGM2
    SolutionIndex: 307
    SolutionNameMin: Cijk_Alik_Bljk_HBH_MT128x64x64_MI32x32x8x1_SE_1LDSB1_AF0EM8_GRVW8_GSU1_LBSPP128_PLR9_SU0_SUS256_SRVW4_TT2_32_VAW2_WG64_4_1_WGM15
    SolutionIndex: 308
    SolutionNameMin: Cijk_Alik_Bljk_HBH_MT128x96x64_MI32x32x8x1_SE_1LDSB0_AF0EM8_GRVW8_GSU1_LBSPP128_PLR9_SU0_SUS256_SRVW4_TT1_96_VAW2_WG128_2_1_WGM2
    SolutionIndex: 309
    SolutionNameMin: Cijk_Alik_Bljk_HBH_MT32x64x64_MI16x16x16x1_SE_1LDSB1_AF0EM8_GRVW8_GSU1_LBSPP128_PLR5_SU32_SUS256_SRVW4_TT1_32_VAW2_WG32_8_1_WGM2
    SolutionIndex: 310
    SolutionNameMin: Cijk_Alik_Bljk_HBH_MT16x16x64_MI16x16x16x1_SE_1LDSB0_AF0EM1_GRVW4_GSU1_LBSPP128_PLR5_SU0_SUS256_SRVW0_TT1_16_VAW2_WG16_4_1_WGM1
    SolutionIndex: 311
    SolutionNameMin: Cijk_Alik_Bljk_HBH_MT16x16x64_MI16x16x16x1_SE_1LDSB0_AF0EM1_GRVW8_GSU1_LBSPP128_PLR5_SU0_SUS256_SRVW0_TT1_16_VAW2_WG16_4_1_WGM1
    SolutionIndex: 312
    SolutionNameMin: Cijk_Alik_Bljk_HBH_MT64x128x32_MI32x32x8x1_SE_1LDSB0_AF0EM8_GRVW8_GSU1_LBSPP128_PLR5_SU0_SUS256_SRVW4_TT1_64_VAW2_WG64_4_1_WGM1
    SolutionIndex: 313
    SolutionNameMin: Cijk_Alik_Bljk_HBH_MT128x160x64_MI32x32x8x1_SE_1LDSB1_AF0EM8_GRVW8_GSU1_LBSPP128_PLR9_SU32_SUS128_SRVW4_TT1_160_VAW2_WG128_2_1_WGM15
    SolutionIndex: 314
    SolutionNameMin: Cijk_Alik_Bljk_HBH_MT64x64x32_MI32x32x8x1_SE_1LDSB1_AF0EM8_GRVW8_GSU1_LBSPP128_PLR5_SU0_SUS256_SRVW4_TT1_32_VAW2_WG64_4_1_WGM1
    SolutionIndex: 315
    SolutionNameMin: Cijk_Alik_Bljk_HBH_MT128x96x32_MI32x32x8x1_SE_1LDSB1_AF0EM8_GRVW4_GSU1_LBSPP128_PLR5_SU0_SUS256_SRVW4_TT1_96_VAW2_WG128_2_1_WGM1
    SolutionIndex: 316
    SolutionNameMin: Cijk_Alik_Bljk_HBH_MT64x128x32_MI32x32x8x1_SE_1LDSB1_AF0EM8_GRVW8_GSU1_LBSPP128_PLR5_SU0_SUS256_SRVW4_TT1_64_VAW2_WG64_4_1_WGM15
    SolutionIndex: 317
    SolutionNameMin: Cijk_Alik_Bljk_HBH_MT64x64x64_MI32x32x8x1_SE_1LDSB1_AF0EM8_GRVW8_GSU1_LBSPP128_PLR9_SU32_SUS256_SRVW4_TT1_32_VAW2_WG64_4_1_WGM15
    SolutionIndex: 318
    SolutionNameMin: Cijk_Alik_Bljk_HBH_MT64x32x32_MI16x16x16x1_SE_1LDSB0_AF0EM8_GRVW4_GSU1_LBSPP128_PLR2_SU0_SUS256_SRVW4_TT2_16_VAW2_WG32_8_1_WGM1
    SolutionIndex: 319
    SolutionNameMin: Cijk_Alik_Bljk_HBH_MT16x16x64_MI16x16x16x1_SE_1LDSB0_AF0EM1_GRVW8_GSU1_LBSPP128_PLR5_SU32_SUS128_SRVW0_TT1_16_VAW2_WG16_4_1_WGM1
    SolutionIndex: 320
    SolutionNameMin: Cijk_Alik_Bljk_HBH_MT16x16x128_MI16x16x16x1_SE_1LDSB0_AF0EM8_GRVW8_GSU1_LBSPP256_PLR9_SU0_SUS256_SRVW0_TT1_16_VAW2_WG16_4_1_WGM1
    SolutionIndex: 321
    SolutionNameMin: Cijk_Alik_Bljk_HBH_MT64x64x64_MI32x32x8x1_SE_1LDSB1_AF0EM8_GRVW2_GSU1_LBSPP128_PLR9_SU0_SUS256_SRVW4_TT1_32_VAW2_WG64_4_1_WGM15
    SolutionIndex: 322
    SolutionNameMin: Cijk_Alik_Bljk_HBH_MT64x128x64_MI32x32x8x1_SE_1LDSB1_AF0EM8_GRVW8_GSU1_LBSPP128_PLR9_SU0_SUS256_SRVW4_TT1_64_VAW2_WG64_4_1_WGM2
    SolutionIndex: 323
    SolutionNameMin: Cijk_Alik_Bljk_HBH_MT32x32x64_MI16x16x16x1_SE_1LDSB0_AF0EM1_GRVW2_GSU5_LBSPP128_PLR5_SU0_SUS256_SRVW0_TT1_16_VAW1_WG32_8_1_WGM1
    SolutionIndex: 324
    SolutionNameMin: Cijk_Alik_Bljk_HBH_MT128x128x32_MI32x32x8x1_SE_1LDSB1_AF0EM1_GRVW4_GSU1_LBSPP128_PLR5_SU32_SUS128_SRVW4_TT2_64_VAW2_WG64_4_1_WGM15
    SolutionIndex: 325
    SolutionNameMin: Cijk_Alik_Bljk_HBH_MT32x32x32_MI16x16x16x1_SE_1LDSB0_AF0EM1_GRVW2_GSU15_LBSPP128_PLR2_SU0_SUS256_SRVW0_TT1_16_VAW1_WG32_8_1_WGM1
    SolutionIndex: 326
    SolutionNameMin: Cijk_Alik_Bljk_HBH_MT128x256x32_MI32x32x8x1_SE_1LDSB1_AF0EM1_GRVW8_GSU1_LBSPP128_PLR5_SU32_SUS128_SRVW4_TT2_128_VAW2_WG64_4_1_WGM15
    SolutionIndex: 327
    SolutionNameMin: Cijk_Alik_Bljk_HBH_MT128x160x32_MI32x32x8x1_SE_1LDSB1_AF0EM1_GRVW2_GSU1_LBSPP128_PLR5_SU32_SUS128_SRVW4_TT1_160_VAW2_WG128_2_1_WGM15
    SolutionIndex: 328
    SolutionNameMin: Cijk_Alik_Bljk_HBH_MT256x160x64_MI32x32x8x1_SE_1LDSB1_AF0EM1_GRVW2_GSU1_LBSPP128_PLR9_SU0_SUS256_SRVW4_TT2_160_VAW2_WG128_2_1_WGM15
    SolutionIndex: 329
    SolutionNameMin: Cijk_Alik_Bljk_HBH_MT128x128x32_MI32x32x8x1_SE_1LDSB1_AF0EM1_GRVW8_GSU1_LBSPP128_PLR5_SU0_SUS256_SRVW4_TT2_64_VAW2_WG64_4_1_WGM15
    SolutionIndex: 330
    SolutionNameMin: Cijk_Alik_Bljk_HBH_MT128x160x32_MI32x32x8x1_SE_1LDSB1_AF0EM1_GRVW4_GSU1_LBSPP128_PLR5_SU32_SUS128_SRVW4_TT1_160_VAW2_WG128_2_1_WGM15
    SolutionIndex: 331
    SolutionNameMin: Cijk_Alik_Bljk_HBH_MT16x16x128_MI16x16x16x1_SE_1LDSB1_AF0EM1_GRVW8_GSU1_LBSPP256_PLR9_SU0_SUS256_SRVW0_TT1_16_VAW2_WG16_4_1_WGM1
    SolutionIndex: 332
    SolutionNameMin: Cijk_Alik_Bljk_HBH_MT256x160x64_MI32x32x8x1_SE_1LDSB1_AF0EM1_GRVW2_GSU1_LBSPP128_PLR9_SU0_SUS256_SRVW4_TT2_160_VAW2_WG128_2_1_WGM2
    SolutionIndex: 333
    SolutionNameMin: Cijk_Alik_Bljk_HBH_MT128x96x64_MI32x32x8x1_SE_1LDSB1_AF0EM1_GRVW4_GSU1_LBSPP128_PLR9_SU32_SUS256_SRVW4_TT1_96_VAW2_WG128_2_1_WGM2
    SolutionIndex: 334
    SolutionNameMin: Cijk_Alik_Bljk_HBH_MT16x16x32_MI16x16x16x1_SE_1LDSB1_AF0EM1_GRVW8_GSU1_LBSPP128_PLR2_SU0_SUS256_SRVW0_TT1_16_VAW2_WG16_4_1_WGM1
    SolutionIndex: 335
    SolutionNameMin: Cijk_Alik_Bljk_HBH_MT16x16x32_MI16x16x16x1_SE_1LDSB1_AF0EM1_GRVW8_GSU1_LBSPP128_PLR2_SU0_SUS256_SRVW0_TT1_16_VAW2_WG16_4_1_WGM2
    SolutionIndex: 336
    SolutionNameMin: Cijk_Alik_Bljk_HBH_MT16x16x32_MI16x16x16x1_SE_1LDSB1_AF0EM1_GRVW2_GSU1_LBSPP128_PLR2_SU32_SUS128_SRVW0_TT1_16_VAW2_WG16_4_1_WGM1
    SolutionIndex: 337
    SolutionNameMin: Cijk_Alik_Bljk_HBH_MT32x32x32_MI16x16x16x1_SE_1LDSB1_AF0EM1_GRVW4_GSU1_LBSPP128_PLR2_SU0_SUS256_SRVW4_TT1_16_VAW2_WG32_8_1_WGM1
    SolutionIndex: 338
    SolutionNameMin: Cijk_Alik_Bljk_HBH_MT32x32x32_MI16x16x16x1_SE_1LDSB1_AF0EM1_GRVW2_GSU1_LBSPP128_PLR2_SU0_SUS256_SRVW4_TT1_16_VAW2_WG32_8_1_WGM1
    SolutionIndex: 339
    SolutionNameMin: Cijk_Alik_Bljk_HBH_MT32x32x32_MI16x16x16x1_SE_1LDSB1_AF0EM1_GRVW4_GSU1_LBSPP128_PLR2_SU32_SUS256_SRVW4_TT1_16_VAW2_WG32_8_1_WGM15
    SolutionIndex: 340
    SolutionNameMin: Cijk_Alik_Bljk_HBH_MT32x32x32_MI16x16x16x1_SE_1LDSB1_AF0EM1_GRVW8_GSU1_LBSPP128_PLR2_SU32_SUS256_SRVW4_TT1_16_VAW2_WG32_8_1_WGM2
    SolutionIndex: 341
    SolutionNameMin: Cijk_Alik_Bljk_HBH_MT64x32x64_MI16x16x16x1_SE_1LDSB1_AF0EM1_GRVW8_GSU1_LBSPP128_PLR5_SU0_SUS256_SRVW4_TT2_16_VAW2_WG32_8_1_WGM1
    SolutionIndex: 342
    SolutionNameMin: Cijk_Alik_Bljk_HBH_MT64x64x32_MI32x32x8x1_SE_1LDSB1_AF0EM1_GRVW2_GSU1_LBSPP128_PLR5_SU32_SUS128_SRVW4_TT1_32_VAW2_WG64_4_1_WGM15
    SolutionIndex: 343
    SolutionNameMin: Cijk_Alik_Bljk_HBH_MT64x64x32_MI32x32x8x1_SE_1LDSB1_AF0EM1_GRVW2_GSU1_LBSPP128_PLR5_SU32_SUS256_SRVW4_TT1_32_VAW2_WG64_4_1_WGM1
    SolutionIndex: 344
    SolutionNameMin: Cijk_Alik_Bljk_HBH_MT32x32x32_MI16x16x16x1_SE_1LDSB0_AF0EM1_GRVW2_GSU1_LBSPP128_PLR2_SU0_SUS256_SRVW4_TT1_16_VAW2_WG32_8_1_WGM1
    SolutionIndex: 345
    SolutionNameMin: Cijk_Alik_Bljk_HBH_MT16x16x32_MI16x16x16x1_SE_1LDSB0_AF0EM1_GRVW8_GSU1_LBSPP128_PLR2_SU0_SUS256_SRVW0_TT1_16_VAW2_WG16_4_1_WGM1
    SolutionIndex: 346
    SolutionNameMin: Cijk_Alik_Bljk_HBH_MT64x64x32_MI32x32x8x1_SE_1LDSB1_AF0EM1_GRVW8_GSU1_LBSPP128_PLR5_SU0_SUS256_SRVW4_TT1_32_VAW2_WG64_4_1_WGM1
    SolutionIndex: 347
    SolutionNameMin: Cijk_Alik_Bljk_HBH_MT128x96x64_MI32x32x8x1_SE_1LDSB1_AF0EM1_GRVW8_GSU1_LBSPP128_PLR9_SU0_SUS256_SRVW4_TT1_96_VAW2_WG128_2_1_WGM15
    SolutionIndex: 348
    SolutionNameMin: Cijk_Alik_Bljk_HBH_MT32x32x64_MI16x16x16x1_SE_1LDSB0_AF0EM1_GRVW4_GSU5_LBSPP128_PLR5_SU0_SUS256_SRVW0_TT1_16_VAW1_WG32_8_1_WGM1
    SolutionIndex: 349
    SolutionNameMin: Cijk_Alik_Bljk_HBH_MT256x144x64_MI16x16x16x1_SE_1LDSB1_AF0EM8_GRVW2_LBSPP128_LPA16_LPB16_PLR5_SU32_SUS256_SRVW4_TT4_144_WG64_4_1_WGM2
    SolutionIndex: 350
    SolutionNameMin: Cijk_Alik_Bljk_HBH_MT128x128x32_MI32x32x8x1_SE_1LDSB1_AF0EM8_GRVW8_LBSPP128_LPA8_LPB8_PLR5_SU32_SUS256_SRVW4_TT2_64_WG64_4_1_WGM1
    SolutionIndex: 351
    SolutionNameMin: Cijk_Alik_Bljk_HBH_MT128x128x64_MI32x32x8x1_SE_1LDSB1_AF0EM8_GRVW8_LBSPP128_LPA8_LPB8_PLR9_SU32_SUS256_SRVW0_TT2_64_WG64_4_1_WGM15
    SolutionIndex: 352
    SolutionNameMin: Cijk_Alik_Bljk_HBH_MT144x128x64_MI16x16x16x1_SE_1LDSB1_AF0EM8_GRVW2_LBSPP128_LPA16_LPB16_PLR5_SU0_SUS256_SRVW0_TT9_32_WG16_16_1_WGM1
    SolutionIndex: 353
    SolutionNameMin: Cijk_Alik_Bljk_HBH_MT128x64x32_MI32x32x8x1_SE_1LDSB1_AF0EM8_GRVW8_LBSPP128_LPA8_LPB8_PLR5_SU0_SUS256_SRVW4_TT2_32_WG64_4_1_WGM1
    SolutionIndex: 354
    SolutionNameMin: Cijk_Alik_Bljk_HBH_MT128x256x64_MI32x32x8x1_SE_1LDSB1_AF0EM8_GRVW2_LBSPP128_LPA8_LPB8_PLR9_SU0_SUS256_SRVW0_TT2_128_WG64_4_1_WGM2
    SolutionIndex: 355
    SolutionNameMin: Cijk_Alik_Bljk_HBH_MT160x160x64_MI16x16x16x1_SE_1LDSB1_AF0EM8_GRVW2_LBSPP128_LPA16_LPB16_PLR5_SU0_SUS256_SRVW0_TT5_80_WG32_8_1_WGM1
    SolutionIndex: 356
    SolutionNameMin: Cijk_Alik_Bljk_HBH_MT128x144x64_MI16x16x16x1_SE_1LDSB1_AF0EM8_GRVW2_LBSPP128_LPA16_LPB16_PLR5_SU0_SUS256_SRVW4_TT2_144_WG64_4_1_WGM15
    SolutionIndex: 357
    SolutionNameMin: Cijk_Alik_Bljk_HBH_MT144x256x64_MI16x16x16x1_SE_1LDSB1_AF0EM8_GRVW2_LBSPP128_LPA16_LPB16_PLR5_SU32_SUS256_SRVW0_TT9_64_WG16_16_1_WGM1
    SolutionIndex: 358
    SolutionNameMin: Cijk_Alik_Bljk_HBH_MT160x160x64_MI16x16x16x1_SE_1LDSB1_AF0EM8_GRVW2_LBSPP128_LPA16_LPB16_PLR5_SU0_SUS256_SRVW0_TT5_80_WG32_8_1_WGM2
    SolutionIndex: 359
    SolutionNameMin: Cijk_Alik_Bljk_HBH_MT128x256x32_MI32x32x8x1_SE_1LDSB1_AF0EM8_GRVW8_LBSPP128_LPA8_LPB8_PLR5_SU32_SUS256_SRVW4_TT2_128_WG64_4_1_WGM2
    SolutionIndex: 360
    SolutionNameMin: Cijk_Alik_Bljk_HBH_MT144x256x64_MI16x16x16x1_SE_1LDSB1_AF0EM8_GRVW2_LBSPP128_LPA16_LPB16_PLR5_SU32_SUS256_SRVW0_TT9_64_WG16_16_1_WGM2
    SolutionIndex: 361
    SolutionNameMin: Cijk_Alik_Bljk_HBH_MT64x128x32_MI32x32x8x1_SE_1LDSB1_AF0EM8_GRVW8_LBSPP128_LPA8_LPB8_PLR5_SU0_SUS256_SRVW4_TT1_64_WG64_4_1_WGM1
    SolutionIndex: 362
    SolutionNameMin: Cijk_Alik_Bljk_HBH_MT128x144x32_MI16x16x16x1_SE_1LDSB1_AF0EM8_GRVW2_LBSPP128_LPA16_LPB16_PLR2_SU0_SUS256_SRVW4_TT2_144_WG64_4_1_WGM15
    SolutionIndex: 363
    SolutionNameMin: Cijk_Alik_Bljk_HBH_MT128x160x32_MI32x32x8x1_SE_1LDSB1_AF0EM8_GRVW2_LBSPP128_LPA8_LPB8_PLR5_SU0_SUS256_SRVW4_TT1_160_WG128_2_1_WGM2
    SolutionIndex: 364
    SolutionNameMin: Cijk_Alik_Bljk_HBH_MT128x256x32_MI32x32x8x1_SE_1LDSB1_AF0EM8_GRVW8_LBSPP128_LPA8_LPB8_PLR5_SU0_SUS256_SRVW4_TT2_128_WG64_4_1_WGM1
    SolutionIndex: 365
    SolutionNameMin: Cijk_Alik_Bljk_HBH_MT64x64x64_MI32x32x8x1_SE_1LDSB1_AF0EM8_GRVW4_LBSPP128_LPA8_LPB8_PLR9_SU0_SUS256_SRVW4_TT1_32_WG64_4_1_WGM2
    SolutionIndex: 366
    SolutionNameMin: Cijk_Alik_Bljk_HBH_MT64x128x32_MI32x32x8x1_SE_1LDSB1_AF0EM8_GRVW8_LBSPP128_LPA8_LPB8_PLR5_SU0_SUS256_SRVW4_TT1_64_WG64_4_1_WGM15
    SolutionIndex: 367
    SolutionNameMin: Cijk_Alik_Bljk_HBH_MT128x256x32_MI32x32x8x1_SE_1LDSB1_AF0EM8_GRVW8_LBSPP128_LPA8_LPB8_PLR5_SU32_SUS128_SRVW4_TT2_128_WG64_4_1_WGM15
    SolutionIndex: 368
    SolutionNameMin: Cijk_Alik_Bljk_HBH_MT128x288x64_MI32x32x8x1_SE_1LDSB1_AF0EM8_GRVW4_LBSPP128_LPA8_LPB8_PLR9_SU32_SUS128_SRVW4_TT1_288_WG128_2_1_WGM2
    SolutionIndex: 369
    SolutionNameMin: Cijk_Alik_Bljk_HBH_MT256x144x64_MI16x16x16x1_SE_1LDSB1_AF0EM8_GRVW2_LBSPP128_LPA16_LPB16_PLR5_SU32_SUS256_SRVW4_TT4_144_WG64_4_1_WGM15
    SolutionIndex: 370
    SolutionNameMin: Cijk_Alik_Bljk_HBH_MT128x256x32_MI32x32x8x1_SE_1LDSB1_AF0EM8_GRVW8_LBSPP128_LPA8_LPB8_PLR5_SU0_SUS256_SRVW4_TT2_128_WG64_4_1_WGM2
    SolutionIndex: 371
    SolutionNameMin: Cijk_Alik_Bljk_HBH_MT256x144x64_MI16x16x16x1_SE_1LDSB1_AF0EM8_GRVW2_LBSPP128_LPA16_LPB16_PLR5_SU32_SUS128_SRVW4_TT4_144_WG64_4_1_WGM2
    SolutionIndex: 372
    SolutionNameMin: Cijk_Alik_Bljk_HBH_MT128x288x64_MI32x32x8x1_SE_1LDSB1_AF0EM8_GRVW4_LBSPP128_LPA8_LPB8_PLR9_SU32_SUS128_SRVW4_TT1_288_WG128_2_1_WGM15
    SolutionIndex: 373
    SolutionNameMin: Cijk_Alik_Bljk_HBH_MT256x160x64_MI32x32x8x1_SE_1LDSB1_AF0EM8_GRVW2_LBSPP128_LPA8_LPB8_PLR9_SU0_SUS256_SRVW4_TT2_160_WG128_2_1_WGM1
    SolutionIndex: 374
    SolutionNameMin: Cijk_Alik_Bljk_HBH_MT128x160x32_MI32x32x8x1_SE_1LDSB1_AF0EM8_GRVW4_LBSPP128_LPA8_LPB8_PLR5_SU0_SUS256_SRVW4_TT1_160_WG128_2_1_WGM15
    SolutionIndex: 375
    SolutionNameMin: Cijk_Alik_Bljk_HBH_MT256x160x64_MI32x32x8x1_SE_1LDSB1_AF0EM8_GRVW2_LBSPP128_LPA8_LPB8_PLR9_SU32_SUS128_SRVW4_TT2_160_WG128_2_1_WGM1
    SolutionIndex: 376
    SolutionNameMin: Cijk_Alik_Bljk_HBH_MT256x160x64_MI32x32x8x1_SE_1LDSB1_AF0EM8_GRVW2_LBSPP128_LPA8_LPB8_PLR9_SU0_SUS256_SRVW4_TT2_160_WG128_2_1_WGM2
    SolutionIndex: 377
    SolutionNameMin: Cijk_Alik_Bljk_HBH_MT32x64x32_MI16x16x16x1_SE_1LDSB1_AF0EM8_GRVW4_LBSPP128_LPA16_LPB16_PLR2_SU0_SUS256_SRVW4_TT1_32_WG32_8_1_WGM1
    SolutionIndex: 378
    SolutionNameMin: Cijk_Alik_Bljk_HBH_MT32x64x32_MI16x16x16x1_SE_1LDSB1_AF0EM8_GRVW2_LBSPP128_LPA16_LPB16_PLR2_SU0_SUS256_SRVW4_TT1_32_WG32_8_1_WGM2
    SolutionIndex: 379
    SolutionNameMin: Cijk_Alik_Bljk_HBH_MT128x128x64_MI32x32x8x1_SE_1LDSB1_AF0EM8_GRVW8_LBSPP128_LPA8_LPB8_PLR9_SU0_SUS256_SRVW4_TT2_64_WG64_4_1_WGM2
    SolutionIndex: 380
    SolutionNameMin: Cijk_Alik_Bljk_HBH_MT128x144x64_MI16x16x16x1_SE_1LDSB1_AF0EM8_GRVW2_LBSPP128_LPA16_LPB16_PLR5_SU0_SUS256_SRVW4_TT2_144_WG64_4_1_WGM2
    SolutionIndex: 381
    SolutionNameMin: Cijk_Alik_Bljk_HBH_MT128x160x64_MI32x32x8x1_SE_1LDSB1_AF0EM8_GRVW8_LBSPP128_LPA8_LPB8_PLR9_SU0_SUS256_SRVW4_TT1_160_WG128_2_1_WGM2
    SolutionIndex: 382
    SolutionNameMin: Cijk_Alik_Bljk_HBH_MT128x96x32_MI32x32x8x1_SE_1LDSB0_AF0EM8_GRVW2_LBSPP128_LPA8_LPB8_PLR5_SU0_SUS256_SRVW4_TT1_96_WG128_2_1_WGM15
    SolutionIndex: 383
    SolutionNameMin: Cijk_Alik_Bljk_HBH_MT128x96x32_MI32x32x8x1_SE_1LDSB1_AF0EM8_GRVW4_LBSPP128_LPA8_LPB8_PLR5_SU0_SUS256_SRVW4_TT1_96_WG128_2_1_WGM15
    SolutionIndex: 384
    SolutionNameMin: Cijk_Alik_Bljk_HBH_MT128x256x64_MI32x32x8x1_SE_1LDSB1_AF0EM8_GRVW4_LBSPP128_LPA8_LPB8_PLR9_SU0_SUS256_SRVW4_TT2_128_WG64_4_1_WGM2
    SolutionIndex: 385
    SolutionNameMin: Cijk_Alik_Bljk_HBH_MT128x256x64_MI32x32x8x1_SE_1LDSB1_AF0EM8_GRVW2_LBSPP128_LPA8_LPB8_PLR9_SU0_SUS256_SRVW4_TT2_128_WG64_4_1_WGM2
    SolutionIndex: 386
    SolutionNameMin: Cijk_Alik_Bljk_HBH_MT128x256x64_MI32x32x8x1_SE_1LDSB1_AF0EM8_GRVW2_LBSPP128_LPA8_LPB8_PLR9_SU0_SUS256_SRVW4_TT2_128_WG64_4_1_WGM15
    SolutionIndex: 387
    SolutionNameMin: Cijk_Alik_Bljk_HBH_MT128x288x64_MI32x32x8x1_SE_1LDSB1_AF0EM8_GRVW4_LBSPP128_LPA8_LPB8_PLR9_SU0_SUS256_SRVW4_TT1_288_WG128_2_1_WGM15
    SolutionIndex: 388
    SolutionNameMin: Cijk_Alik_Bljk_HBH_MT128x160x64_MI32x32x8x1_SE_1LDSB1_AF0EM8_GRVW8_LBSPP128_LPA8_LPB8_PLR9_SU32_SUS128_SRVW4_TT1_160_WG128_2_1_WGM15
    SolutionIndex: 389
    SolutionNameMin: Cijk_Alik_Bljk_HBH_MT128x96x64_MI32x32x8x1_SE_1LDSB1_AF0EM8_GRVW4_LBSPP128_LPA8_LPB8_PLR9_SU0_SUS256_SRVW4_TT1_96_WG128_2_1_WGM15
    SolutionIndex: 390
    SolutionNameMin: Cijk_Alik_Bljk_HBH_MT128x128x64_MI32x32x8x1_SE_1LDSB1_AF0EM8_GRVW8_LBSPP128_LPA8_LPB8_PLR9_SU0_SUS256_SRVW4_TT2_64_WG64_4_1_WGM15
    SolutionIndex: 391
    SolutionNameMin: Cijk_Alik_Bljk_HBH_MT128x96x64_MI32x32x8x1_SE_1LDSB1_AF0EM8_GRVW8_LBSPP128_LPA8_LPB8_PLR9_SU0_SUS256_SRVW4_TT1_96_WG128_2_1_WGM2
    SolutionIndex: 392
    SolutionNameMin: Cijk_Alik_Bljk_HBH_MT128x256x32_MI32x32x8x1_SE_1LDSB1_AF0EM8_GRVW8_LBSPP128_LPA8_LPB8_PLR5_SU0_SUS256_SRVW4_TT2_128_WG64_4_1_WGM15
    SolutionIndex: 393
    SolutionNameMin: Cijk_Alik_Bljk_HBH_MT128x128x32_MI32x32x8x1_SE_1LDSB1_AF0EM8_GRVW8_LBSPP128_LPA8_LPB8_PLR5_SU32_SUS256_SRVW4_TT2_64_WG64_4_1_WGM15
    SolutionIndex: 394
    SolutionNameMin: Cijk_Alik_Bljk_HBH_MT128x128x32_MI32x32x8x1_SE_1LDSB1_AF0EM8_GRVW8_LBSPP128_LPA8_LPB8_PLR5_SU32_SUS128_SRVW4_TT2_64_WG64_4_1_WGM2
    SolutionIndex: 395
    SolutionNameMin: Cijk_Alik_Bljk_HBH_MT128x128x32_MI32x32x8x1_SE_1LDSB1_AF0EM8_GRVW8_LBSPP128_LPA8_LPB8_PLR5_SU32_SUS128_SRVW4_TT2_64_WG64_4_1_WGM1
    SolutionIndex: 396
    SolutionNameMin: Cijk_Alik_Bljk_HBH_MT128x128x32_MI32x32x8x1_SE_1LDSB1_AF0EM8_GRVW8_LBSPP128_LPA8_LPB8_PLR5_SU32_SUS128_SRVW4_TT2_64_WG64_4_1_WGM15
    SolutionIndex: 397
    SolutionNameMin: Cijk_Alik_Bljk_HBH_MT128x256x32_MI32x32x8x1_SE_1LDSB1_AF0EM8_GRVW8_LBSPP128_LPA8_LPB8_PLR5_SU32_SUS128_SRVW4_TT2_128_WG64_4_1_WGM2
    SolutionIndex: 398
    SolutionNameMin: Cijk_Alik_Bljk_HBH_MT128x160x64_MI32x32x8x1_SE_1LDSB1_AF0EM8_GRVW4_LBSPP128_LPA8_LPB8_PLR9_SU32_SUS128_SRVW4_TT1_160_WG128_2_1_WGM15
    SolutionIndex: 399
    SolutionNameMin: Cijk_Alik_Bljk_HBH_MT256x256x32_MI32x32x8x1_SE_1LDSB1_AF0EM8_GRVW2_LBSPP128_LPA8_LPB8_PLR5_SU32_SUS256_SRVW4_TT4_128_WG64_4_1_WGM2
    SolutionIndex: 400
    SolutionNameMin: Cijk_Alik_Bljk_HBH_MT64x128x64_MI32x32x8x1_SE_1LDSB1_AF0EM8_GRVW8_LBSPP128_LPA8_LPB8_PLR9_SU0_SUS256_SRVW4_TT1_64_WG64_4_1_WGM1
    SolutionIndex: 401
    SolutionNameMin: Cijk_Alik_Bljk_HBH_MT256x256x32_MI32x32x8x1_SE_1LDSB1_AF0EM8_GRVW2_LBSPP128_LPA8_LPB8_PLR5_SU32_SUS128_SRVW4_TT4_128_WG64_4_1_WGM15
    SolutionIndex: 402
    SolutionNameMin: Cijk_Alik_Bljk_HBH_MT144x256x64_MI16x16x16x1_SE_1LDSB1_AF0EM8_GRVW2_LBSPP128_LPA16_LPB16_PLR5_SU32_SUS128_SRVW0_TT9_64_WG16_16_1_WGM2
    SolutionIndex: 403
    SolutionNameMin: Cijk_Alik_Bljk_HBH_MT128x128x32_MI32x32x8x1_SE_1LDSB1_AF0EM8_GRVW4_LBSPP128_LPA8_LPB8_PLR5_SU0_SUS256_SRVW4_TT2_64_WG64_4_1_WGM15
    SolutionIndex: 404
    SolutionNameMin: Cijk_Alik_Bljk_HBH_MT64x64x64_MI32x32x8x1_SE_1LDSB1_AF0EM8_GRVW8_LBSPP128_LPA8_LPB8_PLR9_SU0_SUS256_SRVW4_TT1_32_WG64_4_1_WGM1
    SolutionIndex: 405
    SolutionNameMin: Cijk_Alik_Bljk_HBH_MT128x256x32_MI32x32x8x1_SE_1LDSB1_AF0EM8_GRVW8_LBSPP128_LPA8_LPB8_PLR5_SU32_SUS128_SRVW4_TT2_128_WG64_4_1_WGM1
    SolutionIndex: 406
    SolutionNameMin: Cijk_Alik_Bljk_HBH_MT256x160x64_MI32x32x8x1_SE_1LDSB1_AF0EM8_GRVW2_LBSPP128_LPA8_LPB8_PLR9_SU0_SUS256_SRVW4_TT2_160_WG128_2_1_WGM15
    SolutionIndex: 407
    SolutionNameMin: Cijk_Alik_Bljk_HBH_MT64x64x64_MI32x32x8x1_SE_1LDSB1_AF0EM8_GRVW8_LBSPP128_LPA8_LPB8_PLR9_SU32_SUS128_SRVW4_TT1_32_WG64_4_1_WGM2
    SolutionIndex: 408
    SolutionNameMin: Cijk_Alik_Bljk_HBH_MT128x256x32_MI32x32x8x1_SE_1LDSB1_AF0EM8_GRVW8_LBSPP128_LPA8_LPB8_PLR5_SU32_SUS256_SRVW4_TT2_128_WG64_4_1_WGM15
    SolutionIndex: 409
    SolutionNameMin: Cijk_Alik_Bljk_HBH_MT128x256x32_MI32x32x8x1_SE_1LDSB1_AF0EM8_GRVW2_LBSPP128_LPA8_LPB8_PLR5_SU32_SUS256_SRVW4_TT2_128_WG64_4_1_WGM2
    SolutionIndex: 410
    SolutionNameMin: Cijk_Alik_Bljk_HBH_MT256x256x32_MI32x32x8x1_SE_1LDSB1_AF0EM8_GRVW2_LBSPP128_LPA8_LPB8_PLR5_SU32_SUS128_SRVW4_TT4_128_WG64_4_1_WGM1
    SolutionIndex: 411
    SolutionNameMin: Cijk_Alik_Bljk_HBH_MT256x256x32_MI32x32x8x1_SE_1LDSB1_AF0EM8_GRVW2_LBSPP128_LPA8_LPB8_PLR5_SU0_SUS256_SRVW4_TT4_128_WG64_4_1_WGM15
    SolutionIndex: 412
    SolutionNameMin: Cijk_Alik_Bljk_HBH_MT128x160x32_MI32x32x8x1_SE_1LDSB1_AF0EM8_GRVW4_LBSPP128_LPA8_LPB8_PLR5_SU0_SUS256_SRVW4_TT1_160_WG128_2_1_WGM2
    SolutionIndex: 413
    SolutionNameMin: Cijk_Alik_Bljk_HBH_MT64x32x64_MI16x16x16x1_SE_1LDSB1_AF0EM8_GRVW8_LBSPP128_LPA16_LPB16_PLR5_SU0_SUS256_SRVW4_TT2_16_WG32_8_1_WGM1
    SolutionIndex: 414
    SolutionNameMin: Cijk_Alik_Bljk_HBH_MT128x64x32_MI32x32x8x1_SE_1LDSB1_AF0EM8_GRVW2_LBSPP128_LPA8_LPB8_PLR5_SU0_SUS256_SRVW4_TT2_32_WG64_4_1_WGM1
    SolutionIndex: 415
    SolutionNameMin: Cijk_Alik_Bljk_HBH_MT32x32x32_MI16x16x16x1_SE_1LDSB0_AF0EM8_GRVW2_LBSPP128_LPA16_LPB16_PLR2_SU0_SUS256_SRVW4_TT1_16_WG32_8_1_WGM15
    SolutionIndex: 416
    SolutionNameMin: Cijk_Alik_Bljk_HBH_MT32x64x32_MI16x16x16x1_SE_1LDSB1_AF0EM8_GRVW2_LBSPP128_LPA16_LPB16_PLR2_SU0_SUS256_SRVW4_TT1_32_WG32_8_1_WGM15
    SolutionIndex: 417
    SolutionNameMin: Cijk_Alik_Bljk_HBH_MT32x32x64_MI16x16x16x1_SE_1LDSB0_AF0EM8_GRVW2_LBSPP128_LPA16_LPB16_PLR5_SU0_SUS256_SRVW4_TT1_16_WG32_8_1_WGM15
    SolutionIndex: 418
    SolutionNameMin: Cijk_Alik_Bljk_HBH_MT32x32x64_MI16x16x16x1_SE_1LDSB0_AF0EM8_GRVW2_LBSPP128_LPA16_LPB16_PLR5_SU32_SUS128_SRVW4_TT1_16_WG32_8_1_WGM2
    SolutionIndex: 419
    SolutionNameMin: Cijk_Alik_Bljk_HBH_MT64x64x32_MI32x32x8x1_SE_1LDSB1_AF0EM8_GRVW2_LBSPP128_LPA8_LPB8_PLR5_SU0_SUS256_SRVW4_TT1_32_WG64_4_1_WGM15
    SolutionIndex: 420
    SolutionNameMin: Cijk_Alik_Bljk_HBH_MT32x32x32_MI16x16x16x1_SE_1LDSB0_AF0EM8_GRVW8_LBSPP128_LPA16_LPB16_PLR2_SU0_SUS256_SRVW4_TT1_16_WG32_8_1_WGM1
    SolutionIndex: 421
    SolutionNameMin: Cijk_Alik_Bljk_HBH_MT32x64x64_MI16x16x16x1_SE_1LDSB0_AF0EM8_GRVW8_LBSPP128_LPA16_LPB16_PLR5_SU0_SUS256_SRVW0_TT1_32_WG32_8_1_WGM1
    SolutionIndex: 422
    SolutionNameMin: Cijk_Alik_Bljk_HBH_MT32x32x64_MI16x16x16x1_SE_1LDSB0_AF0EM8_GRVW2_LBSPP128_LPA16_LPB16_PLR5_SU32_SUS256_SRVW4_TT1_16_WG32_8_1_WGM1
    SolutionIndex: 423
    SolutionNameMin: Cijk_Alik_Bljk_HBH_MT32x32x64_MI16x16x16x1_SE_1LDSB0_AF0EM8_GRVW8_LBSPP128_LPA16_LPB16_PLR5_SU0_SUS256_SRVW0_TT1_16_WG32_8_1_WGM1
    SolutionIndex: 424
    SolutionNameMin: Cijk_Alik_Bljk_HBH_MT64x32x32_MI16x16x16x1_SE_1LDSB0_AF0EM8_GRVW4_LBSPP128_LPA16_LPB16_PLR2_SU0_SUS256_SRVW4_TT2_16_WG32_8_1_WGM1
    SolutionIndex: 425
    SolutionNameMin: Cijk_Alik_Bljk_HBH_MT32x32x64_MI16x16x16x1_SE_1LDSB0_AF0EM8_GRVW8_LBSPP128_LPA16_LPB16_PLR5_SU32_SUS256_SRVW4_TT1_16_WG32_8_1_WGM2
    SolutionIndex: 426
    SolutionNameMin: Cijk_Alik_Bljk_HBH_MT64x64x32_MI32x32x8x1_SE_1LDSB1_AF0EM8_GRVW2_LBSPP128_LPA8_LPB8_PLR5_SU0_SUS256_SRVW4_TT1_32_WG64_4_1_WGM1
    SolutionIndex: 427
    SolutionNameMin: Cijk_Alik_Bljk_HBH_MT32x32x64_MI16x16x16x1_SE_1LDSB0_AF0EM8_GRVW2_LBSPP128_LPA16_LPB16_PLR5_SU32_SUS128_SRVW4_TT1_16_WG32_8_1_WGM15
    SolutionIndex: 428
    SolutionNameMin: Cijk_Alik_Bljk_HBH_MT64x32x64_MI16x16x16x1_SE_1LDSB0_AF0EM8_GRVW8_LBSPP128_LPA16_LPB16_PLR5_SU0_SUS256_SRVW0_TT2_16_WG32_8_1_WGM1
    SolutionIndex: 429
    SolutionNameMin: Cijk_Alik_Bljk_HBH_MT32x32x64_MI16x16x16x1_SE_1LDSB0_AF0EM8_GRVW8_LBSPP128_LPA16_LPB16_PLR5_SU32_SUS128_SRVW0_TT1_16_WG32_8_1_WGM15
    SolutionIndex: 430
    SolutionNameMin: Cijk_Alik_Bljk_HBH_MT144x128x64_MI16x16x16x1_SE_1LDSB1_AF0EM8_GRVW2_LBSPP128_LPA16_LPB16_PLR5_SU0_SUS256_SRVW0_TT9_32_WG16_16_1_WGM1
    SolutionIndex: 431
    SolutionNameMin: Cijk_Alik_Bljk_HBH_MT128x128x64_MI32x32x8x1_SE_1LDSB1_AF0EM8_GRVW8_LBSPP128_LPA8_LPB8_PLR9_SU32_SUS128_SRVW0_TT2_64_WG64_4_1_WGM15
    SolutionIndex: 432
    SolutionNameMin: Cijk_Alik_Bljk_HBH_MT128x128x64_MI32x32x8x1_SE_1LDSB1_AF0EM8_GRVW8_LBSPP128_LPA8_LPB8_PLR9_SU0_SUS256_SRVW0_TT2_64_WG64_4_1_WGM1
    SolutionIndex: 433
    SolutionNameMin: Cijk_Alik_Bljk_HBH_MT128x128x64_MI32x32x8x1_SE_1LDSB1_AF0EM8_GRVW8_LBSPP128_LPA8_LPB8_PLR9_SU32_SUS256_SRVW4_TT2_64_WG64_4_1_WGM2
    SolutionIndex: 434
    SolutionNameMin: Cijk_Alik_Bljk_HBH_MT128x256x64_MI32x32x8x1_SE_1LDSB1_AF0EM8_GRVW2_LBSPP128_LPA8_LPB8_PLR9_SU0_SUS256_SRVW4_TT2_128_WG64_4_1_WGM1
    SolutionIndex: 435
    SolutionNameMin: Cijk_Alik_Bljk_HBH_MT128x128x64_MI32x32x8x1_SE_1LDSB1_AF0EM8_GRVW8_LBSPP128_LPA8_LPB8_PLR9_SU32_SUS128_SRVW4_TT2_64_WG64_4_1_WGM15
    SolutionIndex: 436
    SolutionNameMin: Cijk_Alik_Bljk_HBH_MT256x128x64_MI32x32x8x1_SE_1LDSB1_AF0EM8_GRVW2_LBSPP128_LPA8_LPB8_PLR9_SU0_SUS256_SRVW4_TT4_64_WG64_4_1_WGM1
    SolutionIndex: 437
    SolutionNameMin: Cijk_Alik_Bljk_HBH_MT256x256x32_MI32x32x8x1_SE_1LDSB1_AF0EM8_GRVW2_LBSPP128_LPA8_LPB8_PLR5_SU0_SUS256_SRVW4_TT4_128_WG64_4_1_WGM2
    SolutionIndex: 438
    SolutionNameMin: Cijk_Alik_Bljk_HBH_MT256x256x32_MI32x32x8x1_SE_1LDSB1_AF0EM8_GRVW2_LBSPP128_LPA8_LPB8_PLR5_SU32_SUS128_SRVW4_TT4_128_WG64_4_1_WGM2
    SolutionIndex: 439
    SolutionNameMin: Cijk_Alik_Bljk_HBH_MT64x64x64_MI32x32x8x1_SE_1LDSB1_AF0EM8_GRVW8_LBSPP128_LPA8_LPB8_PLR9_SU0_SUS256_SRVW4_TT1_32_WG64_4_1_WGM15
    SolutionIndex: 440
    SolutionNameMin: Cijk_Alik_Bljk_HBH_MT32x32x64_MI16x16x16x1_SE_1LDSB0_AF0EM8_GRVW8_LBSPP128_LPA16_LPB16_PLR5_SU32_SUS128_SRVW4_TT1_16_WG32_8_1_WGM2
    SolutionIndex: 441
    SolutionNameMin: Cijk_Alik_Bljk_HBH_MT128x128x64_MI32x32x8x1_SE_1LDSB1_AF0EM8_GRVW2_LBSPP128_LPA8_LPB8_PLR9_SU0_SUS256_SRVW0_TT2_64_WG64_4_1_WGM2
    SolutionIndex: 442
    SolutionNameMin: Cijk_Alik_Bljk_HBH_MT128x144x64_MI16x16x16x1_SE_1LDSB1_AF0EM8_GRVW2_LBSPP128_LPA16_LPB16_PLR5_SU0_SUS256_SRVW0_TT2_144_WG64_4_1_WGM1
    SolutionIndex: 443
    SolutionNameMin: Cijk_Alik_Bljk_HBH_MT128x128x64_MI32x32x8x1_SE_1LDSB1_AF0EM8_GRVW8_LBSPP128_LPA8_LPB8_PLR9_SU32_SUS256_SRVW4_TT2_64_WG64_4_1_WGM1
    SolutionIndex: 444
    SolutionNameMin: Cijk_Alik_Bljk_HBH_MT128x64x64_MI32x32x8x1_SE_1LDSB1_AF0EM8_GRVW8_LBSPP128_LPA8_LPB8_PLR9_SU0_SUS256_SRVW0_TT2_32_WG64_4_1_WGM1
    SolutionIndex: 445
    SolutionNameMin: Cijk_Alik_Bljk_HBH_MT144x128x64_MI16x16x16x1_SE_1LDSB1_AF0EM8_GRVW2_LBSPP128_LPA16_LPB16_PLR5_SU0_SUS256_SRVW0_TT9_32_WG16_16_1_WGM2
    SolutionIndex: 446
    SolutionNameMin: Cijk_Alik_Bljk_HBH_MT256x128x64_MI32x32x8x1_SE_1LDSB1_AF0EM8_GRVW2_LBSPP128_LPA8_LPB8_PLR9_SU0_SUS256_SRVW4_TT4_64_WG64_4_1_WGM15
    SolutionIndex: 447
    SolutionNameMin: Cijk_Alik_Bljk_HBH_MT256x128x64_MI32x32x8x1_SE_1LDSB1_AF0EM8_GRVW4_LBSPP128_LPA8_LPB8_PLR9_SU32_SUS256_SRVW4_TT4_64_WG64_4_1_WGM1
    SolutionIndex: 448
    SolutionNameMin: Cijk_Alik_Bljk_HBH_MT128x128x64_MI32x32x8x1_SE_1LDSB1_AF0EM8_GRVW4_LBSPP128_LPA8_LPB8_PLR9_SU0_SUS256_SRVW4_TT2_64_WG64_4_1_WGM1
    SolutionIndex: 449
    SolutionNameMin: Cijk_Alik_Bljk_HBH_MT128x96x64_MI32x32x8x1_SE_1LDSB1_AF0EM8_GRVW4_LBSPP128_LPA8_LPB8_PLR9_SU0_SUS256_SRVW4_TT1_96_WG128_2_1_WGM2
    SolutionIndex: 450
    SolutionNameMin: Cijk_Alik_Bljk_HBH_MT256x128x64_MI32x32x8x1_SE_1LDSB1_AF0EM8_GRVW2_LBSPP128_LPA8_LPB8_PLR9_SU32_SUS256_SRVW4_TT4_64_WG64_4_1_WGM2
    SolutionIndex: 451
    SolutionNameMin: Cijk_Alik_Bljk_HBH_MT128x128x32_MI32x32x8x1_SE_1LDSB1_AF0EM8_GRVW4_LBSPP128_LPA8_LPB8_PLR5_SU0_SUS256_SRVW4_TT2_64_WG64_4_1_WGM2
    SolutionIndex: 452
    SolutionNameMin: Cijk_Alik_Bljk_HBH_MT64x32x64_MI16x16x16x1_SE_1LDSB1_AF0EM8_GRVW2_LBSPP128_LPA16_LPB16_PLR5_SU0_SUS256_SRVW0_TT2_16_WG32_8_1_WGM1
    SolutionIndex: 453
    SolutionNameMin: Cijk_Alik_Bljk_HBH_MT64x128x64_MI32x32x8x1_SE_1LDSB0_AF0EM8_GRVW2_LBSPP128_LPA8_LPB8_PLR9_SU0_SUS256_SRVW0_TT1_64_WG64_4_1_WGM2
    SolutionIndex: 454
    SolutionNameMin: Cijk_Alik_Bljk_HBH_MT64x64x64_MI32x32x8x1_SE_1LDSB1_AF0EM8_GRVW8_LBSPP128_LPA8_LPB8_PLR9_SU0_SUS256_SRVW0_TT1_32_WG64_4_1_WGM15
    SolutionIndex: 455
    SolutionNameMin: Cijk_Alik_Bljk_HBH_MT128x128x32_MI32x32x8x1_SE_1LDSB1_AF0EM8_GRVW8_LBSPP128_LPA8_LPB8_PLR5_SU0_SUS256_SRVW4_TT2_64_WG64_4_1_WGM1
    SolutionIndex: 456
    SolutionNameMin: Cijk_Alik_Bljk_HBH_MT64x128x64_MI32x32x8x1_SE_1LDSB1_AF0EM8_GRVW8_LBSPP128_LPA8_LPB8_PLR9_SU32_SUS128_SRVW4_TT1_64_WG64_4_1_WGM2
    SolutionIndex: 457
    SolutionNameMin: Cijk_Alik_Bljk_HBH_MT128x128x64_MI32x32x8x1_SE_1LDSB1_AF0EM8_GRVW8_LBSPP128_LPA8_LPB8_PLR9_SU32_SUS128_SRVW4_TT2_64_WG64_4_1_WGM1
    SolutionIndex: 458
    SolutionNameMin: Cijk_Alik_Bljk_HBH_MT16x16x128_MI16x16x16x1_SE_1LDSB0_AF0EM8_GRVW8_LBSPP256_LPA16_LPB16_PLR9_SU0_SUS256_SRVW0_TT1_16_WG16_4_1_WGM2
    SolutionIndex: 459
    SolutionNameMin: Cijk_Alik_Bljk_HBH_MT128x96x32_MI32x32x8x1_SE_1LDSB1_AF0EM8_GRVW4_LBSPP128_LPA8_LPB8_PLR5_SU32_SUS128_SRVW4_TT1_96_WG128_2_1_WGM1
    SolutionIndex: 460
    SolutionNameMin: Cijk_Alik_Bljk_HBH_MT64x128x64_MI32x32x8x1_SE_1LDSB1_AF0EM8_GRVW8_LBSPP128_LPA8_LPB8_PLR9_SU32_SUS256_SRVW4_TT1_64_WG64_4_1_WGM1
    SolutionIndex: 461
    SolutionNameMin: Cijk_Alik_Bljk_HBH_MT16x16x128_MI16x16x16x1_SE_1LDSB1_AF0EM8_GRVW8_LBSPP256_LPA16_LPB16_PLR9_SU0_SUS256_SRVW0_TT1_16_WG16_4_1_WGM1
    SolutionIndex: 462
    SolutionNameMin: Cijk_Alik_Bljk_HBH_MT64x128x64_MI32x32x8x1_SE_1LDSB1_AF0EM8_GRVW8_LBSPP128_LPA8_LPB8_PLR9_SU0_SUS256_SRVW4_TT1_64_WG64_4_1_WGM2
    SolutionIndex: 463
    SolutionNameMin: Cijk_Alik_Bljk_HBH_MT16x16x128_MI16x16x16x1_SE_1LDSB0_AF0EM8_GRVW8_LBSPP256_LPA16_LPB16_PLR9_SU0_SUS256_SRVW0_TT1_16_WG16_4_1_WGM1
    SolutionIndex: 464
    SolutionNameMin: Cijk_Alik_Bljk_HBH_MT128x96x32_MI32x32x8x1_SE_1LDSB1_AF0EM8_GRVW2_LBSPP128_LPA8_LPB8_PLR5_SU0_SUS256_SRVW4_TT1_96_WG128_2_1_WGM2
    SolutionIndex: 465
    SolutionNameMin: Cijk_Alik_Bljk_HBH_MT64x128x64_MI32x32x8x1_SE_1LDSB1_AF0EM8_GRVW8_LBSPP128_LPA8_LPB8_PLR9_SU32_SUS128_SRVW4_TT1_64_WG64_4_1_WGM1
    SolutionIndex: 466
    SolutionNameMin: Cijk_Alik_Bljk_HBH_MT256x160x64_MI32x32x8x1_SE_1LDSB1_AF0EM8_GRVW2_LBSPP128_LPA8_LPB8_PLR9_SU32_SUS128_SRVW4_TT2_160_WG128_2_1_WGM2
    SolutionIndex: 467
    SolutionNameMin: Cijk_Alik_Bljk_HBH_MT160x128x64_MI32x32x8x1_SE_1LDSB1_AF0EM8_GRVW2_LBSPP128_LPA8_LPB8_PLR9_SU32_SUS256_SRVW0_TT5_32_WG32_8_1_WGM2
    SolutionIndex: 468
    SolutionNameMin: Cijk_Alik_Bljk_HBH_MT64x64x64_MI32x32x8x1_SE_1LDSB1_AF0EM8_GRVW4_LBSPP128_LPA8_LPB8_PLR9_SU0_SUS256_SRVW4_TT1_32_WG64_4_1_WGM15
    SolutionIndex: 469
    SolutionNameMin: Cijk_Alik_Bljk_HBH_MT128x96x64_MI32x32x8x1_SE_1LDSB0_AF0EM8_GRVW2_LBSPP128_LPA8_LPB8_PLR9_SU0_SUS256_SRVW4_TT1_96_WG128_2_1_WGM2
    SolutionIndex: 470
    SolutionNameMin: Cijk_Alik_Bljk_HBH_MT128x128x64_MI32x32x8x1_SE_1LDSB1_AF0EM8_GRVW8_LBSPP128_LPA8_LPB8_PLR9_SU32_SUS256_SRVW4_TT2_64_WG64_4_1_WGM15
    SolutionIndex: 471
    SolutionNameMin: Cijk_Alik_Bljk_HBH_MT128x160x64_MI32x32x8x1_SE_1LDSB1_AF0EM8_GRVW2_LBSPP128_LPA8_LPB8_PLR9_SU0_SUS256_SRVW4_TT1_160_WG128_2_1_WGM15
    SolutionIndex: 472
    SolutionNameMin: Cijk_Alik_Bljk_HBH_MT256x144x64_MI16x16x16x1_SE_1LDSB1_AF0EM8_GRVW2_LBSPP128_LPA16_LPB16_PLR5_SU0_SUS256_SRVW4_TT4_144_WG64_4_1_WGM2
    SolutionIndex: 473
    SolutionNameMin: Cijk_Alik_Bljk_HBH_MT32x32x64_MI16x16x16x1_SE_1LDSB0_AF0EM8_GRVW4_LBSPP128_LPA16_LPB16_PLR5_SU0_SUS256_SRVW4_TT1_16_WG32_8_1_WGM15
    SolutionIndex: 474
    SolutionNameMin: Cijk_Alik_Bljk_HBH_MT32x32x32_MI16x16x16x1_SE_1LDSB0_AF0EM1_GRVW2_LBSPP128_LPA16_LPB16_PLR2_SU0_SUS256_SRVW4_TT1_16_WG32_8_1_WGM1
    SolutionIndex: 475
    SolutionNameMin: Cijk_Alik_Bljk_HBH_MT128x96x64_MI32x32x8x1_SE_1LDSB1_AF0EM1_GRVW8_LBSPP128_LPA8_LPB8_PLR9_SU32_SUS128_SRVW4_TT1_96_WG128_2_1_WGM2
    SolutionIndex: 476
    SolutionNameMin: Cijk_Alik_Bljk_HBH_MT256x160x64_MI32x32x8x1_SE_1LDSB1_AF0EM1_GRVW4_LBSPP128_LPA8_LPB8_PLR9_SU0_SUS256_SRVW4_TT2_160_WG128_2_1_WGM15
    SolutionIndex: 477
    SolutionNameMin: Cijk_Alik_Bljk_HBH_MT128x256x32_MI32x32x8x1_SE_1LDSB1_AF0EM1_GRVW8_LBSPP128_LPA8_LPB8_PLR5_SU32_SUS128_SRVW4_TT2_128_WG64_4_1_WGM15
    SolutionIndex: 478
    SolutionNameMin: Cijk_Alik_Bljk_HBH_MT32x32x64_MI16x16x16x1_SE_1LDSB0_AF0EM1_GRVW4_LBSPP128_LPA16_LPB16_PLR5_SU0_SUS256_SRVW4_TT1_16_WG32_8_1_WGM1
    SolutionIndex: 479
    SolutionNameMin: Cijk_Alik_Bljk_HBH_MT256x160x64_MI32x32x8x1_SE_1LDSB1_AF0EM1_GRVW2_LBSPP128_LPA8_LPB8_PLR9_SU0_SUS256_SRVW4_TT2_160_WG128_2_1_WGM1
    SolutionIndex: 480
    SolutionNameMin: Cijk_Alik_Bljk_HBH_MT256x160x64_MI32x32x8x1_SE_1LDSB1_AF0EM1_GRVW2_LBSPP128_LPA8_LPB8_PLR9_SU32_SUS256_SRVW4_TT2_160_WG128_2_1_WGM15
    SolutionIndex: 481
    SolutionNameMin: Cijk_Alik_Bljk_HBH_MT32x32x32_MI16x16x16x1_SE_1LDSB1_AF0EM1_GRVW8_LBSPP128_LPA16_LPB16_PLR2_SU0_SUS256_SRVW4_TT1_16_WG32_8_1_WGM1
    SolutionIndex: 482
    SolutionNameMin: Cijk_Alik_Bljk_HBH_MT32x32x32_MI16x16x16x1_SE_1LDSB1_AF0EM1_GRVW4_LBSPP128_LPA16_LPB16_PLR2_SU0_SUS256_SRVW4_TT1_16_WG32_8_1_WGM2
    SolutionIndex: 483
    SolutionNameMin: Cijk_Alik_Bljk_HBH_MT64x32x64_MI16x16x16x1_SE_1LDSB1_AF0EM1_GRVW2_LBSPP128_LPA16_LPB16_PLR5_SU0_SUS256_SRVW4_TT2_16_WG32_8_1_WGM1
    SolutionIndex: 484
    SolutionNameMin: Cijk_Alik_Bljk_HBH_MT32x32x64_MI16x16x16x1_SE_1LDSB0_AF0EM1_GRVW2_LBSPP128_LPA16_LPB16_PLR5_SU0_SUS256_SRVW0_TT1_16_WG32_8_1_WGM1
    SolutionIndex: 485
    SolutionNameMin: Cijk_Alik_Bljk_HBH_MT64x32x64_MI16x16x16x1_SE_1LDSB1_AF0EM1_GRVW8_LBSPP128_LPA16_LPB16_PLR5_SU0_SUS256_SRVW4_TT2_16_WG32_8_1_WGM1
    SolutionIndex: 486
    SolutionNameMin: Cijk_Alik_Bljk_HBH_MT32x32x64_MI16x16x16x1_SE_1LDSB0_AF0EM1_GRVW8_LBSPP128_LPA16_LPB16_PLR5_SU32_SUS256_SRVW0_TT1_16_WG32_8_1_WGM2
    SolutionIndex: 487
    SolutionNameMin: Cijk_Alik_Bljk_HBH_MT16x16x128_MI16x16x16x1_SE_1LDSB1_AF0EM1_GRVW8_LBSPP256_LPA16_LPB16_PLR9_SU0_SUS256_SRVW0_TT1_16_WG16_4_1_WGM1
    SolutionIndex: 488
    SolutionNameMin: Cijk_Alik_Bljk_HBH_MT16x16x128_MI16x16x16x1_SE_1LDSB1_AF0EM1_GRVW8_LBSPP256_LPA16_LPB16_PLR9_SU0_SUS256_SRVW0_TT1_16_WG16_4_1_WGM2
    SolutionIndex: 489
    SolutionNameMin: Cijk_Alik_Bljk_HBH_MT16x16x128_MI16x16x16x1_SE_1LDSB0_AF0EM1_GRVW8_LBSPP256_LPA16_LPB16_PLR9_SU0_SUS256_SRVW0_TT1_16_WG16_4_1_WGM15
- - - [2368, 1024, 1, 1]
    - [37, 0.102]
  - - [448, 1, 1, 256]
    - [52, 0.002]
  - - [5056, 1408, 1, 3328]
    - [21, 7.272]
  - - [5056, 1856, 1, 3328]
    - [19, 7.471]
  - - [5888, 128, 1, 1]
    - [41, 0.047]
  - - [448, 3584, 1, 3328]
    - [19, 6.164]
  - - [704, 64, 1, 3328]
    - [13, 1.486]
  - - [5056, 4288, 1, 32]
    - [22, 2.75]
  - - [3584, 1024, 1, 256]
    - [19, 6.864]
  - - [32, 5056, 1, 1280]
    - [35, 0.886]
  - - [1856, 256, 1, 1]
    - [37, 0.031]
  - - [256, 1856, 1, 32]
    - [30, 0.697]
  - - [1408, 3584, 1, 3328]
    - [19, 7.263]
  - - [128, 3584, 1, 1280]
    - [15, 4.85]
  - - [1024, 2368, 1, 3328]
    - [19, 6.724]
  - - [4288, 64, 1, 3328]
    - [13, 3.36]
  - - [1, 4288, 1, 1280]
    - [52, 0.021]
  - - [2368, 64, 1, 1]
    - [50, 0.009]
  - - [256, 128, 1, 256]
    - [3, 0.707]
  - - [448, 64, 1, 1]
    - [45, 0.002]
  - - [32, 1408, 1, 32]
    - [24, 0.071]
  - - [448, 3584, 1, 32]
    - [30, 1.507]
  - - [64, 1024, 1, 1280]
    - [13, 1.934]
  - - [1, 1408, 1, 3328]
    - [53, 0.01]
  - - [1408, 128, 1, 32]
    - [24, 0.257]
  - - [4288, 6784, 1, 3328]
    - [19, 7.768]
  - - [1024, 1, 1, 3328]
    - [53, 0.008]
  - - [2944, 128, 1, 32]
    - [31, 0.623]
  - - [64, 6784, 1, 1]
    - [37, 0.03]
  - - [1024, 64, 1, 1280]
    - [13, 1.924]
  - - [448, 128, 1, 256]
    - [3, 1.126]
  - - [64, 5056, 1, 3328]
    - [10, 3.642]
  - - [5888, 4288, 1, 3328]
    - [19, 7.564]
  - - [1, 2368, 1, 1280]
    - [53, 0.016]
  - - [704, 1024, 1, 1]
    - [42, 0.046]
  - - [2368, 1408, 1, 32]
    - [22, 2.021]
  - - [256, 1856, 1, 1280]
    - [15, 5.01]
  - - [1024, 2944, 1, 1]
    - [37, 0.113]
  - - [2944, 3584, 1, 3328]
    - [19, 7.548]
  - - [2368, 2944, 1, 1280]
    - [19, 7.448]
  - - [256, 1408, 1, 1]
    - [37, 0.024]
  - - [1, 1024, 1, 3328]
    - [53, 0.008]
  - - [6784, 5888, 1, 3328]
    - [17, 7.545]
  - - [3584, 1408, 1, 32]
    - [22, 2.279]
  - - [5056, 256, 1, 256]
    - [19, 5.818]
  - - [1856, 2368, 1, 256]
    - [19, 6.886]
  - - [2368, 1024, 1, 3328]
    - [19, 6.712]
  - - [3584, 4288, 1, 32]
    - [22, 2.651]
  - - [1024, 1024, 1, 1280]
    - [21, 6.386]
  - - [3584, 3584, 1, 1]
    - [41, 0.176]
  - - [32, 2944, 1, 3328]
    - [35, 0.791]
  - - [704, 1408, 1, 3328]
    - [16, 6.156]
  - - [1408, 704, 1, 256]
    - [19, 5.447]
  - - [704, 64, 1, 32]
    - [24, 0.067]
  - - [5888, 1, 1, 3328]
    - [52, 0.03]
  - - [2368, 32, 1, 256]
    - [31, 0.396]
  - - [6784, 128, 1, 3328]
    - [5, 5.435]
  - - [2944, 256, 1, 1]
    - [46, 0.041]
  - - [1408, 2368, 1, 1]
    - [42, 0.118]
  - - [32, 448, 1, 3328]
    - [35, 0.123]
  - - [5056, 1, 1, 3328]
    - [52, 0.026]
  - - [2944, 256, 1, 32]
    - [24, 1.012]
  - - [5056, 6784, 1, 1280]
    - [19, 7.582]
  - - [4288, 5056, 1, 1]
    - [37, 0.182]
  - - [5056, 4288, 1, 1]
    - [37, 0.182]
  - - [128, 4288, 1, 3328]
    - [15, 4.336]
  - - [5056, 128, 1, 256]
    - [10, 4.405]
  - - [1408, 4288, 1, 1280]
    - [19, 7.244]
  - - [1856, 704, 1, 1280]
    - [19, 6.59]
  - - [4288, 1024, 1, 3328]
    - [19, 7.366]
  - - [1, 5888, 1, 3328]
    - [52, 0.03]
  - - [1024, 128, 1, 32]
    - [24, 0.199]
  - - [32, 4288, 1, 1280]
    - [35, 0.741]
  - - [1024, 5056, 1, 1]
    - [37, 0.141]
  - - [704, 3584, 1, 1280]
    - [19, 6.891]
  - - [1856, 5056, 1, 256]
    - [19, 7.219]
  - - [1408, 1024, 1, 1280]
    - [19, 6.242]
  - - [5056, 5888, 1, 3328]
    - [18, 7.437]
  - - [448, 1, 1, 1]
    - [45, 0.0]
  - - [3584, 3584, 1, 1280]
    - [19, 7.649]
  - - [2368, 3584, 1, 32]
    - [22, 2.516]
  - - [2944, 2368, 1, 1]
    - [37, 0.153]
  - - [704, 4288, 1, 1]
    - [37, 0.113]
  - - [2368, 256, 1, 32]
    - [26, 0.886]
  - - [1024, 6784, 1, 1280]
    - [19, 7.419]
  - - [1024, 3584, 1, 1]
    - [43, 0.124]
  - - [32, 5056, 1, 32]
    - [26, 0.285]
  - - [5888, 32, 1, 32]
    - [24, 0.332]
  - - [64, 128, 1, 3328]
    - [11, 0.271]
  - - [256, 5056, 1, 32]
    - [30, 1.379]
  - - [5056, 64, 1, 32]
    - [31, 0.58]
  - - [2368, 5056, 1, 32]
    - [22, 2.568]
  - - [6784, 1856, 1, 32]
    - [22, 2.572]
  - - [64, 128, 1, 1]
    - [37, 0.001]
  - - [64, 2368, 1, 1280]
    - [11, 3.061]
  - - [128, 704, 1, 32]
    - [24, 0.134]
  - - [64, 6784, 1, 3328]
    - [12, 4.778]
  - - [2944, 256, 1, 1280]
    - [19, 5.791]
  - - [5056, 704, 1, 1]
    - [37, 0.122]
  - - [2944, 4288, 1, 256]
    - [19, 7.225]
  - - [1024, 1024, 1, 3328]
    - [21, 6.513]
  - - [5056, 704, 1, 32]
    - [26, 1.992]
  - - [1856, 4288, 1, 3328]
    - [19, 7.488]
  - - [1, 1856, 1, 256]
    - [52, 0.009]
  - - [6784, 4288, 1, 32]
    - [22, 2.783]
  - - [5888, 64, 1, 256]
    - [5, 3.42]
  - - [256, 128, 1, 1]
    - [49, 0.002]
  - - [5888, 5056, 1, 256]
    - [19, 7.275]
  - - [2944, 448, 1, 256]
    - [19, 5.249]
  - - [3584, 2368, 1, 3328]
    - [19, 7.502]
  - - [4288, 1856, 1, 1]
    - [42, 0.158]
  - - [1856, 2944, 1, 1]
    - [37, 0.141]
  - - [32, 4288, 1, 3328]
    - [35, 0.772]
  - - [1, 3584, 1, 3328]
    - [53, 0.027]
  - - [256, 32, 1, 3328]
    - [35, 0.072]
  - - [1856, 2368, 1, 32]
    - [22, 2.161]
  - - [4288, 1856, 1, 32]
    - [22, 2.437]
  - - [5056, 64, 1, 3328]
    - [5, 3.647]
  - - [6784, 1, 1, 1280]
    - [52, 0.033]
  - - [1024, 448, 1, 32]
    - [24, 0.719]
  - - [1408, 64, 1, 1]
    - [44, 0.006]
  - - [1, 1, 1, 3328]
    - [53, 0.0]
  - - [5056, 2368, 1, 256]
    - [19, 7.139]
  - - [1408, 5888, 1, 256]
    - [21, 7.147]
  - - [5056, 6784, 1, 1]
    - [42, 0.192]
  - - [32, 448, 1, 1280]
    - [35, 0.111]
  - - [32, 448, 1, 32]
    - [30, 0.022]
  - - [1856, 64, 1, 256]
    - [7, 1.976]
  - - [1024, 1408, 1, 3328]
    - [19, 6.331]
  - - [256, 5056, 1, 1280]
    - [19, 6.523]
  - - [704, 2368, 1, 1]
    - [39, 0.083]
  - - [64, 1024, 1, 32]
    - [24, 0.099]
  - - [1024, 256, 1, 256]
    - [8, 3.204]
  - - [128, 1, 1, 1]
    - [53, 0.0]
  - - [3584, 4288, 1, 1280]
    - [19, 7.632]
  - - [1856, 128, 1, 32]
    - [31, 0.404]
  - - [1856, 128, 1, 1280]
    - [15, 3.952]
  - - [128, 2944, 1, 3328]
    - [10, 4.226]
  - - [1, 6784, 1, 3328]
    - [52, 0.034]
  - - [3584, 2368, 1, 1]
    - [43, 0.16]
  - - [4288, 448, 1, 3328]
    - [19, 6.515]
  - - [4288, 32, 1, 3328]
    - [35, 0.773]
  - - [256, 1856, 1, 1]
    - [39, 0.031]
  - - [704, 6784, 1, 1280]
    - [19, 7.158]
  - - [2368, 4288, 1, 32]
    - [22, 2.511]
  - - [704, 5056, 1, 1280]
    - [19, 7.117]
  - - [256, 3584, 1, 3328]
    - [21, 5.701]
  - - [1024, 32, 1, 3328]
    - [35, 0.279]
  - - [3584, 6784, 1, 32]
    - [22, 2.779]
  - - [3584, 6784, 1, 1280]
    - [19, 7.702]
  - - [4288, 4288, 1, 3328]
    - [19, 7.649]
  - - [3584, 64, 1, 1280]
    - [15, 3.795]
  - - [64, 1856, 1, 256]
    - [3, 2.018]
  - - [3584, 64, 1, 32]
    - [31, 0.404]
  - - [448, 1, 1, 1280]
    - [53, 0.003]
  - - [256, 4288, 1, 1280]
    - [19, 5.562]
  - - [1408, 3584, 1, 1]
    - [36, 0.139]
  - - [4288, 1856, 1, 3328]
    - [19, 7.475]
  - - [1856, 2944, 1, 1280]
    - [19, 7.428]
  - - [4288, 256, 1, 256]
    - [19, 5.038]
  - - [128, 5888, 1, 32]
    - [30, 0.999]
  - - [128, 5888, 1, 1280]
    - [19, 5.769]
  - - [1408, 128, 1, 3328]
    - [13, 3.517]
  - - [3584, 256, 1, 256]
    - [19, 5.053]
  - - [32, 6784, 1, 3328]
    - [35, 1.213]
  - - [64, 64, 1, 1280]
    - [11, 0.122]
  - - [32, 3584, 1, 256]
    - [35, 0.685]
  - - [704, 256, 1, 32]
    - [24, 0.255]
  - - [448, 128, 1, 3328]
    - [11, 1.853]
  - - [64, 2944, 1, 3328]
    - [13, 3.707]
  - - [64, 4288, 1, 3328]
    - [2, 3.343]
  - - [5056, 1024, 1, 3328]
    - [21, 7.331]
  - - [128, 256, 1, 1280]
    - [11, 1.028]
  - - [1856, 256, 1, 256]
    - [8, 4.124]
  - - [3584, 704, 1, 1]
    - [42, 0.104]
  - - [256, 704, 1, 256]
    - [8, 2.385]
  - - [448, 5056, 1, 1]
    - [42, 0.099]
  - - [5888, 5888, 1, 256]
    - [19, 7.279]
  - - [3584, 704, 1, 32]
    - [30, 1.812]
  - - [448, 6784, 1, 3328]
    - [19, 7.097]
  - - [6784, 4288, 1, 1]
    - [38, 0.187]
  - - [3584, 6784, 1, 1]
    - [36, 0.189]
  - - [1408, 2368, 1, 32]
    - [22, 1.989]
  - - [448, 5056, 1, 32]
    - [26, 1.735]
  - - [4288, 4288, 1, 1280]
    - [19, 7.612]
  - - [6784, 1408, 1, 1]
    - [36, 0.166]
  - - [1856, 5888, 1, 3328]
    - [19, 7.639]
  - - [1024, 704, 1, 1]
    - [39, 0.046]
  - - [3584, 1856, 1, 3328]
    - [19, 7.41]
  - - [5056, 5888, 1, 1]
    - [37, 0.189]
  - - [2944, 1024, 1, 256]
    - [19, 6.542]
  - - [448, 1408, 1, 3328]
    - [19, 4.955]
  - - [5056, 32, 1, 3328]
    - [35, 0.912]
  - - [2368, 4288, 1, 3328]
    - [19, 7.628]
  - - [1024, 704, 1, 32]
    - [31, 0.977]
  - - [448, 2944, 1, 256]
    - [19, 5.223]
  - - [2944, 6784, 1, 256]
    - [19, 7.323]
  - - [2368, 2368, 1, 1280]
    - [19, 7.299]
  - - [5888, 128, 1, 3328]
    - [19, 5.845]
  - - [256, 256, 1, 32]
    - [24, 0.096]
  - - [1024, 1, 1, 256]
    - [52, 0.005]
  - - [3584, 3584, 1, 32]
    - [22, 2.64]
  - - [2944, 448, 1, 1]
    - [52, 0.066]
  - - [128, 32, 1, 32]
    - [24, 0.006]
  - - [5056, 64, 1, 1280]
    - [5, 3.527]
  - - [2944, 2944, 1, 1280]
    - [19, 7.406]
  - - [1, 2368, 1, 256]
    - [52, 0.011]
  - - [1408, 5056, 1, 1]
    - [36, 0.154]
  - - [2944, 32, 1, 1280]
    - [35, 0.74]
  - - [64, 1408, 1, 3328]
    - [11, 2.587]
  - - [256, 448, 1, 1280]
    - [11, 2.886]
  - - [2368, 6784, 1, 1]
    - [37, 0.165]
  - - [6784, 4288, 1, 1280]
    - [19, 7.576]
  - - [2944, 704, 1, 256]
    - [19, 6.382]
  - - [2368, 6784, 1, 1280]
    - [19, 7.605]
  - - [704, 2944, 1, 3328]
    - [9, 7.032]
  - - [5888, 256, 1, 1]
    - [37, 0.078]
  - - [704, 704, 1, 32]
    - [26, 0.742]
  - - [256, 4288, 1, 256]
    - [19, 5.107]
  - - [5056, 6784, 1, 32]
    - [22, 2.819]
  - - [5056, 128, 1, 1]
    - [37, 0.043]
  - - [448, 5056, 1, 1280]
    - [19, 6.807]
  - - [448, 448, 1, 256]
    - [8, 2.657]
  - - [256, 5888, 1, 3328]
    - [19, 6.606]
  - - [704, 448, 1, 1280]
    - [8, 3.388]
  - - [448, 64, 1, 256]
    - [3, 0.613]
  - - [1024, 704, 1, 1280]
    - [19, 5.514]
  - - [5888, 1024, 1, 1]
    - [41, 0.147]
  - - [5888, 448, 1, 32]
    - [30, 1.771]
  - - [6784, 2944, 1, 256]
    - [19, 7.204]
  - - [1024, 256, 1, 1]
    - [37, 0.018]
  - - [2368, 448, 1, 256]
    - [19, 4.85]
  - - [4288, 256, 1, 3328]
    - [19, 5.651]
  - - [4288, 2944, 1, 256]
    - [19, 7.196]
  - - [448, 5888, 1, 3328]
    - [19, 6.696]
  - - [128, 256, 1, 3328]
    - [11, 1.097]
  - - [128, 6784, 1, 32]
    - [26, 1.107]
  - - [1856, 64, 1, 32]
    - [24, 0.18]
  - - [1408, 4288, 1, 1]
    - [36, 0.147]
  - - [1408, 1856, 1, 3328]
    - [19, 7.226]
  - - [4288, 64, 1, 256]
    - [13, 2.599]
  - - [3584, 1024, 1, 3328]
    - [19, 7.407]
  - - [2944, 5888, 1, 3328]
    - [19, 7.648]
  - - [128, 6784, 1, 3328]
    - [5, 5.467]
  - - [448, 4288, 1, 3328]
    - [19, 6.524]
  - - [704, 2368, 1, 256]
    - [19, 5.788]
  - - [1, 64, 1, 3328]
    - [53, 0.0]
  - - [4288, 128, 1, 1]
    - [37, 0.037]
  - - [256, 2368, 1, 32]
    - [31, 0.886]
  - - [4288, 3584, 1, 3328]
    - [19, 7.675]
  - - [1408, 64, 1, 256]
    - [2, 1.564]
  - - [1408, 1024, 1, 1]
    - [36, 0.075]
  - - [64, 1024, 1, 1]
    - [44, 0.004]
  - - [1408, 1024, 1, 256]
    - [19, 5.719]
  - - [5056, 3584, 1, 1]
    - [42, 0.174]
  - - [448, 1024, 1, 256]
    - [19, 4.041]
  - - [6784, 6784, 1, 3328]
    - [21, 7.612]
  - - [6784, 32, 1, 32]
    - [30, 0.363]
  - - [64, 1024, 1, 3328]
    - [11, 2.06]
  - - [2368, 2944, 1, 3328]
    - [19, 7.494]
  - - [448, 448, 1, 1280]
    - [15, 3.325]
  - - [5056, 3584, 1, 32]
    - [22, 2.702]
  - - [5056, 3584, 1, 1280]
    - [19, 7.465]
  - - [1856, 1856, 1, 256]
    - [19, 6.508]
  - - [32, 5888, 1, 256]
    - [35, 0.831]
  - - [256, 1408, 1, 32]
    - [31, 0.565]
  - - [2944, 1, 1, 3328]
    - [53, 0.022]
  - - [32, 704, 1, 3328]
    - [35, 0.189]
  - - [5888, 4288, 1, 1]
    - [41, 0.188]
  - - [1024, 128, 1, 256]
    - [1, 2.166]
  - - [32, 1856, 1, 3328]
    - [35, 0.5]
  - - [5056, 704, 1, 256]
    - [19, 6.585]
  - - [2368, 5056, 1, 256]
    - [19, 7.254]
  - - [1024, 5056, 1, 256]
    - [19, 6.96]
  - - [32, 1024, 1, 3328]
    - [35, 0.276]
  - - [5888, 448, 1, 256]
    - [19, 6.076]
  - - [6784, 5056, 1, 1280]
    - [19, 7.58]
  - - [4288, 6784, 1, 1280]
    - [19, 7.733]
  - - [64, 1, 1, 256]
    - [52, 0.0]
  - - [1856, 64, 1, 1280]
    - [13, 2.964]
  - - [128, 1408, 1, 1]
    - [39, 0.01]
  - - [1024, 64, 1, 32]
    - [24, 0.1]
  - - [1024, 64, 1, 3328]
    - [11, 2.055]
  - - [704, 6784, 1, 3328]
    - [19, 7.221]
  - - [2944, 1856, 1, 1]
    - [37, 0.143]
  - - [5888, 4288, 1, 1280]
    - [19, 7.521]
  - - [5888, 3584, 1, 1280]
    - [19, 7.517]
  - - [32, 2368, 1, 1280]
    - [35, 0.598]
  - - [3584, 1408, 1, 1280]
    - [19, 7.194]
  - - [1024, 2944, 1, 256]
    - [21, 6.483]
  - - [1, 2944, 1, 1280]
    - [53, 0.02]
  - - [32, 1024, 1, 256]
    - [31, 0.161]
  - - [2944, 1856, 1, 1280]
    - [19, 7.43]
  - - [3584, 1, 1, 1280]
    - [53, 0.025]
  - - [256, 3584, 1, 32]
    - [30, 1.15]
  - - [1024, 2368, 1, 1]
    - [36, 0.102]
  - - [2944, 3584, 1, 1280]
    - [19, 7.503]
  - - [64, 1, 1, 1]
    - [42, 0.0]
  - - [1856, 4288, 1, 256]
    - [19, 7.088]
  - - [256, 1, 1, 256]
    - [52, 0.001]
  - - [256, 128, 1, 3328]
    - [11, 1.102]
  - - [1, 1856, 1, 3328]
    - [53, 0.014]
  - - [448, 3584, 1, 1]
    - [42, 0.083]
  - - [2368, 2944, 1, 32]
    - [22, 2.419]
  - - [128, 4288, 1, 32]
    - [31, 0.81]
  - - [448, 256, 1, 256]
    - [7, 1.844]
  - - [64, 64, 1, 1]
    - [42, 0.0]
  - - [1, 1408, 1, 1]
    - [37, 0.0]
  - - [2944, 32, 1, 32]
    - [24, 0.134]
  - - [448, 1856, 1, 1]
    - [48, 0.05]
  - - [4288, 704, 1, 256]
    - [19, 6.533]
  - - [1856, 1024, 1, 256]
    - [19, 5.913]
  - - [448, 1856, 1, 32]
    - [26, 1.078]
  - - [448, 1856, 1, 3328]
    - [16, 5.177]
  - - [448, 448, 1, 32]
    - [32, 0.247]
  - - [1024, 448, 1, 256]
    - [19, 4.041]
  - - [6784, 1, 1, 256]
    - [52, 0.028]
  - - [704, 6784, 1, 32]
    - [22, 2.135]
  - - [1024, 4288, 1, 1]
    - [37, 0.133]
  - - [704, 256, 1, 3328]
    - [15, 3.177]
  - - [704, 1856, 1, 32]
    - [30, 1.408]
  - - [1408, 5888, 1, 1280]
    - [19, 7.504]
  - - [32, 704, 1, 1280]
    - [35, 0.178]
  - - [5056, 1856, 1, 256]
    - [19, 7.092]
  - - [6784, 704, 1, 1280]
    - [19, 7.033]
  - - [704, 1408, 1, 32]
    - [30, 1.187]
  - - [5888, 1024, 1, 256]
    - [19, 6.978]
  - - [64, 2944, 1, 1]
    - [42, 0.011]
  - - [64, 2944, 1, 32]
    - [26, 0.259]
  - - [64, 2944, 1, 1280]
    - [11, 3.472]
  - - [6784, 1856, 1, 3328]
    - [19, 7.413]
  - - [2368, 5888, 1, 1280]
    - [19, 7.568]
  - - [5888, 6784, 1, 32]
    - [22, 2.836]
  - - [1, 6784, 1, 256]
    - [52, 0.028]
  - - [6784, 6784, 1, 32]
    - [22, 2.843]
  - - [256, 1, 1, 1280]
    - [53, 0.002]
  - - [5888, 128, 1, 32]
    - [26, 0.952]
  - - [6784, 256, 1, 256]
    - [19, 5.944]
  - - [2368, 3584, 1, 3328]
    - [19, 7.507]
  - - [128, 4288, 1, 1280]
    - [19, 4.239]
  - - [32, 3584, 1, 1280]
    - [35, 0.946]
  - - [5888, 1024, 1, 1280]
    - [19, 7.366]
  - - [1856, 704, 1, 3328]
    - [19, 6.709]
  - - [5888, 6784, 1, 3328]
    - [19, 7.604]
  - - [6784, 448, 1, 1]
    - [37, 0.112]
  - - [6784, 1856, 1, 1]
    - [38, 0.173]
  - - [128, 32, 1, 1280]
    - [35, 0.032]
  - - [2944, 2368, 1, 1280]
    - [19, 7.437]
  - - [128, 256, 1, 1]
    - [38, 0.002]
  - - [6784, 448, 1, 32]
    - [26, 1.88]
  - - [6784, 448, 1, 3328]
    - [19, 6.963]
  - - [1, 6784, 1, 1]
    - [42, 0.001]
  - - [448, 3584, 1, 1280]
    - [19, 6.069]
  - - [1408, 6784, 1, 1280]
    - [19, 7.509]
  - - [5056, 5888, 1, 1280]
    - [19, 7.554]
  - - [32, 2944, 1, 32]
    - [24, 0.139]
  - - [5888, 704, 1, 1]
    - [42, 0.128]
  - - [3584, 1856, 1, 1]
    - [42, 0.15]
  - - [1, 256, 1, 256]
    - [53, 0.001]
  - - [5056, 2944, 1, 32]
    - [22, 2.725]
  - - [32, 6784, 1, 256]
    - [35, 0.935]
  - - [4288, 6784, 1, 1]
    - [37, 0.189]
  - - [1, 4288, 1, 3328]
    - [52, 0.022]
  - - [1024, 6784, 1, 1]
    - [43, 0.14]
  - - [2368, 5888, 1, 32]
    - [22, 2.703]
  - - [448, 448, 1, 3328]
    - [15, 3.524]
  - - [1, 256, 1, 1]
    - [39, 0.0]
  - - [3584, 4288, 1, 1]
    - [43, 0.18]
  - - [5888, 1024, 1, 3328]
    - [19, 7.088]
  - - [6784, 5888, 1, 256]
    - [19, 7.297]
  - - [704, 128, 1, 1280]
    - [13, 2.42]
  - - [4288, 128, 1, 256]
    - [19, 3.768]
  - - [5056, 1024, 1, 1]
    - [37, 0.14]
  - - [32, 3584, 1, 3328]
    - [35, 0.995]
  - - [1024, 1, 1, 1280]
    - [53, 0.007]
  - - [4288, 2368, 1, 32]
    - [22, 2.566]
  - - [704, 3584, 1, 1]
    - [39, 0.103]
  - - [704, 1856, 1, 3328]
    - [19, 6.712]
  - - [2944, 128, 1, 1280]
    - [5, 4.111]
  - - [1, 2368, 1, 3328]
    - [53, 0.018]
  - - [6784, 704, 1, 32]
    - [22, 2.132]
  - - [4288, 1, 1, 1280]
    - [52, 0.021]
  - - [704, 5888, 1, 256]
    - [19, 6.835]
  - - [2368, 3584, 1, 1280]
    - [19, 7.46]
  - - [64, 448, 1, 256]
    - [3, 0.613]
  - - [1408, 448, 1, 1280]
    - [19, 4.828]
  - - [3584, 5056, 1, 32]
    - [22, 2.68]
  - - [1024, 32, 1, 1280]
    - [35, 0.259]
  - - [128, 2368, 1, 1]
    - [44, 0.021]
  - - [6784, 1856, 1, 1280]
    - [19, 7.376]
  - - [5056, 5056, 1, 3328]
    - [20, 7.252]
  - - [128, 704, 1, 1280]
    - [13, 2.409]
  - - [128, 2944, 1, 1280]
    - [5, 4.111]
  - - [2368, 5056, 1, 1]
    - [42, 0.173]
  - - [5888, 1408, 1, 256]
    - [21, 7.061]
  - - [2368, 1024, 1, 32]
    - [22, 1.767]
  - - [256, 256, 1, 3328]
    - [11, 2.051]
  - - [64, 4288, 1, 1]
    - [37, 0.019]
  - - [4288, 1024, 1, 256]
    - [19, 6.884]
  - - [3584, 32, 1, 32]
    - [31, 0.208]
  - - [3584, 64, 1, 1]
    - [48, 0.017]
  - - [704, 32, 1, 1280]
    - [35, 0.175]
  - - [32, 4288, 1, 32]
    - [35, 0.231]
  - - [64, 64, 1, 3328]
    - [11, 0.136]
  - - [64, 1408, 1, 1]
    - [44, 0.006]
  - - [4288, 5888, 1, 1280]
    - [19, 7.668]
  - - [1856, 2944, 1, 3328]
    - [19, 7.497]
  - - [256, 1024, 1, 256]
    - [8, 3.358]
  - - [5056, 5888, 1, 256]
    - [19, 7.278]
  - - [1408, 128, 1, 1280]
    - [13, 3.4]
  - - [5056, 256, 1, 3328]
    - [19, 6.547]
  - - [1024, 5888, 1, 1280]
    - [19, 7.517]
  - - [1024, 448, 1, 1]
    - [42, 0.032]
  - - [32, 32, 1, 32]
    - [26, 0.002]
  - - [5056, 1, 1, 1280]
    - [52, 0.025]
  - - [5888, 5056, 1, 1280]
    - [19, 7.553]
  - - [5888, 2944, 1, 1]
    - [36, 0.18]
  - - [64, 4288, 1, 1280]
    - [6, 3.354]
  - - [1408, 4288, 1, 3328]
    - [19, 7.287]
  - - [704, 2944, 1, 32]
    - [22, 1.763]
  - - [1, 5888, 1, 1280]
    - [52, 0.029]
  - - [2944, 4288, 1, 3328]
    - [19, 7.585]
  - - [256, 2944, 1, 256]
    - [19, 5.058]
  - - [704, 448, 1, 32]
    - [31, 0.534]
  - - [5056, 2944, 1, 256]
    - [19, 7.2]
  - - [704, 1024, 1, 256]
    - [19, 4.893]
  - - [2368, 1856, 1, 256]
    - [19, 6.9]
  - - [64, 3584, 1, 1]
    - [39, 0.012]
  - - [1024, 128, 1, 1280]
    - [13, 3.237]
  - - [2368, 4288, 1, 1280]
    - [19, 7.575]
  - - [3584, 448, 1, 256]
    - [19, 5.583]
  - - [256, 6784, 1, 256]
    - [19, 6.03]
  - - [1024, 32, 1, 32]
    - [24, 0.052]
  - - [1024, 1408, 1, 1]
    - [37, 0.076]
  - - [128, 64, 1, 32]
    - [24, 0.013]
  - - [64, 1, 1, 1280]
    - [53, 0.0]
  - - [2368, 32, 1, 32]
    - [24, 0.117]
  - - [256, 5888, 1, 1]
    - [42, 0.078]
  - - [2944, 2944, 1, 1]
    - [36, 0.164]
  - - [6784, 3584, 1, 256]
    - [19, 7.266]
  - - [1408, 1856, 1, 256]
    - [19, 6.604]
  - - [128, 1408, 1, 256]
    - [1, 2.359]
  - - [2944, 2944, 1, 32]
    - [22, 2.463]
  - - [2944, 2944, 1, 3328]
    - [19, 7.454]
  - - [1, 2944, 1, 256]
    - [52, 0.014]
  - - [448, 32, 1, 1280]
    - [35, 0.113]
  - - [3584, 1, 1, 256]
    - [48, 0.017]
  - - [704, 32, 1, 3328]
    - [35, 0.193]
  - - [256, 448, 1, 3328]
    - [13, 3.077]
  - - [128, 128, 1, 256]
    - [3, 0.36]
  - - [2368, 64, 1, 256]
    - [13, 2.111]
  - - [64, 448, 1, 1280]
    - [11, 0.899]
  - - [6784, 1408, 1, 32]
    - [22, 2.547]
  - - [1408, 448, 1, 3328]
    - [19, 4.947]
  - - [2368, 6784, 1, 3328]
    - [19, 7.649]
  - - [256, 2368, 1, 1]
    - [50, 0.039]
  - - [4288, 3584, 1, 32]
    - [22, 2.616]
  - - [5888, 64, 1, 3328]
    - [5, 4.225]
  - - [3584, 704, 1, 1280]
    - [19, 6.893]
  - - [448, 5056, 1, 3328]
    - [19, 6.906]
  - - [4288, 448, 1, 256]
    - [19, 5.885]
  - - [5056, 256, 1, 1280]
    - [19, 6.431]
  - - [704, 448, 1, 3328]
    - [15, 3.507]
  - - [2944, 5888, 1, 32]
    - [22, 2.731]
  - - [3584, 5056, 1, 256]
    - [19, 7.293]
  - - [6784, 1, 1, 3328]
    - [52, 0.034]
  - - [32, 2368, 1, 3328]
    - [35, 0.641]
  - - [4288, 256, 1, 1]
    - [38, 0.062]
  - - [64, 256, 1, 1]
    - [42, 0.001]
  - - [1856, 448, 1, 3328]
    - [19, 5.163]
  - - [3584, 2368, 1, 256]
    - [19, 7.094]
  - - [4288, 4288, 1, 256]
    - [19, 7.279]
  - - [4288, 256, 1, 1280]
    - [19, 5.562]
  - - [448, 5056, 1, 256]
    - [19, 6.216]
  - - [128, 1856, 1, 1]
    - [39, 0.017]
  - - [4288, 704, 1, 1280]
    - [19, 6.975]
  - - [128, 1856, 1, 32]
    - [35, 0.409]
  - - [2368, 704, 1, 1]
    - [42, 0.082]
  - - [3584, 32, 1, 256]
    - [35, 0.632]
  - - [448, 2368, 1, 1280]
    - [19, 5.362]
  - - [3584, 256, 1, 1]
    - [37, 0.055]
  - - [1408, 1856, 1, 1280]
    - [19, 7.135]
  - - [3584, 4288, 1, 3328]
    - [19, 7.682]
  - - [448, 4288, 1, 32]
    - [22, 1.667]
  - - [448, 4288, 1, 1280]
    - [19, 6.424]
  - - [64, 3584, 1, 256]
    - [8, 2.987]
  - - [1, 6784, 1, 1280]
    - [52, 0.033]
  - - [5056, 1024, 1, 256]
    - [19, 6.868]
  - - [2368, 448, 1, 32]
    - [26, 1.217]
  - - [4288, 3584, 1, 1280]
    - [19, 7.629]
  - - [32, 2944, 1, 1280]
    - [35, 0.718]
  - - [1408, 704, 1, 1]
    - [39, 0.056]
  - - [2368, 256, 1, 256]
    - [19, 4.185]
  - - [1, 5056, 1, 1]
    - [42, 0.0]
  - - [4288, 32, 1, 32]
    - [31, 0.258]
  - - [1856, 3584, 1, 32]
    - [22, 2.282]
  - - [5056, 3584, 1, 3328]
    - [17, 7.429]
  - - [4288, 5056, 1, 256]
    - [19, 7.381]
  - - [1856, 5888, 1, 256]
    - [19, 7.25]
  - - [256, 256, 1, 256]
    - [7, 1.331]
  - - [2368, 3584, 1, 1]
    - [37, 0.161]
  - - [4288, 2368, 1, 256]
    - [19, 7.21]
  - - [448, 1, 1, 3328]
    - [53, 0.003]
  - - [1856, 256, 1, 1280]
    - [15, 4.953]
  - - [256, 2944, 1, 1]
    - [38, 0.046]
  - - [1408, 2944, 1, 3328]
    - [19, 7.375]
  - - [32, 1856, 1, 32]
    - [24, 0.091]
  - - [5888, 3584, 1, 1]
    - [41, 0.185]
  - - [256, 1, 1, 1]
    - [44, 0.0]
  - - [6784, 5056, 1, 3328]
    - [19, 7.608]
  - - [6784, 5056, 1, 1]
    - [36, 0.193]
  - - [5888, 3584, 1, 32]
    - [22, 2.769]
  - - [5888, 3584, 1, 3328]
    - [19, 7.554]
  - - [32, 1024, 1, 1280]
    - [35, 0.254]
  - - [1, 256, 1, 3328]
    - [53, 0.002]
  - - [1024, 6784, 1, 256]
    - [19, 7.055]
  - - [6784, 5888, 1, 32]
    - [22, 2.825]
  - - [1408, 1, 1, 1280]
    - [53, 0.01]
  - - [2368, 6784, 1, 32]
    - [22, 2.701]
  - - [6784, 64, 1, 1]
    - [42, 0.032]
  - - [5056, 1408, 1, 1280]
    - [21, 7.211]
  - - [3584, 1408, 1, 3328]
    - [19, 7.252]
  - - [2944, 3584, 1, 1]
    - [36, 0.172]
  - - [2944, 1408, 1, 1280]
    - [19, 7.304]
  - - [1856, 64, 1, 1]
    - [37, 0.007]
  - - [3584, 1024, 1, 1]
    - [37, 0.123]
  - - [256, 32, 1, 256]
    - [35, 0.053]
  - - [2944, 1856, 1, 3328]
    - [19, 7.491]
  - - [128, 1024, 1, 3328]
    - [11, 3.486]
  - - [1408, 128, 1, 1]
    - [42, 0.01]
  - - [2944, 3584, 1, 32]
    - [22, 2.596]
  - - [5888, 256, 1, 32]
    - [29, 1.456]
  - - [6784, 64, 1, 256]
    - [19, 3.852]
  - - [256, 128, 1, 1280]
    - [11, 1.03]
  - - [6784, 5056, 1, 256]
    - [19, 7.304]
  - - [1408, 32, 1, 3328]
    - [35, 0.38]
  - - [1856, 3584, 1, 1280]
    - [19, 7.368]
  - - [256, 5888, 1, 256]
    - [19, 5.91]
  - - [5056, 32, 1, 256]
    - [35, 0.733]
  - - [1024, 4288, 1, 3328]
    - [19, 7.379]
  - - [448, 2368, 1, 256]
    - [19, 4.906]
  - - [64, 1408, 1, 1280]
    - [11, 2.42]
  - - [3584, 32, 1, 1280]
    - [35, 0.92]
  - - [128, 2368, 1, 3328]
    - [5, 3.414]
  - - [64, 5056, 1, 256]
    - [5, 3.028]
  - - [256, 64, 1, 256]
    - [3, 0.35]
  - - [32, 1408, 1, 256]
    - [31, 0.239]
  - - [2368, 448, 1, 3328]
    - [19, 5.473]
  - - [2368, 1408, 1, 1]
    - [37, 0.118]
  - - [1, 1, 1, 1]
    - [42, 0.0]
  - - [1024, 1856, 1, 32]
    - [22, 1.612]
  - - [32, 1024, 1, 32]
    - [23, 0.049]
  - - [4288, 1, 1, 256]
    - [52, 0.018]
  - - [1856, 128, 1, 3328]
    - [15, 4.173]
  - - [5888, 2368, 1, 1]
    - [42, 0.177]
  - - [2368, 2368, 1, 1]
    - [37, 0.144]
  - - [704, 256, 1, 1280]
    - [15, 2.994]
  - - [704, 4288, 1, 256]
    - [19, 6.486]
  - - [5888, 2368, 1, 32]
    - [22, 2.592]
  - - [5888, 2368, 1, 1280]
    - [18, 7.196]
  - - [128, 256, 1, 256]
    - [3, 0.701]
  - - [2944, 5056, 1, 3328]
    - [19, 7.699]
  - - [6784, 704, 1, 3328]
    - [19, 7.083]
  - - [1856, 1856, 1, 32]
    - [22, 2.023]
  - - [4288, 2944, 1, 32]
    - [22, 2.566]
  - - [256, 5056, 1, 1]
    - [38, 0.069]
  - - [704, 64, 1, 256]
    - [3, 0.947]
  - - [256, 2368, 1, 3328]
    - [19, 4.764]
  - - [704, 1, 1, 1]
    - [37, 0.0]
  - - [128, 448, 1, 1280]
    - [11, 1.73]
  - - [5056, 5056, 1, 256]
    - [19, 7.257]
  - - [5888, 256, 1, 256]
    - [19, 5.862]
  - - [5888, 64, 1, 1]
    - [39, 0.028]
  - - [6784, 6784, 1, 256]
    - [21, 7.385]
  - - [256, 3584, 1, 1]
    - [37, 0.054]
  - - [2368, 1, 1, 256]
    - [52, 0.011]
  - - [448, 32, 1, 32]
    - [24, 0.023]
  - - [704, 64, 1, 1]
    - [50, 0.003]
  - - [3584, 704, 1, 3328]
    - [19, 6.974]
  - - [4288, 704, 1, 3328]
    - [19, 7.041]
  - - [4288, 2944, 1, 1280]
    - [19, 7.527]
  - - [448, 3584, 1, 256]
    - [19, 5.583]
  - - [704, 32, 1, 256]
    - [31, 0.119]
  - - [6784, 256, 1, 32]
    - [30, 1.59]
  - - [1856, 128, 1, 1]
    - [39, 0.016]
  - - [1856, 32, 1, 32]
    - [24, 0.096]
  - - [6784, 1408, 1, 1280]
    - [19, 7.367]
  - - [2368, 5056, 1, 1280]
    - [19, 7.595]
  - - [704, 1856, 1, 1280]
    - [19, 6.563]
  - - [1408, 1408, 1, 1280]
    - [21, 6.701]
  - - [448, 1024, 1, 3328]
    - [19, 4.932]
  - - [32, 704, 1, 32]
    - [24, 0.035]
  - - [256, 704, 1, 1]
    - [42, 0.01]
  - - [5888, 1856, 1, 32]
    - [22, 2.575]
  - - [5888, 704, 1, 3328]
    - [19, 7.241]
  - - [5056, 1, 1, 256]
    - [52, 0.021]
  - - [448, 6784, 1, 256]
    - [19, 6.524]
  - - [1024, 128, 1, 1]
    - [44, 0.008]
  - - [128, 64, 1, 256]
    - [3, 0.157]
  - - [1856, 128, 1, 256]
    - [8, 3.11]
  - - [2944, 5888, 1, 256]
    - [19, 7.296]
  - - [1024, 256, 1, 1280]
    - [15, 4.325]
  - - [128, 5056, 1, 32]
    - [26, 0.919]
  - - [128, 5056, 1, 1280]
    - [19, 4.985]
  - - [448, 32, 1, 3328]
    - [35, 0.119]
  - - [1856, 1408, 1, 32]
    - [22, 1.877]
  - - [64, 704, 1, 32]
    - [24, 0.068]
  - - [64, 704, 1, 3328]
    - [11, 1.482]
  - - [64, 2368, 1, 32]
    - [24, 0.222]
  - - [5888, 64, 1, 32]
    - [33, 0.567]
  - - [2368, 256, 1, 1]
    - [52, 0.036]
  - - [5888, 64, 1, 1280]
    - [10, 4.081]
  - - [5056, 1, 1, 1]
    - [50, 0.0]
  - - [5888, 2944, 1, 1280]
    - [21, 7.343]
  - - [32, 2368, 1, 256]
    - [31, 0.396]
  - - [256, 1408, 1, 256]
    - [8, 3.283]
  - - [448, 5888, 1, 1]
    - [42, 0.107]
  - - [3584, 1408, 1, 1]
    - [36, 0.138]
  - - [32, 6784, 1, 1280]
    - [35, 1.169]
  - - [32, 6784, 1, 32]
    - [31, 0.361]
  - - [448, 5888, 1, 32]
    - [22, 1.816]
  - - [5056, 704, 1, 1280]
    - [19, 6.993]
  - - [1856, 6784, 1, 1]
    - [42, 0.173]
  - - [5056, 64, 1, 1]
    - [44, 0.023]
  - - [1, 5888, 1, 1]
    - [37, 0.0]
  - - [2368, 1024, 1, 256]
    - [19, 6.206]
  - - [1856, 6784, 1, 32]
    - [22, 2.626]
  - - [1856, 6784, 1, 1280]
    - [19, 7.529]
  - - [64, 3584, 1, 3328]
    - [12, 4.029]
  - - [5888, 5056, 1, 3328]
    - [17, 7.423]
  - - [1, 2944, 1, 3328]
    - [53, 0.022]
  - - [1408, 6784, 1, 32]
    - [22, 2.507]
  - - [32, 5888, 1, 1280]
    - [35, 1.014]
  - - [448, 256, 1, 1]
    - [37, 0.007]
  - - [3584, 5888, 1, 3328]
    - [19, 7.707]
  - - [4288, 1408, 1, 256]
    - [19, 6.881]
  - - [448, 64, 1, 1280]
    - [11, 0.904]
  - - [128, 448, 1, 32]
    - [34, 0.08]
  - - [6784, 2368, 1, 256]
    - [19, 7.164]
  - - [1408, 448, 1, 32]
    - [26, 0.908]
  - - [1856, 1408, 1, 1280]
    - [19, 7.142]
  - - [448, 256, 1, 3328]
    - [13, 3.066]
  - - [1856, 2368, 1, 1]
    - [37, 0.133]
  - - [1408, 5056, 1, 3328]
    - [19, 7.4]
  - - [128, 704, 1, 3328]
    - [11, 2.603]
  - - [5056, 128, 1, 1280]
    - [5, 4.989]
  - - [5056, 4288, 1, 256]
    - [19, 7.245]
  - - [5056, 5056, 1, 32]
    - [22, 2.788]
  - - [1856, 704, 1, 256]
    - [19, 5.895]
  - - [64, 256, 1, 256]
    - [3, 0.363]
  - - [448, 5888, 1, 1280]
    - [19, 6.612]
  - - [128, 6784, 1, 256]
    - [5, 4.782]
  - - [5056, 448, 1, 256]
    - [19, 6.181]
  - - [4288, 5888, 1, 1]
    - [37, 0.187]
  - - [1856, 5056, 1, 1280]
    - [19, 7.573]
  - - [2368, 4288, 1, 1]
    - [42, 0.167]
  - - [2368, 32, 1, 3328]
    - [35, 0.637]
  - - [3584, 1856, 1, 256]
    - [19, 7.002]
  - - [256, 3584, 1, 256]
    - [19, 5.018]
  - - [64, 704, 1, 1]
    - [42, 0.003]
  - - [4288, 5888, 1, 32]
    - [22, 2.749]
  - - [4288, 5888, 1, 3328]
    - [19, 7.706]
  - - [1, 1024, 1, 1]
    - [42, 0.0]
  - - [1024, 2944, 1, 3328]
    - [19, 7.045]
  - - [2944, 2368, 1, 256]
    - [19, 7.077]
  - - [1024, 1856, 1, 256]
    - [19, 5.906]
  - - [2944, 64, 1, 3328]
    - [14, 3.468]
  - - [1024, 5888, 1, 32]
    - [30, 2.226]
  - - [1024, 5888, 1, 3328]
    - [19, 7.581]
  - - [5056, 2368, 1, 32]
    - [22, 2.5]
  - - [1408, 2368, 1, 1280]
    - [19, 7.151]
  - - [256, 1, 1, 3328]
    - [53, 0.002]
  - - [128, 1024, 1, 32]
    - [24, 0.194]
  - - [5056, 6784, 1, 3328]
    - [19, 7.62]
  - - [448, 704, 1, 1]
    - [52, 0.021]
  - - [32, 64, 1, 32]
    - [24, 0.003]
  - - [448, 704, 1, 32]
    - [31, 0.508]
  - - [448, 704, 1, 3328]
    - [15, 3.513]
  - - [1408, 2944, 1, 256]
    - [21, 6.896]
  - - [64, 5888, 1, 1]
    - [47, 0.026]
  - - [2368, 128, 1, 32]
    - [31, 0.513]
  - - [2368, 256, 1, 1280]
    - [19, 4.682]
  - - [2368, 128, 1, 3328]
    - [10, 3.412]
  - - [704, 5056, 1, 32]
    - [22, 2.086]
  - - [32, 2368, 1, 32]
    - [24, 0.114]
  - - [1408, 1, 1, 256]
    - [52, 0.007]
  - - [4288, 256, 1, 32]
    - [30, 1.294]
  - - [448, 1408, 1, 1]
    - [48, 0.04]
  - - [5056, 4288, 1, 1280]
    - [19, 7.535]
  - - [1408, 256, 1, 256]
    - [19, 3.296]
  - - [4288, 448, 1, 1]
    - [37, 0.065]
  - - [256, 4288, 1, 32]
    - [26, 1.274]
  - - [1408, 256, 1, 1280]
    - [15, 3.821]
  - - [256, 256, 1, 1]
    - [37, 0.004]
  - - [1408, 1, 1, 1]
    - [44, 0.0]
  - - [448, 1408, 1, 256]
    - [19, 4.305]
  - - [5888, 5888, 1, 1]
    - [41, 0.196]
  - - [128, 2944, 1, 32]
    - [31, 0.613]
  - - [32, 256, 1, 32]
    - [31, 0.018]
  - - [2944, 704, 1, 1280]
    - [19, 6.935]
  - - [1024, 3584, 1, 1280]
    - [19, 7.337]
  - - [1856, 448, 1, 1]
    - [37, 0.05]
  - - [2368, 2944, 1, 1]
    - [42, 0.153]
  - - [5056, 256, 1, 32]
    - [30, 1.425]
  - - [4288, 1, 1, 3328]
    - [52, 0.022]
  - - [5056, 1024, 1, 1280]
    - [21, 7.244]
  - - [704, 704, 1, 1]
    - [42, 0.033]
  - - [1856, 448, 1, 1280]
    - [19, 5.077]
  - - [3584, 6784, 1, 256]
    - [19, 7.395]
  - - [64, 1856, 1, 1280]
    - [13, 2.983]
  - - [1856, 1408, 1, 256]
    - [19, 6.611]
  - - [4288, 4288, 1, 32]
    - [22, 2.716]
  - - [128, 1, 1, 256]
    - [52, 0.001]
  - - [32, 64, 1, 3328]
    - [35, 0.017]
  - - [5888, 448, 1, 1]
    - [37, 0.104]
  - - [128, 5888, 1, 256]
    - [19, 4.974]
  - - [3584, 256, 1, 3328]
    - [16, 5.703]
  - - [5056, 5056, 1, 1280]
    - [19, 7.537]
  - - [6784, 1408, 1, 3328]
    - [19, 7.409]
  - - [448, 2368, 1, 1]
    - [50, 0.06]
  - - [2368, 1, 1, 1280]
    - [53, 0.016]
  - - [32, 3584, 1, 32]
    - [31, 0.204]
  - - [128, 6784, 1, 1]
    - [42, 0.055]
  - - [1, 3584, 1, 1]
    - [37, 0.0]
  - - [5888, 5888, 1, 3328]
    - [17, 7.505]
  - - [256, 2944, 1, 3328]
    - [19, 5.912]
  - - [1, 128, 1, 3328]
    - [53, 0.001]
  - - [32, 256, 1, 256]
    - [35, 0.053]
  - - [5888, 1408, 1, 32]
    - [22, 2.539]
  - - [704, 256, 1, 1]
    - [42, 0.011]
  - - [1, 448, 1, 1]
    - [43, 0.0]
  - - [256, 6784, 1, 3328]
    - [19, 6.655]
  - - [64, 5888, 1, 256]
    - [5, 3.472]
  - - [1856, 1, 1, 1]
    - [37, 0.0]
  - - [1024, 256, 1, 3328]
    - [15, 4.592]
  - - [704, 704, 1, 256]
    - [19, 4.302]
  - - [448, 1024, 1, 32]
    - [26, 0.673]
  - - [6784, 2368, 1, 1280]
    - [19, 7.451]
  - - [128, 1856, 1, 1280]
    - [12, 3.947]
  - - [256, 2368, 1, 256]
    - [19, 4.161]
  - - [2944, 1408, 1, 1]
    - [37, 0.13]
  - - [6784, 1024, 1, 256]
    - [19, 6.94]
  - - [5056, 1408, 1, 32]
    - [22, 2.379]
  - - [1408, 6784, 1, 3328]
    - [19, 7.561]
  - - [2944, 1408, 1, 3328]
    - [19, 7.374]
  - - [1856, 32, 1, 256]
    - [31, 0.318]
  - - [704, 2368, 1, 32]
    - [26, 1.522]
  - - [448, 256, 1, 32]
    - [25, 0.165]
  - - [704, 6784, 1, 1]
    - [42, 0.137]
  - - [2368, 6784, 1, 256]
    - [19, 7.271]
  - - [1856, 3584, 1, 3328]
    - [19, 7.423]
  - - [1, 704, 1, 3328]
    - [53, 0.005]
  - - [64, 1, 1, 3328]
    - [53, 0.0]
  - - [448, 704, 1, 1280]
    - [8, 3.401]
  - - [704, 1856, 1, 1]
    - [44, 0.07]
  - - [704, 448, 1, 256]
    - [19, 2.895]
  - - [448, 64, 1, 3328]
    - [11, 0.969]
  - - [704, 6784, 1, 256]
    - [19, 6.766]
  - - [256, 32, 1, 1280]
    - [35, 0.065]
  - - [2368, 448, 1, 1280]
    - [19, 5.387]
  - - [6784, 2944, 1, 32]
    - [22, 2.759]
  - - [64, 4288, 1, 32]
    - [24, 0.464]
  - - [128, 704, 1, 1]
    - [44, 0.006]
  - - [128, 448, 1, 3328]
    - [13, 1.862]
  - - [5888, 2368, 1, 3328]
    - [19, 7.457]
  - - [2368, 704, 1, 1280]
    - [19, 6.313]
  - - [1024, 1408, 1, 1280]
    - [19, 6.233]
  - - [4288, 64, 1, 1280]
    - [13, 3.236]
  - - [128, 5056, 1, 1]
    - [48, 0.043]
  - - [2944, 5056, 1, 32]
    - [22, 2.672]
  - - [448, 448, 1, 1]
    - [52, 0.011]
  - - [256, 2368, 1, 1280]
    - [19, 4.673]
  - - [704, 2368, 1, 3328]
    - [19, 6.389]
  - - [3584, 2944, 1, 256]
    - [19, 7.157]
  - - [64, 6784, 1, 256]
    - [8, 3.896]
  - - [3584, 1024, 1, 1280]
    - [19, 7.322]
  - - [64, 1024, 1, 256]
    - [3, 1.298]
  - - [1408, 32, 1, 32]
    - [24, 0.071]
  - - [128, 3584, 1, 256]
    - [8, 4.056]
  - - [704, 1408, 1, 1]
    - [39, 0.057]
  - - [5056, 3584, 1, 256]
    - [19, 7.178]
  - - [2368, 704, 1, 256]
    - [19, 5.805]
  - - [1856, 1856, 1, 1280]
    - [19, 6.903]
  - - [32, 5888, 1, 32]
    - [24, 0.33]
  - - [64, 32, 1, 32]
    - [24, 0.003]
  - - [4288, 704, 1, 1]
    - [40, 0.088]
  - - [1856, 1024, 1, 1]
    - [42, 0.088]
  - - [4288, 2944, 1, 3328]
    - [19, 7.575]
  - - [1024, 128, 1, 3328]
    - [11, 3.495]
  - - [4288, 128, 1, 3328]
    - [15, 4.331]
  - - [4288, 704, 1, 32]
    - [30, 1.911]
  - - [1856, 1024, 1, 32]
    - [28, 1.577]
  - - [1, 448, 1, 3328]
    - [53, 0.003]
  - - [2944, 6784, 1, 1]
    - [41, 0.189]
  - - [6784, 2368, 1, 32]
    - [22, 2.667]
  - - [5888, 5056, 1, 1]
    - [36, 0.191]
  - - [128, 6784, 1, 1280]
    - [10, 5.351]
  - - [704, 5888, 1, 1]
    - [37, 0.131]
  - - [6784, 6784, 1, 1]
    - [41, 0.189]
  - - [1856, 32, 1, 1280]
    - [35, 0.472]
  - - [5888, 448, 1, 3328]
    - [19, 6.579]
  - - [704, 5888, 1, 32]
    - [22, 2.174]
  - - [704, 5888, 1, 1280]
    - [19, 7.302]
  - - [1024, 6784, 1, 3328]
    - [19, 7.482]
  - - [704, 2944, 1, 1280]
    - [19, 6.927]
  - - [4288, 6784, 1, 256]
    - [19, 7.421]
  - - [3584, 256, 1, 32]
    - [26, 1.15]
  - - [1408, 1408, 1, 32]
    - [22, 1.682]
  - - [1408, 1408, 1, 3328]
    - [21, 6.772]
  - - [1024, 64, 1, 256]
    - [3, 1.308]
  - - [4288, 64, 1, 32]
    - [31, 0.462]
  - - [1408, 256, 1, 32]
    - [31, 0.6]
  - - [5888, 128, 1, 256]
    - [19, 5.058]
  - - [64, 704, 1, 1280]
    - [11, 1.377]
  - - [2944, 1856, 1, 256]
    - [19, 7.027]
  - - [128, 5056, 1, 3328]
    - [5, 5.09]
  - - [4288, 2944, 1, 1]
    - [42, 0.173]
  - - [6784, 5056, 1, 32]
    - [22, 2.805]
  - - [1024, 448, 1, 3328]
    - [15, 4.977]
  - - [3584, 128, 1, 1]
    - [44, 0.033]
  - - [2944, 4288, 1, 1280]
    - [19, 7.536]
  - - [64, 32, 1, 3328]
    - [35, 0.017]
  - - [1024, 4288, 1, 256]
    - [19, 6.884]
  - - [128, 2368, 1, 256]
    - [0, 2.882]
  - - [2368, 64, 1, 32]
    - [24, 0.224]
  - - [1408, 1, 1, 3328]
    - [53, 0.01]
  - - [64, 1408, 1, 32]
    - [26, 0.135]
  - - [2368, 5888, 1, 1]
    - [42, 0.176]
  - - [1408, 1856, 1, 32]
    - [30, 1.783]
  - - [448, 1856, 1, 256]
    - [19, 4.569]
  - - [1856, 6784, 1, 3328]
    - [19, 7.567]
  - - [3584, 128, 1, 256]
    - [8, 4.056]
  - - [1024, 448, 1, 1280]
    - [19, 4.795]
  - - [1024, 2368, 1, 32]
    - [22, 1.78]
  - - [32, 2944, 1, 256]
    - [31, 0.449]
  - - [128, 5888, 1, 1]
    - [41, 0.047]
  - - [64, 5056, 1, 1]
    - [44, 0.022]
  - - [1856, 256, 1, 32]
    - [24, 0.711]
  - - [2368, 2368, 1, 3328]
    - [19, 7.358]
  - - [64, 448, 1, 1]
    - [51, 0.002]
  - - [3584, 5888, 1, 32]
    - [22, 2.71]
  - - [3584, 5888, 1, 1280]
    - [19, 7.665]
  - - [64, 5056, 1, 32]
    - [31, 0.554]
  - - [2944, 64, 1, 1]
    - [44, 0.011]
  - - [6784, 704, 1, 256]
    - [19, 6.668]
  - - [3584, 1024, 1, 32]
    - [22, 2.109]
  - - [1408, 704, 1, 32]
    - [26, 1.197]
  - - [1408, 704, 1, 1280]
    - [19, 6.021]
  - - [2368, 5888, 1, 256]
    - [19, 7.247]
  - - [2944, 64, 1, 32]
    - [24, 0.26]
  - - [1, 1408, 1, 256]
    - [52, 0.007]
  - - [64, 2944, 1, 256]
    - [1, 2.536]
  - - [5888, 5888, 1, 32]
    - [22, 2.809]
  - - [1856, 1408, 1, 3328]
    - [19, 7.231]
  - - [1024, 1024, 1, 32]
    - [26, 1.251]
  - - [4288, 1024, 1, 1]
    - [37, 0.131]
  - - [704, 4288, 1, 3328]
    - [19, 7.053]
  - - [2944, 5056, 1, 1280]
    - [19, 7.654]
  - - [6784, 2944, 1, 1280]
    - [19, 7.483]
  - - [6784, 256, 1, 3328]
    - [19, 6.552]
  - - [5056, 128, 1, 3328]
    - [5, 5.091]
  - - [128, 128, 1, 1280]
    - [11, 0.514]
  - - [128, 4288, 1, 1]
    - [50, 0.036]
  - - [1408, 5056, 1, 32]
    - [22, 2.302]
  - - [2944, 128, 1, 3328]
    - [5, 4.234]
  - - [5888, 1856, 1, 1280]
    - [19, 7.435]
  - - [64, 128, 1, 256]
    - [3, 0.166]
  - - [5888, 256, 1, 1280]
    - [19, 6.421]
  - - [1856, 5056, 1, 1]
    - [42, 0.152]
  - - [3584, 1856, 1, 1280]
    - [19, 7.366]
  - - [6784, 448, 1, 256]
    - [19, 6.398]
  - - [704, 3584, 1, 256]
    - [19, 6.363]
  - - [1856, 5056, 1, 32]
    - [22, 2.514]
  - - [1856, 5056, 1, 3328]
    - [19, 7.628]
  - - [1024, 2944, 1, 32]
    - [22, 1.925]
  - - [1408, 6784, 1, 256]
    - [19, 7.169]
  - - [1024, 2368, 1, 1280]
    - [19, 6.642]
  - - [1856, 3584, 1, 1]
    - [42, 0.151]
  - - [5888, 128, 1, 1280]
    - [19, 5.743]
  - - [2944, 5888, 1, 1280]
    - [19, 7.607]
  - - [1, 1856, 1, 1]
    - [47, 0.0]
  - - [3584, 3584, 1, 256]
    - [19, 7.299]
  - - [1856, 2368, 1, 3328]
    - [19, 7.384]
  - - [5888, 704, 1, 256]
    - [19, 6.769]
  - - [64, 448, 1, 32]
    - [24, 0.044]
  - - [6784, 4288, 1, 256]
    - [19, 7.297]
  - - [128, 64, 1, 3328]
    - [11, 0.271]
  - - [1, 5056, 1, 1280]
    - [52, 0.025]
  - - [32, 64, 1, 1280]
    - [35, 0.016]
  - - [1408, 2368, 1, 3328]
    - [19, 7.222]
  - - [1024, 3584, 1, 256]
    - [19, 6.858]
  - - [2944, 128, 1, 256]
    - [10, 3.407]
  - - [6784, 128, 1, 1]
    - [39, 0.053]
  - - [1408, 256, 1, 3328]
    - [15, 3.928]
  - - [448, 32, 1, 256]
    - [31, 0.075]
  - - [1024, 32, 1, 256]
    - [31, 0.174]
  - - [1, 5888, 1, 256]
    - [52, 0.024]
  - - [64, 2368, 1, 256]
    - [1, 2.255]
  - - [2944, 256, 1, 256]
    - [19, 5.086]
  - - [1, 128, 1, 256]
    - [52, 0.001]
  - - [32, 256, 1, 1280]
    - [35, 0.069]
  - - [5888, 1, 1, 256]
    - [52, 0.024]
  - - [32, 128, 1, 3328]
    - [35, 0.035]
  - - [6784, 128, 1, 256]
    - [19, 4.696]
  - - [6784, 64, 1, 1280]
    - [15, 4.57]
  - - [4288, 1024, 1, 32]
    - [22, 2.188]
  - - [1408, 64, 1, 3328]
    - [13, 2.591]
  - - [2944, 448, 1, 1280]
    - [19, 5.735]
  - - [6784, 32, 1, 1280]
    - [35, 1.154]
  - - [2944, 64, 1, 1280]
    - [13, 3.456]
  - - [704, 448, 1, 1]
    - [50, 0.022]
  - - [32, 128, 1, 32]
    - [24, 0.006]
  - - [1, 128, 1, 1]
    - [42, 0.0]
  - - [5888, 1, 1, 1]
    - [37, 0.0]
  - - [5888, 1856, 1, 3328]
    - [18, 7.356]
  - - [2368, 3584, 1, 256]
    - [19, 7.102]
  - - [4288, 1408, 1, 3328]
    - [19, 7.279]
  - - [1856, 32, 1, 3328]
    - [35, 0.5]
  - - [2944, 32, 1, 256]
    - [31, 0.478]
  - - [128, 64, 1, 1]
    - [53, 0.001]
  - - [256, 1024, 1, 3328]
    - [15, 4.602]
  - - [32, 448, 1, 256]
    - [31, 0.075]
  - - [1856, 64, 1, 3328]
    - [13, 3.192]
  - - [256, 5056, 1, 256]
    - [19, 5.884]
  - - [5888, 2944, 1, 3328]
    - [19, 7.493]
  - - [2368, 1408, 1, 3328]
    - [19, 7.221]
  - - [5888, 704, 1, 32]
    - [30, 2.076]
  - - [2944, 704, 1, 1]
    - [42, 0.092]
  - - [6784, 1856, 1, 256]
    - [19, 7.078]
  - - [1, 704, 1, 256]
    - [52, 0.003]
  - - [1856, 1856, 1, 1]
    - [37, 0.121]
  - - [5888, 32, 1, 256]
    - [35, 0.837]
  - - [128, 704, 1, 256]
    - [11, 1.599]
  - - [256, 1408, 1, 3328]
    - [15, 3.925]
  - - [2944, 128, 1, 1]
    - [52, 0.023]
  - - [32, 256, 1, 3328]
    - [35, 0.071]
  - - [2944, 704, 1, 3328]
    - [19, 7.031]
  - - [704, 1024, 1, 32]
    - [31, 0.977]
  - - [2368, 1856, 1, 32]
    - [22, 2.151]
  - - [5056, 4288, 1, 3328]
    - [17, 7.435]
  - - [3584, 448, 1, 3328]
    - [19, 6.157]
  - - [256, 32, 1, 32]
    - [31, 0.018]
  - - [64, 256, 1, 3328]
    - [11, 0.553]
  - - [256, 6784, 1, 1]
    - [37, 0.086]
  - - [1024, 3584, 1, 32]
    - [22, 2.093]
  - - [256, 6784, 1, 32]
    - [30, 1.581]
  - - [2944, 1408, 1, 32]
    - [22, 2.17]
  - - [4288, 3584, 1, 1]
    - [42, 0.18]
  - - [1, 704, 1, 1]
    - [44, 0.0]
  - - [5056, 448, 1, 3328]
    - [19, 6.785]
  - - [3584, 64, 1, 256]
    - [8, 2.987]
  - - [64, 1856, 1, 32]
    - [24, 0.181]
  - - [64, 1856, 1, 3328]
    - [13, 3.184]
  - - [6784, 3584, 1, 32]
    - [22, 2.812]
  - - [4288, 1856, 1, 256]
    - [19, 7.067]
  - - [1856, 2944, 1, 256]
    - [19, 7.027]
  - - [128, 448, 1, 1]
    - [44, 0.004]
  - - [64, 128, 1, 32]
    - [24, 0.012]
  - - [704, 1, 1, 1280]
    - [53, 0.005]
  - - [2944, 5888, 1, 1]
    - [41, 0.18]
  - - [1024, 1856, 1, 3328]
    - [21, 6.497]
  - - [5888, 1024, 1, 32]
    - [22, 2.37]
  - - [3584, 256, 1, 1280]
    - [19, 5.585]
  - - [1024, 1, 1, 1]
    - [47, 0.0]
  - - [1408, 5056, 1, 1280]
    - [19, 7.349]
  - - [3584, 128, 1, 1280]
    - [15, 4.804]
  - - [5056, 6784, 1, 256]
    - [19, 7.3]
  - - [256, 1856, 1, 256]
    - [19, 4.185]
  - - [5888, 32, 1, 1280]
    - [35, 1.014]
  - - [256, 128, 1, 32]
    - [26, 0.048]
  - - [32, 1856, 1, 1280]
    - [35, 0.46]
  - - [2944, 5056, 1, 1]
    - [36, 0.18]
  - - [448, 128, 1, 1]
    - [44, 0.004]
  - - [256, 704, 1, 32]
    - [27, 0.232]
  - - [256, 704, 1, 1280]
    - [15, 2.998]
  - - [1, 2368, 1, 1]
    - [48, 0.0]
  - - [5888, 5888, 1, 1280]
    - [19, 7.553]
  - - [256, 2944, 1, 1280]
    - [19, 5.772]
  - - [2944, 256, 1, 3328]
    - [19, 5.91]
  - - [5056, 2944, 1, 1280]
    - [19, 7.496]
  - - [704, 1024, 1, 3328]
    - [19, 5.655]
  - - [2368, 1856, 1, 1280]
    - [19, 7.316]
  - - [448, 2944, 1, 1]
    - [38, 0.072]
  - - [6784, 2944, 1, 1]
    - [36, 0.187]
  - - [2944, 1024, 1, 32]
    - [22, 1.993]
  - - [2944, 1024, 1, 1280]
    - [19, 6.965]
  - - [1408, 64, 1, 32]
    - [26, 0.137]
  - - [5056, 5056, 1, 1]
    - [37, 0.186]
  - - [2368, 4288, 1, 256]
    - [19, 7.229]
  - - [448, 1856, 1, 1280]
    - [19, 5.058]
  - - [2368, 448, 1, 1]
    - [46, 0.057]
  - - [448, 2944, 1, 32]
    - [30, 1.376]
  - - [448, 2944, 1, 1280]
    - [19, 5.722]
  - - [2944, 6784, 1, 1280]
    - [19, 7.63]
  - - [256, 6784, 1, 1280]
    - [19, 6.571]
  - - [128, 2368, 1, 1280]
    - [0, 3.508]
  - - [3584, 2368, 1, 32]
    - [22, 2.492]
  - - [704, 32, 1, 32]
    - [26, 0.035]
  - - [6784, 3584, 1, 3328]
    - [17, 7.469]
  - - [128, 32, 1, 256]
    - [31, 0.021]
  - - [128, 1408, 1, 1280]
    - [11, 3.389]
  - - [64, 32, 1, 1280]
    - [35, 0.016]
  - - [128, 1856, 1, 3328]
    - [12, 4.171]
  - - [2944, 2944, 1, 256]
    - [19, 7.08]
  - - [1408, 1024, 1, 3328]
    - [19, 6.329]
  - - [5056, 2368, 1, 1280]
    - [19, 7.449]
  - - [448, 128, 1, 32]
    - [24, 0.084]
  - - [2368, 64, 1, 3328]
    - [13, 3.198]
  - - [32, 5056, 1, 3328]
    - [35, 0.907]
  - - [448, 2944, 1, 3328]
    - [19, 5.808]
  - - [2944, 1024, 1, 1]
    - [37, 0.114]
  - - [2368, 128, 1, 1280]
    - [10, 3.328]
  - - [3584, 704, 1, 256]
    - [19, 6.424]
  - - [2368, 5888, 1, 3328]
    - [19, 7.608]
  - - [4288, 2368, 1, 1]
    - [37, 0.168]
  - - [1408, 3584, 1, 32]
    - [22, 2.279]
  - - [2944, 4288, 1, 32]
    - [26, 2.476]
  - - [5888, 1408, 1, 1280]
    - [21, 7.387]
  - - [3584, 5056, 1, 1280]
    - [19, 7.603]
  - - [5888, 6784, 1, 1280]
    - [18, 7.504]
  - - [64, 1856, 1, 1]
    - [44, 0.008]
  - - [704, 128, 1, 32]
    - [24, 0.138]
  - - [3584, 2944, 1, 1]
    - [38, 0.171]
  - - [128, 3584, 1, 3328]
    - [12, 5.038]
  - - [256, 4288, 1, 3328]
    - [19, 5.647]
  - - [4288, 64, 1, 1]
    - [37, 0.02]
  - - [1, 1408, 1, 1280]
    - [53, 0.01]
  - - [5056, 32, 1, 1280]
    - [35, 0.888]
  - - [1856, 704, 1, 32]
    - [30, 1.397]
  - - [1024, 1856, 1, 1]
    - [37, 0.09]
  - - [704, 5056, 1, 3328]
    - [19, 7.195]
  - - [1024, 3584, 1, 3328]
    - [19, 7.419]
  - - [5888, 256, 1, 3328]
    - [19, 6.511]
  - - [1856, 1408, 1, 1]
    - [42, 0.106]
  - - [2944, 448, 1, 32]
    - [30, 1.386]
  - - [128, 448, 1, 256]
    - [3, 1.205]
  - - [128, 1024, 1, 1]
    - [44, 0.008]
  - - [32, 32, 1, 256]
    - [31, 0.005]
  - - [4288, 5056, 1, 1280]
    - [19, 7.683]
  - - [1856, 1856, 1, 3328]
    - [19, 6.963]
  - - [1024, 2368, 1, 256]
    - [19, 6.226]
  - - [4288, 2368, 1, 3328]
    - [19, 7.622]
  - - [256, 64, 1, 32]
    - [31, 0.033]
  - - [1, 1024, 1, 1280]
    - [53, 0.007]
  - - [5056, 128, 1, 32]
    - [24, 0.945]
  - - [5888, 3584, 1, 256]
    - [19, 7.233]
  - - [1024, 5056, 1, 32]
    - [22, 2.202]
  - - [5888, 448, 1, 1280]
    - [19, 6.507]
  - - [704, 5888, 1, 3328]
    - [19, 7.378]
  - - [1024, 1408, 1, 256]
    - [19, 5.681]
  - - [3584, 2944, 1, 1280]
    - [19, 7.494]
  - - [1, 5056, 1, 256]
    - [52, 0.021]
  - - [256, 1024, 1, 1]
    - [42, 0.017]
  - - [32, 32, 1, 3328]
    - [35, 0.009]
  - - [2368, 1, 1, 3328]
    - [53, 0.018]
  - - [4288, 1856, 1, 1280]
    - [19, 7.421]
  - - [3584, 5888, 1, 1]
    - [36, 0.185]
  - - [5888, 4288, 1, 256]
    - [19, 7.244]
  - - [1024, 2944, 1, 1280]
    - [19, 6.973]
  - - [6784, 1, 1, 1]
    - [50, 0.001]
  - - [1408, 64, 1, 1280]
    - [13, 2.399]
  - - [1, 256, 1, 1280]
    - [53, 0.002]
  - - [2944, 3584, 1, 256]
    - [19, 7.177]
  - - [1, 128, 1, 1280]
    - [53, 0.001]
  - - [1024, 256, 1, 32]
    - [31, 0.454]
  - - [5888, 1, 1, 1280]
    - [52, 0.029]
  - - [2368, 32, 1, 1280]
    - [35, 0.598]
  - - [5888, 1856, 1, 1]
    - [36, 0.152]
  - - [6784, 128, 1, 1280]
    - [10, 5.34]
  - - [6784, 2368, 1, 3328]
    - [19, 7.495]
  - - [1, 64, 1, 256]
    - [52, 0.0]
  - - [704, 128, 1, 1]
    - [44, 0.006]
  - - [1408, 4288, 1, 32]
    - [22, 2.36]
  - - [256, 64, 1, 1280]
    - [11, 0.51]
  - - [256, 448, 1, 256]
    - [1, 2.006]
  - - [1856, 1024, 1, 1280]
    - [21, 6.397]
  - - [5888, 1856, 1, 256]
    - [19, 7.116]
  - - [5056, 1856, 1, 1]
    - [37, 0.165]
  - - [5888, 2368, 1, 256]
    - [19, 7.122]
  - - [1408, 1024, 1, 32]
    - [26, 1.459]
  - - [32, 704, 1, 256]
    - [35, 0.117]
  - - [2944, 1, 1, 256]
    - [52, 0.014]
  - - [32, 4288, 1, 256]
    - [31, 0.593]
  - - [5056, 1856, 1, 32]
    - [22, 2.437]
  - - [5056, 1856, 1, 1280]
    - [19, 7.422]
  - - [1, 64, 1, 1]
    - [37, 0.0]
  - - [1408, 5888, 1, 3328]
    - [19, 7.561]
  - - [1408, 704, 1, 3328]
    - [16, 6.148]
  - - [5056, 704, 1, 3328]
    - [19, 7.06]
  - - [704, 64, 1, 1280]
    - [13, 1.377]
  - - [1, 704, 1, 1280]
    - [53, 0.005]
  - - [5888, 6784, 1, 1]
    - [36, 0.198]
  - - [5888, 4288, 1, 32]
    - [22, 2.782]
  - - [1408, 3584, 1, 256]
    - [19, 6.842]
  - - [1856, 704, 1, 1]
    - [39, 0.069]
  - - [6784, 256, 1, 1]
    - [42, 0.086]
  - - [2944, 1, 1, 1]
    - [37, 0.0]
  - - [256, 1856, 1, 3328]
    - [15, 5.207]
  - - [4288, 128, 1, 1280]
    - [8, 4.244]
  - - [6784, 256, 1, 1280]
    - [19, 6.453]
  - - [128, 4288, 1, 256]
    - [10, 3.822]
  - - [128, 128, 1, 32]
    - [31, 0.032]
  - - [128, 1408, 1, 32]
    - [30, 0.249]
  - - [6784, 128, 1, 32]
    - [30, 1.136]
  - - [1408, 448, 1, 1]
    - [39, 0.04]
  - - [2368, 704, 1, 3328]
    - [19, 6.393]
  - - [704, 128, 1, 3328]
    - [13, 2.589]
  - - [2944, 1856, 1, 32]
    - [22, 2.229]
  - - [1024, 64, 1, 1]
    - [37, 0.004]
  - - [1408, 32, 1, 1280]
    - [35, 0.352]
  - - [704, 1, 1, 256]
    - [52, 0.003]
  - - [2368, 1408, 1, 256]
    - [19, 6.712]
  - - [2368, 1856, 1, 1]
    - [37, 0.132]
  - - [4288, 1408, 1, 1]
    - [50, 0.14]
  - - [3584, 2368, 1, 1280]
    - [19, 7.452]
  - - [64, 5056, 1, 1280]
    - [6, 3.685]
  - - [1408, 2944, 1, 1]
    - [36, 0.13]
  - - [4288, 1408, 1, 32]
    - [22, 2.373]
  - - [5888, 2944, 1, 256]
    - [19, 7.165]
  - - [128, 64, 1, 1280]
    - [3, 0.244]
  - - [1408, 2944, 1, 32]
    - [22, 2.166]
  - - [1, 3584, 1, 1280]
    - [53, 0.025]
  - - [64, 64, 1, 32]
    - [24, 0.006]
  - - [448, 1408, 1, 32]
    - [31, 0.9]
  - - [128, 5056, 1, 256]
    - [19, 4.43]
  - - [1, 1, 1, 1280]
    - [53, 0.0]
  - - [64, 704, 1, 256]
    - [3, 0.947]
  - - [5888, 6784, 1, 256]
    - [19, 7.294]
  - - [6784, 5888, 1, 1]
    - [36, 0.197]
  - - [64, 4288, 1, 256]
    - [1, 2.822]
  - - [1, 448, 1, 1280]
    - [53, 0.003]
  - - [1024, 1024, 1, 1]
    - [37, 0.059]
  - - [6784, 5888, 1, 1280]
    - [17, 7.47]
  - - [1024, 4288, 1, 32]
    - [30, 2.117]
  - - [1856, 1, 1, 1280]
    - [53, 0.013]
  - - [3584, 5888, 1, 256]
    - [19, 7.354]
  - - [5056, 2368, 1, 1]
    - [43, 0.16]
  - - [256, 1408, 1, 1280]
    - [15, 3.831]
  - - [64, 256, 1, 32]
    - [24, 0.025]
  - - [64, 5888, 1, 3328]
    - [5, 4.238]
  - - [6784, 64, 1, 3328]
    - [15, 4.75]
  - - [5056, 448, 1, 1]
    - [37, 0.098]
  - - [2944, 448, 1, 3328]
    - [19, 5.816]
  - - [2368, 1024, 1, 1280]
    - [19, 6.641]
  - - [1856, 6784, 1, 256]
    - [19, 7.217]
  - - [4288, 32, 1, 1280]
    - [35, 0.744]
  - - [448, 1408, 1, 1280]
    - [19, 4.856]
  - - [5056, 448, 1, 32]
    - [30, 1.726]
  - - [3584, 2944, 1, 32]
    - [22, 2.616]
  - - [2368, 128, 1, 1]
    - [44, 0.019]
  - - [32, 128, 1, 1280]
    - [35, 0.032]
  - - [3584, 1856, 1, 32]
    - [22, 2.346]
  - - [128, 128, 1, 3328]
    - [11, 0.549]
  - - [5056, 64, 1, 256]
    - [5, 3.005]
  - - [64, 448, 1, 3328]
    - [11, 0.97]
  - - [4288, 1408, 1, 1280]
    - [19, 7.221]
  - - [6784, 2368, 1, 1]
    - [46, 0.175]
  - - [32, 5056, 1, 256]
    - [35, 0.719]
  - - [704, 128, 1, 256]
    - [7, 1.599]
  - - [704, 5056, 1, 1]
    - [42, 0.122]
  - - [256, 1024, 1, 32]
    - [33, 0.411]
  - - [256, 1024, 1, 1280]
    - [15, 4.349]
  - - [2368, 128, 1, 256]
    - [10, 2.815]
  - - [32, 64, 1, 256]
    - [31, 0.011]
  - - [2368, 1408, 1, 1280]
    - [19, 7.14]
  - - [128, 256, 1, 32]
    - [24, 0.05]
  - - [64, 6784, 1, 32]
    - [31, 0.681]
  - - [6784, 32, 1, 256]
    - [35, 0.947]
  - - [256, 4288, 1, 1]
    - [38, 0.062]
  - - [5888, 1408, 1, 1]
    - [41, 0.142]
  - - [1024, 4288, 1, 1280]
    - [19, 7.314]
  - - [1856, 4288, 1, 1]
    - [37, 0.158]
  - - [128, 2944, 1, 256]
    - [10, 3.42]
  - - [3584, 4288, 1, 256]
    - [19, 7.289]
  - - [2368, 2944, 1, 256]
    - [19, 7.074]
  - - [3584, 128, 1, 32]
    - [26, 0.712]
  - - [3584, 128, 1, 3328]
    - [15, 5.013]
  - - [704, 5056, 1, 256]
    - [19, 6.657]
  - - [1856, 4288, 1, 32]
    - [22, 2.465]
  - - [64, 256, 1, 1280]
    - [11, 0.512]
  - - [4288, 1024, 1, 1280]
    - [19, 7.301]
  - - [1, 4288, 1, 256]
    - [52, 0.018]
  - - [64, 2368, 1, 1]
    - [44, 0.009]
  - - [4288, 6784, 1, 32]
    - [22, 2.766]
  - - [704, 704, 1, 3328]
    - [19, 5.323]
  - - [128, 2944, 1, 1]
    - [50, 0.027]
  - - [3584, 1408, 1, 256]
    - [21, 6.803]
  - - [704, 3584, 1, 3328]
    - [19, 6.983]
  - - [5056, 448, 1, 1280]
    - [19, 6.693]
  - - [1408, 2944, 1, 1280]
    - [19, 7.307]
  - - [5888, 704, 1, 1280]
    - [19, 7.165]
  - - [64, 64, 1, 256]
    - [3, 0.078]
  - - [704, 1408, 1, 1280]
    - [9, 6.04]
  - - [4288, 5888, 1, 256]
    - [19, 7.343]
  - - [6784, 64, 1, 32]
    - [27, 0.688]
  - - [3584, 3584, 1, 3328]
    - [19, 7.706]
  - - [2944, 6784, 1, 32]
    - [22, 2.736]
  - - [448, 64, 1, 32]
    - [24, 0.043]
  - - [5056, 256, 1, 1]
    - [38, 0.07]
  - - [64, 6784, 1, 1280]
    - [15, 4.574]
  - - [2944, 2368, 1, 3328]
    - [19, 7.498]
  - - [1, 4288, 1, 1]
    - [50, 0.0]
  - - [1408, 128, 1, 256]
    - [8, 2.347]
  - - [1024, 1856, 1, 1280]
    - [21, 6.4]
  - - [448, 5888, 1, 256]
    - [19, 6.165]
  - - [1024, 5888, 1, 256]
    - [19, 7.088]
  - - [704, 1408, 1, 256]
    - [19, 5.325]
  - - [6784, 2944, 1, 3328]
    - [19, 7.52]
  - - [1408, 2368, 1, 256]
    - [19, 6.668]
  - - [64, 128, 1, 1280]
    - [3, 0.245]
  - - [5888, 32, 1, 3328]
    - [35, 1.06]
  - - [1408, 5056, 1, 256]
    - [19, 7.013]
  - - [1024, 1408, 1, 32]
    - [30, 1.411]
  - - [4288, 128, 1, 32]
    - [24, 0.81]
  - - [6784, 704, 1, 1]
    - [37, 0.135]
  - - [448, 704, 1, 256]
    - [19, 2.895]
  - - [704, 3584, 1, 32]
    - [22, 1.834]
  - - [1856, 256, 1, 3328]
    - [15, 5.214]
  - - [448, 1024, 1, 1280]
    - [19, 4.787]
  - - [4288, 4288, 1, 1]
    - [37, 0.179]
  - - [5056, 2944, 1, 1]
    - [37, 0.179]
  - - [64, 2368, 1, 3328]
    - [11, 3.224]
  - - [256, 704, 1, 3328]
    - [15, 3.171]
  - - [1, 2944, 1, 1]
    - [42, 0.0]
  - - [1024, 1024, 1, 256]
    - [19, 5.658]
  - - [3584, 1, 1, 1]
    - [37, 0.0]
  - - [256, 2944, 1, 32]
    - [30, 0.994]
  - - [6784, 4288, 1, 3328]
    - [18, 7.541]
  - - [5056, 2944, 1, 3328]
    - [18, 7.335]
  - - [704, 1024, 1, 1280]
    - [19, 5.539]
  - - [256, 3584, 1, 1280]
    - [19, 5.573]
  - - [2368, 1856, 1, 3328]
    - [19, 7.378]
  - - [1856, 4288, 1, 1280]
    - [19, 7.438]
  - - [1, 1024, 1, 256]
    - [52, 0.005]
  - - [3584, 448, 1, 1]
    - [48, 0.078]
  - - [2944, 1024, 1, 3328]
    - [19, 7.041]
  - - [32, 1408, 1, 3328]
    - [35, 0.379]
  - - [128, 1, 1, 3328]
    - [53, 0.001]
  - - [5888, 5056, 1, 32]
    - [22, 2.774]
  - - [704, 2944, 1, 1]
    - [44, 0.093]
  - - [3584, 448, 1, 32]
    - [30, 1.507]
  - - [3584, 448, 1, 1280]
    - [19, 6.06]
  - - [2944, 6784, 1, 3328]
    - [19, 7.675]
  - - [1856, 2368, 1, 1280]
    - [19, 7.314]
  - - [6784, 1024, 1, 1280]
    - [19, 7.278]
  - - [6784, 3584, 1, 1280]
    - [19, 7.55]
  - - [1, 5056, 1, 3328]
    - [52, 0.026]
  - - [128, 128, 1, 1]
    - [52, 0.001]
  - - [128, 2368, 1, 32]
    - [31, 0.516]
  - - [128, 1408, 1, 3328]
    - [11, 3.513]
  - - [2944, 32, 1, 3328]
    - [35, 0.79]
  - - [704, 1856, 1, 256]
    - [19, 5.873]
  - - [1408, 1408, 1, 1]
    - [37, 0.09]
  - - [1408, 4288, 1, 256]
    - [19, 6.891]
  - - [256, 5056, 1, 3328]
    - [19, 6.645]
  - - [2368, 64, 1, 1280]
    - [13, 3.036]
  - - [1856, 448, 1, 32]
    - [30, 1.073]
  - - [1408, 448, 1, 256]
    - [19, 4.281]
  - - [32, 128, 1, 256]
    - [31, 0.02]
  - - [448, 1024, 1, 1]
    - [42, 0.029]
  - - [128, 1024, 1, 1280]
    - [11, 3.278]
  - - [448, 6784, 1, 1]
    - [37, 0.115]
  - - [704, 2944, 1, 256]
    - [19, 6.309]
  - - [1408, 1408, 1, 256]
    - [21, 6.217]
  - - [448, 6784, 1, 32]
    - [30, 1.854]
  - - [1, 64, 1, 1280]
    - [53, 0.0]
  - - [1408, 1856, 1, 1]
    - [42, 0.105]
  - - [4288, 448, 1, 32]
    - [30, 1.598]
  - - [4288, 448, 1, 1280]
    - [19, 6.41]
  - - [2944, 704, 1, 32]
    - [26, 1.677]
  - - [1024, 704, 1, 256]
    - [19, 4.771]
  - - [448, 4288, 1, 1]
    - [37, 0.09]
  - - [3584, 5056, 1, 1]
    - [37, 0.183]
  - - [1408, 3584, 1, 1280]
    - [19, 7.193]
  - - [6784, 448, 1, 1280]
    - [19, 6.889]
  - - [3584, 5056, 1, 3328]
    - [19, 7.655]
  - - [2368, 2368, 1, 32]
    - [22, 2.332]
  - - [64, 5888, 1, 32]
    - [31, 0.617]
  - - [1856, 448, 1, 256]
    - [19, 4.622]
  - - [128, 1024, 1, 256]
    - [11, 2.136]
  - - [3584, 64, 1, 3328]
    - [15, 4.02]
  - - [5888, 2944, 1, 32]
    - [22, 2.716]
  - - [2944, 1, 1, 1280]
    - [53, 0.02]
  - - [1856, 2944, 1, 32]
    - [22, 2.298]
  - - [5056, 1408, 1, 1]
    - [42, 0.153]
  - - [5888, 1408, 1, 3328]
    - [19, 7.408]
  - - [448, 4288, 1, 256]
    - [19, 5.923]
  - - [6784, 1024, 1, 1]
    - [43, 0.154]
  - - [256, 448, 1, 1]
    - [44, 0.007]
  - - [128, 5888, 1, 3328]
    - [19, 5.917]
  - - [6784, 1024, 1, 32]
    - [22, 2.43]
  - - [256, 448, 1, 32]
    - [26, 0.168]
  - - [6784, 3584, 1, 1]
    - [42, 0.189]
  - - [2944, 2368, 1, 32]
    - [22, 2.359]
  - - [3584, 6784, 1, 3328]
    - [19, 7.748]
  - - [448, 128, 1, 1280]
    - [13, 1.743]
  - - [64, 3584, 1, 32]
    - [24, 0.297]
  - - [64, 3584, 1, 1280]
    - [15, 3.827]
  - - [6784, 1408, 1, 256]
    - [19, 7.045]
  - - [5056, 1024, 1, 32]
    - [26, 2.218]
  - - [1024, 5056, 1, 1280]
    - [19, 7.386]
  - - [4288, 3584, 1, 256]
    - [19, 7.311]
  - - [2368, 256, 1, 3328]
    - [19, 4.763]
  - - [448, 6784, 1, 1280]
    - [19, 7.015]
  - - [1856, 5888, 1, 1]
    - [42, 0.169]
  - - [256, 5888, 1, 32]
    - [22, 1.48]
  - - [3584, 1, 1, 3328]
    - [53, 0.027]
  - - [4288, 32, 1, 256]
    - [35, 0.623]
  - - [256, 64, 1, 1]
    - [44, 0.001]
  - - [4288, 5056, 1, 32]
    - [22, 2.752]
  - - [4288, 5056, 1, 3328]
    - [19, 7.725]
  - - [1856, 5888, 1, 32]
    - [22, 2.589]
  - - [1856, 5888, 1, 1280]
    - [19, 7.586]
  - - [256, 256, 1, 1280]
    - [11, 1.943]
  - - [704, 2368, 1, 1280]
    - [19, 6.303]
  - - [4288, 2368, 1, 1280]
    - [19, 7.571]
  - - [2944, 5056, 1, 256]
    - [19, 7.33]
  - - [32, 1856, 1, 256]
    - [31, 0.293]
  - - [64, 5888, 1, 1280]
    - [10, 4.122]
  - - [1, 1856, 1, 1280]
    - [53, 0.013]
  - - [2944, 4288, 1, 1]
    - [43, 0.174]
  - - [5056, 5888, 1, 32]
    - [22, 2.788]
  - - [704, 1, 1, 3328]
    - [53, 0.005]
  - - [448, 256, 1, 1280]
    - [13, 2.838]
  - - [1408, 256, 1, 1]
    - [44, 0.024]
  - - [2368, 5056, 1, 3328]
    - [19, 7.65]
  - - [1024, 5056, 1, 3328]
    - [19, 7.451]
  - - [704, 704, 1, 1280]
    - [19, 5.162]
  - - [128, 32, 1, 3328]
    - [35, 0.035]
  - - [1024, 6784, 1, 32]
    - [22, 2.324]
  - - [3584, 2944, 1, 3328]
    - [19, 7.549]
  - - [128, 1856, 1, 256]
    - [4, 3.093]
  - - [32, 32, 1, 1280]
    - [35, 0.008]
  - - [1408, 5888, 1, 1]
    - [41, 0.148]
  - - [1, 3584, 1, 256]
    - [53, 0.02]
  - - [704, 4288, 1, 32]
    - [22, 1.97]
  - - [1408, 5888, 1, 32]
    - [22, 2.528]
  - - [6784, 1024, 1, 3328]
    - [19, 7.329]
  - - [1856, 1, 1, 3328]
    - [53, 0.014]
  - - [5056, 1408, 1, 256]
    - [19, 6.888]
  - - [1, 1, 1, 256]
    - [52, 0.0]
  - - [2944, 1408, 1, 256]
    - [19, 6.877]
  - - [4288, 1, 1, 1]
    - [44, 0.0]
  - - [2368, 2368, 1, 256]
    - [19, 6.935]
  - - [1, 448, 1, 256]
    - [52, 0.002]
  - - [1408, 6784, 1, 1]
    - [36, 0.157]
  - - [3584, 32, 1, 3328]
    - [35, 0.997]
  - - [128, 3584, 1, 1]
    - [44, 0.032]
  - - [1856, 1, 1, 256]
    - [52, 0.009]
  - - [6784, 6784, 1, 1280]
    - [19, 7.584]
  - - [1024, 5888, 1, 1]
    - [36, 0.127]
  - - [6784, 32, 1, 3328]
    - [35, 1.21]
  - - [1408, 32, 1, 256]
    - [31, 0.237]
  - - [128, 3584, 1, 32]
    - [30, 0.708]
  - - [1856, 3584, 1, 256]
    - [19, 7.014]
  - - [2944, 64, 1, 256]
    - [4, 2.453]
  - - [2368, 704, 1, 32]
    - [26, 1.508]
  - - [256, 5888, 1, 1280]
    - [19, 6.528]
  - - [448, 2368, 1, 32]
    - [30, 1.107]
  - - [448, 2368, 1, 3328]
    - [19, 5.465]
  - - [64, 1408, 1, 256]
    - [3, 1.674]
  - - [5056, 32, 1, 32]
    - [24, 0.299]
  - - [1024, 704, 1, 3328]
    - [19, 5.655]
  - - [32, 5888, 1, 3328]
    - [35, 1.055]
  - - [256, 64, 1, 3328]
    - [11, 0.553]
  - - [32, 1408, 1, 1280]
    - [35, 0.357]
  - - [64, 32, 1, 256]
    - [31, 0.011]
  - - [1856, 1024, 1, 3328]
    - [21, 6.497]
  - - [2368, 1, 1, 1]
    - [42, 0.0]
  - - [5056, 2368, 1, 3328]
    - [19, 7.495]
  - - [128, 1, 1, 1280]
    - [53, 0.001]
  - - [704, 4288, 1, 1280]
    - [19, 6.978]
  - - [704, 256, 1, 256]
    - [8, 2.261]
  - - [512, 128, 1, 784]
    - [425, 3.339]
  - - [1024, 256, 1, 196]
    - [415, 5.284]
  - - [256, 64, 1, 3136]
    - [423, 3.435]
  - - [256, 1024, 1, 196]
    - [420, 5.284]
  - - [64, 256, 1, 3136]
    - [429, 3.41]
  - - [128, 512, 1, 784]
    - [418, 3.339]
  - - [64, 64, 1, 3136]
    - [429, 0.841]
  - - [2560, 7000, 1, 2560]
    - [69, 12.082]
  - - [7680, 12000, 1, 2560]
    - [69, 13.04]
  - - [5124, 9124, 1, 1760]
    - [67, 12.552]
  - - [1760, 32, 1, 1760]
    - [57, 1.541]
  - - [512, 24000, 1, 1536]
    - [69, 11.7]
  - - [3072, 24000, 1, 1024]
    - [69, 11.963]
  - - [2048, 400, 1, 512]
    - [70, 6.414]
  - - [2560, 128, 1, 2560]
    - [61, 4.81]
  - - [3072, 16, 1, 1024]
    - [62, 1.04]
  - - [512, 48000, 1, 2816]
    - [69, 12.758]
  - - [512, 48000, 1, 2048]
    - [70, 10.232]
  - - [1760, 64, 1, 1760]
    - [57, 2.978]
  - - [2048, 1600, 1, 2048]
    - [70, 6.088]
  - - [512, 48000, 1, 1536]
    - [69, 12.287]
  - - [2560, 32, 1, 2560]
    - [57, 2.186]
  - - [8448, 5984, 1, 2816]
    - [69, 12.759]
  - - [4096, 3200, 1, 1024]
    - [70, 10.152]
  - - [1024, 24000, 1, 2560]
    - [69, 12.402]
  - - [1760, 6400, 1, 1760]
    - [67, 12.673]
  - - [5124, 9124, 1, 2048]
    - [70, 10.267]
  - - [1024, 700, 1, 512]
    - [66, 5.469]
  - - [4608, 32, 1, 1536]
    - [57, 3.322]
  - - [3072, 64, 1, 1024]
    - [62, 3.015]
  - - [16384, 3200, 1, 4096]
    - [70, 10.63]
  - - [2560, 16, 1, 2560]
    - [61, 1.129]
  - - [1024, 48000, 1, 2560]
    - [69, 12.882]
  - - [8448, 48000, 1, 2816]
    - [69, 11.709]
  - - [2048, 32, 1, 2048]
    - [59, 1.215]
  - - [2560, 3200, 1, 2560]
    - [69, 11.639]
  - - [16384, 800, 1, 4096]
    - [70, 8.686]
  - - [4608, 24000, 1, 1536]
    - [69, 12.921]
  - - [7680, 48000, 1, 2560]
    - [69, 12.276]
  - - [3072, 48000, 1, 1024]
    - [69, 12.454]
  - - [1760, 16, 1, 1760]
    - [59, 0.734]
  - - [8192, 3200, 1, 2048]
    - [70, 10.168]
  - - [512, 24000, 1, 2816]
    - [69, 12.625]
  - - [4096, 400, 1, 1024]
    - [70, 7.625]
  - - [6144, 48000, 1, 2560]
    - [69, 13.067]
  - - [4608, 48000, 1, 1536]
    - [69, 13.057]
  - - [4096, 128, 1, 4096]
    - [62, 3.428]
  - - [2048, 800, 1, 512]
    - [69, 7.788]
  - - [4608, 5984, 1, 1536]
    - [69, 12.254]
  - - [4096, 1600, 1, 1024]
    - [70, 9.132]
  - - [6144, 5984, 1, 2048]
    - [70, 10.445]
  - - [7680, 24000, 1, 2560]
    - [69, 12.975]
  - - [6144, 48000, 1, 2048]
    - [70, 11.058]
  - - [2048, 3200, 1, 2048]
    - [70, 8.487]
  - - [5124, 9124, 1, 2560]
    - [69, 12.325]
  - - [1024, 24000, 1, 1536]
    - [69, 12.236]
  - - [7680, 16, 1, 2560]
    - [59, 2.186]
  - - [2560, 6400, 1, 2560]
    - [69, 12.244]
  - - [2048, 128, 1, 2048]
    - [59, 2.63]
  - - [512, 16, 1, 500000]
    - [59, 0.23]
  - - [1024, 8, 1, 500000]
    - [57, 0.231]
  - - [512, 24000, 1, 2560]
    - [69, 12.043]
  - - [1024, 24000, 1, 2816]
    - [69, 12.737]
  - - [7680, 5984, 1, 2560]
    - [69, 12.764]
  - - [2048, 1600, 1, 512]
    - [70, 7.866]
  - - [2048, 7000, 1, 2048]
    - [70, 9.591]
  - - [1760, 800, 1, 1760]
    - [64, 8.65]
  - - [4096, 64, 1, 4096]
    - [59, 2.672]
  - - [7680, 32, 1, 2560]
    - [59, 4.317]
  - - [2560, 64, 1, 2560]
    - [61, 3.933]
  - - [3072, 128, 1, 1024]
    - [62, 3.841]
  - - [7680, 64, 1, 2560]
    - [66, 4.992]
  - - [1760, 128, 1, 1760]
    - [57, 5.19]
  - - [2560, 1600, 1, 2560]
    - [69, 9.133]
  - - [2048, 3200, 1, 512]
    - [70, 9.263]
  - - [2560, 800, 1, 2560]
    - [69, 7.858]
  - - [3072, 32, 1, 1024]
    - [59, 2.004]
  - - [6144, 32, 1, 2560]
    - [57, 4.009]
  - - [4608, 12000, 1, 1536]
    - [69, 12.701]
  - - [4096, 32, 1, 4096]
    - [63, 1.746]
  - - [6144, 24000, 1, 2048]
    - [70, 10.943]
  - - [8192, 800, 1, 2048]
    - [70, 7.666]
  - - [5124, 9124, 1, 4096]
    - [70, 10.35]
  - - [8448, 24000, 1, 2816]
    - [69, 12.94]
  - - [1024, 48000, 1, 1536]
    - [69, 12.669]
  - - [7680, 128, 1, 2560]
    - [66, 8.749]
  - - [8192, 1600, 1, 2048]
    - [70, 9.136]
  - - [4096, 800, 1, 1024]
    - [70, 7.802]
  - - [1024, 16, 1, 500000]
    - [59, 0.46]
  - - [2048, 800, 1, 2048]
    - [68, 5.62]
  - - [1760, 3200, 1, 1760]
    - [67, 11.354]
  - - [512, 48000, 1, 2560]
    - [69, 12.509]
  - - [8448, 16, 1, 2816]
    - [58, 2.552]
  - - [2048, 64, 1, 2048]
    - [59, 2.169]
  - - [512, 24000, 1, 2048]
    - [70, 9.372]
  - - [16384, 1600, 1, 4096]
    - [70, 9.853]
  - - [4608, 16, 1, 1536]
    - [57, 1.685]
  - - [1024, 24000, 1, 2048]
    - [70, 10.192]
  - - [8192, 400, 1, 2048]
    - [70, 6.087]
  - - [2048, 6400, 1, 2048]
    - [70, 9.487]
  - - [6144, 12000, 1, 2048]
    - [70, 10.796]
  - - [512, 8, 1, 500000]
    - [57, 0.116]
  - - [1760, 7000, 1, 1760]
    - [67, 11.811]
  - - [1024, 48000, 1, 2816]
    - [69, 13.051]
  - - [6144, 16, 1, 2560]
    - [61, 2.077]
  - - [8448, 32, 1, 2816]
    - [61, 4.543]
  - - [4096, 7000, 1, 4096]
    - [70, 10.357]
  - - [4096, 16, 1, 4096]
    - [60, 0.885]
  - - [6144, 24000, 1, 2560]
    - [69, 12.895]
  - - [2048, 16, 1, 2048]
    - [62, 0.643]
  - - [8448, 12000, 1, 2816]
    - [69, 12.941]
  - - [16384, 400, 1, 4096]
    - [70, 7.144]
  - - [1760, 1600, 1, 1760]
    - [65, 11.099]
  - - [1024, 48000, 1, 2048]
    - [70, 10.643]
  - - [4096, 4096, 1, 4096]
    - [195, 86.777]
  - - [512, 512, 1, 512]
    - [193, 16.527]
  - - [1024, 1024, 1, 1024]
    - [196, 46.956]
  - - [2049, 512, 1, 2048]
    - [73, 1.632]
  - - [2048, 2048, 1, 2049]
    - [74, 2.544]
  - - [1023, 512, 1, 1024]
    - [73, 1.106]
  - - [8192, 8191, 1, 8192]
    - [74, 3.027]
  - - [511, 512, 1, 512]
    - [73, 0.707]
  - - [1024, 512, 1, 1025]
    - [73, 1.104]
  - - [8192, 8192, 1, 8192]
    - [194, 92.464]
  - - [1024, 1024, 1, 1023]
    - [73, 1.637]
  - - [1024, 1025, 1, 1024]
    - [73, 1.63]
  - - [512, 512, 1, 511]
    - [73, 0.744]
  - - [2047, 2048, 1, 2048]
    - [73, 2.361]
  - - [1024, 1023, 1, 1024]
    - [73, 1.629]
  - - [2048, 511, 1, 2048]
    - [73, 1.639]
  - - [2048, 2049, 1, 2048]
    - [74, 2.373]
  - - [8192, 8192, 1, 8191]
    - [76, 3.088]
  - - [2047, 512, 1, 2048]
    - [73, 1.641]
  - - [1025, 1024, 1, 1024]
    - [77, 1.467]
  - - [3072, 513, 1, 3072]
    - [74, 2.327]
  - - [512, 513, 1, 512]
    - [73, 0.726]
  - - [512, 511, 1, 512]
    - [73, 0.722]
  - - [8191, 8192, 1, 8192]
    - [76, 2.89]
  - - [8192, 8193, 1, 8192]
    - [74, 3.099]
  - - [4096, 4097, 1, 4096]
    - [73, 2.525]
  - - [8192, 8192, 1, 8193]
    - [76, 3.117]
  - - [4096, 4095, 1, 4096]
    - [76, 2.688]
  - - [4096, 4096, 1, 4097]
    - [74, 2.977]
  - - [1024, 1024, 1, 1025]
    - [73, 1.637]
  - - [513, 512, 1, 512]
    - [73, 0.728]
  - - [2048, 2048, 1, 2048]
    - [349, 79.908]
  - - [4095, 4096, 1, 4096]
    - [76, 2.721]
  - - [8193, 8192, 1, 8192]
    - [74, 3.062]
  - - [4096, 4096, 1, 4095]
    - [74, 2.911]
  - - [1025, 512, 1, 1024]
    - [73, 1.111]
  - - [1024, 512, 1, 1023]
    - [74, 1.101]
  - - [2048, 513, 1, 2048]
    - [73, 1.604]
  - - [3072, 511, 1, 3072]
    - [74, 2.327]
  - - [2049, 2048, 1, 2048]
    - [74, 2.516]
  - - [2048, 2047, 1, 2048]
    - [74, 2.516]
  - - [1024, 511, 1, 1024]
    - [77, 1.094]
  - - [2048, 512, 1, 2047]
    - [73, 1.634]
  - - [2048, 2048, 1, 2047]
    - [74, 2.523]
  - - [4097, 4096, 1, 4096]
    - [74, 2.935]
  - - [1024, 513, 1, 1024]
    - [73, 1.111]
  - - [512, 512, 1, 513]
    - [73, 0.733]
  - - [2048, 512, 1, 2049]
    - [73, 1.621]
  - - [1023, 1024, 1, 1024]
    - [73, 1.63]
  - - [14, 14, 1, 64]
    - [88, 0.001]
  - - [15, 14, 1, 64]
    - [87, 0.001]
  - - [15, 15, 1, 64]
    - [87, 0.001]
  - - [15, 15, 1, 64]
    - [87, 0.001]
  - - [17, 15, 1, 64]
    - [90, 0.002]
  - - [17, 17, 1, 64]
    - [88, 0.002]
  - - [17, 17, 1, 64]
    - [88, 0.002]
  - - [21, 17, 1, 64]
    - [91, 0.003]
  - - [21, 21, 1, 64]
    - [87, 0.003]
  - - [24, 24, 1, 64]
    - [90, 0.004]
  - - [30, 30, 1, 64]
    - [90, 0.007]
  - - [30, 31, 1, 64]
    - [90, 0.007]
  - - [31, 31, 1, 64]
    - [89, 0.007]
  - - [32, 32, 1, 64]
    - [90, 0.007]
  - - [32, 35, 1, 64]
    - [90, 0.008]
  - - [34, 24, 1, 64]
    - [89, 0.006]
  - - [34, 34, 1, 64]
    - [90, 0.008]
  - - [35, 35, 1, 64]
    - [90, 0.009]
  - - [27, 27, 1, 64]
    - [89, 0.005]
  - - [27, 33, 1, 64]
    - [90, 0.007]
  - - [33, 33, 1, 64]
    - [81, 0.008]
  - - [2, 4, 1, 1024]
    - [478, 0.001]
  - - [2, 32, 1, 1024]
    - [258, 0.01]
  - - [2, 2048, 1, 1024]
    - [212, 0.654]
  - - [64, 128, 512, 128]
    - [365, 20.507]
  - - [64, 512, 1, 512]
    - [249, 2.661]
  - - [64, 512, 64, 512]
    - [213, 29.468]
  - - [128, 128, 512, 64]
    - [366, 19.104]
  - - [512, 512, 1, 64]
    - [250, 4.618]
  - - [512, 512, 64, 64]
    - [211, 30.266]
  - - [1024, 4, 1, 1024]
    - [212, 0.633]
  - - [1024, 4, 1, 1024]
    - [212, 0.633]
  - - [1024, 32, 1, 1024]
    - [236, 3.451]
  - - [1024, 2048, 1, 1024]
    - [356, 54.463]
  - - [1024, 2048, 1, 4096]
    - [214, 61.694]
  - - [1024, 4096, 1, 1024]
    - [237, 68.943]
  - - [1024, 4096, 1, 4096]
    - [349, 74.398]
  - - [4096, 2048, 1, 1024]
    - [357, 65.892]
  - - [4096, 4096, 1, 1024]
    - [210, 71.297]
  - - [30528, 2048, 1, 1024]
    - [240, 82.458]
  - - [30528, 4096, 1, 1024]
    - [367, 85.153]
  - - [3, 3, 512, 64]
    - [310, 0.099]
  - - [5, 5, 512, 64]
    - [310, 0.274]
  - - [5, 5, 960, 64]
    - [345, 0.449]
  - - [9, 9, 512, 64]
    - [311, 0.856]
  - - [27, 27, 32768, 128]
    - [483, 8.499]
  - - [32, 1600, 1, 512]
    - [236, 3.894]
  - - [33, 33, 1600, 32]
    - [346, 3.345]
  - - [64, 512, 1, 1024]
    - [256, 3.271]
  - - [64, 960, 1, 1024]
    - [260, 5.304]
  - - [128, 32768, 1, 256]
    - [362, 35.382]
  - - [256, 684, 1, 1024]
    - [260, 14.22]
  - - [256, 1280, 1, 1024]
    - [201, 23.434]
  - - [256, 1536, 1, 1024]
    - [261, 25.987]
  - - [256, 2304, 1, 1024]
    - [155, 29.135]
  - - [256, 2560, 1, 1024]
    - [259, 31.091]
  - - [256, 2816, 1, 1024]
    - [262, 33.864]
  - - [256, 3328, 1, 1024]
    - [263, 36.776]
  - - [256, 3584, 1, 1024]
    - [264, 39.252]
  - - [256, 4608, 1, 1024]
    - [192, 43.986]
  - - [256, 4864, 1, 1024]
    - [232, 43.549]
  - - [256, 5376, 1, 1024]
    - [265, 48.133]
  - - [256, 5888, 1, 1024]
    - [205, 47.359]
  - - [256, 6144, 1, 1024]
    - [266, 49.257]
  - - [256, 6400, 1, 1024]
    - [205, 50.811]
  - - [256, 6656, 1, 1024]
    - [267, 53.89]
  - - [256, 7168, 1, 1024]
    - [379, 57.467]
  - - [256, 7424, 1, 1024]
    - [379, 59.325]
  - - [256, 7936, 1, 1024]
    - [380, 54.382]
  - - [256, 8192, 1, 1024]
    - [135, 51.531]
  - - [256, 8448, 1, 1024]
    - [160, 51.942]
  - - [256, 8960, 1, 1024]
    - [381, 62.093]
  - - [256, 9984, 1, 1024]
    - [270, 50.921]
  - - [256, 10496, 1, 1024]
    - [382, 53.868]
  - - [256, 11264, 1, 1024]
    - [383, 55.488]
  - - [256, 11520, 1, 1024]
    - [271, 54.141]
  - - [256, 11776, 1, 1024]
    - [226, 54.611]
  - - [256, 12544, 1, 1024]
    - [226, 57.52]
  - - [256, 13312, 1, 1024]
    - [384, 60.032]
  - - [256, 14336, 1, 1024]
    - [385, 66.232]
  - - [256, 14592, 1, 1024]
    - [385, 67.671]
  - - [256, 14848, 1, 1024]
    - [385, 68.341]
  - - [256, 15104, 1, 1024]
    - [386, 69.781]
  - - [256, 16128, 1, 1024]
    - [387, 66.609]
  - - [256, 18176, 1, 1024]
    - [381, 60.42]
  - - [256, 18944, 1, 1024]
    - [388, 63.059]
  - - [256, 19200, 1, 1024]
    - [376, 76.589]
  - - [256, 20480, 1, 1024]
    - [204, 60.46]
  - - [256, 20992, 1, 1024]
    - [209, 62.046]
  - - [256, 21248, 1, 1024]
    - [204, 60.824]
  - - [256, 21504, 1, 1024]
    - [389, 61.773]
  - - [256, 22016, 1, 1024]
    - [390, 62.152]
  - - [256, 22344, 1, 1024]
    - [143, 61.521]
  - - [256, 23296, 1, 1024]
    - [274, 58.08]
  - - [256, 23552, 1, 1024]
    - [269, 58.54]
  - - [256, 31488, 1, 1024]
    - [391, 64.427]
  - - [256, 32768, 1, 512]
    - [204, 59.283]
  - - [256, 33536, 1, 1024]
    - [237, 64.832]
  - - [256, 44505, 1, 1024]
    - [392, 67.646]
  - - [512, 1600, 1, 512]
    - [259, 31.401]
  - - [512, 32768, 1, 13]
    - [226, 5.516]
  - - [512, 32768, 1, 1024]
    - [363, 71.013]
  - - [684, 8976, 1, 256]
    - [347, 39.861]
  - - [1024, 200, 1, 560]
    - [275, 10.627]
  - - [1024, 512, 1, 1024]
    - [200, 29.729]
  - - [1024, 512, 1, 1600]
    - [225, 33.984]
  - - [1024, 960, 1, 1024]
    - [192, 47.102]
  - - [1024, 960, 1, 1600]
    - [192, 48.901]
  - - [1024, 1600, 1, 560]
    - [257, 33.805]
  - - [1024, 1600, 1, 1024]
    - [231, 51.478]
  - - [1024, 32768, 1, 480]
    - [224, 80.003]
  - - [1024, 32768, 1, 1024]
    - [364, 79.434]
  - - [1280, 8976, 1, 256]
    - [276, 52.429]
  - - [1792, 8976, 1, 256]
    - [277, 56.67]
  - - [2048, 114, 1, 512]
    - [278, 13.642]
  - - [2048, 114, 1, 768]
    - [279, 16.78]
  - - [2048, 215, 1, 512]
    - [280, 20.484]
  - - [2048, 215, 1, 768]
    - [281, 23.617]
  - - [2048, 256, 1, 512]
    - [282, 25.121]
  - - [2048, 256, 1, 768]
    - [283, 28.121]
  - - [2048, 512, 1, 67]
    - [284, 7.645]
  - - [2048, 512, 1, 74]
    - [254, 8.443]
  - - [2048, 512, 1, 100]
    - [254, 10.117]
  - - [2048, 512, 1, 2048]
    - [253, 43.406]
  - - [2048, 684, 1, 512]
    - [266, 39.024]
  - - [2048, 684, 1, 768]
    - [285, 44.158]
  - - [2048, 960, 1, 74]
    - [286, 12.607]
  - - [2048, 960, 1, 2048]
    - [182, 59.435]
  - - [2048, 1536, 1, 512]
    - [393, 50.242]
  - - [2048, 1536, 1, 768]
    - [288, 57.972]
  - - [2048, 8976, 1, 256]
    - [276, 55.467]
  - - [2304, 8976, 1, 256]
    - [394, 57.88]
  - - [2560, 8976, 1, 256]
    - [276, 58.565]
  - - [2816, 8976, 1, 256]
    - [277, 59.956]
  - - [3072, 8976, 1, 256]
    - [276, 59.354]
  - - [3328, 8976, 1, 256]
    - [276, 60.342]
  - - [3840, 8976, 1, 256]
    - [277, 59.622]
  - - [4096, 8976, 1, 256]
    - [276, 56.498]
  - - [4352, 8976, 1, 256]
    - [395, 59.119]
  - - [4608, 8976, 1, 256]
    - [276, 59.407]
  - - [4864, 8976, 1, 256]
    - [276, 59.769]
  - - [5120, 8976, 1, 256]
    - [396, 59.321]
  - - [5376, 8976, 1, 256]
    - [367, 59.315]
  - - [5632, 8976, 1, 256]
    - [290, 59.339]
  - - [5888, 8976, 1, 256]
    - [239, 60.065]
  - - [6144, 8976, 1, 256]
    - [290, 59.3]
  - - [6400, 8976, 1, 256]
    - [367, 59.968]
  - - [7168, 8976, 1, 256]
    - [240, 60.974]
  - - [7936, 8976, 1, 256]
    - [240, 60.797]
  - - [8192, 8976, 1, 256]
    - [397, 60.144]
  - - [8448, 8976, 1, 256]
    - [397, 61.707]
  - - [8960, 8976, 1, 256]
    - [240, 60.954]
  - - [9472, 8976, 1, 256]
    - [240, 60.838]
  - - [9728, 8976, 1, 256]
    - [240, 62.389]
  - - [9984, 8976, 1, 256]
    - [240, 61.57]
  - - [10240, 8976, 1, 256]
    - [397, 61.959]
  - - [10496, 8976, 1, 256]
    - [240, 62.059]
  - - [11264, 8976, 1, 256]
    - [240, 62.364]
  - - [11776, 8976, 1, 256]
    - [397, 62.634]
  - - [12544, 8976, 1, 256]
    - [397, 62.441]
  - - [13312, 8976, 1, 256]
    - [240, 62.503]
  - - [13568, 8976, 1, 256]
    - [397, 62.611]
  - - [13824, 8976, 1, 256]
    - [240, 62.902]
  - - [15104, 8976, 1, 256]
    - [240, 63.326]
  - - [15360, 8976, 1, 256]
    - [239, 61.936]
  - - [15872, 8976, 1, 256]
    - [397, 62.637]
  - - [16128, 8976, 1, 256]
    - [240, 63.024]
  - - [17152, 8976, 1, 256]
    - [240, 62.888]
  - - [18176, 8976, 1, 256]
    - [240, 63.154]
  - - [18688, 8976, 1, 256]
    - [397, 63.477]
  - - [18944, 8976, 1, 256]
    - [240, 63.247]
  - - [19712, 8976, 1, 256]
    - [397, 63.022]
  - - [19968, 8976, 1, 256]
    - [240, 62.952]
  - - [20480, 8976, 1, 256]
    - [397, 62.744]
  - - [20992, 8976, 1, 256]
    - [397, 63.099]
  - - [21248, 8976, 1, 256]
    - [397, 63.215]
  - - [23552, 8976, 1, 256]
    - [397, 63.095]
  - - [28672, 8976, 1, 256]
    - [240, 63.655]
  - - [31488, 8976, 1, 256]
    - [397, 63.52]
  - - [33536, 8976, 1, 256]
    - [397, 63.893]
  - - [44505, 8976, 1, 256]
    - [477, 61.792]
  - - [14, 14, 10880, 64]
    - [311, 3.528]
  - - [15, 14, 10880, 64]
    - [311, 3.76]
  - - [15, 15, 7680, 64]
    - [336, 3.508]
  - - [15, 15, 10880, 64]
    - [311, 3.942]
  - - [17, 15, 7680, 64]
    - [337, 3.103]
  - - [17, 17, 7680, 64]
    - [338, 3.391]
  - - [21, 17, 6144, 64]
    - [337, 3.143]
  - - [21, 21, 6144, 64]
    - [339, 3.543]
  - - [24, 24, 4736, 64]
    - [247, 5.428]
  - - [30, 30, 2048, 64]
    - [481, 4.718]
  - - [30, 31, 2048, 64]
    - [481, 4.793]
  - - [31, 31, 2048, 64]
    - [482, 4.851]
  - - [32, 32, 4608, 64]
    - [377, 6.482]
  - - [32, 35, 4608, 64]
    - [378, 6.662]
  - - [34, 24, 4736, 64]
    - [341, 5.875]
  - - [34, 34, 4736, 64]
    - [342, 6.282]
  - - [35, 35, 4608, 64]
    - [343, 5.941]
  - - [1024, 3840, 1, 1024]
    - [244, 71.502]
  - - [1024, 3840, 1, 4096]
    - [244, 81.65]
  - - [1024, 3968, 1, 1024]
    - [371, 62.5]
  - - [1024, 3968, 1, 4096]
    - [371, 72.985]
  - - [1024, 6528, 1, 1024]
    - [367, 62.926]
  - - [1024, 6528, 1, 4096]
    - [134, 75.164]
  - - [1024, 7104, 1, 1024]
    - [245, 72.616]
  - - [1024, 7104, 1, 4096]
    - [245, 84.859]
  - - [1024, 7200, 1, 1024]
    - [243, 69.953]
  - - [1024, 7200, 1, 4096]
    - [146, 82.538]
  - - [1024, 8064, 1, 1024]
    - [372, 68.041]
  - - [1024, 8064, 1, 4096]
    - [237, 76.622]
  - - [1024, 8160, 1, 1024]
    - [373, 67.289]
  - - [1024, 8160, 1, 4096]
    - [241, 78.025]
  - - [1024, 9216, 1, 1024]
    - [374, 68.46]
  - - [1024, 9216, 1, 4096]
    - [375, 86.211]
  - - [1024, 9520, 1, 1024]
    - [246, 70.879]
  - - [1024, 9520, 1, 4096]
    - [242, 87.144]
  - - [1024, 10064, 1, 1024]
    - [243, 68.061]
  - - [1024, 10064, 1, 4096]
    - [243, 76.914]
  - - [1024, 10080, 1, 1024]
    - [243, 67.611]
  - - [1024, 10080, 1, 4096]
    - [370, 77.231]
  - - [1024, 10200, 1, 1024]
    - [367, 66.198]
  - - [1024, 10200, 1, 4096]
    - [219, 75.384]
  - - [4096, 3840, 1, 1024]
    - [187, 80.216]
  - - [4096, 3968, 1, 1024]
    - [215, 72.747]
  - - [4096, 6528, 1, 1024]
    - [367, 77.063]
  - - [4096, 7104, 1, 1024]
    - [219, 76.25]
  - - [4096, 7200, 1, 1024]
    - [238, 80.334]
  - - [4096, 8064, 1, 1024]
    - [219, 77.409]
  - - [4096, 8160, 1, 1024]
    - [238, 79.085]
  - - [4096, 9216, 1, 1024]
    - [370, 80.298]
  - - [4096, 9520, 1, 1024]
    - [376, 79.523]
  - - [4096, 10064, 1, 1024]
    - [370, 78.88]
  - - [4096, 10080, 1, 1024]
    - [219, 79.258]
  - - [4096, 10200, 1, 1024]
    - [219, 79.977]
  - - [42720, 3968, 1, 1024]
    - [367, 84.677]
  - - [42720, 6528, 1, 1024]
    - [239, 86.437]
  - - [42720, 7104, 1, 1024]
    - [239, 87.532]
  - - [42720, 7200, 1, 1024]
    - [239, 86.023]
  - - [42720, 9520, 1, 1024]
    - [367, 85.21]
  - - [42720, 10080, 1, 1024]
    - [367, 86.051]
  - - [27, 27, 1920, 64]
    - [97, 4.05]
  - - [27, 33, 1920, 64]
    - [94, 4.765]
  - - [33, 33, 1920, 64]
    - [93, 3.46]
  - - [1024, 3240, 1, 1024]
    - [103, 49.756]
  - - [1024, 3240, 1, 4096]
    - [106, 62.865]
  - - [1024, 3960, 1, 1024]
    - [102, 42.377]
  - - [1024, 3960, 1, 4096]
    - [105, 45.238]
  - - [4096, 3240, 1, 1024]
    - [100, 59.015]
  - - [4096, 3960, 1, 1024]
    - [98, 61.195]
  - - [42720, 3960, 1, 1024]
    - [104, 72.574]
  - - [7680, 8192, 1, 8192]
    - [186, 95.553]
  - - [3840, 4096, 1, 4096]
    - [187, 93.779]
  - - [1920, 2048, 1, 2048]
    - [188, 88.248]
  - - [480, 512, 1, 512]
    - [190, 15.494]
  - - [8192, 7680, 1, 8192]
    - [186, 95.516]
  - - [4096, 3840, 1, 4096]
    - [187, 93.765]
  - - [2048, 1920, 1, 2048]
    - [191, 87.632]
  - - [512, 480, 1, 512]
    - [193, 15.494]
  - - [2, 8, 1, 1024]
    - [323, 0.002]
  - - [512, 512, 16, 64]
    - [350, 20.934]
  - - [512, 512, 128, 64]
    - [197, 31.699]
  - - [1024, 77, 1, 1024]
    - [199, 7.556]
  - - [1024, 512, 1, 4096]
    - [351, 32.362]
  - - [4096, 512, 1, 1024]
    - [352, 55.211]
  - - [30522, 77, 1, 1024]
    - [475, 35.026]
  - - [30522, 616, 1, 1024]
    - [324, 66.485]
  - - [2, 10, 1, 1024]
    - [325, 0.003]
  - - [128, 128, 128, 64]
    - [201, 14.777]
  - - [128, 128, 160, 64]
    - [353, 16.527]
  - - [1024, 10, 1, 1024]
    - [202, 1.509]
  - - [1024, 200, 1, 1024]
    - [203, 15.333]
  - - [1024, 1280, 1, 1024]
    - [204, 46.349]
  - - [1024, 1280, 1, 4096]
    - [354, 48.874]
  - - [4096, 1280, 1, 1024]
    - [205, 61.346]
  - - [30522, 160, 1, 1024]
    - [476, 66.95]
  - - [30522, 200, 1, 1024]
    - [477, 50.957]
  - - [2, 39, 1, 1024]
    - [198, 0.013]
  - - [128, 128, 624, 64]
    - [206, 19.881]
  - - [1024, 39, 1, 1024]
    - [207, 3.987]
  - - [1024, 780, 1, 1024]
    - [208, 36.799]
  - - [1024, 4992, 1, 1024]
    - [209, 62.086]
  - - [1024, 4992, 1, 4096]
    - [355, 67.127]
  - - [4096, 4992, 1, 1024]
    - [210, 72.065]
  - - [30522, 780, 1, 1024]
    - [327, 70.09]
  - - [1024, 308, 1, 1024]
    - [213, 22.555]
  - - [30522, 308, 1, 1024]
    - [479, 61.661]
  - - [2, 40, 1, 1024]
    - [258, 0.013]
  - - [128, 128, 640, 64]
    - [193, 19.874]
  - - [1024, 40, 1, 1024]
    - [216, 4.047]
  - - [1024, 800, 1, 1024]
    - [217, 37.561]
  - - [1024, 5120, 1, 1024]
    - [204, 62.724]
  - - [1024, 5120, 1, 4096]
    - [218, 66.502]
  - - [4096, 5120, 1, 1024]
    - [219, 74.71]
  - - [30522, 800, 1, 1024]
    - [480, 74.949]
  - - [2, 41, 1, 1024]
    - [212, 0.013]
  - - [128, 128, 656, 64]
    - [220, 19.992]
  - - [1024, 41, 1, 1024]
    - [207, 4.106]
  - - [1024, 820, 1, 1024]
    - [221, 37.601]
  - - [1024, 5248, 1, 1024]
    - [204, 61.017]
  - - [1024, 5248, 1, 4096]
    - [159, 67.694]
  - - [4096, 5248, 1, 1024]
    - [188, 74.527]
  - - [30522, 820, 1, 1024]
    - [329, 68.389]
  - - [2, 5, 1, 1024]
    - [474, 0.001]
  - - [512, 512, 80, 64]
    - [222, 30.786]
  - - [1024, 5, 1, 1024]
    - [223, 0.779]
  - - [1024, 385, 1, 1024]
    - [213, 25.356]
  - - [1024, 2560, 1, 1024]
    - [218, 55.455]
  - - [1024, 2560, 1, 4096]
    - [358, 63.317]
  - - [4096, 2560, 1, 1024]
    - [359, 71.468]
  - - [30522, 385, 1, 1024]
    - [330, 59.518]
  - - [2, 6, 1, 1024]
    - [331, 0.002]
  - - [512, 512, 96, 64]
    - [197, 30.511]
  - - [1024, 6, 1, 1024]
    - [202, 0.934]
  - - [1024, 462, 1, 1024]
    - [225, 27.147]
  - - [1024, 3072, 1, 1024]
    - [226, 57.42]
  - - [1024, 3072, 1, 4096]
    - [163, 65.604]
  - - [4096, 3072, 1, 1024]
    - [210, 68.318]
  - - [30522, 462, 1, 1024]
    - [332, 65.029]
  - - [1024, 8, 1, 1024]
    - [198, 1.208]
  - - [1024, 160, 1, 1024]
    - [227, 13.535]
  - - [1024, 1024, 1, 4096]
    - [140, 46.413]
  - - [4096, 1024, 1, 1024]
    - [360, 62.22]
  - - [2, 9, 1, 1024]
    - [258, 0.003]
  - - [128, 128, 144, 64]
    - [361, 15.194]
  - - [1024, 9, 1, 1024]
    - [229, 1.38]
  - - [1024, 180, 1, 1024]
    - [203, 14.843]
  - - [1024, 1152, 1, 1024]
    - [230, 45.953]
  - - [1024, 1152, 1, 4096]
    - [231, 47.151]
  - - [4096, 1152, 1, 1024]
    - [232, 59.264]
  - - [30522, 180, 1, 1024]
    - [333, 48.345]
  - - [1024, 32768, 1, 479]
    - [234, 53.037]
  - - [4, 4, 32768, 64]
    - [334, 0.77]
  - - [4, 4, 38400, 64]
    - [335, 0.776]
  - - [1024, 8192, 1, 1024]
    - [368, 64.776]
  - - [1024, 8192, 1, 4096]
    - [369, 76.305]
  - - [1024, 9600, 1, 1024]
    - [242, 77.726]
  - - [1024, 9600, 1, 4096]
    - [242, 90.668]
  - - [4096, 8192, 1, 1024]
    - [370, 79.102]
  - - [4096, 9600, 1, 1024]
    - [241, 80.242]
  - - [33712, 8192, 1, 1024]
    - [239, 87.496]
  - - [33712, 9600, 1, 1024]
    - [239, 86.384]
  - - [17, 17, 6144, 64]
    - [337, 2.791]
  - - [128, 128, 1, 64]
    - [251, 0.327]
  - - [64, 128, 1, 128]
    - [252, 0.289]
  - - [2, 1024, 1, 1024]
    - [212, 0.327]
  - - [5, 5, 1, 64]
    - [344, 0.001]
  - - [33, 33, 1, 32]
    - [337, 0.01]
  - - [480, 1024, 1, 1024]
    - [124, 24.405]
  - - [480, 2048, 1, 2048]
    - [125, 46.406]
  - - [1024, 480, 1, 1024]
    - [126, 27.385]
  - - [2048, 480, 1, 2048]
    - [127, 47.102]
  - - [1024, 1024, 128, 96]
    - [370, 50.033]
  - - [30592, 4096, 1, 1024]
    - [367, 84.592]
  - - [64, 1024, 256, 1024]
    - [133, 40.123]
  - - [1536, 8192, 1, 1536]
    - [372, 73.168]
  - - [2048, 2, 1, 2048]
    - [291, 0.604]
  - - [3072, 8192, 1, 1024]
    - [364, 76.877]
  - - [3072, 2048, 1, 1024]
    - [359, 63.53]
  - - [50304, 8192, 1, 1024]
    - [367, 88.452]
  - - [64, 512, 40, 512]
    - [400, 26.954]
  - - [2048, 1024, 1, 8192]
    - [138, 69.509]
  - - [96, 1024, 64, 1024]
    - [298, 45.813]
  - - [1024, 16, 1, 1024]
    - [198, 2.574]
  - - [50304, 2048, 1, 1024]
    - [240, 84.215]
  - - [1536, 8192, 1, 6144]
    - [402, 83.649]
  - - [50304, 4096, 1, 1536]
    - [397, 87.873]
  - - [8192, 1024, 1, 2048]
    - [357, 74.158]
  - - [2, 4, 1, 2560]
    - [348, 0.002]
  - - [2560, 2048, 1, 640]
    - [192, 59.025]
  - - [1024, 1024, 128, 64]
    - [289, 35.775]
  - - [2048, 1024, 1, 2048]
    - [398, 60.533]
  - - [1536, 4096, 1, 1536]
    - [297, 65.015]
  - - [1024, 1024, 64, 64]
    - [287, 34.77]
  - - [30592, 8192, 1, 1024]
    - [367, 86.997]
  - - [50304, 16384, 1, 1024]
    - [239, 86.87]
  - - [4608, 4096, 1, 1536]
    - [219, 80.483]
  - - [2560, 2048, 1, 2560]
    - [294, 71.205]
  - - [7680, 2048, 1, 2560]
    - [296, 89.718]
  - - [2, 16, 1, 1024]
    - [258, 0.005]
  - - [50304, 4096, 1, 1024]
    - [367, 86.753]
  - - [64, 1024, 128, 1024]
    - [167, 39.004]
  - - [1920, 2048, 1, 2560]
    - [244, 81.775]
  - - [1024, 1024, 64, 96]
    - [219, 48.041]
  - - [64, 1024, 32, 1024]
    - [201, 32.625]
  - - [6144, 4096, 1, 1536]
    - [397, 78.368]
  - - [64, 512, 128, 512]
    - [193, 31.061]
  - - [1536, 4096, 1, 6144]
    - [401, 74.158]
  - - [512, 512, 256, 64]
    - [210, 32.919]
  - - [96, 1024, 128, 1024]
    - [299, 49.217]
  - - [50304, 8192, 1, 1536]
    - [240, 88.972]
  - - [6144, 8192, 1, 1536]
    - [367, 86.181]
  - - [4096, 16384, 1, 1024]
    - [239, 80.73]
  - - [30592, 1024, 1, 2048]
    - [399, 87.292]
  - - [2, 2, 1, 2048]
    - [484, 0.001]
  - - [1024, 16384, 1, 4096]
    - [136, 77.867]
  - - [64, 512, 256, 512]
    - [292, 33.663]
  - - [512, 512, 40, 64]
    - [210, 27.545]
  - - [6144, 1024, 1, 2048]
    - [142, 67.78]
  - - [4608, 8192, 1, 1536]
    - [399, 82.982]
  - - [30592, 2048, 1, 1024]
    - [367, 82.95]
  - - [3072, 16384, 1, 1024]
    - [367, 81.986]
  - - [1024, 1024, 256, 64]
    - [288, 36.301]
  - - [64, 1024, 64, 1024]
    - [181, 35.792]
  - - [1024, 16384, 1, 1024]
    - [403, 70.207]
  - - [1024, 1024, 32, 64]
    - [300, 33.054]
  - - [3072, 4096, 1, 1024]
    - [293, 68.669]
  - - [2560, 4, 1, 2560]
    - [295, 1.646]
  - - [960, 1024, 1, 1024]
    - [189, 46.406]
  - - [1024, 1, 1, 1024]
    - [198, 0.163]
  - - [32768, 1, 1, 256]
    - [235, 0.586]
  - - [512, 1, 1, 2048]
    - [255, 0.106]
  - - [1600, 1, 1, 1024]
    - [258, 0.255]
  - - [200, 1, 1, 1024]
    - [258, 0.032]
  - - [960, 1, 1, 2048]
    - [258, 0.18]
  - - [1024, 64, 1, 1024]
    - [301, 6.753]
  - - [30528, 8192, 1, 1024]
    - [239, 87.796]
  - - [128, 128, 1024, 64]
    - [206, 21.289]
  - - [64, 128, 1024, 128]
    - [404, 19.399]
  - - [1024, 3456, 1, 1024]
    - [272, 63.988]
  - - [1024, 3456, 1, 480]
    - [302, 56.978]
  - - [1024, 4096, 1, 480]
    - [195, 62.181]
  - - [1024, 6912, 1, 1024]
    - [245, 71.023]
  - - [1024, 6912, 1, 480]
    - [219, 66.375]
  - - [1024, 864, 1, 1024]
    - [208, 39.804]
  - - [1024, 864, 1, 480]
    - [303, 33.68]
  - - [128, 3456, 1, 256]
    - [304, 17.963]
  - - [128, 4096, 1, 256]
    - [305, 18.747]
  - - [128, 55296, 1, 256]
    - [405, 44.741]
  - - [128, 6912, 1, 256]
    - [306, 24.937]
  - - [128, 864, 1, 256]
    - [216, 6.022]
  - - [256, 3456, 1, 512]
    - [307, 32.36]
  - - [256, 4096, 1, 512]
    - [308, 33.495]
  - - [256, 55296, 1, 512]
    - [209, 60.832]
  - - [256, 6912, 1, 512]
    - [390, 45.098]
  - - [256, 864, 1, 512]
    - [309, 14.13]
  - - [3456, 1, 1, 256]
    - [310, 0.224]
  - - [4096, 1, 1, 256]
    - [311, 0.265]
  - - [512, 3456, 1, 1024]
    - [379, 54.002]
  - - [512, 3456, 1, 13]
    - [312, 3.312]
  - - [512, 4096, 1, 1024]
    - [313, 51.137]
  - - [512, 4096, 1, 13]
    - [314, 3.271]
  - - [512, 55296, 1, 13]
    - [315, 5.908]
  - - [512, 6912, 1, 1024]
    - [385, 63.988]
  - - [512, 6912, 1, 13]
    - [316, 4.349]
  - - [512, 864, 1, 1024]
    - [317, 26.495]
  - - [512, 864, 1, 13]
    - [318, 1.252]
  - - [6912, 1, 1, 256]
    - [319, 0.395]
  - - [864, 1, 1, 256]
    - [320, 0.056]
  - - [30528, 640, 1, 1024]
    - [242, 79.402]
  - - [30528, 1280, 1, 1024]
    - [239, 81.903]
  - - [30528, 1600, 1, 1024]
    - [406, 78.064]
  - - [1024, 10240, 1, 1024]
    - [243, 69.396]
  - - [1024, 80, 1, 1024]
    - [199, 7.696]
  - - [4096, 10240, 1, 1024]
    - [219, 80.694]
  - - [1024, 10240, 1, 4096]
    - [219, 76.896]
  - - [64, 128, 1280, 128]
    - [407, 19.718]
  - - [128, 128, 1280, 64]
    - [321, 21.845]
  - - [1024, 10496, 1, 4096]
    - [243, 78.849]
  - - [30528, 1640, 1, 1024]
    - [408, 77.371]
  - - [1024, 82, 1, 1024]
    - [199, 7.889]
  - - [4096, 10496, 1, 1024]
    - [409, 78.175]
  - - [1024, 10496, 1, 1024]
    - [219, 70.739]
  - - [64, 128, 1312, 128]
    - [278, 19.777]
  - - [128, 128, 1312, 64]
    - [189, 21.933]
  - - [30528, 160, 1, 1024]
    - [373, 72.123]
  - - [1024, 12, 1, 1024]
    - [229, 1.812]
  - - [30528, 240, 1, 1024]
    - [410, 73.137]
  - - [1024, 6144, 1, 1024]
    - [243, 61.9]
  - - [4096, 6144, 1, 1024]
    - [219, 76.926]
  - - [1024, 6144, 1, 4096]
    - [186, 72.032]
  - - [64, 512, 192, 512]
    - [322, 32.66]
  - - [512, 512, 192, 64]
    - [288, 32.38]
  - - [2, 64, 1, 1024]
    - [212, 0.021]
  - - [2, 80, 1, 1024]
    - [258, 0.025]
  - - [2, 82, 1, 1024]
    - [258, 0.027]
  - - [2, 12, 1, 1024]
    - [258, 0.004]
  - - [2, 1, 1, 1024]
    - [474, 0.0]
  - - [1, 4096, 1, 256]
    - [310, 0.265]
  - - [1, 6912, 1, 256]
    - [311, 0.385]
  - - [1024, 10224, 1, 1024]
    - [397, 66.135]
  - - [1024, 10192, 1, 1024]
    - [397, 65.669]
  - - [1024, 10208, 1, 1024]
    - [397, 65.514]
  - - [1024, 10224, 1, 4096]
    - [392, 75.194]
  - - [4096, 10224, 1, 1024]
    - [367, 79.735]
  - - [3072, 10224, 1, 1024]
    - [411, 78.36]
  - - [3072, 10240, 1, 1024]
    - [411, 82.364]
  - - [1024, 10192, 1, 4096]
    - [392, 75.753]
  - - [4096, 10192, 1, 1024]
    - [367, 79.819]
  - - [3072, 10192, 1, 1024]
    - [411, 78.074]
  - - [3072, 10200, 1, 1024]
    - [367, 78.483]
  - - [1024, 10184, 1, 1024]
    - [397, 66.27]
  - - [3072, 10208, 1, 1024]
    - [367, 79.124]
  - - [1024, 10208, 1, 4096]
    - [392, 75.118]
  - - [4096, 10208, 1, 1024]
    - [370, 79.833]
  - - [2048, 10224, 1, 1024]
    - [363, 71.611]
  - - [2048, 10240, 1, 1024]
    - [364, 74.186]
  - - [1024, 10120, 1, 1024]
    - [364, 67.372]
  - - [2048, 10192, 1, 1024]
    - [412, 72.473]
  - - [24, 24, 6816, 64]
    - [413, 4.693]
  - - [1024, 10152, 1, 1024]
    - [397, 67.084]
  - - [3072, 10080, 1, 1024]
    - [367, 79.174]
  - - [1024, 2048, 1, 49]
    - [414, 8.51]
  - - [1024, 512, 1, 196]
    - [416, 8.822]
  - - [1152, 128, 1, 784]
    - [417, 7.565]
  - - [2048, 512, 1, 49]
    - [419, 5.226]
  - - [2304, 256, 1, 196]
    - [416, 9.659]
  - - [256, 128, 1, 3136]
    - [421, 5.724]
  - - [256, 512, 1, 784]
    - [422, 6.587]
  - - [4608, 512, 1, 49]
    - [419, 9.015]
  - - [512, 1024, 1, 196]
    - [424, 8.988]
  - - [512, 2048, 1, 49]
    - [426, 5.342]
  - - [512, 256, 1, 784]
    - [427, 6.772]
  - - [576, 64, 1, 3136]
    - [428, 6.402]
  - - [128, 128, 49, 12800]
    - [430, 41.097]
  - - [128, 128, 25, 25088]
    - [431, 36.207]
  - - [128, 128, 49, 25600]
    - [430, 43.514]
  - - [128, 128, 25, 50176]
    - [432, 37.39]
  - - [256, 256, 25, 12544]
    - [433, 63.33]
  - - [256, 256, 49, 3200]
    - [434, 62.609]
  - - [256, 256, 25, 6272]
    - [435, 61.883]
  - - [256, 256, 49, 6400]
    - [436, 67.367]
  - - [512, 512, 49, 1152]
    - [437, 67.849]
  - - [512, 512, 25, 2048]
    - [438, 68.413]
  - - [512, 512, 49, 2304]
    - [411, 73.134]
  - - [512, 512, 25, 4096]
    - [399, 74.743]
  - - [64, 128, 2048, 128]
    - [439, 20.057]
  - - [128, 128, 2048, 64]
    - [404, 22.555]
  - - [30528, 2560, 1, 1024]
    - [367, 83.112]
  - - [1024, 128, 1, 1024]
    - [440, 8.783]
  - - [64, 128, 1536, 128]
    - [404, 19.781]
  - - [128, 128, 1536, 64]
    - [407, 21.94]
  - - [1024, 12288, 1, 1024]
    - [372, 67.176]
  - - [1024, 12288, 1, 4096]
    - [387, 77.382]
  - - [30528, 1920, 1, 1024]
    - [406, 78.427]
  - - [1024, 96, 1, 1024]
    - [440, 6.729]
  - - [4096, 12288, 1, 1024]
    - [367, 80.28]
  - - [128, 128, 36, 12544]
    - [441, 37.266]
  - - [128, 128, 49, 9216]
    - [442, 39.611]
  - - [128, 128, 64, 6400]
    - [443, 36.218]
  - - [128, 128, 81, 12544]
    - [379, 40.1]
  - - [128, 128, 121, 9216]
    - [444, 33.858]
  - - [128, 128, 169, 6400]
    - [445, 40.707]
  - - [256, 256, 36, 4096]
    - [446, 48.517]
  - - [256, 256, 49, 2304]
    - [447, 59.536]
  - - [256, 256, 64, 2304]
    - [391, 52.579]
  - - [256, 256, 81, 4096]
    - [448, 61.179]
  - - [256, 256, 121, 2304]
    - [449, 56.993]
  - - [256, 256, 169, 2304]
    - [450, 71.01]
  - - [512, 512, 81, 1024]
    - [437, 73.3]
  - - [512, 512, 121, 1024]
    - [364, 70.772]
  - - [512, 512, 169, 1024]
    - [437, 76.453]
  - - [512, 512, 36, 1024]
    - [451, 60.614]
  - - [512, 512, 49, 1024]
    - [411, 67.191]
  - - [512, 512, 64, 1024]
    - [370, 66.244]
  - - [64, 64, 36, 50176]
    - [452, 20.299]
  - - [64, 64, 49, 36864]
    - [453, 21.739]
  - - [64, 64, 64, 25600]
    - [454, 20.625]
  - - [128, 128, 192, 64]
    - [455, 17.285]
  - - [64, 128, 192, 128]
    - [456, 15.833]
  - - [768, 2048, 1, 768]
    - [457, 44.859]
  - - [3072, 2048, 1, 768]
    - [405, 59.813]
  - - [768, 2048, 1, 3072]
    - [435, 59.42]
  - - [768, 16, 1, 768]
    - [458, 1.09]
  - - [384, 384, 144, 64]
    - [459, 28.838]
  - - [64, 384, 144, 384]
    - [460, 28.324]
  - - [768, 4608, 1, 768]
    - [434, 60.56]
  - - [3072, 4608, 1, 768]
    - [399, 69.685]
  - - [768, 4608, 1, 3072]
    - [386, 74.155]
  - - [768, 12, 1, 768]
    - [461, 0.752]
  - - [512, 512, 48, 64]
    - [403, 27.305]
  - - [64, 512, 48, 512]
    - [462, 30.025]
  - - [768, 4, 1, 768]
    - [463, 0.246]
  - - [128, 128, 256, 64]
    - [361, 17.325]
  - - [64, 128, 256, 128]
    - [404, 16.313]
  - - [384, 384, 192, 64]
    - [464, 29.49]
  - - [64, 384, 192, 384]
    - [465, 28.261]
  - - [1024, 4608, 1, 1024]
    - [388, 61.354]
  - - [4096, 4608, 1, 1024]
    - [370, 77.727]
  - - [1024, 4608, 1, 4096]
    - [466, 81.437]
  - - [2880, 3072, 1, 3072]
    - [360, 82.154]
  - - [3072, 3072, 1, 3072]
    - [373, 82.489]
  - - [3072, 512, 1, 3072]
    - [435, 60.858]
  - - [4096, 512, 1, 4096]
    - [467, 57.46]
  - - [512, 1024, 1, 1024]
    - [468, 24.872]
  - - [512, 2048, 1, 2048]
    - [469, 44.169]
  - - [512, 3072, 1, 3072]
    - [470, 58.27]
  - - [512, 4096, 1, 4096]
    - [471, 60.9]
  - - [512, 8192, 1, 8192]
    - [472, 78.946]
  - - [64, 1024, 1, 1024]
    - [473, 4.361]
  - - [8192, 512, 1, 8192]
    - [402, 78.773]
  - - [26, 26, 6272, 64]
    - [485, 4.765]
  - - [147, 64, 1, 12544]
    - [486, 6.239]
  - - [2, 128, 1, 1024]
    - [487, 0.03]
  - - [2, 96, 1, 1024]
    - [488, 0.019]
  - - [2, 2048, 1, 768]
    - [489, 0.383]
  - - [2, 4608, 1, 768]
    - [487, 0.728]
  - - [2, 4608, 1, 1024]
    - [487, 0.825]
- null
