library/src/blas3/Tensile/Logic/asm_full/arcturus_Cijk_Ailk_Bljk_HBH.yaml
- {MinimumRequiredVersion: 4.6.0}
- arcturus
- gfx908
- [Device 7380, Device 7388, Device 738c, Device 7390]
    SolutionIndex: 0
    SolutionNameMin: Cijk_Ailk_Bljk_HBH_MT016x016x16_PGR1_PLR1_TT02_02
    SolutionIndex: 1
    SolutionNameMin: Cijk_Ailk_Bljk_HBH_MT032x032x16_PGR1_PLR1_TT04_04
    SolutionIndex: 2
    SolutionNameMin: Cijk_Ailk_Bljk_HBH_MT064x016x16_PGR1_PLR1_TT04_04
    SolutionIndex: 3
    SolutionNameMin: Cijk_Ailk_Bljk_HBH_MT032x016x16_PGR1_PLR1_TT02_02
    SolutionIndex: 4
    SolutionNameMin: Cijk_Ailk_Bljk_HBH_MT064x016x16_PGR1_PLR1_TT04_02
    SolutionIndex: 5
    SolutionNameMin: Cijk_Ailk_Bljk_HBH_MT064x008x16_PGR1_PLR1_TT02_02
    SolutionIndex: 6
    SolutionNameMin: Cijk_Ailk_Bljk_HBH_MT064x016x16_PGR1_PLR1_TT02_02
    SolutionIndex: 7
    SolutionNameMin: Cijk_Ailk_Bljk_HBH_MT128x016x16_PGR1_PLR1_TT04_02
    SolutionIndex: 8
    SolutionNameMin: Cijk_Ailk_Bljk_HBH_MT016x016x32_PGR1_PLR1_TT02_02
    SolutionIndex: 9
    SolutionNameMin: Cijk_Ailk_Bljk_HBH_MT032x008x32_PGR1_PLR1_TT02_02
    SolutionIndex: 10
    SolutionNameMin: Cijk_Ailk_Bljk_HBH_MT032x016x32_PGR1_PLR1_TT02_02
    SolutionIndex: 11
    SolutionNameMin: Cijk_Ailk_Bljk_HBH_MT064x016x32_PGR1_PLR1_TT04_02
    SolutionIndex: 12
    SolutionNameMin: Cijk_Ailk_Bljk_HBH_MT064x008x32_PGR1_PLR1_TT02_02
    SolutionIndex: 13
    SolutionNameMin: Cijk_Ailk_Bljk_HBH_MT064x016x32_PGR1_PLR1_TT02_02
    SolutionIndex: 14
    SolutionNameMin: Cijk_Ailk_Bljk_HBH_MT128x016x32_PGR1_PLR1_TT04_02
    SolutionIndex: 15
    SolutionNameMin: Cijk_Ailk_Bljk_HBH_MT032x008x64_PGR1_PLR1_TT02_02
    SolutionIndex: 16
    SolutionNameMin: Cijk_Ailk_Bljk_HBH_MT064x008x64_PGR1_PLR1_TT02_02
    SolutionIndex: 17
    SolutionNameMin: Cijk_Ailk_Bljk_HBH_MT064x032x08_PGR1_PLR1_TT08_04
    SolutionIndex: 18
    SolutionNameMin: Cijk_Ailk_Bljk_HBH_MT032x032x08_PGR1_PLR1_TT04_04
    SolutionIndex: 19
    SolutionNameMin: Cijk_Ailk_Bljk_HBH_MT064x032x08_PGR1_PLR1_TT08_04
    SolutionIndex: 20
    SolutionNameMin: Cijk_Ailk_Bljk_HBH_MT032x016x16_PGR1_PLR1_TT04_02
    SolutionIndex: 21
    SolutionNameMin: Cijk_Ailk_Bljk_HBH_MT032x032x16_PGR1_PLR1_TT04_04
    SolutionIndex: 22
    SolutionNameMin: Cijk_Ailk_Bljk_HBH_MT064x064x16_PGR1_PLR1_TT08_08
    SolutionIndex: 23
    SolutionNameMin: Cijk_Ailk_Bljk_HBH_MT064x016x16_PGR1_PLR1_TT04_02
    SolutionIndex: 24
    SolutionNameMin: Cijk_Ailk_Bljk_HBH_MT064x016x16_PGR1_PLR1_TT02_02
    SolutionIndex: 25
    SolutionNameMin: Cijk_Ailk_Bljk_HBH_MT128x016x16_PGR1_PLR1_TT04_02
    SolutionIndex: 26
    SolutionNameMin: Cijk_Ailk_Bljk_HBH_MT064x016x16_PGR1_PLR1_TT04_04
    SolutionIndex: 27
    SolutionNameMin: Cijk_Ailk_Bljk_HBH_MT064x008x16_PGR1_PLR1_TT02_02
    SolutionIndex: 28
    SolutionNameMin: Cijk_Ailk_Bljk_HBH_MT016x016x24_PGR1_PLR1_TT02_02
    SolutionIndex: 29
    SolutionNameMin: Cijk_Ailk_Bljk_HBH_MT032x016x24_PGR1_PLR1_TT04_02
    SolutionIndex: 30
    SolutionNameMin: Cijk_Ailk_Bljk_HBH_MT016x016x24_PGR1_PLR1_TT02_02
    SolutionIndex: 31
    SolutionNameMin: Cijk_Ailk_Bljk_HBH_MT032x016x24_PGR1_PLR1_TT04_02
    SolutionIndex: 32
    SolutionNameMin: Cijk_Ailk_Bljk_HBH_MT032x032x24_PGR1_PLR1_TT04_04
    SolutionIndex: 33
    SolutionNameMin: Cijk_Ailk_Bljk_HBH_MT032x032x32_PGR1_PLR1_TT04_04
    SolutionIndex: 34
    SolutionNameMin: Cijk_Ailk_Bljk_HBH_MT064x016x32_PGR1_PLR1_TT02_02
    SolutionIndex: 35
    SolutionNameMin: Cijk_Ailk_Bljk_HBH_MT128x016x32_PGR1_PLR1_TT04_02
    SolutionIndex: 36
    SolutionNameMin: Cijk_Ailk_Bljk_HBH_MT032x008x32_PGR1_PLR1_TT02_02
    SolutionIndex: 37
    SolutionNameMin: Cijk_Ailk_Bljk_HBH_MT064x008x32_PGR1_PLR1_TT02_02
    SolutionIndex: 38
    SolutionNameMin: Cijk_Ailk_Bljk_HBH_MT032x008x64_PGR1_PLR1_TT02_02
    SolutionIndex: 39
    SolutionNameMin: Cijk_Ailk_Bljk_HBH_MT064x008x64_PGR1_PLR1_TT02_02
    SolutionIndex: 40
    SolutionNameMin: Cijk_Ailk_Bljk_HBH_MT064x064x08_PGR1_PLR1_TT04_04
    SolutionIndex: 41
    SolutionNameMin: Cijk_Ailk_Bljk_HBH_MT064x128x08_PGR1_PLR1_TT04_08
    SolutionIndex: 42
    SolutionNameMin: Cijk_Ailk_Bljk_HBH_MT128x064x08_PGR1_PLR1_TT08_04
    SolutionIndex: 43
    SolutionNameMin: Cijk_Ailk_Bljk_HBH_MT064x032x16_PGR0_PLR1_TT08_04
    SolutionIndex: 44
    SolutionNameMin: Cijk_Ailk_Bljk_HBH_MT064x064x16_PGR1_PLR1_TT04_04
    SolutionIndex: 45
    SolutionNameMin: Cijk_Ailk_Bljk_HBH_MT064x128x16_PGR1_PLR1_TT04_08
    SolutionIndex: 46
    SolutionNameMin: Cijk_Ailk_Bljk_HBH_MT128x064x16_PGR1_PLR1_TT08_04
    SolutionIndex: 47
    SolutionNameMin: Cijk_Ailk_Bljk_HBH_MT128x128x16_PGR1_PLR1_TT08_08
    SolutionIndex: 48
    SolutionNameMin: Cijk_Ailk_Bljk_HBH_MT064x032x16_PGR0_PLR0_TT04_04
    SolutionIndex: 49
    SolutionNameMin: Cijk_Ailk_Bljk_HBH_MT064x128x16_PGR0_PLR0_TT04_08
    SolutionIndex: 50
    SolutionNameMin: Cijk_Ailk_Bljk_HBH_MT032x128x16_PGR1_PLR0_TT04_04
    SolutionIndex: 51
    SolutionNameMin: Cijk_Ailk_Bljk_HBH_MT032x128x16_PGR0_PLR0_TT04_04
    SolutionIndex: 52
    SolutionNameMin: Cijk_Ailk_Bljk_HBH_MT064x064x04_PGR1_PLR1_TT04_04
    SolutionIndex: 53
    SolutionNameMin: Cijk_Ailk_Bljk_HBH_MT064x064x08_PGR1_PLR1_TT04_04
    SolutionIndex: 54
    SolutionNameMin: Cijk_Ailk_Bljk_HBH_MT064x064x16_PGR1_PLR1_TT04_04
    SolutionIndex: 55
    SolutionNameMin: Cijk_Ailk_Bljk_HBH_MT032x032x08_PGR0_PLR1_TT04_04
    SolutionIndex: 56
    SolutionNameMin: Cijk_Ailk_Bljk_HBH_MT032x032x16_PGR1_PLR1_TT04_04
    SolutionIndex: 57
    SolutionNameMin: Cijk_Ailk_Bljk_HBH_MT064x016x16_PGR1_PLR1_TT04_04
    SolutionIndex: 58
    SolutionNameMin: Cijk_Ailk_Bljk_HBH_MT064x032x16_PGR1_PLR1_TT04_04
    SolutionIndex: 59
    SolutionNameMin: Cijk_Ailk_Bljk_HBH_MT064x064x16_PGR1_PLR1_TT04_04
    SolutionIndex: 60
    SolutionNameMin: Cijk_Ailk_Bljk_HBH_MT032x032x32_PGR1_PLR1_TT04_04
    SolutionIndex: 61
    SolutionNameMin: Cijk_Ailk_Bljk_HBH_MT064x016x32_PGR1_PLR1_TT04_04
    SolutionIndex: 62
    SolutionNameMin: Cijk_Ailk_Bljk_HBH_MT064x032x32_PGR1_PLR1_TT04_04
    SolutionIndex: 63
    SolutionNameMin: Cijk_Ailk_Bljk_HBH_MT128x016x32_PGR1_PLR1_TT04_04
    SolutionIndex: 64
    SolutionNameMin: Cijk_Ailk_Bljk_HBH_MT128x032x32_PGR1_PLR1_TT04_04
    SolutionIndex: 65
    SolutionNameMin: Cijk_Ailk_Bljk_HBH_MT064x064x16_PGR1_PLR1_TT08_08
    SolutionIndex: 66
    SolutionNameMin: Cijk_Ailk_Bljk_HBH_MT128x128x16_PGR1_PLR1_TT08_08
    SolutionIndex: 67
    SolutionNameMin: Cijk_Ailk_Bljk_HBH_MT032x032x08_PGR1_PLR1_TT04_04
    SolutionIndex: 68
    SolutionNameMin: Cijk_Ailk_Bljk_HBH_MT064x032x08_PGR1_PLR1_TT08_04
    SolutionIndex: 69
    SolutionNameMin: Cijk_Ailk_Bljk_HBH_MT064x064x08_PGR1_PLR1_TT08_08
    SolutionIndex: 70
    SolutionNameMin: Cijk_Ailk_Bljk_HBH_MT128x128x08_PGR1_PLR1_TT08_08
    SolutionIndex: 71
    SolutionNameMin: Cijk_Ailk_Bljk_HBH_MT128x032x16_PGR1_PLR1_TT08_04
    SolutionIndex: 72
    SolutionNameMin: Cijk_Ailk_Bljk_HBH_MT032x032x16_PGR1_PLR1_TT04_04
    SolutionIndex: 73
    SolutionNameMin: Cijk_Ailk_Bljk_HBH_MT064x032x16_PGR1_PLR1_TT08_04
    SolutionIndex: 74
    SolutionNameMin: Cijk_Ailk_Bljk_HBH_MT064x064x16_PGR1_PLR1_TT04_04
    SolutionIndex: 75
    SolutionNameMin: Cijk_Ailk_Bljk_HBH_MT128x064x16_PGR1_PLR1_TT08_04
    SolutionIndex: 76
    SolutionNameMin: Cijk_Ailk_Bljk_HBH_MT128x128x16_PGR1_PLR1_TT08_08
    SolutionIndex: 77
    SolutionNameMin: Cijk_Ailk_Bljk_HBH_MT064x032x16_PGR1_PLR1_TT04_04
    SolutionIndex: 78
    SolutionNameMin: Cijk_Ailk_Bljk_HBH_MT128x032x16_PGR1_PLR1_TT08_04
    SolutionIndex: 79
    SolutionNameMin: Cijk_Ailk_Bljk_HBH_MT128x064x32_PGR1_PLR1_TT08_04
    SolutionIndex: 80
    SolutionNameMin: Cijk_Ailk_Bljk_HBH_MT128x032x32_PGR1_PLR1_TT04_04
    SolutionIndex: 81
    SolutionNameMin: Cijk_Ailk_Bljk_HBH_MT064x016x32_PGR1_PLR1_TT04_04
    SolutionIndex: 82
    SolutionNameMin: Cijk_Ailk_Bljk_HBH_MT064x064x16_PGR1_PLR1_TT08_08
    SolutionIndex: 83
    SolutionNameMin: Cijk_Ailk_Bljk_HBH_MT128x128x16_PGR1_PLR1_TT08_08
    SolutionIndex: 84
    SolutionNameMin: Cijk_Ailk_Bljk_HBH_MT064x064x32_PGR1_PLR1_TT08_08
    SolutionIndex: 85
    SolutionNameMin: Cijk_Ailk_Bljk_HBH_MT128x128x32_PGR1_PLR1_TT08_08
    SolutionIndex: 86
    SolutionNameMin: Cijk_Ailk_Bljk_HBH_MT064x032x16_PGR0_PLR1_TT08_04
    SolutionIndex: 87
    SolutionNameMin: Cijk_Ailk_Bljk_HBH_MT128x128x32_PGR0_PLR1_TT08_08
    SolutionIndex: 88
    SolutionNameMin: Cijk_Ailk_Bljk_HBH_MT064x128x16_PGR1_PLR1_TT04_08
    SolutionIndex: 89
    SolutionNameMin: Cijk_Ailk_Bljk_HBH_MT128x064x16_PGR1_PLR1_TT08_04
    SolutionIndex: 90
    SolutionNameMin: Cijk_Ailk_Bljk_HBH_MT128x128x16_PGR1_PLR1_TT08_08
    SolutionIndex: 91
    SolutionNameMin: Cijk_Ailk_Bljk_HBH_MT128x064x16_PGR1_PLR1_TT04_08
    SolutionIndex: 92
    SolutionNameMin: Cijk_Ailk_Bljk_HBH_MT128x064x16_PGR1_PLR1_TT04_08
    SolutionIndex: 93
    SolutionNameMin: Cijk_Ailk_Bljk_HBH_MT128x064x32_PGR1_PLR1_TT04_04
    SolutionIndex: 94
    SolutionNameMin: Cijk_Ailk_Bljk_HBH_MT256x128x32_PGR1_PLR1_TT08_08
    SolutionIndex: 95
    SolutionNameMin: Cijk_Ailk_Bljk_HBH_MT128x032x16_PGR0_PLR0_TT08_04
    SolutionIndex: 96
    SolutionNameMin: Cijk_Ailk_Bljk_HBH_MT064x128x16_PGR1_PLR0_TT04_08
    SolutionIndex: 97
    SolutionNameMin: Cijk_Ailk_Bljk_HBH_MT128x064x16_PGR1_PLR0_TT08_04
    SolutionIndex: 98
    SolutionNameMin: Cijk_Ailk_Bljk_HBH_MT128x064x16_PGR1_PLR0_TT04_08
    SolutionIndex: 99
    SolutionNameMin: Cijk_Ailk_Bljk_HBH_MT064x128x04_PGR0_PLR0_TT04_08
    SolutionIndex: 100
    SolutionNameMin: Cijk_Ailk_Bljk_HBH_MT064x064x04_PGR0_PLR0_TT04_04
    SolutionIndex: 101
    SolutionNameMin: Cijk_Ailk_Bljk_HBH_MT064x064x04_PGR1_PLR0_TT04_04
    SolutionIndex: 102
    SolutionNameMin: Cijk_Ailk_Bljk_HBH_MT064x064x04_PGR0_PLR1_TT04_04
    SolutionIndex: 103
    SolutionNameMin: Cijk_Ailk_Bljk_HBH_MT064x064x04_PGR1_PLR1_TT04_04
    SolutionIndex: 104
    SolutionNameMin: Cijk_Ailk_Bljk_HBH_MT064x128x08_PGR0_PLR0_TT04_08
    SolutionIndex: 105
    SolutionNameMin: Cijk_Ailk_Bljk_HBH_MT064x064x08_PGR0_PLR0_TT04_04
    SolutionIndex: 106
    SolutionNameMin: Cijk_Ailk_Bljk_HBH_MT064x128x08_PGR1_PLR0_TT04_08
    SolutionIndex: 107
    SolutionNameMin: Cijk_Ailk_Bljk_HBH_MT064x064x08_PGR1_PLR0_TT04_04
    SolutionIndex: 108
    SolutionNameMin: Cijk_Ailk_Bljk_HBH_MT064x128x08_PGR0_PLR1_TT04_08
    SolutionIndex: 109
    SolutionNameMin: Cijk_Ailk_Bljk_HBH_MT064x064x08_PGR0_PLR1_TT04_04
    SolutionIndex: 110
    SolutionNameMin: Cijk_Ailk_Bljk_HBH_MT064x064x08_PGR1_PLR1_TT04_04
    SolutionIndex: 111
    SolutionNameMin: Cijk_Ailk_Bljk_HBH_MT128x128x16_PGR0_PLR0_TT08_08
    SolutionIndex: 112
    SolutionNameMin: Cijk_Ailk_Bljk_HBH_MT064x128x16_PGR0_PLR0_TT04_08
    SolutionIndex: 113
    SolutionNameMin: Cijk_Ailk_Bljk_HBH_MT064x064x16_PGR1_PLR0_TT04_04
    SolutionIndex: 114
    SolutionNameMin: Cijk_Ailk_Bljk_HBH_MT064x064x16_PGR0_PLR1_TT04_04
    SolutionIndex: 115
    SolutionNameMin: Cijk_Ailk_Bljk_HBH_MT064x064x16_PGR1_PLR1_TT04_04
    SolutionIndex: 116
    SolutionNameMin: Cijk_Ailk_Bljk_HBH_MT128x128x04_PGR0_PLR0_TT08_08
    SolutionIndex: 117
    SolutionNameMin: Cijk_Ailk_Bljk_HBH_MT064x128x04_PGR0_PLR0_TT04_08
    SolutionIndex: 118
    SolutionNameMin: Cijk_Ailk_Bljk_HBH_MT064x064x04_PGR0_PLR0_TT04_04
    SolutionIndex: 119
    SolutionNameMin: Cijk_Ailk_Bljk_HBH_MT064x128x04_PGR1_PLR0_TT04_08
    SolutionIndex: 120
    SolutionNameMin: Cijk_Ailk_Bljk_HBH_MT064x064x04_PGR1_PLR0_TT04_04
    SolutionIndex: 121
    SolutionNameMin: Cijk_Ailk_Bljk_HBH_MT064x128x04_PGR0_PLR1_TT04_08
    SolutionIndex: 122
    SolutionNameMin: Cijk_Ailk_Bljk_HBH_MT064x064x04_PGR0_PLR1_TT04_04
    SolutionIndex: 123
    SolutionNameMin: Cijk_Ailk_Bljk_HBH_MT064x128x04_PGR1_PLR1_TT04_08
    SolutionIndex: 124
    SolutionNameMin: Cijk_Ailk_Bljk_HBH_MT064x064x04_PGR1_PLR1_TT04_04
    SolutionIndex: 125
    SolutionNameMin: Cijk_Ailk_Bljk_HBH_MT064x064x08_PGR0_PLR0_TT04_04
    SolutionIndex: 126
    SolutionNameMin: Cijk_Ailk_Bljk_HBH_MT064x128x08_PGR1_PLR0_TT04_08
    SolutionIndex: 127
    SolutionNameMin: Cijk_Ailk_Bljk_HBH_MT064x064x08_PGR1_PLR0_TT04_04
    SolutionIndex: 128
    SolutionNameMin: Cijk_Ailk_Bljk_HBH_MT064x128x08_PGR0_PLR1_TT04_08
    SolutionIndex: 129
    SolutionNameMin: Cijk_Ailk_Bljk_HBH_MT064x064x08_PGR0_PLR1_TT04_04
    SolutionIndex: 130
    SolutionNameMin: Cijk_Ailk_Bljk_HBH_MT064x064x08_PGR1_PLR1_TT04_04
    SolutionIndex: 131
    SolutionNameMin: Cijk_Ailk_Bljk_HBH_MT064x064x16_PGR0_PLR0_TT04_04
    SolutionIndex: 132
    SolutionNameMin: Cijk_Ailk_Bljk_HBH_MT128x128x16_PGR1_PLR0_TT08_08
    SolutionIndex: 133
    SolutionNameMin: Cijk_Ailk_Bljk_HBH_MT064x128x16_PGR1_PLR0_TT04_08
    SolutionIndex: 134
    SolutionNameMin: Cijk_Ailk_Bljk_HBH_MT064x064x16_PGR1_PLR1_TT04_04
    SolutionIndex: 135
    SolutionNameMin: Cijk_Ailk_Bljk_HBH_MT128x064x16_EPS1_GRVW08_LPB00_PGR1_PLR1_SNLL1_TT08_08_VW08_WG16_08_01_WGM01
    SolutionIndex: 136
    SolutionNameMin: Cijk_Ailk_Bljk_HBH_MT064x128x16_EPS1_GRVW04_LPB04_PGR1_PLR1_SNLL1_TT08_04_VW04_WG08_32_01_WGM01
    SolutionIndex: 137
    SolutionNameMin: Cijk_Ailk_Bljk_HBH_MT128x064x16_EPS1_GRVW04_LPB04_PGR1_PLR1_SNLL1_TT08_04_VW04_WG16_16_01_WGM01
    SolutionIndex: 138
    SolutionNameMin: Cijk_Ailk_Bljk_HBH_MT128x128x16_EPS1_GRVW04_LPB04_PGR1_PLR1_SNLL1_TT08_08_VW04_WG16_16_01_WGM01
    SolutionIndex: 139
    SolutionNameMin: Cijk_Ailk_Bljk_HBH_MT064x128x16_EPS1_GRVW04_LPB04_PGR1_PLR1_SNLL1_TT08_04_VW04_WG08_32_01_WGM08
    SolutionIndex: 140
    SolutionNameMin: Cijk_Ailk_Bljk_HBH_MT128x064x16_EPS1_GRVW04_LPB04_PGR1_PLR1_SNLL1_TT08_04_VW04_WG16_16_01_WGM08
    SolutionIndex: 141
    SolutionNameMin: Cijk_Ailk_Bljk_HBH_MT256x064x16_EPS1_GRVW04_LPB04_PGR1_PLR1_SNLL1_TT08_08_VW04_WG32_08_01_WGM64
    SolutionIndex: 142
    SolutionNameMin: Cijk_Ailk_Bljk_HBH_MT064x128x32_EPS0_GRVW04_LPB04_PGR0_PLR0_SNLL0_TT08_04_VW04_WG08_32_01_WGM01
    SolutionIndex: 143
    SolutionNameMin: Cijk_Ailk_Bljk_HBH_MT064x064x32_EPS0_GRVW04_LPB04_PGR0_PLR0_SNLL0_TT04_04_VW04_WG16_16_01_WGM01
    SolutionIndex: 144
    SolutionNameMin: Cijk_Ailk_Bljk_HBH_MT128x064x32_EPS1_GRVW04_LPB04_PGR1_PLR1_SNLL1_TT08_04_VW04_WG16_16_01_WGM01
    SolutionIndex: 145
    SolutionNameMin: Cijk_Ailk_Bljk_HBH_MT064x064x32_EPS0_GRVW04_LPB04_PGR0_PLR0_SNLL0_TT04_04_VW04_WG16_16_01_WGM08
    SolutionIndex: 146
    SolutionNameMin: Cijk_Ailk_Bljk_HBH_MT128x064x32_EPS0_GRVW08_LPB08_PGR0_PLR1_SNLL0_TT08_08_VW08_WG16_08_01_WGM01
    SolutionIndex: 147
    SolutionNameMin: Cijk_Ailk_Bljk_HBH_MT64x128x16_MI32x32x4x2_SE_AF0EM1_ASEM1_GRVW2_ONLL0_SNLL1
    SolutionIndex: 148
    SolutionNameMin: Cijk_Ailk_Bljk_HBH_MT64x128x16_MI32x32x4x2_SE_AF0EM1_ASEM2_GRVW2_ONLL0_SNLL1
    SolutionIndex: 149
    SolutionNameMin: Cijk_Ailk_Bljk_HBH_MT64x128x16_MI32x32x4x2_SE_AF0EM2_ASEM1_GRVW2_ONLL0_SNLL1
    SolutionIndex: 150
    SolutionNameMin: Cijk_Ailk_Bljk_HBH_MT64x128x16_MI32x32x4x2_SE_AF0EM1_ASEM1_GRVW2_ONLL0_SNLL0
    SolutionIndex: 151
    SolutionNameMin: Cijk_Ailk_Bljk_HBH_MT64x128x16_MI32x32x4x2_SE_AF0EM1_ASEM2_GRVW2_ONLL0_SNLL0
    SolutionIndex: 152
    SolutionNameMin: Cijk_Ailk_Bljk_HBH_MT64x128x16_MI32x32x4x2_SE_AF0EM2_ASEM1_GRVW2_ONLL0_SNLL0
    SolutionIndex: 153
    SolutionNameMin: Cijk_Ailk_Bljk_HBH_MT64x128x16_MI32x32x4x2_SE_AF0EM2_ASEM2_GRVW2_ONLL0_SNLL0
    SolutionIndex: 154
    SolutionNameMin: Cijk_Ailk_Bljk_HBH_MT64x128x32_MI32x32x4x2_SE_AF0EM2_ASEM2_GRVW2_ONLL0_SNLL0
    SolutionIndex: 155
    SolutionNameMin: Cijk_Ailk_Bljk_HBH_MT32x256x16_MI32x32x4x2_SE_AF0EM1_ASEM2_GRVW4_ONLL0_SNLL0
    SolutionIndex: 156
    SolutionNameMin: Cijk_Ailk_Bljk_HBH_MT64x128x16_MI32x32x4x2_SE_AF0EM1_ASEM1_GRVW2_ONLL1_SNLL1
    SolutionIndex: 157
    SolutionNameMin: Cijk_Ailk_Bljk_HBH_MT64x128x16_MI32x32x4x2_SE_AF0EM1_ASEM2_GRVW2_ONLL1_SNLL1
    SolutionIndex: 158
    SolutionNameMin: Cijk_Ailk_Bljk_HBH_MT64x128x16_MI32x32x4x2_SE_AF0EM2_ASEM1_GRVW2_ONLL1_SNLL1
    SolutionIndex: 159
    SolutionNameMin: Cijk_Ailk_Bljk_HBH_MT64x128x16_MI32x32x4x2_SE_AF0EM2_ASEM2_GRVW2_ONLL1_SNLL1
    SolutionIndex: 160
    SolutionNameMin: Cijk_Ailk_Bljk_HBH_MT64x128x16_MI32x32x4x2_SE_AF0EM1_ASEM1_GRVW2_ONLL1_SNLL0
    SolutionIndex: 161
    SolutionNameMin: Cijk_Ailk_Bljk_HBH_MT64x128x16_MI32x32x4x2_SE_AF0EM1_ASEM2_GRVW2_ONLL1_SNLL0
    SolutionIndex: 162
    SolutionNameMin: Cijk_Ailk_Bljk_HBH_MT64x128x16_MI32x32x4x2_SE_AF0EM2_ASEM1_GRVW2_ONLL1_SNLL0
    SolutionIndex: 163
    SolutionNameMin: Cijk_Ailk_Bljk_HBH_MT64x128x16_MI32x32x4x2_SE_AF0EM2_ASEM2_GRVW2_ONLL1_SNLL0
    SolutionIndex: 164
    SolutionNameMin: Cijk_Ailk_Bljk_HBH_MT64x128x8_MI32x32x4x2_SE_AF0EM2_ASEM1_GRVW4_ONLL1_SNLL0
    SolutionIndex: 165
    SolutionNameMin: Cijk_Ailk_Bljk_HBH_MT64x128x8_MI32x32x4x2_SE_AF0EM2_ASEM2_GRVW4_ONLL1_SNLL0
    SolutionIndex: 166
    SolutionNameMin: Cijk_Ailk_Bljk_HBH_MT32x256x16_MI32x32x4x2_SE_AF0EM2_ASEM2_GRVW4_ONLL1_SNLL0
    SolutionIndex: 167
    SolutionNameMin: Cijk_Ailk_Bljk_HBH_MT64x256x16_MI32x32x4x2_SE_AF0EM1_ASEM2_GRVW2_ONLL0_SNLL1
    SolutionIndex: 168
    SolutionNameMin: Cijk_Ailk_Bljk_HBH_MT64x256x16_MI32x32x4x2_SE_AF0EM1_ASEM1_GRVW2_ONLL0_SNLL0
    SolutionIndex: 169
    SolutionNameMin: Cijk_Ailk_Bljk_HBH_MT64x256x16_MI32x32x4x2_SE_AF0EM1_ASEM2_GRVW2_ONLL0_SNLL0
    SolutionIndex: 170
    SolutionNameMin: Cijk_Ailk_Bljk_HBH_MT64x256x16_MI32x32x4x2_SE_AF0EM1_ASEM1_GRVW2_ONLL1_SNLL1
    SolutionIndex: 171
    SolutionNameMin: Cijk_Ailk_Bljk_HBH_MT64x256x16_MI32x32x4x2_SE_AF0EM1_ASEM1_GRVW2_ONLL1_SNLL0
    SolutionIndex: 172
    SolutionNameMin: Cijk_Ailk_Bljk_HBH_MT64x256x16_MI32x32x4x2_SE_AF0EM1_ASEM2_GRVW2_ONLL1_SNLL0
    SolutionIndex: 173
    SolutionIndex: 174
    SolutionIndex: 175
    SolutionIndex: 176
    SolutionIndex: 177
    SolutionIndex: 178
    SolutionIndex: 179
    SolutionIndex: 180
    SolutionIndex: 181
    SolutionIndex: 182
    SolutionIndex: 183
    SolutionIndex: 184
    SolutionIndex: 185
    SolutionIndex: 186
    SolutionIndex: 187
    SolutionIndex: 188
    SolutionIndex: 189
    SolutionIndex: 190
    SolutionIndex: 191
    SolutionIndex: 192
    SolutionIndex: 193
    SolutionIndex: 194
    SolutionIndex: 195
    SolutionIndex: 196
    SolutionIndex: 197
    SolutionIndex: 198
    SolutionIndex: 199
    SolutionIndex: 200
    SolutionIndex: 201
    SolutionIndex: 202
    SolutionIndex: 203
    SolutionIndex: 204
    SolutionIndex: 205
    SolutionIndex: 206
    SolutionIndex: 207
    SolutionIndex: 208
    SolutionIndex: 209
    SolutionIndex: 210
    SolutionIndex: 211
    SolutionIndex: 212
    SolutionIndex: 213
    SolutionIndex: 214
    SolutionIndex: 215
    SolutionIndex: 216
    SolutionIndex: 217
    SolutionIndex: 218
    SolutionIndex: 219
    SolutionIndex: 220
    SolutionIndex: 221
    SolutionIndex: 222
    SolutionIndex: 223
    SolutionIndex: 224
    SolutionIndex: 225
    SolutionIndex: 226
    SolutionIndex: 227
    SolutionIndex: 228
    SolutionIndex: 229
    SolutionIndex: 230
    SolutionIndex: 231
    SolutionIndex: 232
    SolutionIndex: 233
    SolutionIndex: 234
    SolutionIndex: 235
    SolutionIndex: 236
    SolutionIndex: 237
    SolutionIndex: 238
    SolutionIndex: 239
    SolutionIndex: 240
    SolutionIndex: 241
    SolutionIndex: 242
    SolutionIndex: 243
    SolutionIndex: 244
    SolutionIndex: 245
    SolutionIndex: 246
    SolutionIndex: 247
    SolutionIndex: 248
    SolutionIndex: 249
    SolutionIndex: 250
    SolutionIndex: 251
    SolutionIndex: 252
    SolutionIndex: 253
    SolutionIndex: 254
    SolutionIndex: 255
    SolutionIndex: 256
    SolutionIndex: 257
    SolutionIndex: 258
    SolutionIndex: 259
    SolutionIndex: 260
    SolutionIndex: 261
    SolutionIndex: 262
    SolutionIndex: 263
    SolutionIndex: 264
    SolutionIndex: 265
    SolutionIndex: 266
    SolutionIndex: 267
    SolutionIndex: 268
    SolutionIndex: 269
    SolutionIndex: 270
    SolutionIndex: 271
    SolutionIndex: 272
    SolutionIndex: 273
    SolutionIndex: 274
    SolutionIndex: 275
    SolutionIndex: 276
    SolutionIndex: 277
    SolutionIndex: 278
    SolutionIndex: 279
    SolutionIndex: 280
    SolutionIndex: 281
    SolutionIndex: 282
    SolutionIndex: 283
    SolutionIndex: 284
    SolutionIndex: 285
    SolutionIndex: 286
    SolutionIndex: 287
    SolutionNameMin: Cijk_Ailk_Bljk_HBH_MT016x016x16_PGR1_PLR1_TT02_02
    SolutionIndex: 288
    SolutionNameMin: Cijk_Ailk_Bljk_HBH_MT032x032x16_PGR1_PLR1_TT04_04
    SolutionIndex: 289
    SolutionNameMin: Cijk_Ailk_Bljk_HBH_MT064x016x16_PGR1_PLR1_TT04_04
    SolutionIndex: 290
    SolutionNameMin: Cijk_Ailk_Bljk_HBH_MT032x016x16_PGR1_PLR1_TT02_02
    SolutionIndex: 291
    SolutionNameMin: Cijk_Ailk_Bljk_HBH_MT064x016x16_PGR1_PLR1_TT04_02
    SolutionIndex: 292
    SolutionNameMin: Cijk_Ailk_Bljk_HBH_MT064x008x16_PGR1_PLR1_TT02_02
    SolutionIndex: 293
    SolutionNameMin: Cijk_Ailk_Bljk_HBH_MT064x016x16_PGR1_PLR1_TT02_02
    SolutionIndex: 294
    SolutionNameMin: Cijk_Ailk_Bljk_HBH_MT128x016x16_PGR1_PLR1_TT04_02
    SolutionIndex: 295
    SolutionNameMin: Cijk_Ailk_Bljk_HBH_MT016x016x32_PGR1_PLR1_TT02_02
    SolutionIndex: 296
    SolutionNameMin: Cijk_Ailk_Bljk_HBH_MT032x008x32_PGR1_PLR1_TT02_02
    SolutionIndex: 297
    SolutionNameMin: Cijk_Ailk_Bljk_HBH_MT032x016x32_PGR1_PLR1_TT02_02
    SolutionIndex: 298
    SolutionNameMin: Cijk_Ailk_Bljk_HBH_MT064x016x32_PGR1_PLR1_TT04_02
    SolutionIndex: 299
    SolutionNameMin: Cijk_Ailk_Bljk_HBH_MT064x008x32_PGR1_PLR1_TT02_02
    SolutionIndex: 300
    SolutionNameMin: Cijk_Ailk_Bljk_HBH_MT064x016x32_PGR1_PLR1_TT02_02
    SolutionIndex: 301
    SolutionNameMin: Cijk_Ailk_Bljk_HBH_MT128x016x32_PGR1_PLR1_TT04_02
    SolutionIndex: 302
    SolutionNameMin: Cijk_Ailk_Bljk_HBH_MT032x008x64_PGR1_PLR1_TT02_02
    SolutionIndex: 303
    SolutionNameMin: Cijk_Ailk_Bljk_HBH_MT064x008x64_PGR1_PLR1_TT02_02
    SolutionIndex: 304
    SolutionNameMin: Cijk_Ailk_Bljk_HBH_MT064x032x08_PGR1_PLR1_TT08_04
    SolutionIndex: 305
    SolutionNameMin: Cijk_Ailk_Bljk_HBH_MT032x032x08_PGR1_PLR1_TT04_04
    SolutionIndex: 306
    SolutionNameMin: Cijk_Ailk_Bljk_HBH_MT064x032x08_PGR1_PLR1_TT08_04
    SolutionIndex: 307
    SolutionNameMin: Cijk_Ailk_Bljk_HBH_MT032x016x16_PGR1_PLR1_TT04_02
    SolutionIndex: 308
    SolutionNameMin: Cijk_Ailk_Bljk_HBH_MT032x032x16_PGR1_PLR1_TT04_04
    SolutionIndex: 309
    SolutionNameMin: Cijk_Ailk_Bljk_HBH_MT064x064x16_PGR1_PLR1_TT08_08
    SolutionIndex: 310
    SolutionNameMin: Cijk_Ailk_Bljk_HBH_MT064x016x16_PGR1_PLR1_TT04_02
    SolutionIndex: 311
    SolutionNameMin: Cijk_Ailk_Bljk_HBH_MT064x016x16_PGR1_PLR1_TT02_02
    SolutionIndex: 312
    SolutionNameMin: Cijk_Ailk_Bljk_HBH_MT128x016x16_PGR1_PLR1_TT04_02
    SolutionIndex: 313
    SolutionNameMin: Cijk_Ailk_Bljk_HBH_MT064x016x16_PGR1_PLR1_TT04_04
    SolutionIndex: 314
    SolutionNameMin: Cijk_Ailk_Bljk_HBH_MT064x008x16_PGR1_PLR1_TT02_02
    SolutionIndex: 315
    SolutionNameMin: Cijk_Ailk_Bljk_HBH_MT016x016x24_PGR1_PLR1_TT02_02
    SolutionIndex: 316
    SolutionNameMin: Cijk_Ailk_Bljk_HBH_MT032x016x24_PGR1_PLR1_TT04_02
    SolutionIndex: 317
    SolutionNameMin: Cijk_Ailk_Bljk_HBH_MT016x016x24_PGR1_PLR1_TT02_02
    SolutionIndex: 318
    SolutionNameMin: Cijk_Ailk_Bljk_HBH_MT032x016x24_PGR1_PLR1_TT04_02
    SolutionIndex: 319
    SolutionNameMin: Cijk_Ailk_Bljk_HBH_MT032x032x24_PGR1_PLR1_TT04_04
    SolutionIndex: 320
    SolutionNameMin: Cijk_Ailk_Bljk_HBH_MT032x032x32_PGR1_PLR1_TT04_04
    SolutionIndex: 321
    SolutionNameMin: Cijk_Ailk_Bljk_HBH_MT064x016x32_PGR1_PLR1_TT02_02
    SolutionIndex: 322
    SolutionNameMin: Cijk_Ailk_Bljk_HBH_MT128x016x32_PGR1_PLR1_TT04_02
    SolutionIndex: 323
    SolutionNameMin: Cijk_Ailk_Bljk_HBH_MT032x008x32_PGR1_PLR1_TT02_02
    SolutionIndex: 324
    SolutionNameMin: Cijk_Ailk_Bljk_HBH_MT064x008x32_PGR1_PLR1_TT02_02
    SolutionIndex: 325
    SolutionNameMin: Cijk_Ailk_Bljk_HBH_MT032x008x64_PGR1_PLR1_TT02_02
    SolutionIndex: 326
    SolutionNameMin: Cijk_Ailk_Bljk_HBH_MT064x008x64_PGR1_PLR1_TT02_02
    SolutionIndex: 327
    SolutionNameMin: Cijk_Ailk_Bljk_HBH_MT064x064x08_PGR1_PLR1_TT04_04
    SolutionIndex: 328
    SolutionNameMin: Cijk_Ailk_Bljk_HBH_MT064x128x08_PGR1_PLR1_TT04_08
    SolutionIndex: 329
    SolutionNameMin: Cijk_Ailk_Bljk_HBH_MT128x064x08_PGR1_PLR1_TT08_04
    SolutionIndex: 330
    SolutionNameMin: Cijk_Ailk_Bljk_HBH_MT064x032x16_PGR0_PLR1_TT08_04
    SolutionIndex: 331
    SolutionNameMin: Cijk_Ailk_Bljk_HBH_MT064x064x16_PGR1_PLR1_TT04_04
    SolutionIndex: 332
    SolutionNameMin: Cijk_Ailk_Bljk_HBH_MT064x128x16_PGR1_PLR1_TT04_08
    SolutionIndex: 333
    SolutionNameMin: Cijk_Ailk_Bljk_HBH_MT128x064x16_PGR1_PLR1_TT08_04
    SolutionIndex: 334
    SolutionNameMin: Cijk_Ailk_Bljk_HBH_MT128x128x16_PGR1_PLR1_TT08_08
    SolutionIndex: 335
    SolutionNameMin: Cijk_Ailk_Bljk_HBH_MT064x032x16_PGR0_PLR0_TT04_04
    SolutionIndex: 336
    SolutionNameMin: Cijk_Ailk_Bljk_HBH_MT064x128x16_PGR0_PLR0_TT04_08
    SolutionIndex: 337
    SolutionNameMin: Cijk_Ailk_Bljk_HBH_MT032x128x16_PGR1_PLR0_TT04_04
    SolutionIndex: 338
    SolutionNameMin: Cijk_Ailk_Bljk_HBH_MT032x128x16_PGR0_PLR0_TT04_04
    SolutionIndex: 339
    SolutionNameMin: Cijk_Ailk_Bljk_HBH_MT064x064x04_PGR1_PLR1_TT04_04
    SolutionIndex: 340
    SolutionNameMin: Cijk_Ailk_Bljk_HBH_MT064x064x08_PGR1_PLR1_TT04_04
    SolutionIndex: 341
    SolutionNameMin: Cijk_Ailk_Bljk_HBH_MT064x064x16_PGR1_PLR1_TT04_04
    SolutionIndex: 342
    SolutionNameMin: Cijk_Ailk_Bljk_HBH_MT032x032x08_PGR0_PLR1_TT04_04
    SolutionIndex: 343
    SolutionNameMin: Cijk_Ailk_Bljk_HBH_MT032x032x16_PGR1_PLR1_TT04_04
    SolutionIndex: 344
    SolutionNameMin: Cijk_Ailk_Bljk_HBH_MT064x016x16_PGR1_PLR1_TT04_04
    SolutionIndex: 345
    SolutionNameMin: Cijk_Ailk_Bljk_HBH_MT064x032x16_PGR1_PLR1_TT04_04
    SolutionIndex: 346
    SolutionNameMin: Cijk_Ailk_Bljk_HBH_MT064x064x16_PGR1_PLR1_TT04_04
    SolutionIndex: 347
    SolutionNameMin: Cijk_Ailk_Bljk_HBH_MT032x032x32_PGR1_PLR1_TT04_04
    SolutionIndex: 348
    SolutionNameMin: Cijk_Ailk_Bljk_HBH_MT064x016x32_PGR1_PLR1_TT04_04
    SolutionIndex: 349
    SolutionNameMin: Cijk_Ailk_Bljk_HBH_MT064x032x32_PGR1_PLR1_TT04_04
    SolutionIndex: 350
    SolutionNameMin: Cijk_Ailk_Bljk_HBH_MT128x016x32_PGR1_PLR1_TT04_04
    SolutionIndex: 351
    SolutionNameMin: Cijk_Ailk_Bljk_HBH_MT128x032x32_PGR1_PLR1_TT04_04
    SolutionIndex: 352
    SolutionNameMin: Cijk_Ailk_Bljk_HBH_MT064x064x16_PGR1_PLR1_TT08_08
    SolutionIndex: 353
    SolutionNameMin: Cijk_Ailk_Bljk_HBH_MT128x128x16_PGR1_PLR1_TT08_08
    SolutionIndex: 354
    SolutionNameMin: Cijk_Ailk_Bljk_HBH_MT032x032x08_PGR1_PLR1_TT04_04
    SolutionIndex: 355
    SolutionNameMin: Cijk_Ailk_Bljk_HBH_MT064x032x08_PGR1_PLR1_TT08_04
    SolutionIndex: 356
    SolutionNameMin: Cijk_Ailk_Bljk_HBH_MT064x064x08_PGR1_PLR1_TT08_08
    SolutionIndex: 357
    SolutionNameMin: Cijk_Ailk_Bljk_HBH_MT128x128x08_PGR1_PLR1_TT08_08
    SolutionIndex: 358
    SolutionNameMin: Cijk_Ailk_Bljk_HBH_MT128x032x16_PGR1_PLR1_TT08_04
    SolutionIndex: 359
    SolutionNameMin: Cijk_Ailk_Bljk_HBH_MT032x032x16_PGR1_PLR1_TT04_04
    SolutionIndex: 360
    SolutionNameMin: Cijk_Ailk_Bljk_HBH_MT064x032x16_PGR1_PLR1_TT08_04
    SolutionIndex: 361
    SolutionNameMin: Cijk_Ailk_Bljk_HBH_MT064x064x16_PGR1_PLR1_TT04_04
    SolutionIndex: 362
    SolutionNameMin: Cijk_Ailk_Bljk_HBH_MT128x064x16_PGR1_PLR1_TT08_04
    SolutionIndex: 363
    SolutionNameMin: Cijk_Ailk_Bljk_HBH_MT128x128x16_PGR1_PLR1_TT08_08
    SolutionIndex: 364
    SolutionNameMin: Cijk_Ailk_Bljk_HBH_MT064x032x16_PGR1_PLR1_TT04_04
    SolutionIndex: 365
    SolutionNameMin: Cijk_Ailk_Bljk_HBH_MT128x032x16_PGR1_PLR1_TT08_04
    SolutionIndex: 366
    SolutionNameMin: Cijk_Ailk_Bljk_HBH_MT128x064x32_PGR1_PLR1_TT08_04
    SolutionIndex: 367
    SolutionNameMin: Cijk_Ailk_Bljk_HBH_MT128x032x32_PGR1_PLR1_TT04_04
    SolutionIndex: 368
    SolutionNameMin: Cijk_Ailk_Bljk_HBH_MT064x016x32_PGR1_PLR1_TT04_04
    SolutionIndex: 369
    SolutionNameMin: Cijk_Ailk_Bljk_HBH_MT064x064x16_PGR1_PLR1_TT08_08
    SolutionIndex: 370
    SolutionNameMin: Cijk_Ailk_Bljk_HBH_MT128x128x16_PGR1_PLR1_TT08_08
    SolutionIndex: 371
    SolutionNameMin: Cijk_Ailk_Bljk_HBH_MT064x064x32_PGR1_PLR1_TT08_08
    SolutionIndex: 372
    SolutionNameMin: Cijk_Ailk_Bljk_HBH_MT128x128x32_PGR1_PLR1_TT08_08
    SolutionIndex: 373
    SolutionNameMin: Cijk_Ailk_Bljk_HBH_MT064x032x16_PGR0_PLR1_TT08_04
    SolutionIndex: 374
    SolutionNameMin: Cijk_Ailk_Bljk_HBH_MT128x128x32_PGR0_PLR1_TT08_08
    SolutionIndex: 375
    SolutionNameMin: Cijk_Ailk_Bljk_HBH_MT064x128x16_PGR1_PLR1_TT04_08
    SolutionIndex: 376
    SolutionNameMin: Cijk_Ailk_Bljk_HBH_MT128x064x16_PGR1_PLR1_TT08_04
    SolutionIndex: 377
    SolutionNameMin: Cijk_Ailk_Bljk_HBH_MT128x128x16_PGR1_PLR1_TT08_08
    SolutionIndex: 378
    SolutionNameMin: Cijk_Ailk_Bljk_HBH_MT128x064x16_PGR1_PLR1_TT04_08
    SolutionIndex: 379
    SolutionNameMin: Cijk_Ailk_Bljk_HBH_MT128x064x16_PGR1_PLR1_TT04_08
    SolutionIndex: 380
    SolutionNameMin: Cijk_Ailk_Bljk_HBH_MT128x064x32_PGR1_PLR1_TT04_04
    SolutionIndex: 381
    SolutionNameMin: Cijk_Ailk_Bljk_HBH_MT256x128x32_PGR1_PLR1_TT08_08
    SolutionIndex: 382
    SolutionNameMin: Cijk_Ailk_Bljk_HBH_MT128x032x16_PGR0_PLR0_TT08_04
    SolutionIndex: 383
    SolutionNameMin: Cijk_Ailk_Bljk_HBH_MT064x128x16_PGR1_PLR0_TT04_08
    SolutionIndex: 384
    SolutionNameMin: Cijk_Ailk_Bljk_HBH_MT128x064x16_PGR1_PLR0_TT08_04
    SolutionIndex: 385
    SolutionNameMin: Cijk_Ailk_Bljk_HBH_MT128x064x16_PGR1_PLR0_TT04_08
    SolutionIndex: 386
    SolutionNameMin: Cijk_Ailk_Bljk_HBH_MT064x128x04_PGR0_PLR0_TT04_08
    SolutionIndex: 387
    SolutionNameMin: Cijk_Ailk_Bljk_HBH_MT064x064x04_PGR0_PLR0_TT04_04
    SolutionIndex: 388
    SolutionNameMin: Cijk_Ailk_Bljk_HBH_MT064x064x04_PGR1_PLR0_TT04_04
    SolutionIndex: 389
    SolutionNameMin: Cijk_Ailk_Bljk_HBH_MT064x064x04_PGR0_PLR1_TT04_04
    SolutionIndex: 390
    SolutionNameMin: Cijk_Ailk_Bljk_HBH_MT064x064x04_PGR1_PLR1_TT04_04
    SolutionIndex: 391
    SolutionNameMin: Cijk_Ailk_Bljk_HBH_MT064x128x08_PGR0_PLR0_TT04_08
    SolutionIndex: 392
    SolutionNameMin: Cijk_Ailk_Bljk_HBH_MT064x064x08_PGR0_PLR0_TT04_04
    SolutionIndex: 393
    SolutionNameMin: Cijk_Ailk_Bljk_HBH_MT064x128x08_PGR1_PLR0_TT04_08
    SolutionIndex: 394
    SolutionNameMin: Cijk_Ailk_Bljk_HBH_MT064x064x08_PGR1_PLR0_TT04_04
    SolutionIndex: 395
    SolutionNameMin: Cijk_Ailk_Bljk_HBH_MT064x128x08_PGR0_PLR1_TT04_08
    SolutionIndex: 396
    SolutionNameMin: Cijk_Ailk_Bljk_HBH_MT064x064x08_PGR0_PLR1_TT04_04
    SolutionIndex: 397
    SolutionNameMin: Cijk_Ailk_Bljk_HBH_MT064x064x08_PGR1_PLR1_TT04_04
    SolutionIndex: 398
    SolutionNameMin: Cijk_Ailk_Bljk_HBH_MT128x128x16_PGR0_PLR0_TT08_08
    SolutionIndex: 399
    SolutionNameMin: Cijk_Ailk_Bljk_HBH_MT064x128x16_PGR0_PLR0_TT04_08
    SolutionIndex: 400
    SolutionNameMin: Cijk_Ailk_Bljk_HBH_MT064x064x16_PGR1_PLR0_TT04_04
    SolutionIndex: 401
    SolutionNameMin: Cijk_Ailk_Bljk_HBH_MT064x064x16_PGR0_PLR1_TT04_04
    SolutionIndex: 402
    SolutionNameMin: Cijk_Ailk_Bljk_HBH_MT064x064x16_PGR1_PLR1_TT04_04
    SolutionIndex: 403
    SolutionNameMin: Cijk_Ailk_Bljk_HBH_MT128x128x04_PGR0_PLR0_TT08_08
    SolutionIndex: 404
    SolutionNameMin: Cijk_Ailk_Bljk_HBH_MT064x128x04_PGR0_PLR0_TT04_08
    SolutionIndex: 405
    SolutionNameMin: Cijk_Ailk_Bljk_HBH_MT064x064x04_PGR0_PLR0_TT04_04
    SolutionIndex: 406
    SolutionNameMin: Cijk_Ailk_Bljk_HBH_MT064x128x04_PGR1_PLR0_TT04_08
    SolutionIndex: 407
    SolutionNameMin: Cijk_Ailk_Bljk_HBH_MT064x064x04_PGR1_PLR0_TT04_04
    SolutionIndex: 408
    SolutionNameMin: Cijk_Ailk_Bljk_HBH_MT064x128x04_PGR0_PLR1_TT04_08
    SolutionIndex: 409
    SolutionNameMin: Cijk_Ailk_Bljk_HBH_MT064x064x04_PGR0_PLR1_TT04_04
    SolutionIndex: 410
    SolutionNameMin: Cijk_Ailk_Bljk_HBH_MT064x128x04_PGR1_PLR1_TT04_08
    SolutionIndex: 411
    SolutionNameMin: Cijk_Ailk_Bljk_HBH_MT064x064x04_PGR1_PLR1_TT04_04
    SolutionIndex: 412
    SolutionNameMin: Cijk_Ailk_Bljk_HBH_MT064x064x08_PGR0_PLR0_TT04_04
    SolutionIndex: 413
    SolutionNameMin: Cijk_Ailk_Bljk_HBH_MT064x128x08_PGR1_PLR0_TT04_08
    SolutionIndex: 414
    SolutionNameMin: Cijk_Ailk_Bljk_HBH_MT064x064x08_PGR1_PLR0_TT04_04
    SolutionIndex: 415
    SolutionNameMin: Cijk_Ailk_Bljk_HBH_MT064x128x08_PGR0_PLR1_TT04_08
    SolutionIndex: 416
    SolutionNameMin: Cijk_Ailk_Bljk_HBH_MT064x064x08_PGR0_PLR1_TT04_04
    SolutionIndex: 417
    SolutionNameMin: Cijk_Ailk_Bljk_HBH_MT064x064x08_PGR1_PLR1_TT04_04
    SolutionIndex: 418
    SolutionNameMin: Cijk_Ailk_Bljk_HBH_MT064x064x16_PGR0_PLR0_TT04_04
    SolutionIndex: 419
    SolutionNameMin: Cijk_Ailk_Bljk_HBH_MT128x128x16_PGR1_PLR0_TT08_08
    SolutionIndex: 420
    SolutionNameMin: Cijk_Ailk_Bljk_HBH_MT064x128x16_PGR1_PLR0_TT04_08
    SolutionIndex: 421
    SolutionNameMin: Cijk_Ailk_Bljk_HBH_MT064x064x16_PGR1_PLR1_TT04_04
    SolutionIndex: 422
    SolutionNameMin: Cijk_Ailk_Bljk_HBH_MT128x064x16_EPS1_GRVW08_LPB00_PGR1_PLR1_SNLL1_TT08_08_VW08_WG16_08_01_WGM01
    SolutionIndex: 423
    SolutionNameMin: Cijk_Ailk_Bljk_HBH_MT064x128x16_EPS1_GRVW04_LPB04_PGR1_PLR1_SNLL1_TT08_04_VW04_WG08_32_01_WGM01
    SolutionIndex: 424
    SolutionNameMin: Cijk_Ailk_Bljk_HBH_MT128x064x16_EPS1_GRVW04_LPB04_PGR1_PLR1_SNLL1_TT08_04_VW04_WG16_16_01_WGM01
    SolutionIndex: 425
    SolutionNameMin: Cijk_Ailk_Bljk_HBH_MT128x128x16_EPS1_GRVW04_LPB04_PGR1_PLR1_SNLL1_TT08_08_VW04_WG16_16_01_WGM01
    SolutionIndex: 426
    SolutionNameMin: Cijk_Ailk_Bljk_HBH_MT064x128x16_EPS1_GRVW04_LPB04_PGR1_PLR1_SNLL1_TT08_04_VW04_WG08_32_01_WGM08
    SolutionIndex: 427
    SolutionNameMin: Cijk_Ailk_Bljk_HBH_MT128x064x16_EPS1_GRVW04_LPB04_PGR1_PLR1_SNLL1_TT08_04_VW04_WG16_16_01_WGM08
    SolutionIndex: 428
    SolutionNameMin: Cijk_Ailk_Bljk_HBH_MT256x064x16_EPS1_GRVW04_LPB04_PGR1_PLR1_SNLL1_TT08_08_VW04_WG32_08_01_WGM64
    SolutionIndex: 429
    SolutionNameMin: Cijk_Ailk_Bljk_HBH_MT064x128x32_EPS0_GRVW04_LPB04_PGR0_PLR0_SNLL0_TT08_04_VW04_WG08_32_01_WGM01
    SolutionIndex: 430
    SolutionNameMin: Cijk_Ailk_Bljk_HBH_MT064x064x32_EPS0_GRVW04_LPB04_PGR0_PLR0_SNLL0_TT04_04_VW04_WG16_16_01_WGM01
    SolutionIndex: 431
    SolutionNameMin: Cijk_Ailk_Bljk_HBH_MT128x064x32_EPS1_GRVW04_LPB04_PGR1_PLR1_SNLL1_TT08_04_VW04_WG16_16_01_WGM01
    SolutionIndex: 432
    SolutionNameMin: Cijk_Ailk_Bljk_HBH_MT064x064x32_EPS0_GRVW04_LPB04_PGR0_PLR0_SNLL0_TT04_04_VW04_WG16_16_01_WGM08
    SolutionIndex: 433
    SolutionNameMin: Cijk_Ailk_Bljk_HBH_MT128x064x32_EPS0_GRVW08_LPB08_PGR0_PLR1_SNLL0_TT08_08_VW08_WG16_08_01_WGM01
    SolutionIndex: 434
    SolutionNameMin: Cijk_Ailk_Bljk_HBH_MT64x128x16_MI32x32x4x2_SE_AF0EM1_ASEM1_GRVW2_ONLL0_SNLL1
    SolutionIndex: 435
    SolutionNameMin: Cijk_Ailk_Bljk_HBH_MT64x128x16_MI32x32x4x2_SE_AF0EM1_ASEM2_GRVW2_ONLL0_SNLL1
    SolutionIndex: 436
    SolutionNameMin: Cijk_Ailk_Bljk_HBH_MT64x128x16_MI32x32x4x2_SE_AF0EM2_ASEM1_GRVW2_ONLL0_SNLL1
    SolutionIndex: 437
    SolutionNameMin: Cijk_Ailk_Bljk_HBH_MT64x128x16_MI32x32x4x2_SE_AF0EM1_ASEM1_GRVW2_ONLL0_SNLL0
    SolutionIndex: 438
    SolutionNameMin: Cijk_Ailk_Bljk_HBH_MT64x128x16_MI32x32x4x2_SE_AF0EM1_ASEM2_GRVW2_ONLL0_SNLL0
    SolutionIndex: 439
    SolutionNameMin: Cijk_Ailk_Bljk_HBH_MT64x128x16_MI32x32x4x2_SE_AF0EM2_ASEM1_GRVW2_ONLL0_SNLL0
    SolutionIndex: 440
    SolutionNameMin: Cijk_Ailk_Bljk_HBH_MT64x128x16_MI32x32x4x2_SE_AF0EM2_ASEM2_GRVW2_ONLL0_SNLL0
    SolutionIndex: 441
    SolutionNameMin: Cijk_Ailk_Bljk_HBH_MT64x128x32_MI32x32x4x2_SE_AF0EM2_ASEM2_GRVW2_ONLL0_SNLL0
    SolutionIndex: 442
    SolutionNameMin: Cijk_Ailk_Bljk_HBH_MT32x256x16_MI32x32x4x2_SE_AF0EM1_ASEM2_GRVW4_ONLL0_SNLL0
    SolutionIndex: 443
    SolutionNameMin: Cijk_Ailk_Bljk_HBH_MT64x128x16_MI32x32x4x2_SE_AF0EM1_ASEM1_GRVW2_ONLL1_SNLL1
    SolutionIndex: 444
    SolutionNameMin: Cijk_Ailk_Bljk_HBH_MT64x128x16_MI32x32x4x2_SE_AF0EM1_ASEM2_GRVW2_ONLL1_SNLL1
    SolutionIndex: 445
    SolutionNameMin: Cijk_Ailk_Bljk_HBH_MT64x128x16_MI32x32x4x2_SE_AF0EM2_ASEM1_GRVW2_ONLL1_SNLL1
    SolutionIndex: 446
    SolutionNameMin: Cijk_Ailk_Bljk_HBH_MT64x128x16_MI32x32x4x2_SE_AF0EM2_ASEM2_GRVW2_ONLL1_SNLL1
    SolutionIndex: 447
    SolutionNameMin: Cijk_Ailk_Bljk_HBH_MT64x128x16_MI32x32x4x2_SE_AF0EM1_ASEM1_GRVW2_ONLL1_SNLL0
    SolutionIndex: 448
    SolutionNameMin: Cijk_Ailk_Bljk_HBH_MT64x128x16_MI32x32x4x2_SE_AF0EM1_ASEM2_GRVW2_ONLL1_SNLL0
    SolutionIndex: 449
    SolutionNameMin: Cijk_Ailk_Bljk_HBH_MT64x128x16_MI32x32x4x2_SE_AF0EM2_ASEM1_GRVW2_ONLL1_SNLL0
    SolutionIndex: 450
    SolutionNameMin: Cijk_Ailk_Bljk_HBH_MT64x128x16_MI32x32x4x2_SE_AF0EM2_ASEM2_GRVW2_ONLL1_SNLL0
    SolutionIndex: 451
    SolutionNameMin: Cijk_Ailk_Bljk_HBH_MT64x128x8_MI32x32x4x2_SE_AF0EM2_ASEM1_GRVW4_ONLL1_SNLL0
    SolutionIndex: 452
    SolutionNameMin: Cijk_Ailk_Bljk_HBH_MT64x128x8_MI32x32x4x2_SE_AF0EM2_ASEM2_GRVW4_ONLL1_SNLL0
    SolutionIndex: 453
    SolutionNameMin: Cijk_Ailk_Bljk_HBH_MT32x256x16_MI32x32x4x2_SE_AF0EM2_ASEM2_GRVW4_ONLL1_SNLL0
    SolutionIndex: 454
    SolutionNameMin: Cijk_Ailk_Bljk_HBH_MT64x256x16_MI32x32x4x2_SE_AF0EM1_ASEM2_GRVW2_ONLL0_SNLL1
    SolutionIndex: 455
    SolutionNameMin: Cijk_Ailk_Bljk_HBH_MT64x256x16_MI32x32x4x2_SE_AF0EM1_ASEM1_GRVW2_ONLL0_SNLL0
    SolutionIndex: 456
    SolutionNameMin: Cijk_Ailk_Bljk_HBH_MT64x256x16_MI32x32x4x2_SE_AF0EM1_ASEM2_GRVW2_ONLL0_SNLL0
    SolutionIndex: 457
    SolutionNameMin: Cijk_Ailk_Bljk_HBH_MT64x256x16_MI32x32x4x2_SE_AF0EM1_ASEM1_GRVW2_ONLL1_SNLL1
    SolutionIndex: 458
    SolutionNameMin: Cijk_Ailk_Bljk_HBH_MT64x256x16_MI32x32x4x2_SE_AF0EM1_ASEM1_GRVW2_ONLL1_SNLL0
    SolutionIndex: 459
    SolutionNameMin: Cijk_Ailk_Bljk_HBH_MT64x256x16_MI32x32x4x2_SE_AF0EM1_ASEM2_GRVW2_ONLL1_SNLL0
    SolutionIndex: 460
    SolutionIndex: 461
    SolutionIndex: 462
    SolutionIndex: 463
    SolutionIndex: 464
    SolutionIndex: 465
    SolutionIndex: 466
    SolutionIndex: 467
    SolutionIndex: 468
    SolutionIndex: 469
    SolutionIndex: 470
    SolutionIndex: 471
    SolutionIndex: 472
    SolutionIndex: 473
    SolutionIndex: 474
    SolutionIndex: 475
    SolutionIndex: 476
    SolutionIndex: 477
    SolutionIndex: 478
    SolutionIndex: 479
    SolutionIndex: 480
    SolutionIndex: 481
    SolutionIndex: 482
    SolutionIndex: 483
    SolutionIndex: 484
    SolutionIndex: 485
    SolutionIndex: 486
    SolutionIndex: 487
    SolutionIndex: 488
    SolutionIndex: 489
    SolutionIndex: 490
    SolutionIndex: 491
    SolutionIndex: 492
    SolutionIndex: 493
    SolutionIndex: 494
    SolutionIndex: 495
    SolutionIndex: 496
    SolutionIndex: 497
    SolutionIndex: 498
    SolutionIndex: 499
    SolutionIndex: 500
    SolutionIndex: 501
    SolutionIndex: 502
    SolutionIndex: 503
    SolutionIndex: 504
    SolutionIndex: 505
    SolutionIndex: 506
    SolutionIndex: 507
    SolutionIndex: 508
    SolutionIndex: 509
    SolutionIndex: 510
    SolutionIndex: 511
    SolutionIndex: 512
    SolutionIndex: 513
    SolutionIndex: 514
    SolutionIndex: 515
    SolutionIndex: 516
    SolutionIndex: 517
    SolutionIndex: 518
    SolutionIndex: 519
    SolutionIndex: 520
    SolutionIndex: 521
    SolutionIndex: 522
    SolutionIndex: 523
    SolutionIndex: 524
    SolutionIndex: 525
    SolutionIndex: 526
    SolutionIndex: 527
    SolutionIndex: 528
    SolutionIndex: 529
    SolutionIndex: 530
    SolutionIndex: 531
    SolutionIndex: 532
    SolutionIndex: 533
    SolutionIndex: 534
    SolutionIndex: 535
    SolutionIndex: 536
    SolutionIndex: 537
    SolutionIndex: 538
    SolutionIndex: 539
    SolutionIndex: 540
    SolutionIndex: 541
    SolutionIndex: 542
    SolutionIndex: 543
    SolutionIndex: 544
    SolutionIndex: 545
    SolutionIndex: 546
    SolutionIndex: 547
    SolutionIndex: 548
    SolutionIndex: 549
    SolutionIndex: 550
    SolutionIndex: 551
    SolutionIndex: 552
    SolutionIndex: 553
    SolutionIndex: 554
    SolutionIndex: 555
    SolutionIndex: 556
    SolutionIndex: 557
    SolutionIndex: 558
    SolutionIndex: 559
    SolutionIndex: 560
    SolutionIndex: 561
    SolutionIndex: 562
    SolutionIndex: 563
    SolutionIndex: 564
    SolutionIndex: 565
    SolutionIndex: 566
    SolutionIndex: 567
    SolutionIndex: 568
    SolutionIndex: 569
    SolutionIndex: 570
    SolutionIndex: 571
    SolutionIndex: 572
    SolutionIndex: 573
- - - [1024, 1024, 1, 3328]
    - [21, 9231.92]
  - - [2944, 4288, 1, 1280]
    - [44, 10205.8]
  - - [2368, 64, 1, 3328]
    - [37, 4925.44]
  - - [2368, 5888, 1, 256]
    - [41, 9906.08]
  - - [256, 704, 1, 1280]
    - [21, 4055.67]
  - - [128, 6784, 1, 3328]
    - [25, 8287.11]
  - - [5888, 1856, 1, 3328]
    - [44, 10356.5]
  - - [5888, 2944, 1, 3328]
    - [44, 10362.5]
  - - [1856, 4288, 1, 256]
    - [40, 9603.07]
  - - [5056, 5056, 1, 3328]
    - [44, 10474.1]
  - - [1408, 5888, 1, 1280]
    - [46, 10182.3]
  - - [1024, 3584, 1, 3328]
    - [44, 10158.6]
  - - [448, 3584, 1, 3328]
    - [44, 8554.62]
  - - [256, 4288, 1, 3328]
    - [44, 7929.43]
  - - [5888, 1408, 1, 1280]
    - [46, 10183.9]
  - - [704, 1856, 1, 3328]
    - [44, 9428.57]
  - - [1024, 2368, 1, 256]
    - [46, 8555.09]
  - - [5056, 6784, 1, 1280]
    - [40, 10454.9]
  - - [1408, 64, 1, 1280]
    - [12, 3482.64]
  - - [448, 1024, 1, 1280]
    - [32, 7017.24]
  - - [5056, 5056, 1, 1280]
    - [44, 10399.7]
  - - [4288, 6784, 1, 256]
    - [41, 10079.9]
  - - [6784, 448, 1, 256]
    - [46, 9055.44]
  - - [5056, 256, 1, 1280]
    - [44, 9187.86]
  - - [5888, 704, 1, 1280]
    - [44, 9985.33]
  - - [3584, 1024, 1, 256]
    - [46, 9463.38]
  - - [6784, 4288, 1, 3328]
    - [44, 10521.3]
  - - [1856, 2368, 1, 3328]
    - [44, 10084.5]
  - - [5888, 2944, 1, 1280]
    - [40, 10272.9]
  - - [5888, 1024, 1, 256]
    - [40, 9675.93]
  - - [448, 64, 1, 1280]
    - [16, 1267.27]
  - - [1024, 704, 1, 256]
    - [18, 6886.17]
  - - [1408, 2944, 1, 256]
    - [46, 9461.12]
  - - [256, 1856, 1, 1280]
    - [21, 7260.91]
  - - [6784, 5056, 1, 3328]
    - [44, 10529.9]
  - - [5056, 5056, 1, 256]
    - [19, 10065.5]
  - - [256, 2944, 1, 3328]
    - [44, 8471.35]
  - - [64, 1024, 1, 1280]
    - [34, 2766.69]
  - - [1024, 3584, 1, 1280]
    - [44, 10032.5]
  - - [2368, 2944, 1, 1280]
    - [44, 10114.5]
  - - [128, 3584, 1, 1280]
    - [2, 7154.03]
  - - [6784, 6784, 1, 1280]
    - [46, 10484.1]
  - - [1024, 256, 1, 3328]
    - [32, 6220.87]
  - - [1408, 4288, 1, 1280]
    - [44, 9838.09]
  - - [3584, 4288, 1, 1280]
    - [44, 10335.5]
  - - [2368, 704, 1, 1280]
    - [44, 8745.31]
  - - [5056, 4288, 1, 3328]
    - [44, 10473.3]
  - - [3584, 2368, 1, 3328]
    - [44, 10204.8]
  - - [5888, 6784, 1, 1280]
    - [40, 10431.2]
  - - [64, 704, 1, 1280]
    - [36, 1902.1]
  - - [4288, 256, 1, 256]
    - [44, 7082.12]
  - - [6784, 448, 1, 1280]
    - [44, 9642.63]
  - - [2944, 5888, 1, 256]
    - [40, 9864.8]
  - - [256, 128, 1, 256]
    - [16, 970.904]
  - - [4288, 2944, 1, 256]
    - [40, 9764.67]
  - - [5888, 64, 1, 3328]
    - [25, 7264.23]
  - - [2944, 256, 1, 3328]
    - [21, 8494.3]
  - - [5056, 2368, 1, 1280]
    - [40, 10288.5]
  - - [448, 3584, 1, 1280]
    - [44, 8434.07]
  - - [6784, 5888, 1, 256]
    - [41, 10103.7]
  - - [64, 1024, 1, 3328]
    - [34, 2973.06]
  - - [704, 128, 1, 1280]
    - [12, 3525.16]
  - - [1408, 448, 1, 1280]
    - [21, 7018.49]
  - - [1024, 1408, 1, 256]
    - [40, 7886.73]
  - - [2368, 2368, 1, 3328]
    - [44, 10020.6]
  - - [5056, 704, 1, 3328]
    - [44, 9847.2]
  - - [1408, 1856, 1, 256]
    - [46, 9199.55]
  - - [1408, 256, 1, 1280]
    - [21, 5615.55]
  - - [5888, 1856, 1, 256]
    - [46, 9920.59]
  - - [704, 5888, 1, 256]
    - [41, 9447.64]
  - - [6784, 64, 1, 256]
    - [26, 5717.54]
  - - [3584, 704, 1, 3328]
    - [44, 9619.89]
  - - [1408, 1408, 1, 256]
    - [47, 8538.2]
  - - [1024, 64, 1, 1280]
    - [9, 2781.37]
  - - [448, 4288, 1, 256]
    - [22, 8251.38]
  - - [64, 3584, 1, 3328]
    - [29, 6054.59]
  - - [704, 2368, 1, 1280]
    - [44, 8753.92]
  - - [1856, 2368, 1, 1280]
    - [44, 9984.42]
  - - [2368, 128, 1, 3328]
    - [24, 6190.07]
  - - [1408, 1408, 1, 3328]
    - [44, 9317.67]
  - - [2944, 128, 1, 256]
    - [7, 5582.7]
  - - [448, 1408, 1, 256]
    - [44, 6079.85]
  - - [64, 5056, 1, 3328]
    - [6, 6592.13]
  - - [1408, 1024, 1, 1280]
    - [44, 8698.61]
  - - [704, 6784, 1, 256]
    - [40, 9245.61]
  - - [6784, 704, 1, 256]
    - [40, 9228.9]
  - - [256, 3584, 1, 3328]
    - [44, 8072.81]
  - - [5056, 704, 1, 256]
    - [19, 9170.82]
  - - [1408, 3584, 1, 256]
    - [46, 9339.54]
  - - [3584, 4288, 1, 3328]
    - [44, 10417.8]
  - - [5888, 1856, 1, 1280]
    - [46, 10284.1]
  - - [256, 1408, 1, 256]
    - [44, 4669.77]
  - - [5056, 64, 1, 1280]
    - [24, 6313.83]
  - - [2368, 128, 1, 256]
    - [6, 4731.52]
  - - [2368, 3584, 1, 1280]
    - [44, 10118.5]
  - - [1024, 256, 1, 256]
    - [21, 4559.03]
  - - [448, 448, 1, 256]
    - [11, 4039.33]
  - - [2944, 3584, 1, 3328]
    - [44, 10241.4]
  - - [256, 256, 1, 3328]
    - [13, 2979.56]
  - - [128, 1024, 1, 3328]
    - [12, 5105.43]
  - - [6784, 2944, 1, 256]
    - [41, 9908.66]
  - - [64, 1856, 1, 1280]
    - [12, 4349.07]
  - - [448, 256, 1, 256]
    - [13, 3033.07]
  - - [1856, 2368, 1, 256]
    - [40, 9413.67]
  - - [3584, 6784, 1, 3328]
    - [44, 10494.6]
  - - [256, 1024, 1, 256]
    - [21, 4634.59]
  - - [1024, 128, 1, 1280]
    - [12, 4766.25]
  - - [4288, 128, 1, 1280]
    - [4, 6969.7]
  - - [5056, 4288, 1, 1280]
    - [44, 10401.0]
  - - [5888, 64, 1, 256]
    - [7, 5661.33]
  - - [6784, 1856, 1, 3328]
    - [44, 10256.5]
  - - [1408, 5056, 1, 1280]
    - [44, 9972.14]
  - - [1856, 256, 1, 1280]
    - [21, 7281.78]
  - - [64, 5888, 1, 3328]
    - [6, 6636.84]
  - - [6784, 5888, 1, 3328]
    - [44, 10508.3]
  - - [448, 256, 1, 3328]
    - [12, 4484.04]
  - - [2368, 5056, 1, 1280]
    - [44, 10294.6]
  - - [1024, 704, 1, 1280]
    - [21, 7982.24]
  - - [256, 1408, 1, 3328]
    - [21, 5791.69]
  - - [6784, 128, 1, 3328]
    - [25, 8277.61]
  - - [1024, 5056, 1, 1280]
    - [44, 10047.0]
  - - [4288, 1024, 1, 256]
    - [40, 9379.79]
  - - [2368, 1408, 1, 256]
    - [40, 9166.03]
  - - [704, 704, 1, 3328]
    - [21, 7851.36]
  - - [5888, 448, 1, 1280]
    - [44, 9092.04]
  - - [3584, 256, 1, 3328]
    - [21, 8139.96]
  - - [704, 5888, 1, 3328]
    - [44, 10094.2]
  - - [1024, 6784, 1, 1280]
    - [44, 10077.9]
  - - [128, 3584, 1, 3328]
    - [2, 7388.36]
  - - [128, 704, 1, 1280]
    - [12, 3491.02]
  - - [3584, 2944, 1, 1280]
    - [44, 10159.5]
  - - [1856, 128, 1, 3328]
    - [35, 6274.81]
  - - [128, 2944, 1, 1280]
    - [7, 6986.46]
  - - [448, 1856, 1, 1280]
    - [21, 7257.97]
  - - [1408, 5056, 1, 3328]
    - [44, 10056.2]
  - - [1856, 1856, 1, 3328]
    - [44, 9540.06]
  - - [3584, 128, 1, 256]
    - [26, 5991.86]
  - - [448, 1408, 1, 3328]
    - [21, 7181.35]
  - - [2368, 2368, 1, 256]
    - [19, 9444.08]
  - - [4288, 4288, 1, 1280]
    - [40, 10295.8]
  - - [64, 448, 1, 1280]
    - [15, 1270.78]
  - - [5888, 1024, 1, 1280]
    - [44, 10224.6]
  - - [704, 1024, 1, 256]
    - [44, 6886.17]
  - - [704, 6784, 1, 3328]
    - [44, 9846.33]
  - - [5888, 5888, 1, 3328]
    - [44, 10487.0]
  - - [5056, 1024, 1, 1280]
    - [44, 10055.6]
  - - [448, 5888, 1, 3328]
    - [44, 9194.28]
  - - [1024, 2944, 1, 1280]
    - [44, 9555.18]
  - - [5056, 5888, 1, 1280]
    - [41, 10439.1]
  - - [448, 6784, 1, 256]
    - [45, 9030.22]
  - - [256, 3584, 1, 256]
    - [44, 7057.72]
  - - [256, 448, 1, 256]
    - [37, 3058.35]
  - - [3584, 5888, 1, 256]
    - [40, 9964.35]
  - - [2944, 3584, 1, 256]
    - [40, 9705.15]
  - - [1408, 704, 1, 256]
    - [46, 7588.38]
  - - [6784, 1024, 1, 3328]
    - [44, 10169.2]
  - - [6784, 2944, 1, 3328]
    - [44, 10396.9]
  - - [64, 64, 1, 3328]
    - [12, 189.748]
  - - [6784, 2368, 1, 1280]
    - [46, 10298.6]
  - - [4288, 3584, 1, 256]
    - [40, 9895.03]
  - - [4288, 5888, 1, 1280]
    - [44, 10378.3]
  - - [448, 2944, 1, 3328]
    - [44, 8086.49]
  - - [4288, 1856, 1, 1280]
    - [44, 10082.9]
  - - [1856, 2944, 1, 3328]
    - [44, 10223.3]
  - - [256, 6784, 1, 3328]
    - [44, 9236.39]
  - - [64, 5888, 1, 256]
    - [20, 5407.45]
  - - [5056, 1024, 1, 256]
    - [41, 9582.13]
  - - [704, 64, 1, 3328]
    - [38, 2068.81]
  - - [5056, 1856, 1, 3328]
    - [44, 10358.6]
  - - [448, 448, 1, 3328]
    - [29, 5324.8]
  - - [448, 2368, 1, 1280]
    - [44, 7540.59]
  - - [1408, 128, 1, 1280]
    - [6, 5252.43]
  - - [5056, 256, 1, 3328]
    - [44, 9349.62]
  - - [704, 704, 1, 256]
    - [21, 6318.61]
  - - [1024, 5888, 1, 1280]
    - [44, 10225.7]
  - - [64, 128, 1, 256]
    - [3, 216.659]
  - - [128, 1856, 1, 1280]
    - [14, 5948.55]
  - - [5056, 3584, 1, 256]
    - [41, 9980.43]
  - - [1856, 1024, 1, 1280]
    - [44, 8821.8]
  - - [1856, 1856, 1, 1280]
    - [44, 9431.18]
  - - [128, 4288, 1, 3328]
    - [4, 7099.75]
  - - [1856, 1024, 1, 3328]
    - [44, 8937.69]
  - - [256, 2368, 1, 256]
    - [44, 5896.25]
  - - [1024, 448, 1, 3328]
    - [21, 7261.84]
  - - [1856, 704, 1, 1280]
    - [44, 9254.53]
  - - [6784, 1024, 1, 256]
    - [40, 9590.11]
  - - [5056, 5888, 1, 3328]
    - [44, 10492.0]
  - - [1856, 1024, 1, 256]
    - [22, 8174.38]
  - - [5056, 1408, 1, 3328]
    - [44, 10060.3]
  - - [1024, 1024, 1, 1280]
    - [21, 9034.58]
  - - [448, 5888, 1, 256]
    - [40, 8526.3]
  - - [1408, 6784, 1, 3328]
    - [44, 10265.0]
  - - [2944, 1408, 1, 3328]
    - [44, 10091.2]
  - - [2944, 4288, 1, 3328]
    - [44, 10280.8]
  - - [256, 2944, 1, 256]
    - [44, 7199.18]
  - - [5056, 2944, 1, 256]
    - [40, 9919.12]
  - - [2368, 1856, 1, 256]
    - [40, 9407.41]
  - - [128, 6784, 1, 1280]
    - [7, 8139.21]
  - - [1408, 3584, 1, 3328]
    - [44, 9900.27]
  - - [2368, 6784, 1, 256]
    - [41, 9970.23]
  - - [4288, 2368, 1, 3328]
    - [44, 10360.5]
  - - [704, 3584, 1, 1280]
    - [44, 9501.11]
  - - [1408, 5888, 1, 3328]
    - [44, 10271.9]
  - - [1856, 5056, 1, 256]
    - [19, 9835.79]
  - - [6784, 6784, 1, 256]
    - [41, 10190.5]
  - - [1408, 704, 1, 3328]
    - [44, 8714.14]
  - - [128, 5888, 1, 1280]
    - [1, 8310.56]
  - - [2368, 4288, 1, 1280]
    - [44, 10279.3]
  - - [3584, 1856, 1, 1280]
    - [44, 10009.5]
  - - [704, 1408, 1, 3328]
    - [44, 8714.14]
  - - [704, 64, 1, 1280]
    - [15, 1897.09]
  - - [3584, 448, 1, 256]
    - [44, 7749.66]
  - - [3584, 3584, 1, 1280]
    - [44, 10378.3]
  - - [256, 6784, 1, 256]
    - [40, 8332.01]
  - - [1856, 3584, 1, 3328]
    - [44, 10106.3]
  - - [128, 448, 1, 256]
    - [34, 1683.49]
  - - [3584, 3584, 1, 256]
    - [40, 9923.77]
  - - [6784, 4288, 1, 1280]
    - [40, 10453.6]
  - - [448, 704, 1, 1280]
    - [21, 4932.82]
  - - [3584, 5056, 1, 256]
    - [46, 9970.14]
  - - [6784, 128, 1, 256]
    - [7, 7198.77]
  - - [64, 1408, 1, 3328]
    - [12, 3790.35]
  - - [704, 448, 1, 256]
    - [21, 4102.66]
  - - [2944, 2368, 1, 1280]
    - [44, 10110.8]
  - - [448, 64, 1, 3328]
    - [39, 1390.16]
  - - [6784, 3584, 1, 256]
    - [41, 10018.6]
  - - [256, 1856, 1, 3328]
    - [32, 7593.43]
  - - [256, 704, 1, 256]
    - [21, 3134.33]
  - - [128, 1408, 1, 256]
    - [6, 3819.32]
  - - [64, 128, 1, 3328]
    - [37, 379.921]
  - - [1856, 1408, 1, 256]
    - [41, 9159.25]
  - - [2944, 2944, 1, 3328]
    - [44, 10119.4]
  - - [5056, 6784, 1, 256]
    - [41, 10104.0]
  - - [1408, 4288, 1, 3328]
    - [44, 9919.46]
  - - [6784, 256, 1, 1280]
    - [44, 9104.63]
  - - [1024, 704, 1, 3328]
    - [21, 8113.99]
  - - [2368, 704, 1, 3328]
    - [44, 8870.59]
  - - [128, 4288, 1, 256]
    - [4, 6056.43]
  - - [3584, 6784, 1, 256]
    - [40, 10010.9]
  - - [128, 128, 1, 3328]
    - [15, 795.303]
  - - [5056, 1856, 1, 256]
    - [19, 9845.46]
  - - [704, 4288, 1, 256]
    - [19, 8952.74]
  - - [256, 448, 1, 3328]
    - [12, 4492.49]
  - - [1408, 6784, 1, 1280]
    - [44, 10169.7]
  - - [64, 2368, 1, 1280]
    - [12, 4609.95]
  - - [64, 6784, 1, 3328]
    - [2, 6899.07]
  - - [2944, 256, 1, 1280]
    - [44, 8276.34]
  - - [5056, 2368, 1, 3328]
    - [44, 10374.6]
  - - [2944, 4288, 1, 256]
    - [40, 9759.95]
  - - [1408, 3584, 1, 1280]
    - [44, 9802.18]
  - - [2368, 64, 1, 256]
    - [12, 3439.48]
  - - [256, 256, 1, 256]
    - [13, 1872.46]
  - - [704, 128, 1, 3328]
    - [12, 3794.19]
  - - [1856, 704, 1, 256]
    - [18, 8279.6]
  - - [2368, 6784, 1, 3328]
    - [44, 10367.1]
  - - [5056, 704, 1, 1280]
    - [44, 9750.2]
  - - [1856, 4288, 1, 3328]
    - [44, 10171.9]
  - - [1408, 5888, 1, 256]
    - [41, 9792.93]
  - - [704, 2944, 1, 1280]
    - [44, 9589.73]
  - - [4288, 64, 1, 1280]
    - [27, 5441.03]
  - - [704, 1856, 1, 256]
    - [40, 8279.6]
  - - [3584, 704, 1, 1280]
    - [44, 9507.84]
  - - [5888, 5056, 1, 256]
    - [42, 10114.0]
  - - [3584, 448, 1, 3328]
    - [44, 8550.23]
  - - [704, 2368, 1, 3328]
    - [44, 8871.73]
  - - [2944, 448, 1, 256]
    - [44, 7289.32]
  - - [448, 5056, 1, 3328]
    - [44, 9533.37]
  - - [2368, 128, 1, 1280]
    - [6, 5957.82]
  - - [4288, 448, 1, 256]
    - [22, 8240.32]
  - - [64, 6784, 1, 256]
    - [2, 5741.17]
  - - [64, 5056, 1, 1280]
    - [6, 6329.27]
  - - [5888, 2368, 1, 256]
    - [46, 9892.9]
  - - [704, 448, 1, 3328]
    - [21, 5085.4]
  - - [6784, 704, 1, 3328]
    - [44, 9847.8]
  - - [128, 64, 1, 1280]
    - [28, 338.687]
  - - [2368, 256, 1, 1280]
    - [21, 6735.64]
  - - [1408, 2944, 1, 3328]
    - [44, 10087.1]
  - - [64, 1024, 1, 256]
    - [13, 1889.33]
  - - [2368, 448, 1, 1280]
    - [21, 7584.37]
  - - [128, 3584, 1, 256]
    - [2, 5943.35]
  - - [1856, 448, 1, 3328]
    - [21, 7376.83]
  - - [128, 5056, 1, 256]
    - [7, 6903.13]
  - - [4288, 4288, 1, 256]
    - [40, 9878.84]
  - - [2368, 704, 1, 256]
    - [40, 8022.0]
  - - [3584, 2368, 1, 256]
    - [40, 9644.24]
  - - [5888, 5056, 1, 1280]
    - [46, 10444.2]
  - - [128, 1024, 1, 1280]
    - [12, 4733.98]
  - - [64, 704, 1, 256]
    - [10, 1310.72]
  - - [4288, 256, 1, 1280]
    - [44, 7813.01]
  - - [3584, 3584, 1, 3328]
    - [44, 10460.7]
  - - [128, 1024, 1, 256]
    - [37, 3302.6]
  - - [5888, 6784, 1, 256]
    - [41, 10098.1]
  - - [4288, 2944, 1, 3328]
    - [44, 10283.8]
  - - [1856, 64, 1, 256]
    - [12, 3115.65]
  - - [4288, 128, 1, 3328]
    - [4, 7095.33]
  - - [256, 5056, 1, 1280]
    - [44, 9151.32]
  - - [6784, 5888, 1, 1280]
    - [44, 10437.8]
  - - [704, 128, 1, 256]
    - [13, 2363.59]
  - - [5888, 4288, 1, 1280]
    - [44, 10379.9]
  - - [448, 256, 1, 1280]
    - [12, 4218.41]
  - - [448, 2368, 1, 3328]
    - [44, 7672.47]
  - - [1, 1, 1, 1280]
    - [54, 0.00964436]
  - - [256, 1408, 1, 1280]
    - [21, 5632.0]
  - - [1408, 1856, 1, 1280]
    - [44, 9833.5]
  - - [5888, 448, 1, 3328]
    - [44, 9199.67]
  - - [704, 5888, 1, 1280]
    - [44, 9971.82]
  - - [256, 64, 1, 3328]
    - [38, 793.451]
  - - [128, 2368, 1, 256]
    - [6, 4801.65]
  - - [6784, 64, 1, 3328]
    - [26, 6997.97]
  - - [5056, 2944, 1, 3328]
    - [44, 10438.5]
  - - [448, 128, 1, 256]
    - [34, 1699.08]
  - - [1856, 128, 1, 1280]
    - [35, 5985.97]
  - - [448, 4288, 1, 1280]
    - [44, 8919.45]
  - - [64, 3584, 1, 256]
    - [11, 4475.63]
  - - [128, 2944, 1, 3328]
    - [25, 7250.81]
  - - [3584, 704, 1, 256]
    - [46, 8853.11]
  - - [2944, 448, 1, 3328]
    - [44, 8096.04]
  - - [3584, 1408, 1, 3328]
    - [44, 9900.27]
  - - [2368, 1024, 1, 1280]
    - [44, 9128.79]
  - - [2944, 6784, 1, 1280]
    - [44, 10317.5]
  - - [1856, 6784, 1, 256]
    - [40, 9744.04]
  - - [4288, 448, 1, 3328]
    - [44, 9035.02]
  - - [6784, 704, 1, 1280]
    - [44, 9748.07]
  - - [5888, 1024, 1, 3328]
    - [44, 10321.4]
  - - [704, 6784, 1, 1280]
    - [44, 9745.58]
  - - [5888, 128, 1, 256]
    - [21, 7220.73]
  - - [5056, 1024, 1, 3328]
    - [44, 10153.6]
  - - [704, 5056, 1, 1280]
    - [44, 9731.87]
  - - [64, 704, 1, 3328]
    - [15, 2068.8]
  - - [2944, 1856, 1, 256]
    - [40, 9575.58]
  - - [5056, 64, 1, 256]
    - [6, 5051.07]
  - - [5888, 5056, 1, 3328]
    - [46, 10498.2]
  - - [128, 5056, 1, 3328]
    - [7, 8281.22]
  - - [3584, 6784, 1, 1280]
    - [40, 10422.3]
  - - [1856, 5888, 1, 256]
    - [41, 9912.15]
  - - [64, 448, 1, 3328]
    - [39, 1395.05]
  - - [4288, 4288, 1, 3328]
    - [44, 10373.2]
  - - [4288, 1408, 1, 1280]
    - [44, 9836.09]
  - - [64, 1856, 1, 256]
    - [12, 3040.87]
  - - [4288, 2368, 1, 256]
    - [40, 9807.67]
  - - [2944, 5056, 1, 1280]
    - [40, 10356.5]
  - - [256, 4288, 1, 1280]
    - [44, 7809.54]
  - - [6784, 2368, 1, 3328]
    - [44, 10369.9]
  - - [256, 1024, 1, 1280]
    - [21, 5899.16]
  - - [4288, 128, 1, 256]
    - [4, 6014.95]
  - - [4288, 1856, 1, 3328]
    - [44, 10179.4]
  - - [1856, 2944, 1, 1280]
    - [44, 10117.5]
  - - [3584, 64, 1, 1280]
    - [14, 5761.41]
  - - [4288, 6784, 1, 3328]
    - [44, 10529.9]
  - - [3584, 1024, 1, 1280]
    - [44, 10037.7]
  - - [1024, 4288, 1, 256]
    - [40, 9373.53]
  - - [5888, 3584, 1, 3328]
    - [44, 10447.6]
  - - [5056, 3584, 1, 3328]
    - [44, 10371.9]
  - - [1408, 128, 1, 3328]
    - [6, 5541.26]
  - - [2368, 1408, 1, 1280]
    - [44, 9790.12]
  - - [5056, 2944, 1, 1280]
    - [40, 10358.8]
  - - [3584, 256, 1, 256]
    - [44, 7074.73]
  - - [1024, 6784, 1, 256]
    - [40, 9561.21]
  - - [2944, 5056, 1, 3328]
    - [44, 10442.9]
  - - [3584, 2944, 1, 256]
    - [40, 9719.12]
  - - [448, 128, 1, 3328]
    - [13, 2604.27]
  - - [64, 2944, 1, 3328]
    - [24, 5806.03]
  - - [64, 4288, 1, 3328]
    - [27, 5693.95]
  - - [5056, 6784, 1, 3328]
    - [44, 10526.2]
  - - [128, 2944, 1, 256]
    - [7, 5661.33]
  - - [3584, 4288, 1, 256]
    - [40, 9908.99]
  - - [1856, 6784, 1, 3328]
    - [44, 10257.1]
  - - [3584, 128, 1, 3328]
    - [26, 7354.19]
  - - [128, 256, 1, 1280]
    - [16, 1464.49]
  - - [64, 448, 1, 256]
    - [16, 873.813]
  - - [64, 256, 1, 1280]
    - [15, 728.178]
  - - [5056, 1408, 1, 1280]
    - [46, 9962.55]
  - - [5888, 5888, 1, 256]
    - [41, 10068.0]
  - - [4288, 1024, 1, 1280]
    - [44, 9977.95]
  - - [5888, 128, 1, 3328]
    - [1, 8494.3]
  - - [448, 6784, 1, 3328]
    - [44, 9751.06]
  - - [2944, 1408, 1, 1280]
    - [44, 9979.32]
  - - [64, 128, 1, 1280]
    - [12, 337.82]
  - - [2944, 1856, 1, 3328]
    - [44, 10220.6]
  - - [448, 5056, 1, 256]
    - [40, 8753.96]
  - - [64, 64, 1, 256]
    - [3, 109.227]
  - - [3584, 5888, 1, 1280]
    - [40, 10372.1]
  - - [6784, 1856, 1, 1280]
    - [40, 10176.2]
  - - [5888, 256, 1, 3328]
    - [44, 9232.18]
  - - [1856, 5888, 1, 3328]
    - [44, 10362.4]
  - - [3584, 1408, 1, 256]
    - [46, 9328.75]
  - - [704, 3584, 1, 3328]
    - [44, 9622.54]
  - - [5056, 448, 1, 1280]
    - [44, 9410.92]
  - - [3584, 1856, 1, 3328]
    - [44, 10106.3]
  - - [1408, 704, 1, 1280]
    - [21, 8549.71]
  - - [2944, 1024, 1, 256]
    - [46, 9015.79]
  - - [448, 1408, 1, 1280]
    - [21, 7028.23]
  - - [2368, 4288, 1, 3328]
    - [44, 10356.7]
  - - [1024, 1408, 1, 1280]
    - [44, 8701.9]
  - - [256, 128, 1, 1280]
    - [16, 1448.31]
  - - [704, 1408, 1, 1280]
    - [21, 8545.1]
  - - [6784, 5056, 1, 256]
    - [42, 10082.7]
  - - [4288, 5888, 1, 256]
    - [41, 9994.17]
  - - [448, 2944, 1, 256]
    - [40, 7340.03]
  - - [2944, 6784, 1, 256]
    - [40, 9896.38]
  - - [2368, 2368, 1, 1280]
    - [44, 9922.47]
  - - [1856, 3584, 1, 1280]
    - [44, 10013.2]
  - - [64, 2944, 1, 256]
    - [6, 3966.65]
  - - [3584, 1408, 1, 1280]
    - [44, 9800.98]
  - - [5056, 3584, 1, 1280]
    - [46, 10305.4]
  - - [256, 5888, 1, 256]
    - [46, 8245.21]
  - - [128, 256, 1, 3328]
    - [16, 1596.19]
  - - [1856, 1408, 1, 3328]
    - [44, 9965.29]
  - - [1024, 4288, 1, 3328]
    - [44, 10077.4]
  - - [448, 2368, 1, 256]
    - [44, 6858.11]
  - - [64, 1408, 1, 1280]
    - [12, 3533.86]
  - - [64, 6784, 1, 1280]
    - [26, 6810.6]
  - - [2944, 2368, 1, 3328]
    - [44, 10210.6]
  - - [704, 4288, 1, 3328]
    - [44, 9683.86]
  - - [1024, 1856, 1, 1280]
    - [44, 8821.8]
  - - [6784, 1856, 1, 256]
    - [40, 9739.33]
  - - [128, 2368, 1, 3328]
    - [6, 6202.25]
  - - [1024, 5888, 1, 256]
    - [40, 9651.76]
  - - [64, 2944, 1, 1280]
    - [24, 5441.62]
  - - [5056, 64, 1, 3328]
    - [24, 6595.34]
  - - [1408, 2368, 1, 256]
    - [40, 9142.47]
  - - [2944, 704, 1, 3328]
    - [44, 9743.39]
  - - [256, 64, 1, 256]
    - [15, 489.989]
  - - [2944, 2944, 1, 1280]
    - [46, 10039.4]
  - - [6784, 256, 1, 3328]
    - [44, 9241.11]
  - - [1408, 5056, 1, 256]
    - [46, 9571.56]
  - - [5056, 128, 1, 3328]
    - [25, 8263.43]
  - - [128, 128, 1, 1280]
    - [15, 728.178]
  - - [448, 704, 1, 256]
    - [44, 4119.41]
  - - [1856, 256, 1, 3328]
    - [32, 7495.53]
  - - [2944, 128, 1, 3328]
    - [25, 7230.72]
  - - [704, 256, 1, 256]
    - [21, 3203.98]
  - - [256, 448, 1, 1280]
    - [12, 4208.79]
  - - [704, 256, 1, 1280]
    - [33, 4096.0]
  - - [64, 2368, 1, 3328]
    - [37, 4933.15]
  - - [256, 704, 1, 3328]
    - [32, 4286.63]
  - - [1024, 1024, 1, 256]
    - [21, 7951.29]
  - - [1408, 4288, 1, 256]
    - [46, 9410.62]
  - - [5888, 2368, 1, 1280]
    - [46, 10247.8]
  - - [128, 256, 1, 256]
    - [10, 953.251]
  - - [256, 64, 1, 1280]
    - [15, 726.161]
  - - [2368, 5888, 1, 1280]
    - [40, 10235.1]
  - - [5888, 256, 1, 1280]
    - [44, 9080.31]
  - - [704, 1024, 1, 1280]
    - [44, 7921.93]
  - - [2368, 1856, 1, 3328]
    - [44, 10095.1]
  - - [2944, 704, 1, 256]
    - [22, 8890.41]
  - - [2368, 6784, 1, 1280]
    - [41, 10293.7]
  - - [2368, 1024, 1, 3328]
    - [44, 9250.18]
  - - [1856, 4288, 1, 1280]
    - [44, 10084.5]
  - - [704, 3584, 1, 256]
    - [40, 8833.74]
  - - [704, 2944, 1, 3328]
    - [44, 9740.1]
  - - [1856, 5056, 1, 3328]
    - [44, 10359.4]
  - - [3584, 5056, 1, 1280]
    - [46, 10309.8]
  - - [2944, 1024, 1, 3328]
    - [44, 9672.21]
  - - [256, 4288, 1, 256]
    - [44, 7067.87]
  - - [2368, 256, 1, 256]
    - [44, 5914.22]
  - - [1408, 6784, 1, 256]
    - [40, 9703.51]
  - - [6784, 1408, 1, 3328]
    - [44, 10265.0]
  - - [1024, 2368, 1, 1280]
    - [44, 9141.7]
  - - [704, 64, 1, 256]
    - [12, 1322.74]
  - - [256, 2368, 1, 3328]
    - [21, 6916.7]
  - - [6784, 2944, 1, 1280]
    - [44, 10319.8]
  - - [3584, 448, 1, 1280]
    - [44, 8428.51]
  - - [2944, 6784, 1, 3328]
    - [44, 10398.6]
  - - [448, 5056, 1, 1280]
    - [44, 9408.48]
  - - [4288, 5056, 1, 1280]
    - [40, 10402.5]
  - - [128, 448, 1, 1280]
    - [34, 2420.85]
  - - [4288, 704, 1, 256]
    - [19, 8969.37]
  - - [64, 64, 1, 1280]
    - [34, 179.06]
  - - [5888, 704, 1, 256]
    - [46, 9467.87]
  - - [256, 5888, 1, 3328]
    - [44, 9233.54]
  - - [6784, 4288, 1, 256]
    - [42, 10061.3]
  - - [5888, 256, 1, 256]
    - [40, 8217.12]
  - - [6784, 1024, 1, 1280]
    - [44, 10077.9]
  - - [704, 448, 1, 1280]
    - [21, 4942.48]
  - - [128, 64, 1, 3328]
    - [12, 379.921]
  - - [448, 64, 1, 256]
    - [37, 873.813]
  - - [2944, 704, 1, 1280]
    - [44, 9598.05]
  - - [6784, 3584, 1, 1280]
    - [40, 10419.5]
  - - [2944, 64, 1, 1280]
    - [6, 5471.24]
  - - [1408, 2944, 1, 1280]
    - [44, 9985.33]
  - - [256, 1856, 1, 256]
    - [44, 6009.63]
  - - [1408, 2368, 1, 3328]
    - [44, 9907.19]
  - - [128, 1408, 1, 3328]
    - [6, 5561.81]
  - - [2368, 2944, 1, 256]
    - [40, 9615.71]
  - - [64, 5056, 1, 256]
    - [6, 4978.22]
  - - [1408, 256, 1, 3328]
    - [32, 5776.07]
  - - [3584, 1856, 1, 256]
    - [46, 9592.65]
  - - [4288, 3584, 1, 1280]
    - [40, 10336.8]
  - - [2368, 448, 1, 256]
    - [21, 6885.93]
  - - [4288, 256, 1, 3328]
    - [44, 7934.94]
  - - [1408, 64, 1, 256]
    - [13, 2402.99]
  - - [4288, 2944, 1, 1280]
    - [44, 10206.3]
  - - [5056, 448, 1, 3328]
    - [44, 9539.16]
  - - [1024, 64, 1, 256]
    - [13, 1889.33]
  - - [64, 2368, 1, 256]
    - [12, 3391.37]
  - - [4288, 5056, 1, 3328]
    - [44, 10478.7]
  - - [2944, 256, 1, 256]
    - [18, 7135.28]
  - - [1024, 128, 1, 3328]
    - [37, 5076.9]
  - - [256, 5056, 1, 3328]
    - [44, 9341.52]
  - - [5056, 2368, 1, 256]
    - [19, 9915.22]
  - - [4288, 704, 1, 3328]
    - [44, 9682.37]
  - - [448, 3584, 1, 256]
    - [40, 7749.66]
  - - [2368, 64, 1, 1280]
    - [12, 4609.95]
  - - [1024, 1408, 1, 3328]
    - [44, 8838.59]
  - - [2944, 5888, 1, 1280]
    - [40, 10277.5]
  - - [5888, 3584, 1, 256]
    - [41, 9952.6]
  - - [1408, 1856, 1, 3328]
    - [44, 9969.86]
  - - [6784, 1408, 1, 1280]
    - [44, 10179.2]
  - - [704, 2944, 1, 256]
    - [22, 8866.64]
  - - [4288, 64, 1, 256]
    - [5, 4435.26]
  - - [2944, 5888, 1, 3328]
    - [44, 10357.6]
  - - [64, 4288, 1, 1280]
    - [5, 5481.79]
  - - [6784, 64, 1, 1280]
    - [2, 6810.6]
  - - [704, 1856, 1, 1280]
    - [44, 9262.73]
  - - [1408, 64, 1, 3328]
    - [12, 3778.89]
  - - [1408, 1408, 1, 1280]
    - [44, 9204.72]
  - - [448, 1024, 1, 3328]
    - [32, 7272.91]
  - - [448, 4288, 1, 3328]
    - [44, 9034.0]
  - - [704, 2368, 1, 256]
    - [40, 8058.35]
  - - [2944, 448, 1, 1280]
    - [21, 7996.45]
  - - [5888, 2368, 1, 3328]
    - [44, 10315.2]
  - - [4288, 5056, 1, 256]
    - [40, 9985.11]
  - - [4288, 448, 1, 1280]
    - [44, 8909.11]
  - - [5888, 704, 1, 3328]
    - [44, 10088.9]
  - - [4288, 3584, 1, 3328]
    - [44, 10417.3]
  - - [2944, 64, 1, 256]
    - [6, 3966.65]
  - - [1024, 6784, 1, 3328]
    - [44, 10171.3]
  - - [1408, 1024, 1, 256]
    - [44, 7927.38]
  - - [448, 1024, 1, 256]
    - [44, 5872.03]
  - - [6784, 6784, 1, 3328]
    - [46, 10535.5]
  - - [1024, 448, 1, 1280]
    - [32, 7050.94]
  - - [704, 5056, 1, 3328]
    - [44, 9853.75]
  - - [256, 2368, 1, 1280]
    - [21, 6749.71]
  - - [3584, 5056, 1, 3328]
    - [46, 10366.7]
  - - [2368, 2944, 1, 3328]
    - [44, 10203.7]
  - - [448, 448, 1, 1280]
    - [29, 5057.11]
  - - [2368, 3584, 1, 256]
    - [40, 9657.96]
  - - [1024, 256, 1, 1280]
    - [44, 5890.88]
  - - [128, 5056, 1, 1280]
    - [7, 8089.6]
  - - [3584, 2368, 1, 1280]
    - [44, 10126.1]
  - - [1856, 1856, 1, 256]
    - [46, 8875.33]
  - - [4288, 1408, 1, 3328]
    - [44, 9923.77]
  - - [3584, 64, 1, 3328]
    - [29, 6066.14]
  - - [1, 1, 1, 1]
    - [52, 9.12409e-05]
  - - [256, 1024, 1, 3328]
    - [32, 6210.27]
  - - [1856, 64, 1, 3328]
    - [12, 4644.19]
  - - [5888, 1408, 1, 3328]
    - [44, 10274.9]
  - - [256, 5056, 1, 256]
    - [40, 8185.52]
  - - [1856, 64, 1, 1280]
    - [37, 4359.05]
  - - [1408, 256, 1, 256]
    - [44, 4669.77]
  - - [2368, 5056, 1, 256]
    - [19, 9912.65]
  - - [128, 5888, 1, 3328]
    - [44, 8471.35]
  - - [1024, 5056, 1, 256]
    - [46, 9576.59]
  - - [2368, 1408, 1, 3328]
    - [44, 9902.24]
  - - [5888, 448, 1, 256]
    - [40, 8526.3]
  - - [6784, 5056, 1, 1280]
    - [44, 10451.5]
  - - [4288, 6784, 1, 1280]
    - [40, 10455.5]
  - - [2368, 448, 1, 3328]
    - [44, 7671.13]
  - - [1024, 128, 1, 256]
    - [13, 3355.44]
  - - [448, 128, 1, 1280]
    - [13, 2433.7]
  - - [1024, 64, 1, 3328]
    - [34, 2976.31]
  - - [64, 3584, 1, 1280]
    - [29, 5752.38]
  - - [6784, 1408, 1, 256]
    - [40, 9706.59]
  - - [5888, 4288, 1, 256]
    - [40, 9969.51]
  - - [5056, 5888, 1, 256]
    - [41, 10134.4]
  - - [2368, 1024, 1, 256]
    - [40, 8526.88]
  - - [1856, 6784, 1, 1280]
    - [40, 10169.0]
  - - [3584, 128, 1, 1280]
    - [26, 7161.01]
  - - [128, 64, 1, 256]
    - [3, 216.648]
  - - [1408, 448, 1, 256]
    - [44, 6098.21]
  - - [64, 256, 1, 3328]
    - [15, 794.382]
  - - [6784, 448, 1, 3328]
    - [44, 9745.05]
  - - [5056, 1856, 1, 1280]
    - [44, 10275.3]
  - - [1408, 1024, 1, 3328]
    - [44, 8838.59]
  - - [2368, 256, 1, 3328]
    - [21, 6914.81]
  - - [5888, 3584, 1, 1280]
    - [40, 10370.5]
  - - [5888, 128, 1, 1280]
    - [21, 8304.84]
  - - [1024, 2944, 1, 256]
    - [46, 8965.52]
  - - [448, 6784, 1, 1280]
    - [44, 9633.09]
  - - [256, 3584, 1, 1280]
    - [21, 7965.31]
  - - [704, 5056, 1, 256]
    - [19, 9163.49]
  - - [3584, 1024, 1, 3328]
    - [44, 10156.5]
  - - [2944, 1856, 1, 1280]
    - [44, 10115.1]
  - - [5056, 256, 1, 256]
    - [18, 8234.34]
  - - [128, 5888, 1, 256]
    - [1, 7199.18]
  - - [2368, 3584, 1, 3328]
    - [44, 10205.7]
  - - [3584, 5888, 1, 3328]
    - [44, 10445.7]
  - - [2944, 3584, 1, 1280]
    - [44, 10163.2]
  - - [1856, 5888, 1, 1280]
    - [44, 10268.4]
  - - [256, 256, 1, 1280]
    - [34, 2744.96]
  - - [4288, 1408, 1, 256]
    - [41, 9392.35]
  - - [3584, 64, 1, 256]
    - [23, 4475.63]
  - - [64, 1856, 1, 3328]
    - [12, 4639.83]
  - - [1408, 128, 1, 256]
    - [24, 3844.78]
  - - [4288, 2368, 1, 1280]
    - [44, 10265.6]
  - - [2944, 5056, 1, 256]
    - [40, 9919.14]
  - - [256, 128, 1, 3328]
    - [16, 1596.19]
  - - [6784, 2368, 1, 256]
    - [42, 9949.0]
  - - [1408, 448, 1, 3328]
    - [21, 7197.11]
  - - [4288, 1856, 1, 256]
    - [40, 9613.93]
  - - [1856, 2944, 1, 256]
    - [40, 9570.37]
  - - [64, 5888, 1, 1280]
    - [20, 6669.59]
  - - [1856, 1408, 1, 1280]
    - [44, 9819.66]
  - - [128, 704, 1, 256]
    - [9, 2383.13]
  - - [1024, 4288, 1, 1280]
    - [44, 9972.28]
  - - [2368, 5056, 1, 3328]
    - [44, 10382.1]
  - - [4288, 1024, 1, 3328]
    - [44, 10081.8]
  - - [1024, 5056, 1, 3328]
    - [44, 10156.0]
  - - [1024, 1856, 1, 3328]
    - [44, 8935.67]
  - - [704, 704, 1, 1280]
    - [21, 7602.93]
  - - [128, 2368, 1, 1280]
    - [6, 5957.82]
  - - [3584, 256, 1, 1280]
    - [21, 7978.3]
  - - [5888, 64, 1, 1280]
    - [25, 6978.37]
  - - [128, 704, 1, 3328]
    - [37, 3778.89]
  - - [3584, 2944, 1, 3328]
    - [44, 10245.7]
  - - [128, 1856, 1, 256]
    - [23, 4552.2]
  - - [64, 4288, 1, 256]
    - [5, 4412.98]
  - - [5888, 2944, 1, 256]
    - [40, 9861.3]
  - - [5056, 128, 1, 1280]
    - [7, 8083.28]
  - - [448, 1856, 1, 3328]
    - [21, 7386.28]
  - - [5056, 4288, 1, 256]
    - [40, 9982.24]
  - - [1024, 448, 1, 256]
    - [21, 5848.63]
  - - [1024, 3584, 1, 256]
    - [46, 9417.84]
  - - [2944, 128, 1, 1280]
    - [25, 6994.56]
  - - [64, 256, 1, 256]
    - [9, 480.998]
  - - [704, 256, 1, 3328]
    - [33, 4255.02]
  - - [5056, 1408, 1, 256]
    - [41, 9567.54]
  - - [5888, 5888, 1, 1280]
    - [44, 10410.0]
  - - [448, 5888, 1, 1280]
    - [44, 9092.04]
  - - [1, 1, 1, 256]
    - [53, 0.00688172]
  - - [4288, 704, 1, 1280]
    - [44, 9571.96]
  - - [2944, 1408, 1, 256]
    - [42, 9420.84]
  - - [256, 2944, 1, 1280]
    - [44, 8299.16]
  - - [2368, 5888, 1, 3328]
    - [44, 10318.3]
  - - [704, 1024, 1, 3328]
    - [21, 8122.79]
  - - [2368, 1856, 1, 1280]
    - [44, 9980.17]
  - - [1856, 448, 1, 1280]
    - [21, 7261.93]
  - - [128, 6784, 1, 256]
    - [7, 7255.16]
  - - [5888, 4288, 1, 3328]
    - [44, 10453.1]
  - - [1856, 128, 1, 256]
    - [4, 4663.91]
  - - [5056, 448, 1, 256]
    - [40, 8732.87]
  - - [1856, 5056, 1, 1280]
    - [44, 10268.3]
  - - [2944, 1024, 1, 1280]
    - [44, 9558.98]
  - - [2368, 4288, 1, 256]
    - [40, 9804.71]
  - - [1024, 2368, 1, 3328]
    - [44, 9252.72]
  - - [4288, 64, 1, 3328]
    - [27, 5657.29]
  - - [704, 1408, 1, 256]
    - [44, 7606.58]
  - - [4288, 5888, 1, 3328]
    - [44, 10451.0]
  - - [448, 2944, 1, 1280]
    - [44, 7966.27]
  - - [1024, 2944, 1, 3328]
    - [44, 9671.47]
  - - [256, 6784, 1, 1280]
    - [44, 9101.64]
  - - [1856, 3584, 1, 256]
    - [41, 9588.33]
  - - [128, 448, 1, 3328]
    - [9, 2609.97]
  - - [1856, 256, 1, 256]
    - [21, 6033.47]
  - - [5056, 128, 1, 256]
    - [7, 6949.45]
  - - [256, 5888, 1, 1280]
    - [44, 9087.15]
  - - [6784, 128, 1, 1280]
    - [25, 8143.98]
  - - [64, 1408, 1, 256]
    - [12, 2443.72]
  - - [2944, 2368, 1, 256]
    - [40, 9611.57]
  - - [1856, 448, 1, 256]
    - [44, 6489.66]
  - - [1024, 1856, 1, 256]
    - [22, 8163.41]
  - - [6784, 3584, 1, 3328]
    - [44, 10489.3]
  - - [2944, 64, 1, 3328]
    - [6, 5797.42]
  - - [1024, 5888, 1, 3328]
    - [44, 10324.8]
  - - [1408, 2368, 1, 1280]
    - [44, 9795.52]
  - - [128, 1408, 1, 1280]
    - [6, 5242.88]
  - - [128, 1856, 1, 3328]
    - [35, 6290.81]
  - - [2944, 2944, 1, 256]
    - [41, 9660.36]
  - - [6784, 256, 1, 256]
    - [40, 8307.1]
  - - [128, 4288, 1, 1280]
    - [4, 6975.24]
  - - [5888, 1408, 1, 256]
    - [46, 9778.49]
  - - [128, 128, 1, 256]
    - [8, 494.611]
  - - [448, 704, 1, 3328]
    - [21, 5075.57]
  - - [448, 1856, 1, 256]
    - [40, 6442.52]
  - - [1856, 704, 1, 3328]
    - [44, 9430.19]
  - - [5888, 6784, 1, 3328]
    - [44, 10508.0]
  - - [704, 4288, 1, 1280]
    - [44, 9571.96]
  - - [4096, 7000, 1, 4096]
    - [83, 17060.9]
  - - [5124, 9124, 1, 1760]
    - [82, 17597.3]
  - - [1760, 32, 1, 1760]
    - [61, 2065.07]
  - - [1024, 1500, 1, 1536]
    - [75, 14247.0]
  - - [512, 24000, 1, 2048]
    - [85, 15569.1]
  - - [3072, 24000, 1, 1024]
    - [83, 17692.8]
  - - [1024, 3000, 1, 2560]
    - [83, 16608.2]
  - - [512, 3136, 1, 2048]
    - [94, 12702.2]
  - - [7680, 4, 1, 2560]
    - [61, 1128.63]
  - - [64, 193600, 1, 64]
    - [82, 13431.3]
  - - [8448, 1500, 1, 2816]
    - [82, 16834.1]
  - - [2560, 7000, 1, 2560]
    - [82, 17276.5]
  - - [3072, 16, 1, 1024]
    - [56, 1695.81]
  - - [512, 48000, 1, 2048]
    - [85, 15995.8]
  - - [1760, 64, 1, 1760]
    - [77, 4157.85]
  - - [1024, 16, 1, 512]
    - [58, 440.578]
  - - [196, 256, 64, 1024]
    - [95, 8949.31]
  - - [512, 48000, 1, 1536]
    - [83, 17684.6]
  - - [2560, 32, 1, 2560]
    - [61, 3037.59]
  - - [4608, 1500, 1, 1536]
    - [83, 16508.3]
  - - [2048, 128, 1, 2048]
    - [80, 8473.34]
  - - [1024, 24000, 1, 2560]
    - [82, 17746.8]
  - - [4608, 3000, 1, 1536]
    - [83, 16899.3]
  - - [5124, 9124, 1, 2048]
    - [83, 16332.6]
  - - [2048, 16, 1, 2048]
    - [60, 1217.5]
  - - [1024, 700, 1, 512]
    - [74, 9400.66]
  - - [3072, 1, 1, 128]
    - [56, 57.8259]
  - - [5124, 700, 1, 2560]
    - [83, 14715.1]
  - - [8448, 16, 1, 2816]
    - [57, 4678.38]
  - - [6144, 6000, 1, 2560]
    - [76, 16507.6]
  - - [4608, 32, 1, 1536]
    - [56, 5128.9]
  - - [3072, 64, 1, 1024]
    - [72, 6403.52]
  - - [512, 16, 1, 512]
    - [58, 220.289]
  - - [7680, 2, 1, 2560]
    - [61, 566.267]
  - - [4224, 1, 1, 128]
    - [56, 78.586]
  - - [7680, 1, 1, 2560]
    - [61, 283.46]
  - - [128, 1500, 1, 1280]
    - [56, 6536.17]
  - - [1024, 1500, 1, 2816]
    - [75, 14522.5]
  - - [6144, 2, 1, 2560]
    - [61, 450.419]
  - - [8448, 48000, 1, 2816]
    - [83, 15518.5]
  - - [512, 6000, 1, 2048]
    - [87, 12121.3]
  - - [4224, 1500, 1, 176]
    - [68, 14023.3]
  - - [1024, 6000, 1, 2816]
    - [82, 17591.4]
  - - [1024, 48000, 1, 1536]
    - [83, 18080.3]
  - - [1024, 48000, 1, 2560]
    - [82, 18254.9]
  - - [4096, 32, 1, 4096]
    - [62, 4827.98]
  - - [512, 16, 1, 500000]
    - [58, 330.658]
  - - [2560, 128, 1, 2560]
    - [77, 8673.08]
  - - [4608, 24000, 1, 1536]
    - [82, 18298.6]
  - - [512, 2, 1, 500000]
    - [58, 41.3314]
  - - [7680, 48000, 1, 2560]
    - [83, 15645.3]
  - - [3072, 48000, 1, 1024]
    - [83, 17986.4]
  - - [1760, 16, 1, 1760]
    - [56, 1035.99]
  - - [1024, 1500, 1, 2048]
    - [79, 11136.1]
  - - [1024, 16, 1, 500000]
    - [58, 661.008]
  - - [64, 193600, 1, 256]
    - [88, 15677.8]
  - - [1024, 3000, 1, 2048]
    - [84, 12173.9]
  - - [6144, 4, 1, 2560]
    - [61, 904.985]
  - - [1024, 6000, 1, 2048]
    - [85, 14556.8]
  - - [512, 24000, 1, 2816]
    - [82, 17783.8]
  - - [6144, 48000, 1, 2560]
    - [85, 14434.6]
  - - [1760, 7000, 1, 1760]
    - [69, 16687.6]
  - - [8448, 3000, 1, 2816]
    - [82, 17630.2]
  - - [3072, 4, 1, 1024]
    - [56, 423.953]
  - - [4608, 48000, 1, 1536]
    - [82, 18437.1]
  - - [2048, 32, 1, 2048]
    - [81, 2407.06]
  - - [7680, 1500, 1, 2560]
    - [83, 16260.4]
  - - [4096, 128, 1, 4096]
    - [73, 11511.0]
  - - [4608, 16, 1, 1536]
    - [61, 2655.87]
  - - [512, 3000, 1, 1536]
    - [75, 14260.7]
  - - [3072, 2, 1, 1024]
    - [56, 214.872]
  - - [8448, 1, 1, 2816]
    - [57, 289.834]
  - - [1024, 3000, 1, 2816]
    - [82, 17002.3]
  - - [128, 1, 1, 1408]
    - [56, 4.75274]
  - - [64, 1, 1, 1216]
    - [58, 2.11939]
  - - [1024, 2, 1, 512]
    - [58, 55.0723]
  - - [1024, 4, 1, 500000]
    - [58, 165.084]
  - - [6144, 1, 1, 2560]
    - [61, 226.768]
  - - [5124, 9124, 1, 2560]
    - [83, 17113.5]
  - - [512, 48000, 1, 2816]
    - [82, 18060.4]
  - - [512, 3000, 1, 2816]
    - [75, 14530.3]
  - - [1024, 24000, 1, 1536]
    - [83, 17629.1]
  - - [7680, 6000, 1, 2560]
    - [82, 17726.0]
  - - [1760, 128, 1, 1760]
    - [80, 7497.97]
  - - [512, 1500, 1, 2816]
    - [74, 11273.4]
  - - [512, 1, 1, 512]
    - [63, 16.1419]
  - - [512, 6000, 1, 2560]
    - [83, 16656.0]
  - - [512, 8, 1, 500000]
    - [58, 165.328]
  - - [512, 24000, 1, 2560]
    - [83, 17561.4]
  - - [6144, 3000, 1, 2560]
    - [85, 16106.6]
  - - [1024, 24000, 1, 2816]
    - [82, 18138.0]
  - - [2048, 7000, 1, 2048]
    - [85, 15826.5]
  - - [7680, 3000, 1, 2560]
    - [76, 16179.8]
  - - [1024, 4, 1, 512]
    - [58, 110.609]
  - - [5124, 700, 1, 2048]
    - [85, 13074.5]
  - - [5124, 9124, 1, 4096]
    - [76, 15808.6]
  - - [4096, 64, 1, 4096]
    - [81, 8409.63]
  - - [256, 193600, 1, 64]
    - [65, 14460.0]
  - - [7680, 32, 1, 2560]
    - [64, 8501.97]
  - - [2560, 64, 1, 2560]
    - [72, 5877.67]
  - - [3072, 128, 1, 1024]
    - [77, 9514.49]
  - - [8448, 6000, 1, 2816]
    - [83, 17792.5]
  - - [7680, 64, 1, 2560]
    - [58, 11163.0]
  - - [5124, 1500, 1, 2560]
    - [83, 16136.5]
  - - [1024, 1500, 1, 2560]
    - [75, 14448.0]
  - - [512, 4, 1, 512]
    - [63, 64.251]
  - - [1024, 6000, 1, 2560]
    - [83, 17205.6]
  - - [3072, 32, 1, 1024]
    - [81, 3364.41]
  - - [6144, 32, 1, 2560]
    - [72, 6883.43]
  - - [196, 1024, 64, 256]
    - [98, 12380.8]
  - - [512, 50176, 1, 128]
    - [90, 15888.7]
  - - [4608, 1, 1, 1536]
    - [61, 165.681]
  - - [1024, 32, 1, 512]
    - [58, 907.858]
  - - [7680, 24000, 1, 2560]
    - [83, 17224.8]
  - - [8448, 4, 1, 2816]
    - [61, 1155.96]
  - - [512, 1, 1, 500000]
    - [58, 20.6657]
  - - [176, 1500, 1, 1408]
    - [58, 6743.69]
  - - [512, 3000, 1, 2560]
    - [75, 14469.2]
  - - [8448, 24000, 1, 2816]
    - [83, 14526.0]
  - - [4608, 2, 1, 1536]
    - [61, 329.511]
  - - [512, 6000, 1, 1536]
    - [83, 16415.9]
  - - [7680, 128, 1, 2560]
    - [66, 13827.4]
  - - [3072, 6000, 1, 1024]
    - [83, 16775.4]
  - - [3072, 1500, 1, 128]
    - [82, 12889.5]
  - - [2048, 3136, 1, 512]
    - [92, 15706.6]
  - - [1024, 3000, 1, 1536]
    - [83, 16365.8]
  - - [512, 4, 1, 500000]
    - [58, 82.6644]
  - - [512, 6000, 1, 2816]
    - [83, 16718.4]
  - - [128, 50176, 1, 512]
    - [89, 15938.0]
  - - [256, 12544, 1, 1024]
    - [93, 14000.1]
  - - [1024, 12544, 1, 256]
    - [91, 16382.7]
  - - [512, 48000, 1, 2560]
    - [83, 17747.2]
  - - [2560, 16, 1, 2560]
    - [56, 1534.8]
  - - [2048, 64, 1, 2048]
    - [81, 4719.33]
  - - [512, 2, 1, 512]
    - [63, 32.1255]
  - - [1024, 1, 1, 512]
    - [58, 27.5361]
  - - [512, 1500, 1, 2560]
    - [74, 11050.4]
  - - [512, 24000, 1, 1536]
    - [83, 17469.8]
  - - [1024, 1, 1, 500000]
    - [58, 41.1425]
  - - [6144, 16, 1, 2560]
    - [61, 3615.78]
  - - [1024, 24000, 1, 2048]
    - [85, 15988.1]
  - - [4096, 16, 1, 4096]
    - [62, 2507.81]
  - - [512, 32, 1, 512]
    - [58, 455.903]
  - - [5124, 1500, 1, 2048]
    - [85, 14375.8]
  - - [3072, 1500, 1, 1024]
    - [75, 14683.2]
  - - [1024, 2, 1, 500000]
    - [58, 82.5046]
  - - [1024, 8, 1, 500000]
    - [58, 330.528]
  - - [7680, 16, 1, 2560]
    - [61, 4514.54]
  - - [6144, 1500, 1, 2560]
    - [83, 16981.2]
  - - [3072, 1, 1, 1024]
    - [56, 107.143]
  - - [1024, 48000, 1, 2816]
    - [82, 18584.6]
  - - [8448, 2, 1, 2816]
    - [61, 579.103]
  - - [4608, 4, 1, 1536]
    - [61, 659.021]
  - - [1024, 6000, 1, 1536]
    - [83, 17098.8]
  - - [8448, 32, 1, 2816]
    - [58, 7214.43]
  - - [512, 3000, 1, 2048]
    - [85, 11148.7]
  - - [6144, 24000, 1, 2560]
    - [85, 15954.4]
  - - [4608, 6000, 1, 1536]
    - [83, 17669.4]
  - - [1024, 1024, 1, 1024]
    - [85, 13068.9]
  - - [512, 1500, 1, 2048]
    - [85, 9265.22]
  - - [512, 1500, 1, 1536]
    - [74, 10818.5]
  - - [128, 1, 1, 1024]
    - [56, 4.64136]
  - - [3072, 3000, 1, 1024]
    - [85, 15741.2]
  - - [1024, 48000, 1, 2048]
    - [83, 16800.7]
  - - [3136, 64, 128, 64]
    - [143, 15223.8]
  - - [784, 512, 64, 128]
    - [136, 18907.2]
  - - [3136, 256, 64, 64]
    - [143, 18012.3]
  - - [12544, 1024, 1, 256]
    - [139, 20780.7]
  - - [784, 128, 128, 512]
    - [138, 19837.9]
  - - [784, 512, 256, 128]
    - [142, 18471.7]
  - - [3136, 64, 64, 256]
    - [140, 19306.8]
  - - [3136, 512, 1, 2048]
    - [141, 15558.0]
  - - [12544, 256, 1, 1024]
    - [144, 17648.9]
  - - [3136, 2048, 1, 512]
    - [137, 19499.1]
  - - [3136, 256, 256, 64]
    - [146, 18095.6]
  - - [3136, 64, 128, 256]
    - [137, 19910.0]
  - - [784, 128, 64, 512]
    - [138, 19325.0]
  - - [3136, 64, 256, 64]
    - [143, 15429.5]
  - - [784, 512, 128, 128]
    - [136, 19136.0]
  - - [3136, 64, 64, 64]
    - [145, 14680.1]
  - - [784, 128, 256, 512]
    - [138, 20166.4]
  - - [3136, 64, 256, 256]
    - [140, 20048.3]
  - - [3136, 256, 128, 64]
    - [135, 18309.2]
  - - [64, 128, 512, 128]
    - [274, 14557.0]
  - - [64, 512, 1, 512]
    - [188, 945.0]
  - - [64, 512, 64, 512]
    - [265, 24010.0]
  - - [128, 128, 512, 64]
    - [272, 9282.0]
  - - [512, 512, 1, 64]
    - [209, 1531.0]
  - - [512, 512, 64, 64]
    - [267, 10974.0]
  - - [1024, 4, 1, 2]
    - [173, 1.0]
  - - [1024, 4, 1, 1024]
    - [249, 147.0]
  - - [1024, 32, 1, 2]
    - [205, 9.0]
  - - [1024, 32, 1, 1024]
    - [255, 1107.0]
  - - [1024, 2048, 1, 2]
    - [227, 237.0]
  - - [1024, 2048, 1, 1024]
    - [212, 29369.0]
  - - [1024, 2048, 1, 4096]
    - [207, 33755.0]
  - - [1024, 2048, 1, 30528]
    - [261, 41275.0]
  - - [1024, 4096, 1, 1024]
    - [242, 36621.0]
  - - [1024, 4096, 1, 4096]
    - [206, 40496.0]
  - - [1024, 4096, 1, 30528]
    - [204, 48353.0]
  - - [4096, 2048, 1, 1024]
    - [199, 41377.0]
  - - [4096, 4096, 1, 1024]
    - [193, 45808.0]
  - - [32, 33, 1600, 33]
    - [180, 1864.0]
  - - [32, 200, 1, 1]
    - [173, 1.0]
  - - [64, 3, 512, 3]
    - [183, 30.0]
  - - [64, 5, 512, 5]
    - [183, 81.0]
  - - [64, 5, 960, 5]
    - [178, 124.0]
  - - [64, 9, 512, 9]
    - [254, 239.0]
  - - [64, 512, 1, 1]
    - [190, 6.0]
  - - [67, 512, 1, 2048]
    - [271, 1258.0]
  - - [74, 512, 1, 2048]
    - [176, 1614.0]
  - - [74, 960, 1, 2048]
    - [247, 2901.0]
  - - [100, 512, 1, 2048]
    - [271, 2058.0]
  - - [128, 27, 32768, 27]
    - [197, 2610.0]
  - - [256, 1024, 1, 1]
    - [220, 30.0]
  - - [256, 8976, 1, 1536]
    - [269, 36981.0]
  - - [256, 8976, 1, 2048]
    - [241, 39061.0]
  - - [256, 8976, 1, 2304]
    - [253, 40800.0]
  - - [256, 8976, 1, 2560]
    - [218, 41614.0]
  - - [256, 8976, 1, 2816]
    - [234, 42415.0]
  - - [256, 8976, 1, 3072]
    - [225, 43085.0]
  - - [256, 8976, 1, 4352]
    - [187, 45275.0]
  - - [256, 8976, 1, 4864]
    - [189, 45927.0]
  - - [256, 8976, 1, 5376]
    - [225, 46288.0]
  - - [256, 8976, 1, 5632]
    - [187, 46592.0]
  - - [256, 8976, 1, 5888]
    - [187, 46758.0]
  - - [256, 8976, 1, 6144]
    - [208, 46113.0]
  - - [256, 8976, 1, 6656]
    - [187, 47182.0]
  - - [256, 8976, 1, 7168]
    - [222, 47604.0]
  - - [256, 8976, 1, 7424]
    - [189, 47684.0]
  - - [256, 8976, 1, 8192]
    - [225, 40815.0]
  - - [256, 8976, 1, 8448]
    - [189, 48107.0]
  - - [256, 8976, 1, 8960]
    - [189, 48385.0]
  - - [256, 8976, 1, 9472]
    - [187, 48471.0]
  - - [256, 8976, 1, 9728]
    - [187, 48561.0]
  - - [256, 8976, 1, 9984]
    - [189, 48655.0]
  - - [256, 8976, 1, 10240]
    - [208, 47802.0]
  - - [256, 8976, 1, 10496]
    - [187, 48791.0]
  - - [256, 8976, 1, 11008]
    - [256, 48945.0]
  - - [256, 8976, 1, 11520]
    - [273, 48985.0]
  - - [256, 8976, 1, 12288]
    - [201, 40199.0]
  - - [256, 8976, 1, 14336]
    - [225, 48285.0]
  - - [256, 8976, 1, 14848]
    - [264, 49614.0]
  - - [256, 8976, 1, 15104]
    - [189, 49609.0]
  - - [256, 8976, 1, 15872]
    - [264, 49721.0]
  - - [256, 8976, 1, 17152]
    - [189, 49869.0]
  - - [256, 8976, 1, 19712]
    - [187, 49714.0]
  - - [256, 8976, 1, 19968]
    - [208, 49653.0]
  - - [256, 8976, 1, 20480]
    - [225, 41490.0]
  - - [256, 8976, 1, 20992]
    - [258, 49638.0]
  - - [256, 8976, 1, 22016]
    - [229, 49687.0]
  - - [256, 8976, 1, 26112]
    - [266, 46739.0]
  - - [256, 8976, 1, 33536]
    - [235, 39564.0]
  - - [256, 8976, 1, 44505]
    - [215, 38680.0]
  - - [256, 32768, 1, 128]
    - [207, 17011.0]
  - - [257, 1024, 1, 4096]
    - [202, 8778.0]
  - - [480, 32768, 1, 1024]
    - [218, 53473.0]
  - - [512, 200, 1, 1]
    - [175, 10.0]
  - - [512, 200, 1, 32]
    - [184, 301.0]
  - - [512, 215, 1, 2048]
    - [231, 4270.0]
  - - [512, 256, 1, 2048]
    - [260, 5243.0]
  - - [512, 1600, 1, 32]
    - [192, 2409.0]
  - - [512, 1600, 1, 512]
    - [252, 18996.0]
  - - [512, 32768, 1, 256]
    - [224, 31323.0]
  - - [560, 200, 1, 1024]
    - [223, 3896.0]
  - - [560, 1600, 1, 1024]
    - [186, 27113.0]
  - - [768, 215, 1, 2048]
    - [179, 6434.0]
  - - [768, 256, 1, 2048]
    - [179, 7864.0]
  - - [1024, 200, 1, 1]
    - [177, 20.0]
  - - [1024, 512, 1, 1]
    - [245, 60.0]
  - - [1024, 512, 1, 64]
    - [192, 3130.0]
  - - [1024, 512, 1, 1024]
    - [259, 17163.0]
  - - [1024, 960, 1, 64]
    - [237, 4033.0]
  - - [1024, 960, 1, 1024]
    - [250, 21695.0]
  - - [1024, 1600, 1, 1]
    - [219, 119.0]
  - - [1024, 1600, 1, 1024]
    - [263, 35246.0]
  - - [1024, 1792, 1, 256]
    - [211, 21275.0]
  - - [1024, 2048, 1, 256]
    - [198, 17252.0]
  - - [1024, 2560, 1, 256]
    - [198, 21130.0]
  - - [1024, 3072, 1, 256]
    - [210, 22826.0]
  - - [1024, 3328, 1, 256]
    - [236, 24451.0]
  - - [1024, 3840, 1, 256]
    - [240, 27900.0]
  - - [1024, 4096, 1, 256]
    - [212, 22370.0]
  - - [1024, 4608, 1, 256]
    - [198, 24672.0]
  - - [1024, 4864, 1, 256]
    - [214, 24521.0]
  - - [1024, 5120, 1, 256]
    - [221, 25732.0]
  - - [1024, 5632, 1, 256]
    - [214, 28004.0]
  - - [1024, 6144, 1, 256]
    - [246, 24978.0]
  - - [1024, 6400, 1, 256]
    - [224, 25859.0]
  - - [1024, 7168, 1, 256]
    - [228, 28062.0]
  - - [1024, 7424, 1, 256]
    - [213, 29134.0]
  - - [1024, 7680, 1, 256]
    - [213, 30139.0]
  - - [1024, 7936, 1, 256]
    - [221, 26294.0]
  - - [1024, 8192, 1, 256]
    - [214, 27115.0]
  - - [1024, 8448, 1, 256]
    - [224, 27822.0]
  - - [1024, 8704, 1, 256]
    - [224, 28464.0]
  - - [1024, 8960, 1, 256]
    - [213, 29041.0]
  - - [1024, 9728, 1, 256]
    - [214, 28036.0]
  - - [1024, 9984, 1, 256]
    - [221, 28276.0]
  - - [1024, 10240, 1, 256]
    - [221, 28679.0]
  - - [1024, 10496, 1, 256]
    - [214, 28999.0]
  - - [1024, 11008, 1, 256]
    - [213, 30261.0]
  - - [1024, 11264, 1, 256]
    - [213, 30707.0]
  - - [1024, 11520, 1, 256]
    - [214, 30891.0]
  - - [1024, 12288, 1, 256]
    - [221, 29629.0]
  - - [1024, 13312, 1, 256]
    - [221, 31337.0]
  - - [1024, 13568, 1, 256]
    - [221, 29699.0]
  - - [1024, 14336, 1, 256]
    - [213, 30484.0]
  - - [1024, 14592, 1, 256]
    - [224, 30868.0]
  - - [1024, 14848, 1, 256]
    - [221, 31410.0]
  - - [1024, 15104, 1, 256]
    - [214, 31444.0]
  - - [1024, 16128, 1, 256]
    - [213, 30923.0]
  - - [1024, 17152, 1, 256]
    - [214, 31789.0]
  - - [1024, 18944, 1, 256]
    - [221, 32180.0]
  - - [1024, 19712, 1, 256]
    - [221, 31632.0]
  - - [1024, 19968, 1, 256]
    - [213, 31763.0]
  - - [1024, 20480, 1, 256]
    - [213, 32202.0]
  - - [1024, 20992, 1, 256]
    - [221, 32325.0]
  - - [1024, 21504, 1, 256]
    - [224, 31855.0]
  - - [1024, 22016, 1, 256]
    - [221, 32322.0]
  - - [1024, 23552, 1, 256]
    - [213, 32183.0]
  - - [1024, 28672, 1, 256]
    - [221, 32989.0]
  - - [1024, 32768, 1, 512]
    - [221, 44241.0]
  - - [1024, 32768, 1, 1024]
    - [222, 57396.0]
  - - [1024, 33536, 1, 256]
    - [228, 33220.0]
  - - [1024, 40448, 1, 256]
    - [224, 33708.0]
  - - [1600, 512, 1, 1024]
    - [257, 28112.0]
  - - [2048, 512, 1, 1]
    - [203, 73.0]
  - - [2048, 512, 1, 2048]
    - [230, 27142.0]
  - - [2048, 960, 1, 2048]
    - [233, 29485.0]
  - - [2048, 1024, 1, 1]
    - [191, 106.0]
  - - [2048, 1024, 1, 256]
    - [194, 16093.0]
  - - [3200, 1024, 1, 2048]
    - [248, 55627.0]
  - - [4096, 1024, 1, 1]
    - [196, 155.0]
  - - [64, 14, 1, 14]
    - [174, 2.0]
  - - [64, 14, 1, 15]
    - [174, 2.0]
  - - [64, 15, 1, 15]
    - [173, 2.0]
  - - [64, 15, 1, 15]
    - [173, 2.0]
  - - [64, 15, 1, 17]
    - [173, 2.0]
  - - [64, 17, 1, 17]
    - [173, 2.0]
  - - [64, 17, 1, 17]
    - [173, 2.0]
  - - [64, 17, 1, 21]
    - [174, 3.0]
  - - [64, 21, 1, 21]
    - [174, 4.0]
  - - [64, 24, 1, 24]
    - [174, 5.0]
  - - [64, 24, 1, 34]
    - [174, 6.0]
  - - [64, 30, 1, 30]
    - [174, 7.0]
  - - [64, 31, 1, 30]
    - [182, 8.0]
  - - [64, 31, 1, 31]
    - [185, 8.0]
  - - [64, 32, 1, 32]
    - [177, 9.0]
  - - [64, 34, 1, 34]
    - [181, 9.0]
  - - [64, 35, 1, 32]
    - [180, 10.0]
  - - [64, 35, 1, 35]
    - [174, 9.0]
  - - [1024, 3840, 1, 1024]
    - [251, 54062.0]
  - - [1024, 3840, 1, 4096]
    - [225, 46102.0]
  - - [1024, 3968, 1, 1024]
    - [232, 36168.0]
  - - [1024, 3968, 1, 4096]
    - [206, 39755.0]
  - - [1024, 3968, 1, 42720]
    - [244, 47150.0]
  - - [1024, 6528, 1, 1024]
    - [241, 48506.0]
  - - [1024, 6528, 1, 4096]
    - [262, 47734.0]
  - - [1024, 6528, 1, 42720]
    - [239, 57819.0]
  - - [1024, 7104, 1, 1024]
    - [243, 48270.0]
  - - [1024, 7104, 1, 4096]
    - [262, 48853.0]
  - - [1024, 7104, 1, 42720]
    - [230, 62599.0]
  - - [1024, 7200, 1, 1024]
    - [241, 51881.0]
  - - [1024, 7200, 1, 4096]
    - [268, 48834.0]
  - - [1024, 7200, 1, 42720]
    - [239, 62681.0]
  - - [1024, 8064, 1, 1024]
    - [240, 44920.0]
  - - [1024, 8064, 1, 4096]
    - [218, 48071.0]
  - - [1024, 8160, 1, 1024]
    - [221, 44051.0]
  - - [1024, 8160, 1, 4096]
    - [222, 47556.0]
  - - [1024, 9216, 1, 1024]
    - [221, 50797.0]
  - - [1024, 9216, 1, 4096]
    - [218, 50071.0]
  - - [1024, 9520, 1, 1024]
    - [221, 51819.0]
  - - [1024, 9520, 1, 4096]
    - [216, 48411.0]
  - - [1024, 9520, 1, 42720]
    - [238, 62058.0]
  - - [1024, 10064, 1, 1024]
    - [206, 49815.0]
  - - [1024, 10064, 1, 4096]
    - [217, 47246.0]
  - - [1024, 10080, 1, 1024]
    - [208, 49744.0]
  - - [1024, 10080, 1, 4096]
    - [217, 47740.0]
  - - [1024, 10080, 1, 42720]
    - [226, 59594.0]
  - - [1024, 10200, 1, 1024]
    - [243, 47595.0]
  - - [1024, 10200, 1, 4096]
    - [208, 47350.0]
  - - [4096, 3840, 1, 1024]
    - [199, 44680.0]
  - - [4096, 3968, 1, 1024]
    - [199, 45304.0]
  - - [4096, 6528, 1, 1024]
    - [200, 45531.0]
  - - [4096, 7104, 1, 1024]
    - [199, 46141.0]
  - - [4096, 7200, 1, 1024]
    - [199, 46437.0]
  - - [4096, 8064, 1, 1024]
    - [199, 46373.0]
  - - [4096, 8160, 1, 1024]
    - [193, 45874.0]
  - - [4096, 9216, 1, 1024]
    - [199, 47053.0]
  - - [4096, 9520, 1, 1024]
    - [200, 46159.0]
  - - [4096, 10064, 1, 1024]
    - [200, 46521.0]
  - - [4096, 10080, 1, 1024]
    - [200, 46464.0]
  - - [4096, 10200, 1, 1024]
    - [200, 46774.0]
  - - [1024, 3240, 1, 1024]
    - [233, 42467.0]
  - - [1024, 3240, 1, 4096]
    - [270, 41472.0]
  - - [1024, 3960, 1, 1024]
    - [212, 34419.0]
  - - [1024, 3960, 1, 4096]
    - [206, 39705.0]
  - - [1024, 3960, 1, 42720]
    - [230, 46985.0]
  - - [4096, 3240, 1, 1024]
    - [200, 43646.0]
  - - [4096, 3960, 1, 1024]
    - [195, 44697.0]
  - - [64, 30, 2048, 30]
    - [286, 2874.0]
  - - [64, 31, 2048, 30]
    - [277, 2919.0]
  - - [64, 31, 2048, 31]
    - [282, 2988.0]
  - - [64, 27, 1920, 27]
    - [281, 2382.0]
  - - [64, 33, 1920, 27]
    - [285, 2726.0]
  - - [64, 33, 1920, 33]
    - [284, 3138.0]
  - - [64, 14, 10880, 14]
    - [276, 1015.0]
  - - [64, 14, 10880, 15]
    - [275, 1083.0]
  - - [64, 15, 7680, 15]
    - [283, 1121.0]
  - - [64, 15, 10880, 15]
    - [280, 1148.0]
  - - [64, 15, 7680, 17]
    - [279, 1172.0]
  - - [64, 17, 7680, 17]
    - [278, 1314.0]
  - - [1024, 1024, 1, 3328]
    - [308, 9231.92]
  - - [2944, 4288, 1, 1280]
    - [331, 10205.8]
  - - [2368, 64, 1, 3328]
    - [324, 4925.44]
  - - [2368, 5888, 1, 256]
    - [328, 9906.08]
  - - [256, 704, 1, 1280]
    - [308, 4055.67]
  - - [128, 6784, 1, 3328]
    - [312, 8287.11]
  - - [5888, 1856, 1, 3328]
    - [331, 10356.5]
  - - [5888, 2944, 1, 3328]
    - [331, 10362.5]
  - - [1856, 4288, 1, 256]
    - [327, 9603.07]
  - - [5056, 5056, 1, 3328]
    - [331, 10474.1]
  - - [1408, 5888, 1, 1280]
    - [333, 10182.3]
  - - [1024, 3584, 1, 3328]
    - [331, 10158.6]
  - - [448, 3584, 1, 3328]
    - [331, 8554.62]
  - - [256, 4288, 1, 3328]
    - [331, 7929.43]
  - - [5888, 1408, 1, 1280]
    - [333, 10183.9]
  - - [704, 1856, 1, 3328]
    - [331, 9428.57]
  - - [1024, 2368, 1, 256]
    - [333, 8555.09]
  - - [5056, 6784, 1, 1280]
    - [327, 10454.9]
  - - [1408, 64, 1, 1280]
    - [299, 3482.64]
  - - [448, 1024, 1, 1280]
    - [319, 7017.24]
  - - [5056, 5056, 1, 1280]
    - [331, 10399.7]
  - - [4288, 6784, 1, 256]
    - [328, 10079.9]
  - - [6784, 448, 1, 256]
    - [333, 9055.44]
  - - [5056, 256, 1, 1280]
    - [331, 9187.86]
  - - [5888, 704, 1, 1280]
    - [331, 9985.33]
  - - [3584, 1024, 1, 256]
    - [333, 9463.38]
  - - [6784, 4288, 1, 3328]
    - [331, 10521.3]
  - - [1856, 2368, 1, 3328]
    - [331, 10084.5]
  - - [5888, 2944, 1, 1280]
    - [327, 10272.9]
  - - [5888, 1024, 1, 256]
    - [327, 9675.93]
  - - [448, 64, 1, 1280]
    - [303, 1267.27]
  - - [1024, 704, 1, 256]
    - [305, 6886.17]
  - - [1408, 2944, 1, 256]
    - [333, 9461.12]
  - - [256, 1856, 1, 1280]
    - [308, 7260.91]
  - - [6784, 5056, 1, 3328]
    - [331, 10529.9]
  - - [5056, 5056, 1, 256]
    - [306, 10065.5]
  - - [256, 2944, 1, 3328]
    - [331, 8471.35]
  - - [64, 1024, 1, 1280]
    - [321, 2766.69]
  - - [1024, 3584, 1, 1280]
    - [331, 10032.5]
  - - [2368, 2944, 1, 1280]
    - [331, 10114.5]
  - - [128, 3584, 1, 1280]
    - [289, 7154.03]
  - - [6784, 6784, 1, 1280]
    - [333, 10484.1]
  - - [1024, 256, 1, 3328]
    - [319, 6220.87]
  - - [1408, 4288, 1, 1280]
    - [331, 9838.09]
  - - [3584, 4288, 1, 1280]
    - [331, 10335.5]
  - - [2368, 704, 1, 1280]
    - [331, 8745.31]
  - - [5056, 4288, 1, 3328]
    - [331, 10473.3]
  - - [3584, 2368, 1, 3328]
    - [331, 10204.8]
  - - [5888, 6784, 1, 1280]
    - [327, 10431.2]
  - - [64, 704, 1, 1280]
    - [323, 1902.1]
  - - [4288, 256, 1, 256]
    - [331, 7082.12]
  - - [6784, 448, 1, 1280]
    - [331, 9642.63]
  - - [2944, 5888, 1, 256]
    - [327, 9864.8]
  - - [256, 128, 1, 256]
    - [303, 970.904]
  - - [4288, 2944, 1, 256]
    - [327, 9764.67]
  - - [5888, 64, 1, 3328]
    - [312, 7264.23]
  - - [2944, 256, 1, 3328]
    - [308, 8494.3]
  - - [5056, 2368, 1, 1280]
    - [327, 10288.5]
  - - [448, 3584, 1, 1280]
    - [331, 8434.07]
  - - [6784, 5888, 1, 256]
    - [328, 10103.7]
  - - [64, 1024, 1, 3328]
    - [321, 2973.06]
  - - [704, 128, 1, 1280]
    - [299, 3525.16]
  - - [1408, 448, 1, 1280]
    - [308, 7018.49]
  - - [1024, 1408, 1, 256]
    - [327, 7886.73]
  - - [2368, 2368, 1, 3328]
    - [331, 10020.6]
  - - [5056, 704, 1, 3328]
    - [331, 9847.2]
  - - [1408, 1856, 1, 256]
    - [333, 9199.55]
  - - [1408, 256, 1, 1280]
    - [308, 5615.55]
  - - [5888, 1856, 1, 256]
    - [333, 9920.59]
  - - [704, 5888, 1, 256]
    - [328, 9447.64]
  - - [6784, 64, 1, 256]
    - [313, 5717.54]
  - - [3584, 704, 1, 3328]
    - [331, 9619.89]
  - - [1408, 1408, 1, 256]
    - [334, 8538.2]
  - - [1024, 64, 1, 1280]
    - [296, 2781.37]
  - - [448, 4288, 1, 256]
    - [309, 8251.38]
  - - [64, 3584, 1, 3328]
    - [316, 6054.59]
  - - [704, 2368, 1, 1280]
    - [331, 8753.92]
  - - [1856, 2368, 1, 1280]
    - [331, 9984.42]
  - - [2368, 128, 1, 3328]
    - [311, 6190.07]
  - - [1408, 1408, 1, 3328]
    - [331, 9317.67]
  - - [2944, 128, 1, 256]
    - [294, 5582.7]
  - - [448, 1408, 1, 256]
    - [331, 6079.85]
  - - [64, 5056, 1, 3328]
    - [293, 6592.13]
  - - [1408, 1024, 1, 1280]
    - [331, 8698.61]
  - - [704, 6784, 1, 256]
    - [327, 9245.61]
  - - [6784, 704, 1, 256]
    - [327, 9228.9]
  - - [256, 3584, 1, 3328]
    - [331, 8072.81]
  - - [5056, 704, 1, 256]
    - [306, 9170.82]
  - - [1408, 3584, 1, 256]
    - [333, 9339.54]
  - - [3584, 4288, 1, 3328]
    - [331, 10417.8]
  - - [5888, 1856, 1, 1280]
    - [333, 10284.1]
  - - [256, 1408, 1, 256]
    - [331, 4669.77]
  - - [5056, 64, 1, 1280]
    - [311, 6313.83]
  - - [2368, 128, 1, 256]
    - [293, 4731.52]
  - - [2368, 3584, 1, 1280]
    - [331, 10118.5]
  - - [1024, 256, 1, 256]
    - [308, 4559.03]
  - - [448, 448, 1, 256]
    - [298, 4039.33]
  - - [2944, 3584, 1, 3328]
    - [331, 10241.4]
  - - [256, 256, 1, 3328]
    - [300, 2979.56]
  - - [128, 1024, 1, 3328]
    - [299, 5105.43]
  - - [6784, 2944, 1, 256]
    - [328, 9908.66]
  - - [64, 1856, 1, 1280]
    - [299, 4349.07]
  - - [448, 256, 1, 256]
    - [300, 3033.07]
  - - [1856, 2368, 1, 256]
    - [327, 9413.67]
  - - [3584, 6784, 1, 3328]
    - [331, 10494.6]
  - - [256, 1024, 1, 256]
    - [308, 4634.59]
  - - [1024, 128, 1, 1280]
    - [299, 4766.25]
  - - [4288, 128, 1, 1280]
    - [291, 6969.7]
  - - [5056, 4288, 1, 1280]
    - [331, 10401.0]
  - - [5888, 64, 1, 256]
    - [294, 5661.33]
  - - [6784, 1856, 1, 3328]
    - [331, 10256.5]
  - - [1408, 5056, 1, 1280]
    - [331, 9972.14]
  - - [1856, 256, 1, 1280]
    - [308, 7281.78]
  - - [64, 5888, 1, 3328]
    - [293, 6636.84]
  - - [6784, 5888, 1, 3328]
    - [331, 10508.3]
  - - [448, 256, 1, 3328]
    - [299, 4484.04]
  - - [2368, 5056, 1, 1280]
    - [331, 10294.6]
  - - [1024, 704, 1, 1280]
    - [308, 7982.24]
  - - [256, 1408, 1, 3328]
    - [308, 5791.69]
  - - [6784, 128, 1, 3328]
    - [312, 8277.61]
  - - [1024, 5056, 1, 1280]
    - [331, 10047.0]
  - - [4288, 1024, 1, 256]
    - [327, 9379.79]
  - - [2368, 1408, 1, 256]
    - [327, 9166.03]
  - - [704, 704, 1, 3328]
    - [308, 7851.36]
  - - [5888, 448, 1, 1280]
    - [331, 9092.04]
  - - [3584, 256, 1, 3328]
    - [308, 8139.96]
  - - [704, 5888, 1, 3328]
    - [331, 10094.2]
  - - [1024, 6784, 1, 1280]
    - [331, 10077.9]
  - - [128, 3584, 1, 3328]
    - [289, 7388.36]
  - - [128, 704, 1, 1280]
    - [299, 3491.02]
  - - [3584, 2944, 1, 1280]
    - [331, 10159.5]
  - - [1856, 128, 1, 3328]
    - [322, 6274.81]
  - - [128, 2944, 1, 1280]
    - [294, 6986.46]
  - - [448, 1856, 1, 1280]
    - [308, 7257.97]
  - - [1408, 5056, 1, 3328]
    - [331, 10056.2]
  - - [1856, 1856, 1, 3328]
    - [331, 9540.06]
  - - [3584, 128, 1, 256]
    - [313, 5991.86]
  - - [448, 1408, 1, 3328]
    - [308, 7181.35]
  - - [2368, 2368, 1, 256]
    - [306, 9444.08]
  - - [4288, 4288, 1, 1280]
    - [327, 10295.8]
  - - [64, 448, 1, 1280]
    - [302, 1270.78]
  - - [5888, 1024, 1, 1280]
    - [331, 10224.6]
  - - [704, 1024, 1, 256]
    - [331, 6886.17]
  - - [704, 6784, 1, 3328]
    - [331, 9846.33]
  - - [5888, 5888, 1, 3328]
    - [331, 10487.0]
  - - [5056, 1024, 1, 1280]
    - [331, 10055.6]
  - - [448, 5888, 1, 3328]
    - [331, 9194.28]
  - - [1024, 2944, 1, 1280]
    - [331, 9555.18]
  - - [5056, 5888, 1, 1280]
    - [328, 10439.1]
  - - [448, 6784, 1, 256]
    - [332, 9030.22]
  - - [256, 3584, 1, 256]
    - [331, 7057.72]
  - - [256, 448, 1, 256]
    - [324, 3058.35]
  - - [3584, 5888, 1, 256]
    - [327, 9964.35]
  - - [2944, 3584, 1, 256]
    - [327, 9705.15]
  - - [1408, 704, 1, 256]
    - [333, 7588.38]
  - - [6784, 1024, 1, 3328]
    - [331, 10169.2]
  - - [6784, 2944, 1, 3328]
    - [331, 10396.9]
  - - [64, 64, 1, 3328]
    - [299, 189.748]
  - - [6784, 2368, 1, 1280]
    - [333, 10298.6]
  - - [4288, 3584, 1, 256]
    - [327, 9895.03]
  - - [4288, 5888, 1, 1280]
    - [331, 10378.3]
  - - [448, 2944, 1, 3328]
    - [331, 8086.49]
  - - [4288, 1856, 1, 1280]
    - [331, 10082.9]
  - - [1856, 2944, 1, 3328]
    - [331, 10223.3]
  - - [256, 6784, 1, 3328]
    - [331, 9236.39]
  - - [64, 5888, 1, 256]
    - [307, 5407.45]
  - - [5056, 1024, 1, 256]
    - [328, 9582.13]
  - - [704, 64, 1, 3328]
    - [325, 2068.81]
  - - [5056, 1856, 1, 3328]
    - [331, 10358.6]
  - - [448, 448, 1, 3328]
    - [316, 5324.8]
  - - [448, 2368, 1, 1280]
    - [331, 7540.59]
  - - [1408, 128, 1, 1280]
    - [293, 5252.43]
  - - [5056, 256, 1, 3328]
    - [331, 9349.62]
  - - [704, 704, 1, 256]
    - [308, 6318.61]
  - - [1024, 5888, 1, 1280]
    - [331, 10225.7]
  - - [64, 128, 1, 256]
    - [290, 216.659]
  - - [128, 1856, 1, 1280]
    - [301, 5948.55]
  - - [5056, 3584, 1, 256]
    - [328, 9980.43]
  - - [1856, 1024, 1, 1280]
    - [331, 8821.8]
  - - [1856, 1856, 1, 1280]
    - [331, 9431.18]
  - - [128, 4288, 1, 3328]
    - [291, 7099.75]
  - - [1856, 1024, 1, 3328]
    - [331, 8937.69]
  - - [256, 2368, 1, 256]
    - [331, 5896.25]
  - - [1024, 448, 1, 3328]
    - [308, 7261.84]
  - - [1856, 704, 1, 1280]
    - [331, 9254.53]
  - - [6784, 1024, 1, 256]
    - [327, 9590.11]
  - - [5056, 5888, 1, 3328]
    - [331, 10492.0]
  - - [1856, 1024, 1, 256]
    - [309, 8174.38]
  - - [5056, 1408, 1, 3328]
    - [331, 10060.3]
  - - [1024, 1024, 1, 1280]
    - [308, 9034.58]
  - - [448, 5888, 1, 256]
    - [327, 8526.3]
  - - [1408, 6784, 1, 3328]
    - [331, 10265.0]
  - - [2944, 1408, 1, 3328]
    - [331, 10091.2]
  - - [2944, 4288, 1, 3328]
    - [331, 10280.8]
  - - [256, 2944, 1, 256]
    - [331, 7199.18]
  - - [5056, 2944, 1, 256]
    - [327, 9919.12]
  - - [2368, 1856, 1, 256]
    - [327, 9407.41]
  - - [128, 6784, 1, 1280]
    - [294, 8139.21]
  - - [1408, 3584, 1, 3328]
    - [331, 9900.27]
  - - [2368, 6784, 1, 256]
    - [328, 9970.23]
  - - [4288, 2368, 1, 3328]
    - [331, 10360.5]
  - - [704, 3584, 1, 1280]
    - [331, 9501.11]
  - - [1408, 5888, 1, 3328]
    - [331, 10271.9]
  - - [1856, 5056, 1, 256]
    - [306, 9835.79]
  - - [6784, 6784, 1, 256]
    - [328, 10190.5]
  - - [1408, 704, 1, 3328]
    - [331, 8714.14]
  - - [128, 5888, 1, 1280]
    - [288, 8310.56]
  - - [2368, 4288, 1, 1280]
    - [331, 10279.3]
  - - [3584, 1856, 1, 1280]
    - [331, 10009.5]
  - - [704, 1408, 1, 3328]
    - [331, 8714.14]
  - - [704, 64, 1, 1280]
    - [302, 1897.09]
  - - [3584, 448, 1, 256]
    - [331, 7749.66]
  - - [3584, 3584, 1, 1280]
    - [331, 10378.3]
  - - [256, 6784, 1, 256]
    - [327, 8332.01]
  - - [1856, 3584, 1, 3328]
    - [331, 10106.3]
  - - [128, 448, 1, 256]
    - [321, 1683.49]
  - - [3584, 3584, 1, 256]
    - [327, 9923.77]
  - - [6784, 4288, 1, 1280]
    - [327, 10453.6]
  - - [448, 704, 1, 1280]
    - [308, 4932.82]
  - - [3584, 5056, 1, 256]
    - [333, 9970.14]
  - - [6784, 128, 1, 256]
    - [294, 7198.77]
  - - [64, 1408, 1, 3328]
    - [299, 3790.35]
  - - [704, 448, 1, 256]
    - [308, 4102.66]
  - - [2944, 2368, 1, 1280]
    - [331, 10110.8]
  - - [448, 64, 1, 3328]
    - [326, 1390.16]
  - - [6784, 3584, 1, 256]
    - [328, 10018.6]
  - - [256, 1856, 1, 3328]
    - [319, 7593.43]
  - - [256, 704, 1, 256]
    - [308, 3134.33]
  - - [128, 1408, 1, 256]
    - [293, 3819.32]
  - - [64, 128, 1, 3328]
    - [324, 379.921]
  - - [1856, 1408, 1, 256]
    - [328, 9159.25]
  - - [2944, 2944, 1, 3328]
    - [331, 10119.4]
  - - [5056, 6784, 1, 256]
    - [328, 10104.0]
  - - [1408, 4288, 1, 3328]
    - [331, 9919.46]
  - - [6784, 256, 1, 1280]
    - [331, 9104.63]
  - - [1024, 704, 1, 3328]
    - [308, 8113.99]
  - - [2368, 704, 1, 3328]
    - [331, 8870.59]
  - - [128, 4288, 1, 256]
    - [291, 6056.43]
  - - [3584, 6784, 1, 256]
    - [327, 10010.9]
  - - [128, 128, 1, 3328]
    - [302, 795.303]
  - - [5056, 1856, 1, 256]
    - [306, 9845.46]
  - - [704, 4288, 1, 256]
    - [306, 8952.74]
  - - [256, 448, 1, 3328]
    - [299, 4492.49]
  - - [1408, 6784, 1, 1280]
    - [331, 10169.7]
  - - [64, 2368, 1, 1280]
    - [299, 4609.95]
  - - [64, 6784, 1, 3328]
    - [289, 6899.07]
  - - [2944, 256, 1, 1280]
    - [331, 8276.34]
  - - [5056, 2368, 1, 3328]
    - [331, 10374.6]
  - - [2944, 4288, 1, 256]
    - [327, 9759.95]
  - - [1408, 3584, 1, 1280]
    - [331, 9802.18]
  - - [2368, 64, 1, 256]
    - [299, 3439.48]
  - - [256, 256, 1, 256]
    - [300, 1872.46]
  - - [704, 128, 1, 3328]
    - [299, 3794.19]
  - - [1856, 704, 1, 256]
    - [305, 8279.6]
  - - [2368, 6784, 1, 3328]
    - [331, 10367.1]
  - - [5056, 704, 1, 1280]
    - [331, 9750.2]
  - - [1856, 4288, 1, 3328]
    - [331, 10171.9]
  - - [1408, 5888, 1, 256]
    - [328, 9792.93]
  - - [704, 2944, 1, 1280]
    - [331, 9589.73]
  - - [4288, 64, 1, 1280]
    - [314, 5441.03]
  - - [704, 1856, 1, 256]
    - [327, 8279.6]
  - - [3584, 704, 1, 1280]
    - [331, 9507.84]
  - - [5888, 5056, 1, 256]
    - [329, 10114.0]
  - - [3584, 448, 1, 3328]
    - [331, 8550.23]
  - - [704, 2368, 1, 3328]
    - [331, 8871.73]
  - - [2944, 448, 1, 256]
    - [331, 7289.32]
  - - [448, 5056, 1, 3328]
    - [331, 9533.37]
  - - [2368, 128, 1, 1280]
    - [293, 5957.82]
  - - [4288, 448, 1, 256]
    - [309, 8240.32]
  - - [64, 6784, 1, 256]
    - [289, 5741.17]
  - - [64, 5056, 1, 1280]
    - [293, 6329.27]
  - - [5888, 2368, 1, 256]
    - [333, 9892.9]
  - - [704, 448, 1, 3328]
    - [308, 5085.4]
  - - [6784, 704, 1, 3328]
    - [331, 9847.8]
  - - [128, 64, 1, 1280]
    - [315, 338.687]
  - - [2368, 256, 1, 1280]
    - [308, 6735.64]
  - - [1408, 2944, 1, 3328]
    - [331, 10087.1]
  - - [64, 1024, 1, 256]
    - [300, 1889.33]
  - - [2368, 448, 1, 1280]
    - [308, 7584.37]
  - - [128, 3584, 1, 256]
    - [289, 5943.35]
  - - [1856, 448, 1, 3328]
    - [308, 7376.83]
  - - [128, 5056, 1, 256]
    - [294, 6903.13]
  - - [4288, 4288, 1, 256]
    - [327, 9878.84]
  - - [2368, 704, 1, 256]
    - [327, 8022.0]
  - - [3584, 2368, 1, 256]
    - [327, 9644.24]
  - - [5888, 5056, 1, 1280]
    - [333, 10444.2]
  - - [128, 1024, 1, 1280]
    - [299, 4733.98]
  - - [64, 704, 1, 256]
    - [297, 1310.72]
  - - [4288, 256, 1, 1280]
    - [331, 7813.01]
  - - [3584, 3584, 1, 3328]
    - [331, 10460.7]
  - - [128, 1024, 1, 256]
    - [324, 3302.6]
  - - [5888, 6784, 1, 256]
    - [328, 10098.1]
  - - [4288, 2944, 1, 3328]
    - [331, 10283.8]
  - - [1856, 64, 1, 256]
    - [299, 3115.65]
  - - [4288, 128, 1, 3328]
    - [291, 7095.33]
  - - [256, 5056, 1, 1280]
    - [331, 9151.32]
  - - [6784, 5888, 1, 1280]
    - [331, 10437.8]
  - - [704, 128, 1, 256]
    - [300, 2363.59]
  - - [5888, 4288, 1, 1280]
    - [331, 10379.9]
  - - [448, 256, 1, 1280]
    - [299, 4218.41]
  - - [448, 2368, 1, 3328]
    - [331, 7672.47]
  - - [1, 1, 1, 1280]
    - [341, 0.00964436]
  - - [256, 1408, 1, 1280]
    - [308, 5632.0]
  - - [1408, 1856, 1, 1280]
    - [331, 9833.5]
  - - [5888, 448, 1, 3328]
    - [331, 9199.67]
  - - [704, 5888, 1, 1280]
    - [331, 9971.82]
  - - [256, 64, 1, 3328]
    - [325, 793.451]
  - - [128, 2368, 1, 256]
    - [293, 4801.65]
  - - [6784, 64, 1, 3328]
    - [313, 6997.97]
  - - [5056, 2944, 1, 3328]
    - [331, 10438.5]
  - - [448, 128, 1, 256]
    - [321, 1699.08]
  - - [1856, 128, 1, 1280]
    - [322, 5985.97]
  - - [448, 4288, 1, 1280]
    - [331, 8919.45]
  - - [64, 3584, 1, 256]
    - [298, 4475.63]
  - - [128, 2944, 1, 3328]
    - [312, 7250.81]
  - - [3584, 704, 1, 256]
    - [333, 8853.11]
  - - [2944, 448, 1, 3328]
    - [331, 8096.04]
  - - [3584, 1408, 1, 3328]
    - [331, 9900.27]
  - - [2368, 1024, 1, 1280]
    - [331, 9128.79]
  - - [2944, 6784, 1, 1280]
    - [331, 10317.5]
  - - [1856, 6784, 1, 256]
    - [327, 9744.04]
  - - [4288, 448, 1, 3328]
    - [331, 9035.02]
  - - [6784, 704, 1, 1280]
    - [331, 9748.07]
  - - [5888, 1024, 1, 3328]
    - [331, 10321.4]
  - - [704, 6784, 1, 1280]
    - [331, 9745.58]
  - - [5888, 128, 1, 256]
    - [308, 7220.73]
  - - [5056, 1024, 1, 3328]
    - [331, 10153.6]
  - - [704, 5056, 1, 1280]
    - [331, 9731.87]
  - - [64, 704, 1, 3328]
    - [302, 2068.8]
  - - [2944, 1856, 1, 256]
    - [327, 9575.58]
  - - [5056, 64, 1, 256]
    - [293, 5051.07]
  - - [5888, 5056, 1, 3328]
    - [333, 10498.2]
  - - [128, 5056, 1, 3328]
    - [294, 8281.22]
  - - [3584, 6784, 1, 1280]
    - [327, 10422.3]
  - - [1856, 5888, 1, 256]
    - [328, 9912.15]
  - - [64, 448, 1, 3328]
    - [326, 1395.05]
  - - [4288, 4288, 1, 3328]
    - [331, 10373.2]
  - - [4288, 1408, 1, 1280]
    - [331, 9836.09]
  - - [64, 1856, 1, 256]
    - [299, 3040.87]
  - - [4288, 2368, 1, 256]
    - [327, 9807.67]
  - - [2944, 5056, 1, 1280]
    - [327, 10356.5]
  - - [256, 4288, 1, 1280]
    - [331, 7809.54]
  - - [6784, 2368, 1, 3328]
    - [331, 10369.9]
  - - [256, 1024, 1, 1280]
    - [308, 5899.16]
  - - [4288, 128, 1, 256]
    - [291, 6014.95]
  - - [4288, 1856, 1, 3328]
    - [331, 10179.4]
  - - [1856, 2944, 1, 1280]
    - [331, 10117.5]
  - - [3584, 64, 1, 1280]
    - [301, 5761.41]
  - - [4288, 6784, 1, 3328]
    - [331, 10529.9]
  - - [3584, 1024, 1, 1280]
    - [331, 10037.7]
  - - [1024, 4288, 1, 256]
    - [327, 9373.53]
  - - [5888, 3584, 1, 3328]
    - [331, 10447.6]
  - - [5056, 3584, 1, 3328]
    - [331, 10371.9]
  - - [1408, 128, 1, 3328]
    - [293, 5541.26]
  - - [2368, 1408, 1, 1280]
    - [331, 9790.12]
  - - [5056, 2944, 1, 1280]
    - [327, 10358.8]
  - - [3584, 256, 1, 256]
    - [331, 7074.73]
  - - [1024, 6784, 1, 256]
    - [327, 9561.21]
  - - [2944, 5056, 1, 3328]
    - [331, 10442.9]
  - - [3584, 2944, 1, 256]
    - [327, 9719.12]
  - - [448, 128, 1, 3328]
    - [300, 2604.27]
  - - [64, 2944, 1, 3328]
    - [311, 5806.03]
  - - [64, 4288, 1, 3328]
    - [314, 5693.95]
  - - [5056, 6784, 1, 3328]
    - [331, 10526.2]
  - - [128, 2944, 1, 256]
    - [294, 5661.33]
  - - [3584, 4288, 1, 256]
    - [327, 9908.99]
  - - [1856, 6784, 1, 3328]
    - [331, 10257.1]
  - - [3584, 128, 1, 3328]
    - [313, 7354.19]
  - - [128, 256, 1, 1280]
    - [303, 1464.49]
  - - [64, 448, 1, 256]
    - [303, 873.813]
  - - [64, 256, 1, 1280]
    - [302, 728.178]
  - - [5056, 1408, 1, 1280]
    - [333, 9962.55]
  - - [5888, 5888, 1, 256]
    - [328, 10068.0]
  - - [4288, 1024, 1, 1280]
    - [331, 9977.95]
  - - [5888, 128, 1, 3328]
    - [288, 8494.3]
  - - [448, 6784, 1, 3328]
    - [331, 9751.06]
  - - [2944, 1408, 1, 1280]
    - [331, 9979.32]
  - - [64, 128, 1, 1280]
    - [299, 337.82]
  - - [2944, 1856, 1, 3328]
    - [331, 10220.6]
  - - [448, 5056, 1, 256]
    - [327, 8753.96]
  - - [64, 64, 1, 256]
    - [290, 109.227]
  - - [3584, 5888, 1, 1280]
    - [327, 10372.1]
  - - [6784, 1856, 1, 1280]
    - [327, 10176.2]
  - - [5888, 256, 1, 3328]
    - [331, 9232.18]
  - - [1856, 5888, 1, 3328]
    - [331, 10362.4]
  - - [3584, 1408, 1, 256]
    - [333, 9328.75]
  - - [704, 3584, 1, 3328]
    - [331, 9622.54]
  - - [5056, 448, 1, 1280]
    - [331, 9410.92]
  - - [3584, 1856, 1, 3328]
    - [331, 10106.3]
  - - [1408, 704, 1, 1280]
    - [308, 8549.71]
  - - [2944, 1024, 1, 256]
    - [333, 9015.79]
  - - [448, 1408, 1, 1280]
    - [308, 7028.23]
  - - [2368, 4288, 1, 3328]
    - [331, 10356.7]
  - - [1024, 1408, 1, 1280]
    - [331, 8701.9]
  - - [256, 128, 1, 1280]
    - [303, 1448.31]
  - - [704, 1408, 1, 1280]
    - [308, 8545.1]
  - - [6784, 5056, 1, 256]
    - [329, 10082.7]
  - - [4288, 5888, 1, 256]
    - [328, 9994.17]
  - - [448, 2944, 1, 256]
    - [327, 7340.03]
  - - [2944, 6784, 1, 256]
    - [327, 9896.38]
  - - [2368, 2368, 1, 1280]
    - [331, 9922.47]
  - - [1856, 3584, 1, 1280]
    - [331, 10013.2]
  - - [64, 2944, 1, 256]
    - [293, 3966.65]
  - - [3584, 1408, 1, 1280]
    - [331, 9800.98]
  - - [5056, 3584, 1, 1280]
    - [333, 10305.4]
  - - [256, 5888, 1, 256]
    - [333, 8245.21]
  - - [128, 256, 1, 3328]
    - [303, 1596.19]
  - - [1856, 1408, 1, 3328]
    - [331, 9965.29]
  - - [1024, 4288, 1, 3328]
    - [331, 10077.4]
  - - [448, 2368, 1, 256]
    - [331, 6858.11]
  - - [64, 1408, 1, 1280]
    - [299, 3533.86]
  - - [64, 6784, 1, 1280]
    - [313, 6810.6]
  - - [2944, 2368, 1, 3328]
    - [331, 10210.6]
  - - [704, 4288, 1, 3328]
    - [331, 9683.86]
  - - [1024, 1856, 1, 1280]
    - [331, 8821.8]
  - - [6784, 1856, 1, 256]
    - [327, 9739.33]
  - - [128, 2368, 1, 3328]
    - [293, 6202.25]
  - - [1024, 5888, 1, 256]
    - [327, 9651.76]
  - - [64, 2944, 1, 1280]
    - [311, 5441.62]
  - - [5056, 64, 1, 3328]
    - [311, 6595.34]
  - - [1408, 2368, 1, 256]
    - [327, 9142.47]
  - - [2944, 704, 1, 3328]
    - [331, 9743.39]
  - - [256, 64, 1, 256]
    - [302, 489.989]
  - - [2944, 2944, 1, 1280]
    - [333, 10039.4]
  - - [6784, 256, 1, 3328]
    - [331, 9241.11]
  - - [1408, 5056, 1, 256]
    - [333, 9571.56]
  - - [5056, 128, 1, 3328]
    - [312, 8263.43]
  - - [128, 128, 1, 1280]
    - [302, 728.178]
  - - [448, 704, 1, 256]
    - [331, 4119.41]
  - - [1856, 256, 1, 3328]
    - [319, 7495.53]
  - - [2944, 128, 1, 3328]
    - [312, 7230.72]
  - - [704, 256, 1, 256]
    - [308, 3203.98]
  - - [256, 448, 1, 1280]
    - [299, 4208.79]
  - - [704, 256, 1, 1280]
    - [320, 4096.0]
  - - [64, 2368, 1, 3328]
    - [324, 4933.15]
  - - [256, 704, 1, 3328]
    - [319, 4286.63]
  - - [1024, 1024, 1, 256]
    - [308, 7951.29]
  - - [1408, 4288, 1, 256]
    - [333, 9410.62]
  - - [5888, 2368, 1, 1280]
    - [333, 10247.8]
  - - [128, 256, 1, 256]
    - [297, 953.251]
  - - [256, 64, 1, 1280]
    - [302, 726.161]
  - - [2368, 5888, 1, 1280]
    - [327, 10235.1]
  - - [5888, 256, 1, 1280]
    - [331, 9080.31]
  - - [704, 1024, 1, 1280]
    - [331, 7921.93]
  - - [2368, 1856, 1, 3328]
    - [331, 10095.1]
  - - [2944, 704, 1, 256]
    - [309, 8890.41]
  - - [2368, 6784, 1, 1280]
    - [328, 10293.7]
  - - [2368, 1024, 1, 3328]
    - [331, 9250.18]
  - - [1856, 4288, 1, 1280]
    - [331, 10084.5]
  - - [704, 3584, 1, 256]
    - [327, 8833.74]
  - - [704, 2944, 1, 3328]
    - [331, 9740.1]
  - - [1856, 5056, 1, 3328]
    - [331, 10359.4]
  - - [3584, 5056, 1, 1280]
    - [333, 10309.8]
  - - [2944, 1024, 1, 3328]
    - [331, 9672.21]
  - - [256, 4288, 1, 256]
    - [331, 7067.87]
  - - [2368, 256, 1, 256]
    - [331, 5914.22]
  - - [1408, 6784, 1, 256]
    - [327, 9703.51]
  - - [6784, 1408, 1, 3328]
    - [331, 10265.0]
  - - [1024, 2368, 1, 1280]
    - [331, 9141.7]
  - - [704, 64, 1, 256]
    - [299, 1322.74]
  - - [256, 2368, 1, 3328]
    - [308, 6916.7]
  - - [6784, 2944, 1, 1280]
    - [331, 10319.8]
  - - [3584, 448, 1, 1280]
    - [331, 8428.51]
  - - [2944, 6784, 1, 3328]
    - [331, 10398.6]
  - - [448, 5056, 1, 1280]
    - [331, 9408.48]
  - - [4288, 5056, 1, 1280]
    - [327, 10402.5]
  - - [128, 448, 1, 1280]
    - [321, 2420.85]
  - - [4288, 704, 1, 256]
    - [306, 8969.37]
  - - [64, 64, 1, 1280]
    - [321, 179.06]
  - - [5888, 704, 1, 256]
    - [333, 9467.87]
  - - [256, 5888, 1, 3328]
    - [331, 9233.54]
  - - [6784, 4288, 1, 256]
    - [329, 10061.3]
  - - [5888, 256, 1, 256]
    - [327, 8217.12]
  - - [6784, 1024, 1, 1280]
    - [331, 10077.9]
  - - [704, 448, 1, 1280]
    - [308, 4942.48]
  - - [128, 64, 1, 3328]
    - [299, 379.921]
  - - [448, 64, 1, 256]
    - [324, 873.813]
  - - [2944, 704, 1, 1280]
    - [331, 9598.05]
  - - [6784, 3584, 1, 1280]
    - [327, 10419.5]
  - - [2944, 64, 1, 1280]
    - [293, 5471.24]
  - - [1408, 2944, 1, 1280]
    - [331, 9985.33]
  - - [256, 1856, 1, 256]
    - [331, 6009.63]
  - - [1408, 2368, 1, 3328]
    - [331, 9907.19]
  - - [128, 1408, 1, 3328]
    - [293, 5561.81]
  - - [2368, 2944, 1, 256]
    - [327, 9615.71]
  - - [64, 5056, 1, 256]
    - [293, 4978.22]
  - - [1408, 256, 1, 3328]
    - [319, 5776.07]
  - - [3584, 1856, 1, 256]
    - [333, 9592.65]
  - - [4288, 3584, 1, 1280]
    - [327, 10336.8]
  - - [2368, 448, 1, 256]
    - [308, 6885.93]
  - - [4288, 256, 1, 3328]
    - [331, 7934.94]
  - - [1408, 64, 1, 256]
    - [300, 2402.99]
  - - [4288, 2944, 1, 1280]
    - [331, 10206.3]
  - - [5056, 448, 1, 3328]
    - [331, 9539.16]
  - - [1024, 64, 1, 256]
    - [300, 1889.33]
  - - [64, 2368, 1, 256]
    - [299, 3391.37]
  - - [4288, 5056, 1, 3328]
    - [331, 10478.7]
  - - [2944, 256, 1, 256]
    - [305, 7135.28]
  - - [1024, 128, 1, 3328]
    - [324, 5076.9]
  - - [256, 5056, 1, 3328]
    - [331, 9341.52]
  - - [5056, 2368, 1, 256]
    - [306, 9915.22]
  - - [4288, 704, 1, 3328]
    - [331, 9682.37]
  - - [448, 3584, 1, 256]
    - [327, 7749.66]
  - - [2368, 64, 1, 1280]
    - [299, 4609.95]
  - - [1024, 1408, 1, 3328]
    - [331, 8838.59]
  - - [2944, 5888, 1, 1280]
    - [327, 10277.5]
  - - [5888, 3584, 1, 256]
    - [328, 9952.6]
  - - [1408, 1856, 1, 3328]
    - [331, 9969.86]
  - - [6784, 1408, 1, 1280]
    - [331, 10179.2]
  - - [704, 2944, 1, 256]
    - [309, 8866.64]
  - - [4288, 64, 1, 256]
    - [292, 4435.26]
  - - [2944, 5888, 1, 3328]
    - [331, 10357.6]
  - - [64, 4288, 1, 1280]
    - [292, 5481.79]
  - - [6784, 64, 1, 1280]
    - [289, 6810.6]
  - - [704, 1856, 1, 1280]
    - [331, 9262.73]
  - - [1408, 64, 1, 3328]
    - [299, 3778.89]
  - - [1408, 1408, 1, 1280]
    - [331, 9204.72]
  - - [448, 1024, 1, 3328]
    - [319, 7272.91]
  - - [448, 4288, 1, 3328]
    - [331, 9034.0]
  - - [704, 2368, 1, 256]
    - [327, 8058.35]
  - - [2944, 448, 1, 1280]
    - [308, 7996.45]
  - - [5888, 2368, 1, 3328]
    - [331, 10315.2]
  - - [4288, 5056, 1, 256]
    - [327, 9985.11]
  - - [4288, 448, 1, 1280]
    - [331, 8909.11]
  - - [5888, 704, 1, 3328]
    - [331, 10088.9]
  - - [4288, 3584, 1, 3328]
    - [331, 10417.3]
  - - [2944, 64, 1, 256]
    - [293, 3966.65]
  - - [1024, 6784, 1, 3328]
    - [331, 10171.3]
  - - [1408, 1024, 1, 256]
    - [331, 7927.38]
  - - [448, 1024, 1, 256]
    - [331, 5872.03]
  - - [6784, 6784, 1, 3328]
    - [333, 10535.5]
  - - [1024, 448, 1, 1280]
    - [319, 7050.94]
  - - [704, 5056, 1, 3328]
    - [331, 9853.75]
  - - [256, 2368, 1, 1280]
    - [308, 6749.71]
  - - [3584, 5056, 1, 3328]
    - [333, 10366.7]
  - - [2368, 2944, 1, 3328]
    - [331, 10203.7]
  - - [448, 448, 1, 1280]
    - [316, 5057.11]
  - - [2368, 3584, 1, 256]
    - [327, 9657.96]
  - - [1024, 256, 1, 1280]
    - [331, 5890.88]
  - - [128, 5056, 1, 1280]
    - [294, 8089.6]
  - - [3584, 2368, 1, 1280]
    - [331, 10126.1]
  - - [1856, 1856, 1, 256]
    - [333, 8875.33]
  - - [4288, 1408, 1, 3328]
    - [331, 9923.77]
  - - [3584, 64, 1, 3328]
    - [316, 6066.14]
  - - [1, 1, 1, 1]
    - [339, 9.12409e-05]
  - - [256, 1024, 1, 3328]
    - [319, 6210.27]
  - - [1856, 64, 1, 3328]
    - [299, 4644.19]
  - - [5888, 1408, 1, 3328]
    - [331, 10274.9]
  - - [256, 5056, 1, 256]
    - [327, 8185.52]
  - - [1856, 64, 1, 1280]
    - [324, 4359.05]
  - - [1408, 256, 1, 256]
    - [331, 4669.77]
  - - [2368, 5056, 1, 256]
    - [306, 9912.65]
  - - [128, 5888, 1, 3328]
    - [331, 8471.35]
  - - [1024, 5056, 1, 256]
    - [333, 9576.59]
  - - [2368, 1408, 1, 3328]
    - [331, 9902.24]
  - - [5888, 448, 1, 256]
    - [327, 8526.3]
  - - [6784, 5056, 1, 1280]
    - [331, 10451.5]
  - - [4288, 6784, 1, 1280]
    - [327, 10455.5]
  - - [2368, 448, 1, 3328]
    - [331, 7671.13]
  - - [1024, 128, 1, 256]
    - [300, 3355.44]
  - - [448, 128, 1, 1280]
    - [300, 2433.7]
  - - [1024, 64, 1, 3328]
    - [321, 2976.31]
  - - [64, 3584, 1, 1280]
    - [316, 5752.38]
  - - [6784, 1408, 1, 256]
    - [327, 9706.59]
  - - [5888, 4288, 1, 256]
    - [327, 9969.51]
  - - [5056, 5888, 1, 256]
    - [328, 10134.4]
  - - [2368, 1024, 1, 256]
    - [327, 8526.88]
  - - [1856, 6784, 1, 1280]
    - [327, 10169.0]
  - - [3584, 128, 1, 1280]
    - [313, 7161.01]
  - - [128, 64, 1, 256]
    - [290, 216.648]
  - - [1408, 448, 1, 256]
    - [331, 6098.21]
  - - [64, 256, 1, 3328]
    - [302, 794.382]
  - - [6784, 448, 1, 3328]
    - [331, 9745.05]
  - - [5056, 1856, 1, 1280]
    - [331, 10275.3]
  - - [1408, 1024, 1, 3328]
    - [331, 8838.59]
  - - [2368, 256, 1, 3328]
    - [308, 6914.81]
  - - [5888, 3584, 1, 1280]
    - [327, 10370.5]
  - - [5888, 128, 1, 1280]
    - [308, 8304.84]
  - - [1024, 2944, 1, 256]
    - [333, 8965.52]
  - - [448, 6784, 1, 1280]
    - [331, 9633.09]
  - - [256, 3584, 1, 1280]
    - [308, 7965.31]
  - - [704, 5056, 1, 256]
    - [306, 9163.49]
  - - [3584, 1024, 1, 3328]
    - [331, 10156.5]
  - - [2944, 1856, 1, 1280]
    - [331, 10115.1]
  - - [5056, 256, 1, 256]
    - [305, 8234.34]
  - - [128, 5888, 1, 256]
    - [288, 7199.18]
  - - [2368, 3584, 1, 3328]
    - [331, 10205.7]
  - - [3584, 5888, 1, 3328]
    - [331, 10445.7]
  - - [2944, 3584, 1, 1280]
    - [331, 10163.2]
  - - [1856, 5888, 1, 1280]
    - [331, 10268.4]
  - - [256, 256, 1, 1280]
    - [321, 2744.96]
  - - [4288, 1408, 1, 256]
    - [328, 9392.35]
  - - [3584, 64, 1, 256]
    - [310, 4475.63]
  - - [64, 1856, 1, 3328]
    - [299, 4639.83]
  - - [1408, 128, 1, 256]
    - [311, 3844.78]
  - - [4288, 2368, 1, 1280]
    - [331, 10265.6]
  - - [2944, 5056, 1, 256]
    - [327, 9919.14]
  - - [256, 128, 1, 3328]
    - [303, 1596.19]
  - - [6784, 2368, 1, 256]
    - [329, 9949.0]
  - - [1408, 448, 1, 3328]
    - [308, 7197.11]
  - - [4288, 1856, 1, 256]
    - [327, 9613.93]
  - - [1856, 2944, 1, 256]
    - [327, 9570.37]
  - - [64, 5888, 1, 1280]
    - [307, 6669.59]
  - - [1856, 1408, 1, 1280]
    - [331, 9819.66]
  - - [128, 704, 1, 256]
    - [296, 2383.13]
  - - [1024, 4288, 1, 1280]
    - [331, 9972.28]
  - - [2368, 5056, 1, 3328]
    - [331, 10382.1]
  - - [4288, 1024, 1, 3328]
    - [331, 10081.8]
  - - [1024, 5056, 1, 3328]
    - [331, 10156.0]
  - - [1024, 1856, 1, 3328]
    - [331, 8935.67]
  - - [704, 704, 1, 1280]
    - [308, 7602.93]
  - - [128, 2368, 1, 1280]
    - [293, 5957.82]
  - - [3584, 256, 1, 1280]
    - [308, 7978.3]
  - - [5888, 64, 1, 1280]
    - [312, 6978.37]
  - - [128, 704, 1, 3328]
    - [324, 3778.89]
  - - [3584, 2944, 1, 3328]
    - [331, 10245.7]
  - - [128, 1856, 1, 256]
    - [310, 4552.2]
  - - [64, 4288, 1, 256]
    - [292, 4412.98]
  - - [5888, 2944, 1, 256]
    - [327, 9861.3]
  - - [5056, 128, 1, 1280]
    - [294, 8083.28]
  - - [448, 1856, 1, 3328]
    - [308, 7386.28]
  - - [5056, 4288, 1, 256]
    - [327, 9982.24]
  - - [1024, 448, 1, 256]
    - [308, 5848.63]
  - - [1024, 3584, 1, 256]
    - [333, 9417.84]
  - - [2944, 128, 1, 1280]
    - [312, 6994.56]
  - - [64, 256, 1, 256]
    - [296, 480.998]
  - - [704, 256, 1, 3328]
    - [320, 4255.02]
  - - [5056, 1408, 1, 256]
    - [328, 9567.54]
  - - [5888, 5888, 1, 1280]
    - [331, 10410.0]
  - - [448, 5888, 1, 1280]
    - [331, 9092.04]
  - - [1, 1, 1, 256]
    - [340, 0.00688172]
  - - [4288, 704, 1, 1280]
    - [331, 9571.96]
  - - [2944, 1408, 1, 256]
    - [329, 9420.84]
  - - [256, 2944, 1, 1280]
    - [331, 8299.16]
  - - [2368, 5888, 1, 3328]
    - [331, 10318.3]
  - - [704, 1024, 1, 3328]
    - [308, 8122.79]
  - - [2368, 1856, 1, 1280]
    - [331, 9980.17]
  - - [1856, 448, 1, 1280]
    - [308, 7261.93]
  - - [128, 6784, 1, 256]
    - [294, 7255.16]
  - - [5888, 4288, 1, 3328]
    - [331, 10453.1]
  - - [1856, 128, 1, 256]
    - [291, 4663.91]
  - - [5056, 448, 1, 256]
    - [327, 8732.87]
  - - [1856, 5056, 1, 1280]
    - [331, 10268.3]
  - - [2944, 1024, 1, 1280]
    - [331, 9558.98]
  - - [2368, 4288, 1, 256]
    - [327, 9804.71]
  - - [1024, 2368, 1, 3328]
    - [331, 9252.72]
  - - [4288, 64, 1, 3328]
    - [314, 5657.29]
  - - [704, 1408, 1, 256]
    - [331, 7606.58]
  - - [4288, 5888, 1, 3328]
    - [331, 10451.0]
  - - [448, 2944, 1, 1280]
    - [331, 7966.27]
  - - [1024, 2944, 1, 3328]
    - [331, 9671.47]
  - - [256, 6784, 1, 1280]
    - [331, 9101.64]
  - - [1856, 3584, 1, 256]
    - [328, 9588.33]
  - - [128, 448, 1, 3328]
    - [296, 2609.97]
  - - [1856, 256, 1, 256]
    - [308, 6033.47]
  - - [5056, 128, 1, 256]
    - [294, 6949.45]
  - - [256, 5888, 1, 1280]
    - [331, 9087.15]
  - - [6784, 128, 1, 1280]
    - [312, 8143.98]
  - - [64, 1408, 1, 256]
    - [299, 2443.72]
  - - [2944, 2368, 1, 256]
    - [327, 9611.57]
  - - [1856, 448, 1, 256]
    - [331, 6489.66]
  - - [1024, 1856, 1, 256]
    - [309, 8163.41]
  - - [6784, 3584, 1, 3328]
    - [331, 10489.3]
  - - [2944, 64, 1, 3328]
    - [293, 5797.42]
  - - [1024, 5888, 1, 3328]
    - [331, 10324.8]
  - - [1408, 2368, 1, 1280]
    - [331, 9795.52]
  - - [128, 1408, 1, 1280]
    - [293, 5242.88]
  - - [128, 1856, 1, 3328]
    - [322, 6290.81]
  - - [2944, 2944, 1, 256]
    - [328, 9660.36]
  - - [6784, 256, 1, 256]
    - [327, 8307.1]
  - - [128, 4288, 1, 1280]
    - [291, 6975.24]
  - - [5888, 1408, 1, 256]
    - [333, 9778.49]
  - - [128, 128, 1, 256]
    - [295, 494.611]
  - - [448, 704, 1, 3328]
    - [308, 5075.57]
  - - [448, 1856, 1, 256]
    - [327, 6442.52]
  - - [1856, 704, 1, 3328]
    - [331, 9430.19]
  - - [5888, 6784, 1, 3328]
    - [331, 10508.0]
  - - [704, 4288, 1, 1280]
    - [331, 9571.96]
  - - [4096, 7000, 1, 4096]
    - [370, 17060.9]
  - - [5124, 9124, 1, 1760]
    - [369, 17597.3]
  - - [1760, 32, 1, 1760]
    - [348, 2065.07]
  - - [1024, 1500, 1, 1536]
    - [362, 14247.0]
  - - [512, 24000, 1, 2048]
    - [372, 15569.1]
  - - [3072, 24000, 1, 1024]
    - [370, 17692.8]
  - - [1024, 3000, 1, 2560]
    - [370, 16608.2]
  - - [512, 3136, 1, 2048]
    - [381, 12702.2]
  - - [7680, 4, 1, 2560]
    - [348, 1128.63]
  - - [64, 193600, 1, 64]
    - [369, 13431.3]
  - - [8448, 1500, 1, 2816]
    - [369, 16834.1]
  - - [2560, 7000, 1, 2560]
    - [369, 17276.5]
  - - [3072, 16, 1, 1024]
    - [343, 1695.81]
  - - [512, 48000, 1, 2048]
    - [372, 15995.8]
  - - [1760, 64, 1, 1760]
    - [364, 4157.85]
  - - [1024, 16, 1, 512]
    - [345, 440.578]
  - - [196, 256, 64, 1024]
    - [382, 8949.31]
  - - [512, 48000, 1, 1536]
    - [370, 17684.6]
  - - [2560, 32, 1, 2560]
    - [348, 3037.59]
  - - [4608, 1500, 1, 1536]
    - [370, 16508.3]
  - - [2048, 128, 1, 2048]
    - [367, 8473.34]
  - - [1024, 24000, 1, 2560]
    - [369, 17746.8]
  - - [4608, 3000, 1, 1536]
    - [370, 16899.3]
  - - [5124, 9124, 1, 2048]
    - [370, 16332.6]
  - - [2048, 16, 1, 2048]
    - [347, 1217.5]
  - - [1024, 700, 1, 512]
    - [361, 9400.66]
  - - [3072, 1, 1, 128]
    - [343, 57.8259]
  - - [5124, 700, 1, 2560]
    - [370, 14715.1]
  - - [8448, 16, 1, 2816]
    - [344, 4678.38]
  - - [6144, 6000, 1, 2560]
    - [363, 16507.6]
  - - [4608, 32, 1, 1536]
    - [343, 5128.9]
  - - [3072, 64, 1, 1024]
    - [359, 6403.52]
  - - [512, 16, 1, 512]
    - [345, 220.289]
  - - [7680, 2, 1, 2560]
    - [348, 566.267]
  - - [4224, 1, 1, 128]
    - [343, 78.586]
  - - [7680, 1, 1, 2560]
    - [348, 283.46]
  - - [128, 1500, 1, 1280]
    - [343, 6536.17]
  - - [1024, 1500, 1, 2816]
    - [362, 14522.5]
  - - [6144, 2, 1, 2560]
    - [348, 450.419]
  - - [8448, 48000, 1, 2816]
    - [370, 15518.5]
  - - [512, 6000, 1, 2048]
    - [374, 12121.3]
  - - [4224, 1500, 1, 176]
    - [355, 14023.3]
  - - [1024, 6000, 1, 2816]
    - [369, 17591.4]
  - - [1024, 48000, 1, 1536]
    - [370, 18080.3]
  - - [1024, 48000, 1, 2560]
    - [369, 18254.9]
  - - [4096, 32, 1, 4096]
    - [349, 4827.98]
  - - [512, 16, 1, 500000]
    - [345, 330.658]
  - - [2560, 128, 1, 2560]
    - [364, 8673.08]
  - - [4608, 24000, 1, 1536]
    - [369, 18298.6]
  - - [512, 2, 1, 500000]
    - [345, 41.3314]
  - - [7680, 48000, 1, 2560]
    - [370, 15645.3]
  - - [3072, 48000, 1, 1024]
    - [370, 17986.4]
  - - [1760, 16, 1, 1760]
    - [343, 1035.99]
  - - [1024, 1500, 1, 2048]
    - [366, 11136.1]
  - - [1024, 16, 1, 500000]
    - [345, 661.008]
  - - [64, 193600, 1, 256]
    - [375, 15677.8]
  - - [1024, 3000, 1, 2048]
    - [371, 12173.9]
  - - [6144, 4, 1, 2560]
    - [348, 904.985]
  - - [1024, 6000, 1, 2048]
    - [372, 14556.8]
  - - [512, 24000, 1, 2816]
    - [369, 17783.8]
  - - [6144, 48000, 1, 2560]
    - [372, 14434.6]
  - - [1760, 7000, 1, 1760]
    - [356, 16687.6]
  - - [8448, 3000, 1, 2816]
    - [369, 17630.2]
  - - [3072, 4, 1, 1024]
    - [343, 423.953]
  - - [4608, 48000, 1, 1536]
    - [369, 18437.1]
  - - [2048, 32, 1, 2048]
    - [368, 2407.06]
  - - [7680, 1500, 1, 2560]
    - [370, 16260.4]
  - - [4096, 128, 1, 4096]
    - [360, 11511.0]
  - - [4608, 16, 1, 1536]
    - [348, 2655.87]
  - - [512, 3000, 1, 1536]
    - [362, 14260.7]
  - - [3072, 2, 1, 1024]
    - [343, 214.872]
  - - [8448, 1, 1, 2816]
    - [344, 289.834]
  - - [1024, 3000, 1, 2816]
    - [369, 17002.3]
  - - [128, 1, 1, 1408]
    - [343, 4.75274]
  - - [64, 1, 1, 1216]
    - [345, 2.11939]
  - - [1024, 2, 1, 512]
    - [345, 55.0723]
  - - [1024, 4, 1, 500000]
    - [345, 165.084]
  - - [6144, 1, 1, 2560]
    - [348, 226.768]
  - - [5124, 9124, 1, 2560]
    - [370, 17113.5]
  - - [512, 48000, 1, 2816]
    - [369, 18060.4]
  - - [512, 3000, 1, 2816]
    - [362, 14530.3]
  - - [1024, 24000, 1, 1536]
    - [370, 17629.1]
  - - [7680, 6000, 1, 2560]
    - [369, 17726.0]
  - - [1760, 128, 1, 1760]
    - [367, 7497.97]
  - - [512, 1500, 1, 2816]
    - [361, 11273.4]
  - - [512, 1, 1, 512]
    - [350, 16.1419]
  - - [512, 6000, 1, 2560]
    - [370, 16656.0]
  - - [512, 8, 1, 500000]
    - [345, 165.328]
  - - [512, 24000, 1, 2560]
    - [370, 17561.4]
  - - [6144, 3000, 1, 2560]
    - [372, 16106.6]
  - - [1024, 24000, 1, 2816]
    - [369, 18138.0]
  - - [2048, 7000, 1, 2048]
    - [372, 15826.5]
  - - [7680, 3000, 1, 2560]
    - [363, 16179.8]
  - - [1024, 4, 1, 512]
    - [345, 110.609]
  - - [5124, 700, 1, 2048]
    - [372, 13074.5]
  - - [5124, 9124, 1, 4096]
    - [363, 15808.6]
  - - [4096, 64, 1, 4096]
    - [368, 8409.63]
  - - [256, 193600, 1, 64]
    - [352, 14460.0]
  - - [7680, 32, 1, 2560]
    - [351, 8501.97]
  - - [2560, 64, 1, 2560]
    - [359, 5877.67]
  - - [3072, 128, 1, 1024]
    - [364, 9514.49]
  - - [8448, 6000, 1, 2816]
    - [370, 17792.5]
  - - [7680, 64, 1, 2560]
    - [345, 11163.0]
  - - [5124, 1500, 1, 2560]
    - [370, 16136.5]
  - - [1024, 1500, 1, 2560]
    - [362, 14448.0]
  - - [512, 4, 1, 512]
    - [350, 64.251]
  - - [1024, 6000, 1, 2560]
    - [370, 17205.6]
  - - [3072, 32, 1, 1024]
    - [368, 3364.41]
  - - [6144, 32, 1, 2560]
    - [359, 6883.43]
  - - [196, 1024, 64, 256]
    - [385, 12380.8]
  - - [512, 50176, 1, 128]
    - [377, 15888.7]
  - - [4608, 1, 1, 1536]
    - [348, 165.681]
  - - [1024, 32, 1, 512]
    - [345, 907.858]
  - - [7680, 24000, 1, 2560]
    - [370, 17224.8]
  - - [8448, 4, 1, 2816]
    - [348, 1155.96]
  - - [512, 1, 1, 500000]
    - [345, 20.6657]
  - - [176, 1500, 1, 1408]
    - [345, 6743.69]
  - - [512, 3000, 1, 2560]
    - [362, 14469.2]
  - - [8448, 24000, 1, 2816]
    - [370, 14526.0]
  - - [4608, 2, 1, 1536]
    - [348, 329.511]
  - - [512, 6000, 1, 1536]
    - [370, 16415.9]
  - - [7680, 128, 1, 2560]
    - [353, 13827.4]
  - - [3072, 6000, 1, 1024]
    - [370, 16775.4]
  - - [3072, 1500, 1, 128]
    - [369, 12889.5]
  - - [2048, 3136, 1, 512]
    - [379, 15706.6]
  - - [1024, 3000, 1, 1536]
    - [370, 16365.8]
  - - [512, 4, 1, 500000]
    - [345, 82.6644]
  - - [512, 6000, 1, 2816]
    - [370, 16718.4]
  - - [128, 50176, 1, 512]
    - [376, 15938.0]
  - - [256, 12544, 1, 1024]
    - [380, 14000.1]
  - - [1024, 12544, 1, 256]
    - [378, 16382.7]
  - - [512, 48000, 1, 2560]
    - [370, 17747.2]
  - - [2560, 16, 1, 2560]
    - [343, 1534.8]
  - - [2048, 64, 1, 2048]
    - [368, 4719.33]
  - - [512, 2, 1, 512]
    - [350, 32.1255]
  - - [1024, 1, 1, 512]
    - [345, 27.5361]
  - - [512, 1500, 1, 2560]
    - [361, 11050.4]
  - - [512, 24000, 1, 1536]
    - [370, 17469.8]
  - - [1024, 1, 1, 500000]
    - [345, 41.1425]
  - - [6144, 16, 1, 2560]
    - [348, 3615.78]
  - - [1024, 24000, 1, 2048]
    - [372, 15988.1]
  - - [4096, 16, 1, 4096]
    - [349, 2507.81]
  - - [512, 32, 1, 512]
    - [345, 455.903]
  - - [5124, 1500, 1, 2048]
    - [372, 14375.8]
  - - [3072, 1500, 1, 1024]
    - [362, 14683.2]
  - - [1024, 2, 1, 500000]
    - [345, 82.5046]
  - - [1024, 8, 1, 500000]
    - [345, 330.528]
  - - [7680, 16, 1, 2560]
    - [348, 4514.54]
  - - [6144, 1500, 1, 2560]
    - [370, 16981.2]
  - - [3072, 1, 1, 1024]
    - [343, 107.143]
  - - [1024, 48000, 1, 2816]
    - [369, 18584.6]
  - - [8448, 2, 1, 2816]
    - [348, 579.103]
  - - [4608, 4, 1, 1536]
    - [348, 659.021]
  - - [1024, 6000, 1, 1536]
    - [370, 17098.8]
  - - [8448, 32, 1, 2816]
    - [345, 7214.43]
  - - [512, 3000, 1, 2048]
    - [372, 11148.7]
  - - [6144, 24000, 1, 2560]
    - [372, 15954.4]
  - - [4608, 6000, 1, 1536]
    - [370, 17669.4]
  - - [1024, 1024, 1, 1024]
    - [372, 13068.9]
  - - [512, 1500, 1, 2048]
    - [372, 9265.22]
  - - [512, 1500, 1, 1536]
    - [361, 10818.5]
  - - [128, 1, 1, 1024]
    - [343, 4.64136]
  - - [3072, 3000, 1, 1024]
    - [372, 15741.2]
  - - [1024, 48000, 1, 2048]
    - [370, 16800.7]
  - - [3136, 64, 128, 64]
    - [430, 15223.8]
  - - [784, 512, 64, 128]
    - [423, 18907.2]
  - - [3136, 256, 64, 64]
    - [430, 18012.3]
  - - [12544, 1024, 1, 256]
    - [426, 20780.7]
  - - [784, 128, 128, 512]
    - [425, 19837.9]
  - - [784, 512, 256, 128]
    - [429, 18471.7]
  - - [3136, 64, 64, 256]
    - [427, 19306.8]
  - - [3136, 512, 1, 2048]
    - [428, 15558.0]
  - - [12544, 256, 1, 1024]
    - [431, 17648.9]
  - - [3136, 2048, 1, 512]
    - [424, 19499.1]
  - - [3136, 256, 256, 64]
    - [433, 18095.6]
  - - [3136, 64, 128, 256]
    - [424, 19910.0]
  - - [784, 128, 64, 512]
    - [425, 19325.0]
  - - [3136, 64, 256, 64]
    - [430, 15429.5]
  - - [784, 512, 128, 128]
    - [423, 19136.0]
  - - [3136, 64, 64, 64]
    - [432, 14680.1]
  - - [784, 128, 256, 512]
    - [425, 20166.4]
  - - [3136, 64, 256, 256]
    - [427, 20048.3]
  - - [3136, 256, 128, 64]
    - [422, 18309.2]
  - - [64, 128, 512, 128]
    - [561, 14557.0]
  - - [64, 512, 1, 512]
    - [475, 945.0]
  - - [64, 512, 64, 512]
    - [552, 24010.0]
  - - [128, 128, 512, 64]
    - [559, 9282.0]
  - - [512, 512, 1, 64]
    - [496, 1531.0]
  - - [512, 512, 64, 64]
    - [554, 10974.0]
  - - [1024, 4, 1, 2]
    - [460, 1.0]
  - - [1024, 4, 1, 1024]
    - [536, 147.0]
  - - [1024, 32, 1, 2]
    - [492, 9.0]
  - - [1024, 32, 1, 1024]
    - [542, 1107.0]
  - - [1024, 2048, 1, 2]
    - [514, 237.0]
  - - [1024, 2048, 1, 1024]
    - [499, 29369.0]
  - - [1024, 2048, 1, 4096]
    - [494, 33755.0]
  - - [1024, 2048, 1, 30528]
    - [548, 41275.0]
  - - [1024, 4096, 1, 1024]
    - [529, 36621.0]
  - - [1024, 4096, 1, 4096]
    - [493, 40496.0]
  - - [1024, 4096, 1, 30528]
    - [491, 48353.0]
  - - [4096, 2048, 1, 1024]
    - [486, 41377.0]
  - - [4096, 4096, 1, 1024]
    - [480, 45808.0]
  - - [32, 33, 1600, 33]
    - [467, 1864.0]
  - - [32, 200, 1, 1]
    - [460, 1.0]
  - - [64, 3, 512, 3]
    - [470, 30.0]
  - - [64, 5, 512, 5]
    - [470, 81.0]
  - - [64, 5, 960, 5]
    - [465, 124.0]
  - - [64, 9, 512, 9]
    - [541, 239.0]
  - - [64, 512, 1, 1]
    - [477, 6.0]
  - - [67, 512, 1, 2048]
    - [558, 1258.0]
  - - [74, 512, 1, 2048]
    - [463, 1614.0]
  - - [74, 960, 1, 2048]
    - [534, 2901.0]
  - - [100, 512, 1, 2048]
    - [558, 2058.0]
  - - [128, 27, 32768, 27]
    - [484, 2610.0]
  - - [256, 1024, 1, 1]
    - [507, 30.0]
  - - [256, 8976, 1, 1536]
    - [556, 36981.0]
  - - [256, 8976, 1, 2048]
    - [528, 39061.0]
  - - [256, 8976, 1, 2304]
    - [540, 40800.0]
  - - [256, 8976, 1, 2560]
    - [505, 41614.0]
  - - [256, 8976, 1, 2816]
    - [521, 42415.0]
  - - [256, 8976, 1, 3072]
    - [512, 43085.0]
  - - [256, 8976, 1, 4352]
    - [474, 45275.0]
  - - [256, 8976, 1, 4864]
    - [476, 45927.0]
  - - [256, 8976, 1, 5376]
    - [512, 46288.0]
  - - [256, 8976, 1, 5632]
    - [474, 46592.0]
  - - [256, 8976, 1, 5888]
    - [474, 46758.0]
  - - [256, 8976, 1, 6144]
    - [495, 46113.0]
  - - [256, 8976, 1, 6656]
    - [474, 47182.0]
  - - [256, 8976, 1, 7168]
    - [509, 47604.0]
  - - [256, 8976, 1, 7424]
    - [476, 47684.0]
  - - [256, 8976, 1, 8192]
    - [512, 40815.0]
  - - [256, 8976, 1, 8448]
    - [476, 48107.0]
  - - [256, 8976, 1, 8960]
    - [476, 48385.0]
  - - [256, 8976, 1, 9472]
    - [474, 48471.0]
  - - [256, 8976, 1, 9728]
    - [474, 48561.0]
  - - [256, 8976, 1, 9984]
    - [476, 48655.0]
  - - [256, 8976, 1, 10240]
    - [495, 47802.0]
  - - [256, 8976, 1, 10496]
    - [474, 48791.0]
  - - [256, 8976, 1, 11008]
    - [543, 48945.0]
  - - [256, 8976, 1, 11520]
    - [560, 48985.0]
  - - [256, 8976, 1, 12288]
    - [488, 40199.0]
  - - [256, 8976, 1, 14336]
    - [512, 48285.0]
  - - [256, 8976, 1, 14848]
    - [551, 49614.0]
  - - [256, 8976, 1, 15104]
    - [476, 49609.0]
  - - [256, 8976, 1, 15872]
    - [551, 49721.0]
  - - [256, 8976, 1, 17152]
    - [476, 49869.0]
  - - [256, 8976, 1, 19712]
    - [474, 49714.0]
  - - [256, 8976, 1, 19968]
    - [495, 49653.0]
  - - [256, 8976, 1, 20480]
    - [512, 41490.0]
  - - [256, 8976, 1, 20992]
    - [545, 49638.0]
  - - [256, 8976, 1, 22016]
    - [516, 49687.0]
  - - [256, 8976, 1, 26112]
    - [553, 46739.0]
  - - [256, 8976, 1, 33536]
    - [522, 39564.0]
  - - [256, 8976, 1, 44505]
    - [502, 38680.0]
  - - [256, 32768, 1, 128]
    - [494, 17011.0]
  - - [257, 1024, 1, 4096]
    - [489, 8778.0]
  - - [480, 32768, 1, 1024]
    - [505, 53473.0]
  - - [512, 200, 1, 1]
    - [462, 10.0]
  - - [512, 200, 1, 32]
    - [471, 301.0]
  - - [512, 215, 1, 2048]
    - [518, 4270.0]
  - - [512, 256, 1, 2048]
    - [547, 5243.0]
  - - [512, 1600, 1, 32]
    - [479, 2409.0]
  - - [512, 1600, 1, 512]
    - [539, 18996.0]
  - - [512, 32768, 1, 256]
    - [511, 31323.0]
  - - [560, 200, 1, 1024]
    - [510, 3896.0]
  - - [560, 1600, 1, 1024]
    - [473, 27113.0]
  - - [768, 215, 1, 2048]
    - [466, 6434.0]
  - - [768, 256, 1, 2048]
    - [466, 7864.0]
  - - [1024, 200, 1, 1]
    - [464, 20.0]
  - - [1024, 512, 1, 1]
    - [532, 60.0]
  - - [1024, 512, 1, 64]
    - [479, 3130.0]
  - - [1024, 512, 1, 1024]
    - [546, 17163.0]
  - - [1024, 960, 1, 64]
    - [524, 4033.0]
  - - [1024, 960, 1, 1024]
    - [537, 21695.0]
  - - [1024, 1600, 1, 1]
    - [506, 119.0]
  - - [1024, 1600, 1, 1024]
    - [550, 35246.0]
  - - [1024, 1792, 1, 256]
    - [498, 21275.0]
  - - [1024, 2048, 1, 256]
    - [485, 17252.0]
  - - [1024, 2560, 1, 256]
    - [485, 21130.0]
  - - [1024, 3072, 1, 256]
    - [497, 22826.0]
  - - [1024, 3328, 1, 256]
    - [523, 24451.0]
  - - [1024, 3840, 1, 256]
    - [527, 27900.0]
  - - [1024, 4096, 1, 256]
    - [499, 22370.0]
  - - [1024, 4608, 1, 256]
    - [485, 24672.0]
  - - [1024, 4864, 1, 256]
    - [501, 24521.0]
  - - [1024, 5120, 1, 256]
    - [508, 25732.0]
  - - [1024, 5632, 1, 256]
    - [501, 28004.0]
  - - [1024, 6144, 1, 256]
    - [533, 24978.0]
  - - [1024, 6400, 1, 256]
    - [511, 25859.0]
  - - [1024, 7168, 1, 256]
    - [515, 28062.0]
  - - [1024, 7424, 1, 256]
    - [500, 29134.0]
  - - [1024, 7680, 1, 256]
    - [500, 30139.0]
  - - [1024, 7936, 1, 256]
    - [508, 26294.0]
  - - [1024, 8192, 1, 256]
    - [501, 27115.0]
  - - [1024, 8448, 1, 256]
    - [511, 27822.0]
  - - [1024, 8704, 1, 256]
    - [511, 28464.0]
  - - [1024, 8960, 1, 256]
    - [500, 29041.0]
  - - [1024, 9728, 1, 256]
    - [501, 28036.0]
  - - [1024, 9984, 1, 256]
    - [508, 28276.0]
  - - [1024, 10240, 1, 256]
    - [508, 28679.0]
  - - [1024, 10496, 1, 256]
    - [501, 28999.0]
  - - [1024, 11008, 1, 256]
    - [500, 30261.0]
  - - [1024, 11264, 1, 256]
    - [500, 30707.0]
  - - [1024, 11520, 1, 256]
    - [501, 30891.0]
  - - [1024, 12288, 1, 256]
    - [508, 29629.0]
  - - [1024, 13312, 1, 256]
    - [508, 31337.0]
  - - [1024, 13568, 1, 256]
    - [508, 29699.0]
  - - [1024, 14336, 1, 256]
    - [500, 30484.0]
  - - [1024, 14592, 1, 256]
    - [511, 30868.0]
  - - [1024, 14848, 1, 256]
    - [508, 31410.0]
  - - [1024, 15104, 1, 256]
    - [501, 31444.0]
  - - [1024, 16128, 1, 256]
    - [500, 30923.0]
  - - [1024, 17152, 1, 256]
    - [501, 31789.0]
  - - [1024, 18944, 1, 256]
    - [508, 32180.0]
  - - [1024, 19712, 1, 256]
    - [508, 31632.0]
  - - [1024, 19968, 1, 256]
    - [500, 31763.0]
  - - [1024, 20480, 1, 256]
    - [500, 32202.0]
  - - [1024, 20992, 1, 256]
    - [508, 32325.0]
  - - [1024, 21504, 1, 256]
    - [511, 31855.0]
  - - [1024, 22016, 1, 256]
    - [508, 32322.0]
  - - [1024, 23552, 1, 256]
    - [500, 32183.0]
  - - [1024, 28672, 1, 256]
    - [508, 32989.0]
  - - [1024, 32768, 1, 512]
    - [508, 44241.0]
  - - [1024, 32768, 1, 1024]
    - [509, 57396.0]
  - - [1024, 33536, 1, 256]
    - [515, 33220.0]
  - - [1024, 40448, 1, 256]
    - [511, 33708.0]
  - - [1600, 512, 1, 1024]
    - [544, 28112.0]
  - - [2048, 512, 1, 1]
    - [490, 73.0]
  - - [2048, 512, 1, 2048]
    - [517, 27142.0]
  - - [2048, 960, 1, 2048]
    - [520, 29485.0]
  - - [2048, 1024, 1, 1]
    - [478, 106.0]
  - - [2048, 1024, 1, 256]
    - [481, 16093.0]
  - - [3200, 1024, 1, 2048]
    - [535, 55627.0]
  - - [4096, 1024, 1, 1]
    - [483, 155.0]
  - - [64, 14, 1, 14]
    - [461, 2.0]
  - - [64, 14, 1, 15]
    - [461, 2.0]
  - - [64, 15, 1, 15]
    - [460, 2.0]
  - - [64, 15, 1, 15]
    - [460, 2.0]
  - - [64, 15, 1, 17]
    - [460, 2.0]
  - - [64, 17, 1, 17]
    - [460, 2.0]
  - - [64, 17, 1, 17]
    - [460, 2.0]
  - - [64, 17, 1, 21]
    - [461, 3.0]
  - - [64, 21, 1, 21]
    - [461, 4.0]
  - - [64, 24, 1, 24]
    - [461, 5.0]
  - - [64, 24, 1, 34]
    - [461, 6.0]
  - - [64, 30, 1, 30]
    - [461, 7.0]
  - - [64, 31, 1, 30]
    - [469, 8.0]
  - - [64, 31, 1, 31]
    - [472, 8.0]
  - - [64, 32, 1, 32]
    - [464, 9.0]
  - - [64, 34, 1, 34]
    - [468, 9.0]
  - - [64, 35, 1, 32]
    - [467, 10.0]
  - - [64, 35, 1, 35]
    - [461, 9.0]
  - - [1024, 3840, 1, 1024]
    - [538, 54062.0]
  - - [1024, 3840, 1, 4096]
    - [512, 46102.0]
  - - [1024, 3968, 1, 1024]
    - [519, 36168.0]
  - - [1024, 3968, 1, 4096]
    - [493, 39755.0]
  - - [1024, 3968, 1, 42720]
    - [531, 47150.0]
  - - [1024, 6528, 1, 1024]
    - [528, 48506.0]
  - - [1024, 6528, 1, 4096]
    - [549, 47734.0]
  - - [1024, 6528, 1, 42720]
    - [526, 57819.0]
  - - [1024, 7104, 1, 1024]
    - [530, 48270.0]
  - - [1024, 7104, 1, 4096]
    - [549, 48853.0]
  - - [1024, 7104, 1, 42720]
    - [517, 62599.0]
  - - [1024, 7200, 1, 1024]
    - [528, 51881.0]
  - - [1024, 7200, 1, 4096]
    - [555, 48834.0]
  - - [1024, 7200, 1, 42720]
    - [526, 62681.0]
  - - [1024, 8064, 1, 1024]
    - [527, 44920.0]
  - - [1024, 8064, 1, 4096]
    - [505, 48071.0]
  - - [1024, 8160, 1, 1024]
    - [508, 44051.0]
  - - [1024, 8160, 1, 4096]
    - [509, 47556.0]
  - - [1024, 9216, 1, 1024]
    - [508, 50797.0]
  - - [1024, 9216, 1, 4096]
    - [505, 50071.0]
  - - [1024, 9520, 1, 1024]
    - [508, 51819.0]
  - - [1024, 9520, 1, 4096]
    - [503, 48411.0]
  - - [1024, 9520, 1, 42720]
    - [525, 62058.0]
  - - [1024, 10064, 1, 1024]
    - [493, 49815.0]
  - - [1024, 10064, 1, 4096]
    - [504, 47246.0]
  - - [1024, 10080, 1, 1024]
    - [495, 49744.0]
  - - [1024, 10080, 1, 4096]
    - [504, 47740.0]
  - - [1024, 10080, 1, 42720]
    - [513, 59594.0]
  - - [1024, 10200, 1, 1024]
    - [530, 47595.0]
  - - [1024, 10200, 1, 4096]
    - [495, 47350.0]
  - - [4096, 3840, 1, 1024]
    - [486, 44680.0]
  - - [4096, 3968, 1, 1024]
    - [486, 45304.0]
  - - [4096, 6528, 1, 1024]
    - [487, 45531.0]
  - - [4096, 7104, 1, 1024]
    - [486, 46141.0]
  - - [4096, 7200, 1, 1024]
    - [486, 46437.0]
  - - [4096, 8064, 1, 1024]
    - [486, 46373.0]
  - - [4096, 8160, 1, 1024]
    - [480, 45874.0]
  - - [4096, 9216, 1, 1024]
    - [486, 47053.0]
  - - [4096, 9520, 1, 1024]
    - [487, 46159.0]
  - - [4096, 10064, 1, 1024]
    - [487, 46521.0]
  - - [4096, 10080, 1, 1024]
    - [487, 46464.0]
  - - [4096, 10200, 1, 1024]
    - [487, 46774.0]
  - - [1024, 3240, 1, 1024]
    - [520, 42467.0]
  - - [1024, 3240, 1, 4096]
    - [557, 41472.0]
  - - [1024, 3960, 1, 1024]
    - [499, 34419.0]
  - - [1024, 3960, 1, 4096]
    - [493, 39705.0]
  - - [1024, 3960, 1, 42720]
    - [517, 46985.0]
  - - [4096, 3240, 1, 1024]
    - [487, 43646.0]
  - - [4096, 3960, 1, 1024]
    - [482, 44697.0]
  - - [64, 30, 2048, 30]
    - [573, 2874.0]
  - - [64, 31, 2048, 30]
    - [564, 2919.0]
  - - [64, 31, 2048, 31]
    - [569, 2988.0]
  - - [64, 27, 1920, 27]
    - [568, 2382.0]
  - - [64, 33, 1920, 27]
    - [572, 2726.0]
  - - [64, 33, 1920, 33]
    - [571, 3138.0]
  - - [64, 14, 10880, 14]
    - [563, 1015.0]
  - - [64, 14, 10880, 15]
    - [562, 1083.0]
  - - [64, 15, 7680, 15]
    - [570, 1121.0]
  - - [64, 15, 10880, 15]
    - [567, 1148.0]
  - - [64, 15, 7680, 17]
    - [566, 1172.0]
  - - [64, 17, 7680, 17]
    - [565, 1314.0]
- null
