library/src/blas3/Tensile/Logic/asm_full/arcturus_Cijk_Alik_Bljk_BBH.yaml
- {MinimumRequiredVersion: 4.14.0}
- arcturus
- gfx908
- [Device 7380, Device 7388, Device 738c, Device 7390]
    SolutionIndex: 0
    SolutionNameMin: Cijk_Alik_Bljk_BBH_MT64x128x16_MI32x32x2x2_SE_GRVW4_ONLL1_SNLL0
    SolutionIndex: 1
    SolutionNameMin: Cijk_Alik_Bljk_BBH_MT256x128x16_SE_
    SolutionIndex: 2
    SolutionNameMin: Cijk_Alik_Bljk_BBH_MT128x64x16_SE_
    SolutionIndex: 3
    SolutionNameMin: Cijk_Alik_Bljk_BBH_MT32x128x16_SE_
    SolutionIndex: 4
    SolutionNameMin: Cijk_Alik_Bljk_BBH_MT64x128x16_SE_
    SolutionIndex: 5
    SolutionNameMin: Cijk_Alik_Bljk_BBH_MT256x128x16_SE_
    SolutionIndex: 6
    SolutionNameMin: Cijk_Alik_Bljk_BBH_MT64x16x16_SE_
    SolutionIndex: 7
    SolutionNameMin: Cijk_Alik_Bljk_BBH_MT16x64x16_SE_
    SolutionIndex: 8
    SolutionNameMin: Cijk_Alik_Bljk_BBH_MT32x32x32_SE_
    SolutionIndex: 9
    SolutionNameMin: Cijk_Alik_Bljk_BBH_MT64x128x64_SE_
    SolutionIndex: 10
    SolutionNameMin: Cijk_Alik_Bljk_BBH_MT128x64x16_SE_AF0EM1_ASEM1_GRVW1_WGM8
    SolutionIndex: 11
    SolutionNameMin: Cijk_Alik_Bljk_BBH_MT32x128x16_SE_AF0EM1_ASEM1_GRVW1_WGM8
    SolutionIndex: 12
    SolutionNameMin: Cijk_Alik_Bljk_BBH_MT64x16x16_SE_AF0EM1_ASEM1_GRVW1_WGM8
    SolutionIndex: 13
    SolutionNameMin: Cijk_Alik_Bljk_BBH_MT64x32x16_SE_AF0EM1_ASEM1_GRVW1_WGM8
    SolutionIndex: 14
    SolutionNameMin: Cijk_Alik_Bljk_BBH_MT64x128x32_MI32x32x2x2_SE_AF0EM2_ASEM1_GRVW4_WGM1
    SolutionIndex: 15
    SolutionNameMin: Cijk_Alik_Bljk_BBH_MT64x128x32_MI32x32x2x2_SE_AF0EM2_ASEM2_GRVW4_WGM1
    SolutionIndex: 16
    SolutionNameMin: Cijk_Alik_Bljk_BBH_MT32x256x32_MI32x32x2x2_SE_AF0EM2_ASEM1_GRVW4_WGM8
    SolutionIndex: 17
    SolutionNameMin: Cijk_Alik_Bljk_BBH_MT64x128x32_MI32x32x2x2_SE_AF0EM2_ASEM1_GRVW4_WGM8
    SolutionIndex: 18
    SolutionNameMin: Cijk_Alik_Bljk_BBH_MT64x128x32_MI32x32x2x2_SE_AF0EM2_ASEM2_GRVW4_WGM8
    SolutionIndex: 19
    SolutionIndex: 20
    SolutionIndex: 21
    SolutionIndex: 22
    SolutionIndex: 23
    SolutionIndex: 24
    SolutionIndex: 25
    SolutionIndex: 26
    SolutionIndex: 27
    SolutionIndex: 28
    SolutionIndex: 29
    SolutionIndex: 30
    SolutionIndex: 31
    SolutionIndex: 32
    SolutionIndex: 33
    SolutionIndex: 34
    SolutionIndex: 35
    SolutionIndex: 36
    SolutionIndex: 37
    SolutionIndex: 38
    SolutionIndex: 39
    SolutionIndex: 40
    SolutionIndex: 41
    SolutionIndex: 42
    SolutionIndex: 43
    SolutionIndex: 44
    SolutionIndex: 45
    SolutionIndex: 46
    SolutionIndex: 47
    SolutionIndex: 48
    SolutionIndex: 49
    SolutionIndex: 50
    SolutionIndex: 51
    SolutionIndex: 52
    SolutionIndex: 53
    SolutionIndex: 54
    SolutionIndex: 55
    SolutionIndex: 56
    SolutionIndex: 57
    SolutionIndex: 58
    SolutionIndex: 59
    SolutionIndex: 60
    SolutionIndex: 61
    SolutionIndex: 62
    SolutionIndex: 63
    SolutionIndex: 64
    SolutionIndex: 65
    SolutionIndex: 66
    SolutionIndex: 67
    SolutionIndex: 68
    SolutionIndex: 69
    SolutionIndex: 70
    SolutionIndex: 71
    SolutionIndex: 72
    SolutionIndex: 73
    SolutionIndex: 74
    SolutionIndex: 75
    SolutionIndex: 76
    SolutionIndex: 77
    SolutionIndex: 78
    SolutionIndex: 79
    SolutionIndex: 80
    SolutionIndex: 81
    SolutionIndex: 82
    SolutionIndex: 83
    SolutionIndex: 84
    SolutionIndex: 85
    SolutionIndex: 86
    SolutionIndex: 87
    SolutionIndex: 88
    SolutionNameMin: Cijk_Alik_Bljk_BBH_MT64x80x64_MI16x16x8x1_SE_1LDSB0_AF0EM4_GRVW4_LBSPP128_PLR9_SU0_SUS256_SRVW0_TT1_80_WG64_4_1_WGM15
    SolutionIndex: 89
    SolutionNameMin: Cijk_Alik_Bljk_BBH_MT64x64x128_MI32x32x4x1_SE_1LDSB1_AF0EM4_GRVW8_LBSPP256_PLR33_SU0_SUS256_SRVW0_TT1_32_WG64_4_1_WGM15
    SolutionIndex: 90
    SolutionNameMin: Cijk_Alik_Bljk_BBH_MT32x32x128_MI16x16x8x1_SE_1LDSB0_AF0EM1_GRVW2_LBSPP256_PLR17_SU16_SUS256_SRVW0_TT1_16_WG32_8_1_WGM1
    SolutionIndex: 91
    SolutionNameMin: Cijk_Alik_Bljk_BBH_MT64x128x32_MI32x32x2x2_SE_1LDSB0_AF0EM1_GRVW8_LBSPP128_PLR17_SU0_SUS256_SRVW4_TT1_32_WG64_4_1_WGM15
    SolutionIndex: 92
    SolutionNameMin: Cijk_Alik_Bljk_BBH_MT128x96x32_MI32x32x4x1_SE_1LDSB0_AF0EM4_GRVW4_LBSPP128_PLR9_SU0_SUS256_SRVW4_TT1_96_WG128_2_1_WGM1
    SolutionIndex: 93
    SolutionNameMin: Cijk_Alik_Bljk_BBH_MT32x32x128_MI16x16x8x1_SE_1LDSB0_AF0EM4_GRVW4_LBSPP256_PLR17_SU0_SUS256_SRVW0_TT1_16_WG32_8_1_WGM1
    SolutionIndex: 94
    SolutionNameMin: Cijk_Alik_Bljk_BBH_MT64x32x64_MI16x16x8x1_SE_1LDSB0_AF0EM4_GRVW4_LBSPP128_PLR9_SU0_SUS256_SRVW0_TT2_16_WG32_8_1_WGM15
    SolutionIndex: 95
    SolutionNameMin: Cijk_Alik_Bljk_BBH_MT128x80x64_MI16x16x8x1_SE_1LDSB0_AF0EM4_GRVW2_LBSPP128_PLR9_SU0_SUS256_SRVW0_TT2_80_WG64_4_1_WGM2
    SolutionIndex: 96
    SolutionNameMin: Cijk_Alik_Bljk_BBH_MT64x128x32_MI32x32x2x2_SE_1LDSB0_AF0EM4_GRVW8_LBSPP128_PLR17_SU0_SUS256_SRVW4_TT1_32_WG64_4_1_WGM15
    SolutionIndex: 97
    SolutionNameMin: Cijk_Alik_Bljk_BBH_MT128x64x32_MI32x32x2x2_SE_1LDSB0_AF0EM1_GRVW8_LBSPP128_PLR17_SU0_SUS256_SRVW4_TT1_32_WG128_2_1_WGM15
    SolutionIndex: 98
    SolutionNameMin: Cijk_Alik_Bljk_BBH_MT64x128x32_MI32x32x2x2_SE_1LDSB0_AF0EM1_GRVW2_LBSPP128_PLR17_SU0_SUS256_SRVW4_TT1_32_WG64_4_1_WGM15
    SolutionIndex: 99
    SolutionNameMin: Cijk_Alik_Bljk_BBH_MT128x80x64_MI16x16x8x1_SE_1LDSB0_AF0EM4_GRVW2_LBSPP128_PLR9_SU32_SUS128_SRVW0_TT2_80_WG64_4_1_WGM2
    SolutionIndex: 100
    SolutionNameMin: Cijk_Alik_Bljk_BBH_MT64x128x64_MI32x32x4x1_SE_1LDSB0_AF0EM4_GRVW8_LBSPP128_PLR17_SU0_SUS256_SRVW4_TT1_64_WG64_4_1_WGM15
    SolutionIndex: 101
    SolutionNameMin: Cijk_Alik_Bljk_BBH_MT64x128x128_MI32x32x4x1_SE_1LDSB1_AF0EM1_GRVW4_LBSPP256_PLR33_SU0_SUS256_SRVW4_TT1_64_WG64_4_1_WGM1
    SolutionIndex: 102
    SolutionNameMin: Cijk_Alik_Bljk_BBH_MT32x32x128_MI16x16x8x1_SE_1LDSB0_AF0EM1_GRVW8_LBSPP256_PLR17_SU0_SUS256_SRVW4_TT1_16_WG32_8_1_WGM1
    SolutionIndex: 103
    SolutionNameMin: Cijk_Alik_Bljk_BBH_MT32x32x64_MI16x16x8x1_SE_1LDSB0_AF0EM1_GRVW4_LBSPP128_PLR9_SU0_SUS256_SRVW0_TT1_16_WG32_8_1_WGM1
    SolutionIndex: 104
    SolutionNameMin: Cijk_Alik_Bljk_BBH_MT32x32x128_MI16x16x8x1_SE_1LDSB0_AF0EM4_GRVW2_LBSPP256_PLR17_SU32_SUS256_SRVW4_TT1_16_WG32_8_1_WGM15
    SolutionIndex: 105
    SolutionNameMin: Cijk_Alik_Bljk_BBH_MT32x32x64_MI16x16x8x1_SE_1LDSB0_AF0EM1_GRVW2_LBSPP128_PLR9_SU0_SUS256_SRVW0_TT1_16_WG32_8_1_WGM1
    SolutionIndex: 106
    SolutionNameMin: Cijk_Alik_Bljk_BBH_MT32x32x64_MI16x16x8x1_SE_1LDSB0_AF0EM1_GRVW2_LBSPP128_PLR9_SU0_SUS256_SRVW0_TT1_16_WG32_8_1_WGM15
    SolutionIndex: 107
    SolutionNameMin: Cijk_Alik_Bljk_BBH_MT32x32x128_MI16x16x8x1_SE_1LDSB0_AF0EM4_GRVW8_LBSPP256_PLR17_SU0_SUS256_SRVW4_TT1_16_WG32_8_1_WGM1
    SolutionIndex: 108
    SolutionNameMin: Cijk_Alik_Bljk_BBH_MT64x128x32_MI32x32x2x2_SE_1LDSB0_AF0EM4_GRVW8_LBSPP128_PLR17_SU16_SUS128_SRVW4_TT1_32_WG64_4_1_WGM15
    SolutionIndex: 109
    SolutionNameMin: Cijk_Alik_Bljk_BBH_MT32x32x128_MI16x16x8x1_SE_1LDSB0_AF0EM4_GRVW8_LBSPP256_PLR17_SU0_SUS256_SRVW0_TT1_16_WG32_8_1_WGM2
    SolutionIndex: 110
    SolutionNameMin: Cijk_Alik_Bljk_BBH_MT64x128x32_MI32x32x4x1_SE_1LDSB0_AF0EM4_GRVW8_LBSPP128_PLR9_SU16_SUS128_SRVW4_TT1_64_WG64_4_1_WGM15
    SolutionIndex: 111
    SolutionNameMin: Cijk_Alik_Bljk_BBH_MT128x80x64_MI16x16x8x1_SE_1LDSB0_AF0EM4_GRVW2_LBSPP128_PLR9_SU32_SUS128_SRVW0_TT2_80_WG64_4_1_WGM15
    SolutionIndex: 112
    SolutionNameMin: Cijk_Alik_Bljk_BBH_MT128x64x32_MI32x32x4x1_SE_1LDSB0_AF0EM4_GRVW8_LBSPP128_PLR9_SU32_SUS256_SRVW4_TT2_32_WG64_4_1_WGM15
    SolutionIndex: 113
    SolutionNameMin: Cijk_Alik_Bljk_BBH_MT64x32x64_MI16x16x8x1_SE_1LDSB0_AF0EM1_GRVW2_LBSPP128_PLR9_SU0_SUS256_SRVW0_TT2_16_WG32_8_1_WGM1
    SolutionIndex: 114
    SolutionNameMin: Cijk_Alik_Bljk_BBH_MT64x64x128_MI32x32x4x1_SE_1LDSB1_AF0EM1_GRVW8_LBSPP256_PLR33_SU0_SUS256_SRVW4_TT1_32_WG64_4_1_WGM15
    SolutionIndex: 115
    SolutionNameMin: Cijk_Alik_Bljk_BBH_MT32x32x64_MI16x16x8x1_SE_1LDSB0_AF0EM1_GRVW8_LBSPP128_PLR9_SU0_SUS256_SRVW0_TT1_16_WG32_8_1_WGM1
    SolutionIndex: 116
    SolutionNameMin: Cijk_Alik_Bljk_BBH_MT128x96x32_MI32x32x4x1_SE_1LDSB0_AF0EM4_GRVW2_LBSPP128_PLR9_SU0_SUS256_SRVW4_TT1_96_WG128_2_1_WGM15
    SolutionIndex: 117
    SolutionNameMin: Cijk_Alik_Bljk_BBH_MT64x128x32_MI32x32x2x2_SE_1LDSB0_AF0EM1_GRVW2_LBSPP128_PLR17_SU16_SUS256_SRVW4_TT1_32_WG64_4_1_WGM2
    SolutionIndex: 118
    SolutionNameMin: Cijk_Alik_Bljk_BBH_MT32x32x64_MI16x16x8x1_SE_1LDSB0_AF0EM1_GRVW8_LBSPP128_PLR9_SU16_SUS128_SRVW0_TT1_16_WG32_8_1_WGM1
    SolutionIndex: 119
    SolutionNameMin: Cijk_Alik_Bljk_BBH_MT64x128x32_MI32x32x4x1_SE_1LDSB0_AF0EM4_GRVW8_LBSPP128_PLR9_SU16_SUS128_SRVW4_TT1_64_WG64_4_1_WGM2
    SolutionIndex: 120
    SolutionNameMin: Cijk_Alik_Bljk_BBH_MT128x96x32_MI32x32x4x1_SE_1LDSB0_AF0EM4_GRVW2_LBSPP128_PLR9_SU32_SUS256_SRVW4_TT1_96_WG128_2_1_WGM15
    SolutionIndex: 121
    SolutionNameMin: Cijk_Alik_Bljk_BBH_MT128x64x64_MI32x32x4x1_SE_1LDSB0_AF0EM4_GRVW8_LBSPP128_PLR17_SU0_SUS256_SRVW0_TT2_32_WG64_4_1_WGM1
    SolutionIndex: 122
    SolutionNameMin: Cijk_Alik_Bljk_BBH_MT128x96x32_MI32x32x4x1_SE_1LDSB0_AF0EM4_GRVW2_LBSPP128_PLR9_SU16_SUS128_SRVW4_TT1_96_WG128_2_1_WGM1
    SolutionIndex: 123
    SolutionNameMin: Cijk_Alik_Bljk_BBH_MT128x96x32_MI32x32x4x1_SE_1LDSB0_AF0EM4_GRVW2_LBSPP128_PLR9_SU16_SUS256_SRVW4_TT1_96_WG128_2_1_WGM15
    SolutionIndex: 124
    SolutionNameMin: Cijk_Alik_Bljk_BBH_MT128x64x32_MI32x32x4x1_SE_1LDSB0_AF0EM1_GRVW8_LBSPP128_PLR9_SU0_SUS256_SRVW4_TT2_32_WG64_4_1_WGM15
    SolutionIndex: 125
    SolutionNameMin: Cijk_Alik_Bljk_BBH_MT64x80x64_MI16x16x8x1_SE_1LDSB0_AF0EM4_GRVW4_LBSPP128_PLR9_SU16_SUS128_SRVW0_TT1_80_WG64_4_1_WGM15
    SolutionIndex: 126
    SolutionNameMin: Cijk_Alik_Bljk_BBH_MT128x160x64_MI32x32x4x1_SE_1LDSB1_AF0EM4_GRVW2_LBSPP128_PLR17_SU0_SUS256_SRVW0_TT1_160_WG128_2_1_WGM1
    SolutionIndex: 127
    SolutionNameMin: Cijk_Alik_Bljk_BBH_MT128x96x32_MI32x32x4x1_SE_1LDSB0_AF0EM1_GRVW2_LBSPP128_PLR9_SU32_SUS128_SRVW4_TT1_96_WG128_2_1_WGM15
    SolutionIndex: 128
    SolutionNameMin: Cijk_Alik_Bljk_BBH_MT64x128x32_MI32x32x2x2_SE_1LDSB0_AF0EM4_GRVW2_LBSPP128_PLR17_SU0_SUS256_SRVW4_TT1_32_WG64_4_1_WGM15
    SolutionIndex: 129
    SolutionNameMin: Cijk_Alik_Bljk_BBH_MT128x96x32_MI32x32x4x1_SE_1LDSB0_AF0EM1_GRVW2_LBSPP128_PLR9_SU0_SUS256_SRVW4_TT1_96_WG128_2_1_WGM15
    SolutionIndex: 130
    SolutionNameMin: Cijk_Alik_Bljk_BBH_MT64x80x64_MI16x16x8x1_SE_1LDSB0_AF0EM4_GRVW4_LBSPP128_PLR9_SU32_SUS256_SRVW0_TT1_80_WG64_4_1_WGM2
    SolutionIndex: 131
    SolutionNameMin: Cijk_Alik_Bljk_BBH_MT128x96x32_MI32x32x4x1_SE_1LDSB0_AF0EM4_GRVW2_LBSPP128_PLR9_SU32_SUS128_SRVW4_TT1_96_WG128_2_1_WGM2
    SolutionIndex: 132
    SolutionNameMin: Cijk_Alik_Bljk_BBH_MT64x128x32_MI32x32x2x2_SE_1LDSB0_AF0EM1_GRVW2_LBSPP128_PLR17_SU16_SUS128_SRVW4_TT1_32_WG64_4_1_WGM15
    SolutionIndex: 133
    SolutionNameMin: Cijk_Alik_Bljk_BBH_MT128x96x32_MI32x32x4x1_SE_1LDSB0_AF0EM1_GRVW2_LBSPP128_PLR9_SU0_SUS256_SRVW4_TT1_96_WG128_2_1_WGM1
    SolutionIndex: 134
    SolutionNameMin: Cijk_Alik_Bljk_BBH_MT128x80x64_MI16x16x8x1_SE_1LDSB0_AF0EM4_GRVW2_LBSPP128_PLR9_SU32_SUS256_SRVW0_TT2_80_WG64_4_1_WGM2
    SolutionIndex: 135
    SolutionNameMin: Cijk_Alik_Bljk_BBH_MT64x128x64_MI32x32x4x1_SE_1LDSB0_AF0EM4_GRVW2_LBSPP128_PLR17_SU16_SUS128_SRVW4_TT1_64_WG64_4_1_WGM2
    SolutionIndex: 136
    SolutionNameMin: Cijk_Alik_Bljk_BBH_MT128x128x32_MI32x32x4x1_SE_1LDSB0_AF0EM4_GRVW8_LBSPP128_PLR9_SU0_SUS256_SRVW4_TT2_64_WG64_4_1_WGM2
    SolutionIndex: 137
    SolutionNameMin: Cijk_Alik_Bljk_BBH_MT32x32x128_MI16x16x8x1_SE_1LDSB0_AF0EM4_GRVW8_LBSPP256_PLR17_SU0_SUS256_SRVW0_TT1_16_WG32_8_1_WGM15
    SolutionIndex: 138
    SolutionNameMin: Cijk_Alik_Bljk_BBH_MT32x64x128_MI16x16x8x1_SE_1LDSB0_AF0EM4_GRVW8_LBSPP256_PLR17_SU0_SUS256_SRVW0_TT1_32_WG32_8_1_WGM15
    SolutionIndex: 139
    SolutionNameMin: Cijk_Alik_Bljk_BBH_MT128x64x32_MI32x32x4x1_SE_1LDSB0_AF0EM1_GRVW8_LBSPP128_PLR9_SU32_SUS128_SRVW4_TT2_32_WG64_4_1_WGM15
    SolutionIndex: 140
    SolutionNameMin: Cijk_Alik_Bljk_BBH_MT64x128x64_MI32x32x4x1_SE_1LDSB0_AF0EM4_GRVW8_LBSPP128_PLR17_SU0_SUS256_SRVW4_TT1_64_WG64_4_1_WGM2
    SolutionIndex: 141
    SolutionNameMin: Cijk_Alik_Bljk_BBH_MT32x32x64_MI16x16x8x1_SE_1LDSB0_AF0EM4_GRVW2_LBSPP128_PLR9_SU0_SUS256_SRVW0_TT1_16_WG32_8_1_WGM1
    SolutionIndex: 142
    SolutionNameMin: Cijk_Alik_Bljk_BBH_MT64x128x32_MI32x32x4x1_SE_1LDSB0_AF0EM1_GRVW8_LBSPP128_PLR9_SU32_SUS256_SRVW4_TT1_64_WG64_4_1_WGM1
    SolutionIndex: 143
    SolutionNameMin: Cijk_Alik_Bljk_BBH_MT64x32x128_MI16x16x8x1_SE_1LDSB0_AF0EM1_GRVW8_LBSPP256_PLR17_SU0_SUS256_SRVW0_TT2_16_WG32_8_1_WGM15
    SolutionIndex: 144
    SolutionNameMin: Cijk_Alik_Bljk_BBH_MT64x64x32_MI32x32x4x1_SE_1LDSB0_AF0EM1_GRVW2_LBSPP128_PLR9_SU0_SUS256_SRVW0_TT1_32_WG64_4_1_WGM1
    SolutionIndex: 145
    SolutionNameMin: Cijk_Alik_Bljk_BBH_MT64x64x32_MI32x32x4x1_SE_1LDSB0_AF0EM4_GRVW8_LBSPP128_PLR9_SU32_SUS128_SRVW4_TT1_32_WG64_4_1_WGM15
    SolutionIndex: 146
    SolutionNameMin: Cijk_Alik_Bljk_BBH_MT128x96x32_MI32x32x4x1_SE_1LDSB0_AF0EM4_GRVW2_LBSPP128_PLR9_SU0_SUS256_SRVW4_TT1_96_WG128_2_1_WGM2
    SolutionIndex: 147
    SolutionNameMin: Cijk_Alik_Bljk_BBH_MT64x128x64_MI32x32x2x2_SE_1LDSB0_AF0EM1_GRVW8_LBSPP128_PLR33_SU0_SUS256_SRVW4_TT1_32_WG64_4_1_WGM15
    SolutionIndex: 148
    SolutionNameMin: Cijk_Alik_Bljk_BBH_MT64x80x128_MI16x16x8x1_SE_1LDSB1_AF0EM4_GRVW8_LBSPP256_PLR17_SU0_SUS256_SRVW0_TT1_80_WG64_4_1_WGM15
    SolutionIndex: 149
    SolutionNameMin: Cijk_Alik_Bljk_BBH_MT128x128x32_MI32x32x4x1_SE_1LDSB0_AF0EM1_GRVW8_LBSPP128_PLR9_SU0_SUS256_SRVW4_TT2_64_WG64_4_1_WGM15
    SolutionIndex: 150
    SolutionNameMin: Cijk_Alik_Bljk_BBH_MT128x96x32_MI32x32x4x1_SE_1LDSB0_AF0EM4_GRVW2_LBSPP128_PLR9_SU16_SUS128_SRVW4_TT1_96_WG128_2_1_WGM2
    SolutionIndex: 151
    SolutionNameMin: Cijk_Alik_Bljk_BBH_MT128x96x64_MI32x32x4x1_SE_1LDSB0_AF0EM1_GRVW8_LBSPP128_PLR17_SU0_SUS256_SRVW4_TT1_96_WG128_2_1_WGM1
    SolutionIndex: 152
    SolutionNameMin: Cijk_Alik_Bljk_BBH_MT128x96x32_MI32x32x4x1_SE_1LDSB0_AF0EM4_GRVW2_LBSPP128_PLR9_SU32_SUS128_SRVW4_TT1_96_WG128_2_1_WGM1
    SolutionIndex: 153
    SolutionNameMin: Cijk_Alik_Bljk_BBH_MT128x96x32_MI32x32x4x1_SE_1LDSB0_AF0EM1_GRVW2_LBSPP128_PLR9_SU0_SUS256_SRVW4_TT1_96_WG128_2_1_WGM2
    SolutionIndex: 154
    SolutionNameMin: Cijk_Alik_Bljk_BBH_MT32x32x128_MI16x16x8x1_SE_1LDSB0_AF0EM1_GRVW2_LBSPP256_PLR17_SU0_SUS256_SRVW0_TT1_16_WG32_8_1_WGM1
    SolutionIndex: 155
    SolutionNameMin: Cijk_Alik_Bljk_BBH_MT32x32x64_MI16x16x8x1_SE_1LDSB0_AF0EM1_GRVW2_LBSPP128_PLR9_SU16_SUS256_SRVW0_TT1_16_WG32_8_1_WGM1
    SolutionIndex: 156
    SolutionNameMin: Cijk_Alik_Bljk_BBH_MT64x128x64_MI32x32x2x2_SE_1LDSB0_AF0EM1_GRVW8_LBSPP128_PLR33_SU0_SUS256_SRVW4_TT1_32_WG64_4_1_WGM1
    SolutionIndex: 157
    SolutionNameMin: Cijk_Alik_Bljk_BBH_MT64x64x32_MI32x32x4x1_SE_1LDSB0_AF0EM4_GRVW2_LBSPP128_PLR9_SU32_SUS128_SRVW4_TT1_32_WG64_4_1_WGM2
    SolutionIndex: 158
    SolutionNameMin: Cijk_Alik_Bljk_BBH_MT32x32x64_MI16x16x8x1_SE_1LDSB0_AF0EM1_GRVW2_LBSPP128_PLR9_SU16_SUS128_SRVW0_TT1_16_WG32_8_1_WGM15
    SolutionIndex: 159
    SolutionNameMin: Cijk_Alik_Bljk_BBH_MT128x64x32_MI32x32x2x2_SE_1LDSB0_AF0EM1_GRVW2_LBSPP128_PLR17_SU32_SUS256_SRVW4_TT1_32_WG128_2_1_WGM15
    SolutionIndex: 160
    SolutionNameMin: Cijk_Alik_Bljk_BBH_MT128x128x32_MI32x32x4x1_SE_1LDSB0_AF0EM4_GRVW8_LBSPP128_PLR9_SU0_SUS256_SRVW4_TT2_64_WG64_4_1_WGM1
    SolutionIndex: 161
    SolutionNameMin: Cijk_Alik_Bljk_BBH_MT64x64x128_MI32x32x4x1_SE_1LDSB1_AF0EM1_GRVW8_LBSPP256_PLR33_SU0_SUS256_SRVW4_TT1_32_WG64_4_1_WGM2
    SolutionIndex: 162
    SolutionNameMin: Cijk_Alik_Bljk_BBH_MT64x64x128_MI32x32x4x1_SE_1LDSB1_AF0EM4_GRVW8_LBSPP256_PLR33_SU0_SUS256_SRVW4_TT1_32_WG64_4_1_WGM15
    SolutionIndex: 163
    SolutionNameMin: Cijk_Alik_Bljk_BBH_MT128x160x32_MI32x32x4x1_SE_1LDSB0_AF0EM4_GRVW2_LBSPP128_PLR9_SU32_SUS128_SRVW0_TT1_160_WG128_2_1_WGM2
    SolutionIndex: 164
    SolutionNameMin: Cijk_Alik_Bljk_BBH_MT64x128x32_MI32x32x2x2_SE_1LDSB0_AF0EM1_GRVW2_LBSPP128_PLR17_SU32_SUS256_SRVW4_TT1_32_WG64_4_1_WGM1
    SolutionIndex: 165
    SolutionNameMin: Cijk_Alik_Bljk_BBH_MT128x64x32_MI32x32x2x2_SE_1LDSB0_AF0EM1_GRVW2_LBSPP128_PLR17_SU16_SUS128_SRVW4_TT1_32_WG128_2_1_WGM15
    SolutionIndex: 166
    SolutionNameMin: Cijk_Alik_Bljk_BBH_MT64x128x32_MI32x32x2x2_SE_1LDSB0_AF0EM4_GRVW2_LBSPP128_PLR17_SU16_SUS128_SRVW4_TT1_32_WG64_4_1_WGM15
    SolutionIndex: 167
    SolutionNameMin: Cijk_Alik_Bljk_BBH_MT32x32x128_MI16x16x8x1_SE_1LDSB0_AF0EM1_GRVW8_LBSPP256_PLR17_SU32_SUS256_SRVW4_TT1_16_WG32_8_1_WGM2
    SolutionIndex: 168
    SolutionNameMin: Cijk_Alik_Bljk_BBH_MT64x64x32_MI32x32x4x1_SE_1LDSB0_AF0EM4_GRVW2_LBSPP128_PLR9_SU16_SUS128_SRVW4_TT1_32_WG64_4_1_WGM2
    SolutionIndex: 169
    SolutionNameMin: Cijk_Alik_Bljk_BBH_MT128x64x32_MI32x32x4x1_SE_1LDSB0_AF0EM4_GRVW8_LBSPP128_PLR9_SU16_SUS128_SRVW4_TT2_32_WG64_4_1_WGM15
    SolutionIndex: 170
    SolutionNameMin: Cijk_Alik_Bljk_BBH_MT64x32x128_MI16x16x8x1_SE_1LDSB0_AF0EM1_GRVW8_LBSPP256_PLR17_SU16_SUS256_SRVW0_TT2_16_WG32_8_1_WGM15
    SolutionIndex: 171
    SolutionNameMin: Cijk_Alik_Bljk_BBH_MT128x144x64_MI16x16x8x1_SE_1LDSB1_AF0EM4_GRVW2_LBSPP128_PLR9_SU0_SUS256_SRVW0_TT2_144_WG64_4_1_WGM15
    SolutionIndex: 172
    SolutionNameMin: Cijk_Alik_Bljk_BBH_MT128x64x64_MI32x32x4x1_SE_1LDSB0_AF0EM4_GRVW8_LBSPP128_PLR17_SU0_SUS256_SRVW4_TT2_32_WG64_4_1_WGM15
    SolutionIndex: 173
    SolutionNameMin: Cijk_Alik_Bljk_BBH_MT128x144x64_MI16x16x8x1_SE_1LDSB1_AF0EM4_GRVW2_LBSPP128_PLR9_SU0_SUS256_SRVW0_TT2_144_WG64_4_1_WGM1
    SolutionIndex: 174
    SolutionNameMin: Cijk_Alik_Bljk_BBH_MT32x32x128_MI16x16x8x1_SE_1LDSB0_AF0EM4_GRVW8_LBSPP256_PLR17_SU0_SUS256_SRVW4_TT1_16_WG32_8_1_WGM15
    SolutionIndex: 175
    SolutionNameMin: Cijk_Alik_Bljk_BBH_MT64x128x32_MI32x32x2x2_SE_1LDSB0_AF0EM4_GRVW8_LBSPP128_PLR17_SU16_SUS256_SRVW4_TT1_32_WG64_4_1_WGM1
    SolutionIndex: 176
    SolutionNameMin: Cijk_Alik_Bljk_BBH_MT32x32x128_MI16x16x8x1_SE_1LDSB0_AF0EM4_GRVW8_LBSPP256_PLR17_SU16_SUS256_SRVW0_TT1_16_WG32_8_1_WGM2
    SolutionIndex: 177
    SolutionNameMin: Cijk_Alik_Bljk_BBH_MT64x32x64_MI16x16x8x1_SE_1LDSB0_AF0EM1_GRVW8_LBSPP128_PLR9_SU0_SUS256_SRVW0_TT2_16_WG32_8_1_WGM15
    SolutionIndex: 178
    SolutionNameMin: Cijk_Alik_Bljk_BBH_MT32x32x128_MI16x16x8x1_SE_1LDSB0_AF0EM1_GRVW8_LBSPP256_PLR17_SU0_SUS256_SRVW0_TT1_16_WG32_8_1_WGM15
    SolutionIndex: 179
    SolutionNameMin: Cijk_Alik_Bljk_BBH_MT32x32x128_MI16x16x8x1_SE_1LDSB0_AF0EM4_GRVW8_LBSPP256_PLR17_SU32_SUS256_SRVW4_TT1_16_WG32_8_1_WGM1
    SolutionIndex: 180
    SolutionNameMin: Cijk_Alik_Bljk_BBH_MT64x32x128_MI16x16x8x1_SE_1LDSB0_AF0EM1_GRVW4_LBSPP256_PLR17_SU0_SUS256_SRVW0_TT2_16_WG32_8_1_WGM15
    SolutionIndex: 181
    SolutionNameMin: Cijk_Alik_Bljk_BBH_MT128x64x32_MI32x32x4x1_SE_1LDSB0_AF0EM4_GRVW8_LBSPP128_PLR9_SU16_SUS128_SRVW4_TT2_32_WG64_4_1_WGM2
    SolutionIndex: 182
    SolutionNameMin: Cijk_Alik_Bljk_BBH_MT64x128x32_MI32x32x2x2_SE_1LDSB0_AF0EM4_GRVW2_LBSPP128_PLR17_SU16_SUS256_SRVW4_TT1_32_WG64_4_1_WGM2
    SolutionIndex: 183
    SolutionNameMin: Cijk_Alik_Bljk_BBH_MT128x96x128_MI32x32x4x1_SE_1LDSB1_AF0EM4_GRVW2_LBSPP256_PLR33_SU32_SUS256_SRVW0_TT1_96_WG128_2_1_WGM2
    SolutionIndex: 184
    SolutionNameMin: Cijk_Alik_Bljk_BBH_MT128x96x32_MI32x32x4x1_SE_1LDSB0_AF0EM4_GRVW4_LBSPP128_PLR9_SU32_SUS128_SRVW4_TT1_96_WG128_2_1_WGM1
    SolutionIndex: 185
    SolutionNameMin: Cijk_Alik_Bljk_BBH_MT64x128x32_MI32x32x2x2_SE_1LDSB0_AF0EM4_GRVW8_LBSPP128_PLR17_SU32_SUS256_SRVW4_TT1_32_WG64_4_1_WGM15
    SolutionIndex: 186
    SolutionNameMin: Cijk_Alik_Bljk_BBH_MT128x64x32_MI32x32x2x2_SE_1LDSB0_AF0EM1_GRVW2_LBSPP128_PLR17_SU16_SUS256_SRVW4_TT1_32_WG128_2_1_WGM15
    SolutionIndex: 187
    SolutionNameMin: Cijk_Alik_Bljk_BBH_MT64x64x32_MI32x32x4x1_SE_1LDSB0_AF0EM4_GRVW2_LBSPP128_PLR9_SU0_SUS256_SRVW4_TT1_32_WG64_4_1_WGM1
    SolutionIndex: 188
    SolutionNameMin: Cijk_Alik_Bljk_BBH_MT128x96x64_MI32x32x4x1_SE_1LDSB0_AF0EM4_GRVW2_LBSPP128_PLR17_SU0_SUS256_SRVW0_TT1_96_WG128_2_1_WGM1
    SolutionIndex: 189
    SolutionNameMin: Cijk_Alik_Bljk_BBH_MT128x96x32_MI32x32x4x1_SE_1LDSB0_AF0EM4_GRVW2_LBSPP128_PLR9_SU32_SUS128_SRVW0_TT1_96_WG128_2_1_WGM2
    SolutionIndex: 190
    SolutionNameMin: Cijk_Alik_Bljk_BBH_MT128x96x32_MI32x32x4x1_SE_1LDSB0_AF0EM1_GRVW2_LBSPP128_PLR9_SU32_SUS128_SRVW4_TT1_96_WG128_2_1_WGM1
    SolutionIndex: 191
    SolutionNameMin: Cijk_Alik_Bljk_BBH_MT128x256x32_MI32x32x4x1_SE_1LDSB1_AF0EM8_GRVW2_GSU1_LBSPP128_LPA4_LPB4_PLR9_SU0_SUS256_SRVW4_TT2_128_WG64_4_1_WGM1
    SolutionIndex: 192
    SolutionNameMin: Cijk_Alik_Bljk_BBH_MT128x256x32_MI32x32x4x1_SE_1LDSB1_AF0EM8_GRVW2_GSU1_LBSPP128_LPA4_LPB4_PLR9_SU0_SUS256_SRVW4_TT2_128_WG64_4_1_WGM15
    SolutionIndex: 193
    SolutionNameMin: Cijk_Alik_Bljk_BBH_MT128x128x32_MI32x32x4x1_SE_1LDSB1_AF0EM8_GRVW2_GSU1_LBSPP128_LPA4_LPB4_PLR9_SU0_SUS256_SRVW4_TT2_64_WG64_4_1_WGM1
    SolutionIndex: 194
    SolutionNameMin: Cijk_Alik_Bljk_BBH_MT64x64x64_MI32x32x4x1_SE_1LDSB1_AF0EM8_GRVW8_GSU1_LBSPP128_LPA8_LPB8_PLR17_SU0_SUS256_SRVW4_TT1_32_WG64_4_1_WGM1
    SolutionIndex: 195
    SolutionNameMin: Cijk_Alik_Bljk_BBH_MT128x128x32_MI32x32x4x1_SE_1LDSB1_AF0EM8_GRVW4_GSU1_LBSPP128_LPA4_LPB4_PLR9_SU0_SUS256_SRVW4_TT2_64_WG64_4_1_WGM15
    SolutionIndex: 196
    SolutionNameMin: Cijk_Alik_Bljk_BBH_MT128x96x64_MI32x32x4x1_SE_1LDSB1_AF0EM8_GRVW8_GSU1_LBSPP128_LPA8_LPB8_PLR17_SU32_SUS256_SRVW4_TT1_96_WG128_2_1_WGM15
    SolutionIndex: 197
    SolutionNameMin: Cijk_Alik_Bljk_BBH_MT128x160x32_MI32x32x4x1_SE_1LDSB1_AF0EM8_GRVW4_GSU1_LBSPP128_LPA4_LPB4_PLR9_SU32_SUS128_SRVW4_TT1_160_WG128_2_1_WGM15
    SolutionIndex: 198
    SolutionNameMin: Cijk_Alik_Bljk_BBH_MT128x144x32_MI16x16x8x1_SE_1LDSB1_AF0EM8_GRVW2_GSU1_LBSPP128_LPA4_LPB4_PLR5_SU0_SUS256_SRVW4_TT2_144_WG64_4_1_WGM15
    SolutionIndex: 199
    SolutionNameMin: Cijk_Alik_Bljk_BBH_MT64x64x32_MI32x32x4x1_SE_1LDSB1_AF0EM8_GRVW8_GSU1_LBSPP128_LPA8_LPB8_PLR9_SU0_SUS256_SRVW4_TT1_32_WG64_4_1_WGM1
    SolutionIndex: 200
    SolutionNameMin: Cijk_Alik_Bljk_BBH_MT64x128x32_MI32x32x4x1_SE_1LDSB1_AF0EM8_GRVW8_GSU1_LBSPP128_LPA8_LPB8_PLR9_SU0_SUS256_SRVW4_TT1_64_WG64_4_1_WGM15
    SolutionIndex: 201
    SolutionNameMin: Cijk_Alik_Bljk_BBH_MT16x16x128_MI16x16x8x1_SE_1LDSB0_AF0EM8_GRVW8_GSU1_LBSPP256_LPA8_LPB8_PLR17_SU0_SUS256_SRVW0_TT1_16_WG16_4_1_WGM15
    SolutionIndex: 202
    SolutionNameMin: Cijk_Alik_Bljk_BBH_MT64x64x64_MI32x32x4x1_SE_1LDSB1_AF0EM8_GRVW4_GSU1_LBSPP128_LPA4_LPB4_PLR17_SU32_SUS256_SRVW4_TT1_32_WG64_4_1_WGM15
    SolutionIndex: 203
    SolutionNameMin: Cijk_Alik_Bljk_BBH_MT64x64x32_MI32x32x4x1_SE_1LDSB1_AF0EM8_GRVW4_GSU1_LBSPP128_LPA4_LPB4_PLR9_SU0_SUS256_SRVW4_TT1_32_WG64_4_1_WGM1
    SolutionIndex: 204
    SolutionNameMin: Cijk_Alik_Bljk_BBH_MT128x128x32_MI32x32x4x1_SE_1LDSB1_AF0EM8_GRVW8_GSU1_LBSPP128_LPA8_LPB8_PLR9_SU32_SUS128_SRVW4_TT2_64_WG64_4_1_WGM1
    SolutionIndex: 205
    SolutionNameMin: Cijk_Alik_Bljk_BBH_MT64x64x32_MI32x32x4x1_SE_1LDSB1_AF0EM8_GRVW4_GSU1_LBSPP128_LPA4_LPB4_PLR9_SU32_SUS256_SRVW4_TT1_32_WG64_4_1_WGM15
    SolutionIndex: 206
    SolutionNameMin: Cijk_Alik_Bljk_BBH_MT96x96x32_MI16x16x8x1_SE_1LDSB1_AF0EM8_GRVW2_GSU1_LBSPP128_LPA4_LPB4_PLR5_SU0_SUS256_SRVW0_TT3_48_WG32_8_1_WGM2
    SolutionIndex: 207
    SolutionNameMin: Cijk_Alik_Bljk_BBH_MT96x96x64_MI16x16x8x1_SE_1LDSB1_AF0EM8_GRVW2_GSU1_LBSPP128_LPA4_LPB4_PLR9_SU0_SUS256_SRVW0_TT3_48_WG32_8_1_WGM1
    SolutionIndex: 208
    SolutionNameMin: Cijk_Alik_Bljk_BBH_MT128x96x32_MI32x32x4x1_SE_1LDSB1_AF0EM8_GRVW2_GSU1_LBSPP128_LPA4_LPB4_PLR9_SU32_SUS256_SRVW4_TT1_96_WG128_2_1_WGM15
    SolutionIndex: 209
    SolutionNameMin: Cijk_Alik_Bljk_BBH_MT64x128x32_MI32x32x4x1_SE_1LDSB1_AF0EM8_GRVW4_GSU1_LBSPP128_LPA4_LPB4_PLR9_SU0_SUS256_SRVW4_TT1_64_WG64_4_1_WGM2
    SolutionIndex: 210
    SolutionNameMin: Cijk_Alik_Bljk_BBH_MT64x64x64_MI32x32x4x1_SE_1LDSB1_AF0EM8_GRVW4_GSU1_LBSPP128_LPA4_LPB4_PLR17_SU0_SUS256_SRVW4_TT1_32_WG64_4_1_WGM15
    SolutionIndex: 211
    SolutionNameMin: Cijk_Alik_Bljk_BBH_MT64x128x32_MI32x32x4x1_SE_1LDSB1_AF0EM8_GRVW8_GSU1_LBSPP128_LPA8_LPB8_PLR9_SU32_SUS256_SRVW4_TT1_64_WG64_4_1_WGM2
    SolutionIndex: 212
    SolutionNameMin: Cijk_Alik_Bljk_BBH_MT64x128x32_MI32x32x4x1_SE_1LDSB1_AF0EM8_GRVW8_GSU1_LBSPP128_LPA8_LPB8_PLR9_SU0_SUS256_SRVW4_TT1_64_WG64_4_1_WGM1
    SolutionIndex: 213
    SolutionNameMin: Cijk_Alik_Bljk_BBH_MT96x96x64_MI16x16x8x1_SE_1LDSB1_AF0EM8_GRVW2_GSU1_LBSPP128_LPA4_LPB4_PLR9_SU32_SUS128_SRVW0_TT3_48_WG32_8_1_WGM15
    SolutionIndex: 214
    SolutionNameMin: Cijk_Alik_Bljk_BBH_MT128x128x32_MI32x32x4x1_SE_1LDSB1_AF0EM8_GRVW8_GSU1_LBSPP128_LPA8_LPB8_PLR9_SU0_SUS256_SRVW4_TT2_64_WG64_4_1_WGM15
    SolutionIndex: 215
    SolutionNameMin: Cijk_Alik_Bljk_BBH_MT64x64x32_MI32x32x4x1_SE_1LDSB1_AF0EM8_GRVW2_GSU1_LBSPP128_LPA4_LPB4_PLR9_SU0_SUS256_SRVW4_TT1_32_WG64_4_1_WGM1
    SolutionIndex: 216
    SolutionNameMin: Cijk_Alik_Bljk_BBH_MT128x128x32_MI32x32x4x1_SE_1LDSB1_AF0EM8_GRVW2_GSU1_LBSPP128_LPA4_LPB4_PLR9_SU0_SUS256_SRVW4_TT2_64_WG64_4_1_WGM15
    SolutionIndex: 217
    SolutionNameMin: Cijk_Alik_Bljk_BBH_MT64x128x32_MI32x32x4x1_SE_1LDSB1_AF0EM8_GRVW4_GSU1_LBSPP128_LPA4_LPB4_PLR9_SU0_SUS256_SRVW4_TT1_64_WG64_4_1_WGM1
    SolutionIndex: 218
    SolutionNameMin: Cijk_Alik_Bljk_BBH_MT64x128x64_MI32x32x4x1_SE_1LDSB1_AF0EM8_GRVW8_GSU1_LBSPP128_LPA8_LPB8_PLR17_SU0_SUS256_SRVW4_TT1_64_WG64_4_1_WGM15
    SolutionIndex: 219
    SolutionNameMin: Cijk_Alik_Bljk_BBH_MT64x128x32_MI32x32x4x1_SE_1LDSB1_AF0EM8_GRVW8_GSU1_LBSPP128_LPA8_LPB8_PLR9_SU32_SUS256_SRVW4_TT1_64_WG64_4_1_WGM15
    SolutionIndex: 220
    SolutionNameMin: Cijk_Alik_Bljk_BBH_MT96x96x32_MI16x16x8x1_SE_1LDSB1_AF0EM8_GRVW2_GSU1_LBSPP128_LPA4_LPB4_PLR5_SU0_SUS256_SRVW0_TT3_48_WG32_8_1_WGM15
    SolutionIndex: 221
    SolutionNameMin: Cijk_Alik_Bljk_BBH_MT96x96x64_MI16x16x8x1_SE_1LDSB1_AF0EM8_GRVW2_GSU1_LBSPP128_LPA4_LPB4_PLR9_SU0_SUS256_SRVW0_TT3_48_WG32_8_1_WGM15
    SolutionIndex: 222
    SolutionNameMin: Cijk_Alik_Bljk_BBH_MT64x64x32_MI32x32x4x1_SE_1LDSB1_AF0EM8_GRVW8_GSU1_LBSPP128_LPA8_LPB8_PLR9_SU32_SUS256_SRVW4_TT1_32_WG64_4_1_WGM15
    SolutionIndex: 223
    SolutionNameMin: Cijk_Alik_Bljk_BBH_MT64x128x32_MI32x32x4x1_SE_1LDSB1_AF0EM8_GRVW8_GSU1_LBSPP128_LPA8_LPB8_PLR9_SU32_SUS128_SRVW4_TT1_64_WG64_4_1_WGM15
    SolutionIndex: 224
    SolutionNameMin: Cijk_Alik_Bljk_BBH_MT64x64x64_MI32x32x4x1_SE_1LDSB1_AF0EM8_GRVW4_GSU1_LBSPP128_LPA4_LPB4_PLR17_SU0_SUS256_SRVW4_TT1_32_WG64_4_1_WGM1
    SolutionIndex: 225
    SolutionNameMin: Cijk_Alik_Bljk_BBH_MT128x64x32_MI32x32x4x1_SE_1LDSB1_AF0EM8_GRVW8_GSU1_LBSPP128_LPA8_LPB8_PLR9_SU0_SUS256_SRVW4_TT2_32_WG64_4_1_WGM15
    SolutionIndex: 226
    SolutionNameMin: Cijk_Alik_Bljk_BBH_MT128x128x32_MI32x32x4x1_SE_1LDSB1_AF0EM8_GRVW8_GSU1_LBSPP128_LPA8_LPB8_PLR9_SU0_SUS256_SRVW4_TT2_64_WG64_4_1_WGM2
    SolutionIndex: 227
    SolutionNameMin: Cijk_Alik_Bljk_BBH_MT128x160x32_MI32x32x4x1_SE_1LDSB1_AF0EM8_GRVW2_GSU1_LBSPP128_LPA4_LPB4_PLR9_SU32_SUS128_SRVW4_TT1_160_WG128_2_1_WGM15
    SolutionIndex: 228
    SolutionNameMin: Cijk_Alik_Bljk_BBH_MT128x96x32_MI32x32x4x1_SE_1LDSB1_AF0EM8_GRVW2_GSU1_LBSPP128_LPA4_LPB4_PLR9_SU32_SUS128_SRVW4_TT1_96_WG128_2_1_WGM15
    SolutionIndex: 229
    SolutionNameMin: Cijk_Alik_Bljk_BBH_MT16x16x64_MI16x16x8x1_SE_1LDSB1_AF0EM8_GRVW4_GSU1_LBSPP128_LPA4_LPB4_PLR9_SU0_SUS256_SRVW0_TT1_16_WG16_4_1_WGM1
    SolutionIndex: 230
    SolutionNameMin: Cijk_Alik_Bljk_BBH_MT128x96x64_MI32x32x4x1_SE_1LDSB1_AF0EM8_GRVW2_GSU1_LBSPP128_LPA4_LPB4_PLR17_SU0_SUS256_SRVW4_TT1_96_WG128_2_1_WGM2
    SolutionIndex: 231
    SolutionNameMin: Cijk_Alik_Bljk_BBH_MT128x96x64_MI32x32x4x1_SE_1LDSB1_AF0EM8_GRVW2_GSU1_LBSPP128_LPA4_LPB4_PLR17_SU32_SUS256_SRVW4_TT1_96_WG128_2_1_WGM15
    SolutionIndex: 232
    SolutionNameMin: Cijk_Alik_Bljk_BBH_MT128x160x32_MI32x32x4x1_SE_1LDSB1_AF0EM8_GRVW2_GSU1_LBSPP128_LPA4_LPB4_PLR9_SU0_SUS256_SRVW4_TT1_160_WG128_2_1_WGM15
    SolutionIndex: 233
    SolutionNameMin: Cijk_Alik_Bljk_BBH_MT128x96x32_MI32x32x4x1_SE_1LDSB1_AF0EM8_GRVW2_GSU1_LBSPP128_LPA4_LPB4_PLR9_SU0_SUS256_SRVW4_TT1_96_WG128_2_1_WGM15
    SolutionIndex: 234
    SolutionNameMin: Cijk_Alik_Bljk_BBH_MT128x96x32_MI32x32x4x1_SE_1LDSB1_AF0EM8_GRVW4_GSU1_LBSPP128_LPA4_LPB4_PLR9_SU32_SUS128_SRVW4_TT1_96_WG128_2_1_WGM15
    SolutionIndex: 235
    SolutionNameMin: Cijk_Alik_Bljk_BBH_MT128x96x64_MI32x32x4x1_SE_1LDSB1_AF0EM8_GRVW2_GSU1_LBSPP128_LPA4_LPB4_PLR17_SU0_SUS256_SRVW4_TT1_96_WG128_2_1_WGM15
    SolutionIndex: 236
    SolutionNameMin: Cijk_Alik_Bljk_BBH_MT128x96x32_MI32x32x4x1_SE_1LDSB1_AF0EM8_GRVW4_GSU1_LBSPP128_LPA4_LPB4_PLR9_SU0_SUS256_SRVW4_TT1_96_WG128_2_1_WGM2
    SolutionIndex: 237
    SolutionNameMin: Cijk_Alik_Bljk_BBH_MT128x64x32_MI32x32x4x1_SE_1LDSB1_AF0EM8_GRVW8_GSU1_LBSPP128_LPA8_LPB8_PLR9_SU32_SUS128_SRVW4_TT2_32_WG64_4_1_WGM15
    SolutionIndex: 238
    SolutionNameMin: Cijk_Alik_Bljk_BBH_MT128x64x64_MI32x32x4x1_SE_1LDSB1_AF0EM8_GRVW8_GSU1_LBSPP128_LPA8_LPB8_PLR17_SU32_SUS256_SRVW4_TT2_32_WG64_4_1_WGM15
    SolutionIndex: 239
    SolutionNameMin: Cijk_Alik_Bljk_BBH_MT128x96x64_MI32x32x4x1_SE_1LDSB1_AF0EM8_GRVW2_GSU1_LBSPP128_LPA4_LPB4_PLR17_SU32_SUS256_SRVW4_TT1_96_WG128_2_1_WGM2
    SolutionIndex: 240
    SolutionNameMin: Cijk_Alik_Bljk_BBH_MT128x64x32_MI32x32x4x1_SE_1LDSB1_AF0EM8_GRVW4_GSU1_LBSPP128_LPA4_LPB4_PLR9_SU0_SUS256_SRVW4_TT2_32_WG64_4_1_WGM15
    SolutionIndex: 241
    SolutionNameMin: Cijk_Alik_Bljk_BBH_MT128x64x64_MI32x32x4x1_SE_1LDSB1_AF0EM8_GRVW8_GSU1_LBSPP128_LPA8_LPB8_PLR17_SU0_SUS256_SRVW4_TT2_32_WG64_4_1_WGM15
    SolutionIndex: 242
    SolutionNameMin: Cijk_Alik_Bljk_BBH_MT32x32x64_MI16x16x8x1_SE_1LDSB1_AF0EM8_GRVW4_GSU1_LBSPP128_LPA4_LPB4_PLR9_SU0_SUS256_SRVW4_TT1_16_WG32_8_1_WGM1
    SolutionIndex: 243
    SolutionNameMin: Cijk_Alik_Bljk_BBH_MT32x64x32_MI16x16x8x1_SE_1LDSB1_AF0EM8_GRVW4_GSU1_LBSPP128_LPA4_LPB4_PLR5_SU0_SUS256_SRVW4_TT1_32_WG32_8_1_WGM2
    SolutionIndex: 244
    SolutionNameMin: Cijk_Alik_Bljk_BBH_MT32x64x32_MI16x16x8x1_SE_1LDSB1_AF0EM8_GRVW8_GSU1_LBSPP128_LPA8_LPB8_PLR5_SU32_SUS128_SRVW4_TT1_32_WG32_8_1_WGM1
    SolutionIndex: 245
    SolutionNameMin: Cijk_Alik_Bljk_BBH_MT32x64x32_MI16x16x8x1_SE_1LDSB1_AF0EM8_GRVW2_GSU1_LBSPP128_LPA4_LPB4_PLR5_SU0_SUS256_SRVW4_TT1_32_WG32_8_1_WGM15
    SolutionIndex: 246
    SolutionNameMin: Cijk_Alik_Bljk_BBH_MT32x32x64_MI16x16x8x1_SE_1LDSB0_AF0EM8_GRVW2_GSU15_LBSPP128_LPA4_LPB4_PLR9_SU0_SUS256_SRVW0_TT1_16_WG32_8_1_WGM1
    SolutionIndex: 247
    SolutionNameMin: Cijk_Alik_Bljk_BBH_MT16x16x128_MI16x16x8x1_SE_1LDSB1_AF0EM8_GRVW8_GSU1_LBSPP256_LPA8_LPB8_PLR17_SU32_SUS256_SRVW0_TT1_16_WG16_4_1_WGM15
    SolutionIndex: 248
    SolutionNameMin: Cijk_Alik_Bljk_BBH_MT32x32x32_MI16x16x8x1_SE_1LDSB0_AF0EM8_GRVW8_GSU15_LBSPP128_LPA8_LPB8_PLR5_SU0_SUS256_SRVW0_TT1_16_WG32_8_1_WGM1
    SolutionIndex: 249
    SolutionNameMin: Cijk_Alik_Bljk_BBH_MT64x64x64_MI32x32x4x1_SE_1LDSB1_AF0EM8_GRVW8_GSU1_LBSPP128_LPA8_LPB8_PLR17_SU0_SUS256_SRVW4_TT1_32_WG64_4_1_WGM15
    SolutionIndex: 250
    SolutionNameMin: Cijk_Alik_Bljk_BBH_MT128x96x64_MI32x32x4x1_SE_1LDSB1_AF0EM8_GRVW4_GSU1_LBSPP128_LPA4_LPB4_PLR17_SU0_SUS256_SRVW4_TT1_96_WG128_2_1_WGM2
    SolutionIndex: 251
    SolutionNameMin: Cijk_Alik_Bljk_BBH_MT128x144x32_MI16x16x8x1_SE_1LDSB1_AF0EM8_GRVW2_GSU1_LBSPP128_LPA4_LPB4_PLR5_SU0_SUS256_SRVW4_TT2_144_WG64_4_1_WGM2
    SolutionIndex: 252
    SolutionNameMin: Cijk_Alik_Bljk_BBH_MT128x96x64_MI32x32x4x1_SE_1LDSB1_AF0EM8_GRVW2_GSU1_LBSPP128_LPA4_LPB4_PLR17_SU0_SUS256_SRVW4_TT1_96_WG128_2_1_WGM1
    SolutionIndex: 253
    SolutionNameMin: Cijk_Alik_Bljk_BBH_MT16x16x64_MI16x16x8x1_SE_1LDSB0_AF0EM1_GRVW8_GSU7_LBSPP128_LPA8_LPB8_PLR9_SU0_SUS256_SRVW0_TT1_16_WG16_4_1_WGM1
    SolutionIndex: 254
    SolutionNameMin: Cijk_Alik_Bljk_BBH_MT64x128x32_MI32x32x4x1_SE_1LDSB1_AF0EM8_GRVW8_GSU1_LBSPP128_LPA8_LPB8_PLR9_SU32_SUS128_SRVW4_TT1_64_WG64_4_1_WGM1
    SolutionIndex: 255
    SolutionNameMin: Cijk_Alik_Bljk_BBH_MT64x128x32_MI32x32x4x1_SE_1LDSB1_AF0EM8_GRVW8_GSU1_LBSPP128_LPA8_LPB8_PLR9_SU32_SUS256_SRVW4_TT1_64_WG64_4_1_WGM1
    SolutionIndex: 256
    SolutionNameMin: Cijk_Alik_Bljk_BBH_MT32x32x64_MI16x16x8x1_SE_1LDSB1_AF0EM8_GRVW4_GSU1_LBSPP128_LPA4_LPB4_PLR9_SU0_SUS256_SRVW4_TT1_16_WG32_8_1_WGM15
    SolutionIndex: 257
    SolutionNameMin: Cijk_Alik_Bljk_BBH_MT64x64x64_MI32x32x4x1_SE_1LDSB1_AF0EM8_GRVW8_GSU1_LBSPP128_LPA8_LPB8_PLR17_SU0_SUS256_SRVW4_TT1_32_WG64_4_1_WGM2
    SolutionIndex: 258
    SolutionNameMin: Cijk_Alik_Bljk_BBH_MT64x64x32_MI32x32x4x1_SE_1LDSB1_AF0EM8_GRVW2_GSU1_LBSPP128_LPA4_LPB4_PLR9_SU0_SUS256_SRVW4_TT1_32_WG64_4_1_WGM15
    SolutionIndex: 259
    SolutionNameMin: Cijk_Alik_Bljk_BBH_MT128x64x64_MI32x32x4x1_SE_1LDSB1_AF0EM8_GRVW8_GSU1_LBSPP128_LPA8_LPB8_PLR17_SU32_SUS256_SRVW4_TT2_32_WG64_4_1_WGM2
    SolutionIndex: 260
    SolutionNameMin: Cijk_Alik_Bljk_BBH_MT64x64x64_MI32x32x4x1_SE_1LDSB1_AF0EM8_GRVW8_GSU1_LBSPP128_LPA8_LPB8_PLR17_SU32_SUS128_SRVW4_TT1_32_WG64_4_1_WGM2
    SolutionIndex: 261
    SolutionNameMin: Cijk_Alik_Bljk_BBH_MT128x96x32_MI32x32x4x1_SE_1LDSB1_AF0EM8_GRVW2_GSU1_LBSPP128_LPA4_LPB4_PLR9_SU32_SUS256_SRVW4_TT1_96_WG128_2_1_WGM2
    SolutionIndex: 262
    SolutionNameMin: Cijk_Alik_Bljk_BBH_MT144x128x32_MI16x16x8x1_SE_1LDSB0_AF0EM8_GRVW2_GSU1_LBSPP128_LPA4_LPB4_PLR5_SU0_SUS256_SRVW0_TT9_32_WG16_16_1_WGM1
    SolutionIndex: 263
    SolutionNameMin: Cijk_Alik_Bljk_BBH_MT128x128x32_MI32x32x4x1_SE_1LDSB1_AF0EM8_GRVW8_GSU1_LBSPP128_LPA8_LPB8_PLR9_SU32_SUS256_SRVW4_TT2_64_WG64_4_1_WGM15
    SolutionIndex: 264
    SolutionNameMin: Cijk_Alik_Bljk_BBH_MT144x128x32_MI16x16x8x1_SE_1LDSB1_AF0EM8_GRVW2_GSU1_LBSPP128_LPA4_LPB4_PLR5_SU0_SUS256_SRVW0_TT9_32_WG16_16_1_WGM1
    SolutionIndex: 265
    SolutionNameMin: Cijk_Alik_Bljk_BBH_MT64x128x64_MI32x32x4x1_SE_1LDSB1_AF0EM8_GRVW8_GSU1_LBSPP128_LPA8_LPB8_PLR17_SU32_SUS128_SRVW4_TT1_64_WG64_4_1_WGM1
    SolutionIndex: 266
    SolutionNameMin: Cijk_Alik_Bljk_BBH_MT64x128x32_MI32x32x4x1_SE_1LDSB1_AF0EM8_GRVW2_GSU1_LBSPP128_LPA4_LPB4_PLR9_SU32_SUS128_SRVW4_TT1_64_WG64_4_1_WGM1
    SolutionIndex: 267
    SolutionNameMin: Cijk_Alik_Bljk_BBH_MT96x96x64_MI16x16x8x1_SE_1LDSB1_AF0EM8_GRVW2_GSU1_LBSPP128_LPA4_LPB4_PLR9_SU32_SUS256_SRVW0_TT3_48_WG32_8_1_WGM1
    SolutionIndex: 268
    SolutionNameMin: Cijk_Alik_Bljk_BBH_MT64x128x32_MI32x32x4x1_SE_1LDSB1_AF0EM8_GRVW8_GSU1_LBSPP128_LPA8_LPB8_PLR9_SU0_SUS256_SRVW4_TT1_64_WG64_4_1_WGM2
    SolutionIndex: 269
    SolutionNameMin: Cijk_Alik_Bljk_BBH_MT16x16x128_MI16x16x8x1_SE_1LDSB0_AF0EM8_GRVW8_GSU1_LBSPP256_LPA8_LPB8_PLR17_SU0_SUS256_SRVW4_TT1_16_WG16_4_1_WGM1
    SolutionIndex: 270
    SolutionNameMin: Cijk_Alik_Bljk_BBH_MT128x128x32_MI32x32x4x1_SE_1LDSB1_AF0EM8_GRVW8_GSU1_LBSPP128_LPA8_LPB8_PLR9_SU0_SUS256_SRVW4_TT2_64_WG64_4_1_WGM1
    SolutionIndex: 271
    SolutionNameMin: Cijk_Alik_Bljk_BBH_MT128x64x64_MI32x32x4x1_SE_1LDSB1_AF0EM8_GRVW8_GSU1_LBSPP128_LPA8_LPB8_PLR17_SU0_SUS256_SRVW4_TT2_32_WG64_4_1_WGM1
    SolutionIndex: 272
    SolutionNameMin: Cijk_Alik_Bljk_BBH_MT96x96x64_MI16x16x8x1_SE_1LDSB1_AF0EM8_GRVW8_GSU1_LBSPP128_LPA8_LPB8_PLR9_SU32_SUS256_SRVW0_TT3_48_WG32_8_1_WGM15
    SolutionIndex: 273
    SolutionNameMin: Cijk_Alik_Bljk_BBH_MT128x64x32_MI32x32x4x1_SE_1LDSB1_AF0EM8_GRVW8_GSU1_LBSPP128_LPA8_LPB8_PLR9_SU0_SUS256_SRVW4_TT2_32_WG64_4_1_WGM1
    SolutionIndex: 274
    SolutionNameMin: Cijk_Alik_Bljk_BBH_MT128x64x64_MI32x32x4x1_SE_1LDSB1_AF0EM8_GRVW8_GSU1_LBSPP128_LPA8_LPB8_PLR17_SU0_SUS256_SRVW4_TT2_32_WG64_4_1_WGM2
    SolutionIndex: 275
    SolutionNameMin: Cijk_Alik_Bljk_BBH_MT96x96x64_MI16x16x8x1_SE_1LDSB1_AF0EM8_GRVW8_GSU1_LBSPP128_LPA8_LPB8_PLR9_SU0_SUS256_SRVW0_TT3_48_WG32_8_1_WGM15
    SolutionIndex: 276
    SolutionNameMin: Cijk_Alik_Bljk_BBH_MT128x96x32_MI32x32x4x1_SE_1LDSB1_AF0EM8_GRVW4_GSU1_LBSPP128_LPA4_LPB4_PLR9_SU32_SUS128_SRVW4_TT1_96_WG128_2_1_WGM1
    SolutionIndex: 277
    SolutionNameMin: Cijk_Alik_Bljk_BBH_MT64x64x64_MI32x32x4x1_SE_1LDSB1_AF0EM8_GRVW8_GSU1_LBSPP128_LPA8_LPB8_PLR17_SU32_SUS128_SRVW4_TT1_32_WG64_4_1_WGM15
    SolutionIndex: 278
    SolutionNameMin: Cijk_Alik_Bljk_BBH_MT128x128x32_MI32x32x4x1_SE_1LDSB1_AF0EM8_GRVW8_GSU1_LBSPP128_LPA8_LPB8_PLR9_SU32_SUS256_SRVW4_TT2_64_WG64_4_1_WGM1
    SolutionIndex: 279
    SolutionNameMin: Cijk_Alik_Bljk_BBH_MT64x128x64_MI32x32x4x1_SE_1LDSB1_AF0EM8_GRVW8_GSU1_LBSPP128_LPA8_LPB8_PLR17_SU32_SUS256_SRVW4_TT1_64_WG64_4_1_WGM1
    SolutionIndex: 280
    SolutionNameMin: Cijk_Alik_Bljk_BBH_MT32x32x64_MI16x16x8x1_SE_1LDSB1_AF0EM8_GRVW8_GSU1_LBSPP128_LPA8_LPB8_PLR9_SU32_SUS128_SRVW4_TT1_16_WG32_8_1_WGM2
    SolutionIndex: 281
    SolutionNameMin: Cijk_Alik_Bljk_BBH_MT64x64x32_MI32x32x4x1_SE_1LDSB1_AF0EM8_GRVW8_GSU1_LBSPP128_LPA8_LPB8_PLR9_SU0_SUS256_SRVW4_TT1_32_WG64_4_1_WGM2
    SolutionIndex: 282
    SolutionNameMin: Cijk_Alik_Bljk_BBH_MT64x128x64_MI32x32x4x1_SE_1LDSB1_AF0EM8_GRVW8_GSU1_LBSPP128_LPA8_LPB8_PLR17_SU0_SUS256_SRVW4_TT1_64_WG64_4_1_WGM1
    SolutionIndex: 283
    SolutionNameMin: Cijk_Alik_Bljk_BBH_MT64x64x32_MI32x32x4x1_SE_1LDSB1_AF0EM8_GRVW8_GSU1_LBSPP128_LPA8_LPB8_PLR9_SU32_SUS128_SRVW4_TT1_32_WG64_4_1_WGM15
    SolutionIndex: 284
    SolutionNameMin: Cijk_Alik_Bljk_BBH_MT128x96x32_MI32x32x4x1_SE_1LDSB1_AF0EM8_GRVW2_GSU1_LBSPP128_LPA4_LPB4_PLR9_SU0_SUS256_SRVW4_TT1_96_WG128_2_1_WGM1
    SolutionIndex: 285
    SolutionNameMin: Cijk_Alik_Bljk_BBH_MT64x64x32_MI32x32x4x1_SE_1LDSB0_AF0EM8_GRVW8_GSU1_LBSPP128_LPA8_LPB8_PLR9_SU32_SUS256_SRVW4_TT1_32_WG64_4_1_WGM15
    SolutionIndex: 286
    SolutionNameMin: Cijk_Alik_Bljk_BBH_MT32x32x64_MI16x16x8x1_SE_1LDSB1_AF0EM8_GRVW8_GSU1_LBSPP128_LPA8_LPB8_PLR9_SU0_SUS256_SRVW4_TT1_16_WG32_8_1_WGM2
    SolutionIndex: 287
    SolutionNameMin: Cijk_Alik_Bljk_BBH_MT128x96x32_MI32x32x4x1_SE_1LDSB1_AF0EM8_GRVW4_GSU1_LBSPP128_LPA4_LPB4_PLR9_SU32_SUS128_SRVW4_TT1_96_WG128_2_1_WGM2
    SolutionIndex: 288
    SolutionNameMin: Cijk_Alik_Bljk_BBH_MT64x64x32_MI32x32x4x1_SE_1LDSB0_AF0EM8_GRVW8_GSU1_LBSPP128_LPA8_LPB8_PLR9_SU0_SUS256_SRVW4_TT1_32_WG64_4_1_WGM15
    SolutionIndex: 289
    SolutionNameMin: Cijk_Alik_Bljk_BBH_MT32x32x64_MI16x16x8x1_SE_1LDSB0_AF0EM8_GRVW8_GSU1_LBSPP128_LPA8_LPB8_PLR9_SU0_SUS256_SRVW4_TT1_16_WG32_8_1_WGM15
    SolutionIndex: 290
    SolutionNameMin: Cijk_Alik_Bljk_BBH_MT64x64x32_MI32x32x4x1_SE_1LDSB1_AF0EM8_GRVW8_GSU1_LBSPP128_LPA8_LPB8_PLR9_SU0_SUS256_SRVW4_TT1_32_WG64_4_1_WGM15
    SolutionIndex: 291
    SolutionNameMin: Cijk_Alik_Bljk_BBH_MT16x16x128_MI16x16x8x1_SE_1LDSB1_AF0EM8_GRVW8_GSU1_LBSPP256_LPA8_LPB8_PLR17_SU0_SUS256_SRVW0_TT1_16_WG16_4_1_WGM1
    SolutionIndex: 292
    SolutionNameMin: Cijk_Alik_Bljk_BBH_MT16x16x128_MI16x16x8x1_SE_1LDSB1_AF0EM8_GRVW8_GSU1_LBSPP256_LPA8_LPB8_PLR17_SU0_SUS256_SRVW0_TT1_16_WG16_4_1_WGM15
    SolutionIndex: 293
    SolutionNameMin: Cijk_Alik_Bljk_BBH_MT128x64x32_MI32x32x4x1_SE_1LDSB0_AF0EM8_GRVW8_GSU1_LBSPP128_LPA8_LPB8_PLR9_SU0_SUS256_SRVW4_TT2_32_WG64_4_1_WGM15
    SolutionIndex: 294
    SolutionNameMin: Cijk_Alik_Bljk_BBH_MT32x32x32_MI16x16x8x1_SE_1LDSB0_AF0EM8_GRVW4_GSU1_LBSPP128_LPA4_LPB4_PLR5_SU0_SUS256_SRVW4_TT1_16_WG32_8_1_WGM1
    SolutionIndex: 295
    SolutionNameMin: Cijk_Alik_Bljk_BBH_MT16x16x64_MI16x16x8x1_SE_1LDSB0_AF0EM8_GRVW8_GSU1_LBSPP128_LPA8_LPB8_PLR9_SU32_SUS128_SRVW4_TT1_16_WG16_4_1_WGM1
    SolutionIndex: 296
    SolutionNameMin: Cijk_Alik_Bljk_BBH_MT16x16x128_MI16x16x8x1_SE_1LDSB0_AF0EM8_GRVW8_GSU1_LBSPP256_LPA8_LPB8_PLR17_SU0_SUS256_SRVW0_TT1_16_WG16_4_1_WGM1
    SolutionIndex: 297
    SolutionNameMin: Cijk_Alik_Bljk_BBH_MT128x160x32_MI32x32x4x1_SE_1LDSB1_AF0EM8_GRVW2_GSU1_LBSPP128_LPA4_LPB4_PLR9_SU32_SUS128_SRVW4_TT1_160_WG128_2_1_WGM2
    SolutionIndex: 298
    SolutionNameMin: Cijk_Alik_Bljk_BBH_MT32x32x64_MI16x16x8x1_SE_1LDSB0_AF0EM8_GRVW8_GSU1_LBSPP128_LPA8_LPB8_PLR9_SU32_SUS128_SRVW4_TT1_16_WG32_8_1_WGM2
    SolutionIndex: 299
    SolutionNameMin: Cijk_Alik_Bljk_BBH_MT64x128x32_MI32x32x4x1_SE_1LDSB1_AF0EM8_GRVW2_GSU1_LBSPP128_LPA4_LPB4_PLR9_SU0_SUS256_SRVW4_TT1_64_WG64_4_1_WGM15
    SolutionIndex: 300
    SolutionNameMin: Cijk_Alik_Bljk_BBH_MT16x16x128_MI16x16x8x1_SE_1LDSB1_AF0EM8_GRVW8_GSU1_LBSPP256_LPA8_LPB8_PLR17_SU32_SUS256_SRVW0_TT1_16_WG16_4_1_WGM1
    SolutionIndex: 301
    SolutionNameMin: Cijk_Alik_Bljk_BBH_MT128x128x32_MI32x32x4x1_SE_1LDSB1_AF0EM1_GRVW8_GSU1_LBSPP128_LPA8_LPB8_PLR9_SU32_SUS128_SRVW4_TT2_64_WG64_4_1_WGM15
    SolutionIndex: 302
    SolutionNameMin: Cijk_Alik_Bljk_BBH_MT32x32x64_MI16x16x8x1_SE_1LDSB0_AF0EM1_GRVW8_GSU15_LBSPP128_LPA8_LPB8_PLR9_SU0_SUS256_SRVW0_TT1_16_WG32_8_1_WGM1
    SolutionIndex: 303
    SolutionNameMin: Cijk_Alik_Bljk_BBH_MT128x160x32_MI32x32x4x1_SE_1LDSB1_AF0EM1_GRVW4_GSU1_LBSPP128_LPA4_LPB4_PLR9_SU32_SUS128_SRVW4_TT1_160_WG128_2_1_WGM2
    SolutionIndex: 304
    SolutionNameMin: Cijk_Alik_Bljk_BBH_MT128x128x32_MI32x32x4x1_SE_1LDSB1_AF0EM1_GRVW8_GSU1_LBSPP128_LPA8_LPB8_PLR9_SU32_SUS128_SRVW4_TT2_64_WG64_4_1_WGM1
    SolutionIndex: 305
    SolutionNameMin: Cijk_Alik_Bljk_BBH_MT32x32x64_MI16x16x8x1_SE_1LDSB0_AF0EM1_GRVW2_GSU15_LBSPP128_LPA4_LPB4_PLR9_SU0_SUS256_SRVW0_TT1_16_WG32_8_1_WGM1
    SolutionIndex: 306
    SolutionNameMin: Cijk_Alik_Bljk_BBH_MT128x160x32_MI32x32x4x1_SE_1LDSB1_AF0EM1_GRVW2_GSU1_LBSPP128_LPA4_LPB4_PLR9_SU0_SUS256_SRVW4_TT1_160_WG128_2_1_WGM15
    SolutionIndex: 307
    SolutionNameMin: Cijk_Alik_Bljk_BBH_MT128x64x64_MI32x32x4x1_SE_1LDSB1_AF0EM1_GRVW8_GSU1_LBSPP128_LPA8_LPB8_PLR17_SU32_SUS128_SRVW4_TT2_32_WG64_4_1_WGM15
    SolutionIndex: 308
    SolutionNameMin: Cijk_Alik_Bljk_BBH_MT32x32x64_MI16x16x8x1_SE_1LDSB0_AF0EM1_GRVW8_GSU7_LBSPP128_LPA8_LPB8_PLR9_SU0_SUS256_SRVW0_TT1_16_WG32_8_1_WGM1
    SolutionIndex: 309
    SolutionNameMin: Cijk_Alik_Bljk_BBH_MT128x160x32_MI32x32x4x1_SE_1LDSB1_AF0EM1_GRVW2_GSU1_LBSPP128_LPA4_LPB4_PLR9_SU0_SUS256_SRVW4_TT1_160_WG128_2_1_WGM2
    SolutionIndex: 310
    SolutionNameMin: Cijk_Alik_Bljk_BBH_MT128x144x32_MI16x16x8x1_SE_1LDSB1_AF0EM1_GRVW2_GSU1_LBSPP128_LPA4_LPB4_PLR5_SU0_SUS256_SRVW4_TT2_144_WG64_4_1_WGM15
    SolutionIndex: 311
    SolutionNameMin: Cijk_Alik_Bljk_BBH_MT128x96x32_MI32x32x4x1_SE_1LDSB1_AF0EM1_GRVW2_GSU1_LBSPP128_LPA4_LPB4_PLR9_SU32_SUS128_SRVW4_TT1_96_WG128_2_1_WGM15
    SolutionIndex: 312
    SolutionNameMin: Cijk_Alik_Bljk_BBH_MT128x96x64_MI32x32x4x1_SE_1LDSB1_AF0EM1_GRVW8_GSU1_LBSPP128_LPA8_LPB8_PLR17_SU32_SUS128_SRVW4_TT1_96_WG128_2_1_WGM15
    SolutionIndex: 313
    SolutionNameMin: Cijk_Alik_Bljk_BBH_MT16x16x64_MI16x16x8x1_SE_1LDSB1_AF0EM1_GRVW8_GSU1_LBSPP128_LPA8_LPB8_PLR9_SU0_SUS256_SRVW0_TT1_16_WG16_4_1_WGM1
    SolutionIndex: 314
    SolutionNameMin: Cijk_Alik_Bljk_BBH_MT16x16x64_MI16x16x8x1_SE_1LDSB1_AF0EM1_GRVW4_GSU1_LBSPP128_LPA4_LPB4_PLR9_SU0_SUS256_SRVW0_TT1_16_WG16_4_1_WGM1
    SolutionIndex: 315
    SolutionNameMin: Cijk_Alik_Bljk_BBH_MT16x16x64_MI16x16x8x1_SE_1LDSB1_AF0EM1_GRVW4_GSU1_LBSPP128_LPA4_LPB4_PLR9_SU0_SUS256_SRVW0_TT1_16_WG16_4_1_WGM15
    SolutionIndex: 316
    SolutionNameMin: Cijk_Alik_Bljk_BBH_MT16x16x64_MI16x16x8x1_SE_1LDSB1_AF0EM1_GRVW8_GSU1_LBSPP128_LPA8_LPB8_PLR9_SU0_SUS256_SRVW0_TT1_16_WG16_4_1_WGM15
    SolutionIndex: 317
    SolutionNameMin: Cijk_Alik_Bljk_BBH_MT32x32x64_MI16x16x8x1_SE_1LDSB1_AF0EM1_GRVW8_GSU1_LBSPP128_LPA8_LPB8_PLR9_SU0_SUS256_SRVW4_TT1_16_WG32_8_1_WGM1
    SolutionIndex: 318
    SolutionNameMin: Cijk_Alik_Bljk_BBH_MT32x32x64_MI16x16x8x1_SE_1LDSB1_AF0EM1_GRVW4_GSU1_LBSPP128_LPA4_LPB4_PLR9_SU0_SUS256_SRVW4_TT1_16_WG32_8_1_WGM2
    SolutionIndex: 319
    SolutionNameMin: Cijk_Alik_Bljk_BBH_MT32x32x64_MI16x16x8x1_SE_1LDSB1_AF0EM1_GRVW4_GSU1_LBSPP128_LPA4_LPB4_PLR9_SU0_SUS256_SRVW4_TT1_16_WG32_8_1_WGM1
    SolutionIndex: 320
    SolutionNameMin: Cijk_Alik_Bljk_BBH_MT32x32x64_MI16x16x8x1_SE_1LDSB1_AF0EM1_GRVW4_GSU1_LBSPP128_LPA4_LPB4_PLR9_SU0_SUS256_SRVW4_TT1_16_WG32_8_1_WGM15
    SolutionIndex: 321
    SolutionNameMin: Cijk_Alik_Bljk_BBH_MT32x32x64_MI16x16x8x1_SE_1LDSB1_AF0EM1_GRVW2_GSU1_LBSPP128_LPA4_LPB4_PLR9_SU0_SUS256_SRVW4_TT1_16_WG32_8_1_WGM1
    SolutionIndex: 322
    SolutionNameMin: Cijk_Alik_Bljk_BBH_MT32x32x64_MI16x16x8x1_SE_1LDSB1_AF0EM1_GRVW8_GSU1_LBSPP128_LPA8_LPB8_PLR9_SU32_SUS128_SRVW4_TT1_16_WG32_8_1_WGM1
    SolutionIndex: 323
    SolutionNameMin: Cijk_Alik_Bljk_BBH_MT64x32x32_MI16x16x8x1_SE_1LDSB1_AF0EM1_GRVW4_GSU1_LBSPP128_LPA4_LPB4_PLR5_SU32_SUS256_SRVW4_TT2_16_WG32_8_1_WGM1
    SolutionIndex: 324
    SolutionNameMin: Cijk_Alik_Bljk_BBH_MT64x64x32_MI32x32x4x1_SE_1LDSB1_AF0EM1_GRVW2_GSU1_LBSPP128_LPA4_LPB4_PLR9_SU0_SUS256_SRVW4_TT1_32_WG64_4_1_WGM1
    SolutionIndex: 325
    SolutionNameMin: Cijk_Alik_Bljk_BBH_MT64x64x32_MI32x32x4x1_SE_1LDSB1_AF0EM1_GRVW4_GSU1_LBSPP128_LPA4_LPB4_PLR9_SU0_SUS256_SRVW4_TT1_32_WG64_4_1_WGM1
    SolutionIndex: 326
    SolutionNameMin: Cijk_Alik_Bljk_BBH_MT16x16x128_MI16x16x8x1_SE_1LDSB1_AF0EM1_GRVW8_GSU1_LBSPP256_LPA8_LPB8_PLR17_SU0_SUS256_SRVW0_TT1_16_WG16_4_1_WGM1
    SolutionIndex: 327
    SolutionNameMin: Cijk_Alik_Bljk_BBH_MT16x16x64_MI16x16x8x1_SE_1LDSB1_AF0EM1_GRVW4_GSU1_LBSPP128_LPA4_LPB4_PLR9_SU32_SUS256_SRVW0_TT1_16_WG16_4_1_WGM1
    SolutionIndex: 328
    SolutionNameMin: Cijk_Alik_Bljk_BBH_MT32x32x64_MI16x16x8x1_SE_1LDSB1_AF0EM1_GRVW2_GSU1_LBSPP128_LPA4_LPB4_PLR9_SU32_SUS256_SRVW4_TT1_16_WG32_8_1_WGM2
    SolutionIndex: 329
    SolutionNameMin: Cijk_Alik_Bljk_BBH_MT32x32x64_MI16x16x8x1_SE_1LDSB0_AF0EM1_GRVW8_GSU5_LBSPP128_LPA8_LPB8_PLR9_SU0_SUS256_SRVW0_TT1_16_WG32_8_1_WGM1
    SolutionIndex: 330
    SolutionNameMin: Cijk_Alik_Bljk_BBH_MT32x32x64_MI16x16x8x1_SE_1LDSB0_AF0EM1_GRVW8_GSU3_LBSPP128_LPA8_LPB8_PLR9_SU32_SUS128_SRVW0_TT1_16_WG32_8_1_WGM1
    SolutionIndex: 331
    SolutionNameMin: Cijk_Alik_Bljk_BBH_MT32x32x64_MI16x16x8x1_SE_1LDSB1_AF0EM1_GRVW2_GSU15_LBSPP128_LPA4_LPB4_PLR9_SU0_SUS256_SRVW0_TT1_16_WG32_8_1_WGM1
    SolutionIndex: 332
    SolutionNameMin: Cijk_Alik_Bljk_BBH_MT32x32x64_MI16x16x8x1_SE_1LDSB1_AF0EM1_GRVW8_GSU3_LBSPP128_LPA8_LPB8_PLR9_SU0_SUS256_SRVW0_TT1_16_WG32_8_1_WGM1
    SolutionIndex: 333
    SolutionNameMin: Cijk_Alik_Bljk_BBH_MT16x16x32_MI16x16x8x1_SE_1LDSB0_AF0EM1_GRVW2_GSU1_LBSPP128_LPA4_LPB4_PLR5_SU0_SUS256_SRVW0_TT1_16_WG16_4_1_WGM1
    SolutionIndex: 334
    SolutionNameMin: Cijk_Alik_Bljk_BBH_MT16x16x64_MI16x16x8x1_SE_1LDSB0_AF0EM1_GRVW8_GSU1_LBSPP128_LPA8_LPB8_PLR9_SU0_SUS256_SRVW0_TT1_16_WG16_4_1_WGM2
- - - [511, 4096, 1, 4096]
    - [2, 1.999]
  - - [512, 3071, 1, 3072]
    - [2, 2.388]
  - - [2880, 3073, 1, 3072]
    - [2, 2.907]
  - - [511, 3072, 1, 3072]
    - [2, 2.378]
  - - [1024, 512, 1, 1025]
    - [2, 1.147]
  - - [511, 2048, 1, 2048]
    - [3, 1.612]
  - - [8192, 8193, 1, 8192]
    - [5, 3.275]
  - - [3072, 3072, 1, 3071]
    - [2, 3.114]
  - - [8192, 8192, 1, 8193]
    - [5, 3.467]
  - - [513, 1024, 1, 1024]
    - [2, 1.131]
  - - [512, 1023, 1, 1024]
    - [2, 1.121]
  - - [512, 2048, 1, 2047]
    - [3, 1.641]
  - - [513, 4096, 1, 4096]
    - [2, 1.988]
  - - [3073, 512, 1, 3072]
    - [2, 2.381]
  - - [4096, 4096, 1, 4097]
    - [2, 3.106]
  - - [1025, 1024, 1, 1024]
    - [3, 1.61]
  - - [8192, 8191, 1, 8192]
    - [5, 3.302]
  - - [8192, 512, 1, 8193]
    - [2, 2.685]
  - - [2880, 3071, 1, 3072]
    - [4, 3.128]
  - - [512, 1025, 1, 1024]
    - [2, 1.16]
  - - [2048, 513, 1, 2048]
    - [3, 1.636]
  - - [1024, 1024, 1, 1025]
    - [3, 1.594]
  - - [3072, 512, 1, 3071]
    - [2, 2.394]
  - - [3072, 3071, 1, 3072]
    - [2, 3.099]
  - - [512, 2048, 1, 2049]
    - [3, 1.625]
  - - [3072, 511, 1, 3072]
    - [2, 2.386]
  - - [2049, 512, 1, 2048]
    - [3, 1.627]
  - - [512, 8191, 1, 8192]
    - [2, 2.559]
  - - [513, 3072, 1, 3072]
    - [2, 2.374]
  - - [4096, 4095, 1, 4096]
    - [2, 3.063]
  - - [511, 1024, 1, 1024]
    - [2, 1.117]
  - - [513, 512, 1, 512]
    - [6, 0.664]
  - - [1024, 511, 1, 1024]
    - [2, 1.152]
  - - [3072, 3072, 1, 3073]
    - [2, 3.116]
  - - [512, 3072, 1, 3073]
    - [2, 2.383]
  - - [1023, 512, 1, 1024]
    - [2, 1.153]
  - - [3072, 512, 1, 3073]
    - [2, 2.4]
  - - [512, 2049, 1, 2048]
    - [3, 1.628]
  - - [513, 8192, 1, 8192]
    - [4, 2.482]
  - - [1024, 513, 1, 1024]
    - [2, 1.164]
  - - [8192, 511, 1, 8192]
    - [2, 2.621]
  - - [4096, 4097, 1, 4096]
    - [2, 3.051]
  - - [512, 3072, 1, 3071]
    - [2, 2.381]
  - - [2048, 2047, 1, 2048]
    - [2, 2.645]
  - - [8193, 8192, 1, 8192]
    - [5, 3.304]
  - - [512, 4096, 1, 4095]
    - [3, 1.995]
  - - [1024, 1023, 1, 1024]
    - [3, 1.605]
  - - [3073, 3072, 1, 3072]
    - [2, 3.099]
  - - [512, 3073, 1, 3072]
    - [2, 2.388]
  - - [4096, 4096, 1, 4095]
    - [5, 3.094]
  - - [512, 8192, 1, 8191]
    - [4, 2.534]
  - - [8191, 512, 1, 8192]
    - [2, 2.624]
  - - [1025, 512, 1, 1024]
    - [2, 1.165]
  - - [2881, 3072, 1, 3072]
    - [2, 2.915]
  - - [64, 1024, 1, 1024]
    - [8, 3.509]
  - - [1024, 512, 1, 1023]
    - [2, 1.153]
  - - [513, 2048, 1, 2048]
    - [3, 1.63]
  - - [2880, 3072, 1, 3073]
    - [4, 3.112]
  - - [512, 512, 1, 513]
    - [6, 0.653]
  - - [4095, 512, 1, 4096]
    - [2, 2.058]
  - - [1024, 1025, 1, 1024]
    - [3, 1.6]
  - - [2879, 3072, 1, 3072]
    - [4, 3.13]
  - - [512, 8192, 1, 8193]
    - [2, 2.663]
  - - [511, 8192, 1, 8192]
    - [2, 2.545]
  - - [8192, 513, 1, 8192]
    - [2, 2.624]
  - - [512, 8193, 1, 8192]
    - [2, 2.532]
  - - [512, 512, 1, 511]
    - [6, 0.666]
  - - [2047, 2048, 1, 2048]
    - [2, 2.645]
  - - [2049, 2048, 1, 2048]
    - [2, 2.646]
  - - [2880, 3072, 1, 3071]
    - [4, 3.114]
  - - [64, 1025, 1, 1024]
    - [6, 0.201]
  - - [2048, 511, 1, 2048]
    - [3, 1.594]
  - - [4096, 513, 1, 4096]
    - [2, 2.065]
  - - [4097, 512, 1, 4096]
    - [2, 2.062]
  - - [8192, 512, 1, 8191]
    - [4, 2.546]
  - - [2048, 2049, 1, 2048]
    - [2, 2.644]
  - - [2048, 512, 1, 2047]
    - [3, 1.623]
  - - [3071, 3072, 1, 3072]
    - [2, 3.1]
  - - [4096, 511, 1, 4096]
    - [2, 2.058]
  - - [64, 1024, 1, 1025]
    - [6, 0.204]
  - - [2047, 512, 1, 2048]
    - [3, 1.622]
  - - [63, 1024, 1, 1024]
    - [6, 0.199]
  - - [3072, 513, 1, 3072]
    - [2, 2.38]
  - - [512, 4095, 1, 4096]
    - [2, 2.013]
  - - [512, 1024, 1, 1025]
    - [2, 1.146]
  - - [3071, 512, 1, 3072]
    - [2, 2.384]
  - - [512, 511, 1, 512]
    - [6, 0.678]
  - - [4097, 4096, 1, 4096]
    - [2, 3.061]
  - - [2048, 2048, 1, 2047]
    - [2, 2.631]
  - - [512, 4096, 1, 4097]
    - [2, 2.104]
  - - [3072, 3073, 1, 3072]
    - [2, 3.098]
  - - [512, 2047, 1, 2048]
    - [3, 1.618]
  - - [2048, 2048, 1, 2049]
    - [2, 2.666]
  - - [8191, 8192, 1, 8192]
    - [5, 3.304]
  - - [64, 1023, 1, 1024]
    - [6, 0.202]
  - - [4096, 512, 1, 4097]
    - [2, 2.129]
  - - [65, 1024, 1, 1024]
    - [7, 0.195]
  - - [512, 513, 1, 512]
    - [6, 0.687]
  - - [8192, 8192, 1, 8191]
    - [5, 3.469]
  - - [1024, 1024, 1, 1023]
    - [3, 1.613]
  - - [512, 4097, 1, 4096]
    - [2, 2.02]
  - - [511, 512, 1, 512]
    - [6, 0.675]
  - - [4096, 512, 1, 4095]
    - [4, 2.002]
  - - [8193, 512, 1, 8192]
    - [2, 2.628]
  - - [512, 1024, 1, 1023]
    - [2, 1.153]
  - - [4095, 4096, 1, 4096]
    - [2, 3.063]
  - - [64, 1024, 1, 1023]
    - [6, 0.198]
  - - [2048, 512, 1, 2049]
    - [3, 1.64]
  - - [1023, 1024, 1, 1024]
    - [3, 1.605]
  - - [512, 512, 1, 512]
    - [89, 20.934]
  - - [512, 1024, 1, 1024]
    - [9, 16.86]
  - - [512, 2048, 1, 2048]
    - [9, 19.231]
  - - [512, 3072, 1, 3072]
    - [9, 28.838]
  - - [512, 4096, 1, 4096]
    - [9, 26.877]
  - - [512, 8192, 1, 8192]
    - [9, 33.16]
  - - [1024, 1024, 1, 1024]
    - [95, 53.735]
  - - [2048, 2048, 1, 2048]
    - [198, 87.236]
  - - [2880, 3072, 1, 3072]
    - [9, 35.623]
  - - [3072, 512, 1, 3072]
    - [9, 29.023]
  - - [3072, 3072, 1, 3072]
    - [9, 35.788]
  - - [4096, 512, 1, 4096]
    - [9, 26.94]
  - - [4096, 4096, 1, 4096]
    - [197, 94.552]
  - - [8192, 512, 1, 8192]
    - [9, 33.15]
  - - [8192, 8192, 1, 8192]
    - [196, 97.009]
  - - [479, 1024, 1, 1024]
    - [11, 1.499]
  - - [479, 2048, 1, 2048]
    - [11, 2.3]
  - - [480, 1023, 1, 1024]
    - [11, 1.503]
  - - [480, 1024, 1, 1023]
    - [11, 1.524]
  - - [480, 1024, 1, 1025]
    - [11, 1.528]
  - - [480, 1025, 1, 1024]
    - [10, 1.26]
  - - [480, 2047, 1, 2048]
    - [11, 2.302]
  - - [480, 2048, 1, 2047]
    - [11, 2.306]
  - - [480, 2048, 1, 2049]
    - [11, 2.31]
  - - [480, 2049, 1, 2048]
    - [11, 1.812]
  - - [481, 1024, 1, 1024]
    - [10, 1.225]
  - - [481, 2048, 1, 2048]
    - [11, 1.775]
  - - [511, 480, 1, 512]
    - [12, 0.75]
  - - [512, 479, 1, 512]
    - [12, 0.747]
  - - [512, 480, 1, 511]
    - [12, 0.755]
  - - [512, 480, 1, 513]
    - [12, 0.752]
  - - [512, 481, 1, 512]
    - [12, 0.727]
  - - [513, 480, 1, 512]
    - [12, 0.71]
  - - [1023, 480, 1, 1024]
    - [12, 1.419]
  - - [1024, 479, 1, 1024]
    - [12, 1.413]
  - - [1024, 480, 1, 1023]
    - [12, 1.408]
  - - [1024, 480, 1, 1025]
    - [12, 1.41]
  - - [1024, 481, 1, 1024]
    - [10, 1.252]
  - - [1025, 480, 1, 1024]
    - [10, 1.257]
  - - [2047, 480, 1, 2048]
    - [13, 2.319]
  - - [2048, 479, 1, 2048]
    - [13, 2.315]
  - - [2048, 480, 1, 2047]
    - [13, 2.279]
  - - [2048, 480, 1, 2049]
    - [13, 2.276]
  - - [2048, 481, 1, 2048]
    - [11, 1.789]
  - - [2049, 480, 1, 2048]
    - [11, 1.785]
  - - [480, 1024, 1, 1024]
    - [84, 41.869]
  - - [480, 2048, 1, 2048]
    - [85, 65.081]
  - - [512, 480, 1, 512]
    - [158, 21.217]
  - - [1024, 480, 1, 1024]
    - [86, 45.291]
  - - [2048, 480, 1, 2048]
    - [87, 65.306]
  - - [480, 3072, 1, 3072]
    - [14, 23.039]
  - - [480, 4096, 1, 4096]
    - [16, 22.557]
  - - [480, 8192, 1, 8192]
    - [15, 27.105]
  - - [3072, 480, 1, 3072]
    - [17, 23.395]
  - - [4096, 480, 1, 4096]
    - [17, 21.441]
  - - [8192, 480, 1, 8192]
    - [18, 27.075]
  - - [17, 17, 1, 64]
    - [21, 0.003]
  - - [24, 24, 1, 64]
    - [26, 0.006]
  - - [30, 31, 1, 64]
    - [26, 0.01]
  - - [32, 32, 1, 64]
    - [24, 0.01]
  - - [32, 35, 1, 64]
    - [27, 0.011]
  - - [31, 31, 1, 64]
    - [25, 0.01]
  - - [34, 34, 1, 64]
    - [23, 0.011]
  - - [30, 30, 1, 64]
    - [22, 0.009]
  - - [17, 15, 1, 64]
    - [28, 0.003]
  - - [35, 35, 1, 64]
    - [26, 0.013]
  - - [21, 17, 1, 64]
    - [22, 0.004]
  - - [21, 21, 1, 64]
    - [21, 0.004]
  - - [15, 14, 1, 64]
    - [21, 0.002]
  - - [14, 14, 1, 64]
    - [20, 0.001]
  - - [15, 15, 1, 64]
    - [21, 0.002]
  - - [34, 24, 1, 64]
    - [19, 0.008]
  - - [2, 4, 1, 1024]
    - [105, 0.001]
  - - [2, 32, 1, 1024]
    - [308, 0.012]
  - - [2, 2048, 1, 1024]
    - [326, 0.66]
  - - [64, 128, 512, 128]
    - [215, 32.206]
  - - [64, 512, 1, 512]
    - [167, 3.975]
  - - [64, 512, 64, 512]
    - [194, 51.796]
  - - [128, 128, 512, 64]
    - [199, 33.606]
  - - [512, 512, 1, 64]
    - [113, 4.83]
  - - [512, 512, 64, 64]
    - [209, 45.78]
  - - [1024, 4, 1, 1024]
    - [154, 0.66]
  - - [1024, 4, 1, 1024]
    - [154, 0.66]
  - - [1024, 32, 1, 1024]
    - [107, 5.414]
  - - [1024, 2048, 1, 1024]
    - [210, 67.895]
  - - [1024, 2048, 1, 4096]
    - [198, 80.67]
  - - [1024, 4096, 1, 1024]
    - [150, 79.278]
  - - [1024, 4096, 1, 4096]
    - [230, 89.121]
  - - [4096, 2048, 1, 1024]
    - [211, 85.838]
  - - [4096, 4096, 1, 1024]
    - [214, 89.568]
  - - [30528, 2048, 1, 1024]
    - [226, 95.04]
  - - [30528, 4096, 1, 1024]
    - [214, 95.575]
  - - [3, 3, 512, 64]
    - [327, 0.088]
  - - [5, 5, 512, 64]
    - [327, 0.226]
  - - [5, 5, 960, 64]
    - [327, 0.404]
  - - [9, 9, 512, 64]
    - [327, 0.731]
  - - [27, 27, 32768, 128]
    - [328, 17.109]
  - - [32, 1600, 1, 512]
    - [179, 5.772]
  - - [33, 33, 1600, 32]
    - [324, 4.422]
  - - [64, 512, 1, 1024]
    - [178, 5.658]
  - - [64, 960, 1, 1024]
    - [109, 9.652]
  - - [128, 32768, 1, 256]
    - [224, 55.364]
  - - [256, 684, 1, 1024]
    - [138, 23.144]
  - - [256, 1280, 1, 1024]
    - [162, 36.513]
  - - [256, 1536, 1, 1024]
    - [114, 41.869]
  - - [256, 2304, 1, 1024]
    - [125, 45.768]
  - - [256, 2560, 1, 1024]
    - [249, 46.01]
  - - [256, 2816, 1, 1024]
    - [249, 50.06]
  - - [256, 3328, 1, 1024]
    - [156, 56.894]
  - - [256, 3584, 1, 1024]
    - [147, 61.701]
  - - [256, 4608, 1, 1024]
    - [111, 59.185]
  - - [256, 4864, 1, 1024]
    - [188, 57.924]
  - - [256, 5376, 1, 1024]
    - [151, 64.968]
  - - [256, 5888, 1, 1024]
    - [97, 61.076]
  - - [256, 6144, 1, 1024]
    - [97, 63.733]
  - - [256, 6400, 1, 1024]
    - [97, 65.83]
  - - [256, 6656, 1, 1024]
    - [97, 68.178]
  - - [256, 7168, 1, 1024]
    - [97, 72.514]
  - - [256, 7424, 1, 1024]
    - [124, 74.642]
  - - [256, 7936, 1, 1024]
    - [249, 65.552]
  - - [256, 8192, 1, 1024]
    - [210, 67.214]
  - - [256, 8448, 1, 1024]
    - [210, 68.174]
  - - [256, 8960, 1, 1024]
    - [210, 71.6]
  - - [256, 9984, 1, 1024]
    - [230, 71.932]
  - - [256, 10496, 1, 1024]
    - [218, 73.992]
  - - [256, 11264, 1, 1024]
    - [200, 77.405]
  - - [256, 11520, 1, 1024]
    - [250, 82.036]
  - - [256, 11776, 1, 1024]
    - [210, 69.95]
  - - [256, 12544, 1, 1024]
    - [210, 72.664]
  - - [256, 13312, 1, 1024]
    - [218, 74.56]
  - - [256, 14336, 1, 1024]
    - [226, 80.48]
  - - [256, 14592, 1, 1024]
    - [226, 81.451]
  - - [256, 14848, 1, 1024]
    - [214, 83.258]
  - - [256, 15104, 1, 1024]
    - [226, 84.598]
  - - [256, 16128, 1, 1024]
    - [251, 79.931]
  - - [256, 18176, 1, 1024]
    - [218, 82.346]
  - - [256, 18944, 1, 1024]
    - [218, 83.436]
  - - [256, 19200, 1, 1024]
    - [232, 87.066]
  - - [256, 20480, 1, 1024]
    - [226, 79.877]
  - - [256, 20992, 1, 1024]
    - [226, 82.003]
  - - [256, 21248, 1, 1024]
    - [214, 82.61]
  - - [256, 21504, 1, 1024]
    - [214, 83.803]
  - - [256, 22016, 1, 1024]
    - [214, 85.392]
  - - [256, 22344, 1, 1024]
    - [218, 83.688]
  - - [256, 23296, 1, 1024]
    - [249, 78.234]
  - - [256, 23552, 1, 1024]
    - [218, 78.878]
  - - [256, 31488, 1, 1024]
    - [252, 83.107]
  - - [256, 32768, 1, 512]
    - [225, 80.307]
  - - [256, 33536, 1, 1024]
    - [218, 86.556]
  - - [256, 44505, 1, 1024]
    - [237, 87.31]
  - - [512, 1600, 1, 512]
    - [145, 42.899]
  - - [512, 32768, 1, 13]
    - [226, 7.895]
  - - [512, 32768, 1, 1024]
    - [226, 89.518]
  - - [684, 8976, 1, 256]
    - [119, 61.159]
  - - [1024, 200, 1, 560]
    - [106, 14.907]
  - - [1024, 512, 1, 1024]
    - [88, 43.126]
  - - [1024, 512, 1, 1600]
    - [125, 48.015]
  - - [1024, 960, 1, 1024]
    - [121, 66.576]
  - - [1024, 960, 1, 1600]
    - [172, 74.153]
  - - [1024, 1600, 1, 560]
    - [175, 48.102]
  - - [1024, 1600, 1, 1024]
    - [96, 66.67]
  - - [1024, 32768, 1, 480]
    - [254, 90.771]
  - - [1024, 32768, 1, 1024]
    - [228, 93.217]
  - - [1280, 8976, 1, 256]
    - [200, 74.494]
  - - [1792, 8976, 1, 256]
    - [255, 78.724]
  - - [2048, 114, 1, 512]
    - [256, 18.043]
  - - [2048, 114, 1, 768]
    - [256, 22.987]
  - - [2048, 215, 1, 512]
    - [177, 27.048]
  - - [2048, 215, 1, 768]
    - [94, 32.795]
  - - [2048, 256, 1, 512]
    - [187, 30.45]
  - - [2048, 256, 1, 768]
    - [257, 35.382]
  - - [2048, 512, 1, 67]
    - [245, 11.05]
  - - [2048, 512, 1, 74]
    - [245, 11.618]
  - - [2048, 512, 1, 100]
    - [245, 15.096]
  - - [2048, 512, 1, 2048]
    - [111, 63.598]
  - - [2048, 684, 1, 512]
    - [110, 49.535]
  - - [2048, 684, 1, 768]
    - [210, 57.043]
  - - [2048, 960, 1, 74]
    - [258, 18.276]
  - - [2048, 960, 1, 2048]
    - [259, 82.999]
  - - [2048, 1536, 1, 512]
    - [210, 64.689]
  - - [2048, 1536, 1, 768]
    - [260, 71.435]
  - - [2048, 8976, 1, 256]
    - [254, 78.926]
  - - [2304, 8976, 1, 256]
    - [254, 80.042]
  - - [2560, 8976, 1, 256]
    - [254, 81.617]
  - - [2816, 8976, 1, 256]
    - [254, 81.722]
  - - [3072, 8976, 1, 256]
    - [254, 83.095]
  - - [3328, 8976, 1, 256]
    - [254, 83.459]
  - - [3840, 8976, 1, 256]
    - [254, 84.433]
  - - [4096, 8976, 1, 256]
    - [254, 83.095]
  - - [4352, 8976, 1, 256]
    - [254, 84.731]
  - - [4608, 8976, 1, 256]
    - [254, 85.276]
  - - [4864, 8976, 1, 256]
    - [254, 85.419]
  - - [5120, 8976, 1, 256]
    - [254, 84.856]
  - - [5376, 8976, 1, 256]
    - [254, 84.692]
  - - [5632, 8976, 1, 256]
    - [254, 85.08]
  - - [5888, 8976, 1, 256]
    - [254, 85.206]
  - - [6144, 8976, 1, 256]
    - [254, 84.775]
  - - [6400, 8976, 1, 256]
    - [200, 85.377]
  - - [7168, 8976, 1, 256]
    - [200, 85.586]
  - - [7936, 8976, 1, 256]
    - [200, 85.478]
  - - [8192, 8976, 1, 256]
    - [261, 84.126]
  - - [8448, 8976, 1, 256]
    - [200, 85.55]
  - - [8960, 8976, 1, 256]
    - [200, 86.19]
  - - [9472, 8976, 1, 256]
    - [200, 85.998]
  - - [9728, 8976, 1, 256]
    - [200, 86.282]
  - - [9984, 8976, 1, 256]
    - [200, 85.571]
  - - [10240, 8976, 1, 256]
    - [200, 86.083]
  - - [10496, 8976, 1, 256]
    - [200, 86.263]
  - - [11264, 8976, 1, 256]
    - [200, 86.047]
  - - [11776, 8976, 1, 256]
    - [200, 86.221]
  - - [12544, 8976, 1, 256]
    - [200, 86.016]
  - - [13312, 8976, 1, 256]
    - [200, 86.642]
  - - [13568, 8976, 1, 256]
    - [200, 86.425]
  - - [13824, 8976, 1, 256]
    - [200, 86.922]
  - - [15104, 8976, 1, 256]
    - [200, 86.983]
  - - [15360, 8976, 1, 256]
    - [200, 86.432]
  - - [15872, 8976, 1, 256]
    - [200, 86.375]
  - - [16128, 8976, 1, 256]
    - [200, 86.51]
  - - [17152, 8976, 1, 256]
    - [200, 86.847]
  - - [18176, 8976, 1, 256]
    - [200, 86.819]
  - - [18688, 8976, 1, 256]
    - [200, 87.125]
  - - [18944, 8976, 1, 256]
    - [200, 86.244]
  - - [19712, 8976, 1, 256]
    - [200, 86.792]
  - - [19968, 8976, 1, 256]
    - [200, 86.922]
  - - [20480, 8976, 1, 256]
    - [200, 87.003]
  - - [20992, 8976, 1, 256]
    - [200, 87.263]
  - - [21248, 8976, 1, 256]
    - [200, 86.399]
  - - [23552, 8976, 1, 256]
    - [200, 87.17]
  - - [28672, 8976, 1, 256]
    - [200, 86.938]
  - - [31488, 8976, 1, 256]
    - [200, 86.928]
  - - [33536, 8976, 1, 256]
    - [200, 86.929]
  - - [44505, 8976, 1, 256]
    - [301, 86.053]
  - - [14, 14, 10880, 64]
    - [314, 6.922]
  - - [15, 14, 10880, 64]
    - [313, 7.165]
  - - [15, 15, 7680, 64]
    - [315, 6.72]
  - - [15, 15, 10880, 64]
    - [316, 7.461]
  - - [17, 15, 7680, 64]
    - [317, 5.057]
  - - [17, 17, 7680, 64]
    - [319, 5.621]
  - - [21, 17, 6144, 64]
    - [317, 5.122]
  - - [21, 21, 6144, 64]
    - [320, 5.754]
  - - [24, 24, 4736, 64]
    - [242, 10.086]
  - - [30, 30, 2048, 64]
    - [319, 8.363]
  - - [30, 31, 2048, 64]
    - [321, 8.545]
  - - [31, 31, 2048, 64]
    - [322, 8.668]
  - - [32, 32, 4608, 64]
    - [243, 12.155]
  - - [32, 35, 4608, 64]
    - [244, 12.642]
  - - [34, 24, 4736, 64]
    - [323, 10.197]
  - - [34, 34, 4736, 64]
    - [324, 10.135]
  - - [35, 35, 4608, 64]
    - [325, 9.9]
  - - [1024, 3840, 1, 1024]
    - [214, 86.624]
  - - [1024, 3840, 1, 4096]
    - [216, 95.096]
  - - [1024, 3968, 1, 1024]
    - [116, 77.027]
  - - [1024, 3968, 1, 4096]
    - [239, 86.193]
  - - [1024, 6528, 1, 1024]
    - [240, 85.356]
  - - [1024, 6528, 1, 4096]
    - [241, 89.593]
  - - [1024, 7104, 1, 1024]
    - [233, 87.909]
  - - [1024, 7104, 1, 4096]
    - [230, 94.141]
  - - [1024, 7200, 1, 1024]
    - [232, 90.291]
  - - [1024, 7200, 1, 4096]
    - [232, 96.571]
  - - [1024, 8064, 1, 1024]
    - [230, 85.225]
  - - [1024, 8064, 1, 4096]
    - [235, 89.934]
  - - [1024, 8160, 1, 1024]
    - [230, 86.333]
  - - [1024, 8160, 1, 4096]
    - [230, 91.069]
  - - [1024, 9216, 1, 1024]
    - [214, 88.62]
  - - [1024, 9216, 1, 4096]
    - [214, 93.149]
  - - [1024, 9520, 1, 1024]
    - [214, 88.717]
  - - [1024, 9520, 1, 4096]
    - [214, 95.289]
  - - [1024, 10064, 1, 1024]
    - [234, 89.333]
  - - [1024, 10064, 1, 4096]
    - [235, 95.371]
  - - [1024, 10080, 1, 1024]
    - [236, 90.333]
  - - [1024, 10080, 1, 4096]
    - [230, 95.767]
  - - [1024, 10200, 1, 1024]
    - [237, 87.762]
  - - [1024, 10200, 1, 4096]
    - [238, 91.168]
  - - [4096, 3840, 1, 1024]
    - [214, 93.013]
  - - [4096, 3968, 1, 1024]
    - [212, 89.563]
  - - [4096, 6528, 1, 1024]
    - [214, 92.42]
  - - [4096, 7104, 1, 1024]
    - [214, 93.29]
  - - [4096, 7200, 1, 1024]
    - [232, 94.298]
  - - [4096, 8064, 1, 1024]
    - [214, 94.106]
  - - [4096, 8160, 1, 1024]
    - [228, 93.326]
  - - [4096, 9216, 1, 1024]
    - [228, 93.329]
  - - [4096, 9520, 1, 1024]
    - [214, 94.35]
  - - [4096, 10064, 1, 1024]
    - [235, 93.808]
  - - [4096, 10080, 1, 1024]
    - [232, 94.013]
  - - [4096, 10200, 1, 1024]
    - [198, 93.012]
  - - [42720, 3968, 1, 1024]
    - [214, 95.313]
  - - [42720, 6528, 1, 1024]
    - [214, 96.214]
  - - [42720, 7104, 1, 1024]
    - [228, 95.798]
  - - [42720, 7200, 1, 1024]
    - [228, 95.777]
  - - [42720, 9520, 1, 1024]
    - [214, 95.395]
  - - [42720, 10080, 1, 1024]
    - [214, 96.066]
  - - [27, 27, 1920, 64]
    - [31, 4.213]
  - - [27, 33, 1920, 64]
    - [29, 4.595]
  - - [33, 33, 1920, 64]
    - [36, 3.385]
  - - [27, 27, 1920, 64]
    - [35, 4.299]
  - - [27, 33, 1920, 64]
    - [37, 4.637]
  - - [33, 33, 1920, 64]
    - [42, 3.488]
  - - [1024, 3240, 1, 1024]
    - [51, 35.327]
  - - [1024, 3240, 1, 4096]
    - [32, 38.283]
  - - [1024, 3960, 1, 1024]
    - [39, 35.104]
  - - [1024, 3960, 1, 4096]
    - [47, 37.527]
  - - [4096, 3240, 1, 1024]
    - [52, 42.293]
  - - [4096, 3960, 1, 1024]
    - [44, 43.442]
  - - [42720, 3960, 1, 1024]
    - [48, 45.756]
  - - [1024, 10, 1, 1024]
    - [102, 1.752]
  - - [1024, 32768, 1, 479]
    - [227, 83.608]
  - - [1024, 4992, 1, 4096]
    - [207, 86.262]
  - - [1024, 5, 1, 1024]
    - [93, 0.812]
  - - [2, 5, 1, 1024]
    - [144, 0.001]
  - - [8192, 7680, 1, 8192]
    - [192, 98.475]
  - - [2, 40, 1, 1024]
    - [308, 0.015]
  - - [128, 128, 128, 64]
    - [199, 22.036]
  - - [64, 128, 1, 128]
    - [93, 0.332]
  - - [1024, 2560, 1, 4096]
    - [218, 83.045]
  - - [30522, 462, 1, 1024]
    - [311, 86.567]
  - - [1024, 820, 1, 1024]
    - [100, 54.738]
  - - [4096, 5248, 1, 1024]
    - [214, 93.654]
  - - [4096, 3840, 1, 4096]
    - [191, 97.204]
  - - [1024, 39, 1, 1024]
    - [102, 6.486]
  - - [128, 128, 160, 64]
    - [203, 23.79]
  - - [4096, 1280, 1, 1024]
    - [204, 79.75]
  - - [1024, 2560, 1, 1024]
    - [218, 73.027]
  - - [1024, 800, 1, 1024]
    - [108, 53.404]
  - - [1024, 8, 1, 1024]
    - [109, 1.402]
  - - [30522, 160, 1, 1024]
    - [303, 74.877]
  - - [2, 1024, 1, 1024]
    - [90, 0.329]
  - - [30522, 308, 1, 1024]
    - [307, 81.49]
  - - [17, 17, 6144, 64]
    - [318, 4.479]
  - - [4096, 2560, 1, 1024]
    - [219, 88.416]
  - - [4096, 8192, 1, 1024]
    - [233, 93.068]
  - - [33, 33, 1, 32]
    - [105, 0.009]
  - - [1024, 5120, 1, 1024]
    - [212, 79.372]
  - - [1024, 9, 1, 1024]
    - [109, 1.563]
  - - [1024, 780, 1, 1024]
    - [168, 52.068]
  - - [512, 512, 80, 64]
    - [217, 48.217]
  - - [4096, 3072, 1, 1024]
    - [200, 89.752]
  - - [480, 512, 1, 512]
    - [118, 22.866]
  - - [1024, 3072, 1, 4096]
    - [221, 85.761]
  - - [4096, 1024, 1, 1024]
    - [116, 80.792]
  - - [1024, 1152, 1, 1024]
    - [99, 58.724]
  - - [128, 128, 656, 64]
    - [215, 35.273]
  - - [1024, 1024, 1, 4096]
    - [95, 67.666]
  - - [30522, 820, 1, 1024]
    - [307, 88.847]
  - - [2, 10, 1, 1024]
    - [302, 0.004]
  - - [1024, 180, 1, 1024]
    - [170, 22.939]
  - - [128, 128, 624, 64]
    - [205, 35.09]
  - - [1024, 160, 1, 1024]
    - [143, 21.807]
  - - [4096, 5120, 1, 1024]
    - [214, 91.788]
  - - [4, 4, 38400, 64]
    - [313, 1.327]
  - - [2048, 1920, 1, 2048]
    - [195, 92.3]
  - - [2, 39, 1, 1024]
    - [305, 0.015]
  - - [1024, 462, 1, 1024]
    - [130, 37.314]
  - - [2, 9, 1, 1024]
    - [105, 0.003]
  - - [30522, 180, 1, 1024]
    - [312, 74.519]
  - - [33712, 8192, 1, 1024]
    - [214, 95.999]
  - - [1024, 77, 1, 1024]
    - [174, 11.535]
  - - [5, 5, 1, 64]
    - [144, 0.0]
  - - [1024, 40, 1, 1024]
    - [176, 6.653]
  - - [2, 8, 1, 1024]
    - [154, 0.003]
  - - [512, 512, 96, 64]
    - [212, 49.177]
  - - [1024, 1152, 1, 4096]
    - [134, 75.615]
  - - [30522, 385, 1, 1024]
    - [310, 78.913]
  - - [1024, 200, 1, 1024]
    - [180, 24.38]
  - - [1024, 5120, 1, 4096]
    - [213, 86.848]
  - - [30522, 616, 1, 1024]
    - [301, 87.125]
  - - [1024, 41, 1, 1024]
    - [137, 6.596]
  - - [128, 128, 1, 64]
    - [115, 0.37]
  - - [1024, 5248, 1, 4096]
    - [216, 87.75]
  - - [4, 4, 32768, 64]
    - [313, 1.277]
  - - [128, 128, 640, 64]
    - [203, 35.382]
  - - [7680, 8192, 1, 8192]
    - [191, 98.43]
  - - [1024, 1280, 1, 4096]
    - [183, 76.589]
  - - [1024, 5248, 1, 1024]
    - [214, 81.485]
  - - [512, 512, 128, 64]
    - [200, 51.203]
  - - [512, 512, 16, 64]
    - [199, 30.267]
  - - [1024, 9600, 1, 1024]
    - [214, 91.862]
  - - [2, 6, 1, 1024]
    - [144, 0.001]
  - - [1024, 385, 1, 1024]
    - [114, 39.354]
  - - [1024, 4992, 1, 1024]
    - [206, 78.128]
  - - [33712, 9600, 1, 1024]
    - [214, 96.213]
  - - [1024, 512, 1, 4096]
    - [148, 55.44]
  - - [1024, 9600, 1, 4096]
    - [232, 96.93]
  - - [1024, 6, 1, 1024]
    - [93, 0.997]
  - - [1024, 308, 1, 1024]
    - [162, 32.498]
  - - [3840, 4096, 1, 4096]
    - [192, 97.235]
  - - [2, 41, 1, 1024]
    - [308, 0.015]
  - - [4096, 1152, 1, 1024]
    - [223, 82.893]
  - - [4096, 9600, 1, 1024]
    - [214, 95.433]
  - - [30522, 200, 1, 1024]
    - [304, 66.893]
  - - [4096, 4992, 1, 1024]
    - [208, 92.252]
  - - [1024, 8192, 1, 1024]
    - [218, 85.931]
  - - [30522, 780, 1, 1024]
    - [306, 88.892]
  - - [4096, 512, 1, 1024]
    - [202, 67.44]
  - - [1024, 1280, 1, 1024]
    - [189, 61.121]
  - - [1920, 2048, 1, 2048]
    - [193, 92.755]
  - - [1024, 3072, 1, 1024]
    - [220, 74.895]
  - - [1024, 8192, 1, 4096]
    - [231, 90.807]
  - - [128, 128, 144, 64]
    - [222, 23.165]
  - - [30522, 800, 1, 1024]
    - [309, 91.367]
  - - [30522, 77, 1, 1024]
    - [190, 57.674]
  - - [1024, 1024, 128, 96]
    - [204, 76.101]
  - - [30592, 4096, 1, 1024]
    - [214, 95.874]
  - - [64, 1024, 256, 1024]
    - [265, 73.13]
  - - [1536, 8192, 1, 1536]
    - [273, 92.094]
  - - [2048, 2, 1, 2048]
    - [104, 0.957]
  - - [3072, 8192, 1, 1024]
    - [214, 93.474]
  - - [3072, 2048, 1, 1024]
    - [198, 83.505]
  - - [50304, 8192, 1, 1024]
    - [214, 96.366]
  - - [64, 512, 40, 512]
    - [257, 46.01]
  - - [2048, 1024, 1, 8192]
    - [262, 86.206]
  - - [96, 1024, 64, 1024]
    - [272, 76.56]
  - - [1024, 16, 1, 1024]
    - [107, 2.707]
  - - [50304, 2048, 1, 1024]
    - [214, 94.915]
  - - [1536, 8192, 1, 6144]
    - [274, 95.202]
  - - [50304, 4096, 1, 1536]
    - [214, 97.048]
  - - [8192, 1024, 1, 2048]
    - [235, 88.193]
  - - [2, 4, 1, 2560]
    - [330, 0.003]
  - - [2560, 2048, 1, 640]
    - [268, 76.125]
  - - [1024, 1024, 128, 64]
    - [278, 60.946]
  - - [2048, 1024, 1, 2048]
    - [262, 76.27]
  - - [1536, 4096, 1, 1536]
    - [271, 85.037]
  - - [1024, 1024, 64, 64]
    - [204, 57.749]
  - - [30592, 8192, 1, 1024]
    - [214, 96.118]
  - - [50304, 16384, 1, 1024]
    - [214, 96.41]
  - - [4608, 4096, 1, 1536]
    - [228, 93.121]
  - - [2560, 2048, 1, 2560]
    - [267, 85.737]
  - - [7680, 2048, 1, 2560]
    - [270, 96.324]
  - - [2, 16, 1, 1024]
    - [329, 0.006]
  - - [50304, 4096, 1, 1024]
    - [214, 96.021]
  - - [64, 1024, 128, 1024]
    - [279, 71.679]
  - - [1920, 2048, 1, 2560]
    - [193, 92.904]
  - - [1024, 1024, 64, 96]
    - [204, 73.169]
  - - [64, 1024, 32, 1024]
    - [194, 60.352]
  - - [6144, 4096, 1, 1536]
    - [270, 94.278]
  - - [64, 512, 128, 512]
    - [194, 58.252]
  - - [1536, 4096, 1, 6144]
    - [221, 90.64]
  - - [512, 512, 256, 64]
    - [226, 56.294]
  - - [96, 1024, 128, 1024]
    - [275, 80.307]
  - - [50304, 8192, 1, 1536]
    - [214, 97.035]
  - - [6144, 8192, 1, 1536]
    - [214, 95.082]
  - - [4096, 16384, 1, 1024]
    - [228, 94.636]
  - - [30592, 1024, 1, 2048]
    - [263, 96.271]
  - - [2, 2, 1, 2048]
    - [154, 0.001]
  - - [1024, 16384, 1, 4096]
    - [232, 94.566]
  - - [64, 512, 256, 512]
    - [265, 62.316]
  - - [512, 512, 40, 64]
    - [199, 41.183]
  - - [6144, 1024, 1, 2048]
    - [264, 85.549]
  - - [4608, 8192, 1, 1536]
    - [228, 94.236]
  - - [30592, 2048, 1, 1024]
    - [214, 95.293]
  - - [3072, 16384, 1, 1024]
    - [226, 94.434]
  - - [1024, 1024, 256, 64]
    - [204, 62.888]
  - - [64, 1024, 64, 1024]
    - [277, 65.249]
  - - [1024, 16384, 1, 1024]
    - [226, 89.493]
  - - [1024, 1024, 32, 64]
    - [276, 52.404]
  - - [3072, 4096, 1, 1024]
    - [266, 89.752]
  - - [2560, 4, 1, 2560]
    - [269, 2.556]
  - - [960, 1024, 1, 1024]
    - [194, 66.341]
  - - [1024, 1, 1, 1024]
    - [201, 0.162]
  - - [32768, 1, 1, 256]
    - [229, 0.886]
  - - [512, 1, 1, 2048]
    - [246, 0.145]
  - - [1600, 1, 1, 1024]
    - [247, 0.253]
  - - [200, 1, 1, 1024]
    - [248, 0.034]
  - - [960, 1, 1, 2048]
    - [253, 0.232]
  - - [1024, 64, 1, 1024]
    - [280, 8.43]
  - - [30528, 8192, 1, 1024]
    - [214, 95.918]
  - - [128, 128, 1024, 64]
    - [281, 38.574]
  - - [64, 128, 1024, 128]
    - [268, 36.015]
  - - [1024, 3456, 1, 1024]
    - [282, 77.077]
  - - [1024, 3456, 1, 480]
    - [273, 70.185]
  - - [1024, 4096, 1, 480]
    - [283, 73.453]
  - - [1024, 6912, 1, 1024]
    - [230, 86.624]
  - - [1024, 6912, 1, 480]
    - [284, 80.696]
  - - [1024, 864, 1, 1024]
    - [260, 53.831]
  - - [1024, 864, 1, 480]
    - [285, 42.056]
  - - [128, 3456, 1, 256]
    - [256, 19.997]
  - - [128, 4096, 1, 256]
    - [286, 21.656]
  - - [128, 55296, 1, 256]
    - [287, 64.968]
  - - [128, 6912, 1, 256]
    - [288, 31.402]
  - - [128, 864, 1, 256]
    - [289, 6.542]
  - - [256, 3456, 1, 512]
    - [288, 45.829]
  - - [256, 4096, 1, 512]
    - [290, 42.044]
  - - [256, 55296, 1, 512]
    - [236, 84.677]
  - - [256, 6912, 1, 512]
    - [225, 60.344]
  - - [256, 864, 1, 512]
    - [289, 18.592]
  - - [3456, 1, 1, 256]
    - [291, 0.195]
  - - [4096, 1, 1, 256]
    - [292, 0.228]
  - - [512, 3456, 1, 1024]
    - [293, 70.8]
  - - [512, 3456, 1, 13]
    - [199, 3.501]
  - - [512, 4096, 1, 1024]
    - [210, 68.707]
  - - [512, 4096, 1, 13]
    - [203, 3.956]
  - - [512, 55296, 1, 13]
    - [236, 9.676]
  - - [512, 6912, 1, 1024]
    - [216, 77.784]
  - - [512, 6912, 1, 13]
    - [223, 5.187]
  - - [512, 864, 1, 1024]
    - [277, 38.892]
  - - [512, 864, 1, 13]
    - [294, 1.282]
  - - [6912, 1, 1, 256]
    - [295, 0.373]
  - - [864, 1, 1, 256]
    - [296, 0.049]
  - - [30528, 640, 1, 1024]
    - [214, 92.3]
  - - [30528, 1280, 1, 1024]
    - [214, 94.015]
  - - [30528, 1600, 1, 1024]
    - [297, 93.916]
  - - [1024, 10240, 1, 1024]
    - [237, 88.26]
  - - [1024, 80, 1, 1024]
    - [298, 10.195]
  - - [4096, 10240, 1, 1024]
    - [299, 92.955]
  - - [1024, 10240, 1, 4096]
    - [241, 91.484]
  - - [64, 128, 1280, 128]
    - [212, 36.303]
  - - [128, 128, 1280, 64]
    - [199, 40.259]
  - - [1024, 10496, 1, 4096]
    - [251, 92.874]
  - - [30528, 1640, 1, 1024]
    - [214, 93.881]
  - - [1024, 82, 1, 1024]
    - [298, 10.45]
  - - [4096, 10496, 1, 1024]
    - [214, 94.949]
  - - [1024, 10496, 1, 1024]
    - [200, 89.875]
  - - [64, 128, 1312, 128]
    - [210, 36.267]
  - - [128, 128, 1312, 64]
    - [199, 40.045]
  - - [30528, 160, 1, 1024]
    - [297, 79.47]
  - - [1024, 12, 1, 1024]
    - [300, 1.93]
  - - [30528, 240, 1, 1024]
    - [191, 82.312]
  - - [1024, 6144, 1, 1024]
    - [218, 82.196]
  - - [4096, 6144, 1, 1024]
    - [214, 93.185]
  - - [1024, 6144, 1, 4096]
    - [251, 89.056]
  - - [64, 512, 192, 512]
    - [218, 60.594]
  - - [512, 512, 192, 64]
    - [214, 54.219]
  - - [2, 64, 1, 1024]
    - [308, 0.022]
  - - [2, 80, 1, 1024]
    - [331, 0.03]
  - - [2, 82, 1, 1024]
    - [302, 0.03]
  - - [2, 12, 1, 1024]
    - [332, 0.004]
  - - [2, 1, 1, 1024]
    - [333, 0.0]
  - - [1, 4096, 1, 256]
    - [326, 0.228]
  - - [1, 6912, 1, 256]
    - [334, 0.359]
- null
