library/src/blas3/Tensile/Logic/asm_full/arcturus_Cijk_Ailk_Bjlk_BBH.yaml
- {MinimumRequiredVersion: 4.14.0}
- arcturus
- gfx908
- [Device 7380, Device 7388, Device 738c, Device 7390]
    SolutionIndex: 0
    SolutionNameMin: Cijk_Ailk_Bjlk_BBH_MT32x256x8_MI32x32x2x2_SE_ONLL0_SNLL1
    SolutionIndex: 1
    SolutionNameMin: Cijk_Ailk_Bjlk_BBH_MT64x128x8_MI32x32x2x2_SE_ONLL0_SNLL1
    SolutionIndex: 2
    SolutionNameMin: Cijk_Ailk_Bjlk_BBH_MT64x128x16_MI32x32x2x2_SE_ONLL0_SNLL1
    SolutionIndex: 3
    SolutionNameMin: Cijk_Ailk_Bjlk_BBH_MT32x256x8_MI32x32x2x2_SE_ONLL0_SNLL0
    SolutionIndex: 4
    SolutionNameMin: Cijk_Ailk_Bjlk_BBH_MT64x128x8_MI32x32x2x2_SE_ONLL0_SNLL0
    SolutionIndex: 5
    SolutionNameMin: Cijk_Ailk_Bjlk_BBH_MT64x128x16_MI32x32x2x2_SE_ONLL0_SNLL0
    SolutionIndex: 6
    SolutionNameMin: Cijk_Ailk_Bjlk_BBH_MT64x128x32_MI32x32x2x2_SE_ONLL0_SNLL0
    SolutionIndex: 7
    SolutionNameMin: Cijk_Ailk_Bjlk_BBH_MT64x128x16_MI32x32x2x2_SE_ONLL1_SNLL1
    SolutionIndex: 8
    SolutionNameMin: Cijk_Ailk_Bjlk_BBH_MT64x128x32_MI32x32x2x2_SE_ONLL1_SNLL1
    SolutionIndex: 9
    SolutionNameMin: Cijk_Ailk_Bjlk_BBH_MT32x256x8_MI32x32x2x2_SE_ONLL1_SNLL0
    SolutionIndex: 10
    SolutionNameMin: Cijk_Ailk_Bjlk_BBH_MT64x128x8_MI32x32x2x2_SE_ONLL1_SNLL0
    SolutionIndex: 11
    SolutionNameMin: Cijk_Ailk_Bjlk_BBH_MT32x256x16_MI32x32x2x2_SE_ONLL1_SNLL0
    SolutionIndex: 12
    SolutionNameMin: Cijk_Ailk_Bjlk_BBH_MT64x128x16_MI32x32x2x2_SE_ONLL1_SNLL0
    SolutionIndex: 13
    SolutionNameMin: Cijk_Ailk_Bjlk_BBH_MT64x128x32_MI32x32x2x2_SE_ONLL1_SNLL0
    SolutionIndex: 14
    SolutionNameMin: Cijk_Ailk_Bjlk_BBH_MT64x256x8_MI32x32x2x2_SE_ONLL0_SNLL0
    SolutionIndex: 15
    SolutionNameMin: Cijk_Ailk_Bjlk_BBH_MT64x256x16_MI32x32x2x2_SE_ONLL0_SNLL0
    SolutionIndex: 16
    SolutionNameMin: Cijk_Ailk_Bjlk_BBH_MT64x256x16_MI32x32x2x2_SE_ONLL1_SNLL1
    SolutionIndex: 17
    SolutionNameMin: Cijk_Ailk_Bjlk_BBH_MT64x128x8_MI32x32x2x2_SE_AF0EM1_ASEM1_ONLL0_SNLL1
    SolutionIndex: 18
    SolutionNameMin: Cijk_Ailk_Bjlk_BBH_MT64x128x8_MI32x32x2x2_SE_AF0EM1_ASEM1_ONLL0_SNLL0
    SolutionIndex: 19
    SolutionNameMin: Cijk_Ailk_Bjlk_BBH_MT64x128x32_MI32x32x2x2_SE_AF0EM1_ASEM2_ONLL0_SNLL0
    SolutionIndex: 20
    SolutionNameMin: Cijk_Ailk_Bjlk_BBH_MT64x128x8_MI32x32x2x2_SE_AF0EM1_ASEM1_ONLL1_SNLL1
    SolutionIndex: 21
    SolutionNameMin: Cijk_Ailk_Bjlk_BBH_MT64x128x8_MI32x32x2x2_SE_AF0EM1_ASEM1_ONLL1_SNLL0
    SolutionIndex: 22
    SolutionNameMin: Cijk_Ailk_Bjlk_BBH_MT64x128x32_MI32x32x2x2_SE_AF0EM1_ASEM2_ONLL1_SNLL0
    SolutionIndex: 23
    SolutionIndex: 24
    SolutionIndex: 25
    SolutionIndex: 26
    SolutionIndex: 27
    SolutionIndex: 28
    SolutionIndex: 29
    SolutionIndex: 30
    SolutionIndex: 31
    SolutionIndex: 32
    SolutionIndex: 33
    SolutionIndex: 34
    SolutionIndex: 35
    SolutionIndex: 36
    SolutionIndex: 37
    SolutionIndex: 38
    SolutionIndex: 39
    SolutionIndex: 40
    SolutionIndex: 41
    SolutionIndex: 42
    SolutionIndex: 43
    SolutionIndex: 44
    SolutionIndex: 45
    SolutionIndex: 46
    SolutionIndex: 47
    SolutionIndex: 48
    SolutionIndex: 49
    SolutionIndex: 50
    SolutionIndex: 51
    SolutionIndex: 52
    SolutionIndex: 53
    SolutionIndex: 54
    SolutionIndex: 55
    SolutionIndex: 56
    SolutionIndex: 57
    SolutionIndex: 58
    SolutionIndex: 59
    SolutionIndex: 60
    SolutionIndex: 61
    SolutionIndex: 62
    SolutionIndex: 63
    SolutionIndex: 64
    SolutionIndex: 65
    SolutionIndex: 66
    SolutionIndex: 67
    SolutionIndex: 68
    SolutionIndex: 69
    SolutionIndex: 70
    SolutionIndex: 71
    SolutionIndex: 72
    SolutionIndex: 73
    SolutionIndex: 74
    SolutionIndex: 75
    SolutionIndex: 76
    SolutionIndex: 77
    SolutionIndex: 78
    SolutionIndex: 79
    SolutionIndex: 80
    SolutionIndex: 81
    SolutionIndex: 82
    SolutionIndex: 83
    SolutionIndex: 84
    SolutionIndex: 85
    SolutionIndex: 86
    SolutionIndex: 87
    SolutionIndex: 88
    SolutionIndex: 89
    SolutionIndex: 90
    SolutionIndex: 91
    SolutionNameMin: Cijk_Ailk_Bjlk_BBH_MT32x256x8_MI32x32x2x2_SE_ONLL0_SNLL1
    SolutionIndex: 92
    SolutionNameMin: Cijk_Ailk_Bjlk_BBH_MT64x128x8_MI32x32x2x2_SE_ONLL0_SNLL1
    SolutionIndex: 93
    SolutionNameMin: Cijk_Ailk_Bjlk_BBH_MT64x128x16_MI32x32x2x2_SE_ONLL0_SNLL1
    SolutionIndex: 94
    SolutionNameMin: Cijk_Ailk_Bjlk_BBH_MT32x256x8_MI32x32x2x2_SE_ONLL0_SNLL0
    SolutionIndex: 95
    SolutionNameMin: Cijk_Ailk_Bjlk_BBH_MT64x128x8_MI32x32x2x2_SE_ONLL0_SNLL0
    SolutionIndex: 96
    SolutionNameMin: Cijk_Ailk_Bjlk_BBH_MT64x128x16_MI32x32x2x2_SE_ONLL0_SNLL0
    SolutionIndex: 97
    SolutionNameMin: Cijk_Ailk_Bjlk_BBH_MT64x128x32_MI32x32x2x2_SE_ONLL0_SNLL0
    SolutionIndex: 98
    SolutionNameMin: Cijk_Ailk_Bjlk_BBH_MT64x128x16_MI32x32x2x2_SE_ONLL1_SNLL1
    SolutionIndex: 99
    SolutionNameMin: Cijk_Ailk_Bjlk_BBH_MT64x128x32_MI32x32x2x2_SE_ONLL1_SNLL1
    SolutionIndex: 100
    SolutionNameMin: Cijk_Ailk_Bjlk_BBH_MT32x256x8_MI32x32x2x2_SE_ONLL1_SNLL0
    SolutionIndex: 101
    SolutionNameMin: Cijk_Ailk_Bjlk_BBH_MT64x128x8_MI32x32x2x2_SE_ONLL1_SNLL0
    SolutionIndex: 102
    SolutionNameMin: Cijk_Ailk_Bjlk_BBH_MT32x256x16_MI32x32x2x2_SE_ONLL1_SNLL0
    SolutionIndex: 103
    SolutionNameMin: Cijk_Ailk_Bjlk_BBH_MT64x128x16_MI32x32x2x2_SE_ONLL1_SNLL0
    SolutionIndex: 104
    SolutionNameMin: Cijk_Ailk_Bjlk_BBH_MT64x128x32_MI32x32x2x2_SE_ONLL1_SNLL0
    SolutionIndex: 105
    SolutionNameMin: Cijk_Ailk_Bjlk_BBH_MT64x256x8_MI32x32x2x2_SE_ONLL0_SNLL0
    SolutionIndex: 106
    SolutionNameMin: Cijk_Ailk_Bjlk_BBH_MT64x256x16_MI32x32x2x2_SE_ONLL0_SNLL0
    SolutionIndex: 107
    SolutionNameMin: Cijk_Ailk_Bjlk_BBH_MT64x256x16_MI32x32x2x2_SE_ONLL1_SNLL1
    SolutionIndex: 108
    SolutionNameMin: Cijk_Ailk_Bjlk_BBH_MT64x128x8_MI32x32x2x2_SE_AF0EM1_ASEM1_ONLL0_SNLL1
    SolutionIndex: 109
    SolutionNameMin: Cijk_Ailk_Bjlk_BBH_MT64x128x8_MI32x32x2x2_SE_AF0EM1_ASEM1_ONLL0_SNLL0
    SolutionIndex: 110
    SolutionNameMin: Cijk_Ailk_Bjlk_BBH_MT64x128x32_MI32x32x2x2_SE_AF0EM1_ASEM2_ONLL0_SNLL0
    SolutionIndex: 111
    SolutionNameMin: Cijk_Ailk_Bjlk_BBH_MT64x128x8_MI32x32x2x2_SE_AF0EM1_ASEM1_ONLL1_SNLL1
    SolutionIndex: 112
    SolutionNameMin: Cijk_Ailk_Bjlk_BBH_MT64x128x8_MI32x32x2x2_SE_AF0EM1_ASEM1_ONLL1_SNLL0
    SolutionIndex: 113
    SolutionNameMin: Cijk_Ailk_Bjlk_BBH_MT64x128x32_MI32x32x2x2_SE_AF0EM1_ASEM2_ONLL1_SNLL0
    SolutionIndex: 114
    SolutionIndex: 115
    SolutionIndex: 116
    SolutionIndex: 117
    SolutionIndex: 118
    SolutionIndex: 119
    SolutionIndex: 120
    SolutionIndex: 121
    SolutionIndex: 122
    SolutionIndex: 123
    SolutionIndex: 124
    SolutionIndex: 125
    SolutionIndex: 126
    SolutionIndex: 127
    SolutionIndex: 128
    SolutionIndex: 129
    SolutionIndex: 130
    SolutionIndex: 131
    SolutionIndex: 132
    SolutionIndex: 133
    SolutionIndex: 134
    SolutionIndex: 135
    SolutionIndex: 136
    SolutionIndex: 137
    SolutionIndex: 138
    SolutionIndex: 139
    SolutionIndex: 140
    SolutionIndex: 141
    SolutionIndex: 142
    SolutionIndex: 143
    SolutionIndex: 144
    SolutionIndex: 145
    SolutionIndex: 146
    SolutionIndex: 147
    SolutionIndex: 148
    SolutionIndex: 149
    SolutionIndex: 150
    SolutionIndex: 151
    SolutionIndex: 152
    SolutionIndex: 153
    SolutionIndex: 154
    SolutionIndex: 155
    SolutionIndex: 156
    SolutionIndex: 157
    SolutionIndex: 158
    SolutionIndex: 159
    SolutionIndex: 160
    SolutionIndex: 161
    SolutionIndex: 162
    SolutionIndex: 163
    SolutionIndex: 164
    SolutionIndex: 165
    SolutionIndex: 166
    SolutionIndex: 167
    SolutionIndex: 168
    SolutionIndex: 169
    SolutionIndex: 170
    SolutionIndex: 171
    SolutionIndex: 172
    SolutionIndex: 173
    SolutionIndex: 174
    SolutionIndex: 175
    SolutionIndex: 176
    SolutionIndex: 177
    SolutionIndex: 178
    SolutionIndex: 179
    SolutionIndex: 180
    SolutionIndex: 181
    SolutionIndex: 182
    SolutionIndex: 183
    SolutionIndex: 184
    SolutionIndex: 185
    SolutionIndex: 186
    SolutionIndex: 187
    SolutionIndex: 188
    SolutionIndex: 189
    SolutionIndex: 190
    SolutionIndex: 191
    SolutionIndex: 192
    SolutionIndex: 193
    SolutionIndex: 194
    SolutionIndex: 195
    SolutionIndex: 196
    SolutionIndex: 197
    SolutionIndex: 198
    SolutionIndex: 199
    SolutionIndex: 200
    SolutionIndex: 201
    SolutionIndex: 202
    SolutionIndex: 203
    SolutionIndex: 204
    SolutionIndex: 205
    SolutionIndex: 206
    SolutionIndex: 207
    SolutionIndex: 208
    SolutionIndex: 209
    SolutionIndex: 210
    SolutionIndex: 211
    SolutionIndex: 212
    SolutionIndex: 213
    SolutionIndex: 214
    SolutionIndex: 215
    SolutionIndex: 216
    SolutionIndex: 217
    SolutionIndex: 218
    SolutionIndex: 219
    SolutionIndex: 220
    SolutionIndex: 221
    SolutionIndex: 222
    SolutionIndex: 223
    SolutionIndex: 224
    SolutionIndex: 225
    SolutionIndex: 226
    SolutionIndex: 227
    SolutionIndex: 228
    SolutionIndex: 229
    SolutionIndex: 230
    SolutionIndex: 231
    SolutionIndex: 232
    SolutionIndex: 233
    SolutionIndex: 234
    SolutionIndex: 235
    SolutionIndex: 236
    SolutionIndex: 237
    SolutionIndex: 238
    SolutionIndex: 239
    SolutionIndex: 240
    SolutionIndex: 241
    SolutionIndex: 242
    SolutionIndex: 243
    SolutionIndex: 244
    SolutionIndex: 245
    SolutionIndex: 246
    SolutionIndex: 247
    SolutionIndex: 248
    SolutionIndex: 249
    SolutionIndex: 250
    SolutionIndex: 251
    SolutionIndex: 252
    SolutionIndex: 253
    SolutionIndex: 254
    SolutionIndex: 255
    SolutionIndex: 256
    SolutionIndex: 257
    SolutionIndex: 258
    SolutionIndex: 259
    SolutionIndex: 260
    SolutionIndex: 261
    SolutionIndex: 262
    SolutionIndex: 263
    SolutionIndex: 264
    SolutionIndex: 265
    SolutionIndex: 266
    SolutionIndex: 267
    SolutionIndex: 268
    SolutionIndex: 269
    SolutionIndex: 270
    SolutionIndex: 271
    SolutionIndex: 272
    SolutionIndex: 273
    SolutionIndex: 274
    SolutionIndex: 275
    SolutionIndex: 276
    SolutionIndex: 277
    SolutionIndex: 278
    SolutionIndex: 279
    SolutionIndex: 280
    SolutionIndex: 281
    SolutionIndex: 282
    SolutionIndex: 283
    SolutionIndex: 284
    SolutionIndex: 285
    SolutionIndex: 286
    SolutionIndex: 287
    SolutionIndex: 288
    SolutionIndex: 289
    SolutionIndex: 290
    SolutionIndex: 291
    SolutionIndex: 292
    SolutionIndex: 293
    SolutionIndex: 294
    SolutionIndex: 295
    SolutionIndex: 296
    SolutionIndex: 297
    SolutionIndex: 298
    SolutionIndex: 299
    SolutionIndex: 300
    SolutionIndex: 301
    SolutionIndex: 302
    SolutionIndex: 303
    SolutionIndex: 304
    SolutionIndex: 305
    SolutionIndex: 306
    SolutionIndex: 307
    SolutionIndex: 308
    SolutionIndex: 309
    SolutionIndex: 310
    SolutionIndex: 311
    SolutionIndex: 312
    SolutionIndex: 313
    SolutionIndex: 314
    SolutionIndex: 315
    SolutionIndex: 316
    SolutionIndex: 317
    SolutionIndex: 318
    SolutionIndex: 319
    SolutionIndex: 320
    SolutionIndex: 321
    SolutionIndex: 322
    SolutionIndex: 323
    SolutionIndex: 324
    SolutionIndex: 325
    SolutionIndex: 326
    SolutionIndex: 327
- - - [34, 64, 1, 34]
    - [33, 0.0]
  - - [32, 64, 1, 35]
    - [32, 0.0]
  - - [64, 21, 1, 17]
    - [28, 0.0]
  - - [64, 32, 1, 35]
    - [32, 0.0]
  - - [21, 64, 1, 21]
    - [30, 0.0]
  - - [64, 30, 1, 31]
    - [32, 0.0]
  - - [15, 64, 1, 15]
    - [23, 0.0]
  - - [64, 24, 1, 24]
    - [32, 0.0]
  - - [17, 64, 1, 15]
    - [51, 0.0]
  - - [64, 35, 1, 35]
    - [28, 0.0]
  - - [32, 64, 1, 32]
    - [33, 0.0]
  - - [64, 34, 1, 24]
    - [32, 0.0]
  - - [64, 15, 1, 15]
    - [26, 0.0]
  - - [30, 64, 1, 30]
    - [73, 0.0]
  - - [30, 64, 1, 31]
    - [51, 0.0]
  - - [34, 64, 1, 24]
    - [77, 0.0]
  - - [64, 30, 1, 30]
    - [32, 0.0]
  - - [14, 64, 1, 14]
    - [23, 0.0]
  - - [64, 17, 1, 17]
    - [24, 0.0]
  - - [64, 17, 1, 15]
    - [24, 0.0]
  - - [64, 32, 1, 32]
    - [29, 0.0]
  - - [64, 31, 1, 31]
    - [32, 0.0]
  - - [17, 64, 1, 17]
    - [30, 0.0]
  - - [64, 21, 1, 21]
    - [24, 0.0]
  - - [35, 64, 1, 35]
    - [33, 0.0]
  - - [31, 64, 1, 31]
    - [51, 0.0]
  - - [21, 64, 1, 17]
    - [33, 0.0]
  - - [64, 15, 1, 15]
    - [26, 0.0]
  - - [64, 17, 1, 17]
    - [24, 0.0]
  - - [17, 64, 1, 17]
    - [30, 0.0]
  - - [64, 34, 1, 34]
    - [83, 0.0]
  - - [15, 64, 1, 14]
    - [27, 0.0]
  - - [24, 64, 1, 24]
    - [33, 0.0]
  - - [64, 14, 1, 14]
    - [27, 0.0]
  - - [15, 64, 1, 15]
    - [23, 0.0]
  - - [64, 15, 1, 14]
    - [28, 0.0]
  - - [34, 64, 1, 34]
    - [124, 0.0]
  - - [32, 64, 1, 35]
    - [123, 0.0]
  - - [64, 21, 1, 17]
    - [119, 0.0]
  - - [64, 32, 1, 35]
    - [123, 0.0]
  - - [21, 64, 1, 21]
    - [121, 0.0]
  - - [64, 30, 1, 31]
    - [123, 0.0]
  - - [15, 64, 1, 15]
    - [114, 0.0]
  - - [64, 24, 1, 24]
    - [123, 0.0]
  - - [17, 64, 1, 15]
    - [142, 0.0]
  - - [64, 35, 1, 35]
    - [119, 0.0]
  - - [32, 64, 1, 32]
    - [124, 0.0]
  - - [64, 34, 1, 24]
    - [123, 0.0]
  - - [64, 15, 1, 15]
    - [117, 0.0]
  - - [30, 64, 1, 30]
    - [164, 0.0]
  - - [30, 64, 1, 31]
    - [142, 0.0]
  - - [34, 64, 1, 24]
    - [168, 0.0]
  - - [64, 30, 1, 30]
    - [123, 0.0]
  - - [14, 64, 1, 14]
    - [114, 0.0]
  - - [64, 17, 1, 17]
    - [115, 0.0]
  - - [64, 17, 1, 15]
    - [115, 0.0]
  - - [64, 32, 1, 32]
    - [120, 0.0]
  - - [64, 31, 1, 31]
    - [123, 0.0]
  - - [17, 64, 1, 17]
    - [121, 0.0]
  - - [64, 21, 1, 21]
    - [115, 0.0]
  - - [35, 64, 1, 35]
    - [124, 0.0]
  - - [31, 64, 1, 31]
    - [142, 0.0]
  - - [21, 64, 1, 17]
    - [124, 0.0]
  - - [64, 15, 1, 15]
    - [117, 0.0]
  - - [64, 17, 1, 17]
    - [115, 0.0]
  - - [17, 64, 1, 17]
    - [121, 0.0]
  - - [64, 34, 1, 34]
    - [174, 0.0]
  - - [15, 64, 1, 14]
    - [118, 0.0]
  - - [24, 64, 1, 24]
    - [124, 0.0]
  - - [64, 14, 1, 14]
    - [118, 0.0]
  - - [15, 64, 1, 15]
    - [114, 0.0]
  - - [64, 15, 1, 14]
    - [119, 0.0]
  - - [64, 128, 512, 128]
    - [231, 15.701]
  - - [64, 512, 1, 512]
    - [191, 1.892]
  - - [64, 512, 64, 512]
    - [215, 23.868]
  - - [128, 64, 512, 128]
    - [196, 16.052]
  - - [512, 64, 1, 512]
    - [207, 1.869]
  - - [512, 64, 64, 512]
    - [279, 21.703]
  - - [1024, 2, 1, 4]
    - [182, 0.001]
  - - [1024, 2, 1, 32]
    - [200, 0.011]
  - - [1024, 2, 1, 2048]
    - [185, 0.191]
  - - [1024, 1024, 1, 4]
    - [204, 0.553]
  - - [1024, 1024, 1, 32]
    - [197, 4.422]
  - - [1024, 1024, 1, 2048]
    - [267, 27.493]
  - - [1024, 1024, 1, 4096]
    - [267, 29.042]
  - - [1024, 4096, 1, 2048]
    - [319, 38.316]
  - - [1024, 4096, 1, 4096]
    - [272, 39.042]
  - - [1024, 30528, 1, 2048]
    - [270, 45.468]
  - - [1024, 30528, 1, 4096]
    - [252, 46.731]
  - - [4096, 1024, 1, 2048]
    - [316, 38.611]
  - - [4096, 1024, 1, 4096]
    - [254, 39.377]
  - - [3, 64, 512, 3]
    - [198, 0.034]
  - - [5, 64, 512, 5]
    - [187, 0.098]
  - - [5, 64, 960, 5]
    - [199, 0.144]
  - - [9, 64, 512, 9]
    - [194, 0.307]
  - - [13, 512, 1, 32768]
    - [223, 0.629]
  - - [27, 128, 32768, 27]
    - [273, 5.157]
  - - [33, 32, 200, 33]
    - [189, 0.932]
  - - [33, 32, 1600, 33]
    - [183, 2.35]
  - - [67, 2048, 1, 512]
    - [211, 5.572]
  - - [74, 2048, 1, 512]
    - [230, 6.102]
  - - [74, 2048, 1, 960]
    - [296, 8.009]
  - - [100, 2048, 1, 512]
    - [192, 7.111]
  - - [256, 128, 1, 32768]
    - [210, 3.427]
  - - [256, 1280, 1, 8976]
    - [278, 23.034]
  - - [256, 2560, 1, 8976]
    - [284, 30.066]
  - - [256, 2816, 1, 8976]
    - [317, 32.697]
  - - [256, 3328, 1, 8976]
    - [282, 38.435]
  - - [256, 3584, 1, 8976]
    - [282, 41.192]
  - - [256, 3840, 1, 8976]
    - [288, 43.645]
  - - [256, 4096, 1, 8976]
    - [261, 29.321]
  - - [256, 4352, 1, 8976]
    - [242, 31.93]
  - - [256, 4864, 1, 8976]
    - [242, 35.517]
  - - [256, 5120, 1, 8976]
    - [261, 36.823]
  - - [256, 5632, 1, 8976]
    - [240, 36.79]
  - - [256, 5888, 1, 8976]
    - [188, 36.021]
  - - [256, 6144, 1, 8976]
    - [188, 37.534]
  - - [256, 7168, 1, 8976]
    - [188, 43.384]
  - - [256, 8192, 1, 8976]
    - [202, 33.574]
  - - [256, 8960, 1, 8976]
    - [190, 37.089]
  - - [256, 9728, 1, 8976]
    - [247, 38.419]
  - - [256, 9984, 1, 8976]
    - [284, 39.423]
  - - [256, 10240, 1, 8976]
    - [243, 40.263]
  - - [256, 10496, 1, 8976]
    - [221, 41.3]
  - - [256, 11008, 1, 8976]
    - [284, 42.914]
  - - [256, 11264, 1, 8976]
    - [282, 43.945]
  - - [256, 11520, 1, 8976]
    - [265, 44.126]
  - - [256, 11776, 1, 8976]
    - [219, 38.497]
  - - [256, 12544, 1, 8976]
    - [255, 39.185]
  - - [256, 12800, 1, 8976]
    - [219, 39.886]
  - - [256, 13312, 1, 8976]
    - [252, 41.404]
  - - [256, 13568, 1, 8976]
    - [326, 42.187]
  - - [256, 14336, 1, 8976]
    - [237, 44.44]
  - - [256, 14848, 1, 8976]
    - [216, 45.929]
  - - [256, 15104, 1, 8976]
    - [235, 46.66]
  - - [256, 15872, 1, 8976]
    - [242, 40.297]
  - - [256, 16128, 1, 8976]
    - [190, 40.918]
  - - [256, 17152, 1, 8976]
    - [227, 41.405]
  - - [256, 17408, 1, 8976]
    - [247, 42.042]
  - - [256, 18688, 1, 8976]
    - [227, 44.662]
  - - [256, 19968, 1, 8976]
    - [205, 41.523]
  - - [256, 20480, 1, 8976]
    - [260, 42.51]
  - - [256, 20992, 1, 8976]
    - [205, 43.543]
  - - [256, 21248, 1, 8976]
    - [224, 44.074]
  - - [256, 22016, 1, 8976]
    - [218, 45.575]
  - - [256, 26112, 1, 8976]
    - [222, 44.682]
  - - [256, 32512, 1, 8976]
    - [247, 44.099]
  - - [256, 32768, 1, 1]
    - [195, 0.391]
  - - [256, 33536, 1, 8976]
    - [221, 45.345]
  - - [256, 44505, 1, 8976]
    - [249, 46.016]
  - - [257, 4096, 1, 1024]
    - [229, 20.799]
  - - [480, 1024, 1, 32768]
    - [269, 26.158]
  - - [512, 32, 1, 200]
    - [292, 0.398]
  - - [512, 32, 1, 1600]
    - [251, 1.593]
  - - [512, 256, 1, 32768]
    - [217, 11.112]
  - - [512, 512, 1, 200]
    - [290, 5.22]
  - - [512, 512, 1, 1600]
    - [297, 15.097]
  - - [512, 2048, 1, 256]
    - [280, 16.103]
  - - [560, 1024, 1, 200]
    - [239, 8.798]
  - - [560, 1024, 1, 1600]
    - [248, 20.493]
  - - [768, 2048, 1, 256]
    - [327, 22.036]
  - - [1024, 64, 1, 512]
    - [207, 3.738]
  - - [1024, 64, 1, 960]
    - [286, 5.12]
  - - [1024, 256, 1, 1024]
    - [206, 12.624]
  - - [1024, 256, 1, 1280]
    - [202, 13.895]
  - - [1024, 256, 1, 2304]
    - [283, 15.833]
  - - [1024, 256, 1, 2816]
    - [203, 16.37]
  - - [1024, 256, 1, 3072]
    - [228, 16.636]
  - - [1024, 256, 1, 3328]
    - [281, 16.103]
  - - [1024, 256, 1, 3584]
    - [202, 15.957]
  - - [1024, 256, 1, 4096]
    - [228, 17.236]
  - - [1024, 256, 1, 4352]
    - [226, 17.332]
  - - [1024, 256, 1, 4608]
    - [258, 17.392]
  - - [1024, 256, 1, 5120]
    - [285, 17.592]
  - - [1024, 256, 1, 5376]
    - [285, 17.703]
  - - [1024, 256, 1, 5632]
    - [285, 17.897]
  - - [1024, 256, 1, 6144]
    - [301, 17.943]
  - - [1024, 256, 1, 6400]
    - [250, 18.214]
  - - [1024, 256, 1, 7680]
    - [285, 18.239]
  - - [1024, 256, 1, 7936]
    - [250, 18.35]
  - - [1024, 256, 1, 8192]
    - [321, 18.404]
  - - [1024, 256, 1, 8448]
    - [301, 18.488]
  - - [1024, 256, 1, 9728]
    - [294, 18.717]
  - - [1024, 256, 1, 9984]
    - [250, 18.855]
  - - [1024, 256, 1, 10496]
    - [250, 18.795]
  - - [1024, 256, 1, 11520]
    - [312, 18.891]
  - - [1024, 256, 1, 12032]
    - [250, 19.105]
  - - [1024, 256, 1, 13568]
    - [285, 19.163]
  - - [1024, 256, 1, 14336]
    - [304, 19.25]
  - - [1024, 256, 1, 14848]
    - [225, 19.417]
  - - [1024, 256, 1, 15104]
    - [250, 19.309]
  - - [1024, 256, 1, 15872]
    - [250, 19.343]
  - - [1024, 256, 1, 16128]
    - [225, 19.338]
  - - [1024, 256, 1, 17152]
    - [285, 19.408]
  - - [1024, 256, 1, 17408]
    - [225, 19.474]
  - - [1024, 256, 1, 18944]
    - [225, 19.551]
  - - [1024, 256, 1, 19712]
    - [285, 19.444]
  - - [1024, 256, 1, 19968]
    - [301, 19.532]
  - - [1024, 256, 1, 21248]
    - [225, 19.648]
  - - [1024, 256, 1, 21504]
    - [225, 19.67]
  - - [1024, 256, 1, 22016]
    - [285, 19.554]
  - - [1024, 256, 1, 28672]
    - [225, 19.675]
  - - [1024, 256, 1, 33536]
    - [250, 19.739]
  - - [1024, 512, 1, 32768]
    - [295, 25.753]
  - - [1024, 1024, 1, 200]
    - [245, 12.828]
  - - [1024, 1024, 1, 512]
    - [297, 19.858]
  - - [1024, 1024, 1, 960]
    - [307, 24.031]
  - - [1024, 1024, 1, 1600]
    - [304, 26.255]
  - - [1024, 1024, 1, 32768]
    - [267, 30.088]
  - - [1600, 1024, 1, 512]
    - [314, 27.545]
  - - [1600, 1024, 1, 960]
    - [254, 31.452]
  - - [2048, 256, 1, 1024]
    - [291, 17.88]
  - - [2048, 960, 1, 1]
    - [236, 0.242]
  - - [2048, 2048, 1, 512]
    - [318, 32.892]
  - - [2048, 2048, 1, 960]
    - [318, 36.302]
  - - [2048, 2048, 1, 1024]
    - [318, 36.375]
  - - [3200, 2048, 1, 1024]
    - [262, 40.336]
  - - [4096, 4096, 1, 1024]
    - [323, 42.187]
  - - [14, 64, 10880, 14]
    - [238, 1.687]
  - - [15, 64, 10880, 14]
    - [199, 1.768]
  - - [15, 64, 7680, 15]
    - [306, 1.807]
  - - [15, 64, 10880, 15]
    - [199, 1.88]
  - - [17, 64, 7680, 15]
    - [289, 2.012]
  - - [17, 64, 6144, 17]
    - [184, 2.03]
  - - [17, 64, 7680, 17]
    - [187, 2.123]
  - - [21, 64, 6144, 17]
    - [299, 2.367]
  - - [21, 64, 6144, 21]
    - [305, 2.872]
  - - [24, 64, 4736, 24]
    - [322, 3.447]
  - - [30, 64, 2048, 30]
    - [244, 3.887]
  - - [30, 64, 2048, 31]
    - [212, 3.934]
  - - [31, 64, 2048, 31]
    - [212, 3.852]
  - - [32, 64, 4608, 32]
    - [305, 7.321]
  - - [32, 64, 4608, 35]
    - [220, 5.6]
  - - [34, 64, 4736, 24]
    - [287, 3.936]
  - - [34, 64, 4736, 34]
    - [195, 4.612]
  - - [35, 64, 4608, 35]
    - [277, 4.562]
  - - [64, 14, 10880, 14]
    - [320, 1.321]
  - - [64, 15, 10880, 14]
    - [266, 1.362]
  - - [64, 15, 7680, 15]
    - [209, 1.416]
  - - [64, 15, 10880, 15]
    - [303, 1.463]
  - - [64, 17, 7680, 15]
    - [275, 1.543]
  - - [64, 17, 6144, 17]
    - [208, 1.568]
  - - [64, 17, 7680, 17]
    - [209, 1.605]
  - - [64, 21, 6144, 17]
    - [259, 1.848]
  - - [64, 21, 6144, 21]
    - [293, 2.248]
  - - [64, 24, 4736, 24]
    - [287, 2.778]
  - - [64, 30, 2048, 30]
    - [298, 3.084]
  - - [64, 30, 2048, 31]
    - [195, 3.108]
  - - [64, 31, 2048, 31]
    - [214, 3.16]
  - - [64, 32, 4608, 32]
    - [300, 7.048]
  - - [64, 32, 4608, 35]
    - [276, 5.59]
  - - [64, 34, 4736, 24]
    - [298, 3.764]
  - - [64, 34, 4736, 34]
    - [186, 4.504]
  - - [64, 35, 4608, 35]
    - [275, 4.625]
  - - [1024, 1024, 1, 3840]
    - [321, 29.03]
  - - [1024, 1024, 1, 3968]
    - [304, 28.929]
  - - [1024, 1024, 1, 6528]
    - [267, 29.739]
  - - [1024, 1024, 1, 7104]
    - [267, 29.944]
  - - [1024, 1024, 1, 7200]
    - [321, 29.063]
  - - [1024, 1024, 1, 8064]
    - [267, 30.019]
  - - [1024, 1024, 1, 8160]
    - [233, 29.288]
  - - [1024, 1024, 1, 9216]
    - [267, 30.075]
  - - [1024, 1024, 1, 9520]
    - [321, 29.377]
  - - [1024, 1024, 1, 10064]
    - [267, 29.63]
  - - [1024, 1024, 1, 10080]
    - [233, 29.483]
  - - [1024, 1024, 1, 10200]
    - [321, 29.551]
  - - [1024, 4096, 1, 3840]
    - [264, 39.068]
  - - [1024, 4096, 1, 3968]
    - [325, 39.074]
  - - [1024, 4096, 1, 6528]
    - [268, 39.252]
  - - [1024, 4096, 1, 7104]
    - [234, 39.429]
  - - [1024, 4096, 1, 7200]
    - [262, 39.317]
  - - [1024, 4096, 1, 8064]
    - [234, 39.655]
  - - [1024, 4096, 1, 8160]
    - [324, 39.237]
  - - [1024, 4096, 1, 9216]
    - [234, 39.892]
  - - [1024, 4096, 1, 9520]
    - [271, 39.206]
  - - [1024, 4096, 1, 10064]
    - [263, 39.162]
  - - [1024, 4096, 1, 10080]
    - [271, 39.487]
  - - [1024, 4096, 1, 10200]
    - [274, 39.14]
  - - [1024, 42720, 1, 3968]
    - [311, 46.271]
  - - [1024, 42720, 1, 6528]
    - [262, 46.28]
  - - [1024, 42720, 1, 7104]
    - [201, 46.392]
  - - [1024, 42720, 1, 7200]
    - [256, 46.422]
  - - [1024, 42720, 1, 9520]
    - [232, 46.576]
  - - [1024, 42720, 1, 10080]
    - [241, 46.626]
  - - [4096, 1024, 1, 3840]
    - [316, 39.262]
  - - [4096, 1024, 1, 3968]
    - [257, 39.311]
  - - [4096, 1024, 1, 6528]
    - [257, 39.616]
  - - [4096, 1024, 1, 7104]
    - [247, 39.541]
  - - [4096, 1024, 1, 7200]
    - [254, 39.727]
  - - [4096, 1024, 1, 8064]
    - [268, 39.561]
  - - [4096, 1024, 1, 8160]
    - [246, 39.459]
  - - [4096, 1024, 1, 9216]
    - [313, 39.717]
  - - [4096, 1024, 1, 9520]
    - [315, 39.247]
  - - [4096, 1024, 1, 10064]
    - [253, 39.31]
  - - [4096, 1024, 1, 10080]
    - [315, 39.574]
  - - [4096, 1024, 1, 10200]
    - [310, 39.259]
  - - [27, 64, 1920, 27]
    - [309, 3.275]
  - - [27, 64, 1920, 33]
    - [305, 3.57]
  - - [33, 64, 1920, 33]
    - [213, 3.548]
  - - [64, 27, 1920, 27]
    - [259, 2.525]
  - - [64, 27, 1920, 33]
    - [302, 2.903]
  - - [64, 33, 1920, 33]
    - [193, 3.716]
  - - [1024, 1024, 1, 3240]
    - [321, 26.989]
  - - [1024, 1024, 1, 3960]
    - [267, 27.424]
  - - [1024, 4096, 1, 3240]
    - [325, 38.306]
  - - [1024, 4096, 1, 3960]
    - [264, 38.342]
  - - [1024, 42720, 1, 3960]
    - [308, 45.984]
  - - [4096, 1024, 1, 3240]
    - [254, 38.398]
  - - [4096, 1024, 1, 3960]
    - [254, 38.589]
- null
