library/src/blas3/Tensile/Logic/asm_full/arcturus_Cijk_Ailk_Bjlk_4xi8BH.yaml
- {MinimumRequiredVersion: 4.6.0}
- arcturus
- gfx908
- [Device 7380, Device 7388, Device 738c, Device 7390]
    SolutionIndex: 0
    SolutionNameMin: Cijk_Ailk_Bjlk_4xi8BH_MT016x016x08_GRVW02_GSU01_SNLL0_TT02_02_VW02_WG08_08_01
    SolutionIndex: 1
    SolutionNameMin: Cijk_Ailk_Bjlk_4xi8BH_MT032x016x08_GRVW02_GSU01_SNLL0_TT02_02_VW02_WG16_08_01
    SolutionIndex: 2
    SolutionNameMin: Cijk_Ailk_Bjlk_4xi8BH_MT016x016x16_GRVW02_GSU01_SNLL0_TT02_02_VW02_WG08_08_01
    SolutionIndex: 3
    SolutionNameMin: Cijk_Ailk_Bjlk_4xi8BH_MT032x016x16_GRVW02_GSU01_SNLL0_TT02_02_VW02_WG16_08_01
    SolutionIndex: 4
    SolutionNameMin: Cijk_Ailk_Bjlk_4xi8BH_MT032x016x08_GRVW02_GSU02_SNLL0_TT04_02_VW02_WG08_08_02
    SolutionIndex: 5
    SolutionNameMin: Cijk_Ailk_Bjlk_4xi8BH_MT016x016x08_GRVW02_GSU04_SNLL0_TT02_02_VW02_WG08_08_02
    SolutionIndex: 6
    SolutionNameMin: Cijk_Ailk_Bjlk_4xi8BH_MT032x016x08_GRVW02_GSU04_SNLL0_TT04_02_VW02_WG08_08_02
    SolutionIndex: 7
    SolutionNameMin: Cijk_Ailk_Bjlk_4xi8BH_MT016x016x08_GRVW02_GSU08_SNLL0_TT02_02_VW02_WG08_08_02
    SolutionIndex: 8
    SolutionNameMin: Cijk_Ailk_Bjlk_4xi8BH_MT064x016x16_GRVW04_GSU02_SNLL0_TT04_04_VW04_WG16_04_04
    SolutionIndex: 9
    SolutionNameMin: Cijk_Ailk_Bjlk_4xi8BH_MT032x032x16_GRVW04_GSU02_SNLL0_TT04_04_VW04_WG08_08_02
    SolutionIndex: 10
    SolutionNameMin: Cijk_Ailk_Bjlk_4xi8BH_MT064x032x16_GRVW04_GSU02_SNLL0_TT08_04_VW04_WG08_08_02
    SolutionIndex: 11
    SolutionNameMin: Cijk_Ailk_Bjlk_4xi8BH_MT016x016x16_GRVW02_GSU02_SNLL0_TT02_02_VW02_WG08_08_04
    SolutionIndex: 12
    SolutionNameMin: Cijk_Ailk_Bjlk_4xi8BH_MT032x016x16_GRVW02_GSU02_SNLL0_TT04_02_VW02_WG08_08_04
    SolutionIndex: 13
    SolutionNameMin: Cijk_Ailk_Bjlk_4xi8BH_MT064x016x16_GRVW04_GSU02_SNLL0_TT04_04_VW04_WG16_04_04
    SolutionIndex: 14
    SolutionNameMin: Cijk_Ailk_Bjlk_4xi8BH_MT032x032x16_GRVW04_GSU02_SNLL0_TT04_04_VW04_WG08_08_02
    SolutionIndex: 15
    SolutionNameMin: Cijk_Ailk_Bjlk_4xi8BH_MT016x016x16_GRVW02_GSU04_SNLL0_TT02_02_VW02_WG08_08_04
    SolutionIndex: 16
    SolutionNameMin: Cijk_Ailk_Bjlk_4xi8BH_MT032x016x16_GRVW02_GSU04_SNLL0_TT04_02_VW02_WG08_08_04
    SolutionIndex: 17
    SolutionNameMin: Cijk_Ailk_Bjlk_4xi8BH_MT016x016x16_GRVW02_GSU08_SNLL0_TT02_02_VW02_WG08_08_04
    SolutionIndex: 18
    SolutionNameMin: Cijk_Ailk_Bjlk_4xi8BH_MT032x016x16_GRVW02_GSU08_SNLL0_TT04_02_VW02_WG08_08_04
    SolutionIndex: 19
    SolutionNameMin: Cijk_Ailk_Bjlk_4xi8BH_MT032x008x32_GRVW02_GSU02_SNLL0_TT02_02_VW02_WG16_04_04
    SolutionIndex: 20
    SolutionNameMin: Cijk_Ailk_Bjlk_4xi8BH_MT016x016x32_GRVW02_GSU02_SNLL0_TT02_02_VW02_WG08_08_04
    SolutionIndex: 21
    SolutionNameMin: Cijk_Ailk_Bjlk_4xi8BH_MT032x016x32_GRVW02_GSU02_SNLL0_TT04_02_VW02_WG08_08_04
    SolutionIndex: 22
    SolutionNameMin: Cijk_Ailk_Bjlk_4xi8BH_MT032x032x32_GRVW04_GSU02_SNLL0_TT04_04_VW04_WG08_08_04
    SolutionIndex: 23
    SolutionNameMin: Cijk_Ailk_Bjlk_4xi8BH_MT064x032x32_GRVW04_GSU02_SNLL0_TT08_04_VW04_WG08_08_04
    SolutionIndex: 24
    SolutionNameMin: Cijk_Ailk_Bjlk_4xi8BH_MT032x016x32_GRVW02_GSU02_SNLL0_TT04_02_VW02_WG08_08_04
    SolutionIndex: 25
    SolutionNameMin: Cijk_Ailk_Bjlk_4xi8BH_MT032x032x32_GRVW04_GSU02_SNLL0_TT04_04_VW04_WG08_08_04
    SolutionIndex: 26
    SolutionNameMin: Cijk_Ailk_Bjlk_4xi8BH_MT016x016x32_GRVW02_GSU04_SNLL0_TT02_02_VW02_WG08_08_04
    SolutionIndex: 27
    SolutionNameMin: Cijk_Ailk_Bjlk_4xi8BH_MT032x016x32_GRVW02_GSU04_SNLL0_TT04_02_VW02_WG08_08_04
    SolutionIndex: 28
    SolutionNameMin: Cijk_Ailk_Bjlk_4xi8BH_MT032x032x32_GRVW04_GSU04_SNLL0_TT04_04_VW04_WG08_08_04
    SolutionIndex: 29
    SolutionNameMin: Cijk_Ailk_Bjlk_4xi8BH_MT032x008x32_GRVW02_GSU04_SNLL0_TT02_02_VW02_WG16_04_04
    SolutionIndex: 30
    SolutionNameMin: Cijk_Ailk_Bjlk_4xi8BH_MT016x016x32_GRVW02_GSU04_SNLL0_TT02_02_VW02_WG08_08_04
    SolutionIndex: 31
    SolutionNameMin: Cijk_Ailk_Bjlk_4xi8BH_MT032x032x32_GRVW04_GSU04_SNLL0_TT04_04_VW04_WG08_08_04
    SolutionIndex: 32
    SolutionNameMin: Cijk_Ailk_Bjlk_4xi8BH_MT016x016x32_GRVW02_GSU08_SNLL0_TT02_02_VW02_WG08_08_04
    SolutionIndex: 33
    SolutionNameMin: Cijk_Ailk_Bjlk_4xi8BH_MT096x128x16_GRVW02_GSU01_SNLL0_TT06_08_VW02_WG16_16_01
    SolutionIndex: 34
    SolutionNameMin: Cijk_Ailk_Bjlk_4xi8BH_MT064x064x16_GRVW04_GSU01_SNLL1_TT04_04_VW04_WG16_16_01
    SolutionIndex: 35
    SolutionNameMin: Cijk_Ailk_Bjlk_4xi8BH_MT128x064x16_GRVW04_GSU01_SNLL1_TT08_04_VW04_WG16_16_01
    SolutionIndex: 36
    SolutionNameMin: Cijk_Ailk_Bjlk_4xi8BH_MT128x128x16_GRVW04_GSU01_SNLL1_TT08_08_VW04_WG16_16_01
    SolutionIndex: 37
    SolutionNameMin: Cijk_Ailk_Bjlk_4xi8BH_MT064x064x16_GRVW04_GSU01_SNLL1_TT04_04_VW04_WG16_16_01
    SolutionIndex: 38
    SolutionNameMin: Cijk_Ailk_Bjlk_4xi8BH_MT128x064x16_GRVW04_GSU01_SNLL1_TT08_04_VW04_WG16_16_01
    SolutionIndex: 39
    SolutionNameMin: Cijk_Ailk_Bjlk_4xi8BH_MT128x128x16_GRVW04_GSU01_SNLL1_TT08_08_VW04_WG16_16_01
    SolutionIndex: 40
    SolutionNameMin: Cijk_Ailk_Bjlk_4xi8BH_MT016x016x04_GRVW02_GSU01_SNLL0_TT02_02_VW02_WG08_08_01
    SolutionIndex: 41
    SolutionNameMin: Cijk_Ailk_Bjlk_4xi8BH_MT032x032x02_GRVW04_GSU01_SNLL0_TT04_04_VW04_WG08_08_01
    SolutionIndex: 42
    SolutionNameMin: Cijk_Ailk_Bjlk_4xi8BH_MT016x016x08_GRVW02_GSU01_SNLL1_TT02_02_VW02_WG08_08_02
    SolutionIndex: 43
    SolutionNameMin: Cijk_Ailk_Bjlk_4xi8BH_MT008x008x08_GRVW02_GSU01_SNLL1_TT02_02_VW02_WG04_04_04
    SolutionIndex: 44
    SolutionNameMin: Cijk_Ailk_Bjlk_4xi8BH_MT016x016x16_GRVW02_GSU01_SNLL1_TT02_02_VW02_WG08_08_04
    SolutionIndex: 45
    SolutionNameMin: Cijk_Ailk_Bjlk_4xi8BH_MT016x016x04_GRVW02_GSU08_SNLL0_TT02_02_VW02_WG08_08_01
    SolutionIndex: 46
    SolutionNameMin: Cijk_Ailk_Bjlk_4xi8BH_MT008x008x08_GRVW02_GSU08_SNLL0_TT02_02_VW02_WG04_04_04
    SolutionIndex: 47
    SolutionNameMin: Cijk_Ailk_Bjlk_4xi8BH_MT016x016x08_GRVW02_GSU16_SNLL0_TT02_02_VW02_WG08_08_02
    SolutionIndex: 48
    SolutionNameMin: Cijk_Ailk_Bjlk_4xi8BH_MT008x008x08_GRVW02_GSU16_SNLL0_TT02_02_VW02_WG04_04_04
    SolutionIndex: 49
    SolutionNameMin: Cijk_Ailk_Bjlk_4xi8BH_MT016x016x16_GRVW02_GSU16_SNLL0_TT02_02_VW02_WG08_08_04
- - - [1024, 128, 1, 128]
    - [2, 0.0]
  - - [4, 704, 1, 1280]
    - [17, 0.0]
  - - [4, 1856, 1, 3328]
    - [17, 0.0]
  - - [1856, 448, 1, 3328]
    - [34, 0.0]
  - - [2944, 4288, 1, 1280]
    - [37, 0.0]
  - - [2368, 64, 1, 3328]
    - [25, 0.0]
  - - [2368, 5888, 1, 256]
    - [34, 0.0]
  - - [128, 64, 1, 256]
    - [29, 0.0]
  - - [5888, 1024, 1, 1280]
    - [39, 0.0]
  - - [128, 6784, 1, 3328]
    - [34, 0.0]
  - - [64, 4, 1, 256]
    - [44, 0.0]
  - - [5888, 1856, 1, 3328]
    - [37, 0.0]
  - - [5056, 704, 1, 256]
    - [37, 0.0]
  - - [5888, 2944, 1, 3328]
    - [37, 0.0]
  - - [1856, 4288, 1, 256]
    - [34, 0.0]
  - - [1024, 5056, 1, 128]
    - [33, 0.0]
  - - [5056, 5056, 1, 3328]
    - [37, 0.0]
  - - [1408, 5888, 1, 1280]
    - [37, 0.0]
  - - [2368, 448, 1, 128]
    - [33, 0.0]
  - - [1024, 3584, 1, 3328]
    - [37, 0.0]
  - - [4, 2944, 1, 1280]
    - [44, 0.0]
  - - [1408, 64, 1, 128]
    - [2, 0.0]
  - - [256, 4288, 1, 3328]
    - [37, 0.0]
  - - [5888, 1408, 1, 1280]
    - [37, 0.0]
  - - [704, 1856, 1, 3328]
    - [37, 0.0]
  - - [4, 1408, 1, 128]
    - [40, 0.0]
  - - [1024, 2368, 1, 256]
    - [37, 0.0]
  - - [1408, 1856, 1, 1280]
    - [37, 0.0]
  - - [1408, 64, 1, 1280]
    - [25, 0.0]
  - - [448, 1024, 1, 1280]
    - [34, 0.0]
  - - [256, 1408, 1, 3328]
    - [34, 0.0]
  - - [5056, 5056, 1, 1280]
    - [37, 0.0]
  - - [448, 5056, 1, 256]
    - [34, 0.0]
  - - [704, 1856, 1, 1280]
    - [34, 0.0]
  - - [128, 5056, 1, 128]
    - [2, 0.0]
  - - [2368, 128, 1, 256]
    - [34, 0.0]
  - - [1856, 1408, 1, 128]
    - [33, 0.0]
  - - [64, 5056, 1, 256]
    - [34, 0.0]
  - - [6784, 256, 1, 3328]
    - [37, 0.0]
  - - [6784, 4288, 1, 3328]
    - [37, 0.0]
  - - [4288, 448, 1, 256]
    - [37, 0.0]
  - - [64, 704, 1, 128]
    - [2, 0.0]
  - - [1856, 2368, 1, 3328]
    - [37, 0.0]
  - - [4288, 2944, 1, 1280]
    - [37, 0.0]
  - - [704, 5056, 1, 1280]
    - [34, 0.0]
  - - [2368, 704, 1, 3328]
    - [34, 0.0]
  - - [256, 5888, 1, 256]
    - [34, 0.0]
  - - [1856, 4288, 1, 3328]
    - [37, 0.0]
  - - [256, 2944, 1, 256]
    - [34, 0.0]
  - - [5888, 1024, 1, 256]
    - [37, 0.0]
  - - [448, 64, 1, 1280]
    - [21, 0.0]
  - - [448, 5056, 1, 3328]
    - [34, 0.0]
  - - [3584, 4, 1, 1280]
    - [44, 0.0]
  - - [2944, 64, 1, 256]
    - [34, 0.0]
  - - [128, 4, 1, 1280]
    - [49, 0.0]
  - - [1408, 2944, 1, 256]
    - [37, 0.0]
  - - [256, 1856, 1, 1280]
    - [34, 0.0]
  - - [6784, 5056, 1, 3328]
    - [37, 0.0]
  - - [5056, 5056, 1, 256]
    - [37, 0.0]
  - - [1408, 6784, 1, 128]
    - [33, 0.0]
  - - [64, 1024, 1, 1280]
    - [22, 0.0]
  - - [2944, 4, 1, 256]
    - [44, 0.0]
  - - [704, 5056, 1, 128]
    - [33, 0.0]
  - - [4, 2368, 1, 1280]
    - [44, 0.0]
  - - [2368, 2944, 1, 1280]
    - [34, 0.0]
  - - [128, 3584, 1, 1280]
    - [37, 0.0]
  - - [6784, 6784, 1, 1280]
    - [39, 0.0]
  - - [1024, 256, 1, 3328]
    - [37, 0.0]
  - - [1408, 4288, 1, 1280]
    - [37, 0.0]
  - - [3584, 4288, 1, 1280]
    - [37, 0.0]
  - - [2368, 704, 1, 1280]
    - [37, 0.0]
  - - [5056, 4288, 1, 3328]
    - [37, 0.0]
  - - [3584, 2368, 1, 3328]
    - [37, 0.0]
  - - [64, 704, 1, 1280]
    - [21, 0.0]
  - - [4288, 256, 1, 256]
    - [34, 0.0]
  - - [2944, 128, 1, 128]
    - [2, 0.0]
  - - [6784, 448, 1, 1280]
    - [37, 0.0]
  - - [1408, 2944, 1, 128]
    - [33, 0.0]
  - - [4288, 2944, 1, 256]
    - [37, 0.0]
  - - [5888, 704, 1, 1280]
    - [37, 0.0]
  - - [1856, 64, 1, 1280]
    - [22, 0.0]
  - - [448, 5888, 1, 128]
    - [33, 0.0]
  - - [5888, 64, 1, 3328]
    - [23, 0.0]
  - - [2944, 256, 1, 3328]
    - [37, 0.0]
  - - [1024, 64, 1, 128]
    - [0, 0.0]
  - - [5056, 2368, 1, 1280]
    - [37, 0.0]
  - - [448, 3584, 1, 1280]
    - [37, 0.0]
  - - [6784, 5888, 1, 256]
    - [34, 0.0]
  - - [704, 1024, 1, 128]
    - [33, 0.0]
  - - [704, 128, 1, 1280]
    - [25, 0.0]
  - - [5888, 2944, 1, 128]
    - [33, 0.0]
  - - [4, 3584, 1, 128]
    - [40, 0.0]
  - - [1408, 448, 1, 1280]
    - [34, 0.0]
  - - [1024, 1408, 1, 256]
    - [37, 0.0]
  - - [2368, 2368, 1, 3328]
    - [37, 0.0]
  - - [1856, 6784, 1, 128]
    - [33, 0.0]
  - - [5056, 704, 1, 3328]
    - [37, 0.0]
  - - [1408, 1856, 1, 256]
    - [34, 0.0]
  - - [1408, 704, 1, 3328]
    - [37, 0.0]
  - - [2368, 5056, 1, 256]
    - [34, 0.0]
  - - [5888, 1856, 1, 256]
    - [37, 0.0]
  - - [4288, 64, 1, 3328]
    - [25, 0.0]
  - - [2368, 4, 1, 1280]
    - [5, 0.0]
  - - [704, 5888, 1, 256]
    - [34, 0.0]
  - - [4288, 64, 1, 256]
    - [37, 0.0]
  - - [6784, 64, 1, 256]
    - [34, 0.0]
  - - [2944, 256, 1, 256]
    - [34, 0.0]
  - - [2944, 6784, 1, 3328]
    - [37, 0.0]
  - - [704, 1408, 1, 3328]
    - [34, 0.0]
  - - [3584, 704, 1, 3328]
    - [37, 0.0]
  - - [2944, 256, 1, 128]
    - [33, 0.0]
  - - [6784, 4, 1, 1280]
    - [44, 0.0]
  - - [1024, 64, 1, 1280]
    - [12, 0.0]
  - - [448, 4288, 1, 256]
    - [34, 0.0]
  - - [64, 3584, 1, 3328]
    - [9, 0.0]
  - - [704, 2368, 1, 1280]
    - [37, 0.0]
  - - [448, 2944, 1, 128]
    - [33, 0.0]
  - - [1856, 2368, 1, 1280]
    - [37, 0.0]
  - - [2368, 128, 1, 3328]
    - [25, 0.0]
  - - [2944, 128, 1, 256]
    - [34, 0.0]
  - - [448, 1408, 1, 256]
    - [37, 0.0]
  - - [1856, 4288, 1, 1280]
    - [37, 0.0]
  - - [64, 5056, 1, 3328]
    - [22, 0.0]
  - - [4, 704, 1, 256]
    - [44, 0.0]
  - - [1024, 448, 1, 128]
    - [33, 0.0]
  - - [704, 4, 1, 1280]
    - [17, 0.0]
  - - [704, 256, 1, 128]
    - [33, 0.0]
  - - [704, 2944, 1, 128]
    - [33, 0.0]
  - - [1408, 1024, 1, 1280]
    - [37, 0.0]
  - - [704, 6784, 1, 256]
    - [34, 0.0]
  - - [6784, 704, 1, 256]
    - [37, 0.0]
  - - [5056, 1408, 1, 128]
    - [33, 0.0]
  - - [256, 3584, 1, 3328]
    - [34, 0.0]
  - - [4, 5888, 1, 3328]
    - [44, 0.0]
  - - [128, 1408, 1, 128]
    - [2, 0.0]
  - - [3584, 4288, 1, 3328]
    - [37, 0.0]
  - - [5888, 1856, 1, 1280]
    - [37, 0.0]
  - - [5056, 1024, 1, 3328]
    - [39, 0.0]
  - - [5056, 64, 1, 1280]
    - [37, 0.0]
  - - [1024, 704, 1, 256]
    - [37, 0.0]
  - - [1024, 4288, 1, 128]
    - [33, 0.0]
  - - [4288, 64, 1, 1280]
    - [25, 0.0]
  - - [2368, 3584, 1, 1280]
    - [37, 0.0]
  - - [2368, 6784, 1, 1280]
    - [37, 0.0]
  - - [1024, 256, 1, 256]
    - [37, 0.0]
  - - [1856, 4, 1, 1280]
    - [44, 0.0]
  - - [448, 448, 1, 256]
    - [34, 0.0]
  - - [2944, 3584, 1, 3328]
    - [37, 0.0]
  - - [128, 4288, 1, 128]
    - [2, 0.0]
  - - [64, 448, 1, 256]
    - [34, 0.0]
  - - [128, 1024, 1, 3328]
    - [8, 0.0]
  - - [4, 1408, 1, 3328]
    - [7, 0.0]
  - - [6784, 2944, 1, 256]
    - [34, 0.0]
  - - [64, 1856, 1, 1280]
    - [22, 0.0]
  - - [64, 1024, 1, 128]
    - [2, 0.0]
  - - [4288, 2368, 1, 3328]
    - [37, 0.0]
  - - [1856, 2368, 1, 256]
    - [34, 0.0]
  - - [3584, 256, 1, 128]
    - [33, 0.0]
  - - [3584, 6784, 1, 3328]
    - [37, 0.0]
  - - [256, 1024, 1, 256]
    - [37, 0.0]
  - - [4, 6784, 1, 3328]
    - [45, 0.0]
  - - [1024, 5888, 1, 3328]
    - [37, 0.0]
  - - [1024, 128, 1, 1280]
    - [4, 0.0]
  - - [4288, 128, 1, 1280]
    - [34, 0.0]
  - - [5056, 4288, 1, 1280]
    - [37, 0.0]
  - - [5888, 64, 1, 256]
    - [34, 0.0]
  - - [1856, 256, 1, 1280]
    - [34, 0.0]
  - - [64, 5888, 1, 3328]
    - [22, 0.0]
  - - [2944, 5888, 1, 128]
    - [33, 0.0]
  - - [704, 5888, 1, 1280]
    - [37, 0.0]
  - - [2368, 3584, 1, 128]
    - [33, 0.0]
  - - [6784, 5888, 1, 3328]
    - [39, 0.0]
  - - [704, 1024, 1, 1280]
    - [34, 0.0]
  - - [448, 256, 1, 3328]
    - [25, 0.0]
  - - [448, 1856, 1, 128]
    - [33, 0.0]
  - - [128, 1024, 1, 128]
    - [2, 0.0]
  - - [2944, 4, 1, 128]
    - [40, 0.0]
  - - [1024, 704, 1, 1280]
    - [37, 0.0]
  - - [128, 5888, 1, 256]
    - [34, 0.0]
  - - [1024, 5056, 1, 1280]
    - [37, 0.0]
  - - [4288, 1024, 1, 256]
    - [37, 0.0]
  - - [2944, 2368, 1, 128]
    - [33, 0.0]
  - - [704, 704, 1, 3328]
    - [34, 0.0]
  - - [704, 1408, 1, 1280]
    - [34, 0.0]
  - - [5888, 448, 1, 1280]
    - [37, 0.0]
  - - [3584, 256, 1, 3328]
    - [34, 0.0]
  - - [704, 5888, 1, 3328]
    - [34, 0.0]
  - - [704, 1856, 1, 128]
    - [33, 0.0]
  - - [128, 3584, 1, 3328]
    - [34, 0.0]
  - - [6784, 2368, 1, 1280]
    - [37, 0.0]
  - - [4, 4288, 1, 128]
    - [40, 0.0]
  - - [128, 704, 1, 1280]
    - [25, 0.0]
  - - [3584, 2944, 1, 256]
    - [34, 0.0]
  - - [1856, 128, 1, 3328]
    - [14, 0.0]
  - - [4, 64, 1, 1280]
    - [15, 0.0]
  - - [4, 5056, 1, 3328]
    - [44, 0.0]
  - - [128, 2944, 1, 1280]
    - [34, 0.0]
  - - [2368, 1024, 1, 3328]
    - [35, 0.0]
  - - [128, 256, 1, 3328]
    - [16, 0.0]
  - - [1408, 5056, 1, 3328]
    - [37, 0.0]
  - - [1856, 1856, 1, 3328]
    - [37, 0.0]
  - - [3584, 128, 1, 256]
    - [34, 0.0]
  - - [448, 1408, 1, 3328]
    - [34, 0.0]
  - - [2368, 2368, 1, 256]
    - [34, 0.0]
  - - [4288, 4288, 1, 1280]
    - [37, 0.0]
  - - [64, 448, 1, 1280]
    - [21, 0.0]
  - - [1408, 4288, 1, 256]
    - [34, 0.0]
  - - [448, 4, 1, 256]
    - [44, 0.0]
  - - [5888, 448, 1, 128]
    - [33, 0.0]
  - - [448, 4, 1, 1280]
    - [7, 0.0]
  - - [704, 6784, 1, 3328]
    - [37, 0.0]
  - - [5888, 5888, 1, 1280]
    - [37, 0.0]
  - - [5056, 1024, 1, 1280]
    - [39, 0.0]
  - - [448, 5888, 1, 3328]
    - [34, 0.0]
  - - [128, 4, 1, 128]
    - [40, 0.0]
  - - [1024, 2944, 1, 1280]
    - [37, 0.0]
  - - [5056, 5888, 1, 1280]
    - [37, 0.0]
  - - [4288, 5888, 1, 128]
    - [33, 0.0]
  - - [256, 3584, 1, 256]
    - [34, 0.0]
  - - [1408, 3584, 1, 128]
    - [33, 0.0]
  - - [256, 2944, 1, 3328]
    - [34, 0.0]
  - - [448, 3584, 1, 128]
    - [33, 0.0]
  - - [5888, 2944, 1, 1280]
    - [37, 0.0]
  - - [4, 6784, 1, 1280]
    - [42, 0.0]
  - - [2368, 5888, 1, 128]
    - [33, 0.0]
  - - [64, 2944, 1, 128]
    - [2, 0.0]
  - - [3584, 5888, 1, 256]
    - [37, 0.0]
  - - [2368, 704, 1, 128]
    - [33, 0.0]
  - - [3584, 2944, 1, 1280]
    - [37, 0.0]
  - - [3584, 2368, 1, 128]
    - [33, 0.0]
  - - [5056, 704, 1, 128]
    - [33, 0.0]
  - - [448, 2368, 1, 128]
    - [33, 0.0]
  - - [5056, 1408, 1, 3328]
    - [39, 0.0]
  - - [1408, 704, 1, 256]
    - [34, 0.0]
  - - [6784, 1024, 1, 3328]
    - [37, 0.0]
  - - [6784, 2944, 1, 3328]
    - [37, 0.0]
  - - [2944, 5056, 1, 3328]
    - [37, 0.0]
  - - [1856, 1856, 1, 256]
    - [34, 0.0]
  - - [1024, 5888, 1, 128]
    - [33, 0.0]
  - - [2048, 7133, 1, 2048]
    - [36, 0.0]
  - - [256, 4, 1, 128]
    - [40, 0.0]
  - - [4288, 5888, 1, 1280]
    - [37, 0.0]
  - - [4288, 4288, 1, 256]
    - [34, 0.0]
  - - [448, 2944, 1, 3328]
    - [34, 0.0]
  - - [4288, 1856, 1, 1280]
    - [37, 0.0]
  - - [1856, 2944, 1, 3328]
    - [37, 0.0]
  - - [256, 6784, 1, 3328]
    - [34, 0.0]
  - - [64, 5888, 1, 256]
    - [34, 0.0]
  - - [256, 5056, 1, 128]
    - [33, 0.0]
  - - [5056, 1024, 1, 256]
    - [37, 0.0]
  - - [704, 64, 1, 3328]
    - [28, 0.0]
  - - [5056, 1856, 1, 3328]
    - [34, 0.0]
  - - [4, 2944, 1, 3328]
    - [7, 0.0]
  - - [4, 5056, 1, 256]
    - [44, 0.0]
  - - [1856, 1408, 1, 256]
    - [34, 0.0]
  - - [3584, 4, 1, 128]
    - [40, 0.0]
  - - [448, 448, 1, 3328]
    - [25, 0.0]
  - - [6784, 128, 1, 3328]
    - [37, 0.0]
  - - [4288, 1408, 1, 128]
    - [33, 0.0]
  - - [4288, 5056, 1, 256]
    - [34, 0.0]
  - - [1408, 128, 1, 1280]
    - [25, 0.0]
  - - [5056, 256, 1, 3328]
    - [37, 0.0]
  - - [704, 704, 1, 256]
    - [34, 0.0]
  - - [1024, 5888, 1, 1280]
    - [37, 0.0]
  - - [6784, 2368, 1, 128]
    - [33, 0.0]
  - - [4, 5056, 1, 1280]
    - [44, 0.0]
  - - [64, 128, 1, 256]
    - [34, 0.0]
  - - [128, 1856, 1, 1280]
    - [34, 0.0]
  - - [5056, 3584, 1, 256]
    - [37, 0.0]
  - - [1856, 1024, 1, 1280]
    - [34, 0.0]
  - - [6784, 4288, 1, 1280]
    - [37, 0.0]
  - - [1856, 1856, 1, 1280]
    - [34, 0.0]
  - - [6784, 2944, 1, 128]
    - [33, 0.0]
  - - [1408, 5056, 1, 1280]
    - [34, 0.0]
  - - [4, 2368, 1, 3328]
    - [15, 0.0]
  - - [5888, 1856, 1, 128]
    - [33, 0.0]
  - - [448, 704, 1, 1280]
    - [37, 0.0]
  - - [2368, 1024, 1, 128]
    - [33, 0.0]
  - - [1024, 448, 1, 3328]
    - [34, 0.0]
  - - [1856, 704, 1, 1280]
    - [34, 0.0]
  - - [5056, 3584, 1, 128]
    - [33, 0.0]
  - - [5888, 5888, 1, 3328]
    - [37, 0.0]
  - - [6784, 1024, 1, 256]
    - [37, 0.0]
  - - [2944, 2368, 1, 256]
    - [34, 0.0]
  - - [256, 448, 1, 256]
    - [34, 0.0]
  - - [5056, 5888, 1, 3328]
    - [39, 0.0]
  - - [1856, 1024, 1, 256]
    - [34, 0.0]
  - - [448, 1408, 1, 1280]
    - [37, 0.0]
  - - [3584, 448, 1, 1280]
    - [37, 0.0]
  - - [1024, 1024, 1, 1280]
    - [37, 0.0]
  - - [448, 5888, 1, 256]
    - [34, 0.0]
  - - [704, 64, 1, 128]
    - [2, 0.0]
  - - [1408, 6784, 1, 3328]
    - [37, 0.0]
  - - [448, 1024, 1, 128]
    - [33, 0.0]
  - - [4288, 704, 1, 128]
    - [33, 0.0]
  - - [128, 1856, 1, 128]
    - [2, 0.0]
  - - [448, 2368, 1, 3328]
    - [34, 0.0]
  - - [5056, 64, 1, 128]
    - [2, 0.0]
  - - [5056, 2944, 1, 256]
    - [34, 0.0]
  - - [6784, 5888, 1, 128]
    - [33, 0.0]
  - - [704, 1024, 1, 256]
    - [34, 0.0]
  - - [1024, 4, 1, 256]
    - [44, 0.0]
  - - [2368, 1856, 1, 256]
    - [34, 0.0]
  - - [128, 6784, 1, 1280]
    - [37, 0.0]
  - - [1408, 3584, 1, 3328]
    - [37, 0.0]
  - - [2368, 6784, 1, 256]
    - [34, 0.0]
  - - [5056, 1408, 1, 1280]
    - [37, 0.0]
  - - [256, 256, 1, 128]
    - [0, 0.0]
  - - [5056, 4288, 1, 128]
    - [33, 0.0]
  - - [1408, 1856, 1, 128]
    - [33, 0.0]
  - - [1408, 5888, 1, 3328]
    - [39, 0.0]
  - - [1856, 256, 1, 256]
    - [34, 0.0]
  - - [6784, 6784, 1, 256]
    - [36, 0.0]
  - - [64, 256, 1, 128]
    - [1, 0.0]
  - - [4288, 2368, 1, 128]
    - [33, 0.0]
  - - [1856, 4288, 1, 128]
    - [33, 0.0]
  - - [256, 4288, 1, 1280]
    - [34, 0.0]
  - - [2368, 2944, 1, 256]
    - [34, 0.0]
  - - [4, 1856, 1, 256]
    - [44, 0.0]
  - - [3584, 1856, 1, 1280]
    - [37, 0.0]
  - - [6784, 6784, 1, 128]
    - [33, 0.0]
  - - [256, 1856, 1, 128]
    - [33, 0.0]
  - - [704, 64, 1, 1280]
    - [21, 0.0]
  - - [5888, 5056, 1, 256]
    - [34, 0.0]
  - - [3584, 448, 1, 256]
    - [34, 0.0]
  - - [448, 4288, 1, 128]
    - [33, 0.0]
  - - [2944, 4288, 1, 3328]
    - [37, 0.0]
  - - [256, 6784, 1, 256]
    - [34, 0.0]
  - - [1408, 4288, 1, 128]
    - [33, 0.0]
  - - [2944, 704, 1, 3328]
    - [37, 0.0]
  - - [128, 448, 1, 256]
    - [34, 0.0]
  - - [512, 32, 1, 512]
    - [20, 0.0]
  - - [3584, 3584, 1, 256]
    - [37, 0.0]
  - - [448, 1408, 1, 128]
    - [33, 0.0]
  - - [128, 256, 1, 1280]
    - [24, 0.0]
  - - [3584, 5056, 1, 256]
    - [34, 0.0]
  - - [6784, 128, 1, 256]
    - [34, 0.0]
  - - [4288, 4, 1, 256]
    - [44, 0.0]
  - - [64, 1408, 1, 3328]
    - [22, 0.0]
  - - [704, 448, 1, 256]
    - [34, 0.0]
  - - [2944, 2368, 1, 1280]
    - [37, 0.0]
  - - [448, 64, 1, 3328]
    - [27, 0.0]
  - - [1408, 3584, 1, 256]
    - [34, 0.0]
  - - [3584, 4, 1, 3328]
    - [15, 0.0]
  - - [6784, 3584, 1, 256]
    - [37, 0.0]
  - - [256, 128, 1, 128]
    - [1, 0.0]
  - - [704, 1408, 1, 128]
    - [33, 0.0]
  - - [4, 2368, 1, 256]
    - [44, 0.0]
  - - [2944, 448, 1, 128]
    - [33, 0.0]
  - - [128, 1408, 1, 256]
    - [37, 0.0]
  - - [4, 2944, 1, 256]
    - [44, 0.0]
  - - [64, 128, 1, 3328]
    - [17, 0.0]
  - - [5056, 2368, 1, 128]
    - [33, 0.0]
  - - [2944, 2944, 1, 3328]
    - [37, 0.0]
  - - [5056, 6784, 1, 256]
    - [34, 0.0]
  - - [1856, 3584, 1, 128]
    - [33, 0.0]
  - - [128, 2944, 1, 128]
    - [2, 0.0]
  - - [1024, 704, 1, 3328]
    - [37, 0.0]
  - - [6784, 448, 1, 256]
    - [34, 0.0]
  - - [3584, 6784, 1, 128]
    - [33, 0.0]
  - - [128, 4288, 1, 256]
    - [34, 0.0]
  - - [704, 448, 1, 3328]
    - [34, 0.0]
  - - [1024, 1024, 1, 3328]
    - [35, 0.0]
  - - [128, 128, 1, 3328]
    - [30, 0.0]
  - - [5056, 1856, 1, 256]
    - [37, 0.0]
  - - [256, 128, 1, 256]
    - [34, 0.0]
  - - [1024, 1856, 1, 256]
    - [37, 0.0]
  - - [4288, 64, 1, 128]
    - [2, 0.0]
  - - [256, 448, 1, 3328]
    - [25, 0.0]
  - - [1408, 6784, 1, 1280]
    - [37, 0.0]
  - - [3584, 3584, 1, 1280]
    - [37, 0.0]
  - - [64, 2368, 1, 1280]
    - [9, 0.0]
  - - [448, 2368, 1, 1280]
    - [37, 0.0]
  - - [5888, 5888, 1, 128]
    - [33, 0.0]
  - - [64, 6784, 1, 3328]
    - [34, 0.0]
  - - [2944, 256, 1, 1280]
    - [37, 0.0]
  - - [5056, 5888, 1, 128]
    - [33, 0.0]
  - - [256, 2368, 1, 128]
    - [33, 0.0]
  - - [5056, 2368, 1, 3328]
    - [37, 0.0]
  - - [2944, 4288, 1, 256]
    - [37, 0.0]
  - - [1408, 3584, 1, 1280]
    - [37, 0.0]
  - - [2368, 64, 1, 256]
    - [34, 0.0]
  - - [64, 448, 1, 3328]
    - [31, 0.0]
  - - [256, 256, 1, 3328]
    - [22, 0.0]
  - - [5888, 4, 1, 128]
    - [40, 0.0]
  - - [1856, 704, 1, 256]
    - [34, 0.0]
  - - [4, 4288, 1, 1280]
    - [44, 0.0]
  - - [1408, 448, 1, 3328]
    - [37, 0.0]
  - - [1024, 4, 1, 3328]
    - [15, 0.0]
  - - [2368, 256, 1, 256]
    - [34, 0.0]
  - - [2368, 6784, 1, 3328]
    - [37, 0.0]
  - - [1856, 1408, 1, 1280]
    - [37, 0.0]
  - - [1856, 448, 1, 1280]
    - [34, 0.0]
  - - [6784, 704, 1, 128]
    - [33, 0.0]
  - - [4, 4, 1, 256]
    - [44, 0.0]
  - - [128, 5888, 1, 128]
    - [2, 0.0]
  - - [1408, 5888, 1, 256]
    - [34, 0.0]
  - - [704, 2944, 1, 1280]
    - [37, 0.0]
  - - [1856, 2368, 1, 128]
    - [33, 0.0]
  - - [4096, 7133, 1, 4096]
    - [36, 0.0]
  - - [256, 64, 1, 256]
    - [20, 0.0]
  - - [1024, 1024, 1, 256]
    - [37, 0.0]
  - - [704, 1856, 1, 256]
    - [37, 0.0]
  - - [128, 4288, 1, 3328]
    - [22, 0.0]
  - - [3584, 704, 1, 1280]
    - [37, 0.0]
  - - [256, 128, 1, 1280]
    - [6, 0.0]
  - - [2368, 4, 1, 256]
    - [44, 0.0]
  - - [256, 2368, 1, 1280]
    - [34, 0.0]
  - - [2944, 6784, 1, 128]
    - [33, 0.0]
  - - [3584, 448, 1, 3328]
    - [37, 0.0]
  - - [1408, 4, 1, 256]
    - [44, 0.0]
  - - [704, 2368, 1, 3328]
    - [37, 0.0]
  - - [2944, 448, 1, 256]
    - [34, 0.0]
  - - [1856, 448, 1, 128]
    - [33, 0.0]
  - - [2368, 128, 1, 1280]
    - [25, 0.0]
  - - [256, 5888, 1, 128]
    - [33, 0.0]
  - - [64, 6784, 1, 256]
    - [34, 0.0]
  - - [64, 5056, 1, 1280]
    - [34, 0.0]
  - - [4, 6784, 1, 128]
    - [40, 0.0]
  - - [2944, 2944, 1, 1280]
    - [37, 0.0]
  - - [5888, 2368, 1, 256]
    - [34, 0.0]
  - - [4, 3584, 1, 1280]
    - [44, 0.0]
  - - [1408, 128, 1, 128]
    - [2, 0.0]
  - - [6784, 704, 1, 3328]
    - [37, 0.0]
  - - [128, 64, 1, 1280]
    - [30, 0.0]
  - - [2368, 256, 1, 1280]
    - [34, 0.0]
  - - [4, 448, 1, 3328]
    - [49, 0.0]
  - - [5888, 4288, 1, 128]
    - [33, 0.0]
  - - [4, 5888, 1, 256]
    - [44, 0.0]
  - - [1408, 2944, 1, 3328]
    - [37, 0.0]
  - - [3584, 704, 1, 128]
    - [33, 0.0]
  - - [64, 1024, 1, 256]
    - [37, 0.0]
  - - [5056, 5056, 1, 128]
    - [33, 0.0]
  - - [2368, 448, 1, 1280]
    - [34, 0.0]
  - - [128, 3584, 1, 256]
    - [34, 0.0]
  - - [704, 448, 1, 1280]
    - [34, 0.0]
  - - [448, 5056, 1, 128]
    - [33, 0.0]
  - - [256, 4, 1, 1280]
    - [17, 0.0]
  - - [128, 5056, 1, 256]
    - [34, 0.0]
  - - [1408, 5056, 1, 128]
    - [33, 0.0]
  - - [2944, 3584, 1, 128]
    - [33, 0.0]
  - - [3584, 2368, 1, 256]
    - [34, 0.0]
  - - [5888, 5056, 1, 1280]
    - [37, 0.0]
  - - [2368, 5056, 1, 128]
    - [33, 0.0]
  - - [64, 704, 1, 256]
    - [34, 0.0]
  - - [4288, 256, 1, 1280]
    - [37, 0.0]
  - - [3584, 3584, 1, 3328]
    - [37, 0.0]
  - - [1024, 256, 1, 128]
    - [33, 0.0]
  - - [4, 704, 1, 128]
    - [40, 0.0]
  - - [5888, 6784, 1, 256]
    - [34, 0.0]
  - - [4288, 2944, 1, 3328]
    - [37, 0.0]
  - - [2944, 64, 1, 128]
    - [2, 0.0]
  - - [1856, 64, 1, 256]
    - [37, 0.0]
  - - [4288, 128, 1, 3328]
    - [25, 0.0]
  - - [4288, 704, 1, 1280]
    - [34, 0.0]
  - - [256, 5056, 1, 1280]
    - [34, 0.0]
  - - [1408, 256, 1, 128]
    - [33, 0.0]
  - - [2944, 5888, 1, 3328]
    - [39, 0.0]
  - - [6784, 5888, 1, 1280]
    - [37, 0.0]
  - - [704, 128, 1, 256]
    - [37, 0.0]
  - - [5888, 4288, 1, 1280]
    - [37, 0.0]
  - - [448, 256, 1, 1280]
    - [22, 0.0]
  - - [5888, 3584, 1, 128]
    - [33, 0.0]
  - - [1856, 1856, 1, 128]
    - [33, 0.0]
  - - [5056, 4, 1, 1280]
    - [44, 0.0]
  - - [256, 1408, 1, 1280]
    - [34, 0.0]
  - - [512, 16, 1, 512]
    - [15, 0.0]
  - - [704, 3584, 1, 128]
    - [33, 0.0]
  - - [5888, 448, 1, 3328]
    - [34, 0.0]
  - - [2368, 4288, 1, 1280]
    - [37, 0.0]
  - - [4288, 2944, 1, 128]
    - [33, 0.0]
  - - [1024, 6784, 1, 3328]
    - [37, 0.0]
  - - [128, 2368, 1, 256]
    - [34, 0.0]
  - - [6784, 64, 1, 3328]
    - [34, 0.0]
  - - [5056, 2944, 1, 3328]
    - [37, 0.0]
  - - [448, 128, 1, 256]
    - [34, 0.0]
  - - [2944, 3584, 1, 256]
    - [37, 0.0]
  - - [1408, 1408, 1, 3328]
    - [34, 0.0]
  - - [1856, 128, 1, 1280]
    - [34, 0.0]
  - - [3584, 3584, 1, 128]
    - [33, 0.0]
  - - [64, 3584, 1, 256]
    - [34, 0.0]
  - - [1408, 4, 1, 3328]
    - [17, 0.0]
  - - [128, 2944, 1, 3328]
    - [22, 0.0]
  - - [3584, 704, 1, 256]
    - [34, 0.0]
  - - [2944, 448, 1, 3328]
    - [37, 0.0]
  - - [3584, 1408, 1, 3328]
    - [37, 0.0]
  - - [704, 3584, 1, 1280]
    - [37, 0.0]
  - - [2944, 6784, 1, 1280]
    - [37, 0.0]
  - - [1856, 6784, 1, 256]
    - [34, 0.0]
  - - [4288, 448, 1, 3328]
    - [37, 0.0]
  - - [6784, 4288, 1, 128]
    - [33, 0.0]
  - - [6784, 704, 1, 1280]
    - [37, 0.0]
  - - [256, 4288, 1, 256]
    - [34, 0.0]
  - - [3584, 64, 1, 128]
    - [2, 0.0]
  - - [5888, 1024, 1, 3328]
    - [39, 0.0]
  - - [448, 64, 1, 128]
    - [1, 0.0]
  - - [704, 6784, 1, 1280]
    - [34, 0.0]
  - - [5888, 128, 1, 256]
    - [34, 0.0]
  - - [2368, 448, 1, 3328]
    - [37, 0.0]
  - - [1856, 5056, 1, 3328]
    - [37, 0.0]
  - - [4, 6784, 1, 256]
    - [44, 0.0]
  - - [1024, 3584, 1, 128]
    - [33, 0.0]
  - - [1024, 1408, 1, 128]
    - [33, 0.0]
  - - [2368, 2944, 1, 128]
    - [33, 0.0]
  - - [5056, 64, 1, 256]
    - [34, 0.0]
  - - [4, 448, 1, 1280]
    - [46, 0.0]
  - - [5056, 2944, 1, 128]
    - [33, 0.0]
  - - [5888, 5056, 1, 3328]
    - [36, 0.0]
  - - [1024, 704, 1, 128]
    - [33, 0.0]
  - - [1408, 2368, 1, 128]
    - [33, 0.0]
  - - [5888, 2368, 1, 128]
    - [33, 0.0]
  - - [128, 5056, 1, 3328]
    - [37, 0.0]
  - - [3584, 6784, 1, 1280]
    - [37, 0.0]
  - - [3072, 7435, 1, 1024]
    - [37, 0.0]
  - - [1856, 5888, 1, 256]
    - [34, 0.0]
  - - [256, 256, 1, 256]
    - [34, 0.0]
  - - [256, 64, 1, 128]
    - [1, 0.0]
  - - [4288, 4288, 1, 3328]
    - [37, 0.0]
  - - [4288, 1408, 1, 1280]
    - [34, 0.0]
  - - [3584, 5056, 1, 128]
    - [33, 0.0]
  - - [4, 1024, 1, 3328]
    - [15, 0.0]
  - - [4288, 2368, 1, 256]
    - [34, 0.0]
  - - [2944, 5056, 1, 1280]
    - [37, 0.0]
  - - [448, 6784, 1, 256]
    - [34, 0.0]
  - - [64, 1024, 1, 3328]
    - [22, 0.0]
  - - [6784, 2368, 1, 3328]
    - [37, 0.0]
  - - [256, 1024, 1, 1280]
    - [34, 0.0]
  - - [704, 4, 1, 128]
    - [40, 0.0]
  - - [256, 4, 1, 256]
    - [44, 0.0]
  - - [4288, 128, 1, 256]
    - [34, 0.0]
  - - [4288, 1856, 1, 3328]
    - [37, 0.0]
  - - [3584, 448, 1, 128]
    - [33, 0.0]
  - - [256, 4, 1, 3328]
    - [49, 0.0]
  - - [4, 1408, 1, 1280]
    - [15, 0.0]
  - - [3584, 64, 1, 1280]
    - [34, 0.0]
  - - [1408, 448, 1, 128]
    - [33, 0.0]
  - - [3584, 1024, 1, 1280]
    - [38, 0.0]
  - - [1856, 5056, 1, 256]
    - [34, 0.0]
  - - [4, 3584, 1, 256]
    - [44, 0.0]
  - - [1024, 4288, 1, 256]
    - [34, 0.0]
  - - [5888, 3584, 1, 3328]
    - [37, 0.0]
  - - [4, 256, 1, 256]
    - [44, 0.0]
  - - [5056, 3584, 1, 3328]
    - [37, 0.0]
  - - [128, 5888, 1, 1280]
    - [34, 0.0]
  - - [704, 448, 1, 128]
    - [33, 0.0]
  - - [2368, 1408, 1, 1280]
    - [37, 0.0]
  - - [5056, 2944, 1, 1280]
    - [37, 0.0]
  - - [4, 4, 1, 128]
    - [41, 0.0]
  - - [3584, 256, 1, 256]
    - [34, 0.0]
  - - [128, 1856, 1, 3328]
    - [9, 0.0]
  - - [1024, 6784, 1, 256]
    - [34, 0.0]
  - - [4, 128, 1, 256]
    - [44, 0.0]
  - - [64, 64, 1, 1280]
    - [26, 0.0]
  - - [6784, 4, 1, 128]
    - [40, 0.0]
  - - [2944, 1408, 1, 128]
    - [33, 0.0]
  - - [448, 128, 1, 3328]
    - [31, 0.0]
  - - [64, 2944, 1, 3328]
    - [25, 0.0]
  - - [64, 4288, 1, 3328]
    - [25, 0.0]
  - - [5056, 6784, 1, 3328]
    - [37, 0.0]
  - - [128, 2944, 1, 256]
    - [34, 0.0]
  - - [128, 6784, 1, 128]
    - [2, 0.0]
  - - [3584, 4288, 1, 256]
    - [37, 0.0]
  - - [448, 1856, 1, 256]
    - [34, 0.0]
  - - [1856, 6784, 1, 3328]
    - [37, 0.0]
  - - [3584, 128, 1, 3328]
    - [34, 0.0]
  - - [64, 1856, 1, 256]
    - [34, 0.0]
  - - [1024, 448, 1, 1280]
    - [34, 0.0]
  - - [5888, 4288, 1, 256]
    - [37, 0.0]
  - - [4, 448, 1, 128]
    - [40, 0.0]
  - - [5056, 1408, 1, 256]
    - [34, 0.0]
  - - [64, 256, 1, 1280]
    - [27, 0.0]
  - - [3584, 1024, 1, 256]
    - [37, 0.0]
  - - [256, 704, 1, 256]
    - [34, 0.0]
  - - [5888, 5888, 1, 256]
    - [34, 0.0]
  - - [4288, 1024, 1, 1280]
    - [37, 0.0]
  - - [5888, 128, 1, 3328]
    - [37, 0.0]
  - - [448, 6784, 1, 3328]
    - [34, 0.0]
  - - [2944, 1408, 1, 1280]
    - [37, 0.0]
  - - [1024, 32, 1, 512]
    - [11, 0.0]
  - - [2944, 1856, 1, 3328]
    - [37, 0.0]
  - - [2368, 64, 1, 128]
    - [2, 0.0]
  - - [2944, 2944, 1, 128]
    - [33, 0.0]
  - - [4, 128, 1, 3328]
    - [17, 0.0]
  - - [3584, 5888, 1, 1280]
    - [37, 0.0]
  - - [64, 4, 1, 128]
    - [40, 0.0]
  - - [6784, 1856, 1, 1280]
    - [37, 0.0]
  - - [2944, 5056, 1, 256]
    - [34, 0.0]
  - - [2944, 5888, 1, 1280]
    - [37, 0.0]
  - - [5888, 256, 1, 3328]
    - [37, 0.0]
  - - [1856, 5888, 1, 3328]
    - [37, 0.0]
  - - [3584, 1408, 1, 256]
    - [34, 0.0]
  - - [704, 3584, 1, 3328]
    - [34, 0.0]
  - - [5056, 448, 1, 1280]
    - [37, 0.0]
  - - [3584, 1856, 1, 3328]
    - [37, 0.0]
  - - [64, 1408, 1, 128]
    - [2, 0.0]
  - - [1408, 704, 1, 1280]
    - [37, 0.0]
  - - [2944, 1024, 1, 256]
    - [37, 0.0]
  - - [1024, 2368, 1, 128]
    - [33, 0.0]
  - - [2368, 4288, 1, 3328]
    - [37, 0.0]
  - - [4, 1408, 1, 256]
    - [43, 0.0]
  - - [1024, 1408, 1, 1280]
    - [37, 0.0]
  - - [64, 64, 1, 256]
    - [17, 0.0]
  - - [704, 256, 1, 3328]
    - [34, 0.0]
  - - [6784, 5056, 1, 256]
    - [34, 0.0]
  - - [4, 4288, 1, 3328]
    - [44, 0.0]
  - - [448, 6784, 1, 128]
    - [33, 0.0]
  - - [4, 704, 1, 3328]
    - [48, 0.0]
  - - [448, 2944, 1, 256]
    - [34, 0.0]
  - - [2944, 6784, 1, 256]
    - [34, 0.0]
  - - [2368, 2368, 1, 1280]
    - [37, 0.0]
  - - [4, 4, 1, 1280]
    - [17, 0.0]
  - - [1856, 3584, 1, 1280]
    - [37, 0.0]
  - - [64, 2944, 1, 256]
    - [34, 0.0]
  - - [3584, 1408, 1, 1280]
    - [37, 0.0]
  - - [448, 256, 1, 128]
    - [2, 0.0]
  - - [4288, 448, 1, 128]
    - [33, 0.0]
  - - [5056, 256, 1, 1280]
    - [34, 0.0]
  - - [1856, 1408, 1, 3328]
    - [37, 0.0]
  - - [128, 128, 1, 128]
    - [1, 0.0]
  - - [1024, 4288, 1, 3328]
    - [37, 0.0]
  - - [448, 2368, 1, 256]
    - [34, 0.0]
  - - [1024, 4, 1, 128]
    - [40, 0.0]
  - - [5056, 448, 1, 256]
    - [37, 0.0]
  - - [2944, 2368, 1, 3328]
    - [37, 0.0]
  - - [704, 128, 1, 3328]
    - [25, 0.0]
  - - [64, 64, 1, 3328]
    - [18, 0.0]
  - - [1024, 1856, 1, 1280]
    - [37, 0.0]
  - - [6784, 1856, 1, 256]
    - [34, 0.0]
  - - [128, 2368, 1, 3328]
    - [25, 0.0]
  - - [1024, 5888, 1, 256]
    - [37, 0.0]
  - - [5056, 128, 1, 1280]
    - [34, 0.0]
  - - [5056, 64, 1, 3328]
    - [25, 0.0]
  - - [128, 704, 1, 128]
    - [2, 0.0]
  - - [1408, 2368, 1, 256]
    - [34, 0.0]
  - - [1408, 1408, 1, 256]
    - [34, 0.0]
  - - [4, 64, 1, 128]
    - [40, 0.0]
  - - [64, 128, 1, 1280]
    - [26, 0.0]
  - - [2368, 2368, 1, 128]
    - [33, 0.0]
  - - [64, 5888, 1, 128]
    - [2, 0.0]
  - - [5888, 4, 1, 3328]
    - [44, 0.0]
  - - [6784, 1408, 1, 128]
    - [33, 0.0]
  - - [4288, 5888, 1, 256]
    - [34, 0.0]
  - - [1408, 5056, 1, 256]
    - [34, 0.0]
  - - [5056, 128, 1, 3328]
    - [37, 0.0]
  - - [128, 128, 1, 1280]
    - [27, 0.0]
  - - [448, 704, 1, 256]
    - [34, 0.0]
  - - [4288, 3584, 1, 128]
    - [33, 0.0]
  - - [2944, 128, 1, 3328]
    - [25, 0.0]
  - - [128, 5056, 1, 1280]
    - [37, 0.0]
  - - [3584, 5056, 1, 1280]
    - [37, 0.0]
  - - [256, 448, 1, 1280]
    - [25, 0.0]
  - - [704, 704, 1, 128]
    - [33, 0.0]
  - - [5056, 4, 1, 128]
    - [40, 0.0]
  - - [704, 256, 1, 1280]
    - [34, 0.0]
  - - [64, 2368, 1, 3328]
    - [25, 0.0]
  - - [1856, 1024, 1, 128]
    - [33, 0.0]
  - - [1856, 64, 1, 128]
    - [2, 0.0]
  - - [64, 6784, 1, 1280]
    - [34, 0.0]
  - - [704, 4288, 1, 256]
    - [34, 0.0]
  - - [5888, 2368, 1, 1280]
    - [37, 0.0]
  - - [128, 256, 1, 256]
    - [34, 0.0]
  - - [256, 64, 1, 1280]
    - [15, 0.0]
  - - [2368, 5888, 1, 1280]
    - [37, 0.0]
  - - [5888, 256, 1, 1280]
    - [34, 0.0]
  - - [4, 5888, 1, 1280]
    - [44, 0.0]
  - - [704, 128, 1, 128]
    - [2, 0.0]
  - - [1024, 4, 1, 1280]
    - [15, 0.0]
  - - [2368, 1856, 1, 3328]
    - [37, 0.0]
  - - [2368, 128, 1, 128]
    - [2, 0.0]
  - - [2944, 704, 1, 256]
    - [34, 0.0]
  - - [5056, 128, 1, 128]
    - [2, 0.0]
  - - [256, 704, 1, 3328]
    - [34, 0.0]
  - - [704, 3584, 1, 256]
    - [34, 0.0]
  - - [1024, 1024, 1, 1024]
    - [37, 0.0]
  - - [704, 2944, 1, 3328]
    - [34, 0.0]
  - - [6784, 1024, 1, 128]
    - [33, 0.0]
  - - [256, 448, 1, 128]
    - [2, 0.0]
  - - [448, 1024, 1, 3328]
    - [37, 0.0]
  - - [2944, 1024, 1, 3328]
    - [39, 0.0]
  - - [2944, 5056, 1, 128]
    - [33, 0.0]
  - - [1408, 6784, 1, 256]
    - [34, 0.0]
  - - [6784, 1408, 1, 3328]
    - [34, 0.0]
  - - [4288, 6784, 1, 128]
    - [33, 0.0]
  - - [704, 64, 1, 256]
    - [34, 0.0]
  - - [5888, 4, 1, 1280]
    - [44, 0.0]
  - - [256, 2368, 1, 3328]
    - [37, 0.0]
  - - [6784, 2944, 1, 1280]
    - [37, 0.0]
  - - [4288, 1856, 1, 128]
    - [33, 0.0]
  - - [1856, 2944, 1, 128]
    - [33, 0.0]
  - - [6784, 448, 1, 128]
    - [33, 0.0]
  - - [64, 3584, 1, 128]
    - [2, 0.0]
  - - [448, 5056, 1, 1280]
    - [37, 0.0]
  - - [2368, 1856, 1, 128]
    - [33, 0.0]
  - - [128, 448, 1, 1280]
    - [22, 0.0]
  - - [4288, 704, 1, 256]
    - [34, 0.0]
  - - [256, 3584, 1, 128]
    - [33, 0.0]
  - - [5888, 704, 1, 256]
    - [34, 0.0]
  - - [3584, 1024, 1, 128]
    - [33, 0.0]
  - - [256, 5888, 1, 3328]
    - [37, 0.0]
  - - [1408, 4288, 1, 3328]
    - [34, 0.0]
  - - [6784, 4288, 1, 256]
    - [34, 0.0]
  - - [4288, 256, 1, 128]
    - [33, 0.0]
  - - [5888, 256, 1, 256]
    - [34, 0.0]
  - - [6784, 1024, 1, 1280]
    - [37, 0.0]
  - - [5888, 1024, 1, 128]
    - [33, 0.0]
  - - [1024, 128, 1, 256]
    - [37, 0.0]
  - - [128, 64, 1, 3328]
    - [32, 0.0]
  - - [448, 64, 1, 256]
    - [19, 0.0]
  - - [2368, 256, 1, 128]
    - [33, 0.0]
  - - [6784, 3584, 1, 1280]
    - [37, 0.0]
  - - [1024, 6784, 1, 1280]
    - [37, 0.0]
  - - [2944, 64, 1, 1280]
    - [22, 0.0]
  - - [1408, 2944, 1, 1280]
    - [37, 0.0]
  - - [256, 1856, 1, 256]
    - [34, 0.0]
  - - [1408, 2368, 1, 3328]
    - [37, 0.0]
  - - [2944, 4, 1, 3328]
    - [7, 0.0]
  - - [128, 1408, 1, 3328]
    - [22, 0.0]
  - - [2944, 1856, 1, 128]
    - [33, 0.0]
  - - [256, 2944, 1, 128]
    - [33, 0.0]
  - - [256, 6784, 1, 128]
    - [33, 0.0]
  - - [2368, 4, 1, 128]
    - [40, 0.0]
  - - [1408, 256, 1, 3328]
    - [34, 0.0]
  - - [1856, 4, 1, 128]
    - [40, 0.0]
  - - [1024, 16, 1, 512]
    - [19, 0.0]
  - - [5056, 6784, 1, 128]
    - [33, 0.0]
  - - [4288, 5056, 1, 128]
    - [33, 0.0]
  - - [1856, 5888, 1, 128]
    - [33, 0.0]
  - - [2944, 5888, 1, 256]
    - [34, 0.0]
  - - [3584, 1856, 1, 256]
    - [34, 0.0]
  - - [4288, 3584, 1, 1280]
    - [37, 0.0]
  - - [2368, 448, 1, 256]
    - [34, 0.0]
  - - [4288, 256, 1, 3328]
    - [37, 0.0]
  - - [1856, 704, 1, 128]
    - [33, 0.0]
  - - [1408, 64, 1, 256]
    - [34, 0.0]
  - - [64, 1856, 1, 128]
    - [2, 0.0]
  - - [4, 256, 1, 128]
    - [40, 0.0]
  - - [704, 4288, 1, 3328]
    - [34, 0.0]
  - - [704, 5888, 1, 128]
    - [33, 0.0]
  - - [6784, 3584, 1, 128]
    - [33, 0.0]
  - - [1024, 64, 1, 256]
    - [34, 0.0]
  - - [64, 2368, 1, 256]
    - [34, 0.0]
  - - [4288, 5056, 1, 3328]
    - [37, 0.0]
  - - [4, 1856, 1, 1280]
    - [11, 0.0]
  - - [4288, 128, 1, 128]
    - [2, 0.0]
  - - [1408, 1408, 1, 128]
    - [33, 0.0]
  - - [1024, 128, 1, 3328]
    - [25, 0.0]
  - - [1856, 128, 1, 128]
    - [2, 0.0]
  - - [5056, 2368, 1, 256]
    - [34, 0.0]
  - - [4288, 704, 1, 3328]
    - [37, 0.0]
  - - [448, 3584, 1, 256]
    - [34, 0.0]
  - - [64, 128, 1, 128]
    - [1, 0.0]
  - - [2368, 64, 1, 1280]
    - [25, 0.0]
  - - [2368, 1024, 1, 1280]
    - [37, 0.0]
  - - [2944, 1408, 1, 3328]
    - [37, 0.0]
  - - [1408, 448, 1, 256]
    - [34, 0.0]
  - - [1024, 1408, 1, 3328]
    - [37, 0.0]
  - - [2560, 7133, 1, 2560]
    - [34, 0.0]
  - - [1408, 4, 1, 1280]
    - [17, 0.0]
  - - [5888, 3584, 1, 256]
    - [37, 0.0]
  - - [128, 1024, 1, 1280]
    - [13, 0.0]
  - - [1408, 1856, 1, 3328]
    - [37, 0.0]
  - - [4, 4, 1, 3328]
    - [49, 0.0]
  - - [6784, 1408, 1, 1280]
    - [37, 0.0]
  - - [4, 1024, 1, 1280]
    - [7, 0.0]
  - - [704, 2944, 1, 256]
    - [34, 0.0]
  - - [704, 4288, 1, 128]
    - [33, 0.0]
  - - [2368, 4288, 1, 128]
    - [33, 0.0]
  - - [64, 4288, 1, 1280]
    - [22, 0.0]
  - - [6784, 64, 1, 1280]
    - [34, 0.0]
  - - [3584, 128, 1, 128]
    - [2, 0.0]
  - - [1024, 6784, 1, 128]
    - [33, 0.0]
  - - [4, 1856, 1, 128]
    - [40, 0.0]
  - - [1408, 64, 1, 3328]
    - [25, 0.0]
  - - [6784, 4, 1, 256]
    - [44, 0.0]
  - - [1408, 1408, 1, 1280]
    - [37, 0.0]
  - - [256, 2368, 1, 256]
    - [34, 0.0]
  - - [448, 4288, 1, 3328]
    - [34, 0.0]
  - - [2368, 1408, 1, 256]
    - [34, 0.0]
  - - [5888, 5056, 1, 128]
    - [33, 0.0]
  - - [704, 2368, 1, 256]
    - [34, 0.0]
  - - [2944, 448, 1, 1280]
    - [37, 0.0]
  - - [5888, 2368, 1, 3328]
    - [37, 0.0]
  - - [64, 2944, 1, 1280]
    - [25, 0.0]
  - - [448, 1856, 1, 1280]
    - [34, 0.0]
  - - [4288, 448, 1, 1280]
    - [37, 0.0]
  - - [5888, 704, 1, 3328]
    - [37, 0.0]
  - - [5056, 256, 1, 128]
    - [33, 0.0]
  - - [1856, 256, 1, 128]
    - [33, 0.0]
  - - [5056, 128, 1, 256]
    - [34, 0.0]
  - - [704, 4, 1, 256]
    - [44, 0.0]
  - - [1408, 5888, 1, 128]
    - [33, 0.0]
  - - [4288, 4, 1, 128]
    - [40, 0.0]
  - - [1408, 1024, 1, 256]
    - [37, 0.0]
  - - [1024, 1856, 1, 128]
    - [33, 0.0]
  - - [256, 704, 1, 128]
    - [33, 0.0]
  - - [256, 1024, 1, 128]
    - [33, 0.0]
  - - [448, 1024, 1, 256]
    - [37, 0.0]
  - - [128, 4, 1, 3328]
    - [49, 0.0]
  - - [5056, 6784, 1, 1280]
    - [37, 0.0]
  - - [704, 5056, 1, 3328]
    - [37, 0.0]
  - - [64, 1408, 1, 1280]
    - [22, 0.0]
  - - [3584, 5056, 1, 3328]
    - [37, 0.0]
  - - [1856, 4, 1, 3328]
    - [49, 0.0]
  - - [4, 2944, 1, 128]
    - [40, 0.0]
  - - [2368, 2944, 1, 3328]
    - [37, 0.0]
  - - [448, 448, 1, 1280]
    - [25, 0.0]
  - - [2368, 3584, 1, 256]
    - [34, 0.0]
  - - [1024, 256, 1, 1280]
    - [37, 0.0]
  - - [5056, 3584, 1, 1280]
    - [37, 0.0]
  - - [448, 4, 1, 3328]
    - [17, 0.0]
  - - [1856, 2944, 1, 1280]
    - [37, 0.0]
  - - [3584, 2368, 1, 1280]
    - [37, 0.0]
  - - [128, 1024, 1, 256]
    - [34, 0.0]
  - - [2944, 1408, 1, 256]
    - [34, 0.0]
  - - [4288, 1408, 1, 3328]
    - [37, 0.0]
  - - [3584, 64, 1, 3328]
    - [10, 0.0]
  - - [1408, 128, 1, 256]
    - [37, 0.0]
  - - [2944, 1024, 1, 128]
    - [33, 0.0]
  - - [4288, 5056, 1, 1280]
    - [37, 0.0]
  - - [5888, 6784, 1, 1280]
    - [37, 0.0]
  - - [6784, 5056, 1, 128]
    - [33, 0.0]
  - - [256, 1024, 1, 3328]
    - [34, 0.0]
  - - [3584, 4, 1, 256]
    - [44, 0.0]
  - - [1856, 64, 1, 3328]
    - [25, 0.0]
  - - [64, 6784, 1, 128]
    - [2, 0.0]
  - - [5888, 1408, 1, 3328]
    - [39, 0.0]
  - - [5888, 64, 1, 1280]
    - [34, 0.0]
  - - [256, 5056, 1, 256]
    - [34, 0.0]
  - - [128, 3584, 1, 128]
    - [2, 0.0]
  - - [448, 3584, 1, 3328]
    - [34, 0.0]
  - - [704, 2368, 1, 128]
    - [33, 0.0]
  - - [5888, 256, 1, 128]
    - [33, 0.0]
  - - [4, 5056, 1, 128]
    - [40, 0.0]
  - - [448, 256, 1, 256]
    - [34, 0.0]
  - - [704, 4, 1, 3328]
    - [47, 0.0]
  - - [1408, 256, 1, 256]
    - [34, 0.0]
  - - [3584, 1856, 1, 128]
    - [33, 0.0]
  - - [4288, 4288, 1, 128]
    - [33, 0.0]
  - - [1856, 1024, 1, 3328]
    - [35, 0.0]
  - - [128, 5888, 1, 3328]
    - [34, 0.0]
  - - [1024, 5056, 1, 256]
    - [34, 0.0]
  - - [2368, 1408, 1, 3328]
    - [37, 0.0]
  - - [5888, 448, 1, 256]
    - [37, 0.0]
  - - [5888, 6784, 1, 128]
    - [33, 0.0]
  - - [2368, 4, 1, 3328]
    - [49, 0.0]
  - - [6784, 5056, 1, 1280]
    - [37, 0.0]
  - - [5056, 704, 1, 1280]
    - [37, 0.0]
  - - [1408, 256, 1, 1280]
    - [34, 0.0]
  - - [4288, 6784, 1, 1280]
    - [37, 0.0]
  - - [128, 704, 1, 256]
    - [37, 0.0]
  - - [1024, 1024, 1, 128]
    - [33, 0.0]
  - - [448, 128, 1, 1280]
    - [22, 0.0]
  - - [6784, 4, 1, 3328]
    - [45, 0.0]
  - - [4288, 4, 1, 1280]
    - [44, 0.0]
  - - [1024, 64, 1, 3328]
    - [22, 0.0]
  - - [1856, 4, 1, 256]
    - [44, 0.0]
  - - [64, 3584, 1, 1280]
    - [34, 0.0]
  - - [6784, 1408, 1, 256]
    - [37, 0.0]
  - - [3584, 5888, 1, 128]
    - [33, 0.0]
  - - [5056, 5888, 1, 256]
    - [37, 0.0]
  - - [2368, 1024, 1, 256]
    - [37, 0.0]
  - - [2944, 1856, 1, 256]
    - [37, 0.0]
  - - [1856, 6784, 1, 1280]
    - [37, 0.0]
  - - [64, 5056, 1, 128]
    - [2, 0.0]
  - - [5888, 64, 1, 128]
    - [2, 0.0]
  - - [448, 704, 1, 128]
    - [33, 0.0]
  - - [4, 1024, 1, 128]
    - [40, 0.0]
  - - [4288, 3584, 1, 256]
    - [37, 0.0]
  - - [1408, 704, 1, 128]
    - [33, 0.0]
  - - [64, 256, 1, 3328]
    - [27, 0.0]
  - - [5056, 1856, 1, 1280]
    - [37, 0.0]
  - - [1408, 1024, 1, 3328]
    - [37, 0.0]
  - - [2368, 256, 1, 3328]
    - [34, 0.0]
  - - [5888, 3584, 1, 1280]
    - [37, 0.0]
  - - [1856, 3584, 1, 3328]
    - [34, 0.0]
  - - [5888, 128, 1, 1280]
    - [37, 0.0]
  - - [1024, 2944, 1, 256]
    - [37, 0.0]
  - - [448, 6784, 1, 1280]
    - [37, 0.0]
  - - [256, 3584, 1, 1280]
    - [34, 0.0]
  - - [448, 128, 1, 128]
    - [0, 0.0]
  - - [704, 5056, 1, 256]
    - [34, 0.0]
  - - [3584, 1024, 1, 3328]
    - [38, 0.0]
  - - [2944, 1856, 1, 1280]
    - [34, 0.0]
  - - [128, 256, 1, 128]
    - [1, 0.0]
  - - [5056, 256, 1, 256]
    - [34, 0.0]
  - - [2368, 3584, 1, 3328]
    - [37, 0.0]
  - - [2944, 704, 1, 1280]
    - [37, 0.0]
  - - [128, 4, 1, 256]
    - [44, 0.0]
  - - [2944, 3584, 1, 1280]
    - [37, 0.0]
  - - [1856, 5888, 1, 1280]
    - [34, 0.0]
  - - [256, 256, 1, 1280]
    - [25, 0.0]
  - - [5056, 448, 1, 3328]
    - [37, 0.0]
  - - [4288, 1408, 1, 256]
    - [34, 0.0]
  - - [3584, 64, 1, 256]
    - [34, 0.0]
  - - [64, 1856, 1, 3328]
    - [22, 0.0]
  - - [256, 1408, 1, 128]
    - [33, 0.0]
  - - [5888, 1408, 1, 128]
    - [33, 0.0]
  - - [4288, 2368, 1, 1280]
    - [37, 0.0]
  - - [4, 4288, 1, 256]
    - [44, 0.0]
  - - [256, 4288, 1, 128]
    - [33, 0.0]
  - - [256, 128, 1, 3328]
    - [21, 0.0]
  - - [6784, 2368, 1, 256]
    - [37, 0.0]
  - - [5888, 128, 1, 128]
    - [2, 0.0]
  - - [4288, 1856, 1, 256]
    - [34, 0.0]
  - - [1856, 256, 1, 3328]
    - [34, 0.0]
  - - [1856, 2944, 1, 256]
    - [34, 0.0]
  - - [5056, 1024, 1, 128]
    - [33, 0.0]
  - - [64, 5888, 1, 1280]
    - [34, 0.0]
  - - [1760, 7133, 1, 1760]
    - [37, 0.0]
  - - [6784, 256, 1, 128]
    - [33, 0.0]
  - - [5888, 704, 1, 128]
    - [33, 0.0]
  - - [6784, 64, 1, 128]
    - [2, 0.0]
  - - [1024, 4288, 1, 1280]
    - [37, 0.0]
  - - [2368, 5056, 1, 3328]
    - [37, 0.0]
  - - [448, 4, 1, 128]
    - [40, 0.0]
  - - [4, 256, 1, 3328]
    - [17, 0.0]
  - - [4288, 1024, 1, 3328]
    - [37, 0.0]
  - - [1024, 5056, 1, 3328]
    - [37, 0.0]
  - - [1024, 1856, 1, 3328]
    - [37, 0.0]
  - - [704, 704, 1, 1280]
    - [34, 0.0]
  - - [128, 2368, 1, 1280]
    - [22, 0.0]
  - - [1408, 128, 1, 3328]
    - [25, 0.0]
  - - [3584, 256, 1, 1280]
    - [37, 0.0]
  - - [4, 128, 1, 128]
    - [40, 0.0]
  - - [704, 6784, 1, 128]
    - [33, 0.0]
  - - [3584, 128, 1, 1280]
    - [34, 0.0]
  - - [4, 256, 1, 1280]
    - [17, 0.0]
  - - [128, 704, 1, 3328]
    - [22, 0.0]
  - - [4288, 6784, 1, 256]
    - [37, 0.0]
  - - [3584, 2944, 1, 3328]
    - [37, 0.0]
  - - [128, 1856, 1, 256]
    - [34, 0.0]
  - - [64, 4288, 1, 256]
    - [37, 0.0]
  - - [4, 3584, 1, 3328]
    - [7, 0.0]
  - - [64, 4, 1, 3328]
    - [17, 0.0]
  - - [4, 64, 1, 3328]
    - [49, 0.0]
  - - [5888, 2944, 1, 256]
    - [37, 0.0]
  - - [2368, 6784, 1, 128]
    - [33, 0.0]
  - - [448, 4288, 1, 1280]
    - [34, 0.0]
  - - [448, 1856, 1, 3328]
    - [34, 0.0]
  - - [4, 1024, 1, 256]
    - [44, 0.0]
  - - [5056, 4288, 1, 256]
    - [37, 0.0]
  - - [1024, 448, 1, 256]
    - [34, 0.0]
  - - [1024, 3584, 1, 256]
    - [37, 0.0]
  - - [2944, 128, 1, 1280]
    - [34, 0.0]
  - - [1856, 5056, 1, 128]
    - [33, 0.0]
  - - [64, 256, 1, 256]
    - [19, 0.0]
  - - [1408, 4, 1, 128]
    - [40, 0.0]
  - - [128, 2368, 1, 128]
    - [2, 0.0]
  - - [256, 704, 1, 1280]
    - [37, 0.0]
  - - [64, 2368, 1, 128]
    - [2, 0.0]
  - - [6784, 6784, 1, 3328]
    - [39, 0.0]
  - - [448, 5888, 1, 1280]
    - [37, 0.0]
  - - [5056, 448, 1, 128]
    - [33, 0.0]
  - - [3584, 2944, 1, 128]
    - [33, 0.0]
  - - [6784, 256, 1, 1280]
    - [37, 0.0]
  - - [256, 2944, 1, 1280]
    - [34, 0.0]
  - - [64, 4288, 1, 128]
    - [2, 0.0]
  - - [2368, 5888, 1, 3328]
    - [37, 0.0]
  - - [4, 64, 1, 256]
    - [44, 0.0]
  - - [704, 1024, 1, 3328]
    - [34, 0.0]
  - - [2368, 1856, 1, 1280]
    - [37, 0.0]
  - - [128, 448, 1, 128]
    - [0, 0.0]
  - - [128, 6784, 1, 256]
    - [37, 0.0]
  - - [3584, 4288, 1, 128]
    - [33, 0.0]
  - - [64, 448, 1, 128]
    - [1, 0.0]
  - - [5888, 4288, 1, 3328]
    - [37, 0.0]
  - - [2368, 704, 1, 256]
    - [34, 0.0]
  - - [256, 1856, 1, 3328]
    - [34, 0.0]
  - - [1856, 128, 1, 256]
    - [34, 0.0]
  - - [6784, 128, 1, 128]
    - [2, 0.0]
  - - [3584, 1408, 1, 128]
    - [33, 0.0]
  - - [1856, 5056, 1, 1280]
    - [37, 0.0]
  - - [2944, 1024, 1, 1280]
    - [37, 0.0]
  - - [5056, 4, 1, 256]
    - [44, 0.0]
  - - [3584, 5888, 1, 3328]
    - [37, 0.0]
  - - [2368, 4288, 1, 256]
    - [37, 0.0]
  - - [1024, 2368, 1, 3328]
    - [37, 0.0]
  - - [64, 704, 1, 3328]
    - [28, 0.0]
  - - [704, 1408, 1, 256]
    - [34, 0.0]
  - - [6784, 1856, 1, 3328]
    - [37, 0.0]
  - - [1024, 2944, 1, 128]
    - [33, 0.0]
  - - [1024, 3584, 1, 1280]
    - [37, 0.0]
  - - [4288, 5888, 1, 3328]
    - [37, 0.0]
  - - [4288, 4, 1, 3328]
    - [44, 0.0]
  - - [256, 1408, 1, 256]
    - [34, 0.0]
  - - [448, 2944, 1, 1280]
    - [34, 0.0]
  - - [4, 5888, 1, 128]
    - [40, 0.0]
  - - [1024, 2944, 1, 3328]
    - [37, 0.0]
  - - [3584, 6784, 1, 256]
    - [34, 0.0]
  - - [256, 6784, 1, 1280]
    - [34, 0.0]
  - - [1856, 3584, 1, 256]
    - [34, 0.0]
  - - [128, 448, 1, 3328]
    - [22, 0.0]
  - - [6784, 1856, 1, 128]
    - [33, 0.0]
  - - [4, 448, 1, 256]
    - [44, 0.0]
  - - [2944, 704, 1, 128]
    - [33, 0.0]
  - - [256, 5888, 1, 1280]
    - [34, 0.0]
  - - [4, 128, 1, 1280]
    - [17, 0.0]
  - - [4288, 6784, 1, 3328]
    - [37, 0.0]
  - - [6784, 128, 1, 1280]
    - [34, 0.0]
  - - [64, 1408, 1, 256]
    - [34, 0.0]
  - - [7680, 5481, 1, 2560]
    - [39, 0.0]
  - - [2368, 1408, 1, 128]
    - [33, 0.0]
  - - [1856, 448, 1, 256]
    - [34, 0.0]
  - - [1408, 1024, 1, 128]
    - [33, 0.0]
  - - [128, 64, 1, 128]
    - [1, 0.0]
  - - [6784, 3584, 1, 3328]
    - [37, 0.0]
  - - [2944, 64, 1, 3328]
    - [25, 0.0]
  - - [64, 64, 1, 128]
    - [1, 0.0]
  - - [2368, 5056, 1, 1280]
    - [34, 0.0]
  - - [64, 4, 1, 1280]
    - [17, 0.0]
  - - [1408, 2368, 1, 1280]
    - [34, 0.0]
  - - [128, 1408, 1, 1280]
    - [25, 0.0]
  - - [256, 64, 1, 3328]
    - [15, 0.0]
  - - [2944, 4288, 1, 128]
    - [33, 0.0]
  - - [2944, 2944, 1, 256]
    - [34, 0.0]
  - - [2944, 4, 1, 1280]
    - [44, 0.0]
  - - [5888, 4, 1, 256]
    - [44, 0.0]
  - - [6784, 256, 1, 256]
    - [37, 0.0]
  - - [256, 5056, 1, 3328]
    - [34, 0.0]
  - - [128, 4288, 1, 1280]
    - [37, 0.0]
  - - [5056, 1856, 1, 128]
    - [33, 0.0]
  - - [5888, 1408, 1, 256]
    - [34, 0.0]
  - - [128, 128, 1, 256]
    - [34, 0.0]
  - - [5056, 4, 1, 3328]
    - [44, 0.0]
  - - [4288, 3584, 1, 3328]
    - [37, 0.0]
  - - [448, 704, 1, 3328]
    - [34, 0.0]
  - - [448, 448, 1, 128]
    - [3, 0.0]
  - - [1024, 2368, 1, 1280]
    - [37, 0.0]
  - - [1856, 704, 1, 3328]
    - [34, 0.0]
  - - [4, 2368, 1, 128]
    - [40, 0.0]
  - - [5888, 6784, 1, 3328]
    - [39, 0.0]
  - - [704, 4288, 1, 1280]
    - [34, 0.0]
  - - [704, 256, 1, 256]
    - [34, 0.0]
  - - [6784, 448, 1, 3328]
    - [37, 0.0]
  - - [4288, 1024, 1, 128]
    - [33, 0.0]
- null
