library/src/blas3/Tensile/Logic/asm_full/arcturus_Cijk_Alik_Bljk_BBH.yaml
- {MinimumRequiredVersion: 4.14.0}
- arcturus
- gfx908
- [Device 7380, Device 7388, Device 738c, Device 7390]
    SolutionIndex: 0
    SolutionNameMin: Cijk_Alik_Bljk_BBH_MT64x128x32_MI32x32x2x2_SE_GRVW4_ONLL0_SNLL0
    SolutionIndex: 1
    SolutionNameMin: Cijk_Alik_Bljk_BBH_MT64x128x16_MI32x32x2x2_SE_GRVW4_ONLL1_SNLL0
    SolutionIndex: 2
    SolutionNameMin: Cijk_Alik_Bljk_BBH_MT128x32x16_SE_
    SolutionIndex: 3
    SolutionNameMin: Cijk_Alik_Bljk_BBH_MT256x128x16_SE_
    SolutionIndex: 4
    SolutionNameMin: Cijk_Alik_Bljk_BBH_MT64x128x32_SE_
    SolutionIndex: 5
    SolutionNameMin: Cijk_Alik_Bljk_BBH_MT128x64x16_SE_
    SolutionIndex: 6
    SolutionNameMin: Cijk_Alik_Bljk_BBH_MT32x128x16_SE_
    SolutionIndex: 7
    SolutionNameMin: Cijk_Alik_Bljk_BBH_MT64x128x16_SE_
    SolutionIndex: 8
    SolutionNameMin: Cijk_Alik_Bljk_BBH_MT256x128x16_SE_
    SolutionIndex: 9
    SolutionNameMin: Cijk_Alik_Bljk_BBH_MT64x16x16_SE_
    SolutionIndex: 10
    SolutionNameMin: Cijk_Alik_Bljk_BBH_MT16x64x16_SE_
    SolutionIndex: 11
    SolutionNameMin: Cijk_Alik_Bljk_BBH_MT32x32x32_SE_
    SolutionIndex: 12
    SolutionNameMin: Cijk_Alik_Bljk_BBH_MT64x128x64_SE_
    SolutionIndex: 13
    SolutionNameMin: Cijk_Alik_Bljk_BBH_MT128x64x16_SE_AF0EM1_ASEM1_GRVW1_WGM8
    SolutionIndex: 14
    SolutionNameMin: Cijk_Alik_Bljk_BBH_MT32x128x16_SE_AF0EM1_ASEM1_GRVW1_WGM8
    SolutionIndex: 15
    SolutionNameMin: Cijk_Alik_Bljk_BBH_MT64x16x16_SE_AF0EM1_ASEM1_GRVW1_WGM8
    SolutionIndex: 16
    SolutionNameMin: Cijk_Alik_Bljk_BBH_MT64x32x16_SE_AF0EM1_ASEM1_GRVW1_WGM8
    SolutionIndex: 17
    SolutionNameMin: Cijk_Alik_Bljk_BBH_MT64x128x32_MI32x32x2x2_SE_AF0EM2_ASEM1_GRVW4_WGM1
    SolutionIndex: 18
    SolutionNameMin: Cijk_Alik_Bljk_BBH_MT64x128x32_MI32x32x2x2_SE_AF0EM2_ASEM2_GRVW4_WGM1
    SolutionIndex: 19
    SolutionNameMin: Cijk_Alik_Bljk_BBH_MT32x256x32_MI32x32x2x2_SE_AF0EM2_ASEM1_GRVW4_WGM8
    SolutionIndex: 20
    SolutionNameMin: Cijk_Alik_Bljk_BBH_MT64x128x32_MI32x32x2x2_SE_AF0EM2_ASEM1_GRVW4_WGM8
    SolutionIndex: 21
    SolutionNameMin: Cijk_Alik_Bljk_BBH_MT64x128x32_MI32x32x2x2_SE_AF0EM2_ASEM2_GRVW4_WGM8
    SolutionIndex: 22
    SolutionIndex: 23
    SolutionIndex: 24
    SolutionIndex: 25
    SolutionIndex: 26
    SolutionIndex: 27
    SolutionIndex: 28
    SolutionIndex: 29
    SolutionIndex: 30
    SolutionIndex: 31
    SolutionIndex: 32
    SolutionIndex: 33
    SolutionIndex: 34
    SolutionIndex: 35
    SolutionIndex: 36
    SolutionIndex: 37
    SolutionIndex: 38
    SolutionIndex: 39
    SolutionIndex: 40
    SolutionIndex: 41
    SolutionIndex: 42
    SolutionIndex: 43
    SolutionIndex: 44
    SolutionIndex: 45
    SolutionIndex: 46
    SolutionIndex: 47
    SolutionIndex: 48
    SolutionIndex: 49
    SolutionIndex: 50
    SolutionIndex: 51
    SolutionIndex: 52
    SolutionIndex: 53
    SolutionIndex: 54
    SolutionIndex: 55
    SolutionIndex: 56
    SolutionIndex: 57
    SolutionIndex: 58
    SolutionIndex: 59
    SolutionIndex: 60
    SolutionIndex: 61
    SolutionIndex: 62
    SolutionIndex: 63
    SolutionIndex: 64
    SolutionIndex: 65
    SolutionIndex: 66
    SolutionIndex: 67
    SolutionIndex: 68
    SolutionIndex: 69
    SolutionIndex: 70
    SolutionIndex: 71
    SolutionIndex: 72
    SolutionIndex: 73
    SolutionIndex: 74
    SolutionIndex: 75
    SolutionIndex: 76
    SolutionIndex: 77
    SolutionIndex: 78
    SolutionIndex: 79
    SolutionIndex: 80
    SolutionIndex: 81
    SolutionIndex: 82
    SolutionIndex: 83
    SolutionIndex: 84
    SolutionIndex: 85
    SolutionIndex: 86
    SolutionIndex: 87
    SolutionIndex: 88
    SolutionIndex: 89
    SolutionIndex: 90
    SolutionIndex: 91
    SolutionIndex: 92
    SolutionIndex: 93
    SolutionIndex: 94
    SolutionIndex: 95
    SolutionIndex: 96
    SolutionIndex: 97
    SolutionIndex: 98
    SolutionIndex: 99
    SolutionIndex: 100
    SolutionIndex: 101
    SolutionIndex: 102
    SolutionIndex: 103
    SolutionIndex: 104
    SolutionIndex: 105
    SolutionIndex: 106
    SolutionIndex: 107
    SolutionIndex: 108
    SolutionIndex: 109
    SolutionIndex: 110
    SolutionIndex: 111
    SolutionIndex: 112
    SolutionIndex: 113
    SolutionIndex: 114
    SolutionIndex: 115
    SolutionIndex: 116
    SolutionIndex: 117
    SolutionIndex: 118
    SolutionIndex: 119
    SolutionIndex: 120
    SolutionIndex: 121
    SolutionIndex: 122
    SolutionIndex: 123
    SolutionIndex: 124
    SolutionIndex: 125
    SolutionIndex: 126
    SolutionIndex: 127
    SolutionIndex: 128
    SolutionIndex: 129
    SolutionIndex: 130
    SolutionIndex: 131
    SolutionIndex: 132
    SolutionIndex: 133
    SolutionIndex: 134
    SolutionIndex: 135
    SolutionIndex: 136
    SolutionIndex: 137
    SolutionIndex: 138
    SolutionIndex: 139
    SolutionIndex: 140
    SolutionIndex: 141
    SolutionIndex: 142
    SolutionNameMin: Cijk_Alik_Bljk_BBH_MT64x80x64_MI16x16x8x1_SE_1LDSB0_AF0EM4_GRVW4_LBSPP128_PLR9_SU0_SUS256_SRVW0_TT1_80_WG64_4_1_WGM15
    SolutionIndex: 143
    SolutionNameMin: Cijk_Alik_Bljk_BBH_MT128x64x32_MI32x32x2x2_SE_1LDSB0_AF0EM4_GRVW8_LBSPP128_PLR17_SU16_SUS256_SRVW4_TT1_32_WG128_2_1_WGM15
    SolutionIndex: 144
    SolutionNameMin: Cijk_Alik_Bljk_BBH_MT64x64x128_MI32x32x4x1_SE_1LDSB1_AF0EM4_GRVW8_LBSPP256_PLR33_SU0_SUS256_SRVW0_TT1_32_WG64_4_1_WGM15
    SolutionIndex: 145
    SolutionNameMin: Cijk_Alik_Bljk_BBH_MT32x32x128_MI16x16x8x1_SE_1LDSB0_AF0EM1_GRVW2_LBSPP256_PLR17_SU16_SUS256_SRVW0_TT1_16_WG32_8_1_WGM1
    SolutionIndex: 146
    SolutionNameMin: Cijk_Alik_Bljk_BBH_MT128x96x32_MI32x32x4x1_SE_1LDSB0_AF0EM4_GRVW2_LBSPP128_PLR9_SU16_SUS128_SRVW4_TT1_96_WG128_2_1_WGM15
    SolutionIndex: 147
    SolutionNameMin: Cijk_Alik_Bljk_BBH_MT64x128x32_MI32x32x2x2_SE_1LDSB0_AF0EM1_GRVW8_LBSPP128_PLR17_SU0_SUS256_SRVW4_TT1_32_WG64_4_1_WGM15
    SolutionIndex: 148
    SolutionNameMin: Cijk_Alik_Bljk_BBH_MT64x64x32_MI32x32x4x1_SE_1LDSB0_AF0EM4_GRVW4_LBSPP128_PLR9_SU0_SUS256_SRVW4_TT1_32_WG64_4_1_WGM15
    SolutionIndex: 149
    SolutionNameMin: Cijk_Alik_Bljk_BBH_MT128x96x32_MI32x32x4x1_SE_1LDSB0_AF0EM4_GRVW4_LBSPP128_PLR9_SU0_SUS256_SRVW4_TT1_96_WG128_2_1_WGM1
    SolutionIndex: 150
    SolutionNameMin: Cijk_Alik_Bljk_BBH_MT32x64x64_MI16x16x8x1_SE_1LDSB0_AF0EM4_GRVW2_LBSPP128_PLR9_SU0_SUS256_SRVW0_TT1_32_WG32_8_1_WGM2
    SolutionIndex: 151
    SolutionNameMin: Cijk_Alik_Bljk_BBH_MT32x32x128_MI16x16x8x1_SE_1LDSB0_AF0EM4_GRVW4_LBSPP256_PLR17_SU0_SUS256_SRVW0_TT1_16_WG32_8_1_WGM1
    SolutionIndex: 152
    SolutionNameMin: Cijk_Alik_Bljk_BBH_MT128x96x32_MI32x32x4x1_SE_1LDSB0_AF0EM4_GRVW2_LBSPP128_PLR9_SU32_SUS128_SRVW4_TT1_96_WG128_2_1_WGM15
    SolutionIndex: 153
    SolutionNameMin: Cijk_Alik_Bljk_BBH_MT64x32x64_MI16x16x8x1_SE_1LDSB0_AF0EM4_GRVW4_LBSPP128_PLR9_SU0_SUS256_SRVW0_TT2_16_WG32_8_1_WGM15
    SolutionIndex: 154
    SolutionNameMin: Cijk_Alik_Bljk_BBH_MT128x64x32_MI32x32x2x2_SE_1LDSB0_AF0EM4_GRVW8_LBSPP128_PLR17_SU0_SUS256_SRVW4_TT1_32_WG128_2_1_WGM15
    SolutionIndex: 155
    SolutionNameMin: Cijk_Alik_Bljk_BBH_MT128x80x64_MI16x16x8x1_SE_1LDSB0_AF0EM4_GRVW2_LBSPP128_PLR9_SU0_SUS256_SRVW0_TT2_80_WG64_4_1_WGM2
    SolutionIndex: 156
    SolutionNameMin: Cijk_Alik_Bljk_BBH_MT64x128x32_MI32x32x2x2_SE_1LDSB0_AF0EM4_GRVW2_LBSPP128_PLR17_SU32_SUS128_SRVW4_TT1_32_WG64_4_1_WGM15
    SolutionIndex: 157
    SolutionNameMin: Cijk_Alik_Bljk_BBH_MT64x128x32_MI32x32x2x2_SE_1LDSB0_AF0EM4_GRVW8_LBSPP128_PLR17_SU0_SUS256_SRVW4_TT1_32_WG64_4_1_WGM15
    SolutionIndex: 158
    SolutionNameMin: Cijk_Alik_Bljk_BBH_MT128x64x32_MI32x32x2x2_SE_1LDSB0_AF0EM1_GRVW8_LBSPP128_PLR17_SU0_SUS256_SRVW4_TT1_32_WG128_2_1_WGM15
    SolutionIndex: 159
    SolutionNameMin: Cijk_Alik_Bljk_BBH_MT64x64x32_MI32x32x4x1_SE_1LDSB0_AF0EM1_GRVW8_LBSPP128_PLR9_SU0_SUS256_SRVW4_TT1_32_WG64_4_1_WGM1
    SolutionIndex: 160
    SolutionNameMin: Cijk_Alik_Bljk_BBH_MT64x128x32_MI32x32x2x2_SE_1LDSB0_AF0EM1_GRVW2_LBSPP128_PLR17_SU0_SUS256_SRVW4_TT1_32_WG64_4_1_WGM15
    SolutionIndex: 161
    SolutionNameMin: Cijk_Alik_Bljk_BBH_MT128x80x64_MI16x16x8x1_SE_1LDSB0_AF0EM4_GRVW2_LBSPP128_PLR9_SU32_SUS128_SRVW0_TT2_80_WG64_4_1_WGM2
    SolutionIndex: 162
    SolutionNameMin: Cijk_Alik_Bljk_BBH_MT64x128x64_MI32x32x4x1_SE_1LDSB0_AF0EM1_GRVW8_LBSPP128_PLR17_SU0_SUS256_SRVW4_TT1_64_WG64_4_1_WGM15
    SolutionIndex: 163
    SolutionNameMin: Cijk_Alik_Bljk_BBH_MT64x128x64_MI32x32x4x1_SE_1LDSB0_AF0EM4_GRVW8_LBSPP128_PLR17_SU0_SUS256_SRVW4_TT1_64_WG64_4_1_WGM15
    SolutionIndex: 164
    SolutionNameMin: Cijk_Alik_Bljk_BBH_MT64x64x32_MI32x32x4x1_SE_1LDSB0_AF0EM1_GRVW2_LBSPP128_PLR9_SU32_SUS128_SRVW4_TT1_32_WG64_4_1_WGM1
    SolutionIndex: 165
    SolutionNameMin: Cijk_Alik_Bljk_BBH_MT64x128x128_MI32x32x4x1_SE_1LDSB1_AF0EM1_GRVW4_LBSPP256_PLR33_SU0_SUS256_SRVW4_TT1_64_WG64_4_1_WGM1
    SolutionIndex: 166
    SolutionNameMin: Cijk_Alik_Bljk_BBH_MT64x128x32_MI32x32x2x2_SE_1LDSB0_AF0EM1_GRVW4_LBSPP128_PLR17_SU0_SUS256_SRVW4_TT1_32_WG64_4_1_WGM1
    SolutionIndex: 167
    SolutionNameMin: Cijk_Alik_Bljk_BBH_MT32x32x128_MI16x16x8x1_SE_1LDSB0_AF0EM1_GRVW8_LBSPP256_PLR17_SU0_SUS256_SRVW4_TT1_16_WG32_8_1_WGM1
    SolutionIndex: 168
    SolutionNameMin: Cijk_Alik_Bljk_BBH_MT128x160x64_MI32x32x4x1_SE_1LDSB1_AF0EM1_GRVW8_LBSPP128_PLR17_SU32_SUS128_SRVW4_TT1_160_WG128_2_1_WGM1
    SolutionIndex: 169
    SolutionNameMin: Cijk_Alik_Bljk_BBH_MT32x32x64_MI16x16x8x1_SE_1LDSB0_AF0EM1_GRVW4_LBSPP128_PLR9_SU0_SUS256_SRVW0_TT1_16_WG32_8_1_WGM1
    SolutionIndex: 170
    SolutionNameMin: Cijk_Alik_Bljk_BBH_MT128x64x32_MI32x32x2x2_SE_1LDSB0_AF0EM1_GRVW8_LBSPP128_PLR17_SU0_SUS256_SRVW4_TT1_32_WG128_2_1_WGM1
    SolutionIndex: 171
    SolutionNameMin: Cijk_Alik_Bljk_BBH_MT32x32x128_MI16x16x8x1_SE_1LDSB0_AF0EM4_GRVW2_LBSPP256_PLR17_SU32_SUS256_SRVW4_TT1_16_WG32_8_1_WGM15
    SolutionIndex: 172
    SolutionNameMin: Cijk_Alik_Bljk_BBH_MT32x32x64_MI16x16x8x1_SE_1LDSB0_AF0EM1_GRVW2_LBSPP128_PLR9_SU0_SUS256_SRVW0_TT1_16_WG32_8_1_WGM1
    SolutionIndex: 173
    SolutionNameMin: Cijk_Alik_Bljk_BBH_MT32x32x64_MI16x16x8x1_SE_1LDSB0_AF0EM1_GRVW2_LBSPP128_PLR9_SU0_SUS256_SRVW0_TT1_16_WG32_8_1_WGM15
    SolutionIndex: 174
    SolutionNameMin: Cijk_Alik_Bljk_BBH_MT128x64x32_MI32x32x2x2_SE_1LDSB0_AF0EM1_GRVW8_LBSPP128_PLR17_SU16_SUS256_SRVW4_TT1_32_WG128_2_1_WGM15
    SolutionIndex: 175
    SolutionNameMin: Cijk_Alik_Bljk_BBH_MT32x32x128_MI16x16x8x1_SE_1LDSB0_AF0EM4_GRVW8_LBSPP256_PLR17_SU0_SUS256_SRVW4_TT1_16_WG32_8_1_WGM1
    SolutionIndex: 176
    SolutionNameMin: Cijk_Alik_Bljk_BBH_MT64x128x32_MI32x32x2x2_SE_1LDSB0_AF0EM4_GRVW8_LBSPP128_PLR17_SU16_SUS128_SRVW4_TT1_32_WG64_4_1_WGM15
    SolutionIndex: 177
    SolutionNameMin: Cijk_Alik_Bljk_BBH_MT64x128x32_MI32x32x4x1_SE_1LDSB0_AF0EM1_GRVW8_LBSPP128_PLR9_SU0_SUS256_SRVW4_TT1_64_WG64_4_1_WGM15
    SolutionIndex: 178
    SolutionNameMin: Cijk_Alik_Bljk_BBH_MT32x32x128_MI16x16x8x1_SE_1LDSB0_AF0EM4_GRVW8_LBSPP256_PLR17_SU0_SUS256_SRVW0_TT1_16_WG32_8_1_WGM2
    SolutionIndex: 179
    SolutionNameMin: Cijk_Alik_Bljk_BBH_MT64x128x32_MI32x32x4x1_SE_1LDSB0_AF0EM4_GRVW8_LBSPP128_PLR9_SU16_SUS128_SRVW4_TT1_64_WG64_4_1_WGM15
    SolutionIndex: 180
    SolutionNameMin: Cijk_Alik_Bljk_BBH_MT128x80x64_MI16x16x8x1_SE_1LDSB0_AF0EM4_GRVW2_LBSPP128_PLR9_SU32_SUS128_SRVW0_TT2_80_WG64_4_1_WGM15
    SolutionIndex: 181
    SolutionNameMin: Cijk_Alik_Bljk_BBH_MT128x96x32_MI32x32x4x1_SE_1LDSB0_AF0EM1_GRVW2_LBSPP128_PLR9_SU32_SUS256_SRVW4_TT1_96_WG128_2_1_WGM15
    SolutionIndex: 182
    SolutionNameMin: Cijk_Alik_Bljk_BBH_MT128x64x32_MI32x32x4x1_SE_1LDSB0_AF0EM4_GRVW8_LBSPP128_PLR9_SU32_SUS256_SRVW4_TT2_32_WG64_4_1_WGM15
    SolutionIndex: 183
    SolutionNameMin: Cijk_Alik_Bljk_BBH_MT128x64x32_MI32x32x2x2_SE_1LDSB0_AF0EM4_GRVW2_LBSPP128_PLR17_SU0_SUS256_SRVW4_TT1_32_WG128_2_1_WGM2
    SolutionIndex: 184
    SolutionNameMin: Cijk_Alik_Bljk_BBH_MT64x32x64_MI16x16x8x1_SE_1LDSB0_AF0EM1_GRVW2_LBSPP128_PLR9_SU0_SUS256_SRVW0_TT2_16_WG32_8_1_WGM1
    SolutionIndex: 185
    SolutionNameMin: Cijk_Alik_Bljk_BBH_MT128x64x32_MI32x32x2x2_SE_1LDSB0_AF0EM4_GRVW8_LBSPP128_PLR17_SU32_SUS128_SRVW4_TT1_32_WG128_2_1_WGM15
    SolutionIndex: 186
    SolutionNameMin: Cijk_Alik_Bljk_BBH_MT64x64x128_MI32x32x4x1_SE_1LDSB1_AF0EM1_GRVW8_LBSPP256_PLR33_SU0_SUS256_SRVW4_TT1_32_WG64_4_1_WGM15
    SolutionIndex: 187
    SolutionNameMin: Cijk_Alik_Bljk_BBH_MT32x32x64_MI16x16x8x1_SE_1LDSB0_AF0EM1_GRVW8_LBSPP128_PLR9_SU0_SUS256_SRVW0_TT1_16_WG32_8_1_WGM1
    SolutionIndex: 188
    SolutionNameMin: Cijk_Alik_Bljk_BBH_MT64x64x32_MI32x32x4x1_SE_1LDSB0_AF0EM4_GRVW2_LBSPP128_PLR9_SU0_SUS256_SRVW4_TT1_32_WG64_4_1_WGM15
    SolutionIndex: 189
    SolutionNameMin: Cijk_Alik_Bljk_BBH_MT128x96x32_MI32x32x4x1_SE_1LDSB0_AF0EM4_GRVW2_LBSPP128_PLR9_SU0_SUS256_SRVW4_TT1_96_WG128_2_1_WGM15
    SolutionIndex: 190
    SolutionNameMin: Cijk_Alik_Bljk_BBH_MT64x128x32_MI32x32x4x1_SE_1LDSB0_AF0EM1_GRVW8_LBSPP128_PLR9_SU16_SUS256_SRVW4_TT1_64_WG64_4_1_WGM1
    SolutionIndex: 191
    SolutionNameMin: Cijk_Alik_Bljk_BBH_MT64x128x32_MI32x32x2x2_SE_1LDSB0_AF0EM1_GRVW2_LBSPP128_PLR17_SU16_SUS256_SRVW4_TT1_32_WG64_4_1_WGM2
    SolutionIndex: 192
    SolutionNameMin: Cijk_Alik_Bljk_BBH_MT128x96x32_MI32x32x4x1_SE_1LDSB0_AF0EM1_GRVW2_LBSPP128_PLR9_SU16_SUS128_SRVW4_TT1_96_WG128_2_1_WGM15
    SolutionIndex: 193
    SolutionNameMin: Cijk_Alik_Bljk_BBH_MT32x32x64_MI16x16x8x1_SE_1LDSB0_AF0EM1_GRVW8_LBSPP128_PLR9_SU16_SUS128_SRVW0_TT1_16_WG32_8_1_WGM1
    SolutionIndex: 194
    SolutionNameMin: Cijk_Alik_Bljk_BBH_MT128x96x32_MI32x32x4x1_SE_1LDSB0_AF0EM4_GRVW2_LBSPP128_PLR9_SU0_SUS256_SRVW4_TT1_96_WG128_2_1_WGM1
    SolutionIndex: 195
    SolutionNameMin: Cijk_Alik_Bljk_BBH_MT64x128x32_MI32x32x4x1_SE_1LDSB0_AF0EM4_GRVW8_LBSPP128_PLR9_SU16_SUS128_SRVW4_TT1_64_WG64_4_1_WGM2
    SolutionIndex: 196
    SolutionNameMin: Cijk_Alik_Bljk_BBH_MT64x64x128_MI32x32x4x1_SE_1LDSB1_AF0EM4_GRVW8_LBSPP256_PLR33_SU0_SUS256_SRVW4_TT1_32_WG64_4_1_WGM1
    SolutionIndex: 197
    SolutionNameMin: Cijk_Alik_Bljk_BBH_MT128x96x32_MI32x32x4x1_SE_1LDSB0_AF0EM4_GRVW2_LBSPP128_PLR9_SU32_SUS256_SRVW4_TT1_96_WG128_2_1_WGM15
    SolutionIndex: 198
    SolutionNameMin: Cijk_Alik_Bljk_BBH_MT128x64x64_MI32x32x4x1_SE_1LDSB0_AF0EM4_GRVW8_LBSPP128_PLR17_SU0_SUS256_SRVW0_TT2_32_WG64_4_1_WGM1
    SolutionIndex: 199
    SolutionNameMin: Cijk_Alik_Bljk_BBH_MT64x128x32_MI32x32x2x2_SE_1LDSB0_AF0EM1_GRVW2_LBSPP128_PLR17_SU32_SUS128_SRVW4_TT1_32_WG64_4_1_WGM1
    SolutionIndex: 200
    SolutionNameMin: Cijk_Alik_Bljk_BBH_MT128x96x32_MI32x32x4x1_SE_1LDSB0_AF0EM4_GRVW2_LBSPP128_PLR9_SU16_SUS128_SRVW4_TT1_96_WG128_2_1_WGM1
    SolutionIndex: 201
    SolutionNameMin: Cijk_Alik_Bljk_BBH_MT64x128x32_MI32x32x4x1_SE_1LDSB0_AF0EM4_GRVW8_LBSPP128_PLR9_SU0_SUS256_SRVW4_TT1_64_WG64_4_1_WGM1
    SolutionIndex: 202
    SolutionNameMin: Cijk_Alik_Bljk_BBH_MT128x96x32_MI32x32x4x1_SE_1LDSB0_AF0EM4_GRVW2_LBSPP128_PLR9_SU16_SUS256_SRVW4_TT1_96_WG128_2_1_WGM15
    SolutionIndex: 203
    SolutionNameMin: Cijk_Alik_Bljk_BBH_MT128x64x32_MI32x32x4x1_SE_1LDSB0_AF0EM1_GRVW8_LBSPP128_PLR9_SU0_SUS256_SRVW4_TT2_32_WG64_4_1_WGM15
    SolutionIndex: 204
    SolutionNameMin: Cijk_Alik_Bljk_BBH_MT64x80x64_MI16x16x8x1_SE_1LDSB0_AF0EM4_GRVW4_LBSPP128_PLR9_SU16_SUS128_SRVW0_TT1_80_WG64_4_1_WGM15
    SolutionIndex: 205
    SolutionNameMin: Cijk_Alik_Bljk_BBH_MT128x64x32_MI32x32x2x2_SE_1LDSB0_AF0EM4_GRVW8_LBSPP128_PLR17_SU32_SUS256_SRVW4_TT1_32_WG128_2_1_WGM15
    SolutionIndex: 206
    SolutionNameMin: Cijk_Alik_Bljk_BBH_MT128x160x64_MI32x32x4x1_SE_1LDSB1_AF0EM4_GRVW2_LBSPP128_PLR17_SU0_SUS256_SRVW0_TT1_160_WG128_2_1_WGM1
    SolutionIndex: 207
    SolutionNameMin: Cijk_Alik_Bljk_BBH_MT128x160x64_MI32x32x4x1_SE_1LDSB1_AF0EM1_GRVW2_LBSPP128_PLR17_SU0_SUS256_SRVW4_TT1_160_WG128_2_1_WGM2
    SolutionIndex: 208
    SolutionNameMin: Cijk_Alik_Bljk_BBH_MT128x96x32_MI32x32x4x1_SE_1LDSB0_AF0EM1_GRVW2_LBSPP128_PLR9_SU32_SUS128_SRVW4_TT1_96_WG128_2_1_WGM15
    SolutionIndex: 209
    SolutionNameMin: Cijk_Alik_Bljk_BBH_MT32x32x64_MI16x16x8x1_SE_1LDSB0_AF0EM1_GRVW8_LBSPP128_PLR9_SU32_SUS128_SRVW0_TT1_16_WG32_8_1_WGM1
    SolutionIndex: 210
    SolutionNameMin: Cijk_Alik_Bljk_BBH_MT64x128x32_MI32x32x2x2_SE_1LDSB0_AF0EM4_GRVW2_LBSPP128_PLR17_SU0_SUS256_SRVW4_TT1_32_WG64_4_1_WGM15
    SolutionIndex: 211
    SolutionNameMin: Cijk_Alik_Bljk_BBH_MT64x128x32_MI32x32x4x1_SE_1LDSB0_AF0EM4_GRVW8_LBSPP128_PLR9_SU0_SUS256_SRVW4_TT1_64_WG64_4_1_WGM15
    SolutionIndex: 212
    SolutionNameMin: Cijk_Alik_Bljk_BBH_MT128x96x32_MI32x32x4x1_SE_1LDSB0_AF0EM1_GRVW2_LBSPP128_PLR9_SU0_SUS256_SRVW4_TT1_96_WG128_2_1_WGM15
    SolutionIndex: 213
    SolutionNameMin: Cijk_Alik_Bljk_BBH_MT64x80x64_MI16x16x8x1_SE_1LDSB0_AF0EM4_GRVW4_LBSPP128_PLR9_SU32_SUS256_SRVW0_TT1_80_WG64_4_1_WGM2
    SolutionIndex: 214
    SolutionNameMin: Cijk_Alik_Bljk_BBH_MT64x128x32_MI32x32x4x1_SE_1LDSB0_AF0EM4_GRVW4_LBSPP128_PLR9_SU0_SUS256_SRVW4_TT1_64_WG64_4_1_WGM1
    SolutionIndex: 215
    SolutionNameMin: Cijk_Alik_Bljk_BBH_MT128x96x32_MI32x32x4x1_SE_1LDSB0_AF0EM4_GRVW2_LBSPP128_PLR9_SU32_SUS128_SRVW4_TT1_96_WG128_2_1_WGM2
    SolutionIndex: 216
    SolutionNameMin: Cijk_Alik_Bljk_BBH_MT256x256x32_MI32x32x4x1_SE_1LDSB1_AF0EM1_GRVW2_LBSPP128_PLR9_SU16_SUS128_SRVW4_TT4_128_WG64_4_1_WGM1
    SolutionIndex: 217
    SolutionNameMin: Cijk_Alik_Bljk_BBH_MT64x128x32_MI32x32x2x2_SE_1LDSB0_AF0EM1_GRVW2_LBSPP128_PLR17_SU16_SUS128_SRVW4_TT1_32_WG64_4_1_WGM15
    SolutionIndex: 218
    SolutionNameMin: Cijk_Alik_Bljk_BBH_MT64x128x32_MI32x32x2x2_SE_1LDSB0_AF0EM4_GRVW8_LBSPP128_PLR17_SU0_SUS256_SRVW4_TT1_32_WG64_4_1_WGM1
    SolutionIndex: 219
    SolutionNameMin: Cijk_Alik_Bljk_BBH_MT128x96x32_MI32x32x4x1_SE_1LDSB0_AF0EM1_GRVW2_LBSPP128_PLR9_SU0_SUS256_SRVW4_TT1_96_WG128_2_1_WGM1
    SolutionIndex: 220
    SolutionNameMin: Cijk_Alik_Bljk_BBH_MT64x128x32_MI32x32x4x1_SE_1LDSB0_AF0EM4_GRVW8_LBSPP128_PLR9_SU32_SUS256_SRVW4_TT1_64_WG64_4_1_WGM15
    SolutionIndex: 221
    SolutionNameMin: Cijk_Alik_Bljk_BBH_MT128x80x64_MI16x16x8x1_SE_1LDSB0_AF0EM4_GRVW2_LBSPP128_PLR9_SU32_SUS256_SRVW0_TT2_80_WG64_4_1_WGM2
    SolutionIndex: 222
    SolutionNameMin: Cijk_Alik_Bljk_BBH_MT128x160x64_MI32x32x4x1_SE_1LDSB1_AF0EM4_GRVW8_LBSPP128_PLR17_SU0_SUS256_SRVW4_TT1_160_WG128_2_1_WGM2
    SolutionIndex: 223
    SolutionNameMin: Cijk_Alik_Bljk_BBH_MT64x128x64_MI32x32x4x1_SE_1LDSB0_AF0EM4_GRVW2_LBSPP128_PLR17_SU16_SUS128_SRVW4_TT1_64_WG64_4_1_WGM2
    SolutionIndex: 224
    SolutionNameMin: Cijk_Alik_Bljk_BBH_MT128x64x32_MI32x32x4x1_SE_1LDSB0_AF0EM1_GRVW2_LBSPP128_PLR9_SU16_SUS128_SRVW4_TT2_32_WG64_4_1_WGM15
    SolutionIndex: 225
    SolutionNameMin: Cijk_Alik_Bljk_BBH_MT128x128x32_MI32x32x4x1_SE_1LDSB0_AF0EM4_GRVW8_LBSPP128_PLR9_SU0_SUS256_SRVW4_TT2_64_WG64_4_1_WGM2
    SolutionIndex: 226
    SolutionNameMin: Cijk_Alik_Bljk_BBH_MT32x32x128_MI16x16x8x1_SE_1LDSB0_AF0EM4_GRVW8_LBSPP256_PLR17_SU0_SUS256_SRVW0_TT1_16_WG32_8_1_WGM15
    SolutionIndex: 227
    SolutionNameMin: Cijk_Alik_Bljk_BBH_MT128x64x32_MI32x32x2x2_SE_1LDSB0_AF0EM1_GRVW8_LBSPP128_PLR17_SU32_SUS128_SRVW4_TT1_32_WG128_2_1_WGM15
    SolutionIndex: 228
    SolutionNameMin: Cijk_Alik_Bljk_BBH_MT32x64x128_MI16x16x8x1_SE_1LDSB0_AF0EM4_GRVW8_LBSPP256_PLR17_SU0_SUS256_SRVW0_TT1_32_WG32_8_1_WGM15
    SolutionIndex: 229
    SolutionNameMin: Cijk_Alik_Bljk_BBH_MT128x64x32_MI32x32x4x1_SE_1LDSB0_AF0EM1_GRVW4_LBSPP128_PLR9_SU32_SUS128_SRVW4_TT2_32_WG64_4_1_WGM1
    SolutionIndex: 230
    SolutionNameMin: Cijk_Alik_Bljk_BBH_MT128x64x32_MI32x32x4x1_SE_1LDSB0_AF0EM1_GRVW8_LBSPP128_PLR9_SU32_SUS128_SRVW4_TT2_32_WG64_4_1_WGM15
    SolutionIndex: 231
    SolutionNameMin: Cijk_Alik_Bljk_BBH_MT64x128x32_MI32x32x2x2_SE_1LDSB0_AF0EM1_GRVW2_LBSPP128_PLR17_SU32_SUS128_SRVW4_TT1_32_WG64_4_1_WGM15
    SolutionIndex: 232
    SolutionNameMin: Cijk_Alik_Bljk_BBH_MT64x128x64_MI32x32x4x1_SE_1LDSB0_AF0EM4_GRVW8_LBSPP128_PLR17_SU0_SUS256_SRVW4_TT1_64_WG64_4_1_WGM2
    SolutionIndex: 233
    SolutionNameMin: Cijk_Alik_Bljk_BBH_MT128x64x32_MI32x32x2x2_SE_1LDSB0_AF0EM1_GRVW8_LBSPP128_PLR17_SU0_SUS256_SRVW4_TT1_32_WG128_2_1_WGM2
    SolutionIndex: 234
    SolutionNameMin: Cijk_Alik_Bljk_BBH_MT32x32x64_MI16x16x8x1_SE_1LDSB0_AF0EM4_GRVW2_LBSPP128_PLR9_SU0_SUS256_SRVW0_TT1_16_WG32_8_1_WGM1
    SolutionIndex: 235
    SolutionNameMin: Cijk_Alik_Bljk_BBH_MT128x64x32_MI32x32x2x2_SE_1LDSB0_AF0EM4_GRVW8_LBSPP128_PLR17_SU0_SUS256_SRVW4_TT1_32_WG128_2_1_WGM1
    SolutionIndex: 236
    SolutionNameMin: Cijk_Alik_Bljk_BBH_MT64x128x32_MI32x32x4x1_SE_1LDSB0_AF0EM1_GRVW8_LBSPP128_PLR9_SU32_SUS256_SRVW4_TT1_64_WG64_4_1_WGM1
    SolutionIndex: 237
    SolutionNameMin: Cijk_Alik_Bljk_BBH_MT64x32x128_MI16x16x8x1_SE_1LDSB0_AF0EM1_GRVW8_LBSPP256_PLR17_SU0_SUS256_SRVW0_TT2_16_WG32_8_1_WGM15
    SolutionIndex: 238
    SolutionNameMin: Cijk_Alik_Bljk_BBH_MT64x64x32_MI32x32x4x1_SE_1LDSB0_AF0EM1_GRVW2_LBSPP128_PLR9_SU0_SUS256_SRVW0_TT1_32_WG64_4_1_WGM1
    SolutionIndex: 239
    SolutionNameMin: Cijk_Alik_Bljk_BBH_MT64x64x32_MI32x32x4x1_SE_1LDSB0_AF0EM4_GRVW8_LBSPP128_PLR9_SU32_SUS128_SRVW4_TT1_32_WG64_4_1_WGM15
    SolutionIndex: 240
    SolutionNameMin: Cijk_Alik_Bljk_BBH_MT64x128x32_MI32x32x2x2_SE_1LDSB0_AF0EM1_GRVW8_LBSPP128_PLR17_SU0_SUS256_SRVW4_TT1_32_WG64_4_1_WGM2
    SolutionIndex: 241
    SolutionNameMin: Cijk_Alik_Bljk_BBH_MT128x96x32_MI32x32x4x1_SE_1LDSB0_AF0EM4_GRVW2_LBSPP128_PLR9_SU0_SUS256_SRVW4_TT1_96_WG128_2_1_WGM2
    SolutionIndex: 242
    SolutionNameMin: Cijk_Alik_Bljk_BBH_MT64x128x64_MI32x32x2x2_SE_1LDSB0_AF0EM1_GRVW8_LBSPP128_PLR33_SU0_SUS256_SRVW4_TT1_32_WG64_4_1_WGM15
    SolutionIndex: 243
    SolutionNameMin: Cijk_Alik_Bljk_BBH_MT64x80x128_MI16x16x8x1_SE_1LDSB1_AF0EM4_GRVW8_LBSPP256_PLR17_SU0_SUS256_SRVW0_TT1_80_WG64_4_1_WGM15
    SolutionIndex: 244
    SolutionNameMin: Cijk_Alik_Bljk_BBH_MT128x160x64_MI32x32x4x1_SE_1LDSB1_AF0EM4_GRVW2_LBSPP128_PLR17_SU16_SUS256_SRVW0_TT1_160_WG128_2_1_WGM1
    SolutionIndex: 245
    SolutionNameMin: Cijk_Alik_Bljk_BBH_MT128x128x32_MI32x32x4x1_SE_1LDSB0_AF0EM1_GRVW8_LBSPP128_PLR9_SU0_SUS256_SRVW4_TT2_64_WG64_4_1_WGM15
    SolutionIndex: 246
    SolutionNameMin: Cijk_Alik_Bljk_BBH_MT128x96x32_MI32x32x4x1_SE_1LDSB0_AF0EM4_GRVW2_LBSPP128_PLR9_SU16_SUS128_SRVW4_TT1_96_WG128_2_1_WGM2
    SolutionIndex: 247
    SolutionNameMin: Cijk_Alik_Bljk_BBH_MT128x96x64_MI32x32x4x1_SE_1LDSB0_AF0EM1_GRVW8_LBSPP128_PLR17_SU0_SUS256_SRVW4_TT1_96_WG128_2_1_WGM1
    SolutionIndex: 248
    SolutionNameMin: Cijk_Alik_Bljk_BBH_MT128x128x32_MI32x32x4x1_SE_1LDSB0_AF0EM4_GRVW8_LBSPP128_PLR9_SU0_SUS256_SRVW4_TT2_64_WG64_4_1_WGM15
    SolutionIndex: 249
    SolutionNameMin: Cijk_Alik_Bljk_BBH_MT128x96x32_MI32x32x4x1_SE_1LDSB0_AF0EM4_GRVW2_LBSPP128_PLR9_SU32_SUS128_SRVW4_TT1_96_WG128_2_1_WGM1
    SolutionIndex: 250
    SolutionNameMin: Cijk_Alik_Bljk_BBH_MT128x144x64_MI16x16x8x1_SE_1LDSB1_AF0EM4_GRVW2_LBSPP128_PLR9_SU0_SUS256_SRVW0_TT2_144_WG64_4_1_WGM2
    SolutionIndex: 251
    SolutionNameMin: Cijk_Alik_Bljk_BBH_MT128x96x32_MI32x32x4x1_SE_1LDSB0_AF0EM1_GRVW2_LBSPP128_PLR9_SU0_SUS256_SRVW4_TT1_96_WG128_2_1_WGM2
    SolutionIndex: 252
    SolutionNameMin: Cijk_Alik_Bljk_BBH_MT128x64x32_MI32x32x4x1_SE_1LDSB0_AF0EM1_GRVW2_LBSPP128_PLR9_SU16_SUS256_SRVW4_TT2_32_WG64_4_1_WGM15
    SolutionIndex: 253
    SolutionNameMin: Cijk_Alik_Bljk_BBH_MT32x32x128_MI16x16x8x1_SE_1LDSB0_AF0EM1_GRVW2_LBSPP256_PLR17_SU0_SUS256_SRVW0_TT1_16_WG32_8_1_WGM1
    SolutionIndex: 254
    SolutionNameMin: Cijk_Alik_Bljk_BBH_MT256x128x32_MI32x32x4x1_SE_1LDSB0_AF0EM1_GRVW2_LBSPP128_PLR9_SU0_SUS256_SRVW4_TT4_64_WG64_4_1_WGM1
    SolutionIndex: 255
    SolutionNameMin: Cijk_Alik_Bljk_BBH_MT32x32x64_MI16x16x8x1_SE_1LDSB0_AF0EM1_GRVW2_LBSPP128_PLR9_SU16_SUS256_SRVW0_TT1_16_WG32_8_1_WGM1
    SolutionIndex: 256
    SolutionNameMin: Cijk_Alik_Bljk_BBH_MT64x128x64_MI32x32x2x2_SE_1LDSB0_AF0EM1_GRVW8_LBSPP128_PLR33_SU0_SUS256_SRVW4_TT1_32_WG64_4_1_WGM1
    SolutionIndex: 257
    SolutionNameMin: Cijk_Alik_Bljk_BBH_MT32x32x64_MI16x16x8x1_SE_1LDSB0_AF0EM1_GRVW8_LBSPP128_PLR9_SU0_SUS256_SRVW0_TT1_16_WG32_8_1_WGM2
    SolutionIndex: 258
    SolutionNameMin: Cijk_Alik_Bljk_BBH_MT64x64x32_MI32x32x4x1_SE_1LDSB0_AF0EM4_GRVW2_LBSPP128_PLR9_SU32_SUS128_SRVW4_TT1_32_WG64_4_1_WGM2
    SolutionIndex: 259
    SolutionNameMin: Cijk_Alik_Bljk_BBH_MT64x128x32_MI32x32x4x1_SE_1LDSB0_AF0EM4_GRVW2_LBSPP128_PLR9_SU0_SUS256_SRVW4_TT1_64_WG64_4_1_WGM2
    SolutionIndex: 260
    SolutionNameMin: Cijk_Alik_Bljk_BBH_MT32x32x64_MI16x16x8x1_SE_1LDSB0_AF0EM1_GRVW2_LBSPP128_PLR9_SU16_SUS128_SRVW0_TT1_16_WG32_8_1_WGM15
    SolutionIndex: 261
    SolutionNameMin: Cijk_Alik_Bljk_BBH_MT128x64x32_MI32x32x2x2_SE_1LDSB0_AF0EM1_GRVW8_LBSPP128_PLR17_SU16_SUS128_SRVW4_TT1_32_WG128_2_1_WGM15
    SolutionIndex: 262
    SolutionNameMin: Cijk_Alik_Bljk_BBH_MT128x64x32_MI32x32x2x2_SE_1LDSB0_AF0EM1_GRVW2_LBSPP128_PLR17_SU32_SUS256_SRVW4_TT1_32_WG128_2_1_WGM15
    SolutionIndex: 263
    SolutionNameMin: Cijk_Alik_Bljk_BBH_MT64x128x128_MI32x32x4x1_SE_1LDSB1_AF0EM4_GRVW4_LBSPP256_PLR33_SU0_SUS256_SRVW4_TT1_64_WG64_4_1_WGM15
    SolutionIndex: 264
    SolutionNameMin: Cijk_Alik_Bljk_BBH_MT128x128x32_MI32x32x4x1_SE_1LDSB0_AF0EM4_GRVW8_LBSPP128_PLR9_SU0_SUS256_SRVW4_TT2_64_WG64_4_1_WGM1
    SolutionIndex: 265
    SolutionNameMin: Cijk_Alik_Bljk_BBH_MT32x32x64_MI16x16x8x1_SE_1LDSB0_AF0EM4_GRVW8_LBSPP128_PLR9_SU0_SUS256_SRVW0_TT1_16_WG32_8_1_WGM1
    SolutionIndex: 266
    SolutionNameMin: Cijk_Alik_Bljk_BBH_MT64x64x128_MI32x32x4x1_SE_1LDSB1_AF0EM1_GRVW8_LBSPP256_PLR33_SU0_SUS256_SRVW4_TT1_32_WG64_4_1_WGM2
    SolutionIndex: 267
    SolutionNameMin: Cijk_Alik_Bljk_BBH_MT64x64x128_MI32x32x4x1_SE_1LDSB1_AF0EM4_GRVW8_LBSPP256_PLR33_SU0_SUS256_SRVW4_TT1_32_WG64_4_1_WGM15
    SolutionIndex: 268
    SolutionNameMin: Cijk_Alik_Bljk_BBH_MT128x64x32_MI32x32x4x1_SE_1LDSB0_AF0EM4_GRVW8_LBSPP128_PLR9_SU16_SUS256_SRVW4_TT2_32_WG64_4_1_WGM15
    SolutionIndex: 269
    SolutionNameMin: Cijk_Alik_Bljk_BBH_MT128x160x32_MI32x32x4x1_SE_1LDSB0_AF0EM4_GRVW2_LBSPP128_PLR9_SU32_SUS128_SRVW0_TT1_160_WG128_2_1_WGM2
    SolutionIndex: 270
    SolutionNameMin: Cijk_Alik_Bljk_BBH_MT128x64x32_MI32x32x2x2_SE_1LDSB0_AF0EM1_GRVW2_LBSPP128_PLR17_SU32_SUS128_SRVW4_TT1_32_WG128_2_1_WGM15
    SolutionIndex: 271
    SolutionNameMin: Cijk_Alik_Bljk_BBH_MT64x128x32_MI32x32x2x2_SE_1LDSB0_AF0EM1_GRVW2_LBSPP128_PLR17_SU32_SUS256_SRVW4_TT1_32_WG64_4_1_WGM1
    SolutionIndex: 272
    SolutionNameMin: Cijk_Alik_Bljk_BBH_MT128x160x32_MI32x32x4x1_SE_1LDSB0_AF0EM1_GRVW2_LBSPP128_PLR9_SU32_SUS128_SRVW4_TT1_160_WG128_2_1_WGM1
    SolutionIndex: 273
    SolutionNameMin: Cijk_Alik_Bljk_BBH_MT128x64x32_MI32x32x2x2_SE_1LDSB0_AF0EM1_GRVW2_LBSPP128_PLR17_SU16_SUS128_SRVW4_TT1_32_WG128_2_1_WGM15
    SolutionIndex: 274
    SolutionNameMin: Cijk_Alik_Bljk_BBH_MT128x64x32_MI32x32x2x2_SE_1LDSB0_AF0EM1_GRVW8_LBSPP128_PLR17_SU32_SUS256_SRVW4_TT1_32_WG128_2_1_WGM15
    SolutionIndex: 275
    SolutionNameMin: Cijk_Alik_Bljk_BBH_MT64x128x32_MI32x32x2x2_SE_1LDSB0_AF0EM4_GRVW2_LBSPP128_PLR17_SU16_SUS128_SRVW4_TT1_32_WG64_4_1_WGM15
    SolutionIndex: 276
    SolutionNameMin: Cijk_Alik_Bljk_BBH_MT32x32x128_MI16x16x8x1_SE_1LDSB0_AF0EM1_GRVW8_LBSPP256_PLR17_SU32_SUS256_SRVW4_TT1_16_WG32_8_1_WGM2
    SolutionIndex: 277
    SolutionNameMin: Cijk_Alik_Bljk_BBH_MT128x64x32_MI32x32x2x2_SE_1LDSB0_AF0EM4_GRVW8_LBSPP128_PLR17_SU0_SUS256_SRVW4_TT1_32_WG128_2_1_WGM2
    SolutionIndex: 278
    SolutionNameMin: Cijk_Alik_Bljk_BBH_MT64x64x32_MI32x32x4x1_SE_1LDSB0_AF0EM4_GRVW2_LBSPP128_PLR9_SU16_SUS128_SRVW4_TT1_32_WG64_4_1_WGM2
    SolutionIndex: 279
    SolutionNameMin: Cijk_Alik_Bljk_BBH_MT128x64x64_MI32x32x4x1_SE_1LDSB0_AF0EM4_GRVW2_LBSPP128_PLR17_SU0_SUS256_SRVW4_TT2_32_WG64_4_1_WGM1
    SolutionIndex: 280
    SolutionNameMin: Cijk_Alik_Bljk_BBH_MT128x64x32_MI32x32x4x1_SE_1LDSB0_AF0EM4_GRVW8_LBSPP128_PLR9_SU16_SUS128_SRVW4_TT2_32_WG64_4_1_WGM15
    SolutionIndex: 281
    SolutionNameMin: Cijk_Alik_Bljk_BBH_MT64x32x128_MI16x16x8x1_SE_1LDSB0_AF0EM1_GRVW8_LBSPP256_PLR17_SU16_SUS256_SRVW0_TT2_16_WG32_8_1_WGM15
    SolutionIndex: 282
    SolutionNameMin: Cijk_Alik_Bljk_BBH_MT64x32x64_MI16x16x8x1_SE_1LDSB0_AF0EM1_GRVW8_LBSPP128_PLR9_SU0_SUS256_SRVW0_TT2_16_WG32_8_1_WGM1
    SolutionIndex: 283
    SolutionNameMin: Cijk_Alik_Bljk_BBH_MT128x144x64_MI16x16x8x1_SE_1LDSB1_AF0EM4_GRVW2_LBSPP128_PLR9_SU0_SUS256_SRVW0_TT2_144_WG64_4_1_WGM15
    SolutionIndex: 284
    SolutionNameMin: Cijk_Alik_Bljk_BBH_MT128x64x64_MI32x32x4x1_SE_1LDSB0_AF0EM4_GRVW8_LBSPP128_PLR17_SU0_SUS256_SRVW4_TT2_32_WG64_4_1_WGM15
    SolutionIndex: 285
    SolutionNameMin: Cijk_Alik_Bljk_BBH_MT32x64x64_MI16x16x8x1_SE_1LDSB0_AF0EM4_GRVW8_LBSPP128_PLR9_SU32_SUS256_SRVW0_TT1_32_WG32_8_1_WGM1
    SolutionIndex: 286
    SolutionNameMin: Cijk_Alik_Bljk_BBH_MT128x144x64_MI16x16x8x1_SE_1LDSB1_AF0EM4_GRVW2_LBSPP128_PLR9_SU0_SUS256_SRVW0_TT2_144_WG64_4_1_WGM1
    SolutionIndex: 287
    SolutionNameMin: Cijk_Alik_Bljk_BBH_MT64x64x32_MI32x32x4x1_SE_1LDSB0_AF0EM1_GRVW2_LBSPP128_PLR9_SU0_SUS256_SRVW4_TT1_32_WG64_4_1_WGM1
    SolutionIndex: 288
    SolutionNameMin: Cijk_Alik_Bljk_BBH_MT32x32x128_MI16x16x8x1_SE_1LDSB0_AF0EM4_GRVW8_LBSPP256_PLR17_SU0_SUS256_SRVW4_TT1_16_WG32_8_1_WGM15
    SolutionIndex: 289
    SolutionNameMin: Cijk_Alik_Bljk_BBH_MT64x128x32_MI32x32x2x2_SE_1LDSB0_AF0EM4_GRVW8_LBSPP128_PLR17_SU16_SUS256_SRVW4_TT1_32_WG64_4_1_WGM1
    SolutionIndex: 290
    SolutionNameMin: Cijk_Alik_Bljk_BBH_MT32x32x128_MI16x16x8x1_SE_1LDSB0_AF0EM4_GRVW8_LBSPP256_PLR17_SU16_SUS256_SRVW0_TT1_16_WG32_8_1_WGM2
    SolutionIndex: 291
    SolutionNameMin: Cijk_Alik_Bljk_BBH_MT128x96x32_MI32x32x4x1_SE_1LDSB0_AF0EM1_GRVW2_LBSPP128_PLR9_SU16_SUS128_SRVW4_TT1_96_WG128_2_1_WGM1
    SolutionIndex: 292
    SolutionNameMin: Cijk_Alik_Bljk_BBH_MT64x32x64_MI16x16x8x1_SE_1LDSB0_AF0EM1_GRVW8_LBSPP128_PLR9_SU0_SUS256_SRVW0_TT2_16_WG32_8_1_WGM15
    SolutionIndex: 293
    SolutionNameMin: Cijk_Alik_Bljk_BBH_MT32x32x128_MI16x16x8x1_SE_1LDSB0_AF0EM1_GRVW8_LBSPP256_PLR17_SU0_SUS256_SRVW0_TT1_16_WG32_8_1_WGM15
    SolutionIndex: 294
    SolutionNameMin: Cijk_Alik_Bljk_BBH_MT32x32x128_MI16x16x8x1_SE_1LDSB0_AF0EM4_GRVW8_LBSPP256_PLR17_SU32_SUS256_SRVW4_TT1_16_WG32_8_1_WGM1
    SolutionIndex: 295
    SolutionNameMin: Cijk_Alik_Bljk_BBH_MT64x32x128_MI16x16x8x1_SE_1LDSB0_AF0EM1_GRVW4_LBSPP256_PLR17_SU0_SUS256_SRVW0_TT2_16_WG32_8_1_WGM15
    SolutionIndex: 296
    SolutionNameMin: Cijk_Alik_Bljk_BBH_MT128x160x64_MI32x32x4x1_SE_1LDSB1_AF0EM4_GRVW2_LBSPP128_PLR17_SU0_SUS256_SRVW4_TT1_160_WG128_2_1_WGM2
    SolutionIndex: 297
    SolutionNameMin: Cijk_Alik_Bljk_BBH_MT128x64x32_MI32x32x4x1_SE_1LDSB0_AF0EM4_GRVW8_LBSPP128_PLR9_SU16_SUS128_SRVW4_TT2_32_WG64_4_1_WGM2
    SolutionIndex: 298
    SolutionNameMin: Cijk_Alik_Bljk_BBH_MT64x128x32_MI32x32x2x2_SE_1LDSB0_AF0EM4_GRVW8_LBSPP128_PLR17_SU0_SUS256_SRVW4_TT1_32_WG64_4_1_WGM2
    SolutionIndex: 299
    SolutionNameMin: Cijk_Alik_Bljk_BBH_MT64x128x32_MI32x32x2x2_SE_1LDSB0_AF0EM4_GRVW2_LBSPP128_PLR17_SU16_SUS256_SRVW4_TT1_32_WG64_4_1_WGM2
    SolutionIndex: 300
    SolutionNameMin: Cijk_Alik_Bljk_BBH_MT256x256x32_MI32x32x4x1_SE_1LDSB1_AF0EM4_GRVW2_LBSPP128_PLR9_SU0_SUS256_SRVW4_TT4_128_WG64_4_1_WGM1
    SolutionIndex: 301
    SolutionNameMin: Cijk_Alik_Bljk_BBH_MT128x96x128_MI32x32x4x1_SE_1LDSB1_AF0EM4_GRVW2_LBSPP256_PLR33_SU32_SUS256_SRVW0_TT1_96_WG128_2_1_WGM2
    SolutionIndex: 302
    SolutionNameMin: Cijk_Alik_Bljk_BBH_MT64x128x32_MI32x32x2x2_SE_1LDSB0_AF0EM1_GRVW8_LBSPP128_PLR17_SU16_SUS256_SRVW4_TT1_32_WG64_4_1_WGM2
    SolutionIndex: 303
    SolutionNameMin: Cijk_Alik_Bljk_BBH_MT128x96x32_MI32x32x4x1_SE_1LDSB0_AF0EM4_GRVW4_LBSPP128_PLR9_SU32_SUS128_SRVW4_TT1_96_WG128_2_1_WGM1
    SolutionIndex: 304
    SolutionNameMin: Cijk_Alik_Bljk_BBH_MT64x128x32_MI32x32x2x2_SE_1LDSB0_AF0EM4_GRVW4_LBSPP128_PLR17_SU0_SUS256_SRVW4_TT1_32_WG64_4_1_WGM15
    SolutionIndex: 305
    SolutionNameMin: Cijk_Alik_Bljk_BBH_MT64x128x32_MI32x32x2x2_SE_1LDSB0_AF0EM4_GRVW8_LBSPP128_PLR17_SU32_SUS256_SRVW4_TT1_32_WG64_4_1_WGM15
    SolutionIndex: 306
    SolutionNameMin: Cijk_Alik_Bljk_BBH_MT128x256x32_MI32x32x4x1_SE_1LDSB0_AF0EM4_GRVW2_LBSPP128_PLR9_SU0_SUS256_SRVW4_TT2_128_WG64_4_1_WGM1
    SolutionIndex: 307
    SolutionNameMin: Cijk_Alik_Bljk_BBH_MT128x64x32_MI32x32x2x2_SE_1LDSB0_AF0EM1_GRVW2_LBSPP128_PLR17_SU16_SUS256_SRVW4_TT1_32_WG128_2_1_WGM15
    SolutionIndex: 308
    SolutionNameMin: Cijk_Alik_Bljk_BBH_MT64x128x32_MI32x32x4x1_SE_1LDSB0_AF0EM4_GRVW8_LBSPP128_PLR9_SU16_SUS128_SRVW4_TT1_64_WG64_4_1_WGM1
    SolutionIndex: 309
    SolutionNameMin: Cijk_Alik_Bljk_BBH_MT64x64x32_MI32x32x4x1_SE_1LDSB0_AF0EM4_GRVW2_LBSPP128_PLR9_SU0_SUS256_SRVW4_TT1_32_WG64_4_1_WGM1
    SolutionIndex: 310
    SolutionNameMin: Cijk_Alik_Bljk_BBH_MT64x128x32_MI32x32x4x1_SE_1LDSB0_AF0EM4_GRVW8_LBSPP128_PLR9_SU0_SUS256_SRVW4_TT1_64_WG64_4_1_WGM2
    SolutionIndex: 311
    SolutionNameMin: Cijk_Alik_Bljk_BBH_MT128x96x64_MI32x32x4x1_SE_1LDSB0_AF0EM4_GRVW2_LBSPP128_PLR17_SU0_SUS256_SRVW0_TT1_96_WG128_2_1_WGM1
    SolutionIndex: 312
    SolutionNameMin: Cijk_Alik_Bljk_BBH_MT128x96x32_MI32x32x4x1_SE_1LDSB0_AF0EM4_GRVW2_LBSPP128_PLR9_SU32_SUS128_SRVW0_TT1_96_WG128_2_1_WGM2
    SolutionIndex: 313
    SolutionNameMin: Cijk_Alik_Bljk_BBH_MT64x32x64_MI16x16x8x1_SE_1LDSB0_AF0EM4_GRVW8_LBSPP128_PLR9_SU0_SUS256_SRVW4_TT2_16_WG32_8_1_WGM1
    SolutionIndex: 314
    SolutionNameMin: Cijk_Alik_Bljk_BBH_MT128x96x32_MI32x32x4x1_SE_1LDSB0_AF0EM1_GRVW2_LBSPP128_PLR9_SU32_SUS128_SRVW4_TT1_96_WG128_2_1_WGM1
- - - [511, 4096, 1, 4096]
    - [5, 1.999]
  - - [512, 3071, 1, 3072]
    - [5, 2.388]
  - - [2880, 3073, 1, 3072]
    - [5, 2.907]
  - - [511, 3072, 1, 3072]
    - [5, 2.378]
  - - [1024, 512, 1, 1025]
    - [5, 1.147]
  - - [511, 2048, 1, 2048]
    - [6, 1.612]
  - - [8192, 8193, 1, 8192]
    - [8, 3.275]
  - - [3072, 3072, 1, 3071]
    - [5, 3.114]
  - - [8192, 8192, 1, 8193]
    - [8, 3.467]
  - - [513, 1024, 1, 1024]
    - [5, 1.131]
  - - [512, 1023, 1, 1024]
    - [5, 1.121]
  - - [512, 2048, 1, 2047]
    - [6, 1.641]
  - - [513, 4096, 1, 4096]
    - [5, 1.988]
  - - [3073, 512, 1, 3072]
    - [5, 2.381]
  - - [4096, 4096, 1, 4097]
    - [5, 3.106]
  - - [1025, 1024, 1, 1024]
    - [6, 1.61]
  - - [8192, 8191, 1, 8192]
    - [8, 3.302]
  - - [8192, 512, 1, 8193]
    - [5, 2.685]
  - - [2880, 3071, 1, 3072]
    - [7, 3.128]
  - - [512, 1025, 1, 1024]
    - [5, 1.16]
  - - [2048, 513, 1, 2048]
    - [6, 1.636]
  - - [1024, 1024, 1, 1025]
    - [6, 1.594]
  - - [960, 1024, 1, 1023]
    - [7, 2.003]
  - - [3072, 512, 1, 3071]
    - [5, 2.394]
  - - [960, 1025, 1, 1024]
    - [6, 1.524]
  - - [3072, 3071, 1, 3072]
    - [5, 3.099]
  - - [512, 2048, 1, 2049]
    - [6, 1.625]
  - - [3072, 511, 1, 3072]
    - [5, 2.386]
  - - [2049, 512, 1, 2048]
    - [6, 1.627]
  - - [512, 8191, 1, 8192]
    - [5, 2.559]
  - - [513, 3072, 1, 3072]
    - [5, 2.374]
  - - [4096, 4095, 1, 4096]
    - [5, 3.063]
  - - [511, 1024, 1, 1024]
    - [5, 1.117]
  - - [513, 512, 1, 512]
    - [9, 0.664]
  - - [1024, 511, 1, 1024]
    - [5, 1.152]
  - - [3072, 3072, 1, 3073]
    - [5, 3.116]
  - - [960, 1024, 1, 1025]
    - [7, 1.991]
  - - [959, 1024, 1, 1024]
    - [6, 1.963]
  - - [512, 3072, 1, 3073]
    - [5, 2.383]
  - - [1023, 512, 1, 1024]
    - [5, 1.153]
  - - [3072, 512, 1, 3073]
    - [5, 2.4]
  - - [512, 2049, 1, 2048]
    - [6, 1.628]
  - - [513, 8192, 1, 8192]
    - [7, 2.482]
  - - [1024, 513, 1, 1024]
    - [5, 1.164]
  - - [8192, 511, 1, 8192]
    - [5, 2.621]
  - - [4096, 4097, 1, 4096]
    - [5, 3.051]
  - - [512, 3072, 1, 3071]
    - [5, 2.381]
  - - [2048, 2047, 1, 2048]
    - [5, 2.645]
  - - [8193, 8192, 1, 8192]
    - [8, 3.304]
  - - [512, 4096, 1, 4095]
    - [6, 1.995]
  - - [1024, 1023, 1, 1024]
    - [6, 1.605]
  - - [3073, 3072, 1, 3072]
    - [5, 3.099]
  - - [512, 3073, 1, 3072]
    - [5, 2.388]
  - - [4096, 4096, 1, 4095]
    - [8, 3.094]
  - - [512, 8192, 1, 8191]
    - [7, 2.534]
  - - [8191, 512, 1, 8192]
    - [5, 2.624]
  - - [1025, 512, 1, 1024]
    - [5, 1.165]
  - - [2881, 3072, 1, 3072]
    - [5, 2.915]
  - - [64, 1024, 1, 1024]
    - [11, 3.509]
  - - [1024, 512, 1, 1023]
    - [5, 1.153]
  - - [513, 2048, 1, 2048]
    - [6, 1.63]
  - - [2880, 3072, 1, 3073]
    - [7, 3.112]
  - - [512, 512, 1, 513]
    - [9, 0.653]
  - - [4095, 512, 1, 4096]
    - [5, 2.058]
  - - [1024, 1025, 1, 1024]
    - [6, 1.6]
  - - [2879, 3072, 1, 3072]
    - [7, 3.13]
  - - [512, 8192, 1, 8193]
    - [5, 2.663]
  - - [511, 8192, 1, 8192]
    - [5, 2.545]
  - - [8192, 513, 1, 8192]
    - [5, 2.624]
  - - [512, 8193, 1, 8192]
    - [5, 2.532]
  - - [512, 512, 1, 511]
    - [9, 0.666]
  - - [2047, 2048, 1, 2048]
    - [5, 2.645]
  - - [2049, 2048, 1, 2048]
    - [5, 2.646]
  - - [960, 1023, 1, 1024]
    - [7, 1.974]
  - - [2880, 3072, 1, 3071]
    - [7, 3.114]
  - - [64, 1025, 1, 1024]
    - [9, 0.201]
  - - [2048, 511, 1, 2048]
    - [6, 1.594]
  - - [4096, 513, 1, 4096]
    - [5, 2.065]
  - - [4097, 512, 1, 4096]
    - [5, 2.062]
  - - [8192, 512, 1, 8191]
    - [7, 2.546]
  - - [2048, 2049, 1, 2048]
    - [5, 2.644]
  - - [2048, 512, 1, 2047]
    - [6, 1.623]
  - - [3071, 3072, 1, 3072]
    - [5, 3.1]
  - - [4096, 511, 1, 4096]
    - [5, 2.058]
  - - [64, 1024, 1, 1025]
    - [9, 0.204]
  - - [2047, 512, 1, 2048]
    - [6, 1.622]
  - - [63, 1024, 1, 1024]
    - [9, 0.199]
  - - [3072, 513, 1, 3072]
    - [5, 2.38]
  - - [512, 4095, 1, 4096]
    - [5, 2.013]
  - - [512, 1024, 1, 1025]
    - [5, 1.146]
  - - [3071, 512, 1, 3072]
    - [5, 2.384]
  - - [512, 511, 1, 512]
    - [9, 0.678]
  - - [4097, 4096, 1, 4096]
    - [5, 3.061]
  - - [2048, 2048, 1, 2047]
    - [5, 2.631]
  - - [512, 4096, 1, 4097]
    - [5, 2.104]
  - - [3072, 3073, 1, 3072]
    - [5, 3.098]
  - - [512, 2047, 1, 2048]
    - [6, 1.618]
  - - [2048, 2048, 1, 2049]
    - [5, 2.666]
  - - [8191, 8192, 1, 8192]
    - [8, 3.304]
  - - [64, 1023, 1, 1024]
    - [9, 0.202]
  - - [4096, 512, 1, 4097]
    - [5, 2.129]
  - - [65, 1024, 1, 1024]
    - [10, 0.195]
  - - [512, 513, 1, 512]
    - [9, 0.687]
  - - [8192, 8192, 1, 8191]
    - [8, 3.469]
  - - [1024, 1024, 1, 1023]
    - [6, 1.613]
  - - [512, 4097, 1, 4096]
    - [5, 2.02]
  - - [511, 512, 1, 512]
    - [9, 0.675]
  - - [4096, 512, 1, 4095]
    - [7, 2.002]
  - - [8193, 512, 1, 8192]
    - [5, 2.628]
  - - [961, 1024, 1, 1024]
    - [6, 1.519]
  - - [512, 1024, 1, 1023]
    - [5, 1.153]
  - - [4095, 4096, 1, 4096]
    - [5, 3.063]
  - - [64, 1024, 1, 1023]
    - [9, 0.198]
  - - [2048, 512, 1, 2049]
    - [6, 1.64]
  - - [1023, 1024, 1, 1024]
    - [6, 1.605]
  - - [512, 512, 1, 512]
    - [144, 20.934]
  - - [512, 1024, 1, 1024]
    - [12, 16.86]
  - - [512, 2048, 1, 2048]
    - [12, 19.231]
  - - [512, 3072, 1, 3072]
    - [12, 28.838]
  - - [512, 4096, 1, 4096]
    - [12, 26.877]
  - - [512, 8192, 1, 8192]
    - [12, 33.16]
  - - [960, 1024, 1, 1024]
    - [232, 65.877]
  - - [1024, 1024, 1, 1024]
    - [155, 53.735]
  - - [2048, 2048, 1, 2048]
    - [200, 86.253]
  - - [2880, 3072, 1, 3072]
    - [12, 35.623]
  - - [3072, 512, 1, 3072]
    - [12, 29.023]
  - - [3072, 3072, 1, 3072]
    - [12, 35.788]
  - - [4096, 512, 1, 4096]
    - [12, 26.94]
  - - [4096, 4096, 1, 4096]
    - [222, 92.002]
  - - [8192, 512, 1, 8192]
    - [12, 33.15]
  - - [8192, 8192, 1, 8192]
    - [202, 96.12]
  - - [479, 1024, 1, 1024]
    - [14, 1.499]
  - - [479, 2048, 1, 2048]
    - [14, 2.3]
  - - [480, 1023, 1, 1024]
    - [14, 1.503]
  - - [480, 1024, 1, 1023]
    - [14, 1.524]
  - - [480, 1024, 1, 1025]
    - [14, 1.528]
  - - [480, 1025, 1, 1024]
    - [13, 1.26]
  - - [480, 2047, 1, 2048]
    - [14, 2.302]
  - - [480, 2048, 1, 2047]
    - [14, 2.306]
  - - [480, 2048, 1, 2049]
    - [14, 2.31]
  - - [480, 2049, 1, 2048]
    - [14, 1.812]
  - - [481, 1024, 1, 1024]
    - [13, 1.225]
  - - [481, 2048, 1, 2048]
    - [14, 1.775]
  - - [511, 480, 1, 512]
    - [15, 0.75]
  - - [512, 479, 1, 512]
    - [15, 0.747]
  - - [512, 480, 1, 511]
    - [15, 0.755]
  - - [512, 480, 1, 513]
    - [15, 0.752]
  - - [512, 481, 1, 512]
    - [15, 0.727]
  - - [513, 480, 1, 512]
    - [15, 0.71]
  - - [1023, 480, 1, 1024]
    - [15, 1.419]
  - - [1024, 479, 1, 1024]
    - [15, 1.413]
  - - [1024, 480, 1, 1023]
    - [15, 1.408]
  - - [1024, 480, 1, 1025]
    - [15, 1.41]
  - - [1024, 481, 1, 1024]
    - [13, 1.252]
  - - [1025, 480, 1, 1024]
    - [13, 1.257]
  - - [2047, 480, 1, 2048]
    - [16, 2.319]
  - - [2048, 479, 1, 2048]
    - [16, 2.315]
  - - [2048, 480, 1, 2047]
    - [16, 2.279]
  - - [2048, 480, 1, 2049]
    - [16, 2.276]
  - - [2048, 481, 1, 2048]
    - [14, 1.789]
  - - [2049, 480, 1, 2048]
    - [14, 1.785]
  - - [480, 1024, 1, 1024]
    - [138, 41.869]
  - - [480, 2048, 1, 2048]
    - [139, 65.081]
  - - [512, 480, 1, 512]
    - [260, 21.217]
  - - [1024, 480, 1, 1024]
    - [140, 45.291]
  - - [2048, 480, 1, 2048]
    - [141, 65.306]
  - - [480, 3072, 1, 3072]
    - [17, 23.039]
  - - [480, 4096, 1, 4096]
    - [19, 22.557]
  - - [480, 8192, 1, 8192]
    - [18, 27.105]
  - - [3072, 480, 1, 3072]
    - [20, 23.395]
  - - [4096, 480, 1, 4096]
    - [20, 21.441]
  - - [8192, 480, 1, 8192]
    - [21, 27.075]
  - - [17, 17, 1, 64]
    - [25, 0.003]
  - - [24, 24, 1, 64]
    - [31, 0.006]
  - - [30, 31, 1, 64]
    - [31, 0.01]
  - - [32, 32, 1, 64]
    - [28, 0.01]
  - - [32, 35, 1, 64]
    - [33, 0.011]
  - - [31, 31, 1, 64]
    - [29, 0.01]
  - - [34, 34, 1, 64]
    - [27, 0.011]
  - - [30, 30, 1, 64]
    - [26, 0.009]
  - - [17, 15, 1, 64]
    - [35, 0.003]
  - - [35, 35, 1, 64]
    - [31, 0.013]
  - - [21, 17, 1, 64]
    - [26, 0.004]
  - - [21, 21, 1, 64]
    - [25, 0.004]
  - - [15, 14, 1, 64]
    - [25, 0.002]
  - - [14, 14, 1, 64]
    - [24, 0.001]
  - - [15, 15, 1, 64]
    - [25, 0.002]
  - - [34, 24, 1, 64]
    - [22, 0.008]
  - - [2, 4, 1, 1024]
    - [172, 0.001]
  - - [2, 32, 1, 1024]
    - [145, 0.01]
  - - [2, 2048, 1, 1024]
    - [145, 0.618]
  - - [64, 128, 512, 128]
    - [304, 27.606]
  - - [64, 512, 1, 512]
    - [276, 3.975]
  - - [64, 512, 64, 512]
    - [196, 43.593]
  - - [128, 128, 512, 64]
    - [177, 27.53]
  - - [512, 512, 1, 64]
    - [184, 4.83]
  - - [512, 512, 64, 64]
    - [308, 37.216]
  - - [1024, 4, 1, 1024]
    - [253, 0.66]
  - - [1024, 4, 1, 1024]
    - [253, 0.66]
  - - [1024, 32, 1, 1024]
    - [175, 5.414]
  - - [1024, 2048, 1, 1024]
    - [250, 61.931]
  - - [1024, 2048, 1, 4096]
    - [283, 78.046]
  - - [1024, 4096, 1, 1024]
    - [246, 79.278]
  - - [1024, 4096, 1, 4096]
    - [152, 86.299]
  - - [4096, 2048, 1, 1024]
    - [189, 84.707]
  - - [4096, 4096, 1, 1024]
    - [152, 87.14]
  - - [30528, 2048, 1, 1024]
    - [275, 91.394]
  - - [30528, 4096, 1, 1024]
    - [146, 92.516]
  - - [3, 3, 512, 64]
    - [255, 0.057]
  - - [5, 5, 512, 64]
    - [169, 0.159]
  - - [5, 5, 960, 64]
    - [169, 0.231]
  - - [9, 9, 512, 64]
    - [169, 0.491]
  - - [27, 27, 32768, 128]
    - [187, 14.644]
  - - [32, 1600, 1, 512]
    - [294, 5.772]
  - - [33, 33, 1600, 32]
    - [159, 3.356]
  - - [64, 512, 1, 1024]
    - [293, 5.658]
  - - [64, 960, 1, 1024]
    - [178, 9.652]
  - - [128, 32768, 1, 256]
    - [154, 53.166]
  - - [256, 684, 1, 1024]
    - [228, 23.144]
  - - [256, 1280, 1, 1024]
    - [267, 36.513]
  - - [256, 1536, 1, 1024]
    - [186, 41.869]
  - - [256, 2304, 1, 1024]
    - [204, 45.768]
  - - [256, 2560, 1, 1024]
    - [188, 44.859]
  - - [256, 2816, 1, 1024]
    - [148, 48.479]
  - - [256, 3328, 1, 1024]
    - [256, 56.894]
  - - [256, 3584, 1, 1024]
    - [242, 61.701]
  - - [256, 4608, 1, 1024]
    - [180, 59.185]
  - - [256, 4864, 1, 1024]
    - [311, 57.924]
  - - [256, 5376, 1, 1024]
    - [247, 64.968]
  - - [256, 5888, 1, 1024]
    - [158, 61.076]
  - - [256, 6144, 1, 1024]
    - [158, 63.733]
  - - [256, 6400, 1, 1024]
    - [158, 65.83]
  - - [256, 6656, 1, 1024]
    - [158, 68.178]
  - - [256, 7168, 1, 1024]
    - [158, 72.514]
  - - [256, 7424, 1, 1024]
    - [203, 74.642]
  - - [256, 7936, 1, 1024]
    - [286, 62.4]
  - - [256, 8192, 1, 1024]
    - [269, 64.004]
  - - [256, 8448, 1, 1024]
    - [250, 63.671]
  - - [256, 8960, 1, 1024]
    - [168, 68.052]
  - - [256, 9984, 1, 1024]
    - [194, 69.583]
  - - [256, 10496, 1, 1024]
    - [158, 72.127]
  - - [256, 11264, 1, 1024]
    - [246, 76.759]
  - - [256, 11520, 1, 1024]
    - [212, 78.722]
  - - [256, 11776, 1, 1024]
    - [183, 65.213]
  - - [256, 12544, 1, 1024]
    - [154, 69.077]
  - - [256, 13312, 1, 1024]
    - [233, 72.896]
  - - [256, 14336, 1, 1024]
    - [157, 77.042]
  - - [256, 14592, 1, 1024]
    - [203, 78.246]
  - - [256, 14848, 1, 1024]
    - [157, 79.532]
  - - [256, 15104, 1, 1024]
    - [147, 80.816]
  - - [256, 16128, 1, 1024]
    - [192, 77.429]
  - - [256, 18176, 1, 1024]
    - [154, 80.125]
  - - [256, 18944, 1, 1024]
    - [177, 81.248]
  - - [256, 19200, 1, 1024]
    - [210, 81.774]
  - - [256, 20480, 1, 1024]
    - [230, 76.647]
  - - [256, 20992, 1, 1024]
    - [183, 78.444]
  - - [256, 21248, 1, 1024]
    - [183, 78.92]
  - - [256, 21504, 1, 1024]
    - [194, 80.48]
  - - [256, 22016, 1, 1024]
    - [152, 81.218]
  - - [256, 22344, 1, 1024]
    - [202, 81.874]
  - - [256, 23296, 1, 1024]
    - [261, 76.048]
  - - [256, 23552, 1, 1024]
    - [233, 76.376]
  - - [256, 31488, 1, 1024]
    - [219, 81.227]
  - - [256, 32768, 1, 512]
    - [158, 77.67]
  - - [256, 33536, 1, 1024]
    - [152, 84.817]
  - - [256, 44505, 1, 1024]
    - [194, 86.071]
  - - [512, 1600, 1, 512]
    - [239, 42.899]
  - - [512, 32768, 1, 13]
    - [303, 6.907]
  - - [512, 32768, 1, 1024]
    - [194, 87.164]
  - - [684, 8976, 1, 256]
    - [195, 61.159]
  - - [1024, 200, 1, 560]
    - [173, 14.907]
  - - [1024, 512, 1, 1024]
    - [142, 43.126]
  - - [1024, 512, 1, 1600]
    - [204, 48.015]
  - - [1024, 960, 1, 1024]
    - [198, 66.576]
  - - [1024, 960, 1, 1600]
    - [284, 74.153]
  - - [1024, 1600, 1, 560]
    - [289, 48.102]
  - - [1024, 1600, 1, 1024]
    - [157, 66.67]
  - - [1024, 32768, 1, 480]
    - [215, 89.744]
  - - [1024, 32768, 1, 1024]
    - [152, 91.544]
  - - [1280, 8976, 1, 256]
    - [215, 71.773]
  - - [1792, 8976, 1, 256]
    - [246, 77.381]
  - - [2048, 114, 1, 512]
    - [285, 17.757]
  - - [2048, 114, 1, 768]
    - [313, 22.676]
  - - [2048, 215, 1, 512]
    - [292, 27.048]
  - - [2048, 215, 1, 768]
    - [153, 32.795]
  - - [2048, 256, 1, 512]
    - [309, 30.45]
  - - [2048, 256, 1, 768]
    - [258, 33.795]
  - - [2048, 512, 1, 67]
    - [166, 9.962]
  - - [2048, 512, 1, 74]
    - [214, 10.679]
  - - [2048, 512, 1, 100]
    - [166, 14.018]
  - - [2048, 512, 1, 2048]
    - [180, 63.598]
  - - [2048, 684, 1, 512]
    - [179, 49.535]
  - - [2048, 684, 1, 768]
    - [157, 54.422]
  - - [2048, 960, 1, 74]
    - [229, 17.916]
  - - [2048, 960, 1, 2048]
    - [203, 81.65]
  - - [2048, 1536, 1, 512]
    - [201, 62.803]
  - - [2048, 1536, 1, 768]
    - [310, 67.489]
  - - [2048, 8976, 1, 256]
    - [215, 76.526]
  - - [2304, 8976, 1, 256]
    - [246, 76.995]
  - - [2560, 8976, 1, 256]
    - [246, 78.869]
  - - [2816, 8976, 1, 256]
    - [246, 79.314]
  - - [3072, 8976, 1, 256]
    - [246, 80.709]
  - - [3328, 8976, 1, 256]
    - [215, 80.32]
  - - [3840, 8976, 1, 256]
    - [215, 80.877]
  - - [4096, 8976, 1, 256]
    - [215, 80.037]
  - - [4352, 8976, 1, 256]
    - [246, 81.415]
  - - [4608, 8976, 1, 256]
    - [297, 80.792]
  - - [4864, 8976, 1, 256]
    - [215, 81.051]
  - - [5120, 8976, 1, 256]
    - [308, 80.365]
  - - [5376, 8976, 1, 256]
    - [235, 80.871]
  - - [5632, 8976, 1, 256]
    - [170, 80.5]
  - - [5888, 8976, 1, 256]
    - [235, 80.494]
  - - [6144, 8976, 1, 256]
    - [241, 79.591]
  - - [6400, 8976, 1, 256]
    - [235, 79.209]
  - - [7168, 8976, 1, 256]
    - [246, 79.169]
  - - [7936, 8976, 1, 256]
    - [249, 77.537]
  - - [8192, 8976, 1, 256]
    - [215, 77.095]
  - - [8448, 8976, 1, 256]
    - [291, 77.602]
  - - [8960, 8976, 1, 256]
    - [200, 77.086]
  - - [9472, 8976, 1, 256]
    - [200, 76.993]
  - - [9728, 8976, 1, 256]
    - [215, 76.515]
  - - [9984, 8976, 1, 256]
    - [200, 76.637]
  - - [10240, 8976, 1, 256]
    - [143, 76.379]
  - - [10496, 8976, 1, 256]
    - [205, 76.511]
  - - [11264, 8976, 1, 256]
    - [182, 76.86]
  - - [11776, 8976, 1, 256]
    - [268, 76.888]
  - - [12544, 8976, 1, 256]
    - [182, 76.993]
  - - [13312, 8976, 1, 256]
    - [205, 76.9]
  - - [13568, 8976, 1, 256]
    - [268, 76.05]
  - - [13824, 8976, 1, 256]
    - [220, 76.478]
  - - [15104, 8976, 1, 256]
    - [261, 76.912]
  - - [15360, 8976, 1, 256]
    - [189, 76.388]
  - - [15872, 8976, 1, 256]
    - [205, 76.734]
  - - [16128, 8976, 1, 256]
    - [189, 76.551]
  - - [17152, 8976, 1, 256]
    - [189, 76.89]
  - - [18176, 8976, 1, 256]
    - [182, 76.767]
  - - [18688, 8976, 1, 256]
    - [205, 77.462]
  - - [18944, 8976, 1, 256]
    - [179, 77.051]
  - - [19712, 8976, 1, 256]
    - [274, 77.423]
  - - [19968, 8976, 1, 256]
    - [143, 77.236]
  - - [20480, 8976, 1, 256]
    - [268, 77.216]
  - - [20992, 8976, 1, 256]
    - [227, 77.456]
  - - [21248, 8976, 1, 256]
    - [230, 76.363]
  - - [23552, 8976, 1, 256]
    - [185, 77.607]
  - - [28672, 8976, 1, 256]
    - [143, 77.565]
  - - [31488, 8976, 1, 256]
    - [185, 77.803]
  - - [33536, 8976, 1, 256]
    - [182, 77.59]
  - - [44505, 8976, 1, 256]
    - [261, 75.994]
  - - [14, 14, 10880, 64]
    - [187, 2.903]
  - - [15, 14, 10880, 64]
    - [187, 3.092]
  - - [15, 15, 7680, 64]
    - [187, 2.944]
  - - [15, 15, 10880, 64]
    - [187, 3.336]
  - - [17, 15, 7680, 64]
    - [187, 3.323]
  - - [17, 17, 7680, 64]
    - [187, 3.749]
  - - [21, 17, 6144, 64]
    - [187, 3.493]
  - - [21, 21, 6144, 64]
    - [209, 3.996]
  - - [24, 24, 4736, 64]
    - [265, 7.725]
  - - [30, 30, 2048, 64]
    - [209, 6.552]
  - - [30, 31, 2048, 64]
    - [209, 6.632]
  - - [31, 31, 2048, 64]
    - [255, 6.66]
  - - [32, 32, 4608, 64]
    - [187, 8.804]
  - - [32, 35, 4608, 64]
    - [150, 8.366]
  - - [34, 24, 4736, 64]
    - [282, 7.503]
  - - [34, 34, 4736, 64]
    - [164, 7.247]
  - - [35, 35, 4608, 64]
    - [287, 6.675]
  - - [1024, 3840, 1, 1024]
    - [177, 81.65]
  - - [1024, 3840, 1, 4096]
    - [248, 92.669]
  - - [1024, 3968, 1, 1024]
    - [189, 77.027]
  - - [1024, 3968, 1, 4096]
    - [241, 84.924]
  - - [1024, 6528, 1, 1024]
    - [231, 83.737]
  - - [1024, 6528, 1, 4096]
    - [230, 87.751]
  - - [1024, 7104, 1, 1024]
    - [241, 87.302]
  - - [1024, 7104, 1, 4096]
    - [208, 91.23]
  - - [1024, 7200, 1, 1024]
    - [212, 87.605]
  - - [1024, 7200, 1, 4096]
    - [207, 93.194]
  - - [1024, 8064, 1, 1024]
    - [219, 83.782]
  - - [1024, 8064, 1, 4096]
    - [194, 87.68]
  - - [1024, 8160, 1, 1024]
    - [241, 84.734]
  - - [1024, 8160, 1, 4096]
    - [185, 88.223]
  - - [1024, 9216, 1, 1024]
    - [177, 85.559]
  - - [1024, 9216, 1, 4096]
    - [245, 90.334]
  - - [1024, 9520, 1, 1024]
    - [273, 85.082]
  - - [1024, 9520, 1, 4096]
    - [248, 92.712]
  - - [1024, 10064, 1, 1024]
    - [246, 88.177]
  - - [1024, 10064, 1, 4096]
    - [152, 93.157]
  - - [1024, 10080, 1, 1024]
    - [251, 89.112]
  - - [1024, 10080, 1, 4096]
    - [152, 93.492]
  - - [1024, 10200, 1, 1024]
    - [185, 85.366]
  - - [1024, 10200, 1, 4096]
    - [227, 89.05]
  - - [4096, 3840, 1, 1024]
    - [152, 88.714]
  - - [4096, 3968, 1, 1024]
    - [231, 87.476]
  - - [4096, 6528, 1, 1024]
    - [231, 89.032]
  - - [4096, 7104, 1, 1024]
    - [192, 91.32]
  - - [4096, 7200, 1, 1024]
    - [152, 91.996]
  - - [4096, 8064, 1, 1024]
    - [208, 90.851]
  - - [4096, 8160, 1, 1024]
    - [192, 91.591]
  - - [4096, 9216, 1, 1024]
    - [192, 91.79]
  - - [4096, 9520, 1, 1024]
    - [152, 91.24]
  - - [4096, 10064, 1, 1024]
    - [152, 92.405]
  - - [4096, 10080, 1, 1024]
    - [146, 92.529]
  - - [4096, 10200, 1, 1024]
    - [146, 91.189]
  - - [42720, 3968, 1, 1024]
    - [156, 92.186]
  - - [42720, 6528, 1, 1024]
    - [192, 93.353]
  - - [42720, 7104, 1, 1024]
    - [208, 93.896]
  - - [42720, 7200, 1, 1024]
    - [152, 93.572]
  - - [42720, 9520, 1, 1024]
    - [208, 92.872]
  - - [42720, 10080, 1, 1024]
    - [192, 93.545]
  - - [27, 27, 1920, 64]
    - [41, 4.213]
  - - [27, 33, 1920, 64]
    - [37, 4.595]
  - - [33, 33, 1920, 64]
    - [49, 3.385]
  - - [27, 27, 1920, 64]
    - [48, 4.299]
  - - [27, 33, 1920, 64]
    - [50, 4.637]
  - - [33, 33, 1920, 64]
    - [60, 3.488]
  - - [1024, 3240, 1, 1024]
    - [74, 35.327]
  - - [1024, 3240, 1, 4096]
    - [42, 38.283]
  - - [1024, 3960, 1, 1024]
    - [54, 35.104]
  - - [1024, 3960, 1, 4096]
    - [68, 37.527]
  - - [4096, 3240, 1, 1024]
    - [75, 42.293]
  - - [4096, 3960, 1, 1024]
    - [63, 43.442]
  - - [42720, 3960, 1, 1024]
    - [69, 45.756]
  - - [1024, 10, 1, 1024]
    - [167, 1.752]
  - - [1024, 32768, 1, 479]
    - [146, 70.418]
  - - [1024, 4992, 1, 4096]
    - [264, 81.473]
  - - [1024, 5, 1, 1024]
    - [151, 0.812]
  - - [2, 5, 1, 1024]
    - [238, 0.001]
  - - [8192, 7680, 1, 8192]
    - [216, 97.192]
  - - [2, 40, 1, 1024]
    - [253, 0.013]
  - - [128, 128, 128, 64]
    - [159, 16.974]
  - - [64, 128, 1, 128]
    - [151, 0.332]
  - - [1024, 2560, 1, 4096]
    - [162, 79.059]
  - - [30522, 462, 1, 1024]
    - [192, 85.471]
  - - [1024, 820, 1, 1024]
    - [163, 54.738]
  - - [4096, 5248, 1, 1024]
    - [146, 89.464]
  - - [4096, 3840, 1, 4096]
    - [306, 94.924]
  - - [1024, 39, 1, 1024]
    - [167, 6.486]
  - - [128, 128, 160, 64]
    - [159, 19.874]
  - - [4096, 1280, 1, 1024]
    - [152, 78.137]
  - - [1024, 2560, 1, 1024]
    - [174, 72.604]
  - - [1024, 800, 1, 1024]
    - [176, 53.404]
  - - [1024, 8, 1, 1024]
    - [178, 1.402]
  - - [30522, 160, 1, 1024]
    - [272, 70.427]
  - - [2, 1024, 1, 1024]
    - [145, 0.329]
  - - [30522, 308, 1, 1024]
    - [273, 79.302]
  - - [17, 17, 6144, 64]
    - [257, 3.052]
  - - [4096, 2560, 1, 1024]
    - [275, 86.215]
  - - [4096, 8192, 1, 1024]
    - [146, 91.649]
  - - [33, 33, 1, 32]
    - [172, 0.009]
  - - [1024, 5120, 1, 1024]
    - [277, 78.016]
  - - [1024, 9, 1, 1024]
    - [178, 1.563]
  - - [1024, 780, 1, 1024]
    - [278, 52.068]
  - - [512, 512, 80, 64]
    - [190, 38.471]
  - - [4096, 3072, 1, 1024]
    - [147, 87.251]
  - - [480, 512, 1, 512]
    - [193, 22.866]
  - - [1024, 3072, 1, 4096]
    - [245, 74.918]
  - - [4096, 1024, 1, 1024]
    - [189, 80.792]
  - - [1024, 1152, 1, 1024]
    - [161, 58.724]
  - - [128, 128, 656, 64]
    - [259, 29.327]
  - - [1024, 1024, 1, 4096]
    - [155, 67.666]
  - - [30522, 820, 1, 1024]
    - [181, 86.57]
  - - [2, 10, 1, 1024]
    - [172, 0.003]
  - - [1024, 180, 1, 1024]
    - [281, 22.939]
  - - [128, 128, 624, 64]
    - [201, 28.815]
  - - [1024, 160, 1, 1024]
    - [237, 21.807]
  - - [4096, 5120, 1, 1024]
    - [211, 88.028]
  - - [4, 4, 38400, 64]
    - [234, 0.273]
  - - [2048, 1920, 1, 2048]
    - [147, 90.526]
  - - [2, 39, 1, 1024]
    - [253, 0.012]
  - - [1024, 462, 1, 1024]
    - [213, 37.314]
  - - [2, 9, 1, 1024]
    - [172, 0.003]
  - - [30522, 180, 1, 1024]
    - [181, 73.224]
  - - [33712, 8192, 1, 1024]
    - [275, 92.452]
  - - [1024, 77, 1, 1024]
    - [288, 11.535]
  - - [5, 5, 1, 64]
    - [238, 0.0]
  - - [1024, 40, 1, 1024]
    - [290, 6.653]
  - - [2, 8, 1, 1024]
    - [253, 0.003]
  - - [512, 512, 96, 64]
    - [218, 38.947]
  - - [1024, 1152, 1, 4096]
    - [221, 75.615]
  - - [30522, 385, 1, 1024]
    - [224, 75.172]
  - - [1024, 200, 1, 1024]
    - [295, 24.38]
  - - [1024, 5120, 1, 4096]
    - [225, 83.442]
  - - [30522, 616, 1, 1024]
    - [307, 83.646]
  - - [1024, 41, 1, 1024]
    - [226, 6.596]
  - - [128, 128, 1, 64]
    - [187, 0.37]
  - - [1024, 5248, 1, 4096]
    - [248, 85.546]
  - - [4, 4, 32768, 64]
    - [234, 0.267]
  - - [128, 128, 640, 64]
    - [201, 29.279]
  - - [7680, 8192, 1, 8192]
    - [300, 97.283]
  - - [1024, 1280, 1, 4096]
    - [301, 76.589]
  - - [1024, 5248, 1, 1024]
    - [157, 80.091]
  - - [512, 512, 128, 64]
    - [236, 39.717]
  - - [512, 512, 16, 64]
    - [177, 24.997]
  - - [1024, 9600, 1, 1024]
    - [251, 85.953]
  - - [2, 6, 1, 1024]
    - [238, 0.001]
  - - [1024, 385, 1, 1024]
    - [186, 39.354]
  - - [1024, 4992, 1, 1024]
    - [219, 76.541]
  - - [33712, 9600, 1, 1024]
    - [192, 93.696]
  - - [1024, 512, 1, 4096]
    - [243, 55.44]
  - - [1024, 9600, 1, 4096]
    - [245, 93.91]
  - - [1024, 6, 1, 1024]
    - [151, 0.997]
  - - [1024, 308, 1, 1024]
    - [267, 32.498]
  - - [3840, 4096, 1, 4096]
    - [254, 94.916]
  - - [2, 41, 1, 1024]
    - [145, 0.013]
  - - [4096, 1152, 1, 1024]
    - [305, 81.695]
  - - [4096, 9600, 1, 1024]
    - [192, 92.064]
  - - [30522, 200, 1, 1024]
    - [252, 65.507]
  - - [4096, 4992, 1, 1024]
    - [146, 90.926]
  - - [1024, 8192, 1, 1024]
    - [241, 83.869]
  - - [30522, 780, 1, 1024]
    - [270, 82.885]
  - - [4096, 512, 1, 1024]
    - [189, 60.26]
  - - [1024, 1280, 1, 1024]
    - [312, 61.121]
  - - [1920, 2048, 1, 2048]
    - [302, 89.771]
  - - [1024, 3072, 1, 1024]
    - [160, 69.141]
  - - [1024, 8192, 1, 4096]
    - [152, 89.605]
  - - [128, 128, 144, 64]
    - [159, 18.592]
  - - [30522, 800, 1, 1024]
    - [262, 84.948]
  - - [30522, 77, 1, 1024]
    - [314, 57.674]
  - - [1024, 1024, 128, 96]
    - [149, 62.027]
  - - [30592, 4096, 1, 1024]
    - [152, 92.775]
  - - [64, 1024, 256, 1024]
    - [165, 70.454]
  - - [1536, 8192, 1, 1536]
    - [170, 90.685]
  - - [2048, 2, 1, 2048]
    - [171, 0.957]
  - - [3072, 8192, 1, 1024]
    - [179, 89.852]
  - - [3072, 2048, 1, 1024]
    - [191, 80.067]
  - - [50304, 8192, 1, 1024]
    - [197, 93.298]
  - - [64, 512, 40, 512]
    - [199, 43.462]
  - - [2048, 1024, 1, 8192]
    - [206, 80.328]
  - - [96, 1024, 64, 1024]
    - [194, 62.283]
  - - [1024, 16, 1, 1024]
    - [175, 2.707]
  - - [50304, 2048, 1, 1024]
    - [217, 91.6]
  - - [1536, 8192, 1, 6144]
    - [223, 91.935]
  - - [50304, 4096, 1, 1536]
    - [152, 94.817]
  - - [8192, 1024, 1, 2048]
    - [146, 87.046]
  - - [2, 4, 1, 2560]
    - [238, 0.001]
  - - [2560, 2048, 1, 640]
    - [240, 75.123]
  - - [1024, 1024, 128, 64]
    - [194, 45.365]
  - - [2048, 1024, 1, 2048]
    - [244, 71.14]
  - - [1536, 4096, 1, 1536]
    - [170, 82.665]
  - - [1024, 1024, 64, 64]
    - [249, 44.194]
  - - [30592, 8192, 1, 1024]
    - [208, 93.05]
  - - [50304, 16384, 1, 1024]
    - [208, 93.663]
  - - [4608, 4096, 1, 1536]
    - [146, 91.814]
  - - [2560, 2048, 1, 2560]
    - [152, 82.229]
  - - [7680, 2048, 1, 2560]
    - [156, 92.064]
  - - [2, 16, 1, 1024]
    - [172, 0.004]
  - - [50304, 4096, 1, 1024]
    - [146, 93.062]
  - - [64, 1024, 128, 1024]
    - [263, 67.185]
  - - [1920, 2048, 1, 2560]
    - [264, 90.147]
  - - [1024, 1024, 64, 96]
    - [149, 60.111]
  - - [64, 1024, 32, 1024]
    - [266, 55.747]
  - - [6144, 4096, 1, 1536]
    - [217, 91.384]
  - - [64, 512, 128, 512]
    - [271, 50.304]
  - - [1536, 4096, 1, 6144]
    - [279, 85.357]
  - - [512, 512, 256, 64]
    - [194, 41.523]
  - - [96, 1024, 128, 1024]
    - [235, 64.053]
  - - [50304, 8192, 1, 1536]
    - [192, 95.024]
  - - [6144, 8192, 1, 1536]
    - [280, 92.922]
  - - [4096, 16384, 1, 1024]
    - [146, 92.961]
  - - [30592, 1024, 1, 2048]
    - [146, 91.635]
  - - [2, 2, 1, 2048]
    - [253, 0.001]
  - - [1024, 16384, 1, 4096]
    - [296, 91.538]
  - - [64, 512, 256, 512]
    - [275, 56.891]
  - - [512, 512, 40, 64]
    - [298, 33.856]
  - - [6144, 1024, 1, 2048]
    - [299, 83.017]
  - - [4608, 8192, 1, 1536]
    - [152, 93.104]
  - - [30592, 2048, 1, 1024]
    - [275, 91.025]
  - - [3072, 16384, 1, 1024]
    - [146, 91.471]
  - - [1024, 1024, 256, 64]
    - [249, 45.935]
  - - [64, 1024, 64, 1024]
    - [196, 61.132]
  - - [1024, 16384, 1, 1024]
    - [194, 87.07]
  - - [1024, 1024, 32, 64]
    - [194, 42.175]
  - - [3072, 4096, 1, 1024]
    - [217, 87.759]
  - - [2560, 4, 1, 2560]
    - [171, 2.542]
- null
