library/src/blas3/Tensile/Logic/asm_full/arcturus_Cijk_Ailk_Bjlk_HBH.yaml
- {MinimumRequiredVersion: 4.6.0}
- arcturus
- gfx908
- [Device 7380, Device 7388, Device 738c, Device 7390]
    SolutionIndex: 0
    SolutionNameMin: Cijk_Ailk_Bjlk_HBH_MT016x016x08_PGR1_PLR1_TT02_02
    SolutionIndex: 1
    SolutionNameMin: Cijk_Ailk_Bjlk_HBH_MT016x016x16_PGR1_PLR1_TT02_02
    SolutionIndex: 2
    SolutionNameMin: Cijk_Ailk_Bjlk_HBH_MT032x016x16_PGR1_PLR1_TT04_02
    SolutionIndex: 3
    SolutionNameMin: Cijk_Ailk_Bjlk_HBH_MT016x016x24_PGR1_PLR1_TT02_02
    SolutionIndex: 4
    SolutionNameMin: Cijk_Ailk_Bjlk_HBH_MT032x016x24_PGR1_PLR1_TT04_02
    SolutionIndex: 5
    SolutionNameMin: Cijk_Ailk_Bjlk_HBH_MT016x016x32_PGR1_PLR1_TT02_02
    SolutionIndex: 6
    SolutionNameMin: Cijk_Ailk_Bjlk_HBH_MT032x016x32_PGR1_PLR1_TT02_02
    SolutionIndex: 7
    SolutionNameMin: Cijk_Ailk_Bjlk_HBH_MT064x016x32_PGR1_PLR1_TT02_02
    SolutionIndex: 8
    SolutionNameMin: Cijk_Ailk_Bjlk_HBH_MT016x016x32_PGR1_PLR1_TT02_02
    SolutionIndex: 9
    SolutionNameMin: Cijk_Ailk_Bjlk_HBH_MT064x016x32_PGR1_PLR1_TT02_02
    SolutionIndex: 10
    SolutionNameMin: Cijk_Ailk_Bjlk_HBH_MT016x016x64_PGR1_PLR1_TT02_02
    SolutionIndex: 11
    SolutionNameMin: Cijk_Ailk_Bjlk_HBH_MT032x016x64_PGR1_PLR1_TT02_02
    SolutionIndex: 12
    SolutionNameMin: Cijk_Ailk_Bjlk_HBH_MT064x016x64_PGR1_PLR1_TT02_02
    SolutionIndex: 13
    SolutionNameMin: Cijk_Ailk_Bjlk_HBH_MT016x016x64_PGR1_PLR1_TT02_02
    SolutionIndex: 14
    SolutionNameMin: Cijk_Ailk_Bjlk_HBH_MT032x016x64_PGR1_PLR1_TT02_02
    SolutionIndex: 15
    SolutionNameMin: Cijk_Ailk_Bjlk_HBH_MT032x032x08_PGR1_PLR1_TT02_02
    SolutionIndex: 16
    SolutionNameMin: Cijk_Ailk_Bjlk_HBH_MT032x032x16_PGR1_PLR1_TT02_02
    SolutionIndex: 17
    SolutionNameMin: Cijk_Ailk_Bjlk_HBH_MT032x032x32_PGR1_PLR1_TT02_02
    SolutionIndex: 18
    SolutionNameMin: Cijk_Ailk_Bjlk_HBH_MT032x032x64_PGR1_PLR1_TT02_02
    SolutionIndex: 19
    SolutionNameMin: Cijk_Ailk_Bjlk_HBH_MT064x064x04_PGR0_PLR1_TT04_04
    SolutionIndex: 20
    SolutionNameMin: Cijk_Ailk_Bjlk_HBH_MT064x064x04_PGR1_PLR1_TT04_04
    SolutionIndex: 21
    SolutionNameMin: Cijk_Ailk_Bjlk_HBH_MT064x064x08_PGR0_PLR1_TT04_04
    SolutionIndex: 22
    SolutionNameMin: Cijk_Ailk_Bjlk_HBH_MT064x064x16_PGR1_PLR1_TT04_04
    SolutionIndex: 23
    SolutionNameMin: Cijk_Ailk_Bjlk_HBH_MT032x032x08_PGR1_PLR1_TT04_04
    SolutionIndex: 24
    SolutionNameMin: Cijk_Ailk_Bjlk_HBH_MT064x064x08_PGR1_PLR1_TT08_08
    SolutionIndex: 25
    SolutionNameMin: Cijk_Ailk_Bjlk_HBH_MT032x032x16_PGR1_PLR1_TT04_04
    SolutionIndex: 26
    SolutionNameMin: Cijk_Ailk_Bjlk_HBH_MT064x032x16_PGR1_PLR1_TT04_04
    SolutionIndex: 27
    SolutionNameMin: Cijk_Ailk_Bjlk_HBH_MT032x032x16_PGR1_PLR1_TT04_04
    SolutionIndex: 28
    SolutionNameMin: Cijk_Ailk_Bjlk_HBH_MT064x032x16_PGR1_PLR1_TT04_04
    SolutionIndex: 29
    SolutionNameMin: Cijk_Ailk_Bjlk_HBH_MT032x032x32_PGR1_PLR1_TT04_04
    SolutionIndex: 30
    SolutionNameMin: Cijk_Ailk_Bjlk_HBH_MT064x032x32_PGR1_PLR1_TT04_04
    SolutionIndex: 31
    SolutionNameMin: Cijk_Ailk_Bjlk_HBH_MT128x032x32_PGR1_PLR1_TT04_04
    SolutionIndex: 32
    SolutionNameMin: Cijk_Ailk_Bjlk_HBH_MT128x016x32_PGR1_PLR1_TT04_04
    SolutionIndex: 33
    SolutionNameMin: Cijk_Ailk_Bjlk_HBH_MT032x032x32_PGR1_PLR1_TT04_04
    SolutionIndex: 34
    SolutionNameMin: Cijk_Ailk_Bjlk_HBH_MT064x032x32_PGR1_PLR1_TT04_04
    SolutionIndex: 35
    SolutionNameMin: Cijk_Ailk_Bjlk_HBH_MT128x032x32_PGR1_PLR1_TT04_04
    SolutionIndex: 36
    SolutionNameMin: Cijk_Ailk_Bjlk_HBH_MT128x016x32_PGR1_PLR1_TT04_04
    SolutionIndex: 37
    SolutionNameMin: Cijk_Ailk_Bjlk_HBH_MT032x032x64_PGR1_PLR1_TT04_04
    SolutionIndex: 38
    SolutionNameMin: Cijk_Ailk_Bjlk_HBH_MT032x032x64_PGR1_PLR1_TT04_04
    SolutionIndex: 39
    SolutionNameMin: Cijk_Ailk_Bjlk_HBH_MT064x032x64_PGR1_PLR1_TT04_04
    SolutionIndex: 40
    SolutionNameMin: Cijk_Ailk_Bjlk_HBH_MT064x064x08_PGR1_PLR1_TT08_08
    SolutionIndex: 41
    SolutionNameMin: Cijk_Ailk_Bjlk_HBH_MT064x064x16_PGR1_PLR1_TT08_08
    SolutionIndex: 42
    SolutionNameMin: Cijk_Ailk_Bjlk_HBH_MT064x064x16_PGR1_PLR1_TT08_08
    SolutionIndex: 43
    SolutionNameMin: Cijk_Ailk_Bjlk_HBH_MT128x064x32_PGR1_PLR1_TT08_08
    SolutionIndex: 44
    SolutionNameMin: Cijk_Ailk_Bjlk_HBH_MT064x064x16_PGR1_PLR1_TT04_04
    SolutionIndex: 45
    SolutionNameMin: Cijk_Ailk_Bjlk_HBH_MT064x128x16_PGR1_PLR1_TT04_08
    SolutionIndex: 46
    SolutionNameMin: Cijk_Ailk_Bjlk_HBH_MT128x064x16_PGR1_PLR1_TT08_04
    SolutionIndex: 47
    SolutionNameMin: Cijk_Ailk_Bjlk_HBH_MT128x128x16_PGR1_PLR1_TT08_08
    SolutionIndex: 48
    SolutionNameMin: Cijk_Ailk_Bjlk_HBH_MT064x064x32_PGR1_PLR1_TT04_04
    SolutionIndex: 49
    SolutionNameMin: Cijk_Ailk_Bjlk_HBH_MT064x128x32_PGR1_PLR1_TT04_08
    SolutionIndex: 50
    SolutionNameMin: Cijk_Ailk_Bjlk_HBH_MT128x064x32_PGR1_PLR1_TT08_04
    SolutionIndex: 51
    SolutionNameMin: Cijk_Ailk_Bjlk_HBH_MT128x128x32_PGR1_PLR1_TT08_08
    SolutionIndex: 52
    SolutionNameMin: Cijk_Ailk_Bjlk_HBH_MT064x064x16_PGR1_PLR1_TT04_04
    SolutionIndex: 53
    SolutionNameMin: Cijk_Ailk_Bjlk_HBH_MT064x064x32_PGR1_PLR1_TT04_04
    SolutionIndex: 54
    SolutionNameMin: Cijk_Ailk_Bjlk_HBH_MT064x064x64_PGR1_PLR1_TT04_04
    SolutionIndex: 55
    SolutionNameMin: Cijk_Ailk_Bjlk_HBH_MT064x128x04_PGR0_PLR0_TT04_08
    SolutionIndex: 56
    SolutionNameMin: Cijk_Ailk_Bjlk_HBH_MT064x064x04_PGR1_PLR0_TT04_04
    SolutionIndex: 57
    SolutionNameMin: Cijk_Ailk_Bjlk_HBH_MT128x128x04_PGR1_PLR1_TT08_08
    SolutionIndex: 58
    SolutionNameMin: Cijk_Ailk_Bjlk_HBH_MT128x128x08_PGR0_PLR0_TT08_08
    SolutionIndex: 59
    SolutionNameMin: Cijk_Ailk_Bjlk_HBH_MT064x064x08_PGR0_PLR0_TT04_04
    SolutionIndex: 60
    SolutionNameMin: Cijk_Ailk_Bjlk_HBH_MT064x128x08_PGR1_PLR0_TT04_08
    SolutionIndex: 61
    SolutionNameMin: Cijk_Ailk_Bjlk_HBH_MT064x064x08_PGR1_PLR0_TT04_04
    SolutionIndex: 62
    SolutionNameMin: Cijk_Ailk_Bjlk_HBH_MT064x128x08_PGR0_PLR1_TT04_08
    SolutionIndex: 63
    SolutionNameMin: Cijk_Ailk_Bjlk_HBH_MT064x064x08_PGR0_PLR1_TT04_04
    SolutionIndex: 64
    SolutionNameMin: Cijk_Ailk_Bjlk_HBH_MT064x128x08_PGR1_PLR1_TT04_08
    SolutionIndex: 65
    SolutionNameMin: Cijk_Ailk_Bjlk_HBH_MT064x064x08_PGR1_PLR1_TT04_04
    SolutionIndex: 66
    SolutionNameMin: Cijk_Ailk_Bjlk_HBH_MT064x128x16_PGR0_PLR0_TT04_08
    SolutionIndex: 67
    SolutionNameMin: Cijk_Ailk_Bjlk_HBH_MT064x064x16_PGR0_PLR0_TT04_04
    SolutionIndex: 68
    SolutionNameMin: Cijk_Ailk_Bjlk_HBH_MT064x064x16_PGR1_PLR0_TT04_04
    SolutionIndex: 69
    SolutionNameMin: Cijk_Ailk_Bjlk_HBH_MT064x128x16_PGR0_PLR1_TT04_08
    SolutionIndex: 70
    SolutionNameMin: Cijk_Ailk_Bjlk_HBH_MT064x064x16_PGR0_PLR1_TT04_04
    SolutionIndex: 71
    SolutionNameMin: Cijk_Ailk_Bjlk_HBH_MT064x128x16_PGR1_PLR1_TT04_08
    SolutionIndex: 72
    SolutionNameMin: Cijk_Ailk_Bjlk_HBH_MT064x064x16_PGR1_PLR1_TT04_04
    SolutionIndex: 73
    SolutionNameMin: Cijk_Ailk_Bjlk_HBH_MT128x128x04_PGR0_PLR0_TT08_08
    SolutionIndex: 74
    SolutionNameMin: Cijk_Ailk_Bjlk_HBH_MT064x128x04_PGR0_PLR0_TT04_08
    SolutionIndex: 75
    SolutionNameMin: Cijk_Ailk_Bjlk_HBH_MT064x064x04_PGR0_PLR0_TT04_04
    SolutionIndex: 76
    SolutionNameMin: Cijk_Ailk_Bjlk_HBH_MT128x128x04_PGR1_PLR0_TT08_08
    SolutionIndex: 77
    SolutionNameMin: Cijk_Ailk_Bjlk_HBH_MT064x128x04_PGR1_PLR0_TT04_08
    SolutionIndex: 78
    SolutionNameMin: Cijk_Ailk_Bjlk_HBH_MT064x064x04_PGR1_PLR0_TT04_04
    SolutionIndex: 79
    SolutionNameMin: Cijk_Ailk_Bjlk_HBH_MT128x128x04_PGR0_PLR1_TT08_08
    SolutionIndex: 80
    SolutionNameMin: Cijk_Ailk_Bjlk_HBH_MT064x128x04_PGR0_PLR1_TT04_08
    SolutionIndex: 81
    SolutionNameMin: Cijk_Ailk_Bjlk_HBH_MT064x064x04_PGR0_PLR1_TT04_04
    SolutionIndex: 82
    SolutionNameMin: Cijk_Ailk_Bjlk_HBH_MT128x128x04_PGR1_PLR1_TT08_08
    SolutionIndex: 83
    SolutionNameMin: Cijk_Ailk_Bjlk_HBH_MT064x128x04_PGR1_PLR1_TT04_08
    SolutionIndex: 84
    SolutionNameMin: Cijk_Ailk_Bjlk_HBH_MT064x064x04_PGR1_PLR1_TT04_04
    SolutionIndex: 85
    SolutionNameMin: Cijk_Ailk_Bjlk_HBH_MT064x128x08_PGR0_PLR0_TT04_08
    SolutionIndex: 86
    SolutionNameMin: Cijk_Ailk_Bjlk_HBH_MT064x064x08_PGR0_PLR0_TT04_04
    SolutionIndex: 87
    SolutionNameMin: Cijk_Ailk_Bjlk_HBH_MT064x064x08_PGR1_PLR0_TT04_04
    SolutionIndex: 88
    SolutionNameMin: Cijk_Ailk_Bjlk_HBH_MT128x128x08_PGR0_PLR1_TT08_08
    SolutionIndex: 89
    SolutionNameMin: Cijk_Ailk_Bjlk_HBH_MT064x128x08_PGR0_PLR1_TT04_08
    SolutionIndex: 90
    SolutionNameMin: Cijk_Ailk_Bjlk_HBH_MT064x064x08_PGR0_PLR1_TT04_04
    SolutionIndex: 91
    SolutionNameMin: Cijk_Ailk_Bjlk_HBH_MT064x128x08_PGR1_PLR1_TT04_08
    SolutionIndex: 92
    SolutionNameMin: Cijk_Ailk_Bjlk_HBH_MT064x064x08_PGR1_PLR1_TT04_04
    SolutionIndex: 93
    SolutionNameMin: Cijk_Ailk_Bjlk_HBH_MT064x064x16_PGR0_PLR0_TT04_04
    SolutionIndex: 94
    SolutionNameMin: Cijk_Ailk_Bjlk_HBH_MT064x064x16_PGR1_PLR0_TT04_04
    SolutionIndex: 95
    SolutionNameMin: Cijk_Ailk_Bjlk_HBH_MT064x128x16_PGR0_PLR1_TT04_08
    SolutionIndex: 96
    SolutionNameMin: Cijk_Ailk_Bjlk_HBH_MT064x064x16_PGR0_PLR1_TT04_04
    SolutionIndex: 97
    SolutionNameMin: Cijk_Ailk_Bjlk_HBH_MT064x064x16_PGR1_PLR1_TT04_04
    SolutionIndex: 98
    SolutionNameMin: Cijk_Ailk_Bjlk_HBH_MT064x128x16_EPS1_GRVW04_PGR1_PLR1_SNLL1_TT08_04_VW04_WG08_32_01_WGM01
    SolutionIndex: 99
    SolutionNameMin: Cijk_Ailk_Bjlk_HBH_MT128x128x16_EPS1_GRVW04_PGR1_PLR1_SNLL1_TT08_08_VW04_WG16_16_01_WGM01
    SolutionIndex: 100
    SolutionNameMin: Cijk_Ailk_Bjlk_HBH_MT064x128x16_EPS1_GRVW04_PGR1_PLR1_SNLL1_TT08_04_VW04_WG08_32_01_WGM08
    SolutionIndex: 101
    SolutionNameMin: Cijk_Ailk_Bjlk_HBH_MT128x064x16_EPS1_GRVW04_PGR1_PLR1_SNLL1_TT08_04_VW04_WG16_16_01_WGM08
    SolutionIndex: 102
    SolutionNameMin: Cijk_Ailk_Bjlk_HBH_MT128x128x16_EPS1_GRVW04_PGR1_PLR1_SNLL1_TT08_08_VW04_WG16_16_01_WGM08
    SolutionIndex: 103
    SolutionNameMin: Cijk_Ailk_Bjlk_HBH_MT128x064x16_EPS1_GRVW04_PGR1_PLR1_SNLL1_TT08_04_VW04_WG16_16_01_WGM64
    SolutionIndex: 104
    SolutionNameMin: Cijk_Ailk_Bjlk_HBH_MT064x064x32_EPS0_GRVW04_PGR0_PLR0_SNLL0_TT04_04_VW04_WG16_16_01_WGM01
    SolutionIndex: 105
    SolutionNameMin: Cijk_Ailk_Bjlk_HBH_MT128x064x16_EPS1_GRVW08_PGR1_PLR1_SNLL1_TT08_08_VW08_WG16_08_01_WGM64
    SolutionIndex: 106
    SolutionNameMin: Cijk_Ailk_Bjlk_HBH_MT128x128x32_EPS1_GRVW08_PGR1_PLR1_SNLL1_TT08_08_VW08_WG16_16_01_WGM64
    SolutionIndex: 107
    SolutionNameMin: Cijk_Ailk_Bjlk_HBH_MT64x128x16_MI32x32x4x2_SE_AF0EM1_ASEM1_ONLL0_SNLL1
    SolutionIndex: 108
    SolutionNameMin: Cijk_Ailk_Bjlk_HBH_MT64x128x16_MI32x32x4x2_SE_AF0EM1_ASEM2_ONLL0_SNLL1
    SolutionIndex: 109
    SolutionNameMin: Cijk_Ailk_Bjlk_HBH_MT64x128x16_MI32x32x4x2_SE_AF0EM2_ASEM1_ONLL0_SNLL1
    SolutionIndex: 110
    SolutionNameMin: Cijk_Ailk_Bjlk_HBH_MT64x128x16_MI32x32x4x2_SE_AF0EM2_ASEM2_ONLL0_SNLL1
    SolutionIndex: 111
    SolutionNameMin: Cijk_Ailk_Bjlk_HBH_MT64x128x32_MI32x32x4x2_SE_AF0EM2_ASEM2_ONLL0_SNLL1
    SolutionIndex: 112
    SolutionNameMin: Cijk_Ailk_Bjlk_HBH_MT64x128x8_MI32x32x4x2_SE_AF0EM1_ASEM1_ONLL0_SNLL0
    SolutionIndex: 113
    SolutionNameMin: Cijk_Ailk_Bjlk_HBH_MT32x256x16_MI32x32x4x2_SE_AF0EM2_ASEM1_ONLL0_SNLL0
    SolutionIndex: 114
    SolutionNameMin: Cijk_Ailk_Bjlk_HBH_MT32x256x16_MI32x32x4x2_SE_AF0EM2_ASEM2_ONLL0_SNLL0
    SolutionIndex: 115
    SolutionNameMin: Cijk_Ailk_Bjlk_HBH_MT64x128x16_MI32x32x4x2_SE_AF0EM1_ASEM1_ONLL0_SNLL0
    SolutionIndex: 116
    SolutionNameMin: Cijk_Ailk_Bjlk_HBH_MT64x128x16_MI32x32x4x2_SE_AF0EM1_ASEM2_ONLL0_SNLL0
    SolutionIndex: 117
    SolutionNameMin: Cijk_Ailk_Bjlk_HBH_MT64x128x16_MI32x32x4x2_SE_AF0EM2_ASEM1_ONLL0_SNLL0
    SolutionIndex: 118
    SolutionNameMin: Cijk_Ailk_Bjlk_HBH_MT64x128x16_MI32x32x4x2_SE_AF0EM2_ASEM2_ONLL0_SNLL0
    SolutionIndex: 119
    SolutionNameMin: Cijk_Ailk_Bjlk_HBH_MT64x128x32_MI32x32x4x2_SE_AF0EM2_ASEM1_ONLL0_SNLL0
    SolutionIndex: 120
    SolutionNameMin: Cijk_Ailk_Bjlk_HBH_MT64x128x32_MI32x32x4x2_SE_AF0EM2_ASEM2_ONLL0_SNLL0
    SolutionIndex: 121
    SolutionNameMin: Cijk_Ailk_Bjlk_HBH_MT64x128x16_MI32x32x4x2_SE_AF0EM1_ASEM1_ONLL1_SNLL1
    SolutionIndex: 122
    SolutionNameMin: Cijk_Ailk_Bjlk_HBH_MT64x128x16_MI32x32x4x2_SE_AF0EM1_ASEM2_ONLL1_SNLL1
    SolutionIndex: 123
    SolutionNameMin: Cijk_Ailk_Bjlk_HBH_MT64x128x16_MI32x32x4x2_SE_AF0EM2_ASEM1_ONLL1_SNLL1
    SolutionIndex: 124
    SolutionNameMin: Cijk_Ailk_Bjlk_HBH_MT64x128x16_MI32x32x4x2_SE_AF0EM2_ASEM2_ONLL1_SNLL1
    SolutionIndex: 125
    SolutionNameMin: Cijk_Ailk_Bjlk_HBH_MT64x128x32_MI32x32x4x2_SE_AF0EM2_ASEM1_ONLL1_SNLL1
    SolutionIndex: 126
    SolutionNameMin: Cijk_Ailk_Bjlk_HBH_MT64x128x8_MI32x32x4x2_SE_AF0EM1_ASEM1_ONLL1_SNLL0
    SolutionIndex: 127
    SolutionNameMin: Cijk_Ailk_Bjlk_HBH_MT32x256x16_MI32x32x4x2_SE_AF0EM1_ASEM1_ONLL1_SNLL0
    SolutionIndex: 128
    SolutionNameMin: Cijk_Ailk_Bjlk_HBH_MT64x128x16_MI32x32x4x2_SE_AF0EM1_ASEM1_ONLL1_SNLL0
    SolutionIndex: 129
    SolutionNameMin: Cijk_Ailk_Bjlk_HBH_MT64x128x16_MI32x32x4x2_SE_AF0EM2_ASEM1_ONLL1_SNLL0
    SolutionIndex: 130
    SolutionNameMin: Cijk_Ailk_Bjlk_HBH_MT64x128x16_MI32x32x4x2_SE_AF0EM2_ASEM2_ONLL1_SNLL0
    SolutionIndex: 131
    SolutionNameMin: Cijk_Ailk_Bjlk_HBH_MT64x128x32_MI32x32x4x2_SE_AF0EM2_ASEM1_ONLL1_SNLL0
    SolutionIndex: 132
    SolutionNameMin: Cijk_Ailk_Bjlk_HBH_MT64x128x32_MI32x32x4x2_SE_AF0EM2_ASEM2_ONLL1_SNLL0
    SolutionIndex: 133
    SolutionNameMin: Cijk_Ailk_Bjlk_HBH_MT64x256x16_MI32x32x4x2_SE_AF0EM1_ASEM1_ONLL0_SNLL1
    SolutionIndex: 134
    SolutionNameMin: Cijk_Ailk_Bjlk_HBH_MT64x256x16_MI32x32x4x2_SE_AF0EM1_ASEM2_ONLL0_SNLL1
    SolutionIndex: 135
    SolutionNameMin: Cijk_Ailk_Bjlk_HBH_MT64x256x16_MI32x32x4x2_SE_AF0EM2_ASEM1_ONLL0_SNLL1
    SolutionIndex: 136
    SolutionNameMin: Cijk_Ailk_Bjlk_HBH_MT64x256x16_MI32x32x4x2_SE_AF0EM2_ASEM2_ONLL0_SNLL1
    SolutionIndex: 137
    SolutionNameMin: Cijk_Ailk_Bjlk_HBH_MT64x256x8_MI32x32x4x2_SE_AF0EM1_ASEM2_ONLL0_SNLL0
    SolutionIndex: 138
    SolutionNameMin: Cijk_Ailk_Bjlk_HBH_MT64x256x16_MI32x32x4x2_SE_AF0EM1_ASEM1_ONLL0_SNLL0
    SolutionIndex: 139
    SolutionNameMin: Cijk_Ailk_Bjlk_HBH_MT64x256x16_MI32x32x4x2_SE_AF0EM1_ASEM2_ONLL0_SNLL0
    SolutionIndex: 140
    SolutionIndex: 141
    SolutionIndex: 142
    SolutionIndex: 143
    SolutionIndex: 144
    SolutionIndex: 145
    SolutionIndex: 146
    SolutionIndex: 147
    SolutionIndex: 148
    SolutionIndex: 149
    SolutionIndex: 150
    SolutionIndex: 151
    SolutionIndex: 152
    SolutionIndex: 153
    SolutionIndex: 154
    SolutionIndex: 155
    SolutionIndex: 156
    SolutionIndex: 157
    SolutionIndex: 158
    SolutionIndex: 159
    SolutionIndex: 160
    SolutionIndex: 161
    SolutionIndex: 162
    SolutionIndex: 163
    SolutionIndex: 164
    SolutionIndex: 165
    SolutionIndex: 166
    SolutionIndex: 167
    SolutionIndex: 168
    SolutionIndex: 169
    SolutionIndex: 170
    SolutionIndex: 171
    SolutionIndex: 172
    SolutionIndex: 173
    SolutionIndex: 174
    SolutionIndex: 175
    SolutionIndex: 176
    SolutionIndex: 177
    SolutionIndex: 178
    SolutionIndex: 179
    SolutionIndex: 180
    SolutionIndex: 181
    SolutionIndex: 182
    SolutionIndex: 183
    SolutionIndex: 184
    SolutionIndex: 185
    SolutionIndex: 186
    SolutionIndex: 187
    SolutionIndex: 188
    SolutionIndex: 189
    SolutionIndex: 190
    SolutionIndex: 191
    SolutionIndex: 192
    SolutionIndex: 193
    SolutionIndex: 194
    SolutionIndex: 195
    SolutionIndex: 196
    SolutionIndex: 197
    SolutionIndex: 198
    SolutionIndex: 199
    SolutionIndex: 200
    SolutionIndex: 201
    SolutionIndex: 202
    SolutionIndex: 203
    SolutionIndex: 204
    SolutionIndex: 205
    SolutionIndex: 206
    SolutionIndex: 207
    SolutionIndex: 208
    SolutionIndex: 209
    SolutionIndex: 210
    SolutionIndex: 211
    SolutionIndex: 212
    SolutionIndex: 213
    SolutionIndex: 214
    SolutionIndex: 215
    SolutionIndex: 216
    SolutionIndex: 217
    SolutionIndex: 218
    SolutionIndex: 219
    SolutionIndex: 220
    SolutionIndex: 221
    SolutionIndex: 222
    SolutionIndex: 223
    SolutionIndex: 224
    SolutionIndex: 225
    SolutionIndex: 226
    SolutionIndex: 227
    SolutionIndex: 228
    SolutionIndex: 229
    SolutionIndex: 230
    SolutionIndex: 231
    SolutionIndex: 232
    SolutionIndex: 233
    SolutionIndex: 234
    SolutionIndex: 235
    SolutionIndex: 236
    SolutionIndex: 237
    SolutionIndex: 238
    SolutionIndex: 239
    SolutionIndex: 240
    SolutionIndex: 241
    SolutionIndex: 242
    SolutionIndex: 243
    SolutionIndex: 244
    SolutionIndex: 245
    SolutionIndex: 246
    SolutionIndex: 247
    SolutionIndex: 248
    SolutionIndex: 249
    SolutionIndex: 250
    SolutionIndex: 251
    SolutionIndex: 252
    SolutionIndex: 253
    SolutionIndex: 254
    SolutionIndex: 255
    SolutionNameMin: Cijk_Ailk_Bjlk_HBH_MT016x016x08_PGR1_PLR1_TT02_02
    SolutionIndex: 256
    SolutionNameMin: Cijk_Ailk_Bjlk_HBH_MT016x016x16_PGR1_PLR1_TT02_02
    SolutionIndex: 257
    SolutionNameMin: Cijk_Ailk_Bjlk_HBH_MT032x016x16_PGR1_PLR1_TT04_02
    SolutionIndex: 258
    SolutionNameMin: Cijk_Ailk_Bjlk_HBH_MT016x016x24_PGR1_PLR1_TT02_02
    SolutionIndex: 259
    SolutionNameMin: Cijk_Ailk_Bjlk_HBH_MT032x016x24_PGR1_PLR1_TT04_02
    SolutionIndex: 260
    SolutionNameMin: Cijk_Ailk_Bjlk_HBH_MT016x016x32_PGR1_PLR1_TT02_02
    SolutionIndex: 261
    SolutionNameMin: Cijk_Ailk_Bjlk_HBH_MT032x016x32_PGR1_PLR1_TT02_02
    SolutionIndex: 262
    SolutionNameMin: Cijk_Ailk_Bjlk_HBH_MT064x016x32_PGR1_PLR1_TT02_02
    SolutionIndex: 263
    SolutionNameMin: Cijk_Ailk_Bjlk_HBH_MT016x016x32_PGR1_PLR1_TT02_02
    SolutionIndex: 264
    SolutionNameMin: Cijk_Ailk_Bjlk_HBH_MT064x016x32_PGR1_PLR1_TT02_02
    SolutionIndex: 265
    SolutionNameMin: Cijk_Ailk_Bjlk_HBH_MT016x016x64_PGR1_PLR1_TT02_02
    SolutionIndex: 266
    SolutionNameMin: Cijk_Ailk_Bjlk_HBH_MT032x016x64_PGR1_PLR1_TT02_02
    SolutionIndex: 267
    SolutionNameMin: Cijk_Ailk_Bjlk_HBH_MT064x016x64_PGR1_PLR1_TT02_02
    SolutionIndex: 268
    SolutionNameMin: Cijk_Ailk_Bjlk_HBH_MT016x016x64_PGR1_PLR1_TT02_02
    SolutionIndex: 269
    SolutionNameMin: Cijk_Ailk_Bjlk_HBH_MT032x016x64_PGR1_PLR1_TT02_02
    SolutionIndex: 270
    SolutionNameMin: Cijk_Ailk_Bjlk_HBH_MT032x032x08_PGR1_PLR1_TT02_02
    SolutionIndex: 271
    SolutionNameMin: Cijk_Ailk_Bjlk_HBH_MT032x032x16_PGR1_PLR1_TT02_02
    SolutionIndex: 272
    SolutionNameMin: Cijk_Ailk_Bjlk_HBH_MT032x032x32_PGR1_PLR1_TT02_02
    SolutionIndex: 273
    SolutionNameMin: Cijk_Ailk_Bjlk_HBH_MT032x032x64_PGR1_PLR1_TT02_02
    SolutionIndex: 274
    SolutionNameMin: Cijk_Ailk_Bjlk_HBH_MT064x064x04_PGR0_PLR1_TT04_04
    SolutionIndex: 275
    SolutionNameMin: Cijk_Ailk_Bjlk_HBH_MT064x064x04_PGR1_PLR1_TT04_04
    SolutionIndex: 276
    SolutionNameMin: Cijk_Ailk_Bjlk_HBH_MT064x064x08_PGR0_PLR1_TT04_04
    SolutionIndex: 277
    SolutionNameMin: Cijk_Ailk_Bjlk_HBH_MT064x064x16_PGR1_PLR1_TT04_04
    SolutionIndex: 278
    SolutionNameMin: Cijk_Ailk_Bjlk_HBH_MT032x032x08_PGR1_PLR1_TT04_04
    SolutionIndex: 279
    SolutionNameMin: Cijk_Ailk_Bjlk_HBH_MT064x064x08_PGR1_PLR1_TT08_08
    SolutionIndex: 280
    SolutionNameMin: Cijk_Ailk_Bjlk_HBH_MT032x032x16_PGR1_PLR1_TT04_04
    SolutionIndex: 281
    SolutionNameMin: Cijk_Ailk_Bjlk_HBH_MT064x032x16_PGR1_PLR1_TT04_04
    SolutionIndex: 282
    SolutionNameMin: Cijk_Ailk_Bjlk_HBH_MT032x032x16_PGR1_PLR1_TT04_04
    SolutionIndex: 283
    SolutionNameMin: Cijk_Ailk_Bjlk_HBH_MT064x032x16_PGR1_PLR1_TT04_04
    SolutionIndex: 284
    SolutionNameMin: Cijk_Ailk_Bjlk_HBH_MT032x032x32_PGR1_PLR1_TT04_04
    SolutionIndex: 285
    SolutionNameMin: Cijk_Ailk_Bjlk_HBH_MT064x032x32_PGR1_PLR1_TT04_04
    SolutionIndex: 286
    SolutionNameMin: Cijk_Ailk_Bjlk_HBH_MT128x032x32_PGR1_PLR1_TT04_04
    SolutionIndex: 287
    SolutionNameMin: Cijk_Ailk_Bjlk_HBH_MT128x016x32_PGR1_PLR1_TT04_04
    SolutionIndex: 288
    SolutionNameMin: Cijk_Ailk_Bjlk_HBH_MT032x032x32_PGR1_PLR1_TT04_04
    SolutionIndex: 289
    SolutionNameMin: Cijk_Ailk_Bjlk_HBH_MT064x032x32_PGR1_PLR1_TT04_04
    SolutionIndex: 290
    SolutionNameMin: Cijk_Ailk_Bjlk_HBH_MT128x032x32_PGR1_PLR1_TT04_04
    SolutionIndex: 291
    SolutionNameMin: Cijk_Ailk_Bjlk_HBH_MT128x016x32_PGR1_PLR1_TT04_04
    SolutionIndex: 292
    SolutionNameMin: Cijk_Ailk_Bjlk_HBH_MT032x032x64_PGR1_PLR1_TT04_04
    SolutionIndex: 293
    SolutionNameMin: Cijk_Ailk_Bjlk_HBH_MT032x032x64_PGR1_PLR1_TT04_04
    SolutionIndex: 294
    SolutionNameMin: Cijk_Ailk_Bjlk_HBH_MT064x032x64_PGR1_PLR1_TT04_04
    SolutionIndex: 295
    SolutionNameMin: Cijk_Ailk_Bjlk_HBH_MT064x064x08_PGR1_PLR1_TT08_08
    SolutionIndex: 296
    SolutionNameMin: Cijk_Ailk_Bjlk_HBH_MT064x064x16_PGR1_PLR1_TT08_08
    SolutionIndex: 297
    SolutionNameMin: Cijk_Ailk_Bjlk_HBH_MT064x064x16_PGR1_PLR1_TT08_08
    SolutionIndex: 298
    SolutionNameMin: Cijk_Ailk_Bjlk_HBH_MT128x064x32_PGR1_PLR1_TT08_08
    SolutionIndex: 299
    SolutionNameMin: Cijk_Ailk_Bjlk_HBH_MT064x064x16_PGR1_PLR1_TT04_04
    SolutionIndex: 300
    SolutionNameMin: Cijk_Ailk_Bjlk_HBH_MT064x128x16_PGR1_PLR1_TT04_08
    SolutionIndex: 301
    SolutionNameMin: Cijk_Ailk_Bjlk_HBH_MT128x064x16_PGR1_PLR1_TT08_04
    SolutionIndex: 302
    SolutionNameMin: Cijk_Ailk_Bjlk_HBH_MT128x128x16_PGR1_PLR1_TT08_08
    SolutionIndex: 303
    SolutionNameMin: Cijk_Ailk_Bjlk_HBH_MT064x064x32_PGR1_PLR1_TT04_04
    SolutionIndex: 304
    SolutionNameMin: Cijk_Ailk_Bjlk_HBH_MT064x128x32_PGR1_PLR1_TT04_08
    SolutionIndex: 305
    SolutionNameMin: Cijk_Ailk_Bjlk_HBH_MT128x064x32_PGR1_PLR1_TT08_04
    SolutionIndex: 306
    SolutionNameMin: Cijk_Ailk_Bjlk_HBH_MT128x128x32_PGR1_PLR1_TT08_08
    SolutionIndex: 307
    SolutionNameMin: Cijk_Ailk_Bjlk_HBH_MT064x064x16_PGR1_PLR1_TT04_04
    SolutionIndex: 308
    SolutionNameMin: Cijk_Ailk_Bjlk_HBH_MT064x064x32_PGR1_PLR1_TT04_04
    SolutionIndex: 309
    SolutionNameMin: Cijk_Ailk_Bjlk_HBH_MT064x064x64_PGR1_PLR1_TT04_04
    SolutionIndex: 310
    SolutionNameMin: Cijk_Ailk_Bjlk_HBH_MT064x128x04_PGR0_PLR0_TT04_08
    SolutionIndex: 311
    SolutionNameMin: Cijk_Ailk_Bjlk_HBH_MT064x064x04_PGR1_PLR0_TT04_04
    SolutionIndex: 312
    SolutionNameMin: Cijk_Ailk_Bjlk_HBH_MT128x128x04_PGR1_PLR1_TT08_08
    SolutionIndex: 313
    SolutionNameMin: Cijk_Ailk_Bjlk_HBH_MT128x128x08_PGR0_PLR0_TT08_08
    SolutionIndex: 314
    SolutionNameMin: Cijk_Ailk_Bjlk_HBH_MT064x064x08_PGR0_PLR0_TT04_04
    SolutionIndex: 315
    SolutionNameMin: Cijk_Ailk_Bjlk_HBH_MT064x128x08_PGR1_PLR0_TT04_08
    SolutionIndex: 316
    SolutionNameMin: Cijk_Ailk_Bjlk_HBH_MT064x064x08_PGR1_PLR0_TT04_04
    SolutionIndex: 317
    SolutionNameMin: Cijk_Ailk_Bjlk_HBH_MT064x128x08_PGR0_PLR1_TT04_08
    SolutionIndex: 318
    SolutionNameMin: Cijk_Ailk_Bjlk_HBH_MT064x064x08_PGR0_PLR1_TT04_04
    SolutionIndex: 319
    SolutionNameMin: Cijk_Ailk_Bjlk_HBH_MT064x128x08_PGR1_PLR1_TT04_08
    SolutionIndex: 320
    SolutionNameMin: Cijk_Ailk_Bjlk_HBH_MT064x064x08_PGR1_PLR1_TT04_04
    SolutionIndex: 321
    SolutionNameMin: Cijk_Ailk_Bjlk_HBH_MT064x128x16_PGR0_PLR0_TT04_08
    SolutionIndex: 322
    SolutionNameMin: Cijk_Ailk_Bjlk_HBH_MT064x064x16_PGR0_PLR0_TT04_04
    SolutionIndex: 323
    SolutionNameMin: Cijk_Ailk_Bjlk_HBH_MT064x064x16_PGR1_PLR0_TT04_04
    SolutionIndex: 324
    SolutionNameMin: Cijk_Ailk_Bjlk_HBH_MT064x128x16_PGR0_PLR1_TT04_08
    SolutionIndex: 325
    SolutionNameMin: Cijk_Ailk_Bjlk_HBH_MT064x064x16_PGR0_PLR1_TT04_04
    SolutionIndex: 326
    SolutionNameMin: Cijk_Ailk_Bjlk_HBH_MT064x128x16_PGR1_PLR1_TT04_08
    SolutionIndex: 327
    SolutionNameMin: Cijk_Ailk_Bjlk_HBH_MT064x064x16_PGR1_PLR1_TT04_04
    SolutionIndex: 328
    SolutionNameMin: Cijk_Ailk_Bjlk_HBH_MT128x128x04_PGR0_PLR0_TT08_08
    SolutionIndex: 329
    SolutionNameMin: Cijk_Ailk_Bjlk_HBH_MT064x128x04_PGR0_PLR0_TT04_08
    SolutionIndex: 330
    SolutionNameMin: Cijk_Ailk_Bjlk_HBH_MT064x064x04_PGR0_PLR0_TT04_04
    SolutionIndex: 331
    SolutionNameMin: Cijk_Ailk_Bjlk_HBH_MT128x128x04_PGR1_PLR0_TT08_08
    SolutionIndex: 332
    SolutionNameMin: Cijk_Ailk_Bjlk_HBH_MT064x128x04_PGR1_PLR0_TT04_08
    SolutionIndex: 333
    SolutionNameMin: Cijk_Ailk_Bjlk_HBH_MT064x064x04_PGR1_PLR0_TT04_04
    SolutionIndex: 334
    SolutionNameMin: Cijk_Ailk_Bjlk_HBH_MT128x128x04_PGR0_PLR1_TT08_08
    SolutionIndex: 335
    SolutionNameMin: Cijk_Ailk_Bjlk_HBH_MT064x128x04_PGR0_PLR1_TT04_08
    SolutionIndex: 336
    SolutionNameMin: Cijk_Ailk_Bjlk_HBH_MT064x064x04_PGR0_PLR1_TT04_04
    SolutionIndex: 337
    SolutionNameMin: Cijk_Ailk_Bjlk_HBH_MT128x128x04_PGR1_PLR1_TT08_08
    SolutionIndex: 338
    SolutionNameMin: Cijk_Ailk_Bjlk_HBH_MT064x128x04_PGR1_PLR1_TT04_08
    SolutionIndex: 339
    SolutionNameMin: Cijk_Ailk_Bjlk_HBH_MT064x064x04_PGR1_PLR1_TT04_04
    SolutionIndex: 340
    SolutionNameMin: Cijk_Ailk_Bjlk_HBH_MT064x128x08_PGR0_PLR0_TT04_08
    SolutionIndex: 341
    SolutionNameMin: Cijk_Ailk_Bjlk_HBH_MT064x064x08_PGR0_PLR0_TT04_04
    SolutionIndex: 342
    SolutionNameMin: Cijk_Ailk_Bjlk_HBH_MT064x064x08_PGR1_PLR0_TT04_04
    SolutionIndex: 343
    SolutionNameMin: Cijk_Ailk_Bjlk_HBH_MT128x128x08_PGR0_PLR1_TT08_08
    SolutionIndex: 344
    SolutionNameMin: Cijk_Ailk_Bjlk_HBH_MT064x128x08_PGR0_PLR1_TT04_08
    SolutionIndex: 345
    SolutionNameMin: Cijk_Ailk_Bjlk_HBH_MT064x064x08_PGR0_PLR1_TT04_04
    SolutionIndex: 346
    SolutionNameMin: Cijk_Ailk_Bjlk_HBH_MT064x128x08_PGR1_PLR1_TT04_08
    SolutionIndex: 347
    SolutionNameMin: Cijk_Ailk_Bjlk_HBH_MT064x064x08_PGR1_PLR1_TT04_04
    SolutionIndex: 348
    SolutionNameMin: Cijk_Ailk_Bjlk_HBH_MT064x064x16_PGR0_PLR0_TT04_04
    SolutionIndex: 349
    SolutionNameMin: Cijk_Ailk_Bjlk_HBH_MT064x064x16_PGR1_PLR0_TT04_04
    SolutionIndex: 350
    SolutionNameMin: Cijk_Ailk_Bjlk_HBH_MT064x128x16_PGR0_PLR1_TT04_08
    SolutionIndex: 351
    SolutionNameMin: Cijk_Ailk_Bjlk_HBH_MT064x064x16_PGR0_PLR1_TT04_04
    SolutionIndex: 352
    SolutionNameMin: Cijk_Ailk_Bjlk_HBH_MT064x064x16_PGR1_PLR1_TT04_04
    SolutionIndex: 353
    SolutionNameMin: Cijk_Ailk_Bjlk_HBH_MT064x128x16_EPS1_GRVW04_PGR1_PLR1_SNLL1_TT08_04_VW04_WG08_32_01_WGM01
    SolutionIndex: 354
    SolutionNameMin: Cijk_Ailk_Bjlk_HBH_MT128x128x16_EPS1_GRVW04_PGR1_PLR1_SNLL1_TT08_08_VW04_WG16_16_01_WGM01
    SolutionIndex: 355
    SolutionNameMin: Cijk_Ailk_Bjlk_HBH_MT064x128x16_EPS1_GRVW04_PGR1_PLR1_SNLL1_TT08_04_VW04_WG08_32_01_WGM08
    SolutionIndex: 356
    SolutionNameMin: Cijk_Ailk_Bjlk_HBH_MT128x064x16_EPS1_GRVW04_PGR1_PLR1_SNLL1_TT08_04_VW04_WG16_16_01_WGM08
    SolutionIndex: 357
    SolutionNameMin: Cijk_Ailk_Bjlk_HBH_MT128x128x16_EPS1_GRVW04_PGR1_PLR1_SNLL1_TT08_08_VW04_WG16_16_01_WGM08
    SolutionIndex: 358
    SolutionNameMin: Cijk_Ailk_Bjlk_HBH_MT128x064x16_EPS1_GRVW04_PGR1_PLR1_SNLL1_TT08_04_VW04_WG16_16_01_WGM64
    SolutionIndex: 359
    SolutionNameMin: Cijk_Ailk_Bjlk_HBH_MT064x064x32_EPS0_GRVW04_PGR0_PLR0_SNLL0_TT04_04_VW04_WG16_16_01_WGM01
    SolutionIndex: 360
    SolutionNameMin: Cijk_Ailk_Bjlk_HBH_MT128x064x16_EPS1_GRVW08_PGR1_PLR1_SNLL1_TT08_08_VW08_WG16_08_01_WGM64
    SolutionIndex: 361
    SolutionNameMin: Cijk_Ailk_Bjlk_HBH_MT128x128x32_EPS1_GRVW08_PGR1_PLR1_SNLL1_TT08_08_VW08_WG16_16_01_WGM64
    SolutionIndex: 362
    SolutionNameMin: Cijk_Ailk_Bjlk_HBH_MT64x128x16_MI32x32x4x2_SE_AF0EM1_ASEM1_ONLL0_SNLL1
    SolutionIndex: 363
    SolutionNameMin: Cijk_Ailk_Bjlk_HBH_MT64x128x16_MI32x32x4x2_SE_AF0EM1_ASEM2_ONLL0_SNLL1
    SolutionIndex: 364
    SolutionNameMin: Cijk_Ailk_Bjlk_HBH_MT64x128x16_MI32x32x4x2_SE_AF0EM2_ASEM1_ONLL0_SNLL1
    SolutionIndex: 365
    SolutionNameMin: Cijk_Ailk_Bjlk_HBH_MT64x128x16_MI32x32x4x2_SE_AF0EM2_ASEM2_ONLL0_SNLL1
    SolutionIndex: 366
    SolutionNameMin: Cijk_Ailk_Bjlk_HBH_MT64x128x32_MI32x32x4x2_SE_AF0EM2_ASEM2_ONLL0_SNLL1
    SolutionIndex: 367
    SolutionNameMin: Cijk_Ailk_Bjlk_HBH_MT64x128x8_MI32x32x4x2_SE_AF0EM1_ASEM1_ONLL0_SNLL0
    SolutionIndex: 368
    SolutionNameMin: Cijk_Ailk_Bjlk_HBH_MT32x256x16_MI32x32x4x2_SE_AF0EM2_ASEM1_ONLL0_SNLL0
    SolutionIndex: 369
    SolutionNameMin: Cijk_Ailk_Bjlk_HBH_MT32x256x16_MI32x32x4x2_SE_AF0EM2_ASEM2_ONLL0_SNLL0
    SolutionIndex: 370
    SolutionNameMin: Cijk_Ailk_Bjlk_HBH_MT64x128x16_MI32x32x4x2_SE_AF0EM1_ASEM1_ONLL0_SNLL0
    SolutionIndex: 371
    SolutionNameMin: Cijk_Ailk_Bjlk_HBH_MT64x128x16_MI32x32x4x2_SE_AF0EM1_ASEM2_ONLL0_SNLL0
    SolutionIndex: 372
    SolutionNameMin: Cijk_Ailk_Bjlk_HBH_MT64x128x16_MI32x32x4x2_SE_AF0EM2_ASEM1_ONLL0_SNLL0
    SolutionIndex: 373
    SolutionNameMin: Cijk_Ailk_Bjlk_HBH_MT64x128x16_MI32x32x4x2_SE_AF0EM2_ASEM2_ONLL0_SNLL0
    SolutionIndex: 374
    SolutionNameMin: Cijk_Ailk_Bjlk_HBH_MT64x128x32_MI32x32x4x2_SE_AF0EM2_ASEM1_ONLL0_SNLL0
    SolutionIndex: 375
    SolutionNameMin: Cijk_Ailk_Bjlk_HBH_MT64x128x32_MI32x32x4x2_SE_AF0EM2_ASEM2_ONLL0_SNLL0
    SolutionIndex: 376
    SolutionNameMin: Cijk_Ailk_Bjlk_HBH_MT64x128x16_MI32x32x4x2_SE_AF0EM1_ASEM1_ONLL1_SNLL1
    SolutionIndex: 377
    SolutionNameMin: Cijk_Ailk_Bjlk_HBH_MT64x128x16_MI32x32x4x2_SE_AF0EM1_ASEM2_ONLL1_SNLL1
    SolutionIndex: 378
    SolutionNameMin: Cijk_Ailk_Bjlk_HBH_MT64x128x16_MI32x32x4x2_SE_AF0EM2_ASEM1_ONLL1_SNLL1
    SolutionIndex: 379
    SolutionNameMin: Cijk_Ailk_Bjlk_HBH_MT64x128x16_MI32x32x4x2_SE_AF0EM2_ASEM2_ONLL1_SNLL1
    SolutionIndex: 380
    SolutionNameMin: Cijk_Ailk_Bjlk_HBH_MT64x128x32_MI32x32x4x2_SE_AF0EM2_ASEM1_ONLL1_SNLL1
    SolutionIndex: 381
    SolutionNameMin: Cijk_Ailk_Bjlk_HBH_MT64x128x8_MI32x32x4x2_SE_AF0EM1_ASEM1_ONLL1_SNLL0
    SolutionIndex: 382
    SolutionNameMin: Cijk_Ailk_Bjlk_HBH_MT32x256x16_MI32x32x4x2_SE_AF0EM1_ASEM1_ONLL1_SNLL0
    SolutionIndex: 383
    SolutionNameMin: Cijk_Ailk_Bjlk_HBH_MT64x128x16_MI32x32x4x2_SE_AF0EM1_ASEM1_ONLL1_SNLL0
    SolutionIndex: 384
    SolutionNameMin: Cijk_Ailk_Bjlk_HBH_MT64x128x16_MI32x32x4x2_SE_AF0EM2_ASEM1_ONLL1_SNLL0
    SolutionIndex: 385
    SolutionNameMin: Cijk_Ailk_Bjlk_HBH_MT64x128x16_MI32x32x4x2_SE_AF0EM2_ASEM2_ONLL1_SNLL0
    SolutionIndex: 386
    SolutionNameMin: Cijk_Ailk_Bjlk_HBH_MT64x128x32_MI32x32x4x2_SE_AF0EM2_ASEM1_ONLL1_SNLL0
    SolutionIndex: 387
    SolutionNameMin: Cijk_Ailk_Bjlk_HBH_MT64x128x32_MI32x32x4x2_SE_AF0EM2_ASEM2_ONLL1_SNLL0
    SolutionIndex: 388
    SolutionNameMin: Cijk_Ailk_Bjlk_HBH_MT64x256x16_MI32x32x4x2_SE_AF0EM1_ASEM1_ONLL0_SNLL1
    SolutionIndex: 389
    SolutionNameMin: Cijk_Ailk_Bjlk_HBH_MT64x256x16_MI32x32x4x2_SE_AF0EM1_ASEM2_ONLL0_SNLL1
    SolutionIndex: 390
    SolutionNameMin: Cijk_Ailk_Bjlk_HBH_MT64x256x16_MI32x32x4x2_SE_AF0EM2_ASEM1_ONLL0_SNLL1
    SolutionIndex: 391
    SolutionNameMin: Cijk_Ailk_Bjlk_HBH_MT64x256x16_MI32x32x4x2_SE_AF0EM2_ASEM2_ONLL0_SNLL1
    SolutionIndex: 392
    SolutionNameMin: Cijk_Ailk_Bjlk_HBH_MT64x256x8_MI32x32x4x2_SE_AF0EM1_ASEM2_ONLL0_SNLL0
    SolutionIndex: 393
    SolutionNameMin: Cijk_Ailk_Bjlk_HBH_MT64x256x16_MI32x32x4x2_SE_AF0EM1_ASEM1_ONLL0_SNLL0
    SolutionIndex: 394
    SolutionNameMin: Cijk_Ailk_Bjlk_HBH_MT64x256x16_MI32x32x4x2_SE_AF0EM1_ASEM2_ONLL0_SNLL0
    SolutionIndex: 395
    SolutionIndex: 396
    SolutionIndex: 397
    SolutionIndex: 398
    SolutionIndex: 399
    SolutionIndex: 400
    SolutionIndex: 401
    SolutionIndex: 402
    SolutionIndex: 403
    SolutionIndex: 404
    SolutionIndex: 405
    SolutionIndex: 406
    SolutionIndex: 407
    SolutionIndex: 408
    SolutionIndex: 409
    SolutionIndex: 410
    SolutionIndex: 411
    SolutionIndex: 412
    SolutionIndex: 413
    SolutionIndex: 414
    SolutionIndex: 415
    SolutionIndex: 416
    SolutionIndex: 417
    SolutionIndex: 418
    SolutionIndex: 419
    SolutionIndex: 420
    SolutionIndex: 421
    SolutionIndex: 422
    SolutionIndex: 423
    SolutionIndex: 424
    SolutionIndex: 425
    SolutionIndex: 426
    SolutionIndex: 427
    SolutionIndex: 428
    SolutionIndex: 429
    SolutionIndex: 430
    SolutionIndex: 431
    SolutionIndex: 432
    SolutionIndex: 433
    SolutionIndex: 434
    SolutionIndex: 435
    SolutionIndex: 436
    SolutionIndex: 437
    SolutionIndex: 438
    SolutionIndex: 439
    SolutionIndex: 440
    SolutionIndex: 441
    SolutionIndex: 442
    SolutionIndex: 443
    SolutionIndex: 444
    SolutionIndex: 445
    SolutionIndex: 446
    SolutionIndex: 447
    SolutionIndex: 448
    SolutionIndex: 449
    SolutionIndex: 450
    SolutionIndex: 451
    SolutionIndex: 452
    SolutionIndex: 453
    SolutionIndex: 454
    SolutionIndex: 455
    SolutionIndex: 456
    SolutionIndex: 457
    SolutionIndex: 458
    SolutionIndex: 459
    SolutionIndex: 460
    SolutionIndex: 461
    SolutionIndex: 462
    SolutionIndex: 463
    SolutionIndex: 464
    SolutionIndex: 465
    SolutionIndex: 466
    SolutionIndex: 467
    SolutionIndex: 468
    SolutionIndex: 469
    SolutionIndex: 470
    SolutionIndex: 471
    SolutionIndex: 472
    SolutionIndex: 473
    SolutionIndex: 474
    SolutionIndex: 475
    SolutionIndex: 476
    SolutionIndex: 477
    SolutionIndex: 478
    SolutionIndex: 479
    SolutionIndex: 480
    SolutionIndex: 481
    SolutionIndex: 482
    SolutionIndex: 483
    SolutionIndex: 484
    SolutionIndex: 485
    SolutionIndex: 486
    SolutionIndex: 487
    SolutionIndex: 488
    SolutionIndex: 489
    SolutionIndex: 490
    SolutionIndex: 491
    SolutionIndex: 492
    SolutionIndex: 493
    SolutionIndex: 494
    SolutionIndex: 495
    SolutionIndex: 496
    SolutionIndex: 497
    SolutionIndex: 498
    SolutionIndex: 499
    SolutionIndex: 500
    SolutionIndex: 501
    SolutionIndex: 502
    SolutionIndex: 503
    SolutionIndex: 504
    SolutionIndex: 505
    SolutionIndex: 506
    SolutionIndex: 507
    SolutionIndex: 508
    SolutionIndex: 509
- - - [64, 448, 1, 3328]
    - [10, 0.0]
  - - [1, 64, 1, 256]
    - [20, 0.0]
  - - [3584, 64, 1, 1280]
    - [17, 0.0]
  - - [64, 128, 1, 256]
    - [1, 0.0]
  - - [64, 5888, 1, 1280]
    - [17, 0.0]
  - - [64, 4288, 1, 1280]
    - [18, 0.0]
  - - [3584, 64, 1, 3328]
    - [17, 0.0]
  - - [64, 1024, 1, 3328]
    - [18, 0.0]
  - - [1, 64, 1, 1280]
    - [22, 0.0]
  - - [704, 64, 1, 3328]
    - [10, 0.0]
  - - [64, 448, 1, 1280]
    - [6, 0.0]
  - - [64, 704, 1, 3328]
    - [11, 0.0]
  - - [64, 64, 1, 1280]
    - [9, 0.0]
  - - [64, 5056, 1, 256]
    - [0, 0.0]
  - - [64, 4288, 1, 3328]
    - [17, 0.0]
  - - [1856, 64, 1, 3328]
    - [18, 0.0]
  - - [1, 64, 1, 1]
    - [19, 0.0]
  - - [448, 64, 1, 1280]
    - [5, 0.0]
  - - [5888, 64, 1, 1280]
    - [17, 0.0]
  - - [2944, 64, 1, 256]
    - [1, 0.0]
  - - [64, 1856, 1, 256]
    - [12, 0.0]
  - - [64, 1024, 1, 1280]
    - [18, 0.0]
  - - [64, 256, 1, 1280]
    - [10, 0.0]
  - - [704, 64, 1, 1280]
    - [3, 0.0]
  - - [64, 128, 1, 1280]
    - [5, 0.0]
  - - [2368, 64, 1, 256]
    - [5, 0.0]
  - - [2368, 64, 1, 3328]
    - [18, 0.0]
  - - [64, 1408, 1, 3328]
    - [11, 0.0]
  - - [1856, 64, 1, 1280]
    - [18, 0.0]
  - - [64, 3584, 1, 1280]
    - [4, 0.0]
  - - [448, 64, 1, 3328]
    - [10, 0.0]
  - - [5888, 64, 1, 3328]
    - [17, 0.0]
  - - [128, 64, 1, 256]
    - [16, 0.0]
  - - [64, 128, 1, 3328]
    - [6, 0.0]
  - - [64, 256, 1, 3328]
    - [13, 0.0]
  - - [4288, 64, 1, 3328]
    - [17, 0.0]
  - - [64, 2944, 1, 256]
    - [16, 0.0]
  - - [6784, 64, 1, 256]
    - [17, 0.0]
  - - [1024, 64, 1, 1280]
    - [18, 0.0]
  - - [64, 2368, 1, 1280]
    - [6, 0.0]
  - - [64, 3584, 1, 3328]
    - [17, 0.0]
  - - [64, 6784, 1, 3328]
    - [17, 0.0]
  - - [3584, 64, 1, 256]
    - [17, 0.0]
  - - [64, 1856, 1, 3328]
    - [18, 0.0]
  - - [448, 64, 1, 256]
    - [5, 0.0]
  - - [64, 5056, 1, 3328]
    - [17, 0.0]
  - - [256, 64, 1, 256]
    - [1, 0.0]
  - - [4288, 64, 1, 1280]
    - [17, 0.0]
  - - [1, 1, 1, 1]
    - [21, 0.0]
  - - [5056, 64, 1, 1280]
    - [18, 0.0]
  - - [1024, 64, 1, 3328]
    - [17, 0.0]
  - - [1408, 64, 1, 256]
    - [16, 0.0]
  - - [64, 1408, 1, 256]
    - [7, 0.0]
  - - [64, 2368, 1, 3328]
    - [6, 0.0]
  - - [64, 448, 1, 256]
    - [5, 0.0]
  - - [64, 6784, 1, 1280]
    - [18, 0.0]
  - - [64, 1856, 1, 1280]
    - [14, 0.0]
  - - [64, 6784, 1, 256]
    - [17, 0.0]
  - - [64, 5056, 1, 1280]
    - [18, 0.0]
  - - [64, 4288, 1, 256]
    - [16, 0.0]
  - - [128, 64, 1, 1280]
    - [5, 0.0]
  - - [5888, 64, 1, 256]
    - [16, 0.0]
  - - [64, 5888, 1, 3328]
    - [17, 0.0]
  - - [64, 1024, 1, 256]
    - [11, 0.0]
  - - [5056, 64, 1, 3328]
    - [17, 0.0]
  - - [256, 64, 1, 1280]
    - [10, 0.0]
  - - [64, 256, 1, 256]
    - [5, 0.0]
  - - [704, 64, 1, 256]
    - [5, 0.0]
  - - [64, 1408, 1, 1280]
    - [18, 0.0]
  - - [1, 1, 1, 256]
    - [20, 0.0]
  - - [64, 704, 1, 256]
    - [8, 0.0]
  - - [64, 2944, 1, 3328]
    - [18, 0.0]
  - - [64, 64, 1, 256]
    - [1, 0.0]
  - - [1856, 64, 1, 256]
    - [17, 0.0]
  - - [128, 64, 1, 3328]
    - [17, 0.0]
  - - [2944, 64, 1, 1280]
    - [17, 0.0]
  - - [4288, 64, 1, 256]
    - [18, 0.0]
  - - [1, 1, 1, 1280]
    - [22, 0.0]
  - - [64, 2944, 1, 1280]
    - [18, 0.0]
  - - [1408, 64, 1, 1280]
    - [18, 0.0]
  - - [6784, 64, 1, 3328]
    - [17, 0.0]
  - - [1024, 64, 1, 256]
    - [18, 0.0]
  - - [64, 2368, 1, 256]
    - [7, 0.0]
  - - [64, 3584, 1, 256]
    - [2, 0.0]
  - - [2944, 64, 1, 3328]
    - [18, 0.0]
  - - [2368, 64, 1, 1280]
    - [5, 0.0]
  - - [256, 64, 1, 3328]
    - [10, 0.0]
  - - [64, 64, 1, 3328]
    - [17, 0.0]
  - - [1, 1, 1, 3328]
    - [22, 0.0]
  - - [64, 5888, 1, 256]
    - [17, 0.0]
  - - [64, 704, 1, 1280]
    - [13, 0.0]
  - - [6784, 64, 1, 1280]
    - [17, 0.0]
  - - [5056, 64, 1, 256]
    - [15, 0.0]
  - - [1408, 64, 1, 3328]
    - [18, 0.0]
  - - [4096, 7133, 1, 4096]
    - [47, 0.0]
  - - [512, 16, 1, 512]
    - [32, 0.0]
  - - [2048, 7133, 1, 2048]
    - [42, 0.0]
  - - [2560, 7133, 1, 2560]
    - [45, 0.0]
  - - [1024, 1024, 1, 1024]
    - [45, 0.0]
  - - [3072, 7435, 1, 1024]
    - [42, 0.0]
  - - [1024, 32, 1, 512]
    - [26, 0.0]
  - - [1760, 7133, 1, 1760]
    - [45, 0.0]
  - - [7680, 5481, 1, 2560]
    - [42, 0.0]
  - - [1024, 16, 1, 512]
    - [26, 0.0]
  - - [512, 32, 1, 512]
    - [31, 0.0]
  - - [3136, 256, 64, 64]
    - [99, 0.0]
  - - [784, 512, 64, 128]
    - [100, 0.0]
  - - [784, 128, 64, 512]
    - [98, 0.0]
  - - [3136, 64, 128, 64]
    - [104, 0.0]
  - - [196, 256, 128, 1024]
    - [99, 0.0]
  - - [196, 256, 64, 1024]
    - [99, 0.0]
  - - [196, 1024, 128, 256]
    - [99, 0.0]
  - - [784, 128, 256, 512]
    - [98, 0.0]
  - - [3136, 64, 64, 256]
    - [103, 0.0]
  - - [3136, 64, 256, 256]
    - [101, 0.0]
  - - [3136, 256, 256, 64]
    - [106, 0.0]
  - - [3136, 64, 128, 256]
    - [105, 0.0]
  - - [784, 128, 128, 512]
    - [98, 0.0]
  - - [784, 512, 128, 128]
    - [98, 0.0]
  - - [784, 512, 256, 128]
    - [100, 0.0]
  - - [196, 1024, 64, 256]
    - [99, 0.0]
  - - [3136, 64, 64, 64]
    - [104, 0.0]
  - - [196, 1024, 256, 256]
    - [102, 0.0]
  - - [196, 256, 256, 1024]
    - [99, 0.0]
  - - [3136, 256, 128, 64]
    - [105, 0.0]
  - - [3136, 64, 256, 64]
    - [104, 0.0]
  - - [64, 128, 512, 128]
    - [175, 0.0]
  - - [64, 512, 1, 512]
    - [224, 0.0]
  - - [64, 512, 64, 512]
    - [160, 0.0]
  - - [128, 64, 512, 128]
    - [214, 0.0]
  - - [512, 64, 1, 512]
    - [167, 0.0]
  - - [512, 64, 64, 512]
    - [206, 0.0]
  - - [1024, 2, 1, 4]
    - [140, 0.0]
  - - [1024, 2, 1, 32]
    - [141, 0.0]
  - - [1024, 2, 1, 2048]
    - [168, 0.0]
  - - [1024, 1024, 1, 4]
    - [227, 0.0]
  - - [1024, 1024, 1, 32]
    - [217, 0.0]
  - - [1024, 1024, 1, 2048]
    - [179, 0.0]
  - - [1024, 1024, 1, 4096]
    - [179, 0.0]
  - - [1024, 4096, 1, 2048]
    - [201, 0.0]
  - - [1024, 4096, 1, 4096]
    - [198, 0.0]
  - - [1024, 30528, 1, 2048]
    - [204, 0.0]
  - - [1024, 30528, 1, 4096]
    - [207, 0.0]
  - - [4096, 1024, 1, 2048]
    - [181, 0.0]
  - - [4096, 1024, 1, 4096]
    - [149, 0.0]
  - - [3, 64, 512, 3]
    - [140, 0.0]
  - - [5, 64, 512, 5]
    - [140, 0.0]
  - - [5, 64, 960, 5]
    - [156, 0.0]
  - - [9, 64, 512, 9]
    - [199, 0.0]
  - - [13, 512, 1, 32768]
    - [232, 0.0]
  - - [27, 128, 32768, 27]
    - [209, 0.0]
  - - [33, 32, 200, 33]
    - [140, 0.0]
  - - [33, 32, 1600, 33]
    - [140, 0.0]
  - - [67, 2048, 1, 512]
    - [231, 0.0]
  - - [74, 2048, 1, 512]
    - [212, 0.0]
  - - [74, 2048, 1, 960]
    - [220, 0.0]
  - - [100, 2048, 1, 512]
    - [170, 0.0]
  - - [256, 128, 1, 32768]
    - [168, 0.0]
  - - [256, 1280, 1, 8976]
    - [168, 0.0]
  - - [256, 2560, 1, 8976]
    - [189, 0.0]
  - - [256, 2816, 1, 8976]
    - [166, 0.0]
  - - [256, 3328, 1, 8976]
    - [166, 0.0]
  - - [256, 3584, 1, 8976]
    - [222, 0.0]
  - - [256, 3840, 1, 8976]
    - [154, 0.0]
  - - [256, 4096, 1, 8976]
    - [151, 0.0]
  - - [256, 4352, 1, 8976]
    - [169, 0.0]
  - - [256, 4864, 1, 8976]
    - [225, 0.0]
  - - [256, 5120, 1, 8976]
    - [158, 0.0]
  - - [256, 5632, 1, 8976]
    - [208, 0.0]
  - - [256, 5888, 1, 8976]
    - [237, 0.0]
  - - [256, 6144, 1, 8976]
    - [152, 0.0]
  - - [256, 7168, 1, 8976]
    - [197, 0.0]
  - - [256, 8192, 1, 8976]
    - [196, 0.0]
  - - [256, 8960, 1, 8976]
    - [188, 0.0]
  - - [256, 9728, 1, 8976]
    - [203, 0.0]
  - - [256, 9984, 1, 8976]
    - [197, 0.0]
  - - [256, 10240, 1, 8976]
    - [164, 0.0]
  - - [256, 10496, 1, 8976]
    - [188, 0.0]
  - - [256, 11008, 1, 8976]
    - [221, 0.0]
  - - [256, 11264, 1, 8976]
    - [234, 0.0]
  - - [256, 11520, 1, 8976]
    - [171, 0.0]
  - - [256, 11776, 1, 8976]
    - [153, 0.0]
  - - [256, 12544, 1, 8976]
    - [171, 0.0]
  - - [256, 12800, 1, 8976]
    - [153, 0.0]
  - - [256, 13312, 1, 8976]
    - [223, 0.0]
  - - [256, 13568, 1, 8976]
    - [236, 0.0]
  - - [256, 14336, 1, 8976]
    - [163, 0.0]
  - - [256, 14848, 1, 8976]
    - [155, 0.0]
  - - [256, 15104, 1, 8976]
    - [226, 0.0]
  - - [256, 15872, 1, 8976]
    - [219, 0.0]
  - - [256, 16128, 1, 8976]
    - [208, 0.0]
  - - [256, 17152, 1, 8976]
    - [216, 0.0]
  - - [256, 17408, 1, 8976]
    - [165, 0.0]
  - - [256, 18688, 1, 8976]
    - [169, 0.0]
  - - [256, 19968, 1, 8976]
    - [205, 0.0]
  - - [256, 20480, 1, 8976]
    - [144, 0.0]
  - - [256, 20992, 1, 8976]
    - [165, 0.0]
  - - [256, 21248, 1, 8976]
    - [165, 0.0]
  - - [256, 22016, 1, 8976]
    - [233, 0.0]
  - - [256, 26112, 1, 8976]
    - [165, 0.0]
  - - [256, 32512, 1, 8976]
    - [165, 0.0]
  - - [256, 32768, 1, 1]
    - [210, 0.0]
  - - [256, 33536, 1, 8976]
    - [165, 0.0]
  - - [256, 44505, 1, 8976]
    - [207, 0.0]
  - - [257, 4096, 1, 1024]
    - [157, 0.0]
  - - [480, 1024, 1, 32768]
    - [162, 0.0]
  - - [512, 32, 1, 200]
    - [159, 0.0]
  - - [512, 32, 1, 1600]
    - [190, 0.0]
  - - [512, 256, 1, 32768]
    - [168, 0.0]
  - - [512, 512, 1, 200]
    - [159, 0.0]
  - - [512, 512, 1, 1600]
    - [215, 0.0]
  - - [512, 2048, 1, 256]
    - [192, 0.0]
  - - [560, 1024, 1, 200]
    - [159, 0.0]
  - - [560, 1024, 1, 1600]
    - [168, 0.0]
  - - [768, 2048, 1, 256]
    - [160, 0.0]
  - - [1024, 64, 1, 512]
    - [217, 0.0]
  - - [1024, 64, 1, 960]
    - [160, 0.0]
  - - [1024, 256, 1, 1024]
    - [172, 0.0]
  - - [1024, 256, 1, 1280]
    - [215, 0.0]
  - - [1024, 256, 1, 2304]
    - [168, 0.0]
  - - [1024, 256, 1, 2816]
    - [168, 0.0]
  - - [1024, 256, 1, 3072]
    - [190, 0.0]
  - - [1024, 256, 1, 3328]
    - [168, 0.0]
  - - [1024, 256, 1, 3584]
    - [168, 0.0]
  - - [1024, 256, 1, 4096]
    - [168, 0.0]
  - - [1024, 256, 1, 4352]
    - [168, 0.0]
  - - [1024, 256, 1, 4608]
    - [168, 0.0]
  - - [1024, 256, 1, 5120]
    - [230, 0.0]
  - - [1024, 256, 1, 5376]
    - [168, 0.0]
  - - [1024, 256, 1, 5632]
    - [168, 0.0]
  - - [1024, 256, 1, 6144]
    - [168, 0.0]
  - - [1024, 256, 1, 6400]
    - [230, 0.0]
  - - [1024, 256, 1, 7680]
    - [168, 0.0]
  - - [1024, 256, 1, 7936]
    - [230, 0.0]
  - - [1024, 256, 1, 8192]
    - [168, 0.0]
  - - [1024, 256, 1, 8448]
    - [168, 0.0]
  - - [1024, 256, 1, 9728]
    - [230, 0.0]
  - - [1024, 256, 1, 9984]
    - [168, 0.0]
  - - [1024, 256, 1, 10496]
    - [168, 0.0]
  - - [1024, 256, 1, 11520]
    - [230, 0.0]
  - - [1024, 256, 1, 12032]
    - [168, 0.0]
  - - [1024, 256, 1, 13568]
    - [168, 0.0]
  - - [1024, 256, 1, 14336]
    - [168, 0.0]
  - - [1024, 256, 1, 14848]
    - [168, 0.0]
  - - [1024, 256, 1, 15104]
    - [168, 0.0]
  - - [1024, 256, 1, 15872]
    - [235, 0.0]
  - - [1024, 256, 1, 16128]
    - [168, 0.0]
  - - [1024, 256, 1, 17152]
    - [168, 0.0]
  - - [1024, 256, 1, 17408]
    - [168, 0.0]
  - - [1024, 256, 1, 18944]
    - [168, 0.0]
  - - [1024, 256, 1, 19712]
    - [168, 0.0]
  - - [1024, 256, 1, 19968]
    - [168, 0.0]
  - - [1024, 256, 1, 21248]
    - [168, 0.0]
  - - [1024, 256, 1, 21504]
    - [235, 0.0]
  - - [1024, 256, 1, 22016]
    - [168, 0.0]
  - - [1024, 256, 1, 28672]
    - [168, 0.0]
  - - [1024, 256, 1, 33536]
    - [168, 0.0]
  - - [1024, 512, 1, 32768]
    - [168, 0.0]
  - - [1024, 1024, 1, 200]
    - [200, 0.0]
  - - [1024, 1024, 1, 512]
    - [146, 0.0]
  - - [1024, 1024, 1, 960]
    - [186, 0.0]
  - - [1024, 1024, 1, 1600]
    - [186, 0.0]
  - - [1024, 1024, 1, 32768]
    - [174, 0.0]
  - - [1600, 1024, 1, 512]
    - [195, 0.0]
  - - [1600, 1024, 1, 960]
    - [148, 0.0]
  - - [2048, 256, 1, 1024]
    - [162, 0.0]
  - - [2048, 960, 1, 1]
    - [194, 0.0]
  - - [2048, 2048, 1, 512]
    - [176, 0.0]
  - - [2048, 2048, 1, 960]
    - [193, 0.0]
  - - [2048, 2048, 1, 1024]
    - [193, 0.0]
  - - [3200, 2048, 1, 1024]
    - [161, 0.0]
  - - [4096, 4096, 1, 1024]
    - [218, 0.0]
  - - [14, 64, 1, 14]
    - [140, 0.0]
  - - [15, 64, 1, 14]
    - [140, 0.0]
  - - [15, 64, 1, 15]
    - [140, 0.0]
  - - [15, 64, 1, 15]
    - [140, 0.0]
  - - [17, 64, 1, 15]
    - [140, 0.0]
  - - [17, 64, 1, 17]
    - [140, 0.0]
  - - [17, 64, 1, 17]
    - [140, 0.0]
  - - [21, 64, 1, 17]
    - [150, 0.0]
  - - [21, 64, 1, 21]
    - [140, 0.0]
  - - [24, 64, 1, 24]
    - [140, 0.0]
  - - [30, 64, 1, 30]
    - [228, 0.0]
  - - [30, 64, 1, 31]
    - [150, 0.0]
  - - [31, 64, 1, 31]
    - [156, 0.0]
  - - [32, 64, 1, 32]
    - [150, 0.0]
  - - [32, 64, 1, 35]
    - [143, 0.0]
  - - [34, 64, 1, 24]
    - [229, 0.0]
  - - [34, 64, 1, 34]
    - [150, 0.0]
  - - [35, 64, 1, 35]
    - [180, 0.0]
  - - [64, 14, 1, 14]
    - [140, 0.0]
  - - [64, 15, 1, 14]
    - [141, 0.0]
  - - [64, 15, 1, 15]
    - [141, 0.0]
  - - [64, 15, 1, 15]
    - [141, 0.0]
  - - [64, 17, 1, 15]
    - [140, 0.0]
  - - [64, 17, 1, 17]
    - [184, 0.0]
  - - [64, 17, 1, 17]
    - [147, 0.0]
  - - [64, 21, 1, 17]
    - [141, 0.0]
  - - [64, 21, 1, 21]
    - [141, 0.0]
  - - [64, 24, 1, 24]
    - [141, 0.0]
  - - [64, 30, 1, 30]
    - [142, 0.0]
  - - [64, 30, 1, 31]
    - [141, 0.0]
  - - [64, 31, 1, 31]
    - [145, 0.0]
  - - [64, 32, 1, 32]
    - [143, 0.0]
  - - [64, 32, 1, 35]
    - [147, 0.0]
  - - [64, 34, 1, 24]
    - [141, 0.0]
  - - [64, 34, 1, 34]
    - [142, 0.0]
  - - [64, 35, 1, 35]
    - [142, 0.0]
  - - [1024, 1024, 1, 3840]
    - [183, 0.0]
  - - [1024, 1024, 1, 3968]
    - [187, 0.0]
  - - [1024, 1024, 1, 6528]
    - [174, 0.0]
  - - [1024, 1024, 1, 7104]
    - [174, 0.0]
  - - [1024, 1024, 1, 7200]
    - [173, 0.0]
  - - [1024, 1024, 1, 8064]
    - [179, 0.0]
  - - [1024, 1024, 1, 8160]
    - [173, 0.0]
  - - [1024, 1024, 1, 9216]
    - [179, 0.0]
  - - [1024, 1024, 1, 9520]
    - [191, 0.0]
  - - [1024, 1024, 1, 10064]
    - [179, 0.0]
  - - [1024, 1024, 1, 10080]
    - [174, 0.0]
  - - [1024, 1024, 1, 10200]
    - [191, 0.0]
  - - [1024, 4096, 1, 3840]
    - [196, 0.0]
  - - [1024, 4096, 1, 3968]
    - [188, 0.0]
  - - [1024, 4096, 1, 6528]
    - [198, 0.0]
  - - [1024, 4096, 1, 7104]
    - [193, 0.0]
  - - [1024, 4096, 1, 7200]
    - [198, 0.0]
  - - [1024, 4096, 1, 8064]
    - [202, 0.0]
  - - [1024, 4096, 1, 8160]
    - [196, 0.0]
  - - [1024, 4096, 1, 9216]
    - [188, 0.0]
  - - [1024, 4096, 1, 9520]
    - [193, 0.0]
  - - [1024, 4096, 1, 10064]
    - [193, 0.0]
  - - [1024, 4096, 1, 10080]
    - [185, 0.0]
  - - [1024, 4096, 1, 10200]
    - [198, 0.0]
  - - [1024, 42720, 1, 3968]
    - [211, 0.0]
  - - [1024, 42720, 1, 6528]
    - [213, 0.0]
  - - [1024, 42720, 1, 7104]
    - [207, 0.0]
  - - [1024, 42720, 1, 7200]
    - [211, 0.0]
  - - [1024, 42720, 1, 9520]
    - [203, 0.0]
  - - [1024, 42720, 1, 10080]
    - [204, 0.0]
  - - [4096, 1024, 1, 3840]
    - [171, 0.0]
  - - [4096, 1024, 1, 3968]
    - [161, 0.0]
  - - [4096, 1024, 1, 6528]
    - [149, 0.0]
  - - [4096, 1024, 1, 7104]
    - [155, 0.0]
  - - [4096, 1024, 1, 7200]
    - [161, 0.0]
  - - [4096, 1024, 1, 8064]
    - [178, 0.0]
  - - [4096, 1024, 1, 8160]
    - [161, 0.0]
  - - [4096, 1024, 1, 9216]
    - [153, 0.0]
  - - [4096, 1024, 1, 9520]
    - [161, 0.0]
  - - [4096, 1024, 1, 10064]
    - [178, 0.0]
  - - [4096, 1024, 1, 10080]
    - [161, 0.0]
  - - [4096, 1024, 1, 10200]
    - [181, 0.0]
  - - [1024, 1024, 1, 3240]
    - [182, 0.0]
  - - [1024, 1024, 1, 3960]
    - [177, 0.0]
  - - [1024, 4096, 1, 3240]
    - [198, 0.0]
  - - [1024, 4096, 1, 3960]
    - [188, 0.0]
  - - [1024, 42720, 1, 3960]
    - [203, 0.0]
  - - [4096, 1024, 1, 3240]
    - [149, 0.0]
  - - [4096, 1024, 1, 3960]
    - [185, 0.0]
  - - [30, 64, 2048, 30]
    - [243, 0.0]
  - - [30, 64, 2048, 31]
    - [249, 0.0]
  - - [31, 64, 2048, 31]
    - [249, 0.0]
  - - [64, 30, 2048, 30]
    - [250, 0.0]
  - - [64, 30, 2048, 31]
    - [247, 0.0]
  - - [64, 31, 2048, 31]
    - [248, 0.0]
  - - [27, 64, 1920, 27]
    - [254, 0.0]
  - - [27, 64, 1920, 33]
    - [249, 0.0]
  - - [33, 64, 1920, 33]
    - [246, 0.0]
  - - [64, 27, 1920, 27]
    - [147, 0.0]
  - - [64, 27, 1920, 33]
    - [245, 0.0]
  - - [64, 33, 1920, 33]
    - [252, 0.0]
  - - [14, 64, 10880, 14]
    - [241, 0.0]
  - - [15, 64, 10880, 14]
    - [244, 0.0]
  - - [15, 64, 7680, 15]
    - [241, 0.0]
  - - [15, 64, 10880, 15]
    - [241, 0.0]
  - - [17, 64, 7680, 15]
    - [241, 0.0]
  - - [17, 64, 7680, 17]
    - [253, 0.0]
  - - [64, 14, 10880, 14]
    - [239, 0.0]
  - - [64, 15, 10880, 14]
    - [238, 0.0]
  - - [64, 15, 7680, 15]
    - [238, 0.0]
  - - [64, 15, 10880, 15]
    - [240, 0.0]
  - - [64, 17, 7680, 15]
    - [251, 0.0]
  - - [64, 17, 7680, 17]
    - [242, 0.0]
  - - [64, 448, 1, 3328]
    - [265, 0.0]
  - - [1, 64, 1, 256]
    - [275, 0.0]
  - - [3584, 64, 1, 1280]
    - [272, 0.0]
  - - [64, 128, 1, 256]
    - [256, 0.0]
  - - [64, 5888, 1, 1280]
    - [272, 0.0]
  - - [64, 4288, 1, 1280]
    - [273, 0.0]
  - - [3584, 64, 1, 3328]
    - [272, 0.0]
  - - [64, 1024, 1, 3328]
    - [273, 0.0]
  - - [1, 64, 1, 1280]
    - [277, 0.0]
  - - [704, 64, 1, 3328]
    - [265, 0.0]
  - - [64, 448, 1, 1280]
    - [261, 0.0]
  - - [64, 704, 1, 3328]
    - [266, 0.0]
  - - [64, 64, 1, 1280]
    - [264, 0.0]
  - - [64, 5056, 1, 256]
    - [255, 0.0]
  - - [64, 4288, 1, 3328]
    - [272, 0.0]
  - - [1856, 64, 1, 3328]
    - [273, 0.0]
  - - [1, 64, 1, 1]
    - [274, 0.0]
  - - [448, 64, 1, 1280]
    - [260, 0.0]
  - - [5888, 64, 1, 1280]
    - [272, 0.0]
  - - [2944, 64, 1, 256]
    - [256, 0.0]
  - - [64, 1856, 1, 256]
    - [267, 0.0]
  - - [64, 1024, 1, 1280]
    - [273, 0.0]
  - - [64, 256, 1, 1280]
    - [265, 0.0]
  - - [704, 64, 1, 1280]
    - [258, 0.0]
  - - [64, 128, 1, 1280]
    - [260, 0.0]
  - - [2368, 64, 1, 256]
    - [260, 0.0]
  - - [2368, 64, 1, 3328]
    - [273, 0.0]
  - - [64, 1408, 1, 3328]
    - [266, 0.0]
  - - [1856, 64, 1, 1280]
    - [273, 0.0]
  - - [64, 3584, 1, 1280]
    - [259, 0.0]
  - - [448, 64, 1, 3328]
    - [265, 0.0]
  - - [5888, 64, 1, 3328]
    - [272, 0.0]
  - - [128, 64, 1, 256]
    - [271, 0.0]
  - - [64, 128, 1, 3328]
    - [261, 0.0]
  - - [64, 256, 1, 3328]
    - [268, 0.0]
  - - [4288, 64, 1, 3328]
    - [272, 0.0]
  - - [64, 2944, 1, 256]
    - [271, 0.0]
  - - [6784, 64, 1, 256]
    - [272, 0.0]
  - - [1024, 64, 1, 1280]
    - [273, 0.0]
  - - [64, 2368, 1, 1280]
    - [261, 0.0]
  - - [64, 3584, 1, 3328]
    - [272, 0.0]
  - - [64, 6784, 1, 3328]
    - [272, 0.0]
  - - [3584, 64, 1, 256]
    - [272, 0.0]
  - - [64, 1856, 1, 3328]
    - [273, 0.0]
  - - [448, 64, 1, 256]
    - [260, 0.0]
  - - [64, 5056, 1, 3328]
    - [272, 0.0]
  - - [256, 64, 1, 256]
    - [256, 0.0]
  - - [4288, 64, 1, 1280]
    - [272, 0.0]
  - - [1, 1, 1, 1]
    - [276, 0.0]
  - - [5056, 64, 1, 1280]
    - [273, 0.0]
  - - [1024, 64, 1, 3328]
    - [272, 0.0]
  - - [1408, 64, 1, 256]
    - [271, 0.0]
  - - [64, 1408, 1, 256]
    - [262, 0.0]
  - - [64, 2368, 1, 3328]
    - [261, 0.0]
  - - [64, 448, 1, 256]
    - [260, 0.0]
  - - [64, 6784, 1, 1280]
    - [273, 0.0]
  - - [64, 1856, 1, 1280]
    - [269, 0.0]
  - - [64, 6784, 1, 256]
    - [272, 0.0]
  - - [64, 5056, 1, 1280]
    - [273, 0.0]
  - - [64, 4288, 1, 256]
    - [271, 0.0]
  - - [128, 64, 1, 1280]
    - [260, 0.0]
  - - [5888, 64, 1, 256]
    - [271, 0.0]
  - - [64, 5888, 1, 3328]
    - [272, 0.0]
  - - [64, 1024, 1, 256]
    - [266, 0.0]
  - - [5056, 64, 1, 3328]
    - [272, 0.0]
  - - [256, 64, 1, 1280]
    - [265, 0.0]
  - - [64, 256, 1, 256]
    - [260, 0.0]
  - - [704, 64, 1, 256]
    - [260, 0.0]
  - - [64, 1408, 1, 1280]
    - [273, 0.0]
  - - [1, 1, 1, 256]
    - [275, 0.0]
  - - [64, 704, 1, 256]
    - [263, 0.0]
  - - [64, 2944, 1, 3328]
    - [273, 0.0]
  - - [64, 64, 1, 256]
    - [256, 0.0]
  - - [1856, 64, 1, 256]
    - [272, 0.0]
  - - [128, 64, 1, 3328]
    - [272, 0.0]
  - - [2944, 64, 1, 1280]
    - [272, 0.0]
  - - [4288, 64, 1, 256]
    - [273, 0.0]
  - - [1, 1, 1, 1280]
    - [277, 0.0]
  - - [64, 2944, 1, 1280]
    - [273, 0.0]
  - - [1408, 64, 1, 1280]
    - [273, 0.0]
  - - [6784, 64, 1, 3328]
    - [272, 0.0]
  - - [1024, 64, 1, 256]
    - [273, 0.0]
  - - [64, 2368, 1, 256]
    - [262, 0.0]
  - - [64, 3584, 1, 256]
    - [257, 0.0]
  - - [2944, 64, 1, 3328]
    - [273, 0.0]
  - - [2368, 64, 1, 1280]
    - [260, 0.0]
  - - [256, 64, 1, 3328]
    - [265, 0.0]
  - - [64, 64, 1, 3328]
    - [272, 0.0]
  - - [1, 1, 1, 3328]
    - [277, 0.0]
  - - [64, 5888, 1, 256]
    - [272, 0.0]
  - - [64, 704, 1, 1280]
    - [268, 0.0]
  - - [6784, 64, 1, 1280]
    - [272, 0.0]
  - - [5056, 64, 1, 256]
    - [270, 0.0]
  - - [1408, 64, 1, 3328]
    - [273, 0.0]
  - - [4096, 7133, 1, 4096]
    - [302, 0.0]
  - - [512, 16, 1, 512]
    - [287, 0.0]
  - - [2048, 7133, 1, 2048]
    - [297, 0.0]
  - - [2560, 7133, 1, 2560]
    - [300, 0.0]
  - - [1024, 1024, 1, 1024]
    - [300, 0.0]
  - - [3072, 7435, 1, 1024]
    - [297, 0.0]
  - - [1024, 32, 1, 512]
    - [281, 0.0]
  - - [1760, 7133, 1, 1760]
    - [300, 0.0]
  - - [7680, 5481, 1, 2560]
    - [297, 0.0]
  - - [1024, 16, 1, 512]
    - [281, 0.0]
  - - [512, 32, 1, 512]
    - [286, 0.0]
  - - [3136, 256, 64, 64]
    - [354, 0.0]
  - - [784, 512, 64, 128]
    - [355, 0.0]
  - - [784, 128, 64, 512]
    - [353, 0.0]
  - - [3136, 64, 128, 64]
    - [359, 0.0]
  - - [196, 256, 128, 1024]
    - [354, 0.0]
  - - [196, 256, 64, 1024]
    - [354, 0.0]
  - - [196, 1024, 128, 256]
    - [354, 0.0]
  - - [784, 128, 256, 512]
    - [353, 0.0]
  - - [3136, 64, 64, 256]
    - [358, 0.0]
  - - [3136, 64, 256, 256]
    - [356, 0.0]
  - - [3136, 256, 256, 64]
    - [361, 0.0]
  - - [3136, 64, 128, 256]
    - [360, 0.0]
  - - [784, 128, 128, 512]
    - [353, 0.0]
  - - [784, 512, 128, 128]
    - [353, 0.0]
  - - [784, 512, 256, 128]
    - [355, 0.0]
  - - [196, 1024, 64, 256]
    - [354, 0.0]
  - - [3136, 64, 64, 64]
    - [359, 0.0]
  - - [196, 1024, 256, 256]
    - [357, 0.0]
  - - [196, 256, 256, 1024]
    - [354, 0.0]
  - - [3136, 256, 128, 64]
    - [360, 0.0]
  - - [3136, 64, 256, 64]
    - [359, 0.0]
  - - [64, 128, 512, 128]
    - [430, 0.0]
  - - [64, 512, 1, 512]
    - [479, 0.0]
  - - [64, 512, 64, 512]
    - [415, 0.0]
  - - [128, 64, 512, 128]
    - [469, 0.0]
  - - [512, 64, 1, 512]
    - [422, 0.0]
  - - [512, 64, 64, 512]
    - [461, 0.0]
  - - [1024, 2, 1, 4]
    - [395, 0.0]
  - - [1024, 2, 1, 32]
    - [396, 0.0]
  - - [1024, 2, 1, 2048]
    - [423, 0.0]
  - - [1024, 1024, 1, 4]
    - [482, 0.0]
  - - [1024, 1024, 1, 32]
    - [472, 0.0]
  - - [1024, 1024, 1, 2048]
    - [434, 0.0]
  - - [1024, 1024, 1, 4096]
    - [434, 0.0]
  - - [1024, 4096, 1, 2048]
    - [456, 0.0]
  - - [1024, 4096, 1, 4096]
    - [453, 0.0]
  - - [1024, 30528, 1, 2048]
    - [459, 0.0]
  - - [1024, 30528, 1, 4096]
    - [462, 0.0]
  - - [4096, 1024, 1, 2048]
    - [436, 0.0]
  - - [4096, 1024, 1, 4096]
    - [404, 0.0]
  - - [3, 64, 512, 3]
    - [395, 0.0]
  - - [5, 64, 512, 5]
    - [395, 0.0]
  - - [5, 64, 960, 5]
    - [411, 0.0]
  - - [9, 64, 512, 9]
    - [454, 0.0]
  - - [13, 512, 1, 32768]
    - [487, 0.0]
  - - [27, 128, 32768, 27]
    - [464, 0.0]
  - - [33, 32, 200, 33]
    - [395, 0.0]
  - - [33, 32, 1600, 33]
    - [395, 0.0]
  - - [67, 2048, 1, 512]
    - [486, 0.0]
  - - [74, 2048, 1, 512]
    - [467, 0.0]
  - - [74, 2048, 1, 960]
    - [475, 0.0]
  - - [100, 2048, 1, 512]
    - [425, 0.0]
  - - [256, 128, 1, 32768]
    - [423, 0.0]
  - - [256, 1280, 1, 8976]
    - [423, 0.0]
  - - [256, 2560, 1, 8976]
    - [444, 0.0]
  - - [256, 2816, 1, 8976]
    - [421, 0.0]
  - - [256, 3328, 1, 8976]
    - [421, 0.0]
  - - [256, 3584, 1, 8976]
    - [477, 0.0]
  - - [256, 3840, 1, 8976]
    - [409, 0.0]
  - - [256, 4096, 1, 8976]
    - [406, 0.0]
  - - [256, 4352, 1, 8976]
    - [424, 0.0]
  - - [256, 4864, 1, 8976]
    - [480, 0.0]
  - - [256, 5120, 1, 8976]
    - [413, 0.0]
  - - [256, 5632, 1, 8976]
    - [463, 0.0]
  - - [256, 5888, 1, 8976]
    - [492, 0.0]
  - - [256, 6144, 1, 8976]
    - [407, 0.0]
  - - [256, 7168, 1, 8976]
    - [452, 0.0]
  - - [256, 8192, 1, 8976]
    - [451, 0.0]
  - - [256, 8960, 1, 8976]
    - [443, 0.0]
  - - [256, 9728, 1, 8976]
    - [458, 0.0]
  - - [256, 9984, 1, 8976]
    - [452, 0.0]
  - - [256, 10240, 1, 8976]
    - [419, 0.0]
  - - [256, 10496, 1, 8976]
    - [443, 0.0]
  - - [256, 11008, 1, 8976]
    - [476, 0.0]
  - - [256, 11264, 1, 8976]
    - [489, 0.0]
  - - [256, 11520, 1, 8976]
    - [426, 0.0]
  - - [256, 11776, 1, 8976]
    - [408, 0.0]
  - - [256, 12544, 1, 8976]
    - [426, 0.0]
  - - [256, 12800, 1, 8976]
    - [408, 0.0]
  - - [256, 13312, 1, 8976]
    - [478, 0.0]
  - - [256, 13568, 1, 8976]
    - [491, 0.0]
  - - [256, 14336, 1, 8976]
    - [418, 0.0]
  - - [256, 14848, 1, 8976]
    - [410, 0.0]
  - - [256, 15104, 1, 8976]
    - [481, 0.0]
  - - [256, 15872, 1, 8976]
    - [474, 0.0]
  - - [256, 16128, 1, 8976]
    - [463, 0.0]
  - - [256, 17152, 1, 8976]
    - [471, 0.0]
  - - [256, 17408, 1, 8976]
    - [420, 0.0]
  - - [256, 18688, 1, 8976]
    - [424, 0.0]
  - - [256, 19968, 1, 8976]
    - [460, 0.0]
  - - [256, 20480, 1, 8976]
    - [399, 0.0]
  - - [256, 20992, 1, 8976]
    - [420, 0.0]
  - - [256, 21248, 1, 8976]
    - [420, 0.0]
  - - [256, 22016, 1, 8976]
    - [488, 0.0]
  - - [256, 26112, 1, 8976]
    - [420, 0.0]
  - - [256, 32512, 1, 8976]
    - [420, 0.0]
  - - [256, 32768, 1, 1]
    - [465, 0.0]
  - - [256, 33536, 1, 8976]
    - [420, 0.0]
  - - [256, 44505, 1, 8976]
    - [462, 0.0]
  - - [257, 4096, 1, 1024]
    - [412, 0.0]
  - - [480, 1024, 1, 32768]
    - [417, 0.0]
  - - [512, 32, 1, 200]
    - [414, 0.0]
  - - [512, 32, 1, 1600]
    - [445, 0.0]
  - - [512, 256, 1, 32768]
    - [423, 0.0]
  - - [512, 512, 1, 200]
    - [414, 0.0]
  - - [512, 512, 1, 1600]
    - [470, 0.0]
  - - [512, 2048, 1, 256]
    - [447, 0.0]
  - - [560, 1024, 1, 200]
    - [414, 0.0]
  - - [560, 1024, 1, 1600]
    - [423, 0.0]
  - - [768, 2048, 1, 256]
    - [415, 0.0]
  - - [1024, 64, 1, 512]
    - [472, 0.0]
  - - [1024, 64, 1, 960]
    - [415, 0.0]
  - - [1024, 256, 1, 1024]
    - [427, 0.0]
  - - [1024, 256, 1, 1280]
    - [470, 0.0]
  - - [1024, 256, 1, 2304]
    - [423, 0.0]
  - - [1024, 256, 1, 2816]
    - [423, 0.0]
  - - [1024, 256, 1, 3072]
    - [445, 0.0]
  - - [1024, 256, 1, 3328]
    - [423, 0.0]
  - - [1024, 256, 1, 3584]
    - [423, 0.0]
  - - [1024, 256, 1, 4096]
    - [423, 0.0]
  - - [1024, 256, 1, 4352]
    - [423, 0.0]
  - - [1024, 256, 1, 4608]
    - [423, 0.0]
  - - [1024, 256, 1, 5120]
    - [485, 0.0]
  - - [1024, 256, 1, 5376]
    - [423, 0.0]
  - - [1024, 256, 1, 5632]
    - [423, 0.0]
  - - [1024, 256, 1, 6144]
    - [423, 0.0]
  - - [1024, 256, 1, 6400]
    - [485, 0.0]
  - - [1024, 256, 1, 7680]
    - [423, 0.0]
  - - [1024, 256, 1, 7936]
    - [485, 0.0]
  - - [1024, 256, 1, 8192]
    - [423, 0.0]
  - - [1024, 256, 1, 8448]
    - [423, 0.0]
  - - [1024, 256, 1, 9728]
    - [485, 0.0]
  - - [1024, 256, 1, 9984]
    - [423, 0.0]
  - - [1024, 256, 1, 10496]
    - [423, 0.0]
  - - [1024, 256, 1, 11520]
    - [485, 0.0]
  - - [1024, 256, 1, 12032]
    - [423, 0.0]
  - - [1024, 256, 1, 13568]
    - [423, 0.0]
  - - [1024, 256, 1, 14336]
    - [423, 0.0]
  - - [1024, 256, 1, 14848]
    - [423, 0.0]
  - - [1024, 256, 1, 15104]
    - [423, 0.0]
  - - [1024, 256, 1, 15872]
    - [490, 0.0]
  - - [1024, 256, 1, 16128]
    - [423, 0.0]
  - - [1024, 256, 1, 17152]
    - [423, 0.0]
  - - [1024, 256, 1, 17408]
    - [423, 0.0]
  - - [1024, 256, 1, 18944]
    - [423, 0.0]
  - - [1024, 256, 1, 19712]
    - [423, 0.0]
  - - [1024, 256, 1, 19968]
    - [423, 0.0]
  - - [1024, 256, 1, 21248]
    - [423, 0.0]
  - - [1024, 256, 1, 21504]
    - [490, 0.0]
  - - [1024, 256, 1, 22016]
    - [423, 0.0]
  - - [1024, 256, 1, 28672]
    - [423, 0.0]
  - - [1024, 256, 1, 33536]
    - [423, 0.0]
  - - [1024, 512, 1, 32768]
    - [423, 0.0]
  - - [1024, 1024, 1, 200]
    - [455, 0.0]
  - - [1024, 1024, 1, 512]
    - [401, 0.0]
  - - [1024, 1024, 1, 960]
    - [441, 0.0]
  - - [1024, 1024, 1, 1600]
    - [441, 0.0]
  - - [1024, 1024, 1, 32768]
    - [429, 0.0]
  - - [1600, 1024, 1, 512]
    - [450, 0.0]
  - - [1600, 1024, 1, 960]
    - [403, 0.0]
  - - [2048, 256, 1, 1024]
    - [417, 0.0]
  - - [2048, 960, 1, 1]
    - [449, 0.0]
  - - [2048, 2048, 1, 512]
    - [431, 0.0]
  - - [2048, 2048, 1, 960]
    - [448, 0.0]
  - - [2048, 2048, 1, 1024]
    - [448, 0.0]
  - - [3200, 2048, 1, 1024]
    - [416, 0.0]
  - - [4096, 4096, 1, 1024]
    - [473, 0.0]
  - - [14, 64, 1, 14]
    - [395, 0.0]
  - - [15, 64, 1, 14]
    - [395, 0.0]
  - - [15, 64, 1, 15]
    - [395, 0.0]
  - - [15, 64, 1, 15]
    - [395, 0.0]
  - - [17, 64, 1, 15]
    - [395, 0.0]
  - - [17, 64, 1, 17]
    - [395, 0.0]
  - - [17, 64, 1, 17]
    - [395, 0.0]
  - - [21, 64, 1, 17]
    - [405, 0.0]
  - - [21, 64, 1, 21]
    - [395, 0.0]
  - - [24, 64, 1, 24]
    - [395, 0.0]
  - - [30, 64, 1, 30]
    - [483, 0.0]
  - - [30, 64, 1, 31]
    - [405, 0.0]
  - - [31, 64, 1, 31]
    - [411, 0.0]
  - - [32, 64, 1, 32]
    - [405, 0.0]
  - - [32, 64, 1, 35]
    - [398, 0.0]
  - - [34, 64, 1, 24]
    - [484, 0.0]
  - - [34, 64, 1, 34]
    - [405, 0.0]
  - - [35, 64, 1, 35]
    - [435, 0.0]
  - - [64, 14, 1, 14]
    - [395, 0.0]
  - - [64, 15, 1, 14]
    - [396, 0.0]
  - - [64, 15, 1, 15]
    - [396, 0.0]
  - - [64, 15, 1, 15]
    - [396, 0.0]
  - - [64, 17, 1, 15]
    - [395, 0.0]
  - - [64, 17, 1, 17]
    - [439, 0.0]
  - - [64, 17, 1, 17]
    - [402, 0.0]
  - - [64, 21, 1, 17]
    - [396, 0.0]
  - - [64, 21, 1, 21]
    - [396, 0.0]
  - - [64, 24, 1, 24]
    - [396, 0.0]
  - - [64, 30, 1, 30]
    - [397, 0.0]
  - - [64, 30, 1, 31]
    - [396, 0.0]
  - - [64, 31, 1, 31]
    - [400, 0.0]
  - - [64, 32, 1, 32]
    - [398, 0.0]
  - - [64, 32, 1, 35]
    - [402, 0.0]
  - - [64, 34, 1, 24]
    - [396, 0.0]
  - - [64, 34, 1, 34]
    - [397, 0.0]
  - - [64, 35, 1, 35]
    - [397, 0.0]
  - - [1024, 1024, 1, 3840]
    - [438, 0.0]
  - - [1024, 1024, 1, 3968]
    - [442, 0.0]
  - - [1024, 1024, 1, 6528]
    - [429, 0.0]
  - - [1024, 1024, 1, 7104]
    - [429, 0.0]
  - - [1024, 1024, 1, 7200]
    - [428, 0.0]
  - - [1024, 1024, 1, 8064]
    - [434, 0.0]
  - - [1024, 1024, 1, 8160]
    - [428, 0.0]
  - - [1024, 1024, 1, 9216]
    - [434, 0.0]
  - - [1024, 1024, 1, 9520]
    - [446, 0.0]
  - - [1024, 1024, 1, 10064]
    - [434, 0.0]
  - - [1024, 1024, 1, 10080]
    - [429, 0.0]
  - - [1024, 1024, 1, 10200]
    - [446, 0.0]
  - - [1024, 4096, 1, 3840]
    - [451, 0.0]
  - - [1024, 4096, 1, 3968]
    - [443, 0.0]
  - - [1024, 4096, 1, 6528]
    - [453, 0.0]
  - - [1024, 4096, 1, 7104]
    - [448, 0.0]
  - - [1024, 4096, 1, 7200]
    - [453, 0.0]
  - - [1024, 4096, 1, 8064]
    - [457, 0.0]
  - - [1024, 4096, 1, 8160]
    - [451, 0.0]
  - - [1024, 4096, 1, 9216]
    - [443, 0.0]
  - - [1024, 4096, 1, 9520]
    - [448, 0.0]
  - - [1024, 4096, 1, 10064]
    - [448, 0.0]
  - - [1024, 4096, 1, 10080]
    - [440, 0.0]
  - - [1024, 4096, 1, 10200]
    - [453, 0.0]
  - - [1024, 42720, 1, 3968]
    - [466, 0.0]
  - - [1024, 42720, 1, 6528]
    - [468, 0.0]
  - - [1024, 42720, 1, 7104]
    - [462, 0.0]
  - - [1024, 42720, 1, 7200]
    - [466, 0.0]
  - - [1024, 42720, 1, 9520]
    - [458, 0.0]
  - - [1024, 42720, 1, 10080]
    - [459, 0.0]
  - - [4096, 1024, 1, 3840]
    - [426, 0.0]
  - - [4096, 1024, 1, 3968]
    - [416, 0.0]
  - - [4096, 1024, 1, 6528]
    - [404, 0.0]
  - - [4096, 1024, 1, 7104]
    - [410, 0.0]
  - - [4096, 1024, 1, 7200]
    - [416, 0.0]
  - - [4096, 1024, 1, 8064]
    - [433, 0.0]
  - - [4096, 1024, 1, 8160]
    - [416, 0.0]
  - - [4096, 1024, 1, 9216]
    - [408, 0.0]
  - - [4096, 1024, 1, 9520]
    - [416, 0.0]
  - - [4096, 1024, 1, 10064]
    - [433, 0.0]
  - - [4096, 1024, 1, 10080]
    - [416, 0.0]
  - - [4096, 1024, 1, 10200]
    - [436, 0.0]
  - - [1024, 1024, 1, 3240]
    - [437, 0.0]
  - - [1024, 1024, 1, 3960]
    - [432, 0.0]
  - - [1024, 4096, 1, 3240]
    - [453, 0.0]
  - - [1024, 4096, 1, 3960]
    - [443, 0.0]
  - - [1024, 42720, 1, 3960]
    - [458, 0.0]
  - - [4096, 1024, 1, 3240]
    - [404, 0.0]
  - - [4096, 1024, 1, 3960]
    - [440, 0.0]
  - - [30, 64, 2048, 30]
    - [498, 0.0]
  - - [30, 64, 2048, 31]
    - [504, 0.0]
  - - [31, 64, 2048, 31]
    - [504, 0.0]
  - - [64, 30, 2048, 30]
    - [505, 0.0]
  - - [64, 30, 2048, 31]
    - [502, 0.0]
  - - [64, 31, 2048, 31]
    - [503, 0.0]
  - - [27, 64, 1920, 27]
    - [509, 0.0]
  - - [27, 64, 1920, 33]
    - [504, 0.0]
  - - [33, 64, 1920, 33]
    - [501, 0.0]
  - - [64, 27, 1920, 27]
    - [402, 0.0]
  - - [64, 27, 1920, 33]
    - [500, 0.0]
  - - [64, 33, 1920, 33]
    - [507, 0.0]
  - - [14, 64, 10880, 14]
    - [496, 0.0]
  - - [15, 64, 10880, 14]
    - [499, 0.0]
  - - [15, 64, 7680, 15]
    - [496, 0.0]
  - - [15, 64, 10880, 15]
    - [496, 0.0]
  - - [17, 64, 7680, 15]
    - [496, 0.0]
  - - [17, 64, 7680, 17]
    - [508, 0.0]
  - - [64, 14, 10880, 14]
    - [494, 0.0]
  - - [64, 15, 10880, 14]
    - [493, 0.0]
  - - [64, 15, 7680, 15]
    - [493, 0.0]
  - - [64, 15, 10880, 15]
    - [495, 0.0]
  - - [64, 17, 7680, 15]
    - [506, 0.0]
  - - [64, 17, 7680, 17]
    - [497, 0.0]
- null
