library/src/blas3/Tensile/Logic/asm_full/arcturus_Cijk_Ailk_Bljk_HBH.yaml
- {MinimumRequiredVersion: 4.6.0}
- arcturus
- gfx908
- [Device 7380, Device 7388, Device 738c, Device 7390]
    SolutionIndex: 0
    SolutionNameMin: Cijk_Ailk_Bljk_HBH_MT032x032x16_PGR1_PLR1_TT04_04
    SolutionIndex: 1
    SolutionNameMin: Cijk_Ailk_Bljk_HBH_MT064x016x16_PGR1_PLR1_TT04_04
    SolutionIndex: 2
    SolutionNameMin: Cijk_Ailk_Bljk_HBH_MT032x016x16_PGR1_PLR1_TT02_02
    SolutionIndex: 3
    SolutionNameMin: Cijk_Ailk_Bljk_HBH_MT064x016x16_PGR1_PLR1_TT04_02
    SolutionIndex: 4
    SolutionNameMin: Cijk_Ailk_Bljk_HBH_MT064x008x16_PGR1_PLR1_TT02_02
    SolutionIndex: 5
    SolutionNameMin: Cijk_Ailk_Bljk_HBH_MT064x016x16_PGR1_PLR1_TT02_02
    SolutionIndex: 6
    SolutionNameMin: Cijk_Ailk_Bljk_HBH_MT128x016x16_PGR1_PLR1_TT04_02
    SolutionIndex: 7
    SolutionNameMin: Cijk_Ailk_Bljk_HBH_MT016x016x32_PGR1_PLR1_TT02_02
    SolutionIndex: 8
    SolutionNameMin: Cijk_Ailk_Bljk_HBH_MT032x008x32_PGR1_PLR1_TT02_02
    SolutionIndex: 9
    SolutionNameMin: Cijk_Ailk_Bljk_HBH_MT032x016x32_PGR1_PLR1_TT02_02
    SolutionIndex: 10
    SolutionNameMin: Cijk_Ailk_Bljk_HBH_MT064x016x32_PGR1_PLR1_TT04_02
    SolutionIndex: 11
    SolutionNameMin: Cijk_Ailk_Bljk_HBH_MT064x008x32_PGR1_PLR1_TT02_02
    SolutionIndex: 12
    SolutionNameMin: Cijk_Ailk_Bljk_HBH_MT064x016x32_PGR1_PLR1_TT02_02
    SolutionIndex: 13
    SolutionNameMin: Cijk_Ailk_Bljk_HBH_MT128x016x32_PGR1_PLR1_TT04_02
    SolutionIndex: 14
    SolutionNameMin: Cijk_Ailk_Bljk_HBH_MT032x008x64_PGR1_PLR1_TT02_02
    SolutionIndex: 15
    SolutionNameMin: Cijk_Ailk_Bljk_HBH_MT064x008x64_PGR1_PLR1_TT02_02
    SolutionIndex: 16
    SolutionNameMin: Cijk_Ailk_Bljk_HBH_MT032x032x08_PGR1_PLR1_TT04_04
    SolutionIndex: 17
    SolutionNameMin: Cijk_Ailk_Bljk_HBH_MT064x032x08_PGR1_PLR1_TT08_04
    SolutionIndex: 18
    SolutionNameMin: Cijk_Ailk_Bljk_HBH_MT032x016x16_PGR1_PLR1_TT04_02
    SolutionIndex: 19
    SolutionNameMin: Cijk_Ailk_Bljk_HBH_MT032x032x16_PGR1_PLR1_TT04_04
    SolutionIndex: 20
    SolutionNameMin: Cijk_Ailk_Bljk_HBH_MT064x064x16_PGR1_PLR1_TT08_08
    SolutionIndex: 21
    SolutionNameMin: Cijk_Ailk_Bljk_HBH_MT064x016x16_PGR1_PLR1_TT04_02
    SolutionIndex: 22
    SolutionNameMin: Cijk_Ailk_Bljk_HBH_MT064x016x16_PGR1_PLR1_TT02_02
    SolutionIndex: 23
    SolutionNameMin: Cijk_Ailk_Bljk_HBH_MT128x016x16_PGR1_PLR1_TT04_02
    SolutionIndex: 24
    SolutionNameMin: Cijk_Ailk_Bljk_HBH_MT064x016x16_PGR1_PLR1_TT04_04
    SolutionIndex: 25
    SolutionNameMin: Cijk_Ailk_Bljk_HBH_MT064x008x16_PGR1_PLR1_TT02_02
    SolutionIndex: 26
    SolutionNameMin: Cijk_Ailk_Bljk_HBH_MT016x016x24_PGR1_PLR1_TT02_02
    SolutionIndex: 27
    SolutionNameMin: Cijk_Ailk_Bljk_HBH_MT032x016x24_PGR1_PLR1_TT04_02
    SolutionIndex: 28
    SolutionNameMin: Cijk_Ailk_Bljk_HBH_MT032x032x24_PGR1_PLR1_TT04_04
    SolutionIndex: 29
    SolutionNameMin: Cijk_Ailk_Bljk_HBH_MT032x032x32_PGR1_PLR1_TT04_04
    SolutionIndex: 30
    SolutionNameMin: Cijk_Ailk_Bljk_HBH_MT064x016x32_PGR1_PLR1_TT02_02
    SolutionIndex: 31
    SolutionNameMin: Cijk_Ailk_Bljk_HBH_MT128x016x32_PGR1_PLR1_TT04_02
    SolutionIndex: 32
    SolutionNameMin: Cijk_Ailk_Bljk_HBH_MT032x008x32_PGR1_PLR1_TT02_02
    SolutionIndex: 33
    SolutionNameMin: Cijk_Ailk_Bljk_HBH_MT064x008x32_PGR1_PLR1_TT02_02
    SolutionIndex: 34
    SolutionNameMin: Cijk_Ailk_Bljk_HBH_MT032x008x64_PGR1_PLR1_TT02_02
    SolutionIndex: 35
    SolutionNameMin: Cijk_Ailk_Bljk_HBH_MT064x008x64_PGR1_PLR1_TT02_02
    SolutionIndex: 36
    SolutionNameMin: Cijk_Ailk_Bljk_HBH_MT064x064x08_PGR1_PLR1_TT04_04
    SolutionIndex: 37
    SolutionNameMin: Cijk_Ailk_Bljk_HBH_MT064x128x08_PGR1_PLR1_TT04_08
    SolutionIndex: 38
    SolutionNameMin: Cijk_Ailk_Bljk_HBH_MT128x064x08_PGR1_PLR1_TT08_04
    SolutionIndex: 39
    SolutionNameMin: Cijk_Ailk_Bljk_HBH_MT064x064x16_PGR1_PLR1_TT04_04
    SolutionIndex: 40
    SolutionNameMin: Cijk_Ailk_Bljk_HBH_MT064x128x16_PGR1_PLR1_TT04_08
    SolutionIndex: 41
    SolutionNameMin: Cijk_Ailk_Bljk_HBH_MT128x064x16_PGR1_PLR1_TT08_04
    SolutionIndex: 42
    SolutionNameMin: Cijk_Ailk_Bljk_HBH_MT128x128x16_PGR1_PLR1_TT08_08
    SolutionIndex: 43
    SolutionNameMin: Cijk_Ailk_Bljk_HBH_MT064x064x04_PGR1_PLR1_TT04_04
    SolutionIndex: 44
    SolutionNameMin: Cijk_Ailk_Bljk_HBH_MT064x064x08_PGR1_PLR1_TT04_04
    SolutionIndex: 45
    SolutionNameMin: Cijk_Ailk_Bljk_HBH_MT064x064x16_PGR1_PLR1_TT04_04
    SolutionIndex: 46
    SolutionNameMin: Cijk_Ailk_Bljk_HBH_MT032x032x16_PGR1_PLR1_TT04_04
    SolutionIndex: 47
    SolutionNameMin: Cijk_Ailk_Bljk_HBH_MT064x016x16_PGR1_PLR1_TT04_04
    SolutionIndex: 48
    SolutionNameMin: Cijk_Ailk_Bljk_HBH_MT064x032x16_PGR1_PLR1_TT04_04
    SolutionIndex: 49
    SolutionNameMin: Cijk_Ailk_Bljk_HBH_MT032x032x32_PGR1_PLR1_TT04_04
    SolutionIndex: 50
    SolutionNameMin: Cijk_Ailk_Bljk_HBH_MT064x016x32_PGR1_PLR1_TT04_04
    SolutionIndex: 51
    SolutionNameMin: Cijk_Ailk_Bljk_HBH_MT064x032x32_PGR1_PLR1_TT04_04
    SolutionIndex: 52
    SolutionNameMin: Cijk_Ailk_Bljk_HBH_MT128x016x32_PGR1_PLR1_TT04_04
    SolutionIndex: 53
    SolutionNameMin: Cijk_Ailk_Bljk_HBH_MT128x032x32_PGR1_PLR1_TT04_04
    SolutionIndex: 54
    SolutionNameMin: Cijk_Ailk_Bljk_HBH_MT064x064x16_PGR1_PLR1_TT08_08
    SolutionIndex: 55
    SolutionNameMin: Cijk_Ailk_Bljk_HBH_MT128x128x16_PGR1_PLR1_TT08_08
    SolutionIndex: 56
    SolutionNameMin: Cijk_Ailk_Bljk_HBH_MT064x032x08_PGR1_PLR1_TT08_04
    SolutionIndex: 57
    SolutionNameMin: Cijk_Ailk_Bljk_HBH_MT064x064x08_PGR1_PLR1_TT08_08
    SolutionIndex: 58
    SolutionNameMin: Cijk_Ailk_Bljk_HBH_MT032x032x16_PGR1_PLR1_TT04_04
    SolutionIndex: 59
    SolutionNameMin: Cijk_Ailk_Bljk_HBH_MT064x032x16_PGR1_PLR1_TT08_04
    SolutionIndex: 60
    SolutionNameMin: Cijk_Ailk_Bljk_HBH_MT064x064x16_PGR1_PLR1_TT04_04
    SolutionIndex: 61
    SolutionNameMin: Cijk_Ailk_Bljk_HBH_MT128x064x16_PGR1_PLR1_TT08_04
    SolutionIndex: 62
    SolutionNameMin: Cijk_Ailk_Bljk_HBH_MT128x128x16_PGR1_PLR1_TT08_08
    SolutionIndex: 63
    SolutionNameMin: Cijk_Ailk_Bljk_HBH_MT064x032x16_PGR1_PLR1_TT04_04
    SolutionIndex: 64
    SolutionNameMin: Cijk_Ailk_Bljk_HBH_MT128x064x32_PGR1_PLR1_TT08_04
    SolutionIndex: 65
    SolutionNameMin: Cijk_Ailk_Bljk_HBH_MT128x032x32_PGR1_PLR1_TT04_04
    SolutionIndex: 66
    SolutionNameMin: Cijk_Ailk_Bljk_HBH_MT064x016x32_PGR1_PLR1_TT04_04
    SolutionIndex: 67
    SolutionNameMin: Cijk_Ailk_Bljk_HBH_MT064x064x16_PGR1_PLR1_TT08_08
    SolutionIndex: 68
    SolutionNameMin: Cijk_Ailk_Bljk_HBH_MT128x128x16_PGR1_PLR1_TT08_08
    SolutionIndex: 69
    SolutionNameMin: Cijk_Ailk_Bljk_HBH_MT064x064x32_PGR1_PLR1_TT08_08
    SolutionIndex: 70
    SolutionNameMin: Cijk_Ailk_Bljk_HBH_MT128x128x32_PGR1_PLR1_TT08_08
    SolutionIndex: 71
    SolutionNameMin: Cijk_Ailk_Bljk_HBH_MT128x128x32_PGR0_PLR1_TT08_08
    SolutionIndex: 72
    SolutionNameMin: Cijk_Ailk_Bljk_HBH_MT064x128x16_PGR1_PLR1_TT04_08
    SolutionIndex: 73
    SolutionNameMin: Cijk_Ailk_Bljk_HBH_MT128x064x16_PGR1_PLR1_TT08_04
    SolutionIndex: 74
    SolutionNameMin: Cijk_Ailk_Bljk_HBH_MT128x128x16_PGR1_PLR1_TT08_08
    SolutionIndex: 75
    SolutionNameMin: Cijk_Ailk_Bljk_HBH_MT128x064x16_PGR1_PLR1_TT04_08
    SolutionIndex: 76
    SolutionNameMin: Cijk_Ailk_Bljk_HBH_MT128x064x16_PGR1_PLR1_TT04_08
    SolutionIndex: 77
    SolutionNameMin: Cijk_Ailk_Bljk_HBH_MT128x064x32_PGR1_PLR1_TT04_04
    SolutionIndex: 78
    SolutionNameMin: Cijk_Ailk_Bljk_HBH_MT256x128x32_PGR1_PLR1_TT08_08
    SolutionIndex: 79
    SolutionNameMin: Cijk_Ailk_Bljk_HBH_MT064x064x08_PGR1_PLR1_TT04_04
    SolutionIndex: 80
    SolutionNameMin: Cijk_Ailk_Bljk_HBH_MT064x128x08_PGR1_PLR0_TT04_08
    SolutionIndex: 81
    SolutionNameMin: Cijk_Ailk_Bljk_HBH_MT128x064x16_EPS1_GRVW08_LPB00_PGR1_PLR1_SNLL1_TT08_08_VW08_WG16_08_01_WGM01
    SolutionIndex: 82
    SolutionNameMin: Cijk_Ailk_Bljk_HBH_MT128x064x16_EPS1_GRVW04_LPB04_PGR1_PLR1_SNLL1_TT08_04_VW04_WG16_16_01_WGM01
    SolutionIndex: 83
    SolutionNameMin: Cijk_Ailk_Bljk_HBH_MT064x128x16_EPS1_GRVW04_LPB04_PGR1_PLR1_SNLL1_TT08_04_VW04_WG08_32_01_WGM08
    SolutionIndex: 84
    SolutionNameMin: Cijk_Ailk_Bljk_HBH_MT256x064x16_EPS1_GRVW04_LPB04_PGR1_PLR1_SNLL1_TT08_08_VW04_WG32_08_01_WGM64
    SolutionIndex: 85
    SolutionNameMin: Cijk_Ailk_Bljk_HBH_MT064x064x32_EPS0_GRVW04_LPB04_PGR0_PLR0_SNLL0_TT04_04_VW04_WG16_16_01_WGM01
    SolutionIndex: 86
    SolutionNameMin: Cijk_Ailk_Bljk_HBH_MT128x064x32_EPS1_GRVW04_LPB04_PGR1_PLR1_SNLL1_TT08_04_VW04_WG16_16_01_WGM01
    SolutionIndex: 87
    SolutionNameMin: Cijk_Ailk_Bljk_HBH_MT64x128x32_MI32x32x4x2_SE_AF0EM2_ASEM2_GRVW2_ONLL0_SNLL0
    SolutionIndex: 88
    SolutionNameMin: Cijk_Ailk_Bljk_HBH_MT64x256x16_MI32x32x4x2_SE_AF0EM1_ASEM1_GRVW2_ONLL1_SNLL1
    SolutionIndex: 89
    SolutionIndex: 90
    SolutionIndex: 91
    SolutionIndex: 92
    SolutionIndex: 93
    SolutionIndex: 94
    SolutionIndex: 95
    SolutionIndex: 96
    SolutionIndex: 97
    SolutionIndex: 98
    SolutionIndex: 99
    SolutionIndex: 100
    SolutionIndex: 101
    SolutionIndex: 102
    SolutionIndex: 103
    SolutionIndex: 104
    SolutionIndex: 105
    SolutionIndex: 106
    SolutionIndex: 107
    SolutionIndex: 108
    SolutionIndex: 109
    SolutionIndex: 110
    SolutionIndex: 111
    SolutionIndex: 112
    SolutionIndex: 113
    SolutionIndex: 114
    SolutionIndex: 115
    SolutionIndex: 116
    SolutionIndex: 117
    SolutionIndex: 118
    SolutionIndex: 119
    SolutionIndex: 120
    SolutionIndex: 121
    SolutionIndex: 122
    SolutionIndex: 123
    SolutionIndex: 124
    SolutionIndex: 125
    SolutionIndex: 126
    SolutionIndex: 127
    SolutionIndex: 128
    SolutionIndex: 129
    SolutionIndex: 130
    SolutionIndex: 131
    SolutionIndex: 132
    SolutionIndex: 133
    SolutionIndex: 134
    SolutionIndex: 135
    SolutionIndex: 136
    SolutionIndex: 137
    SolutionIndex: 138
    SolutionIndex: 139
    SolutionIndex: 140
    SolutionNameMin: Cijk_Ailk_Bljk_HBH_MT32x64x64_MI16x16x16x1_SE_AF0EM1_GRVW8_LBSPP128_LPB8_NLCA1_SU32_SUS128_SRVW0_TT1_32_WG32_8_1_WGM1
    SolutionIndex: 141
    SolutionNameMin: Cijk_Ailk_Bljk_HBH_MT256x128x32_MI32x32x4x2_SE_AF0EM1_GRVW8_LBSPP128_LPB8_NLCA1_SU0_SUS256_SRVW4_TT2_64_WG128_2_1_WGM15
    SolutionIndex: 142
    SolutionNameMin: Cijk_Ailk_Bljk_HBH_MT32x32x128_MI16x16x16x1_SE_AF0EM1_GRVW8_LBSPP256_LPB8_NLCA1_SU16_SUS256_SRVW0_TT1_16_WG32_8_1_WGM2
    SolutionIndex: 143
    SolutionNameMin: Cijk_Ailk_Bljk_HBH_MT64x80x64_MI16x16x16x1_SE_AF0EM4_GRVW4_LBSPP128_LPB4_NLCA1_SU0_SUS256_SRVW0_TT1_80_WG64_4_1_WGM1
    SolutionIndex: 144
    SolutionNameMin: Cijk_Ailk_Bljk_HBH_MT128x96x64_MI32x32x8x1_SE_AF0EM1_GRVW8_LBSPP128_LPB8_NLCA1_SU0_SUS256_SRVW4_TT1_96_WG128_2_1_WGM15
    SolutionIndex: 145
    SolutionNameMin: Cijk_Ailk_Bljk_HBH_MT64x80x32_MI16x16x16x1_SE_AF0EM4_GRVW2_LBSPP128_LPB4_NLCA1_SU0_SUS256_SRVW4_TT1_80_WG64_4_1_WGM1
    SolutionIndex: 146
    SolutionNameMin: Cijk_Ailk_Bljk_HBH_MT128x256x32_MI32x32x4x2_SE_AF0EM1_GRVW8_LBSPP128_LPB8_NLCA1_SU32_SUS256_SRVW4_TT2_64_WG64_4_1_WGM15
    SolutionIndex: 147
    SolutionNameMin: Cijk_Ailk_Bljk_HBH_MT128x160x32_MI32x32x8x1_SE_AF0EM4_GRVW2_LBSPP128_LPB4_NLCA1_SU32_SUS256_SRVW0_TT1_160_WG128_2_1_WGM15
    SolutionIndex: 148
    SolutionNameMin: Cijk_Ailk_Bljk_HBH_MT32x64x128_MI16x16x16x1_SE_AF0EM1_GRVW2_LBSPP256_LPB4_NLCA1_SU32_SUS256_SRVW4_TT1_32_WG32_8_1_WGM15
    SolutionIndex: 149
    SolutionNameMin: Cijk_Ailk_Bljk_HBH_MT256x128x32_MI32x32x4x2_SE_AF0EM1_GRVW4_LBSPP128_LPB4_NLCA1_SU0_SUS256_SRVW4_TT2_64_WG128_2_1_WGM15
    SolutionIndex: 150
    SolutionNameMin: Cijk_Ailk_Bljk_HBH_MT64x128x32_MI32x32x4x2_SE_AF0EM4_GRVW8_LBSPP128_LPB8_NLCA1_SU0_SUS256_SRVW4_TT1_32_WG64_4_1_WGM1
    SolutionIndex: 151
    SolutionNameMin: Cijk_Ailk_Bljk_HBH_MT32x32x128_MI16x16x16x1_SE_AF0EM1_GRVW2_LBSPP256_LPB4_NLCA1_SU16_SUS256_SRVW4_TT1_16_WG32_8_1_WGM15
    SolutionIndex: 152
    SolutionNameMin: Cijk_Ailk_Bljk_HBH_MT256x128x32_MI32x32x4x2_SE_AF0EM4_GRVW8_LBSPP128_LPB8_NLCA1_SU32_SUS128_SRVW4_TT2_64_WG128_2_1_WGM2
    SolutionIndex: 153
    SolutionNameMin: Cijk_Ailk_Bljk_HBH_MT32x32x32_MI16x16x16x1_SE_AF0EM4_GRVW2_LBSPP128_LPB4_NLCA1_SU32_SUS256_SRVW0_TT1_16_WG32_8_1_WGM1
    SolutionIndex: 154
    SolutionNameMin: Cijk_Ailk_Bljk_HBH_MT128x80x32_MI16x16x16x1_SE_AF0EM4_GRVW2_LBSPP128_LPB4_NLCA1_SU16_SUS256_SRVW4_TT2_80_WG64_4_1_WGM2
    SolutionIndex: 155
    SolutionNameMin: Cijk_Ailk_Bljk_HBH_MT128x96x32_MI32x32x8x1_SE_AF0EM4_GRVW2_LBSPP128_LPB4_NLCA1_SU0_SUS256_SRVW4_TT1_96_WG128_2_1_WGM15
    SolutionIndex: 156
    SolutionNameMin: Cijk_Ailk_Bljk_HBH_MT32x64x64_MI16x16x16x1_SE_AF0EM4_GRVW8_LBSPP128_LPB8_NLCA1_SU0_SUS256_SRVW0_TT1_32_WG32_8_1_WGM2
    SolutionIndex: 157
    SolutionNameMin: Cijk_Ailk_Bljk_HBH_MT256x128x32_MI32x32x4x2_SE_AF0EM4_GRVW4_LBSPP128_LPB4_NLCA1_SU0_SUS256_SRVW4_TT2_64_WG128_2_1_WGM15
    SolutionIndex: 158
    SolutionNameMin: Cijk_Ailk_Bljk_HBH_MT128x96x32_MI32x32x8x1_SE_AF0EM4_GRVW4_LBSPP128_LPB4_NLCA1_SU16_SUS256_SRVW4_TT1_96_WG128_2_1_WGM15
    SolutionIndex: 159
    SolutionNameMin: Cijk_Ailk_Bljk_HBH_MT64x128x32_MI32x32x4x2_SE_AF0EM1_GRVW2_LBSPP128_LPB4_NLCA1_SU0_SUS256_SRVW0_TT1_32_WG64_4_1_WGM1
    SolutionIndex: 160
    SolutionNameMin: Cijk_Ailk_Bljk_HBH_MT128x256x32_MI32x32x4x2_SE_AF0EM4_GRVW4_LBSPP128_LPB4_NLCA1_SU0_SUS256_SRVW4_TT2_64_WG64_4_1_WGM1
    SolutionIndex: 161
    SolutionNameMin: Cijk_Ailk_Bljk_HBH_MT32x32x128_MI16x16x16x1_SE_AF0EM4_GRVW8_LBSPP256_LPB8_NLCA1_SU16_SUS256_SRVW4_TT1_16_WG32_8_1_WGM1
    SolutionIndex: 162
    SolutionNameMin: Cijk_Ailk_Bljk_HBH_MT64x64x32_MI32x32x8x1_SE_AF0EM4_GRVW4_LBSPP128_LPB4_NLCA1_SU0_SUS256_SRVW0_TT1_32_WG64_4_1_WGM1
    SolutionIndex: 163
    SolutionNameMin: Cijk_Ailk_Bljk_HBH_MT256x128x32_MI32x32x4x2_SE_AF0EM4_GRVW8_LBSPP128_LPB8_NLCA1_SU16_SUS128_SRVW4_TT2_64_WG128_2_1_WGM15
    SolutionIndex: 164
    SolutionNameMin: Cijk_Ailk_Bljk_HBH_MT256x128x32_MI32x32x4x2_SE_AF0EM1_GRVW4_LBSPP128_LPB4_NLCA1_SU0_SUS256_SRVW4_TT2_64_WG128_2_1_WGM2
    SolutionIndex: 165
    SolutionNameMin: Cijk_Ailk_Bljk_HBH_MT64x64x32_MI32x32x8x1_SE_AF0EM4_GRVW2_LBSPP128_LPB4_NLCA1_SU0_SUS256_SRVW0_TT1_32_WG64_4_1_WGM1
    SolutionIndex: 166
    SolutionNameMin: Cijk_Ailk_Bljk_HBH_MT256x128x32_MI32x32x4x2_SE_AF0EM1_GRVW8_LBSPP128_LPB8_NLCA1_SU0_SUS256_SRVW4_TT2_64_WG128_2_1_WGM2
    SolutionIndex: 167
    SolutionNameMin: Cijk_Ailk_Bljk_HBH_MT160x128x32_MI32x32x8x1_SE_AF0EM4_GRVW2_LBSPP128_LPB4_NLCA5_SU0_SUS256_SRVW0_TT5_32_WG32_8_1_WGM1
    SolutionIndex: 168
    SolutionNameMin: Cijk_Ailk_Bljk_HBH_MT64x64x64_MI32x32x8x1_SE_AF0EM1_GRVW2_LBSPP128_LPB4_NLCA1_SU0_SUS256_SRVW0_TT1_32_WG64_4_1_WGM1
    SolutionIndex: 169
    SolutionNameMin: Cijk_Ailk_Bljk_HBH_MT256x128x32_MI32x32x4x2_SE_AF0EM1_GRVW8_LBSPP128_LPB8_NLCA1_SU32_SUS128_SRVW4_TT2_64_WG128_2_1_WGM1
    SolutionIndex: 170
    SolutionNameMin: Cijk_Ailk_Bljk_HBH_MT256x128x32_MI32x32x4x2_SE_AF0EM4_GRVW8_LBSPP128_LPB8_NLCA1_SU16_SUS128_SRVW4_TT2_64_WG128_2_1_WGM1
    SolutionIndex: 171
    SolutionNameMin: Cijk_Ailk_Bljk_HBH_MT32x32x128_MI16x16x16x1_SE_AF0EM4_GRVW2_LBSPP256_LPB4_NLCA1_SU0_SUS256_SRVW0_TT1_16_WG32_8_1_WGM1
    SolutionIndex: 172
    SolutionNameMin: Cijk_Ailk_Bljk_HBH_MT64x128x32_MI32x32x8x1_SE_AF0EM4_GRVW4_LBSPP128_LPB4_NLCA1_SU0_SUS256_SRVW4_TT1_64_WG64_4_1_WGM2
    SolutionIndex: 173
    SolutionNameMin: Cijk_Ailk_Bljk_HBH_MT64x32x32_MI16x16x16x1_SE_AF0EM4_GRVW4_LBSPP128_LPB4_NLCA1_SU0_SUS256_SRVW0_TT2_16_WG32_8_1_WGM2
    SolutionIndex: 174
    SolutionNameMin: Cijk_Ailk_Bljk_HBH_MT32x64x64_MI16x16x16x1_SE_AF0EM4_GRVW4_LBSPP128_LPB4_NLCA1_SU16_SUS256_SRVW4_TT1_32_WG32_8_1_WGM15
    SolutionIndex: 175
    SolutionNameMin: Cijk_Ailk_Bljk_HBH_MT64x128x32_MI32x32x4x2_SE_AF0EM4_GRVW2_LBSPP128_LPB4_NLCA1_SU32_SUS128_SRVW4_TT1_32_WG64_4_1_WGM2
    SolutionIndex: 176
    SolutionNameMin: Cijk_Ailk_Bljk_HBH_MT128x96x32_MI32x32x8x1_SE_AF0EM1_GRVW4_LBSPP128_LPB4_NLCA1_SU0_SUS256_SRVW4_TT1_96_WG128_2_1_WGM15
    SolutionIndex: 177
    SolutionNameMin: Cijk_Ailk_Bljk_HBH_MT256x128x32_MI32x32x4x2_SE_AF0EM1_GRVW4_LBSPP128_LPB4_NLCA1_SU0_SUS256_SRVW0_TT2_64_WG128_2_1_WGM15
    SolutionIndex: 178
    SolutionNameMin: Cijk_Ailk_Bljk_HBH_MT64x32x128_MI16x16x16x1_SE_AF0EM4_GRVW8_LBSPP256_LPB8_NLCA1_SU32_SUS256_SRVW4_TT2_16_WG32_8_1_WGM15
    SolutionIndex: 179
    SolutionNameMin: Cijk_Ailk_Bljk_HBH_MT128x96x32_MI32x32x8x1_SE_AF0EM1_GRVW2_LBSPP128_LPB4_NLCA1_SU32_SUS128_SRVW4_TT1_96_WG128_2_1_WGM15
    SolutionIndex: 180
    SolutionNameMin: Cijk_Ailk_Bljk_HBH_MT32x32x128_MI16x16x16x1_SE_AF0EM4_GRVW8_LBSPP256_LPB8_NLCA1_SU32_SUS256_SRVW4_TT1_16_WG32_8_1_WGM2
    SolutionIndex: 181
    SolutionNameMin: Cijk_Ailk_Bljk_HBH_MT128x64x32_MI32x32x4x2_SE_AF0EM4_GRVW8_LBSPP128_LPB8_NLCA1_SU0_SUS256_SRVW4_TT1_32_WG128_2_1_WGM15
    SolutionIndex: 182
    SolutionNameMin: Cijk_Ailk_Bljk_HBH_MT128x96x64_MI32x32x8x1_SE_AF0EM1_GRVW8_LBSPP128_LPB8_NLCA1_SU0_SUS256_SRVW0_TT1_96_WG128_2_1_WGM15
    SolutionIndex: 183
    SolutionNameMin: Cijk_Ailk_Bljk_HBH_MT32x32x32_MI16x16x16x1_SE_AF0EM4_GRVW8_LBSPP128_LPB8_NLCA1_SU16_SUS128_SRVW0_TT1_16_WG32_8_1_WGM1
    SolutionIndex: 184
    SolutionNameMin: Cijk_Ailk_Bljk_HBH_MT128x96x32_MI32x32x8x1_SE_AF0EM4_GRVW2_LBSPP128_LPB4_NLCA1_SU32_SUS128_SRVW4_TT1_96_WG128_2_1_WGM2
    SolutionIndex: 185
    SolutionNameMin: Cijk_Ailk_Bljk_HBH_MT128x160x32_MI32x32x8x1_SE_AF0EM4_GRVW2_LBSPP128_LPB4_NLCA1_SU32_SUS256_SRVW4_TT1_160_WG128_2_1_WGM1
    SolutionIndex: 186
    SolutionNameMin: Cijk_Ailk_Bljk_HBH_MT32x32x128_MI16x16x16x1_SE_AF0EM4_GRVW2_LBSPP256_LPB4_NLCA1_SU0_SUS256_SRVW0_TT1_16_WG32_8_1_WGM2
    SolutionIndex: 187
    SolutionNameMin: Cijk_Ailk_Bljk_HBH_MT128x96x64_MI32x32x8x1_SE_AF0EM4_GRVW4_LBSPP128_LPB4_NLCA1_SU0_SUS256_SRVW4_TT1_96_WG128_2_1_WGM15
    SolutionIndex: 188
    SolutionNameMin: Cijk_Ailk_Bljk_HBH_MT64x32x64_MI16x16x16x1_SE_AF0EM1_ASBE01_GRVW4_LPB4_PBD0_SRVW4_TT1_32_WG64_4_1_WGM10
    SolutionIndex: 189
    SolutionNameMin: Cijk_Ailk_Bljk_HBH_MT64x64x32_MI32x32x8x1_SE_AF0EM8_ASBE01_GRVW2_LPB4_PBD0_SRVW4_TT1_32_WG64_4_1_WGM1
    SolutionIndex: 190
    SolutionNameMin: Cijk_Ailk_Bljk_HBH_MT64x32x32_MI16x16x16x1_SE_AF0EM1_ASBE01_GRVW4_LPB4_PBD0_SRVW4_TT1_32_WG128_2_1_WGM10
    SolutionIndex: 191
    SolutionNameMin: Cijk_Ailk_Bljk_HBH_MT128x64x32_MI32x32x4x2_SE_AF0EM4_ASBE01_GRVW2_LPB4_PBD0_SRVW4_TT1_32_WG128_2_1_WGM120
    SolutionIndex: 192
    SolutionNameMin: Cijk_Ailk_Bljk_HBH_MT64x128x64_MI32x32x8x1_SE_AF0EM8_ASBE01_GRVW8_LPB8_PBD0_SRVW4_TT2_32_WG32_8_1_WGM120
    SolutionIndex: 193
    SolutionNameMin: Cijk_Ailk_Bljk_HBH_MT128x64x32_MI32x32x4x2_SE_AF0EM1_ASBE01_GRVW4_LPB4_PBD0_SRVW4_TT1_32_WG128_2_1_WGM1
    SolutionIndex: 194
    SolutionNameMin: Cijk_Ailk_Bljk_HBH_MT64x128x32_MI32x32x8x1_SE_AF0EM8_ASBE01_GRVW8_LPB8_PBD0_SRVW4_TT2_32_WG32_8_1_WGM1
    SolutionIndex: 195
    SolutionNameMin: Cijk_Ailk_Bljk_HBH_MT128x64x32_MI16x16x16x1_SE_AF0EM8_ASBE01_GRVW8_LPB8_PBD0_SRVW4_TT2_64_WG64_4_1_WGM1
    SolutionIndex: 196
    SolutionNameMin: Cijk_Ailk_Bljk_HBH_MT128x64x32_MI32x32x8x1_SE_AF0EM1_ASBE01_GRVW2_LPB4_PBD0_SRVW4_TT2_32_WG64_4_1_WGM10
    SolutionIndex: 197
    SolutionNameMin: Cijk_Ailk_Bljk_HBH_MT64x64x32_MI32x32x8x1_SE_AF0EM8_ASBE01_GRVW8_LPB8_PBD0_SRVW4_TT1_32_WG64_4_1_WGM10
    SolutionIndex: 198
    SolutionNameMin: Cijk_Ailk_Bljk_HBH_MT64x128x32_MI32x32x8x1_SE_AF0EM1_ASBE01_GRVW2_LPB4_PBD0_SRVW4_TT2_32_WG32_8_1_WGM1
    SolutionIndex: 199
    SolutionNameMin: Cijk_Ailk_Bljk_HBH_MT256x128x32_MI32x32x4x2_SE_AF0EM8_ASBE01_GRVW8_LPB8_PBD0_SRVW4_TT2_64_WG128_2_1_WGM10
    SolutionIndex: 200
    SolutionNameMin: Cijk_Ailk_Bljk_HBH_MT64x128x32_MI32x32x4x2_SE_AF0EM4_ASBE01_GRVW2_LPB4_PBD0_SRVW4_TT1_32_WG64_4_1_WGM1
    SolutionIndex: 201
    SolutionNameMin: Cijk_Ailk_Bljk_HBH_MT64x128x32_MI32x32x4x2_SE_AF0EM1_ASBE01_GRVW2_LPB4_PBD0_SRVW4_TT1_32_WG64_4_1_WGM1
    SolutionIndex: 202
    SolutionNameMin: Cijk_Ailk_Bljk_HBH_MT64x128x32_MI32x32x4x2_SE_AF0EM4_ASBE01_GRVW2_LPB4_PBD0_SRVW4_TT1_32_WG64_4_1_WGM10
    SolutionIndex: 203
    SolutionNameMin: Cijk_Ailk_Bljk_HBH_MT256x128x32_MI32x32x4x2_SE_AF0EM4_ASBE01_GRVW4_LPB4_PBD0_SRVW0_TT2_64_WG128_2_1_WGM10
    SolutionIndex: 204
    SolutionNameMin: Cijk_Ailk_Bljk_HBH_MT64x64x32_MI32x32x8x1_SE_AF0EM1_ASBE01_GRVW2_LPB4_PBD0_SRVW4_TT1_32_WG64_4_1_WGM120
    SolutionIndex: 205
    SolutionNameMin: Cijk_Ailk_Bljk_HBH_MT128x64x32_MI32x32x8x1_SE_AF0EM8_ASBE01_GRVW8_LPB8_PBD0_SRVW4_TT2_32_WG64_4_1_WGM1
    SolutionIndex: 206
    SolutionNameMin: Cijk_Ailk_Bljk_HBH_MT256x128x32_MI32x32x4x2_SE_AF0EM4_ASBE01_GRVW4_LPB4_PBD0_SRVW4_TT2_64_WG128_2_1_WGM10
    SolutionIndex: 207
    SolutionNameMin: Cijk_Ailk_Bljk_HBH_MT256x256x32_MI32x32x8x1_SE_GRVW8_GSU1_PLR5_SU0_SUS256_SRVW4_VAW2_WGM2
    SolutionIndex: 208
    SolutionNameMin: Cijk_Ailk_Bljk_HBH_MT128x256x32_MI32x32x8x1_SE_GRVW8_GSU1_PLR5_SU0_SUS256_SRVW4_VAW2_WGM1
    SolutionIndex: 209
    SolutionNameMin: Cijk_Ailk_Bljk_HBH_MT128x256x32_MI32x32x8x1_SE_GRVW8_GSU1_PLR5_SU0_SUS256_SRVW4_VAW2_WGM2
    SolutionIndex: 210
    SolutionNameMin: Cijk_Ailk_Bljk_HBH_MT64x128x64_MI32x32x8x1_SE_GRVW8_GSU1_PLR9_SU32_SUS256_SRVW4_VAW2_WGM1
    SolutionIndex: 211
    SolutionNameMin: Cijk_Ailk_Bljk_HBH_MT32x64x64_MI16x16x16x1_SE_GRVW8_GSU1_PLR5_SU32_SUS128_SRVW4_VAW2_WGM1
    SolutionIndex: 212
    SolutionNameMin: Cijk_Ailk_Bljk_HBH_MT256x128x32_MI32x32x8x1_SE_GRVW8_GSU1_PLR5_SU0_SUS256_SRVW4_VAW2_WGM15
    SolutionIndex: 213
    SolutionNameMin: Cijk_Ailk_Bljk_HBH_MT128x96x64_MI32x32x8x1_SE_GRVW8_GSU1_PLR9_SU32_SUS128_SRVW4_VAW2_WGM2
    SolutionIndex: 214
    SolutionNameMin: Cijk_Ailk_Bljk_HBH_MT64x64x64_MI32x32x8x1_SE_GRVW8_GSU1_PLR9_SU0_SUS256_SRVW4_VAW2_WGM1
    SolutionIndex: 215
    SolutionNameMin: Cijk_Ailk_Bljk_HBH_MT256x160x32_MI32x32x8x1_SE_GRVW4_GSU1_PLR5_SU0_SUS256_SRVW4_VAW2_WGM1
    SolutionIndex: 216
    SolutionNameMin: Cijk_Ailk_Bljk_HBH_MT128x288x32_MI32x32x8x1_SE_GRVW4_GSU1_PLR5_SU0_SUS256_SRVW4_VAW2_WGM1
    SolutionIndex: 217
    SolutionNameMin: Cijk_Ailk_Bljk_HBH_MT64x128x64_MI32x32x8x1_SE_GRVW8_GSU1_PLR9_SU0_SUS256_SRVW4_VAW2_WGM1
    SolutionIndex: 218
    SolutionNameMin: Cijk_Ailk_Bljk_HBH_MT32x32x32_MI16x16x16x1_SE_GRVW2_GSU1_PLR2_SU0_SUS256_SRVW4_VAW2_WGM1
    SolutionIndex: 219
    SolutionNameMin: Cijk_Ailk_Bljk_HBH_MT32x32x64_MI16x16x16x1_SE_GRVW8_GSU1_PLR5_SU0_SUS256_SRVW4_VAW2_WGM1
    SolutionIndex: 220
    SolutionNameMin: Cijk_Ailk_Bljk_HBH_MT32x32x64_MI16x16x16x1_SE_GRVW4_GSU1_PLR5_SU32_SUS128_SRVW4_VAW2_WGM1
    SolutionIndex: 221
    SolutionNameMin: Cijk_Ailk_Bljk_HBH_MT64x64x32_MI32x32x8x1_SE_GRVW2_GSU1_PLR5_SU0_SUS256_SRVW4_VAW2_WGM1
    SolutionIndex: 222
    SolutionNameMin: Cijk_Ailk_Bljk_HBH_MT64x128x64_MI32x32x8x1_SE_GRVW8_GSU1_PLR9_SU32_SUS128_SRVW4_VAW2_WGM2
    SolutionIndex: 223
    SolutionNameMin: Cijk_Ailk_Bljk_HBH_MT64x128x64_MI32x32x8x1_SE_GRVW8_GSU1_PLR9_SU32_SUS128_SRVW4_VAW2_WGM15
    SolutionIndex: 224
    SolutionNameMin: Cijk_Ailk_Bljk_HBH_MT128x128x32_MI32x32x8x1_SE_GRVW2_GSU1_PLR5_SU0_SUS256_SRVW4_VAW2_WGM1
    SolutionIndex: 225
    SolutionNameMin: Cijk_Ailk_Bljk_HBH_MT256x160x32_MI32x32x8x1_SE_GRVW4_GSU1_PLR5_SU0_SUS256_SRVW4_VAW2_WGM15
    SolutionIndex: 226
    SolutionNameMin: Cijk_Ailk_Bljk_HBH_MT160x160x64_MI16x16x16x1_SE_GRVW8_GSU1_PLR5_SU0_SUS256_SRVW0_VAW2_WGM2
    SolutionIndex: 227
    SolutionNameMin: Cijk_Ailk_Bljk_HBH_MT64x128x32_MI32x32x8x1_SE_GRVW8_GSU1_PLR5_SU0_SUS256_SRVW4_VAW2_WGM15
    SolutionIndex: 228
    SolutionNameMin: Cijk_Ailk_Bljk_HBH_MT64x128x32_MI32x32x8x1_SE_GRVW2_GSU1_PLR5_SU0_SUS256_SRVW4_VAW2_WGM1
    SolutionIndex: 229
    SolutionNameMin: Cijk_Ailk_Bljk_HBH_MT32x32x32_MI16x16x16x1_SE_GRVW4_GSU1_PLR2_SU0_SUS256_SRVW4_VAW2_WGM1
    SolutionIndex: 230
    SolutionNameMin: Cijk_Ailk_Bljk_HBH_MT32x32x64_MI16x16x16x1_SE_GRVW8_GSU1_PLR5_SU0_SUS256_SRVW4_VAW2_WGM15
    SolutionIndex: 231
    SolutionNameMin: Cijk_Ailk_Bljk_HBH_MT32x64x64_MI16x16x16x1_SE_GRVW8_GSU1_PLR5_SU32_SUS128_SRVW4_VAW2_WGM2
    SolutionIndex: 232
    SolutionNameMin: Cijk_Ailk_Bljk_HBH_MT64x64x64_MI32x32x8x1_SE_GRVW8_GSU1_PLR9_SU32_SUS128_SRVW4_VAW2_WGM1
    SolutionIndex: 233
    SolutionNameMin: Cijk_Ailk_Bljk_HBH_MT128x64x32_MI32x32x8x1_SE_GRVW4_GSU1_PLR5_SU0_SUS256_SRVW4_VAW2_WGM1
    SolutionIndex: 234
    SolutionNameMin: Cijk_Ailk_Bljk_HBH_MT128x96x64_MI32x32x8x1_SE_GRVW8_GSU1_PLR9_SU0_SUS256_SRVW4_VAW2_WGM15
    SolutionIndex: 235
    SolutionNameMin: Cijk_Ailk_Bljk_HBH_MT128x96x64_MI32x32x8x1_SE_GRVW8_GSU1_PLR9_SU32_SUS128_SRVW4_VAW2_WGM15
    SolutionIndex: 236
    SolutionNameMin: Cijk_Ailk_Bljk_HBH_MT128x96x64_MI32x32x8x1_SE_GRVW2_GSU1_PLR9_SU0_SUS256_SRVW4_VAW2_WGM2
    SolutionIndex: 237
    SolutionNameMin: Cijk_Ailk_Bljk_HBH_MT128x128x64_MI32x32x8x1_SE_GRVW2_GSU1_PLR9_SU32_SUS256_SRVW4_VAW2_WGM2
    SolutionIndex: 238
    SolutionNameMin: Cijk_Ailk_Bljk_HBH_MT32x32x32_MI16x16x16x1_SE_GRVW8_GSU1_PLR2_SU0_SUS256_SRVW4_VAW2_WGM1
    SolutionIndex: 239
    SolutionNameMin: Cijk_Ailk_Bljk_HBH_MT32x32x64_MI16x16x16x1_SE_GRVW8_GSU1_PLR5_SU32_SUS128_SRVW4_VAW2_WGM1
    SolutionIndex: 240
    SolutionNameMin: Cijk_Ailk_Bljk_HBH_MT160x160x64_MI16x16x16x1_SE_GRVW8_GSU1_PLR5_SU0_SUS256_SRVW0_VAW2_WGM15
    SolutionIndex: 241
    SolutionNameMin: Cijk_Ailk_Bljk_HBH_MT64x64x64_MI32x32x8x1_SE_GRVW8_GSU1_PLR9_SU32_SUS256_SRVW4_VAW2_WGM1
    SolutionIndex: 242
    SolutionNameMin: Cijk_Ailk_Bljk_HBH_MT128x96x32_MI32x32x8x1_SE_GRVW4_GSU1_PLR5_SU32_SUS128_SRVW4_VAW2_WGM1
    SolutionIndex: 243
    SolutionNameMin: Cijk_Ailk_Bljk_HBH_MT128x160x64_MI32x32x8x1_SE_GRVW2_GSU1_PLR9_SU0_SUS256_SRVW4_VAW2_WGM2
    SolutionIndex: 244
    SolutionNameMin: Cijk_Ailk_Bljk_HBH_MT128x160x64_MI32x32x8x1_SE_GRVW2_GSU1_PLR9_SU0_SUS256_SRVW4_VAW2_WGM15
    SolutionIndex: 245
    SolutionNameMin: Cijk_Ailk_Bljk_HBH_MT256x160x32_MI32x32x8x1_SE_GRVW4_GSU1_PLR5_SU0_SUS256_SRVW4_VAW2_WGM2
    SolutionIndex: 246
    SolutionNameMin: Cijk_Ailk_Bljk_HBH_MT256x144x64_MI16x16x16x1_SE_GRVW4_GSU5_PLR5_SU0_SUS256_SRVW0_VAW1_WGM1
    SolutionIndex: 247
    SolutionNameMin: Cijk_Ailk_Bljk_HBH_MT128x96x64_MI32x32x8x1_SE_GRVW2_GSU1_PLR9_SU0_SUS256_SRVW4_VAW2_WGM15
    SolutionIndex: 248
    SolutionNameMin: Cijk_Ailk_Bljk_HBH_MT160x160x64_MI16x16x16x1_SE_GRVW8_GSU1_PLR5_SU32_SUS128_SRVW0_VAW2_WGM1
    SolutionIndex: 249
    SolutionNameMin: Cijk_Ailk_Bljk_HBH_MT128x128x32_MI32x32x8x1_SE_GRVW2_GSU1_PLR5_SU32_SUS256_SRVW4_VAW2_WGM2
    SolutionIndex: 250
    SolutionNameMin: Cijk_Ailk_Bljk_HBH_MT128x256x32_MI32x32x8x1_SE_GRVW8_GSU1_PLR5_SU32_SUS256_SRVW4_VAW2_WGM2
    SolutionIndex: 251
    SolutionNameMin: Cijk_Ailk_Bljk_HBH_MT64x64x64_MI32x32x8x1_SE_GRVW8_GSU1_PLR9_SU32_SUS256_SRVW4_VAW2_WGM15
    SolutionIndex: 252
    SolutionNameMin: Cijk_Ailk_Bljk_HBH_MT128x96x32_MI32x32x8x1_SE_GRVW4_GSU1_PLR5_SU0_SUS256_SRVW4_VAW2_WGM15
    SolutionIndex: 253
    SolutionNameMin: Cijk_Ailk_Bljk_HBH_MT32x32x64_MI16x16x16x1_SE_GRVW8_GSU1_PLR5_SU0_SUS256_SRVW4_VAW2_WGM2
    SolutionIndex: 254
    SolutionNameMin: Cijk_Ailk_Bljk_HBH_MT256x128x32_MI32x32x8x1_SE_GRVW8_GSU1_PLR5_SU0_SUS256_SRVW4_VAW2_WGM1
    SolutionIndex: 255
    SolutionNameMin: Cijk_Ailk_Bljk_HBH_MT256x128x32_MI32x32x8x1_SE_GRVW8_GSU1_PLR5_SU0_SUS256_SRVW4_VAW2_WGM15
    SolutionIndex: 256
    SolutionNameMin: Cijk_Ailk_Bljk_HBH_MT128x96x64_MI32x32x8x1_SE_GRVW2_GSU7_PLR9_SU0_SUS256_SRVW0_VAW1_WGM1
    SolutionIndex: 257
    SolutionNameMin: Cijk_Ailk_Bljk_HBH_MT128x96x32_MI32x32x8x1_SE_GRVW4_GSU1_PLR5_SU0_SUS256_SRVW4_VAW2_WGM1
    SolutionIndex: 258
    SolutionNameMin: Cijk_Ailk_Bljk_HBH_MT128x128x32_MI32x32x8x1_SE_GRVW2_GSU1_PLR5_SU0_SUS256_SRVW4_VAW2_WGM15
    SolutionIndex: 259
    SolutionNameMin: Cijk_Ailk_Bljk_HBH_MT64x32x32_MI16x16x16x1_SE_GRVW2_GSU1_PLR2_SU0_SUS256_SRVW4_VAW2_WGM1
    SolutionIndex: 260
    SolutionNameMin: Cijk_Ailk_Bljk_HBH_MT256x160x32_MI32x32x8x1_SE_GRVW2_GSU1_PLR5_SU0_SUS256_SRVW4_VAW2_WGM15
    SolutionIndex: 261
    SolutionNameMin: Cijk_Ailk_Bljk_HBH_MT128x256x32_MI32x32x8x1_SE_GRVW8_GSU1_PLR5_SU0_SUS256_SRVW4_VAW2_WGM15
    SolutionIndex: 262
    SolutionNameMin: Cijk_Ailk_Bljk_HBH_MT256x128x32_MI32x32x8x1_SE_GRVW4_GSU1_PLR5_SU0_SUS256_SRVW4_VAW2_WGM15
    SolutionIndex: 263
    SolutionNameMin: Cijk_Ailk_Bljk_HBH_MT256x256x32_MI32x32x8x1_SE_GRVW8_GSU1_PLR5_SU32_SUS256_SRVW4_VAW2_WGM2
    SolutionIndex: 264
    SolutionNameMin: Cijk_Ailk_Bljk_HBH_MT256x256x32_MI32x32x8x1_SE_GRVW2_GSU1_PLR5_SU32_SUS128_SRVW4_VAW2_WGM2
    SolutionIndex: 265
    SolutionNameMin: Cijk_Ailk_Bljk_HBH_MT256x256x32_MI32x32x8x1_SE_GRVW8_GSU1_PLR5_SU0_SUS256_SRVW4_VAW2_WGM1
    SolutionIndex: 266
    SolutionNameMin: Cijk_Ailk_Bljk_HBH_MT256x256x32_MI32x32x8x1_SE_GRVW2_GSU1_PLR5_SU32_SUS128_SRVW4_VAW2_WGM15
    SolutionIndex: 267
    SolutionNameMin: Cijk_Ailk_Bljk_HBH_MT256x160x32_MI32x32x8x1_SE_GRVW4_GSU1_PLR5_SU32_SUS256_SRVW4_VAW2_WGM15
    SolutionIndex: 268
    SolutionNameMin: Cijk_Ailk_Bljk_HBH_MT64x32x32_MI16x16x16x1_SE_GRVW2_GSU1_PLR2_SU0_SUS256_SRVW4_VAW2_WGM2
    SolutionIndex: 269
    SolutionNameMin: Cijk_Ailk_Bljk_HBH_MT64x32x32_MI16x16x16x1_SE_GRVW2_GSU1_PLR2_SU0_SUS256_SRVW4_VAW2_WGM15
    SolutionIndex: 270
    SolutionNameMin: Cijk_Ailk_Bljk_HBH_MT64x32x32_MI16x16x16x1_SE_GRVW2_GSU1_PLR2_SU32_SUS128_SRVW4_VAW2_WGM1
    SolutionIndex: 271
    SolutionNameMin: Cijk_Ailk_Bljk_HBH_MT32x64x32_MI16x16x16x1_SE_GRVW2_GSU1_PLR2_SU32_SUS128_SRVW4_VAW2_WGM2
    SolutionIndex: 272
    SolutionNameMin: Cijk_Ailk_Bljk_HBH_MT32x64x32_MI16x16x16x1_SE_GRVW2_GSU1_PLR2_SU0_SUS256_SRVW4_VAW2_WGM1
    SolutionIndex: 273
    SolutionNameMin: Cijk_Ailk_Bljk_HBH_MT32x64x32_MI16x16x16x1_SE_GRVW4_GSU1_PLR2_SU0_SUS256_SRVW4_VAW2_WGM1
    SolutionIndex: 274
    SolutionNameMin: Cijk_Ailk_Bljk_HBH_MT64x32x64_MI16x16x16x1_SE_GRVW8_GSU1_PLR5_SU0_SUS256_SRVW4_VAW2_WGM2
    SolutionIndex: 275
    SolutionNameMin: Cijk_Ailk_Bljk_HBH_MT32x32x64_MI16x16x16x1_SE_GRVW2_GSU1_PLR5_SU32_SUS128_SRVW4_VAW2_WGM1
    SolutionIndex: 276
    SolutionNameMin: Cijk_Ailk_Bljk_HBH_MT64x64x32_MI32x32x8x1_SE_GRVW8_GSU1_PLR5_SU0_SUS256_SRVW4_VAW2_WGM15
    SolutionIndex: 277
    SolutionNameMin: Cijk_Ailk_Bljk_HBH_MT128x96x64_MI32x32x8x1_SE_GRVW8_GSU1_PLR9_SU32_SUS128_SRVW4_VAW2_WGM1
    SolutionIndex: 278
    SolutionNameMin: Cijk_Ailk_Bljk_HBH_MT32x32x32_MI16x16x16x1_SE_GRVW4_GSU1_PLR2_SU0_SUS256_SRVW4_VAW2_WGM2
    SolutionIndex: 279
    SolutionNameMin: Cijk_Ailk_Bljk_HBH_MT96x128x64_MI32x32x8x1_SE_GRVW8_GSU1_PLR9_SU32_SUS256_SRVW0_VAW2_WGM1
    SolutionIndex: 280
    SolutionNameMin: Cijk_Ailk_Bljk_HBH_MT64x64x32_MI32x32x8x1_SE_GRVW8_GSU1_PLR5_SU0_SUS256_SRVW4_VAW2_WGM1
    SolutionIndex: 281
    SolutionNameMin: Cijk_Ailk_Bljk_HBH_MT128x160x64_MI32x32x8x1_SE_GRVW2_GSU1_PLR9_SU32_SUS128_SRVW4_VAW2_WGM15
    SolutionIndex: 282
    SolutionNameMin: Cijk_Ailk_Bljk_HBH_MT128x160x64_MI32x32x8x1_SE_GRVW2_GSU1_PLR9_SU32_SUS128_SRVW4_VAW2_WGM2
    SolutionIndex: 283
    SolutionNameMin: Cijk_Ailk_Bljk_HBH_MT128x160x64_MI32x32x8x1_SE_GRVW2_GSU1_PLR9_SU32_SUS256_SRVW4_VAW2_WGM2
    SolutionIndex: 284
    SolutionNameMin: Cijk_Ailk_Bljk_HBH_MT256x160x32_MI32x32x8x1_SE_GRVW4_GSU2_PLR5_SU0_SUS256_SRVW0_VAW1_WGM1
    SolutionIndex: 285
    SolutionNameMin: Cijk_Ailk_Bljk_HBH_MT256x160x32_MI32x32x8x1_SE_GRVW4_GSU2_PLR5_SU32_SUS256_SRVW0_VAW1_WGM2
    SolutionIndex: 286
    SolutionNameMin: Cijk_Ailk_Bljk_HBH_MT32x64x64_MI16x16x16x1_SE_GRVW8_GSU1_PLR5_SU0_SUS256_SRVW4_VAW2_WGM1
    SolutionIndex: 287
    SolutionNameMin: Cijk_Ailk_Bljk_HBH_MT64x32x64_MI16x16x16x1_SE_GRVW8_GSU7_PLR5_SU0_SUS256_SRVW0_VAW1_WGM1
    SolutionIndex: 288
    SolutionNameMin: Cijk_Ailk_Bljk_HBH_MT64x64x32_MI32x32x8x1_SE_GRVW4_GSU1_PLR5_SU0_SUS256_SRVW4_VAW2_WGM1
    SolutionIndex: 289
    SolutionNameMin: Cijk_Ailk_Bljk_HBH_MT64x64x32_MI32x32x8x1_SE_GRVW2_GSU1_PLR5_SU0_SUS256_SRVW4_VAW2_WGM2
    SolutionIndex: 290
    SolutionNameMin: Cijk_Ailk_Bljk_HBH_MT128x64x32_MI32x32x8x1_SE_GRVW2_GSU1_PLR5_SU0_SUS256_SRVW4_VAW2_WGM1
    SolutionIndex: 291
    SolutionNameMin: Cijk_Ailk_Bljk_HBH_MT128x128x32_MI32x32x8x1_SE_GRVW4_GSU1_PLR5_SU32_SUS256_SRVW4_VAW2_WGM15
    SolutionIndex: 292
    SolutionNameMin: Cijk_Ailk_Bljk_HBH_MT128x160x32_MI32x32x8x1_SE_GRVW4_GSU1_PLR5_SU32_SUS128_SRVW4_VAW2_WGM2
    SolutionIndex: 293
    SolutionNameMin: Cijk_Ailk_Bljk_HBH_MT128x288x32_MI32x32x8x1_SE_GRVW4_GSU1_PLR5_SU32_SUS128_SRVW4_VAW2_WGM2
    SolutionIndex: 294
    SolutionNameMin: Cijk_Ailk_Bljk_HBH_MT128x128x32_MI32x32x8x1_SE_GRVW2_GSU1_PLR5_SU32_SUS128_SRVW4_VAW2_WGM15
    SolutionIndex: 295
    SolutionNameMin: Cijk_Ailk_Bljk_HBH_MT128x160x32_MI32x32x8x1_SE_GRVW2_GSU1_PLR5_SU32_SUS256_SRVW4_VAW2_WGM15
    SolutionIndex: 296
    SolutionNameMin: Cijk_Ailk_Bljk_HBH_MT128x256x32_MI32x32x8x1_SE_GRVW8_GSU1_PLR5_SU32_SUS128_SRVW4_VAW2_WGM15
    SolutionIndex: 297
    SolutionNameMin: Cijk_Ailk_Bljk_HBH_MT128x256x32_MI32x32x8x1_SE_GRVW8_GSU1_PLR5_SU32_SUS128_SRVW4_VAW2_WGM2
    SolutionIndex: 298
    SolutionNameMin: Cijk_Ailk_Bljk_HBH_MT64x128x64_MI32x32x8x1_SE_GRVW8_GSU1_PLR9_SU32_SUS256_SRVW4_VAW2_WGM2
    SolutionIndex: 299
    SolutionNameMin: Cijk_Ailk_Bljk_HBH_MT128x160x32_MI32x32x8x1_SE_GRVW4_GSU1_PLR5_SU0_SUS256_SRVW4_VAW2_WGM1
    SolutionIndex: 300
    SolutionNameMin: Cijk_Ailk_Bljk_HBH_MT128x96x32_MI32x32x8x1_SE_GRVW2_GSU1_PLR5_SU32_SUS256_SRVW4_VAW2_WGM15
    SolutionIndex: 301
    SolutionNameMin: Cijk_Ailk_Bljk_HBH_MT128x160x64_MI32x32x8x1_SE_GRVW2_GSU1_PLR9_SU0_SUS256_SRVW4_VAW2_WGM1
    SolutionIndex: 302
    SolutionNameMin: Cijk_Ailk_Bljk_HBH_MT256x160x32_MI32x32x8x1_SE_GRVW4_GSU1_PLR5_SU32_SUS128_SRVW4_VAW2_WGM1
    SolutionIndex: 303
    SolutionNameMin: Cijk_Ailk_Bljk_HBH_MT64x128x64_MI32x32x8x1_SE_GRVW8_GSU1_PLR9_SU32_SUS128_SRVW4_VAW2_WGM1
    SolutionIndex: 304
    SolutionNameMin: Cijk_Ailk_Bljk_HBH_MT256x160x32_MI32x32x8x1_SE_GRVW4_GSU1_PLR5_SU32_SUS128_SRVW4_VAW2_WGM2
    SolutionIndex: 305
    SolutionNameMin: Cijk_Ailk_Bljk_HBH_MT128x96x64_MI32x32x8x1_SE_GRVW2_GSU1_PLR9_SU32_SUS256_SRVW4_VAW2_WGM2
    SolutionIndex: 306
    SolutionNameMin: Cijk_Ailk_Bljk_HBH_MT128x96x64_MI32x32x8x1_SE_GRVW8_GSU1_PLR9_SU0_SUS256_SRVW4_VAW2_WGM1
    SolutionIndex: 307
    SolutionNameMin: Cijk_Ailk_Bljk_HBH_MT256x128x32_MI32x32x8x1_SE_GRVW8_GSU1_PLR5_SU0_SUS256_SRVW4_VAW2_WGM2
    SolutionIndex: 308
    SolutionNameMin: Cijk_Ailk_Bljk_HBH_MT256x256x32_MI32x32x8x1_SE_GRVW2_GSU1_PLR5_SU0_SUS256_SRVW4_VAW2_WGM2
    SolutionIndex: 309
    SolutionNameMin: Cijk_Ailk_Bljk_HBH_MT128x96x64_MI32x32x8x1_SE_GRVW2_GSU1_PLR9_SU32_SUS128_SRVW4_VAW2_WGM2
    SolutionIndex: 310
    SolutionNameMin: Cijk_Ailk_Bljk_HBH_MT256x160x32_MI32x32x8x1_SE_GRVW4_GSU1_PLR5_SU32_SUS128_SRVW4_VAW2_WGM15
    SolutionIndex: 311
    SolutionNameMin: Cijk_Ailk_Bljk_HBH_MT128x256x32_MI32x32x8x1_SE_GRVW2_GSU1_PLR5_SU0_SUS256_SRVW4_VAW2_WGM15
    SolutionIndex: 312
    SolutionNameMin: Cijk_Ailk_Bljk_HBH_MT64x256x64_MI32x32x8x1_SE_GRVW2_GSU1_PLR9_SU32_SUS128_SRVW4_VAW2_WGM2
    SolutionIndex: 313
    SolutionNameMin: Cijk_Ailk_Bljk_HBH_MT128x128x32_MI32x32x8x1_SE_GRVW2_GSU1_PLR5_SU32_SUS256_SRVW4_VAW2_WGM15
    SolutionIndex: 314
    SolutionNameMin: Cijk_Ailk_Bljk_HBH_MT64x128x64_MI32x32x8x1_SE_GRVW8_GSU1_PLR9_SU0_SUS256_SRVW4_VAW2_WGM15
    SolutionIndex: 315
    SolutionNameMin: Cijk_Ailk_Bljk_HBH_MT32x32x32_MI16x16x16x1_SE_GRVW4_GSU1_PLR2_SU0_SUS256_SRVW4_VAW2_WGM15
    SolutionIndex: 316
    SolutionNameMin: Cijk_Ailk_Bljk_HBH_MT128x256x32_MI32x32x8x1_SE_GRVW8_GSU1_PLR5_SU0_SUS256_SRVW4_VAW2_WGM2
    SolutionIndex: 317
    SolutionNameMin: Cijk_Ailk_Bljk_HBH_MT64x128x64_MI32x32x8x1_SE_GRVW8_GSU1_PLR9_SU32_SUS256_SRVW4_VAW2_WGM15
    SolutionIndex: 318
    SolutionNameMin: Cijk_Ailk_Bljk_HBH_MT64x128x32_MI32x32x8x1_SE_GRVW8_GSU1_PLR5_SU0_SUS256_SRVW4_VAW2_WGM1
    SolutionIndex: 319
    SolutionNameMin: Cijk_Ailk_Bljk_HBH_MT64x32x64_MI16x16x16x1_SE_GRVW8_GSU1_PLR5_SU0_SUS256_SRVW4_VAW2_WGM1
    SolutionIndex: 320
    SolutionNameMin: Cijk_Ailk_Bljk_HBH_MT128x128x64_MI32x32x8x1_SE_GRVW2_GSU1_PLR9_SU32_SUS256_SRVW4_VAW2_WGM1
    SolutionIndex: 321
    SolutionNameMin: Cijk_Ailk_Bljk_HBH_MT64x64x64_MI32x32x8x1_SE_GRVW2_GSU1_PLR9_SU0_SUS256_SRVW4_VAW2_WGM1
    SolutionIndex: 322
    SolutionNameMin: Cijk_Ailk_Bljk_HBH_MT128x128x64_MI32x32x8x1_SE_GRVW2_GSU1_PLR9_SU0_SUS256_SRVW4_VAW2_WGM15
    SolutionIndex: 323
    SolutionNameMin: Cijk_Ailk_Bljk_HBH_MT64x64x64_MI32x32x8x1_SE_GRVW8_GSU1_PLR9_SU0_SUS256_SRVW4_VAW2_WGM15
    SolutionIndex: 324
    SolutionNameMin: Cijk_Ailk_Bljk_HBH_MT256x128x32_MI32x32x8x1_SE_GRVW8_GSU3_PLR5_SU0_SUS256_SRVW0_VAW1_WGM2
    SolutionIndex: 325
    SolutionNameMin: Cijk_Ailk_Bljk_HBH_MT64x32x32_MI16x16x16x1_SE_GRVW2_GSU1_PLR2_SU32_SUS128_SRVW4_VAW2_WGM2
    SolutionIndex: 326
    SolutionNameMin: Cijk_Ailk_Bljk_HBH_MT128x128x32_MI32x32x8x1_SE_GRVW2_GSU1_PLR5_SU32_SUS128_SRVW4_VAW2_WGM1
    SolutionIndex: 327
    SolutionNameMin: Cijk_Ailk_Bljk_HBH_MT128x128x64_MI32x32x8x1_SE_GRVW2_GSU7_PLR9_SU0_SUS256_SRVW0_VAW1_WGM15
    SolutionIndex: 328
    SolutionNameMin: Cijk_Ailk_Bljk_HBH_MT256x256x32_MI32x32x8x1_SE_GRVW8_GSU1_PLR5_SU32_SUS256_SRVW4_VAW2_WGM1
    SolutionIndex: 329
    SolutionNameMin: Cijk_Ailk_Bljk_HBH_MT64x128x32_MI32x32x8x1_SE_GRVW8_GSU1_PLR5_SU0_SUS256_SRVW4_VAW2_WGM2
    SolutionIndex: 330
    SolutionNameMin: Cijk_Ailk_Bljk_HBH_MT128x256x32_MI32x32x8x1_SE_GRVW8_GSU1_PLR5_SU0_SUS256_SRVW4_VAW2_WGM15
    SolutionIndex: 331
    SolutionNameMin: Cijk_Ailk_Bljk_HBH_MT128x96x32_MI32x32x8x1_SE_1LDSB1_GRVW2_NLCA1_PLR5_SU0_SUS256_SRVW4_TT1_96_WG128_2_1_WGM1
    SolutionIndex: 332
    SolutionNameMin: Cijk_Ailk_Bljk_HBH_MT128x96x32_MI32x32x8x1_SE_1LDSB1_GRVW2_NLCA1_PLR5_SU32_SUS128_SRVW4_TT1_96_WG128_2_1_WGM1
    SolutionIndex: 333
    SolutionNameMin: Cijk_Ailk_Bljk_HBH_MT128x128x32_MI32x32x8x1_SE_1LDSB1_GRVW2_NLCA1_PLR5_SU0_SUS256_SRVW4_TT2_64_WG64_4_1_WGM1
    SolutionIndex: 334
    SolutionNameMin: Cijk_Ailk_Bljk_HBH_MT128x256x32_MI32x32x8x1_SE_1LDSB1_GRVW8_NLCA1_PLR5_SU0_SUS256_SRVW4_TT2_128_WG64_4_1_WGM1
    SolutionIndex: 335
    SolutionNameMin: Cijk_Ailk_Bljk_HBH_MT128x256x32_MI32x32x8x1_SE_1LDSB1_GRVW8_NLCA1_PLR5_SU0_SUS256_SRVW4_TT2_128_WG64_4_1_WGM15
    SolutionIndex: 336
    SolutionNameMin: Cijk_Ailk_Bljk_HBH_MT128x128x32_MI32x32x8x1_SE_1LDSB1_GRVW2_NLCA1_PLR5_SU32_SUS128_SRVW4_TT2_64_WG64_4_1_WGM1
    SolutionIndex: 337
    SolutionNameMin: Cijk_Ailk_Bljk_HBH_MT64x32x32_MI16x16x16x1_SE_1LDSB1_GRVW2_NLCA1_PLR2_SU0_SUS256_SRVW4_TT2_16_WG32_8_1_WGM1
    SolutionIndex: 338
    SolutionNameMin: Cijk_Ailk_Bljk_HBH_MT128x128x32_MI32x32x8x1_SE_1LDSB1_GRVW2_NLCA1_PLR5_SU32_SUS256_SRVW4_TT2_64_WG64_4_1_WGM2
    SolutionIndex: 339
    SolutionNameMin: Cijk_Ailk_Bljk_HBH_MT64x64x32_MI32x32x8x1_SE_1LDSB0_GRVW8_NLCA1_PLR5_SU0_SUS256_SRVW4_TT1_32_WG64_4_1_WGM1
    SolutionIndex: 340
    SolutionNameMin: Cijk_Ailk_Bljk_HBH_MT64x128x64_MI32x32x8x1_SE_1LDSB0_GRVW8_NLCA1_PLR9_SU0_SUS256_SRVW4_TT1_64_WG64_4_1_WGM1
    SolutionIndex: 341
    SolutionNameMin: Cijk_Ailk_Bljk_HBH_MT64x128x32_MI32x32x8x1_SE_1LDSB0_GRVW2_NLCA1_PLR5_SU32_SUS256_SRVW4_TT1_64_WG64_4_1_WGM1
    SolutionIndex: 342
    SolutionNameMin: Cijk_Ailk_Bljk_HBH_MT32x64x64_MI16x16x16x1_SE_1LDSB0_GRVW8_NLCA1_PLR5_SU0_SUS256_SRVW4_TT1_32_WG32_8_1_WGM1
    SolutionIndex: 343
    SolutionNameMin: Cijk_Ailk_Bljk_HBH_MT64x128x64_MI32x32x8x1_SE_1LDSB0_GRVW8_NLCA1_PLR9_SU32_SUS128_SRVW4_TT1_64_WG64_4_1_WGM2
    SolutionIndex: 344
    SolutionNameMin: Cijk_Ailk_Bljk_HBH_MT64x128x64_MI32x32x8x1_SE_1LDSB0_GRVW8_NLCA1_PLR9_SU32_SUS256_SRVW4_TT1_64_WG64_4_1_WGM1
    SolutionIndex: 345
    SolutionNameMin: Cijk_Ailk_Bljk_HBH_MT64x64x64_MI32x32x8x1_SE_1LDSB0_GRVW8_NLCA1_PLR9_SU32_SUS256_SRVW4_TT1_32_WG64_4_1_WGM2
    SolutionIndex: 346
    SolutionNameMin: Cijk_Ailk_Bljk_HBH_MT128x128x32_MI32x32x8x1_SE_1LDSB1_GRVW2_NLCA1_PLR5_SU0_SUS256_SRVW4_TT2_64_WG64_4_1_WGM1
    SolutionIndex: 347
    SolutionNameMin: Cijk_Ailk_Bljk_HBH_MT128x128x32_MI32x32x8x1_SE_1LDSB1_GRVW2_NLCA1_PLR5_SU0_SUS256_SRVW4_TT2_64_WG64_4_1_WGM2
    SolutionIndex: 348
    SolutionNameMin: Cijk_Ailk_Bljk_HBH_MT64x256x64_MI32x32x8x1_SE_1LDSB1_GRVW2_NLCA1_PLR9_SU0_SUS256_SRVW4_TT1_128_WG64_4_1_WGM2
    SolutionIndex: 349
    SolutionNameMin: Cijk_Ailk_Bljk_HBH_MT64x128x64_MI32x32x8x1_SE_1LDSB0_GRVW4_NLCA1_PLR9_SU0_SUS256_SRVW4_TT1_64_WG64_4_1_WGM1
    SolutionIndex: 350
    SolutionNameMin: Cijk_Ailk_Bljk_HBH_MT128x128x32_MI32x32x8x1_SE_1LDSB1_GRVW2_NLCA1_PLR5_SU0_SUS256_SRVW4_TT2_64_WG64_4_1_WGM15
    SolutionIndex: 351
    SolutionNameMin: Cijk_Ailk_Bljk_HBH_MT256x160x32_MI32x32x8x1_SE_1LDSB0_GRVW4_NLCA1_PLR5_SU0_SUS256_SRVW4_TT2_160_WG128_2_1_WGM2
    SolutionIndex: 352
    SolutionNameMin: Cijk_Ailk_Bljk_HBH_MT64x128x64_MI32x32x8x1_SE_1LDSB0_GRVW8_NLCA1_PLR9_SU32_SUS256_SRVW4_TT1_64_WG64_4_1_WGM15
    SolutionIndex: 353
    SolutionNameMin: Cijk_Ailk_Bljk_HBH_MT96x96x32_MI16x16x16x1_SE_1LDSB1_GRVW2_NLCA3_PLR2_SU32_SUS256_SRVW0_TT3_48_WG32_8_1_WGM15
    SolutionIndex: 354
    SolutionNameMin: Cijk_Ailk_Bljk_HBH_MT64x128x32_MI32x32x8x1_SE_1LDSB0_GRVW8_NLCA1_PLR5_SU32_SUS256_SRVW4_TT1_64_WG64_4_1_WGM15
    SolutionIndex: 355
    SolutionNameMin: Cijk_Ailk_Bljk_HBH_MT64x128x64_MI32x32x8x1_SE_1LDSB0_GRVW2_NLCA1_PLR9_SU32_SUS256_SRVW4_TT1_64_WG64_4_1_WGM1
    SolutionIndex: 356
    SolutionNameMin: Cijk_Ailk_Bljk_HBH_MT64x32x32_MI16x16x16x1_SE_1LDSB1_GRVW2_NLCA1_PLR2_SU32_SUS256_SRVW4_TT2_16_WG32_8_1_WGM2
    SolutionIndex: 357
    SolutionNameMin: Cijk_Ailk_Bljk_HBH_MT128x64x32_MI32x32x8x1_SE_1LDSB0_GRVW8_NLCA1_PLR5_SU0_SUS256_SRVW4_TT2_32_WG64_4_1_WGM2
    SolutionIndex: 358
    SolutionNameMin: Cijk_Ailk_Bljk_HBH_MT128x64x32_MI32x32x8x1_SE_1LDSB0_GRVW4_NLCA1_PLR5_SU0_SUS256_SRVW4_TT2_32_WG64_4_1_WGM1
    SolutionIndex: 359
    SolutionNameMin: Cijk_Ailk_Bljk_HBH_MT64x32x32_MI16x16x16x1_SE_1LDSB1_GRVW2_NLCA1_PLR2_SU0_SUS256_SRVW4_TT2_16_WG32_8_1_WGM15
    SolutionIndex: 360
    SolutionNameMin: Cijk_Ailk_Bljk_HBH_MT128x96x32_MI32x32x8x1_SE_1LDSB0_GRVW4_NLCA1_PLR5_SU0_SUS256_SRVW4_TT1_96_WG128_2_1_WGM2
    SolutionIndex: 361
    SolutionNameMin: Cijk_Ailk_Bljk_HBH_MT64x32x32_MI16x16x16x1_SE_1LDSB0_GRVW2_NLCA1_PLR2_SU0_SUS256_SRVW4_TT2_16_WG32_8_1_WGM2
    SolutionIndex: 362
    SolutionNameMin: Cijk_Ailk_Bljk_HBH_MT128x64x32_MI32x32x8x1_SE_1LDSB0_GRVW2_NLCA1_PLR5_SU0_SUS256_SRVW4_TT2_32_WG64_4_1_WGM15
    SolutionIndex: 363
    SolutionNameMin: Cijk_Ailk_Bljk_HBH_MT128x64x32_MI32x32x8x1_SE_1LDSB0_GRVW8_NLCA1_PLR5_SU0_SUS256_SRVW4_TT2_32_WG64_4_1_WGM15
    SolutionIndex: 364
    SolutionNameMin: Cijk_Ailk_Bljk_HBH_MT128x64x32_MI32x32x8x1_SE_1LDSB0_GRVW2_NLCA1_PLR5_SU0_SUS256_SRVW4_TT2_32_WG64_4_1_WGM2
    SolutionIndex: 365
    SolutionNameMin: Cijk_Ailk_Bljk_HBH_MT256x256x32_MI32x32x8x1_SE_1LDSB1_GRVW8_LPB8_NLCA1_PLR5_SU0_SUS256_SRVW4_TT4_128_WG64_4_1_WGM2
    SolutionIndex: 366
    SolutionNameMin: Cijk_Ailk_Bljk_HBH_MT128x256x32_MI32x32x8x1_SE_1LDSB1_GRVW8_LPB8_NLCA1_PLR5_SU0_SUS256_SRVW4_TT2_128_WG64_4_1_WGM1
    SolutionIndex: 367
    SolutionNameMin: Cijk_Ailk_Bljk_HBH_MT256x144x64_MI16x16x16x1_SE_1LDSB1_GRVW4_LPB16_NLCA1_PLR5_SU32_SUS256_SRVW4_TT4_144_WG64_4_1_WGM2
    SolutionIndex: 368
    SolutionNameMin: Cijk_Ailk_Bljk_HBH_MT128x96x64_MI32x32x8x1_SE_1LDSB0_GRVW8_LPB8_NLCA1_PLR9_SU0_SUS256_SRVW0_TT1_96_WG128_2_1_WGM15
    SolutionIndex: 369
    SolutionNameMin: Cijk_Ailk_Bljk_HBH_MT96x128x64_MI32x32x8x1_SE_1LDSB0_GRVW4_LPB8_NLCA3_PLR9_SU32_SUS128_SRVW0_TT3_32_WG32_8_1_WGM2
    SolutionIndex: 370
    SolutionNameMin: Cijk_Ailk_Bljk_HBH_MT128x288x32_MI32x32x8x1_SE_1LDSB0_GRVW4_LPB8_NLCA1_PLR5_SU0_SUS256_SRVW4_TT1_288_WG128_2_1_WGM15
    SolutionIndex: 371
    SolutionNameMin: Cijk_Ailk_Bljk_HBH_MT128x256x32_MI32x32x8x1_SE_1LDSB1_GRVW8_LPB8_NLCA1_PLR5_SU32_SUS256_SRVW4_TT2_128_WG64_4_1_WGM2
    SolutionIndex: 372
    SolutionNameMin: Cijk_Ailk_Bljk_HBH_MT64x128x32_MI32x32x8x1_SE_1LDSB0_GRVW2_LPB8_NLCA1_PLR5_SU0_SUS256_SRVW4_TT1_64_WG64_4_1_WGM1
    SolutionIndex: 373
    SolutionNameMin: Cijk_Ailk_Bljk_HBH_MT256x128x32_MI32x32x8x1_SE_1LDSB0_GRVW8_LPB8_NLCA1_PLR5_SU0_SUS256_SRVW0_TT4_64_WG64_4_1_WGM1
    SolutionIndex: 374
    SolutionNameMin: Cijk_Ailk_Bljk_HBH_MT256x128x32_MI32x32x8x1_SE_1LDSB0_GRVW8_LPB8_NLCA1_PLR5_SU0_SUS256_SRVW0_TT4_64_WG64_4_1_WGM1
    SolutionIndex: 375
    SolutionNameMin: Cijk_Ailk_Bljk_HBH_MT64x128x32_MI32x32x8x1_SE_1LDSB0_GRVW8_LPB8_NLCA1_PLR5_SU0_SUS256_SRVW4_TT1_64_WG64_4_1_WGM1
    SolutionIndex: 376
    SolutionNameMin: Cijk_Ailk_Bljk_HBH_MT256x160x32_MI32x32x8x1_SE_1LDSB0_GRVW4_LPB8_NLCA1_PLR5_SU32_SUS128_SRVW0_TT2_160_WG128_2_1_WGM1
    SolutionIndex: 377
    SolutionNameMin: Cijk_Ailk_Bljk_HBH_MT256x160x32_MI32x32x8x1_SE_1LDSB0_GRVW2_LPB8_NLCA2_PLR5_SU32_SUS128_SRVW0_TT2_160_WG128_2_1_WGM1
    SolutionIndex: 378
    SolutionNameMin: Cijk_Ailk_Bljk_HBH_MT256x160x32_MI32x32x8x1_SE_1LDSB0_GRVW4_LPB8_NLCA1_PLR5_SU32_SUS256_SRVW4_TT2_160_WG128_2_1_WGM2
    SolutionIndex: 379
    SolutionNameMin: Cijk_Ailk_Bljk_HBH_MT64x128x32_MI32x32x8x1_SE_1LDSB0_GRVW8_LPB8_NLCA1_PLR5_SU0_SUS256_SRVW4_TT1_64_WG64_4_1_WGM2
    SolutionIndex: 380
    SolutionNameMin: Cijk_Ailk_Bljk_HBH_MT256x144x64_MI16x16x16x1_SE_1LDSB1_GRVW4_LPB16_NLCA1_PLR5_SU0_SUS256_SRVW0_TT4_144_WG64_4_1_WGM2
    SolutionIndex: 381
    SolutionNameMin: Cijk_Ailk_Bljk_HBH_MT256x144x64_MI16x16x16x1_SE_1LDSB1_GRVW4_LPB16_NLCA1_PLR5_SU0_SUS256_SRVW0_TT4_144_WG64_4_1_WGM15
    SolutionIndex: 382
    SolutionNameMin: Cijk_Ailk_Bljk_HBH_MT128x128x32_MI32x32x8x1_SE_1LDSB1_GRVW2_LPB8_NLCA1_PLR5_SU0_SUS256_SRVW4_TT2_64_WG64_4_1_WGM1
    SolutionIndex: 383
    SolutionNameMin: Cijk_Ailk_Bljk_HBH_MT128x256x32_MI32x32x8x1_SE_1LDSB1_GRVW8_LPB8_NLCA1_PLR5_SU0_SUS256_SRVW4_TT2_128_WG64_4_1_WGM2
    SolutionIndex: 384
    SolutionNameMin: Cijk_Ailk_Bljk_HBH_MT64x128x64_MI32x32x8x1_SE_1LDSB0_GRVW8_LPB8_NLCA1_PLR9_SU0_SUS256_SRVW4_TT1_64_WG64_4_1_WGM1
    SolutionIndex: 385
    SolutionNameMin: Cijk_Ailk_Bljk_HBH_MT256x256x32_MI32x32x8x1_SE_1LDSB1_GRVW4_LPB8_NLCA1_PLR5_SU0_SUS256_SRVW0_TT4_128_WG64_4_1_WGM1
    SolutionIndex: 386
    SolutionNameMin: Cijk_Ailk_Bljk_HBH_MT64x128x32_MI32x32x8x1_SE_1LDSB0_GRVW2_LPB8_NLCA1_PLR5_SU32_SUS256_SRVW4_TT1_64_WG64_4_1_WGM15
    SolutionIndex: 387
    SolutionNameMin: Cijk_Ailk_Bljk_HBH_MT256x128x32_MI32x32x8x1_SE_1LDSB1_GRVW8_LPB8_NLCA1_PLR5_SU0_SUS256_SRVW4_TT4_64_WG64_4_1_WGM15
    SolutionIndex: 388
    SolutionNameMin: Cijk_Ailk_Bljk_HBH_MT128x160x64_MI32x32x8x1_SE_1LDSB1_GRVW2_LPB8_NLCA1_PLR9_SU0_SUS256_SRVW0_TT1_160_WG128_2_1_WGM15
    SolutionIndex: 389
    SolutionNameMin: Cijk_Ailk_Bljk_HBH_MT256x128x32_MI32x32x8x1_SE_1LDSB1_GRVW8_LPB8_NLCA1_PLR5_SU0_SUS256_SRVW0_TT4_64_WG64_4_1_WGM1
    SolutionIndex: 390
    SolutionNameMin: Cijk_Ailk_Bljk_HBH_MT128x96x64_MI32x32x8x1_SE_1LDSB0_GRVW8_LPB8_NLCA1_PLR9_SU0_SUS256_SRVW4_TT1_96_WG128_2_1_WGM15
    SolutionIndex: 391
    SolutionNameMin: Cijk_Ailk_Bljk_HBH_MT32x64x32_MI16x16x16x1_SE_1LDSB1_GRVW2_LPB16_NLCA1_PLR2_SU32_SUS256_SRVW4_TT1_32_WG32_8_1_WGM1
    SolutionIndex: 392
    SolutionNameMin: Cijk_Ailk_Bljk_HBH_MT256x160x32_MI32x32x8x1_SE_1LDSB0_GRVW4_LPB8_NLCA1_PLR5_SU0_SUS256_SRVW0_TT2_160_WG128_2_1_WGM2
    SolutionIndex: 393
    SolutionNameMin: Cijk_Ailk_Bljk_HBH_MT64x32x32_MI16x16x16x1_SE_1LDSB1_GRVW2_LPB16_NLCA1_PLR2_SU0_SUS256_SRVW4_TT2_16_WG32_8_1_WGM1
    SolutionIndex: 394
    SolutionNameMin: Cijk_Ailk_Bljk_HBH_MT256x160x32_MI32x32x8x1_SE_1LDSB0_GRVW4_LPB8_NLCA1_PLR5_SU32_SUS256_SRVW4_TT2_160_WG128_2_1_WGM15
    SolutionIndex: 395
    SolutionNameMin: Cijk_Ailk_Bljk_HBH_MT128x256x32_MI32x32x8x1_SE_1LDSB1_GRVW8_LPB8_NLCA1_PLR5_SU0_SUS256_SRVW4_TT2_128_WG64_4_1_WGM15
    SolutionIndex: 396
    SolutionNameMin: Cijk_Ailk_Bljk_HBH_MT256x160x32_MI32x32x8x1_SE_1LDSB0_GRVW4_LPB8_NLCA1_PLR5_SU0_SUS256_SRVW4_TT2_160_WG128_2_1_WGM15
    SolutionIndex: 397
    SolutionNameMin: Cijk_Ailk_Bljk_HBH_MT256x160x32_MI32x32x8x1_SE_1LDSB0_GRVW4_LPB8_NLCA1_PLR5_SU0_SUS256_SRVW4_TT2_160_WG128_2_1_WGM2
    SolutionIndex: 398
    SolutionNameMin: Cijk_Ailk_Bljk_HBH_MT256x160x32_MI32x32x8x1_SE_1LDSB0_GRVW2_LPB8_NLCA2_PLR5_SU32_SUS256_SRVW4_TT2_160_WG128_2_1_WGM2
    SolutionIndex: 399
    SolutionNameMin: Cijk_Ailk_Bljk_HBH_MT128x256x32_MI32x32x8x1_SE_1LDSB1_GRVW8_LPB8_NLCA1_PLR5_SU32_SUS128_SRVW4_TT2_128_WG64_4_1_WGM15
    SolutionIndex: 400
    SolutionNameMin: Cijk_Ailk_Bljk_HBH_MT256x256x32_MI32x32x8x1_SE_1LDSB1_GRVW8_LPB8_NLCA1_PLR5_SU0_SUS256_SRVW4_TT4_128_WG64_4_1_WGM1
    SolutionIndex: 401
    SolutionNameMin: Cijk_Ailk_Bljk_HBH_MT64x32x32_MI16x16x16x1_SE_1LDSB1_GRVW2_LPB16_NLCA1_PLR2_SU0_SUS256_SRVW4_TT2_16_WG32_8_1_WGM2
    SolutionIndex: 402
    SolutionNameMin: Cijk_Ailk_Bljk_HBH_MT64x32x32_MI16x16x16x1_SE_1LDSB1_GRVW2_LPB16_NLCA1_PLR2_SU0_SUS256_SRVW4_TT2_16_WG32_8_1_WGM15
    SolutionIndex: 403
    SolutionNameMin: Cijk_Ailk_Bljk_HBH_MT32x32x32_MI16x16x16x1_SE_1LDSB0_GRVW2_LPB16_NLCA1_PLR2_SU0_SUS256_SRVW4_TT1_16_WG32_8_1_WGM1
    SolutionIndex: 404
    SolutionNameMin: Cijk_Ailk_Bljk_HBH_MT128x160x64_MI32x32x8x1_SE_1LDSB1_GRVW2_LPB8_NLCA1_PLR9_SU0_SUS256_SRVW4_TT1_160_WG128_2_1_WGM15
    SolutionIndex: 405
    SolutionNameMin: Cijk_Ailk_Bljk_HBH_MT128x160x64_MI32x32x8x1_SE_1LDSB1_GRVW2_LPB8_NLCA1_PLR9_SU32_SUS128_SRVW4_TT1_160_WG128_2_1_WGM15
    SolutionIndex: 406
    SolutionNameMin: Cijk_Ailk_Bljk_HBH_MT256x160x32_MI32x32x8x1_SE_1LDSB0_GRVW4_LPB8_NLCA1_PLR5_SU32_SUS128_SRVW0_TT2_160_WG128_2_1_WGM2
    SolutionIndex: 407
    SolutionNameMin: Cijk_Ailk_Bljk_HBH_MT256x160x32_MI32x32x8x1_SE_1LDSB0_GRVW4_LPB8_NLCA1_PLR5_SU32_SUS256_SRVW0_TT2_160_WG128_2_1_WGM2
    SolutionIndex: 408
    SolutionNameMin: Cijk_Ailk_Bljk_HBH_MT256x160x32_MI32x32x8x1_SE_1LDSB0_GRVW4_LPB8_NLCA1_PLR5_SU32_SUS256_SRVW0_TT2_160_WG128_2_1_WGM15
    SolutionIndex: 409
    SolutionNameMin: Cijk_Ailk_Bljk_HBH_MT256x160x32_MI32x32x8x1_SE_1LDSB0_GRVW4_LPB8_NLCA1_PLR5_SU0_SUS256_SRVW0_TT2_160_WG128_2_1_WGM1
    SolutionIndex: 410
    SolutionNameMin: Cijk_Ailk_Bljk_HBH_MT256x160x32_MI32x32x8x1_SE_1LDSB0_GRVW4_LPB8_NLCA1_PLR5_SU32_SUS128_SRVW0_TT2_160_WG128_2_1_WGM15
    SolutionIndex: 411
    SolutionNameMin: Cijk_Ailk_Bljk_HBH_MT256x160x32_MI32x32x8x1_SE_1LDSB0_GRVW4_LPB8_NLCA1_PLR5_SU0_SUS256_SRVW0_TT2_160_WG128_2_1_WGM15
    SolutionIndex: 412
    SolutionNameMin: Cijk_Ailk_Bljk_HBH_MT256x160x32_MI32x32x8x1_SE_1LDSB0_GRVW4_LPB8_NLCA1_PLR5_SU32_SUS128_SRVW0_TT2_160_WG128_2_1_WGM1
    SolutionIndex: 413
    SolutionNameMin: Cijk_Ailk_Bljk_HBH_MT64x128x64_MI32x32x8x1_SE_1LDSB0_GRVW4_LPB8_NLCA1_PLR9_SU32_SUS256_SRVW0_TT1_64_WG64_4_1_WGM2
    SolutionIndex: 414
    SolutionNameMin: Cijk_Ailk_Bljk_HBH_MT96x96x64_MI16x16x16x1_SE_1LDSB0_GRVW8_LPB16_NLCA3_PLR5_SU0_SUS256_SRVW0_TT3_48_WG32_8_1_WGM1
    SolutionIndex: 415
    SolutionNameMin: Cijk_Ailk_Bljk_HBH_MT96x96x64_MI16x16x16x1_SE_1LDSB0_GRVW8_LPB16_NLCA3_PLR5_SU32_SUS128_SRVW0_TT3_48_WG32_8_1_WGM1
    SolutionIndex: 416
    SolutionNameMin: Cijk_Ailk_Bljk_HBH_MT96x96x64_MI16x16x16x1_SE_1LDSB0_GRVW2_LPB16_NLCA3_PLR5_SU0_SUS256_SRVW0_TT3_48_WG32_8_1_WGM1
    SolutionIndex: 417
    SolutionNameMin: Cijk_Ailk_Bljk_HBH_MT32x32x64_MI16x16x16x1_SE_1LDSB0_GRVW8_LPB16_NLCA1_PLR5_SU0_SUS256_SRVW0_TT1_16_WG32_8_1_WGM2
    SolutionIndex: 418
    SolutionNameMin: Cijk_Ailk_Bljk_HBH_MT128x256x32_MI32x32x8x1_SE_1LDSB1_GRVW8_LPB8_NLCA1_PLR5_SU32_SUS128_SRVW4_TT2_128_WG64_4_1_WGM2
    SolutionIndex: 419
    SolutionNameMin: Cijk_Ailk_Bljk_HBH_MT256x160x32_MI32x32x8x1_SE_1LDSB1_GRVW2_LPB8_NLCA2_PLR5_SU0_SUS256_SRVW0_TT2_160_WG128_2_1_WGM15
    SolutionIndex: 420
    SolutionNameMin: Cijk_Ailk_Bljk_HBH_MT64x32x64_MI16x16x16x1_SE_1LDSB0_GRVW4_LPB16_NLCA1_PLR5_SU32_SUS128_SRVW0_TT2_16_WG32_8_1_WGM1
    SolutionIndex: 421
    SolutionNameMin: Cijk_Ailk_Bljk_HBH_MT128x96x64_MI32x32x8x1_SE_1LDSB0_GRVW8_LPB8_NLCA1_PLR9_SU32_SUS256_SRVW4_TT1_96_WG128_2_1_WGM15
    SolutionIndex: 422
    SolutionNameMin: Cijk_Ailk_Bljk_HBH_MT64x32x64_MI16x16x16x1_SE_1LDSB0_GRVW8_LPB16_NLCA1_PLR5_SU32_SUS256_SRVW0_TT2_16_WG32_8_1_WGM1
    SolutionIndex: 423
    SolutionNameMin: Cijk_Ailk_Bljk_HBH_MT64x128x32_MI32x32x8x1_SE_1LDSB0_GRVW8_LPB8_NLCA1_PLR5_SU32_SUS128_SRVW4_TT1_64_WG64_4_1_WGM15
    SolutionIndex: 424
    SolutionNameMin: Cijk_Ailk_Bljk_HBH_MT96x128x64_MI32x32x8x1_SE_1LDSB0_GRVW8_LPB8_NLCA3_PLR9_SU32_SUS256_SRVW0_TT3_32_WG32_8_1_WGM1
    SolutionIndex: 425
    SolutionNameMin: Cijk_Ailk_Bljk_HBH_MT128x128x32_MI32x32x8x1_SE_1LDSB1_GRVW2_LPB8_NLCA1_PLR5_SU0_SUS256_SRVW4_TT2_64_WG64_4_1_WGM15
    SolutionIndex: 426
    SolutionNameMin: Cijk_Ailk_Bljk_HBH_MT64x32x32_MI16x16x16x1_SE_1LDSB1_GRVW2_LPB16_NLCA1_PLR2_SU32_SUS128_SRVW4_TT2_16_WG32_8_1_WGM2
    SolutionIndex: 427
    SolutionNameMin: Cijk_Ailk_Bljk_HBH_MT128x288x32_MI32x32x8x1_SE_1LDSB0_GRVW2_LPB8_NLCA1_PLR5_SU32_SUS256_SRVW4_TT1_288_WG128_2_1_WGM15
    SolutionIndex: 428
    SolutionNameMin: Cijk_Ailk_Bljk_HBH_MT256x256x32_MI32x32x8x1_SE_1LDSB1_GRVW8_LPB8_NLCA1_PLR5_SU32_SUS256_SRVW4_TT4_128_WG64_4_1_WGM15
    SolutionIndex: 429
    SolutionNameMin: Cijk_Ailk_Bljk_HBH_MT128x96x32_MI32x32x8x1_SE_1LDSB1_GRVW2_LPB8_NLCA1_PLR5_SU0_SUS256_SRVW4_TT1_96_WG128_2_1_WGM2
    SolutionIndex: 430
    SolutionNameMin: Cijk_Ailk_Bljk_HBH_MT256x160x32_MI32x32x8x1_SE_1LDSB0_GRVW4_LPB8_NLCA1_PLR5_SU0_SUS256_SRVW0_TT2_160_WG128_2_1_WGM15
    SolutionIndex: 431
    SolutionNameMin: Cijk_Ailk_Bljk_HBH_MT256x128x32_MI32x32x8x1_SE_1LDSB1_GRVW8_LPB8_NLCA1_PLR5_SU0_SUS256_SRVW0_TT4_64_WG64_4_1_WGM1
    SolutionIndex: 432
    SolutionNameMin: Cijk_Ailk_Bljk_HBH_MT256x160x32_MI32x32x8x1_SE_1LDSB0_GRVW4_LPB8_NLCA1_PLR5_SU0_SUS256_SRVW0_TT2_160_WG128_2_1_WGM15
    SolutionIndex: 433
    SolutionNameMin: Cijk_Ailk_Bljk_HBH_MT128x128x32_MI32x32x8x1_SE_1LDSB1_GRVW2_LPB8_NLCA1_PLR5_SU32_SUS128_SRVW4_TT2_64_WG64_4_1_WGM1
    SolutionIndex: 434
    SolutionNameMin: Cijk_Ailk_Bljk_HBH_MT64x32x32_MI16x16x16x1_SE_1LDSB1_GRVW2_LPB16_NLCA1_PLR2_SU32_SUS128_SRVW4_TT2_16_WG32_8_1_WGM15
    SolutionIndex: 435
    SolutionNameMin: Cijk_Ailk_Bljk_HBH_MT256x128x32_MI32x32x8x1_SE_1LDSB1_GRVW8_LPB8_NLCA1_PLR5_SU0_SUS256_SRVW0_TT4_64_WG64_4_1_WGM2
    SolutionIndex: 436
    SolutionNameMin: Cijk_Ailk_Bljk_HBH_MT128x128x32_MI32x32x8x1_SE_1LDSB1_GRVW2_LPB8_NLCA1_PLR5_SU32_SUS256_SRVW4_TT2_64_WG64_4_1_WGM15
    SolutionIndex: 437
    SolutionNameMin: Cijk_Ailk_Bljk_HBH_MT128x160x64_MI32x32x8x1_SE_1LDSB1_GRVW2_LPB8_NLCA1_PLR9_SU0_SUS256_SRVW0_TT1_160_WG128_2_1_WGM1
    SolutionIndex: 438
    SolutionNameMin: Cijk_Ailk_Bljk_HBH_MT128x128x32_MI32x32x8x1_SE_1LDSB1_GRVW2_LPB8_NLCA1_PLR5_SU0_SUS256_SRVW4_TT2_64_WG64_4_1_WGM2
    SolutionIndex: 439
    SolutionNameMin: Cijk_Ailk_Bljk_HBH_MT128x96x32_MI32x32x8x1_SE_1LDSB1_GRVW2_LPB8_NLCA1_PLR5_SU0_SUS256_SRVW4_TT1_96_WG128_2_1_WGM1
    SolutionIndex: 440
    SolutionNameMin: Cijk_Ailk_Bljk_HBH_MT64x128x32_MI32x32x8x1_SE_1LDSB0_GRVW8_LPB8_NLCA1_PLR5_SU32_SUS128_SRVW4_TT1_64_WG64_4_1_WGM1
    SolutionIndex: 441
    SolutionNameMin: Cijk_Ailk_Bljk_HBH_MT64x64x32_MI32x32x8x1_SE_1LDSB0_GRVW8_LPB8_NLCA1_PLR5_SU0_SUS256_SRVW4_TT1_32_WG64_4_1_WGM2
    SolutionIndex: 442
    SolutionNameMin: Cijk_Ailk_Bljk_HBH_MT64x64x32_MI32x32x8x1_SE_1LDSB0_GRVW8_LPB8_NLCA1_PLR5_SU0_SUS256_SRVW4_TT1_32_WG64_4_1_WGM15
    SolutionIndex: 443
    SolutionNameMin: Cijk_Ailk_Bljk_HBH_MT64x128x64_MI32x32x8x1_SE_1LDSB0_GRVW4_LPB8_NLCA1_PLR9_SU32_SUS128_SRVW4_TT1_64_WG64_4_1_WGM15
    SolutionIndex: 444
    SolutionNameMin: Cijk_Ailk_Bljk_HBH_MT64x128x64_MI32x32x8x1_SE_1LDSB0_GRVW8_LPB8_NLCA1_PLR9_SU32_SUS256_SRVW4_TT1_64_WG64_4_1_WGM15
    SolutionIndex: 445
    SolutionNameMin: Cijk_Ailk_Bljk_HBH_MT64x64x32_MI32x32x8x1_SE_1LDSB0_GRVW2_LPB8_NLCA1_PLR5_SU0_SUS256_SRVW4_TT1_32_WG64_4_1_WGM2
    SolutionIndex: 446
    SolutionNameMin: Cijk_Ailk_Bljk_HBH_MT32x32x64_MI16x16x16x1_SE_1LDSB0_GRVW8_LPB16_NLCA1_PLR5_SU32_SUS256_SRVW4_TT1_16_WG32_8_1_WGM15
    SolutionIndex: 447
    SolutionNameMin: Cijk_Ailk_Bljk_HBH_MT32x32x64_MI16x16x16x1_SE_1LDSB0_GRVW8_LPB16_NLCA1_PLR5_SU32_SUS256_SRVW4_TT1_16_WG32_8_1_WGM1
    SolutionIndex: 448
    SolutionNameMin: Cijk_Ailk_Bljk_HBH_MT128x96x32_MI32x32x8x1_SE_1LDSB1_GRVW2_LPB8_NLCA1_PLR5_SU32_SUS128_SRVW4_TT1_96_WG128_2_1_WGM1
    SolutionIndex: 449
    SolutionNameMin: Cijk_Ailk_Bljk_HBH_MT128x96x32_MI32x32x8x1_SE_1LDSB1_GRVW2_LPB8_NLCA1_PLR5_SU0_SUS256_SRVW4_TT1_96_WG128_2_1_WGM15
    SolutionIndex: 450
    SolutionNameMin: Cijk_Ailk_Bljk_HBH_MT128x96x64_MI32x32x8x1_SE_1LDSB1_GRVW2_LPB8_NLCA1_PLR9_SU0_SUS256_SRVW4_TT1_96_WG128_2_1_WGM2
    SolutionIndex: 451
    SolutionNameMin: Cijk_Ailk_Bljk_HBH_MT128x256x32_MI32x32x8x1_SE_1LDSB1_GRVW8_LPB8_NLCA1_PLR5_SU32_SUS128_SRVW4_TT2_128_WG64_4_1_WGM1
    SolutionIndex: 452
    SolutionNameMin: Cijk_Ailk_Bljk_HBH_MT128x128x32_MI32x32x8x1_SE_1LDSB1_GRVW2_LPB8_NLCA1_PLR5_SU32_SUS256_SRVW4_TT2_64_WG64_4_1_WGM1
    SolutionIndex: 453
    SolutionNameMin: Cijk_Ailk_Bljk_HBH_MT64x32x32_MI16x16x16x1_SE_1LDSB1_GRVW2_LPB16_NLCA1_PLR2_SU32_SUS256_SRVW4_TT2_16_WG32_8_1_WGM2
    SolutionIndex: 454
    SolutionNameMin: Cijk_Ailk_Bljk_HBH_MT256x256x32_MI32x32x8x1_SE_1LDSB1_GRVW2_LPB8_NLCA2_PLR5_SU0_SUS256_SRVW0_TT4_128_WG64_4_1_WGM1
    SolutionIndex: 455
    SolutionNameMin: Cijk_Ailk_Bljk_HBH_MT32x32x64_MI16x16x16x1_SE_1LDSB0_GRVW4_LPB16_NLCA1_PLR5_SU32_SUS128_SRVW4_TT1_16_WG32_8_1_WGM15
    SolutionIndex: 456
    SolutionNameMin: Cijk_Ailk_Bljk_HBH_MT32x32x32_MI16x16x16x1_SE_1LDSB0_GRVW8_LPB16_NLCA1_PLR2_SU0_SUS256_SRVW4_TT1_16_WG32_8_1_WGM1
    SolutionIndex: 457
    SolutionNameMin: Cijk_Ailk_Bljk_HBH_MT256x160x32_MI32x32x8x1_SE_1LDSB0_GRVW4_LPB8_NLCA1_PLR5_SU32_SUS128_SRVW4_TT2_160_WG128_2_1_WGM15
    SolutionIndex: 458
    SolutionNameMin: Cijk_Ailk_Bljk_HBH_MT256x256x32_MI32x32x8x1_SE_1LDSB1_GRVW8_LPB8_NLCA1_PLR5_SU0_SUS256_SRVW4_TT4_128_WG64_4_1_WGM15
    SolutionIndex: 459
    SolutionNameMin: Cijk_Ailk_Bljk_HBH_MT32x32x64_MI16x16x16x1_SE_1LDSB0_GRVW8_LPB16_NLCA1_PLR5_SU0_SUS256_SRVW4_TT1_16_WG32_8_1_WGM15
    SolutionIndex: 460
    SolutionNameMin: Cijk_Ailk_Bljk_HBH_MT64x128x32_MI32x32x8x1_SE_1LDSB0_GRVW2_LPB8_NLCA1_PLR5_SU32_SUS128_SRVW4_TT1_64_WG64_4_1_WGM1
    SolutionIndex: 461
    SolutionNameMin: Cijk_Ailk_Bljk_HBH_MT128x128x64_MI32x32x8x1_SE_1LDSB1_GRVW2_LPB8_NLCA1_PLR9_SU0_SUS256_SRVW4_TT2_64_WG64_4_1_WGM1
    SolutionIndex: 462
    SolutionNameMin: Cijk_Ailk_Bljk_HBH_MT64x128x32_MI32x32x8x1_SE_1LDSB0_GRVW4_LPB8_NLCA1_PLR5_SU0_SUS256_SRVW4_TT1_64_WG64_4_1_WGM1
    SolutionIndex: 463
    SolutionNameMin: Cijk_Ailk_Bljk_HBH_MT256x128x32_MI32x32x8x1_SE_1LDSB0_GRVW8_LPB8_NLCA1_PLR5_SU0_SUS256_SRVW4_TT4_64_WG64_4_1_WGM2
    SolutionIndex: 464
    SolutionNameMin: Cijk_Ailk_Bljk_HBH_MT64x128x32_MI32x32x8x1_SE_1LDSB0_GRVW4_LPB8_NLCA1_PLR5_SU0_SUS256_SRVW4_TT1_64_WG64_4_1_WGM2
    SolutionIndex: 465
    SolutionNameMin: Cijk_Ailk_Bljk_HBH_MT32x64x32_MI16x16x16x1_SE_1LDSB1_GRVW2_LPB16_NLCA1_PLR2_SU32_SUS256_SRVW4_TT1_32_WG32_8_1_WGM2
    SolutionIndex: 466
    SolutionNameMin: Cijk_Ailk_Bljk_HBH_MT128x96x32_MI32x32x8x1_SE_1LDSB1_GRVW2_LPB8_NLCA1_PLR5_SU32_SUS128_SRVW4_TT1_96_WG128_2_1_WGM2
    SolutionIndex: 467
    SolutionNameMin: Cijk_Ailk_Bljk_HBH_MT64x128x64_MI32x32x8x1_SE_1LDSB0_GRVW8_LPB8_NLCA1_PLR9_SU0_SUS256_SRVW4_TT1_64_WG64_4_1_WGM15
    SolutionIndex: 468
    SolutionNameMin: Cijk_Ailk_Bljk_HBH_MT128x256x32_MI32x32x8x1_SE_1LDSB1_GRVW2_LPB8_NLCA1_PLR5_SU32_SUS128_SRVW4_TT2_128_WG64_4_1_WGM2
    SolutionIndex: 469
    SolutionNameMin: Cijk_Ailk_Bljk_HBH_MT256x160x32_MI32x32x8x1_SE_1LDSB0_GRVW4_LPB8_NLCA1_PLR5_SU0_SUS256_SRVW4_TT2_160_WG128_2_1_WGM1
    SolutionIndex: 470
    SolutionNameMin: Cijk_Ailk_Bljk_HBH_MT32x32x64_MI16x16x16x1_SE_1LDSB0_GRVW4_LPB16_NLCA1_PLR5_SU0_SUS256_SRVW0_TT1_16_WG32_8_1_WGM1
    SolutionIndex: 471
    SolutionNameMin: Cijk_Ailk_Bljk_HBH_MT32x64x64_MI16x16x16x1_SE_1LDSB0_GRVW8_LPB16_NLCA1_PLR5_SU0_SUS256_SRVW0_TT1_32_WG32_8_1_WGM15
    SolutionIndex: 472
    SolutionNameMin: Cijk_Ailk_Bljk_HBH_MT32x64x64_MI16x16x16x1_SE_1LDSB0_GRVW2_LPB16_NLCA1_PLR5_SU0_SUS256_SRVW0_TT1_32_WG32_8_1_WGM1
    SolutionIndex: 473
    SolutionNameMin: Cijk_Ailk_Bljk_HBH_MT32x64x64_MI16x16x16x1_SE_1LDSB0_GRVW8_LPB16_NLCA1_PLR5_SU32_SUS256_SRVW0_TT1_32_WG32_8_1_WGM1
    SolutionIndex: 474
    SolutionNameMin: Cijk_Ailk_Bljk_HBH_MT128x128x64_MI32x32x8x1_SE_1LDSB1_GRVW2_LPB8_NLCA1_PLR9_SU32_SUS256_SRVW0_TT2_64_WG64_4_1_WGM1
    SolutionIndex: 475
    SolutionNameMin: Cijk_Ailk_Bljk_HBH_MT128x128x32_MI32x32x8x1_SE_1LDSB1_GRVW2_LPB8_NLCA1_PLR5_SU0_SUS256_SRVW4_TT2_64_WG64_4_1_WGM2
    SolutionIndex: 476
    SolutionNameMin: Cijk_Ailk_Bljk_HBH_MT128x96x32_MI32x32x8x1_SE_1LDSB1_GRVW2_LPB8_NLCA1_PLR5_SU0_SUS256_SRVW4_TT1_96_WG128_2_1_WGM1
    SolutionIndex: 477
    SolutionNameMin: Cijk_Ailk_Bljk_HBH_MT128x64x32_MI32x32x8x1_SE_1LDSB0_GRVW8_LPB8_NLCA1_PLR5_SU0_SUS256_SRVW4_TT2_32_WG64_4_1_WGM15
    SolutionIndex: 478
    SolutionNameMin: Cijk_Ailk_Bljk_HBH_MT128x64x32_MI32x32x8x1_SE_1LDSB0_GRVW8_LPB8_NLCA1_PLR5_SU0_SUS256_SRVW4_TT2_32_WG64_4_1_WGM1
    SolutionIndex: 479
    SolutionNameMin: Cijk_Ailk_Bljk_HBH_MT128x96x32_MI32x32x8x1_SE_1LDSB1_GRVW2_LPB8_NLCA1_PLR5_SU0_SUS256_SRVW4_TT1_96_WG128_2_1_WGM2
    SolutionIndex: 480
    SolutionNameMin: Cijk_Ailk_Bljk_HBH_MT128x64x32_MI32x32x8x1_SE_1LDSB0_GRVW4_LPB8_NLCA1_PLR5_SU0_SUS256_SRVW4_TT2_32_WG64_4_1_WGM1
    SolutionIndex: 481
    SolutionNameMin: Cijk_Ailk_Bljk_HBH_MT128x128x32_MI32x32x8x1_SE_1LDSB1_GRVW2_LPB8_NLCA1_PLR5_SU0_SUS256_SRVW4_TT2_64_WG64_4_1_WGM1
    SolutionIndex: 482
    SolutionNameMin: Cijk_Ailk_Bljk_HBH_MT128x160x32_MI32x32x8x1_SE_1LDSB1_GRVW2_LPB8_NLCA1_PLR5_SU0_SUS256_SRVW4_TT1_160_WG128_2_1_WGM15
    SolutionIndex: 483
    SolutionNameMin: Cijk_Ailk_Bljk_HBH_MT128x96x32_MI32x32x8x1_SE_1LDSB0_GRVW4_LPB8_NLCA1_PLR5_SU0_SUS256_SRVW4_TT1_96_WG128_2_1_WGM15
    SolutionIndex: 484
    SolutionNameMin: Cijk_Ailk_Bljk_HBH_MT128x96x32_MI32x32x8x1_SE_1LDSB1_GRVW2_LPB8_NLCA1_PLR5_SU32_SUS256_SRVW4_TT1_96_WG128_2_1_WGM1
    SolutionIndex: 485
    SolutionNameMin: Cijk_Ailk_Bljk_HBH_MT128x64x32_MI32x32x8x1_SE_1LDSB0_GRVW8_LPB8_NLCA1_PLR5_SU32_SUS256_SRVW4_TT2_32_WG64_4_1_WGM1
    SolutionIndex: 486
    SolutionNameMin: Cijk_Ailk_Bljk_HBH_MT128x64x32_MI32x32x8x1_SE_1LDSB0_GRVW2_LPB8_NLCA1_PLR5_SU0_SUS256_SRVW4_TT2_32_WG64_4_1_WGM1
    SolutionIndex: 487
    SolutionNameMin: Cijk_Ailk_Bljk_HBH_MT128x96x32_MI32x32x8x1_SE_1LDSB1_GRVW2_LPB8_NLCA1_PLR5_SU0_SUS256_SRVW4_TT1_96_WG128_2_1_WGM15
    SolutionIndex: 488
    SolutionNameMin: Cijk_Ailk_Bljk_HBH_MT128x96x32_MI32x32x8x1_SE_1LDSB0_GRVW4_LPB8_NLCA1_PLR5_SU0_SUS256_SRVW4_TT1_96_WG128_2_1_WGM2
    SolutionIndex: 489
    SolutionNameMin: Cijk_Ailk_Bljk_HBH_MT64x64x64_MI32x32x8x1_SE_1LDSB0_GRVW2_LPB8_NLCA1_PLR9_SU0_SUS256_SRVW0_TT1_32_WG64_4_1_WGM1
    SolutionIndex: 490
    SolutionNameMin: Cijk_Ailk_Bljk_HBH_MT32x64x64_MI16x16x16x1_SE_1LDSB0_GRVW8_LPB16_NLCA1_PLR5_SU0_SUS256_SRVW0_TT1_32_WG32_8_1_WGM15
    SolutionIndex: 491
    SolutionNameMin: Cijk_Ailk_Bljk_HBH_MT128x128x32_MI32x32x8x1_SE_1LDSB1_GRVW2_LPB8_NLCA1_PLR5_SU0_SUS256_SRVW4_TT2_64_WG64_4_1_WGM15
    SolutionIndex: 492
    SolutionNameMin: Cijk_Ailk_Bljk_HBH_MT128x256x32_MI32x32x8x1_SE_1LDSB1_GRVW8_LPB8_NLCA1_PLR5_SU0_SUS256_SRVW4_TT2_128_WG64_4_1_WGM2
    SolutionIndex: 493
    SolutionNameMin: Cijk_Ailk_Bljk_HBH_MT64x256x32_MI32x32x8x1_SE_1LDSB1_GRVW4_LPB8_NLCA1_PLR5_SU32_SUS256_SRVW4_TT1_128_WG64_4_1_WGM1
    SolutionIndex: 494
    SolutionNameMin: Cijk_Ailk_Bljk_HBH_MT64x128x64_MI32x32x8x1_SE_1LDSB0_GRVW8_LPB8_NLCA1_PLR9_SU0_SUS256_SRVW4_TT1_64_WG64_4_1_WGM15
    SolutionIndex: 495
    SolutionNameMin: Cijk_Ailk_Bljk_HBH_MT64x128x64_MI32x32x8x1_SE_1LDSB0_GRVW8_LPB8_NLCA1_PLR9_SU32_SUS256_SRVW4_TT1_64_WG64_4_1_WGM2
- - - [1024, 1024, 1, 3328]
    - [19, 6.912]
  - - [2944, 4288, 1, 1280]
    - [39, 7.641]
  - - [2368, 64, 1, 3328]
    - [33, 3.688]
  - - [2368, 5888, 1, 256]
    - [37, 7.416]
  - - [256, 704, 1, 1280]
    - [19, 3.036]
  - - [128, 6784, 1, 3328]
    - [23, 6.204]
  - - [5888, 1856, 1, 3328]
    - [39, 7.754]
  - - [5888, 2944, 1, 3328]
    - [39, 7.758]
  - - [1856, 4288, 1, 256]
    - [36, 7.19]
  - - [5056, 5056, 1, 3328]
    - [39, 7.842]
  - - [1408, 5888, 1, 1280]
    - [41, 7.623]
  - - [1024, 3584, 1, 3328]
    - [39, 7.605]
  - - [448, 3584, 1, 3328]
    - [39, 6.405]
  - - [256, 4288, 1, 3328]
    - [39, 5.937]
  - - [5888, 1408, 1, 1280]
    - [41, 7.624]
  - - [704, 1856, 1, 3328]
    - [39, 7.059]
  - - [1024, 2368, 1, 256]
    - [41, 6.405]
  - - [5056, 6784, 1, 1280]
    - [36, 7.827]
  - - [1408, 64, 1, 1280]
    - [11, 2.607]
  - - [448, 1024, 1, 1280]
    - [28, 5.254]
  - - [5056, 5056, 1, 1280]
    - [39, 7.786]
  - - [4288, 6784, 1, 256]
    - [37, 7.546]
  - - [6784, 448, 1, 256]
    - [41, 6.78]
  - - [5056, 256, 1, 1280]
    - [39, 6.879]
  - - [5888, 704, 1, 1280]
    - [39, 7.476]
  - - [3584, 1024, 1, 256]
    - [41, 7.085]
  - - [6784, 4288, 1, 3328]
    - [39, 7.877]
  - - [1856, 2368, 1, 3328]
    - [39, 7.55]
  - - [5888, 2944, 1, 1280]
    - [36, 7.691]
  - - [5888, 1024, 1, 256]
    - [36, 7.244]
  - - [448, 64, 1, 1280]
    - [15, 0.949]
  - - [1024, 704, 1, 256]
    - [16, 5.155]
  - - [1408, 2944, 1, 256]
    - [41, 7.083]
  - - [256, 1856, 1, 1280]
    - [19, 5.436]
  - - [6784, 5056, 1, 3328]
    - [39, 7.883]
  - - [5056, 5056, 1, 256]
    - [17, 7.536]
  - - [256, 2944, 1, 3328]
    - [39, 6.342]
  - - [64, 1024, 1, 1280]
    - [30, 2.071]
  - - [1024, 3584, 1, 1280]
    - [39, 7.511]
  - - [2368, 2944, 1, 1280]
    - [39, 7.572]
  - - [128, 3584, 1, 1280]
    - [1, 5.356]
  - - [6784, 6784, 1, 1280]
    - [41, 7.849]
  - - [1024, 256, 1, 3328]
    - [28, 4.657]
  - - [1408, 4288, 1, 1280]
    - [39, 7.365]
  - - [3584, 4288, 1, 1280]
    - [39, 7.738]
  - - [2368, 704, 1, 1280]
    - [39, 6.547]
  - - [5056, 4288, 1, 3328]
    - [39, 7.841]
  - - [3584, 2368, 1, 3328]
    - [39, 7.64]
  - - [5888, 6784, 1, 1280]
    - [36, 7.81]
  - - [64, 704, 1, 1280]
    - [32, 1.424]
  - - [4288, 256, 1, 256]
    - [39, 5.302]
  - - [6784, 448, 1, 1280]
    - [39, 7.219]
  - - [2944, 5888, 1, 256]
    - [36, 7.385]
  - - [256, 128, 1, 256]
    - [15, 0.727]
  - - [4288, 2944, 1, 256]
    - [36, 7.31]
  - - [5888, 64, 1, 3328]
    - [23, 5.438]
  - - [2944, 256, 1, 3328]
    - [19, 6.359]
  - - [5056, 2368, 1, 1280]
    - [36, 7.703]
  - - [448, 3584, 1, 1280]
    - [39, 6.314]
  - - [6784, 5888, 1, 256]
    - [37, 7.564]
  - - [64, 1024, 1, 3328]
    - [30, 2.226]
  - - [704, 128, 1, 1280]
    - [11, 2.639]
  - - [1408, 448, 1, 1280]
    - [19, 5.255]
  - - [1024, 1408, 1, 256]
    - [36, 5.905]
  - - [2368, 2368, 1, 3328]
    - [39, 7.502]
  - - [5056, 704, 1, 3328]
    - [39, 7.372]
  - - [1408, 1856, 1, 256]
    - [41, 6.887]
  - - [1408, 256, 1, 1280]
    - [19, 4.204]
  - - [5888, 1856, 1, 256]
    - [41, 7.427]
  - - [704, 5888, 1, 256]
    - [37, 7.073]
  - - [6784, 64, 1, 256]
    - [24, 4.281]
  - - [3584, 704, 1, 3328]
    - [39, 7.202]
  - - [1408, 1408, 1, 256]
    - [42, 6.392]
  - - [1024, 64, 1, 1280]
    - [8, 2.082]
  - - [448, 4288, 1, 256]
    - [20, 6.178]
  - - [64, 3584, 1, 3328]
    - [27, 4.533]
  - - [704, 2368, 1, 1280]
    - [39, 6.554]
  - - [1856, 2368, 1, 1280]
    - [39, 7.475]
  - - [2368, 128, 1, 3328]
    - [22, 4.634]
  - - [1408, 1408, 1, 3328]
    - [39, 6.976]
  - - [2944, 128, 1, 256]
    - [6, 4.18]
  - - [448, 1408, 1, 256]
    - [39, 4.552]
  - - [64, 5056, 1, 3328]
    - [5, 4.935]
  - - [1408, 1024, 1, 1280]
    - [39, 6.512]
  - - [704, 6784, 1, 256]
    - [36, 6.922]
  - - [6784, 704, 1, 256]
    - [36, 6.909]
  - - [256, 3584, 1, 3328]
    - [39, 6.044]
  - - [5056, 704, 1, 256]
    - [17, 6.866]
  - - [1408, 3584, 1, 256]
    - [41, 6.992]
  - - [3584, 4288, 1, 3328]
    - [39, 7.799]
  - - [5888, 1856, 1, 1280]
    - [41, 7.699]
  - - [256, 1408, 1, 256]
    - [39, 3.496]
  - - [5056, 64, 1, 1280]
    - [22, 4.727]
  - - [2368, 128, 1, 256]
    - [5, 3.542]
  - - [2368, 3584, 1, 1280]
    - [39, 7.575]
  - - [1024, 256, 1, 256]
    - [19, 3.413]
  - - [448, 448, 1, 256]
    - [10, 3.024]
  - - [2944, 3584, 1, 3328]
    - [39, 7.667]
  - - [256, 256, 1, 3328]
    - [12, 2.231]
  - - [128, 1024, 1, 3328]
    - [11, 3.822]
  - - [6784, 2944, 1, 256]
    - [37, 7.418]
  - - [64, 1856, 1, 1280]
    - [11, 3.256]
  - - [448, 256, 1, 256]
    - [12, 2.271]
  - - [1856, 2368, 1, 256]
    - [36, 7.048]
  - - [3584, 6784, 1, 3328]
    - [39, 7.857]
  - - [256, 1024, 1, 256]
    - [19, 3.47]
  - - [1024, 128, 1, 1280]
    - [11, 3.568]
  - - [4288, 128, 1, 1280]
    - [3, 5.218]
  - - [5056, 4288, 1, 1280]
    - [39, 7.787]
  - - [5888, 64, 1, 256]
    - [6, 4.238]
  - - [6784, 1856, 1, 3328]
    - [39, 7.679]
  - - [1408, 5056, 1, 1280]
    - [39, 7.466]
  - - [1856, 256, 1, 1280]
    - [19, 5.452]
  - - [64, 5888, 1, 3328]
    - [5, 4.969]
  - - [6784, 5888, 1, 3328]
    - [39, 7.867]
  - - [448, 256, 1, 3328]
    - [11, 3.357]
  - - [2368, 5056, 1, 1280]
    - [39, 7.707]
  - - [1024, 704, 1, 1280]
    - [19, 5.976]
  - - [256, 1408, 1, 3328]
    - [19, 4.336]
  - - [6784, 128, 1, 3328]
    - [23, 6.197]
  - - [1024, 5056, 1, 1280]
    - [39, 7.522]
  - - [4288, 1024, 1, 256]
    - [36, 7.022]
  - - [2368, 1408, 1, 256]
    - [36, 6.862]
  - - [704, 704, 1, 3328]
    - [19, 5.878]
  - - [5888, 448, 1, 1280]
    - [39, 6.807]
  - - [3584, 256, 1, 3328]
    - [19, 6.094]
  - - [704, 5888, 1, 3328]
    - [39, 7.557]
  - - [1024, 6784, 1, 1280]
    - [39, 7.545]
  - - [128, 3584, 1, 3328]
    - [1, 5.531]
  - - [128, 704, 1, 1280]
    - [11, 2.614]
  - - [3584, 2944, 1, 1280]
    - [39, 7.606]
  - - [1856, 128, 1, 3328]
    - [31, 4.698]
  - - [128, 2944, 1, 1280]
    - [6, 5.231]
  - - [448, 1856, 1, 1280]
    - [19, 5.434]
  - - [1408, 5056, 1, 3328]
    - [39, 7.529]
  - - [1856, 1856, 1, 3328]
    - [39, 7.142]
  - - [3584, 128, 1, 256]
    - [24, 4.486]
  - - [448, 1408, 1, 3328]
    - [19, 5.376]
  - - [2368, 2368, 1, 256]
    - [17, 7.07]
  - - [4288, 4288, 1, 1280]
    - [36, 7.708]
  - - [64, 448, 1, 1280]
    - [14, 0.951]
  - - [5888, 1024, 1, 1280]
    - [39, 7.655]
  - - [704, 1024, 1, 256]
    - [39, 5.155]
  - - [704, 6784, 1, 3328]
    - [39, 7.372]
  - - [5888, 5888, 1, 3328]
    - [39, 7.851]
  - - [5056, 1024, 1, 1280]
    - [39, 7.528]
  - - [448, 5888, 1, 3328]
    - [39, 6.883]
  - - [1024, 2944, 1, 1280]
    - [39, 7.154]
  - - [5056, 5888, 1, 1280]
    - [37, 7.815]
  - - [448, 6784, 1, 256]
    - [40, 6.761]
  - - [256, 3584, 1, 256]
    - [39, 5.284]
  - - [256, 448, 1, 256]
    - [33, 2.29]
  - - [3584, 5888, 1, 256]
    - [36, 7.46]
  - - [2944, 3584, 1, 256]
    - [36, 7.266]
  - - [1408, 704, 1, 256]
    - [41, 5.681]
  - - [6784, 1024, 1, 3328]
    - [39, 7.613]
  - - [6784, 2944, 1, 3328]
    - [39, 7.784]
  - - [64, 64, 1, 3328]
    - [11, 0.142]
  - - [6784, 2368, 1, 1280]
    - [41, 7.71]
  - - [4288, 3584, 1, 256]
    - [36, 7.408]
  - - [4288, 5888, 1, 1280]
    - [39, 7.77]
  - - [448, 2944, 1, 3328]
    - [39, 6.054]
  - - [4288, 1856, 1, 1280]
    - [39, 7.549]
  - - [1856, 2944, 1, 3328]
    - [39, 7.654]
  - - [256, 6784, 1, 3328]
    - [39, 6.915]
  - - [64, 5888, 1, 256]
    - [18, 4.048]
  - - [5056, 1024, 1, 256]
    - [37, 7.174]
  - - [704, 64, 1, 3328]
    - [34, 1.549]
  - - [5056, 1856, 1, 3328]
    - [39, 7.755]
  - - [448, 448, 1, 3328]
    - [27, 3.987]
  - - [448, 2368, 1, 1280]
    - [39, 5.645]
  - - [1408, 128, 1, 1280]
    - [5, 3.932]
  - - [5056, 256, 1, 3328]
    - [39, 7.0]
  - - [704, 704, 1, 256]
    - [19, 4.731]
  - - [1024, 5888, 1, 1280]
    - [39, 7.656]
  - - [64, 128, 1, 256]
    - [2, 0.162]
  - - [128, 1856, 1, 1280]
    - [13, 4.453]
  - - [5056, 3584, 1, 256]
    - [37, 7.472]
  - - [1856, 1024, 1, 1280]
    - [39, 6.605]
  - - [1856, 1856, 1, 1280]
    - [39, 7.061]
  - - [128, 4288, 1, 3328]
    - [3, 5.315]
  - - [1856, 1024, 1, 3328]
    - [39, 6.691]
  - - [256, 2368, 1, 256]
    - [39, 4.414]
  - - [1024, 448, 1, 3328]
    - [19, 5.437]
  - - [1856, 704, 1, 1280]
    - [39, 6.929]
  - - [6784, 1024, 1, 256]
    - [36, 7.18]
  - - [5056, 5888, 1, 3328]
    - [39, 7.855]
  - - [1856, 1024, 1, 256]
    - [20, 6.12]
  - - [5056, 1408, 1, 3328]
    - [39, 7.532]
  - - [1024, 1024, 1, 1280]
    - [19, 6.764]
  - - [448, 5888, 1, 256]
    - [36, 6.383]
  - - [1408, 6784, 1, 3328]
    - [39, 7.685]
  - - [2944, 1408, 1, 3328]
    - [39, 7.555]
  - - [2944, 4288, 1, 3328]
    - [39, 7.697]
  - - [256, 2944, 1, 256]
    - [39, 5.39]
  - - [5056, 2944, 1, 256]
    - [36, 7.426]
  - - [2368, 1856, 1, 256]
    - [36, 7.043]
  - - [128, 6784, 1, 1280]
    - [6, 6.094]
  - - [1408, 3584, 1, 3328]
    - [39, 7.412]
  - - [2368, 6784, 1, 256]
    - [37, 7.464]
  - - [4288, 2368, 1, 3328]
    - [39, 7.757]
  - - [704, 3584, 1, 1280]
    - [39, 7.113]
  - - [1408, 5888, 1, 3328]
    - [39, 7.69]
  - - [1856, 5056, 1, 256]
    - [17, 7.364]
  - - [6784, 6784, 1, 256]
    - [37, 7.629]
  - - [1408, 704, 1, 3328]
    - [39, 6.524]
  - - [128, 5888, 1, 1280]
    - [0, 6.222]
  - - [2368, 4288, 1, 1280]
    - [39, 7.696]
  - - [3584, 1856, 1, 1280]
    - [39, 7.494]
  - - [704, 1408, 1, 3328]
    - [39, 6.524]
  - - [704, 64, 1, 1280]
    - [14, 1.42]
  - - [3584, 448, 1, 256]
    - [39, 5.802]
  - - [3584, 3584, 1, 1280]
    - [39, 7.77]
  - - [256, 6784, 1, 256]
    - [36, 6.238]
  - - [1856, 3584, 1, 3328]
    - [39, 7.566]
  - - [128, 448, 1, 256]
    - [30, 1.26]
  - - [3584, 3584, 1, 256]
    - [36, 7.43]
  - - [6784, 4288, 1, 1280]
    - [36, 7.826]
  - - [448, 704, 1, 1280]
    - [19, 3.693]
  - - [3584, 5056, 1, 256]
    - [41, 7.464]
  - - [6784, 128, 1, 256]
    - [6, 5.389]
  - - [64, 1408, 1, 3328]
    - [11, 2.838]
  - - [704, 448, 1, 256]
    - [19, 3.072]
  - - [2944, 2368, 1, 1280]
    - [39, 7.57]
  - - [448, 64, 1, 3328]
    - [35, 1.041]
  - - [6784, 3584, 1, 256]
    - [37, 7.501]
  - - [256, 1856, 1, 3328]
    - [28, 5.685]
  - - [256, 704, 1, 256]
    - [19, 2.347]
  - - [128, 1408, 1, 256]
    - [5, 2.859]
  - - [64, 128, 1, 3328]
    - [33, 0.284]
  - - [1856, 1408, 1, 256]
    - [37, 6.857]
  - - [2944, 2944, 1, 3328]
    - [39, 7.576]
  - - [5056, 6784, 1, 256]
    - [37, 7.565]
  - - [1408, 4288, 1, 3328]
    - [39, 7.426]
  - - [6784, 256, 1, 1280]
    - [39, 6.816]
  - - [1024, 704, 1, 3328]
    - [19, 6.075]
  - - [2368, 704, 1, 3328]
    - [39, 6.641]
  - - [128, 4288, 1, 256]
    - [3, 4.534]
  - - [3584, 6784, 1, 256]
    - [36, 7.495]
  - - [128, 128, 1, 3328]
    - [14, 0.595]
  - - [5056, 1856, 1, 256]
    - [17, 7.371]
  - - [704, 4288, 1, 256]
    - [17, 6.703]
  - - [256, 448, 1, 3328]
    - [11, 3.363]
  - - [1408, 6784, 1, 1280]
    - [39, 7.614]
  - - [64, 2368, 1, 1280]
    - [11, 3.451]
  - - [64, 6784, 1, 3328]
    - [1, 5.165]
  - - [2944, 256, 1, 1280]
    - [39, 6.196]
  - - [5056, 2368, 1, 3328]
    - [39, 7.767]
  - - [2944, 4288, 1, 256]
    - [36, 7.307]
  - - [1408, 3584, 1, 1280]
    - [39, 7.339]
  - - [2368, 64, 1, 256]
    - [11, 2.575]
  - - [256, 256, 1, 256]
    - [12, 1.402]
  - - [704, 128, 1, 3328]
    - [11, 2.841]
  - - [1856, 704, 1, 256]
    - [16, 6.199]
  - - [2368, 6784, 1, 3328]
    - [39, 7.762]
  - - [5056, 704, 1, 1280]
    - [39, 7.3]
  - - [1856, 4288, 1, 3328]
    - [39, 7.615]
  - - [1408, 5888, 1, 256]
    - [37, 7.332]
  - - [704, 2944, 1, 1280]
    - [39, 7.18]
  - - [4288, 64, 1, 1280]
    - [25, 4.074]
  - - [704, 1856, 1, 256]
    - [36, 6.199]
  - - [3584, 704, 1, 1280]
    - [39, 7.118]
  - - [5888, 5056, 1, 256]
    - [38, 7.572]
  - - [3584, 448, 1, 3328]
    - [39, 6.401]
  - - [704, 2368, 1, 3328]
    - [39, 6.642]
  - - [2944, 448, 1, 256]
    - [39, 5.457]
  - - [448, 5056, 1, 3328]
    - [39, 7.137]
  - - [2368, 128, 1, 1280]
    - [5, 4.46]
  - - [4288, 448, 1, 256]
    - [20, 6.169]
  - - [64, 6784, 1, 256]
    - [1, 4.298]
  - - [64, 5056, 1, 1280]
    - [5, 4.739]
  - - [5888, 2368, 1, 256]
    - [41, 7.406]
  - - [704, 448, 1, 3328]
    - [19, 3.807]
  - - [6784, 704, 1, 3328]
    - [39, 7.373]
  - - [128, 64, 1, 1280]
    - [26, 0.254]
  - - [2368, 256, 1, 1280]
    - [19, 5.043]
  - - [1408, 2944, 1, 3328]
    - [39, 7.552]
  - - [64, 1024, 1, 256]
    - [12, 1.414]
  - - [2368, 448, 1, 1280]
    - [19, 5.678]
  - - [128, 3584, 1, 256]
    - [1, 4.45]
  - - [1856, 448, 1, 3328]
    - [19, 5.523]
  - - [128, 5056, 1, 256]
    - [6, 5.168]
  - - [4288, 4288, 1, 256]
    - [36, 7.396]
  - - [2368, 704, 1, 256]
    - [36, 6.006]
  - - [3584, 2368, 1, 256]
    - [36, 7.22]
  - - [5888, 5056, 1, 1280]
    - [41, 7.819]
  - - [128, 1024, 1, 1280]
    - [11, 3.544]
  - - [64, 704, 1, 256]
    - [9, 0.981]
  - - [4288, 256, 1, 1280]
    - [39, 5.849]
  - - [3584, 3584, 1, 3328]
    - [39, 7.832]
  - - [128, 1024, 1, 256]
    - [33, 2.473]
  - - [5888, 6784, 1, 256]
    - [37, 7.56]
  - - [4288, 2944, 1, 3328]
    - [39, 7.699]
  - - [1856, 64, 1, 256]
    - [11, 2.333]
  - - [4288, 128, 1, 3328]
    - [3, 5.312]
  - - [256, 5056, 1, 1280]
    - [39, 6.851]
  - - [6784, 5888, 1, 1280]
    - [39, 7.814]
  - - [704, 128, 1, 256]
    - [12, 1.77]
  - - [5888, 4288, 1, 1280]
    - [39, 7.771]
  - - [448, 256, 1, 1280]
    - [11, 3.158]
  - - [448, 2368, 1, 3328]
    - [39, 5.744]
  - - [1, 1, 1, 1280]
    - [45, 0.0]
  - - [256, 1408, 1, 1280]
    - [19, 4.216]
  - - [1408, 1856, 1, 1280]
    - [39, 7.362]
  - - [5888, 448, 1, 3328]
    - [39, 6.887]
  - - [704, 5888, 1, 1280]
    - [39, 7.466]
  - - [256, 64, 1, 3328]
    - [34, 0.594]
  - - [128, 2368, 1, 256]
    - [5, 3.595]
  - - [6784, 64, 1, 3328]
    - [24, 5.239]
  - - [5056, 2944, 1, 3328]
    - [39, 7.815]
  - - [448, 128, 1, 256]
    - [30, 1.272]
  - - [1856, 128, 1, 1280]
    - [31, 4.482]
  - - [448, 4288, 1, 1280]
    - [39, 6.678]
  - - [64, 3584, 1, 256]
    - [10, 3.351]
  - - [128, 2944, 1, 3328]
    - [23, 5.428]
  - - [3584, 704, 1, 256]
    - [41, 6.628]
  - - [2944, 448, 1, 3328]
    - [39, 6.061]
  - - [3584, 1408, 1, 3328]
    - [39, 7.412]
  - - [2368, 1024, 1, 1280]
    - [39, 6.834]
  - - [2944, 6784, 1, 1280]
    - [39, 7.724]
  - - [1856, 6784, 1, 256]
    - [36, 7.295]
  - - [4288, 448, 1, 3328]
    - [39, 6.764]
  - - [6784, 704, 1, 1280]
    - [39, 7.298]
  - - [5888, 1024, 1, 3328]
    - [39, 7.727]
  - - [704, 6784, 1, 1280]
    - [39, 7.296]
  - - [5888, 128, 1, 256]
    - [19, 5.406]
  - - [5056, 1024, 1, 3328]
    - [39, 7.602]
  - - [704, 5056, 1, 1280]
    - [39, 7.286]
  - - [64, 704, 1, 3328]
    - [14, 1.549]
  - - [2944, 1856, 1, 256]
    - [36, 7.169]
  - - [5056, 64, 1, 256]
    - [5, 3.782]
  - - [5888, 5056, 1, 3328]
    - [41, 7.86]
  - - [128, 5056, 1, 3328]
    - [6, 6.2]
  - - [3584, 6784, 1, 1280]
    - [36, 7.803]
  - - [1856, 5888, 1, 256]
    - [37, 7.421]
  - - [64, 448, 1, 3328]
    - [35, 1.044]
  - - [4288, 4288, 1, 3328]
    - [39, 7.766]
  - - [4288, 1408, 1, 1280]
    - [39, 7.364]
  - - [64, 1856, 1, 256]
    - [11, 2.277]
  - - [4288, 2368, 1, 256]
    - [36, 7.343]
  - - [2944, 5056, 1, 1280]
    - [36, 7.754]
  - - [256, 4288, 1, 1280]
    - [39, 5.847]
  - - [6784, 2368, 1, 3328]
    - [39, 7.764]
  - - [256, 1024, 1, 1280]
    - [19, 4.417]
  - - [4288, 128, 1, 256]
    - [3, 4.503]
  - - [4288, 1856, 1, 3328]
    - [39, 7.621]
  - - [1856, 2944, 1, 1280]
    - [39, 7.575]
  - - [3584, 64, 1, 1280]
    - [13, 4.313]
  - - [4288, 6784, 1, 3328]
    - [39, 7.883]
  - - [3584, 1024, 1, 1280]
    - [39, 7.515]
  - - [1024, 4288, 1, 256]
    - [36, 7.018]
  - - [5888, 3584, 1, 3328]
    - [39, 7.822]
  - - [5056, 3584, 1, 3328]
    - [39, 7.765]
  - - [1408, 128, 1, 3328]
    - [5, 4.149]
  - - [2368, 1408, 1, 1280]
    - [39, 7.33]
  - - [5056, 2944, 1, 1280]
    - [36, 7.755]
  - - [3584, 256, 1, 256]
    - [39, 5.297]
  - - [1024, 6784, 1, 256]
    - [36, 7.158]
  - - [2944, 5056, 1, 3328]
    - [39, 7.818]
  - - [3584, 2944, 1, 256]
    - [36, 7.276]
  - - [448, 128, 1, 3328]
    - [12, 1.95]
  - - [64, 2944, 1, 3328]
    - [22, 4.347]
  - - [64, 4288, 1, 3328]
    - [25, 4.263]
  - - [5056, 6784, 1, 3328]
    - [39, 7.881]
  - - [128, 2944, 1, 256]
    - [6, 4.238]
  - - [3584, 4288, 1, 256]
    - [36, 7.419]
  - - [1856, 6784, 1, 3328]
    - [39, 7.679]
  - - [3584, 128, 1, 3328]
    - [24, 5.506]
  - - [128, 256, 1, 1280]
    - [15, 1.096]
  - - [64, 448, 1, 256]
    - [15, 0.654]
  - - [64, 256, 1, 1280]
    - [14, 0.545]
  - - [5056, 1408, 1, 1280]
    - [41, 7.459]
  - - [5888, 5888, 1, 256]
    - [37, 7.538]
  - - [4288, 1024, 1, 1280]
    - [39, 7.47]
  - - [5888, 128, 1, 3328]
    - [0, 6.359]
  - - [448, 6784, 1, 3328]
    - [39, 7.3]
  - - [2944, 1408, 1, 1280]
    - [39, 7.471]
  - - [64, 128, 1, 1280]
    - [11, 0.253]
  - - [2944, 1856, 1, 3328]
    - [39, 7.652]
  - - [448, 5056, 1, 256]
    - [36, 6.554]
  - - [64, 64, 1, 256]
    - [2, 0.082]
  - - [3584, 5888, 1, 1280]
    - [36, 7.765]
  - - [6784, 1856, 1, 1280]
    - [36, 7.619]
  - - [5888, 256, 1, 3328]
    - [39, 6.912]
  - - [1856, 5888, 1, 3328]
    - [39, 7.758]
  - - [3584, 1408, 1, 256]
    - [41, 6.984]
  - - [704, 3584, 1, 3328]
    - [39, 7.204]
  - - [5056, 448, 1, 1280]
    - [39, 7.046]
  - - [3584, 1856, 1, 3328]
    - [39, 7.566]
  - - [1408, 704, 1, 1280]
    - [19, 6.401]
  - - [2944, 1024, 1, 256]
    - [41, 6.75]
  - - [448, 1408, 1, 1280]
    - [19, 5.262]
  - - [2368, 4288, 1, 3328]
    - [39, 7.754]
  - - [1024, 1408, 1, 1280]
    - [39, 6.515]
  - - [256, 128, 1, 1280]
    - [15, 1.084]
  - - [704, 1408, 1, 1280]
    - [19, 6.397]
  - - [6784, 5056, 1, 256]
    - [38, 7.549]
  - - [4288, 5888, 1, 256]
    - [37, 7.482]
  - - [448, 2944, 1, 256]
    - [36, 5.495]
  - - [2944, 6784, 1, 256]
    - [36, 7.409]
  - - [2368, 2368, 1, 1280]
    - [39, 7.429]
  - - [1856, 3584, 1, 1280]
    - [39, 7.497]
  - - [64, 2944, 1, 256]
    - [5, 2.97]
  - - [3584, 1408, 1, 1280]
    - [39, 7.338]
  - - [5056, 3584, 1, 1280]
    - [41, 7.715]
  - - [256, 5888, 1, 256]
    - [41, 6.173]
  - - [128, 256, 1, 3328]
    - [15, 1.195]
  - - [1856, 1408, 1, 3328]
    - [39, 7.461]
  - - [1024, 4288, 1, 3328]
    - [39, 7.545]
  - - [448, 2368, 1, 256]
    - [39, 5.134]
  - - [64, 1408, 1, 1280]
    - [11, 2.646]
  - - [64, 6784, 1, 1280]
    - [24, 5.099]
  - - [2944, 2368, 1, 3328]
    - [39, 7.644]
  - - [704, 4288, 1, 3328]
    - [39, 7.25]
  - - [1024, 1856, 1, 1280]
    - [39, 6.605]
  - - [6784, 1856, 1, 256]
    - [36, 7.292]
  - - [128, 2368, 1, 3328]
    - [5, 4.643]
  - - [1024, 5888, 1, 256]
    - [36, 7.226]
  - - [64, 2944, 1, 1280]
    - [22, 4.074]
  - - [5056, 64, 1, 3328]
    - [22, 4.938]
  - - [1408, 2368, 1, 256]
    - [36, 6.845]
  - - [2944, 704, 1, 3328]
    - [39, 7.295]
  - - [256, 64, 1, 256]
    - [14, 0.367]
  - - [2944, 2944, 1, 1280]
    - [41, 7.516]
  - - [6784, 256, 1, 3328]
    - [39, 6.919]
  - - [1408, 5056, 1, 256]
    - [41, 7.166]
  - - [5056, 128, 1, 3328]
    - [23, 6.187]
  - - [128, 128, 1, 1280]
    - [14, 0.545]
  - - [448, 704, 1, 256]
    - [39, 3.084]
  - - [1856, 256, 1, 3328]
    - [28, 5.612]
  - - [2944, 128, 1, 3328]
    - [23, 5.413]
  - - [704, 256, 1, 256]
    - [19, 2.399]
  - - [256, 448, 1, 1280]
    - [11, 3.151]
  - - [704, 256, 1, 1280]
    - [29, 3.067]
  - - [64, 2368, 1, 3328]
    - [33, 3.693]
  - - [256, 704, 1, 3328]
    - [28, 3.209]
  - - [1024, 1024, 1, 256]
    - [19, 5.953]
  - - [1408, 4288, 1, 256]
    - [41, 7.045]
  - - [5888, 2368, 1, 1280]
    - [41, 7.672]
  - - [128, 256, 1, 256]
    - [9, 0.714]
  - - [256, 64, 1, 1280]
    - [14, 0.544]
  - - [2368, 5888, 1, 1280]
    - [36, 7.663]
  - - [5888, 256, 1, 1280]
    - [39, 6.798]
  - - [704, 1024, 1, 1280]
    - [39, 5.931]
  - - [2368, 1856, 1, 3328]
    - [39, 7.558]
  - - [2944, 704, 1, 256]
    - [20, 6.656]
  - - [2368, 6784, 1, 1280]
    - [37, 7.707]
  - - [2368, 1024, 1, 3328]
    - [39, 6.925]
  - - [1856, 4288, 1, 1280]
    - [39, 7.55]
  - - [704, 3584, 1, 256]
    - [36, 6.614]
  - - [704, 2944, 1, 3328]
    - [39, 7.292]
  - - [1856, 5056, 1, 3328]
    - [39, 7.756]
  - - [3584, 5056, 1, 1280]
    - [41, 7.719]
  - - [2944, 1024, 1, 3328]
    - [39, 7.241]
  - - [256, 4288, 1, 256]
    - [39, 5.291]
  - - [2368, 256, 1, 256]
    - [39, 4.428]
  - - [1408, 6784, 1, 256]
    - [36, 7.265]
  - - [6784, 1408, 1, 3328]
    - [39, 7.685]
  - - [1024, 2368, 1, 1280]
    - [39, 6.844]
  - - [704, 64, 1, 256]
    - [11, 0.99]
  - - [256, 2368, 1, 3328]
    - [19, 5.178]
  - - [6784, 2944, 1, 1280]
    - [39, 7.726]
  - - [3584, 448, 1, 1280]
    - [39, 6.31]
  - - [2944, 6784, 1, 3328]
    - [39, 7.785]
  - - [448, 5056, 1, 1280]
    - [39, 7.044]
  - - [4288, 5056, 1, 1280]
    - [36, 7.788]
  - - [128, 448, 1, 1280]
    - [30, 1.812]
  - - [4288, 704, 1, 256]
    - [17, 6.715]
  - - [64, 64, 1, 1280]
    - [30, 0.134]
  - - [5888, 704, 1, 256]
    - [41, 7.088]
  - - [256, 5888, 1, 3328]
    - [39, 6.913]
  - - [6784, 4288, 1, 256]
    - [38, 7.533]
  - - [5888, 256, 1, 256]
    - [36, 6.152]
  - - [6784, 1024, 1, 1280]
    - [39, 7.545]
  - - [704, 448, 1, 1280]
    - [19, 3.7]
  - - [128, 64, 1, 3328]
    - [11, 0.284]
  - - [448, 64, 1, 256]
    - [33, 0.654]
  - - [2944, 704, 1, 1280]
    - [39, 7.186]
  - - [6784, 3584, 1, 1280]
    - [36, 7.801]
  - - [2944, 64, 1, 1280]
    - [5, 4.096]
  - - [1408, 2944, 1, 1280]
    - [39, 7.476]
  - - [256, 1856, 1, 256]
    - [39, 4.499]
  - - [1408, 2368, 1, 3328]
    - [39, 7.417]
  - - [128, 1408, 1, 3328]
    - [5, 4.164]
  - - [2368, 2944, 1, 256]
    - [36, 7.199]
  - - [64, 5056, 1, 256]
    - [5, 3.727]
  - - [1408, 256, 1, 3328]
    - [28, 4.324]
  - - [3584, 1856, 1, 256]
    - [41, 7.182]
  - - [4288, 3584, 1, 1280]
    - [36, 7.739]
  - - [2368, 448, 1, 256]
    - [19, 5.155]
  - - [4288, 256, 1, 3328]
    - [39, 5.941]
  - - [1408, 64, 1, 256]
    - [12, 1.799]
  - - [4288, 2944, 1, 1280]
    - [39, 7.641]
  - - [5056, 448, 1, 3328]
    - [39, 7.142]
  - - [1024, 64, 1, 256]
    - [12, 1.414]
  - - [64, 2368, 1, 256]
    - [11, 2.539]
  - - [4288, 5056, 1, 3328]
    - [39, 7.845]
  - - [2944, 256, 1, 256]
    - [16, 5.342]
  - - [1024, 128, 1, 3328]
    - [33, 3.801]
  - - [256, 5056, 1, 3328]
    - [39, 6.994]
  - - [5056, 2368, 1, 256]
    - [17, 7.423]
  - - [4288, 704, 1, 3328]
    - [39, 7.249]
  - - [448, 3584, 1, 256]
    - [36, 5.802]
  - - [2368, 64, 1, 1280]
    - [11, 3.451]
  - - [1024, 1408, 1, 3328]
    - [39, 6.617]
  - - [2944, 5888, 1, 1280]
    - [36, 7.694]
  - - [5888, 3584, 1, 256]
    - [37, 7.451]
  - - [1408, 1856, 1, 3328]
    - [39, 7.464]
  - - [6784, 1408, 1, 1280]
    - [39, 7.621]
  - - [704, 2944, 1, 256]
    - [20, 6.638]
  - - [4288, 64, 1, 256]
    - [4, 3.321]
  - - [2944, 5888, 1, 3328]
    - [39, 7.754]
  - - [64, 4288, 1, 1280]
    - [4, 4.104]
  - - [6784, 64, 1, 1280]
    - [1, 5.099]
  - - [704, 1856, 1, 1280]
    - [39, 6.935]
  - - [1408, 64, 1, 3328]
    - [11, 2.829]
  - - [1408, 1408, 1, 1280]
    - [39, 6.891]
  - - [448, 1024, 1, 3328]
    - [28, 5.445]
  - - [448, 4288, 1, 3328]
    - [39, 6.763]
  - - [704, 2368, 1, 256]
    - [36, 6.033]
  - - [2944, 448, 1, 1280]
    - [19, 5.987]
  - - [5888, 2368, 1, 3328]
    - [39, 7.723]
  - - [4288, 5056, 1, 256]
    - [36, 7.476]
  - - [4288, 448, 1, 1280]
    - [39, 6.67]
  - - [5888, 704, 1, 3328]
    - [39, 7.553]
  - - [4288, 3584, 1, 3328]
    - [39, 7.799]
  - - [2944, 64, 1, 256]
    - [5, 2.97]
  - - [1024, 6784, 1, 3328]
    - [39, 7.615]
  - - [1408, 1024, 1, 256]
    - [39, 5.935]
  - - [448, 1024, 1, 256]
    - [39, 4.396]
  - - [6784, 6784, 1, 3328]
    - [41, 7.888]
  - - [1024, 448, 1, 1280]
    - [28, 5.279]
  - - [704, 5056, 1, 3328]
    - [39, 7.377]
  - - [256, 2368, 1, 1280]
    - [19, 5.053]
  - - [3584, 5056, 1, 3328]
    - [41, 7.761]
  - - [2368, 2944, 1, 3328]
    - [39, 7.639]
  - - [448, 448, 1, 1280]
    - [27, 3.786]
  - - [2368, 3584, 1, 256]
    - [36, 7.231]
  - - [1024, 256, 1, 1280]
    - [39, 4.41]
  - - [128, 5056, 1, 1280]
    - [6, 6.056]
  - - [3584, 2368, 1, 1280]
    - [39, 7.581]
  - - [1856, 1856, 1, 256]
    - [41, 6.645]
  - - [4288, 1408, 1, 3328]
    - [39, 7.43]
  - - [3584, 64, 1, 3328]
    - [27, 4.542]
  - - [1, 1, 1, 1]
    - [43, 0.0]
  - - [256, 1024, 1, 3328]
    - [28, 4.649]
  - - [1856, 64, 1, 3328]
    - [11, 3.477]
  - - [5888, 1408, 1, 3328]
    - [39, 7.692]
  - - [256, 5056, 1, 256]
    - [36, 6.128]
  - - [1856, 64, 1, 1280]
    - [33, 3.263]
  - - [1408, 256, 1, 256]
    - [39, 3.496]
  - - [2368, 5056, 1, 256]
    - [17, 7.421]
  - - [128, 5888, 1, 3328]
    - [39, 6.342]
  - - [1024, 5056, 1, 256]
    - [41, 7.17]
  - - [2368, 1408, 1, 3328]
    - [39, 7.413]
  - - [5888, 448, 1, 256]
    - [36, 6.383]
  - - [6784, 5056, 1, 1280]
    - [39, 7.825]
  - - [4288, 6784, 1, 1280]
    - [36, 7.828]
  - - [2368, 448, 1, 3328]
    - [39, 5.743]
  - - [1024, 128, 1, 256]
    - [12, 2.512]
  - - [448, 128, 1, 1280]
    - [12, 1.822]
  - - [1024, 64, 1, 3328]
    - [30, 2.228]
  - - [64, 3584, 1, 1280]
    - [27, 4.307]
  - - [6784, 1408, 1, 256]
    - [36, 7.267]
  - - [5888, 4288, 1, 256]
    - [36, 7.464]
  - - [5056, 5888, 1, 256]
    - [37, 7.587]
  - - [2368, 1024, 1, 256]
    - [36, 6.384]
  - - [1856, 6784, 1, 1280]
    - [36, 7.613]
  - - [3584, 128, 1, 1280]
    - [24, 5.361]
  - - [128, 64, 1, 256]
    - [2, 0.162]
  - - [1408, 448, 1, 256]
    - [39, 4.566]
  - - [64, 256, 1, 3328]
    - [14, 0.595]
  - - [6784, 448, 1, 3328]
    - [39, 7.296]
  - - [5056, 1856, 1, 1280]
    - [39, 7.693]
  - - [1408, 1024, 1, 3328]
    - [39, 6.617]
  - - [2368, 256, 1, 3328]
    - [19, 5.177]
  - - [5888, 3584, 1, 1280]
    - [36, 7.764]
  - - [5888, 128, 1, 1280]
    - [19, 6.218]
  - - [1024, 2944, 1, 256]
    - [41, 6.712]
  - - [448, 6784, 1, 1280]
    - [39, 7.212]
  - - [256, 3584, 1, 1280]
    - [19, 5.963]
  - - [704, 5056, 1, 256]
    - [17, 6.86]
  - - [3584, 1024, 1, 3328]
    - [39, 7.604]
  - - [2944, 1856, 1, 1280]
    - [39, 7.573]
  - - [5056, 256, 1, 256]
    - [16, 6.165]
  - - [128, 5888, 1, 256]
    - [0, 5.39]
  - - [2368, 3584, 1, 3328]
    - [39, 7.641]
  - - [3584, 5888, 1, 3328]
    - [39, 7.82]
  - - [2944, 3584, 1, 1280]
    - [39, 7.609]
  - - [1856, 5888, 1, 1280]
    - [39, 7.688]
  - - [256, 256, 1, 1280]
    - [30, 2.055]
  - - [4288, 1408, 1, 256]
    - [37, 7.032]
  - - [3584, 64, 1, 256]
    - [21, 3.351]
  - - [64, 1856, 1, 3328]
    - [11, 3.474]
  - - [1408, 128, 1, 256]
    - [22, 2.878]
  - - [4288, 2368, 1, 1280]
    - [39, 7.686]
  - - [2944, 5056, 1, 256]
    - [36, 7.426]
  - - [256, 128, 1, 3328]
    - [15, 1.195]
  - - [6784, 2368, 1, 256]
    - [38, 7.448]
  - - [1408, 448, 1, 3328]
    - [19, 5.388]
  - - [4288, 1856, 1, 256]
    - [36, 7.198]
  - - [1856, 2944, 1, 256]
    - [36, 7.165]
  - - [64, 5888, 1, 1280]
    - [18, 4.993]
  - - [1856, 1408, 1, 1280]
    - [39, 7.352]
  - - [128, 704, 1, 256]
    - [8, 1.784]
  - - [1024, 4288, 1, 1280]
    - [39, 7.466]
  - - [2368, 5056, 1, 3328]
    - [39, 7.773]
  - - [4288, 1024, 1, 3328]
    - [39, 7.548]
  - - [1024, 5056, 1, 3328]
    - [39, 7.603]
  - - [1024, 1856, 1, 3328]
    - [39, 6.69]
  - - [704, 704, 1, 1280]
    - [19, 5.692]
  - - [128, 2368, 1, 1280]
    - [5, 4.46]
  - - [3584, 256, 1, 1280]
    - [19, 5.973]
  - - [5888, 64, 1, 1280]
    - [23, 5.224]
  - - [128, 704, 1, 3328]
    - [33, 2.829]
  - - [3584, 2944, 1, 3328]
    - [39, 7.671]
  - - [128, 1856, 1, 256]
    - [21, 3.408]
  - - [64, 4288, 1, 256]
    - [4, 3.304]
  - - [5888, 2944, 1, 256]
    - [36, 7.383]
  - - [5056, 128, 1, 1280]
    - [6, 6.052]
  - - [448, 1856, 1, 3328]
    - [19, 5.53]
  - - [5056, 4288, 1, 256]
    - [36, 7.473]
  - - [1024, 448, 1, 256]
    - [19, 4.379]
  - - [1024, 3584, 1, 256]
    - [41, 7.051]
  - - [2944, 128, 1, 1280]
    - [23, 5.237]
  - - [64, 256, 1, 256]
    - [8, 0.36]
  - - [704, 256, 1, 3328]
    - [29, 3.186]
  - - [5056, 1408, 1, 256]
    - [37, 7.163]
  - - [5888, 5888, 1, 1280]
    - [39, 7.794]
  - - [448, 5888, 1, 1280]
    - [39, 6.807]
  - - [1, 1, 1, 256]
    - [44, 0.0]
  - - [4288, 704, 1, 1280]
    - [39, 7.166]
  - - [2944, 1408, 1, 256]
    - [38, 7.053]
  - - [256, 2944, 1, 1280]
    - [39, 6.213]
  - - [2368, 5888, 1, 3328]
    - [39, 7.725]
  - - [704, 1024, 1, 3328]
    - [19, 6.081]
  - - [2368, 1856, 1, 1280]
    - [39, 7.472]
  - - [1856, 448, 1, 1280]
    - [19, 5.437]
  - - [128, 6784, 1, 256]
    - [6, 5.432]
  - - [5888, 4288, 1, 3328]
    - [39, 7.826]
  - - [1856, 128, 1, 256]
    - [3, 3.492]
  - - [5056, 448, 1, 256]
    - [36, 6.538]
  - - [1856, 5056, 1, 1280]
    - [39, 7.688]
  - - [2944, 1024, 1, 1280]
    - [39, 7.157]
  - - [2368, 4288, 1, 256]
    - [36, 7.34]
  - - [1024, 2368, 1, 3328]
    - [39, 6.927]
  - - [4288, 64, 1, 3328]
    - [25, 4.235]
  - - [704, 1408, 1, 256]
    - [39, 5.695]
  - - [4288, 5888, 1, 3328]
    - [39, 7.824]
  - - [448, 2944, 1, 1280]
    - [39, 5.964]
  - - [1024, 2944, 1, 3328]
    - [39, 7.241]
  - - [256, 6784, 1, 1280]
    - [39, 6.814]
  - - [1856, 3584, 1, 256]
    - [37, 7.178]
  - - [128, 448, 1, 3328]
    - [8, 1.954]
  - - [1856, 256, 1, 256]
    - [19, 4.517]
  - - [5056, 128, 1, 256]
    - [6, 5.203]
  - - [256, 5888, 1, 1280]
    - [39, 6.803]
  - - [6784, 128, 1, 1280]
    - [23, 6.097]
  - - [64, 1408, 1, 256]
    - [11, 1.83]
  - - [2944, 2368, 1, 256]
    - [36, 7.196]
  - - [1856, 448, 1, 256]
    - [39, 4.859]
  - - [1024, 1856, 1, 256]
    - [20, 6.112]
  - - [6784, 3584, 1, 3328]
    - [39, 7.853]
  - - [2944, 64, 1, 3328]
    - [5, 4.34]
  - - [1024, 5888, 1, 3328]
    - [39, 7.73]
  - - [1408, 2368, 1, 1280]
    - [39, 7.334]
  - - [128, 1408, 1, 1280]
    - [5, 3.925]
  - - [128, 1856, 1, 3328]
    - [31, 4.71]
  - - [2944, 2944, 1, 256]
    - [37, 7.232]
  - - [6784, 256, 1, 256]
    - [36, 6.219]
  - - [128, 4288, 1, 1280]
    - [3, 5.222]
  - - [5888, 1408, 1, 256]
    - [41, 7.321]
  - - [128, 128, 1, 256]
    - [7, 0.37]
  - - [448, 704, 1, 3328]
    - [19, 3.8]
  - - [448, 1856, 1, 256]
    - [36, 4.823]
  - - [1856, 704, 1, 3328]
    - [39, 7.06]
  - - [5888, 6784, 1, 3328]
    - [39, 7.867]
  - - [704, 4288, 1, 1280]
    - [39, 7.166]
  - - [4096, 7000, 1, 4096]
    - [68, 12.773]
  - - [5124, 9124, 1, 1760]
    - [67, 13.175]
  - - [1760, 32, 1, 1760]
    - [50, 1.546]
  - - [1024, 1500, 1, 1536]
    - [61, 10.666]
  - - [512, 24000, 1, 2048]
    - [70, 11.656]
  - - [3072, 24000, 1, 1024]
    - [68, 13.246]
  - - [1024, 3000, 1, 2560]
    - [68, 12.434]
  - - [512, 3136, 1, 2048]
    - [78, 9.51]
  - - [7680, 4, 1, 2560]
    - [50, 0.845]
  - - [64, 193600, 1, 64]
    - [67, 10.056]
  - - [8448, 1500, 1, 2816]
    - [67, 12.603]
  - - [2560, 7000, 1, 2560]
    - [67, 12.934]
  - - [3072, 16, 1, 1024]
    - [46, 1.27]
  - - [512, 48000, 1, 2048]
    - [70, 11.976]
  - - [1760, 64, 1, 1760]
    - [63, 3.113]
  - - [1024, 16, 1, 512]
    - [48, 0.33]
  - - [196, 256, 64, 1024]
    - [475, 35.741]
  - - [512, 48000, 1, 1536]
    - [68, 13.24]
  - - [2560, 32, 1, 2560]
    - [50, 2.274]
  - - [4608, 1500, 1, 1536]
    - [68, 12.359]
  - - [2048, 128, 1, 2048]
    - [65, 6.344]
  - - [1024, 24000, 1, 2560]
    - [67, 13.286]
  - - [4608, 3000, 1, 1536]
    - [68, 12.652]
  - - [5124, 9124, 1, 2048]
    - [68, 12.228]
  - - [2048, 16, 1, 2048]
    - [49, 0.912]
  - - [1024, 700, 1, 512]
    - [60, 7.038]
  - - [3072, 1, 1, 128]
    - [46, 0.043]
  - - [5124, 700, 1, 2560]
    - [68, 11.017]
  - - [8448, 16, 1, 2816]
    - [47, 3.503]
  - - [6144, 6000, 1, 2560]
    - [62, 12.359]
  - - [4608, 32, 1, 1536]
    - [46, 3.84]
  - - [3072, 64, 1, 1024]
    - [58, 4.794]
  - - [512, 16, 1, 512]
    - [48, 0.165]
  - - [7680, 2, 1, 2560]
    - [50, 0.424]
  - - [4224, 1, 1, 128]
    - [46, 0.059]
  - - [7680, 1, 1, 2560]
    - [50, 0.212]
  - - [128, 1500, 1, 1280]
    - [46, 4.893]
  - - [1024, 1500, 1, 2816]
    - [61, 10.873]
  - - [6144, 2, 1, 2560]
    - [50, 0.337]
  - - [8448, 48000, 1, 2816]
    - [68, 11.618]
  - - [512, 6000, 1, 2048]
    - [71, 9.075]
  - - [4224, 1500, 1, 176]
    - [56, 10.499]
  - - [1024, 6000, 1, 2816]
    - [67, 13.17]
  - - [1024, 48000, 1, 1536]
    - [68, 13.536]
  - - [1024, 48000, 1, 2560]
    - [67, 13.667]
  - - [4096, 32, 1, 4096]
    - [51, 3.615]
  - - [512, 16, 1, 500000]
    - [48, 0.248]
  - - [2560, 128, 1, 2560]
    - [63, 6.493]
  - - [4608, 24000, 1, 1536]
    - [67, 13.7]
  - - [512, 2, 1, 500000]
    - [48, 0.031]
  - - [7680, 48000, 1, 2560]
    - [68, 11.713]
  - - [3072, 48000, 1, 1024]
    - [68, 13.466]
  - - [1760, 16, 1, 1760]
    - [46, 0.776]
  - - [1024, 1500, 1, 2048]
    - [64, 8.337]
  - - [1024, 16, 1, 500000]
    - [48, 0.495]
  - - [64, 193600, 1, 256]
    - [72, 11.737]
  - - [1024, 3000, 1, 2048]
    - [69, 9.114]
  - - [6144, 4, 1, 2560]
    - [50, 0.678]
  - - [1024, 6000, 1, 2048]
    - [70, 10.898]
  - - [512, 24000, 1, 2816]
    - [67, 13.314]
  - - [6144, 48000, 1, 2560]
    - [70, 10.807]
  - - [1760, 7000, 1, 1760]
    - [57, 12.493]
  - - [8448, 3000, 1, 2816]
    - [67, 13.199]
  - - [3072, 4, 1, 1024]
    - [46, 0.317]
  - - [4608, 48000, 1, 1536]
    - [67, 13.803]
  - - [2048, 32, 1, 2048]
    - [66, 1.802]
  - - [7680, 1500, 1, 2560]
    - [68, 12.174]
  - - [4096, 128, 1, 4096]
    - [59, 8.618]
  - - [4608, 16, 1, 1536]
    - [50, 1.988]
  - - [512, 3000, 1, 1536]
    - [61, 10.677]
  - - [3072, 2, 1, 1024]
    - [46, 0.161]
  - - [8448, 1, 1, 2816]
    - [47, 0.217]
  - - [1024, 3000, 1, 2816]
    - [67, 12.729]
  - - [128, 1, 1, 1408]
    - [46, 0.004]
  - - [64, 1, 1, 1216]
    - [48, 0.002]
  - - [1024, 2, 1, 512]
    - [48, 0.041]
  - - [1024, 4, 1, 500000]
    - [48, 0.124]
  - - [6144, 1, 1, 2560]
    - [50, 0.17]
  - - [5124, 9124, 1, 2560]
    - [68, 12.812]
  - - [512, 48000, 1, 2816]
    - [67, 13.521]
  - - [512, 3000, 1, 2816]
    - [61, 10.878]
  - - [1024, 24000, 1, 1536]
    - [68, 13.198]
  - - [7680, 6000, 1, 2560]
    - [67, 13.271]
  - - [1760, 128, 1, 1760]
    - [65, 5.613]
  - - [512, 1500, 1, 2816]
    - [60, 8.44]
  - - [512, 1, 1, 512]
    - [52, 0.012]
  - - [512, 6000, 1, 2560]
    - [68, 12.47]
  - - [512, 8, 1, 500000]
    - [48, 0.124]
  - - [512, 24000, 1, 2560]
    - [68, 13.148]
  - - [6144, 3000, 1, 2560]
    - [70, 12.058]
  - - [1024, 24000, 1, 2816]
    - [67, 13.579]
  - - [2048, 7000, 1, 2048]
    - [70, 11.849]
  - - [7680, 3000, 1, 2560]
    - [62, 12.113]
  - - [1024, 4, 1, 512]
    - [48, 0.083]
  - - [5124, 700, 1, 2048]
    - [70, 9.788]
  - - [5124, 9124, 1, 4096]
    - [62, 11.835]
  - - [4096, 64, 1, 4096]
    - [66, 6.296]
  - - [256, 193600, 1, 64]
    - [54, 10.826]
  - - [7680, 32, 1, 2560]
    - [53, 6.365]
  - - [2560, 64, 1, 2560]
    - [58, 4.4]
  - - [3072, 128, 1, 1024]
    - [63, 7.123]
  - - [8448, 6000, 1, 2816]
    - [68, 13.321]
  - - [7680, 64, 1, 2560]
    - [48, 8.357]
  - - [5124, 1500, 1, 2560]
    - [68, 12.081]
  - - [1024, 1500, 1, 2560]
    - [61, 10.817]
  - - [512, 4, 1, 512]
    - [52, 0.048]
  - - [1024, 6000, 1, 2560]
    - [68, 12.881]
  - - [3072, 32, 1, 1024]
    - [66, 2.519]
  - - [6144, 32, 1, 2560]
    - [58, 5.153]
  - - [196, 1024, 64, 256]
    - [350, 34.851]
  - - [512, 50176, 1, 128]
    - [74, 11.895]
  - - [4608, 1, 1, 1536]
    - [50, 0.124]
  - - [1024, 32, 1, 512]
    - [48, 0.68]
  - - [7680, 24000, 1, 2560]
    - [68, 12.896]
  - - [8448, 4, 1, 2816]
    - [50, 0.865]
  - - [512, 1, 1, 500000]
    - [48, 0.015]
  - - [176, 1500, 1, 1408]
    - [48, 5.049]
  - - [512, 3000, 1, 2560]
    - [61, 10.833]
  - - [8448, 24000, 1, 2816]
    - [68, 10.875]
  - - [4608, 2, 1, 1536]
    - [50, 0.247]
  - - [512, 6000, 1, 1536]
    - [68, 12.29]
  - - [7680, 128, 1, 2560]
    - [55, 10.352]
  - - [3072, 6000, 1, 1024]
    - [68, 12.559]
  - - [3072, 1500, 1, 128]
    - [67, 9.65]
  - - [2048, 3136, 1, 512]
    - [76, 11.759]
  - - [1024, 3000, 1, 1536]
    - [68, 12.253]
  - - [512, 4, 1, 500000]
    - [48, 0.062]
  - - [512, 6000, 1, 2816]
    - [68, 12.517]
  - - [128, 50176, 1, 512]
    - [73, 11.932]
  - - [256, 12544, 1, 1024]
    - [77, 10.481]
  - - [1024, 12544, 1, 256]
    - [75, 12.265]
  - - [512, 48000, 1, 2560]
    - [68, 13.287]
  - - [2560, 16, 1, 2560]
    - [46, 1.149]
  - - [2048, 64, 1, 2048]
    - [66, 3.533]
  - - [512, 2, 1, 512]
    - [52, 0.024]
  - - [1024, 1, 1, 512]
    - [48, 0.021]
  - - [512, 1500, 1, 2560]
    - [60, 8.273]
  - - [512, 24000, 1, 1536]
    - [68, 13.079]
  - - [1024, 1, 1, 500000]
    - [48, 0.031]
  - - [6144, 16, 1, 2560]
    - [50, 2.707]
  - - [1024, 24000, 1, 2048]
    - [70, 11.97]
  - - [4096, 16, 1, 4096]
    - [51, 1.878]
  - - [512, 32, 1, 512]
    - [48, 0.341]
  - - [5124, 1500, 1, 2048]
    - [70, 10.763]
  - - [3072, 1500, 1, 1024]
    - [61, 10.993]
  - - [1024, 2, 1, 500000]
    - [48, 0.062]
  - - [1024, 8, 1, 500000]
    - [48, 0.247]
  - - [7680, 16, 1, 2560]
    - [50, 3.38]
  - - [6144, 1500, 1, 2560]
    - [68, 12.713]
  - - [3072, 1, 1, 1024]
    - [46, 0.08]
  - - [1024, 48000, 1, 2816]
    - [67, 13.914]
  - - [8448, 2, 1, 2816]
    - [50, 0.434]
  - - [4608, 4, 1, 1536]
    - [50, 0.493]
  - - [1024, 6000, 1, 1536]
    - [68, 12.801]
  - - [8448, 32, 1, 2816]
    - [48, 5.401]
  - - [512, 3000, 1, 2048]
    - [70, 8.347]
  - - [6144, 24000, 1, 2560]
    - [70, 11.945]
  - - [4608, 6000, 1, 1536]
    - [68, 13.229]
  - - [1024, 1024, 1, 1024]
    - [213, 47.398]
  - - [512, 1500, 1, 2048]
    - [70, 6.937]
  - - [512, 1500, 1, 1536]
    - [60, 8.099]
  - - [128, 1, 1, 1024]
    - [46, 0.003]
  - - [3072, 3000, 1, 1024]
    - [70, 11.785]
  - - [1024, 48000, 1, 2048]
    - [68, 12.578]
  - - [3136, 64, 128, 64]
    - [448, 20.681]
  - - [784, 512, 64, 128]
    - [338, 39.554]
  - - [3136, 256, 64, 64]
    - [332, 32.257]
  - - [12544, 1024, 1, 256]
    - [83, 15.558]
  - - [784, 128, 128, 512]
    - [438, 47.6]
  - - [784, 512, 256, 128]
    - [451, 44.215]
  - - [3136, 64, 64, 256]
    - [439, 30.2]
  - - [3136, 512, 1, 2048]
    - [84, 11.648]
  - - [12544, 256, 1, 1024]
    - [86, 13.213]
  - - [3136, 2048, 1, 512]
    - [82, 14.598]
  - - [3136, 256, 256, 64]
    - [429, 33.595]
  - - [3136, 64, 128, 256]
    - [449, 31.195]
  - - [784, 128, 64, 512]
    - [333, 43.65]
  - - [3136, 64, 256, 64]
    - [448, 21.949]
  - - [784, 512, 128, 128]
    - [451, 41.982]
  - - [3136, 64, 64, 64]
    - [393, 18.996]
  - - [784, 128, 256, 512]
    - [382, 48.943]
  - - [3136, 64, 256, 256]
    - [450, 31.701]
  - - [3136, 256, 128, 64]
    - [448, 33.072]
  - - [64, 14, 1, 14]
    - [90, 0.001]
  - - [64, 14, 1, 15]
    - [90, 0.001]
  - - [64, 15, 1, 15]
    - [89, 0.001]
  - - [64, 15, 1, 15]
    - [89, 0.001]
  - - [64, 15, 1, 17]
    - [89, 0.001]
  - - [64, 17, 1, 17]
    - [89, 0.001]
  - - [64, 17, 1, 17]
    - [89, 0.001]
  - - [64, 17, 1, 21]
    - [90, 0.002]
  - - [64, 21, 1, 21]
    - [90, 0.003]
  - - [64, 24, 1, 24]
    - [90, 0.004]
  - - [64, 24, 1, 34]
    - [90, 0.004]
  - - [64, 30, 1, 30]
    - [90, 0.005]
  - - [64, 31, 1, 30]
    - [94, 0.006]
  - - [64, 31, 1, 31]
    - [95, 0.006]
  - - [64, 32, 1, 32]
    - [91, 0.007]
  - - [64, 34, 1, 34]
    - [93, 0.007]
  - - [64, 35, 1, 32]
    - [92, 0.007]
  - - [64, 35, 1, 35]
    - [90, 0.007]
  - - [64, 128, 512, 128]
    - [391, 16.26]
  - - [64, 512, 1, 512]
    - [219, 2.453]
  - - [64, 512, 64, 512]
    - [145, 25.121]
  - - [128, 128, 512, 64]
    - [382, 20.934]
  - - [512, 512, 1, 64]
    - [273, 4.243]
  - - [512, 512, 64, 64]
    - [258, 29.641]
  - - [1024, 4, 1, 2]
    - [218, 0.002]
  - - [1024, 4, 1, 1024]
    - [219, 0.374]
  - - [1024, 32, 1, 2]
    - [218, 0.016]
  - - [1024, 32, 1, 1024]
    - [239, 2.881]
  - - [1024, 2048, 1, 2]
    - [242, 0.478]
  - - [1024, 2048, 1, 1024]
    - [243, 47.85]
  - - [1024, 2048, 1, 4096]
    - [244, 61.318]
  - - [1024, 2048, 1, 30528]
    - [392, 77.02]
  - - [1024, 4096, 1, 1024]
    - [370, 63.498]
  - - [1024, 4096, 1, 4096]
    - [225, 74.606]
  - - [1024, 4096, 1, 30528]
    - [225, 81.85]
  - - [4096, 2048, 1, 1024]
    - [378, 63.297]
  - - [4096, 4096, 1, 1024]
    - [371, 70.453]
  - - [32, 33, 1600, 33]
    - [272, 2.836]
  - - [32, 200, 1, 1]
    - [403, 0.001]
  - - [64, 3, 512, 3]
    - [270, 0.042]
  - - [64, 5, 512, 5]
    - [259, 0.116]
  - - [64, 5, 960, 5]
    - [268, 0.171]
  - - [64, 9, 512, 9]
    - [259, 0.382]
  - - [64, 512, 1, 1]
    - [218, 0.008]
  - - [67, 512, 1, 2048]
    - [471, 4.413]
  - - [74, 512, 1, 2048]
    - [470, 4.874]
  - - [74, 960, 1, 2048]
    - [472, 7.32]
  - - [100, 512, 1, 2048]
    - [473, 5.983]
  - - [128, 27, 32768, 27]
    - [259, 5.027]
  - - [256, 1024, 1, 1]
    - [278, 0.06]
  - - [256, 8976, 1, 1536]
    - [281, 57.948]
  - - [256, 8976, 1, 2048]
    - [404, 60.495]
  - - [256, 8976, 1, 2304]
    - [244, 62.087]
  - - [256, 8976, 1, 2560]
    - [282, 62.771]
  - - [256, 8976, 1, 2816]
    - [281, 63.476]
  - - [256, 8976, 1, 3072]
    - [244, 64.075]
  - - [256, 8976, 1, 4352]
    - [244, 67.425]
  - - [256, 8976, 1, 4864]
    - [404, 62.783]
  - - [256, 8976, 1, 5376]
    - [281, 66.825]
  - - [256, 8976, 1, 5632]
    - [405, 66.362]
  - - [256, 8976, 1, 5888]
    - [406, 66.187]
  - - [256, 8976, 1, 6144]
    - [407, 66.896]
  - - [256, 8976, 1, 6656]
    - [408, 68.32]
  - - [256, 8976, 1, 7168]
    - [408, 69.527]
  - - [256, 8976, 1, 7424]
    - [392, 69.836]
  - - [256, 8976, 1, 8192]
    - [409, 70.016]
  - - [256, 8976, 1, 8448]
    - [410, 72.176]
  - - [256, 8976, 1, 8960]
    - [406, 72.818]
  - - [256, 8976, 1, 9472]
    - [392, 73.348]
  - - [256, 8976, 1, 9728]
    - [407, 73.971]
  - - [256, 8976, 1, 9984]
    - [410, 74.47]
  - - [256, 8976, 1, 10240]
    - [392, 74.267]
  - - [256, 8976, 1, 10496]
    - [406, 75.035]
  - - [256, 8976, 1, 11008]
    - [392, 75.388]
  - - [256, 8976, 1, 11520]
    - [410, 76.271]
  - - [256, 8976, 1, 12288]
    - [408, 76.815]
  - - [256, 8976, 1, 14336]
    - [410, 78.844]
  - - [256, 8976, 1, 14848]
    - [408, 78.974]
  - - [256, 8976, 1, 15104]
    - [409, 79.122]
  - - [256, 8976, 1, 15872]
    - [392, 79.431]
  - - [256, 8976, 1, 17152]
    - [411, 79.732]
  - - [256, 8976, 1, 19712]
    - [410, 81.564]
  - - [256, 8976, 1, 19968]
    - [412, 81.217]
  - - [256, 8976, 1, 20480]
    - [409, 81.496]
  - - [256, 8976, 1, 20992]
    - [408, 81.689]
  - - [256, 8976, 1, 22016]
    - [392, 81.655]
  - - [256, 8976, 1, 26112]
    - [408, 83.348]
  - - [256, 8976, 1, 33536]
    - [409, 85.013]
  - - [256, 8976, 1, 44505]
    - [406, 81.409]
  - - [256, 32768, 1, 128]
    - [382, 34.413]
  - - [257, 1024, 1, 4096]
    - [474, 22.926]
  - - [480, 32768, 1, 1024]
    - [208, 67.59]
  - - [512, 200, 1, 1]
    - [238, 0.03]
  - - [512, 200, 1, 32]
    - [229, 1.022]
  - - [512, 215, 1, 2048]
    - [413, 10.82]
  - - [512, 256, 1, 2048]
    - [414, 12.436]
  - - [512, 1600, 1, 32]
    - [280, 6.814]
  - - [512, 1600, 1, 512]
    - [223, 31.912]
  - - [512, 32768, 1, 256]
    - [258, 53.807]
  - - [560, 200, 1, 1024]
    - [286, 8.451]
  - - [560, 1600, 1, 1024]
    - [279, 35.777]
  - - [768, 215, 1, 2048]
    - [415, 15.07]
  - - [768, 256, 1, 2048]
    - [416, 17.526]
  - - [1024, 200, 1, 1]
    - [269, 0.052]
  - - [1024, 512, 1, 1]
    - [288, 0.103]
  - - [1024, 512, 1, 64]
    - [276, 7.851]
  - - [1024, 512, 1, 1024]
    - [222, 28.875]
  - - [1024, 960, 1, 64]
    - [289, 12.527]
  - - [1024, 960, 1, 1024]
    - [213, 45.953]
  - - [1024, 1600, 1, 1]
    - [290, 0.236]
  - - [1024, 1600, 1, 1024]
    - [237, 45.509]
  - - [1024, 1792, 1, 256]
    - [291, 35.453]
  - - [1024, 2048, 1, 256]
    - [292, 32.002]
  - - [1024, 2560, 1, 256]
    - [252, 35.887]
  - - [1024, 3072, 1, 256]
    - [258, 37.682]
  - - [1024, 3328, 1, 256]
    - [258, 39.633]
  - - [1024, 3840, 1, 256]
    - [255, 45.291]
  - - [1024, 4096, 1, 256]
    - [293, 43.5]
  - - [1024, 4608, 1, 256]
    - [252, 40.664]
  - - [1024, 4864, 1, 256]
    - [258, 42.314]
  - - [1024, 5120, 1, 256]
    - [258, 41.592]
  - - [1024, 5632, 1, 256]
    - [258, 43.448]
  - - [1024, 6144, 1, 256]
    - [209, 46.521]
  - - [1024, 6400, 1, 256]
    - [261, 47.291]
  - - [1024, 7168, 1, 256]
    - [261, 52.026]
  - - [1024, 7424, 1, 256]
    - [261, 53.41]
  - - [1024, 7680, 1, 256]
    - [261, 54.93]
  - - [1024, 7936, 1, 256]
    - [258, 46.134]
  - - [1024, 8192, 1, 256]
    - [258, 46.956]
  - - [1024, 8448, 1, 256]
    - [258, 48.085]
  - - [1024, 8704, 1, 256]
    - [294, 48.863]
  - - [1024, 8960, 1, 256]
    - [295, 49.396]
  - - [1024, 9728, 1, 256]
    - [209, 50.348]
  - - [1024, 9984, 1, 256]
    - [261, 51.241]
  - - [1024, 10240, 1, 256]
    - [261, 51.903]
  - - [1024, 10496, 1, 256]
    - [261, 52.982]
  - - [1024, 11008, 1, 256]
    - [261, 55.112]
  - - [1024, 11264, 1, 256]
    - [296, 55.156]
  - - [1024, 11520, 1, 256]
    - [261, 56.074]
  - - [1024, 12288, 1, 256]
    - [208, 49.744]
  - - [1024, 13312, 1, 256]
    - [261, 51.673]
  - - [1024, 13568, 1, 256]
    - [261, 52.667]
  - - [1024, 14336, 1, 256]
    - [261, 55.385]
  - - [1024, 14592, 1, 256]
    - [261, 55.846]
  - - [1024, 14848, 1, 256]
    - [261, 56.738]
  - - [1024, 15104, 1, 256]
    - [261, 57.358]
  - - [1024, 16128, 1, 256]
    - [249, 52.06]
  - - [1024, 17152, 1, 256]
    - [261, 53.946]
  - - [1024, 18944, 1, 256]
    - [261, 57.804]
  - - [1024, 19712, 1, 256]
    - [297, 53.553]
  - - [1024, 19968, 1, 256]
    - [296, 54.129]
  - - [1024, 20480, 1, 256]
    - [399, 54.73]
  - - [1024, 20992, 1, 256]
    - [418, 55.494]
  - - [1024, 21504, 1, 256]
    - [261, 56.062]
  - - [1024, 22016, 1, 256]
    - [261, 57.458]
  - - [1024, 23552, 1, 256]
    - [297, 54.871]
  - - [1024, 28672, 1, 256]
    - [399, 57.467]
  - - [1024, 32768, 1, 512]
    - [383, 73.08]
  - - [1024, 32768, 1, 1024]
    - [209, 80.893]
  - - [1024, 33536, 1, 256]
    - [296, 58.598]
  - - [1024, 40448, 1, 256]
    - [296, 58.889]
  - - [1600, 512, 1, 1024]
    - [298, 38.863]
  - - [2048, 512, 1, 1]
    - [233, 0.163]
  - - [2048, 512, 1, 2048]
    - [277, 44.072]
  - - [2048, 960, 1, 2048]
    - [244, 54.454]
  - - [2048, 1024, 1, 1]
    - [224, 0.249]
  - - [2048, 1024, 1, 256]
    - [299, 33.72]
  - - [3200, 1024, 1, 2048]
    - [146, 64.946]
  - - [4096, 1024, 1, 1]
    - [300, 0.344]
  - - [64, 14, 10880, 14]
    - [401, 1.545]
  - - [64, 14, 10880, 15]
    - [393, 1.667]
  - - [64, 15, 7680, 15]
    - [259, 1.734]
  - - [64, 15, 10880, 15]
    - [402, 1.773]
  - - [64, 15, 7680, 17]
    - [259, 1.78]
  - - [64, 17, 6144, 17]
    - [259, 1.923]
  - - [64, 17, 7680, 17]
    - [269, 2.011]
  - - [64, 17, 6144, 21]
    - [259, 2.309]
  - - [64, 21, 6144, 21]
    - [259, 2.793]
  - - [64, 24, 4736, 24]
    - [269, 3.575]
  - - [64, 24, 4736, 34]
    - [259, 3.897]
  - - [64, 30, 2048, 30]
    - [270, 4.296]
  - - [64, 31, 2048, 30]
    - [401, 4.439]
  - - [64, 31, 2048, 31]
    - [402, 4.517]
  - - [64, 32, 4608, 32]
    - [402, 7.457]
  - - [64, 34, 4736, 34]
    - [271, 3.718]
  - - [64, 35, 4608, 32]
    - [259, 6.563]
  - - [64, 35, 4608, 35]
    - [272, 3.604]
  - - [1024, 3840, 1, 1024]
    - [212, 67.773]
  - - [1024, 3840, 1, 4096]
    - [387, 80.775]
  - - [1024, 3968, 1, 1024]
    - [245, 55.625]
  - - [1024, 3968, 1, 4096]
    - [215, 71.973]
  - - [1024, 3968, 1, 42720]
    - [225, 79.723]
  - - [1024, 6528, 1, 1024]
    - [212, 66.728]
  - - [1024, 6528, 1, 4096]
    - [255, 76.26]
  - - [1024, 6528, 1, 42720]
    - [262, 81.671]
  - - [1024, 7104, 1, 1024]
    - [263, 71.061]
  - - [1024, 7104, 1, 4096]
    - [365, 85.169]
  - - [1024, 7104, 1, 42720]
    - [264, 87.619]
  - - [1024, 7200, 1, 1024]
    - [261, 70.372]
  - - [1024, 7200, 1, 4096]
    - [265, 81.94]
  - - [1024, 7200, 1, 42720]
    - [266, 88.897]
  - - [1024, 8064, 1, 1024]
    - [370, 63.559]
  - - [1024, 8064, 1, 4096]
    - [394, 75.381]
  - - [1024, 8160, 1, 1024]
    - [225, 68.97]
  - - [1024, 8160, 1, 4096]
    - [225, 78.273]
  - - [1024, 9216, 1, 1024]
    - [396, 69.781]
  - - [1024, 9216, 1, 4096]
    - [225, 85.056]
  - - [1024, 9520, 1, 1024]
    - [394, 70.825]
  - - [1024, 9520, 1, 4096]
    - [225, 81.892]
  - - [1024, 9520, 1, 42720]
    - [225, 95.257]
  - - [1024, 10064, 1, 1024]
    - [208, 70.743]
  - - [1024, 10064, 1, 4096]
    - [261, 78.255]
  - - [1024, 10080, 1, 1024]
    - [395, 71.008]
  - - [1024, 10080, 1, 4096]
    - [366, 78.425]
  - - [1024, 10080, 1, 42720]
    - [262, 83.612]
  - - [1024, 10200, 1, 1024]
    - [261, 68.982]
  - - [1024, 10200, 1, 4096]
    - [395, 79.249]
  - - [4096, 3840, 1, 1024]
    - [207, 81.562]
  - - [4096, 3968, 1, 1024]
    - [383, 69.938]
  - - [4096, 6528, 1, 1024]
    - [208, 73.546]
  - - [4096, 7104, 1, 1024]
    - [209, 76.88]
  - - [4096, 7200, 1, 1024]
    - [398, 77.641]
  - - [4096, 8064, 1, 1024]
    - [399, 76.235]
  - - [4096, 8160, 1, 1024]
    - [366, 77.179]
  - - [4096, 9216, 1, 1024]
    - [400, 80.692]
  - - [4096, 9520, 1, 1024]
    - [209, 78.487]
  - - [4096, 10064, 1, 1024]
    - [383, 76.452]
  - - [4096, 10080, 1, 1024]
    - [397, 77.066]
  - - [4096, 10200, 1, 1024]
    - [208, 78.105]
  - - [64, 27, 1920, 27]
    - [107, 2.194]
  - - [64, 33, 1920, 27]
    - [105, 2.334]
  - - [64, 33, 1920, 33]
    - [106, 2.746]
  - - [1024, 3240, 1, 1024]
    - [111, 46.687]
  - - [1024, 3240, 1, 4096]
    - [109, 61.646]
  - - [1024, 3960, 1, 1024]
    - [104, 40.819]
  - - [1024, 3960, 1, 4096]
    - [102, 42.95]
  - - [1024, 3960, 1, 42720]
    - [108, 48.607]
  - - [4096, 3240, 1, 1024]
    - [113, 57.754]
  - - [4096, 3960, 1, 1024]
    - [112, 59.012]
  - - [64, 192, 64, 1280]
    - [339, 25.392]
  - - [64, 320, 64, 1280]
    - [340, 27.448]
  - - [64, 384, 64, 1280]
    - [440, 31.559]
  - - [64, 448, 64, 1280]
    - [441, 30.403]
  - - [64, 192, 64, 2048]
    - [204, 24.508]
  - - [64, 320, 64, 2048]
    - [200, 27.545]
  - - [64, 384, 64, 2048]
    - [341, 30.604]
  - - [64, 448, 64, 2048]
    - [189, 30.85]
  - - [1225, 32, 64, 192]
    - [356, 14.175]
  - - [1225, 48, 64, 192]
    - [476, 15.127]
  - - [1225, 64, 64, 192]
    - [477, 22.941]
  - - [1225, 48, 64, 256]
    - [476, 17.371]
  - - [1225, 64, 64, 256]
    - [478, 25.522]
  - - [1225, 48, 64, 288]
    - [479, 17.983]
  - - [1225, 64, 64, 288]
    - [480, 27.21]
  - - [5329, 80, 64, 64]
    - [359, 12.717]
  - - [289, 128, 64, 768]
    - [481, 31.746]
  - - [289, 160, 64, 768]
    - [482, 34.529]
  - - [289, 192, 64, 768]
    - [483, 37.479]
  - - [64, 192, 32, 1280]
    - [342, 21.508]
  - - [64, 320, 32, 1280]
    - [343, 25.908]
  - - [64, 384, 32, 1280]
    - [344, 28.986]
  - - [64, 448, 32, 1280]
    - [442, 29.387]
  - - [64, 192, 32, 2048]
    - [345, 21.845]
  - - [64, 320, 32, 2048]
    - [443, 26.897]
  - - [64, 384, 32, 2048]
    - [444, 29.847]
  - - [64, 448, 32, 2048]
    - [189, 30.215]
  - - [1225, 32, 32, 192]
    - [361, 12.453]
  - - [1225, 48, 32, 192]
    - [484, 13.258]
  - - [1225, 64, 32, 192]
    - [485, 19.771]
  - - [1225, 48, 32, 256]
    - [476, 15.026]
  - - [1225, 64, 32, 256]
    - [486, 21.238]
  - - [1225, 48, 32, 288]
    - [487, 16.15]
  - - [1225, 64, 32, 288]
    - [364, 23.156]
  - - [5329, 80, 32, 64]
    - [359, 12.287]
  - - [289, 128, 32, 768]
    - [363, 27.713]
  - - [289, 160, 32, 768]
    - [488, 28.06]
  - - [289, 192, 32, 768]
    - [483, 34.868]
  - - [49, 2048, 64, 512]
    - [354, 21.687]
  - - [49, 512, 64, 2048]
    - [355, 20.906]
  - - [3136, 256, 32, 64]
    - [331, 30.469]
  - - [3136, 64, 32, 64]
    - [205, 14.626]
  - - [3136, 64, 32, 256]
    - [195, 27.042]
  - - [784, 512, 32, 128]
    - [194, 27.137]
  - - [784, 128, 32, 512]
    - [193, 34.576]
  - - [196, 1024, 32, 256]
    - [191, 26.9]
  - - [196, 256, 32, 1024]
    - [203, 26.257]
  - - [49, 2048, 32, 512]
    - [201, 18.187]
  - - [49, 512, 32, 2048]
    - [198, 17.788]
  - - [3136, 128, 64, 64]
    - [433, 25.86]
  - - [3136, 256, 64, 128]
    - [366, 46.911]
  - - [784, 512, 64, 256]
    - [334, 51.46]
  - - [3136, 128, 64, 256]
    - [438, 46.556]
  - - [3136, 256, 64, 256]
    - [366, 61.332]
  - - [196, 1024, 64, 512]
    - [475, 43.1]
  - - [784, 256, 64, 512]
    - [366, 57.628]
  - - [784, 512, 64, 512]
    - [334, 61.981]
  - - [196, 512, 64, 1024]
    - [347, 44.374]
  - - [196, 1024, 64, 1024]
    - [475, 50.886]
  - - [49, 2048, 64, 1024]
    - [348, 25.214]
  - - [49, 1024, 64, 2048]
    - [349, 24.668]
  - - [3136, 128, 32, 64]
    - [425, 23.892]
  - - [3136, 256, 32, 128]
    - [336, 43.775]
  - - [784, 512, 32, 256]
    - [366, 47.71]
  - - [3136, 128, 32, 256]
    - [425, 45.122]
  - - [3136, 256, 32, 256]
    - [334, 57.306]
  - - [196, 1024, 32, 512]
    - [350, 38.276]
  - - [784, 256, 32, 512]
    - [382, 49.003]
  - - [784, 512, 32, 512]
    - [334, 58.505]
  - - [196, 512, 32, 1024]
    - [347, 36.332]
  - - [196, 1024, 32, 1024]
    - [351, 45.827]
  - - [49, 2048, 32, 1024]
    - [352, 22.762]
  - - [49, 1024, 32, 2048]
    - [353, 22.3]
  - - [7680, 8192, 1, 8192]
    - [365, 95.502]
  - - [3840, 4096, 1, 4096]
    - [366, 94.145]
  - - [1920, 2048, 1, 2048]
    - [209, 88.248]
  - - [960, 1024, 1, 1024]
    - [210, 44.436]
  - - [480, 512, 1, 512]
    - [211, 14.538]
  - - [8192, 7680, 1, 8192]
    - [207, 95.338]
  - - [4096, 3840, 1, 4096]
    - [366, 93.765]
  - - [2048, 1920, 1, 2048]
    - [212, 86.13]
  - - [512, 480, 1, 512]
    - [214, 14.187]
  - - [8192, 8192, 1, 8192]
    - [215, 92.617]
  - - [4096, 4096, 1, 4096]
    - [216, 86.729]
  - - [2048, 2048, 1, 2048]
    - [367, 70.392]
  - - [512, 512, 1, 512]
    - [214, 15.134]
  - - [64, 512, 16, 512]
    - [143, 16.974]
  - - [64, 512, 128, 512]
    - [217, 27.644]
  - - [1024, 8, 1, 1024]
    - [219, 0.748]
  - - [1024, 77, 1, 1024]
    - [220, 6.746]
  - - [1024, 77, 1, 30522]
    - [368, 30.936]
  - - [1024, 512, 1, 2]
    - [221, 0.204]
  - - [1024, 512, 1, 4096]
    - [369, 32.625]
  - - [1024, 616, 1, 1024]
    - [223, 33.031]
  - - [1024, 4096, 1, 2]
    - [224, 0.671]
  - - [4096, 512, 1, 1024]
    - [226, 41.956]
  - - [64, 128, 128, 128]
    - [227, 12.817]
  - - [64, 128, 160, 128]
    - [372, 13.535]
  - - [1024, 10, 1, 2]
    - [229, 0.005]
  - - [1024, 10, 1, 1024]
    - [230, 0.926]
  - - [1024, 160, 1, 1024]
    - [231, 12.363]
  - - [1024, 200, 1, 1024]
    - [232, 14.431]
  - - [1024, 200, 1, 30522]
    - [373, 45.917]
  - - [1024, 1024, 1, 2]
    - [233, 0.327]
  - - [1024, 1024, 1, 4096]
    - [234, 46.956]
  - - [1024, 1280, 1, 2]
    - [228, 0.383]
  - - [1024, 1280, 1, 1024]
    - [235, 44.228]
  - - [1024, 1280, 1, 4096]
    - [374, 50.647]
  - - [4096, 1024, 1, 1024]
    - [225, 57.093]
  - - [4096, 1280, 1, 1024]
    - [237, 54.969]
  - - [64, 128, 624, 128]
    - [375, 16.73]
  - - [1024, 39, 1, 2]
    - [238, 0.02]
  - - [1024, 39, 1, 1024]
    - [239, 3.511]
  - - [1024, 780, 1, 1024]
    - [223, 36.799]
  - - [1024, 780, 1, 30522]
    - [376, 62.249]
  - - [1024, 4992, 1, 2]
    - [224, 0.736]
  - - [1024, 4992, 1, 1024]
    - [236, 55.54]
  - - [1024, 4992, 1, 4096]
    - [240, 61.695]
  - - [4096, 4992, 1, 1024]
    - [209, 74.221]
  - - [1024, 308, 1, 1024]
    - [241, 21.435]
  - - [1024, 308, 1, 30522]
    - [377, 52.467]
  - - [64, 128, 640, 128]
    - [379, 16.928]
  - - [1024, 40, 1, 2]
    - [218, 0.02]
  - - [1024, 40, 1, 1024]
    - [239, 3.568]
  - - [1024, 800, 1, 1024]
    - [222, 36.856]
  - - [1024, 800, 1, 30522]
    - [380, 63.104]
  - - [1024, 5120, 1, 2]
    - [224, 0.749]
  - - [1024, 5120, 1, 1024]
    - [247, 56.262]
  - - [1024, 5120, 1, 4096]
    - [248, 62.783]
  - - [4096, 5120, 1, 1024]
    - [208, 77.117]
  - - [64, 128, 656, 128]
    - [375, 17.398]
  - - [1024, 41, 1, 2]
    - [218, 0.021]
  - - [1024, 41, 1, 1024]
    - [239, 3.691]
  - - [1024, 820, 1, 1024]
    - [223, 37.956]
  - - [1024, 820, 1, 30522]
    - [381, 64.146]
  - - [1024, 5248, 1, 2]
    - [382, 0.745]
  - - [1024, 5248, 1, 1024]
    - [236, 56.841]
  - - [1024, 5248, 1, 4096]
    - [226, 63.973]
  - - [4096, 5248, 1, 1024]
    - [383, 75.733]
  - - [64, 512, 80, 512]
    - [384, 27.485]
  - - [1024, 5, 1, 2]
    - [218, 0.002]
  - - [1024, 5, 1, 1024]
    - [219, 0.472]
  - - [1024, 385, 1, 1024]
    - [251, 25.356]
  - - [1024, 385, 1, 30522]
    - [385, 49.26]
  - - [1024, 2560, 1, 2]
    - [252, 0.591]
  - - [1024, 2560, 1, 1024]
    - [226, 50.853]
  - - [1024, 2560, 1, 4096]
    - [226, 62.104]
  - - [4096, 2560, 1, 1024]
    - [209, 71.981]
  - - [64, 512, 96, 512]
    - [386, 28.655]
  - - [1024, 6, 1, 2]
    - [218, 0.003]
  - - [1024, 6, 1, 1024]
    - [253, 0.556]
  - - [1024, 462, 1, 1024]
    - [222, 26.358]
  - - [1024, 462, 1, 30522]
    - [385, 57.527]
  - - [1024, 3072, 1, 2]
    - [224, 0.633]
  - - [1024, 3072, 1, 1024]
    - [254, 55.01]
  - - [1024, 3072, 1, 4096]
    - [387, 69.419]
  - - [4096, 3072, 1, 1024]
    - [208, 69.022]
  - - [1024, 8, 1, 2]
    - [218, 0.004]
  - - [1024, 160, 1, 30522]
    - [388, 40.695]
  - - [64, 128, 144, 128]
    - [228, 13.084]
  - - [1024, 9, 1, 2]
    - [218, 0.004]
  - - [1024, 9, 1, 1024]
    - [219, 0.825]
  - - [1024, 180, 1, 1024]
    - [211, 13.692]
  - - [1024, 180, 1, 30522]
    - [389, 40.623]
  - - [1024, 1152, 1, 2]
    - [233, 0.356]
  - - [1024, 1152, 1, 1024]
    - [213, 43.816]
  - - [1024, 1152, 1, 4096]
    - [390, 47.749]
  - - [4096, 1152, 1, 1024]
    - [257, 52.457]
  - - [479, 32768, 1, 1024]
    - [330, 63.331]
  - - [64, 4, 32768, 4]
    - [393, 0.145]
  - - [64, 4, 38400, 4]
    - [393, 0.147]
  - - [1024, 8192, 1, 1024]
    - [370, 63.698]
  - - [1024, 8192, 1, 4096]
    - [394, 76.341]
  - - [1024, 8192, 1, 33712]
    - [225, 82.057]
  - - [1024, 9600, 1, 1024]
    - [225, 78.832]
  - - [1024, 9600, 1, 4096]
    - [260, 81.245]
  - - [1024, 9600, 1, 33712]
    - [225, 88.406]
  - - [4096, 8192, 1, 1024]
    - [383, 77.426]
  - - [4096, 9600, 1, 1024]
    - [209, 78.865]
  - - [128, 128, 1, 64]
    - [274, 0.338]
  - - [64, 128, 1, 128]
    - [275, 0.289]
  - - [64, 5, 1, 5]
    - [218, 0.001]
  - - [32, 33, 1, 33]
    - [278, 0.008]
  - - [1024, 1024, 64, 64]
    - [258, 34.921]
  - - [64, 1024, 32, 1024]
    - [145, 29.126]
  - - [1024, 16384, 1, 3072]
    - [310, 76.889]
  - - [1024, 2048, 1, 30592]
    - [411, 76.826]
  - - [640, 2048, 1, 2560]
    - [306, 56.681]
  - - [1024, 1024, 64, 96]
    - [209, 48.387]
  - - [2048, 2, 1, 2048]
    - [420, 0.564]
  - - [2048, 2, 1, 2]
    - [218, 0.002]
  - - [1536, 4096, 1, 4608]
    - [307, 73.307]
  - - [512, 512, 256, 64]
    - [258, 33.579]
  - - [2048, 1024, 1, 8192]
    - [411, 64.829]
  - - [4096, 16384, 1, 1024]
    - [265, 80.69]
  - - [1024, 8192, 1, 50304]
    - [310, 82.526]
  - - [1536, 8192, 1, 50304]
    - [302, 82.896]
  - - [6144, 8192, 1, 1536]
    - [250, 87.051]
  - - [1024, 4096, 1, 30592]
    - [225, 81.498]
  - - [1536, 4096, 1, 6144]
    - [254, 74.265]
  - - [1024, 16384, 1, 4096]
    - [310, 78.609]
  - - [1024, 16384, 1, 50304]
    - [310, 82.689]
  - - [1024, 4096, 1, 3072]
    - [304, 71.689]
  - - [1536, 8192, 1, 1536]
    - [207, 71.718]
  - - [1024, 2048, 1, 3072]
    - [243, 59.458]
  - - [2560, 2048, 1, 7680]
    - [421, 66.015]
  - - [96, 1024, 64, 1024]
    - [309, 43.689]
  - - [2048, 1024, 1, 2048]
    - [301, 55.67]
  - - [2048, 1024, 1, 30592]
    - [419, 71.145]
  - - [64, 1024, 256, 1024]
    - [312, 37.829]
  - - [8192, 1024, 1, 2048]
    - [302, 71.615]
  - - [2560, 2048, 1, 2560]
    - [247, 63.469]
  - - [1536, 8192, 1, 4608]
    - [310, 78.765]
  - - [64, 512, 256, 512]
    - [303, 30.13]
  - - [1024, 2048, 1, 50304]
    - [411, 78.848]
  - - [1024, 1024, 32, 64]
    - [258, 33.607]
  - - [1536, 8192, 1, 6144]
    - [310, 79.767]
  - - [1024, 1024, 256, 64]
    - [311, 36.507]
  - - [512, 512, 40, 64]
    - [258, 27.545]
  - - [1536, 4096, 1, 50304]
    - [308, 77.069]
  - - [1024, 1024, 128, 96]
    - [371, 50.159]
  - - [1024, 8192, 1, 3072]
    - [394, 74.456]
  - - [64, 1024, 64, 1024]
    - [217, 32.811]
  - - [1024, 1024, 128, 64]
    - [313, 35.887]
  - - [64, 1024, 128, 1024]
    - [314, 35.712]
  - - [1024, 4096, 1, 50304]
    - [225, 82.162]
  - - [96, 1024, 128, 1024]
    - [424, 45.762]
  - - [6144, 4096, 1, 1536]
    - [209, 81.768]
  - - [1024, 16, 1, 2]
    - [218, 0.008]
  - - [1024, 16, 1, 1024]
    - [230, 1.428]
  - - [2560, 4, 1, 2]
    - [238, 0.005]
  - - [1024, 16384, 1, 1024]
    - [261, 72.161]
  - - [2560, 2048, 1, 1920]
    - [305, 61.491]
  - - [2048, 1024, 1, 6144]
    - [243, 63.664]
  - - [2560, 4, 1, 2560]
    - [422, 1.333]
  - - [512, 512, 128, 64]
    - [258, 32.002]
  - - [1024, 8192, 1, 30592]
    - [225, 82.215]
  - - [1536, 4096, 1, 1536]
    - [212, 67.742]
  - - [64, 512, 40, 512]
    - [423, 25.021]
  - - [1024, 1, 1, 2]
    - [218, 0.001]
  - - [1024, 1, 1, 1024]
    - [219, 0.094]
  - - [1024, 1, 1, 200]
    - [238, 0.034]
  - - [1024, 1, 1, 1600]
    - [417, 0.142]
  - - [2048, 1, 1, 512]
    - [219, 0.147]
  - - [128, 128, 1024, 64]
    - [425, 20.057]
  - - [64, 128, 1024, 128]
    - [426, 17.691]
  - - [1024, 64, 1, 2]
    - [315, 0.033]
  - - [1024, 8192, 1, 30528]
    - [267, 82.381]
  - - [1024, 64, 1, 1024]
    - [239, 5.658]
  - - [1024, 3456, 1, 1024]
    - [316, 60.886]
  - - [1024, 3456, 1, 512]
    - [255, 56.712]
  - - [1024, 4096, 1, 512]
    - [427, 54.91]
  - - [1024, 6912, 1, 1024]
    - [207, 72.465]
  - - [1024, 6912, 1, 512]
    - [428, 62.456]
  - - [1024, 864, 1, 1024]
    - [317, 38.364]
  - - [1024, 864, 1, 512]
    - [223, 33.119]
  - - [256, 3456, 1, 128]
    - [280, 19.626]
  - - [256, 4096, 1, 128]
    - [318, 19.031]
  - - [256, 55296, 1, 128]
    - [429, 40.373]
  - - [256, 6912, 1, 128]
    - [227, 26.495]
  - - [256, 864, 1, 128]
    - [319, 6.623]
  - - [480, 3456, 1, 1024]
    - [320, 45.162]
  - - [480, 4096, 1, 1024]
    - [301, 44.228]
  - - [480, 6912, 1, 1024]
    - [254, 60.908]
  - - [480, 864, 1, 1024]
    - [321, 24.086]
  - - [512, 3456, 1, 256]
    - [322, 35.035]
  - - [512, 4096, 1, 256]
    - [252, 32.207]
  - - [512, 55296, 1, 256]
    - [258, 55.824]
  - - [512, 6912, 1, 256]
    - [307, 42.605]
  - - [512, 864, 1, 256]
    - [323, 16.822]
  - - [1024, 640, 1, 30528]
    - [430, 74.239]
  - - [1024, 1280, 1, 30528]
    - [431, 72.387]
  - - [1024, 1600, 1, 30528]
    - [432, 84.719]
  - - [1024, 10240, 1, 1024]
    - [209, 72.136]
  - - [1024, 10240, 1, 4096]
    - [261, 79.686]
  - - [4096, 10240, 1, 1024]
    - [245, 78.58]
  - - [1024, 80, 1, 1024]
    - [239, 7.137]
  - - [1024, 80, 1, 2]
    - [238, 0.04]
  - - [128, 128, 1280, 64]
    - [433, 20.693]
  - - [64, 128, 1280, 128]
    - [434, 17.97]
  - - [1024, 1640, 1, 30528]
    - [435, 76.715]
  - - [1024, 10496, 1, 1024]
    - [261, 74.152]
  - - [1024, 10496, 1, 4096]
    - [255, 81.163]
  - - [4096, 10496, 1, 1024]
    - [366, 80.247]
  - - [1024, 82, 1, 1024]
    - [239, 7.249]
  - - [1024, 82, 1, 2]
    - [238, 0.041]
  - - [128, 128, 1312, 64]
    - [436, 20.698]
  - - [64, 128, 1312, 128]
    - [426, 17.982]
  - - [1024, 160, 1, 30528]
    - [437, 50.439]
  - - [1024, 240, 1, 30528]
    - [389, 59.501]
  - - [1024, 6144, 1, 4096]
    - [387, 72.118]
  - - [1024, 12, 1, 1024]
    - [253, 1.111]
  - - [4096, 6144, 1, 1024]
    - [208, 78.173]
  - - [1024, 6144, 1, 1024]
    - [328, 64.551]
  - - [1024, 12, 1, 2]
    - [218, 0.006]
  - - [512, 512, 192, 64]
    - [224, 33.127]
  - - [64, 512, 192, 512]
    - [210, 29.154]
  - - [256, 4096, 1, 1]
    - [329, 0.163]
  - - [256, 6912, 1, 1]
    - [228, 0.259]
  - - [1024, 10224, 1, 1024]
    - [395, 67.835]
  - - [1024, 10192, 1, 1024]
    - [395, 69.744]
  - - [1024, 10208, 1, 1024]
    - [395, 69.035]
  - - [1024, 10224, 1, 4096]
    - [383, 78.595]
  - - [1024, 10224, 1, 3072]
    - [383, 77.254]
  - - [4096, 10224, 1, 1024]
    - [383, 77.443]
  - - [1024, 10240, 1, 3072]
    - [383, 78.36]
  - - [1024, 10192, 1, 3072]
    - [395, 77.811]
  - - [4096, 10192, 1, 1024]
    - [366, 77.725]
  - - [1024, 10192, 1, 4096]
    - [395, 79.015]
  - - [1024, 10200, 1, 3072]
    - [383, 77.832]
  - - [1024, 10184, 1, 1024]
    - [395, 69.496]
  - - [4096, 10208, 1, 1024]
    - [366, 77.862]
  - - [1024, 10208, 1, 3072]
    - [395, 78.278]
  - - [1024, 10208, 1, 4096]
    - [395, 78.952]
  - - [1024, 10224, 1, 2048]
    - [395, 74.871]
  - - [1024, 10240, 1, 2048]
    - [395, 76.735]
  - - [1024, 10120, 1, 1024]
    - [395, 70.731]
  - - [1024, 10192, 1, 2048]
    - [395, 76.201]
  - - [64, 24, 6816, 24]
    - [401, 3.552]
  - - [1024, 10152, 1, 1024]
    - [395, 69.762]
  - - [1024, 10080, 1, 3072]
    - [383, 77.176]
  - - [64, 26, 6272, 26]
    - [393, 3.83]
  - - [100352, 512, 1, 256]
    - [418, 68.309]
  - - [12544, 2048, 1, 1024]
    - [383, 80.903]
  - - [12544, 64, 1, 147]
    - [445, 9.688]
  - - [200704, 512, 1, 256]
    - [418, 70.138]
  - - [25088, 1024, 1, 512]
    - [418, 75.286]
  - - [3136, 64, 1, 576]
    - [446, 9.659]
  - - [50176, 1024, 1, 512]
    - [418, 78.478]
  - - [6272, 2048, 1, 1024]
    - [382, 69.505]
  - - [784, 128, 1, 1152]
    - [447, 6.327]
  - - [3136, 128, 128, 256]
    - [425, 48.178]
  - - [3136, 128, 256, 256]
    - [438, 48.75]
  - - [784, 256, 128, 512]
    - [395, 59.179]
  - - [784, 256, 256, 512]
    - [366, 63.995]
  - - [128, 128, 2048, 64]
    - [452, 21.633]
  - - [64, 128, 2048, 128]
    - [453, 18.625]
  - - [1024, 2560, 1, 30528]
    - [454, 87.501]
  - - [1024, 128, 1, 1024]
    - [455, 8.0]
  - - [1024, 128, 1, 2]
    - [456, 0.055]
  - - [128, 128, 1536, 64]
    - [382, 21.14]
  - - [64, 128, 1536, 128]
    - [434, 18.248]
  - - [1024, 12288, 1, 4096]
    - [457, 76.754]
  - - [1024, 12288, 1, 1024]
    - [458, 67.401]
  - - [4096, 12288, 1, 1024]
    - [366, 80.24]
  - - [1024, 1920, 1, 30528]
    - [435, 74.554]
  - - [1024, 96, 1, 1024]
    - [459, 6.365]
  - - [1024, 96, 1, 2]
    - [456, 0.028]
  - - [128, 128, 192, 64]
    - [452, 16.822]
  - - [64, 128, 192, 128]
    - [460, 15.073]
  - - [768, 2048, 1, 2]
    - [375, 0.415]
  - - [3072, 2048, 1, 768]
    - [371, 60.452]
  - - [768, 2048, 1, 3072]
    - [461, 50.523]
  - - [768, 2048, 1, 768]
    - [462, 39.116]
  - - [384, 384, 144, 64]
    - [449, 29.303]
  - - [64, 384, 144, 384]
    - [440, 26.774]
  - - [768, 4608, 1, 2]
    - [438, 0.649]
  - - [3072, 4608, 1, 768]
    - [366, 72.723]
  - - [768, 4608, 1, 3072]
    - [387, 78.383]
  - - [768, 4608, 1, 768]
    - [463, 64.393]
  - - [512, 512, 48, 64]
    - [425, 27.207]
  - - [64, 512, 48, 512]
    - [464, 28.765]
  - - [128, 128, 256, 64]
    - [382, 15.799]
  - - [64, 128, 256, 128]
    - [465, 14.437]
  - - [384, 384, 192, 64]
    - [466, 30.012]
  - - [64, 384, 192, 384]
    - [467, 25.196]
  - - [1024, 4608, 1, 2]
    - [433, 0.696]
  - - [4096, 4608, 1, 1024]
    - [468, 74.74]
  - - [1024, 4608, 1, 4096]
    - [396, 81.29]
  - - [1024, 4608, 1, 1024]
    - [397, 63.42]
  - - [8192, 1024, 1, 1024]
    - [469, 63.548]
  - - [8192, 4096, 1, 1024]
    - [418, 81.612]
  - - [196, 256, 1, 2304]
    - [489, 6.891]
  - - [49, 512, 1, 4608]
    - [490, 6.01]
  - - [196, 1024, 128, 256]
    - [491, 37.369]
  - - [196, 1024, 256, 256]
    - [491, 38.407]
  - - [196, 256, 128, 1024]
    - [475, 42.652]
  - - [196, 256, 256, 1024]
    - [491, 47.822]
  - - [196, 512, 128, 1024]
    - [475, 49.634]
  - - [196, 512, 256, 1024]
    - [492, 54.25]
  - - [49, 2048, 128, 512]
    - [493, 22.974]
  - - [49, 2048, 256, 512]
    - [493, 23.322]
  - - [49, 512, 128, 2048]
    - [494, 23.856]
  - - [49, 512, 256, 2048]
    - [495, 26.035]
- null
