library/src/blas3/Tensile/Logic/asm_full/arcturus_Cijk_Alik_Bljk_BBH.yaml
- {MinimumRequiredVersion: 4.14.0}
- arcturus
- gfx908
- [Device 7380, Device 7388, Device 738c, Device 7390]
    SolutionIndex: 0
    SolutionNameMin: Cijk_Alik_Bljk_BBH_MT64x128x16_MI32x32x2x2_SE_GRVW4_ONLL0_SNLL1
    SolutionIndex: 1
    SolutionNameMin: Cijk_Alik_Bljk_BBH_MT64x128x16_MI32x32x2x2_SE_GRVW2_ONLL0_SNLL0
    SolutionIndex: 2
    SolutionNameMin: Cijk_Alik_Bljk_BBH_MT64x128x16_MI32x32x2x2_SE_GRVW4_ONLL0_SNLL0
    SolutionIndex: 3
    SolutionNameMin: Cijk_Alik_Bljk_BBH_MT64x128x32_MI32x32x2x2_SE_GRVW4_ONLL0_SNLL0
    SolutionIndex: 4
    SolutionNameMin: Cijk_Alik_Bljk_BBH_MT64x128x16_MI32x32x2x2_SE_GRVW4_ONLL1_SNLL1
    SolutionIndex: 5
    SolutionNameMin: Cijk_Alik_Bljk_BBH_MT64x128x16_MI32x32x2x2_SE_GRVW2_ONLL1_SNLL0
    SolutionIndex: 6
    SolutionNameMin: Cijk_Alik_Bljk_BBH_MT32x256x16_MI32x32x2x2_SE_GRVW4_ONLL1_SNLL0
    SolutionIndex: 7
    SolutionNameMin: Cijk_Alik_Bljk_BBH_MT64x128x16_MI32x32x2x2_SE_GRVW4_ONLL1_SNLL0
    SolutionIndex: 8
    SolutionNameMin: Cijk_Alik_Bljk_BBH_MT64x128x32_MI32x32x2x2_SE_GRVW4_ONLL1_SNLL0
    SolutionIndex: 9
    SolutionNameMin: Cijk_Alik_Bljk_BBH_MT64x256x16_MI32x32x2x2_SE_GRVW4_ONLL0_SNLL0
    SolutionIndex: 10
    SolutionNameMin: Cijk_Alik_Bljk_BBH_MT64x256x16_MI32x32x2x2_SE_GRVW4_ONLL1_SNLL1
    SolutionIndex: 11
    SolutionNameMin: Cijk_Alik_Bljk_BBH_MT128x32x16_SE_
    SolutionIndex: 12
    SolutionNameMin: Cijk_Alik_Bljk_BBH_MT128x64x16_SE_
    SolutionIndex: 13
    SolutionNameMin: Cijk_Alik_Bljk_BBH_MT32x128x16_SE_
    SolutionIndex: 14
    SolutionNameMin: Cijk_Alik_Bljk_BBH_MT64x128x16_SE_
    SolutionIndex: 15
    SolutionNameMin: Cijk_Alik_Bljk_BBH_MT256x128x16_SE_
    SolutionIndex: 16
    SolutionNameMin: Cijk_Alik_Bljk_BBH_MT128x256x16_SE_
    SolutionIndex: 17
    SolutionNameMin: Cijk_Alik_Bljk_BBH_MT64x16x16_SE_
    SolutionIndex: 18
    SolutionNameMin: Cijk_Alik_Bljk_BBH_MT16x64x16_SE_
    SolutionIndex: 19
    SolutionNameMin: Cijk_Alik_Bljk_BBH_MT64x128x32_SE_
    SolutionIndex: 20
    SolutionNameMin: Cijk_Alik_Bljk_BBH_MT64x128x64_SE_
    SolutionIndex: 21
    SolutionNameMin: Cijk_Alik_Bljk_BBH_MT32x32x32_SE_
    SolutionIndex: 22
    SolutionNameMin: Cijk_Alik_Bljk_BBH_MT128x64x16_SE_
    SolutionIndex: 23
    SolutionNameMin: Cijk_Alik_Bljk_BBH_MT32x128x16_SE_
    SolutionIndex: 24
    SolutionNameMin: Cijk_Alik_Bljk_BBH_MT64x128x16_SE_
    SolutionIndex: 25
    SolutionNameMin: Cijk_Alik_Bljk_BBH_MT256x128x16_SE_
    SolutionIndex: 26
    SolutionNameMin: Cijk_Alik_Bljk_BBH_MT128x256x16_SE_
    SolutionIndex: 27
    SolutionNameMin: Cijk_Alik_Bljk_BBH_MT64x16x16_SE_
    SolutionIndex: 28
    SolutionNameMin: Cijk_Alik_Bljk_BBH_MT16x64x16_SE_
    SolutionIndex: 29
    SolutionNameMin: Cijk_Alik_Bljk_BBH_MT64x128x32_SE_
    SolutionIndex: 30
    SolutionNameMin: Cijk_Alik_Bljk_BBH_MT64x128x64_SE_
    SolutionIndex: 31
    SolutionNameMin: Cijk_Alik_Bljk_BBH_MT32x32x32_SE_
    SolutionIndex: 32
    SolutionNameMin: Cijk_Alik_Bljk_BBH_MT64x128x8_MI32x32x2x2_SE_GRVW4_ONLL0_SNLL1
    SolutionIndex: 33
    SolutionNameMin: Cijk_Alik_Bljk_BBH_MT64x128x8_MI32x32x2x2_SE_GRVW4_ONLL1_SNLL0
    SolutionIndex: 34
    SolutionNameMin: Cijk_Alik_Bljk_BBH_MT64x128x16_MI32x32x2x2_SE_GRVW4_ONLL1_SNLL0
    SolutionIndex: 35
    SolutionNameMin: Cijk_Alik_Bljk_BBH_MT64x128x64_SE_
    SolutionIndex: 36
    SolutionNameMin: Cijk_Alik_Bljk_BBH_MT128x64x16_SE_AF0EM1_ASEM1_GRVW1_WGM8
    SolutionIndex: 37
    SolutionNameMin: Cijk_Alik_Bljk_BBH_MT32x128x16_SE_AF0EM1_ASEM1_GRVW1_WGM8
    SolutionIndex: 38
    SolutionNameMin: Cijk_Alik_Bljk_BBH_MT64x16x16_SE_AF0EM1_ASEM1_GRVW1_WGM8
    SolutionIndex: 39
    SolutionNameMin: Cijk_Alik_Bljk_BBH_MT64x32x16_SE_AF0EM1_ASEM1_GRVW1_WGM8
    SolutionIndex: 40
    SolutionNameMin: Cijk_Alik_Bljk_BBH_MT32x64x64_SE_AF0EM8_ASEM8_GRVW2_WGM8
    SolutionIndex: 41
    SolutionNameMin: Cijk_Alik_Bljk_BBH_MT64x32x64_SE_AF0EM8_ASEM8_GRVW2_WGM8
    SolutionIndex: 42
    SolutionNameMin: Cijk_Alik_Bljk_BBH_MT64x128x32_MI32x32x2x2_SE_AF0EM2_ASEM1_GRVW4_WGM1
    SolutionIndex: 43
    SolutionNameMin: Cijk_Alik_Bljk_BBH_MT64x128x32_MI32x32x2x2_SE_AF0EM2_ASEM2_GRVW4_WGM1
    SolutionIndex: 44
    SolutionNameMin: Cijk_Alik_Bljk_BBH_MT32x256x32_MI32x32x2x2_SE_AF0EM2_ASEM1_GRVW4_WGM8
    SolutionIndex: 45
    SolutionNameMin: Cijk_Alik_Bljk_BBH_MT64x128x32_MI32x32x2x2_SE_AF0EM2_ASEM1_GRVW4_WGM8
    SolutionIndex: 46
    SolutionNameMin: Cijk_Alik_Bljk_BBH_MT64x128x32_MI32x32x2x2_SE_AF0EM2_ASEM2_GRVW4_WGM8
    SolutionIndex: 47
    SolutionIndex: 48
    SolutionIndex: 49
    SolutionIndex: 50
    SolutionIndex: 51
    SolutionIndex: 52
    SolutionIndex: 53
    SolutionIndex: 54
    SolutionIndex: 55
    SolutionIndex: 56
    SolutionIndex: 57
    SolutionIndex: 58
    SolutionIndex: 59
    SolutionIndex: 60
    SolutionIndex: 61
    SolutionIndex: 62
    SolutionIndex: 63
    SolutionIndex: 64
    SolutionIndex: 65
    SolutionIndex: 66
    SolutionIndex: 67
    SolutionIndex: 68
    SolutionIndex: 69
    SolutionIndex: 70
    SolutionIndex: 71
    SolutionIndex: 72
    SolutionIndex: 73
    SolutionIndex: 74
    SolutionIndex: 75
    SolutionIndex: 76
    SolutionIndex: 77
    SolutionIndex: 78
    SolutionIndex: 79
    SolutionIndex: 80
    SolutionIndex: 81
    SolutionIndex: 82
    SolutionIndex: 83
    SolutionIndex: 84
    SolutionIndex: 85
    SolutionIndex: 86
    SolutionIndex: 87
    SolutionIndex: 88
    SolutionIndex: 89
    SolutionIndex: 90
    SolutionIndex: 91
    SolutionIndex: 92
    SolutionIndex: 93
    SolutionIndex: 94
    SolutionIndex: 95
    SolutionIndex: 96
    SolutionIndex: 97
    SolutionIndex: 98
    SolutionIndex: 99
    SolutionIndex: 100
    SolutionIndex: 101
    SolutionIndex: 102
    SolutionIndex: 103
    SolutionIndex: 104
    SolutionIndex: 105
    SolutionIndex: 106
    SolutionIndex: 107
    SolutionIndex: 108
    SolutionIndex: 109
    SolutionIndex: 110
    SolutionIndex: 111
    SolutionIndex: 112
    SolutionIndex: 113
    SolutionIndex: 114
    SolutionIndex: 115
    SolutionIndex: 116
    SolutionIndex: 117
    SolutionIndex: 118
    SolutionIndex: 119
    SolutionIndex: 120
    SolutionIndex: 121
    SolutionIndex: 122
    SolutionIndex: 123
    SolutionIndex: 124
    SolutionIndex: 125
    SolutionIndex: 126
    SolutionIndex: 127
    SolutionIndex: 128
    SolutionIndex: 129
    SolutionIndex: 130
    SolutionIndex: 131
    SolutionIndex: 132
    SolutionIndex: 133
    SolutionIndex: 134
    SolutionIndex: 135
    SolutionIndex: 136
    SolutionIndex: 137
    SolutionIndex: 138
    SolutionIndex: 139
    SolutionIndex: 140
    SolutionIndex: 141
    SolutionIndex: 142
    SolutionIndex: 143
    SolutionIndex: 144
    SolutionIndex: 145
    SolutionIndex: 146
    SolutionIndex: 147
    SolutionIndex: 148
    SolutionIndex: 149
    SolutionIndex: 150
    SolutionIndex: 151
    SolutionIndex: 152
    SolutionIndex: 153
    SolutionIndex: 154
    SolutionIndex: 155
    SolutionIndex: 156
    SolutionIndex: 157
    SolutionIndex: 158
    SolutionIndex: 159
    SolutionIndex: 160
    SolutionIndex: 161
    SolutionIndex: 162
    SolutionIndex: 163
    SolutionIndex: 164
    SolutionIndex: 165
    SolutionIndex: 166
    SolutionIndex: 167
    SolutionIndex: 168
    SolutionIndex: 169
    SolutionIndex: 170
    SolutionIndex: 171
    SolutionIndex: 172
    SolutionIndex: 173
    SolutionIndex: 174
    SolutionIndex: 175
    SolutionIndex: 176
    SolutionIndex: 177
    SolutionIndex: 178
    SolutionIndex: 179
    SolutionIndex: 180
    SolutionIndex: 181
    SolutionIndex: 182
    SolutionIndex: 183
    SolutionIndex: 184
    SolutionIndex: 185
    SolutionIndex: 186
    SolutionIndex: 187
    SolutionIndex: 188
    SolutionIndex: 189
    SolutionIndex: 190
    SolutionIndex: 191
    SolutionIndex: 192
    SolutionIndex: 193
    SolutionIndex: 194
    SolutionIndex: 195
    SolutionIndex: 196
    SolutionIndex: 197
    SolutionIndex: 198
    SolutionIndex: 199
    SolutionIndex: 200
    SolutionIndex: 201
    SolutionIndex: 202
    SolutionIndex: 203
    SolutionIndex: 204
    SolutionIndex: 205
    SolutionIndex: 206
    SolutionIndex: 207
    SolutionIndex: 208
    SolutionIndex: 209
    SolutionIndex: 210
    SolutionIndex: 211
    SolutionIndex: 212
    SolutionIndex: 213
    SolutionIndex: 214
    SolutionIndex: 215
    SolutionIndex: 216
    SolutionIndex: 217
    SolutionIndex: 218
    SolutionIndex: 219
    SolutionIndex: 220
    SolutionIndex: 221
    SolutionIndex: 222
    SolutionIndex: 223
    SolutionIndex: 224
    SolutionIndex: 225
- - - [511, 4096, 1, 4096]
    - [22, 1.999]
  - - [512, 3071, 1, 3072]
    - [22, 2.388]
  - - [2880, 3073, 1, 3072]
    - [22, 2.907]
  - - [511, 3072, 1, 3072]
    - [22, 2.378]
  - - [1024, 512, 1, 1025]
    - [22, 1.147]
  - - [511, 2048, 1, 2048]
    - [23, 1.612]
  - - [8192, 8193, 1, 8192]
    - [25, 3.275]
  - - [3072, 3072, 1, 3071]
    - [22, 3.114]
  - - [8192, 8192, 1, 8193]
    - [25, 3.467]
  - - [513, 1024, 1, 1024]
    - [22, 1.131]
  - - [512, 1023, 1, 1024]
    - [22, 1.121]
  - - [512, 2048, 1, 2047]
    - [23, 1.641]
  - - [7680, 8192, 1, 8193]
    - [25, 3.629]
  - - [513, 4096, 1, 4096]
    - [22, 1.988]
  - - [3073, 512, 1, 3072]
    - [22, 2.381]
  - - [4096, 4096, 1, 4097]
    - [22, 3.106]
  - - [1025, 1024, 1, 1024]
    - [23, 1.61]
  - - [8192, 8191, 1, 8192]
    - [25, 3.302]
  - - [8192, 512, 1, 8193]
    - [22, 2.685]
  - - [7681, 8192, 1, 8192]
    - [25, 3.235]
  - - [2880, 3071, 1, 3072]
    - [24, 3.128]
  - - [512, 1025, 1, 1024]
    - [22, 1.16]
  - - [2048, 513, 1, 2048]
    - [23, 1.636]
  - - [1024, 1024, 1, 1025]
    - [23, 1.594]
  - - [960, 1024, 1, 1023]
    - [24, 2.003]
  - - [3072, 512, 1, 3071]
    - [22, 2.394]
  - - [960, 1025, 1, 1024]
    - [23, 1.524]
  - - [3072, 3071, 1, 3072]
    - [22, 3.099]
  - - [512, 2048, 1, 2049]
    - [23, 1.625]
  - - [3072, 511, 1, 3072]
    - [22, 2.386]
  - - [2049, 512, 1, 2048]
    - [23, 1.627]
  - - [512, 8191, 1, 8192]
    - [22, 2.559]
  - - [513, 3072, 1, 3072]
    - [22, 2.374]
  - - [4096, 4095, 1, 4096]
    - [22, 3.063]
  - - [511, 1024, 1, 1024]
    - [22, 1.117]
  - - [513, 512, 1, 512]
    - [27, 0.664]
  - - [1024, 511, 1, 1024]
    - [22, 1.152]
  - - [3072, 3072, 1, 3073]
    - [22, 3.116]
  - - [960, 1024, 1, 1025]
    - [24, 1.991]
  - - [959, 1024, 1, 1024]
    - [23, 1.963]
  - - [7680, 8193, 1, 8192]
    - [25, 3.27]
  - - [512, 3072, 1, 3073]
    - [22, 2.383]
  - - [1023, 512, 1, 1024]
    - [22, 1.153]
  - - [3072, 512, 1, 3073]
    - [22, 2.4]
  - - [512, 2049, 1, 2048]
    - [23, 1.628]
  - - [513, 8192, 1, 8192]
    - [24, 2.482]
  - - [7679, 8192, 1, 8192]
    - [25, 3.457]
  - - [1024, 513, 1, 1024]
    - [22, 1.164]
  - - [8192, 511, 1, 8192]
    - [22, 2.621]
  - - [4096, 4097, 1, 4096]
    - [22, 3.051]
  - - [512, 3072, 1, 3071]
    - [22, 2.381]
  - - [7680, 8192, 1, 8191]
    - [26, 3.41]
  - - [2048, 2047, 1, 2048]
    - [22, 2.645]
  - - [8193, 8192, 1, 8192]
    - [25, 3.304]
  - - [512, 4096, 1, 4095]
    - [23, 1.995]
  - - [1024, 1023, 1, 1024]
    - [23, 1.605]
  - - [3073, 3072, 1, 3072]
    - [22, 3.099]
  - - [512, 3073, 1, 3072]
    - [22, 2.388]
  - - [4096, 4096, 1, 4095]
    - [25, 3.094]
  - - [1920, 2048, 1, 2047]
    - [26, 3.371]
  - - [1920, 2049, 1, 2048]
    - [22, 2.495]
  - - [512, 8192, 1, 8191]
    - [24, 2.534]
  - - [8191, 512, 1, 8192]
    - [22, 2.624]
  - - [1025, 512, 1, 1024]
    - [22, 1.165]
  - - [2881, 3072, 1, 3072]
    - [22, 2.915]
  - - [64, 1024, 1, 1024]
    - [31, 3.509]
  - - [1024, 512, 1, 1023]
    - [22, 1.153]
  - - [513, 2048, 1, 2048]
    - [23, 1.63]
  - - [3841, 4096, 1, 4096]
    - [22, 3.034]
  - - [2880, 3072, 1, 3073]
    - [24, 3.112]
  - - [512, 512, 1, 513]
    - [27, 0.653]
  - - [4095, 512, 1, 4096]
    - [22, 2.058]
  - - [1919, 2048, 1, 2048]
    - [26, 3.133]
  - - [1024, 1025, 1, 1024]
    - [23, 1.6]
  - - [2879, 3072, 1, 3072]
    - [24, 3.13]
  - - [512, 8192, 1, 8193]
    - [22, 2.663]
  - - [511, 8192, 1, 8192]
    - [22, 2.545]
  - - [8192, 513, 1, 8192]
    - [22, 2.624]
  - - [512, 8193, 1, 8192]
    - [22, 2.532]
  - - [7680, 8191, 1, 8192]
    - [25, 3.455]
  - - [512, 512, 1, 511]
    - [27, 0.666]
  - - [2047, 2048, 1, 2048]
    - [22, 2.645]
  - - [2049, 2048, 1, 2048]
    - [22, 2.646]
  - - [3840, 4095, 1, 4096]
    - [25, 3.362]
  - - [960, 1023, 1, 1024]
    - [24, 1.974]
  - - [2880, 3072, 1, 3071]
    - [24, 3.114]
  - - [64, 1025, 1, 1024]
    - [27, 0.201]
  - - [2048, 511, 1, 2048]
    - [23, 1.594]
  - - [4096, 513, 1, 4096]
    - [22, 2.065]
  - - [4097, 512, 1, 4096]
    - [22, 2.062]
  - - [8192, 512, 1, 8191]
    - [24, 2.546]
  - - [1921, 2048, 1, 2048]
    - [22, 2.471]
  - - [2048, 2049, 1, 2048]
    - [22, 2.644]
  - - [2048, 512, 1, 2047]
    - [23, 1.623]
  - - [3071, 3072, 1, 3072]
    - [22, 3.1]
  - - [3840, 4097, 1, 4096]
    - [22, 3.046]
  - - [4096, 511, 1, 4096]
    - [22, 2.058]
  - - [64, 1024, 1, 1025]
    - [27, 0.204]
  - - [2047, 512, 1, 2048]
    - [23, 1.622]
  - - [63, 1024, 1, 1024]
    - [27, 0.199]
  - - [3072, 513, 1, 3072]
    - [22, 2.38]
  - - [512, 4095, 1, 4096]
    - [22, 2.013]
  - - [512, 1024, 1, 1025]
    - [22, 1.146]
  - - [3071, 512, 1, 3072]
    - [22, 2.384]
  - - [3840, 4096, 1, 4097]
    - [25, 3.603]
  - - [512, 511, 1, 512]
    - [27, 0.678]
  - - [4097, 4096, 1, 4096]
    - [22, 3.061]
  - - [2048, 2048, 1, 2047]
    - [22, 2.631]
  - - [3839, 4096, 1, 4096]
    - [25, 3.355]
  - - [512, 4096, 1, 4097]
    - [22, 2.104]
  - - [3072, 3073, 1, 3072]
    - [22, 3.098]
  - - [512, 2047, 1, 2048]
    - [23, 1.618]
  - - [2048, 2048, 1, 2049]
    - [22, 2.666]
  - - [8191, 8192, 1, 8192]
    - [25, 3.304]
  - - [64, 1023, 1, 1024]
    - [27, 0.202]
  - - [4096, 512, 1, 4097]
    - [22, 2.129]
  - - [3840, 4096, 1, 4095]
    - [25, 3.594]
  - - [65, 1024, 1, 1024]
    - [28, 0.195]
  - - [1920, 2047, 1, 2048]
    - [26, 3.139]
  - - [512, 513, 1, 512]
    - [27, 0.687]
  - - [8192, 8192, 1, 8191]
    - [25, 3.469]
  - - [1024, 1024, 1, 1023]
    - [23, 1.613]
  - - [512, 4097, 1, 4096]
    - [22, 2.02]
  - - [511, 512, 1, 512]
    - [27, 0.675]
  - - [4096, 512, 1, 4095]
    - [24, 2.002]
  - - [8193, 512, 1, 8192]
    - [22, 2.628]
  - - [961, 1024, 1, 1024]
    - [23, 1.519]
  - - [512, 1024, 1, 1023]
    - [22, 1.153]
  - - [4095, 4096, 1, 4096]
    - [22, 3.063]
  - - [64, 1024, 1, 1023]
    - [27, 0.198]
  - - [2048, 512, 1, 2049]
    - [23, 1.64]
  - - [1023, 1024, 1, 1024]
    - [23, 1.605]
  - - [1920, 2048, 1, 2049]
    - [26, 3.351]
  - - [512, 512, 1, 512]
    - [35, 5.461]
  - - [512, 1024, 1, 1024]
    - [35, 16.86]
  - - [512, 2048, 1, 2048]
    - [35, 19.231]
  - - [512, 3072, 1, 3072]
    - [35, 28.838]
  - - [512, 4096, 1, 4096]
    - [35, 26.877]
  - - [512, 8192, 1, 8192]
    - [35, 33.16]
  - - [960, 1024, 1, 1024]
    - [35, 24.342]
  - - [1024, 1024, 1, 1024]
    - [35, 17.537]
  - - [1920, 2048, 1, 2048]
    - [35, 35.233]
  - - [2048, 2048, 1, 2048]
    - [35, 30.93]
  - - [2880, 3072, 1, 3072]
    - [35, 35.623]
  - - [3072, 512, 1, 3072]
    - [35, 29.023]
  - - [3072, 3072, 1, 3072]
    - [35, 35.788]
  - - [3840, 4096, 1, 4096]
    - [35, 37.795]
  - - [4096, 512, 1, 4096]
    - [35, 26.94]
  - - [4096, 4096, 1, 4096]
    - [35, 36.253]
  - - [7680, 8192, 1, 8192]
    - [35, 38.491]
  - - [8192, 512, 1, 8192]
    - [35, 33.15]
  - - [8192, 8192, 1, 8192]
    - [35, 38.43]
  - - [479, 512, 1, 512]
    - [38, 0.731]
  - - [479, 1024, 1, 1024]
    - [37, 1.499]
  - - [479, 2048, 1, 2048]
    - [37, 2.3]
  - - [480, 511, 1, 512]
    - [38, 0.728]
  - - [480, 512, 1, 511]
    - [38, 0.737]
  - - [480, 512, 1, 513]
    - [38, 0.724]
  - - [480, 513, 1, 512]
    - [38, 0.738]
  - - [480, 1023, 1, 1024]
    - [37, 1.503]
  - - [480, 1024, 1, 1023]
    - [37, 1.524]
  - - [480, 1024, 1, 1025]
    - [37, 1.528]
  - - [480, 1025, 1, 1024]
    - [36, 1.26]
  - - [480, 2047, 1, 2048]
    - [37, 2.302]
  - - [480, 2048, 1, 2047]
    - [37, 2.306]
  - - [480, 2048, 1, 2049]
    - [37, 2.31]
  - - [480, 2049, 1, 2048]
    - [37, 1.812]
  - - [481, 512, 1, 512]
    - [38, 0.737]
  - - [481, 1024, 1, 1024]
    - [36, 1.225]
  - - [481, 2048, 1, 2048]
    - [37, 1.775]
  - - [511, 480, 1, 512]
    - [38, 0.75]
  - - [512, 479, 1, 512]
    - [38, 0.747]
  - - [512, 480, 1, 511]
    - [38, 0.755]
  - - [512, 480, 1, 513]
    - [38, 0.752]
  - - [512, 481, 1, 512]
    - [38, 0.727]
  - - [513, 480, 1, 512]
    - [38, 0.71]
  - - [1023, 480, 1, 1024]
    - [38, 1.419]
  - - [1024, 479, 1, 1024]
    - [38, 1.413]
  - - [1024, 480, 1, 1023]
    - [38, 1.408]
  - - [1024, 480, 1, 1025]
    - [38, 1.41]
  - - [1024, 481, 1, 1024]
    - [36, 1.252]
  - - [1025, 480, 1, 1024]
    - [36, 1.257]
  - - [2047, 480, 1, 2048]
    - [39, 2.319]
  - - [2048, 479, 1, 2048]
    - [39, 2.315]
  - - [2048, 480, 1, 2047]
    - [39, 2.279]
  - - [2048, 480, 1, 2049]
    - [39, 2.276]
  - - [2048, 481, 1, 2048]
    - [37, 1.789]
  - - [2049, 480, 1, 2048]
    - [37, 1.785]
  - - [480, 512, 1, 512]
    - [40, 8.472]
  - - [480, 1024, 1, 1024]
    - [40, 17.91]
  - - [480, 2048, 1, 2048]
    - [40, 21.362]
  - - [512, 480, 1, 512]
    - [41, 7.453]
  - - [1024, 480, 1, 1024]
    - [41, 16.298]
  - - [2048, 480, 1, 2048]
    - [41, 16.299]
  - - [480, 3072, 1, 3072]
    - [42, 23.039]
  - - [480, 4096, 1, 4096]
    - [44, 22.557]
  - - [480, 8192, 1, 8192]
    - [43, 27.105]
  - - [3072, 480, 1, 3072]
    - [45, 23.395]
  - - [4096, 480, 1, 4096]
    - [45, 21.441]
  - - [8192, 480, 1, 8192]
    - [46, 27.075]
  - - [17, 17, 1, 64]
    - [57, 0.003]
  - - [24, 24, 1, 64]
    - [75, 0.006]
  - - [30, 31, 1, 64]
    - [75, 0.01]
  - - [32, 32, 1, 64]
    - [65, 0.01]
  - - [32, 35, 1, 64]
    - [80, 0.011]
  - - [31, 31, 1, 64]
    - [68, 0.01]
  - - [34, 34, 1, 64]
    - [63, 0.011]
  - - [30, 30, 1, 64]
    - [61, 0.009]
  - - [17, 15, 1, 64]
    - [86, 0.003]
  - - [35, 35, 1, 64]
    - [75, 0.013]
  - - [21, 17, 1, 64]
    - [61, 0.004]
  - - [21, 21, 1, 64]
    - [57, 0.004]
  - - [15, 14, 1, 64]
    - [57, 0.002]
  - - [14, 14, 1, 64]
    - [55, 0.001]
  - - [15, 15, 1, 64]
    - [57, 0.002]
  - - [34, 24, 1, 64]
    - [49, 0.008]
  - - [2, 4, 1, 1024]
    - [89, 0.001]
  - - [2, 32, 1, 1024]
    - [91, 0.006]
  - - [2, 2048, 1, 1024]
    - [142, 0.371]
  - - [64, 128, 512, 128]
    - [125, 14.437]
  - - [64, 512, 1, 512]
    - [92, 2.275]
  - - [64, 512, 64, 512]
    - [148, 21.154]
  - - [128, 128, 512, 64]
    - [178, 14.396]
  - - [512, 512, 1, 64]
    - [133, 3.079]
  - - [512, 512, 64, 64]
    - [105, 19.067]
  - - [1024, 4, 1, 1024]
    - [134, 0.374]
  - - [1024, 4, 1, 1024]
    - [172, 0.374]
  - - [1024, 32, 1, 1024]
    - [167, 3.079]
  - - [1024, 2048, 1, 1024]
    - [199, 30.496]
  - - [1024, 2048, 1, 4096]
    - [213, 32.467]
  - - [1024, 4096, 1, 1024]
    - [144, 36.909]
  - - [1024, 4096, 1, 4096]
    - [204, 38.778]
  - - [4096, 2048, 1, 1024]
    - [181, 42.154]
  - - [4096, 4096, 1, 1024]
    - [203, 43.207]
  - - [30528, 2048, 1, 1024]
    - [203, 45.458]
  - - [30528, 4096, 1, 1024]
    - [203, 45.899]
  - - [3, 3, 512, 64]
    - [193, 0.042]
  - - [5, 5, 512, 64]
    - [90, 0.115]
  - - [5, 5, 960, 64]
    - [98, 0.167]
  - - [9, 9, 512, 64]
    - [139, 0.377]
  - - [27, 27, 32768, 128]
    - [95, 7.92]
  - - [32, 1600, 1, 512]
    - [99, 3.608]
  - - [33, 33, 1600, 32]
    - [102, 1.999]
  - - [64, 512, 1, 1024]
    - [99, 3.14]
  - - [64, 960, 1, 1024]
    - [124, 5.402]
  - - [128, 32768, 1, 256]
    - [163, 26.724]
  - - [256, 684, 1, 1024]
    - [148, 11.04]
  - - [256, 1280, 1, 1024]
    - [161, 17.943]
  - - [256, 1536, 1, 1024]
    - [152, 19.832]
  - - [256, 2304, 1, 1024]
    - [195, 21.249]
  - - [256, 2560, 1, 1024]
    - [164, 23.522]
  - - [256, 2816, 1, 1024]
    - [192, 25.682]
  - - [256, 3328, 1, 1024]
    - [207, 30.239]
  - - [256, 3584, 1, 1024]
    - [189, 31.068]
  - - [256, 4608, 1, 1024]
    - [221, 24.9]
  - - [256, 4864, 1, 1024]
    - [147, 25.174]
  - - [256, 5376, 1, 1024]
    - [97, 27.476]
  - - [256, 5888, 1, 1024]
    - [156, 29.783]
  - - [256, 6144, 1, 1024]
    - [196, 30.886]
  - - [256, 6400, 1, 1024]
    - [104, 32.042]
  - - [256, 6656, 1, 1024]
    - [175, 33.188]
  - - [256, 7168, 1, 1024]
    - [126, 35.382]
  - - [256, 7424, 1, 1024]
    - [191, 36.793]
  - - [256, 7936, 1, 1024]
    - [140, 28.339]
  - - [256, 8192, 1, 1024]
    - [157, 29.296]
  - - [256, 8448, 1, 1024]
    - [190, 30.08]
  - - [256, 8960, 1, 1024]
    - [190, 31.491]
  - - [256, 9984, 1, 1024]
    - [163, 34.208]
  - - [256, 10496, 1, 1024]
    - [130, 35.419]
  - - [256, 11264, 1, 1024]
    - [128, 37.242]
  - - [256, 11520, 1, 1024]
    - [225, 37.582]
  - - [256, 11776, 1, 1024]
    - [121, 32.351]
  - - [256, 12544, 1, 1024]
    - [121, 34.117]
  - - [256, 13312, 1, 1024]
    - [156, 35.769]
  - - [256, 14336, 1, 1024]
    - [156, 37.898]
  - - [256, 14592, 1, 1024]
    - [216, 38.002]
  - - [256, 14848, 1, 1024]
    - [224, 38.383]
  - - [256, 15104, 1, 1024]
    - [225, 38.8]
  - - [256, 16128, 1, 1024]
    - [118, 35.517]
  - - [256, 18176, 1, 1024]
    - [153, 39.012]
  - - [256, 18944, 1, 1024]
    - [163, 39.418]
  - - [256, 19200, 1, 1024]
    - [224, 39.122]
  - - [256, 20480, 1, 1024]
    - [156, 37.919]
  - - [256, 20992, 1, 1024]
    - [156, 38.72]
  - - [256, 21248, 1, 1024]
    - [156, 38.958]
  - - [256, 21504, 1, 1024]
    - [153, 39.399]
  - - [256, 22016, 1, 1024]
    - [153, 39.86]
  - - [256, 22344, 1, 1024]
    - [162, 39.578]
  - - [256, 23296, 1, 1024]
    - [153, 37.451]
  - - [256, 23552, 1, 1024]
    - [153, 37.714]
  - - [256, 31488, 1, 1024]
    - [156, 39.675]
  - - [256, 32768, 1, 512]
    - [222, 37.74]
  - - [256, 33536, 1, 1024]
    - [211, 41.322]
  - - [256, 44505, 1, 1024]
    - [216, 41.388]
  - - [512, 1600, 1, 512]
    - [171, 22.429]
  - - [512, 32768, 1, 13]
    - [122, 3.495]
  - - [512, 32768, 1, 1024]
    - [219, 42.342]
  - - [684, 8976, 1, 256]
    - [154, 29.417]
  - - [1024, 200, 1, 560]
    - [177, 8.518]
  - - [1024, 512, 1, 1024]
    - [143, 19.399]
  - - [1024, 512, 1, 1600]
    - [210, 21.746]
  - - [1024, 960, 1, 1024]
    - [160, 32.824]
  - - [1024, 960, 1, 1600]
    - [180, 36.344]
  - - [1024, 1600, 1, 560]
    - [214, 24.393]
  - - [1024, 1600, 1, 1024]
    - [112, 32.44]
  - - [1024, 32768, 1, 480]
    - [103, 44.098]
  - - [1024, 32768, 1, 1024]
    - [182, 44.248]
  - - [1280, 8976, 1, 256]
    - [123, 34.975]
  - - [1792, 8976, 1, 256]
    - [184, 37.743]
  - - [2048, 114, 1, 512]
    - [194, 10.757]
  - - [2048, 114, 1, 768]
    - [137, 12.617]
  - - [2048, 215, 1, 512]
    - [117, 14.963]
  - - [2048, 215, 1, 768]
    - [198, 18.293]
  - - [2048, 256, 1, 512]
    - [127, 16.001]
  - - [2048, 256, 1, 768]
    - [137, 18.381]
  - - [2048, 512, 1, 67]
    - [188, 5.668]
  - - [2048, 512, 1, 74]
    - [114, 6.154]
  - - [2048, 512, 1, 100]
    - [176, 7.851]
  - - [2048, 512, 1, 2048]
    - [197, 24.689]
  - - [2048, 684, 1, 512]
    - [224, 23.145]
  - - [2048, 684, 1, 768]
    - [93, 27.812]
  - - [2048, 960, 1, 74]
    - [174, 9.725]
  - - [2048, 960, 1, 2048]
    - [159, 39.748]
  - - [2048, 1536, 1, 512]
    - [120, 31.866]
  - - [2048, 1536, 1, 768]
    - [158, 33.897]
  - - [2048, 8976, 1, 256]
    - [101, 36.277]
  - - [2304, 8976, 1, 256]
    - [183, 38.053]
  - - [2560, 8976, 1, 256]
    - [111, 38.256]
  - - [2816, 8976, 1, 256]
    - [149, 38.473]
  - - [3072, 8976, 1, 256]
    - [103, 38.452]
  - - [3328, 8976, 1, 256]
    - [103, 39.15]
  - - [3840, 8976, 1, 256]
    - [101, 38.804]
  - - [4096, 8976, 1, 256]
    - [101, 38.015]
  - - [4352, 8976, 1, 256]
    - [106, 39.892]
  - - [4608, 8976, 1, 256]
    - [101, 39.892]
  - - [4864, 8976, 1, 256]
    - [105, 40.09]
  - - [5120, 8976, 1, 256]
    - [106, 39.505]
  - - [5376, 8976, 1, 256]
    - [103, 39.768]
  - - [5632, 8976, 1, 256]
    - [103, 39.501]
  - - [5888, 8976, 1, 256]
    - [105, 39.273]
  - - [6144, 8976, 1, 256]
    - [103, 38.632]
  - - [6400, 8976, 1, 256]
    - [103, 38.823]
  - - [7168, 8976, 1, 256]
    - [103, 37.835]
  - - [7936, 8976, 1, 256]
    - [123, 38.093]
  - - [8192, 8976, 1, 256]
    - [205, 37.048]
  - - [8448, 8976, 1, 256]
    - [116, 37.934]
  - - [8960, 8976, 1, 256]
    - [116, 38.169]
  - - [9472, 8976, 1, 256]
    - [110, 38.201]
  - - [9728, 8976, 1, 256]
    - [150, 37.788]
  - - [9984, 8976, 1, 256]
    - [116, 38.067]
  - - [10240, 8976, 1, 256]
    - [110, 37.803]
  - - [10496, 8976, 1, 256]
    - [111, 38.056]
  - - [11264, 8976, 1, 256]
    - [183, 38.163]
  - - [11776, 8976, 1, 256]
    - [149, 37.791]
  - - [12544, 8976, 1, 256]
    - [179, 38.17]
  - - [13312, 8976, 1, 256]
    - [115, 38.017]
  - - [13568, 8976, 1, 256]
    - [145, 37.838]
  - - [13824, 8976, 1, 256]
    - [184, 37.84]
  - - [15104, 8976, 1, 256]
    - [203, 38.252]
  - - [15360, 8976, 1, 256]
    - [179, 37.865]
  - - [15872, 8976, 1, 256]
    - [208, 38.174]
  - - [16128, 8976, 1, 256]
    - [206, 38.032]
  - - [17152, 8976, 1, 256]
    - [206, 38.115]
  - - [18176, 8976, 1, 256]
    - [115, 38.114]
  - - [18688, 8976, 1, 256]
    - [116, 38.597]
  - - [18944, 8976, 1, 256]
    - [209, 38.041]
  - - [19712, 8976, 1, 256]
    - [116, 38.299]
  - - [19968, 8976, 1, 256]
    - [150, 38.199]
  - - [20480, 8976, 1, 256]
    - [115, 38.266]
  - - [20992, 8976, 1, 256]
    - [145, 37.838]
  - - [21248, 8976, 1, 256]
    - [111, 37.887]
  - - [23552, 8976, 1, 256]
    - [150, 38.077]
  - - [28672, 8976, 1, 256]
    - [218, 38.112]
  - - [31488, 8976, 1, 256]
    - [115, 38.118]
  - - [33536, 8976, 1, 256]
    - [146, 38.229]
  - - [44505, 8976, 1, 256]
    - [217, 37.325]
  - - [14, 14, 10880, 64]
    - [165, 2.34]
  - - [15, 14, 10880, 64]
    - [90, 2.479]
  - - [15, 15, 7680, 64]
    - [90, 2.519]
  - - [15, 15, 10880, 64]
    - [90, 2.647]
  - - [17, 15, 7680, 64]
    - [90, 2.799]
  - - [17, 17, 7680, 64]
    - [90, 3.15]
  - - [21, 17, 6144, 64]
    - [166, 3.317]
  - - [21, 21, 6144, 64]
    - [185, 3.818]
  - - [24, 24, 4736, 64]
    - [141, 4.136]
  - - [30, 30, 2048, 64]
    - [96, 4.524]
  - - [30, 31, 2048, 64]
    - [170, 4.619]
  - - [31, 31, 2048, 64]
    - [138, 4.623]
  - - [32, 32, 4608, 64]
    - [151, 6.65]
  - - [32, 35, 4608, 64]
    - [187, 6.061]
  - - [34, 24, 4736, 64]
    - [109, 4.592]
  - - [34, 34, 4736, 64]
    - [135, 4.029]
  - - [35, 35, 4608, 64]
    - [100, 4.044]
  - - [1024, 3840, 1, 1024]
    - [200, 40.606]
  - - [1024, 3840, 1, 4096]
    - [113, 46.136]
  - - [1024, 3968, 1, 1024]
    - [181, 35.756]
  - - [1024, 3968, 1, 4096]
    - [155, 37.923]
  - - [1024, 6528, 1, 1024]
    - [181, 41.732]
  - - [1024, 6528, 1, 4096]
    - [186, 42.749]
  - - [1024, 7104, 1, 1024]
    - [168, 40.46]
  - - [1024, 7104, 1, 4096]
    - [129, 42.663]
  - - [1024, 7200, 1, 1024]
    - [202, 40.675]
  - - [1024, 7200, 1, 4096]
    - [131, 43.087]
  - - [1024, 8064, 1, 1024]
    - [203, 41.214]
  - - [1024, 8064, 1, 4096]
    - [153, 42.983]
  - - [1024, 8160, 1, 1024]
    - [168, 41.19]
  - - [1024, 8160, 1, 4096]
    - [211, 43.207]
  - - [1024, 9216, 1, 1024]
    - [169, 42.22]
  - - [1024, 9216, 1, 4096]
    - [212, 44.61]
  - - [1024, 9520, 1, 1024]
    - [202, 41.911]
  - - [1024, 9520, 1, 4096]
    - [119, 45.587]
  - - [1024, 10064, 1, 1024]
    - [103, 41.9]
  - - [1024, 10064, 1, 4096]
    - [153, 43.683]
  - - [1024, 10080, 1, 1024]
    - [203, 41.913]
  - - [1024, 10080, 1, 4096]
    - [118, 43.792]
  - - [1024, 10200, 1, 1024]
    - [181, 42.268]
  - - [1024, 10200, 1, 4096]
    - [153, 43.339]
  - - [4096, 3840, 1, 1024]
    - [181, 42.893]
  - - [4096, 3968, 1, 1024]
    - [202, 43.763]
  - - [4096, 6528, 1, 1024]
    - [182, 44.431]
  - - [4096, 7104, 1, 1024]
    - [215, 43.809]
  - - [4096, 7200, 1, 1024]
    - [203, 44.117]
  - - [4096, 8064, 1, 1024]
    - [181, 44.575]
  - - [4096, 8160, 1, 1024]
    - [203, 44.393]
  - - [4096, 9216, 1, 1024]
    - [203, 44.809]
  - - [4096, 9520, 1, 1024]
    - [182, 44.475]
  - - [4096, 10064, 1, 1024]
    - [202, 44.692]
  - - [4096, 10080, 1, 1024]
    - [181, 44.727]
  - - [4096, 10200, 1, 1024]
    - [182, 44.445]
  - - [42720, 3968, 1, 1024]
    - [202, 45.959]
  - - [42720, 6528, 1, 1024]
    - [203, 46.123]
  - - [42720, 7104, 1, 1024]
    - [202, 45.616]
  - - [42720, 7200, 1, 1024]
    - [202, 45.565]
  - - [42720, 9520, 1, 1024]
    - [202, 45.804]
  - - [42720, 10080, 1, 1024]
    - [203, 45.986]
  - - [27, 27, 1920, 64]
    - [107, 4.213]
  - - [27, 33, 1920, 64]
    - [94, 4.595]
  - - [33, 33, 1920, 64]
    - [135, 3.385]
  - - [27, 27, 1920, 64]
    - [132, 4.299]
  - - [27, 33, 1920, 64]
    - [136, 4.637]
  - - [33, 33, 1920, 64]
    - [173, 3.488]
  - - [1024, 3240, 1, 1024]
    - [220, 35.327]
  - - [1024, 3240, 1, 4096]
    - [108, 38.283]
  - - [1024, 3960, 1, 1024]
    - [149, 35.104]
  - - [1024, 3960, 1, 4096]
    - [201, 37.527]
  - - [4096, 3240, 1, 1024]
    - [223, 42.293]
  - - [4096, 3960, 1, 1024]
    - [182, 43.442]
  - - [42720, 3960, 1, 1024]
    - [202, 45.756]
- null
