library/src/blas3/Tensile/Logic/asm_full/arcturus_Cijk_Alik_Bljk_BBH.yaml
- {MinimumRequiredVersion: 4.14.0}
- arcturus
- gfx908
- [Device 7380, Device 7388, Device 738c, Device 7390]
    SolutionIndex: 0
    SolutionNameMin: Cijk_Alik_Bljk_BBH_MT64x128x16_MI32x32x2x2_SE_GRVW2_ONLL0_SNLL0
    SolutionIndex: 1
    SolutionNameMin: Cijk_Alik_Bljk_BBH_MT64x128x32_MI32x32x2x2_SE_GRVW4_ONLL0_SNLL0
    SolutionIndex: 2
    SolutionNameMin: Cijk_Alik_Bljk_BBH_MT64x128x16_MI32x32x2x2_SE_GRVW2_ONLL1_SNLL0
    SolutionIndex: 3
    SolutionNameMin: Cijk_Alik_Bljk_BBH_MT64x128x16_MI32x32x2x2_SE_GRVW4_ONLL1_SNLL0
    SolutionIndex: 4
    SolutionNameMin: Cijk_Alik_Bljk_BBH_MT64x256x16_MI32x32x2x2_SE_GRVW4_ONLL0_SNLL0
    SolutionIndex: 5
    SolutionNameMin: Cijk_Alik_Bljk_BBH_MT128x32x16_SE_
    SolutionIndex: 6
    SolutionNameMin: Cijk_Alik_Bljk_BBH_MT32x128x16_SE_
    SolutionIndex: 7
    SolutionNameMin: Cijk_Alik_Bljk_BBH_MT256x128x16_SE_
    SolutionIndex: 8
    SolutionNameMin: Cijk_Alik_Bljk_BBH_MT64x16x16_SE_
    SolutionIndex: 9
    SolutionNameMin: Cijk_Alik_Bljk_BBH_MT64x128x32_SE_
    SolutionIndex: 10
    SolutionNameMin: Cijk_Alik_Bljk_BBH_MT32x32x32_SE_
    SolutionIndex: 11
    SolutionNameMin: Cijk_Alik_Bljk_BBH_MT128x64x16_SE_
    SolutionIndex: 12
    SolutionNameMin: Cijk_Alik_Bljk_BBH_MT32x128x16_SE_
    SolutionIndex: 13
    SolutionNameMin: Cijk_Alik_Bljk_BBH_MT64x128x16_SE_
    SolutionIndex: 14
    SolutionNameMin: Cijk_Alik_Bljk_BBH_MT256x128x16_SE_
    SolutionIndex: 15
    SolutionNameMin: Cijk_Alik_Bljk_BBH_MT64x16x16_SE_
    SolutionIndex: 16
    SolutionNameMin: Cijk_Alik_Bljk_BBH_MT16x64x16_SE_
    SolutionIndex: 17
    SolutionNameMin: Cijk_Alik_Bljk_BBH_MT64x128x64_SE_
    SolutionIndex: 18
    SolutionNameMin: Cijk_Alik_Bljk_BBH_MT32x32x32_SE_
    SolutionIndex: 19
    SolutionNameMin: Cijk_Alik_Bljk_BBH_MT64x128x8_MI32x32x2x2_SE_GRVW4_ONLL1_SNLL0
    SolutionIndex: 20
    SolutionNameMin: Cijk_Alik_Bljk_BBH_MT64x128x64_SE_
    SolutionIndex: 21
    SolutionNameMin: Cijk_Alik_Bljk_BBH_MT128x64x16_SE_AF0EM1_ASEM1_GRVW1_WGM8
    SolutionIndex: 22
    SolutionNameMin: Cijk_Alik_Bljk_BBH_MT32x128x16_SE_AF0EM1_ASEM1_GRVW1_WGM8
    SolutionIndex: 23
    SolutionNameMin: Cijk_Alik_Bljk_BBH_MT64x16x16_SE_AF0EM1_ASEM1_GRVW1_WGM8
    SolutionIndex: 24
    SolutionNameMin: Cijk_Alik_Bljk_BBH_MT64x32x16_SE_AF0EM1_ASEM1_GRVW1_WGM8
    SolutionIndex: 25
    SolutionNameMin: Cijk_Alik_Bljk_BBH_MT64x32x64_SE_AF0EM8_ASEM8_GRVW2_WGM8
    SolutionIndex: 26
    SolutionNameMin: Cijk_Alik_Bljk_BBH_MT64x128x32_MI32x32x2x2_SE_AF0EM2_ASEM1_GRVW4_WGM1
    SolutionIndex: 27
    SolutionNameMin: Cijk_Alik_Bljk_BBH_MT64x128x32_MI32x32x2x2_SE_AF0EM2_ASEM2_GRVW4_WGM1
    SolutionIndex: 28
    SolutionNameMin: Cijk_Alik_Bljk_BBH_MT32x256x32_MI32x32x2x2_SE_AF0EM2_ASEM1_GRVW4_WGM8
    SolutionIndex: 29
    SolutionNameMin: Cijk_Alik_Bljk_BBH_MT64x128x32_MI32x32x2x2_SE_AF0EM2_ASEM1_GRVW4_WGM8
    SolutionIndex: 30
    SolutionNameMin: Cijk_Alik_Bljk_BBH_MT64x128x32_MI32x32x2x2_SE_AF0EM2_ASEM2_GRVW4_WGM8
    SolutionIndex: 31
    SolutionIndex: 32
    SolutionIndex: 33
    SolutionIndex: 34
    SolutionIndex: 35
    SolutionIndex: 36
    SolutionIndex: 37
    SolutionIndex: 38
    SolutionIndex: 39
    SolutionIndex: 40
    SolutionIndex: 41
    SolutionIndex: 42
    SolutionIndex: 43
    SolutionIndex: 44
    SolutionIndex: 45
    SolutionIndex: 46
    SolutionIndex: 47
    SolutionIndex: 48
    SolutionIndex: 49
    SolutionIndex: 50
    SolutionIndex: 51
    SolutionIndex: 52
    SolutionIndex: 53
    SolutionIndex: 54
    SolutionIndex: 55
    SolutionIndex: 56
    SolutionIndex: 57
    SolutionIndex: 58
    SolutionIndex: 59
    SolutionIndex: 60
    SolutionIndex: 61
    SolutionIndex: 62
    SolutionIndex: 63
    SolutionIndex: 64
    SolutionIndex: 65
    SolutionIndex: 66
    SolutionIndex: 67
    SolutionIndex: 68
    SolutionIndex: 69
    SolutionIndex: 70
    SolutionIndex: 71
    SolutionIndex: 72
    SolutionIndex: 73
    SolutionIndex: 74
    SolutionIndex: 75
    SolutionIndex: 76
    SolutionIndex: 77
    SolutionIndex: 78
    SolutionIndex: 79
    SolutionIndex: 80
    SolutionIndex: 81
    SolutionIndex: 82
    SolutionIndex: 83
    SolutionIndex: 84
    SolutionIndex: 85
    SolutionIndex: 86
    SolutionIndex: 87
    SolutionIndex: 88
    SolutionIndex: 89
    SolutionIndex: 90
    SolutionIndex: 91
    SolutionIndex: 92
    SolutionIndex: 93
    SolutionIndex: 94
    SolutionIndex: 95
    SolutionIndex: 96
    SolutionIndex: 97
    SolutionIndex: 98
    SolutionIndex: 99
    SolutionIndex: 100
    SolutionIndex: 101
    SolutionIndex: 102
    SolutionIndex: 103
    SolutionIndex: 104
    SolutionIndex: 105
    SolutionIndex: 106
    SolutionIndex: 107
    SolutionIndex: 108
    SolutionIndex: 109
    SolutionIndex: 110
    SolutionIndex: 111
    SolutionIndex: 112
    SolutionIndex: 113
    SolutionIndex: 114
    SolutionIndex: 115
    SolutionIndex: 116
    SolutionIndex: 117
    SolutionIndex: 118
    SolutionIndex: 119
    SolutionIndex: 120
    SolutionIndex: 121
    SolutionIndex: 122
    SolutionIndex: 123
    SolutionIndex: 124
    SolutionIndex: 125
    SolutionIndex: 126
    SolutionIndex: 127
    SolutionIndex: 128
    SolutionIndex: 129
    SolutionIndex: 130
    SolutionIndex: 131
    SolutionIndex: 132
    SolutionIndex: 133
    SolutionIndex: 134
    SolutionIndex: 135
    SolutionIndex: 136
    SolutionIndex: 137
    SolutionIndex: 138
    SolutionIndex: 139
    SolutionIndex: 140
    SolutionIndex: 141
    SolutionIndex: 142
    SolutionIndex: 143
    SolutionIndex: 144
    SolutionIndex: 145
    SolutionIndex: 146
    SolutionIndex: 147
    SolutionIndex: 148
    SolutionIndex: 149
    SolutionIndex: 150
    SolutionIndex: 151
    SolutionIndex: 152
    SolutionIndex: 153
    SolutionIndex: 154
    SolutionIndex: 155
    SolutionIndex: 156
    SolutionIndex: 157
    SolutionIndex: 158
    SolutionIndex: 159
    SolutionIndex: 160
    SolutionIndex: 161
    SolutionIndex: 162
    SolutionIndex: 163
    SolutionIndex: 164
    SolutionIndex: 165
    SolutionIndex: 166
    SolutionIndex: 167
    SolutionIndex: 168
    SolutionIndex: 169
    SolutionIndex: 170
    SolutionIndex: 171
    SolutionIndex: 172
    SolutionIndex: 173
    SolutionIndex: 174
    SolutionIndex: 175
    SolutionIndex: 176
    SolutionIndex: 177
    SolutionIndex: 178
    SolutionIndex: 179
    SolutionIndex: 180
    SolutionIndex: 181
    SolutionIndex: 182
    SolutionIndex: 183
    SolutionIndex: 184
    SolutionIndex: 185
    SolutionIndex: 186
    SolutionIndex: 187
    SolutionIndex: 188
    SolutionIndex: 189
    SolutionIndex: 190
    SolutionIndex: 191
    SolutionIndex: 192
    SolutionIndex: 193
    SolutionIndex: 194
    SolutionIndex: 195
    SolutionIndex: 196
    SolutionIndex: 197
    SolutionIndex: 198
    SolutionIndex: 199
    SolutionIndex: 200
    SolutionIndex: 201
    SolutionIndex: 202
    SolutionIndex: 203
    SolutionIndex: 204
    SolutionIndex: 205
    SolutionIndex: 206
    SolutionIndex: 207
    SolutionIndex: 208
    SolutionIndex: 209
    SolutionIndex: 210
    SolutionIndex: 211
    SolutionIndex: 212
    SolutionIndex: 213
    SolutionIndex: 214
    SolutionIndex: 215
    SolutionIndex: 216
    SolutionIndex: 217
    SolutionIndex: 218
    SolutionIndex: 219
    SolutionIndex: 220
    SolutionIndex: 221
    SolutionIndex: 222
    SolutionIndex: 223
    SolutionIndex: 224
    SolutionIndex: 225
    SolutionIndex: 226
    SolutionIndex: 227
    SolutionIndex: 228
    SolutionIndex: 229
    SolutionIndex: 230
    SolutionIndex: 231
    SolutionIndex: 232
    SolutionIndex: 233
    SolutionIndex: 234
    SolutionIndex: 235
    SolutionIndex: 236
    SolutionIndex: 237
    SolutionIndex: 238
    SolutionIndex: 239
    SolutionIndex: 240
    SolutionIndex: 241
    SolutionIndex: 242
    SolutionIndex: 243
    SolutionIndex: 244
    SolutionIndex: 245
    SolutionIndex: 246
    SolutionIndex: 247
    SolutionIndex: 248
    SolutionIndex: 249
    SolutionIndex: 250
    SolutionIndex: 251
    SolutionIndex: 252
    SolutionIndex: 253
- - - [511, 4096, 1, 4096]
    - [11, 1.999]
  - - [512, 3071, 1, 3072]
    - [11, 2.388]
  - - [2880, 3073, 1, 3072]
    - [11, 2.907]
  - - [511, 3072, 1, 3072]
    - [11, 2.378]
  - - [1024, 512, 1, 1025]
    - [11, 1.147]
  - - [511, 2048, 1, 2048]
    - [12, 1.612]
  - - [8192, 8193, 1, 8192]
    - [14, 3.275]
  - - [3072, 3072, 1, 3071]
    - [11, 3.114]
  - - [8192, 8192, 1, 8193]
    - [14, 3.467]
  - - [513, 1024, 1, 1024]
    - [11, 1.131]
  - - [512, 1023, 1, 1024]
    - [11, 1.121]
  - - [512, 2048, 1, 2047]
    - [12, 1.641]
  - - [513, 4096, 1, 4096]
    - [11, 1.988]
  - - [3073, 512, 1, 3072]
    - [11, 2.381]
  - - [4096, 4096, 1, 4097]
    - [11, 3.106]
  - - [1025, 1024, 1, 1024]
    - [12, 1.61]
  - - [8192, 8191, 1, 8192]
    - [14, 3.302]
  - - [8192, 512, 1, 8193]
    - [11, 2.685]
  - - [2880, 3071, 1, 3072]
    - [13, 3.128]
  - - [512, 1025, 1, 1024]
    - [11, 1.16]
  - - [2048, 513, 1, 2048]
    - [12, 1.636]
  - - [1024, 1024, 1, 1025]
    - [12, 1.594]
  - - [960, 1024, 1, 1023]
    - [13, 2.003]
  - - [3072, 512, 1, 3071]
    - [11, 2.394]
  - - [960, 1025, 1, 1024]
    - [12, 1.524]
  - - [3072, 3071, 1, 3072]
    - [11, 3.099]
  - - [512, 2048, 1, 2049]
    - [12, 1.625]
  - - [3072, 511, 1, 3072]
    - [11, 2.386]
  - - [2049, 512, 1, 2048]
    - [12, 1.627]
  - - [512, 8191, 1, 8192]
    - [11, 2.559]
  - - [513, 3072, 1, 3072]
    - [11, 2.374]
  - - [4096, 4095, 1, 4096]
    - [11, 3.063]
  - - [511, 1024, 1, 1024]
    - [11, 1.117]
  - - [513, 512, 1, 512]
    - [15, 0.664]
  - - [1024, 511, 1, 1024]
    - [11, 1.152]
  - - [3072, 3072, 1, 3073]
    - [11, 3.116]
  - - [960, 1024, 1, 1025]
    - [13, 1.991]
  - - [959, 1024, 1, 1024]
    - [12, 1.963]
  - - [512, 3072, 1, 3073]
    - [11, 2.383]
  - - [1023, 512, 1, 1024]
    - [11, 1.153]
  - - [3072, 512, 1, 3073]
    - [11, 2.4]
  - - [512, 2049, 1, 2048]
    - [12, 1.628]
  - - [513, 8192, 1, 8192]
    - [13, 2.482]
  - - [1024, 513, 1, 1024]
    - [11, 1.164]
  - - [8192, 511, 1, 8192]
    - [11, 2.621]
  - - [4096, 4097, 1, 4096]
    - [11, 3.051]
  - - [512, 3072, 1, 3071]
    - [11, 2.381]
  - - [2048, 2047, 1, 2048]
    - [11, 2.645]
  - - [8193, 8192, 1, 8192]
    - [14, 3.304]
  - - [512, 4096, 1, 4095]
    - [12, 1.995]
  - - [1024, 1023, 1, 1024]
    - [12, 1.605]
  - - [3073, 3072, 1, 3072]
    - [11, 3.099]
  - - [512, 3073, 1, 3072]
    - [11, 2.388]
  - - [4096, 4096, 1, 4095]
    - [14, 3.094]
  - - [512, 8192, 1, 8191]
    - [13, 2.534]
  - - [8191, 512, 1, 8192]
    - [11, 2.624]
  - - [1025, 512, 1, 1024]
    - [11, 1.165]
  - - [2881, 3072, 1, 3072]
    - [11, 2.915]
  - - [64, 1024, 1, 1024]
    - [18, 3.509]
  - - [1024, 512, 1, 1023]
    - [11, 1.153]
  - - [513, 2048, 1, 2048]
    - [12, 1.63]
  - - [2880, 3072, 1, 3073]
    - [13, 3.112]
  - - [512, 512, 1, 513]
    - [15, 0.653]
  - - [4095, 512, 1, 4096]
    - [11, 2.058]
  - - [1024, 1025, 1, 1024]
    - [12, 1.6]
  - - [2879, 3072, 1, 3072]
    - [13, 3.13]
  - - [512, 8192, 1, 8193]
    - [11, 2.663]
  - - [511, 8192, 1, 8192]
    - [11, 2.545]
  - - [8192, 513, 1, 8192]
    - [11, 2.624]
  - - [512, 8193, 1, 8192]
    - [11, 2.532]
  - - [512, 512, 1, 511]
    - [15, 0.666]
  - - [2047, 2048, 1, 2048]
    - [11, 2.645]
  - - [2049, 2048, 1, 2048]
    - [11, 2.646]
  - - [960, 1023, 1, 1024]
    - [13, 1.974]
  - - [2880, 3072, 1, 3071]
    - [13, 3.114]
  - - [64, 1025, 1, 1024]
    - [15, 0.201]
  - - [2048, 511, 1, 2048]
    - [12, 1.594]
  - - [4096, 513, 1, 4096]
    - [11, 2.065]
  - - [4097, 512, 1, 4096]
    - [11, 2.062]
  - - [8192, 512, 1, 8191]
    - [13, 2.546]
  - - [2048, 2049, 1, 2048]
    - [11, 2.644]
  - - [2048, 512, 1, 2047]
    - [12, 1.623]
  - - [3071, 3072, 1, 3072]
    - [11, 3.1]
  - - [4096, 511, 1, 4096]
    - [11, 2.058]
  - - [64, 1024, 1, 1025]
    - [15, 0.204]
  - - [2047, 512, 1, 2048]
    - [12, 1.622]
  - - [63, 1024, 1, 1024]
    - [15, 0.199]
  - - [3072, 513, 1, 3072]
    - [11, 2.38]
  - - [512, 4095, 1, 4096]
    - [11, 2.013]
  - - [512, 1024, 1, 1025]
    - [11, 1.146]
  - - [3071, 512, 1, 3072]
    - [11, 2.384]
  - - [512, 511, 1, 512]
    - [15, 0.678]
  - - [4097, 4096, 1, 4096]
    - [11, 3.061]
  - - [2048, 2048, 1, 2047]
    - [11, 2.631]
  - - [512, 4096, 1, 4097]
    - [11, 2.104]
  - - [3072, 3073, 1, 3072]
    - [11, 3.098]
  - - [512, 2047, 1, 2048]
    - [12, 1.618]
  - - [2048, 2048, 1, 2049]
    - [11, 2.666]
  - - [8191, 8192, 1, 8192]
    - [14, 3.304]
  - - [64, 1023, 1, 1024]
    - [15, 0.202]
  - - [4096, 512, 1, 4097]
    - [11, 2.129]
  - - [65, 1024, 1, 1024]
    - [16, 0.195]
  - - [512, 513, 1, 512]
    - [15, 0.687]
  - - [8192, 8192, 1, 8191]
    - [14, 3.469]
  - - [1024, 1024, 1, 1023]
    - [12, 1.613]
  - - [512, 4097, 1, 4096]
    - [11, 2.02]
  - - [511, 512, 1, 512]
    - [15, 0.675]
  - - [4096, 512, 1, 4095]
    - [13, 2.002]
  - - [8193, 512, 1, 8192]
    - [11, 2.628]
  - - [961, 1024, 1, 1024]
    - [12, 1.519]
  - - [512, 1024, 1, 1023]
    - [11, 1.153]
  - - [4095, 4096, 1, 4096]
    - [11, 3.063]
  - - [64, 1024, 1, 1023]
    - [15, 0.198]
  - - [2048, 512, 1, 2049]
    - [12, 1.64]
  - - [1023, 1024, 1, 1024]
    - [12, 1.605]
  - - [512, 512, 1, 512]
    - [155, 19.626]
  - - [512, 1024, 1, 1024]
    - [20, 16.86]
  - - [512, 2048, 1, 2048]
    - [20, 19.231]
  - - [512, 3072, 1, 3072]
    - [20, 28.838]
  - - [512, 4096, 1, 4096]
    - [20, 26.877]
  - - [512, 8192, 1, 8192]
    - [20, 33.16]
  - - [960, 1024, 1, 1024]
    - [20, 24.342]
  - - [1024, 1024, 1, 1024]
    - [204, 45.161]
  - - [2048, 2048, 1, 2048]
    - [132, 78.046]
  - - [2880, 3072, 1, 3072]
    - [20, 35.623]
  - - [3072, 512, 1, 3072]
    - [20, 29.023]
  - - [3072, 3072, 1, 3072]
    - [20, 35.788]
  - - [4096, 512, 1, 4096]
    - [20, 26.94]
  - - [4096, 4096, 1, 4096]
    - [147, 90.743]
  - - [8192, 512, 1, 8192]
    - [20, 33.15]
  - - [8192, 8192, 1, 8192]
    - [196, 95.729]
  - - [479, 1024, 1, 1024]
    - [22, 1.499]
  - - [479, 2048, 1, 2048]
    - [22, 2.3]
  - - [480, 1023, 1, 1024]
    - [22, 1.503]
  - - [480, 1024, 1, 1023]
    - [22, 1.524]
  - - [480, 1024, 1, 1025]
    - [22, 1.528]
  - - [480, 1025, 1, 1024]
    - [21, 1.26]
  - - [480, 2047, 1, 2048]
    - [22, 2.302]
  - - [480, 2048, 1, 2047]
    - [22, 2.306]
  - - [480, 2048, 1, 2049]
    - [22, 2.31]
  - - [480, 2049, 1, 2048]
    - [22, 1.812]
  - - [481, 1024, 1, 1024]
    - [21, 1.225]
  - - [481, 2048, 1, 2048]
    - [22, 1.775]
  - - [511, 480, 1, 512]
    - [23, 0.75]
  - - [512, 479, 1, 512]
    - [23, 0.747]
  - - [512, 480, 1, 511]
    - [23, 0.755]
  - - [512, 480, 1, 513]
    - [23, 0.752]
  - - [512, 481, 1, 512]
    - [23, 0.727]
  - - [513, 480, 1, 512]
    - [23, 0.71]
  - - [1023, 480, 1, 1024]
    - [23, 1.419]
  - - [1024, 479, 1, 1024]
    - [23, 1.413]
  - - [1024, 480, 1, 1023]
    - [23, 1.408]
  - - [1024, 480, 1, 1025]
    - [23, 1.41]
  - - [1024, 481, 1, 1024]
    - [21, 1.252]
  - - [1025, 480, 1, 1024]
    - [21, 1.257]
  - - [2047, 480, 1, 2048]
    - [24, 2.319]
  - - [2048, 479, 1, 2048]
    - [24, 2.315]
  - - [2048, 480, 1, 2047]
    - [24, 2.279]
  - - [2048, 480, 1, 2049]
    - [24, 2.276]
  - - [2048, 481, 1, 2048]
    - [22, 1.789]
  - - [2049, 480, 1, 2048]
    - [22, 1.785]
  - - [480, 1024, 1, 1024]
    - [250, 41.869]
  - - [480, 2048, 1, 2048]
    - [251, 65.081]
  - - [512, 480, 1, 512]
    - [245, 20.659]
  - - [1024, 480, 1, 1024]
    - [252, 45.291]
  - - [2048, 480, 1, 2048]
    - [253, 65.306]
  - - [480, 3072, 1, 3072]
    - [26, 23.039]
  - - [480, 4096, 1, 4096]
    - [28, 22.557]
  - - [480, 8192, 1, 8192]
    - [27, 27.105]
  - - [3072, 480, 1, 3072]
    - [29, 23.395]
  - - [4096, 480, 1, 4096]
    - [29, 21.441]
  - - [8192, 480, 1, 8192]
    - [30, 27.075]
  - - [17, 17, 1, 64]
    - [36, 0.003]
  - - [24, 24, 1, 64]
    - [46, 0.006]
  - - [30, 31, 1, 64]
    - [46, 0.01]
  - - [32, 32, 1, 64]
    - [40, 0.01]
  - - [32, 35, 1, 64]
    - [49, 0.011]
  - - [31, 31, 1, 64]
    - [42, 0.01]
  - - [34, 34, 1, 64]
    - [39, 0.011]
  - - [30, 30, 1, 64]
    - [38, 0.009]
  - - [17, 15, 1, 64]
    - [52, 0.003]
  - - [35, 35, 1, 64]
    - [46, 0.013]
  - - [21, 17, 1, 64]
    - [38, 0.004]
  - - [21, 21, 1, 64]
    - [36, 0.004]
  - - [15, 14, 1, 64]
    - [36, 0.002]
  - - [14, 14, 1, 64]
    - [35, 0.001]
  - - [15, 15, 1, 64]
    - [36, 0.002]
  - - [34, 24, 1, 64]
    - [32, 0.008]
  - - [2, 4, 1, 1024]
    - [143, 0.001]
  - - [2, 32, 1, 1024]
    - [134, 0.009]
  - - [2, 2048, 1, 1024]
    - [172, 0.553]
  - - [64, 128, 512, 128]
    - [159, 25.832]
  - - [64, 512, 1, 512]
    - [151, 3.739]
  - - [64, 512, 64, 512]
    - [200, 41.267]
  - - [128, 128, 512, 64]
    - [185, 25.832]
  - - [512, 512, 1, 64]
    - [200, 4.362]
  - - [512, 512, 64, 64]
    - [185, 35.632]
  - - [1024, 4, 1, 1024]
    - [246, 0.608]
  - - [1024, 4, 1, 1024]
    - [246, 0.608]
  - - [1024, 32, 1, 1024]
    - [162, 5.065]
  - - [1024, 2048, 1, 1024]
    - [232, 59.813]
  - - [1024, 2048, 1, 4096]
    - [164, 66.027]
  - - [1024, 4096, 1, 1024]
    - [152, 72.618]
  - - [1024, 4096, 1, 4096]
    - [156, 78.332]
  - - [4096, 2048, 1, 1024]
    - [201, 83.174]
  - - [4096, 4096, 1, 1024]
    - [160, 86.485]
  - - [30528, 2048, 1, 1024]
    - [147, 91.773]
  - - [30528, 4096, 1, 1024]
    - [147, 92.778]
  - - [3, 3, 512, 64]
    - [194, 0.054]
  - - [5, 5, 512, 64]
    - [128, 0.145]
  - - [5, 5, 960, 64]
    - [128, 0.216]
  - - [9, 9, 512, 64]
    - [225, 0.46]
  - - [27, 27, 32768, 128]
    - [150, 14.611]
  - - [32, 1600, 1, 512]
    - [174, 5.334]
  - - [33, 33, 1600, 32]
    - [153, 3.201]
  - - [64, 512, 1, 1024]
    - [165, 5.414]
  - - [64, 960, 1, 1024]
    - [145, 9.652]
  - - [128, 32768, 1, 256]
    - [234, 51.931]
  - - [256, 684, 1, 1024]
    - [219, 21.241]
  - - [256, 1280, 1, 1024]
    - [213, 32.881]
  - - [256, 1536, 1, 1024]
    - [184, 38.847]
  - - [256, 2304, 1, 1024]
    - [166, 39.527]
  - - [256, 2560, 1, 1024]
    - [166, 44.227]
  - - [256, 2816, 1, 1024]
    - [166, 47.644]
  - - [256, 3328, 1, 1024]
    - [166, 53.891]
  - - [256, 3584, 1, 1024]
    - [202, 56.361]
  - - [256, 4608, 1, 1024]
    - [184, 50.354]
  - - [256, 4864, 1, 1024]
    - [184, 51.767]
  - - [256, 5376, 1, 1024]
    - [184, 56.002]
  - - [256, 5888, 1, 1024]
    - [156, 60.564]
  - - [256, 6144, 1, 1024]
    - [156, 62.413]
  - - [256, 6400, 1, 1024]
    - [156, 64.88]
  - - [256, 6656, 1, 1024]
    - [156, 67.058]
  - - [256, 7168, 1, 1024]
    - [167, 71.628]
  - - [256, 7424, 1, 1024]
    - [167, 73.886]
  - - [256, 7936, 1, 1024]
    - [192, 56.026]
  - - [256, 8192, 1, 1024]
    - [138, 57.915]
  - - [256, 8448, 1, 1024]
    - [163, 59.898]
  - - [256, 8960, 1, 1024]
    - [138, 63.438]
  - - [256, 9984, 1, 1024]
    - [131, 69.881]
  - - [256, 10496, 1, 1024]
    - [129, 72.738]
  - - [256, 11264, 1, 1024]
    - [131, 76.653]
  - - [256, 11520, 1, 1024]
    - [129, 78.07]
  - - [256, 11776, 1, 1024]
    - [137, 64.63]
  - - [256, 12544, 1, 1024]
    - [137, 68.921]
  - - [256, 13312, 1, 1024]
    - [137, 72.172]
  - - [256, 14336, 1, 1024]
    - [142, 76.539]
  - - [256, 14592, 1, 1024]
    - [131, 77.652]
  - - [256, 14848, 1, 1024]
    - [131, 78.844]
  - - [256, 15104, 1, 1024]
    - [156, 79.771]
  - - [256, 16128, 1, 1024]
    - [138, 71.742]
  - - [256, 18176, 1, 1024]
    - [205, 79.2]
  - - [256, 18944, 1, 1024]
    - [163, 80.197]
  - - [256, 19200, 1, 1024]
    - [167, 81.07]
  - - [256, 20480, 1, 1024]
    - [137, 76.706]
  - - [256, 20992, 1, 1024]
    - [205, 78.206]
  - - [256, 21248, 1, 1024]
    - [205, 78.98]
  - - [256, 21504, 1, 1024]
    - [129, 79.871]
  - - [256, 22016, 1, 1024]
    - [131, 81.403]
  - - [256, 22344, 1, 1024]
    - [237, 78.814]
  - - [256, 23296, 1, 1024]
    - [205, 75.999]
  - - [256, 23552, 1, 1024]
    - [163, 76.629]
  - - [256, 31488, 1, 1024]
    - [163, 80.551]
  - - [256, 32768, 1, 512]
    - [156, 76.632]
  - - [256, 33536, 1, 1024]
    - [205, 84.294]
  - - [256, 44505, 1, 1024]
    - [129, 83.632]
  - - [512, 1600, 1, 512]
    - [222, 41.102]
  - - [512, 32768, 1, 13]
    - [179, 5.308]
  - - [512, 32768, 1, 1024]
    - [137, 86.276]
  - - [684, 8976, 1, 256]
    - [193, 56.033]
  - - [1024, 200, 1, 560]
    - [154, 13.849]
  - - [1024, 512, 1, 1024]
    - [236, 36.408]
  - - [1024, 512, 1, 1600]
    - [243, 39.95]
  - - [1024, 960, 1, 1024]
    - [231, 58.694]
  - - [1024, 960, 1, 1600]
    - [202, 69.105]
  - - [1024, 1600, 1, 560]
    - [199, 45.073]
  - - [1024, 1600, 1, 1024]
    - [171, 65.148]
  - - [1024, 32768, 1, 480]
    - [193, 87.0]
  - - [1024, 32768, 1, 1024]
    - [137, 89.943]
  - - [1280, 8976, 1, 256]
    - [127, 66.727]
  - - [1792, 8976, 1, 256]
    - [138, 72.503]
  - - [2048, 114, 1, 512]
    - [209, 16.213]
  - - [2048, 114, 1, 768]
    - [200, 20.588]
  - - [2048, 215, 1, 512]
    - [180, 25.573]
  - - [2048, 215, 1, 768]
    - [149, 30.284]
  - - [2048, 256, 1, 512]
    - [222, 29.042]
  - - [2048, 256, 1, 768]
    - [240, 33.054]
  - - [2048, 512, 1, 67]
    - [190, 8.484]
  - - [2048, 512, 1, 74]
    - [190, 8.965]
  - - [2048, 512, 1, 100]
    - [161, 12.344]
  - - [2048, 512, 1, 2048]
    - [173, 53.735]
  - - [2048, 684, 1, 512]
    - [238, 46.131]
  - - [2048, 684, 1, 768]
    - [195, 51.107]
  - - [2048, 960, 1, 74]
    - [229, 15.298]
  - - [2048, 960, 1, 2048]
    - [136, 80.004]
  - - [2048, 1536, 1, 512]
    - [203, 61.9]
  - - [2048, 1536, 1, 768]
    - [182, 65.916]
  - - [2048, 8976, 1, 256]
    - [183, 70.975]
  - - [2304, 8976, 1, 256]
    - [127, 74.115]
  - - [2560, 8976, 1, 256]
    - [176, 74.343]
  - - [2816, 8976, 1, 256]
    - [183, 75.741]
  - - [3072, 8976, 1, 256]
    - [178, 75.975]
  - - [3328, 8976, 1, 256]
    - [176, 76.953]
  - - [3840, 8976, 1, 256]
    - [169, 77.029]
  - - [4096, 8976, 1, 256]
    - [183, 75.801]
  - - [4352, 8976, 1, 256]
    - [216, 78.61]
  - - [4608, 8976, 1, 256]
    - [178, 79.115]
  - - [4864, 8976, 1, 256]
    - [223, 79.119]
  - - [5120, 8976, 1, 256]
    - [169, 78.841]
  - - [5376, 8976, 1, 256]
    - [217, 78.913]
  - - [5632, 8976, 1, 256]
    - [140, 79.131]
  - - [5888, 8976, 1, 256]
    - [183, 78.595]
  - - [6144, 8976, 1, 256]
    - [234, 77.902]
  - - [6400, 8976, 1, 256]
    - [223, 77.998]
  - - [7168, 8976, 1, 256]
    - [140, 76.975]
  - - [7936, 8976, 1, 256]
    - [127, 77.378]
  - - [8192, 8976, 1, 256]
    - [183, 74.915]
  - - [8448, 8976, 1, 256]
    - [138, 77.851]
  - - [8960, 8976, 1, 256]
    - [138, 77.944]
  - - [9472, 8976, 1, 256]
    - [127, 78.176]
  - - [9728, 8976, 1, 256]
    - [136, 75.836]
  - - [9984, 8976, 1, 256]
    - [138, 78.213]
  - - [10240, 8976, 1, 256]
    - [136, 75.906]
  - - [10496, 8976, 1, 256]
    - [127, 78.411]
  - - [11264, 8976, 1, 256]
    - [136, 76.303]
  - - [11776, 8976, 1, 256]
    - [136, 76.737]
  - - [12544, 8976, 1, 256]
    - [138, 78.472]
  - - [13312, 8976, 1, 256]
    - [132, 76.408]
  - - [13568, 8976, 1, 256]
    - [127, 78.643]
  - - [13824, 8976, 1, 256]
    - [136, 76.439]
  - - [15104, 8976, 1, 256]
    - [138, 79.113]
  - - [15360, 8976, 1, 256]
    - [136, 76.134]
  - - [15872, 8976, 1, 256]
    - [138, 77.063]
  - - [16128, 8976, 1, 256]
    - [138, 78.886]
  - - [17152, 8976, 1, 256]
    - [127, 79.5]
  - - [18176, 8976, 1, 256]
    - [127, 79.338]
  - - [18688, 8976, 1, 256]
    - [127, 79.601]
  - - [18944, 8976, 1, 256]
    - [136, 76.98]
  - - [19712, 8976, 1, 256]
    - [127, 79.603]
  - - [19968, 8976, 1, 256]
    - [136, 77.153]
  - - [20480, 8976, 1, 256]
    - [132, 76.92]
  - - [20992, 8976, 1, 256]
    - [132, 77.237]
  - - [21248, 8976, 1, 256]
    - [138, 79.038]
  - - [23552, 8976, 1, 256]
    - [132, 77.2]
  - - [28672, 8976, 1, 256]
    - [132, 77.595]
  - - [31488, 8976, 1, 256]
    - [127, 79.6]
  - - [33536, 8976, 1, 256]
    - [127, 79.875]
  - - [44505, 8976, 1, 256]
    - [138, 76.192]
  - - [14, 14, 10880, 64]
    - [150, 2.86]
  - - [15, 14, 10880, 64]
    - [150, 3.058]
  - - [15, 15, 7680, 64]
    - [150, 2.969]
  - - [15, 15, 10880, 64]
    - [150, 3.284]
  - - [17, 15, 7680, 64]
    - [150, 3.309]
  - - [17, 17, 7680, 64]
    - [150, 3.703]
  - - [21, 17, 6144, 64]
    - [150, 3.475]
  - - [21, 21, 6144, 64]
    - [150, 3.957]
  - - [24, 24, 4736, 64]
    - [150, 6.522]
  - - [30, 30, 2048, 64]
    - [154, 6.344]
  - - [30, 31, 2048, 64]
    - [148, 6.427]
  - - [31, 31, 2048, 64]
    - [239, 6.549]
  - - [32, 32, 4608, 64]
    - [150, 8.643]
  - - [32, 35, 4608, 64]
    - [177, 7.247]
  - - [34, 24, 4736, 64]
    - [200, 7.371]
  - - [34, 34, 4736, 64]
    - [159, 7.183]
  - - [35, 35, 4608, 64]
    - [166, 6.446]
  - - [1024, 3840, 1, 1024]
    - [167, 80.862]
  - - [1024, 3840, 1, 4096]
    - [139, 91.405]
  - - [1024, 3968, 1, 1024]
    - [169, 70.412]
  - - [1024, 3968, 1, 4096]
    - [247, 75.06]
  - - [1024, 6528, 1, 1024]
    - [156, 83.247]
  - - [1024, 6528, 1, 4096]
    - [224, 87.557]
  - - [1024, 7104, 1, 1024]
    - [137, 81.391]
  - - [1024, 7104, 1, 4096]
    - [156, 86.342]
  - - [1024, 7200, 1, 1024]
    - [167, 81.398]
  - - [1024, 7200, 1, 4096]
    - [152, 85.926]
  - - [1024, 8064, 1, 1024]
    - [137, 82.687]
  - - [1024, 8064, 1, 4096]
    - [224, 87.281]
  - - [1024, 8160, 1, 1024]
    - [218, 81.087]
  - - [1024, 8160, 1, 4096]
    - [206, 87.596]
  - - [1024, 9216, 1, 1024]
    - [137, 84.956]
  - - [1024, 9216, 1, 4096]
    - [242, 89.717]
  - - [1024, 9520, 1, 1024]
    - [147, 84.466]
  - - [1024, 9520, 1, 4096]
    - [139, 90.786]
  - - [1024, 10064, 1, 1024]
    - [160, 82.99]
  - - [1024, 10064, 1, 4096]
    - [248, 88.542]
  - - [1024, 10080, 1, 1024]
    - [133, 83.297]
  - - [1024, 10080, 1, 4096]
    - [152, 88.822]
  - - [1024, 10200, 1, 1024]
    - [160, 84.216]
  - - [1024, 10200, 1, 4096]
    - [152, 88.332]
  - - [4096, 3840, 1, 1024]
    - [181, 86.08]
  - - [4096, 3968, 1, 1024]
    - [147, 87.452]
  - - [4096, 6528, 1, 1024]
    - [160, 88.94]
  - - [4096, 7104, 1, 1024]
    - [163, 88.663]
  - - [4096, 7200, 1, 1024]
    - [127, 87.685]
  - - [4096, 8064, 1, 1024]
    - [160, 90.358]
  - - [4096, 8160, 1, 1024]
    - [147, 88.761]
  - - [4096, 9216, 1, 1024]
    - [201, 89.518]
  - - [4096, 9520, 1, 1024]
    - [147, 89.247]
  - - [4096, 10064, 1, 1024]
    - [147, 89.607]
  - - [4096, 10080, 1, 1024]
    - [147, 89.698]
  - - [4096, 10200, 1, 1024]
    - [147, 89.949]
  - - [42720, 3968, 1, 1024]
    - [147, 92.472]
  - - [42720, 6528, 1, 1024]
    - [147, 92.609]
  - - [42720, 7104, 1, 1024]
    - [171, 92.197]
  - - [42720, 7200, 1, 1024]
    - [171, 91.477]
  - - [42720, 9520, 1, 1024]
    - [147, 92.236]
  - - [42720, 10080, 1, 1024]
    - [147, 92.54]
  - - [27, 27, 1920, 64]
    - [63, 4.213]
  - - [27, 33, 1920, 64]
    - [56, 4.595]
  - - [33, 33, 1920, 64]
    - [78, 3.385]
  - - [27, 27, 1920, 64]
    - [76, 4.299]
  - - [27, 33, 1920, 64]
    - [79, 4.637]
  - - [33, 33, 1920, 64]
    - [98, 3.488]
  - - [1024, 3240, 1, 1024]
    - [123, 35.327]
  - - [1024, 3240, 1, 4096]
    - [64, 38.283]
  - - [1024, 3960, 1, 1024]
    - [86, 35.104]
  - - [1024, 3960, 1, 4096]
    - [113, 37.527]
  - - [4096, 3240, 1, 1024]
    - [125, 42.293]
  - - [4096, 3960, 1, 1024]
    - [103, 43.442]
  - - [42720, 3960, 1, 1024]
    - [114, 45.756]
  - - [1024, 10, 1, 1024]
    - [130, 1.571]
  - - [1024, 32768, 1, 479]
    - [135, 57.083]
  - - [1024, 4992, 1, 4096]
    - [139, 80.636]
  - - [1024, 5, 1, 1024]
    - [141, 0.743]
  - - [2, 5, 1, 1024]
    - [143, 0.001]
  - - [8192, 7680, 1, 8192]
    - [144, 96.535]
  - - [2, 40, 1, 1024]
    - [146, 0.012]
  - - [128, 128, 128, 64]
    - [153, 15.604]
  - - [64, 128, 1, 128]
    - [130, 0.298]
  - - [1024, 2560, 1, 4096]
    - [156, 77.835]
  - - [30522, 462, 1, 1024]
    - [157, 78.224]
  - - [1024, 820, 1, 1024]
    - [158, 51.089]
  - - [4096, 5248, 1, 1024]
    - [147, 88.579]
  - - [4096, 3840, 1, 4096]
    - [147, 94.588]
  - - [1024, 39, 1, 1024]
    - [162, 5.843]
  - - [128, 128, 160, 64]
    - [159, 18.047]
  - - [4096, 1280, 1, 1024]
    - [152, 76.941]
  - - [1024, 2560, 1, 1024]
    - [152, 71.98]
  - - [1024, 800, 1, 1024]
    - [168, 50.811]
  - - [1024, 8, 1, 1024]
    - [170, 1.217]
  - - [30522, 160, 1, 1024]
    - [171, 66.241]
  - - [2, 1024, 1, 1024]
    - [172, 0.295]
  - - [30522, 308, 1, 1024]
    - [175, 79.372]
  - - [17, 17, 6144, 64]
    - [150, 3.043]
  - - [4096, 2560, 1, 1024]
    - [160, 86.179]
  - - [4096, 8192, 1, 1024]
    - [160, 89.869]
  - - [33, 33, 1, 32]
    - [128, 0.009]
  - - [1024, 5120, 1, 1024]
    - [182, 77.415]
  - - [1024, 9, 1, 1024]
    - [130, 1.369]
  - - [1024, 780, 1, 1024]
    - [166, 50.859]
  - - [512, 512, 80, 64]
    - [183, 37.216]
  - - [4096, 3072, 1, 1024]
    - [160, 86.937]
  - - [480, 512, 1, 512]
    - [186, 20.659]
  - - [1024, 3072, 1, 4096]
    - [187, 73.909]
  - - [4096, 1024, 1, 1024]
    - [188, 73.28]
  - - [1024, 1152, 1, 1024]
    - [189, 49.581]
  - - [128, 128, 656, 64]
    - [190, 27.392]
  - - [1024, 1024, 1, 4096]
    - [191, 57.337]
  - - [30522, 820, 1, 1024]
    - [171, 86.633]
  - - [2, 10, 1, 1024]
    - [143, 0.003]
  - - [1024, 180, 1, 1024]
    - [197, 21.942]
  - - [128, 128, 624, 64]
    - [198, 27.214]
  - - [1024, 160, 1, 1024]
    - [207, 20.524]
  - - [4096, 5120, 1, 1024]
    - [208, 87.702]
  - - [4, 4, 38400, 64]
    - [143, 0.255]
  - - [2048, 1920, 1, 2048]
    - [156, 89.559]
  - - [2, 39, 1, 1024]
    - [134, 0.01]
  - - [1024, 462, 1, 1024]
    - [210, 33.832]
  - - [2, 9, 1, 1024]
    - [134, 0.003]
  - - [30522, 180, 1, 1024]
    - [211, 72.468]
  - - [33712, 8192, 1, 1024]
    - [147, 92.752]
  - - [1024, 77, 1, 1024]
    - [212, 10.495]
  - - [5, 5, 1, 64]
    - [143, 0.0]
  - - [1024, 40, 1, 1024]
    - [162, 5.902]
  - - [2, 8, 1, 1024]
    - [214, 0.001]
  - - [512, 512, 96, 64]
    - [156, 37.728]
  - - [1024, 1152, 1, 4096]
    - [215, 62.935]
  - - [30522, 385, 1, 1024]
    - [171, 75.148]
  - - [1024, 200, 1, 1024]
    - [219, 23.504]
  - - [1024, 5120, 1, 4096]
    - [187, 82.72]
  - - [30522, 616, 1, 1024]
    - [220, 83.84]
  - - [1024, 41, 1, 1024]
    - [162, 6.238]
  - - [128, 128, 1, 64]
    - [221, 0.316]
  - - [1024, 5248, 1, 4096]
    - [187, 84.701]
  - - [4, 4, 32768, 64]
    - [143, 0.25]
  - - [128, 128, 640, 64]
    - [190, 27.187]
  - - [7680, 8192, 1, 8192]
    - [226, 96.472]
  - - [1024, 1280, 1, 4096]
    - [227, 64.454]
  - - [1024, 5248, 1, 1024]
    - [167, 79.288]
  - - [512, 512, 128, 64]
    - [228, 38.648]
  - - [512, 512, 16, 64]
    - [176, 22.837]
  - - [1024, 9600, 1, 1024]
    - [160, 85.291]
  - - [2, 6, 1, 1024]
    - [214, 0.001]
  - - [1024, 385, 1, 1024]
    - [230, 35.641]
  - - [1024, 4992, 1, 1024]
    - [167, 75.479]
  - - [33712, 9600, 1, 1024]
    - [147, 92.893]
  - - [1024, 512, 1, 4096]
    - [233, 44.91]
  - - [1024, 9600, 1, 4096]
    - [139, 93.202]
  - - [1024, 6, 1, 1024]
    - [141, 0.892]
  - - [1024, 308, 1, 1024]
    - [209, 27.728]
  - - [3840, 4096, 1, 4096]
    - [235, 94.729]
  - - [2, 41, 1, 1024]
    - [134, 0.012]
  - - [4096, 1152, 1, 1024]
    - [167, 80.964]
  - - [4096, 9600, 1, 1024]
    - [160, 90.288]
  - - [30522, 200, 1, 1024]
    - [175, 64.496]
  - - [4096, 4992, 1, 1024]
    - [147, 88.945]
  - - [1024, 8192, 1, 1024]
    - [137, 83.217]
  - - [30522, 780, 1, 1024]
    - [171, 83.309]
  - - [4096, 512, 1, 1024]
    - [127, 58.252]
  - - [1024, 1280, 1, 1024]
    - [232, 53.909]
  - - [1920, 2048, 1, 2048]
    - [156, 89.03]
  - - [1024, 3072, 1, 1024]
    - [241, 68.512]
  - - [1024, 8192, 1, 4096]
    - [224, 88.217]
  - - [128, 128, 144, 64]
    - [244, 16.823]
  - - [30522, 800, 1, 1024]
    - [175, 84.596]
  - - [30522, 77, 1, 1024]
    - [249, 45.637]
- null
