library/src/blas3/Tensile/Logic/asm_full/arcturus_Cijk_Ailk_Bljk_BBH.yaml
- {MinimumRequiredVersion: 4.14.0}
- arcturus
- gfx908
- [Device 7380, Device 7388, Device 738c, Device 7390]
    SolutionIndex: 0
    SolutionNameMin: Cijk_Ailk_Bljk_BBH_MT32x32x32_MI16x16x8x1_SE_1LDSB0_AF0EM8_AF1EM1_EPS1_FL0_GRVW4_GSU1_IU1_LBSPP128_LPB4_LRVW4_NLCA1_PGR1_PLR5_SU0_SUM0_SUS256_SRVW4_TT1_16_TLDS1_WSGRA1_WSGRB1_WG32_8_1_WGM1
    SolutionIndex: 1
    SolutionNameMin: Cijk_Ailk_Bljk_BBH_MT32x32x32_MI16x16x8x1_SE_1LDSB0_AF0EM8_AF1EM1_EPS0_FL0_GRVW4_GSU1_IU1_LBSPP128_LPB4_LRVW4_NLCA1_PGR2_PLR5_SU0_SUM0_SUS256_SRVW4_TT1_16_TLDS1_WSGRA1_WSGRB1_WG32_8_1_WGM1
    SolutionIndex: 2
    SolutionNameMin: Cijk_Ailk_Bljk_BBH_MT32x32x64_MI16x16x8x1_SE_1LDSB0_AF0EM8_AF1EM1_EPS1_FL0_GRVW2_GSU1_IU1_LBSPP128_LPB4_LRVW4_NLCA1_PGR1_PLR9_SU32_SUM0_SUS128_SRVW4_TT1_16_TLDS1_WSGRA1_WSGRB1_WG32_8_1_WGM1
    SolutionIndex: 3
    SolutionNameMin: Cijk_Ailk_Bljk_BBH_MT32x32x32_MI16x16x8x1_SE_1LDSB0_AF0EM8_AF1EM1_EPS1_FL0_GRVW4_GSU1_IU1_LBSPP128_LPB4_LRVW4_NLCA1_PGR1_PLR5_SU0_SUM0_SUS256_SRVW4_TT1_16_TLDS1_WSGRA1_WSGRB1_WG32_8_1_WGM2
    SolutionIndex: 4
    SolutionNameMin: Cijk_Ailk_Bljk_BBH_MT32x32x32_MI16x16x8x1_SE_1LDSB0_AF0EM8_AF1EM1_EPS1_FL0_GRVW2_GSU1_IU1_LBSPP128_LPB4_LRVW4_NLCA1_PGR1_PLR5_SU0_SUM0_SUS256_SRVW4_TT1_16_TLDS1_WSGRA1_WSGRB1_WG32_8_1_WGM1
    SolutionIndex: 5
    SolutionNameMin: Cijk_Ailk_Bljk_BBH_MT32x32x64_MI16x16x8x1_SE_1LDSB0_AF0EM4_AF1EM1_EPS1_FL0_GRVW8_GSU1_IU1_LBSPP128_LPB8_LRVW2_NLCA1_PGR1_PLR1_SU16_SUM0_SUS256_SRVW0_TT1_16_TLDS1_WSGRA1_WSGRB1_WG32_8_1_WGM2
    SolutionIndex: 6
    SolutionNameMin: Cijk_Ailk_Bljk_BBH_MT32x32x32_MI16x16x8x1_SE_1LDSB0_AF0EM8_AF1EM1_EPS1_FL0_GRVW8_GSU1_IU1_LBSPP128_LPB8_LRVW4_NLCA1_PGR1_PLR5_SU0_SUM0_SUS256_SRVW4_TT1_16_TLDS1_WSGRA1_WSGRB1_WG32_8_1_WGM15
    SolutionIndex: 7
    SolutionNameMin: Cijk_Ailk_Bljk_BBH_MT32x32x32_MI16x16x8x1_SE_1LDSB0_AF0EM4_AF1EM1_EPS1_FL0_GRVW4_GSU1_IU1_LBSPP128_LPB4_LRVW2_NLCA1_PGR1_PLR1_SU0_SUM0_SUS256_SRVW0_TT1_16_TLDS1_WSGRA1_WSGRB1_WG32_8_1_WGM1
    SolutionIndex: 8
    SolutionNameMin: Cijk_Ailk_Bljk_BBH_MT64x64x32_MI32x32x4x1_SE_1LDSB0_AF0EM4_AF1EM1_EPS1_FL0_GRVW8_GSU1_IU1_LBSPP128_LPB8_LRVW2_NLCA1_PGR1_PLR1_SU32_SUM0_SUS128_SRVW0_TT1_32_TLDS1_WSGRA1_WSGRB1_WG64_4_1_WGM1
    SolutionIndex: 9
    SolutionNameMin: Cijk_Ailk_Bljk_BBH_MT32x32x32_MI16x16x8x1_SE_1LDSB0_AF0EM4_AF1EM1_EPS1_FL0_GRVW4_GSU1_IU1_LBSPP128_LPB4_LRVW2_NLCA1_PGR1_PLR1_SU32_SUM0_SUS128_SRVW0_TT1_16_TLDS1_WSGRA1_WSGRB1_WG32_8_1_WGM2
    SolutionIndex: 10
    SolutionNameMin: Cijk_Ailk_Bljk_BBH_MT64x16x32_MI16x16x8x1_SE_1LDSB0_AF0EM8_AF1EM1_EPS1_FL0_GRVW8_GSU1_IU1_LBSPP128_LPB8_LRVW4_NLCA1_PGR1_PLR5_SU0_SUM0_SUS256_SRVW0_TT1_16_TLDS1_WSGRA1_WSGRB1_WG64_4_1_WGM2
    SolutionIndex: 11
    SolutionNameMin: Cijk_Ailk_Bljk_BBH_MT32x64x32_MI16x16x8x1_SE_1LDSB0_AF0EM4_AF1EM1_EPS1_FL0_GRVW2_GSU1_IU1_LBSPP128_LPB2_LRVW2_NLCA1_PGR1_PLR1_SU0_SUM0_SUS256_SRVW0_TT1_32_TLDS1_WSGRA1_WSGRB1_WG32_8_1_WGM1
    SolutionIndex: 12
    SolutionNameMin: Cijk_Ailk_Bljk_BBH_MT64x80x32_MI16x16x8x1_SE_1LDSB0_AF0EM4_AF1EM1_EPS1_FL0_GRVW2_GSU1_IU1_LBSPP128_LPB2_LRVW2_NLCA1_PGR1_PLR1_SU32_SUM0_SUS256_SRVW0_TT1_80_TLDS1_WSGRA1_WSGRB1_WG64_4_1_WGM2
    SolutionIndex: 13
    SolutionNameMin: Cijk_Ailk_Bljk_BBH_MT64x128x32_MI16x16x2x4_SE_1LDSB0_AF0EM4_AF1EM1_EPS1_FL1_GRVW2_GSU1_IU1_LBSPP128_LPB2_LRVW2_NLCA1_PGR1_PLR1_SU0_SUM0_SUS256_SRVW4_TT1_32_TLDS1_WSGRA0_WSGRB0_WG64_4_1_WGM4
    SolutionIndex: 14
    SolutionNameMin: Cijk_Ailk_Bljk_BBH_MT128x144x32_MI16x16x8x1_SE_1LDSB1_AF0EM8_AF1EM1_EPS1_FL0_GRVW2_GSU1_IU1_LBSPP128_LPB4_LRVW4_NLCA1_PGR1_PLR5_SU0_SUM0_SUS256_SRVW4_TT2_144_TLDS1_WSGRA1_WSGRB1_WG64_4_1_WGM1
    SolutionIndex: 15
    SolutionNameMin: Cijk_Ailk_Bljk_BBH_MT32x32x128_MI16x16x8x1_SE_1LDSB0_AF0EM4_AF1EM1_EPS1_FL0_GRVW8_GSU1_IU1_LBSPP256_LPB8_LRVW2_NLCA1_PGR1_PLR1_SU0_SUM0_SUS256_SRVW0_TT1_16_TLDS1_WSGRA1_WSGRB1_WG32_8_1_WGM1
    SolutionIndex: 16
    SolutionNameMin: Cijk_Ailk_Bljk_BBH_MT32x32x64_MI16x16x8x1_SE_1LDSB0_AF0EM8_AF1EM1_EPS1_FL0_GRVW8_GSU1_IU1_LBSPP128_LPB8_LRVW4_NLCA1_PGR1_PLR9_SU32_SUM0_SUS128_SRVW4_TT1_16_TLDS1_WSGRA1_WSGRB1_WG32_8_1_WGM15
    SolutionIndex: 17
    SolutionNameMin: Cijk_Ailk_Bljk_BBH_MT64x64x32_MI32x32x4x1_SE_1LDSB0_AF0EM8_AF1EM1_EPS1_FL0_GRVW8_GSU1_IU1_LBSPP128_LPB8_LRVW4_NLCA1_PGR1_PLR9_SU32_SUM0_SUS256_SRVW4_TT1_32_TLDS1_WSGRA1_WSGRB1_WG64_4_1_WGM15
    SolutionIndex: 18
    SolutionNameMin: Cijk_Ailk_Bljk_BBH_MT128x144x32_MI16x16x8x1_SE_1LDSB0_AF0EM8_AF1EM1_EPS1_FL0_GRVW2_GSU1_IU1_LBSPP128_LPB4_LRVW4_NLCA1_PGR1_PLR5_SU0_SUM0_SUS256_SRVW4_TT2_144_TLDS1_WSGRA1_WSGRB1_WG64_4_1_WGM15
    SolutionIndex: 19
    SolutionNameMin: Cijk_Ailk_Bljk_BBH_MT128x144x32_MI16x16x8x1_SE_1LDSB1_AF0EM8_AF1EM1_EPS1_FL0_GRVW2_GSU1_IU1_LBSPP128_LPB4_LRVW4_NLCA1_PGR1_PLR5_SU32_SUM0_SUS256_SRVW4_TT2_144_TLDS1_WSGRA1_WSGRB1_WG64_4_1_WGM15
    SolutionIndex: 20
    SolutionNameMin: Cijk_Ailk_Bljk_BBH_MT128x96x64_MI32x32x4x1_SE_1LDSB0_AF0EM8_AF1EM1_EPS1_FL0_GRVW8_GSU2_IU1_LBSPP128_LPB8_LRVW4_NLCA1_PGR1_PLR17_SU32_SUM0_SUS128_SRVW4_TT1_96_TLDS1_WSGRA1_WSGRB1_WG128_2_1_WGM15
    SolutionIndex: 21
    SolutionNameMin: Cijk_Ailk_Bljk_BBH_MT128x96x32_MI32x32x4x1_SE_1LDSB0_AF0EM8_AF1EM1_EPS1_FL0_GRVW4_GSU1_IU1_LBSPP128_LPB4_LRVW4_NLCA1_PGR1_PLR9_SU32_SUM0_SUS128_SRVW4_TT1_96_TLDS1_WSGRA1_WSGRB1_WG128_2_1_WGM15
    SolutionIndex: 22
    SolutionNameMin: Cijk_Ailk_Bljk_BBH_MT128x96x32_MI32x32x4x1_SE_1LDSB0_AF0EM4_AF1EM1_EPS1_FL0_GRVW4_GSU1_IU1_LBSPP128_LPB4_LRVW2_NLCA1_PGR1_PLR1_SU32_SUM0_SUS128_SRVW4_TT1_96_TLDS1_WSGRA1_WSGRB1_WG128_2_1_WGM2
    SolutionIndex: 23
    SolutionNameMin: Cijk_Ailk_Bljk_BBH_MT128x96x32_MI32x32x4x1_SE_1LDSB0_AF0EM8_AF1EM1_EPS1_FL0_GRVW4_GSU1_IU1_LBSPP128_LPB4_LRVW4_NLCA1_PGR1_PLR9_SU32_SUM0_SUS256_SRVW4_TT1_96_TLDS1_WSGRA1_WSGRB1_WG128_2_1_WGM15
    SolutionIndex: 24
    SolutionNameMin: Cijk_Ailk_Bljk_BBH_MT128x64x32_MI32x32x4x1_SE_1LDSB0_AF0EM1_AF1EM1_EPS1_FL0_GRVW4_GSU1_IU1_LBSPP128_LPB4_LRVW4_NLCA1_PGR1_PLR9_SU0_SUM0_SUS256_SRVW4_TT2_32_TLDS1_WSGRA1_WSGRB1_WG64_4_1_WGM1
    SolutionIndex: 25
    SolutionNameMin: Cijk_Ailk_Bljk_BBH_MT128x96x32_MI32x32x4x1_SE_1LDSB0_AF0EM4_AF1EM1_EPS1_FL0_GRVW4_GSU1_IU1_LBSPP128_LPB4_LRVW2_NLCA1_PGR1_PLR1_SU0_SUM0_SUS256_SRVW4_TT1_96_TLDS1_WSGRA1_WSGRB1_WG128_2_1_WGM15
    SolutionIndex: 26
    SolutionNameMin: Cijk_Ailk_Bljk_BBH_MT32x32x32_MI16x16x8x1_SE_1LDSB0_AF0EM4_AF1EM1_EPS1_FL0_GRVW2_GSU1_IU1_LBSPP128_LPB2_LRVW2_NLCA1_PGR1_PLR1_SU0_SUM0_SUS256_SRVW0_TT1_16_TLDS1_WSGRA1_WSGRB1_WG32_8_1_WGM15
    SolutionIndex: 27
    SolutionNameMin: Cijk_Ailk_Bljk_BBH_MT64x16x32_MI16x16x8x1_SE_1LDSB0_AF0EM8_AF1EM1_EPS1_FL0_GRVW8_GSU1_IU1_LBSPP128_LPB8_LRVW4_NLCA1_PGR1_PLR5_SU0_SUM0_SUS256_SRVW0_TT1_16_TLDS1_WSGRA1_WSGRB1_WG64_4_1_WGM1
    SolutionIndex: 28
    SolutionNameMin: Cijk_Ailk_Bljk_BBH_MT64x32x32_MI16x16x8x1_SE_1LDSB0_AF0EM4_AF1EM1_EPS1_FL1_GRVW2_GSU1_IU1_LBSPP128_LPB2_LRVW2_NLCA1_PGR1_PLR1_SU0_SUM0_SUS256_SRVW0_TT1_32_TLDS1_WSGRA0_WSGRB0_WG128_2_1_WGM1
    SolutionIndex: 29
    SolutionNameMin: Cijk_Ailk_Bljk_BBH_MT64x16x32_MI16x16x8x1_SE_1LDSB0_AF0EM8_AF1EM1_EPS1_FL0_GRVW2_GSU1_IU1_LBSPP128_LPB4_LRVW4_NLCA1_PGR1_PLR5_SU0_SUM0_SUS256_SRVW0_TT1_16_TLDS1_WSGRA1_WSGRB1_WG64_4_1_WGM1
    SolutionIndex: 30
    SolutionNameMin: Cijk_Ailk_Bljk_BBH_MT32x32x64_MI16x16x8x1_SE_1LDSB0_AF0EM8_AF1EM1_EPS1_FL0_GRVW4_GSU1_IU1_LBSPP128_LPB4_LRVW4_NLCA1_PGR1_PLR9_SU0_SUM0_SUS256_SRVW4_TT1_16_TLDS1_WSGRA1_WSGRB1_WG32_8_1_WGM2
    SolutionIndex: 31
    SolutionNameMin: Cijk_Ailk_Bljk_BBH_MT64x64x64_MI32x32x4x1_SE_1LDSB0_AF0EM1_AF1EM1_EPS1_FL0_GRVW4_GSU7_IU1_LBSPP128_LPB4_LRVW4_NLCA1_PGR1_PLR17_SU32_SUM0_SUS256_SRVW0_TT1_32_TLDS1_WSGRA1_WSGRB1_WG64_4_1_WGM1
    SolutionIndex: 32
    SolutionNameMin: Cijk_Ailk_Bljk_BBH_MT16x16x64_MI16x16x8x1_SE_1LDSB0_AF0EM1_AF1EM1_EPS1_FL0_GRVW2_GSU1_IU1_LBSPP128_LPB16_LRVW8_NLCA1_PGR1_PLR9_SU32_SUM0_SUS256_SRVW0_TT1_16_TLDS1_WSGRA1_WSGRB1_WG16_4_1_WGM1
    SolutionIndex: 33
    SolutionNameMin: Cijk_Ailk_Bljk_BBH_MT32x64x64_MI16x16x8x1_SE_1LDSB0_AF0EM1_AF1EM1_EPS1_FL0_GRVW4_GSU5_IU1_LBSPP128_LPB4_LRVW4_NLCA1_PGR1_PLR9_SU0_SUM0_SUS256_SRVW0_TT1_32_TLDS1_WSGRA1_WSGRB1_WG32_8_1_WGM1
    SolutionIndex: 34
    SolutionNameMin: Cijk_Ailk_Bljk_BBH_MT64x32x32_MI16x16x8x1_SE_1LDSB0_AF0EM4_AF1EM1_EPS1_FL0_GRVW2_GSU1_IU1_LBSPP128_LPB2_LRVW2_NLCA1_PGR1_PLR1_SU0_SUM0_SUS256_SRVW0_TT2_16_TLDS1_WSGRA1_WSGRB1_WG32_8_1_WGM1
    SolutionIndex: 35
    SolutionNameMin: Cijk_Ailk_Bljk_BBH_MT128x160x32_MI32x32x4x1_SE_1LDSB0_AF0EM4_AF1EM1_EPS1_FL0_GRVW4_GSU1_IU1_LBSPP128_LPB4_LRVW2_NLCA1_PGR1_PLR1_SU0_SUM0_SUS256_SRVW0_TT1_160_TLDS1_WSGRA1_WSGRB1_WG128_2_1_WGM1
    SolutionIndex: 36
    SolutionNameMin: Cijk_Ailk_Bljk_BBH_MT128x160x32_MI32x32x4x1_SE_1LDSB0_AF0EM4_AF1EM1_EPS1_FL0_GRVW4_GSU1_IU1_LBSPP128_LPB4_LRVW2_NLCA1_PGR1_PLR1_SU0_SUM0_SUS256_SRVW0_TT1_160_TLDS1_WSGRA1_WSGRB1_WG128_2_1_WGM15
    SolutionIndex: 37
    SolutionNameMin: Cijk_Ailk_Bljk_BBH_MT64x80x32_MI16x16x8x1_SE_1LDSB0_AF0EM4_AF1EM1_EPS1_FL0_GRVW2_GSU1_IU1_LBSPP128_LPB2_LRVW2_NLCA1_PGR1_PLR1_SU16_SUM0_SUS128_SRVW0_TT1_80_TLDS1_WSGRA1_WSGRB1_WG64_4_1_WGM15
    SolutionIndex: 38
    SolutionNameMin: Cijk_Ailk_Bljk_BBH_MT128x160x32_MI32x32x4x1_SE_1LDSB0_AF0EM8_AF1EM1_EPS1_FL0_GRVW2_GSU1_IU1_LBSPP128_LPB4_LRVW4_NLCA1_PGR1_PLR9_SU0_SUM0_SUS256_SRVW4_TT1_160_TLDS1_WSGRA1_WSGRB1_WG128_2_1_WGM2
    SolutionIndex: 39
    SolutionNameMin: Cijk_Ailk_Bljk_BBH_MT128x160x32_MI32x32x4x1_SE_1LDSB0_AF0EM8_AF1EM1_EPS1_FL0_GRVW2_GSU1_IU1_LBSPP128_LPB4_LRVW4_NLCA1_PGR1_PLR9_SU0_SUM0_SUS256_SRVW4_TT1_160_TLDS1_WSGRA1_WSGRB1_WG128_2_1_WGM15
    SolutionIndex: 40
    SolutionNameMin: Cijk_Ailk_Bljk_BBH_MT128x160x32_MI32x32x4x1_SE_1LDSB0_AF0EM4_AF1EM1_EPS1_FL0_GRVW4_GSU1_IU1_LBSPP128_LPB4_LRVW2_NLCA1_PGR1_PLR1_SU0_SUM0_SUS256_SRVW0_TT1_160_TLDS1_WSGRA1_WSGRB1_WG128_2_1_WGM2
    SolutionIndex: 41
    SolutionNameMin: Cijk_Ailk_Bljk_BBH_MT128x80x64_MI16x16x8x1_SE_1LDSB0_AF0EM4_AF1EM1_EPS1_FL0_GRVW2_GSU1_IU1_LBSPP128_LPB2_LRVW2_NLCA1_PGR1_PLR1_SU32_SUM0_SUS256_SRVW0_TT2_80_TLDS1_WSGRA1_WSGRB1_WG64_4_1_WGM15
    SolutionIndex: 42
    SolutionNameMin: Cijk_Ailk_Bljk_BBH_MT128x160x32_MI32x32x4x1_SE_1LDSB0_AF0EM8_AF1EM1_EPS1_FL0_GRVW2_GSU1_IU1_LBSPP128_LPB4_LRVW4_NLCA1_PGR1_PLR9_SU32_SUM0_SUS256_SRVW4_TT1_160_TLDS1_WSGRA1_WSGRB1_WG128_2_1_WGM2
    SolutionIndex: 43
    SolutionNameMin: Cijk_Ailk_Bljk_BBH_MT128x80x64_MI16x16x8x1_SE_1LDSB0_AF0EM4_AF1EM1_EPS1_FL0_GRVW2_GSU1_IU1_LBSPP128_LPB2_LRVW2_NLCA1_PGR1_PLR1_SU32_SUM0_SUS256_SRVW0_TT2_80_TLDS1_WSGRA1_WSGRB1_WG64_4_1_WGM2
    SolutionIndex: 44
    SolutionNameMin: Cijk_Ailk_Bljk_BBH_MT128x160x32_MI32x32x4x1_SE_1LDSB0_AF0EM8_AF1EM1_EPS1_FL0_GRVW2_GSU1_IU1_LBSPP128_LPB4_LRVW4_NLCA1_PGR1_PLR9_SU32_SUM0_SUS128_SRVW4_TT1_160_TLDS1_WSGRA1_WSGRB1_WG128_2_1_WGM2
    SolutionIndex: 45
    SolutionNameMin: Cijk_Ailk_Bljk_BBH_MT128x160x32_MI32x32x4x1_SE_1LDSB0_AF0EM4_AF1EM1_EPS1_FL0_GRVW4_GSU1_IU1_LBSPP128_LPB4_LRVW2_NLCA1_PGR1_PLR1_SU32_SUM0_SUS128_SRVW0_TT1_160_TLDS1_WSGRA1_WSGRB1_WG128_2_1_WGM1
    SolutionIndex: 46
    SolutionNameMin: Cijk_Ailk_Bljk_BBH_MT128x80x64_MI16x16x8x1_SE_1LDSB0_AF0EM4_AF1EM1_EPS1_FL0_GRVW2_GSU1_IU1_LBSPP128_LPB2_LRVW2_NLCA1_PGR1_PLR1_SU0_SUM0_SUS256_SRVW0_TT2_80_TLDS1_WSGRA1_WSGRB1_WG64_4_1_WGM2
    SolutionIndex: 47
    SolutionNameMin: Cijk_Ailk_Bljk_BBH_MT128x160x32_MI32x32x4x1_SE_1LDSB0_AF0EM8_AF1EM1_EPS0_FL0_GRVW4_GSU1_IU1_LBSPP128_LPB4_LRVW4_NLCA1_PGR2_PLR9_SU0_SUM0_SUS256_SRVW4_TT1_160_TLDS1_WSGRA1_WSGRB1_WG128_2_1_WGM15
    SolutionIndex: 48
    SolutionNameMin: Cijk_Ailk_Bljk_BBH_MT128x160x32_MI32x32x4x1_SE_1LDSB0_AF0EM8_AF1EM1_EPS1_FL0_GRVW2_GSU1_IU1_LBSPP128_LPB4_LRVW4_NLCA1_PGR1_PLR9_SU32_SUM0_SUS256_SRVW4_TT1_160_TLDS1_WSGRA1_WSGRB1_WG128_2_1_WGM15
    SolutionIndex: 49
    SolutionNameMin: Cijk_Ailk_Bljk_BBH_MT128x160x32_MI32x32x4x1_SE_1LDSB0_AF0EM4_AF1EM1_EPS1_FL0_GRVW4_GSU1_IU1_LBSPP128_LPB4_LRVW2_NLCA1_PGR1_PLR1_SU32_SUM0_SUS256_SRVW0_TT1_160_TLDS1_WSGRA1_WSGRB1_WG128_2_1_WGM1
    SolutionIndex: 50
    SolutionNameMin: Cijk_Ailk_Bljk_BBH_MT128x160x32_MI32x32x4x1_SE_1LDSB0_AF0EM8_AF1EM1_EPS1_FL0_GRVW2_GSU1_IU1_LBSPP128_LPB4_LRVW4_NLCA1_PGR1_PLR9_SU32_SUM0_SUS128_SRVW4_TT1_160_TLDS1_WSGRA1_WSGRB1_WG128_2_1_WGM15
    SolutionIndex: 51
    SolutionNameMin: Cijk_Ailk_Bljk_BBH_MT128x96x32_MI32x32x4x1_SE_1LDSB0_AF0EM8_AF1EM1_EPS1_FL0_GRVW4_GSU5_IU1_LBSPP128_LPB4_LRVW4_NLCA1_PGR1_PLR9_SU0_SUM0_SUS256_SRVW4_TT1_96_TLDS1_WSGRA1_WSGRB1_WG128_2_1_WGM2
    SolutionIndex: 52
    SolutionNameMin: Cijk_Ailk_Bljk_BBH_MT128x96x32_MI32x32x4x1_SE_1LDSB0_AF0EM8_AF1EM1_EPS1_FL0_GRVW4_GSU5_IU1_LBSPP128_LPB4_LRVW4_NLCA1_PGR1_PLR9_SU0_SUM0_SUS256_SRVW4_TT1_96_TLDS1_WSGRA1_WSGRB1_WG128_2_1_WGM1
    SolutionIndex: 53
    SolutionNameMin: Cijk_Ailk_Bljk_BBH_MT128x96x32_MI32x32x4x1_SE_1LDSB0_AF0EM8_AF1EM1_EPS1_FL0_GRVW4_GSU1_IU1_LBSPP128_LPB4_LRVW4_NLCA1_PGR1_PLR9_SU0_SUM0_SUS256_SRVW4_TT1_96_TLDS1_WSGRA1_WSGRB1_WG128_2_1_WGM2
    SolutionIndex: 54
    SolutionNameMin: Cijk_Ailk_Bljk_BBH_MT64x128x64_MI32x32x4x1_SE_1LDSB0_AF0EM1_AF1EM1_EPS1_FL0_GRVW2_GSU3_IU1_LBSPP128_LPB4_LRVW4_NLCA1_PGR1_PLR17_SU0_SUM0_SUS256_SRVW0_TT1_64_TLDS1_WSGRA1_WSGRB1_WG64_4_1_WGM1
    SolutionIndex: 55
    SolutionNameMin: Cijk_Ailk_Bljk_BBH_MT128x144x32_MI16x16x8x1_SE_1LDSB1_AF0EM8_AF1EM1_EPS1_FL0_GRVW2_GSU1_IU1_LBSPP128_LPB4_LRVW4_NLCA1_PGR1_PLR5_SU32_SUM0_SUS128_SRVW4_TT2_144_TLDS1_WSGRA1_WSGRB1_WG64_4_1_WGM15
    SolutionIndex: 56
    SolutionNameMin: Cijk_Ailk_Bljk_BBH_MT32x32x64_MI16x16x8x1_SE_1LDSB0_AF0EM8_AF1EM1_EPS1_FL0_GRVW8_GSU1_IU1_LBSPP128_LPB8_LRVW4_NLCA1_PGR1_PLR9_SU0_SUM0_SUS256_SRVW4_TT1_16_TLDS1_WSGRA1_WSGRB1_WG32_8_1_WGM15
    SolutionIndex: 57
    SolutionNameMin: Cijk_Ailk_Bljk_BBH_MT32x32x64_MI16x16x8x1_SE_1LDSB0_AF0EM8_AF1EM1_EPS1_FL0_GRVW4_GSU1_IU1_LBSPP128_LPB4_LRVW4_NLCA1_PGR1_PLR9_SU32_SUM0_SUS256_SRVW4_TT1_16_TLDS1_WSGRA1_WSGRB1_WG32_8_1_WGM2
    SolutionIndex: 58
    SolutionNameMin: Cijk_Ailk_Bljk_BBH_MT64x32x32_MI16x16x8x1_SE_1LDSB0_AF0EM1_AF1EM1_EPS1_FL1_GRVW2_GSU1_IU1_LBSPP128_LPB2_LRVW2_NLCA1_PGR1_PLR1_SU0_SUM0_SUS256_SRVW4_TT1_32_TLDS1_WSGRA0_WSGRB0_WG64_4_1_WGM1
    SolutionIndex: 59
    SolutionNameMin: Cijk_Ailk_Bljk_BBH_MT64x128x64_MI32x32x4x1_SE_1LDSB0_AF0EM8_AF1EM1_EPS1_FL0_GRVW8_GSU1_IU1_LBSPP128_LPB8_LRVW4_NLCA1_PGR1_PLR17_SU0_SUM0_SUS256_SRVW4_TT1_64_TLDS1_WSGRA1_WSGRB1_WG64_4_1_WGM1
    SolutionIndex: 60
    SolutionNameMin: Cijk_Ailk_Bljk_BBH_MT64x128x64_MI32x32x4x1_SE_1LDSB0_AF0EM8_AF1EM1_EPS1_FL0_GRVW8_GSU1_IU1_LBSPP128_LPB8_LRVW4_NLCA1_PGR1_PLR17_SU32_SUM0_SUS256_SRVW4_TT1_64_TLDS1_WSGRA1_WSGRB1_WG64_4_1_WGM1
    SolutionIndex: 61
    SolutionNameMin: Cijk_Ailk_Bljk_BBH_MT32x64x64_MI16x16x8x1_SE_1LDSB0_AF0EM8_AF1EM1_EPS1_FL0_GRVW4_GSU1_IU1_LBSPP128_LPB4_LRVW4_NLCA1_PGR1_PLR9_SU32_SUM0_SUS256_SRVW4_TT1_32_TLDS1_WSGRA1_WSGRB1_WG32_8_1_WGM2
    SolutionIndex: 62
    SolutionNameMin: Cijk_Ailk_Bljk_BBH_MT32x32x64_MI16x16x8x1_SE_1LDSB0_AF0EM8_AF1EM1_EPS1_FL0_GRVW8_GSU1_IU1_LBSPP128_LPB8_LRVW4_NLCA1_PGR1_PLR9_SU32_SUM0_SUS256_SRVW4_TT1_16_TLDS1_WSGRA1_WSGRB1_WG32_8_1_WGM1
    SolutionIndex: 63
    SolutionNameMin: Cijk_Ailk_Bljk_BBH_MT64x32x32_MI16x16x8x1_SE_1LDSB0_AF0EM8_AF1EM1_EPS1_FL0_GRVW2_GSU1_IU1_LBSPP128_LPB4_LRVW4_NLCA1_PGR1_PLR5_SU0_SUM0_SUS256_SRVW4_TT2_16_TLDS1_WSGRA1_WSGRB1_WG32_8_1_WGM1
    SolutionIndex: 64
    SolutionNameMin: Cijk_Ailk_Bljk_BBH_MT64x80x64_MI16x16x8x1_SE_1LDSB0_AF0EM4_AF1EM1_EPS1_FL0_GRVW2_GSU1_IU1_LBSPP128_LPB2_LRVW2_NLCA1_PGR1_PLR1_SU16_SUM0_SUS256_SRVW0_TT1_80_TLDS1_WSGRA1_WSGRB1_WG64_4_1_WGM15
    SolutionIndex: 65
    SolutionNameMin: Cijk_Ailk_Bljk_BBH_MT64x64x32_MI32x32x4x1_SE_1LDSB0_AF0EM8_AF1EM1_EPS1_FL0_GRVW8_GSU1_IU1_LBSPP128_LPB8_LRVW4_NLCA1_PGR1_PLR9_SU32_SUM0_SUS128_SRVW4_TT1_32_TLDS1_WSGRA1_WSGRB1_WG64_4_1_WGM15
    SolutionIndex: 66
    SolutionNameMin: Cijk_Ailk_Bljk_BBH_MT128x64x32_MI32x32x4x1_SE_1LDSB0_AF0EM8_AF1EM1_EPS0_FL0_GRVW8_GSU1_IU1_LBSPP128_LPB8_LRVW4_NLCA1_PGR2_PLR9_SU32_SUM0_SUS128_SRVW4_TT2_32_TLDS1_WSGRA1_WSGRB1_WG64_4_1_WGM15
    SolutionIndex: 67
    SolutionNameMin: Cijk_Ailk_Bljk_BBH_MT128x64x32_MI32x32x4x1_SE_1LDSB0_AF0EM8_AF1EM1_EPS1_FL0_GRVW8_GSU1_IU1_LBSPP128_LPB8_LRVW4_NLCA1_PGR1_PLR9_SU0_SUM0_SUS256_SRVW4_TT2_32_TLDS1_WSGRA1_WSGRB1_WG64_4_1_WGM15
    SolutionIndex: 68
    SolutionNameMin: Cijk_Ailk_Bljk_BBH_MT128x64x32_MI32x32x2x2_SE_1LDSB0_AF0EM4_AF1EM1_EPS1_FL1_GRVW4_GSU1_IU1_LBSPP128_LPB4_LRVW2_NLCA1_PGR1_PLR1_SU0_SUM0_SUS256_SRVW4_TT1_32_TLDS1_WSGRA0_WSGRB0_WG128_2_1_WGM4
    SolutionIndex: 69
    SolutionNameMin: Cijk_Ailk_Bljk_BBH_MT64x128x32_MI32x32x2x2_SE_1LDSB0_AF0EM1_AF1EM1_EPS1_FL0_GRVW4_GSU1_IU1_LBSPP128_LPB4_LRVW2_NLCA1_PGR1_PLR1_SU32_SUM0_SUS256_SRVW4_TT1_32_TLDS1_WSGRA1_WSGRB1_WG64_4_1_WGM10
    SolutionIndex: 70
    SolutionNameMin: Cijk_Ailk_Bljk_BBH_MT128x64x32_MI32x32x4x1_SE_1LDSB0_AF0EM8_AF1EM1_EPS1_FL1_GRVW8_GSU1_IU1_LBSPP128_LPB8_LRVW2_NLCA1_PGR1_PLR1_SU0_SUM0_SUS256_SRVW4_TT2_32_TLDS1_WSGRA0_WSGRB0_WG64_4_1_WGM4
    SolutionIndex: 71
    SolutionNameMin: Cijk_Ailk_Bljk_BBH_MT96x96x64_MI16x16x8x1_SE_1LDSB1_AF0EM8_AF1EM1_EPS1_FL0_GRVW8_GSU1_IU1_LBSPP128_LPB8_LRVW4_NLCA3_PGR1_PLR9_SU32_SUM0_SUS256_SRVW0_TT3_48_TLDS1_WSGRA1_WSGRB1_WG32_8_1_WGM2
    SolutionIndex: 72
    SolutionNameMin: Cijk_Ailk_Bljk_BBH_MT128x96x32_MI32x32x4x1_SE_1LDSB0_AF0EM8_AF1EM1_EPS1_FL0_GRVW4_GSU1_IU1_LBSPP128_LPB4_LRVW4_NLCA1_PGR1_PLR9_SU0_SUM0_SUS256_SRVW4_TT1_96_TLDS1_WSGRA1_WSGRB1_WG128_2_1_WGM15
    SolutionIndex: 73
    SolutionNameMin: Cijk_Ailk_Bljk_BBH_MT128x64x32_MI32x32x2x2_SE_1LDSB0_AF0EM4_AF1EM1_EPS1_FL1_GRVW4_GSU1_IU1_LBSPP128_LPB4_LRVW2_NLCA1_PGR1_PLR1_SU0_SUM0_SUS256_SRVW4_TT1_32_TLDS1_WSGRA0_WSGRB0_WG128_2_1_WGM10
    SolutionIndex: 74
    SolutionNameMin: Cijk_Ailk_Bljk_BBH_MT128x96x32_MI32x32x4x1_SE_1LDSB0_AF0EM8_AF1EM1_EPS1_FL0_GRVW4_GSU1_IU1_LBSPP128_LPB4_LRVW4_NLCA1_PGR1_PLR9_SU32_SUM0_SUS256_SRVW4_TT1_96_TLDS1_WSGRA1_WSGRB1_WG128_2_1_WGM2
    SolutionIndex: 75
    SolutionNameMin: Cijk_Ailk_Bljk_BBH_MT128x144x32_MI16x16x8x1_SE_1LDSB1_AF0EM8_AF1EM1_EPS1_FL0_GRVW2_GSU1_IU1_LBSPP128_LPB4_LRVW4_NLCA1_PGR1_PLR5_SU0_SUM0_SUS256_SRVW4_TT2_144_TLDS1_WSGRA1_WSGRB1_WG64_4_1_WGM15
    SolutionIndex: 76
    SolutionNameMin: Cijk_Ailk_Bljk_BBH_MT128x256x32_MI32x32x4x1_SE_1LDSB1_AF0EM8_AF1EM1_EPS1_FL0_GRVW8_GSU1_IU1_LBSPP128_LPB8_LRVW4_NLCA1_PGR1_PLR9_SU32_SUM0_SUS256_SRVW4_TT2_128_TLDS1_WSGRA1_WSGRB1_WG64_4_1_WGM15
    SolutionIndex: 77
    SolutionNameMin: Cijk_Ailk_Bljk_BBH_MT128x96x32_MI32x32x4x1_SE_1LDSB0_AF0EM8_AF1EM1_EPS1_FL0_GRVW4_GSU1_IU1_LBSPP128_LPB4_LRVW4_NLCA1_PGR1_PLR9_SU32_SUM0_SUS256_SRVW4_TT1_96_TLDS1_WSGRA1_WSGRB1_WG128_2_1_WGM1
    SolutionIndex: 78
    SolutionNameMin: Cijk_Ailk_Bljk_BBH_MT128x96x32_MI32x32x4x1_SE_1LDSB0_AF0EM8_AF1EM1_EPS1_FL0_GRVW4_GSU1_IU1_LBSPP128_LPB4_LRVW4_NLCA1_PGR1_PLR9_SU32_SUM0_SUS128_SRVW4_TT1_96_TLDS1_WSGRA1_WSGRB1_WG128_2_1_WGM2
    SolutionIndex: 79
    SolutionNameMin: Cijk_Ailk_Bljk_BBH_MT64x128x32_MI32x32x4x1_SE_1LDSB0_AF0EM8_AF1EM1_EPS0_FL0_GRVW8_GSU1_IU1_LBSPP128_LPB8_LRVW4_NLCA1_PGR2_PLR9_SU0_SUM0_SUS256_SRVW4_TT1_64_TLDS1_WSGRA1_WSGRB1_WG64_4_1_WGM1
    SolutionIndex: 80
    SolutionNameMin: Cijk_Ailk_Bljk_BBH_MT128x256x32_MI32x32x4x1_SE_1LDSB1_AF0EM8_AF1EM1_EPS1_FL0_GRVW8_GSU1_IU1_LBSPP128_LPB8_LRVW4_NLCA1_PGR1_PLR9_SU0_SUM0_SUS256_SRVW4_TT2_128_TLDS1_WSGRA1_WSGRB1_WG64_4_1_WGM15
    SolutionIndex: 81
    SolutionNameMin: Cijk_Ailk_Bljk_BBH_MT128x96x32_MI32x32x4x1_SE_1LDSB0_AF0EM4_AF1EM1_EPS1_FL0_GRVW4_GSU1_IU1_LBSPP128_LPB4_LRVW2_NLCA1_PGR1_PLR1_SU16_SUM0_SUS128_SRVW4_TT1_96_TLDS1_WSGRA1_WSGRB1_WG128_2_1_WGM2
    SolutionIndex: 82
    SolutionNameMin: Cijk_Ailk_Bljk_BBH_MT128x192x32_MI32x32x4x1_SE_1LDSB1_AF0EM8_AF1EM1_EPS0_FL0_GRVW8_GSU1_IU1_LBSPP128_LPB8_LRVW4_NLCA1_PGR2_PLR9_SU32_SUM0_SUS128_SRVW4_TT2_96_TLDS1_WSGRA1_WSGRB1_WG64_4_1_WGM15
    SolutionIndex: 83
    SolutionNameMin: Cijk_Ailk_Bljk_BBH_MT128x96x32_MI32x32x4x1_SE_1LDSB0_AF0EM8_AF1EM1_EPS0_FL0_GRVW2_GSU1_IU1_LBSPP128_LPB4_LRVW4_NLCA1_PGR2_PLR9_SU32_SUM0_SUS128_SRVW4_TT1_96_TLDS1_WSGRA1_WSGRB1_WG128_2_1_WGM2
    SolutionIndex: 84
    SolutionNameMin: Cijk_Ailk_Bljk_BBH_MT128x96x32_MI32x32x4x1_SE_1LDSB0_AF0EM4_AF1EM1_EPS1_FL0_GRVW4_GSU1_IU1_LBSPP128_LPB4_LRVW2_NLCA1_PGR1_PLR1_SU16_SUM0_SUS256_SRVW4_TT1_96_TLDS1_WSGRA1_WSGRB1_WG128_2_1_WGM2
    SolutionIndex: 85
    SolutionNameMin: Cijk_Ailk_Bljk_BBH_MT128x64x32_MI32x32x4x1_SE_1LDSB0_AF0EM4_AF1EM1_EPS1_FL1_GRVW4_GSU1_IU1_LBSPP128_LPB4_LRVW2_NLCA1_PGR1_PLR1_SU0_SUM0_SUS256_SRVW4_TT2_32_TLDS1_WSGRA0_WSGRB0_WG64_4_1_WGM1
    SolutionIndex: 86
    SolutionNameMin: Cijk_Ailk_Bljk_BBH_MT128x64x32_MI32x32x4x1_SE_1LDSB0_AF0EM8_AF1EM1_EPS1_FL0_GRVW8_GSU1_IU1_LBSPP128_LPB8_LRVW4_NLCA1_PGR1_PLR9_SU0_SUM0_SUS256_SRVW4_TT2_32_TLDS1_WSGRA1_WSGRB1_WG64_4_1_WGM1
    SolutionIndex: 87
    SolutionNameMin: Cijk_Ailk_Bljk_BBH_MT128x96x32_MI32x32x4x1_SE_1LDSB0_AF0EM4_AF1EM1_EPS1_FL0_GRVW4_GSU1_IU1_LBSPP128_LPB4_LRVW2_NLCA1_PGR1_PLR1_SU0_SUM0_SUS256_SRVW4_TT1_96_TLDS1_WSGRA1_WSGRB1_WG128_2_1_WGM1
    SolutionIndex: 88
    SolutionNameMin: Cijk_Ailk_Bljk_BBH_MT128x96x32_MI32x32x4x1_SE_1LDSB0_AF0EM4_AF1EM1_EPS1_FL0_GRVW4_GSU1_IU1_LBSPP128_LPB4_LRVW2_NLCA1_PGR1_PLR1_SU16_SUM0_SUS128_SRVW4_TT1_96_TLDS1_WSGRA1_WSGRB1_WG128_2_1_WGM1
    SolutionIndex: 89
    SolutionNameMin: Cijk_Ailk_Bljk_BBH_MT128x96x32_MI32x32x4x1_SE_1LDSB0_AF0EM4_AF1EM1_EPS1_FL0_GRVW4_GSU1_IU1_LBSPP128_LPB4_LRVW2_NLCA1_PGR1_PLR1_SU0_SUM0_SUS256_SRVW4_TT1_96_TLDS1_WSGRA1_WSGRB1_WG128_2_1_WGM2
    SolutionIndex: 90
    SolutionNameMin: Cijk_Ailk_Bljk_BBH_MT64x128x32_MI32x32x2x2_SE_1LDSB0_AF0EM1_AF1EM1_EPS1_FL0_GRVW4_GSU1_IU1_LBSPP128_LPB4_LRVW2_NLCA1_PGR1_PLR1_SU32_SUM0_SUS256_SRVW4_TT1_32_TLDS1_WSGRA0_WSGRB1_WG64_4_1_WGM4
    SolutionIndex: 91
    SolutionNameMin: Cijk_Ailk_Bljk_BBH_MT128x256x32_MI32x32x4x1_SE_1LDSB1_AF0EM8_AF1EM1_EPS0_FL0_GRVW8_GSU1_IU1_LBSPP128_LPB8_LRVW4_NLCA1_PGR2_PLR9_SU0_SUM0_SUS256_SRVW4_TT2_128_TLDS1_WSGRA1_WSGRB1_WG64_4_1_WGM2
    SolutionIndex: 92
    SolutionNameMin: Cijk_Ailk_Bljk_BBH_MT128x96x32_MI32x32x4x1_SE_1LDSB0_AF0EM8_AF1EM1_EPS1_FL0_GRVW2_GSU1_IU1_LBSPP128_LPB4_LRVW4_NLCA1_PGR1_PLR9_SU32_SUM0_SUS128_SRVW4_TT1_96_TLDS1_WSGRA1_WSGRB1_WG128_2_1_WGM15
    SolutionIndex: 93
    SolutionNameMin: Cijk_Ailk_Bljk_BBH_MT64x64x32_MI32x32x4x1_SE_1LDSB0_AF0EM8_AF1EM1_EPS1_FL0_GRVW8_GSU1_IU1_LBSPP128_LPB8_LRVW4_NLCA1_PGR1_PLR9_SU32_SUM0_SUS256_SRVW4_TT1_32_TLDS1_WSGRA1_WSGRB1_WG64_4_1_WGM2
    SolutionIndex: 94
    SolutionNameMin: Cijk_Ailk_Bljk_BBH_MT64x32x32_MI16x16x8x1_SE_1LDSB0_AF0EM1_AF1EM1_EPS1_FL0_GRVW2_GSU1_IU1_LBSPP128_LPB2_LRVW2_NLCA1_PGR1_PLR1_SU32_SUM3_SUS256_SRVW0_TT1_32_TLDS1_WSGRA1_WSGRB0_WG64_4_1_WGM1
    SolutionIndex: 95
    SolutionNameMin: Cijk_Ailk_Bljk_BBH_MT256x64x32_MI32x32x4x1_SE_1LDSB0_AF0EM8_AF1EM1_EPS1_FL0_GRVW4_GSU1_IU1_LBSPP128_LPB4_LRVW4_NLCA1_PGR1_PLR9_SU0_SUM0_SUS256_SRVW4_TT4_32_TLDS1_WSGRA1_WSGRB1_WG64_4_1_WGM15
    SolutionIndex: 96
    SolutionNameMin: Cijk_Ailk_Bljk_BBH_MT32x32x32_MI16x16x8x1_SE_1LDSB0_AF0EM4_AF1EM1_EPS1_FL0_GRVW2_GSU1_IU1_LBSPP128_LPB2_LRVW2_NLCA1_PGR1_PLR1_SU0_SUM0_SUS256_SRVW0_TT1_16_TLDS1_WSGRA1_WSGRB1_WG32_8_1_WGM1
    SolutionIndex: 97
    SolutionNameMin: Cijk_Ailk_Bljk_BBH_MT144x128x32_MI16x16x8x1_SE_1LDSB0_AF0EM8_AF1EM1_EPS1_FL0_GRVW2_GSU1_IU1_LBSPP128_LPB4_LRVW4_NLCA9_PGR1_PLR5_SU0_SUM0_SUS256_SRVW0_TT9_32_TLDS1_WSGRA1_WSGRB1_WG16_16_1_WGM15
    SolutionIndex: 98
    SolutionNameMin: Cijk_Ailk_Bljk_BBH_MT128x80x64_MI16x16x8x1_SE_1LDSB0_AF0EM4_AF1EM1_EPS1_FL0_GRVW2_GSU1_IU1_LBSPP128_LPB2_LRVW2_NLCA1_PGR1_PLR1_SU0_SUM0_SUS256_SRVW0_TT2_80_TLDS1_WSGRA1_WSGRB1_WG64_4_1_WGM1
    SolutionIndex: 99
    SolutionNameMin: Cijk_Ailk_Bljk_BBH_MT64x16x32_MI16x16x8x1_SE_1LDSB0_AF0EM8_AF1EM1_EPS1_FL0_GRVW4_GSU1_IU1_LBSPP128_LPB4_LRVW4_NLCA1_PGR1_PLR5_SU0_SUM0_SUS256_SRVW0_TT1_16_TLDS1_WSGRA1_WSGRB1_WG64_4_1_WGM2
    SolutionIndex: 100
    SolutionNameMin: Cijk_Ailk_Bljk_BBH_MT64x32x32_MI16x16x8x1_SE_1LDSB0_AF0EM4_AF1EM1_EPS1_FL0_GRVW2_GSU1_IU1_LBSPP128_LPB2_LRVW2_NLCA1_PGR1_PLR1_SU0_SUM0_SUS256_SRVW0_TT2_16_TLDS1_WSGRA1_WSGRB1_WG32_8_1_WGM2
    SolutionIndex: 101
    SolutionNameMin: Cijk_Ailk_Bljk_BBH_MT64x128x8_MI32x32x2x2_SE_1LDSB0_AF0EM8_AF1EM1_EPS1_FL0_GRVW2_GSU1_IU2_LBSPP0_LPB2_LRVW2_NLCA1_PGR1_PLR1_SU16_SUM3_SUS256_SRVW0_TT1_32_TLDS0_WSGRA0_WSGRB0_WG64_4_1_WGM16
    SolutionIndex: 102
    SolutionNameMin: Cijk_Ailk_Bljk_BBH_MT64x128x32_MI32x32x4x1_SE_1LDSB0_AF0EM1_AF1EM1_EPS1_FL0_GRVW8_GSU1_IU1_LBSPP128_LPB8_LRVW4_NLCA1_PGR1_PLR9_SU0_SUM0_SUS256_SRVW4_TT1_64_TLDS1_WSGRA1_WSGRB1_WG64_4_1_WGM15
    SolutionIndex: 103
    SolutionNameMin: Cijk_Ailk_Bljk_BBH_MT128x96x32_MI32x32x4x1_SE_1LDSB0_AF0EM8_AF1EM1_EPS0_FL0_GRVW4_GSU1_IU1_LBSPP128_LPB4_LRVW4_NLCA1_PGR2_PLR9_SU0_SUM0_SUS256_SRVW4_TT1_96_TLDS1_WSGRA1_WSGRB1_WG128_2_1_WGM15
    SolutionIndex: 104
    SolutionNameMin: Cijk_Ailk_Bljk_BBH_MT128x160x32_MI32x32x4x1_SE_1LDSB0_AF0EM8_AF1EM1_EPS1_FL0_GRVW2_GSU3_IU1_LBSPP128_LPB4_LRVW4_NLCA1_PGR1_PLR9_SU0_SUM0_SUS256_SRVW0_TT1_160_TLDS1_WSGRA1_WSGRB1_WG128_2_1_WGM15
    SolutionIndex: 105
    SolutionNameMin: Cijk_Ailk_Bljk_BBH_MT64x128x32_MI32x32x4x1_SE_1LDSB0_AF0EM8_AF1EM1_EPS1_FL0_GRVW8_GSU1_IU1_LBSPP128_LPB8_LRVW4_NLCA1_PGR1_PLR9_SU32_SUM0_SUS256_SRVW4_TT1_64_TLDS1_WSGRA1_WSGRB1_WG64_4_1_WGM1
    SolutionIndex: 106
    SolutionNameMin: Cijk_Ailk_Bljk_BBH_MT128x64x32_MI32x32x4x1_SE_1LDSB0_AF0EM1_AF1EM1_EPS0_FL0_GRVW4_GSU1_IU1_LBSPP128_LPB4_LRVW4_NLCA1_PGR2_PLR9_SU0_SUM0_SUS256_SRVW4_TT2_32_TLDS1_WSGRA1_WSGRB1_WG64_4_1_WGM2
    SolutionIndex: 107
    SolutionNameMin: Cijk_Ailk_Bljk_BBH_MT128x96x32_MI32x32x4x1_SE_1LDSB0_AF0EM8_AF1EM1_EPS0_FL0_GRVW4_GSU1_IU1_LBSPP128_LPB4_LRVW4_NLCA1_PGR2_PLR9_SU0_SUM0_SUS256_SRVW4_TT1_96_TLDS1_WSGRA1_WSGRB1_WG128_2_1_WGM1
    SolutionIndex: 108
    SolutionNameMin: Cijk_Ailk_Bljk_BBH_MT128x96x32_MI32x32x4x1_SE_1LDSB0_AF0EM8_AF1EM1_EPS0_FL0_GRVW4_GSU1_IU1_LBSPP128_LPB4_LRVW4_NLCA1_PGR2_PLR9_SU0_SUM0_SUS256_SRVW4_TT1_96_TLDS1_WSGRA1_WSGRB1_WG128_2_1_WGM2
    SolutionIndex: 109
    SolutionNameMin: Cijk_Ailk_Bljk_BBH_MT128x64x64_MI32x32x4x1_SE_1LDSB0_AF0EM8_AF1EM1_EPS1_FL0_GRVW8_GSU1_IU1_LBSPP128_LPB8_LRVW4_NLCA1_PGR1_PLR17_SU0_SUM0_SUS256_SRVW4_TT2_32_TLDS1_WSGRA1_WSGRB1_WG64_4_1_WGM2
    SolutionIndex: 110
    SolutionNameMin: Cijk_Ailk_Bljk_BBH_MT256x160x32_MI32x32x4x1_SE_1LDSB0_AF0EM8_AF1EM1_EPS1_FL0_GRVW2_GSU1_IU1_LBSPP128_LPB4_LRVW4_NLCA2_PGR1_PLR9_SU0_SUM0_SUS256_SRVW4_TT2_160_TLDS1_WSGRA1_WSGRB1_WG128_2_1_WGM15
    SolutionIndex: 111
    SolutionNameMin: Cijk_Ailk_Bljk_BBH_MT128x96x32_MI32x32x4x1_SE_1LDSB0_AF0EM1_AF1EM1_EPS1_FL0_GRVW4_GSU1_IU1_LBSPP128_LPB4_LRVW4_NLCA1_PGR1_PLR9_SU0_SUM0_SUS256_SRVW4_TT1_96_TLDS1_WSGRA1_WSGRB1_WG128_2_1_WGM15
    SolutionIndex: 112
    SolutionNameMin: Cijk_Ailk_Bljk_BBH_MT128x256x32_MI32x32x4x1_SE_1LDSB1_AF0EM8_AF1EM1_EPS1_FL0_GRVW8_GSU1_IU1_LBSPP128_LPB8_LRVW4_NLCA1_PGR1_PLR9_SU32_SUM0_SUS256_SRVW4_TT2_128_TLDS1_WSGRA1_WSGRB1_WG64_4_1_WGM2
    SolutionIndex: 113
    SolutionNameMin: Cijk_Ailk_Bljk_BBH_MT128x256x32_MI32x32x4x1_SE_1LDSB1_AF0EM8_AF1EM1_EPS1_FL0_GRVW8_GSU1_IU1_LBSPP128_LPB8_LRVW4_NLCA1_PGR1_PLR9_SU32_SUM0_SUS256_SRVW4_TT2_128_TLDS1_WSGRA1_WSGRB1_WG64_4_1_WGM1
    SolutionIndex: 114
    SolutionNameMin: Cijk_Ailk_Bljk_BBH_MT128x96x32_MI32x32x4x1_SE_1LDSB0_AF0EM8_AF1EM1_EPS1_FL0_GRVW4_GSU1_IU1_LBSPP128_LPB4_LRVW4_NLCA1_PGR1_PLR9_SU0_SUM0_SUS256_SRVW4_TT1_96_TLDS1_WSGRA1_WSGRB1_WG128_2_1_WGM1
    SolutionIndex: 115
    SolutionNameMin: Cijk_Ailk_Bljk_BBH_MT128x144x32_MI16x16x8x1_SE_1LDSB1_AF0EM8_AF1EM1_EPS1_FL0_GRVW2_GSU1_IU1_LBSPP128_LPB4_LRVW4_NLCA1_PGR1_PLR5_SU0_SUM0_SUS256_SRVW4_TT2_144_TLDS1_WSGRA1_WSGRB1_WG64_4_1_WGM2
    SolutionIndex: 116
    SolutionNameMin: Cijk_Ailk_Bljk_BBH_MT64x128x32_MI32x32x4x1_SE_1LDSB0_AF0EM8_AF1EM1_EPS0_FL0_GRVW8_GSU1_IU1_LBSPP128_LPB8_LRVW4_NLCA1_PGR2_PLR9_SU32_SUM0_SUS128_SRVW4_TT1_64_TLDS1_WSGRA1_WSGRB1_WG64_4_1_WGM1
    SolutionIndex: 117
    SolutionNameMin: Cijk_Ailk_Bljk_BBH_MT128x144x32_MI16x16x8x1_SE_1LDSB0_AF0EM8_AF1EM1_EPS1_FL0_GRVW2_GSU1_IU1_LBSPP128_LPB4_LRVW4_NLCA1_PGR1_PLR5_SU0_SUM0_SUS256_SRVW4_TT2_144_TLDS1_WSGRA1_WSGRB1_WG64_4_1_WGM2
    SolutionIndex: 118
    SolutionNameMin: Cijk_Ailk_Bljk_BBH_MT64x64x32_MI32x32x4x1_SE_1LDSB0_AF0EM8_AF1EM1_EPS1_FL0_GRVW8_GSU1_IU1_LBSPP128_LPB8_LRVW4_NLCA1_PGR1_PLR9_SU32_SUM0_SUS128_SRVW4_TT1_32_TLDS1_WSGRA1_WSGRB1_WG64_4_1_WGM1
    SolutionIndex: 119
    SolutionNameMin: Cijk_Ailk_Bljk_BBH_MT64x64x64_MI32x32x4x1_SE_1LDSB0_AF0EM8_AF1EM1_EPS0_FL0_GRVW4_GSU1_IU1_LBSPP128_LPB4_LRVW4_NLCA1_PGR2_PLR17_SU0_SUM0_SUS256_SRVW4_TT1_32_TLDS1_WSGRA1_WSGRB1_WG64_4_1_WGM1
    SolutionIndex: 120
    SolutionNameMin: Cijk_Ailk_Bljk_BBH_MT64x128x32_MI32x32x4x1_SE_1LDSB0_AF0EM8_AF1EM1_EPS1_FL0_GRVW8_GSU1_IU1_LBSPP128_LPB8_LRVW4_NLCA1_PGR1_PLR9_SU32_SUM0_SUS256_SRVW4_TT1_64_TLDS1_WSGRA1_WSGRB1_WG64_4_1_WGM2
    SolutionIndex: 121
    SolutionNameMin: Cijk_Ailk_Bljk_BBH_MT64x64x32_MI32x32x4x1_SE_1LDSB0_AF0EM8_AF1EM1_EPS0_FL0_GRVW8_GSU1_IU1_LBSPP128_LPB8_LRVW4_NLCA1_PGR2_PLR9_SU0_SUM0_SUS256_SRVW4_TT1_32_TLDS1_WSGRA1_WSGRB1_WG64_4_1_WGM15
    SolutionIndex: 122
    SolutionNameMin: Cijk_Ailk_Bljk_BBH_MT64x32x32_MI16x16x8x1_SE_1LDSB0_AF0EM1_AF1EM1_EPS1_FL0_GRVW2_GSU1_IU1_LBSPP128_LPB4_LRVW4_NLCA1_PGR1_PLR5_SU0_SUM0_SUS256_SRVW4_TT2_16_TLDS1_WSGRA1_WSGRB1_WG32_8_1_WGM1
    SolutionIndex: 123
    SolutionNameMin: Cijk_Ailk_Bljk_BBH_MT128x64x32_MI32x32x4x1_SE_1LDSB0_AF0EM1_AF1EM1_EPS1_FL0_GRVW8_GSU1_IU1_LBSPP128_LPB8_LRVW4_NLCA1_PGR1_PLR9_SU0_SUM0_SUS256_SRVW4_TT2_32_TLDS1_WSGRA1_WSGRB1_WG64_4_1_WGM1
    SolutionIndex: 124
    SolutionNameMin: Cijk_Ailk_Bljk_BBH_MT128x64x32_MI32x32x4x1_SE_1LDSB0_AF0EM1_AF1EM1_EPS0_FL0_GRVW4_GSU1_IU1_LBSPP128_LPB4_LRVW4_NLCA1_PGR2_PLR9_SU0_SUM0_SUS256_SRVW4_TT2_32_TLDS1_WSGRA1_WSGRB1_WG64_4_1_WGM1
    SolutionIndex: 125
    SolutionNameMin: Cijk_Ailk_Bljk_BBH_MT128x64x32_MI32x32x4x1_SE_1LDSB0_AF0EM1_AF1EM1_EPS1_FL0_GRVW8_GSU1_IU1_LBSPP128_LPB8_LRVW4_NLCA1_PGR1_PLR9_SU0_SUM0_SUS256_SRVW4_TT2_32_TLDS1_WSGRA1_WSGRB1_WG64_4_1_WGM2
    SolutionIndex: 126
    SolutionNameMin: Cijk_Ailk_Bljk_BBH_MT64x32x32_MI16x16x8x1_SE_1LDSB0_AF0EM1_AF1EM1_EPS1_FL0_GRVW4_GSU1_IU1_LBSPP128_LPB4_LRVW4_NLCA1_PGR1_PLR5_SU32_SUM0_SUS256_SRVW4_TT2_16_TLDS1_WSGRA1_WSGRB1_WG32_8_1_WGM1
    SolutionIndex: 127
    SolutionNameMin: Cijk_Ailk_Bljk_BBH_MT64x32x64_MI16x16x8x1_SE_1LDSB0_AF0EM8_AF1EM1_EPS1_FL0_GRVW4_GSU1_IU1_LBSPP128_LPB4_LRVW4_NLCA1_PGR1_PLR9_SU32_SUM0_SUS128_SRVW4_TT2_16_TLDS1_WSGRA1_WSGRB1_WG32_8_1_WGM1
    SolutionIndex: 128
    SolutionNameMin: Cijk_Ailk_Bljk_BBH_MT64x128x64_MI32x32x4x1_SE_1LDSB0_AF0EM8_AF1EM1_EPS1_FL0_GRVW8_GSU1_IU1_LBSPP128_LPB8_LRVW4_NLCA1_PGR1_PLR17_SU0_SUM0_SUS256_SRVW4_TT1_64_TLDS1_WSGRA1_WSGRB1_WG64_4_1_WGM2
    SolutionIndex: 129
    SolutionNameMin: Cijk_Ailk_Bljk_BBH_MT64x128x64_MI32x32x4x1_SE_1LDSB0_AF0EM8_AF1EM1_EPS1_FL0_GRVW8_GSU1_IU1_LBSPP128_LPB8_LRVW4_NLCA1_PGR1_PLR17_SU0_SUM0_SUS256_SRVW4_TT1_64_TLDS1_WSGRA1_WSGRB1_WG64_4_1_WGM15
    SolutionIndex: 130
    SolutionNameMin: Cijk_Ailk_Bljk_BBH_MT64x64x32_MI32x32x4x1_SE_1LDSB0_AF0EM8_AF1EM1_EPS1_FL0_GRVW8_GSU1_IU1_LBSPP128_LPB8_LRVW4_NLCA1_PGR1_PLR9_SU0_SUM0_SUS256_SRVW4_TT1_32_TLDS1_WSGRA1_WSGRB1_WG64_4_1_WGM2
    SolutionIndex: 131
    SolutionNameMin: Cijk_Ailk_Bljk_BBH_MT128x64x32_MI32x32x4x1_SE_1LDSB0_AF0EM1_AF1EM1_EPS1_FL0_GRVW4_GSU1_IU1_LBSPP128_LPB4_LRVW4_NLCA1_PGR1_PLR9_SU0_SUM0_SUS256_SRVW4_TT2_32_TLDS1_WSGRA1_WSGRB1_WG64_4_1_WGM2
    SolutionIndex: 132
    SolutionNameMin: Cijk_Ailk_Bljk_BBH_MT128x64x32_MI32x32x4x1_SE_1LDSB0_AF0EM1_AF1EM1_EPS1_FL0_GRVW2_GSU1_IU1_LBSPP128_LPB4_LRVW4_NLCA1_PGR1_PLR9_SU0_SUM0_SUS256_SRVW4_TT2_32_TLDS1_WSGRA1_WSGRB1_WG64_4_1_WGM15
    SolutionIndex: 133
    SolutionNameMin: Cijk_Ailk_Bljk_BBH_MT64x32x32_MI16x16x8x1_SE_1LDSB0_AF0EM1_AF1EM1_EPS1_FL0_GRVW2_GSU1_IU1_LBSPP128_LPB4_LRVW4_NLCA1_PGR1_PLR5_SU32_SUM0_SUS256_SRVW4_TT2_16_TLDS1_WSGRA1_WSGRB1_WG32_8_1_WGM1
    SolutionIndex: 134
    SolutionNameMin: Cijk_Ailk_Bljk_BBH_MT64x64x32_MI32x32x4x1_SE_1LDSB0_AF0EM1_AF1EM1_EPS1_FL0_GRVW8_GSU1_IU1_LBSPP128_LPB8_LRVW4_NLCA1_PGR1_PLR9_SU0_SUM0_SUS256_SRVW4_TT1_32_TLDS1_WSGRA1_WSGRB1_WG64_4_1_WGM1
    SolutionIndex: 135
    SolutionNameMin: Cijk_Ailk_Bljk_BBH_MT128x64x32_MI32x32x2x2_SE_1LDSB0_AF0EM8_AF1EM1_EPS1_FL1_GRVW8_GSU1_IU1_LBSPP128_LPB8_LRVW2_NLCA1_PGR1_PLR1_SU0_SUM0_SUS256_SRVW4_TT1_32_TLDS1_WSGRA0_WSGRB0_WG128_2_1_WGM1
    SolutionIndex: 136
    SolutionNameMin: Cijk_Ailk_Bljk_BBH_MT128x64x32_MI32x32x4x1_SE_1LDSB0_AF0EM8_AF1EM1_EPS0_FL0_GRVW8_GSU1_IU1_LBSPP128_LPB8_LRVW4_NLCA1_PGR2_PLR9_SU0_SUM0_SUS256_SRVW4_TT2_32_TLDS1_WSGRA1_WSGRB1_WG64_4_1_WGM1
    SolutionIndex: 137
    SolutionNameMin: Cijk_Ailk_Bljk_BBH_MT96x96x32_MI16x16x8x1_SE_1LDSB1_AF0EM8_AF1EM1_EPS0_FL0_GRVW4_GSU1_IU1_LBSPP128_LPB4_LRVW4_NLCA3_PGR2_PLR5_SU32_SUM0_SUS128_SRVW0_TT3_48_TLDS1_WSGRA1_WSGRB1_WG32_8_1_WGM1
    SolutionIndex: 138
    SolutionNameMin: Cijk_Ailk_Bljk_BBH_MT64x128x32_MI32x32x4x1_SE_1LDSB0_AF0EM8_AF1EM1_EPS1_FL1_GRVW8_GSU1_IU1_LBSPP128_LPB8_LRVW2_NLCA1_PGR1_PLR1_SU0_SUM0_SUS256_SRVW4_TT2_32_TLDS1_WSGRA0_WSGRB0_WG32_8_1_WGM1
    SolutionIndex: 139
    SolutionNameMin: Cijk_Ailk_Bljk_BBH_MT64x128x32_MI32x32x4x1_SE_1LDSB0_AF0EM1_AF1EM1_EPS1_FL0_GRVW8_GSU1_IU1_LBSPP128_LPB8_LRVW4_NLCA1_PGR1_PLR9_SU0_SUM0_SUS256_SRVW4_TT1_64_TLDS1_WSGRA1_WSGRB1_WG64_4_1_WGM1
    SolutionIndex: 140
    SolutionNameMin: Cijk_Ailk_Bljk_BBH_MT64x32x32_MI16x16x8x1_SE_1LDSB0_AF0EM1_AF1EM1_EPS1_FL1_GRVW4_GSU1_IU1_LBSPP128_LPB4_LRVW2_NLCA1_PGR1_PLR1_SU0_SUM0_SUS256_SRVW4_TT1_32_TLDS1_WSGRA0_WSGRB0_WG128_2_1_WGM1
    SolutionIndex: 141
    SolutionNameMin: Cijk_Ailk_Bljk_BBH_MT64x64x32_MI32x32x4x1_SE_1LDSB0_AF0EM1_AF1EM1_EPS1_FL0_GRVW2_GSU1_IU1_LBSPP128_LPB4_LRVW4_NLCA1_PGR1_PLR9_SU0_SUM0_SUS256_SRVW4_TT1_32_TLDS1_WSGRA1_WSGRB1_WG64_4_1_WGM15
    SolutionIndex: 142
    SolutionNameMin: Cijk_Ailk_Bljk_BBH_MT128x64x32_MI32x32x4x1_SE_1LDSB0_AF0EM8_AF1EM1_EPS1_FL0_GRVW8_GSU1_IU1_LBSPP128_LPB8_LRVW4_NLCA1_PGR1_PLR9_SU32_SUM0_SUS128_SRVW4_TT2_32_TLDS1_WSGRA1_WSGRB1_WG64_4_1_WGM1
    SolutionIndex: 143
    SolutionNameMin: Cijk_Ailk_Bljk_BBH_MT64x128x32_MI32x32x4x1_SE_1LDSB0_AF0EM1_AF1EM1_EPS1_FL0_GRVW4_GSU1_IU1_LBSPP128_LPB4_LRVW4_NLCA1_PGR1_PLR9_SU0_SUM0_SUS256_SRVW4_TT1_64_TLDS1_WSGRA1_WSGRB1_WG64_4_1_WGM15
    SolutionIndex: 144
    SolutionNameMin: Cijk_Ailk_Bljk_BBH_MT64x128x32_MI32x32x4x1_SE_1LDSB0_AF0EM8_AF1EM1_EPS1_FL0_GRVW4_GSU1_IU1_LBSPP128_LPB4_LRVW4_NLCA1_PGR1_PLR9_SU32_SUM0_SUS256_SRVW4_TT1_64_TLDS1_WSGRA1_WSGRB1_WG64_4_1_WGM15
    SolutionIndex: 145
    SolutionNameMin: Cijk_Ailk_Bljk_BBH_MT128x144x32_MI16x16x8x1_SE_1LDSB1_AF0EM8_AF1EM1_EPS1_FL0_GRVW2_GSU1_IU1_LBSPP128_LPB4_LRVW4_NLCA1_PGR1_PLR5_SU32_SUM0_SUS128_SRVW4_TT2_144_TLDS1_WSGRA1_WSGRB1_WG64_4_1_WGM1
    SolutionIndex: 146
    SolutionNameMin: Cijk_Ailk_Bljk_BBH_MT64x128x32_MI32x32x4x1_SE_1LDSB0_AF0EM8_AF1EM1_EPS1_FL0_GRVW8_GSU1_IU1_LBSPP128_LPB8_LRVW4_NLCA1_PGR1_PLR9_SU32_SUM0_SUS128_SRVW4_TT1_64_TLDS1_WSGRA1_WSGRB1_WG64_4_1_WGM2
    SolutionIndex: 147
    SolutionNameMin: Cijk_Ailk_Bljk_BBH_MT64x128x32_MI32x32x4x1_SE_1LDSB0_AF0EM4_AF1EM1_EPS1_FL0_GRVW8_GSU1_IU1_LBSPP128_LPB8_LRVW2_NLCA1_PGR1_PLR1_SU32_SUM0_SUS128_SRVW4_TT1_64_TLDS1_WSGRA1_WSGRB1_WG64_4_1_WGM1
    SolutionIndex: 148
    SolutionNameMin: Cijk_Ailk_Bljk_BBH_MT128x256x32_MI32x32x4x1_SE_1LDSB1_AF0EM8_AF1EM1_EPS1_FL0_GRVW8_GSU1_IU1_LBSPP128_LPB8_LRVW4_NLCA1_PGR1_PLR9_SU0_SUM0_SUS256_SRVW4_TT2_128_TLDS1_WSGRA1_WSGRB1_WG64_4_1_WGM1
    SolutionIndex: 149
    SolutionNameMin: Cijk_Ailk_Bljk_BBH_MT64x128x32_MI32x32x4x1_SE_1LDSB0_AF0EM8_AF1EM1_EPS1_FL0_GRVW8_GSU1_IU1_LBSPP128_LPB8_LRVW4_NLCA1_PGR1_PLR9_SU0_SUM0_SUS256_SRVW4_TT1_64_TLDS1_WSGRA1_WSGRB1_WG64_4_1_WGM1
    SolutionIndex: 150
    SolutionNameMin: Cijk_Ailk_Bljk_BBH_MT64x128x32_MI32x32x4x1_SE_1LDSB0_AF0EM1_AF1EM1_EPS1_FL0_GRVW4_GSU1_IU1_LBSPP128_LPB4_LRVW4_NLCA1_PGR1_PLR9_SU0_SUM0_SUS256_SRVW4_TT1_64_TLDS1_WSGRA1_WSGRB1_WG64_4_1_WGM2
    SolutionIndex: 151
    SolutionNameMin: Cijk_Ailk_Bljk_BBH_MT64x128x32_MI32x32x4x1_SE_1LDSB0_AF0EM1_AF1EM1_EPS1_FL0_GRVW8_GSU1_IU1_LBSPP128_LPB8_LRVW2_NLCA1_PGR1_PLR1_SU16_SUM0_SUS128_SRVW4_TT1_64_TLDS1_WSGRA1_WSGRB1_WG64_4_1_WGM15
    SolutionIndex: 152
    SolutionNameMin: Cijk_Ailk_Bljk_BBH_MT128x256x32_MI32x32x4x1_SE_1LDSB1_AF0EM8_AF1EM1_EPS1_FL0_GRVW8_GSU1_IU1_LBSPP128_LPB8_LRVW4_NLCA1_PGR1_PLR9_SU32_SUM0_SUS128_SRVW4_TT2_128_TLDS1_WSGRA1_WSGRB1_WG64_4_1_WGM15
    SolutionIndex: 153
    SolutionNameMin: Cijk_Ailk_Bljk_BBH_MT64x128x32_MI32x32x4x1_SE_1LDSB0_AF0EM8_AF1EM1_EPS0_FL0_GRVW8_GSU1_IU1_LBSPP128_LPB8_LRVW4_NLCA1_PGR2_PLR9_SU32_SUM0_SUS256_SRVW4_TT1_64_TLDS1_WSGRA1_WSGRB1_WG64_4_1_WGM2
    SolutionIndex: 154
    SolutionNameMin: Cijk_Ailk_Bljk_BBH_MT64x128x32_MI32x32x4x1_SE_1LDSB0_AF0EM1_AF1EM1_EPS1_FL0_GRVW8_GSU1_IU1_LBSPP128_LPB8_LRVW4_NLCA1_PGR1_PLR9_SU32_SUM0_SUS256_SRVW4_TT1_64_TLDS1_WSGRA1_WSGRB1_WG64_4_1_WGM15
    SolutionIndex: 155
    SolutionNameMin: Cijk_Ailk_Bljk_BBH_MT32x32x64_MI16x16x8x1_SE_1LDSB0_AF0EM8_AF1EM1_EPS1_FL0_GRVW8_GSU3_IU1_LBSPP128_LPB8_LRVW4_NLCA1_PGR1_PLR9_SU0_SUM0_SUS256_SRVW0_TT1_16_TLDS1_WSGRA1_WSGRB1_WG32_8_1_WGM2
    SolutionIndex: 156
    SolutionNameMin: Cijk_Ailk_Bljk_BBH_MT128x64x32_MI32x32x4x1_SE_1LDSB0_AF0EM8_AF1EM1_EPS1_FL1_GRVW4_GSU1_IU1_LBSPP128_LPB4_LRVW2_NLCA1_PGR1_PLR1_SU0_SUM0_SUS256_SRVW4_TT2_32_TLDS1_WSGRA0_WSGRB0_WG64_4_1_WGM1
    SolutionIndex: 157
    SolutionNameMin: Cijk_Ailk_Bljk_BBH_MT128x96x64_MI32x32x4x1_SE_1LDSB0_AF0EM8_AF1EM1_EPS1_FL0_GRVW2_GSU1_IU1_LBSPP128_LPB4_LRVW4_NLCA1_PGR1_PLR17_SU0_SUM0_SUS256_SRVW4_TT1_96_TLDS1_WSGRA1_WSGRB1_WG128_2_1_WGM2
    SolutionIndex: 158
    SolutionNameMin: Cijk_Ailk_Bljk_BBH_MT32x64x64_MI16x16x8x1_SE_1LDSB0_AF0EM8_AF1EM1_EPS1_FL0_GRVW8_GSU1_IU1_LBSPP128_LPB8_LRVW4_NLCA1_PGR1_PLR9_SU0_SUM0_SUS256_SRVW4_TT1_32_TLDS1_WSGRA1_WSGRB1_WG32_8_1_WGM1
    SolutionIndex: 159
    SolutionNameMin: Cijk_Ailk_Bljk_BBH_MT128x64x64_MI32x32x4x1_SE_1LDSB0_AF0EM8_AF1EM1_EPS0_FL0_GRVW4_GSU3_IU1_LBSPP128_LPB4_LRVW4_NLCA1_PGR2_PLR17_SU32_SUM0_SUS128_SRVW4_TT2_32_TLDS1_WSGRA1_WSGRB1_WG64_4_1_WGM15
    SolutionIndex: 160
    SolutionNameMin: Cijk_Ailk_Bljk_BBH_MT64x64x32_MI32x32x4x1_SE_1LDSB0_AF0EM8_AF1EM1_EPS1_FL0_GRVW8_GSU1_IU1_LBSPP128_LPB8_LRVW4_NLCA1_PGR1_PLR9_SU0_SUM0_SUS256_SRVW4_TT1_32_TLDS1_WSGRA1_WSGRB1_WG64_4_1_WGM15
    SolutionIndex: 161
    SolutionNameMin: Cijk_Ailk_Bljk_BBH_MT128x96x64_MI32x32x4x1_SE_1LDSB0_AF0EM8_AF1EM1_EPS1_FL0_GRVW8_GSU7_IU1_LBSPP128_LPB8_LRVW4_NLCA1_PGR1_PLR17_SU32_SUM0_SUS128_SRVW0_TT1_96_TLDS1_WSGRA1_WSGRB1_WG128_2_1_WGM15
    SolutionIndex: 162
    SolutionNameMin: Cijk_Ailk_Bljk_BBH_MT64x128x64_MI32x32x4x1_SE_1LDSB0_AF0EM8_AF1EM1_EPS1_FL0_GRVW8_GSU1_IU1_LBSPP128_LPB8_LRVW4_NLCA1_PGR1_PLR17_SU32_SUM0_SUS128_SRVW4_TT1_64_TLDS1_WSGRA1_WSGRB1_WG64_4_1_WGM2
    SolutionIndex: 163
    SolutionNameMin: Cijk_Ailk_Bljk_BBH_MT64x128x32_MI32x32x2x2_SE_1LDSB0_AF0EM1_AF1EM1_EPS1_FL0_GRVW4_GSU1_IU1_LBSPP128_LPB4_LRVW2_NLCA1_PGR1_PLR1_SU32_SUM0_SUS256_SRVW4_TT1_32_TLDS1_WSGRA1_WSGRB1_WG64_4_1_WGM1
    SolutionIndex: 164
    SolutionNameMin: Cijk_Ailk_Bljk_BBH_MT32x32x64_MI16x16x8x1_SE_1LDSB0_AF0EM8_AF1EM1_EPS1_FL0_GRVW4_GSU3_IU1_LBSPP128_LPB4_LRVW4_NLCA1_PGR1_PLR9_SU32_SUM0_SUS128_SRVW0_TT1_16_TLDS1_WSGRA1_WSGRB1_WG32_8_1_WGM1
    SolutionIndex: 165
    SolutionNameMin: Cijk_Ailk_Bljk_BBH_MT32x32x32_MI16x16x8x1_SE_1LDSB0_AF0EM4_AF1EM1_EPS1_FL0_GRVW4_GSU1_IU1_LBSPP128_LPB4_LRVW2_NLCA1_PGR1_PLR1_SU0_SUM0_SUS256_SRVW0_TT1_16_TLDS1_WSGRA1_WSGRB1_WG32_8_1_WGM2
    SolutionIndex: 166
    SolutionNameMin: Cijk_Ailk_Bljk_BBH_MT128x96x32_MI32x32x4x1_SE_1LDSB0_AF0EM8_AF1EM1_EPS1_FL0_GRVW4_GSU15_IU1_LBSPP128_LPB4_LRVW4_NLCA1_PGR1_PLR9_SU0_SUM0_SUS256_SRVW0_TT1_96_TLDS1_WSGRA1_WSGRB1_WG128_2_1_WGM1
    SolutionIndex: 167
    SolutionNameMin: Cijk_Ailk_Bljk_BBH_MT32x32x64_MI16x16x8x1_SE_1LDSB0_AF0EM8_AF1EM1_EPS1_FL0_GRVW8_GSU3_IU1_LBSPP128_LPB8_LRVW4_NLCA1_PGR1_PLR9_SU32_SUM0_SUS128_SRVW0_TT1_16_TLDS1_WSGRA1_WSGRB1_WG32_8_1_WGM1
    SolutionIndex: 168
    SolutionNameMin: Cijk_Ailk_Bljk_BBH_MT128x256x32_MI32x32x4x1_SE_1LDSB1_AF0EM1_AF1EM1_EPS1_FL0_GRVW8_GSU1_IU1_LBSPP128_LPB8_LRVW4_NLCA1_PGR1_PLR9_SU0_SUM0_SUS256_SRVW4_TT2_128_TLDS1_WSGRA1_WSGRB1_WG64_4_1_WGM2
    SolutionIndex: 169
    SolutionNameMin: Cijk_Ailk_Bljk_BBH_MT96x96x32_MI16x16x8x1_SE_1LDSB1_AF0EM8_AF1EM1_EPS1_FL0_GRVW4_GSU1_IU1_LBSPP128_LPB4_LRVW4_NLCA3_PGR1_PLR5_SU32_SUM0_SUS128_SRVW0_TT3_48_TLDS1_WSGRA1_WSGRB1_WG32_8_1_WGM15
    SolutionIndex: 170
    SolutionNameMin: Cijk_Ailk_Bljk_BBH_MT32x32x64_MI16x16x8x1_SE_1LDSB0_AF0EM8_AF1EM1_EPS1_FL0_GRVW8_GSU1_IU1_LBSPP128_LPB8_LRVW4_NLCA1_PGR1_PLR9_SU32_SUM0_SUS256_SRVW4_TT1_16_TLDS1_WSGRA1_WSGRB1_WG32_8_1_WGM15
    SolutionIndex: 171
    SolutionNameMin: Cijk_Ailk_Bljk_BBH_MT96x96x64_MI16x16x8x1_SE_1LDSB0_AF0EM8_AF1EM1_EPS1_FL0_GRVW8_GSU5_IU1_LBSPP128_LPB8_LRVW4_NLCA3_PGR1_PLR9_SU0_SUM0_SUS256_SRVW0_TT3_48_TLDS1_WSGRA1_WSGRB1_WG32_8_1_WGM1
    SolutionIndex: 172
    SolutionNameMin: Cijk_Ailk_Bljk_BBH_MT128x144x32_MI16x16x8x1_SE_1LDSB1_AF0EM8_AF1EM1_EPS1_FL0_GRVW2_GSU5_IU1_LBSPP128_LPB4_LRVW4_NLCA1_PGR1_PLR5_SU0_SUM0_SUS256_SRVW0_TT2_144_TLDS1_WSGRA1_WSGRB1_WG64_4_1_WGM15
    SolutionIndex: 173
    SolutionNameMin: Cijk_Ailk_Bljk_BBH_MT144x128x32_MI16x16x8x1_SE_1LDSB0_AF0EM8_AF1EM1_EPS1_FL0_GRVW2_GSU1_IU1_LBSPP128_LPB4_LRVW4_NLCA9_PGR1_PLR5_SU32_SUM0_SUS128_SRVW0_TT9_32_TLDS1_WSGRA1_WSGRB1_WG16_16_1_WGM2
    SolutionIndex: 174
    SolutionNameMin: Cijk_Ailk_Bljk_BBH_MT32x32x64_MI16x16x8x1_SE_1LDSB0_AF0EM8_AF1EM1_EPS1_FL0_GRVW8_GSU1_IU1_LBSPP128_LPB8_LRVW4_NLCA1_PGR1_PLR9_SU32_SUM0_SUS128_SRVW4_TT1_16_TLDS1_WSGRA1_WSGRB1_WG32_8_1_WGM2
    SolutionIndex: 175
    SolutionNameMin: Cijk_Ailk_Bljk_BBH_MT64x32x64_MI16x16x8x1_SE_1LDSB0_AF0EM8_AF1EM1_EPS1_FL0_GRVW4_GSU1_IU1_LBSPP128_LPB4_LRVW4_NLCA1_PGR1_PLR9_SU0_SUM0_SUS256_SRVW4_TT2_16_TLDS1_WSGRA1_WSGRB1_WG32_8_1_WGM1
    SolutionIndex: 176
    SolutionNameMin: Cijk_Ailk_Bljk_BBH_MT128x96x64_MI32x32x4x1_SE_1LDSB0_AF0EM8_AF1EM1_EPS1_FL0_GRVW2_GSU3_IU1_LBSPP128_LPB4_LRVW4_NLCA1_PGR1_PLR17_SU32_SUM0_SUS128_SRVW0_TT1_96_TLDS1_WSGRA1_WSGRB1_WG128_2_1_WGM2
    SolutionIndex: 177
    SolutionNameMin: Cijk_Ailk_Bljk_BBH_MT32x32x64_MI16x16x8x1_SE_1LDSB0_AF0EM8_AF1EM1_EPS1_FL0_GRVW8_GSU1_IU1_LBSPP128_LPB8_LRVW4_NLCA1_PGR1_PLR9_SU0_SUM0_SUS256_SRVW4_TT1_16_TLDS1_WSGRA1_WSGRB1_WG32_8_1_WGM2
    SolutionIndex: 178
    SolutionNameMin: Cijk_Ailk_Bljk_BBH_MT64x128x32_MI32x32x2x2_SE_1LDSB0_AF0EM1_AF1EM1_EPS1_FL0_GRVW4_GSU1_IU1_LBSPP128_LPB4_LRVW2_NLCA1_PGR1_PLR1_SU32_SUM3_SUS256_SRVW4_TT1_32_TLDS1_WSGRA1_WSGRB1_WG64_4_1_WGM1
    SolutionIndex: 179
    SolutionNameMin: Cijk_Ailk_Bljk_BBH_MT256x160x32_MI32x32x4x1_SE_1LDSB1_AF0EM8_AF1EM1_EPS1_FL0_GRVW2_GSU1_IU1_LBSPP128_LPB4_LRVW4_NLCA2_PGR1_PLR9_SU0_SUM0_SUS256_SRVW4_TT2_160_TLDS1_WSGRA1_WSGRB1_WG128_2_1_WGM15
    SolutionIndex: 180
    SolutionNameMin: Cijk_Ailk_Bljk_BBH_MT96x96x64_MI16x16x8x1_SE_1LDSB1_AF0EM8_AF1EM1_EPS1_FL0_GRVW8_GSU1_IU1_LBSPP128_LPB8_LRVW4_NLCA3_PGR1_PLR9_SU32_SUM0_SUS128_SRVW0_TT3_48_TLDS1_WSGRA1_WSGRB1_WG32_8_1_WGM15
    SolutionIndex: 181
    SolutionNameMin: Cijk_Ailk_Bljk_BBH_MT64x64x64_MI32x32x4x1_SE_1LDSB0_AF0EM8_AF1EM1_EPS1_FL0_GRVW8_GSU1_IU1_LBSPP128_LPB8_LRVW4_NLCA1_PGR1_PLR17_SU32_SUM0_SUS256_SRVW4_TT1_32_TLDS1_WSGRA1_WSGRB1_WG64_4_1_WGM2
    SolutionIndex: 182
    SolutionNameMin: Cijk_Ailk_Bljk_BBH_MT64x128x32_MI32x32x4x1_SE_1LDSB0_AF0EM8_AF1EM1_EPS1_FL0_GRVW8_GSU1_IU1_LBSPP128_LPB8_LRVW4_NLCA1_PGR1_PLR9_SU0_SUM0_SUS256_SRVW4_TT1_64_TLDS1_WSGRA1_WSGRB1_WG64_4_1_WGM15
    SolutionIndex: 183
    SolutionNameMin: Cijk_Ailk_Bljk_BBH_MT96x96x64_MI16x16x8x1_SE_1LDSB1_AF0EM8_AF1EM1_EPS1_FL0_GRVW8_GSU1_IU1_LBSPP128_LPB8_LRVW4_NLCA3_PGR1_PLR9_SU0_SUM0_SUS256_SRVW0_TT3_48_TLDS1_WSGRA1_WSGRB1_WG32_8_1_WGM15
    SolutionIndex: 184
    SolutionNameMin: Cijk_Ailk_Bljk_BBH_MT128x256x32_MI32x32x4x1_SE_1LDSB1_AF0EM8_AF1EM1_EPS1_FL0_GRVW8_GSU1_IU1_LBSPP128_LPB8_LRVW4_NLCA1_PGR1_PLR9_SU0_SUM0_SUS256_SRVW4_TT2_128_TLDS1_WSGRA1_WSGRB1_WG64_4_1_WGM2
    SolutionIndex: 185
    SolutionNameMin: Cijk_Ailk_Bljk_BBH_MT128x96x32_MI32x32x4x1_SE_1LDSB0_AF0EM1_AF1EM1_EPS1_FL0_GRVW4_GSU1_IU1_LBSPP128_LPB4_LRVW4_NLCA1_PGR1_PLR9_SU0_SUM0_SUS256_SRVW4_TT1_96_TLDS1_WSGRA1_WSGRB1_WG128_2_1_WGM2
    SolutionIndex: 186
    SolutionNameMin: Cijk_Ailk_Bljk_BBH_MT64x32x64_MI16x16x8x1_SE_1LDSB0_AF0EM8_AF1EM1_EPS1_FL0_GRVW8_GSU7_IU1_LBSPP128_LPB8_LRVW4_NLCA1_PGR1_PLR9_SU0_SUM0_SUS256_SRVW0_TT2_16_TLDS1_WSGRA1_WSGRB1_WG32_8_1_WGM1
    SolutionIndex: 187
    SolutionNameMin: Cijk_Ailk_Bljk_BBH_MT128x144x32_MI16x16x8x1_SE_1LDSB1_AF0EM8_AF1EM1_EPS1_FL0_GRVW2_GSU1_IU1_LBSPP128_LPB4_LRVW4_NLCA1_PGR1_PLR5_SU32_SUM0_SUS256_SRVW4_TT2_144_TLDS1_WSGRA1_WSGRB1_WG64_4_1_WGM1
    SolutionIndex: 188
    SolutionNameMin: Cijk_Ailk_Bljk_BBH_MT128x96x64_MI32x32x4x1_SE_1LDSB0_AF0EM8_AF1EM1_EPS1_FL0_GRVW2_GSU2_IU1_LBSPP128_LPB4_LRVW4_NLCA1_PGR1_PLR17_SU32_SUM0_SUS128_SRVW4_TT1_96_TLDS1_WSGRA1_WSGRB1_WG128_2_1_WGM2
    SolutionIndex: 189
    SolutionNameMin: Cijk_Ailk_Bljk_BBH_MT96x96x32_MI16x16x8x1_SE_1LDSB0_AF0EM8_AF1EM1_EPS0_FL0_GRVW2_GSU1_IU1_LBSPP128_LPB4_LRVW4_NLCA3_PGR2_PLR5_SU0_SUM0_SUS256_SRVW0_TT3_48_TLDS1_WSGRA1_WSGRB1_WG32_8_1_WGM15
    SolutionIndex: 190
    SolutionNameMin: Cijk_Ailk_Bljk_BBH_MT128x96x64_MI32x32x4x1_SE_1LDSB0_AF0EM8_AF1EM1_EPS1_FL0_GRVW8_GSU2_IU1_LBSPP128_LPB8_LRVW4_NLCA1_PGR1_PLR17_SU0_SUM0_SUS256_SRVW4_TT1_96_TLDS1_WSGRA1_WSGRB1_WG128_2_1_WGM2
    SolutionIndex: 191
    SolutionNameMin: Cijk_Ailk_Bljk_BBH_MT64x128x64_MI32x32x4x1_SE_1LDSB0_AF0EM1_AF1EM1_EPS1_FL0_GRVW4_GSU1_IU1_LBSPP128_LPB4_LRVW2_NLCA1_PGR1_PLR1_SU32_SUM0_SUS256_SRVW4_TT2_32_TLDS1_WSGRA1_WSGRB1_WG32_8_1_WGM4
    SolutionIndex: 192
    SolutionNameMin: Cijk_Ailk_Bljk_BBH_MT64x128x32_MI32x32x4x1_SE_1LDSB0_AF0EM8_AF1EM1_EPS1_FL0_GRVW8_GSU1_IU1_LBSPP128_LPB8_LRVW4_NLCA1_PGR1_PLR9_SU32_SUM0_SUS128_SRVW4_TT1_64_TLDS1_WSGRA1_WSGRB1_WG64_4_1_WGM15
    SolutionIndex: 193
    SolutionNameMin: Cijk_Ailk_Bljk_BBH_MT256x128x32_MI32x32x4x1_SE_1LDSB1_AF0EM8_AF1EM1_EPS1_FL0_GRVW8_GSU5_IU1_LBSPP128_LPB8_LRVW4_NLCA1_PGR1_PLR9_SU32_SUM0_SUS128_SRVW0_TT4_64_TLDS1_WSGRA1_WSGRB1_WG64_4_1_WGM1
    SolutionIndex: 194
    SolutionNameMin: Cijk_Ailk_Bljk_BBH_MT128x256x32_MI32x32x4x1_SE_1LDSB1_AF0EM8_AF1EM1_EPS1_FL0_GRVW8_GSU1_IU1_LBSPP128_LPB8_LRVW4_NLCA1_PGR1_PLR9_SU32_SUM0_SUS128_SRVW4_TT2_128_TLDS1_WSGRA1_WSGRB1_WG64_4_1_WGM1
    SolutionIndex: 195
    SolutionNameMin: Cijk_Ailk_Bljk_BBH_MT64x128x32_MI32x32x4x1_SE_1LDSB0_AF0EM8_AF1EM1_EPS1_FL0_GRVW4_GSU1_IU1_LBSPP128_LPB4_LRVW4_NLCA1_PGR1_PLR9_SU0_SUM0_SUS256_SRVW4_TT1_64_TLDS1_WSGRA1_WSGRB1_WG64_4_1_WGM1
    SolutionIndex: 196
    SolutionNameMin: Cijk_Ailk_Bljk_BBH_MT128x96x64_MI32x32x4x1_SE_1LDSB0_AF0EM8_AF1EM1_EPS1_FL0_GRVW2_GSU1_IU1_LBSPP128_LPB4_LRVW4_NLCA1_PGR1_PLR17_SU32_SUM0_SUS256_SRVW4_TT1_96_TLDS1_WSGRA1_WSGRB1_WG128_2_1_WGM15
    SolutionIndex: 197
    SolutionNameMin: Cijk_Ailk_Bljk_BBH_MT96x96x64_MI16x16x8x1_SE_1LDSB1_AF0EM8_AF1EM1_EPS1_FL0_GRVW8_GSU1_IU1_LBSPP128_LPB8_LRVW4_NLCA3_PGR1_PLR9_SU0_SUM0_SUS256_SRVW0_TT3_48_TLDS1_WSGRA1_WSGRB1_WG32_8_1_WGM1
    SolutionIndex: 198
    SolutionNameMin: Cijk_Ailk_Bljk_BBH_MT32x32x32_MI16x16x8x1_SE_1LDSB0_AF0EM8_AF1EM1_EPS1_FL0_GRVW8_GSU1_IU1_LBSPP128_LPB8_LRVW4_NLCA1_PGR1_PLR5_SU0_SUM0_SUS256_SRVW4_TT1_16_TLDS1_WSGRA1_WSGRB1_WG32_8_1_WGM1
    SolutionIndex: 199
    SolutionNameMin: Cijk_Ailk_Bljk_BBH_MT32x32x128_MI16x16x8x1_SE_1LDSB0_AF0EM4_AF1EM1_EPS1_FL0_GRVW8_GSU1_IU1_LBSPP256_LPB8_LRVW2_NLCA1_PGR1_PLR1_SU16_SUM0_SUS256_SRVW0_TT1_16_TLDS1_WSGRA1_WSGRB1_WG32_8_1_WGM2
    SolutionIndex: 200
    SolutionNameMin: Cijk_Ailk_Bljk_BBH_MT32x32x64_MI16x16x8x1_SE_1LDSB0_AF0EM8_AF1EM1_EPS1_FL0_GRVW8_GSU3_IU1_LBSPP128_LPB8_LRVW4_NLCA1_PGR1_PLR9_SU0_SUM0_SUS256_SRVW0_TT1_16_TLDS1_WSGRA1_WSGRB1_WG32_8_1_WGM1
    SolutionIndex: 201
    SolutionNameMin: Cijk_Ailk_Bljk_BBH_MT32x32x64_MI16x16x8x1_SE_1LDSB0_AF0EM8_AF1EM1_EPS1_FL0_GRVW8_GSU5_IU1_LBSPP128_LPB8_LRVW4_NLCA1_PGR1_PLR9_SU32_SUM0_SUS256_SRVW0_TT1_16_TLDS1_WSGRA1_WSGRB1_WG32_8_1_WGM2
    SolutionIndex: 202
    SolutionNameMin: Cijk_Ailk_Bljk_BBH_MT64x128x32_MI32x32x4x1_SE_1LDSB0_AF0EM8_AF1EM1_EPS0_FL0_GRVW4_GSU1_IU1_LBSPP128_LPB4_LRVW4_NLCA1_PGR2_PLR9_SU0_SUM0_SUS256_SRVW4_TT1_64_TLDS1_WSGRA1_WSGRB1_WG64_4_1_WGM1
    SolutionIndex: 203
    SolutionNameMin: Cijk_Ailk_Bljk_BBH_MT32x32x128_MI16x16x8x1_SE_1LDSB0_AF0EM1_AF1EM1_EPS1_FL0_GRVW8_GSU1_IU1_LBSPP256_LPB8_LRVW2_NLCA1_PGR1_PLR1_SU32_SUM0_SUS256_SRVW0_TT1_16_TLDS1_WSGRA1_WSGRB1_WG32_8_1_WGM1
    SolutionIndex: 204
    SolutionNameMin: Cijk_Ailk_Bljk_BBH_MT128x96x32_MI32x32x4x1_SE_1LDSB0_AF0EM8_AF1EM1_EPS1_FL0_GRVW2_GSU1_IU1_LBSPP128_LPB4_LRVW4_NLCA1_PGR1_PLR9_SU0_SUM0_SUS256_SRVW4_TT1_96_TLDS1_WSGRA1_WSGRB1_WG128_2_1_WGM15
    SolutionIndex: 205
    SolutionNameMin: Cijk_Ailk_Bljk_BBH_MT64x32x32_MI16x16x8x1_SE_1LDSB0_AF0EM1_AF1EM1_EPS1_FL0_GRVW2_GSU1_IU1_LBSPP128_LPB2_LRVW2_NLCA1_PGR1_PLR1_SU32_SUM3_SUS256_SRVW0_TT1_32_TLDS1_WSGRA0_WSGRB0_WG64_4_1_WGM1
    SolutionIndex: 206
    SolutionNameMin: Cijk_Ailk_Bljk_BBH_MT64x64x64_MI32x32x4x1_SE_1LDSB0_AF0EM8_AF1EM1_EPS1_FL0_GRVW8_GSU1_IU1_LBSPP128_LPB8_LRVW4_NLCA1_PGR1_PLR17_SU32_SUM0_SUS128_SRVW4_TT1_32_TLDS1_WSGRA1_WSGRB1_WG64_4_1_WGM15
    SolutionIndex: 207
    SolutionNameMin: Cijk_Ailk_Bljk_BBH_MT64x64x32_MI32x32x4x1_SE_1LDSB0_AF0EM8_AF1EM1_EPS1_FL0_GRVW8_GSU1_IU1_LBSPP128_LPB8_LRVW4_NLCA1_PGR1_PLR9_SU0_SUM0_SUS256_SRVW4_TT1_32_TLDS1_WSGRA1_WSGRB1_WG64_4_1_WGM1
    SolutionIndex: 208
    SolutionNameMin: Cijk_Ailk_Bljk_BBH_MT32x64x64_MI16x16x8x1_SE_1LDSB0_AF0EM8_AF1EM1_EPS1_FL0_GRVW8_GSU1_IU1_LBSPP128_LPB8_LRVW4_NLCA1_PGR1_PLR9_SU32_SUM0_SUS128_SRVW4_TT1_32_TLDS1_WSGRA1_WSGRB1_WG32_8_1_WGM1
    SolutionIndex: 209
    SolutionNameMin: Cijk_Ailk_Bljk_BBH_MT128x128x32_MI32x32x4x1_SE_1LDSB0_AF0EM8_AF1EM1_EPS0_FL0_GRVW4_GSU3_IU1_LBSPP128_LPB4_LRVW4_NLCA1_PGR2_PLR9_SU32_SUM0_SUS128_SRVW4_TT2_64_TLDS1_WSGRA1_WSGRB1_WG64_4_1_WGM15
    SolutionIndex: 210
    SolutionNameMin: Cijk_Ailk_Bljk_BBH_MT256x128x32_MI32x32x4x1_SE_1LDSB1_AF0EM8_AF1EM1_EPS1_FL0_GRVW8_GSU3_IU1_LBSPP128_LPB8_LRVW4_NLCA1_PGR1_PLR9_SU32_SUM0_SUS256_SRVW0_TT4_64_TLDS1_WSGRA1_WSGRB1_WG64_4_1_WGM15
    SolutionIndex: 211
    SolutionNameMin: Cijk_Ailk_Bljk_BBH_MT256x160x32_MI32x32x4x1_SE_1LDSB0_AF0EM8_AF1EM1_EPS1_FL0_GRVW2_GSU3_IU1_LBSPP128_LPB4_LRVW4_NLCA2_PGR1_PLR9_SU0_SUM0_SUS256_SRVW0_TT2_160_TLDS1_WSGRA1_WSGRB1_WG128_2_1_WGM1
    SolutionIndex: 212
    SolutionNameMin: Cijk_Ailk_Bljk_BBH_MT128x96x32_MI32x32x4x1_SE_1LDSB0_AF0EM8_AF1EM1_EPS1_FL0_GRVW4_GSU5_IU1_LBSPP128_LPB4_LRVW4_NLCA1_PGR1_PLR9_SU32_SUM0_SUS128_SRVW4_TT1_96_TLDS1_WSGRA1_WSGRB1_WG128_2_1_WGM1
    SolutionIndex: 213
    SolutionNameMin: Cijk_Ailk_Bljk_BBH_MT32x32x32_MI16x16x8x1_SE_1LDSB0_AF0EM8_AF1EM1_EPS1_FL0_GRVW2_GSU1_IU1_LBSPP128_LPB4_LRVW4_NLCA1_PGR1_PLR5_SU0_SUM0_SUS256_SRVW4_TT1_16_TLDS1_WSGRA1_WSGRB1_WG32_8_1_WGM2
    SolutionIndex: 214
    SolutionNameMin: Cijk_Ailk_Bljk_BBH_MT128x160x32_MI32x32x4x1_SE_1LDSB0_AF0EM8_AF1EM1_EPS1_FL0_GRVW4_GSU15_IU1_LBSPP128_LPB4_LRVW4_NLCA1_PGR1_PLR9_SU0_SUM0_SUS256_SRVW0_TT1_160_TLDS1_WSGRA1_WSGRB1_WG128_2_1_WGM1
    SolutionIndex: 215
    SolutionNameMin: Cijk_Ailk_Bljk_BBH_MT128x96x32_MI32x32x4x1_SE_1LDSB0_AF0EM8_AF1EM1_EPS1_FL0_GRVW4_GSU5_IU1_LBSPP128_LPB4_LRVW4_NLCA1_PGR1_PLR9_SU32_SUM0_SUS128_SRVW4_TT1_96_TLDS1_WSGRA1_WSGRB1_WG128_2_1_WGM15
    SolutionIndex: 216
    SolutionNameMin: Cijk_Ailk_Bljk_BBH_MT32x32x64_MI16x16x8x1_SE_1LDSB0_AF0EM8_AF1EM1_EPS1_FL0_GRVW4_GSU3_IU1_LBSPP128_LPB4_LRVW4_NLCA1_PGR1_PLR9_SU32_SUM0_SUS256_SRVW0_TT1_16_TLDS1_WSGRA1_WSGRB1_WG32_8_1_WGM2
    SolutionIndex: 217
    SolutionNameMin: Cijk_Ailk_Bljk_BBH_MT64x128x32_MI32x32x4x1_SE_1LDSB0_AF0EM1_AF1EM1_EPS1_FL1_GRVW2_GSU1_IU1_LBSPP128_LPB2_LRVW2_NLCA1_PGR1_PLR1_SU0_SUM0_SUS256_SRVW4_TT2_32_TLDS1_WSGRA0_WSGRB0_WG32_8_1_WGM10
    SolutionIndex: 218
    SolutionNameMin: Cijk_Ailk_Bljk_BBH_MT128x64x32_MI32x32x4x1_SE_1LDSB0_AF0EM4_AF1EM1_EPS1_FL1_GRVW4_GSU1_IU1_LBSPP128_LPB4_LRVW2_NLCA1_PGR1_PLR1_SU0_SUM0_SUS256_SRVW4_TT2_32_TLDS1_WSGRA0_WSGRB0_WG64_4_1_WGM4
    SolutionIndex: 219
    SolutionNameMin: Cijk_Ailk_Bljk_BBH_MT128x96x32_MI32x32x4x1_SE_1LDSB0_AF0EM8_AF1EM1_EPS1_FL0_GRVW2_GSU1_IU1_LBSPP128_LPB4_LRVW4_NLCA1_PGR1_PLR9_SU32_SUM0_SUS128_SRVW4_TT1_96_TLDS1_WSGRA1_WSGRB1_WG128_2_1_WGM2
    SolutionIndex: 220
    SolutionNameMin: Cijk_Ailk_Bljk_BBH_MT32x64x64_MI16x16x8x1_SE_1LDSB0_AF0EM1_AF1EM1_EPS1_FL0_GRVW2_GSU15_IU1_LBSPP128_LPB4_LRVW4_NLCA1_PGR1_PLR9_SU0_SUM0_SUS256_SRVW0_TT1_32_TLDS1_WSGRA1_WSGRB1_WG32_8_1_WGM15
    SolutionIndex: 221
    SolutionNameMin: Cijk_Ailk_Bljk_BBH_MT64x128x64_MI32x32x4x1_SE_1LDSB0_AF0EM1_AF1EM1_EPS1_FL0_GRVW4_GSU1_IU1_LBSPP128_LPB4_LRVW4_NLCA1_PGR1_PLR17_SU32_SUM0_SUS128_SRVW4_TT1_64_TLDS1_WSGRA1_WSGRB1_WG64_4_1_WGM15
    SolutionIndex: 222
    SolutionNameMin: Cijk_Ailk_Bljk_BBH_MT64x128x64_MI32x32x4x1_SE_1LDSB0_AF0EM8_AF1EM1_EPS1_FL0_GRVW8_GSU1_IU1_LBSPP128_LPB8_LRVW4_NLCA1_PGR1_PLR17_SU32_SUM0_SUS128_SRVW4_TT1_64_TLDS1_WSGRA1_WSGRB1_WG64_4_1_WGM1
    SolutionIndex: 223
    SolutionNameMin: Cijk_Ailk_Bljk_BBH_MT96x128x32_MI32x32x4x1_SE_1LDSB0_AF0EM8_AF1EM1_EPS0_FL0_GRVW4_GSU1_IU1_LBSPP128_LPB4_LRVW4_NLCA3_PGR2_PLR9_SU0_SUM0_SUS256_SRVW0_TT3_32_TLDS1_WSGRA1_WSGRB1_WG32_8_1_WGM1
    SolutionIndex: 224
    SolutionNameMin: Cijk_Ailk_Bljk_BBH_MT128x144x32_MI16x16x8x1_SE_1LDSB1_AF0EM8_AF1EM1_EPS1_FL0_GRVW2_GSU1_IU1_LBSPP128_LPB4_LRVW4_NLCA1_PGR1_PLR5_SU32_SUM0_SUS256_SRVW4_TT2_144_TLDS1_WSGRA1_WSGRB1_WG64_4_1_WGM2
    SolutionIndex: 225
    SolutionNameMin: Cijk_Ailk_Bljk_BBH_MT64x128x64_MI32x32x4x1_SE_1LDSB0_AF0EM8_AF1EM1_EPS1_FL0_GRVW8_GSU1_IU1_LBSPP128_LPB8_LRVW4_NLCA1_PGR1_PLR17_SU32_SUM0_SUS256_SRVW4_TT1_64_TLDS1_WSGRA1_WSGRB1_WG64_4_1_WGM15
    SolutionIndex: 226
    SolutionNameMin: Cijk_Ailk_Bljk_BBH_MT256x64x32_MI32x32x4x1_SE_1LDSB0_AF0EM8_AF1EM1_EPS1_FL0_GRVW8_GSU7_IU1_LBSPP128_LPB8_LRVW4_NLCA1_PGR1_PLR9_SU0_SUM0_SUS256_SRVW0_TT4_32_TLDS1_WSGRA1_WSGRB1_WG64_4_1_WGM15
    SolutionIndex: 227
    SolutionNameMin: Cijk_Ailk_Bljk_BBH_MT128x128x32_MI32x32x4x1_SE_1LDSB0_AF0EM8_AF1EM1_EPS1_FL0_GRVW4_GSU7_IU1_LBSPP128_LPB4_LRVW4_NLCA1_PGR1_PLR9_SU0_SUM0_SUS256_SRVW0_TT2_64_TLDS1_WSGRA1_WSGRB1_WG64_4_1_WGM1
    SolutionIndex: 228
    SolutionNameMin: Cijk_Ailk_Bljk_BBH_MT128x256x32_MI32x32x4x1_SE_1LDSB0_AF0EM8_AF1EM1_EPS1_FL0_GRVW4_GSU7_IU1_LBSPP128_LPB4_LRVW4_NLCA1_PGR1_PLR9_SU0_SUM0_SUS256_SRVW4_TT2_128_TLDS1_WSGRA1_WSGRB1_WG64_4_1_WGM15
    SolutionIndex: 229
    SolutionNameMin: Cijk_Ailk_Bljk_BBH_MT128x96x64_MI32x32x4x1_SE_1LDSB0_AF0EM8_AF1EM1_EPS1_FL0_GRVW8_GSU5_IU1_LBSPP128_LPB8_LRVW4_NLCA1_PGR1_PLR17_SU0_SUM0_SUS256_SRVW4_TT1_96_TLDS1_WSGRA1_WSGRB1_WG128_2_1_WGM2
    SolutionIndex: 230
    SolutionNameMin: Cijk_Ailk_Bljk_BBH_MT128x96x64_MI32x32x4x1_SE_1LDSB0_AF0EM8_AF1EM1_EPS1_FL0_GRVW8_GSU5_IU1_LBSPP128_LPB8_LRVW4_NLCA1_PGR1_PLR17_SU32_SUM0_SUS128_SRVW4_TT1_96_TLDS1_WSGRA1_WSGRB1_WG128_2_1_WGM1
    SolutionIndex: 231
    SolutionNameMin: Cijk_Ailk_Bljk_BBH_MT128x96x32_MI32x32x4x1_SE_1LDSB0_AF0EM8_AF1EM1_EPS1_FL0_GRVW4_GSU5_IU1_LBSPP128_LPB4_LRVW4_NLCA1_PGR1_PLR9_SU32_SUM0_SUS256_SRVW4_TT1_96_TLDS1_WSGRA1_WSGRB1_WG128_2_1_WGM1
    SolutionIndex: 232
    SolutionNameMin: Cijk_Ailk_Bljk_BBH_MT128x96x32_MI32x32x4x1_SE_1LDSB0_AF0EM8_AF1EM1_EPS1_FL0_GRVW4_GSU5_IU1_LBSPP128_LPB4_LRVW4_NLCA1_PGR1_PLR9_SU32_SUM0_SUS128_SRVW4_TT1_96_TLDS1_WSGRA1_WSGRB1_WG128_2_1_WGM2
    SolutionIndex: 233
    SolutionNameMin: Cijk_Ailk_Bljk_BBH_MT128x96x64_MI32x32x4x1_SE_1LDSB0_AF0EM8_AF1EM1_EPS1_FL0_GRVW8_GSU5_IU1_LBSPP128_LPB8_LRVW4_NLCA1_PGR1_PLR17_SU32_SUM0_SUS128_SRVW4_TT1_96_TLDS1_WSGRA1_WSGRB1_WG128_2_1_WGM15
    SolutionIndex: 234
    SolutionNameMin: Cijk_Ailk_Bljk_BBH_MT128x96x64_MI32x32x4x1_SE_1LDSB0_AF0EM8_AF1EM1_EPS1_FL0_GRVW8_GSU5_IU1_LBSPP128_LPB8_LRVW4_NLCA1_PGR1_PLR17_SU32_SUM0_SUS256_SRVW4_TT1_96_TLDS1_WSGRA1_WSGRB1_WG128_2_1_WGM15
    SolutionIndex: 235
    SolutionNameMin: Cijk_Ailk_Bljk_BBH_MT128x64x64_MI32x32x4x1_SE_1LDSB0_AF0EM8_AF1EM1_EPS0_FL0_GRVW4_GSU3_IU1_LBSPP128_LPB4_LRVW4_NLCA1_PGR2_PLR17_SU32_SUM0_SUS256_SRVW4_TT2_32_TLDS1_WSGRA1_WSGRB1_WG64_4_1_WGM2
    SolutionIndex: 236
    SolutionNameMin: Cijk_Ailk_Bljk_BBH_MT256x64x32_MI32x32x4x1_SE_1LDSB0_AF0EM8_AF1EM1_EPS0_FL0_GRVW2_GSU3_IU1_LBSPP128_LPB4_LRVW4_NLCA2_PGR2_PLR9_SU0_SUM0_SUS256_SRVW0_TT4_32_TLDS1_WSGRA1_WSGRB1_WG64_4_1_WGM15
    SolutionIndex: 237
    SolutionNameMin: Cijk_Ailk_Bljk_BBH_MT128x160x32_MI32x32x4x1_SE_1LDSB0_AF0EM8_AF1EM1_EPS1_FL0_GRVW4_GSU1_IU1_LBSPP128_LPB4_LRVW4_NLCA1_PGR1_PLR9_SU0_SUM0_SUS256_SRVW4_TT1_160_TLDS1_WSGRA1_WSGRB1_WG128_2_1_WGM2
    SolutionIndex: 238
    SolutionNameMin: Cijk_Ailk_Bljk_BBH_MT64x128x32_MI32x32x4x1_SE_1LDSB0_AF0EM8_AF1EM1_EPS1_FL0_GRVW4_GSU1_IU1_LBSPP128_LPB4_LRVW4_NLCA1_PGR1_PLR9_SU0_SUM0_SUS256_SRVW4_TT1_64_TLDS1_WSGRA1_WSGRB1_WG64_4_1_WGM2
    SolutionIndex: 239
    SolutionNameMin: Cijk_Ailk_Bljk_BBH_MT32x32x64_MI16x16x8x1_SE_1LDSB0_AF0EM8_AF1EM1_EPS1_FL0_GRVW4_GSU3_IU1_LBSPP128_LPB4_LRVW4_NLCA1_PGR1_PLR9_SU0_SUM0_SUS256_SRVW0_TT1_16_TLDS1_WSGRA1_WSGRB1_WG32_8_1_WGM1
    SolutionIndex: 240
    SolutionNameMin: Cijk_Ailk_Bljk_BBH_MT128x192x32_MI32x32x4x1_SE_1LDSB0_AF0EM8_AF1EM1_EPS1_FL0_GRVW4_GSU5_IU1_LBSPP128_LPB4_LRVW4_NLCA1_PGR1_PLR9_SU32_SUM0_SUS128_SRVW4_TT2_96_TLDS1_WSGRA1_WSGRB1_WG64_4_1_WGM15
    SolutionIndex: 241
    SolutionNameMin: Cijk_Ailk_Bljk_BBH_MT128x128x32_MI32x32x4x1_SE_1LDSB0_AF0EM8_AF1EM1_EPS0_FL0_GRVW4_GSU3_IU1_LBSPP128_LPB4_LRVW4_NLCA1_PGR2_PLR9_SU32_SUM0_SUS256_SRVW4_TT2_64_TLDS1_WSGRA1_WSGRB1_WG64_4_1_WGM15
    SolutionIndex: 242
    SolutionNameMin: Cijk_Ailk_Bljk_BBH_MT128x128x32_MI32x32x4x1_SE_1LDSB0_AF0EM8_AF1EM1_EPS0_FL0_GRVW4_GSU3_IU1_LBSPP128_LPB4_LRVW4_NLCA1_PGR2_PLR9_SU0_SUM0_SUS256_SRVW4_TT2_64_TLDS1_WSGRA1_WSGRB1_WG64_4_1_WGM15
    SolutionIndex: 243
    SolutionNameMin: Cijk_Ailk_Bljk_BBH_MT128x144x32_MI16x16x8x1_SE_1LDSB1_AF0EM8_AF1EM1_EPS1_FL0_GRVW2_GSU3_IU1_LBSPP128_LPB4_LRVW4_NLCA1_PGR1_PLR5_SU0_SUM0_SUS256_SRVW4_TT2_144_TLDS1_WSGRA1_WSGRB1_WG64_4_1_WGM2
    SolutionIndex: 244
    SolutionNameMin: Cijk_Ailk_Bljk_BBH_MT128x144x32_MI16x16x8x1_SE_1LDSB0_AF0EM8_AF1EM1_EPS1_FL0_GRVW2_GSU3_IU1_LBSPP128_LPB4_LRVW4_NLCA1_PGR1_PLR5_SU0_SUM0_SUS256_SRVW4_TT2_144_TLDS1_WSGRA1_WSGRB1_WG64_4_1_WGM15
    SolutionIndex: 245
    SolutionNameMin: Cijk_Ailk_Bljk_BBH_MT128x256x32_MI32x32x4x1_SE_1LDSB0_AF0EM8_AF1EM1_EPS1_FL0_GRVW4_GSU5_IU1_LBSPP128_LPB4_LRVW4_NLCA1_PGR1_PLR9_SU32_SUM0_SUS256_SRVW4_TT2_128_TLDS1_WSGRA1_WSGRB1_WG64_4_1_WGM2
    SolutionIndex: 246
    SolutionNameMin: Cijk_Ailk_Bljk_BBH_MT128x64x64_MI32x32x4x1_SE_1LDSB0_AF0EM8_AF1EM1_EPS1_FL0_GRVW4_GSU3_IU1_LBSPP128_LPB4_LRVW4_NLCA1_PGR1_PLR17_SU32_SUM0_SUS128_SRVW4_TT2_32_TLDS1_WSGRA1_WSGRB1_WG64_4_1_WGM1
    SolutionIndex: 247
    SolutionNameMin: Cijk_Ailk_Bljk_BBH_MT64x32x64_MI16x16x8x1_SE_1LDSB0_AF0EM8_AF1EM1_EPS0_FL0_GRVW2_GSU3_IU1_LBSPP128_LPB4_LRVW4_NLCA1_PGR2_PLR9_SU0_SUM0_SUS256_SRVW4_TT2_16_TLDS1_WSGRA1_WSGRB1_WG32_8_1_WGM1
    SolutionIndex: 248
    SolutionNameMin: Cijk_Ailk_Bljk_BBH_MT64x64x64_MI32x32x4x1_SE_1LDSB0_AF0EM8_AF1EM1_EPS0_FL0_GRVW2_GSU3_IU1_LBSPP128_LPB4_LRVW4_NLCA1_PGR2_PLR17_SU32_SUM0_SUS256_SRVW4_TT1_32_TLDS1_WSGRA1_WSGRB1_WG64_4_1_WGM15
    SolutionIndex: 249
    SolutionNameMin: Cijk_Ailk_Bljk_BBH_MT64x64x64_MI32x32x4x1_SE_1LDSB0_AF0EM8_AF1EM1_EPS0_FL0_GRVW2_GSU3_IU1_LBSPP128_LPB4_LRVW4_NLCA1_PGR2_PLR17_SU32_SUM0_SUS256_SRVW4_TT1_32_TLDS1_WSGRA1_WSGRB1_WG64_4_1_WGM1
    SolutionIndex: 250
    SolutionNameMin: Cijk_Ailk_Bljk_BBH_MT128x64x32_MI32x32x4x1_SE_1LDSB0_AF0EM8_AF1EM1_EPS0_FL0_GRVW4_GSU5_IU1_LBSPP128_LPB4_LRVW4_NLCA1_PGR2_PLR9_SU32_SUM0_SUS128_SRVW4_TT2_32_TLDS1_WSGRA1_WSGRB1_WG64_4_1_WGM15
    SolutionIndex: 251
    SolutionNameMin: Cijk_Ailk_Bljk_BBH_MT128x64x64_MI32x32x4x1_SE_1LDSB0_AF0EM8_AF1EM1_EPS1_FL0_GRVW8_GSU5_IU1_LBSPP128_LPB8_LRVW4_NLCA1_PGR1_PLR17_SU0_SUM0_SUS256_SRVW4_TT2_32_TLDS1_WSGRA1_WSGRB1_WG64_4_1_WGM2
    SolutionIndex: 252
    SolutionNameMin: Cijk_Ailk_Bljk_BBH_MT128x64x64_MI32x32x4x1_SE_1LDSB0_AF0EM8_AF1EM1_EPS0_FL0_GRVW8_GSU5_IU1_LBSPP128_LPB8_LRVW4_NLCA1_PGR2_PLR17_SU32_SUM0_SUS128_SRVW4_TT2_32_TLDS1_WSGRA1_WSGRB1_WG64_4_1_WGM1
    SolutionIndex: 253
    SolutionNameMin: Cijk_Ailk_Bljk_BBH_MT128x64x64_MI32x32x4x1_SE_1LDSB0_AF0EM8_AF1EM1_EPS1_FL0_GRVW4_GSU5_IU1_LBSPP128_LPB4_LRVW4_NLCA1_PGR1_PLR17_SU32_SUM0_SUS128_SRVW4_TT2_32_TLDS1_WSGRA1_WSGRB1_WG64_4_1_WGM15
    SolutionIndex: 254
    SolutionNameMin: Cijk_Ailk_Bljk_BBH_MT128x64x64_MI32x32x4x1_SE_1LDSB0_AF0EM8_AF1EM1_EPS1_FL0_GRVW8_GSU5_IU1_LBSPP128_LPB8_LRVW4_NLCA1_PGR1_PLR17_SU0_SUM0_SUS256_SRVW4_TT2_32_TLDS1_WSGRA1_WSGRB1_WG64_4_1_WGM1
    SolutionIndex: 255
    SolutionNameMin: Cijk_Ailk_Bljk_BBH_MT128x64x64_MI32x32x4x1_SE_1LDSB0_AF0EM8_AF1EM1_EPS1_FL0_GRVW8_GSU5_IU1_LBSPP128_LPB8_LRVW4_NLCA1_PGR1_PLR17_SU32_SUM0_SUS128_SRVW4_TT2_32_TLDS1_WSGRA1_WSGRB1_WG64_4_1_WGM15
    SolutionIndex: 256
    SolutionNameMin: Cijk_Ailk_Bljk_BBH_MT64x64x64_MI32x32x4x1_SE_1LDSB0_AF0EM8_AF1EM1_EPS1_FL0_GRVW8_GSU3_IU1_LBSPP128_LPB8_LRVW4_NLCA1_PGR1_PLR17_SU0_SUM0_SUS256_SRVW0_TT1_32_TLDS1_WSGRA1_WSGRB1_WG64_4_1_WGM1
    SolutionIndex: 257
    SolutionNameMin: Cijk_Ailk_Bljk_BBH_MT128x96x64_MI32x32x4x1_SE_1LDSB0_AF0EM8_AF1EM1_EPS1_FL0_GRVW2_GSU5_IU1_LBSPP128_LPB4_LRVW4_NLCA1_PGR1_PLR17_SU32_SUM0_SUS128_SRVW4_TT1_96_TLDS1_WSGRA1_WSGRB1_WG128_2_1_WGM1
    SolutionIndex: 258
    SolutionNameMin: Cijk_Ailk_Bljk_BBH_MT64x32x32_MI16x16x8x1_SE_1LDSB0_AF0EM1_AF1EM1_EPS1_FL0_GRVW2_GSU1_IU1_LBSPP128_LPB2_LRVW2_NLCA1_PGR1_PLR1_SU32_SUM0_SUS256_SRVW0_TT2_16_TLDS1_WSGRA0_WSGRB0_WG32_8_1_WGM1
- - - [64, 35, 1, 35]
    - [0, 0.004]
  - - [64, 35, 1, 32]
    - [1, 0.005]
  - - [64, 15, 1, 17]
    - [3, 0.001]
  - - [64, 30, 1, 30]
    - [5, 0.003]
  - - [64, 32, 1, 32]
    - [6, 0.005]
  - - [64, 31, 1, 31]
    - [7, 0.004]
  - - [64, 24, 1, 24]
    - [8, 0.002]
  - - [64, 15, 1, 15]
    - [2, 0.001]
  - - [64, 17, 1, 17]
    - [4, 0.001]
  - - [64, 34, 1, 34]
    - [9, 0.005]
  - - [64, 14, 1, 15]
    - [6, 0.001]
  - - [64, 17, 1, 21]
    - [7, 0.001]
  - - [64, 14, 1, 14]
    - [9, 0.001]
  - - [64, 24, 1, 34]
    - [0, 0.004]
  - - [64, 21, 1, 21]
    - [10, 0.002]
  - - [64, 31, 1, 30]
    - [5, 0.004]
  - - [64, 128, 512, 128]
    - [11, 15.982]
  - - [64, 512, 1, 512]
    - [9, 0.941]
  - - [64, 512, 64, 512]
    - [12, 30.287]
  - - [128, 128, 512, 64]
    - [13, 14.234]
  - - [512, 512, 1, 64]
    - [10, 1.314]
  - - [512, 512, 64, 64]
    - [14, 20.803]
  - - [1024, 4, 1, 2]
    - [15, 0.0]
  - - [1024, 4, 1, 1024]
    - [5, 0.208]
  - - [1024, 32, 1, 2]
    - [9, 0.005]
  - - [1024, 32, 1, 1024]
    - [16, 1.707]
  - - [1024, 2048, 1, 2]
    - [17, 0.208]
  - - [1024, 2048, 1, 1024]
    - [18, 49.557]
  - - [1024, 2048, 1, 4096]
    - [19, 73.829]
  - - [1024, 2048, 1, 30528]
    - [20, 87.196]
  - - [1024, 4096, 1, 1024]
    - [21, 64.365]
  - - [1024, 4096, 1, 4096]
    - [22, 75.738]
  - - [1024, 4096, 1, 30528]
    - [23, 90.08]
  - - [4096, 2048, 1, 1024]
    - [24, 64.101]
  - - [4096, 4096, 1, 1024]
    - [25, 76.13]
  - - [32, 33, 1600, 33]
    - [26, 2.229]
  - - [32, 200, 1, 1]
    - [4, 0.0]
  - - [64, 3, 512, 3]
    - [27, 0.021]
  - - [64, 5, 512, 5]
    - [28, 0.058]
  - - [64, 5, 960, 5]
    - [29, 0.074]
  - - [64, 9, 512, 9]
    - [10, 0.176]
  - - [64, 512, 1, 1]
    - [30, 0.002]
  - - [67, 512, 1, 2048]
    - [31, 2.6]
  - - [74, 512, 1, 2048]
    - [31, 3.622]
  - - [74, 960, 1, 2048]
    - [32, 5.733]
  - - [100, 512, 1, 2048]
    - [33, 3.97]
  - - [128, 27, 32768, 27]
    - [34, 6.381]
  - - [256, 1024, 1, 1]
    - [28, 0.017]
  - - [256, 8976, 1, 1536]
    - [35, 59.974]
  - - [256, 8976, 1, 2048]
    - [36, 65.751]
  - - [256, 8976, 1, 2304]
    - [36, 64.064]
  - - [256, 8976, 1, 2560]
    - [37, 54.254]
  - - [256, 8976, 1, 2816]
    - [35, 60.18]
  - - [256, 8976, 1, 3072]
    - [38, 65.88]
  - - [256, 8976, 1, 4352]
    - [39, 74.556]
  - - [256, 8976, 1, 4864]
    - [40, 72.929]
  - - [256, 8976, 1, 5376]
    - [40, 76.882]
  - - [256, 8976, 1, 5632]
    - [41, 71.394]
  - - [256, 8976, 1, 5888]
    - [42, 76.076]
  - - [256, 8976, 1, 6144]
    - [38, 79.275]
  - - [256, 8976, 1, 6656]
    - [43, 75.736]
  - - [256, 8976, 1, 7168]
    - [44, 79.294]
  - - [256, 8976, 1, 7424]
    - [43, 76.187]
  - - [256, 8976, 1, 8192]
    - [45, 81.004]
  - - [256, 8976, 1, 8448]
    - [46, 77.821]
  - - [256, 8976, 1, 8960]
    - [45, 81.147]
  - - [256, 8976, 1, 9472]
    - [35, 82.888]
  - - [256, 8976, 1, 9728]
    - [47, 81.969]
  - - [256, 8976, 1, 9984]
    - [48, 83.953]
  - - [256, 8976, 1, 10240]
    - [38, 82.179]
  - - [256, 8976, 1, 10496]
    - [40, 82.626]
  - - [256, 8976, 1, 11008]
    - [49, 83.432]
  - - [256, 8976, 1, 11520]
    - [40, 80.497]
  - - [256, 8976, 1, 12288]
    - [36, 83.171]
  - - [256, 8976, 1, 14336]
    - [50, 85.675]
  - - [256, 8976, 1, 14848]
    - [35, 84.902]
  - - [256, 8976, 1, 15104]
    - [48, 85.622]
  - - [256, 8976, 1, 15872]
    - [44, 85.566]
  - - [256, 8976, 1, 17152]
    - [45, 83.864]
  - - [256, 8976, 1, 19712]
    - [47, 85.507]
  - - [256, 8976, 1, 19968]
    - [40, 86.824]
  - - [256, 8976, 1, 20480]
    - [35, 86.392]
  - - [256, 8976, 1, 20992]
    - [39, 87.125]
  - - [256, 8976, 1, 22016]
    - [48, 87.472]
  - - [256, 8976, 1, 26112]
    - [51, 87.478]
  - - [256, 8976, 1, 33536]
    - [51, 88.098]
  - - [256, 8976, 1, 44505]
    - [52, 89.508]
  - - [256, 32768, 1, 128]
    - [53, 25.309]
  - - [257, 1024, 1, 4096]
    - [54, 23.94]
  - - [480, 32768, 1, 1024]
    - [55, 72.523]
  - - [512, 200, 1, 1]
    - [0, 0.007]
  - - [512, 200, 1, 32]
    - [7, 0.253]
  - - [512, 215, 1, 2048]
    - [56, 8.86]
  - - [512, 256, 1, 2048]
    - [57, 10.213]
  - - [512, 1600, 1, 32]
    - [58, 1.92]
  - - [512, 1600, 1, 512]
    - [59, 19.318]
  - - [512, 32768, 1, 256]
    - [22, 54.397]
  - - [560, 200, 1, 1024]
    - [16, 5.796]
  - - [560, 1600, 1, 1024]
    - [60, 33.98]
  - - [768, 215, 1, 2048]
    - [61, 13.955]
  - - [768, 256, 1, 2048]
    - [62, 14.718]
  - - [1024, 200, 1, 1]
    - [56, 0.013]
  - - [1024, 512, 1, 1]
    - [9, 0.032]
  - - [1024, 512, 1, 64]
    - [63, 1.995]
  - - [1024, 512, 1, 1024]
    - [64, 20.636]
  - - [1024, 960, 1, 64]
    - [65, 4.214]
  - - [1024, 960, 1, 1024]
    - [66, 38.608]
  - - [1024, 1600, 1, 1]
    - [67, 0.103]
  - - [1024, 1600, 1, 1024]
    - [67, 44.672]
  - - [1024, 1792, 1, 256]
    - [68, 22.683]
  - - [1024, 2048, 1, 256]
    - [69, 21.4]
  - - [1024, 2560, 1, 256]
    - [70, 26.538]
  - - [1024, 3072, 1, 256]
    - [71, 28.591]
  - - [1024, 3328, 1, 256]
    - [70, 29.838]
  - - [1024, 3840, 1, 256]
    - [72, 33.614]
  - - [1024, 4096, 1, 256]
    - [70, 33.614]
  - - [1024, 4608, 1, 256]
    - [70, 35.2]
  - - [1024, 4864, 1, 256]
    - [73, 35.573]
  - - [1024, 5120, 1, 256]
    - [21, 37.151]
  - - [1024, 5632, 1, 256]
    - [73, 34.712]
  - - [1024, 6144, 1, 256]
    - [74, 40.194]
  - - [1024, 6400, 1, 256]
    - [75, 41.145]
  - - [1024, 7168, 1, 256]
    - [21, 43.008]
  - - [1024, 7424, 1, 256]
    - [76, 39.755]
  - - [1024, 7680, 1, 256]
    - [22, 43.272]
  - - [1024, 7936, 1, 256]
    - [72, 39.972]
  - - [1024, 8192, 1, 256]
    - [77, 40.711]
  - - [1024, 8448, 1, 256]
    - [78, 45.647]
  - - [1024, 8704, 1, 256]
    - [70, 44.666]
  - - [1024, 8960, 1, 256]
    - [22, 45.22]
  - - [1024, 9728, 1, 256]
    - [21, 46.843]
  - - [1024, 9984, 1, 256]
    - [22, 46.565]
  - - [1024, 10240, 1, 256]
    - [79, 48.111]
  - - [1024, 10496, 1, 256]
    - [80, 45.423]
  - - [1024, 11008, 1, 256]
    - [81, 49.098]
  - - [1024, 11264, 1, 256]
    - [76, 47.928]
  - - [1024, 11520, 1, 256]
    - [82, 52.85]
  - - [1024, 12288, 1, 256]
    - [22, 49.444]
  - - [1024, 13312, 1, 256]
    - [22, 48.768]
  - - [1024, 13568, 1, 256]
    - [83, 51.347]
  - - [1024, 14336, 1, 256]
    - [82, 53.044]
  - - [1024, 14592, 1, 256]
    - [84, 54.139]
  - - [1024, 14848, 1, 256]
    - [80, 55.032]
  - - [1024, 15104, 1, 256]
    - [76, 51.444]
  - - [1024, 16128, 1, 256]
    - [82, 55.446]
  - - [1024, 17152, 1, 256]
    - [19, 54.827]
  - - [1024, 18944, 1, 256]
    - [85, 47.558]
  - - [1024, 19712, 1, 256]
    - [86, 49.093]
  - - [1024, 19968, 1, 256]
    - [82, 49.646]
  - - [1024, 20480, 1, 256]
    - [87, 50.85]
  - - [1024, 20992, 1, 256]
    - [88, 52.057]
  - - [1024, 21504, 1, 256]
    - [80, 53.722]
  - - [1024, 22016, 1, 256]
    - [89, 53.377]
  - - [1024, 23552, 1, 256]
    - [90, 47.52]
  - - [1024, 28672, 1, 256]
    - [81, 57.957]
  - - [1024, 32768, 1, 512]
    - [91, 73.239]
  - - [1024, 32768, 1, 1024]
    - [92, 81.961]
  - - [1024, 33536, 1, 256]
    - [80, 58.562]
  - - [1024, 40448, 1, 256]
    - [21, 59.387]
  - - [1600, 512, 1, 1024]
    - [93, 29.758]
  - - [2048, 512, 1, 1]
    - [94, 0.06]
  - - [2048, 512, 1, 2048]
    - [46, 45.584]
  - - [2048, 960, 1, 2048]
    - [95, 65.384]
  - - [2048, 1024, 1, 1]
    - [96, 0.098]
  - - [2048, 1024, 1, 256]
    - [97, 19.234]
  - - [3200, 1024, 1, 2048]
    - [98, 63.873]
  - - [4096, 1024, 1, 1]
    - [19, 0.175]
  - - [64, 14, 10880, 14]
    - [34, 1.92]
  - - [64, 14, 10880, 15]
    - [99, 2.225]
  - - [64, 15, 7680, 15]
    - [99, 1.961]
  - - [64, 15, 10880, 15]
    - [34, 2.18]
  - - [64, 15, 7680, 17]
    - [100, 2.158]
  - - [64, 17, 6144, 17]
    - [28, 2.359]
  - - [64, 17, 7680, 17]
    - [34, 2.375]
  - - [64, 17, 6144, 21]
    - [28, 2.719]
  - - [64, 21, 6144, 21]
    - [28, 3.573]
  - - [64, 24, 4736, 24]
    - [34, 4.237]
  - - [64, 24, 4736, 34]
    - [100, 5.067]
  - - [64, 30, 2048, 30]
    - [28, 4.027]
  - - [64, 31, 2048, 30]
    - [34, 4.507]
  - - [64, 31, 2048, 31]
    - [28, 4.031]
  - - [64, 32, 4608, 32]
    - [34, 7.511]
  - - [64, 34, 4736, 34]
    - [101, 5.84]
  - - [64, 35, 4608, 32]
    - [11, 6.452]
  - - [64, 35, 4608, 35]
    - [101, 5.227]
  - - [1024, 3840, 1, 1024]
    - [80, 65.021]
  - - [1024, 3840, 1, 4096]
    - [102, 79.082]
  - - [1024, 3968, 1, 1024]
    - [103, 59.213]
  - - [1024, 3968, 1, 4096]
    - [87, 77.175]
  - - [1024, 3968, 1, 42720]
    - [104, 91.884]
  - - [1024, 6528, 1, 1024]
    - [105, 65.182]
  - - [1024, 6528, 1, 4096]
    - [79, 83.514]
  - - [1024, 6528, 1, 42720]
    - [106, 92.873]
  - - [1024, 7104, 1, 1024]
    - [21, 71.538]
  - - [1024, 7104, 1, 4096]
    - [81, 84.972]
  - - [1024, 7104, 1, 42720]
    - [107, 95.078]
  - - [1024, 7200, 1, 1024]
    - [25, 69.402]
  - - [1024, 7200, 1, 4096]
    - [74, 87.182]
  - - [1024, 7200, 1, 42720]
    - [108, 96.386]
  - - [1024, 8064, 1, 1024]
    - [14, 64.492]
  - - [1024, 8064, 1, 4096]
    - [25, 84.196]
  - - [1024, 8160, 1, 1024]
    - [109, 63.401]
  - - [1024, 8160, 1, 4096]
    - [22, 85.022]
  - - [1024, 9216, 1, 1024]
    - [79, 71.126]
  - - [1024, 9216, 1, 4096]
    - [48, 85.533]
  - - [1024, 9520, 1, 1024]
    - [103, 68.079]
  - - [1024, 9520, 1, 4096]
    - [50, 88.189]
  - - [1024, 9520, 1, 42720]
    - [110, 95.82]
  - - [1024, 10064, 1, 1024]
    - [25, 75.862]
  - - [1024, 10064, 1, 4096]
    - [23, 90.408]
  - - [1024, 10080, 1, 1024]
    - [75, 70.742]
  - - [1024, 10080, 1, 4096]
    - [53, 89.747]
  - - [1024, 10080, 1, 42720]
    - [111, 96.635]
  - - [1024, 10200, 1, 1024]
    - [70, 68.261]
  - - [1024, 10200, 1, 4096]
    - [55, 86.088]
  - - [4096, 3840, 1, 1024]
    - [112, 80.121]
  - - [4096, 3968, 1, 1024]
    - [89, 74.754]
  - - [4096, 6528, 1, 1024]
    - [113, 79.545]
  - - [4096, 7104, 1, 1024]
    - [22, 82.053]
  - - [4096, 7200, 1, 1024]
    - [89, 81.37]
  - - [4096, 8064, 1, 1024]
    - [55, 83.946]
  - - [4096, 8160, 1, 1024]
    - [107, 81.19]
  - - [4096, 9216, 1, 1024]
    - [23, 82.719]
  - - [4096, 9520, 1, 1024]
    - [87, 81.071]
  - - [4096, 10064, 1, 1024]
    - [114, 83.16]
  - - [4096, 10080, 1, 1024]
    - [115, 84.204]
  - - [4096, 10200, 1, 1024]
    - [55, 84.396]
  - - [64, 27, 1920, 27]
    - [28, 3.345]
  - - [64, 33, 1920, 27]
    - [101, 3.631]
  - - [64, 33, 1920, 33]
    - [101, 3.593]
  - - [1024, 3240, 1, 1024]
    - [116, 52.963]
  - - [1024, 3240, 1, 4096]
    - [113, 69.821]
  - - [1024, 3960, 1, 1024]
    - [81, 62.135]
  - - [1024, 3960, 1, 4096]
    - [117, 74.118]
  - - [1024, 3960, 1, 42720]
    - [52, 91.761]
  - - [4096, 3240, 1, 1024]
    - [79, 74.287]
  - - [4096, 3960, 1, 1024]
    - [21, 75.974]
  - - [64, 192, 64, 1280]
    - [118, 28.163]
  - - [64, 320, 64, 1280]
    - [119, 36.668]
  - - [64, 384, 64, 1280]
    - [120, 41.909]
  - - [64, 448, 64, 1280]
    - [121, 43.113]
  - - [64, 192, 64, 2048]
    - [119, 33.739]
  - - [64, 320, 64, 2048]
    - [119, 43.928]
  - - [64, 384, 64, 2048]
    - [105, 44.918]
  - - [64, 448, 64, 2048]
    - [119, 49.253]
  - - [1225, 32, 64, 192]
    - [122, 14.967]
  - - [1225, 48, 64, 192]
    - [106, 16.549]
  - - [1225, 64, 64, 192]
    - [123, 23.771]
  - - [1225, 48, 64, 256]
    - [124, 18.723]
  - - [1225, 64, 64, 256]
    - [24, 27.752]
  - - [1225, 48, 64, 288]
    - [106, 20.102]
  - - [1225, 64, 64, 288]
    - [125, 28.935]
  - - [5329, 80, 64, 64]
    - [126, 13.204]
  - - [289, 128, 64, 768]
    - [102, 37.5]
  - - [289, 160, 64, 768]
    - [124, 33.803]
  - - [289, 192, 64, 768]
    - [106, 40.973]
  - - [64, 192, 32, 1280]
    - [127, 19.729]
  - - [64, 320, 32, 1280]
    - [121, 27.771]
  - - [64, 384, 32, 1280]
    - [128, 29.482]
  - - [64, 448, 32, 1280]
    - [118, 38.009]
  - - [64, 192, 32, 2048]
    - [119, 24.26]
  - - [64, 320, 32, 2048]
    - [129, 32.541]
  - - [64, 384, 32, 2048]
    - [129, 39.121]
  - - [64, 448, 32, 2048]
    - [130, 41.062]
  - - [1225, 32, 32, 192]
    - [122, 11.342]
  - - [1225, 48, 32, 192]
    - [123, 13.005]
  - - [1225, 64, 32, 192]
    - [131, 18.761]
  - - [1225, 48, 32, 256]
    - [24, 15.784]
  - - [1225, 64, 32, 256]
    - [106, 23.12]
  - - [1225, 48, 32, 288]
    - [106, 17.639]
  - - [1225, 64, 32, 288]
    - [132, 22.645]
  - - [5329, 80, 32, 64]
    - [133, 13.745]
  - - [289, 128, 32, 768]
    - [106, 24.47]
  - - [289, 160, 32, 768]
    - [134, 27.507]
  - - [289, 192, 32, 768]
    - [134, 30.938]
  - - [3136, 256, 64, 64]
    - [25, 24.285]
  - - [3136, 64, 64, 64]
    - [135, 18.35]
  - - [3136, 64, 64, 256]
    - [136, 44.841]
  - - [784, 512, 64, 128]
    - [137, 31.997]
  - - [784, 128, 64, 512]
    - [138, 53.19]
  - - [196, 1024, 64, 256]
    - [87, 44.348]
  - - [196, 256, 64, 1024]
    - [85, 44.923]
  - - [49, 2048, 64, 512]
    - [139, 31.135]
  - - [49, 512, 64, 2048]
    - [140, 31.174]
  - - [3136, 256, 32, 64]
    - [72, 21.894]
  - - [3136, 64, 32, 64]
    - [141, 13.159]
  - - [3136, 64, 32, 256]
    - [66, 37.214]
  - - [784, 512, 32, 128]
    - [142, 33.582]
  - - [784, 128, 32, 512]
    - [138, 41.745]
  - - [196, 1024, 32, 256]
    - [88, 35.943]
  - - [196, 256, 32, 1024]
    - [87, 35.052]
  - - [49, 2048, 32, 512]
    - [143, 27.36]
  - - [49, 512, 32, 2048]
    - [102, 24.121]
  - - [3136, 128, 64, 64]
    - [144, 21.51]
  - - [3136, 256, 64, 128]
    - [145, 41.119]
  - - [784, 512, 64, 256]
    - [146, 50.144]
  - - [3136, 128, 64, 256]
    - [147, 49.829]
  - - [3136, 256, 64, 256]
    - [148, 62.638]
  - - [196, 1024, 64, 512]
    - [22, 50.757]
  - - [784, 256, 64, 512]
    - [149, 59.769]
  - - [784, 512, 64, 512]
    - [91, 63.666]
  - - [196, 512, 64, 1024]
    - [102, 49.961]
  - - [196, 1024, 64, 1024]
    - [73, 58.204]
  - - [49, 2048, 64, 1024]
    - [150, 39.459]
  - - [49, 1024, 64, 2048]
    - [151, 37.514]
  - - [3136, 128, 32, 64]
    - [136, 18.361]
  - - [3136, 256, 32, 128]
    - [152, 42.763]
  - - [784, 512, 32, 256]
    - [153, 50.366]
  - - [3136, 128, 32, 256]
    - [136, 50.698]
  - - [3136, 256, 32, 256]
    - [76, 52.103]
  - - [196, 1024, 32, 512]
    - [87, 48.133]
  - - [784, 256, 32, 512]
    - [138, 51.167]
  - - [784, 512, 32, 512]
    - [147, 62.302]
  - - [196, 512, 32, 1024]
    - [85, 43.265]
  - - [196, 1024, 32, 1024]
    - [102, 50.036]
  - - [49, 2048, 32, 1024]
    - [154, 31.341]
  - - [49, 1024, 32, 2048]
    - [133, 30.081]
  - - [64, 128, 624, 128]
    - [13, 17.4]
  - - [1024, 10, 1, 1024]
    - [155, 0.547]
  - - [2048, 2048, 1, 2048]
    - [22, 71.339]
  - - [1024, 10, 1, 2]
    - [11, 0.002]
  - - [1024, 5, 1, 2]
    - [28, 0.001]
  - - [1024, 5, 1, 1024]
    - [15, 0.305]
  - - [64, 512, 16, 512]
    - [64, 11.89]
  - - [1024, 1024, 1, 1024]
    - [43, 30.889]
  - - [1024, 9600, 1, 4096]
    - [136, 88.16]
  - - [1024, 8192, 1, 1024]
    - [156, 65.073]
  - - [1024, 1280, 1, 4096]
    - [157, 67.547]
  - - [512, 512, 1, 512]
    - [158, 6.473]
  - - [1024, 1152, 1, 1024]
    - [46, 38.011]
  - - [1024, 5248, 1, 2]
    - [90, 0.423]
  - - [1024, 820, 1, 1024]
    - [109, 28.652]
  - - [4096, 1152, 1, 1024]
    - [151, 63.654]
  - - [1024, 308, 1, 30522]
    - [159, 70.759]
  - - [1024, 39, 1, 1024]
    - [15, 2.214]
  - - [1024, 616, 1, 1024]
    - [160, 21.235]
  - - [64, 512, 96, 512]
    - [138, 34.383]
  - - [1024, 39, 1, 2]
    - [9, 0.005]
  - - [128, 128, 1, 64]
    - [26, 0.085]
  - - [1024, 160, 1, 30522]
    - [161, 45.875]
  - - [1024, 2560, 1, 1024]
    - [25, 54.06]
  - - [4096, 9600, 1, 1024]
    - [55, 83.729]
  - - [1024, 8, 1, 2]
    - [29, 0.001]
  - - [1024, 800, 1, 1024]
    - [162, 32.083]
  - - [64, 128, 640, 128]
    - [163, 19.453]
  - - [4096, 1024, 1, 1024]
    - [78, 61.021]
  - - [1024, 8, 1, 1024]
    - [164, 0.4]
  - - [1024, 1024, 1, 2]
    - [165, 0.107]
  - - [4096, 5248, 1, 1024]
    - [74, 77.198]
  - - [4096, 4096, 1, 4096]
    - [115, 87.068]
  - - [1024, 77, 1, 30522]
    - [166, 39.318]
  - - [1024, 9, 1, 2]
    - [15, 0.001]
  - - [1024, 1024, 1, 4096]
    - [46, 57.2]
  - - [1024, 9, 1, 1024]
    - [167, 0.418]
  - - [1024, 780, 1, 1024]
    - [73, 25.246]
  - - [64, 4, 38400, 4]
    - [27, 0.207]
  - - [1024, 4096, 1, 2]
    - [69, 0.294]
  - - [4096, 2560, 1, 1024]
    - [136, 70.609]
  - - [64, 128, 144, 128]
    - [154, 7.538]
  - - [1024, 780, 1, 30522]
    - [104, 79.785]
  - - [8192, 7680, 1, 8192]
    - [168, 96.055]
  - - [1024, 3072, 1, 2]
    - [169, 0.317]
  - - [8192, 8192, 1, 8192]
    - [108, 94.659]
  - - [1024, 180, 1, 1024]
    - [170, 10.545]
  - - [1024, 180, 1, 30522]
    - [171, 52.108]
  - - [1024, 512, 1, 2]
    - [96, 0.084]
  - - [1024, 8192, 1, 4096]
    - [92, 84.144]
  - - [1024, 385, 1, 30522]
    - [172, 62.757]
  - - [4096, 512, 1, 1024]
    - [173, 49.062]
  - - [1024, 160, 1, 1024]
    - [174, 9.053]
  - - [1024, 5120, 1, 4096]
    - [22, 79.029]
  - - [2048, 1920, 1, 2048]
    - [116, 73.642]
  - - [1024, 462, 1, 1024]
    - [175, 20.561]
  - - [1024, 462, 1, 30522]
    - [176, 66.306]
  - - [1024, 77, 1, 1024]
    - [177, 3.647]
  - - [960, 1024, 1, 1024]
    - [178, 38.728]
  - - [1024, 40, 1, 2]
    - [170, 0.006]
  - - [64, 5, 1, 5]
    - [96, 0.0]
  - - [1024, 40, 1, 1024]
    - [15, 2.686]
  - - [4096, 5120, 1, 1024]
    - [55, 77.024]
  - - [1024, 200, 1, 30522]
    - [166, 46.946]
  - - [1024, 41, 1, 2]
    - [9, 0.007]
  - - [1024, 200, 1, 1024]
    - [57, 9.501]
  - - [4096, 8192, 1, 1024]
    - [23, 82.297]
  - - [1024, 41, 1, 1024]
    - [177, 2.013]
  - - [1024, 4992, 1, 4096]
    - [72, 75.512]
  - - [4096, 1280, 1, 1024]
    - [37, 50.919]
  - - [1024, 2560, 1, 4096]
    - [87, 69.632]
  - - [1024, 4992, 1, 2]
    - [25, 0.438]
  - - [32, 33, 1, 33]
    - [10, 0.003]
  - - [7680, 8192, 1, 8192]
    - [91, 96.02]
  - - [4096, 3072, 1, 1024]
    - [75, 72.685]
  - - [1024, 9600, 1, 1024]
    - [139, 67.379]
  - - [1024, 385, 1, 1024]
    - [121, 15.354]
  - - [64, 4, 32768, 4]
    - [99, 0.195]
  - - [64, 128, 656, 128]
    - [138, 19.137]
  - - [64, 512, 128, 512]
    - [79, 37.712]
  - - [1024, 4992, 1, 1024]
    - [103, 59.886]
  - - [1024, 1152, 1, 2]
    - [149, 0.138]
  - - [1024, 5248, 1, 4096]
    - [25, 78.96]
  - - [1024, 9600, 1, 33712]
    - [179, 96.101]
  - - [1024, 3072, 1, 4096]
    - [180, 71.157]
  - - [4096, 3840, 1, 4096]
    - [168, 91.846]
  - - [1024, 6, 1, 1024]
    - [56, 0.289]
  - - [1024, 5120, 1, 1024]
    - [22, 49.547]
  - - [1024, 8192, 1, 33712]
    - [172, 91.906]
  - - [1024, 308, 1, 1024]
    - [181, 13.102]
  - - [3840, 4096, 1, 4096]
    - [168, 91.558]
  - - [1024, 2560, 1, 2]
    - [85, 0.262]
  - - [1024, 6, 1, 2]
    - [9, 0.001]
  - - [64, 128, 160, 128]
    - [182, 9.285]
  - - [1024, 512, 1, 4096]
    - [64, 40.842]
  - - [64, 128, 128, 128]
    - [13, 6.329]
  - - [1024, 5248, 1, 1024]
    - [183, 54.118]
  - - [1024, 820, 1, 30522]
    - [51, 78.594]
  - - [1024, 1280, 1, 2]
    - [136, 0.153]
  - - [1024, 1280, 1, 1024]
    - [25, 43.261]
  - - [1920, 2048, 1, 2048]
    - [184, 76.948]
  - - [1024, 3072, 1, 1024]
    - [183, 54.173]
  - - [1024, 800, 1, 30522]
    - [104, 79.98]
  - - [64, 128, 1, 128]
    - [5, 0.057]
  - - [64, 512, 80, 512]
    - [128, 33.774]
  - - [480, 512, 1, 512]
    - [61, 6.856]
  - - [512, 480, 1, 512]
    - [9, 6.445]
  - - [4096, 4992, 1, 1024]
    - [185, 75.678]
  - - [479, 32768, 1, 1024]
    - [139, 63.057]
  - - [1024, 1152, 1, 4096]
    - [41, 66.565]
  - - [1024, 5120, 1, 2]
    - [72, 0.389]
  - - [1024, 1024, 64, 64]
    - [19, 26.3]
  - - [64, 1024, 32, 1024]
    - [12, 38.943]
  - - [1024, 16384, 1, 3072]
    - [14, 85.462]
  - - [1024, 2048, 1, 30592]
    - [18, 87.403]
  - - [640, 2048, 1, 2560]
    - [21, 57.068]
  - - [1024, 1024, 64, 96]
    - [145, 37.281]
  - - [2048, 2, 1, 2048]
    - [186, 0.371]
  - - [2048, 2, 1, 2]
    - [15, 0.001]
  - - [1536, 4096, 1, 4608]
    - [145, 83.147]
  - - [512, 512, 256, 64]
    - [19, 27.971]
  - - [2048, 1024, 1, 8192]
    - [173, 77.429]
  - - [4096, 16384, 1, 1024]
    - [82, 85.652]
  - - [1024, 8192, 1, 50304]
    - [172, 92.922]
  - - [1536, 8192, 1, 50304]
    - [136, 94.783]
  - - [6144, 8192, 1, 1536]
    - [55, 89.414]
  - - [1024, 4096, 1, 30592]
    - [103, 90.122]
  - - [1536, 4096, 1, 6144]
    - [187, 84.627]
  - - [1024, 16384, 1, 4096]
    - [103, 87.429]
  - - [1024, 16384, 1, 50304]
    - [188, 94.343]
  - - [1024, 4096, 1, 3072]
    - [22, 71.826]
  - - [1536, 8192, 1, 1536]
    - [136, 82.405]
  - - [1024, 2048, 1, 3072]
    - [98, 59.475]
  - - [2560, 2048, 1, 7680]
    - [180, 83.821]
  - - [96, 1024, 64, 1024]
    - [189, 58.517]
  - - [2048, 1024, 1, 2048]
    - [173, 59.652]
  - - [2048, 1024, 1, 30592]
    - [190, 86.157]
  - - [64, 1024, 256, 1024]
    - [191, 62.579]
  - - [8192, 1024, 1, 2048]
    - [116, 77.09]
  - - [2560, 2048, 1, 2560]
    - [89, 75.995]
  - - [1536, 8192, 1, 4608]
    - [79, 89.095]
  - - [64, 512, 256, 512]
    - [192, 40.056]
  - - [1024, 2048, 1, 50304]
    - [18, 87.962]
  - - [1024, 1024, 32, 64]
    - [73, 20.51]
  - - [1536, 8192, 1, 6144]
    - [66, 91.066]
  - - [1024, 1024, 256, 64]
    - [187, 33.377]
  - - [512, 512, 40, 64]
    - [25, 17.127]
  - - [1536, 4096, 1, 50304]
    - [193, 92.965]
  - - [1024, 1024, 128, 96]
    - [194, 44.513]
  - - [1024, 8192, 1, 3072]
    - [107, 84.081]
  - - [64, 1024, 64, 1024]
    - [100, 40.807]
  - - [1024, 1024, 128, 64]
    - [76, 30.835]
  - - [64, 1024, 128, 1024]
    - [195, 54.021]
  - - [1024, 4096, 1, 50304]
    - [196, 91.178]
  - - [96, 1024, 128, 1024]
    - [197, 69.809]
  - - [6144, 4096, 1, 1536]
    - [19, 83.038]
  - - [1024, 16, 1, 2]
    - [198, 0.003]
  - - [1024, 16, 1, 1024]
    - [199, 0.885]
  - - [2560, 4, 1, 2]
    - [96, 0.001]
  - - [1024, 16384, 1, 1024]
    - [82, 77.374]
  - - [2560, 2048, 1, 1920]
    - [125, 68.572]
  - - [2048, 1024, 1, 6144]
    - [36, 72.174]
  - - [2560, 4, 1, 2560]
    - [155, 1.188]
  - - [512, 512, 128, 64]
    - [76, 20.999]
  - - [1024, 8192, 1, 30592]
    - [103, 91.3]
  - - [1536, 4096, 1, 1536]
    - [115, 72.632]
  - - [64, 512, 40, 512]
    - [119, 25.074]
  - - [1024, 1, 1, 2]
    - [56, 0.0]
  - - [1024, 1, 1, 1024]
    - [200, 0.049]
  - - [1024, 1, 1, 200]
    - [9, 0.013]
  - - [1024, 1, 1, 1600]
    - [201, 0.104]
  - - [2048, 1, 1, 512]
    - [5, 0.064]
  - - [128, 128, 1024, 64]
    - [106, 17.569]
  - - [64, 128, 1024, 128]
    - [202, 21.031]
  - - [1024, 64, 1, 2]
    - [96, 0.011]
  - - [1024, 8192, 1, 30528]
    - [172, 92.021]
  - - [1024, 64, 1, 1024]
    - [203, 3.891]
  - - [1024, 3456, 1, 1024]
    - [66, 58.907]
  - - [1024, 3456, 1, 512]
    - [116, 43.12]
  - - [1024, 4096, 1, 512]
    - [72, 49.432]
  - - [1024, 6912, 1, 1024]
    - [204, 69.104]
  - - [1024, 6912, 1, 512]
    - [111, 59.119]
  - - [1024, 864, 1, 1024]
    - [109, 32.99]
  - - [1024, 864, 1, 512]
    - [70, 20.205]
  - - [256, 3456, 1, 128]
    - [70, 6.668]
  - - [256, 4096, 1, 128]
    - [205, 7.257]
  - - [256, 55296, 1, 128]
    - [22, 32.765]
  - - [256, 6912, 1, 128]
    - [85, 12.568]
  - - [256, 864, 1, 128]
    - [29, 1.645]
  - - [480, 3456, 1, 1024]
    - [138, 44.189]
  - - [480, 4096, 1, 1024]
    - [183, 45.849]
  - - [480, 6912, 1, 1024]
    - [183, 60.391]
  - - [480, 864, 1, 1024]
    - [206, 20.655]
  - - [512, 3456, 1, 256]
    - [163, 20.455]
  - - [512, 4096, 1, 256]
    - [207, 18.239]
  - - [512, 55296, 1, 256]
    - [84, 54.322]
  - - [512, 6912, 1, 256]
    - [111, 26.985]
  - - [512, 864, 1, 256]
    - [208, 5.703]
  - - [1024, 640, 1, 30528]
    - [209, 81.264]
  - - [1024, 1280, 1, 30528]
    - [210, 89.508]
  - - [1024, 1600, 1, 30528]
    - [211, 88.668]
  - - [1024, 10240, 1, 1024]
    - [138, 70.784]
  - - [1024, 10240, 1, 4096]
    - [79, 86.278]
  - - [4096, 10240, 1, 1024]
    - [23, 82.902]
  - - [1024, 80, 1, 1024]
    - [177, 4.853]
  - - [1024, 80, 1, 2]
    - [7, 0.013]
  - - [128, 128, 1280, 64]
    - [75, 18.17]
  - - [64, 128, 1280, 128]
    - [202, 22.204]
  - - [1024, 1640, 1, 30528]
    - [212, 85.03]
  - - [1024, 10496, 1, 1024]
    - [153, 75.275]
  - - [1024, 10496, 1, 4096]
    - [115, 87.342]
  - - [4096, 10496, 1, 1024]
    - [91, 85.941]
  - - [1024, 82, 1, 1024]
    - [5, 4.89]
  - - [1024, 82, 1, 2]
    - [213, 0.009]
  - - [128, 128, 1312, 64]
    - [163, 19.989]
  - - [64, 128, 1312, 128]
    - [138, 23.23]
  - - [1024, 160, 1, 30528]
    - [214, 57.013]
  - - [1024, 240, 1, 30528]
    - [215, 56.302]
  - - [1024, 6144, 1, 4096]
    - [75, 83.774]
  - - [1024, 12, 1, 1024]
    - [216, 0.713]
  - - [4096, 6144, 1, 1024]
    - [22, 78.571]
  - - [1024, 6144, 1, 1024]
    - [84, 60.408]
  - - [1024, 12, 1, 2]
    - [9, 0.001]
  - - [512, 512, 192, 64]
    - [145, 27.186]
  - - [64, 512, 192, 512]
    - [217, 45.3]
  - - [256, 4096, 1, 1]
    - [68, 0.061]
  - - [256, 6912, 1, 1]
    - [70, 0.108]
  - - [1024, 10224, 1, 1024]
    - [85, 70.435]
  - - [1024, 10192, 1, 1024]
    - [218, 70.541]
  - - [1024, 10208, 1, 1024]
    - [81, 69.212]
  - - [1024, 10224, 1, 4096]
    - [75, 86.419]
  - - [1024, 10224, 1, 3072]
    - [116, 82.969]
  - - [4096, 10224, 1, 1024]
    - [187, 84.836]
  - - [1024, 10240, 1, 3072]
    - [115, 84.58]
  - - [1024, 10192, 1, 3072]
    - [19, 83.387]
  - - [4096, 10192, 1, 1024]
    - [115, 85.488]
  - - [1024, 10192, 1, 4096]
    - [75, 85.601]
  - - [1024, 10200, 1, 3072]
    - [70, 84.321]
  - - [1024, 10184, 1, 1024]
    - [115, 70.181]
  - - [4096, 10208, 1, 1024]
    - [187, 84.884]
  - - [1024, 10208, 1, 3072]
    - [115, 84.648]
  - - [1024, 10208, 1, 4096]
    - [79, 84.894]
  - - [1024, 10224, 1, 2048]
    - [169, 77.393]
  - - [1024, 10240, 1, 2048]
    - [79, 82.101]
  - - [1024, 10120, 1, 1024]
    - [116, 68.291]
  - - [1024, 10192, 1, 2048]
    - [79, 81.981]
  - - [64, 24, 6816, 24]
    - [28, 4.265]
  - - [1024, 10152, 1, 1024]
    - [153, 69.594]
  - - [1024, 10080, 1, 3072]
    - [107, 88.728]
  - - [64, 26, 6272, 26]
    - [34, 4.811]
  - - [100352, 512, 1, 256]
    - [80, 63.325]
  - - [12544, 2048, 1, 1024]
    - [219, 80.038]
  - - [12544, 64, 1, 147]
    - [140, 6.455]
  - - [200704, 512, 1, 256]
    - [91, 65.093]
  - - [25088, 1024, 1, 512]
    - [89, 64.717]
  - - [3136, 64, 1, 576]
    - [5, 5.758]
  - - [50176, 1024, 1, 512]
    - [184, 76.595]
  - - [6272, 2048, 1, 1024]
    - [89, 71.804]
  - - [784, 128, 1, 1152]
    - [15, 6.278]
  - - [3136, 128, 128, 256]
    - [14, 57.057]
  - - [3136, 128, 256, 256]
    - [136, 64.251]
  - - [3136, 256, 128, 64]
    - [194, 30.721]
  - - [3136, 256, 256, 64]
    - [152, 32.935]
  - - [3136, 64, 128, 256]
    - [21, 40.849]
  - - [3136, 64, 256, 256]
    - [86, 50.918]
  - - [3136, 64, 128, 64]
    - [135, 20.481]
  - - [3136, 64, 256, 64]
    - [135, 23.258]
  - - [784, 128, 128, 512]
    - [79, 57.721]
  - - [784, 128, 256, 512]
    - [138, 62.292]
  - - [784, 256, 128, 512]
    - [138, 63.702]
  - - [784, 256, 256, 512]
    - [184, 68.867]
  - - [784, 512, 128, 128]
    - [135, 41.035]
  - - [784, 512, 256, 128]
    - [76, 46.142]
  - - [128, 128, 2048, 64]
    - [66, 18.949]
  - - [64, 128, 2048, 128]
    - [13, 27.338]
  - - [1024, 2560, 1, 30528]
    - [210, 91.034]
  - - [1024, 128, 1, 1024]
    - [170, 7.633]
  - - [1024, 128, 1, 2]
    - [29, 0.019]
  - - [128, 128, 1536, 64]
    - [19, 19.824]
  - - [64, 128, 1536, 128]
    - [138, 24.278]
  - - [1024, 12288, 1, 4096]
    - [21, 86.953]
  - - [1024, 12288, 1, 1024]
    - [74, 72.681]
  - - [4096, 12288, 1, 1024]
    - [91, 86.918]
  - - [1024, 1920, 1, 30528]
    - [128, 92.238]
  - - [1024, 96, 1, 1024]
    - [15, 4.931]
  - - [1024, 96, 1, 2]
    - [96, 0.015]
  - - [128, 128, 192, 64]
    - [156, 9.617]
  - - [64, 128, 192, 128]
    - [163, 8.454]
  - - [768, 2048, 1, 2]
    - [85, 0.187]
  - - [3072, 2048, 1, 768]
    - [75, 62.858]
  - - [768, 2048, 1, 3072]
    - [136, 59.114]
  - - [768, 2048, 1, 768]
    - [67, 34.673]
  - - [384, 384, 144, 64]
    - [19, 22.657]
  - - [64, 384, 144, 384]
    - [182, 33.558]
  - - [768, 4608, 1, 2]
    - [14, 0.335]
  - - [3072, 4608, 1, 768]
    - [84, 70.379]
  - - [768, 4608, 1, 3072]
    - [116, 69.392]
  - - [768, 4608, 1, 768]
    - [70, 52.464]
  - - [512, 512, 48, 64]
    - [14, 19.763]
  - - [64, 512, 48, 512]
    - [138, 30.324]
  - - [128, 128, 256, 64]
    - [67, 9.32]
  - - [64, 128, 256, 128]
    - [121, 10.193]
  - - [384, 384, 192, 64]
    - [75, 22.223]
  - - [64, 384, 192, 384]
    - [202, 37.077]
  - - [1024, 4608, 1, 2]
    - [25, 0.395]
  - - [4096, 4608, 1, 1024]
    - [89, 77.482]
  - - [1024, 4608, 1, 4096]
    - [79, 81.775]
  - - [1024, 4608, 1, 1024]
    - [67, 61.485]
  - - [8192, 1024, 1, 1024]
    - [114, 65.293]
  - - [8192, 4096, 1, 1024]
    - [88, 82.27]
  - - [16384, 16384, 1, 16384]
    - [115, 96.478]
  - - [196, 256, 1, 2304]
    - [33, 5.169]
  - - [49, 512, 1, 4608]
    - [220, 4.929]
  - - [196, 1024, 128, 256]
    - [89, 43.065]
  - - [196, 1024, 256, 256]
    - [87, 48.775]
  - - [196, 256, 128, 1024]
    - [125, 50.656]
  - - [196, 256, 256, 1024]
    - [68, 54.265]
  - - [196, 512, 128, 1024]
    - [85, 57.612]
  - - [196, 512, 256, 1024]
    - [73, 59.323]
  - - [49, 2048, 128, 512]
    - [102, 36.815]
  - - [49, 2048, 256, 512]
    - [139, 37.721]
  - - [49, 512, 128, 2048]
    - [221, 38.174]
  - - [49, 512, 256, 2048]
    - [191, 45.128]
  - - [1024, 1024, 160, 96]
    - [80, 43.937]
  - - [96, 1024, 160, 1024]
    - [137, 69.844]
  - - [1920, 16384, 1, 25216]
    - [148, 96.547]
  - - [3840, 16384, 1, 1920]
    - [113, 91.613]
  - - [1920, 16384, 1, 3840]
    - [80, 92.96]
  - - [960, 16384, 1, 1920]
    - [116, 85.826]
  - - [1920, 16384, 1, 2880]
    - [184, 92.283]
  - - [1024, 1024, 40, 96]
    - [152, 33.224]
  - - [96, 1024, 40, 1024]
    - [169, 54.758]
  - - [1920, 4096, 1, 25216]
    - [152, 95.448]
  - - [3840, 4096, 1, 1920]
    - [184, 85.774]
  - - [1920, 4096, 1, 3840]
    - [113, 88.149]
  - - [960, 4096, 1, 1920]
    - [222, 71.983]
  - - [1920, 4096, 1, 2880]
    - [148, 87.689]
  - - [1024, 1024, 80, 96]
    - [152, 39.41]
  - - [96, 1024, 80, 1024]
    - [197, 62.72]
  - - [1920, 8192, 1, 25216]
    - [184, 96.151]
  - - [3840, 8192, 1, 1920]
    - [194, 88.862]
  - - [1920, 8192, 1, 3840]
    - [113, 89.998]
  - - [960, 8192, 1, 1920]
    - [79, 82.264]
  - - [1920, 8192, 1, 2880]
    - [148, 88.811]
  - - [1024, 1024, 96, 96]
    - [115, 41.811]
  - - [96, 1024, 96, 1024]
    - [137, 63.056]
  - - [2304, 16384, 1, 12672]
    - [107, 94.734]
  - - [2304, 16384, 1, 2304]
    - [108, 89.615]
  - - [576, 16384, 1, 2304]
    - [79, 83.89]
  - - [2304, 16384, 1, 1728]
    - [103, 89.357]
  - - [1024, 1024, 24, 96]
    - [187, 32.886]
  - - [96, 1024, 24, 1024]
    - [223, 46.959]
  - - [2304, 4096, 1, 12672]
    - [124, 91.016]
  - - [2304, 4096, 1, 2304]
    - [79, 83.959]
  - - [576, 4096, 1, 2304]
    - [121, 61.519]
  - - [2304, 4096, 1, 1728]
    - [67, 79.288]
  - - [1024, 1024, 48, 96]
    - [224, 36.084]
  - - [96, 1024, 48, 1024]
    - [183, 55.819]
  - - [2304, 8192, 1, 12672]
    - [107, 94.333]
  - - [2304, 8192, 1, 2304]
    - [103, 87.434]
  - - [576, 8192, 1, 2304]
    - [225, 70.353]
  - - [2304, 8192, 1, 1728]
    - [107, 85.9]
  - - [1024, 1024, 16, 96]
    - [115, 28.974]
  - - [96, 1024, 16, 1024]
    - [71, 34.712]
  - - [3072, 4096, 1, 6400]
    - [79, 91.185]
  - - [1536, 4096, 1, 3072]
    - [81, 75.42]
  - - [3072, 4096, 1, 1536]
    - [79, 82.997]
  - - [384, 4096, 1, 3072]
    - [136, 61.287]
  - - [3072, 4096, 1, 1152]
    - [149, 72.933]
  - - [1024, 1024, 32, 96]
    - [163, 30.253]
  - - [96, 1024, 32, 1024]
    - [180, 57.389]
  - - [3072, 8192, 1, 6400]
    - [79, 92.322]
  - - [1536, 8192, 1, 3072]
    - [136, 87.593]
  - - [3072, 8192, 1, 1536]
    - [88, 81.983]
  - - [384, 8192, 1, 3072]
    - [180, 74.056]
  - - [3072, 8192, 1, 1152]
    - [136, 80.717]
  - - [2048, 199, 1, 29000]
    - [52, 56.748]
  - - [2048, 221, 1, 29000]
    - [226, 62.816]
  - - [2048, 224, 1, 29000]
    - [227, 63.483]
  - - [2048, 229, 1, 29000]
    - [228, 66.312]
  - - [2048, 234, 1, 29000]
    - [227, 67.095]
  - - [2048, 242, 1, 29000]
    - [229, 67.938]
  - - [2048, 246, 1, 29000]
    - [230, 70.515]
  - - [2048, 247, 1, 29000]
    - [231, 68.734]
  - - [2048, 256, 1, 29000]
    - [232, 72.211]
  - - [2048, 262, 1, 29000]
    - [233, 72.754]
  - - [2048, 264, 1, 29000]
    - [233, 73.432]
  - - [2048, 265, 1, 29000]
    - [232, 68.839]
  - - [2048, 274, 1, 29000]
    - [234, 76.657]
  - - [2048, 277, 1, 29000]
    - [234, 70.641]
  - - [2048, 279, 1, 29000]
    - [230, 72.971]
  - - [2048, 288, 1, 29000]
    - [233, 79.396]
  - - [2048, 296, 1, 29000]
    - [235, 74.95]
  - - [2048, 315, 1, 29000]
    - [236, 79.135]
  - - [2048, 335, 1, 29000]
    - [193, 70.122]
  - - [2048, 4096, 1, 2048]
    - [75, 77.808]
  - - [2048, 4096, 1, 4096]
    - [115, 84.056]
  - - [2048, 8, 1, 2]
    - [56, 0.003]
  - - [2048, 8, 1, 2048]
    - [186, 1.592]
  - - [4096, 4096, 1, 2048]
    - [219, 82.422]
  - - [1024, 2283, 1, 29000]
    - [215, 87.877]
  - - [1024, 2296, 1, 29000]
    - [39, 89.979]
  - - [1024, 2306, 1, 29000]
    - [39, 90.431]
  - - [1024, 2309, 1, 29000]
    - [39, 90.439]
  - - [1024, 2318, 1, 29000]
    - [35, 89.638]
  - - [1024, 2320, 1, 29000]
    - [48, 88.324]
  - - [1024, 2324, 1, 29000]
    - [39, 90.502]
  - - [1024, 2325, 1, 29000]
    - [42, 89.565]
  - - [1024, 2329, 1, 29000]
    - [50, 89.971]
  - - [1024, 2338, 1, 29000]
    - [39, 89.434]
  - - [1024, 2345, 1, 29000]
    - [237, 90.475]
  - - [1024, 2350, 1, 29000]
    - [39, 91.824]
  - - [1024, 2362, 1, 29000]
    - [42, 91.291]
  - - [1024, 2366, 1, 29000]
    - [36, 91.678]
  - - [1024, 2368, 1, 29000]
    - [47, 91.073]
  - - [1024, 2374, 1, 29000]
    - [36, 91.863]
  - - [1024, 2390, 1, 29000]
    - [40, 92.448]
  - - [512, 512, 320, 64]
    - [14, 27.397]
  - - [64, 512, 320, 512]
    - [238, 48.624]
  - - [1024, 20, 1, 1024]
    - [239, 1.098]
  - - [1024, 20, 1, 2]
    - [5, 0.002]
  - - [1024, 561, 1, 29000]
    - [240, 78.907]
  - - [1024, 574, 1, 29000]
    - [234, 81.388]
  - - [1024, 600, 1, 29000]
    - [241, 74.68]
  - - [1024, 608, 1, 29000]
    - [159, 77.465]
  - - [1024, 615, 1, 29000]
    - [242, 80.792]
  - - [1024, 622, 1, 29000]
    - [159, 78.715]
  - - [1024, 625, 1, 29000]
    - [241, 79.62]
  - - [1024, 626, 1, 29000]
    - [209, 78.567]
  - - [1024, 628, 1, 29000]
    - [241, 80.569]
  - - [1024, 636, 1, 29000]
    - [235, 79.682]
  - - [1024, 651, 1, 29000]
    - [243, 75.586]
  - - [1024, 658, 1, 29000]
    - [243, 74.411]
  - - [1024, 669, 1, 29000]
    - [188, 76.302]
  - - [1024, 670, 1, 29000]
    - [244, 75.692]
  - - [1024, 672, 1, 29000]
    - [244, 76.125]
  - - [1024, 684, 1, 29000]
    - [243, 78.999]
  - - [1024, 716, 1, 29000]
    - [244, 81.94]
  - - [1024, 730, 1, 29000]
    - [245, 77.895]
  - - [512, 512, 80, 64]
    - [187, 22.17]
  - - [2560, 1024, 1, 2560]
    - [89, 63.699]
  - - [2560, 1024, 1, 4096]
    - [85, 68.994]
  - - [2560, 109, 1, 29000]
    - [246, 58.859]
  - - [2560, 121, 1, 29000]
    - [246, 67.405]
  - - [2560, 2, 1, 2]
    - [29, 0.001]
  - - [2560, 2, 1, 2560]
    - [155, 0.666]
  - - [2560, 27, 1, 29000]
    - [247, 23.915]
  - - [2560, 35, 1, 29000]
    - [248, 30.182]
  - - [2560, 36, 1, 29000]
    - [248, 33.198]
  - - [2560, 39, 1, 29000]
    - [249, 34.271]
  - - [2560, 40, 1, 29000]
    - [248, 35.729]
  - - [2560, 42, 1, 29000]
    - [249, 39.25]
  - - [2560, 43, 1, 29000]
    - [248, 39.489]
  - - [2560, 44, 1, 29000]
    - [248, 39.44]
  - - [2560, 46, 1, 29000]
    - [249, 41.161]
  - - [2560, 48, 1, 29000]
    - [249, 44.286]
  - - [2560, 49, 1, 29000]
    - [248, 44.613]
  - - [2560, 50, 1, 29000]
    - [248, 41.711]
  - - [2560, 51, 1, 29000]
    - [249, 45.338]
  - - [2560, 53, 1, 29000]
    - [248, 36.159]
  - - [2560, 54, 1, 29000]
    - [250, 36.491]
  - - [2560, 55, 1, 29000]
    - [251, 36.097]
  - - [2560, 56, 1, 29000]
    - [252, 37.361]
  - - [2560, 57, 1, 29000]
    - [253, 51.281]
  - - [2560, 58, 1, 29000]
    - [254, 51.317]
  - - [2560, 59, 1, 29000]
    - [255, 52.435]
  - - [2560, 61, 1, 29000]
    - [256, 39.954]
  - - [2560, 63, 1, 29000]
    - [256, 41.768]
  - - [2560, 65, 1, 29000]
    - [231, 39.75]
  - - [2560, 66, 1, 29000]
    - [230, 36.687]
  - - [2560, 67, 1, 29000]
    - [257, 37.411]
  - - [2560, 69, 1, 29000]
    - [257, 37.58]
  - - [2560, 70, 1, 29000]
    - [166, 37.653]
  - - [2560, 71, 1, 29000]
    - [215, 39.727]
  - - [2560, 73, 1, 29000]
    - [166, 39.561]
  - - [2560, 74, 1, 29000]
    - [166, 40.534]
  - - [2560, 75, 1, 29000]
    - [230, 43.032]
  - - [2560, 77, 1, 29000]
    - [230, 43.497]
  - - [2560, 78, 1, 29000]
    - [166, 43.831]
  - - [2560, 80, 1, 29000]
    - [166, 45.038]
  - - [2560, 81, 1, 29000]
    - [233, 46.936]
  - - [2560, 82, 1, 29000]
    - [51, 44.519]
  - - [2560, 83, 1, 29000]
    - [257, 47.127]
  - - [2560, 84, 1, 29000]
    - [52, 45.944]
  - - [2560, 88, 1, 29000]
    - [166, 49.476]
  - - [2560, 89, 1, 29000]
    - [230, 51.197]
  - - [2560, 90, 1, 29000]
    - [212, 50.883]
  - - [2560, 92, 1, 29000]
    - [232, 55.181]
  - - [2560, 95, 1, 29000]
    - [166, 52.648]
  - - [2560, 98, 1, 29000]
    - [159, 54.06]
  - - [4096, 1024, 1, 2560]
    - [25, 70.014]
  - - [1024, 1024, 512, 64]
    - [187, 34.664]
  - - [64, 1024, 512, 1024]
    - [162, 64.195]
  - - [1024, 32768, 1, 3072]
    - [108, 90.949]
  - - [1024, 32768, 1, 4096]
    - [107, 92.163]
  - - [1024, 32768, 1, 50304]
    - [108, 96.017]
  - - [4096, 32768, 1, 1024]
    - [14, 88.934]
  - - [1024, 1024, 24, 128]
    - [23, 32.698]
  - - [128, 1024, 24, 1024]
    - [121, 54.494]
  - - [1909283, 40, 1, 40]
    - [140, 4.767]
  - - [3818566, 40, 1, 40]
    - [205, 5.546]
  - - [1909283, 11, 1, 11]
    - [94, 0.899]
  - - [3818566, 11, 1, 11]
    - [258, 0.988]
- null
