library/src/blas3/Tensile/Logic/asm_full/arcturus_Cijk_Ailk_Bljk_HBH.yaml
- {MinimumRequiredVersion: 4.6.0}
- arcturus
- gfx908
- [Device 7380, Device 7388, Device 738c, Device 7390]
    SolutionIndex: 0
    SolutionNameMin: Cijk_Ailk_Bljk_HBH_MT016x016x16_PGR1_PLR1_TT02_02
    SolutionIndex: 1
    SolutionNameMin: Cijk_Ailk_Bljk_HBH_MT032x032x16_PGR1_PLR1_TT04_04
    SolutionIndex: 2
    SolutionNameMin: Cijk_Ailk_Bljk_HBH_MT064x016x16_PGR1_PLR1_TT04_04
    SolutionIndex: 3
    SolutionNameMin: Cijk_Ailk_Bljk_HBH_MT032x016x16_PGR1_PLR1_TT02_02
    SolutionIndex: 4
    SolutionNameMin: Cijk_Ailk_Bljk_HBH_MT064x016x16_PGR1_PLR1_TT04_02
    SolutionIndex: 5
    SolutionNameMin: Cijk_Ailk_Bljk_HBH_MT064x008x16_PGR1_PLR1_TT02_02
    SolutionIndex: 6
    SolutionNameMin: Cijk_Ailk_Bljk_HBH_MT064x016x16_PGR1_PLR1_TT02_02
    SolutionIndex: 7
    SolutionNameMin: Cijk_Ailk_Bljk_HBH_MT128x016x16_PGR1_PLR1_TT04_02
    SolutionIndex: 8
    SolutionNameMin: Cijk_Ailk_Bljk_HBH_MT016x016x32_PGR1_PLR1_TT02_02
    SolutionIndex: 9
    SolutionNameMin: Cijk_Ailk_Bljk_HBH_MT032x008x32_PGR1_PLR1_TT02_02
    SolutionIndex: 10
    SolutionNameMin: Cijk_Ailk_Bljk_HBH_MT032x016x32_PGR1_PLR1_TT02_02
    SolutionIndex: 11
    SolutionNameMin: Cijk_Ailk_Bljk_HBH_MT064x016x32_PGR1_PLR1_TT04_02
    SolutionIndex: 12
    SolutionNameMin: Cijk_Ailk_Bljk_HBH_MT064x008x32_PGR1_PLR1_TT02_02
    SolutionIndex: 13
    SolutionNameMin: Cijk_Ailk_Bljk_HBH_MT064x016x32_PGR1_PLR1_TT02_02
    SolutionIndex: 14
    SolutionNameMin: Cijk_Ailk_Bljk_HBH_MT128x016x32_PGR1_PLR1_TT04_02
    SolutionIndex: 15
    SolutionNameMin: Cijk_Ailk_Bljk_HBH_MT032x008x64_PGR1_PLR1_TT02_02
    SolutionIndex: 16
    SolutionNameMin: Cijk_Ailk_Bljk_HBH_MT064x008x64_PGR1_PLR1_TT02_02
    SolutionIndex: 17
    SolutionNameMin: Cijk_Ailk_Bljk_HBH_MT064x032x08_PGR1_PLR1_TT08_04
    SolutionIndex: 18
    SolutionNameMin: Cijk_Ailk_Bljk_HBH_MT032x032x08_PGR1_PLR1_TT04_04
    SolutionIndex: 19
    SolutionNameMin: Cijk_Ailk_Bljk_HBH_MT064x032x08_PGR1_PLR1_TT08_04
    SolutionIndex: 20
    SolutionNameMin: Cijk_Ailk_Bljk_HBH_MT032x016x16_PGR1_PLR1_TT04_02
    SolutionIndex: 21
    SolutionNameMin: Cijk_Ailk_Bljk_HBH_MT032x032x16_PGR1_PLR1_TT04_04
    SolutionIndex: 22
    SolutionNameMin: Cijk_Ailk_Bljk_HBH_MT064x064x16_PGR1_PLR1_TT08_08
    SolutionIndex: 23
    SolutionNameMin: Cijk_Ailk_Bljk_HBH_MT064x016x16_PGR1_PLR1_TT04_02
    SolutionIndex: 24
    SolutionNameMin: Cijk_Ailk_Bljk_HBH_MT064x016x16_PGR1_PLR1_TT02_02
    SolutionIndex: 25
    SolutionNameMin: Cijk_Ailk_Bljk_HBH_MT128x016x16_PGR1_PLR1_TT04_02
    SolutionIndex: 26
    SolutionNameMin: Cijk_Ailk_Bljk_HBH_MT064x016x16_PGR1_PLR1_TT04_04
    SolutionIndex: 27
    SolutionNameMin: Cijk_Ailk_Bljk_HBH_MT064x008x16_PGR1_PLR1_TT02_02
    SolutionIndex: 28
    SolutionNameMin: Cijk_Ailk_Bljk_HBH_MT016x016x24_PGR1_PLR1_TT02_02
    SolutionIndex: 29
    SolutionNameMin: Cijk_Ailk_Bljk_HBH_MT032x016x24_PGR1_PLR1_TT04_02
    SolutionIndex: 30
    SolutionNameMin: Cijk_Ailk_Bljk_HBH_MT016x016x24_PGR1_PLR1_TT02_02
    SolutionIndex: 31
    SolutionNameMin: Cijk_Ailk_Bljk_HBH_MT032x016x24_PGR1_PLR1_TT04_02
    SolutionIndex: 32
    SolutionNameMin: Cijk_Ailk_Bljk_HBH_MT032x032x24_PGR1_PLR1_TT04_04
    SolutionIndex: 33
    SolutionNameMin: Cijk_Ailk_Bljk_HBH_MT032x032x32_PGR1_PLR1_TT04_04
    SolutionIndex: 34
    SolutionNameMin: Cijk_Ailk_Bljk_HBH_MT064x016x32_PGR1_PLR1_TT02_02
    SolutionIndex: 35
    SolutionNameMin: Cijk_Ailk_Bljk_HBH_MT128x016x32_PGR1_PLR1_TT04_02
    SolutionIndex: 36
    SolutionNameMin: Cijk_Ailk_Bljk_HBH_MT032x008x32_PGR1_PLR1_TT02_02
    SolutionIndex: 37
    SolutionNameMin: Cijk_Ailk_Bljk_HBH_MT064x008x32_PGR1_PLR1_TT02_02
    SolutionIndex: 38
    SolutionNameMin: Cijk_Ailk_Bljk_HBH_MT032x008x64_PGR1_PLR1_TT02_02
    SolutionIndex: 39
    SolutionNameMin: Cijk_Ailk_Bljk_HBH_MT064x008x64_PGR1_PLR1_TT02_02
    SolutionIndex: 40
    SolutionNameMin: Cijk_Ailk_Bljk_HBH_MT064x064x08_PGR1_PLR1_TT04_04
    SolutionIndex: 41
    SolutionNameMin: Cijk_Ailk_Bljk_HBH_MT064x128x08_PGR1_PLR1_TT04_08
    SolutionIndex: 42
    SolutionNameMin: Cijk_Ailk_Bljk_HBH_MT128x064x08_PGR1_PLR1_TT08_04
    SolutionIndex: 43
    SolutionNameMin: Cijk_Ailk_Bljk_HBH_MT064x032x16_PGR0_PLR1_TT08_04
    SolutionIndex: 44
    SolutionNameMin: Cijk_Ailk_Bljk_HBH_MT064x064x16_PGR1_PLR1_TT04_04
    SolutionIndex: 45
    SolutionNameMin: Cijk_Ailk_Bljk_HBH_MT064x128x16_PGR1_PLR1_TT04_08
    SolutionIndex: 46
    SolutionNameMin: Cijk_Ailk_Bljk_HBH_MT128x064x16_PGR1_PLR1_TT08_04
    SolutionIndex: 47
    SolutionNameMin: Cijk_Ailk_Bljk_HBH_MT128x128x16_PGR1_PLR1_TT08_08
    SolutionIndex: 48
    SolutionNameMin: Cijk_Ailk_Bljk_HBH_MT064x032x16_PGR0_PLR0_TT04_04
    SolutionIndex: 49
    SolutionNameMin: Cijk_Ailk_Bljk_HBH_MT064x128x16_PGR0_PLR0_TT04_08
    SolutionIndex: 50
    SolutionNameMin: Cijk_Ailk_Bljk_HBH_MT032x128x16_PGR1_PLR0_TT04_04
    SolutionIndex: 51
    SolutionNameMin: Cijk_Ailk_Bljk_HBH_MT032x128x16_PGR0_PLR0_TT04_04
    SolutionIndex: 52
    SolutionNameMin: Cijk_Ailk_Bljk_HBH_MT064x064x04_PGR1_PLR1_TT04_04
    SolutionIndex: 53
    SolutionNameMin: Cijk_Ailk_Bljk_HBH_MT064x064x08_PGR1_PLR1_TT04_04
    SolutionIndex: 54
    SolutionNameMin: Cijk_Ailk_Bljk_HBH_MT064x064x16_PGR1_PLR1_TT04_04
    SolutionIndex: 55
    SolutionNameMin: Cijk_Ailk_Bljk_HBH_MT032x032x08_PGR0_PLR1_TT04_04
    SolutionIndex: 56
    SolutionNameMin: Cijk_Ailk_Bljk_HBH_MT032x032x16_PGR1_PLR1_TT04_04
    SolutionIndex: 57
    SolutionNameMin: Cijk_Ailk_Bljk_HBH_MT064x016x16_PGR1_PLR1_TT04_04
    SolutionIndex: 58
    SolutionNameMin: Cijk_Ailk_Bljk_HBH_MT064x032x16_PGR1_PLR1_TT04_04
    SolutionIndex: 59
    SolutionNameMin: Cijk_Ailk_Bljk_HBH_MT064x064x16_PGR1_PLR1_TT04_04
    SolutionIndex: 60
    SolutionNameMin: Cijk_Ailk_Bljk_HBH_MT032x032x32_PGR1_PLR1_TT04_04
    SolutionIndex: 61
    SolutionNameMin: Cijk_Ailk_Bljk_HBH_MT064x016x32_PGR1_PLR1_TT04_04
    SolutionIndex: 62
    SolutionNameMin: Cijk_Ailk_Bljk_HBH_MT064x032x32_PGR1_PLR1_TT04_04
    SolutionIndex: 63
    SolutionNameMin: Cijk_Ailk_Bljk_HBH_MT128x016x32_PGR1_PLR1_TT04_04
    SolutionIndex: 64
    SolutionNameMin: Cijk_Ailk_Bljk_HBH_MT128x032x32_PGR1_PLR1_TT04_04
    SolutionIndex: 65
    SolutionNameMin: Cijk_Ailk_Bljk_HBH_MT064x064x16_PGR1_PLR1_TT08_08
    SolutionIndex: 66
    SolutionNameMin: Cijk_Ailk_Bljk_HBH_MT128x128x16_PGR1_PLR1_TT08_08
    SolutionIndex: 67
    SolutionNameMin: Cijk_Ailk_Bljk_HBH_MT032x032x08_PGR1_PLR1_TT04_04
    SolutionIndex: 68
    SolutionNameMin: Cijk_Ailk_Bljk_HBH_MT064x032x08_PGR1_PLR1_TT08_04
    SolutionIndex: 69
    SolutionNameMin: Cijk_Ailk_Bljk_HBH_MT064x064x08_PGR1_PLR1_TT08_08
    SolutionIndex: 70
    SolutionNameMin: Cijk_Ailk_Bljk_HBH_MT128x128x08_PGR1_PLR1_TT08_08
    SolutionIndex: 71
    SolutionNameMin: Cijk_Ailk_Bljk_HBH_MT128x032x16_PGR1_PLR1_TT08_04
    SolutionIndex: 72
    SolutionNameMin: Cijk_Ailk_Bljk_HBH_MT032x032x16_PGR1_PLR1_TT04_04
    SolutionIndex: 73
    SolutionNameMin: Cijk_Ailk_Bljk_HBH_MT064x032x16_PGR1_PLR1_TT08_04
    SolutionIndex: 74
    SolutionNameMin: Cijk_Ailk_Bljk_HBH_MT064x064x16_PGR1_PLR1_TT04_04
    SolutionIndex: 75
    SolutionNameMin: Cijk_Ailk_Bljk_HBH_MT128x064x16_PGR1_PLR1_TT08_04
    SolutionIndex: 76
    SolutionNameMin: Cijk_Ailk_Bljk_HBH_MT128x128x16_PGR1_PLR1_TT08_08
    SolutionIndex: 77
    SolutionNameMin: Cijk_Ailk_Bljk_HBH_MT064x032x16_PGR1_PLR1_TT04_04
    SolutionIndex: 78
    SolutionNameMin: Cijk_Ailk_Bljk_HBH_MT128x032x16_PGR1_PLR1_TT08_04
    SolutionIndex: 79
    SolutionNameMin: Cijk_Ailk_Bljk_HBH_MT128x064x32_PGR1_PLR1_TT08_04
    SolutionIndex: 80
    SolutionNameMin: Cijk_Ailk_Bljk_HBH_MT128x032x32_PGR1_PLR1_TT04_04
    SolutionIndex: 81
    SolutionNameMin: Cijk_Ailk_Bljk_HBH_MT064x016x32_PGR1_PLR1_TT04_04
    SolutionIndex: 82
    SolutionNameMin: Cijk_Ailk_Bljk_HBH_MT064x064x16_PGR1_PLR1_TT08_08
    SolutionIndex: 83
    SolutionNameMin: Cijk_Ailk_Bljk_HBH_MT128x128x16_PGR1_PLR1_TT08_08
    SolutionIndex: 84
    SolutionNameMin: Cijk_Ailk_Bljk_HBH_MT064x064x32_PGR1_PLR1_TT08_08
    SolutionIndex: 85
    SolutionNameMin: Cijk_Ailk_Bljk_HBH_MT128x128x32_PGR1_PLR1_TT08_08
    SolutionIndex: 86
    SolutionNameMin: Cijk_Ailk_Bljk_HBH_MT064x032x16_PGR0_PLR1_TT08_04
    SolutionIndex: 87
    SolutionNameMin: Cijk_Ailk_Bljk_HBH_MT128x128x32_PGR0_PLR1_TT08_08
    SolutionIndex: 88
    SolutionNameMin: Cijk_Ailk_Bljk_HBH_MT064x128x16_PGR1_PLR1_TT04_08
    SolutionIndex: 89
    SolutionNameMin: Cijk_Ailk_Bljk_HBH_MT128x064x16_PGR1_PLR1_TT08_04
    SolutionIndex: 90
    SolutionNameMin: Cijk_Ailk_Bljk_HBH_MT128x128x16_PGR1_PLR1_TT08_08
    SolutionIndex: 91
    SolutionNameMin: Cijk_Ailk_Bljk_HBH_MT128x064x16_PGR1_PLR1_TT04_08
    SolutionIndex: 92
    SolutionNameMin: Cijk_Ailk_Bljk_HBH_MT128x064x16_PGR1_PLR1_TT04_08
    SolutionIndex: 93
    SolutionNameMin: Cijk_Ailk_Bljk_HBH_MT128x064x32_PGR1_PLR1_TT04_04
    SolutionIndex: 94
    SolutionNameMin: Cijk_Ailk_Bljk_HBH_MT256x128x32_PGR1_PLR1_TT08_08
    SolutionIndex: 95
    SolutionNameMin: Cijk_Ailk_Bljk_HBH_MT128x032x16_PGR0_PLR0_TT08_04
    SolutionIndex: 96
    SolutionNameMin: Cijk_Ailk_Bljk_HBH_MT064x128x16_PGR1_PLR0_TT04_08
    SolutionIndex: 97
    SolutionNameMin: Cijk_Ailk_Bljk_HBH_MT128x064x16_PGR1_PLR0_TT08_04
    SolutionIndex: 98
    SolutionNameMin: Cijk_Ailk_Bljk_HBH_MT128x064x16_PGR1_PLR0_TT04_08
    SolutionIndex: 99
    SolutionNameMin: Cijk_Ailk_Bljk_HBH_MT064x128x04_PGR0_PLR0_TT04_08
    SolutionIndex: 100
    SolutionNameMin: Cijk_Ailk_Bljk_HBH_MT064x064x04_PGR0_PLR0_TT04_04
    SolutionIndex: 101
    SolutionNameMin: Cijk_Ailk_Bljk_HBH_MT064x064x04_PGR1_PLR0_TT04_04
    SolutionIndex: 102
    SolutionNameMin: Cijk_Ailk_Bljk_HBH_MT064x064x04_PGR0_PLR1_TT04_04
    SolutionIndex: 103
    SolutionNameMin: Cijk_Ailk_Bljk_HBH_MT064x064x04_PGR1_PLR1_TT04_04
    SolutionIndex: 104
    SolutionNameMin: Cijk_Ailk_Bljk_HBH_MT064x128x08_PGR0_PLR0_TT04_08
    SolutionIndex: 105
    SolutionNameMin: Cijk_Ailk_Bljk_HBH_MT064x064x08_PGR0_PLR0_TT04_04
    SolutionIndex: 106
    SolutionNameMin: Cijk_Ailk_Bljk_HBH_MT064x128x08_PGR1_PLR0_TT04_08
    SolutionIndex: 107
    SolutionNameMin: Cijk_Ailk_Bljk_HBH_MT064x064x08_PGR1_PLR0_TT04_04
    SolutionIndex: 108
    SolutionNameMin: Cijk_Ailk_Bljk_HBH_MT064x128x08_PGR0_PLR1_TT04_08
    SolutionIndex: 109
    SolutionNameMin: Cijk_Ailk_Bljk_HBH_MT064x064x08_PGR0_PLR1_TT04_04
    SolutionIndex: 110
    SolutionNameMin: Cijk_Ailk_Bljk_HBH_MT064x064x08_PGR1_PLR1_TT04_04
    SolutionIndex: 111
    SolutionNameMin: Cijk_Ailk_Bljk_HBH_MT128x128x16_PGR0_PLR0_TT08_08
    SolutionIndex: 112
    SolutionNameMin: Cijk_Ailk_Bljk_HBH_MT064x128x16_PGR0_PLR0_TT04_08
    SolutionIndex: 113
    SolutionNameMin: Cijk_Ailk_Bljk_HBH_MT064x064x16_PGR1_PLR0_TT04_04
    SolutionIndex: 114
    SolutionNameMin: Cijk_Ailk_Bljk_HBH_MT064x064x16_PGR0_PLR1_TT04_04
    SolutionIndex: 115
    SolutionNameMin: Cijk_Ailk_Bljk_HBH_MT064x064x16_PGR1_PLR1_TT04_04
    SolutionIndex: 116
    SolutionNameMin: Cijk_Ailk_Bljk_HBH_MT128x128x04_PGR0_PLR0_TT08_08
    SolutionIndex: 117
    SolutionNameMin: Cijk_Ailk_Bljk_HBH_MT064x128x04_PGR0_PLR0_TT04_08
    SolutionIndex: 118
    SolutionNameMin: Cijk_Ailk_Bljk_HBH_MT064x064x04_PGR0_PLR0_TT04_04
    SolutionIndex: 119
    SolutionNameMin: Cijk_Ailk_Bljk_HBH_MT064x128x04_PGR1_PLR0_TT04_08
    SolutionIndex: 120
    SolutionNameMin: Cijk_Ailk_Bljk_HBH_MT064x064x04_PGR1_PLR0_TT04_04
    SolutionIndex: 121
    SolutionNameMin: Cijk_Ailk_Bljk_HBH_MT064x128x04_PGR0_PLR1_TT04_08
    SolutionIndex: 122
    SolutionNameMin: Cijk_Ailk_Bljk_HBH_MT064x064x04_PGR0_PLR1_TT04_04
    SolutionIndex: 123
    SolutionNameMin: Cijk_Ailk_Bljk_HBH_MT064x128x04_PGR1_PLR1_TT04_08
    SolutionIndex: 124
    SolutionNameMin: Cijk_Ailk_Bljk_HBH_MT064x064x04_PGR1_PLR1_TT04_04
    SolutionIndex: 125
    SolutionNameMin: Cijk_Ailk_Bljk_HBH_MT064x064x08_PGR0_PLR0_TT04_04
    SolutionIndex: 126
    SolutionNameMin: Cijk_Ailk_Bljk_HBH_MT064x128x08_PGR1_PLR0_TT04_08
    SolutionIndex: 127
    SolutionNameMin: Cijk_Ailk_Bljk_HBH_MT064x064x08_PGR1_PLR0_TT04_04
    SolutionIndex: 128
    SolutionNameMin: Cijk_Ailk_Bljk_HBH_MT064x128x08_PGR0_PLR1_TT04_08
    SolutionIndex: 129
    SolutionNameMin: Cijk_Ailk_Bljk_HBH_MT064x064x08_PGR0_PLR1_TT04_04
    SolutionIndex: 130
    SolutionNameMin: Cijk_Ailk_Bljk_HBH_MT064x064x08_PGR1_PLR1_TT04_04
    SolutionIndex: 131
    SolutionNameMin: Cijk_Ailk_Bljk_HBH_MT064x064x16_PGR0_PLR0_TT04_04
    SolutionIndex: 132
    SolutionNameMin: Cijk_Ailk_Bljk_HBH_MT128x128x16_PGR1_PLR0_TT08_08
    SolutionIndex: 133
    SolutionNameMin: Cijk_Ailk_Bljk_HBH_MT064x128x16_PGR1_PLR0_TT04_08
    SolutionIndex: 134
    SolutionNameMin: Cijk_Ailk_Bljk_HBH_MT064x064x16_PGR1_PLR1_TT04_04
    SolutionIndex: 135
    SolutionNameMin: Cijk_Ailk_Bljk_HBH_MT128x064x16_EPS1_GRVW08_LPB00_PGR1_PLR1_SNLL1_TT08_08_VW08_WG16_08_01_WGM01
    SolutionIndex: 136
    SolutionNameMin: Cijk_Ailk_Bljk_HBH_MT064x128x16_EPS1_GRVW04_LPB04_PGR1_PLR1_SNLL1_TT08_04_VW04_WG08_32_01_WGM01
    SolutionIndex: 137
    SolutionNameMin: Cijk_Ailk_Bljk_HBH_MT128x064x16_EPS1_GRVW04_LPB04_PGR1_PLR1_SNLL1_TT08_04_VW04_WG16_16_01_WGM01
    SolutionIndex: 138
    SolutionNameMin: Cijk_Ailk_Bljk_HBH_MT128x128x16_EPS1_GRVW04_LPB04_PGR1_PLR1_SNLL1_TT08_08_VW04_WG16_16_01_WGM01
    SolutionIndex: 139
    SolutionNameMin: Cijk_Ailk_Bljk_HBH_MT064x128x16_EPS1_GRVW04_LPB04_PGR1_PLR1_SNLL1_TT08_04_VW04_WG08_32_01_WGM08
    SolutionIndex: 140
    SolutionNameMin: Cijk_Ailk_Bljk_HBH_MT128x064x16_EPS1_GRVW04_LPB04_PGR1_PLR1_SNLL1_TT08_04_VW04_WG16_16_01_WGM08
    SolutionIndex: 141
    SolutionNameMin: Cijk_Ailk_Bljk_HBH_MT256x064x16_EPS1_GRVW04_LPB04_PGR1_PLR1_SNLL1_TT08_08_VW04_WG32_08_01_WGM64
    SolutionIndex: 142
    SolutionNameMin: Cijk_Ailk_Bljk_HBH_MT064x128x32_EPS0_GRVW04_LPB04_PGR0_PLR0_SNLL0_TT08_04_VW04_WG08_32_01_WGM01
    SolutionIndex: 143
    SolutionNameMin: Cijk_Ailk_Bljk_HBH_MT064x064x32_EPS0_GRVW04_LPB04_PGR0_PLR0_SNLL0_TT04_04_VW04_WG16_16_01_WGM01
    SolutionIndex: 144
    SolutionNameMin: Cijk_Ailk_Bljk_HBH_MT128x064x32_EPS1_GRVW04_LPB04_PGR1_PLR1_SNLL1_TT08_04_VW04_WG16_16_01_WGM01
    SolutionIndex: 145
    SolutionNameMin: Cijk_Ailk_Bljk_HBH_MT064x064x32_EPS0_GRVW04_LPB04_PGR0_PLR0_SNLL0_TT04_04_VW04_WG16_16_01_WGM08
    SolutionIndex: 146
    SolutionNameMin: Cijk_Ailk_Bljk_HBH_MT128x064x32_EPS0_GRVW08_LPB08_PGR0_PLR1_SNLL0_TT08_08_VW08_WG16_08_01_WGM01
    SolutionIndex: 147
    SolutionNameMin: Cijk_Ailk_Bljk_HBH_MT64x128x16_MI32x32x4x2_SE_AF0EM1_ASEM1_GRVW2_ONLL0_SNLL1
    SolutionIndex: 148
    SolutionNameMin: Cijk_Ailk_Bljk_HBH_MT64x128x16_MI32x32x4x2_SE_AF0EM1_ASEM2_GRVW2_ONLL0_SNLL1
    SolutionIndex: 149
    SolutionNameMin: Cijk_Ailk_Bljk_HBH_MT64x128x16_MI32x32x4x2_SE_AF0EM2_ASEM1_GRVW2_ONLL0_SNLL1
    SolutionIndex: 150
    SolutionNameMin: Cijk_Ailk_Bljk_HBH_MT64x128x16_MI32x32x4x2_SE_AF0EM1_ASEM1_GRVW2_ONLL0_SNLL0
    SolutionIndex: 151
    SolutionNameMin: Cijk_Ailk_Bljk_HBH_MT64x128x16_MI32x32x4x2_SE_AF0EM1_ASEM2_GRVW2_ONLL0_SNLL0
    SolutionIndex: 152
    SolutionNameMin: Cijk_Ailk_Bljk_HBH_MT64x128x16_MI32x32x4x2_SE_AF0EM2_ASEM1_GRVW2_ONLL0_SNLL0
    SolutionIndex: 153
    SolutionNameMin: Cijk_Ailk_Bljk_HBH_MT64x128x16_MI32x32x4x2_SE_AF0EM2_ASEM2_GRVW2_ONLL0_SNLL0
    SolutionIndex: 154
    SolutionNameMin: Cijk_Ailk_Bljk_HBH_MT64x128x32_MI32x32x4x2_SE_AF0EM2_ASEM2_GRVW2_ONLL0_SNLL0
    SolutionIndex: 155
    SolutionNameMin: Cijk_Ailk_Bljk_HBH_MT32x256x16_MI32x32x4x2_SE_AF0EM1_ASEM2_GRVW4_ONLL0_SNLL0
    SolutionIndex: 156
    SolutionNameMin: Cijk_Ailk_Bljk_HBH_MT64x128x16_MI32x32x4x2_SE_AF0EM1_ASEM1_GRVW2_ONLL1_SNLL1
    SolutionIndex: 157
    SolutionNameMin: Cijk_Ailk_Bljk_HBH_MT64x128x16_MI32x32x4x2_SE_AF0EM1_ASEM2_GRVW2_ONLL1_SNLL1
    SolutionIndex: 158
    SolutionNameMin: Cijk_Ailk_Bljk_HBH_MT64x128x16_MI32x32x4x2_SE_AF0EM2_ASEM1_GRVW2_ONLL1_SNLL1
    SolutionIndex: 159
    SolutionNameMin: Cijk_Ailk_Bljk_HBH_MT64x128x16_MI32x32x4x2_SE_AF0EM2_ASEM2_GRVW2_ONLL1_SNLL1
    SolutionIndex: 160
    SolutionNameMin: Cijk_Ailk_Bljk_HBH_MT64x128x16_MI32x32x4x2_SE_AF0EM1_ASEM1_GRVW2_ONLL1_SNLL0
    SolutionIndex: 161
    SolutionNameMin: Cijk_Ailk_Bljk_HBH_MT64x128x16_MI32x32x4x2_SE_AF0EM1_ASEM2_GRVW2_ONLL1_SNLL0
    SolutionIndex: 162
    SolutionNameMin: Cijk_Ailk_Bljk_HBH_MT64x128x16_MI32x32x4x2_SE_AF0EM2_ASEM1_GRVW2_ONLL1_SNLL0
    SolutionIndex: 163
    SolutionNameMin: Cijk_Ailk_Bljk_HBH_MT64x128x16_MI32x32x4x2_SE_AF0EM2_ASEM2_GRVW2_ONLL1_SNLL0
    SolutionIndex: 164
    SolutionNameMin: Cijk_Ailk_Bljk_HBH_MT64x128x8_MI32x32x4x2_SE_AF0EM2_ASEM1_GRVW4_ONLL1_SNLL0
    SolutionIndex: 165
    SolutionNameMin: Cijk_Ailk_Bljk_HBH_MT64x128x8_MI32x32x4x2_SE_AF0EM2_ASEM2_GRVW4_ONLL1_SNLL0
    SolutionIndex: 166
    SolutionNameMin: Cijk_Ailk_Bljk_HBH_MT32x256x16_MI32x32x4x2_SE_AF0EM2_ASEM2_GRVW4_ONLL1_SNLL0
    SolutionIndex: 167
    SolutionNameMin: Cijk_Ailk_Bljk_HBH_MT64x256x16_MI32x32x4x2_SE_AF0EM1_ASEM2_GRVW2_ONLL0_SNLL1
    SolutionIndex: 168
    SolutionNameMin: Cijk_Ailk_Bljk_HBH_MT64x256x16_MI32x32x4x2_SE_AF0EM1_ASEM1_GRVW2_ONLL0_SNLL0
    SolutionIndex: 169
    SolutionNameMin: Cijk_Ailk_Bljk_HBH_MT64x256x16_MI32x32x4x2_SE_AF0EM1_ASEM2_GRVW2_ONLL0_SNLL0
    SolutionIndex: 170
    SolutionNameMin: Cijk_Ailk_Bljk_HBH_MT64x256x16_MI32x32x4x2_SE_AF0EM1_ASEM1_GRVW2_ONLL1_SNLL1
    SolutionIndex: 171
    SolutionNameMin: Cijk_Ailk_Bljk_HBH_MT64x256x16_MI32x32x4x2_SE_AF0EM1_ASEM1_GRVW2_ONLL1_SNLL0
    SolutionIndex: 172
    SolutionNameMin: Cijk_Ailk_Bljk_HBH_MT64x256x16_MI32x32x4x2_SE_AF0EM1_ASEM2_GRVW2_ONLL1_SNLL0
    SolutionIndex: 173
    SolutionIndex: 174
    SolutionIndex: 175
    SolutionIndex: 176
    SolutionIndex: 177
    SolutionIndex: 178
    SolutionIndex: 179
    SolutionIndex: 180
    SolutionIndex: 181
    SolutionIndex: 182
    SolutionIndex: 183
    SolutionIndex: 184
    SolutionIndex: 185
    SolutionIndex: 186
    SolutionIndex: 187
    SolutionIndex: 188
    SolutionIndex: 189
    SolutionIndex: 190
    SolutionIndex: 191
    SolutionIndex: 192
    SolutionIndex: 193
    SolutionIndex: 194
    SolutionIndex: 195
    SolutionIndex: 196
    SolutionIndex: 197
    SolutionIndex: 198
    SolutionIndex: 199
    SolutionIndex: 200
    SolutionIndex: 201
    SolutionIndex: 202
    SolutionIndex: 203
    SolutionIndex: 204
    SolutionIndex: 205
    SolutionIndex: 206
    SolutionIndex: 207
    SolutionIndex: 208
    SolutionIndex: 209
    SolutionIndex: 210
    SolutionIndex: 211
    SolutionIndex: 212
    SolutionIndex: 213
    SolutionIndex: 214
    SolutionIndex: 215
    SolutionIndex: 216
    SolutionIndex: 217
    SolutionIndex: 218
    SolutionIndex: 219
    SolutionIndex: 220
    SolutionIndex: 221
    SolutionIndex: 222
    SolutionIndex: 223
    SolutionIndex: 224
    SolutionIndex: 225
    SolutionIndex: 226
    SolutionIndex: 227
    SolutionIndex: 228
    SolutionIndex: 229
    SolutionIndex: 230
    SolutionIndex: 231
    SolutionIndex: 232
    SolutionIndex: 233
    SolutionIndex: 234
    SolutionIndex: 235
    SolutionIndex: 236
    SolutionIndex: 237
    SolutionIndex: 238
    SolutionIndex: 239
    SolutionIndex: 240
    SolutionIndex: 241
    SolutionIndex: 242
    SolutionIndex: 243
    SolutionIndex: 244
    SolutionIndex: 245
    SolutionIndex: 246
    SolutionIndex: 247
    SolutionIndex: 248
    SolutionIndex: 249
    SolutionIndex: 250
    SolutionIndex: 251
    SolutionIndex: 252
    SolutionIndex: 253
    SolutionIndex: 254
    SolutionIndex: 255
    SolutionIndex: 256
    SolutionIndex: 257
    SolutionIndex: 258
    SolutionIndex: 259
    SolutionIndex: 260
    SolutionIndex: 261
    SolutionIndex: 262
    SolutionIndex: 263
    SolutionIndex: 264
    SolutionIndex: 265
    SolutionIndex: 266
    SolutionIndex: 267
    SolutionIndex: 268
    SolutionIndex: 269
    SolutionIndex: 270
    SolutionIndex: 271
    SolutionIndex: 272
    SolutionIndex: 273
    SolutionIndex: 274
    SolutionIndex: 275
    SolutionIndex: 276
    SolutionIndex: 277
    SolutionIndex: 278
    SolutionIndex: 279
    SolutionIndex: 280
    SolutionIndex: 281
    SolutionIndex: 282
    SolutionIndex: 283
    SolutionIndex: 284
    SolutionIndex: 285
    SolutionIndex: 286
    SolutionIndex: 287
    SolutionNameMin: Cijk_Ailk_Bljk_HBH_MT016x016x16_PGR1_PLR1_TT02_02
    SolutionIndex: 288
    SolutionNameMin: Cijk_Ailk_Bljk_HBH_MT032x032x16_PGR1_PLR1_TT04_04
    SolutionIndex: 289
    SolutionNameMin: Cijk_Ailk_Bljk_HBH_MT064x016x16_PGR1_PLR1_TT04_04
    SolutionIndex: 290
    SolutionNameMin: Cijk_Ailk_Bljk_HBH_MT032x016x16_PGR1_PLR1_TT02_02
    SolutionIndex: 291
    SolutionNameMin: Cijk_Ailk_Bljk_HBH_MT064x016x16_PGR1_PLR1_TT04_02
    SolutionIndex: 292
    SolutionNameMin: Cijk_Ailk_Bljk_HBH_MT064x008x16_PGR1_PLR1_TT02_02
    SolutionIndex: 293
    SolutionNameMin: Cijk_Ailk_Bljk_HBH_MT064x016x16_PGR1_PLR1_TT02_02
    SolutionIndex: 294
    SolutionNameMin: Cijk_Ailk_Bljk_HBH_MT128x016x16_PGR1_PLR1_TT04_02
    SolutionIndex: 295
    SolutionNameMin: Cijk_Ailk_Bljk_HBH_MT016x016x32_PGR1_PLR1_TT02_02
    SolutionIndex: 296
    SolutionNameMin: Cijk_Ailk_Bljk_HBH_MT032x008x32_PGR1_PLR1_TT02_02
    SolutionIndex: 297
    SolutionNameMin: Cijk_Ailk_Bljk_HBH_MT032x016x32_PGR1_PLR1_TT02_02
    SolutionIndex: 298
    SolutionNameMin: Cijk_Ailk_Bljk_HBH_MT064x016x32_PGR1_PLR1_TT04_02
    SolutionIndex: 299
    SolutionNameMin: Cijk_Ailk_Bljk_HBH_MT064x008x32_PGR1_PLR1_TT02_02
    SolutionIndex: 300
    SolutionNameMin: Cijk_Ailk_Bljk_HBH_MT064x016x32_PGR1_PLR1_TT02_02
    SolutionIndex: 301
    SolutionNameMin: Cijk_Ailk_Bljk_HBH_MT128x016x32_PGR1_PLR1_TT04_02
    SolutionIndex: 302
    SolutionNameMin: Cijk_Ailk_Bljk_HBH_MT032x008x64_PGR1_PLR1_TT02_02
    SolutionIndex: 303
    SolutionNameMin: Cijk_Ailk_Bljk_HBH_MT064x008x64_PGR1_PLR1_TT02_02
    SolutionIndex: 304
    SolutionNameMin: Cijk_Ailk_Bljk_HBH_MT064x032x08_PGR1_PLR1_TT08_04
    SolutionIndex: 305
    SolutionNameMin: Cijk_Ailk_Bljk_HBH_MT032x032x08_PGR1_PLR1_TT04_04
    SolutionIndex: 306
    SolutionNameMin: Cijk_Ailk_Bljk_HBH_MT064x032x08_PGR1_PLR1_TT08_04
    SolutionIndex: 307
    SolutionNameMin: Cijk_Ailk_Bljk_HBH_MT032x016x16_PGR1_PLR1_TT04_02
    SolutionIndex: 308
    SolutionNameMin: Cijk_Ailk_Bljk_HBH_MT032x032x16_PGR1_PLR1_TT04_04
    SolutionIndex: 309
    SolutionNameMin: Cijk_Ailk_Bljk_HBH_MT064x064x16_PGR1_PLR1_TT08_08
    SolutionIndex: 310
    SolutionNameMin: Cijk_Ailk_Bljk_HBH_MT064x016x16_PGR1_PLR1_TT04_02
    SolutionIndex: 311
    SolutionNameMin: Cijk_Ailk_Bljk_HBH_MT064x016x16_PGR1_PLR1_TT02_02
    SolutionIndex: 312
    SolutionNameMin: Cijk_Ailk_Bljk_HBH_MT128x016x16_PGR1_PLR1_TT04_02
    SolutionIndex: 313
    SolutionNameMin: Cijk_Ailk_Bljk_HBH_MT064x016x16_PGR1_PLR1_TT04_04
    SolutionIndex: 314
    SolutionNameMin: Cijk_Ailk_Bljk_HBH_MT064x008x16_PGR1_PLR1_TT02_02
    SolutionIndex: 315
    SolutionNameMin: Cijk_Ailk_Bljk_HBH_MT016x016x24_PGR1_PLR1_TT02_02
    SolutionIndex: 316
    SolutionNameMin: Cijk_Ailk_Bljk_HBH_MT032x016x24_PGR1_PLR1_TT04_02
    SolutionIndex: 317
    SolutionNameMin: Cijk_Ailk_Bljk_HBH_MT016x016x24_PGR1_PLR1_TT02_02
    SolutionIndex: 318
    SolutionNameMin: Cijk_Ailk_Bljk_HBH_MT032x016x24_PGR1_PLR1_TT04_02
    SolutionIndex: 319
    SolutionNameMin: Cijk_Ailk_Bljk_HBH_MT032x032x24_PGR1_PLR1_TT04_04
    SolutionIndex: 320
    SolutionNameMin: Cijk_Ailk_Bljk_HBH_MT032x032x32_PGR1_PLR1_TT04_04
    SolutionIndex: 321
    SolutionNameMin: Cijk_Ailk_Bljk_HBH_MT064x016x32_PGR1_PLR1_TT02_02
    SolutionIndex: 322
    SolutionNameMin: Cijk_Ailk_Bljk_HBH_MT128x016x32_PGR1_PLR1_TT04_02
    SolutionIndex: 323
    SolutionNameMin: Cijk_Ailk_Bljk_HBH_MT032x008x32_PGR1_PLR1_TT02_02
    SolutionIndex: 324
    SolutionNameMin: Cijk_Ailk_Bljk_HBH_MT064x008x32_PGR1_PLR1_TT02_02
    SolutionIndex: 325
    SolutionNameMin: Cijk_Ailk_Bljk_HBH_MT032x008x64_PGR1_PLR1_TT02_02
    SolutionIndex: 326
    SolutionNameMin: Cijk_Ailk_Bljk_HBH_MT064x008x64_PGR1_PLR1_TT02_02
    SolutionIndex: 327
    SolutionNameMin: Cijk_Ailk_Bljk_HBH_MT064x064x08_PGR1_PLR1_TT04_04
    SolutionIndex: 328
    SolutionNameMin: Cijk_Ailk_Bljk_HBH_MT064x128x08_PGR1_PLR1_TT04_08
    SolutionIndex: 329
    SolutionNameMin: Cijk_Ailk_Bljk_HBH_MT128x064x08_PGR1_PLR1_TT08_04
    SolutionIndex: 330
    SolutionNameMin: Cijk_Ailk_Bljk_HBH_MT064x032x16_PGR0_PLR1_TT08_04
    SolutionIndex: 331
    SolutionNameMin: Cijk_Ailk_Bljk_HBH_MT064x064x16_PGR1_PLR1_TT04_04
    SolutionIndex: 332
    SolutionNameMin: Cijk_Ailk_Bljk_HBH_MT064x128x16_PGR1_PLR1_TT04_08
    SolutionIndex: 333
    SolutionNameMin: Cijk_Ailk_Bljk_HBH_MT128x064x16_PGR1_PLR1_TT08_04
    SolutionIndex: 334
    SolutionNameMin: Cijk_Ailk_Bljk_HBH_MT128x128x16_PGR1_PLR1_TT08_08
    SolutionIndex: 335
    SolutionNameMin: Cijk_Ailk_Bljk_HBH_MT064x032x16_PGR0_PLR0_TT04_04
    SolutionIndex: 336
    SolutionNameMin: Cijk_Ailk_Bljk_HBH_MT064x128x16_PGR0_PLR0_TT04_08
    SolutionIndex: 337
    SolutionNameMin: Cijk_Ailk_Bljk_HBH_MT032x128x16_PGR1_PLR0_TT04_04
    SolutionIndex: 338
    SolutionNameMin: Cijk_Ailk_Bljk_HBH_MT032x128x16_PGR0_PLR0_TT04_04
    SolutionIndex: 339
    SolutionNameMin: Cijk_Ailk_Bljk_HBH_MT064x064x04_PGR1_PLR1_TT04_04
    SolutionIndex: 340
    SolutionNameMin: Cijk_Ailk_Bljk_HBH_MT064x064x08_PGR1_PLR1_TT04_04
    SolutionIndex: 341
    SolutionNameMin: Cijk_Ailk_Bljk_HBH_MT064x064x16_PGR1_PLR1_TT04_04
    SolutionIndex: 342
    SolutionNameMin: Cijk_Ailk_Bljk_HBH_MT032x032x08_PGR0_PLR1_TT04_04
    SolutionIndex: 343
    SolutionNameMin: Cijk_Ailk_Bljk_HBH_MT032x032x16_PGR1_PLR1_TT04_04
    SolutionIndex: 344
    SolutionNameMin: Cijk_Ailk_Bljk_HBH_MT064x016x16_PGR1_PLR1_TT04_04
    SolutionIndex: 345
    SolutionNameMin: Cijk_Ailk_Bljk_HBH_MT064x032x16_PGR1_PLR1_TT04_04
    SolutionIndex: 346
    SolutionNameMin: Cijk_Ailk_Bljk_HBH_MT064x064x16_PGR1_PLR1_TT04_04
    SolutionIndex: 347
    SolutionNameMin: Cijk_Ailk_Bljk_HBH_MT032x032x32_PGR1_PLR1_TT04_04
    SolutionIndex: 348
    SolutionNameMin: Cijk_Ailk_Bljk_HBH_MT064x016x32_PGR1_PLR1_TT04_04
    SolutionIndex: 349
    SolutionNameMin: Cijk_Ailk_Bljk_HBH_MT064x032x32_PGR1_PLR1_TT04_04
    SolutionIndex: 350
    SolutionNameMin: Cijk_Ailk_Bljk_HBH_MT128x016x32_PGR1_PLR1_TT04_04
    SolutionIndex: 351
    SolutionNameMin: Cijk_Ailk_Bljk_HBH_MT128x032x32_PGR1_PLR1_TT04_04
    SolutionIndex: 352
    SolutionNameMin: Cijk_Ailk_Bljk_HBH_MT064x064x16_PGR1_PLR1_TT08_08
    SolutionIndex: 353
    SolutionNameMin: Cijk_Ailk_Bljk_HBH_MT128x128x16_PGR1_PLR1_TT08_08
    SolutionIndex: 354
    SolutionNameMin: Cijk_Ailk_Bljk_HBH_MT032x032x08_PGR1_PLR1_TT04_04
    SolutionIndex: 355
    SolutionNameMin: Cijk_Ailk_Bljk_HBH_MT064x032x08_PGR1_PLR1_TT08_04
    SolutionIndex: 356
    SolutionNameMin: Cijk_Ailk_Bljk_HBH_MT064x064x08_PGR1_PLR1_TT08_08
    SolutionIndex: 357
    SolutionNameMin: Cijk_Ailk_Bljk_HBH_MT128x128x08_PGR1_PLR1_TT08_08
    SolutionIndex: 358
    SolutionNameMin: Cijk_Ailk_Bljk_HBH_MT128x032x16_PGR1_PLR1_TT08_04
    SolutionIndex: 359
    SolutionNameMin: Cijk_Ailk_Bljk_HBH_MT032x032x16_PGR1_PLR1_TT04_04
    SolutionIndex: 360
    SolutionNameMin: Cijk_Ailk_Bljk_HBH_MT064x032x16_PGR1_PLR1_TT08_04
    SolutionIndex: 361
    SolutionNameMin: Cijk_Ailk_Bljk_HBH_MT064x064x16_PGR1_PLR1_TT04_04
    SolutionIndex: 362
    SolutionNameMin: Cijk_Ailk_Bljk_HBH_MT128x064x16_PGR1_PLR1_TT08_04
    SolutionIndex: 363
    SolutionNameMin: Cijk_Ailk_Bljk_HBH_MT128x128x16_PGR1_PLR1_TT08_08
    SolutionIndex: 364
    SolutionNameMin: Cijk_Ailk_Bljk_HBH_MT064x032x16_PGR1_PLR1_TT04_04
    SolutionIndex: 365
    SolutionNameMin: Cijk_Ailk_Bljk_HBH_MT128x032x16_PGR1_PLR1_TT08_04
    SolutionIndex: 366
    SolutionNameMin: Cijk_Ailk_Bljk_HBH_MT128x064x32_PGR1_PLR1_TT08_04
    SolutionIndex: 367
    SolutionNameMin: Cijk_Ailk_Bljk_HBH_MT128x032x32_PGR1_PLR1_TT04_04
    SolutionIndex: 368
    SolutionNameMin: Cijk_Ailk_Bljk_HBH_MT064x016x32_PGR1_PLR1_TT04_04
    SolutionIndex: 369
    SolutionNameMin: Cijk_Ailk_Bljk_HBH_MT064x064x16_PGR1_PLR1_TT08_08
    SolutionIndex: 370
    SolutionNameMin: Cijk_Ailk_Bljk_HBH_MT128x128x16_PGR1_PLR1_TT08_08
    SolutionIndex: 371
    SolutionNameMin: Cijk_Ailk_Bljk_HBH_MT064x064x32_PGR1_PLR1_TT08_08
    SolutionIndex: 372
    SolutionNameMin: Cijk_Ailk_Bljk_HBH_MT128x128x32_PGR1_PLR1_TT08_08
    SolutionIndex: 373
    SolutionNameMin: Cijk_Ailk_Bljk_HBH_MT064x032x16_PGR0_PLR1_TT08_04
    SolutionIndex: 374
    SolutionNameMin: Cijk_Ailk_Bljk_HBH_MT128x128x32_PGR0_PLR1_TT08_08
    SolutionIndex: 375
    SolutionNameMin: Cijk_Ailk_Bljk_HBH_MT064x128x16_PGR1_PLR1_TT04_08
    SolutionIndex: 376
    SolutionNameMin: Cijk_Ailk_Bljk_HBH_MT128x064x16_PGR1_PLR1_TT08_04
    SolutionIndex: 377
    SolutionNameMin: Cijk_Ailk_Bljk_HBH_MT128x128x16_PGR1_PLR1_TT08_08
    SolutionIndex: 378
    SolutionNameMin: Cijk_Ailk_Bljk_HBH_MT128x064x16_PGR1_PLR1_TT04_08
    SolutionIndex: 379
    SolutionNameMin: Cijk_Ailk_Bljk_HBH_MT128x064x16_PGR1_PLR1_TT04_08
    SolutionIndex: 380
    SolutionNameMin: Cijk_Ailk_Bljk_HBH_MT128x064x32_PGR1_PLR1_TT04_04
    SolutionIndex: 381
    SolutionNameMin: Cijk_Ailk_Bljk_HBH_MT256x128x32_PGR1_PLR1_TT08_08
    SolutionIndex: 382
    SolutionNameMin: Cijk_Ailk_Bljk_HBH_MT128x032x16_PGR0_PLR0_TT08_04
    SolutionIndex: 383
    SolutionNameMin: Cijk_Ailk_Bljk_HBH_MT064x128x16_PGR1_PLR0_TT04_08
    SolutionIndex: 384
    SolutionNameMin: Cijk_Ailk_Bljk_HBH_MT128x064x16_PGR1_PLR0_TT08_04
    SolutionIndex: 385
    SolutionNameMin: Cijk_Ailk_Bljk_HBH_MT128x064x16_PGR1_PLR0_TT04_08
    SolutionIndex: 386
    SolutionNameMin: Cijk_Ailk_Bljk_HBH_MT064x128x04_PGR0_PLR0_TT04_08
    SolutionIndex: 387
    SolutionNameMin: Cijk_Ailk_Bljk_HBH_MT064x064x04_PGR0_PLR0_TT04_04
    SolutionIndex: 388
    SolutionNameMin: Cijk_Ailk_Bljk_HBH_MT064x064x04_PGR1_PLR0_TT04_04
    SolutionIndex: 389
    SolutionNameMin: Cijk_Ailk_Bljk_HBH_MT064x064x04_PGR0_PLR1_TT04_04
    SolutionIndex: 390
    SolutionNameMin: Cijk_Ailk_Bljk_HBH_MT064x064x04_PGR1_PLR1_TT04_04
    SolutionIndex: 391
    SolutionNameMin: Cijk_Ailk_Bljk_HBH_MT064x128x08_PGR0_PLR0_TT04_08
    SolutionIndex: 392
    SolutionNameMin: Cijk_Ailk_Bljk_HBH_MT064x064x08_PGR0_PLR0_TT04_04
    SolutionIndex: 393
    SolutionNameMin: Cijk_Ailk_Bljk_HBH_MT064x128x08_PGR1_PLR0_TT04_08
    SolutionIndex: 394
    SolutionNameMin: Cijk_Ailk_Bljk_HBH_MT064x064x08_PGR1_PLR0_TT04_04
    SolutionIndex: 395
    SolutionNameMin: Cijk_Ailk_Bljk_HBH_MT064x128x08_PGR0_PLR1_TT04_08
    SolutionIndex: 396
    SolutionNameMin: Cijk_Ailk_Bljk_HBH_MT064x064x08_PGR0_PLR1_TT04_04
    SolutionIndex: 397
    SolutionNameMin: Cijk_Ailk_Bljk_HBH_MT064x064x08_PGR1_PLR1_TT04_04
    SolutionIndex: 398
    SolutionNameMin: Cijk_Ailk_Bljk_HBH_MT128x128x16_PGR0_PLR0_TT08_08
    SolutionIndex: 399
    SolutionNameMin: Cijk_Ailk_Bljk_HBH_MT064x128x16_PGR0_PLR0_TT04_08
    SolutionIndex: 400
    SolutionNameMin: Cijk_Ailk_Bljk_HBH_MT064x064x16_PGR1_PLR0_TT04_04
    SolutionIndex: 401
    SolutionNameMin: Cijk_Ailk_Bljk_HBH_MT064x064x16_PGR0_PLR1_TT04_04
    SolutionIndex: 402
    SolutionNameMin: Cijk_Ailk_Bljk_HBH_MT064x064x16_PGR1_PLR1_TT04_04
    SolutionIndex: 403
    SolutionNameMin: Cijk_Ailk_Bljk_HBH_MT128x128x04_PGR0_PLR0_TT08_08
    SolutionIndex: 404
    SolutionNameMin: Cijk_Ailk_Bljk_HBH_MT064x128x04_PGR0_PLR0_TT04_08
    SolutionIndex: 405
    SolutionNameMin: Cijk_Ailk_Bljk_HBH_MT064x064x04_PGR0_PLR0_TT04_04
    SolutionIndex: 406
    SolutionNameMin: Cijk_Ailk_Bljk_HBH_MT064x128x04_PGR1_PLR0_TT04_08
    SolutionIndex: 407
    SolutionNameMin: Cijk_Ailk_Bljk_HBH_MT064x064x04_PGR1_PLR0_TT04_04
    SolutionIndex: 408
    SolutionNameMin: Cijk_Ailk_Bljk_HBH_MT064x128x04_PGR0_PLR1_TT04_08
    SolutionIndex: 409
    SolutionNameMin: Cijk_Ailk_Bljk_HBH_MT064x064x04_PGR0_PLR1_TT04_04
    SolutionIndex: 410
    SolutionNameMin: Cijk_Ailk_Bljk_HBH_MT064x128x04_PGR1_PLR1_TT04_08
    SolutionIndex: 411
    SolutionNameMin: Cijk_Ailk_Bljk_HBH_MT064x064x04_PGR1_PLR1_TT04_04
    SolutionIndex: 412
    SolutionNameMin: Cijk_Ailk_Bljk_HBH_MT064x064x08_PGR0_PLR0_TT04_04
    SolutionIndex: 413
    SolutionNameMin: Cijk_Ailk_Bljk_HBH_MT064x128x08_PGR1_PLR0_TT04_08
    SolutionIndex: 414
    SolutionNameMin: Cijk_Ailk_Bljk_HBH_MT064x064x08_PGR1_PLR0_TT04_04
    SolutionIndex: 415
    SolutionNameMin: Cijk_Ailk_Bljk_HBH_MT064x128x08_PGR0_PLR1_TT04_08
    SolutionIndex: 416
    SolutionNameMin: Cijk_Ailk_Bljk_HBH_MT064x064x08_PGR0_PLR1_TT04_04
    SolutionIndex: 417
    SolutionNameMin: Cijk_Ailk_Bljk_HBH_MT064x064x08_PGR1_PLR1_TT04_04
    SolutionIndex: 418
    SolutionNameMin: Cijk_Ailk_Bljk_HBH_MT064x064x16_PGR0_PLR0_TT04_04
    SolutionIndex: 419
    SolutionNameMin: Cijk_Ailk_Bljk_HBH_MT128x128x16_PGR1_PLR0_TT08_08
    SolutionIndex: 420
    SolutionNameMin: Cijk_Ailk_Bljk_HBH_MT064x128x16_PGR1_PLR0_TT04_08
    SolutionIndex: 421
    SolutionNameMin: Cijk_Ailk_Bljk_HBH_MT064x064x16_PGR1_PLR1_TT04_04
    SolutionIndex: 422
    SolutionNameMin: Cijk_Ailk_Bljk_HBH_MT128x064x16_EPS1_GRVW08_LPB00_PGR1_PLR1_SNLL1_TT08_08_VW08_WG16_08_01_WGM01
    SolutionIndex: 423
    SolutionNameMin: Cijk_Ailk_Bljk_HBH_MT064x128x16_EPS1_GRVW04_LPB04_PGR1_PLR1_SNLL1_TT08_04_VW04_WG08_32_01_WGM01
    SolutionIndex: 424
    SolutionNameMin: Cijk_Ailk_Bljk_HBH_MT128x064x16_EPS1_GRVW04_LPB04_PGR1_PLR1_SNLL1_TT08_04_VW04_WG16_16_01_WGM01
    SolutionIndex: 425
    SolutionNameMin: Cijk_Ailk_Bljk_HBH_MT128x128x16_EPS1_GRVW04_LPB04_PGR1_PLR1_SNLL1_TT08_08_VW04_WG16_16_01_WGM01
    SolutionIndex: 426
    SolutionNameMin: Cijk_Ailk_Bljk_HBH_MT064x128x16_EPS1_GRVW04_LPB04_PGR1_PLR1_SNLL1_TT08_04_VW04_WG08_32_01_WGM08
    SolutionIndex: 427
    SolutionNameMin: Cijk_Ailk_Bljk_HBH_MT128x064x16_EPS1_GRVW04_LPB04_PGR1_PLR1_SNLL1_TT08_04_VW04_WG16_16_01_WGM08
    SolutionIndex: 428
    SolutionNameMin: Cijk_Ailk_Bljk_HBH_MT256x064x16_EPS1_GRVW04_LPB04_PGR1_PLR1_SNLL1_TT08_08_VW04_WG32_08_01_WGM64
    SolutionIndex: 429
    SolutionNameMin: Cijk_Ailk_Bljk_HBH_MT064x128x32_EPS0_GRVW04_LPB04_PGR0_PLR0_SNLL0_TT08_04_VW04_WG08_32_01_WGM01
    SolutionIndex: 430
    SolutionNameMin: Cijk_Ailk_Bljk_HBH_MT064x064x32_EPS0_GRVW04_LPB04_PGR0_PLR0_SNLL0_TT04_04_VW04_WG16_16_01_WGM01
    SolutionIndex: 431
    SolutionNameMin: Cijk_Ailk_Bljk_HBH_MT128x064x32_EPS1_GRVW04_LPB04_PGR1_PLR1_SNLL1_TT08_04_VW04_WG16_16_01_WGM01
    SolutionIndex: 432
    SolutionNameMin: Cijk_Ailk_Bljk_HBH_MT064x064x32_EPS0_GRVW04_LPB04_PGR0_PLR0_SNLL0_TT04_04_VW04_WG16_16_01_WGM08
    SolutionIndex: 433
    SolutionNameMin: Cijk_Ailk_Bljk_HBH_MT128x064x32_EPS0_GRVW08_LPB08_PGR0_PLR1_SNLL0_TT08_08_VW08_WG16_08_01_WGM01
    SolutionIndex: 434
    SolutionNameMin: Cijk_Ailk_Bljk_HBH_MT64x128x16_MI32x32x4x2_SE_AF0EM1_ASEM1_GRVW2_ONLL0_SNLL1
    SolutionIndex: 435
    SolutionNameMin: Cijk_Ailk_Bljk_HBH_MT64x128x16_MI32x32x4x2_SE_AF0EM1_ASEM2_GRVW2_ONLL0_SNLL1
    SolutionIndex: 436
    SolutionNameMin: Cijk_Ailk_Bljk_HBH_MT64x128x16_MI32x32x4x2_SE_AF0EM2_ASEM1_GRVW2_ONLL0_SNLL1
    SolutionIndex: 437
    SolutionNameMin: Cijk_Ailk_Bljk_HBH_MT64x128x16_MI32x32x4x2_SE_AF0EM1_ASEM1_GRVW2_ONLL0_SNLL0
    SolutionIndex: 438
    SolutionNameMin: Cijk_Ailk_Bljk_HBH_MT64x128x16_MI32x32x4x2_SE_AF0EM1_ASEM2_GRVW2_ONLL0_SNLL0
    SolutionIndex: 439
    SolutionNameMin: Cijk_Ailk_Bljk_HBH_MT64x128x16_MI32x32x4x2_SE_AF0EM2_ASEM1_GRVW2_ONLL0_SNLL0
    SolutionIndex: 440
    SolutionNameMin: Cijk_Ailk_Bljk_HBH_MT64x128x16_MI32x32x4x2_SE_AF0EM2_ASEM2_GRVW2_ONLL0_SNLL0
    SolutionIndex: 441
    SolutionNameMin: Cijk_Ailk_Bljk_HBH_MT64x128x32_MI32x32x4x2_SE_AF0EM2_ASEM2_GRVW2_ONLL0_SNLL0
    SolutionIndex: 442
    SolutionNameMin: Cijk_Ailk_Bljk_HBH_MT32x256x16_MI32x32x4x2_SE_AF0EM1_ASEM2_GRVW4_ONLL0_SNLL0
    SolutionIndex: 443
    SolutionNameMin: Cijk_Ailk_Bljk_HBH_MT64x128x16_MI32x32x4x2_SE_AF0EM1_ASEM1_GRVW2_ONLL1_SNLL1
    SolutionIndex: 444
    SolutionNameMin: Cijk_Ailk_Bljk_HBH_MT64x128x16_MI32x32x4x2_SE_AF0EM1_ASEM2_GRVW2_ONLL1_SNLL1
    SolutionIndex: 445
    SolutionNameMin: Cijk_Ailk_Bljk_HBH_MT64x128x16_MI32x32x4x2_SE_AF0EM2_ASEM1_GRVW2_ONLL1_SNLL1
    SolutionIndex: 446
    SolutionNameMin: Cijk_Ailk_Bljk_HBH_MT64x128x16_MI32x32x4x2_SE_AF0EM2_ASEM2_GRVW2_ONLL1_SNLL1
    SolutionIndex: 447
    SolutionNameMin: Cijk_Ailk_Bljk_HBH_MT64x128x16_MI32x32x4x2_SE_AF0EM1_ASEM1_GRVW2_ONLL1_SNLL0
    SolutionIndex: 448
    SolutionNameMin: Cijk_Ailk_Bljk_HBH_MT64x128x16_MI32x32x4x2_SE_AF0EM1_ASEM2_GRVW2_ONLL1_SNLL0
    SolutionIndex: 449
    SolutionNameMin: Cijk_Ailk_Bljk_HBH_MT64x128x16_MI32x32x4x2_SE_AF0EM2_ASEM1_GRVW2_ONLL1_SNLL0
    SolutionIndex: 450
    SolutionNameMin: Cijk_Ailk_Bljk_HBH_MT64x128x16_MI32x32x4x2_SE_AF0EM2_ASEM2_GRVW2_ONLL1_SNLL0
    SolutionIndex: 451
    SolutionNameMin: Cijk_Ailk_Bljk_HBH_MT64x128x8_MI32x32x4x2_SE_AF0EM2_ASEM1_GRVW4_ONLL1_SNLL0
    SolutionIndex: 452
    SolutionNameMin: Cijk_Ailk_Bljk_HBH_MT64x128x8_MI32x32x4x2_SE_AF0EM2_ASEM2_GRVW4_ONLL1_SNLL0
    SolutionIndex: 453
    SolutionNameMin: Cijk_Ailk_Bljk_HBH_MT32x256x16_MI32x32x4x2_SE_AF0EM2_ASEM2_GRVW4_ONLL1_SNLL0
    SolutionIndex: 454
    SolutionNameMin: Cijk_Ailk_Bljk_HBH_MT64x256x16_MI32x32x4x2_SE_AF0EM1_ASEM2_GRVW2_ONLL0_SNLL1
    SolutionIndex: 455
    SolutionNameMin: Cijk_Ailk_Bljk_HBH_MT64x256x16_MI32x32x4x2_SE_AF0EM1_ASEM1_GRVW2_ONLL0_SNLL0
    SolutionIndex: 456
    SolutionNameMin: Cijk_Ailk_Bljk_HBH_MT64x256x16_MI32x32x4x2_SE_AF0EM1_ASEM2_GRVW2_ONLL0_SNLL0
    SolutionIndex: 457
    SolutionNameMin: Cijk_Ailk_Bljk_HBH_MT64x256x16_MI32x32x4x2_SE_AF0EM1_ASEM1_GRVW2_ONLL1_SNLL1
    SolutionIndex: 458
    SolutionNameMin: Cijk_Ailk_Bljk_HBH_MT64x256x16_MI32x32x4x2_SE_AF0EM1_ASEM1_GRVW2_ONLL1_SNLL0
    SolutionIndex: 459
    SolutionNameMin: Cijk_Ailk_Bljk_HBH_MT64x256x16_MI32x32x4x2_SE_AF0EM1_ASEM2_GRVW2_ONLL1_SNLL0
    SolutionIndex: 460
    SolutionIndex: 461
    SolutionIndex: 462
    SolutionIndex: 463
    SolutionIndex: 464
    SolutionIndex: 465
    SolutionIndex: 466
    SolutionIndex: 467
    SolutionIndex: 468
    SolutionIndex: 469
    SolutionIndex: 470
    SolutionIndex: 471
    SolutionIndex: 472
    SolutionIndex: 473
    SolutionIndex: 474
    SolutionIndex: 475
    SolutionIndex: 476
    SolutionIndex: 477
    SolutionIndex: 478
    SolutionIndex: 479
    SolutionIndex: 480
    SolutionIndex: 481
    SolutionIndex: 482
    SolutionIndex: 483
    SolutionIndex: 484
    SolutionIndex: 485
    SolutionIndex: 486
    SolutionIndex: 487
    SolutionIndex: 488
    SolutionIndex: 489
    SolutionIndex: 490
    SolutionIndex: 491
    SolutionIndex: 492
    SolutionIndex: 493
    SolutionIndex: 494
    SolutionIndex: 495
    SolutionIndex: 496
    SolutionIndex: 497
    SolutionIndex: 498
    SolutionIndex: 499
    SolutionIndex: 500
    SolutionIndex: 501
    SolutionIndex: 502
    SolutionIndex: 503
    SolutionIndex: 504
    SolutionIndex: 505
    SolutionIndex: 506
    SolutionIndex: 507
    SolutionIndex: 508
    SolutionIndex: 509
    SolutionIndex: 510
    SolutionIndex: 511
    SolutionIndex: 512
    SolutionIndex: 513
    SolutionIndex: 514
    SolutionIndex: 515
    SolutionIndex: 516
    SolutionIndex: 517
    SolutionIndex: 518
    SolutionIndex: 519
    SolutionIndex: 520
    SolutionIndex: 521
    SolutionIndex: 522
    SolutionIndex: 523
    SolutionIndex: 524
    SolutionIndex: 525
    SolutionIndex: 526
    SolutionIndex: 527
    SolutionIndex: 528
    SolutionIndex: 529
    SolutionIndex: 530
    SolutionIndex: 531
    SolutionIndex: 532
    SolutionIndex: 533
    SolutionIndex: 534
    SolutionIndex: 535
    SolutionIndex: 536
    SolutionIndex: 537
    SolutionIndex: 538
    SolutionIndex: 539
    SolutionIndex: 540
    SolutionIndex: 541
    SolutionIndex: 542
    SolutionIndex: 543
    SolutionIndex: 544
    SolutionIndex: 545
    SolutionIndex: 546
    SolutionIndex: 547
    SolutionIndex: 548
    SolutionIndex: 549
    SolutionIndex: 550
    SolutionIndex: 551
    SolutionIndex: 552
    SolutionIndex: 553
    SolutionIndex: 554
    SolutionIndex: 555
    SolutionIndex: 556
    SolutionIndex: 557
    SolutionIndex: 558
    SolutionIndex: 559
    SolutionIndex: 560
    SolutionIndex: 561
    SolutionIndex: 562
    SolutionIndex: 563
    SolutionIndex: 564
    SolutionIndex: 565
    SolutionIndex: 566
    SolutionIndex: 567
    SolutionIndex: 568
    SolutionIndex: 569
    SolutionIndex: 570
    SolutionIndex: 571
    SolutionIndex: 572
    SolutionIndex: 573
- - - [1024, 1024, 1, 3328]
    - [21, 0]
  - - [2944, 4288, 1, 1280]
    - [44, 0]
  - - [2368, 64, 1, 3328]
    - [37, 0]
  - - [2368, 5888, 1, 256]
    - [41, 0]
  - - [256, 704, 1, 1280]
    - [21, 0]
  - - [128, 6784, 1, 3328]
    - [25, 0]
  - - [5888, 1856, 1, 3328]
    - [44, 0]
  - - [5888, 2944, 1, 3328]
    - [44, 0]
  - - [1856, 4288, 1, 256]
    - [40, 0]
  - - [5056, 5056, 1, 3328]
    - [44, 0]
  - - [1408, 5888, 1, 1280]
    - [46, 0]
  - - [1024, 3584, 1, 3328]
    - [44, 0]
  - - [448, 3584, 1, 3328]
    - [44, 0]
  - - [256, 4288, 1, 3328]
    - [44, 0]
  - - [5888, 1408, 1, 1280]
    - [46, 0]
  - - [704, 1856, 1, 3328]
    - [44, 0]
  - - [1024, 2368, 1, 256]
    - [46, 0]
  - - [5056, 6784, 1, 1280]
    - [40, 0]
  - - [1408, 64, 1, 1280]
    - [12, 0]
  - - [448, 1024, 1, 1280]
    - [32, 0]
  - - [5056, 5056, 1, 1280]
    - [44, 0]
  - - [4288, 6784, 1, 256]
    - [41, 0]
  - - [6784, 448, 1, 256]
    - [46, 0]
  - - [5056, 256, 1, 1280]
    - [44, 0]
  - - [5888, 704, 1, 1280]
    - [44, 0]
  - - [3584, 1024, 1, 256]
    - [46, 0]
  - - [6784, 4288, 1, 3328]
    - [44, 0]
  - - [1856, 2368, 1, 3328]
    - [44, 0]
  - - [5888, 2944, 1, 1280]
    - [40, 0]
  - - [5888, 1024, 1, 256]
    - [40, 0]
  - - [448, 64, 1, 1280]
    - [16, 0]
  - - [1024, 704, 1, 256]
    - [18, 0]
  - - [1408, 2944, 1, 256]
    - [46, 0]
  - - [256, 1856, 1, 1280]
    - [21, 0]
  - - [6784, 5056, 1, 3328]
    - [44, 0]
  - - [5056, 5056, 1, 256]
    - [19, 0]
  - - [256, 2944, 1, 3328]
    - [44, 0]
  - - [64, 1024, 1, 1280]
    - [34, 0]
  - - [1024, 3584, 1, 1280]
    - [44, 0]
  - - [2368, 2944, 1, 1280]
    - [44, 0]
  - - [128, 3584, 1, 1280]
    - [2, 0]
  - - [6784, 6784, 1, 1280]
    - [46, 0]
  - - [1024, 256, 1, 3328]
    - [32, 0]
  - - [1408, 4288, 1, 1280]
    - [44, 0]
  - - [3584, 4288, 1, 1280]
    - [44, 0]
  - - [2368, 704, 1, 1280]
    - [44, 0]
  - - [5056, 4288, 1, 3328]
    - [44, 0]
  - - [3584, 2368, 1, 3328]
    - [44, 0]
  - - [5888, 6784, 1, 1280]
    - [40, 0]
  - - [64, 704, 1, 1280]
    - [36, 0]
  - - [4288, 256, 1, 256]
    - [44, 0]
  - - [6784, 448, 1, 1280]
    - [44, 0]
  - - [2944, 5888, 1, 256]
    - [40, 0]
  - - [256, 128, 1, 256]
    - [16, 0]
  - - [4288, 2944, 1, 256]
    - [40, 0]
  - - [5888, 64, 1, 3328]
    - [25, 0]
  - - [2944, 256, 1, 3328]
    - [21, 0]
  - - [5056, 2368, 1, 1280]
    - [40, 0]
  - - [448, 3584, 1, 1280]
    - [44, 0]
  - - [6784, 5888, 1, 256]
    - [41, 0]
  - - [64, 1024, 1, 3328]
    - [34, 0]
  - - [704, 128, 1, 1280]
    - [12, 0]
  - - [1408, 448, 1, 1280]
    - [21, 0]
  - - [1024, 1408, 1, 256]
    - [40, 0]
  - - [2368, 2368, 1, 3328]
    - [44, 0]
  - - [5056, 704, 1, 3328]
    - [44, 0]
  - - [1408, 1856, 1, 256]
    - [46, 0]
  - - [1408, 256, 1, 1280]
    - [21, 0]
  - - [5888, 1856, 1, 256]
    - [46, 0]
  - - [704, 5888, 1, 256]
    - [41, 0]
  - - [6784, 64, 1, 256]
    - [26, 0]
  - - [3584, 704, 1, 3328]
    - [44, 0]
  - - [1408, 1408, 1, 256]
    - [47, 0]
  - - [1024, 64, 1, 1280]
    - [9, 0]
  - - [448, 4288, 1, 256]
    - [22, 0]
  - - [64, 3584, 1, 3328]
    - [29, 0]
  - - [704, 2368, 1, 1280]
    - [44, 0]
  - - [1856, 2368, 1, 1280]
    - [44, 0]
  - - [2368, 128, 1, 3328]
    - [24, 0]
  - - [1408, 1408, 1, 3328]
    - [44, 0]
  - - [2944, 128, 1, 256]
    - [7, 0]
  - - [448, 1408, 1, 256]
    - [44, 0]
  - - [64, 5056, 1, 3328]
    - [6, 0]
  - - [1408, 1024, 1, 1280]
    - [44, 0]
  - - [704, 6784, 1, 256]
    - [40, 0]
  - - [6784, 704, 1, 256]
    - [40, 0]
  - - [256, 3584, 1, 3328]
    - [44, 0]
  - - [5056, 704, 1, 256]
    - [19, 0]
  - - [1408, 3584, 1, 256]
    - [46, 0]
  - - [3584, 4288, 1, 3328]
    - [44, 0]
  - - [5888, 1856, 1, 1280]
    - [46, 0]
  - - [256, 1408, 1, 256]
    - [44, 0]
  - - [5056, 64, 1, 1280]
    - [24, 0]
  - - [2368, 128, 1, 256]
    - [6, 0]
  - - [2368, 3584, 1, 1280]
    - [44, 0]
  - - [1024, 256, 1, 256]
    - [21, 0]
  - - [448, 448, 1, 256]
    - [11, 0]
  - - [2944, 3584, 1, 3328]
    - [44, 0]
  - - [256, 256, 1, 3328]
    - [13, 0]
  - - [128, 1024, 1, 3328]
    - [12, 0]
  - - [6784, 2944, 1, 256]
    - [41, 0]
  - - [64, 1856, 1, 1280]
    - [12, 0]
  - - [448, 256, 1, 256]
    - [13, 0]
  - - [1856, 2368, 1, 256]
    - [40, 0]
  - - [3584, 6784, 1, 3328]
    - [44, 0]
  - - [256, 1024, 1, 256]
    - [21, 0]
  - - [1024, 128, 1, 1280]
    - [12, 0]
  - - [4288, 128, 1, 1280]
    - [4, 0]
  - - [5056, 4288, 1, 1280]
    - [44, 0]
  - - [5888, 64, 1, 256]
    - [7, 0]
  - - [6784, 1856, 1, 3328]
    - [44, 0]
  - - [1408, 5056, 1, 1280]
    - [44, 0]
  - - [1856, 256, 1, 1280]
    - [21, 0]
  - - [64, 5888, 1, 3328]
    - [6, 0]
  - - [6784, 5888, 1, 3328]
    - [44, 0]
  - - [448, 256, 1, 3328]
    - [12, 0]
  - - [2368, 5056, 1, 1280]
    - [44, 0]
  - - [1024, 704, 1, 1280]
    - [21, 0]
  - - [256, 1408, 1, 3328]
    - [21, 0]
  - - [6784, 128, 1, 3328]
    - [25, 0]
  - - [1024, 5056, 1, 1280]
    - [44, 0]
  - - [4288, 1024, 1, 256]
    - [40, 0]
  - - [2368, 1408, 1, 256]
    - [40, 0]
  - - [704, 704, 1, 3328]
    - [21, 0]
  - - [5888, 448, 1, 1280]
    - [44, 0]
  - - [3584, 256, 1, 3328]
    - [21, 0]
  - - [704, 5888, 1, 3328]
    - [44, 0]
  - - [1024, 6784, 1, 1280]
    - [44, 0]
  - - [128, 3584, 1, 3328]
    - [2, 0]
  - - [128, 704, 1, 1280]
    - [12, 0]
  - - [3584, 2944, 1, 1280]
    - [44, 0]
  - - [1856, 128, 1, 3328]
    - [35, 0]
  - - [128, 2944, 1, 1280]
    - [7, 0]
  - - [448, 1856, 1, 1280]
    - [21, 0]
  - - [1408, 5056, 1, 3328]
    - [44, 0]
  - - [1856, 1856, 1, 3328]
    - [44, 0]
  - - [3584, 128, 1, 256]
    - [26, 0]
  - - [448, 1408, 1, 3328]
    - [21, 0]
  - - [2368, 2368, 1, 256]
    - [19, 0]
  - - [4288, 4288, 1, 1280]
    - [40, 0]
  - - [64, 448, 1, 1280]
    - [15, 0]
  - - [5888, 1024, 1, 1280]
    - [44, 0]
  - - [704, 1024, 1, 256]
    - [44, 0]
  - - [704, 6784, 1, 3328]
    - [44, 0]
  - - [5888, 5888, 1, 3328]
    - [44, 0]
  - - [5056, 1024, 1, 1280]
    - [44, 0]
  - - [448, 5888, 1, 3328]
    - [44, 0]
  - - [1024, 2944, 1, 1280]
    - [44, 0]
  - - [5056, 5888, 1, 1280]
    - [41, 0]
  - - [448, 6784, 1, 256]
    - [45, 0]
  - - [256, 3584, 1, 256]
    - [44, 0]
  - - [256, 448, 1, 256]
    - [37, 0]
  - - [3584, 5888, 1, 256]
    - [40, 0]
  - - [2944, 3584, 1, 256]
    - [40, 0]
  - - [1408, 704, 1, 256]
    - [46, 0]
  - - [6784, 1024, 1, 3328]
    - [44, 0]
  - - [6784, 2944, 1, 3328]
    - [44, 0]
  - - [64, 64, 1, 3328]
    - [12, 0]
  - - [6784, 2368, 1, 1280]
    - [46, 0]
  - - [4288, 3584, 1, 256]
    - [40, 0]
  - - [4288, 5888, 1, 1280]
    - [44, 0]
  - - [448, 2944, 1, 3328]
    - [44, 0]
  - - [4288, 1856, 1, 1280]
    - [44, 0]
  - - [1856, 2944, 1, 3328]
    - [44, 0]
  - - [256, 6784, 1, 3328]
    - [44, 0]
  - - [64, 5888, 1, 256]
    - [20, 0]
  - - [5056, 1024, 1, 256]
    - [41, 0]
  - - [704, 64, 1, 3328]
    - [38, 0]
  - - [5056, 1856, 1, 3328]
    - [44, 0]
  - - [448, 448, 1, 3328]
    - [29, 0]
  - - [448, 2368, 1, 1280]
    - [44, 0]
  - - [1408, 128, 1, 1280]
    - [6, 0]
  - - [5056, 256, 1, 3328]
    - [44, 0]
  - - [704, 704, 1, 256]
    - [21, 0]
  - - [1024, 5888, 1, 1280]
    - [44, 0]
  - - [64, 128, 1, 256]
    - [3, 0]
  - - [128, 1856, 1, 1280]
    - [14, 0]
  - - [5056, 3584, 1, 256]
    - [41, 0]
  - - [1856, 1024, 1, 1280]
    - [44, 0]
  - - [1856, 1856, 1, 1280]
    - [44, 0]
  - - [128, 4288, 1, 3328]
    - [4, 0]
  - - [1856, 1024, 1, 3328]
    - [44, 0]
  - - [256, 2368, 1, 256]
    - [44, 0]
  - - [1024, 448, 1, 3328]
    - [21, 0]
  - - [1856, 704, 1, 1280]
    - [44, 0]
  - - [6784, 1024, 1, 256]
    - [40, 0]
  - - [5056, 5888, 1, 3328]
    - [44, 0]
  - - [1856, 1024, 1, 256]
    - [22, 0]
  - - [5056, 1408, 1, 3328]
    - [44, 0]
  - - [1024, 1024, 1, 1280]
    - [21, 0]
  - - [448, 5888, 1, 256]
    - [40, 0]
  - - [1408, 6784, 1, 3328]
    - [44, 0]
  - - [2944, 1408, 1, 3328]
    - [44, 0]
  - - [2944, 4288, 1, 3328]
    - [44, 0]
  - - [256, 2944, 1, 256]
    - [44, 0]
  - - [5056, 2944, 1, 256]
    - [40, 0]
  - - [2368, 1856, 1, 256]
    - [40, 0]
  - - [128, 6784, 1, 1280]
    - [7, 0]
  - - [1408, 3584, 1, 3328]
    - [44, 0]
  - - [2368, 6784, 1, 256]
    - [41, 0]
  - - [4288, 2368, 1, 3328]
    - [44, 0]
  - - [704, 3584, 1, 1280]
    - [44, 0]
  - - [1408, 5888, 1, 3328]
    - [44, 0]
  - - [1856, 5056, 1, 256]
    - [19, 0]
  - - [6784, 6784, 1, 256]
    - [41, 0]
  - - [1408, 704, 1, 3328]
    - [44, 0]
  - - [128, 5888, 1, 1280]
    - [1, 0]
  - - [2368, 4288, 1, 1280]
    - [44, 0]
  - - [3584, 1856, 1, 1280]
    - [44, 0]
  - - [704, 1408, 1, 3328]
    - [44, 0]
  - - [704, 64, 1, 1280]
    - [15, 0]
  - - [3584, 448, 1, 256]
    - [44, 0]
  - - [3584, 3584, 1, 1280]
    - [44, 0]
  - - [256, 6784, 1, 256]
    - [40, 0]
  - - [1856, 3584, 1, 3328]
    - [44, 0]
  - - [128, 448, 1, 256]
    - [34, 0]
  - - [3584, 3584, 1, 256]
    - [40, 0]
  - - [6784, 4288, 1, 1280]
    - [40, 0]
  - - [448, 704, 1, 1280]
    - [21, 0]
  - - [3584, 5056, 1, 256]
    - [46, 0]
  - - [6784, 128, 1, 256]
    - [7, 0]
  - - [64, 1408, 1, 3328]
    - [12, 0]
  - - [704, 448, 1, 256]
    - [21, 0]
  - - [2944, 2368, 1, 1280]
    - [44, 0]
  - - [448, 64, 1, 3328]
    - [39, 0]
  - - [6784, 3584, 1, 256]
    - [41, 0]
  - - [256, 1856, 1, 3328]
    - [32, 0]
  - - [256, 704, 1, 256]
    - [21, 0]
  - - [128, 1408, 1, 256]
    - [6, 0]
  - - [64, 128, 1, 3328]
    - [37, 0]
  - - [1856, 1408, 1, 256]
    - [41, 0]
  - - [2944, 2944, 1, 3328]
    - [44, 0]
  - - [5056, 6784, 1, 256]
    - [41, 0]
  - - [1408, 4288, 1, 3328]
    - [44, 0]
  - - [6784, 256, 1, 1280]
    - [44, 0]
  - - [1024, 704, 1, 3328]
    - [21, 0]
  - - [2368, 704, 1, 3328]
    - [44, 0]
  - - [128, 4288, 1, 256]
    - [4, 0]
  - - [3584, 6784, 1, 256]
    - [40, 0]
  - - [128, 128, 1, 3328]
    - [15, 0]
  - - [5056, 1856, 1, 256]
    - [19, 0]
  - - [704, 4288, 1, 256]
    - [19, 0]
  - - [256, 448, 1, 3328]
    - [12, 0]
  - - [1408, 6784, 1, 1280]
    - [44, 0]
  - - [64, 2368, 1, 1280]
    - [12, 0]
  - - [64, 6784, 1, 3328]
    - [2, 0]
  - - [2944, 256, 1, 1280]
    - [44, 0]
  - - [5056, 2368, 1, 3328]
    - [44, 0]
  - - [2944, 4288, 1, 256]
    - [40, 0]
  - - [1408, 3584, 1, 1280]
    - [44, 0]
  - - [2368, 64, 1, 256]
    - [12, 0]
  - - [256, 256, 1, 256]
    - [13, 0]
  - - [704, 128, 1, 3328]
    - [12, 0]
  - - [1856, 704, 1, 256]
    - [18, 0]
  - - [2368, 6784, 1, 3328]
    - [44, 0]
  - - [5056, 704, 1, 1280]
    - [44, 0]
  - - [1856, 4288, 1, 3328]
    - [44, 0]
  - - [1408, 5888, 1, 256]
    - [41, 0]
  - - [704, 2944, 1, 1280]
    - [44, 0]
  - - [4288, 64, 1, 1280]
    - [27, 0]
  - - [704, 1856, 1, 256]
    - [40, 0]
  - - [3584, 704, 1, 1280]
    - [44, 0]
  - - [5888, 5056, 1, 256]
    - [42, 0]
  - - [3584, 448, 1, 3328]
    - [44, 0]
  - - [704, 2368, 1, 3328]
    - [44, 0]
  - - [2944, 448, 1, 256]
    - [44, 0]
  - - [448, 5056, 1, 3328]
    - [44, 0]
  - - [2368, 128, 1, 1280]
    - [6, 0]
  - - [4288, 448, 1, 256]
    - [22, 0]
  - - [64, 6784, 1, 256]
    - [2, 0]
  - - [64, 5056, 1, 1280]
    - [6, 0]
  - - [5888, 2368, 1, 256]
    - [46, 0]
  - - [704, 448, 1, 3328]
    - [21, 0]
  - - [6784, 704, 1, 3328]
    - [44, 0]
  - - [128, 64, 1, 1280]
    - [28, 0]
  - - [2368, 256, 1, 1280]
    - [21, 0]
  - - [1408, 2944, 1, 3328]
    - [44, 0]
  - - [64, 1024, 1, 256]
    - [13, 0]
  - - [2368, 448, 1, 1280]
    - [21, 0]
  - - [128, 3584, 1, 256]
    - [2, 0]
  - - [1856, 448, 1, 3328]
    - [21, 0]
  - - [128, 5056, 1, 256]
    - [7, 0]
  - - [4288, 4288, 1, 256]
    - [40, 0]
  - - [2368, 704, 1, 256]
    - [40, 0]
  - - [3584, 2368, 1, 256]
    - [40, 0]
  - - [5888, 5056, 1, 1280]
    - [46, 0]
  - - [128, 1024, 1, 1280]
    - [12, 0]
  - - [64, 704, 1, 256]
    - [10, 0]
  - - [4288, 256, 1, 1280]
    - [44, 0]
  - - [3584, 3584, 1, 3328]
    - [44, 0]
  - - [128, 1024, 1, 256]
    - [37, 0]
  - - [5888, 6784, 1, 256]
    - [41, 0]
  - - [4288, 2944, 1, 3328]
    - [44, 0]
  - - [1856, 64, 1, 256]
    - [12, 0]
  - - [4288, 128, 1, 3328]
    - [4, 0]
  - - [256, 5056, 1, 1280]
    - [44, 0]
  - - [6784, 5888, 1, 1280]
    - [44, 0]
  - - [704, 128, 1, 256]
    - [13, 0]
  - - [5888, 4288, 1, 1280]
    - [44, 0]
  - - [448, 256, 1, 1280]
    - [12, 0]
  - - [448, 2368, 1, 3328]
    - [44, 0]
  - - [1, 1, 1, 1280]
    - [54, 0]
  - - [256, 1408, 1, 1280]
    - [21, 0]
  - - [1408, 1856, 1, 1280]
    - [44, 0]
  - - [5888, 448, 1, 3328]
    - [44, 0]
  - - [704, 5888, 1, 1280]
    - [44, 0]
  - - [256, 64, 1, 3328]
    - [38, 0]
  - - [128, 2368, 1, 256]
    - [6, 0]
  - - [6784, 64, 1, 3328]
    - [26, 0]
  - - [5056, 2944, 1, 3328]
    - [44, 0]
  - - [448, 128, 1, 256]
    - [34, 0]
  - - [1856, 128, 1, 1280]
    - [35, 0]
  - - [448, 4288, 1, 1280]
    - [44, 0]
  - - [64, 3584, 1, 256]
    - [11, 0]
  - - [128, 2944, 1, 3328]
    - [25, 0]
  - - [3584, 704, 1, 256]
    - [46, 0]
  - - [2944, 448, 1, 3328]
    - [44, 0]
  - - [3584, 1408, 1, 3328]
    - [44, 0]
  - - [2368, 1024, 1, 1280]
    - [44, 0]
  - - [2944, 6784, 1, 1280]
    - [44, 0]
  - - [1856, 6784, 1, 256]
    - [40, 0]
  - - [4288, 448, 1, 3328]
    - [44, 0]
  - - [6784, 704, 1, 1280]
    - [44, 0]
  - - [5888, 1024, 1, 3328]
    - [44, 0]
  - - [704, 6784, 1, 1280]
    - [44, 0]
  - - [5888, 128, 1, 256]
    - [21, 0]
  - - [5056, 1024, 1, 3328]
    - [44, 0]
  - - [704, 5056, 1, 1280]
    - [44, 0]
  - - [64, 704, 1, 3328]
    - [15, 0]
  - - [2944, 1856, 1, 256]
    - [40, 0]
  - - [5056, 64, 1, 256]
    - [6, 0]
  - - [5888, 5056, 1, 3328]
    - [46, 0]
  - - [128, 5056, 1, 3328]
    - [7, 0]
  - - [3584, 6784, 1, 1280]
    - [40, 0]
  - - [1856, 5888, 1, 256]
    - [41, 0]
  - - [64, 448, 1, 3328]
    - [39, 0]
  - - [4288, 4288, 1, 3328]
    - [44, 0]
  - - [4288, 1408, 1, 1280]
    - [44, 0]
  - - [64, 1856, 1, 256]
    - [12, 0]
  - - [4288, 2368, 1, 256]
    - [40, 0]
  - - [2944, 5056, 1, 1280]
    - [40, 0]
  - - [256, 4288, 1, 1280]
    - [44, 0]
  - - [6784, 2368, 1, 3328]
    - [44, 0]
  - - [256, 1024, 1, 1280]
    - [21, 0]
  - - [4288, 128, 1, 256]
    - [4, 0]
  - - [4288, 1856, 1, 3328]
    - [44, 0]
  - - [1856, 2944, 1, 1280]
    - [44, 0]
  - - [3584, 64, 1, 1280]
    - [14, 0]
  - - [4288, 6784, 1, 3328]
    - [44, 0]
  - - [3584, 1024, 1, 1280]
    - [44, 0]
  - - [1024, 4288, 1, 256]
    - [40, 0]
  - - [5888, 3584, 1, 3328]
    - [44, 0]
  - - [5056, 3584, 1, 3328]
    - [44, 0]
  - - [1408, 128, 1, 3328]
    - [6, 0]
  - - [2368, 1408, 1, 1280]
    - [44, 0]
  - - [5056, 2944, 1, 1280]
    - [40, 0]
  - - [3584, 256, 1, 256]
    - [44, 0]
  - - [1024, 6784, 1, 256]
    - [40, 0]
  - - [2944, 5056, 1, 3328]
    - [44, 0]
  - - [3584, 2944, 1, 256]
    - [40, 0]
  - - [448, 128, 1, 3328]
    - [13, 0]
  - - [64, 2944, 1, 3328]
    - [24, 0]
  - - [64, 4288, 1, 3328]
    - [27, 0]
  - - [5056, 6784, 1, 3328]
    - [44, 0]
  - - [128, 2944, 1, 256]
    - [7, 0]
  - - [3584, 4288, 1, 256]
    - [40, 0]
  - - [1856, 6784, 1, 3328]
    - [44, 0]
  - - [3584, 128, 1, 3328]
    - [26, 0]
  - - [128, 256, 1, 1280]
    - [16, 0]
  - - [64, 448, 1, 256]
    - [16, 0]
  - - [64, 256, 1, 1280]
    - [15, 0]
  - - [5056, 1408, 1, 1280]
    - [46, 0]
  - - [5888, 5888, 1, 256]
    - [41, 0]
  - - [4288, 1024, 1, 1280]
    - [44, 0]
  - - [5888, 128, 1, 3328]
    - [1, 0]
  - - [448, 6784, 1, 3328]
    - [44, 0]
  - - [2944, 1408, 1, 1280]
    - [44, 0]
  - - [64, 128, 1, 1280]
    - [12, 0]
  - - [2944, 1856, 1, 3328]
    - [44, 0]
  - - [448, 5056, 1, 256]
    - [40, 0]
  - - [64, 64, 1, 256]
    - [3, 0]
  - - [3584, 5888, 1, 1280]
    - [40, 0]
  - - [6784, 1856, 1, 1280]
    - [40, 0]
  - - [5888, 256, 1, 3328]
    - [44, 0]
  - - [1856, 5888, 1, 3328]
    - [44, 0]
  - - [3584, 1408, 1, 256]
    - [46, 0]
  - - [704, 3584, 1, 3328]
    - [44, 0]
  - - [5056, 448, 1, 1280]
    - [44, 0]
  - - [3584, 1856, 1, 3328]
    - [44, 0]
  - - [1408, 704, 1, 1280]
    - [21, 0]
  - - [2944, 1024, 1, 256]
    - [46, 0]
  - - [448, 1408, 1, 1280]
    - [21, 0]
  - - [2368, 4288, 1, 3328]
    - [44, 0]
  - - [1024, 1408, 1, 1280]
    - [44, 0]
  - - [256, 128, 1, 1280]
    - [16, 0]
  - - [704, 1408, 1, 1280]
    - [21, 0]
  - - [6784, 5056, 1, 256]
    - [42, 0]
  - - [4288, 5888, 1, 256]
    - [41, 0]
  - - [448, 2944, 1, 256]
    - [40, 0]
  - - [2944, 6784, 1, 256]
    - [40, 0]
  - - [2368, 2368, 1, 1280]
    - [44, 0]
  - - [1856, 3584, 1, 1280]
    - [44, 0]
  - - [64, 2944, 1, 256]
    - [6, 0]
  - - [3584, 1408, 1, 1280]
    - [44, 0]
  - - [5056, 3584, 1, 1280]
    - [46, 0]
  - - [256, 5888, 1, 256]
    - [46, 0]
  - - [128, 256, 1, 3328]
    - [16, 0]
  - - [1856, 1408, 1, 3328]
    - [44, 0]
  - - [1024, 4288, 1, 3328]
    - [44, 0]
  - - [448, 2368, 1, 256]
    - [44, 0]
  - - [64, 1408, 1, 1280]
    - [12, 0]
  - - [64, 6784, 1, 1280]
    - [26, 0]
  - - [2944, 2368, 1, 3328]
    - [44, 0]
  - - [704, 4288, 1, 3328]
    - [44, 0]
  - - [1024, 1856, 1, 1280]
    - [44, 0]
  - - [6784, 1856, 1, 256]
    - [40, 0]
  - - [128, 2368, 1, 3328]
    - [6, 0]
  - - [1024, 5888, 1, 256]
    - [40, 0]
  - - [64, 2944, 1, 1280]
    - [24, 0]
  - - [5056, 64, 1, 3328]
    - [24, 0]
  - - [1408, 2368, 1, 256]
    - [40, 0]
  - - [2944, 704, 1, 3328]
    - [44, 0]
  - - [256, 64, 1, 256]
    - [15, 0]
  - - [2944, 2944, 1, 1280]
    - [46, 0]
  - - [6784, 256, 1, 3328]
    - [44, 0]
  - - [1408, 5056, 1, 256]
    - [46, 0]
  - - [5056, 128, 1, 3328]
    - [25, 0]
  - - [128, 128, 1, 1280]
    - [15, 0]
  - - [448, 704, 1, 256]
    - [44, 0]
  - - [1856, 256, 1, 3328]
    - [32, 0]
  - - [2944, 128, 1, 3328]
    - [25, 0]
  - - [704, 256, 1, 256]
    - [21, 0]
  - - [256, 448, 1, 1280]
    - [12, 0]
  - - [704, 256, 1, 1280]
    - [33, 0]
  - - [64, 2368, 1, 3328]
    - [37, 0]
  - - [256, 704, 1, 3328]
    - [32, 0]
  - - [1024, 1024, 1, 256]
    - [21, 0]
  - - [1408, 4288, 1, 256]
    - [46, 0]
  - - [5888, 2368, 1, 1280]
    - [46, 0]
  - - [128, 256, 1, 256]
    - [10, 0]
  - - [256, 64, 1, 1280]
    - [15, 0]
  - - [2368, 5888, 1, 1280]
    - [40, 0]
  - - [5888, 256, 1, 1280]
    - [44, 0]
  - - [704, 1024, 1, 1280]
    - [44, 0]
  - - [2368, 1856, 1, 3328]
    - [44, 0]
  - - [2944, 704, 1, 256]
    - [22, 0]
  - - [2368, 6784, 1, 1280]
    - [41, 0]
  - - [2368, 1024, 1, 3328]
    - [44, 0]
  - - [1856, 4288, 1, 1280]
    - [44, 0]
  - - [704, 3584, 1, 256]
    - [40, 0]
  - - [704, 2944, 1, 3328]
    - [44, 0]
  - - [1856, 5056, 1, 3328]
    - [44, 0]
  - - [3584, 5056, 1, 1280]
    - [46, 0]
  - - [2944, 1024, 1, 3328]
    - [44, 0]
  - - [256, 4288, 1, 256]
    - [44, 0]
  - - [2368, 256, 1, 256]
    - [44, 0]
  - - [1408, 6784, 1, 256]
    - [40, 0]
  - - [6784, 1408, 1, 3328]
    - [44, 0]
  - - [1024, 2368, 1, 1280]
    - [44, 0]
  - - [704, 64, 1, 256]
    - [12, 0]
  - - [256, 2368, 1, 3328]
    - [21, 0]
  - - [6784, 2944, 1, 1280]
    - [44, 0]
  - - [3584, 448, 1, 1280]
    - [44, 0]
  - - [2944, 6784, 1, 3328]
    - [44, 0]
  - - [448, 5056, 1, 1280]
    - [44, 0]
  - - [4288, 5056, 1, 1280]
    - [40, 0]
  - - [128, 448, 1, 1280]
    - [34, 0]
  - - [4288, 704, 1, 256]
    - [19, 0]
  - - [64, 64, 1, 1280]
    - [34, 0]
  - - [5888, 704, 1, 256]
    - [46, 0]
  - - [256, 5888, 1, 3328]
    - [44, 0]
  - - [6784, 4288, 1, 256]
    - [42, 0]
  - - [5888, 256, 1, 256]
    - [40, 0]
  - - [6784, 1024, 1, 1280]
    - [44, 0]
  - - [704, 448, 1, 1280]
    - [21, 0]
  - - [128, 64, 1, 3328]
    - [12, 0]
  - - [448, 64, 1, 256]
    - [37, 0]
  - - [2944, 704, 1, 1280]
    - [44, 0]
  - - [6784, 3584, 1, 1280]
    - [40, 0]
  - - [2944, 64, 1, 1280]
    - [6, 0]
  - - [1408, 2944, 1, 1280]
    - [44, 0]
  - - [256, 1856, 1, 256]
    - [44, 0]
  - - [1408, 2368, 1, 3328]
    - [44, 0]
  - - [128, 1408, 1, 3328]
    - [6, 0]
  - - [2368, 2944, 1, 256]
    - [40, 0]
  - - [64, 5056, 1, 256]
    - [6, 0]
  - - [1408, 256, 1, 3328]
    - [32, 0]
  - - [3584, 1856, 1, 256]
    - [46, 0]
  - - [4288, 3584, 1, 1280]
    - [40, 0]
  - - [2368, 448, 1, 256]
    - [21, 0]
  - - [4288, 256, 1, 3328]
    - [44, 0]
  - - [1408, 64, 1, 256]
    - [13, 0]
  - - [4288, 2944, 1, 1280]
    - [44, 0]
  - - [5056, 448, 1, 3328]
    - [44, 0]
  - - [1024, 64, 1, 256]
    - [13, 0]
  - - [64, 2368, 1, 256]
    - [12, 0]
  - - [4288, 5056, 1, 3328]
    - [44, 0]
  - - [2944, 256, 1, 256]
    - [18, 0]
  - - [1024, 128, 1, 3328]
    - [37, 0]
  - - [256, 5056, 1, 3328]
    - [44, 0]
  - - [5056, 2368, 1, 256]
    - [19, 0]
  - - [4288, 704, 1, 3328]
    - [44, 0]
  - - [448, 3584, 1, 256]
    - [40, 0]
  - - [2368, 64, 1, 1280]
    - [12, 0]
  - - [1024, 1408, 1, 3328]
    - [44, 0]
  - - [2944, 5888, 1, 1280]
    - [40, 0]
  - - [5888, 3584, 1, 256]
    - [41, 0]
  - - [1408, 1856, 1, 3328]
    - [44, 0]
  - - [6784, 1408, 1, 1280]
    - [44, 0]
  - - [704, 2944, 1, 256]
    - [22, 0]
  - - [4288, 64, 1, 256]
    - [5, 0]
  - - [2944, 5888, 1, 3328]
    - [44, 0]
  - - [64, 4288, 1, 1280]
    - [5, 0]
  - - [6784, 64, 1, 1280]
    - [2, 0]
  - - [704, 1856, 1, 1280]
    - [44, 0]
  - - [1408, 64, 1, 3328]
    - [12, 0]
  - - [1408, 1408, 1, 1280]
    - [44, 0]
  - - [448, 1024, 1, 3328]
    - [32, 0]
  - - [448, 4288, 1, 3328]
    - [44, 0]
  - - [704, 2368, 1, 256]
    - [40, 0]
  - - [2944, 448, 1, 1280]
    - [21, 0]
  - - [5888, 2368, 1, 3328]
    - [44, 0]
  - - [4288, 5056, 1, 256]
    - [40, 0]
  - - [4288, 448, 1, 1280]
    - [44, 0]
  - - [5888, 704, 1, 3328]
    - [44, 0]
  - - [4288, 3584, 1, 3328]
    - [44, 0]
  - - [2944, 64, 1, 256]
    - [6, 0]
  - - [1024, 6784, 1, 3328]
    - [44, 0]
  - - [1408, 1024, 1, 256]
    - [44, 0]
  - - [448, 1024, 1, 256]
    - [44, 0]
  - - [6784, 6784, 1, 3328]
    - [46, 0]
  - - [1024, 448, 1, 1280]
    - [32, 0]
  - - [704, 5056, 1, 3328]
    - [44, 0]
  - - [256, 2368, 1, 1280]
    - [21, 0]
  - - [3584, 5056, 1, 3328]
    - [46, 0]
  - - [2368, 2944, 1, 3328]
    - [44, 0]
  - - [448, 448, 1, 1280]
    - [29, 0]
  - - [2368, 3584, 1, 256]
    - [40, 0]
  - - [1024, 256, 1, 1280]
    - [44, 0]
  - - [128, 5056, 1, 1280]
    - [7, 0]
  - - [3584, 2368, 1, 1280]
    - [44, 0]
  - - [1856, 1856, 1, 256]
    - [46, 0]
  - - [4288, 1408, 1, 3328]
    - [44, 0]
  - - [3584, 64, 1, 3328]
    - [29, 0]
  - - [1, 1, 1, 1]
    - [52, 0]
  - - [256, 1024, 1, 3328]
    - [32, 0]
  - - [1856, 64, 1, 3328]
    - [12, 0]
  - - [5888, 1408, 1, 3328]
    - [44, 0]
  - - [256, 5056, 1, 256]
    - [40, 0]
  - - [1856, 64, 1, 1280]
    - [37, 0]
  - - [1408, 256, 1, 256]
    - [44, 0]
  - - [2368, 5056, 1, 256]
    - [19, 0]
  - - [128, 5888, 1, 3328]
    - [44, 0]
  - - [1024, 5056, 1, 256]
    - [46, 0]
  - - [2368, 1408, 1, 3328]
    - [44, 0]
  - - [5888, 448, 1, 256]
    - [40, 0]
  - - [6784, 5056, 1, 1280]
    - [44, 0]
  - - [4288, 6784, 1, 1280]
    - [40, 0]
  - - [2368, 448, 1, 3328]
    - [44, 0]
  - - [1024, 128, 1, 256]
    - [13, 0]
  - - [448, 128, 1, 1280]
    - [13, 0]
  - - [1024, 64, 1, 3328]
    - [34, 0]
  - - [64, 3584, 1, 1280]
    - [29, 0]
  - - [6784, 1408, 1, 256]
    - [40, 0]
  - - [5888, 4288, 1, 256]
    - [40, 0]
  - - [5056, 5888, 1, 256]
    - [41, 0]
  - - [2368, 1024, 1, 256]
    - [40, 0]
  - - [1856, 6784, 1, 1280]
    - [40, 0]
  - - [3584, 128, 1, 1280]
    - [26, 0]
  - - [128, 64, 1, 256]
    - [3, 0]
  - - [1408, 448, 1, 256]
    - [44, 0]
  - - [64, 256, 1, 3328]
    - [15, 0]
  - - [6784, 448, 1, 3328]
    - [44, 0]
  - - [5056, 1856, 1, 1280]
    - [44, 0]
  - - [1408, 1024, 1, 3328]
    - [44, 0]
  - - [2368, 256, 1, 3328]
    - [21, 0]
  - - [5888, 3584, 1, 1280]
    - [40, 0]
  - - [5888, 128, 1, 1280]
    - [21, 0]
  - - [1024, 2944, 1, 256]
    - [46, 0]
  - - [448, 6784, 1, 1280]
    - [44, 0]
  - - [256, 3584, 1, 1280]
    - [21, 0]
  - - [704, 5056, 1, 256]
    - [19, 0]
  - - [3584, 1024, 1, 3328]
    - [44, 0]
  - - [2944, 1856, 1, 1280]
    - [44, 0]
  - - [5056, 256, 1, 256]
    - [18, 0]
  - - [128, 5888, 1, 256]
    - [1, 0]
  - - [2368, 3584, 1, 3328]
    - [44, 0]
  - - [3584, 5888, 1, 3328]
    - [44, 0]
  - - [2944, 3584, 1, 1280]
    - [44, 0]
  - - [1856, 5888, 1, 1280]
    - [44, 0]
  - - [256, 256, 1, 1280]
    - [34, 0]
  - - [4288, 1408, 1, 256]
    - [41, 0]
  - - [3584, 64, 1, 256]
    - [23, 0]
  - - [64, 1856, 1, 3328]
    - [12, 0]
  - - [1408, 128, 1, 256]
    - [24, 0]
  - - [4288, 2368, 1, 1280]
    - [44, 0]
  - - [2944, 5056, 1, 256]
    - [40, 0]
  - - [256, 128, 1, 3328]
    - [16, 0]
  - - [6784, 2368, 1, 256]
    - [42, 0]
  - - [1408, 448, 1, 3328]
    - [21, 0]
  - - [4288, 1856, 1, 256]
    - [40, 0]
  - - [1856, 2944, 1, 256]
    - [40, 0]
  - - [64, 5888, 1, 1280]
    - [20, 0]
  - - [1856, 1408, 1, 1280]
    - [44, 0]
  - - [128, 704, 1, 256]
    - [9, 0]
  - - [1024, 4288, 1, 1280]
    - [44, 0]
  - - [2368, 5056, 1, 3328]
    - [44, 0]
  - - [4288, 1024, 1, 3328]
    - [44, 0]
  - - [1024, 5056, 1, 3328]
    - [44, 0]
  - - [1024, 1856, 1, 3328]
    - [44, 0]
  - - [704, 704, 1, 1280]
    - [21, 0]
  - - [128, 2368, 1, 1280]
    - [6, 0]
  - - [3584, 256, 1, 1280]
    - [21, 0]
  - - [5888, 64, 1, 1280]
    - [25, 0]
  - - [128, 704, 1, 3328]
    - [37, 0]
  - - [3584, 2944, 1, 3328]
    - [44, 0]
  - - [128, 1856, 1, 256]
    - [23, 0]
  - - [64, 4288, 1, 256]
    - [5, 0]
  - - [5888, 2944, 1, 256]
    - [40, 0]
  - - [5056, 128, 1, 1280]
    - [7, 0]
  - - [448, 1856, 1, 3328]
    - [21, 0]
  - - [5056, 4288, 1, 256]
    - [40, 0]
  - - [1024, 448, 1, 256]
    - [21, 0]
  - - [1024, 3584, 1, 256]
    - [46, 0]
  - - [2944, 128, 1, 1280]
    - [25, 0]
  - - [64, 256, 1, 256]
    - [9, 0]
  - - [704, 256, 1, 3328]
    - [33, 0]
  - - [5056, 1408, 1, 256]
    - [41, 0]
  - - [5888, 5888, 1, 1280]
    - [44, 0]
  - - [448, 5888, 1, 1280]
    - [44, 0]
  - - [1, 1, 1, 256]
    - [53, 0]
  - - [4288, 704, 1, 1280]
    - [44, 0]
  - - [2944, 1408, 1, 256]
    - [42, 0]
  - - [256, 2944, 1, 1280]
    - [44, 0]
  - - [2368, 5888, 1, 3328]
    - [44, 0]
  - - [704, 1024, 1, 3328]
    - [21, 0]
  - - [2368, 1856, 1, 1280]
    - [44, 0]
  - - [1856, 448, 1, 1280]
    - [21, 0]
  - - [128, 6784, 1, 256]
    - [7, 0]
  - - [5888, 4288, 1, 3328]
    - [44, 0]
  - - [1856, 128, 1, 256]
    - [4, 0]
  - - [5056, 448, 1, 256]
    - [40, 0]
  - - [1856, 5056, 1, 1280]
    - [44, 0]
  - - [2944, 1024, 1, 1280]
    - [44, 0]
  - - [2368, 4288, 1, 256]
    - [40, 0]
  - - [1024, 2368, 1, 3328]
    - [44, 0]
  - - [4288, 64, 1, 3328]
    - [27, 0]
  - - [704, 1408, 1, 256]
    - [44, 0]
  - - [4288, 5888, 1, 3328]
    - [44, 0]
  - - [448, 2944, 1, 1280]
    - [44, 0]
  - - [1024, 2944, 1, 3328]
    - [44, 0]
  - - [256, 6784, 1, 1280]
    - [44, 0]
  - - [1856, 3584, 1, 256]
    - [41, 0]
  - - [128, 448, 1, 3328]
    - [9, 0]
  - - [1856, 256, 1, 256]
    - [21, 0]
  - - [5056, 128, 1, 256]
    - [7, 0]
  - - [256, 5888, 1, 1280]
    - [44, 0]
  - - [6784, 128, 1, 1280]
    - [25, 0]
  - - [64, 1408, 1, 256]
    - [12, 0]
  - - [2944, 2368, 1, 256]
    - [40, 0]
  - - [1856, 448, 1, 256]
    - [44, 0]
  - - [1024, 1856, 1, 256]
    - [22, 0]
  - - [6784, 3584, 1, 3328]
    - [44, 0]
  - - [2944, 64, 1, 3328]
    - [6, 0]
  - - [1024, 5888, 1, 3328]
    - [44, 0]
  - - [1408, 2368, 1, 1280]
    - [44, 0]
  - - [128, 1408, 1, 1280]
    - [6, 0]
  - - [128, 1856, 1, 3328]
    - [35, 0]
  - - [2944, 2944, 1, 256]
    - [41, 0]
  - - [6784, 256, 1, 256]
    - [40, 0]
  - - [128, 4288, 1, 1280]
    - [4, 0]
  - - [5888, 1408, 1, 256]
    - [46, 0]
  - - [128, 128, 1, 256]
    - [8, 0]
  - - [448, 704, 1, 3328]
    - [21, 0]
  - - [448, 1856, 1, 256]
    - [40, 0]
  - - [1856, 704, 1, 3328]
    - [44, 0]
  - - [5888, 6784, 1, 3328]
    - [44, 0]
  - - [704, 4288, 1, 1280]
    - [44, 0]
  - - [4096, 7000, 1, 4096]
    - [83, 0]
  - - [5124, 9124, 1, 1760]
    - [82, 0]
  - - [1760, 32, 1, 1760]
    - [61, 0]
  - - [1024, 1500, 1, 1536]
    - [75, 0]
  - - [512, 24000, 1, 2048]
    - [85, 0]
  - - [3072, 24000, 1, 1024]
    - [83, 0]
  - - [1024, 3000, 1, 2560]
    - [83, 0]
  - - [512, 3136, 1, 2048]
    - [94, 0]
  - - [7680, 4, 1, 2560]
    - [61, 0]
  - - [64, 193600, 1, 64]
    - [82, 0]
  - - [8448, 1500, 1, 2816]
    - [82, 0]
  - - [2560, 7000, 1, 2560]
    - [82, 0]
  - - [3072, 16, 1, 1024]
    - [56, 0]
  - - [512, 48000, 1, 2048]
    - [85, 0]
  - - [1760, 64, 1, 1760]
    - [77, 0]
  - - [1024, 16, 1, 512]
    - [58, 0]
  - - [196, 256, 64, 1024]
    - [95, 0]
  - - [512, 48000, 1, 1536]
    - [83, 0]
  - - [2560, 32, 1, 2560]
    - [61, 0]
  - - [4608, 1500, 1, 1536]
    - [83, 0]
  - - [2048, 128, 1, 2048]
    - [80, 0]
  - - [1024, 24000, 1, 2560]
    - [82, 0]
  - - [4608, 3000, 1, 1536]
    - [83, 0]
  - - [5124, 9124, 1, 2048]
    - [83, 0]
  - - [2048, 16, 1, 2048]
    - [60, 0]
  - - [1024, 700, 1, 512]
    - [74, 0]
  - - [3072, 1, 1, 128]
    - [56, 0]
  - - [5124, 700, 1, 2560]
    - [83, 0]
  - - [8448, 16, 1, 2816]
    - [57, 0]
  - - [6144, 6000, 1, 2560]
    - [76, 0]
  - - [4608, 32, 1, 1536]
    - [56, 0]
  - - [3072, 64, 1, 1024]
    - [72, 0]
  - - [512, 16, 1, 512]
    - [58, 0]
  - - [7680, 2, 1, 2560]
    - [61, 0]
  - - [4224, 1, 1, 128]
    - [56, 0]
  - - [7680, 1, 1, 2560]
    - [61, 0]
  - - [128, 1500, 1, 1280]
    - [56, 0]
  - - [1024, 1500, 1, 2816]
    - [75, 0]
  - - [6144, 2, 1, 2560]
    - [61, 0]
  - - [8448, 48000, 1, 2816]
    - [83, 0]
  - - [512, 6000, 1, 2048]
    - [87, 0]
  - - [4224, 1500, 1, 176]
    - [68, 0]
  - - [1024, 6000, 1, 2816]
    - [82, 0]
  - - [1024, 48000, 1, 1536]
    - [83, 0]
  - - [1024, 48000, 1, 2560]
    - [82, 0]
  - - [4096, 32, 1, 4096]
    - [62, 0]
  - - [512, 16, 1, 500000]
    - [58, 0]
  - - [2560, 128, 1, 2560]
    - [77, 0]
  - - [4608, 24000, 1, 1536]
    - [82, 0]
  - - [512, 2, 1, 500000]
    - [58, 0]
  - - [7680, 48000, 1, 2560]
    - [83, 0]
  - - [3072, 48000, 1, 1024]
    - [83, 0]
  - - [1760, 16, 1, 1760]
    - [56, 0]
  - - [1024, 1500, 1, 2048]
    - [79, 0]
  - - [1024, 16, 1, 500000]
    - [58, 0]
  - - [64, 193600, 1, 256]
    - [88, 0]
  - - [1024, 3000, 1, 2048]
    - [84, 0]
  - - [6144, 4, 1, 2560]
    - [61, 0]
  - - [1024, 6000, 1, 2048]
    - [85, 0]
  - - [512, 24000, 1, 2816]
    - [82, 0]
  - - [6144, 48000, 1, 2560]
    - [85, 0]
  - - [1760, 7000, 1, 1760]
    - [69, 0]
  - - [8448, 3000, 1, 2816]
    - [82, 0]
  - - [3072, 4, 1, 1024]
    - [56, 0]
  - - [4608, 48000, 1, 1536]
    - [82, 0]
  - - [2048, 32, 1, 2048]
    - [81, 0]
  - - [7680, 1500, 1, 2560]
    - [83, 0]
  - - [4096, 128, 1, 4096]
    - [73, 0]
  - - [4608, 16, 1, 1536]
    - [61, 0]
  - - [512, 3000, 1, 1536]
    - [75, 0]
  - - [3072, 2, 1, 1024]
    - [56, 0]
  - - [8448, 1, 1, 2816]
    - [57, 0]
  - - [1024, 3000, 1, 2816]
    - [82, 0]
  - - [128, 1, 1, 1408]
    - [56, 0]
  - - [64, 1, 1, 1216]
    - [58, 0]
  - - [1024, 2, 1, 512]
    - [58, 0]
  - - [1024, 4, 1, 500000]
    - [58, 0]
  - - [6144, 1, 1, 2560]
    - [61, 0]
  - - [5124, 9124, 1, 2560]
    - [83, 0]
  - - [512, 48000, 1, 2816]
    - [82, 0]
  - - [512, 3000, 1, 2816]
    - [75, 0]
  - - [1024, 24000, 1, 1536]
    - [83, 0]
  - - [7680, 6000, 1, 2560]
    - [82, 0]
  - - [1760, 128, 1, 1760]
    - [80, 0]
  - - [512, 1500, 1, 2816]
    - [74, 0]
  - - [512, 1, 1, 512]
    - [63, 0]
  - - [512, 6000, 1, 2560]
    - [83, 0]
  - - [512, 8, 1, 500000]
    - [58, 0]
  - - [512, 24000, 1, 2560]
    - [83, 0]
  - - [6144, 3000, 1, 2560]
    - [85, 0]
  - - [1024, 24000, 1, 2816]
    - [82, 0]
  - - [2048, 7000, 1, 2048]
    - [85, 0]
  - - [7680, 3000, 1, 2560]
    - [76, 0]
  - - [1024, 4, 1, 512]
    - [58, 0]
  - - [5124, 700, 1, 2048]
    - [85, 0]
  - - [5124, 9124, 1, 4096]
    - [76, 0]
  - - [4096, 64, 1, 4096]
    - [81, 0]
  - - [256, 193600, 1, 64]
    - [65, 0]
  - - [7680, 32, 1, 2560]
    - [64, 0]
  - - [2560, 64, 1, 2560]
    - [72, 0]
  - - [3072, 128, 1, 1024]
    - [77, 0]
  - - [8448, 6000, 1, 2816]
    - [83, 0]
  - - [7680, 64, 1, 2560]
    - [58, 0]
  - - [5124, 1500, 1, 2560]
    - [83, 0]
  - - [1024, 1500, 1, 2560]
    - [75, 0]
  - - [512, 4, 1, 512]
    - [63, 0]
  - - [1024, 6000, 1, 2560]
    - [83, 0]
  - - [3072, 32, 1, 1024]
    - [81, 0]
  - - [6144, 32, 1, 2560]
    - [72, 0]
  - - [196, 1024, 64, 256]
    - [98, 0]
  - - [512, 50176, 1, 128]
    - [90, 0]
  - - [4608, 1, 1, 1536]
    - [61, 0]
  - - [1024, 32, 1, 512]
    - [58, 0]
  - - [7680, 24000, 1, 2560]
    - [83, 0]
  - - [8448, 4, 1, 2816]
    - [61, 0]
  - - [512, 1, 1, 500000]
    - [58, 0]
  - - [176, 1500, 1, 1408]
    - [58, 0]
  - - [512, 3000, 1, 2560]
    - [75, 0]
  - - [8448, 24000, 1, 2816]
    - [83, 0]
  - - [4608, 2, 1, 1536]
    - [61, 0]
  - - [512, 6000, 1, 1536]
    - [83, 0]
  - - [7680, 128, 1, 2560]
    - [66, 0]
  - - [3072, 6000, 1, 1024]
    - [83, 0]
  - - [3072, 1500, 1, 128]
    - [82, 0]
  - - [2048, 3136, 1, 512]
    - [92, 0]
  - - [1024, 3000, 1, 1536]
    - [83, 0]
  - - [512, 4, 1, 500000]
    - [58, 0]
  - - [512, 6000, 1, 2816]
    - [83, 0]
  - - [128, 50176, 1, 512]
    - [89, 0]
  - - [256, 12544, 1, 1024]
    - [93, 0]
  - - [1024, 12544, 1, 256]
    - [91, 0]
  - - [512, 48000, 1, 2560]
    - [83, 0]
  - - [2560, 16, 1, 2560]
    - [56, 0]
  - - [2048, 64, 1, 2048]
    - [81, 0]
  - - [512, 2, 1, 512]
    - [63, 0]
  - - [1024, 1, 1, 512]
    - [58, 0]
  - - [512, 1500, 1, 2560]
    - [74, 0]
  - - [512, 24000, 1, 1536]
    - [83, 0]
  - - [1024, 1, 1, 500000]
    - [58, 0]
  - - [6144, 16, 1, 2560]
    - [61, 0]
  - - [1024, 24000, 1, 2048]
    - [85, 0]
  - - [4096, 16, 1, 4096]
    - [62, 0]
  - - [512, 32, 1, 512]
    - [58, 0]
  - - [5124, 1500, 1, 2048]
    - [85, 0]
  - - [3072, 1500, 1, 1024]
    - [75, 0]
  - - [1024, 2, 1, 500000]
    - [58, 0]
  - - [1024, 8, 1, 500000]
    - [58, 0]
  - - [7680, 16, 1, 2560]
    - [61, 0]
  - - [6144, 1500, 1, 2560]
    - [83, 0]
  - - [3072, 1, 1, 1024]
    - [56, 0]
  - - [1024, 48000, 1, 2816]
    - [82, 0]
  - - [8448, 2, 1, 2816]
    - [61, 0]
  - - [4608, 4, 1, 1536]
    - [61, 0]
  - - [1024, 6000, 1, 1536]
    - [83, 0]
  - - [8448, 32, 1, 2816]
    - [58, 0]
  - - [512, 3000, 1, 2048]
    - [85, 0]
  - - [6144, 24000, 1, 2560]
    - [85, 0]
  - - [4608, 6000, 1, 1536]
    - [83, 0]
  - - [1024, 1024, 1, 1024]
    - [85, 0]
  - - [512, 1500, 1, 2048]
    - [85, 0]
  - - [512, 1500, 1, 1536]
    - [74, 0]
  - - [128, 1, 1, 1024]
    - [56, 0]
  - - [3072, 3000, 1, 1024]
    - [85, 0]
  - - [1024, 48000, 1, 2048]
    - [83, 0]
  - - [3136, 64, 128, 64]
    - [143, 0]
  - - [784, 512, 64, 128]
    - [136, 0]
  - - [3136, 256, 64, 64]
    - [143, 0]
  - - [12544, 1024, 1, 256]
    - [139, 0]
  - - [784, 128, 128, 512]
    - [138, 0]
  - - [784, 512, 256, 128]
    - [142, 0]
  - - [3136, 64, 64, 256]
    - [140, 0]
  - - [3136, 512, 1, 2048]
    - [141, 0]
  - - [12544, 256, 1, 1024]
    - [144, 0]
  - - [3136, 2048, 1, 512]
    - [137, 0]
  - - [3136, 256, 256, 64]
    - [146, 0]
  - - [3136, 64, 128, 256]
    - [137, 0]
  - - [784, 128, 64, 512]
    - [138, 0]
  - - [3136, 64, 256, 64]
    - [143, 0]
  - - [784, 512, 128, 128]
    - [136, 0]
  - - [3136, 64, 64, 64]
    - [145, 0]
  - - [784, 128, 256, 512]
    - [138, 0]
  - - [3136, 64, 256, 256]
    - [140, 0]
  - - [3136, 256, 128, 64]
    - [135, 0]
  - - [64, 128, 512, 128]
    - [274, 0]
  - - [64, 512, 1, 512]
    - [188, 0]
  - - [64, 512, 64, 512]
    - [265, 0]
  - - [128, 128, 512, 64]
    - [272, 0]
  - - [512, 512, 1, 64]
    - [209, 0]
  - - [512, 512, 64, 64]
    - [267, 0]
  - - [1024, 4, 1, 2]
    - [173, 0]
  - - [1024, 4, 1, 1024]
    - [249, 0]
  - - [1024, 32, 1, 2]
    - [205, 0]
  - - [1024, 32, 1, 1024]
    - [255, 0]
  - - [1024, 2048, 1, 2]
    - [227, 0]
  - - [1024, 2048, 1, 1024]
    - [212, 0]
  - - [1024, 2048, 1, 4096]
    - [207, 0]
  - - [1024, 2048, 1, 30528]
    - [261, 0]
  - - [1024, 4096, 1, 1024]
    - [242, 0]
  - - [1024, 4096, 1, 4096]
    - [206, 0]
  - - [1024, 4096, 1, 30528]
    - [204, 0]
  - - [4096, 2048, 1, 1024]
    - [199, 0]
  - - [4096, 4096, 1, 1024]
    - [193, 0]
  - - [32, 33, 1600, 33]
    - [180, 0]
  - - [32, 200, 1, 1]
    - [173, 0]
  - - [64, 3, 512, 3]
    - [183, 0]
  - - [64, 5, 512, 5]
    - [183, 0]
  - - [64, 5, 960, 5]
    - [178, 0]
  - - [64, 9, 512, 9]
    - [254, 0]
  - - [64, 512, 1, 1]
    - [190, 0]
  - - [67, 512, 1, 2048]
    - [271, 0]
  - - [74, 512, 1, 2048]
    - [176, 0]
  - - [74, 960, 1, 2048]
    - [247, 0]
  - - [100, 512, 1, 2048]
    - [271, 0]
  - - [128, 27, 32768, 27]
    - [197, 0]
  - - [256, 1024, 1, 1]
    - [220, 0]
  - - [256, 8976, 1, 1536]
    - [269, 0]
  - - [256, 8976, 1, 2048]
    - [241, 0]
  - - [256, 8976, 1, 2304]
    - [253, 0]
  - - [256, 8976, 1, 2560]
    - [218, 0]
  - - [256, 8976, 1, 2816]
    - [234, 0]
  - - [256, 8976, 1, 3072]
    - [225, 0]
  - - [256, 8976, 1, 4352]
    - [187, 0]
  - - [256, 8976, 1, 4864]
    - [189, 0]
  - - [256, 8976, 1, 5376]
    - [225, 0]
  - - [256, 8976, 1, 5632]
    - [187, 0]
  - - [256, 8976, 1, 5888]
    - [187, 0]
  - - [256, 8976, 1, 6144]
    - [208, 0]
  - - [256, 8976, 1, 6656]
    - [187, 0]
  - - [256, 8976, 1, 7168]
    - [222, 0]
  - - [256, 8976, 1, 7424]
    - [189, 0]
  - - [256, 8976, 1, 8192]
    - [225, 0]
  - - [256, 8976, 1, 8448]
    - [189, 0]
  - - [256, 8976, 1, 8960]
    - [189, 0]
  - - [256, 8976, 1, 9472]
    - [187, 0]
  - - [256, 8976, 1, 9728]
    - [187, 0]
  - - [256, 8976, 1, 9984]
    - [189, 0]
  - - [256, 8976, 1, 10240]
    - [208, 0]
  - - [256, 8976, 1, 10496]
    - [187, 0]
  - - [256, 8976, 1, 11008]
    - [256, 0]
  - - [256, 8976, 1, 11520]
    - [273, 0]
  - - [256, 8976, 1, 12288]
    - [201, 0]
  - - [256, 8976, 1, 14336]
    - [225, 0]
  - - [256, 8976, 1, 14848]
    - [264, 0]
  - - [256, 8976, 1, 15104]
    - [189, 0]
  - - [256, 8976, 1, 15872]
    - [264, 0]
  - - [256, 8976, 1, 17152]
    - [189, 0]
  - - [256, 8976, 1, 19712]
    - [187, 0]
  - - [256, 8976, 1, 19968]
    - [208, 0]
  - - [256, 8976, 1, 20480]
    - [225, 0]
  - - [256, 8976, 1, 20992]
    - [258, 0]
  - - [256, 8976, 1, 22016]
    - [229, 0]
  - - [256, 8976, 1, 26112]
    - [266, 0]
  - - [256, 8976, 1, 33536]
    - [235, 0]
  - - [256, 8976, 1, 44505]
    - [215, 0]
  - - [256, 32768, 1, 128]
    - [207, 0]
  - - [257, 1024, 1, 4096]
    - [202, 0]
  - - [480, 32768, 1, 1024]
    - [218, 0]
  - - [512, 200, 1, 1]
    - [175, 0]
  - - [512, 200, 1, 32]
    - [184, 0]
  - - [512, 215, 1, 2048]
    - [231, 0]
  - - [512, 256, 1, 2048]
    - [260, 0]
  - - [512, 1600, 1, 32]
    - [192, 0]
  - - [512, 1600, 1, 512]
    - [252, 0]
  - - [512, 32768, 1, 256]
    - [224, 0]
  - - [560, 200, 1, 1024]
    - [223, 0]
  - - [560, 1600, 1, 1024]
    - [186, 0]
  - - [768, 215, 1, 2048]
    - [179, 0]
  - - [768, 256, 1, 2048]
    - [179, 0]
  - - [1024, 200, 1, 1]
    - [177, 0]
  - - [1024, 512, 1, 1]
    - [245, 0]
  - - [1024, 512, 1, 64]
    - [192, 0]
  - - [1024, 512, 1, 1024]
    - [259, 0]
  - - [1024, 960, 1, 64]
    - [237, 0]
  - - [1024, 960, 1, 1024]
    - [250, 0]
  - - [1024, 1600, 1, 1]
    - [219, 0]
  - - [1024, 1600, 1, 1024]
    - [263, 0]
  - - [1024, 1792, 1, 256]
    - [211, 0]
  - - [1024, 2048, 1, 256]
    - [198, 0]
  - - [1024, 2560, 1, 256]
    - [198, 0]
  - - [1024, 3072, 1, 256]
    - [210, 0]
  - - [1024, 3328, 1, 256]
    - [236, 0]
  - - [1024, 3840, 1, 256]
    - [240, 0]
  - - [1024, 4096, 1, 256]
    - [212, 0]
  - - [1024, 4608, 1, 256]
    - [198, 0]
  - - [1024, 4864, 1, 256]
    - [214, 0]
  - - [1024, 5120, 1, 256]
    - [221, 0]
  - - [1024, 5632, 1, 256]
    - [214, 0]
  - - [1024, 6144, 1, 256]
    - [246, 0]
  - - [1024, 6400, 1, 256]
    - [224, 0]
  - - [1024, 7168, 1, 256]
    - [228, 0]
  - - [1024, 7424, 1, 256]
    - [213, 0]
  - - [1024, 7680, 1, 256]
    - [213, 0]
  - - [1024, 7936, 1, 256]
    - [221, 0]
  - - [1024, 8192, 1, 256]
    - [214, 0]
  - - [1024, 8448, 1, 256]
    - [224, 0]
  - - [1024, 8704, 1, 256]
    - [224, 0]
  - - [1024, 8960, 1, 256]
    - [213, 0]
  - - [1024, 9728, 1, 256]
    - [214, 0]
  - - [1024, 9984, 1, 256]
    - [221, 0]
  - - [1024, 10240, 1, 256]
    - [221, 0]
  - - [1024, 10496, 1, 256]
    - [214, 0]
  - - [1024, 11008, 1, 256]
    - [213, 0]
  - - [1024, 11264, 1, 256]
    - [213, 0]
  - - [1024, 11520, 1, 256]
    - [214, 0]
  - - [1024, 12288, 1, 256]
    - [221, 0]
  - - [1024, 13312, 1, 256]
    - [221, 0]
  - - [1024, 13568, 1, 256]
    - [221, 0]
  - - [1024, 14336, 1, 256]
    - [213, 0]
  - - [1024, 14592, 1, 256]
    - [224, 0]
  - - [1024, 14848, 1, 256]
    - [221, 0]
  - - [1024, 15104, 1, 256]
    - [214, 0]
  - - [1024, 16128, 1, 256]
    - [213, 0]
  - - [1024, 17152, 1, 256]
    - [214, 0]
  - - [1024, 18944, 1, 256]
    - [221, 0]
  - - [1024, 19712, 1, 256]
    - [221, 0]
  - - [1024, 19968, 1, 256]
    - [213, 0]
  - - [1024, 20480, 1, 256]
    - [213, 0]
  - - [1024, 20992, 1, 256]
    - [221, 0]
  - - [1024, 21504, 1, 256]
    - [224, 0]
  - - [1024, 22016, 1, 256]
    - [221, 0]
  - - [1024, 23552, 1, 256]
    - [213, 0]
  - - [1024, 28672, 1, 256]
    - [221, 0]
  - - [1024, 32768, 1, 512]
    - [221, 0]
  - - [1024, 32768, 1, 1024]
    - [222, 0]
  - - [1024, 33536, 1, 256]
    - [228, 0]
  - - [1024, 40448, 1, 256]
    - [224, 0]
  - - [1600, 512, 1, 1024]
    - [257, 0]
  - - [2048, 512, 1, 1]
    - [203, 0]
  - - [2048, 512, 1, 2048]
    - [230, 0]
  - - [2048, 960, 1, 2048]
    - [233, 0]
  - - [2048, 1024, 1, 1]
    - [191, 0]
  - - [2048, 1024, 1, 256]
    - [194, 0]
  - - [3200, 1024, 1, 2048]
    - [248, 0]
  - - [4096, 1024, 1, 1]
    - [196, 0]
  - - [64, 14, 1, 14]
    - [174, 0]
  - - [64, 14, 1, 15]
    - [174, 0]
  - - [64, 15, 1, 15]
    - [173, 0]
  - - [64, 15, 1, 15]
    - [173, 0]
  - - [64, 15, 1, 17]
    - [173, 0]
  - - [64, 17, 1, 17]
    - [173, 0]
  - - [64, 17, 1, 17]
    - [173, 0]
  - - [64, 17, 1, 21]
    - [174, 0]
  - - [64, 21, 1, 21]
    - [174, 0]
  - - [64, 24, 1, 24]
    - [174, 0]
  - - [64, 24, 1, 34]
    - [174, 0]
  - - [64, 30, 1, 30]
    - [174, 0]
  - - [64, 31, 1, 30]
    - [182, 0]
  - - [64, 31, 1, 31]
    - [185, 0]
  - - [64, 32, 1, 32]
    - [177, 0]
  - - [64, 34, 1, 34]
    - [181, 0]
  - - [64, 35, 1, 32]
    - [180, 0]
  - - [64, 35, 1, 35]
    - [174, 0]
  - - [1024, 3840, 1, 1024]
    - [251, 0]
  - - [1024, 3840, 1, 4096]
    - [225, 0]
  - - [1024, 3968, 1, 1024]
    - [232, 0]
  - - [1024, 3968, 1, 4096]
    - [206, 0]
  - - [1024, 3968, 1, 42720]
    - [244, 0]
  - - [1024, 6528, 1, 1024]
    - [241, 0]
  - - [1024, 6528, 1, 4096]
    - [262, 0]
  - - [1024, 6528, 1, 42720]
    - [239, 0]
  - - [1024, 7104, 1, 1024]
    - [243, 0]
  - - [1024, 7104, 1, 4096]
    - [262, 0]
  - - [1024, 7104, 1, 42720]
    - [230, 0]
  - - [1024, 7200, 1, 1024]
    - [241, 0]
  - - [1024, 7200, 1, 4096]
    - [268, 0]
  - - [1024, 7200, 1, 42720]
    - [239, 0]
  - - [1024, 8064, 1, 1024]
    - [240, 0]
  - - [1024, 8064, 1, 4096]
    - [218, 0]
  - - [1024, 8160, 1, 1024]
    - [221, 0]
  - - [1024, 8160, 1, 4096]
    - [222, 0]
  - - [1024, 9216, 1, 1024]
    - [221, 0]
  - - [1024, 9216, 1, 4096]
    - [218, 0]
  - - [1024, 9520, 1, 1024]
    - [221, 0]
  - - [1024, 9520, 1, 4096]
    - [216, 0]
  - - [1024, 9520, 1, 42720]
    - [238, 0]
  - - [1024, 10064, 1, 1024]
    - [206, 0]
  - - [1024, 10064, 1, 4096]
    - [217, 0]
  - - [1024, 10080, 1, 1024]
    - [208, 0]
  - - [1024, 10080, 1, 4096]
    - [217, 0]
  - - [1024, 10080, 1, 42720]
    - [226, 0]
  - - [1024, 10200, 1, 1024]
    - [243, 0]
  - - [1024, 10200, 1, 4096]
    - [208, 0]
  - - [4096, 3840, 1, 1024]
    - [199, 0]
  - - [4096, 3968, 1, 1024]
    - [199, 0]
  - - [4096, 6528, 1, 1024]
    - [200, 0]
  - - [4096, 7104, 1, 1024]
    - [199, 0]
  - - [4096, 7200, 1, 1024]
    - [199, 0]
  - - [4096, 8064, 1, 1024]
    - [199, 0]
  - - [4096, 8160, 1, 1024]
    - [193, 0]
  - - [4096, 9216, 1, 1024]
    - [199, 0]
  - - [4096, 9520, 1, 1024]
    - [200, 0]
  - - [4096, 10064, 1, 1024]
    - [200, 0]
  - - [4096, 10080, 1, 1024]
    - [200, 0]
  - - [4096, 10200, 1, 1024]
    - [200, 0]
  - - [1024, 3240, 1, 1024]
    - [233, 0]
  - - [1024, 3240, 1, 4096]
    - [270, 0]
  - - [1024, 3960, 1, 1024]
    - [212, 0]
  - - [1024, 3960, 1, 4096]
    - [206, 0]
  - - [1024, 3960, 1, 42720]
    - [230, 0]
  - - [4096, 3240, 1, 1024]
    - [200, 0]
  - - [4096, 3960, 1, 1024]
    - [195, 0]
  - - [64, 30, 2048, 30]
    - [286, 0]
  - - [64, 31, 2048, 30]
    - [277, 0]
  - - [64, 31, 2048, 31]
    - [282, 0]
  - - [64, 27, 1920, 27]
    - [281, 0]
  - - [64, 33, 1920, 27]
    - [285, 0]
  - - [64, 33, 1920, 33]
    - [284, 0]
  - - [64, 14, 10880, 14]
    - [276, 0]
  - - [64, 14, 10880, 15]
    - [275, 0]
  - - [64, 15, 7680, 15]
    - [283, 0]
  - - [64, 15, 10880, 15]
    - [280, 0]
  - - [64, 15, 7680, 17]
    - [279, 0]
  - - [64, 17, 7680, 17]
    - [278, 0]
  - - [1024, 1024, 1, 3328]
    - [308, 0]
  - - [2944, 4288, 1, 1280]
    - [331, 0]
  - - [2368, 64, 1, 3328]
    - [324, 0]
  - - [2368, 5888, 1, 256]
    - [328, 0]
  - - [256, 704, 1, 1280]
    - [308, 0]
  - - [128, 6784, 1, 3328]
    - [312, 0]
  - - [5888, 1856, 1, 3328]
    - [331, 0]
  - - [5888, 2944, 1, 3328]
    - [331, 0]
  - - [1856, 4288, 1, 256]
    - [327, 0]
  - - [5056, 5056, 1, 3328]
    - [331, 0]
  - - [1408, 5888, 1, 1280]
    - [333, 0]
  - - [1024, 3584, 1, 3328]
    - [331, 0]
  - - [448, 3584, 1, 3328]
    - [331, 0]
  - - [256, 4288, 1, 3328]
    - [331, 0]
  - - [5888, 1408, 1, 1280]
    - [333, 0]
  - - [704, 1856, 1, 3328]
    - [331, 0]
  - - [1024, 2368, 1, 256]
    - [333, 0]
  - - [5056, 6784, 1, 1280]
    - [327, 0]
  - - [1408, 64, 1, 1280]
    - [299, 0]
  - - [448, 1024, 1, 1280]
    - [319, 0]
  - - [5056, 5056, 1, 1280]
    - [331, 0]
  - - [4288, 6784, 1, 256]
    - [328, 0]
  - - [6784, 448, 1, 256]
    - [333, 0]
  - - [5056, 256, 1, 1280]
    - [331, 0]
  - - [5888, 704, 1, 1280]
    - [331, 0]
  - - [3584, 1024, 1, 256]
    - [333, 0]
  - - [6784, 4288, 1, 3328]
    - [331, 0]
  - - [1856, 2368, 1, 3328]
    - [331, 0]
  - - [5888, 2944, 1, 1280]
    - [327, 0]
  - - [5888, 1024, 1, 256]
    - [327, 0]
  - - [448, 64, 1, 1280]
    - [303, 0]
  - - [1024, 704, 1, 256]
    - [305, 0]
  - - [1408, 2944, 1, 256]
    - [333, 0]
  - - [256, 1856, 1, 1280]
    - [308, 0]
  - - [6784, 5056, 1, 3328]
    - [331, 0]
  - - [5056, 5056, 1, 256]
    - [306, 0]
  - - [256, 2944, 1, 3328]
    - [331, 0]
  - - [64, 1024, 1, 1280]
    - [321, 0]
  - - [1024, 3584, 1, 1280]
    - [331, 0]
  - - [2368, 2944, 1, 1280]
    - [331, 0]
  - - [128, 3584, 1, 1280]
    - [289, 0]
  - - [6784, 6784, 1, 1280]
    - [333, 0]
  - - [1024, 256, 1, 3328]
    - [319, 0]
  - - [1408, 4288, 1, 1280]
    - [331, 0]
  - - [3584, 4288, 1, 1280]
    - [331, 0]
  - - [2368, 704, 1, 1280]
    - [331, 0]
  - - [5056, 4288, 1, 3328]
    - [331, 0]
  - - [3584, 2368, 1, 3328]
    - [331, 0]
  - - [5888, 6784, 1, 1280]
    - [327, 0]
  - - [64, 704, 1, 1280]
    - [323, 0]
  - - [4288, 256, 1, 256]
    - [331, 0]
  - - [6784, 448, 1, 1280]
    - [331, 0]
  - - [2944, 5888, 1, 256]
    - [327, 0]
  - - [256, 128, 1, 256]
    - [303, 0]
  - - [4288, 2944, 1, 256]
    - [327, 0]
  - - [5888, 64, 1, 3328]
    - [312, 0]
  - - [2944, 256, 1, 3328]
    - [308, 0]
  - - [5056, 2368, 1, 1280]
    - [327, 0]
  - - [448, 3584, 1, 1280]
    - [331, 0]
  - - [6784, 5888, 1, 256]
    - [328, 0]
  - - [64, 1024, 1, 3328]
    - [321, 0]
  - - [704, 128, 1, 1280]
    - [299, 0]
  - - [1408, 448, 1, 1280]
    - [308, 0]
  - - [1024, 1408, 1, 256]
    - [327, 0]
  - - [2368, 2368, 1, 3328]
    - [331, 0]
  - - [5056, 704, 1, 3328]
    - [331, 0]
  - - [1408, 1856, 1, 256]
    - [333, 0]
  - - [1408, 256, 1, 1280]
    - [308, 0]
  - - [5888, 1856, 1, 256]
    - [333, 0]
  - - [704, 5888, 1, 256]
    - [328, 0]
  - - [6784, 64, 1, 256]
    - [313, 0]
  - - [3584, 704, 1, 3328]
    - [331, 0]
  - - [1408, 1408, 1, 256]
    - [334, 0]
  - - [1024, 64, 1, 1280]
    - [296, 0]
  - - [448, 4288, 1, 256]
    - [309, 0]
  - - [64, 3584, 1, 3328]
    - [316, 0]
  - - [704, 2368, 1, 1280]
    - [331, 0]
  - - [1856, 2368, 1, 1280]
    - [331, 0]
  - - [2368, 128, 1, 3328]
    - [311, 0]
  - - [1408, 1408, 1, 3328]
    - [331, 0]
  - - [2944, 128, 1, 256]
    - [294, 0]
  - - [448, 1408, 1, 256]
    - [331, 0]
  - - [64, 5056, 1, 3328]
    - [293, 0]
  - - [1408, 1024, 1, 1280]
    - [331, 0]
  - - [704, 6784, 1, 256]
    - [327, 0]
  - - [6784, 704, 1, 256]
    - [327, 0]
  - - [256, 3584, 1, 3328]
    - [331, 0]
  - - [5056, 704, 1, 256]
    - [306, 0]
  - - [1408, 3584, 1, 256]
    - [333, 0]
  - - [3584, 4288, 1, 3328]
    - [331, 0]
  - - [5888, 1856, 1, 1280]
    - [333, 0]
  - - [256, 1408, 1, 256]
    - [331, 0]
  - - [5056, 64, 1, 1280]
    - [311, 0]
  - - [2368, 128, 1, 256]
    - [293, 0]
  - - [2368, 3584, 1, 1280]
    - [331, 0]
  - - [1024, 256, 1, 256]
    - [308, 0]
  - - [448, 448, 1, 256]
    - [298, 0]
  - - [2944, 3584, 1, 3328]
    - [331, 0]
  - - [256, 256, 1, 3328]
    - [300, 0]
  - - [128, 1024, 1, 3328]
    - [299, 0]
  - - [6784, 2944, 1, 256]
    - [328, 0]
  - - [64, 1856, 1, 1280]
    - [299, 0]
  - - [448, 256, 1, 256]
    - [300, 0]
  - - [1856, 2368, 1, 256]
    - [327, 0]
  - - [3584, 6784, 1, 3328]
    - [331, 0]
  - - [256, 1024, 1, 256]
    - [308, 0]
  - - [1024, 128, 1, 1280]
    - [299, 0]
  - - [4288, 128, 1, 1280]
    - [291, 0]
  - - [5056, 4288, 1, 1280]
    - [331, 0]
  - - [5888, 64, 1, 256]
    - [294, 0]
  - - [6784, 1856, 1, 3328]
    - [331, 0]
  - - [1408, 5056, 1, 1280]
    - [331, 0]
  - - [1856, 256, 1, 1280]
    - [308, 0]
  - - [64, 5888, 1, 3328]
    - [293, 0]
  - - [6784, 5888, 1, 3328]
    - [331, 0]
  - - [448, 256, 1, 3328]
    - [299, 0]
  - - [2368, 5056, 1, 1280]
    - [331, 0]
  - - [1024, 704, 1, 1280]
    - [308, 0]
  - - [256, 1408, 1, 3328]
    - [308, 0]
  - - [6784, 128, 1, 3328]
    - [312, 0]
  - - [1024, 5056, 1, 1280]
    - [331, 0]
  - - [4288, 1024, 1, 256]
    - [327, 0]
  - - [2368, 1408, 1, 256]
    - [327, 0]
  - - [704, 704, 1, 3328]
    - [308, 0]
  - - [5888, 448, 1, 1280]
    - [331, 0]
  - - [3584, 256, 1, 3328]
    - [308, 0]
  - - [704, 5888, 1, 3328]
    - [331, 0]
  - - [1024, 6784, 1, 1280]
    - [331, 0]
  - - [128, 3584, 1, 3328]
    - [289, 0]
  - - [128, 704, 1, 1280]
    - [299, 0]
  - - [3584, 2944, 1, 1280]
    - [331, 0]
  - - [1856, 128, 1, 3328]
    - [322, 0]
  - - [128, 2944, 1, 1280]
    - [294, 0]
  - - [448, 1856, 1, 1280]
    - [308, 0]
  - - [1408, 5056, 1, 3328]
    - [331, 0]
  - - [1856, 1856, 1, 3328]
    - [331, 0]
  - - [3584, 128, 1, 256]
    - [313, 0]
  - - [448, 1408, 1, 3328]
    - [308, 0]
  - - [2368, 2368, 1, 256]
    - [306, 0]
  - - [4288, 4288, 1, 1280]
    - [327, 0]
  - - [64, 448, 1, 1280]
    - [302, 0]
  - - [5888, 1024, 1, 1280]
    - [331, 0]
  - - [704, 1024, 1, 256]
    - [331, 0]
  - - [704, 6784, 1, 3328]
    - [331, 0]
  - - [5888, 5888, 1, 3328]
    - [331, 0]
  - - [5056, 1024, 1, 1280]
    - [331, 0]
  - - [448, 5888, 1, 3328]
    - [331, 0]
  - - [1024, 2944, 1, 1280]
    - [331, 0]
  - - [5056, 5888, 1, 1280]
    - [328, 0]
  - - [448, 6784, 1, 256]
    - [332, 0]
  - - [256, 3584, 1, 256]
    - [331, 0]
  - - [256, 448, 1, 256]
    - [324, 0]
  - - [3584, 5888, 1, 256]
    - [327, 0]
  - - [2944, 3584, 1, 256]
    - [327, 0]
  - - [1408, 704, 1, 256]
    - [333, 0]
  - - [6784, 1024, 1, 3328]
    - [331, 0]
  - - [6784, 2944, 1, 3328]
    - [331, 0]
  - - [64, 64, 1, 3328]
    - [299, 0]
  - - [6784, 2368, 1, 1280]
    - [333, 0]
  - - [4288, 3584, 1, 256]
    - [327, 0]
  - - [4288, 5888, 1, 1280]
    - [331, 0]
  - - [448, 2944, 1, 3328]
    - [331, 0]
  - - [4288, 1856, 1, 1280]
    - [331, 0]
  - - [1856, 2944, 1, 3328]
    - [331, 0]
  - - [256, 6784, 1, 3328]
    - [331, 0]
  - - [64, 5888, 1, 256]
    - [307, 0]
  - - [5056, 1024, 1, 256]
    - [328, 0]
  - - [704, 64, 1, 3328]
    - [325, 0]
  - - [5056, 1856, 1, 3328]
    - [331, 0]
  - - [448, 448, 1, 3328]
    - [316, 0]
  - - [448, 2368, 1, 1280]
    - [331, 0]
  - - [1408, 128, 1, 1280]
    - [293, 0]
  - - [5056, 256, 1, 3328]
    - [331, 0]
  - - [704, 704, 1, 256]
    - [308, 0]
  - - [1024, 5888, 1, 1280]
    - [331, 0]
  - - [64, 128, 1, 256]
    - [290, 0]
  - - [128, 1856, 1, 1280]
    - [301, 0]
  - - [5056, 3584, 1, 256]
    - [328, 0]
  - - [1856, 1024, 1, 1280]
    - [331, 0]
  - - [1856, 1856, 1, 1280]
    - [331, 0]
  - - [128, 4288, 1, 3328]
    - [291, 0]
  - - [1856, 1024, 1, 3328]
    - [331, 0]
  - - [256, 2368, 1, 256]
    - [331, 0]
  - - [1024, 448, 1, 3328]
    - [308, 0]
  - - [1856, 704, 1, 1280]
    - [331, 0]
  - - [6784, 1024, 1, 256]
    - [327, 0]
  - - [5056, 5888, 1, 3328]
    - [331, 0]
  - - [1856, 1024, 1, 256]
    - [309, 0]
  - - [5056, 1408, 1, 3328]
    - [331, 0]
  - - [1024, 1024, 1, 1280]
    - [308, 0]
  - - [448, 5888, 1, 256]
    - [327, 0]
  - - [1408, 6784, 1, 3328]
    - [331, 0]
  - - [2944, 1408, 1, 3328]
    - [331, 0]
  - - [2944, 4288, 1, 3328]
    - [331, 0]
  - - [256, 2944, 1, 256]
    - [331, 0]
  - - [5056, 2944, 1, 256]
    - [327, 0]
  - - [2368, 1856, 1, 256]
    - [327, 0]
  - - [128, 6784, 1, 1280]
    - [294, 0]
  - - [1408, 3584, 1, 3328]
    - [331, 0]
  - - [2368, 6784, 1, 256]
    - [328, 0]
  - - [4288, 2368, 1, 3328]
    - [331, 0]
  - - [704, 3584, 1, 1280]
    - [331, 0]
  - - [1408, 5888, 1, 3328]
    - [331, 0]
  - - [1856, 5056, 1, 256]
    - [306, 0]
  - - [6784, 6784, 1, 256]
    - [328, 0]
  - - [1408, 704, 1, 3328]
    - [331, 0]
  - - [128, 5888, 1, 1280]
    - [288, 0]
  - - [2368, 4288, 1, 1280]
    - [331, 0]
  - - [3584, 1856, 1, 1280]
    - [331, 0]
  - - [704, 1408, 1, 3328]
    - [331, 0]
  - - [704, 64, 1, 1280]
    - [302, 0]
  - - [3584, 448, 1, 256]
    - [331, 0]
  - - [3584, 3584, 1, 1280]
    - [331, 0]
  - - [256, 6784, 1, 256]
    - [327, 0]
  - - [1856, 3584, 1, 3328]
    - [331, 0]
  - - [128, 448, 1, 256]
    - [321, 0]
  - - [3584, 3584, 1, 256]
    - [327, 0]
  - - [6784, 4288, 1, 1280]
    - [327, 0]
  - - [448, 704, 1, 1280]
    - [308, 0]
  - - [3584, 5056, 1, 256]
    - [333, 0]
  - - [6784, 128, 1, 256]
    - [294, 0]
  - - [64, 1408, 1, 3328]
    - [299, 0]
  - - [704, 448, 1, 256]
    - [308, 0]
  - - [2944, 2368, 1, 1280]
    - [331, 0]
  - - [448, 64, 1, 3328]
    - [326, 0]
  - - [6784, 3584, 1, 256]
    - [328, 0]
  - - [256, 1856, 1, 3328]
    - [319, 0]
  - - [256, 704, 1, 256]
    - [308, 0]
  - - [128, 1408, 1, 256]
    - [293, 0]
  - - [64, 128, 1, 3328]
    - [324, 0]
  - - [1856, 1408, 1, 256]
    - [328, 0]
  - - [2944, 2944, 1, 3328]
    - [331, 0]
  - - [5056, 6784, 1, 256]
    - [328, 0]
  - - [1408, 4288, 1, 3328]
    - [331, 0]
  - - [6784, 256, 1, 1280]
    - [331, 0]
  - - [1024, 704, 1, 3328]
    - [308, 0]
  - - [2368, 704, 1, 3328]
    - [331, 0]
  - - [128, 4288, 1, 256]
    - [291, 0]
  - - [3584, 6784, 1, 256]
    - [327, 0]
  - - [128, 128, 1, 3328]
    - [302, 0]
  - - [5056, 1856, 1, 256]
    - [306, 0]
  - - [704, 4288, 1, 256]
    - [306, 0]
  - - [256, 448, 1, 3328]
    - [299, 0]
  - - [1408, 6784, 1, 1280]
    - [331, 0]
  - - [64, 2368, 1, 1280]
    - [299, 0]
  - - [64, 6784, 1, 3328]
    - [289, 0]
  - - [2944, 256, 1, 1280]
    - [331, 0]
  - - [5056, 2368, 1, 3328]
    - [331, 0]
  - - [2944, 4288, 1, 256]
    - [327, 0]
  - - [1408, 3584, 1, 1280]
    - [331, 0]
  - - [2368, 64, 1, 256]
    - [299, 0]
  - - [256, 256, 1, 256]
    - [300, 0]
  - - [704, 128, 1, 3328]
    - [299, 0]
  - - [1856, 704, 1, 256]
    - [305, 0]
  - - [2368, 6784, 1, 3328]
    - [331, 0]
  - - [5056, 704, 1, 1280]
    - [331, 0]
  - - [1856, 4288, 1, 3328]
    - [331, 0]
  - - [1408, 5888, 1, 256]
    - [328, 0]
  - - [704, 2944, 1, 1280]
    - [331, 0]
  - - [4288, 64, 1, 1280]
    - [314, 0]
  - - [704, 1856, 1, 256]
    - [327, 0]
  - - [3584, 704, 1, 1280]
    - [331, 0]
  - - [5888, 5056, 1, 256]
    - [329, 0]
  - - [3584, 448, 1, 3328]
    - [331, 0]
  - - [704, 2368, 1, 3328]
    - [331, 0]
  - - [2944, 448, 1, 256]
    - [331, 0]
  - - [448, 5056, 1, 3328]
    - [331, 0]
  - - [2368, 128, 1, 1280]
    - [293, 0]
  - - [4288, 448, 1, 256]
    - [309, 0]
  - - [64, 6784, 1, 256]
    - [289, 0]
  - - [64, 5056, 1, 1280]
    - [293, 0]
  - - [5888, 2368, 1, 256]
    - [333, 0]
  - - [704, 448, 1, 3328]
    - [308, 0]
  - - [6784, 704, 1, 3328]
    - [331, 0]
  - - [128, 64, 1, 1280]
    - [315, 0]
  - - [2368, 256, 1, 1280]
    - [308, 0]
  - - [1408, 2944, 1, 3328]
    - [331, 0]
  - - [64, 1024, 1, 256]
    - [300, 0]
  - - [2368, 448, 1, 1280]
    - [308, 0]
  - - [128, 3584, 1, 256]
    - [289, 0]
  - - [1856, 448, 1, 3328]
    - [308, 0]
  - - [128, 5056, 1, 256]
    - [294, 0]
  - - [4288, 4288, 1, 256]
    - [327, 0]
  - - [2368, 704, 1, 256]
    - [327, 0]
  - - [3584, 2368, 1, 256]
    - [327, 0]
  - - [5888, 5056, 1, 1280]
    - [333, 0]
  - - [128, 1024, 1, 1280]
    - [299, 0]
  - - [64, 704, 1, 256]
    - [297, 0]
  - - [4288, 256, 1, 1280]
    - [331, 0]
  - - [3584, 3584, 1, 3328]
    - [331, 0]
  - - [128, 1024, 1, 256]
    - [324, 0]
  - - [5888, 6784, 1, 256]
    - [328, 0]
  - - [4288, 2944, 1, 3328]
    - [331, 0]
  - - [1856, 64, 1, 256]
    - [299, 0]
  - - [4288, 128, 1, 3328]
    - [291, 0]
  - - [256, 5056, 1, 1280]
    - [331, 0]
  - - [6784, 5888, 1, 1280]
    - [331, 0]
  - - [704, 128, 1, 256]
    - [300, 0]
  - - [5888, 4288, 1, 1280]
    - [331, 0]
  - - [448, 256, 1, 1280]
    - [299, 0]
  - - [448, 2368, 1, 3328]
    - [331, 0]
  - - [1, 1, 1, 1280]
    - [341, 0]
  - - [256, 1408, 1, 1280]
    - [308, 0]
  - - [1408, 1856, 1, 1280]
    - [331, 0]
  - - [5888, 448, 1, 3328]
    - [331, 0]
  - - [704, 5888, 1, 1280]
    - [331, 0]
  - - [256, 64, 1, 3328]
    - [325, 0]
  - - [128, 2368, 1, 256]
    - [293, 0]
  - - [6784, 64, 1, 3328]
    - [313, 0]
  - - [5056, 2944, 1, 3328]
    - [331, 0]
  - - [448, 128, 1, 256]
    - [321, 0]
  - - [1856, 128, 1, 1280]
    - [322, 0]
  - - [448, 4288, 1, 1280]
    - [331, 0]
  - - [64, 3584, 1, 256]
    - [298, 0]
  - - [128, 2944, 1, 3328]
    - [312, 0]
  - - [3584, 704, 1, 256]
    - [333, 0]
  - - [2944, 448, 1, 3328]
    - [331, 0]
  - - [3584, 1408, 1, 3328]
    - [331, 0]
  - - [2368, 1024, 1, 1280]
    - [331, 0]
  - - [2944, 6784, 1, 1280]
    - [331, 0]
  - - [1856, 6784, 1, 256]
    - [327, 0]
  - - [4288, 448, 1, 3328]
    - [331, 0]
  - - [6784, 704, 1, 1280]
    - [331, 0]
  - - [5888, 1024, 1, 3328]
    - [331, 0]
  - - [704, 6784, 1, 1280]
    - [331, 0]
  - - [5888, 128, 1, 256]
    - [308, 0]
  - - [5056, 1024, 1, 3328]
    - [331, 0]
  - - [704, 5056, 1, 1280]
    - [331, 0]
  - - [64, 704, 1, 3328]
    - [302, 0]
  - - [2944, 1856, 1, 256]
    - [327, 0]
  - - [5056, 64, 1, 256]
    - [293, 0]
  - - [5888, 5056, 1, 3328]
    - [333, 0]
  - - [128, 5056, 1, 3328]
    - [294, 0]
  - - [3584, 6784, 1, 1280]
    - [327, 0]
  - - [1856, 5888, 1, 256]
    - [328, 0]
  - - [64, 448, 1, 3328]
    - [326, 0]
  - - [4288, 4288, 1, 3328]
    - [331, 0]
  - - [4288, 1408, 1, 1280]
    - [331, 0]
  - - [64, 1856, 1, 256]
    - [299, 0]
  - - [4288, 2368, 1, 256]
    - [327, 0]
  - - [2944, 5056, 1, 1280]
    - [327, 0]
  - - [256, 4288, 1, 1280]
    - [331, 0]
  - - [6784, 2368, 1, 3328]
    - [331, 0]
  - - [256, 1024, 1, 1280]
    - [308, 0]
  - - [4288, 128, 1, 256]
    - [291, 0]
  - - [4288, 1856, 1, 3328]
    - [331, 0]
  - - [1856, 2944, 1, 1280]
    - [331, 0]
  - - [3584, 64, 1, 1280]
    - [301, 0]
  - - [4288, 6784, 1, 3328]
    - [331, 0]
  - - [3584, 1024, 1, 1280]
    - [331, 0]
  - - [1024, 4288, 1, 256]
    - [327, 0]
  - - [5888, 3584, 1, 3328]
    - [331, 0]
  - - [5056, 3584, 1, 3328]
    - [331, 0]
  - - [1408, 128, 1, 3328]
    - [293, 0]
  - - [2368, 1408, 1, 1280]
    - [331, 0]
  - - [5056, 2944, 1, 1280]
    - [327, 0]
  - - [3584, 256, 1, 256]
    - [331, 0]
  - - [1024, 6784, 1, 256]
    - [327, 0]
  - - [2944, 5056, 1, 3328]
    - [331, 0]
  - - [3584, 2944, 1, 256]
    - [327, 0]
  - - [448, 128, 1, 3328]
    - [300, 0]
  - - [64, 2944, 1, 3328]
    - [311, 0]
  - - [64, 4288, 1, 3328]
    - [314, 0]
  - - [5056, 6784, 1, 3328]
    - [331, 0]
  - - [128, 2944, 1, 256]
    - [294, 0]
  - - [3584, 4288, 1, 256]
    - [327, 0]
  - - [1856, 6784, 1, 3328]
    - [331, 0]
  - - [3584, 128, 1, 3328]
    - [313, 0]
  - - [128, 256, 1, 1280]
    - [303, 0]
  - - [64, 448, 1, 256]
    - [303, 0]
  - - [64, 256, 1, 1280]
    - [302, 0]
  - - [5056, 1408, 1, 1280]
    - [333, 0]
  - - [5888, 5888, 1, 256]
    - [328, 0]
  - - [4288, 1024, 1, 1280]
    - [331, 0]
  - - [5888, 128, 1, 3328]
    - [288, 0]
  - - [448, 6784, 1, 3328]
    - [331, 0]
  - - [2944, 1408, 1, 1280]
    - [331, 0]
  - - [64, 128, 1, 1280]
    - [299, 0]
  - - [2944, 1856, 1, 3328]
    - [331, 0]
  - - [448, 5056, 1, 256]
    - [327, 0]
  - - [64, 64, 1, 256]
    - [290, 0]
  - - [3584, 5888, 1, 1280]
    - [327, 0]
  - - [6784, 1856, 1, 1280]
    - [327, 0]
  - - [5888, 256, 1, 3328]
    - [331, 0]
  - - [1856, 5888, 1, 3328]
    - [331, 0]
  - - [3584, 1408, 1, 256]
    - [333, 0]
  - - [704, 3584, 1, 3328]
    - [331, 0]
  - - [5056, 448, 1, 1280]
    - [331, 0]
  - - [3584, 1856, 1, 3328]
    - [331, 0]
  - - [1408, 704, 1, 1280]
    - [308, 0]
  - - [2944, 1024, 1, 256]
    - [333, 0]
  - - [448, 1408, 1, 1280]
    - [308, 0]
  - - [2368, 4288, 1, 3328]
    - [331, 0]
  - - [1024, 1408, 1, 1280]
    - [331, 0]
  - - [256, 128, 1, 1280]
    - [303, 0]
  - - [704, 1408, 1, 1280]
    - [308, 0]
  - - [6784, 5056, 1, 256]
    - [329, 0]
  - - [4288, 5888, 1, 256]
    - [328, 0]
  - - [448, 2944, 1, 256]
    - [327, 0]
  - - [2944, 6784, 1, 256]
    - [327, 0]
  - - [2368, 2368, 1, 1280]
    - [331, 0]
  - - [1856, 3584, 1, 1280]
    - [331, 0]
  - - [64, 2944, 1, 256]
    - [293, 0]
  - - [3584, 1408, 1, 1280]
    - [331, 0]
  - - [5056, 3584, 1, 1280]
    - [333, 0]
  - - [256, 5888, 1, 256]
    - [333, 0]
  - - [128, 256, 1, 3328]
    - [303, 0]
  - - [1856, 1408, 1, 3328]
    - [331, 0]
  - - [1024, 4288, 1, 3328]
    - [331, 0]
  - - [448, 2368, 1, 256]
    - [331, 0]
  - - [64, 1408, 1, 1280]
    - [299, 0]
  - - [64, 6784, 1, 1280]
    - [313, 0]
  - - [2944, 2368, 1, 3328]
    - [331, 0]
  - - [704, 4288, 1, 3328]
    - [331, 0]
  - - [1024, 1856, 1, 1280]
    - [331, 0]
  - - [6784, 1856, 1, 256]
    - [327, 0]
  - - [128, 2368, 1, 3328]
    - [293, 0]
  - - [1024, 5888, 1, 256]
    - [327, 0]
  - - [64, 2944, 1, 1280]
    - [311, 0]
  - - [5056, 64, 1, 3328]
    - [311, 0]
  - - [1408, 2368, 1, 256]
    - [327, 0]
  - - [2944, 704, 1, 3328]
    - [331, 0]
  - - [256, 64, 1, 256]
    - [302, 0]
  - - [2944, 2944, 1, 1280]
    - [333, 0]
  - - [6784, 256, 1, 3328]
    - [331, 0]
  - - [1408, 5056, 1, 256]
    - [333, 0]
  - - [5056, 128, 1, 3328]
    - [312, 0]
  - - [128, 128, 1, 1280]
    - [302, 0]
  - - [448, 704, 1, 256]
    - [331, 0]
  - - [1856, 256, 1, 3328]
    - [319, 0]
  - - [2944, 128, 1, 3328]
    - [312, 0]
  - - [704, 256, 1, 256]
    - [308, 0]
  - - [256, 448, 1, 1280]
    - [299, 0]
  - - [704, 256, 1, 1280]
    - [320, 0]
  - - [64, 2368, 1, 3328]
    - [324, 0]
  - - [256, 704, 1, 3328]
    - [319, 0]
  - - [1024, 1024, 1, 256]
    - [308, 0]
  - - [1408, 4288, 1, 256]
    - [333, 0]
  - - [5888, 2368, 1, 1280]
    - [333, 0]
  - - [128, 256, 1, 256]
    - [297, 0]
  - - [256, 64, 1, 1280]
    - [302, 0]
  - - [2368, 5888, 1, 1280]
    - [327, 0]
  - - [5888, 256, 1, 1280]
    - [331, 0]
  - - [704, 1024, 1, 1280]
    - [331, 0]
  - - [2368, 1856, 1, 3328]
    - [331, 0]
  - - [2944, 704, 1, 256]
    - [309, 0]
  - - [2368, 6784, 1, 1280]
    - [328, 0]
  - - [2368, 1024, 1, 3328]
    - [331, 0]
  - - [1856, 4288, 1, 1280]
    - [331, 0]
  - - [704, 3584, 1, 256]
    - [327, 0]
  - - [704, 2944, 1, 3328]
    - [331, 0]
  - - [1856, 5056, 1, 3328]
    - [331, 0]
  - - [3584, 5056, 1, 1280]
    - [333, 0]
  - - [2944, 1024, 1, 3328]
    - [331, 0]
  - - [256, 4288, 1, 256]
    - [331, 0]
  - - [2368, 256, 1, 256]
    - [331, 0]
  - - [1408, 6784, 1, 256]
    - [327, 0]
  - - [6784, 1408, 1, 3328]
    - [331, 0]
  - - [1024, 2368, 1, 1280]
    - [331, 0]
  - - [704, 64, 1, 256]
    - [299, 0]
  - - [256, 2368, 1, 3328]
    - [308, 0]
  - - [6784, 2944, 1, 1280]
    - [331, 0]
  - - [3584, 448, 1, 1280]
    - [331, 0]
  - - [2944, 6784, 1, 3328]
    - [331, 0]
  - - [448, 5056, 1, 1280]
    - [331, 0]
  - - [4288, 5056, 1, 1280]
    - [327, 0]
  - - [128, 448, 1, 1280]
    - [321, 0]
  - - [4288, 704, 1, 256]
    - [306, 0]
  - - [64, 64, 1, 1280]
    - [321, 0]
  - - [5888, 704, 1, 256]
    - [333, 0]
  - - [256, 5888, 1, 3328]
    - [331, 0]
  - - [6784, 4288, 1, 256]
    - [329, 0]
  - - [5888, 256, 1, 256]
    - [327, 0]
  - - [6784, 1024, 1, 1280]
    - [331, 0]
  - - [704, 448, 1, 1280]
    - [308, 0]
  - - [128, 64, 1, 3328]
    - [299, 0]
  - - [448, 64, 1, 256]
    - [324, 0]
  - - [2944, 704, 1, 1280]
    - [331, 0]
  - - [6784, 3584, 1, 1280]
    - [327, 0]
  - - [2944, 64, 1, 1280]
    - [293, 0]
  - - [1408, 2944, 1, 1280]
    - [331, 0]
  - - [256, 1856, 1, 256]
    - [331, 0]
  - - [1408, 2368, 1, 3328]
    - [331, 0]
  - - [128, 1408, 1, 3328]
    - [293, 0]
  - - [2368, 2944, 1, 256]
    - [327, 0]
  - - [64, 5056, 1, 256]
    - [293, 0]
  - - [1408, 256, 1, 3328]
    - [319, 0]
  - - [3584, 1856, 1, 256]
    - [333, 0]
  - - [4288, 3584, 1, 1280]
    - [327, 0]
  - - [2368, 448, 1, 256]
    - [308, 0]
  - - [4288, 256, 1, 3328]
    - [331, 0]
  - - [1408, 64, 1, 256]
    - [300, 0]
  - - [4288, 2944, 1, 1280]
    - [331, 0]
  - - [5056, 448, 1, 3328]
    - [331, 0]
  - - [1024, 64, 1, 256]
    - [300, 0]
  - - [64, 2368, 1, 256]
    - [299, 0]
  - - [4288, 5056, 1, 3328]
    - [331, 0]
  - - [2944, 256, 1, 256]
    - [305, 0]
  - - [1024, 128, 1, 3328]
    - [324, 0]
  - - [256, 5056, 1, 3328]
    - [331, 0]
  - - [5056, 2368, 1, 256]
    - [306, 0]
  - - [4288, 704, 1, 3328]
    - [331, 0]
  - - [448, 3584, 1, 256]
    - [327, 0]
  - - [2368, 64, 1, 1280]
    - [299, 0]
  - - [1024, 1408, 1, 3328]
    - [331, 0]
  - - [2944, 5888, 1, 1280]
    - [327, 0]
  - - [5888, 3584, 1, 256]
    - [328, 0]
  - - [1408, 1856, 1, 3328]
    - [331, 0]
  - - [6784, 1408, 1, 1280]
    - [331, 0]
  - - [704, 2944, 1, 256]
    - [309, 0]
  - - [4288, 64, 1, 256]
    - [292, 0]
  - - [2944, 5888, 1, 3328]
    - [331, 0]
  - - [64, 4288, 1, 1280]
    - [292, 0]
  - - [6784, 64, 1, 1280]
    - [289, 0]
  - - [704, 1856, 1, 1280]
    - [331, 0]
  - - [1408, 64, 1, 3328]
    - [299, 0]
  - - [1408, 1408, 1, 1280]
    - [331, 0]
  - - [448, 1024, 1, 3328]
    - [319, 0]
  - - [448, 4288, 1, 3328]
    - [331, 0]
  - - [704, 2368, 1, 256]
    - [327, 0]
  - - [2944, 448, 1, 1280]
    - [308, 0]
  - - [5888, 2368, 1, 3328]
    - [331, 0]
  - - [4288, 5056, 1, 256]
    - [327, 0]
  - - [4288, 448, 1, 1280]
    - [331, 0]
  - - [5888, 704, 1, 3328]
    - [331, 0]
  - - [4288, 3584, 1, 3328]
    - [331, 0]
  - - [2944, 64, 1, 256]
    - [293, 0]
  - - [1024, 6784, 1, 3328]
    - [331, 0]
  - - [1408, 1024, 1, 256]
    - [331, 0]
  - - [448, 1024, 1, 256]
    - [331, 0]
  - - [6784, 6784, 1, 3328]
    - [333, 0]
  - - [1024, 448, 1, 1280]
    - [319, 0]
  - - [704, 5056, 1, 3328]
    - [331, 0]
  - - [256, 2368, 1, 1280]
    - [308, 0]
  - - [3584, 5056, 1, 3328]
    - [333, 0]
  - - [2368, 2944, 1, 3328]
    - [331, 0]
  - - [448, 448, 1, 1280]
    - [316, 0]
  - - [2368, 3584, 1, 256]
    - [327, 0]
  - - [1024, 256, 1, 1280]
    - [331, 0]
  - - [128, 5056, 1, 1280]
    - [294, 0]
  - - [3584, 2368, 1, 1280]
    - [331, 0]
  - - [1856, 1856, 1, 256]
    - [333, 0]
  - - [4288, 1408, 1, 3328]
    - [331, 0]
  - - [3584, 64, 1, 3328]
    - [316, 0]
  - - [1, 1, 1, 1]
    - [339, 0]
  - - [256, 1024, 1, 3328]
    - [319, 0]
  - - [1856, 64, 1, 3328]
    - [299, 0]
  - - [5888, 1408, 1, 3328]
    - [331, 0]
  - - [256, 5056, 1, 256]
    - [327, 0]
  - - [1856, 64, 1, 1280]
    - [324, 0]
  - - [1408, 256, 1, 256]
    - [331, 0]
  - - [2368, 5056, 1, 256]
    - [306, 0]
  - - [128, 5888, 1, 3328]
    - [331, 0]
  - - [1024, 5056, 1, 256]
    - [333, 0]
  - - [2368, 1408, 1, 3328]
    - [331, 0]
  - - [5888, 448, 1, 256]
    - [327, 0]
  - - [6784, 5056, 1, 1280]
    - [331, 0]
  - - [4288, 6784, 1, 1280]
    - [327, 0]
  - - [2368, 448, 1, 3328]
    - [331, 0]
  - - [1024, 128, 1, 256]
    - [300, 0]
  - - [448, 128, 1, 1280]
    - [300, 0]
  - - [1024, 64, 1, 3328]
    - [321, 0]
  - - [64, 3584, 1, 1280]
    - [316, 0]
  - - [6784, 1408, 1, 256]
    - [327, 0]
  - - [5888, 4288, 1, 256]
    - [327, 0]
  - - [5056, 5888, 1, 256]
    - [328, 0]
  - - [2368, 1024, 1, 256]
    - [327, 0]
  - - [1856, 6784, 1, 1280]
    - [327, 0]
  - - [3584, 128, 1, 1280]
    - [313, 0]
  - - [128, 64, 1, 256]
    - [290, 0]
  - - [1408, 448, 1, 256]
    - [331, 0]
  - - [64, 256, 1, 3328]
    - [302, 0]
  - - [6784, 448, 1, 3328]
    - [331, 0]
  - - [5056, 1856, 1, 1280]
    - [331, 0]
  - - [1408, 1024, 1, 3328]
    - [331, 0]
  - - [2368, 256, 1, 3328]
    - [308, 0]
  - - [5888, 3584, 1, 1280]
    - [327, 0]
  - - [5888, 128, 1, 1280]
    - [308, 0]
  - - [1024, 2944, 1, 256]
    - [333, 0]
  - - [448, 6784, 1, 1280]
    - [331, 0]
  - - [256, 3584, 1, 1280]
    - [308, 0]
  - - [704, 5056, 1, 256]
    - [306, 0]
  - - [3584, 1024, 1, 3328]
    - [331, 0]
  - - [2944, 1856, 1, 1280]
    - [331, 0]
  - - [5056, 256, 1, 256]
    - [305, 0]
  - - [128, 5888, 1, 256]
    - [288, 0]
  - - [2368, 3584, 1, 3328]
    - [331, 0]
  - - [3584, 5888, 1, 3328]
    - [331, 0]
  - - [2944, 3584, 1, 1280]
    - [331, 0]
  - - [1856, 5888, 1, 1280]
    - [331, 0]
  - - [256, 256, 1, 1280]
    - [321, 0]
  - - [4288, 1408, 1, 256]
    - [328, 0]
  - - [3584, 64, 1, 256]
    - [310, 0]
  - - [64, 1856, 1, 3328]
    - [299, 0]
  - - [1408, 128, 1, 256]
    - [311, 0]
  - - [4288, 2368, 1, 1280]
    - [331, 0]
  - - [2944, 5056, 1, 256]
    - [327, 0]
  - - [256, 128, 1, 3328]
    - [303, 0]
  - - [6784, 2368, 1, 256]
    - [329, 0]
  - - [1408, 448, 1, 3328]
    - [308, 0]
  - - [4288, 1856, 1, 256]
    - [327, 0]
  - - [1856, 2944, 1, 256]
    - [327, 0]
  - - [64, 5888, 1, 1280]
    - [307, 0]
  - - [1856, 1408, 1, 1280]
    - [331, 0]
  - - [128, 704, 1, 256]
    - [296, 0]
  - - [1024, 4288, 1, 1280]
    - [331, 0]
  - - [2368, 5056, 1, 3328]
    - [331, 0]
  - - [4288, 1024, 1, 3328]
    - [331, 0]
  - - [1024, 5056, 1, 3328]
    - [331, 0]
  - - [1024, 1856, 1, 3328]
    - [331, 0]
  - - [704, 704, 1, 1280]
    - [308, 0]
  - - [128, 2368, 1, 1280]
    - [293, 0]
  - - [3584, 256, 1, 1280]
    - [308, 0]
  - - [5888, 64, 1, 1280]
    - [312, 0]
  - - [128, 704, 1, 3328]
    - [324, 0]
  - - [3584, 2944, 1, 3328]
    - [331, 0]
  - - [128, 1856, 1, 256]
    - [310, 0]
  - - [64, 4288, 1, 256]
    - [292, 0]
  - - [5888, 2944, 1, 256]
    - [327, 0]
  - - [5056, 128, 1, 1280]
    - [294, 0]
  - - [448, 1856, 1, 3328]
    - [308, 0]
  - - [5056, 4288, 1, 256]
    - [327, 0]
  - - [1024, 448, 1, 256]
    - [308, 0]
  - - [1024, 3584, 1, 256]
    - [333, 0]
  - - [2944, 128, 1, 1280]
    - [312, 0]
  - - [64, 256, 1, 256]
    - [296, 0]
  - - [704, 256, 1, 3328]
    - [320, 0]
  - - [5056, 1408, 1, 256]
    - [328, 0]
  - - [5888, 5888, 1, 1280]
    - [331, 0]
  - - [448, 5888, 1, 1280]
    - [331, 0]
  - - [1, 1, 1, 256]
    - [340, 0]
  - - [4288, 704, 1, 1280]
    - [331, 0]
  - - [2944, 1408, 1, 256]
    - [329, 0]
  - - [256, 2944, 1, 1280]
    - [331, 0]
  - - [2368, 5888, 1, 3328]
    - [331, 0]
  - - [704, 1024, 1, 3328]
    - [308, 0]
  - - [2368, 1856, 1, 1280]
    - [331, 0]
  - - [1856, 448, 1, 1280]
    - [308, 0]
  - - [128, 6784, 1, 256]
    - [294, 0]
  - - [5888, 4288, 1, 3328]
    - [331, 0]
  - - [1856, 128, 1, 256]
    - [291, 0]
  - - [5056, 448, 1, 256]
    - [327, 0]
  - - [1856, 5056, 1, 1280]
    - [331, 0]
  - - [2944, 1024, 1, 1280]
    - [331, 0]
  - - [2368, 4288, 1, 256]
    - [327, 0]
  - - [1024, 2368, 1, 3328]
    - [331, 0]
  - - [4288, 64, 1, 3328]
    - [314, 0]
  - - [704, 1408, 1, 256]
    - [331, 0]
  - - [4288, 5888, 1, 3328]
    - [331, 0]
  - - [448, 2944, 1, 1280]
    - [331, 0]
  - - [1024, 2944, 1, 3328]
    - [331, 0]
  - - [256, 6784, 1, 1280]
    - [331, 0]
  - - [1856, 3584, 1, 256]
    - [328, 0]
  - - [128, 448, 1, 3328]
    - [296, 0]
  - - [1856, 256, 1, 256]
    - [308, 0]
  - - [5056, 128, 1, 256]
    - [294, 0]
  - - [256, 5888, 1, 1280]
    - [331, 0]
  - - [6784, 128, 1, 1280]
    - [312, 0]
  - - [64, 1408, 1, 256]
    - [299, 0]
  - - [2944, 2368, 1, 256]
    - [327, 0]
  - - [1856, 448, 1, 256]
    - [331, 0]
  - - [1024, 1856, 1, 256]
    - [309, 0]
  - - [6784, 3584, 1, 3328]
    - [331, 0]
  - - [2944, 64, 1, 3328]
    - [293, 0]
  - - [1024, 5888, 1, 3328]
    - [331, 0]
  - - [1408, 2368, 1, 1280]
    - [331, 0]
  - - [128, 1408, 1, 1280]
    - [293, 0]
  - - [128, 1856, 1, 3328]
    - [322, 0]
  - - [2944, 2944, 1, 256]
    - [328, 0]
  - - [6784, 256, 1, 256]
    - [327, 0]
  - - [128, 4288, 1, 1280]
    - [291, 0]
  - - [5888, 1408, 1, 256]
    - [333, 0]
  - - [128, 128, 1, 256]
    - [295, 0]
  - - [448, 704, 1, 3328]
    - [308, 0]
  - - [448, 1856, 1, 256]
    - [327, 0]
  - - [1856, 704, 1, 3328]
    - [331, 0]
  - - [5888, 6784, 1, 3328]
    - [331, 0]
  - - [704, 4288, 1, 1280]
    - [331, 0]
  - - [4096, 7000, 1, 4096]
    - [370, 0]
  - - [5124, 9124, 1, 1760]
    - [369, 0]
  - - [1760, 32, 1, 1760]
    - [348, 0]
  - - [1024, 1500, 1, 1536]
    - [362, 0]
  - - [512, 24000, 1, 2048]
    - [372, 0]
  - - [3072, 24000, 1, 1024]
    - [370, 0]
  - - [1024, 3000, 1, 2560]
    - [370, 0]
  - - [512, 3136, 1, 2048]
    - [381, 0]
  - - [7680, 4, 1, 2560]
    - [348, 0]
  - - [64, 193600, 1, 64]
    - [369, 0]
  - - [8448, 1500, 1, 2816]
    - [369, 0]
  - - [2560, 7000, 1, 2560]
    - [369, 0]
  - - [3072, 16, 1, 1024]
    - [343, 0]
  - - [512, 48000, 1, 2048]
    - [372, 0]
  - - [1760, 64, 1, 1760]
    - [364, 0]
  - - [1024, 16, 1, 512]
    - [345, 0]
  - - [196, 256, 64, 1024]
    - [382, 0]
  - - [512, 48000, 1, 1536]
    - [370, 0]
  - - [2560, 32, 1, 2560]
    - [348, 0]
  - - [4608, 1500, 1, 1536]
    - [370, 0]
  - - [2048, 128, 1, 2048]
    - [367, 0]
  - - [1024, 24000, 1, 2560]
    - [369, 0]
  - - [4608, 3000, 1, 1536]
    - [370, 0]
  - - [5124, 9124, 1, 2048]
    - [370, 0]
  - - [2048, 16, 1, 2048]
    - [347, 0]
  - - [1024, 700, 1, 512]
    - [361, 0]
  - - [3072, 1, 1, 128]
    - [343, 0]
  - - [5124, 700, 1, 2560]
    - [370, 0]
  - - [8448, 16, 1, 2816]
    - [344, 0]
  - - [6144, 6000, 1, 2560]
    - [363, 0]
  - - [4608, 32, 1, 1536]
    - [343, 0]
  - - [3072, 64, 1, 1024]
    - [359, 0]
  - - [512, 16, 1, 512]
    - [345, 0]
  - - [7680, 2, 1, 2560]
    - [348, 0]
  - - [4224, 1, 1, 128]
    - [343, 0]
  - - [7680, 1, 1, 2560]
    - [348, 0]
  - - [128, 1500, 1, 1280]
    - [343, 0]
  - - [1024, 1500, 1, 2816]
    - [362, 0]
  - - [6144, 2, 1, 2560]
    - [348, 0]
  - - [8448, 48000, 1, 2816]
    - [370, 0]
  - - [512, 6000, 1, 2048]
    - [374, 0]
  - - [4224, 1500, 1, 176]
    - [355, 0]
  - - [1024, 6000, 1, 2816]
    - [369, 0]
  - - [1024, 48000, 1, 1536]
    - [370, 0]
  - - [1024, 48000, 1, 2560]
    - [369, 0]
  - - [4096, 32, 1, 4096]
    - [349, 0]
  - - [512, 16, 1, 500000]
    - [345, 0]
  - - [2560, 128, 1, 2560]
    - [364, 0]
  - - [4608, 24000, 1, 1536]
    - [369, 0]
  - - [512, 2, 1, 500000]
    - [345, 0]
  - - [7680, 48000, 1, 2560]
    - [370, 0]
  - - [3072, 48000, 1, 1024]
    - [370, 0]
  - - [1760, 16, 1, 1760]
    - [343, 0]
  - - [1024, 1500, 1, 2048]
    - [366, 0]
  - - [1024, 16, 1, 500000]
    - [345, 0]
  - - [64, 193600, 1, 256]
    - [375, 0]
  - - [1024, 3000, 1, 2048]
    - [371, 0]
  - - [6144, 4, 1, 2560]
    - [348, 0]
  - - [1024, 6000, 1, 2048]
    - [372, 0]
  - - [512, 24000, 1, 2816]
    - [369, 0]
  - - [6144, 48000, 1, 2560]
    - [372, 0]
  - - [1760, 7000, 1, 1760]
    - [356, 0]
  - - [8448, 3000, 1, 2816]
    - [369, 0]
  - - [3072, 4, 1, 1024]
    - [343, 0]
  - - [4608, 48000, 1, 1536]
    - [369, 0]
  - - [2048, 32, 1, 2048]
    - [368, 0]
  - - [7680, 1500, 1, 2560]
    - [370, 0]
  - - [4096, 128, 1, 4096]
    - [360, 0]
  - - [4608, 16, 1, 1536]
    - [348, 0]
  - - [512, 3000, 1, 1536]
    - [362, 0]
  - - [3072, 2, 1, 1024]
    - [343, 0]
  - - [8448, 1, 1, 2816]
    - [344, 0]
  - - [1024, 3000, 1, 2816]
    - [369, 0]
  - - [128, 1, 1, 1408]
    - [343, 0]
  - - [64, 1, 1, 1216]
    - [345, 0]
  - - [1024, 2, 1, 512]
    - [345, 0]
  - - [1024, 4, 1, 500000]
    - [345, 0]
  - - [6144, 1, 1, 2560]
    - [348, 0]
  - - [5124, 9124, 1, 2560]
    - [370, 0]
  - - [512, 48000, 1, 2816]
    - [369, 0]
  - - [512, 3000, 1, 2816]
    - [362, 0]
  - - [1024, 24000, 1, 1536]
    - [370, 0]
  - - [7680, 6000, 1, 2560]
    - [369, 0]
  - - [1760, 128, 1, 1760]
    - [367, 0]
  - - [512, 1500, 1, 2816]
    - [361, 0]
  - - [512, 1, 1, 512]
    - [350, 0]
  - - [512, 6000, 1, 2560]
    - [370, 0]
  - - [512, 8, 1, 500000]
    - [345, 0]
  - - [512, 24000, 1, 2560]
    - [370, 0]
  - - [6144, 3000, 1, 2560]
    - [372, 0]
  - - [1024, 24000, 1, 2816]
    - [369, 0]
  - - [2048, 7000, 1, 2048]
    - [372, 0]
  - - [7680, 3000, 1, 2560]
    - [363, 0]
  - - [1024, 4, 1, 512]
    - [345, 0]
  - - [5124, 700, 1, 2048]
    - [372, 0]
  - - [5124, 9124, 1, 4096]
    - [363, 0]
  - - [4096, 64, 1, 4096]
    - [368, 0]
  - - [256, 193600, 1, 64]
    - [352, 0]
  - - [7680, 32, 1, 2560]
    - [351, 0]
  - - [2560, 64, 1, 2560]
    - [359, 0]
  - - [3072, 128, 1, 1024]
    - [364, 0]
  - - [8448, 6000, 1, 2816]
    - [370, 0]
  - - [7680, 64, 1, 2560]
    - [345, 0]
  - - [5124, 1500, 1, 2560]
    - [370, 0]
  - - [1024, 1500, 1, 2560]
    - [362, 0]
  - - [512, 4, 1, 512]
    - [350, 0]
  - - [1024, 6000, 1, 2560]
    - [370, 0]
  - - [3072, 32, 1, 1024]
    - [368, 0]
  - - [6144, 32, 1, 2560]
    - [359, 0]
  - - [196, 1024, 64, 256]
    - [385, 0]
  - - [512, 50176, 1, 128]
    - [377, 0]
  - - [4608, 1, 1, 1536]
    - [348, 0]
  - - [1024, 32, 1, 512]
    - [345, 0]
  - - [7680, 24000, 1, 2560]
    - [370, 0]
  - - [8448, 4, 1, 2816]
    - [348, 0]
  - - [512, 1, 1, 500000]
    - [345, 0]
  - - [176, 1500, 1, 1408]
    - [345, 0]
  - - [512, 3000, 1, 2560]
    - [362, 0]
  - - [8448, 24000, 1, 2816]
    - [370, 0]
  - - [4608, 2, 1, 1536]
    - [348, 0]
  - - [512, 6000, 1, 1536]
    - [370, 0]
  - - [7680, 128, 1, 2560]
    - [353, 0]
  - - [3072, 6000, 1, 1024]
    - [370, 0]
  - - [3072, 1500, 1, 128]
    - [369, 0]
  - - [2048, 3136, 1, 512]
    - [379, 0]
  - - [1024, 3000, 1, 1536]
    - [370, 0]
  - - [512, 4, 1, 500000]
    - [345, 0]
  - - [512, 6000, 1, 2816]
    - [370, 0]
  - - [128, 50176, 1, 512]
    - [376, 0]
  - - [256, 12544, 1, 1024]
    - [380, 0]
  - - [1024, 12544, 1, 256]
    - [378, 0]
  - - [512, 48000, 1, 2560]
    - [370, 0]
  - - [2560, 16, 1, 2560]
    - [343, 0]
  - - [2048, 64, 1, 2048]
    - [368, 0]
  - - [512, 2, 1, 512]
    - [350, 0]
  - - [1024, 1, 1, 512]
    - [345, 0]
  - - [512, 1500, 1, 2560]
    - [361, 0]
  - - [512, 24000, 1, 1536]
    - [370, 0]
  - - [1024, 1, 1, 500000]
    - [345, 0]
  - - [6144, 16, 1, 2560]
    - [348, 0]
  - - [1024, 24000, 1, 2048]
    - [372, 0]
  - - [4096, 16, 1, 4096]
    - [349, 0]
  - - [512, 32, 1, 512]
    - [345, 0]
  - - [5124, 1500, 1, 2048]
    - [372, 0]
  - - [3072, 1500, 1, 1024]
    - [362, 0]
  - - [1024, 2, 1, 500000]
    - [345, 0]
  - - [1024, 8, 1, 500000]
    - [345, 0]
  - - [7680, 16, 1, 2560]
    - [348, 0]
  - - [6144, 1500, 1, 2560]
    - [370, 0]
  - - [3072, 1, 1, 1024]
    - [343, 0]
  - - [1024, 48000, 1, 2816]
    - [369, 0]
  - - [8448, 2, 1, 2816]
    - [348, 0]
  - - [4608, 4, 1, 1536]
    - [348, 0]
  - - [1024, 6000, 1, 1536]
    - [370, 0]
  - - [8448, 32, 1, 2816]
    - [345, 0]
  - - [512, 3000, 1, 2048]
    - [372, 0]
  - - [6144, 24000, 1, 2560]
    - [372, 0]
  - - [4608, 6000, 1, 1536]
    - [370, 0]
  - - [1024, 1024, 1, 1024]
    - [372, 0]
  - - [512, 1500, 1, 2048]
    - [372, 0]
  - - [512, 1500, 1, 1536]
    - [361, 0]
  - - [128, 1, 1, 1024]
    - [343, 0]
  - - [3072, 3000, 1, 1024]
    - [372, 0]
  - - [1024, 48000, 1, 2048]
    - [370, 0]
  - - [3136, 64, 128, 64]
    - [430, 0]
  - - [784, 512, 64, 128]
    - [423, 0]
  - - [3136, 256, 64, 64]
    - [430, 0]
  - - [12544, 1024, 1, 256]
    - [426, 0]
  - - [784, 128, 128, 512]
    - [425, 0]
  - - [784, 512, 256, 128]
    - [429, 0]
  - - [3136, 64, 64, 256]
    - [427, 0]
  - - [3136, 512, 1, 2048]
    - [428, 0]
  - - [12544, 256, 1, 1024]
    - [431, 0]
  - - [3136, 2048, 1, 512]
    - [424, 0]
  - - [3136, 256, 256, 64]
    - [433, 0]
  - - [3136, 64, 128, 256]
    - [424, 0]
  - - [784, 128, 64, 512]
    - [425, 0]
  - - [3136, 64, 256, 64]
    - [430, 0]
  - - [784, 512, 128, 128]
    - [423, 0]
  - - [3136, 64, 64, 64]
    - [432, 0]
  - - [784, 128, 256, 512]
    - [425, 0]
  - - [3136, 64, 256, 256]
    - [427, 0]
  - - [3136, 256, 128, 64]
    - [422, 0]
  - - [64, 128, 512, 128]
    - [561, 0]
  - - [64, 512, 1, 512]
    - [475, 0]
  - - [64, 512, 64, 512]
    - [552, 0]
  - - [128, 128, 512, 64]
    - [559, 0]
  - - [512, 512, 1, 64]
    - [496, 0]
  - - [512, 512, 64, 64]
    - [554, 0]
  - - [1024, 4, 1, 2]
    - [460, 0]
  - - [1024, 4, 1, 1024]
    - [536, 0]
  - - [1024, 32, 1, 2]
    - [492, 0]
  - - [1024, 32, 1, 1024]
    - [542, 0]
  - - [1024, 2048, 1, 2]
    - [514, 0]
  - - [1024, 2048, 1, 1024]
    - [499, 0]
  - - [1024, 2048, 1, 4096]
    - [494, 0]
  - - [1024, 2048, 1, 30528]
    - [548, 0]
  - - [1024, 4096, 1, 1024]
    - [529, 0]
  - - [1024, 4096, 1, 4096]
    - [493, 0]
  - - [1024, 4096, 1, 30528]
    - [491, 0]
  - - [4096, 2048, 1, 1024]
    - [486, 0]
  - - [4096, 4096, 1, 1024]
    - [480, 0]
  - - [32, 33, 1600, 33]
    - [467, 0]
  - - [32, 200, 1, 1]
    - [460, 0]
  - - [64, 3, 512, 3]
    - [470, 0]
  - - [64, 5, 512, 5]
    - [470, 0]
  - - [64, 5, 960, 5]
    - [465, 0]
  - - [64, 9, 512, 9]
    - [541, 0]
  - - [64, 512, 1, 1]
    - [477, 0]
  - - [67, 512, 1, 2048]
    - [558, 0]
  - - [74, 512, 1, 2048]
    - [463, 0]
  - - [74, 960, 1, 2048]
    - [534, 0]
  - - [100, 512, 1, 2048]
    - [558, 0]
  - - [128, 27, 32768, 27]
    - [484, 0]
  - - [256, 1024, 1, 1]
    - [507, 0]
  - - [256, 8976, 1, 1536]
    - [556, 0]
  - - [256, 8976, 1, 2048]
    - [528, 0]
  - - [256, 8976, 1, 2304]
    - [540, 0]
  - - [256, 8976, 1, 2560]
    - [505, 0]
  - - [256, 8976, 1, 2816]
    - [521, 0]
  - - [256, 8976, 1, 3072]
    - [512, 0]
  - - [256, 8976, 1, 4352]
    - [474, 0]
  - - [256, 8976, 1, 4864]
    - [476, 0]
  - - [256, 8976, 1, 5376]
    - [512, 0]
  - - [256, 8976, 1, 5632]
    - [474, 0]
  - - [256, 8976, 1, 5888]
    - [474, 0]
  - - [256, 8976, 1, 6144]
    - [495, 0]
  - - [256, 8976, 1, 6656]
    - [474, 0]
  - - [256, 8976, 1, 7168]
    - [509, 0]
  - - [256, 8976, 1, 7424]
    - [476, 0]
  - - [256, 8976, 1, 8192]
    - [512, 0]
  - - [256, 8976, 1, 8448]
    - [476, 0]
  - - [256, 8976, 1, 8960]
    - [476, 0]
  - - [256, 8976, 1, 9472]
    - [474, 0]
  - - [256, 8976, 1, 9728]
    - [474, 0]
  - - [256, 8976, 1, 9984]
    - [476, 0]
  - - [256, 8976, 1, 10240]
    - [495, 0]
  - - [256, 8976, 1, 10496]
    - [474, 0]
  - - [256, 8976, 1, 11008]
    - [543, 0]
  - - [256, 8976, 1, 11520]
    - [560, 0]
  - - [256, 8976, 1, 12288]
    - [488, 0]
  - - [256, 8976, 1, 14336]
    - [512, 0]
  - - [256, 8976, 1, 14848]
    - [551, 0]
  - - [256, 8976, 1, 15104]
    - [476, 0]
  - - [256, 8976, 1, 15872]
    - [551, 0]
  - - [256, 8976, 1, 17152]
    - [476, 0]
  - - [256, 8976, 1, 19712]
    - [474, 0]
  - - [256, 8976, 1, 19968]
    - [495, 0]
  - - [256, 8976, 1, 20480]
    - [512, 0]
  - - [256, 8976, 1, 20992]
    - [545, 0]
  - - [256, 8976, 1, 22016]
    - [516, 0]
  - - [256, 8976, 1, 26112]
    - [553, 0]
  - - [256, 8976, 1, 33536]
    - [522, 0]
  - - [256, 8976, 1, 44505]
    - [502, 0]
  - - [256, 32768, 1, 128]
    - [494, 0]
  - - [257, 1024, 1, 4096]
    - [489, 0]
  - - [480, 32768, 1, 1024]
    - [505, 0]
  - - [512, 200, 1, 1]
    - [462, 0]
  - - [512, 200, 1, 32]
    - [471, 0]
  - - [512, 215, 1, 2048]
    - [518, 0]
  - - [512, 256, 1, 2048]
    - [547, 0]
  - - [512, 1600, 1, 32]
    - [479, 0]
  - - [512, 1600, 1, 512]
    - [539, 0]
  - - [512, 32768, 1, 256]
    - [511, 0]
  - - [560, 200, 1, 1024]
    - [510, 0]
  - - [560, 1600, 1, 1024]
    - [473, 0]
  - - [768, 215, 1, 2048]
    - [466, 0]
  - - [768, 256, 1, 2048]
    - [466, 0]
  - - [1024, 200, 1, 1]
    - [464, 0]
  - - [1024, 512, 1, 1]
    - [532, 0]
  - - [1024, 512, 1, 64]
    - [479, 0]
  - - [1024, 512, 1, 1024]
    - [546, 0]
  - - [1024, 960, 1, 64]
    - [524, 0]
  - - [1024, 960, 1, 1024]
    - [537, 0]
  - - [1024, 1600, 1, 1]
    - [506, 0]
  - - [1024, 1600, 1, 1024]
    - [550, 0]
  - - [1024, 1792, 1, 256]
    - [498, 0]
  - - [1024, 2048, 1, 256]
    - [485, 0]
  - - [1024, 2560, 1, 256]
    - [485, 0]
  - - [1024, 3072, 1, 256]
    - [497, 0]
  - - [1024, 3328, 1, 256]
    - [523, 0]
  - - [1024, 3840, 1, 256]
    - [527, 0]
  - - [1024, 4096, 1, 256]
    - [499, 0]
  - - [1024, 4608, 1, 256]
    - [485, 0]
  - - [1024, 4864, 1, 256]
    - [501, 0]
  - - [1024, 5120, 1, 256]
    - [508, 0]
  - - [1024, 5632, 1, 256]
    - [501, 0]
  - - [1024, 6144, 1, 256]
    - [533, 0]
  - - [1024, 6400, 1, 256]
    - [511, 0]
  - - [1024, 7168, 1, 256]
    - [515, 0]
  - - [1024, 7424, 1, 256]
    - [500, 0]
  - - [1024, 7680, 1, 256]
    - [500, 0]
  - - [1024, 7936, 1, 256]
    - [508, 0]
  - - [1024, 8192, 1, 256]
    - [501, 0]
  - - [1024, 8448, 1, 256]
    - [511, 0]
  - - [1024, 8704, 1, 256]
    - [511, 0]
  - - [1024, 8960, 1, 256]
    - [500, 0]
  - - [1024, 9728, 1, 256]
    - [501, 0]
  - - [1024, 9984, 1, 256]
    - [508, 0]
  - - [1024, 10240, 1, 256]
    - [508, 0]
  - - [1024, 10496, 1, 256]
    - [501, 0]
  - - [1024, 11008, 1, 256]
    - [500, 0]
  - - [1024, 11264, 1, 256]
    - [500, 0]
  - - [1024, 11520, 1, 256]
    - [501, 0]
  - - [1024, 12288, 1, 256]
    - [508, 0]
  - - [1024, 13312, 1, 256]
    - [508, 0]
  - - [1024, 13568, 1, 256]
    - [508, 0]
  - - [1024, 14336, 1, 256]
    - [500, 0]
  - - [1024, 14592, 1, 256]
    - [511, 0]
  - - [1024, 14848, 1, 256]
    - [508, 0]
  - - [1024, 15104, 1, 256]
    - [501, 0]
  - - [1024, 16128, 1, 256]
    - [500, 0]
  - - [1024, 17152, 1, 256]
    - [501, 0]
  - - [1024, 18944, 1, 256]
    - [508, 0]
  - - [1024, 19712, 1, 256]
    - [508, 0]
  - - [1024, 19968, 1, 256]
    - [500, 0]
  - - [1024, 20480, 1, 256]
    - [500, 0]
  - - [1024, 20992, 1, 256]
    - [508, 0]
  - - [1024, 21504, 1, 256]
    - [511, 0]
  - - [1024, 22016, 1, 256]
    - [508, 0]
  - - [1024, 23552, 1, 256]
    - [500, 0]
  - - [1024, 28672, 1, 256]
    - [508, 0]
  - - [1024, 32768, 1, 512]
    - [508, 0]
  - - [1024, 32768, 1, 1024]
    - [509, 0]
  - - [1024, 33536, 1, 256]
    - [515, 0]
  - - [1024, 40448, 1, 256]
    - [511, 0]
  - - [1600, 512, 1, 1024]
    - [544, 0]
  - - [2048, 512, 1, 1]
    - [490, 0]
  - - [2048, 512, 1, 2048]
    - [517, 0]
  - - [2048, 960, 1, 2048]
    - [520, 0]
  - - [2048, 1024, 1, 1]
    - [478, 0]
  - - [2048, 1024, 1, 256]
    - [481, 0]
  - - [3200, 1024, 1, 2048]
    - [535, 0]
  - - [4096, 1024, 1, 1]
    - [483, 0]
  - - [64, 14, 1, 14]
    - [461, 0]
  - - [64, 14, 1, 15]
    - [461, 0]
  - - [64, 15, 1, 15]
    - [460, 0]
  - - [64, 15, 1, 15]
    - [460, 0]
  - - [64, 15, 1, 17]
    - [460, 0]
  - - [64, 17, 1, 17]
    - [460, 0]
  - - [64, 17, 1, 17]
    - [460, 0]
  - - [64, 17, 1, 21]
    - [461, 0]
  - - [64, 21, 1, 21]
    - [461, 0]
  - - [64, 24, 1, 24]
    - [461, 0]
  - - [64, 24, 1, 34]
    - [461, 0]
  - - [64, 30, 1, 30]
    - [461, 0]
  - - [64, 31, 1, 30]
    - [469, 0]
  - - [64, 31, 1, 31]
    - [472, 0]
  - - [64, 32, 1, 32]
    - [464, 0]
  - - [64, 34, 1, 34]
    - [468, 0]
  - - [64, 35, 1, 32]
    - [467, 0]
  - - [64, 35, 1, 35]
    - [461, 0]
  - - [1024, 3840, 1, 1024]
    - [538, 0]
  - - [1024, 3840, 1, 4096]
    - [512, 0]
  - - [1024, 3968, 1, 1024]
    - [519, 0]
  - - [1024, 3968, 1, 4096]
    - [493, 0]
  - - [1024, 3968, 1, 42720]
    - [531, 0]
  - - [1024, 6528, 1, 1024]
    - [528, 0]
  - - [1024, 6528, 1, 4096]
    - [549, 0]
  - - [1024, 6528, 1, 42720]
    - [526, 0]
  - - [1024, 7104, 1, 1024]
    - [530, 0]
  - - [1024, 7104, 1, 4096]
    - [549, 0]
  - - [1024, 7104, 1, 42720]
    - [517, 0]
  - - [1024, 7200, 1, 1024]
    - [528, 0]
  - - [1024, 7200, 1, 4096]
    - [555, 0]
  - - [1024, 7200, 1, 42720]
    - [526, 0]
  - - [1024, 8064, 1, 1024]
    - [527, 0]
  - - [1024, 8064, 1, 4096]
    - [505, 0]
  - - [1024, 8160, 1, 1024]
    - [508, 0]
  - - [1024, 8160, 1, 4096]
    - [509, 0]
  - - [1024, 9216, 1, 1024]
    - [508, 0]
  - - [1024, 9216, 1, 4096]
    - [505, 0]
  - - [1024, 9520, 1, 1024]
    - [508, 0]
  - - [1024, 9520, 1, 4096]
    - [503, 0]
  - - [1024, 9520, 1, 42720]
    - [525, 0]
  - - [1024, 10064, 1, 1024]
    - [493, 0]
  - - [1024, 10064, 1, 4096]
    - [504, 0]
  - - [1024, 10080, 1, 1024]
    - [495, 0]
  - - [1024, 10080, 1, 4096]
    - [504, 0]
  - - [1024, 10080, 1, 42720]
    - [513, 0]
  - - [1024, 10200, 1, 1024]
    - [530, 0]
  - - [1024, 10200, 1, 4096]
    - [495, 0]
  - - [4096, 3840, 1, 1024]
    - [486, 0]
  - - [4096, 3968, 1, 1024]
    - [486, 0]
  - - [4096, 6528, 1, 1024]
    - [487, 0]
  - - [4096, 7104, 1, 1024]
    - [486, 0]
  - - [4096, 7200, 1, 1024]
    - [486, 0]
  - - [4096, 8064, 1, 1024]
    - [486, 0]
  - - [4096, 8160, 1, 1024]
    - [480, 0]
  - - [4096, 9216, 1, 1024]
    - [486, 0]
  - - [4096, 9520, 1, 1024]
    - [487, 0]
  - - [4096, 10064, 1, 1024]
    - [487, 0]
  - - [4096, 10080, 1, 1024]
    - [487, 0]
  - - [4096, 10200, 1, 1024]
    - [487, 0]
  - - [1024, 3240, 1, 1024]
    - [520, 0]
  - - [1024, 3240, 1, 4096]
    - [557, 0]
  - - [1024, 3960, 1, 1024]
    - [499, 0]
  - - [1024, 3960, 1, 4096]
    - [493, 0]
  - - [1024, 3960, 1, 42720]
    - [517, 0]
  - - [4096, 3240, 1, 1024]
    - [487, 0]
  - - [4096, 3960, 1, 1024]
    - [482, 0]
  - - [64, 30, 2048, 30]
    - [573, 0]
  - - [64, 31, 2048, 30]
    - [564, 0]
  - - [64, 31, 2048, 31]
    - [569, 0]
  - - [64, 27, 1920, 27]
    - [568, 0]
  - - [64, 33, 1920, 27]
    - [572, 0]
  - - [64, 33, 1920, 33]
    - [571, 0]
  - - [64, 14, 10880, 14]
    - [563, 0]
  - - [64, 14, 10880, 15]
    - [562, 0]
  - - [64, 15, 7680, 15]
    - [570, 0]
  - - [64, 15, 10880, 15]
    - [567, 0]
  - - [64, 15, 7680, 17]
    - [566, 0]
  - - [64, 17, 7680, 17]
    - [565, 0]
- null
