library/src/blas3/Tensile/Logic/asm_full/arcturus_Cijk_Ailk_Bjlk_I8II_BH_GB.yaml
- {MinimumRequiredVersion: 4.26.0}
- arcturus
- gfx908
- [Device 7380, Device 7388, Device 738c, Device 7390]
    SolutionIndex: 0
    SolutionNameMin: Cijk_Ailk_Bjlk_I8II_BH_GB_MT64x64x32_MI32x32x8x1_SN_1LDSB0_EPS1_GRVW4_OPLV0_PK0_PAP0_PGR1_SU32_SUS256_SRVW0_TT1_32_WG64_4_1_WGM8
    SolutionIndex: 1
    SolutionNameMin: Cijk_Ailk_Bjlk_I8II_BH_GB_MT64x64x64_MI32x32x8x1_SN_1LDSB0_EPS1_GRVW4_OPLV0_PK0_PAP0_PGR1_SU32_SUS256_SRVW0_TT1_32_WG64_4_1_WGM8
    SolutionIndex: 2
    SolutionNameMin: Cijk_Ailk_Bjlk_I8II_BH_GB_MT256x256x32_MI32x32x8x1_SN_1LDSB0_EPS1_GRVW16_OPLV0_PKn1_PAP0_PGR1_SU0_SUS128_SRVW0_TT4_128_WG64_4_1_WGM1
    SolutionIndex: 3
    SolutionNameMin: Cijk_Ailk_Bjlk_I8II_BH_GB_MT32x32x32_MI16x16x16x1_SN_1LDSB0_EPS1_GRVW4_OPLV0_PK0_PAP0_PGR1_SU0_SUS128_SRVW0_TT1_16_WG32_8_1_WGM1
    SolutionIndex: 4
    SolutionNameMin: Cijk_Ailk_Bjlk_I8II_BH_GB_MT32x64x32_MI16x16x16x1_SN_1LDSB0_EPS1_GRVW4_OPLV0_PK0_PAP0_PGR1_SU0_SUS128_SRVW0_TT1_32_WG32_8_1_WGM1
    SolutionIndex: 5
    SolutionNameMin: Cijk_Ailk_Bjlk_I8II_BH_GB_MT32x64x32_MI16x16x16x1_SN_1LDSB0_EPS1_GRVW8_OPLV0_PK0_PAP0_PGR1_SU0_SUS128_SRVW0_TT1_32_WG32_8_1_WGM1
    SolutionIndex: 6
    SolutionNameMin: Cijk_Ailk_Bjlk_I8II_BH_GB_MT64x32x32_MI16x16x16x1_SN_1LDSB0_EPS1_GRVW8_OPLV0_PK0_PAP0_PGR1_SU0_SUS128_SRVW0_TT2_16_WG32_8_1_WGM1
    SolutionIndex: 7
    SolutionNameMin: Cijk_Ailk_Bjlk_I8II_BH_GB_MT32x32x64_MI16x16x16x1_SN_1LDSB0_EPS1_GRVW8_OPLV0_PK0_PAP0_PGR1_SU0_SUS128_SRVW0_TT1_16_WG32_8_1_WGM1
    SolutionIndex: 8
    SolutionNameMin: Cijk_Ailk_Bjlk_I8II_BH_GB_MT32x64x64_MI16x16x16x1_SN_1LDSB0_EPS1_GRVW8_OPLV0_PK0_PAP0_PGR1_SU0_SUS128_SRVW0_TT1_32_WG32_8_1_WGM1
    SolutionIndex: 9
    SolutionNameMin: Cijk_Ailk_Bjlk_I8II_BH_GB_MT32x32x64_MI16x16x16x1_SN_1LDSB0_EPS1_GRVW16_OPLV0_PK0_PAP0_PGR1_SU0_SUS128_SRVW0_TT1_16_WG32_8_1_WGM1
    SolutionIndex: 10
    SolutionNameMin: Cijk_Ailk_Bjlk_I8II_BH_GB_MT32x64x64_MI16x16x16x1_SN_1LDSB0_EPS1_GRVW16_OPLV0_PK0_PAP0_PGR1_SU0_SUS128_SRVW0_TT1_32_WG32_8_1_WGM1
    SolutionIndex: 11
    SolutionNameMin: Cijk_Ailk_Bjlk_I8II_BH_GB_MT32x32x32_MI16x16x16x1_SN_1LDSB0_EPS0_GRVW4_OPLV0_PK0_PAP0_PGR2_SU0_SUS128_SRVW0_TT1_16_WG32_8_1_WGM1
    SolutionIndex: 12
    SolutionNameMin: Cijk_Ailk_Bjlk_I8II_BH_GB_MT32x64x32_MI16x16x16x1_SN_1LDSB0_EPS0_GRVW4_OPLV0_PK0_PAP0_PGR2_SU0_SUS128_SRVW0_TT1_32_WG32_8_1_WGM1
    SolutionIndex: 13
    SolutionNameMin: Cijk_Ailk_Bjlk_I8II_BH_GB_MT32x32x32_MI16x16x16x1_SN_1LDSB0_EPS0_GRVW8_OPLV0_PK0_PAP0_PGR2_SU0_SUS128_SRVW0_TT1_16_WG32_8_1_WGM1
    SolutionIndex: 14
    SolutionNameMin: Cijk_Ailk_Bjlk_I8II_BH_GB_MT32x32x64_MI16x16x16x1_SN_1LDSB0_EPS0_GRVW8_OPLV0_PK0_PAP0_PGR2_SU0_SUS128_SRVW0_TT1_16_WG32_8_1_WGM1
    SolutionIndex: 15
    SolutionNameMin: Cijk_Ailk_Bjlk_I8II_BH_GB_MT64x32x64_MI16x16x16x1_SN_1LDSB0_EPS0_GRVW8_OPLV0_PK0_PAP0_PGR2_SU0_SUS128_SRVW0_TT2_16_WG32_8_1_WGM1
    SolutionIndex: 16
    SolutionNameMin: Cijk_Ailk_Bjlk_I8II_BH_GB_MT32x32x128_MI16x16x16x1_SN_1LDSB0_EPS0_GRVW8_OPLV0_PK0_PAP0_PGR2_SU0_SUS128_SRVW0_TT1_16_WG32_8_1_WGM1
    SolutionIndex: 17
    SolutionNameMin: Cijk_Ailk_Bjlk_I8II_BH_GB_MT64x32x32_MI16x16x16x1_SN_1LDSB0_EPS0_GRVW16_OPLV0_PK0_PAP0_PGR2_SU0_SUS128_SRVW0_TT2_16_WG32_8_1_WGM1
    SolutionIndex: 18
    SolutionNameMin: Cijk_Ailk_Bjlk_I8II_BH_GB_MT128x128x32_MI32x32x8x1_SN_1LDSB0_EPS0_GRVW16_OPLV0_PK0_PAP0_PGR2_SU0_SUS128_SRVW0_TT2_64_WG64_4_1_WGM1
    SolutionIndex: 19
    SolutionNameMin: Cijk_Ailk_Bjlk_I8II_BH_GB_MT32x32x64_MI16x16x16x1_SN_1LDSB0_EPS0_GRVW16_OPLV0_PK0_PAP0_PGR2_SU0_SUS128_SRVW0_TT1_16_WG32_8_1_WGM1
    SolutionIndex: 20
    SolutionNameMin: Cijk_Ailk_Bjlk_I8II_BH_GB_MT32x64x64_MI16x16x16x1_SN_1LDSB0_EPS0_GRVW16_OPLV0_PK0_PAP0_PGR2_SU0_SUS128_SRVW0_TT1_32_WG32_8_1_WGM1
    SolutionIndex: 21
    SolutionNameMin: Cijk_Ailk_Bjlk_I8II_BH_GB_MT32x32x128_MI16x16x16x1_SN_1LDSB0_EPS0_GRVW16_OPLV0_PK0_PAP0_PGR2_SU0_SUS128_SRVW0_TT1_16_WG32_8_1_WGM1
    SolutionIndex: 22
    SolutionNameMin: Cijk_Ailk_Bjlk_I8II_BH_GB_MT64x32x32_MI16x16x16x1_SN_1LDSB0_EPS1_GRVW4_OPLV0_PK0_PAP0_PGR1_SU0_SUS128_SRVW4_TT2_16_WG32_8_1_WGM1
    SolutionIndex: 23
    SolutionNameMin: Cijk_Ailk_Bjlk_I8II_BH_GB_MT64x32x32_MI16x16x16x1_SN_1LDSB0_EPS1_GRVW16_OPLV0_PK0_PAP0_PGR1_SU0_SUS128_SRVW4_TT2_16_WG32_8_1_WGM1
    SolutionIndex: 24
    SolutionNameMin: Cijk_Ailk_Bjlk_I8II_BH_GB_MT64x64x64_MI32x32x8x1_SN_1LDSB0_EPS1_GRVW16_OPLV0_PK0_PAP0_PGR1_SU0_SUS128_SRVW4_TT1_32_WG64_4_1_WGM1
    SolutionIndex: 25
    SolutionNameMin: Cijk_Ailk_Bjlk_I8II_BH_GB_MT32x32x32_MI16x16x16x1_SN_1LDSB0_EPS0_GRVW8_OPLV0_PK0_PAP0_PGR2_SU0_SUS128_SRVW4_TT1_16_WG32_8_1_WGM1
    SolutionIndex: 26
    SolutionNameMin: Cijk_Ailk_Bjlk_I8II_BH_GB_MT64x64x64_MI32x32x8x1_SN_1LDSB0_EPS0_GRVW8_OPLV0_PK0_PAP0_PGR2_SU0_SUS128_SRVW4_TT1_32_WG64_4_1_WGM1
    SolutionIndex: 27
    SolutionNameMin: Cijk_Ailk_Bjlk_I8II_BH_GB_MT64x64x32_MI32x32x8x1_SN_1LDSB0_EPS0_GRVW16_OPLV0_PK0_PAP0_PGR2_SU0_SUS128_SRVW4_TT1_32_WG64_4_1_WGM1
    SolutionIndex: 28
    SolutionNameMin: Cijk_Ailk_Bjlk_I8II_BH_GB_MT64x128x32_MI32x32x8x1_SN_1LDSB0_EPS0_GRVW16_OPLV0_PK0_PAP0_PGR2_SU0_SUS128_SRVW4_TT1_64_WG64_4_1_WGM1
    SolutionIndex: 29
    SolutionNameMin: Cijk_Ailk_Bjlk_I8II_BH_GB_MT64x64x64_MI32x32x8x1_SN_1LDSB0_EPS0_GRVW16_OPLV0_PK0_PAP0_PGR2_SU0_SUS128_SRVW4_TT1_32_WG64_4_1_WGM1
    SolutionIndex: 30
    SolutionNameMin: Cijk_Ailk_Bjlk_I8II_BH_GB_MT32x32x32_MI16x16x16x1_SN_1LDSB0_EPS1_GRVW4_OPLV0_PK0_PAP0_PGR1_SU0_SUS256_SRVW0_TT1_16_WG32_8_1_WGM1
    SolutionIndex: 31
    SolutionNameMin: Cijk_Ailk_Bjlk_I8II_BH_GB_MT32x64x32_MI16x16x16x1_SN_1LDSB0_EPS1_GRVW4_OPLV0_PK0_PAP0_PGR1_SU0_SUS256_SRVW0_TT1_32_WG32_8_1_WGM1
    SolutionIndex: 32
    SolutionNameMin: Cijk_Ailk_Bjlk_I8II_BH_GB_MT32x32x32_MI16x16x16x1_SN_1LDSB0_EPS1_GRVW8_OPLV0_PK0_PAP0_PGR1_SU0_SUS256_SRVW0_TT1_16_WG32_8_1_WGM1
    SolutionIndex: 33
    SolutionNameMin: Cijk_Ailk_Bjlk_I8II_BH_GB_MT32x32x64_MI16x16x16x1_SN_1LDSB0_EPS1_GRVW8_OPLV0_PK0_PAP0_PGR1_SU0_SUS256_SRVW0_TT1_16_WG32_8_1_WGM1
    SolutionIndex: 34
    SolutionNameMin: Cijk_Ailk_Bjlk_I8II_BH_GB_MT32x32x32_MI16x16x16x1_SN_1LDSB0_EPS1_GRVW16_OPLV0_PK0_PAP0_PGR1_SU0_SUS256_SRVW0_TT1_16_WG32_8_1_WGM1
    SolutionIndex: 35
    SolutionNameMin: Cijk_Ailk_Bjlk_I8II_BH_GB_MT64x32x32_MI16x16x16x1_SN_1LDSB0_EPS1_GRVW16_OPLV0_PK0_PAP0_PGR1_SU0_SUS256_SRVW0_TT2_16_WG32_8_1_WGM1
    SolutionIndex: 36
    SolutionNameMin: Cijk_Ailk_Bjlk_I8II_BH_GB_MT32x32x32_MI16x16x16x1_SN_1LDSB0_EPS0_GRVW4_OPLV0_PK0_PAP0_PGR2_SU0_SUS256_SRVW0_TT1_16_WG32_8_1_WGM1
    SolutionIndex: 37
    SolutionNameMin: Cijk_Ailk_Bjlk_I8II_BH_GB_MT32x32x32_MI16x16x16x1_SN_1LDSB0_EPS0_GRVW8_OPLV0_PK0_PAP0_PGR2_SU0_SUS256_SRVW0_TT1_16_WG32_8_1_WGM1
    SolutionIndex: 38
    SolutionNameMin: Cijk_Ailk_Bjlk_I8II_BH_GB_MT128x64x32_MI32x32x8x1_SN_1LDSB0_EPS0_GRVW8_OPLV0_PK0_PAP0_PGR2_SU0_SUS256_SRVW0_TT2_32_WG64_4_1_WGM1
    SolutionIndex: 39
    SolutionNameMin: Cijk_Ailk_Bjlk_I8II_BH_GB_MT32x32x64_MI16x16x16x1_SN_1LDSB0_EPS0_GRVW8_OPLV0_PK0_PAP0_PGR2_SU0_SUS256_SRVW0_TT1_16_WG32_8_1_WGM1
    SolutionIndex: 40
    SolutionNameMin: Cijk_Ailk_Bjlk_I8II_BH_GB_MT64x32x64_MI16x16x16x1_SN_1LDSB0_EPS0_GRVW8_OPLV0_PK0_PAP0_PGR2_SU0_SUS256_SRVW0_TT2_16_WG32_8_1_WGM1
    SolutionIndex: 41
    SolutionNameMin: Cijk_Ailk_Bjlk_I8II_BH_GB_MT32x32x128_MI16x16x16x1_SN_1LDSB0_EPS0_GRVW8_OPLV0_PK0_PAP0_PGR2_SU0_SUS256_SRVW0_TT1_16_WG32_8_1_WGM1
    SolutionIndex: 42
    SolutionNameMin: Cijk_Ailk_Bjlk_I8II_BH_GB_MT32x32x32_MI16x16x16x1_SN_1LDSB0_EPS0_GRVW16_OPLV0_PK0_PAP0_PGR2_SU0_SUS256_SRVW0_TT1_16_WG32_8_1_WGM1
    SolutionIndex: 43
    SolutionNameMin: Cijk_Ailk_Bjlk_I8II_BH_GB_MT64x32x32_MI16x16x16x1_SN_1LDSB0_EPS0_GRVW16_OPLV0_PK0_PAP0_PGR2_SU0_SUS256_SRVW0_TT2_16_WG32_8_1_WGM1
    SolutionIndex: 44
    SolutionNameMin: Cijk_Ailk_Bjlk_I8II_BH_GB_MT128x128x32_MI32x32x8x1_SN_1LDSB0_EPS0_GRVW16_OPLV0_PK0_PAP0_PGR2_SU0_SUS256_SRVW0_TT2_64_WG64_4_1_WGM1
    SolutionIndex: 45
    SolutionNameMin: Cijk_Ailk_Bjlk_I8II_BH_GB_MT256x128x32_MI32x32x8x1_SN_1LDSB0_EPS0_GRVW16_OPLV0_PK0_PAP0_PGR2_SU0_SUS256_SRVW0_TT4_64_WG64_4_1_WGM1
    SolutionIndex: 46
    SolutionNameMin: Cijk_Ailk_Bjlk_I8II_BH_GB_MT32x32x64_MI16x16x16x1_SN_1LDSB0_EPS0_GRVW16_OPLV0_PK0_PAP0_PGR2_SU0_SUS256_SRVW0_TT1_16_WG32_8_1_WGM1
    SolutionIndex: 47
    SolutionNameMin: Cijk_Ailk_Bjlk_I8II_BH_GB_MT64x32x32_MI16x16x16x1_SN_1LDSB0_EPS1_GRVW4_OPLV0_PK0_PAP0_PGR1_SU0_SUS256_SRVW4_TT2_16_WG32_8_1_WGM1
    SolutionIndex: 48
    SolutionNameMin: Cijk_Ailk_Bjlk_I8II_BH_GB_MT64x64x64_MI32x32x8x1_SN_1LDSB0_EPS1_GRVW4_OPLV0_PK0_PAP0_PGR1_SU0_SUS256_SRVW4_TT1_32_WG64_4_1_WGM1
    SolutionIndex: 49
    SolutionNameMin: Cijk_Ailk_Bjlk_I8II_BH_GB_MT64x32x32_MI16x16x16x1_SN_1LDSB0_EPS1_GRVW8_OPLV0_PK0_PAP0_PGR1_SU0_SUS256_SRVW4_TT2_16_WG32_8_1_WGM1
    SolutionIndex: 50
    SolutionNameMin: Cijk_Ailk_Bjlk_I8II_BH_GB_MT64x32x32_MI16x16x16x1_SN_1LDSB0_EPS1_GRVW16_OPLV0_PK0_PAP0_PGR1_SU0_SUS256_SRVW4_TT2_16_WG32_8_1_WGM1
    SolutionIndex: 51
    SolutionNameMin: Cijk_Ailk_Bjlk_I8II_BH_GB_MT64x64x32_MI32x32x8x1_SN_1LDSB0_EPS1_GRVW16_OPLV0_PK0_PAP0_PGR1_SU0_SUS256_SRVW4_TT1_32_WG64_4_1_WGM1
    SolutionIndex: 52
    SolutionNameMin: Cijk_Ailk_Bjlk_I8II_BH_GB_MT64x64x64_MI32x32x8x1_SN_1LDSB0_EPS1_GRVW16_OPLV0_PK0_PAP0_PGR1_SU0_SUS256_SRVW4_TT1_32_WG64_4_1_WGM1
    SolutionIndex: 53
    SolutionNameMin: Cijk_Ailk_Bjlk_I8II_BH_GB_MT32x32x32_MI16x16x16x1_SN_1LDSB0_EPS0_GRVW8_OPLV0_PK0_PAP0_PGR2_SU0_SUS256_SRVW4_TT1_16_WG32_8_1_WGM1
    SolutionIndex: 54
    SolutionNameMin: Cijk_Ailk_Bjlk_I8II_BH_GB_MT64x64x64_MI32x32x8x1_SN_1LDSB0_EPS0_GRVW8_OPLV0_PK0_PAP0_PGR2_SU0_SUS256_SRVW4_TT1_32_WG64_4_1_WGM1
    SolutionIndex: 55
    SolutionNameMin: Cijk_Ailk_Bjlk_I8II_BH_GB_MT64x64x32_MI32x32x8x1_SN_1LDSB0_EPS0_GRVW16_OPLV0_PK0_PAP0_PGR2_SU0_SUS256_SRVW4_TT1_32_WG64_4_1_WGM1
    SolutionIndex: 56
    SolutionNameMin: Cijk_Ailk_Bjlk_I8II_BH_GB_MT64x128x32_MI32x32x8x1_SN_1LDSB0_EPS0_GRVW16_OPLV0_PK0_PAP0_PGR2_SU0_SUS256_SRVW4_TT1_64_WG64_4_1_WGM1
    SolutionIndex: 57
    SolutionNameMin: Cijk_Ailk_Bjlk_I8II_BH_GB_MT64x64x64_MI32x32x8x1_SN_1LDSB0_EPS0_GRVW16_OPLV0_PK0_PAP0_PGR2_SU0_SUS256_SRVW4_TT1_32_WG64_4_1_WGM1
    SolutionIndex: 58
    SolutionNameMin: Cijk_Ailk_Bjlk_I8II_BH_GB_MT32x32x32_MI16x16x16x1_SN_1LDSB0_EPS1_GRVW4_OPLV0_PK0_PAP0_PGR1_SU32_SUS128_SRVW0_TT1_16_WG32_8_1_WGM1
    SolutionIndex: 59
    SolutionNameMin: Cijk_Ailk_Bjlk_I8II_BH_GB_MT32x32x64_MI16x16x16x1_SN_1LDSB0_EPS1_GRVW8_OPLV0_PK0_PAP0_PGR1_SU32_SUS128_SRVW0_TT1_16_WG32_8_1_WGM1
    SolutionIndex: 60
    SolutionNameMin: Cijk_Ailk_Bjlk_I8II_BH_GB_MT64x32x32_MI16x16x16x1_SN_1LDSB0_EPS0_GRVW8_OPLV0_PK0_PAP0_PGR2_SU32_SUS128_SRVW0_TT2_16_WG32_8_1_WGM1
    SolutionIndex: 61
    SolutionNameMin: Cijk_Ailk_Bjlk_I8II_BH_GB_MT64x32x64_MI16x16x16x1_SN_1LDSB0_EPS0_GRVW8_OPLV0_PK0_PAP0_PGR2_SU32_SUS128_SRVW0_TT2_16_WG32_8_1_WGM1
    SolutionIndex: 62
    SolutionNameMin: Cijk_Ailk_Bjlk_I8II_BH_GB_MT64x32x32_MI16x16x16x1_SN_1LDSB0_EPS0_GRVW16_OPLV0_PK0_PAP0_PGR2_SU32_SUS128_SRVW0_TT2_16_WG32_8_1_WGM1
    SolutionIndex: 63
    SolutionNameMin: Cijk_Ailk_Bjlk_I8II_BH_GB_MT32x32x64_MI16x16x16x1_SN_1LDSB0_EPS0_GRVW16_OPLV0_PK0_PAP0_PGR2_SU32_SUS128_SRVW0_TT1_16_WG32_8_1_WGM1
    SolutionIndex: 64
    SolutionNameMin: Cijk_Ailk_Bjlk_I8II_BH_GB_MT32x32x128_MI16x16x16x1_SN_1LDSB0_EPS0_GRVW16_OPLV0_PK0_PAP0_PGR2_SU32_SUS128_SRVW0_TT1_16_WG32_8_1_WGM1
    SolutionIndex: 65
    SolutionNameMin: Cijk_Ailk_Bjlk_I8II_BH_GB_MT64x32x32_MI16x16x16x1_SN_1LDSB0_EPS1_GRVW4_OPLV0_PK0_PAP0_PGR1_SU32_SUS128_SRVW4_TT2_16_WG32_8_1_WGM1
    SolutionIndex: 66
    SolutionNameMin: Cijk_Ailk_Bjlk_I8II_BH_GB_MT32x64x32_MI16x16x16x1_SN_1LDSB0_EPS1_GRVW8_OPLV0_PK0_PAP0_PGR1_SU32_SUS128_SRVW4_TT1_32_WG32_8_1_WGM1
    SolutionIndex: 67
    SolutionNameMin: Cijk_Ailk_Bjlk_I8II_BH_GB_MT64x64x64_MI32x32x8x1_SN_1LDSB0_EPS1_GRVW16_OPLV0_PK0_PAP0_PGR1_SU32_SUS128_SRVW4_TT1_32_WG64_4_1_WGM1
    SolutionIndex: 68
    SolutionNameMin: Cijk_Ailk_Bjlk_I8II_BH_GB_MT32x32x64_MI16x16x16x1_SN_1LDSB0_EPS0_GRVW8_OPLV0_PK0_PAP0_PGR2_SU32_SUS128_SRVW4_TT1_16_WG32_8_1_WGM1
    SolutionIndex: 69
    SolutionNameMin: Cijk_Ailk_Bjlk_I8II_BH_GB_MT64x64x32_MI32x32x8x1_SN_1LDSB0_EPS0_GRVW16_OPLV0_PK0_PAP0_PGR2_SU32_SUS128_SRVW4_TT1_32_WG64_4_1_WGM1
    SolutionIndex: 70
    SolutionNameMin: Cijk_Ailk_Bjlk_I8II_BH_GB_MT32x32x64_MI16x16x16x1_SN_1LDSB0_EPS0_GRVW16_OPLV0_PK0_PAP0_PGR2_SU32_SUS128_SRVW4_TT1_16_WG32_8_1_WGM1
    SolutionIndex: 71
    SolutionNameMin: Cijk_Ailk_Bjlk_I8II_BH_GB_MT32x32x64_MI16x16x16x1_SN_1LDSB0_EPS1_GRVW8_OPLV0_PK0_PAP0_PGR1_SU32_SUS256_SRVW0_TT1_16_WG32_8_1_WGM1
    SolutionIndex: 72
    SolutionNameMin: Cijk_Ailk_Bjlk_I8II_BH_GB_MT32x32x128_MI16x16x16x1_SN_1LDSB0_EPS1_GRVW8_OPLV0_PK0_PAP0_PGR1_SU32_SUS256_SRVW0_TT1_16_WG32_8_1_WGM1
    SolutionIndex: 73
    SolutionNameMin: Cijk_Ailk_Bjlk_I8II_BH_GB_MT64x32x32_MI16x16x16x1_SN_1LDSB0_EPS1_GRVW16_OPLV0_PK0_PAP0_PGR1_SU32_SUS256_SRVW0_TT2_16_WG32_8_1_WGM1
    SolutionIndex: 74
    SolutionNameMin: Cijk_Ailk_Bjlk_I8II_BH_GB_MT32x32x32_MI16x16x16x1_SN_1LDSB0_EPS0_GRVW4_OPLV0_PK0_PAP0_PGR2_SU32_SUS256_SRVW0_TT1_16_WG32_8_1_WGM1
    SolutionIndex: 75
    SolutionNameMin: Cijk_Ailk_Bjlk_I8II_BH_GB_MT32x32x64_MI16x16x16x1_SN_1LDSB0_EPS0_GRVW16_OPLV0_PK0_PAP0_PGR2_SU32_SUS256_SRVW0_TT1_16_WG32_8_1_WGM1
    SolutionIndex: 76
    SolutionNameMin: Cijk_Ailk_Bjlk_I8II_BH_GB_MT32x32x32_MI16x16x16x1_SN_1LDSB0_EPS0_GRVW8_OPLV0_PK0_PAP0_PGR2_SU32_SUS256_SRVW4_TT1_16_WG32_8_1_WGM1
    SolutionIndex: 77
    SolutionNameMin: Cijk_Ailk_Bjlk_I8II_BH_GB_MT64x64x32_MI32x32x8x1_SN_1LDSB0_EPS0_GRVW8_OPLV0_PK0_PAP0_PGR2_SU32_SUS256_SRVW4_TT1_32_WG64_4_1_WGM1
    SolutionIndex: 78
    SolutionNameMin: Cijk_Ailk_Bjlk_I8II_BH_GB_MT32x32x64_MI16x16x16x1_SN_1LDSB0_EPS0_GRVW8_OPLV0_PK0_PAP0_PGR2_SU32_SUS256_SRVW4_TT1_16_WG32_8_1_WGM1
    SolutionIndex: 79
    SolutionNameMin: Cijk_Ailk_Bjlk_I8II_BH_GB_MT64x128x32_MI32x32x8x1_SN_1LDSB0_EPS0_GRVW16_OPLV0_PK0_PAP0_PGR2_SU32_SUS256_SRVW4_TT1_64_WG64_4_1_WGM1
    SolutionIndex: 80
    SolutionNameMin: Cijk_Ailk_Bjlk_I8II_BH_GB_MT64x64x64_MI32x32x8x1_SN_1LDSB0_EPS0_GRVW16_OPLV0_PK0_PAP0_PGR2_SU32_SUS256_SRVW4_TT1_32_WG64_4_1_WGM1
    SolutionIndex: 81
    SolutionNameMin: Cijk_Ailk_Bjlk_I8II_BH_GB_MT32x32x64_MI16x16x16x1_SN_1LDSB0_EPS1_GRVW4_OPLV0_PK0_PAP0_PGR1_SU0_SUS128_SRVW0_TT1_16_WG32_8_1_WGM2
    SolutionIndex: 82
    SolutionNameMin: Cijk_Ailk_Bjlk_I8II_BH_GB_MT32x32x32_MI16x16x16x1_SN_1LDSB0_EPS1_GRVW8_OPLV0_PK0_PAP0_PGR1_SU0_SUS128_SRVW0_TT1_16_WG32_8_1_WGM2
    SolutionIndex: 83
    SolutionNameMin: Cijk_Ailk_Bjlk_I8II_BH_GB_MT32x64x32_MI16x16x16x1_SN_1LDSB0_EPS1_GRVW16_OPLV0_PK0_PAP0_PGR1_SU0_SUS128_SRVW0_TT1_32_WG32_8_1_WGM2
    SolutionIndex: 84
    SolutionNameMin: Cijk_Ailk_Bjlk_I8II_BH_GB_MT32x32x64_MI16x16x16x1_SN_1LDSB0_EPS1_GRVW16_OPLV0_PK0_PAP0_PGR1_SU0_SUS128_SRVW0_TT1_16_WG32_8_1_WGM2
    SolutionIndex: 85
    SolutionNameMin: Cijk_Ailk_Bjlk_I8II_BH_GB_MT32x32x32_MI16x16x16x1_SN_1LDSB0_EPS0_GRVW8_OPLV0_PK0_PAP0_PGR2_SU0_SUS128_SRVW0_TT1_16_WG32_8_1_WGM2
    SolutionIndex: 86
    SolutionNameMin: Cijk_Ailk_Bjlk_I8II_BH_GB_MT32x32x64_MI16x16x16x1_SN_1LDSB0_EPS0_GRVW8_OPLV0_PK0_PAP0_PGR2_SU0_SUS128_SRVW0_TT1_16_WG32_8_1_WGM2
    SolutionIndex: 87
    SolutionNameMin: Cijk_Ailk_Bjlk_I8II_BH_GB_MT32x32x32_MI16x16x16x1_SN_1LDSB0_EPS0_GRVW16_OPLV0_PK0_PAP0_PGR2_SU0_SUS128_SRVW0_TT1_16_WG32_8_1_WGM2
    SolutionIndex: 88
    SolutionNameMin: Cijk_Ailk_Bjlk_I8II_BH_GB_MT128x128x32_MI32x32x8x1_SN_1LDSB0_EPS0_GRVW16_OPLV0_PK0_PAP0_PGR2_SU0_SUS128_SRVW0_TT2_64_WG64_4_1_WGM2
    SolutionIndex: 89
    SolutionNameMin: Cijk_Ailk_Bjlk_I8II_BH_GB_MT64x64x64_MI32x32x8x1_SN_1LDSB0_EPS0_GRVW16_OPLV0_PK0_PAP0_PGR2_SU0_SUS128_SRVW0_TT1_32_WG64_4_1_WGM2
    SolutionIndex: 90
    SolutionNameMin: Cijk_Ailk_Bjlk_I8II_BH_GB_MT64x128x32_MI32x32x8x1_SN_1LDSB0_EPS1_GRVW8_OPLV0_PK0_PAP0_PGR1_SU0_SUS128_SRVW4_TT1_64_WG64_4_1_WGM2
    SolutionIndex: 91
    SolutionNameMin: Cijk_Ailk_Bjlk_I8II_BH_GB_MT64x32x32_MI16x16x16x1_SN_1LDSB0_EPS1_GRVW16_OPLV0_PK0_PAP0_PGR1_SU0_SUS128_SRVW4_TT2_16_WG32_8_1_WGM2
    SolutionIndex: 92
    SolutionNameMin: Cijk_Ailk_Bjlk_I8II_BH_GB_MT64x64x64_MI32x32x8x1_SN_1LDSB0_EPS1_GRVW16_OPLV0_PK0_PAP0_PGR1_SU0_SUS128_SRVW4_TT1_32_WG64_4_1_WGM2
    SolutionIndex: 93
    SolutionNameMin: Cijk_Ailk_Bjlk_I8II_BH_GB_MT64x64x32_MI32x32x8x1_SN_1LDSB0_EPS0_GRVW4_OPLV0_PK0_PAP0_PGR2_SU0_SUS128_SRVW4_TT1_32_WG64_4_1_WGM2
    SolutionIndex: 94
    SolutionNameMin: Cijk_Ailk_Bjlk_I8II_BH_GB_MT64x64x32_MI32x32x8x1_SN_1LDSB0_EPS0_GRVW8_OPLV0_PK0_PAP0_PGR2_SU0_SUS128_SRVW4_TT1_32_WG64_4_1_WGM2
    SolutionIndex: 95
    SolutionNameMin: Cijk_Ailk_Bjlk_I8II_BH_GB_MT64x64x64_MI32x32x8x1_SN_1LDSB0_EPS0_GRVW8_OPLV0_PK0_PAP0_PGR2_SU0_SUS128_SRVW4_TT1_32_WG64_4_1_WGM2
    SolutionIndex: 96
    SolutionNameMin: Cijk_Ailk_Bjlk_I8II_BH_GB_MT64x64x32_MI32x32x8x1_SN_1LDSB0_EPS0_GRVW16_OPLV0_PK0_PAP0_PGR2_SU0_SUS128_SRVW4_TT1_32_WG64_4_1_WGM2
    SolutionIndex: 97
    SolutionNameMin: Cijk_Ailk_Bjlk_I8II_BH_GB_MT64x128x32_MI32x32x8x1_SN_1LDSB0_EPS0_GRVW16_OPLV0_PK0_PAP0_PGR2_SU0_SUS128_SRVW4_TT1_64_WG64_4_1_WGM2
    SolutionIndex: 98
    SolutionNameMin: Cijk_Ailk_Bjlk_I8II_BH_GB_MT64x32x32_MI16x16x16x1_SN_1LDSB0_EPS1_GRVW4_OPLV0_PK0_PAP0_PGR1_SU0_SUS256_SRVW0_TT2_16_WG32_8_1_WGM2
    SolutionIndex: 99
    SolutionNameMin: Cijk_Ailk_Bjlk_I8II_BH_GB_MT64x32x32_MI16x16x16x1_SN_1LDSB0_EPS1_GRVW8_OPLV0_PK0_PAP0_PGR1_SU0_SUS256_SRVW0_TT2_16_WG32_8_1_WGM2
    SolutionIndex: 100
    SolutionNameMin: Cijk_Ailk_Bjlk_I8II_BH_GB_MT32x64x32_MI16x16x16x1_SN_1LDSB0_EPS1_GRVW16_OPLV0_PK0_PAP0_PGR1_SU0_SUS256_SRVW0_TT1_32_WG32_8_1_WGM2
    SolutionIndex: 101
    SolutionNameMin: Cijk_Ailk_Bjlk_I8II_BH_GB_MT32x32x64_MI16x16x16x1_SN_1LDSB0_EPS1_GRVW16_OPLV0_PK0_PAP0_PGR1_SU0_SUS256_SRVW0_TT1_16_WG32_8_1_WGM2
    SolutionIndex: 102
    SolutionNameMin: Cijk_Ailk_Bjlk_I8II_BH_GB_MT64x32x32_MI16x16x16x1_SN_1LDSB0_EPS0_GRVW4_OPLV0_PK0_PAP0_PGR2_SU0_SUS256_SRVW0_TT2_16_WG32_8_1_WGM2
    SolutionIndex: 103
    SolutionNameMin: Cijk_Ailk_Bjlk_I8II_BH_GB_MT32x32x32_MI16x16x16x1_SN_1LDSB0_EPS0_GRVW8_OPLV0_PK0_PAP0_PGR2_SU0_SUS256_SRVW0_TT1_16_WG32_8_1_WGM2
    SolutionIndex: 104
    SolutionNameMin: Cijk_Ailk_Bjlk_I8II_BH_GB_MT64x32x32_MI16x16x16x1_SN_1LDSB0_EPS0_GRVW8_OPLV0_PK0_PAP0_PGR2_SU0_SUS256_SRVW0_TT2_16_WG32_8_1_WGM2
    SolutionIndex: 105
    SolutionNameMin: Cijk_Ailk_Bjlk_I8II_BH_GB_MT32x32x32_MI16x16x16x1_SN_1LDSB0_EPS0_GRVW16_OPLV0_PK0_PAP0_PGR2_SU0_SUS256_SRVW0_TT1_16_WG32_8_1_WGM2
    SolutionIndex: 106
    SolutionNameMin: Cijk_Ailk_Bjlk_I8II_BH_GB_MT64x32x32_MI16x16x16x1_SN_1LDSB0_EPS0_GRVW16_OPLV0_PK0_PAP0_PGR2_SU0_SUS256_SRVW0_TT2_16_WG32_8_1_WGM2
    SolutionIndex: 107
    SolutionNameMin: Cijk_Ailk_Bjlk_I8II_BH_GB_MT64x64x64_MI32x32x8x1_SN_1LDSB0_EPS0_GRVW16_OPLV0_PK0_PAP0_PGR2_SU0_SUS256_SRVW0_TT1_32_WG64_4_1_WGM2
    SolutionIndex: 108
    SolutionNameMin: Cijk_Ailk_Bjlk_I8II_BH_GB_MT64x128x32_MI32x32x8x1_SN_1LDSB0_EPS1_GRVW4_OPLV0_PK0_PAP0_PGR1_SU0_SUS256_SRVW4_TT1_64_WG64_4_1_WGM2
    SolutionIndex: 109
    SolutionNameMin: Cijk_Ailk_Bjlk_I8II_BH_GB_MT64x64x64_MI32x32x8x1_SN_1LDSB0_EPS1_GRVW8_OPLV0_PK0_PAP0_PGR1_SU0_SUS256_SRVW4_TT1_32_WG64_4_1_WGM2
    SolutionIndex: 110
    SolutionNameMin: Cijk_Ailk_Bjlk_I8II_BH_GB_MT64x64x32_MI32x32x8x1_SN_1LDSB0_EPS0_GRVW8_OPLV0_PK0_PAP0_PGR2_SU0_SUS256_SRVW4_TT1_32_WG64_4_1_WGM2
    SolutionIndex: 111
    SolutionNameMin: Cijk_Ailk_Bjlk_I8II_BH_GB_MT64x128x32_MI32x32x8x1_SN_1LDSB0_EPS0_GRVW8_OPLV0_PK0_PAP0_PGR2_SU0_SUS256_SRVW4_TT1_64_WG64_4_1_WGM2
    SolutionIndex: 112
    SolutionNameMin: Cijk_Ailk_Bjlk_I8II_BH_GB_MT64x64x64_MI32x32x8x1_SN_1LDSB0_EPS0_GRVW8_OPLV0_PK0_PAP0_PGR2_SU0_SUS256_SRVW4_TT1_32_WG64_4_1_WGM2
    SolutionIndex: 113
    SolutionNameMin: Cijk_Ailk_Bjlk_I8II_BH_GB_MT32x32x32_MI16x16x16x1_SN_1LDSB0_EPS0_GRVW16_OPLV0_PK0_PAP0_PGR2_SU0_SUS256_SRVW4_TT1_16_WG32_8_1_WGM2
    SolutionIndex: 114
    SolutionNameMin: Cijk_Ailk_Bjlk_I8II_BH_GB_MT64x64x32_MI32x32x8x1_SN_1LDSB0_EPS0_GRVW16_OPLV0_PK0_PAP0_PGR2_SU0_SUS256_SRVW4_TT1_32_WG64_4_1_WGM2
    SolutionIndex: 115
    SolutionNameMin: Cijk_Ailk_Bjlk_I8II_BH_GB_MT64x128x32_MI32x32x8x1_SN_1LDSB0_EPS0_GRVW16_OPLV0_PK0_PAP0_PGR2_SU0_SUS256_SRVW4_TT1_64_WG64_4_1_WGM2
    SolutionIndex: 116
    SolutionNameMin: Cijk_Ailk_Bjlk_I8II_BH_GB_MT64x256x32_MI32x32x8x1_SN_1LDSB0_EPS0_GRVW16_OPLV0_PK0_PAP0_PGR2_SU0_SUS256_SRVW4_TT1_128_WG64_4_1_WGM2
    SolutionIndex: 117
    SolutionNameMin: Cijk_Ailk_Bjlk_I8II_BH_GB_MT64x64x64_MI32x32x8x1_SN_1LDSB0_EPS0_GRVW16_OPLV0_PK0_PAP0_PGR2_SU0_SUS256_SRVW4_TT1_32_WG64_4_1_WGM2
    SolutionIndex: 118
    SolutionNameMin: Cijk_Ailk_Bjlk_I8II_BH_GB_MT64x32x64_MI16x16x16x1_SN_1LDSB0_EPS0_GRVW16_OPLV0_PK0_PAP0_PGR2_SU32_SUS128_SRVW0_TT2_16_WG32_8_1_WGM2
    SolutionIndex: 119
    SolutionNameMin: Cijk_Ailk_Bjlk_I8II_BH_GB_MT64x128x32_MI32x32x8x1_SN_1LDSB0_EPS1_GRVW16_OPLV0_PK0_PAP0_PGR1_SU32_SUS128_SRVW4_TT1_64_WG64_4_1_WGM2
    SolutionIndex: 120
    SolutionNameMin: Cijk_Ailk_Bjlk_I8II_BH_GB_MT64x256x32_MI32x32x8x1_SN_1LDSB0_EPS1_GRVW16_OPLV0_PK0_PAP0_PGR1_SU32_SUS128_SRVW4_TT1_128_WG64_4_1_WGM2
    SolutionIndex: 121
    SolutionNameMin: Cijk_Ailk_Bjlk_I8II_BH_GB_MT64x64x32_MI32x32x8x1_SN_1LDSB0_EPS0_GRVW16_OPLV0_PK0_PAP0_PGR2_SU32_SUS128_SRVW4_TT1_32_WG64_4_1_WGM2
    SolutionIndex: 122
    SolutionNameMin: Cijk_Ailk_Bjlk_I8II_BH_GB_MT64x128x32_MI32x32x8x1_SN_1LDSB0_EPS0_GRVW16_OPLV0_PK0_PAP0_PGR2_SU32_SUS128_SRVW4_TT1_64_WG64_4_1_WGM2
    SolutionIndex: 123
    SolutionNameMin: Cijk_Ailk_Bjlk_I8II_BH_GB_MT64x128x32_MI32x32x8x1_SN_1LDSB0_EPS0_GRVW16_OPLV0_PK0_PAP0_PGR2_SU32_SUS256_SRVW4_TT1_64_WG64_4_1_WGM2
    SolutionIndex: 124
    SolutionNameMin: Cijk_Ailk_Bjlk_I8II_BH_GB_MT32x32x32_MI16x16x16x1_SN_1LDSB0_EPS1_GRVW4_OPLV0_PK0_PAP0_PGR1_SU0_SUS128_SRVW0_TT1_16_WG32_8_1_WGM15
    SolutionIndex: 125
    SolutionNameMin: Cijk_Ailk_Bjlk_I8II_BH_GB_MT32x32x64_MI16x16x16x1_SN_1LDSB0_EPS1_GRVW4_OPLV0_PK0_PAP0_PGR1_SU0_SUS128_SRVW0_TT1_16_WG32_8_1_WGM15
    SolutionIndex: 126
    SolutionNameMin: Cijk_Ailk_Bjlk_I8II_BH_GB_MT32x32x64_MI16x16x16x1_SN_1LDSB0_EPS1_GRVW8_OPLV0_PK0_PAP0_PGR1_SU0_SUS128_SRVW0_TT1_16_WG32_8_1_WGM15
    SolutionIndex: 127
    SolutionNameMin: Cijk_Ailk_Bjlk_I8II_BH_GB_MT32x32x32_MI16x16x16x1_SN_1LDSB0_EPS0_GRVW8_OPLV0_PK0_PAP0_PGR2_SU0_SUS128_SRVW0_TT1_16_WG32_8_1_WGM15
    SolutionIndex: 128
    SolutionNameMin: Cijk_Ailk_Bjlk_I8II_BH_GB_MT64x32x32_MI16x16x16x1_SN_1LDSB0_EPS0_GRVW8_OPLV0_PK0_PAP0_PGR2_SU0_SUS128_SRVW0_TT2_16_WG32_8_1_WGM15
    SolutionIndex: 129
    SolutionNameMin: Cijk_Ailk_Bjlk_I8II_BH_GB_MT32x32x64_MI16x16x16x1_SN_1LDSB0_EPS0_GRVW8_OPLV0_PK0_PAP0_PGR2_SU0_SUS128_SRVW0_TT1_16_WG32_8_1_WGM15
    SolutionIndex: 130
    SolutionNameMin: Cijk_Ailk_Bjlk_I8II_BH_GB_MT32x32x128_MI16x16x16x1_SN_1LDSB0_EPS0_GRVW8_OPLV0_PK0_PAP0_PGR2_SU0_SUS128_SRVW0_TT1_16_WG32_8_1_WGM15
    SolutionIndex: 131
    SolutionNameMin: Cijk_Ailk_Bjlk_I8II_BH_GB_MT32x32x64_MI16x16x16x1_SN_1LDSB0_EPS0_GRVW16_OPLV0_PK0_PAP0_PGR2_SU0_SUS128_SRVW0_TT1_16_WG32_8_1_WGM15
    SolutionIndex: 132
    SolutionNameMin: Cijk_Ailk_Bjlk_I8II_BH_GB_MT32x64x64_MI16x16x16x1_SN_1LDSB0_EPS0_GRVW16_OPLV0_PK0_PAP0_PGR2_SU0_SUS128_SRVW0_TT1_32_WG32_8_1_WGM15
    SolutionIndex: 133
    SolutionNameMin: Cijk_Ailk_Bjlk_I8II_BH_GB_MT64x64x64_MI32x32x8x1_SN_1LDSB0_EPS0_GRVW16_OPLV0_PK0_PAP0_PGR2_SU0_SUS128_SRVW0_TT1_32_WG64_4_1_WGM15
    SolutionIndex: 134
    SolutionNameMin: Cijk_Ailk_Bjlk_I8II_BH_GB_MT64x128x32_MI32x32x8x1_SN_1LDSB0_EPS1_GRVW8_OPLV0_PK0_PAP0_PGR1_SU0_SUS128_SRVW4_TT1_64_WG64_4_1_WGM15
    SolutionIndex: 135
    SolutionNameMin: Cijk_Ailk_Bjlk_I8II_BH_GB_MT32x32x64_MI16x16x16x1_SN_1LDSB0_EPS1_GRVW8_OPLV0_PK0_PAP0_PGR1_SU0_SUS128_SRVW4_TT1_16_WG32_8_1_WGM15
    SolutionIndex: 136
    SolutionNameMin: Cijk_Ailk_Bjlk_I8II_BH_GB_MT64x64x64_MI32x32x8x1_SN_1LDSB0_EPS0_GRVW4_OPLV0_PK0_PAP0_PGR2_SU0_SUS128_SRVW4_TT1_32_WG64_4_1_WGM15
    SolutionIndex: 137
    SolutionNameMin: Cijk_Ailk_Bjlk_I8II_BH_GB_MT64x64x32_MI32x32x8x1_SN_1LDSB0_EPS0_GRVW8_OPLV0_PK0_PAP0_PGR2_SU0_SUS128_SRVW4_TT1_32_WG64_4_1_WGM15
    SolutionIndex: 138
    SolutionNameMin: Cijk_Ailk_Bjlk_I8II_BH_GB_MT64x64x64_MI32x32x8x1_SN_1LDSB0_EPS0_GRVW8_OPLV0_PK0_PAP0_PGR2_SU0_SUS128_SRVW4_TT1_32_WG64_4_1_WGM15
    SolutionIndex: 139
    SolutionNameMin: Cijk_Ailk_Bjlk_I8II_BH_GB_MT64x64x32_MI32x32x8x1_SN_1LDSB0_EPS0_GRVW16_OPLV0_PK0_PAP0_PGR2_SU0_SUS128_SRVW4_TT1_32_WG64_4_1_WGM15
    SolutionIndex: 140
    SolutionNameMin: Cijk_Ailk_Bjlk_I8II_BH_GB_MT64x128x32_MI32x32x8x1_SN_1LDSB0_EPS0_GRVW16_OPLV0_PK0_PAP0_PGR2_SU0_SUS128_SRVW4_TT1_64_WG64_4_1_WGM15
    SolutionIndex: 141
    SolutionNameMin: Cijk_Ailk_Bjlk_I8II_BH_GB_MT64x64x64_MI32x32x8x1_SN_1LDSB0_EPS0_GRVW16_OPLV0_PK0_PAP0_PGR2_SU0_SUS128_SRVW4_TT1_32_WG64_4_1_WGM15
    SolutionIndex: 142
    SolutionNameMin: Cijk_Ailk_Bjlk_I8II_BH_GB_MT32x64x32_MI16x16x16x1_SN_1LDSB0_EPS1_GRVW8_OPLV0_PK0_PAP0_PGR1_SU0_SUS256_SRVW0_TT1_32_WG32_8_1_WGM15
    SolutionIndex: 143
    SolutionNameMin: Cijk_Ailk_Bjlk_I8II_BH_GB_MT32x32x32_MI16x16x16x1_SN_1LDSB0_EPS0_GRVW8_OPLV0_PK0_PAP0_PGR2_SU0_SUS256_SRVW0_TT1_16_WG32_8_1_WGM15
    SolutionIndex: 144
    SolutionNameMin: Cijk_Ailk_Bjlk_I8II_BH_GB_MT32x32x64_MI16x16x16x1_SN_1LDSB0_EPS0_GRVW8_OPLV0_PK0_PAP0_PGR2_SU0_SUS256_SRVW0_TT1_16_WG32_8_1_WGM15
    SolutionIndex: 145
    SolutionNameMin: Cijk_Ailk_Bjlk_I8II_BH_GB_MT32x32x128_MI16x16x16x1_SN_1LDSB0_EPS0_GRVW8_OPLV0_PK0_PAP0_PGR2_SU0_SUS256_SRVW0_TT1_16_WG32_8_1_WGM15
    SolutionIndex: 146
    SolutionNameMin: Cijk_Ailk_Bjlk_I8II_BH_GB_MT64x32x32_MI16x16x16x1_SN_1LDSB0_EPS0_GRVW16_OPLV0_PK0_PAP0_PGR2_SU0_SUS256_SRVW0_TT2_16_WG32_8_1_WGM15
    SolutionIndex: 147
    SolutionNameMin: Cijk_Ailk_Bjlk_I8II_BH_GB_MT128x256x32_MI32x32x8x1_SN_1LDSB0_EPS0_GRVW16_OPLV0_PK0_PAP0_PGR2_SU0_SUS256_SRVW0_TT2_128_WG64_4_1_WGM15
    SolutionIndex: 148
    SolutionNameMin: Cijk_Ailk_Bjlk_I8II_BH_GB_MT32x64x64_MI16x16x16x1_SN_1LDSB0_EPS0_GRVW16_OPLV0_PK0_PAP0_PGR2_SU0_SUS256_SRVW0_TT1_32_WG32_8_1_WGM15
    SolutionIndex: 149
    SolutionNameMin: Cijk_Ailk_Bjlk_I8II_BH_GB_MT64x64x32_MI32x32x8x1_SN_1LDSB0_EPS0_GRVW8_OPLV0_PK0_PAP0_PGR2_SU0_SUS256_SRVW4_TT1_32_WG64_4_1_WGM15
    SolutionIndex: 150
    SolutionNameMin: Cijk_Ailk_Bjlk_I8II_BH_GB_MT64x64x64_MI32x32x8x1_SN_1LDSB0_EPS0_GRVW8_OPLV0_PK0_PAP0_PGR2_SU0_SUS256_SRVW4_TT1_32_WG64_4_1_WGM15
    SolutionIndex: 151
    SolutionNameMin: Cijk_Ailk_Bjlk_I8II_BH_GB_MT64x64x32_MI32x32x8x1_SN_1LDSB0_EPS0_GRVW16_OPLV0_PK0_PAP0_PGR2_SU0_SUS256_SRVW4_TT1_32_WG64_4_1_WGM15
    SolutionIndex: 152
    SolutionNameMin: Cijk_Ailk_Bjlk_I8II_BH_GB_MT64x128x32_MI32x32x8x1_SN_1LDSB0_EPS0_GRVW16_OPLV0_PK0_PAP0_PGR2_SU0_SUS256_SRVW4_TT1_64_WG64_4_1_WGM15
    SolutionIndex: 153
    SolutionNameMin: Cijk_Ailk_Bjlk_I8II_BH_GB_MT32x32x128_MI16x16x16x1_SN_1LDSB0_EPS0_GRVW8_OPLV0_PK0_PAP0_PGR2_SU32_SUS128_SRVW0_TT1_16_WG32_8_1_WGM15
    SolutionIndex: 154
    SolutionNameMin: Cijk_Ailk_Bjlk_I8II_BH_GB_MT64x64x64_MI32x32x8x1_SN_1LDSB0_EPS1_GRVW8_OPLV0_PK0_PAP0_PGR1_SU32_SUS128_SRVW4_TT1_32_WG64_4_1_WGM15
    SolutionIndex: 155
    SolutionNameMin: Cijk_Ailk_Bjlk_I8II_BH_GB_MT64x128x32_MI32x32x8x1_SN_1LDSB0_EPS1_GRVW16_OPLV0_PK0_PAP0_PGR1_SU32_SUS128_SRVW4_TT1_64_WG64_4_1_WGM15
    SolutionIndex: 156
    SolutionNameMin: Cijk_Ailk_Bjlk_I8II_BH_GB_MT64x128x32_MI32x32x8x1_SN_1LDSB0_EPS0_GRVW16_OPLV0_PK0_PAP0_PGR2_SU32_SUS128_SRVW4_TT1_64_WG64_4_1_WGM15
    SolutionIndex: 157
    SolutionNameMin: Cijk_Ailk_Bjlk_I8II_BH_GB_MT64x256x32_MI32x32x8x1_SN_1LDSB0_EPS0_GRVW16_OPLV0_PK0_PAP0_PGR2_SU32_SUS128_SRVW4_TT1_128_WG64_4_1_WGM15
    SolutionIndex: 158
    SolutionNameMin: Cijk_Ailk_Bjlk_I8II_BH_GB_MT64x128x32_MI32x32x8x1_SN_1LDSB0_EPS0_GRVW16_OPLV0_PK0_PAP0_PGR2_SU32_SUS256_SRVW4_TT1_64_WG64_4_1_WGM15
- - - [35, 35, 1, 512, 35, 35, 35, 35]
    - [1, 38.0]
  - - [4, 64, 1, 128, 4, 4, 4, 64]
    - [0, 4.0]
  - - [480, 512, 1, 512, 704, 704, 704, 704]
    - [19, 15124.0]
  - - [960, 1024, 1, 1024, 1088, 1088, 1088, 1088]
    - [55, 61082.0]
  - - [1920, 2048, 1, 2048, 2240, 2240, 2240, 2240]
    - [44, 113359.0]
  - - [3840, 4096, 1, 4096, 4256, 4256, 4256, 4256]
    - [2, 131029.0]
  - - [7680, 8192, 1, 8192, 8416, 8416, 8416, 8416]
    - [147, 138866.0]
  - - [32, 32, 8, 32, 32, 32, 32, 32]
    - [36, 63.0]
  - - [32, 32, 8, 64, 32, 32, 32, 32]
    - [127, 117.0]
  - - [32, 32, 8, 128, 32, 32, 32, 32]
    - [37, 208.0]
  - - [32, 32, 8, 256, 32, 32, 32, 32]
    - [13, 350.0]
  - - [32, 32, 8, 512, 32, 32, 32, 32]
    - [46, 552.0]
  - - [32, 32, 8, 1024, 32, 32, 32, 32]
    - [86, 839.0]
  - - [32, 32, 8, 2048, 32, 32, 32, 32]
    - [21, 1128.0]
  - - [32, 64, 8, 32, 32, 32, 32, 64]
    - [85, 126.0]
  - - [32, 64, 8, 64, 32, 32, 32, 64]
    - [143, 238.0]
  - - [32, 64, 8, 128, 32, 32, 32, 64]
    - [87, 410.0]
  - - [32, 64, 8, 256, 32, 32, 32, 64]
    - [42, 699.0]
  - - [32, 64, 8, 512, 32, 32, 32, 64]
    - [70, 1104.0]
  - - [32, 64, 8, 1024, 32, 32, 32, 64]
    - [46, 1626.0]
  - - [32, 64, 8, 2048, 32, 32, 32, 64]
    - [16, 2267.0]
  - - [32, 128, 8, 32, 32, 32, 32, 128]
    - [143, 247.0]
  - - [32, 128, 8, 64, 32, 32, 32, 128]
    - [101, 468.0]
  - - [32, 128, 8, 128, 32, 32, 32, 128]
    - [42, 807.0]
  - - [32, 128, 8, 256, 32, 32, 32, 128]
    - [42, 1311.0]
  - - [32, 128, 8, 512, 32, 32, 32, 128]
    - [46, 2118.0]
  - - [32, 128, 8, 1024, 32, 32, 32, 128]
    - [63, 3226.0]
  - - [32, 128, 8, 2048, 32, 32, 32, 128]
    - [16, 4280.0]
  - - [32, 256, 8, 32, 32, 32, 32, 256]
    - [74, 468.0]
  - - [32, 256, 8, 64, 32, 32, 32, 256]
    - [46, 904.0]
  - - [32, 256, 8, 128, 32, 32, 32, 256]
    - [16, 1498.0]
  - - [32, 256, 8, 256, 32, 32, 32, 256]
    - [42, 2589.0]
  - - [32, 256, 8, 512, 32, 32, 32, 256]
    - [129, 4033.0]
  - - [32, 256, 8, 1024, 32, 32, 32, 256]
    - [46, 5746.0]
  - - [32, 256, 8, 2048, 32, 32, 32, 256]
    - [16, 7626.0]
  - - [32, 512, 8, 32, 32, 32, 32, 512]
    - [127, 920.0]
  - - [32, 512, 8, 64, 32, 32, 32, 512]
    - [125, 1907.0]
  - - [32, 512, 8, 128, 32, 32, 32, 512]
    - [16, 2996.0]
  - - [32, 512, 8, 256, 32, 32, 32, 512]
    - [85, 5115.0]
  - - [32, 512, 8, 512, 32, 32, 32, 512]
    - [19, 7840.0]
  - - [32, 512, 8, 1024, 32, 32, 32, 512]
    - [14, 10552.0]
  - - [32, 512, 8, 2048, 32, 32, 32, 512]
    - [148, 12428.0]
  - - [32, 1024, 8, 32, 32, 32, 32, 1024]
    - [82, 1907.0]
  - - [32, 1024, 8, 64, 32, 32, 32, 1024]
    - [63, 3616.0]
  - - [32, 1024, 8, 128, 32, 32, 32, 1024]
    - [7, 5907.0]
  - - [32, 1024, 8, 256, 32, 32, 32, 1024]
    - [19, 9118.0]
  - - [32, 1024, 8, 512, 32, 32, 32, 1024]
    - [7, 13210.0]
  - - [32, 1024, 8, 1024, 32, 32, 32, 1024]
    - [19, 16694.0]
  - - [32, 1024, 8, 2048, 32, 32, 32, 1024]
    - [20, 19622.0]
  - - [32, 2048, 8, 32, 32, 32, 32, 2048]
    - [58, 3554.0]
  - - [32, 2048, 8, 64, 32, 32, 32, 2048]
    - [46, 6554.0]
  - - [32, 2048, 8, 128, 32, 32, 32, 2048]
    - [101, 9986.0]
  - - [32, 2048, 8, 256, 32, 32, 32, 2048]
    - [10, 14717.0]
  - - [32, 2048, 8, 512, 32, 32, 32, 2048]
    - [8, 20092.0]
  - - [32, 2048, 8, 1024, 32, 32, 32, 2048]
    - [20, 24672.0]
  - - [32, 2048, 8, 2048, 32, 32, 32, 2048]
    - [115, 27336.0]
  - - [64, 32, 8, 32, 64, 64, 64, 32]
    - [127, 131.0]
  - - [64, 32, 8, 64, 64, 64, 64, 32]
    - [19, 243.0]
  - - [64, 32, 8, 128, 64, 64, 64, 32]
    - [7, 410.0]
  - - [64, 32, 8, 256, 64, 64, 64, 32]
    - [113, 708.0]
  - - [64, 32, 8, 512, 64, 64, 64, 32]
    - [39, 1104.0]
  - - [64, 32, 8, 1024, 64, 64, 64, 32]
    - [46, 1638.0]
  - - [64, 32, 8, 2048, 64, 64, 64, 32]
    - [41, 2292.0]
  - - [64, 64, 8, 32, 64, 64, 64, 64]
    - [143, 257.0]
  - - [64, 64, 8, 64, 64, 64, 64, 64]
    - [63, 460.0]
  - - [64, 64, 8, 128, 64, 64, 64, 64]
    - [127, 832.0]
  - - [64, 64, 8, 256, 64, 64, 64, 64]
    - [143, 1362.0]
  - - [64, 64, 8, 512, 64, 64, 64, 64]
    - [19, 2140.0]
  - - [64, 64, 8, 1024, 64, 64, 64, 64]
    - [63, 3277.0]
  - - [64, 64, 8, 2048, 64, 64, 64, 64]
    - [145, 4462.0]
  - - [64, 128, 8, 32, 64, 64, 64, 128]
    - [87, 485.0]
  - - [64, 128, 8, 64, 64, 64, 64, 128]
    - [46, 920.0]
  - - [64, 128, 8, 128, 64, 64, 64, 128]
    - [11, 1589.0]
  - - [64, 128, 8, 256, 64, 64, 64, 128]
    - [85, 2655.0]
  - - [64, 128, 8, 512, 64, 64, 64, 128]
    - [68, 4324.0]
  - - [64, 128, 8, 1024, 64, 64, 64, 128]
    - [19, 6355.0]
  - - [64, 128, 8, 2048, 64, 64, 64, 128]
    - [75, 8877.0]
  - - [64, 256, 8, 32, 64, 64, 64, 256]
    - [143, 953.0]
  - - [64, 256, 8, 64, 64, 64, 64, 256]
    - [33, 1777.0]
  - - [64, 256, 8, 128, 64, 64, 64, 256]
    - [143, 3178.0]
  - - [64, 256, 8, 256, 64, 64, 64, 256]
    - [46, 4993.0]
  - - [64, 256, 8, 512, 64, 64, 64, 256]
    - [19, 7696.0]
  - - [64, 256, 8, 1024, 64, 64, 64, 256]
    - [153, 11185.0]
  - - [64, 256, 8, 2048, 64, 64, 64, 256]
    - [130, 14463.0]
  - - [64, 512, 8, 32, 64, 64, 64, 512]
    - [32, 1808.0]
  - - [64, 512, 8, 64, 64, 64, 64, 512]
    - [63, 3554.0]
  - - [64, 512, 8, 128, 64, 64, 64, 512]
    - [25, 5825.0]
  - - [64, 512, 8, 256, 64, 64, 64, 512]
    - [76, 9533.0]
  - - [64, 512, 8, 512, 64, 64, 64, 512]
    - [126, 13865.0]
  - - [64, 512, 8, 1024, 64, 64, 64, 512]
    - [151, 18040.0]
  - - [64, 512, 8, 2048, 64, 64, 64, 512]
    - [96, 23221.0]
  - - [64, 1024, 8, 32, 64, 64, 64, 1024]
    - [34, 3495.0]
  - - [64, 1024, 8, 64, 64, 64, 64, 1024]
    - [7, 6453.0]
  - - [64, 1024, 8, 128, 64, 64, 64, 1024]
    - [12, 10230.0]
  - - [64, 1024, 8, 256, 64, 64, 64, 1024]
    - [55, 15828.0]
  - - [64, 1024, 8, 512, 64, 64, 64, 1024]
    - [27, 25614.0]
  - - [64, 1024, 8, 1024, 64, 64, 64, 1024]
    - [94, 34065.0]
  - - [64, 1024, 8, 2048, 64, 64, 64, 1024]
    - [26, 40065.0]
  - - [64, 2048, 8, 32, 64, 64, 64, 2048]
    - [12, 6260.0]
  - - [64, 2048, 8, 64, 64, 64, 64, 2048]
    - [73, 10618.0]
  - - [64, 2048, 8, 128, 64, 64, 64, 2048]
    - [27, 16777.0]
  - - [64, 2048, 8, 256, 64, 64, 64, 2048]
    - [27, 28197.0]
  - - [64, 2048, 8, 512, 64, 64, 64, 2048]
    - [114, 39015.0]
  - - [64, 2048, 8, 1024, 64, 64, 64, 2048]
    - [54, 48106.0]
  - - [64, 2048, 8, 2048, 64, 64, 64, 2048]
    - [56, 54560.0]
  - - [128, 32, 8, 32, 128, 128, 128, 32]
    - [102, 247.0]
  - - [128, 32, 8, 64, 128, 128, 128, 32]
    - [101, 477.0]
  - - [128, 32, 8, 128, 128, 128, 128, 32]
    - [105, 832.0]
  - - [128, 32, 8, 256, 128, 128, 128, 32]
    - [143, 1436.0]
  - - [128, 32, 8, 512, 128, 128, 128, 32]
    - [19, 2162.0]
  - - [128, 32, 8, 1024, 128, 128, 128, 32]
    - [144, 3277.0]
  - - [128, 32, 8, 2048, 128, 128, 128, 32]
    - [16, 4510.0]
  - - [128, 64, 8, 32, 128, 128, 128, 64]
    - [105, 495.0]
  - - [128, 64, 8, 64, 128, 128, 128, 64]
    - [127, 936.0]
  - - [128, 64, 8, 128, 128, 128, 128, 64]
    - [127, 1613.0]
  - - [128, 64, 8, 256, 128, 128, 128, 64]
    - [87, 2724.0]
  - - [128, 64, 8, 512, 128, 128, 128, 64]
    - [46, 4280.0]
  - - [128, 64, 8, 1024, 128, 128, 128, 64]
    - [144, 6453.0]
  - - [128, 64, 8, 2048, 128, 128, 128, 64]
    - [46, 8972.0]
  - - [128, 128, 8, 32, 128, 128, 128, 128]
    - [106, 920.0]
  - - [128, 128, 8, 64, 128, 128, 128, 128]
    - [59, 1748.0]
  - - [128, 128, 8, 128, 128, 128, 128, 128]
    - [103, 3039.0]
  - - [128, 128, 8, 256, 128, 128, 128, 128]
    - [11, 5053.0]
  - - [128, 128, 8, 512, 128, 128, 128, 128]
    - [46, 8560.0]
  - - [128, 128, 8, 1024, 128, 128, 128, 128]
    - [41, 11732.0]
  - - [128, 128, 8, 2048, 128, 128, 128, 128]
    - [41, 15252.0]
  - - [128, 256, 8, 32, 128, 128, 128, 256]
    - [124, 1808.0]
  - - [128, 256, 8, 64, 128, 128, 128, 256]
    - [71, 3438.0]
  - - [128, 256, 8, 128, 128, 128, 128, 256]
    - [63, 5825.0]
  - - [128, 256, 8, 256, 128, 128, 128, 256]
    - [19, 9869.0]
  - - [128, 256, 8, 512, 128, 128, 128, 256]
    - [19, 14099.0]
  - - [128, 256, 8, 1024, 128, 128, 128, 256]
    - [19, 18336.0]
  - - [128, 256, 8, 2048, 128, 128, 128, 256]
    - [107, 22982.0]
  - - [128, 512, 8, 32, 128, 128, 128, 512]
    - [85, 3495.0]
  - - [128, 512, 8, 64, 128, 128, 128, 512]
    - [19, 6765.0]
  - - [128, 512, 8, 128, 128, 128, 128, 512]
    - [19, 10486.0]
  - - [128, 512, 8, 256, 128, 128, 128, 512]
    - [10, 15680.0]
  - - [128, 512, 8, 512, 128, 128, 128, 512]
    - [139, 24315.0]
  - - [128, 512, 8, 1024, 128, 128, 128, 512]
    - [94, 34415.0]
  - - [128, 512, 8, 2048, 128, 128, 128, 512]
    - [138, 42207.0]
  - - [128, 1024, 8, 32, 128, 128, 128, 1024]
    - [35, 6079.0]
  - - [128, 1024, 8, 64, 128, 128, 128, 1024]
    - [62, 10486.0]
  - - [128, 1024, 8, 128, 128, 128, 128, 1024]
    - [100, 16611.0]
  - - [128, 1024, 8, 256, 128, 128, 128, 1024]
    - [114, 28436.0]
  - - [128, 1024, 8, 512, 128, 128, 128, 1024]
    - [151, 41171.0]
  - - [128, 1024, 8, 1024, 128, 128, 128, 1024]
    - [150, 54339.0]
  - - [128, 1024, 8, 2048, 128, 128, 128, 1024]
    - [150, 65632.0]
  - - [128, 2048, 8, 32, 128, 128, 128, 2048]
    - [17, 8830.0]
  - - [128, 2048, 8, 64, 128, 128, 128, 2048]
    - [35, 14847.0]
  - - [128, 2048, 8, 128, 128, 128, 128, 2048]
    - [111, 25041.0]
  - - [128, 2048, 8, 256, 128, 128, 128, 2048]
    - [115, 41943.0]
  - - [128, 2048, 8, 512, 128, 128, 128, 2048]
    - [28, 59127.0]
  - - [128, 2048, 8, 1024, 128, 128, 128, 2048]
    - [56, 74358.0]
  - - [128, 2048, 8, 2048, 128, 128, 128, 2048]
    - [140, 76369.0]
  - - [256, 32, 8, 32, 256, 256, 256, 32]
    - [85, 504.0]
  - - [256, 32, 8, 64, 256, 256, 256, 32]
    - [7, 920.0]
  - - [256, 32, 8, 128, 256, 256, 256, 32]
    - [101, 1565.0]
  - - [256, 32, 8, 256, 256, 256, 256, 32]
    - [85, 2621.0]
  - - [256, 32, 8, 512, 256, 256, 256, 32]
    - [70, 4112.0]
  - - [256, 32, 8, 1024, 256, 256, 256, 32]
    - [78, 6214.0]
  - - [256, 32, 8, 2048, 256, 256, 256, 32]
    - [64, 8389.0]
  - - [256, 64, 8, 32, 256, 256, 256, 64]
    - [85, 989.0]
  - - [256, 64, 8, 64, 256, 256, 256, 64]
    - [19, 1748.0]
  - - [256, 64, 8, 128, 256, 256, 256, 64]
    - [103, 3039.0]
  - - [256, 64, 8, 256, 256, 256, 256, 64]
    - [25, 4993.0]
  - - [256, 64, 8, 512, 256, 256, 256, 64]
    - [70, 8066.0]
  - - [256, 64, 8, 1024, 256, 256, 256, 64]
    - [19, 11491.0]
  - - [256, 64, 8, 2048, 256, 256, 256, 64]
    - [16, 14653.0]
  - - [256, 128, 8, 32, 256, 256, 256, 128]
    - [85, 1840.0]
  - - [256, 128, 8, 64, 256, 256, 256, 128]
    - [84, 3495.0]
  - - [256, 128, 8, 128, 256, 256, 256, 128]
    - [7, 5907.0]
  - - [256, 128, 8, 256, 256, 256, 256, 128]
    - [84, 9533.0]
  - - [256, 128, 8, 512, 256, 256, 256, 128]
    - [19, 13640.0]
  - - [256, 128, 8, 1024, 256, 256, 256, 128]
    - [7, 17944.0]
  - - [256, 128, 8, 2048, 256, 256, 256, 128]
    - [89, 22826.0]
  - - [256, 256, 8, 32, 256, 256, 256, 256]
    - [85, 3438.0]
  - - [256, 256, 8, 64, 256, 256, 256, 256]
    - [9, 6168.0]
  - - [256, 256, 8, 128, 256, 256, 256, 256]
    - [128, 10230.0]
  - - [256, 256, 8, 256, 256, 256, 256, 256]
    - [132, 15680.0]
  - - [256, 256, 8, 512, 256, 256, 256, 256]
    - [94, 23629.0]
  - - [256, 256, 8, 1024, 256, 256, 256, 256]
    - [77, 34065.0]
  - - [256, 256, 8, 2048, 256, 256, 256, 256]
    - [95, 42207.0]
  - - [256, 512, 8, 32, 256, 256, 256, 512]
    - [142, 6168.0]
  - - [256, 512, 8, 64, 256, 256, 256, 512]
    - [102, 10486.0]
  - - [256, 512, 8, 128, 256, 256, 256, 512]
    - [94, 16776.0]
  - - [256, 512, 8, 256, 256, 256, 256, 512]
    - [110, 28677.0]
  - - [256, 512, 8, 512, 256, 256, 256, 512]
    - [117, 41683.0]
  - - [256, 512, 8, 1024, 256, 256, 256, 512]
    - [112, 54120.0]
  - - [256, 512, 8, 2048, 256, 256, 256, 512]
    - [150, 65153.0]
  - - [256, 1024, 8, 32, 256, 256, 256, 1024]
    - [4, 8830.0]
  - - [256, 1024, 8, 64, 256, 256, 256, 1024]
    - [106, 14847.0]
  - - [256, 1024, 8, 128, 256, 256, 256, 1024]
    - [5, 23630.0]
  - - [256, 1024, 8, 256, 256, 256, 256, 1024]
    - [115, 42474.0]
  - - [256, 1024, 8, 512, 256, 256, 256, 1024]
    - [56, 59127.0]
  - - [256, 1024, 8, 1024, 256, 256, 256, 1024]
    - [56, 74982.0]
  - - [256, 1024, 8, 2048, 256, 256, 256, 1024]
    - [56, 78375.0]
  - - [256, 2048, 8, 32, 256, 256, 256, 2048]
    - [66, 9811.0]
  - - [256, 2048, 8, 64, 256, 256, 256, 2048]
    - [35, 17386.0]
  - - [256, 2048, 8, 128, 256, 256, 256, 2048]
    - [55, 28802.0]
  - - [256, 2048, 8, 256, 256, 256, 256, 2048]
    - [56, 49164.0]
  - - [256, 2048, 8, 512, 256, 256, 256, 2048]
    - [56, 71967.0]
  - - [256, 2048, 8, 1024, 256, 256, 256, 2048]
    - [56, 86872.0]
  - - [256, 2048, 8, 2048, 256, 256, 256, 2048]
    - [115, 87939.0]
  - - [512, 32, 8, 32, 512, 512, 512, 32]
    - [127, 971.0]
  - - [512, 32, 8, 64, 512, 512, 512, 32]
    - [125, 1872.0]
  - - [512, 32, 8, 128, 512, 512, 512, 32]
    - [42, 3039.0]
  - - [512, 32, 8, 256, 512, 512, 512, 32]
    - [85, 5053.0]
  - - [512, 32, 8, 512, 512, 512, 512, 32]
    - [131, 7840.0]
  - - [512, 32, 8, 1024, 512, 512, 512, 32]
    - [19, 10356.0]
  - - [512, 32, 8, 2048, 512, 512, 512, 32]
    - [118, 12758.0]
  - - [512, 64, 8, 32, 512, 512, 512, 64]
    - [143, 1840.0]
  - - [512, 64, 8, 64, 512, 512, 512, 64]
    - [84, 3495.0]
  - - [512, 64, 8, 128, 512, 512, 512, 64]
    - [72, 5746.0]
  - - [512, 64, 8, 256, 512, 512, 512, 64]
    - [135, 8924.0]
  - - [512, 64, 8, 512, 512, 512, 512, 64]
    - [15, 13210.0]
  - - [512, 64, 8, 1024, 512, 512, 512, 64]
    - [114, 17660.0]
  - - [512, 64, 8, 2048, 512, 512, 512, 64]
    - [133, 22595.0]
  - - [512, 128, 8, 32, 512, 512, 512, 128]
    - [53, 3438.0]
  - - [512, 128, 8, 64, 512, 512, 512, 128]
    - [19, 6658.0]
  - - [512, 128, 8, 128, 512, 512, 512, 128]
    - [43, 10107.0]
  - - [512, 128, 8, 256, 512, 512, 512, 128]
    - [7, 15534.0]
  - - [512, 128, 8, 512, 512, 512, 512, 128]
    - [77, 23302.0]
  - - [512, 128, 8, 1024, 512, 512, 512, 128]
    - [69, 33723.0]
  - - [512, 128, 8, 2048, 512, 512, 512, 128]
    - [80, 41683.0]
  - - [512, 256, 8, 32, 512, 512, 512, 256]
    - [35, 5907.0]
  - - [512, 256, 8, 64, 512, 512, 512, 256]
    - [62, 10486.0]
  - - [512, 256, 8, 128, 512, 512, 512, 256]
    - [5, 16448.0]
  - - [512, 256, 8, 256, 512, 512, 512, 256]
    - [151, 27504.0]
  - - [512, 256, 8, 512, 512, 512, 512, 256]
    - [57, 40427.0]
  - - [512, 256, 8, 1024, 512, 512, 512, 256]
    - [29, 53050.0]
  - - [512, 256, 8, 2048, 512, 512, 512, 256]
    - [29, 62865.0]
  - - [512, 512, 8, 32, 512, 512, 512, 512]
    - [31, 8473.0]
  - - [512, 512, 8, 64, 512, 512, 512, 512]
    - [104, 14589.0]
  - - [512, 512, 8, 128, 512, 512, 512, 512]
    - [115, 23797.0]
  - - [512, 512, 8, 256, 512, 512, 512, 512]
    - [158, 41683.0]
  - - [512, 512, 8, 512, 512, 512, 512, 512]
    - [152, 59127.0]
  - - [512, 512, 8, 1024, 512, 512, 512, 512]
    - [115, 72747.0]
  - - [512, 512, 8, 2048, 512, 512, 512, 512]
    - [115, 76586.0]
  - - [512, 1024, 8, 32, 512, 512, 512, 1024]
    - [6, 9754.0]
  - - [512, 1024, 8, 64, 512, 512, 512, 1024]
    - [24, 16947.0]
  - - [512, 1024, 8, 128, 512, 512, 512, 1024]
    - [67, 27731.0]
  - - [512, 1024, 8, 256, 512, 512, 512, 1024]
    - [56, 47764.0]
  - - [512, 1024, 8, 512, 512, 512, 512, 1024]
    - [97, 69363.0]
  - - [512, 1024, 8, 1024, 512, 512, 512, 1024]
    - [56, 86037.0]
  - - [512, 1024, 8, 2048, 512, 512, 512, 1024]
    - [115, 91851.0]
  - - [512, 2048, 8, 32, 512, 512, 512, 2048]
    - [91, 10789.0]
  - - [512, 2048, 8, 64, 512, 512, 512, 2048]
    - [154, 19065.0]
  - - [512, 2048, 8, 128, 512, 512, 512, 2048]
    - [115, 32342.0]
  - - [512, 2048, 8, 256, 512, 512, 512, 2048]
    - [28, 56157.0]
  - - [512, 2048, 8, 512, 512, 512, 512, 2048]
    - [122, 80250.0]
  - - [512, 2048, 8, 1024, 512, 512, 512, 2048]
    - [115, 94022.0]
  - - [512, 2048, 8, 2048, 512, 512, 512, 2048]
    - [152, 97701.0]
  - - [1024, 32, 8, 32, 1024, 1024, 1024, 32]
    - [30, 1808.0]
  - - [1024, 32, 8, 64, 1024, 1024, 1024, 32]
    - [75, 3495.0]
  - - [1024, 32, 8, 128, 1024, 1024, 1024, 32]
    - [127, 5668.0]
  - - [1024, 32, 8, 256, 1024, 1024, 1024, 32]
    - [101, 8738.0]
  - - [1024, 32, 8, 512, 1024, 1024, 1024, 32]
    - [15, 12614.0]
  - - [1024, 32, 8, 1024, 1024, 1024, 1024, 32]
    - [61, 15114.0]
  - - [1024, 32, 8, 2048, 1024, 1024, 1024, 32]
    - [40, 17754.0]
  - - [1024, 64, 8, 32, 1024, 1024, 1024, 64]
    - [127, 3438.0]
  - - [1024, 64, 8, 64, 1024, 1024, 1024, 64]
    - [7, 6260.0]
  - - [1024, 64, 8, 128, 1024, 1024, 1024, 64]
    - [81, 9533.0]
  - - [1024, 64, 8, 256, 1024, 1024, 1024, 64]
    - [151, 15252.0]
  - - [1024, 64, 8, 512, 1024, 1024, 1024, 64]
    - [121, 22520.0]
  - - [1024, 64, 8, 1024, 1024, 1024, 1024, 64]
    - [29, 29178.0]
  - - [1024, 64, 8, 2048, 1024, 1024, 1024, 64]
    - [141, 33723.0]
  - - [1024, 128, 8, 32, 1024, 1024, 1024, 128]
    - [43, 5746.0]
  - - [1024, 128, 8, 64, 1024, 1024, 1024, 128]
    - [83, 10107.0]
  - - [1024, 128, 8, 128, 1024, 1024, 1024, 128]
    - [137, 16132.0]
  - - [1024, 128, 8, 256, 1024, 1024, 1024, 128]
    - [137, 27504.0]
  - - [1024, 128, 8, 512, 1024, 1024, 1024, 128]
    - [27, 38568.0]
  - - [1024, 128, 8, 1024, 1024, 1024, 1024, 128]
    - [29, 48630.0]
  - - [1024, 128, 8, 2048, 1024, 1024, 1024, 128]
    - [54, 55462.0]
  - - [1024, 256, 8, 32, 1024, 1024, 1024, 256]
    - [35, 8144.0]
  - - [1024, 256, 8, 64, 1024, 1024, 1024, 256]
    - [60, 13640.0]
  - - [1024, 256, 8, 128, 1024, 1024, 1024, 256]
    - [56, 23141.0]
  - - [1024, 256, 8, 256, 1024, 1024, 1024, 256]
    - [140, 40427.0]
  - - [1024, 256, 8, 512, 1024, 1024, 1024, 256]
    - [152, 55692.0]
  - - [1024, 256, 8, 1024, 1024, 1024, 1024, 256]
    - [115, 68131.0]
  - - [1024, 256, 8, 2048, 1024, 1024, 1024, 256]
    - [115, 75936.0]
  - - [1024, 512, 8, 32, 1024, 1024, 1024, 512]
    - [22, 9425.0]
  - - [1024, 512, 8, 64, 1024, 1024, 1024, 512]
    - [109, 17033.0]
  - - [1024, 512, 8, 128, 1024, 1024, 1024, 512]
    - [27, 27962.0]
  - - [1024, 512, 8, 256, 1024, 1024, 1024, 512]
    - [122, 45965.0]
  - - [1024, 512, 8, 512, 1024, 1024, 1024, 512]
    - [152, 70271.0]
  - - [1024, 512, 8, 1024, 1024, 1024, 1024, 512]
    - [140, 85352.0]
  - - [1024, 512, 8, 2048, 1024, 1024, 1024, 512]
    - [140, 91227.0]
  - - [1024, 1024, 8, 32, 1024, 1024, 1024, 1024]
    - [51, 10293.0]
  - - [1024, 1024, 8, 64, 1024, 1024, 1024, 1024]
    - [52, 19119.0]
  - - [1024, 1024, 8, 128, 1024, 1024, 1024, 1024]
    - [134, 32656.0]
  - - [1024, 1024, 8, 256, 1024, 1024, 1024, 1024]
    - [115, 55462.0]
  - - [1024, 1024, 8, 512, 1024, 1024, 1024, 1024]
    - [56, 78489.0]
  - - [1024, 1024, 8, 1024, 1024, 1024, 1024, 1024]
    - [155, 92723.0]
  - - [1024, 1024, 8, 2048, 1024, 1024, 1024, 1024]
    - [140, 101248.0]
  - - [1024, 2048, 8, 32, 1024, 1024, 1024, 2048]
    - [47, 11148.0]
  - - [1024, 2048, 8, 64, 1024, 1024, 1024, 2048]
    - [136, 20972.0]
  - - [1024, 2048, 8, 128, 1024, 1024, 1024, 2048]
    - [108, 35414.0]
  - - [1024, 2048, 8, 256, 1024, 1024, 1024, 2048]
    - [122, 60663.0]
  - - [1024, 2048, 8, 512, 1024, 1024, 1024, 2048]
    - [123, 84546.0]
  - - [1024, 2048, 8, 1024, 1024, 1024, 1024, 2048]
    - [56, 99191.0]
  - - [1024, 2048, 8, 2048, 1024, 1024, 1024, 2048]
    - [88, 112345.0]
  - - [2048, 32, 8, 32, 2048, 2048, 2048, 32]
    - [3, 3383.0]
  - - [2048, 32, 8, 64, 2048, 2048, 2048, 32]
    - [7, 6079.0]
  - - [2048, 32, 8, 128, 2048, 2048, 2048, 32]
    - [50, 9642.0]
  - - [2048, 32, 8, 256, 2048, 2048, 2048, 32]
    - [49, 13865.0]
  - - [2048, 32, 8, 512, 2048, 2048, 2048, 32]
    - [102, 18538.0]
  - - [2048, 32, 8, 1024, 2048, 2048, 2048, 32]
    - [104, 21931.0]
  - - [2048, 32, 8, 2048, 2048, 2048, 2048, 32]
    - [38, 24809.0]
  - - [2048, 64, 8, 32, 2048, 2048, 2048, 64]
    - [102, 5746.0]
  - - [2048, 64, 8, 64, 2048, 2048, 2048, 64]
    - [98, 9869.0]
  - - [2048, 64, 8, 128, 2048, 2048, 2048, 64]
    - [27, 15252.0]
  - - [2048, 64, 8, 256, 2048, 2048, 2048, 64]
    - [149, 25041.0]
  - - [2048, 64, 8, 512, 2048, 2048, 2048, 64]
    - [149, 34415.0]
  - - [2048, 64, 8, 1024, 2048, 2048, 2048, 64]
    - [151, 41553.0]
  - - [2048, 64, 8, 2048, 2048, 2048, 2048, 64]
    - [29, 46603.0]
  - - [2048, 128, 8, 32, 2048, 2048, 2048, 128]
    - [99, 7989.0]
  - - [2048, 128, 8, 64, 2048, 2048, 2048, 128]
    - [146, 13752.0]
  - - [2048, 128, 8, 128, 2048, 2048, 2048, 128]
    - [56, 23141.0]
  - - [2048, 128, 8, 256, 2048, 2048, 2048, 128]
    - [152, 37915.0]
  - - [2048, 128, 8, 512, 2048, 2048, 2048, 128]
    - [115, 51228.0]
  - - [2048, 128, 8, 1024, 2048, 2048, 2048, 128]
    - [79, 62138.0]
  - - [2048, 128, 8, 2048, 2048, 2048, 2048, 128]
    - [115, 69905.0]
  - - [2048, 256, 8, 32, 2048, 2048, 2048, 256]
    - [49, 9425.0]
  - - [2048, 256, 8, 64, 2048, 2048, 2048, 256]
    - [52, 16288.0]
  - - [2048, 256, 8, 128, 2048, 2048, 2048, 256]
    - [93, 26631.0]
  - - [2048, 256, 8, 256, 2048, 2048, 2048, 256]
    - [158, 43862.0]
  - - [2048, 256, 8, 512, 2048, 2048, 2048, 256]
    - [158, 66775.0]
  - - [2048, 256, 8, 1024, 2048, 2048, 2048, 256]
    - [152, 83625.0]
  - - [2048, 256, 8, 2048, 2048, 2048, 2048, 256]
    - [152, 89928.0]
  - - [2048, 512, 8, 32, 2048, 2048, 2048, 512]
    - [47, 10356.0]
  - - [2048, 512, 8, 64, 2048, 2048, 2048, 512]
    - [92, 18590.0]
  - - [2048, 512, 8, 128, 2048, 2048, 2048, 512]
    - [28, 32420.0]
  - - [2048, 512, 8, 256, 2048, 2048, 2048, 512]
    - [56, 55007.0]
  - - [2048, 512, 8, 512, 2048, 2048, 2048, 512]
    - [158, 78720.0]
  - - [2048, 512, 8, 1024, 2048, 2048, 2048, 512]
    - [156, 93368.0]
  - - [2048, 512, 8, 2048, 2048, 2048, 2048, 512]
    - [97, 99191.0]
  - - [2048, 1024, 8, 32, 2048, 2048, 2048, 1024]
    - [65, 10948.0]
  - - [2048, 1024, 8, 64, 2048, 2048, 2048, 1024]
    - [109, 20523.0]
  - - [2048, 1024, 8, 128, 2048, 2048, 2048, 1024]
    - [97, 36373.0]
  - - [2048, 1024, 8, 256, 2048, 2048, 2048, 1024]
    - [119, 59719.0]
  - - [2048, 1024, 8, 512, 2048, 2048, 2048, 1024]
    - [120, 84083.0]
  - - [2048, 1024, 8, 1024, 2048, 2048, 2048, 1024]
    - [116, 100069.0]
  - - [2048, 1024, 8, 2048, 2048, 2048, 2048, 1024]
    - [18, 111877.0]
  - - [2048, 2048, 8, 32, 2048, 2048, 2048, 2048]
    - [23, 11846.0]
  - - [2048, 2048, 8, 64, 2048, 2048, 2048, 2048]
    - [48, 21860.0]
  - - [2048, 2048, 8, 128, 2048, 2048, 2048, 2048]
    - [90, 37754.0]
  - - [2048, 2048, 8, 256, 2048, 2048, 2048, 2048]
    - [122, 62755.0]
  - - [2048, 2048, 8, 512, 2048, 2048, 2048, 2048]
    - [157, 87438.0]
  - - [2048, 2048, 8, 1024, 2048, 2048, 2048, 2048]
    - [120, 104044.0]
  - - [2048, 2048, 8, 2048, 2048, 2048, 2048, 2048]
    - [45, 115301.0]
- null
