library/src/blas3/Tensile/Logic/asm_full/arcturus_Cijk_Alik_Bljk_BBH.yaml
- {MinimumRequiredVersion: 4.14.0}
- arcturus
- gfx908
- [Device 7380, Device 7388, Device 738c, Device 7390]
    SolutionIndex: 0
    SolutionNameMin: Cijk_Alik_Bljk_BBH_MT64x128x16_MI32x32x2x2_SE_GRVW4_ONLL0_SNLL1
    SolutionIndex: 1
    SolutionNameMin: Cijk_Alik_Bljk_BBH_MT64x128x16_MI32x32x2x2_SE_GRVW2_ONLL0_SNLL0
    SolutionIndex: 2
    SolutionNameMin: Cijk_Alik_Bljk_BBH_MT64x128x16_MI32x32x2x2_SE_GRVW4_ONLL0_SNLL0
    SolutionIndex: 3
    SolutionNameMin: Cijk_Alik_Bljk_BBH_MT64x128x32_MI32x32x2x2_SE_GRVW4_ONLL0_SNLL0
    SolutionIndex: 4
    SolutionNameMin: Cijk_Alik_Bljk_BBH_MT64x128x16_MI32x32x2x2_SE_GRVW4_ONLL1_SNLL1
    SolutionIndex: 5
    SolutionNameMin: Cijk_Alik_Bljk_BBH_MT64x128x16_MI32x32x2x2_SE_GRVW2_ONLL1_SNLL0
    SolutionIndex: 6
    SolutionNameMin: Cijk_Alik_Bljk_BBH_MT32x256x16_MI32x32x2x2_SE_GRVW4_ONLL1_SNLL0
    SolutionIndex: 7
    SolutionNameMin: Cijk_Alik_Bljk_BBH_MT64x128x16_MI32x32x2x2_SE_GRVW4_ONLL1_SNLL0
    SolutionIndex: 8
    SolutionNameMin: Cijk_Alik_Bljk_BBH_MT64x128x32_MI32x32x2x2_SE_GRVW4_ONLL1_SNLL0
    SolutionIndex: 9
    SolutionNameMin: Cijk_Alik_Bljk_BBH_MT64x256x16_MI32x32x2x2_SE_GRVW4_ONLL0_SNLL0
    SolutionIndex: 10
    SolutionNameMin: Cijk_Alik_Bljk_BBH_MT64x256x16_MI32x32x2x2_SE_GRVW4_ONLL1_SNLL1
    SolutionIndex: 11
    SolutionNameMin: Cijk_Alik_Bljk_BBH_MT128x32x16_SE_
    SolutionIndex: 12
    SolutionNameMin: Cijk_Alik_Bljk_BBH_MT128x64x16_SE_
    SolutionIndex: 13
    SolutionNameMin: Cijk_Alik_Bljk_BBH_MT32x128x16_SE_
    SolutionIndex: 14
    SolutionNameMin: Cijk_Alik_Bljk_BBH_MT64x128x16_SE_
    SolutionIndex: 15
    SolutionNameMin: Cijk_Alik_Bljk_BBH_MT256x128x16_SE_
    SolutionIndex: 16
    SolutionNameMin: Cijk_Alik_Bljk_BBH_MT128x256x16_SE_
    SolutionIndex: 17
    SolutionNameMin: Cijk_Alik_Bljk_BBH_MT64x16x16_SE_
    SolutionIndex: 18
    SolutionNameMin: Cijk_Alik_Bljk_BBH_MT16x64x16_SE_
    SolutionIndex: 19
    SolutionNameMin: Cijk_Alik_Bljk_BBH_MT64x128x32_SE_
    SolutionIndex: 20
    SolutionNameMin: Cijk_Alik_Bljk_BBH_MT64x128x64_SE_
    SolutionIndex: 21
    SolutionNameMin: Cijk_Alik_Bljk_BBH_MT32x32x32_SE_
    SolutionIndex: 22
    SolutionNameMin: Cijk_Alik_Bljk_BBH_MT128x64x16_SE_
    SolutionIndex: 23
    SolutionNameMin: Cijk_Alik_Bljk_BBH_MT32x128x16_SE_
    SolutionIndex: 24
    SolutionNameMin: Cijk_Alik_Bljk_BBH_MT64x128x16_SE_
    SolutionIndex: 25
    SolutionNameMin: Cijk_Alik_Bljk_BBH_MT256x128x16_SE_
    SolutionIndex: 26
    SolutionNameMin: Cijk_Alik_Bljk_BBH_MT128x256x16_SE_
    SolutionIndex: 27
    SolutionNameMin: Cijk_Alik_Bljk_BBH_MT64x16x16_SE_
    SolutionIndex: 28
    SolutionNameMin: Cijk_Alik_Bljk_BBH_MT16x64x16_SE_
    SolutionIndex: 29
    SolutionNameMin: Cijk_Alik_Bljk_BBH_MT64x128x32_SE_
    SolutionIndex: 30
    SolutionNameMin: Cijk_Alik_Bljk_BBH_MT64x128x64_SE_
    SolutionIndex: 31
    SolutionNameMin: Cijk_Alik_Bljk_BBH_MT32x32x32_SE_
    SolutionIndex: 32
    SolutionNameMin: Cijk_Alik_Bljk_BBH_MT64x128x8_MI32x32x2x2_SE_GRVW4_ONLL0_SNLL1
    SolutionIndex: 33
    SolutionNameMin: Cijk_Alik_Bljk_BBH_MT64x128x8_MI32x32x2x2_SE_GRVW4_ONLL1_SNLL0
    SolutionIndex: 34
    SolutionNameMin: Cijk_Alik_Bljk_BBH_MT64x128x16_MI32x32x2x2_SE_GRVW4_ONLL1_SNLL0
    SolutionIndex: 35
    SolutionNameMin: Cijk_Alik_Bljk_BBH_MT64x128x64_SE_
    SolutionIndex: 36
    SolutionNameMin: Cijk_Alik_Bljk_BBH_MT128x64x16_SE_AF0EM1_ASEM1_GRVW1_WGM8
    SolutionIndex: 37
    SolutionNameMin: Cijk_Alik_Bljk_BBH_MT32x128x16_SE_AF0EM1_ASEM1_GRVW1_WGM8
    SolutionIndex: 38
    SolutionNameMin: Cijk_Alik_Bljk_BBH_MT64x16x16_SE_AF0EM1_ASEM1_GRVW1_WGM8
    SolutionIndex: 39
    SolutionNameMin: Cijk_Alik_Bljk_BBH_MT64x32x16_SE_AF0EM1_ASEM1_GRVW1_WGM8
    SolutionIndex: 40
    SolutionNameMin: Cijk_Alik_Bljk_BBH_MT32x64x64_SE_AF0EM8_ASEM8_GRVW2_WGM8
    SolutionIndex: 41
    SolutionNameMin: Cijk_Alik_Bljk_BBH_MT64x32x64_SE_AF0EM8_ASEM8_GRVW2_WGM8
    SolutionIndex: 42
    SolutionNameMin: Cijk_Alik_Bljk_BBH_MT64x128x32_MI32x32x2x2_SE_AF0EM2_ASEM1_GRVW4_WGM1
    SolutionIndex: 43
    SolutionNameMin: Cijk_Alik_Bljk_BBH_MT64x128x32_MI32x32x2x2_SE_AF0EM2_ASEM2_GRVW4_WGM1
    SolutionIndex: 44
    SolutionNameMin: Cijk_Alik_Bljk_BBH_MT32x256x32_MI32x32x2x2_SE_AF0EM2_ASEM1_GRVW4_WGM8
    SolutionIndex: 45
    SolutionNameMin: Cijk_Alik_Bljk_BBH_MT64x128x32_MI32x32x2x2_SE_AF0EM2_ASEM1_GRVW4_WGM8
    SolutionIndex: 46
    SolutionNameMin: Cijk_Alik_Bljk_BBH_MT64x128x32_MI32x32x2x2_SE_AF0EM2_ASEM2_GRVW4_WGM8
    SolutionIndex: 47
    SolutionIndex: 48
    SolutionIndex: 49
    SolutionIndex: 50
    SolutionIndex: 51
    SolutionIndex: 52
    SolutionIndex: 53
    SolutionIndex: 54
    SolutionIndex: 55
    SolutionIndex: 56
    SolutionIndex: 57
    SolutionIndex: 58
    SolutionIndex: 59
    SolutionIndex: 60
    SolutionIndex: 61
    SolutionIndex: 62
    SolutionIndex: 63
    SolutionIndex: 64
    SolutionIndex: 65
    SolutionIndex: 66
    SolutionIndex: 67
    SolutionIndex: 68
    SolutionIndex: 69
    SolutionIndex: 70
    SolutionIndex: 71
    SolutionIndex: 72
    SolutionIndex: 73
    SolutionIndex: 74
    SolutionIndex: 75
    SolutionIndex: 76
    SolutionIndex: 77
    SolutionIndex: 78
    SolutionIndex: 79
    SolutionIndex: 80
    SolutionIndex: 81
    SolutionIndex: 82
    SolutionIndex: 83
    SolutionIndex: 84
    SolutionIndex: 85
    SolutionIndex: 86
    SolutionIndex: 87
    SolutionIndex: 88
    SolutionIndex: 89
    SolutionNameMin: Cijk_Alik_Bljk_BBH_MT64x128x16_MI32x32x2x2_SE_GRVW4_ONLL0_SNLL1
    SolutionIndex: 90
    SolutionNameMin: Cijk_Alik_Bljk_BBH_MT64x128x16_MI32x32x2x2_SE_GRVW2_ONLL0_SNLL0
    SolutionIndex: 91
    SolutionNameMin: Cijk_Alik_Bljk_BBH_MT64x128x16_MI32x32x2x2_SE_GRVW4_ONLL0_SNLL0
    SolutionIndex: 92
    SolutionNameMin: Cijk_Alik_Bljk_BBH_MT64x128x32_MI32x32x2x2_SE_GRVW4_ONLL0_SNLL0
    SolutionIndex: 93
    SolutionNameMin: Cijk_Alik_Bljk_BBH_MT64x128x16_MI32x32x2x2_SE_GRVW4_ONLL1_SNLL1
    SolutionIndex: 94
    SolutionNameMin: Cijk_Alik_Bljk_BBH_MT64x128x16_MI32x32x2x2_SE_GRVW2_ONLL1_SNLL0
    SolutionIndex: 95
    SolutionNameMin: Cijk_Alik_Bljk_BBH_MT32x256x16_MI32x32x2x2_SE_GRVW4_ONLL1_SNLL0
    SolutionIndex: 96
    SolutionNameMin: Cijk_Alik_Bljk_BBH_MT64x128x16_MI32x32x2x2_SE_GRVW4_ONLL1_SNLL0
    SolutionIndex: 97
    SolutionNameMin: Cijk_Alik_Bljk_BBH_MT64x128x32_MI32x32x2x2_SE_GRVW4_ONLL1_SNLL0
    SolutionIndex: 98
    SolutionNameMin: Cijk_Alik_Bljk_BBH_MT64x256x16_MI32x32x2x2_SE_GRVW4_ONLL0_SNLL0
    SolutionIndex: 99
    SolutionNameMin: Cijk_Alik_Bljk_BBH_MT64x256x16_MI32x32x2x2_SE_GRVW4_ONLL1_SNLL1
    SolutionIndex: 100
    SolutionNameMin: Cijk_Alik_Bljk_BBH_MT128x32x16_SE_
    SolutionIndex: 101
    SolutionNameMin: Cijk_Alik_Bljk_BBH_MT128x64x16_SE_
    SolutionIndex: 102
    SolutionNameMin: Cijk_Alik_Bljk_BBH_MT32x128x16_SE_
    SolutionIndex: 103
    SolutionNameMin: Cijk_Alik_Bljk_BBH_MT64x128x16_SE_
    SolutionIndex: 104
    SolutionNameMin: Cijk_Alik_Bljk_BBH_MT256x128x16_SE_
    SolutionIndex: 105
    SolutionNameMin: Cijk_Alik_Bljk_BBH_MT128x256x16_SE_
    SolutionIndex: 106
    SolutionNameMin: Cijk_Alik_Bljk_BBH_MT64x16x16_SE_
    SolutionIndex: 107
    SolutionNameMin: Cijk_Alik_Bljk_BBH_MT16x64x16_SE_
    SolutionIndex: 108
    SolutionNameMin: Cijk_Alik_Bljk_BBH_MT64x128x32_SE_
    SolutionIndex: 109
    SolutionNameMin: Cijk_Alik_Bljk_BBH_MT64x128x64_SE_
    SolutionIndex: 110
    SolutionNameMin: Cijk_Alik_Bljk_BBH_MT32x32x32_SE_
    SolutionIndex: 111
    SolutionNameMin: Cijk_Alik_Bljk_BBH_MT128x64x16_SE_
    SolutionIndex: 112
    SolutionNameMin: Cijk_Alik_Bljk_BBH_MT32x128x16_SE_
    SolutionIndex: 113
    SolutionNameMin: Cijk_Alik_Bljk_BBH_MT64x128x16_SE_
    SolutionIndex: 114
    SolutionNameMin: Cijk_Alik_Bljk_BBH_MT256x128x16_SE_
    SolutionIndex: 115
    SolutionNameMin: Cijk_Alik_Bljk_BBH_MT128x256x16_SE_
    SolutionIndex: 116
    SolutionNameMin: Cijk_Alik_Bljk_BBH_MT64x16x16_SE_
    SolutionIndex: 117
    SolutionNameMin: Cijk_Alik_Bljk_BBH_MT16x64x16_SE_
    SolutionIndex: 118
    SolutionNameMin: Cijk_Alik_Bljk_BBH_MT64x128x32_SE_
    SolutionIndex: 119
    SolutionNameMin: Cijk_Alik_Bljk_BBH_MT64x128x64_SE_
    SolutionIndex: 120
    SolutionNameMin: Cijk_Alik_Bljk_BBH_MT32x32x32_SE_
    SolutionIndex: 121
    SolutionNameMin: Cijk_Alik_Bljk_BBH_MT64x128x8_MI32x32x2x2_SE_GRVW4_ONLL0_SNLL1
    SolutionIndex: 122
    SolutionNameMin: Cijk_Alik_Bljk_BBH_MT64x128x8_MI32x32x2x2_SE_GRVW4_ONLL1_SNLL0
    SolutionIndex: 123
    SolutionNameMin: Cijk_Alik_Bljk_BBH_MT64x128x16_MI32x32x2x2_SE_GRVW4_ONLL1_SNLL0
    SolutionIndex: 124
    SolutionNameMin: Cijk_Alik_Bljk_BBH_MT64x128x64_SE_
    SolutionIndex: 125
    SolutionNameMin: Cijk_Alik_Bljk_BBH_MT128x64x16_SE_AF0EM1_ASEM1_GRVW1_WGM8
    SolutionIndex: 126
    SolutionNameMin: Cijk_Alik_Bljk_BBH_MT32x128x16_SE_AF0EM1_ASEM1_GRVW1_WGM8
    SolutionIndex: 127
    SolutionNameMin: Cijk_Alik_Bljk_BBH_MT64x16x16_SE_AF0EM1_ASEM1_GRVW1_WGM8
    SolutionIndex: 128
    SolutionNameMin: Cijk_Alik_Bljk_BBH_MT64x32x16_SE_AF0EM1_ASEM1_GRVW1_WGM8
    SolutionIndex: 129
    SolutionNameMin: Cijk_Alik_Bljk_BBH_MT32x64x64_SE_AF0EM8_ASEM8_GRVW2_WGM8
    SolutionIndex: 130
    SolutionNameMin: Cijk_Alik_Bljk_BBH_MT64x32x64_SE_AF0EM8_ASEM8_GRVW2_WGM8
    SolutionIndex: 131
    SolutionNameMin: Cijk_Alik_Bljk_BBH_MT64x128x32_MI32x32x2x2_SE_AF0EM2_ASEM1_GRVW4_WGM1
    SolutionIndex: 132
    SolutionNameMin: Cijk_Alik_Bljk_BBH_MT64x128x32_MI32x32x2x2_SE_AF0EM2_ASEM2_GRVW4_WGM1
    SolutionIndex: 133
    SolutionNameMin: Cijk_Alik_Bljk_BBH_MT32x256x32_MI32x32x2x2_SE_AF0EM2_ASEM1_GRVW4_WGM8
    SolutionIndex: 134
    SolutionNameMin: Cijk_Alik_Bljk_BBH_MT64x128x32_MI32x32x2x2_SE_AF0EM2_ASEM1_GRVW4_WGM8
    SolutionIndex: 135
    SolutionNameMin: Cijk_Alik_Bljk_BBH_MT64x128x32_MI32x32x2x2_SE_AF0EM2_ASEM2_GRVW4_WGM8
    SolutionIndex: 136
    SolutionIndex: 137
    SolutionIndex: 138
    SolutionIndex: 139
    SolutionIndex: 140
    SolutionIndex: 141
    SolutionIndex: 142
    SolutionIndex: 143
    SolutionIndex: 144
    SolutionIndex: 145
    SolutionIndex: 146
    SolutionIndex: 147
    SolutionIndex: 148
    SolutionIndex: 149
    SolutionIndex: 150
    SolutionIndex: 151
    SolutionIndex: 152
    SolutionIndex: 153
    SolutionIndex: 154
    SolutionIndex: 155
    SolutionIndex: 156
    SolutionIndex: 157
    SolutionIndex: 158
    SolutionIndex: 159
    SolutionIndex: 160
    SolutionIndex: 161
    SolutionIndex: 162
    SolutionIndex: 163
    SolutionIndex: 164
    SolutionIndex: 165
    SolutionIndex: 166
    SolutionIndex: 167
    SolutionIndex: 168
    SolutionIndex: 169
    SolutionIndex: 170
    SolutionIndex: 171
    SolutionIndex: 172
    SolutionIndex: 173
    SolutionIndex: 174
    SolutionIndex: 175
    SolutionIndex: 176
    SolutionIndex: 177
- - - [511, 4096, 1, 4096]
    - [22, 0]
  - - [512, 3071, 1, 3072]
    - [22, 0]
  - - [2880, 3073, 1, 3072]
    - [22, 0]
  - - [511, 3072, 1, 3072]
    - [22, 0]
  - - [1024, 512, 1, 1025]
    - [22, 0]
  - - [511, 2048, 1, 2048]
    - [23, 0]
  - - [8192, 8193, 1, 8192]
    - [25, 0]
  - - [3072, 3072, 1, 3071]
    - [22, 0]
  - - [8192, 8192, 1, 8193]
    - [25, 0]
  - - [513, 1024, 1, 1024]
    - [22, 0]
  - - [512, 1023, 1, 1024]
    - [22, 0]
  - - [512, 2048, 1, 2047]
    - [23, 0]
  - - [7680, 8192, 1, 8193]
    - [25, 0]
  - - [513, 4096, 1, 4096]
    - [22, 0]
  - - [3073, 512, 1, 3072]
    - [22, 0]
  - - [4096, 4096, 1, 4097]
    - [22, 0]
  - - [1025, 1024, 1, 1024]
    - [23, 0]
  - - [8192, 8191, 1, 8192]
    - [25, 0]
  - - [8192, 512, 1, 8193]
    - [22, 0]
  - - [7681, 8192, 1, 8192]
    - [25, 0]
  - - [2880, 3071, 1, 3072]
    - [24, 0]
  - - [512, 1025, 1, 1024]
    - [22, 0]
  - - [2048, 513, 1, 2048]
    - [23, 0]
  - - [1024, 1024, 1, 1025]
    - [23, 0]
  - - [960, 1024, 1, 1023]
    - [24, 0]
  - - [3072, 512, 1, 3071]
    - [22, 0]
  - - [960, 1025, 1, 1024]
    - [23, 0]
  - - [3072, 3071, 1, 3072]
    - [22, 0]
  - - [512, 2048, 1, 2049]
    - [23, 0]
  - - [3072, 511, 1, 3072]
    - [22, 0]
  - - [2049, 512, 1, 2048]
    - [23, 0]
  - - [512, 8191, 1, 8192]
    - [22, 0]
  - - [513, 3072, 1, 3072]
    - [22, 0]
  - - [4096, 4095, 1, 4096]
    - [22, 0]
  - - [511, 1024, 1, 1024]
    - [22, 0]
  - - [513, 512, 1, 512]
    - [27, 0]
  - - [1024, 511, 1, 1024]
    - [22, 0]
  - - [3072, 3072, 1, 3073]
    - [22, 0]
  - - [960, 1024, 1, 1025]
    - [24, 0]
  - - [959, 1024, 1, 1024]
    - [23, 0]
  - - [7680, 8193, 1, 8192]
    - [25, 0]
  - - [512, 3072, 1, 3073]
    - [22, 0]
  - - [1023, 512, 1, 1024]
    - [22, 0]
  - - [3072, 512, 1, 3073]
    - [22, 0]
  - - [512, 2049, 1, 2048]
    - [23, 0]
  - - [513, 8192, 1, 8192]
    - [24, 0]
  - - [7679, 8192, 1, 8192]
    - [25, 0]
  - - [1024, 513, 1, 1024]
    - [22, 0]
  - - [8192, 511, 1, 8192]
    - [22, 0]
  - - [4096, 4097, 1, 4096]
    - [22, 0]
  - - [512, 3072, 1, 3071]
    - [22, 0]
  - - [7680, 8192, 1, 8191]
    - [26, 0]
  - - [2048, 2047, 1, 2048]
    - [22, 0]
  - - [8193, 8192, 1, 8192]
    - [25, 0]
  - - [512, 4096, 1, 4095]
    - [23, 0]
  - - [1024, 1023, 1, 1024]
    - [23, 0]
  - - [3073, 3072, 1, 3072]
    - [22, 0]
  - - [512, 3073, 1, 3072]
    - [22, 0]
  - - [4096, 4096, 1, 4095]
    - [25, 0]
  - - [1920, 2048, 1, 2047]
    - [26, 0]
  - - [1920, 2049, 1, 2048]
    - [22, 0]
  - - [512, 8192, 1, 8191]
    - [24, 0]
  - - [8191, 512, 1, 8192]
    - [22, 0]
  - - [1025, 512, 1, 1024]
    - [22, 0]
  - - [2881, 3072, 1, 3072]
    - [22, 0]
  - - [64, 1024, 1, 1024]
    - [31, 0]
  - - [1024, 512, 1, 1023]
    - [22, 0]
  - - [513, 2048, 1, 2048]
    - [23, 0]
  - - [3841, 4096, 1, 4096]
    - [22, 0]
  - - [2880, 3072, 1, 3073]
    - [24, 0]
  - - [512, 512, 1, 513]
    - [27, 0]
  - - [4095, 512, 1, 4096]
    - [22, 0]
  - - [1919, 2048, 1, 2048]
    - [26, 0]
  - - [1024, 1025, 1, 1024]
    - [23, 0]
  - - [2879, 3072, 1, 3072]
    - [24, 0]
  - - [512, 8192, 1, 8193]
    - [22, 0]
  - - [511, 8192, 1, 8192]
    - [22, 0]
  - - [8192, 513, 1, 8192]
    - [22, 0]
  - - [512, 8193, 1, 8192]
    - [22, 0]
  - - [7680, 8191, 1, 8192]
    - [25, 0]
  - - [512, 512, 1, 511]
    - [27, 0]
  - - [2047, 2048, 1, 2048]
    - [22, 0]
  - - [2049, 2048, 1, 2048]
    - [22, 0]
  - - [3840, 4095, 1, 4096]
    - [25, 0]
  - - [960, 1023, 1, 1024]
    - [24, 0]
  - - [2880, 3072, 1, 3071]
    - [24, 0]
  - - [64, 1025, 1, 1024]
    - [27, 0]
  - - [2048, 511, 1, 2048]
    - [23, 0]
  - - [4096, 513, 1, 4096]
    - [22, 0]
  - - [4097, 512, 1, 4096]
    - [22, 0]
  - - [8192, 512, 1, 8191]
    - [24, 0]
  - - [1921, 2048, 1, 2048]
    - [22, 0]
  - - [2048, 2049, 1, 2048]
    - [22, 0]
  - - [2048, 512, 1, 2047]
    - [23, 0]
  - - [3071, 3072, 1, 3072]
    - [22, 0]
  - - [3840, 4097, 1, 4096]
    - [22, 0]
  - - [4096, 511, 1, 4096]
    - [22, 0]
  - - [64, 1024, 1, 1025]
    - [27, 0]
  - - [2047, 512, 1, 2048]
    - [23, 0]
  - - [63, 1024, 1, 1024]
    - [27, 0]
  - - [3072, 513, 1, 3072]
    - [22, 0]
  - - [512, 4095, 1, 4096]
    - [22, 0]
  - - [512, 1024, 1, 1025]
    - [22, 0]
  - - [3071, 512, 1, 3072]
    - [22, 0]
  - - [3840, 4096, 1, 4097]
    - [25, 0]
  - - [512, 511, 1, 512]
    - [27, 0]
  - - [4097, 4096, 1, 4096]
    - [22, 0]
  - - [2048, 2048, 1, 2047]
    - [22, 0]
  - - [3839, 4096, 1, 4096]
    - [25, 0]
  - - [512, 4096, 1, 4097]
    - [22, 0]
  - - [3072, 3073, 1, 3072]
    - [22, 0]
  - - [512, 2047, 1, 2048]
    - [23, 0]
  - - [2048, 2048, 1, 2049]
    - [22, 0]
  - - [8191, 8192, 1, 8192]
    - [25, 0]
  - - [64, 1023, 1, 1024]
    - [27, 0]
  - - [4096, 512, 1, 4097]
    - [22, 0]
  - - [3840, 4096, 1, 4095]
    - [25, 0]
  - - [65, 1024, 1, 1024]
    - [28, 0]
  - - [1920, 2047, 1, 2048]
    - [26, 0]
  - - [512, 513, 1, 512]
    - [27, 0]
  - - [8192, 8192, 1, 8191]
    - [25, 0]
  - - [1024, 1024, 1, 1023]
    - [23, 0]
  - - [512, 4097, 1, 4096]
    - [22, 0]
  - - [511, 512, 1, 512]
    - [27, 0]
  - - [4096, 512, 1, 4095]
    - [24, 0]
  - - [8193, 512, 1, 8192]
    - [22, 0]
  - - [961, 1024, 1, 1024]
    - [23, 0]
  - - [512, 1024, 1, 1023]
    - [22, 0]
  - - [4095, 4096, 1, 4096]
    - [22, 0]
  - - [64, 1024, 1, 1023]
    - [27, 0]
  - - [2048, 512, 1, 2049]
    - [23, 0]
  - - [1023, 1024, 1, 1024]
    - [23, 0]
  - - [1920, 2048, 1, 2049]
    - [26, 0]
  - - [512, 512, 1, 512]
    - [35, 0]
  - - [512, 1024, 1, 1024]
    - [35, 0]
  - - [512, 2048, 1, 2048]
    - [35, 0]
  - - [512, 3072, 1, 3072]
    - [35, 0]
  - - [512, 4096, 1, 4096]
    - [35, 0]
  - - [512, 8192, 1, 8192]
    - [35, 0]
  - - [960, 1024, 1, 1024]
    - [35, 0]
  - - [1024, 1024, 1, 1024]
    - [35, 0]
  - - [1920, 2048, 1, 2048]
    - [35, 0]
  - - [2048, 2048, 1, 2048]
    - [35, 0]
  - - [2880, 3072, 1, 3072]
    - [35, 0]
  - - [3072, 512, 1, 3072]
    - [35, 0]
  - - [3072, 3072, 1, 3072]
    - [35, 0]
  - - [3840, 4096, 1, 4096]
    - [35, 0]
  - - [4096, 512, 1, 4096]
    - [35, 0]
  - - [4096, 4096, 1, 4096]
    - [35, 0]
  - - [7680, 8192, 1, 8192]
    - [35, 0]
  - - [8192, 512, 1, 8192]
    - [35, 0]
  - - [8192, 8192, 1, 8192]
    - [35, 0]
  - - [479, 512, 1, 512]
    - [38, 0]
  - - [479, 1024, 1, 1024]
    - [37, 0]
  - - [479, 2048, 1, 2048]
    - [37, 0]
  - - [480, 511, 1, 512]
    - [38, 0]
  - - [480, 512, 1, 511]
    - [38, 0]
  - - [480, 512, 1, 513]
    - [38, 0]
  - - [480, 513, 1, 512]
    - [38, 0]
  - - [480, 1023, 1, 1024]
    - [37, 0]
  - - [480, 1024, 1, 1023]
    - [37, 0]
  - - [480, 1024, 1, 1025]
    - [37, 0]
  - - [480, 1025, 1, 1024]
    - [36, 0]
  - - [480, 2047, 1, 2048]
    - [37, 0]
  - - [480, 2048, 1, 2047]
    - [37, 0]
  - - [480, 2048, 1, 2049]
    - [37, 0]
  - - [480, 2049, 1, 2048]
    - [37, 0]
  - - [481, 512, 1, 512]
    - [38, 0]
  - - [481, 1024, 1, 1024]
    - [36, 0]
  - - [481, 2048, 1, 2048]
    - [37, 0]
  - - [511, 480, 1, 512]
    - [38, 0]
  - - [512, 479, 1, 512]
    - [38, 0]
  - - [512, 480, 1, 511]
    - [38, 0]
  - - [512, 480, 1, 513]
    - [38, 0]
  - - [512, 481, 1, 512]
    - [38, 0]
  - - [513, 480, 1, 512]
    - [38, 0]
  - - [1023, 480, 1, 1024]
    - [38, 0]
  - - [1024, 479, 1, 1024]
    - [38, 0]
  - - [1024, 480, 1, 1023]
    - [38, 0]
  - - [1024, 480, 1, 1025]
    - [38, 0]
  - - [1024, 481, 1, 1024]
    - [36, 0]
  - - [1025, 480, 1, 1024]
    - [36, 0]
  - - [2047, 480, 1, 2048]
    - [39, 0]
  - - [2048, 479, 1, 2048]
    - [39, 0]
  - - [2048, 480, 1, 2047]
    - [39, 0]
  - - [2048, 480, 1, 2049]
    - [39, 0]
  - - [2048, 481, 1, 2048]
    - [37, 0]
  - - [2049, 480, 1, 2048]
    - [37, 0]
  - - [480, 512, 1, 512]
    - [40, 0]
  - - [480, 1024, 1, 1024]
    - [40, 0]
  - - [480, 2048, 1, 2048]
    - [40, 0]
  - - [512, 480, 1, 512]
    - [41, 0]
  - - [1024, 480, 1, 1024]
    - [41, 0]
  - - [2048, 480, 1, 2048]
    - [41, 0]
  - - [480, 3072, 1, 3072]
    - [42, 0]
  - - [480, 4096, 1, 4096]
    - [44, 0]
  - - [480, 8192, 1, 8192]
    - [43, 0]
  - - [3072, 480, 1, 3072]
    - [45, 0]
  - - [4096, 480, 1, 4096]
    - [45, 0]
  - - [8192, 480, 1, 8192]
    - [46, 0]
  - - [256, 44505, 1, 1024]
    - [56, 0]
  - - [10240, 8976, 1, 256]
    - [84, 0]
  - - [512, 1600, 1, 512]
    - [86, 0]
  - - [1024, 10200, 1, 4096]
    - [52, 0]
  - - [2, 32, 1, 1024]
    - [62, 0]
  - - [17, 15, 7680, 64]
    - [61, 0]
  - - [17, 17, 1, 64]
    - [57, 0]
  - - [42720, 6528, 1, 1024]
    - [76, 0]
  - - [256, 19200, 1, 1024]
    - [56, 0]
  - - [1024, 512, 1, 1024]
    - [80, 0]
  - - [5632, 8976, 1, 256]
    - [66, 0]
  - - [24, 24, 1, 64]
    - [75, 0]
  - - [256, 14848, 1, 1024]
    - [87, 0]
  - - [3840, 8976, 1, 256]
    - [66, 0]
  - - [27, 33, 1920, 64]
    - [83, 0]
  - - [64, 960, 1, 1024]
    - [74, 0]
  - - [4096, 3968, 1, 1024]
    - [56, 0]
  - - [1024, 6528, 1, 4096]
    - [52, 0]
  - - [1024, 1600, 1, 1024]
    - [56, 0]
  - - [1024, 2048, 1, 4096]
    - [67, 0]
  - - [30, 31, 2048, 64]
    - [83, 0]
  - - [5376, 8976, 1, 256]
    - [76, 0]
  - - [256, 5888, 1, 1024]
    - [48, 0]
  - - [64, 128, 512, 128]
    - [71, 0]
  - - [1024, 9216, 1, 1024]
    - [72, 0]
  - - [1024, 8160, 1, 4096]
    - [79, 0]
  - - [30, 31, 1, 64]
    - [75, 0]
  - - [2, 4, 1, 1024]
    - [62, 0]
  - - [32, 32, 1, 64]
    - [65, 0]
  - - [256, 7424, 1, 1024]
    - [50, 0]
  - - [32, 35, 1, 64]
    - [80, 0]
  - - [8192, 8976, 1, 256]
    - [87, 0]
  - - [128, 32768, 1, 256]
    - [66, 0]
  - - [256, 2560, 1, 1024]
    - [73, 0]
  - - [256, 21504, 1, 1024]
    - [56, 0]
  - - [2048, 512, 1, 100]
    - [85, 0]
  - - [6400, 8976, 1, 256]
    - [76, 0]
  - - [31, 31, 1, 64]
    - [68, 0]
  - - [256, 8960, 1, 1024]
    - [67, 0]
  - - [34, 34, 1, 64]
    - [63, 0]
  - - [5, 5, 960, 64]
    - [83, 0]
  - - [11776, 8976, 1, 256]
    - [76, 0]
  - - [256, 20992, 1, 1024]
    - [56, 0]
  - - [15, 15, 10880, 64]
    - [61, 0]
  - - [256, 684, 1, 1024]
    - [82, 0]
  - - [1024, 200, 1, 560]
    - [80, 0]
  - - [256, 10496, 1, 1024]
    - [70, 0]
  - - [21248, 8976, 1, 256]
    - [76, 0]
  - - [15360, 8976, 1, 256]
    - [66, 0]
  - - [4096, 10080, 1, 1024]
    - [56, 0]
  - - [256, 8192, 1, 1024]
    - [88, 0]
  - - [4096, 8976, 1, 256]
    - [87, 0]
  - - [2048, 512, 1, 2048]
    - [72, 0]
  - - [1024, 8064, 1, 4096]
    - [48, 0]
  - - [18944, 8976, 1, 256]
    - [76, 0]
  - - [8448, 8976, 1, 256]
    - [76, 0]
  - - [256, 11776, 1, 1024]
    - [56, 0]
  - - [31488, 8976, 1, 256]
    - [76, 0]
  - - [1024, 4096, 1, 1024]
    - [86, 0]
  - - [30, 30, 1, 64]
    - [61, 0]
  - - [64, 512, 1, 512]
    - [80, 0]
  - - [4096, 3840, 1, 1024]
    - [56, 0]
  - - [64, 512, 1, 1024]
    - [78, 0]
  - - [12544, 8976, 1, 256]
    - [76, 0]
  - - [1024, 3240, 1, 1024]
    - [72, 0]
  - - [256, 23296, 1, 1024]
    - [56, 0]
  - - [17, 15, 1, 64]
    - [86, 0]
  - - [35, 35, 1, 64]
    - [75, 0]
  - - [27, 27, 32768, 128]
    - [61, 0]
  - - [256, 18944, 1, 1024]
    - [56, 0]
  - - [1024, 3968, 1, 4096]
    - [70, 0]
  - - [16128, 8976, 1, 256]
    - [76, 0]
  - - [1024, 7104, 1, 1024]
    - [56, 0]
  - - [512, 512, 64, 64]
    - [66, 0]
  - - [1024, 7200, 1, 1024]
    - [72, 0]
  - - [256, 2816, 1, 1024]
    - [70, 0]
  - - [21, 17, 1, 64]
    - [61, 0]
  - - [1024, 10080, 1, 4096]
    - [52, 0]
  - - [256, 6144, 1, 1024]
    - [48, 0]
  - - [21, 21, 1, 64]
    - [57, 0]
  - - [9472, 8976, 1, 256]
    - [76, 0]
  - - [2048, 215, 1, 768]
    - [80, 0]
  - - [1024, 32768, 1, 1024]
    - [72, 0]
  - - [1024, 4, 1, 1024]
    - [82, 0]
  - - [684, 8976, 1, 256]
    - [59, 0]
  - - [3, 3, 512, 64]
    - [83, 0]
  - - [30528, 2048, 1, 1024]
    - [76, 0]
  - - [256, 1536, 1, 1024]
    - [80, 0]
  - - [2048, 684, 1, 768]
    - [56, 0]
  - - [8960, 8976, 1, 256]
    - [76, 0]
  - - [1024, 7104, 1, 4096]
    - [52, 0]
  - - [256, 11520, 1, 1024]
    - [56, 0]
  - - [33536, 8976, 1, 256]
    - [71, 0]
  - - [1024, 3840, 1, 1024]
    - [77, 0]
  - - [4096, 7104, 1, 1024]
    - [56, 0]
  - - [5, 5, 512, 64]
    - [61, 0]
  - - [28672, 8976, 1, 256]
    - [60, 0]
  - - [256, 1280, 1, 1024]
    - [78, 0]
  - - [256, 7168, 1, 1024]
    - [50, 0]
  - - [1024, 3840, 1, 4096]
    - [53, 0]
  - - [256, 13312, 1, 1024]
    - [56, 0]
  - - [2304, 8976, 1, 256]
    - [66, 0]
  - - [2048, 512, 1, 67]
    - [68, 0]
  - - [4096, 2048, 1, 1024]
    - [56, 0]
  - - [15, 14, 1, 64]
    - [57, 0]
  - - [1024, 960, 1, 1600]
    - [84, 0]
  - - [4096, 7200, 1, 1024]
    - [56, 0]
  - - [1024, 7200, 1, 4096]
    - [52, 0]
  - - [4096, 9520, 1, 1024]
    - [56, 0]
  - - [42720, 10080, 1, 1024]
    - [71, 0]
  - - [9984, 8976, 1, 256]
    - [71, 0]
  - - [1024, 10200, 1, 1024]
    - [56, 0]
  - - [256, 14592, 1, 1024]
    - [87, 0]
  - - [11264, 8976, 1, 256]
    - [66, 0]
  - - [1024, 32768, 1, 480]
    - [66, 0]
  - - [2048, 114, 1, 512]
    - [80, 0]
  - - [256, 7936, 1, 1024]
    - [54, 0]
  - - [2048, 256, 1, 768]
    - [80, 0]
  - - [15104, 8976, 1, 256]
    - [76, 0]
  - - [4096, 4096, 1, 1024]
    - [56, 0]
  - - [2048, 512, 1, 74]
    - [83, 0]
  - - [14, 14, 10880, 64]
    - [61, 0]
  - - [42720, 7104, 1, 1024]
    - [66, 0]
  - - [256, 23552, 1, 1024]
    - [56, 0]
  - - [1024, 1600, 1, 560]
    - [69, 0]
  - - [2048, 1536, 1, 512]
    - [56, 0]
  - - [14, 14, 1, 64]
    - [55, 0]
  - - [1024, 8064, 1, 1024]
    - [72, 0]
  - - [13824, 8976, 1, 256]
    - [76, 0]
  - - [1024, 9520, 1, 1024]
    - [81, 0]
  - - [4096, 10064, 1, 1024]
    - [56, 0]
  - - [256, 6656, 1, 1024]
    - [48, 0]
  - - [2048, 215, 1, 512]
    - [80, 0]
  - - [2560, 8976, 1, 256]
    - [66, 0]
  - - [4096, 10200, 1, 1024]
    - [56, 0]
  - - [17, 17, 7680, 64]
    - [61, 0]
  - - [1024, 960, 1, 1024]
    - [67, 0]
  - - [32, 1600, 1, 512]
    - [80, 0]
  - - [13568, 8976, 1, 256]
    - [76, 0]
  - - [4096, 8064, 1, 1024]
    - [56, 0]
  - - [4608, 8976, 1, 256]
    - [76, 0]
  - - [256, 22016, 1, 1024]
    - [50, 0]
  - - [42720, 3968, 1, 1024]
    - [76, 0]
  - - [2048, 960, 1, 74]
    - [81, 0]
  - - [4864, 8976, 1, 256]
    - [76, 0]
  - - [256, 21248, 1, 1024]
    - [56, 0]
  - - [1024, 6528, 1, 1024]
    - [81, 0]
  - - [23552, 8976, 1, 256]
    - [66, 0]
  - - [256, 12544, 1, 1024]
    - [56, 0]
  - - [42720, 7200, 1, 1024]
    - [76, 0]
  - - [9, 9, 512, 64]
    - [75, 0]
  - - [256, 33536, 1, 1024]
    - [56, 0]
  - - [1792, 8976, 1, 256]
    - [84, 0]
  - - [4096, 8160, 1, 1024]
    - [56, 0]
  - - [4096, 9216, 1, 1024]
    - [56, 0]
  - - [19968, 8976, 1, 256]
    - [76, 0]
  - - [33, 33, 1600, 32]
    - [83, 0]
  - - [5888, 8976, 1, 256]
    - [76, 0]
  - - [256, 2304, 1, 1024]
    - [67, 0]
  - - [33, 33, 1920, 64]
    - [61, 0]
  - - [7168, 8976, 1, 256]
    - [66, 0]
  - - [1024, 32, 1, 1024]
    - [78, 0]
  - - [2, 2048, 1, 1024]
    - [82, 0]
  - - [4096, 3960, 1, 1024]
    - [56, 0]
  - - [512, 32768, 1, 13]
    - [64, 0]
  - - [19712, 8976, 1, 256]
    - [76, 0]
  - - [1024, 2048, 1, 1024]
    - [80, 0]
  - - [64, 512, 64, 512]
    - [71, 0]
  - - [2048, 8976, 1, 256]
    - [81, 0]
  - - [256, 3584, 1, 1024]
    - [54, 0]
  - - [18688, 8976, 1, 256]
    - [76, 0]
  - - [512, 512, 1, 64]
    - [68, 0]
  - - [256, 5376, 1, 1024]
    - [48, 0]
  - - [30, 30, 2048, 64]
    - [61, 0]
  - - [6144, 8976, 1, 256]
    - [66, 0]
  - - [30528, 4096, 1, 1024]
    - [76, 0]
  - - [256, 11264, 1, 1024]
    - [56, 0]
  - - [4096, 3240, 1, 1024]
    - [56, 0]
  - - [4352, 8976, 1, 256]
    - [71, 0]
  - - [15, 15, 1, 64]
    - [57, 0]
  - - [256, 15104, 1, 1024]
    - [87, 0]
  - - [256, 31488, 1, 1024]
    - [56, 0]
  - - [1024, 3968, 1, 1024]
    - [80, 0]
  - - [9728, 8976, 1, 256]
    - [71, 0]
  - - [256, 9984, 1, 1024]
    - [67, 0]
  - - [7936, 8976, 1, 256]
    - [76, 0]
  - - [2048, 960, 1, 2048]
    - [81, 0]
  - - [5120, 8976, 1, 256]
    - [66, 0]
  - - [27, 27, 1920, 64]
    - [83, 0]
  - - [4096, 6528, 1, 1024]
    - [56, 0]
  - - [13312, 8976, 1, 256]
    - [66, 0]
  - - [1024, 10080, 1, 1024]
    - [56, 0]
  - - [256, 14336, 1, 1024]
    - [56, 0]
  - - [1280, 8976, 1, 256]
    - [66, 0]
  - - [256, 22344, 1, 1024]
    - [56, 0]
  - - [256, 18176, 1, 1024]
    - [56, 0]
  - - [1024, 9520, 1, 4096]
    - [48, 0]
  - - [512, 32768, 1, 1024]
    - [72, 0]
  - - [128, 128, 512, 64]
    - [58, 0]
  - - [20992, 8976, 1, 256]
    - [76, 0]
  - - [42720, 3960, 1, 1024]
    - [76, 0]
  - - [1024, 10064, 1, 1024]
    - [56, 0]
  - - [2048, 684, 1, 512]
    - [77, 0]
  - - [31, 31, 2048, 64]
    - [61, 0]
  - - [17152, 8976, 1, 256]
    - [76, 0]
  - - [256, 3328, 1, 1024]
    - [70, 0]
  - - [34, 24, 1, 64]
    - [49, 0]
  - - [20480, 8976, 1, 256]
    - [60, 0]
  - - [2048, 256, 1, 512]
    - [80, 0]
  - - [2048, 1536, 1, 768]
    - [56, 0]
  - - [10496, 8976, 1, 256]
    - [71, 0]
  - - [3328, 8976, 1, 256]
    - [66, 0]
  - - [1024, 3240, 1, 4096]
    - [47, 0]
  - - [256, 4864, 1, 1024]
    - [50, 0]
  - - [1024, 9216, 1, 4096]
    - [79, 0]
  - - [15872, 8976, 1, 256]
    - [76, 0]
  - - [15, 14, 10880, 64]
    - [61, 0]
  - - [1024, 8160, 1, 1024]
    - [81, 0]
  - - [256, 32768, 1, 512]
    - [56, 0]
  - - [15, 15, 7680, 64]
    - [61, 0]
  - - [18176, 8976, 1, 256]
    - [71, 0]
  - - [1024, 512, 1, 1600]
    - [80, 0]
  - - [256, 6400, 1, 1024]
    - [50, 0]
  - - [3072, 8976, 1, 256]
    - [66, 0]
  - - [256, 20480, 1, 1024]
    - [56, 0]
  - - [44505, 8976, 1, 256]
    - [76, 0]
  - - [2048, 114, 1, 768]
    - [82, 0]
  - - [256, 16128, 1, 1024]
    - [56, 0]
  - - [256, 4608, 1, 1024]
    - [56, 0]
  - - [1024, 4, 1, 1024]
    - [82, 0]
  - - [1024, 4096, 1, 4096]
    - [67, 0]
  - - [256, 8448, 1, 1024]
    - [51, 0]
  - - [1024, 3960, 1, 4096]
    - [70, 0]
  - - [42720, 9520, 1, 1024]
    - [71, 0]
  - - [1024, 10064, 1, 4096]
    - [52, 0]
  - - [2816, 8976, 1, 256]
    - [66, 0]
  - - [1024, 3960, 1, 1024]
    - [86, 0]
  - - [511, 4096, 1, 4096]
    - [111, 0]
  - - [512, 3071, 1, 3072]
    - [111, 0]
  - - [2880, 3073, 1, 3072]
    - [111, 0]
  - - [511, 3072, 1, 3072]
    - [111, 0]
  - - [1024, 512, 1, 1025]
    - [111, 0]
  - - [511, 2048, 1, 2048]
    - [112, 0]
  - - [8192, 8193, 1, 8192]
    - [114, 0]
  - - [3072, 3072, 1, 3071]
    - [111, 0]
  - - [8192, 8192, 1, 8193]
    - [114, 0]
  - - [513, 1024, 1, 1024]
    - [111, 0]
  - - [512, 1023, 1, 1024]
    - [111, 0]
  - - [512, 2048, 1, 2047]
    - [112, 0]
  - - [7680, 8192, 1, 8193]
    - [114, 0]
  - - [513, 4096, 1, 4096]
    - [111, 0]
  - - [3073, 512, 1, 3072]
    - [111, 0]
  - - [4096, 4096, 1, 4097]
    - [111, 0]
  - - [1025, 1024, 1, 1024]
    - [112, 0]
  - - [8192, 8191, 1, 8192]
    - [114, 0]
  - - [8192, 512, 1, 8193]
    - [111, 0]
  - - [7681, 8192, 1, 8192]
    - [114, 0]
  - - [2880, 3071, 1, 3072]
    - [113, 0]
  - - [512, 1025, 1, 1024]
    - [111, 0]
  - - [2048, 513, 1, 2048]
    - [112, 0]
  - - [1024, 1024, 1, 1025]
    - [112, 0]
  - - [960, 1024, 1, 1023]
    - [113, 0]
  - - [3072, 512, 1, 3071]
    - [111, 0]
  - - [960, 1025, 1, 1024]
    - [112, 0]
  - - [3072, 3071, 1, 3072]
    - [111, 0]
  - - [512, 2048, 1, 2049]
    - [112, 0]
  - - [3072, 511, 1, 3072]
    - [111, 0]
  - - [2049, 512, 1, 2048]
    - [112, 0]
  - - [512, 8191, 1, 8192]
    - [111, 0]
  - - [513, 3072, 1, 3072]
    - [111, 0]
  - - [4096, 4095, 1, 4096]
    - [111, 0]
  - - [511, 1024, 1, 1024]
    - [111, 0]
  - - [513, 512, 1, 512]
    - [116, 0]
  - - [1024, 511, 1, 1024]
    - [111, 0]
  - - [3072, 3072, 1, 3073]
    - [111, 0]
  - - [960, 1024, 1, 1025]
    - [113, 0]
  - - [959, 1024, 1, 1024]
    - [112, 0]
  - - [7680, 8193, 1, 8192]
    - [114, 0]
  - - [512, 3072, 1, 3073]
    - [111, 0]
  - - [1023, 512, 1, 1024]
    - [111, 0]
  - - [3072, 512, 1, 3073]
    - [111, 0]
  - - [512, 2049, 1, 2048]
    - [112, 0]
  - - [513, 8192, 1, 8192]
    - [113, 0]
  - - [7679, 8192, 1, 8192]
    - [114, 0]
  - - [1024, 513, 1, 1024]
    - [111, 0]
  - - [8192, 511, 1, 8192]
    - [111, 0]
  - - [4096, 4097, 1, 4096]
    - [111, 0]
  - - [512, 3072, 1, 3071]
    - [111, 0]
  - - [7680, 8192, 1, 8191]
    - [115, 0]
  - - [2048, 2047, 1, 2048]
    - [111, 0]
  - - [8193, 8192, 1, 8192]
    - [114, 0]
  - - [512, 4096, 1, 4095]
    - [112, 0]
  - - [1024, 1023, 1, 1024]
    - [112, 0]
  - - [3073, 3072, 1, 3072]
    - [111, 0]
  - - [512, 3073, 1, 3072]
    - [111, 0]
  - - [4096, 4096, 1, 4095]
    - [114, 0]
  - - [1920, 2048, 1, 2047]
    - [115, 0]
  - - [1920, 2049, 1, 2048]
    - [111, 0]
  - - [512, 8192, 1, 8191]
    - [113, 0]
  - - [8191, 512, 1, 8192]
    - [111, 0]
  - - [1025, 512, 1, 1024]
    - [111, 0]
  - - [2881, 3072, 1, 3072]
    - [111, 0]
  - - [64, 1024, 1, 1024]
    - [120, 0]
  - - [1024, 512, 1, 1023]
    - [111, 0]
  - - [513, 2048, 1, 2048]
    - [112, 0]
  - - [3841, 4096, 1, 4096]
    - [111, 0]
  - - [2880, 3072, 1, 3073]
    - [113, 0]
  - - [512, 512, 1, 513]
    - [116, 0]
  - - [4095, 512, 1, 4096]
    - [111, 0]
  - - [1919, 2048, 1, 2048]
    - [115, 0]
  - - [1024, 1025, 1, 1024]
    - [112, 0]
  - - [2879, 3072, 1, 3072]
    - [113, 0]
  - - [512, 8192, 1, 8193]
    - [111, 0]
  - - [511, 8192, 1, 8192]
    - [111, 0]
  - - [8192, 513, 1, 8192]
    - [111, 0]
  - - [512, 8193, 1, 8192]
    - [111, 0]
  - - [7680, 8191, 1, 8192]
    - [114, 0]
  - - [512, 512, 1, 511]
    - [116, 0]
  - - [2047, 2048, 1, 2048]
    - [111, 0]
  - - [2049, 2048, 1, 2048]
    - [111, 0]
  - - [3840, 4095, 1, 4096]
    - [114, 0]
  - - [960, 1023, 1, 1024]
    - [113, 0]
  - - [2880, 3072, 1, 3071]
    - [113, 0]
  - - [64, 1025, 1, 1024]
    - [116, 0]
  - - [2048, 511, 1, 2048]
    - [112, 0]
  - - [4096, 513, 1, 4096]
    - [111, 0]
  - - [4097, 512, 1, 4096]
    - [111, 0]
  - - [8192, 512, 1, 8191]
    - [113, 0]
  - - [1921, 2048, 1, 2048]
    - [111, 0]
  - - [2048, 2049, 1, 2048]
    - [111, 0]
  - - [2048, 512, 1, 2047]
    - [112, 0]
  - - [3071, 3072, 1, 3072]
    - [111, 0]
  - - [3840, 4097, 1, 4096]
    - [111, 0]
  - - [4096, 511, 1, 4096]
    - [111, 0]
  - - [64, 1024, 1, 1025]
    - [116, 0]
  - - [2047, 512, 1, 2048]
    - [112, 0]
  - - [63, 1024, 1, 1024]
    - [116, 0]
  - - [3072, 513, 1, 3072]
    - [111, 0]
  - - [512, 4095, 1, 4096]
    - [111, 0]
  - - [512, 1024, 1, 1025]
    - [111, 0]
  - - [3071, 512, 1, 3072]
    - [111, 0]
  - - [3840, 4096, 1, 4097]
    - [114, 0]
  - - [512, 511, 1, 512]
    - [116, 0]
  - - [4097, 4096, 1, 4096]
    - [111, 0]
  - - [2048, 2048, 1, 2047]
    - [111, 0]
  - - [3839, 4096, 1, 4096]
    - [114, 0]
  - - [512, 4096, 1, 4097]
    - [111, 0]
  - - [3072, 3073, 1, 3072]
    - [111, 0]
  - - [512, 2047, 1, 2048]
    - [112, 0]
  - - [2048, 2048, 1, 2049]
    - [111, 0]
  - - [8191, 8192, 1, 8192]
    - [114, 0]
  - - [64, 1023, 1, 1024]
    - [116, 0]
  - - [4096, 512, 1, 4097]
    - [111, 0]
  - - [3840, 4096, 1, 4095]
    - [114, 0]
  - - [65, 1024, 1, 1024]
    - [117, 0]
  - - [1920, 2047, 1, 2048]
    - [115, 0]
  - - [512, 513, 1, 512]
    - [116, 0]
  - - [8192, 8192, 1, 8191]
    - [114, 0]
  - - [1024, 1024, 1, 1023]
    - [112, 0]
  - - [512, 4097, 1, 4096]
    - [111, 0]
  - - [511, 512, 1, 512]
    - [116, 0]
  - - [4096, 512, 1, 4095]
    - [113, 0]
  - - [8193, 512, 1, 8192]
    - [111, 0]
  - - [961, 1024, 1, 1024]
    - [112, 0]
  - - [512, 1024, 1, 1023]
    - [111, 0]
  - - [4095, 4096, 1, 4096]
    - [111, 0]
  - - [64, 1024, 1, 1023]
    - [116, 0]
  - - [2048, 512, 1, 2049]
    - [112, 0]
  - - [1023, 1024, 1, 1024]
    - [112, 0]
  - - [1920, 2048, 1, 2049]
    - [115, 0]
  - - [512, 512, 1, 512]
    - [124, 0]
  - - [512, 1024, 1, 1024]
    - [124, 0]
  - - [512, 2048, 1, 2048]
    - [124, 0]
  - - [512, 3072, 1, 3072]
    - [124, 0]
  - - [512, 4096, 1, 4096]
    - [124, 0]
  - - [512, 8192, 1, 8192]
    - [124, 0]
  - - [960, 1024, 1, 1024]
    - [124, 0]
  - - [1024, 1024, 1, 1024]
    - [124, 0]
  - - [1920, 2048, 1, 2048]
    - [124, 0]
  - - [2048, 2048, 1, 2048]
    - [124, 0]
  - - [2880, 3072, 1, 3072]
    - [124, 0]
  - - [3072, 512, 1, 3072]
    - [124, 0]
  - - [3072, 3072, 1, 3072]
    - [124, 0]
  - - [3840, 4096, 1, 4096]
    - [124, 0]
  - - [4096, 512, 1, 4096]
    - [124, 0]
  - - [4096, 4096, 1, 4096]
    - [124, 0]
  - - [7680, 8192, 1, 8192]
    - [124, 0]
  - - [8192, 512, 1, 8192]
    - [124, 0]
  - - [8192, 8192, 1, 8192]
    - [124, 0]
  - - [479, 512, 1, 512]
    - [127, 0]
  - - [479, 1024, 1, 1024]
    - [126, 0]
  - - [479, 2048, 1, 2048]
    - [126, 0]
  - - [480, 511, 1, 512]
    - [127, 0]
  - - [480, 512, 1, 511]
    - [127, 0]
  - - [480, 512, 1, 513]
    - [127, 0]
  - - [480, 513, 1, 512]
    - [127, 0]
  - - [480, 1023, 1, 1024]
    - [126, 0]
  - - [480, 1024, 1, 1023]
    - [126, 0]
  - - [480, 1024, 1, 1025]
    - [126, 0]
  - - [480, 1025, 1, 1024]
    - [125, 0]
  - - [480, 2047, 1, 2048]
    - [126, 0]
  - - [480, 2048, 1, 2047]
    - [126, 0]
  - - [480, 2048, 1, 2049]
    - [126, 0]
  - - [480, 2049, 1, 2048]
    - [126, 0]
  - - [481, 512, 1, 512]
    - [127, 0]
  - - [481, 1024, 1, 1024]
    - [125, 0]
  - - [481, 2048, 1, 2048]
    - [126, 0]
  - - [511, 480, 1, 512]
    - [127, 0]
  - - [512, 479, 1, 512]
    - [127, 0]
  - - [512, 480, 1, 511]
    - [127, 0]
  - - [512, 480, 1, 513]
    - [127, 0]
  - - [512, 481, 1, 512]
    - [127, 0]
  - - [513, 480, 1, 512]
    - [127, 0]
  - - [1023, 480, 1, 1024]
    - [127, 0]
  - - [1024, 479, 1, 1024]
    - [127, 0]
  - - [1024, 480, 1, 1023]
    - [127, 0]
  - - [1024, 480, 1, 1025]
    - [127, 0]
  - - [1024, 481, 1, 1024]
    - [125, 0]
  - - [1025, 480, 1, 1024]
    - [125, 0]
  - - [2047, 480, 1, 2048]
    - [128, 0]
  - - [2048, 479, 1, 2048]
    - [128, 0]
  - - [2048, 480, 1, 2047]
    - [128, 0]
  - - [2048, 480, 1, 2049]
    - [128, 0]
  - - [2048, 481, 1, 2048]
    - [126, 0]
  - - [2049, 480, 1, 2048]
    - [126, 0]
  - - [480, 512, 1, 512]
    - [129, 0]
  - - [480, 1024, 1, 1024]
    - [129, 0]
  - - [480, 2048, 1, 2048]
    - [129, 0]
  - - [512, 480, 1, 512]
    - [130, 0]
  - - [1024, 480, 1, 1024]
    - [130, 0]
  - - [2048, 480, 1, 2048]
    - [130, 0]
  - - [480, 3072, 1, 3072]
    - [131, 0]
  - - [480, 4096, 1, 4096]
    - [133, 0]
  - - [480, 8192, 1, 8192]
    - [132, 0]
  - - [3072, 480, 1, 3072]
    - [134, 0]
  - - [4096, 480, 1, 4096]
    - [134, 0]
  - - [8192, 480, 1, 8192]
    - [135, 0]
  - - [256, 44505, 1, 1024]
    - [145, 0]
  - - [10240, 8976, 1, 256]
    - [173, 0]
  - - [512, 1600, 1, 512]
    - [175, 0]
  - - [1024, 10200, 1, 4096]
    - [141, 0]
  - - [2, 32, 1, 1024]
    - [151, 0]
  - - [17, 15, 7680, 64]
    - [150, 0]
  - - [17, 17, 1, 64]
    - [146, 0]
  - - [42720, 6528, 1, 1024]
    - [165, 0]
  - - [256, 19200, 1, 1024]
    - [145, 0]
  - - [1024, 512, 1, 1024]
    - [169, 0]
  - - [5632, 8976, 1, 256]
    - [155, 0]
  - - [24, 24, 1, 64]
    - [164, 0]
  - - [256, 14848, 1, 1024]
    - [176, 0]
  - - [3840, 8976, 1, 256]
    - [155, 0]
  - - [27, 33, 1920, 64]
    - [172, 0]
  - - [64, 960, 1, 1024]
    - [163, 0]
  - - [4096, 3968, 1, 1024]
    - [145, 0]
  - - [1024, 6528, 1, 4096]
    - [141, 0]
  - - [1024, 1600, 1, 1024]
    - [145, 0]
  - - [1024, 2048, 1, 4096]
    - [156, 0]
  - - [30, 31, 2048, 64]
    - [172, 0]
  - - [5376, 8976, 1, 256]
    - [165, 0]
  - - [256, 5888, 1, 1024]
    - [137, 0]
  - - [64, 128, 512, 128]
    - [160, 0]
  - - [1024, 9216, 1, 1024]
    - [161, 0]
  - - [1024, 8160, 1, 4096]
    - [168, 0]
  - - [30, 31, 1, 64]
    - [164, 0]
  - - [2, 4, 1, 1024]
    - [151, 0]
  - - [32, 32, 1, 64]
    - [154, 0]
  - - [256, 7424, 1, 1024]
    - [139, 0]
  - - [32, 35, 1, 64]
    - [169, 0]
  - - [8192, 8976, 1, 256]
    - [176, 0]
  - - [128, 32768, 1, 256]
    - [155, 0]
  - - [256, 2560, 1, 1024]
    - [162, 0]
  - - [256, 21504, 1, 1024]
    - [145, 0]
  - - [2048, 512, 1, 100]
    - [174, 0]
  - - [6400, 8976, 1, 256]
    - [165, 0]
  - - [31, 31, 1, 64]
    - [157, 0]
  - - [256, 8960, 1, 1024]
    - [156, 0]
  - - [34, 34, 1, 64]
    - [152, 0]
  - - [5, 5, 960, 64]
    - [172, 0]
  - - [11776, 8976, 1, 256]
    - [165, 0]
  - - [256, 20992, 1, 1024]
    - [145, 0]
  - - [15, 15, 10880, 64]
    - [150, 0]
  - - [256, 684, 1, 1024]
    - [171, 0]
  - - [1024, 200, 1, 560]
    - [169, 0]
  - - [256, 10496, 1, 1024]
    - [159, 0]
  - - [21248, 8976, 1, 256]
    - [165, 0]
  - - [15360, 8976, 1, 256]
    - [155, 0]
  - - [4096, 10080, 1, 1024]
    - [145, 0]
  - - [256, 8192, 1, 1024]
    - [177, 0]
  - - [4096, 8976, 1, 256]
    - [176, 0]
  - - [2048, 512, 1, 2048]
    - [161, 0]
  - - [1024, 8064, 1, 4096]
    - [137, 0]
  - - [18944, 8976, 1, 256]
    - [165, 0]
  - - [8448, 8976, 1, 256]
    - [165, 0]
  - - [256, 11776, 1, 1024]
    - [145, 0]
  - - [31488, 8976, 1, 256]
    - [165, 0]
  - - [1024, 4096, 1, 1024]
    - [175, 0]
  - - [30, 30, 1, 64]
    - [150, 0]
  - - [64, 512, 1, 512]
    - [169, 0]
  - - [4096, 3840, 1, 1024]
    - [145, 0]
  - - [64, 512, 1, 1024]
    - [167, 0]
  - - [12544, 8976, 1, 256]
    - [165, 0]
  - - [1024, 3240, 1, 1024]
    - [161, 0]
  - - [256, 23296, 1, 1024]
    - [145, 0]
  - - [17, 15, 1, 64]
    - [175, 0]
  - - [35, 35, 1, 64]
    - [164, 0]
  - - [27, 27, 32768, 128]
    - [150, 0]
  - - [256, 18944, 1, 1024]
    - [145, 0]
  - - [1024, 3968, 1, 4096]
    - [159, 0]
  - - [16128, 8976, 1, 256]
    - [165, 0]
  - - [1024, 7104, 1, 1024]
    - [145, 0]
  - - [512, 512, 64, 64]
    - [155, 0]
  - - [1024, 7200, 1, 1024]
    - [161, 0]
  - - [256, 2816, 1, 1024]
    - [159, 0]
  - - [21, 17, 1, 64]
    - [150, 0]
  - - [1024, 10080, 1, 4096]
    - [141, 0]
  - - [256, 6144, 1, 1024]
    - [137, 0]
  - - [21, 21, 1, 64]
    - [146, 0]
  - - [9472, 8976, 1, 256]
    - [165, 0]
  - - [2048, 215, 1, 768]
    - [169, 0]
  - - [1024, 32768, 1, 1024]
    - [161, 0]
  - - [1024, 4, 1, 1024]
    - [171, 0]
  - - [684, 8976, 1, 256]
    - [148, 0]
  - - [3, 3, 512, 64]
    - [172, 0]
  - - [30528, 2048, 1, 1024]
    - [165, 0]
  - - [256, 1536, 1, 1024]
    - [169, 0]
  - - [2048, 684, 1, 768]
    - [145, 0]
  - - [8960, 8976, 1, 256]
    - [165, 0]
  - - [1024, 7104, 1, 4096]
    - [141, 0]
  - - [256, 11520, 1, 1024]
    - [145, 0]
  - - [33536, 8976, 1, 256]
    - [160, 0]
  - - [1024, 3840, 1, 1024]
    - [166, 0]
  - - [4096, 7104, 1, 1024]
    - [145, 0]
  - - [5, 5, 512, 64]
    - [150, 0]
  - - [28672, 8976, 1, 256]
    - [149, 0]
  - - [256, 1280, 1, 1024]
    - [167, 0]
  - - [256, 7168, 1, 1024]
    - [139, 0]
  - - [1024, 3840, 1, 4096]
    - [142, 0]
  - - [256, 13312, 1, 1024]
    - [145, 0]
  - - [2304, 8976, 1, 256]
    - [155, 0]
  - - [2048, 512, 1, 67]
    - [157, 0]
  - - [4096, 2048, 1, 1024]
    - [145, 0]
  - - [15, 14, 1, 64]
    - [146, 0]
  - - [1024, 960, 1, 1600]
    - [173, 0]
  - - [4096, 7200, 1, 1024]
    - [145, 0]
  - - [1024, 7200, 1, 4096]
    - [141, 0]
  - - [4096, 9520, 1, 1024]
    - [145, 0]
  - - [42720, 10080, 1, 1024]
    - [160, 0]
  - - [9984, 8976, 1, 256]
    - [160, 0]
  - - [1024, 10200, 1, 1024]
    - [145, 0]
  - - [256, 14592, 1, 1024]
    - [176, 0]
  - - [11264, 8976, 1, 256]
    - [155, 0]
  - - [1024, 32768, 1, 480]
    - [155, 0]
  - - [2048, 114, 1, 512]
    - [169, 0]
  - - [256, 7936, 1, 1024]
    - [143, 0]
  - - [2048, 256, 1, 768]
    - [169, 0]
  - - [15104, 8976, 1, 256]
    - [165, 0]
  - - [4096, 4096, 1, 1024]
    - [145, 0]
  - - [2048, 512, 1, 74]
    - [172, 0]
  - - [14, 14, 10880, 64]
    - [150, 0]
  - - [42720, 7104, 1, 1024]
    - [155, 0]
  - - [256, 23552, 1, 1024]
    - [145, 0]
  - - [1024, 1600, 1, 560]
    - [158, 0]
  - - [2048, 1536, 1, 512]
    - [145, 0]
  - - [14, 14, 1, 64]
    - [144, 0]
  - - [1024, 8064, 1, 1024]
    - [161, 0]
  - - [13824, 8976, 1, 256]
    - [165, 0]
  - - [1024, 9520, 1, 1024]
    - [170, 0]
  - - [4096, 10064, 1, 1024]
    - [145, 0]
  - - [256, 6656, 1, 1024]
    - [137, 0]
  - - [2048, 215, 1, 512]
    - [169, 0]
  - - [2560, 8976, 1, 256]
    - [155, 0]
  - - [4096, 10200, 1, 1024]
    - [145, 0]
  - - [17, 17, 7680, 64]
    - [150, 0]
  - - [1024, 960, 1, 1024]
    - [156, 0]
  - - [32, 1600, 1, 512]
    - [169, 0]
  - - [13568, 8976, 1, 256]
    - [165, 0]
  - - [4096, 8064, 1, 1024]
    - [145, 0]
  - - [4608, 8976, 1, 256]
    - [165, 0]
  - - [256, 22016, 1, 1024]
    - [139, 0]
  - - [42720, 3968, 1, 1024]
    - [165, 0]
  - - [2048, 960, 1, 74]
    - [170, 0]
  - - [4864, 8976, 1, 256]
    - [165, 0]
  - - [256, 21248, 1, 1024]
    - [145, 0]
  - - [1024, 6528, 1, 1024]
    - [170, 0]
  - - [23552, 8976, 1, 256]
    - [155, 0]
  - - [256, 12544, 1, 1024]
    - [145, 0]
  - - [42720, 7200, 1, 1024]
    - [165, 0]
  - - [9, 9, 512, 64]
    - [164, 0]
  - - [256, 33536, 1, 1024]
    - [145, 0]
  - - [1792, 8976, 1, 256]
    - [173, 0]
  - - [4096, 8160, 1, 1024]
    - [145, 0]
  - - [4096, 9216, 1, 1024]
    - [145, 0]
  - - [19968, 8976, 1, 256]
    - [165, 0]
  - - [33, 33, 1600, 32]
    - [172, 0]
  - - [5888, 8976, 1, 256]
    - [165, 0]
  - - [256, 2304, 1, 1024]
    - [156, 0]
  - - [33, 33, 1920, 64]
    - [150, 0]
  - - [7168, 8976, 1, 256]
    - [155, 0]
  - - [1024, 32, 1, 1024]
    - [167, 0]
  - - [2, 2048, 1, 1024]
    - [171, 0]
  - - [4096, 3960, 1, 1024]
    - [145, 0]
  - - [512, 32768, 1, 13]
    - [153, 0]
  - - [19712, 8976, 1, 256]
    - [165, 0]
  - - [1024, 2048, 1, 1024]
    - [169, 0]
  - - [64, 512, 64, 512]
    - [160, 0]
  - - [2048, 8976, 1, 256]
    - [170, 0]
  - - [256, 3584, 1, 1024]
    - [143, 0]
  - - [18688, 8976, 1, 256]
    - [165, 0]
  - - [512, 512, 1, 64]
    - [157, 0]
  - - [256, 5376, 1, 1024]
    - [137, 0]
  - - [30, 30, 2048, 64]
    - [150, 0]
  - - [6144, 8976, 1, 256]
    - [155, 0]
  - - [30528, 4096, 1, 1024]
    - [165, 0]
  - - [256, 11264, 1, 1024]
    - [145, 0]
  - - [4096, 3240, 1, 1024]
    - [145, 0]
  - - [4352, 8976, 1, 256]
    - [160, 0]
  - - [15, 15, 1, 64]
    - [146, 0]
  - - [256, 15104, 1, 1024]
    - [176, 0]
  - - [256, 31488, 1, 1024]
    - [145, 0]
  - - [1024, 3968, 1, 1024]
    - [169, 0]
  - - [9728, 8976, 1, 256]
    - [160, 0]
  - - [256, 9984, 1, 1024]
    - [156, 0]
  - - [7936, 8976, 1, 256]
    - [165, 0]
  - - [2048, 960, 1, 2048]
    - [170, 0]
  - - [5120, 8976, 1, 256]
    - [155, 0]
  - - [27, 27, 1920, 64]
    - [172, 0]
  - - [4096, 6528, 1, 1024]
    - [145, 0]
  - - [13312, 8976, 1, 256]
    - [155, 0]
  - - [1024, 10080, 1, 1024]
    - [145, 0]
  - - [256, 14336, 1, 1024]
    - [145, 0]
  - - [1280, 8976, 1, 256]
    - [155, 0]
  - - [256, 22344, 1, 1024]
    - [145, 0]
  - - [256, 18176, 1, 1024]
    - [145, 0]
  - - [1024, 9520, 1, 4096]
    - [137, 0]
  - - [512, 32768, 1, 1024]
    - [161, 0]
  - - [128, 128, 512, 64]
    - [147, 0]
  - - [20992, 8976, 1, 256]
    - [165, 0]
  - - [42720, 3960, 1, 1024]
    - [165, 0]
  - - [1024, 10064, 1, 1024]
    - [145, 0]
  - - [2048, 684, 1, 512]
    - [166, 0]
  - - [31, 31, 2048, 64]
    - [150, 0]
  - - [17152, 8976, 1, 256]
    - [165, 0]
  - - [256, 3328, 1, 1024]
    - [159, 0]
  - - [34, 24, 1, 64]
    - [138, 0]
  - - [20480, 8976, 1, 256]
    - [149, 0]
  - - [2048, 256, 1, 512]
    - [169, 0]
  - - [2048, 1536, 1, 768]
    - [145, 0]
  - - [10496, 8976, 1, 256]
    - [160, 0]
  - - [3328, 8976, 1, 256]
    - [155, 0]
  - - [1024, 3240, 1, 4096]
    - [136, 0]
  - - [256, 4864, 1, 1024]
    - [139, 0]
  - - [1024, 9216, 1, 4096]
    - [168, 0]
  - - [15872, 8976, 1, 256]
    - [165, 0]
  - - [15, 14, 10880, 64]
    - [150, 0]
  - - [1024, 8160, 1, 1024]
    - [170, 0]
  - - [256, 32768, 1, 512]
    - [145, 0]
  - - [15, 15, 7680, 64]
    - [150, 0]
  - - [18176, 8976, 1, 256]
    - [160, 0]
  - - [1024, 512, 1, 1600]
    - [169, 0]
  - - [256, 6400, 1, 1024]
    - [139, 0]
  - - [3072, 8976, 1, 256]
    - [155, 0]
  - - [256, 20480, 1, 1024]
    - [145, 0]
  - - [44505, 8976, 1, 256]
    - [165, 0]
  - - [2048, 114, 1, 768]
    - [171, 0]
  - - [256, 16128, 1, 1024]
    - [145, 0]
  - - [256, 4608, 1, 1024]
    - [145, 0]
  - - [1024, 4, 1, 1024]
    - [171, 0]
  - - [1024, 4096, 1, 4096]
    - [156, 0]
  - - [256, 8448, 1, 1024]
    - [140, 0]
  - - [1024, 3960, 1, 4096]
    - [159, 0]
  - - [42720, 9520, 1, 1024]
    - [160, 0]
  - - [1024, 10064, 1, 4096]
    - [141, 0]
  - - [2816, 8976, 1, 256]
    - [155, 0]
  - - [1024, 3960, 1, 1024]
    - [175, 0]
- null
