library/src/blas3/Tensile/Logic/asm_full/arcturus_Cijk_Alik_Bjlk_HB.yaml
- {MinimumRequiredVersion: 4.6.0}
- arcturus
- gfx908
- [Device 7380, Device 7388, Device 738c, Device 7390]
    SolutionIndex: 0
    SolutionNameMin: Cijk_Alik_Bjlk_HB_MT016x128x08_GRVW04_NLCA01_TT04_04_USFGRO0_VW04_WG04_32_01
    SolutionIndex: 1
    SolutionNameMin: Cijk_Alik_Bjlk_HB_MT016x064x08_GRVW02_NLCA01_TT02_04_USFGRO0_VW02_WG08_16_01
    SolutionIndex: 2
    SolutionNameMin: Cijk_Alik_Bjlk_HB_MT032x064x08_GRVW04_NLCA01_TT04_04_USFGRO0_VW04_WG08_16_01
    SolutionIndex: 3
    SolutionNameMin: Cijk_Alik_Bjlk_HB_MT032x128x08_GRVW04_NLCA01_TT04_04_USFGRO0_VW04_WG08_32_01
    SolutionIndex: 4
    SolutionNameMin: Cijk_Alik_Bjlk_HB_MT032x064x08_GRVW02_NLCA01_TT02_04_USFGRO0_VW02_WG16_16_01
    SolutionIndex: 5
    SolutionNameMin: Cijk_Alik_Bjlk_HB_MT064x128x08_GRVW04_NLCA01_TT04_08_USFGRO0_VW04_WG16_16_01
    SolutionIndex: 6
    SolutionNameMin: Cijk_Alik_Bjlk_HB_MT016x128x08_GRVW04_NLCA01_TT04_04_USFGRO0_VW04_WG04_32_01
    SolutionIndex: 7
    SolutionNameMin: Cijk_Alik_Bjlk_HB_MT032x032x08_GRVW04_NLCA01_TT04_04_USFGRO0_VW04_WG08_08_01
    SolutionIndex: 8
    SolutionNameMin: Cijk_Alik_Bjlk_HB_MT016x064x08_GRVW02_NLCA01_TT02_04_USFGRO0_VW02_WG08_16_01
    SolutionIndex: 9
    SolutionNameMin: Cijk_Alik_Bjlk_HB_MT032x064x08_GRVW04_NLCA01_TT04_04_USFGRO0_VW04_WG08_16_01
    SolutionIndex: 10
    SolutionNameMin: Cijk_Alik_Bjlk_HB_MT032x128x08_GRVW04_NLCA01_TT04_04_USFGRO0_VW04_WG08_32_01
    SolutionIndex: 11
    SolutionNameMin: Cijk_Alik_Bjlk_HB_MT064x128x08_GRVW04_NLCA01_TT04_08_USFGRO0_VW04_WG16_16_01
    SolutionIndex: 12
    SolutionNameMin: Cijk_Alik_Bjlk_HB_MT008x064x16_GRVW02_NLCA01_TT02_02_USFGRO0_VW02_WG04_32_01
    SolutionIndex: 13
    SolutionNameMin: Cijk_Alik_Bjlk_HB_MT016x128x16_GRVW04_NLCA01_TT04_04_USFGRO0_VW04_WG04_32_01
    SolutionIndex: 14
    SolutionNameMin: Cijk_Alik_Bjlk_HB_MT016x016x16_GRVW02_NLCA01_TT02_02_USFGRO0_VW02_WG08_08_01
    SolutionIndex: 15
    SolutionNameMin: Cijk_Alik_Bjlk_HB_MT032x032x16_GRVW04_NLCA01_TT04_04_USFGRO0_VW04_WG08_08_01
    SolutionIndex: 16
    SolutionNameMin: Cijk_Alik_Bjlk_HB_MT032x064x16_GRVW04_NLCA01_TT04_08_USFGRO0_VW04_WG08_08_01
    SolutionIndex: 17
    SolutionNameMin: Cijk_Alik_Bjlk_HB_MT064x064x16_GRVW08_NLCA01_TT08_08_USFGRO0_VW08_WG08_08_01
    SolutionIndex: 18
    SolutionNameMin: Cijk_Alik_Bjlk_HB_MT016x032x16_GRVW02_NLCA01_TT02_02_USFGRO0_VW02_WG08_16_01
    SolutionIndex: 19
    SolutionNameMin: Cijk_Alik_Bjlk_HB_MT016x064x16_GRVW02_NLCA01_TT02_04_USFGRO0_VW02_WG08_16_01
    SolutionIndex: 20
    SolutionNameMin: Cijk_Alik_Bjlk_HB_MT032x064x16_GRVW04_NLCA01_TT04_04_USFGRO0_VW04_WG08_16_01
    SolutionIndex: 21
    SolutionNameMin: Cijk_Alik_Bjlk_HB_MT016x064x16_GRVW02_NLCA01_TT02_02_USFGRO0_VW02_WG08_32_01
    SolutionIndex: 22
    SolutionNameMin: Cijk_Alik_Bjlk_HB_MT016x128x16_GRVW02_NLCA01_TT02_04_USFGRO0_VW02_WG08_32_01
    SolutionIndex: 23
    SolutionNameMin: Cijk_Alik_Bjlk_HB_MT032x032x16_GRVW02_NLCA01_TT02_02_USFGRO0_VW02_WG16_16_01
    SolutionIndex: 24
    SolutionNameMin: Cijk_Alik_Bjlk_HB_MT064x064x16_GRVW04_NLCA01_TT04_04_USFGRO0_VW04_WG16_16_01
    SolutionIndex: 25
    SolutionNameMin: Cijk_Alik_Bjlk_HB_MT064x128x16_GRVW04_NLCA01_TT04_08_USFGRO0_VW04_WG16_16_01
    SolutionIndex: 26
    SolutionNameMin: Cijk_Alik_Bjlk_HB_MT128x128x16_GRVW08_NLCA01_TT08_08_USFGRO0_VW08_WG16_16_01
    SolutionIndex: 27
    SolutionNameMin: Cijk_Alik_Bjlk_HB_MT032x032x16_GRVW04_NLCA01_TT04_04_USFGRO0_VW04_WG08_08_01
    SolutionIndex: 28
    SolutionNameMin: Cijk_Alik_Bjlk_HB_MT032x064x16_GRVW04_NLCA01_TT04_08_USFGRO0_VW04_WG08_08_01
    SolutionIndex: 29
    SolutionNameMin: Cijk_Alik_Bjlk_HB_MT064x064x16_GRVW08_NLCA01_TT08_08_USFGRO0_VW08_WG08_08_01
    SolutionIndex: 30
    SolutionNameMin: Cijk_Alik_Bjlk_HB_MT016x032x16_GRVW02_NLCA01_TT02_02_USFGRO0_VW02_WG08_16_01
    SolutionIndex: 31
    SolutionNameMin: Cijk_Alik_Bjlk_HB_MT016x064x16_GRVW02_NLCA01_TT02_04_USFGRO0_VW02_WG08_16_01
    SolutionIndex: 32
    SolutionNameMin: Cijk_Alik_Bjlk_HB_MT032x064x16_GRVW04_NLCA01_TT04_04_USFGRO0_VW04_WG08_16_01
    SolutionIndex: 33
    SolutionNameMin: Cijk_Alik_Bjlk_HB_MT016x064x16_GRVW02_NLCA01_TT02_02_USFGRO0_VW02_WG08_32_01
    SolutionIndex: 34
    SolutionNameMin: Cijk_Alik_Bjlk_HB_MT064x064x16_GRVW04_NLCA01_TT04_04_USFGRO0_VW04_WG16_16_01
    SolutionIndex: 35
    SolutionNameMin: Cijk_Alik_Bjlk_HB_MT064x128x16_GRVW04_NLCA01_TT04_08_USFGRO0_VW04_WG16_16_01
    SolutionIndex: 36
    SolutionNameMin: Cijk_Alik_Bjlk_HB_MT128x128x16_GRVW08_NLCA01_TT08_08_USFGRO0_VW08_WG16_16_01
    SolutionIndex: 37
    SolutionNameMin: Cijk_Alik_Bjlk_HB_MT016x016x24_GRVW02_NLCA03_TT02_02_USFGRO0_VW02_WG08_08_01
    SolutionIndex: 38
    SolutionNameMin: Cijk_Alik_Bjlk_HB_MT032x032x24_GRVW04_NLCA03_TT04_04_USFGRO0_VW04_WG08_08_01
    SolutionIndex: 39
    SolutionNameMin: Cijk_Alik_Bjlk_HB_MT016x016x24_GRVW02_NLCA03_TT02_02_USFGRO0_VW02_WG08_08_01
    SolutionIndex: 40
    SolutionNameMin: Cijk_Alik_Bjlk_HB_MT032x032x24_GRVW04_NLCA03_TT04_04_USFGRO0_VW04_WG08_08_01
    SolutionIndex: 41
    SolutionNameMin: Cijk_Alik_Bjlk_HB_MT008x064x32_GRVW02_NLCA01_TT02_02_USFGRO0_VW02_WG04_32_01
    SolutionIndex: 42
    SolutionNameMin: Cijk_Alik_Bjlk_HB_MT016x016x32_GRVW02_NLCA01_TT02_02_USFGRO0_VW02_WG08_08_01
    SolutionIndex: 43
    SolutionNameMin: Cijk_Alik_Bjlk_HB_MT016x064x32_GRVW02_NLCA01_TT02_02_USFGRO0_VW02_WG08_32_01
    SolutionIndex: 44
    SolutionNameMin: Cijk_Alik_Bjlk_HB_MT008x064x32_GRVW02_NLCA01_TT02_02_USFGRO0_VW02_WG04_32_01
    SolutionIndex: 45
    SolutionNameMin: Cijk_Alik_Bjlk_HB_MT016x064x32_GRVW02_NLCA01_TT02_02_USFGRO0_VW02_WG08_32_01
    SolutionIndex: 46
    SolutionNameMin: Cijk_Alik_Bjlk_HB_MT064x128x32_GRVW04_NLCA01_TT04_08_USFGRO0_VW04_WG16_16_01
    SolutionIndex: 47
    SolutionNameMin: Cijk_Alik_Bjlk_HB_MT008x064x64_GRVW02_NLCA01_TT02_02_USFGRO0_VW02_WG04_32_01
    SolutionIndex: 48
    SolutionNameMin: Cijk_Alik_Bjlk_HB_MT064x064x16_GRVW08_NLCA01_TT08_08_USFGRO0_VW08_WG08_08_01
    SolutionIndex: 49
    SolutionNameMin: Cijk_Alik_Bjlk_HB_MT128x064x16_GRVW04_NLCA01_TT08_04_USFGRO0_VW04_WG16_16_01
    SolutionIndex: 50
    SolutionNameMin: Cijk_Alik_Bjlk_HB_MT064x064x16_GRVW08_NLCA01_TT08_08_USFGRO0_VW08_WG08_08_01
    SolutionIndex: 51
    SolutionNameMin: Cijk_Alik_Bjlk_HB_MT128x064x16_GRVW04_NLCA01_TT08_04_USFGRO0_VW04_WG16_16_01
- - - [1024, 1024, 1, 3328]
    - [25, 0.0]
  - - [64, 6784, 1, 256]
    - [2, 0.0]
  - - [2944, 4288, 1, 1280]
    - [11, 0.0]
  - - [2368, 64, 1, 3328]
    - [30, 0.0]
  - - [2368, 5888, 1, 256]
    - [5, 0.0]
  - - [1024, 5056, 1, 3328]
    - [36, 0.0]
  - - [5888, 1024, 1, 1280]
    - [36, 0.0]
  - - [128, 6784, 1, 3328]
    - [25, 0.0]
  - - [5888, 1856, 1, 3328]
    - [5, 0.0]
  - - [5056, 704, 1, 256]
    - [51, 0.0]
  - - [5888, 2944, 1, 3328]
    - [26, 0.0]
  - - [1856, 4288, 1, 256]
    - [36, 0.0]
  - - [5056, 5056, 1, 3328]
    - [26, 0.0]
  - - [1408, 5888, 1, 1280]
    - [26, 0.0]
  - - [448, 3584, 1, 3328]
    - [25, 0.0]
  - - [256, 4288, 1, 3328]
    - [24, 0.0]
  - - [5888, 1408, 1, 1280]
    - [26, 0.0]
  - - [704, 1856, 1, 3328]
    - [24, 0.0]
  - - [3584, 1856, 1, 3328]
    - [26, 0.0]
  - - [5056, 6784, 1, 1280]
    - [48, 0.0]
  - - [1408, 64, 1, 1280]
    - [18, 0.0]
  - - [704, 64, 1, 3328]
    - [45, 0.0]
  - - [448, 1024, 1, 1280]
    - [24, 0.0]
  - - [5056, 5056, 1, 1280]
    - [36, 0.0]
  - - [448, 5056, 1, 256]
    - [11, 0.0]
  - - [6784, 448, 1, 256]
    - [49, 0.0]
  - - [2368, 128, 1, 256]
    - [1, 0.0]
  - - [5888, 704, 1, 1280]
    - [48, 0.0]
  - - [3584, 1024, 1, 256]
    - [25, 0.0]
  - - [6784, 4288, 1, 3328]
    - [5, 0.0]
  - - [1856, 2368, 1, 3328]
    - [5, 0.0]
  - - [5888, 2944, 1, 1280]
    - [5, 0.0]
  - - [5888, 1024, 1, 256]
    - [26, 0.0]
  - - [448, 64, 1, 1280]
    - [41, 0.0]
  - - [2944, 64, 1, 256]
    - [21, 0.0]
  - - [1408, 2944, 1, 256]
    - [26, 0.0]
  - - [256, 1856, 1, 1280]
    - [24, 0.0]
  - - [6784, 5056, 1, 3328]
    - [11, 0.0]
  - - [5056, 5056, 1, 256]
    - [26, 0.0]
  - - [448, 704, 1, 1280]
    - [15, 0.0]
  - - [64, 1024, 1, 1280]
    - [37, 0.0]
  - - [1024, 3584, 1, 1280]
    - [35, 0.0]
  - - [2368, 2944, 1, 1280]
    - [26, 0.0]
  - - [128, 3584, 1, 1280]
    - [0, 0.0]
  - - [1024, 256, 1, 3328]
    - [38, 0.0]
  - - [1408, 4288, 1, 1280]
    - [26, 0.0]
  - - [3584, 4288, 1, 1280]
    - [26, 0.0]
  - - [2368, 704, 1, 1280]
    - [5, 0.0]
  - - [5056, 4288, 1, 3328]
    - [5, 0.0]
  - - [3584, 2368, 1, 3328]
    - [5, 0.0]
  - - [64, 704, 1, 1280]
    - [37, 0.0]
  - - [4288, 256, 1, 256]
    - [34, 0.0]
  - - [6784, 448, 1, 1280]
    - [51, 0.0]
  - - [1024, 1408, 1, 3328]
    - [25, 0.0]
  - - [4288, 2944, 1, 256]
    - [5, 0.0]
  - - [1856, 64, 1, 1280]
    - [21, 0.0]
  - - [5888, 64, 1, 3328]
    - [20, 0.0]
  - - [2944, 256, 1, 3328]
    - [24, 0.0]
  - - [5056, 2368, 1, 1280]
    - [36, 0.0]
  - - [448, 3584, 1, 1280]
    - [5, 0.0]
  - - [6784, 5888, 1, 256]
    - [5, 0.0]
  - - [256, 4288, 1, 1280]
    - [24, 0.0]
  - - [704, 128, 1, 1280]
    - [18, 0.0]
  - - [1408, 448, 1, 1280]
    - [24, 0.0]
  - - [1024, 1408, 1, 256]
    - [11, 0.0]
  - - [2368, 2368, 1, 3328]
    - [5, 0.0]
  - - [5056, 704, 1, 3328]
    - [51, 0.0]
  - - [1408, 1856, 1, 256]
    - [49, 0.0]
  - - [5888, 1856, 1, 256]
    - [26, 0.0]
  - - [4288, 64, 1, 3328]
    - [20, 0.0]
  - - [704, 5888, 1, 256]
    - [25, 0.0]
  - - [6784, 128, 1, 1280]
    - [6, 0.0]
  - - [4288, 6784, 1, 3328]
    - [26, 0.0]
  - - [3584, 704, 1, 3328]
    - [51, 0.0]
  - - [1408, 1408, 1, 256]
    - [5, 0.0]
  - - [1856, 128, 1, 256]
    - [19, 0.0]
  - - [2944, 64, 1, 1280]
    - [19, 0.0]
  - - [448, 4288, 1, 256]
    - [11, 0.0]
  - - [64, 3584, 1, 3328]
    - [38, 0.0]
  - - [704, 2368, 1, 1280]
    - [25, 0.0]
  - - [1856, 2368, 1, 1280]
    - [5, 0.0]
  - - [2368, 128, 1, 3328]
    - [20, 0.0]
  - - [2944, 128, 1, 256]
    - [10, 0.0]
  - - [448, 1408, 1, 256]
    - [24, 0.0]
  - - [64, 5056, 1, 3328]
    - [1, 0.0]
  - - [1408, 1024, 1, 1280]
    - [5, 0.0]
  - - [2368, 256, 1, 1280]
    - [24, 0.0]
  - - [6784, 704, 1, 256]
    - [25, 0.0]
  - - [256, 3584, 1, 3328]
    - [25, 0.0]
  - - [1408, 3584, 1, 256]
    - [36, 0.0]
  - - [3584, 4288, 1, 3328]
    - [36, 0.0]
  - - [5888, 1856, 1, 1280]
    - [36, 0.0]
  - - [5056, 1024, 1, 3328]
    - [26, 0.0]
  - - [5056, 64, 1, 1280]
    - [19, 0.0]
  - - [1024, 704, 1, 256]
    - [34, 0.0]
  - - [128, 448, 1, 256]
    - [18, 0.0]
  - - [2368, 3584, 1, 1280]
    - [5, 0.0]
  - - [1024, 256, 1, 256]
    - [15, 0.0]
  - - [448, 448, 1, 256]
    - [1, 0.0]
  - - [2944, 3584, 1, 3328]
    - [5, 0.0]
  - - [256, 256, 1, 3328]
    - [37, 0.0]
  - - [128, 1024, 1, 3328]
    - [43, 0.0]
  - - [6784, 2944, 1, 256]
    - [5, 0.0]
  - - [64, 1856, 1, 1280]
    - [21, 0.0]
  - - [1024, 2368, 1, 256]
    - [11, 0.0]
  - - [4288, 2368, 1, 3328]
    - [5, 0.0]
  - - [1856, 2368, 1, 256]
    - [25, 0.0]
  - - [3584, 6784, 1, 3328]
    - [11, 0.0]
  - - [6784, 1856, 1, 3328]
    - [5, 0.0]
  - - [1024, 128, 1, 1280]
    - [21, 0.0]
  - - [4288, 128, 1, 1280]
    - [0, 0.0]
  - - [5056, 4288, 1, 1280]
    - [5, 0.0]
  - - [5888, 64, 1, 256]
    - [20, 0.0]
  - - [1408, 5056, 1, 1280]
    - [36, 0.0]
  - - [1856, 256, 1, 1280]
    - [34, 0.0]
  - - [64, 5888, 1, 3328]
    - [20, 0.0]
  - - [6784, 5888, 1, 3328]
    - [25, 0.0]
  - - [448, 256, 1, 3328]
    - [43, 0.0]
  - - [2368, 5056, 1, 1280]
    - [26, 0.0]
  - - [256, 1408, 1, 3328]
    - [40, 0.0]
  - - [6784, 128, 1, 3328]
    - [25, 0.0]
  - - [1024, 5056, 1, 1280]
    - [36, 0.0]
  - - [4288, 1024, 1, 256]
    - [25, 0.0]
  - - [2368, 1408, 1, 256]
    - [25, 0.0]
  - - [704, 704, 1, 3328]
    - [24, 0.0]
  - - [5888, 448, 1, 1280]
    - [11, 0.0]
  - - [3584, 256, 1, 3328]
    - [25, 0.0]
  - - [704, 5888, 1, 3328]
    - [5, 0.0]
  - - [1024, 6784, 1, 1280]
    - [36, 0.0]
  - - [128, 3584, 1, 3328]
    - [3, 0.0]
  - - [128, 704, 1, 1280]
    - [30, 0.0]
  - - [3584, 2944, 1, 1280]
    - [5, 0.0]
  - - [1856, 128, 1, 3328]
    - [40, 0.0]
  - - [128, 2944, 1, 1280]
    - [20, 0.0]
  - - [2368, 1024, 1, 3328]
    - [11, 0.0]
  - - [448, 1856, 1, 1280]
    - [25, 0.0]
  - - [1408, 5056, 1, 3328]
    - [36, 0.0]
  - - [1856, 1856, 1, 3328]
    - [5, 0.0]
  - - [3584, 128, 1, 256]
    - [10, 0.0]
  - - [448, 1408, 1, 3328]
    - [24, 0.0]
  - - [2368, 2368, 1, 256]
    - [25, 0.0]
  - - [4288, 4288, 1, 1280]
    - [5, 0.0]
  - - [64, 448, 1, 1280]
    - [37, 0.0]
  - - [704, 6784, 1, 3328]
    - [26, 0.0]
  - - [5888, 5888, 1, 3328]
    - [5, 0.0]
  - - [5056, 1024, 1, 1280]
    - [36, 0.0]
  - - [448, 5888, 1, 3328]
    - [5, 0.0]
  - - [5056, 5888, 1, 1280]
    - [5, 0.0]
  - - [448, 6784, 1, 256]
    - [25, 0.0]
  - - [256, 3584, 1, 256]
    - [11, 0.0]
  - - [256, 2944, 1, 3328]
    - [24, 0.0]
  - - [256, 448, 1, 256]
    - [21, 0.0]
  - - [3584, 5888, 1, 256]
    - [26, 0.0]
  - - [2944, 3584, 1, 256]
    - [11, 0.0]
  - - [1408, 704, 1, 256]
    - [24, 0.0]
  - - [6784, 2944, 1, 3328]
    - [5, 0.0]
  - - [2944, 5056, 1, 3328]
    - [5, 0.0]
  - - [64, 64, 1, 3328]
    - [47, 0.0]
  - - [6784, 2368, 1, 1280]
    - [36, 0.0]
  - - [4288, 5888, 1, 1280]
    - [5, 0.0]
  - - [4288, 4288, 1, 256]
    - [11, 0.0]
  - - [448, 2944, 1, 3328]
    - [25, 0.0]
  - - [4288, 1856, 1, 1280]
    - [26, 0.0]
  - - [1856, 2944, 1, 3328]
    - [5, 0.0]
  - - [256, 6784, 1, 3328]
    - [25, 0.0]
  - - [64, 5888, 1, 256]
    - [9, 0.0]
  - - [5056, 1024, 1, 256]
    - [25, 0.0]
  - - [1408, 1408, 1, 1280]
    - [5, 0.0]
  - - [5056, 1856, 1, 3328]
    - [5, 0.0]
  - - [1856, 1408, 1, 256]
    - [11, 0.0]
  - - [448, 448, 1, 3328]
    - [40, 0.0]
  - - [448, 2368, 1, 1280]
    - [24, 0.0]
  - - [1408, 128, 1, 1280]
    - [19, 0.0]
  - - [5056, 256, 1, 3328]
    - [24, 0.0]
  - - [256, 64, 1, 1280]
    - [41, 0.0]
  - - [128, 1856, 1, 1280]
    - [22, 0.0]
  - - [5056, 3584, 1, 256]
    - [5, 0.0]
  - - [1856, 1024, 1, 1280]
    - [25, 0.0]
  - - [1856, 1856, 1, 1280]
    - [5, 0.0]
  - - [6784, 6784, 1, 1280]
    - [50, 0.0]
  - - [128, 4288, 1, 3328]
    - [13, 0.0]
  - - [1856, 1024, 1, 3328]
    - [35, 0.0]
  - - [256, 2368, 1, 256]
    - [24, 0.0]
  - - [1024, 448, 1, 3328]
    - [24, 0.0]
  - - [1856, 704, 1, 1280]
    - [24, 0.0]
  - - [6784, 1024, 1, 256]
    - [26, 0.0]
  - - [5056, 5888, 1, 3328]
    - [5, 0.0]
  - - [1856, 1024, 1, 256]
    - [11, 0.0]
  - - [5056, 1408, 1, 3328]
    - [26, 0.0]
  - - [1024, 1024, 1, 1280]
    - [25, 0.0]
  - - [4288, 1024, 1, 3328]
    - [5, 0.0]
  - - [2944, 1408, 1, 3328]
    - [26, 0.0]
  - - [2944, 4288, 1, 3328]
    - [5, 0.0]
  - - [256, 2944, 1, 256]
    - [24, 0.0]
  - - [5056, 2944, 1, 256]
    - [5, 0.0]
  - - [2368, 1856, 1, 256]
    - [25, 0.0]
  - - [128, 448, 1, 1280]
    - [43, 0.0]
  - - [128, 6784, 1, 1280]
    - [25, 0.0]
  - - [1408, 3584, 1, 3328]
    - [36, 0.0]
  - - [2368, 6784, 1, 256]
    - [5, 0.0]
  - - [5056, 1408, 1, 1280]
    - [26, 0.0]
  - - [1408, 5888, 1, 3328]
    - [26, 0.0]
  - - [1856, 5056, 1, 256]
    - [11, 0.0]
  - - [6784, 6784, 1, 256]
    - [36, 0.0]
  - - [1408, 704, 1, 3328]
    - [28, 0.0]
  - - [128, 5888, 1, 1280]
    - [10, 0.0]
  - - [2368, 4288, 1, 1280]
    - [11, 0.0]
  - - [3584, 1856, 1, 1280]
    - [36, 0.0]
  - - [704, 1408, 1, 3328]
    - [25, 0.0]
  - - [704, 64, 1, 1280]
    - [37, 0.0]
  - - [5888, 5056, 1, 256]
    - [26, 0.0]
  - - [3584, 448, 1, 256]
    - [5, 0.0]
  - - [3584, 3584, 1, 1280]
    - [5, 0.0]
  - - [256, 6784, 1, 256]
    - [5, 0.0]
  - - [1856, 3584, 1, 3328]
    - [5, 0.0]
  - - [5056, 256, 1, 1280]
    - [24, 0.0]
  - - [3584, 3584, 1, 256]
    - [11, 0.0]
  - - [6784, 4288, 1, 1280]
    - [5, 0.0]
  - - [704, 5056, 1, 256]
    - [25, 0.0]
  - - [6784, 128, 1, 256]
    - [0, 0.0]
  - - [64, 1408, 1, 3328]
    - [44, 0.0]
  - - [704, 448, 1, 256]
    - [15, 0.0]
  - - [2944, 2368, 1, 1280]
    - [36, 0.0]
  - - [448, 64, 1, 3328]
    - [37, 0.0]
  - - [6784, 3584, 1, 256]
    - [5, 0.0]
  - - [256, 1856, 1, 3328]
    - [24, 0.0]
  - - [704, 6784, 1, 256]
    - [25, 0.0]
  - - [1024, 3584, 1, 3328]
    - [11, 0.0]
  - - [64, 128, 1, 3328]
    - [41, 0.0]
  - - [2944, 2944, 1, 3328]
    - [5, 0.0]
  - - [5056, 6784, 1, 256]
    - [5, 0.0]
  - - [1408, 4288, 1, 3328]
    - [26, 0.0]
  - - [6784, 256, 1, 1280]
    - [11, 0.0]
  - - [2368, 704, 1, 3328]
    - [5, 0.0]
  - - [128, 4288, 1, 256]
    - [10, 0.0]
  - - [3584, 6784, 1, 256]
    - [26, 0.0]
  - - [128, 128, 1, 3328]
    - [41, 0.0]
  - - [5056, 1856, 1, 256]
    - [48, 0.0]
  - - [256, 128, 1, 256]
    - [21, 0.0]
  - - [704, 4288, 1, 256]
    - [25, 0.0]
  - - [256, 448, 1, 3328]
    - [43, 0.0]
  - - [1408, 6784, 1, 1280]
    - [5, 0.0]
  - - [64, 2368, 1, 1280]
    - [30, 0.0]
  - - [64, 6784, 1, 3328]
    - [40, 0.0]
  - - [2944, 256, 1, 1280]
    - [34, 0.0]
  - - [5056, 2368, 1, 3328]
    - [26, 0.0]
  - - [2944, 4288, 1, 256]
    - [11, 0.0]
  - - [1408, 3584, 1, 1280]
    - [26, 0.0]
  - - [2368, 64, 1, 256]
    - [18, 0.0]
  - - [64, 448, 1, 3328]
    - [37, 0.0]
  - - [1024, 1408, 1, 1280]
    - [11, 0.0]
  - - [1856, 704, 1, 256]
    - [24, 0.0]
  - - [1408, 448, 1, 3328]
    - [24, 0.0]
  - - [2368, 256, 1, 256]
    - [24, 0.0]
  - - [2368, 6784, 1, 3328]
    - [5, 0.0]
  - - [5056, 704, 1, 1280]
    - [51, 0.0]
  - - [1856, 4288, 1, 3328]
    - [26, 0.0]
  - - [1408, 5888, 1, 256]
    - [26, 0.0]
  - - [4288, 64, 1, 1280]
    - [20, 0.0]
  - - [256, 64, 1, 256]
    - [23, 0.0]
  - - [704, 1856, 1, 256]
    - [24, 0.0]
  - - [5888, 64, 1, 1280]
    - [20, 0.0]
  - - [3584, 704, 1, 1280]
    - [51, 0.0]
  - - [256, 128, 1, 1280]
    - [41, 0.0]
  - - [256, 2368, 1, 1280]
    - [24, 0.0]
  - - [3584, 448, 1, 3328]
    - [5, 0.0]
  - - [704, 2368, 1, 3328]
    - [35, 0.0]
  - - [2944, 448, 1, 256]
    - [5, 0.0]
  - - [448, 5056, 1, 3328]
    - [5, 0.0]
  - - [2368, 128, 1, 1280]
    - [20, 0.0]
  - - [4288, 448, 1, 256]
    - [49, 0.0]
  - - [448, 5888, 1, 256]
    - [11, 0.0]
  - - [64, 5056, 1, 1280]
    - [1, 0.0]
  - - [5888, 2368, 1, 256]
    - [26, 0.0]
  - - [704, 448, 1, 3328]
    - [38, 0.0]
  - - [6784, 704, 1, 3328]
    - [5, 0.0]
  - - [128, 64, 1, 1280]
    - [41, 0.0]
  - - [1408, 2944, 1, 3328]
    - [36, 0.0]
  - - [64, 1024, 1, 256]
    - [14, 0.0]
  - - [5056, 64, 1, 3328]
    - [32, 0.0]
  - - [2368, 448, 1, 1280]
    - [34, 0.0]
  - - [1408, 256, 1, 1280]
    - [24, 0.0]
  - - [1856, 448, 1, 3328]
    - [25, 0.0]
  - - [128, 5056, 1, 256]
    - [3, 0.0]
  - - [2368, 704, 1, 256]
    - [5, 0.0]
  - - [3584, 2368, 1, 256]
    - [25, 0.0]
  - - [5888, 5056, 1, 1280]
    - [11, 0.0]
  - - [128, 1024, 1, 1280]
    - [21, 0.0]
  - - [64, 704, 1, 256]
    - [14, 0.0]
  - - [4288, 256, 1, 1280]
    - [24, 0.0]
  - - [3584, 3584, 1, 3328]
    - [5, 0.0]
  - - [704, 704, 1, 256]
    - [24, 0.0]
  - - [5888, 6784, 1, 256]
    - [26, 0.0]
  - - [4288, 2944, 1, 3328]
    - [5, 0.0]
  - - [1856, 64, 1, 256]
    - [21, 0.0]
  - - [4288, 128, 1, 3328]
    - [0, 0.0]
  - - [4288, 704, 1, 1280]
    - [51, 0.0]
  - - [256, 5056, 1, 1280]
    - [24, 0.0]
  - - [6784, 5888, 1, 1280]
    - [5, 0.0]
  - - [704, 128, 1, 256]
    - [12, 0.0]
  - - [5888, 4288, 1, 1280]
    - [5, 0.0]
  - - [448, 256, 1, 1280]
    - [21, 0.0]
  - - [256, 1024, 1, 256]
    - [7, 0.0]
  - - [256, 1408, 1, 1280]
    - [7, 0.0]
  - - [3584, 1024, 1, 3328]
    - [11, 0.0]
  - - [1408, 1856, 1, 1280]
    - [51, 0.0]
  - - [5888, 448, 1, 3328]
    - [11, 0.0]
  - - [704, 5888, 1, 1280]
    - [5, 0.0]
  - - [1024, 6784, 1, 3328]
    - [36, 0.0]
  - - [704, 2944, 1, 1280]
    - [5, 0.0]
  - - [6784, 64, 1, 3328]
    - [20, 0.0]
  - - [5056, 2944, 1, 3328]
    - [5, 0.0]
  - - [448, 128, 1, 256]
    - [12, 0.0]
  - - [1408, 1408, 1, 3328]
    - [25, 0.0]
  - - [1856, 128, 1, 1280]
    - [22, 0.0]
  - - [448, 4288, 1, 1280]
    - [25, 0.0]
  - - [64, 3584, 1, 256]
    - [4, 0.0]
  - - [128, 2944, 1, 3328]
    - [20, 0.0]
  - - [3584, 704, 1, 256]
    - [49, 0.0]
  - - [2944, 448, 1, 3328]
    - [25, 0.0]
  - - [3584, 1408, 1, 3328]
    - [36, 0.0]
  - - [2368, 1024, 1, 1280]
    - [11, 0.0]
  - - [1856, 6784, 1, 256]
    - [5, 0.0]
  - - [4288, 448, 1, 3328]
    - [29, 0.0]
  - - [4288, 3584, 1, 1280]
    - [26, 0.0]
  - - [5888, 1024, 1, 3328]
    - [26, 0.0]
  - - [704, 6784, 1, 1280]
    - [26, 0.0]
  - - [1024, 2944, 1, 3328]
    - [36, 0.0]
  - - [2368, 448, 1, 3328]
    - [24, 0.0]
  - - [704, 5056, 1, 1280]
    - [11, 0.0]
  - - [1024, 5888, 1, 1280]
    - [36, 0.0]
  - - [2944, 1856, 1, 256]
    - [25, 0.0]
  - - [5056, 64, 1, 256]
    - [1, 0.0]
  - - [3584, 5056, 1, 256]
    - [11, 0.0]
  - - [5888, 5056, 1, 3328]
    - [36, 0.0]
  - - [128, 5056, 1, 3328]
    - [13, 0.0]
  - - [3584, 6784, 1, 1280]
    - [36, 0.0]
  - - [4288, 1856, 1, 256]
    - [26, 0.0]
  - - [1856, 5888, 1, 256]
    - [5, 0.0]
  - - [256, 256, 1, 256]
    - [21, 0.0]
  - - [4288, 4288, 1, 3328]
    - [5, 0.0]
  - - [4288, 1408, 1, 1280]
    - [36, 0.0]
  - - [64, 1856, 1, 256]
    - [30, 0.0]
  - - [4288, 2368, 1, 256]
    - [5, 0.0]
  - - [2944, 5056, 1, 1280]
    - [11, 0.0]
  - - [6784, 64, 1, 256]
    - [24, 0.0]
  - - [6784, 2368, 1, 3328]
    - [26, 0.0]
  - - [256, 1024, 1, 1280]
    - [38, 0.0]
  - - [4288, 1856, 1, 3328]
    - [26, 0.0]
  - - [1856, 2944, 1, 1280]
    - [5, 0.0]
  - - [3584, 64, 1, 1280]
    - [38, 0.0]
  - - [3584, 1024, 1, 1280]
    - [25, 0.0]
  - - [1024, 4288, 1, 256]
    - [35, 0.0]
  - - [5888, 3584, 1, 3328]
    - [5, 0.0]
  - - [5056, 3584, 1, 3328]
    - [5, 0.0]
  - - [1408, 128, 1, 3328]
    - [19, 0.0]
  - - [2368, 1408, 1, 1280]
    - [11, 0.0]
  - - [5056, 2944, 1, 1280]
    - [5, 0.0]
  - - [128, 2368, 1, 256]
    - [19, 0.0]
  - - [3584, 256, 1, 256]
    - [5, 0.0]
  - - [1024, 6784, 1, 256]
    - [36, 0.0]
  - - [3584, 2944, 1, 256]
    - [26, 0.0]
  - - [448, 128, 1, 3328]
    - [45, 0.0]
  - - [3584, 1408, 1, 1280]
    - [26, 0.0]
  - - [64, 4288, 1, 3328]
    - [20, 0.0]
  - - [5056, 6784, 1, 3328]
    - [26, 0.0]
  - - [128, 2944, 1, 256]
    - [10, 0.0]
  - - [3584, 4288, 1, 256]
    - [26, 0.0]
  - - [1856, 6784, 1, 3328]
    - [5, 0.0]
  - - [3584, 128, 1, 3328]
    - [20, 0.0]
  - - [128, 256, 1, 1280]
    - [41, 0.0]
  - - [1024, 448, 1, 1280]
    - [34, 0.0]
  - - [5056, 1408, 1, 256]
    - [26, 0.0]
  - - [64, 256, 1, 1280]
    - [41, 0.0]
  - - [256, 704, 1, 256]
    - [24, 0.0]
  - - [5888, 5888, 1, 256]
    - [26, 0.0]
  - - [4288, 1024, 1, 1280]
    - [11, 0.0]
  - - [5888, 128, 1, 3328]
    - [3, 0.0]
  - - [448, 6784, 1, 3328]
    - [5, 0.0]
  - - [2944, 1408, 1, 1280]
    - [26, 0.0]
  - - [2944, 1856, 1, 3328]
    - [5, 0.0]
  - - [128, 1024, 1, 256]
    - [21, 0.0]
  - - [3584, 5888, 1, 1280]
    - [11, 0.0]
  - - [6784, 1856, 1, 1280]
    - [5, 0.0]
  - - [5888, 256, 1, 3328]
    - [25, 0.0]
  - - [1856, 5888, 1, 3328]
    - [5, 0.0]
  - - [3584, 1408, 1, 256]
    - [26, 0.0]
  - - [64, 448, 1, 256]
    - [42, 0.0]
  - - [704, 3584, 1, 3328]
    - [11, 0.0]
  - - [5056, 448, 1, 1280]
    - [5, 0.0]
  - - [4288, 704, 1, 256]
    - [51, 0.0]
  - - [1408, 704, 1, 1280]
    - [16, 0.0]
  - - [2944, 1024, 1, 256]
    - [25, 0.0]
  - - [448, 1408, 1, 1280]
    - [24, 0.0]
  - - [2368, 4288, 1, 3328]
    - [5, 0.0]
  - - [64, 64, 1, 256]
    - [18, 0.0]
  - - [704, 1408, 1, 1280]
    - [25, 0.0]
  - - [6784, 5056, 1, 256]
    - [11, 0.0]
  - - [3584, 5056, 1, 3328]
    - [11, 0.0]
  - - [4288, 5888, 1, 256]
    - [5, 0.0]
  - - [448, 2944, 1, 256]
    - [5, 0.0]
  - - [2944, 6784, 1, 256]
    - [26, 0.0]
  - - [2368, 2368, 1, 1280]
    - [5, 0.0]
  - - [1856, 3584, 1, 1280]
    - [5, 0.0]
  - - [64, 2944, 1, 256]
    - [21, 0.0]
  - - [5056, 3584, 1, 1280]
    - [5, 0.0]
  - - [256, 5888, 1, 256]
    - [11, 0.0]
  - - [128, 256, 1, 3328]
    - [41, 0.0]
  - - [1856, 1408, 1, 3328]
    - [5, 0.0]
  - - [1024, 4288, 1, 3328]
    - [11, 0.0]
  - - [448, 2368, 1, 256]
    - [24, 0.0]
  - - [64, 1408, 1, 1280]
    - [18, 0.0]
  - - [2944, 2368, 1, 3328]
    - [26, 0.0]
  - - [704, 128, 1, 3328]
    - [44, 0.0]
  - - [1408, 128, 1, 256]
    - [19, 0.0]
  - - [1024, 1856, 1, 1280]
    - [11, 0.0]
  - - [6784, 1856, 1, 256]
    - [5, 0.0]
  - - [1024, 5888, 1, 256]
    - [36, 0.0]
  - - [64, 2944, 1, 1280]
    - [31, 0.0]
  - - [64, 5056, 1, 256]
    - [1, 0.0]
  - - [1408, 2368, 1, 256]
    - [25, 0.0]
  - - [2944, 704, 1, 3328]
    - [17, 0.0]
  - - [64, 128, 1, 1280]
    - [41, 0.0]
  - - [2944, 2944, 1, 1280]
    - [5, 0.0]
  - - [6784, 256, 1, 3328]
    - [25, 0.0]
  - - [1408, 5056, 1, 256]
    - [11, 0.0]
  - - [5056, 128, 1, 3328]
    - [13, 0.0]
  - - [128, 128, 1, 1280]
    - [41, 0.0]
  - - [448, 704, 1, 256]
    - [15, 0.0]
  - - [1856, 256, 1, 3328]
    - [24, 0.0]
  - - [2944, 128, 1, 3328]
    - [20, 0.0]
  - - [704, 256, 1, 1280]
    - [38, 0.0]
  - - [256, 448, 1, 1280]
    - [43, 0.0]
  - - [5056, 256, 1, 256]
    - [24, 0.0]
  - - [64, 2368, 1, 3328]
    - [41, 0.0]
  - - [256, 704, 1, 3328]
    - [38, 0.0]
  - - [64, 6784, 1, 1280]
    - [2, 0.0]
  - - [1408, 4288, 1, 256]
    - [11, 0.0]
  - - [5888, 2368, 1, 1280]
    - [26, 0.0]
  - - [128, 256, 1, 256]
    - [21, 0.0]
  - - [64, 128, 1, 256]
    - [14, 0.0]
  - - [2368, 5888, 1, 1280]
    - [5, 0.0]
  - - [5888, 256, 1, 1280]
    - [25, 0.0]
  - - [704, 1024, 1, 1280]
    - [34, 0.0]
  - - [2368, 1856, 1, 3328]
    - [5, 0.0]
  - - [2944, 704, 1, 256]
    - [51, 0.0]
  - - [2368, 6784, 1, 1280]
    - [5, 0.0]
  - - [1856, 4288, 1, 1280]
    - [36, 0.0]
  - - [704, 3584, 1, 256]
    - [11, 0.0]
  - - [704, 2944, 1, 3328]
    - [25, 0.0]
  - - [1856, 5056, 1, 3328]
    - [5, 0.0]
  - - [3584, 5056, 1, 1280]
    - [11, 0.0]
  - - [2944, 1024, 1, 3328]
    - [11, 0.0]
  - - [256, 4288, 1, 256]
    - [24, 0.0]
  - - [1408, 6784, 1, 256]
    - [5, 0.0]
  - - [6784, 1408, 1, 3328]
    - [5, 0.0]
  - - [1024, 2368, 1, 1280]
    - [11, 0.0]
  - - [704, 64, 1, 256]
    - [14, 0.0]
  - - [256, 2368, 1, 3328]
    - [34, 0.0]
  - - [6784, 2944, 1, 1280]
    - [5, 0.0]
  - - [3584, 448, 1, 1280]
    - [5, 0.0]
  - - [2944, 6784, 1, 3328]
    - [5, 0.0]
  - - [448, 5056, 1, 1280]
    - [11, 0.0]
  - - [64, 2944, 1, 3328]
    - [19, 0.0]
  - - [128, 1408, 1, 256]
    - [33, 0.0]
  - - [64, 64, 1, 1280]
    - [37, 0.0]
  - - [5888, 704, 1, 256]
    - [51, 0.0]
  - - [256, 5888, 1, 3328]
    - [25, 0.0]
  - - [6784, 4288, 1, 256]
    - [5, 0.0]
  - - [5888, 256, 1, 256]
    - [5, 0.0]
  - - [128, 3584, 1, 256]
    - [3, 0.0]
  - - [6784, 1024, 1, 1280]
    - [26, 0.0]
  - - [704, 448, 1, 1280]
    - [27, 0.0]
  - - [128, 64, 1, 3328]
    - [41, 0.0]
  - - [448, 64, 1, 256]
    - [23, 0.0]
  - - [2944, 704, 1, 1280]
    - [17, 0.0]
  - - [6784, 3584, 1, 1280]
    - [5, 0.0]
  - - [1024, 704, 1, 1280]
    - [24, 0.0]
  - - [1408, 2944, 1, 1280]
    - [36, 0.0]
  - - [256, 1856, 1, 256]
    - [34, 0.0]
  - - [1408, 2368, 1, 3328]
    - [5, 0.0]
  - - [1024, 3584, 1, 256]
    - [35, 0.0]
  - - [2368, 2944, 1, 256]
    - [26, 0.0]
  - - [704, 1856, 1, 1280]
    - [34, 0.0]
  - - [1408, 256, 1, 3328]
    - [40, 0.0]
  - - [5888, 128, 1, 256]
    - [3, 0.0]
  - - [2944, 5888, 1, 256]
    - [26, 0.0]
  - - [3584, 1856, 1, 256]
    - [26, 0.0]
  - - [2368, 448, 1, 256]
    - [24, 0.0]
  - - [4288, 256, 1, 3328]
    - [24, 0.0]
  - - [1408, 64, 1, 256]
    - [30, 0.0]
  - - [704, 4288, 1, 3328]
    - [5, 0.0]
  - - [4288, 2944, 1, 1280]
    - [5, 0.0]
  - - [1024, 64, 1, 256]
    - [14, 0.0]
  - - [64, 2368, 1, 256]
    - [18, 0.0]
  - - [4288, 5056, 1, 3328]
    - [26, 0.0]
  - - [2944, 256, 1, 256]
    - [24, 0.0]
  - - [1024, 128, 1, 3328]
    - [43, 0.0]
  - - [256, 5056, 1, 3328]
    - [24, 0.0]
  - - [5056, 2368, 1, 256]
    - [26, 0.0]
  - - [4288, 704, 1, 3328]
    - [51, 0.0]
  - - [448, 3584, 1, 256]
    - [11, 0.0]
  - - [2368, 64, 1, 1280]
    - [18, 0.0]
  - - [1408, 448, 1, 256]
    - [24, 0.0]
  - - [2944, 5888, 1, 1280]
    - [26, 0.0]
  - - [5888, 3584, 1, 256]
    - [5, 0.0]
  - - [1408, 1856, 1, 3328]
    - [51, 0.0]
  - - [6784, 1408, 1, 1280]
    - [5, 0.0]
  - - [704, 2944, 1, 256]
    - [25, 0.0]
  - - [4288, 64, 1, 256]
    - [1, 0.0]
  - - [2944, 5888, 1, 3328]
    - [26, 0.0]
  - - [64, 4288, 1, 1280]
    - [1, 0.0]
  - - [6784, 64, 1, 1280]
    - [20, 0.0]
  - - [1408, 6784, 1, 3328]
    - [5, 0.0]
  - - [1408, 64, 1, 3328]
    - [18, 0.0]
  - - [448, 1024, 1, 3328]
    - [24, 0.0]
  - - [448, 4288, 1, 3328]
    - [25, 0.0]
  - - [704, 2368, 1, 256]
    - [5, 0.0]
  - - [2944, 448, 1, 1280]
    - [5, 0.0]
  - - [5888, 2368, 1, 3328]
    - [26, 0.0]
  - - [4288, 5056, 1, 256]
    - [11, 0.0]
  - - [4288, 448, 1, 1280]
    - [29, 0.0]
  - - [5888, 704, 1, 3328]
    - [51, 0.0]
  - - [4288, 3584, 1, 3328]
    - [26, 0.0]
  - - [5056, 128, 1, 256]
    - [20, 0.0]
  - - [128, 64, 1, 256]
    - [18, 0.0]
  - - [448, 1024, 1, 256]
    - [24, 0.0]
  - - [6784, 6784, 1, 3328]
    - [36, 0.0]
  - - [704, 5056, 1, 3328]
    - [11, 0.0]
  - - [1024, 64, 1, 1280]
    - [37, 0.0]
  - - [64, 1024, 1, 3328]
    - [37, 0.0]
  - - [2368, 2944, 1, 3328]
    - [26, 0.0]
  - - [448, 448, 1, 1280]
    - [22, 0.0]
  - - [2368, 3584, 1, 256]
    - [11, 0.0]
  - - [1024, 256, 1, 1280]
    - [38, 0.0]
  - - [128, 5056, 1, 1280]
    - [6, 0.0]
  - - [3584, 2368, 1, 1280]
    - [5, 0.0]
  - - [1856, 1856, 1, 256]
    - [25, 0.0]
  - - [4288, 1408, 1, 3328]
    - [36, 0.0]
  - - [3584, 64, 1, 3328]
    - [38, 0.0]
  - - [4288, 5056, 1, 1280]
    - [26, 0.0]
  - - [5888, 6784, 1, 1280]
    - [11, 0.0]
  - - [256, 1024, 1, 3328]
    - [38, 0.0]
  - - [1856, 64, 1, 3328]
    - [43, 0.0]
  - - [5888, 1408, 1, 3328]
    - [36, 0.0]
  - - [256, 5056, 1, 256]
    - [24, 0.0]
  - - [1408, 1024, 1, 256]
    - [5, 0.0]
  - - [448, 256, 1, 256]
    - [21, 0.0]
  - - [1408, 256, 1, 256]
    - [24, 0.0]
  - - [2368, 5056, 1, 256]
    - [26, 0.0]
  - - [128, 5888, 1, 3328]
    - [10, 0.0]
  - - [1024, 5056, 1, 256]
    - [36, 0.0]
  - - [2368, 1408, 1, 3328]
    - [5, 0.0]
  - - [5888, 448, 1, 256]
    - [5, 0.0]
  - - [6784, 5056, 1, 1280]
    - [11, 0.0]
  - - [4288, 6784, 1, 1280]
    - [26, 0.0]
  - - [128, 704, 1, 256]
    - [21, 0.0]
  - - [1024, 128, 1, 256]
    - [21, 0.0]
  - - [448, 128, 1, 1280]
    - [37, 0.0]
  - - [1024, 64, 1, 3328]
    - [43, 0.0]
  - - [64, 3584, 1, 1280]
    - [22, 0.0]
  - - [6784, 1408, 1, 256]
    - [5, 0.0]
  - - [5888, 4288, 1, 256]
    - [11, 0.0]
  - - [5056, 5888, 1, 256]
    - [5, 0.0]
  - - [2368, 1024, 1, 256]
    - [5, 0.0]
  - - [1856, 6784, 1, 1280]
    - [5, 0.0]
  - - [3584, 128, 1, 1280]
    - [20, 0.0]
  - - [4288, 128, 1, 256]
    - [3, 0.0]
  - - [4288, 3584, 1, 256]
    - [26, 0.0]
  - - [64, 256, 1, 3328]
    - [37, 0.0]
  - - [5056, 1856, 1, 1280]
    - [48, 0.0]
  - - [1408, 1024, 1, 3328]
    - [25, 0.0]
  - - [2368, 256, 1, 3328]
    - [24, 0.0]
  - - [5888, 3584, 1, 1280]
    - [5, 0.0]
  - - [5888, 128, 1, 1280]
    - [3, 0.0]
  - - [1024, 2944, 1, 256]
    - [35, 0.0]
  - - [448, 6784, 1, 1280]
    - [25, 0.0]
  - - [256, 3584, 1, 1280]
    - [25, 0.0]
  - - [2944, 1856, 1, 1280]
    - [5, 0.0]
  - - [128, 5888, 1, 256]
    - [10, 0.0]
  - - [2368, 3584, 1, 3328]
    - [5, 0.0]
  - - [3584, 5888, 1, 3328]
    - [11, 0.0]
  - - [2944, 3584, 1, 1280]
    - [5, 0.0]
  - - [1856, 5888, 1, 1280]
    - [5, 0.0]
  - - [256, 256, 1, 1280]
    - [39, 0.0]
  - - [5056, 448, 1, 3328]
    - [5, 0.0]
  - - [4288, 1408, 1, 256]
    - [26, 0.0]
  - - [3584, 64, 1, 256]
    - [19, 0.0]
  - - [64, 1856, 1, 3328]
    - [43, 0.0]
  - - [1024, 1024, 1, 256]
    - [34, 0.0]
  - - [4288, 2368, 1, 1280]
    - [5, 0.0]
  - - [2944, 5056, 1, 256]
    - [11, 0.0]
  - - [256, 128, 1, 3328]
    - [41, 0.0]
  - - [6784, 2368, 1, 256]
    - [26, 0.0]
  - - [1024, 1024, 1, 1024]
    - [46, 0.0]
  - - [2944, 64, 1, 3328]
    - [19, 0.0]
  - - [128, 1408, 1, 3328]
    - [19, 0.0]
  - - [1856, 2944, 1, 256]
    - [25, 0.0]
  - - [64, 5888, 1, 1280]
    - [20, 0.0]
  - - [1856, 1408, 1, 1280]
    - [5, 0.0]
  - - [704, 1024, 1, 256]
    - [24, 0.0]
  - - [1024, 4288, 1, 1280]
    - [11, 0.0]
  - - [2368, 5056, 1, 3328]
    - [36, 0.0]
  - - [1024, 1856, 1, 3328]
    - [35, 0.0]
  - - [704, 704, 1, 1280]
    - [24, 0.0]
  - - [128, 2368, 1, 1280]
    - [19, 0.0]
  - - [3584, 256, 1, 1280]
    - [25, 0.0]
  - - [704, 3584, 1, 1280]
    - [11, 0.0]
  - - [128, 704, 1, 3328]
    - [44, 0.0]
  - - [4288, 6784, 1, 256]
    - [5, 0.0]
  - - [3584, 2944, 1, 3328]
    - [5, 0.0]
  - - [128, 1856, 1, 256]
    - [4, 0.0]
  - - [64, 4288, 1, 256]
    - [8, 0.0]
  - - [5888, 2944, 1, 256]
    - [26, 0.0]
  - - [5056, 128, 1, 1280]
    - [13, 0.0]
  - - [448, 1856, 1, 3328]
    - [25, 0.0]
  - - [5056, 4288, 1, 256]
    - [11, 0.0]
  - - [1024, 448, 1, 256]
    - [34, 0.0]
  - - [2944, 128, 1, 1280]
    - [32, 0.0]
  - - [6784, 1024, 1, 3328]
    - [26, 0.0]
  - - [64, 256, 1, 256]
    - [14, 0.0]
  - - [704, 256, 1, 3328]
    - [38, 0.0]
  - - [256, 704, 1, 1280]
    - [38, 0.0]
  - - [5888, 5888, 1, 1280]
    - [5, 0.0]
  - - [448, 5888, 1, 1280]
    - [5, 0.0]
  - - [2944, 1408, 1, 256]
    - [36, 0.0]
  - - [256, 2944, 1, 1280]
    - [24, 0.0]
  - - [1024, 2944, 1, 1280]
    - [36, 0.0]
  - - [2368, 5888, 1, 3328]
    - [5, 0.0]
  - - [704, 1024, 1, 3328]
    - [24, 0.0]
  - - [2368, 1856, 1, 1280]
    - [5, 0.0]
  - - [1856, 448, 1, 1280]
    - [5, 0.0]
  - - [128, 6784, 1, 256]
    - [3, 0.0]
  - - [5888, 4288, 1, 3328]
    - [11, 0.0]
  - - [6784, 704, 1, 1280]
    - [5, 0.0]
  - - [5056, 448, 1, 256]
    - [5, 0.0]
  - - [1856, 5056, 1, 1280]
    - [48, 0.0]
  - - [2944, 1024, 1, 1280]
    - [11, 0.0]
  - - [2368, 4288, 1, 256]
    - [11, 0.0]
  - - [1024, 2368, 1, 3328]
    - [11, 0.0]
  - - [64, 704, 1, 3328]
    - [37, 0.0]
  - - [704, 1408, 1, 256]
    - [5, 0.0]
  - - [4288, 5888, 1, 3328]
    - [5, 0.0]
  - - [256, 1408, 1, 256]
    - [7, 0.0]
  - - [448, 2944, 1, 1280]
    - [5, 0.0]
  - - [2944, 6784, 1, 1280]
    - [5, 0.0]
  - - [256, 6784, 1, 1280]
    - [5, 0.0]
  - - [1856, 3584, 1, 256]
    - [11, 0.0]
  - - [128, 448, 1, 3328]
    - [43, 0.0]
  - - [1856, 256, 1, 256]
    - [24, 0.0]
  - - [128, 2368, 1, 3328]
    - [32, 0.0]
  - - [256, 5888, 1, 1280]
    - [5, 0.0]
  - - [448, 2368, 1, 3328]
    - [24, 0.0]
  - - [64, 1408, 1, 256]
    - [18, 0.0]
  - - [2944, 2368, 1, 256]
    - [26, 0.0]
  - - [1856, 448, 1, 256]
    - [5, 0.0]
  - - [1024, 1856, 1, 256]
    - [35, 0.0]
  - - [6784, 3584, 1, 3328]
    - [5, 0.0]
  - - [1024, 704, 1, 3328]
    - [24, 0.0]
  - - [1024, 5888, 1, 3328]
    - [36, 0.0]
  - - [1408, 2368, 1, 1280]
    - [5, 0.0]
  - - [128, 1408, 1, 1280]
    - [19, 0.0]
  - - [256, 64, 1, 3328]
    - [41, 0.0]
  - - [128, 1856, 1, 3328]
    - [38, 0.0]
  - - [2944, 2944, 1, 256]
    - [5, 0.0]
  - - [6784, 256, 1, 256]
    - [5, 0.0]
  - - [128, 4288, 1, 1280]
    - [6, 0.0]
  - - [5888, 1408, 1, 256]
    - [26, 0.0]
  - - [128, 128, 1, 256]
    - [18, 0.0]
  - - [448, 704, 1, 3328]
    - [40, 0.0]
  - - [448, 1856, 1, 256]
    - [5, 0.0]
  - - [1856, 704, 1, 3328]
    - [24, 0.0]
  - - [5888, 6784, 1, 3328]
    - [25, 0.0]
  - - [704, 4288, 1, 1280]
    - [11, 0.0]
  - - [704, 256, 1, 256]
    - [7, 0.0]
  - - [6784, 448, 1, 3328]
    - [51, 0.0]
- null
