library/src/blas3/Tensile/Logic/asm_full/arcturus_Cijk_Alik_Bjlk_HB.yaml
- {MinimumRequiredVersion: 4.6.0}
- arcturus
- gfx908
- [Device 7380, Device 7388, Device 738c]
    SolutionIndex: 0
    SolutionNameMin: Cijk_Alik_Bjlk_HB_MT016x128x08_GRVW04_NLCA01_TT04_04_USFGRO0_VW04_WG04_32_01
    SolutionIndex: 1
    SolutionNameMin: Cijk_Alik_Bjlk_HB_MT016x064x08_GRVW02_NLCA01_TT02_04_USFGRO0_VW02_WG08_16_01
    SolutionIndex: 2
    SolutionNameMin: Cijk_Alik_Bjlk_HB_MT032x064x08_GRVW04_NLCA01_TT04_04_USFGRO0_VW04_WG08_16_01
    SolutionIndex: 3
    SolutionNameMin: Cijk_Alik_Bjlk_HB_MT032x128x08_GRVW04_NLCA01_TT04_04_USFGRO0_VW04_WG08_32_01
    SolutionIndex: 4
    SolutionNameMin: Cijk_Alik_Bjlk_HB_MT032x064x08_GRVW02_NLCA01_TT02_04_USFGRO0_VW02_WG16_16_01
    SolutionIndex: 5
    SolutionNameMin: Cijk_Alik_Bjlk_HB_MT064x128x08_GRVW04_NLCA01_TT04_08_USFGRO0_VW04_WG16_16_01
    SolutionIndex: 6
    SolutionNameMin: Cijk_Alik_Bjlk_HB_MT016x128x08_GRVW04_NLCA01_TT04_04_USFGRO0_VW04_WG04_32_01
    SolutionIndex: 7
    SolutionNameMin: Cijk_Alik_Bjlk_HB_MT032x032x08_GRVW04_NLCA01_TT04_04_USFGRO0_VW04_WG08_08_01
    SolutionIndex: 8
    SolutionNameMin: Cijk_Alik_Bjlk_HB_MT016x064x08_GRVW02_NLCA01_TT02_04_USFGRO0_VW02_WG08_16_01
    SolutionIndex: 9
    SolutionNameMin: Cijk_Alik_Bjlk_HB_MT032x064x08_GRVW04_NLCA01_TT04_04_USFGRO0_VW04_WG08_16_01
    SolutionIndex: 10
    SolutionNameMin: Cijk_Alik_Bjlk_HB_MT032x128x08_GRVW04_NLCA01_TT04_04_USFGRO0_VW04_WG08_32_01
    SolutionIndex: 11
    SolutionNameMin: Cijk_Alik_Bjlk_HB_MT064x128x08_GRVW04_NLCA01_TT04_08_USFGRO0_VW04_WG16_16_01
    SolutionIndex: 12
    SolutionNameMin: Cijk_Alik_Bjlk_HB_MT008x064x16_GRVW02_NLCA01_TT02_02_USFGRO0_VW02_WG04_32_01
    SolutionIndex: 13
    SolutionNameMin: Cijk_Alik_Bjlk_HB_MT016x128x16_GRVW04_NLCA01_TT04_04_USFGRO0_VW04_WG04_32_01
    SolutionIndex: 14
    SolutionNameMin: Cijk_Alik_Bjlk_HB_MT016x016x16_GRVW02_NLCA01_TT02_02_USFGRO0_VW02_WG08_08_01
    SolutionIndex: 15
    SolutionNameMin: Cijk_Alik_Bjlk_HB_MT032x032x16_GRVW04_NLCA01_TT04_04_USFGRO0_VW04_WG08_08_01
    SolutionIndex: 16
    SolutionNameMin: Cijk_Alik_Bjlk_HB_MT032x064x16_GRVW04_NLCA01_TT04_08_USFGRO0_VW04_WG08_08_01
    SolutionIndex: 17
    SolutionNameMin: Cijk_Alik_Bjlk_HB_MT064x064x16_GRVW08_NLCA01_TT08_08_USFGRO0_VW08_WG08_08_01
    SolutionIndex: 18
    SolutionNameMin: Cijk_Alik_Bjlk_HB_MT016x032x16_GRVW02_NLCA01_TT02_02_USFGRO0_VW02_WG08_16_01
    SolutionIndex: 19
    SolutionNameMin: Cijk_Alik_Bjlk_HB_MT016x064x16_GRVW02_NLCA01_TT02_04_USFGRO0_VW02_WG08_16_01
    SolutionIndex: 20
    SolutionNameMin: Cijk_Alik_Bjlk_HB_MT032x064x16_GRVW04_NLCA01_TT04_04_USFGRO0_VW04_WG08_16_01
    SolutionIndex: 21
    SolutionNameMin: Cijk_Alik_Bjlk_HB_MT016x064x16_GRVW02_NLCA01_TT02_02_USFGRO0_VW02_WG08_32_01
    SolutionIndex: 22
    SolutionNameMin: Cijk_Alik_Bjlk_HB_MT016x128x16_GRVW02_NLCA01_TT02_04_USFGRO0_VW02_WG08_32_01
    SolutionIndex: 23
    SolutionNameMin: Cijk_Alik_Bjlk_HB_MT032x032x16_GRVW02_NLCA01_TT02_02_USFGRO0_VW02_WG16_16_01
    SolutionIndex: 24
    SolutionNameMin: Cijk_Alik_Bjlk_HB_MT064x064x16_GRVW04_NLCA01_TT04_04_USFGRO0_VW04_WG16_16_01
    SolutionIndex: 25
    SolutionNameMin: Cijk_Alik_Bjlk_HB_MT064x128x16_GRVW04_NLCA01_TT04_08_USFGRO0_VW04_WG16_16_01
    SolutionIndex: 26
    SolutionNameMin: Cijk_Alik_Bjlk_HB_MT128x128x16_GRVW08_NLCA01_TT08_08_USFGRO0_VW08_WG16_16_01
    SolutionIndex: 27
    SolutionNameMin: Cijk_Alik_Bjlk_HB_MT032x032x16_GRVW04_NLCA01_TT04_04_USFGRO0_VW04_WG08_08_01
    SolutionIndex: 28
    SolutionNameMin: Cijk_Alik_Bjlk_HB_MT032x064x16_GRVW04_NLCA01_TT04_08_USFGRO0_VW04_WG08_08_01
    SolutionIndex: 29
    SolutionNameMin: Cijk_Alik_Bjlk_HB_MT064x064x16_GRVW08_NLCA01_TT08_08_USFGRO0_VW08_WG08_08_01
    SolutionIndex: 30
    SolutionNameMin: Cijk_Alik_Bjlk_HB_MT016x032x16_GRVW02_NLCA01_TT02_02_USFGRO0_VW02_WG08_16_01
    SolutionIndex: 31
    SolutionNameMin: Cijk_Alik_Bjlk_HB_MT016x064x16_GRVW02_NLCA01_TT02_04_USFGRO0_VW02_WG08_16_01
    SolutionIndex: 32
    SolutionNameMin: Cijk_Alik_Bjlk_HB_MT032x064x16_GRVW04_NLCA01_TT04_04_USFGRO0_VW04_WG08_16_01
    SolutionIndex: 33
    SolutionNameMin: Cijk_Alik_Bjlk_HB_MT016x064x16_GRVW02_NLCA01_TT02_02_USFGRO0_VW02_WG08_32_01
    SolutionIndex: 34
    SolutionNameMin: Cijk_Alik_Bjlk_HB_MT064x064x16_GRVW04_NLCA01_TT04_04_USFGRO0_VW04_WG16_16_01
    SolutionIndex: 35
    SolutionNameMin: Cijk_Alik_Bjlk_HB_MT064x128x16_GRVW04_NLCA01_TT04_08_USFGRO0_VW04_WG16_16_01
    SolutionIndex: 36
    SolutionNameMin: Cijk_Alik_Bjlk_HB_MT128x128x16_GRVW08_NLCA01_TT08_08_USFGRO0_VW08_WG16_16_01
    SolutionIndex: 37
    SolutionNameMin: Cijk_Alik_Bjlk_HB_MT016x016x24_GRVW02_NLCA03_TT02_02_USFGRO0_VW02_WG08_08_01
    SolutionIndex: 38
    SolutionNameMin: Cijk_Alik_Bjlk_HB_MT032x032x24_GRVW04_NLCA03_TT04_04_USFGRO0_VW04_WG08_08_01
    SolutionIndex: 39
    SolutionNameMin: Cijk_Alik_Bjlk_HB_MT016x016x24_GRVW02_NLCA03_TT02_02_USFGRO0_VW02_WG08_08_01
    SolutionIndex: 40
    SolutionNameMin: Cijk_Alik_Bjlk_HB_MT032x032x24_GRVW04_NLCA03_TT04_04_USFGRO0_VW04_WG08_08_01
    SolutionIndex: 41
    SolutionNameMin: Cijk_Alik_Bjlk_HB_MT008x064x32_GRVW02_NLCA01_TT02_02_USFGRO0_VW02_WG04_32_01
    SolutionIndex: 42
    SolutionNameMin: Cijk_Alik_Bjlk_HB_MT016x016x32_GRVW02_NLCA01_TT02_02_USFGRO0_VW02_WG08_08_01
    SolutionIndex: 43
    SolutionNameMin: Cijk_Alik_Bjlk_HB_MT016x064x32_GRVW02_NLCA01_TT02_02_USFGRO0_VW02_WG08_32_01
    SolutionIndex: 44
    SolutionNameMin: Cijk_Alik_Bjlk_HB_MT008x064x32_GRVW02_NLCA01_TT02_02_USFGRO0_VW02_WG04_32_01
    SolutionIndex: 45
    SolutionNameMin: Cijk_Alik_Bjlk_HB_MT016x064x32_GRVW02_NLCA01_TT02_02_USFGRO0_VW02_WG08_32_01
    SolutionIndex: 46
    SolutionNameMin: Cijk_Alik_Bjlk_HB_MT064x128x32_GRVW04_NLCA01_TT04_08_USFGRO0_VW04_WG16_16_01
    SolutionIndex: 47
    SolutionNameMin: Cijk_Alik_Bjlk_HB_MT008x064x64_GRVW02_NLCA01_TT02_02_USFGRO0_VW02_WG04_32_01
    SolutionIndex: 48
    SolutionNameMin: Cijk_Alik_Bjlk_HB_MT064x064x16_GRVW08_NLCA01_TT08_08_USFGRO0_VW08_WG08_08_01
    SolutionIndex: 49
    SolutionNameMin: Cijk_Alik_Bjlk_HB_MT128x064x16_GRVW04_NLCA01_TT08_04_USFGRO0_VW04_WG16_16_01
    SolutionIndex: 50
    SolutionNameMin: Cijk_Alik_Bjlk_HB_MT064x064x16_GRVW08_NLCA01_TT08_08_USFGRO0_VW08_WG08_08_01
    SolutionIndex: 51
    SolutionNameMin: Cijk_Alik_Bjlk_HB_MT128x064x16_GRVW04_NLCA01_TT08_04_USFGRO0_VW04_WG16_16_01
- - - [1024, 1024, 1, 3328]
    - [25, 15435.5]
  - - [64, 6784, 1, 256]
    - [2, 7052.6]
  - - [2944, 4288, 1, 1280]
    - [11, 18910.4]
  - - [2368, 64, 1, 3328]
    - [30, 5365.59]
  - - [2368, 5888, 1, 256]
    - [5, 18188.7]
  - - [1024, 5056, 1, 3328]
    - [36, 18931.0]
  - - [5888, 1024, 1, 1280]
    - [36, 18160.6]
  - - [128, 6784, 1, 3328]
    - [25, 12864.5]
  - - [5888, 1856, 1, 3328]
    - [5, 18625.4]
  - - [5056, 704, 1, 256]
    - [51, 14184.5]
  - - [5888, 2944, 1, 3328]
    - [26, 19439.9]
  - - [1856, 4288, 1, 256]
    - [36, 16921.8]
  - - [5056, 5056, 1, 3328]
    - [26, 19606.3]
  - - [1408, 5888, 1, 1280]
    - [26, 19347.3]
  - - [448, 3584, 1, 3328]
    - [25, 13369.6]
  - - [256, 4288, 1, 3328]
    - [24, 12014.1]
  - - [5888, 1408, 1, 1280]
    - [26, 19033.5]
  - - [704, 1856, 1, 3328]
    - [24, 14285.3]
  - - [3584, 1856, 1, 3328]
    - [26, 17774.9]
  - - [5056, 6784, 1, 1280]
    - [48, 19362.1]
  - - [1408, 64, 1, 1280]
    - [18, 3595.49]
  - - [704, 64, 1, 3328]
    - [45, 2127.5]
  - - [448, 1024, 1, 1280]
    - [24, 9905.58]
  - - [5056, 5056, 1, 1280]
    - [36, 19440.6]
  - - [448, 5056, 1, 256]
    - [11, 13397.9]
  - - [6784, 448, 1, 256]
    - [49, 13873.8]
  - - [2368, 128, 1, 256]
    - [1, 5329.3]
  - - [5888, 704, 1, 1280]
    - [48, 16863.1]
  - - [3584, 1024, 1, 256]
    - [25, 15934.9]
  - - [6784, 4288, 1, 3328]
    - [5, 19553.9]
  - - [1856, 2368, 1, 3328]
    - [5, 17561.5]
  - - [5888, 2944, 1, 1280]
    - [5, 19185.7]
  - - [5888, 1024, 1, 256]
    - [26, 16589.7]
  - - [448, 64, 1, 1280]
    - [41, 1299.58]
  - - [2944, 64, 1, 256]
    - [21, 4019.54]
  - - [1408, 2944, 1, 256]
    - [26, 16580.6]
  - - [256, 1856, 1, 1280]
    - [24, 10259.3]
  - - [6784, 5056, 1, 3328]
    - [11, 19641.7]
  - - [5056, 5056, 1, 256]
    - [26, 18604.1]
  - - [448, 704, 1, 1280]
    - [15, 7047.87]
  - - [64, 1024, 1, 1280]
    - [37, 2896.62]
  - - [1024, 3584, 1, 1280]
    - [35, 17751.0]
  - - [2368, 2944, 1, 1280]
    - [26, 18342.8]
  - - [128, 3584, 1, 1280]
    - [0, 10166.2]
  - - [1024, 256, 1, 3328]
    - [38, 8546.39]
  - - [1408, 4288, 1, 1280]
    - [26, 18365.0]
  - - [3584, 4288, 1, 1280]
    - [26, 19510.5]
  - - [2368, 704, 1, 1280]
    - [5, 13581.0]
  - - [5056, 4288, 1, 3328]
    - [5, 19695.9]
  - - [3584, 2368, 1, 3328]
    - [5, 18565.3]
  - - [64, 704, 1, 1280]
    - [37, 1985.94]
  - - [4288, 256, 1, 256]
    - [34, 9895.01]
  - - [6784, 448, 1, 1280]
    - [51, 15620.9]
  - - [1024, 1408, 1, 3328]
    - [25, 15047.3]
  - - [4288, 2944, 1, 256]
    - [5, 17741.1]
  - - [1856, 64, 1, 1280]
    - [21, 4535.9]
  - - [5888, 64, 1, 3328]
    - [20, 9264.9]
  - - [2944, 256, 1, 3328]
    - [24, 12833.6]
  - - [5056, 2368, 1, 1280]
    - [36, 18806.4]
  - - [448, 3584, 1, 1280]
    - [5, 13087.2]
  - - [6784, 5888, 1, 256]
    - [5, 19029.5]
  - - [256, 4288, 1, 1280]
    - [24, 11670.1]
  - - [704, 128, 1, 1280]
    - [18, 3586.55]
  - - [1408, 448, 1, 1280]
    - [24, 10319.6]
  - - [1024, 1408, 1, 256]
    - [11, 11921.8]
  - - [2368, 2368, 1, 3328]
    - [5, 18621.3]
  - - [5056, 704, 1, 3328]
    - [51, 16291.3]
  - - [1408, 1856, 1, 256]
    - [49, 13845.0]
  - - [5888, 1856, 1, 256]
    - [26, 17269.1]
  - - [4288, 64, 1, 3328]
    - [20, 6775.29]
  - - [704, 5888, 1, 256]
    - [25, 16176.2]
  - - [6784, 128, 1, 1280]
    - [6, 12208.8]
  - - [4288, 6784, 1, 3328]
    - [26, 19535.6]
  - - [3584, 704, 1, 3328]
    - [51, 15753.0]
  - - [1408, 1408, 1, 256]
    - [5, 13881.6]
  - - [1856, 128, 1, 256]
    - [19, 4873.19]
  - - [2944, 64, 1, 1280]
    - [19, 6029.31]
  - - [448, 4288, 1, 256]
    - [11, 13540.3]
  - - [64, 3584, 1, 3328]
    - [38, 7507.51]
  - - [704, 2368, 1, 1280]
    - [25, 13512.2]
  - - [1856, 2368, 1, 1280]
    - [5, 17243.8]
  - - [2368, 128, 1, 3328]
    - [20, 7492.03]
  - - [2944, 128, 1, 256]
    - [10, 6121.13]
  - - [448, 1408, 1, 256]
    - [24, 8106.46]
  - - [64, 5056, 1, 3328]
    - [1, 7993.52]
  - - [1408, 1024, 1, 1280]
    - [5, 14665.3]
  - - [2368, 256, 1, 1280]
    - [24, 9887.18]
  - - [6784, 704, 1, 256]
    - [25, 14998.0]
  - - [256, 3584, 1, 3328]
    - [25, 13587.8]
  - - [1408, 3584, 1, 256]
    - [36, 16630.4]
  - - [3584, 4288, 1, 3328]
    - [36, 19712.5]
  - - [5888, 1856, 1, 1280]
    - [36, 18463.6]
  - - [5056, 1024, 1, 3328]
    - [26, 18911.0]
  - - [5056, 64, 1, 1280]
    - [19, 7481.71]
  - - [1024, 704, 1, 256]
    - [34, 9264.53]
  - - [128, 448, 1, 256]
    - [18, 1529.17]
  - - [2368, 3584, 1, 1280]
    - [5, 18439.8]
  - - [1024, 256, 1, 256]
    - [15, 4739.33]
  - - [448, 448, 1, 256]
    - [1, 4090.78]
  - - [2944, 3584, 1, 3328]
    - [5, 18942.4]
  - - [256, 256, 1, 3328]
    - [37, 3101.59]
  - - [128, 1024, 1, 3328]
    - [43, 5463.52]
  - - [6784, 2944, 1, 256]
    - [5, 18381.0]
  - - [64, 1856, 1, 1280]
    - [21, 4503.66]
  - - [1024, 2368, 1, 256]
    - [11, 13332.4]
  - - [4288, 2368, 1, 3328]
    - [5, 19052.2]
  - - [1856, 2368, 1, 256]
    - [25, 15421.1]
  - - [3584, 6784, 1, 3328]
    - [11, 19753.1]
  - - [6784, 1856, 1, 3328]
    - [5, 18968.9]
  - - [1024, 128, 1, 1280]
    - [21, 5017.11]
  - - [4288, 128, 1, 1280]
    - [0, 9714.41]
  - - [5056, 4288, 1, 1280]
    - [5, 19540.4]
  - - [5888, 64, 1, 256]
    - [20, 5999.32]
  - - [1408, 5056, 1, 1280]
    - [36, 18733.8]
  - - [1856, 256, 1, 1280]
    - [34, 10231.7]
  - - [64, 5888, 1, 3328]
    - [20, 9303.36]
  - - [6784, 5888, 1, 3328]
    - [25, 19148.8]
  - - [448, 256, 1, 3328]
    - [43, 4790.18]
  - - [2368, 5056, 1, 1280]
    - [26, 18867.5]
  - - [256, 1408, 1, 3328]
    - [40, 8447.68]
  - - [6784, 128, 1, 3328]
    - [25, 12832.5]
  - - [1024, 5056, 1, 1280]
    - [36, 18469.9]
  - - [4288, 1024, 1, 256]
    - [25, 15373.0]
  - - [2368, 1408, 1, 256]
    - [25, 14595.4]
  - - [704, 704, 1, 3328]
    - [24, 11378.4]
  - - [5888, 448, 1, 1280]
    - [11, 14929.3]
  - - [3584, 256, 1, 3328]
    - [25, 13554.0]
  - - [704, 5888, 1, 3328]
    - [5, 18442.6]
  - - [1024, 6784, 1, 1280]
    - [36, 18299.2]
  - - [128, 3584, 1, 3328]
    - [3, 10794.1]
  - - [128, 704, 1, 1280]
    - [30, 3577.65]
  - - [3584, 2944, 1, 1280]
    - [5, 18566.0]
  - - [1856, 128, 1, 3328]
    - [40, 7751.24]
  - - [128, 2944, 1, 1280]
    - [20, 8712.88]
  - - [2368, 1024, 1, 3328]
    - [11, 16577.3]
  - - [448, 1856, 1, 1280]
    - [25, 11721.4]
  - - [1408, 5056, 1, 3328]
    - [36, 19023.8]
  - - [1856, 1856, 1, 3328]
    - [5, 17300.6]
  - - [3584, 128, 1, 256]
    - [10, 7303.51]
  - - [448, 1408, 1, 3328]
    - [24, 10789.7]
  - - [2368, 2368, 1, 256]
    - [25, 16477.3]
  - - [4288, 4288, 1, 1280]
    - [5, 19282.4]
  - - [64, 448, 1, 1280]
    - [37, 1310.72]
  - - [704, 6784, 1, 3328]
    - [26, 17498.6]
  - - [5888, 5888, 1, 3328]
    - [5, 19885.4]
  - - [5056, 1024, 1, 1280]
    - [36, 18573.4]
  - - [448, 5888, 1, 3328]
    - [5, 15345.2]
  - - [5056, 5888, 1, 1280]
    - [5, 19879.6]
  - - [448, 6784, 1, 256]
    - [25, 15219.9]
  - - [256, 3584, 1, 256]
    - [11, 9885.56]
  - - [256, 2944, 1, 3328]
    - [24, 12833.6]
  - - [256, 448, 1, 256]
    - [21, 2912.71]
  - - [3584, 5888, 1, 256]
    - [26, 18536.5]
  - - [2944, 3584, 1, 256]
    - [11, 17640.6]
  - - [1408, 704, 1, 256]
    - [24, 10468.5]
  - - [6784, 2944, 1, 3328]
    - [5, 19455.3]
  - - [2944, 5056, 1, 3328]
    - [5, 19477.5]
  - - [64, 64, 1, 3328]
    - [47, 208.305]
  - - [6784, 2368, 1, 1280]
    - [36, 18928.6]
  - - [4288, 5888, 1, 1280]
    - [5, 19611.8]
  - - [4288, 4288, 1, 256]
    - [11, 18272.7]
  - - [448, 2944, 1, 3328]
    - [25, 13816.8]
  - - [4288, 1856, 1, 1280]
    - [26, 18382.6]
  - - [1856, 2944, 1, 3328]
    - [5, 18080.3]
  - - [256, 6784, 1, 3328]
    - [25, 14440.7]
  - - [64, 5888, 1, 256]
    - [9, 6247.99]
  - - [5056, 1024, 1, 256]
    - [25, 16600.7]
  - - [1408, 1408, 1, 1280]
    - [5, 16117.6]
  - - [5056, 1856, 1, 3328]
    - [5, 18506.3]
  - - [1856, 1408, 1, 256]
    - [11, 14932.8]
  - - [448, 448, 1, 3328]
    - [40, 6584.58]
  - - [448, 2368, 1, 1280]
    - [24, 11308.3]
  - - [1408, 128, 1, 1280]
    - [19, 5755.66]
  - - [5056, 256, 1, 3328]
    - [24, 14095.4]
  - - [256, 64, 1, 1280]
    - [41, 762.047]
  - - [128, 1856, 1, 1280]
    - [22, 7000.16]
  - - [5056, 3584, 1, 256]
    - [5, 18615.2]
  - - [1856, 1024, 1, 1280]
    - [25, 15404.6]
  - - [1856, 1856, 1, 1280]
    - [5, 16880.8]
  - - [6784, 6784, 1, 1280]
    - [50, 19331.6]
  - - [128, 4288, 1, 3328]
    - [13, 10036.4]
  - - [1856, 1024, 1, 3328]
    - [35, 15746.4]
  - - [256, 2368, 1, 256]
    - [24, 7853.71]
  - - [1024, 448, 1, 3328]
    - [24, 10514.6]
  - - [1856, 704, 1, 1280]
    - [24, 13835.9]
  - - [6784, 1024, 1, 256]
    - [26, 16840.8]
  - - [5056, 5888, 1, 3328]
    - [5, 20036.2]
  - - [1856, 1024, 1, 256]
    - [11, 13366.5]
  - - [5056, 1408, 1, 3328]
    - [26, 18988.4]
  - - [1024, 1024, 1, 1280]
    - [25, 14588.9]
  - - [4288, 1024, 1, 3328]
    - [5, 17300.8]
  - - [2944, 1408, 1, 3328]
    - [26, 18640.0]
  - - [2944, 4288, 1, 3328]
    - [5, 19091.6]
  - - [256, 2944, 1, 256]
    - [24, 9532.51]
  - - [5056, 2944, 1, 256]
    - [5, 18124.6]
  - - [2368, 1856, 1, 256]
    - [25, 15404.2]
  - - [128, 448, 1, 1280]
    - [43, 2493.22]
  - - [128, 6784, 1, 1280]
    - [25, 12241.1]
  - - [1408, 3584, 1, 3328]
    - [36, 18523.3]
  - - [2368, 6784, 1, 256]
    - [5, 18300.6]
  - - [5056, 1408, 1, 1280]
    - [26, 18672.4]
  - - [1408, 5888, 1, 3328]
    - [26, 19569.7]
  - - [1856, 5056, 1, 256]
    - [11, 17198.4]
  - - [6784, 6784, 1, 256]
    - [36, 19406.0]
  - - [1408, 704, 1, 3328]
    - [28, 13921.4]
  - - [128, 5888, 1, 1280]
    - [10, 12679.9]
  - - [2368, 4288, 1, 1280]
    - [11, 18829.8]
  - - [3584, 1856, 1, 1280]
    - [36, 17499.3]
  - - [704, 1408, 1, 3328]
    - [25, 14664.0]
  - - [704, 64, 1, 1280]
    - [37, 1958.96]
  - - [5888, 5056, 1, 256]
    - [26, 18804.4]
  - - [3584, 448, 1, 256]
    - [5, 11169.6]
  - - [3584, 3584, 1, 1280]
    - [5, 19230.9]
  - - [256, 6784, 1, 256]
    - [5, 12160.7]
  - - [1856, 3584, 1, 3328]
    - [5, 18892.6]
  - - [5056, 256, 1, 1280]
    - [24, 13705.7]
  - - [3584, 3584, 1, 256]
    - [11, 18028.1]
  - - [6784, 4288, 1, 1280]
    - [5, 19425.5]
  - - [704, 5056, 1, 256]
    - [25, 15350.6]
  - - [6784, 128, 1, 256]
    - [0, 9581.82]
  - - [64, 1408, 1, 3328]
    - [44, 3921.19]
  - - [704, 448, 1, 256]
    - [15, 5046.27]
  - - [2944, 2368, 1, 1280]
    - [36, 18348.8]
  - - [448, 64, 1, 3328]
    - [37, 1408.21]
  - - [6784, 3584, 1, 256]
    - [5, 18752.6]
  - - [256, 1856, 1, 3328]
    - [24, 10884.1]
  - - [704, 6784, 1, 256]
    - [25, 15359.8]
  - - [1024, 3584, 1, 3328]
    - [11, 18383.2]
  - - [64, 128, 1, 3328]
    - [41, 413.577]
  - - [2944, 2944, 1, 3328]
    - [5, 18989.5]
  - - [5056, 6784, 1, 256]
    - [5, 18865.5]
  - - [1408, 4288, 1, 3328]
    - [26, 18666.7]
  - - [6784, 256, 1, 1280]
    - [11, 13935.4]
  - - [2368, 704, 1, 3328]
    - [5, 13872.8]
  - - [128, 4288, 1, 256]
    - [10, 7505.83]
  - - [3584, 6784, 1, 256]
    - [26, 18793.3]
  - - [128, 128, 1, 3328]
    - [41, 819.2]
  - - [5056, 1856, 1, 256]
    - [48, 16965.2]
  - - [256, 128, 1, 256]
    - [21, 936.229]
  - - [704, 4288, 1, 256]
    - [25, 14976.8]
  - - [256, 448, 1, 3328]
    - [43, 4795.0]
  - - [1408, 6784, 1, 1280]
    - [5, 18563.1]
  - - [64, 2368, 1, 1280]
    - [30, 4948.64]
  - - [64, 6784, 1, 3328]
    - [40, 10152.7]
  - - [2944, 256, 1, 1280]
    - [34, 12267.2]
  - - [5056, 2368, 1, 3328]
    - [26, 19057.2]
  - - [2944, 4288, 1, 256]
    - [11, 17756.7]
  - - [1408, 3584, 1, 1280]
    - [26, 18205.2]
  - - [2368, 64, 1, 256]
    - [18, 3391.37]
  - - [64, 448, 1, 3328]
    - [37, 1428.45]
  - - [1024, 1408, 1, 1280]
    - [11, 14536.0]
  - - [1856, 704, 1, 256]
    - [24, 11646.8]
  - - [1408, 448, 1, 3328]
    - [24, 10772.0]
  - - [2368, 256, 1, 256]
    - [24, 7853.71]
  - - [2368, 6784, 1, 3328]
    - [5, 19701.8]
  - - [5056, 704, 1, 1280]
    - [51, 15988.4]
  - - [1856, 4288, 1, 3328]
    - [26, 18758.8]
  - - [1408, 5888, 1, 256]
    - [26, 17985.7]
  - - [4288, 64, 1, 1280]
    - [20, 6336.09]
  - - [256, 64, 1, 256]
    - [23, 485.452]
  - - [704, 1856, 1, 256]
    - [24, 11712.0]
  - - [5888, 64, 1, 1280]
    - [20, 8588.76]
  - - [3584, 704, 1, 1280]
    - [51, 15367.4]
  - - [256, 128, 1, 1280]
    - [41, 1485.24]
  - - [256, 2368, 1, 1280]
    - [24, 9907.38]
  - - [3584, 448, 1, 3328]
    - [5, 13329.5]
  - - [704, 2368, 1, 3328]
    - [35, 13847.9]
  - - [2944, 448, 1, 256]
    - [5, 11077.5]
  - - [448, 5056, 1, 3328]
    - [5, 15406.7]
  - - [2368, 128, 1, 1280]
    - [20, 6987.99]
  - - [4288, 448, 1, 256]
    - [49, 12197.0]
  - - [448, 5888, 1, 256]
    - [11, 13272.1]
  - - [64, 5056, 1, 1280]
    - [1, 7503.4]
  - - [5888, 2368, 1, 256]
    - [26, 17656.1]
  - - [704, 448, 1, 3328]
    - [38, 7544.72]
  - - [6784, 704, 1, 3328]
    - [5, 17228.5]
  - - [128, 64, 1, 1280]
    - [41, 387.787]
  - - [1408, 2944, 1, 3328]
    - [36, 18672.2]
  - - [64, 1024, 1, 256]
    - [14, 1839.61]
  - - [5056, 64, 1, 3328]
    - [32, 7969.83]
  - - [2368, 448, 1, 1280]
    - [34, 11293.2]
  - - [1408, 256, 1, 1280]
    - [24, 7804.02]
  - - [1856, 448, 1, 3328]
    - [25, 12261.6]
  - - [128, 5056, 1, 256]
    - [3, 8738.13]
  - - [2368, 704, 1, 256]
    - [5, 11724.5]
  - - [3584, 2368, 1, 256]
    - [25, 16681.9]
  - - [5888, 5056, 1, 1280]
    - [11, 19491.6]
  - - [128, 1024, 1, 1280]
    - [21, 4993.22]
  - - [64, 704, 1, 256]
    - [14, 1347.47]
  - - [4288, 256, 1, 1280]
    - [24, 11662.4]
  - - [3584, 3584, 1, 3328]
    - [5, 19436.7]
  - - [704, 704, 1, 256]
    - [24, 7851.34]
  - - [5888, 6784, 1, 256]
    - [26, 19086.4]
  - - [4288, 2944, 1, 3328]
    - [5, 19014.9]
  - - [1856, 64, 1, 256]
    - [21, 2992.98]
  - - [4288, 128, 1, 3328]
    - [0, 10116.4]
  - - [4288, 704, 1, 1280]
    - [51, 15615.9]
  - - [256, 5056, 1, 1280]
    - [24, 13733.0]
  - - [6784, 5888, 1, 1280]
    - [5, 19846.8]
  - - [704, 128, 1, 256]
    - [12, 2306.87]
  - - [5888, 4288, 1, 1280]
    - [5, 19528.4]
  - - [448, 256, 1, 1280]
    - [21, 4421.71]
  - - [256, 1024, 1, 256]
    - [7, 4905.62]
  - - [256, 1408, 1, 1280]
    - [7, 7825.19]
  - - [3584, 1024, 1, 3328]
    - [11, 18253.5]
  - - [1408, 1856, 1, 1280]
    - [51, 15904.1]
  - - [5888, 448, 1, 3328]
    - [11, 15238.6]
  - - [704, 5888, 1, 1280]
    - [5, 18051.8]
  - - [1024, 6784, 1, 3328]
    - [36, 18578.4]
  - - [704, 2944, 1, 1280]
    - [5, 16722.8]
  - - [6784, 64, 1, 3328]
    - [20, 10017.6]
  - - [5056, 2944, 1, 3328]
    - [5, 19423.8]
  - - [448, 128, 1, 256]
    - [12, 1504.1]
  - - [1408, 1408, 1, 3328]
    - [25, 16431.7]
  - - [1856, 128, 1, 1280]
    - [22, 7039.05]
  - - [448, 4288, 1, 1280]
    - [25, 15515.6]
  - - [64, 3584, 1, 256]
    - [4, 4616.37]
  - - [128, 2944, 1, 3328]
    - [20, 9281.32]
  - - [3584, 704, 1, 256]
    - [49, 13323.5]
  - - [2944, 448, 1, 3328]
    - [25, 13754.5]
  - - [3584, 1408, 1, 3328]
    - [36, 18502.1]
  - - [2368, 1024, 1, 1280]
    - [11, 16246.8]
  - - [1856, 6784, 1, 256]
    - [5, 17671.7]
  - - [4288, 448, 1, 3328]
    - [29, 15725.0]
  - - [4288, 3584, 1, 1280]
    - [26, 19521.4]
  - - [5888, 1024, 1, 3328]
    - [26, 18404.7]
  - - [704, 6784, 1, 1280]
    - [26, 17144.9]
  - - [1024, 2944, 1, 3328]
    - [36, 17430.1]
  - - [2368, 448, 1, 3328]
    - [24, 11592.3]
  - - [704, 5056, 1, 1280]
    - [11, 17544.9]
  - - [1024, 5888, 1, 1280]
    - [36, 18305.3]
  - - [2944, 1856, 1, 256]
    - [25, 16085.6]
  - - [5056, 64, 1, 256]
    - [1, 5478.67]
  - - [3584, 5056, 1, 256]
    - [11, 18549.7]
  - - [5888, 5056, 1, 3328]
    - [36, 19739.5]
  - - [128, 5056, 1, 3328]
    - [13, 11797.6]
  - - [3584, 6784, 1, 1280]
    - [36, 19576.4]
  - - [4288, 1856, 1, 256]
    - [26, 16865.8]
  - - [1856, 5888, 1, 256]
    - [5, 17970.2]
  - - [256, 256, 1, 256]
    - [21, 1777.25]
  - - [4288, 4288, 1, 3328]
    - [5, 19439.3]
  - - [4288, 1408, 1, 1280]
    - [36, 18274.7]
  - - [64, 1856, 1, 256]
    - [30, 2923.91]
  - - [4288, 2368, 1, 256]
    - [5, 17357.2]
  - - [2944, 5056, 1, 1280]
    - [11, 19295.0]
  - - [6784, 64, 1, 256]
    - [24, 6647.67]
  - - [6784, 2368, 1, 3328]
    - [26, 19106.9]
  - - [256, 1024, 1, 1280]
    - [38, 7489.83]
  - - [4288, 1856, 1, 3328]
    - [26, 18692.1]
  - - [1856, 2944, 1, 1280]
    - [5, 17780.2]
  - - [3584, 64, 1, 1280]
    - [38, 6600.75]
  - - [3584, 1024, 1, 1280]
    - [25, 17821.0]
  - - [1024, 4288, 1, 256]
    - [35, 15206.6]
  - - [5888, 3584, 1, 3328]
    - [5, 19671.7]
  - - [5056, 3584, 1, 3328]
    - [5, 19764.1]
  - - [1408, 128, 1, 3328]
    - [19, 6252.98]
  - - [2368, 1408, 1, 1280]
    - [11, 16279.0]
  - - [5056, 2944, 1, 1280]
    - [5, 19238.8]
  - - [128, 2368, 1, 256]
    - [19, 5271.37]
  - - [3584, 256, 1, 256]
    - [5, 9952.59]
  - - [1024, 6784, 1, 256]
    - [36, 16701.6]
  - - [3584, 2944, 1, 256]
    - [26, 17200.3]
  - - [448, 128, 1, 3328]
    - [45, 2704.66]
  - - [3584, 1408, 1, 1280]
    - [26, 18148.0]
  - - [64, 4288, 1, 3328]
    - [20, 6795.46]
  - - [5056, 6784, 1, 3328]
    - [26, 19452.7]
  - - [128, 2944, 1, 256]
    - [10, 6247.99]
  - - [3584, 4288, 1, 256]
    - [26, 18502.0]
  - - [1856, 6784, 1, 3328]
    - [5, 19026.8]
  - - [3584, 128, 1, 3328]
    - [20, 10643.7]
  - - [128, 256, 1, 1280]
    - [41, 1481.04]
  - - [1024, 448, 1, 1280]
    - [34, 9905.58]
  - - [5056, 1408, 1, 256]
    - [26, 17153.9]
  - - [64, 256, 1, 1280]
    - [41, 764.268]
  - - [256, 704, 1, 256]
    - [24, 3372.61]
  - - [5888, 5888, 1, 256]
    - [26, 18967.2]
  - - [4288, 1024, 1, 1280]
    - [11, 17381.1]
  - - [5888, 128, 1, 3328]
    - [3, 12987.7]
  - - [448, 6784, 1, 3328]
    - [5, 17530.8]
  - - [2944, 1408, 1, 1280]
    - [26, 18316.1]
  - - [2944, 1856, 1, 3328]
    - [5, 18133.6]
  - - [128, 1024, 1, 256]
    - [21, 3302.6]
  - - [3584, 5888, 1, 1280]
    - [11, 19503.3]
  - - [6784, 1856, 1, 1280]
    - [5, 18769.9]
  - - [5888, 256, 1, 3328]
    - [25, 15582.7]
  - - [1856, 5888, 1, 3328]
    - [5, 19602.9]
  - - [3584, 1408, 1, 256]
    - [26, 16528.2]
  - - [64, 448, 1, 256]
    - [42, 865.57]
  - - [704, 3584, 1, 3328]
    - [11, 17221.1]
  - - [5056, 448, 1, 1280]
    - [5, 15151.1]
  - - [4288, 704, 1, 256]
    - [51, 13741.1]
  - - [1408, 704, 1, 1280]
    - [16, 13053.3]
  - - [2944, 1024, 1, 256]
    - [25, 15073.3]
  - - [448, 1408, 1, 1280]
    - [24, 10309.0]
  - - [2368, 4288, 1, 3328]
    - [5, 19047.0]
  - - [64, 64, 1, 256]
    - [18, 106.563]
  - - [704, 1408, 1, 1280]
    - [25, 13912.0]
  - - [6784, 5056, 1, 256]
    - [11, 18727.1]
  - - [3584, 5056, 1, 3328]
    - [11, 19680.0]
  - - [4288, 5888, 1, 256]
    - [5, 18723.7]
  - - [448, 2944, 1, 256]
    - [5, 11135.9]
  - - [2944, 6784, 1, 256]
    - [26, 18471.3]
  - - [2368, 2368, 1, 1280]
    - [5, 18224.4]
  - - [1856, 3584, 1, 1280]
    - [5, 18584.0]
  - - [64, 2944, 1, 256]
    - [21, 3992.92]
  - - [5056, 3584, 1, 1280]
    - [5, 19583.3]
  - - [256, 5888, 1, 256]
    - [11, 12593.9]
  - - [128, 256, 1, 3328]
    - [41, 1605.59]
  - - [1856, 1408, 1, 3328]
    - [5, 17714.0]
  - - [1024, 4288, 1, 3328]
    - [11, 17611.1]
  - - [448, 2368, 1, 256]
    - [24, 9727.12]
  - - [64, 1408, 1, 1280]
    - [18, 3604.48]
  - - [2944, 2368, 1, 3328]
    - [26, 18644.2]
  - - [704, 128, 1, 3328]
    - [44, 3933.54]
  - - [1408, 128, 1, 256]
    - [19, 3870.58]
  - - [1024, 1856, 1, 1280]
    - [11, 15303.8]
  - - [6784, 1856, 1, 256]
    - [5, 17540.9]
  - - [1024, 5888, 1, 256]
    - [36, 16532.8]
  - - [64, 2944, 1, 1280]
    - [31, 5957.82]
  - - [64, 5056, 1, 256]
    - [1, 5627.55]
  - - [1408, 2368, 1, 256]
    - [25, 14496.3]
  - - [2944, 704, 1, 3328]
    - [17, 16905.7]
  - - [64, 128, 1, 1280]
    - [41, 387.787]
  - - [2944, 2944, 1, 1280]
    - [5, 18719.5]
  - - [6784, 256, 1, 3328]
    - [25, 14312.0]
  - - [1408, 5056, 1, 256]
    - [11, 17257.8]
  - - [5056, 128, 1, 3328]
    - [13, 11766.7]
  - - [128, 128, 1, 1280]
    - [41, 759.838]
  - - [448, 704, 1, 256]
    - [15, 5021.17]
  - - [1856, 256, 1, 3328]
    - [24, 10884.2]
  - - [2944, 128, 1, 3328]
    - [20, 9297.84]
  - - [704, 256, 1, 1280]
    - [38, 5339.97]
  - - [256, 448, 1, 1280]
    - [43, 4400.5]
  - - [5056, 256, 1, 256]
    - [24, 11505.2]
  - - [64, 2368, 1, 3328]
    - [41, 5297.95]
  - - [256, 704, 1, 3328]
    - [38, 5940.79]
  - - [64, 6784, 1, 1280]
    - [2, 9595.05]
  - - [1408, 4288, 1, 256]
    - [11, 16597.9]
  - - [5888, 2368, 1, 1280]
    - [26, 18710.4]
  - - [128, 256, 1, 256]
    - [21, 961.996]
  - - [64, 128, 1, 256]
    - [14, 267.494]
  - - [2368, 5888, 1, 1280]
    - [5, 19376.8]
  - - [5888, 256, 1, 1280]
    - [25, 14998.3]
  - - [704, 1024, 1, 1280]
    - [34, 11733.8]
  - - [2368, 1856, 1, 3328]
    - [5, 17603.7]
  - - [2944, 704, 1, 256]
    - [51, 13211.6]
  - - [2368, 6784, 1, 1280]
    - [5, 19495.8]
  - - [1856, 4288, 1, 1280]
    - [36, 18467.9]
  - - [704, 3584, 1, 256]
    - [11, 14951.9]
  - - [704, 2944, 1, 3328]
    - [25, 17151.2]
  - - [1856, 5056, 1, 3328]
    - [5, 18539.7]
  - - [3584, 5056, 1, 1280]
    - [11, 19509.5]
  - - [2944, 1024, 1, 3328]
    - [11, 17415.6]
  - - [256, 4288, 1, 256]
    - [24, 9895.01]
  - - [1408, 6784, 1, 256]
    - [5, 17085.5]
  - - [6784, 1408, 1, 3328]
    - [5, 18758.3]
  - - [1024, 2368, 1, 1280]
    - [11, 16018.7]
  - - [704, 64, 1, 256]
    - [14, 1253.73]
  - - [256, 2368, 1, 3328]
    - [34, 10373.6]
  - - [6784, 2944, 1, 1280]
    - [5, 19354.0]
  - - [3584, 448, 1, 1280]
    - [5, 13014.2]
  - - [2944, 6784, 1, 3328]
    - [5, 19579.1]
  - - [448, 5056, 1, 1280]
    - [11, 15125.8]
  - - [64, 2944, 1, 3328]
    - [19, 6504.65]
  - - [128, 1408, 1, 256]
    - [33, 3870.58]
  - - [64, 64, 1, 1280]
    - [37, 182.552]
  - - [5888, 704, 1, 256]
    - [51, 14787.6]
  - - [256, 5888, 1, 3328]
    - [25, 15735.2]
  - - [6784, 4288, 1, 256]
    - [5, 18547.0]
  - - [5888, 256, 1, 256]
    - [5, 12367.8]
  - - [128, 3584, 1, 256]
    - [3, 7645.87]
  - - [6784, 1024, 1, 1280]
    - [26, 18132.0]
  - - [704, 448, 1, 1280]
    - [27, 7067.61]
  - - [128, 64, 1, 3328]
    - [41, 414.583]
  - - [448, 64, 1, 256]
    - [23, 826.58]
  - - [2944, 704, 1, 1280]
    - [17, 16207.8]
  - - [6784, 3584, 1, 1280]
    - [5, 19660.4]
  - - [1024, 704, 1, 1280]
    - [24, 11615.6]
  - - [1408, 2944, 1, 1280]
    - [36, 18326.2]
  - - [256, 1856, 1, 256]
    - [34, 7380.75]
  - - [1408, 2368, 1, 3328]
    - [5, 16777.6]
  - - [1024, 3584, 1, 256]
    - [35, 15391.9]
  - - [2368, 2944, 1, 256]
    - [26, 16862.0]
  - - [704, 1856, 1, 1280]
    - [34, 13854.1]
  - - [1408, 256, 1, 3328]
    - [40, 8548.82]
  - - [5888, 128, 1, 256]
    - [3, 9608.47]
  - - [2944, 5888, 1, 256]
    - [26, 18708.2]
  - - [3584, 1856, 1, 256]
    - [26, 16065.0]
  - - [2368, 448, 1, 256]
    - [24, 9644.22]
  - - [4288, 256, 1, 3328]
    - [24, 11998.3]
  - - [1408, 64, 1, 256]
    - [30, 2288.56]
  - - [704, 4288, 1, 3328]
    - [5, 17444.1]
  - - [4288, 2944, 1, 1280]
    - [5, 18875.0]
  - - [1024, 64, 1, 256]
    - [14, 1762.31]
  - - [64, 2368, 1, 256]
    - [18, 3415.26]
  - - [4288, 5056, 1, 3328]
    - [26, 19118.0]
  - - [2944, 256, 1, 256]
    - [24, 9685.64]
  - - [1024, 128, 1, 3328]
    - [43, 5480.0]
  - - [256, 5056, 1, 3328]
    - [24, 14117.6]
  - - [5056, 2368, 1, 256]
    - [26, 17639.2]
  - - [4288, 704, 1, 3328]
    - [51, 15975.1]
  - - [448, 3584, 1, 256]
    - [11, 11443.3]
  - - [2368, 64, 1, 1280]
    - [18, 4958.76]
  - - [1408, 448, 1, 256]
    - [24, 8106.46]
  - - [2944, 5888, 1, 1280]
    - [26, 19561.9]
  - - [5888, 3584, 1, 256]
    - [5, 18526.2]
  - - [1408, 1856, 1, 3328]
    - [51, 16318.1]
  - - [6784, 1408, 1, 1280]
    - [5, 18502.4]
  - - [704, 2944, 1, 256]
    - [25, 14324.5]
  - - [4288, 64, 1, 256]
    - [1, 4798.81]
  - - [2944, 5888, 1, 3328]
    - [26, 19699.6]
  - - [64, 4288, 1, 1280]
    - [1, 6419.46]
  - - [6784, 64, 1, 1280]
    - [20, 9362.29]
  - - [1408, 6784, 1, 3328]
    - [5, 18852.7]
  - - [1408, 64, 1, 3328]
    - [18, 3921.19]
  - - [448, 1024, 1, 3328]
    - [24, 10520.4]
  - - [448, 4288, 1, 3328]
    - [25, 15935.1]
  - - [704, 2368, 1, 256]
    - [5, 11934.3]
  - - [2944, 448, 1, 1280]
    - [5, 13322.3]
  - - [5888, 2368, 1, 3328]
    - [26, 18874.7]
  - - [4288, 5056, 1, 256]
    - [11, 18639.6]
  - - [4288, 448, 1, 1280]
    - [29, 15066.9]
  - - [5888, 704, 1, 3328]
    - [51, 16633.4]
  - - [4288, 3584, 1, 3328]
    - [26, 19714.3]
  - - [5056, 128, 1, 256]
    - [20, 8850.16]
  - - [128, 64, 1, 256]
    - [18, 234.057]
  - - [448, 1024, 1, 256]
    - [24, 7231.56]
  - - [6784, 6784, 1, 3328]
    - [36, 20206.2]
  - - [704, 5056, 1, 3328]
    - [11, 17900.4]
  - - [1024, 64, 1, 1280]
    - [37, 2826.35]
  - - [64, 1024, 1, 3328]
    - [37, 3087.54]
  - - [2368, 2944, 1, 3328]
    - [26, 18643.0]
  - - [448, 448, 1, 1280]
    - [22, 5935.79]
  - - [2368, 3584, 1, 256]
    - [11, 17309.2]
  - - [1024, 256, 1, 1280]
    - [38, 7543.71]
  - - [128, 5056, 1, 1280]
    - [6, 11255.1]
  - - [3584, 2368, 1, 1280]
    - [5, 18308.0]
  - - [1856, 1856, 1, 256]
    - [25, 14916.3]
  - - [4288, 1408, 1, 3328]
    - [36, 18616.9]
  - - [3584, 64, 1, 3328]
    - [38, 7472.23]
  - - [4288, 5056, 1, 1280]
    - [26, 18968.8]
  - - [5888, 6784, 1, 1280]
    - [11, 19759.7]
  - - [256, 1024, 1, 3328]
    - [38, 8486.49]
  - - [1856, 64, 1, 3328]
    - [43, 4976.25]
  - - [5888, 1408, 1, 3328]
    - [36, 19244.3]
  - - [256, 5056, 1, 256]
    - [24, 11634.5]
  - - [1408, 1024, 1, 256]
    - [5, 12402.5]
  - - [448, 256, 1, 256]
    - [21, 2912.71]
  - - [1408, 256, 1, 256]
    - [24, 5738.48]
  - - [2368, 5056, 1, 256]
    - [26, 17623.0]
  - - [128, 5888, 1, 3328]
    - [10, 13118.2]
  - - [1024, 5056, 1, 256]
    - [36, 16436.0]
  - - [2368, 1408, 1, 3328]
    - [5, 16694.8]
  - - [5888, 448, 1, 256]
    - [5, 12946.4]
  - - [6784, 5056, 1, 1280]
    - [11, 19527.4]
  - - [4288, 6784, 1, 1280]
    - [26, 19420.7]
  - - [128, 704, 1, 256]
    - [21, 2306.87]
  - - [1024, 128, 1, 256]
    - [21, 3177.5]
  - - [448, 128, 1, 1280]
    - [37, 2473.06]
  - - [1024, 64, 1, 3328]
    - [43, 3087.54]
  - - [64, 3584, 1, 1280]
    - [22, 6796.33]
  - - [6784, 1408, 1, 256]
    - [5, 17133.4]
  - - [5888, 4288, 1, 256]
    - [11, 18551.7]
  - - [5056, 5888, 1, 256]
    - [5, 18999.4]
  - - [2368, 1024, 1, 256]
    - [5, 14031.6]
  - - [1856, 6784, 1, 1280]
    - [5, 18820.8]
  - - [3584, 128, 1, 1280]
    - [20, 9959.34]
  - - [4288, 128, 1, 256]
    - [3, 7505.83]
  - - [4288, 3584, 1, 256]
    - [26, 18488.1]
  - - [64, 256, 1, 3328]
    - [37, 822.165]
  - - [5056, 1856, 1, 1280]
    - [48, 18276.7]
  - - [1408, 1024, 1, 3328]
    - [25, 15096.5]
  - - [2368, 256, 1, 3328]
    - [24, 10360.8]
  - - [5888, 3584, 1, 1280]
    - [5, 19512.3]
  - - [5888, 128, 1, 1280]
    - [3, 12508.9]
  - - [1024, 2944, 1, 256]
    - [35, 14550.4]
  - - [448, 6784, 1, 1280]
    - [25, 17050.4]
  - - [256, 3584, 1, 1280]
    - [25, 12854.6]
  - - [2944, 1856, 1, 1280]
    - [5, 17794.6]
  - - [128, 5888, 1, 256]
    - [10, 9924.79]
  - - [2368, 3584, 1, 3328]
    - [5, 18695.0]
  - - [3584, 5888, 1, 3328]
    - [11, 19671.2]
  - - [2944, 3584, 1, 1280]
    - [5, 18749.5]
  - - [1856, 5888, 1, 1280]
    - [5, 19356.8]
  - - [256, 256, 1, 1280]
    - [39, 2841.67]
  - - [5056, 448, 1, 3328]
    - [5, 15434.5]
  - - [4288, 1408, 1, 256]
    - [26, 16727.3]
  - - [3584, 64, 1, 256]
    - [19, 4587.52]
  - - [64, 1856, 1, 3328]
    - [43, 4946.33]
  - - [1024, 1024, 1, 256]
    - [34, 11001.5]
  - - [4288, 2368, 1, 1280]
    - [5, 18814.6]
  - - [2944, 5056, 1, 256]
    - [11, 18270.6]
  - - [256, 128, 1, 3328]
    - [41, 1613.19]
  - - [6784, 2368, 1, 256]
    - [26, 18018.4]
  - - [1024, 1024, 1, 1024]
    - [46, 12404.6]
  - - [2944, 64, 1, 3328]
    - [19, 6499.26]
  - - [128, 1408, 1, 3328]
    - [19, 6221.84]
  - - [1856, 2944, 1, 256]
    - [25, 16204.8]
  - - [64, 5888, 1, 1280]
    - [20, 8637.98]
  - - [1856, 1408, 1, 1280]
    - [5, 17349.4]
  - - [704, 1024, 1, 256]
    - [24, 9264.53]
  - - [1024, 4288, 1, 1280]
    - [11, 17244.6]
  - - [2368, 5056, 1, 3328]
    - [36, 19091.6]
  - - [1024, 1856, 1, 3328]
    - [35, 15727.6]
  - - [704, 704, 1, 1280]
    - [24, 10658.4]
  - - [128, 2368, 1, 1280]
    - [19, 6998.07]
  - - [3584, 256, 1, 1280]
    - [25, 12798.7]
  - - [704, 3584, 1, 1280]
    - [11, 16856.0]
  - - [128, 704, 1, 3328]
    - [44, 3925.3]
  - - [4288, 6784, 1, 256]
    - [5, 18816.9]
  - - [3584, 2944, 1, 3328]
    - [5, 18807.7]
  - - [128, 1856, 1, 256]
    - [4, 4781.24]
  - - [64, 4288, 1, 256]
    - [8, 4798.81]
  - - [5888, 2944, 1, 256]
    - [26, 18422.3]
  - - [5056, 128, 1, 1280]
    - [13, 11218.5]
  - - [448, 1856, 1, 3328]
    - [25, 12318.3]
  - - [5056, 4288, 1, 256]
    - [11, 18554.8]
  - - [1024, 448, 1, 256]
    - [34, 7057.72]
  - - [2944, 128, 1, 1280]
    - [32, 8662.8]
  - - [6784, 1024, 1, 3328]
    - [26, 18351.9]
  - - [64, 256, 1, 256]
    - [14, 509.017]
  - - [704, 256, 1, 3328]
    - [38, 5973.96]
  - - [256, 704, 1, 1280]
    - [38, 5379.82]
  - - [5888, 5888, 1, 1280]
    - [5, 19749.9]
  - - [448, 5888, 1, 1280]
    - [5, 15030.3]
  - - [2944, 1408, 1, 256]
    - [36, 16477.6]
  - - [256, 2944, 1, 1280]
    - [24, 12254.7]
  - - [1024, 2944, 1, 1280]
    - [36, 16888.8]
  - - [2368, 5888, 1, 3328]
    - [5, 19605.9]
  - - [704, 1024, 1, 3328]
    - [24, 12300.8]
  - - [2368, 1856, 1, 1280]
    - [5, 17201.6]
  - - [1856, 448, 1, 1280]
    - [5, 11619.0]
  - - [128, 6784, 1, 256]
    - [3, 9681.97]
  - - [5888, 4288, 1, 3328]
    - [11, 19676.7]
  - - [6784, 704, 1, 1280]
    - [5, 16861.2]
  - - [5056, 448, 1, 256]
    - [5, 13107.2]
  - - [1856, 5056, 1, 1280]
    - [48, 18370.6]
  - - [2944, 1024, 1, 1280]
    - [11, 17038.0]
  - - [2368, 4288, 1, 256]
    - [11, 17601.7]
  - - [1024, 2368, 1, 3328]
    - [11, 16380.8]
  - - [64, 704, 1, 3328]
    - [37, 2129.92]
  - - [704, 1408, 1, 256]
    - [5, 10975.6]
  - - [4288, 5888, 1, 3328]
    - [5, 19773.1]
  - - [256, 1408, 1, 256]
    - [7, 5767.17]
  - - [448, 2944, 1, 1280]
    - [5, 13441.1]
  - - [2944, 6784, 1, 1280]
    - [5, 19388.0]
  - - [256, 6784, 1, 1280]
    - [5, 14098.1]
  - - [1856, 3584, 1, 256]
    - [11, 17042.5]
  - - [128, 448, 1, 3328]
    - [43, 2710.81]
  - - [1856, 256, 1, 256]
    - [24, 7380.75]
  - - [128, 2368, 1, 3328]
    - [32, 7492.05]
  - - [256, 5888, 1, 1280]
    - [5, 15225.5]
  - - [448, 2368, 1, 3328]
    - [24, 11601.5]
  - - [64, 1408, 1, 256]
    - [18, 2288.56]
  - - [2944, 2368, 1, 256]
    - [26, 16938.8]
  - - [1856, 448, 1, 256]
    - [5, 9019.53]
  - - [1024, 1856, 1, 256]
    - [35, 12967.5]
  - - [6784, 3584, 1, 3328]
    - [5, 19818.5]
  - - [1024, 704, 1, 3328]
    - [24, 12300.8]
  - - [1024, 5888, 1, 3328]
    - [36, 18637.2]
  - - [1408, 2368, 1, 1280]
    - [5, 16303.9]
  - - [128, 1408, 1, 1280]
    - [19, 5676.35]
  - - [256, 64, 1, 3328]
    - [41, 817.235]
  - - [128, 1856, 1, 3328]
    - [38, 7751.24]
  - - [2944, 2944, 1, 256]
    - [5, 17226.6]
  - - [6784, 256, 1, 256]
    - [5, 12003.1]
  - - [128, 4288, 1, 1280]
    - [6, 9779.31]
  - - [5888, 1408, 1, 256]
    - [26, 17650.7]
  - - [128, 128, 1, 256]
    - [18, 504.123]
  - - [448, 704, 1, 3328]
    - [40, 7553.4]
  - - [448, 1856, 1, 256]
    - [5, 9112.2]
  - - [1856, 704, 1, 3328]
    - [24, 14255.3]
  - - [5888, 6784, 1, 3328]
    - [25, 19142.0]
  - - [704, 4288, 1, 1280]
    - [11, 17109.5]
  - - [704, 256, 1, 256]
    - [7, 3353.0]
  - - [6784, 448, 1, 3328]
    - [51, 15955.6]
- null
