library/src/blas3/Tensile/Logic/asm_full/arcturus_Cijk_Alik_Bljk_SB.yaml
- {MinimumRequiredVersion: 4.6.0}
- arcturus
- gfx908
- [Device 7380, Device 7388, Device 738c]
    SolutionIndex: 0
    SolutionNameMin: Cijk_Alik_Bljk_SB_MT064x008x32_GRVW02_GSU32_SNLL0_TT04_02_VW02_WG16_04_04
    SolutionIndex: 1
    SolutionNameMin: Cijk_Alik_Bljk_SB_MT064x008x32_GRVW04_GSU32_SNLL0_TT04_04_VW04_WG16_02_08
    SolutionIndex: 2
    SolutionNameMin: Cijk_Alik_Bljk_SB_MT064x016x64_GRVW04_GSU32_SNLL0_TT04_04_VW04_WG16_04_04
    SolutionIndex: 3
    SolutionNameMin: Cijk_Alik_Bljk_SB_MT064x016x64_GRVW04_GSU32_SNLL0_TT04_04_VW04_WG16_04_04
    SolutionIndex: 4
    SolutionNameMin: Cijk_Alik_Bljk_SB_MT036x048x16_GRVW01_GSU02_SNLL0_TT03_03_VW01_WG12_16_01
    SolutionIndex: 5
    SolutionNameMin: Cijk_Alik_Bljk_SB_MT048x036x16_GRVW01_GSU08_SNLL0_TT06_03_VW01_WG08_12_02
    SolutionIndex: 6
    SolutionNameMin: Cijk_Alik_Bljk_SB_MT048x048x16_GRVW02_GSU08_SNLL0_TT06_04_VW02_WG08_12_02
    SolutionIndex: 7
    SolutionNameMin: Cijk_Alik_Bljk_SB_MT048x048x16_GRVW01_GSU08_SNLL0_TT03_03_VW01_WG16_16_01
    SolutionIndex: 8
    SolutionNameMin: Cijk_Alik_Bljk_SB_MT032x008x08_GRVW02_GSU01_SNLL0_TT02_02_VW02_WG16_04_01
    SolutionIndex: 9
    SolutionNameMin: Cijk_Alik_Bljk_SB_MT016x016x08_GRVW02_GSU01_SNLL0_TT02_02_VW02_WG08_08_01
    SolutionIndex: 10
    SolutionNameMin: Cijk_Alik_Bljk_SB_MT032x016x08_GRVW02_GSU01_SNLL0_TT04_02_VW02_WG08_08_01
    SolutionIndex: 11
    SolutionNameMin: Cijk_Alik_Bljk_SB_MT032x032x08_GRVW04_GSU01_SNLL0_TT04_04_VW04_WG08_08_01
    SolutionIndex: 12
    SolutionNameMin: Cijk_Alik_Bljk_SB_MT032x016x08_GRVW02_GSU01_SNLL0_TT02_02_VW02_WG16_08_01
    SolutionIndex: 13
    SolutionNameMin: Cijk_Alik_Bljk_SB_MT016x016x08_GRVW02_GSU01_SNLL0_TT02_02_VW02_WG08_08_01
    SolutionIndex: 14
    SolutionNameMin: Cijk_Alik_Bljk_SB_MT032x032x08_GRVW04_GSU01_SNLL0_TT04_04_VW04_WG08_08_01
    SolutionIndex: 15
    SolutionNameMin: Cijk_Alik_Bljk_SB_MT032x016x08_GRVW02_GSU01_SNLL0_TT02_02_VW02_WG16_08_01
    SolutionIndex: 16
    SolutionNameMin: Cijk_Alik_Bljk_SB_MT064x008x16_GRVW02_GSU01_SNLL0_TT02_02_VW02_WG32_04_01
    SolutionIndex: 17
    SolutionNameMin: Cijk_Alik_Bljk_SB_MT032x008x16_GRVW02_GSU01_SNLL0_TT02_02_VW02_WG16_04_01
    SolutionIndex: 18
    SolutionNameMin: Cijk_Alik_Bljk_SB_MT016x016x16_GRVW02_GSU01_SNLL0_TT02_02_VW02_WG08_08_01
    SolutionIndex: 19
    SolutionNameMin: Cijk_Alik_Bljk_SB_MT032x016x16_GRVW02_GSU01_SNLL0_TT04_02_VW02_WG08_08_01
    SolutionIndex: 20
    SolutionNameMin: Cijk_Alik_Bljk_SB_MT032x032x16_GRVW04_GSU01_SNLL0_TT04_04_VW04_WG08_08_01
    SolutionIndex: 21
    SolutionNameMin: Cijk_Alik_Bljk_SB_MT032x016x16_GRVW02_GSU01_SNLL0_TT02_02_VW02_WG16_08_01
    SolutionIndex: 22
    SolutionNameMin: Cijk_Alik_Bljk_SB_MT064x016x16_GRVW02_GSU01_SNLL0_TT04_02_VW02_WG16_08_01
    SolutionIndex: 23
    SolutionNameMin: Cijk_Alik_Bljk_SB_MT064x032x16_GRVW04_GSU01_SNLL0_TT04_04_VW04_WG16_08_01
    SolutionIndex: 24
    SolutionNameMin: Cijk_Alik_Bljk_SB_MT064x008x16_GRVW02_GSU01_SNLL0_TT02_02_VW02_WG32_04_01
    SolutionIndex: 25
    SolutionNameMin: Cijk_Alik_Bljk_SB_MT032x008x16_GRVW02_GSU01_SNLL0_TT02_02_VW02_WG16_04_01
    SolutionIndex: 26
    SolutionNameMin: Cijk_Alik_Bljk_SB_MT032x016x16_GRVW02_GSU01_SNLL0_TT02_02_VW02_WG16_08_01
    SolutionIndex: 27
    SolutionNameMin: Cijk_Alik_Bljk_SB_MT064x032x16_GRVW04_GSU01_SNLL0_TT04_04_VW04_WG16_08_01
    SolutionIndex: 28
    SolutionNameMin: Cijk_Alik_Bljk_SB_MT032x032x08_GRVW04_GSU02_SNLL0_TT04_04_VW04_WG08_08_04
    SolutionIndex: 29
    SolutionNameMin: Cijk_Alik_Bljk_SB_MT016x016x08_GRVW02_GSU08_SNLL0_TT02_02_VW02_WG08_08_02
    SolutionIndex: 30
    SolutionNameMin: Cijk_Alik_Bljk_SB_MT032x032x08_GRVW04_GSU08_SNLL0_TT04_04_VW04_WG08_08_04
    SolutionIndex: 31
    SolutionNameMin: Cijk_Alik_Bljk_SB_MT032x016x16_GRVW02_GSU02_SNLL0_TT04_02_VW02_WG08_08_02
    SolutionIndex: 32
    SolutionNameMin: Cijk_Alik_Bljk_SB_MT032x032x16_GRVW04_GSU02_SNLL0_TT04_04_VW04_WG08_08_02
    SolutionIndex: 33
    SolutionNameMin: Cijk_Alik_Bljk_SB_MT064x032x16_GRVW04_GSU02_SNLL0_TT08_04_VW04_WG08_08_02
    SolutionIndex: 34
    SolutionNameMin: Cijk_Alik_Bljk_SB_MT016x016x16_GRVW02_GSU02_SNLL0_TT02_02_VW02_WG08_08_04
    SolutionIndex: 35
    SolutionNameMin: Cijk_Alik_Bljk_SB_MT032x016x16_GRVW02_GSU02_SNLL0_TT04_02_VW02_WG08_08_04
    SolutionIndex: 36
    SolutionNameMin: Cijk_Alik_Bljk_SB_MT032x016x16_GRVW02_GSU02_SNLL0_TT02_02_VW02_WG16_08_02
    SolutionIndex: 37
    SolutionNameMin: Cijk_Alik_Bljk_SB_MT064x016x16_GRVW02_GSU02_SNLL0_TT04_02_VW02_WG16_08_02
    SolutionIndex: 38
    SolutionNameMin: Cijk_Alik_Bljk_SB_MT128x064x16_GRVW04_GSU02_SNLL0_TT08_08_VW04_WG16_08_02
    SolutionIndex: 39
    SolutionNameMin: Cijk_Alik_Bljk_SB_MT032x016x16_GRVW02_GSU02_SNLL0_TT04_02_VW02_WG08_08_02
    SolutionIndex: 40
    SolutionNameMin: Cijk_Alik_Bljk_SB_MT032x032x16_GRVW04_GSU02_SNLL0_TT04_04_VW04_WG08_08_02
    SolutionIndex: 41
    SolutionNameMin: Cijk_Alik_Bljk_SB_MT064x032x16_GRVW04_GSU02_SNLL0_TT08_04_VW04_WG08_08_02
    SolutionIndex: 42
    SolutionNameMin: Cijk_Alik_Bljk_SB_MT016x016x16_GRVW02_GSU02_SNLL0_TT02_02_VW02_WG08_08_04
    SolutionIndex: 43
    SolutionNameMin: Cijk_Alik_Bljk_SB_MT032x016x16_GRVW02_GSU02_SNLL0_TT04_02_VW02_WG08_08_04
    SolutionIndex: 44
    SolutionNameMin: Cijk_Alik_Bljk_SB_MT032x016x16_GRVW02_GSU02_SNLL0_TT02_02_VW02_WG16_08_02
    SolutionIndex: 45
    SolutionNameMin: Cijk_Alik_Bljk_SB_MT128x064x16_GRVW04_GSU02_SNLL0_TT08_08_VW04_WG16_08_02
    SolutionIndex: 46
    SolutionNameMin: Cijk_Alik_Bljk_SB_MT064x016x16_GRVW04_GSU04_SNLL0_TT04_04_VW04_WG16_04_04
    SolutionIndex: 47
    SolutionNameMin: Cijk_Alik_Bljk_SB_MT032x032x16_GRVW04_GSU04_SNLL0_TT04_04_VW04_WG08_08_02
    SolutionIndex: 48
    SolutionNameMin: Cijk_Alik_Bljk_SB_MT064x032x16_GRVW04_GSU04_SNLL0_TT08_04_VW04_WG08_08_02
    SolutionIndex: 49
    SolutionNameMin: Cijk_Alik_Bljk_SB_MT016x016x16_GRVW02_GSU04_SNLL0_TT02_02_VW02_WG08_08_04
    SolutionIndex: 50
    SolutionNameMin: Cijk_Alik_Bljk_SB_MT032x016x16_GRVW02_GSU04_SNLL0_TT04_02_VW02_WG08_08_04
    SolutionIndex: 51
    SolutionNameMin: Cijk_Alik_Bljk_SB_MT032x016x16_GRVW02_GSU04_SNLL0_TT02_02_VW02_WG16_08_02
    SolutionIndex: 52
    SolutionNameMin: Cijk_Alik_Bljk_SB_MT032x016x16_GRVW02_GSU04_SNLL0_TT04_02_VW02_WG08_08_02
    SolutionIndex: 53
    SolutionNameMin: Cijk_Alik_Bljk_SB_MT032x032x16_GRVW04_GSU04_SNLL0_TT04_04_VW04_WG08_08_02
    SolutionIndex: 54
    SolutionNameMin: Cijk_Alik_Bljk_SB_MT064x032x16_GRVW04_GSU04_SNLL0_TT08_04_VW04_WG08_08_02
    SolutionIndex: 55
    SolutionNameMin: Cijk_Alik_Bljk_SB_MT016x016x16_GRVW02_GSU04_SNLL0_TT02_02_VW02_WG08_08_04
    SolutionIndex: 56
    SolutionNameMin: Cijk_Alik_Bljk_SB_MT032x016x16_GRVW02_GSU04_SNLL0_TT04_02_VW02_WG08_08_04
    SolutionIndex: 57
    SolutionNameMin: Cijk_Alik_Bljk_SB_MT032x016x16_GRVW02_GSU04_SNLL0_TT02_02_VW02_WG16_08_02
    SolutionIndex: 58
    SolutionNameMin: Cijk_Alik_Bljk_SB_MT128x064x16_GRVW04_GSU04_SNLL0_TT08_08_VW04_WG16_08_02
    SolutionIndex: 59
    SolutionNameMin: Cijk_Alik_Bljk_SB_MT016x016x16_GRVW02_GSU08_SNLL0_TT02_02_VW02_WG08_08_04
    SolutionIndex: 60
    SolutionNameMin: Cijk_Alik_Bljk_SB_MT016x016x16_GRVW02_GSU08_SNLL0_TT02_02_VW02_WG08_08_04
    SolutionIndex: 61
    SolutionNameMin: Cijk_Alik_Bljk_SB_MT032x016x16_GRVW02_GSU08_SNLL0_TT02_02_VW02_WG16_08_02
    SolutionIndex: 62
    SolutionNameMin: Cijk_Alik_Bljk_SB_MT064x064x24_GRVW04_GSU02_SNLL0_TT08_08_VW04_WG08_08_02
    SolutionIndex: 63
    SolutionNameMin: Cijk_Alik_Bljk_SB_MT064x064x24_GRVW04_GSU02_SNLL0_TT08_08_VW04_WG08_08_02
    SolutionIndex: 64
    SolutionNameMin: Cijk_Alik_Bljk_SB_MT064x064x24_GRVW04_GSU04_SNLL0_TT08_08_VW04_WG08_08_02
    SolutionIndex: 65
    SolutionNameMin: Cijk_Alik_Bljk_SB_MT064x064x24_GRVW04_GSU04_SNLL0_TT08_08_VW04_WG08_08_02
    SolutionIndex: 66
    SolutionNameMin: Cijk_Alik_Bljk_SB_MT032x032x32_GRVW04_GSU02_SNLL0_TT04_04_VW04_WG08_08_02
    SolutionIndex: 67
    SolutionNameMin: Cijk_Alik_Bljk_SB_MT032x032x32_GRVW04_GSU02_SNLL0_TT04_04_VW04_WG08_08_04
    SolutionIndex: 68
    SolutionNameMin: Cijk_Alik_Bljk_SB_MT064x032x32_GRVW04_GSU02_SNLL0_TT08_04_VW04_WG08_08_04
    SolutionIndex: 69
    SolutionNameMin: Cijk_Alik_Bljk_SB_MT128x032x32_GRVW04_GSU02_SNLL0_TT08_04_VW04_WG16_08_02
    SolutionIndex: 70
    SolutionNameMin: Cijk_Alik_Bljk_SB_MT032x032x32_GRVW04_GSU02_SNLL0_TT04_04_VW04_WG08_08_04
    SolutionIndex: 71
    SolutionNameMin: Cijk_Alik_Bljk_SB_MT064x032x32_GRVW04_GSU02_SNLL0_TT08_04_VW04_WG08_08_04
    SolutionIndex: 72
    SolutionNameMin: Cijk_Alik_Bljk_SB_MT064x064x32_GRVW04_GSU02_SNLL0_TT08_08_VW04_WG08_08_04
    SolutionIndex: 73
    SolutionNameMin: Cijk_Alik_Bljk_SB_MT064x032x32_GRVW04_GSU02_SNLL0_TT04_04_VW04_WG16_08_02
    SolutionIndex: 74
    SolutionNameMin: Cijk_Alik_Bljk_SB_MT032x008x32_GRVW02_GSU04_SNLL0_TT02_02_VW02_WG16_04_04
    SolutionIndex: 75
    SolutionNameMin: Cijk_Alik_Bljk_SB_MT064x064x32_GRVW04_GSU04_SNLL0_TT08_08_VW04_WG08_08_02
    SolutionIndex: 76
    SolutionNameMin: Cijk_Alik_Bljk_SB_MT032x032x32_GRVW04_GSU04_SNLL0_TT04_04_VW04_WG08_08_04
    SolutionIndex: 77
    SolutionNameMin: Cijk_Alik_Bljk_SB_MT032x032x32_GRVW04_GSU04_SNLL0_TT04_04_VW04_WG08_08_04
    SolutionIndex: 78
    SolutionNameMin: Cijk_Alik_Bljk_SB_MT064x032x32_GRVW04_GSU04_SNLL0_TT08_04_VW04_WG08_08_04
    SolutionIndex: 79
    SolutionNameMin: Cijk_Alik_Bljk_SB_MT064x032x32_GRVW04_GSU04_SNLL0_TT04_04_VW04_WG16_08_02
    SolutionIndex: 80
    SolutionNameMin: Cijk_Alik_Bljk_SB_MT064x064x16_GRVW04_GSU01_SNLL0_TT04_04_VW04_WG16_16_01
    SolutionIndex: 81
    SolutionNameMin: Cijk_Alik_Bljk_SB_MT064x128x16_GRVW04_GSU01_SNLL0_TT04_08_VW04_WG16_16_01
    SolutionIndex: 82
    SolutionNameMin: Cijk_Alik_Bljk_SB_MT096x128x16_GRVW02_GSU01_SNLL0_TT06_08_VW02_WG16_16_01
    SolutionIndex: 83
    SolutionNameMin: Cijk_Alik_Bljk_SB_MT128x064x16_GRVW04_GSU01_SNLL0_TT08_04_VW04_WG16_16_01
    SolutionIndex: 84
    SolutionNameMin: Cijk_Alik_Bljk_SB_MT064x064x16_GRVW04_GSU01_SNLL0_TT04_04_VW04_WG16_16_01
    SolutionIndex: 85
    SolutionNameMin: Cijk_Alik_Bljk_SB_MT064x128x16_GRVW04_GSU01_SNLL0_TT04_08_VW04_WG16_16_01
    SolutionIndex: 86
    SolutionNameMin: Cijk_Alik_Bljk_SB_MT128x064x16_GRVW04_GSU01_SNLL0_TT08_04_VW04_WG16_16_01
    SolutionIndex: 87
    SolutionNameMin: Cijk_Alik_Bljk_SB_MT064x064x32_GRVW04_GSU01_SNLL0_TT04_04_VW04_WG16_16_01
    SolutionIndex: 88
    SolutionNameMin: Cijk_Alik_Bljk_SB_MT064x064x32_GRVW04_GSU01_SNLL0_TT04_04_VW04_WG16_16_01
    SolutionIndex: 89
    SolutionNameMin: Cijk_Alik_Bljk_SB_MT128x128x08_GRVW04_GSU01_SNLL1_TT08_08_VW04_WG16_16_01
    SolutionIndex: 90
    SolutionNameMin: Cijk_Alik_Bljk_SB_MT128x128x08_GRVW04_GSU01_SNLL1_TT08_08_VW04_WG16_16_01
    SolutionIndex: 91
    SolutionNameMin: Cijk_Alik_Bljk_SB_MT064x064x16_GRVW04_GSU01_SNLL1_TT04_04_VW04_WG16_16_01
    SolutionIndex: 92
    SolutionNameMin: Cijk_Alik_Bljk_SB_MT064x128x16_GRVW04_GSU01_SNLL1_TT04_08_VW04_WG16_16_01
    SolutionIndex: 93
    SolutionNameMin: Cijk_Alik_Bljk_SB_MT096x128x16_GRVW02_GSU01_SNLL1_TT06_08_VW02_WG16_16_01
    SolutionIndex: 94
    SolutionNameMin: Cijk_Alik_Bljk_SB_MT128x064x16_GRVW04_GSU01_SNLL1_TT08_04_VW04_WG16_16_01
    SolutionIndex: 95
    SolutionNameMin: Cijk_Alik_Bljk_SB_MT128x096x16_GRVW02_GSU01_SNLL1_TT08_06_VW02_WG16_16_01
    SolutionIndex: 96
    SolutionNameMin: Cijk_Alik_Bljk_SB_MT128x128x16_GRVW04_GSU01_SNLL1_TT08_08_VW04_WG16_16_01
    SolutionIndex: 97
    SolutionNameMin: Cijk_Alik_Bljk_SB_MT064x064x16_GRVW04_GSU01_SNLL1_TT04_04_VW04_WG16_16_01
    SolutionIndex: 98
    SolutionNameMin: Cijk_Alik_Bljk_SB_MT064x128x16_GRVW04_GSU01_SNLL1_TT04_08_VW04_WG16_16_01
    SolutionIndex: 99
    SolutionNameMin: Cijk_Alik_Bljk_SB_MT096x128x16_GRVW02_GSU01_SNLL1_TT06_08_VW02_WG16_16_01
    SolutionIndex: 100
    SolutionNameMin: Cijk_Alik_Bljk_SB_MT128x064x16_GRVW04_GSU01_SNLL1_TT08_04_VW04_WG16_16_01
    SolutionIndex: 101
    SolutionNameMin: Cijk_Alik_Bljk_SB_MT128x096x16_GRVW02_GSU01_SNLL1_TT08_06_VW02_WG16_16_01
    SolutionIndex: 102
    SolutionNameMin: Cijk_Alik_Bljk_SB_MT128x128x16_GRVW04_GSU01_SNLL1_TT08_08_VW04_WG16_16_01
    SolutionIndex: 103
    SolutionNameMin: Cijk_Alik_Bljk_SB_MT128x128x24_GRVW04_GSU01_SNLL1_TT08_08_VW04_WG16_16_01
    SolutionIndex: 104
    SolutionNameMin: Cijk_Alik_Bljk_SB_MT128x128x24_GRVW04_GSU01_SNLL1_TT08_08_VW04_WG16_16_01
    SolutionIndex: 105
    SolutionNameMin: Cijk_Alik_Bljk_SB_MT064x064x32_GRVW04_GSU01_SNLL1_TT04_04_VW04_WG16_16_01
    SolutionIndex: 107
    SolutionNameMin: Cijk_Alik_Bljk_SB_MT128x128x32_GRVW04_GSU01_SNLL1_TT08_08_VW04_WG16_16_01
    SolutionIndex: 108
    SolutionNameMin: Cijk_Alik_Bljk_SB_MT064x064x32_GRVW04_GSU01_SNLL1_TT04_04_VW04_WG16_16_01
    SolutionIndex: 109
    SolutionNameMin: Cijk_Alik_Bljk_SB_MT064x128x32_GRVW04_GSU01_SNLL1_TT04_08_VW04_WG16_16_01
    SolutionIndex: 110
    SolutionNameMin: Cijk_Alik_Bljk_SB_MT128x128x32_GRVW04_GSU01_SNLL1_TT08_08_VW04_WG16_16_01
    SolutionIndex: 111
    SolutionNameMin: Cijk_Alik_Bljk_SB_MT016x016x04_GRVW02_GSU01_SNLL0_TT02_02_VW02_WG08_08_01
    SolutionIndex: 112
    SolutionNameMin: Cijk_Alik_Bljk_SB_MT032x032x02_GRVW04_GSU01_SNLL0_TT04_04_VW04_WG08_08_01
    SolutionIndex: 113
    SolutionNameMin: Cijk_Alik_Bljk_SB_MT016x016x16_GRVW02_GSU01_SNLL1_TT02_02_VW02_WG08_08_04
    SolutionIndex: 114
    SolutionNameMin: Cijk_Alik_Bljk_SB_MT008x008x08_GRVW02_GSU02_SNLL0_TT02_02_VW02_WG04_04_04
    SolutionIndex: 115
    SolutionNameMin: Cijk_Alik_Bljk_SB_MT008x008x08_GRVW02_GSU04_SNLL0_TT02_02_VW02_WG04_04_04
    SolutionIndex: 116
    SolutionNameMin: Cijk_Alik_Bljk_SB_MT008x008x08_GRVW02_GSU08_SNLL0_TT02_02_VW02_WG04_04_04
    SolutionIndex: 117
    SolutionNameMin: Cijk_Alik_Bljk_SB_MT008x008x08_GRVW02_GSU16_SNLL0_TT02_02_VW02_WG04_04_04
    SolutionIndex: 118
    SolutionNameMin: Cijk_Alik_Bljk_SB_MT016x016x16_GRVW02_GSU16_SNLL0_TT02_02_VW02_WG08_08_04
    SolutionIndex: 119
    SolutionNameMin: Cijk_Alik_Bljk_SB_MT064x032x16_GRVW01_GSU04_LPA01_LPB01_PGR1_PLR1_TT04_04_USFGRO01_VW01_WG16_08_02_WGM01
    SolutionIndex: 120
    SolutionNameMin: Cijk_Alik_Bljk_SB_MT064x016x16_GRVW01_GSU04_LPA01_LPB01_PGR1_PLR1_TT04_04_USFGRO01_VW01_WG16_04_04_WGM01
    SolutionIndex: 121
    SolutionNameMin: Cijk_Alik_Bljk_SB_MT064x016x32_GRVW01_GSU08_LPA01_LPB01_PGR1_PLR1_TT04_04_USFGRO01_VW01_WG16_04_04_WGM01
    SolutionIndex: 122
    SolutionNameMin: Cijk_Alik_Bljk_SB_MT064x016x32_GRVW01_GSU08_LPA01_LPB01_PGR1_PLR1_TT04_04_USFGRO01_VW01_WG16_04_04_WGM08
    SolutionIndex: 123
    SolutionNameMin: Cijk_Alik_Bljk_SB_MT064x032x32_GRVW01_GSU01_LPA02_LPB02_PGR1_PLR1_TT04_08_USFGRO01_VW02_WG16_04_04_WGM01
    SolutionIndex: 124
    SolutionNameMin: Cijk_Alik_Bljk_SB_MT032x008x32_GRVW01_GSU08_LPA02_LPB02_PGR1_PLR1_TT02_02_USFGRO01_VW02_WG16_04_04_WGM01
    SolutionIndex: 125
    SolutionNameMin: Cijk_Alik_Bljk_SB_MT064x032x16_GRVW01_GSU01_LPA04_LPB04_PGR1_PLR1_TT04_04_USFGRO01_VW04_WG16_08_02_WGM01
    SolutionIndex: 126
    SolutionNameMin: Cijk_Alik_Bljk_SB_MT128x064x16_GRVW01_GSU01_LPA04_LPB04_PGR1_PLR1_TT04_08_USFGRO01_VW04_WG32_08_01_WGM01
    SolutionIndex: 127
    SolutionNameMin: Cijk_Alik_Bljk_SB_MT128x064x16_GRVW04_GSU01_LPA04_LPB04_PGR1_PLR1_TT04_08_USFGRO0_VW04_WG32_08_01_WGM01
    SolutionIndex: 128
    SolutionNameMin: Cijk_Alik_Bljk_SB_MT128x128x16_EPS1_GSU1_LPA0_LPB0_PGR1_SNLL1_TT8_8_VW2_WG16_16_1_WGM1
    SolutionIndex: 129
    SolutionNameMin: Cijk_Alik_Bljk_SB_MT64x32x16_EPS1_GSU3_LPA0_LPB0_PGR1_SNLL0_TT4_4_VW2_WG16_8_1_WGM1
    SolutionIndex: 130
    SolutionNameMin: Cijk_Alik_Bljk_SB_MT64x64x16_EPS1_GSU3_LPA0_LPB0_PGR1_SNLL0_TT4_4_VW2_WG16_16_1_WGM1
    SolutionIndex: 131
    SolutionNameMin: Cijk_Alik_Bljk_SB_MT128x128x16_EPS1_GSU3_LPA0_LPB0_PGR1_SNLL0_TT8_8_VW2_WG16_16_1_WGM1
    SolutionIndex: 132
    SolutionNameMin: Cijk_Alik_Bljk_SB_MT64x64x16_EPS1_GSU5_LPA0_LPB0_PGR1_SNLL0_TT4_4_VW2_WG16_16_1_WGM1
    SolutionIndex: 133
    SolutionNameMin: Cijk_Alik_Bljk_SB_MT128x128x16_EPS1_GSU5_LPA0_LPB0_PGR1_SNLL0_TT8_8_VW2_WG16_16_1_WGM1
    SolutionIndex: 134
    SolutionNameMin: Cijk_Alik_Bljk_SB_MT64x64x16_EPS1_GSU5_LPA0_LPB0_PGR1_SNLL0_TT4_4_VW2_WG16_16_1_WGM8
    SolutionIndex: 135
    SolutionNameMin: Cijk_Alik_Bljk_SB_MT64x64x16_EPS1_GSU3_LPA0_LPB0_PGR1_SNLL0_TT4_4_VW2_WG16_16_1_WGM64
    SolutionIndex: 136
    SolutionNameMin: Cijk_Alik_Bljk_SB_MT32x128x16_EPS1_GSU5_LPA0_LPB0_PGR1_SNLL0_TT4_4_VW2_WG8_32_1_WGM64
    SolutionIndex: 137
    SolutionNameMin: Cijk_Alik_Bljk_SB_MT64x64x16_EPS1_GSU5_LPA0_LPB0_PGR1_SNLL0_TT4_4_VW2_WG16_16_1_WGM64
    SolutionIndex: 138
    SolutionNameMin: Cijk_Alik_Bljk_SB_MT128x32x8_EPS1_GSU1_LPA0_LPB0_PGR1_SNLL1_TT4_4_VW4_WG32_8_1_WGM1
    SolutionIndex: 139
    SolutionNameMin: Cijk_Alik_Bljk_SB_MT128x128x16_EPS1_GSU1_LPA0_LPB0_PGR1_SNLL1_TT8_8_VW4_WG16_16_1_WGM1
    SolutionIndex: 140
    SolutionNameMin: Cijk_Alik_Bljk_SB_MT64x64x16_EPS1_GSU3_LPA0_LPB0_PGR1_SNLL0_TT4_4_VW4_WG16_16_1_WGM1
    SolutionIndex: 141
    SolutionNameMin: Cijk_Alik_Bljk_SB_MT128x128x16_EPS1_GSU1_LPA0_LPB0_PGR1_SNLL1_TT8_8_VW4_WG16_16_1_WGM8
    SolutionIndex: 142
    SolutionNameMin: Cijk_Alik_Bljk_SB_MT128x64x16_EPS0_GSU1_LPA0_LPB0_PGR0_SNLL0_TT4_8_VW4_WG32_8_1_WGM8
    SolutionIndex: 143
    SolutionNameMin: Cijk_Alik_Bljk_SB_MT64x32x16_EPS1_GSU1_LPA0_LPB0_PGR1_SNLL1_TT4_4_VW4_WG16_8_1_WGM64
    SolutionIndex: 144
    SolutionNameMin: Cijk_Alik_Bljk_SB_MT128x128x16_EPS1_GSU1_LPA0_LPB0_PGR1_SNLL1_TT8_8_VW4_WG16_16_1_WGM64
    SolutionIndex: 145
    SolutionNameMin: Cijk_Alik_Bljk_SB_MT128x64x16_EPS1_GSU1_LPA0_LPB0_PGR1_SNLL1_TT4_8_VW4_WG32_8_1_WGM64
    SolutionIndex: 146
    SolutionNameMin: Cijk_Alik_Bljk_SB_MT64x64x8_EPS1_GSU1_LPA2_LPB0_PGR1_SNLL1_TT4_8_VW2_WG16_8_1_WGM8
    SolutionIndex: 147
    SolutionNameMin: Cijk_Alik_Bljk_SB_MT64x32x16_EPS1_GSU3_LPA2_LPB0_PGR1_SNLL0_TT4_4_VW2_WG16_8_1_WGM1
    SolutionIndex: 148
    SolutionNameMin: Cijk_Alik_Bljk_SB_MT128x32x16_EPS1_GSU3_LPA2_LPB0_PGR1_SNLL0_TT4_4_VW2_WG32_8_1_WGM1
    SolutionIndex: 149
    SolutionNameMin: Cijk_Alik_Bljk_SB_MT64x64x16_EPS1_GSU5_LPA2_LPB0_PGR1_SNLL0_TT4_4_VW2_WG16_16_1_WGM1
    SolutionIndex: 150
    SolutionNameMin: Cijk_Alik_Bljk_SB_MT64x32x16_EPS0_GSU1_LPA2_LPB0_PGR0_SNLL0_TT4_4_VW2_WG16_8_1_WGM8
    SolutionIndex: 151
    SolutionNameMin: Cijk_Alik_Bljk_SB_MT64x64x16_EPS0_GSU1_LPA2_LPB0_PGR0_SNLL0_TT4_4_VW2_WG16_16_1_WGM8
    SolutionIndex: 152
    SolutionNameMin: Cijk_Alik_Bljk_SB_MT64x32x16_EPS1_GSU3_LPA2_LPB0_PGR1_SNLL0_TT4_4_VW2_WG16_8_1_WGM8
    SolutionIndex: 153
    SolutionNameMin: Cijk_Alik_Bljk_SB_MT64x64x16_EPS1_GSU5_LPA2_LPB0_PGR1_SNLL0_TT4_4_VW2_WG16_16_1_WGM8
    SolutionIndex: 154
    SolutionNameMin: Cijk_Alik_Bljk_SB_MT128x32x16_EPS1_GSU1_LPA2_LPB0_PGR1_SNLL1_TT4_4_VW2_WG32_8_1_WGM64
    SolutionIndex: 155
    SolutionNameMin: Cijk_Alik_Bljk_SB_MT64x32x16_EPS1_GSU5_LPA2_LPB0_PGR1_SNLL0_TT4_4_VW2_WG16_8_1_WGM64
    SolutionIndex: 156
    SolutionNameMin: Cijk_Alik_Bljk_SB_MT256x64x8_EPS1_GSU1_LPA4_LPB0_PGR1_SNLL1_TT8_8_VW4_WG32_8_1_WGM1
    SolutionIndex: 157
    SolutionNameMin: Cijk_Alik_Bljk_SB_MT128x128x8_EPS1_GSU1_LPA4_LPB0_PGR1_SNLL1_TT8_8_VW4_WG16_16_1_WGM8
    SolutionIndex: 158
    SolutionNameMin: Cijk_Alik_Bljk_SB_MT64x64x16_EPS1_GSU5_LPA4_LPB0_PGR1_SNLL0_TT4_4_VW4_WG16_16_1_WGM1
    SolutionIndex: 159
    SolutionNameMin: Cijk_Alik_Bljk_SB_MT64x64x16_EPS1_GSU1_LPA4_LPB0_PGR1_SNLL1_TT4_4_VW4_WG16_16_1_WGM8
    SolutionIndex: 160
    SolutionNameMin: Cijk_Alik_Bljk_SB_MT128x64x16_EPS1_GSU1_LPA4_LPB0_PGR1_SNLL1_TT8_4_VW4_WG16_16_1_WGM8
    SolutionIndex: 161
    SolutionNameMin: Cijk_Alik_Bljk_SB_MT128x64x16_EPS0_GSU1_LPA4_LPB0_PGR0_SNLL0_TT4_8_VW4_WG32_8_1_WGM8
    SolutionIndex: 162
    SolutionNameMin: Cijk_Alik_Bljk_SB_MT128x64x16_EPS1_GSU1_LPA4_LPB0_PGR1_SNLL1_TT4_8_VW4_WG32_8_1_WGM8
    SolutionIndex: 163
    SolutionNameMin: Cijk_Alik_Bljk_SB_MT64x64x16_EPS1_GSU1_LPA4_LPB0_PGR1_SNLL1_TT4_4_VW4_WG16_16_1_WGM64
    SolutionIndex: 164
    SolutionNameMin: Cijk_Alik_Bljk_SB_MT128x32x16_EPS0_GSU1_LPA4_LPB0_PGR0_SNLL0_TT4_4_VW4_WG32_8_1_WGM64
    SolutionIndex: 165
    SolutionNameMin: Cijk_Alik_Bljk_SB_MT64x32x16_EPS1_GSU5_LPA4_LPB0_PGR1_SNLL0_TT4_4_VW4_WG16_8_1_WGM64
    SolutionIndex: 166
    SolutionNameMin: Cijk_Alik_Bljk_SB_MT32x128x32_EPS1_GSU1_LPA4_LPB0_PGR1_SNLL1_TT4_4_VW4_WG8_32_1_WGM64
    SolutionIndex: 167
    SolutionNameMin: Cijk_Alik_Bljk_SB_MT128x64x8_EPS1_GSU1_LPA0_LPB2_PGR1_SNLL1_TT8_4_VW2_WG16_16_1_WGM8
    SolutionIndex: 168
    SolutionNameMin: Cijk_Alik_Bljk_SB_MT64x32x16_EPS1_GSU5_LPA0_LPB2_PGR1_SNLL0_TT4_4_VW2_WG16_8_1_WGM1
    SolutionIndex: 169
    SolutionNameMin: Cijk_Alik_Bljk_SB_MT64x64x16_EPS1_GSU5_LPA0_LPB2_PGR1_SNLL0_TT4_4_VW2_WG16_16_1_WGM1
    SolutionIndex: 170
    SolutionNameMin: Cijk_Alik_Bljk_SB_MT64x64x16_EPS1_GSU3_LPA0_LPB2_PGR1_SNLL0_TT4_4_VW2_WG16_16_1_WGM64
    SolutionIndex: 171
    SolutionNameMin: Cijk_Alik_Bljk_SB_MT64x32x16_EPS1_GSU5_LPA0_LPB2_PGR1_SNLL0_TT4_4_VW2_WG16_8_1_WGM64
    SolutionIndex: 172
    SolutionNameMin: Cijk_Alik_Bljk_SB_MT128x64x8_EPS1_GSU1_LPA0_LPB4_PGR1_SNLL1_TT4_8_VW4_WG32_8_1_WGM8
    SolutionIndex: 173
    SolutionNameMin: Cijk_Alik_Bljk_SB_MT64x32x16_EPS1_GSU1_LPA0_LPB4_PGR1_SNLL1_TT4_4_VW4_WG16_8_1_WGM1
    SolutionIndex: 174
    SolutionNameMin: Cijk_Alik_Bljk_SB_MT128x64x16_EPS0_GSU1_LPA0_LPB4_PGR0_SNLL0_TT8_4_VW4_WG16_16_1_WGM1
    SolutionIndex: 175
    SolutionNameMin: Cijk_Alik_Bljk_SB_MT64x32x16_EPS1_GSU5_LPA0_LPB4_PGR1_SNLL0_TT4_4_VW4_WG16_8_1_WGM1
    SolutionIndex: 176
    SolutionNameMin: Cijk_Alik_Bljk_SB_MT64x64x16_EPS1_GSU5_LPA0_LPB4_PGR1_SNLL0_TT4_4_VW4_WG16_16_1_WGM1
    SolutionIndex: 177
    SolutionNameMin: Cijk_Alik_Bljk_SB_MT64x128x16_EPS1_GSU1_LPA0_LPB4_PGR1_SNLL1_TT8_4_VW4_WG8_32_1_WGM8
    SolutionIndex: 178
    SolutionNameMin: Cijk_Alik_Bljk_SB_MT64x256x16_EPS1_GSU1_LPA0_LPB4_PGR1_SNLL1_TT8_8_VW4_WG8_32_1_WGM8
    SolutionIndex: 179
    SolutionNameMin: Cijk_Alik_Bljk_SB_MT64x128x16_EPS1_GSU1_LPA0_LPB4_PGR1_SNLL1_TT4_8_VW4_WG16_16_1_WGM8
    SolutionIndex: 180
    SolutionNameMin: Cijk_Alik_Bljk_SB_MT128x32x16_EPS0_GSU1_LPA0_LPB4_PGR0_SNLL0_TT4_4_VW4_WG32_8_1_WGM8
    SolutionIndex: 181
    SolutionNameMin: Cijk_Alik_Bljk_SB_MT64x32x16_EPS1_GSU5_LPA0_LPB4_PGR1_SNLL0_TT4_4_VW4_WG16_8_1_WGM8
    SolutionIndex: 182
    SolutionNameMin: Cijk_Alik_Bljk_SB_MT64x64x16_EPS1_GSU5_LPA0_LPB4_PGR1_SNLL0_TT4_4_VW4_WG16_16_1_WGM8
    SolutionIndex: 183
    SolutionNameMin: Cijk_Alik_Bljk_SB_MT64x32x16_EPS1_GSU1_LPA0_LPB4_PGR1_SNLL1_TT4_4_VW4_WG16_8_1_WGM64
    SolutionIndex: 184
    SolutionNameMin: Cijk_Alik_Bljk_SB_MT32x256x16_EPS1_GSU1_LPA0_LPB4_PGR1_SNLL1_TT4_8_VW4_WG8_32_1_WGM64
    SolutionIndex: 185
    SolutionNameMin: Cijk_Alik_Bljk_SB_MT64x128x16_EPS1_GSU1_LPA0_LPB4_PGR1_SNLL1_TT8_4_VW4_WG8_32_1_WGM64
    SolutionIndex: 186
    SolutionNameMin: Cijk_Alik_Bljk_SB_MT64x128x16_EPS1_GSU1_LPA0_LPB4_PGR1_SNLL1_TT4_8_VW4_WG16_16_1_WGM64
    SolutionIndex: 187
    SolutionNameMin: Cijk_Alik_Bljk_SB_MT128x64x16_EPS1_GSU1_LPA0_LPB4_PGR1_SNLL1_TT4_8_VW4_WG32_8_1_WGM64
    SolutionIndex: 188
    SolutionNameMin: Cijk_Alik_Bljk_SB_MT64x32x16_EPS1_GSU5_LPA0_LPB4_PGR1_SNLL0_TT4_4_VW4_WG16_8_1_WGM64
    SolutionIndex: 189
    SolutionNameMin: Cijk_Alik_Bljk_SB_MT32x128x32_EPS1_GSU5_LPA0_LPB4_PGR1_SNLL0_TT4_4_VW4_WG8_32_1_WGM8
    SolutionIndex: 190
    SolutionNameMin: Cijk_Alik_Bljk_SB_MT32x128x32_EPS1_GSU1_LPA0_LPB4_PGR1_SNLL1_TT4_4_VW4_WG8_32_1_WGM64
    SolutionIndex: 191
    SolutionNameMin: Cijk_Alik_Bljk_SB_MT128x32x8_EPS1_GSU1_LPA2_LPB2_PGR1_SNLL1_TT4_4_VW2_WG32_8_1_WGM64
    SolutionIndex: 192
    SolutionNameMin: Cijk_Alik_Bljk_SB_MT64x32x16_EPS1_GSU3_LPA2_LPB2_PGR1_SNLL0_TT4_4_VW2_WG16_8_1_WGM1
    SolutionIndex: 193
    SolutionNameMin: Cijk_Alik_Bljk_SB_MT32x128x16_EPS1_GSU3_LPA2_LPB2_PGR1_SNLL0_TT4_4_VW2_WG8_32_1_WGM1
    SolutionIndex: 194
    SolutionNameMin: Cijk_Alik_Bljk_SB_MT64x64x16_EPS1_GSU3_LPA2_LPB2_PGR1_SNLL0_TT4_4_VW2_WG16_16_1_WGM1
    SolutionIndex: 195
    SolutionNameMin: Cijk_Alik_Bljk_SB_MT64x128x16_EPS1_GSU3_LPA2_LPB2_PGR1_SNLL0_TT4_8_VW2_WG16_16_1_WGM1
    SolutionIndex: 196
    SolutionNameMin: Cijk_Alik_Bljk_SB_MT128x32x16_EPS1_GSU3_LPA2_LPB2_PGR1_SNLL0_TT4_4_VW2_WG32_8_1_WGM1
    SolutionIndex: 197
    SolutionNameMin: Cijk_Alik_Bljk_SB_MT64x32x16_EPS1_GSU5_LPA2_LPB2_PGR1_SNLL0_TT4_4_VW2_WG16_8_1_WGM1
    SolutionIndex: 198
    SolutionNameMin: Cijk_Alik_Bljk_SB_MT64x64x16_EPS0_GSU5_LPA2_LPB2_PGR0_SNLL0_TT4_4_VW2_WG16_16_1_WGM1
    SolutionIndex: 199
    SolutionNameMin: Cijk_Alik_Bljk_SB_MT64x64x16_EPS1_GSU5_LPA2_LPB2_PGR1_SNLL0_TT4_4_VW2_WG16_16_1_WGM1
    SolutionIndex: 200
    SolutionNameMin: Cijk_Alik_Bljk_SB_MT128x64x16_EPS1_GSU5_LPA2_LPB2_PGR1_SNLL0_TT8_4_VW2_WG16_16_1_WGM1
    SolutionIndex: 201
    SolutionNameMin: Cijk_Alik_Bljk_SB_MT128x64x16_EPS1_GSU5_LPA2_LPB2_PGR1_SNLL0_TT4_8_VW2_WG32_8_1_WGM1
    SolutionIndex: 202
    SolutionNameMin: Cijk_Alik_Bljk_SB_MT64x32x16_EPS1_GSU1_LPA2_LPB2_PGR1_SNLL1_TT4_4_VW2_WG16_8_1_WGM8
    SolutionIndex: 203
    SolutionNameMin: Cijk_Alik_Bljk_SB_MT64x64x16_EPS1_GSU1_LPA2_LPB2_PGR1_SNLL1_TT4_4_VW2_WG16_16_1_WGM8
    SolutionIndex: 204
    SolutionNameMin: Cijk_Alik_Bljk_SB_MT128x64x16_EPS1_GSU1_LPA2_LPB2_PGR1_SNLL1_TT8_4_VW2_WG16_16_1_WGM8
    SolutionIndex: 205
    SolutionNameMin: Cijk_Alik_Bljk_SB_MT64x128x16_EPS1_GSU3_LPA2_LPB2_PGR1_SNLL0_TT8_4_VW2_WG8_32_1_WGM8
    SolutionIndex: 206
    SolutionNameMin: Cijk_Alik_Bljk_SB_MT32x128x16_EPS1_GSU5_LPA2_LPB2_PGR1_SNLL0_TT4_4_VW2_WG8_32_1_WGM8
    SolutionIndex: 207
    SolutionNameMin: Cijk_Alik_Bljk_SB_MT64x128x16_EPS1_GSU5_LPA2_LPB2_PGR1_SNLL0_TT8_4_VW2_WG8_32_1_WGM8
    SolutionIndex: 208
    SolutionNameMin: Cijk_Alik_Bljk_SB_MT64x64x16_EPS1_GSU5_LPA2_LPB2_PGR1_SNLL0_TT4_4_VW2_WG16_16_1_WGM8
    SolutionIndex: 209
    SolutionNameMin: Cijk_Alik_Bljk_SB_MT64x128x16_EPS1_GSU5_LPA2_LPB2_PGR1_SNLL0_TT4_8_VW2_WG16_16_1_WGM8
    SolutionIndex: 210
    SolutionNameMin: Cijk_Alik_Bljk_SB_MT64x64x16_EPS1_GSU1_LPA2_LPB2_PGR1_SNLL1_TT4_4_VW2_WG16_16_1_WGM64
    SolutionIndex: 211
    SolutionNameMin: Cijk_Alik_Bljk_SB_MT64x128x16_EPS1_GSU1_LPA2_LPB2_PGR1_SNLL1_TT4_8_VW2_WG16_16_1_WGM64
    SolutionIndex: 212
    SolutionNameMin: Cijk_Alik_Bljk_SB_MT64x128x16_EPS1_GSU3_LPA2_LPB2_PGR1_SNLL0_TT4_8_VW2_WG16_16_1_WGM64
    SolutionIndex: 213
    SolutionNameMin: Cijk_Alik_Bljk_SB_MT128x64x16_EPS1_GSU3_LPA2_LPB2_PGR1_SNLL0_TT8_4_VW2_WG16_16_1_WGM64
    SolutionIndex: 214
    SolutionNameMin: Cijk_Alik_Bljk_SB_MT64x32x16_EPS1_GSU5_LPA2_LPB2_PGR1_SNLL0_TT4_4_VW2_WG16_8_1_WGM64
    SolutionIndex: 215
    SolutionNameMin: Cijk_Alik_Bljk_SB_MT64x64x16_EPS1_GSU5_LPA2_LPB2_PGR1_SNLL0_TT4_4_VW2_WG16_16_1_WGM64
    SolutionIndex: 216
    SolutionNameMin: Cijk_Alik_Bljk_SB_MT32x128x32_EPS1_GSU5_LPA2_LPB2_PGR1_SNLL0_TT4_4_VW2_WG8_32_1_WGM1
    SolutionIndex: 217
    SolutionNameMin: Cijk_Alik_Bljk_SB_MT64x128x32_EPS1_GSU1_LPA2_LPB2_PGR1_SNLL1_TT8_4_VW2_WG8_32_1_WGM8
    SolutionIndex: 218
    SolutionNameMin: Cijk_Alik_Bljk_SB_MT64x64x32_EPS1_GSU5_LPA2_LPB2_PGR1_SNLL0_TT4_4_VW2_WG16_16_1_WGM64
    SolutionIndex: 219
    SolutionNameMin: Cijk_Alik_Bljk_SB_MT128x32x8_EPS1_GSU1_LPA4_LPB4_PGR1_SNLL1_TT4_4_VW4_WG32_8_1_WGM8
    SolutionIndex: 220
    SolutionNameMin: Cijk_Alik_Bljk_SB_MT128x64x8_EPS1_GSU1_LPA4_LPB4_PGR1_SNLL1_TT4_8_VW4_WG32_8_1_WGM8
    SolutionIndex: 221
    SolutionNameMin: Cijk_Alik_Bljk_SB_MT64x32x16_EPS1_GSU1_LPA4_LPB4_PGR1_SNLL1_TT4_4_VW4_WG16_8_1_WGM1
    SolutionIndex: 222
    SolutionNameMin: Cijk_Alik_Bljk_SB_MT32x128x16_EPS1_GSU1_LPA4_LPB4_PGR1_SNLL1_TT4_4_VW4_WG8_32_1_WGM1
    SolutionIndex: 223
    SolutionNameMin: Cijk_Alik_Bljk_SB_MT64x64x16_EPS1_GSU1_LPA4_LPB4_PGR1_SNLL1_TT4_4_VW4_WG16_16_1_WGM1
    SolutionIndex: 224
    SolutionNameMin: Cijk_Alik_Bljk_SB_MT128x64x16_EPS1_GSU1_LPA4_LPB4_PGR1_SNLL1_TT8_4_VW4_WG16_16_1_WGM1
    SolutionIndex: 225
    SolutionNameMin: Cijk_Alik_Bljk_SB_MT128x32x16_EPS1_GSU1_LPA4_LPB4_PGR1_SNLL1_TT4_4_VW4_WG32_8_1_WGM1
    SolutionIndex: 226
    SolutionNameMin: Cijk_Alik_Bljk_SB_MT128x64x16_EPS1_GSU1_LPA4_LPB4_PGR1_SNLL1_TT4_8_VW4_WG32_8_1_WGM1
    SolutionIndex: 227
    SolutionNameMin: Cijk_Alik_Bljk_SB_MT256x32x16_EPS0_GSU1_LPA4_LPB4_PGR0_SNLL0_TT8_4_VW4_WG32_8_1_WGM1
    SolutionIndex: 228
    SolutionNameMin: Cijk_Alik_Bljk_SB_MT128x64x16_EPS1_GSU3_LPA4_LPB4_PGR1_SNLL0_TT8_4_VW4_WG16_16_1_WGM1
    SolutionIndex: 229
    SolutionNameMin: Cijk_Alik_Bljk_SB_MT64x32x16_EPS1_GSU5_LPA4_LPB4_PGR1_SNLL0_TT4_4_VW4_WG16_8_1_WGM1
    SolutionIndex: 230
    SolutionNameMin: Cijk_Alik_Bljk_SB_MT64x128x16_EPS1_GSU1_LPA4_LPB4_PGR1_SNLL1_TT8_4_VW4_WG8_32_1_WGM8
    SolutionIndex: 231
    SolutionNameMin: Cijk_Alik_Bljk_SB_MT64x64x16_EPS1_GSU1_LPA4_LPB4_PGR1_SNLL1_TT4_4_VW4_WG16_16_1_WGM8
    SolutionIndex: 232
    SolutionNameMin: Cijk_Alik_Bljk_SB_MT64x128x16_EPS1_GSU1_LPA4_LPB4_PGR1_SNLL1_TT4_8_VW4_WG16_16_1_WGM8
    SolutionIndex: 233
    SolutionNameMin: Cijk_Alik_Bljk_SB_MT128x64x16_EPS1_GSU1_LPA4_LPB4_PGR1_SNLL1_TT8_4_VW4_WG16_16_1_WGM8
    SolutionIndex: 234
    SolutionNameMin: Cijk_Alik_Bljk_SB_MT128x128x16_EPS1_GSU1_LPA4_LPB4_PGR1_SNLL1_TT8_8_VW4_WG16_16_1_WGM8
    SolutionIndex: 235
    SolutionNameMin: Cijk_Alik_Bljk_SB_MT128x32x16_EPS0_GSU1_LPA4_LPB4_PGR0_SNLL0_TT4_4_VW4_WG32_8_1_WGM8
    SolutionIndex: 236
    SolutionNameMin: Cijk_Alik_Bljk_SB_MT128x32x16_EPS1_GSU1_LPA4_LPB4_PGR1_SNLL1_TT4_4_VW4_WG32_8_1_WGM8
    SolutionIndex: 237
    SolutionNameMin: Cijk_Alik_Bljk_SB_MT128x64x16_EPS1_GSU1_LPA4_LPB4_PGR1_SNLL1_TT4_8_VW4_WG32_8_1_WGM8
    SolutionIndex: 238
    SolutionNameMin: Cijk_Alik_Bljk_SB_MT64x32x16_EPS1_GSU5_LPA4_LPB4_PGR1_SNLL0_TT4_4_VW4_WG16_8_1_WGM8
    SolutionIndex: 239
    SolutionNameMin: Cijk_Alik_Bljk_SB_MT64x32x16_EPS1_GSU1_LPA4_LPB4_PGR1_SNLL1_TT4_4_VW4_WG16_8_1_WGM64
    SolutionIndex: 240
    SolutionNameMin: Cijk_Alik_Bljk_SB_MT32x128x16_EPS1_GSU1_LPA4_LPB4_PGR1_SNLL1_TT4_4_VW4_WG8_32_1_WGM64
    SolutionIndex: 241
    SolutionNameMin: Cijk_Alik_Bljk_SB_MT64x128x16_EPS1_GSU1_LPA4_LPB4_PGR1_SNLL1_TT8_4_VW4_WG8_32_1_WGM64
    SolutionIndex: 242
    SolutionNameMin: Cijk_Alik_Bljk_SB_MT64x64x16_EPS1_GSU1_LPA4_LPB4_PGR1_SNLL1_TT4_4_VW4_WG16_16_1_WGM64
    SolutionIndex: 243
    SolutionNameMin: Cijk_Alik_Bljk_SB_MT64x128x16_EPS1_GSU1_LPA4_LPB4_PGR1_SNLL1_TT4_8_VW4_WG16_16_1_WGM64
    SolutionIndex: 244
    SolutionNameMin: Cijk_Alik_Bljk_SB_MT128x64x16_EPS1_GSU1_LPA4_LPB4_PGR1_SNLL1_TT8_4_VW4_WG16_16_1_WGM64
    SolutionIndex: 245
    SolutionNameMin: Cijk_Alik_Bljk_SB_MT128x128x16_EPS1_GSU1_LPA4_LPB4_PGR1_SNLL1_TT8_8_VW4_WG16_16_1_WGM64
    SolutionIndex: 246
    SolutionNameMin: Cijk_Alik_Bljk_SB_MT128x32x16_EPS1_GSU1_LPA4_LPB4_PGR1_SNLL1_TT4_4_VW4_WG32_8_1_WGM64
    SolutionIndex: 247
    SolutionNameMin: Cijk_Alik_Bljk_SB_MT128x64x16_EPS1_GSU1_LPA4_LPB4_PGR1_SNLL1_TT4_8_VW4_WG32_8_1_WGM64
    SolutionIndex: 248
    SolutionNameMin: Cijk_Alik_Bljk_SB_MT32x128x16_EPS1_GSU5_LPA4_LPB4_PGR1_SNLL0_TT4_4_VW4_WG8_32_1_WGM64
    SolutionIndex: 249
    SolutionNameMin: Cijk_Alik_Bljk_SB_MT32x128x32_EPS1_GSU1_LPA4_LPB4_PGR1_SNLL1_TT4_4_VW4_WG8_32_1_WGM1
    SolutionIndex: 250
    SolutionNameMin: Cijk_Alik_Bljk_SB_MT64x64x32_EPS1_GSU1_LPA4_LPB4_PGR1_SNLL1_TT4_4_VW4_WG16_16_1_WGM1
    SolutionIndex: 251
    SolutionNameMin: Cijk_Alik_Bljk_SB_MT32x128x32_EPS1_GSU5_LPA4_LPB4_PGR1_SNLL0_TT4_4_VW4_WG8_32_1_WGM1
    SolutionIndex: 252
    SolutionNameMin: Cijk_Alik_Bljk_SB_MT64x64x32_EPS1_GSU1_LPA4_LPB4_PGR1_SNLL1_TT4_4_VW4_WG16_16_1_WGM8
    SolutionIndex: 253
    SolutionNameMin: Cijk_Alik_Bljk_SB_MT64x128x32_EPS1_GSU1_LPA4_LPB4_PGR1_SNLL1_TT4_8_VW4_WG16_16_1_WGM8
    SolutionIndex: 254
    SolutionNameMin: Cijk_Alik_Bljk_SB_MT64x64x32_EPS1_GSU1_LPA4_LPB4_PGR1_SNLL1_TT4_4_VW4_WG16_16_1_WGM64
    SolutionIndex: 255
    SolutionNameMin: Cijk_Alik_Bljk_SB_MT64x128x32_EPS1_GSU1_LPA4_LPB4_PGR1_SNLL1_TT4_8_VW4_WG16_16_1_WGM64
    SolutionIndex: 256
    SolutionNameMin: Cijk_Alik_Bljk_SB_MT64x32x16_SE_EPS1_GSU1_PGR1_SNLL1_TT4_2_VW2_WG16_16_1_WGM1
    SolutionIndex: 257
    SolutionNameMin: Cijk_Alik_Bljk_SB_MT64x64x16_SE_EPS1_GSU1_PGR1_SNLL1_TT4_4_VW2_WG16_16_1_WGM1
    SolutionIndex: 258
    SolutionNameMin: Cijk_Alik_Bljk_SB_MT16x8x32_SE_EPS1_GSU1_PGR1_SNLL1_TT4_2_VW2_WG4_4_8_WGM1
    SolutionIndex: 259
    SolutionNameMin: Cijk_Alik_Bljk_SB_MT32x32x8_SE_EPS1_GSU1_PGR1_SNLL1_TT4_4_VW2_WG8_8_1_WGM8
    SolutionIndex: 260
    SolutionNameMin: Cijk_Alik_Bljk_SB_MT32x16x16_SE_EPS1_GSU1_PGR1_SNLL1_TT8_4_VW2_WG4_4_8_WGM8
    SolutionIndex: 261
    SolutionNameMin: Cijk_Alik_Bljk_SB_MT16x8x32_SE_EPS1_GSU1_PGR1_SNLL1_TT4_2_VW2_WG4_4_8_WGM8
    SolutionIndex: 262
    SolutionNameMin: Cijk_Alik_Bljk_SB_MT16x8x32_SE_EPS1_GSU1_PGR1_SNLL1_TT4_2_VW2_WG4_4_8_WGM16
    SolutionIndex: 263
    SolutionNameMin: Cijk_Alik_Bljk_SB_MT32x32x8_SE_EPS1_GSU1_PGR1_SNLL1_TT4_4_VW2_WG8_8_1_WGM64
    SolutionIndex: 264
    SolutionNameMin: Cijk_Alik_Bljk_SB_MT16x8x32_SE_EPS1_GSU1_PGR1_SNLL1_TT4_2_VW2_WG4_4_8_WGM64
    SolutionIndex: 265
    SolutionNameMin: Cijk_Alik_Bljk_SB_MT32x16x32_SE_EPS1_GSU8_PGR1_SNLL0_TT8_4_VW2_WG4_4_8_WGM64
    SolutionIndex: 266
    SolutionNameMin: Cijk_Alik_Bljk_SB_MT32x8x8_SE_EPS1_GSU1_PGR1_SNLL1_TT4_4_VW4_WG8_2_4_WGM1
    SolutionIndex: 267
    SolutionNameMin: Cijk_Alik_Bljk_SB_MT128x64x8_SE_EPS1_GSU1_PGR1_SNLL1_TT8_4_VW4_WG16_16_1_WGM1
    SolutionIndex: 268
    SolutionNameMin: Cijk_Alik_Bljk_SB_MT32x32x8_SE_EPS1_GSU1_PGR1_SNLL1_TT4_4_VW4_WG8_8_1_WGM1
    SolutionIndex: 269
    SolutionNameMin: Cijk_Alik_Bljk_SB_MT16x32x16_SE_EPS1_GSU1_PGR1_SNLL1_TT8_4_VW4_WG2_8_4_WGM1
    SolutionIndex: 270
    SolutionNameMin: Cijk_Alik_Bljk_SB_MT64x64x16_SE_EPS0_GSU1_PGR0_SNLL0_TT4_4_VW4_WG16_16_1_WGM1
    SolutionIndex: 271
    SolutionNameMin: Cijk_Alik_Bljk_SB_MT16x16x32_SE_EPS1_GSU1_PGR1_SNLL1_TT4_4_VW4_WG4_4_8_WGM1
    SolutionIndex: 272
    SolutionNameMin: Cijk_Alik_Bljk_SB_MT32x8x8_SE_EPS1_GSU1_PGR1_SNLL1_TT4_4_VW4_WG8_2_4_WGM8
    SolutionIndex: 273
    SolutionNameMin: Cijk_Alik_Bljk_SB_MT32x32x8_SE_EPS1_GSU1_PGR1_SNLL1_TT4_4_VW4_WG8_8_1_WGM8
    SolutionIndex: 274
    SolutionNameMin: Cijk_Alik_Bljk_SB_MT16x16x32_SE_EPS1_GSU8_PGR1_SNLL0_TT4_4_VW4_WG4_4_8_WGM8
    SolutionIndex: 275
    SolutionNameMin: Cijk_Alik_Bljk_SB_MT64x64x16_SE_EPS1_GSU1_PGR1_SNLL1_TT4_4_VW4_WG16_16_1_WGM16
    SolutionIndex: 276
    SolutionNameMin: Cijk_Alik_Bljk_SB_MT32x32x8_SE_EPS1_GSU1_PGR1_SNLL1_TT4_4_VW4_WG8_8_1_WGM64
    SolutionIndex: 277
    SolutionNameMin: Cijk_Alik_Bljk_SB_MT16x32x16_SE_EPS1_GSU1_PGR1_SNLL1_TT8_4_VW4_WG2_8_4_WGM64
    SolutionIndex: 278
    SolutionNameMin: Cijk_Alik_Bljk_SB_MT32x16x16_SE_EPS1_GSU1_PGR1_SNLL1_TT8_4_VW4_WG4_4_8_WGM64
    SolutionIndex: 279
    SolutionNameMin: Cijk_Alik_Bljk_SB_MT16x16x32_SE_EPS1_GSU1_PGR1_SNLL1_TT4_4_VW4_WG4_4_8_WGM64
    SolutionIndex: 280
    SolutionNameMin: Cijk_Alik_Bljk_SB_MT128x128x16_SE_EPS1_FL1_GRVW4_LPA0_LPB0_PGR1_PLR1_SNLL1_TT8_8_USFGRO0_VW2_WG16_16_1_WGM1
    SolutionIndex: 281
    SolutionNameMin: Cijk_Alik_Bljk_SB_MT128x128x16_SE_EPS1_FL0_GRVW4_LPA0_LPB0_PGR1_PLR1_SNLL1_TT8_8_USFGRO0_VW2_WG16_16_1_WGM8
    SolutionIndex: 282
    SolutionNameMin: Cijk_Alik_Bljk_SB_MT128x128x16_SE_EPS1_FL0_GRVW4_LPA0_LPB0_PGR1_PLR1_SNLL1_TT8_8_USFGRO1_VW2_WG16_16_1_WGM8
    SolutionIndex: 283
    SolutionNameMin: Cijk_Alik_Bljk_SB_MT128x128x16_SE_EPS1_FL1_GRVW4_LPA0_LPB0_PGR1_PLR1_SNLL1_TT8_8_USFGRO0_VW2_WG16_16_1_WGM8
    SolutionIndex: 284
    SolutionNameMin: Cijk_Alik_Bljk_SB_MT128x128x16_SE_EPS1_FL1_GRVW4_LPA0_LPB0_PGR1_PLR1_SNLL1_TT8_8_USFGRO1_VW2_WG16_16_1_WGM8
    SolutionIndex: 285
    SolutionNameMin: Cijk_Alik_Bljk_SB_MT128x128x16_SE_EPS1_FL0_GRVW4_LPA0_LPB0_PGR1_PLR1_SNLL1_TT8_8_USFGRO0_VW4_WG16_16_1_WGM1
    SolutionIndex: 286
    SolutionNameMin: Cijk_Alik_Bljk_SB_MT128x128x16_SE_EPS1_FL0_GRVW4_LPA0_LPB0_PGR1_PLR1_SNLL1_TT8_8_USFGRO1_VW4_WG16_16_1_WGM1
    SolutionIndex: 287
    SolutionNameMin: Cijk_Alik_Bljk_SB_MT128x128x16_SE_EPS1_FL1_GRVW4_LPA0_LPB0_PGR1_PLR1_SNLL1_TT8_8_USFGRO0_VW4_WG16_16_1_WGM1
    SolutionIndex: 288
    SolutionNameMin: Cijk_Alik_Bljk_SB_MT128x128x16_SE_EPS1_FL1_GRVW4_LPA0_LPB0_PGR1_PLR1_SNLL1_TT8_8_USFGRO1_VW4_WG16_16_1_WGM1
    SolutionIndex: 289
    SolutionNameMin: Cijk_Alik_Bljk_SB_MT128x128x16_SE_EPS1_FL0_GRVW4_LPA0_LPB0_PGR1_PLR1_SNLL1_TT8_8_USFGRO0_VW4_WG16_16_1_WGM8
    SolutionIndex: 290
    SolutionNameMin: Cijk_Alik_Bljk_SB_MT128x128x16_SE_EPS1_FL0_GRVW4_LPA0_LPB0_PGR1_PLR1_SNLL1_TT8_8_USFGRO1_VW4_WG16_16_1_WGM8
    SolutionIndex: 291
    SolutionNameMin: Cijk_Alik_Bljk_SB_MT128x128x16_SE_EPS1_FL1_GRVW4_LPA0_LPB0_PGR1_PLR1_SNLL1_TT8_8_USFGRO0_VW4_WG16_16_1_WGM8
    SolutionIndex: 292
    SolutionNameMin: Cijk_Alik_Bljk_SB_MT128x128x16_SE_EPS1_FL1_GRVW4_LPA0_LPB0_PGR1_PLR1_SNLL1_TT8_8_USFGRO1_VW4_WG16_16_1_WGM8
    SolutionIndex: 293
    SolutionNameMin: Cijk_Alik_Bljk_SB_MT64x128x16_SE_EPS1_FL0_GRVW2_LPA0_LPB4_PGR1_PLR1_SNLL1_TT4_8_USFGRO0_VW4_WG16_16_1_WGM1
    SolutionIndex: 294
    SolutionNameMin: Cijk_Alik_Bljk_SB_MT64x128x16_SE_EPS1_FL0_GRVW2_LPA0_LPB4_PGR1_PLR1_SNLL1_TT4_8_USFGRO1_VW4_WG16_16_1_WGM1
    SolutionIndex: 295
    SolutionNameMin: Cijk_Alik_Bljk_SB_MT64x128x16_SE_EPS1_FL1_GRVW2_LPA0_LPB4_PGR1_PLR1_SNLL1_TT4_8_USFGRO0_VW4_WG16_16_1_WGM1
    SolutionIndex: 296
    SolutionNameMin: Cijk_Alik_Bljk_SB_MT64x128x16_SE_EPS1_FL1_GRVW2_LPA0_LPB4_PGR1_PLR1_SNLL1_TT4_8_USFGRO1_VW4_WG16_16_1_WGM1
    SolutionIndex: 297
    SolutionNameMin: Cijk_Alik_Bljk_SB_MT64x128x16_SE_EPS1_FL1_GRVW4_LPA0_LPB2_PGR1_PLR1_SNLL1_TT4_8_USFGRO1_VW2_WG16_16_1_WGM1
    SolutionIndex: 298
    SolutionNameMin: Cijk_Alik_Bljk_SB_MT64x128x16_SE_EPS1_FL0_GRVW1_LPA2_LPB2_PGR1_PLR1_SNLL1_TT4_8_USFGRO1_VW2_WG16_16_1_WGM1
    SolutionIndex: 299
    SolutionNameMin: Cijk_Alik_Bljk_SB_MT64x128x16_SE_EPS1_FL0_GRVW1_LPA4_LPB4_PGR1_PLR1_SNLL1_TT4_8_USFGRO0_VW4_WG16_16_1_WGM1
    SolutionIndex: 300
    SolutionNameMin: Cijk_Alik_Bljk_SB_MT64x128x16_SE_EPS1_FL0_GRVW1_LPA4_LPB4_PGR1_PLR1_SNLL1_TT4_8_USFGRO1_VW4_WG16_16_1_WGM1
    SolutionIndex: 301
    SolutionNameMin: Cijk_Alik_Bljk_SB_MT64x128x16_SE_EPS1_FL0_GRVW2_LPA2_LPB2_PGR1_PLR1_SNLL1_TT4_8_USFGRO0_VW2_WG16_16_1_WGM1
    SolutionIndex: 302
    SolutionNameMin: Cijk_Alik_Bljk_SB_MT64x128x16_SE_EPS1_FL0_GRVW2_LPA2_LPB2_PGR1_PLR1_SNLL1_TT4_8_USFGRO1_VW2_WG16_16_1_WGM1
    SolutionIndex: 303
    SolutionNameMin: Cijk_Alik_Bljk_SB_MT64x128x16_SE_EPS1_FL1_GRVW2_LPA2_LPB2_PGR1_PLR1_SNLL1_TT4_8_USFGRO0_VW2_WG16_16_1_WGM1
    SolutionIndex: 304
    SolutionNameMin: Cijk_Alik_Bljk_SB_MT64x128x16_SE_EPS1_FL1_GRVW2_LPA2_LPB2_PGR1_PLR1_SNLL1_TT4_8_USFGRO1_VW2_WG16_16_1_WGM1
    SolutionIndex: 305
    SolutionNameMin: Cijk_Alik_Bljk_SB_MT64x128x16_SE_EPS1_FL0_GRVW2_LPA4_LPB4_PGR1_PLR1_SNLL1_TT4_8_USFGRO0_VW4_WG16_16_1_WGM1
    SolutionIndex: 306
    SolutionNameMin: Cijk_Alik_Bljk_SB_MT64x128x16_SE_EPS1_FL0_GRVW2_LPA4_LPB4_PGR1_PLR1_SNLL1_TT4_8_USFGRO1_VW4_WG16_16_1_WGM1
    SolutionIndex: 307
    SolutionNameMin: Cijk_Alik_Bljk_SB_MT64x128x16_SE_EPS1_FL1_GRVW2_LPA4_LPB4_PGR1_PLR1_SNLL1_TT4_8_USFGRO0_VW4_WG16_16_1_WGM1
    SolutionIndex: 308
    SolutionNameMin: Cijk_Alik_Bljk_SB_MT64x128x16_SE_EPS1_FL1_GRVW2_LPA4_LPB4_PGR1_PLR1_SNLL1_TT4_8_USFGRO1_VW4_WG16_16_1_WGM1
    SolutionIndex: 309
    SolutionNameMin: Cijk_Alik_Bljk_SB_MT128x64x16_SE_EPS1_FL0_GRVW2_LPA4_LPB4_PGR1_PLR1_SNLL1_TT8_4_USFGRO0_VW4_WG16_16_1_WGM1
    SolutionIndex: 310
    SolutionNameMin: Cijk_Alik_Bljk_SB_MT128x64x16_SE_EPS1_FL0_GRVW2_LPA4_LPB4_PGR1_PLR1_SNLL1_TT8_4_USFGRO1_VW4_WG16_16_1_WGM1
    SolutionIndex: 311
    SolutionNameMin: Cijk_Alik_Bljk_SB_MT128x64x16_SE_EPS1_FL1_GRVW2_LPA4_LPB4_PGR1_PLR1_SNLL1_TT8_4_USFGRO0_VW4_WG16_16_1_WGM1
    SolutionIndex: 312
    SolutionNameMin: Cijk_Alik_Bljk_SB_MT128x64x16_SE_EPS1_FL0_GRVW2_LPA4_LPB4_PGR1_PLR1_SNLL1_TT8_4_USFGRO1_VW4_WG16_16_1_WGM8
    SolutionIndex: 313
    SolutionNameMin: Cijk_Alik_Bljk_SB_MT128x64x16_SE_EPS1_FL1_GRVW2_LPA4_LPB4_PGR1_PLR1_SNLL1_TT8_4_USFGRO1_VW4_WG16_16_1_WGM8
    SolutionIndex: 314
    SolutionNameMin: Cijk_Alik_Bljk_SB_MT64x128x16_SE_EPS1_FL0_GRVW4_LPA4_LPB4_PGR1_PLR1_SNLL1_TT4_8_USFGRO0_VW4_WG16_16_1_WGM1
    SolutionIndex: 315
    SolutionNameMin: Cijk_Alik_Bljk_SB_MT64x128x16_SE_EPS1_FL1_GRVW4_LPA4_LPB4_PGR1_PLR1_SNLL1_TT4_8_USFGRO1_VW4_WG16_16_1_WGM1
    SolutionIndex: 316
    SolutionNameMin: Cijk_Alik_Bljk_SB_MT32x32x16_SE_EPS0_FL1_GRVW4_LPA1_LPB0_PGR0_PLR1_SNLL0_TT2_4_USFGRO1_VW1_WG16_8_1_WGM8
    SolutionIndex: 317
    SolutionNameMin: Cijk_Alik_Bljk_SB_MT32x32x16_SE_EPS0_FL0_GRVW1_LPA1_LPB1_PGR0_PLR1_SNLL0_TT2_4_USFGRO1_VW1_WG16_8_1_WGM1
    SolutionIndex: 318
    SolutionNameMin: Cijk_Alik_Bljk_SB_MT32x32x16_SE_EPS0_FL0_GRVW1_LPA1_LPB1_PGR0_PLR1_SNLL0_TT2_4_USFGRO1_VW1_WG16_8_1_WGM8
    SolutionIndex: 319
    SolutionNameMin: Cijk_Alik_Bljk_SB_MT64x64x16_SE_EPS0_FL0_GRVW4_LPA1_LPB1_PGR0_PLR1_SNLL0_TT4_4_USFGRO1_VW1_WG16_16_1_WGM1
    SolutionIndex: 320
    SolutionNameMin: Cijk_Alik_Bljk_SB_MT64x64x16_SE_EPS0_FL1_GRVW4_LPA1_LPB1_PGR0_PLR1_SNLL0_TT4_4_USFGRO1_VW1_WG16_16_1_WGM1
    SolutionIndex: 321
    SolutionNameMin: Cijk_Alik_Bljk_SB_MT32x32x16_SE_EPS0_FL0_GRVW4_LPA1_LPB1_PGR0_PLR1_SNLL0_TT2_4_USFGRO1_VW1_WG16_8_1_WGM1
    SolutionIndex: 322
    SolutionNameMin: Cijk_Alik_Bljk_SB_MT32x32x16_SE_EPS0_FL1_GRVW4_LPA1_LPB1_PGR0_PLR1_SNLL0_TT2_4_USFGRO1_VW1_WG16_8_1_WGM1
    SolutionIndex: 323
    SolutionNameMin: Cijk_Alik_Bljk_SB_MT32x32x16_SE_EPS0_FL0_GRVW4_LPA1_LPB1_PGR0_PLR1_SNLL0_TT4_2_USFGRO1_VW1_WG8_16_1_WGM1
    SolutionIndex: 324
    SolutionNameMin: Cijk_Alik_Bljk_SB_MT32x32x16_SE_EPS0_FL1_GRVW4_LPA1_LPB1_PGR0_PLR1_SNLL0_TT4_2_USFGRO1_VW1_WG8_16_1_WGM1
    SolutionIndex: 325
    SolutionNameMin: Cijk_Alik_Bljk_SB_MT64x64x16_SE_EPS0_FL0_GRVW4_LPA1_LPB1_PGR0_PLR1_SNLL0_TT4_4_USFGRO1_VW1_WG16_16_1_WGM8
    SolutionIndex: 326
    SolutionNameMin: Cijk_Alik_Bljk_SB_MT64x64x16_SE_EPS0_FL1_GRVW4_LPA1_LPB1_PGR0_PLR1_SNLL0_TT4_4_USFGRO1_VW1_WG16_16_1_WGM8
    SolutionIndex: 327
    SolutionNameMin: Cijk_Alik_Bljk_SB_MT32x32x16_SE_EPS0_FL0_GRVW4_LPA1_LPB1_PGR0_PLR1_SNLL0_TT2_4_USFGRO1_VW1_WG16_8_1_WGM8
    SolutionIndex: 328
    SolutionNameMin: Cijk_Alik_Bljk_SB_MT32x32x16_SE_EPS0_FL1_GRVW4_LPA1_LPB1_PGR0_PLR1_SNLL0_TT2_4_USFGRO1_VW1_WG16_8_1_WGM8
    SolutionIndex: 329
    SolutionNameMin: Cijk_Alik_Bljk_SB_MT32x32x16_SE_EPS0_FL0_GRVW4_LPA1_LPB1_PGR0_PLR1_SNLL0_TT4_2_USFGRO1_VW1_WG8_16_1_WGM8
    SolutionIndex: 330
    SolutionNameMin: Cijk_Alik_Bljk_SB_MT32x32x32_SE_EPS0_FL0_GRVW4_LPA1_LPB1_PGR0_PLR1_SNLL0_TT2_4_USFGRO1_VW1_WG16_8_1_WGM1
    SolutionIndex: 331
    SolutionNameMin: Cijk_Alik_Bljk_SB_MT64x32x8_SE_EPS0_FL1_GRVW4_LPA4_LPB4_PGR0_PLR0_SNLL0_TT4_4_USFGRO1_VW4_WG16_8_1_WGM8
    SolutionIndex: 332
    SolutionNameMin: Cijk_Alik_Bljk_SB_MT64x32x16_SE_EPS0_FL0_GRVW4_LPA4_LPB4_PGR0_PLR1_SNLL0_TT4_4_USFGRO1_VW4_WG16_8_1_WGM1
    SolutionIndex: 333
    SolutionNameMin: Cijk_Alik_Bljk_SB_MT64x32x16_SE_EPS0_FL1_GRVW4_LPA4_LPB4_PGR0_PLR1_SNLL0_TT4_4_USFGRO1_VW4_WG16_8_1_WGM1
    SolutionIndex: 334
    SolutionNameMin: Cijk_Alik_Bljk_SB_MT32x64x16_SE_EPS0_FL1_GRVW4_LPA4_LPB4_PGR0_PLR1_SNLL0_TT4_4_USFGRO1_VW4_WG8_16_1_WGM1
    SolutionIndex: 335
    SolutionNameMin: Cijk_Alik_Bljk_SB_MT64x32x16_SE_EPS0_FL1_GRVW4_LPA4_LPB4_PGR0_PLR1_SNLL0_TT4_4_USFGRO1_VW4_WG16_8_1_WGM8
    SolutionIndex: 336
    SolutionNameMin: Cijk_Alik_Bljk_SB_MT96x64x16_SE_EPS1_FL1_GRVW4_GSU1_PGR1_PLR1_TT6_4_VW2_WG16_16_1_WGM8
    SolutionIndex: 337
    SolutionNameMin: Cijk_Alik_Bljk_SB_MT128x128x16_SE_EPS1_FL0_GRVW2_GSU1_PGR1_PLR1_TT8_8_VW4_WG16_16_1_WGM8
    SolutionIndex: 338
    SolutionNameMin: Cijk_Alik_Bljk_SB_MT128x128x16_SE_EPS1_FL0_GRVW4_GSU1_PGR1_PLR0_TT8_8_VW4_WG16_16_1_WGM8
    SolutionIndex: 339
    SolutionNameMin: Cijk_Alik_Bljk_SB_MT64x32x16_SE_EPS1_FL1_GRVW4_GSU1_PGR1_PLR1_TT4_4_VW2_WG16_8_2_WGM8
    SolutionIndex: 340
    SolutionNameMin: Cijk_Alik_Bljk_SB_MT16x64x16_SE_EPS1_FL1_GRVW4_GSU1_PGR1_PLR1_TT4_4_VW4_WG4_16_4_WGM8
    SolutionIndex: 341
    SolutionNameMin: Cijk_Alik_Bljk_SB_MT064x008x32_GRVW02_GSU32_SNLL0_TT04_02_VW02_WG16_04_04
    SolutionIndex: 342
    SolutionNameMin: Cijk_Alik_Bljk_SB_MT064x008x32_GRVW04_GSU32_SNLL0_TT04_04_VW04_WG16_02_08
    SolutionIndex: 343
    SolutionNameMin: Cijk_Alik_Bljk_SB_MT064x016x64_GRVW04_GSU32_SNLL0_TT04_04_VW04_WG16_04_04
    SolutionIndex: 344
    SolutionNameMin: Cijk_Alik_Bljk_SB_MT064x016x64_GRVW04_GSU32_SNLL0_TT04_04_VW04_WG16_04_04
    SolutionIndex: 345
    SolutionNameMin: Cijk_Alik_Bljk_SB_MT036x048x16_GRVW01_GSU02_SNLL0_TT03_03_VW01_WG12_16_01
    SolutionIndex: 346
    SolutionNameMin: Cijk_Alik_Bljk_SB_MT048x036x16_GRVW01_GSU08_SNLL0_TT06_03_VW01_WG08_12_02
    SolutionIndex: 347
    SolutionNameMin: Cijk_Alik_Bljk_SB_MT048x048x16_GRVW02_GSU08_SNLL0_TT06_04_VW02_WG08_12_02
    SolutionIndex: 348
    SolutionNameMin: Cijk_Alik_Bljk_SB_MT048x048x16_GRVW01_GSU08_SNLL0_TT03_03_VW01_WG16_16_01
    SolutionIndex: 349
    SolutionNameMin: Cijk_Alik_Bljk_SB_MT032x008x08_GRVW02_GSU01_SNLL0_TT02_02_VW02_WG16_04_01
    SolutionIndex: 350
    SolutionNameMin: Cijk_Alik_Bljk_SB_MT016x016x08_GRVW02_GSU01_SNLL0_TT02_02_VW02_WG08_08_01
    SolutionIndex: 351
    SolutionNameMin: Cijk_Alik_Bljk_SB_MT032x016x08_GRVW02_GSU01_SNLL0_TT04_02_VW02_WG08_08_01
    SolutionIndex: 352
    SolutionNameMin: Cijk_Alik_Bljk_SB_MT032x032x08_GRVW04_GSU01_SNLL0_TT04_04_VW04_WG08_08_01
    SolutionIndex: 353
    SolutionNameMin: Cijk_Alik_Bljk_SB_MT032x016x08_GRVW02_GSU01_SNLL0_TT02_02_VW02_WG16_08_01
    SolutionIndex: 354
    SolutionNameMin: Cijk_Alik_Bljk_SB_MT016x016x08_GRVW02_GSU01_SNLL0_TT02_02_VW02_WG08_08_01
    SolutionIndex: 355
    SolutionNameMin: Cijk_Alik_Bljk_SB_MT032x032x08_GRVW04_GSU01_SNLL0_TT04_04_VW04_WG08_08_01
    SolutionIndex: 356
    SolutionNameMin: Cijk_Alik_Bljk_SB_MT032x016x08_GRVW02_GSU01_SNLL0_TT02_02_VW02_WG16_08_01
    SolutionIndex: 357
    SolutionNameMin: Cijk_Alik_Bljk_SB_MT064x008x16_GRVW02_GSU01_SNLL0_TT02_02_VW02_WG32_04_01
    SolutionIndex: 358
    SolutionNameMin: Cijk_Alik_Bljk_SB_MT032x008x16_GRVW02_GSU01_SNLL0_TT02_02_VW02_WG16_04_01
    SolutionIndex: 359
    SolutionNameMin: Cijk_Alik_Bljk_SB_MT016x016x16_GRVW02_GSU01_SNLL0_TT02_02_VW02_WG08_08_01
    SolutionIndex: 360
    SolutionNameMin: Cijk_Alik_Bljk_SB_MT032x016x16_GRVW02_GSU01_SNLL0_TT04_02_VW02_WG08_08_01
    SolutionIndex: 361
    SolutionNameMin: Cijk_Alik_Bljk_SB_MT032x032x16_GRVW04_GSU01_SNLL0_TT04_04_VW04_WG08_08_01
    SolutionIndex: 362
    SolutionNameMin: Cijk_Alik_Bljk_SB_MT032x016x16_GRVW02_GSU01_SNLL0_TT02_02_VW02_WG16_08_01
    SolutionIndex: 363
    SolutionNameMin: Cijk_Alik_Bljk_SB_MT064x016x16_GRVW02_GSU01_SNLL0_TT04_02_VW02_WG16_08_01
    SolutionIndex: 364
    SolutionNameMin: Cijk_Alik_Bljk_SB_MT064x032x16_GRVW04_GSU01_SNLL0_TT04_04_VW04_WG16_08_01
    SolutionIndex: 365
    SolutionNameMin: Cijk_Alik_Bljk_SB_MT064x008x16_GRVW02_GSU01_SNLL0_TT02_02_VW02_WG32_04_01
    SolutionIndex: 366
    SolutionNameMin: Cijk_Alik_Bljk_SB_MT032x008x16_GRVW02_GSU01_SNLL0_TT02_02_VW02_WG16_04_01
    SolutionIndex: 367
    SolutionNameMin: Cijk_Alik_Bljk_SB_MT032x016x16_GRVW02_GSU01_SNLL0_TT02_02_VW02_WG16_08_01
    SolutionIndex: 368
    SolutionNameMin: Cijk_Alik_Bljk_SB_MT064x032x16_GRVW04_GSU01_SNLL0_TT04_04_VW04_WG16_08_01
    SolutionIndex: 369
    SolutionNameMin: Cijk_Alik_Bljk_SB_MT032x032x08_GRVW04_GSU02_SNLL0_TT04_04_VW04_WG08_08_04
    SolutionIndex: 370
    SolutionNameMin: Cijk_Alik_Bljk_SB_MT016x016x08_GRVW02_GSU08_SNLL0_TT02_02_VW02_WG08_08_02
    SolutionIndex: 371
    SolutionNameMin: Cijk_Alik_Bljk_SB_MT032x032x08_GRVW04_GSU08_SNLL0_TT04_04_VW04_WG08_08_04
    SolutionIndex: 372
    SolutionNameMin: Cijk_Alik_Bljk_SB_MT032x016x16_GRVW02_GSU02_SNLL0_TT04_02_VW02_WG08_08_02
    SolutionIndex: 373
    SolutionNameMin: Cijk_Alik_Bljk_SB_MT032x032x16_GRVW04_GSU02_SNLL0_TT04_04_VW04_WG08_08_02
    SolutionIndex: 374
    SolutionNameMin: Cijk_Alik_Bljk_SB_MT064x032x16_GRVW04_GSU02_SNLL0_TT08_04_VW04_WG08_08_02
    SolutionIndex: 375
    SolutionNameMin: Cijk_Alik_Bljk_SB_MT016x016x16_GRVW02_GSU02_SNLL0_TT02_02_VW02_WG08_08_04
    SolutionIndex: 376
    SolutionNameMin: Cijk_Alik_Bljk_SB_MT032x016x16_GRVW02_GSU02_SNLL0_TT04_02_VW02_WG08_08_04
    SolutionIndex: 377
    SolutionNameMin: Cijk_Alik_Bljk_SB_MT032x016x16_GRVW02_GSU02_SNLL0_TT02_02_VW02_WG16_08_02
    SolutionIndex: 378
    SolutionNameMin: Cijk_Alik_Bljk_SB_MT064x016x16_GRVW02_GSU02_SNLL0_TT04_02_VW02_WG16_08_02
    SolutionIndex: 379
    SolutionNameMin: Cijk_Alik_Bljk_SB_MT128x064x16_GRVW04_GSU02_SNLL0_TT08_08_VW04_WG16_08_02
    SolutionIndex: 380
    SolutionNameMin: Cijk_Alik_Bljk_SB_MT032x016x16_GRVW02_GSU02_SNLL0_TT04_02_VW02_WG08_08_02
    SolutionIndex: 381
    SolutionNameMin: Cijk_Alik_Bljk_SB_MT032x032x16_GRVW04_GSU02_SNLL0_TT04_04_VW04_WG08_08_02
    SolutionIndex: 382
    SolutionNameMin: Cijk_Alik_Bljk_SB_MT064x032x16_GRVW04_GSU02_SNLL0_TT08_04_VW04_WG08_08_02
    SolutionIndex: 383
    SolutionNameMin: Cijk_Alik_Bljk_SB_MT016x016x16_GRVW02_GSU02_SNLL0_TT02_02_VW02_WG08_08_04
    SolutionIndex: 384
    SolutionNameMin: Cijk_Alik_Bljk_SB_MT032x016x16_GRVW02_GSU02_SNLL0_TT04_02_VW02_WG08_08_04
    SolutionIndex: 385
    SolutionNameMin: Cijk_Alik_Bljk_SB_MT032x016x16_GRVW02_GSU02_SNLL0_TT02_02_VW02_WG16_08_02
    SolutionIndex: 386
    SolutionNameMin: Cijk_Alik_Bljk_SB_MT128x064x16_GRVW04_GSU02_SNLL0_TT08_08_VW04_WG16_08_02
    SolutionIndex: 387
    SolutionNameMin: Cijk_Alik_Bljk_SB_MT064x016x16_GRVW04_GSU04_SNLL0_TT04_04_VW04_WG16_04_04
    SolutionIndex: 388
    SolutionNameMin: Cijk_Alik_Bljk_SB_MT032x032x16_GRVW04_GSU04_SNLL0_TT04_04_VW04_WG08_08_02
    SolutionIndex: 389
    SolutionNameMin: Cijk_Alik_Bljk_SB_MT064x032x16_GRVW04_GSU04_SNLL0_TT08_04_VW04_WG08_08_02
    SolutionIndex: 390
    SolutionNameMin: Cijk_Alik_Bljk_SB_MT016x016x16_GRVW02_GSU04_SNLL0_TT02_02_VW02_WG08_08_04
    SolutionIndex: 391
    SolutionNameMin: Cijk_Alik_Bljk_SB_MT032x016x16_GRVW02_GSU04_SNLL0_TT04_02_VW02_WG08_08_04
    SolutionIndex: 392
    SolutionNameMin: Cijk_Alik_Bljk_SB_MT032x016x16_GRVW02_GSU04_SNLL0_TT02_02_VW02_WG16_08_02
    SolutionIndex: 393
    SolutionNameMin: Cijk_Alik_Bljk_SB_MT032x016x16_GRVW02_GSU04_SNLL0_TT04_02_VW02_WG08_08_02
    SolutionIndex: 394
    SolutionNameMin: Cijk_Alik_Bljk_SB_MT032x032x16_GRVW04_GSU04_SNLL0_TT04_04_VW04_WG08_08_02
    SolutionIndex: 395
    SolutionNameMin: Cijk_Alik_Bljk_SB_MT064x032x16_GRVW04_GSU04_SNLL0_TT08_04_VW04_WG08_08_02
    SolutionIndex: 396
    SolutionNameMin: Cijk_Alik_Bljk_SB_MT016x016x16_GRVW02_GSU04_SNLL0_TT02_02_VW02_WG08_08_04
    SolutionIndex: 397
    SolutionNameMin: Cijk_Alik_Bljk_SB_MT032x016x16_GRVW02_GSU04_SNLL0_TT04_02_VW02_WG08_08_04
    SolutionIndex: 398
    SolutionNameMin: Cijk_Alik_Bljk_SB_MT032x016x16_GRVW02_GSU04_SNLL0_TT02_02_VW02_WG16_08_02
    SolutionIndex: 399
    SolutionNameMin: Cijk_Alik_Bljk_SB_MT128x064x16_GRVW04_GSU04_SNLL0_TT08_08_VW04_WG16_08_02
    SolutionIndex: 400
    SolutionNameMin: Cijk_Alik_Bljk_SB_MT016x016x16_GRVW02_GSU08_SNLL0_TT02_02_VW02_WG08_08_04
    SolutionIndex: 401
    SolutionNameMin: Cijk_Alik_Bljk_SB_MT016x016x16_GRVW02_GSU08_SNLL0_TT02_02_VW02_WG08_08_04
    SolutionIndex: 402
    SolutionNameMin: Cijk_Alik_Bljk_SB_MT032x016x16_GRVW02_GSU08_SNLL0_TT02_02_VW02_WG16_08_02
    SolutionIndex: 403
    SolutionNameMin: Cijk_Alik_Bljk_SB_MT064x064x24_GRVW04_GSU02_SNLL0_TT08_08_VW04_WG08_08_02
    SolutionIndex: 404
    SolutionNameMin: Cijk_Alik_Bljk_SB_MT064x064x24_GRVW04_GSU02_SNLL0_TT08_08_VW04_WG08_08_02
    SolutionIndex: 405
    SolutionNameMin: Cijk_Alik_Bljk_SB_MT064x064x24_GRVW04_GSU04_SNLL0_TT08_08_VW04_WG08_08_02
    SolutionIndex: 406
    SolutionNameMin: Cijk_Alik_Bljk_SB_MT064x064x24_GRVW04_GSU04_SNLL0_TT08_08_VW04_WG08_08_02
    SolutionIndex: 407
    SolutionNameMin: Cijk_Alik_Bljk_SB_MT032x032x32_GRVW04_GSU02_SNLL0_TT04_04_VW04_WG08_08_02
    SolutionIndex: 408
    SolutionNameMin: Cijk_Alik_Bljk_SB_MT032x032x32_GRVW04_GSU02_SNLL0_TT04_04_VW04_WG08_08_04
    SolutionIndex: 409
    SolutionNameMin: Cijk_Alik_Bljk_SB_MT064x032x32_GRVW04_GSU02_SNLL0_TT08_04_VW04_WG08_08_04
    SolutionIndex: 410
    SolutionNameMin: Cijk_Alik_Bljk_SB_MT128x032x32_GRVW04_GSU02_SNLL0_TT08_04_VW04_WG16_08_02
    SolutionIndex: 411
    SolutionNameMin: Cijk_Alik_Bljk_SB_MT032x032x32_GRVW04_GSU02_SNLL0_TT04_04_VW04_WG08_08_04
    SolutionIndex: 412
    SolutionNameMin: Cijk_Alik_Bljk_SB_MT064x032x32_GRVW04_GSU02_SNLL0_TT08_04_VW04_WG08_08_04
    SolutionIndex: 413
    SolutionNameMin: Cijk_Alik_Bljk_SB_MT064x064x32_GRVW04_GSU02_SNLL0_TT08_08_VW04_WG08_08_04
    SolutionIndex: 414
    SolutionNameMin: Cijk_Alik_Bljk_SB_MT064x032x32_GRVW04_GSU02_SNLL0_TT04_04_VW04_WG16_08_02
    SolutionIndex: 415
    SolutionNameMin: Cijk_Alik_Bljk_SB_MT032x008x32_GRVW02_GSU04_SNLL0_TT02_02_VW02_WG16_04_04
    SolutionIndex: 416
    SolutionNameMin: Cijk_Alik_Bljk_SB_MT064x064x32_GRVW04_GSU04_SNLL0_TT08_08_VW04_WG08_08_02
    SolutionIndex: 417
    SolutionNameMin: Cijk_Alik_Bljk_SB_MT032x032x32_GRVW04_GSU04_SNLL0_TT04_04_VW04_WG08_08_04
    SolutionIndex: 418
    SolutionNameMin: Cijk_Alik_Bljk_SB_MT032x032x32_GRVW04_GSU04_SNLL0_TT04_04_VW04_WG08_08_04
    SolutionIndex: 419
    SolutionNameMin: Cijk_Alik_Bljk_SB_MT064x032x32_GRVW04_GSU04_SNLL0_TT08_04_VW04_WG08_08_04
    SolutionIndex: 420
    SolutionNameMin: Cijk_Alik_Bljk_SB_MT064x032x32_GRVW04_GSU04_SNLL0_TT04_04_VW04_WG16_08_02
    SolutionIndex: 421
    SolutionNameMin: Cijk_Alik_Bljk_SB_MT064x064x16_GRVW04_GSU01_SNLL0_TT04_04_VW04_WG16_16_01
    SolutionIndex: 422
    SolutionNameMin: Cijk_Alik_Bljk_SB_MT064x128x16_GRVW04_GSU01_SNLL0_TT04_08_VW04_WG16_16_01
    SolutionIndex: 423
    SolutionNameMin: Cijk_Alik_Bljk_SB_MT096x128x16_GRVW02_GSU01_SNLL0_TT06_08_VW02_WG16_16_01
    SolutionIndex: 424
    SolutionNameMin: Cijk_Alik_Bljk_SB_MT128x064x16_GRVW04_GSU01_SNLL0_TT08_04_VW04_WG16_16_01
    SolutionIndex: 425
    SolutionNameMin: Cijk_Alik_Bljk_SB_MT064x064x16_GRVW04_GSU01_SNLL0_TT04_04_VW04_WG16_16_01
    SolutionIndex: 426
    SolutionNameMin: Cijk_Alik_Bljk_SB_MT064x128x16_GRVW04_GSU01_SNLL0_TT04_08_VW04_WG16_16_01
    SolutionIndex: 427
    SolutionNameMin: Cijk_Alik_Bljk_SB_MT128x064x16_GRVW04_GSU01_SNLL0_TT08_04_VW04_WG16_16_01
    SolutionIndex: 428
    SolutionNameMin: Cijk_Alik_Bljk_SB_MT064x064x32_GRVW04_GSU01_SNLL0_TT04_04_VW04_WG16_16_01
    SolutionIndex: 429
    SolutionNameMin: Cijk_Alik_Bljk_SB_MT064x064x32_GRVW04_GSU01_SNLL0_TT04_04_VW04_WG16_16_01
    SolutionIndex: 430
    SolutionNameMin: Cijk_Alik_Bljk_SB_MT128x128x08_GRVW04_GSU01_SNLL1_TT08_08_VW04_WG16_16_01
    SolutionIndex: 431
    SolutionNameMin: Cijk_Alik_Bljk_SB_MT128x128x08_GRVW04_GSU01_SNLL1_TT08_08_VW04_WG16_16_01
    SolutionIndex: 432
    SolutionNameMin: Cijk_Alik_Bljk_SB_MT064x064x16_GRVW04_GSU01_SNLL1_TT04_04_VW04_WG16_16_01
    SolutionIndex: 433
    SolutionNameMin: Cijk_Alik_Bljk_SB_MT064x128x16_GRVW04_GSU01_SNLL1_TT04_08_VW04_WG16_16_01
    SolutionIndex: 434
    SolutionNameMin: Cijk_Alik_Bljk_SB_MT096x128x16_GRVW02_GSU01_SNLL1_TT06_08_VW02_WG16_16_01
    SolutionIndex: 435
    SolutionNameMin: Cijk_Alik_Bljk_SB_MT128x064x16_GRVW04_GSU01_SNLL1_TT08_04_VW04_WG16_16_01
    SolutionIndex: 436
    SolutionNameMin: Cijk_Alik_Bljk_SB_MT128x096x16_GRVW02_GSU01_SNLL1_TT08_06_VW02_WG16_16_01
    SolutionIndex: 437
    SolutionNameMin: Cijk_Alik_Bljk_SB_MT128x128x16_GRVW04_GSU01_SNLL1_TT08_08_VW04_WG16_16_01
    SolutionIndex: 438
    SolutionNameMin: Cijk_Alik_Bljk_SB_MT064x064x16_GRVW04_GSU01_SNLL1_TT04_04_VW04_WG16_16_01
    SolutionIndex: 439
    SolutionNameMin: Cijk_Alik_Bljk_SB_MT064x128x16_GRVW04_GSU01_SNLL1_TT04_08_VW04_WG16_16_01
    SolutionIndex: 440
    SolutionNameMin: Cijk_Alik_Bljk_SB_MT096x128x16_GRVW02_GSU01_SNLL1_TT06_08_VW02_WG16_16_01
    SolutionIndex: 441
    SolutionNameMin: Cijk_Alik_Bljk_SB_MT128x064x16_GRVW04_GSU01_SNLL1_TT08_04_VW04_WG16_16_01
    SolutionIndex: 442
    SolutionNameMin: Cijk_Alik_Bljk_SB_MT128x096x16_GRVW02_GSU01_SNLL1_TT08_06_VW02_WG16_16_01
    SolutionIndex: 443
    SolutionNameMin: Cijk_Alik_Bljk_SB_MT128x128x16_GRVW04_GSU01_SNLL1_TT08_08_VW04_WG16_16_01
    SolutionIndex: 444
    SolutionNameMin: Cijk_Alik_Bljk_SB_MT128x128x24_GRVW04_GSU01_SNLL1_TT08_08_VW04_WG16_16_01
    SolutionIndex: 445
    SolutionNameMin: Cijk_Alik_Bljk_SB_MT128x128x24_GRVW04_GSU01_SNLL1_TT08_08_VW04_WG16_16_01
    SolutionIndex: 446
    SolutionNameMin: Cijk_Alik_Bljk_SB_MT064x064x32_GRVW04_GSU01_SNLL1_TT04_04_VW04_WG16_16_01
    SolutionIndex: 448
    SolutionNameMin: Cijk_Alik_Bljk_SB_MT128x128x32_GRVW04_GSU01_SNLL1_TT08_08_VW04_WG16_16_01
    SolutionIndex: 449
    SolutionNameMin: Cijk_Alik_Bljk_SB_MT064x064x32_GRVW04_GSU01_SNLL1_TT04_04_VW04_WG16_16_01
    SolutionIndex: 450
    SolutionNameMin: Cijk_Alik_Bljk_SB_MT064x128x32_GRVW04_GSU01_SNLL1_TT04_08_VW04_WG16_16_01
    SolutionIndex: 451
    SolutionNameMin: Cijk_Alik_Bljk_SB_MT128x128x32_GRVW04_GSU01_SNLL1_TT08_08_VW04_WG16_16_01
    SolutionIndex: 452
    SolutionNameMin: Cijk_Alik_Bljk_SB_MT016x016x04_GRVW02_GSU01_SNLL0_TT02_02_VW02_WG08_08_01
    SolutionIndex: 453
    SolutionNameMin: Cijk_Alik_Bljk_SB_MT032x032x02_GRVW04_GSU01_SNLL0_TT04_04_VW04_WG08_08_01
    SolutionIndex: 454
    SolutionNameMin: Cijk_Alik_Bljk_SB_MT016x016x16_GRVW02_GSU01_SNLL1_TT02_02_VW02_WG08_08_04
    SolutionIndex: 455
    SolutionNameMin: Cijk_Alik_Bljk_SB_MT008x008x08_GRVW02_GSU02_SNLL0_TT02_02_VW02_WG04_04_04
    SolutionIndex: 456
    SolutionNameMin: Cijk_Alik_Bljk_SB_MT008x008x08_GRVW02_GSU04_SNLL0_TT02_02_VW02_WG04_04_04
    SolutionIndex: 457
    SolutionNameMin: Cijk_Alik_Bljk_SB_MT008x008x08_GRVW02_GSU08_SNLL0_TT02_02_VW02_WG04_04_04
    SolutionIndex: 458
    SolutionNameMin: Cijk_Alik_Bljk_SB_MT008x008x08_GRVW02_GSU16_SNLL0_TT02_02_VW02_WG04_04_04
    SolutionIndex: 459
    SolutionNameMin: Cijk_Alik_Bljk_SB_MT016x016x16_GRVW02_GSU16_SNLL0_TT02_02_VW02_WG08_08_04
    SolutionIndex: 460
    SolutionNameMin: Cijk_Alik_Bljk_SB_MT064x032x16_GRVW01_GSU04_LPA01_LPB01_PGR1_PLR1_TT04_04_USFGRO01_VW01_WG16_08_02_WGM01
    SolutionIndex: 461
    SolutionNameMin: Cijk_Alik_Bljk_SB_MT064x016x16_GRVW01_GSU04_LPA01_LPB01_PGR1_PLR1_TT04_04_USFGRO01_VW01_WG16_04_04_WGM01
    SolutionIndex: 462
    SolutionNameMin: Cijk_Alik_Bljk_SB_MT064x016x32_GRVW01_GSU08_LPA01_LPB01_PGR1_PLR1_TT04_04_USFGRO01_VW01_WG16_04_04_WGM01
    SolutionIndex: 463
    SolutionNameMin: Cijk_Alik_Bljk_SB_MT064x016x32_GRVW01_GSU08_LPA01_LPB01_PGR1_PLR1_TT04_04_USFGRO01_VW01_WG16_04_04_WGM08
    SolutionIndex: 464
    SolutionNameMin: Cijk_Alik_Bljk_SB_MT064x032x32_GRVW01_GSU01_LPA02_LPB02_PGR1_PLR1_TT04_08_USFGRO01_VW02_WG16_04_04_WGM01
    SolutionIndex: 465
    SolutionNameMin: Cijk_Alik_Bljk_SB_MT032x008x32_GRVW01_GSU08_LPA02_LPB02_PGR1_PLR1_TT02_02_USFGRO01_VW02_WG16_04_04_WGM01
    SolutionIndex: 466
    SolutionNameMin: Cijk_Alik_Bljk_SB_MT064x032x16_GRVW01_GSU01_LPA04_LPB04_PGR1_PLR1_TT04_04_USFGRO01_VW04_WG16_08_02_WGM01
    SolutionIndex: 467
    SolutionNameMin: Cijk_Alik_Bljk_SB_MT128x064x16_GRVW01_GSU01_LPA04_LPB04_PGR1_PLR1_TT04_08_USFGRO01_VW04_WG32_08_01_WGM01
    SolutionIndex: 468
    SolutionNameMin: Cijk_Alik_Bljk_SB_MT128x064x16_GRVW04_GSU01_LPA04_LPB04_PGR1_PLR1_TT04_08_USFGRO0_VW04_WG32_08_01_WGM01
    SolutionIndex: 473
    SolutionNameMin: Cijk_Alik_Bljk_SB_MT64x64x16_EPS1_GSU5_LPA0_LPB0_PGR1_SNLL0_TT4_4_VW2_WG16_16_1_WGM1
    SolutionIndex: 475
    SolutionNameMin: Cijk_Alik_Bljk_SB_MT64x64x16_EPS1_GSU5_LPA0_LPB0_PGR1_SNLL0_TT4_4_VW2_WG16_16_1_WGM8
    SolutionIndex: 476
    SolutionNameMin: Cijk_Alik_Bljk_SB_MT64x64x16_EPS1_GSU3_LPA0_LPB0_PGR1_SNLL0_TT4_4_VW2_WG16_16_1_WGM64
    SolutionIndex: 478
    SolutionNameMin: Cijk_Alik_Bljk_SB_MT64x64x16_EPS1_GSU5_LPA0_LPB0_PGR1_SNLL0_TT4_4_VW2_WG16_16_1_WGM64
    SolutionIndex: 480
    SolutionNameMin: Cijk_Alik_Bljk_SB_MT128x128x16_EPS1_GSU1_LPA0_LPB0_PGR1_SNLL1_TT8_8_VW4_WG16_16_1_WGM1
    SolutionIndex: 481
    SolutionNameMin: Cijk_Alik_Bljk_SB_MT64x64x16_EPS1_GSU3_LPA0_LPB0_PGR1_SNLL0_TT4_4_VW4_WG16_16_1_WGM1
    SolutionIndex: 482
    SolutionNameMin: Cijk_Alik_Bljk_SB_MT128x128x16_EPS1_GSU1_LPA0_LPB0_PGR1_SNLL1_TT8_8_VW4_WG16_16_1_WGM8
    SolutionIndex: 485
    SolutionNameMin: Cijk_Alik_Bljk_SB_MT128x128x16_EPS1_GSU1_LPA0_LPB0_PGR1_SNLL1_TT8_8_VW4_WG16_16_1_WGM64
    SolutionIndex: 488
    SolutionNameMin: Cijk_Alik_Bljk_SB_MT64x32x16_EPS1_GSU3_LPA2_LPB0_PGR1_SNLL0_TT4_4_VW2_WG16_8_1_WGM1
    SolutionIndex: 490
    SolutionNameMin: Cijk_Alik_Bljk_SB_MT64x64x16_EPS1_GSU5_LPA2_LPB0_PGR1_SNLL0_TT4_4_VW2_WG16_16_1_WGM1
    SolutionIndex: 493
    SolutionNameMin: Cijk_Alik_Bljk_SB_MT64x32x16_EPS1_GSU3_LPA2_LPB0_PGR1_SNLL0_TT4_4_VW2_WG16_8_1_WGM8
    SolutionIndex: 510
    SolutionNameMin: Cijk_Alik_Bljk_SB_MT64x64x16_EPS1_GSU5_LPA0_LPB2_PGR1_SNLL0_TT4_4_VW2_WG16_16_1_WGM1
    SolutionIndex: 511
    SolutionNameMin: Cijk_Alik_Bljk_SB_MT64x64x16_EPS1_GSU3_LPA0_LPB2_PGR1_SNLL0_TT4_4_VW2_WG16_16_1_WGM64
    SolutionIndex: 516
    SolutionNameMin: Cijk_Alik_Bljk_SB_MT64x32x16_EPS1_GSU5_LPA0_LPB4_PGR1_SNLL0_TT4_4_VW4_WG16_8_1_WGM1
    SolutionIndex: 519
    SolutionNameMin: Cijk_Alik_Bljk_SB_MT64x256x16_EPS1_GSU1_LPA0_LPB4_PGR1_SNLL1_TT8_8_VW4_WG8_32_1_WGM8
    SolutionIndex: 521
    SolutionNameMin: Cijk_Alik_Bljk_SB_MT128x32x16_EPS0_GSU1_LPA0_LPB4_PGR0_SNLL0_TT4_4_VW4_WG32_8_1_WGM8
    SolutionIndex: 522
    SolutionNameMin: Cijk_Alik_Bljk_SB_MT64x32x16_EPS1_GSU5_LPA0_LPB4_PGR1_SNLL0_TT4_4_VW4_WG16_8_1_WGM8
    SolutionIndex: 523
    SolutionNameMin: Cijk_Alik_Bljk_SB_MT64x64x16_EPS1_GSU5_LPA0_LPB4_PGR1_SNLL0_TT4_4_VW4_WG16_16_1_WGM8
    SolutionIndex: 529
    SolutionNameMin: Cijk_Alik_Bljk_SB_MT64x32x16_EPS1_GSU5_LPA0_LPB4_PGR1_SNLL0_TT4_4_VW4_WG16_8_1_WGM64
    SolutionIndex: 535
    SolutionNameMin: Cijk_Alik_Bljk_SB_MT64x64x16_EPS1_GSU3_LPA2_LPB2_PGR1_SNLL0_TT4_4_VW2_WG16_16_1_WGM1
    SolutionIndex: 537
    SolutionNameMin: Cijk_Alik_Bljk_SB_MT128x32x16_EPS1_GSU3_LPA2_LPB2_PGR1_SNLL0_TT4_4_VW2_WG32_8_1_WGM1
    SolutionIndex: 538
    SolutionNameMin: Cijk_Alik_Bljk_SB_MT64x32x16_EPS1_GSU5_LPA2_LPB2_PGR1_SNLL0_TT4_4_VW2_WG16_8_1_WGM1
    SolutionIndex: 541
    SolutionNameMin: Cijk_Alik_Bljk_SB_MT128x64x16_EPS1_GSU5_LPA2_LPB2_PGR1_SNLL0_TT8_4_VW2_WG16_16_1_WGM1
    SolutionIndex: 553
    SolutionNameMin: Cijk_Alik_Bljk_SB_MT64x128x16_EPS1_GSU3_LPA2_LPB2_PGR1_SNLL0_TT4_8_VW2_WG16_16_1_WGM64
    SolutionIndex: 555
    SolutionNameMin: Cijk_Alik_Bljk_SB_MT64x32x16_EPS1_GSU5_LPA2_LPB2_PGR1_SNLL0_TT4_4_VW2_WG16_8_1_WGM64
    SolutionIndex: 556
    SolutionNameMin: Cijk_Alik_Bljk_SB_MT64x64x16_EPS1_GSU5_LPA2_LPB2_PGR1_SNLL0_TT4_4_VW2_WG16_16_1_WGM64
    SolutionIndex: 562
    SolutionNameMin: Cijk_Alik_Bljk_SB_MT64x32x16_EPS1_GSU1_LPA4_LPB4_PGR1_SNLL1_TT4_4_VW4_WG16_8_1_WGM1
    SolutionIndex: 566
    SolutionNameMin: Cijk_Alik_Bljk_SB_MT128x32x16_EPS1_GSU1_LPA4_LPB4_PGR1_SNLL1_TT4_4_VW4_WG32_8_1_WGM1
    SolutionIndex: 572
    SolutionNameMin: Cijk_Alik_Bljk_SB_MT64x64x16_EPS1_GSU1_LPA4_LPB4_PGR1_SNLL1_TT4_4_VW4_WG16_16_1_WGM8
    SolutionIndex: 573
    SolutionNameMin: Cijk_Alik_Bljk_SB_MT64x128x16_EPS1_GSU1_LPA4_LPB4_PGR1_SNLL1_TT4_8_VW4_WG16_16_1_WGM8
    SolutionIndex: 574
    SolutionNameMin: Cijk_Alik_Bljk_SB_MT128x64x16_EPS1_GSU1_LPA4_LPB4_PGR1_SNLL1_TT8_4_VW4_WG16_16_1_WGM8
    SolutionIndex: 575
    SolutionNameMin: Cijk_Alik_Bljk_SB_MT128x128x16_EPS1_GSU1_LPA4_LPB4_PGR1_SNLL1_TT8_8_VW4_WG16_16_1_WGM8
    SolutionIndex: 576
    SolutionNameMin: Cijk_Alik_Bljk_SB_MT128x32x16_EPS0_GSU1_LPA4_LPB4_PGR0_SNLL0_TT4_4_VW4_WG32_8_1_WGM8
    SolutionIndex: 577
    SolutionNameMin: Cijk_Alik_Bljk_SB_MT128x32x16_EPS1_GSU1_LPA4_LPB4_PGR1_SNLL1_TT4_4_VW4_WG32_8_1_WGM8
    SolutionIndex: 578
    SolutionNameMin: Cijk_Alik_Bljk_SB_MT128x64x16_EPS1_GSU1_LPA4_LPB4_PGR1_SNLL1_TT4_8_VW4_WG32_8_1_WGM8
    SolutionIndex: 581
    SolutionNameMin: Cijk_Alik_Bljk_SB_MT32x128x16_EPS1_GSU1_LPA4_LPB4_PGR1_SNLL1_TT4_4_VW4_WG8_32_1_WGM64
    SolutionIndex: 582
    SolutionNameMin: Cijk_Alik_Bljk_SB_MT64x128x16_EPS1_GSU1_LPA4_LPB4_PGR1_SNLL1_TT8_4_VW4_WG8_32_1_WGM64
    SolutionIndex: 583
    SolutionNameMin: Cijk_Alik_Bljk_SB_MT64x64x16_EPS1_GSU1_LPA4_LPB4_PGR1_SNLL1_TT4_4_VW4_WG16_16_1_WGM64
    SolutionIndex: 584
    SolutionNameMin: Cijk_Alik_Bljk_SB_MT64x128x16_EPS1_GSU1_LPA4_LPB4_PGR1_SNLL1_TT4_8_VW4_WG16_16_1_WGM64
    SolutionIndex: 585
    SolutionNameMin: Cijk_Alik_Bljk_SB_MT128x64x16_EPS1_GSU1_LPA4_LPB4_PGR1_SNLL1_TT8_4_VW4_WG16_16_1_WGM64
    SolutionIndex: 588
    SolutionNameMin: Cijk_Alik_Bljk_SB_MT128x64x16_EPS1_GSU1_LPA4_LPB4_PGR1_SNLL1_TT4_8_VW4_WG32_8_1_WGM64
    SolutionIndex: 594
    SolutionNameMin: Cijk_Alik_Bljk_SB_MT64x128x32_EPS1_GSU1_LPA4_LPB4_PGR1_SNLL1_TT4_8_VW4_WG16_16_1_WGM8
    SolutionIndex: 596
    SolutionNameMin: Cijk_Alik_Bljk_SB_MT64x128x32_EPS1_GSU1_LPA4_LPB4_PGR1_SNLL1_TT4_8_VW4_WG16_16_1_WGM64
- - - [1024, 128, 1, 128]
    - [12, 896.219]
  - - [4, 704, 1, 1280]
    - [49, 328.876]
  - - [4, 1856, 1, 3328]
    - [59, 501.361]
  - - [1856, 448, 1, 3328]
    - [104, 5677.91]
  - - [2944, 4288, 1, 1280]
    - [90, 8412.39]
  - - [2368, 64, 1, 3328]
    - [40, 4913.92]
  - - [1760, 32, 1, 1760]
    - [67, 3312.94]
  - - [2368, 5888, 1, 256]
    - [90, 6489.72]
  - - [5888, 1856, 1, 256]
    - [102, 7791.88]
  - - [128, 64, 1, 256]
    - [74, 369.217]
  - - [512, 24000, 1, 1536]
    - [96, 8827.37]
  - - [128, 6784, 1, 3328]
    - [96, 6536.99]
  - - [5888, 1408, 1, 256]
    - [110, 6129.61]
  - - [5888, 1856, 1, 3328]
    - [96, 7969.17]
  - - [5056, 704, 1, 256]
    - [96, 6723.82]
  - - [2048, 400, 1, 512]
    - [102, 4531.44]
  - - [5888, 2944, 1, 3328]
    - [102, 8608.04]
  - - [1856, 4288, 1, 256]
    - [102, 6297.54]
  - - [1024, 5056, 1, 128]
    - [80, 3595.37]
  - - [5056, 5056, 1, 3328]
    - [96, 8559.16]
  - - [1408, 5888, 1, 1280]
    - [91, 6797.06]
  - - [2368, 448, 1, 128]
    - [80, 2814.9]
  - - [2368, 6784, 1, 128]
    - [84, 4781.98]
  - - [1024, 3584, 1, 3328]
    - [92, 8402.44]
  - - [512, 48000, 1, 2048]
    - [96, 8162.23]
  - - [128, 448, 1, 1280]
    - [67, 2903.49]
  - - [256, 4288, 1, 3328]
    - [97, 6345.94]
  - - [5888, 1408, 1, 1280]
    - [96, 8959.45]
  - - [704, 1856, 1, 3328]
    - [91, 6955.27]
  - - [4, 1408, 1, 128]
    - [111, 60.0747]
  - - [1024, 2368, 1, 256]
    - [98, 5927.78]
  - - [64, 4, 1, 256]
    - [116, 13.2129]
  - - [1408, 1856, 1, 1280]
    - [94, 8051.58]
  - - [1408, 64, 1, 1280]
    - [70, 3400.45]
  - - [448, 1024, 1, 1280]
    - [98, 5729.92]
  - - [6144, 24000, 1, 2048]
    - [102, 7738.3]
  - - [4096, 32, 1, 4096]
    - [40, 2381.43]
  - - [256, 1408, 1, 3328]
    - [98, 4844.78]
  - - [5056, 5056, 1, 1280]
    - [102, 9090.1]
  - - [448, 5056, 1, 256]
    - [108, 4961.18]
  - - [704, 1856, 1, 1280]
    - [94, 6456.44]
  - - [128, 5056, 1, 128]
    - [23, 2251.02]
  - - [2368, 128, 1, 256]
    - [91, 3403.27]
  - - [1760, 6400, 1, 1760]
    - [90, 8959.7]
  - - [1856, 1408, 1, 128]
    - [83, 3493.06]
  - - [64, 5056, 1, 256]
    - [92, 2582.22]
  - - [6784, 256, 1, 3328]
    - [90, 7323.54]
  - - [6784, 4288, 1, 3328]
    - [92, 8542.09]
  - - [4288, 448, 1, 256]
    - [108, 5030.5]
  - - [64, 704, 1, 128]
    - [25, 375.467]
  - - [1856, 2368, 1, 3328]
    - [101, 6742.34]
  - - [4288, 2944, 1, 1280]
    - [102, 8578.17]
  - - [704, 5056, 1, 1280]
    - [98, 8014.45]
  - - [2368, 704, 1, 3328]
    - [97, 6544.31]
  - - [256, 5888, 1, 256]
    - [95, 5932.9]
  - - [1856, 4288, 1, 3328]
    - [101, 7410.72]
  - - [256, 2944, 1, 256]
    - [97, 5013.98]
  - - [5888, 1024, 1, 256]
    - [102, 8069.34]
  - - [448, 64, 1, 1280]
    - [77, 2057.18]
  - - [3072, 64, 1, 1024]
    - [57, 2145.42]
  - - [3584, 4, 1, 1280]
    - [49, 498.643]
  - - [16384, 3200, 1, 4096]
    - [89, 6621.43]
  - - [2944, 64, 1, 256]
    - [97, 2554.79]
  - - [128, 4, 1, 1280]
    - [59, 87.1489]
  - - [1408, 2944, 1, 256]
    - [96, 8029.35]
  - - [256, 1856, 1, 1280]
    - [91, 6170.6]
  - - [6784, 5056, 1, 3328]
    - [100, 7134.19]
  - - [5056, 5056, 1, 256]
    - [108, 6246.8]
  - - [1408, 6784, 1, 128]
    - [85, 4329.45]
  - - [64, 1024, 1, 1280]
    - [67, 3206.65]
  - - [2944, 4, 1, 256]
    - [116, 333.48]
  - - [704, 5056, 1, 128]
    - [80, 4085.42]
  - - [4, 2368, 1, 1280]
    - [117, 394.667]
  - - [2368, 2944, 1, 1280]
    - [96, 8633.95]
  - - [128, 3584, 1, 1280]
    - [97, 6046.15]
  - - [6784, 6784, 1, 1280]
    - [102, 8847.41]
  - - [1408, 4288, 1, 1280]
    - [102, 8236.69]
  - - [3584, 4288, 1, 1280]
    - [97, 7399.88]
  - - [2368, 704, 1, 1280]
    - [90, 6754.4]
  - - [5056, 4288, 1, 3328]
    - [96, 8569.53]
  - - [3584, 2368, 1, 3328]
    - [101, 7942.38]
  - - [64, 704, 1, 1280]
    - [70, 2363.59]
  - - [4288, 256, 1, 256]
    - [98, 4591.8]
  - - [2944, 128, 1, 128]
    - [23, 1878.29]
  - - [6144, 32, 1, 2560]
    - [68, 3334.1]
  - - [6784, 448, 1, 1280]
    - [100, 7939.2]
  - - [1408, 2944, 1, 128]
    - [84, 4096.51]
  - - [4288, 2944, 1, 256]
    - [90, 8141.13]
  - - [5888, 704, 1, 1280]
    - [91, 7516.13]
  - - [5056, 4, 1, 3328]
    - [34, 552.409]
  - - [1856, 64, 1, 1280]
    - [40, 3870.76]
  - - [1760, 16, 1, 1760]
    - [52, 2181.41]
  - - [448, 5888, 1, 128]
    - [85, 3371.0]
  - - [5888, 64, 1, 3328]
    - [65, 5319.38]
  - - [2944, 256, 1, 3328]
    - [97, 7122.3]
  - - [1024, 64, 1, 128]
    - [12, 595.782]
  - - [5056, 2368, 1, 1280]
    - [91, 7778.19]
  - - [448, 3584, 1, 1280]
    - [96, 6500.52]
  - - [6784, 5888, 1, 256]
    - [96, 8918.58]
  - - [704, 1024, 1, 128]
    - [80, 2627.41]
  - - [704, 128, 1, 1280]
    - [67, 3408.49]
  - - [4, 3584, 1, 128]
    - [111, 140.721]
  - - [1408, 448, 1, 1280]
    - [91, 5881.44]
  - - [1024, 1408, 1, 256]
    - [95, 5647.17]
  - - [2368, 2368, 1, 3328]
    - [89, 7688.73]
  - - [1856, 6784, 1, 128]
    - [80, 4705.85]
  - - [5056, 704, 1, 3328]
    - [100, 8198.88]
  - - [1408, 1856, 1, 256]
    - [102, 6339.95]
  - - [1408, 704, 1, 3328]
    - [94, 7599.55]
  - - [2368, 5056, 1, 256]
    - [102, 8242.75]
  - - [1408, 256, 1, 1280]
    - [97, 4879.16]
  - - [3072, 128, 1, 1024]
    - [66, 2525.42]
  - - [3584, 2368, 1, 1280]
    - [98, 8132.62]
  - - [4288, 64, 1, 3328]
    - [53, 5156.43]
  - - [2368, 4, 1, 1280]
    - [115, 482.65]
  - - [704, 5888, 1, 256]
    - [105, 5398.65]
  - - [6784, 2944, 1, 128]
    - [81, 4748.89]
  - - [2560, 1600, 1, 2560]
    - [92, 7354.9]
  - - [4288, 6784, 1, 3328]
    - [89, 7409.31]
  - - [2944, 256, 1, 256]
    - [97, 5077.32]
  - - [2944, 6784, 1, 3328]
    - [102, 8067.95]
  - - [704, 1408, 1, 3328]
    - [97, 7239.33]
  - - [6144, 5984, 1, 2048]
    - [96, 7175.97]
  - - [3584, 704, 1, 3328]
    - [102, 6642.76]
  - - [2944, 256, 1, 128]
    - [81, 2644.44]
  - - [6784, 4, 1, 1280]
    - [113, 402.387]
  - - [1024, 64, 1, 1280]
    - [67, 2601.93]
  - - [2048, 1600, 1, 512]
    - [94, 5592.4]
  - - [448, 4288, 1, 256]
    - [92, 6128.89]
  - - [64, 3584, 1, 3328]
    - [33, 5534.83]
  - - [1856, 4288, 1, 128]
    - [83, 4400.01]
  - - [704, 2368, 1, 1280]
    - [108, 5734.92]
  - - [1856, 2368, 1, 1280]
    - [105, 6482.3]
  - - [2368, 128, 1, 3328]
    - [78, 4717.22]
  - - [2944, 128, 1, 256]
    - [105, 3276.8]
  - - [448, 1408, 1, 256]
    - [97, 4852.18]
  - - [1856, 4288, 1, 1280]
    - [92, 8132.86]
  - - [64, 5056, 1, 3328]
    - [68, 5096.96]
  - - [4, 704, 1, 256]
    - [115, 128.731]
  - - [1024, 448, 1, 128]
    - [80, 1816.84]
  - - [704, 4, 1, 1280]
    - [116, 328.876]
  - - [704, 256, 1, 128]
    - [84, 876.469]
  - - [704, 2944, 1, 128]
    - [84, 3734.37]
  - - [1408, 1024, 1, 1280]
    - [92, 7224.75]
  - - [704, 6784, 1, 256]
    - [96, 7354.67]
  - - [6784, 704, 1, 256]
    - [92, 6012.18]
  - - [5056, 1408, 1, 128]
    - [85, 4311.18]
  - - [2048, 7000, 1, 2048]
    - [96, 7231.97]
  - - [256, 3584, 1, 3328]
    - [100, 7005.9]
  - - [4, 5888, 1, 3328]
    - [118, 534.512]
  - - [128, 1408, 1, 128]
    - [10, 1176.97]
  - - [3584, 4288, 1, 3328]
    - [102, 7134.9]
  - - [5888, 1856, 1, 1280]
    - [90, 8394.93]
  - - [256, 1408, 1, 256]
    - [91, 3977.36]
  - - [5056, 64, 1, 1280]
    - [91, 4257.68]
  - - [1024, 704, 1, 256]
    - [91, 5036.83]
  - - [448, 128, 1, 128]
    - [12, 533.433]
  - - [2368, 3584, 1, 1280]
    - [96, 8272.33]
  - - [2368, 6784, 1, 1280]
    - [89, 8288.14]
  - - [1856, 4, 1, 1280]
    - [29, 464.0]
  - - [448, 448, 1, 256]
    - [91, 3058.35]
  - - [2944, 3584, 1, 3328]
    - [96, 8557.53]
  - - [7680, 32, 1, 2560]
    - [68, 3728.93]
  - - [128, 4288, 1, 128]
    - [11, 2116.1]
  - - [256, 256, 1, 3328]
    - [67, 4050.96]
  - - [128, 1024, 1, 3328]
    - [40, 5139.11]
  - - [4, 1408, 1, 3328]
    - [59, 502.771]
  - - [6784, 2944, 1, 256]
    - [90, 8445.96]
  - - [64, 1856, 1, 1280]
    - [32, 3870.76]
  - - [6784, 64, 1, 128]
    - [80, 1877.52]
  - - [4288, 2368, 1, 3328]
    - [100, 8419.3]
  - - [1856, 2368, 1, 256]
    - [94, 6887.38]
  - - [3584, 256, 1, 128]
    - [84, 2496.61]
  - - [3584, 6784, 1, 3328]
    - [96, 7626.08]
  - - [256, 1024, 1, 256]
    - [97, 3095.43]
  - - [4, 6784, 1, 3328]
    - [59, 589.174]
  - - [1024, 5888, 1, 3328]
    - [96, 7794.25]
  - - [1024, 128, 1, 1280]
    - [69, 3130.08]
  - - [3072, 32, 1, 1024]
    - [56, 1675.49]
  - - [6144, 24000, 1, 2560]
    - [96, 7256.04]
  - - [5056, 4288, 1, 1280]
    - [94, 8348.93]
  - - [5888, 64, 1, 256]
    - [43, 2593.25]
  - - [6784, 1856, 1, 3328]
    - [90, 8087.28]
  - - [1408, 5056, 1, 1280]
    - [92, 7802.53]
  - - [1856, 256, 1, 1280]
    - [97, 6150.63]
  - - [64, 5888, 1, 3328]
    - [64, 5301.39]
  - - [2368, 2368, 1, 1280]
    - [94, 8233.33]
  - - [2944, 5888, 1, 128]
    - [87, 3745.41]
  - - [704, 5888, 1, 1280]
    - [92, 8244.94]
  - - [2368, 3584, 1, 128]
    - [84, 4523.33]
  - - [1856, 5056, 1, 128]
    - [81, 4497.98]
  - - [704, 1024, 1, 1280]
    - [105, 5479.49]
  - - [448, 256, 1, 3328]
    - [48, 5048.7]
  - - [448, 1856, 1, 128]
    - [81, 2936.82]
  - - [8192, 3200, 1, 2048]
    - [90, 6713.02]
  - - [128, 1024, 1, 128]
    - [26, 998.644]
  - - [2944, 4, 1, 128]
    - [111, 98.6471]
  - - [1024, 704, 1, 1280]
    - [97, 5896.9]
  - - [128, 5888, 1, 256]
    - [97, 5013.98]
  - - [1024, 5056, 1, 1280]
    - [96, 8857.71]
  - - [4288, 1024, 1, 256]
    - [102, 6195.29]
  - - [2944, 2368, 1, 128]
    - [80, 4442.13]
  - - [704, 704, 1, 3328]
    - [97, 6764.3]
  - - [704, 1408, 1, 1280]
    - [98, 7383.48]
  - - [5888, 448, 1, 1280]
    - [96, 7299.39]
  - - [3584, 256, 1, 3328]
    - [94, 7061.62]
  - - [704, 5888, 1, 3328]
    - [98, 8142.32]
  - - [704, 1856, 1, 128]
    - [84, 3139.04]
  - - [448, 448, 1, 3328]
    - [62, 5063.24]
  - - [4, 4288, 1, 128]
    - [112, 64.8775]
  - - [128, 704, 1, 1280]
    - [32, 3400.45]
  - - [3584, 2944, 1, 256]
    - [102, 7982.04]
  - - [3584, 4, 1, 128]
    - [111, 105.218]
  - - [1856, 128, 1, 3328]
    - [63, 5442.09]
  - - [4, 64, 1, 1280]
    - [117, 42.2268]
  - - [2944, 448, 1, 128]
    - [80, 2926.85]
  - - [128, 2944, 1, 1280]
    - [91, 5109.59]
  - - [64, 64, 1, 3328]
    - [59, 1252.89]
  - - [448, 2944, 1, 1280]
    - [100, 6684.37]
  - - [512, 24000, 1, 2048]
    - [96, 7938.93]
  - - [128, 256, 1, 3328]
    - [77, 3276.8]
  - - [1408, 5056, 1, 3328]
    - [102, 8959.11]
  - - [1856, 1856, 1, 3328]
    - [92, 8006.07]
  - - [3584, 128, 1, 256]
    - [97, 4292.42]
  - - [2560, 800, 1, 2560]
    - [92, 6262.38]
  - - [448, 1408, 1, 3328]
    - [108, 4997.25]
  - - [2368, 2368, 1, 256]
    - [110, 4978.84]
  - - [4288, 4288, 1, 1280]
    - [89, 8617.68]
  - - [64, 448, 1, 1280]
    - [35, 2057.18]
  - - [5888, 1024, 1, 1280]
    - [107, 6848.07]
  - - [1408, 4288, 1, 256]
    - [90, 7076.91]
  - - [448, 4, 1, 256]
    - [115, 84.3294]
  - - [5888, 448, 1, 128]
    - [84, 3493.81]
  - - [512, 48000, 1, 2560]
    - [102, 8960.03]
  - - [35, 8457, 1, 1760]
    - [4, 3934.68]
  - - [704, 6784, 1, 3328]
    - [89, 8180.78]
  - - [2560, 6400, 1, 2560]
    - [90, 7822.14]
  - - [5056, 1024, 1, 1280]
    - [92, 8357.28]
  - - [448, 5888, 1, 3328]
    - [96, 7505.18]
  - - [128, 4, 1, 128]
    - [111, 0.562251]
  - - [1024, 2944, 1, 1280]
    - [96, 8406.14]
  - - [5056, 5888, 1, 1280]
    - [96, 8819.66]
  - - [4288, 5888, 1, 128]
    - [81, 3522.22]
  - - [256, 3584, 1, 256]
    - [92, 5883.79]
  - - [1408, 3584, 1, 128]
    - [80, 4283.31]
  - - [256, 2944, 1, 3328]
    - [100, 5670.53]
  - - [448, 3584, 1, 128]
    - [84, 3171.62]
  - - [5888, 2944, 1, 1280]
    - [102, 8198.76]
  - - [4, 6784, 1, 1280]
    - [49, 553.796]
  - - [2368, 5888, 1, 128]
    - [80, 4787.22]
  - - [8448, 16, 1, 2816]
    - [39, 2452.53]
  - - [64, 2944, 1, 128]
    - [12, 1376.56]
  - - [2368, 4, 1, 256]
    - [34, 278.077]
  - - [3584, 5888, 1, 256]
    - [110, 6233.56]
  - - [2368, 1024, 1, 128]
    - [81, 3781.41]
  - - [2368, 704, 1, 128]
    - [81, 3198.22]
  - - [3584, 2944, 1, 1280]
    - [92, 8045.58]
  - - [3584, 2368, 1, 128]
    - [81, 4188.47]
  - - [5056, 704, 1, 128]
    - [84, 4019.11]
  - - [448, 2368, 1, 128]
    - [86, 2522.11]
  - - [5056, 1408, 1, 3328]
    - [94, 8349.83]
  - - [1408, 704, 1, 256]
    - [100, 4741.32]
  - - [6784, 1024, 1, 3328]
    - [102, 8769.4]
  - - [6784, 2944, 1, 3328]
    - [99, 7319.64]
  - - [2944, 5056, 1, 3328]
    - [89, 8889.66]
  - - [1856, 1856, 1, 256]
    - [92, 6309.74]
  - - [1024, 5888, 1, 128]
    - [83, 3759.5]
  - - [6784, 2368, 1, 1280]
    - [92, 8298.3]
  - - [256, 4, 1, 128]
    - [111, 7.00171]
  - - [4288, 5888, 1, 1280]
    - [96, 8365.18]
  - - [4288, 4288, 1, 256]
    - [96, 6513.68]
  - - [8448, 32, 1, 2816]
    - [67, 4257.64]
  - - [448, 2944, 1, 3328]
    - [100, 6875.52]
  - - [5888, 4, 1, 128]
    - [111, 163.84]
  - - [4288, 1856, 1, 1280]
    - [96, 8402.81]
  - - [1856, 2944, 1, 3328]
    - [96, 6612.11]
  - - [256, 6784, 1, 3328]
    - [97, 7358.6]
  - - [64, 5888, 1, 256]
    - [91, 3358.95]
  - - [256, 5056, 1, 128]
    - [84, 2489.11]
  - - [5056, 1024, 1, 256]
    - [102, 8077.77]
  - - [704, 64, 1, 3328]
    - [46, 3288.3]
  - - [5056, 1856, 1, 3328]
    - [100, 8171.03]
  - - [4, 2944, 1, 3328]
    - [59, 546.743]
  - - [4, 5056, 1, 256]
    - [34, 378.461]
  - - [1856, 1408, 1, 256]
    - [102, 6320.78]
  - - [8448, 12000, 1, 2816]
    - [100, 7365.77]
  - - [6784, 128, 1, 3328]
    - [97, 6366.47]
  - - [4288, 1408, 1, 128]
    - [80, 4451.6]
  - - [1856, 5888, 1, 3328]
    - [98, 8619.66]
  - - [4288, 5056, 1, 256]
    - [102, 7288.95]
  - - [1408, 128, 1, 1280]
    - [40, 4291.05]
  - - [4096, 800, 1, 1024]
    - [91, 5867.79]
  - - [5056, 256, 1, 3328]
    - [97, 7527.51]
  - - [704, 704, 1, 256]
    - [97, 4417.75]
  - - [1024, 5888, 1, 1280]
    - [102, 8674.47]
  - - [6784, 2368, 1, 128]
    - [80, 4723.98]
  - - [4, 5056, 1, 1280]
    - [49, 540.207]
  - - [256, 64, 1, 1280]
    - [51, 1515.28]
  - - [128, 1856, 1, 1280]
    - [91, 4574.11]
  - - [1856, 1024, 1, 1280]
    - [96, 7741.51]
  - - [6784, 4288, 1, 1280]
    - [102, 8521.19]
  - - [2560, 64, 1, 2560]
    - [33, 3504.6]
  - - [1856, 1856, 1, 1280]
    - [92, 7779.21]
  - - [4096, 400, 1, 1024]
    - [102, 4157.71]
  - - [3072, 24000, 1, 1024]
    - [102, 8663.35]
  - - [128, 4288, 1, 3328]
    - [48, 5674.13]
  - - [4, 2368, 1, 3328]
    - [59, 525.38]
  - - [5888, 1856, 1, 128]
    - [84, 4099.64]
  - - [448, 704, 1, 1280]
    - [97, 4309.37]
  - - [128, 5056, 1, 1280]
    - [40, 5068.36]
  - - [1024, 448, 1, 3328]
    - [100, 6077.72]
  - - [1856, 704, 1, 1280]
    - [108, 6257.39]
  - - [5056, 3584, 1, 128]
    - [81, 4598.42]
  - - [5888, 5888, 1, 3328]
    - [102, 8058.15]
  - - [6784, 1024, 1, 256]
    - [102, 5120.89]
  - - [2944, 2368, 1, 256]
    - [93, 6522.93]
  - - [256, 448, 1, 256]
    - [43, 1816.84]
  - - [5056, 5888, 1, 3328]
    - [95, 6722.31]
  - - [1856, 1024, 1, 256]
    - [102, 6632.21]
  - - [512, 48000, 1, 1536]
    - [96, 8555.91]
  - - [3584, 448, 1, 1280]
    - [91, 6566.99]
  - - [8448, 5984, 1, 2816]
    - [96, 8990.56]
  - - [448, 5888, 1, 256]
    - [96, 6220.37]
  - - [704, 64, 1, 128]
    - [9, 450.56]
  - - [1408, 6784, 1, 3328]
    - [89, 8478.58]
  - - [448, 1024, 1, 128]
    - [88, 1844.23]
  - - [4288, 704, 1, 128]
    - [84, 3895.16]
  - - [128, 1856, 1, 128]
    - [15, 1456.36]
  - - [448, 2368, 1, 3328]
    - [94, 5537.94]
  - - [5056, 64, 1, 128]
    - [80, 1648.84]
  - - [5056, 2944, 1, 256]
    - [96, 8230.77]
  - - [6784, 5888, 1, 128]
    - [80, 4873.09]
  - - [1024, 700, 1, 512]
    - [94, 4445.27]
  - - [704, 1024, 1, 256]
    - [92, 4707.89]
  - - [1024, 4, 1, 256]
    - [34, 174.763]
  - - [2944, 704, 1, 128]
    - [84, 3483.32]
  - - [128, 6784, 1, 1280]
    - [92, 6522.83]
  - - [1408, 3584, 1, 3328]
    - [96, 8673.49]
  - - [2368, 6784, 1, 256]
    - [92, 7941.66]
  - - [5056, 1408, 1, 1280]
    - [96, 8800.91]
  - - [256, 256, 1, 128]
    - [21, 551.882]
  - - [5056, 4288, 1, 128]
    - [88, 3793.54]
  - - [1408, 1856, 1, 128]
    - [80, 3067.64]
  - - [1408, 5888, 1, 3328]
    - [96, 9148.87]
  - - [1856, 256, 1, 256]
    - [92, 4319.42]
  - - [6784, 6784, 1, 256]
    - [92, 7668.43]
  - - [64, 256, 1, 128]
    - [26, 131.072]
  - - [4288, 2368, 1, 128]
    - [81, 4582.89]
  - - [256, 4288, 1, 1280]
    - [91, 6058.51]
  - - [2368, 2944, 1, 256]
    - [96, 8015.97]
  - - [4, 1856, 1, 256]
    - [113, 252.732]
  - - [3584, 1856, 1, 1280]
    - [92, 7760.14]
  - - [6784, 6784, 1, 128]
    - [81, 4970.04]
  - - [256, 1856, 1, 128]
    - [87, 1580.49]
  - - [704, 64, 1, 1280]
    - [76, 2556.37]
  - - [5888, 5056, 1, 256]
    - [96, 8216.57]
  - - [8448, 48000, 1, 2816]
    - [102, 4082.79]
  - - [3584, 448, 1, 256]
    - [96, 5518.82]
  - - [448, 4288, 1, 128]
    - [84, 3415.15]
  - - [7680, 64, 1, 2560]
    - [45, 5162.0]
  - - [256, 6784, 1, 256]
    - [96, 6272.52]
  - - [1408, 4288, 1, 128]
    - [84, 4343.53]
  - - [2944, 704, 1, 3328]
    - [91, 7679.61]
  - - [128, 448, 1, 256]
    - [31, 1422.49]
  - - [5056, 256, 1, 1280]
    - [98, 5052.29]
  - - [2560, 32, 1, 2560]
    - [54, 3105.97]
  - - [3584, 3584, 1, 256]
    - [102, 8260.47]
  - - [448, 1408, 1, 128]
    - [80, 2397.28]
  - - [128, 256, 1, 1280]
    - [35, 2340.57]
  - - [3584, 5056, 1, 256]
    - [102, 7347.46]
  - - [6784, 128, 1, 256]
    - [92, 5591.0]
  - - [4288, 4, 1, 256]
    - [34, 354.106]
  - - [704, 448, 1, 256]
    - [97, 3492.23]
  - - [2944, 2368, 1, 1280]
    - [104, 6661.61]
  - - [448, 64, 1, 3328]
    - [76, 3058.35]
  - - [1408, 3584, 1, 256]
    - [102, 7966.49]
  - - [3584, 4, 1, 3328]
    - [115, 605.459]
  - - [6784, 3584, 1, 256]
    - [92, 7525.31]
  - - [256, 128, 1, 128]
    - [24, 275.941]
  - - [704, 1408, 1, 128]
    - [81, 3109.75]
  - - [4, 2368, 1, 256]
    - [115, 283.275]
  - - [4288, 128, 1, 1280]
    - [97, 5132.55]
  - - [128, 1408, 1, 256]
    - [91, 2733.25]
  - - [4, 2944, 1, 256]
    - [113, 314.027]
  - - [64, 128, 1, 3328]
    - [61, 1514.61]
  - - [5056, 2368, 1, 128]
    - [85, 3449.07]
  - - [2944, 2944, 1, 3328]
    - [89, 8168.93]
  - - [5056, 6784, 1, 256]
    - [109, 5792.67]
  - - [1856, 3584, 1, 128]
    - [86, 4213.4]
  - - [128, 2944, 1, 128]
    - [10, 1970.36]
  - - [35, 8457, 1, 2560]
    - [5, 3525.05]
  - - [1024, 704, 1, 3328]
    - [91, 6784.89]
  - - [6784, 448, 1, 256]
    - [100, 6544.78]
  - - [3584, 6784, 1, 128]
    - [80, 4623.5]
  - - [128, 4288, 1, 256]
    - [94, 3606.5]
  - - [704, 448, 1, 3328]
    - [91, 4477.91]
  - - [128, 128, 1, 3328]
    - [76, 2177.55]
  - - [5056, 1856, 1, 256]
    - [110, 5608.62]
  - - [4608, 5984, 1, 1536]
    - [99, 7859.75]
  - - [256, 128, 1, 256]
    - [35, 998.644]
  - - [1760, 3200, 1, 1760]
    - [92, 8179.54]
  - - [1024, 1856, 1, 256]
    - [102, 6143.17]
  - - [4096, 1600, 1, 1024]
    - [110, 5851.42]
  - - [4288, 64, 1, 128]
    - [15, 1372.16]
  - - [256, 448, 1, 3328]
    - [54, 4795.0]
  - - [1408, 6784, 1, 1280]
    - [96, 8426.4]
  - - [3584, 3584, 1, 1280]
    - [96, 7556.46]
  - - [7680, 24000, 1, 2560]
    - [89, 5019.09]
  - - [64, 2368, 1, 1280]
    - [40, 4061.7]
  - - [448, 2368, 1, 1280]
    - [91, 5928.67]
  - - [4608, 48000, 1, 1536]
    - [96, 6937.3]
  - - [5888, 5888, 1, 128]
    - [81, 3743.9]
  - - [64, 6784, 1, 3328]
    - [91, 5988.62]
  - - [2944, 256, 1, 1280]
    - [97, 6717.87]
  - - [2048, 16, 1, 2048]
    - [49, 1210.48]
  - - [256, 2368, 1, 128]
    - [84, 1935.97]
  - - [5056, 2368, 1, 3328]
    - [102, 8875.53]
  - - [2944, 4288, 1, 256]
    - [96, 8063.14]
  - - [1408, 3584, 1, 1280]
    - [92, 8196.97]
  - - [2368, 64, 1, 256]
    - [91, 2365.69]
  - - [64, 448, 1, 3328]
    - [77, 3027.3]
  - - [704, 128, 1, 3328]
    - [48, 4452.09]
  - - [8192, 1600, 1, 2048]
    - [96, 7229.83]
  - - [1856, 704, 1, 256]
    - [98, 5545.35]
  - - [4, 4288, 1, 1280]
    - [49, 523.725]
  - - [1408, 448, 1, 3328]
    - [103, 4789.3]
  - - [1024, 4, 1, 3328]
    - [29, 504.123]
  - - [512, 24000, 1, 2560]
    - [102, 8903.52]
  - - [2368, 6784, 1, 3328]
    - [102, 8311.04]
  - - [1856, 1408, 1, 1280]
    - [92, 8160.01]
  - - [1856, 448, 1, 1280]
    - [94, 6242.97]
  - - [6784, 704, 1, 128]
    - [80, 4068.95]
  - - [4, 4, 1, 256]
    - [49, 0.742029]
  - - [128, 5888, 1, 128]
    - [80, 2327.92]
  - - [1408, 5888, 1, 256]
    - [91, 6986.81]
  - - [704, 2944, 1, 1280]
    - [92, 7904.93]
  - - [4288, 64, 1, 1280]
    - [67, 3828.17]
  - - [256, 64, 1, 256]
    - [42, 655.36]
  - - [704, 1856, 1, 256]
    - [100, 5444.27]
  - - [704, 6784, 1, 128]
    - [80, 4319.67]
  - - [3584, 704, 1, 1280]
    - [100, 7726.33]
  - - [256, 128, 1, 1280]
    - [35, 2184.53]
  - - [5888, 2368, 1, 256]
    - [102, 8192.59]
  - - [256, 2368, 1, 1280]
    - [97, 5675.44]
  - - [2944, 6784, 1, 128]
    - [85, 4248.25]
  - - [3584, 448, 1, 3328]
    - [96, 6560.67]
  - - [1408, 4, 1, 256]
    - [114, 176.69]
  - - [704, 2368, 1, 3328]
    - [97, 7085.21]
  - - [2944, 448, 1, 256]
    - [93, 3411.9]
  - - [1856, 448, 1, 128]
    - [81, 2748.72]
  - - [4288, 4, 1, 3328]
    - [49, 553.548]
  - - [2368, 128, 1, 1280]
    - [70, 4173.55]
  - - [256, 5888, 1, 128]
    - [85, 2860.88]
  - - [64, 6784, 1, 256]
    - [98, 3637.08]
  - - [64, 5056, 1, 1280]
    - [97, 4289.43]
  - - [4, 6784, 1, 128]
    - [111, 160.806]
  - - [2048, 3200, 1, 512]
    - [98, 6926.99]
  - - [2944, 2944, 1, 1280]
    - [90, 6267.75]
  - - [5056, 448, 1, 3328]
    - [91, 7400.26]
  - - [4, 3584, 1, 1280]
    - [49, 499.73]
  - - [1408, 128, 1, 128]
    - [26, 1037.26]
  - - [6784, 704, 1, 3328]
    - [97, 7633.85]
  - - [128, 64, 1, 1280]
    - [49, 1170.29]
  - - [2368, 256, 1, 1280]
    - [97, 5609.79]
  - - [4, 448, 1, 3328]
    - [117, 358.4]
  - - [5888, 4288, 1, 128]
    - [85, 4521.64]
  - - [4, 5888, 1, 256]
    - [49, 353.833]
  - - [1408, 2944, 1, 3328]
    - [90, 8951.31]
  - - [3584, 704, 1, 128]
    - [80, 3395.31]
  - - [4608, 12000, 1, 1536]
    - [89, 6609.89]
  - - [64, 1024, 1, 256]
    - [35, 1588.75]
  - - [5056, 5056, 1, 128]
    - [80, 4080.71]
  - - [2368, 448, 1, 1280]
    - [91, 5422.94]
  - - [128, 3584, 1, 256]
    - [97, 4705.15]
  - - [704, 448, 1, 1280]
    - [94, 3960.97]
  - - [8192, 800, 1, 2048]
    - [92, 6306.26]
  - - [448, 5056, 1, 128]
    - [84, 3709.46]
  - - [256, 4, 1, 1280]
    - [116, 163.84]
  - - [5056, 3584, 1, 256]
    - [89, 7008.24]
  - - [2368, 4, 1, 3328]
    - [49, 496.266]
  - - [1408, 5056, 1, 128]
    - [84, 4175.27]
  - - [2944, 3584, 1, 128]
    - [80, 4659.69]
  - - [3584, 2368, 1, 256]
    - [102, 5851.77]
  - - [128, 3584, 1, 3328]
    - [92, 6104.94]
  - - [128, 1024, 1, 1280]
    - [32, 3847.99]
  - - [8448, 24000, 1, 2816]
    - [102, 5128.54]
  - - [64, 704, 1, 256]
    - [35, 1253.73]
  - - [4288, 256, 1, 1280]
    - [91, 5625.76]
  - - [3584, 3584, 1, 3328]
    - [96, 8206.05]
  - - [4, 704, 1, 128]
    - [111, 29.4484]
  - - [5888, 6784, 1, 256]
    - [98, 8248.65]
  - - [4288, 2944, 1, 3328]
    - [96, 8657.02]
  - - [2944, 64, 1, 128]
    - [15, 1240.6]
  - - [1024, 128, 1, 3328]
    - [40, 4433.0]
  - - [1024, 16, 1, 500000]
    - [3, 2571.05]
  - - [4288, 128, 1, 3328]
    - [40, 5716.75]
  - - [7680, 128, 1, 2560]
    - [38, 5488.0]
  - - [256, 5056, 1, 1280]
    - [98, 6379.96]
  - - [1408, 256, 1, 128]
    - [84, 1633.73]
  - - [2944, 5888, 1, 3328]
    - [93, 7848.92]
  - - [6784, 5888, 1, 1280]
    - [102, 9047.62]
  - - [2048, 800, 1, 512]
    - [97, 4841.07]
  - - [704, 128, 1, 256]
    - [42, 1567.17]
  - - [5888, 4288, 1, 1280]
    - [96, 7982.83]
  - - [1024, 24000, 1, 2048]
    - [98, 5774.3]
  - - [448, 256, 1, 1280]
    - [32, 3707.09]
  - - [5888, 3584, 1, 128]
    - [85, 3804.4]
  - - [1024, 2944, 1, 128]
    - [80, 3308.26]
  - - [5056, 4, 1, 1280]
    - [113, 468.962]
  - - [256, 1408, 1, 1280]
    - [91, 4899.89]
  - - [3072, 16, 1, 1024]
    - [49, 1233.62]
  - - [704, 3584, 1, 128]
    - [80, 3919.43]
  - - [5888, 448, 1, 3328]
    - [110, 6095.61]
  - - [2368, 4288, 1, 1280]
    - [92, 8338.3]
  - - [4288, 2944, 1, 128]
    - [84, 3946.5]
  - - [1024, 6784, 1, 3328]
    - [98, 7494.28]
  - - [128, 2368, 1, 256]
    - [97, 2895.32]
  - - [6784, 64, 1, 3328]
    - [91, 5964.89]
  - - [5056, 2944, 1, 3328]
    - [102, 6605.53]
  - - [448, 128, 1, 256]
    - [35, 1339.42]
  - - [2944, 3584, 1, 256]
    - [98, 7165.56]
  - - [1408, 1408, 1, 3328]
    - [102, 8332.86]
  - - [1856, 128, 1, 1280]
    - [97, 4498.33]
  - - [3584, 3584, 1, 128]
    - [81, 4000.01]
  - - [64, 3584, 1, 256]
    - [108, 2383.13]
  - - [1408, 4, 1, 3328]
    - [59, 422.908]
  - - [128, 2944, 1, 3328]
    - [64, 5429.93]
  - - [3584, 704, 1, 256]
    - [97, 6153.99]
  - - [2944, 448, 1, 3328]
    - [97, 6507.72]
  - - [3584, 1408, 1, 3328]
    - [102, 8829.63]
  - - [704, 3584, 1, 1280]
    - [92, 7860.23]
  - - [2944, 6784, 1, 1280]
    - [102, 8894.5]
  - - [1856, 6784, 1, 256]
    - [102, 8115.09]
  - - [4288, 448, 1, 3328]
    - [94, 6397.25]
  - - [6784, 4288, 1, 128]
    - [80, 4109.44]
  - - [6784, 704, 1, 1280]
    - [90, 7999.04]
  - - [256, 4288, 1, 256]
    - [94, 4603.84]
  - - [3584, 6784, 1, 256]
    - [102, 7361.55]
  - - [6144, 12000, 1, 2048]
    - [101, 6311.66]
  - - [6144, 16, 1, 2560]
    - [50, 2240.55]
  - - [3584, 64, 1, 128]
    - [21, 1292.26]
  - - [5888, 1024, 1, 3328]
    - [89, 8394.49]
  - - [448, 64, 1, 128]
    - [12, 262.144]
  - - [704, 6784, 1, 1280]
    - [96, 7740.56]
  - - [4, 1024, 1, 1280]
    - [49, 378.821]
  - - [5888, 128, 1, 256]
    - [97, 5003.58]
  - - [4096, 16, 1, 4096]
    - [49, 1585.75]
  - - [1856, 5056, 1, 3328]
    - [90, 8522.82]
  - - [4, 6784, 1, 256]
    - [34, 387.657]
  - - [1024, 3584, 1, 128]
    - [84, 3031.51]
  - - [1024, 1408, 1, 128]
    - [86, 2600.75]
  - - [2368, 2944, 1, 128]
    - [83, 4340.16]
  - - [5056, 64, 1, 256]
    - [97, 3109.52]
  - - [4, 448, 1, 1280]
    - [117, 253.735]
  - - [5056, 2944, 1, 128]
    - [88, 3739.91]
  - - [5888, 5056, 1, 3328]
    - [102, 9016.38]
  - - [1024, 704, 1, 128]
    - [84, 2363.56]
  - - [5888, 2368, 1, 128]
    - [87, 3651.73]
  - - [128, 5056, 1, 3328]
    - [91, 6243.54]
  - - [3584, 6784, 1, 1280]
    - [89, 9080.57]
  - - [448, 4, 1, 1280]
    - [117, 242.983]
  - - [1856, 5888, 1, 256]
    - [102, 8182.02]
  - - [256, 256, 1, 256]
    - [35, 1542.02]
  - - [256, 64, 1, 128]
    - [16, 135.126]
  - - [4288, 4288, 1, 3328]
    - [102, 8674.54]
  - - [4288, 1408, 1, 1280]
    - [90, 7867.08]
  - - [3584, 5056, 1, 128]
    - [80, 4457.73]
  - - [4, 1024, 1, 3328]
    - [29, 440.294]
  - - [4288, 2368, 1, 256]
    - [110, 5699.47]
  - - [2944, 5056, 1, 1280]
    - [102, 8236.46]
  - - [448, 6784, 1, 256]
    - [92, 6620.52]
  - - [64, 128, 1, 128]
    - [17, 67.5629]
  - - [1856, 2368, 1, 128]
    - [84, 4233.6]
  - - [6784, 2368, 1, 3328]
    - [102, 8269.8]
  - - [256, 1024, 1, 1280]
    - [91, 4882.78]
  - - [704, 4, 1, 128]
    - [111, 19.011]
  - - [256, 4, 1, 256]
    - [49, 46.8114]
  - - [4288, 128, 1, 256]
    - [97, 4273.39]
  - - [4288, 1856, 1, 3328]
    - [92, 8195.71]
  - - [3584, 448, 1, 128]
    - [85, 2750.55]
  - - [2048, 1600, 1, 2048]
    - [108, 5753.49]
  - - [256, 4, 1, 3328]
    - [118, 297.878]
  - - [4, 1408, 1, 1280]
    - [116, 402.286]
  - - [3584, 64, 1, 1280]
    - [105, 4096.0]
  - - [1408, 448, 1, 128]
    - [80, 2498.15]
  - - [3584, 1024, 1, 1280]
    - [102, 7252.08]
  - - [1856, 5056, 1, 256]
    - [96, 7711.49]
  - - [4, 3584, 1, 256]
    - [113, 314.214]
  - - [4, 2944, 1, 1280]
    - [49, 483.118]
  - - [1024, 4288, 1, 256]
    - [101, 6544.42]
  - - [5888, 3584, 1, 3328]
    - [90, 8105.05]
  - - [1856, 4, 1, 256]
    - [49, 252.732]
  - - [4, 256, 1, 256]
    - [34, 48.1882]
  - - [5056, 3584, 1, 3328]
    - [95, 7354.7]
  - - [704, 448, 1, 128]
    - [88, 1233.81]
  - - [2368, 1408, 1, 1280]
    - [96, 6654.14]
  - - [5056, 2944, 1, 1280]
    - [102, 8505.62]
  - - [4, 4, 1, 128]
    - [112, 0.0478505]
  - - [3584, 256, 1, 256]
    - [94, 4616.37]
  - - [1024, 6784, 1, 256]
    - [96, 7944.88]
  - - [4, 128, 1, 256]
    - [49, 29.2571]
  - - [64, 64, 1, 1280]
    - [60, 642.51]
  - - [5124, 9124, 1, 2048]
    - [102, 8019.3]
  - - [6784, 4, 1, 128]
    - [111, 192.967]
  - - [2944, 1408, 1, 128]
    - [80, 3827.03]
  - - [448, 128, 1, 3328]
    - [53, 4063.9]
  - - [3584, 1408, 1, 1280]
    - [102, 7180.73]
  - - [64, 4288, 1, 3328]
    - [48, 4786.74]
  - - [5056, 6784, 1, 3328]
    - [89, 7889.73]
  - - [128, 2944, 1, 256]
    - [92, 3599.59]
  - - [128, 6784, 1, 128]
    - [10, 2606.69]
  - - [3584, 4288, 1, 256]
    - [96, 7299.71]
  - - [448, 1856, 1, 256]
    - [92, 5206.97]
  - - [1856, 6784, 1, 3328]
    - [94, 8386.26]
  - - [3584, 128, 1, 3328]
    - [38, 5589.94]
  - - [64, 1856, 1, 256]
    - [31, 1949.28]
  - - [64, 448, 1, 256]
    - [36, 955.733]
  - - [5888, 4288, 1, 256]
    - [100, 7791.74]
  - - [4, 448, 1, 128]
    - [111, 8.74146]
  - - [5056, 1408, 1, 256]
    - [102, 5153.91]
  - - [35, 8457, 1, 2048]
    - [7, 3182.47]
  - - [64, 256, 1, 1280]
    - [56, 1713.36]
  - - [3584, 1024, 1, 256]
    - [92, 6528.08]
  - - [256, 704, 1, 256]
    - [91, 2720.36]
  - - [5888, 5888, 1, 256]
    - [100, 7992.16]
  - - [4288, 1024, 1, 1280]
    - [94, 7837.4]
  - - [5888, 128, 1, 3328]
    - [97, 7181.03]
  - - [448, 6784, 1, 3328]
    - [91, 7663.0]
  - - [2944, 1408, 1, 1280]
    - [100, 7903.04]
  - - [64, 128, 1, 1280]
    - [49, 1191.56]
  - - [2944, 1856, 1, 3328]
    - [90, 7844.31]
  - - [2368, 64, 1, 128]
    - [21, 997.873]
  - - [256, 1024, 1, 128]
    - [80, 1215.74]
  - - [3584, 5888, 1, 1280]
    - [89, 8958.84]
  - - [64, 4, 1, 128]
    - [112, 1.11608]
  - - [6784, 1856, 1, 1280]
    - [89, 6728.7]
  - - [2944, 5056, 1, 256]
    - [102, 8275.11]
  - - [4288, 4, 1, 128]
    - [111, 147.544]
  - - [5888, 256, 1, 3328]
    - [98, 7094.1]
  - - [2944, 4288, 1, 128]
    - [83, 4611.45]
  - - [3584, 1408, 1, 256]
    - [93, 6542.96]
  - - [704, 3584, 1, 3328]
    - [92, 8117.1]
  - - [4096, 3200, 1, 1024]
    - [107, 6656.03]
  - - [5056, 448, 1, 1280]
    - [105, 6096.1]
  - - [3584, 1856, 1, 3328]
    - [90, 8552.31]
  - - [4288, 6784, 1, 1280]
    - [96, 8212.36]
  - - [2560, 7000, 1, 2560]
    - [98, 7655.24]
  - - [1408, 704, 1, 1280]
    - [94, 5756.69]
  - - [2944, 1024, 1, 256]
    - [102, 6880.81]
  - - [6784, 64, 1, 256]
    - [97, 4438.86]
  - - [2368, 4288, 1, 3328]
    - [98, 8377.89]
  - - [4, 1408, 1, 256]
    - [115, 222.499]
  - - [1024, 1408, 1, 1280]
    - [92, 6339.28]
  - - [64, 64, 1, 256]
    - [49, 187.246]
  - - [704, 256, 1, 3328]
    - [91, 4046.04]
  - - [6784, 5056, 1, 256]
    - [102, 7972.07]
  - - [1856, 1856, 1, 128]
    - [86, 3716.51]
  - - [3584, 5056, 1, 3328]
    - [102, 8684.66]
  - - [448, 6784, 1, 128]
    - [84, 3828.95]
  - - [4, 704, 1, 3328]
    - [117, 393.106]
  - - [35, 8457, 1, 4096]
    - [6, 3173.14]
  - - [448, 2944, 1, 256]
    - [100, 5553.31]
  - - [4, 4288, 1, 3328]
    - [59, 573.111]
  - - [2944, 6784, 1, 256]
    - [96, 8565.96]
  - - [2944, 2944, 1, 128]
    - [80, 4540.73]
  - - [4, 4, 1, 1280]
    - [59, 3.04762]
  - - [1856, 3584, 1, 1280]
    - [96, 7306.26]
  - - [64, 2944, 1, 256]
    - [108, 2292.51]
  - - [448, 256, 1, 128]
    - [17, 797.83]
  - - [4288, 448, 1, 128]
    - [83, 3430.4]
  - - [4608, 24000, 1, 1536]
    - [101, 6820.14]
  - - [1856, 1408, 1, 3328]
    - [104, 6600.14]
  - - [128, 128, 1, 128]
    - [9, 161.817]
  - - [1024, 4288, 1, 3328]
    - [92, 7936.98]
  - - [448, 2368, 1, 256]
    - [100, 4526.35]
  - - [1024, 4, 1, 128]
    - [112, 16.8907]
  - - [64, 1408, 1, 1280]
    - [32, 3345.22]
  - - [64, 6784, 1, 1280]
    - [97, 5526.5]
  - - [5056, 448, 1, 256]
    - [91, 4216.55]
  - - [2944, 2368, 1, 3328]
    - [102, 7000.32]
  - - [704, 4288, 1, 3328]
    - [108, 6414.33]
  - - [1408, 128, 1, 256]
    - [91, 2720.36]
  - - [1024, 1856, 1, 1280]
    - [102, 7682.83]
  - - [2048, 6400, 1, 2048]
    - [98, 7418.12]
  - - [512, 48000, 1, 2816]
    - [102, 8884.67]
  - - [5124, 9124, 1, 2560]
    - [94, 6040.7]
  - - [128, 2368, 1, 3328]
    - [48, 5025.56]
  - - [1024, 5888, 1, 256]
    - [96, 7322.11]
  - - [64, 2944, 1, 1280]
    - [32, 4222.21]
  - - [5056, 64, 1, 3328]
    - [73, 4936.22]
  - - [128, 704, 1, 128]
    - [18, 683.314]
  - - [1408, 2368, 1, 256]
    - [97, 6404.12]
  - - [1408, 1408, 1, 256]
    - [102, 4537.83]
  - - [4, 64, 1, 128]
    - [111, 2.46747]
  - - [64, 1024, 1, 128]
    - [10, 532.272]
  - - [1024, 8, 1, 500000]
    - [0, 1684.98]
  - - [2368, 2368, 1, 128]
    - [81, 4334.23]
  - - [64, 5888, 1, 128]
    - [10, 2003.09]
  - - [5888, 4, 1, 3328]
    - [28, 339.018]
  - - [6784, 1408, 1, 128]
    - [84, 4431.13]
  - - [4288, 5888, 1, 256]
    - [102, 7800.78]
  - - [1408, 5056, 1, 256]
    - [96, 8153.28]
  - - [5056, 128, 1, 3328]
    - [53, 5829.83]
  - - [128, 128, 1, 1280]
    - [56, 1691.25]
  - - [448, 704, 1, 256]
    - [97, 3364.18]
  - - [4288, 3584, 1, 128]
    - [81, 2952.58]
  - - [2944, 128, 1, 3328]
    - [53, 5620.72]
  - - [64, 1408, 1, 3328]
    - [54, 4169.81]
  - - [3584, 5056, 1, 1280]
    - [99, 7780.66]
  - - [256, 448, 1, 1280]
    - [32, 3929.35]
  - - [704, 704, 1, 128]
    - [80, 2346.07]
  - - [5056, 4, 1, 128]
    - [111, 144.457]
  - - [704, 256, 1, 1280]
    - [100, 2283.12]
  - - [64, 2368, 1, 3328]
    - [32, 4921.59]
  - - [1856, 1024, 1, 128]
    - [81, 3459.47]
  - - [1856, 64, 1, 128]
    - [13, 918.137]
  - - [4096, 64, 1, 4096]
    - [58, 4000.52]
  - - [1024, 24000, 1, 1536]
    - [94, 8502.26]
  - - [704, 4288, 1, 256]
    - [98, 6003.73]
  - - [5888, 2368, 1, 1280]
    - [89, 8801.2]
  - - [128, 256, 1, 256]
    - [43, 1069.98]
  - - [64, 128, 1, 256]
    - [49, 374.491]
  - - [2368, 5888, 1, 1280]
    - [92, 8308.53]
  - - [5888, 256, 1, 1280]
    - [100, 7154.32]
  - - [1760, 128, 1, 1760]
    - [41, 5363.81]
  - - [4, 5888, 1, 1280]
    - [49, 542.204]
  - - [704, 128, 1, 128]
    - [21, 779.347]
  - - [1024, 4, 1, 1280]
    - [49, 392.431]
  - - [2368, 1856, 1, 3328]
    - [92, 7975.22]
  - - [2368, 128, 1, 128]
    - [14, 1584.86]
  - - [2944, 704, 1, 256]
    - [100, 4039.11]
  - - [5056, 128, 1, 128]
    - [80, 2575.79]
  - - [2368, 1024, 1, 3328]
    - [108, 6165.44]
  - - [256, 704, 1, 3328]
    - [91, 4028.64]
  - - [704, 3584, 1, 256]
    - [102, 6102.82]
  - - [704, 2944, 1, 3328]
    - [92, 8202.74]
  - - [6784, 1024, 1, 128]
    - [84, 4386.3]
  - - [256, 448, 1, 128]
    - [21, 834.095]
  - - [448, 1024, 1, 3328]
    - [109, 5412.38]
  - - [2944, 1024, 1, 3328]
    - [102, 6265.77]
  - - [2944, 5056, 1, 128]
    - [80, 4770.78]
  - - [2368, 256, 1, 256]
    - [97, 3975.13]
  - - [1408, 6784, 1, 256]
    - [96, 7986.92]
  - - [6784, 1408, 1, 3328]
    - [96, 8472.61]
  - - [4288, 6784, 1, 128]
    - [87, 3865.1]
  - - [704, 64, 1, 256]
    - [35, 1287.31]
  - - [5888, 4, 1, 1280]
    - [34, 509.922]
  - - [256, 2368, 1, 3328]
    - [97, 5837.55]
  - - [6784, 2944, 1, 1280]
    - [102, 8560.44]
  - - [4288, 1856, 1, 128]
    - [80, 4616.97]
  - - [1856, 2944, 1, 128]
    - [80, 4287.63]
  - - [6784, 448, 1, 128]
    - [84, 3893.33]
  - - [64, 3584, 1, 128]
    - [10, 1609.66]
  - - [448, 5056, 1, 1280]
    - [100, 7124.31]
  - - [2368, 1856, 1, 128]
    - [83, 4004.55]
  - - [64, 2944, 1, 3328]
    - [33, 5086.38]
  - - [4288, 704, 1, 256]
    - [98, 6176.47]
  - - [256, 3584, 1, 128]
    - [81, 2553.05]
  - - [5888, 704, 1, 256]
    - [97, 6781.41]
  - - [3584, 1024, 1, 128]
    - [84, 3660.85]
  - - [256, 5888, 1, 3328]
    - [100, 7772.03]
  - - [1408, 4288, 1, 3328]
    - [96, 8832.76]
  - - [6784, 4288, 1, 256]
    - [102, 8566.04]
  - - [4288, 256, 1, 128]
    - [82, 1953.69]
  - - [5888, 256, 1, 256]
    - [100, 3730.43]
  - - [6784, 1024, 1, 1280]
    - [96, 8578.29]
  - - [5888, 1024, 1, 128]
    - [81, 4092.86]
  - - [1024, 128, 1, 256]
    - [31, 1897.88]
  - - [512, 16, 1, 500000]
    - [2, 2363.69]
  - - [128, 64, 1, 3328]
    - [59, 1592.46]
  - - [448, 64, 1, 256]
    - [49, 976.068]
  - - [2368, 256, 1, 128]
    - [84, 2094.89]
  - - [6784, 3584, 1, 1280]
    - [96, 8570.06]
  - - [1024, 6784, 1, 1280]
    - [102, 8203.47]
  - - [2944, 64, 1, 1280]
    - [40, 4300.51]
  - - [1408, 2944, 1, 1280]
    - [92, 7349.54]
  - - [256, 1856, 1, 256]
    - [91, 4649.65]
  - - [2048, 800, 1, 2048]
    - [110, 4668.63]
  - - [1408, 2368, 1, 3328]
    - [100, 7537.64]
  - - [2944, 4, 1, 3328]
    - [49, 514.042]
  - - [128, 1408, 1, 3328]
    - [41, 4991.54]
  - - [2944, 1856, 1, 128]
    - [80, 4317.29]
  - - [256, 2944, 1, 128]
    - [80, 2258.17]
  - - [256, 6784, 1, 128]
    - [80, 3146.92]
  - - [2368, 4, 1, 128]
    - [112, 33.8286]
  - - [1408, 256, 1, 3328]
    - [91, 5077.75]
  - - [1856, 4, 1, 128]
    - [112, 21.4025]
  - - [5056, 6784, 1, 128]
    - [80, 4945.01]
  - - [4288, 5056, 1, 128]
    - [83, 4729.77]
  - - [1856, 5888, 1, 128]
    - [80, 4707.86]
  - - [2944, 5888, 1, 256]
    - [94, 8014.68]
  - - [3584, 1856, 1, 256]
    - [96, 7567.03]
  - - [4288, 3584, 1, 1280]
    - [89, 8726.33]
  - - [2368, 448, 1, 256]
    - [97, 4227.6]
  - - [4288, 256, 1, 3328]
    - [98, 5487.31]
  - - [1856, 704, 1, 128]
    - [84, 3124.96]
  - - [1408, 64, 1, 256]
    - [44, 1619.99]
  - - [64, 1856, 1, 128]
    - [8, 955.047]
  - - [4, 256, 1, 128]
    - [111, 10.7789]
  - - [2560, 16, 1, 2560]
    - [56, 2019.6]
  - - [704, 5888, 1, 128]
    - [85, 3976.16]
  - - [6784, 3584, 1, 128]
    - [84, 4018.81]
  - - [1024, 64, 1, 256]
    - [49, 1370.69]
  - - [64, 2368, 1, 256]
    - [91, 2255.66]
  - - [4288, 5056, 1, 3328]
    - [96, 8368.59]
  - - [4, 1856, 1, 1280]
    - [49, 392.026]
  - - [4288, 128, 1, 128]
    - [14, 2286.93]
  - - [1408, 1408, 1, 128]
    - [84, 3233.38]
  - - [7680, 16, 1, 2560]
    - [52, 2257.27]
  - - [1856, 128, 1, 128]
    - [14, 1532.7]
  - - [5056, 2368, 1, 256]
    - [96, 8167.19]
  - - [4288, 704, 1, 3328]
    - [102, 6411.06]
  - - [448, 3584, 1, 256]
    - [102, 5477.64]
  - - [2368, 64, 1, 1280]
    - [32, 3936.42]
  - - [2368, 1024, 1, 1280]
    - [98, 7688.72]
  - - [2944, 1408, 1, 3328]
    - [89, 7668.68]
  - - [1408, 448, 1, 256]
    - [91, 4863.88]
  - - [1024, 1408, 1, 3328]
    - [100, 7448.89]
  - - [2944, 5888, 1, 1280]
    - [90, 8208.47]
  - - [1408, 4, 1, 1280]
    - [29, 479.319]
  - - [5888, 3584, 1, 256]
    - [90, 8609.99]
  - - [2368, 5056, 1, 128]
    - [87, 3726.15]
  - - [1408, 1856, 1, 3328]
    - [91, 7829.38]
  - - [4, 4, 1, 3328]
    - [118, 4.29419]
  - - [6784, 1408, 1, 1280]
    - [91, 7690.7]
  - - [4096, 7000, 1, 4096]
    - [103, 6272.39]
  - - [704, 2944, 1, 256]
    - [92, 6095.81]
  - - [4288, 64, 1, 256]
    - [57, 2121.21]
  - - [6784, 5888, 1, 3328]
    - [96, 8955.5]
  - - [2368, 4288, 1, 128]
    - [80, 4699.55]
  - - [64, 4288, 1, 1280]
    - [70, 4013.63]
  - - [6784, 64, 1, 1280]
    - [91, 5418.73]
  - - [3584, 128, 1, 128]
    - [20, 2165.2]
  - - [1024, 6784, 1, 128]
    - [81, 3765.2]
  - - [4, 1856, 1, 128]
    - [112, 33.2728]
  - - [1408, 64, 1, 3328]
    - [53, 4489.41]
  - - [6784, 4, 1, 256]
    - [49, 400.162]
  - - [1408, 1408, 1, 1280]
    - [96, 8139.43]
  - - [16384, 400, 1, 4096]
    - [100, 6087.18]
  - - [256, 2368, 1, 256]
    - [91, 4766.25]
  - - [448, 4288, 1, 3328]
    - [98, 7576.98]
  - - [2368, 1408, 1, 256]
    - [94, 5284.43]
  - - [5888, 5056, 1, 128]
    - [81, 3643.5]
  - - [704, 2368, 1, 256]
    - [96, 5334.63]
  - - [1024, 24000, 1, 2560]
    - [104, 7437.96]
  - - [2944, 448, 1, 1280]
    - [105, 4937.43]
  - - [5888, 2368, 1, 3328]
    - [90, 8201.74]
  - - [5124, 9124, 1, 1760]
    - [97, 6763.96]
  - - [448, 1408, 1, 1280]
    - [91, 5881.44]
  - - [448, 1856, 1, 1280]
    - [98, 6225.46]
  - - [4288, 448, 1, 1280]
    - [100, 5626.27]
  - - [5888, 704, 1, 3328]
    - [94, 7873.52]
  - - [5056, 256, 1, 128]
    - [85, 2920.93]
  - - [1856, 256, 1, 128]
    - [87, 1995.32]
  - - [64, 1408, 1, 128]
    - [8, 758.838]
  - - [704, 4, 1, 256]
    - [49, 130.597]
  - - [1408, 5888, 1, 128]
    - [80, 4573.95]
  - - [7680, 12000, 1, 2560]
    - [96, 8747.03]
  - - [1408, 1024, 1, 256]
    - [93, 4609.13]
  - - [8192, 400, 1, 2048]
    - [105, 5283.15]
  - - [1024, 1856, 1, 128]
    - [80, 2686.28]
  - - [256, 704, 1, 128]
    - [80, 1004.73]
  - - [2560, 128, 1, 2560]
    - [58, 4259.04]
  - - [448, 1024, 1, 256]
    - [91, 4813.14]
  - - [128, 4, 1, 3328]
    - [117, 128.308]
  - - [5056, 6784, 1, 1280]
    - [99, 6579.75]
  - - [1408, 64, 1, 128]
    - [21, 819.2]
  - - [1024, 448, 1, 1280]
    - [100, 5703.21]
  - - [704, 5056, 1, 3328]
    - [92, 7574.39]
  - - [128, 5056, 1, 256]
    - [91, 5113.43]
  - - [64, 1024, 1, 3328]
    - [76, 3980.0]
  - - [1856, 4, 1, 3328]
    - [30, 433.153]
  - - [4, 2944, 1, 128]
    - [112, 46.5225]
  - - [2368, 2944, 1, 3328]
    - [90, 9002.03]
  - - [448, 448, 1, 1280]
    - [32, 3969.42]
  - - [2368, 3584, 1, 256]
    - [102, 7806.29]
  - - [5056, 3584, 1, 1280]
    - [89, 8971.46]
  - - [5124, 9124, 1, 4096]
    - [102, 7208.62]
  - - [7680, 48000, 1, 2560]
    - [96, 3835.81]
  - - [448, 4, 1, 3328]
    - [117, 409.6]
  - - [1856, 2944, 1, 1280]
    - [89, 7173.61]
  - - [1024, 48000, 1, 2816]
    - [96, 8976.16]
  - - [128, 1024, 1, 256]
    - [35, 1969.16]
  - - [2944, 1408, 1, 256]
    - [98, 4585.02]
  - - [4288, 1408, 1, 3328]
    - [92, 8237.17]
  - - [3584, 64, 1, 3328]
    - [38, 5183.06]
  - - [5888, 2944, 1, 128]
    - [87, 3674.46]
  - - [2944, 1024, 1, 128]
    - [84, 3834.22]
  - - [4288, 5056, 1, 1280]
    - [96, 8086.0]
  - - [5888, 6784, 1, 1280]
    - [90, 6941.22]
  - - [6784, 5056, 1, 128]
    - [81, 4860.05]
  - - [256, 1024, 1, 3328]
    - [105, 5156.12]
  - - [3584, 4, 1, 256]
    - [49, 332.429]
  - - [1760, 1600, 1, 1760]
    - [92, 6330.66]
  - - [1856, 64, 1, 3328]
    - [53, 4755.93]
  - - [4, 128, 1, 3328]
    - [117, 160.144]
  - - [5888, 1408, 1, 3328]
    - [90, 8722.64]
  - - [448, 2944, 1, 128]
    - [83, 2997.53]
  - - [2368, 1856, 1, 256]
    - [91, 6662.24]
  - - [256, 5056, 1, 256]
    - [93, 5256.19]
  - - [128, 3584, 1, 128]
    - [12, 2073.46]
  - - [448, 3584, 1, 3328]
    - [89, 6833.86]
  - - [4, 5056, 1, 3328]
    - [59, 581.423]
  - - [704, 2368, 1, 128]
    - [80, 3402.19]
  - - [5888, 256, 1, 128]
    - [85, 2977.44]
  - - [4, 5056, 1, 128]
    - [111, 65.1074]
  - - [448, 256, 1, 256]
    - [97, 1764.43]
  - - [704, 4, 1, 3328]
    - [49, 398.454]
  - - [1408, 256, 1, 256]
    - [92, 3463.76]
  - - [3584, 1856, 1, 128]
    - [88, 3228.09]
  - - [4288, 4288, 1, 128]
    - [84, 4853.83]
  - - [1856, 1024, 1, 3328]
    - [108, 5994.58]
  - - [128, 5888, 1, 3328]
    - [62, 6512.75]
  - - [1024, 5056, 1, 256]
    - [102, 7859.32]
  - - [5888, 5888, 1, 1280]
    - [102, 8131.34]
  - - [5056, 5888, 1, 128]
    - [81, 4920.61]
  - - [2368, 1408, 1, 3328]
    - [100, 7110.64]
  - - [1024, 48000, 1, 1536]
    - [100, 8590.72]
  - - [5888, 448, 1, 256]
    - [101, 3567.64]
  - - [2560, 3200, 1, 2560]
    - [91, 7638.21]
  - - [5888, 6784, 1, 128]
    - [81, 3910.82]
  - - [6144, 48000, 1, 2048]
    - [102, 3412.85]
  - - [6784, 5056, 1, 1280]
    - [93, 7890.12]
  - - [5056, 704, 1, 1280]
    - [97, 7664.96]
  - - [1024, 48000, 1, 2560]
    - [102, 8188.4]
  - - [4608, 32, 1, 1536]
    - [70, 2856.87]
  - - [1024, 2368, 1, 128]
    - [80, 3019.25]
  - - [128, 704, 1, 256]
    - [31, 1696.23]
  - - [2368, 448, 1, 3328]
    - [97, 5799.19]
  - - [128, 5888, 1, 1280]
    - [91, 6680.65]
  - - [16384, 800, 1, 4096]
    - [96, 6322.12]
  - - [448, 128, 1, 1280]
    - [70, 2849.39]
  - - [6784, 4, 1, 3328]
    - [49, 563.02]
  - - [5888, 5056, 1, 1280]
    - [96, 8631.23]
  - - [1024, 64, 1, 3328]
    - [71, 3481.86]
  - - [3072, 48000, 1, 1024]
    - [96, 9019.39]
  - - [64, 3584, 1, 1280]
    - [33, 4327.85]
  - - [6784, 1408, 1, 256]
    - [96, 6320.49]
  - - [3584, 5888, 1, 128]
    - [83, 4406.69]
  - - [5056, 5888, 1, 256]
    - [102, 8037.03]
  - - [2368, 1024, 1, 256]
    - [94, 4936.04]
  - - [2944, 1856, 1, 256]
    - [102, 7222.22]
  - - [1856, 6784, 1, 1280]
    - [92, 8251.71]
  - - [64, 5056, 1, 128]
    - [12, 1643.6]
  - - [64, 6784, 1, 128]
    - [10, 1929.67]
  - - [448, 704, 1, 128]
    - [82, 979.859]
  - - [4, 1024, 1, 128]
    - [111, 20.0416]
  - - [4288, 3584, 1, 256]
    - [96, 8444.04]
  - - [1408, 704, 1, 128]
    - [80, 3020.9]
  - - [64, 256, 1, 3328]
    - [76, 2227.37]
  - - [6784, 448, 1, 3328]
    - [102, 6573.01]
  - - [5056, 1856, 1, 1280]
    - [94, 7976.13]
  - - [1408, 1024, 1, 3328]
    - [92, 7470.23]
  - - [2368, 256, 1, 3328]
    - [97, 5394.27]
  - - [5888, 3584, 1, 1280]
    - [89, 9031.45]
  - - [1856, 3584, 1, 3328]
    - [104, 7272.5]
  - - [5888, 128, 1, 1280]
    - [97, 6684.38]
  - - [1024, 2944, 1, 256]
    - [102, 7414.99]
  - - [448, 6784, 1, 1280]
    - [98, 7923.68]
  - - [256, 3584, 1, 1280]
    - [94, 6901.77]
  - - [704, 5056, 1, 256]
    - [99, 5004.45]
  - - [3584, 1024, 1, 3328]
    - [91, 7894.53]
  - - [2944, 1856, 1, 1280]
    - [96, 7903.17]
  - - [128, 256, 1, 128]
    - [9, 325.645]
  - - [5056, 256, 1, 256]
    - [93, 3356.46]
  - - [2944, 4288, 1, 3328]
    - [102, 7813.83]
  - - [2368, 3584, 1, 3328]
    - [102, 8370.99]
  - - [2944, 704, 1, 1280]
    - [108, 5513.99]
  - - [128, 4, 1, 256]
    - [49, 25.2062]
  - - [2944, 3584, 1, 1280]
    - [96, 7738.73]
  - - [1856, 5888, 1, 1280]
    - [90, 8584.53]
  - - [256, 256, 1, 1280]
    - [70, 2962.08]
  - - [2048, 3200, 1, 2048]
    - [98, 6911.59]
  - - [4288, 1408, 1, 256]
    - [96, 7953.9]
  - - [3584, 64, 1, 256]
    - [97, 2780.32]
  - - [64, 1856, 1, 3328]
    - [32, 4911.94]
  - - [256, 1408, 1, 128]
    - [80, 1373.14]
  - - [5888, 1408, 1, 128]
    - [85, 4241.91]
  - - [4288, 2368, 1, 1280]
    - [94, 8012.6]
  - - [4, 4288, 1, 256]
    - [115, 301.574]
  - - [256, 4288, 1, 128]
    - [80, 2706.26]
  - - [2048, 128, 1, 2048]
    - [75, 2885.16]
  - - [256, 128, 1, 3328]
    - [77, 3170.11]
  - - [512, 8, 1, 500000]
    - [1, 1915.02]
  - - [6784, 2368, 1, 256]
    - [96, 8323.56]
  - - [5888, 128, 1, 128]
    - [84, 2465.98]
  - - [1024, 24000, 1, 2816]
    - [94, 8131.54]
  - - [7680, 5984, 1, 2560]
    - [98, 6040.67]
  - - [4288, 1856, 1, 256]
    - [110, 5818.43]
  - - [1856, 256, 1, 3328]
    - [91, 6531.93]
  - - [1856, 2944, 1, 256]
    - [96, 7312.82]
  - - [5056, 1024, 1, 128]
    - [86, 4102.9]
  - - [64, 5888, 1, 1280]
    - [91, 5058.15]
  - - [1760, 800, 1, 1760]
    - [94, 7279.9]
  - - [6784, 256, 1, 128]
    - [84, 3257.59]
  - - [5888, 704, 1, 128]
    - [80, 3813.83]
  - - [1408, 2368, 1, 128]
    - [81, 3561.17]
  - - [1024, 4288, 1, 1280]
    - [100, 7752.64]
  - - [2368, 5056, 1, 3328]
    - [103, 7711.81]
  - - [448, 4, 1, 128]
    - [111, 18.3795]
  - - [4, 256, 1, 3328]
    - [118, 269.61]
  - - [4288, 1024, 1, 3328]
    - [97, 7910.17]
  - - [6144, 48000, 1, 2560]
    - [96, 3540.99]
  - - [1024, 5056, 1, 3328]
    - [90, 8509.56]
  - - [1024, 1856, 1, 3328]
    - [96, 7907.83]
  - - [704, 704, 1, 1280]
    - [108, 5648.05]
  - - [128, 2368, 1, 1280]
    - [67, 4145.01]
  - - [1408, 128, 1, 3328]
    - [40, 4919.5]
  - - [3584, 256, 1, 1280]
    - [92, 5185.46]
  - - [4, 128, 1, 128]
    - [111, 2.97891]
  - - [5888, 64, 1, 1280]
    - [40, 4499.49]
  - - [3584, 128, 1, 1280]
    - [97, 5928.91]
  - - [4, 256, 1, 1280]
    - [116, 170.667]
  - - [128, 704, 1, 3328]
    - [40, 4379.27]
  - - [4288, 6784, 1, 256]
    - [90, 7180.99]
  - - [3584, 2944, 1, 3328]
    - [96, 8553.2]
  - - [128, 1856, 1, 256]
    - [97, 3207.67]
  - - [64, 4288, 1, 256]
    - [91, 2907.89]
  - - [4, 3584, 1, 3328]
    - [49, 560.505]
  - - [64, 4, 1, 3328]
    - [118, 67.4025]
  - - [4, 64, 1, 3328]
    - [118, 88.7467]
  - - [5888, 2944, 1, 256]
    - [96, 7255.67]
  - - [1856, 64, 1, 256]
    - [42, 1743.62]
  - - [5056, 128, 1, 1280]
    - [97, 6009.69]
  - - [448, 4288, 1, 1280]
    - [98, 6466.72]
  - - [448, 1856, 1, 3328]
    - [98, 6381.89]
  - - [1024, 4288, 1, 128]
    - [83, 3491.77]
  - - [4, 1024, 1, 256]
    - [116, 172.463]
  - - [5056, 4288, 1, 256]
    - [96, 8241.42]
  - - [1024, 448, 1, 256]
    - [100, 4218.41]
  - - [1024, 3584, 1, 256]
    - [96, 6513.59]
  - - [2944, 128, 1, 1280]
    - [40, 4710.38]
  - - [2048, 32, 1, 2048]
    - [55, 1779.13]
  - - [64, 256, 1, 256]
    - [49, 655.36]
  - - [1408, 4, 1, 128]
    - [112, 20.0249]
  - - [128, 2368, 1, 128]
    - [12, 1707.63]
  - - [256, 704, 1, 1280]
    - [91, 3735.21]
  - - [64, 2368, 1, 128]
    - [19, 1049.71]
  - - [6784, 6784, 1, 3328]
    - [96, 9277.84]
  - - [448, 5888, 1, 1280]
    - [102, 7319.65]
  - - [5056, 448, 1, 128]
    - [84, 3694.33]
  - - [4288, 704, 1, 1280]
    - [94, 7890.86]
  - - [3584, 2944, 1, 128]
    - [86, 4124.61]
  - - [6784, 256, 1, 1280]
    - [102, 7185.73]
  - - [256, 2944, 1, 1280]
    - [91, 6736.66]
  - - [64, 4288, 1, 128]
    - [10, 1614.31]
  - - [2368, 5888, 1, 3328]
    - [92, 8616.36]
  - - [4, 64, 1, 256]
    - [29, 11.3778]
  - - [704, 1024, 1, 3328]
    - [97, 6801.82]
  - - [2368, 1856, 1, 1280]
    - [94, 7853.47]
  - - [448, 5056, 1, 3328]
    - [97, 7452.94]
  - - [128, 448, 1, 128]
    - [12, 530.349]
  - - [128, 6784, 1, 256]
    - [92, 5557.45]
  - - [3584, 4288, 1, 128]
    - [83, 4462.63]
  - - [64, 448, 1, 128]
    - [12, 278.032]
  - - [5888, 4288, 1, 3328]
    - [89, 9153.45]
  - - [2368, 704, 1, 256]
    - [96, 5350.68]
  - - [256, 1856, 1, 3328]
    - [91, 6536.25]
  - - [1856, 128, 1, 256]
    - [105, 2847.26]
  - - [6784, 128, 1, 128]
    - [85, 2530.72]
  - - [3584, 1408, 1, 128]
    - [86, 3625.52]
  - - [1856, 5056, 1, 1280]
    - [92, 8123.29]
  - - [2944, 1024, 1, 1280]
    - [102, 8450.31]
  - - [5056, 4, 1, 256]
    - [116, 380.687]
  - - [3584, 5888, 1, 3328]
    - [94, 8567.89]
  - - [2368, 4288, 1, 256]
    - [98, 7857.97]
  - - [1024, 2368, 1, 3328]
    - [92, 6776.35]
  - - [64, 704, 1, 3328]
    - [47, 3503.42]
  - - [704, 1408, 1, 256]
    - [92, 6099.89]
  - - [4096, 128, 1, 4096]
    - [72, 4116.47]
  - - [1024, 3584, 1, 1280]
    - [102, 7231.55]
  - - [4288, 5888, 1, 3328]
    - [96, 8762.32]
  - - [4288, 4, 1, 1280]
    - [49, 492.697]
  - - [4608, 16, 1, 1536]
    - [50, 1892.48]
  - - [5888, 64, 1, 128]
    - [27, 1747.63]
  - - [4, 5888, 1, 128]
    - [112, 84.4915]
  - - [1024, 2944, 1, 3328]
    - [100, 6906.95]
  - - [6784, 1856, 1, 256]
    - [96, 6273.97]
  - - [2048, 64, 1, 2048]
    - [79, 2371.34]
  - - [256, 6784, 1, 1280]
    - [96, 7066.94]
  - - [1856, 3584, 1, 256]
    - [102, 7706.77]
  - - [128, 448, 1, 3328]
    - [47, 3995.83]
  - - [6784, 1856, 1, 128]
    - [84, 4458.99]
  - - [4, 448, 1, 256]
    - [49, 84.3294]
  - - [5056, 128, 1, 256]
    - [97, 4954.4]
  - - [512, 24000, 1, 2816]
    - [90, 8994.88]
  - - [256, 5888, 1, 1280]
    - [89, 6183.9]
  - - [4, 128, 1, 1280]
    - [117, 71.8597]
  - - [16384, 1600, 1, 4096]
    - [96, 6920.99]
  - - [6784, 128, 1, 1280]
    - [100, 6486.27]
  - - [64, 1408, 1, 256]
    - [37, 1647.76]
  - - [2368, 1408, 1, 128]
    - [84, 3937.0]
  - - [1856, 448, 1, 256]
    - [97, 4635.47]
  - - [1408, 1024, 1, 128]
    - [80, 3208.41]
  - - [128, 64, 1, 128]
    - [9, 70.092]
  - - [6784, 3584, 1, 3328]
    - [102, 8466.18]
  - - [1760, 7000, 1, 1760]
    - [100, 8149.11]
  - - [2944, 64, 1, 3328]
    - [33, 5017.99]
  - - [64, 64, 1, 128]
    - [9, 35.4249]
  - - [2368, 5056, 1, 1280]
    - [96, 8763.9]
  - - [64, 4, 1, 1280]
    - [118, 43.5745]
  - - [1408, 2368, 1, 1280]
    - [97, 7660.28]
  - - [128, 1408, 1, 1280]
    - [32, 4185.17]
  - - [256, 64, 1, 3328]
    - [57, 2071.65]
  - - [704, 4288, 1, 128]
    - [80, 4069.08]
  - - [128, 1856, 1, 3328]
    - [63, 5776.05]
  - - [2944, 2944, 1, 256]
    - [102, 7949.21]
  - - [2944, 4, 1, 1280]
    - [49, 483.118]
  - - [5888, 4, 1, 256]
    - [34, 396.665]
  - - [6784, 256, 1, 256]
    - [108, 4044.73]
  - - [256, 5056, 1, 3328]
    - [91, 7607.27]
  - - [128, 4288, 1, 1280]
    - [32, 4958.68]
  - - [5056, 1856, 1, 128]
    - [84, 4560.84]
  - - [5056, 1024, 1, 3328]
    - [96, 8634.08]
  - - [128, 128, 1, 256]
    - [34, 699.051]
  - - [1760, 64, 1, 1760]
    - [40, 4580.55]
  - - [4288, 3584, 1, 3328]
    - [102, 9143.66]
  - - [448, 704, 1, 3328]
    - [91, 4473.33]
  - - [448, 448, 1, 128]
    - [22, 1264.28]
  - - [1024, 2368, 1, 1280]
    - [100, 7452.41]
  - - [1856, 704, 1, 3328]
    - [91, 6103.24]
  - - [4, 2368, 1, 128]
    - [111, 95.919]
  - - [5888, 6784, 1, 3328]
    - [96, 9131.64]
  - - [704, 4288, 1, 1280]
    - [98, 7906.36]
  - - [704, 256, 1, 256]
    - [91, 2772.68]
  - - [1024, 48000, 1, 2048]
    - [95, 6513.35]
  - - [4288, 1024, 1, 128]
    - [80, 4291.67]
  - - [512, 2048, 1, 49]
    - [126, 4554.98]
  - - [512, 128, 1, 784]
    - [119, 3195.29]
  - - [2048, 512, 1, 49]
    - [127, 4253.33]
  - - [1024, 256, 1, 196]
    - [123, 4039.33]
  - - [256, 64, 1, 3136]
    - [121, 3015.27]
  - - [256, 1024, 1, 196]
    - [125, 4225.35]
  - - [64, 256, 1, 3136]
    - [122, 3058.35]
  - - [128, 512, 1, 784]
    - [120, 3380.28]
  - - [64, 64, 1, 3136]
    - [124, 1372.34]
  - - [1024, 1024, 1, 3328]
    - [237, 8705.0]
  - - [2048, 200, 1, 3200]
    - [242, 6173.32]
  - - [1024, 200, 1, 13312]
    - [140, 5213.21]
  - - [1024, 256, 1, 1536]
    - [242, 5859.33]
  - - [4096, 256, 1, 12288]
    - [247, 8807.42]
  - - [64, 200, 1, 1024]
    - [214, 366.532]
  - - [32, 512, 1, 1024]
    - [169, 452.949]
  - - [2048, 256, 1, 3328]
    - [231, 7876.63]
  - - [4096, 512, 1, 32]
    - [235, 3975.64]
  - - [2048, 256, 1, 13312]
    - [212, 7837.71]
  - - [4096, 200, 1, 11264]
    - [247, 6902.66]
  - - [2048, 512, 1, 1024]
    - [241, 8100.04]
  - - [2048, 1024, 1, 1664]
    - [141, 9081.98]
  - - [1024, 1024, 1, 64]
    - [237, 4258.18]
  - - [512, 1024, 1, 1536]
    - [231, 7597.23]
  - - [1024, 256, 1, 15360]
    - [132, 6735.14]
  - - [1, 512, 1, 1024]
    - [182, 15.0657]
  - - [4096, 512, 1, 1408]
    - [144, 9024.42]
  - - [1024, 200, 1, 1408]
    - [242, 4460.99]
  - - [1024, 512, 1, 512]
    - [236, 6528.1]
  - - [4096, 256, 1, 15360]
    - [243, 8823.93]
  - - [2048, 512, 1, 640]
    - [233, 7989.15]
  - - [4096, 1024, 1, 1280]
    - [139, 9421.44]
  - - [1024, 200, 1, 6144]
    - [231, 4966.42]
  - - [1024, 1024, 1, 512]
    - [233, 7731.44]
  - - [128, 512, 1, 2048]
    - [149, 2190.24]
  - - [2048, 1024, 1, 640]
    - [139, 8581.7]
  - - [1024, 256, 1, 3328]
    - [231, 6192.61]
  - - [4096, 1024, 1, 13312]
    - [144, 9642.49]
  - - [2048, 256, 1, 2048]
    - [231, 7485.65]
  - - [2048, 1024, 1, 13312]
    - [144, 9352.16]
  - - [2048, 512, 1, 16640]
    - [232, 8839.07]
  - - [1024, 512, 1, 128]
    - [236, 4279.9]
  - - [2048, 1024, 1, 3584]
    - [139, 9264.62]
  - - [2048, 512, 1, 256]
    - [247, 6990.51]
  - - [512, 256, 1, 3200]
    - [194, 4154.42]
  - - [4096, 1024, 1, 1920]
    - [139, 9535.22]
  - - [4096, 200, 1, 2560]
    - [244, 6754.55]
  - - [1024, 256, 1, 16384]
    - [134, 6289.5]
  - - [1024, 1024, 1, 1152]
    - [237, 8407.29]
  - - [2048, 200, 1, 32]
    - [180, 1412.41]
  - - [512, 1024, 1, 2816]
    - [231, 7843.15]
  - - [4096, 256, 1, 14336]
    - [243, 8844.67]
  - - [1024, 200, 1, 4608]
    - [242, 4931.64]
  - - [1024, 200, 1, 16384]
    - [137, 5135.05]
  - - [64, 256, 1, 1024]
    - [215, 460.913]
  - - [1, 200, 1, 1024]
    - [197, 7.39884]
  - - [2048, 200, 1, 2080]
    - [242, 6033.77]
  - - [512, 256, 1, 1792]
    - [152, 3153.61]
  - - [2048, 200, 1, 1024]
    - [242, 5711.2]
  - - [4096, 1024, 1, 12288]
    - [139, 9658.13]
  - - [4096, 200, 1, 4096]
    - [233, 6834.45]
  - - [1024, 512, 1, 11264]
    - [200, 7686.36]
  - - [128, 512, 1, 1024]
    - [170, 1458.89]
  - - [32, 256, 1, 2048]
    - [188, 384.799]
  - - [1024, 200, 1, 1792]
    - [242, 4638.54]
  - - [1024, 1024, 1, 1792]
    - [237, 8550.46]
  - - [32, 256, 1, 512]
    - [221, 161.319]
  - - [512, 200, 1, 2816]
    - [147, 3353.0]
  - - [512, 200, 1, 3072]
    - [132, 3298.79]
  - - [1024, 1024, 1, 8192]
    - [178, 8369.0]
  - - [1024, 256, 1, 12288]
    - [135, 6475.61]
  - - [4096, 200, 1, 768]
    - [237, 6367.87]
  - - [1024, 512, 1, 16384]
    - [253, 7367.02]
  - - [4096, 256, 1, 1024]
    - [233, 8214.06]
  - - [1024, 512, 1, 256]
    - [236, 5537.03]
  - - [4096, 1024, 1, 8320]
    - [139, 9674.16]
  - - [4096, 256, 1, 9216]
    - [241, 8790.92]
  - - [1024, 512, 1, 1408]
    - [231, 7459.55]
  - - [1024, 512, 1, 5632]
    - [242, 7997.81]
  - - [4096, 200, 1, 256]
    - [247, 5371.8]
  - - [1024, 200, 1, 128]
    - [225, 1998.05]
  - - [256, 200, 1, 1024]
    - [194, 1195.91]
  - - [1024, 200, 1, 5120]
    - [242, 4957.34]
  - - [512, 1024, 1, 3072]
    - [255, 7103.97]
  - - [4096, 1024, 1, 15360]
    - [139, 9668.94]
  - - [1, 256, 1, 2048]
    - [181, 13.8262]
  - - [1024, 1024, 1, 4160]
    - [233, 8759.2]
  - - [1024, 256, 1, 256]
    - [240, 3728.27]
  - - [2048, 256, 1, 384]
    - [242, 6123.07]
  - - [512, 256, 1, 2560]
    - [196, 3809.54]
  - - [4096, 512, 1, 3072]
    - [144, 9215.09]
  - - [1024, 256, 1, 4160]
    - [231, 6293.39]
  - - [4096, 512, 1, 13312]
    - [141, 9367.22]
  - - [4096, 1024, 1, 3840]
    - [139, 9631.47]
  - - [4096, 200, 1, 640]
    - [237, 6206.06]
  - - [32, 200, 1, 2048]
    - [175, 303.407]
  - - [1024, 200, 1, 512]
    - [231, 3713.09]
  - - [1024, 1024, 1, 7168]
    - [234, 8475.64]
  - - [2048, 1024, 1, 3200]
    - [139, 9271.24]
  - - [512, 512, 1, 1536]
    - [242, 5832.17]
  - - [4096, 256, 1, 768]
    - [247, 8065.97]
  - - [2048, 256, 1, 6656]
    - [231, 8034.77]
  - - [1024, 256, 1, 896]
    - [231, 5467.44]
  - - [2048, 256, 1, 512]
    - [242, 6465.21]
  - - [2048, 200, 1, 3072]
    - [242, 6165.68]
  - - [128, 200, 1, 1024]
    - [199, 692.77]
  - - [4096, 512, 1, 3840]
    - [144, 9272.6]
  - - [1024, 200, 1, 3200]
    - [242, 4838.75]
  - - [4096, 512, 1, 5632]
    - [139, 9335.42]
  - - [4096, 512, 1, 64]
    - [174, 5275.85]
  - - [1024, 512, 1, 2816]
    - [231, 7816.58]
  - - [4096, 256, 1, 7680]
    - [237, 8795.4]
  - - [4096, 200, 1, 1024]
    - [247, 6448.81]
  - - [1024, 512, 1, 12288]
    - [201, 7624.57]
  - - [2048, 1024, 1, 512]
    - [144, 8436.06]
  - - [128, 256, 1, 2048]
    - [218, 1342.18]
  - - [2048, 200, 1, 1792]
    - [242, 6020.37]
  - - [1024, 1024, 1, 2816]
    - [233, 8670.4]
  - - [2048, 512, 1, 1536]
    - [244, 8466.22]
  - - [4096, 256, 1, 3072]
    - [241, 8631.37]
  - - [1024, 200, 1, 1536]
    - [223, 4577.6]
  - - [1024, 256, 1, 1024]
    - [231, 5491.72]
  - - [4096, 512, 1, 8192]
    - [144, 9325.54]
  - - [128, 1024, 1, 512]
    - [242, 2534.32]
  - - [4096, 512, 1, 2304]
    - [139, 9192.99]
  - - [2048, 256, 1, 5632]
    - [242, 7999.54]
  - - [1024, 256, 1, 5120]
    - [242, 6307.22]
  - - [1024, 512, 1, 6656]
    - [242, 8028.85]
  - - [4096, 512, 1, 2816]
    - [139, 9234.4]
  - - [4096, 200, 1, 2080]
    - [226, 6697.86]
  - - [1024, 200, 1, 2304]
    - [242, 4752.81]
  - - [2048, 200, 1, 13312]
    - [231, 6346.13]
  - - [64, 1024, 1, 1024]
    - [215, 1359.58]
  - - [4096, 256, 1, 3584]
    - [237, 8668.8]
  - - [2048, 1024, 1, 7680]
    - [139, 9365.78]
  - - [1024, 256, 1, 1664]
    - [231, 5907.47]
  - - [1, 512, 1, 2048]
    - [158, 23.4057]
  - - [512, 512, 1, 1024]
    - [231, 5360.13]
  - - [2048, 256, 1, 8192]
    - [203, 7665.21]
  - - [2048, 512, 1, 512]
    - [233, 7767.23]
  - - [4096, 512, 1, 1920]
    - [139, 9132.94]
  - - [4096, 200, 1, 12288]
    - [247, 6910.65]
  - - [1024, 512, 1, 3072]
    - [177, 7310.33]
  - - [2048, 512, 1, 1152]
    - [237, 8342.26]
  - - [1024, 256, 1, 2080]
    - [231, 6010.36]
  - - [4096, 1024, 1, 32]
    - [227, 4793.49]
  - - [4096, 512, 1, 16640]
    - [139, 9365.31]
  - - [2048, 200, 1, 9216]
    - [231, 6315.88]
  - - [2048, 200, 1, 2560]
    - [231, 6119.14]
  - - [2048, 1024, 1, 1024]
    - [139, 8628.59]
  - - [2048, 256, 1, 4608]
    - [231, 7951.29]
  - - [512, 200, 1, 768]
    - [183, 2132.41]
  - - [128, 256, 1, 512]
    - [183, 670.017]
  - - [4096, 512, 1, 1792]
    - [144, 9126.91]
  - - [4096, 1024, 1, 8192]
    - [139, 9591.27]
  - - [1024, 256, 1, 2816]
    - [242, 6119.01]
  - - [1024, 1024, 1, 13312]
    - [234, 8529.27]
  - - [2048, 1024, 1, 4160]
    - [139, 9305.57]
  - - [2048, 256, 1, 3584]
    - [231, 7903.13]
  - - [128, 200, 1, 2048]
    - [199, 1135.81]
  - - [4096, 512, 1, 10240]
    - [141, 9339.49]
  - - [4096, 512, 1, 512]
    - [139, 8446.68]
  - - [2048, 1024, 1, 6656]
    - [139, 9331.65]
  - - [1024, 512, 1, 640]
    - [231, 6775.94]
  - - [2048, 512, 1, 768]
    - [233, 8085.41]
  - - [2048, 200, 1, 1408]
    - [231, 5880.07]
  - - [4096, 200, 1, 2048]
    - [247, 6691.61]
  - - [1024, 1024, 1, 5632]
    - [233, 8749.53]
  - - [2048, 512, 1, 3584]
    - [237, 8704.13]
  - - [64, 512, 1, 512]
    - [173, 667.883]
  - - [64, 200, 1, 512]
    - [183, 251.288]
  - - [1024, 200, 1, 64]
    - [138, 1310.72]
  - - [512, 512, 1, 2304]
    - [231, 6078.7]
  - - [2048, 1024, 1, 14336]
    - [139, 9321.84]
  - - [4096, 512, 1, 11264]
    - [141, 9339.85]
  - - [4096, 512, 1, 128]
    - [226, 6566.43]
  - - [1024, 512, 1, 64]
    - [246, 2953.74]
  - - [4096, 512, 1, 768]
    - [139, 8738.13]
  - - [4096, 1024, 1, 11264]
    - [139, 9637.68]
  - - [1, 256, 1, 1024]
    - [229, 8.83234]
  - - [4096, 200, 1, 7680]
    - [226, 6889.47]
  - - [1024, 200, 1, 12288]
    - [198, 5237.64]
  - - [1024, 1024, 1, 1280]
    - [233, 8418.07]
  - - [4096, 1024, 1, 16640]
    - [139, 9674.91]
  - - [2048, 1024, 1, 5632]
    - [139, 9327.75]
  - - [1024, 200, 1, 15360]
    - [198, 5386.53]
  - - [1, 1024, 1, 1024]
    - [248, 27.2499]
  - - [2048, 256, 1, 16384]
    - [209, 7652.65]
  - - [4096, 512, 1, 12288]
    - [141, 9359.41]
  - - [2048, 200, 1, 896]
    - [242, 5628.86]
  - - [4096, 1024, 1, 5632]
    - [139, 9626.68]
  - - [2048, 256, 1, 32]
    - [235, 1889.33]
  - - [2048, 256, 1, 1280]
    - [231, 7390.84]
  - - [4096, 256, 1, 4096]
    - [233, 8694.27]
  - - [2048, 256, 1, 11264]
    - [231, 8113.85]
  - - [4096, 200, 1, 9216]
    - [233, 6890.98]
  - - [1024, 512, 1, 4096]
    - [179, 7348.36]
  - - [2048, 1024, 1, 10240]
    - [141, 9095.81]
  - - [4096, 1024, 1, 640]
    - [139, 9115.58]
  - - [128, 1024, 1, 2048]
    - [132, 3270.41]
  - - [4096, 200, 1, 3840]
    - [226, 6836.16]
  - - [1024, 1024, 1, 1920]
    - [237, 8562.72]
  - - [2048, 200, 1, 7168]
    - [242, 6296.13]
  - - [2048, 512, 1, 16384]
    - [133, 8632.41]
  - - [2048, 1024, 1, 12288]
    - [139, 9157.98]
  - - [4096, 1024, 1, 10240]
    - [139, 9658.74]
  - - [1024, 1024, 1, 8320]
    - [241, 8799.48]
  - - [1024, 256, 1, 9216]
    - [231, 6375.13]
  - - [4096, 256, 1, 1152]
    - [226, 8300.99]
  - - [512, 200, 1, 2560]
    - [192, 3088.41]
  - - [2048, 256, 1, 1920]
    - [231, 7714.84]
  - - [2048, 1024, 1, 4608]
    - [139, 9305.6]
  - - [512, 256, 1, 1024]
    - [239, 2887.64]
  - - [1024, 256, 1, 1920]
    - [223, 5913.02]
  - - [4096, 512, 1, 3584]
    - [139, 9275.59]
  - - [2048, 512, 1, 4160]
    - [244, 8733.93]
  - - [2048, 512, 1, 5632]
    - [247, 8758.88]
  - - [4096, 1024, 1, 4608]
    - [139, 9657.12]
  - - [4096, 1024, 1, 3328]
    - [139, 9621.35]
  - - [4096, 256, 1, 7168]
    - [233, 8769.95]
  - - [4096, 200, 1, 128]
    - [247, 4458.23]
  - - [2048, 200, 1, 5120]
    - [231, 6176.81]
  - - [1024, 1024, 1, 6656]
    - [233, 8780.35]
  - - [512, 1024, 1, 3200]
    - [242, 7886.99]
  - - [512, 200, 1, 2304]
    - [132, 2990.99]
  - - [2048, 1024, 1, 9216]
    - [144, 9325.36]
  - - [2048, 256, 1, 1536]
    - [242, 7551.63]
  - - [4096, 256, 1, 256]
    - [247, 6932.73]
  - - [2048, 512, 1, 1408]
    - [244, 8430.76]
  - - [1024, 256, 1, 384]
    - [236, 4462.03]
  - - [2048, 1024, 1, 2304]
    - [139, 9174.84]
  - - [4096, 512, 1, 6144]
    - [141, 9284.15]
  - - [1024, 200, 1, 14336]
    - [130, 5268.47]
  - - [1024, 512, 1, 2080]
    - [242, 7736.37]
  - - [2048, 512, 1, 2304]
    - [244, 8615.97]
  - - [4096, 512, 1, 15360]
    - [144, 9362.07]
  - - [1024, 256, 1, 32]
    - [164, 1028.02]
  - - [1024, 200, 1, 2816]
    - [242, 4780.48]
  - - [4096, 200, 1, 512]
    - [233, 6054.13]
  - - [4096, 1024, 1, 7168]
    - [144, 9468.39]
  - - [2048, 256, 1, 14336]
    - [205, 7865.42]
  - - [1024, 200, 1, 3072]
    - [242, 4804.1]
  - - [2048, 200, 1, 1280]
    - [242, 5846.21]
  - - [1024, 1024, 1, 2304]
    - [233, 8633.22]
  - - [4096, 1024, 1, 9216]
    - [139, 9640.93]
  - - [2048, 512, 1, 4608]
    - [244, 8743.2]
  - - [4096, 1024, 1, 7680]
    - [139, 9684.76]
  - - [4096, 256, 1, 6144]
    - [244, 8757.14]
  - - [4096, 256, 1, 896]
    - [237, 8258.83]
  - - [512, 256, 1, 1536]
    - [221, 3065.26]
  - - [1024, 256, 1, 512]
    - [231, 4752.75]
  - - [2048, 256, 1, 640]
    - [231, 6775.94]
  - - [256, 256, 1, 2048]
    - [168, 2248.96]
  - - [2048, 1024, 1, 8192]
    - [139, 9178.07]
  - - [4096, 200, 1, 16640]
    - [131, 7009.49]
  - - [256, 512, 1, 512]
    - [143, 2511.56]
  - - [2048, 512, 1, 384]
    - [244, 7467.6]
  - - [2048, 200, 1, 16384]
    - [212, 6327.21]
  - - [4096, 200, 1, 10240]
    - [237, 6892.64]
  - - [1024, 512, 1, 9216]
    - [186, 7529.99]
  - - [4096, 1024, 1, 64]
    - [161, 6260.16]
  - - [4096, 200, 1, 1920]
    - [247, 6710.17]
  - - [2048, 1024, 1, 1280]
    - [139, 8998.24]
  - - [1024, 200, 1, 3840]
    - [231, 4873.77]
  - - [256, 1024, 1, 512]
    - [242, 4766.25]
  - - [2048, 1024, 1, 3328]
    - [139, 9275.1]
  - - [1024, 256, 1, 16640]
    - [196, 6837.12]
  - - [4096, 512, 1, 14336]
    - [144, 9354.32]
  - - [1024, 1024, 1, 16640]
    - [241, 8832.27]
  - - [1024, 256, 1, 1152]
    - [242, 5642.56]
  - - [512, 512, 1, 512]
    - [231, 4779.83]
  - - [4096, 512, 1, 8320]
    - [144, 9327.86]
  - - [2048, 512, 1, 7680]
    - [247, 8793.86]
  - - [4096, 1024, 1, 6656]
    - [139, 9666.93]
  - - [1024, 512, 1, 3584]
    - [242, 7900.47]
  - - [1024, 1024, 1, 32]
    - [227, 2974.68]
  - - [512, 512, 1, 2816]
    - [223, 6155.75]
  - - [2048, 512, 1, 1664]
    - [247, 8496.45]
  - - [1024, 1024, 1, 14336]
    - [133, 8624.64]
  - - [2048, 200, 1, 2048]
    - [242, 6029.76]
  - - [1024, 1024, 1, 3584]
    - [233, 8702.52]
  - - [512, 200, 1, 1280]
    - [147, 2350.65]
  - - [4096, 256, 1, 6656]
    - [247, 8788.31]
  - - [4096, 256, 1, 4160]
    - [224, 8728.34]
  - - [128, 256, 1, 1024]
    - [206, 859.489]
  - - [512, 200, 1, 3200]
    - [147, 3376.75]
  - - [2048, 512, 1, 9216]
    - [230, 8806.3]
  - - [2048, 1024, 1, 256]
    - [226, 7713.66]
  - - [1024, 256, 1, 2304]
    - [242, 6015.73]
  - - [1024, 200, 1, 8192]
    - [242, 5021.92]
  - - [2048, 256, 1, 3072]
    - [159, 7514.99]
  - - [2048, 256, 1, 8320]
    - [231, 8063.58]
  - - [4096, 512, 1, 1024]
    - [141, 8824.31]
  - - [1024, 512, 1, 3200]
    - [231, 7866.29]
  - - [1024, 512, 1, 896]
    - [223, 7161.01]
  - - [2048, 512, 1, 1280]
    - [237, 8384.42]
  - - [4096, 200, 1, 64]
    - [146, 3260.5]
  - - [1024, 256, 1, 6144]
    - [252, 6143.62]
  - - [1024, 200, 1, 2560]
    - [231, 4762.79]
  - - [1024, 1024, 1, 5120]
    - [160, 8454.13]
  - - [2048, 512, 1, 6656]
    - [237, 8798.95]
  - - [4096, 1024, 1, 1536]
    - [139, 9503.27]
  - - [1024, 1024, 1, 128]
    - [162, 5825.42]
  - - [512, 1024, 1, 1792]
    - [231, 7701.02]
  - - [2048, 1024, 1, 32]
    - [142, 3938.31]
  - - [4096, 256, 1, 2816]
    - [226, 8652.1]
  - - [1024, 1024, 1, 15360]
    - [133, 8719.6]
  - - [1024, 256, 1, 5632]
    - [231, 6344.08]
  - - [1024, 1024, 1, 4096]
    - [234, 8187.76]
  - - [2048, 200, 1, 4160]
    - [242, 6222.38]
  - - [512, 256, 1, 768]
    - [173, 2771.57]
  - - [4096, 512, 1, 640]
    - [144, 8590.48]
  - - [2048, 512, 1, 8192]
    - [186, 8494.8]
  - - [1024, 512, 1, 768]
    - [231, 7049.25]
  - - [4096, 200, 1, 8320]
    - [226, 6908.6]
  - - [2048, 512, 1, 896]
    - [233, 8224.13]
  - - [4096, 200, 1, 7168]
    - [244, 6878.49]
  - - [2048, 512, 1, 13312]
    - [232, 8802.94]
  - - [64, 512, 1, 1024]
    - [136, 843.924]
  - - [2048, 200, 1, 3840]
    - [231, 6192.38]
  - - [1024, 1024, 1, 768]
    - [224, 8098.41]
  - - [4096, 512, 1, 16384]
    - [144, 9345.63]
  - - [4096, 256, 1, 2304]
    - [224, 8596.35]
  - - [1, 256, 1, 4096]
    - [229, 19.8293]
  - - [1024, 1024, 1, 11264]
    - [234, 8491.38]
  - - [2048, 200, 1, 16640]
    - [228, 6510.54]
  - - [1024, 256, 1, 3072]
    - [242, 6179.45]
  - - [4096, 1024, 1, 512]
    - [139, 9032.15]
  - - [2048, 256, 1, 2816]
    - [231, 7793.47]
  - - [32, 512, 1, 512]
    - [143, 318.716]
  - - [256, 512, 1, 2048]
    - [194, 3368.92]
  - - [1024, 512, 1, 384]
    - [242, 6198.48]
  - - [2048, 200, 1, 7680]
    - [231, 6307.6]
  - - [1024, 512, 1, 4608]
    - [242, 7953.38]
  - - [2048, 256, 1, 768]
    - [242, 7059.14]
  - - [4096, 200, 1, 32]
    - [191, 2199.19]
  - - [4096, 200, 1, 3328]
    - [226, 6813.02]
  - - [1024, 200, 1, 1152]
    - [231, 4375.55]
  - - [1024, 1024, 1, 1408]
    - [233, 8457.81]
  - - [2048, 200, 1, 15360]
    - [207, 6333.0]
  - - [512, 1024, 1, 2048]
    - [217, 6280.66]
  - - [1024, 512, 1, 1024]
    - [242, 7064.09]
  - - [1024, 200, 1, 10240]
    - [231, 5030.59]
  - - [4096, 256, 1, 5632]
    - [244, 8765.12]
  - - [512, 512, 1, 3072]
    - [254, 5942.34]
  - - [2048, 256, 1, 1408]
    - [231, 7544.95]
  - - [2048, 256, 1, 6144]
    - [242, 7963.87]
  - - [4096, 256, 1, 3328]
    - [237, 8682.48]
  - - [1024, 200, 1, 1664]
    - [231, 4595.3]
  - - [2048, 1024, 1, 1152]
    - [139, 8942.55]
  - - [2048, 512, 1, 6144]
    - [232, 8729.61]
  - - [2048, 512, 1, 3200]
    - [233, 8696.46]
  - - [4096, 1024, 1, 2080]
    - [172, 9538.35]
  - - [4096, 1024, 1, 768]
    - [139, 9260.65]
  - - [4096, 1024, 1, 2560]
    - [139, 9567.17]
  - - [64, 200, 1, 2048]
    - [171, 583.061]
  - - [2048, 200, 1, 4608]
    - [242, 6243.18]
  - - [1024, 1024, 1, 6144]
    - [234, 8320.15]
  - - [4096, 256, 1, 1664]
    - [237, 8503.07]
  - - [2048, 200, 1, 384]
    - [242, 4939.9]
  - - [1, 200, 1, 2048]
    - [188, 11.2281]
  - - [4096, 256, 1, 1792]
    - [247, 8504.02]
  - - [2048, 1024, 1, 64]
    - [161, 5309.25]
  - - [4096, 1024, 1, 16384]
    - [128, 9428.51]
  - - [1024, 512, 1, 16640]
    - [242, 8122.45]
  - - [2048, 512, 1, 10240]
    - [232, 8766.11]
  - - [4096, 512, 1, 6656]
    - [139, 9351.65]
  - - [2048, 256, 1, 16640]
    - [231, 8135.17]
  - - [2048, 512, 1, 2816]
    - [233, 8660.22]
  - - [1024, 200, 1, 32]
    - [151, 780.191]
  - - [1, 512, 1, 4096]
    - [176, 34.7671]
  - - [256, 256, 1, 1024]
    - [183, 1489.98]
  - - [2048, 1024, 1, 128]
    - [156, 6605.2]
  - - [2048, 1024, 1, 2080]
    - [139, 9159.41]
  - - [2048, 1024, 1, 16640]
    - [139, 9371.55]
  - - [1024, 200, 1, 384]
    - [242, 3378.14]
  - - [4096, 256, 1, 384]
    - [187, 7369.2]
  - - [4096, 256, 1, 13312]
    - [241, 8776.38]
  - - [2048, 256, 1, 128]
    - [236, 4279.9]
  - - [512, 256, 1, 2304]
    - [148, 3584.88]
  - - [2048, 1024, 1, 3072]
    - [141, 9156.42]
  - - [1024, 1024, 1, 640]
    - [237, 7928.74]
  - - [256, 512, 1, 1024]
    - [242, 2843.6]
  - - [4096, 1024, 1, 1408]
    - [139, 9437.46]
  - - [4096, 200, 1, 5632]
    - [244, 6873.86]
  - - [4096, 1024, 1, 2048]
    - [139, 9437.0]
  - - [2048, 1024, 1, 2560]
    - [144, 9195.52]
  - - [4096, 1024, 1, 128]
    - [226, 7407.16]
  - - [1024, 200, 1, 3328]
    - [242, 4857.29]
  - - [2048, 200, 1, 1152]
    - [231, 5760.0]
  - - [1024, 200, 1, 9216]
    - [130, 5053.11]
  - - [4096, 256, 1, 512]
    - [224, 7617.35]
  - - [4096, 1024, 1, 14336]
    - [139, 9665.02]
  - - [1024, 1024, 1, 384]
    - [162, 7478.7]
  - - [2048, 200, 1, 512]
    - [231, 5150.18]
  - - [2048, 256, 1, 9216]
    - [210, 7717.61]
  - - [2048, 256, 1, 1792]
    - [231, 7655.84]
  - - [4096, 512, 1, 9216]
    - [141, 9331.12]
  - - [4096, 200, 1, 15360]
    - [131, 6958.04]
  - - [1024, 512, 1, 2048]
    - [230, 7067.81]
  - - [64, 256, 1, 2048]
    - [155, 723.156]
  - - [4096, 200, 1, 1792]
    - [233, 6699.55]
  - - [1, 200, 1, 4096]
    - [165, 15.5387]
  - - [2048, 1024, 1, 2048]
    - [144, 9071.83]
  - - [1024, 200, 1, 2080]
    - [223, 4679.09]
  - - [2048, 200, 1, 1536]
    - [242, 5939.82]
  - - [1024, 1024, 1, 3072]
    - [204, 8333.05]
  - - [512, 200, 1, 1792]
    - [129, 2679.63]
  - - [1024, 256, 1, 11264]
    - [132, 6470.88]
  - - [2048, 512, 1, 12288]
    - [179, 8729.14]
  - - [1024, 256, 1, 1792]
    - [242, 5931.34]
  - - [1024, 200, 1, 7168]
    - [242, 4970.23]
  - - [32, 256, 1, 1024]
    - [153, 237.234]
  - - [512, 256, 1, 3072]
    - [196, 3813.0]
  - - [1024, 1024, 1, 2080]
    - [233, 8600.31]
  - - [2048, 200, 1, 2304]
    - [242, 6093.22]
  - - [4096, 512, 1, 1536]
    - [139, 9074.9]
  - - [2048, 256, 1, 7168]
    - [242, 7895.16]
  - - [2048, 512, 1, 1792]
    - [244, 8531.82]
  - - [1024, 200, 1, 2048]
    - [231, 4685.33]
  - - [1024, 1024, 1, 4608]
    - [237, 8735.61]
  - - [4096, 256, 1, 8192]
    - [233, 8782.45]
  - - [512, 1024, 1, 1280]
    - [223, 7483.15]
  - - [2048, 1024, 1, 16384]
    - [133, 8878.86]
  - - [512, 512, 1, 1280]
    - [231, 5745.62]
  - - [1024, 200, 1, 1280]
    - [223, 4446.13]
  - - [4096, 512, 1, 4096]
    - [141, 9264.39]
  - - [2048, 256, 1, 3200]
    - [231, 7842.75]
  - - [2048, 512, 1, 15360]
    - [179, 8757.14]
  - - [1024, 512, 1, 3328]
    - [231, 7853.94]
  - - [1024, 512, 1, 4160]
    - [231, 7934.51]
  - - [4096, 200, 1, 6656]
    - [233, 6883.2]
  - - [4096, 1024, 1, 1024]
    - [139, 9229.34]
  - - [2048, 200, 1, 3328]
    - [242, 6182.64]
  - - [1024, 1024, 1, 256]
    - [162, 6932.73]
  - - [512, 200, 1, 512]
    - [183, 1910.67]
  - - [2048, 256, 1, 64]
    - [154, 2912.71]
  - - [1024, 256, 1, 2560]
    - [231, 6123.07]
  - - [2048, 512, 1, 11264]
    - [243, 8728.84]
  - - [32, 200, 1, 1024]
    - [238, 187.46]
  - - [32, 512, 1, 2048]
    - [182, 694.421]
  - - [2048, 256, 1, 2304]
    - [231, 7759.25]
  - - [2048, 256, 1, 12288]
    - [210, 7726.25]
  - - [4096, 200, 1, 8192]
    - [233, 6870.84]
  - - [1024, 512, 1, 7168]
    - [179, 7479.1]
  - - [1024, 512, 1, 1792]
    - [231, 7626.01]
  - - [4096, 1024, 1, 1664]
    - [139, 9503.44]
  - - [4096, 200, 1, 2816]
    - [226, 6775.34]
  - - [1024, 1024, 1, 896]
    - [233, 8229.89]
  - - [1024, 200, 1, 8320]
    - [194, 5173.48]
  - - [1024, 1024, 1, 12288]
    - [234, 8463.11]
  - - [1024, 256, 1, 8320]
    - [223, 6404.27]
  - - [1024, 200, 1, 1024]
    - [231, 4297.44]
  - - [1024, 200, 1, 16640]
    - [193, 5499.41]
  - - [4096, 256, 1, 5120]
    - [247, 8729.05]
  - - [1024, 256, 1, 3200]
    - [242, 6124.86]
  - - [512, 512, 1, 2560]
    - [242, 6109.69]
  - - [4096, 256, 1, 2048]
    - [247, 8510.95]
  - - [1024, 256, 1, 640]
    - [231, 5102.56]
  - - [2048, 256, 1, 5120]
    - [159, 7667.83]
  - - [2048, 256, 1, 7680]
    - [242, 8054.35]
  - - [4096, 512, 1, 384]
    - [237, 8190.67]
  - - [2048, 200, 1, 3584]
    - [231, 6166.02]
  - - [1024, 512, 1, 1536]
    - [231, 7517.8]
  - - [4096, 512, 1, 3328]
    - [139, 9259.35]
  - - [4096, 1024, 1, 256]
    - [139, 8341.69]
  - - [2048, 200, 1, 64]
    - [202, 2307.61]
  - - [2048, 200, 1, 4096]
    - [242, 6211.94]
  - - [1024, 1024, 1, 1536]
    - [233, 8484.05]
  - - [2048, 1024, 1, 7168]
    - [141, 9315.14]
  - - [1024, 256, 1, 3584]
    - [231, 6207.22]
  - - [4096, 256, 1, 32]
    - [235, 2892.62]
  - - [4096, 256, 1, 1280]
    - [244, 8392.8]
  - - [512, 512, 1, 3200]
    - [242, 6219.31]
  - - [2048, 1024, 1, 1536]
    - [141, 9052.45]
  - - [2048, 256, 1, 1024]
    - [231, 7192.8]
  - - [128, 200, 1, 512]
    - [221, 502.577]
  - - [4096, 512, 1, 7168]
    - [144, 9329.01]
  - - [1024, 512, 1, 1152]
    - [231, 7358.43]
  - - [64, 1024, 1, 2048]
    - [149, 2102.41]
  - - [2048, 512, 1, 3328]
    - [233, 8694.59]
  - - [4096, 1024, 1, 896]
    - [139, 9342.92]
  - - [1, 1024, 1, 2048]
    - [189, 40.8324]
  - - [4096, 200, 1, 3584]
    - [237, 6810.2]
  - - [4096, 1024, 1, 4096]
    - [139, 9347.46]
  - - [1024, 256, 1, 14336]
    - [132, 6625.7]
  - - [2048, 200, 1, 256]
    - [231, 4413.2]
  - - [4096, 256, 1, 16384]
    - [133, 8752.03]
  - - [4096, 256, 1, 1920]
    - [224, 8533.68]
  - - [32, 1024, 1, 512]
    - [222, 647.269]
  - - [1024, 256, 1, 7680]
    - [242, 6387.26]
  - - [2048, 256, 1, 1664]
    - [242, 7631.34]
  - - [512, 200, 1, 1536]
    - [147, 2576.78]
  - - [2048, 1024, 1, 6144]
    - [128, 9033.67]
  - - [512, 256, 1, 2816]
    - [194, 3977.36]
  - - [4096, 512, 1, 4160]
    - [141, 9288.92]
  - - [4096, 512, 1, 2080]
    - [220, 9150.18]
  - - [2048, 256, 1, 15360]
    - [205, 7963.87]
  - - [4096, 200, 1, 5120]
    - [244, 6861.52]
  - - [1024, 512, 1, 8192]
    - [230, 7473.15]
  - - [4096, 200, 1, 896]
    - [247, 6443.15]
  - - [2048, 512, 1, 8320]
    - [237, 8810.14]
  - - [1024, 1024, 1, 10240]
    - [245, 8436.6]
  - - [1024, 200, 1, 768]
    - [231, 4087.48]
  - - [2048, 200, 1, 640]
    - [242, 5416.2]
  - - [512, 200, 1, 2048]
    - [196, 2702.52]
  - - [1024, 1024, 1, 9216]
    - [234, 8498.98]
  - - [4096, 200, 1, 1408]
    - [244, 6613.72]
  - - [1024, 256, 1, 13312]
    - [132, 6643.44]
  - - [1024, 256, 1, 128]
    - [163, 2706.0]
  - - [2048, 200, 1, 5632]
    - [242, 6270.02]
  - - [64, 1024, 1, 512]
    - [221, 1310.72]
  - - [1024, 512, 1, 2560]
    - [242, 7731.44]
  - - [4096, 200, 1, 1280]
    - [224, 6566.73]
  - - [1024, 200, 1, 4096]
    - [242, 4911.36]
  - - [1024, 1024, 1, 2560]
    - [233, 8630.25]
  - - [2048, 512, 1, 64]
    - [237, 4152.78]
  - - [2048, 200, 1, 8192]
    - [231, 6234.11]
  - - [2048, 512, 1, 3072]
    - [241, 8614.75]
  - - [4096, 1024, 1, 5120]
    - [139, 9573.65]
  - - [4096, 256, 1, 640]
    - [226, 7913.78]
  - - [1024, 256, 1, 1280]
    - [231, 5706.54]
  - - [2048, 1024, 1, 1920]
    - [141, 9141.24]
  - - [2048, 256, 1, 4096]
    - [231, 7937.18]
  - - [2048, 1024, 1, 15360]
    - [144, 9351.86]
  - - [4096, 200, 1, 16384]
    - [133, 6975.11]
  - - [1, 1024, 1, 4096]
    - [251, 60.6815]
  - - [4096, 1024, 1, 2816]
    - [139, 9583.88]
  - - [4096, 200, 1, 1664]
    - [226, 6658.6]
  - - [4096, 512, 1, 256]
    - [157, 7731.44]
  - - [1024, 200, 1, 896]
    - [231, 4193.35]
  - - [2048, 200, 1, 6656]
    - [242, 6291.07]
  - - [2048, 1024, 1, 5120]
    - [141, 9270.47]
  - - [512, 1024, 1, 768]
    - [231, 7098.96]
  - - [2048, 512, 1, 14336]
    - [211, 8559.03]
  - - [2048, 200, 1, 8320]
    - [231, 6314.62]
  - - [4096, 256, 1, 3840]
    - [247, 8718.46]
  - - [2048, 1024, 1, 4096]
    - [128, 8973.28]
  - - [1024, 1024, 1, 3200]
    - [237, 8701.88]
  - - [1024, 256, 1, 4608]
    - [231, 6267.95]
  - - [4096, 512, 1, 4608]
    - [139, 9316.37]
  - - [2048, 512, 1, 2048]
    - [230, 8462.66]
  - - [4096, 512, 1, 1664]
    - [139, 9074.43]
  - - [4096, 256, 1, 4608]
    - [226, 8717.95]
  - - [1024, 512, 1, 32]
    - [219, 1807.89]
  - - [1024, 512, 1, 3840]
    - [231, 7936.24]
  - - [2048, 512, 1, 1920]
    - [247, 8548.17]
  - - [2048, 1024, 1, 896]
    - [139, 8843.41]
  - - [4096, 200, 1, 6144]
    - [247, 6864.66]
  - - [1024, 512, 1, 13312]
    - [200, 7763.09]
  - - [4096, 1024, 1, 4160]
    - [139, 9650.62]
  - - [2048, 200, 1, 2816]
    - [231, 6119.66]
  - - [1024, 1024, 1, 3840]
    - [226, 8709.4]
  - - [128, 1024, 1, 1024]
    - [249, 2577.15]
  - - [2048, 1024, 1, 11264]
    - [144, 9338.96]
  - - [2048, 1024, 1, 384]
    - [233, 8210.71]
  - - [1024, 256, 1, 2048]
    - [254, 5755.48]
  - - [2048, 1024, 1, 3840]
    - [141, 9288.86]
  - - [4096, 256, 1, 8320]
    - [247, 8812.28]
  - - [2048, 256, 1, 3840]
    - [223, 7856.95]
  - - [64, 256, 1, 512]
    - [221, 336.082]
  - - [4096, 512, 1, 1280]
    - [141, 8993.42]
  - - [512, 256, 1, 1280]
    - [173, 2995.93]
  - - [1024, 512, 1, 7680]
    - [231, 8041.49]
  - - [4096, 1024, 1, 1152]
    - [139, 9368.38]
  - - [256, 200, 1, 512]
    - [173, 992.97]
  - - [256, 1024, 1, 2048]
    - [250, 4759.49]
  - - [2048, 200, 1, 10240]
    - [242, 6328.93]
  - - [2048, 512, 1, 5120]
    - [243, 8732.46]
  - - [2048, 1024, 1, 1408]
    - [141, 9006.8]
  - - [512, 1024, 1, 512]
    - [231, 6528.1]
  - - [1024, 200, 1, 11264]
    - [198, 5194.72]
  - - [512, 1024, 1, 1024]
    - [184, 6337.0]
  - - [2048, 512, 1, 32]
    - [150, 2777.68]
  - - [4096, 256, 1, 2560]
    - [233, 8621.39]
  - - [4096, 256, 1, 64]
    - [167, 4194.3]
  - - [32, 1024, 1, 1024]
    - [168, 778.164]
  - - [2048, 200, 1, 768]
    - [242, 5507.23]
  - - [512, 512, 1, 2048]
    - [190, 5338.81]
  - - [2048, 512, 1, 2560]
    - [244, 8643.59]
  - - [512, 256, 1, 512]
    - [223, 2542.0]
  - - [1024, 200, 1, 7680]
    - [198, 5047.7]
  - - [4096, 512, 1, 896]
    - [139, 8856.75]
  - - [4096, 1024, 1, 3072]
    - [139, 9492.07]
  - - [4096, 200, 1, 13312]
    - [131, 6900.63]
  - - [2048, 512, 1, 7168]
    - [232, 8788.0]
  - - [2048, 1024, 1, 2816]
    - [144, 9229.78]
  - - [2048, 512, 1, 128]
    - [162, 5629.94]
  - - [1024, 256, 1, 8192]
    - [254, 6203.73]
  - - [4096, 1024, 1, 1792]
    - [139, 9510.32]
  - - [1024, 200, 1, 6656]
    - [223, 5002.75]
  - - [1024, 1024, 1, 1024]
    - [160, 8095.16]
  - - [4096, 200, 1, 2304]
    - [244, 6754.35]
  - - [4096, 512, 1, 1152]
    - [139, 8974.44]
  - - [512, 200, 1, 1024]
    - [221, 2232.91]
  - - [1024, 256, 1, 3840]
    - [242, 6244.62]
  - - [512, 512, 1, 768]
    - [231, 5331.74]
  - - [2048, 512, 1, 4096]
    - [241, 8621.66]
  - - [2048, 256, 1, 2560]
    - [231, 7770.83]
  - - [2048, 256, 1, 4160]
    - [242, 7922.98]
  - - [1024, 256, 1, 64]
    - [138, 1705.0]
  - - [4096, 512, 1, 7680]
    - [139, 9364.47]
  - - [1024, 512, 1, 1664]
    - [242, 7594.14]
  - - [2048, 512, 1, 2080]
    - [233, 8570.57]
  - - [2048, 512, 1, 3840]
    - [244, 8729.04]
  - - [4096, 1024, 1, 384]
    - [139, 8764.76]
  - - [4096, 200, 1, 3072]
    - [233, 6772.29]
  - - [1024, 512, 1, 14336]
    - [201, 7680.87]
  - - [1024, 200, 1, 1920]
    - [223, 4636.98]
  - - [1024, 1024, 1, 1664]
    - [237, 8506.39]
  - - [512, 1024, 1, 2304]
    - [231, 7775.23]
  - - [2048, 1024, 1, 1792]
    - [139, 9123.36]
  - - [32, 200, 1, 512]
    - [239, 125.644]
  - - [4096, 256, 1, 11264]
    - [244, 8822.21]
  - - [4096, 256, 1, 1408]
    - [244, 8419.22]
  - - [1024, 256, 1, 7168]
    - [231, 6377.44]
  - - [2048, 256, 1, 1152]
    - [242, 7401.71]
  - - [256, 256, 1, 512]
    - [221, 1314.83]
  - - [1024, 512, 1, 1280]
    - [231, 7410.43]
  - - [512, 512, 1, 1792]
    - [223, 5931.34]
  - - [2048, 200, 1, 12288]
    - [205, 6242.15]
  - - [2048, 200, 1, 1664]
    - [242, 5953.65]
  - - [4096, 200, 1, 4608]
    - [237, 6853.44]
  - - [512, 1024, 1, 2560]
    - [231, 7778.03]
  - - [4096, 200, 1, 384]
    - [224, 5765.63]
  - - [128, 512, 1, 512]
    - [221, 1302.58]
  - - [1024, 200, 1, 256]
    - [225, 2861.83]
  - - [256, 1024, 1, 1024]
    - [166, 4522.16]
  - - [2048, 200, 1, 128]
    - [231, 3309.9]
  - - [2048, 200, 1, 11264]
    - [212, 6168.1]
  - - [1024, 512, 1, 1920]
    - [242, 7649.19]
  - - [4096, 256, 1, 1536]
    - [237, 8427.23]
  - - [4096, 1024, 1, 3584]
    - [139, 9617.9]
  - - [2048, 256, 1, 256]
    - [231, 5464.89]
  - - [2048, 1024, 1, 768]
    - [139, 8726.77]
  - - [4096, 256, 1, 10240]
    - [233, 8790.79]
  - - [2048, 256, 1, 10240]
    - [213, 7665.21]
  - - [4096, 200, 1, 14336]
    - [247, 6916.08]
  - - [1024, 512, 1, 5120]
    - [185, 7420.26]
  - - [1024, 512, 1, 8320]
    - [242, 8061.21]
  - - [256, 200, 1, 2048]
    - [197, 1916.26]
  - - [1024, 200, 1, 640]
    - [225, 3873.29]
  - - [1024, 512, 1, 10240]
    - [230, 7526.8]
  - - [1024, 200, 1, 4160]
    - [242, 4928.09]
  - - [1024, 200, 1, 5632]
    - [223, 4978.56]
  - - [1024, 1024, 1, 2048]
    - [178, 7937.18]
  - - [1024, 256, 1, 6656]
    - [242, 6373.58]
  - - [2048, 1024, 1, 8320]
    - [139, 9333.05]
  - - [1024, 256, 1, 10240]
    - [231, 6407.19]
  - - [2048, 256, 1, 2080]
    - [231, 7714.48]
  - - [4096, 256, 1, 128]
    - [145, 5765.37]
  - - [1024, 256, 1, 768]
    - [236, 5210.32]
  - - [2048, 256, 1, 896]
    - [242, 7267.36]
  - - [64, 512, 1, 2048]
    - [208, 1296.54]
  - - [4096, 512, 1, 2048]
    - [141, 9121.15]
  - - [512, 256, 1, 2048]
    - [194, 3283.21]
  - - [4096, 256, 1, 16640]
    - [226, 8839.78]
  - - [4096, 512, 1, 2560]
    - [144, 9222.05]
  - - [1024, 512, 1, 15360]
    - [195, 7865.56]
  - - [4096, 1024, 1, 2304]
    - [139, 9558.16]
  - - [4096, 200, 1, 1152]
    - [244, 6531.83]
  - - [2048, 200, 1, 6144]
    - [242, 6277.65]
  - - [1024, 1024, 1, 7680]
    - [237, 8799.24]
  - - [2048, 200, 1, 1920]
    - [242, 6030.92]
  - - [32, 1024, 1, 2048]
    - [216, 1174.88]
  - - [1024, 200, 1, 3584]
    - [223, 4880.34]
  - - [4096, 256, 1, 2080]
    - [230, 8557.12]
  - - [1024, 1024, 1, 16384]
    - [131, 8618.55]
  - - [1024, 256, 1, 1408]
    - [242, 5803.44]
  - - [1024, 256, 1, 4096]
    - [252, 6037.68]
  - - [2048, 200, 1, 14336]
    - [242, 6364.38]
  - - [4096, 512, 1, 5120]
    - [141, 9301.95]
  - - [1024, 512, 1, 6144]
    - [177, 7468.99]
  - - [1024, 512, 1, 2304]
    - [242, 7759.25]
  - - [4096, 200, 1, 4160]
    - [226, 6843.12]
  - - [4096, 200, 1, 1536]
    - [237, 6628.17]
  - - [4096, 1024, 1, 6144]
    - [139, 9592.98]
  - - [1280, 384, 1, 64]
    - [270, 3196.88]
  - - [256, 64, 1, 1225]
    - [271, 1194.67]
  - - [2048, 320, 1, 64]
    - [273, 3449.26]
  - - [256, 48, 1, 1225]
    - [264, 913.398]
  - - [2048, 192, 1, 64]
    - [263, 2516.58]
  - - [1024, 128, 1, 289]
    - [277, 2869.68]
  - - [1280, 192, 1, 64]
    - [256, 1872.46]
  - - [192, 32, 1, 1225]
    - [261, 505.806]
  - - [1280, 448, 1, 64]
    - [257, 3078.87]
  - - [384, 64, 1, 1225]
    - [262, 1511.33]
  - - [2048, 384, 1, 64]
    - [275, 3836.25]
  - - [288, 48, 1, 1225]
    - [258, 1032.59]
  - - [64, 80, 1, 5329]
    - [274, 888.167]
  - - [1024, 384, 1, 289]
    - [268, 4291.52]
  - - [2048, 448, 1, 64]
    - [267, 3783.52]
  - - [1280, 320, 1, 64]
    - [273, 2776.95]
  - - [192, 64, 1, 1225]
    - [258, 926.897]
  - - [384, 192, 1, 1225]
    - [269, 2560.0]
  - - [1536, 256, 1, 64]
    - [276, 2621.44]
  - - [192, 48, 1, 1225]
    - [261, 698.614]
  - - [768, 128, 1, 289]
    - [278, 2291.12]
  - - [1024, 256, 1, 289]
    - [276, 4064.36]
  - - [768, 192, 1, 289]
    - [272, 2690.33]
  - - [1536, 384, 1, 64]
    - [259, 3145.73]
  - - [288, 64, 1, 1225]
    - [261, 1142.67]
  - - [1024, 192, 1, 289]
    - [266, 3243.13]
  - - [384, 96, 1, 1225]
    - [279, 1844.71]
  - - [160, 64, 1, 5329]
    - [265, 1564.48]
  - - [768, 160, 1, 289]
    - [260, 2386.58]
  - - [1024, 3392, 1, 4096]
    - [305, 8502.92]
  - - [1024, 3301, 1, 4096]
    - [307, 8414.0]
  - - [1024, 3443, 1, 4096]
    - [294, 8536.49]
  - - [132, 134, 480, 64]
    - [332, 4149.17]
  - - [162, 162, 400, 64]
    - [320, 5539.63]
  - - [4096, 3548, 1, 1024]
    - [286, 9772.91]
  - - [4096, 2977, 1, 1024]
    - [287, 9574.33]
  - - [132, 135, 480, 64]
    - [332, 4167.41]
  - - [1024, 2985, 1, 4096]
    - [290, 9133.89]
  - - [33708, 3681, 1, 1024]
    - [287, 10033.7]
  - - [4096, 3443, 1, 1024]
    - [287, 9513.68]
  - - [11, 11, 5456, 64]
    - [329, 627.246]
  - - [1024, 3400, 1, 4096]
    - [308, 8419.92]
  - - [4096, 3995, 1, 1024]
    - [286, 9693.77]
  - - [4096, 3190, 1, 1024]
    - [286, 9474.74]
  - - [4096, 3594, 1, 1024]
    - [287, 9315.73]
  - - [159, 162, 400, 64]
    - [319, 5429.88]
  - - [1024, 3565, 1, 4096]
    - [302, 8532.7]
  - - [4096, 3422, 1, 1024]
    - [287, 9459.14]
  - - [1024, 3214, 1, 4096]
    - [307, 8064.82]
  - - [33708, 3584, 1, 1024]
    - [288, 10128.9]
  - - [33708, 3640, 1, 1024]
    - [285, 9919.12]
  - - [4096, 3263, 1, 1024]
    - [285, 9699.25]
  - - [4096, 3296, 1, 1024]
    - [285, 9780.7]
  - - [1024, 3557, 1, 4096]
    - [306, 8526.79]
  - - [4096, 3463, 1, 1024]
    - [285, 9578.03]
  - - [4096, 3528, 1, 1024]
    - [285, 9739.82]
  - - [14, 14, 4368, 64]
    - [317, 991.176]
  - - [4096, 3226, 1, 1024]
    - [285, 9587.09]
  - - [4096, 3439, 1, 1024]
    - [288, 9499.62]
  - - [1024, 3523, 1, 4096]
    - [308, 8393.48]
  - - [1024, 3098, 1, 4096]
    - [314, 7882.77]
  - - [4096, 3121, 1, 1024]
    - [285, 9296.13]
  - - [33708, 3894, 1, 1024]
    - [286, 9952.17]
  - - [1024, 3548, 1, 4096]
    - [292, 8432.35]
  - - [1024, 3451, 1, 4096]
    - [305, 8456.34]
  - - [4096, 3353, 1, 1024]
    - [287, 9288.98]
  - - [4096, 3402, 1, 1024]
    - [287, 9406.34]
  - - [4096, 3939, 1, 1024]
    - [285, 9549.49]
  - - [133, 133, 480, 64]
    - [332, 4124.21]
  - - [1024, 3559, 1, 4096]
    - [307, 8586.94]
  - - [1024, 2977, 1, 4096]
    - [290, 9084.49]
  - - [1024, 3478, 1, 4096]
    - [301, 8342.75]
  - - [134, 134, 480, 64]
    - [334, 4204.33]
  - - [1024, 3368, 1, 4096]
    - [307, 8277.33]
  - - [4096, 4012, 1, 1024]
    - [287, 9726.47]
  - - [4096, 3486, 1, 1024]
    - [285, 9639.61]
  - - [1024, 3479, 1, 4096]
    - [295, 8420.27]
  - - [1024, 3505, 1, 4096]
    - [307, 8310.56]
  - - [4096, 3381, 1, 1024]
    - [288, 9357.65]
  - - [4096, 3430, 1, 1024]
    - [285, 9482.26]
  - - [1024, 3554, 1, 4096]
    - [307, 8592.28]
  - - [4096, 3271, 1, 1024]
    - [285, 9715.31]
  - - [1024, 3063, 1, 4096]
    - [289, 9388.46]
  - - [1024, 3209, 1, 4096]
    - [307, 8212.64]
  - - [4096, 3503, 1, 1024]
    - [287, 9680.49]
  - - [4096, 3344, 1, 1024]
    - [285, 9268.45]
  - - [1024, 3147, 1, 4096]
    - [308, 8037.1]
  - - [1024, 3322, 1, 4096]
    - [306, 8356.22]
  - - [1024, 3341, 1, 4096]
    - [307, 8316.23]
  - - [1024, 3516, 1, 4096]
    - [289, 8397.02]
  - - [102, 101, 624, 64]
    - [320, 4709.49]
  - - [1024, 3454, 1, 4096]
    - [306, 8425.5]
  - - [4096, 3969, 1, 1024]
    - [287, 9640.05]
  - - [4096, 3466, 1, 1024]
    - [287, 9576.73]
  - - [1024, 3999, 1, 1024]
    - [290, 9207.05]
  - - [1024, 4032, 1, 1024]
    - [291, 9294.46]
  - - [1024, 3403, 1, 4096]
    - [305, 8357.87]
  - - [4096, 3361, 1, 1024]
    - [287, 9308.68]
  - - [1024, 3527, 1, 4096]
    - [306, 8512.09]
  - - [1024, 3822, 1, 4096]
    - [290, 8991.03]
  - - [4096, 3315, 1, 1024]
    - [285, 9834.86]
  - - [232, 232, 272, 64]
    - [319, 6481.52]
  - - [1024, 3336, 1, 4096]
    - [308, 8295.51]
  - - [228, 232, 272, 64]
    - [320, 6327.75]
  - - [4096, 3547, 1, 1024]
    - [285, 9781.46]
  - - [4096, 3340, 1, 1024]
    - [287, 9269.62]
  - - [1024, 3906, 1, 1024]
    - [291, 9018.28]
  - - [1024, 3295, 1, 4096]
    - [305, 8194.73]
  - - [4096, 3294, 1, 1024]
    - [288, 9762.06]
  - - [33708, 3968, 1, 1024]
    - [288, 10147.7]
  - - [1024, 3473, 1, 4096]
    - [294, 8318.58]
  - - [1024, 3072, 1, 4096]
    - [291, 9370.03]
  - - [4096, 3189, 1, 1024]
    - [285, 9470.16]
  - - [4096, 3494, 1, 1024]
    - [285, 9661.22]
  - - [1024, 3522, 1, 4096]
    - [308, 8459.13]
  - - [33708, 3944, 1, 1024]
    - [288, 10060.1]
  - - [135, 135, 480, 64]
    - [333, 4256.93]
  - - [4096, 3421, 1, 1024]
    - [285, 9456.88]
  - - [32, 32, 1984, 64]
    - [330, 3436.14]
  - - [4096, 3311, 1, 1024]
    - [285, 9810.78]
  - - [1024, 3990, 1, 1024]
    - [292, 9197.64]
  - - [1024, 3290, 1, 4096]
    - [305, 8229.53]
  - - [4096, 3565, 1, 1024]
    - [286, 9824.38]
  - - [1024, 3484, 1, 4096]
    - [295, 8575.28]
  - - [4096, 3384, 1, 1024]
    - [285, 9366.44]
  - - [1024, 3422, 1, 4096]
    - [305, 8484.02]
  - - [4096, 3681, 1, 1024]
    - [286, 9520.06]
  - - [1024, 3584, 1, 1024]
    - [312, 8583.27]
  - - [4096, 4050, 1, 1024]
    - [287, 9807.25]
  - - [1024, 3996, 1, 4096]
    - [288, 9181.6]
  - - [4096, 3169, 1, 1024]
    - [286, 9411.3]
  - - [4096, 3538, 1, 1024]
    - [286, 9765.89]
  - - [1024, 3495, 1, 4096]
    - [292, 8295.85]
  - - [4096, 3401, 1, 1024]
    - [285, 9402.58]
  - - [1024, 3560, 1, 4096]
    - [306, 8513.35]
  - - [133, 135, 480, 64]
    - [333, 4198.98]
  - - [1024, 3263, 1, 4096]
    - [307, 8172.13]
  - - [1024, 3870, 1, 4096]
    - [287, 8996.17]
  - - [4096, 3555, 1, 1024]
    - [288, 9811.78]
  - - [4096, 3412, 1, 1024]
    - [285, 9431.99]
  - - [101, 101, 624, 64]
    - [319, 4667.59]
  - - [1024, 3296, 1, 4096]
    - [306, 8350.51]
  - - [1024, 3379, 1, 4096]
    - [308, 8432.84]
  - - [4096, 3302, 1, 1024]
    - [285, 9796.29]
  - - [1024, 3490, 1, 4096]
    - [305, 8538.34]
  - - [1024, 3428, 1, 4096]
    - [306, 8531.57]
  - - [1024, 3976, 1, 4096]
    - [287, 9327.77]
  - - [4096, 3485, 1, 1024]
    - [285, 9628.72]
  - - [4096, 3534, 1, 1024]
    - [285, 9755.87]
  - - [1024, 3064, 1, 4096]
    - [291, 9196.88]
  - - [4096, 3216, 1, 1024]
    - [287, 9563.34]
  - - [1024, 3450, 1, 4096]
    - [315, 8519.19]
  - - [1024, 3533, 1, 4096]
    - [306, 8495.67]
  - - [1024, 4030, 1, 1024]
    - [291, 9304.58]
  - - [1024, 3311, 1, 4096]
    - [306, 8278.5]
  - - [1024, 3468, 1, 4096]
    - [297, 8564.45]
  - - [23, 23, 2720, 64]
    - [321, 2311.45]
  - - [4096, 3359, 1, 1024]
    - [287, 9309.05]
  - - [4096, 3392, 1, 1024]
    - [287, 9388.09]
  - - [1024, 3925, 1, 1024]
    - [289, 9006.62]
  - - [4096, 3233, 1, 1024]
    - [285, 9603.54]
  - - [4096, 3956, 1, 1024]
    - [286, 9581.84]
  - - [1024, 3463, 1, 4096]
    - [307, 8293.87]
  - - [1024, 3126, 1, 4096]
    - [306, 7978.03]
  - - [1024, 3363, 1, 4096]
    - [299, 8267.37]
  - - [4096, 3465, 1, 1024]
    - [285, 9590.64]
  - - [33708, 3996, 1, 1024]
    - [286, 9899.89]
  - - [1024, 3231, 1, 4096]
    - [307, 8231.58]
  - - [33708, 3978, 1, 1024]
    - [286, 9853.54]
  - - [4096, 3476, 1, 1024]
    - [285, 9616.52]
  - - [85, 85, 752, 64]
    - [317, 4240.55]
  - - [4096, 3339, 1, 1024]
    - [287, 9249.71]
  - - [4096, 3452, 1, 1024]
    - [285, 9534.03]
  - - [1024, 3396, 1, 4096]
    - [306, 8451.13]
  - - [4096, 3293, 1, 1024]
    - [287, 9775.12]
  - - [54, 54, 1184, 64]
    - [319, 4153.44]
  - - [1024, 3432, 1, 4096]
    - [300, 8345.43]
  - - [4096, 3493, 1, 1024]
    - [288, 9649.8]
  - - [4096, 3350, 1, 1024]
    - [287, 9273.81]
  - - [1024, 3079, 1, 4096]
    - [315, 7775.56]
  - - [1024, 3101, 1, 4096]
    - [315, 7847.75]
  - - [33708, 3939, 1, 1024]
    - [288, 10054.3]
  - - [4096, 3256, 1, 1024]
    - [287, 9681.73]
  - - [1024, 3439, 1, 4096]
    - [306, 8531.01]
  - - [1024, 3510, 1, 4096]
    - [305, 8422.21]
  - - [4096, 3900, 1, 1024]
    - [286, 9468.51]
  - - [1024, 3470, 1, 4096]
    - [307, 8507.67]
  - - [4096, 3456, 1, 1024]
    - [287, 9577.36]
  - - [4096, 3014, 1, 1024]
    - [286, 9666.05]
  - - [4096, 3367, 1, 1024]
    - [288, 9328.26]
  - - [4096, 3432, 1, 1024]
    - [285, 9480.78]
  - - [33708, 4026, 1, 1024]
    - [288, 9972.73]
  - - [4096, 3273, 1, 1024]
    - [285, 9716.85]
  - - [4096, 3130, 1, 1024]
    - [285, 9311.3]
  - - [1024, 3496, 1, 4096]
    - [296, 8434.55]
  - - [1024, 3995, 1, 4096]
    - [281, 9157.63]
  - - [1024, 3939, 1, 4096]
    - [289, 9059.76]
  - - [1024, 3121, 1, 4096]
    - [313, 7963.33]
  - - [1024, 3232, 1, 4096]
    - [307, 8060.99]
  - - [4096, 3147, 1, 1024]
    - [287, 9364.53]
  - - [4096, 3516, 1, 1024]
    - [285, 9708.74]
  - - [1024, 3969, 1, 1024]
    - [291, 9168.58]
  - - [1024, 3364, 1, 4096]
    - [295, 8363.55]
  - - [4096, 3411, 1, 1024]
    - [288, 9442.67]
  - - [147, 147, 432, 64]
    - [332, 4843.11]
  - - [4096, 3301, 1, 1024]
    - [287, 9783.36]
  - - [112, 111, 576, 64]
    - [319, 5627.37]
  - - [1024, 3513, 1, 4096]
    - [306, 8725.31]
  - - [1024, 3469, 1, 4096]
    - [286, 8183.01]
  - - [1024, 3095, 1, 4096]
    - [307, 7887.77]
  - - [4096, 3533, 1, 1024]
    - [286, 9755.17]
  - - [4096, 3390, 1, 1024]
    - [285, 9377.11]
  - - [4096, 3582, 1, 1024]
    - [285, 9874.86]
  - - [1024, 3956, 1, 1024]
    - [291, 9058.72]
  - - [4096, 3585, 1, 1024]
    - [287, 9289.65]
  - - [4096, 3231, 1, 1024]
    - [286, 9597.05]
  - - [1024, 3205, 1, 4096]
    - [305, 8073.15]
  - - [4096, 3496, 1, 1024]
    - [286, 9668.28]
  - - [1024, 3143, 1, 4096]
    - [305, 8031.58]
  - - [1024, 3318, 1, 4096]
    - [302, 8261.33]
  - - [1024, 3353, 1, 4096]
    - [306, 8414.82]
  - - [1024, 3464, 1, 4096]
    - [305, 8309.93]
  - - [4096, 2736, 1, 1024]
    - [287, 9563.02]
  - - [1024, 3402, 1, 4096]
    - [302, 8413.74]
  - - [4096, 3138, 1, 1024]
    - [287, 9341.99]
  - - [1024, 3860, 1, 4096]
    - [290, 9008.47]
  - - [148, 148, 432, 64]
    - [332, 4915.6]
  - - [1024, 3539, 1, 4096]
    - [302, 8449.26]
  - - [4096, 3211, 1, 1024]
    - [287, 9551.18]
  - - [1024, 3332, 1, 4096]
    - [295, 8295.01]
  - - [1024, 3466, 1, 4096]
    - [306, 8339.15]
  - - [4096, 3475, 1, 1024]
    - [285, 9612.23]
  - - [4096, 3524, 1, 1024]
    - [288, 9722.64]
  - - [4096, 2985, 1, 1024]
    - [288, 9591.23]
  - - [4096, 3222, 1, 1024]
    - [285, 9577.38]
  - - [4096, 3451, 1, 1024]
    - [287, 9541.32]
  - - [1024, 3181, 1, 4096]
    - [305, 8118.79]
  - - [1024, 3640, 1, 4096]
    - [290, 8617.01]
  - - [1024, 3375, 1, 4096]
    - [294, 8419.65]
  - - [1024, 3550, 1, 4096]
    - [307, 8512.73]
  - - [1024, 4020, 1, 1024]
    - [291, 9266.8]
  - - [1024, 3840, 1, 4096]
    - [290, 8983.39]
  - - [4096, 3349, 1, 1024]
    - [285, 9279.86]
  - - [4096, 3398, 1, 1024]
    - [286, 9402.22]
  - - [33708, 3976, 1, 1024]
    - [287, 9849.44]
  - - [1024, 2917, 1, 4096]
    - [292, 8936.77]
  - - [33708, 3910, 1, 1024]
    - [285, 9983.25]
  - - [4096, 3860, 1, 1024]
    - [286, 9377.48]
  - - [4096, 3304, 1, 1024]
    - [288, 9798.34]
  - - [1024, 3286, 1, 4096]
    - [293, 8167.31]
  - - [1024, 3460, 1, 4096]
    - [303, 8539.46]
  - - [1024, 4026, 1, 4096]
    - [289, 9305.58]
  - - [4096, 3471, 1, 1024]
    - [287, 9596.61]
  - - [193, 193, 320, 64]
    - [335, 4758.36]
  - - [1024, 3894, 1, 1024]
    - [289, 8979.5]
  - - [65, 65, 992, 64]
    - [331, 2565.39]
  - - [1024, 3506, 1, 4096]
    - [303, 8593.12]
  - - [35, 35, 1808, 64]
    - [325, 2129.62]
  - - [1024, 4000, 1, 1024]
    - [289, 9204.5]
  - - [1024, 3900, 1, 4096]
    - [285, 9050.26]
  - - [1024, 3445, 1, 4096]
    - [308, 8551.55]
  - - [4096, 3442, 1, 1024]
    - [286, 9504.9]
  - - [1024, 3358, 1, 4096]
    - [307, 8437.06]
  - - [13, 13, 4672, 64]
    - [318, 860.565]
  - - [1024, 3211, 1, 4096]
    - [311, 8085.15]
  - - [4096, 3515, 1, 1024]
    - [287, 9715.19]
  - - [1024, 3564, 1, 4096]
    - [293, 8760.27]
  - - [4096, 3057, 1, 1024]
    - [287, 9803.95]
  - - [1024, 3343, 1, 4096]
    - [305, 8363.7]
  - - [4096, 3262, 1, 1024]
    - [286, 9686.39]
  - - [1024, 3518, 1, 4096]
    - [305, 8454.95]
  - - [77, 77, 816, 64]
    - [324, 3505.84]
  - - [33708, 3876, 1, 1024]
    - [286, 9895.85]
  - - [4096, 3462, 1, 1024]
    - [287, 9570.21]
  - - [1024, 3265, 1, 4096]
    - [305, 8322.65]
  - - [4096, 3389, 1, 1024]
    - [286, 9382.76]
  - - [4096, 3438, 1, 1024]
    - [287, 9503.37]
  - - [1024, 3955, 1, 1024]
    - [289, 9064.35]
  - - [1024, 3545, 1, 4096]
    - [308, 8652.31]
  - - [1024, 3144, 1, 4096]
    - [308, 8060.45]
  - - [1024, 3417, 1, 4096]
    - [306, 8505.81]
  - - [4096, 3543, 1, 1024]
    - [285, 9775.57]
  - - [4096, 3352, 1, 1024]
    - [287, 9282.77]
  - - [33708, 3975, 1, 1024]
    - [288, 9849.39]
  - - [148, 147, 432, 64]
    - [332, 4876.05]
  - - [4096, 3137, 1, 1024]
    - [285, 9330.53]
  - - [4096, 3506, 1, 1024]
    - [288, 9682.66]
  - - [1024, 3975, 1, 1024]
    - [291, 9164.67]
  - - [1024, 3859, 1, 4096]
    - [289, 8983.74]
  - - [4096, 3369, 1, 1024]
    - [287, 9330.35]
  - - [1024, 3434, 1, 4096]
    - [305, 8486.88]
  - - [1024, 3292, 1, 4096]
    - [305, 8478.86]
  - - [4096, 3523, 1, 1024]
    - [285, 9734.73]
  - - [4096, 3380, 1, 1024]
    - [287, 9354.39]
  - - [1024, 3408, 1, 4096]
    - [308, 8440.93]
  - - [4096, 3221, 1, 1024]
    - [287, 9575.49]
  - - [4096, 3270, 1, 1024]
    - [287, 9717.85]
  - - [143, 143, 432, 64]
    - [333, 4643.35]
  - - [111, 111, 576, 64]
    - [325, 5474.94]
  - - [1024, 3303, 1, 4096]
    - [307, 8412.97]
  - - [4096, 3502, 1, 1024]
    - [287, 9679.77]
  - - [1024, 3222, 1, 4096]
    - [307, 8141.78]
  - - [4096, 2505, 1, 1024]
    - [285, 9594.85]
  - - [4096, 3397, 1, 1024]
    - [285, 9392.51]
  - - [4096, 3562, 1, 1024]
    - [285, 9827.48]
  - - [4096, 3095, 1, 1024]
    - [287, 9222.35]
  - - [1024, 3226, 1, 4096]
    - [303, 8026.93]
  - - [177, 177, 352, 64]
    - [320, 6406.86]
  - - [4096, 3360, 1, 1024]
    - [286, 9298.05]
  - - [1024, 3942, 1, 1024]
    - [291, 9061.49]
  - - [1024, 3298, 1, 4096]
    - [308, 8254.26]
  - - [1024, 3381, 1, 4096]
    - [307, 8508.71]
  - - [4096, 3314, 1, 1024]
    - [287, 9837.46]
  - - [1024, 3492, 1, 4096]
    - [295, 8583.29]
  - - [1024, 3430, 1, 4096]
    - [295, 8492.61]
  - - [4096, 3977, 1, 1024]
    - [287, 9656.35]
  - - [4096, 3546, 1, 1024]
    - [285, 9780.25]
  - - [4096, 3640, 1, 1024]
    - [285, 9415.41]
  - - [4096, 3441, 1, 1024]
    - [286, 9499.14]
  - - [33708, 4059, 1, 1024]
    - [288, 10051.8]
  - - [1024, 3978, 1, 1024]
    - [289, 9158.7]
  - - [1024, 3376, 1, 4096]
    - [307, 8415.34]
  - - [1024, 3482, 1, 4096]
    - [308, 8396.52]
  - - [1024, 3563, 1, 4096]
    - [291, 8424.08]
  - - [4096, 4020, 1, 1024]
    - [288, 9745.86]
  - - [1024, 3271, 1, 4096]
    - [306, 8289.58]
  - - [1024, 3291, 1, 4096]
    - [306, 8222.61]
  - - [1024, 3431, 1, 4096]
    - [301, 8464.3]
  - - [1024, 3481, 1, 4096]
    - [307, 8386.4]
  - - [84, 85, 752, 64]
    - [322, 4194.75]
  - - [4096, 3461, 1, 1024]
    - [285, 9579.57]
  - - [1024, 3574, 1, 4096]
    - [308, 8579.7]
  - - [1024, 4059, 1, 1024]
    - [289, 9330.44]
  - - [84, 84, 752, 64]
    - [329, 4141.36]
  - - [1024, 3421, 1, 4096]
    - [308, 8528.32]
  - - [4096, 3224, 1, 1024]
    - [287, 9589.85]
  - - [4096, 3437, 1, 1024]
    - [287, 9498.1]
  - - [45, 45, 1424, 64]
    - [319, 3314.48]
  - - [4096, 3840, 1, 1024]
    - [285, 9931.27]
  - - [4096, 3168, 1, 1024]
    - [287, 9412.06]
  - - [33708, 3990, 1, 1024]
    - [285, 9884.29]
  - - [1024, 3349, 1, 4096]
    - [307, 8421.3]
  - - [4096, 3335, 1, 1024]
    - [285, 9241.55]
  - - [4096, 3400, 1, 1024]
    - [287, 9407.25]
  - - [160, 159, 400, 64]
    - [334, 5708.84]
  - - [1024, 3398, 1, 4096]
    - [307, 8623.93]
  - - [1024, 3780, 1, 4096]
    - [287, 8756.68]
  - - [29, 29, 2176, 64]
    - [330, 2963.59]
  - - [4096, 3098, 1, 1024]
    - [285, 9229.72]
  - - [1024, 4012, 1, 4096]
    - [291, 9421.93]
  - - [4096, 3505, 1, 1024]
    - [287, 9687.55]
  - - [4096, 3554, 1, 1024]
    - [287, 9812.12]
  - - [4096, 3063, 1, 1024]
    - [287, 9825.0]
  - - [1024, 3503, 1, 4096]
    - [305, 8404.64]
  - - [1024, 3166, 1, 4096]
    - [308, 8084.83]
  - - [1024, 3425, 1, 4096]
    - [308, 8537.48]
  - - [1024, 3344, 1, 4096]
    - [299, 8351.06]
  - - [4096, 3484, 1, 1024]
    - [287, 9635.6]
  - - [1024, 3681, 1, 1024]
    - [290, 8457.08]
  - - [1024, 4050, 1, 1024]
    - [291, 9326.11]
  - - [4096, 3379, 1, 1024]
    - [285, 9356.06]
  - - [4096, 3428, 1, 1024]
    - [286, 9472.23]
  - - [12, 12, 5040, 64]
    - [324, 741.517]
  - - [27, 27, 2336, 64]
    - [330, 2757.8]
  - - [1024, 3304, 1, 4096]
    - [308, 8317.72]
  - - [1024, 3387, 1, 4096]
    - [306, 8460.05]
  - - [4096, 3126, 1, 1024]
    - [288, 9308.38]
  - - [1024, 3498, 1, 4096]
    - [305, 8485.45]
  - - [1024, 3436, 1, 4096]
    - [307, 8397.61]
  - - [4096, 3501, 1, 1024]
    - [285, 9681.09]
  - - [4096, 3358, 1, 1024]
    - [287, 9304.8]
  - - [4096, 3232, 1, 1024]
    - [285, 9607.1]
  - - [1024, 3585, 1, 4096]
    - [289, 8510.64]
  - - [4096, 3143, 1, 1024]
    - [288, 9355.81]
  - - [4096, 3464, 1, 1024]
    - [287, 9585.85]
  - - [1024, 3366, 1, 4096]
    - [295, 8275.13]
  - - [4096, 3375, 1, 1024]
    - [285, 9342.03]
  - - [4096, 2917, 1, 1024]
    - [285, 9372.74]
  - - [4096, 4026, 1, 1024]
    - [287, 9759.05]
  - - [49, 49, 1296, 64]
    - [326, 3709.92]
  - - [1024, 3277, 1, 4096]
    - [306, 8217.0]
  - - [1024, 3103, 1, 4096]
    - [307, 7872.57]
  - - [33708, 3995, 1, 1024]
    - [287, 9892.98]
  - - [1024, 3297, 1, 4096]
    - [306, 8185.72]
  - - [4096, 3545, 1, 1024]
    - [287, 9789.33]
  - - [1024, 3399, 1, 4096]
    - [306, 8377.08]
  - - [33708, 3796, 1, 1024]
    - [286, 10007.9]
  - - [4096, 3292, 1, 1024]
    - [287, 9767.18]
  - - [71, 71, 896, 64]
    - [321, 3006.15]
  - - [33708, 3859, 1, 1024]
    - [288, 9860.27]
  - - [4096, 3566, 1, 1024]
    - [287, 9834.37]
  - - [4096, 3894, 1, 1024]
    - [285, 9456.57]
  - - [4096, 3492, 1, 1024]
    - [285, 9653.14]
  - - [1024, 3977, 1, 1024]
    - [291, 9161.23]
  - - [1024, 3272, 1, 4096]
    - [308, 8256.99]
  - - [135, 134, 480, 64]
    - [332, 4238.29]
  - - [1024, 3355, 1, 4096]
    - [306, 8374.54]
  - - [4096, 3419, 1, 1024]
    - [288, 9455.34]
  - - [1024, 3404, 1, 4096]
    - [307, 8580.18]
  - - [4096, 3999, 1, 1024]
    - [287, 9701.68]
  - - [4096, 3166, 1, 1024]
    - [285, 9410.38]
  - - [33708, 3840, 1, 1024]
    - [288, 10132.8]
  - - [4096, 4032, 1, 1024]
    - [288, 9762.76]
  - - [1024, 3573, 1, 4096]
    - [306, 8603.3]
  - - [4096, 3366, 1, 1024]
    - [288, 9322.53]
  - - [1024, 3541, 1, 4096]
    - [308, 8405.8]
  - - [4096, 3207, 1, 1024]
    - [285, 9544.15]
  - - [4096, 3272, 1, 1024]
    - [287, 9716.63]
  - - [1024, 3334, 1, 4096]
    - [305, 8241.29]
  - - [228, 228, 272, 64]
    - [320, 6232.35]
  - - [4096, 3183, 1, 1024]
    - [287, 9452.34]
  - - [4096, 3536, 1, 1024]
    - [286, 9759.34]
  - - [1024, 4005, 1, 1024]
    - [290, 9225.73]
  - - [1024, 3245, 1, 4096]
    - [307, 8074.21]
  - - [4096, 3447, 1, 1024]
    - [286, 9525.74]
  - - [1024, 3183, 1, 4096]
    - [306, 8121.52]
  - - [1024, 3361, 1, 4096]
    - [308, 8285.76]
  - - [33708, 3870, 1, 1024]
    - [286, 9879.25]
  - - [1024, 3321, 1, 4096]
    - [307, 8408.57]
  - - [1024, 3968, 1, 1024]
    - [289, 9201.95]
  - - [1024, 3486, 1, 4096]
    - [303, 8258.79]
  - - [4096, 4005, 1, 1024]
    - [287, 9723.88]
  - - [4096, 3410, 1, 1024]
    - [288, 9440.4]
  - - [1024, 3944, 1, 1024]
    - [291, 9040.72]
  - - [4096, 3300, 1, 1024]
    - [286, 9789.8]
  - - [4096, 3579, 1, 1024]
    - [288, 9859.34]
  - - [4096, 3483, 1, 1024]
    - [288, 9624.21]
  - - [4096, 3532, 1, 1024]
    - [287, 9742.66]
  - - [1024, 3140, 1, 4096]
    - [307, 7899.55]
  - - [1024, 3372, 1, 4096]
    - [305, 8236.97]
  - - [1024, 3224, 1, 4096]
    - [308, 8159.03]
  - - [4096, 3230, 1, 1024]
    - [287, 9601.15]
  - - [4096, 3427, 1, 1024]
    - [287, 9466.47]
  - - [1024, 3796, 1, 1024]
    - [291, 8739.68]
  - - [143, 148, 432, 64]
    - [332, 4761.9]
  - - [1024, 3616, 1, 4096]
    - [290, 8445.79]
  - - [1024, 3315, 1, 4096]
    - [307, 8403.11]
  - - [1024, 3476, 1, 4096]
    - [305, 8523.58]
  - - [1024, 3509, 1, 4096]
    - [305, 8344.95]
  - - [4096, 3357, 1, 1024]
    - [287, 9300.06]
  - - [4096, 3406, 1, 1024]
    - [287, 9427.34]
  - - [1024, 3558, 1, 4096]
    - [306, 8525.68]
  - - [4096, 3593, 1, 1024]
    - [287, 9302.1]
  - - [4096, 3247, 1, 1024]
    - [287, 9648.4]
  - - [4096, 3088, 1, 1024]
    - [287, 9204.11]
  - - [1024, 3213, 1, 4096]
    - [305, 8054.21]
  - - [4096, 3511, 1, 1024]
    - [285, 9702.6]
  - - [122, 122, 528, 64]
    - [326, 6293.29]
  - - [1024, 3365, 1, 4096]
    - [302, 8413.52]
  - - [1024, 3504, 1, 4096]
    - [304, 8414.36]
  - - [1024, 3442, 1, 4096]
    - [307, 8683.9]
  - - [4096, 3474, 1, 1024]
    - [285, 9611.5]
  - - [4096, 2984, 1, 1024]
    - [286, 9592.72]
  - - [1024, 3876, 1, 4096]
    - [289, 9085.85]
  - - [4096, 3337, 1, 1024]
    - [287, 9246.12]
  - - [4096, 3450, 1, 1024]
    - [287, 9534.53]
  - - [1024, 3547, 1, 4096]
    - [307, 8386.63]
  - - [4096, 3291, 1, 1024]
    - [286, 9759.24]
  - - [1024, 3340, 1, 4096]
    - [306, 8237.87]
  - - [4096, 3491, 1, 1024]
    - [287, 9656.49]
  - - [4096, 3348, 1, 1024]
    - [287, 9279.05]
  - - [78, 78, 816, 64]
    - [327, 3590.99]
  - - [4096, 3968, 1, 1024]
    - [288, 9642.09]
  - - [4096, 3906, 1, 1024]
    - [288, 9485.27]
  - - [1024, 3477, 1, 4096]
    - [295, 8389.1]
  - - [1024, 3397, 1, 4096]
    - [305, 8556.78]
  - - [4096, 3165, 1, 1024]
    - [286, 9415.42]
  - - [4096, 3470, 1, 1024]
    - [285, 9598.4]
  - - [1024, 3526, 1, 4096]
    - [305, 8442.05]
  - - [112, 112, 576, 64]
    - [320, 5672.5]
  - - [4096, 3365, 1, 1024]
    - [285, 9321.73]
  - - [4096, 3319, 1, 1024]
    - [285, 9838.38]
  - - [1024, 3401, 1, 4096]
    - [307, 8460.76]
  - - [1024, 3294, 1, 4096]
    - [306, 8324.53]
  - - [159, 159, 400, 64]
    - [322, 5488.41]
  - - [1024, 3472, 1, 4096]
    - [300, 8289.67]
  - - [4096, 3328, 1, 1024]
    - [286, 9904.25]
  - - [1024, 3861, 1, 1024]
    - [291, 8917.53]
  - - [1024, 3910, 1, 1024]
    - [289, 9010.06]
  - - [1024, 3410, 1, 4096]
    - [307, 8519.53]
  - - [1024, 3395, 1, 4096]
    - [305, 8424.25]
  - - [4096, 3282, 1, 1024]
    - [285, 9743.57]
  - - [1024, 3751, 1, 1024]
    - [292, 8680.29]
  - - [4096, 3145, 1, 1024]
    - [287, 9353.27]
  - - [4096, 3514, 1, 1024]
    - [287, 9712.94]
  - - [4096, 3944, 1, 1024]
    - [287, 9563.82]
  - - [1024, 3515, 1, 4096]
    - [306, 8428.03]
  - - [4096, 3409, 1, 1024]
    - [286, 9428.67]
  - - [4096, 3564, 1, 1024]
    - [285, 9823.69]
  - - [4096, 3299, 1, 1024]
    - [287, 9792.93]
  - - [1024, 3057, 1, 4096]
    - [283, 9237.75]
  - - [4096, 3531, 1, 1024]
    - [285, 9745.54]
  - - [4096, 3388, 1, 1024]
    - [287, 9374.55]
  - - [1024, 3189, 1, 4096]
    - [307, 8084.5]
  - - [1024, 3300, 1, 4096]
    - [307, 8185.03]
  - - [1024, 3720, 1, 4096]
    - [286, 8755.01]
  - - [1024, 3383, 1, 4096]
    - [300, 8463.37]
  - - [1024, 3494, 1, 4096]
    - [307, 8676.47]
  - - [77, 78, 816, 64]
    - [323, 3548.16]
  - - [1024, 3448, 1, 4096]
    - [305, 8665.68]
  - - [4096, 3542, 1, 1024]
    - [285, 9771.78]
  - - [1024, 3488, 1, 4096]
    - [305, 8488.29]
  - - [4096, 3405, 1, 1024]
    - [287, 9426.06]
  - - [1024, 3262, 1, 4096]
    - [307, 8206.87]
  - - [33708, 4005, 1, 1024]
    - [288, 9928.06]
  - - [1024, 3594, 1, 4096]
    - [292, 8458.47]
  - - [4096, 3103, 1, 1024]
    - [288, 9243.04]
  - - [4096, 3136, 1, 1024]
    - [287, 9340.8]
  - - [1024, 3378, 1, 4096]
    - [308, 8432.35]
  - - [10, 10, 5952, 64]
    - [328, 523.253]
  - - [7, 7, 8192, 64]
    - [328, 260.443]
  - - [4096, 3559, 1, 1024]
    - [287, 9813.0]
  - - [4096, 3368, 1, 1024]
    - [288, 9328.56]
  - - [4096, 3209, 1, 1024]
    - [285, 9538.73]
  - - [4096, 3322, 1, 1024]
    - [287, 9839.48]
  - - [1024, 3483, 1, 4096]
    - [293, 8348.25]
  - - [4096, 3473, 1, 1024]
    - [286, 9605.69]
  - - [4096, 3522, 1, 1024]
    - [288, 9729.92]
  - - [1024, 3532, 1, 4096]
    - [306, 8474.22]
  - - [4096, 3449, 1, 1024]
    - [287, 9528.25]
  - - [1024, 3351, 1, 4096]
    - [308, 8311.13]
  - - [1024, 3462, 1, 4096]
    - [305, 8297.54]
  - - [4096, 3396, 1, 1024]
    - [287, 9400.15]
  - - [132, 132, 480, 64]
    - [333, 4089.74]
  - - [111, 112, 576, 64]
    - [319, 5529.6]
  - - [1024, 3416, 1, 4096]
    - [306, 8556.54]
  - - [4096, 3469, 1, 1024]
    - [288, 9598.67]
  - - [1024, 3582, 1, 4096]
    - [289, 8461.37]
  - - [1024, 3230, 1, 4096]
    - [306, 8188.84]
  - - [1024, 3489, 1, 4096]
    - [307, 8457.75]
  - - [1024, 3427, 1, 4096]
    - [307, 8566.49]
  - - [1024, 3346, 1, 4096]
    - [306, 8352.07]
  - - [33708, 3977, 1, 1024]
    - [288, 9868.4]
  - - [4096, 3796, 1, 1024]
    - [287, 9797.66]
  - - [4096, 3176, 1, 1024]
    - [287, 9435.29]
  - - [4096, 3990, 1, 1024]
    - [285, 9672.23]
  - - [1024, 3257, 1, 4096]
    - [308, 8225.07]
  - - [4096, 3343, 1, 1024]
    - [309, 9273.52]
  - - [4096, 3440, 1, 1024]
    - [285, 9501.38]
  - - [33708, 4030, 1, 1024]
    - [286, 9983.26]
  - - [1024, 3190, 1, 4096]
    - [307, 8192.01]
  - - [1024, 3389, 1, 4096]
    - [308, 8439.32]
  - - [1024, 3500, 1, 4096]
    - [306, 8556.02]
  - - [1024, 3471, 1, 4096]
    - [295, 8491.07]
  - - [1024, 3438, 1, 4096]
    - [308, 8567.85]
  - - [4096, 3513, 1, 1024]
    - [285, 9710.17]
  - - [1024, 3562, 1, 4096]
    - [300, 8608.84]
  - - [4096, 3616, 1, 1024]
    - [287, 9357.49]
  - - [4096, 3955, 1, 1024]
    - [286, 9589.61]
  - - [1024, 3441, 1, 4096]
    - [296, 8359.17]
  - - [1024, 3236, 1, 4096]
    - [310, 8022.5]
  - - [1024, 3524, 1, 4096]
    - [305, 8477.14]
  - - [4096, 3460, 1, 1024]
    - [285, 9581.86]
  - - [16, 16, 3840, 64]
    - [317, 1270.49]
  - - [92, 93, 688, 64]
    - [321, 4962.3]
  - - [1024, 3384, 1, 4096]
    - [296, 8409.29]
  - - [4096, 3387, 1, 1024]
    - [287, 9379.7]
  - - [4096, 3436, 1, 1024]
    - [285, 9491.83]
  - - [4096, 3277, 1, 1024]
    - [285, 9717.17]
  - - [1024, 3457, 1, 4096]
    - [305, 8279.12]
  - - [1024, 3999, 1, 4096]
    - [280, 9231.37]
  - - [1024, 4032, 1, 4096]
    - [289, 9443.52]
  - - [4096, 3541, 1, 1024]
    - [285, 9773.14]
  - - [4096, 3334, 1, 1024]
    - [285, 9242.69]
  - - [1024, 3393, 1, 4096]
    - [307, 8376.07]
  - - [17, 17, 3632, 64]
    - [329, 1425.67]
  - - [1024, 3411, 1, 4096]
    - [295, 8490.87]
  - - [1024, 3822, 1, 1024]
    - [292, 8773.34]
  - - [1024, 3593, 1, 4096]
    - [292, 8571.15]
  - - [33708, 3822, 1, 1024]
    - [286, 10056.7]
  - - [4096, 3504, 1, 1024]
    - [288, 9680.19]
  - - [1024, 3163, 1, 4096]
    - [307, 8014.33]
  - - [1024, 3357, 1, 4096]
    - [308, 8375.94]
  - - [1024, 3906, 1, 4096]
    - [289, 9108.12]
  - - [4096, 3415, 1, 1024]
    - [285, 9443.77]
  - - [1024, 3406, 1, 4096]
    - [308, 8451.54]
  - - [4096, 3321, 1, 1024]
    - [287, 9836.52]
  - - [4096, 3584, 1, 1024]
    - [288, 9915.83]
  - - [1024, 2736, 1, 4096]
    - [291, 8532.83]
  - - [1024, 3110, 1, 4096]
    - [308, 7889.19]
  - - [33708, 3999, 1, 1024]
    - [288, 9903.23]
  - - [1024, 3093, 1, 4096]
    - [306, 7919.25]
  - - [4096, 3378, 1, 1024]
    - [288, 9362.2]
  - - [1024, 3543, 1, 4096]
    - [302, 8438.06]
  - - [33708, 3925, 1, 1024]
    - [287, 10021.5]
  - - [1024, 3352, 1, 4096]
    - [308, 8333.72]
  - - [4096, 3780, 1, 1024]
    - [285, 9754.92]
  - - [1024, 3990, 1, 4096]
    - [282, 9250.92]
  - - [4096, 3500, 1, 1024]
    - [285, 9673.73]
  - - [4096, 3996, 1, 1024]
    - [286, 9694.4]
  - - [1024, 3247, 1, 4096]
    - [311, 8171.48]
  - - [4096, 3395, 1, 1024]
    - [287, 9391.94]
  - - [1024, 3169, 1, 4096]
    - [306, 7990.14]
  - - [1024, 3088, 1, 4096]
    - [306, 7890.26]
  - - [1024, 3584, 1, 4096]
    - [308, 8604.1]
  - - [4096, 3093, 1, 1024]
    - [287, 9224.78]
  - - [1024, 3538, 1, 4096]
    - [289, 8395.64]
  - - [1024, 3996, 1, 1024]
    - [290, 9208.23]
  - - [1024, 3581, 1, 4096]
    - [302, 8523.14]
  - - [4096, 3374, 1, 1024]
    - [287, 9342.71]
  - - [33708, 3751, 1, 1024]
    - [287, 9881.89]
  - - [59, 59, 1088, 64]
    - [325, 4515.44]
  - - [4096, 3215, 1, 1024]
    - [287, 9557.65]
  - - [4096, 3312, 1, 1024]
    - [285, 9834.3]
  - - [4096, 3581, 1, 1024]
    - [287, 9856.56]
  - - [4096, 3479, 1, 1024]
    - [287, 9620.25]
  - - [4096, 3544, 1, 1024]
    - [285, 9778.84]
  - - [1024, 3870, 1, 1024]
    - [290, 8935.16]
  - - [1024, 3374, 1, 4096]
    - [307, 8412.75]
  - - [1024, 2967, 1, 4096]
    - [290, 8982.87]
  - - [41, 41, 1552, 64]
    - [319, 2805.28]
  - - [4096, 3455, 1, 1024]
    - [285, 9538.79]
  - - [4096, 3942, 1, 1024]
    - [286, 9554.55]
  - - [1024, 3528, 1, 4096]
    - [305, 8438.37]
  - - [4096, 3186, 1, 1024]
    - [286, 9468.22]
  - - [1024, 3976, 1, 1024]
    - [290, 9166.98]
  - - [1024, 3511, 1, 4096]
    - [292, 8334.96]
  - - [4096, 3573, 1, 1024]
    - [285, 9855.23]
  - - [4096, 3561, 1, 1024]
    - [285, 9830.93]
  - - [4096, 3418, 1, 1024]
    - [286, 9450.58]
  - - [33708, 3906, 1, 1024]
    - [288, 9973.57]
  - - [4096, 3259, 1, 1024]
    - [285, 9685.16]
  - - [4096, 3308, 1, 1024]
    - [287, 9791.93]
  - - [1024, 3419, 1, 4096]
    - [307, 8514.43]
  - - [1024, 3215, 1, 4096]
    - [306, 8137.43]
  - - [1024, 4030, 1, 4096]
    - [288, 9290.66]
  - - [4096, 3459, 1, 1024]
    - [285, 9567.47]
  - - [1024, 3572, 1, 4096]
    - [305, 8501.33]
  - - [1024, 3137, 1, 4096]
    - [307, 7930.05]
  - - [1024, 3312, 1, 4096]
    - [308, 8378.5]
  - - [1024, 3925, 1, 4096]
    - [290, 9255.76]
  - - [1024, 3453, 1, 4096]
    - [307, 8630.66]
  - - [4096, 3435, 1, 1024]
    - [286, 9495.08]
  - - [1024, 3176, 1, 4096]
    - [307, 8087.13]
  - - [1024, 3444, 1, 4096]
    - [299, 8528.48]
  - - [4096, 3975, 1, 1024]
    - [288, 9645.24]
  - - [4096, 3182, 1, 1024]
    - [287, 9448.3]
  - - [1024, 3475, 1, 4096]
    - [306, 8404.77]
  - - [9, 9, 6544, 64]
    - [321, 425.754]
  - - [33708, 3955, 1, 1024]
    - [288, 10088.3]
  - - [4096, 3446, 1, 1024]
    - [287, 9519.96]
  - - [1024, 3138, 1, 4096]
    - [306, 8053.34]
  - - [1024, 3549, 1, 4096]
    - [292, 8426.32]
  - - [4096, 3287, 1, 1024]
    - [288, 9751.24]
  - - [1024, 3342, 1, 4096]
    - [305, 8319.91]
  - - [102, 102, 624, 64]
    - [320, 4747.42]
  - - [4096, 3519, 1, 1024]
    - [287, 9716.0]
  - - [4096, 3552, 1, 1024]
    - [285, 9806.59]
  - - [4096, 3859, 1, 1024]
    - [285, 9369.84]
  - - [33708, 3969, 1, 1024]
    - [285, 9830.29]
  - - [1024, 3369, 1, 4096]
    - [306, 8379.16]
  - - [4096, 3482, 1, 1024]
    - [285, 9631.6]
  - - [1024, 3306, 1, 4096]
    - [308, 8319.96]
  - - [1024, 3474, 1, 4096]
    - [307, 8498.8]
  - - [99, 99, 624, 64]
    - [319, 4492.8]
  - - [4096, 3377, 1, 1024]
    - [285, 9369.82]
  - - [4096, 3426, 1, 1024]
    - [285, 9467.2]
  - - [4096, 2935, 1, 1024]
    - [286, 9423.64]
  - - [4096, 3267, 1, 1024]
    - [285, 9697.94]
  - - [1024, 3299, 1, 4096]
    - [306, 8264.66]
  - - [1024, 3456, 1, 4096]
    - [305, 8678.29]
  - - [1024, 3280, 1, 4096]
    - [306, 8220.59]
  - - [1024, 3555, 1, 4096]
    - [305, 8656.17]
  - - [4096, 3499, 1, 1024]
    - [287, 9663.83]
  - - [4096, 3356, 1, 1024]
    - [287, 9296.8]
  - - [100, 102, 624, 64]
    - [320, 4671.41]
  - - [1024, 3412, 1, 4096]
    - [308, 8537.95]
  - - [1024, 2984, 1, 4096]
    - [291, 9193.07]
  - - [4096, 3141, 1, 1024]
    - [287, 9349.33]
  - - [4096, 3510, 1, 1024]
    - [285, 9701.88]
  - - [1024, 3995, 1, 1024]
    - [289, 9243.3]
  - - [1024, 3517, 1, 4096]
    - [307, 8569.21]
  - - [1024, 3455, 1, 4096]
    - [307, 8560.57]
  - - [1024, 3939, 1, 1024]
    - [290, 9030.84]
  - - [38, 38, 1680, 64]
    - [319, 2459.74]
  - - [1024, 3447, 1, 4096]
    - [305, 8609.92]
  - - [1024, 3969, 1, 4096]
    - [292, 9097.23]
  - - [4096, 3527, 1, 1024]
    - [287, 9743.73]
  - - [4096, 3336, 1, 1024]
    - [287, 9248.23]
  - - [1024, 3191, 1, 4096]
    - [305, 8104.86]
  - - [1024, 3302, 1, 4096]
    - [306, 8244.99]
  - - [1024, 3337, 1, 4096]
    - [308, 8254.15]
  - - [4096, 3290, 1, 1024]
    - [287, 9759.03]
  - - [1024, 3512, 1, 4096]
    - [296, 8640.96]
  - - [1024, 3433, 1, 4096]
    - [306, 8444.6]
  - - [4096, 3876, 1, 1024]
    - [286, 9420.28]
  - - [4096, 3490, 1, 1024]
    - [287, 9641.01]
  - - [4096, 3064, 1, 1024]
    - [287, 9820.39]
  - - [1024, 3508, 1, 4096]
    - [302, 8442.14]
  - - [1024, 3956, 1, 4096]
    - [287, 9128.09]
  - - [4096, 3417, 1, 1024]
    - [287, 9448.31]
  - - [1024, 3248, 1, 4096]
    - [306, 8006.06]
  - - [1024, 2499, 1, 4096]
    - [306, 8155.09]
  - - [1024, 3186, 1, 4096]
    - [306, 8092.94]
  - - [1024, 3180, 1, 4096]
    - [308, 8096.92]
  - - [4096, 3364, 1, 1024]
    - [287, 9317.98]
  - - [4096, 3976, 1, 1024]
    - [287, 9654.37]
  - - [4096, 3205, 1, 1024]
    - [288, 9538.74]
  - - [4096, 3318, 1, 1024]
    - [285, 9838.19]
  - - [1024, 3377, 1, 4096]
    - [308, 8445.54]
  - - [1024, 3485, 1, 4096]
    - [305, 8368.73]
  - - [4096, 3181, 1, 1024]
    - [288, 9458.19]
  - - [4096, 3550, 1, 1024]
    - [285, 9783.04]
  - - [1024, 3534, 1, 4096]
    - [294, 8684.89]
  - - [1024, 3860, 1, 1024]
    - [289, 8923.08]
  - - [160, 160, 400, 64]
    - [332, 5797.59]
  - - [4096, 3445, 1, 1024]
    - [287, 9511.18]
  - - [1024, 3391, 1, 4096]
    - [308, 8541.67]
  - - [1024, 3221, 1, 4096]
    - [306, 8055.4]
  - - [4096, 3079, 1, 1024]
    - [285, 9180.94]
  - - [4096, 3144, 1, 1024]
    - [287, 9351.35]
  - - [1024, 3270, 1, 4096]
    - [307, 8367.53]
  - - [1024, 3561, 1, 4096]
    - [307, 8426.19]
  - - [1024, 3480, 1, 4096]
    - [294, 8464.9]
  - - [4096, 3408, 1, 1024]
    - [287, 9419.94]
  - - [1024, 3418, 1, 4096]
    - [308, 8480.92]
  - - [4096, 3298, 1, 1024]
    - [288, 9788.3]
  - - [1024, 3640, 1, 1024]
    - [291, 8435.34]
  - - [1024, 3449, 1, 4096]
    - [306, 8590.77]
  - - [1024, 4020, 1, 4096]
    - [284, 9168.03]
  - - [4096, 3481, 1, 1024]
    - [285, 9627.81]
  - - [4096, 3530, 1, 1024]
    - [287, 9734.58]
  - - [1024, 3216, 1, 4096]
    - [308, 8014.22]
  - - [1024, 3840, 1, 1024]
    - [291, 8908.27]
  - - [1024, 3491, 1, 4096]
    - [294, 8410.49]
  - - [1024, 3154, 1, 4096]
    - [307, 8095.59]
  - - [4096, 3425, 1, 1024]
    - [287, 9474.43]
  - - [1024, 3348, 1, 4096]
    - [305, 8202.8]
  - - [1024, 3415, 1, 4096]
    - [306, 8597.58]
  - - [1024, 4026, 1, 1024]
    - [289, 9278.99]
  - - [1024, 3367, 1, 4096]
    - [308, 8335.44]
  - - [1024, 3259, 1, 4096]
    - [308, 8285.2]
  - - [1024, 3894, 1, 4096]
    - [291, 9040.34]
  - - [4096, 3355, 1, 1024]
    - [286, 9291.57]
  - - [4096, 3404, 1, 1024]
    - [287, 9410.37]
  - - [1024, 3308, 1, 4096]
    - [308, 8336.2]
  - - [4096, 3245, 1, 1024]
    - [286, 9641.37]
  - - [1024, 3502, 1, 4096]
    - [307, 8375.8]
  - - [33708, 4032, 1, 1024]
    - [286, 9988.1]
  - - [8, 8, 7280, 64]
    - [323, 339.778]
  - - [1024, 3424, 1, 4096]
    - [294, 8489.38]
  - - [4096, 3509, 1, 1024]
    - [286, 9702.19]
  - - [4096, 3558, 1, 1024]
    - [287, 9815.41]
  - - [1024, 3900, 1, 1024]
    - [290, 9013.95]
  - - [1024, 2505, 1, 4096]
    - [304, 8263.65]
  - - [4096, 3472, 1, 1024]
    - [285, 9609.51]
  - - [1024, 3386, 1, 4096]
    - [305, 8417.45]
  - - [4096, 3383, 1, 1024]
    - [287, 9364.67]
  - - [4096, 3448, 1, 1024]
    - [288, 9520.97]
  - - [4096, 4030, 1, 1024]
    - [288, 9771.46]
  - - [4096, 3289, 1, 1024]
    - [285, 9757.17]
  - - [1024, 3459, 1, 4096]
    - [307, 8422.02]
  - - [1024, 2918, 1, 4096]
    - [292, 9022.61]
  - - [4096, 3489, 1, 1024]
    - [285, 9641.8]
  - - [4096, 3346, 1, 1024]
    - [287, 9271.55]
  - - [4096, 3572, 1, 1024]
    - [287, 9829.72]
  - - [1024, 3955, 1, 4096]
    - [288, 9221.56]
  - - [4096, 3236, 1, 1024]
    - [285, 9620.62]
  - - [4096, 3163, 1, 1024]
    - [285, 9397.2]
  - - [4096, 3468, 1, 1024]
    - [285, 9601.48]
  - - [1024, 3165, 1, 4096]
    - [307, 7941.48]
  - - [1024, 3276, 1, 4096]
    - [307, 8244.86]
  - - [1024, 3359, 1, 4096]
    - [305, 8273.83]
  - - [4096, 3363, 1, 1024]
    - [287, 9315.7]
  - - [1024, 3385, 1, 4096]
    - [299, 8286.1]
  - - [1024, 3207, 1, 4096]
    - [308, 8143.92]
  - - [1024, 3458, 1, 4096]
    - [307, 8472.31]
  - - [21, 21, 2976, 64]
    - [323, 2083.2]
  - - [4096, 3110, 1, 1024]
    - [285, 9260.2]
  - - [4096, 3925, 1, 1024]
    - [288, 9526.56]
  - - [1024, 3975, 1, 4096]
    - [283, 9133.74]
  - - [4096, 3549, 1, 1024]
    - [287, 9793.67]
  - - [4096, 3342, 1, 1024]
    - [286, 9264.38]
  - - [1024, 3859, 1, 1024]
    - [289, 8933.37]
  - - [1024, 3497, 1, 4096]
    - [306, 8526.03]
  - - [4096, 3280, 1, 1024]
    - [287, 9733.22]
  - - [1024, 3435, 1, 4096]
    - [306, 8489.75]
  - - [1024, 3354, 1, 4096]
    - [306, 8248.73]
  - - [4096, 3191, 1, 1024]
    - [286, 9475.02]
  - - [4096, 3512, 1, 1024]
    - [285, 9701.27]
  - - [1024, 3055, 1, 4096]
    - [292, 9264.81]
  - - [4096, 2499, 1, 1024]
    - [287, 9573.96]
  - - [1024, 3233, 1, 4096]
    - [305, 8101.64]
  - - [4096, 3423, 1, 1024]
    - [288, 9463.4]
  - - [1024, 3319, 1, 4096]
    - [308, 8413.66]
  - - [4096, 3297, 1, 1024]
    - [285, 9782.56]
  - - [4096, 3154, 1, 1024]
    - [287, 9381.1]
  - - [1024, 3540, 1, 4096]
    - [308, 8507.43]
  - - [1024, 3289, 1, 4096]
    - [308, 8233.7]
  - - [4096, 3529, 1, 1024]
    - [287, 9741.05]
  - - [4096, 3386, 1, 1024]
    - [287, 9372.47]
  - - [4096, 3276, 1, 1024]
    - [285, 9713.66]
  - - [1024, 3244, 1, 4096]
    - [308, 8146.73]
  - - [1024, 3182, 1, 4096]
    - [305, 8115.02]
  - - [4096, 3540, 1, 1024]
    - [285, 9768.32]
  - - [1024, 3360, 1, 4096]
    - [307, 8353.21]
  - - [1024, 3942, 1, 4096]
    - [286, 9143.68]
  - - [4096, 3403, 1, 1024]
    - [288, 9412.08]
  - - [4096, 3101, 1, 1024]
    - [288, 9239.18]
  - - [4096, 2918, 1, 1024]
    - [287, 9373.65]
  - - [1024, 3465, 1, 4096]
    - [308, 8288.06]
  - - [33708, 3780, 1, 1024]
    - [287, 9971.81]
  - - [4096, 3557, 1, 1024]
    - [285, 9814.72]
  - - [4096, 3414, 1, 1024]
    - [285, 9436.53]
  - - [1024, 3948, 1, 1024]
    - [289, 9073.7]
  - - [4096, 3320, 1, 1024]
    - [287, 9834.67]
  - - [4096, 2765, 1, 1024]
    - [287, 9666.96]
  - - [1024, 3978, 1, 4096]
    - [282, 9109.5]
  - - [4096, 3487, 1, 1024]
    - [285, 9643.9]
  - - [4096, 3520, 1, 1024]
    - [287, 9727.98]
  - - [1024, 3139, 1, 4096]
    - [307, 7940.09]
  - - [1024, 3314, 1, 4096]
    - [305, 8293.91]
  - - [4096, 3431, 1, 1024]
    - [287, 9482.02]
  - - [123, 122, 528, 64]
    - [320, 6325.88]
  - - [1024, 3446, 1, 4096]
    - [301, 8468.24]
  - - [1024, 4059, 1, 4096]
    - [288, 9370.7]
  - - [99, 102, 624, 64]
    - [320, 4624.7]
  - - [4096, 3345, 1, 1024]
    - [285, 9271.22]
  - - [4096, 3394, 1, 1024]
    - [285, 9398.09]
  - - [1024, 3927, 1, 1024]
    - [290, 9041.28]
  - - [4096, 3235, 1, 1024]
    - [285, 9619.83]
  - - [1024, 3328, 1, 4096]
    - [306, 8405.99]
  - - [33708, 3956, 1, 1024]
    - [286, 10100.3]
  - - [4096, 3467, 1, 1024]
    - [287, 9586.56]
  - - [1024, 3287, 1, 4096]
    - [307, 8273.73]
  - - [4096, 3214, 1, 1024]
    - [288, 9557.39]
  - - [4096, 3910, 1, 1024]
    - [285, 9490.15]
  - - [1024, 3780, 1, 1024]
    - [292, 8705.9]
  - - [1024, 3371, 1, 4096]
    - [308, 8248.36]
  - - [4096, 3478, 1, 1024]
    - [288, 9619.52]
  - - [1024, 3546, 1, 4096]
    - [306, 8456.73]
  - - [1024, 4012, 1, 1024]
    - [289, 9253.24]
  - - [4096, 3341, 1, 1024]
    - [287, 9260.14]
  - - [4096, 3454, 1, 1024]
    - [285, 9533.52]
  - - [4096, 3295, 1, 1024]
    - [288, 9772.76]
  - - [4096, 3072, 1, 1024]
    - [285, 9887.13]
  - - [1024, 3282, 1, 4096]
    - [293, 8112.75]
  - - [33708, 3720, 1, 1024]
    - [288, 9818.75]
  - - [1024, 3681, 1, 4096]
    - [290, 8639.18]
  - - [1024, 4050, 1, 4096]
    - [288, 9291.83]
  - - [4096, 3495, 1, 1024]
    - [287, 9660.42]
  - - [4096, 3560, 1, 1024]
    - [286, 9813.7]
  - - [4096, 3751, 1, 1024]
    - [285, 9684.85]
  - - [1024, 3414, 1, 4096]
    - [306, 8555.62]
  - - [33708, 3860, 1, 1024]
    - [285, 9856.58]
  - - [1024, 3325, 1, 4096]
    - [295, 8261.11]
  - - [4096, 3458, 1, 1024]
    - [285, 9570.76]
  - - [4096, 2967, 1, 1024]
    - [285, 9544.51]
  - - [1024, 3519, 1, 4096]
    - [308, 8413.0]
  - - [4096, 3385, 1, 1024]
    - [287, 9367.24]
  - - [4096, 3434, 1, 1024]
    - [285, 9488.31]
  - - [1024, 3552, 1, 4096]
    - [306, 8456.03]
  - - [4096, 3822, 1, 1024]
    - [286, 9849.74]
  - - [1024, 3544, 1, 4096]
    - [305, 8494.46]
  - - [4096, 3539, 1, 1024]
    - [287, 9762.99]
  - - [4096, 3332, 1, 1024]
    - [285, 9232.26]
  - - [1024, 3145, 1, 4096]
    - [305, 8098.26]
  - - [1024, 3535, 1, 4096]
    - [293, 8592.7]
  - - [1024, 3320, 1, 4096]
    - [306, 8419.45]
  - - [33708, 4012, 1, 1024]
    - [288, 9940.1]
  - - [4096, 3286, 1, 1024]
    - [287, 9747.72]
  - - [1024, 3514, 1, 4096]
    - [306, 8653.59]
  - - [93, 93, 688, 64]
    - [327, 5005.69]
  - - [1024, 2765, 1, 4096]
    - [292, 8636.62]
  - - [1024, 3452, 1, 4096]
    - [305, 8445.77]
  - - [4096, 3518, 1, 1024]
    - [285, 9722.46]
  - - [1024, 3529, 1, 4096]
    - [305, 8444.22]
  - - [4096, 3413, 1, 1024]
    - [285, 9436.25]
  - - [33708, 4050, 1, 1024]
    - [287, 10026.6]
  - - [1024, 3525, 1, 4096]
    - [298, 8488.89]
  - - [4096, 3303, 1, 1024]
    - [285, 9790.95]
  - - [1024, 3382, 1, 4096]
    - [306, 8483.53]
  - - [1024, 3390, 1, 4096]
    - [305, 8552.71]
  - - [1024, 3977, 1, 4096]
    - [287, 9053.43]
  - - [1024, 3184, 1, 4096]
    - [305, 8008.71]
  - - [4096, 3535, 1, 1024]
    - [287, 9760.69]
  - - [4096, 3376, 1, 1024]
    - [288, 9341.83]
  - - [4096, 3978, 1, 1024]
    - [288, 9642.7]
  - - [1024, 3136, 1, 4096]
    - [307, 8085.02]
  - - [1024, 3293, 1, 4096]
    - [305, 8300.39]
  - - [4096, 3266, 1, 1024]
    - [286, 9691.68]
  - - [1024, 3487, 1, 4096]
    - [305, 8383.52]
  - - [1024, 3409, 1, 4096]
    - [307, 8493.15]
  - - [4096, 3498, 1, 1024]
    - [286, 9672.28]
  - - [1024, 3520, 1, 4096]
    - [308, 8488.16]
  - - [1024, 3530, 1, 4096]
    - [289, 8409.77]
  - - [4096, 3393, 1, 1024]
    - [287, 9395.33]
  - - [4096, 3140, 1, 1024]
    - [287, 9338.4]
  - - [1024, 3536, 1, 4096]
    - [308, 8642.01]
  - - [1024, 3288, 1, 4096]
    - [308, 8229.24]
  - - [1024, 4005, 1, 4096]
    - [290, 9270.94]
  - - [1024, 3579, 1, 4096]
    - [294, 8844.4]
  - - [4096, 3372, 1, 1024]
    - [285, 9339.15]
  - - [1024, 3440, 1, 4096]
    - [305, 8466.59]
  - - [4096, 3213, 1, 1024]
    - [288, 9558.75]
  - - [123, 123, 528, 64]
    - [320, 6333.49]
  - - [100, 100, 624, 64]
    - [319, 4584.02]
  - - [1024, 3968, 1, 4096]
    - [286, 9237.5]
  - - [4096, 3477, 1, 1024]
    - [286, 9618.78]
  - - [4096, 3526, 1, 1024]
    - [285, 9735.84]
  - - [1024, 3493, 1, 4096]
    - [306, 8355.03]
  - - [1024, 3944, 1, 4096]
    - [281, 9065.29]
  - - [4096, 3453, 1, 1024]
    - [286, 9533.27]
  - - [1024, 3350, 1, 4096]
    - [308, 8448.54]
  - - [4096, 3184, 1, 1024]
    - [287, 9447.28]
  - - [1024, 3423, 1, 4096]
    - [306, 8465.28]
  - - [4096, 3351, 1, 1024]
    - [285, 9281.96]
  - - [4096, 3416, 1, 1024]
    - [285, 9446.54]
  - - [1024, 3796, 1, 4096]
    - [287, 8820.24]
  - - [4096, 3257, 1, 1024]
    - [285, 9671.54]
  - - [4096, 3306, 1, 1024]
    - [287, 9795.41]
  - - [33708, 4020, 1, 1024]
    - [287, 9961.75]
  - - [19, 19, 3264, 64]
    - [317, 1735.99]
  - - [1024, 3426, 1, 4096]
    - [305, 8518.51]
  - - [4096, 3457, 1, 1024]
    - [285, 9564.46]
  - - [1024, 2935, 1, 4096]
    - [290, 9067.69]
  - - [1024, 3046, 1, 4096]
    - [290, 9242.87]
  - - [4096, 3433, 1, 1024]
    - [287, 9495.55]
  - - [1024, 3256, 1, 4096]
    - [308, 8224.13]
  - - [1024, 3531, 1, 4096]
    - [305, 8524.09]
  - - [4096, 3180, 1, 1024]
    - [285, 9443.43]
  - - [1024, 3388, 1, 4096]
    - [307, 8352.72]
  - - [4096, 3444, 1, 1024]
    - [288, 9510.93]
  - - [1024, 3501, 1, 4096]
    - [295, 8461.02]
  - - [1024, 3266, 1, 4096]
    - [293, 8147.34]
  - - [1024, 3267, 1, 4096]
    - [308, 8391.39]
  - - [1024, 3461, 1, 4096]
    - [292, 8270.19]
  - - [4096, 3870, 1, 1024]
    - [287, 9399.59]
  - - [4096, 3517, 1, 1024]
    - [285, 9725.33]
  - - [1024, 3566, 1, 4096]
    - [308, 8669.66]
  - - [4096, 3574, 1, 1024]
    - [285, 9844.53]
  - - [1024, 3876, 1, 1024]
    - [290, 8961.64]
  - - [25, 25, 2512, 64]
    - [316, 2472.44]
  - - [4096, 3720, 1, 1024]
    - [285, 9612.39]
  - - [4096, 3248, 1, 1024]
    - [287, 9644.82]
  - - [4096, 4059, 1, 1024]
    - [285, 9826.32]
  - - [1024, 3380, 1, 4096]
    - [306, 8677.81]
  - - [4096, 3480, 1, 1024]
    - [287, 9626.06]
  - - [1024, 3335, 1, 4096]
    - [307, 8302.08]
  - - [1024, 3345, 1, 4096]
    - [307, 8323.03]
  - - [4096, 3391, 1, 1024]
    - [285, 9379.38]
  - - [4096, 3424, 1, 1024]
    - [287, 9466.67]
  - - [1024, 3394, 1, 4096]
    - [293, 8373.81]
  - - [4096, 3265, 1, 1024]
    - [287, 9700.79]
  - - [1024, 3014, 1, 4096]
    - [290, 9302.99]
  - - [4096, 3497, 1, 1024]
    - [285, 9668.5]
  - - [4096, 3354, 1, 1024]
    - [287, 9294.21]
  - - [4096, 3055, 1, 1024]
    - [286, 9780.78]
  - - [1024, 3499, 1, 4096]
    - [299, 8526.94]
  - - [1024, 3162, 1, 4096]
    - [307, 8058.92]
  - - [4096, 3244, 1, 1024]
    - [287, 9636.76]
  - - [1024, 3437, 1, 4096]
    - [306, 8583.31]
  - - [1024, 3356, 1, 4096]
    - [308, 8296.85]
  - - [4096, 3139, 1, 1024]
    - [287, 9338.6]
  - - [4096, 3508, 1, 1024]
    - [287, 9700.44]
  - - [1024, 3235, 1, 4096]
    - [305, 8314.49]
  - - [1024, 3910, 1, 4096]
    - [292, 9200.11]
  - - [4096, 3371, 1, 1024]
    - [285, 9336.87]
  - - [1024, 3751, 1, 4096]
    - [292, 8827.57]
  - - [4096, 3325, 1, 1024]
    - [285, 9845.58]
  - - [1024, 3413, 1, 4096]
    - [293, 8345.68]
  - - [1024, 3542, 1, 4096]
    - [305, 8521.61]
  - - [18, 18, 3440, 64]
    - [321, 1578.14]
  - - [101, 102, 624, 64]
    - [319, 4705.18]
  - - [33708, 3900, 1, 1024]
    - [285, 9950.95]
  - - [4096, 3525, 1, 1024]
    - [286, 9744.37]
  - - [4096, 3382, 1, 1024]
    - [286, 9358.93]
  - - [102, 100, 624, 64]
    - [320, 4671.41]
  - - [15, 15, 4096, 64]
    - [324, 1129.07]
  - - [1024, 3339, 1, 4096]
    - [294, 8326.27]
  - - [4096, 3288, 1, 1024]
    - [287, 9761.38]
  - - [92, 92, 688, 64]
    - [327, 4903.77]
  - - [1024, 3141, 1, 4096]
    - [305, 7975.54]
  - - [1024, 3168, 1, 4096]
    - [305, 8083.64]
  - - [4096, 3488, 1, 1024]
    - [287, 9646.67]
  - - [4096, 3046, 1, 1024]
    - [286, 9767.48]
  - - [1024, 3362, 1, 4096]
    - [308, 8458.05]
  - - [33708, 3942, 1, 1024]
    - [286, 10060.3]
  - - [4096, 3399, 1, 1024]
    - [287, 9406.47]
  - - [1024, 3720, 1, 1024]
    - [289, 8639.06]
  - - [4096, 3563, 1, 1024]
    - [285, 9836.45]
  - - [1024, 3273, 1, 4096]
    - [308, 8221.52]
  - - [4096, 3162, 1, 1024]
    - [287, 9400.09]
  - - [1024, 3467, 1, 4096]
    - [306, 8342.32]
  - - [1024, 3130, 1, 4096]
    - [307, 7933.78]
  - - [1024, 3405, 1, 4096]
    - [314, 8406.49]
  - - [4096, 3362, 1, 1024]
    - [285, 9311.94]
  - - [1024, 3960, 1, 1024]
    - [289, 9082.16]
  - - [2048, 128, 1, 4096]
    - [339, 5986.52]
  - - [1024, 3712, 1, 36548]
    - [337, 9456.15]
  - - [1024, 128, 1, 1024]
    - [340, 3631.43]
  - - [3072, 128, 1, 4096]
    - [336, 6145.5]
  - - [1024, 3712, 1, 1024]
    - [338, 8933.88]
  - - [1024, 128, 1, 128]
    - [353, 896.319]
  - - [4, 704, 1, 1280]
    - [390, 328.976]
  - - [4, 1856, 1, 3328]
    - [400, 501.461]
  - - [1856, 448, 1, 3328]
    - [445, 5678.01]
  - - [2944, 4288, 1, 1280]
    - [431, 8412.49]
  - - [2368, 64, 1, 3328]
    - [381, 4914.02]
  - - [1760, 32, 1, 1760]
    - [408, 3313.04]
  - - [2368, 5888, 1, 256]
    - [431, 6489.82]
  - - [5888, 1856, 1, 256]
    - [443, 7791.98]
  - - [128, 64, 1, 256]
    - [415, 369.317]
  - - [512, 24000, 1, 1536]
    - [437, 8827.47]
  - - [128, 6784, 1, 3328]
    - [437, 6537.09]
  - - [5888, 1408, 1, 256]
    - [451, 6129.71]
  - - [5888, 1856, 1, 3328]
    - [437, 7969.27]
  - - [5056, 704, 1, 256]
    - [437, 6723.92]
  - - [2048, 400, 1, 512]
    - [443, 4531.54]
  - - [5888, 2944, 1, 3328]
    - [443, 8608.14]
  - - [1856, 4288, 1, 256]
    - [443, 6297.64]
  - - [1024, 5056, 1, 128]
    - [421, 3595.47]
  - - [5056, 5056, 1, 3328]
    - [437, 8559.26]
  - - [1408, 5888, 1, 1280]
    - [432, 6797.16]
  - - [2368, 448, 1, 128]
    - [421, 2815.0]
  - - [2368, 6784, 1, 128]
    - [425, 4782.08]
  - - [1024, 3584, 1, 3328]
    - [433, 8402.54]
  - - [512, 48000, 1, 2048]
    - [437, 8162.33]
  - - [128, 448, 1, 1280]
    - [408, 2903.59]
  - - [256, 4288, 1, 3328]
    - [438, 6346.04]
  - - [5888, 1408, 1, 1280]
    - [437, 8959.55]
  - - [704, 1856, 1, 3328]
    - [432, 6955.37]
  - - [4, 1408, 1, 128]
    - [452, 60.1747]
  - - [1024, 2368, 1, 256]
    - [439, 5927.88]
  - - [64, 4, 1, 256]
    - [457, 13.3129]
  - - [1408, 1856, 1, 1280]
    - [435, 8051.68]
  - - [1408, 64, 1, 1280]
    - [411, 3400.55]
  - - [448, 1024, 1, 1280]
    - [439, 5730.02]
  - - [6144, 24000, 1, 2048]
    - [443, 7738.4]
  - - [4096, 32, 1, 4096]
    - [381, 2381.53]
  - - [256, 1408, 1, 3328]
    - [439, 4844.88]
  - - [5056, 5056, 1, 1280]
    - [443, 9090.2]
  - - [448, 5056, 1, 256]
    - [449, 4961.28]
  - - [704, 1856, 1, 1280]
    - [435, 6456.54]
  - - [128, 5056, 1, 128]
    - [364, 2251.12]
  - - [2368, 128, 1, 256]
    - [432, 3403.37]
  - - [1760, 6400, 1, 1760]
    - [431, 8959.8]
  - - [1856, 1408, 1, 128]
    - [424, 3493.16]
  - - [64, 5056, 1, 256]
    - [433, 2582.32]
  - - [6784, 256, 1, 3328]
    - [431, 7323.64]
  - - [6784, 4288, 1, 3328]
    - [433, 8542.19]
  - - [4288, 448, 1, 256]
    - [449, 5030.6]
  - - [64, 704, 1, 128]
    - [366, 375.567]
  - - [1856, 2368, 1, 3328]
    - [442, 6742.44]
  - - [4288, 2944, 1, 1280]
    - [443, 8578.27]
  - - [704, 5056, 1, 1280]
    - [439, 8014.55]
  - - [2368, 704, 1, 3328]
    - [438, 6544.41]
  - - [256, 5888, 1, 256]
    - [436, 5933.0]
  - - [1856, 4288, 1, 3328]
    - [442, 7410.82]
  - - [256, 2944, 1, 256]
    - [438, 5014.08]
  - - [5888, 1024, 1, 256]
    - [443, 8069.44]
  - - [448, 64, 1, 1280]
    - [418, 2057.28]
  - - [3072, 64, 1, 1024]
    - [398, 2145.52]
  - - [3584, 4, 1, 1280]
    - [390, 498.743]
  - - [16384, 3200, 1, 4096]
    - [430, 6621.53]
  - - [2944, 64, 1, 256]
    - [438, 2554.89]
  - - [128, 4, 1, 1280]
    - [400, 87.2489]
  - - [1408, 2944, 1, 256]
    - [437, 8029.45]
  - - [256, 1856, 1, 1280]
    - [432, 6170.7]
  - - [6784, 5056, 1, 3328]
    - [441, 7134.29]
  - - [5056, 5056, 1, 256]
    - [449, 6246.9]
  - - [1408, 6784, 1, 128]
    - [426, 4329.55]
  - - [64, 1024, 1, 1280]
    - [408, 3206.75]
  - - [2944, 4, 1, 256]
    - [457, 333.58]
  - - [704, 5056, 1, 128]
    - [421, 4085.52]
  - - [4, 2368, 1, 1280]
    - [458, 394.767]
  - - [2368, 2944, 1, 1280]
    - [437, 8634.05]
  - - [128, 3584, 1, 1280]
    - [438, 6046.25]
  - - [6784, 6784, 1, 1280]
    - [443, 8847.51]
  - - [1408, 4288, 1, 1280]
    - [443, 8236.79]
  - - [3584, 4288, 1, 1280]
    - [438, 7399.98]
  - - [2368, 704, 1, 1280]
    - [431, 6754.5]
  - - [5056, 4288, 1, 3328]
    - [437, 8569.63]
  - - [3584, 2368, 1, 3328]
    - [442, 7942.48]
  - - [64, 704, 1, 1280]
    - [411, 2363.69]
  - - [4288, 256, 1, 256]
    - [439, 4591.9]
  - - [2944, 128, 1, 128]
    - [364, 1878.39]
  - - [6144, 32, 1, 2560]
    - [409, 3334.2]
  - - [6784, 448, 1, 1280]
    - [441, 7939.3]
  - - [1408, 2944, 1, 128]
    - [425, 4096.61]
  - - [4288, 2944, 1, 256]
    - [431, 8141.23]
  - - [5888, 704, 1, 1280]
    - [432, 7516.23]
  - - [5056, 4, 1, 3328]
    - [375, 552.509]
  - - [1856, 64, 1, 1280]
    - [381, 3870.86]
  - - [1760, 16, 1, 1760]
    - [393, 2181.51]
  - - [448, 5888, 1, 128]
    - [426, 3371.1]
  - - [5888, 64, 1, 3328]
    - [406, 5319.48]
  - - [2944, 256, 1, 3328]
    - [438, 7122.4]
  - - [1024, 64, 1, 128]
    - [353, 595.882]
  - - [5056, 2368, 1, 1280]
    - [432, 7778.29]
  - - [448, 3584, 1, 1280]
    - [437, 6500.62]
  - - [6784, 5888, 1, 256]
    - [437, 8918.68]
  - - [704, 1024, 1, 128]
    - [421, 2627.51]
  - - [704, 128, 1, 1280]
    - [408, 3408.59]
  - - [4, 3584, 1, 128]
    - [452, 140.821]
  - - [1408, 448, 1, 1280]
    - [432, 5881.54]
  - - [1024, 1408, 1, 256]
    - [436, 5647.27]
  - - [2368, 2368, 1, 3328]
    - [430, 7688.83]
  - - [1856, 6784, 1, 128]
    - [421, 4705.95]
  - - [5056, 704, 1, 3328]
    - [441, 8198.98]
  - - [1408, 1856, 1, 256]
    - [443, 6340.05]
  - - [1408, 704, 1, 3328]
    - [435, 7599.65]
  - - [2368, 5056, 1, 256]
    - [443, 8242.85]
  - - [1408, 256, 1, 1280]
    - [438, 4879.26]
  - - [3072, 128, 1, 1024]
    - [407, 2525.52]
  - - [3584, 2368, 1, 1280]
    - [439, 8132.72]
  - - [4288, 64, 1, 3328]
    - [394, 5156.53]
  - - [2368, 4, 1, 1280]
    - [456, 482.75]
  - - [704, 5888, 1, 256]
    - [446, 5398.75]
  - - [6784, 2944, 1, 128]
    - [422, 4748.99]
  - - [2560, 1600, 1, 2560]
    - [433, 7355.0]
  - - [4288, 6784, 1, 3328]
    - [430, 7409.41]
  - - [2944, 256, 1, 256]
    - [438, 5077.42]
  - - [2944, 6784, 1, 3328]
    - [443, 8068.05]
  - - [704, 1408, 1, 3328]
    - [438, 7239.43]
  - - [6144, 5984, 1, 2048]
    - [437, 7176.07]
  - - [3584, 704, 1, 3328]
    - [443, 6642.86]
  - - [2944, 256, 1, 128]
    - [422, 2644.54]
  - - [6784, 4, 1, 1280]
    - [454, 402.487]
  - - [1024, 64, 1, 1280]
    - [408, 2602.03]
  - - [2048, 1600, 1, 512]
    - [435, 5592.5]
  - - [448, 4288, 1, 256]
    - [433, 6128.99]
  - - [64, 3584, 1, 3328]
    - [374, 5534.93]
  - - [1856, 4288, 1, 128]
    - [424, 4400.11]
  - - [704, 2368, 1, 1280]
    - [449, 5735.02]
  - - [1856, 2368, 1, 1280]
    - [446, 6482.4]
  - - [2368, 128, 1, 3328]
    - [419, 4717.32]
  - - [2944, 128, 1, 256]
    - [446, 3276.9]
  - - [448, 1408, 1, 256]
    - [438, 4852.28]
  - - [1856, 4288, 1, 1280]
    - [433, 8132.96]
  - - [64, 5056, 1, 3328]
    - [409, 5097.06]
  - - [4, 704, 1, 256]
    - [456, 128.831]
  - - [1024, 448, 1, 128]
    - [421, 1816.94]
  - - [704, 4, 1, 1280]
    - [457, 328.976]
  - - [704, 256, 1, 128]
    - [425, 876.569]
  - - [704, 2944, 1, 128]
    - [425, 3734.47]
  - - [1408, 1024, 1, 1280]
    - [433, 7224.85]
  - - [704, 6784, 1, 256]
    - [437, 7354.77]
  - - [6784, 704, 1, 256]
    - [433, 6012.28]
  - - [5056, 1408, 1, 128]
    - [426, 4311.28]
  - - [2048, 7000, 1, 2048]
    - [437, 7232.07]
  - - [256, 3584, 1, 3328]
    - [441, 7006.0]
  - - [4, 5888, 1, 3328]
    - [459, 534.612]
  - - [128, 1408, 1, 128]
    - [351, 1177.07]
  - - [3584, 4288, 1, 3328]
    - [443, 7135.0]
  - - [5888, 1856, 1, 1280]
    - [431, 8395.03]
  - - [256, 1408, 1, 256]
    - [432, 3977.46]
  - - [5056, 64, 1, 1280]
    - [432, 4257.78]
  - - [1024, 704, 1, 256]
    - [432, 5036.93]
  - - [448, 128, 1, 128]
    - [353, 533.533]
  - - [2368, 3584, 1, 1280]
    - [437, 8272.43]
  - - [2368, 6784, 1, 1280]
    - [430, 8288.24]
  - - [1856, 4, 1, 1280]
    - [370, 464.1]
  - - [448, 448, 1, 256]
    - [432, 3058.45]
  - - [2944, 3584, 1, 3328]
    - [437, 8557.63]
  - - [7680, 32, 1, 2560]
    - [409, 3729.03]
  - - [128, 4288, 1, 128]
    - [352, 2116.2]
  - - [256, 256, 1, 3328]
    - [408, 4051.06]
  - - [128, 1024, 1, 3328]
    - [381, 5139.21]
  - - [4, 1408, 1, 3328]
    - [400, 502.871]
  - - [6784, 2944, 1, 256]
    - [431, 8446.06]
  - - [64, 1856, 1, 1280]
    - [373, 3870.86]
  - - [6784, 64, 1, 128]
    - [421, 1877.62]
  - - [4288, 2368, 1, 3328]
    - [441, 8419.4]
  - - [1856, 2368, 1, 256]
    - [435, 6887.48]
  - - [3584, 256, 1, 128]
    - [425, 2496.71]
  - - [3584, 6784, 1, 3328]
    - [437, 7626.18]
  - - [256, 1024, 1, 256]
    - [438, 3095.53]
  - - [4, 6784, 1, 3328]
    - [400, 589.274]
  - - [1024, 5888, 1, 3328]
    - [437, 7794.35]
  - - [1024, 128, 1, 1280]
    - [410, 3130.18]
  - - [3072, 32, 1, 1024]
    - [397, 1675.59]
  - - [6144, 24000, 1, 2560]
    - [437, 7256.14]
  - - [5056, 4288, 1, 1280]
    - [435, 8349.03]
  - - [5888, 64, 1, 256]
    - [384, 2593.35]
  - - [6784, 1856, 1, 3328]
    - [431, 8087.38]
  - - [1408, 5056, 1, 1280]
    - [433, 7802.63]
  - - [1856, 256, 1, 1280]
    - [438, 6150.73]
  - - [64, 5888, 1, 3328]
    - [405, 5301.49]
  - - [2368, 2368, 1, 1280]
    - [435, 8233.43]
  - - [2944, 5888, 1, 128]
    - [428, 3745.51]
  - - [704, 5888, 1, 1280]
    - [433, 8245.04]
  - - [2368, 3584, 1, 128]
    - [425, 4523.43]
  - - [1856, 5056, 1, 128]
    - [422, 4498.08]
  - - [704, 1024, 1, 1280]
    - [446, 5479.59]
  - - [448, 256, 1, 3328]
    - [389, 5048.8]
  - - [448, 1856, 1, 128]
    - [422, 2936.92]
  - - [8192, 3200, 1, 2048]
    - [431, 6713.12]
  - - [128, 1024, 1, 128]
    - [367, 998.744]
  - - [2944, 4, 1, 128]
    - [452, 98.7471]
  - - [1024, 704, 1, 1280]
    - [438, 5897.0]
  - - [128, 5888, 1, 256]
    - [438, 5014.08]
  - - [1024, 5056, 1, 1280]
    - [437, 8857.81]
  - - [4288, 1024, 1, 256]
    - [443, 6195.39]
  - - [2944, 2368, 1, 128]
    - [421, 4442.23]
  - - [704, 704, 1, 3328]
    - [438, 6764.4]
  - - [704, 1408, 1, 1280]
    - [439, 7383.58]
  - - [5888, 448, 1, 1280]
    - [437, 7299.49]
  - - [3584, 256, 1, 3328]
    - [435, 7061.72]
  - - [704, 5888, 1, 3328]
    - [439, 8142.42]
  - - [704, 1856, 1, 128]
    - [425, 3139.14]
  - - [448, 448, 1, 3328]
    - [403, 5063.34]
  - - [4, 4288, 1, 128]
    - [453, 64.9775]
  - - [128, 704, 1, 1280]
    - [373, 3400.55]
  - - [3584, 2944, 1, 256]
    - [443, 7982.14]
  - - [3584, 4, 1, 128]
    - [452, 105.318]
  - - [1856, 128, 1, 3328]
    - [404, 5442.19]
  - - [4, 64, 1, 1280]
    - [458, 42.3268]
  - - [2944, 448, 1, 128]
    - [421, 2926.95]
  - - [128, 2944, 1, 1280]
    - [432, 5109.69]
  - - [64, 64, 1, 3328]
    - [400, 1252.99]
  - - [448, 2944, 1, 1280]
    - [441, 6684.47]
  - - [512, 24000, 1, 2048]
    - [437, 7939.03]
  - - [128, 256, 1, 3328]
    - [418, 3276.9]
  - - [1408, 5056, 1, 3328]
    - [443, 8959.21]
  - - [1856, 1856, 1, 3328]
    - [433, 8006.17]
  - - [3584, 128, 1, 256]
    - [438, 4292.52]
  - - [2560, 800, 1, 2560]
    - [433, 6262.48]
  - - [448, 1408, 1, 3328]
    - [449, 4997.35]
  - - [2368, 2368, 1, 256]
    - [451, 4978.94]
  - - [4288, 4288, 1, 1280]
    - [430, 8617.78]
  - - [64, 448, 1, 1280]
    - [376, 2057.28]
  - - [5888, 1024, 1, 1280]
    - [448, 6848.17]
  - - [1408, 4288, 1, 256]
    - [431, 7077.01]
  - - [448, 4, 1, 256]
    - [456, 84.4294]
  - - [5888, 448, 1, 128]
    - [425, 3493.91]
  - - [512, 48000, 1, 2560]
    - [443, 8960.13]
  - - [35, 8457, 1, 1760]
    - [345, 3934.78]
  - - [704, 6784, 1, 3328]
    - [430, 8180.88]
  - - [2560, 6400, 1, 2560]
    - [431, 7822.24]
  - - [5056, 1024, 1, 1280]
    - [433, 8357.38]
  - - [448, 5888, 1, 3328]
    - [437, 7505.28]
  - - [128, 4, 1, 128]
    - [452, 0.662251]
  - - [1024, 2944, 1, 1280]
    - [437, 8406.24]
  - - [5056, 5888, 1, 1280]
    - [437, 8819.76]
  - - [4288, 5888, 1, 128]
    - [422, 3522.32]
  - - [256, 3584, 1, 256]
    - [433, 5883.89]
  - - [1408, 3584, 1, 128]
    - [421, 4283.41]
  - - [256, 2944, 1, 3328]
    - [441, 5670.63]
  - - [448, 3584, 1, 128]
    - [425, 3171.72]
  - - [5888, 2944, 1, 1280]
    - [443, 8198.86]
  - - [4, 6784, 1, 1280]
    - [390, 553.896]
  - - [2368, 5888, 1, 128]
    - [421, 4787.32]
  - - [8448, 16, 1, 2816]
    - [380, 2452.63]
  - - [64, 2944, 1, 128]
    - [353, 1376.66]
  - - [2368, 4, 1, 256]
    - [375, 278.177]
  - - [3584, 5888, 1, 256]
    - [451, 6233.66]
  - - [2368, 1024, 1, 128]
    - [422, 3781.51]
  - - [2368, 704, 1, 128]
    - [422, 3198.32]
  - - [3584, 2944, 1, 1280]
    - [433, 8045.68]
  - - [3584, 2368, 1, 128]
    - [422, 4188.57]
  - - [5056, 704, 1, 128]
    - [425, 4019.21]
  - - [448, 2368, 1, 128]
    - [427, 2522.21]
  - - [5056, 1408, 1, 3328]
    - [435, 8349.93]
  - - [1408, 704, 1, 256]
    - [441, 4741.42]
  - - [6784, 1024, 1, 3328]
    - [443, 8769.5]
  - - [6784, 2944, 1, 3328]
    - [440, 7319.74]
  - - [2944, 5056, 1, 3328]
    - [430, 8889.76]
  - - [1856, 1856, 1, 256]
    - [433, 6309.84]
  - - [1024, 5888, 1, 128]
    - [424, 3759.6]
  - - [6784, 2368, 1, 1280]
    - [433, 8298.4]
  - - [256, 4, 1, 128]
    - [452, 7.10171]
  - - [4288, 5888, 1, 1280]
    - [437, 8365.28]
  - - [4288, 4288, 1, 256]
    - [437, 6513.78]
  - - [8448, 32, 1, 2816]
    - [408, 4257.74]
  - - [448, 2944, 1, 3328]
    - [441, 6875.62]
  - - [5888, 4, 1, 128]
    - [452, 163.94]
  - - [4288, 1856, 1, 1280]
    - [437, 8402.91]
  - - [1856, 2944, 1, 3328]
    - [437, 6612.21]
  - - [256, 6784, 1, 3328]
    - [438, 7358.7]
  - - [64, 5888, 1, 256]
    - [432, 3359.05]
  - - [256, 5056, 1, 128]
    - [425, 2489.21]
  - - [5056, 1024, 1, 256]
    - [443, 8077.87]
  - - [704, 64, 1, 3328]
    - [387, 3288.4]
  - - [5056, 1856, 1, 3328]
    - [441, 8171.13]
  - - [4, 2944, 1, 3328]
    - [400, 546.843]
  - - [4, 5056, 1, 256]
    - [375, 378.561]
  - - [1856, 1408, 1, 256]
    - [443, 6320.88]
  - - [8448, 12000, 1, 2816]
    - [441, 7365.87]
  - - [6784, 128, 1, 3328]
    - [438, 6366.57]
  - - [4288, 1408, 1, 128]
    - [421, 4451.7]
  - - [1856, 5888, 1, 3328]
    - [439, 8619.76]
  - - [4288, 5056, 1, 256]
    - [443, 7289.05]
  - - [1408, 128, 1, 1280]
    - [381, 4291.15]
  - - [4096, 800, 1, 1024]
    - [432, 5867.89]
  - - [5056, 256, 1, 3328]
    - [438, 7527.61]
  - - [704, 704, 1, 256]
    - [438, 4417.85]
  - - [1024, 5888, 1, 1280]
    - [443, 8674.57]
  - - [6784, 2368, 1, 128]
    - [421, 4724.08]
  - - [4, 5056, 1, 1280]
    - [390, 540.307]
  - - [256, 64, 1, 1280]
    - [392, 1515.38]
  - - [128, 1856, 1, 1280]
    - [432, 4574.21]
  - - [1856, 1024, 1, 1280]
    - [437, 7741.61]
  - - [6784, 4288, 1, 1280]
    - [443, 8521.29]
  - - [2560, 64, 1, 2560]
    - [374, 3504.7]
  - - [1856, 1856, 1, 1280]
    - [433, 7779.31]
  - - [4096, 400, 1, 1024]
    - [443, 4157.81]
  - - [3072, 24000, 1, 1024]
    - [443, 8663.45]
  - - [128, 4288, 1, 3328]
    - [389, 5674.23]
  - - [4, 2368, 1, 3328]
    - [400, 525.48]
  - - [5888, 1856, 1, 128]
    - [425, 4099.74]
  - - [448, 704, 1, 1280]
    - [438, 4309.47]
  - - [128, 5056, 1, 1280]
    - [381, 5068.46]
  - - [1024, 448, 1, 3328]
    - [441, 6077.82]
  - - [1856, 704, 1, 1280]
    - [449, 6257.49]
  - - [5056, 3584, 1, 128]
    - [422, 4598.52]
  - - [5888, 5888, 1, 3328]
    - [443, 8058.25]
  - - [6784, 1024, 1, 256]
    - [443, 5120.99]
  - - [2944, 2368, 1, 256]
    - [434, 6523.03]
  - - [256, 448, 1, 256]
    - [384, 1816.94]
  - - [5056, 5888, 1, 3328]
    - [436, 6722.41]
  - - [1856, 1024, 1, 256]
    - [443, 6632.31]
  - - [512, 48000, 1, 1536]
    - [437, 8556.01]
  - - [3584, 448, 1, 1280]
    - [432, 6567.09]
  - - [8448, 5984, 1, 2816]
    - [437, 8990.66]
  - - [448, 5888, 1, 256]
    - [437, 6220.47]
  - - [704, 64, 1, 128]
    - [350, 450.66]
  - - [1408, 6784, 1, 3328]
    - [430, 8478.68]
  - - [448, 1024, 1, 128]
    - [429, 1844.33]
  - - [4288, 704, 1, 128]
    - [425, 3895.26]
  - - [128, 1856, 1, 128]
    - [356, 1456.46]
  - - [448, 2368, 1, 3328]
    - [435, 5538.04]
  - - [5056, 64, 1, 128]
    - [421, 1648.94]
  - - [5056, 2944, 1, 256]
    - [437, 8230.87]
  - - [6784, 5888, 1, 128]
    - [421, 4873.19]
  - - [1024, 700, 1, 512]
    - [435, 4445.37]
  - - [704, 1024, 1, 256]
    - [433, 4707.99]
  - - [1024, 4, 1, 256]
    - [375, 174.863]
  - - [2944, 704, 1, 128]
    - [425, 3483.42]
  - - [128, 6784, 1, 1280]
    - [433, 6522.93]
  - - [1408, 3584, 1, 3328]
    - [437, 8673.59]
  - - [2368, 6784, 1, 256]
    - [433, 7941.76]
  - - [5056, 1408, 1, 1280]
    - [437, 8801.01]
  - - [256, 256, 1, 128]
    - [362, 551.982]
  - - [5056, 4288, 1, 128]
    - [429, 3793.64]
  - - [1408, 1856, 1, 128]
    - [421, 3067.74]
  - - [1408, 5888, 1, 3328]
    - [437, 9148.97]
  - - [1856, 256, 1, 256]
    - [433, 4319.52]
  - - [6784, 6784, 1, 256]
    - [433, 7668.53]
  - - [64, 256, 1, 128]
    - [367, 131.172]
  - - [4288, 2368, 1, 128]
    - [422, 4582.99]
  - - [256, 4288, 1, 1280]
    - [432, 6058.61]
  - - [2368, 2944, 1, 256]
    - [437, 8016.07]
  - - [4, 1856, 1, 256]
    - [454, 252.832]
  - - [3584, 1856, 1, 1280]
    - [433, 7760.24]
  - - [6784, 6784, 1, 128]
    - [422, 4970.14]
  - - [256, 1856, 1, 128]
    - [428, 1580.59]
  - - [704, 64, 1, 1280]
    - [417, 2556.47]
  - - [5888, 5056, 1, 256]
    - [437, 8216.67]
  - - [8448, 48000, 1, 2816]
    - [443, 4082.89]
  - - [3584, 448, 1, 256]
    - [437, 5518.92]
  - - [448, 4288, 1, 128]
    - [425, 3415.25]
  - - [7680, 64, 1, 2560]
    - [386, 5162.1]
  - - [256, 6784, 1, 256]
    - [437, 6272.62]
  - - [1408, 4288, 1, 128]
    - [425, 4343.63]
  - - [2944, 704, 1, 3328]
    - [432, 7679.71]
  - - [128, 448, 1, 256]
    - [372, 1422.59]
  - - [5056, 256, 1, 1280]
    - [439, 5052.39]
  - - [2560, 32, 1, 2560]
    - [395, 3106.07]
  - - [3584, 3584, 1, 256]
    - [443, 8260.57]
  - - [448, 1408, 1, 128]
    - [421, 2397.38]
  - - [128, 256, 1, 1280]
    - [376, 2340.67]
  - - [3584, 5056, 1, 256]
    - [443, 7347.56]
  - - [6784, 128, 1, 256]
    - [433, 5591.1]
  - - [4288, 4, 1, 256]
    - [375, 354.206]
  - - [704, 448, 1, 256]
    - [438, 3492.33]
  - - [2944, 2368, 1, 1280]
    - [445, 6661.71]
  - - [448, 64, 1, 3328]
    - [417, 3058.45]
  - - [1408, 3584, 1, 256]
    - [443, 7966.59]
  - - [3584, 4, 1, 3328]
    - [456, 605.559]
  - - [6784, 3584, 1, 256]
    - [433, 7525.41]
  - - [256, 128, 1, 128]
    - [365, 276.041]
  - - [704, 1408, 1, 128]
    - [422, 3109.85]
  - - [4, 2368, 1, 256]
    - [456, 283.375]
  - - [4288, 128, 1, 1280]
    - [438, 5132.65]
  - - [128, 1408, 1, 256]
    - [432, 2733.35]
  - - [4, 2944, 1, 256]
    - [454, 314.127]
  - - [64, 128, 1, 3328]
    - [402, 1514.71]
  - - [5056, 2368, 1, 128]
    - [426, 3449.17]
  - - [2944, 2944, 1, 3328]
    - [430, 8169.03]
  - - [5056, 6784, 1, 256]
    - [450, 5792.77]
  - - [1856, 3584, 1, 128]
    - [427, 4213.5]
  - - [128, 2944, 1, 128]
    - [351, 1970.46]
  - - [35, 8457, 1, 2560]
    - [346, 3525.15]
  - - [1024, 704, 1, 3328]
    - [432, 6784.99]
  - - [6784, 448, 1, 256]
    - [441, 6544.88]
  - - [3584, 6784, 1, 128]
    - [421, 4623.6]
  - - [128, 4288, 1, 256]
    - [435, 3606.6]
  - - [704, 448, 1, 3328]
    - [432, 4478.01]
  - - [128, 128, 1, 3328]
    - [417, 2177.65]
  - - [5056, 1856, 1, 256]
    - [451, 5608.72]
  - - [4608, 5984, 1, 1536]
    - [440, 7859.85]
  - - [256, 128, 1, 256]
    - [376, 998.744]
  - - [1760, 3200, 1, 1760]
    - [433, 8179.64]
  - - [1024, 1856, 1, 256]
    - [443, 6143.27]
  - - [4096, 1600, 1, 1024]
    - [451, 5851.52]
  - - [4288, 64, 1, 128]
    - [356, 1372.26]
  - - [256, 448, 1, 3328]
    - [395, 4795.1]
  - - [1408, 6784, 1, 1280]
    - [437, 8426.5]
  - - [3584, 3584, 1, 1280]
    - [437, 7556.56]
  - - [7680, 24000, 1, 2560]
    - [430, 5019.19]
  - - [64, 2368, 1, 1280]
    - [381, 4061.8]
  - - [448, 2368, 1, 1280]
    - [432, 5928.77]
  - - [4608, 48000, 1, 1536]
    - [437, 6937.4]
  - - [5888, 5888, 1, 128]
    - [422, 3744.0]
  - - [64, 6784, 1, 3328]
    - [432, 5988.72]
  - - [2944, 256, 1, 1280]
    - [438, 6717.97]
  - - [2048, 16, 1, 2048]
    - [390, 1210.58]
  - - [256, 2368, 1, 128]
    - [425, 1936.07]
  - - [5056, 2368, 1, 3328]
    - [443, 8875.63]
  - - [2944, 4288, 1, 256]
    - [437, 8063.24]
  - - [1408, 3584, 1, 1280]
    - [433, 8197.07]
  - - [2368, 64, 1, 256]
    - [432, 2365.79]
  - - [64, 448, 1, 3328]
    - [418, 3027.4]
  - - [704, 128, 1, 3328]
    - [389, 4452.19]
  - - [8192, 1600, 1, 2048]
    - [437, 7229.93]
  - - [1856, 704, 1, 256]
    - [439, 5545.45]
  - - [4, 4288, 1, 1280]
    - [390, 523.825]
  - - [1408, 448, 1, 3328]
    - [444, 4789.4]
  - - [1024, 4, 1, 3328]
    - [370, 504.223]
  - - [512, 24000, 1, 2560]
    - [443, 8903.62]
  - - [2368, 6784, 1, 3328]
    - [443, 8311.14]
  - - [1856, 1408, 1, 1280]
    - [433, 8160.11]
  - - [1856, 448, 1, 1280]
    - [435, 6243.07]
  - - [6784, 704, 1, 128]
    - [421, 4069.05]
  - - [4, 4, 1, 256]
    - [390, 0.842029]
  - - [128, 5888, 1, 128]
    - [421, 2328.02]
  - - [1408, 5888, 1, 256]
    - [432, 6986.91]
  - - [704, 2944, 1, 1280]
    - [433, 7905.03]
  - - [4288, 64, 1, 1280]
    - [408, 3828.27]
  - - [256, 64, 1, 256]
    - [383, 655.46]
  - - [704, 1856, 1, 256]
    - [441, 5444.37]
  - - [704, 6784, 1, 128]
    - [421, 4319.77]
  - - [3584, 704, 1, 1280]
    - [441, 7726.43]
  - - [256, 128, 1, 1280]
    - [376, 2184.63]
  - - [5888, 2368, 1, 256]
    - [443, 8192.69]
  - - [256, 2368, 1, 1280]
    - [438, 5675.54]
  - - [2944, 6784, 1, 128]
    - [426, 4248.35]
  - - [3584, 448, 1, 3328]
    - [437, 6560.77]
  - - [1408, 4, 1, 256]
    - [455, 176.79]
  - - [704, 2368, 1, 3328]
    - [438, 7085.31]
  - - [2944, 448, 1, 256]
    - [434, 3412.0]
  - - [1856, 448, 1, 128]
    - [422, 2748.82]
  - - [4288, 4, 1, 3328]
    - [390, 553.648]
  - - [2368, 128, 1, 1280]
    - [411, 4173.65]
  - - [256, 5888, 1, 128]
    - [426, 2860.98]
  - - [64, 6784, 1, 256]
    - [439, 3637.18]
  - - [64, 5056, 1, 1280]
    - [438, 4289.53]
  - - [4, 6784, 1, 128]
    - [452, 160.906]
  - - [2048, 3200, 1, 512]
    - [439, 6927.09]
  - - [2944, 2944, 1, 1280]
    - [431, 6267.85]
  - - [5056, 448, 1, 3328]
    - [432, 7400.36]
  - - [4, 3584, 1, 1280]
    - [390, 499.83]
  - - [1408, 128, 1, 128]
    - [367, 1037.36]
  - - [6784, 704, 1, 3328]
    - [438, 7633.95]
  - - [128, 64, 1, 1280]
    - [390, 1170.39]
  - - [2368, 256, 1, 1280]
    - [438, 5609.89]
  - - [4, 448, 1, 3328]
    - [458, 358.5]
  - - [5888, 4288, 1, 128]
    - [426, 4521.74]
  - - [4, 5888, 1, 256]
    - [390, 353.933]
  - - [1408, 2944, 1, 3328]
    - [431, 8951.41]
  - - [3584, 704, 1, 128]
    - [421, 3395.41]
  - - [4608, 12000, 1, 1536]
    - [430, 6609.99]
  - - [64, 1024, 1, 256]
    - [376, 1588.85]
  - - [5056, 5056, 1, 128]
    - [421, 4080.81]
  - - [2368, 448, 1, 1280]
    - [432, 5423.04]
  - - [128, 3584, 1, 256]
    - [438, 4705.25]
  - - [704, 448, 1, 1280]
    - [435, 3961.07]
  - - [8192, 800, 1, 2048]
    - [433, 6306.36]
  - - [448, 5056, 1, 128]
    - [425, 3709.56]
  - - [256, 4, 1, 1280]
    - [457, 163.94]
  - - [5056, 3584, 1, 256]
    - [430, 7008.34]
  - - [2368, 4, 1, 3328]
    - [390, 496.366]
  - - [1408, 5056, 1, 128]
    - [425, 4175.37]
  - - [2944, 3584, 1, 128]
    - [421, 4659.79]
  - - [3584, 2368, 1, 256]
    - [443, 5851.87]
  - - [128, 3584, 1, 3328]
    - [433, 6105.04]
  - - [128, 1024, 1, 1280]
    - [373, 3848.09]
  - - [8448, 24000, 1, 2816]
    - [443, 5128.64]
  - - [64, 704, 1, 256]
    - [376, 1253.83]
  - - [4288, 256, 1, 1280]
    - [432, 5625.86]
  - - [3584, 3584, 1, 3328]
    - [437, 8206.15]
  - - [4, 704, 1, 128]
    - [452, 29.5484]
  - - [5888, 6784, 1, 256]
    - [439, 8248.75]
  - - [4288, 2944, 1, 3328]
    - [437, 8657.12]
  - - [2944, 64, 1, 128]
    - [356, 1240.7]
  - - [1024, 128, 1, 3328]
    - [381, 4433.1]
  - - [1024, 16, 1, 500000]
    - [344, 2571.15]
  - - [4288, 128, 1, 3328]
    - [381, 5716.85]
  - - [7680, 128, 1, 2560]
    - [379, 5488.1]
  - - [256, 5056, 1, 1280]
    - [439, 6380.06]
  - - [1408, 256, 1, 128]
    - [425, 1633.83]
  - - [2944, 5888, 1, 3328]
    - [434, 7849.02]
  - - [6784, 5888, 1, 1280]
    - [443, 9047.72]
  - - [2048, 800, 1, 512]
    - [438, 4841.17]
  - - [704, 128, 1, 256]
    - [383, 1567.27]
  - - [5888, 4288, 1, 1280]
    - [437, 7982.93]
  - - [1024, 24000, 1, 2048]
    - [439, 5774.4]
  - - [448, 256, 1, 1280]
    - [373, 3707.19]
  - - [5888, 3584, 1, 128]
    - [426, 3804.5]
  - - [1024, 2944, 1, 128]
    - [421, 3308.36]
  - - [5056, 4, 1, 1280]
    - [454, 469.062]
  - - [256, 1408, 1, 1280]
    - [432, 4899.99]
  - - [3072, 16, 1, 1024]
    - [390, 1233.72]
  - - [704, 3584, 1, 128]
    - [421, 3919.53]
  - - [5888, 448, 1, 3328]
    - [451, 6095.71]
  - - [2368, 4288, 1, 1280]
    - [433, 8338.4]
  - - [4288, 2944, 1, 128]
    - [425, 3946.6]
  - - [1024, 6784, 1, 3328]
    - [439, 7494.38]
  - - [128, 2368, 1, 256]
    - [438, 2895.42]
  - - [6784, 64, 1, 3328]
    - [432, 5964.99]
  - - [5056, 2944, 1, 3328]
    - [443, 6605.63]
  - - [448, 128, 1, 256]
    - [376, 1339.52]
  - - [2944, 3584, 1, 256]
    - [439, 7165.66]
  - - [1408, 1408, 1, 3328]
    - [443, 8332.96]
  - - [1856, 128, 1, 1280]
    - [438, 4498.43]
  - - [3584, 3584, 1, 128]
    - [422, 4000.11]
  - - [64, 3584, 1, 256]
    - [449, 2383.23]
  - - [1408, 4, 1, 3328]
    - [400, 423.008]
  - - [128, 2944, 1, 3328]
    - [405, 5430.03]
  - - [3584, 704, 1, 256]
    - [438, 6154.09]
  - - [2944, 448, 1, 3328]
    - [438, 6507.82]
  - - [3584, 1408, 1, 3328]
    - [443, 8829.73]
  - - [704, 3584, 1, 1280]
    - [433, 7860.33]
  - - [2944, 6784, 1, 1280]
    - [443, 8894.6]
  - - [1856, 6784, 1, 256]
    - [443, 8115.19]
  - - [4288, 448, 1, 3328]
    - [435, 6397.35]
  - - [6784, 4288, 1, 128]
    - [421, 4109.54]
  - - [6784, 704, 1, 1280]
    - [431, 7999.14]
  - - [256, 4288, 1, 256]
    - [435, 4603.94]
  - - [3584, 6784, 1, 256]
    - [443, 7361.65]
  - - [6144, 12000, 1, 2048]
    - [442, 6311.76]
  - - [6144, 16, 1, 2560]
    - [391, 2240.65]
  - - [3584, 64, 1, 128]
    - [362, 1292.36]
  - - [5888, 1024, 1, 3328]
    - [430, 8394.59]
  - - [448, 64, 1, 128]
    - [353, 262.244]
  - - [704, 6784, 1, 1280]
    - [437, 7740.66]
  - - [4, 1024, 1, 1280]
    - [390, 378.921]
  - - [5888, 128, 1, 256]
    - [438, 5003.68]
  - - [4096, 16, 1, 4096]
    - [390, 1585.85]
  - - [1856, 5056, 1, 3328]
    - [431, 8522.92]
  - - [4, 6784, 1, 256]
    - [375, 387.757]
  - - [1024, 3584, 1, 128]
    - [425, 3031.61]
  - - [1024, 1408, 1, 128]
    - [427, 2600.85]
  - - [2368, 2944, 1, 128]
    - [424, 4340.26]
  - - [5056, 64, 1, 256]
    - [438, 3109.62]
  - - [4, 448, 1, 1280]
    - [458, 253.835]
  - - [5056, 2944, 1, 128]
    - [429, 3740.01]
  - - [5888, 5056, 1, 3328]
    - [443, 9016.48]
  - - [1024, 704, 1, 128]
    - [425, 2363.66]
  - - [5888, 2368, 1, 128]
    - [428, 3651.83]
  - - [128, 5056, 1, 3328]
    - [432, 6243.64]
  - - [3584, 6784, 1, 1280]
    - [430, 9080.67]
  - - [448, 4, 1, 1280]
    - [458, 243.083]
  - - [1856, 5888, 1, 256]
    - [443, 8182.12]
  - - [256, 256, 1, 256]
    - [376, 1542.12]
  - - [256, 64, 1, 128]
    - [357, 135.226]
  - - [4288, 4288, 1, 3328]
    - [443, 8674.64]
  - - [4288, 1408, 1, 1280]
    - [431, 7867.18]
  - - [3584, 5056, 1, 128]
    - [421, 4457.83]
  - - [4, 1024, 1, 3328]
    - [370, 440.394]
  - - [4288, 2368, 1, 256]
    - [451, 5699.57]
  - - [2944, 5056, 1, 1280]
    - [443, 8236.56]
  - - [448, 6784, 1, 256]
    - [433, 6620.62]
  - - [64, 128, 1, 128]
    - [358, 67.6629]
  - - [1856, 2368, 1, 128]
    - [425, 4233.7]
  - - [6784, 2368, 1, 3328]
    - [443, 8269.9]
  - - [256, 1024, 1, 1280]
    - [432, 4882.88]
  - - [704, 4, 1, 128]
    - [452, 19.111]
  - - [256, 4, 1, 256]
    - [390, 46.9114]
  - - [4288, 128, 1, 256]
    - [438, 4273.49]
  - - [4288, 1856, 1, 3328]
    - [433, 8195.81]
  - - [3584, 448, 1, 128]
    - [426, 2750.65]
  - - [2048, 1600, 1, 2048]
    - [449, 5753.59]
  - - [256, 4, 1, 3328]
    - [459, 297.978]
  - - [4, 1408, 1, 1280]
    - [457, 402.386]
  - - [3584, 64, 1, 1280]
    - [446, 4096.1]
  - - [1408, 448, 1, 128]
    - [421, 2498.25]
  - - [3584, 1024, 1, 1280]
    - [443, 7252.18]
  - - [1856, 5056, 1, 256]
    - [437, 7711.59]
  - - [4, 3584, 1, 256]
    - [454, 314.314]
  - - [4, 2944, 1, 1280]
    - [390, 483.218]
  - - [1024, 4288, 1, 256]
    - [442, 6544.52]
  - - [5888, 3584, 1, 3328]
    - [431, 8105.15]
  - - [1856, 4, 1, 256]
    - [390, 252.832]
  - - [4, 256, 1, 256]
    - [375, 48.2882]
  - - [5056, 3584, 1, 3328]
    - [436, 7354.8]
  - - [704, 448, 1, 128]
    - [429, 1233.91]
  - - [2368, 1408, 1, 1280]
    - [437, 6654.24]
  - - [5056, 2944, 1, 1280]
    - [443, 8505.72]
  - - [4, 4, 1, 128]
    - [453, 0.1478505]
  - - [3584, 256, 1, 256]
    - [435, 4616.47]
  - - [1024, 6784, 1, 256]
    - [437, 7944.98]
  - - [4, 128, 1, 256]
    - [390, 29.3571]
  - - [64, 64, 1, 1280]
    - [401, 642.61]
  - - [5124, 9124, 1, 2048]
    - [443, 8019.4]
  - - [6784, 4, 1, 128]
    - [452, 193.067]
  - - [2944, 1408, 1, 128]
    - [421, 3827.13]
  - - [448, 128, 1, 3328]
    - [394, 4064.0]
  - - [3584, 1408, 1, 1280]
    - [443, 7180.83]
  - - [64, 4288, 1, 3328]
    - [389, 4786.84]
  - - [5056, 6784, 1, 3328]
    - [430, 7889.83]
  - - [128, 2944, 1, 256]
    - [433, 3599.69]
  - - [128, 6784, 1, 128]
    - [351, 2606.79]
  - - [3584, 4288, 1, 256]
    - [437, 7299.81]
  - - [448, 1856, 1, 256]
    - [433, 5207.07]
  - - [1856, 6784, 1, 3328]
    - [435, 8386.36]
  - - [3584, 128, 1, 3328]
    - [379, 5590.04]
  - - [64, 1856, 1, 256]
    - [372, 1949.38]
  - - [64, 448, 1, 256]
    - [377, 955.833]
  - - [5888, 4288, 1, 256]
    - [441, 7791.84]
  - - [4, 448, 1, 128]
    - [452, 8.84146]
  - - [5056, 1408, 1, 256]
    - [443, 5154.01]
  - - [35, 8457, 1, 2048]
    - [348, 3182.57]
  - - [64, 256, 1, 1280]
    - [397, 1713.46]
  - - [3584, 1024, 1, 256]
    - [433, 6528.18]
  - - [256, 704, 1, 256]
    - [432, 2720.46]
  - - [5888, 5888, 1, 256]
    - [441, 7992.26]
  - - [4288, 1024, 1, 1280]
    - [435, 7837.5]
  - - [5888, 128, 1, 3328]
    - [438, 7181.13]
  - - [448, 6784, 1, 3328]
    - [432, 7663.1]
  - - [2944, 1408, 1, 1280]
    - [441, 7903.14]
  - - [64, 128, 1, 1280]
    - [390, 1191.66]
  - - [2944, 1856, 1, 3328]
    - [431, 7844.41]
  - - [2368, 64, 1, 128]
    - [362, 997.973]
  - - [256, 1024, 1, 128]
    - [421, 1215.84]
  - - [3584, 5888, 1, 1280]
    - [430, 8958.94]
  - - [64, 4, 1, 128]
    - [453, 1.21608]
  - - [6784, 1856, 1, 1280]
    - [430, 6728.8]
  - - [2944, 5056, 1, 256]
    - [443, 8275.21]
  - - [4288, 4, 1, 128]
    - [452, 147.644]
  - - [5888, 256, 1, 3328]
    - [439, 7094.2]
  - - [2944, 4288, 1, 128]
    - [424, 4611.55]
  - - [3584, 1408, 1, 256]
    - [434, 6543.06]
  - - [704, 3584, 1, 3328]
    - [433, 8117.2]
  - - [4096, 3200, 1, 1024]
    - [448, 6656.13]
  - - [5056, 448, 1, 1280]
    - [446, 6096.2]
  - - [3584, 1856, 1, 3328]
    - [431, 8552.41]
  - - [4288, 6784, 1, 1280]
    - [437, 8212.46]
  - - [2560, 7000, 1, 2560]
    - [439, 7655.34]
  - - [1408, 704, 1, 1280]
    - [435, 5756.79]
  - - [2944, 1024, 1, 256]
    - [443, 6880.91]
  - - [6784, 64, 1, 256]
    - [438, 4438.96]
  - - [2368, 4288, 1, 3328]
    - [439, 8377.99]
  - - [4, 1408, 1, 256]
    - [456, 222.599]
  - - [1024, 1408, 1, 1280]
    - [433, 6339.38]
  - - [64, 64, 1, 256]
    - [390, 187.346]
  - - [704, 256, 1, 3328]
    - [432, 4046.14]
  - - [6784, 5056, 1, 256]
    - [443, 7972.17]
  - - [1856, 1856, 1, 128]
    - [427, 3716.61]
  - - [3584, 5056, 1, 3328]
    - [443, 8684.76]
  - - [448, 6784, 1, 128]
    - [425, 3829.05]
  - - [4, 704, 1, 3328]
    - [458, 393.206]
  - - [35, 8457, 1, 4096]
    - [347, 3173.24]
  - - [448, 2944, 1, 256]
    - [441, 5553.41]
  - - [4, 4288, 1, 3328]
    - [400, 573.211]
  - - [2944, 6784, 1, 256]
    - [437, 8566.06]
  - - [2944, 2944, 1, 128]
    - [421, 4540.83]
  - - [4, 4, 1, 1280]
    - [400, 3.14762]
  - - [1856, 3584, 1, 1280]
    - [437, 7306.36]
  - - [64, 2944, 1, 256]
    - [449, 2292.61]
  - - [448, 256, 1, 128]
    - [358, 797.93]
  - - [4288, 448, 1, 128]
    - [424, 3430.5]
  - - [4608, 24000, 1, 1536]
    - [442, 6820.24]
  - - [1856, 1408, 1, 3328]
    - [445, 6600.24]
  - - [128, 128, 1, 128]
    - [350, 161.917]
  - - [1024, 4288, 1, 3328]
    - [433, 7937.08]
  - - [448, 2368, 1, 256]
    - [441, 4526.45]
  - - [1024, 4, 1, 128]
    - [453, 16.9907]
  - - [64, 1408, 1, 1280]
    - [373, 3345.32]
  - - [64, 6784, 1, 1280]
    - [438, 5526.6]
  - - [5056, 448, 1, 256]
    - [432, 4216.65]
  - - [2944, 2368, 1, 3328]
    - [443, 7000.42]
  - - [704, 4288, 1, 3328]
    - [449, 6414.43]
  - - [1408, 128, 1, 256]
    - [432, 2720.46]
  - - [1024, 1856, 1, 1280]
    - [443, 7682.93]
  - - [2048, 6400, 1, 2048]
    - [439, 7418.22]
  - - [512, 48000, 1, 2816]
    - [443, 8884.77]
  - - [5124, 9124, 1, 2560]
    - [435, 6040.8]
  - - [128, 2368, 1, 3328]
    - [389, 5025.66]
  - - [1024, 5888, 1, 256]
    - [437, 7322.21]
  - - [64, 2944, 1, 1280]
    - [373, 4222.31]
  - - [5056, 64, 1, 3328]
    - [414, 4936.32]
  - - [128, 704, 1, 128]
    - [359, 683.414]
  - - [1408, 2368, 1, 256]
    - [438, 6404.22]
  - - [1408, 1408, 1, 256]
    - [443, 4537.93]
  - - [4, 64, 1, 128]
    - [452, 2.56747]
  - - [64, 1024, 1, 128]
    - [351, 532.372]
  - - [1024, 8, 1, 500000]
    - [341, 1685.08]
  - - [2368, 2368, 1, 128]
    - [422, 4334.33]
  - - [64, 5888, 1, 128]
    - [351, 2003.19]
  - - [5888, 4, 1, 3328]
    - [369, 339.118]
  - - [6784, 1408, 1, 128]
    - [425, 4431.23]
  - - [4288, 5888, 1, 256]
    - [443, 7800.88]
  - - [1408, 5056, 1, 256]
    - [437, 8153.38]
  - - [5056, 128, 1, 3328]
    - [394, 5829.93]
  - - [128, 128, 1, 1280]
    - [397, 1691.35]
  - - [448, 704, 1, 256]
    - [438, 3364.28]
  - - [4288, 3584, 1, 128]
    - [422, 2952.68]
  - - [2944, 128, 1, 3328]
    - [394, 5620.82]
  - - [64, 1408, 1, 3328]
    - [395, 4169.91]
  - - [3584, 5056, 1, 1280]
    - [440, 7780.76]
  - - [256, 448, 1, 1280]
    - [373, 3929.45]
  - - [704, 704, 1, 128]
    - [421, 2346.17]
  - - [5056, 4, 1, 128]
    - [452, 144.557]
  - - [704, 256, 1, 1280]
    - [441, 2283.22]
  - - [64, 2368, 1, 3328]
    - [373, 4921.69]
  - - [1856, 1024, 1, 128]
    - [422, 3459.57]
  - - [1856, 64, 1, 128]
    - [354, 918.237]
  - - [4096, 64, 1, 4096]
    - [399, 4000.62]
  - - [1024, 24000, 1, 1536]
    - [435, 8502.36]
  - - [704, 4288, 1, 256]
    - [439, 6003.83]
  - - [5888, 2368, 1, 1280]
    - [430, 8801.3]
  - - [128, 256, 1, 256]
    - [384, 1070.08]
  - - [64, 128, 1, 256]
    - [390, 374.591]
  - - [2368, 5888, 1, 1280]
    - [433, 8308.63]
  - - [5888, 256, 1, 1280]
    - [441, 7154.42]
  - - [1760, 128, 1, 1760]
    - [382, 5363.91]
  - - [4, 5888, 1, 1280]
    - [390, 542.304]
  - - [704, 128, 1, 128]
    - [362, 779.447]
  - - [1024, 4, 1, 1280]
    - [390, 392.531]
  - - [2368, 1856, 1, 3328]
    - [433, 7975.32]
  - - [2368, 128, 1, 128]
    - [355, 1584.96]
  - - [2944, 704, 1, 256]
    - [441, 4039.21]
  - - [5056, 128, 1, 128]
    - [421, 2575.89]
  - - [2368, 1024, 1, 3328]
    - [449, 6165.54]
  - - [256, 704, 1, 3328]
    - [432, 4028.74]
  - - [704, 3584, 1, 256]
    - [443, 6102.92]
  - - [704, 2944, 1, 3328]
    - [433, 8202.84]
  - - [6784, 1024, 1, 128]
    - [425, 4386.4]
  - - [256, 448, 1, 128]
    - [362, 834.195]
  - - [448, 1024, 1, 3328]
    - [450, 5412.48]
  - - [2944, 1024, 1, 3328]
    - [443, 6265.87]
  - - [2944, 5056, 1, 128]
    - [421, 4770.88]
  - - [2368, 256, 1, 256]
    - [438, 3975.23]
  - - [1408, 6784, 1, 256]
    - [437, 7987.02]
  - - [6784, 1408, 1, 3328]
    - [437, 8472.71]
  - - [4288, 6784, 1, 128]
    - [428, 3865.2]
  - - [704, 64, 1, 256]
    - [376, 1287.41]
  - - [5888, 4, 1, 1280]
    - [375, 510.022]
  - - [256, 2368, 1, 3328]
    - [438, 5837.65]
  - - [6784, 2944, 1, 1280]
    - [443, 8560.54]
  - - [4288, 1856, 1, 128]
    - [421, 4617.07]
  - - [1856, 2944, 1, 128]
    - [421, 4287.73]
  - - [6784, 448, 1, 128]
    - [425, 3893.43]
  - - [64, 3584, 1, 128]
    - [351, 1609.76]
  - - [448, 5056, 1, 1280]
    - [441, 7124.41]
  - - [2368, 1856, 1, 128]
    - [424, 4004.65]
  - - [64, 2944, 1, 3328]
    - [374, 5086.48]
  - - [4288, 704, 1, 256]
    - [439, 6176.57]
  - - [256, 3584, 1, 128]
    - [422, 2553.15]
  - - [5888, 704, 1, 256]
    - [438, 6781.51]
  - - [3584, 1024, 1, 128]
    - [425, 3660.95]
  - - [256, 5888, 1, 3328]
    - [441, 7772.13]
  - - [1408, 4288, 1, 3328]
    - [437, 8832.86]
  - - [6784, 4288, 1, 256]
    - [443, 8566.14]
  - - [4288, 256, 1, 128]
    - [423, 1953.79]
  - - [5888, 256, 1, 256]
    - [441, 3730.53]
  - - [6784, 1024, 1, 1280]
    - [437, 8578.39]
  - - [5888, 1024, 1, 128]
    - [422, 4092.96]
  - - [1024, 128, 1, 256]
    - [372, 1897.98]
  - - [512, 16, 1, 500000]
    - [343, 2363.79]
  - - [128, 64, 1, 3328]
    - [400, 1592.56]
  - - [448, 64, 1, 256]
    - [390, 976.168]
  - - [2368, 256, 1, 128]
    - [425, 2094.99]
  - - [6784, 3584, 1, 1280]
    - [437, 8570.16]
  - - [1024, 6784, 1, 1280]
    - [443, 8203.57]
  - - [2944, 64, 1, 1280]
    - [381, 4300.61]
  - - [1408, 2944, 1, 1280]
    - [433, 7349.64]
  - - [256, 1856, 1, 256]
    - [432, 4649.75]
  - - [2048, 800, 1, 2048]
    - [451, 4668.73]
  - - [1408, 2368, 1, 3328]
    - [441, 7537.74]
  - - [2944, 4, 1, 3328]
    - [390, 514.142]
  - - [128, 1408, 1, 3328]
    - [382, 4991.64]
  - - [2944, 1856, 1, 128]
    - [421, 4317.39]
  - - [256, 2944, 1, 128]
    - [421, 2258.27]
  - - [256, 6784, 1, 128]
    - [421, 3147.02]
  - - [2368, 4, 1, 128]
    - [453, 33.9286]
  - - [1408, 256, 1, 3328]
    - [432, 5077.85]
  - - [1856, 4, 1, 128]
    - [453, 21.5025]
  - - [5056, 6784, 1, 128]
    - [421, 4945.11]
  - - [4288, 5056, 1, 128]
    - [424, 4729.87]
  - - [1856, 5888, 1, 128]
    - [421, 4707.96]
  - - [2944, 5888, 1, 256]
    - [435, 8014.78]
  - - [3584, 1856, 1, 256]
    - [437, 7567.13]
  - - [4288, 3584, 1, 1280]
    - [430, 8726.43]
  - - [2368, 448, 1, 256]
    - [438, 4227.7]
  - - [4288, 256, 1, 3328]
    - [439, 5487.41]
  - - [1856, 704, 1, 128]
    - [425, 3125.06]
  - - [1408, 64, 1, 256]
    - [385, 1620.09]
  - - [64, 1856, 1, 128]
    - [349, 955.147]
  - - [4, 256, 1, 128]
    - [452, 10.8789]
  - - [2560, 16, 1, 2560]
    - [397, 2019.7]
  - - [704, 5888, 1, 128]
    - [426, 3976.26]
  - - [6784, 3584, 1, 128]
    - [425, 4018.91]
  - - [1024, 64, 1, 256]
    - [390, 1370.79]
  - - [64, 2368, 1, 256]
    - [432, 2255.76]
  - - [4288, 5056, 1, 3328]
    - [437, 8368.69]
  - - [4, 1856, 1, 1280]
    - [390, 392.126]
  - - [4288, 128, 1, 128]
    - [355, 2287.03]
  - - [1408, 1408, 1, 128]
    - [425, 3233.48]
  - - [7680, 16, 1, 2560]
    - [393, 2257.37]
  - - [1856, 128, 1, 128]
    - [355, 1532.8]
  - - [5056, 2368, 1, 256]
    - [437, 8167.29]
  - - [4288, 704, 1, 3328]
    - [443, 6411.16]
  - - [448, 3584, 1, 256]
    - [443, 5477.74]
  - - [2368, 64, 1, 1280]
    - [373, 3936.52]
  - - [2368, 1024, 1, 1280]
    - [439, 7688.82]
  - - [2944, 1408, 1, 3328]
    - [430, 7668.78]
  - - [1408, 448, 1, 256]
    - [432, 4863.98]
  - - [1024, 1408, 1, 3328]
    - [441, 7448.99]
  - - [2944, 5888, 1, 1280]
    - [431, 8208.57]
  - - [1408, 4, 1, 1280]
    - [370, 479.419]
  - - [5888, 3584, 1, 256]
    - [431, 8610.09]
  - - [2368, 5056, 1, 128]
    - [428, 3726.25]
  - - [1408, 1856, 1, 3328]
    - [432, 7829.48]
  - - [4, 4, 1, 3328]
    - [459, 4.39419]
  - - [6784, 1408, 1, 1280]
    - [432, 7690.8]
  - - [4096, 7000, 1, 4096]
    - [444, 6272.49]
  - - [704, 2944, 1, 256]
    - [433, 6095.91]
  - - [4288, 64, 1, 256]
    - [398, 2121.31]
  - - [6784, 5888, 1, 3328]
    - [437, 8955.6]
  - - [2368, 4288, 1, 128]
    - [421, 4699.65]
  - - [64, 4288, 1, 1280]
    - [411, 4013.73]
  - - [6784, 64, 1, 1280]
    - [432, 5418.83]
  - - [3584, 128, 1, 128]
    - [361, 2165.3]
  - - [1024, 6784, 1, 128]
    - [422, 3765.3]
  - - [4, 1856, 1, 128]
    - [453, 33.3728]
  - - [1408, 64, 1, 3328]
    - [394, 4489.51]
  - - [6784, 4, 1, 256]
    - [390, 400.262]
  - - [1408, 1408, 1, 1280]
    - [437, 8139.53]
  - - [16384, 400, 1, 4096]
    - [441, 6087.28]
  - - [256, 2368, 1, 256]
    - [432, 4766.35]
  - - [448, 4288, 1, 3328]
    - [439, 7577.08]
  - - [2368, 1408, 1, 256]
    - [435, 5284.53]
  - - [5888, 5056, 1, 128]
    - [422, 3643.6]
  - - [704, 2368, 1, 256]
    - [437, 5334.73]
  - - [1024, 24000, 1, 2560]
    - [445, 7438.06]
  - - [2944, 448, 1, 1280]
    - [446, 4937.53]
  - - [5888, 2368, 1, 3328]
    - [431, 8201.84]
  - - [5124, 9124, 1, 1760]
    - [438, 6764.06]
  - - [448, 1408, 1, 1280]
    - [432, 5881.54]
  - - [448, 1856, 1, 1280]
    - [439, 6225.56]
  - - [4288, 448, 1, 1280]
    - [441, 5626.37]
  - - [5888, 704, 1, 3328]
    - [435, 7873.62]
  - - [5056, 256, 1, 128]
    - [426, 2921.03]
  - - [1856, 256, 1, 128]
    - [428, 1995.42]
  - - [64, 1408, 1, 128]
    - [349, 758.938]
  - - [704, 4, 1, 256]
    - [390, 130.697]
  - - [1408, 5888, 1, 128]
    - [421, 4574.05]
  - - [7680, 12000, 1, 2560]
    - [437, 8747.13]
  - - [1408, 1024, 1, 256]
    - [434, 4609.23]
  - - [8192, 400, 1, 2048]
    - [446, 5283.25]
  - - [1024, 1856, 1, 128]
    - [421, 2686.38]
  - - [256, 704, 1, 128]
    - [421, 1004.83]
  - - [2560, 128, 1, 2560]
    - [399, 4259.14]
  - - [448, 1024, 1, 256]
    - [432, 4813.24]
  - - [128, 4, 1, 3328]
    - [458, 128.408]
  - - [5056, 6784, 1, 1280]
    - [440, 6579.85]
  - - [1408, 64, 1, 128]
    - [362, 819.3]
  - - [1024, 448, 1, 1280]
    - [441, 5703.31]
  - - [704, 5056, 1, 3328]
    - [433, 7574.49]
  - - [128, 5056, 1, 256]
    - [432, 5113.53]
  - - [64, 1024, 1, 3328]
    - [417, 3980.1]
  - - [1856, 4, 1, 3328]
    - [371, 433.253]
  - - [4, 2944, 1, 128]
    - [453, 46.6225]
  - - [2368, 2944, 1, 3328]
    - [431, 9002.13]
  - - [448, 448, 1, 1280]
    - [373, 3969.52]
  - - [2368, 3584, 1, 256]
    - [443, 7806.39]
  - - [5056, 3584, 1, 1280]
    - [430, 8971.56]
  - - [5124, 9124, 1, 4096]
    - [443, 7208.72]
  - - [7680, 48000, 1, 2560]
    - [437, 3835.91]
  - - [448, 4, 1, 3328]
    - [458, 409.7]
  - - [1856, 2944, 1, 1280]
    - [430, 7173.71]
  - - [1024, 48000, 1, 2816]
    - [437, 8976.26]
  - - [128, 1024, 1, 256]
    - [376, 1969.26]
  - - [2944, 1408, 1, 256]
    - [439, 4585.12]
  - - [4288, 1408, 1, 3328]
    - [433, 8237.27]
  - - [3584, 64, 1, 3328]
    - [379, 5183.16]
  - - [5888, 2944, 1, 128]
    - [428, 3674.56]
  - - [2944, 1024, 1, 128]
    - [425, 3834.32]
  - - [4288, 5056, 1, 1280]
    - [437, 8086.1]
  - - [5888, 6784, 1, 1280]
    - [431, 6941.32]
  - - [6784, 5056, 1, 128]
    - [422, 4860.15]
  - - [256, 1024, 1, 3328]
    - [446, 5156.22]
  - - [3584, 4, 1, 256]
    - [390, 332.529]
  - - [1760, 1600, 1, 1760]
    - [433, 6330.76]
  - - [1856, 64, 1, 3328]
    - [394, 4756.03]
  - - [4, 128, 1, 3328]
    - [458, 160.244]
  - - [5888, 1408, 1, 3328]
    - [431, 8722.74]
  - - [448, 2944, 1, 128]
    - [424, 2997.63]
  - - [2368, 1856, 1, 256]
    - [432, 6662.34]
  - - [256, 5056, 1, 256]
    - [434, 5256.29]
  - - [128, 3584, 1, 128]
    - [353, 2073.56]
  - - [448, 3584, 1, 3328]
    - [430, 6833.96]
  - - [4, 5056, 1, 3328]
    - [400, 581.523]
  - - [704, 2368, 1, 128]
    - [421, 3402.29]
  - - [5888, 256, 1, 128]
    - [426, 2977.54]
  - - [4, 5056, 1, 128]
    - [452, 65.2074]
  - - [448, 256, 1, 256]
    - [438, 1764.53]
  - - [704, 4, 1, 3328]
    - [390, 398.554]
  - - [1408, 256, 1, 256]
    - [433, 3463.86]
  - - [3584, 1856, 1, 128]
    - [429, 3228.19]
  - - [4288, 4288, 1, 128]
    - [425, 4853.93]
  - - [1856, 1024, 1, 3328]
    - [449, 5994.68]
  - - [128, 5888, 1, 3328]
    - [403, 6512.85]
  - - [1024, 5056, 1, 256]
    - [443, 7859.42]
  - - [5888, 5888, 1, 1280]
    - [443, 8131.44]
  - - [5056, 5888, 1, 128]
    - [422, 4920.71]
  - - [2368, 1408, 1, 3328]
    - [441, 7110.74]
  - - [1024, 48000, 1, 1536]
    - [441, 8590.82]
  - - [5888, 448, 1, 256]
    - [442, 3567.74]
  - - [2560, 3200, 1, 2560]
    - [432, 7638.31]
  - - [5888, 6784, 1, 128]
    - [422, 3910.92]
  - - [6144, 48000, 1, 2048]
    - [443, 3412.95]
  - - [6784, 5056, 1, 1280]
    - [434, 7890.22]
  - - [5056, 704, 1, 1280]
    - [438, 7665.06]
  - - [1024, 48000, 1, 2560]
    - [443, 8188.5]
  - - [4608, 32, 1, 1536]
    - [411, 2856.97]
  - - [1024, 2368, 1, 128]
    - [421, 3019.35]
  - - [128, 704, 1, 256]
    - [372, 1696.33]
  - - [2368, 448, 1, 3328]
    - [438, 5799.29]
  - - [128, 5888, 1, 1280]
    - [432, 6680.75]
  - - [16384, 800, 1, 4096]
    - [437, 6322.22]
  - - [448, 128, 1, 1280]
    - [411, 2849.49]
  - - [6784, 4, 1, 3328]
    - [390, 563.12]
  - - [5888, 5056, 1, 1280]
    - [437, 8631.33]
  - - [1024, 64, 1, 3328]
    - [412, 3481.96]
  - - [3072, 48000, 1, 1024]
    - [437, 9019.49]
  - - [64, 3584, 1, 1280]
    - [374, 4327.95]
  - - [6784, 1408, 1, 256]
    - [437, 6320.59]
  - - [3584, 5888, 1, 128]
    - [424, 4406.79]
  - - [5056, 5888, 1, 256]
    - [443, 8037.13]
  - - [2368, 1024, 1, 256]
    - [435, 4936.14]
  - - [2944, 1856, 1, 256]
    - [443, 7222.32]
  - - [1856, 6784, 1, 1280]
    - [433, 8251.81]
  - - [64, 5056, 1, 128]
    - [353, 1643.7]
  - - [64, 6784, 1, 128]
    - [351, 1929.77]
  - - [448, 704, 1, 128]
    - [423, 979.959]
  - - [4, 1024, 1, 128]
    - [452, 20.1416]
  - - [4288, 3584, 1, 256]
    - [437, 8444.14]
  - - [1408, 704, 1, 128]
    - [421, 3021.0]
  - - [64, 256, 1, 3328]
    - [417, 2227.47]
  - - [6784, 448, 1, 3328]
    - [443, 6573.11]
  - - [5056, 1856, 1, 1280]
    - [435, 7976.23]
  - - [1408, 1024, 1, 3328]
    - [433, 7470.33]
  - - [2368, 256, 1, 3328]
    - [438, 5394.37]
  - - [5888, 3584, 1, 1280]
    - [430, 9031.55]
  - - [1856, 3584, 1, 3328]
    - [445, 7272.6]
  - - [5888, 128, 1, 1280]
    - [438, 6684.48]
  - - [1024, 2944, 1, 256]
    - [443, 7415.09]
  - - [448, 6784, 1, 1280]
    - [439, 7923.78]
  - - [256, 3584, 1, 1280]
    - [435, 6901.87]
  - - [704, 5056, 1, 256]
    - [440, 5004.55]
  - - [3584, 1024, 1, 3328]
    - [432, 7894.63]
  - - [2944, 1856, 1, 1280]
    - [437, 7903.27]
  - - [128, 256, 1, 128]
    - [350, 325.745]
  - - [5056, 256, 1, 256]
    - [434, 3356.56]
  - - [2944, 4288, 1, 3328]
    - [443, 7813.93]
  - - [2368, 3584, 1, 3328]
    - [443, 8371.09]
  - - [2944, 704, 1, 1280]
    - [449, 5514.09]
  - - [128, 4, 1, 256]
    - [390, 25.3062]
  - - [2944, 3584, 1, 1280]
    - [437, 7738.83]
  - - [1856, 5888, 1, 1280]
    - [431, 8584.63]
  - - [256, 256, 1, 1280]
    - [411, 2962.18]
  - - [2048, 3200, 1, 2048]
    - [439, 6911.69]
  - - [4288, 1408, 1, 256]
    - [437, 7954.0]
  - - [3584, 64, 1, 256]
    - [438, 2780.42]
  - - [64, 1856, 1, 3328]
    - [373, 4912.04]
  - - [256, 1408, 1, 128]
    - [421, 1373.24]
  - - [5888, 1408, 1, 128]
    - [426, 4242.01]
  - - [4288, 2368, 1, 1280]
    - [435, 8012.7]
  - - [4, 4288, 1, 256]
    - [456, 301.674]
  - - [256, 4288, 1, 128]
    - [421, 2706.36]
  - - [2048, 128, 1, 2048]
    - [416, 2885.26]
  - - [256, 128, 1, 3328]
    - [418, 3170.21]
  - - [512, 8, 1, 500000]
    - [342, 1915.12]
  - - [6784, 2368, 1, 256]
    - [437, 8323.66]
  - - [5888, 128, 1, 128]
    - [425, 2466.08]
  - - [1024, 24000, 1, 2816]
    - [435, 8131.64]
  - - [7680, 5984, 1, 2560]
    - [439, 6040.77]
  - - [4288, 1856, 1, 256]
    - [451, 5818.53]
  - - [1856, 256, 1, 3328]
    - [432, 6532.03]
  - - [1856, 2944, 1, 256]
    - [437, 7312.92]
  - - [5056, 1024, 1, 128]
    - [427, 4103.0]
  - - [64, 5888, 1, 1280]
    - [432, 5058.25]
  - - [1760, 800, 1, 1760]
    - [435, 7280.0]
  - - [6784, 256, 1, 128]
    - [425, 3257.69]
  - - [5888, 704, 1, 128]
    - [421, 3813.93]
  - - [1408, 2368, 1, 128]
    - [422, 3561.27]
  - - [1024, 4288, 1, 1280]
    - [441, 7752.74]
  - - [2368, 5056, 1, 3328]
    - [444, 7711.91]
  - - [448, 4, 1, 128]
    - [452, 18.4795]
  - - [4, 256, 1, 3328]
    - [459, 269.71]
  - - [4288, 1024, 1, 3328]
    - [438, 7910.27]
  - - [6144, 48000, 1, 2560]
    - [437, 3541.09]
  - - [1024, 5056, 1, 3328]
    - [431, 8509.66]
  - - [1024, 1856, 1, 3328]
    - [437, 7907.93]
  - - [704, 704, 1, 1280]
    - [449, 5648.15]
  - - [128, 2368, 1, 1280]
    - [408, 4145.11]
  - - [1408, 128, 1, 3328]
    - [381, 4919.6]
  - - [3584, 256, 1, 1280]
    - [433, 5185.56]
  - - [4, 128, 1, 128]
    - [452, 3.07891]
  - - [5888, 64, 1, 1280]
    - [381, 4499.59]
  - - [3584, 128, 1, 1280]
    - [438, 5929.01]
  - - [4, 256, 1, 1280]
    - [457, 170.767]
  - - [128, 704, 1, 3328]
    - [381, 4379.37]
  - - [4288, 6784, 1, 256]
    - [431, 7181.09]
  - - [3584, 2944, 1, 3328]
    - [437, 8553.3]
  - - [128, 1856, 1, 256]
    - [438, 3207.77]
  - - [64, 4288, 1, 256]
    - [432, 2907.99]
  - - [4, 3584, 1, 3328]
    - [390, 560.605]
  - - [64, 4, 1, 3328]
    - [459, 67.5025]
  - - [4, 64, 1, 3328]
    - [459, 88.8467]
  - - [5888, 2944, 1, 256]
    - [437, 7255.77]
  - - [1856, 64, 1, 256]
    - [383, 1743.72]
  - - [5056, 128, 1, 1280]
    - [438, 6009.79]
  - - [448, 4288, 1, 1280]
    - [439, 6466.82]
  - - [448, 1856, 1, 3328]
    - [439, 6381.99]
  - - [1024, 4288, 1, 128]
    - [424, 3491.87]
  - - [4, 1024, 1, 256]
    - [457, 172.563]
  - - [5056, 4288, 1, 256]
    - [437, 8241.52]
  - - [1024, 448, 1, 256]
    - [441, 4218.51]
  - - [1024, 3584, 1, 256]
    - [437, 6513.69]
  - - [2944, 128, 1, 1280]
    - [381, 4710.48]
  - - [2048, 32, 1, 2048]
    - [396, 1779.23]
  - - [64, 256, 1, 256]
    - [390, 655.46]
  - - [1408, 4, 1, 128]
    - [453, 20.1249]
  - - [128, 2368, 1, 128]
    - [353, 1707.73]
  - - [256, 704, 1, 1280]
    - [432, 3735.31]
  - - [64, 2368, 1, 128]
    - [360, 1049.81]
  - - [6784, 6784, 1, 3328]
    - [437, 9277.94]
  - - [448, 5888, 1, 1280]
    - [443, 7319.75]
  - - [5056, 448, 1, 128]
    - [425, 3694.43]
  - - [4288, 704, 1, 1280]
    - [435, 7890.96]
  - - [3584, 2944, 1, 128]
    - [427, 4124.71]
  - - [6784, 256, 1, 1280]
    - [443, 7185.83]
  - - [256, 2944, 1, 1280]
    - [432, 6736.76]
  - - [64, 4288, 1, 128]
    - [351, 1614.41]
  - - [2368, 5888, 1, 3328]
    - [433, 8616.46]
  - - [4, 64, 1, 256]
    - [370, 11.4778]
  - - [704, 1024, 1, 3328]
    - [438, 6801.92]
  - - [2368, 1856, 1, 1280]
    - [435, 7853.57]
  - - [448, 5056, 1, 3328]
    - [438, 7453.04]
  - - [128, 448, 1, 128]
    - [353, 530.449]
  - - [128, 6784, 1, 256]
    - [433, 5557.55]
  - - [3584, 4288, 1, 128]
    - [424, 4462.73]
  - - [64, 448, 1, 128]
    - [353, 278.132]
  - - [5888, 4288, 1, 3328]
    - [430, 9153.55]
  - - [2368, 704, 1, 256]
    - [437, 5350.78]
  - - [256, 1856, 1, 3328]
    - [432, 6536.35]
  - - [1856, 128, 1, 256]
    - [446, 2847.36]
  - - [6784, 128, 1, 128]
    - [426, 2530.82]
  - - [3584, 1408, 1, 128]
    - [427, 3625.62]
  - - [1856, 5056, 1, 1280]
    - [433, 8123.39]
  - - [2944, 1024, 1, 1280]
    - [443, 8450.41]
  - - [5056, 4, 1, 256]
    - [457, 380.787]
  - - [3584, 5888, 1, 3328]
    - [435, 8567.99]
  - - [2368, 4288, 1, 256]
    - [439, 7858.07]
  - - [1024, 2368, 1, 3328]
    - [433, 6776.45]
  - - [64, 704, 1, 3328]
    - [388, 3503.52]
  - - [704, 1408, 1, 256]
    - [433, 6099.99]
  - - [4096, 128, 1, 4096]
    - [413, 4116.57]
  - - [1024, 3584, 1, 1280]
    - [443, 7231.65]
  - - [4288, 5888, 1, 3328]
    - [437, 8762.42]
  - - [4288, 4, 1, 1280]
    - [390, 492.797]
  - - [4608, 16, 1, 1536]
    - [391, 1892.58]
  - - [5888, 64, 1, 128]
    - [368, 1747.73]
  - - [4, 5888, 1, 128]
    - [453, 84.5915]
  - - [1024, 2944, 1, 3328]
    - [441, 6907.05]
  - - [6784, 1856, 1, 256]
    - [437, 6274.07]
  - - [2048, 64, 1, 2048]
    - [420, 2371.44]
  - - [256, 6784, 1, 1280]
    - [437, 7067.04]
  - - [1856, 3584, 1, 256]
    - [443, 7706.87]
  - - [128, 448, 1, 3328]
    - [388, 3995.93]
  - - [6784, 1856, 1, 128]
    - [425, 4459.09]
  - - [4, 448, 1, 256]
    - [390, 84.4294]
  - - [5056, 128, 1, 256]
    - [438, 4954.5]
  - - [512, 24000, 1, 2816]
    - [431, 8994.98]
  - - [256, 5888, 1, 1280]
    - [430, 6184.0]
  - - [4, 128, 1, 1280]
    - [458, 71.9597]
  - - [16384, 1600, 1, 4096]
    - [437, 6921.09]
  - - [6784, 128, 1, 1280]
    - [441, 6486.37]
  - - [64, 1408, 1, 256]
    - [378, 1647.86]
  - - [2368, 1408, 1, 128]
    - [425, 3937.1]
  - - [1856, 448, 1, 256]
    - [438, 4635.57]
  - - [1408, 1024, 1, 128]
    - [421, 3208.51]
  - - [128, 64, 1, 128]
    - [350, 70.192]
  - - [6784, 3584, 1, 3328]
    - [443, 8466.28]
  - - [1760, 7000, 1, 1760]
    - [441, 8149.21]
  - - [2944, 64, 1, 3328]
    - [374, 5018.09]
  - - [64, 64, 1, 128]
    - [350, 35.5249]
  - - [2368, 5056, 1, 1280]
    - [437, 8764.0]
  - - [64, 4, 1, 1280]
    - [459, 43.6745]
  - - [1408, 2368, 1, 1280]
    - [438, 7660.38]
  - - [128, 1408, 1, 1280]
    - [373, 4185.27]
  - - [256, 64, 1, 3328]
    - [398, 2071.75]
  - - [704, 4288, 1, 128]
    - [421, 4069.18]
  - - [128, 1856, 1, 3328]
    - [404, 5776.15]
  - - [2944, 2944, 1, 256]
    - [443, 7949.31]
  - - [2944, 4, 1, 1280]
    - [390, 483.218]
  - - [5888, 4, 1, 256]
    - [375, 396.765]
  - - [6784, 256, 1, 256]
    - [449, 4044.83]
  - - [256, 5056, 1, 3328]
    - [432, 7607.37]
  - - [128, 4288, 1, 1280]
    - [373, 4958.78]
  - - [5056, 1856, 1, 128]
    - [425, 4560.94]
  - - [5056, 1024, 1, 3328]
    - [437, 8634.18]
  - - [128, 128, 1, 256]
    - [375, 699.151]
  - - [1760, 64, 1, 1760]
    - [381, 4580.65]
  - - [4288, 3584, 1, 3328]
    - [443, 9143.76]
  - - [448, 704, 1, 3328]
    - [432, 4473.43]
  - - [448, 448, 1, 128]
    - [363, 1264.38]
  - - [1024, 2368, 1, 1280]
    - [441, 7452.51]
  - - [1856, 704, 1, 3328]
    - [432, 6103.34]
  - - [4, 2368, 1, 128]
    - [452, 96.019]
  - - [5888, 6784, 1, 3328]
    - [437, 9131.74]
  - - [704, 4288, 1, 1280]
    - [439, 7906.46]
  - - [704, 256, 1, 256]
    - [432, 2772.78]
  - - [1024, 48000, 1, 2048]
    - [436, 6513.45]
  - - [4288, 1024, 1, 128]
    - [421, 4291.77]
  - - [512, 2048, 1, 49]
    - [467, 4555.08]
  - - [512, 128, 1, 784]
    - [460, 3195.39]
  - - [2048, 512, 1, 49]
    - [468, 4253.43]
  - - [1024, 256, 1, 196]
    - [464, 4039.43]
  - - [256, 64, 1, 3136]
    - [462, 3015.37]
  - - [256, 1024, 1, 196]
    - [466, 4225.45]
  - - [64, 256, 1, 3136]
    - [463, 3058.45]
  - - [128, 512, 1, 784]
    - [461, 3380.38]
  - - [64, 64, 1, 3136]
    - [465, 1372.44]
  - - [1024, 1024, 1, 3328]
    - [578, 8705.1]
  - - [2048, 200, 1, 3200]
    - [583, 6173.42]
  - - [1024, 200, 1, 13312]
    - [481, 5213.31]
  - - [1024, 256, 1, 1536]
    - [583, 5859.43]
  - - [4096, 256, 1, 12288]
    - [588, 8807.52]
  - - [64, 200, 1, 1024]
    - [555, 366.632]
  - - [32, 512, 1, 1024]
    - [510, 453.049]
  - - [2048, 256, 1, 3328]
    - [572, 7876.73]
  - - [4096, 512, 1, 32]
    - [576, 3975.74]
  - - [2048, 256, 1, 13312]
    - [553, 7837.81]
  - - [4096, 200, 1, 11264]
    - [588, 6902.76]
  - - [2048, 512, 1, 1024]
    - [582, 8100.14]
  - - [2048, 1024, 1, 1664]
    - [482, 9082.08]
  - - [1024, 1024, 1, 64]
    - [578, 4258.28]
  - - [512, 1024, 1, 1536]
    - [572, 7597.33]
  - - [1024, 256, 1, 15360]
    - [473, 6735.24]
  - - [1, 512, 1, 1024]
    - [523, 15.1657]
  - - [4096, 512, 1, 1408]
    - [485, 9024.52]
  - - [1024, 200, 1, 1408]
    - [583, 4461.09]
  - - [1024, 512, 1, 512]
    - [577, 6528.2]
  - - [4096, 256, 1, 15360]
    - [584, 8824.03]
  - - [2048, 512, 1, 640]
    - [574, 7989.25]
  - - [4096, 1024, 1, 1280]
    - [480, 9421.54]
  - - [1024, 200, 1, 6144]
    - [572, 4966.52]
  - - [1024, 1024, 1, 512]
    - [574, 7731.54]
  - - [128, 512, 1, 2048]
    - [490, 2190.34]
  - - [2048, 1024, 1, 640]
    - [480, 8581.8]
  - - [1024, 256, 1, 3328]
    - [572, 6192.71]
  - - [4096, 1024, 1, 13312]
    - [485, 9642.59]
  - - [2048, 256, 1, 2048]
    - [572, 7485.75]
  - - [2048, 1024, 1, 13312]
    - [485, 9352.26]
  - - [2048, 512, 1, 16640]
    - [573, 8839.17]
  - - [1024, 512, 1, 128]
    - [577, 4280.0]
  - - [2048, 1024, 1, 3584]
    - [480, 9264.72]
  - - [2048, 512, 1, 256]
    - [588, 6990.61]
  - - [512, 256, 1, 3200]
    - [535, 4154.52]
  - - [4096, 1024, 1, 1920]
    - [480, 9535.32]
  - - [4096, 200, 1, 2560]
    - [585, 6754.65]
  - - [1024, 256, 1, 16384]
    - [475, 6289.6]
  - - [1024, 1024, 1, 1152]
    - [578, 8407.39]
  - - [2048, 200, 1, 32]
    - [521, 1412.51]
  - - [512, 1024, 1, 2816]
    - [572, 7843.25]
  - - [4096, 256, 1, 14336]
    - [584, 8844.77]
  - - [1024, 200, 1, 4608]
    - [583, 4931.74]
  - - [1024, 200, 1, 16384]
    - [478, 5135.15]
  - - [64, 256, 1, 1024]
    - [556, 461.013]
  - - [1, 200, 1, 1024]
    - [538, 7.49884]
  - - [2048, 200, 1, 2080]
    - [583, 6033.87]
  - - [512, 256, 1, 1792]
    - [493, 3153.71]
  - - [2048, 200, 1, 1024]
    - [583, 5711.3]
  - - [4096, 1024, 1, 12288]
    - [480, 9658.23]
  - - [4096, 200, 1, 4096]
    - [574, 6834.55]
  - - [1024, 512, 1, 11264]
    - [541, 7686.46]
  - - [128, 512, 1, 1024]
    - [511, 1458.99]
  - - [32, 256, 1, 2048]
    - [529, 384.899]
  - - [1024, 200, 1, 1792]
    - [583, 4638.64]
  - - [1024, 1024, 1, 1792]
    - [578, 8550.56]
  - - [32, 256, 1, 512]
    - [562, 161.419]
  - - [512, 200, 1, 2816]
    - [488, 3353.1]
  - - [512, 200, 1, 3072]
    - [473, 3298.89]
  - - [1024, 1024, 1, 8192]
    - [519, 8369.1]
  - - [1024, 256, 1, 12288]
    - [476, 6475.71]
  - - [4096, 200, 1, 768]
    - [578, 6367.97]
  - - [1024, 512, 1, 16384]
    - [594, 7367.12]
  - - [4096, 256, 1, 1024]
    - [574, 8214.16]
  - - [1024, 512, 1, 256]
    - [577, 5537.13]
  - - [4096, 1024, 1, 8320]
    - [480, 9674.26]
  - - [4096, 256, 1, 9216]
    - [582, 8791.02]
  - - [1024, 512, 1, 1408]
    - [572, 7459.65]
  - - [1024, 512, 1, 5632]
    - [583, 7997.91]
  - - [4096, 200, 1, 256]
    - [588, 5371.9]
  - - [1024, 200, 1, 128]
    - [566, 1998.15]
  - - [256, 200, 1, 1024]
    - [535, 1196.01]
  - - [1024, 200, 1, 5120]
    - [583, 4957.44]
  - - [512, 1024, 1, 3072]
    - [596, 7104.07]
  - - [4096, 1024, 1, 15360]
    - [480, 9669.04]
  - - [1, 256, 1, 2048]
    - [522, 13.9262]
  - - [1024, 1024, 1, 4160]
    - [574, 8759.3]
  - - [1024, 256, 1, 256]
    - [581, 3728.37]
  - - [2048, 256, 1, 384]
    - [583, 6123.17]
  - - [512, 256, 1, 2560]
    - [537, 3809.64]
  - - [4096, 512, 1, 3072]
    - [485, 9215.19]
  - - [1024, 256, 1, 4160]
    - [572, 6293.49]
  - - [4096, 512, 1, 13312]
    - [482, 9367.32]
  - - [4096, 1024, 1, 3840]
    - [480, 9631.57]
  - - [4096, 200, 1, 640]
    - [578, 6206.16]
  - - [32, 200, 1, 2048]
    - [516, 303.507]
  - - [1024, 200, 1, 512]
    - [572, 3713.19]
  - - [1024, 1024, 1, 7168]
    - [575, 8475.74]
  - - [2048, 1024, 1, 3200]
    - [480, 9271.34]
  - - [512, 512, 1, 1536]
    - [583, 5832.27]
  - - [4096, 256, 1, 768]
    - [588, 8066.07]
