library/src/blas3/Tensile/Logic/asm_full/arcturus_Cijk_Alik_Bljk_BBH.yaml
- {MinimumRequiredVersion: 4.12.0}
- arcturus
- gfx908
- [Device 7380, Device 7388, Device 738c]
    SolutionIndex: 0
    SolutionNameMin: Cijk_Alik_Bljk_BBH_MT128x32x16_SE_
    SolutionIndex: 1
    SolutionNameMin: Cijk_Alik_Bljk_BBH_MT128x64x16_SE_
    SolutionIndex: 2
    SolutionNameMin: Cijk_Alik_Bljk_BBH_MT32x128x16_SE_
    SolutionIndex: 3
    SolutionNameMin: Cijk_Alik_Bljk_BBH_MT64x128x16_SE_
    SolutionIndex: 4
    SolutionNameMin: Cijk_Alik_Bljk_BBH_MT256x128x16_SE_
    SolutionIndex: 5
    SolutionNameMin: Cijk_Alik_Bljk_BBH_MT64x128x32_SE_
    SolutionIndex: 6
    SolutionNameMin: Cijk_Alik_Bljk_BBH_MT64x16x16_SE_
    SolutionIndex: 7
    SolutionNameMin: Cijk_Alik_Bljk_BBH_MT32x32x32_SE_
- - - [959, 1024, 1, 1024]
    - [3, 1055.49]
  - - [960, 1023, 1, 1024]
    - [3, 1071.67]
  - - [960, 1024, 1, 1023]
    - [3, 1069.84]
  - - [960, 1024, 1, 1025]
    - [3, 1077.07]
  - - [960, 1025, 1, 1024]
    - [2, 822.52]
  - - [961, 1024, 1, 1024]
    - [2, 813.489]
  - - [1023, 1024, 1, 1024]
    - [0, 865.973]
  - - [1024, 1023, 1, 1024]
    - [0, 865.805]
  - - [1024, 1024, 1, 1023]
    - [2, 866.42]
  - - [1024, 1024, 1, 1025]
    - [0, 865.43]
  - - [1024, 1025, 1, 1024]
    - [0, 866.658]
  - - [1025, 1024, 1, 1024]
    - [0, 866.155]
  - - [2039, 2048, 1, 2048]
    - [1, 1376.9]
  - - [2040, 2047, 1, 2048]
    - [1, 1378.17]
  - - [2040, 2048, 1, 2047]
    - [1, 1372.13]
  - - [2040, 2048, 1, 2049]
    - [1, 1387.02]
  - - [2040, 2049, 1, 2048]
    - [1, 1380.06]
  - - [2041, 2048, 1, 2048]
    - [1, 1379.05]
  - - [2047, 2048, 1, 2048]
    - [1, 1384.61]
  - - [2048, 2047, 1, 2048]
    - [1, 1383.95]
  - - [2048, 2048, 1, 2047]
    - [1, 1374.29]
  - - [2048, 2048, 1, 2049]
    - [1, 1391.34]
  - - [2048, 2049, 1, 2048]
    - [1, 1384.69]
  - - [2049, 2048, 1, 2048]
    - [1, 1383.0]
  - - [2999, 3072, 1, 3072]
    - [1, 1614.3]
  - - [3000, 3071, 1, 3072]
    - [1, 1614.82]
  - - [3000, 3072, 1, 3071]
    - [1, 1600.23]
  - - [3000, 3072, 1, 3073]
    - [1, 1608.61]
  - - [3000, 3073, 1, 3072]
    - [1, 1614.31]
  - - [3001, 3072, 1, 3072]
    - [1, 1616.45]
  - - [3071, 3072, 1, 3072]
    - [1, 1651.37]
  - - [3072, 3071, 1, 3072]
    - [1, 1652.19]
  - - [3072, 3072, 1, 3071]
    - [1, 1636.33]
  - - [3072, 3072, 1, 3073]
    - [1, 1645.1]
  - - [3072, 3073, 1, 3072]
    - [1, 1651.42]
  - - [3073, 3072, 1, 3072]
    - [1, 1652.4]
  - - [4079, 4096, 1, 4096]
    - [1, 1600.96]
  - - [4080, 4095, 1, 4096]
    - [1, 1600.47]
  - - [4080, 4096, 1, 4095]
    - [4, 1604.11]
  - - [4080, 4096, 1, 4097]
    - [1, 1621.16]
  - - [4080, 4097, 1, 4096]
    - [1, 1602.61]
  - - [4081, 4096, 1, 4096]
    - [1, 1599.52]
  - - [4095, 4096, 1, 4096]
    - [1, 1604.71]
  - - [4096, 4095, 1, 4096]
    - [1, 1604.32]
  - - [4096, 4096, 1, 4095]
    - [4, 1609.64]
  - - [4096, 4096, 1, 4097]
    - [1, 1625.9]
  - - [4096, 4097, 1, 4096]
    - [1, 1605.8]
  - - [4097, 4096, 1, 4096]
    - [1, 1603.85]
  - - [960, 1024, 1, 1024]
    - [5, 9007.14]
  - - [1024, 1024, 1, 1024]
    - [5, 7604.43]
  - - [2040, 2048, 1, 2048]
    - [5, 11066.3]
  - - [2048, 2048, 1, 2048]
    - [5, 14117.1]
  - - [3000, 3072, 1, 3072]
    - [5, 12651.4]
  - - [3072, 3072, 1, 3072]
    - [5, 12416.1]
  - - [4080, 4096, 1, 4096]
    - [5, 16848.0]
  - - [4096, 4096, 1, 4096]
    - [5, 16911.1]
  - - [63, 1024, 1, 1024]
    - [6, 111.559]
  - - [64, 1023, 1, 1024]
    - [6, 113.219]
  - - [64, 1024, 1, 1023]
    - [6, 114.051]
  - - [64, 1024, 1, 1025]
    - [6, 114.243]
  - - [64, 1025, 1, 1024]
    - [6, 112.937]
  - - [65, 1024, 1, 1024]
    - [6, 109.143]
  - - [64, 1024, 1, 1024]
    - [7, 1762.34]
- null
