library/src/blas3/Tensile/Logic/asm_full/arcturus_Cijk_Alik_Bjlk_SB_GB.yaml
- {MinimumRequiredVersion: 4.26.0}
- arcturus
- gfx908
- [Device 7380, Device 7388, Device 738c, Device 7390]
    SolutionIndex: 0
    SolutionNameMin: Cijk_Alik_Bjlk_SB_GB_MT32x32x16_MI16x16x4x1_SN_1LDSB0_EPS1_GRVW1_LPA2_NLCB1_PGR1_PLR5_SRVW2_TT1_16_WG32_8_1_WGM1
    SolutionIndex: 1
    SolutionNameMin: Cijk_Alik_Bjlk_SB_GB_MT64x32x16_MI16x16x4x1_SN_1LDSB0_EPS1_GRVW1_LPA2_NLCB1_PGR1_PLR5_SRVW2_TT2_16_WG32_8_1_WGM1
    SolutionIndex: 2
    SolutionNameMin: Cijk_Alik_Bjlk_SB_GB_MT32x32x16_MI16x16x4x1_SN_1LDSB0_EPS0_GRVW1_LPA2_NLCB1_PGR2_PLR5_SRVW2_TT1_16_WG32_8_1_WGM1
    SolutionIndex: 3
    SolutionNameMin: Cijk_Alik_Bjlk_SB_GB_MT64x32x16_MI16x16x4x1_SN_1LDSB0_EPS0_GRVW1_LPA2_NLCB1_PGR2_PLR5_SRVW2_TT2_16_WG32_8_1_WGM1
    SolutionIndex: 4
    SolutionNameMin: Cijk_Alik_Bjlk_SB_GB_MT64x128x16_MI32x32x2x1_SN_1LDSB0_EPS1_GRVW1_LPA2_NLCB2_PGR1_PLR9_SRVW2_TT1_64_WG64_4_1_WGM1
    SolutionIndex: 5
    SolutionNameMin: Cijk_Alik_Bjlk_SB_GB_MT64x128x16_MI32x32x2x1_SN_1LDSB0_EPS0_GRVW1_LPA2_NLCB2_PGR2_PLR9_SRVW2_TT1_64_WG64_4_1_WGM1
    SolutionIndex: 6
    SolutionNameMin: Cijk_Alik_Bjlk_SB_GB_MT32x32x32_MI16x16x4x1_SN_1LDSB0_EPS1_GRVW1_LPA2_NLCB1_PGR1_PLR9_SRVW2_TT1_16_WG32_8_1_WGM1
    SolutionIndex: 7
    SolutionNameMin: Cijk_Alik_Bjlk_SB_GB_MT32x32x32_MI16x16x4x1_SN_1LDSB0_EPS0_GRVW1_LPA2_NLCB1_PGR2_PLR9_SRVW2_TT1_16_WG32_8_1_WGM1
    SolutionIndex: 8
    SolutionNameMin: Cijk_Alik_Bjlk_SB_GB_MT64x32x32_MI16x16x4x1_SN_1LDSB0_EPS0_GRVW1_LPA2_NLCB1_PGR2_PLR9_SRVW2_TT2_16_WG32_8_1_WGM1
    SolutionIndex: 9
    SolutionNameMin: Cijk_Alik_Bjlk_SB_GB_MT32x32x16_MI16x16x4x1_SN_1LDSB0_EPS1_GRVW2_LPA2_NLCB1_PGR1_PLR5_SRVW2_TT1_16_WG32_8_1_WGM1
    SolutionIndex: 10
    SolutionNameMin: Cijk_Alik_Bjlk_SB_GB_MT64x32x16_MI16x16x4x1_SN_1LDSB0_EPS1_GRVW2_LPA2_NLCB1_PGR1_PLR5_SRVW2_TT2_16_WG32_8_1_WGM1
    SolutionIndex: 11
    SolutionNameMin: Cijk_Alik_Bjlk_SB_GB_MT32x32x16_MI16x16x4x1_SN_1LDSB0_EPS0_GRVW2_LPA2_NLCB1_PGR2_PLR5_SRVW2_TT1_16_WG32_8_1_WGM1
    SolutionIndex: 12
    SolutionNameMin: Cijk_Alik_Bjlk_SB_GB_MT64x32x16_MI16x16x4x1_SN_1LDSB0_EPS0_GRVW2_LPA2_NLCB1_PGR2_PLR5_SRVW2_TT2_16_WG32_8_1_WGM1
    SolutionIndex: 13
    SolutionNameMin: Cijk_Alik_Bjlk_SB_GB_MT64x128x16_MI32x32x2x1_SN_1LDSB0_EPS1_GRVW2_LPA2_NLCB1_PGR1_PLR9_SRVW2_TT1_64_WG64_4_1_WGM1
    SolutionIndex: 14
    SolutionNameMin: Cijk_Alik_Bjlk_SB_GB_MT64x64x16_MI32x32x2x1_SN_1LDSB0_EPS0_GRVW2_LPA2_NLCB1_PGR2_PLR9_SRVW2_TT1_32_WG64_4_1_WGM1
    SolutionIndex: 15
    SolutionNameMin: Cijk_Alik_Bjlk_SB_GB_MT64x128x16_MI32x32x2x1_SN_1LDSB0_EPS0_GRVW2_LPA2_NLCB1_PGR2_PLR9_SRVW2_TT1_64_WG64_4_1_WGM1
    SolutionIndex: 16
    SolutionNameMin: Cijk_Alik_Bjlk_SB_GB_MT32x32x32_MI16x16x4x1_SN_1LDSB0_EPS1_GRVW2_LPA2_NLCB1_PGR1_PLR9_SRVW2_TT1_16_WG32_8_1_WGM1
    SolutionIndex: 17
    SolutionNameMin: Cijk_Alik_Bjlk_SB_GB_MT32x32x32_MI16x16x4x1_SN_1LDSB0_EPS0_GRVW2_LPA2_NLCB1_PGR2_PLR9_SRVW2_TT1_16_WG32_8_1_WGM1
    SolutionIndex: 18
    SolutionNameMin: Cijk_Alik_Bjlk_SB_GB_MT32x32x16_MI16x16x4x1_SN_1LDSB0_EPS1_GRVW4_LPA4_NLCB1_PGR1_PLR5_SRVW2_TT1_16_WG32_8_1_WGM1
    SolutionIndex: 19
    SolutionNameMin: Cijk_Alik_Bjlk_SB_GB_MT32x64x16_MI16x16x4x1_SN_1LDSB0_EPS1_GRVW4_LPA4_NLCB1_PGR1_PLR5_SRVW2_TT1_32_WG32_8_1_WGM1
    SolutionIndex: 20
    SolutionNameMin: Cijk_Alik_Bjlk_SB_GB_MT64x32x16_MI16x16x4x1_SN_1LDSB0_EPS1_GRVW4_LPA4_NLCB1_PGR1_PLR5_SRVW2_TT2_16_WG32_8_1_WGM1
    SolutionIndex: 21
    SolutionNameMin: Cijk_Alik_Bjlk_SB_GB_MT32x32x16_MI16x16x4x1_SN_1LDSB0_EPS0_GRVW4_LPA4_NLCB1_PGR2_PLR5_SRVW2_TT1_16_WG32_8_1_WGM1
    SolutionIndex: 22
    SolutionNameMin: Cijk_Alik_Bjlk_SB_GB_MT64x32x16_MI16x16x4x1_SN_1LDSB0_EPS0_GRVW4_LPA4_NLCB1_PGR2_PLR5_SRVW2_TT2_16_WG32_8_1_WGM1
    SolutionIndex: 23
    SolutionNameMin: Cijk_Alik_Bjlk_SB_GB_MT64x128x16_MI32x32x2x1_SN_1LDSB0_EPS1_GRVW4_LPA4_NLCB1_PGR1_PLR9_SRVW2_TT1_64_WG64_4_1_WGM1
    SolutionIndex: 24
    SolutionNameMin: Cijk_Alik_Bjlk_SB_GB_MT64x64x16_MI32x32x2x1_SN_1LDSB0_EPS0_GRVW4_LPA4_NLCB1_PGR2_PLR9_SRVW2_TT1_32_WG64_4_1_WGM1
    SolutionIndex: 25
    SolutionNameMin: Cijk_Alik_Bjlk_SB_GB_MT64x128x16_MI32x32x2x1_SN_1LDSB0_EPS0_GRVW4_LPA4_NLCB1_PGR2_PLR9_SRVW2_TT1_64_WG64_4_1_WGM1
    SolutionIndex: 26
    SolutionNameMin: Cijk_Alik_Bjlk_SB_GB_MT32x32x32_MI16x16x4x1_SN_1LDSB0_EPS1_GRVW4_LPA4_NLCB1_PGR1_PLR9_SRVW2_TT1_16_WG32_8_1_WGM1
    SolutionIndex: 27
    SolutionNameMin: Cijk_Alik_Bjlk_SB_GB_MT64x32x32_MI16x16x4x1_SN_1LDSB0_EPS1_GRVW4_LPA4_NLCB1_PGR1_PLR9_SRVW2_TT2_16_WG32_8_1_WGM1
    SolutionIndex: 28
    SolutionNameMin: Cijk_Alik_Bjlk_SB_GB_MT32x32x32_MI16x16x4x1_SN_1LDSB0_EPS0_GRVW4_LPA4_NLCB1_PGR2_PLR9_SRVW2_TT1_16_WG32_8_1_WGM1
    SolutionIndex: 29
    SolutionNameMin: Cijk_Alik_Bjlk_SB_GB_MT64x32x32_MI16x16x4x1_SN_1LDSB0_EPS0_GRVW4_LPA4_NLCB1_PGR2_PLR9_SRVW2_TT2_16_WG32_8_1_WGM1
    SolutionIndex: 30
    SolutionNameMin: Cijk_Alik_Bjlk_SB_GB_MT64x64x32_MI32x32x2x1_SN_1LDSB0_EPS1_GRVW4_LPA4_NLCB1_PGR1_PLR17_SRVW2_TT1_32_WG64_4_1_WGM1
    SolutionIndex: 31
    SolutionNameMin: Cijk_Alik_Bjlk_SB_GB_MT64x64x32_MI32x32x2x1_SN_1LDSB0_EPS0_GRVW4_LPA4_NLCB1_PGR2_PLR17_SRVW2_TT1_32_WG64_4_1_WGM1
    SolutionIndex: 32
    SolutionNameMin: Cijk_Alik_Bjlk_SB_GB_MT64x32x16_MI16x16x4x1_SN_1LDSB0_EPS1_GRVW1_LPA2_NLCB1_PGR1_PLR5_SRVW2_TT2_16_WG32_8_1_WGM2
    SolutionIndex: 33
    SolutionNameMin: Cijk_Alik_Bjlk_SB_GB_MT32x32x16_MI16x16x4x1_SN_1LDSB0_EPS0_GRVW1_LPA2_NLCB1_PGR2_PLR5_SRVW2_TT1_16_WG32_8_1_WGM2
    SolutionIndex: 34
    SolutionNameMin: Cijk_Alik_Bjlk_SB_GB_MT64x32x16_MI16x16x4x1_SN_1LDSB0_EPS0_GRVW1_LPA2_NLCB1_PGR2_PLR5_SRVW2_TT2_16_WG32_8_1_WGM2
    SolutionIndex: 35
    SolutionNameMin: Cijk_Alik_Bjlk_SB_GB_MT64x128x16_MI32x32x2x1_SN_1LDSB0_EPS1_GRVW1_LPA2_NLCB2_PGR1_PLR9_SRVW2_TT1_64_WG64_4_1_WGM2
    SolutionIndex: 36
    SolutionNameMin: Cijk_Alik_Bjlk_SB_GB_MT64x128x16_MI32x32x2x1_SN_1LDSB0_EPS0_GRVW1_LPA2_NLCB2_PGR2_PLR9_SRVW2_TT1_64_WG64_4_1_WGM2
    SolutionIndex: 37
    SolutionNameMin: Cijk_Alik_Bjlk_SB_GB_MT32x32x32_MI16x16x4x1_SN_1LDSB0_EPS1_GRVW1_LPA2_NLCB1_PGR1_PLR9_SRVW2_TT1_16_WG32_8_1_WGM2
    SolutionIndex: 38
    SolutionNameMin: Cijk_Alik_Bjlk_SB_GB_MT32x32x16_MI16x16x4x1_SN_1LDSB0_EPS1_GRVW2_LPA2_NLCB1_PGR1_PLR5_SRVW2_TT1_16_WG32_8_1_WGM2
    SolutionIndex: 39
    SolutionNameMin: Cijk_Alik_Bjlk_SB_GB_MT64x32x16_MI16x16x4x1_SN_1LDSB0_EPS1_GRVW2_LPA2_NLCB1_PGR1_PLR5_SRVW2_TT2_16_WG32_8_1_WGM2
    SolutionIndex: 40
    SolutionNameMin: Cijk_Alik_Bjlk_SB_GB_MT32x32x16_MI16x16x4x1_SN_1LDSB0_EPS0_GRVW2_LPA2_NLCB1_PGR2_PLR5_SRVW2_TT1_16_WG32_8_1_WGM2
    SolutionIndex: 41
    SolutionNameMin: Cijk_Alik_Bjlk_SB_GB_MT64x32x16_MI16x16x4x1_SN_1LDSB0_EPS0_GRVW2_LPA2_NLCB1_PGR2_PLR5_SRVW2_TT2_16_WG32_8_1_WGM2
    SolutionIndex: 42
    SolutionNameMin: Cijk_Alik_Bjlk_SB_GB_MT64x128x16_MI32x32x2x1_SN_1LDSB0_EPS1_GRVW2_LPA2_NLCB1_PGR1_PLR9_SRVW2_TT1_64_WG64_4_1_WGM2
    SolutionIndex: 43
    SolutionNameMin: Cijk_Alik_Bjlk_SB_GB_MT64x64x16_MI32x32x2x1_SN_1LDSB0_EPS0_GRVW2_LPA2_NLCB1_PGR2_PLR9_SRVW2_TT1_32_WG64_4_1_WGM2
    SolutionIndex: 44
    SolutionNameMin: Cijk_Alik_Bjlk_SB_GB_MT64x128x16_MI32x32x2x1_SN_1LDSB0_EPS0_GRVW2_LPA2_NLCB1_PGR2_PLR9_SRVW2_TT1_64_WG64_4_1_WGM2
    SolutionIndex: 45
    SolutionNameMin: Cijk_Alik_Bjlk_SB_GB_MT32x32x32_MI16x16x4x1_SN_1LDSB0_EPS1_GRVW2_LPA2_NLCB1_PGR1_PLR9_SRVW2_TT1_16_WG32_8_1_WGM2
    SolutionIndex: 46
    SolutionNameMin: Cijk_Alik_Bjlk_SB_GB_MT32x32x32_MI16x16x4x1_SN_1LDSB0_EPS0_GRVW2_LPA2_NLCB1_PGR2_PLR9_SRVW2_TT1_16_WG32_8_1_WGM2
    SolutionIndex: 47
    SolutionNameMin: Cijk_Alik_Bjlk_SB_GB_MT32x32x16_MI16x16x4x1_SN_1LDSB0_EPS1_GRVW4_LPA4_NLCB1_PGR1_PLR5_SRVW2_TT1_16_WG32_8_1_WGM2
    SolutionIndex: 48
    SolutionNameMin: Cijk_Alik_Bjlk_SB_GB_MT32x32x16_MI16x16x4x1_SN_1LDSB0_EPS0_GRVW4_LPA4_NLCB1_PGR2_PLR5_SRVW2_TT1_16_WG32_8_1_WGM2
    SolutionIndex: 49
    SolutionNameMin: Cijk_Alik_Bjlk_SB_GB_MT64x32x16_MI16x16x4x1_SN_1LDSB0_EPS0_GRVW4_LPA4_NLCB1_PGR2_PLR5_SRVW2_TT2_16_WG32_8_1_WGM2
    SolutionIndex: 50
    SolutionNameMin: Cijk_Alik_Bjlk_SB_GB_MT64x64x16_MI32x32x2x1_SN_1LDSB0_EPS1_GRVW4_LPA4_NLCB1_PGR1_PLR9_SRVW2_TT1_32_WG64_4_1_WGM2
    SolutionIndex: 51
    SolutionNameMin: Cijk_Alik_Bjlk_SB_GB_MT64x128x16_MI32x32x2x1_SN_1LDSB0_EPS1_GRVW4_LPA4_NLCB1_PGR1_PLR9_SRVW2_TT1_64_WG64_4_1_WGM2
    SolutionIndex: 52
    SolutionNameMin: Cijk_Alik_Bjlk_SB_GB_MT64x64x16_MI32x32x2x1_SN_1LDSB0_EPS0_GRVW4_LPA4_NLCB1_PGR2_PLR9_SRVW2_TT1_32_WG64_4_1_WGM2
    SolutionIndex: 53
    SolutionNameMin: Cijk_Alik_Bjlk_SB_GB_MT64x128x16_MI32x32x2x1_SN_1LDSB0_EPS0_GRVW4_LPA4_NLCB1_PGR2_PLR9_SRVW2_TT1_64_WG64_4_1_WGM2
    SolutionIndex: 54
    SolutionNameMin: Cijk_Alik_Bjlk_SB_GB_MT32x32x32_MI16x16x4x1_SN_1LDSB0_EPS1_GRVW4_LPA4_NLCB1_PGR1_PLR9_SRVW2_TT1_16_WG32_8_1_WGM2
    SolutionIndex: 55
    SolutionNameMin: Cijk_Alik_Bjlk_SB_GB_MT64x32x32_MI16x16x4x1_SN_1LDSB0_EPS1_GRVW4_LPA4_NLCB1_PGR1_PLR9_SRVW2_TT2_16_WG32_8_1_WGM2
    SolutionIndex: 56
    SolutionNameMin: Cijk_Alik_Bjlk_SB_GB_MT32x32x32_MI16x16x4x1_SN_1LDSB0_EPS0_GRVW4_LPA4_NLCB1_PGR2_PLR9_SRVW2_TT1_16_WG32_8_1_WGM2
    SolutionIndex: 57
    SolutionNameMin: Cijk_Alik_Bjlk_SB_GB_MT64x32x32_MI16x16x4x1_SN_1LDSB0_EPS0_GRVW4_LPA4_NLCB1_PGR2_PLR9_SRVW2_TT2_16_WG32_8_1_WGM2
    SolutionIndex: 58
    SolutionNameMin: Cijk_Alik_Bjlk_SB_GB_MT64x64x32_MI32x32x2x1_SN_1LDSB0_EPS1_GRVW4_LPA4_NLCB1_PGR1_PLR17_SRVW2_TT1_32_WG64_4_1_WGM2
    SolutionIndex: 59
    SolutionNameMin: Cijk_Alik_Bjlk_SB_GB_MT64x128x32_MI32x32x2x1_SN_1LDSB0_EPS1_GRVW4_LPA4_NLCB1_PGR1_PLR17_SRVW2_TT1_64_WG64_4_1_WGM2
    SolutionIndex: 60
    SolutionNameMin: Cijk_Alik_Bjlk_SB_GB_MT64x32x16_MI16x16x4x1_SN_1LDSB0_EPS1_GRVW1_LPA2_NLCB1_PGR1_PLR5_SRVW2_TT2_16_WG32_8_1_WGM15
    SolutionIndex: 61
    SolutionNameMin: Cijk_Alik_Bjlk_SB_GB_MT32x32x16_MI16x16x4x1_SN_1LDSB0_EPS0_GRVW1_LPA2_NLCB1_PGR2_PLR5_SRVW2_TT1_16_WG32_8_1_WGM15
    SolutionIndex: 62
    SolutionNameMin: Cijk_Alik_Bjlk_SB_GB_MT64x32x16_MI16x16x4x1_SN_1LDSB0_EPS0_GRVW1_LPA2_NLCB1_PGR2_PLR5_SRVW2_TT2_16_WG32_8_1_WGM15
    SolutionIndex: 63
    SolutionNameMin: Cijk_Alik_Bjlk_SB_GB_MT64x128x16_MI32x32x2x1_SN_1LDSB0_EPS1_GRVW1_LPA2_NLCB2_PGR1_PLR9_SRVW2_TT1_64_WG64_4_1_WGM15
    SolutionIndex: 64
    SolutionNameMin: Cijk_Alik_Bjlk_SB_GB_MT64x128x16_MI32x32x2x1_SN_1LDSB0_EPS0_GRVW1_LPA2_NLCB2_PGR2_PLR9_SRVW2_TT1_64_WG64_4_1_WGM15
    SolutionIndex: 65
    SolutionNameMin: Cijk_Alik_Bjlk_SB_GB_MT32x32x32_MI16x16x4x1_SN_1LDSB0_EPS1_GRVW1_LPA2_NLCB1_PGR1_PLR9_SRVW2_TT1_16_WG32_8_1_WGM15
    SolutionIndex: 66
    SolutionNameMin: Cijk_Alik_Bjlk_SB_GB_MT32x32x32_MI16x16x4x1_SN_1LDSB0_EPS0_GRVW1_LPA2_NLCB1_PGR2_PLR9_SRVW2_TT1_16_WG32_8_1_WGM15
    SolutionIndex: 67
    SolutionNameMin: Cijk_Alik_Bjlk_SB_GB_MT32x32x16_MI16x16x4x1_SN_1LDSB0_EPS1_GRVW2_LPA2_NLCB1_PGR1_PLR5_SRVW2_TT1_16_WG32_8_1_WGM15
    SolutionIndex: 68
    SolutionNameMin: Cijk_Alik_Bjlk_SB_GB_MT64x32x16_MI16x16x4x1_SN_1LDSB0_EPS1_GRVW2_LPA2_NLCB1_PGR1_PLR5_SRVW2_TT2_16_WG32_8_1_WGM15
    SolutionIndex: 69
    SolutionNameMin: Cijk_Alik_Bjlk_SB_GB_MT64x128x16_MI32x32x2x1_SN_1LDSB0_EPS1_GRVW2_LPA2_NLCB1_PGR1_PLR9_SRVW2_TT1_64_WG64_4_1_WGM15
    SolutionIndex: 70
    SolutionNameMin: Cijk_Alik_Bjlk_SB_GB_MT64x64x16_MI32x32x2x1_SN_1LDSB0_EPS0_GRVW2_LPA2_NLCB1_PGR2_PLR9_SRVW2_TT1_32_WG64_4_1_WGM15
    SolutionIndex: 71
    SolutionNameMin: Cijk_Alik_Bjlk_SB_GB_MT64x128x16_MI32x32x2x1_SN_1LDSB0_EPS0_GRVW2_LPA2_NLCB1_PGR2_PLR9_SRVW2_TT1_64_WG64_4_1_WGM15
    SolutionIndex: 72
    SolutionNameMin: Cijk_Alik_Bjlk_SB_GB_MT32x32x32_MI16x16x4x1_SN_1LDSB0_EPS0_GRVW2_LPA2_NLCB1_PGR2_PLR9_SRVW2_TT1_16_WG32_8_1_WGM15
    SolutionIndex: 73
    SolutionNameMin: Cijk_Alik_Bjlk_SB_GB_MT64x32x16_MI16x16x4x1_SN_1LDSB0_EPS1_GRVW4_LPA4_NLCB1_PGR1_PLR5_SRVW2_TT2_16_WG32_8_1_WGM15
    SolutionIndex: 74
    SolutionNameMin: Cijk_Alik_Bjlk_SB_GB_MT32x32x16_MI16x16x4x1_SN_1LDSB0_EPS0_GRVW4_LPA4_NLCB1_PGR2_PLR5_SRVW2_TT1_16_WG32_8_1_WGM15
    SolutionIndex: 75
    SolutionNameMin: Cijk_Alik_Bjlk_SB_GB_MT64x32x16_MI16x16x4x1_SN_1LDSB0_EPS0_GRVW4_LPA4_NLCB1_PGR2_PLR5_SRVW2_TT2_16_WG32_8_1_WGM15
    SolutionIndex: 76
    SolutionNameMin: Cijk_Alik_Bjlk_SB_GB_MT64x128x16_MI32x32x2x1_SN_1LDSB0_EPS1_GRVW4_LPA4_NLCB1_PGR1_PLR9_SRVW2_TT1_64_WG64_4_1_WGM15
    SolutionIndex: 77
    SolutionNameMin: Cijk_Alik_Bjlk_SB_GB_MT64x64x16_MI32x32x2x1_SN_1LDSB0_EPS0_GRVW4_LPA4_NLCB1_PGR2_PLR9_SRVW2_TT1_32_WG64_4_1_WGM15
    SolutionIndex: 78
    SolutionNameMin: Cijk_Alik_Bjlk_SB_GB_MT64x128x16_MI32x32x2x1_SN_1LDSB0_EPS0_GRVW4_LPA4_NLCB1_PGR2_PLR9_SRVW2_TT1_64_WG64_4_1_WGM15
    SolutionIndex: 79
    SolutionNameMin: Cijk_Alik_Bjlk_SB_GB_MT32x32x32_MI16x16x4x1_SN_1LDSB0_EPS1_GRVW4_LPA4_NLCB1_PGR1_PLR9_SRVW2_TT1_16_WG32_8_1_WGM15
    SolutionIndex: 80
    SolutionNameMin: Cijk_Alik_Bjlk_SB_GB_MT64x32x32_MI16x16x4x1_SN_1LDSB0_EPS1_GRVW4_LPA4_NLCB1_PGR1_PLR9_SRVW2_TT2_16_WG32_8_1_WGM15
    SolutionIndex: 81
    SolutionNameMin: Cijk_Alik_Bjlk_SB_GB_MT32x32x32_MI16x16x4x1_SN_1LDSB0_EPS0_GRVW4_LPA4_NLCB1_PGR2_PLR9_SRVW2_TT1_16_WG32_8_1_WGM15
    SolutionIndex: 82
    SolutionNameMin: Cijk_Alik_Bjlk_SB_GB_MT64x32x32_MI16x16x4x1_SN_1LDSB0_EPS0_GRVW4_LPA4_NLCB1_PGR2_PLR9_SRVW2_TT2_16_WG32_8_1_WGM15
    SolutionIndex: 83
    SolutionNameMin: Cijk_Alik_Bjlk_SB_GB_MT64x64x32_MI32x32x2x1_SN_1LDSB0_EPS1_GRVW4_LPA4_NLCB1_PGR1_PLR17_SRVW2_TT1_32_WG64_4_1_WGM15
    SolutionIndex: 84
    SolutionNameMin: Cijk_Alik_Bjlk_SB_GB_MT32x32x8_MI32x32x2x1_SN_1LDSB0_EPS1_GRVW1_LPA2_NLCB1_PGR1_PLR5_SRVW2_TT1_32_WG32_2_1_WGM1
    SolutionIndex: 85
    SolutionNameMin: Cijk_Alik_Bjlk_SB_GB_MT32x32x8_MI32x32x2x1_SN_1LDSB0_EPS0_GRVW1_LPA2_NLCB1_PGR2_PLR5_SRVW2_TT1_32_WG32_2_1_WGM1
    SolutionIndex: 86
    SolutionNameMin: Cijk_Alik_Bjlk_SB_GB_MT16x16x16_MI16x16x4x1_SN_1LDSB0_EPS1_GRVW1_LPA2_NLCB1_PGR1_PLR5_SRVW2_TT1_16_WG16_4_1_WGM1
    SolutionIndex: 87
    SolutionNameMin: Cijk_Alik_Bjlk_SB_GB_MT16x16x16_MI16x16x4x1_SN_1LDSB0_EPS0_GRVW1_LPA2_NLCB1_PGR2_PLR5_SRVW2_TT1_16_WG16_4_1_WGM1
    SolutionIndex: 88
    SolutionNameMin: Cijk_Alik_Bjlk_SB_GB_MT32x32x8_MI32x32x2x1_SN_1LDSB0_EPS0_GRVW4_LPA4_NLCB1_PGR2_PLR5_SRVW2_TT1_32_WG32_2_1_WGM1
    SolutionIndex: 89
    SolutionNameMin: Cijk_Alik_Bjlk_SB_GB_MT16x16x16_MI16x16x4x1_SN_1LDSB0_EPS0_GRVW4_LPA4_NLCB1_PGR2_PLR5_SRVW2_TT1_16_WG16_4_1_WGM1
    SolutionIndex: 90
    SolutionNameMin: Cijk_Alik_Bjlk_SB_GB_MT32x32x8_MI32x32x2x1_SN_1LDSB0_EPS1_GRVW1_LPA2_NLCB1_PGR1_PLR5_SRVW2_TT1_32_WG32_2_1_WGM2
    SolutionIndex: 91
    SolutionNameMin: Cijk_Alik_Bjlk_SB_GB_MT16x16x16_MI16x16x4x1_SN_1LDSB0_EPS1_GRVW1_LPA2_NLCB1_PGR1_PLR5_SRVW2_TT1_16_WG16_4_1_WGM2
    SolutionIndex: 92
    SolutionNameMin: Cijk_Alik_Bjlk_SB_GB_MT32x32x8_MI32x32x2x1_SN_1LDSB0_EPS0_GRVW2_LPA2_NLCB1_PGR2_PLR5_SRVW2_TT1_32_WG32_2_1_WGM2
    SolutionIndex: 93
    SolutionNameMin: Cijk_Alik_Bjlk_SB_GB_MT96x96x16_MI16x16x4x1_SN_1LDSB0_EPS0_GRVW2_LPA2_NLCB3_PGR2_PLR5_SRVW0_TT3_48_WG32_8_1_WGM1
    SolutionIndex: 94
    SolutionNameMin: Cijk_Alik_Bjlk_SB_GB_MT96x96x16_MI16x16x4x1_SN_1LDSB0_EPS1_GRVW2_LPA2_NLCB3_PGR1_PLR5_SRVW0_TT3_48_WG32_8_1_WGM2
    SolutionIndex: 95
    SolutionNameMin: Cijk_Alik_Bjlk_SB_GB_MT160x160x16_MI16x16x4x1_SN_1LDSB1_EPS0_GRVW1_LPA2_NLCB5_PGR2_PLR5_SRVW0_TT5_80_WG32_8_1_WGM1
    SolutionIndex: 96
    SolutionNameMin: Cijk_Alik_Bjlk_SB_GB_MT96x96x16_MI16x16x4x1_SN_1LDSB1_EPS1_GRVW2_LPA2_NLCB3_PGR1_PLR5_SRVW0_TT3_48_WG32_8_1_WGM1
    SolutionIndex: 97
    SolutionNameMin: Cijk_Alik_Bjlk_SB_GB_MT96x96x32_MI16x16x4x1_SN_1LDSB1_EPS1_GRVW4_LPA4_NLCB3_PGR1_PLR9_SRVW0_TT3_48_WG32_8_1_WGM1
    SolutionIndex: 98
    SolutionNameMin: Cijk_Alik_Bjlk_SB_GB_MT160x160x16_MI16x16x4x1_SN_1LDSB1_EPS0_GRVW1_LPA2_NLCB5_PGR2_PLR5_SRVW0_TT5_80_WG32_8_1_WGM2
    SolutionIndex: 99
    SolutionNameMin: Cijk_Alik_Bjlk_SB_GB_MT96x96x16_MI16x16x4x1_SN_1LDSB1_EPS1_GRVW2_LPA2_NLCB3_PGR1_PLR5_SRVW0_TT3_48_WG32_8_1_WGM2
    SolutionIndex: 100
    SolutionNameMin: Cijk_Alik_Bjlk_SB_GB_MT96x96x16_MI16x16x4x1_SN_1LDSB1_EPS0_GRVW2_LPA2_NLCB3_PGR2_PLR5_SRVW0_TT3_48_WG32_8_1_WGM2
    SolutionIndex: 101
    SolutionNameMin: Cijk_Alik_Bjlk_SB_GB_MT160x160x16_MI16x16x4x1_SN_1LDSB1_EPS1_GRVW1_LPA2_NLCB5_PGR1_PLR5_SRVW0_TT5_80_WG32_8_1_WGM15
    SolutionIndex: 102
    SolutionNameMin: Cijk_Alik_Bjlk_SB_GB_MT160x160x16_MI16x16x4x1_SN_1LDSB1_EPS0_GRVW1_LPA2_NLCB5_PGR2_PLR5_SRVW0_TT5_80_WG32_8_1_WGM15
    SolutionIndex: 103
    SolutionNameMin: Cijk_Alik_Bjlk_SB_GB_MT96x96x16_MI16x16x4x1_SN_1LDSB1_EPS1_GRVW2_LPA2_NLCB3_PGR1_PLR5_SRVW0_TT3_48_WG32_8_1_WGM15
    SolutionIndex: 104
    SolutionNameMin: Cijk_Alik_Bjlk_SB_GB_MT96x96x16_MI16x16x4x1_SN_1LDSB1_EPS0_GRVW2_LPA2_NLCB3_PGR2_PLR5_SRVW0_TT3_48_WG32_8_1_WGM15
    SolutionIndex: 105
    SolutionNameMin: Cijk_Alik_Bjlk_SB_GB_MT160x160x16_MI16x16x4x1_SN_1LDSB1_EPS0_GRVW2_LPA2_NLCB5_PGR2_PLR5_SRVW0_TT5_80_WG32_8_1_WGM15
    SolutionIndex: 106
    SolutionNameMin: Cijk_Alik_Bjlk_SB_GB_MT96x96x32_MI16x16x4x1_SN_1LDSB1_EPS1_GRVW4_LPA4_NLCB3_PGR1_PLR9_SRVW0_TT3_48_WG32_8_1_WGM15
    SolutionIndex: 107
    SolutionNameMin: Cijk_Alik_Bjlk_SB_GB_MT96x96x32_MI16x16x4x1_SN_1LDSB1_EPS0_GRVW4_LPA4_NLCB3_PGR2_PLR9_SRVW0_TT3_48_WG32_8_1_WGM15
- - - [192, 192, 1000, 32, 192, 192, 32, 192]
    - [3, 9315.0]
  - - [1536, 1536, 168, 32, 1536, 1536, 32, 1536]
    - [53, 10847.0]
  - - [1536, 32, 168, 1536, 1536, 1536, 1536, 32]
    - [82, 12915.0]
  - - [32, 1536, 168, 32, 32, 32, 32, 1536]
    - [19, 6939.0]
  - - [384, 384, 1024, 384, 384, 384, 384, 384]
    - [13, 25434.0]
  - - [1, 1, 1000, 1, 1, 1, 1, 1]
    - [84, 0.0]
  - - [2, 2, 1000, 2, 2, 2, 2, 2]
    - [86, 2.0]
  - - [3, 3, 1000, 3, 3, 3, 3, 3]
    - [86, 6.0]
  - - [4, 4, 1000, 4, 4, 4, 4, 4]
    - [86, 14.0]
  - - [5, 5, 1000, 5, 5, 5, 5, 5]
    - [86, 27.0]
  - - [6, 6, 1000, 6, 6, 6, 6, 6]
    - [86, 47.0]
  - - [7, 7, 1000, 7, 7, 7, 7, 7]
    - [87, 74.0]
  - - [8, 8, 1000, 8, 8, 8, 8, 8]
    - [87, 110.0]
  - - [9, 9, 1000, 9, 9, 9, 9, 9]
    - [86, 149.0]
  - - [10, 10, 1000, 10, 10, 10, 10, 10]
    - [86, 208.0]
  - - [11, 11, 1000, 11, 11, 11, 11, 11]
    - [91, 273.0]
  - - [12, 12, 1000, 12, 12, 12, 12, 12]
    - [86, 354.0]
  - - [13, 13, 1000, 13, 13, 13, 13, 13]
    - [87, 443.0]
  - - [14, 14, 1000, 14, 14, 14, 14, 14]
    - [87, 553.0]
  - - [15, 15, 1000, 15, 15, 15, 15, 15]
    - [87, 670.0]
  - - [16, 16, 1000, 16, 16, 16, 16, 16]
    - [89, 914.0]
  - - [17, 17, 1000, 17, 17, 17, 17, 17]
    - [85, 706.0]
  - - [18, 18, 1000, 18, 18, 18, 18, 18]
    - [90, 819.0]
  - - [19, 19, 1000, 19, 19, 19, 19, 19]
    - [84, 932.0]
  - - [20, 20, 1000, 20, 20, 20, 20, 20]
    - [90, 1064.0]
  - - [21, 21, 1000, 21, 21, 21, 21, 21]
    - [85, 1181.0]
  - - [22, 22, 1000, 22, 22, 22, 22, 22]
    - [85, 1331.0]
  - - [23, 23, 1000, 23, 23, 23, 23, 23]
    - [85, 1448.0]
  - - [24, 24, 1000, 24, 24, 24, 24, 24]
    - [88, 1728.0]
  - - [25, 25, 1000, 25, 25, 25, 25, 25]
    - [0, 1728.0]
  - - [26, 26, 1000, 26, 26, 26, 26, 26]
    - [0, 1927.0]
  - - [27, 27, 1000, 27, 27, 27, 27, 27]
    - [2, 2103.0]
  - - [28, 28, 1000, 28, 28, 28, 28, 28]
    - [61, 2325.0]
  - - [29, 29, 1000, 29, 29, 29, 29, 29]
    - [0, 2459.0]
  - - [30, 30, 1000, 30, 30, 30, 30, 30]
    - [2, 2637.0]
  - - [31, 31, 1000, 31, 31, 31, 31, 31]
    - [0, 2843.0]
  - - [32, 32, 1000, 32, 32, 32, 32, 32]
    - [92, 3657.0]
  - - [33, 33, 1000, 33, 33, 33, 33, 33]
    - [3, 1748.0]
  - - [34, 34, 1000, 34, 34, 34, 34, 34]
    - [3, 1868.0]
  - - [35, 35, 1000, 35, 35, 35, 35, 35]
    - [3, 2015.0]
  - - [36, 36, 1000, 36, 36, 36, 36, 36]
    - [3, 2226.0]
  - - [37, 37, 1000, 37, 37, 37, 37, 37]
    - [62, 2302.0]
  - - [38, 38, 1000, 38, 38, 38, 38, 38]
    - [3, 2485.0]
  - - [39, 39, 1000, 39, 39, 39, 39, 39]
    - [3, 2593.0]
  - - [40, 40, 1000, 40, 40, 40, 40, 40]
    - [3, 2857.0]
  - - [41, 41, 1000, 41, 41, 41, 41, 41]
    - [3, 2911.0]
  - - [42, 42, 1000, 42, 42, 42, 42, 42]
    - [3, 3118.0]
  - - [43, 43, 1000, 43, 43, 43, 43, 43]
    - [3, 3280.0]
  - - [44, 44, 1000, 44, 44, 44, 44, 44]
    - [3, 3538.0]
  - - [45, 45, 1000, 45, 45, 45, 45, 45]
    - [34, 3527.0]
  - - [46, 46, 1000, 46, 46, 46, 46, 46]
    - [3, 3838.0]
  - - [47, 47, 1000, 47, 47, 47, 47, 47]
    - [34, 4018.0]
  - - [48, 48, 1000, 48, 48, 48, 48, 48]
    - [3, 4885.0]
  - - [49, 49, 1000, 49, 49, 49, 49, 49]
    - [3, 3953.0]
  - - [50, 50, 1000, 50, 50, 50, 50, 50]
    - [3, 4212.0]
  - - [51, 51, 1000, 51, 51, 51, 51, 51]
    - [3, 4285.0]
  - - [52, 52, 1000, 52, 52, 52, 52, 52]
    - [34, 4687.0]
  - - [53, 53, 1000, 53, 53, 53, 53, 53]
    - [34, 4618.0]
  - - [54, 54, 1000, 54, 54, 54, 54, 54]
    - [34, 4896.0]
  - - [55, 55, 1000, 55, 55, 55, 55, 55]
    - [1, 5011.0]
  - - [56, 56, 1000, 56, 56, 56, 56, 56]
    - [34, 5557.0]
  - - [57, 57, 1000, 57, 57, 57, 57, 57]
    - [34, 5309.0]
  - - [58, 58, 1000, 58, 58, 58, 58, 58]
    - [3, 5633.0]
  - - [59, 59, 1000, 59, 59, 59, 59, 59]
    - [34, 5769.0]
  - - [60, 60, 1000, 60, 60, 60, 60, 60]
    - [1, 6081.0]
  - - [61, 61, 1000, 61, 61, 61, 61, 61]
    - [3, 6102.0]
  - - [62, 62, 1000, 62, 62, 62, 62, 62]
    - [1, 6272.0]
  - - [63, 63, 1000, 63, 63, 63, 63, 63]
    - [34, 6458.0]
  - - [64, 64, 1000, 64, 64, 64, 64, 64]
    - [3, 7802.0]
  - - [65, 65, 1000, 65, 65, 65, 65, 65]
    - [100, 4243.0]
  - - [66, 66, 1000, 66, 66, 66, 66, 66]
    - [96, 4509.0]
  - - [67, 67, 1000, 67, 67, 67, 67, 67]
    - [96, 4568.0]
  - - [68, 68, 1000, 68, 68, 68, 68, 68]
    - [103, 4640.0]
  - - [69, 69, 1000, 69, 69, 69, 69, 69]
    - [99, 4803.0]
  - - [70, 70, 1000, 70, 70, 70, 70, 70]
    - [103, 4878.0]
  - - [71, 71, 1000, 71, 71, 71, 71, 71]
    - [96, 5078.0]
  - - [72, 72, 1000, 72, 72, 72, 72, 72]
    - [103, 5621.0]
  - - [73, 73, 1000, 73, 73, 73, 73, 73]
    - [96, 5297.0]
  - - [74, 74, 1000, 74, 74, 74, 74, 74]
    - [96, 5500.0]
  - - [75, 75, 1000, 75, 75, 75, 75, 75]
    - [96, 5580.0]
  - - [76, 76, 1000, 76, 76, 76, 76, 76]
    - [34, 5776.0]
  - - [77, 77, 1000, 77, 77, 77, 77, 77]
    - [75, 5753.0]
  - - [78, 78, 1000, 78, 78, 78, 78, 78]
    - [75, 5944.0]
  - - [79, 79, 1000, 79, 79, 79, 79, 79]
    - [75, 6072.0]
  - - [80, 80, 1000, 80, 80, 80, 80, 80]
    - [49, 7901.0]
  - - [81, 81, 1000, 81, 81, 81, 81, 81]
    - [93, 6078.0]
  - - [82, 82, 1000, 82, 82, 82, 82, 82]
    - [107, 6165.0]
  - - [83, 83, 1000, 83, 83, 83, 83, 83]
    - [94, 6204.0]
  - - [84, 84, 1000, 84, 84, 84, 84, 84]
    - [75, 6741.0]
  - - [85, 85, 1000, 85, 85, 85, 85, 85]
    - [97, 6413.0]
  - - [86, 86, 1000, 86, 86, 86, 86, 86]
    - [75, 6648.0]
  - - [87, 87, 1000, 87, 87, 87, 87, 87]
    - [106, 6660.0]
  - - [88, 88, 1000, 88, 88, 88, 88, 88]
    - [62, 7895.0]
  - - [89, 89, 1000, 89, 89, 89, 89, 89]
    - [75, 6933.0]
  - - [90, 90, 1000, 90, 90, 90, 90, 90]
    - [75, 7209.0]
  - - [91, 91, 1000, 91, 91, 91, 91, 91]
    - [75, 7246.0]
  - - [92, 92, 1000, 92, 92, 92, 92, 92]
    - [75, 7933.0]
  - - [93, 93, 1000, 93, 93, 93, 93, 93]
    - [4, 7577.0]
  - - [94, 94, 1000, 94, 94, 94, 94, 94]
    - [4, 7836.0]
  - - [95, 95, 1000, 95, 95, 95, 95, 95]
    - [63, 7986.0]
  - - [96, 96, 1000, 96, 96, 96, 96, 96]
    - [97, 13389.0]
  - - [97, 97, 1000, 97, 97, 97, 97, 97]
    - [4, 8155.0]
  - - [98, 98, 1000, 98, 98, 98, 98, 98]
    - [4, 8422.0]
  - - [99, 99, 1000, 99, 99, 99, 99, 99]
    - [42, 8572.0]
  - - [100, 100, 1000, 100, 100, 100, 100, 100]
    - [13, 8993.0]
  - - [101, 101, 1000, 101, 101, 101, 101, 101]
    - [42, 8791.0]
  - - [102, 102, 1000, 102, 102, 102, 102, 102]
    - [35, 9086.0]
  - - [103, 103, 1000, 103, 103, 103, 103, 103]
    - [35, 9305.0]
  - - [104, 104, 1000, 104, 104, 104, 104, 104]
    - [23, 10101.0]
  - - [105, 105, 1000, 105, 105, 105, 105, 105]
    - [4, 9692.0]
  - - [106, 106, 1000, 106, 106, 106, 106, 106]
    - [4, 9859.0]
  - - [107, 107, 1000, 107, 107, 107, 107, 107]
    - [63, 10074.0]
  - - [108, 108, 1000, 108, 108, 108, 108, 108]
    - [63, 10442.0]
  - - [109, 109, 1000, 109, 109, 109, 109, 109]
    - [63, 10417.0]
  - - [110, 110, 1000, 110, 110, 110, 110, 110]
    - [4, 10741.0]
  - - [111, 111, 1000, 111, 111, 111, 111, 111]
    - [63, 10752.0]
  - - [112, 112, 1000, 112, 112, 112, 112, 112]
    - [25, 13509.0]
  - - [113, 113, 1000, 113, 113, 113, 113, 113]
    - [35, 10846.0]
  - - [114, 114, 1000, 114, 114, 114, 114, 114]
    - [42, 11425.0]
  - - [115, 115, 1000, 115, 115, 115, 115, 115]
    - [42, 11649.0]
  - - [116, 116, 1000, 116, 116, 116, 116, 116]
    - [69, 12014.0]
  - - [117, 117, 1000, 117, 117, 117, 117, 117]
    - [42, 11967.0]
  - - [118, 118, 1000, 118, 118, 118, 118, 118]
    - [13, 12269.0]
  - - [119, 119, 1000, 119, 119, 119, 119, 119]
    - [23, 12561.0]
  - - [120, 120, 1000, 120, 120, 120, 120, 120]
    - [76, 12989.0]
  - - [121, 121, 1000, 121, 121, 121, 121, 121]
    - [23, 13003.0]
  - - [122, 122, 1000, 122, 122, 122, 122, 122]
    - [25, 13344.0]
  - - [123, 123, 1000, 123, 123, 123, 123, 123]
    - [53, 13399.0]
  - - [124, 124, 1000, 124, 124, 124, 124, 124]
    - [36, 13721.0]
  - - [125, 125, 1000, 125, 125, 125, 125, 125]
    - [25, 13793.0]
  - - [126, 126, 1000, 126, 126, 126, 126, 126]
    - [71, 13961.0]
  - - [127, 127, 1000, 127, 127, 127, 127, 127]
    - [15, 14123.0]
  - - [128, 128, 1000, 128, 128, 128, 128, 128]
    - [53, 15048.0]
  - - [129, 129, 1000, 129, 129, 129, 129, 129]
    - [105, 8065.0]
  - - [130, 130, 1000, 130, 130, 130, 130, 130]
    - [95, 8617.0]
  - - [131, 131, 1000, 131, 131, 131, 131, 131]
    - [104, 8773.0]
  - - [132, 132, 1000, 132, 132, 132, 132, 132]
    - [104, 8723.0]
  - - [133, 133, 1000, 133, 133, 133, 133, 133]
    - [100, 8947.0]
  - - [134, 134, 1000, 134, 134, 134, 134, 134]
    - [98, 9067.0]
  - - [135, 135, 1000, 135, 135, 135, 135, 135]
    - [95, 9275.0]
  - - [136, 136, 1000, 136, 136, 136, 136, 136]
    - [22, 9642.0]
  - - [137, 137, 1000, 137, 137, 137, 137, 137]
    - [101, 9507.0]
  - - [138, 138, 1000, 138, 138, 138, 138, 138]
    - [102, 9594.0]
  - - [139, 139, 1000, 139, 139, 139, 139, 139]
    - [100, 9733.0]
  - - [140, 140, 1000, 140, 140, 140, 140, 140]
    - [104, 9659.0]
  - - [141, 141, 1000, 141, 141, 141, 141, 141]
    - [104, 9924.0]
  - - [142, 142, 1000, 142, 142, 142, 142, 142]
    - [100, 9830.0]
  - - [143, 143, 1000, 143, 143, 143, 143, 143]
    - [100, 10095.0]
  - - [144, 144, 1000, 144, 144, 144, 144, 144]
    - [22, 13421.0]
  - - [145, 145, 1000, 145, 145, 145, 145, 145]
    - [24, 10381.0]
  - - [146, 146, 1000, 146, 146, 146, 146, 146]
    - [24, 10545.0]
  - - [147, 147, 1000, 147, 147, 147, 147, 147]
    - [24, 10594.0]
  - - [148, 148, 1000, 148, 148, 148, 148, 148]
    - [24, 10902.0]
  - - [149, 149, 1000, 149, 149, 149, 149, 149]
    - [24, 10796.0]
  - - [150, 150, 1000, 150, 150, 150, 150, 150]
    - [24, 11041.0]
  - - [32, 32, 8, 32, 32, 32, 32, 32]
    - [45, 67.0]
  - - [32, 32, 8, 64, 32, 32, 64, 32]
    - [54, 119.0]
  - - [32, 32, 8, 128, 32, 32, 128, 32]
    - [65, 180.0]
  - - [32, 32, 8, 256, 32, 32, 256, 32]
    - [28, 285.0]
  - - [32, 32, 8, 512, 32, 32, 512, 32]
    - [81, 403.0]
  - - [32, 32, 8, 1024, 32, 32, 1024, 32]
    - [81, 530.0]
  - - [32, 32, 8, 2048, 32, 32, 2048, 32]
    - [28, 626.0]
  - - [32, 64, 8, 32, 32, 32, 32, 64]
    - [17, 117.0]
  - - [32, 64, 8, 64, 32, 32, 64, 64]
    - [26, 199.0]
  - - [32, 64, 8, 128, 32, 32, 128, 64]
    - [26, 328.0]
  - - [32, 64, 8, 256, 32, 32, 256, 64]
    - [81, 564.0]
  - - [32, 64, 8, 512, 32, 32, 512, 64]
    - [81, 826.0]
  - - [32, 64, 8, 1024, 32, 32, 1024, 64]
    - [81, 1110.0]
  - - [32, 64, 8, 2048, 32, 32, 2048, 64]
    - [81, 1332.0]
  - - [32, 128, 8, 32, 32, 32, 32, 128]
    - [6, 230.0]
  - - [32, 128, 8, 64, 32, 32, 64, 128]
    - [81, 386.0]
  - - [32, 128, 8, 128, 32, 32, 128, 128]
    - [26, 664.0]
  - - [32, 128, 8, 256, 32, 32, 256, 128]
    - [81, 1104.0]
  - - [32, 128, 8, 512, 32, 32, 512, 128]
    - [28, 1613.0]
  - - [32, 128, 8, 1024, 32, 32, 1024, 128]
    - [28, 2231.0]
  - - [32, 128, 8, 2048, 32, 32, 2048, 128]
    - [28, 2750.0]
  - - [32, 256, 8, 32, 32, 32, 32, 256]
    - [21, 430.0]
  - - [32, 256, 8, 64, 32, 32, 64, 256]
    - [16, 760.0]
  - - [32, 256, 8, 128, 32, 32, 128, 256]
    - [79, 1311.0]
  - - [32, 256, 8, 256, 32, 32, 256, 256]
    - [28, 2162.0]
  - - [32, 256, 8, 512, 32, 32, 512, 256]
    - [28, 3585.0]
  - - [32, 256, 8, 1024, 32, 32, 1024, 256]
    - [28, 4584.0]
  - - [32, 256, 8, 2048, 32, 32, 2048, 256]
    - [28, 5574.0]
  - - [32, 512, 8, 32, 32, 32, 32, 512]
    - [66, 989.0]
  - - [32, 512, 8, 64, 32, 32, 64, 512]
    - [28, 1748.0]
  - - [32, 512, 8, 128, 32, 32, 128, 512]
    - [28, 2796.0]
  - - [32, 512, 8, 256, 32, 32, 256, 512]
    - [28, 4237.0]
  - - [32, 512, 8, 512, 32, 32, 512, 512]
    - [56, 5592.0]
  - - [32, 512, 8, 1024, 32, 32, 1024, 512]
    - [81, 7170.0]
  - - [32, 512, 8, 2048, 32, 32, 2048, 512]
    - [56, 7989.0]
  - - [32, 1024, 8, 32, 32, 32, 32, 1024]
    - [48, 1777.0]
  - - [32, 1024, 8, 64, 32, 32, 64, 1024]
    - [11, 2796.0]
  - - [32, 1024, 8, 128, 32, 32, 128, 1024]
    - [11, 4415.0]
  - - [32, 1024, 8, 256, 32, 32, 256, 1024]
    - [74, 6168.0]
  - - [32, 1024, 8, 512, 32, 32, 512, 1024]
    - [33, 7951.0]
  - - [32, 1024, 8, 1024, 32, 32, 1024, 1024]
    - [74, 8648.0]
  - - [32, 1024, 8, 2048, 32, 32, 2048, 1024]
    - [61, 9256.0]
  - - [32, 2048, 8, 32, 32, 32, 32, 2048]
    - [21, 2759.0]
  - - [32, 2048, 8, 64, 32, 32, 64, 2048]
    - [38, 4237.0]
  - - [32, 2048, 8, 128, 32, 32, 128, 2048]
    - [67, 6168.0]
  - - [32, 2048, 8, 256, 32, 32, 256, 2048]
    - [9, 7877.0]
  - - [32, 2048, 8, 512, 32, 32, 512, 2048]
    - [47, 8224.0]
  - - [32, 2048, 8, 1024, 32, 32, 1024, 2048]
    - [18, 9256.0]
  - - [32, 2048, 8, 2048, 32, 32, 2048, 2048]
    - [9, 9862.0]
  - - [64, 32, 8, 32, 64, 64, 32, 32]
    - [46, 113.0]
  - - [64, 32, 8, 64, 64, 64, 64, 32]
    - [79, 196.0]
  - - [64, 32, 8, 128, 64, 64, 128, 32]
    - [81, 336.0]
  - - [64, 32, 8, 256, 64, 64, 256, 32]
    - [28, 570.0]
  - - [64, 32, 8, 512, 64, 64, 512, 32]
    - [56, 819.0]
  - - [64, 32, 8, 1024, 64, 64, 1024, 32]
    - [28, 1121.0]
  - - [64, 32, 8, 2048, 64, 64, 2048, 32]
    - [81, 1307.0]
  - - [64, 64, 8, 32, 64, 64, 32, 64]
    - [6, 222.0]
  - - [64, 64, 8, 64, 64, 64, 64, 64]
    - [26, 397.0]
  - - [64, 64, 8, 128, 64, 64, 128, 64]
    - [79, 672.0]
  - - [64, 64, 8, 256, 64, 64, 256, 64]
    - [28, 1128.0]
  - - [64, 64, 8, 512, 64, 64, 512, 64]
    - [81, 1664.0]
  - - [64, 64, 8, 1024, 64, 64, 1024, 64]
    - [28, 2243.0]
  - - [64, 64, 8, 2048, 64, 64, 2048, 64]
    - [28, 2732.0]
  - - [64, 128, 8, 32, 64, 64, 32, 128]
    - [6, 430.0]
  - - [64, 128, 8, 64, 64, 64, 64, 128]
    - [16, 771.0]
  - - [64, 128, 8, 128, 64, 64, 128, 128]
    - [6, 1327.0]
  - - [64, 128, 8, 256, 64, 64, 256, 128]
    - [28, 2305.0]
  - - [64, 128, 8, 512, 64, 64, 512, 128]
    - [81, 3495.0]
  - - [64, 128, 8, 1024, 64, 64, 1024, 128]
    - [28, 4660.0]
  - - [64, 128, 8, 2048, 64, 64, 2048, 128]
    - [28, 5592.0]
  - - [64, 256, 8, 32, 64, 64, 32, 256]
    - [37, 989.0]
  - - [64, 256, 8, 64, 64, 64, 64, 256]
    - [56, 1748.0]
  - - [64, 256, 8, 128, 64, 64, 128, 256]
    - [28, 2873.0]
  - - [64, 256, 8, 256, 64, 64, 256, 256]
    - [56, 4462.0]
  - - [64, 256, 8, 512, 64, 64, 512, 256]
    - [81, 5992.0]
  - - [64, 256, 8, 1024, 64, 64, 1024, 256]
    - [56, 7457.0]
  - - [64, 256, 8, 2048, 64, 64, 2048, 256]
    - [56, 8047.0]
  - - [64, 512, 8, 32, 64, 64, 32, 512]
    - [40, 1808.0]
  - - [64, 512, 8, 64, 64, 64, 64, 512]
    - [61, 2996.0]
  - - [64, 512, 8, 128, 64, 64, 128, 512]
    - [11, 4510.0]
  - - [64, 512, 8, 256, 64, 64, 256, 512]
    - [21, 6554.0]
  - - [64, 512, 8, 512, 64, 64, 512, 512]
    - [55, 8306.0]
  - - [64, 512, 8, 1024, 64, 64, 1024, 512]
    - [83, 9840.0]
  - - [64, 512, 8, 2048, 64, 64, 2048, 512]
    - [83, 10983.0]
  - - [64, 1024, 8, 32, 64, 64, 32, 1024]
    - [39, 3084.0]
  - - [64, 1024, 8, 64, 64, 64, 64, 1024]
    - [1, 4713.0]
  - - [64, 1024, 8, 128, 64, 64, 128, 1024]
    - [3, 7109.0]
  - - [64, 1024, 8, 256, 64, 64, 256, 1024]
    - [3, 9373.0]
  - - [64, 1024, 8, 512, 64, 64, 512, 1024]
    - [14, 11222.0]
  - - [64, 1024, 8, 1024, 64, 64, 1024, 1024]
    - [70, 12710.0]
  - - [64, 1024, 8, 2048, 64, 64, 2048, 1024]
    - [59, 13044.0]
  - - [64, 2048, 8, 32, 64, 64, 32, 2048]
    - [3, 4415.0]
  - - [64, 2048, 8, 64, 64, 64, 64, 2048]
    - [12, 6605.0]
  - - [64, 2048, 8, 128, 64, 64, 128, 2048]
    - [24, 9479.0]
  - - [64, 2048, 8, 256, 64, 64, 256, 2048]
    - [24, 12157.0]
  - - [64, 2048, 8, 512, 64, 64, 512, 2048]
    - [14, 13585.0]
  - - [64, 2048, 8, 1024, 64, 64, 1024, 2048]
    - [14, 14526.0]
  - - [64, 2048, 8, 2048, 64, 64, 2048, 2048]
    - [24, 15123.0]
  - - [128, 32, 8, 32, 128, 128, 32, 32]
    - [21, 222.0]
  - - [128, 32, 8, 64, 128, 128, 64, 32]
    - [79, 397.0]
  - - [128, 32, 8, 128, 128, 128, 128, 32]
    - [81, 672.0]
  - - [128, 32, 8, 256, 128, 128, 256, 32]
    - [56, 1116.0]
  - - [128, 32, 8, 512, 128, 128, 512, 32]
    - [28, 1577.0]
  - - [128, 32, 8, 1024, 128, 128, 1024, 32]
    - [28, 2255.0]
  - - [128, 32, 8, 2048, 128, 128, 2048, 32]
    - [56, 2724.0]
  - - [128, 64, 8, 32, 128, 128, 32, 64]
    - [6, 437.0]
  - - [128, 64, 8, 64, 128, 128, 64, 64]
    - [26, 794.0]
  - - [128, 64, 8, 128, 128, 128, 128, 64]
    - [26, 1417.0]
  - - [128, 64, 8, 256, 128, 128, 256, 64]
    - [79, 2208.0]
  - - [128, 64, 8, 512, 128, 128, 512, 64]
    - [28, 3410.0]
  - - [128, 64, 8, 1024, 128, 128, 1024, 64]
    - [28, 4635.0]
  - - [128, 64, 8, 2048, 128, 128, 2048, 64]
    - [28, 5465.0]
  - - [128, 128, 8, 32, 128, 128, 32, 128]
    - [37, 1028.0]
  - - [128, 128, 8, 64, 128, 128, 64, 128]
    - [7, 1777.0]
  - - [128, 128, 8, 128, 128, 128, 128, 128]
    - [56, 2913.0]
  - - [128, 128, 8, 256, 128, 128, 256, 128]
    - [28, 4510.0]
  - - [128, 128, 8, 512, 128, 128, 512, 128]
    - [28, 5746.0]
  - - [128, 128, 8, 1024, 128, 128, 1024, 128]
    - [28, 7201.0]
  - - [128, 128, 8, 2048, 128, 128, 2048, 128]
    - [81, 8431.0]
  - - [128, 256, 8, 32, 128, 128, 32, 256]
    - [40, 1808.0]
  - - [128, 256, 8, 64, 128, 128, 64, 256]
    - [33, 2954.0]
  - - [128, 256, 8, 128, 128, 128, 128, 256]
    - [11, 4713.0]
  - - [128, 256, 8, 256, 128, 128, 256, 256]
    - [11, 6765.0]
  - - [128, 256, 8, 512, 128, 128, 512, 256]
    - [80, 8389.0]
  - - [128, 256, 8, 1024, 128, 128, 1024, 256]
    - [27, 10046.0]
  - - [128, 256, 8, 2048, 128, 128, 2048, 256]
    - [58, 10894.0]
  - - [128, 512, 8, 32, 128, 128, 32, 512]
    - [32, 3039.0]
  - - [128, 512, 8, 64, 128, 128, 64, 512]
    - [20, 4821.0]
  - - [128, 512, 8, 128, 128, 128, 128, 512]
    - [20, 7232.0]
  - - [128, 512, 8, 256, 128, 128, 256, 512]
    - [50, 9020.0]
  - - [128, 512, 8, 512, 128, 128, 512, 512]
    - [70, 11038.0]
  - - [128, 512, 8, 1024, 128, 128, 1024, 512]
    - [43, 12758.0]
  - - [128, 512, 8, 2048, 128, 128, 2048, 512]
    - [14, 13503.0]
  - - [128, 1024, 8, 32, 128, 128, 32, 1024]
    - [3, 4510.0]
  - - [128, 1024, 8, 64, 128, 128, 64, 1024]
    - [5, 6711.0]
  - - [128, 1024, 8, 128, 128, 128, 128, 1024]
    - [52, 9479.0]
  - - [128, 1024, 8, 256, 128, 128, 256, 1024]
    - [77, 12382.0]
  - - [128, 1024, 8, 512, 128, 128, 512, 1024]
    - [24, 13557.0]
  - - [128, 1024, 8, 1024, 128, 128, 1024, 1024]
    - [52, 14864.0]
  - - [128, 1024, 8, 2048, 128, 128, 2048, 1024]
    - [24, 15634.0]
  - - [128, 2048, 8, 32, 128, 128, 32, 2048]
    - [3, 6214.0]
  - - [128, 2048, 8, 64, 128, 128, 64, 2048]
    - [25, 9168.0]
  - - [128, 2048, 8, 128, 128, 128, 128, 2048]
    - [52, 12520.0]
  - - [128, 2048, 8, 256, 128, 128, 256, 2048]
    - [51, 15047.0]
  - - [128, 2048, 8, 512, 128, 128, 512, 2048]
    - [42, 16777.0]
  - - [128, 2048, 8, 1024, 128, 128, 1024, 2048]
    - [42, 18076.0]
  - - [128, 2048, 8, 2048, 128, 128, 2048, 2048]
    - [52, 18824.0]
  - - [256, 32, 8, 32, 256, 256, 32, 32]
    - [21, 430.0]
  - - [256, 32, 8, 64, 256, 256, 64, 32]
    - [48, 783.0]
  - - [256, 32, 8, 128, 256, 256, 128, 32]
    - [16, 1311.0]
  - - [256, 32, 8, 256, 256, 256, 256, 32]
    - [28, 2305.0]
  - - [256, 32, 8, 512, 256, 256, 512, 32]
    - [28, 3355.0]
  - - [256, 32, 8, 1024, 256, 256, 1024, 32]
    - [56, 4462.0]
  - - [256, 32, 8, 2048, 256, 256, 2048, 32]
    - [28, 5131.0]
  - - [256, 64, 8, 32, 256, 256, 32, 64]
    - [16, 989.0]
  - - [256, 64, 8, 64, 256, 256, 64, 64]
    - [26, 1808.0]
  - - [256, 64, 8, 128, 256, 256, 128, 64]
    - [56, 2873.0]
  - - [256, 64, 8, 256, 256, 256, 256, 64]
    - [56, 4462.0]
  - - [256, 64, 8, 512, 256, 256, 512, 64]
    - [29, 5146.0]
  - - [256, 64, 8, 1024, 256, 256, 1024, 64]
    - [72, 6605.0]
  - - [256, 64, 8, 2048, 256, 256, 2048, 64]
    - [81, 7785.0]
  - - [256, 128, 8, 32, 256, 256, 32, 128]
    - [11, 1808.0]
  - - [256, 128, 8, 64, 256, 256, 64, 128]
    - [8, 2996.0]
  - - [256, 128, 8, 128, 256, 256, 128, 128]
    - [48, 4766.0]
  - - [256, 128, 8, 256, 256, 256, 256, 128]
    - [48, 6765.0]
  - - [256, 128, 8, 512, 256, 256, 512, 128]
    - [31, 7951.0]
  - - [256, 128, 8, 1024, 256, 256, 1024, 128]
    - [83, 9642.0]
  - - [256, 128, 8, 2048, 256, 256, 2048, 128]
    - [83, 10568.0]
  - - [256, 256, 8, 32, 256, 256, 32, 256]
    - [1, 3084.0]
  - - [256, 256, 8, 64, 256, 256, 64, 256]
    - [32, 4934.0]
  - - [256, 256, 8, 128, 256, 256, 128, 256]
    - [73, 7232.0]
  - - [256, 256, 8, 256, 256, 256, 256, 256]
    - [14, 9218.0]
  - - [256, 256, 8, 512, 256, 256, 512, 256]
    - [14, 11336.0]
  - - [256, 256, 8, 1024, 256, 256, 1024, 256]
    - [43, 12955.0]
  - - [256, 256, 8, 2048, 256, 256, 2048, 256]
    - [43, 13710.0]
  - - [256, 512, 8, 32, 256, 256, 32, 512]
    - [36, 4462.0]
  - - [256, 512, 8, 64, 256, 256, 64, 512]
    - [12, 6876.0]
  - - [256, 512, 8, 128, 256, 256, 128, 512]
    - [12, 9587.0]
  - - [256, 512, 8, 256, 256, 256, 256, 512]
    - [52, 12202.0]
  - - [256, 512, 8, 512, 256, 256, 512, 512]
    - [77, 13981.0]
  - - [256, 512, 8, 1024, 256, 256, 1024, 512]
    - [77, 15427.0]
  - - [256, 512, 8, 2048, 256, 256, 2048, 512]
    - [24, 16210.0]
  - - [256, 1024, 8, 32, 256, 256, 32, 1024]
    - [3, 6168.0]
  - - [256, 1024, 8, 64, 256, 256, 64, 1024]
    - [24, 9069.0]
  - - [256, 1024, 8, 128, 256, 256, 128, 1024]
    - [52, 13006.0]
  - - [256, 1024, 8, 256, 256, 256, 256, 1024]
    - [76, 15115.0]
  - - [256, 1024, 8, 512, 256, 256, 512, 1024]
    - [69, 17033.0]
  - - [256, 1024, 8, 1024, 256, 256, 1024, 1024]
    - [70, 18462.0]
  - - [256, 1024, 8, 2048, 256, 256, 2048, 1024]
    - [69, 18844.0]
  - - [256, 2048, 8, 32, 256, 256, 32, 2048]
    - [36, 7951.0]
  - - [256, 2048, 8, 64, 256, 256, 64, 2048]
    - [78, 12070.0]
  - - [256, 2048, 8, 128, 256, 256, 128, 2048]
    - [44, 15643.0]
  - - [256, 2048, 8, 256, 256, 256, 256, 2048]
    - [78, 17968.0]
  - - [256, 2048, 8, 512, 256, 256, 512, 2048]
    - [78, 20214.0]
  - - [256, 2048, 8, 1024, 256, 256, 1024, 2048]
    - [71, 22112.0]
  - - [256, 2048, 8, 2048, 256, 256, 2048, 2048]
    - [78, 22850.0]
  - - [512, 32, 8, 32, 512, 512, 32, 32]
    - [28, 989.0]
  - - [512, 32, 8, 64, 512, 512, 64, 32]
    - [46, 1691.0]
  - - [512, 32, 8, 128, 512, 512, 128, 32]
    - [28, 2689.0]
  - - [512, 32, 8, 256, 512, 512, 256, 32]
    - [72, 4033.0]
  - - [512, 32, 8, 512, 512, 512, 512, 32]
    - [28, 5707.0]
  - - [512, 32, 8, 1024, 512, 512, 1024, 32]
    - [28, 7592.0]
  - - [512, 32, 8, 2048, 512, 512, 2048, 32]
    - [56, 8715.0]
  - - [512, 64, 8, 32, 512, 512, 32, 64]
    - [11, 1777.0]
  - - [512, 64, 8, 64, 512, 512, 64, 64]
    - [21, 3039.0]
  - - [512, 64, 8, 128, 512, 512, 128, 64]
    - [61, 4713.0]
  - - [512, 64, 8, 256, 512, 512, 256, 64]
    - [74, 6355.0]
  - - [512, 64, 8, 512, 512, 512, 512, 64]
    - [80, 8184.0]
  - - [512, 64, 8, 1024, 512, 512, 1024, 64]
    - [57, 9587.0]
  - - [512, 64, 8, 2048, 512, 512, 2048, 64]
    - [30, 10437.0]
  - - [512, 128, 8, 32, 512, 512, 32, 128]
    - [20, 3178.0]
  - - [512, 128, 8, 64, 512, 512, 64, 128]
    - [34, 4934.0]
  - - [512, 128, 8, 128, 512, 512, 128, 128]
    - [20, 7424.0]
  - - [512, 128, 8, 256, 512, 512, 256, 128]
    - [14, 9373.0]
  - - [512, 128, 8, 512, 512, 512, 512, 128]
    - [41, 11773.0]
  - - [512, 128, 8, 1024, 512, 512, 1024, 128]
    - [14, 12405.0]
  - - [512, 128, 8, 2048, 512, 512, 2048, 128]
    - [41, 13082.0]
  - - [512, 256, 8, 32, 512, 512, 32, 256]
    - [41, 4510.0]
  - - [512, 256, 8, 64, 512, 512, 64, 256]
    - [5, 6820.0]
  - - [512, 256, 8, 128, 512, 512, 128, 256]
    - [22, 9587.0]
  - - [512, 256, 8, 256, 512, 512, 256, 256]
    - [24, 11941.0]
  - - [512, 256, 8, 512, 512, 512, 512, 256]
    - [80, 14040.0]
  - - [512, 256, 8, 1024, 512, 512, 1024, 256]
    - [77, 15166.0]
  - - [512, 256, 8, 2048, 512, 512, 2048, 256]
    - [77, 16161.0]
  - - [512, 512, 8, 32, 512, 512, 32, 512]
    - [3, 6168.0]
  - - [512, 512, 8, 64, 512, 512, 64, 512]
    - [24, 9218.0]
  - - [512, 512, 8, 128, 512, 512, 128, 512]
    - [24, 13107.0]
  - - [512, 512, 8, 256, 512, 512, 256, 512]
    - [76, 15252.0]
  - - [512, 512, 8, 512, 512, 512, 512, 512]
    - [77, 18487.0]
  - - [512, 512, 8, 1024, 512, 512, 1024, 512]
    - [77, 19680.0]
  - - [512, 512, 8, 2048, 512, 512, 2048, 512]
    - [77, 20275.0]
  - - [512, 1024, 8, 32, 512, 512, 32, 1024]
    - [23, 7989.0]
  - - [512, 1024, 8, 64, 512, 512, 64, 1024]
    - [25, 12157.0]
  - - [512, 1024, 8, 128, 512, 512, 128, 1024]
    - [25, 16448.0]
  - - [512, 1024, 8, 256, 512, 512, 256, 1024]
    - [76, 19174.0]
  - - [512, 1024, 8, 512, 512, 512, 512, 1024]
    - [69, 21288.0]
  - - [512, 1024, 8, 1024, 512, 512, 1024, 1024]
    - [69, 22846.0]
  - - [512, 1024, 8, 2048, 512, 512, 2048, 1024]
    - [69, 23708.0]
  - - [512, 2048, 8, 32, 512, 512, 32, 2048]
    - [64, 9321.0]
  - - [512, 2048, 8, 64, 512, 512, 64, 2048]
    - [71, 13585.0]
  - - [512, 2048, 8, 128, 512, 512, 128, 2048]
    - [71, 17777.0]
  - - [512, 2048, 8, 256, 512, 512, 256, 2048]
    - [25, 20554.0]
  - - [512, 2048, 8, 512, 512, 512, 512, 2048]
    - [78, 22787.0]
  - - [512, 2048, 8, 1024, 512, 512, 1024, 2048]
    - [69, 23803.0]
  - - [512, 2048, 8, 2048, 512, 512, 2048, 2048]
    - [78, 24295.0]
  - - [1024, 32, 8, 32, 1024, 1024, 32, 32]
    - [62, 1719.0]
  - - [1024, 32, 8, 64, 1024, 1024, 64, 32]
    - [11, 2724.0]
  - - [1024, 32, 8, 128, 1024, 1024, 128, 32]
    - [40, 4369.0]
  - - [1024, 32, 8, 256, 1024, 1024, 256, 32]
    - [27, 6355.0]
  - - [1024, 32, 8, 512, 1024, 1024, 512, 32]
    - [11, 7914.0]
  - - [1024, 32, 8, 1024, 1024, 1024, 1024, 32]
    - [29, 9614.0]
  - - [1024, 32, 8, 2048, 1024, 1024, 2048, 32]
    - [82, 10519.0]
  - - [1024, 64, 8, 32, 1024, 1024, 32, 64]
    - [12, 3039.0]
  - - [1024, 64, 8, 64, 1024, 1024, 64, 64]
    - [20, 4934.0]
  - - [1024, 64, 8, 128, 1024, 1024, 128, 64]
    - [10, 7049.0]
  - - [1024, 64, 8, 256, 1024, 1024, 256, 64]
    - [3, 9587.0]
  - - [1024, 64, 8, 512, 1024, 1024, 512, 64]
    - [3, 11111.0]
  - - [1024, 64, 8, 1024, 1024, 1024, 1024, 64]
    - [3, 12567.0]
  - - [1024, 64, 8, 2048, 1024, 1024, 2048, 64]
    - [3, 12844.0]
  - - [1024, 128, 8, 32, 1024, 1024, 32, 128]
    - [3, 4609.0]
  - - [1024, 128, 8, 64, 1024, 1024, 64, 128]
    - [12, 6765.0]
  - - [1024, 128, 8, 128, 1024, 1024, 128, 128]
    - [22, 9533.0]
  - - [1024, 128, 8, 256, 1024, 1024, 256, 128]
    - [77, 12027.0]
  - - [1024, 128, 8, 512, 1024, 1024, 512, 128]
    - [80, 13923.0]
  - - [1024, 128, 8, 1024, 1024, 1024, 1024, 128]
    - [52, 14897.0]
  - - [1024, 128, 8, 2048, 1024, 1024, 2048, 128]
    - [52, 15698.0]
  - - [1024, 256, 8, 32, 1024, 1024, 32, 256]
    - [3, 6079.0]
  - - [1024, 256, 8, 64, 1024, 1024, 64, 256]
    - [24, 9218.0]
  - - [1024, 256, 8, 128, 1024, 1024, 128, 256]
    - [52, 13159.0]
  - - [1024, 256, 8, 256, 1024, 1024, 256, 256]
    - [52, 15392.0]
  - - [1024, 256, 8, 512, 1024, 1024, 512, 256]
    - [52, 18311.0]
  - - [1024, 256, 8, 1024, 1024, 1024, 1024, 256]
    - [24, 19666.0]
  - - [1024, 256, 8, 2048, 1024, 1024, 2048, 256]
    - [77, 20153.0]
  - - [1024, 512, 8, 32, 1024, 1024, 32, 512]
    - [36, 8184.0]
  - - [1024, 512, 8, 64, 1024, 1024, 64, 512]
    - [53, 12291.0]
  - - [1024, 512, 8, 128, 1024, 1024, 128, 512]
    - [23, 16570.0]
  - - [1024, 512, 8, 256, 1024, 1024, 256, 512]
    - [51, 19340.0]
  - - [1024, 512, 8, 512, 1024, 1024, 512, 512]
    - [69, 21561.0]
  - - [1024, 512, 8, 1024, 1024, 1024, 1024, 512]
    - [69, 22520.0]
  - - [1024, 512, 8, 2048, 1024, 1024, 2048, 512]
    - [69, 23266.0]
  - - [1024, 1024, 8, 32, 1024, 1024, 32, 1024]
    - [51, 9143.0]
  - - [1024, 1024, 8, 64, 1024, 1024, 64, 1024]
    - [25, 13503.0]
  - - [1024, 1024, 8, 128, 1024, 1024, 128, 1024]
    - [51, 18311.0]
  - - [1024, 1024, 8, 256, 1024, 1024, 256, 1024]
    - [76, 21806.0]
  - - [1024, 1024, 8, 512, 1024, 1024, 512, 1024]
    - [69, 24706.0]
  - - [1024, 1024, 8, 1024, 1024, 1024, 1024, 1024]
    - [69, 25999.0]
  - - [1024, 1024, 8, 2048, 1024, 1024, 2048, 1024]
    - [78, 26594.0]
  - - [1024, 2048, 8, 32, 1024, 1024, 32, 2048]
    - [76, 9628.0]
  - - [1024, 2048, 8, 64, 1024, 1024, 64, 2048]
    - [64, 14386.0]
  - - [1024, 2048, 8, 128, 1024, 1024, 128, 2048]
    - [78, 18759.0]
  - - [1024, 2048, 8, 256, 1024, 1024, 256, 2048]
    - [78, 21931.0]
  - - [1024, 2048, 8, 512, 1024, 1024, 512, 2048]
    - [71, 24032.0]
  - - [1024, 2048, 8, 1024, 1024, 1024, 1024, 2048]
    - [71, 25336.0]
  - - [1024, 2048, 8, 2048, 1024, 1024, 2048, 2048]
    - [78, 25437.0]
  - - [2048, 32, 8, 32, 2048, 2048, 32, 32]
    - [60, 2913.0]
  - - [2048, 32, 8, 64, 2048, 2048, 64, 32]
    - [73, 4369.0]
  - - [2048, 32, 8, 128, 2048, 2048, 128, 32]
    - [62, 6123.0]
  - - [2048, 32, 8, 256, 2048, 2048, 256, 32]
    - [10, 7989.0]
  - - [2048, 32, 8, 512, 2048, 2048, 512, 32]
    - [68, 9347.0]
  - - [2048, 32, 8, 1024, 2048, 2048, 1024, 32]
    - [28, 10153.0]
  - - [2048, 32, 8, 2048, 2048, 2048, 2048, 32]
    - [28, 10781.0]
  - - [2048, 64, 8, 32, 2048, 2048, 32, 64]
    - [22, 4415.0]
  - - [2048, 64, 8, 64, 2048, 2048, 64, 64]
    - [3, 6554.0]
  - - [2048, 64, 8, 128, 2048, 2048, 128, 64]
    - [49, 9168.0]
  - - [2048, 64, 8, 256, 2048, 2048, 256, 64]
    - [77, 11651.0]
  - - [2048, 64, 8, 512, 2048, 2048, 512, 64]
    - [80, 13668.0]
  - - [2048, 64, 8, 1024, 2048, 2048, 1024, 64]
    - [55, 14605.0]
  - - [2048, 64, 8, 2048, 2048, 2048, 2048, 64]
    - [57, 14749.0]
  - - [2048, 128, 8, 32, 2048, 2048, 32, 128]
    - [24, 6079.0]
  - - [2048, 128, 8, 64, 2048, 2048, 64, 128]
    - [24, 8830.0]
  - - [2048, 128, 8, 128, 2048, 2048, 128, 128]
    - [24, 12567.0]
  - - [2048, 128, 8, 256, 2048, 2048, 256, 128]
    - [50, 14946.0]
  - - [2048, 128, 8, 512, 2048, 2048, 512, 128]
    - [77, 17872.0]
  - - [2048, 128, 8, 1024, 2048, 2048, 1024, 128]
    - [77, 19298.0]
  - - [2048, 128, 8, 2048, 2048, 2048, 2048, 128]
    - [52, 19803.0]
  - - [2048, 256, 8, 32, 2048, 2048, 32, 256]
    - [5, 7951.0]
  - - [2048, 256, 8, 64, 2048, 2048, 64, 256]
    - [25, 11815.0]
  - - [2048, 256, 8, 128, 2048, 2048, 128, 256]
    - [23, 16055.0]
  - - [2048, 256, 8, 256, 2048, 2048, 256, 256]
    - [42, 18957.0]
  - - [2048, 256, 8, 512, 2048, 2048, 512, 256]
    - [42, 21220.0]
  - - [2048, 256, 8, 1024, 2048, 2048, 1024, 256]
    - [42, 22416.0]
  - - [2048, 256, 8, 2048, 2048, 2048, 2048, 256]
    - [69, 22744.0]
  - - [2048, 512, 8, 32, 2048, 2048, 32, 512]
    - [13, 9093.0]
  - - [2048, 512, 8, 64, 2048, 2048, 64, 512]
    - [25, 13449.0]
  - - [2048, 512, 8, 128, 2048, 2048, 128, 512]
    - [51, 18719.0]
  - - [2048, 512, 8, 256, 2048, 2048, 256, 512]
    - [51, 21475.0]
  - - [2048, 512, 8, 512, 2048, 2048, 512, 512]
    - [78, 24470.0]
  - - [2048, 512, 8, 1024, 2048, 2048, 1024, 512]
    - [69, 25879.0]
  - - [2048, 512, 8, 2048, 2048, 2048, 2048, 512]
    - [69, 26486.0]
  - - [2048, 1024, 8, 32, 2048, 2048, 32, 1024]
    - [23, 9628.0]
  - - [2048, 1024, 8, 64, 2048, 2048, 64, 1024]
    - [64, 13408.0]
  - - [2048, 1024, 8, 128, 2048, 2048, 128, 1024]
    - [53, 18449.0]
  - - [2048, 1024, 8, 256, 2048, 2048, 256, 1024]
    - [78, 23101.0]
  - - [2048, 1024, 8, 512, 2048, 2048, 512, 1024]
    - [69, 25571.0]
  - - [2048, 1024, 8, 1024, 2048, 2048, 1024, 1024]
    - [71, 26813.0]
  - - [2048, 1024, 8, 2048, 2048, 2048, 2048, 1024]
    - [78, 27270.0]
  - - [2048, 2048, 8, 32, 2048, 2048, 32, 2048]
    - [64, 9621.0]
  - - [2048, 2048, 8, 64, 2048, 2048, 64, 2048]
    - [64, 14203.0]
  - - [2048, 2048, 8, 128, 2048, 2048, 128, 2048]
    - [78, 19222.0]
  - - [2048, 2048, 8, 256, 2048, 2048, 256, 2048]
    - [76, 22365.0]
  - - [2048, 2048, 8, 512, 2048, 2048, 512, 2048]
    - [71, 24610.0]
  - - [2048, 2048, 8, 1024, 2048, 2048, 1024, 2048]
    - [71, 25958.0]
  - - [2048, 2048, 8, 2048, 2048, 2048, 2048, 2048]
    - [78, 25944.0]
- null
