library/src/blas3/Tensile/Logic/asm_full/arcturus_Cijk_Ailk_Bjlk_HBH.yaml
- {MinimumRequiredVersion: 4.6.0}
- arcturus
- gfx908
- [Device 7380, Device 7388, Device 738c, Device 7390]
    SolutionIndex: 0
    SolutionNameMin: Cijk_Ailk_Bjlk_HBH_MT32x32x64_MI16x16x16x1_SE_1LDSB0_AF0EM8_AF1EM1_AMAS3_BL1_EPS1_GRVW8_GSU7_ISA908_KLA_LRVW4_MAC_NLCA1_NLCB1_PGR1_SIA3_SU32_SUS128_SRVW0_TT1_16_USFGROn1_VAW1_VSn1_VW2_WSGRA1_WSGRB1_WG32_8_1_WGM2
    SolutionIndex: 1
    SolutionNameMin: Cijk_Ailk_Bjlk_HBH_MT64x64x16_SN_1LDSB0_AF0EM1_AF1EM1_AMAS0_BL0_EPS0_GRVW1_GSU1_ISA000_KLS_LRVW1_FMA_NLCA1_NLCB1_PGR1_SIA1_SU32_SUS256_SRVW0_TT4_4_USFGRO0_VAW2_VS1_VW1_WSGRA0_WSGRB0_WG16_16_1_WGM8
    SolutionIndex: 2
    SolutionNameMin: Cijk_Ailk_Bjlk_HBH_MT32x32x64_MI16x16x16x1_SE_1LDSB0_AF0EM8_AF1EM1_AMAS3_BL1_EPS0_GRVW4_GSU1_ISA908_KLA_LRVW4_MAC_NLCA1_NLCB1_PGR2_SIA3_SU0_SUS256_SRVW4_TT1_16_USFGROn1_VAW2_VSn1_VW2_WSGRA1_WSGRB1_WG32_8_1_WGM1
    SolutionIndex: 3
    SolutionNameMin: Cijk_Ailk_Bjlk_HBH_MT32x32x32_MI16x16x16x1_SE_1LDSB0_AF0EM8_AF1EM1_AMAS3_BL1_EPS0_GRVW8_GSU1_ISA908_KLA_LRVW4_MAC_NLCA1_NLCB1_PGR2_SIA3_SU0_SUS256_SRVW4_TT1_16_USFGROn1_VAW2_VSn1_VW2_WSGRA1_WSGRB1_WG32_8_1_WGM1
    SolutionIndex: 4
    SolutionNameMin: Cijk_Ailk_Bjlk_HBH_MT64x64x32_MI32x32x8x1_SE_1LDSB0_AF0EM8_AF1EM1_AMAS3_BL1_EPS0_GRVW8_GSU1_ISA908_KLA_LRVW4_MAC_NLCA1_NLCB1_PGR2_SIA3_SU32_SUS128_SRVW4_TT1_32_USFGROn1_VAW2_VSn1_VW2_WSGRA1_WSGRB1_WG64_4_1_WGM1
    SolutionIndex: 5
    SolutionNameMin: Cijk_Ailk_Bjlk_HBH_MT64x64x32_MI32x32x8x1_SE_1LDSB0_AF0EM8_AF1EM1_AMAS3_BL1_EPS0_GRVW8_GSU1_ISA908_KLA_LRVW4_MAC_NLCA1_NLCB1_PGR2_SIA3_SU32_SUS128_SRVW4_TT1_32_USFGROn1_VAW2_VSn1_VW2_WSGRA1_WSGRB1_WG64_4_1_WGM2
    SolutionIndex: 6
    SolutionNameMin: Cijk_Ailk_Bjlk_HBH_MT64x32x64_MI16x16x16x1_SE_1LDSB0_AF0EM8_AF1EM1_AMAS3_BL1_EPS0_GRVW4_GSU1_ISA908_KLA_LRVW4_MAC_NLCA1_NLCB1_PGR2_SIA3_SU0_SUS256_SRVW4_TT2_16_USFGROn1_VAW2_VSn1_VW2_WSGRA1_WSGRB1_WG32_8_1_WGM15
    SolutionIndex: 7
    SolutionNameMin: Cijk_Ailk_Bjlk_HBH_MT32x32x64_MI16x16x16x1_SE_1LDSB0_AF0EM8_AF1EM1_AMAS3_BL1_EPS0_GRVW4_GSU1_ISA908_KLA_LRVW4_MAC_NLCA1_NLCB1_PGR2_SIA3_SU32_SUS128_SRVW4_TT1_16_USFGROn1_VAW2_VSn1_VW2_WSGRA1_WSGRB1_WG32_8_1_WGM1
    SolutionIndex: 8
    SolutionNameMin: Cijk_Ailk_Bjlk_HBH_MT32x32x64_MI16x16x16x1_SE_1LDSB0_AF0EM8_AF1EM1_AMAS3_BL1_EPS1_GRVW4_GSU5_ISA908_KLA_LRVW4_MAC_NLCA1_NLCB1_PGR1_SIA3_SU32_SUS128_SRVW0_TT1_16_USFGROn1_VAW1_VSn1_VW2_WSGRA1_WSGRB1_WG32_8_1_WGM1
    SolutionIndex: 9
    SolutionNameMin: Cijk_Ailk_Bjlk_HBH_MT32x32x64_MI16x16x16x1_SE_1LDSB0_AF0EM8_AF1EM1_AMAS3_BL1_EPS0_GRVW2_GSU5_ISA908_KLA_LRVW4_MAC_NLCA1_NLCB1_PGR2_SIA3_SU0_SUS256_SRVW4_TT1_16_USFGROn1_VAW1_VSn1_VW2_WSGRA1_WSGRB1_WG32_8_1_WGM2
    SolutionIndex: 10
    SolutionNameMin: Cijk_Ailk_Bjlk_HBH_MT32x32x32_MI16x16x16x1_SE_1LDSB0_AF0EM1_AF1EM1_AMAS3_BL1_EPS1_GRVW4_GSU1_ISA908_KLA_LRVW4_MAC_NLCA1_NLCB1_PGR1_SIA3_SU0_SUS256_SRVW4_TT1_16_USFGROn1_VAW2_VSn1_VW2_WSGRA1_WSGRB1_WG32_8_1_WGM1
    SolutionIndex: 11
    SolutionNameMin: Cijk_Ailk_Bjlk_HBH_MT64x64x64_MI32x32x8x1_SE_1LDSB0_AF0EM8_AF1EM1_AMAS3_BL1_EPS0_GRVW8_GSU1_ISA908_KLA_LRVW4_MAC_NLCA1_NLCB1_PGR2_SIA3_SU0_SUS256_SRVW4_TT1_32_USFGROn1_VAW2_VSn1_VW2_WSGRA1_WSGRB1_WG64_4_1_WGM15
    SolutionIndex: 12
    SolutionNameMin: Cijk_Ailk_Bjlk_HBH_MT32x32x64_MI16x16x16x1_SE_1LDSB0_AF0EM8_AF1EM1_AMAS3_BL1_EPS0_GRVW8_GSU1_ISA908_KLA_LRVW4_MAC_NLCA1_NLCB1_PGR2_SIA3_SU0_SUS256_SRVW4_TT1_16_USFGROn1_VAW2_VSn1_VW2_WSGRA1_WSGRB1_WG32_8_1_WGM1
    SolutionIndex: 13
    SolutionNameMin: Cijk_Ailk_Bjlk_HBH_MT64x64x4_SN_1LDSB0_AF0EM1_AF1EM1_AMAS0_BL0_EPS0_GRVW1_GSU1_ISA000_KLS_LRVW1_FMA_NLCA1_NLCB1_PGR1_SIA1_SU32_SUS256_SRVW0_TT4_4_USFGRO0_VAW2_VS1_VW1_WSGRA0_WSGRB0_WG16_16_1_WGM8
    SolutionIndex: 14
    SolutionNameMin: Cijk_Ailk_Bjlk_HBH_MT32x32x64_MI16x16x16x1_SE_1LDSB0_AF0EM8_AF1EM1_AMAS3_BL1_EPS0_GRVW8_GSU1_ISA908_KLA_LRVW4_MAC_NLCA1_NLCB1_PGR2_SIA3_SU0_SUS256_SRVW4_TT1_16_USFGROn1_VAW2_VSn1_VW2_WSGRA1_WSGRB1_WG32_8_1_WGM15
    SolutionIndex: 15
    SolutionNameMin: Cijk_Ailk_Bjlk_HBH_MT32x32x64_MI16x16x16x1_SE_1LDSB0_AF0EM8_AF1EM1_AMAS3_BL1_EPS0_GRVW4_GSU1_ISA908_KLA_LRVW4_MAC_NLCA1_NLCB1_PGR2_SIA3_SU0_SUS256_SRVW4_TT1_16_USFGROn1_VAW2_VSn1_VW2_WSGRA1_WSGRB1_WG32_8_1_WGM2
    SolutionIndex: 16
    SolutionNameMin: Cijk_Ailk_Bjlk_HBH_MT32x32x64_MI16x16x16x1_SE_1LDSB0_AF0EM1_AF1EM1_AMAS3_BL1_EPS0_GRVW8_GSU1_ISA908_KLA_LRVW4_MAC_NLCA1_NLCB1_PGR2_SIA3_SU0_SUS256_SRVW4_TT1_16_USFGROn1_VAW2_VSn1_VW2_WSGRA1_WSGRB1_WG32_8_1_WGM1
    SolutionIndex: 17
    SolutionNameMin: Cijk_Ailk_Bjlk_HBH_MT32x32x32_MI16x16x16x1_SE_1LDSB0_AF0EM8_AF1EM1_AMAS3_BL1_EPS0_GRVW4_GSU3_ISA908_KLA_LRVW4_MAC_NLCA1_NLCB1_PGR2_SIA3_SU32_SUS256_SRVW4_TT1_16_USFGROn1_VAW1_VSn1_VW2_WSGRA1_WSGRB1_WG32_8_1_WGM1
    SolutionIndex: 18
    SolutionNameMin: Cijk_Ailk_Bjlk_HBH_MT32x64x64_MI16x16x16x1_SE_1LDSB0_AF0EM8_AF1EM1_AMAS3_BL1_EPS1_GRVW8_GSU5_ISA908_KLA_LRVW4_MAC_NLCA1_NLCB1_PGR1_SIA3_SU32_SUS128_SRVW0_TT1_32_USFGROn1_VAW1_VSn1_VW2_WSGRA1_WSGRB1_WG32_8_1_WGM15
    SolutionIndex: 19
    SolutionNameMin: Cijk_Ailk_Bjlk_HBH_MT32x32x32_MI16x16x16x1_SE_1LDSB0_AF0EM8_AF1EM1_AMAS3_BL1_EPS0_GRVW4_GSU1_ISA908_KLA_LRVW4_MAC_NLCA1_NLCB1_PGR2_SIA3_SU32_SUS128_SRVW4_TT1_16_USFGROn1_VAW2_VSn1_VW2_WSGRA1_WSGRB1_WG32_8_1_WGM15
    SolutionIndex: 20
    SolutionNameMin: Cijk_Ailk_Bjlk_HBH_MT64x64x64_MI32x32x8x1_SE_1LDSB0_AF0EM8_AF1EM1_AMAS3_BL1_EPS1_GRVW8_GSU5_ISA908_KLA_LRVW4_MAC_NLCA1_NLCB1_PGR1_SIA3_SU32_SUS128_SRVW0_TT1_32_USFGROn1_VAW1_VSn1_VW2_WSGRA1_WSGRB1_WG64_4_1_WGM1
    SolutionIndex: 21
    SolutionNameMin: Cijk_Ailk_Bjlk_HBH_MT64x128x32_MI32x32x8x1_SE_1LDSB0_AF0EM8_AF1EM1_AMAS3_BL1_EPS0_GRVW4_GSU7_ISA908_KLA_LRVW4_MAC_NLCA1_NLCB1_PGR2_SIA3_SU0_SUS256_SRVW4_TT1_64_USFGROn1_VAW1_VSn1_VW2_WSGRA1_WSGRB1_WG64_4_1_WGM1
    SolutionIndex: 22
    SolutionNameMin: Cijk_Ailk_Bjlk_HBH_MT32x64x64_MI16x16x16x1_SE_1LDSB0_AF0EM1_AF1EM1_AMAS3_BL1_EPS0_GRVW8_GSU1_ISA908_KLA_LRVW4_MAC_NLCA1_NLCB1_PGR2_SIA3_SU0_SUS256_SRVW4_TT1_32_USFGROn1_VAW2_VSn1_VW2_WSGRA1_WSGRB1_WG32_8_1_WGM15
    SolutionIndex: 23
    SolutionNameMin: Cijk_Ailk_Bjlk_HBH_MT32x32x64_MI16x16x16x1_SE_1LDSB0_AF0EM1_AF1EM1_AMAS3_BL1_EPS0_GRVW8_GSU7_ISA908_KLA_LRVW4_MAC_NLCA1_NLCB1_PGR2_SIA3_SU32_SUS256_SRVW4_TT1_16_USFGROn1_VAW1_VSn1_VW2_WSGRA1_WSGRB1_WG32_8_1_WGM1
    SolutionIndex: 24
    SolutionNameMin: Cijk_Ailk_Bjlk_HBH_MT64x64x64_MI32x32x8x1_SE_1LDSB0_AF0EM8_AF1EM1_AMAS3_BL1_EPS0_GRVW8_GSU1_ISA908_KLA_LRVW4_MAC_NLCA1_NLCB1_PGR2_SIA3_SU32_SUS256_SRVW4_TT1_32_USFGROn1_VAW2_VSn1_VW2_WSGRA1_WSGRB1_WG64_4_1_WGM1
    SolutionIndex: 25
    SolutionNameMin: Cijk_Ailk_Bjlk_HBH_MT32x32x32_MI16x16x16x1_SE_1LDSB0_AF0EM1_AF1EM1_AMAS3_BL1_EPS0_GRVW8_GSU1_ISA908_KLA_LRVW4_MAC_NLCA1_NLCB1_PGR2_SIA3_SU0_SUS256_SRVW4_TT1_16_USFGROn1_VAW2_VSn1_VW2_WSGRA1_WSGRB1_WG32_8_1_WGM2
    SolutionIndex: 26
    SolutionNameMin: Cijk_Ailk_Bjlk_HBH_MT64x16x64_MI16x16x16x1_SE_1LDSB0_AF0EM8_AF1EM1_AMAS3_BL1_EPS0_GRVW2_GSU7_ISA908_KLA_LRVW4_MAC_NLCA1_NLCB1_PGR2_SIA3_SU0_SUS256_SRVW0_TT1_16_USFGROn1_VAW1_VSn1_VW2_WSGRA1_WSGRB1_WG64_4_1_WGM1
    SolutionIndex: 27
    SolutionNameMin: Cijk_Ailk_Bjlk_HBH_MT64x16x64_MI16x16x16x1_SE_1LDSB0_AF0EM8_AF1EM1_AMAS3_BL1_EPS0_GRVW2_GSU7_ISA908_KLA_LRVW4_MAC_NLCA1_NLCB1_PGR2_SIA3_SU32_SUS128_SRVW0_TT1_16_USFGROn1_VAW1_VSn1_VW2_WSGRA1_WSGRB1_WG64_4_1_WGM1
    SolutionIndex: 28
    SolutionNameMin: Cijk_Ailk_Bjlk_HBH_MT32x32x32_MI16x16x16x1_SE_1LDSB0_AF0EM1_AF1EM1_AMAS3_BL1_EPS0_GRVW8_GSU1_ISA908_KLA_LRVW4_MAC_NLCA1_NLCB1_PGR2_SIA3_SU0_SUS256_SRVW4_TT1_16_USFGROn1_VAW2_VSn1_VW2_WSGRA1_WSGRB1_WG32_8_1_WGM1
    SolutionIndex: 29
    SolutionNameMin: Cijk_Ailk_Bjlk_HBH_MT64x64x32_MI32x32x8x1_SE_1LDSB0_AF0EM8_AF1EM1_AMAS3_BL1_EPS0_GRVW8_GSU1_ISA908_KLA_LRVW4_MAC_NLCA1_NLCB1_PGR2_SIA3_SU32_SUS256_SRVW4_TT1_32_USFGROn1_VAW2_VSn1_VW2_WSGRA1_WSGRB1_WG64_4_1_WGM2
    SolutionIndex: 30
    SolutionNameMin: Cijk_Ailk_Bjlk_HBH_MT32x32x32_MI16x16x16x1_SE_1LDSB0_AF0EM8_AF1EM1_AMAS3_BL1_EPS0_GRVW4_GSU1_ISA908_KLA_LRVW4_MAC_NLCA1_NLCB1_PGR2_SIA3_SU0_SUS256_SRVW4_TT1_16_USFGROn1_VAW2_VSn1_VW2_WSGRA1_WSGRB1_WG32_8_1_WGM1
    SolutionIndex: 31
    SolutionNameMin: Cijk_Ailk_Bjlk_HBH_MT16x16x32_MI16x16x16x1_SE_1LDSB0_AF0EM1_AF1EM1_AMAS3_BL1_EPS0_GRVW8_GSU1_ISA908_KLA_LRVW4_MAC_NLCA1_NLCB1_PGR2_SIA3_SU0_SUS256_SRVW0_TT1_16_USFGROn1_VAW2_VSn1_VW2_WSGRA1_WSGRB1_WG16_4_1_WGM1
    SolutionIndex: 32
    SolutionNameMin: Cijk_Ailk_Bjlk_HBH_MT128x128x32_MI32x32x8x1_SE_1LDSB0_AF0EM8_AF1EM1_AMAS3_BL1_EPS0_GRVW8_GSU3_ISA908_KLA_LRVW4_MAC_NLCA1_NLCB1_PGR2_SIA3_SU32_SUS128_SRVW4_TT2_64_USFGROn1_VAW1_VSn1_VW2_WSGRA1_WSGRB1_WG64_4_1_WGM2
    SolutionIndex: 33
    SolutionNameMin: Cijk_Ailk_Bjlk_HBH_MT64x16x32_MI16x16x16x1_SE_1LDSB0_AF0EM1_AF1EM1_AMAS3_BL1_EPS0_GRVW8_GSU1_ISA908_KLA_LRVW4_MAC_NLCA1_NLCB1_PGR2_SIA3_SU0_SUS256_SRVW0_TT1_16_USFGROn1_VAW2_VSn1_VW2_WSGRA1_WSGRB1_WG64_4_1_WGM1
    SolutionIndex: 34
    SolutionNameMin: Cijk_Ailk_Bjlk_HBH_MT64x64x32_MI32x32x8x1_SE_1LDSB0_AF0EM8_AF1EM1_AMAS3_BL1_EPS0_GRVW8_GSU1_ISA908_KLA_LRVW4_MAC_NLCA1_NLCB1_PGR2_SIA3_SU0_SUS256_SRVW4_TT1_32_USFGROn1_VAW2_VSn1_VW2_WSGRA1_WSGRB1_WG64_4_1_WGM15
    SolutionIndex: 35
    SolutionNameMin: Cijk_Ailk_Bjlk_HBH_MT64x64x4_SN_1LDSB0_AF0EM1_AF1EM1_AMAS0_BL0_EPS0_GRVW1_GSU1_ISA000_KLS_LRVW1_FMA_NLCA1_NLCB1_PGR0_SIA1_SU32_SUS256_SRVW0_TT4_4_USFGRO0_VAW2_VS1_VW1_WSGRA0_WSGRB0_WG16_16_1_WGM8
    SolutionIndex: 36
    SolutionNameMin: Cijk_Ailk_Bjlk_HBH_MT64x64x32_MI32x32x8x1_SE_1LDSB0_AF0EM8_AF1EM1_AMAS3_BL1_EPS0_GRVW8_GSU1_ISA908_KLA_LRVW4_MAC_NLCA1_NLCB1_PGR2_SIA3_SU32_SUS128_SRVW4_TT1_32_USFGROn1_VAW2_VSn1_VW2_WSGRA1_WSGRB1_WG64_4_1_WGM15
    SolutionIndex: 37
    SolutionNameMin: Cijk_Ailk_Bjlk_HBH_MT32x32x32_MI16x16x16x1_SE_1LDSB0_AF0EM1_AF1EM1_AMAS3_BL1_EPS0_GRVW4_GSU1_ISA908_KLA_LRVW4_MAC_NLCA1_NLCB1_PGR2_SIA3_SU0_SUS256_SRVW4_TT1_16_USFGROn1_VAW2_VSn1_VW2_WSGRA1_WSGRB1_WG32_8_1_WGM1
    SolutionIndex: 38
    SolutionNameMin: Cijk_Ailk_Bjlk_HBH_MT64x64x64_MI32x32x8x1_SE_1LDSB0_AF0EM8_AF1EM1_AMAS3_BL1_EPS1_GRVW8_GSU3_ISA908_KLA_LRVW4_MAC_NLCA1_NLCB1_PGR1_SIA3_SU32_SUS128_SRVW0_TT1_32_USFGROn1_VAW1_VSn1_VW2_WSGRA1_WSGRB1_WG64_4_1_WGM15
    SolutionIndex: 39
    SolutionNameMin: Cijk_Ailk_Bjlk_HBH_MT64x32x16_MI16x16x16x1_SE_1LDSB0_AF0EM8_AF1EM1_AMAS3_BL1_EPS0_GRVW8_GSU1_ISA908_KLA_LRVW4_MAC_NLCA1_NLCB1_PGR2_SIA3_SU32_SUS128_SRVW4_TT2_16_USFGROn1_VAW2_VSn1_VW2_WSGRA1_WSGRB1_WG32_8_1_WGM2
    SolutionIndex: 40
    SolutionNameMin: Cijk_Ailk_Bjlk_HBH_MT16x16x32_MI16x16x16x1_SE_1LDSB0_AF0EM8_AF1EM1_AMAS3_BL1_EPS0_GRVW2_GSU5_ISA908_KLA_LRVW4_MAC_NLCA1_NLCB1_PGR2_SIA3_SU0_SUS256_SRVW0_TT1_16_USFGROn1_VAW1_VSn1_VW2_WSGRA1_WSGRB1_WG16_4_1_WGM1
    SolutionIndex: 41
    SolutionNameMin: Cijk_Ailk_Bjlk_HBH_MT64x64x64_MI32x32x8x1_SE_1LDSB0_AF0EM8_AF1EM1_AMAS3_BL1_EPS0_GRVW8_GSU1_ISA908_KLA_LRVW4_MAC_NLCA1_NLCB1_PGR2_SIA3_SU0_SUS256_SRVW4_TT1_32_USFGROn1_VAW2_VSn1_VW2_WSGRA1_WSGRB1_WG64_4_1_WGM2
    SolutionIndex: 42
    SolutionNameMin: Cijk_Ailk_Bjlk_HBH_MT32x32x64_MI16x16x16x1_SE_1LDSB0_AF0EM8_AF1EM1_AMAS3_BL1_EPS1_GRVW2_GSU5_ISA908_KLA_LRVW4_MAC_NLCA1_NLCB1_PGR1_SIA3_SU0_SUS256_SRVW0_TT1_16_USFGROn1_VAW1_VSn1_VW2_WSGRA1_WSGRB1_WG32_8_1_WGM1
    SolutionIndex: 43
    SolutionNameMin: Cijk_Ailk_Bjlk_HBH_MT64x128x32_MI32x32x8x1_SE_1LDSB0_AF0EM8_AF1EM1_AMAS3_BL1_EPS0_GRVW4_GSU7_ISA908_KLA_LRVW4_MAC_NLCA1_NLCB1_PGR2_SIA3_SU32_SUS256_SRVW4_TT1_64_USFGROn1_VAW1_VSn1_VW2_WSGRA1_WSGRB1_WG64_4_1_WGM2
    SolutionIndex: 44
    SolutionNameMin: Cijk_Ailk_Bjlk_HBH_MT32x32x16_MI16x16x16x1_SN_1LDSB0_AF0EM8_AF1EM1_AMAS3_BL1_EPS0_GRVW2_GSU1_ISA908_KLA_LRVW4_MAC_NLCA1_NLCB1_PGR2_SIA3_SU32_SUS256_SRVW4_TT1_16_USFGROn1_VAW2_VSn1_VW2_WSGRA1_WSGRB1_WG32_8_1_WGM2
    SolutionIndex: 45
    SolutionNameMin: Cijk_Ailk_Bjlk_HBH_MT64x64x8_SN_1LDSB0_AF0EM1_AF1EM1_AMAS0_BL0_EPS0_GRVW1_GSU1_ISA000_KLS_LRVW1_FMA_NLCA1_NLCB1_PGR0_SIA1_SU32_SUS256_SRVW0_TT4_4_USFGRO0_VAW2_VS1_VW1_WSGRA0_WSGRB0_WG16_16_1_WGM8
    SolutionIndex: 46
    SolutionNameMin: Cijk_Ailk_Bjlk_HBH_MT32x32x32_MI16x16x16x1_SE_1LDSB0_AF0EM1_AF1EM1_AMAS3_BL1_EPS0_GRVW2_GSU1_ISA908_KLA_LRVW4_MAC_NLCA1_NLCB1_PGR2_SIA3_SU0_SUS256_SRVW4_TT1_16_USFGROn1_VAW2_VSn1_VW2_WSGRA1_WSGRB1_WG32_8_1_WGM1
    SolutionIndex: 47
    SolutionNameMin: Cijk_Ailk_Bjlk_HBH_MT16x16x32_MI16x16x16x1_SE_1LDSB0_AF0EM1_AF1EM1_AMAS3_BL1_EPS0_GRVW4_GSU1_ISA908_KLA_LRVW4_MAC_NLCA1_NLCB1_PGR2_SIA3_SU32_SUS128_SRVW0_TT1_16_USFGROn1_VAW2_VSn1_VW2_WSGRA1_WSGRB1_WG16_4_1_WGM1
    SolutionIndex: 48
    SolutionNameMin: Cijk_Ailk_Bjlk_HBH_MT32x32x64_MI16x16x16x1_SE_1LDSB0_AF0EM8_AF1EM1_AMAS3_BL1_EPS1_GRVW8_GSU1_ISA908_KLA_LRVW4_MAC_NLCA1_NLCB1_PGR1_SIA3_SU0_SUS256_SRVW4_TT1_16_USFGROn1_VAW2_VSn1_VW2_WSGRA1_WSGRB1_WG32_8_1_WGM1
    SolutionIndex: 49
    SolutionNameMin: Cijk_Ailk_Bjlk_HBH_MT128x96x64_MI32x32x8x1_SE_1LDSB0_AF0EM8_AF1EM1_AMAS3_BL1_EPS1_GRVW8_GSU5_ISA908_KLA_LRVW4_MAC_NLCA1_NLCB3_PGR1_SIA3_SU0_SUS256_SRVW4_TT1_96_USFGROn1_VAW1_VSn1_VW2_WSGRA1_WSGRB1_WG128_2_1_WGM15
    SolutionIndex: 50
    SolutionNameMin: Cijk_Ailk_Bjlk_HBH_MT32x32x32_MI16x16x16x1_SE_1LDSB0_AF0EM8_AF1EM1_AMAS3_BL1_EPS0_GRVW8_GSU5_ISA908_KLA_LRVW4_MAC_NLCA1_NLCB1_PGR2_SIA3_SU0_SUS256_SRVW4_TT1_16_USFGROn1_VAW1_VSn1_VW2_WSGRA1_WSGRB1_WG32_8_1_WGM1
    SolutionIndex: 51
    SolutionNameMin: Cijk_Ailk_Bjlk_HBH_MT64x32x16_MI16x16x16x1_SE_1LDSB1_AF0EM8_AF1EM1_AMAS3_BL1_EPS0_GRVW2_GSU1_ISA908_KLA_LRVW4_MAC_NLCA1_NLCB1_PGR2_SIA3_SU0_SUS256_SRVW4_TT2_16_USFGROn1_VAW2_VSn1_VW2_WSGRA1_WSGRB1_WG32_8_1_WGM15
    SolutionIndex: 52
    SolutionNameMin: Cijk_Ailk_Bjlk_HBH_MT256x160x32_MI32x32x8x1_SE_1LDSB0_AF0EM8_AF1EM1_AMAS3_BL1_EPS0_GRVW4_GSU1_ISA908_KLA_LRVW4_MAC_NLCA1_NLCB5_PGR2_SIA3_SU0_SUS256_SRVW4_TT2_160_USFGROn1_VAW2_VSn1_VW2_WSGRA1_WSGRB1_WG128_2_1_WGM15
    SolutionIndex: 53
    SolutionNameMin: Cijk_Ailk_Bjlk_HBH_MT16x16x64_MI16x16x16x1_SE_1LDSB0_AF0EM8_AF1EM1_AMAS3_BL1_EPS1_GRVW8_GSU1_ISA908_KLA_LRVW4_MAC_NLCA1_NLCB1_PGR1_SIA3_SU0_SUS256_SRVW0_TT1_16_USFGROn1_VAW2_VSn1_VW2_WSGRA1_WSGRB1_WG16_4_1_WGM1
    SolutionIndex: 54
    SolutionNameMin: Cijk_Ailk_Bjlk_HBH_MT256x160x32_MI32x32x8x1_SE_1LDSB0_AF0EM8_AF1EM1_AMAS3_BL1_EPS0_GRVW2_GSU1_ISA908_KLA_LRVW4_MAC_NLCA2_NLCB5_PGR2_SIA3_SU0_SUS256_SRVW4_TT2_160_USFGROn1_VAW2_VSn1_VW2_WSGRA1_WSGRB1_WG128_2_1_WGM15
    SolutionIndex: 55
    SolutionNameMin: Cijk_Ailk_Bjlk_HBH_MT128x256x16_MI32x32x8x1_SE_1LDSB0_AF0EM8_AF1EM1_AMAS3_BL1_EPS0_GRVW8_GSU1_ISA908_KLA_LRVW4_MAC_NLCA1_NLCB1_PGR2_SIA3_SU32_SUS256_SRVW4_TT2_128_USFGROn1_VAW2_VSn1_VW2_WSGRA1_WSGRB1_WG64_4_1_WGM2
    SolutionIndex: 56
    SolutionNameMin: Cijk_Ailk_Bjlk_HBH_MT128x96x32_MI32x32x8x1_SE_1LDSB0_AF0EM8_AF1EM1_AMAS3_BL1_EPS0_GRVW4_GSU1_ISA908_KLA_LRVW4_MAC_NLCA1_NLCB3_PGR2_SIA3_SU0_SUS256_SRVW4_TT1_96_USFGROn1_VAW2_VSn1_VW2_WSGRA1_WSGRB1_WG128_2_1_WGM15
    SolutionIndex: 57
    SolutionNameMin: Cijk_Ailk_Bjlk_HBH_MT128x256x16_MI32x32x8x1_SE_1LDSB1_AF0EM8_AF1EM1_AMAS3_BL1_EPS0_GRVW8_GSU1_ISA908_KLA_LRVW4_MAC_NLCA1_NLCB1_PGR2_SIA3_SU0_SUS256_SRVW4_TT2_128_USFGROn1_VAW2_VSn1_VW2_WSGRA1_WSGRB1_WG64_4_1_WGM1
    SolutionIndex: 58
    SolutionNameMin: Cijk_Ailk_Bjlk_HBH_MT128x192x16_MI32x32x8x1_SN_1LDSB0_AF0EM8_AF1EM1_AMAS3_BL1_EPS0_GRVW4_GSU1_ISA908_KLA_LRVW4_MAC_NLCA1_NLCB3_PGR2_SIA3_SU0_SUS256_SRVW4_TT2_96_USFGROn1_VAW2_VSn1_VW2_WSGRA1_WSGRB1_WG64_4_1_WGM1
    SolutionIndex: 59
    SolutionNameMin: Cijk_Ailk_Bjlk_HBH_MT128x256x16_MI32x32x8x1_SE_1LDSB0_AF0EM8_AF1EM1_AMAS3_BL1_EPS0_GRVW4_GSU1_ISA908_KLA_LRVW4_MAC_NLCA1_NLCB1_PGR2_SIA3_SU0_SUS256_SRVW4_TT2_128_USFGROn1_VAW2_VSn1_VW2_WSGRA1_WSGRB1_WG64_4_1_WGM15
    SolutionIndex: 60
    SolutionNameMin: Cijk_Ailk_Bjlk_HBH_MT64x128x16_MI32x32x8x1_SE_1LDSB0_AF0EM1_AF1EM1_AMAS3_BL1_EPS0_GRVW8_GSU1_ISA908_KLA_LRVW4_MAC_NLCA1_NLCB1_PGR2_SIA3_SU32_SUS128_SRVW4_TT1_64_USFGROn1_VAW2_VSn1_VW2_WSGRA1_WSGRB1_WG64_4_1_WGM1
    SolutionIndex: 61
    SolutionNameMin: Cijk_Ailk_Bjlk_HBH_MT128x128x16_MI32x32x8x1_SE_1LDSB0_AF0EM8_AF1EM1_AMAS3_BL1_EPS0_GRVW8_GSU1_ISA908_KLA_LRVW4_MAC_NLCA1_NLCB1_PGR2_SIA3_SU32_SUS256_SRVW4_TT2_64_USFGROn1_VAW2_VSn1_VW2_WSGRA1_WSGRB1_WG64_4_1_WGM15
    SolutionIndex: 62
    SolutionNameMin: Cijk_Ailk_Bjlk_HBH_MT128x128x32_MI32x32x8x1_SE_1LDSB0_AF0EM8_AF1EM1_AMAS3_BL1_EPS0_GRVW8_GSU1_ISA908_KLA_LRVW4_MAC_NLCA1_NLCB1_PGR2_SIA3_SU0_SUS256_SRVW4_TT2_64_USFGROn1_VAW2_VSn1_VW2_WSGRA1_WSGRB1_WG64_4_1_WGM2
    SolutionIndex: 63
    SolutionNameMin: Cijk_Ailk_Bjlk_HBH_MT64x64x32_MI32x32x8x1_SE_1LDSB0_AF0EM8_AF1EM1_AMAS3_BL1_EPS0_GRVW8_GSU1_ISA908_KLA_LRVW4_MAC_NLCA1_NLCB1_PGR2_SIA3_SU0_SUS256_SRVW4_TT1_32_USFGROn1_VAW2_VSn1_VW2_WSGRA1_WSGRB1_WG64_4_1_WGM2
    SolutionIndex: 64
    SolutionNameMin: Cijk_Ailk_Bjlk_HBH_MT128x128x16_MI32x32x8x1_SE_1LDSB0_AF0EM1_AF1EM1_AMAS3_BL1_EPS1_GRVW2_GSU1_ISA908_KLA_LRVW4_MAC_NLCA1_NLCB1_PGR1_SIA3_SU0_SUS256_SRVW4_TT2_64_USFGROn1_VAW2_VSn1_VW2_WSGRA1_WSGRB1_WG64_4_1_WGM2
    SolutionIndex: 65
    SolutionNameMin: Cijk_Ailk_Bjlk_HBH_MT128x128x16_MI32x32x8x1_SE_1LDSB0_AF0EM1_AF1EM1_AMAS3_BL1_EPS0_GRVW8_GSU1_ISA908_KLA_LRVW4_MAC_NLCA1_NLCB1_PGR2_SIA3_SU0_SUS256_SRVW4_TT2_64_USFGROn1_VAW2_VSn1_VW2_WSGRA1_WSGRB1_WG64_4_1_WGM2
    SolutionIndex: 66
    SolutionNameMin: Cijk_Ailk_Bjlk_HBH_MT64x256x16_MI32x32x8x1_SE_1LDSB0_AF0EM1_AF1EM1_AMAS3_BL1_EPS0_GRVW8_GSU1_ISA908_KLA_LRVW4_MAC_NLCA1_NLCB1_PGR2_SIA3_SU32_SUS256_SRVW4_TT1_128_USFGROn1_VAW2_VSn1_VW2_WSGRA1_WSGRB1_WG64_4_1_WGM15
    SolutionIndex: 67
    SolutionNameMin: Cijk_Ailk_Bjlk_HBH_MT128x128x16_MI32x32x8x1_SE_1LDSB0_AF0EM8_AF1EM1_AMAS3_BL1_EPS0_GRVW4_GSU1_ISA908_KLA_LRVW4_MAC_NLCA1_NLCB1_PGR2_SIA3_SU0_SUS256_SRVW4_TT2_64_USFGROn1_VAW2_VSn1_VW2_WSGRA1_WSGRB1_WG64_4_1_WGM15
    SolutionIndex: 68
    SolutionNameMin: Cijk_Ailk_Bjlk_HBH_MT128x64x16_MI32x32x8x1_SE_1LDSB0_AF0EM8_AF1EM1_AMAS3_BL1_EPS0_GRVW8_GSU1_ISA908_KLA_LRVW4_MAC_NLCA1_NLCB1_PGR2_SIA3_SU0_SUS256_SRVW4_TT2_32_USFGROn1_VAW2_VSn1_VW2_WSGRA1_WSGRB1_WG64_4_1_WGM2
    SolutionIndex: 69
    SolutionNameMin: Cijk_Ailk_Bjlk_HBH_MT128x64x16_MI32x32x8x1_SE_1LDSB0_AF0EM8_AF1EM1_AMAS3_BL1_EPS0_GRVW8_GSU1_ISA908_KLA_LRVW4_MAC_NLCA1_NLCB1_PGR2_SIA3_SU32_SUS128_SRVW4_TT2_32_USFGROn1_VAW2_VSn1_VW2_WSGRA1_WSGRB1_WG64_4_1_WGM1
    SolutionIndex: 70
    SolutionNameMin: Cijk_Ailk_Bjlk_HBH_MT128x96x16_MI32x32x8x1_SE_1LDSB0_AF0EM8_AF1EM1_AMAS3_BL1_EPS0_GRVW2_GSU1_ISA908_KLA_LRVW4_MAC_NLCA1_NLCB3_PGR2_SIA3_SU0_SUS256_SRVW4_TT1_96_USFGROn1_VAW2_VSn1_VW2_WSGRA1_WSGRB1_WG128_2_1_WGM1
    SolutionIndex: 71
    SolutionNameMin: Cijk_Ailk_Bjlk_HBH_MT128x128x16_MI32x32x8x1_SN_1LDSB0_AF0EM8_AF1EM1_AMAS3_BL1_EPS0_GRVW8_GSU1_ISA908_KLA_LRVW4_MAC_NLCA1_NLCB1_PGR2_SIA3_SU0_SUS256_SRVW4_TT2_64_USFGROn1_VAW2_VSn1_VW2_WSGRA1_WSGRB1_WG64_4_1_WGM1
    SolutionIndex: 72
    SolutionNameMin: Cijk_Ailk_Bjlk_HBH_MT128x128x16_MI32x32x8x1_SE_1LDSB0_AF0EM8_AF1EM1_AMAS3_BL1_EPS0_GRVW8_GSU1_ISA908_KLA_LRVW4_MAC_NLCA1_NLCB1_PGR2_SIA3_SU32_SUS128_SRVW4_TT2_64_USFGROn1_VAW2_VSn1_VW2_WSGRA1_WSGRB1_WG64_4_1_WGM2
    SolutionIndex: 73
    SolutionNameMin: Cijk_Ailk_Bjlk_HBH_MT128x128x16_MI32x32x8x1_SE_1LDSB0_AF0EM8_AF1EM1_AMAS3_BL1_EPS0_GRVW4_GSU1_ISA908_KLA_LRVW4_MAC_NLCA1_NLCB1_PGR2_SIA3_SU32_SUS256_SRVW4_TT2_64_USFGROn1_VAW2_VSn1_VW2_WSGRA1_WSGRB1_WG64_4_1_WGM1
    SolutionIndex: 74
    SolutionNameMin: Cijk_Ailk_Bjlk_HBH_MT128x128x32_MI32x32x8x1_SE_1LDSB0_AF0EM1_AF1EM1_AMAS3_BL1_EPS0_GRVW8_GSU1_ISA908_KLA_LRVW4_MAC_NLCA1_NLCB1_PGR2_SIA3_SU0_SUS256_SRVW4_TT2_64_USFGROn1_VAW2_VSn1_VW2_WSGRA1_WSGRB1_WG64_4_1_WGM15
    SolutionIndex: 75
    SolutionNameMin: Cijk_Ailk_Bjlk_HBH_MT64x64x32_MI32x32x8x1_SE_1LDSB0_AF0EM8_AF1EM1_AMAS3_BL1_EPS0_GRVW8_GSU1_ISA908_KLA_LRVW4_MAC_NLCA1_NLCB1_PGR2_SIA3_SU0_SUS256_SRVW4_TT1_32_USFGROn1_VAW2_VSn1_VW2_WSGRA1_WSGRB1_WG64_4_1_WGM1
    SolutionIndex: 76
    SolutionNameMin: Cijk_Ailk_Bjlk_HBH_MT64x256x16_MI32x32x8x1_SE_1LDSB0_AF0EM1_AF1EM1_AMAS3_BL1_EPS0_GRVW8_GSU1_ISA908_KLA_LRVW4_MAC_NLCA1_NLCB1_PGR2_SIA3_SU0_SUS256_SRVW4_TT1_128_USFGROn1_VAW2_VSn1_VW2_WSGRA1_WSGRB1_WG64_4_1_WGM1
    SolutionIndex: 77
    SolutionNameMin: Cijk_Ailk_Bjlk_HBH_MT96x128x32_MI32x32x8x1_SE_1LDSB0_AF0EM1_AF1EM1_AMAS3_BL1_EPS0_GRVW4_GSU1_ISA908_KLA_LRVW4_MAC_NLCA3_NLCB1_PGR2_SIA3_SU0_SUS256_SRVW0_TT3_32_USFGROn1_VAW2_VSn1_VW2_WSGRA1_WSGRB1_WG32_8_1_WGM1
    SolutionIndex: 78
    SolutionNameMin: Cijk_Ailk_Bjlk_HBH_MT128x128x16_MI32x32x8x1_SE_1LDSB0_AF0EM8_AF1EM1_AMAS3_BL1_EPS1_GRVW2_GSU1_ISA908_KLA_LRVW4_MAC_NLCA1_NLCB1_PGR1_SIA3_SU32_SUS256_SRVW4_TT2_64_USFGROn1_VAW2_VSn1_VW2_WSGRA1_WSGRB1_WG64_4_1_WGM1
    SolutionIndex: 79
    SolutionNameMin: Cijk_Ailk_Bjlk_HBH_MT32x32x16_MI16x16x16x1_SN_1LDSB0_AF0EM1_AF1EM1_AMAS3_BL1_EPS1_GRVW4_GSU1_ISA908_KLA_LRVW4_MAC_NLCA1_NLCB1_PGR1_SIA3_SU0_SUS128_SRVW4_TT1_16_USFGROn1_VAW2_VSn1_VW2_WSGRA1_WSGRB1_WG32_8_1_WGM1
    SolutionIndex: 80
    SolutionNameMin: Cijk_Ailk_Bjlk_HBH_MT16x16x16_MI16x16x16x1_SE_1LDSB0_AF0EM1_AF1EM1_AMAS3_BL1_EPS1_GRVW4_GSU1_ISA908_KLA_LRVW4_MAC_NLCA1_NLCB1_PGR1_SIA3_SU0_SUS256_SRVW0_TT1_16_USFGROn1_VAW2_VSn1_VW2_WSGRA1_WSGRB1_WG16_4_1_WGM1
    SolutionIndex: 81
    SolutionNameMin: Cijk_Ailk_Bjlk_HBH_MT32x32x64_MI16x16x16x1_SE_1LDSB0_AF0EM8_AF1EM1_AMAS3_BL1_EPS1_GRVW8_GSU1_ISA908_KLA_LRVW4_MAC_NLCA1_NLCB1_PGR1_SIA3_SU32_SUS128_SRVW4_TT1_16_USFGROn1_VAW2_VSn1_VW2_WSGRA1_WSGRB1_WG32_8_1_WGM2
    SolutionIndex: 82
    SolutionNameMin: Cijk_Ailk_Bjlk_HBH_MT32x32x16_MI16x16x16x1_SE_1LDSB0_AF0EM1_AF1EM1_AMAS3_BL1_EPS0_GRVW8_GSU1_ISA908_KLA_LRVW4_MAC_NLCA1_NLCB1_PGR2_SIA3_SU0_SUS256_SRVW4_TT1_16_USFGROn1_VAW2_VSn1_VW2_WSGRA1_WSGRB1_WG32_8_1_WGM1
    SolutionIndex: 83
    SolutionNameMin: Cijk_Ailk_Bjlk_HBH_MT16x16x16_MI16x16x16x1_SE_1LDSB0_AF0EM1_AF1EM1_AMAS3_BL1_EPS0_GRVW2_GSU1_ISA908_KLA_LRVW4_MAC_NLCA1_NLCB1_PGR2_SIA3_SU32_SUS256_SRVW4_TT1_16_USFGROn1_VAW2_VSn1_VW2_WSGRA1_WSGRB1_WG16_4_1_WGM1
    SolutionIndex: 84
    SolutionNameMin: Cijk_Ailk_Bjlk_HBH_MT16x16x16_MI16x16x16x1_SE_1LDSB0_AF0EM1_AF1EM1_AMAS3_BL1_EPS1_GRVW2_GSU1_ISA908_KLA_LRVW4_MAC_NLCA1_NLCB1_PGR1_SIA3_SU0_SUS256_SRVW0_TT1_16_USFGROn1_VAW2_VSn1_VW2_WSGRA1_WSGRB1_WG16_4_1_WGM1
    SolutionIndex: 85
    SolutionNameMin: Cijk_Ailk_Bjlk_HBH_MT16x16x16_MI16x16x16x1_SE_1LDSB0_AF0EM8_AF1EM1_AMAS3_BL1_EPS1_GRVW2_GSU1_ISA908_KLA_LRVW4_MAC_NLCA1_NLCB1_PGR1_SIA3_SU0_SUS256_SRVW0_TT1_16_USFGROn1_VAW2_VSn1_VW2_WSGRA1_WSGRB1_WG16_4_1_WGM2
    SolutionIndex: 86
    SolutionNameMin: Cijk_Ailk_Bjlk_HBH_MT32x32x16_MI16x16x16x1_SE_1LDSB0_AF0EM8_AF1EM1_AMAS3_BL1_EPS1_GRVW4_GSU1_ISA908_KLA_LRVW4_MAC_NLCA1_NLCB1_PGR1_SIA3_SU0_SUS256_SRVW4_TT1_16_USFGROn1_VAW2_VSn1_VW2_WSGRA1_WSGRB1_WG32_8_1_WGM15
    SolutionIndex: 87
    SolutionNameMin: Cijk_Ailk_Bjlk_HBH_MT16x64x32_MI16x16x16x1_SE_1LDSB0_AF0EM8_AF1EM1_AMAS3_BL1_EPS1_GRVW2_GSU1_ISA908_KLA_LRVW4_MAC_NLCA1_NLCB1_PGR1_SIA3_SU0_SUS256_SRVW0_TT1_16_USFGROn1_VAW2_VSn1_VW2_WSGRA1_WSGRB1_WG16_16_1_WGM1
    SolutionIndex: 88
    SolutionNameMin: Cijk_Ailk_Bjlk_HBH_MT32x32x32_MI16x16x16x1_SE_1LDSB0_AF0EM8_AF1EM1_AMAS3_BL1_EPS1_GRVW4_GSU1_ISA908_KLA_LRVW4_MAC_NLCA1_NLCB1_PGR1_SIA3_SU0_SUS256_SRVW4_TT1_16_USFGROn1_VAW2_VSn1_VW2_WSGRA1_WSGRB1_WG32_8_1_WGM1
    SolutionIndex: 89
    SolutionNameMin: Cijk_Ailk_Bjlk_HBH_MT16x16x16_MI16x16x16x1_SE_1LDSB0_AF0EM8_AF1EM1_AMAS3_BL1_EPS0_GRVW2_GSU1_ISA908_KLA_LRVW4_MAC_NLCA1_NLCB1_PGR2_SIA3_SU0_SUS256_SRVW0_TT1_16_USFGROn1_VAW2_VSn1_VW2_WSGRA1_WSGRB1_WG16_4_1_WGM1
    SolutionIndex: 90
    SolutionNameMin: Cijk_Ailk_Bjlk_HBH_MT16x16x16_MI16x16x16x1_SE_1LDSB0_AF0EM8_AF1EM1_AMAS3_BL1_EPS1_GRVW2_GSU1_ISA908_KLA_LRVW4_MAC_NLCA1_NLCB1_PGR1_SIA3_SU0_SUS256_SRVW0_TT1_16_USFGROn1_VAW2_VSn1_VW2_WSGRA1_WSGRB1_WG16_4_1_WGM1
    SolutionIndex: 91
    SolutionNameMin: Cijk_Ailk_Bjlk_HBH_MT32x32x16_MI16x16x16x1_SE_1LDSB0_AF0EM1_AF1EM1_AMAS3_BL1_EPS0_GRVW2_GSU1_ISA908_KLA_LRVW4_MAC_NLCA1_NLCB1_PGR2_SIA3_SU0_SUS256_SRVW4_TT1_16_USFGROn1_VAW2_VSn1_VW2_WSGRA1_WSGRB1_WG32_8_1_WGM2
    SolutionIndex: 92
    SolutionNameMin: Cijk_Ailk_Bjlk_HBH_MT32x32x16_MI16x16x16x1_SE_1LDSB0_AF0EM8_AF1EM1_AMAS3_BL1_EPS1_GRVW2_GSU1_ISA908_KLA_LRVW4_MAC_NLCA1_NLCB1_PGR1_SIA3_SU0_SUS256_SRVW4_TT1_16_USFGROn1_VAW2_VSn1_VW2_WSGRA1_WSGRB1_WG32_8_1_WGM15
    SolutionIndex: 93
    SolutionNameMin: Cijk_Ailk_Bjlk_HBH_MT64x64x16_MI32x32x8x1_SE_1LDSB0_AF0EM8_AF1EM1_AMAS3_BL1_EPS0_GRVW2_GSU1_ISA908_KLA_LRVW4_MAC_NLCA1_NLCB1_PGR2_SIA3_SU32_SUS256_SRVW4_TT1_32_USFGROn1_VAW2_VSn1_VW2_WSGRA1_WSGRB1_WG64_4_1_WGM1
    SolutionIndex: 94
    SolutionNameMin: Cijk_Ailk_Bjlk_HBH_MT64x64x16_MI32x32x8x1_SE_1LDSB0_AF0EM8_AF1EM1_AMAS3_BL1_EPS1_GRVW2_GSU1_ISA908_KLA_LRVW4_MAC_NLCA1_NLCB1_PGR1_SIA3_SU0_SUS256_SRVW4_TT1_32_USFGROn1_VAW2_VSn1_VW2_WSGRA1_WSGRB1_WG64_4_1_WGM1
    SolutionIndex: 95
    SolutionNameMin: Cijk_Ailk_Bjlk_HBH_MT128x64x16_MI32x32x8x1_SE_1LDSB0_AF0EM8_AF1EM1_AMAS3_BL1_EPS0_GRVW2_GSU1_ISA908_KLA_LRVW4_MAC_NLCA1_NLCB1_PGR2_SIA3_SU0_SUS256_SRVW4_TT2_32_USFGROn1_VAW2_VSn1_VW2_WSGRA1_WSGRB1_WG64_4_1_WGM15
    SolutionIndex: 96
    SolutionNameMin: Cijk_Ailk_Bjlk_HBH_MT4x64x32_MI4x4x4x16_SE_1LDSB0_AF0EM8_AF1EM1_AMAS3_BL1_EPS1_GRVW2_GSU1_ISA908_KLA_LRVW4_MAC_NLCA1_NLCB1_PGR1_SIA3_SU0_SUS256_SRVW0_TT1_4_USFGROn1_VAW2_VSn1_VW2_WSGRA1_WSGRB1_WG4_16_1_WGM1
    SolutionIndex: 97
    SolutionNameMin: Cijk_Ailk_Bjlk_HBH_MT64x16x64_MI16x16x16x1_SE_1LDSB0_AF0EM8_AF1EM1_AMAS3_BL1_EPS0_GRVW2_GSU7_ISA908_KLA_LRVW4_MAC_NLCA1_NLCB1_PGR2_SIA3_SU32_SUS256_SRVW0_TT1_16_USFGROn1_VAW1_VSn1_VW2_WSGRA1_WSGRB1_WG64_4_1_WGM2
    SolutionIndex: 98
    SolutionNameMin: Cijk_Ailk_Bjlk_HBH_MT32x64x16_MI16x16x16x1_SE_1LDSB1_AF0EM1_AF1EM1_AMAS3_BL1_EPS1_GRVW2_GSU1_ISA908_KLA_LRVW4_MAC_NLCA1_NLCB1_PGR1_SIA3_SU0_SUS256_SRVW4_TT1_32_USFGROn1_VAW2_VSn1_VW2_WSGRA1_WSGRB1_WG32_8_1_WGM15
    SolutionIndex: 99
    SolutionNameMin: Cijk_Ailk_Bjlk_HBH_MT128x96x64_MI32x32x8x1_SE_1LDSB0_AF0EM8_AF1EM1_AMAS3_BL1_EPS0_GRVW8_GSU1_ISA908_KLA_LRVW4_MAC_NLCA1_NLCB3_PGR2_SIA3_SU0_SUS256_SRVW4_TT1_96_USFGROn1_VAW2_VSn1_VW2_WSGRA1_WSGRB1_WG128_2_1_WGM1
    SolutionIndex: 100
    SolutionNameMin: Cijk_Ailk_Bjlk_HBH_MT128x96x64_MI32x32x8x1_SE_1LDSB0_AF0EM8_AF1EM1_AMAS3_BL1_EPS0_GRVW4_GSU1_ISA908_KLA_LRVW4_MAC_NLCA1_NLCB3_PGR2_SIA3_SU32_SUS128_SRVW4_TT1_96_USFGROn1_VAW2_VSn1_VW2_WSGRA1_WSGRB1_WG128_2_1_WGM2
    SolutionIndex: 101
    SolutionNameMin: Cijk_Ailk_Bjlk_HBH_MT128x288x32_MI32x32x8x1_SE_1LDSB0_AF0EM8_AF1EM1_AMAS3_BL1_EPS0_GRVW2_GSU1_ISA908_KLA_LRVW4_MAC_NLCA1_NLCB9_PGR2_SIA3_SU0_SUS256_SRVW4_TT1_288_USFGROn1_VAW2_VSn1_VW2_WSGRA1_WSGRB1_WG128_2_1_WGM15
    SolutionIndex: 102
    SolutionNameMin: Cijk_Ailk_Bjlk_HBH_MT128x288x32_MI32x32x8x1_SE_1LDSB0_AF0EM8_AF1EM1_AMAS3_BL1_EPS0_GRVW4_GSU1_ISA908_KLA_LRVW4_MAC_NLCA1_NLCB9_PGR2_SIA3_SU0_SUS256_SRVW4_TT1_288_USFGROn1_VAW2_VSn1_VW2_WSGRA1_WSGRB1_WG128_2_1_WGM15
    SolutionIndex: 103
    SolutionNameMin: Cijk_Ailk_Bjlk_HBH_MT128x256x16_MI32x32x8x1_SE_1LDSB0_AF0EM8_AF1EM1_AMAS3_BL1_EPS0_GRVW8_GSU1_ISA908_KLA_LRVW4_MAC_NLCA1_NLCB1_PGR2_SIA3_SU0_SUS256_SRVW4_TT2_128_USFGROn1_VAW2_VSn1_VW2_WSGRA1_WSGRB1_WG64_4_1_WGM15
    SolutionIndex: 104
    SolutionNameMin: Cijk_Ailk_Bjlk_HBH_MT256x160x32_MI32x32x8x1_SE_1LDSB0_AF0EM8_AF1EM1_AMAS3_BL1_EPS1_GRVW4_GSU1_ISA908_KLA_LRVW4_MAC_NLCA1_NLCB5_PGR1_SIA3_SU0_SUS256_SRVW4_TT2_160_USFGROn1_VAW2_VSn1_VW2_WSGRA1_WSGRB1_WG128_2_1_WGM15
    SolutionIndex: 105
    SolutionNameMin: Cijk_Ailk_Bjlk_HBH_MT16x16x16_MI16x16x16x1_SE_1LDSB0_AF0EM1_AF1EM1_AMAS3_BL1_EPS1_GRVW2_GSU1_ISA908_KLA_LRVW4_MAC_NLCA1_NLCB1_PGR1_SIA3_SU32_SUS128_SRVW0_TT1_16_USFGROn1_VAW2_VSn1_VW2_WSGRA1_WSGRB1_WG16_4_1_WGM15
    SolutionIndex: 106
    SolutionNameMin: Cijk_Ailk_Bjlk_HBH_MT16x64x64_MI16x16x16x1_SE_1LDSB0_AF0EM1_AF1EM1_AMAS3_BL1_EPS0_GRVW8_GSU15_ISA908_KLA_LRVW4_MAC_NLCA1_NLCB1_PGR2_SIA3_SU32_SUS256_SRVW0_TT1_16_USFGROn1_VAW1_VSn1_VW2_WSGRA1_WSGRB1_WG16_16_1_WGM1
    SolutionIndex: 107
    SolutionNameMin: Cijk_Ailk_Bjlk_HBH_MT32x64x16_MI16x16x16x1_SE_1LDSB0_AF0EM1_AF1EM1_AMAS3_BL1_EPS1_GRVW2_GSU1_ISA908_KLA_LRVW4_MAC_NLCA1_NLCB1_PGR1_SIA3_SU32_SUS128_SRVW4_TT1_32_USFGROn1_VAW2_VSn1_VW2_WSGRA1_WSGRB1_WG32_8_1_WGM2
    SolutionIndex: 108
    SolutionNameMin: Cijk_Ailk_Bjlk_HBH_MT32x32x16_MI16x16x16x1_SE_1LDSB0_AF0EM1_AF1EM1_AMAS3_BL1_EPS1_GRVW4_GSU1_ISA908_KLA_LRVW4_MAC_NLCA1_NLCB1_PGR1_SIA3_SU0_SUS256_SRVW4_TT1_16_USFGROn1_VAW2_VSn1_VW2_WSGRA1_WSGRB1_WG32_8_1_WGM1
    SolutionIndex: 109
    SolutionNameMin: Cijk_Ailk_Bjlk_HBH_MT32x64x64_MI16x16x16x1_SE_1LDSB0_AF0EM1_AF1EM1_AMAS3_BL1_EPS0_GRVW8_GSU1_ISA908_KLA_LRVW4_MAC_NLCA1_NLCB1_PGR2_SIA3_SU32_SUS128_SRVW4_TT1_32_USFGROn1_VAW2_VSn1_VW2_WSGRA1_WSGRB1_WG32_8_1_WGM2
    SolutionIndex: 110
    SolutionNameMin: Cijk_Ailk_Bjlk_HBH_MT64x64x64_MI32x32x8x1_SE_1LDSB0_AF0EM8_AF1EM1_AMAS3_BL1_EPS0_GRVW8_GSU15_ISA908_KLA_LRVW4_MAC_NLCA1_NLCB1_PGR2_SIA3_SU32_SUS128_SRVW4_TT1_32_USFGROn1_VAW1_VSn1_VW2_WSGRA1_WSGRB1_WG64_4_1_WGM1
    SolutionIndex: 111
    SolutionNameMin: Cijk_Ailk_Bjlk_HBH_MT128x160x32_MI32x32x8x1_SE_1LDSB0_AF0EM8_AF1EM1_AMAS3_BL1_EPS0_GRVW4_GSU7_ISA908_KLA_LRVW4_MAC_NLCA1_NLCB5_PGR2_SIA3_SU0_SUS256_SRVW4_TT1_160_USFGROn1_VAW1_VSn1_VW2_WSGRA1_WSGRB1_WG128_2_1_WGM1
    SolutionIndex: 112
    SolutionNameMin: Cijk_Ailk_Bjlk_HBH_MT128x128x32_MI32x32x8x1_SE_1LDSB0_AF0EM8_AF1EM1_AMAS3_BL1_EPS0_GRVW4_GSU3_ISA908_KLA_LRVW4_MAC_NLCA1_NLCB1_PGR2_SIA3_SU0_SUS256_SRVW4_TT2_64_USFGROn1_VAW1_VSn1_VW2_WSGRA1_WSGRB1_WG64_4_1_WGM15
    SolutionIndex: 113
    SolutionNameMin: Cijk_Ailk_Bjlk_HBH_MT128x256x16_MI32x32x8x1_SE_1LDSB0_AF0EM8_AF1EM1_AMAS3_BL1_EPS0_GRVW4_GSU5_ISA908_KLA_LRVW4_MAC_NLCA1_NLCB1_PGR2_SIA3_SU0_SUS256_SRVW4_TT2_128_USFGROn1_VAW1_VSn1_VW2_WSGRA1_WSGRB1_WG64_4_1_WGM15
    SolutionIndex: 114
    SolutionNameMin: Cijk_Ailk_Bjlk_HBH_MT128x192x32_MI32x32x8x1_SE_1LDSB0_AF0EM8_AF1EM1_AMAS3_BL1_EPS0_GRVW4_GSU3_ISA908_KLA_LRVW4_MAC_NLCA1_NLCB3_PGR2_SIA3_SU0_SUS256_SRVW4_TT2_96_USFGROn1_VAW1_VSn1_VW2_WSGRA1_WSGRB1_WG64_4_1_WGM1
    SolutionIndex: 115
    SolutionNameMin: Cijk_Ailk_Bjlk_HBH_MT128x128x32_MI32x32x8x1_SE_1LDSB0_AF0EM8_AF1EM1_AMAS3_BL1_EPS0_GRVW4_GSU2_ISA908_KLA_LRVW4_MAC_NLCA1_NLCB1_PGR2_SIA3_SU0_SUS256_SRVW4_TT2_64_USFGROn1_VAW1_VSn1_VW2_WSGRA1_WSGRB1_WG64_4_1_WGM15
    SolutionIndex: 116
    SolutionNameMin: Cijk_Ailk_Bjlk_HBH_MT128x128x32_MI32x32x8x1_SE_1LDSB0_AF0EM8_AF1EM1_AMAS3_BL1_EPS0_GRVW8_GSU7_ISA908_KLA_LRVW4_MAC_NLCA1_NLCB1_PGR2_SIA3_SU0_SUS256_SRVW4_TT2_64_USFGROn1_VAW1_VSn1_VW2_WSGRA1_WSGRB1_WG64_4_1_WGM1
    SolutionIndex: 117
    SolutionNameMin: Cijk_Ailk_Bjlk_HBH_MT96x128x64_MI32x32x8x1_SE_1LDSB0_AF0EM8_AF1EM1_AMAS3_BL1_EPS0_GRVW8_GSU1_ISA908_KLA_LRVW4_MAC_NLCA3_NLCB1_PGR2_SIA3_SU0_SUS256_SRVW0_TT3_32_USFGROn1_VAW2_VSn1_VW2_WSGRA1_WSGRB1_WG32_8_1_WGM15
    SolutionIndex: 118
    SolutionNameMin: Cijk_Ailk_Bjlk_HBH_MT128x256x16_MI32x32x8x1_SN_1LDSB0_AF0EM8_AF1EM1_AMAS3_BL1_EPS0_GRVW8_GSU3_ISA908_KLA_LRVW4_MAC_NLCA1_NLCB1_PGR2_SIA3_SU0_SUS256_SRVW4_TT2_128_USFGROn1_VAW1_VSn1_VW2_WSGRA1_WSGRB1_WG64_4_1_WGM1
    SolutionIndex: 119
    SolutionNameMin: Cijk_Ailk_Bjlk_HBH_MT128x128x32_MI32x32x8x1_SE_1LDSB0_AF0EM1_AF1EM1_AMAS3_BL1_EPS0_GRVW8_GSU1_ISA908_KLA_LRVW4_MAC_NLCA1_NLCB1_PGR2_SIA3_SU0_SUS256_SRVW4_TT2_64_USFGROn1_VAW2_VSn1_VW2_WSGRA1_WSGRB1_WG64_4_1_WGM1
    SolutionIndex: 120
    SolutionNameMin: Cijk_Ailk_Bjlk_HBH_MT128x128x32_MI32x32x8x1_SN_1LDSB0_AF0EM8_AF1EM1_AMAS3_BL1_EPS0_GRVW8_GSU1_ISA908_KLA_LRVW4_MAC_NLCA1_NLCB1_PGR2_SIA3_SU0_SUS256_SRVW4_TT2_64_USFGROn1_VAW2_VSn1_VW2_WSGRA1_WSGRB1_WG64_4_1_WGM2
    SolutionIndex: 121
    SolutionNameMin: Cijk_Ailk_Bjlk_HBH_MT128x160x32_MI32x32x8x1_SE_1LDSB0_AF0EM8_AF1EM1_AMAS3_BL1_EPS0_GRVW4_GSU1_ISA908_KLA_LRVW4_MAC_NLCA1_NLCB5_PGR2_SIA3_SU0_SUS256_SRVW4_TT1_160_USFGROn1_VAW2_VSn1_VW2_WSGRA1_WSGRB1_WG128_2_1_WGM15
    SolutionIndex: 122
    SolutionNameMin: Cijk_Ailk_Bjlk_HBH_MT256x128x16_MI32x32x8x1_SN_1LDSB0_AF0EM8_AF1EM1_AMAS3_BL1_EPS0_GRVW8_GSU3_ISA908_KLA_LRVW4_MAC_NLCA1_NLCB1_PGR2_SIA3_SU0_SUS256_SRVW0_TT4_64_USFGROn1_VAW1_VSn1_VW2_WSGRA1_WSGRB1_WG64_4_1_WGM15
    SolutionIndex: 123
    SolutionNameMin: Cijk_Ailk_Bjlk_HBH_MT128x192x16_MI32x32x8x1_SE_1LDSB0_AF0EM8_AF1EM1_AMAS3_BL1_EPS0_GRVW4_GSU1_ISA908_KLA_LRVW4_MAC_NLCA1_NLCB3_PGR2_SIA3_SU32_SUS128_SRVW4_TT2_96_USFGROn1_VAW2_VSn1_VW2_WSGRA1_WSGRB1_WG64_4_1_WGM2
    SolutionIndex: 124
    SolutionNameMin: Cijk_Ailk_Bjlk_HBH_MT128x192x32_MI32x32x8x1_SE_1LDSB0_AF0EM8_AF1EM1_AMAS3_BL1_EPS0_GRVW4_GSU1_ISA908_KLA_LRVW4_MAC_NLCA1_NLCB3_PGR2_SIA3_SU0_SUS256_SRVW4_TT2_96_USFGROn1_VAW2_VSn1_VW2_WSGRA1_WSGRB1_WG64_4_1_WGM2
    SolutionIndex: 125
    SolutionNameMin: Cijk_Ailk_Bjlk_HBH_MT128x192x16_MI32x32x8x1_SN_1LDSB0_AF0EM8_AF1EM1_AMAS3_BL1_EPS0_GRVW4_GSU1_ISA908_KLA_LRVW4_MAC_NLCA1_NLCB3_PGR2_SIA3_SU0_SUS256_SRVW4_TT2_96_USFGROn1_VAW2_VSn1_VW2_WSGRA1_WSGRB1_WG64_4_1_WGM15
    SolutionIndex: 126
    SolutionNameMin: Cijk_Ailk_Bjlk_HBH_MT128x128x32_MI32x32x8x1_SE_1LDSB0_AF0EM1_AF1EM1_AMAS3_BL1_EPS0_GRVW8_GSU1_ISA908_KLA_LRVW4_MAC_NLCA1_NLCB1_PGR2_SIA3_SU32_SUS128_SRVW4_TT2_64_USFGROn1_VAW2_VSn1_VW2_WSGRA1_WSGRB1_WG64_4_1_WGM1
    SolutionIndex: 127
    SolutionNameMin: Cijk_Ailk_Bjlk_HBH_MT128x256x16_MI32x32x8x1_SE_1LDSB0_AF0EM8_AF1EM1_AMAS3_BL1_EPS0_GRVW8_GSU1_ISA908_KLA_LRVW4_MAC_NLCA1_NLCB1_PGR2_SIA3_SU32_SUS128_SRVW4_TT2_128_USFGROn1_VAW2_VSn1_VW2_WSGRA1_WSGRB1_WG64_4_1_WGM2
    SolutionIndex: 128
    SolutionNameMin: Cijk_Ailk_Bjlk_HBH_MT128x256x16_MI32x32x8x1_SE_1LDSB0_AF0EM8_AF1EM1_AMAS3_BL1_EPS0_GRVW8_GSU1_ISA908_KLA_LRVW4_MAC_NLCA1_NLCB1_PGR2_SIA3_SU32_SUS256_SRVW4_TT2_128_USFGROn1_VAW2_VSn1_VW2_WSGRA1_WSGRB1_WG64_4_1_WGM1
    SolutionIndex: 129
    SolutionNameMin: Cijk_Ailk_Bjlk_HBH_MT128x256x32_MI32x32x8x1_SE_1LDSB0_AF0EM8_AF1EM1_AMAS3_BL1_EPS1_GRVW8_GSU1_ISA908_KLA_LRVW4_MAC_NLCA1_NLCB1_PGR1_SIA3_SU32_SUS256_SRVW4_TT2_128_USFGROn1_VAW2_VSn1_VW2_WSGRA1_WSGRB1_WG64_4_1_WGM2
    SolutionIndex: 130
    SolutionNameMin: Cijk_Ailk_Bjlk_HBH_MT128x256x16_MI32x32x8x1_SE_1LDSB0_AF0EM1_AF1EM1_AMAS3_BL1_EPS0_GRVW8_GSU1_ISA908_KLA_LRVW4_MAC_NLCA1_NLCB1_PGR2_SIA3_SU0_SUS256_SRVW4_TT2_128_USFGROn1_VAW2_VSn1_VW2_WSGRA1_WSGRB1_WG64_4_1_WGM15
    SolutionIndex: 131
    SolutionNameMin: Cijk_Ailk_Bjlk_HBH_MT256x128x32_MI32x32x8x1_SN_1LDSB0_AF0EM8_AF1EM1_AMAS3_BL1_EPS1_GRVW8_GSU1_ISA908_KLA_LRVW4_MAC_NLCA1_NLCB1_PGR1_SIA3_SU0_SUS256_SRVW4_TT4_64_USFGROn1_VAW2_VSn1_VW2_WSGRA1_WSGRB1_WG64_4_1_WGM1
    SolutionIndex: 132
    SolutionNameMin: Cijk_Ailk_Bjlk_HBH_MT128x256x32_MI32x32x8x1_SE_1LDSB0_AF0EM8_AF1EM1_AMAS3_BL1_EPS0_GRVW4_GSU1_ISA908_KLA_LRVW4_MAC_NLCA1_NLCB1_PGR2_SIA3_SU0_SUS256_SRVW4_TT2_128_USFGROn1_VAW2_VSn1_VW2_WSGRA1_WSGRB1_WG64_4_1_WGM2
    SolutionIndex: 133
    SolutionNameMin: Cijk_Ailk_Bjlk_HBH_MT128x288x32_MI32x32x8x1_SE_1LDSB0_AF0EM8_AF1EM1_AMAS3_BL1_EPS1_GRVW4_GSU1_ISA908_KLA_LRVW4_MAC_NLCA1_NLCB9_PGR1_SIA3_SU0_SUS256_SRVW4_TT1_288_USFGROn1_VAW2_VSn1_VW2_WSGRA1_WSGRB1_WG128_2_1_WGM1
    SolutionIndex: 134
    SolutionNameMin: Cijk_Ailk_Bjlk_HBH_MT128x288x32_MI32x32x8x1_SN_1LDSB0_AF0EM8_AF1EM1_AMAS3_BL1_EPS1_GRVW4_GSU1_ISA908_KLA_LRVW4_MAC_NLCA1_NLCB9_PGR1_SIA3_SU0_SUS128_SRVW4_TT1_288_USFGROn1_VAW2_VSn1_VW2_WSGRA1_WSGRB1_WG128_2_1_WGM15
    SolutionIndex: 135
    SolutionNameMin: Cijk_Ailk_Bjlk_HBH_MT256x160x32_MI32x32x8x1_SE_1LDSB0_AF0EM8_AF1EM1_AMAS3_BL1_EPS1_GRVW4_GSU1_ISA908_KLA_LRVW4_MAC_NLCA1_NLCB5_PGR1_SIA3_SU0_SUS256_SRVW4_TT2_160_USFGROn1_VAW2_VSn1_VW2_WSGRA1_WSGRB1_WG128_2_1_WGM1
    SolutionIndex: 136
    SolutionNameMin: Cijk_Ailk_Bjlk_HBH_MT256x160x32_MI32x32x8x1_SE_1LDSB0_AF0EM8_AF1EM1_AMAS3_BL1_EPS1_GRVW4_GSU1_ISA908_KLA_LRVW4_MAC_NLCA1_NLCB5_PGR1_SIA3_SU32_SUS128_SRVW4_TT2_160_USFGROn1_VAW2_VSn1_VW2_WSGRA1_WSGRB1_WG128_2_1_WGM1
    SolutionIndex: 137
    SolutionNameMin: Cijk_Ailk_Bjlk_HBH_MT256x192x32_MI32x32x8x1_SE_1LDSB1_AF0EM8_AF1EM1_AMAS3_BL1_EPS1_GRVW8_GSU1_ISA908_KLA_LRVW4_MAC_NLCA1_NLCB3_PGR1_SIA3_SU32_SUS128_SRVW4_TT4_96_USFGROn1_VAW2_VSn1_VW2_WSGRA1_WSGRB1_WG64_4_1_WGM2
    SolutionIndex: 138
    SolutionNameMin: Cijk_Ailk_Bjlk_HBH_MT256x192x32_MI32x32x8x1_SE_1LDSB0_AF0EM8_AF1EM1_AMAS3_BL1_EPS1_GRVW8_GSU1_ISA908_KLA_LRVW4_MAC_NLCA1_NLCB3_PGR1_SIA3_SU32_SUS256_SRVW4_TT4_96_USFGROn1_VAW2_VSn1_VW2_WSGRA1_WSGRB1_WG64_4_1_WGM2
    SolutionIndex: 139
    SolutionNameMin: Cijk_Ailk_Bjlk_HBH_MT128x256x16_MI32x32x8x1_SN_1LDSB0_AF0EM1_AF1EM1_AMAS3_BL1_EPS0_GRVW4_GSU1_ISA908_KLA_LRVW4_MAC_NLCA1_NLCB1_PGR2_SIA3_SU0_SUS256_SRVW4_TT2_128_USFGROn1_VAW2_VSn1_VW2_WSGRA1_WSGRB1_WG64_4_1_WGM15
    SolutionIndex: 140
    SolutionNameMin: Cijk_Ailk_Bjlk_HBH_MT64x32x16_MI16x16x16x1_SE_1LDSB0_AF0EM8_AF1EM1_AMAS3_BL1_EPS1_GRVW2_GSU1_ISA908_KLA_LRVW4_MAC_NLCA1_NLCB1_PGR1_SIA3_SU0_SUS256_SRVW4_TT2_16_USFGROn1_VAW2_VSn1_VW2_WSGRA1_WSGRB1_WG32_8_1_WGM15
    SolutionIndex: 141
    SolutionNameMin: Cijk_Ailk_Bjlk_HBH_MT128x256x16_MI32x32x8x1_SE_1LDSB1_AF0EM8_AF1EM1_AMAS3_BL1_EPS0_GRVW8_GSU1_ISA908_KLA_LRVW4_MAC_NLCA1_NLCB1_PGR2_SIA3_SU32_SUS128_SRVW4_TT2_128_USFGROn1_VAW2_VSn1_VW2_WSGRA1_WSGRB1_WG64_4_1_WGM15
    SolutionIndex: 142
    SolutionNameMin: Cijk_Ailk_Bjlk_HBH_MT128x64x32_MI32x32x8x1_SE_1LDSB0_AF0EM1_AF1EM1_AMAS3_BL1_EPS0_GRVW8_GSU1_ISA908_KLA_LRVW4_MAC_NLCA1_NLCB1_PGR2_SIA3_SU32_SUS256_SRVW4_TT2_32_USFGROn1_VAW2_VSn1_VW2_WSGRA1_WSGRB1_WG64_4_1_WGM1
    SolutionIndex: 143
    SolutionNameMin: Cijk_Ailk_Bjlk_HBH_MT128x256x32_MI32x32x8x1_SE_1LDSB0_AF0EM8_AF1EM1_AMAS3_BL1_EPS0_GRVW8_GSU7_ISA908_KLA_LRVW4_MAC_NLCA1_NLCB1_PGR2_SIA3_SU0_SUS256_SRVW4_TT2_128_USFGROn1_VAW1_VSn1_VW2_WSGRA1_WSGRB1_WG64_4_1_WGM1
    SolutionIndex: 144
    SolutionNameMin: Cijk_Ailk_Bjlk_HBH_MT16x16x64_MI16x16x16x1_SE_1LDSB0_AF0EM8_AF1EM1_AMAS3_BL1_EPS0_GRVW2_GSU3_ISA908_KLA_LRVW4_MAC_NLCA1_NLCB1_PGR2_SIA3_SU0_SUS256_SRVW0_TT1_16_USFGROn1_VAW1_VSn1_VW2_WSGRA1_WSGRB1_WG16_4_1_WGM1
    SolutionIndex: 145
    SolutionNameMin: Cijk_Ailk_Bjlk_HBH_MT128x128x64_MI32x32x8x1_SE_1LDSB0_AF0EM8_AF1EM1_AMAS3_BL1_EPS0_GRVW8_GSU15_ISA908_KLA_LRVW4_MAC_NLCA1_NLCB1_PGR2_SIA3_SU0_SUS256_SRVW4_TT2_64_USFGROn1_VAW1_VSn1_VW2_WSGRA1_WSGRB1_WG64_4_1_WGM2
    SolutionIndex: 146
    SolutionNameMin: Cijk_Ailk_Bjlk_HBH_MT64x64x64_MI32x32x8x1_SE_1LDSB0_AF0EM8_AF1EM1_AMAS3_BL1_EPS1_GRVW8_GSU3_ISA908_KLA_LRVW4_MAC_NLCA1_NLCB1_PGR1_SIA3_SU32_SUS256_SRVW0_TT1_32_USFGROn1_VAW1_VSn1_VW2_WSGRA1_WSGRB1_WG64_4_1_WGM2
    SolutionIndex: 147
    SolutionNameMin: Cijk_Ailk_Bjlk_HBH_MT64x32x16_MI16x16x16x1_SE_1LDSB1_AF0EM8_AF1EM1_AMAS3_BL1_EPS0_GRVW4_GSU1_ISA908_KLA_LRVW4_MAC_NLCA1_NLCB1_PGR2_SIA3_SU32_SUS128_SRVW4_TT2_16_USFGROn1_VAW2_VSn1_VW2_WSGRA1_WSGRB1_WG32_8_1_WGM15
    SolutionIndex: 148
    SolutionNameMin: Cijk_Ailk_Bjlk_HBH_MT128x64x32_MI32x32x8x1_SN_1LDSB0_AF0EM8_AF1EM1_AMAS3_BL1_EPS0_GRVW8_GSU1_ISA908_KLA_LRVW4_MAC_NLCA1_NLCB1_PGR2_SIA3_SU32_SUS128_SRVW4_TT2_32_USFGROn1_VAW2_VSn1_VW2_WSGRA1_WSGRB1_WG64_4_1_WGM2
    SolutionIndex: 149
    SolutionNameMin: Cijk_Ailk_Bjlk_HBH_MT32x32x64_MI16x16x16x1_SE_1LDSB0_AF0EM8_AF1EM1_AMAS3_BL1_EPS1_GRVW8_GSU1_ISA908_KLA_LRVW4_MAC_NLCA1_NLCB1_PGR1_SIA3_SU0_SUS256_SRVW4_TT1_16_USFGROn1_VAW2_VSn1_VW2_WSGRA1_WSGRB1_WG32_8_1_WGM15
    SolutionIndex: 150
    SolutionNameMin: Cijk_Ailk_Bjlk_HBH_MT64x64x64_MI32x32x8x1_SE_1LDSB0_AF0EM8_AF1EM1_AMAS3_BL1_EPS1_GRVW8_GSU1_ISA908_KLA_LRVW4_MAC_NLCA1_NLCB1_PGR1_SIA3_SU32_SUS256_SRVW4_TT1_32_USFGROn1_VAW2_VSn1_VW2_WSGRA1_WSGRB1_WG64_4_1_WGM1
    SolutionIndex: 151
    SolutionNameMin: Cijk_Ailk_Bjlk_HBH_MT128x128x32_MI32x32x8x1_SE_1LDSB0_AF0EM8_AF1EM1_AMAS3_BL1_EPS0_GRVW8_GSU7_ISA908_KLA_LRVW4_MAC_NLCA1_NLCB1_PGR2_SIA3_SU32_SUS128_SRVW4_TT2_64_USFGROn1_VAW1_VSn1_VW2_WSGRA1_WSGRB1_WG64_4_1_WGM2
    SolutionIndex: 152
    SolutionNameMin: Cijk_Ailk_Bjlk_HBH_MT128x128x32_MI32x32x8x1_SE_1LDSB0_AF0EM8_AF1EM1_AMAS3_BL1_EPS0_GRVW2_GSU7_ISA908_KLA_LRVW4_MAC_NLCA1_NLCB1_PGR2_SIA3_SU32_SUS256_SRVW4_TT2_64_USFGROn1_VAW1_VSn1_VW2_WSGRA1_WSGRB1_WG64_4_1_WGM15
    SolutionIndex: 153
    SolutionNameMin: Cijk_Ailk_Bjlk_HBH_MT128x128x32_MI32x32x8x1_SE_1LDSB0_AF0EM8_AF1EM1_AMAS3_BL1_EPS0_GRVW8_GSU7_ISA908_KLA_LRVW4_MAC_NLCA1_NLCB1_PGR2_SIA3_SU32_SUS128_SRVW4_TT2_64_USFGROn1_VAW1_VSn1_VW2_WSGRA1_WSGRB1_WG64_4_1_WGM15
    SolutionIndex: 154
    SolutionNameMin: Cijk_Ailk_Bjlk_HBH_MT128x128x64_MI32x32x8x1_SE_1LDSB0_AF0EM8_AF1EM1_AMAS3_BL1_EPS0_GRVW8_GSU7_ISA908_KLA_LRVW4_MAC_NLCA1_NLCB1_PGR2_SIA3_SU0_SUS256_SRVW4_TT2_64_USFGROn1_VAW1_VSn1_VW2_WSGRA1_WSGRB1_WG64_4_1_WGM15
    SolutionIndex: 155
    SolutionNameMin: Cijk_Ailk_Bjlk_HBH_MT128x128x32_MI32x32x8x1_SE_1LDSB0_AF0EM8_AF1EM1_AMAS3_BL1_EPS0_GRVW4_GSU7_ISA908_KLA_LRVW4_MAC_NLCA1_NLCB1_PGR2_SIA3_SU32_SUS256_SRVW4_TT2_64_USFGROn1_VAW1_VSn1_VW2_WSGRA1_WSGRB1_WG64_4_1_WGM15
    SolutionIndex: 156
    SolutionNameMin: Cijk_Ailk_Bjlk_HBH_MT128x128x64_MI32x32x8x1_SE_1LDSB0_AF0EM8_AF1EM1_AMAS3_BL1_EPS0_GRVW8_GSU7_ISA908_KLA_LRVW4_MAC_NLCA1_NLCB1_PGR2_SIA3_SU32_SUS128_SRVW4_TT2_64_USFGROn1_VAW1_VSn1_VW2_WSGRA1_WSGRB1_WG64_4_1_WGM15
    SolutionIndex: 157
    SolutionNameMin: Cijk_Ailk_Bjlk_HBH_MT128x128x64_MI32x32x8x1_SE_1LDSB0_AF0EM8_AF1EM1_AMAS3_BL1_EPS0_GRVW8_GSU7_ISA908_KLA_LRVW4_MAC_NLCA1_NLCB1_PGR2_SIA3_SU32_SUS256_SRVW4_TT2_64_USFGROn1_VAW1_VSn1_VW2_WSGRA1_WSGRB1_WG64_4_1_WGM2
    SolutionIndex: 158
    SolutionNameMin: Cijk_Ailk_Bjlk_HBH_MT128x128x64_MI32x32x8x1_SE_1LDSB0_AF0EM8_AF1EM1_AMAS3_BL1_EPS0_GRVW4_GSU7_ISA908_KLA_LRVW4_MAC_NLCA1_NLCB1_PGR2_SIA3_SU32_SUS128_SRVW4_TT2_64_USFGROn1_VAW1_VSn1_VW2_WSGRA1_WSGRB1_WG64_4_1_WGM1
    SolutionIndex: 159
    SolutionNameMin: Cijk_Ailk_Bjlk_HBH_MT128x128x64_MI32x32x8x1_SE_1LDSB0_AF0EM8_AF1EM1_AMAS3_BL1_EPS0_GRVW8_GSU7_ISA908_KLA_LRVW4_MAC_NLCA1_NLCB1_PGR2_SIA3_SU0_SUS256_SRVW4_TT2_64_USFGROn1_VAW1_VSn1_VW2_WSGRA1_WSGRB1_WG64_4_1_WGM2
    SolutionIndex: 160
    SolutionNameMin: Cijk_Ailk_Bjlk_HBH_MT128x128x64_MI32x32x8x1_SE_1LDSB0_AF0EM8_AF1EM1_AMAS3_BL1_EPS0_GRVW8_GSU7_ISA908_KLA_LRVW4_MAC_NLCA1_NLCB1_PGR2_SIA3_SU32_SUS128_SRVW4_TT2_64_USFGROn1_VAW1_VSn1_VW2_WSGRA1_WSGRB1_WG64_4_1_WGM1
    SolutionIndex: 161
    SolutionNameMin: Cijk_Ailk_Bjlk_HBH_MT128x128x64_MI32x32x8x1_SE_1LDSB0_AF0EM8_AF1EM1_AMAS3_BL1_EPS0_GRVW8_GSU7_ISA908_KLA_LRVW4_MAC_NLCA1_NLCB1_PGR2_SIA3_SU32_SUS256_SRVW4_TT2_64_USFGROn1_VAW1_VSn1_VW2_WSGRA1_WSGRB1_WG64_4_1_WGM15
    SolutionIndex: 162
    SolutionNameMin: Cijk_Ailk_Bjlk_HBH_MT128x128x64_MI32x32x8x1_SE_1LDSB0_AF0EM8_AF1EM1_AMAS3_BL1_EPS0_GRVW8_GSU7_ISA908_KLA_LRVW4_MAC_NLCA1_NLCB1_PGR2_SIA3_SU32_SUS128_SRVW4_TT2_64_USFGROn1_VAW1_VSn1_VW2_WSGRA1_WSGRB1_WG64_4_1_WGM2
    SolutionIndex: 163
    SolutionNameMin: Cijk_Ailk_Bjlk_HBH_MT128x256x32_MI32x32x8x1_SE_1LDSB0_AF0EM8_AF1EM1_AMAS3_BL1_EPS1_GRVW8_GSU15_ISA908_KLA_LRVW4_MAC_NLCA1_NLCB1_PGR1_SIA3_SU0_SUS256_SRVW4_TT2_128_USFGROn1_VAW1_VSn1_VW2_WSGRA1_WSGRB1_WG64_4_1_WGM15
    SolutionIndex: 164
    SolutionNameMin: Cijk_Ailk_Bjlk_HBH_MT128x256x32_MI32x32x8x1_SE_1LDSB0_AF0EM8_AF1EM1_AMAS3_BL1_EPS0_GRVW4_GSU7_ISA908_KLA_LRVW4_MAC_NLCA1_NLCB1_PGR2_SIA3_SU0_SUS256_SRVW4_TT2_128_USFGROn1_VAW1_VSn1_VW2_WSGRA1_WSGRB1_WG64_4_1_WGM2
    SolutionIndex: 165
    SolutionNameMin: Cijk_Ailk_Bjlk_HBH_MT64x64x16_MI32x32x8x1_SE_1LDSB0_AF0EM8_AF1EM1_AMAS3_BL1_EPS0_GRVW4_GSU1_ISA908_KLA_LRVW4_MAC_NLCA1_NLCB1_PGR2_SIA3_SU0_SUS256_SRVW4_TT1_32_USFGROn1_VAW2_VSn1_VW2_WSGRA1_WSGRB1_WG64_4_1_WGM15
    SolutionIndex: 166
    SolutionNameMin: Cijk_Ailk_Bjlk_HBH_MT128x96x64_MI32x32x8x1_SE_1LDSB0_AF0EM8_AF1EM1_AMAS3_BL1_EPS1_GRVW8_GSU1_ISA908_KLA_LRVW4_MAC_NLCA1_NLCB3_PGR1_SIA3_SU0_SUS256_SRVW4_TT1_96_USFGROn1_VAW2_VSn1_VW2_WSGRA1_WSGRB1_WG128_2_1_WGM2
    SolutionIndex: 167
    SolutionNameMin: Cijk_Ailk_Bjlk_HBH_MT128x256x32_MI32x32x8x1_SE_1LDSB0_AF0EM1_AF1EM1_AMAS3_BL1_EPS0_GRVW8_GSU7_ISA908_KLA_LRVW4_MAC_NLCA1_NLCB1_PGR2_SIA3_SU0_SUS256_SRVW4_TT2_128_USFGROn1_VAW1_VSn1_VW2_WSGRA1_WSGRB1_WG64_4_1_WGM1
    SolutionIndex: 168
    SolutionNameMin: Cijk_Ailk_Bjlk_HBH_MT128x64x16_MI32x32x8x1_SE_1LDSB0_AF0EM8_AF1EM1_AMAS3_BL1_EPS0_GRVW2_GSU1_ISA908_KLA_LRVW4_MAC_NLCA1_NLCB1_PGR2_SIA3_SU0_SUS256_SRVW4_TT2_32_USFGROn1_VAW2_VSn1_VW2_WSGRA1_WSGRB1_WG64_4_1_WGM1
    SolutionIndex: 169
    SolutionNameMin: Cijk_Ailk_Bjlk_HBH_MT128x128x32_MI32x32x8x1_SE_1LDSB0_AF0EM8_AF1EM1_AMAS3_BL1_EPS0_GRVW2_GSU1_ISA908_KLA_LRVW4_MAC_NLCA1_NLCB1_PGR2_SIA3_SU32_SUS128_SRVW4_TT2_64_USFGROn1_VAW2_VSn1_VW2_WSGRA1_WSGRB1_WG64_4_1_WGM1
    SolutionIndex: 170
    SolutionNameMin: Cijk_Ailk_Bjlk_HBH_MT64x64x32_MI32x32x8x1_SE_1LDSB0_AF0EM8_AF1EM1_AMAS3_BL1_EPS0_GRVW4_GSU1_ISA908_KLA_LRVW4_MAC_NLCA1_NLCB1_PGR2_SIA3_SU0_SUS256_SRVW4_TT1_32_USFGROn1_VAW2_VSn1_VW2_WSGRA1_WSGRB1_WG64_4_1_WGM1
    SolutionIndex: 171
    SolutionNameMin: Cijk_Ailk_Bjlk_HBH_MT128x64x16_MI32x32x8x1_SE_1LDSB0_AF0EM8_AF1EM1_AMAS3_BL1_EPS0_GRVW2_GSU1_ISA908_KLA_LRVW4_MAC_NLCA1_NLCB1_PGR2_SIA3_SU32_SUS128_SRVW4_TT2_32_USFGROn1_VAW2_VSn1_VW2_WSGRA1_WSGRB1_WG64_4_1_WGM15
    SolutionIndex: 172
    SolutionNameMin: Cijk_Ailk_Bjlk_HBH_MT256x144x32_MI16x16x16x1_SE_1LDSB0_AF0EM8_AF1EM1_AMAS3_BL1_EPS0_GRVW2_GSU1_ISA908_KLA_LRVW4_MAC_NLCA2_NLCB9_PGR2_SIA3_SU0_SUS256_SRVW4_TT4_144_USFGROn1_VAW2_VSn1_VW2_WSGRA1_WSGRB1_WG64_4_1_WGM15
    SolutionIndex: 173
    SolutionNameMin: Cijk_Ailk_Bjlk_HBH_MT16x16x16_MI16x16x16x1_SE_1LDSB0_AF0EM1_AF1EM1_AMAS3_BL1_EPS1_GRVW2_GSU1_ISA908_KLA_LRVW4_MAC_NLCA1_NLCB1_PGR1_SIA3_SU0_SUS256_SRVW4_TT1_16_USFGROn1_VAW2_VSn1_VW2_WSGRA1_WSGRB1_WG16_4_1_WGM1
    SolutionIndex: 174
    SolutionNameMin: Cijk_Ailk_Bjlk_HBH_MT32x64x16_MI16x16x16x1_SE_1LDSB0_AF0EM1_AF1EM1_AMAS3_BL1_EPS0_GRVW2_GSU1_ISA908_KLA_LRVW4_MAC_NLCA1_NLCB1_PGR2_SIA3_SU32_SUS256_SRVW4_TT1_32_USFGROn1_VAW2_VSn1_VW2_WSGRA1_WSGRB1_WG32_8_1_WGM15
    SolutionIndex: 175
    SolutionNameMin: Cijk_Ailk_Bjlk_HBH_MT32x64x16_MI16x16x16x1_SE_1LDSB1_AF0EM1_AF1EM1_AMAS3_BL1_EPS0_GRVW2_GSU1_ISA908_KLA_LRVW4_MAC_NLCA1_NLCB1_PGR2_SIA3_SU0_SUS256_SRVW4_TT1_32_USFGROn1_VAW2_VSn1_VW2_WSGRA1_WSGRB1_WG32_8_1_WGM2
    SolutionIndex: 176
    SolutionNameMin: Cijk_Ailk_Bjlk_HBH_MT32x64x16_MI16x16x16x1_SE_1LDSB0_AF0EM8_AF1EM1_AMAS3_BL1_EPS0_GRVW8_GSU1_ISA908_KLA_LRVW4_MAC_NLCA1_NLCB1_PGR2_SIA3_SU32_SUS256_SRVW4_TT1_32_USFGROn1_VAW2_VSn1_VW2_WSGRA1_WSGRB1_WG32_8_1_WGM2
    SolutionIndex: 177
    SolutionNameMin: Cijk_Ailk_Bjlk_HBH_MT32x32x16_MI16x16x16x1_SE_1LDSB0_AF0EM1_AF1EM1_AMAS3_BL1_EPS0_GRVW4_GSU1_ISA908_KLA_LRVW4_MAC_NLCA1_NLCB1_PGR2_SIA3_SU0_SUS256_SRVW4_TT1_16_USFGROn1_VAW2_VSn1_VW2_WSGRA1_WSGRB1_WG32_8_1_WGM1
    SolutionIndex: 178
    SolutionNameMin: Cijk_Ailk_Bjlk_HBH_MT32x64x16_MI16x16x16x1_SE_1LDSB1_AF0EM1_AF1EM1_AMAS3_BL1_EPS0_GRVW8_GSU1_ISA908_KLA_LRVW4_MAC_NLCA1_NLCB1_PGR2_SIA3_SU0_SUS256_SRVW4_TT1_32_USFGROn1_VAW2_VSn1_VW2_WSGRA1_WSGRB1_WG32_8_1_WGM2
    SolutionIndex: 179
    SolutionNameMin: Cijk_Ailk_Bjlk_HBH_MT64x32x16_MI16x16x16x1_SE_1LDSB1_AF0EM8_AF1EM1_AMAS3_BL1_EPS1_GRVW2_GSU1_ISA908_KLA_LRVW4_MAC_NLCA1_NLCB1_PGR1_SIA3_SU0_SUS256_SRVW4_TT2_16_USFGROn1_VAW2_VSn1_VW2_WSGRA1_WSGRB1_WG32_8_1_WGM1
    SolutionIndex: 180
    SolutionNameMin: Cijk_Ailk_Bjlk_HBH_MT64x32x16_MI16x16x16x1_SE_1LDSB0_AF0EM8_AF1EM1_AMAS3_BL1_EPS0_GRVW4_GSU1_ISA908_KLA_LRVW4_MAC_NLCA1_NLCB1_PGR2_SIA3_SU0_SUS256_SRVW4_TT2_16_USFGROn1_VAW2_VSn1_VW2_WSGRA1_WSGRB1_WG32_8_1_WGM1
    SolutionIndex: 181
    SolutionNameMin: Cijk_Ailk_Bjlk_HBH_MT64x32x16_MI16x16x16x1_SE_1LDSB1_AF0EM8_AF1EM1_AMAS3_BL1_EPS0_GRVW2_GSU1_ISA908_KLA_LRVW4_MAC_NLCA1_NLCB1_PGR2_SIA3_SU32_SUS256_SRVW4_TT2_16_USFGROn1_VAW2_VSn1_VW2_WSGRA1_WSGRB1_WG32_8_1_WGM2
    SolutionIndex: 182
    SolutionNameMin: Cijk_Ailk_Bjlk_HBH_MT64x32x16_MI16x16x16x1_SE_1LDSB1_AF0EM8_AF1EM1_AMAS3_BL1_EPS1_GRVW2_GSU1_ISA908_KLA_LRVW4_MAC_NLCA1_NLCB1_PGR1_SIA3_SU32_SUS256_SRVW4_TT2_16_USFGROn1_VAW2_VSn1_VW2_WSGRA1_WSGRB1_WG32_8_1_WGM2
    SolutionIndex: 183
    SolutionNameMin: Cijk_Ailk_Bjlk_HBH_MT64x32x16_MI16x16x16x1_SE_1LDSB1_AF0EM8_AF1EM1_AMAS3_BL1_EPS0_GRVW2_GSU1_ISA908_KLA_LRVW4_MAC_NLCA1_NLCB1_PGR2_SIA3_SU32_SUS128_SRVW4_TT2_16_USFGROn1_VAW2_VSn1_VW2_WSGRA1_WSGRB1_WG32_8_1_WGM2
    SolutionIndex: 184
    SolutionNameMin: Cijk_Ailk_Bjlk_HBH_MT64x64x16_MI32x32x8x1_SE_1LDSB0_AF0EM8_AF1EM1_AMAS3_BL1_EPS0_GRVW2_GSU1_ISA908_KLA_LRVW4_MAC_NLCA1_NLCB1_PGR2_SIA3_SU32_SUS128_SRVW4_TT1_32_USFGROn1_VAW2_VSn1_VW2_WSGRA1_WSGRB1_WG64_4_1_WGM15
    SolutionIndex: 185
    SolutionNameMin: Cijk_Ailk_Bjlk_HBH_MT64x32x16_MI16x16x16x1_SE_1LDSB0_AF0EM8_AF1EM1_AMAS3_BL1_EPS1_GRVW2_GSU1_ISA908_KLA_LRVW4_MAC_NLCA1_NLCB1_PGR1_SIA3_SU32_SUS256_SRVW4_TT2_16_USFGROn1_VAW2_VSn1_VW2_WSGRA1_WSGRB1_WG32_8_1_WGM15
    SolutionIndex: 186
    SolutionNameMin: Cijk_Ailk_Bjlk_HBH_MT64x64x16_MI32x32x8x1_SE_1LDSB0_AF0EM8_AF1EM1_AMAS3_BL1_EPS0_GRVW2_GSU1_ISA908_KLA_LRVW4_MAC_NLCA1_NLCB1_PGR2_SIA3_SU0_SUS256_SRVW4_TT1_32_USFGROn1_VAW2_VSn1_VW2_WSGRA1_WSGRB1_WG64_4_1_WGM2
    SolutionIndex: 187
    SolutionNameMin: Cijk_Ailk_Bjlk_HBH_MT64x64x16_MI32x32x8x1_SE_1LDSB0_AF0EM8_AF1EM1_AMAS3_BL1_EPS0_GRVW2_GSU1_ISA908_KLA_LRVW4_MAC_NLCA1_NLCB1_PGR2_SIA3_SU0_SUS256_SRVW4_TT1_32_USFGROn1_VAW2_VSn1_VW2_WSGRA1_WSGRB1_WG64_4_1_WGM1
    SolutionIndex: 188
    SolutionNameMin: Cijk_Ailk_Bjlk_HBH_MT128x96x64_MI32x32x8x1_SE_1LDSB0_AF0EM8_AF1EM1_AMAS3_BL1_EPS0_GRVW4_GSU1_ISA908_KLA_LRVW4_MAC_NLCA1_NLCB3_PGR2_SIA3_SU0_SUS256_SRVW4_TT1_96_USFGROn1_VAW2_VSn1_VW2_WSGRA1_WSGRB1_WG128_2_1_WGM2
    SolutionIndex: 189
    SolutionNameMin: Cijk_Ailk_Bjlk_HBH_MT128x160x32_MI32x32x8x1_SE_1LDSB0_AF0EM8_AF1EM1_AMAS3_BL1_EPS0_GRVW4_GSU2_ISA908_KLA_LRVW4_MAC_NLCA1_NLCB5_PGR2_SIA3_SU0_SUS256_SRVW4_TT1_160_USFGROn1_VAW1_VSn1_VW2_WSGRA1_WSGRB1_WG128_2_1_WGM2
    SolutionIndex: 190
    SolutionNameMin: Cijk_Ailk_Bjlk_HBH_MT128x160x32_MI32x32x8x1_SE_1LDSB0_AF0EM8_AF1EM1_AMAS3_BL1_EPS0_GRVW4_GSU2_ISA908_KLA_LRVW4_MAC_NLCA1_NLCB5_PGR2_SIA3_SU32_SUS128_SRVW4_TT1_160_USFGROn1_VAW1_VSn1_VW2_WSGRA1_WSGRB1_WG128_2_1_WGM15
    SolutionIndex: 191
    SolutionNameMin: Cijk_Ailk_Bjlk_HBH_MT192x64x32_MI32x32x8x1_SE_1LDSB0_AF0EM8_AF1EM1_AMAS3_BL1_EPS0_GRVW8_GSU1_ISA908_KLA_LRVW4_MAC_NLCA3_NLCB1_PGR2_SIA3_SU0_SUS256_SRVW0_TT3_32_USFGROn1_VAW2_VSn1_VW2_WSGRA1_WSGRB1_WG64_4_1_WGM1
    SolutionIndex: 192
    SolutionNameMin: Cijk_Ailk_Bjlk_HBH_MT64x192x32_MI32x32x8x1_SE_1LDSB0_AF0EM8_AF1EM1_AMAS3_BL1_EPS0_GRVW8_GSU1_ISA908_KLA_LRVW4_MAC_NLCA1_NLCB3_PGR2_SIA3_SU0_SUS256_SRVW4_TT1_96_USFGROn1_VAW2_VSn1_VW2_WSGRA1_WSGRB1_WG64_4_1_WGM1
    SolutionIndex: 193
    SolutionNameMin: Cijk_Ailk_Bjlk_HBH_MT96x128x64_MI32x32x8x1_SE_1LDSB0_AF0EM8_AF1EM1_AMAS3_BL1_EPS0_GRVW4_GSU1_ISA908_KLA_LRVW4_MAC_NLCA3_NLCB1_PGR2_SIA3_SU0_SUS256_SRVW0_TT3_32_USFGROn1_VAW2_VSn1_VW2_WSGRA1_WSGRB1_WG32_8_1_WGM1
    SolutionIndex: 194
    SolutionNameMin: Cijk_Ailk_Bjlk_HBH_MT128x256x32_MI32x32x8x1_SE_1LDSB0_AF0EM8_AF1EM1_AMAS3_BL1_EPS1_GRVW8_GSU3_ISA908_KLA_LRVW4_MAC_NLCA1_NLCB1_PGR1_SIA3_SU32_SUS128_SRVW4_TT2_128_USFGROn1_VAW1_VSn1_VW2_WSGRA1_WSGRB1_WG64_4_1_WGM1
    SolutionIndex: 195
    SolutionNameMin: Cijk_Ailk_Bjlk_HBH_MT128x160x32_MI32x32x8x1_SE_1LDSB0_AF0EM8_AF1EM1_AMAS3_BL1_EPS0_GRVW4_GSU2_ISA908_KLA_LRVW4_MAC_NLCA1_NLCB5_PGR2_SIA3_SU0_SUS256_SRVW4_TT1_160_USFGROn1_VAW1_VSn1_VW2_WSGRA1_WSGRB1_WG128_2_1_WGM15
    SolutionIndex: 196
    SolutionNameMin: Cijk_Ailk_Bjlk_HBH_MT128x256x32_MI32x32x8x1_SE_1LDSB0_AF0EM8_AF1EM1_AMAS3_BL1_EPS1_GRVW8_GSU3_ISA908_KLA_LRVW4_MAC_NLCA1_NLCB1_PGR1_SIA3_SU0_SUS256_SRVW4_TT2_128_USFGROn1_VAW1_VSn1_VW2_WSGRA1_WSGRB1_WG64_4_1_WGM15
    SolutionIndex: 197
    SolutionNameMin: Cijk_Ailk_Bjlk_HBH_MT128x256x32_MI32x32x8x1_SN_1LDSB0_AF0EM8_AF1EM1_AMAS3_BL1_EPS1_GRVW8_GSU3_ISA908_KLA_LRVW4_MAC_NLCA1_NLCB1_PGR1_SIA3_SU32_SUS128_SRVW4_TT2_128_USFGROn1_VAW1_VSn1_VW2_WSGRA1_WSGRB1_WG64_4_1_WGM15
    SolutionIndex: 198
    SolutionNameMin: Cijk_Ailk_Bjlk_HBH_MT128x288x32_MI32x32x8x1_SN_1LDSB0_AF0EM8_AF1EM1_AMAS3_BL1_EPS1_GRVW4_GSU1_ISA908_KLA_LRVW4_MAC_NLCA1_NLCB9_PGR1_SIA3_SU0_SUS256_SRVW4_TT1_288_USFGROn1_VAW2_VSn1_VW2_WSGRA1_WSGRB1_WG128_2_1_WGM2
    SolutionIndex: 199
    SolutionNameMin: Cijk_Ailk_Bjlk_HBH_MT128x288x32_MI32x32x8x1_SE_1LDSB0_AF0EM8_AF1EM1_AMAS3_BL1_EPS0_GRVW2_GSU1_ISA908_KLA_LRVW4_MAC_NLCA1_NLCB9_PGR2_SIA3_SU32_SUS128_SRVW4_TT1_288_USFGROn1_VAW2_VSn1_VW2_WSGRA1_WSGRB1_WG128_2_1_WGM15
    SolutionIndex: 200
    SolutionNameMin: Cijk_Ailk_Bjlk_HBH_MT128x288x32_MI32x32x8x1_SN_1LDSB0_AF0EM8_AF1EM1_AMAS3_BL1_EPS0_GRVW4_GSU1_ISA908_KLA_LRVW4_MAC_NLCA1_NLCB9_PGR2_SIA3_SU0_SUS256_SRVW4_TT1_288_USFGROn1_VAW2_VSn1_VW2_WSGRA1_WSGRB1_WG128_2_1_WGM2
    SolutionIndex: 201
    SolutionNameMin: Cijk_Ailk_Bjlk_HBH_MT128x192x16_MI32x32x8x1_SE_1LDSB0_AF0EM8_AF1EM1_AMAS3_BL1_EPS0_GRVW4_GSU1_ISA908_KLA_LRVW4_MAC_NLCA1_NLCB3_PGR2_SIA3_SU0_SUS256_SRVW4_TT2_96_USFGROn1_VAW2_VSn1_VW2_WSGRA1_WSGRB1_WG64_4_1_WGM1
    SolutionIndex: 202
    SolutionNameMin: Cijk_Ailk_Bjlk_HBH_MT128x192x16_MI32x32x8x1_SE_1LDSB0_AF0EM8_AF1EM1_AMAS3_BL1_EPS0_GRVW4_GSU1_ISA908_KLA_LRVW4_MAC_NLCA1_NLCB3_PGR2_SIA3_SU0_SUS256_SRVW4_TT2_96_USFGROn1_VAW2_VSn1_VW2_WSGRA1_WSGRB1_WG64_4_1_WGM15
    SolutionIndex: 203
    SolutionNameMin: Cijk_Ailk_Bjlk_HBH_MT256x160x32_MI32x32x8x1_SE_1LDSB0_AF0EM8_AF1EM1_AMAS3_BL1_EPS1_GRVW4_GSU1_ISA908_KLA_LRVW4_MAC_NLCA1_NLCB5_PGR1_SIA3_SU0_SUS256_SRVW4_TT2_160_USFGROn1_VAW2_VSn1_VW2_WSGRA1_WSGRB1_WG128_2_1_WGM2
    SolutionIndex: 204
    SolutionNameMin: Cijk_Ailk_Bjlk_HBH_MT144x256x32_MI16x16x16x1_SE_1LDSB0_AF0EM8_AF1EM1_AMAS3_BL1_EPS0_GRVW2_GSU1_ISA908_KLA_LRVW4_MAC_NLCA9_NLCB2_PGR2_SIA3_SU32_SUS128_SRVW0_TT9_64_USFGROn1_VAW2_VSn1_VW2_WSGRA1_WSGRB1_WG16_16_1_WGM15
    SolutionIndex: 205
    SolutionNameMin: Cijk_Ailk_Bjlk_HBH_MT144x256x32_MI16x16x16x1_SE_1LDSB0_AF0EM8_AF1EM1_AMAS3_BL1_EPS0_GRVW2_GSU1_ISA908_KLA_LRVW4_MAC_NLCA9_NLCB2_PGR2_SIA3_SU32_SUS256_SRVW0_TT9_64_USFGROn1_VAW2_VSn1_VW2_WSGRA1_WSGRB1_WG16_16_1_WGM2
    SolutionIndex: 206
    SolutionNameMin: Cijk_Ailk_Bjlk_HBH_MT288x128x32_MI32x32x8x1_SN_1LDSB0_AF0EM8_AF1EM1_AMAS3_BL1_EPS1_GRVW4_GSU1_ISA908_KLA_LRVW4_MAC_NLCA9_NLCB1_PGR1_SIA3_SU0_SUS128_SRVW0_TT9_32_USFGROn1_VAW2_VSn1_VW2_WSGRA1_WSGRB1_WG32_8_1_WGM1
    SolutionIndex: 207
    SolutionNameMin: Cijk_Ailk_Bjlk_HBH_MT256x160x32_MI32x32x8x1_SE_1LDSB0_AF0EM8_AF1EM1_AMAS3_BL1_EPS1_GRVW4_GSU1_ISA908_KLA_LRVW4_MAC_NLCA1_NLCB5_PGR1_SIA3_SU32_SUS128_SRVW4_TT2_160_USFGROn1_VAW2_VSn1_VW2_WSGRA1_WSGRB1_WG128_2_1_WGM2
    SolutionIndex: 208
    SolutionNameMin: Cijk_Ailk_Bjlk_HBH_MT256x160x16_MI32x32x8x1_SN_1LDSB0_AF0EM8_AF1EM1_AMAS3_BL1_EPS0_GRVW2_GSU1_ISA908_KLA_LRVW4_MAC_NLCA2_NLCB5_PGR2_SIA3_SU32_SUS128_SRVW4_TT2_160_USFGROn1_VAW2_VSn1_VW2_WSGRA1_WSGRB1_WG128_2_1_WGM1
    SolutionIndex: 209
    SolutionNameMin: Cijk_Ailk_Bjlk_HBH_MT288x128x32_MI32x32x8x1_SE_1LDSB0_AF0EM8_AF1EM1_AMAS3_BL1_EPS0_GRVW2_GSU1_ISA908_KLA_LRVW4_MAC_NLCA9_NLCB1_PGR2_SIA3_SU0_SUS256_SRVW0_TT9_32_USFGROn1_VAW2_VSn1_VW2_WSGRA1_WSGRB1_WG32_8_1_WGM1
    SolutionIndex: 210
    SolutionNameMin: Cijk_Ailk_Bjlk_HBH_MT256x160x32_MI32x32x8x1_SE_1LDSB0_AF0EM8_AF1EM1_AMAS3_BL1_EPS1_GRVW4_GSU1_ISA908_KLA_LRVW4_MAC_NLCA1_NLCB5_PGR1_SIA3_SU32_SUS128_SRVW4_TT2_160_USFGROn1_VAW2_VSn1_VW2_WSGRA1_WSGRB1_WG128_2_1_WGM15
    SolutionIndex: 211
    SolutionNameMin: Cijk_Ailk_Bjlk_HBH_MT64x192x16_MI32x32x8x1_SE_1LDSB0_AF0EM8_AF1EM1_AMAS3_BL1_EPS1_GRVW2_GSU1_ISA908_KLA_LRVW4_MAC_NLCA1_NLCB3_PGR1_SIA3_SU0_SUS256_SRVW4_TT1_96_USFGROn1_VAW2_VSn1_VW2_WSGRA1_WSGRB1_WG64_4_1_WGM2
    SolutionIndex: 212
    SolutionNameMin: Cijk_Ailk_Bjlk_HBH_MT64x192x16_MI32x32x8x1_SE_1LDSB0_AF0EM8_AF1EM1_AMAS3_BL1_EPS1_GRVW4_GSU1_ISA908_KLA_LRVW4_MAC_NLCA1_NLCB3_PGR1_SIA3_SU0_SUS256_SRVW4_TT1_96_USFGROn1_VAW2_VSn1_VW2_WSGRA1_WSGRB1_WG64_4_1_WGM2
    SolutionIndex: 213
    SolutionNameMin: Cijk_Ailk_Bjlk_HBH_MT64x192x16_MI32x32x8x1_SE_1LDSB0_AF0EM8_AF1EM1_AMAS3_BL1_EPS1_GRVW2_GSU1_ISA908_KLA_LRVW4_MAC_NLCA1_NLCB3_PGR1_SIA3_SU32_SUS256_SRVW4_TT1_96_USFGROn1_VAW2_VSn1_VW2_WSGRA1_WSGRB1_WG64_4_1_WGM15
    SolutionIndex: 214
    SolutionNameMin: Cijk_Ailk_Bjlk_HBH_MT64x128x32_MI32x32x8x1_SE_1LDSB0_AF0EM8_AF1EM1_AMAS3_BL1_EPS0_GRVW2_GSU1_ISA908_KLA_LRVW4_MAC_NLCA1_NLCB1_PGR2_SIA3_SU0_SUS256_SRVW4_TT1_64_USFGROn1_VAW2_VSn1_VW2_WSGRA1_WSGRB1_WG64_4_1_WGM2
    SolutionIndex: 215
    SolutionNameMin: Cijk_Ailk_Bjlk_HBH_MT64x128x16_MI32x32x8x1_SE_1LDSB0_AF0EM8_AF1EM1_AMAS3_BL1_EPS0_GRVW4_GSU1_ISA908_KLA_LRVW4_MAC_NLCA1_NLCB1_PGR2_SIA3_SU0_SUS256_SRVW4_TT1_64_USFGROn1_VAW2_VSn1_VW2_WSGRA1_WSGRB1_WG64_4_1_WGM1
    SolutionIndex: 216
    SolutionNameMin: Cijk_Ailk_Bjlk_HBH_MT64x128x16_MI32x32x8x1_SE_1LDSB0_AF0EM8_AF1EM1_AMAS3_BL1_EPS0_GRVW2_GSU1_ISA908_KLA_LRVW4_MAC_NLCA1_NLCB1_PGR2_SIA3_SU0_SUS256_SRVW4_TT1_64_USFGROn1_VAW2_VSn1_VW2_WSGRA1_WSGRB1_WG64_4_1_WGM1
    SolutionIndex: 217
    SolutionNameMin: Cijk_Ailk_Bjlk_HBH_MT64x128x32_MI32x32x8x1_SE_1LDSB0_AF0EM8_AF1EM1_AMAS3_BL1_EPS0_GRVW2_GSU1_ISA908_KLA_LRVW4_MAC_NLCA1_NLCB1_PGR2_SIA3_SU32_SUS128_SRVW4_TT1_64_USFGROn1_VAW2_VSn1_VW2_WSGRA1_WSGRB1_WG64_4_1_WGM1
    SolutionIndex: 218
    SolutionNameMin: Cijk_Ailk_Bjlk_HBH_MT64x64x32_MI32x32x8x1_SE_1LDSB0_AF0EM1_AF1EM1_AMAS3_BL1_EPS0_GRVW8_GSU1_ISA908_KLA_LRVW4_MAC_NLCA1_NLCB1_PGR2_SIA3_SU0_SUS256_SRVW4_TT1_32_USFGROn1_VAW2_VSn1_VW2_WSGRA1_WSGRB1_WG64_4_1_WGM1
    SolutionIndex: 219
    SolutionNameMin: Cijk_Ailk_Bjlk_HBH_MT64x192x16_MI32x32x8x1_SE_1LDSB0_AF0EM1_AF1EM1_AMAS3_BL1_EPS1_GRVW4_GSU1_ISA908_KLA_LRVW4_MAC_NLCA1_NLCB3_PGR1_SIA3_SU32_SUS128_SRVW4_TT1_96_USFGROn1_VAW2_VSn1_VW2_WSGRA1_WSGRB1_WG64_4_1_WGM15
    SolutionIndex: 220
    SolutionNameMin: Cijk_Ailk_Bjlk_HBH_MT64x128x16_MI32x32x8x1_SE_1LDSB0_AF0EM1_AF1EM1_AMAS3_BL1_EPS0_GRVW8_GSU1_ISA908_KLA_LRVW4_MAC_NLCA1_NLCB1_PGR2_SIA3_SU32_SUS128_SRVW4_TT1_64_USFGROn1_VAW2_VSn1_VW2_WSGRA1_WSGRB1_WG64_4_1_WGM2
    SolutionIndex: 221
    SolutionNameMin: Cijk_Ailk_Bjlk_HBH_MT128x96x16_MI32x32x8x1_SE_1LDSB0_AF0EM1_AF1EM1_AMAS3_BL1_EPS1_GRVW2_GSU1_ISA908_KLA_LRVW4_MAC_NLCA1_NLCB3_PGR1_SIA3_SU0_SUS256_SRVW4_TT1_96_USFGROn1_VAW2_VSn1_VW2_WSGRA1_WSGRB1_WG128_2_1_WGM15
    SolutionIndex: 222
    SolutionNameMin: Cijk_Ailk_Bjlk_HBH_MT128x64x16_MI32x32x8x1_SE_1LDSB0_AF0EM1_AF1EM1_AMAS3_BL1_EPS0_GRVW4_GSU1_ISA908_KLA_LRVW4_MAC_NLCA1_NLCB1_PGR2_SIA3_SU0_SUS256_SRVW4_TT2_32_USFGROn1_VAW2_VSn1_VW2_WSGRA1_WSGRB1_WG64_4_1_WGM2
    SolutionIndex: 223
    SolutionNameMin: Cijk_Ailk_Bjlk_HBH_MT64x192x16_MI32x32x8x1_SE_1LDSB0_AF0EM1_AF1EM1_AMAS3_BL1_EPS0_GRVW2_GSU1_ISA908_KLA_LRVW4_MAC_NLCA1_NLCB3_PGR2_SIA3_SU0_SUS256_SRVW4_TT1_96_USFGROn1_VAW2_VSn1_VW2_WSGRA1_WSGRB1_WG64_4_1_WGM1
    SolutionIndex: 224
    SolutionNameMin: Cijk_Ailk_Bjlk_HBH_MT64x128x16_MI32x32x8x1_SE_1LDSB0_AF0EM8_AF1EM1_AMAS3_BL1_EPS0_GRVW2_GSU1_ISA908_KLA_LRVW4_MAC_NLCA1_NLCB1_PGR2_SIA3_SU32_SUS128_SRVW4_TT1_64_USFGROn1_VAW2_VSn1_VW2_WSGRA1_WSGRB1_WG64_4_1_WGM1
    SolutionIndex: 225
    SolutionNameMin: Cijk_Ailk_Bjlk_HBH_MT64x128x16_MI32x32x8x1_SE_1LDSB0_AF0EM8_AF1EM1_AMAS3_BL1_EPS0_GRVW8_GSU1_ISA908_KLA_LRVW4_MAC_NLCA1_NLCB1_PGR2_SIA3_SU32_SUS128_SRVW4_TT1_64_USFGROn1_VAW2_VSn1_VW2_WSGRA1_WSGRB1_WG64_4_1_WGM2
    SolutionIndex: 226
    SolutionNameMin: Cijk_Ailk_Bjlk_HBH_MT64x128x16_MI32x32x8x1_SE_1LDSB0_AF0EM8_AF1EM1_AMAS3_BL1_EPS0_GRVW4_GSU1_ISA908_KLA_LRVW4_MAC_NLCA1_NLCB1_PGR2_SIA3_SU0_SUS256_SRVW4_TT1_64_USFGROn1_VAW2_VSn1_VW2_WSGRA1_WSGRB1_WG64_4_1_WGM2
    SolutionIndex: 227
    SolutionNameMin: Cijk_Ailk_Bjlk_HBH_MT64x192x16_MI32x32x8x1_SE_1LDSB0_AF0EM8_AF1EM1_AMAS3_BL1_EPS1_GRVW4_GSU1_ISA908_KLA_LRVW4_MAC_NLCA1_NLCB3_PGR1_SIA3_SU32_SUS128_SRVW4_TT1_96_USFGROn1_VAW2_VSn1_VW2_WSGRA1_WSGRB1_WG64_4_1_WGM2
    SolutionIndex: 228
    SolutionNameMin: Cijk_Ailk_Bjlk_HBH_MT64x192x16_MI32x32x8x1_SE_1LDSB0_AF0EM8_AF1EM1_AMAS3_BL1_EPS1_GRVW2_GSU1_ISA908_KLA_LRVW4_MAC_NLCA1_NLCB3_PGR1_SIA3_SU0_SUS256_SRVW4_TT1_96_USFGROn1_VAW2_VSn1_VW2_WSGRA1_WSGRB1_WG64_4_1_WGM1
    SolutionIndex: 229
    SolutionNameMin: Cijk_Ailk_Bjlk_HBH_MT128x64x16_MI32x32x8x1_SE_1LDSB0_AF0EM1_AF1EM1_AMAS3_BL1_EPS0_GRVW2_GSU1_ISA908_KLA_LRVW4_MAC_NLCA1_NLCB1_PGR2_SIA3_SU32_SUS256_SRVW4_TT2_32_USFGROn1_VAW2_VSn1_VW2_WSGRA1_WSGRB1_WG64_4_1_WGM2
    SolutionIndex: 230
    SolutionNameMin: Cijk_Ailk_Bjlk_HBH_MT64x128x16_MI32x32x8x1_SE_1LDSB0_AF0EM1_AF1EM1_AMAS3_BL1_EPS0_GRVW4_GSU1_ISA908_KLA_LRVW4_MAC_NLCA1_NLCB1_PGR2_SIA3_SU0_SUS256_SRVW4_TT1_64_USFGROn1_VAW2_VSn1_VW2_WSGRA1_WSGRB1_WG64_4_1_WGM15
    SolutionIndex: 231
    SolutionNameMin: Cijk_Ailk_Bjlk_HBH_MT64x32x16_MI16x16x16x1_SE_1LDSB0_AF0EM1_AF1EM1_AMAS3_BL1_EPS0_GRVW2_GSU1_ISA908_KLA_LRVW4_MAC_NLCA1_NLCB1_PGR2_SIA3_SU0_SUS256_SRVW4_TT2_16_USFGROn1_VAW2_VSn1_VW2_WSGRA1_WSGRB1_WG32_8_1_WGM1
    SolutionIndex: 232
    SolutionNameMin: Cijk_Ailk_Bjlk_HBH_MT64x64x16_MI32x32x8x1_SE_1LDSB0_AF0EM1_AF1EM1_AMAS3_BL1_EPS1_GRVW2_GSU1_ISA908_KLA_LRVW4_MAC_NLCA1_NLCB1_PGR1_SIA3_SU0_SUS256_SRVW4_TT1_32_USFGROn1_VAW2_VSn1_VW2_WSGRA1_WSGRB1_WG64_4_1_WGM2
    SolutionIndex: 233
    SolutionNameMin: Cijk_Ailk_Bjlk_HBH_MT128x96x16_MI32x32x8x1_SE_1LDSB0_AF0EM1_AF1EM1_AMAS3_BL1_EPS0_GRVW2_GSU1_ISA908_KLA_LRVW4_MAC_NLCA1_NLCB3_PGR2_SIA3_SU0_SUS256_SRVW4_TT1_96_USFGROn1_VAW2_VSn1_VW2_WSGRA1_WSGRB1_WG128_2_1_WGM1
    SolutionIndex: 234
    SolutionNameMin: Cijk_Ailk_Bjlk_HBH_MT128x128x16_MI32x32x8x1_SE_1LDSB0_AF0EM1_AF1EM1_AMAS3_BL1_EPS0_GRVW8_GSU1_ISA908_KLA_LRVW4_MAC_NLCA1_NLCB1_PGR2_SIA3_SU32_SUS256_SRVW4_TT2_64_USFGROn1_VAW2_VSn1_VW2_WSGRA1_WSGRB1_WG64_4_1_WGM2
    SolutionIndex: 235
    SolutionNameMin: Cijk_Ailk_Bjlk_HBH_MT128x128x16_MI32x32x8x1_SN_1LDSB0_AF0EM8_AF1EM1_AMAS3_BL1_EPS0_GRVW8_GSU1_ISA908_KLA_LRVW4_MAC_NLCA1_NLCB1_PGR2_SIA3_SU0_SUS128_SRVW4_TT2_64_USFGROn1_VAW2_VSn1_VW2_WSGRA1_WSGRB1_WG64_4_1_WGM2
    SolutionIndex: 236
    SolutionNameMin: Cijk_Ailk_Bjlk_HBH_MT128x128x32_MI32x32x8x1_SE_1LDSB0_AF0EM8_AF1EM1_AMAS3_BL1_EPS1_GRVW8_GSU1_ISA908_KLA_LRVW4_MAC_NLCA1_NLCB1_PGR1_SIA3_SU0_SUS256_SRVW4_TT2_64_USFGROn1_VAW2_VSn1_VW2_WSGRA1_WSGRB1_WG64_4_1_WGM1
    SolutionIndex: 237
    SolutionNameMin: Cijk_Ailk_Bjlk_HBH_MT128x128x16_MI32x32x8x1_SN_1LDSB0_AF0EM8_AF1EM1_AMAS3_BL1_EPS0_GRVW8_GSU1_ISA908_KLA_LRVW4_MAC_NLCA1_NLCB1_PGR2_SIA3_SU32_SUS128_SRVW4_TT2_64_USFGROn1_VAW2_VSn1_VW2_WSGRA1_WSGRB1_WG64_4_1_WGM2
    SolutionIndex: 238
    SolutionNameMin: Cijk_Ailk_Bjlk_HBH_MT64x128x16_MI32x32x8x1_SE_1LDSB0_AF0EM1_AF1EM1_AMAS3_BL1_EPS0_GRVW8_GSU1_ISA908_KLA_LRVW4_MAC_NLCA1_NLCB1_PGR2_SIA3_SU0_SUS256_SRVW4_TT1_64_USFGROn1_VAW2_VSn1_VW2_WSGRA1_WSGRB1_WG64_4_1_WGM1
    SolutionIndex: 239
    SolutionNameMin: Cijk_Ailk_Bjlk_HBH_MT64x64x16_MI32x32x8x1_SE_1LDSB0_AF0EM1_AF1EM1_AMAS3_BL1_EPS0_GRVW4_GSU1_ISA908_KLA_LRVW4_MAC_NLCA1_NLCB1_PGR2_SIA3_SU0_SUS256_SRVW4_TT1_32_USFGROn1_VAW2_VSn1_VW2_WSGRA1_WSGRB1_WG64_4_1_WGM1
    SolutionIndex: 240
    SolutionNameMin: Cijk_Ailk_Bjlk_HBH_MT64x192x16_MI32x32x8x1_SE_1LDSB0_AF0EM1_AF1EM1_AMAS3_BL1_EPS1_GRVW2_GSU1_ISA908_KLA_LRVW4_MAC_NLCA1_NLCB3_PGR1_SIA3_SU0_SUS256_SRVW4_TT1_96_USFGROn1_VAW2_VSn1_VW2_WSGRA1_WSGRB1_WG64_4_1_WGM2
    SolutionIndex: 241
    SolutionNameMin: Cijk_Ailk_Bjlk_HBH_MT64x64x16_MI32x32x8x1_SE_1LDSB0_AF0EM8_AF1EM1_AMAS3_BL1_EPS0_GRVW2_GSU1_ISA908_KLA_LRVW4_MAC_NLCA1_NLCB1_PGR2_SIA3_SU32_SUS256_SRVW4_TT1_32_USFGROn1_VAW2_VSn1_VW2_WSGRA1_WSGRB1_WG64_4_1_WGM15
    SolutionIndex: 242
    SolutionNameMin: Cijk_Ailk_Bjlk_HBH_MT128x128x32_MI32x32x8x1_SE_1LDSB0_AF0EM8_AF1EM1_AMAS3_BL1_EPS0_GRVW4_GSU1_ISA908_KLA_LRVW4_MAC_NLCA1_NLCB1_PGR2_SIA3_SU0_SUS256_SRVW4_TT2_64_USFGROn1_VAW2_VSn1_VW2_WSGRA1_WSGRB1_WG64_4_1_WGM15
    SolutionIndex: 243
    SolutionNameMin: Cijk_Ailk_Bjlk_HBH_MT128x128x32_MI32x32x8x1_SE_1LDSB0_AF0EM1_AF1EM1_AMAS3_BL1_EPS0_GRVW8_GSU1_ISA908_KLA_LRVW4_MAC_NLCA1_NLCB1_PGR2_SIA3_SU32_SUS256_SRVW4_TT2_64_USFGROn1_VAW2_VSn1_VW2_WSGRA1_WSGRB1_WG64_4_1_WGM1
    SolutionIndex: 244
    SolutionNameMin: Cijk_Ailk_Bjlk_HBH_MT128x128x16_MI32x32x8x1_SE_1LDSB0_AF0EM8_AF1EM1_AMAS3_BL1_EPS0_GRVW8_GSU1_ISA908_KLA_LRVW4_MAC_NLCA1_NLCB1_PGR2_SIA3_SU32_SUS256_SRVW4_TT2_64_USFGROn1_VAW2_VSn1_VW2_WSGRA1_WSGRB1_WG64_4_1_WGM2
    SolutionIndex: 245
    SolutionNameMin: Cijk_Ailk_Bjlk_HBH_MT128x64x16_MI32x32x8x1_SE_1LDSB0_AF0EM1_AF1EM1_AMAS3_BL1_EPS0_GRVW8_GSU1_ISA908_KLA_LRVW4_MAC_NLCA1_NLCB1_PGR2_SIA3_SU0_SUS256_SRVW4_TT2_32_USFGROn1_VAW2_VSn1_VW2_WSGRA1_WSGRB1_WG64_4_1_WGM2
    SolutionIndex: 246
    SolutionNameMin: Cijk_Ailk_Bjlk_HBH_MT128x256x16_MI32x32x8x1_SE_1LDSB1_AF0EM8_AF1EM1_AMAS3_BL1_EPS0_GRVW8_GSU1_ISA908_KLA_LRVW4_MAC_NLCA1_NLCB1_PGR2_SIA3_SU0_SUS256_SRVW4_TT2_128_USFGROn1_VAW2_VSn1_VW2_WSGRA1_WSGRB1_WG64_4_1_WGM15
    SolutionIndex: 247
    SolutionNameMin: Cijk_Ailk_Bjlk_HBH_MT128x128x32_MI32x32x8x1_SE_1LDSB0_AF0EM1_AF1EM1_AMAS3_BL1_EPS0_GRVW8_GSU1_ISA908_KLA_LRVW4_MAC_NLCA1_NLCB1_PGR2_SIA3_SU0_SUS256_SRVW4_TT2_64_USFGROn1_VAW2_VSn1_VW2_WSGRA1_WSGRB1_WG64_4_1_WGM2
    SolutionIndex: 248
    SolutionNameMin: Cijk_Ailk_Bjlk_HBH_MT64x128x32_MI32x32x8x1_SE_1LDSB0_AF0EM1_AF1EM1_AMAS3_BL1_EPS0_GRVW4_GSU1_ISA908_KLA_LRVW4_MAC_NLCA1_NLCB1_PGR2_SIA3_SU0_SUS256_SRVW4_TT1_64_USFGROn1_VAW2_VSn1_VW2_WSGRA1_WSGRB1_WG64_4_1_WGM2
    SolutionIndex: 249
    SolutionNameMin: Cijk_Ailk_Bjlk_HBH_MT256x128x32_MI32x32x8x1_SE_1LDSB0_AF0EM8_AF1EM1_AMAS3_BL1_EPS1_GRVW8_GSU1_ISA908_KLA_LRVW4_MAC_NLCA1_NLCB1_PGR1_SIA3_SU0_SUS256_SRVW4_TT4_64_USFGROn1_VAW2_VSn1_VW2_WSGRA1_WSGRB1_WG64_4_1_WGM15
    SolutionIndex: 250
    SolutionNameMin: Cijk_Ailk_Bjlk_HBH_MT128x256x16_MI32x32x8x1_SE_1LDSB0_AF0EM8_AF1EM1_AMAS3_BL1_EPS0_GRVW8_GSU1_ISA908_KLA_LRVW4_MAC_NLCA1_NLCB1_PGR2_SIA3_SU0_SUS256_SRVW4_TT2_128_USFGROn1_VAW2_VSn1_VW2_WSGRA1_WSGRB1_WG64_4_1_WGM1
    SolutionIndex: 251
    SolutionNameMin: Cijk_Ailk_Bjlk_HBH_MT128x256x16_MI32x32x8x1_SN_1LDSB0_AF0EM8_AF1EM1_AMAS3_BL1_EPS0_GRVW8_GSU1_ISA908_KLA_LRVW4_MAC_NLCA1_NLCB1_PGR2_SIA3_SU0_SUS256_SRVW4_TT2_128_USFGROn1_VAW2_VSn1_VW2_WSGRA1_WSGRB1_WG64_4_1_WGM15
    SolutionIndex: 252
    SolutionNameMin: Cijk_Ailk_Bjlk_HBH_MT128x64x32_MI32x32x8x1_SE_1LDSB0_AF0EM1_AF1EM1_AMAS3_BL1_EPS0_GRVW4_GSU1_ISA908_KLA_LRVW4_MAC_NLCA1_NLCB1_PGR2_SIA3_SU0_SUS256_SRVW4_TT2_32_USFGROn1_VAW2_VSn1_VW2_WSGRA1_WSGRB1_WG64_4_1_WGM15
    SolutionIndex: 253
    SolutionNameMin: Cijk_Ailk_Bjlk_HBH_MT256x256x32_MI32x32x8x1_SE_1LDSB0_AF0EM8_AF1EM1_AMAS3_BL1_EPS1_GRVW8_GSU1_ISA908_KLA_LRVW4_MAC_NLCA1_NLCB1_PGR1_SIA3_SU32_SUS128_SRVW4_TT4_128_USFGROn1_VAW2_VSn1_VW2_WSGRA1_WSGRB1_WG64_4_1_WGM1
    SolutionIndex: 254
    SolutionNameMin: Cijk_Ailk_Bjlk_HBH_MT256x256x16_MI32x32x8x1_SE_1LDSB0_AF0EM8_AF1EM1_AMAS3_BL1_EPS1_GRVW4_GSU1_ISA908_KLA_LRVW4_MAC_NLCA1_NLCB1_PGR1_SIA3_SU32_SUS256_SRVW4_TT4_128_USFGROn1_VAW2_VSn1_VW2_WSGRA1_WSGRB1_WG64_4_1_WGM1
    SolutionIndex: 255
    SolutionNameMin: Cijk_Ailk_Bjlk_HBH_MT128x256x16_MI32x32x8x1_SE_1LDSB0_AF0EM1_AF1EM1_AMAS3_BL1_EPS0_GRVW8_GSU1_ISA908_KLA_LRVW4_MAC_NLCA1_NLCB1_PGR2_SIA3_SU32_SUS256_SRVW4_TT2_128_USFGROn1_VAW2_VSn1_VW2_WSGRA1_WSGRB1_WG64_4_1_WGM1
    SolutionIndex: 256
    SolutionNameMin: Cijk_Ailk_Bjlk_HBH_MT96x96x64_MI16x16x16x1_SE_1LDSB0_AF0EM8_AF1EM1_AMAS3_BL1_EPS0_GRVW8_GSU1_ISA908_KLA_LRVW4_MAC_NLCA3_NLCB3_PGR2_SIA3_SU0_SUS256_SRVW0_TT3_48_USFGROn1_VAW2_VSn1_VW2_WSGRA1_WSGRB1_WG32_8_1_WGM1
    SolutionIndex: 257
    SolutionNameMin: Cijk_Ailk_Bjlk_HBH_MT128x256x16_MI32x32x8x1_SE_1LDSB0_AF0EM8_AF1EM1_AMAS3_BL1_EPS0_GRVW4_GSU1_ISA908_KLA_LRVW4_MAC_NLCA1_NLCB1_PGR2_SIA3_SU0_SUS256_SRVW4_TT2_128_USFGROn1_VAW2_VSn1_VW2_WSGRA1_WSGRB1_WG64_4_1_WGM1
    SolutionIndex: 258
    SolutionNameMin: Cijk_Ailk_Bjlk_HBH_MT128x256x16_MI32x32x8x1_SE_1LDSB0_AF0EM8_AF1EM1_AMAS3_BL1_EPS0_GRVW2_GSU1_ISA908_KLA_LRVW4_MAC_NLCA1_NLCB2_PGR2_SIA3_SU0_SUS256_SRVW4_TT2_128_USFGROn1_VAW2_VSn1_VW2_WSGRA1_WSGRB1_WG64_4_1_WGM2
    SolutionIndex: 259
    SolutionNameMin: Cijk_Ailk_Bjlk_HBH_MT256x128x32_MI32x32x8x1_SE_1LDSB0_AF0EM8_AF1EM1_AMAS3_BL1_EPS0_GRVW4_GSU1_ISA908_KLA_LRVW4_MAC_NLCA1_NLCB1_PGR2_SIA3_SU0_SUS256_SRVW4_TT4_64_USFGROn1_VAW2_VSn1_VW2_WSGRA1_WSGRB1_WG64_4_1_WGM15
    SolutionIndex: 260
    SolutionNameMin: Cijk_Ailk_Bjlk_HBH_MT128x64x64_MI32x32x8x1_SE_1LDSB0_AF0EM8_AF1EM1_AMAS3_BL1_EPS0_GRVW8_GSU1_ISA908_KLA_LRVW4_MAC_NLCA1_NLCB1_PGR2_SIA3_SU0_SUS256_SRVW4_TT2_32_USFGROn1_VAW2_VSn1_VW2_WSGRA1_WSGRB1_WG64_4_1_WGM2
    SolutionIndex: 261
    SolutionNameMin: Cijk_Ailk_Bjlk_HBH_MT256x144x32_MI16x16x16x1_SE_1LDSB0_AF0EM8_AF1EM1_AMAS3_BL1_EPS0_GRVW2_GSU1_ISA908_KLA_LRVW4_MAC_NLCA2_NLCB9_PGR2_SIA3_SU0_SUS256_SRVW4_TT4_144_USFGROn1_VAW2_VSn1_VW2_WSGRA1_WSGRB1_WG64_4_1_WGM2
    SolutionIndex: 262
    SolutionNameMin: Cijk_Ailk_Bjlk_HBH_MT64x64x16_MI32x32x8x1_SE_1LDSB0_AF0EM1_AF1EM1_AMAS3_BL1_EPS0_GRVW2_GSU1_ISA908_KLA_LRVW4_MAC_NLCA1_NLCB1_PGR2_SIA3_SU32_SUS128_SRVW4_TT1_32_USFGROn1_VAW2_VSn1_VW2_WSGRA1_WSGRB1_WG64_4_1_WGM2
    SolutionIndex: 263
    SolutionNameMin: Cijk_Ailk_Bjlk_HBH_MT128x288x16_MI32x32x8x1_SE_1LDSB0_AF0EM8_AF1EM1_AMAS3_BL1_EPS0_GRVW2_GSU1_ISA908_KLA_LRVW4_MAC_NLCA1_NLCB9_PGR2_SIA3_SU0_SUS256_SRVW4_TT1_288_USFGROn1_VAW2_VSn1_VW2_WSGRA1_WSGRB1_WG128_2_1_WGM15
    SolutionIndex: 264
    SolutionNameMin: Cijk_Ailk_Bjlk_HBH_MT128x128x32_MI32x32x8x1_SE_1LDSB0_AF0EM8_AF1EM1_AMAS3_BL1_EPS0_GRVW4_GSU1_ISA908_KLA_LRVW4_MAC_NLCA1_NLCB1_PGR2_SIA3_SU32_SUS256_SRVW4_TT2_64_USFGROn1_VAW2_VSn1_VW2_WSGRA1_WSGRB1_WG64_4_1_WGM2
    SolutionIndex: 265
    SolutionNameMin: Cijk_Ailk_Bjlk_HBH_MT128x96x16_MI32x32x8x1_SE_1LDSB0_AF0EM8_AF1EM1_AMAS3_BL1_EPS0_GRVW2_GSU1_ISA908_KLA_LRVW4_MAC_NLCA1_NLCB3_PGR2_SIA3_SU32_SUS256_SRVW4_TT1_96_USFGROn1_VAW2_VSn1_VW2_WSGRA1_WSGRB1_WG128_2_1_WGM15
    SolutionIndex: 266
    SolutionNameMin: Cijk_Ailk_Bjlk_HBH_MT64x128x16_MI32x32x8x1_SE_1LDSB0_AF0EM8_AF1EM1_AMAS3_BL1_EPS0_GRVW4_GSU1_ISA908_KLA_LRVW4_MAC_NLCA1_NLCB1_PGR2_SIA3_SU32_SUS128_SRVW4_TT1_64_USFGROn1_VAW2_VSn1_VW2_WSGRA1_WSGRB1_WG64_4_1_WGM1
    SolutionIndex: 267
    SolutionNameMin: Cijk_Ailk_Bjlk_HBH_MT128x128x16_MI32x32x8x1_SN_1LDSB0_AF0EM8_AF1EM1_AMAS3_BL1_EPS0_GRVW8_GSU1_ISA908_KLA_LRVW4_MAC_NLCA1_NLCB1_PGR2_SIA3_SU0_SUS128_SRVW4_TT2_64_USFGROn1_VAW2_VSn1_VW2_WSGRA1_WSGRB1_WG64_4_1_WGM15
    SolutionIndex: 268
    SolutionNameMin: Cijk_Ailk_Bjlk_HBH_MT256x160x32_MI32x32x8x1_SN_1LDSB0_AF0EM8_AF1EM1_AMAS3_BL1_EPS1_GRVW4_GSU1_ISA908_KLA_LRVW4_MAC_NLCA1_NLCB5_PGR1_SIA3_SU32_SUS256_SRVW4_TT2_160_USFGROn1_VAW2_VSn1_VW2_WSGRA1_WSGRB1_WG128_2_1_WGM15
    SolutionIndex: 269
    SolutionNameMin: Cijk_Ailk_Bjlk_HBH_MT64x64x32_MI32x32x8x1_SE_1LDSB0_AF0EM8_AF1EM1_AMAS3_BL1_EPS0_GRVW2_GSU1_ISA908_KLA_LRVW4_MAC_NLCA1_NLCB1_PGR2_SIA3_SU0_SUS256_SRVW4_TT1_32_USFGROn1_VAW2_VSn1_VW2_WSGRA1_WSGRB1_WG64_4_1_WGM15
    SolutionIndex: 270
    SolutionNameMin: Cijk_Ailk_Bjlk_HBH_MT4x64x32_MI4x4x4x16_SE_1LDSB0_AF0EM8_AF1EM1_AMAS3_BL1_EPS0_GRVW2_GSU1_ISA908_KLA_LRVW4_MAC_NLCA1_NLCB1_PGR2_SIA3_SU0_SUS256_SRVW0_TT1_4_USFGROn1_VAW2_VSn1_VW2_WSGRA1_WSGRB1_WG4_16_1_WGM1
    SolutionIndex: 271
    SolutionNameMin: Cijk_Ailk_Bjlk_HBH_MT64x16x64_MI16x16x16x1_SE_1LDSB0_AF0EM8_AF1EM1_AMAS3_BL1_EPS0_GRVW2_GSU7_ISA908_KLA_LRVW4_MAC_NLCA1_NLCB1_PGR2_SIA3_SU32_SUS256_SRVW0_TT1_16_USFGROn1_VAW1_VSn1_VW2_WSGRA1_WSGRB1_WG64_4_1_WGM1
    SolutionIndex: 272
    SolutionNameMin: Cijk_Ailk_Bjlk_HBH_MT128x256x16_MI32x32x8x1_SE_1LDSB0_AF0EM8_AF1EM1_AMAS3_BL1_EPS0_GRVW4_GSU1_ISA908_KLA_LRVW4_MAC_NLCA1_NLCB1_PGR2_SIA3_SU0_SUS256_SRVW4_TT2_128_USFGROn1_VAW2_VSn1_VW2_WSGRA1_WSGRB1_WG64_4_1_WGM2
    SolutionIndex: 273
    SolutionNameMin: Cijk_Ailk_Bjlk_HBH_MT64x64x16_MI32x32x8x1_SE_1LDSB0_AF0EM8_AF1EM1_AMAS3_BL1_EPS0_GRVW8_GSU1_ISA908_KLA_LRVW4_MAC_NLCA1_NLCB1_PGR2_SIA3_SU32_SUS128_SRVW4_TT1_32_USFGROn1_VAW2_VSn1_VW2_WSGRA1_WSGRB1_WG64_4_1_WGM15
    SolutionIndex: 274
    SolutionNameMin: Cijk_Ailk_Bjlk_HBH_MT64x64x32_MI32x32x8x1_SE_1LDSB0_AF0EM8_AF1EM1_AMAS3_BL1_EPS0_GRVW4_GSU1_ISA908_KLA_LRVW4_MAC_NLCA1_NLCB1_PGR2_SIA3_SU32_SUS128_SRVW4_TT1_32_USFGROn1_VAW2_VSn1_VW2_WSGRA1_WSGRB1_WG64_4_1_WGM2
    SolutionIndex: 275
    SolutionNameMin: Cijk_Ailk_Bjlk_HBH_MT32x32x16_MI16x16x16x1_SE_1LDSB0_AF0EM8_AF1EM1_AMAS3_BL1_EPS0_GRVW4_GSU1_ISA908_KLA_LRVW4_MAC_NLCA1_NLCB1_PGR2_SIA3_SU0_SUS256_SRVW4_TT1_16_USFGROn1_VAW2_VSn1_VW2_WSGRA1_WSGRB1_WG32_8_1_WGM1
    SolutionIndex: 276
    SolutionNameMin: Cijk_Ailk_Bjlk_HBH_MT32x32x16_MI16x16x16x1_SE_1LDSB0_AF0EM1_AF1EM1_AMAS3_BL1_EPS1_GRVW2_GSU1_ISA908_KLA_LRVW4_MAC_NLCA1_NLCB1_PGR1_SIA3_SU0_SUS256_SRVW4_TT1_16_USFGROn1_VAW2_VSn1_VW2_WSGRA1_WSGRB1_WG32_8_1_WGM15
    SolutionIndex: 277
    SolutionNameMin: Cijk_Ailk_Bjlk_HBH_MT128x96x64_MI32x32x8x1_SE_1LDSB0_AF0EM8_AF1EM1_AMAS3_BL1_EPS0_GRVW8_GSU1_ISA908_KLA_LRVW4_MAC_NLCA1_NLCB3_PGR2_SIA3_SU0_SUS256_SRVW4_TT1_96_USFGROn1_VAW2_VSn1_VW2_WSGRA1_WSGRB1_WG128_2_1_WGM2
    SolutionIndex: 278
    SolutionNameMin: Cijk_Ailk_Bjlk_HBH_MT64x64x32_MI32x32x8x1_SN_1LDSB0_AF0EM8_AF1EM1_AMAS3_BL1_EPS0_GRVW4_GSU1_ISA908_KLA_LRVW4_MAC_NLCA1_NLCB1_PGR2_SIA3_SU0_SUS256_SRVW4_TT1_32_USFGROn1_VAW2_VSn1_VW2_WSGRA1_WSGRB1_WG64_4_1_WGM1
    SolutionIndex: 279
    SolutionNameMin: Cijk_Ailk_Bjlk_HBH_MT64x32x16_MI16x16x16x1_SE_1LDSB0_AF0EM1_AF1EM1_AMAS3_BL1_EPS1_GRVW2_GSU1_ISA908_KLA_LRVW4_MAC_NLCA1_NLCB1_PGR1_SIA3_SU32_SUS256_SRVW4_TT2_16_USFGROn1_VAW2_VSn1_VW2_WSGRA1_WSGRB1_WG32_8_1_WGM15
    SolutionIndex: 280
    SolutionNameMin: Cijk_Ailk_Bjlk_HBH_MT128x96x32_MI32x32x8x1_SE_1LDSB0_AF0EM8_AF1EM1_AMAS3_BL1_EPS0_GRVW4_GSU1_ISA908_KLA_LRVW4_MAC_NLCA1_NLCB3_PGR2_SIA3_SU0_SUS256_SRVW4_TT1_96_USFGROn1_VAW2_VSn1_VW2_WSGRA1_WSGRB1_WG128_2_1_WGM2
    SolutionIndex: 281
    SolutionNameMin: Cijk_Ailk_Bjlk_HBH_MT128x256x16_MI32x32x8x1_SE_1LDSB0_AF0EM8_AF1EM1_AMAS3_BL1_EPS0_GRVW8_GSU1_ISA908_KLA_LRVW4_MAC_NLCA1_NLCB1_PGR2_SIA3_SU0_SUS256_SRVW4_TT2_128_USFGROn1_VAW2_VSn1_VW2_WSGRA1_WSGRB1_WG64_4_1_WGM2
    SolutionIndex: 282
    SolutionNameMin: Cijk_Ailk_Bjlk_HBH_MT64x128x16_MI32x32x8x1_SE_1LDSB0_AF0EM8_AF1EM1_AMAS3_BL1_EPS0_GRVW2_GSU1_ISA908_KLA_LRVW4_MAC_NLCA1_NLCB1_PGR2_SIA3_SU0_SUS256_SRVW4_TT1_64_USFGROn1_VAW2_VSn1_VW2_WSGRA1_WSGRB1_WG64_4_1_WGM2
    SolutionIndex: 283
    SolutionNameMin: Cijk_Ailk_Bjlk_HBH_MT64x64x16_MI32x32x8x1_SE_1LDSB0_AF0EM8_AF1EM1_AMAS3_BL1_EPS0_GRVW4_GSU1_ISA908_KLA_LRVW4_MAC_NLCA1_NLCB1_PGR2_SIA3_SU32_SUS256_SRVW4_TT1_32_USFGROn1_VAW2_VSn1_VW2_WSGRA1_WSGRB1_WG64_4_1_WGM15
    SolutionIndex: 284
    SolutionNameMin: Cijk_Ailk_Bjlk_HBH_MT128x64x16_MI32x32x8x1_SE_1LDSB0_AF0EM1_AF1EM1_AMAS3_BL1_EPS0_GRVW4_GSU1_ISA908_KLA_LRVW4_MAC_NLCA1_NLCB1_PGR2_SIA3_SU0_SUS256_SRVW4_TT2_32_USFGROn1_VAW2_VSn1_VW2_WSGRA1_WSGRB1_WG64_4_1_WGM15
    SolutionIndex: 285
    SolutionNameMin: Cijk_Ailk_Bjlk_HBH_MT160x256x32_MI32x32x8x1_SE_1LDSB0_AF0EM8_AF1EM1_AMAS3_BL1_EPS1_GRVW4_GSU1_ISA908_KLA_LRVW4_MAC_NLCA5_NLCB1_PGR1_SIA3_SU32_SUS128_SRVW0_TT5_64_USFGROn1_VAW2_VSn1_VW2_WSGRA1_WSGRB1_WG32_8_1_WGM1
    SolutionIndex: 286
    SolutionNameMin: Cijk_Ailk_Bjlk_HBH_MT64x128x16_MI32x32x8x1_SE_1LDSB0_AF0EM8_AF1EM1_AMAS3_BL1_EPS1_GRVW2_GSU1_ISA908_KLA_LRVW4_MAC_NLCA1_NLCB1_PGR1_SIA3_SU32_SUS128_SRVW4_TT1_64_USFGROn1_VAW2_VSn1_VW2_WSGRA1_WSGRB1_WG64_4_1_WGM15
    SolutionIndex: 287
    SolutionNameMin: Cijk_Ailk_Bjlk_HBH_MT64x16x64_MI16x16x16x1_SE_1LDSB0_AF0EM8_AF1EM1_AMAS3_BL1_EPS0_GRVW2_GSU7_ISA908_KLA_LRVW4_MAC_NLCA1_NLCB1_PGR2_SIA3_SU32_SUS256_SRVW4_TT1_16_USFGROn1_VAW1_VSn1_VW2_WSGRA1_WSGRB1_WG64_4_1_WGM1
    SolutionIndex: 288
    SolutionNameMin: Cijk_Ailk_Bjlk_HBH_MT64x16x32_MI16x16x16x1_SE_1LDSB0_AF0EM1_AF1EM1_AMAS3_BL1_EPS0_GRVW8_GSU3_ISA908_KLA_LRVW4_MAC_NLCA1_NLCB1_PGR2_SIA3_SU32_SUS256_SRVW0_TT1_16_USFGROn1_VAW1_VSn1_VW2_WSGRA1_WSGRB1_WG64_4_1_WGM1
    SolutionIndex: 289
    SolutionNameMin: Cijk_Ailk_Bjlk_HBH_MT128x128x16_MI32x32x8x1_SE_1LDSB0_AF0EM8_AF1EM1_AMAS3_BL1_EPS0_GRVW8_GSU1_ISA908_KLA_LRVW4_MAC_NLCA1_NLCB1_PGR2_SIA3_SU0_SUS256_SRVW4_TT2_64_USFGROn1_VAW2_VSn1_VW2_WSGRA1_WSGRB1_WG64_4_1_WGM2
    SolutionIndex: 290
    SolutionNameMin: Cijk_Ailk_Bjlk_HBH_MT64x128x16_MI32x32x8x1_SE_1LDSB0_AF0EM8_AF1EM1_AMAS3_BL1_EPS0_GRVW2_GSU1_ISA908_KLA_LRVW4_MAC_NLCA1_NLCB1_PGR2_SIA3_SU32_SUS256_SRVW4_TT1_64_USFGROn1_VAW2_VSn1_VW2_WSGRA1_WSGRB1_WG64_4_1_WGM2
    SolutionIndex: 291
    SolutionNameMin: Cijk_Ailk_Bjlk_HBH_MT32x32x16_MI16x16x16x1_SE_1LDSB0_AF0EM1_AF1EM1_AMAS3_BL1_EPS1_GRVW2_GSU1_ISA908_KLA_LRVW4_MAC_NLCA1_NLCB1_PGR1_SIA3_SU32_SUS256_SRVW4_TT1_16_USFGROn1_VAW2_VSn1_VW2_WSGRA1_WSGRB1_WG32_8_1_WGM1
    SolutionIndex: 292
    SolutionNameMin: Cijk_Ailk_Bjlk_HBH_MT16x16x16_MI16x16x16x1_SE_1LDSB0_AF0EM8_AF1EM1_AMAS3_BL1_EPS0_GRVW2_GSU1_ISA908_KLA_LRVW4_MAC_NLCA1_NLCB1_PGR2_SIA3_SU32_SUS256_SRVW0_TT1_16_USFGROn1_VAW2_VSn1_VW2_WSGRA1_WSGRB1_WG16_4_1_WGM2
    SolutionIndex: 293
    SolutionNameMin: Cijk_Ailk_Bjlk_HBH_MT128x256x16_MI32x32x8x1_SE_1LDSB0_AF0EM8_AF1EM1_AMAS3_BL1_EPS0_GRVW4_GSU3_ISA908_KLA_LRVW4_MAC_NLCA1_NLCB1_PGR2_SIA3_SU0_SUS256_SRVW4_TT2_128_USFGROn1_VAW1_VSn1_VW2_WSGRA1_WSGRB1_WG64_4_1_WGM2
    SolutionIndex: 294
    SolutionNameMin: Cijk_Ailk_Bjlk_HBH_MT128x256x16_MI32x32x8x1_SE_1LDSB0_AF0EM8_AF1EM1_AMAS3_BL1_EPS0_GRVW4_GSU1_ISA908_KLA_LRVW4_MAC_NLCA1_NLCB1_PGR2_SIA3_SU32_SUS128_SRVW4_TT2_128_USFGROn1_VAW2_VSn1_VW2_WSGRA1_WSGRB1_WG64_4_1_WGM2
    SolutionIndex: 295
    SolutionNameMin: Cijk_Ailk_Bjlk_HBH_MT16x64x32_MI16x16x16x1_SE_1LDSB0_AF0EM8_AF1EM1_AMAS3_BL1_EPS1_GRVW8_GSU1_ISA908_KLA_LRVW4_MAC_NLCA1_NLCB1_PGR1_SIA3_SU0_SUS256_SRVW0_TT1_16_USFGROn1_VAW2_VSn1_VW2_WSGRA1_WSGRB1_WG16_16_1_WGM2
    SolutionIndex: 296
    SolutionNameMin: Cijk_Ailk_Bjlk_HBH_MT64x64x16_MI32x32x8x1_SE_1LDSB0_AF0EM8_AF1EM1_AMAS3_BL1_EPS0_GRVW8_GSU1_ISA908_KLA_LRVW4_MAC_NLCA1_NLCB1_PGR2_SIA3_SU0_SUS256_SRVW4_TT1_32_USFGROn1_VAW2_VSn1_VW2_WSGRA1_WSGRB1_WG64_4_1_WGM15
    SolutionIndex: 297
    SolutionNameMin: Cijk_Ailk_Bjlk_HBH_MT256x128x32_MI32x32x8x1_SE_1LDSB0_AF0EM8_AF1EM1_AMAS3_BL1_EPS1_GRVW8_GSU1_ISA908_KLA_LRVW4_MAC_NLCA1_NLCB1_PGR1_SIA3_SU32_SUS256_SRVW4_TT4_64_USFGROn1_VAW2_VSn1_VW2_WSGRA1_WSGRB1_WG64_4_1_WGM1
    SolutionIndex: 298
    SolutionNameMin: Cijk_Ailk_Bjlk_HBH_MT128x256x32_MI32x32x8x1_SE_1LDSB0_AF0EM8_AF1EM1_AMAS3_BL1_EPS1_GRVW8_GSU1_ISA908_KLA_LRVW4_MAC_NLCA1_NLCB1_PGR1_SIA3_SU32_SUS128_SRVW4_TT2_128_USFGROn1_VAW2_VSn1_VW2_WSGRA1_WSGRB1_WG64_4_1_WGM15
    SolutionIndex: 299
    SolutionNameMin: Cijk_Ailk_Bjlk_HBH_MT128x96x32_MI32x32x8x1_SE_1LDSB0_AF0EM8_AF1EM1_AMAS3_BL1_EPS0_GRVW4_GSU1_ISA908_KLA_LRVW4_MAC_NLCA1_NLCB3_PGR2_SIA3_SU0_SUS256_SRVW4_TT1_96_USFGROn1_VAW2_VSn1_VW2_WSGRA1_WSGRB1_WG128_2_1_WGM1
    SolutionIndex: 300
    SolutionNameMin: Cijk_Ailk_Bjlk_HBH_MT256x160x32_MI32x32x8x1_SE_1LDSB0_AF0EM8_AF1EM1_AMAS3_BL1_EPS1_GRVW4_GSU3_ISA908_KLA_LRVW4_MAC_NLCA1_NLCB5_PGR1_SIA3_SU32_SUS256_SRVW4_TT2_160_USFGROn1_VAW1_VSn1_VW2_WSGRA1_WSGRB1_WG128_2_1_WGM2
    SolutionIndex: 301
    SolutionNameMin: Cijk_Ailk_Bjlk_HBH_MT64x32x16_MI16x16x16x1_SE_1LDSB0_AF0EM1_AF1EM1_AMAS3_BL1_EPS1_GRVW2_GSU1_ISA908_KLA_LRVW4_MAC_NLCA1_NLCB1_PGR1_SIA3_SU0_SUS256_SRVW4_TT2_16_USFGROn1_VAW2_VSn1_VW2_WSGRA1_WSGRB1_WG32_8_1_WGM1
    SolutionIndex: 302
    SolutionNameMin: Cijk_Ailk_Bjlk_HBH_MT256x128x32_MI32x32x8x1_SE_1LDSB0_AF0EM8_AF1EM1_AMAS3_BL1_EPS1_GRVW8_GSU1_ISA908_KLA_LRVW4_MAC_NLCA1_NLCB1_PGR1_SIA3_SU32_SUS256_SRVW4_TT4_64_USFGROn1_VAW2_VSn1_VW2_WSGRA1_WSGRB1_WG64_4_1_WGM2
    SolutionIndex: 303
    SolutionNameMin: Cijk_Ailk_Bjlk_HBH_MT64x128x16_MI32x32x8x1_SN_1LDSB0_AF0EM8_AF1EM1_AMAS3_BL1_EPS0_GRVW4_GSU1_ISA908_KLA_LRVW4_MAC_NLCA1_NLCB1_PGR2_SIA3_SU0_SUS256_SRVW4_TT1_64_USFGROn1_VAW2_VSn1_VW2_WSGRA1_WSGRB1_WG64_4_1_WGM1
    SolutionIndex: 304
    SolutionNameMin: Cijk_Ailk_Bjlk_HBH_MT64x32x16_MI16x16x16x1_SE_1LDSB1_AF0EM8_AF1EM1_AMAS3_BL1_EPS1_GRVW8_GSU1_ISA908_KLA_LRVW4_MAC_NLCA1_NLCB1_PGR1_SIA3_SU32_SUS256_SRVW4_TT2_16_USFGROn1_VAW2_VSn1_VW2_WSGRA1_WSGRB1_WG32_8_1_WGM15
    SolutionIndex: 305
    SolutionNameMin: Cijk_Ailk_Bjlk_HBH_MT64x128x32_MI32x32x8x1_SE_1LDSB0_AF0EM8_AF1EM1_AMAS3_BL1_EPS0_GRVW4_GSU1_ISA908_KLA_LRVW4_MAC_NLCA1_NLCB1_PGR2_SIA3_SU32_SUS256_SRVW4_TT1_64_USFGROn1_VAW2_VSn1_VW2_WSGRA1_WSGRB1_WG64_4_1_WGM15
    SolutionIndex: 306
    SolutionNameMin: Cijk_Ailk_Bjlk_HBH_MT128x64x16_MI32x32x8x1_SE_1LDSB0_AF0EM8_AF1EM1_AMAS3_BL1_EPS1_GRVW2_GSU1_ISA908_KLA_LRVW4_MAC_NLCA1_NLCB1_PGR1_SIA3_SU0_SUS256_SRVW4_TT2_32_USFGROn1_VAW2_VSn1_VW2_WSGRA1_WSGRB1_WG64_4_1_WGM1
    SolutionIndex: 307
    SolutionNameMin: Cijk_Ailk_Bjlk_HBH_MT64x128x32_MI32x32x8x1_SE_1LDSB0_AF0EM1_AF1EM1_AMAS3_BL1_EPS0_GRVW2_GSU1_ISA908_KLA_LRVW4_MAC_NLCA1_NLCB1_PGR2_SIA3_SU0_SUS256_SRVW4_TT1_64_USFGROn1_VAW2_VSn1_VW2_WSGRA1_WSGRB1_WG64_4_1_WGM15
    SolutionIndex: 308
    SolutionNameMin: Cijk_Ailk_Bjlk_HBH_MT256x192x32_MI32x32x8x1_SE_1LDSB0_AF0EM8_AF1EM1_AMAS3_BL1_EPS1_GRVW8_GSU1_ISA908_KLA_LRVW4_MAC_NLCA1_NLCB3_PGR1_SIA3_SU0_SUS256_SRVW4_TT4_96_USFGROn1_VAW2_VSn1_VW2_WSGRA1_WSGRB1_WG64_4_1_WGM2
    SolutionIndex: 309
    SolutionNameMin: Cijk_Ailk_Bjlk_HBH_MT128x256x16_MI32x32x8x1_SE_1LDSB0_AF0EM8_AF1EM1_AMAS3_BL1_EPS0_GRVW2_GSU1_ISA908_KLA_LRVW4_MAC_NLCA1_NLCB2_PGR2_SIA3_SU0_SUS256_SRVW4_TT2_128_USFGROn1_VAW2_VSn1_VW2_WSGRA1_WSGRB1_WG64_4_1_WGM15
    SolutionIndex: 310
    SolutionNameMin: Cijk_Ailk_Bjlk_HBH_MT128x64x32_MI32x32x8x1_SE_1LDSB0_AF0EM8_AF1EM1_AMAS3_BL1_EPS0_GRVW2_GSU1_ISA908_KLA_LRVW4_MAC_NLCA1_NLCB1_PGR2_SIA3_SU0_SUS256_SRVW4_TT2_32_USFGROn1_VAW2_VSn1_VW2_WSGRA1_WSGRB1_WG64_4_1_WGM1
    SolutionIndex: 311
    SolutionNameMin: Cijk_Ailk_Bjlk_HBH_MT256x160x32_MI32x32x8x1_SN_1LDSB0_AF0EM8_AF1EM1_AMAS3_BL1_EPS1_GRVW4_GSU1_ISA908_KLA_LRVW4_MAC_NLCA1_NLCB5_PGR1_SIA3_SU32_SUS128_SRVW4_TT2_160_USFGROn1_VAW2_VSn1_VW2_WSGRA1_WSGRB1_WG128_2_1_WGM2
    SolutionIndex: 312
    SolutionNameMin: Cijk_Ailk_Bjlk_HBH_MT128x160x32_MI32x32x8x1_SN_1LDSB0_AF0EM8_AF1EM1_AMAS3_BL1_EPS0_GRVW4_GSU1_ISA908_KLA_LRVW4_MAC_NLCA1_NLCB5_PGR2_SIA3_SU0_SUS256_SRVW4_TT1_160_USFGROn1_VAW2_VSn1_VW2_WSGRA1_WSGRB1_WG128_2_1_WGM15
    SolutionIndex: 313
    SolutionNameMin: Cijk_Ailk_Bjlk_HBH_MT144x256x32_MI16x16x16x1_SE_1LDSB0_AF0EM8_AF1EM1_AMAS3_BL1_EPS0_GRVW2_GSU1_ISA908_KLA_LRVW4_MAC_NLCA9_NLCB2_PGR2_SIA3_SU0_SUS256_SRVW0_TT9_64_USFGROn1_VAW2_VSn1_VW2_WSGRA1_WSGRB1_WG16_16_1_WGM1
    SolutionIndex: 314
    SolutionNameMin: Cijk_Ailk_Bjlk_HBH_MT64x128x16_MI32x32x8x1_SE_1LDSB0_AF0EM8_AF1EM1_AMAS3_BL1_EPS0_GRVW2_GSU1_ISA908_KLA_LRVW4_MAC_NLCA1_NLCB1_PGR2_SIA3_SU32_SUS256_SRVW4_TT1_64_USFGROn1_VAW2_VSn1_VW2_WSGRA1_WSGRB1_WG64_4_1_WGM1
    SolutionIndex: 315
    SolutionNameMin: Cijk_Ailk_Bjlk_HBH_MT32x32x16_MI16x16x16x1_SE_1LDSB0_AF0EM8_AF1EM1_AMAS3_BL1_EPS1_GRVW8_GSU1_ISA908_KLA_LRVW4_MAC_NLCA1_NLCB1_PGR1_SIA3_SU32_SUS128_SRVW4_TT1_16_USFGROn1_VAW2_VSn1_VW2_WSGRA1_WSGRB1_WG32_8_1_WGM15
    SolutionIndex: 316
    SolutionNameMin: Cijk_Ailk_Bjlk_HBH_MT128x128x32_MI32x32x8x1_SE_1LDSB0_AF0EM8_AF1EM1_AMAS3_BL1_EPS0_GRVW8_GSU1_ISA908_KLA_LRVW4_MAC_NLCA1_NLCB1_PGR2_SIA3_SU32_SUS128_SRVW4_TT2_64_USFGROn1_VAW2_VSn1_VW2_WSGRA1_WSGRB1_WG64_4_1_WGM2
    SolutionIndex: 317
    SolutionNameMin: Cijk_Ailk_Bjlk_HBH_MT256x192x32_MI32x32x8x1_SE_1LDSB0_AF0EM8_AF1EM1_AMAS3_BL1_EPS1_GRVW8_GSU1_ISA908_KLA_LRVW4_MAC_NLCA1_NLCB3_PGR1_SIA3_SU0_SUS256_SRVW4_TT4_96_USFGROn1_VAW2_VSn1_VW2_WSGRA1_WSGRB1_WG64_4_1_WGM1
    SolutionIndex: 318
    SolutionNameMin: Cijk_Ailk_Bjlk_HBH_MT256x192x32_MI32x32x8x1_SE_1LDSB1_AF0EM8_AF1EM1_AMAS3_BL1_EPS1_GRVW8_GSU1_ISA908_KLA_LRVW4_MAC_NLCA1_NLCB3_PGR1_SIA3_SU32_SUS128_SRVW4_TT4_96_USFGROn1_VAW2_VSn1_VW2_WSGRA1_WSGRB1_WG64_4_1_WGM15
    SolutionIndex: 319
    SolutionNameMin: Cijk_Ailk_Bjlk_HBH_MT128x64x16_MI32x32x8x1_SE_1LDSB0_AF0EM8_AF1EM1_AMAS3_BL1_EPS0_GRVW2_GSU1_ISA908_KLA_LRVW4_MAC_NLCA1_NLCB1_PGR2_SIA3_SU32_SUS256_SRVW4_TT2_32_USFGROn1_VAW2_VSn1_VW2_WSGRA1_WSGRB1_WG64_4_1_WGM15
    SolutionIndex: 320
    SolutionNameMin: Cijk_Ailk_Bjlk_HBH_MT128x256x16_MI32x32x8x1_SE_1LDSB0_AF0EM8_AF1EM1_AMAS3_BL1_EPS0_GRVW4_GSU7_ISA908_KLA_LRVW4_MAC_NLCA1_NLCB1_PGR2_SIA3_SU0_SUS256_SRVW4_TT2_128_USFGROn1_VAW1_VSn1_VW2_WSGRA1_WSGRB1_WG64_4_1_WGM15
    SolutionIndex: 321
    SolutionNameMin: Cijk_Ailk_Bjlk_HBH_MT128x192x32_MI32x32x8x1_SE_1LDSB0_AF0EM8_AF1EM1_AMAS3_BL1_EPS0_GRVW4_GSU5_ISA908_KLA_LRVW4_MAC_NLCA1_NLCB3_PGR2_SIA3_SU0_SUS256_SRVW4_TT2_96_USFGROn1_VAW1_VSn1_VW2_WSGRA1_WSGRB1_WG64_4_1_WGM2
    SolutionIndex: 322
    SolutionNameMin: Cijk_Ailk_Bjlk_HBH_MT32x32x64_MI16x16x16x1_SE_1LDSB0_AF0EM8_AF1EM1_AMAS3_BL1_EPS1_GRVW8_GSU7_ISA908_KLA_LRVW4_MAC_NLCA1_NLCB1_PGR1_SIA3_SU0_SUS256_SRVW0_TT1_16_USFGROn1_VAW1_VSn1_VW2_WSGRA1_WSGRB1_WG32_8_1_WGM15
    SolutionIndex: 323
    SolutionNameMin: Cijk_Ailk_Bjlk_HBH_MT64x64x32_MI32x32x8x1_SE_1LDSB0_AF0EM8_AF1EM1_AMAS3_BL1_EPS0_GRVW4_GSU15_ISA908_KLA_LRVW4_MAC_NLCA1_NLCB1_PGR2_SIA3_SU32_SUS256_SRVW4_TT1_32_USFGROn1_VAW1_VSn1_VW2_WSGRA1_WSGRB1_WG64_4_1_WGM1
    SolutionIndex: 324
    SolutionNameMin: Cijk_Ailk_Bjlk_HBH_MT64x64x16_MI32x32x8x1_SE_1LDSB0_AF0EM8_AF1EM1_AMAS3_BL1_EPS0_GRVW8_GSU1_ISA908_KLA_LRVW4_MAC_NLCA1_NLCB1_PGR2_SIA3_SU0_SUS256_SRVW4_TT1_32_USFGROn1_VAW2_VSn1_VW2_WSGRA1_WSGRB1_WG64_4_1_WGM1
    SolutionIndex: 325
    SolutionNameMin: Cijk_Ailk_Bjlk_HBH_MT64x64x16_MI32x32x8x1_SE_1LDSB0_AF0EM1_AF1EM1_AMAS3_BL1_EPS0_GRVW2_GSU1_ISA908_KLA_LRVW4_MAC_NLCA1_NLCB1_PGR2_SIA3_SU32_SUS256_SRVW4_TT1_32_USFGROn1_VAW2_VSn1_VW2_WSGRA1_WSGRB1_WG64_4_1_WGM15
    SolutionIndex: 326
    SolutionNameMin: Cijk_Ailk_Bjlk_HBH_MT160x128x32_MI32x32x8x1_SE_1LDSB0_AF0EM8_AF1EM1_AMAS3_BL1_EPS0_GRVW2_GSU5_ISA908_KLA_LRVW4_MAC_NLCA5_NLCB1_PGR2_SIA3_SU32_SUS256_SRVW0_TT5_32_USFGROn1_VAW1_VSn1_VW2_WSGRA1_WSGRB1_WG32_8_1_WGM1
    SolutionIndex: 327
    SolutionNameMin: Cijk_Ailk_Bjlk_HBH_MT96x128x64_MI32x32x8x1_SE_1LDSB0_AF0EM8_AF1EM1_AMAS3_BL1_EPS0_GRVW2_GSU3_ISA908_KLA_LRVW4_MAC_NLCA3_NLCB1_PGR2_SIA3_SU0_SUS256_SRVW0_TT3_32_USFGROn1_VAW1_VSn1_VW2_WSGRA1_WSGRB1_WG32_8_1_WGM15
    SolutionIndex: 328
    SolutionNameMin: Cijk_Ailk_Bjlk_HBH_MT64x128x64_MI32x32x8x1_SE_1LDSB0_AF0EM8_AF1EM1_AMAS3_BL1_EPS1_GRVW4_GSU7_ISA908_KLA_LRVW4_MAC_NLCA1_NLCB1_PGR1_SIA3_SU32_SUS128_SRVW0_TT1_64_USFGROn1_VAW1_VSn1_VW2_WSGRA1_WSGRB1_WG64_4_1_WGM15
    SolutionIndex: 329
    SolutionNameMin: Cijk_Ailk_Bjlk_HBH_MT64x64x64_MI32x32x8x1_SE_1LDSB0_AF0EM8_AF1EM1_AMAS3_BL1_EPS1_GRVW8_GSU7_ISA908_KLA_LRVW4_MAC_NLCA1_NLCB1_PGR1_SIA3_SU0_SUS256_SRVW0_TT1_32_USFGROn1_VAW1_VSn1_VW2_WSGRA1_WSGRB1_WG64_4_1_WGM1
    SolutionIndex: 330
    SolutionNameMin: Cijk_Ailk_Bjlk_HBH_MT128x128x32_MI32x32x8x1_SE_1LDSB0_AF0EM8_AF1EM1_AMAS3_BL1_EPS0_GRVW2_GSU15_ISA908_KLA_LRVW4_MAC_NLCA1_NLCB1_PGR2_SIA3_SU32_SUS128_SRVW4_TT2_64_USFGROn1_VAW1_VSn1_VW2_WSGRA1_WSGRB1_WG64_4_1_WGM15
    SolutionIndex: 331
    SolutionNameMin: Cijk_Ailk_Bjlk_HBH_MT128x256x16_MI32x32x8x1_SE_1LDSB0_AF0EM8_AF1EM1_AMAS3_BL1_EPS0_GRVW4_GSU1_ISA908_KLA_LRVW4_MAC_NLCA1_NLCB1_PGR2_SIA3_SU32_SUS128_SRVW4_TT2_128_USFGROn1_VAW2_VSn1_VW2_WSGRA1_WSGRB1_WG64_4_1_WGM15
    SolutionIndex: 332
    SolutionNameMin: Cijk_Ailk_Bjlk_HBH_MT128x256x16_MI32x32x8x1_SE_1LDSB0_AF0EM8_AF1EM1_AMAS3_BL1_EPS0_GRVW8_GSU1_ISA908_KLA_LRVW4_MAC_NLCA1_NLCB1_PGR2_SIA3_SU32_SUS128_SRVW4_TT2_128_USFGROn1_VAW2_VSn1_VW2_WSGRA1_WSGRB1_WG64_4_1_WGM15
    SolutionIndex: 333
    SolutionNameMin: Cijk_Ailk_Bjlk_HBH_MT128x256x32_MI32x32x8x1_SE_1LDSB0_AF0EM8_AF1EM1_AMAS3_BL1_EPS1_GRVW8_GSU7_ISA908_KLA_LRVW4_MAC_NLCA1_NLCB1_PGR1_SIA3_SU0_SUS256_SRVW4_TT2_128_USFGROn1_VAW1_VSn1_VW2_WSGRA1_WSGRB1_WG64_4_1_WGM1
    SolutionIndex: 334
    SolutionNameMin: Cijk_Ailk_Bjlk_HBH_MT128x64x16_MI32x32x8x1_SE_1LDSB0_AF0EM8_AF1EM1_AMAS3_BL1_EPS0_GRVW2_GSU1_ISA908_KLA_LRVW4_MAC_NLCA1_NLCB1_PGR2_SIA3_SU32_SUS256_SRVW4_TT2_32_USFGROn1_VAW2_VSn1_VW2_WSGRA1_WSGRB1_WG64_4_1_WGM2
    SolutionIndex: 335
    SolutionNameMin: Cijk_Ailk_Bjlk_HBH_MT32x64x16_MI16x16x16x1_SE_1LDSB0_AF0EM1_AF1EM1_AMAS3_BL1_EPS1_GRVW2_GSU1_ISA908_KLA_LRVW4_MAC_NLCA1_NLCB1_PGR1_SIA3_SU0_SUS256_SRVW4_TT1_32_USFGROn1_VAW2_VSn1_VW2_WSGRA1_WSGRB1_WG32_8_1_WGM1
    SolutionIndex: 336
    SolutionNameMin: Cijk_Ailk_Bjlk_HBH_MT128x256x16_MI32x32x8x1_SE_1LDSB1_AF0EM8_AF1EM1_AMAS3_BL1_EPS0_GRVW8_GSU1_ISA908_KLA_LRVW4_MAC_NLCA1_NLCB1_PGR2_SIA3_SU32_SUS128_SRVW4_TT2_128_USFGROn1_VAW2_VSn1_VW2_WSGRA1_WSGRB1_WG64_4_1_WGM2
    SolutionIndex: 337
    SolutionNameMin: Cijk_Ailk_Bjlk_HBH_MT128x64x32_MI32x32x8x1_SE_1LDSB0_AF0EM8_AF1EM1_AMAS3_BL1_EPS0_GRVW2_GSU1_ISA908_KLA_LRVW4_MAC_NLCA1_NLCB1_PGR2_SIA3_SU0_SUS256_SRVW4_TT2_32_USFGROn1_VAW2_VSn1_VW2_WSGRA1_WSGRB1_WG64_4_1_WGM2
    SolutionIndex: 338
    SolutionNameMin: Cijk_Ailk_Bjlk_HBH_MT32x32x64_MI16x16x16x1_SE_1LDSB0_AF0EM1_AF1EM1_AMAS3_BL1_EPS0_GRVW8_GSU7_ISA908_KLA_LRVW4_MAC_NLCA1_NLCB1_PGR2_SIA3_SU0_SUS256_SRVW4_TT1_16_USFGROn1_VAW1_VSn1_VW2_WSGRA1_WSGRB1_WG32_8_1_WGM1
    SolutionIndex: 339
    SolutionNameMin: Cijk_Ailk_Bjlk_HBH_MT16x64x64_MI16x16x16x1_SE_1LDSB0_AF0EM1_AF1EM1_AMAS3_BL1_EPS0_GRVW8_GSU15_ISA908_KLA_LRVW4_MAC_NLCA1_NLCB1_PGR2_SIA3_SU32_SUS128_SRVW0_TT1_16_USFGROn1_VAW1_VSn1_VW2_WSGRA1_WSGRB1_WG16_16_1_WGM1
    SolutionIndex: 340
    SolutionNameMin: Cijk_Ailk_Bjlk_HBH_MT128x192x32_MI32x32x8x1_SN_1LDSB0_AF0EM8_AF1EM1_AMAS3_BL1_EPS0_GRVW8_GSU5_ISA908_KLA_LRVW4_MAC_NLCA1_NLCB3_PGR2_SIA3_SU0_SUS256_SRVW4_TT2_96_USFGROn1_VAW1_VSn1_VW2_WSGRA1_WSGRB1_WG64_4_1_WGM15
    SolutionIndex: 341
    SolutionNameMin: Cijk_Ailk_Bjlk_HBH_MT128x256x16_MI32x32x8x1_SN_1LDSB0_AF0EM8_AF1EM1_AMAS3_BL1_EPS0_GRVW8_GSU3_ISA908_KLA_LRVW4_MAC_NLCA1_NLCB1_PGR2_SIA3_SU0_SUS256_SRVW4_TT2_128_USFGROn1_VAW1_VSn1_VW2_WSGRA1_WSGRB1_WG64_4_1_WGM15
    SolutionIndex: 342
    SolutionNameMin: Cijk_Ailk_Bjlk_HBH_MT256x128x32_MI32x32x8x1_SN_1LDSB0_AF0EM8_AF1EM1_AMAS3_BL1_EPS1_GRVW8_GSU1_ISA908_KLA_LRVW4_MAC_NLCA1_NLCB1_PGR1_SIA3_SU32_SUS256_SRVW4_TT4_64_USFGROn1_VAW2_VSn1_VW2_WSGRA1_WSGRB1_WG64_4_1_WGM1
    SolutionIndex: 343
    SolutionNameMin: Cijk_Ailk_Bjlk_HBH_MT128x160x32_MI32x32x8x1_SN_1LDSB0_AF0EM8_AF1EM1_AMAS3_BL1_EPS0_GRVW4_GSU1_ISA908_KLA_LRVW4_MAC_NLCA1_NLCB5_PGR2_SIA3_SU32_SUS128_SRVW4_TT1_160_USFGROn1_VAW2_VSn1_VW2_WSGRA1_WSGRB1_WG128_2_1_WGM15
    SolutionIndex: 344
    SolutionNameMin: Cijk_Ailk_Bjlk_HBH_MT256x144x32_MI16x16x16x1_SE_1LDSB0_AF0EM8_AF1EM1_AMAS3_BL1_EPS0_GRVW2_GSU2_ISA908_KLA_LRVW4_MAC_NLCA2_NLCB9_PGR2_SIA3_SU0_SUS256_SRVW4_TT4_144_USFGROn1_VAW1_VSn1_VW2_WSGRA1_WSGRB1_WG64_4_1_WGM2
    SolutionIndex: 345
    SolutionNameMin: Cijk_Ailk_Bjlk_HBH_MT128x256x32_MI32x32x8x1_SN_1LDSB0_AF0EM8_AF1EM1_AMAS3_BL1_EPS1_GRVW8_GSU3_ISA908_KLA_LRVW4_MAC_NLCA1_NLCB1_PGR1_SIA3_SU32_SUS256_SRVW4_TT2_128_USFGROn1_VAW1_VSn1_VW2_WSGRA1_WSGRB1_WG64_4_1_WGM2
    SolutionIndex: 346
    SolutionNameMin: Cijk_Ailk_Bjlk_HBH_MT128x256x16_MI32x32x8x1_SE_1LDSB0_AF0EM8_AF1EM1_AMAS3_BL1_EPS0_GRVW4_GSU1_ISA908_KLA_LRVW4_MAC_NLCA1_NLCB1_PGR2_SIA3_SU32_SUS256_SRVW4_TT2_128_USFGROn1_VAW2_VSn1_VW2_WSGRA1_WSGRB1_WG64_4_1_WGM15
    SolutionIndex: 347
    SolutionNameMin: Cijk_Ailk_Bjlk_HBH_MT128x256x16_MI32x32x8x1_SE_1LDSB1_AF0EM8_AF1EM1_AMAS3_BL1_EPS0_GRVW8_GSU1_ISA908_KLA_LRVW4_MAC_NLCA1_NLCB1_PGR2_SIA3_SU32_SUS256_SRVW4_TT2_128_USFGROn1_VAW2_VSn1_VW2_WSGRA1_WSGRB1_WG64_4_1_WGM15
    SolutionIndex: 348
    SolutionNameMin: Cijk_Ailk_Bjlk_HBH_MT128x128x16_MI32x32x8x1_SN_1LDSB0_AF0EM8_AF1EM1_AMAS3_BL1_EPS0_GRVW8_GSU1_ISA908_KLA_LRVW4_MAC_NLCA1_NLCB1_PGR2_SIA3_SU32_SUS256_SRVW4_TT2_64_USFGROn1_VAW2_VSn1_VW2_WSGRA1_WSGRB1_WG64_4_1_WGM15
    SolutionIndex: 349
    SolutionNameMin: Cijk_Ailk_Bjlk_HBH_MT128x256x16_MI32x32x8x1_SE_1LDSB1_AF0EM8_AF1EM1_AMAS3_BL1_EPS0_GRVW8_GSU1_ISA908_KLA_LRVW4_MAC_NLCA1_NLCB1_PGR2_SIA3_SU32_SUS256_SRVW4_TT2_128_USFGROn1_VAW2_VSn1_VW2_WSGRA1_WSGRB1_WG64_4_1_WGM2
    SolutionIndex: 350
    SolutionNameMin: Cijk_Ailk_Bjlk_HBH_MT64x64x64_MI32x32x8x1_SE_1LDSB0_AF0EM8_AF1EM1_AMAS3_BL1_EPS1_GRVW8_GSU1_ISA908_KLA_LRVW4_MAC_NLCA1_NLCB1_PGR1_SIA3_SU0_SUS256_SRVW4_TT1_32_USFGROn1_VAW2_VSn1_VW2_WSGRA1_WSGRB1_WG64_4_1_WGM1
    SolutionIndex: 351
    SolutionNameMin: Cijk_Ailk_Bjlk_HBH_MT4x64x32_MI4x4x4x16_SE_1LDSB0_AF0EM1_AF1EM1_AMAS3_BL1_EPS1_GRVW2_GSU1_ISA908_KLA_LRVW4_MAC_NLCA1_NLCB1_PGR1_SIA3_SU0_SUS256_SRVW0_TT1_4_USFGROn1_VAW2_VSn1_VW2_WSGRA1_WSGRB1_WG4_16_1_WGM1
    SolutionIndex: 352
    SolutionNameMin: Cijk_Ailk_Bjlk_HBH_MT128x128x16_MI32x32x8x1_SE_1LDSB0_AF0EM8_AF1EM1_AMAS3_BL1_EPS0_GRVW8_GSU1_ISA908_KLA_LRVW4_MAC_NLCA1_NLCB1_PGR2_SIA3_SU0_SUS256_SRVW4_TT2_64_USFGROn1_VAW2_VSn1_VW2_WSGRA1_WSGRB1_WG64_4_1_WGM15
    SolutionIndex: 353
    SolutionNameMin: Cijk_Ailk_Bjlk_HBH_MT128x128x32_MI32x32x8x1_SE_1LDSB0_AF0EM1_AF1EM1_AMAS3_BL1_EPS1_GRVW8_GSU1_ISA908_KLA_LRVW4_MAC_NLCA1_NLCB1_PGR1_SIA3_SU0_SUS256_SRVW4_TT2_64_USFGROn1_VAW2_VSn1_VW2_WSGRA1_WSGRB1_WG64_4_1_WGM2
    SolutionIndex: 354
    SolutionNameMin: Cijk_Ailk_Bjlk_HBH_MT128x128x16_MI32x32x8x1_SE_1LDSB0_AF0EM8_AF1EM1_AMAS3_BL1_EPS0_GRVW2_GSU1_ISA908_KLA_LRVW4_MAC_NLCA1_NLCB1_PGR2_SIA3_SU32_SUS256_SRVW4_TT2_64_USFGROn1_VAW2_VSn1_VW2_WSGRA1_WSGRB1_WG64_4_1_WGM1
    SolutionIndex: 355
    SolutionNameMin: Cijk_Ailk_Bjlk_HBH_MT256x128x32_MI32x32x8x1_SE_1LDSB0_AF0EM8_AF1EM1_AMAS3_BL1_EPS1_GRVW8_GSU1_ISA908_KLA_LRVW4_MAC_NLCA1_NLCB1_PGR1_SIA3_SU0_SUS256_SRVW4_TT4_64_USFGROn1_VAW2_VSn1_VW2_WSGRA1_WSGRB1_WG64_4_1_WGM1
    SolutionIndex: 356
    SolutionNameMin: Cijk_Ailk_Bjlk_HBH_MT128x128x16_MI32x32x8x1_SE_1LDSB0_AF0EM8_AF1EM1_AMAS3_BL1_EPS0_GRVW8_GSU1_ISA908_KLA_LRVW4_MAC_NLCA1_NLCB1_PGR2_SIA3_SU0_SUS256_SRVW4_TT2_64_USFGROn1_VAW2_VSn1_VW2_WSGRA1_WSGRB1_WG64_4_1_WGM1
    SolutionIndex: 357
    SolutionNameMin: Cijk_Ailk_Bjlk_HBH_MT128x256x16_MI32x32x8x1_SE_1LDSB0_AF0EM1_AF1EM1_AMAS3_BL1_EPS0_GRVW8_GSU1_ISA908_KLA_LRVW4_MAC_NLCA1_NLCB1_PGR2_SIA3_SU0_SUS256_SRVW4_TT2_128_USFGROn1_VAW2_VSn1_VW2_WSGRA1_WSGRB1_WG64_4_1_WGM1
    SolutionIndex: 358
    SolutionNameMin: Cijk_Ailk_Bjlk_HBH_MT128x96x16_MI32x32x8x1_SE_1LDSB0_AF0EM8_AF1EM1_AMAS3_BL1_EPS0_GRVW2_GSU1_ISA908_KLA_LRVW4_MAC_NLCA1_NLCB3_PGR2_SIA3_SU32_SUS256_SRVW4_TT1_96_USFGROn1_VAW2_VSn1_VW2_WSGRA1_WSGRB1_WG128_2_1_WGM1
    SolutionIndex: 359
    SolutionNameMin: Cijk_Ailk_Bjlk_HBH_MT128x96x16_MI32x32x8x1_SE_1LDSB0_AF0EM8_AF1EM1_AMAS3_BL1_EPS0_GRVW2_GSU1_ISA908_KLA_LRVW4_MAC_NLCA1_NLCB3_PGR2_SIA3_SU0_SUS256_SRVW4_TT1_96_USFGROn1_VAW2_VSn1_VW2_WSGRA1_WSGRB1_WG128_2_1_WGM15
    SolutionIndex: 360
    SolutionNameMin: Cijk_Ailk_Bjlk_HBH_MT128x64x16_MI32x32x8x1_SE_1LDSB0_AF0EM8_AF1EM1_AMAS3_BL1_EPS0_GRVW4_GSU1_ISA908_KLA_LRVW4_MAC_NLCA1_NLCB1_PGR2_SIA3_SU0_SUS256_SRVW4_TT2_32_USFGROn1_VAW2_VSn1_VW2_WSGRA1_WSGRB1_WG64_4_1_WGM15
    SolutionIndex: 361
    SolutionNameMin: Cijk_Ailk_Bjlk_HBH_MT128x64x16_MI32x32x8x1_SE_1LDSB0_AF0EM8_AF1EM1_AMAS3_BL1_EPS0_GRVW8_GSU1_ISA908_KLA_LRVW4_MAC_NLCA1_NLCB1_PGR2_SIA3_SU32_SUS256_SRVW4_TT2_32_USFGROn1_VAW2_VSn1_VW2_WSGRA1_WSGRB1_WG64_4_1_WGM1
    SolutionIndex: 362
    SolutionNameMin: Cijk_Ailk_Bjlk_HBH_MT128x64x32_MI32x32x8x1_SE_1LDSB0_AF0EM8_AF1EM1_AMAS3_BL1_EPS1_GRVW8_GSU1_ISA908_KLA_LRVW4_MAC_NLCA1_NLCB1_PGR1_SIA3_SU0_SUS256_SRVW4_TT2_32_USFGROn1_VAW2_VSn1_VW2_WSGRA1_WSGRB1_WG64_4_1_WGM15
    SolutionIndex: 363
    SolutionNameMin: Cijk_Ailk_Bjlk_HBH_MT128x160x32_MI32x32x8x1_SE_1LDSB0_AF0EM8_AF1EM1_AMAS3_BL1_EPS0_GRVW4_GSU1_ISA908_KLA_LRVW4_MAC_NLCA1_NLCB5_PGR2_SIA3_SU0_SUS256_SRVW4_TT1_160_USFGROn1_VAW2_VSn1_VW2_WSGRA1_WSGRB1_WG128_2_1_WGM2
    SolutionIndex: 364
    SolutionNameMin: Cijk_Ailk_Bjlk_HBH_MT64x128x16_MI32x32x8x1_SE_1LDSB0_AF0EM8_AF1EM1_AMAS3_BL1_EPS1_GRVW2_GSU1_ISA908_KLA_LRVW4_MAC_NLCA1_NLCB1_PGR1_SIA3_SU0_SUS256_SRVW4_TT1_64_USFGROn1_VAW2_VSn1_VW2_WSGRA1_WSGRB1_WG64_4_1_WGM2
    SolutionIndex: 365
    SolutionNameMin: Cijk_Ailk_Bjlk_HBH_MT128x160x16_MI32x32x8x1_SE_1LDSB0_AF0EM8_AF1EM1_AMAS3_BL1_EPS0_GRVW2_GSU1_ISA908_KLA_LRVW4_MAC_NLCA1_NLCB5_PGR2_SIA3_SU32_SUS128_SRVW4_TT1_160_USFGROn1_VAW2_VSn1_VW2_WSGRA1_WSGRB1_WG128_2_1_WGM15
    SolutionIndex: 366
    SolutionNameMin: Cijk_Ailk_Bjlk_HBH_MT128x128x32_MI32x32x8x1_SE_1LDSB0_AF0EM8_AF1EM1_AMAS3_BL1_EPS0_GRVW8_GSU3_ISA908_KLA_LRVW4_MAC_NLCA1_NLCB1_PGR2_SIA3_SU0_SUS256_SRVW4_TT2_64_USFGROn1_VAW1_VSn1_VW2_WSGRA1_WSGRB1_WG64_4_1_WGM15
    SolutionIndex: 367
    SolutionNameMin: Cijk_Ailk_Bjlk_HBH_MT64x128x16_MI32x32x8x1_SE_1LDSB0_AF0EM8_AF1EM1_AMAS3_BL1_EPS0_GRVW2_GSU1_ISA908_KLA_LRVW4_MAC_NLCA1_NLCB1_PGR2_SIA3_SU32_SUS128_SRVW4_TT1_64_USFGROn1_VAW2_VSn1_VW2_WSGRA1_WSGRB1_WG64_4_1_WGM15
    SolutionIndex: 368
    SolutionNameMin: Cijk_Ailk_Bjlk_HBH_MT128x64x16_MI32x32x8x1_SE_1LDSB0_AF0EM8_AF1EM1_AMAS3_BL1_EPS1_GRVW8_GSU1_ISA908_KLA_LRVW4_MAC_NLCA1_NLCB1_PGR1_SIA3_SU0_SUS256_SRVW4_TT2_32_USFGROn1_VAW2_VSn1_VW2_WSGRA1_WSGRB1_WG64_4_1_WGM1
    SolutionIndex: 369
    SolutionNameMin: Cijk_Ailk_Bjlk_HBH_MT64x64x32_MI32x32x8x1_SE_1LDSB0_AF0EM1_AF1EM1_AMAS3_BL1_EPS0_GRVW4_GSU1_ISA908_KLA_LRVW4_MAC_NLCA1_NLCB1_PGR2_SIA3_SU0_SUS256_SRVW4_TT1_32_USFGROn1_VAW2_VSn1_VW2_WSGRA1_WSGRB1_WG64_4_1_WGM1
    SolutionIndex: 370
    SolutionNameMin: Cijk_Ailk_Bjlk_HBH_MT128x128x16_MI32x32x8x1_SE_1LDSB0_AF0EM1_AF1EM1_AMAS3_BL1_EPS0_GRVW8_GSU1_ISA908_KLA_LRVW4_MAC_NLCA1_NLCB1_PGR2_SIA3_SU0_SUS256_SRVW4_TT2_64_USFGROn1_VAW2_VSn1_VW2_WSGRA1_WSGRB1_WG64_4_1_WGM15
    SolutionIndex: 371
    SolutionNameMin: Cijk_Ailk_Bjlk_HBH_MT128x128x32_MI32x32x8x1_SE_1LDSB0_AF0EM1_AF1EM1_AMAS3_BL1_EPS0_GRVW4_GSU1_ISA908_KLA_LRVW4_MAC_NLCA1_NLCB1_PGR2_SIA3_SU0_SUS256_SRVW4_TT2_64_USFGROn1_VAW2_VSn1_VW2_WSGRA1_WSGRB1_WG64_4_1_WGM15
    SolutionIndex: 372
    SolutionNameMin: Cijk_Ailk_Bjlk_HBH_MT128x256x16_MI32x32x8x1_SE_1LDSB1_AF0EM8_AF1EM1_AMAS3_BL1_EPS0_GRVW8_GSU1_ISA908_KLA_LRVW4_MAC_NLCA1_NLCB1_PGR2_SIA3_SU0_SUS256_SRVW4_TT2_128_USFGROn1_VAW2_VSn1_VW2_WSGRA1_WSGRB1_WG64_4_1_WGM2
    SolutionIndex: 373
    SolutionNameMin: Cijk_Ailk_Bjlk_HBH_MT128x128x32_MI32x32x8x1_SE_1LDSB0_AF0EM8_AF1EM1_AMAS3_BL1_EPS0_GRVW8_GSU1_ISA908_KLA_LRVW4_MAC_NLCA1_NLCB1_PGR2_SIA3_SU32_SUS128_SRVW4_TT2_64_USFGROn1_VAW2_VSn1_VW2_WSGRA1_WSGRB1_WG64_4_1_WGM1
    SolutionIndex: 374
    SolutionNameMin: Cijk_Ailk_Bjlk_HBH_MT128x128x16_MI32x32x8x1_SE_1LDSB0_AF0EM8_AF1EM1_AMAS3_BL1_EPS0_GRVW4_GSU1_ISA908_KLA_LRVW4_MAC_NLCA1_NLCB1_PGR2_SIA3_SU0_SUS256_SRVW4_TT2_64_USFGROn1_VAW2_VSn1_VW2_WSGRA1_WSGRB1_WG64_4_1_WGM1
    SolutionIndex: 375
    SolutionNameMin: Cijk_Ailk_Bjlk_HBH_MT128x128x32_MI32x32x8x1_SE_1LDSB0_AF0EM1_AF1EM1_AMAS3_BL1_EPS0_GRVW2_GSU1_ISA908_KLA_LRVW4_MAC_NLCA1_NLCB1_PGR2_SIA3_SU32_SUS128_SRVW4_TT2_64_USFGROn1_VAW2_VSn1_VW2_WSGRA1_WSGRB1_WG64_4_1_WGM15
    SolutionIndex: 376
    SolutionNameMin: Cijk_Ailk_Bjlk_HBH_MT64x192x16_MI32x32x8x1_SE_1LDSB0_AF0EM8_AF1EM1_AMAS3_BL1_EPS0_GRVW4_GSU1_ISA908_KLA_LRVW4_MAC_NLCA1_NLCB3_PGR2_SIA3_SU0_SUS256_SRVW4_TT1_96_USFGROn1_VAW2_VSn1_VW2_WSGRA1_WSGRB1_WG64_4_1_WGM15
    SolutionIndex: 377
    SolutionNameMin: Cijk_Ailk_Bjlk_HBH_MT128x128x32_MI32x32x8x1_SE_1LDSB0_AF0EM8_AF1EM1_AMAS3_BL1_EPS0_GRVW4_GSU1_ISA908_KLA_LRVW4_MAC_NLCA1_NLCB1_PGR2_SIA3_SU32_SUS256_SRVW4_TT2_64_USFGROn1_VAW2_VSn1_VW2_WSGRA1_WSGRB1_WG64_4_1_WGM15
    SolutionIndex: 378
    SolutionNameMin: Cijk_Ailk_Bjlk_HBH_MT64x128x64_MI32x32x8x1_SE_1LDSB0_AF0EM8_AF1EM1_AMAS3_BL1_EPS0_GRVW8_GSU1_ISA908_KLA_LRVW4_MAC_NLCA1_NLCB1_PGR2_SIA3_SU0_SUS256_SRVW4_TT1_64_USFGROn1_VAW2_VSn1_VW2_WSGRA1_WSGRB1_WG64_4_1_WGM15
    SolutionIndex: 379
    SolutionNameMin: Cijk_Ailk_Bjlk_HBH_MT128x128x32_MI32x32x8x1_SN_1LDSB0_AF0EM8_AF1EM1_AMAS3_BL1_EPS0_GRVW8_GSU1_ISA908_KLA_LRVW4_MAC_NLCA1_NLCB1_PGR2_SIA3_SU0_SUS256_SRVW4_TT2_64_USFGROn1_VAW2_VSn1_VW2_WSGRA1_WSGRB1_WG64_4_1_WGM15
    SolutionIndex: 380
    SolutionNameMin: Cijk_Ailk_Bjlk_HBH_MT128x128x32_MI32x32x8x1_SE_1LDSB0_AF0EM1_AF1EM1_AMAS3_BL1_EPS0_GRVW8_GSU1_ISA908_KLA_LRVW4_MAC_NLCA1_NLCB1_PGR2_SIA3_SU32_SUS128_SRVW4_TT2_64_USFGROn1_VAW2_VSn1_VW2_WSGRA1_WSGRB1_WG64_4_1_WGM15
    SolutionIndex: 381
    SolutionNameMin: Cijk_Ailk_Bjlk_HBH_MT128x128x16_MI32x32x8x1_SE_1LDSB0_AF0EM8_AF1EM1_AMAS3_BL1_EPS0_GRVW8_GSU1_ISA908_KLA_LRVW4_MAC_NLCA1_NLCB1_PGR2_SIA3_SU32_SUS256_SRVW4_TT2_64_USFGROn1_VAW2_VSn1_VW2_WSGRA1_WSGRB1_WG64_4_1_WGM1
    SolutionIndex: 382
    SolutionNameMin: Cijk_Ailk_Bjlk_HBH_MT128x128x32_MI32x32x8x1_SE_1LDSB0_AF0EM8_AF1EM1_AMAS3_BL1_EPS0_GRVW8_GSU1_ISA908_KLA_LRVW4_MAC_NLCA1_NLCB1_PGR2_SIA3_SU32_SUS256_SRVW4_TT2_64_USFGROn1_VAW2_VSn1_VW2_WSGRA1_WSGRB1_WG64_4_1_WGM1
    SolutionIndex: 383
    SolutionNameMin: Cijk_Ailk_Bjlk_HBH_MT64x128x64_MI32x32x8x1_SE_1LDSB0_AF0EM8_AF1EM1_AMAS3_BL1_EPS0_GRVW8_GSU1_ISA908_KLA_LRVW4_MAC_NLCA1_NLCB1_PGR2_SIA3_SU32_SUS256_SRVW4_TT1_64_USFGROn1_VAW2_VSn1_VW2_WSGRA1_WSGRB1_WG64_4_1_WGM15
    SolutionIndex: 384
    SolutionNameMin: Cijk_Ailk_Bjlk_HBH_MT256x128x32_MI32x32x8x1_SE_1LDSB0_AF0EM8_AF1EM1_AMAS3_BL1_EPS1_GRVW8_GSU1_ISA908_KLA_LRVW4_MAC_NLCA1_NLCB1_PGR1_SIA3_SU32_SUS128_SRVW4_TT4_64_USFGROn1_VAW2_VSn1_VW2_WSGRA1_WSGRB1_WG64_4_1_WGM15
    SolutionIndex: 385
    SolutionNameMin: Cijk_Ailk_Bjlk_HBH_MT128x128x32_MI32x32x8x1_SE_1LDSB0_AF0EM8_AF1EM1_AMAS3_BL1_EPS0_GRVW8_GSU1_ISA908_KLA_LRVW4_MAC_NLCA1_NLCB1_PGR2_SIA3_SU32_SUS256_SRVW4_TT2_64_USFGROn1_VAW2_VSn1_VW2_WSGRA1_WSGRB1_WG64_4_1_WGM15
    SolutionIndex: 386
    SolutionNameMin: Cijk_Ailk_Bjlk_HBH_MT160x128x32_MI32x32x8x1_SE_1LDSB0_AF0EM8_AF1EM1_AMAS3_BL1_EPS0_GRVW4_GSU1_ISA908_KLA_LRVW4_MAC_NLCA5_NLCB1_PGR2_SIA3_SU0_SUS256_SRVW0_TT5_32_USFGROn1_VAW2_VSn1_VW2_WSGRA1_WSGRB1_WG32_8_1_WGM1
    SolutionIndex: 387
    SolutionNameMin: Cijk_Ailk_Bjlk_HBH_MT128x128x32_MI32x32x8x1_SE_1LDSB0_AF0EM8_AF1EM1_AMAS3_BL1_EPS0_GRVW8_GSU1_ISA908_KLA_LRVW4_MAC_NLCA1_NLCB1_PGR2_SIA3_SU0_SUS256_SRVW4_TT2_64_USFGROn1_VAW2_VSn1_VW2_WSGRA1_WSGRB1_WG64_4_1_WGM15
    SolutionIndex: 388
    SolutionNameMin: Cijk_Ailk_Bjlk_HBH_MT128x64x32_MI32x32x8x1_SE_1LDSB0_AF0EM8_AF1EM1_AMAS3_BL1_EPS0_GRVW8_GSU1_ISA908_KLA_LRVW4_MAC_NLCA1_NLCB1_PGR2_SIA3_SU0_SUS256_SRVW4_TT2_32_USFGROn1_VAW2_VSn1_VW2_WSGRA1_WSGRB1_WG64_4_1_WGM2
    SolutionIndex: 389
    SolutionNameMin: Cijk_Ailk_Bjlk_HBH_MT64x128x16_MI32x32x8x1_SE_1LDSB0_AF0EM8_AF1EM1_AMAS3_BL1_EPS1_GRVW2_GSU1_ISA908_KLA_LRVW4_MAC_NLCA1_NLCB1_PGR1_SIA3_SU0_SUS256_SRVW4_TT1_64_USFGROn1_VAW2_VSn1_VW2_WSGRA1_WSGRB1_WG64_4_1_WGM1
    SolutionIndex: 390
    SolutionNameMin: Cijk_Ailk_Bjlk_HBH_MT64x32x16_MI16x16x16x1_SE_1LDSB0_AF0EM8_AF1EM1_AMAS3_BL1_EPS1_GRVW2_GSU1_ISA908_KLA_LRVW4_MAC_NLCA1_NLCB1_PGR1_SIA3_SU32_SUS128_SRVW4_TT2_16_USFGROn1_VAW2_VSn1_VW2_WSGRA1_WSGRB1_WG32_8_1_WGM1
    SolutionIndex: 391
    SolutionNameMin: Cijk_Ailk_Bjlk_HBH_MT32x32x16_MI16x16x16x1_SE_1LDSB0_AF0EM8_AF1EM1_AMAS3_BL1_EPS0_GRVW2_GSU1_ISA908_KLA_LRVW4_MAC_NLCA1_NLCB1_PGR2_SIA3_SU32_SUS128_SRVW4_TT1_16_USFGROn1_VAW2_VSn1_VW2_WSGRA1_WSGRB1_WG32_8_1_WGM1
    SolutionIndex: 392
    SolutionNameMin: Cijk_Ailk_Bjlk_HBH_MT32x32x16_MI16x16x16x1_SE_1LDSB0_AF0EM1_AF1EM1_AMAS3_BL1_EPS1_GRVW8_GSU1_ISA908_KLA_LRVW4_MAC_NLCA1_NLCB1_PGR1_SIA3_SU0_SUS256_SRVW4_TT1_16_USFGROn1_VAW2_VSn1_VW2_WSGRA1_WSGRB1_WG32_8_1_WGM1
    SolutionIndex: 393
    SolutionNameMin: Cijk_Ailk_Bjlk_HBH_MT128x128x16_MI32x32x8x1_SN_1LDSB0_AF0EM8_AF1EM1_AMAS3_BL1_EPS0_GRVW8_GSU1_ISA908_KLA_LRVW4_MAC_NLCA1_NLCB1_PGR2_SIA3_SU32_SUS128_SRVW4_TT2_64_USFGROn1_VAW2_VSn1_VW2_WSGRA1_WSGRB1_WG64_4_1_WGM1
    SolutionIndex: 394
    SolutionNameMin: Cijk_Ailk_Bjlk_HBH_MT64x32x16_MI16x16x16x1_SE_1LDSB0_AF0EM8_AF1EM1_AMAS3_BL1_EPS0_GRVW2_GSU1_ISA908_KLA_LRVW4_MAC_NLCA1_NLCB1_PGR2_SIA3_SU32_SUS128_SRVW4_TT2_16_USFGROn1_VAW2_VSn1_VW2_WSGRA1_WSGRB1_WG32_8_1_WGM1
    SolutionIndex: 395
    SolutionNameMin: Cijk_Ailk_Bjlk_HBH_MT192x64x32_MI32x32x8x1_SE_1LDSB0_AF0EM8_AF1EM1_AMAS3_BL1_EPS0_GRVW8_GSU1_ISA908_KLA_LRVW4_MAC_NLCA3_NLCB1_PGR2_SIA3_SU0_SUS256_SRVW0_TT3_32_USFGROn1_VAW2_VSn1_VW2_WSGRA1_WSGRB1_WG64_4_1_WGM15
    SolutionIndex: 396
    SolutionNameMin: Cijk_Ailk_Bjlk_HBH_MT128x64x16_MI32x32x8x1_SE_1LDSB0_AF0EM8_AF1EM1_AMAS3_BL1_EPS0_GRVW2_GSU1_ISA908_KLA_LRVW4_MAC_NLCA1_NLCB1_PGR2_SIA3_SU0_SUS256_SRVW4_TT2_32_USFGROn1_VAW2_VSn1_VW2_WSGRA1_WSGRB1_WG64_4_1_WGM2
    SolutionIndex: 397
    SolutionNameMin: Cijk_Ailk_Bjlk_HBH_MT128x96x32_MI32x32x8x1_SE_1LDSB0_AF0EM8_AF1EM1_AMAS3_BL1_EPS0_GRVW2_GSU1_ISA908_KLA_LRVW4_MAC_NLCA1_NLCB3_PGR2_SIA3_SU0_SUS256_SRVW4_TT1_96_USFGROn1_VAW2_VSn1_VW2_WSGRA1_WSGRB1_WG128_2_1_WGM15
    SolutionIndex: 398
    SolutionNameMin: Cijk_Ailk_Bjlk_HBH_MT128x128x32_MI32x32x8x1_SE_1LDSB0_AF0EM8_AF1EM1_AMAS3_BL1_EPS0_GRVW8_GSU1_ISA908_KLA_LRVW4_MAC_NLCA1_NLCB1_PGR2_SIA3_SU0_SUS256_SRVW4_TT2_64_USFGROn1_VAW2_VSn1_VW2_WSGRA1_WSGRB1_WG64_4_1_WGM1
    SolutionIndex: 399
    SolutionNameMin: Cijk_Ailk_Bjlk_HBH_MT128x128x16_MI32x32x8x1_SE_1LDSB0_AF0EM8_AF1EM1_AMAS3_BL1_EPS0_GRVW8_GSU1_ISA908_KLA_LRVW4_MAC_NLCA1_NLCB1_PGR2_SIA3_SU32_SUS128_SRVW4_TT2_64_USFGROn1_VAW2_VSn1_VW2_WSGRA1_WSGRB1_WG64_4_1_WGM1
    SolutionIndex: 400
    SolutionNameMin: Cijk_Ailk_Bjlk_HBH_MT128x128x32_MI32x32x8x1_SE_1LDSB0_AF0EM1_AF1EM1_AMAS3_BL1_EPS0_GRVW4_GSU1_ISA908_KLA_LRVW4_MAC_NLCA1_NLCB1_PGR2_SIA3_SU32_SUS256_SRVW4_TT2_64_USFGROn1_VAW2_VSn1_VW2_WSGRA1_WSGRB1_WG64_4_1_WGM15
    SolutionIndex: 401
    SolutionNameMin: Cijk_Ailk_Bjlk_HBH_MT128x128x32_MI32x32x8x1_SE_1LDSB0_AF0EM8_AF1EM1_AMAS3_BL1_EPS0_GRVW4_GSU1_ISA908_KLA_LRVW4_MAC_NLCA1_NLCB1_PGR2_SIA3_SU0_SUS256_SRVW4_TT2_64_USFGROn1_VAW2_VSn1_VW2_WSGRA1_WSGRB1_WG64_4_1_WGM2
    SolutionIndex: 402
    SolutionNameMin: Cijk_Ailk_Bjlk_HBH_MT128x128x32_MI32x32x8x1_SE_1LDSB0_AF0EM8_AF1EM1_AMAS3_BL1_EPS0_GRVW8_GSU1_ISA908_KLA_LRVW4_MAC_NLCA1_NLCB1_PGR2_SIA3_SU32_SUS256_SRVW4_TT2_64_USFGROn1_VAW2_VSn1_VW2_WSGRA1_WSGRB1_WG64_4_1_WGM2
    SolutionIndex: 403
    SolutionNameMin: Cijk_Ailk_Bjlk_HBH_MT64x32x16_MI16x16x16x1_SE_1LDSB0_AF0EM8_AF1EM1_AMAS3_BL1_EPS1_GRVW2_GSU1_ISA908_KLA_LRVW4_MAC_NLCA1_NLCB1_PGR1_SIA3_SU32_SUS128_SRVW4_TT2_16_USFGROn1_VAW2_VSn1_VW2_WSGRA1_WSGRB1_WG32_8_1_WGM2
    SolutionIndex: 404
    SolutionNameMin: Cijk_Ailk_Bjlk_HBH_MT128x128x16_MI32x32x8x1_SE_1LDSB0_AF0EM8_AF1EM1_AMAS3_BL1_EPS0_GRVW2_GSU1_ISA908_KLA_LRVW4_MAC_NLCA1_NLCB1_PGR2_SIA3_SU0_SUS256_SRVW4_TT2_64_USFGROn1_VAW2_VSn1_VW2_WSGRA1_WSGRB1_WG64_4_1_WGM1
    SolutionIndex: 405
    SolutionNameMin: Cijk_Ailk_Bjlk_HBH_MT128x128x32_MI32x32x8x1_SE_1LDSB0_AF0EM8_AF1EM1_AMAS3_BL1_EPS0_GRVW4_GSU1_ISA908_KLA_LRVW4_MAC_NLCA1_NLCB1_PGR2_SIA3_SU0_SUS256_SRVW4_TT2_64_USFGROn1_VAW2_VSn1_VW2_WSGRA1_WSGRB1_WG64_4_1_WGM1
    SolutionIndex: 406
    SolutionNameMin: Cijk_Ailk_Bjlk_HBH_MT128x256x16_MI32x32x8x1_SE_1LDSB0_AF0EM8_AF1EM1_AMAS3_BL1_EPS1_GRVW4_GSU1_ISA908_KLA_LRVW4_MAC_NLCA1_NLCB1_PGR1_SIA3_SU0_SUS256_SRVW4_TT2_128_USFGROn1_VAW2_VSn1_VW2_WSGRA1_WSGRB1_WG64_4_1_WGM2
    SolutionIndex: 407
    SolutionNameMin: Cijk_Ailk_Bjlk_HBH_MT128x128x16_MI32x32x8x1_SE_1LDSB0_AF0EM1_AF1EM1_AMAS3_BL1_EPS0_GRVW2_GSU1_ISA908_KLA_LRVW4_MAC_NLCA1_NLCB1_PGR2_SIA3_SU0_SUS256_SRVW4_TT2_64_USFGROn1_VAW2_VSn1_VW2_WSGRA1_WSGRB1_WG64_4_1_WGM1
    SolutionIndex: 408
    SolutionNameMin: Cijk_Ailk_Bjlk_HBH_MT128x96x16_MI32x32x8x1_SE_1LDSB0_AF0EM8_AF1EM1_AMAS3_BL1_EPS0_GRVW2_GSU1_ISA908_KLA_LRVW4_MAC_NLCA1_NLCB3_PGR2_SIA3_SU32_SUS256_SRVW4_TT1_96_USFGROn1_VAW2_VSn1_VW2_WSGRA1_WSGRB1_WG128_2_1_WGM2
    SolutionIndex: 409
    SolutionNameMin: Cijk_Ailk_Bjlk_HBH_MT128x256x16_MI32x32x8x1_SE_1LDSB1_AF0EM8_AF1EM1_AMAS3_BL1_EPS0_GRVW8_GSU1_ISA908_KLA_LRVW4_MAC_NLCA1_NLCB1_PGR2_SIA3_SU32_SUS256_SRVW4_TT2_128_USFGROn1_VAW2_VSn1_VW2_WSGRA1_WSGRB1_WG64_4_1_WGM1
    SolutionIndex: 410
    SolutionNameMin: Cijk_Ailk_Bjlk_HBH_MT128x128x64_MI32x32x8x1_SE_1LDSB0_AF0EM8_AF1EM1_AMAS3_BL1_EPS0_GRVW4_GSU1_ISA908_KLA_LRVW4_MAC_NLCA1_NLCB1_PGR2_SIA3_SU32_SUS256_SRVW4_TT2_64_USFGROn1_VAW2_VSn1_VW2_WSGRA1_WSGRB1_WG64_4_1_WGM15
    SolutionIndex: 411
    SolutionNameMin: Cijk_Ailk_Bjlk_HBH_MT128x128x16_MI32x32x8x1_SE_1LDSB0_AF0EM8_AF1EM1_AMAS3_BL1_EPS0_GRVW2_GSU1_ISA908_KLA_LRVW4_MAC_NLCA1_NLCB1_PGR2_SIA3_SU32_SUS128_SRVW4_TT2_64_USFGROn1_VAW2_VSn1_VW2_WSGRA1_WSGRB1_WG64_4_1_WGM1
    SolutionIndex: 412
    SolutionNameMin: Cijk_Ailk_Bjlk_HBH_MT128x128x16_MI32x32x8x1_SE_1LDSB0_AF0EM1_AF1EM1_AMAS3_BL1_EPS0_GRVW8_GSU1_ISA908_KLA_LRVW4_MAC_NLCA1_NLCB1_PGR2_SIA3_SU0_SUS256_SRVW4_TT2_64_USFGROn1_VAW2_VSn1_VW2_WSGRA1_WSGRB1_WG64_4_1_WGM1
    SolutionIndex: 413
    SolutionNameMin: Cijk_Ailk_Bjlk_HBH_MT128x128x32_MI32x32x8x1_SE_1LDSB0_AF0EM1_AF1EM1_AMAS3_BL1_EPS0_GRVW4_GSU1_ISA908_KLA_LRVW4_MAC_NLCA1_NLCB1_PGR2_SIA3_SU0_SUS256_SRVW4_TT2_64_USFGROn1_VAW2_VSn1_VW2_WSGRA1_WSGRB1_WG64_4_1_WGM2
    SolutionIndex: 414
    SolutionNameMin: Cijk_Ailk_Bjlk_HBH_MT64x128x64_MI32x32x8x1_SE_1LDSB0_AF0EM1_AF1EM1_AMAS3_BL1_EPS0_GRVW4_GSU1_ISA908_KLA_LRVW4_MAC_NLCA1_NLCB1_PGR2_SIA3_SU0_SUS256_SRVW4_TT1_64_USFGROn1_VAW2_VSn1_VW2_WSGRA1_WSGRB1_WG64_4_1_WGM15
    SolutionIndex: 415
    SolutionNameMin: Cijk_Ailk_Bjlk_HBH_MT128x128x16_MI32x32x8x1_SE_1LDSB0_AF0EM1_AF1EM1_AMAS3_BL1_EPS0_GRVW4_GSU1_ISA908_KLA_LRVW4_MAC_NLCA1_NLCB1_PGR2_SIA3_SU0_SUS256_SRVW4_TT2_64_USFGROn1_VAW2_VSn1_VW2_WSGRA1_WSGRB1_WG64_4_1_WGM15
    SolutionIndex: 416
    SolutionNameMin: Cijk_Ailk_Bjlk_HBH_MT128x128x32_MI32x32x8x1_SE_1LDSB0_AF0EM1_AF1EM1_AMAS3_BL1_EPS0_GRVW8_GSU1_ISA908_KLA_LRVW4_MAC_NLCA1_NLCB1_PGR2_SIA3_SU32_SUS256_SRVW4_TT2_64_USFGROn1_VAW2_VSn1_VW2_WSGRA1_WSGRB1_WG64_4_1_WGM2
    SolutionIndex: 417
    SolutionNameMin: Cijk_Ailk_Bjlk_HBH_MT128x64x64_MI32x32x8x1_SE_1LDSB0_AF0EM1_AF1EM1_AMAS3_BL1_EPS0_GRVW8_GSU1_ISA908_KLA_LRVW4_MAC_NLCA1_NLCB1_PGR2_SIA3_SU32_SUS256_SRVW4_TT2_32_USFGROn1_VAW2_VSn1_VW2_WSGRA1_WSGRB1_WG64_4_1_WGM15
    SolutionIndex: 418
    SolutionNameMin: Cijk_Ailk_Bjlk_HBH_MT128x64x64_MI32x32x8x1_SE_1LDSB0_AF0EM1_AF1EM1_AMAS3_BL1_EPS0_GRVW2_GSU1_ISA908_KLA_LRVW4_MAC_NLCA1_NLCB1_PGR2_SIA3_SU0_SUS256_SRVW4_TT2_32_USFGROn1_VAW2_VSn1_VW2_WSGRA1_WSGRB1_WG64_4_1_WGM15
    SolutionIndex: 419
    SolutionNameMin: Cijk_Ailk_Bjlk_HBH_MT32x32x16_MI16x16x16x1_SE_1LDSB0_AF0EM1_AF1EM1_AMAS3_BL1_EPS0_GRVW2_GSU1_ISA908_KLA_LRVW4_MAC_NLCA1_NLCB1_PGR2_SIA3_SU0_SUS256_SRVW4_TT1_16_USFGROn1_VAW2_VSn1_VW2_WSGRA1_WSGRB1_WG32_8_1_WGM1
    SolutionIndex: 420
    SolutionNameMin: Cijk_Ailk_Bjlk_HBH_MT16x64x32_MI16x16x16x1_SE_1LDSB0_AF0EM1_AF1EM1_AMAS3_BL1_EPS1_GRVW8_GSU1_ISA908_KLA_LRVW4_MAC_NLCA1_NLCB1_PGR1_SIA3_SU0_SUS256_SRVW0_TT1_16_USFGROn1_VAW2_VSn1_VW2_WSGRA1_WSGRB1_WG16_16_1_WGM1
    SolutionIndex: 421
    SolutionNameMin: Cijk_Ailk_Bjlk_HBH_MT128x128x32_MI32x32x8x1_SE_1LDSB0_AF0EM1_AF1EM1_AMAS3_BL1_EPS0_GRVW2_GSU1_ISA908_KLA_LRVW4_MAC_NLCA1_NLCB1_PGR2_SIA3_SU0_SUS256_SRVW4_TT2_64_USFGROn1_VAW2_VSn1_VW2_WSGRA1_WSGRB1_WG64_4_1_WGM1
    SolutionIndex: 422
    SolutionNameMin: Cijk_Ailk_Bjlk_HBH_MT32x32x16_MI16x16x16x1_SE_1LDSB0_AF0EM1_AF1EM1_AMAS3_BL1_EPS0_GRVW4_GSU1_ISA908_KLA_LRVW4_MAC_NLCA1_NLCB1_PGR2_SIA3_SU0_SUS256_SRVW4_TT1_16_USFGROn1_VAW2_VSn1_VW2_WSGRA1_WSGRB1_WG32_8_1_WGM2
    SolutionIndex: 423
    SolutionNameMin: Cijk_Ailk_Bjlk_HBH_MT64x128x32_MI32x32x8x1_SE_1LDSB0_AF0EM1_AF1EM1_AMAS3_BL1_EPS0_GRVW2_GSU1_ISA908_KLA_LRVW4_MAC_NLCA1_NLCB1_PGR2_SIA3_SU0_SUS256_SRVW4_TT1_64_USFGROn1_VAW2_VSn1_VW2_WSGRA1_WSGRB1_WG64_4_1_WGM1
    SolutionIndex: 424
    SolutionNameMin: Cijk_Ailk_Bjlk_HBH_MT96x128x64_MI32x32x8x1_SE_1LDSB0_AF0EM1_AF1EM1_AMAS3_BL1_EPS0_GRVW8_GSU1_ISA908_KLA_LRVW4_MAC_NLCA3_NLCB1_PGR2_SIA3_SU32_SUS256_SRVW0_TT3_32_USFGROn1_VAW2_VSn1_VW2_WSGRA1_WSGRB1_WG32_8_1_WGM15
    SolutionIndex: 425
    SolutionNameMin: Cijk_Ailk_Bjlk_HBH_MT128x128x16_MI32x32x8x1_SE_1LDSB0_AF0EM1_AF1EM1_AMAS3_BL1_EPS0_GRVW8_GSU1_ISA908_KLA_LRVW4_MAC_NLCA1_NLCB1_PGR2_SIA3_SU32_SUS256_SRVW4_TT2_64_USFGROn1_VAW2_VSn1_VW2_WSGRA1_WSGRB1_WG64_4_1_WGM1
    SolutionIndex: 426
    SolutionNameMin: Cijk_Ailk_Bjlk_HBH_MT128x128x32_MI32x32x8x1_SE_1LDSB0_AF0EM1_AF1EM1_AMAS3_BL1_EPS0_GRVW4_GSU1_ISA908_KLA_LRVW4_MAC_NLCA1_NLCB1_PGR2_SIA3_SU0_SUS256_SRVW4_TT2_64_USFGROn1_VAW2_VSn1_VW2_WSGRA1_WSGRB1_WG64_4_1_WGM1
    SolutionIndex: 427
    SolutionNameMin: Cijk_Ailk_Bjlk_HBH_MT128x128x32_MI32x32x8x1_SE_1LDSB0_AF0EM1_AF1EM1_AMAS3_BL1_EPS0_GRVW4_GSU1_ISA908_KLA_LRVW4_MAC_NLCA1_NLCB1_PGR2_SIA3_SU32_SUS128_SRVW4_TT2_64_USFGROn1_VAW2_VSn1_VW2_WSGRA1_WSGRB1_WG64_4_1_WGM1
    SolutionIndex: 428
    SolutionNameMin: Cijk_Ailk_Bjlk_HBH_MT128x128x32_MI32x32x8x1_SE_1LDSB0_AF0EM1_AF1EM1_AMAS3_BL1_EPS1_GRVW8_GSU1_ISA908_KLA_LRVW4_MAC_NLCA1_NLCB1_PGR1_SIA3_SU32_SUS128_SRVW4_TT2_64_USFGROn1_VAW2_VSn1_VW2_WSGRA1_WSGRB1_WG64_4_1_WGM1
    SolutionIndex: 429
    SolutionNameMin: Cijk_Ailk_Bjlk_HBH_MT128x128x64_MI32x32x8x1_SE_1LDSB0_AF0EM1_AF1EM1_AMAS3_BL1_EPS0_GRVW8_GSU1_ISA908_KLA_LRVW4_MAC_NLCA1_NLCB1_PGR2_SIA3_SU32_SUS256_SRVW4_TT2_64_USFGROn1_VAW2_VSn1_VW2_WSGRA1_WSGRB1_WG64_4_1_WGM15
    SolutionIndex: 430
    SolutionNameMin: Cijk_Ailk_Bjlk_HBH_MT128x128x16_MI32x32x8x1_SE_1LDSB0_AF0EM1_AF1EM1_AMAS3_BL1_EPS0_GRVW4_GSU1_ISA908_KLA_LRVW4_MAC_NLCA1_NLCB1_PGR2_SIA3_SU0_SUS256_SRVW4_TT2_64_USFGROn1_VAW2_VSn1_VW2_WSGRA1_WSGRB1_WG64_4_1_WGM2
    SolutionIndex: 431
    SolutionNameMin: Cijk_Ailk_Bjlk_HBH_MT192x192x32_MI32x32x8x1_SE_1LDSB0_AF0EM8_AF1EM1_AMAS3_BL1_EPS1_GRVW8_GSU1_ISA908_KLA_LRVW4_MAC_NLCA3_NLCB3_PGR1_SIA3_SU0_SUS256_SRVW0_TT3_96_USFGROn1_VAW2_VSn1_VW2_WSGRA1_WSGRB1_WG64_4_1_WGM1
    SolutionIndex: 432
    SolutionNameMin: Cijk_Ailk_Bjlk_HBH_MT256x256x16_MI32x32x8x1_SE_1LDSB0_AF0EM8_AF1EM1_AMAS3_BL1_EPS1_GRVW4_GSU1_ISA908_KLA_LRVW4_MAC_NLCA1_NLCB1_PGR1_SIA3_SU0_SUS256_SRVW4_TT4_128_USFGROn1_VAW2_VSn1_VW2_WSGRA1_WSGRB1_WG64_4_1_WGM1
    SolutionIndex: 433
    SolutionNameMin: Cijk_Ailk_Bjlk_HBH_MT256x256x32_MI32x32x8x1_SE_1LDSB0_AF0EM8_AF1EM1_AMAS3_BL1_EPS1_GRVW8_GSU1_ISA908_KLA_LRVW4_MAC_NLCA1_NLCB1_PGR1_SIA3_SU0_SUS256_SRVW4_TT4_128_USFGROn1_VAW2_VSn1_VW2_WSGRA1_WSGRB1_WG64_4_1_WGM1
    SolutionIndex: 434
    SolutionNameMin: Cijk_Ailk_Bjlk_HBH_MT128x256x32_MI32x32x8x1_SN_1LDSB0_AF0EM8_AF1EM1_AMAS3_BL1_EPS1_GRVW8_GSU1_ISA908_KLA_LRVW4_MAC_NLCA1_NLCB1_PGR1_SIA3_SU32_SUS256_SRVW4_TT2_128_USFGROn1_VAW2_VSn1_VW2_WSGRA1_WSGRB1_WG64_4_1_WGM15
    SolutionIndex: 435
    SolutionNameMin: Cijk_Ailk_Bjlk_HBH_MT128x128x16_MI32x32x8x1_SE_1LDSB0_AF0EM8_AF1EM1_AMAS3_BL1_EPS0_GRVW2_GSU1_ISA908_KLA_LRVW4_MAC_NLCA1_NLCB1_PGR2_SIA3_SU0_SUS256_SRVW4_TT2_64_USFGROn1_VAW2_VSn1_VW2_WSGRA1_WSGRB1_WG64_4_1_WGM2
    SolutionIndex: 436
    SolutionNameMin: Cijk_Ailk_Bjlk_HBH_MT128x192x32_MI32x32x8x1_SE_1LDSB0_AF0EM8_AF1EM1_AMAS3_BL1_EPS0_GRVW4_GSU2_ISA908_KLA_LRVW4_MAC_NLCA1_NLCB3_PGR2_SIA3_SU0_SUS256_SRVW4_TT2_96_USFGROn1_VAW1_VSn1_VW2_WSGRA1_WSGRB1_WG64_4_1_WGM15
    SolutionIndex: 437
    SolutionNameMin: Cijk_Ailk_Bjlk_HBH_MT96x128x32_MI32x32x8x1_SE_1LDSB0_AF0EM8_AF1EM1_AMAS3_BL1_EPS0_GRVW4_GSU1_ISA908_KLA_LRVW4_MAC_NLCA3_NLCB1_PGR2_SIA3_SU0_SUS256_SRVW0_TT3_32_USFGROn1_VAW2_VSn1_VW2_WSGRA1_WSGRB1_WG32_8_1_WGM1
    SolutionIndex: 438
    SolutionNameMin: Cijk_Ailk_Bjlk_HBH_MT256x192x32_MI32x32x8x1_SE_1LDSB0_AF0EM8_AF1EM1_AMAS3_BL1_EPS1_GRVW8_GSU1_ISA908_KLA_LRVW4_MAC_NLCA1_NLCB3_PGR1_SIA3_SU32_SUS128_SRVW4_TT4_96_USFGROn1_VAW2_VSn1_VW2_WSGRA1_WSGRB1_WG64_4_1_WGM15
    SolutionIndex: 439
    SolutionNameMin: Cijk_Ailk_Bjlk_HBH_MT256x160x32_MI32x32x8x1_SN_1LDSB0_AF0EM8_AF1EM1_AMAS3_BL1_EPS1_GRVW4_GSU1_ISA908_KLA_LRVW4_MAC_NLCA1_NLCB5_PGR1_SIA3_SU0_SUS256_SRVW4_TT2_160_USFGROn1_VAW2_VSn1_VW2_WSGRA1_WSGRB1_WG128_2_1_WGM1
    SolutionIndex: 440
    SolutionNameMin: Cijk_Ailk_Bjlk_HBH_MT64x192x32_MI32x32x8x1_SE_1LDSB0_AF0EM1_AF1EM1_AMAS3_BL1_EPS0_GRVW8_GSU1_ISA908_KLA_LRVW4_MAC_NLCA1_NLCB3_PGR2_SIA3_SU0_SUS256_SRVW4_TT1_96_USFGROn1_VAW2_VSn1_VW2_WSGRA1_WSGRB1_WG64_4_1_WGM1
    SolutionIndex: 441
    SolutionNameMin: Cijk_Ailk_Bjlk_HBH_MT128x96x16_MI32x32x8x1_SE_1LDSB0_AF0EM8_AF1EM1_AMAS3_BL1_EPS1_GRVW2_GSU1_ISA908_KLA_LRVW4_MAC_NLCA1_NLCB3_PGR1_SIA3_SU32_SUS256_SRVW4_TT1_96_USFGROn1_VAW2_VSn1_VW2_WSGRA1_WSGRB1_WG128_2_1_WGM2
    SolutionIndex: 442
    SolutionNameMin: Cijk_Ailk_Bjlk_HBH_MT128x256x16_MI32x32x8x1_SE_1LDSB0_AF0EM8_AF1EM1_AMAS3_BL1_EPS0_GRVW4_GSU1_ISA908_KLA_LRVW4_MAC_NLCA1_NLCB1_PGR2_SIA3_SU32_SUS256_SRVW4_TT2_128_USFGROn1_VAW2_VSn1_VW2_WSGRA1_WSGRB1_WG64_4_1_WGM2
    SolutionIndex: 443
    SolutionNameMin: Cijk_Ailk_Bjlk_HBH_MT128x256x16_MI32x32x8x1_SE_1LDSB1_AF0EM8_AF1EM1_AMAS3_BL1_EPS0_GRVW8_GSU1_ISA908_KLA_LRVW4_MAC_NLCA1_NLCB1_PGR2_SIA3_SU32_SUS128_SRVW4_TT2_128_USFGROn1_VAW2_VSn1_VW2_WSGRA1_WSGRB1_WG64_4_1_WGM1
    SolutionIndex: 444
    SolutionNameMin: Cijk_Ailk_Bjlk_HBH_MT128x256x16_MI32x32x8x1_SE_1LDSB0_AF0EM8_AF1EM1_AMAS3_BL1_EPS0_GRVW2_GSU1_ISA908_KLA_LRVW4_MAC_NLCA1_NLCB2_PGR2_SIA3_SU0_SUS256_SRVW4_TT2_128_USFGROn1_VAW2_VSn1_VW2_WSGRA1_WSGRB1_WG64_4_1_WGM1
    SolutionIndex: 445
    SolutionNameMin: Cijk_Ailk_Bjlk_HBH_MT64x64x64_MI32x32x8x1_SE_1LDSB0_AF0EM8_AF1EM1_AMAS3_BL1_EPS1_GRVW8_GSU1_ISA908_KLA_LRVW4_MAC_NLCA1_NLCB1_PGR1_SIA3_SU0_SUS256_SRVW4_TT1_32_USFGROn1_VAW2_VSn1_VW2_WSGRA1_WSGRB1_WG64_4_1_WGM2
    SolutionIndex: 446
    SolutionNameMin: Cijk_Ailk_Bjlk_HBH_MT64x64x64_MI32x32x8x1_SE_1LDSB0_AF0EM8_AF1EM1_AMAS3_BL1_EPS1_GRVW8_GSU1_ISA908_KLA_LRVW4_MAC_NLCA1_NLCB1_PGR1_SIA3_SU0_SUS256_SRVW4_TT1_32_USFGROn1_VAW2_VSn1_VW2_WSGRA1_WSGRB1_WG64_4_1_WGM15
    SolutionIndex: 447
    SolutionNameMin: Cijk_Ailk_Bjlk_HBH_MT128x256x16_MI32x32x8x1_SE_1LDSB0_AF0EM8_AF1EM1_AMAS3_BL1_EPS0_GRVW8_GSU1_ISA908_KLA_LRVW4_MAC_NLCA1_NLCB1_PGR2_SIA3_SU32_SUS256_SRVW4_TT2_128_USFGROn1_VAW2_VSn1_VW2_WSGRA1_WSGRB1_WG64_4_1_WGM15
    SolutionIndex: 448
    SolutionNameMin: Cijk_Ailk_Bjlk_HBH_MT32x32x16_MI16x16x16x1_SE_1LDSB0_AF0EM8_AF1EM1_AMAS3_BL1_EPS1_GRVW2_GSU1_ISA908_KLA_LRVW4_MAC_NLCA1_NLCB1_PGR1_SIA3_SU0_SUS256_SRVW4_TT1_16_USFGROn1_VAW2_VSn1_VW2_WSGRA1_WSGRB1_WG32_8_1_WGM1
    SolutionIndex: 449
    SolutionNameMin: Cijk_Ailk_Bjlk_HBH_MT128x96x16_MI32x32x8x1_SE_1LDSB0_AF0EM1_AF1EM1_AMAS3_BL1_EPS1_GRVW2_GSU1_ISA908_KLA_LRVW4_MAC_NLCA1_NLCB3_PGR1_SIA3_SU32_SUS256_SRVW4_TT1_96_USFGROn1_VAW2_VSn1_VW2_WSGRA1_WSGRB1_WG128_2_1_WGM15
    SolutionIndex: 450
    SolutionNameMin: Cijk_Ailk_Bjlk_HBH_MT128x96x16_MI32x32x8x1_SE_1LDSB0_AF0EM8_AF1EM1_AMAS3_BL1_EPS0_GRVW2_GSU1_ISA908_KLA_LRVW4_MAC_NLCA1_NLCB3_PGR2_SIA3_SU32_SUS128_SRVW4_TT1_96_USFGROn1_VAW2_VSn1_VW2_WSGRA1_WSGRB1_WG128_2_1_WGM1
    SolutionIndex: 451
    SolutionNameMin: Cijk_Ailk_Bjlk_HBH_MT128x96x16_MI32x32x8x1_SE_1LDSB0_AF0EM8_AF1EM1_AMAS3_BL1_EPS0_GRVW2_GSU1_ISA908_KLA_LRVW4_MAC_NLCA1_NLCB3_PGR2_SIA3_SU0_SUS256_SRVW4_TT1_96_USFGROn1_VAW2_VSn1_VW2_WSGRA1_WSGRB1_WG128_2_1_WGM2
    SolutionIndex: 452
    SolutionNameMin: Cijk_Ailk_Bjlk_HBH_MT128x256x16_MI32x32x8x1_SE_1LDSB0_AF0EM8_AF1EM1_AMAS3_BL1_EPS0_GRVW4_GSU1_ISA908_KLA_LRVW4_MAC_NLCA1_NLCB1_PGR2_SIA3_SU32_SUS128_SRVW4_TT2_128_USFGROn1_VAW2_VSn1_VW2_WSGRA1_WSGRB1_WG64_4_1_WGM1
    SolutionIndex: 453
    SolutionNameMin: Cijk_Ailk_Bjlk_HBH_MT128x64x16_MI32x32x8x1_SE_1LDSB0_AF0EM8_AF1EM1_AMAS3_BL1_EPS0_GRVW4_GSU1_ISA908_KLA_LRVW4_MAC_NLCA1_NLCB1_PGR2_SIA3_SU0_SUS256_SRVW4_TT2_32_USFGROn1_VAW2_VSn1_VW2_WSGRA1_WSGRB1_WG64_4_1_WGM1
    SolutionIndex: 454
    SolutionNameMin: Cijk_Ailk_Bjlk_HBH_MT64x64x16_MI32x32x8x1_SE_1LDSB0_AF0EM8_AF1EM1_AMAS3_BL1_EPS0_GRVW4_GSU1_ISA908_KLA_LRVW4_MAC_NLCA1_NLCB1_PGR2_SIA3_SU32_SUS256_SRVW4_TT1_32_USFGROn1_VAW2_VSn1_VW2_WSGRA1_WSGRB1_WG64_4_1_WGM1
    SolutionIndex: 455
    SolutionNameMin: Cijk_Ailk_Bjlk_HBH_MT128x160x32_MI32x32x8x1_SN_1LDSB0_AF0EM1_AF1EM1_AMAS3_BL1_EPS0_GRVW4_GSU1_ISA908_KLA_LRVW4_MAC_NLCA1_NLCB5_PGR2_SIA3_SU32_SUS256_SRVW4_TT1_160_USFGROn1_VAW2_VSn1_VW2_WSGRA1_WSGRB1_WG128_2_1_WGM15
    SolutionIndex: 456
    SolutionNameMin: Cijk_Ailk_Bjlk_HBH_MT128x288x32_MI32x32x8x1_SE_1LDSB0_AF0EM8_AF1EM1_AMAS3_BL1_EPS1_GRVW4_GSU1_ISA908_KLA_LRVW4_MAC_NLCA1_NLCB9_PGR1_SIA3_SU0_SUS256_SRVW4_TT1_288_USFGROn1_VAW2_VSn1_VW2_WSGRA1_WSGRB1_WG128_2_1_WGM15
    SolutionIndex: 457
    SolutionNameMin: Cijk_Ailk_Bjlk_HBH_MT128x256x16_MI32x32x8x1_SE_1LDSB1_AF0EM1_AF1EM1_AMAS3_BL1_EPS0_GRVW8_GSU1_ISA908_KLA_LRVW4_MAC_NLCA1_NLCB1_PGR2_SIA3_SU0_SUS256_SRVW4_TT2_128_USFGROn1_VAW2_VSn1_VW2_WSGRA1_WSGRB1_WG64_4_1_WGM15
    SolutionIndex: 458
    SolutionNameMin: Cijk_Ailk_Bjlk_HBH_MT256x128x32_MI32x32x8x1_SE_1LDSB0_AF0EM8_AF1EM1_AMAS3_BL1_EPS1_GRVW8_GSU1_ISA908_KLA_LRVW4_MAC_NLCA1_NLCB1_PGR1_SIA3_SU32_SUS256_SRVW4_TT4_64_USFGROn1_VAW2_VSn1_VW2_WSGRA1_WSGRB1_WG64_4_1_WGM15
    SolutionIndex: 459
    SolutionNameMin: Cijk_Ailk_Bjlk_HBH_MT256x128x16_MI32x32x8x1_SN_1LDSB0_AF0EM8_AF1EM1_AMAS3_BL1_EPS0_GRVW8_GSU1_ISA908_KLA_LRVW4_MAC_NLCA1_NLCB1_PGR2_SIA3_SU0_SUS256_SRVW4_TT4_64_USFGROn1_VAW2_VSn1_VW2_WSGRA1_WSGRB1_WG64_4_1_WGM15
    SolutionIndex: 460
    SolutionNameMin: Cijk_Ailk_Bjlk_HBH_MT128x288x32_MI32x32x8x1_SE_1LDSB0_AF0EM8_AF1EM1_AMAS3_BL1_EPS0_GRVW4_GSU1_ISA908_KLA_LRVW4_MAC_NLCA1_NLCB9_PGR2_SIA3_SU32_SUS128_SRVW4_TT1_288_USFGROn1_VAW2_VSn1_VW2_WSGRA1_WSGRB1_WG128_2_1_WGM1
    SolutionIndex: 461
    SolutionNameMin: Cijk_Ailk_Bjlk_HBH_MT256x128x16_MI32x32x8x1_SE_1LDSB0_AF0EM8_AF1EM1_AMAS3_BL1_EPS0_GRVW4_GSU1_ISA908_KLA_LRVW4_MAC_NLCA1_NLCB1_PGR2_SIA3_SU0_SUS256_SRVW4_TT4_64_USFGROn1_VAW2_VSn1_VW2_WSGRA1_WSGRB1_WG64_4_1_WGM15
    SolutionIndex: 462
    SolutionNameMin: Cijk_Ailk_Bjlk_HBH_MT256x160x32_MI32x32x8x1_SN_1LDSB0_AF0EM8_AF1EM1_AMAS3_BL1_EPS1_GRVW4_GSU1_ISA908_KLA_LRVW4_MAC_NLCA1_NLCB5_PGR1_SIA3_SU32_SUS256_SRVW4_TT2_160_USFGROn1_VAW2_VSn1_VW2_WSGRA1_WSGRB1_WG128_2_1_WGM2
    SolutionIndex: 463
    SolutionNameMin: Cijk_Ailk_Bjlk_HBH_MT256x128x16_MI32x32x8x1_SN_1LDSB0_AF0EM8_AF1EM1_AMAS3_BL1_EPS0_GRVW8_GSU1_ISA908_KLA_LRVW4_MAC_NLCA1_NLCB1_PGR2_SIA3_SU0_SUS128_SRVW4_TT4_64_USFGROn1_VAW2_VSn1_VW2_WSGRA1_WSGRB1_WG64_4_1_WGM2
    SolutionIndex: 464
    SolutionNameMin: Cijk_Ailk_Bjlk_HBH_MT256x128x16_MI32x32x8x1_SE_1LDSB0_AF0EM8_AF1EM1_AMAS3_BL1_EPS0_GRVW8_GSU1_ISA908_KLA_LRVW4_MAC_NLCA1_NLCB1_PGR2_SIA3_SU0_SUS256_SRVW4_TT4_64_USFGROn1_VAW2_VSn1_VW2_WSGRA1_WSGRB1_WG64_4_1_WGM15
    SolutionIndex: 465
    SolutionNameMin: Cijk_Ailk_Bjlk_HBH_MT256x128x32_MI32x32x8x1_SE_1LDSB0_AF0EM8_AF1EM1_AMAS3_BL1_EPS1_GRVW4_GSU1_ISA908_KLA_LRVW4_MAC_NLCA1_NLCB1_PGR1_SIA3_SU0_SUS256_SRVW4_TT4_64_USFGROn1_VAW2_VSn1_VW2_WSGRA1_WSGRB1_WG64_4_1_WGM15
    SolutionIndex: 466
    SolutionNameMin: Cijk_Ailk_Bjlk_HBH_MT128x256x32_MI32x32x8x1_SE_1LDSB0_AF0EM8_AF1EM1_AMAS3_BL1_EPS1_GRVW8_GSU1_ISA908_KLA_LRVW4_MAC_NLCA1_NLCB1_PGR1_SIA3_SU0_SUS256_SRVW4_TT2_128_USFGROn1_VAW2_VSn1_VW2_WSGRA1_WSGRB1_WG64_4_1_WGM2
    SolutionIndex: 467
    SolutionNameMin: Cijk_Ailk_Bjlk_HBH_MT128x256x32_MI32x32x8x1_SE_1LDSB0_AF0EM8_AF1EM1_AMAS3_BL1_EPS1_GRVW4_GSU1_ISA908_KLA_LRVW4_MAC_NLCA1_NLCB1_PGR1_SIA3_SU0_SUS256_SRVW4_TT2_128_USFGROn1_VAW2_VSn1_VW2_WSGRA1_WSGRB1_WG64_4_1_WGM1
    SolutionIndex: 468
    SolutionNameMin: Cijk_Ailk_Bjlk_HBH_MT256x160x32_MI32x32x8x1_SN_1LDSB0_AF0EM8_AF1EM1_AMAS3_BL1_EPS1_GRVW4_GSU1_ISA908_KLA_LRVW4_MAC_NLCA1_NLCB5_PGR1_SIA3_SU32_SUS128_SRVW4_TT2_160_USFGROn1_VAW2_VSn1_VW2_WSGRA1_WSGRB1_WG128_2_1_WGM1
    SolutionIndex: 469
    SolutionNameMin: Cijk_Ailk_Bjlk_HBH_MT128x256x32_MI32x32x8x1_SE_1LDSB0_AF0EM8_AF1EM1_AMAS3_BL1_EPS1_GRVW8_GSU1_ISA908_KLA_LRVW4_MAC_NLCA1_NLCB1_PGR1_SIA3_SU0_SUS256_SRVW4_TT2_128_USFGROn1_VAW2_VSn1_VW2_WSGRA1_WSGRB1_WG64_4_1_WGM15
    SolutionIndex: 470
    SolutionNameMin: Cijk_Ailk_Bjlk_HBH_MT144x256x32_MI16x16x16x1_SE_1LDSB0_AF0EM8_AF1EM1_AMAS3_BL1_EPS0_GRVW2_GSU1_ISA908_KLA_LRVW4_MAC_NLCA9_NLCB2_PGR2_SIA3_SU32_SUS256_SRVW0_TT9_64_USFGROn1_VAW2_VSn1_VW2_WSGRA1_WSGRB1_WG16_16_1_WGM1
    SolutionIndex: 471
    SolutionNameMin: Cijk_Ailk_Bjlk_HBH_MT64x32x16_MI16x16x16x1_SE_1LDSB0_AF0EM8_AF1EM1_AMAS3_BL1_EPS0_GRVW2_GSU1_ISA908_KLA_LRVW4_MAC_NLCA1_NLCB1_PGR2_SIA3_SU32_SUS256_SRVW4_TT2_16_USFGROn1_VAW2_VSn1_VW2_WSGRA1_WSGRB1_WG32_8_1_WGM2
    SolutionIndex: 472
    SolutionNameMin: Cijk_Ailk_Bjlk_HBH_MT64x192x32_MI32x32x8x1_SE_1LDSB0_AF0EM8_AF1EM1_AMAS3_BL1_EPS0_GRVW4_GSU1_ISA908_KLA_LRVW4_MAC_NLCA1_NLCB3_PGR2_SIA3_SU0_SUS256_SRVW4_TT1_96_USFGROn1_VAW2_VSn1_VW2_WSGRA1_WSGRB1_WG64_4_1_WGM1
    SolutionIndex: 473
    SolutionNameMin: Cijk_Ailk_Bjlk_HBH_MT128x64x16_MI32x32x8x1_SE_1LDSB0_AF0EM8_AF1EM1_AMAS3_BL1_EPS0_GRVW4_GSU1_ISA908_KLA_LRVW4_MAC_NLCA1_NLCB1_PGR2_SIA3_SU0_SUS256_SRVW4_TT2_32_USFGROn1_VAW2_VSn1_VW2_WSGRA1_WSGRB1_WG64_4_1_WGM2
- - - [64, 448, 1, 3328]
    - [0, 1.998]
  - - [1, 64, 1, 256]
    - [1, 0.0]
  - - [3584, 64, 1, 1280]
    - [2, 6.493]
  - - [64, 128, 1, 256]
    - [3, 0.06]
  - - [64, 5888, 1, 1280]
    - [4, 10.643]
  - - [64, 4288, 1, 1280]
    - [5, 7.28]
  - - [3584, 64, 1, 3328]
    - [6, 12.404]
  - - [64, 1024, 1, 3328]
    - [7, 4.358]
  - - [1, 64, 1, 1280]
    - [1, 0.0]
  - - [704, 64, 1, 3328]
    - [8, 3.293]
  - - [64, 448, 1, 1280]
    - [2, 0.969]
  - - [64, 704, 1, 3328]
    - [9, 3.316]
  - - [64, 64, 1, 1280]
    - [9, 0.136]
  - - [64, 5056, 1, 256]
    - [10, 2.851]
  - - [64, 4288, 1, 3328]
    - [11, 14.039]
  - - [1856, 64, 1, 3328]
    - [12, 7.655]
  - - [1, 64, 1, 1]
    - [13, 0.0]
  - - [448, 64, 1, 1280]
    - [14, 1.021]
  - - [5888, 64, 1, 1280]
    - [5, 10.674]
  - - [2944, 64, 1, 256]
    - [14, 1.538]
  - - [64, 1856, 1, 256]
    - [12, 1.009]
  - - [64, 1024, 1, 1280]
    - [15, 2.115]
  - - [64, 256, 1, 1280]
    - [16, 0.548]
  - - [704, 64, 1, 1280]
    - [17, 1.48]
  - - [64, 128, 1, 1280]
    - [18, 0.261]
  - - [2368, 64, 1, 256]
    - [19, 1.016]
  - - [2368, 64, 1, 3328]
    - [20, 7.391]
  - - [64, 1408, 1, 3328]
    - [21, 5.877]
  - - [1856, 64, 1, 1280]
    - [12, 3.797]
  - - [64, 3584, 1, 1280]
    - [22, 6.493]
  - - [448, 64, 1, 3328]
    - [23, 2.005]
  - - [5888, 64, 1, 3328]
    - [24, 15.996]
  - - [128, 64, 1, 256]
    - [25, 0.064]
  - - [64, 128, 1, 3328]
    - [26, 0.692]
  - - [64, 256, 1, 3328]
    - [27, 1.362]
  - - [4288, 64, 1, 3328]
    - [11, 12.2]
  - - [64, 2944, 1, 256]
    - [28, 1.59]
  - - [6784, 64, 1, 256]
    - [29, 3.492]
  - - [1024, 64, 1, 1280]
    - [12, 2.135]
  - - [64, 2368, 1, 1280]
    - [30, 4.456]
  - - [64, 3584, 1, 3328]
    - [6, 12.314]
  - - [64, 6784, 1, 3328]
    - [11, 19.458]
  - - [3584, 64, 1, 256]
    - [6, 1.748]
  - - [64, 1856, 1, 3328]
    - [7, 7.723]
  - - [448, 64, 1, 256]
    - [31, 0.231]
  - - [64, 5056, 1, 3328]
    - [32, 16.091]
  - - [256, 64, 1, 256]
    - [33, 0.148]
  - - [4288, 64, 1, 1280]
    - [34, 7.342]
  - - [1, 1, 1, 1]
    - [35, 0.0]
  - - [5056, 64, 1, 1280]
    - [36, 9.896]
  - - [1024, 64, 1, 3328]
    - [21, 4.76]
  - - [1408, 64, 1, 256]
    - [37, 0.814]
  - - [64, 1408, 1, 256]
    - [3, 0.824]
  - - [64, 2368, 1, 3328]
    - [38, 8.983]
  - - [64, 448, 1, 256]
    - [10, 0.237]
  - - [64, 6784, 1, 1280]
    - [11, 12.095]
  - - [64, 1856, 1, 1280]
    - [16, 4.351]
  - - [64, 6784, 1, 256]
    - [39, 3.676]
  - - [64, 5056, 1, 1280]
    - [5, 9.079]
  - - [64, 4288, 1, 256]
    - [3, 2.123]
  - - [128, 64, 1, 1280]
    - [40, 0.265]
  - - [5888, 64, 1, 256]
    - [12, 2.732]
  - - [64, 5888, 1, 3328]
    - [11, 16.854]
  - - [64, 1024, 1, 256]
    - [37, 0.484]
  - - [5056, 64, 1, 3328]
    - [41, 15.764]
  - - [256, 64, 1, 1280]
    - [42, 0.523]
  - - [64, 256, 1, 256]
    - [28, 0.14]
  - - [704, 64, 1, 256]
    - [31, 0.396]
  - - [64, 1408, 1, 1280]
    - [12, 3.232]
  - - [1, 1, 1, 256]
    - [13, 0.0]
  - - [64, 704, 1, 256]
    - [28, 0.369]
  - - [64, 2944, 1, 3328]
    - [43, 10.336]
  - - [64, 64, 1, 256]
    - [25, 0.029]
  - - [1856, 64, 1, 256]
    - [16, 0.99]
  - - [128, 64, 1, 3328]
    - [23, 0.628]
  - - [2944, 64, 1, 1280]
    - [16, 5.785]
  - - [4288, 64, 1, 256]
    - [44, 2.355]
  - - [1, 1, 1, 1280]
    - [45, 0.0]
  - - [64, 2944, 1, 1280]
    - [46, 5.658]
  - - [1408, 64, 1, 1280]
    - [2, 3.036]
  - - [6784, 64, 1, 3328]
    - [41, 21.375]
  - - [1024, 64, 1, 256]
    - [47, 0.553]
  - - [64, 2368, 1, 256]
    - [48, 1.363]
  - - [64, 3584, 1, 256]
    - [30, 2.253]
  - - [2944, 64, 1, 3328]
    - [49, 10.147]
  - - [2368, 64, 1, 1280]
    - [12, 4.614]
  - - [256, 64, 1, 3328]
    - [23, 1.414]
  - - [64, 64, 1, 3328]
    - [50, 0.342]
  - - [1, 1, 1, 3328]
    - [45, 0.0]
  - - [64, 5888, 1, 256]
    - [51, 2.926]
  - - [64, 704, 1, 1280]
    - [12, 1.661]
  - - [6784, 64, 1, 1280]
    - [41, 13.474]
  - - [5056, 64, 1, 256]
    - [14, 2.832]
  - - [1408, 64, 1, 3328]
    - [18, 5.878]
  - - [4096, 7133, 1, 4096]
    - [52, 79.81]
  - - [512, 16, 1, 512]
    - [53, 0.126]
  - - [2048, 7133, 1, 2048]
    - [54, 71.077]
  - - [2560, 7133, 1, 2560]
    - [55, 72.621]
  - - [1024, 1024, 1, 1024]
    - [56, 19.142]
  - - [3072, 7435, 1, 1024]
    - [57, 65.397]
  - - [1024, 32, 1, 512]
    - [14, 0.537]
  - - [1760, 7133, 1, 1760]
    - [58, 61.258]
  - - [7680, 5481, 1, 2560]
    - [59, 81.648]
  - - [1024, 16, 1, 512]
    - [14, 0.263]
  - - [512, 32, 1, 512]
    - [12, 0.266]
  - - [3136, 256, 64, 64]
    - [60, 15.326]
  - - [784, 512, 64, 128]
    - [61, 22.876]
  - - [784, 128, 64, 512]
    - [62, 34.723]
  - - [3136, 64, 128, 64]
    - [63, 11.014]
  - - [196, 256, 128, 1024]
    - [64, 30.528]
  - - [196, 256, 64, 1024]
    - [65, 27.556]
  - - [196, 1024, 128, 256]
    - [66, 24.598]
  - - [784, 128, 256, 512]
    - [67, 42.202]
  - - [3136, 64, 64, 256]
    - [68, 23.651]
  - - [3136, 64, 256, 256]
    - [69, 26.443]
  - - [3136, 256, 256, 64]
    - [60, 17.657]
  - - [3136, 64, 128, 256]
    - [70, 24.475]
  - - [784, 128, 128, 512]
    - [71, 41.338]
  - - [784, 512, 128, 128]
    - [72, 26.197]
  - - [784, 512, 256, 128]
    - [73, 30.172]
  - - [196, 1024, 64, 256]
    - [74, 21.84]
  - - [3136, 64, 64, 64]
    - [75, 10.247]
  - - [196, 1024, 256, 256]
    - [76, 26.094]
  - - [196, 256, 256, 1024]
    - [77, 36.633]
  - - [3136, 256, 128, 64]
    - [78, 16.628]
  - - [3136, 64, 256, 64]
    - [63, 12.566]
  - - [14, 64, 1, 14]
    - [33, 0.0]
  - - [15, 64, 1, 14]
    - [79, 0.0]
  - - [15, 64, 1, 15]
    - [33, 0.0]
  - - [17, 64, 1, 15]
    - [80, 0.001]
  - - [17, 64, 1, 17]
    - [80, 0.001]
  - - [21, 64, 1, 17]
    - [80, 0.001]
  - - [21, 64, 1, 21]
    - [79, 0.001]
  - - [24, 64, 1, 24]
    - [81, 0.001]
  - - [30, 64, 1, 30]
    - [82, 0.002]
  - - [30, 64, 1, 31]
    - [47, 0.002]
  - - [31, 64, 1, 31]
    - [83, 0.002]
  - - [32, 64, 1, 32]
    - [84, 0.002]
  - - [32, 64, 1, 35]
    - [85, 0.003]
  - - [34, 64, 1, 24]
    - [79, 0.002]
  - - [34, 64, 1, 34]
    - [83, 0.003]
  - - [35, 64, 1, 35]
    - [82, 0.003]
  - - [64, 14, 1, 14]
    - [86, 0.0]
  - - [64, 15, 1, 14]
    - [87, 0.0]
  - - [64, 15, 1, 15]
    - [87, 0.0]
  - - [64, 17, 1, 15]
    - [84, 0.001]
  - - [64, 17, 1, 17]
    - [88, 0.001]
  - - [64, 21, 1, 17]
    - [89, 0.001]
  - - [64, 21, 1, 21]
    - [85, 0.001]
  - - [64, 24, 1, 24]
    - [31, 0.001]
  - - [64, 30, 1, 30]
    - [90, 0.002]
  - - [64, 30, 1, 31]
    - [12, 0.002]
  - - [64, 31, 1, 31]
    - [31, 0.002]
  - - [64, 32, 1, 32]
    - [91, 0.003]
  - - [64, 32, 1, 35]
    - [88, 0.002]
  - - [64, 34, 1, 24]
    - [14, 0.002]
  - - [64, 34, 1, 34]
    - [92, 0.003]
  - - [64, 35, 1, 35]
    - [92, 0.003]
  - - [64, 128, 512, 128]
    - [93, 9.454]
  - - [64, 512, 1, 512]
    - [47, 0.525]
  - - [64, 512, 64, 512]
    - [94, 15.139]
  - - [128, 64, 512, 128]
    - [93, 8.65]
  - - [512, 64, 1, 512]
    - [14, 0.514]
  - - [512, 64, 64, 512]
    - [95, 17.402]
  - - [1024, 2, 1, 4]
    - [96, 0.0]
  - - [1024, 2, 1, 32]
    - [33, 0.002]
  - - [1024, 2, 1, 2048]
    - [97, 0.106]
  - - [1024, 1024, 1, 4]
    - [98, 0.146]
  - - [1024, 1024, 1, 32]
    - [86, 1.083]
  - - [1024, 1024, 1, 2048]
    - [99, 27.613]
  - - [1024, 1024, 1, 4096]
    - [100, 37.968]
  - - [1024, 4096, 1, 2048]
    - [101, 56.068]
  - - [1024, 4096, 1, 4096]
    - [102, 65.318]
  - - [1024, 30528, 1, 2048]
    - [103, 79.958]
  - - [1024, 30528, 1, 4096]
    - [59, 87.201]
  - - [4096, 1024, 1, 2048]
    - [104, 54.526]
  - - [4096, 1024, 1, 4096]
    - [104, 63.236]
  - - [3, 64, 512, 3]
    - [79, 0.008]
  - - [5, 64, 512, 5]
    - [46, 0.02]
  - - [5, 64, 960, 5]
    - [105, 0.037]
  - - [9, 64, 512, 9]
    - [83, 0.075]
  - - [13, 512, 1, 32768]
    - [106, 3.473]
  - - [27, 128, 32768, 27]
    - [107, 3.727]
  - - [33, 32, 200, 33]
    - [82, 0.277]
  - - [33, 32, 1600, 33]
    - [108, 1.157]
  - - [67, 2048, 1, 512]
    - [46, 2.197]
  - - [74, 2048, 1, 512]
    - [16, 2.275]
  - - [74, 2048, 1, 960]
    - [46, 3.819]
  - - [100, 2048, 1, 512]
    - [109, 2.942]
  - - [256, 128, 1, 32768]
    - [110, 16.06]
  - - [256, 1280, 1, 8976]
    - [111, 31.721]
  - - [256, 2560, 1, 8976]
    - [112, 46.604]
  - - [256, 2816, 1, 8976]
    - [113, 45.382]
  - - [256, 3328, 1, 8976]
    - [114, 49.813]
  - - [256, 3584, 1, 8976]
    - [115, 51.278]
  - - [256, 3840, 1, 8976]
    - [114, 58.91]
  - - [256, 4096, 1, 8976]
    - [116, 44.227]
  - - [256, 4352, 1, 8976]
    - [117, 47.748]
  - - [256, 4864, 1, 8976]
    - [32, 52.962]
  - - [256, 5120, 1, 8976]
    - [118, 60.332]
  - - [256, 5632, 1, 8976]
    - [56, 60.003]
  - - [256, 5888, 1, 8976]
    - [119, 51.37]
  - - [256, 6144, 1, 8976]
    - [62, 53.785]
  - - [256, 7168, 1, 8976]
    - [120, 63.717]
  - - [256, 8192, 1, 8976]
    - [121, 60.601]
  - - [256, 8960, 1, 8976]
    - [121, 66.164]
  - - [256, 9728, 1, 8976]
    - [122, 64.376]
  - - [256, 9984, 1, 8976]
    - [123, 63.894]
  - - [256, 10240, 1, 8976]
    - [123, 65.565]
  - - [256, 10496, 1, 8976]
    - [124, 67.68]
  - - [256, 11008, 1, 8976]
    - [125, 72.225]
  - - [256, 11264, 1, 8976]
    - [125, 70.14]
  - - [256, 11520, 1, 8976]
    - [123, 72.875]
  - - [256, 11776, 1, 8976]
    - [126, 59.538]
  - - [256, 12544, 1, 8976]
    - [127, 64.731]
  - - [256, 12800, 1, 8976]
    - [128, 64.43]
  - - [256, 13312, 1, 8976]
    - [129, 71.508]
  - - [256, 13568, 1, 8976]
    - [120, 68.98]
  - - [256, 14336, 1, 8976]
    - [130, 76.458]
  - - [256, 14848, 1, 8976]
    - [131, 77.608]
  - - [256, 15104, 1, 8976]
    - [132, 78.363]
  - - [256, 15872, 1, 8976]
    - [133, 72.0]
  - - [256, 16128, 1, 8976]
    - [134, 74.505]
  - - [256, 17152, 1, 8976]
    - [133, 77.885]
  - - [256, 17408, 1, 8976]
    - [135, 72.417]
  - - [256, 18688, 1, 8976]
    - [136, 78.24]
  - - [256, 19968, 1, 8976]
    - [137, 70.959]
  - - [256, 20480, 1, 8976]
    - [125, 76.294]
  - - [256, 20992, 1, 8976]
    - [58, 77.477]
  - - [256, 21248, 1, 8976]
    - [125, 78.987]
  - - [256, 22016, 1, 8976]
    - [138, 78.356]
  - - [256, 26112, 1, 8976]
    - [139, 74.771]
  - - [256, 32512, 1, 8976]
    - [125, 81.589]
  - - [256, 32768, 1, 1]
    - [140, 0.147]
  - - [256, 33536, 1, 8976]
    - [58, 84.731]
  - - [256, 44505, 1, 8976]
    - [141, 85.166]
  - - [257, 4096, 1, 1024]
    - [142, 14.739]
  - - [480, 1024, 1, 32768]
    - [143, 61.432]
  - - [512, 32, 1, 200]
    - [12, 0.107]
  - - [512, 32, 1, 1600]
    - [144, 0.713]
  - - [512, 256, 1, 32768]
    - [145, 42.118]
  - - [512, 512, 1, 200]
    - [19, 1.487]
  - - [512, 512, 1, 1600]
    - [146, 8.006]
  - - [512, 2048, 1, 256]
    - [34, 7.167]
  - - [560, 1024, 1, 200]
    - [147, 3.445]
  - - [560, 1024, 1, 1600]
    - [148, 16.091]
  - - [768, 2048, 1, 256]
    - [68, 10.542]
  - - [1024, 64, 1, 512]
    - [30, 0.882]
  - - [1024, 64, 1, 960]
    - [149, 1.644]
  - - [1024, 256, 1, 1024]
    - [41, 6.365]
  - - [1024, 256, 1, 1280]
    - [150, 7.116]
  - - [1024, 256, 1, 2304]
    - [151, 10.767]
  - - [1024, 256, 1, 2816]
    - [152, 12.77]
  - - [1024, 256, 1, 3072]
    - [116, 14.253]
  - - [1024, 256, 1, 3328]
    - [153, 16.123]
  - - [1024, 256, 1, 3584]
    - [154, 14.398]
  - - [1024, 256, 1, 4096]
    - [155, 17.44]
  - - [1024, 256, 1, 4352]
    - [156, 19.329]
  - - [1024, 256, 1, 4608]
    - [152, 20.357]
  - - [1024, 256, 1, 5120]
    - [157, 20.685]
  - - [1024, 256, 1, 5376]
    - [157, 23.538]
  - - [1024, 256, 1, 5632]
    - [156, 21.648]
  - - [1024, 256, 1, 6144]
    - [152, 22.981]
  - - [1024, 256, 1, 6400]
    - [155, 26.302]
  - - [1024, 256, 1, 7680]
    - [151, 26.969]
  - - [1024, 256, 1, 7936]
    - [158, 27.474]
  - - [1024, 256, 1, 8192]
    - [151, 28.469]
  - - [1024, 256, 1, 8448]
    - [153, 30.206]
  - - [1024, 256, 1, 9728]
    - [116, 31.991]
  - - [1024, 256, 1, 9984]
    - [159, 34.95]
  - - [1024, 256, 1, 10496]
    - [154, 32.425]
  - - [1024, 256, 1, 11520]
    - [160, 35.546]
  - - [1024, 256, 1, 12032]
    - [160, 34.353]
  - - [1024, 256, 1, 13568]
    - [157, 39.514]
  - - [1024, 256, 1, 14336]
    - [154, 39.282]
  - - [1024, 256, 1, 14848]
    - [155, 37.47]
  - - [1024, 256, 1, 15104]
    - [154, 38.175]
  - - [1024, 256, 1, 15872]
    - [154, 41.371]
  - - [1024, 256, 1, 16128]
    - [156, 42.173]
  - - [1024, 256, 1, 17152]
    - [160, 42.997]
  - - [1024, 256, 1, 17408]
    - [161, 42.778]
  - - [1024, 256, 1, 18944]
    - [162, 45.63]
  - - [1024, 256, 1, 19712]
    - [159, 48.401]
  - - [1024, 256, 1, 19968]
    - [154, 46.108]
  - - [1024, 256, 1, 21248]
    - [159, 45.959]
  - - [1024, 256, 1, 21504]
    - [156, 45.707]
  - - [1024, 256, 1, 22016]
    - [160, 48.299]
  - - [1024, 256, 1, 28672]
    - [154, 53.751]
  - - [1024, 256, 1, 33536]
    - [163, 56.274]
  - - [1024, 512, 1, 32768]
    - [164, 64.431]
  - - [1024, 1024, 1, 200]
    - [165, 5.476]
  - - [1024, 1024, 1, 512]
    - [63, 11.622]
  - - [1024, 1024, 1, 960]
    - [166, 17.285]
  - - [1024, 1024, 1, 1600]
    - [166, 24.711]
  - - [1024, 1024, 1, 32768]
    - [167, 68.477]
  - - [1600, 1024, 1, 512]
    - [168, 16.783]
  - - [1600, 1024, 1, 960]
    - [169, 28.03]
  - - [2048, 256, 1, 1024]
    - [170, 10.15]
  - - [2048, 960, 1, 1]
    - [171, 0.064]
  - - [2048, 2048, 1, 512]
    - [172, 28.046]
  - - [2048, 2048, 1, 960]
    - [172, 42.518]
  - - [2048, 2048, 1, 1024]
    - [172, 41.246]
  - - [3200, 2048, 1, 1024]
    - [141, 47.41]
  - - [4096, 4096, 1, 1024]
    - [103, 55.042]
  - - [14, 64, 10880, 14]
    - [173, 1.124]
  - - [15, 64, 10880, 14]
    - [83, 1.241]
  - - [15, 64, 7680, 15]
    - [173, 1.256]
  - - [15, 64, 10880, 15]
    - [173, 1.294]
  - - [17, 64, 7680, 15]
    - [174, 1.222]
  - - [17, 64, 6144, 17]
    - [175, 1.296]
  - - [17, 64, 7680, 17]
    - [174, 1.295]
  - - [21, 64, 6144, 17]
    - [98, 1.389]
  - - [21, 64, 6144, 21]
    - [174, 1.67]
  - - [24, 64, 4736, 24]
    - [176, 2.556]
  - - [30, 64, 2048, 30]
    - [177, 1.836]
  - - [30, 64, 2048, 31]
    - [178, 1.994]
  - - [31, 64, 2048, 31]
    - [107, 1.935]
  - - [32, 64, 4608, 32]
    - [88, 4.396]
  - - [32, 64, 4608, 35]
    - [98, 4.221]
  - - [34, 64, 4736, 24]
    - [98, 2.041]
  - - [34, 64, 4736, 34]
    - [174, 2.606]
  - - [35, 64, 4608, 35]
    - [174, 2.856]
  - - [64, 14, 10880, 14]
    - [90, 1.447]
  - - [64, 15, 10880, 14]
    - [90, 1.421]
  - - [64, 15, 7680, 15]
    - [51, 1.472]
  - - [64, 15, 10880, 15]
    - [179, 1.559]
  - - [64, 17, 7680, 15]
    - [51, 1.529]
  - - [64, 17, 6144, 17]
    - [180, 1.426]
  - - [64, 17, 7680, 17]
    - [181, 1.694]
  - - [64, 21, 6144, 17]
    - [140, 1.853]
  - - [64, 21, 6144, 21]
    - [182, 2.129]
  - - [64, 24, 4736, 24]
    - [183, 2.724]
  - - [64, 30, 2048, 30]
    - [184, 2.322]
  - - [64, 30, 2048, 31]
    - [140, 2.452]
  - - [64, 31, 2048, 31]
    - [147, 2.573]
  - - [64, 32, 4608, 32]
    - [185, 4.155]
  - - [64, 32, 4608, 35]
    - [140, 4.124]
  - - [64, 34, 4736, 24]
    - [186, 3.083]
  - - [64, 34, 4736, 34]
    - [184, 4.036]
  - - [64, 35, 4608, 35]
    - [187, 4.095]
  - - [1024, 1024, 1, 3840]
    - [99, 37.304]
  - - [1024, 1024, 1, 3968]
    - [188, 37.159]
  - - [1024, 1024, 1, 6528]
    - [189, 46.572]
  - - [1024, 1024, 1, 7104]
    - [190, 46.782]
  - - [1024, 1024, 1, 7200]
    - [189, 46.385]
  - - [1024, 1024, 1, 8064]
    - [191, 39.905]
  - - [1024, 1024, 1, 8160]
    - [192, 40.146]
  - - [1024, 1024, 1, 9216]
    - [193, 45.115]
  - - [1024, 1024, 1, 9520]
    - [194, 47.212]
  - - [1024, 1024, 1, 10064]
    - [195, 49.969]
  - - [1024, 1024, 1, 10080]
    - [196, 48.947]
  - - [1024, 1024, 1, 10200]
    - [197, 49.777]
  - - [1024, 4096, 1, 3840]
    - [104, 61.489]
  - - [1024, 4096, 1, 3968]
    - [54, 62.393]
  - - [1024, 4096, 1, 6528]
    - [198, 67.953]
  - - [1024, 4096, 1, 7104]
    - [199, 73.375]
  - - [1024, 4096, 1, 7200]
    - [200, 73.696]
  - - [1024, 4096, 1, 8064]
    - [200, 74.016]
  - - [1024, 4096, 1, 8160]
    - [199, 75.353]
  - - [1024, 4096, 1, 9216]
    - [102, 76.511]
  - - [1024, 4096, 1, 9520]
    - [200, 73.184]
  - - [1024, 4096, 1, 10064]
    - [200, 75.502]
  - - [1024, 4096, 1, 10080]
    - [101, 76.988]
  - - [1024, 4096, 1, 10200]
    - [172, 70.664]
  - - [1024, 42720, 1, 3968]
    - [201, 84.626]
  - - [1024, 42720, 1, 6528]
    - [202, 88.558]
  - - [1024, 42720, 1, 7104]
    - [125, 89.369]
  - - [1024, 42720, 1, 7200]
    - [125, 89.337]
  - - [1024, 42720, 1, 9520]
    - [202, 90.771]
  - - [1024, 42720, 1, 10080]
    - [125, 90.593]
  - - [4096, 1024, 1, 3840]
    - [203, 60.163]
  - - [4096, 1024, 1, 3968]
    - [204, 63.041]
  - - [4096, 1024, 1, 6528]
    - [205, 67.328]
  - - [4096, 1024, 1, 7104]
    - [206, 66.35]
  - - [4096, 1024, 1, 7200]
    - [207, 69.111]
  - - [4096, 1024, 1, 8064]
    - [208, 67.598]
  - - [4096, 1024, 1, 8160]
    - [208, 67.993]
  - - [4096, 1024, 1, 9216]
    - [205, 70.581]
  - - [4096, 1024, 1, 9520]
    - [54, 72.185]
  - - [4096, 1024, 1, 10064]
    - [209, 74.383]
  - - [4096, 1024, 1, 10080]
    - [209, 75.276]
  - - [4096, 1024, 1, 10200]
    - [210, 71.312]
  - - [27, 64, 1920, 27]
    - [91, 1.641]
  - - [27, 64, 1920, 33]
    - [174, 1.785]
  - - [33, 64, 1920, 33]
    - [98, 1.801]
  - - [64, 27, 1920, 27]
    - [183, 1.767]
  - - [64, 27, 1920, 33]
    - [182, 2.342]
  - - [64, 33, 1920, 33]
    - [165, 2.252]
  - - [1024, 1024, 1, 3240]
    - [189, 33.941]
  - - [1024, 1024, 1, 3960]
    - [190, 37.199]
  - - [1024, 4096, 1, 3240]
    - [102, 61.468]
  - - [1024, 4096, 1, 3960]
    - [200, 64.359]
  - - [1024, 42720, 1, 3960]
    - [58, 84.642]
  - - [4096, 1024, 1, 3240]
    - [123, 52.129]
  - - [4096, 1024, 1, 3960]
    - [209, 60.331]
  - - [64, 1280, 64, 192]
    - [211, 15.615]
  - - [64, 1280, 64, 320]
    - [212, 20.768]
  - - [64, 1280, 64, 384]
    - [213, 22.628]
  - - [64, 1280, 64, 448]
    - [214, 23.675]
  - - [64, 2048, 64, 192]
    - [215, 18.058]
  - - [64, 2048, 64, 320]
    - [216, 23.57]
  - - [64, 2048, 64, 384]
    - [217, 26.044]
  - - [64, 2048, 64, 448]
    - [214, 26.792]
  - - [1225, 192, 64, 32]
    - [218, 5.876]
  - - [1225, 192, 64, 48]
    - [219, 8.109]
  - - [1225, 192, 64, 64]
    - [218, 10.165]
  - - [1225, 256, 64, 48]
    - [60, 8.201]
  - - [1225, 256, 64, 64]
    - [220, 9.952]
  - - [1225, 288, 64, 48]
    - [221, 7.816]
  - - [1225, 288, 64, 64]
    - [221, 9.723]
  - - [5329, 64, 64, 80]
    - [222, 11.899]
  - - [289, 768, 64, 128]
    - [223, 14.524]
  - - [289, 768, 64, 160]
    - [223, 18.834]
  - - [289, 768, 64, 192]
    - [223, 20.518]
  - - [64, 1280, 32, 192]
    - [60, 11.917]
  - - [64, 1280, 32, 320]
    - [224, 16.623]
  - - [64, 1280, 32, 384]
    - [225, 18.634]
  - - [64, 1280, 32, 448]
    - [226, 20.318]
  - - [64, 2048, 32, 192]
    - [227, 14.588]
  - - [64, 2048, 32, 320]
    - [228, 18.638]
  - - [64, 2048, 32, 384]
    - [211, 20.982]
  - - [64, 2048, 32, 448]
    - [211, 22.467]
  - - [1225, 192, 32, 32]
    - [229, 3.998]
  - - [1225, 192, 32, 48]
    - [219, 5.756]
  - - [1225, 192, 32, 64]
    - [219, 7.833]
  - - [1225, 256, 32, 48]
    - [60, 7.095]
  - - [1225, 256, 32, 64]
    - [230, 9.468]
  - - [1225, 288, 32, 48]
    - [231, 7.148]
  - - [1225, 288, 32, 64]
    - [221, 9.281]
  - - [5329, 64, 32, 80]
    - [232, 9.975]
  - - [289, 768, 32, 128]
    - [218, 10.264]
  - - [289, 768, 32, 160]
    - [233, 13.854]
  - - [289, 768, 32, 192]
    - [234, 16.217]
  - - [49, 512, 64, 2048]
    - [220, 22.012]
  - - [49, 2048, 64, 512]
    - [230, 20.068]
  - - [3136, 64, 32, 256]
    - [69, 19.499]
  - - [3136, 64, 32, 64]
    - [51, 6.536]
  - - [3136, 256, 32, 64]
    - [235, 12.65]
  - - [784, 128, 32, 512]
    - [236, 27.33]
  - - [784, 512, 32, 128]
    - [237, 19.454]
  - - [196, 256, 32, 1024]
    - [77, 20.767]
  - - [196, 1024, 32, 256]
    - [238, 17.205]
  - - [49, 512, 32, 2048]
    - [239, 16.73]
  - - [49, 2048, 32, 512]
    - [240, 16.606]
  - - [3136, 64, 64, 128]
    - [241, 15.789]
  - - [3136, 128, 64, 256]
    - [242, 30.392]
  - - [784, 256, 64, 512]
    - [235, 43.148]
  - - [3136, 256, 64, 128]
    - [243, 24.975]
  - - [3136, 256, 64, 256]
    - [244, 42.681]
  - - [196, 512, 64, 1024]
    - [245, 30.33]
  - - [784, 512, 64, 256]
    - [123, 30.815]
  - - [784, 512, 64, 512]
    - [246, 49.426]
  - - [196, 1024, 64, 512]
    - [65, 30.73]
  - - [196, 1024, 64, 1024]
    - [247, 42.425]
  - - [49, 1024, 64, 2048]
    - [248, 25.15]
  - - [49, 2048, 64, 1024]
    - [238, 25.237]
  - - [3136, 64, 32, 128]
    - [36, 12.994]
  - - [3136, 128, 32, 256]
    - [72, 31.264]
  - - [784, 256, 32, 512]
    - [103, 33.665]
  - - [3136, 256, 32, 128]
    - [244, 21.74]
  - - [3136, 256, 32, 256]
    - [249, 29.603]
  - - [196, 512, 32, 1024]
    - [247, 26.543]
  - - [784, 512, 32, 256]
    - [250, 31.824]
  - - [784, 512, 32, 512]
    - [251, 46.094]
  - - [196, 1024, 32, 512]
    - [233, 26.705]
  - - [196, 1024, 32, 1024]
    - [252, 31.035]
  - - [49, 1024, 32, 2048]
    - [238, 23.557]
  - - [49, 2048, 32, 1024]
    - [219, 22.576]
  - - [7680, 8192, 1, 8192]
    - [253, 92.022]
  - - [3840, 4096, 1, 4096]
    - [254, 84.191]
  - - [1920, 2048, 1, 2048]
    - [255, 57.513]
  - - [960, 1024, 1, 1024]
    - [256, 20.089]
  - - [480, 512, 1, 512]
    - [109, 3.534]
  - - [8192, 7680, 1, 8192]
    - [257, 92.738]
  - - [4096, 3840, 1, 4096]
    - [258, 84.133]
  - - [2048, 1920, 1, 2048]
    - [259, 62.339]
  - - [1024, 960, 1, 1024]
    - [260, 20.914]
  - - [512, 480, 1, 512]
    - [81, 3.714]
  - - [8192, 8192, 1, 8192]
    - [203, 88.197]
  - - [4096, 4096, 1, 4096]
    - [137, 79.462]
  - - [2048, 2048, 1, 2048]
    - [261, 56.115]
  - - [512, 512, 1, 512]
    - [37, 3.848]
  - - [64, 512, 16, 512]
    - [75, 7.584]
  - - [1024, 2, 1, 1]
    - [96, 0.0]
  - - [1024, 2, 1, 512]
    - [87, 0.029]
  - - [1024, 1024, 1, 1]
    - [262, 0.035]
  - - [1024, 1024, 1, 77]
    - [241, 2.28]
  - - [1024, 4096, 1, 512]
    - [263, 29.634]
  - - [1024, 30522, 1, 77]
    - [264, 11.067]
  - - [4096, 1024, 1, 512]
    - [265, 28.224]
  - - [64, 128, 160, 128]
    - [266, 4.609]
  - - [1024, 2, 1, 10]
    - [180, 0.001]
  - - [1024, 2, 1, 1280]
    - [9, 0.059]
  - - [1024, 1024, 1, 10]
    - [140, 0.311]
  - - [1024, 1024, 1, 1280]
    - [56, 20.943]
  - - [1024, 4096, 1, 1280]
    - [199, 46.107]
  - - [1024, 30522, 1, 200]
    - [267, 29.079]
  - - [4096, 1024, 1, 1280]
    - [268, 44.423]
  - - [64, 128, 624, 128]
    - [269, 10.003]
  - - [1024, 2, 1, 39]
    - [270, 0.003]
  - - [1024, 2, 1, 4992]
    - [271, 0.24]
  - - [1024, 1024, 1, 39]
    - [140, 1.308]
  - - [1024, 1024, 1, 780]
    - [165, 14.98]
  - - [1024, 1024, 1, 4992]
    - [190, 40.905]
  - - [1024, 4096, 1, 4992]
    - [133, 66.365]
  - - [1024, 30522, 1, 780]
    - [272, 59.973]
  - - [4096, 1024, 1, 4992]
    - [207, 66.02]
  - - [1024, 1024, 1, 308]
    - [273, 8.022]
  - - [1024, 30522, 1, 308]
    - [258, 38.646]
  - - [64, 128, 640, 128]
    - [274, 10.583]
  - - [1024, 2, 1, 40]
    - [275, 0.003]
  - - [1024, 2, 1, 5120]
    - [26, 0.298]
  - - [1024, 1024, 1, 40]
    - [276, 1.445]
  - - [1024, 1024, 1, 800]
    - [192, 15.865]
  - - [1024, 1024, 1, 5120]
    - [277, 38.7]
  - - [1024, 4096, 1, 5120]
    - [102, 68.714]
  - - [1024, 30522, 1, 800]
    - [272, 61.777]
  - - [4096, 1024, 1, 5120]
    - [209, 68.995]
  - - [64, 128, 656, 128]
    - [278, 10.838]
  - - [1024, 2, 1, 41]
    - [44, 0.003]
  - - [1024, 2, 1, 5248]
    - [27, 0.277]
  - - [1024, 1024, 1, 41]
    - [279, 1.518]
  - - [1024, 1024, 1, 820]
    - [280, 16.117]
  - - [1024, 1024, 1, 5248]
    - [189, 40.906]
  - - [1024, 4096, 1, 5248]
    - [199, 71.439]
  - - [1024, 30522, 1, 820]
    - [281, 62.229]
  - - [4096, 1024, 1, 5248]
    - [209, 65.473]
  - - [64, 512, 80, 512]
    - [282, 18.902]
  - - [1024, 2, 1, 5]
    - [96, 0.0]
  - - [1024, 2, 1, 2560]
    - [97, 0.121]
  - - [1024, 1024, 1, 5]
    - [283, 0.158]
  - - [1024, 1024, 1, 385]
    - [284, 9.592]
  - - [1024, 1024, 1, 2560]
    - [99, 32.742]
  - - [1024, 4096, 1, 2560]
    - [285, 51.488]
  - - [1024, 30522, 1, 385]
    - [103, 45.752]
  - - [4096, 1024, 1, 2560]
    - [210, 50.459]
  - - [64, 512, 96, 512]
    - [286, 20.497]
  - - [1024, 2, 1, 6]
    - [92, 0.0]
  - - [1024, 2, 1, 3072]
    - [287, 0.144]
  - - [1024, 1024, 1, 6]
    - [180, 0.202]
  - - [1024, 1024, 1, 462]
    - [184, 9.938]
  - - [1024, 1024, 1, 3072]
    - [99, 33.423]
  - - [1024, 4096, 1, 3072]
    - [200, 59.547]
  - - [1024, 30522, 1, 462]
    - [103, 46.503]
  - - [4096, 1024, 1, 3072]
    - [209, 60.118]
  - - [64, 128, 128, 128]
    - [4, 4.189]
  - - [1024, 2, 1, 8]
    - [270, 0.001]
  - - [1024, 2, 1, 1024]
    - [288, 0.041]
  - - [1024, 1024, 1, 8]
    - [276, 0.273]
  - - [1024, 1024, 1, 160]
    - [186, 5.104]
  - - [1024, 4096, 1, 1024]
    - [199, 43.217]
  - - [1024, 30522, 1, 160]
    - [289, 23.744]
  - - [4096, 1024, 1, 1024]
    - [205, 39.639]
  - - [64, 128, 144, 128]
    - [290, 3.543]
  - - [1024, 2, 1, 9]
    - [180, 0.001]
  - - [1024, 2, 1, 1152]
    - [288, 0.049]
  - - [1024, 1024, 1, 9]
    - [291, 0.294]
  - - [1024, 1024, 1, 180]
    - [241, 5.1]
  - - [1024, 1024, 1, 1152]
    - [99, 18.624]
  - - [1024, 4096, 1, 1152]
    - [102, 43.976]
  - - [1024, 30522, 1, 180]
    - [103, 25.973]
  - - [4096, 1024, 1, 1152]
    - [54, 41.891]
  - - [479, 1024, 1, 32768]
    - [167, 57.465]
  - - [4, 64, 32768, 4]
    - [84, 0.156]
  - - [4, 64, 38400, 4]
    - [84, 0.145]
  - - [64, 4, 32768, 4]
    - [292, 0.155]
  - - [64, 4, 38400, 4]
    - [89, 0.148]
  - - [1024, 1024, 1, 8192]
    - [166, 40.859]
  - - [1024, 1024, 1, 9600]
    - [293, 47.509]
  - - [1024, 4096, 1, 8192]
    - [101, 75.386]
  - - [1024, 4096, 1, 9600]
    - [54, 72.381]
  - - [1024, 33712, 1, 8192]
    - [57, 89.303]
  - - [1024, 33712, 1, 9600]
    - [294, 90.311]
  - - [4096, 1024, 1, 8192]
    - [209, 73.355]
  - - [4096, 1024, 1, 9600]
    - [209, 73.47]
  - - [64, 128, 1, 128]
    - [37, 0.036]
  - - [128, 64, 1, 128]
    - [295, 0.037]
  - - [5, 64, 1, 5]
    - [276, 0.0]
  - - [2048, 512, 1, 1]
    - [179, 0.035]
  - - [33, 32, 1, 33]
    - [31, 0.001]
  - - [1024, 1600, 1, 1]
    - [296, 0.054]
  - - [64, 1024, 32, 1024]
    - [225, 25.355]
  - - [2560, 1920, 1, 2048]
    - [104, 65.29]
  - - [1024, 3072, 1, 4096]
    - [297, 58.537]
  - - [2560, 2560, 1, 2048]
    - [298, 58.684]
  - - [2048, 2, 1, 2]
    - [82, 0.0]
  - - [1024, 64, 128, 1024]
    - [168, 32.967]
  - - [2048, 2048, 1, 2]
    - [95, 0.192]
  - - [1024, 64, 32, 1024]
    - [95, 23.523]
  - - [1024, 96, 64, 1024]
    - [299, 40.946]
  - - [1024, 30592, 1, 2048]
    - [246, 79.935]
  - - [1024, 3072, 1, 16384]
    - [300, 72.83]
  - - [6144, 1536, 1, 4096]
    - [203, 76.639]
  - - [1024, 1024, 1, 16]
    - [301, 0.612]
  - - [1536, 4608, 1, 8192]
    - [302, 79.063]
  - - [640, 2560, 1, 2048]
    - [62, 37.52]
  - - [1024, 4096, 1, 16384]
    - [200, 79.094]
  - - [64, 512, 40, 512]
    - [303, 13.161]
  - - [1024, 1024, 1, 16384]
    - [164, 55.843]
  - - [1536, 6144, 1, 4096]
    - [54, 76.357]
  - - [1024, 30592, 1, 4096]
    - [57, 86.638]
  - - [2560, 2560, 1, 4]
    - [304, 0.505]
  - - [1536, 1536, 1, 4096]
    - [121, 62.719]
  - - [2560, 7680, 1, 2048]
    - [250, 78.371]
  - - [64, 1024, 256, 1024]
    - [305, 37.87]
  - - [96, 1024, 64, 1024]
    - [71, 39.003]
  - - [1536, 50304, 1, 4096]
    - [57, 89.078]
  - - [2048, 8192, 1, 1024]
    - [123, 55.575]
  - - [1024, 30592, 1, 8192]
    - [246, 90.531]
  - - [512, 64, 256, 512]
    - [306, 26.13]
  - - [1024, 96, 128, 1024]
    - [299, 46.941]
  - - [64, 512, 128, 512]
    - [217, 22.077]
  - - [4096, 1024, 1, 16384]
    - [54, 74.909]
  - - [8192, 2048, 1, 1024]
    - [59, 54.524]
  - - [64, 1024, 64, 1024]
    - [307, 28.1]
  - - [1024, 50304, 1, 4096]
    - [308, 84.737]
  - - [1536, 4608, 1, 4096]
    - [309, 71.393]
  - - [512, 64, 128, 512]
    - [310, 21.597]
  - - [6144, 1536, 1, 8192]
    - [311, 80.773]
  - - [1024, 3072, 1, 8192]
    - [259, 63.89]
  - - [1536, 1536, 1, 8192]
    - [312, 70.581]
  - - [1536, 50304, 1, 8192]
    - [141, 92.019]
  - - [2560, 2, 1, 4]
    - [87, 0.001]
  - - [2048, 6144, 1, 1024]
    - [313, 49.858]
  - - [64, 1024, 128, 1024]
    - [314, 33.026]
  - - [1024, 64, 64, 1024]
    - [168, 29.776]
  - - [1024, 2, 1, 16]
    - [315, 0.001]
  - - [96, 1024, 128, 1024]
    - [316, 42.669]
  - - [2048, 30592, 1, 1024]
    - [281, 71.377]
  - - [64, 512, 256, 512]
    - [217, 26.13]
  - - [1536, 6144, 1, 8192]
    - [207, 80.806]
  - - [1024, 50304, 1, 2048]
    - [201, 78.667]
  - - [1024, 50304, 1, 8192]
    - [317, 89.494]
  - - [1024, 3072, 1, 2048]
    - [297, 48.639]
  - - [1024, 64, 256, 1024]
    - [245, 36.911]
  - - [1024, 50304, 1, 16384]
    - [318, 91.78]
  - - [512, 64, 40, 512]
    - [273, 13.791]
  - - [1024, 2, 1, 64]
    - [270, 0.006]
  - - [1024, 30528, 1, 8192]
    - [57, 90.891]
  - - [1024, 1024, 1, 64]
    - [148, 1.873]
  - - [64, 128, 1024, 128]
    - [4, 12.054]
  - - [128, 64, 1024, 128]
    - [319, 11.923]
  - - [1024, 1024, 1, 3456]
    - [99, 34.87]
  - - [1024, 1024, 1, 6912]
    - [195, 46.39]
  - - [1024, 1024, 1, 864]
    - [299, 16.781]
  - - [1024, 512, 1, 3456]
    - [320, 23.778]
  - - [1024, 512, 1, 4096]
    - [321, 26.383]
  - - [1024, 512, 1, 6912]
    - [143, 37.445]
  - - [1024, 512, 1, 864]
    - [63, 10.133]
  - - [256, 128, 1, 3456]
    - [322, 2.58]
  - - [256, 128, 1, 4096]
    - [323, 2.974]
  - - [256, 128, 1, 55296]
    - [110, 20.619]
  - - [256, 128, 1, 6912]
    - [0, 4.641]
  - - [256, 128, 1, 864]
    - [30, 0.665]
  - - [256, 3456, 1, 1]
    - [324, 0.025]
  - - [256, 4096, 1, 1]
    - [325, 0.036]
  - - [256, 6912, 1, 1]
    - [94, 0.059]
  - - [256, 864, 1, 1]
    - [140, 0.007]
  - - [480, 1024, 1, 3456]
    - [326, 22.195]
  - - [480, 1024, 1, 4096]
    - [327, 24.013]
  - - [480, 1024, 1, 6912]
    - [327, 33.758]
  - - [480, 1024, 1, 864]
    - [29, 8.361]
  - - [512, 256, 1, 3456]
    - [328, 7.583]
  - - [512, 256, 1, 4096]
    - [329, 10.055]
  - - [512, 256, 1, 55296]
    - [330, 51.015]
  - - [512, 256, 1, 6912]
    - [21, 14.886]
  - - [512, 256, 1, 864]
    - [30, 2.78]
  - - [30528, 1024, 1, 640]
    - [331, 56.605]
  - - [30528, 1024, 1, 1280]
    - [332, 73.028]
  - - [4096, 1024, 1, 10240]
    - [203, 73.111]
  - - [1024, 4096, 1, 10240]
    - [199, 75.769]
  - - [30528, 1024, 1, 1600]
    - [246, 75.2]
  - - [1024, 2, 1, 80]
    - [86, 0.007]
  - - [1024, 1024, 1, 10240]
    - [333, 47.592]
  - - [1024, 1024, 1, 80]
    - [241, 2.811]
  - - [64, 128, 1280, 128]
    - [314, 13.339]
  - - [128, 64, 1280, 128]
    - [334, 11.974]
  - - [1024, 4096, 1, 10496]
    - [172, 72.495]
  - - [30528, 1024, 1, 1640]
    - [332, 74.046]
  - - [4096, 1024, 1, 10496]
    - [104, 72.495]
  - - [1024, 1024, 1, 10496]
    - [189, 50.087]
  - - [1024, 1024, 1, 82]
    - [335, 2.588]
  - - [1024, 2, 1, 82]
    - [90, 0.006]
  - - [128, 64, 1312, 128]
    - [319, 12.745]
  - - [64, 128, 1312, 128]
    - [278, 13.319]
  - - [30528, 1024, 1, 160]
    - [73, 23.662]
  - - [1024, 4096, 1, 6144]
    - [199, 70.368]
  - - [30528, 1024, 1, 240]
    - [336, 34.37]
  - - [4096, 1024, 1, 6144]
    - [209, 69.842]
  - - [1024, 1024, 1, 12]
    - [140, 0.44]
  - - [1024, 2, 1, 12]
    - [180, 0.001]
  - - [1024, 1024, 1, 6144]
    - [195, 44.446]
  - - [64, 512, 192, 512]
    - [286, 25.669]
  - - [512, 64, 192, 512]
    - [337, 24.451]
  - - [13, 512, 1, 3456]
    - [338, 0.639]
  - - [13, 512, 1, 4096]
    - [339, 0.712]
  - - [13, 512, 1, 55296]
    - [339, 4.773]
  - - [13, 512, 1, 6912]
    - [106, 1.141]
  - - [13, 512, 1, 864]
    - [25, 0.138]
  - - [1024, 1024, 1, 10224]
    - [340, 49.839]
  - - [1024, 1024, 1, 10192]
    - [341, 49.8]
  - - [1024, 1024, 1, 10208]
    - [189, 50.225]
  - - [1024, 4096, 1, 10224]
    - [102, 75.926]
  - - [4096, 1024, 1, 10224]
    - [268, 71.344]
  - - [1024, 3072, 1, 10224]
    - [300, 66.139]
  - - [1024, 3072, 1, 10240]
    - [297, 67.836]
  - - [4096, 1024, 1, 10192]
    - [54, 71.19]
  - - [1024, 3072, 1, 10192]
    - [342, 66.411]
  - - [1024, 4096, 1, 10192]
    - [263, 71.995]
  - - [1024, 3072, 1, 10200]
    - [297, 64.171]
  - - [1024, 1024, 1, 10184]
    - [118, 50.795]
  - - [4096, 1024, 1, 10208]
    - [311, 71.974]
  - - [1024, 3072, 1, 10208]
    - [249, 64.802]
  - - [1024, 4096, 1, 10208]
    - [199, 78.121]
  - - [1024, 2048, 1, 10224]
    - [343, 60.474]
  - - [1024, 2048, 1, 10240]
    - [344, 59.84]
  - - [1024, 1024, 1, 10120]
    - [345, 50.023]
  - - [1024, 2048, 1, 10192]
    - [312, 61.547]
  - - [64, 24, 6816, 24]
    - [182, 2.708]
  - - [1024, 1024, 1, 10152]
    - [143, 48.804]
  - - [1024, 3072, 1, 10080]
    - [249, 68.63]
  - - [64, 26, 6272, 26]
    - [140, 3.247]
  - - [100352, 256, 1, 512]
    - [246, 50.134]
  - - [12544, 1024, 1, 2048]
    - [202, 64.68]
  - - [12544, 147, 1, 64]
    - [94, 2.916]
  - - [200704, 256, 1, 512]
    - [346, 52.733]
  - - [25088, 512, 1, 1024]
    - [74, 54.642]
  - - [3136, 576, 1, 64]
    - [306, 3.25]
  - - [50176, 512, 1, 1024]
    - [347, 64.475]
  - - [6272, 1024, 1, 2048]
    - [55, 54.34]
  - - [784, 1152, 1, 128]
    - [75, 3.544]
  - - [3136, 256, 128, 128]
    - [289, 29.752]
  - - [3136, 256, 256, 128]
    - [348, 32.023]
  - - [784, 512, 128, 256]
    - [59, 41.212]
  - - [784, 512, 256, 256]
    - [349, 47.562]
  - - [64, 128, 2048, 128]
    - [29, 14.317]
  - - [128, 64, 2048, 128]
    - [319, 14.105]
  - - [30528, 1024, 1, 2560]
    - [103, 80.876]
  - - [1024, 1024, 1, 128]
    - [269, 3.863]
  - - [1024, 2, 1, 128]
    - [96, 0.009]
  - - [128, 64, 1536, 128]
    - [350, 12.726]
  - - [64, 128, 1536, 128]
    - [274, 13.097]
  - - [1024, 4096, 1, 12288]
    - [101, 77.822]
  - - [30528, 1024, 1, 1920]
    - [141, 79.232]
  - - [1024, 1024, 1, 96]
    - [241, 3.224]
  - - [1024, 1024, 1, 12288]
    - [188, 48.689]
  - - [4096, 1024, 1, 12288]
    - [54, 74.111]
  - - [1024, 2, 1, 96]
    - [351, 0.007]
  - - [25600, 128, 25, 128]
    - [71, 25.19]
  - - [12544, 128, 36, 128]
    - [352, 23.371]
  - - [9216, 128, 49, 128]
    - [353, 23.038]
  - - [6400, 128, 64, 128]
    - [354, 22.805]
  - - [6400, 256, 25, 256]
    - [246, 39.382]
  - - [4096, 256, 36, 256]
    - [237, 37.2]
  - - [2304, 256, 49, 256]
    - [347, 35.694]
  - - [2304, 256, 64, 256]
    - [103, 37.776]
  - - [2304, 512, 25, 512]
    - [355, 48.017]
  - - [1024, 512, 36, 512]
    - [356, 45.308]
  - - [1024, 512, 49, 512]
    - [246, 49.718]
  - - [1024, 512, 64, 512]
    - [357, 52.886]
  - - [92416, 64, 25, 64]
    - [358, 13.205]
  - - [50176, 64, 36, 64]
    - [359, 13.292]
  - - [36864, 64, 49, 64]
    - [360, 13.194]
  - - [25600, 64, 64, 64]
    - [361, 12.881]
  - - [64, 128, 192, 128]
    - [187, 5.307]
  - - [128, 64, 192, 128]
    - [362, 5.003]
  - - [768, 2, 1, 2048]
    - [9, 0.084]
  - - [3072, 768, 1, 2048]
    - [312, 48.488]
  - - [768, 3072, 1, 2048]
    - [363, 48.368]
  - - [768, 768, 1, 2048]
    - [32, 18.102]
  - - [64, 384, 144, 384]
    - [364, 18.094]
  - - [384, 64, 144, 384]
    - [337, 16.894]
  - - [768, 2, 1, 4608]
    - [9, 0.15]
  - - [3072, 768, 1, 4608]
    - [123, 50.674]
  - - [768, 3072, 1, 4608]
    - [365, 50.042]
  - - [768, 768, 1, 4608]
    - [366, 34.846]
  - - [64, 512, 48, 512]
    - [367, 14.729]
  - - [512, 64, 48, 512]
    - [337, 15.073]
  - - [64, 128, 256, 128]
    - [4, 6.955]
  - - [128, 64, 256, 128]
    - [36, 6.71]
  - - [64, 384, 192, 384]
    - [282, 19.212]
  - - [384, 64, 192, 384]
    - [368, 19.962]
  - - [1024, 2, 1, 4608]
    - [97, 0.194]
  - - [4096, 1024, 1, 4608]
    - [135, 61.981]
  - - [1024, 4096, 1, 4608]
    - [102, 61.03]
  - - [1024, 1024, 1, 4608]
    - [188, 39.739]
  - - [196, 2304, 1, 256]
    - [369, 2.881]
  - - [49, 4608, 1, 512]
    - [109, 3.218]
  - - [196, 1024, 128, 512]
    - [370, 34.894]
  - - [196, 1024, 256, 512]
    - [371, 37.387]
  - - [49, 2048, 128, 512]
    - [248, 20.86]
  - - [49, 2048, 256, 512]
    - [230, 23.651]
  - - [49, 512, 128, 2048]
    - [248, 24.728]
  - - [49, 512, 256, 2048]
    - [307, 25.906]
  - - [4880, 256, 49, 256]
    - [372, 43.687]
  - - [3128, 256, 64, 256]
    - [59, 41.481]
  - - [4680, 256, 49, 256]
    - [61, 41.178]
  - - [5280, 256, 36, 256]
    - [71, 39.316]
  - - [2640, 256, 64, 256]
    - [373, 39.686]
  - - [5304, 256, 49, 256]
    - [372, 45.454]
  - - [2760, 256, 64, 256]
    - [71, 39.386]
  - - [6440, 256, 36, 256]
    - [372, 42.577]
  - - [5704, 256, 36, 256]
    - [309, 42.083]
  - - [2128, 256, 64, 256]
    - [374, 34.369]
  - - [1160, 256, 49, 256]
    - [374, 29.559]
  - - [4056, 256, 49, 256]
    - [251, 39.335]
  - - [6144, 256, 36, 256]
    - [375, 38.584]
  - - [6336, 256, 36, 256]
    - [244, 43.588]
  - - [13600, 512, 2, 128]
    - [237, 20.388]
  - - [15200, 512, 2, 128]
    - [376, 19.932]
  - - [15200, 128, 2, 512]
    - [259, 31.906]
  - - [13600, 128, 2, 512]
    - [236, 30.54]
  - - [5632, 256, 36, 256]
    - [372, 42.146]
  - - [12288, 128, 2, 512]
    - [377, 26.736]
  - - [12880, 128, 2, 512]
    - [242, 26.612]
  - - [768, 512, 2, 2048]
    - [378, 23.56]
  - - [11408, 128, 2, 512]
    - [236, 22.439]
  - - [13824, 512, 2, 128]
    - [257, 18.309]
  - - [13824, 128, 2, 512]
    - [73, 26.249]
  - - [10560, 128, 2, 512]
    - [314, 25.704]
  - - [10752, 128, 2, 512]
    - [379, 21.627]
  - - [13600, 512, 2, 256]
    - [244, 32.59]
  - - [15200, 512, 2, 256]
    - [267, 34.628]
  - - [768, 2048, 2, 512]
    - [380, 24.516]
  - - [12880, 512, 2, 128]
    - [381, 18.203]
  - - [11616, 128, 2, 512]
    - [382, 23.286]
  - - [14208, 512, 2, 128]
    - [55, 19.748]
  - - [11408, 512, 2, 128]
    - [141, 17.715]
  - - [6912, 256, 36, 256]
    - [250, 42.772]
  - - [672, 512, 2, 2048]
    - [383, 20.261]
  - - [13824, 512, 2, 256]
    - [349, 33.57]
  - - [11616, 512, 2, 128]
    - [73, 18.31]
  - - [12288, 512, 2, 128]
    - [242, 18.672]
  - - [14208, 128, 2, 512]
    - [384, 30.552]
  - - [11968, 128, 2, 512]
    - [242, 26.253]
  - - [864, 2048, 2, 512]
    - [385, 29.42]
  - - [1008, 512, 2, 2048]
    - [280, 27.671]
  - - [10560, 512, 2, 128]
    - [356, 18.737]
  - - [672, 2048, 2, 512]
    - [120, 21.736]
  - - [9408, 128, 2, 512]
    - [216, 20.4]
  - - [10752, 512, 2, 128]
    - [257, 16.873]
  - - [11968, 512, 2, 128]
    - [71, 19.87]
  - - [1240, 256, 49, 256]
    - [374, 34.112]
  - - [4032, 256, 2, 1024]
    - [386, 30.296]
  - - [888, 2048, 2, 512]
    - [356, 31.345]
  - - [12880, 512, 2, 256]
    - [267, 32.214]
  - - [12288, 512, 2, 256]
    - [237, 30.832]
  - - [13440, 128, 2, 512]
    - [385, 28.606]
  - - [864, 2048, 2, 256]
    - [73, 18.414]
  - - [12672, 128, 2, 512]
    - [73, 26.625]
  - - [11264, 128, 2, 512]
    - [119, 22.854]
  - - [11776, 128, 2, 512]
    - [387, 27.546]
  - - [16128, 128, 2, 512]
    - [73, 26.907]
  - - [4032, 1024, 2, 256]
    - [359, 23.987]
  - - [14000, 128, 2, 512]
    - [169, 27.754]
  - - [13440, 512, 2, 128]
    - [267, 19.736]
  - - [864, 512, 2, 2048]
    - [260, 26.586]
  - - [768, 2048, 2, 256]
    - [235, 16.841]
  - - [3264, 1024, 2, 256]
    - [381, 24.655]
  - - [888, 512, 2, 2048]
    - [388, 25.203]
  - - [4200, 256, 2, 1024]
    - [386, 30.238]
  - - [2352, 1024, 2, 256]
    - [356, 21.513]
  - - [56, 512, 64, 512]
    - [225, 15.711]
  - - [2400, 1024, 2, 256]
    - [73, 20.909]
  - - [15200, 256, 2, 12]
    - [359, 1.637]
  - - [840, 512, 2, 2048]
    - [378, 27.084]
  - - [12880, 256, 2, 12]
    - [180, 1.675]
  - - [2520, 1024, 2, 256]
    - [202, 20.498]
  - - [13600, 256, 2, 12]
    - [180, 1.619]
  - - [15200, 256, 2, 3]
    - [389, 0.451]
  - - [12880, 256, 2, 3]
    - [389, 0.366]
  - - [4200, 1024, 2, 256]
    - [250, 25.695]
  - - [12288, 256, 2, 12]
    - [140, 1.298]
  - - [768, 256, 2, 12]
    - [175, 0.189]
  - - [13824, 256, 2, 12]
    - [390, 1.551]
  - - [864, 256, 2, 3]
    - [391, 0.048]
  - - [176, 256, 2, 3]
    - [84, 0.009]
  - - [864, 256, 2, 12]
    - [392, 0.219]
  - - [13600, 256, 2, 3]
    - [216, 0.432]
  - - [768, 256, 2, 3]
    - [392, 0.043]
  - - [7600, 512, 1, 256]
    - [393, 21.589]
  - - [6144, 512, 1, 256]
    - [126, 17.258]
  - - [12544, 1024, 1, 1024]
    - [243, 51.183]
  - - [1024, 81, 1, 1024]
    - [7, 2.481]
  - - [176, 256, 2, 12]
    - [89, 0.046]
  - - [216, 256, 2, 3]
    - [86, 0.014]
  - - [192, 256, 2, 12]
    - [392, 0.051]
  - - [3800, 256, 2, 3]
    - [314, 0.2]
  - - [13824, 256, 2, 3]
    - [246, 0.426]
  - - [12288, 256, 2, 3]
    - [394, 0.375]
  - - [192, 256, 2, 3]
    - [87, 0.011]
  - - [216, 256, 2, 12]
    - [44, 0.058]
  - - [2688, 256, 2, 1024]
    - [395, 21.187]
  - - [3072, 256, 2, 12]
    - [306, 0.583]
  - - [3800, 256, 2, 12]
    - [396, 0.772]
  - - [3072, 256, 2, 3]
    - [180, 0.162]
  - - [2520, 256, 2, 1024]
    - [397, 23.653]
  - - [16128, 512, 2, 128]
    - [352, 21.053]
  - - [2400, 256, 2, 1024]
    - [188, 23.399]
  - - [2352, 256, 2, 1024]
    - [299, 20.393]
  - - [2944, 256, 2, 1024]
    - [398, 26.453]
  - - [2992, 1024, 2, 256]
    - [57, 21.712]
  - - [2816, 256, 2, 1024]
    - [395, 24.747]
  - - [2904, 1024, 2, 256]
    - [289, 21.81]
  - - [3456, 256, 2, 3]
    - [140, 0.136]
  - - [3400, 256, 2, 3]
    - [314, 0.136]
  - - [2816, 1024, 2, 256]
    - [399, 21.341]
  - - [3456, 256, 2, 12]
    - [279, 0.696]
  - - [2944, 1024, 2, 256]
    - [400, 23.549]
  - - [3168, 256, 2, 1024]
    - [242, 25.435]
  - - [2992, 256, 2, 1024]
    - [62, 23.388]
  - - [51520, 256, 2, 12]
    - [232, 2.363]
  - - [3072, 256, 2, 1024]
    - [387, 26.763]
  - - [2640, 1024, 2, 256]
    - [399, 23.811]
  - - [2688, 1024, 2, 256]
    - [356, 21.566]
  - - [2904, 256, 2, 1024]
    - [401, 23.086]
  - - [3264, 256, 2, 1024]
    - [402, 27.888]
  - - [54400, 256, 2, 12]
    - [73, 2.281]
  - - [55296, 256, 2, 3]
    - [331, 0.582]
  - - [60800, 256, 2, 12]
    - [403, 2.38]
  - - [51520, 256, 2, 3]
    - [94, 0.618]
  - - [55296, 256, 2, 12]
    - [73, 2.298]
  - - [3600, 1024, 2, 256]
    - [57, 28.771]
  - - [60800, 256, 2, 3]
    - [332, 0.599]
  - - [952, 256, 64, 256]
    - [404, 33.405]
  - - [49152, 256, 2, 12]
    - [399, 2.257]
  - - [3360, 256, 2, 1024]
    - [382, 29.263]
  - - [736, 256, 64, 256]
    - [73, 30.314]
  - - [600, 256, 64, 256]
    - [272, 28.959]
  - - [1440, 256, 49, 256]
    - [405, 35.368]
  - - [3168, 1024, 2, 256]
    - [399, 23.974]
  - - [1368, 256, 49, 256]
    - [406, 30.142]
  - - [49152, 256, 2, 3]
    - [407, 0.537]
  - - [3600, 256, 2, 1024]
    - [405, 30.024]
  - - [3360, 1024, 2, 256]
    - [73, 26.212]
  - - [54400, 256, 2, 3]
    - [358, 0.563]
  - - [3072, 1024, 2, 256]
    - [408, 23.482]
  - - [2640, 256, 2, 1024]
    - [191, 26.014]
  - - [616, 256, 64, 256]
    - [398, 28.23]
  - - [3008, 256, 64, 256]
    - [237, 41.825]
  - - [896, 256, 64, 256]
    - [250, 33.004]
  - - [768, 256, 64, 256]
    - [407, 28.649]
  - - [3552, 256, 2, 1024]
    - [405, 30.425]
  - - [3552, 1024, 2, 256]
    - [373, 24.561]
  - - [800, 256, 64, 256]
    - [385, 29.426]
  - - [1120, 256, 49, 256]
    - [356, 31.305]
  - - [2408, 256, 64, 256]
    - [409, 37.397]
  - - [3456, 256, 2, 1024]
    - [410, 32.399]
  - - [672, 256, 64, 256]
    - [356, 27.27]
  - - [3456, 1024, 2, 256]
    - [127, 23.472]
  - - [1064, 256, 49, 256]
    - [251, 30.072]
  - - [3400, 256, 2, 1024]
    - [377, 25.949]
  - - [704, 256, 64, 256]
    - [356, 31.191]
  - - [3400, 1024, 2, 256]
    - [411, 25.739]
  - - [3264, 256, 64, 256]
    - [372, 43.088]
  - - [3800, 1024, 2, 256]
    - [141, 28.596]
  - - [3800, 256, 2, 1024]
    - [73, 31.984]
  - - [6440, 512, 1, 256]
    - [237, 16.778]
  - - [6912, 512, 1, 256]
    - [352, 18.711]
  - - [6800, 512, 1, 256]
    - [381, 17.945]
  - - [6800, 512, 1, 1024]
    - [242, 41.225]
  - - [6440, 512, 1, 1024]
    - [259, 38.004]
  - - [6912, 512, 1, 1024]
    - [259, 39.869]
  - - [1728, 1024, 1, 512]
    - [242, 18.107]
  - - [1536, 1024, 1, 512]
    - [387, 16.71]
  - - [7600, 512, 1, 1024]
    - [259, 45.323]
  - - [6144, 512, 1, 1024]
    - [387, 36.496]
  - - [1728, 1024, 1, 2048]
    - [410, 38.615]
  - - [1536, 1024, 1, 2048]
    - [377, 37.723]
  - - [1024, 320, 1, 1024]
    - [36, 7.775]
  - - [173280, 64, 1, 128]
    - [358, 14.273]
  - - [25992, 64, 1, 128]
    - [324, 6.436]
  - - [4524, 256, 49, 256]
    - [380, 39.659]
  - - [2666, 256, 64, 256]
    - [412, 35.421]
  - - [950, 2048, 2, 512]
    - [233, 25.294]
  - - [3220, 1024, 2, 256]
    - [407, 20.705]
  - - [782, 128, 64, 128]
    - [284, 11.374]
  - - [850, 2048, 2, 512]
    - [413, 23.492]
  - - [713, 512, 2, 2048]
    - [414, 19.328]
  - - [805, 2048, 2, 512]
    - [119, 22.139]
  - - [713, 2048, 2, 512]
    - [415, 19.937]
  - - [660, 512, 2, 2048]
    - [414, 18.367]
  - - [726, 512, 2, 2048]
    - [414, 20.211]
  - - [660, 2048, 2, 512]
    - [119, 21.597]
  - - [726, 2048, 2, 512]
    - [380, 19.424]
  - - [748, 512, 2, 2048]
    - [414, 22.03]
  - - [805, 2048, 2, 256]
    - [60, 14.307]
  - - [1251, 256, 49, 256]
    - [416, 28.029]
  - - [805, 512, 2, 2048]
    - [417, 22.905]
  - - [850, 512, 2, 2048]
    - [418, 24.506]
  - - [850, 256, 2, 3]
    - [419, 0.052]
  - - [805, 256, 2, 12]
    - [276, 0.196]
  - - [228, 256, 2, 12]
    - [33, 0.055]
  - - [228, 256, 2, 3]
    - [25, 0.013]
  - - [805, 256, 2, 3]
    - [91, 0.044]
  - - [850, 256, 2, 12]
    - [46, 0.179]
  - - [187, 256, 2, 12]
    - [25, 0.039]
  - - [247, 256, 2, 12]
    - [420, 0.055]
  - - [950, 256, 2, 12]
    - [335, 0.189]
  - - [950, 256, 2, 3]
    - [108, 0.057]
  - - [1900, 1024, 1, 2048]
    - [421, 43.319]
  - - [1610, 1024, 1, 2048]
    - [126, 34.495]
  - - [1900, 1024, 1, 512]
    - [119, 16.584]
  - - [3220, 256, 2, 12]
    - [279, 0.62]
  - - [187, 256, 2, 3]
    - [31, 0.012]
  - - [221, 256, 2, 3]
    - [173, 0.014]
  - - [221, 256, 2, 12]
    - [422, 0.058]
  - - [247, 256, 2, 3]
    - [91, 0.016]
  - - [3220, 256, 2, 3]
    - [335, 0.163]
  - - [3036, 1024, 2, 256]
    - [412, 20.552]
  - - [3036, 256, 2, 1024]
    - [423, 23.586]
  - - [850, 2048, 2, 256]
    - [416, 14.671]
  - - [2852, 1024, 2, 256]
    - [119, 18.559]
  - - [950, 2048, 2, 256]
    - [221, 15.379]
  - - [3700, 1024, 2, 256]
    - [126, 22.099]
  - - [2852, 256, 2, 1024]
    - [424, 23.743]
  - - [3700, 256, 2, 1024]
    - [238, 25.571]
  - - [1269, 256, 49, 256]
    - [416, 26.373]
  - - [1467, 256, 49, 256]
    - [407, 22.336]
  - - [3500, 256, 2, 1024]
    - [65, 27.875]
  - - [1449, 256, 49, 256]
    - [119, 28.12]
  - - [1278, 256, 49, 256]
    - [74, 26.216]
  - - [1413, 256, 49, 256]
    - [425, 28.635]
  - - [1341, 256, 49, 256]
    - [400, 30.476]
  - - [1287, 256, 49, 256]
    - [380, 28.384]
  - - [1332, 256, 49, 256]
    - [426, 30.334]
  - - [1359, 256, 49, 256]
    - [427, 28.924]
  - - [1395, 256, 49, 256]
    - [119, 29.296]
  - - [1323, 256, 49, 256]
    - [74, 29.248]
  - - [1404, 256, 49, 256]
    - [413, 30.162]
  - - [1386, 256, 49, 256]
    - [416, 29.281]
  - - [1350, 256, 49, 256]
    - [428, 28.178]
  - - [3500, 1024, 2, 256]
    - [427, 23.47]
  - - [3220, 256, 2, 1024]
    - [222, 26.578]
  - - [690, 256, 64, 256]
    - [421, 24.571]
  - - [660, 256, 64, 256]
    - [370, 24.843]
  - - [782, 256, 64, 256]
    - [407, 27.122]
  - - [884, 256, 64, 256]
    - [126, 26.526]
  - - [1610, 1024, 1, 512]
    - [229, 16.442]
  - - [1700, 1024, 1, 512]
    - [142, 18.344]
  - - [1700, 1024, 1, 2048]
    - [429, 36.849]
  - - [100, 512, 120, 128]
    - [248, 9.488]
  - - [100, 512, 18, 128]
    - [107, 3.362]
  - - [100, 512, 19, 128]
    - [325, 3.675]
  - - [1444, 128, 120, 256]
    - [248, 26.586]
  - - [1444, 128, 18, 256]
    - [234, 17.011]
  - - [1444, 128, 19, 256]
    - [426, 17.987]
  - - [1444, 256, 120, 256]
    - [407, 35.916]
  - - [1444, 256, 18, 256]
    - [416, 24.078]
  - - [1444, 256, 19, 256]
    - [421, 20.64]
  - - [25, 256, 120, 128]
    - [46, 2.953]
  - - [25, 256, 18, 128]
    - [47, 0.517]
  - - [25, 256, 19, 128]
    - [91, 0.608]
  - - [361, 512, 120, 256]
    - [430, 26.023]
  - - [361, 512, 18, 256]
    - [221, 14.956]
  - - [361, 512, 19, 256]
    - [221, 15.535]
  - - [9, 256, 120, 128]
    - [420, 0.821]
  - - [9, 256, 18, 128]
    - [46, 0.152]
  - - [9, 256, 19, 128]
    - [276, 0.21]
  - - [100, 2304, 1, 512]
    - [46, 3.135]
  - - [1444, 576, 1, 128]
    - [369, 3.221]
  - - [25, 1152, 1, 256]
    - [83, 0.26]
  - - [27436, 64, 1, 128]
    - [218, 5.914]
  - - [361, 2304, 1, 512]
    - [218, 10.615]
  - - [9, 1152, 1, 256]
    - [25, 0.086]
  - - [96, 1024, 160, 1024]
    - [72, 46.081]
  - - [1024, 96, 160, 1024]
    - [277, 44.575]
  - - [1920, 25216, 1, 16384]
    - [431, 92.365]
  - - [3840, 1920, 1, 16384]
    - [432, 85.939]
  - - [1920, 3840, 1, 16384]
    - [433, 86.251]
  - - [960, 1920, 1, 16384]
    - [74, 71.742]
  - - [1920, 2880, 1, 16384]
    - [318, 85.383]
  - - [96, 1024, 40, 1024]
    - [352, 37.84]
  - - [1024, 96, 40, 1024]
    - [359, 38.817]
  - - [1920, 25216, 1, 4096]
    - [202, 85.907]
  - - [3840, 1920, 1, 4096]
    - [103, 73.028]
  - - [1920, 3840, 1, 4096]
    - [246, 74.887]
  - - [960, 1920, 1, 4096]
    - [387, 55.499]
  - - [1920, 2880, 1, 4096]
    - [125, 70.576]
  - - [96, 1024, 80, 1024]
    - [272, 37.793]
  - - [1024, 96, 80, 1024]
    - [100, 37.833]
  - - [1920, 25216, 1, 8192]
    - [201, 89.383]
  - - [3840, 1920, 1, 8192]
    - [434, 80.76]
  - - [1920, 3840, 1, 8192]
    - [372, 80.986]
  - - [960, 1920, 1, 8192]
    - [62, 55.491]
  - - [1920, 2880, 1, 8192]
    - [317, 79.909]
  - - [96, 1024, 96, 1024]
    - [435, 42.287]
  - - [1024, 96, 96, 1024]
    - [280, 43.499]
  - - [2304, 12672, 1, 16384]
    - [137, 93.169]
  - - [2304, 2304, 1, 16384]
    - [317, 82.147]
  - - [576, 2304, 1, 16384]
    - [436, 62.9]
  - - [2304, 1728, 1, 16384]
    - [133, 76.994]
  - - [96, 1024, 24, 1024]
    - [437, 30.506]
  - - [1024, 96, 24, 1024]
    - [299, 29.749]
  - - [2304, 12672, 1, 4096]
    - [123, 84.738]
  - - [2304, 2304, 1, 4096]
    - [438, 67.914]
  - - [576, 2304, 1, 4096]
    - [117, 50.212]
  - - [2304, 1728, 1, 4096]
    - [198, 62.806]
  - - [96, 1024, 48, 1024]
    - [409, 37.236]
  - - [1024, 96, 48, 1024]
    - [280, 36.61]
  - - [2304, 12672, 1, 8192]
    - [318, 90.523]
  - - [2304, 2304, 1, 8192]
    - [438, 77.159]
  - - [576, 2304, 1, 8192]
    - [277, 50.966]
  - - [2304, 1728, 1, 8192]
    - [102, 70.921]
  - - [96, 1024, 16, 1024]
    - [121, 21.633]
  - - [1024, 96, 16, 1024]
    - [56, 19.648]
  - - [3072, 6400, 1, 4096]
    - [281, 85.466]
  - - [1536, 3072, 1, 4096]
    - [104, 73.202]
  - - [3072, 1536, 1, 4096]
    - [268, 72.76]
  - - [384, 3072, 1, 4096]
    - [99, 43.173]
  - - [3072, 1152, 1, 4096]
    - [297, 68.055]
  - - [96, 1024, 32, 1024]
    - [359, 32.362]
  - - [1024, 96, 32, 1024]
    - [359, 30.688]
  - - [3072, 6400, 1, 8192]
    - [257, 90.55]
  - - [1536, 3072, 1, 8192]
    - [439, 78.508]
  - - [3072, 1536, 1, 8192]
    - [311, 78.818]
  - - [384, 3072, 1, 8192]
    - [440, 45.815]
  - - [3072, 1152, 1, 8192]
    - [250, 73.245]
  - - [2048, 2, 1, 8]
    - [85, 0.001]
  - - [2048, 2048, 1, 4096]
    - [172, 64.248]
  - - [2048, 2048, 1, 8]
    - [441, 0.77]
  - - [2048, 29000, 1, 199]
    - [272, 32.886]
  - - [2048, 29000, 1, 221]
    - [411, 32.568]
  - - [2048, 29000, 1, 224]
    - [281, 37.169]
  - - [2048, 29000, 1, 229]
    - [349, 36.371]
  - - [2048, 29000, 1, 234]
    - [442, 34.227]
  - - [2048, 29000, 1, 242]
    - [372, 36.847]
  - - [2048, 29000, 1, 246]
    - [57, 36.775]
  - - [2048, 29000, 1, 247]
    - [409, 37.455]
  - - [2048, 29000, 1, 256]
    - [281, 42.3]
  - - [2048, 29000, 1, 262]
    - [354, 38.021]
  - - [2048, 29000, 1, 264]
    - [409, 38.981]
  - - [2048, 29000, 1, 265]
    - [272, 38.504]
  - - [2048, 29000, 1, 274]
    - [349, 39.664]
  - - [2048, 29000, 1, 277]
    - [294, 40.98]
  - - [2048, 29000, 1, 279]
    - [443, 40.967]
  - - [2048, 29000, 1, 288]
    - [257, 44.37]
  - - [2048, 29000, 1, 296]
    - [442, 42.469]
  - - [2048, 29000, 1, 315]
    - [444, 44.515]
  - - [2048, 29000, 1, 335]
    - [442, 43.526]
  - - [2048, 4096, 1, 4096]
    - [261, 68.676]
  - - [4096, 2048, 1, 4096]
    - [125, 68.597]
  - - [1024, 29000, 1, 2283]
    - [57, 75.919]
  - - [1024, 29000, 1, 2296]
    - [251, 76.676]
  - - [1024, 29000, 1, 2306]
    - [372, 76.974]
  - - [1024, 29000, 1, 2309]
    - [246, 77.477]
  - - [1024, 29000, 1, 2318]
    - [251, 75.689]
  - - [1024, 29000, 1, 2320]
    - [250, 77.476]
  - - [1024, 29000, 1, 2324]
    - [59, 76.527]
  - - [1024, 29000, 1, 2325]
    - [251, 76.136]
  - - [1024, 29000, 1, 2329]
    - [250, 76.55]
  - - [1024, 29000, 1, 2338]
    - [59, 76.748]
  - - [1024, 29000, 1, 2345]
    - [372, 76.998]
  - - [1024, 29000, 1, 2350]
    - [250, 76.458]
  - - [1024, 29000, 1, 2362]
    - [372, 76.971]
  - - [1024, 29000, 1, 2366]
    - [250, 76.84]
  - - [1024, 29000, 1, 2368]
    - [59, 77.384]
  - - [1024, 29000, 1, 2374]
    - [103, 77.333]
  - - [1024, 29000, 1, 2390]
    - [57, 77.584]
  - - [512, 64, 320, 512]
    - [445, 25.126]
  - - [64, 512, 320, 512]
    - [446, 24.914]
  - - [1024, 1024, 1, 20]
    - [98, 0.665]
  - - [1024, 2, 1, 20]
    - [179, 0.001]
  - - [1024, 29000, 1, 561]
    - [103, 49.298]
  - - [1024, 29000, 1, 574]
    - [58, 49.323]
  - - [1024, 29000, 1, 600]
    - [55, 49.863]
  - - [1024, 29000, 1, 608]
    - [443, 50.884]
  - - [1024, 29000, 1, 615]
    - [57, 51.719]
  - - [1024, 29000, 1, 622]
    - [442, 51.555]
  - - [1024, 29000, 1, 625]
    - [336, 51.971]
  - - [1024, 29000, 1, 626]
    - [447, 50.896]
  - - [1024, 29000, 1, 628]
    - [447, 54.662]
  - - [1024, 29000, 1, 636]
    - [55, 52.518]
  - - [1024, 29000, 1, 651]
    - [59, 53.808]
  - - [1024, 29000, 1, 658]
    - [332, 53.728]
  - - [1024, 29000, 1, 669]
    - [349, 53.406]
  - - [1024, 29000, 1, 670]
    - [442, 54.943]
  - - [1024, 29000, 1, 672]
    - [444, 55.566]
  - - [1024, 29000, 1, 684]
    - [246, 55.336]
  - - [1024, 29000, 1, 716]
    - [444, 57.869]
  - - [1024, 29000, 1, 730]
    - [372, 53.842]
  - - [512, 64, 80, 512]
    - [396, 19.14]
  - - [2560, 2, 1, 2]
    - [448, 0.0]
  - - [2560, 2560, 1, 1024]
    - [272, 47.628]
  - - [2560, 2560, 1, 2]
    - [51, 0.225]
  - - [2560, 29000, 1, 109]
    - [449, 21.744]
  - - [2560, 29000, 1, 121]
    - [356, 24.356]
  - - [2560, 29000, 1, 27]
    - [450, 6.677]
  - - [2560, 29000, 1, 35]
    - [70, 8.506]
  - - [2560, 29000, 1, 36]
    - [67, 8.537]
  - - [2560, 29000, 1, 39]
    - [67, 9.212]
  - - [2560, 29000, 1, 40]
    - [235, 9.174]
  - - [2560, 29000, 1, 42]
    - [450, 9.733]
  - - [2560, 29000, 1, 43]
    - [411, 10.021]
  - - [2560, 29000, 1, 44]
    - [408, 10.08]
  - - [2560, 29000, 1, 46]
    - [73, 10.786]
  - - [2560, 29000, 1, 48]
    - [70, 12.376]
  - - [2560, 29000, 1, 49]
    - [451, 11.618]
  - - [2560, 29000, 1, 50]
    - [71, 11.718]
  - - [2560, 29000, 1, 51]
    - [265, 11.789]
  - - [2560, 29000, 1, 53]
    - [358, 12.551]
  - - [2560, 29000, 1, 54]
    - [235, 12.807]
  - - [2560, 29000, 1, 55]
    - [441, 12.844]
  - - [2560, 29000, 1, 56]
    - [233, 12.863]
  - - [2560, 29000, 1, 57]
    - [233, 13.213]
  - - [2560, 29000, 1, 58]
    - [265, 13.417]
  - - [2560, 29000, 1, 59]
    - [73, 12.988]
  - - [2560, 29000, 1, 61]
    - [408, 14.482]
  - - [2560, 29000, 1, 63]
    - [265, 14.617]
  - - [2560, 29000, 1, 65]
    - [451, 15.327]
  - - [2560, 29000, 1, 66]
    - [70, 15.812]
  - - [2560, 29000, 1, 67]
    - [441, 15.612]
  - - [2560, 29000, 1, 69]
    - [451, 15.873]
  - - [2560, 29000, 1, 70]
    - [451, 16.425]
  - - [2560, 29000, 1, 71]
    - [73, 16.306]
  - - [2560, 29000, 1, 73]
    - [381, 15.537]
  - - [2560, 29000, 1, 74]
    - [450, 16.271]
  - - [2560, 29000, 1, 75]
    - [70, 16.091]
  - - [2560, 29000, 1, 77]
    - [399, 15.511]
  - - [2560, 29000, 1, 78]
    - [70, 16.869]
  - - [2560, 29000, 1, 80]
    - [430, 19.033]
  - - [2560, 29000, 1, 81]
    - [451, 17.993]
  - - [2560, 29000, 1, 82]
    - [450, 17.559]
  - - [2560, 29000, 1, 83]
    - [72, 17.862]
  - - [2560, 29000, 1, 84]
    - [233, 18.555]
  - - [2560, 29000, 1, 88]
    - [408, 19.214]
  - - [2560, 29000, 1, 89]
    - [272, 18.113]
  - - [2560, 29000, 1, 90]
    - [451, 18.654]
  - - [2560, 29000, 1, 92]
    - [374, 19.582]
  - - [2560, 29000, 1, 95]
    - [435, 19.639]
  - - [2560, 29000, 1, 98]
    - [332, 20.183]
  - - [2560, 4096, 1, 1024]
    - [452, 52.38]
  - - [4096, 2560, 1, 1024]
    - [444, 53.063]
  - - [1024, 64, 512, 1024]
    - [453, 37.557]
  - - [64, 1024, 512, 1024]
    - [224, 38.037]
  - - [1024, 3072, 1, 32768]
    - [113, 81.385]
  - - [1024, 4096, 1, 32768]
    - [101, 82.812]
  - - [1024, 50304, 1, 32768]
    - [318, 92.901]
  - - [4096, 1024, 1, 32768]
    - [209, 83.228]
  - - [1024, 128, 24, 1024]
    - [387, 37.688]
  - - [128, 1024, 24, 1024]
    - [382, 39.195]
  - - [64, 224, 384, 224]
    - [94, 15.209]
  - - [224, 64, 384, 224]
    - [454, 14.971]
  - - [768, 3, 1, 32]
    - [33, 0.003]
  - - [768, 768, 1, 32]
    - [75, 0.687]
  - - [3072, 768, 1, 7168]
    - [455, 63.952]
  - - [768, 3072, 1, 7168]
    - [363, 64.414]
  - - [768, 768, 1, 7168]
    - [321, 43.874]
  - - [3072, 1024, 1, 4096]
    - [131, 58.205]
  - - [224, 4000, 1, 7168]
    - [321, 41.212]
  - - [1000, 4000, 1, 224]
    - [359, 17.396]
  - - [1000, 4000, 1, 6944]
    - [261, 69.726]
  - - [1000, 4000, 1, 7168]
    - [456, 70.079]
  - - [1000, 100, 1, 32]
    - [96, 0.135]
  - - [224, 4000, 1, 224]
    - [75, 5.951]
  - - [50257, 1024, 1, 4096]
    - [457, 81.606]
  - - [1024, 3072, 1, 4896]
    - [458, 58.791]
  - - [1024, 1024, 1, 4896]
    - [189, 39.764]
  - - [1024, 4096, 1, 4896]
    - [199, 65.682]
  - - [4096, 1024, 1, 4896]
    - [104, 66.35]
  - - [1024, 3072, 1, 5552]
    - [272, 58.908]
  - - [1024, 1024, 1, 5552]
    - [189, 42.489]
  - - [1024, 4096, 1, 5552]
    - [456, 64.813]
  - - [4096, 1024, 1, 5552]
    - [104, 64.84]
  - - [1024, 3072, 1, 5888]
    - [459, 60.173]
  - - [1024, 1024, 1, 5888]
    - [189, 43.254]
  - - [1024, 4096, 1, 5888]
    - [200, 69.297]
  - - [4096, 1024, 1, 5888]
    - [54, 67.935]
  - - [1024, 3072, 1, 6128]
    - [302, 62.249]
  - - [1024, 1024, 1, 6128]
    - [195, 46.677]
  - - [1024, 4096, 1, 6128]
    - [102, 69.772]
  - - [4096, 1024, 1, 6128]
    - [52, 65.721]
  - - [1024, 3072, 1, 6688]
    - [384, 61.493]
  - - [1024, 1024, 1, 6688]
    - [189, 44.829]
  - - [1024, 4096, 1, 6688]
    - [104, 68.921]
  - - [4096, 1024, 1, 6688]
    - [104, 67.843]
  - - [1024, 3072, 1, 5664]
    - [458, 62.581]
  - - [1024, 1024, 1, 5664]
    - [189, 45.275]
  - - [1024, 4096, 1, 5664]
    - [54, 65.398]
  - - [4096, 1024, 1, 5664]
    - [203, 66.317]
  - - [1024, 3072, 1, 6048]
    - [103, 62.014]
  - - [1024, 1024, 1, 6048]
    - [195, 45.566]
  - - [1024, 4096, 1, 6048]
    - [101, 71.019]
  - - [4096, 1024, 1, 6048]
    - [209, 70.195]
  - - [1024, 3072, 1, 5984]
    - [120, 61.461]
  - - [1024, 1024, 1, 5984]
    - [195, 44.697]
  - - [1024, 4096, 1, 5984]
    - [460, 68.844]
  - - [4096, 1024, 1, 5984]
    - [209, 68.583]
  - - [1024, 3072, 1, 7872]
    - [59, 62.871]
  - - [1024, 1024, 1, 7872]
    - [190, 49.57]
  - - [1024, 4096, 1, 7872]
    - [199, 70.084]
  - - [4096, 1024, 1, 7872]
    - [209, 71.268]
  - - [1024, 3072, 1, 5920]
    - [62, 59.454]
  - - [1024, 1024, 1, 5920]
    - [195, 43.9]
  - - [1024, 4096, 1, 5920]
    - [101, 68.888]
  - - [4096, 1024, 1, 5920]
    - [54, 69.407]
  - - [1024, 3072, 1, 7344]
    - [297, 64.846]
  - - [1024, 1024, 1, 7344]
    - [195, 48.201]
  - - [1024, 4096, 1, 7344]
    - [460, 70.679]
  - - [4096, 1024, 1, 7344]
    - [311, 67.813]
  - - [1024, 3072, 1, 7760]
    - [457, 58.769]
  - - [1024, 1024, 1, 7760]
    - [190, 48.518]
  - - [1024, 4096, 1, 7760]
    - [263, 69.671]
  - - [4096, 1024, 1, 7760]
    - [209, 70.538]
  - - [1024, 3072, 1, 5136]
    - [461, 60.617]
  - - [1024, 1024, 1, 5136]
    - [195, 41.174]
  - - [1024, 4096, 1, 5136]
    - [102, 66.577]
  - - [4096, 1024, 1, 5136]
    - [204, 60.454]
  - - [1024, 3072, 1, 6336]
    - [384, 63.98]
  - - [1024, 1024, 1, 6336]
    - [190, 45.956]
  - - [1024, 4096, 1, 6336]
    - [102, 71.741]
  - - [4096, 1024, 1, 6336]
    - [210, 64.547]
  - - [1024, 3072, 1, 7184]
    - [130, 62.87]
  - - [1024, 1024, 1, 7184]
    - [190, 46.254]
  - - [1024, 4096, 1, 7184]
    - [101, 72.797]
  - - [4096, 1024, 1, 7184]
    - [462, 65.639]
  - - [1024, 3072, 1, 5936]
    - [281, 60.526]
  - - [1024, 1024, 1, 5936]
    - [189, 43.853]
  - - [1024, 4096, 1, 5936]
    - [199, 68.241]
  - - [4096, 1024, 1, 5936]
    - [209, 66.061]
  - - [1024, 3072, 1, 6608]
    - [126, 58.296]
  - - [1024, 1024, 1, 6608]
    - [189, 44.565]
  - - [1024, 4096, 1, 6608]
    - [460, 67.542]
  - - [4096, 1024, 1, 6608]
    - [210, 67.643]
  - - [1024, 3072, 1, 5616]
    - [372, 59.083]
  - - [1024, 1024, 1, 5616]
    - [195, 40.739]
  - - [1024, 4096, 1, 5616]
    - [133, 65.062]
  - - [4096, 1024, 1, 5616]
    - [313, 65.396]
  - - [1024, 3072, 1, 5904]
    - [259, 60.925]
  - - [1024, 1024, 1, 5904]
    - [190, 44.773]
  - - [1024, 4096, 1, 5904]
    - [101, 69.329]
  - - [4096, 1024, 1, 5904]
    - [135, 60.491]
  - - [1024, 3072, 1, 6624]
    - [130, 59.681]
  - - [1024, 1024, 1, 6624]
    - [189, 46.458]
  - - [1024, 4096, 1, 6624]
    - [200, 68.042]
  - - [4096, 1024, 1, 6624]
    - [206, 68.289]
  - - [1024, 3072, 1, 6416]
    - [251, 60.05]
  - - [1024, 1024, 1, 6416]
    - [189, 44.465]
  - - [1024, 4096, 1, 6416]
    - [134, 67.321]
  - - [4096, 1024, 1, 6416]
    - [209, 67.093]
  - - [1024, 3072, 1, 5344]
    - [463, 58.767]
  - - [1024, 1024, 1, 5344]
    - [195, 42.791]
  - - [1024, 4096, 1, 5344]
    - [101, 69.848]
  - - [4096, 1024, 1, 5344]
    - [136, 63.334]
  - - [1024, 3072, 1, 7024]
    - [464, 61.918]
  - - [1024, 1024, 1, 7024]
    - [190, 47.972]
  - - [1024, 4096, 1, 7024]
    - [200, 72.139]
  - - [4096, 1024, 1, 7024]
    - [104, 66.0]
  - - [1024, 3072, 1, 5776]
    - [401, 58.573]
  - - [1024, 1024, 1, 5776]
    - [189, 43.853]
  - - [1024, 4096, 1, 5776]
    - [199, 67.347]
  - - [4096, 1024, 1, 5776]
    - [268, 67.781]
  - - [1024, 3072, 1, 7536]
    - [131, 63.183]
  - - [1024, 1024, 1, 7536]
    - [190, 49.405]
  - - [1024, 4096, 1, 7536]
    - [268, 69.498]
  - - [4096, 1024, 1, 7536]
    - [104, 68.605]
  - - [1024, 3072, 1, 7040]
    - [355, 61.485]
  - - [1024, 1024, 1, 7040]
    - [195, 47.387]
  - - [1024, 4096, 1, 7040]
    - [199, 71.854]
  - - [4096, 1024, 1, 7040]
    - [54, 70.485]
  - - [1024, 3072, 1, 6512]
    - [465, 61.704]
  - - [1024, 1024, 1, 6512]
    - [195, 43.588]
  - - [1024, 4096, 1, 6512]
    - [135, 67.616]
  - - [4096, 1024, 1, 6512]
    - [54, 67.244]
  - - [1024, 3072, 1, 6544]
    - [331, 58.673]
  - - [1024, 1024, 1, 6544]
    - [341, 43.59]
  - - [1024, 4096, 1, 6544]
    - [172, 66.623]
  - - [4096, 1024, 1, 6544]
    - [104, 67.065]
  - - [1024, 3072, 1, 5472]
    - [371, 59.653]
  - - [1024, 1024, 1, 5472]
    - [190, 42.778]
  - - [1024, 4096, 1, 5472]
    - [285, 64.591]
  - - [4096, 1024, 1, 5472]
    - [285, 63.523]
  - - [1024, 3072, 1, 7232]
    - [130, 63.694]
  - - [1024, 1024, 1, 7232]
    - [189, 47.108]
  - - [1024, 4096, 1, 7232]
    - [101, 74.388]
  - - [4096, 1024, 1, 7232]
    - [268, 66.523]
  - - [1024, 3072, 1, 6368]
    - [129, 63.725]
  - - [1024, 1024, 1, 6368]
    - [195, 43.49]
  - - [1024, 4096, 1, 6368]
    - [199, 71.567]
  - - [4096, 1024, 1, 6368]
    - [209, 65.657]
  - - [1024, 3072, 1, 6736]
    - [249, 62.371]
  - - [1024, 1024, 1, 6736]
    - [195, 46.778]
  - - [1024, 4096, 1, 6736]
    - [101, 68.671]
  - - [4096, 1024, 1, 6736]
    - [104, 68.765]
  - - [1024, 3072, 1, 7152]
    - [331, 62.584]
  - - [1024, 1024, 1, 7152]
    - [195, 46.652]
  - - [1024, 4096, 1, 7152]
    - [200, 71.772]
  - - [4096, 1024, 1, 7152]
    - [52, 66.412]
  - - [1024, 3072, 1, 5296]
    - [246, 56.439]
  - - [1024, 1024, 1, 5296]
    - [190, 40.534]
  - - [1024, 4096, 1, 5296]
    - [210, 62.231]
  - - [4096, 1024, 1, 5296]
    - [210, 61.54]
  - - [1024, 3072, 1, 5312]
    - [430, 54.61]
  - - [1024, 1024, 1, 5312]
    - [190, 41.315]
  - - [1024, 4096, 1, 5312]
    - [101, 68.889]
  - - [4096, 1024, 1, 5312]
    - [285, 62.316]
  - - [1024, 3072, 1, 8736]
    - [466, 66.566]
  - - [1024, 1024, 1, 8736]
    - [320, 44.009]
  - - [1024, 4096, 1, 8736]
    - [133, 71.906]
  - - [4096, 1024, 1, 8736]
    - [268, 72.312]
  - - [1024, 3072, 1, 5872]
    - [466, 60.744]
  - - [1024, 1024, 1, 5872]
    - [195, 43.925]
  - - [1024, 4096, 1, 5872]
    - [101, 69.152]
  - - [4096, 1024, 1, 5872]
    - [209, 68.097]
  - - [1024, 3072, 1, 6080]
    - [103, 61.842]
  - - [1024, 1024, 1, 6080]
    - [189, 42.651]
  - - [1024, 4096, 1, 6080]
    - [200, 69.118]
  - - [4096, 1024, 1, 6080]
    - [209, 69.706]
  - - [1024, 3072, 1, 6000]
    - [259, 61.152]
  - - [1024, 1024, 1, 6000]
    - [189, 44.083]
  - - [1024, 4096, 1, 6000]
    - [101, 69.933]
  - - [4096, 1024, 1, 6000]
    - [209, 67.637]
  - - [1024, 3072, 1, 6960]
    - [357, 61.278]
  - - [1024, 1024, 1, 6960]
    - [195, 47.389]
  - - [1024, 4096, 1, 6960]
    - [199, 68.853]
  - - [4096, 1024, 1, 6960]
    - [209, 69.471]
  - - [1024, 3072, 1, 6848]
    - [384, 61.428]
  - - [1024, 1024, 1, 6848]
    - [195, 48.343]
  - - [1024, 4096, 1, 6848]
    - [263, 69.933]
  - - [4096, 1024, 1, 6848]
    - [207, 69.311]
  - - [1024, 3072, 1, 5056]
    - [297, 61.415]
  - - [1024, 1024, 1, 5056]
    - [189, 41.614]
  - - [1024, 4096, 1, 5056]
    - [199, 67.345]
  - - [4096, 1024, 1, 5056]
    - [209, 67.414]
  - - [1024, 3072, 1, 8016]
    - [459, 62.057]
  - - [1024, 1024, 1, 8016]
    - [195, 48.433]
  - - [1024, 4096, 1, 8016]
    - [102, 73.258]
  - - [4096, 1024, 1, 8016]
    - [209, 71.525]
  - - [1024, 3072, 1, 6976]
    - [297, 63.736]
  - - [1024, 1024, 1, 6976]
    - [189, 47.652]
  - - [1024, 4096, 1, 6976]
    - [200, 72.489]
  - - [4096, 1024, 1, 6976]
    - [209, 70.33]
  - - [1024, 3072, 1, 5744]
    - [127, 57.343]
  - - [1024, 1024, 1, 5744]
    - [195, 43.92]
  - - [1024, 4096, 1, 5744]
    - [198, 65.241]
  - - [4096, 1024, 1, 5744]
    - [104, 67.393]
  - - [1024, 3072, 1, 5728]
    - [255, 58.815]
  - - [1024, 1024, 1, 5728]
    - [189, 43.892]
  - - [1024, 4096, 1, 5728]
    - [172, 66.162]
  - - [4096, 1024, 1, 5728]
    - [203, 65.975]
  - - [1024, 3072, 1, 5632]
    - [467, 57.476]
  - - [1024, 1024, 1, 5632]
    - [195, 43.139]
  - - [1024, 4096, 1, 5632]
    - [133, 66.507]
  - - [4096, 1024, 1, 5632]
    - [209, 67.153]
  - - [1024, 3072, 1, 6176]
    - [384, 62.668]
  - - [1024, 1024, 1, 6176]
    - [341, 42.94]
  - - [1024, 4096, 1, 6176]
    - [200, 70.725]
  - - [4096, 1024, 1, 6176]
    - [209, 69.751]
  - - [1024, 3072, 1, 5504]
    - [384, 60.05]
  - - [1024, 1024, 1, 5504]
    - [190, 42.927]
  - - [1024, 4096, 1, 5504]
    - [207, 64.266]
  - - [4096, 1024, 1, 5504]
    - [209, 67.095]
  - - [1024, 3072, 1, 5488]
    - [346, 59.712]
  - - [1024, 1024, 1, 5488]
    - [195, 44.45]
  - - [1024, 4096, 1, 5488]
    - [101, 65.087]
  - - [4096, 1024, 1, 5488]
    - [462, 64.943]
  - - [1024, 3072, 1, 5456]
    - [259, 55.567]
  - - [1024, 1024, 1, 5456]
    - [190, 40.505]
  - - [1024, 4096, 1, 5456]
    - [203, 62.789]
  - - [4096, 1024, 1, 5456]
    - [203, 63.339]
  - - [1024, 3072, 1, 6640]
    - [387, 60.427]
  - - [1024, 1024, 1, 6640]
    - [195, 46.075]
  - - [1024, 4096, 1, 6640]
    - [468, 66.778]
  - - [4096, 1024, 1, 6640]
    - [104, 66.442]
  - - [1024, 3072, 1, 7440]
    - [469, 63.412]
  - - [1024, 1024, 1, 7440]
    - [195, 49.416]
  - - [1024, 4096, 1, 7440]
    - [135, 67.759]
  - - [4096, 1024, 1, 7440]
    - [104, 68.397]
  - - [1024, 3072, 1, 6432]
    - [387, 58.773]
  - - [1024, 1024, 1, 6432]
    - [195, 44.092]
  - - [1024, 4096, 1, 6432]
    - [102, 72.215]
  - - [4096, 1024, 1, 6432]
    - [470, 65.365]
  - - [1024, 3072, 1, 6288]
    - [469, 62.878]
  - - [1024, 1024, 1, 6288]
    - [195, 45.896]
  - - [1024, 4096, 1, 6288]
    - [198, 65.458]
  - - [4096, 1024, 1, 6288]
    - [470, 63.752]
  - - [1024, 3072, 1, 4704]
    - [272, 56.343]
  - - [1024, 1024, 1, 4704]
    - [189, 37.774]
  - - [1024, 4096, 1, 4704]
    - [133, 62.782]
  - - [4096, 1024, 1, 4704]
    - [209, 62.544]
  - - [1024, 3072, 1, 6256]
    - [132, 61.842]
  - - [1024, 1024, 1, 6256]
    - [195, 45.69]
  - - [1024, 4096, 1, 6256]
    - [102, 70.072]
  - - [4096, 1024, 1, 6256]
    - [206, 65.607]
  - - [1024, 3072, 1, 7264]
    - [355, 64.024]
  - - [1024, 1024, 1, 7264]
    - [189, 48.064]
  - - [1024, 4096, 1, 7264]
    - [199, 72.529]
  - - [4096, 1024, 1, 7264]
    - [104, 70.256]
  - - [1024, 3072, 1, 6672]
    - [267, 57.981]
  - - [1024, 1024, 1, 6672]
    - [189, 46.235]
  - - [1024, 4096, 1, 6672]
    - [460, 67.32]
  - - [4096, 1024, 1, 6672]
    - [104, 67.912]
  - - [1024, 3072, 1, 6304]
    - [342, 63.046]
  - - [1024, 1024, 1, 6304]
    - [189, 45.268]
  - - [1024, 4096, 1, 6304]
    - [199, 71.857]
  - - [4096, 1024, 1, 6304]
    - [210, 64.806]
  - - [1024, 3072, 1, 5520]
    - [131, 60.378]
  - - [1024, 1024, 1, 5520]
    - [189, 41.034]
  - - [1024, 4096, 1, 5520]
    - [200, 65.007]
  - - [4096, 1024, 1, 5520]
    - [206, 63.02]
  - - [1024, 3072, 1, 6208]
    - [297, 62.642]
  - - [1024, 1024, 1, 6208]
    - [189, 44.194]
  - - [1024, 4096, 1, 6208]
    - [200, 70.911]
  - - [4096, 1024, 1, 6208]
    - [135, 62.726]
  - - [1024, 3072, 1, 4976]
    - [297, 60.545]
  - - [1024, 1024, 1, 4976]
    - [189, 41.679]
  - - [1024, 4096, 1, 4976]
    - [102, 67.265]
  - - [4096, 1024, 1, 4976]
    - [209, 65.421]
  - - [1024, 3072, 1, 5360]
    - [59, 56.563]
  - - [1024, 1024, 1, 5360]
    - [189, 43.246]
  - - [1024, 4096, 1, 5360]
    - [198, 63.325]
  - - [4096, 1024, 1, 5360]
    - [204, 61.784]
  - - [1024, 3072, 1, 5392]
    - [459, 57.995]
  - - [1024, 1024, 1, 5392]
    - [195, 42.563]
  - - [1024, 4096, 1, 5392]
    - [263, 61.908]
  - - [4096, 1024, 1, 5392]
    - [135, 62.01]
  - - [1024, 3072, 1, 5376]
    - [129, 55.94]
  - - [1024, 1024, 1, 5376]
    - [189, 42.314]
  - - [1024, 4096, 1, 5376]
    - [172, 62.984]
  - - [4096, 1024, 1, 5376]
    - [136, 62.969]
  - - [1024, 3072, 1, 5328]
    - [259, 52.423]
  - - [1024, 1024, 1, 5328]
    - [189, 41.17]
  - - [1024, 4096, 1, 5328]
    - [207, 63.372]
  - - [4096, 1024, 1, 5328]
    - [135, 60.611]
  - - [1024, 3072, 1, 6448]
    - [130, 58.668]
  - - [1024, 1024, 1, 6448]
    - [189, 45.689]
  - - [1024, 4096, 1, 6448]
    - [207, 65.848]
  - - [4096, 1024, 1, 6448]
    - [210, 66.773]
  - - [1024, 3072, 1, 5424]
    - [139, 59.462]
  - - [1024, 1024, 1, 5424]
    - [195, 43.139]
  - - [1024, 4096, 1, 5424]
    - [133, 63.752]
  - - [4096, 1024, 1, 5424]
    - [208, 63.422]
  - - [1024, 3072, 1, 6464]
    - [458, 63.833]
  - - [1024, 1024, 1, 6464]
    - [190, 44.741]
  - - [1024, 4096, 1, 6464]
    - [172, 67.694]
  - - [4096, 1024, 1, 6464]
    - [470, 65.088]
  - - [1024, 3072, 1, 7376]
    - [249, 63.467]
  - - [1024, 1024, 1, 7376]
    - [189, 46.633]
  - - [1024, 4096, 1, 7376]
    - [102, 69.564]
  - - [4096, 1024, 1, 7376]
    - [135, 65.815]
  - - [1024, 3072, 1, 5104]
    - [461, 57.981]
  - - [1024, 1024, 1, 5104]
    - [189, 42.466]
  - - [1024, 4096, 1, 5104]
    - [102, 66.6]
  - - [4096, 1024, 1, 5104]
    - [209, 63.718]
  - - [1024, 3072, 1, 6224]
    - [469, 61.58]
  - - [1024, 1024, 1, 6224]
    - [190, 42.66]
  - - [1024, 4096, 1, 6224]
    - [102, 66.606]
  - - [4096, 1024, 1, 6224]
    - [210, 64.853]
  - - [1024, 3072, 1, 6320]
    - [131, 61.657]
  - - [1024, 1024, 1, 6320]
    - [189, 44.293]
  - - [1024, 4096, 1, 6320]
    - [456, 65.109]
  - - [4096, 1024, 1, 6320]
    - [135, 64.348]
  - - [1024, 3072, 1, 8064]
    - [410, 61.779]
  - - [1024, 3072, 1, 8304]
    - [132, 64.939]
  - - [1024, 1024, 1, 8304]
    - [188, 40.641]
  - - [1024, 4096, 1, 8304]
    - [456, 68.959]
  - - [4096, 1024, 1, 8304]
    - [54, 68.116]
  - - [1024, 3072, 1, 6560]
    - [458, 63.471]
  - - [1024, 1024, 1, 6560]
    - [195, 48.008]
  - - [1024, 4096, 1, 6560]
    - [101, 71.441]
  - - [4096, 1024, 1, 6560]
    - [136, 65.506]
  - - [1024, 3072, 1, 5856]
    - [398, 59.321]
  - - [1024, 1024, 1, 5856]
    - [189, 43.542]
  - - [1024, 4096, 1, 5856]
    - [101, 68.427]
  - - [4096, 1024, 1, 5856]
    - [203, 66.317]
  - - [1024, 3072, 1, 6496]
    - [131, 63.836]
  - - [1024, 1024, 1, 6496]
    - [190, 46.934]
  - - [1024, 4096, 1, 6496]
    - [101, 70.405]
  - - [4096, 1024, 1, 6496]
    - [268, 65.627]
  - - [1024, 3072, 1, 5696]
    - [352, 56.716]
  - - [1024, 1024, 1, 5696]
    - [195, 43.906]
  - - [1024, 4096, 1, 5696]
    - [134, 65.966]
  - - [4096, 1024, 1, 5696]
    - [206, 64.943]
  - - [1024, 3072, 1, 6144]
    - [259, 62.734]
  - - [1024, 3072, 1, 7504]
    - [458, 63.813]
  - - [1024, 1024, 1, 7504]
    - [195, 49.173]
  - - [1024, 4096, 1, 7504]
    - [101, 68.665]
  - - [4096, 1024, 1, 7504]
    - [210, 68.208]
  - - [1024, 3072, 1, 6096]
    - [132, 62.153]
  - - [1024, 1024, 1, 6096]
    - [195, 44.289]
  - - [1024, 4096, 1, 6096]
    - [200, 68.926]
  - - [4096, 1024, 1, 6096]
    - [207, 63.966]
  - - [1024, 3072, 1, 4880]
    - [141, 57.016]
  - - [1024, 1024, 1, 4880]
    - [190, 39.188]
  - - [1024, 4096, 1, 4880]
    - [102, 64.939]
  - - [4096, 1024, 1, 4880]
    - [104, 63.478]
  - - [1024, 3072, 1, 7168]
    - [127, 62.397]
  - - [1024, 1024, 1, 7168]
    - [195, 47.881]
  - - [1024, 4096, 1, 7168]
    - [101, 72.37]
  - - [4096, 1024, 1, 7168]
    - [209, 71.78]
  - - [1024, 3072, 1, 7776]
    - [59, 62.832]
  - - [1024, 1024, 1, 7776]
    - [189, 48.084]
  - - [1024, 4096, 1, 7776]
    - [101, 72.554]
  - - [4096, 1024, 1, 7776]
    - [104, 70.375]
  - - [1024, 3072, 1, 6384]
    - [459, 62.43]
  - - [1024, 1024, 1, 6384]
    - [189, 45.763]
  - - [1024, 4096, 1, 6384]
    - [135, 65.185]
  - - [4096, 1024, 1, 6384]
    - [54, 66.178]
  - - [1024, 3072, 1, 5712]
    - [298, 58.356]
  - - [1024, 1024, 1, 5712]
    - [190, 44.129]
  - - [1024, 4096, 1, 5712]
    - [54, 65.282]
  - - [4096, 1024, 1, 5712]
    - [203, 66.013]
  - - [1024, 3072, 1, 4624]
    - [346, 57.152]
  - - [1024, 1024, 1, 4624]
    - [195, 37.74]
  - - [1024, 4096, 1, 4624]
    - [104, 62.241]
  - - [4096, 1024, 1, 4624]
    - [311, 62.155]
  - - [1024, 3072, 1, 7488]
    - [355, 65.415]
  - - [1024, 1024, 1, 7488]
    - [195, 47.65]
  - - [1024, 4096, 1, 7488]
    - [456, 68.107]
  - - [4096, 1024, 1, 7488]
    - [207, 69.238]
  - - [1024, 3072, 1, 7472]
    - [129, 63.598]
  - - [1024, 1024, 1, 7472]
    - [195, 47.433]
  - - [1024, 4096, 1, 7472]
    - [54, 68.277]
  - - [4096, 1024, 1, 7472]
    - [209, 68.699]
  - - [1024, 3072, 1, 6576]
    - [141, 60.351]
  - - [1024, 1024, 1, 6576]
    - [189, 47.505]
  - - [1024, 4096, 1, 6576]
    - [101, 68.753]
  - - [4096, 1024, 1, 6576]
    - [209, 68.133]
  - - [1024, 3072, 1, 6928]
    - [55, 61.178]
  - - [1024, 1024, 1, 6928]
    - [195, 46.489]
  - - [1024, 4096, 1, 6928]
    - [101, 70.389]
  - - [4096, 1024, 1, 6928]
    - [209, 70.132]
  - - [1024, 3072, 1, 6864]
    - [384, 59.951]
  - - [1024, 1024, 1, 6864]
    - [195, 45.056]
  - - [1024, 4096, 1, 6864]
    - [200, 69.755]
  - - [4096, 1024, 1, 6864]
    - [209, 70.065]
  - - [1024, 3072, 1, 5792]
    - [387, 58.049]
  - - [1024, 1024, 1, 5792]
    - [189, 45.556]
  - - [1024, 4096, 1, 5792]
    - [101, 67.53]
  - - [4096, 1024, 1, 5792]
    - [203, 67.391]
  - - [1024, 3072, 1, 6704]
    - [281, 61.813]
  - - [1024, 1024, 1, 6704]
    - [195, 44.34]
  - - [1024, 4096, 1, 6704]
    - [460, 68.24]
  - - [4096, 1024, 1, 6704]
    - [209, 68.524]
  - - [1024, 3072, 1, 6800]
    - [463, 60.765]
  - - [1024, 1024, 1, 6800]
    - [195, 48.31]
  - - [1024, 4096, 1, 6800]
    - [456, 68.372]
  - - [4096, 1024, 1, 6800]
    - [54, 67.938]
  - - [1024, 3072, 1, 6016]
    - [132, 60.643]
  - - [1024, 1024, 1, 6016]
    - [195, 43.508]
  - - [1024, 4096, 1, 6016]
    - [102, 69.324]
  - - [4096, 1024, 1, 6016]
    - [104, 68.962]
  - - [1024, 3072, 1, 6880]
    - [297, 62.123]
  - - [1024, 1024, 1, 6880]
    - [189, 45.08]
  - - [1024, 4096, 1, 6880]
    - [101, 68.707]
  - - [4096, 1024, 1, 6880]
    - [54, 68.741]
  - - [1024, 3072, 1, 11248]
    - [461, 65.393]
  - - [1024, 1024, 1, 11248]
    - [321, 52.563]
  - - [1024, 4096, 1, 11248]
    - [102, 73.192]
  - - [1024, 1024, 1, 27]
    - [471, 0.998]
  - - [1024, 1024, 1, 1664]
    - [472, 24.312]
  - - [1024, 30528, 1, 1664]
    - [57, 74.897]
  - - [1024, 2, 1, 27]
    - [33, 0.002]
  - - [1500, 1500, 1, 512]
    - [220, 17.434]
  - - [2000, 1500, 1, 512]
    - [237, 22.912]
  - - [4000, 4000, 1, 512]
    - [247, 41.212]
  - - [1536, 4000, 1, 512]
    - [379, 30.722]
  - - [1200, 1200, 1, 512]
    - [473, 14.599]
  - - [2000, 1200, 1, 512]
    - [473, 19.331]
  - - [2200, 2200, 1, 512]
    - [399, 31.466]
  - - [3456, 2200, 1, 512]
    - [202, 39.055]
  - - [1614, 4000, 1, 512]
    - [413, 32.549]
  - - [3228, 2200, 1, 512]
    - [119, 32.974]
- null
