library/src/blas3/Tensile/Logic/asm_full/arcturus_Cijk_Alik_Bjlk_I8II_BH_GB.yaml
- {MinimumRequiredVersion: 4.26.0}
- arcturus
- gfx908
- [Device 7380, Device 7388, Device 738c, Device 7390]
    SolutionIndex: 0
    SolutionNameMin: Cijk_Alik_Bjlk_I8II_BH_GB_MT64x64x32_MI32x32x8x1_SN_1LDSB0_EPS1_GRVW4_LPA4_OPLV0_PK0_PAP0_PGR1_PLR1_SU32_SUS256_SRVW0_TT1_32_WG64_4_1_WGM8
    SolutionIndex: 1
    SolutionNameMin: Cijk_Alik_Bjlk_I8II_BH_GB_MT64x128x64_MI32x32x8x1_SN_1LDSB0_EPS1_GRVW16_LPA16_OPLV0_PKn1_PAP0_PGR1_PLR9_SU0_SUS128_SRVW4_TT1_64_WG64_4_1_WGM1
    SolutionIndex: 2
    SolutionNameMin: Cijk_Alik_Bjlk_I8II_BH_GB_MT64x128x64_MI32x32x8x1_SN_1LDSB0_EPS0_GRVW4_LPA16_OPLV0_PKn1_PAP0_PGR2_PLR9_SU0_SUS128_SRVW4_TT1_64_WG64_4_1_WGM1
    SolutionIndex: 3
    SolutionNameMin: Cijk_Alik_Bjlk_I8II_BH_GB_MT64x64x64_MI32x32x8x1_SN_1LDSB0_EPS0_GRVW8_LPA16_OPLV0_PKn1_PAP0_PGR2_PLR9_SU32_SUS256_SRVW4_TT1_32_WG64_4_1_WGM1
    SolutionIndex: 4
    SolutionNameMin: Cijk_Alik_Bjlk_I8II_BH_GB_MT64x128x64_MI32x32x8x1_SN_1LDSB0_EPS1_GRVW16_LPA16_OPLV0_PKn1_PAP0_PGR1_PLR9_SU0_SUS128_SRVW4_TT1_64_WG64_4_1_WGM2
    SolutionIndex: 5
    SolutionNameMin: Cijk_Alik_Bjlk_I8II_BH_GB_MT64x128x64_MI32x32x8x1_SN_1LDSB0_EPS0_GRVW8_LPA16_OPLV0_PKn1_PAP0_PGR2_PLR9_SU0_SUS128_SRVW4_TT1_64_WG64_4_1_WGM2
    SolutionIndex: 6
    SolutionNameMin: Cijk_Alik_Bjlk_I8II_BH_GB_MT256x128x64_MI32x32x8x1_SN_1LDSB1_EPS1_GRVW16_LPA16_OPLV0_PKn1_PAP0_PGR1_PLR9_SU0_SUS128_SRVW0_TT4_64_WG64_4_1_WGM2
    SolutionIndex: 7
    SolutionNameMin: Cijk_Alik_Bjlk_I8II_BH_GB_MT64x128x64_MI32x32x8x1_SN_1LDSB0_EPS1_GRVW16_LPA16_OPLV1_PKn1_PAP1_PGR1_PLR9_SU32_SUS256_SRVW4_TT1_64_WG64_4_1_WGM2
    SolutionIndex: 8
    SolutionNameMin: Cijk_Alik_Bjlk_I8II_BH_GB_MT256x128x64_MI32x32x8x1_SN_1LDSB1_EPS1_GRVW16_LPA16_OPLV0_PKn1_PAP0_PGR1_PLR9_SU0_SUS256_SRVW0_TT4_64_WG64_4_1_WGM15
    SolutionIndex: 9
    SolutionNameMin: Cijk_Alik_Bjlk_I8II_BH_GB_MT64x64x64_MI32x32x8x1_SN_1LDSB0_EPS1_GRVW8_LPA16_OPLV0_PK0_PAP0_PGR1_PLR9_SU0_SUS128_SRVW0_TT1_32_WG64_4_1_WGM1
    SolutionIndex: 10
    SolutionNameMin: Cijk_Alik_Bjlk_I8II_BH_GB_MT64x128x64_MI32x32x8x1_SN_1LDSB0_EPS1_GRVW8_LPA16_OPLV0_PK0_PAP0_PGR1_PLR9_SU0_SUS128_SRVW0_TT1_64_WG64_4_1_WGM1
    SolutionIndex: 11
    SolutionNameMin: Cijk_Alik_Bjlk_I8II_BH_GB_MT32x32x128_MI16x16x16x1_SN_1LDSB0_EPS1_GRVW8_LPA32_OPLV0_PK0_PAP0_PGR1_PLR9_SU0_SUS128_SRVW0_TT1_16_WG32_8_1_WGM1
    SolutionIndex: 12
    SolutionNameMin: Cijk_Alik_Bjlk_I8II_BH_GB_MT32x64x128_MI16x16x16x1_SN_1LDSB0_EPS1_GRVW8_LPA32_OPLV0_PK0_PAP0_PGR1_PLR9_SU0_SUS128_SRVW0_TT1_32_WG32_8_1_WGM1
    SolutionIndex: 13
    SolutionNameMin: Cijk_Alik_Bjlk_I8II_BH_GB_MT64x32x128_MI16x16x16x1_SN_1LDSB0_EPS1_GRVW8_LPA32_OPLV0_PK0_PAP0_PGR1_PLR9_SU0_SUS128_SRVW0_TT2_16_WG32_8_1_WGM1
    SolutionIndex: 14
    SolutionNameMin: Cijk_Alik_Bjlk_I8II_BH_GB_MT32x32x128_MI16x16x16x1_SN_1LDSB0_EPS1_GRVW16_LPA32_OPLV0_PK0_PAP0_PGR1_PLR9_SU0_SUS128_SRVW0_TT1_16_WG32_8_1_WGM1
    SolutionIndex: 15
    SolutionNameMin: Cijk_Alik_Bjlk_I8II_BH_GB_MT64x32x128_MI16x16x16x1_SN_1LDSB0_EPS1_GRVW16_LPA32_OPLV0_PK0_PAP0_PGR1_PLR9_SU0_SUS128_SRVW0_TT2_16_WG32_8_1_WGM1
    SolutionIndex: 16
    SolutionNameMin: Cijk_Alik_Bjlk_I8II_BH_GB_MT64x64x64_MI32x32x8x1_SN_1LDSB0_EPS0_GRVW8_LPA16_OPLV0_PK0_PAP0_PGR2_PLR9_SU0_SUS128_SRVW0_TT1_32_WG64_4_1_WGM1
    SolutionIndex: 17
    SolutionNameMin: Cijk_Alik_Bjlk_I8II_BH_GB_MT32x32x128_MI16x16x16x1_SN_1LDSB0_EPS0_GRVW8_LPA32_OPLV0_PK0_PAP0_PGR2_PLR9_SU0_SUS128_SRVW0_TT1_16_WG32_8_1_WGM1
    SolutionIndex: 18
    SolutionNameMin: Cijk_Alik_Bjlk_I8II_BH_GB_MT64x32x128_MI16x16x16x1_SN_1LDSB0_EPS0_GRVW8_LPA32_OPLV0_PK0_PAP0_PGR2_PLR9_SU0_SUS128_SRVW0_TT2_16_WG32_8_1_WGM1
    SolutionIndex: 19
    SolutionNameMin: Cijk_Alik_Bjlk_I8II_BH_GB_MT128x64x64_MI32x32x8x1_SN_1LDSB0_EPS0_GRVW16_LPA16_OPLV0_PK0_PAP0_PGR2_PLR9_SU0_SUS128_SRVW0_TT2_32_WG64_4_1_WGM1
    SolutionIndex: 20
    SolutionNameMin: Cijk_Alik_Bjlk_I8II_BH_GB_MT32x32x128_MI16x16x16x1_SN_1LDSB0_EPS0_GRVW16_LPA32_OPLV0_PK0_PAP0_PGR2_PLR9_SU0_SUS128_SRVW0_TT1_16_WG32_8_1_WGM1
    SolutionIndex: 21
    SolutionNameMin: Cijk_Alik_Bjlk_I8II_BH_GB_MT64x32x128_MI16x16x16x1_SN_1LDSB0_EPS0_GRVW16_LPA32_OPLV0_PK0_PAP0_PGR2_PLR9_SU0_SUS128_SRVW0_TT2_16_WG32_8_1_WGM1
    SolutionIndex: 22
    SolutionNameMin: Cijk_Alik_Bjlk_I8II_BH_GB_MT64x64x64_MI32x32x8x1_SN_1LDSB0_EPS1_GRVW4_LPA16_OPLV0_PK0_PAP0_PGR1_PLR9_SU0_SUS128_SRVW4_TT1_32_WG64_4_1_WGM1
    SolutionIndex: 23
    SolutionNameMin: Cijk_Alik_Bjlk_I8II_BH_GB_MT64x64x64_MI32x32x8x1_SN_1LDSB0_EPS1_GRVW8_LPA16_OPLV0_PK0_PAP0_PGR1_PLR9_SU0_SUS128_SRVW4_TT1_32_WG64_4_1_WGM1
    SolutionIndex: 24
    SolutionNameMin: Cijk_Alik_Bjlk_I8II_BH_GB_MT64x128x64_MI32x32x8x1_SN_1LDSB0_EPS1_GRVW8_LPA16_OPLV0_PK0_PAP0_PGR1_PLR9_SU0_SUS128_SRVW4_TT1_64_WG64_4_1_WGM1
    SolutionIndex: 25
    SolutionNameMin: Cijk_Alik_Bjlk_I8II_BH_GB_MT64x64x64_MI32x32x8x1_SN_1LDSB0_EPS1_GRVW16_LPA16_OPLV0_PK0_PAP0_PGR1_PLR9_SU0_SUS128_SRVW4_TT1_32_WG64_4_1_WGM1
    SolutionIndex: 26
    SolutionNameMin: Cijk_Alik_Bjlk_I8II_BH_GB_MT64x128x64_MI32x32x8x1_SN_1LDSB0_EPS1_GRVW16_LPA16_OPLV0_PK0_PAP0_PGR1_PLR9_SU0_SUS128_SRVW4_TT1_64_WG64_4_1_WGM1
    SolutionIndex: 27
    SolutionNameMin: Cijk_Alik_Bjlk_I8II_BH_GB_MT64x64x64_MI32x32x8x1_SN_1LDSB0_EPS0_GRVW16_LPA16_OPLV0_PK0_PAP0_PGR2_PLR9_SU0_SUS128_SRVW4_TT1_32_WG64_4_1_WGM1
    SolutionIndex: 28
    SolutionNameMin: Cijk_Alik_Bjlk_I8II_BH_GB_MT64x128x64_MI32x32x8x1_SN_1LDSB0_EPS0_GRVW16_LPA16_OPLV0_PK0_PAP0_PGR2_PLR9_SU0_SUS128_SRVW4_TT1_64_WG64_4_1_WGM1
    SolutionIndex: 29
    SolutionNameMin: Cijk_Alik_Bjlk_I8II_BH_GB_MT128x128x64_MI32x32x8x1_SN_1LDSB0_EPS0_GRVW16_LPA16_OPLV0_PK0_PAP0_PGR2_PLR9_SU0_SUS128_SRVW4_TT2_64_WG64_4_1_WGM1
    SolutionIndex: 30
    SolutionNameMin: Cijk_Alik_Bjlk_I8II_BH_GB_MT64x32x128_MI16x16x16x1_SN_1LDSB0_EPS0_GRVW16_LPA32_OPLV0_PK0_PAP0_PGR2_PLR9_SU0_SUS128_SRVW4_TT2_16_WG32_8_1_WGM1
    SolutionIndex: 31
    SolutionNameMin: Cijk_Alik_Bjlk_I8II_BH_GB_MT256x128x64_MI32x32x8x1_SN_1LDSB1_EPS1_GRVW16_LPA16_OPLV0_PK0_PAP0_PGR1_PLR9_SU0_SUS128_SRVW0_TT4_64_WG64_4_1_WGM1
    SolutionIndex: 32
    SolutionNameMin: Cijk_Alik_Bjlk_I8II_BH_GB_MT64x64x64_MI32x32x8x1_SN_1LDSB0_EPS1_GRVW16_LPA16_OPLV0_PK0_PAP0_PGR1_PLR9_SU0_SUS256_SRVW0_TT1_32_WG64_4_1_WGM1
    SolutionIndex: 33
    SolutionNameMin: Cijk_Alik_Bjlk_I8II_BH_GB_MT32x32x128_MI16x16x16x1_SN_1LDSB0_EPS1_GRVW16_LPA32_OPLV0_PK0_PAP0_PGR1_PLR9_SU0_SUS256_SRVW0_TT1_16_WG32_8_1_WGM1
    SolutionIndex: 34
    SolutionNameMin: Cijk_Alik_Bjlk_I8II_BH_GB_MT32x64x128_MI16x16x16x1_SN_1LDSB0_EPS1_GRVW16_LPA32_OPLV0_PK0_PAP0_PGR1_PLR9_SU0_SUS256_SRVW0_TT1_32_WG32_8_1_WGM1
    SolutionIndex: 35
    SolutionNameMin: Cijk_Alik_Bjlk_I8II_BH_GB_MT64x32x128_MI16x16x16x1_SN_1LDSB0_EPS1_GRVW16_LPA32_OPLV0_PK0_PAP0_PGR1_PLR9_SU0_SUS256_SRVW0_TT2_16_WG32_8_1_WGM1
    SolutionIndex: 36
    SolutionNameMin: Cijk_Alik_Bjlk_I8II_BH_GB_MT32x32x128_MI16x16x16x1_SN_1LDSB0_EPS0_GRVW4_LPA32_OPLV0_PK0_PAP0_PGR2_PLR9_SU0_SUS256_SRVW0_TT1_16_WG32_8_1_WGM1
    SolutionIndex: 37
    SolutionNameMin: Cijk_Alik_Bjlk_I8II_BH_GB_MT64x64x64_MI32x32x8x1_SN_1LDSB0_EPS0_GRVW8_LPA16_OPLV0_PK0_PAP0_PGR2_PLR9_SU0_SUS256_SRVW0_TT1_32_WG64_4_1_WGM1
    SolutionIndex: 38
    SolutionNameMin: Cijk_Alik_Bjlk_I8II_BH_GB_MT32x32x128_MI16x16x16x1_SN_1LDSB0_EPS0_GRVW8_LPA32_OPLV0_PK0_PAP0_PGR2_PLR9_SU0_SUS256_SRVW0_TT1_16_WG32_8_1_WGM1
    SolutionIndex: 39
    SolutionNameMin: Cijk_Alik_Bjlk_I8II_BH_GB_MT64x64x64_MI32x32x8x1_SN_1LDSB0_EPS0_GRVW16_LPA16_OPLV0_PK0_PAP0_PGR2_PLR9_SU0_SUS256_SRVW0_TT1_32_WG64_4_1_WGM1
    SolutionIndex: 40
    SolutionNameMin: Cijk_Alik_Bjlk_I8II_BH_GB_MT32x32x128_MI16x16x16x1_SN_1LDSB0_EPS0_GRVW16_LPA32_OPLV0_PK0_PAP0_PGR2_PLR9_SU0_SUS256_SRVW0_TT1_16_WG32_8_1_WGM1
    SolutionIndex: 41
    SolutionNameMin: Cijk_Alik_Bjlk_I8II_BH_GB_MT64x32x128_MI16x16x16x1_SN_1LDSB0_EPS0_GRVW16_LPA32_OPLV0_PK0_PAP0_PGR2_PLR9_SU0_SUS256_SRVW0_TT2_16_WG32_8_1_WGM1
    SolutionIndex: 42
    SolutionNameMin: Cijk_Alik_Bjlk_I8II_BH_GB_MT64x64x64_MI32x32x8x1_SN_1LDSB0_EPS1_GRVW4_LPA16_OPLV0_PK0_PAP0_PGR1_PLR9_SU0_SUS256_SRVW4_TT1_32_WG64_4_1_WGM1
    SolutionIndex: 43
    SolutionNameMin: Cijk_Alik_Bjlk_I8II_BH_GB_MT64x128x64_MI32x32x8x1_SN_1LDSB0_EPS1_GRVW8_LPA16_OPLV0_PK0_PAP0_PGR1_PLR9_SU0_SUS256_SRVW4_TT1_64_WG64_4_1_WGM1
    SolutionIndex: 44
    SolutionNameMin: Cijk_Alik_Bjlk_I8II_BH_GB_MT64x64x64_MI32x32x8x1_SN_1LDSB0_EPS1_GRVW16_LPA16_OPLV0_PK0_PAP0_PGR1_PLR9_SU0_SUS256_SRVW4_TT1_32_WG64_4_1_WGM1
    SolutionIndex: 45
    SolutionNameMin: Cijk_Alik_Bjlk_I8II_BH_GB_MT64x128x64_MI32x32x8x1_SN_1LDSB0_EPS1_GRVW16_LPA16_OPLV0_PK0_PAP0_PGR1_PLR9_SU0_SUS256_SRVW4_TT1_64_WG64_4_1_WGM1
    SolutionIndex: 46
    SolutionNameMin: Cijk_Alik_Bjlk_I8II_BH_GB_MT64x128x64_MI32x32x8x1_SN_1LDSB0_EPS0_GRVW8_LPA16_OPLV0_PK0_PAP0_PGR2_PLR9_SU0_SUS256_SRVW4_TT1_64_WG64_4_1_WGM1
    SolutionIndex: 47
    SolutionNameMin: Cijk_Alik_Bjlk_I8II_BH_GB_MT64x64x64_MI32x32x8x1_SN_1LDSB0_EPS0_GRVW16_LPA16_OPLV0_PK0_PAP0_PGR2_PLR9_SU0_SUS256_SRVW4_TT1_32_WG64_4_1_WGM1
    SolutionIndex: 48
    SolutionNameMin: Cijk_Alik_Bjlk_I8II_BH_GB_MT64x128x64_MI32x32x8x1_SN_1LDSB0_EPS0_GRVW16_LPA16_OPLV0_PK0_PAP0_PGR2_PLR9_SU0_SUS256_SRVW4_TT1_64_WG64_4_1_WGM1
    SolutionIndex: 49
    SolutionNameMin: Cijk_Alik_Bjlk_I8II_BH_GB_MT64x32x128_MI16x16x16x1_SN_1LDSB0_EPS0_GRVW16_LPA32_OPLV0_PK0_PAP0_PGR2_PLR9_SU0_SUS256_SRVW4_TT2_16_WG32_8_1_WGM1
    SolutionIndex: 50
    SolutionNameMin: Cijk_Alik_Bjlk_I8II_BH_GB_MT64x64x64_MI32x32x8x1_SN_1LDSB0_EPS0_GRVW16_LPA16_OPLV0_PK0_PAP0_PGR2_PLR9_SU32_SUS128_SRVW0_TT1_32_WG64_4_1_WGM1
    SolutionIndex: 51
    SolutionNameMin: Cijk_Alik_Bjlk_I8II_BH_GB_MT32x32x128_MI16x16x16x1_SN_1LDSB0_EPS0_GRVW16_LPA32_OPLV0_PK0_PAP0_PGR2_PLR9_SU32_SUS128_SRVW0_TT1_16_WG32_8_1_WGM1
    SolutionIndex: 52
    SolutionNameMin: Cijk_Alik_Bjlk_I8II_BH_GB_MT64x64x64_MI32x32x8x1_SN_1LDSB0_EPS1_GRVW16_LPA16_OPLV0_PK0_PAP0_PGR1_PLR9_SU32_SUS128_SRVW4_TT1_32_WG64_4_1_WGM1
    SolutionIndex: 53
    SolutionNameMin: Cijk_Alik_Bjlk_I8II_BH_GB_MT64x128x64_MI32x32x8x1_SN_1LDSB0_EPS1_GRVW16_LPA16_OPLV0_PK0_PAP0_PGR1_PLR9_SU32_SUS128_SRVW4_TT1_64_WG64_4_1_WGM1
    SolutionIndex: 54
    SolutionNameMin: Cijk_Alik_Bjlk_I8II_BH_GB_MT64x64x64_MI32x32x8x1_SN_1LDSB0_EPS0_GRVW16_LPA16_OPLV0_PK0_PAP0_PGR2_PLR9_SU32_SUS128_SRVW4_TT1_32_WG64_4_1_WGM1
    SolutionIndex: 55
    SolutionNameMin: Cijk_Alik_Bjlk_I8II_BH_GB_MT64x64x64_MI32x32x8x1_SN_1LDSB0_EPS1_GRVW16_LPA16_OPLV0_PK0_PAP0_PGR1_PLR9_SU32_SUS256_SRVW0_TT1_32_WG64_4_1_WGM1
    SolutionIndex: 56
    SolutionNameMin: Cijk_Alik_Bjlk_I8II_BH_GB_MT64x32x128_MI16x16x16x1_SN_1LDSB0_EPS1_GRVW16_LPA32_OPLV0_PK0_PAP0_PGR1_PLR9_SU32_SUS256_SRVW0_TT2_16_WG32_8_1_WGM1
    SolutionIndex: 57
    SolutionNameMin: Cijk_Alik_Bjlk_I8II_BH_GB_MT32x32x128_MI16x16x16x1_SN_1LDSB0_EPS0_GRVW8_LPA32_OPLV0_PK0_PAP0_PGR2_PLR9_SU32_SUS256_SRVW0_TT1_16_WG32_8_1_WGM1
    SolutionIndex: 58
    SolutionNameMin: Cijk_Alik_Bjlk_I8II_BH_GB_MT32x32x128_MI16x16x16x1_SN_1LDSB0_EPS0_GRVW16_LPA32_OPLV0_PK0_PAP0_PGR2_PLR9_SU32_SUS256_SRVW0_TT1_16_WG32_8_1_WGM1
    SolutionIndex: 59
    SolutionNameMin: Cijk_Alik_Bjlk_I8II_BH_GB_MT64x128x64_MI32x32x8x1_SN_1LDSB0_EPS0_GRVW16_LPA16_OPLV0_PK0_PAP0_PGR2_PLR9_SU32_SUS256_SRVW4_TT1_64_WG64_4_1_WGM1
    SolutionIndex: 60
    SolutionNameMin: Cijk_Alik_Bjlk_I8II_BH_GB_MT32x32x128_MI16x16x16x1_SN_1LDSB0_EPS1_GRVW4_LPA32_OPLV0_PK0_PAP0_PGR1_PLR9_SU0_SUS128_SRVW0_TT1_16_WG32_8_1_WGM2
    SolutionIndex: 61
    SolutionNameMin: Cijk_Alik_Bjlk_I8II_BH_GB_MT32x32x128_MI16x16x16x1_SN_1LDSB0_EPS1_GRVW16_LPA32_OPLV0_PK0_PAP0_PGR1_PLR9_SU0_SUS128_SRVW0_TT1_16_WG32_8_1_WGM2
    SolutionIndex: 62
    SolutionNameMin: Cijk_Alik_Bjlk_I8II_BH_GB_MT64x32x128_MI16x16x16x1_SN_1LDSB0_EPS1_GRVW16_LPA32_OPLV0_PK0_PAP0_PGR1_PLR9_SU0_SUS128_SRVW0_TT2_16_WG32_8_1_WGM2
    SolutionIndex: 63
    SolutionNameMin: Cijk_Alik_Bjlk_I8II_BH_GB_MT64x64x64_MI32x32x8x1_SN_1LDSB0_EPS0_GRVW8_LPA16_OPLV0_PK0_PAP0_PGR2_PLR9_SU0_SUS128_SRVW0_TT1_32_WG64_4_1_WGM2
    SolutionIndex: 64
    SolutionNameMin: Cijk_Alik_Bjlk_I8II_BH_GB_MT64x32x128_MI16x16x16x1_SN_1LDSB0_EPS0_GRVW16_LPA32_OPLV0_PK0_PAP0_PGR2_PLR9_SU0_SUS128_SRVW0_TT2_16_WG32_8_1_WGM2
    SolutionIndex: 65
    SolutionNameMin: Cijk_Alik_Bjlk_I8II_BH_GB_MT64x64x64_MI32x32x8x1_SN_1LDSB0_EPS1_GRVW4_LPA16_OPLV0_PK0_PAP0_PGR1_PLR9_SU0_SUS128_SRVW4_TT1_32_WG64_4_1_WGM2
    SolutionIndex: 66
    SolutionNameMin: Cijk_Alik_Bjlk_I8II_BH_GB_MT64x64x64_MI32x32x8x1_SN_1LDSB0_EPS1_GRVW16_LPA16_OPLV0_PK0_PAP0_PGR1_PLR9_SU0_SUS128_SRVW4_TT1_32_WG64_4_1_WGM2
    SolutionIndex: 67
    SolutionNameMin: Cijk_Alik_Bjlk_I8II_BH_GB_MT64x128x64_MI32x32x8x1_SN_1LDSB0_EPS1_GRVW16_LPA16_OPLV0_PK0_PAP0_PGR1_PLR9_SU0_SUS128_SRVW4_TT1_64_WG64_4_1_WGM2
    SolutionIndex: 68
    SolutionNameMin: Cijk_Alik_Bjlk_I8II_BH_GB_MT64x64x64_MI32x32x8x1_SN_1LDSB0_EPS0_GRVW16_LPA16_OPLV0_PK0_PAP0_PGR2_PLR9_SU0_SUS128_SRVW4_TT1_32_WG64_4_1_WGM2
    SolutionIndex: 69
    SolutionNameMin: Cijk_Alik_Bjlk_I8II_BH_GB_MT64x128x64_MI32x32x8x1_SN_1LDSB0_EPS0_GRVW16_LPA16_OPLV0_PK0_PAP0_PGR2_PLR9_SU0_SUS128_SRVW4_TT1_64_WG64_4_1_WGM2
    SolutionIndex: 70
    SolutionNameMin: Cijk_Alik_Bjlk_I8II_BH_GB_MT32x32x128_MI16x16x16x1_SN_1LDSB0_EPS0_GRVW16_LPA32_OPLV0_PK0_PAP0_PGR2_PLR9_SU0_SUS128_SRVW4_TT1_16_WG32_8_1_WGM2
    SolutionIndex: 71
    SolutionNameMin: Cijk_Alik_Bjlk_I8II_BH_GB_MT64x64x64_MI32x32x8x1_SN_1LDSB0_EPS1_GRVW16_LPA16_OPLV0_PK0_PAP0_PGR1_PLR9_SU0_SUS256_SRVW0_TT1_32_WG64_4_1_WGM2
    SolutionIndex: 72
    SolutionNameMin: Cijk_Alik_Bjlk_I8II_BH_GB_MT32x32x128_MI16x16x16x1_SN_1LDSB0_EPS1_GRVW16_LPA32_OPLV0_PK0_PAP0_PGR1_PLR9_SU0_SUS256_SRVW0_TT1_16_WG32_8_1_WGM2
    SolutionIndex: 73
    SolutionNameMin: Cijk_Alik_Bjlk_I8II_BH_GB_MT64x64x64_MI32x32x8x1_SN_1LDSB0_EPS0_GRVW16_LPA16_OPLV0_PK0_PAP0_PGR2_PLR9_SU0_SUS256_SRVW0_TT1_32_WG64_4_1_WGM2
    SolutionIndex: 74
    SolutionNameMin: Cijk_Alik_Bjlk_I8II_BH_GB_MT32x32x128_MI16x16x16x1_SN_1LDSB0_EPS0_GRVW16_LPA32_OPLV0_PK0_PAP0_PGR2_PLR9_SU0_SUS256_SRVW0_TT1_16_WG32_8_1_WGM2
    SolutionIndex: 75
    SolutionNameMin: Cijk_Alik_Bjlk_I8II_BH_GB_MT64x64x64_MI32x32x8x1_SN_1LDSB0_EPS1_GRVW4_LPA16_OPLV0_PK0_PAP0_PGR1_PLR9_SU0_SUS256_SRVW4_TT1_32_WG64_4_1_WGM2
    SolutionIndex: 76
    SolutionNameMin: Cijk_Alik_Bjlk_I8II_BH_GB_MT64x64x64_MI32x32x8x1_SN_1LDSB0_EPS1_GRVW8_LPA16_OPLV0_PK0_PAP0_PGR1_PLR9_SU0_SUS256_SRVW4_TT1_32_WG64_4_1_WGM2
    SolutionIndex: 77
    SolutionNameMin: Cijk_Alik_Bjlk_I8II_BH_GB_MT64x128x64_MI32x32x8x1_SN_1LDSB0_EPS1_GRVW8_LPA16_OPLV0_PK0_PAP0_PGR1_PLR9_SU0_SUS256_SRVW4_TT1_64_WG64_4_1_WGM2
    SolutionIndex: 78
    SolutionNameMin: Cijk_Alik_Bjlk_I8II_BH_GB_MT64x64x64_MI32x32x8x1_SN_1LDSB0_EPS1_GRVW16_LPA16_OPLV0_PK0_PAP0_PGR1_PLR9_SU0_SUS256_SRVW4_TT1_32_WG64_4_1_WGM2
    SolutionIndex: 79
    SolutionNameMin: Cijk_Alik_Bjlk_I8II_BH_GB_MT64x64x64_MI32x32x8x1_SN_1LDSB0_EPS0_GRVW8_LPA16_OPLV0_PK0_PAP0_PGR2_PLR9_SU0_SUS256_SRVW4_TT1_32_WG64_4_1_WGM2
    SolutionIndex: 80
    SolutionNameMin: Cijk_Alik_Bjlk_I8II_BH_GB_MT64x64x64_MI32x32x8x1_SN_1LDSB0_EPS0_GRVW16_LPA16_OPLV0_PK0_PAP0_PGR2_PLR9_SU0_SUS256_SRVW4_TT1_32_WG64_4_1_WGM2
    SolutionIndex: 81
    SolutionNameMin: Cijk_Alik_Bjlk_I8II_BH_GB_MT64x128x64_MI32x32x8x1_SN_1LDSB0_EPS0_GRVW16_LPA16_OPLV0_PK0_PAP0_PGR2_PLR9_SU0_SUS256_SRVW4_TT1_64_WG64_4_1_WGM2
    SolutionIndex: 82
    SolutionNameMin: Cijk_Alik_Bjlk_I8II_BH_GB_MT32x32x128_MI16x16x16x1_SN_1LDSB0_EPS0_GRVW16_LPA32_OPLV0_PK0_PAP0_PGR2_PLR9_SU0_SUS256_SRVW4_TT1_16_WG32_8_1_WGM2
    SolutionIndex: 83
    SolutionNameMin: Cijk_Alik_Bjlk_I8II_BH_GB_MT32x32x128_MI16x16x16x1_SN_1LDSB0_EPS0_GRVW16_LPA32_OPLV0_PK0_PAP0_PGR2_PLR9_SU32_SUS128_SRVW0_TT1_16_WG32_8_1_WGM2
    SolutionIndex: 84
    SolutionNameMin: Cijk_Alik_Bjlk_I8II_BH_GB_MT32x64x128_MI16x16x16x1_SN_1LDSB0_EPS0_GRVW16_LPA32_OPLV0_PK0_PAP0_PGR2_PLR9_SU32_SUS128_SRVW0_TT1_32_WG32_8_1_WGM2
    SolutionIndex: 85
    SolutionNameMin: Cijk_Alik_Bjlk_I8II_BH_GB_MT64x128x64_MI32x32x8x1_SN_1LDSB0_EPS1_GRVW16_LPA16_OPLV0_PK0_PAP0_PGR1_PLR9_SU32_SUS128_SRVW4_TT1_64_WG64_4_1_WGM2
    SolutionIndex: 86
    SolutionNameMin: Cijk_Alik_Bjlk_I8II_BH_GB_MT64x64x64_MI32x32x8x1_SN_1LDSB0_EPS0_GRVW4_LPA16_OPLV0_PK0_PAP0_PGR2_PLR9_SU32_SUS128_SRVW4_TT1_32_WG64_4_1_WGM2
    SolutionIndex: 87
    SolutionNameMin: Cijk_Alik_Bjlk_I8II_BH_GB_MT64x64x64_MI32x32x8x1_SN_1LDSB0_EPS0_GRVW16_LPA16_OPLV0_PK0_PAP0_PGR2_PLR9_SU32_SUS128_SRVW4_TT1_32_WG64_4_1_WGM2
    SolutionIndex: 88
    SolutionNameMin: Cijk_Alik_Bjlk_I8II_BH_GB_MT64x128x64_MI32x32x8x1_SN_1LDSB0_EPS0_GRVW16_LPA16_OPLV0_PK0_PAP0_PGR2_PLR9_SU32_SUS128_SRVW4_TT1_64_WG64_4_1_WGM2
    SolutionIndex: 89
    SolutionNameMin: Cijk_Alik_Bjlk_I8II_BH_GB_MT128x64x64_MI32x32x8x1_SN_1LDSB0_EPS1_GRVW8_LPA16_OPLV0_PK0_PAP0_PGR1_PLR9_SU32_SUS256_SRVW0_TT2_32_WG64_4_1_WGM2
    SolutionIndex: 90
    SolutionNameMin: Cijk_Alik_Bjlk_I8II_BH_GB_MT32x32x128_MI16x16x16x1_SN_1LDSB0_EPS0_GRVW16_LPA32_OPLV0_PK0_PAP0_PGR2_PLR9_SU32_SUS256_SRVW0_TT1_16_WG32_8_1_WGM2
    SolutionIndex: 91
    SolutionNameMin: Cijk_Alik_Bjlk_I8II_BH_GB_MT64x64x64_MI32x32x8x1_SN_1LDSB0_EPS1_GRVW16_LPA16_OPLV0_PK0_PAP0_PGR1_PLR9_SU32_SUS256_SRVW4_TT1_32_WG64_4_1_WGM2
    SolutionIndex: 92
    SolutionNameMin: Cijk_Alik_Bjlk_I8II_BH_GB_MT64x64x64_MI32x32x8x1_SN_1LDSB0_EPS0_GRVW16_LPA16_OPLV0_PK0_PAP0_PGR2_PLR9_SU32_SUS256_SRVW4_TT1_32_WG64_4_1_WGM2
    SolutionIndex: 93
    SolutionNameMin: Cijk_Alik_Bjlk_I8II_BH_GB_MT64x128x64_MI32x32x8x1_SN_1LDSB0_EPS0_GRVW16_LPA16_OPLV0_PK0_PAP0_PGR2_PLR9_SU32_SUS256_SRVW4_TT1_64_WG64_4_1_WGM2
    SolutionIndex: 94
    SolutionNameMin: Cijk_Alik_Bjlk_I8II_BH_GB_MT32x32x128_MI16x16x16x1_SN_1LDSB0_EPS1_GRVW4_LPA32_OPLV0_PK0_PAP0_PGR1_PLR9_SU0_SUS128_SRVW0_TT1_16_WG32_8_1_WGM15
    SolutionIndex: 95
    SolutionNameMin: Cijk_Alik_Bjlk_I8II_BH_GB_MT64x32x128_MI16x16x16x1_SN_1LDSB0_EPS1_GRVW16_LPA32_OPLV0_PK0_PAP0_PGR1_PLR9_SU0_SUS128_SRVW0_TT2_16_WG32_8_1_WGM15
    SolutionIndex: 96
    SolutionNameMin: Cijk_Alik_Bjlk_I8II_BH_GB_MT64x128x64_MI32x32x8x1_SN_1LDSB0_EPS0_GRVW16_LPA16_OPLV0_PK0_PAP0_PGR2_PLR9_SU0_SUS128_SRVW0_TT1_64_WG64_4_1_WGM15
    SolutionIndex: 97
    SolutionNameMin: Cijk_Alik_Bjlk_I8II_BH_GB_MT32x64x128_MI16x16x16x1_SN_1LDSB0_EPS0_GRVW16_LPA32_OPLV0_PK0_PAP0_PGR2_PLR9_SU0_SUS128_SRVW0_TT1_32_WG32_8_1_WGM15
    SolutionIndex: 98
    SolutionNameMin: Cijk_Alik_Bjlk_I8II_BH_GB_MT64x64x64_MI32x32x8x1_SN_1LDSB0_EPS1_GRVW16_LPA16_OPLV0_PK0_PAP0_PGR1_PLR9_SU0_SUS128_SRVW4_TT1_32_WG64_4_1_WGM15
    SolutionIndex: 99
    SolutionNameMin: Cijk_Alik_Bjlk_I8II_BH_GB_MT64x32x128_MI16x16x16x1_SN_1LDSB0_EPS1_GRVW16_LPA32_OPLV0_PK0_PAP0_PGR1_PLR9_SU0_SUS128_SRVW4_TT2_16_WG32_8_1_WGM15
    SolutionIndex: 100
    SolutionNameMin: Cijk_Alik_Bjlk_I8II_BH_GB_MT64x64x64_MI32x32x8x1_SN_1LDSB0_EPS0_GRVW16_LPA16_OPLV0_PK0_PAP0_PGR2_PLR9_SU0_SUS128_SRVW4_TT1_32_WG64_4_1_WGM15
    SolutionIndex: 101
    SolutionNameMin: Cijk_Alik_Bjlk_I8II_BH_GB_MT64x128x64_MI32x32x8x1_SN_1LDSB0_EPS0_GRVW16_LPA16_OPLV0_PK0_PAP0_PGR2_PLR9_SU0_SUS128_SRVW4_TT1_64_WG64_4_1_WGM15
    SolutionIndex: 102
    SolutionNameMin: Cijk_Alik_Bjlk_I8II_BH_GB_MT32x32x128_MI16x16x16x1_SN_1LDSB0_EPS1_GRVW16_LPA32_OPLV0_PK0_PAP0_PGR1_PLR9_SU0_SUS256_SRVW0_TT1_16_WG32_8_1_WGM15
    SolutionIndex: 103
    SolutionNameMin: Cijk_Alik_Bjlk_I8II_BH_GB_MT64x32x128_MI16x16x16x1_SN_1LDSB0_EPS1_GRVW16_LPA32_OPLV0_PK0_PAP0_PGR1_PLR9_SU0_SUS256_SRVW0_TT2_16_WG32_8_1_WGM15
    SolutionIndex: 104
    SolutionNameMin: Cijk_Alik_Bjlk_I8II_BH_GB_MT32x32x128_MI16x16x16x1_SN_1LDSB0_EPS0_GRVW16_LPA32_OPLV0_PK0_PAP0_PGR2_PLR9_SU0_SUS256_SRVW0_TT1_16_WG32_8_1_WGM15
    SolutionIndex: 105
    SolutionNameMin: Cijk_Alik_Bjlk_I8II_BH_GB_MT64x32x128_MI16x16x16x1_SN_1LDSB0_EPS0_GRVW16_LPA32_OPLV0_PK0_PAP0_PGR2_PLR9_SU0_SUS256_SRVW0_TT2_16_WG32_8_1_WGM15
    SolutionIndex: 106
    SolutionNameMin: Cijk_Alik_Bjlk_I8II_BH_GB_MT64x64x64_MI32x32x8x1_SN_1LDSB0_EPS1_GRVW16_LPA16_OPLV0_PK0_PAP0_PGR1_PLR9_SU0_SUS256_SRVW4_TT1_32_WG64_4_1_WGM15
    SolutionIndex: 107
    SolutionNameMin: Cijk_Alik_Bjlk_I8II_BH_GB_MT64x128x64_MI32x32x8x1_SN_1LDSB0_EPS1_GRVW16_LPA16_OPLV0_PK0_PAP0_PGR1_PLR9_SU0_SUS256_SRVW4_TT1_64_WG64_4_1_WGM15
    SolutionIndex: 108
    SolutionNameMin: Cijk_Alik_Bjlk_I8II_BH_GB_MT64x64x64_MI32x32x8x1_SN_1LDSB0_EPS0_GRVW16_LPA16_OPLV0_PK0_PAP0_PGR2_PLR9_SU0_SUS256_SRVW4_TT1_32_WG64_4_1_WGM15
    SolutionIndex: 109
    SolutionNameMin: Cijk_Alik_Bjlk_I8II_BH_GB_MT64x128x64_MI32x32x8x1_SN_1LDSB0_EPS0_GRVW16_LPA16_OPLV0_PK0_PAP0_PGR2_PLR9_SU0_SUS256_SRVW4_TT1_64_WG64_4_1_WGM15
    SolutionIndex: 110
    SolutionNameMin: Cijk_Alik_Bjlk_I8II_BH_GB_MT64x64x64_MI32x32x8x1_SN_1LDSB0_EPS0_GRVW16_LPA16_OPLV0_PK0_PAP0_PGR2_PLR9_SU32_SUS128_SRVW0_TT1_32_WG64_4_1_WGM15
    SolutionIndex: 111
    SolutionNameMin: Cijk_Alik_Bjlk_I8II_BH_GB_MT64x64x64_MI32x32x8x1_SN_1LDSB0_EPS1_GRVW16_LPA16_OPLV0_PK0_PAP0_PGR1_PLR9_SU32_SUS128_SRVW4_TT1_32_WG64_4_1_WGM15
    SolutionIndex: 112
    SolutionNameMin: Cijk_Alik_Bjlk_I8II_BH_GB_MT64x128x64_MI32x32x8x1_SN_1LDSB0_EPS1_GRVW16_LPA16_OPLV0_PK0_PAP0_PGR1_PLR9_SU32_SUS128_SRVW4_TT1_64_WG64_4_1_WGM15
    SolutionIndex: 113
    SolutionNameMin: Cijk_Alik_Bjlk_I8II_BH_GB_MT64x64x64_MI32x32x8x1_SN_1LDSB0_EPS0_GRVW16_LPA16_OPLV0_PK0_PAP0_PGR2_PLR9_SU32_SUS128_SRVW4_TT1_32_WG64_4_1_WGM15
    SolutionIndex: 114
    SolutionNameMin: Cijk_Alik_Bjlk_I8II_BH_GB_MT64x128x64_MI32x32x8x1_SN_1LDSB0_EPS0_GRVW16_LPA16_OPLV0_PK0_PAP0_PGR2_PLR9_SU32_SUS128_SRVW4_TT1_64_WG64_4_1_WGM15
    SolutionIndex: 115
    SolutionNameMin: Cijk_Alik_Bjlk_I8II_BH_GB_MT64x32x128_MI16x16x16x1_SN_1LDSB0_EPS0_GRVW16_LPA32_OPLV0_PK0_PAP0_PGR2_PLR9_SU32_SUS256_SRVW0_TT2_16_WG32_8_1_WGM15
    SolutionIndex: 116
    SolutionNameMin: Cijk_Alik_Bjlk_I8II_BH_GB_MT64x64x64_MI32x32x8x1_SN_1LDSB0_EPS0_GRVW8_LPA16_OPLV0_PK0_PAP0_PGR2_PLR9_SU32_SUS256_SRVW4_TT1_32_WG64_4_1_WGM15
    SolutionIndex: 117
    SolutionNameMin: Cijk_Alik_Bjlk_I8II_BH_GB_MT64x64x64_MI32x32x8x1_SN_1LDSB0_EPS0_GRVW16_LPA16_OPLV0_PK0_PAP0_PGR2_PLR9_SU32_SUS256_SRVW4_TT1_32_WG64_4_1_WGM15
- - - [35, 35, 1, 512, 35, 35, 512, 35]
    - [0, 43.0]
  - - [4, 64, 1, 128, 4, 4, 128, 64]
    - [0, 4.0]
  - - [480, 512, 1, 512, 704, 704, 704, 704]
    - [40, 17096.0]
  - - [960, 1024, 1, 1024, 1216, 1216, 1216, 1216]
    - [100, 77672.0]
  - - [1920, 2048, 1, 2048, 2240, 2240, 2240, 2240]
    - [29, 115838.0]
  - - [3840, 4096, 1, 4096, 4288, 4288, 4288, 4288]
    - [6, 138178.0]
  - - [7680, 8192, 1, 8192, 8384, 8384, 8384, 8384]
    - [8, 144761.0]
  - - [32, 32, 8, 32, 32, 32, 32, 32]
    - [72, 45.0]
  - - [32, 32, 8, 64, 32, 32, 64, 32]
    - [55, 89.0]
  - - [32, 32, 8, 128, 32, 32, 128, 32]
    - [20, 215.0]
  - - [32, 32, 8, 256, 32, 32, 256, 32]
    - [57, 359.0]
  - - [32, 32, 8, 512, 32, 32, 512, 32]
    - [20, 596.0]
  - - [32, 32, 8, 1024, 32, 32, 1024, 32]
    - [20, 1008.0]
  - - [32, 32, 8, 2048, 32, 32, 2048, 32]
    - [20, 1477.0]
  - - [32, 64, 8, 32, 32, 32, 32, 64]
    - [72, 90.0]
  - - [32, 64, 8, 64, 32, 32, 64, 64]
    - [55, 175.0]
  - - [32, 64, 8, 128, 32, 32, 128, 64]
    - [40, 444.0]
  - - [32, 64, 8, 256, 32, 32, 256, 64]
    - [20, 728.0]
  - - [32, 64, 8, 512, 32, 32, 512, 64]
    - [20, 1205.0]
  - - [32, 64, 8, 1024, 32, 32, 1024, 64]
    - [20, 1942.0]
  - - [32, 64, 8, 2048, 32, 32, 2048, 64]
    - [40, 2954.0]
  - - [32, 128, 8, 32, 32, 32, 32, 128]
    - [72, 177.0]
  - - [32, 128, 8, 64, 32, 32, 64, 128]
    - [55, 332.0]
  - - [32, 128, 8, 128, 32, 32, 128, 128]
    - [11, 846.0]
  - - [32, 128, 8, 256, 32, 32, 256, 128]
    - [40, 1456.0]
  - - [32, 128, 8, 512, 32, 32, 512, 128]
    - [20, 2280.0]
  - - [32, 128, 8, 1024, 32, 32, 1024, 128]
    - [20, 3779.0]
  - - [32, 128, 8, 2048, 32, 32, 2048, 128]
    - [40, 5115.0]
  - - [32, 256, 8, 32, 32, 32, 32, 256]
    - [104, 350.0]
  - - [32, 256, 8, 64, 32, 32, 64, 256]
    - [110, 681.0]
  - - [32, 256, 8, 128, 32, 32, 128, 256]
    - [40, 1664.0]
  - - [32, 256, 8, 256, 32, 32, 256, 256]
    - [40, 2724.0]
  - - [32, 256, 8, 512, 32, 32, 512, 256]
    - [20, 4369.0]
  - - [32, 256, 8, 1024, 32, 32, 1024, 256]
    - [83, 6605.0]
  - - [32, 256, 8, 2048, 32, 32, 2048, 256]
    - [82, 8924.0]
  - - [32, 512, 8, 32, 32, 32, 32, 512]
    - [36, 603.0]
  - - [32, 512, 8, 64, 32, 32, 64, 512]
    - [32, 1327.0]
  - - [32, 512, 8, 128, 32, 32, 128, 512]
    - [20, 3329.0]
  - - [32, 512, 8, 256, 32, 32, 256, 512]
    - [33, 5243.0]
  - - [32, 512, 8, 512, 32, 32, 512, 512]
    - [58, 8306.0]
  - - [32, 512, 8, 1024, 32, 32, 1024, 512]
    - [20, 11111.0]
  - - [32, 512, 8, 2048, 32, 32, 2048, 512]
    - [50, 13808.0]
  - - [32, 1024, 8, 32, 32, 32, 32, 1024]
    - [16, 1070.0]
  - - [32, 1024, 8, 64, 32, 32, 64, 1024]
    - [71, 2467.0]
  - - [32, 1024, 8, 128, 32, 32, 128, 1024]
    - [84, 5178.0]
  - - [32, 1024, 8, 256, 32, 32, 256, 1024]
    - [34, 7989.0]
  - - [32, 1024, 8, 512, 32, 32, 512, 1024]
    - [73, 12614.0]
  - - [32, 1024, 8, 1024, 32, 32, 1024, 1024]
    - [39, 18437.0]
  - - [32, 1024, 8, 2048, 32, 32, 2048, 1024]
    - [39, 22148.0]
  - - [32, 2048, 8, 32, 32, 32, 32, 2048]
    - [10, 1678.0]
  - - [32, 2048, 8, 64, 32, 32, 64, 2048]
    - [55, 4033.0]
  - - [32, 2048, 8, 128, 32, 32, 128, 2048]
    - [20, 8144.0]
  - - [32, 2048, 8, 256, 32, 32, 256, 2048]
    - [20, 11651.0]
  - - [32, 2048, 8, 512, 32, 32, 512, 2048]
    - [96, 16448.0]
  - - [32, 2048, 8, 1024, 32, 32, 1024, 2048]
    - [45, 22672.0]
  - - [32, 2048, 8, 2048, 32, 32, 2048, 2048]
    - [107, 26369.0]
  - - [64, 32, 8, 32, 64, 64, 32, 32]
    - [17, 89.0]
  - - [64, 32, 8, 64, 64, 64, 64, 32]
    - [37, 166.0]
  - - [64, 32, 8, 128, 64, 64, 128, 32]
    - [61, 437.0]
  - - [64, 32, 8, 256, 64, 64, 256, 32]
    - [20, 718.0]
  - - [64, 32, 8, 512, 64, 64, 512, 32]
    - [20, 1219.0]
  - - [64, 32, 8, 1024, 64, 64, 1024, 32]
    - [20, 1997.0]
  - - [64, 32, 8, 2048, 64, 64, 2048, 32]
    - [58, 3084.0]
  - - [64, 64, 8, 32, 64, 64, 32, 64]
    - [72, 180.0]
  - - [64, 64, 8, 64, 64, 64, 64, 64]
    - [9, 374.0]
  - - [64, 64, 8, 128, 64, 64, 128, 64]
    - [20, 859.0]
  - - [64, 64, 8, 256, 64, 64, 256, 64]
    - [20, 1436.0]
  - - [64, 64, 8, 512, 64, 64, 512, 64]
    - [20, 2439.0]
  - - [64, 64, 8, 1024, 64, 64, 1024, 64]
    - [40, 3920.0]
  - - [64, 64, 8, 2048, 64, 64, 2048, 64]
    - [90, 5992.0]
  - - [64, 128, 8, 32, 64, 64, 32, 128]
    - [102, 359.0]
  - - [64, 128, 8, 64, 64, 64, 64, 128]
    - [27, 760.0]
  - - [64, 128, 8, 128, 64, 64, 128, 128]
    - [40, 1719.0]
  - - [64, 128, 8, 256, 64, 64, 256, 128]
    - [60, 2724.0]
  - - [64, 128, 8, 512, 64, 64, 512, 128]
    - [40, 4559.0]
  - - [64, 128, 8, 1024, 64, 64, 1024, 128]
    - [20, 7109.0]
  - - [64, 128, 8, 2048, 64, 64, 2048, 128]
    - [20, 10618.0]
  - - [64, 256, 8, 32, 64, 64, 32, 256]
    - [36, 617.0]
  - - [64, 256, 8, 64, 64, 64, 64, 256]
    - [113, 1520.0]
  - - [64, 256, 8, 128, 64, 64, 128, 256]
    - [38, 3226.0]
  - - [64, 256, 8, 256, 64, 64, 256, 256]
    - [14, 5447.0]
  - - [64, 256, 8, 512, 64, 64, 512, 256]
    - [40, 8924.0]
  - - [64, 256, 8, 1024, 64, 64, 1024, 256]
    - [14, 12807.0]
  - - [64, 256, 8, 2048, 64, 64, 2048, 256]
    - [104, 17033.0]
  - - [64, 512, 8, 32, 64, 64, 32, 512]
    - [27, 1152.0]
  - - [64, 512, 8, 64, 64, 64, 64, 512]
    - [44, 2954.0]
  - - [64, 512, 8, 128, 64, 64, 128, 512]
    - [35, 5746.0]
  - - [64, 512, 8, 256, 64, 64, 256, 512]
    - [15, 9869.0]
  - - [64, 512, 8, 512, 64, 64, 512, 512]
    - [99, 15392.0]
  - - [64, 512, 8, 1024, 64, 64, 1024, 512]
    - [47, 22370.0]
  - - [64, 512, 8, 2048, 64, 64, 2048, 512]
    - [47, 30094.0]
  - - [64, 1024, 8, 32, 64, 64, 32, 1024]
    - [22, 2118.0]
  - - [64, 1024, 8, 64, 64, 64, 64, 1024]
    - [47, 5518.0]
  - - [64, 1024, 8, 128, 64, 64, 128, 1024]
    - [23, 9321.0]
  - - [64, 1024, 8, 256, 64, 64, 256, 1024]
    - [98, 16132.0]
  - - [64, 1024, 8, 512, 64, 64, 512, 1024]
    - [27, 27060.0]
  - - [64, 1024, 8, 1024, 64, 64, 1024, 1024]
    - [47, 36472.0]
  - - [64, 1024, 8, 2048, 64, 64, 2048, 1024]
    - [47, 44006.0]
  - - [64, 2048, 8, 32, 64, 64, 32, 2048]
    - [24, 3251.0]
  - - [64, 2048, 8, 64, 64, 64, 64, 2048]
    - [77, 8830.0]
  - - [64, 2048, 8, 128, 64, 64, 128, 2048]
    - [64, 14463.0]
  - - [64, 2048, 8, 256, 64, 64, 256, 2048]
    - [48, 23302.0]
  - - [64, 2048, 8, 512, 64, 64, 512, 2048]
    - [48, 36472.0]
  - - [64, 2048, 8, 1024, 64, 64, 1024, 2048]
    - [28, 44889.0]
  - - [64, 2048, 8, 2048, 64, 64, 2048, 2048]
    - [107, 51523.0]
  - - [128, 32, 8, 32, 128, 128, 32, 32]
    - [38, 180.0]
  - - [128, 32, 8, 64, 128, 128, 64, 32]
    - [57, 332.0]
  - - [128, 32, 8, 128, 128, 128, 128, 32]
    - [40, 874.0]
  - - [128, 32, 8, 256, 128, 128, 256, 32]
    - [40, 1398.0]
  - - [128, 32, 8, 512, 128, 128, 512, 32]
    - [20, 2280.0]
  - - [128, 32, 8, 1024, 128, 128, 1024, 32]
    - [58, 3884.0]
  - - [128, 32, 8, 2048, 128, 128, 2048, 32]
    - [20, 6168.0]
  - - [128, 64, 8, 32, 128, 128, 32, 64]
    - [102, 364.0]
  - - [128, 64, 8, 64, 128, 128, 64, 64]
    - [25, 760.0]
  - - [128, 64, 8, 128, 128, 128, 128, 64]
    - [33, 1691.0]
  - - [128, 64, 8, 256, 128, 128, 256, 64]
    - [33, 2834.0]
  - - [128, 64, 8, 512, 128, 128, 512, 64]
    - [40, 4660.0]
  - - [128, 64, 8, 1024, 128, 128, 1024, 64]
    - [20, 7840.0]
  - - [128, 64, 8, 2048, 128, 128, 2048, 64]
    - [51, 11815.0]
  - - [128, 128, 8, 32, 128, 128, 32, 128]
    - [36, 632.0]
  - - [128, 128, 8, 64, 128, 128, 64, 128]
    - [106, 1456.0]
  - - [128, 128, 8, 128, 128, 128, 128, 128]
    - [38, 3277.0]
  - - [128, 128, 8, 256, 128, 128, 256, 128]
    - [33, 5309.0]
  - - [128, 128, 8, 512, 128, 128, 512, 128]
    - [20, 8924.0]
  - - [128, 128, 8, 1024, 128, 128, 1024, 128]
    - [40, 14340.0]
  - - [128, 128, 8, 2048, 128, 128, 2048, 128]
    - [20, 20092.0]
  - - [128, 256, 8, 32, 128, 128, 32, 256]
    - [76, 1140.0]
  - - [128, 256, 8, 64, 128, 128, 64, 256]
    - [68, 2873.0]
  - - [128, 256, 8, 128, 128, 128, 128, 256]
    - [35, 5825.0]
  - - [128, 256, 8, 256, 128, 128, 256, 256]
    - [15, 9869.0]
  - - [128, 256, 8, 512, 128, 128, 512, 256]
    - [62, 15392.0]
  - - [128, 256, 8, 1024, 128, 128, 1024, 256]
    - [103, 23302.0]
  - - [128, 256, 8, 2048, 128, 128, 2048, 256]
    - [95, 30366.0]
  - - [128, 512, 8, 32, 128, 128, 32, 512]
    - [79, 2056.0]
  - - [128, 512, 8, 64, 128, 128, 64, 512]
    - [92, 5447.0]
  - - [128, 512, 8, 128, 128, 128, 128, 512]
    - [115, 9533.0]
  - - [128, 512, 8, 256, 128, 128, 256, 512]
    - [80, 15680.0]
  - - [128, 512, 8, 512, 128, 128, 512, 512]
    - [100, 27060.0]
  - - [128, 512, 8, 1024, 128, 128, 1024, 512]
    - [100, 39476.0]
  - - [128, 512, 8, 2048, 128, 128, 2048, 512]
    - [100, 48806.0]
  - - [128, 1024, 8, 32, 128, 128, 32, 1024]
    - [24, 3303.0]
  - - [128, 1024, 8, 64, 128, 128, 64, 1024]
    - [26, 8648.0]
  - - [128, 1024, 8, 128, 128, 128, 128, 1024]
    - [35, 14847.0]
  - - [128, 1024, 8, 256, 128, 128, 256, 1024]
    - [26, 24315.0]
  - - [128, 1024, 8, 512, 128, 128, 512, 1024]
    - [48, 38791.0]
  - - [128, 1024, 8, 1024, 128, 128, 1024, 1024]
    - [100, 52634.0]
  - - [128, 1024, 8, 2048, 128, 128, 2048, 1024]
    - [108, 63310.0]
  - - [128, 2048, 8, 32, 128, 128, 32, 2048]
    - [75, 4438.0]
  - - [128, 2048, 8, 64, 128, 128, 64, 2048]
    - [87, 12428.0]
  - - [128, 2048, 8, 128, 128, 128, 128, 2048]
    - [91, 20841.0]
  - - [128, 2048, 8, 256, 128, 128, 256, 2048]
    - [44, 33893.0]
  - - [128, 2048, 8, 512, 128, 128, 512, 2048]
    - [100, 50840.0]
  - - [128, 2048, 8, 1024, 128, 128, 1024, 2048]
    - [108, 67787.0]
  - - [128, 2048, 8, 2048, 128, 128, 2048, 2048]
    - [27, 76915.0]
  - - [256, 32, 8, 32, 256, 256, 32, 32]
    - [38, 359.0]
  - - [256, 32, 8, 64, 256, 256, 64, 32]
    - [38, 664.0]
  - - [256, 32, 8, 128, 256, 256, 128, 32]
    - [40, 1808.0]
  - - [256, 32, 8, 256, 256, 256, 256, 32]
    - [20, 2873.0]
  - - [256, 32, 8, 512, 256, 256, 512, 32]
    - [17, 4559.0]
  - - [256, 32, 8, 1024, 256, 256, 1024, 32]
    - [90, 7767.0]
  - - [256, 32, 8, 2048, 256, 256, 2048, 32]
    - [40, 11899.0]
  - - [256, 64, 8, 32, 256, 256, 32, 64]
    - [12, 639.0]
  - - [256, 64, 8, 64, 256, 256, 64, 64]
    - [117, 1498.0]
  - - [256, 64, 8, 128, 256, 256, 128, 64]
    - [20, 3495.0]
  - - [256, 64, 8, 256, 256, 256, 256, 64]
    - [20, 5592.0]
  - - [256, 64, 8, 512, 256, 256, 512, 64]
    - [20, 9118.0]
  - - [256, 64, 8, 1024, 256, 256, 1024, 64]
    - [20, 15680.0]
  - - [256, 64, 8, 2048, 256, 256, 2048, 64]
    - [70, 19973.0]
  - - [256, 128, 8, 32, 256, 256, 32, 128]
    - [117, 1165.0]
  - - [256, 128, 8, 64, 256, 256, 64, 128]
    - [92, 2954.0]
  - - [256, 128, 8, 128, 256, 256, 128, 128]
    - [15, 5992.0]
  - - [256, 128, 8, 256, 256, 256, 256, 128]
    - [13, 9533.0]
  - - [256, 128, 8, 512, 256, 256, 512, 128]
    - [35, 16289.0]
  - - [256, 128, 8, 1024, 256, 256, 1024, 128]
    - [105, 23967.0]
  - - [256, 128, 8, 2048, 256, 256, 2048, 128]
    - [49, 31359.0]
  - - [256, 256, 8, 32, 256, 256, 32, 256]
    - [76, 2076.0]
  - - [256, 256, 8, 64, 256, 256, 64, 256]
    - [78, 5519.0]
  - - [256, 256, 8, 128, 256, 256, 128, 256]
    - [35, 9321.0]
  - - [256, 256, 8, 256, 256, 256, 256, 256]
    - [80, 15828.0]
  - - [256, 256, 8, 512, 256, 256, 512, 256]
    - [47, 27962.0]
  - - [256, 256, 8, 1024, 256, 256, 1024, 256]
    - [68, 40427.0]
  - - [256, 256, 8, 2048, 256, 256, 2048, 256]
    - [27, 51228.0]
  - - [256, 512, 8, 32, 256, 256, 32, 512]
    - [46, 3303.0]
  - - [256, 512, 8, 64, 256, 256, 64, 512]
    - [28, 9020.0]
  - - [256, 512, 8, 128, 256, 256, 128, 512]
    - [64, 14847.0]
  - - [256, 512, 8, 256, 256, 256, 256, 512]
    - [28, 23967.0]
  - - [256, 512, 8, 512, 256, 256, 512, 512]
    - [48, 39708.0]
  - - [256, 512, 8, 1024, 256, 256, 1024, 512]
    - [27, 54120.0]
  - - [256, 512, 8, 2048, 256, 256, 2048, 512]
    - [27, 64839.0]
  - - [256, 1024, 8, 32, 256, 256, 32, 1024]
    - [86, 4302.0]
  - - [256, 1024, 8, 64, 256, 256, 64, 1024]
    - [23, 12906.0]
  - - [256, 1024, 8, 128, 256, 256, 128, 1024]
    - [98, 21103.0]
  - - [256, 1024, 8, 256, 256, 256, 256, 1024]
    - [47, 34592.0]
  - - [256, 1024, 8, 512, 256, 256, 512, 1024]
    - [108, 53050.0]
  - - [256, 1024, 8, 1024, 256, 256, 1024, 1024]
    - [27, 72746.0]
  - - [256, 1024, 8, 2048, 256, 256, 2048, 1024]
    - [80, 81591.0]
  - - [256, 2048, 8, 32, 256, 256, 32, 2048]
    - [81, 5611.0]
  - - [256, 2048, 8, 64, 256, 256, 64, 2048]
    - [25, 16529.0]
  - - [256, 2048, 8, 128, 256, 256, 128, 2048]
    - [27, 27169.0]
  - - [256, 2048, 8, 256, 256, 256, 256, 2048]
    - [28, 44296.0]
  - - [256, 2048, 8, 512, 256, 256, 512, 2048]
    - [28, 67109.0]
  - - [256, 2048, 8, 1024, 256, 256, 1024, 2048]
    - [28, 85083.0]
  - - [256, 2048, 8, 2048, 256, 256, 2048, 2048]
    - [19, 86732.0]
  - - [512, 32, 8, 32, 512, 512, 32, 32]
    - [94, 639.0]
  - - [512, 32, 8, 64, 512, 512, 64, 32]
    - [39, 1311.0]
  - - [512, 32, 8, 128, 512, 512, 128, 32]
    - [20, 3329.0]
  - - [512, 32, 8, 256, 512, 512, 256, 32]
    - [58, 5447.0]
  - - [512, 32, 8, 512, 512, 512, 512, 32]
    - [20, 9020.0]
  - - [512, 32, 8, 1024, 512, 512, 1024, 32]
    - [20, 15534.0]
  - - [512, 32, 8, 2048, 512, 512, 2048, 32]
    - [20, 20713.0]
  - - [512, 64, 8, 32, 512, 512, 32, 64]
    - [63, 1128.0]
  - - [512, 64, 8, 64, 512, 512, 64, 64]
    - [22, 2954.0]
  - - [512, 64, 8, 128, 512, 512, 128, 64]
    - [21, 5992.0]
  - - [512, 64, 8, 256, 512, 512, 256, 64]
    - [15, 9425.0]
  - - [512, 64, 8, 512, 512, 512, 512, 64]
    - [64, 15392.0]
  - - [512, 64, 8, 1024, 512, 512, 1024, 64]
    - [41, 24492.0]
  - - [512, 64, 8, 2048, 512, 512, 2048, 64]
    - [21, 33222.0]
  - - [512, 128, 8, 32, 512, 512, 32, 128]
    - [42, 2016.0]
  - - [512, 128, 8, 64, 512, 512, 64, 128]
    - [27, 5309.0]
  - - [512, 128, 8, 128, 512, 512, 128, 128]
    - [35, 9642.0]
  - - [512, 128, 8, 256, 512, 512, 256, 128]
    - [27, 15977.0]
  - - [512, 128, 8, 512, 512, 512, 512, 128]
    - [54, 26631.0]
  - - [512, 128, 8, 1024, 512, 512, 1024, 128]
    - [27, 39017.0]
  - - [512, 128, 8, 2048, 512, 512, 2048, 128]
    - [27, 49710.0]
  - - [512, 256, 8, 32, 512, 512, 32, 256]
    - [43, 3277.0]
  - - [512, 256, 8, 64, 512, 512, 64, 256]
    - [28, 8924.0]
  - - [512, 256, 8, 128, 512, 512, 128, 256]
    - [56, 14847.0]
  - - [512, 256, 8, 256, 512, 512, 256, 256]
    - [26, 23629.0]
  - - [512, 256, 8, 512, 512, 512, 512, 256]
    - [28, 39245.0]
  - - [512, 256, 8, 1024, 512, 512, 1024, 256]
    - [27, 53903.0]
  - - [512, 256, 8, 2048, 512, 512, 2048, 256]
    - [27, 63761.0]
  - - [512, 512, 8, 32, 512, 512, 32, 512]
    - [42, 4280.0]
  - - [512, 512, 8, 64, 512, 512, 64, 512]
    - [100, 12807.0]
  - - [512, 512, 8, 128, 512, 512, 128, 512]
    - [106, 20841.0]
  - - [512, 512, 8, 256, 512, 512, 256, 512]
    - [27, 34415.0]
  - - [512, 512, 8, 512, 512, 512, 512, 512]
    - [27, 52022.0]
  - - [512, 512, 8, 1024, 512, 512, 1024, 512]
    - [27, 72747.0]
  - - [512, 512, 8, 2048, 512, 512, 2048, 512]
    - [27, 81591.0]
  - - [512, 1024, 8, 32, 512, 512, 32, 1024]
    - [81, 5668.0]
  - - [512, 1024, 8, 64, 512, 512, 64, 1024]
    - [48, 16777.0]
  - - [512, 1024, 8, 128, 512, 512, 128, 1024]
    - [81, 26951.0]
  - - [512, 1024, 8, 256, 512, 512, 256, 1024]
    - [107, 44443.0]
  - - [512, 1024, 8, 512, 512, 512, 512, 1024]
    - [48, 67787.0]
  - - [512, 1024, 8, 1024, 512, 512, 1024, 1024]
    - [81, 83755.0]
  - - [512, 1024, 8, 2048, 512, 512, 2048, 1024]
    - [28, 92245.0]
  - - [512, 2048, 8, 32, 512, 512, 32, 2048]
    - [2, 6618.0]
  - - [512, 2048, 8, 64, 512, 512, 64, 2048]
    - [45, 18538.0]
  - - [512, 2048, 8, 128, 512, 512, 128, 2048]
    - [67, 32110.0]
  - - [512, 2048, 8, 256, 512, 512, 256, 2048]
    - [109, 52841.0]
  - - [512, 2048, 8, 512, 512, 512, 512, 2048]
    - [28, 75616.0]
  - - [512, 2048, 8, 1024, 512, 512, 1024, 2048]
    - [48, 92563.0]
  - - [512, 2048, 8, 2048, 512, 512, 2048, 2048]
    - [81, 100963.0]
  - - [1024, 32, 8, 32, 1024, 1024, 32, 32]
    - [25, 1049.0]
  - - [1024, 32, 8, 64, 1024, 1024, 64, 32]
    - [27, 2411.0]
  - - [1024, 32, 8, 128, 1024, 1024, 128, 32]
    - [56, 5825.0]
  - - [1024, 32, 8, 256, 1024, 1024, 256, 32]
    - [18, 9218.0]
  - - [1024, 32, 8, 512, 1024, 1024, 512, 32]
    - [41, 14847.0]
  - - [1024, 32, 8, 1024, 1024, 1024, 1024, 32]
    - [30, 21931.0]
  - - [1024, 32, 8, 2048, 1024, 1024, 2048, 32]
    - [41, 26951.0]
  - - [1024, 64, 8, 32, 1024, 1024, 32, 64]
    - [65, 2076.0]
  - - [1024, 64, 8, 64, 1024, 1024, 64, 64]
    - [22, 5447.0]
  - - [1024, 64, 8, 128, 1024, 1024, 128, 64]
    - [15, 9321.0]
  - - [1024, 64, 8, 256, 1024, 1024, 256, 64]
    - [25, 15392.0]
  - - [1024, 64, 8, 512, 1024, 1024, 512, 64]
    - [27, 25041.0]
  - - [1024, 64, 8, 1024, 1024, 1024, 1024, 64]
    - [68, 32897.0]
  - - [1024, 64, 8, 2048, 1024, 1024, 2048, 64]
    - [111, 40184.0]
  - - [1024, 128, 8, 32, 1024, 1024, 32, 128]
    - [24, 3202.0]
  - - [1024, 128, 8, 64, 1024, 1024, 64, 128]
    - [44, 8648.0]
  - - [1024, 128, 8, 128, 1024, 1024, 128, 128]
    - [35, 14589.0]
  - - [1024, 128, 8, 256, 1024, 1024, 256, 128]
    - [66, 22672.0]
  - - [1024, 128, 8, 512, 1024, 1024, 512, 128]
    - [28, 37283.0]
  - - [1024, 128, 8, 1024, 1024, 1024, 1024, 128]
    - [27, 47935.0]
  - - [1024, 128, 8, 2048, 1024, 1024, 2048, 128]
    - [92, 54783.0]
  - - [1024, 256, 8, 32, 1024, 1024, 32, 256]
    - [22, 4112.0]
  - - [1024, 256, 8, 64, 1024, 1024, 64, 256]
    - [23, 12710.0]
  - - [1024, 256, 8, 128, 1024, 1024, 128, 256]
    - [25, 21103.0]
  - - [1024, 256, 8, 256, 1024, 1024, 256, 256]
    - [27, 33059.0]
  - - [1024, 256, 8, 512, 1024, 1024, 512, 256]
    - [47, 49345.0]
  - - [1024, 256, 8, 1024, 1024, 1024, 1024, 256]
    - [54, 64528.0]
  - - [1024, 256, 8, 2048, 1024, 1024, 2048, 256]
    - [113, 75829.0]
  - - [1024, 512, 8, 32, 1024, 1024, 32, 512]
    - [81, 5537.0]
  - - [1024, 512, 8, 64, 1024, 1024, 64, 512]
    - [28, 16368.0]
  - - [1024, 512, 8, 128, 1024, 1024, 128, 512]
    - [28, 26317.0]
  - - [1024, 512, 8, 256, 1024, 1024, 256, 512]
    - [101, 43296.0]
  - - [1024, 512, 8, 512, 1024, 1024, 512, 512]
    - [28, 64219.0]
  - - [1024, 512, 8, 1024, 1024, 1024, 1024, 512]
    - [114, 84149.0]
  - - [1024, 512, 8, 2048, 1024, 1024, 2048, 512]
    - [109, 90230.0]
  - - [1024, 1024, 8, 32, 1024, 1024, 32, 1024]
    - [28, 6478.0]
  - - [1024, 1024, 8, 64, 1024, 1024, 64, 1024]
    - [81, 18538.0]
  - - [1024, 1024, 8, 128, 1024, 1024, 128, 1024]
    - [26, 31286.0]
  - - [1024, 1024, 8, 256, 1024, 1024, 256, 1024]
    - [28, 51622.0]
  - - [1024, 1024, 8, 512, 1024, 1024, 512, 1024]
    - [28, 75192.0]
  - - [1024, 1024, 8, 1024, 1024, 1024, 1024, 1024]
    - [114, 95189.0]
  - - [1024, 1024, 8, 2048, 1024, 1024, 2048, 1024]
    - [69, 102799.0]
  - - [1024, 2048, 8, 32, 1024, 1024, 32, 2048]
    - [24, 7326.0]
  - - [1024, 2048, 8, 64, 1024, 1024, 64, 2048]
    - [59, 19796.0]
  - - [1024, 2048, 8, 128, 1024, 1024, 128, 2048]
    - [5, 34459.0]
  - - [1024, 2048, 8, 256, 1024, 1024, 256, 2048]
    - [85, 56632.0]
  - - [1024, 2048, 8, 512, 1024, 1024, 512, 2048]
    - [88, 80011.0]
  - - [1024, 2048, 8, 1024, 1024, 1024, 1024, 2048]
    - [114, 99099.0]
  - - [1024, 2048, 8, 2048, 1024, 1024, 2048, 2048]
    - [114, 108022.0]
  - - [2048, 32, 8, 32, 2048, 2048, 32, 32]
    - [89, 1477.0]
  - - [2048, 32, 8, 64, 2048, 2048, 64, 32]
    - [32, 3745.0]
  - - [2048, 32, 8, 128, 2048, 2048, 128, 32]
    - [21, 8830.0]
  - - [2048, 32, 8, 256, 2048, 2048, 256, 32]
    - [35, 13006.0]
  - - [2048, 32, 8, 512, 2048, 2048, 512, 32]
    - [21, 19284.0]
  - - [2048, 32, 8, 1024, 2048, 2048, 1024, 32]
    - [20, 25420.0]
  - - [2048, 32, 8, 2048, 2048, 2048, 2048, 32]
    - [74, 30435.0]
  - - [2048, 64, 8, 32, 2048, 2048, 32, 64]
    - [27, 2724.0]
  - - [2048, 64, 8, 64, 2048, 2048, 64, 64]
    - [116, 8144.0]
  - - [2048, 64, 8, 128, 2048, 2048, 128, 64]
    - [15, 14980.0]
  - - [2048, 64, 8, 256, 2048, 2048, 256, 64]
    - [35, 22075.0]
  - - [2048, 64, 8, 512, 2048, 2048, 512, 64]
    - [91, 30366.0]
  - - [2048, 64, 8, 1024, 2048, 2048, 1024, 64]
    - [68, 38568.0]
  - - [2048, 64, 8, 2048, 2048, 2048, 2048, 64]
    - [97, 45191.0]
  - - [2048, 128, 8, 32, 2048, 2048, 32, 128]
    - [25, 4112.0]
  - - [2048, 128, 8, 64, 2048, 2048, 64, 128]
    - [44, 12906.0]
  - - [2048, 128, 8, 128, 2048, 2048, 128, 128]
    - [27, 20460.0]
  - - [2048, 128, 8, 256, 2048, 2048, 256, 128]
    - [66, 30784.0]
  - - [2048, 128, 8, 512, 2048, 2048, 512, 128]
    - [68, 45344.0]
  - - [2048, 128, 8, 1024, 2048, 2048, 1024, 128]
    - [80, 59919.0]
  - - [2048, 128, 8, 2048, 2048, 2048, 2048, 128]
    - [52, 70088.0]
  - - [2048, 256, 8, 32, 2048, 2048, 32, 256]
    - [81, 5483.0]
  - - [2048, 256, 8, 64, 2048, 2048, 64, 256]
    - [28, 15828.0]
  - - [2048, 256, 8, 128, 2048, 2048, 128, 256]
    - [80, 25419.0]
  - - [2048, 256, 8, 256, 2048, 2048, 256, 256]
    - [112, 40920.0]
  - - [2048, 256, 8, 512, 2048, 2048, 512, 256]
    - [109, 61568.0]
  - - [2048, 256, 8, 1024, 2048, 2048, 1024, 256]
    - [28, 79773.0]
  - - [2048, 256, 8, 2048, 2048, 2048, 2048, 256]
    - [85, 89033.0]
  - - [2048, 512, 8, 32, 2048, 2048, 32, 512]
    - [45, 6515.0]
  - - [2048, 512, 8, 64, 2048, 2048, 64, 512]
    - [53, 18236.0]
  - - [2048, 512, 8, 128, 2048, 2048, 128, 512]
    - [69, 31655.0]
  - - [2048, 512, 8, 256, 2048, 2048, 256, 512]
    - [67, 50269.0]
  - - [2048, 512, 8, 512, 2048, 2048, 512, 512]
    - [28, 74255.0]
  - - [2048, 512, 8, 1024, 2048, 2048, 1024, 512]
    - [112, 94686.0]
  - - [2048, 512, 8, 2048, 2048, 2048, 2048, 512]
    - [101, 102164.0]
  - - [2048, 1024, 8, 32, 2048, 2048, 32, 1024]
    - [2, 7232.0]
  - - [2048, 1024, 8, 64, 2048, 2048, 64, 1024]
    - [93, 19855.0]
  - - [2048, 1024, 8, 128, 2048, 2048, 128, 1024]
    - [7, 34109.0]
  - - [2048, 1024, 8, 256, 2048, 2048, 256, 1024]
    - [88, 57114.0]
  - - [2048, 1024, 8, 512, 2048, 2048, 512, 1024]
    - [88, 78720.0]
  - - [2048, 1024, 8, 1024, 2048, 2048, 1024, 1024]
    - [85, 98689.0]
  - - [2048, 1024, 8, 2048, 2048, 2048, 2048, 1024]
    - [101, 105970.0]
  - - [2048, 2048, 8, 32, 2048, 2048, 32, 2048]
    - [4, 8081.0]
  - - [2048, 2048, 8, 64, 2048, 2048, 64, 2048]
    - [3, 21087.0]
  - - [2048, 2048, 8, 128, 2048, 2048, 128, 2048]
    - [1, 37439.0]
  - - [2048, 2048, 8, 256, 2048, 2048, 256, 2048]
    - [88, 62282.0]
  - - [2048, 2048, 8, 512, 2048, 2048, 512, 2048]
    - [81, 81933.0]
  - - [2048, 2048, 8, 1024, 2048, 2048, 1024, 2048]
    - [88, 102236.0]
  - - [2048, 2048, 8, 2048, 2048, 2048, 2048, 2048]
    - [31, 116727.0]
- null
