library/src/blas3/Tensile/Logic/asm_full/arcturus_Cijk_Ailk_Bjlk_BBH.yaml
- {MinimumRequiredVersion: 4.14.0}
- arcturus
- gfx908
- [Device 7380, Device 7388, Device 738c, Device 7390]
    SolutionIndex: 0
    SolutionNameMin: Cijk_Ailk_Bjlk_BBH_MT32x256x8_MI32x32x2x2_SE_ONLL0_SNLL1
    SolutionIndex: 1
    SolutionNameMin: Cijk_Ailk_Bjlk_BBH_MT64x128x8_MI32x32x2x2_SE_ONLL0_SNLL1
    SolutionIndex: 2
    SolutionNameMin: Cijk_Ailk_Bjlk_BBH_MT64x128x16_MI32x32x2x2_SE_ONLL0_SNLL1
    SolutionIndex: 3
    SolutionNameMin: Cijk_Ailk_Bjlk_BBH_MT32x256x8_MI32x32x2x2_SE_ONLL0_SNLL0
    SolutionIndex: 4
    SolutionNameMin: Cijk_Ailk_Bjlk_BBH_MT64x128x8_MI32x32x2x2_SE_ONLL0_SNLL0
    SolutionIndex: 5
    SolutionNameMin: Cijk_Ailk_Bjlk_BBH_MT64x128x16_MI32x32x2x2_SE_ONLL0_SNLL0
    SolutionIndex: 6
    SolutionNameMin: Cijk_Ailk_Bjlk_BBH_MT64x128x32_MI32x32x2x2_SE_ONLL0_SNLL0
    SolutionIndex: 7
    SolutionNameMin: Cijk_Ailk_Bjlk_BBH_MT64x128x16_MI32x32x2x2_SE_ONLL1_SNLL1
    SolutionIndex: 8
    SolutionNameMin: Cijk_Ailk_Bjlk_BBH_MT64x128x32_MI32x32x2x2_SE_ONLL1_SNLL1
    SolutionIndex: 9
    SolutionNameMin: Cijk_Ailk_Bjlk_BBH_MT32x256x8_MI32x32x2x2_SE_ONLL1_SNLL0
    SolutionIndex: 10
    SolutionNameMin: Cijk_Ailk_Bjlk_BBH_MT64x128x8_MI32x32x2x2_SE_ONLL1_SNLL0
    SolutionIndex: 11
    SolutionNameMin: Cijk_Ailk_Bjlk_BBH_MT32x256x16_MI32x32x2x2_SE_ONLL1_SNLL0
    SolutionIndex: 12
    SolutionNameMin: Cijk_Ailk_Bjlk_BBH_MT64x128x16_MI32x32x2x2_SE_ONLL1_SNLL0
    SolutionIndex: 13
    SolutionNameMin: Cijk_Ailk_Bjlk_BBH_MT64x128x32_MI32x32x2x2_SE_ONLL1_SNLL0
    SolutionIndex: 14
    SolutionNameMin: Cijk_Ailk_Bjlk_BBH_MT64x256x8_MI32x32x2x2_SE_ONLL0_SNLL0
    SolutionIndex: 15
    SolutionNameMin: Cijk_Ailk_Bjlk_BBH_MT64x256x16_MI32x32x2x2_SE_ONLL0_SNLL0
    SolutionIndex: 16
    SolutionNameMin: Cijk_Ailk_Bjlk_BBH_MT64x256x16_MI32x32x2x2_SE_ONLL1_SNLL1
    SolutionIndex: 17
    SolutionNameMin: Cijk_Ailk_Bjlk_BBH_MT64x128x8_MI32x32x2x2_SE_AF0EM1_ASEM1_ONLL0_SNLL1
    SolutionIndex: 18
    SolutionNameMin: Cijk_Ailk_Bjlk_BBH_MT64x128x8_MI32x32x2x2_SE_AF0EM1_ASEM1_ONLL0_SNLL0
    SolutionIndex: 19
    SolutionNameMin: Cijk_Ailk_Bjlk_BBH_MT64x128x32_MI32x32x2x2_SE_AF0EM1_ASEM2_ONLL0_SNLL0
    SolutionIndex: 20
    SolutionNameMin: Cijk_Ailk_Bjlk_BBH_MT64x128x8_MI32x32x2x2_SE_AF0EM1_ASEM1_ONLL1_SNLL1
    SolutionIndex: 21
    SolutionNameMin: Cijk_Ailk_Bjlk_BBH_MT64x128x8_MI32x32x2x2_SE_AF0EM1_ASEM1_ONLL1_SNLL0
    SolutionIndex: 22
    SolutionNameMin: Cijk_Ailk_Bjlk_BBH_MT64x128x32_MI32x32x2x2_SE_AF0EM1_ASEM2_ONLL1_SNLL0
    SolutionIndex: 23
    SolutionIndex: 24
    SolutionIndex: 25
    SolutionIndex: 26
    SolutionIndex: 27
    SolutionIndex: 28
    SolutionIndex: 29
    SolutionIndex: 30
    SolutionIndex: 31
    SolutionIndex: 32
    SolutionIndex: 33
    SolutionIndex: 34
    SolutionIndex: 35
    SolutionIndex: 36
    SolutionIndex: 37
    SolutionIndex: 38
    SolutionIndex: 39
    SolutionIndex: 40
    SolutionIndex: 41
    SolutionIndex: 42
    SolutionIndex: 43
    SolutionIndex: 44
    SolutionIndex: 45
    SolutionIndex: 46
    SolutionIndex: 47
    SolutionIndex: 48
    SolutionIndex: 49
    SolutionIndex: 50
    SolutionIndex: 51
    SolutionIndex: 52
    SolutionIndex: 53
    SolutionIndex: 54
    SolutionIndex: 55
    SolutionIndex: 56
    SolutionIndex: 57
    SolutionIndex: 58
    SolutionIndex: 59
    SolutionIndex: 60
    SolutionIndex: 61
    SolutionIndex: 62
    SolutionIndex: 63
    SolutionIndex: 64
    SolutionIndex: 65
    SolutionIndex: 66
    SolutionIndex: 67
    SolutionIndex: 68
    SolutionIndex: 69
    SolutionIndex: 70
    SolutionIndex: 71
    SolutionIndex: 72
    SolutionIndex: 73
    SolutionIndex: 74
    SolutionIndex: 75
    SolutionIndex: 76
    SolutionIndex: 77
    SolutionIndex: 78
    SolutionIndex: 79
    SolutionIndex: 80
    SolutionIndex: 81
    SolutionIndex: 82
    SolutionIndex: 83
    SolutionIndex: 84
    SolutionIndex: 85
    SolutionIndex: 86
    SolutionIndex: 87
    SolutionIndex: 88
    SolutionIndex: 89
    SolutionIndex: 90
    SolutionIndex: 91
    SolutionNameMin: Cijk_Ailk_Bjlk_BBH_MT32x256x8_MI32x32x2x2_SE_ONLL0_SNLL1
    SolutionIndex: 92
    SolutionNameMin: Cijk_Ailk_Bjlk_BBH_MT64x128x8_MI32x32x2x2_SE_ONLL0_SNLL1
    SolutionIndex: 93
    SolutionNameMin: Cijk_Ailk_Bjlk_BBH_MT64x128x16_MI32x32x2x2_SE_ONLL0_SNLL1
    SolutionIndex: 94
    SolutionNameMin: Cijk_Ailk_Bjlk_BBH_MT32x256x8_MI32x32x2x2_SE_ONLL0_SNLL0
    SolutionIndex: 95
    SolutionNameMin: Cijk_Ailk_Bjlk_BBH_MT64x128x8_MI32x32x2x2_SE_ONLL0_SNLL0
    SolutionIndex: 96
    SolutionNameMin: Cijk_Ailk_Bjlk_BBH_MT64x128x16_MI32x32x2x2_SE_ONLL0_SNLL0
    SolutionIndex: 97
    SolutionNameMin: Cijk_Ailk_Bjlk_BBH_MT64x128x32_MI32x32x2x2_SE_ONLL0_SNLL0
    SolutionIndex: 98
    SolutionNameMin: Cijk_Ailk_Bjlk_BBH_MT64x128x16_MI32x32x2x2_SE_ONLL1_SNLL1
    SolutionIndex: 99
    SolutionNameMin: Cijk_Ailk_Bjlk_BBH_MT64x128x32_MI32x32x2x2_SE_ONLL1_SNLL1
    SolutionIndex: 100
    SolutionNameMin: Cijk_Ailk_Bjlk_BBH_MT32x256x8_MI32x32x2x2_SE_ONLL1_SNLL0
    SolutionIndex: 101
    SolutionNameMin: Cijk_Ailk_Bjlk_BBH_MT64x128x8_MI32x32x2x2_SE_ONLL1_SNLL0
    SolutionIndex: 102
    SolutionNameMin: Cijk_Ailk_Bjlk_BBH_MT32x256x16_MI32x32x2x2_SE_ONLL1_SNLL0
    SolutionIndex: 103
    SolutionNameMin: Cijk_Ailk_Bjlk_BBH_MT64x128x16_MI32x32x2x2_SE_ONLL1_SNLL0
    SolutionIndex: 104
    SolutionNameMin: Cijk_Ailk_Bjlk_BBH_MT64x128x32_MI32x32x2x2_SE_ONLL1_SNLL0
    SolutionIndex: 105
    SolutionNameMin: Cijk_Ailk_Bjlk_BBH_MT64x256x8_MI32x32x2x2_SE_ONLL0_SNLL0
    SolutionIndex: 106
    SolutionNameMin: Cijk_Ailk_Bjlk_BBH_MT64x256x16_MI32x32x2x2_SE_ONLL0_SNLL0
    SolutionIndex: 107
    SolutionNameMin: Cijk_Ailk_Bjlk_BBH_MT64x256x16_MI32x32x2x2_SE_ONLL1_SNLL1
    SolutionIndex: 108
    SolutionNameMin: Cijk_Ailk_Bjlk_BBH_MT64x128x8_MI32x32x2x2_SE_AF0EM1_ASEM1_ONLL0_SNLL1
    SolutionIndex: 109
    SolutionNameMin: Cijk_Ailk_Bjlk_BBH_MT64x128x8_MI32x32x2x2_SE_AF0EM1_ASEM1_ONLL0_SNLL0
    SolutionIndex: 110
    SolutionNameMin: Cijk_Ailk_Bjlk_BBH_MT64x128x32_MI32x32x2x2_SE_AF0EM1_ASEM2_ONLL0_SNLL0
    SolutionIndex: 111
    SolutionNameMin: Cijk_Ailk_Bjlk_BBH_MT64x128x8_MI32x32x2x2_SE_AF0EM1_ASEM1_ONLL1_SNLL1
    SolutionIndex: 112
    SolutionNameMin: Cijk_Ailk_Bjlk_BBH_MT64x128x8_MI32x32x2x2_SE_AF0EM1_ASEM1_ONLL1_SNLL0
    SolutionIndex: 113
    SolutionNameMin: Cijk_Ailk_Bjlk_BBH_MT64x128x32_MI32x32x2x2_SE_AF0EM1_ASEM2_ONLL1_SNLL0
    SolutionIndex: 114
    SolutionIndex: 115
    SolutionIndex: 116
    SolutionIndex: 117
    SolutionIndex: 118
    SolutionIndex: 119
    SolutionIndex: 120
    SolutionIndex: 121
    SolutionIndex: 122
    SolutionIndex: 123
    SolutionIndex: 124
    SolutionIndex: 125
    SolutionIndex: 126
    SolutionIndex: 127
    SolutionIndex: 128
    SolutionIndex: 129
    SolutionIndex: 130
    SolutionIndex: 131
    SolutionIndex: 132
    SolutionIndex: 133
    SolutionIndex: 134
    SolutionIndex: 135
    SolutionIndex: 136
    SolutionIndex: 137
    SolutionIndex: 138
    SolutionIndex: 139
    SolutionIndex: 140
    SolutionIndex: 141
    SolutionIndex: 142
    SolutionIndex: 143
    SolutionIndex: 144
    SolutionIndex: 145
    SolutionIndex: 146
    SolutionIndex: 147
    SolutionIndex: 148
    SolutionIndex: 149
    SolutionIndex: 150
    SolutionIndex: 151
    SolutionIndex: 152
    SolutionIndex: 153
    SolutionIndex: 154
    SolutionIndex: 155
    SolutionIndex: 156
    SolutionIndex: 157
    SolutionIndex: 158
    SolutionIndex: 159
    SolutionIndex: 160
    SolutionIndex: 161
    SolutionIndex: 162
    SolutionIndex: 163
    SolutionIndex: 164
    SolutionIndex: 165
    SolutionIndex: 166
    SolutionIndex: 167
    SolutionIndex: 168
    SolutionIndex: 169
    SolutionIndex: 170
    SolutionIndex: 171
    SolutionIndex: 172
    SolutionIndex: 173
    SolutionIndex: 174
    SolutionIndex: 175
    SolutionIndex: 176
    SolutionIndex: 177
    SolutionIndex: 178
    SolutionIndex: 179
    SolutionIndex: 180
    SolutionIndex: 181
- - - [34, 64, 1, 34]
    - [33, 11.0]
  - - [64, 15, 10880, 15]
    - [32, 1205.0]
  - - [32, 64, 1, 35]
    - [32, 8.0]
  - - [512, 32, 1, 1600]
    - [70, 619.0]
  - - [256, 13568, 1, 8976]
    - [59, 45437.0]
  - - [256, 9728, 1, 8976]
    - [82, 38722.0]
  - - [1024, 256, 1, 3072]
    - [35, 11504.0]
  - - [74, 2048, 1, 512]
    - [79, 4217.0]
  - - [1024, 4096, 1, 10080]
    - [65, 33480.0]
  - - [1024, 256, 1, 2816]
    - [60, 11364.0]
  - - [64, 21, 1, 17]
    - [28, 3.0]
  - - [64, 30, 2048, 30]
    - [57, 2937.0]
  - - [100, 2048, 1, 512]
    - [79, 5120.0]
  - - [64, 32, 1, 35]
    - [32, 8.0]
  - - [1024, 256, 1, 9728]
    - [35, 13129.0]
  - - [1024, 64, 1, 960]
    - [70, 2131.0]
  - - [4096, 1024, 1, 10064]
    - [81, 35436.0]
  - - [1024, 256, 1, 11520]
    - [35, 13273.0]
  - - [1024, 1024, 1, 3840]
    - [84, 26187.0]
  - - [1024, 42720, 1, 6528]
    - [62, 50182.0]
  - - [21, 64, 1, 21]
    - [30, 4.0]
  - - [1024, 64, 1, 512]
    - [70, 1632.0]
  - - [17, 64, 7680, 17]
    - [33, 1157.0]
  - - [256, 21248, 1, 8976]
    - [49, 46929.0]
  - - [4096, 1024, 1, 3840]
    - [81, 33819.0]
  - - [64, 30, 1, 31]
    - [32, 7.0]
  - - [30, 64, 2048, 31]
    - [33, 1914.0]
  - - [1024, 4096, 1, 4096]
    - [65, 32254.0]
  - - [5, 64, 960, 5]
    - [33, 88.0]
  - - [1024, 1024, 1, 3968]
    - [84, 26334.0]
  - - [4096, 1024, 1, 3960]
    - [43, 33611.0]
  - - [1024, 4096, 1, 7104]
    - [43, 33066.0]
  - - [256, 6144, 1, 8976]
    - [80, 36163.0]
  - - [15, 64, 1, 15]
    - [23, 2.0]
  - - [15, 64, 7680, 15]
    - [33, 945.0]
  - - [64, 24, 1, 24]
    - [32, 5.0]
  - - [17, 64, 1, 15]
    - [51, 3.0]
  - - [4096, 1024, 1, 7200]
    - [81, 35558.0]
  - - [64, 33, 1920, 33]
    - [72, 3312.0]
  - - [4096, 1024, 1, 9216]
    - [81, 36080.0]
  - - [2048, 2048, 1, 960]
    - [65, 27060.0]
  - - [64, 35, 1, 35]
    - [28, 8.0]
  - - [32, 64, 1, 32]
    - [33, 10.0]
  - - [256, 11264, 1, 8976]
    - [46, 37956.0]
  - - [1024, 256, 1, 5376]
    - [35, 12467.0]
  - - [1024, 42720, 1, 3968]
    - [63, 49025.0]
  - - [64, 17, 7680, 17]
    - [57, 1416.0]
  - - [64, 34, 1, 24]
    - [32, 7.0]
  - - [256, 4096, 1, 8976]
    - [63, 27348.0]
  - - [4096, 1024, 1, 2048]
    - [78, 33028.0]
  - - [256, 2560, 1, 8976]
    - [61, 30689.0]
  - - [256, 4864, 1, 8976]
    - [63, 32475.0]
  - - [1024, 1024, 1, 4096]
    - [76, 26304.0]
  - - [1024, 256, 1, 7936]
    - [35, 12944.0]
  - - [1024, 4096, 1, 3240]
    - [65, 31568.0]
  - - [4096, 1024, 1, 8064]
    - [81, 35421.0]
  - - [1024, 256, 1, 14848]
    - [35, 13451.0]
  - - [64, 15, 7680, 15]
    - [68, 1183.0]
  - - [512, 512, 1, 1600]
    - [66, 10005.0]
  - - [1024, 256, 1, 8448]
    - [35, 12972.0]
  - - [560, 1024, 1, 1600]
    - [48, 21929.0]
  - - [256, 22016, 1, 8976]
    - [49, 48528.0]
  - - [1024, 1024, 1, 3960]
    - [63, 25952.0]
  - - [1024, 2, 1, 2048]
    - [48, 85.0]
  - - [1024, 256, 1, 15104]
    - [35, 13413.0]
  - - [256, 19968, 1, 8976]
    - [49, 44228.0]
  - - [4096, 1024, 1, 7104]
    - [81, 35676.0]
  - - [1024, 4096, 1, 3960]
    - [43, 32567.0]
  - - [1024, 256, 1, 22016]
    - [35, 13632.0]
  - - [1024, 256, 1, 15872]
    - [35, 13505.0]
  - - [1024, 1024, 1, 32]
    - [89, 2558.0]
  - - [64, 15, 1, 15]
    - [26, 2.0]
  - - [256, 12800, 1, 8976]
    - [69, 42920.0]
  - - [1024, 1024, 1, 6528]
    - [84, 27129.0]
  - - [1024, 42720, 1, 3960]
    - [63, 48888.0]
  - - [256, 11008, 1, 8976]
    - [87, 42670.0]
  - - [1024, 256, 1, 6144]
    - [35, 12718.0]
  - - [1024, 4096, 1, 10200]
    - [43, 33971.0]
  - - [64, 512, 64, 512]
    - [88, 24582.0]
  - - [30, 64, 1, 30]
    - [73, 8.0]
  - - [1024, 1024, 1, 3240]
    - [63, 25445.0]
  - - [1024, 2, 1, 32]
    - [31, 9.0]
  - - [256, 15104, 1, 8976]
    - [59, 50399.0]
  - - [1024, 4096, 1, 3840]
    - [43, 32326.0]
  - - [30, 64, 1, 31]
    - [51, 9.0]
  - - [34, 64, 1, 24]
    - [77, 9.0]
  - - [1024, 1024, 1, 8064]
    - [63, 27454.0]
  - - [64, 30, 1, 30]
    - [32, 7.0]
  - - [3200, 2048, 1, 1024]
    - [56, 34996.0]
  - - [27, 64, 1920, 27]
    - [51, 1659.0]
  - - [14, 64, 1, 14]
    - [23, 1.0]
  - - [1024, 256, 1, 1024]
    - [90, 8761.0]
  - - [1024, 256, 1, 18944]
    - [35, 13565.0]
  - - [1024, 256, 1, 10496]
    - [35, 13188.0]
  - - [256, 11776, 1, 8976]
    - [69, 39616.0]
  - - [64, 17, 1, 17]
    - [24, 2.0]
  - - [1024, 256, 1, 17152]
    - [35, 13514.0]
  - - [64, 14, 10880, 14]
    - [68, 1104.0]
  - - [64, 27, 1920, 33]
    - [57, 2900.0]
  - - [17, 64, 7680, 15]
    - [33, 1061.0]
  - - [1024, 256, 1, 17408]
    - [35, 13546.0]
  - - [1024, 1024, 1, 9216]
    - [63, 27573.0]
  - - [256, 4352, 1, 8976]
    - [63, 29131.0]
  - - [64, 17, 1, 15]
    - [24, 2.0]
  - - [1024, 1024, 1, 960]
    - [63, 21042.0]
  - - [1024, 256, 1, 33536]
    - [35, 13767.0]
  - - [1024, 4096, 1, 2048]
    - [39, 30443.0]
  - - [768, 2048, 1, 256]
    - [87, 16947.0]
  - - [1024, 256, 1, 7680]
    - [35, 12899.0]
  - - [15, 64, 10880, 15]
    - [33, 965.0]
  - - [64, 32, 1, 32]
    - [29, 9.0]
  - - [1024, 256, 1, 1280]
    - [38, 9447.0]
  - - [1024, 256, 1, 4096]
    - [35, 12081.0]
  - - [256, 9984, 1, 8976]
    - [60, 40147.0]
  - - [1024, 4096, 1, 6528]
    - [43, 33212.0]
  - - [256, 128, 1, 32768]
    - [35, 1720.0]
  - - [1024, 4096, 1, 7200]
    - [75, 32548.0]
  - - [1024, 1024, 1, 2048]
    - [76, 24470.0]
  - - [1024, 256, 1, 19712]
    - [35, 13573.0]
  - - [4096, 4096, 1, 1024]
    - [36, 25235.0]
  - - [560, 1024, 1, 200]
    - [58, 7834.0]
  - - [256, 13312, 1, 8976]
    - [53, 44528.0]
  - - [256, 3840, 1, 8976]
    - [40, 35182.0]
  - - [1024, 4096, 1, 8064]
    - [65, 33322.0]
  - - [9, 64, 512, 9]
    - [33, 217.0]
  - - [4096, 1024, 1, 10080]
    - [41, 36237.0]
  - - [64, 31, 1, 31]
    - [32, 7.0]
  - - [33, 32, 1600, 33]
    - [33, 1434.0]
  - - [256, 1280, 1, 8976]
    - [35, 15909.0]
  - - [64, 30, 2048, 31]
    - [74, 2970.0]
  - - [256, 5632, 1, 8976]
    - [86, 36608.0]
  - - [256, 18688, 1, 8976]
    - [87, 46410.0]
  - - [2048, 2048, 1, 1024]
    - [75, 27860.0]
  - - [1024, 256, 1, 3584]
    - [60, 11863.0]
  - - [17, 64, 1, 17]
    - [30, 3.0]
  - - [1024, 2, 1, 4]
    - [23, 1.0]
  - - [33, 32, 200, 33]
    - [30, 703.0]
  - - [30, 64, 2048, 30]
    - [51, 1883.0]
  - - [1024, 256, 1, 19968]
    - [35, 13586.0]
  - - [64, 21, 1, 21]
    - [24, 3.0]
  - - [15, 64, 10880, 14]
    - [33, 914.0]
  - - [1024, 1024, 1, 1600]
    - [84, 23484.0]
  - - [1024, 1024, 1, 7104]
    - [63, 27330.0]
  - - [1024, 256, 1, 3328]
    - [35, 11626.0]
  - - [64, 15, 10880, 14]
    - [68, 1163.0]
  - - [35, 64, 1, 35]
    - [33, 11.0]
  - - [256, 2816, 1, 8976]
    - [82, 32562.0]
  - - [4096, 1024, 1, 4096]
    - [41, 34481.0]
  - - [4096, 1024, 1, 10200]
    - [81, 35324.0]
  - - [1024, 42720, 1, 9520]
    - [62, 50806.0]
  - - [3, 64, 512, 3]
    - [33, 22.0]
  - - [4096, 1024, 1, 3240]
    - [75, 33048.0]
  - - [1024, 42720, 1, 7104]
    - [62, 50314.0]
  - - [1024, 256, 1, 4608]
    - [35, 12207.0]
  - - [256, 15872, 1, 8976]
    - [35, 39530.0]
  - - [33, 64, 1920, 33]
    - [33, 2028.0]
  - - [480, 1024, 1, 32768]
    - [60, 25343.0]
  - - [1024, 256, 1, 6400]
    - [35, 12664.0]
  - - [1024, 42720, 1, 10080]
    - [44, 50871.0]
  - - [1024, 1024, 1, 4]
    - [45, 316.0]
  - - [256, 44505, 1, 8976]
    - [59, 49661.0]
  - - [1024, 256, 1, 5120]
    - [35, 12446.0]
  - - [74, 2048, 1, 960]
    - [79, 4969.0]
  - - [256, 33536, 1, 8976]
    - [87, 47864.0]
  - - [4096, 1024, 1, 9520]
    - [81, 35286.0]
  - - [1024, 256, 1, 21248]
    - [35, 13615.0]
  - - [4096, 1024, 1, 8160]
    - [81, 35628.0]
  - - [256, 8192, 1, 8976]
    - [87, 30307.0]
  - - [1024, 1024, 1, 512]
    - [76, 17163.0]
  - - [31, 64, 1, 31]
    - [51, 9.0]
  - - [21, 64, 1, 17]
    - [33, 4.0]
  - - [512, 256, 1, 32768]
    - [35, 6879.0]
  - - [1024, 1024, 1, 8160]
    - [76, 27403.0]
  - - [1024, 1024, 1, 10080]
    - [76, 27663.0]
  - - [2048, 960, 1, 1]
    - [37, 97.0]
  - - [1024, 256, 1, 13568]
    - [35, 13367.0]
  - - [256, 32768, 1, 1]
    - [42, 184.0]
  - - [1024, 256, 1, 28672]
    - [35, 13706.0]
  - - [64, 15, 1, 15]
    - [26, 2.0]
  - - [1024, 1024, 1, 10200]
    - [63, 27520.0]
  - - [128, 64, 512, 128]
    - [87, 7867.0]
  - - [31, 64, 2048, 31]
    - [33, 1939.0]
  - - [256, 20992, 1, 8976]
    - [49, 46385.0]
  - - [64, 17, 1, 17]
    - [24, 2.0]
  - - [1024, 256, 1, 16128]
    - [35, 13485.0]
  - - [256, 3584, 1, 8976]
    - [47, 34155.0]
  - - [512, 64, 1, 512]
    - [34, 810.0]
  - - [4096, 1024, 1, 6528]
    - [81, 35056.0]
  - - [1024, 4096, 1, 3968]
    - [65, 32354.0]
  - - [512, 32, 1, 200]
    - [58, 231.0]
  - - [256, 14336, 1, 8976]
    - [46, 47670.0]
  - - [64, 27, 1920, 27]
    - [72, 2483.0]
  - - [17, 64, 1, 17]
    - [30, 3.0]
  - - [64, 34, 1, 34]
    - [83, 9.0]
  - - [1024, 4096, 1, 10064]
    - [65, 33325.0]
  - - [1600, 1024, 1, 960]
    - [87, 33099.0]
  - - [64, 17, 7680, 15]
    - [68, 1324.0]
  - - [1024, 1024, 1, 32768]
    - [63, 28336.0]
  - - [15, 64, 1, 14]
    - [27, 2.0]
  - - [24, 64, 1, 24]
    - [33, 6.0]
  - - [1024, 1024, 1, 10064]
    - [63, 27516.0]
  - - [256, 5120, 1, 8976]
    - [76, 33932.0]
  - - [256, 3328, 1, 8976]
    - [88, 35496.0]
  - - [1024, 256, 1, 5632]
    - [35, 12529.0]
  - - [2048, 2048, 1, 512]
    - [43, 22710.0]
  - - [64, 14, 1, 14]
    - [27, 2.0]
  - - [256, 8960, 1, 8976]
    - [35, 37500.0]
  - - [1600, 1024, 1, 512]
    - [87, 28807.0]
  - - [13, 512, 1, 32768]
    - [64, 298.0]
  - - [1024, 30528, 1, 2048]
    - [55, 47042.0]
  - - [256, 26112, 1, 8976]
    - [59, 43974.0]
  - - [256, 32512, 1, 8976]
    - [87, 46317.0]
  - - [1024, 4096, 1, 9216]
    - [65, 33592.0]
  - - [257, 4096, 1, 1024]
    - [78, 19194.0]
  - - [1024, 256, 1, 14336]
    - [35, 13414.0]
  - - [512, 64, 64, 512]
    - [63, 13794.0]
  - - [1024, 1024, 1, 9520]
    - [63, 27521.0]
  - - [1024, 256, 1, 9984]
    - [35, 13139.0]
  - - [1024, 512, 1, 32768]
    - [35, 27454.0]
  - - [27, 64, 1920, 33]
    - [33, 2004.0]
  - - [1024, 42720, 1, 7200]
    - [62, 50378.0]
  - - [1024, 30528, 1, 4096]
    - [55, 49600.0]
  - - [27, 128, 32768, 27]
    - [33, 1994.0]
  - - [256, 7168, 1, 8976]
    - [67, 39678.0]
  - - [1024, 256, 1, 4352]
    - [60, 12055.0]
  - - [512, 2048, 1, 256]
    - [63, 11941.0]
  - - [256, 12544, 1, 8976]
    - [54, 42082.0]
  - - [2048, 256, 1, 1024]
    - [38, 16735.0]
  - - [1024, 256, 1, 21504]
    - [35, 13601.0]
  - - [256, 17152, 1, 8976]
    - [87, 42736.0]
  - - [64, 31, 2048, 31]
    - [57, 3022.0]
  - - [14, 64, 10880, 14]
    - [33, 878.0]
  - - [256, 11520, 1, 8976]
    - [87, 44433.0]
  - - [1024, 4096, 1, 9520]
    - [43, 33299.0]
  - - [256, 10496, 1, 8976]
    - [87, 40818.0]
  - - [1024, 4096, 1, 8160]
    - [43, 33541.0]
  - - [67, 2048, 1, 512]
    - [52, 2987.0]
  - - [256, 5888, 1, 8976]
    - [41, 38254.0]
  - - [256, 17408, 1, 8976]
    - [76, 38525.0]
  - - [1024, 1024, 1, 7200]
    - [63, 27322.0]
  - - [1024, 256, 1, 8192]
    - [35, 12974.0]
  - - [15, 64, 1, 15]
    - [23, 2.0]
  - - [256, 10240, 1, 8976]
    - [71, 34546.0]
  - - [256, 14848, 1, 8976]
    - [85, 49430.0]
  - - [256, 20480, 1, 8976]
    - [25, 36713.0]
  - - [64, 15, 1, 14]
    - [28, 2.0]
  - - [64, 512, 1, 512]
    - [90, 945.0]
  - - [512, 512, 1, 200]
    - [50, 3260.0]
  - - [5, 64, 512, 5]
    - [33, 71.0]
  - - [1024, 256, 1, 12032]
    - [35, 13324.0]
  - - [64, 128, 512, 128]
    - [88, 15903.0]
  - - [4096, 1024, 1, 3968]
    - [43, 33893.0]
  - - [1024, 256, 1, 2304]
    - [60, 10770.0]
  - - [1024, 1024, 1, 200]
    - [72, 9930.0]
  - - [256, 16128, 1, 8976]
    - [87, 40272.0]
  - - [34, 64, 1, 34]
    - [124, 11.0]
  - - [64, 15, 10880, 15]
    - [123, 1205.0]
  - - [32, 64, 1, 35]
    - [123, 8.0]
  - - [512, 32, 1, 1600]
    - [161, 619.0]
  - - [256, 13568, 1, 8976]
    - [150, 45437.0]
  - - [256, 9728, 1, 8976]
    - [173, 38722.0]
  - - [1024, 256, 1, 3072]
    - [126, 11504.0]
  - - [74, 2048, 1, 512]
    - [170, 4217.0]
  - - [1024, 4096, 1, 10080]
    - [156, 33480.0]
  - - [1024, 256, 1, 2816]
    - [151, 11364.0]
  - - [64, 21, 1, 17]
    - [119, 3.0]
  - - [64, 30, 2048, 30]
    - [148, 2937.0]
  - - [100, 2048, 1, 512]
    - [170, 5120.0]
  - - [64, 32, 1, 35]
    - [123, 8.0]
  - - [1024, 256, 1, 9728]
    - [126, 13129.0]
  - - [1024, 64, 1, 960]
    - [161, 2131.0]
  - - [4096, 1024, 1, 10064]
    - [172, 35436.0]
  - - [1024, 256, 1, 11520]
    - [126, 13273.0]
  - - [1024, 1024, 1, 3840]
    - [175, 26187.0]
  - - [1024, 42720, 1, 6528]
    - [153, 50182.0]
  - - [21, 64, 1, 21]
    - [121, 4.0]
  - - [1024, 64, 1, 512]
    - [161, 1632.0]
  - - [17, 64, 7680, 17]
    - [124, 1157.0]
  - - [256, 21248, 1, 8976]
    - [140, 46929.0]
  - - [4096, 1024, 1, 3840]
    - [172, 33819.0]
  - - [64, 30, 1, 31]
    - [123, 7.0]
  - - [30, 64, 2048, 31]
    - [124, 1914.0]
  - - [1024, 4096, 1, 4096]
    - [156, 32254.0]
  - - [5, 64, 960, 5]
    - [124, 88.0]
  - - [1024, 1024, 1, 3968]
    - [175, 26334.0]
  - - [4096, 1024, 1, 3960]
    - [134, 33611.0]
  - - [1024, 4096, 1, 7104]
    - [134, 33066.0]
  - - [256, 6144, 1, 8976]
    - [171, 36163.0]
  - - [15, 64, 1, 15]
    - [114, 2.0]
  - - [15, 64, 7680, 15]
    - [124, 945.0]
  - - [64, 24, 1, 24]
    - [123, 5.0]
  - - [17, 64, 1, 15]
    - [142, 3.0]
  - - [4096, 1024, 1, 7200]
    - [172, 35558.0]
  - - [64, 33, 1920, 33]
    - [163, 3312.0]
  - - [4096, 1024, 1, 9216]
    - [172, 36080.0]
  - - [2048, 2048, 1, 960]
    - [156, 27060.0]
  - - [64, 35, 1, 35]
    - [119, 8.0]
  - - [32, 64, 1, 32]
    - [124, 10.0]
  - - [256, 11264, 1, 8976]
    - [137, 37956.0]
  - - [1024, 256, 1, 5376]
    - [126, 12467.0]
  - - [1024, 42720, 1, 3968]
    - [154, 49025.0]
  - - [64, 17, 7680, 17]
    - [148, 1416.0]
  - - [64, 34, 1, 24]
    - [123, 7.0]
  - - [256, 4096, 1, 8976]
    - [154, 27348.0]
  - - [4096, 1024, 1, 2048]
    - [169, 33028.0]
  - - [256, 2560, 1, 8976]
    - [152, 30689.0]
  - - [256, 4864, 1, 8976]
    - [154, 32475.0]
  - - [1024, 1024, 1, 4096]
    - [167, 26304.0]
  - - [1024, 256, 1, 7936]
    - [126, 12944.0]
  - - [1024, 4096, 1, 3240]
    - [156, 31568.0]
  - - [4096, 1024, 1, 8064]
    - [172, 35421.0]
  - - [1024, 256, 1, 14848]
    - [126, 13451.0]
  - - [64, 15, 7680, 15]
    - [159, 1183.0]
  - - [512, 512, 1, 1600]
    - [157, 10005.0]
  - - [1024, 256, 1, 8448]
    - [126, 12972.0]
  - - [560, 1024, 1, 1600]
    - [139, 21929.0]
  - - [256, 22016, 1, 8976]
    - [140, 48528.0]
  - - [1024, 1024, 1, 3960]
    - [154, 25952.0]
  - - [1024, 2, 1, 2048]
    - [139, 85.0]
  - - [1024, 256, 1, 15104]
    - [126, 13413.0]
  - - [256, 19968, 1, 8976]
    - [140, 44228.0]
  - - [4096, 1024, 1, 7104]
    - [172, 35676.0]
  - - [1024, 4096, 1, 3960]
    - [134, 32567.0]
  - - [1024, 256, 1, 22016]
    - [126, 13632.0]
  - - [1024, 256, 1, 15872]
    - [126, 13505.0]
  - - [1024, 1024, 1, 32]
    - [180, 2558.0]
  - - [64, 15, 1, 15]
    - [117, 2.0]
  - - [256, 12800, 1, 8976]
    - [160, 42920.0]
  - - [1024, 1024, 1, 6528]
    - [175, 27129.0]
  - - [1024, 42720, 1, 3960]
    - [154, 48888.0]
  - - [256, 11008, 1, 8976]
    - [178, 42670.0]
  - - [1024, 256, 1, 6144]
    - [126, 12718.0]
  - - [1024, 4096, 1, 10200]
    - [134, 33971.0]
  - - [64, 512, 64, 512]
    - [179, 24582.0]
  - - [30, 64, 1, 30]
    - [164, 8.0]
  - - [1024, 1024, 1, 3240]
    - [154, 25445.0]
  - - [1024, 2, 1, 32]
    - [122, 9.0]
  - - [256, 15104, 1, 8976]
    - [150, 50399.0]
  - - [1024, 4096, 1, 3840]
    - [134, 32326.0]
  - - [30, 64, 1, 31]
    - [142, 9.0]
  - - [34, 64, 1, 24]
    - [168, 9.0]
  - - [1024, 1024, 1, 8064]
    - [154, 27454.0]
  - - [64, 30, 1, 30]
    - [123, 7.0]
  - - [3200, 2048, 1, 1024]
    - [147, 34996.0]
  - - [27, 64, 1920, 27]
    - [142, 1659.0]
  - - [14, 64, 1, 14]
    - [114, 1.0]
  - - [1024, 256, 1, 1024]
    - [181, 8761.0]
  - - [1024, 256, 1, 18944]
    - [126, 13565.0]
  - - [1024, 256, 1, 10496]
    - [126, 13188.0]
  - - [256, 11776, 1, 8976]
    - [160, 39616.0]
  - - [64, 17, 1, 17]
    - [115, 2.0]
  - - [1024, 256, 1, 17152]
    - [126, 13514.0]
  - - [64, 14, 10880, 14]
    - [159, 1104.0]
  - - [64, 27, 1920, 33]
    - [148, 2900.0]
  - - [17, 64, 7680, 15]
    - [124, 1061.0]
  - - [1024, 256, 1, 17408]
    - [126, 13546.0]
  - - [1024, 1024, 1, 9216]
    - [154, 27573.0]
  - - [256, 4352, 1, 8976]
    - [154, 29131.0]
  - - [64, 17, 1, 15]
    - [115, 2.0]
  - - [1024, 1024, 1, 960]
    - [154, 21042.0]
  - - [1024, 256, 1, 33536]
    - [126, 13767.0]
  - - [1024, 4096, 1, 2048]
    - [130, 30443.0]
  - - [768, 2048, 1, 256]
    - [178, 16947.0]
  - - [1024, 256, 1, 7680]
    - [126, 12899.0]
  - - [15, 64, 10880, 15]
    - [124, 965.0]
  - - [64, 32, 1, 32]
    - [120, 9.0]
  - - [1024, 256, 1, 1280]
    - [129, 9447.0]
  - - [1024, 256, 1, 4096]
    - [126, 12081.0]
  - - [256, 9984, 1, 8976]
    - [151, 40147.0]
  - - [1024, 4096, 1, 6528]
    - [134, 33212.0]
  - - [256, 128, 1, 32768]
    - [126, 1720.0]
  - - [1024, 4096, 1, 7200]
    - [166, 32548.0]
  - - [1024, 1024, 1, 2048]
    - [167, 24470.0]
  - - [1024, 256, 1, 19712]
    - [126, 13573.0]
  - - [4096, 4096, 1, 1024]
    - [127, 25235.0]
  - - [560, 1024, 1, 200]
    - [149, 7834.0]
  - - [256, 13312, 1, 8976]
    - [144, 44528.0]
  - - [256, 3840, 1, 8976]
    - [131, 35182.0]
  - - [1024, 4096, 1, 8064]
    - [156, 33322.0]
  - - [9, 64, 512, 9]
    - [124, 217.0]
  - - [4096, 1024, 1, 10080]
    - [132, 36237.0]
  - - [64, 31, 1, 31]
    - [123, 7.0]
  - - [33, 32, 1600, 33]
    - [124, 1434.0]
  - - [256, 1280, 1, 8976]
    - [126, 15909.0]
  - - [64, 30, 2048, 31]
    - [165, 2970.0]
  - - [256, 5632, 1, 8976]
    - [177, 36608.0]
  - - [256, 18688, 1, 8976]
    - [178, 46410.0]
  - - [2048, 2048, 1, 1024]
    - [166, 27860.0]
  - - [1024, 256, 1, 3584]
    - [151, 11863.0]
  - - [17, 64, 1, 17]
    - [121, 3.0]
  - - [1024, 2, 1, 4]
    - [114, 1.0]
  - - [33, 32, 200, 33]
    - [121, 703.0]
  - - [30, 64, 2048, 30]
    - [142, 1883.0]
  - - [1024, 256, 1, 19968]
    - [126, 13586.0]
  - - [64, 21, 1, 21]
    - [115, 3.0]
  - - [15, 64, 10880, 14]
    - [124, 914.0]
  - - [1024, 1024, 1, 1600]
    - [175, 23484.0]
  - - [1024, 1024, 1, 7104]
    - [154, 27330.0]
  - - [1024, 256, 1, 3328]
    - [126, 11626.0]
  - - [64, 15, 10880, 14]
    - [159, 1163.0]
  - - [35, 64, 1, 35]
    - [124, 11.0]
  - - [256, 2816, 1, 8976]
    - [173, 32562.0]
  - - [4096, 1024, 1, 4096]
    - [132, 34481.0]
  - - [4096, 1024, 1, 10200]
    - [172, 35324.0]
  - - [1024, 42720, 1, 9520]
    - [153, 50806.0]
  - - [3, 64, 512, 3]
    - [124, 22.0]
  - - [4096, 1024, 1, 3240]
    - [166, 33048.0]
  - - [1024, 42720, 1, 7104]
    - [153, 50314.0]
  - - [1024, 256, 1, 4608]
    - [126, 12207.0]
  - - [256, 15872, 1, 8976]
    - [126, 39530.0]
  - - [33, 64, 1920, 33]
    - [124, 2028.0]
  - - [480, 1024, 1, 32768]
    - [151, 25343.0]
  - - [1024, 256, 1, 6400]
    - [126, 12664.0]
  - - [1024, 42720, 1, 10080]
    - [135, 50871.0]
  - - [1024, 1024, 1, 4]
    - [136, 316.0]
  - - [256, 44505, 1, 8976]
    - [150, 49661.0]
  - - [1024, 256, 1, 5120]
    - [126, 12446.0]
  - - [74, 2048, 1, 960]
    - [170, 4969.0]
  - - [256, 33536, 1, 8976]
    - [178, 47864.0]
  - - [4096, 1024, 1, 9520]
    - [172, 35286.0]
  - - [1024, 256, 1, 21248]
    - [126, 13615.0]
  - - [4096, 1024, 1, 8160]
    - [172, 35628.0]
  - - [256, 8192, 1, 8976]
    - [178, 30307.0]
  - - [1024, 1024, 1, 512]
    - [167, 17163.0]
  - - [31, 64, 1, 31]
    - [142, 9.0]
  - - [21, 64, 1, 17]
    - [124, 4.0]
  - - [512, 256, 1, 32768]
    - [126, 6879.0]
  - - [1024, 1024, 1, 8160]
    - [167, 27403.0]
  - - [1024, 1024, 1, 10080]
    - [167, 27663.0]
  - - [2048, 960, 1, 1]
    - [128, 97.0]
  - - [1024, 256, 1, 13568]
    - [126, 13367.0]
  - - [256, 32768, 1, 1]
    - [133, 184.0]
  - - [1024, 256, 1, 28672]
    - [126, 13706.0]
  - - [64, 15, 1, 15]
    - [117, 2.0]
  - - [1024, 1024, 1, 10200]
    - [154, 27520.0]
  - - [128, 64, 512, 128]
    - [178, 7867.0]
  - - [31, 64, 2048, 31]
    - [124, 1939.0]
  - - [256, 20992, 1, 8976]
    - [140, 46385.0]
  - - [64, 17, 1, 17]
    - [115, 2.0]
  - - [1024, 256, 1, 16128]
    - [126, 13485.0]
  - - [256, 3584, 1, 8976]
    - [138, 34155.0]
  - - [512, 64, 1, 512]
    - [125, 810.0]
  - - [4096, 1024, 1, 6528]
    - [172, 35056.0]
  - - [1024, 4096, 1, 3968]
    - [156, 32354.0]
  - - [512, 32, 1, 200]
    - [149, 231.0]
  - - [256, 14336, 1, 8976]
    - [137, 47670.0]
  - - [64, 27, 1920, 27]
    - [163, 2483.0]
  - - [17, 64, 1, 17]
    - [121, 3.0]
  - - [64, 34, 1, 34]
    - [174, 9.0]
  - - [1024, 4096, 1, 10064]
    - [156, 33325.0]
  - - [1600, 1024, 1, 960]
    - [178, 33099.0]
  - - [64, 17, 7680, 15]
    - [159, 1324.0]
  - - [1024, 1024, 1, 32768]
    - [154, 28336.0]
  - - [15, 64, 1, 14]
    - [118, 2.0]
  - - [24, 64, 1, 24]
    - [124, 6.0]
  - - [1024, 1024, 1, 10064]
    - [154, 27516.0]
  - - [256, 5120, 1, 8976]
    - [167, 33932.0]
  - - [256, 3328, 1, 8976]
    - [179, 35496.0]
  - - [1024, 256, 1, 5632]
    - [126, 12529.0]
  - - [2048, 2048, 1, 512]
    - [134, 22710.0]
  - - [64, 14, 1, 14]
    - [118, 2.0]
  - - [256, 8960, 1, 8976]
    - [126, 37500.0]
  - - [1600, 1024, 1, 512]
    - [178, 28807.0]
  - - [13, 512, 1, 32768]
    - [155, 298.0]
  - - [1024, 30528, 1, 2048]
    - [146, 47042.0]
  - - [256, 26112, 1, 8976]
    - [150, 43974.0]
  - - [256, 32512, 1, 8976]
    - [178, 46317.0]
  - - [1024, 4096, 1, 9216]
    - [156, 33592.0]
  - - [257, 4096, 1, 1024]
    - [169, 19194.0]
  - - [1024, 256, 1, 14336]
    - [126, 13414.0]
  - - [512, 64, 64, 512]
    - [154, 13794.0]
  - - [1024, 1024, 1, 9520]
    - [154, 27521.0]
  - - [1024, 256, 1, 9984]
    - [126, 13139.0]
  - - [1024, 512, 1, 32768]
    - [126, 27454.0]
  - - [27, 64, 1920, 33]
    - [124, 2004.0]
  - - [1024, 42720, 1, 7200]
    - [153, 50378.0]
  - - [1024, 30528, 1, 4096]
    - [146, 49600.0]
  - - [27, 128, 32768, 27]
    - [124, 1994.0]
  - - [256, 7168, 1, 8976]
    - [158, 39678.0]
  - - [1024, 256, 1, 4352]
    - [151, 12055.0]
  - - [512, 2048, 1, 256]
    - [154, 11941.0]
  - - [256, 12544, 1, 8976]
    - [145, 42082.0]
  - - [2048, 256, 1, 1024]
    - [129, 16735.0]
  - - [1024, 256, 1, 21504]
    - [126, 13601.0]
  - - [256, 17152, 1, 8976]
    - [178, 42736.0]
  - - [64, 31, 2048, 31]
    - [148, 3022.0]
  - - [14, 64, 10880, 14]
    - [124, 878.0]
  - - [256, 11520, 1, 8976]
    - [178, 44433.0]
  - - [1024, 4096, 1, 9520]
    - [134, 33299.0]
  - - [256, 10496, 1, 8976]
    - [178, 40818.0]
  - - [1024, 4096, 1, 8160]
    - [134, 33541.0]
  - - [67, 2048, 1, 512]
    - [143, 2987.0]
  - - [256, 5888, 1, 8976]
    - [132, 38254.0]
  - - [256, 17408, 1, 8976]
    - [167, 38525.0]
  - - [1024, 1024, 1, 7200]
    - [154, 27322.0]
  - - [1024, 256, 1, 8192]
    - [126, 12974.0]
  - - [15, 64, 1, 15]
    - [114, 2.0]
  - - [256, 10240, 1, 8976]
    - [162, 34546.0]
  - - [256, 14848, 1, 8976]
    - [176, 49430.0]
  - - [256, 20480, 1, 8976]
    - [116, 36713.0]
  - - [64, 15, 1, 14]
    - [119, 2.0]
  - - [64, 512, 1, 512]
    - [181, 945.0]
  - - [512, 512, 1, 200]
    - [141, 3260.0]
  - - [5, 64, 512, 5]
    - [124, 71.0]
  - - [1024, 256, 1, 12032]
    - [126, 13324.0]
  - - [64, 128, 512, 128]
    - [179, 15903.0]
  - - [4096, 1024, 1, 3968]
    - [134, 33893.0]
  - - [1024, 256, 1, 2304]
    - [151, 10770.0]
  - - [1024, 1024, 1, 200]
    - [163, 9930.0]
  - - [256, 16128, 1, 8976]
    - [178, 40272.0]
- null
