library/src/blas3/Tensile/Logic/asm_full/arcturus_Cijk_Ailk_Bljk_DB_GB.yaml
- {MinimumRequiredVersion: 4.25.0}
- arcturus
- gfx908
- [Device 7380, Device 7388, Device 738c, Device 7390]
    SolutionIndex: 0
    SolutionNameMin: Cijk_Ailk_Bljk_DB_GB_MT16x16x8_SN_NLCA1_NLCB1_TT2_2_WG8_8_1
    SolutionIndex: 1
    SolutionNameMin: Cijk_Ailk_Bljk_DB_GB_MT64x32x8_SN_NLCA1_NLCB1_TT4_4_WG16_8_1
    SolutionIndex: 2
    SolutionNameMin: Cijk_Ailk_Bljk_DB_GB_MT16x32x8_SN_NLCA1_NLCB1_TT2_2_WG8_16_1
    SolutionIndex: 3
    SolutionNameMin: Cijk_Ailk_Bljk_DB_GB_MT64x64x8_SN_NLCA1_NLCB1_TT4_4_WG16_16_1
    SolutionIndex: 4
    SolutionNameMin: Cijk_Ailk_Bljk_DB_GB_MT16x16x16_SN_NLCA1_NLCB1_TT2_2_WG8_8_1
    SolutionIndex: 5
    SolutionNameMin: Cijk_Ailk_Bljk_DB_GB_MT32x16x16_SN_NLCA1_NLCB1_TT2_2_WG16_8_1
    SolutionIndex: 6
    SolutionNameMin: Cijk_Ailk_Bljk_DB_GB_MT32x32x16_SN_NLCA1_NLCB1_TT2_2_WG16_16_1
- - - [32, 32, 8, 128, 32, 32, 32, 128]
    - [2, 85.0]
  - - [128, 128, 8, 128, 128, 128, 128, 128]
    - [2, 1295.0]
  - - [256, 256, 8, 128, 256, 256, 256, 128]
    - [1, 2519.0]
  - - [512, 512, 8, 128, 512, 512, 512, 128]
    - [3, 4773.0]
  - - [32, 32, 8, 512, 32, 32, 32, 512]
    - [4, 137.0]
  - - [128, 128, 8, 512, 128, 128, 128, 512]
    - [0, 1885.0]
  - - [256, 256, 8, 512, 256, 256, 256, 512]
    - [1, 3528.0]
  - - [512, 512, 8, 512, 512, 512, 512, 512]
    - [3, 5492.0]
  - - [32, 32, 8, 1024, 32, 32, 32, 1024]
    - [5, 157.0]
  - - [128, 128, 8, 1024, 128, 128, 128, 1024]
    - [5, 1976.0]
  - - [256, 256, 8, 1024, 256, 256, 256, 1024]
    - [1, 3770.0]
  - - [512, 512, 8, 1024, 512, 512, 512, 1024]
    - [3, 5641.0]
  - - [32, 128, 8, 128, 32, 32, 32, 128]
    - [2, 334.0]
  - - [32, 256, 8, 128, 32, 32, 32, 128]
    - [0, 643.0]
  - - [32, 512, 8, 128, 32, 32, 32, 128]
    - [0, 1226.0]
  - - [32, 128, 8, 512, 32, 32, 32, 512]
    - [5, 548.0]
  - - [32, 256, 8, 512, 32, 32, 32, 512]
    - [5, 1062.0]
  - - [32, 512, 8, 512, 32, 32, 32, 512]
    - [5, 1804.0]
  - - [32, 128, 8, 1024, 32, 32, 32, 1024]
    - [5, 627.0]
  - - [32, 256, 8, 1024, 32, 32, 32, 1024]
    - [6, 1178.0]
  - - [32, 512, 8, 1024, 32, 32, 32, 1024]
    - [5, 1974.0]
  - - [128, 32, 8, 128, 128, 128, 128, 128]
    - [0, 332.0]
  - - [256, 32, 8, 128, 256, 256, 256, 128]
    - [0, 668.0]
  - - [512, 32, 8, 128, 512, 512, 512, 128]
    - [0, 1303.0]
  - - [128, 32, 8, 512, 128, 128, 128, 512]
    - [5, 552.0]
  - - [256, 32, 8, 512, 256, 256, 256, 512]
    - [0, 1059.0]
  - - [512, 32, 8, 512, 512, 512, 512, 512]
    - [0, 1877.0]
  - - [128, 32, 8, 1024, 128, 128, 128, 1024]
    - [5, 633.0]
  - - [256, 32, 8, 1024, 256, 256, 256, 1024]
    - [5, 1185.0]
  - - [512, 32, 8, 1024, 512, 512, 512, 1024]
    - [0, 2051.0]
- null
