library/src/blas3/Tensile/Logic/asm_full/arcturus_Cijk_Ailk_Bljk_SB.yaml
- {MinimumRequiredVersion: 4.20.0}
- arcturus
- gfx908
- [Device 7380, Device 7388, Device 738c, Device 7390]
    SolutionIndex: 0
    SolutionIndex: 1
    SolutionIndex: 2
    SolutionIndex: 3
    SolutionIndex: 4
    SolutionIndex: 5
    SolutionIndex: 6
    SolutionIndex: 7
    SolutionIndex: 8
    SolutionIndex: 9
    SolutionIndex: 10
    SolutionIndex: 11
    SolutionIndex: 12
    SolutionIndex: 13
    SolutionIndex: 14
    SolutionIndex: 15
    SolutionIndex: 16
    SolutionIndex: 17
    SolutionIndex: 18
    SolutionIndex: 19
    SolutionIndex: 20
    SolutionIndex: 21
    SolutionIndex: 22
    SolutionIndex: 23
    SolutionIndex: 24
    SolutionIndex: 25
    SolutionIndex: 26
    SolutionIndex: 27
    SolutionIndex: 28
    SolutionIndex: 29
    SolutionIndex: 30
    SolutionIndex: 31
    SolutionIndex: 32
    SolutionIndex: 33
    SolutionIndex: 34
    SolutionIndex: 35
    SolutionIndex: 36
    SolutionIndex: 37
    SolutionIndex: 38
    SolutionIndex: 39
    SolutionIndex: 40
    SolutionIndex: 41
    SolutionIndex: 42
    SolutionNameMin: Cijk_Ailk_Bljk_SB_MT064x064x16_DTL0_EPS0_GRVW04_LPB00_PGR1_SNLL0_TT04_04_USFGRO00_VW04_WG16_16_01
    SolutionIndex: 43
    SolutionNameMin: Cijk_Ailk_Bljk_SB_MT128x128x24_DTL0_EPS1_GRVW04_LPB00_PGR1_SNLL1_TT08_08_USFGRO0_VW04_WG16_16_01
    SolutionIndex: 44
    SolutionNameMin: Cijk_Ailk_Bljk_SB_MT016x016x08_DTL0_EPS1_GRVW02_LPB00_PGR1_SNLL0_TT02_02_USFGRO01_VW02_WG08_08_02
    SolutionIndex: 45
    SolutionNameMin: Cijk_Ailk_Bljk_SB_MT016x016x16_DTL0_EPS1_GRVW02_LPB00_PGR1_SNLL0_TT02_02_USFGRO01_VW02_WG08_08_04
    SolutionIndex: 46
    SolutionNameMin: Cijk_Ailk_Bljk_SB_MT128x064x16_DTL0_EPS1_GRVW04_LPB00_PGR1_SNLL1_TT08_04_USFGRO0_VW04_WG16_16_01
    SolutionIndex: 47
    SolutionNameMin: Cijk_Ailk_Bljk_SB_MT128x064x16_DTL0_EPS0_GRVW04_LPB00_PGR0_SNLL0_TT08_04_USFGRO0_VW04_WG16_16_01
    SolutionIndex: 48
    SolutionNameMin: Cijk_Ailk_Bljk_SB_MT032x032x16_DTL0_EPS1_GRVW04_LPB00_PGR1_SNLL0_TT04_04_USFGRO0_VW04_WG08_08_02
    SolutionIndex: 49
    SolutionNameMin: Cijk_Ailk_Bljk_SB_MT032x032x32_DTL0_EPS1_GRVW04_LPB00_PGR1_SNLL0_TT04_04_USFGRO0_VW04_WG08_08_04
    SolutionIndex: 50
    SolutionNameMin: Cijk_Ailk_Bljk_SB_MT064x128x16_DTL0_EPS0_GRVW04_LPB00_PGR0_SNLL0_TT04_08_USFGRO0_VW04_WG16_16_01
    SolutionIndex: 51
    SolutionNameMin: Cijk_Ailk_Bljk_SB_MT064x128x16_DTL0_EPS0_GRVW04_LPB00_PGR0_SNLL0_TT04_08_USFGRO0_VW04_WG16_16_01
    SolutionIndex: 52
    SolutionNameMin: Cijk_Ailk_Bljk_SB_MT032x032x16_DTL0_EPS1_GRVW04_LPB00_PGR1_SNLL0_TT04_04_USFGRO0_VW04_WG08_08_02
    SolutionIndex: 53
    SolutionNameMin: Cijk_Ailk_Bljk_SB_MT128x128x16_DTL0_EPS1_GRVW04_LPB00_PGR1_SNLL1_TT08_08_USFGRO0_VW04_WG16_16_01
    SolutionIndex: 54
    SolutionNameMin: Cijk_Ailk_Bljk_SB_MT128x128x16_DTL0_EPS1_GRVW04_LPB00_PGR1_SNLL1_TT08_08_USFGRO0_VW04_WG16_16_01
    SolutionIndex: 55
    SolutionNameMin: Cijk_Ailk_Bljk_SB_MT064x004x64_DTL0_EPS0_GRVW02_LPB00_PGR0_SNLL0_TT04_02_USFGRO0_VW02_WG16_02_08
    SolutionIndex: 56
    SolutionNameMin: Cijk_Ailk_Bljk_SB_MT048x024x32_DTL0_EPS1_GRVW02_LPB00_PGR1_SNLL0_TT06_04_USFGRO0_VW02_WG08_06_04
    SolutionIndex: 57
    SolutionNameMin: Cijk_Ailk_Bljk_SB_MT128x128x08_DTL0_EPS1_GRVW04_LPB00_PGR1_SNLL1_TT08_08_USFGRO0_VW04_WG16_16_01
    SolutionIndex: 58
    SolutionNameMin: Cijk_Ailk_Bljk_SB_MT128x064x32_DTL0_EPS0_GRVW04_LPB00_PGR0_SNLL0_TT08_04_USFGRO00_VW04_WG16_16_01
    SolutionIndex: 59
    SolutionNameMin: Cijk_Ailk_Bljk_SB_MT064x064x16_DTL0_EPS0_GRVW04_LPB00_PGR0_SNLL0_TT04_04_USFGRO00_VW04_WG16_16_01
    SolutionIndex: 60
    SolutionNameMin: Cijk_Ailk_Bljk_SB_MT064x064x16_DTL0_EPS0_GRVW04_LPB00_PGR0_SNLL0_TT04_04_USFGRO0_VW04_WG16_16_01
    SolutionIndex: 61
    SolutionNameMin: Cijk_Ailk_Bljk_SB_MT032x016x08_DTL0_EPS0_GRVW02_LPB00_PGR1_SNLL0_TT02_02_USFGRO00_VW02_WG16_08_01
    SolutionIndex: 62
    SolutionNameMin: Cijk_Ailk_Bljk_SB_MT064x064x32_DTL0_EPS1_GRVW04_LPB00_PGR1_SNLL1_TT04_04_USFGRO0_VW04_WG16_16_01
    SolutionIndex: 63
    SolutionNameMin: Cijk_Ailk_Bljk_SB_MT128x128x08_DTL0_EPS1_GRVW04_LPB00_PGR1_SNLL1_TT08_08_USFGRO0_VW04_WG16_16_01
    SolutionIndex: 64
    SolutionNameMin: Cijk_Ailk_Bljk_SB_MT064x064x32_DTL0_EPS1_GRVW04_LPB00_PGR1_SNLL1_TT04_04_USFGRO0_VW04_WG16_16_01
    SolutionIndex: 65
    SolutionNameMin: Cijk_Ailk_Bljk_SB_MT016x016x16_DTL0_EPS1_GRVW02_LPB00_PGR1_SNLL0_TT02_02_USFGRO01_VW02_WG08_08_04
    SolutionIndex: 66
    SolutionNameMin: Cijk_Ailk_Bljk_SB_MT128x064x16_DTL0_EPS1_GRVW04_LPB00_PGR1_SNLL1_TT08_04_USFGRO0_VW04_WG16_16_01
    SolutionIndex: 67
    SolutionNameMin: Cijk_Ailk_Bljk_SB_MT032x032x32_DTL0_EPS1_GRVW04_LPB00_PGR1_SNLL0_TT04_04_USFGRO0_VW04_WG08_08_04
    SolutionIndex: 68
    SolutionNameMin: Cijk_Ailk_Bljk_SB_MT128x032x32_DTL0_EPS1_GRVW04_LPB00_PGR1_SNLL0_TT08_08_USFGRO0_VW04_WG16_04_04
    SolutionIndex: 69
    SolutionNameMin: Cijk_Ailk_Bljk_SB_MT064x064x16_DTL0_EPS1_GRVW04_LPB00_PGR1_SNLL1_TT04_04_USFGRO0_VW04_WG16_16_01
    SolutionIndex: 70
    SolutionNameMin: Cijk_Ailk_Bljk_SB_MT064x064x32_DTL0_EPS0_GRVW04_LPB00_PGR0_SNLL0_TT04_04_USFGRO0_VW04_WG16_16_01
    SolutionIndex: 71
    SolutionNameMin: Cijk_Ailk_Bljk_SB_MT064x064x16_DTL0_EPS1_GRVW04_LPB00_PGR1_SNLL1_TT04_04_USFGRO0_VW04_WG16_16_01
    SolutionIndex: 72
    SolutionNameMin: Cijk_Ailk_Bljk_SB_MT064x016x16_DTL0_EPS0_GRVW02_LPB00_PGR1_SNLL0_TT04_02_USFGRO00_VW02_WG16_08_01
    SolutionIndex: 73
    SolutionNameMin: Cijk_Ailk_Bljk_SB_MT064x064x16_DTL0_EPS0_GRVW04_LPB00_PGR0_SNLL0_TT04_04_USFGRO00_VW04_WG16_16_01
    SolutionIndex: 74
    SolutionNameMin: Cijk_Ailk_Bljk_SB_MT064x008x16_DTL0_EPS0_GRVW02_LPB00_PGR1_SNLL0_TT02_02_USFGRO00_VW02_WG32_04_01
    SolutionIndex: 75
    SolutionNameMin: Cijk_Ailk_Bljk_SB_MT128x128x08_DTL0_EPS0_GRVW04_LPB00_PGR0_SNLL0_TT08_08_USFGRO00_VW04_WG16_16_01
    SolutionIndex: 76
    SolutionNameMin: Cijk_Ailk_Bljk_SB_MT128x064x16_DTL0_EPS0_GRVW04_LPB00_PGR0_SNLL0_TT08_04_USFGRO0_VW04_WG16_16_01
    SolutionIndex: 77
    SolutionNameMin: Cijk_Ailk_Bljk_SB_MT064x008x32_DTL0_EPS1_GRVW02_LPB00_PGR1_SNLL0_TT04_02_USFGRO0_VW02_WG16_04_04
    SolutionIndex: 78
    SolutionNameMin: Cijk_Ailk_Bljk_SB_MT032x016x16_DTL0_EPS1_GRVW02_LPB00_PGR1_SNLL0_TT04_02_USFGRO0_VW02_WG08_08_04
    SolutionIndex: 79
    SolutionNameMin: Cijk_Ailk_Bljk_SB_MT016x016x08_DTL0_EPS1_GRVW02_LPB00_PGR1_SNLL0_TT02_02_USFGRO01_VW02_WG08_08_02
    SolutionIndex: 80
    SolutionNameMin: Cijk_Ailk_Bljk_SB_MT032x016x16_DTL0_EPS1_GRVW02_LPB00_PGR1_SNLL0_TT04_02_USFGRO0_VW02_WG08_08_04
    SolutionIndex: 81
    SolutionNameMin: Cijk_Ailk_Bljk_SB_MT008x008x08_DTL0_EPS1_GRVW02_LPB00_PGR1_SNLL0_TT02_02_USFGRO01_VW02_WG04_04_04
    SolutionIndex: 82
    SolutionNameMin: Cijk_Ailk_Bljk_SB_MT032x008x32_DTL0_EPS1_GRVW02_LPB00_PGR1_SNLL0_TT02_02_USFGRO0_VW02_WG16_04_04
    SolutionIndex: 83
    SolutionNameMin: Cijk_Ailk_Bljk_SB_MT016x016x08_DTL0_EPS1_GRVW02_LPB00_PGR1_SNLL0_TT02_02_USFGRO01_VW02_WG08_08_02
    SolutionIndex: 84
    SolutionNameMin: Cijk_Ailk_Bljk_SB_MT064x128x16_DTL0_EPS0_GRVW04_LPB00_PGR1_SNLL0_TT04_08_USFGRO00_VW04_WG16_16_01
    SolutionIndex: 85
    SolutionNameMin: Cijk_Ailk_Bljk_SB_MT032x032x32_DTL0_EPS1_GRVW04_LPB00_PGR1_SNLL0_TT04_04_USFGRO0_VW04_WG08_08_04
    SolutionIndex: 86
    SolutionNameMin: Cijk_Ailk_Bljk_SB_MT128x096x16_DTL0_EPS1_GRVW02_LPB00_PGR1_SNLL1_TT08_06_USFGRO0_VW02_WG16_16_01
    SolutionIndex: 87
    SolutionNameMin: Cijk_Ailk_Bljk_SB_MT032x016x16_DTL0_EPS1_GRVW02_LPB00_PGR1_SNLL0_TT04_02_USFGRO0_VW02_WG08_08_02
    SolutionIndex: 88
    SolutionNameMin: Cijk_Ailk_Bljk_SB_MT032x032x08_DTL0_EPS0_GRVW04_LPB00_PGR1_SNLL0_TT04_04_USFGRO00_VW04_WG08_08_01
    SolutionIndex: 89
    SolutionNameMin: Cijk_Ailk_Bljk_SB_MT032x008x32_DTL0_EPS1_GRVW02_LPB00_PGR1_SNLL0_TT02_02_USFGRO0_VW02_WG16_04_04
    SolutionIndex: 90
    SolutionNameMin: Cijk_Ailk_Bljk_SB_MT064x016x32_DTL0_EPS1_GRVW02_LPB00_PGR1_SNLL0_TT04_02_USFGRO0_VW02_WG16_08_02
    SolutionIndex: 91
    SolutionNameMin: Cijk_Ailk_Bljk_SB_MT064x032x32_DTL0_EPS1_GRVW04_LPB00_PGR1_SNLL0_TT04_04_USFGRO0_VW04_WG16_08_02
    SolutionIndex: 92
    SolutionNameMin: Cijk_Ailk_Bljk_SB_MT064x128x16_DTL0_EPS1_GRVW04_LPB00_PGR1_SNLL1_TT04_08_USFGRO0_VW04_WG16_16_01
    SolutionIndex: 93
    SolutionNameMin: Cijk_Ailk_Bljk_SB_MT032x032x02_DTL0_EPS0_GRVW04_LPB00_PGR1_SNLL0_TT04_04_USFGRO00_VW04_WG08_08_01
    SolutionIndex: 94
    SolutionNameMin: Cijk_Ailk_Bljk_SB_MT096x128x16_DTL0_EPS1_GRVW02_LPB00_PGR1_SNLL1_TT06_08_USFGRO0_VW02_WG16_16_01
    SolutionIndex: 95
    SolutionNameMin: Cijk_Ailk_Bljk_SB_MT128x064x32_DTL0_EPS0_GRVW04_LPB00_PGR0_SNLL0_TT08_04_USFGRO0_VW04_WG16_16_01
    SolutionIndex: 96
    SolutionNameMin: Cijk_Ailk_Bljk_SB_MT128x064x32_DTL0_EPS1_GRVW04_LPB00_PGR1_SNLL1_TT08_04_USFGRO0_VW04_WG16_16_01
    SolutionIndex: 97
    SolutionNameMin: Cijk_Ailk_Bljk_SB_MT064x032x32_DTL0_EPS1_GRVW04_LPB00_PGR1_SNLL0_TT08_04_USFGRO0_VW04_WG08_08_04
    SolutionIndex: 98
    SolutionNameMin: Cijk_Ailk_Bljk_SB_MT016x016x04_DTL0_EPS1_GRVW02_LPB00_PGR1_SNLL0_TT02_02_USFGRO01_VW02_WG08_08_01
    SolutionIndex: 99
    SolutionNameMin: Cijk_Ailk_Bljk_SB_MT032x016x16_DTL0_EPS1_GRVW02_LPB00_PGR1_SNLL0_TT04_02_USFGRO0_VW02_WG08_08_02
    SolutionIndex: 100
    SolutionNameMin: Cijk_Ailk_Bljk_SB_MT064x008x32_DTL0_EPS0_GRVW02_LPB00_PGR0_SNLL0_TT02_02_USFGRO0_VW02_WG32_04_02
    SolutionIndex: 101
    SolutionNameMin: Cijk_Ailk_Bljk_SB_MT064x016x16_DTL0_EPS1_GRVW04_LPB00_PGR1_SNLL0_TT04_04_USFGRO0_VW04_WG16_04_04
    SolutionIndex: 102
    SolutionNameMin: Cijk_Ailk_Bljk_SB_MT032x032x16_DTL0_EPS1_GRVW04_LPB00_PGR1_SNLL0_TT04_04_USFGRO0_VW04_WG08_08_02
    SolutionIndex: 103
    SolutionNameMin: Cijk_Ailk_Bljk_SB_MT064x032x32_DTL0_EPS1_GRVW04_LPB00_PGR1_SNLL0_TT08_04_USFGRO0_VW04_WG08_08_04
    SolutionIndex: 104
    SolutionNameMin: Cijk_Ailk_Bljk_SB_MT128x128x32_DTL0_EPS0_GRVW04_LPB00_PGR0_SNLL0_TT08_08_USFGRO0_VW04_WG16_16_01
    SolutionIndex: 105
    SolutionNameMin: Cijk_Ailk_Bljk_SB_MT128x064x16_DTL0_EPS0_GRVW04_LPB00_PGR1_SNLL0_TT08_04_USFGRO00_VW04_WG16_16_01
    SolutionIndex: 106
    SolutionNameMin: Cijk_Ailk_Bljk_SB_MT064x128x16_DTL0_EPS1_GRVW04_LPB00_PGR1_SNLL1_TT04_08_USFGRO0_VW04_WG16_16_01
    SolutionIndex: 107
    SolutionNameMin: Cijk_Ailk_Bljk_SB_MT064x016x08_DTL0_EPS0_GRVW02_LPB00_PGR1_SNLL0_TT04_02_USFGRO00_VW02_WG16_08_01
    SolutionIndex: 108
    SolutionNameMin: Cijk_Ailk_Bljk_SB_MT128x128x32_DTL0_EPS1_GRVW04_LPB00_PGR1_SNLL1_TT08_08_USFGRO0_VW04_WG16_16_01
    SolutionIndex: 109
    SolutionNameMin: Cijk_Ailk_Bljk_SB_MT016x016x08_DTL0_EPS0_GRVW02_LPB00_PGR1_SNLL0_TT02_02_USFGRO00_VW02_WG08_08_01
    SolutionIndex: 110
    SolutionNameMin: Cijk_Ailk_Bljk_SB_MT016x016x08_DTL0_EPS1_GRVW02_LPB00_PGR1_SNLL0_TT02_02_USFGRO01_VW02_WG08_08_02
    SolutionIndex: 111
    SolutionNameMin: Cijk_Ailk_Bljk_SB_MT032x032x08_DTL0_EPS0_GRVW04_LPB00_PGR1_SNLL0_TT04_04_USFGRO00_VW04_WG08_08_01
    SolutionIndex: 112
    SolutionNameMin: Cijk_Ailk_Bljk_SB_MT064x032x32_DTL0_EPS1_GRVW04_LPB00_PGR1_SNLL0_TT08_04_USFGRO0_VW04_WG08_08_04
    SolutionIndex: 113
    SolutionNameMin: Cijk_Ailk_Bljk_SB_MT128x096x16_DTL0_EPS1_GRVW02_LPB00_PGR1_SNLL1_TT08_06_USFGRO0_VW02_WG16_16_01
    SolutionIndex: 114
    SolutionNameMin: Cijk_Ailk_Bljk_SB_MT016x016x08_DTL0_EPS0_GRVW02_LPB00_PGR1_SNLL0_TT02_02_USFGRO00_VW02_WG08_08_01
    SolutionIndex: 115
    SolutionNameMin: Cijk_Ailk_Bljk_SB_MT064x128x16_DTL0_EPS0_GRVW04_LPB00_PGR1_SNLL0_TT04_08_USFGRO00_VW04_WG16_16_01
    SolutionIndex: 116
    SolutionNameMin: Cijk_Ailk_Bljk_SB_MT128x128x16_DTL0_EPS0_GRVW04_LPB00_PGR0_SNLL0_TT08_08_USFGRO0_VW04_WG16_16_01
    SolutionIndex: 117
    SolutionNameMin: Cijk_Ailk_Bljk_SB_MT128x032x32_DTL0_EPS1_GRVW04_LPB00_PGR1_SNLL0_TT08_08_USFGRO0_VW04_WG16_04_04
    SolutionIndex: 118
    SolutionNameMin: Cijk_Ailk_Bljk_SB_MT064x016x16_DTL0_EPS1_GRVW02_LPB00_PGR1_SNLL0_TT04_02_USFGRO0_VW02_WG16_08_02
    SolutionIndex: 119
    SolutionNameMin: Cijk_Ailk_Bljk_SB_MT096x128x16_DTL0_EPS0_GRVW02_LPB00_PGR0_SNLL0_TT06_08_USFGRO00_VW02_WG16_16_01
    SolutionIndex: 120
    SolutionNameMin: Cijk_Ailk_Bljk_SB_MT064x064x32_DTL0_EPS0_GRVW04_LPB00_PGR0_SNLL0_TT04_04_USFGRO00_VW04_WG16_16_01
    SolutionIndex: 121
    SolutionNameMin: Cijk_Ailk_Bljk_SB_MT128x128x24_DTL0_EPS0_GRVW04_LPB00_PGR0_SNLL0_TT08_08_USFGRO0_VW04_WG16_16_01
    SolutionIndex: 122
    SolutionNameMin: Cijk_Ailk_Bljk_SB_MT032x008x08_DTL0_EPS0_GRVW02_LPB00_PGR1_SNLL0_TT02_02_USFGRO00_VW02_WG16_04_01
    SolutionIndex: 123
    SolutionNameMin: Cijk_Ailk_Bljk_SB_MT128x016x16_DTL0_EPS1_GRVW04_LPB00_PGR1_SNLL0_TT04_04_USFGRO0_VW04_WG32_04_02
    SolutionIndex: 124
    SolutionNameMin: Cijk_Ailk_Bljk_SB_MT064x064x16_DTL0_EPS0_GRVW04_LPB00_PGR1_SNLL0_TT04_04_USFGRO00_VW04_WG16_16_01
    SolutionIndex: 125
    SolutionNameMin: Cijk_Ailk_Bljk_SB_MT016x016x04_DTL0_EPS0_GRVW02_LPB00_PGR1_SNLL0_TT02_02_USFGRO00_VW02_WG08_08_01
    SolutionIndex: 126
    SolutionNameMin: Cijk_Ailk_Bljk_SB_MT064x016x16_DTL0_EPS1_GRVW04_LPB00_PGR1_SNLL0_TT04_04_USFGRO0_VW04_WG16_04_04
    SolutionIndex: 127
    SolutionNameMin: Cijk_Ailk_Bljk_SB_MT064x064x24_DTL0_EPS1_GRVW04_LPB00_PGR1_SNLL0_TT08_08_USFGRO0_VW04_WG08_08_02
    SolutionIndex: 128
    SolutionNameMin: Cijk_Ailk_Bljk_SB_MT128x064x16_DTL0_EPS1_GRVW04_LPB04_PGR1_SNLL1_TT04_08_USFGRO0_VW04_WG32_08_01
    SolutionIndex: 129
    SolutionNameMin: Cijk_Ailk_Bljk_SB_MT064x016x32_DTL0_EPS0_GRVW02_LPB00_PGR0_SNLL0_TT04_02_USFGRO0_VW02_WG16_08_02
    SolutionIndex: 130
    SolutionNameMin: Cijk_Ailk_Bljk_SB_MT128x128x24_DTL0_EPS0_GRVW04_LPB00_PGR0_SNLL0_TT08_08_USFGRO0_VW04_WG16_16_01
    SolutionIndex: 131
    SolutionNameMin: Cijk_Ailk_Bljk_SB_MT032x016x16_DTL0_EPS1_GRVW02_LPB00_PGR1_SNLL0_TT04_02_USFGRO0_VW02_WG08_08_02
    SolutionIndex: 132
    SolutionNameMin: Cijk_Ailk_Bljk_SB_MT016x016x16_DTL0_EPS1_GRVW02_LPB00_PGR1_SNLL0_TT02_02_USFGRO01_VW02_WG08_08_04
    SolutionIndex: 133
    SolutionNameMin: Cijk_Ailk_Bljk_SB_MT048x036x16_DTL0_EPS1_GRVW01_LPB00_PGR1_SNLL0_TT06_03_USFGRO01_VW01_WG08_12_02
    SolutionIndex: 134
    SolutionNameMin: Cijk_Ailk_Bljk_SB_MT008x008x08_DTL0_EPS1_GRVW02_LPB00_PGR1_SNLL0_TT02_02_USFGRO01_VW02_WG04_04_04
    SolutionIndex: 135
    SolutionNameMin: Cijk_Ailk_Bljk_SB_MT032x008x32_DTL0_EPS1_GRVW02_LPB00_PGR1_SNLL0_TT02_02_USFGRO0_VW02_WG16_04_04
    SolutionIndex: 136
    SolutionNameMin: Cijk_Ailk_Bljk_SB_MT016x016x16_DTL0_EPS1_GRVW02_LPB00_PGR1_SNLL0_TT02_02_USFGRO01_VW02_WG08_08_04
    SolutionIndex: 137
    SolutionNameMin: Cijk_Ailk_Bljk_SB_MT128x016x16_DTL0_EPS1_GRVW04_LPB00_PGR1_SNLL0_TT04_04_USFGRO0_VW04_WG32_04_02
    SolutionIndex: 138
    SolutionNameMin: Cijk_Ailk_Bljk_SB_MT064x064x16_DTL0_EPS0_GRVW04_LPB00_PGR0_SNLL0_TT04_04_USFGRO0_VW04_WG16_16_01
    SolutionIndex: 139
    SolutionNameMin: Cijk_Ailk_Bljk_SB_MT032x008x32_DTL0_EPS1_GRVW02_LPB00_PGR1_SNLL0_TT02_02_USFGRO0_VW02_WG16_04_04
    SolutionIndex: 140
    SolutionNameMin: Cijk_Ailk_Bljk_SB_MT064x008x32_DTL0_EPS0_GRVW04_LPB00_PGR0_SNLL0_TT04_04_USFGRO0_VW04_WG16_02_08
    SolutionIndex: 141
    SolutionNameMin: Cijk_Ailk_Bljk_SB_MT096x128x16_DTL0_EPS0_GRVW02_LPB00_PGR0_SNLL0_TT06_08_USFGRO00_VW02_WG16_16_01
    SolutionIndex: 142
    SolutionNameMin: Cijk_Ailk_Bljk_SB_MT032x032x32_DTL0_EPS1_GRVW04_LPB00_PGR1_SNLL0_TT04_04_USFGRO0_VW04_WG08_08_04
    SolutionIndex: 143
    SolutionNameMin: Cijk_Ailk_Bljk_SB_MT128x008x32_DTL0_EPS0_GRVW02_LPB00_PGR0_SNLL0_TT04_02_USFGRO0_VW02_WG32_04_02
    SolutionIndex: 144
    SolutionNameMin: Cijk_Ailk_Bljk_SB_MT048x024x32_DTL0_EPS1_GRVW02_LPB00_PGR1_SNLL0_TT06_04_USFGRO0_VW02_WG08_06_04
    SolutionIndex: 145
    SolutionNameMin: Cijk_Ailk_Bljk_SB_MT064x016x16_DTL0_EPS0_GRVW02_LPB00_PGR1_SNLL0_TT04_02_USFGRO00_VW02_WG16_08_01
    SolutionIndex: 146
    SolutionNameMin: Cijk_Ailk_Bljk_SB_MT032x008x32_DTL0_EPS1_GRVW02_LPB00_PGR1_SNLL0_TT02_02_USFGRO0_VW02_WG16_04_04
    SolutionIndex: 147
    SolutionNameMin: Cijk_Ailk_Bljk_SB_MT064x128x32_DTL0_EPS0_GRVW04_LPB00_PGR0_SNLL0_TT04_08_USFGRO00_VW04_WG16_16_01
    SolutionIndex: 148
    SolutionNameMin: Cijk_Ailk_Bljk_SB_MT016x016x16_DTL0_EPS1_GRVW02_LPB00_PGR1_SNLL1_TT02_02_USFGRO01_VW02_WG08_08_04
    SolutionIndex: 149
    SolutionNameMin: Cijk_Ailk_Bljk_SB_MT032x016x16_DTL0_EPS1_GRVW02_LPB00_PGR1_SNLL0_TT04_02_USFGRO0_VW02_WG08_08_04
    SolutionIndex: 150
    SolutionNameMin: Cijk_Ailk_Bljk_SB_MT128x064x16_DTL0_EPS1_GRVW04_LPB00_PGR1_SNLL0_TT08_08_USFGRO0_VW04_WG16_08_02
    SolutionIndex: 151
    SolutionNameMin: Cijk_Ailk_Bljk_SB_MT016x016x04_DTL0_EPS1_GRVW02_LPB00_PGR1_SNLL0_TT02_02_USFGRO01_VW02_WG08_08_01
    SolutionIndex: 152
    SolutionNameMin: Cijk_Ailk_Bljk_SB_MT016x016x16_DTL0_EPS0_GRVW02_LPB00_PGR1_SNLL0_TT02_02_USFGRO00_VW02_WG08_08_01
    SolutionIndex: 153
    SolutionNameMin: Cijk_Ailk_Bljk_SB_MT032x016x08_DTL0_EPS0_GRVW02_LPB00_PGR1_SNLL0_TT04_02_USFGRO00_VW02_WG08_08_01
    SolutionIndex: 154
    SolutionNameMin: Cijk_Ailk_Bljk_SB_MT036x048x16_DTL0_EPS1_GRVW01_LPB00_PGR1_SNLL0_TT03_03_USFGRO01_VW01_WG12_16_01
    SolutionIndex: 155
    SolutionNameMin: Cijk_Ailk_Bljk_SB_MT064x008x32_DTL0_EPS1_GRVW02_LPB00_PGR1_SNLL0_TT04_02_USFGRO0_VW02_WG16_04_04
    SolutionIndex: 156
    SolutionNameMin: Cijk_Ailk_Bljk_SB_MT032x016x08_DTL0_EPS0_GRVW02_LPB00_PGR1_SNLL0_TT02_02_USFGRO00_VW02_WG16_08_01
    SolutionIndex: 157
    SolutionNameMin: Cijk_Ailk_Bljk_SB_MT128x016x16_DTL0_EPS1_GRVW04_LPB00_PGR1_SNLL0_TT04_04_USFGRO0_VW04_WG32_04_02
    SolutionIndex: 158
    SolutionNameMin: Cijk_Ailk_Bljk_SB_MT096x128x16_DTL0_EPS1_GRVW02_LPB00_PGR1_SNLL1_TT06_08_USFGRO0_VW02_WG16_16_01
    SolutionIndex: 159
    SolutionNameMin: Cijk_Ailk_Bljk_SB_MT032x016x16_DTL0_EPS1_GRVW02_LPB00_PGR1_SNLL0_TT04_02_USFGRO0_VW02_WG08_08_04
    SolutionIndex: 160
    SolutionNameMin: Cijk_Ailk_Bljk_SB_MT064x064x32_DTL0_EPS0_GRVW04_LPB00_PGR0_SNLL0_TT04_04_USFGRO0_VW04_WG16_16_01
    SolutionIndex: 161
    SolutionNameMin: Cijk_Ailk_Bljk_SB_MT032x016x16_DTL0_EPS1_GRVW02_LPB00_PGR1_SNLL0_TT02_02_USFGRO0_VW02_WG16_08_02
    SolutionIndex: 162
    SolutionNameMin: Cijk_Ailk_Bljk_SB_MT128x064x16_DTL0_EPS0_GRVW04_LPB00_PGR0_SNLL0_TT08_04_USFGRO00_VW04_WG16_16_01
    SolutionIndex: 163
    SolutionNameMin: Cijk_Ailk_Bljk_SB_MT016x016x16_DTL0_EPS1_GRVW02_LPB00_PGR1_SNLL0_TT02_02_USFGRO01_VW02_WG08_08_04
    SolutionIndex: 164
    SolutionNameMin: Cijk_Ailk_Bljk_SB_MT008x008x08_DTL0_EPS1_GRVW02_LPB00_PGR1_SNLL0_TT02_02_USFGRO01_VW02_WG04_04_04
    SolutionIndex: 165
    SolutionNameMin: Cijk_Ailk_Bljk_SB_MT128x032x16_DTL0_EPS0_GRVW01_LPB02_PGR0_SNLL0_TT04_04_USFGRO01_VW02_WG32_08_01
    SolutionIndex: 166
    SolutionNameMin: Cijk_Ailk_Bljk_SB_MT032x008x32_DTL0_EPS1_GRVW02_LPB00_PGR1_SNLL0_TT02_02_USFGRO0_VW02_WG16_04_04
    SolutionIndex: 167
    SolutionNameMin: Cijk_Ailk_Bljk_SB_MT128x032x08_DTL0_EPS1_GRVW04_LPB04_PGR1_SNLL1_TT04_04_USFGRO0_VW04_WG32_08_01
    SolutionIndex: 168
    SolutionNameMin: Cijk_Ailk_Bljk_SB_MT064x064x16_DTL0_EPS0_GRVW04_LPB04_PGR0_SNLL0_TT04_04_USFGRO0_VW04_WG16_16_01
    SolutionIndex: 169
    SolutionNameMin: Cijk_Ailk_Bljk_SB_MT128x016x16_DTL0_EPS1_GRVW02_LPB00_PGR1_SNLL0_TT08_02_USFGRO0_VW02_WG16_08_02
    SolutionIndex: 170
    SolutionNameMin: Cijk_Ailk_Bljk_SB_MT064x064x32_DTL0_EPS0_GRVW04_LPB00_PGR0_SNLL0_TT04_04_USFGRO00_VW04_WG16_16_01
    SolutionIndex: 171
    SolutionNameMin: Cijk_Ailk_Bljk_SB_MT032x016x32_DTL0_EPS1_GRVW02_LPB00_PGR1_SNLL0_TT04_02_USFGRO0_VW02_WG08_08_02
    SolutionIndex: 172
    SolutionNameMin: Cijk_Ailk_Bljk_SB_MT128x064x16_DTL0_EPS0_GRVW04_LPB00_PGR1_SNLL0_TT08_04_USFGRO00_VW04_WG16_16_01
    SolutionIndex: 173
    SolutionNameMin: Cijk_Ailk_Bljk_SB_MT128x008x32_DTL0_EPS0_GRVW04_LPB00_PGR0_SNLL0_TT04_04_USFGRO0_VW04_WG32_02_04
    SolutionIndex: 174
    SolutionNameMin: Cijk_Ailk_Bljk_SB_MT128x128x16_DTL0_EPS0_GRVW04_LPB00_PGR0_SNLL0_TT08_08_USFGRO0_VW04_WG16_16_01
    SolutionIndex: 175
    SolutionNameMin: Cijk_Ailk_Bljk_SB_MT064x016x16_DTL0_EPS1_GRVW04_LPB00_PGR1_SNLL0_TT04_04_USFGRO0_VW04_WG16_04_04
    SolutionIndex: 176
    SolutionNameMin: Cijk_Ailk_Bljk_SB_MT128x008x32_DTL0_EPS0_GRVW04_LPB00_PGR0_SNLL0_TT04_04_USFGRO0_VW04_WG32_02_04
    SolutionIndex: 177
    SolutionNameMin: Cijk_Ailk_Bljk_SB_MT032x016x32_DTL0_EPS1_GRVW02_LPB00_PGR1_SNLL0_TT04_02_USFGRO0_VW02_WG08_08_04
    SolutionIndex: 178
    SolutionNameMin: Cijk_Ailk_Bljk_SB_MT064x032x16_DTL0_EPS1_GRVW04_LPB00_PGR1_SNLL0_TT08_04_USFGRO0_VW04_WG08_08_02
    SolutionIndex: 179
    SolutionNameMin: Cijk_Ailk_Bljk_SB_MT064x016x16_DTL0_EPS1_GRVW02_LPB00_PGR1_SNLL0_TT04_02_USFGRO0_VW02_WG16_08_02
    SolutionIndex: 180
    SolutionNameMin: Cijk_Ailk_Bljk_SB_MT128x128x32_DTL0_EPS0_GRVW04_LPB00_PGR0_SNLL0_TT08_08_USFGRO0_VW04_WG16_16_01
    SolutionIndex: 181
    SolutionNameMin: Cijk_Ailk_Bljk_SB_MT048x048x16_DTL0_EPS1_GRVW01_LPB00_PGR1_SNLL0_TT03_03_USFGRO01_VW01_WG16_16_01
    SolutionIndex: 182
    SolutionNameMin: Cijk_Ailk_Bljk_SB_MT128x016x16_DTL0_EPS1_GRVW04_LPB00_PGR1_SNLL0_TT04_04_USFGRO0_VW04_WG32_04_02
    SolutionIndex: 183
    SolutionNameMin: Cijk_Ailk_Bljk_SB_MT128x032x08_DTL0_EPS1_GRVW04_LPB04_PGR1_SNLL1_TT04_04_USFGRO0_VW04_WG32_08_01
    SolutionIndex: 184
    SolutionNameMin: Cijk_Ailk_Bljk_SB_MT032x008x64_DTL0_EPS0_GRVW02_LPB00_PGR0_SNLL0_TT02_02_USFGRO0_VW02_WG16_04_04
    SolutionIndex: 185
    SolutionNameMin: Cijk_Ailk_Bljk_SB_MT128x064x32_DTL0_EPS1_GRVW04_LPB00_PGR1_SNLL0_TT08_08_USFGRO0_VW04_WG16_08_02
    SolutionIndex: 186
    SolutionNameMin: Cijk_Ailk_Bljk_SB_MT032x016x16_DTL0_EPS0_GRVW02_LPB00_PGR1_SNLL0_TT04_02_USFGRO00_VW02_WG08_08_01
    SolutionIndex: 187
    SolutionNameMin: Cijk_Ailk_Bljk_SB_MT128x064x32_DTL0_EPS0_GRVW04_LPB00_PGR0_SNLL0_TT08_04_USFGRO0_VW04_WG16_16_01
    SolutionIndex: 188
    SolutionNameMin: Cijk_Ailk_Bljk_SB_MT128x016x16_DTL0_EPS1_GRVW02_LPB00_PGR1_SNLL0_TT08_02_USFGRO0_VW02_WG16_08_02
    SolutionIndex: 189
    SolutionNameMin: Cijk_Ailk_Bljk_SB_MT128x064x32_DTL0_EPS1_GRVW04_LPB00_PGR1_SNLL1_TT08_04_USFGRO0_VW04_WG16_16_01
    SolutionIndex: 190
    SolutionNameMin: Cijk_Ailk_Bljk_SB_MT032x016x24_DTL0_EPS0_GRVW02_LPB00_PGR1_SNLL0_TT04_02_USFGRO00_VW02_WG08_08_01
    SolutionIndex: 191
    SolutionNameMin: Cijk_Ailk_Bljk_SB_MT016x016x16_DTL0_EPS1_GRVW02_LPB00_PGR1_SNLL0_TT02_02_USFGRO0_VW02_WG08_08_02
    SolutionIndex: 192
    SolutionNameMin: Cijk_Ailk_Bljk_SB_MT064x004x64_DTL0_EPS0_GRVW02_LPB00_PGR0_SNLL0_TT02_02_USFGRO0_VW02_WG32_02_04
    SolutionIndex: 193
    SolutionNameMin: Cijk_Ailk_Bljk_SB_MT064x016x32_DTL0_EPS1_GRVW02_LPB00_PGR1_SNLL0_TT04_02_USFGRO0_VW02_WG16_08_02
    SolutionIndex: 194
    SolutionNameMin: Cijk_Ailk_Bljk_SB_MT064x064x32_DTL0_EPS0_GRVW04_LPB00_PGR1_SNLL0_TT04_04_USFGRO00_VW04_WG16_16_01
    SolutionIndex: 195
    SolutionNameMin: Cijk_Ailk_Bljk_SB_MT064x064x16_DTL0_EPS1_GRVW04_LPB04_PGR1_SNLL1_TT04_04_USFGRO0_VW04_WG16_16_01
    SolutionIndex: 196
    SolutionNameMin: Cijk_Ailk_Bljk_SB_MT064x032x16_DTL0_EPS1_GRVW04_LPB00_PGR1_SNLL0_TT08_04_USFGRO0_VW04_WG08_08_02
    SolutionIndex: 197
    SolutionNameMin: Cijk_Ailk_Bljk_SB_MT128x032x08_DTL0_EPS1_GRVW04_LPB00_PGR1_SNLL0_TT08_04_USFGRO0_VW04_WG16_08_02
    SolutionIndex: 198
    SolutionNameMin: Cijk_Ailk_Bljk_SB_MT064x032x16_DTL0_EPS1_GRVW04_LPB00_PGR1_SNLL0_TT08_04_USFGRO0_VW04_WG08_08_02
    SolutionIndex: 199
    SolutionNameMin: Cijk_Ailk_Bljk_SB_MT032x008x32_DTL0_EPS0_GRVW02_LPB00_PGR1_SNLL0_TT02_02_USFGRO00_VW02_WG16_04_01
    SolutionIndex: 200
    SolutionNameMin: Cijk_Ailk_Bljk_SB_MT064x008x32_DTL0_EPS1_GRVW04_LPB00_PGR1_SNLL0_TT04_04_USFGRO0_VW04_WG16_02_08
    SolutionIndex: 201
    SolutionNameMin: Cijk_Ailk_Bljk_SB_MT064x032x16_DTL0_EPS0_GRVW04_LPB00_PGR1_SNLL0_TT04_04_USFGRO00_VW04_WG16_08_01
    SolutionIndex: 202
    SolutionNameMin: Cijk_Ailk_Bljk_SB_MT032x032x16_DTL0_EPS1_GRVW04_LPB00_PGR1_SNLL0_TT04_04_USFGRO0_VW04_WG08_08_02
    SolutionIndex: 203
    SolutionNameMin: Cijk_Ailk_Bljk_SB_MT024x024x32_DTL0_EPS1_GRVW01_LPB00_PGR1_SNLL0_TT03_04_USFGRO01_VW01_WG08_06_04
    SolutionIndex: 204
    SolutionNameMin: Cijk_Ailk_Bljk_SB_MT064x016x08_DTL0_EPS0_GRVW02_LPB00_PGR1_SNLL0_TT04_02_USFGRO00_VW02_WG16_08_01
    SolutionIndex: 205
    SolutionNameMin: Cijk_Ailk_Bljk_SB_MT064x008x32_DTL0_EPS1_GRVW02_LPB00_PGR1_SNLL0_TT08_02_USFGRO0_VW02_WG08_04_08
    SolutionIndex: 206
    SolutionNameMin: Cijk_Ailk_Bljk_SB_MT064x032x08_DTL0_EPS0_GRVW04_LPB00_PGR1_SNLL0_TT08_04_USFGRO00_VW04_WG08_08_01
    SolutionIndex: 207
    SolutionNameMin: Cijk_Ailk_Bljk_SB_MT032x032x16_DTL0_EPS0_GRVW04_LPB00_PGR1_SNLL0_TT04_04_USFGRO00_VW04_WG08_08_01
    SolutionIndex: 208
    SolutionNameMin: Cijk_Ailk_Bljk_SB_MT128x016x16_DTL0_EPS1_GRVW04_LPB00_PGR1_SNLL0_TT08_04_USFGRO0_VW04_WG16_04_04
    SolutionIndex: 209
    SolutionNameMin: Cijk_Ailk_Bljk_SB_MT128x128x24_DTL0_EPS1_GRVW04_LPB00_PGR1_SNLL1_TT08_08_USFGRO0_VW04_WG16_16_01
    SolutionIndex: 210
    SolutionNameMin: Cijk_Ailk_Bljk_SB_MT064x064x24_DTL0_EPS1_GRVW04_LPB00_PGR1_SNLL0_TT08_08_USFGRO0_VW04_WG08_08_02
    SolutionIndex: 211
    SolutionNameMin: Cijk_Ailk_Bljk_SB_MT016x016x32_DTL0_EPS1_GRVW02_LPB00_PGR1_SNLL0_TT02_02_USFGRO0_VW02_WG08_08_04
    SolutionIndex: 212
    SolutionNameMin: Cijk_Ailk_Bljk_SB_MT128x128x32_DTL0_EPS1_GRVW04_LPB00_PGR1_SNLL1_TT08_08_USFGRO0_VW04_WG16_16_01
    SolutionIndex: 213
    SolutionNameMin: Cijk_Ailk_Bljk_SB_MT064x064x16_DTL0_GRVW04_GSU01_PGR1_PLR1_TT04_04_USFGRO0_VW04_WG16_16_01_WGM01
    SolutionIndex: 214
    SolutionNameMin: Cijk_Ailk_Bljk_SB_MT064x128x16_DTL0_GRVW04_GSU01_PGR0_PLR1_TT08_04_USFGRO0_VW04_WG08_32_01_WGM01
    SolutionIndex: 215
    SolutionNameMin: Cijk_Ailk_Bljk_SB_MT064x064x08_DTL0_GRVW04_GSU01_PGR1_PLR1_TT04_08_USFGRO0_VW04_WG16_08_01_WGM01
    SolutionIndex: 216
    SolutionNameMin: Cijk_Ailk_Bljk_SB_MT128x064x08_DTL0_GRVW02_GSU01_PGR1_PLR1_TT08_04_USFGRO0_VW02_WG16_16_01_WGM01
    SolutionIndex: 217
    SolutionNameMin: Cijk_Ailk_Bljk_SB_MT064x128x16_DTL0_GRVW04_GSU01_PGR0_PLR1_TT04_08_USFGRO0_VW04_WG16_16_01_WGM01
    SolutionIndex: 218
    SolutionNameMin: Cijk_Ailk_Bljk_SB_MT128x064x16_DTL0_GRVW04_GSU01_PGR0_PLR1_TT08_04_USFGRO0_VW04_WG16_16_01_WGM01
    SolutionIndex: 219
    SolutionNameMin: Cijk_Ailk_Bljk_SB_MT64x32x32_EPS1_GRVW4_GSU1_LPB4_PGR1_SNLL1_TT4_4_VW4_WG16_8_2_WGM8
    SolutionIndex: 220
    SolutionNameMin: Cijk_Ailk_Bljk_SB_MT128x32x16_EPS1_GRVW4_GSU1_LPB4_PGR1_SNLL1_TT8_4_VW4_WG16_8_2_WGM8
    SolutionIndex: 221
    SolutionNameMin: Cijk_Ailk_Bljk_SB_MT64x32x32_EPS1_GRVW4_GSU1_LPB4_PGR1_SNLL1_TT4_4_VW4_WG16_8_2_WGM32
    SolutionIndex: 222
    SolutionNameMin: Cijk_Ailk_Bljk_SB_MT128x64x16_EPS1_GRVW4_GSU1_LPB4_PGR1_SNLL1_TT8_4_VW4_WG16_16_1_WGM4
    SolutionIndex: 223
    SolutionNameMin: Cijk_Ailk_Bljk_SB_MT128x64x16_EPS1_GRVW4_GSU1_LPB4_PGR1_SNLL1_TT8_4_VW4_WG16_16_1_WGM16
    SolutionIndex: 224
    SolutionNameMin: Cijk_Ailk_Bljk_SB_MT64x64x16_EPS1_GRVW4_GSU1_LPB4_PGR1_SNLL1_TT4_8_VW4_WG16_8_2_WGM16
    SolutionIndex: 225
    SolutionNameMin: Cijk_Ailk_Bljk_SB_MT128x64x8_EPS1_GRVW4_GSU1_LPB0_PGR1_SNLL1_TT8_4_VW4_WG16_16_1_WGM8
    SolutionIndex: 226
    SolutionNameMin: Cijk_Ailk_Bljk_SB_MT64x32x32_EPS1_GRVW4_GSU1_LPB4_PGR1_SNLL1_TT4_4_VW4_WG16_8_2_WGM16
    SolutionIndex: 227
    SolutionNameMin: Cijk_Ailk_Bljk_SB_MT64x32x16_EPS1_GRVW4_GSU1_LPB4_PGR1_SNLL1_TT4_4_VW4_WG16_8_2_WGM16
    SolutionIndex: 228
    SolutionNameMin: Cijk_Ailk_Bljk_SB_MT64x64x16_EPS1_GRVW4_GSU1_LPB4_PGR1_SNLL1_TT4_8_VW4_WG16_8_2_WGM8
    SolutionIndex: 229
    SolutionNameMin: Cijk_Ailk_Bljk_SB_MT64x32x32_EPS1_GRVW4_GSU1_LPB4_PGR1_SNLL1_TT4_4_VW4_WG16_8_2_WGM4
    SolutionIndex: 230
    SolutionNameMin: Cijk_Ailk_Bljk_SB_MT128x64x16_EPS1_GRVW4_GSU1_LPB4_PGR1_SNLL1_TT8_4_VW4_WG16_16_1_WGM8
    SolutionIndex: 231
    SolutionNameMin: Cijk_Ailk_Bljk_SB_MT128x32x16_EPS1_GRVW4_GSU1_LPB4_PGR1_SNLL1_TT8_4_VW4_WG16_8_2_WGM16
    SolutionIndex: 232
    SolutionNameMin: Cijk_Ailk_Bljk_SB_MT128x64x16_EPS1_GRVW4_GSU1_LPB4_PGR1_SNLL1_TT8_4_VW4_WG16_16_1_WGM32
    SolutionIndex: 233
    SolutionNameMin: Cijk_Ailk_Bljk_SB_MT128x64x8_EPS1_GRVW4_GSU1_LPB0_PGR1_SNLL1_TT8_4_VW4_WG16_16_1_WGM4
    SolutionIndex: 234
    SolutionNameMin: Cijk_Ailk_Bljk_SB_MT128x128x16_EPS1_GRVW4_GSU1_LPB0_PGR1_SNLL1_TT8_8_VW4_WG16_16_1_WGM4
    SolutionIndex: 235
    SolutionNameMin: Cijk_Ailk_Bljk_SB_MT128x128x16_EPS1_GRVW4_GSU1_LPB0_PGR1_SNLL1_TT8_8_VW4_WG16_16_1_WGM8
    SolutionIndex: 236
    SolutionNameMin: Cijk_Ailk_Bljk_SB_MT64x32x16_EPS1_GRVW4_GSU1_LPB4_PGR1_SNLL1_TT4_4_VW4_WG16_8_2_WGM4
    SolutionIndex: 237
    SolutionNameMin: Cijk_Ailk_Bljk_SB_MT64x32x16_EPS1_GRVW4_GSU1_LPB4_PGR1_SNLL1_TT4_4_VW4_WG16_8_2_WGM8
    SolutionIndex: 238
    SolutionNameMin: Cijk_Ailk_Bljk_SB_MT64x32x16_EPS1_GRVW4_GSU1_LPB4_PGR1_SNLL1_TT4_4_VW4_WG16_8_2_WGM32
    SolutionIndex: 239
    SolutionNameMin: Cijk_Ailk_Bljk_SB_MT64x32x32_EPS1_GRVW2_GSU1_LPB2_PGR1_SNLL1_TT4_4_VW2_WG16_8_2_WGM4
    SolutionIndex: 240
    SolutionNameMin: Cijk_Ailk_Bljk_SB_MT128x64x8_EPS1_GRVW4_GSU1_LPB4_PGR1_SNLL1_TT8_4_VW4_WG16_16_1_WGM4
    SolutionIndex: 241
    SolutionNameMin: Cijk_Ailk_Bljk_SB_MT64x64x16_EPS1_GRVW4_GSU1_LPB4_PGR1_SNLL1_TT4_8_VW4_WG16_8_2_WGM4
    SolutionIndex: 242
    SolutionNameMin: Cijk_Ailk_Bljk_SB_MT32x16x16_EPS1_GRVW4_GSU1_LPB4_PGR1_SNLL1_TT4_4_VW4_WG8_4_2_WGM4
    SolutionIndex: 243
    SolutionNameMin: Cijk_Ailk_Bljk_SB_MT128x64x16_SE_EPS1_PGR1_SNLL1_TT8_4_WG16_16_1_WGM1
    SolutionIndex: 244
    SolutionNameMin: Cijk_Ailk_Bljk_SB_MT64x64x16_SE_EPS1_PGR1_SNLL1_TT4_4_WG16_16_1_WGM16
    SolutionIndex: 245
    SolutionNameMin: Cijk_Ailk_Bljk_SB_MT128x64x8_SE_EPS1_PGR1_SNLL1_TT4_8_WG32_8_1_WGM15
    SolutionIndex: 246
    SolutionNameMin: Cijk_Ailk_Bljk_SB_MT128x64x8_SE_EPS1_PGR1_SNLL1_TT4_8_WG32_8_1_WGM32
    SolutionIndex: 247
    SolutionNameMin: Cijk_Ailk_Bljk_SB_MT128x64x8_SE_EPS1_PGR1_SNLL1_TT4_8_WG32_8_1_WGM7
    SolutionIndex: 248
    SolutionNameMin: Cijk_Ailk_Bljk_SB_MT64x64x32_SE_EPS1_PGR1_SNLL1_TT4_8_WG16_8_2_WGM32
    SolutionIndex: 249
    SolutionNameMin: Cijk_Ailk_Bljk_SB_MT64x64x16_SE_EPS1_PGR1_SNLL1_TT4_4_WG16_16_1_WGM8
    SolutionIndex: 250
    SolutionNameMin: Cijk_Ailk_Bljk_SB_MT128x64x8_SE_EPS1_PGR1_SNLL1_TT8_4_WG16_16_1_WGM16
    SolutionIndex: 251
    SolutionNameMin: Cijk_Ailk_Bljk_SB_MT64x64x16_SE_EPS1_PGR1_SNLL1_TT4_4_WG16_16_1_WGM1
    SolutionIndex: 252
    SolutionNameMin: Cijk_Ailk_Bljk_SB_MT64x64x16_SE_EPS1_PGR1_SNLL1_TT4_8_WG16_8_2_WGM11
    SolutionIndex: 253
    SolutionNameMin: Cijk_Ailk_Bljk_SB_MT256x32x8_SE_EPS1_PGR1_SNLL1_TT4_8_WG64_4_1_WGM2
    SolutionIndex: 254
    SolutionNameMin: Cijk_Ailk_Bljk_SB_MT64x64x16_SE_EPS1_PGR1_SNLL1_TT4_4_WG16_16_1_WGM2
    SolutionIndex: 255
    SolutionNameMin: Cijk_Ailk_Bljk_SB_MT128x128x16_SE_EPS1_PGR1_SNLL1_TT8_4_WG16_32_1_WGM1
    SolutionIndex: 256
    SolutionNameMin: Cijk_Ailk_Bljk_SB_MT128x64x8_SE_EPS1_PGR1_SNLL1_TT8_4_WG16_16_1_WGM8
    SolutionIndex: 257
    SolutionNameMin: Cijk_Ailk_Bljk_SB_MT64x64x16_SE_EPS1_PGR1_SNLL1_TT4_8_WG16_8_2_WGM7
    SolutionIndex: 258
    SolutionNameMin: Cijk_Ailk_Bljk_SB_MT64x64x16_SE_EPS1_PGR1_SNLL1_TT4_8_WG16_8_2_WGM2
    SolutionIndex: 259
    SolutionNameMin: Cijk_Ailk_Bljk_SB_MT128x128x16_SE_DTL0_EPS1_FL0_GRVW4_LPB0_PGR1_PLR1_SNLL1_TT8_8_USFGRO0_VW4_WG16_16_1_WGM8
    SolutionIndex: 260
    SolutionNameMin: Cijk_Ailk_Bljk_SB_MT128x64x8_SE_DTL0_EPS1_FL1_GRVW4_LPB4_PGR1_PLR1_SNLL1_TT8_4_USFGRO0_VW4_WG16_16_1_WGM1
    SolutionIndex: 261
    SolutionNameMin: Cijk_Ailk_Bljk_SB_MT128x64x8_SE_DTL0_EPS1_FL0_GRVW4_LPB0_PGR1_PLR1_SNLL1_TT8_4_USFGRO0_VW4_WG16_16_1_WGM1
    SolutionIndex: 262
    SolutionNameMin: Cijk_Ailk_Bljk_SB_MT128x64x8_SE_DTL0_EPS1_FL1_GRVW4_LPB4_PGR1_PLR1_SNLL1_TT8_4_USFGRO0_VW4_WG16_16_1_WGM8
    SolutionIndex: 263
    SolutionNameMin: Cijk_Ailk_Bljk_SB_MT64x32x8_SE_DTL0_EPS1_FL1_GRVW4_LPB0_PGR1_PLR1_SNLL1_TT4_4_USFGRO0_VW4_WG16_8_1_WGM8
    SolutionIndex: 264
    SolutionNameMin: Cijk_Ailk_Bljk_SB_MT128x128x16_SE_DTL0_EPS1_FL1_GRVW4_LPB0_PGR1_PLR1_SNLL1_TT8_8_USFGRO0_VW4_WG16_16_1_WGM1
    SolutionIndex: 265
    SolutionNameMin: Cijk_Ailk_Bljk_SB_MT128x64x16_SE_DTL0_EPS1_FL1_GRVW4_LPB4_PGR1_PLR1_SNLL1_TT8_4_USFGRO0_VW4_WG16_16_1_WGM8
    SolutionIndex: 266
    SolutionNameMin: Cijk_Ailk_Bljk_SB_MT128x128x16_SE_DTL0_EPS1_FL0_GRVW4_LPB0_PGR1_PLR1_SNLL1_TT8_8_USFGRO0_VW4_WG16_16_1_WGM1
    SolutionIndex: 267
    SolutionNameMin: Cijk_Ailk_Bljk_SB_MT128x64x16_SE_DTL0_EPS1_FL0_GRVW4_LPB4_PGR1_PLR1_SNLL1_TT8_4_USFGRO0_VW4_WG16_16_1_WGM8
    SolutionIndex: 268
    SolutionNameMin: Cijk_Ailk_Bljk_SB_MT128x64x8_SE_DTL0_EPS1_FL0_GRVW4_LPB4_PGR1_PLR1_SNLL1_TT8_4_USFGRO0_VW4_WG16_16_1_WGM1
    SolutionIndex: 269
    SolutionNameMin: Cijk_Ailk_Bljk_SB_MT128x64x8_SE_DTL0_EPS1_FL0_GRVW4_LPB0_PGR1_PLR1_SNLL1_TT8_4_USFGRO0_VW4_WG16_16_1_WGM8
    SolutionIndex: 270
    SolutionNameMin: Cijk_Ailk_Bljk_SB_MT128x128x16_SE_DTL0_EPS1_FL1_GRVW4_LPB0_PGR1_PLR1_SNLL1_TT8_8_USFGRO0_VW4_WG16_16_1_WGM8
    SolutionIndex: 271
    SolutionNameMin: Cijk_Ailk_Bljk_SB_MT128x64x8_SE_DTL0_EPS1_FL0_GRVW4_LPB4_PGR1_PLR1_SNLL1_TT8_4_USFGRO0_VW4_WG16_16_1_WGM8
    SolutionIndex: 272
    SolutionNameMin: Cijk_Ailk_Bljk_SB_MT128x64x16_SE_DTL0_EPS1_FL1_GRVW4_LPB4_PGR1_PLR1_SNLL1_TT8_4_USFGRO0_VW4_WG16_16_1_WGM1
    SolutionIndex: 273
    SolutionNameMin: Cijk_Ailk_Bljk_SB_MT128x64x8_SE_DTL0_EPS1_FL1_GRVW4_LPB0_PGR1_PLR1_SNLL1_TT8_4_USFGRO0_VW4_WG16_16_1_WGM8
    SolutionIndex: 274
    SolutionNameMin: Cijk_Ailk_Bljk_SB_MT64x64x16_SE_DTL0_EPS0_FL0_GRVW1_LPB1_PGR0_PLR1_SNLL0_TT4_4_USFGRO1_VW1_WG16_16_1_WGM8
    SolutionIndex: 275
    SolutionNameMin: Cijk_Ailk_Bljk_SB_MT64x16x16_SE_DTL0_EPS0_FL0_GRVW1_LPB0_PGR0_PLR1_SNLL0_TT4_2_USFGRO1_VW1_WG16_8_1_WGM1
    SolutionIndex: 276
    SolutionNameMin: Cijk_Ailk_Bljk_SB_MT128x64x16_SE_DTL0_EPS1_FL0_GRVW4_LPB4_PGR1_PLR1_SNLL1_TT8_4_USFGRO0_VW4_WG16_16_1_WGM1
    SolutionIndex: 277
    SolutionNameMin: Cijk_Ailk_Bljk_SB_MT128x64x8_SE_DTL0_EPS1_FL1_GRVW4_LPB0_PGR1_PLR1_SNLL1_TT8_4_USFGRO0_VW4_WG16_16_1_WGM1
    SolutionIndex: 278
    SolutionNameMin: Cijk_Ailk_Bljk_SB_MT64x32x16_SE_DTL0_EPS0_FL0_GRVW1_LPB4_PGR0_PLR1_SNLL0_TT4_4_USFGRO1_VW4_WG16_8_1_WGM1
    SolutionIndex: 279
    SolutionNameMin: Cijk_Ailk_Bljk_SB_MT64x32x8_SE_DTL0_EPS0_FL0_GRVW1_LPB1_PGR0_PLR1_SNLL0_TT4_4_USFGRO1_VW1_WG16_8_1_WGM8
    SolutionIndex: 280
    SolutionNameMin: Cijk_Ailk_Bljk_SB_MT96x64x8_SE_DTL0_EPS1_FL0_GRVW1_LPB2_PGR1_PLR1_SNLL1_TT6_4_USFGRO0_VW2_WG16_16_1_WGM1
    SolutionIndex: 281
    SolutionNameMin: Cijk_Ailk_Bljk_SB_MT64x32x16_SE_DTL0_EPS0_FL1_GRVW4_LPB0_PGR0_PLR1_SNLL0_TT4_4_USFGRO0_VW4_WG16_8_1_WGM8
    SolutionIndex: 282
    SolutionNameMin: Cijk_Ailk_Bljk_SB_MT64x32x8_SE_DTL0_EPS0_FL0_GRVW1_LPB1_PGR0_PLR1_SNLL0_TT4_4_USFGRO1_VW1_WG16_8_1_WGM1
    SolutionIndex: 283
    SolutionNameMin: Cijk_Ailk_Bljk_SB_MT64x32x32_SE_DTL0_EPS0_FL0_GRVW1_LPB1_PGR0_PLR1_SNLL0_TT4_2_USFGRO1_VW1_WG16_16_1_WGM1
    SolutionIndex: 284
    SolutionNameMin: Cijk_Ailk_Bljk_SB_MT64x64x16_SE_DTL0_EPS0_FL0_GRVW1_LPB1_PGR0_PLR1_SNLL0_TT4_4_USFGRO1_VW1_WG16_16_1_WGM1
    SolutionIndex: 285
    SolutionNameMin: Cijk_Ailk_Bljk_SB_MT64x32x8_SE_DTL0_EPS0_FL0_GRVW1_LPB4_PGR0_PLR1_SNLL0_TT4_4_USFGRO1_VW4_WG16_8_1_WGM1
    SolutionIndex: 286
    SolutionNameMin: Cijk_Ailk_Bljk_SB_MT64x32x8_SE_DTL0_EPS0_FL1_GRVW4_LPB4_PGR0_PLR1_SNLL0_TT4_4_USFGRO0_VW4_WG16_8_1_WGM8
    SolutionIndex: 287
    SolutionNameMin: Cijk_Ailk_Bljk_SB_MT64x64x16_SE_DTL0_EPS0_FL0_GRVW4_LPB4_PGR0_PLR1_SNLL0_TT4_4_USFGRO0_VW4_WG16_16_1_WGM1
    SolutionIndex: 288
    SolutionNameMin: Cijk_Ailk_Bljk_SB_MT64x96x16_SE_DTL0_EPS1_FL0_GRVW2_LPB2_PGR1_PLR0_SNLL1_TT4_6_USFGRO0_VW2_WG16_16_1_WGM8
    SolutionIndex: 289
    SolutionNameMin: Cijk_Ailk_Bljk_SB_MT64x16x8_SE_DTL0_EPS0_FL0_GRVW1_LPB1_PGR0_PLR1_SNLL0_TT4_2_USFGRO1_VW1_WG16_8_1_WGM8
    SolutionIndex: 290
    SolutionNameMin: Cijk_Ailk_Bljk_SB_MT64x16x8_SE_DTL0_EPS0_FL0_GRVW1_LPB1_PGR0_PLR0_SNLL0_TT4_2_USFGRO1_VW1_WG16_8_1_WGM1
    SolutionIndex: 291
    SolutionNameMin: Cijk_Ailk_Bljk_SB_MT64x32x8_SE_DTL0_EPS1_FL0_GRVW4_LPB0_PGR1_PLR1_SNLL1_TT4_4_USFGRO0_VW4_WG16_8_1_WGM1
    SolutionIndex: 292
    SolutionNameMin: Cijk_Ailk_Bljk_SB_MT64x32x8_SE_DTL0_EPS0_FL0_GRVW4_LPB4_PGR0_PLR1_SNLL0_TT4_4_USFGRO0_VW4_WG16_8_1_WGM8
    SolutionIndex: 293
    SolutionNameMin: Cijk_Ailk_Bljk_SB_MT64x16x16_SE_DTL0_EPS0_FL0_GRVW1_LPB1_PGR0_PLR0_SNLL0_TT4_2_USFGRO1_VW1_WG16_8_1_WGM1
    SolutionIndex: 294
    SolutionNameMin: Cijk_Ailk_Bljk_SB_MT64x64x16_SE_DTL0_EPS0_FL0_GRVW4_LPB4_PGR0_PLR1_SNLL0_TT4_4_USFGRO0_VW4_WG16_16_1_WGM8
    SolutionIndex: 295
    SolutionNameMin: Cijk_Ailk_Bljk_SB_MT96x64x16_SE_DTL0_EPS1_FL0_GRVW2_LPB2_PGR1_PLR0_SNLL1_TT6_4_USFGRO0_VW2_WG16_16_1_WGM8
    SolutionIndex: 296
    SolutionNameMin: Cijk_Ailk_Bljk_SB_MT64x16x8_SE_DTL0_EPS0_FL0_GRVW1_LPB0_PGR0_PLR0_SNLL0_TT4_2_USFGRO1_VW1_WG16_8_1_WGM8
    SolutionIndex: 297
    SolutionNameMin: Cijk_Ailk_Bljk_SB_MT64x96x16_SE_DTL0_EPS1_FL1_GRVW2_LPB2_PGR1_PLR0_SNLL1_TT4_6_USFGRO0_VW2_WG16_16_1_WGM8
    SolutionIndex: 298
    SolutionNameMin: Cijk_Ailk_Bljk_SB_MT64x32x16_SE_DTL0_EPS0_FL0_GRVW1_LPB1_PGR0_PLR1_SNLL0_TT4_2_USFGRO1_VW1_WG16_16_1_WGM8
    SolutionIndex: 299
    SolutionNameMin: Cijk_Ailk_Bljk_SB_MT64x16x8_SE_DTL0_EPS0_FL0_GRVW1_LPB0_PGR0_PLR1_SNLL0_TT4_2_USFGRO1_VW1_WG16_8_1_WGM8
    SolutionIndex: 300
    SolutionNameMin: Cijk_Ailk_Bljk_SB_MT64x64x8_SE_DTL0_EPS1_FL0_GRVW1_LPB1_PGR1_PLR1_SNLL1_TT4_4_USFGRO1_VW1_WG16_16_1_WGM8
    SolutionIndex: 301
    SolutionNameMin: Cijk_Ailk_Bljk_SB_MT64x64x16_SE_DTL0_EPS0_FL0_GRVW1_LPB4_PGR0_PLR1_SNLL0_TT4_4_USFGRO1_VW4_WG16_16_1_WGM1
    SolutionIndex: 302
    SolutionNameMin: Cijk_Ailk_Bljk_SB_MT64x64x8_SE_DTL0_EPS1_FL0_GRVW1_LPB1_PGR1_PLR1_SNLL1_TT4_4_USFGRO1_VW1_WG16_16_1_WGM1
    SolutionIndex: 303
    SolutionNameMin: Cijk_Ailk_Bljk_SB_MT64x64x8_SE_DTL0_EPS0_FL0_GRVW1_LPB1_PGR0_PLR1_SNLL0_TT4_4_USFGRO1_VW1_WG16_16_1_WGM1
    SolutionIndex: 304
    SolutionNameMin: Cijk_Ailk_Bljk_SB_MT64x64x16_SE_DTL0_EPS0_FL0_GRVW1_LPB4_PGR0_PLR1_SNLL0_TT4_4_USFGRO1_VW4_WG16_16_1_WGM8
    SolutionIndex: 305
    SolutionNameMin: Cijk_Ailk_Bljk_SB_MT64x64x8_SE_DTL0_EPS1_FL0_GRVW4_LPB0_PGR1_PLR1_SNLL1_TT4_8_USFGRO0_VW4_WG16_8_1_WGM1
    SolutionIndex: 306
    SolutionNameMin: Cijk_Ailk_Bljk_SB_MT64x32x8_SE_DTL0_EPS0_FL0_GRVW1_LPB4_PGR0_PLR1_SNLL0_TT4_4_USFGRO1_VW4_WG16_8_1_WGM8
    SolutionIndex: 307
    SolutionNameMin: Cijk_Ailk_Bljk_SB_MT64x64x8_SE_DTL0_EPS0_FL0_GRVW1_LPB1_PGR0_PLR0_SNLL0_TT4_4_USFGRO1_VW1_WG16_16_1_WGM1
    SolutionIndex: 308
    SolutionNameMin: Cijk_Ailk_Bljk_SB_MT64x32x16_SE_DTL0_EPS0_FL0_GRVW1_LPB1_PGR0_PLR1_SNLL0_TT4_2_USFGRO1_VW1_WG16_16_1_WGM1
    SolutionIndex: 309
    SolutionNameMin: Cijk_Ailk_Bljk_SB_MT96x64x8_SE_DTL0_EPS1_FL1_GRVW2_LPB2_PGR1_PLR1_SNLL1_TT6_4_USFGRO0_VW2_WG16_16_1_WGM1
    SolutionIndex: 310
    SolutionNameMin: Cijk_Ailk_Bljk_SB_MT64x16x16_SE_DTL0_EPS0_FL0_GRVW1_LPB0_PGR0_PLR1_SNLL0_TT4_2_USFGRO1_VW1_WG16_8_1_WGM8
    SolutionIndex: 311
    SolutionNameMin: Cijk_Ailk_Bljk_SB_MT64x16x16_SE_DTL0_EPS0_FL0_GRVW1_LPB1_PGR0_PLR1_SNLL0_TT4_2_USFGRO1_VW1_WG16_8_1_WGM8
    SolutionIndex: 312
    SolutionNameMin: Cijk_Ailk_Bljk_SB_MT64x16x8_SE_DTL0_EPS0_FL0_GRVW1_LPB1_PGR0_PLR1_SNLL0_TT4_2_USFGRO1_VW1_WG16_8_1_WGM1
    SolutionIndex: 313
    SolutionNameMin: Cijk_Ailk_Bljk_SB_MT64x32x16_SE_DTL0_EPS0_FL0_GRVW1_LPB1_PGR0_PLR0_SNLL0_TT4_2_USFGRO1_VW1_WG16_16_1_WGM1
    SolutionIndex: 314
    SolutionNameMin: Cijk_Ailk_Bljk_SB_MT64x16x16_SE_DTL0_EPS0_FL0_GRVW1_LPB1_PGR0_PLR1_SNLL0_TT4_2_USFGRO1_VW1_WG16_8_1_WGM1
    SolutionIndex: 315
    SolutionNameMin: Cijk_Ailk_Bljk_SB_MT64x32x8_SE_DTL0_EPS0_FL0_GRVW1_LPB0_PGR0_PLR1_SNLL0_TT4_4_USFGRO1_VW1_WG16_8_1_WGM1
    SolutionIndex: 316
    SolutionNameMin: Cijk_Ailk_Bljk_SB_MT64x32x8_SE_DTL0_EPS1_FL1_GRVW4_LPB0_PGR1_PLR1_SNLL1_TT4_4_USFGRO0_VW4_WG16_8_1_WGM1
    SolutionIndex: 317
    SolutionNameMin: Cijk_Ailk_Bljk_SB_MT64x32x16_SE_DTL0_EPS0_FL0_GRVW1_LPB1_PGR0_PLR1_SNLL0_TT4_4_USFGRO1_VW1_WG16_8_1_WGM1
    SolutionIndex: 318
    SolutionNameMin: Cijk_Ailk_Bljk_SB_MT64x32x16_SE_DTL0_EPS0_FL0_GRVW4_LPB0_PGR0_PLR1_SNLL0_TT4_4_USFGRO0_VW4_WG16_8_1_WGM8
    SolutionIndex: 319
    SolutionNameMin: Cijk_Ailk_Bljk_SB_MT64x64x32_SE_EPS1_GRVW4_GSU1_LPB4_PGR1_PLR1_SNLL1_TT4_8_VW4_WG16_8_4_WGM16
    SolutionIndex: 320
    SolutionNameMin: Cijk_Ailk_Bljk_SB_MT16x16x32_SE_EPS1_GRVW2_GSU1_LPB2_PGR1_PLR1_SNLL1_TT2_2_VW2_WG8_8_4_WGM8
    SolutionIndex: 321
    SolutionNameMin: Cijk_Ailk_Bljk_SB_MT128x32x32_SE_EPS1_GRVW4_GSU1_LPB4_PGR1_PLR1_SNLL1_TT4_8_VW4_WG32_4_4_WGM1
    SolutionIndex: 322
    SolutionNameMin: Cijk_Ailk_Bljk_SB_MT16x8x32_SE_EPS1_GRVW2_GSU1_LPB2_PGR1_PLR1_SNLL1_TT2_2_VW2_WG8_4_4_WGM1
    SolutionIndex: 323
    SolutionNameMin: Cijk_Ailk_Bljk_SB_MT64x32x32_SE_EPS1_GRVW2_GSU1_LPB2_PGR1_PLR1_SNLL1_TT2_4_VW2_WG32_8_2_WGM8
    SolutionIndex: 324
    SolutionNameMin: Cijk_Ailk_Bljk_SB_MT16x16x32_SE_EPS1_GRVW2_GSU1_LPB2_PGR1_PLR1_SNLL1_TT2_2_VW2_WG8_8_4_WGM1
    SolutionIndex: 325
    SolutionNameMin: Cijk_Ailk_Bljk_SB_MT16x16x32_SE_EPS1_GRVW2_GSU1_LPB2_PGR1_PLR1_SNLL1_TT2_4_VW2_WG8_4_8_WGM1
    SolutionIndex: 326
    SolutionNameMin: Cijk_Ailk_Bljk_SB_MT64x64x32_SE_EPS1_GRVW4_GSU1_LPB4_PGR1_PLR1_SNLL1_TT4_4_VW4_WG16_16_1_WGM1
    SolutionIndex: 327
    SolutionNameMin: Cijk_Ailk_Bljk_SB_MT32x16x32_SE_EPS0_GRVW2_GSU1_LPB2_PGR0_PLR1_SNLL0_TT4_2_VW2_WG8_8_4_WGM1
    SolutionIndex: 328
    SolutionNameMin: Cijk_Ailk_Bljk_SB_MT16x32x32_SE_EPS1_GRVW2_GSU1_LPB2_PGR1_PLR1_SNLL1_TT4_4_VW2_WG4_8_8_WGM8
    SolutionIndex: 329
    SolutionNameMin: Cijk_Ailk_Bljk_SB_MT64x16x32_SE_EPS1_GRVW2_GSU1_LPB2_PGR1_PLR1_SNLL1_TT4_2_VW2_WG16_8_2_WGM8
    SolutionIndex: 330
    SolutionNameMin: Cijk_Ailk_Bljk_SB_MT32x64x16_SE_EPS0_GRVW2_GSU1_LPB2_PGR0_PLR1_SNLL0_TT4_4_VW2_WG8_16_2_WGM1
    SolutionIndex: 331
    SolutionNameMin: Cijk_Ailk_Bljk_SB_MT16x16x16_SE_EPS0_GRVW2_GSU1_LPB0_PGR0_PLR1_SNLL0_TT2_2_VW2_WG8_8_2_WGM1
    SolutionIndex: 332
    SolutionNameMin: Cijk_Ailk_Bljk_SB_MT32x64x32_SE_EPS1_GRVW4_GSU1_LPB4_PGR1_PLR1_SNLL1_TT4_4_VW4_WG8_16_2_WGM16
    SolutionIndex: 333
    SolutionNameMin: Cijk_Ailk_Bljk_SB_MT32x32x32_SE_EPS1_GRVW2_GSU1_LPB2_PGR1_PLR1_SNLL1_TT2_4_VW2_WG16_8_2_WGM1
    SolutionIndex: 334
    SolutionNameMin: Cijk_Ailk_Bljk_SB_MT8x32x16_SE_EPS0_GRVW2_GSU1_LPB2_PGR0_PLR1_SNLL0_TT2_2_VW2_WG4_16_4_WGM1
    SolutionIndex: 335
    SolutionNameMin: Cijk_Ailk_Bljk_SB_MT64x64x16_SE_EPS1_GRVW4_GSU1_LPB4_PGR1_PLR1_SNLL1_TT8_4_VW4_WG8_16_2_WGM1
    SolutionIndex: 336
    SolutionNameMin: Cijk_Ailk_Bljk_SB_MT32x32x32_SE_EPS1_GRVW4_GSU1_LPB4_PGR1_PLR1_SNLL1_TT4_4_VW4_WG8_8_4_WGM1
    SolutionIndex: 337
    SolutionNameMin: Cijk_Ailk_Bljk_SB_MT128x32x32_SE_EPS1_GRVW4_GSU1_LPB4_PGR1_PLR1_SNLL1_TT8_4_VW4_WG16_8_4_WGM1
    SolutionIndex: 338
    SolutionNameMin: Cijk_Ailk_Bljk_SB_MT32x64x8_SE_EPS1_GRVW2_GSU1_LPB2_PGR1_PLR1_SNLL1_TT4_4_VW2_WG8_16_2_WGM16
    SolutionIndex: 339
    SolutionNameMin: Cijk_Ailk_Bljk_SB_MT32x32x32_SE_EPS1_GRVW2_GSU4_LPB2_PGR1_PLR1_SNLL0_TT4_4_VW2_WG8_8_4_WGM16
    SolutionIndex: 340
    SolutionNameMin: Cijk_Ailk_Bljk_SB_MT16x32x32_SE_EPS1_GRVW2_GSU1_LPB2_PGR1_PLR1_SNLL1_TT2_4_VW2_WG8_8_4_WGM8
    SolutionIndex: 341
    SolutionNameMin: Cijk_Ailk_Bljk_SB_MT16x8x32_SE_EPS1_GRVW2_GSU4_LPB2_PGR1_PLR1_SNLL0_TT2_2_VW2_WG8_4_4_WGM1
    SolutionIndex: 342
    SolutionNameMin: Cijk_Ailk_Bljk_SB_MT16x16x32_SE_EPS0_GRVW2_GSU1_LPB2_PGR0_PLR1_SNLL0_TT2_2_VW2_WG8_8_4_WGM16
    SolutionIndex: 343
    SolutionNameMin: Cijk_Ailk_Bljk_SB_MT32x64x16_SE_EPS1_GRVW2_GSU1_LPB2_PGR1_PLR1_SNLL1_TT4_4_VW2_WG8_16_2_WGM1
    SolutionIndex: 344
    SolutionNameMin: Cijk_Ailk_Bljk_SB_MT64x16x32_SE_EPS1_GRVW4_GSU1_LPB4_PGR1_PLR1_SNLL1_TT4_4_VW4_WG16_4_4_WGM1
    SolutionIndex: 345
    SolutionNameMin: Cijk_Ailk_Bljk_SB_MT64x32x16_SE_EPS1_GRVW2_GSU1_LPB2_PGR1_PLR1_SNLL1_TT4_4_VW2_WG16_8_4_WGM8
    SolutionIndex: 346
    SolutionNameMin: Cijk_Ailk_Bljk_SB_MT16x16x32_SE_EPS0_GRVW2_GSU1_LPB0_PGR0_PLR0_SNLL0_TT2_2_VW2_WG8_8_4_WGM1
    SolutionIndex: 347
    SolutionNameMin: Cijk_Ailk_Bljk_SB_MT16x16x32_SE_EPS1_GRVW2_GSU1_LPB2_PGR1_PLR0_SNLL1_TT4_2_VW2_WG4_8_8_WGM1
    SolutionIndex: 348
    SolutionNameMin: Cijk_Ailk_Bljk_SB_MT32x32x16_SE_EPS1_GRVW2_GSU1_LPB2_PGR1_PLR1_SNLL1_TT4_2_VW2_WG8_16_2_WGM1
    SolutionIndex: 349
    SolutionNameMin: Cijk_Ailk_Bljk_SB_MT64x64x16_SE_EPS1_GRVW4_GSU1_LPB4_PGR1_PLR1_SNLL1_TT8_4_VW4_WG8_16_2_WGM8
    SolutionIndex: 350
    SolutionNameMin: Cijk_Ailk_Bljk_SB_MT8x32x16_SE_EPS0_GRVW2_GSU1_LPB2_PGR0_PLR0_SNLL0_TT2_2_VW2_WG4_16_4_WGM1
    SolutionIndex: 351
    SolutionNameMin: Cijk_Ailk_Bljk_SB_MT32x32x8_SE_EPS0_GRVW2_GSU1_LPB0_PGR0_PLR1_SNLL0_TT2_2_VW2_WG16_16_1_WGM16
    SolutionIndex: 352
    SolutionNameMin: Cijk_Ailk_Bljk_SB_MT16x32x16_SE_EPS0_GRVW2_GSU1_LPB2_PGR0_PLR1_SNLL0_TT2_2_VW2_WG8_16_2_WGM1
    SolutionIndex: 353
    SolutionNameMin: Cijk_Ailk_Bljk_SB_MT32x32x32_SE_EPS1_GRVW2_GSU1_LPB2_PGR1_PLR1_SNLL1_TT4_4_VW2_WG8_8_4_WGM8
    SolutionIndex: 354
    SolutionNameMin: Cijk_Ailk_Bljk_SB_MT64x64x32_SE_EPS1_GRVW2_GSU1_LPB2_PGR1_PLR1_SNLL1_TT4_4_VW2_WG16_16_4_WGM8
    SolutionIndex: 355
    SolutionNameMin: Cijk_Ailk_Bljk_SB_MT16x16x32_SE_EPS1_GRVW2_GSU4_LPB2_PGR1_PLR1_SNLL0_TT2_4_VW2_WG8_4_8_WGM1
    SolutionIndex: 356
    SolutionNameMin: Cijk_Ailk_Bljk_SB_MT64x32x16_SE_EPS1_GRVW2_GSU1_LPB2_PGR1_PLR1_SNLL1_TT4_4_VW2_WG16_8_4_WGM1
    SolutionIndex: 357
    SolutionNameMin: Cijk_Ailk_Bljk_SB_MT32x16x32_SE_EPS1_GRVW2_GSU4_LPB2_PGR1_PLR1_SNLL0_TT4_2_VW2_WG8_8_4_WGM8
    SolutionIndex: 358
    SolutionNameMin: Cijk_Ailk_Bljk_SB_MT32x16x32_SE_EPS1_GRVW2_GSU1_LPB2_PGR1_PLR1_SNLL1_TT2_2_VW2_WG16_8_2_WGM1
    SolutionIndex: 359
    SolutionNameMin: Cijk_Ailk_Bljk_SB_MT32x32x16_SE_EPS1_GRVW2_GSU1_LPB2_PGR1_PLR1_SNLL1_TT4_4_VW2_WG8_8_4_WGM1
    SolutionIndex: 360
    SolutionNameMin: Cijk_Ailk_Bljk_SB_MT16x64x8_SE_EPS0_GRVW2_GSU1_LPB0_PGR0_PLR1_SNLL0_TT4_4_VW2_WG4_16_4_WGM1
    SolutionIndex: 361
    SolutionNameMin: Cijk_Ailk_Bljk_SB_MT16x16x32_SE_EPS1_GRVW2_GSU1_LPB2_PGR1_PLR0_SNLL1_TT2_2_VW2_WG8_8_4_WGM1
    SolutionIndex: 362
    SolutionNameMin: Cijk_Ailk_Bljk_SB_MT32x16x32_SE_EPS1_GRVW2_GSU1_LPB2_PGR1_PLR1_SNLL1_TT4_2_VW2_WG8_8_4_WGM1
    SolutionIndex: 363
    SolutionNameMin: Cijk_Ailk_Bljk_SB_MT64x64x32_SE_EPS1_GRVW2_GSU1_LPB2_PGR1_PLR1_SNLL1_TT4_4_VW2_WG16_16_4_WGM1
    SolutionIndex: 364
    SolutionNameMin: Cijk_Ailk_Bljk_SB_MT64x16x32_SE_EPS1_GRVW4_GSU1_LPB4_PGR1_PLR1_SNLL1_TT4_4_VW4_WG16_4_4_WGM16
    SolutionIndex: 365
    SolutionNameMin: Cijk_Ailk_Bljk_SB_MT64x32x32_SE_EPS0_GRVW2_GSU4_LPB2_PGR0_PLR1_SNLL0_TT4_4_VW2_WG16_8_2_WGM1
    SolutionIndex: 366
    SolutionNameMin: Cijk_Ailk_Bljk_SB_MT16x32x32_SE_EPS1_GRVW2_GSU1_LPB2_PGR1_PLR1_SNLL1_TT4_2_VW2_WG4_16_4_WGM8
    SolutionIndex: 367
    SolutionNameMin: Cijk_Ailk_Bljk_SB_MT16x32x16_SE_EPS0_GRVW2_GSU1_LPB2_PGR0_PLR0_SNLL0_TT2_2_VW2_WG8_16_1_WGM1
    SolutionIndex: 368
    SolutionNameMin: Cijk_Ailk_Bljk_SB_MT16x16x32_SE_EPS1_GRVW2_GSU4_LPB2_PGR1_PLR1_SNLL0_TT2_2_VW2_WG8_8_2_WGM1
    SolutionIndex: 369
    SolutionNameMin: Cijk_Ailk_Bljk_SB_MT64x64x8_SE_EPS0_GRVW2_GSU1_LPB2_PGR0_PLR1_SNLL0_TT4_4_VW2_WG16_16_1_WGM16
    SolutionIndex: 370
    SolutionNameMin: Cijk_Ailk_Bljk_SB_MT4x64x16_SE_EPS1_GRVW2_GSU1_LPB2_PGR1_PLR1_SNLL1_TT2_2_VW2_WG2_32_4_WGM8
    SolutionIndex: 371
    SolutionNameMin: Cijk_Ailk_Bljk_SB_MT32x16x32_SE_EPS1_GRVW2_GSU1_LPB2_PGR1_PLR1_SNLL1_TT4_2_VW2_WG8_8_4_WGM8
    SolutionIndex: 372
    SolutionNameMin: Cijk_Ailk_Bljk_SB_MT16x32x32_SE_EPS0_GRVW2_GSU1_LPB2_PGR0_PLR1_SNLL0_TT2_4_VW2_WG8_8_4_WGM1
    SolutionIndex: 373
    SolutionNameMin: Cijk_Ailk_Bljk_SB_MT128x64x16_SE_EPS1_GRVW4_GSU1_LPB4_PGR1_PLR1_SNLL1_TT8_4_VW4_WG16_16_1_WGM16
    SolutionIndex: 374
    SolutionNameMin: Cijk_Ailk_Bljk_SB_MT32x8x32_SE_EPS1_GRVW2_GSU1_LPB2_PGR1_PLR1_SNLL1_TT2_2_VW2_WG16_4_4_WGM16
    SolutionIndex: 375
    SolutionNameMin: Cijk_Ailk_Bljk_SB_MT64x32x32_SE_EPS1_GRVW4_GSU1_LPB4_PGR1_PLR1_SNLL1_TT4_4_VW4_WG16_8_2_WGM16
    SolutionIndex: 376
    SolutionNameMin: Cijk_Ailk_Bljk_SB_MT32x32x32_SE_EPS1_GRVW4_GSU1_LPB4_PGR1_PLR1_SNLL1_TT4_4_VW4_WG8_8_4_WGM16
    SolutionIndex: 377
    SolutionNameMin: Cijk_Ailk_Bljk_SB_MT32x32x16_SE_EPS0_GRVW2_GSU1_LPB2_PGR0_PLR1_SNLL0_TT2_2_VW2_WG16_16_1_WGM1
    SolutionIndex: 378
    SolutionNameMin: Cijk_Ailk_Bljk_SB_MT32x64x16_SE_EPS0_GRVW2_GSU1_LPB2_PGR0_PLR0_SNLL0_TT4_4_VW2_WG8_16_4_WGM8
    SolutionIndex: 379
    SolutionNameMin: Cijk_Ailk_Bljk_SB_MT32x32x32_SE_EPS1_GRVW2_GSU1_LPB2_PGR1_PLR1_SNLL1_TT4_4_VW2_WG8_8_4_WGM1
    SolutionIndex: 380
    SolutionNameMin: Cijk_Ailk_Bljk_SB_MT16x32x8_SE_EPS0_GRVW2_GSU1_LPB0_PGR0_PLR0_SNLL0_TT2_2_VW2_WG8_16_2_WGM1
    SolutionIndex: 381
    SolutionNameMin: Cijk_Ailk_Bljk_SB_MT32x32x32_SE_EPS1_GRVW2_GSU1_LPB2_PGR1_PLR1_SNLL1_TT2_2_VW2_WG16_16_1_WGM1
    SolutionIndex: 382
    SolutionNameMin: Cijk_Ailk_Bljk_SB_MT32x64x16_SE_EPS0_GRVW2_GSU1_LPB2_PGR0_PLR0_SNLL0_TT2_4_VW2_WG16_16_1_WGM1
    SolutionIndex: 383
    SolutionNameMin: Cijk_Ailk_Bljk_SB_MT16x16x32_SE_EPS0_GRVW2_GSU1_LPB2_PGR0_PLR1_SNLL0_TT2_2_VW2_WG8_8_4_WGM1
    SolutionIndex: 384
    SolutionNameMin: Cijk_Ailk_Bljk_SB_MT16x16x32_SE_EPS1_GRVW2_GSU1_LPB2_PGR1_PLR1_SNLL1_TT4_2_VW2_WG4_8_8_WGM8
    SolutionIndex: 385
    SolutionNameMin: Cijk_Ailk_Bljk_SB_MT16x8x32_SE_EPS1_GRVW2_GSU1_LPB0_PGR1_PLR1_SNLL1_TT2_2_VW2_WG8_4_4_WGM1
    SolutionIndex: 386
    SolutionNameMin: Cijk_Ailk_Bljk_SB_MT64x64x8_SE_EPS1_GRVW2_GSU1_LPB0_PGR1_PLR1_SNLL1_TT4_4_VW2_WG16_16_1_WGM1
    SolutionIndex: 387
    SolutionNameMin: Cijk_Ailk_Bljk_SB_MT8x32x16_SE_EPS0_GRVW2_GSU1_LPB0_PGR0_PLR1_SNLL0_TT2_2_VW2_WG4_16_4_WGM1
    SolutionIndex: 388
    SolutionNameMin: Cijk_Ailk_Bljk_SB_MT64x16x32_SE_EPS1_GRVW4_GSU1_LPB4_PGR1_PLR1_SNLL1_TT4_4_VW4_WG16_4_4_WGM8
    SolutionIndex: 389
    SolutionNameMin: Cijk_Ailk_Bljk_SB_MT32x32x32_SE_EPS0_GRVW4_GSU1_LPB4_PGR0_PLR1_SNLL0_TT4_4_VW4_WG8_8_4_WGM8
    SolutionIndex: 390
    SolutionNameMin: Cijk_Ailk_Bljk_SB_MT64x64x16_SE_EPS1_GRVW4_GSU1_LPB4_PGR1_PLR1_SNLL1_TT4_4_VW4_WG16_16_1_WGM16
    SolutionIndex: 391
    SolutionNameMin: Cijk_Ailk_Bljk_SB_MT32x8x32_SE_EPS1_GRVW2_GSU1_LPB2_PGR1_PLR1_SNLL1_TT4_2_VW2_WG8_4_8_WGM1
    SolutionIndex: 392
    SolutionNameMin: Cijk_Ailk_Bljk_SB_MT16x16x32_SE_EPS1_GRVW2_GSU1_LPB2_PGR1_PLR1_SNLL1_TT4_2_VW2_WG4_8_8_WGM1
    SolutionIndex: 393
    SolutionNameMin: Cijk_Ailk_Bljk_SB_MT64x32x32_SE_EPS1_GRVW2_GSU1_LPB2_PGR1_PLR1_SNLL1_TT4_4_VW2_WG16_8_4_WGM8
    SolutionIndex: 394
    SolutionNameMin: Cijk_Ailk_Bljk_SB_MT16x32x16_SE_EPS0_GRVW2_GSU1_LPB0_PGR0_PLR0_SNLL0_TT2_2_VW2_WG8_16_1_WGM1
    SolutionIndex: 395
    SolutionNameMin: Cijk_Ailk_Bljk_SB_MT32x16x32_SE_EPS1_GRVW2_GSU1_LPB2_PGR1_PLR1_SNLL1_TT2_4_VW2_WG16_4_4_WGM1
    SolutionIndex: 396
    SolutionNameMin: Cijk_Ailk_Bljk_SB_MT4x64x16_SE_EPS1_GRVW2_GSU1_LPB2_PGR1_PLR1_SNLL1_TT2_2_VW2_WG2_32_4_WGM1
    SolutionIndex: 397
    SolutionNameMin: Cijk_Ailk_Bljk_SB_MT32x16x32_SE_EPS1_GRVW2_GSU1_LPB0_PGR1_PLR1_SNLL1_TT4_2_VW2_WG8_8_4_WGM1
    SolutionIndex: 398
    SolutionNameMin: Cijk_Ailk_Bljk_SB_MT64x64x32_SE_EPS1_GRVW4_GSU1_LPB4_PGR1_PLR1_SNLL1_TT4_8_VW4_WG16_8_4_WGM1
    SolutionIndex: 399
    SolutionNameMin: Cijk_Ailk_Bljk_SB_MT64x64x16_SE_EPS1_GRVW4_GSU1_LPB0_PGR1_PLR1_SNLL1_TT4_4_VW4_WG16_16_1_WGM8
    SolutionIndex: 400
    SolutionNameMin: Cijk_Ailk_Bljk_SB_MT32x16x32_SE_EPS1_GRVW2_GSU1_LPB2_PGR1_PLR1_SNLL1_TT2_4_VW2_WG16_4_4_WGM16
    SolutionIndex: 401
    SolutionNameMin: Cijk_Ailk_Bljk_SB_MT32x16x32_SE_EPS1_GRVW2_GSU1_LPB2_PGR1_PLR1_SNLL1_TT4_2_VW2_WG8_8_4_WGM16
    SolutionIndex: 402
    SolutionNameMin: Cijk_Ailk_Bljk_SB_MT64x32x16_SE_EPS1_GRVW4_GSU1_LPB4_PGR1_PLR1_SNLL1_TT4_4_VW4_WG16_8_2_WGM8
    SolutionIndex: 403
    SolutionNameMin: Cijk_Ailk_Bljk_SB_MT4x64x16_SE_EPS0_GRVW2_GSU1_LPB0_PGR0_PLR0_SNLL0_TT2_2_VW2_WG2_32_4_WGM1
    SolutionIndex: 404
    SolutionNameMin: Cijk_Ailk_Bljk_SB_MT16x32x32_SE_EPS1_GRVW2_GSU4_LPB2_PGR1_PLR1_SNLL0_TT2_4_VW2_WG8_8_4_WGM1
    SolutionIndex: 405
    SolutionNameMin: Cijk_Ailk_Bljk_SB_MT32x32x32_SE_EPS1_GRVW2_GSU4_LPB2_PGR1_PLR1_SNLL0_TT4_4_VW2_WG8_8_4_WGM8
    SolutionIndex: 406
    SolutionNameMin: Cijk_Ailk_Bljk_SB_MT16x32x16_SE_EPS0_GRVW2_GSU1_LPB2_PGR0_PLR0_SNLL0_TT2_2_VW2_WG8_16_2_WGM1
    SolutionIndex: 407
    SolutionNameMin: Cijk_Ailk_Bljk_SB_MT64x32x32_SE_EPS1_GRVW4_GSU1_LPB4_PGR1_PLR1_SNLL1_TT4_4_VW4_WG16_8_4_WGM1
    SolutionIndex: 408
    SolutionNameMin: Cijk_Ailk_Bljk_SB_MT32x32x32_SE_EPS1_GRVW4_GSU1_LPB4_PGR1_PLR1_SNLL1_TT4_4_VW4_WG8_8_4_WGM8
    SolutionIndex: 409
    SolutionNameMin: Cijk_Ailk_Bljk_SB_MT32x8x32_SE_EPS1_GRVW2_GSU1_LPB0_PGR1_PLR1_SNLL1_TT2_2_VW2_WG16_4_4_WGM1
    SolutionIndex: 410
    SolutionNameMin: Cijk_Ailk_Bljk_SB_MT64x64x32_SE_EPS1_GRVW4_GSU1_LPB4_PGR1_PLR1_SNLL1_TT4_4_VW4_WG16_16_1_WGM16
    SolutionIndex: 411
    SolutionNameMin: Cijk_Ailk_Bljk_SB_MT64x64x16_SE_EPS0_GRVW2_GSU1_LPB2_PGR0_PLR0_SNLL0_TT4_4_VW2_WG16_16_1_WGM16
    SolutionIndex: 412
    SolutionNameMin: Cijk_Ailk_Bljk_SB_MT4x64x16_SE_EPS0_GRVW2_GSU1_LPB2_PGR0_PLR1_SNLL0_TT2_2_VW2_WG2_32_4_WGM1
    SolutionIndex: 413
    SolutionNameMin: Cijk_Ailk_Bljk_SB_MT8x32x16_SE_EPS0_GRVW2_GSU1_LPB0_PGR0_PLR0_SNLL0_TT2_2_VW2_WG4_16_4_WGM1
    SolutionIndex: 414
    SolutionNameMin: Cijk_Ailk_Bljk_SB_MT16x16x16_SE_EPS1_GRVW2_GSU1_LPB0_PGR1_PLR1_SNLL1_TT2_2_VW2_WG8_8_4_WGM1
    SolutionIndex: 415
    SolutionNameMin: Cijk_Ailk_Bljk_SB_MT64x32x32_SE_EPS1_GRVW4_GSU1_LPB4_PGR1_PLR1_SNLL1_TT4_4_VW4_WG16_8_4_WGM8
    SolutionIndex: 416
    SolutionNameMin: Cijk_Ailk_Bljk_SB_MT32x16x32_SE_EPS0_GRVW2_GSU1_LPB2_PGR0_PLR1_SNLL0_TT4_2_VW2_WG8_8_4_WGM8
    SolutionIndex: 417
    SolutionNameMin: Cijk_Ailk_Bljk_SB_MT64x64x8_SE_EPS1_GRVW2_GSU1_LPB2_PGR1_PLR1_SNLL1_TT4_4_VW2_WG16_16_1_WGM16
    SolutionIndex: 418
    SolutionNameMin: Cijk_Ailk_Bljk_SB_MT32x64x16_SE_EPS1_GRVW2_GSU1_LPB2_PGR1_PLR1_SNLL1_TT4_4_VW2_WG8_16_4_WGM8
    SolutionIndex: 419
    SolutionNameMin: Cijk_Ailk_Bljk_SB_MT8x32x32_SE_EPS0_GRVW2_GSU1_LPB2_PGR0_PLR1_SNLL0_TT2_4_VW2_WG4_8_8_WGM8
    SolutionIndex: 420
    SolutionNameMin: Cijk_Ailk_Bljk_SB_MT8x32x32_SE_EPS1_GRVW2_GSU1_LPB2_PGR1_PLR1_SNLL1_TT4_2_VW2_WG2_16_8_WGM8
    SolutionIndex: 421
    SolutionNameMin: Cijk_Ailk_Bljk_SB_MT16x16x32_SE_EPS1_GRVW2_GSU4_LPB2_PGR1_PLR1_SNLL0_TT2_2_VW2_WG8_8_4_WGM8
    SolutionIndex: 422
    SolutionNameMin: Cijk_Ailk_Bljk_SB_MT32x8x32_SE_EPS1_GRVW2_GSU4_LPB2_PGR1_PLR0_SNLL0_TT2_2_VW2_WG16_4_4_WGM1
    SolutionIndex: 423
    SolutionNameMin: Cijk_Ailk_Bljk_SB_MT32x32x16_SE_EPS1_GRVW2_GSU1_LPB2_PGR1_PLR1_SNLL1_TT4_4_VW2_WG8_8_4_WGM16
    SolutionIndex: 424
    SolutionNameMin: Cijk_Ailk_Bljk_SB_MT64x128x16_SE_EPS1_GRVW4_GSU1_LPB4_PGR1_PLR1_SNLL1_TT4_8_VW4_WG16_16_1_WGM16
    SolutionIndex: 425
    SolutionNameMin: Cijk_Ailk_Bljk_SB_MT64x32x32_SE_EPS1_GRVW4_GSU1_LPB4_PGR1_PLR1_SNLL1_TT4_4_VW4_WG16_8_2_WGM1
    SolutionIndex: 426
    SolutionNameMin: Cijk_Ailk_Bljk_SB_MT16x32x32_SE_EPS1_GRVW2_GSU1_LPB2_PGR1_PLR1_SNLL1_TT2_4_VW2_WG8_8_4_WGM1
    SolutionIndex: 427
    SolutionNameMin: Cijk_Ailk_Bljk_SB_MT128x64x16_SE_EPS1_GRVW4_GSU1_LPB0_PGR1_PLR1_SNLL1_TT8_4_VW4_WG16_16_1_WGM1
    SolutionIndex: 428
    SolutionNameMin: Cijk_Ailk_Bljk_SB_MT128x32x32_SE_EPS1_GRVW4_GSU1_LPB4_PGR1_PLR1_SNLL1_TT4_4_VW4_WG32_8_2_WGM1
    SolutionIndex: 429
    SolutionNameMin: Cijk_Ailk_Bljk_SB_MT32x64x8_SE_EPS0_GRVW2_GSU1_LPB2_PGR0_PLR1_SNLL0_TT4_4_VW2_WG8_16_2_WGM16
    SolutionIndex: 430
    SolutionNameMin: Cijk_Ailk_Bljk_SB_MT32x64x16_SE_EPS0_GRVW2_GSU1_LPB2_PGR0_PLR1_SNLL0_TT4_4_VW2_WG8_16_2_WGM8
    SolutionIndex: 431
    SolutionNameMin: Cijk_Ailk_Bljk_SB_MT16x16x8_SE_EPS0_GRVW2_GSU1_LPB0_PGR0_PLR0_SNLL0_TT2_2_VW2_WG8_8_4_WGM1
    SolutionIndex: 432
    SolutionNameMin: Cijk_Ailk_Bljk_SB_MT32x32x16_SE_EPS0_GRVW2_GSU1_LPB0_PGR0_PLR1_SNLL0_TT2_2_VW2_WG16_16_1_WGM1
    SolutionIndex: 433
    SolutionNameMin: Cijk_Ailk_Bljk_SB_MT64x64x8_SE_EPS1_GRVW2_GSU1_LPB0_PGR1_PLR1_SNLL1_TT4_4_VW2_WG16_16_1_WGM8
    SolutionIndex: 434
    SolutionNameMin: Cijk_Ailk_Bljk_SB_MT64x64x32_SE_EPS1_GRVW4_GSU1_LPB4_PGR1_PLR1_SNLL1_TT8_4_VW4_WG8_16_4_WGM16
    SolutionIndex: 435
    SolutionNameMin: Cijk_Ailk_Bljk_SB_MT64x32x32_SE_EPS1_GRVW2_GSU1_LPB2_PGR1_PLR1_SNLL1_TT4_4_VW2_WG16_8_4_WGM1
    SolutionIndex: 436
    SolutionNameMin: Cijk_Ailk_Bljk_SB_MT64x64x16_SE_EPS0_GRVW2_GSU1_LPB0_PGR0_PLR0_SNLL0_TT4_4_VW2_WG16_16_1_WGM16
    SolutionIndex: 437
    SolutionNameMin: Cijk_Ailk_Bljk_SB_MT16x8x32_SE_EPS1_GRVW2_GSU4_LPB2_PGR1_PLR1_SNLL0_TT2_2_VW2_WG8_4_4_WGM8
    SolutionIndex: 438
    SolutionNameMin: Cijk_Ailk_Bljk_SB_MT128x64x32_SE_EPS1_GRVW4_GSU1_LPB4_PGR1_PLR1_SNLL1_TT4_4_VW4_WG32_16_2_WGM1
    SolutionIndex: 439
    SolutionNameMin: Cijk_Ailk_Bljk_SB_MT64x64x16_SE_EPS1_GRVW4_GSU1_LPB4_PGR1_PLR1_SNLL1_TT8_4_VW4_WG8_16_2_WGM16
    SolutionIndex: 440
    SolutionNameMin: Cijk_Ailk_Bljk_SB_MT64x32x16_SE_EPS1_GRVW4_GSU1_LPB4_PGR1_PLR1_SNLL1_TT4_4_VW4_WG16_8_2_WGM16
    SolutionIndex: 441
    SolutionNameMin: Cijk_Ailk_Bljk_SB_MT64x32x32_SE_EPS0_GRVW2_GSU4_LPB2_PGR0_PLR1_SNLL0_TT4_4_VW2_WG16_8_2_WGM8
    SolutionIndex: 442
    SolutionNameMin: Cijk_Ailk_Bljk_SB_MT16x16x32_SE_EPS1_GRVW2_GSU4_LPB2_PGR1_PLR1_SNLL0_TT2_4_VW2_WG8_4_8_WGM8
    SolutionIndex: 443
    SolutionNameMin: Cijk_Ailk_Bljk_SB_MT16x16x32_SE_EPS1_GRVW2_GSU4_LPB2_PGR1_PLR1_SNLL0_TT2_2_VW2_WG8_8_4_WGM1
    SolutionIndex: 444
    SolutionNameMin: Cijk_Ailk_Bljk_SB_MT32x64x16_SE_EPS0_GRVW2_GSU1_LPB2_PGR0_PLR1_SNLL0_TT2_4_VW2_WG16_16_1_WGM1
    SolutionIndex: 445
    SolutionNameMin: Cijk_Ailk_Bljk_SB_MT8x32x32_SE_EPS1_GRVW2_GSU1_LPB2_PGR1_PLR1_SNLL1_TT2_4_VW2_WG4_8_8_WGM8
    SolutionIndex: 446
    SolutionNameMin: Cijk_Ailk_Bljk_SB_MT32x32x16_SE_EPS0_GRVW2_GSU1_LPB0_PGR0_PLR0_SNLL0_TT2_2_VW2_WG16_16_1_WGM1
    SolutionIndex: 447
    SolutionNameMin: Cijk_Ailk_Bljk_SB_MT32x16x16_SE_EPS1_GRVW2_GSU1_LPB2_PGR1_PLR1_SNLL1_TT4_2_VW2_WG8_8_4_WGM1
    SolutionIndex: 448
    SolutionNameMin: Cijk_Ailk_Bljk_SB_MT32x8x32_SE_EPS1_GRVW2_GSU1_LPB2_PGR1_PLR1_SNLL1_TT2_2_VW2_WG16_4_4_WGM8
    SolutionIndex: 449
    SolutionNameMin: Cijk_Ailk_Bljk_SB_MT16x32x32_SE_EPS1_GRVW2_GSU1_LPB2_PGR1_PLR0_SNLL1_TT2_4_VW2_WG8_8_4_WGM8
    SolutionIndex: 450
    SolutionNameMin: Cijk_Ailk_Bljk_SB_MT32x32x8_SE_EPS0_GRVW2_GSU1_LPB2_PGR0_PLR1_SNLL0_TT2_2_VW2_WG16_16_1_WGM16
    SolutionIndex: 451
    SolutionNameMin: Cijk_Ailk_Bljk_SB_MT32x64x16_SE_EPS0_GRVW2_GSU1_LPB2_PGR0_PLR0_SNLL0_TT2_4_VW2_WG16_16_1_WGM16
    SolutionIndex: 452
    SolutionNameMin: Cijk_Ailk_Bljk_SB_MT32x64x16_SE_EPS1_GRVW2_GSU1_LPB2_PGR1_PLR1_SNLL1_TT4_4_VW2_WG8_16_2_WGM16
    SolutionIndex: 453
    SolutionNameMin: Cijk_Ailk_Bljk_SB_MT32x16x32_SE_EPS1_GRVW2_GSU4_LPB2_PGR1_PLR0_SNLL0_TT4_2_VW2_WG8_8_4_WGM8
    SolutionIndex: 454
    SolutionNameMin: Cijk_Ailk_Bljk_SB_MT16x16x32_SE_EPS1_GRVW2_GSU4_LPB2_PGR1_PLR0_SNLL0_TT2_2_VW2_WG8_8_4_WGM1
    SolutionIndex: 455
    SolutionNameMin: Cijk_Ailk_Bljk_SB_MT16x8x32_SE_EPS0_GRVW2_GSU1_LPB0_PGR0_PLR1_SNLL0_TT2_2_VW2_WG8_4_4_WGM8
    SolutionIndex: 456
    SolutionNameMin: Cijk_Ailk_Bljk_SB_MT16x16x32_SE_EPS0_GRVW2_GSU4_LPB2_PGR0_PLR1_SNLL0_TT2_2_VW2_WG8_8_4_WGM8
    SolutionIndex: 457
    SolutionNameMin: Cijk_Ailk_Bljk_SB_MT16x32x32_SE_EPS1_GRVW2_GSU1_LPB2_PGR1_PLR0_SNLL1_TT2_4_VW2_WG8_8_4_WGM1
    SolutionIndex: 458
    SolutionNameMin: Cijk_Ailk_Bljk_SB_MT16x8x32_SE_EPS1_GRVW2_GSU4_LPB0_PGR1_PLR1_SNLL0_TT2_2_VW2_WG8_4_4_WGM1
    SolutionIndex: 459
    SolutionNameMin: Cijk_Ailk_Bljk_SB_MT16x8x32_SE_EPS1_GRVW2_GSU4_LPB2_PGR1_PLR0_SNLL0_TT2_2_VW2_WG8_4_4_WGM8
    SolutionIndex: 460
    SolutionNameMin: Cijk_Ailk_Bljk_SB_MT8x64x8_SE_EPS0_GRVW2_GSU1_LPB2_PGR0_PLR1_SNLL0_TT2_4_VW2_WG4_16_4_WGM1
    SolutionIndex: 461
    SolutionNameMin: Cijk_Ailk_Bljk_SB_MT32x32x32_SE_EPS1_GRVW4_GSU1_LPB0_PGR1_PLR1_SNLL1_TT4_4_VW4_WG8_8_4_WGM16
    SolutionIndex: 462
    SolutionNameMin: Cijk_Ailk_Bljk_SB_MT128x64x32_SE_EPS1_GRVW2_GSU1_LPB2_PGR1_PLR1_SNLL1_TT4_4_VW2_WG32_16_2_WGM1
    SolutionIndex: 463
    SolutionNameMin: Cijk_Ailk_Bljk_SB_MT16x8x32_SE_EPS1_GRVW2_GSU4_LPB2_PGR1_PLR0_SNLL0_TT2_2_VW2_WG8_4_4_WGM1
    SolutionIndex: 464
    SolutionNameMin: Cijk_Ailk_Bljk_SB_MT64x64x8_SE_EPS1_GRVW2_GSU1_LPB2_PGR1_PLR1_SNLL1_TT4_4_VW2_WG16_16_1_WGM1
    SolutionIndex: 465
    SolutionNameMin: Cijk_Ailk_Bljk_SB_MT16x16x16_SE_EPS0_GRVW2_GSU1_LPB0_PGR0_PLR0_SNLL0_TT2_2_VW2_WG8_8_2_WGM1
    SolutionIndex: 466
    SolutionNameMin: Cijk_Ailk_Bljk_SB_MT64x64x32_SE_EPS1_GRVW4_GSU1_LPB0_PGR1_PLR1_SNLL1_TT8_4_VW4_WG8_16_2_WGM16
    SolutionIndex: 467
    SolutionNameMin: Cijk_Ailk_Bljk_SB_MT16x16x32_SE_EPS1_GRVW2_GSU1_LPB2_PGR1_PLR1_SNLL1_TT2_2_VW2_WG8_8_4_WGM16
    SolutionIndex: 468
    SolutionNameMin: Cijk_Ailk_Bljk_SB_MT16x32x32_SE_EPS1_GRVW2_GSU4_LPB2_PGR1_PLR1_SNLL0_TT2_4_VW2_WG8_8_4_WGM8
    SolutionIndex: 469
    SolutionNameMin: Cijk_Ailk_Bljk_SB_MT64x64x32_SE_EPS1_GRVW4_GSU1_LPB0_PGR1_PLR1_SNLL1_TT4_4_VW4_WG16_16_1_WGM16
    SolutionIndex: 470
    SolutionNameMin: Cijk_Ailk_Bljk_SB_MT64x64x32_SE_EPS1_GRVW4_GSU1_LPB4_PGR1_PLR1_SNLL1_TT8_4_VW4_WG8_16_4_WGM1
    SolutionIndex: 471
    SolutionNameMin: Cijk_Ailk_Bljk_SB_MT16x16x32_SE_EPS1_GRVW2_GSU1_LPB2_PGR1_PLR1_SNLL1_TT2_4_VW2_WG8_4_8_WGM8
    SolutionIndex: 472
    SolutionNameMin: Cijk_Ailk_Bljk_SB_MT64x64x32_SE_EPS1_GRVW4_GSU1_LPB4_PGR1_PLR1_SNLL1_TT4_8_VW4_WG16_8_4_WGM8
    SolutionIndex: 473
    SolutionNameMin: Cijk_Ailk_Bljk_SB_MT64x64x16_SE_EPS0_GRVW2_GSU1_LPB2_PGR0_PLR1_SNLL0_TT4_4_VW2_WG16_16_1_WGM8
    SolutionIndex: 474
    SolutionNameMin: Cijk_Ailk_Bljk_SB_MT16x32x32_SE_EPS1_GRVW2_GSU1_LPB2_PGR1_PLR1_SNLL1_TT4_2_VW2_WG4_16_4_WGM1
    SolutionIndex: 475
    SolutionNameMin: Cijk_Ailk_Bljk_SB_MT32x16x32_SE_EPS1_GRVW2_GSU1_LPB2_PGR1_PLR1_SNLL1_TT2_4_VW2_WG16_4_4_WGM8
    SolutionIndex: 476
    SolutionNameMin: Cijk_Ailk_Bljk_SB_MT64x64x16_SE_EPS1_GRVW4_GSU1_LPB4_PGR1_PLR1_SNLL1_TT4_8_VW4_WG16_8_2_WGM16
    SolutionIndex: 477
    SolutionNameMin: Cijk_Ailk_Bljk_SB_MT8x32x32_SE_EPS0_GRVW2_GSU1_LPB2_PGR0_PLR1_SNLL0_TT2_4_VW2_WG4_8_8_WGM1
    SolutionIndex: 478
    SolutionNameMin: Cijk_Ailk_Bljk_SB_MT32x64x8_SE_EPS0_GRVW2_GSU1_LPB2_PGR0_PLR1_SNLL0_TT4_4_VW2_WG8_16_2_WGM8
    SolutionIndex: 479
    SolutionNameMin: Cijk_Ailk_Bljk_SB_MT64x32x32_SE_EPS1_GRVW4_GSU1_LPB4_PGR1_PLR0_SNLL1_TT4_4_VW4_WG16_8_4_WGM16
    SolutionIndex: 480
    SolutionNameMin: Cijk_Ailk_Bljk_SB_MT128x64x16_SE_EPS1_GRVW4_GSU1_LPB4_PGR1_PLR1_SNLL1_TT8_4_VW4_WG16_16_1_WGM1
    SolutionIndex: 481
    SolutionNameMin: Cijk_Ailk_Bljk_SB_MT4x64x16_SE_EPS0_GRVW2_GSU1_LPB2_PGR0_PLR0_SNLL0_TT2_2_VW2_WG2_32_4_WGM1
    SolutionIndex: 482
    SolutionNameMin: Cijk_Ailk_Bljk_SB_MT16x8x32_SE_EPS1_GRVW2_GSU1_LPB2_PGR1_PLR1_SNLL1_TT2_2_VW2_WG8_4_4_WGM8
    SolutionIndex: 483
    SolutionNameMin: Cijk_Ailk_Bljk_SB_MT32x8x32_SE_EPS1_GRVW2_GSU1_LPB2_PGR1_PLR1_SNLL1_TT2_2_VW2_WG16_4_4_WGM1
    SolutionIndex: 484
    SolutionNameMin: Cijk_Ailk_Bljk_SB_MT32x16x16_SE_EPS0_GRVW2_GSU1_LPB2_PGR0_PLR1_SNLL0_TT4_2_VW2_WG8_8_4_WGM1
    SolutionIndex: 485
    SolutionNameMin: Cijk_Ailk_Bljk_SB_MT16x64x16_SE_EPS0_GRVW2_GSU1_LPB2_PGR0_PLR1_SNLL0_TT4_4_VW2_WG4_16_4_WGM1
    SolutionIndex: 486
    SolutionNameMin: Cijk_Ailk_Bljk_SB_MT64x64x16_SE_EPS1_GRVW4_GSU1_LPB4_PGR1_PLR1_SNLL1_TT4_4_VW4_WG16_16_1_WGM1
    SolutionIndex: 487
    SolutionNameMin: Cijk_Ailk_Bljk_SB_MT8x32x32_SE_EPS0_GRVW2_GSU1_LPB2_PGR0_PLR1_SNLL0_TT2_2_VW2_WG4_16_4_WGM1
    SolutionIndex: 488
    SolutionNameMin: Cijk_Ailk_Bljk_SB_MT8x32x32_SE_EPS1_GRVW2_GSU1_LPB2_PGR1_PLR1_SNLL1_TT2_4_VW2_WG4_8_8_WGM1
    SolutionIndex: 489
    SolutionNameMin: Cijk_Ailk_Bljk_SB_MT128x32x32_SE_EPS1_GRVW4_GSU1_LPB4_PGR1_PLR1_SNLL1_TT4_4_VW4_WG32_8_2_WGM16
    SolutionIndex: 490
    SolutionNameMin: Cijk_Ailk_Bljk_SB_MT32x64x32_SE_EPS1_GRVW4_GSU1_LPB4_PGR1_PLR1_SNLL1_TT4_4_VW4_WG8_16_2_WGM1
    SolutionIndex: 491
    SolutionNameMin: Cijk_Ailk_Bljk_SB_MT64x32x32_SE_EPS1_GRVW4_GSU1_LPB4_PGR1_PLR1_SNLL1_TT4_4_VW4_WG16_8_2_WGM8
    SolutionIndex: 492
    SolutionNameMin: Cijk_Ailk_Bljk_SB_MT32x32x16_SE_EPS0_GRVW2_GSU1_LPB0_PGR0_PLR1_SNLL0_TT2_2_VW2_WG16_16_1_WGM16
    SolutionIndex: 493
    SolutionNameMin: Cijk_Ailk_Bljk_SB_MT64x32x16_SE_EPS1_GRVW4_GSU1_LPB4_PGR1_PLR1_SNLL1_TT4_4_VW4_WG16_8_2_WGM1
    SolutionIndex: 494
    SolutionNameMin: Cijk_Ailk_Bljk_SB_MT32x16x32_SE_EPS1_GRVW2_GSU1_LPB2_PGR1_PLR0_SNLL1_TT4_2_VW2_WG8_8_4_WGM1
    SolutionIndex: 495
    SolutionNameMin: Cijk_Ailk_Bljk_SB_MT64x32x32_SE_EPS1_GRVW4_GSU1_LPB4_PGR1_PLR1_SNLL1_TT8_4_VW4_WG8_8_4_WGM8
    SolutionIndex: 496
    SolutionNameMin: Cijk_Ailk_Bljk_SB_MT8x64x16_SE_EPS0_GRVW2_GSU1_LPB2_PGR0_PLR0_SNLL0_TT2_4_VW2_WG4_16_4_WGM1
    SolutionIndex: 497
    SolutionNameMin: Cijk_Ailk_Bljk_SB_MT32x32x16_SE_EPS0_GRVW2_GSU1_LPB0_PGR0_PLR0_SNLL0_TT2_2_VW2_WG16_16_1_WGM8
    SolutionIndex: 498
    SolutionNameMin: Cijk_Ailk_Bljk_SB_MT16x64x8_SE_EPS0_GRVW2_GSU1_LPB0_PGR0_PLR0_SNLL0_TT4_4_VW2_WG4_16_4_WGM1
    SolutionIndex: 499
    SolutionNameMin: Cijk_Ailk_Bljk_SB_MT32x32x16_SE_EPS0_GRVW2_GSU1_LPB2_PGR0_PLR1_SNLL0_TT4_4_VW2_WG8_8_4_WGM8
    SolutionIndex: 500
    SolutionNameMin: Cijk_Ailk_Bljk_SB_MT16x16x32_SE_EPS0_GRVW2_GSU4_LPB2_PGR0_PLR1_SNLL0_TT2_4_VW2_WG8_4_8_WGM1
    SolutionIndex: 501
    SolutionNameMin: Cijk_Ailk_Bljk_SB_MT32x32x32_SE_EPS1_GRVW2_GSU1_LPB2_PGR1_PLR1_SNLL1_TT4_4_VW2_WG8_8_4_WGM16
    SolutionIndex: 502
    SolutionNameMin: Cijk_Ailk_Bljk_SB_MT64x64x8_SE_EPS0_GRVW2_GSU1_LPB0_PGR0_PLR0_SNLL0_TT4_4_VW2_WG16_16_1_WGM16
    SolutionIndex: 503
    SolutionNameMin: Cijk_Ailk_Bljk_SB_MT16x16x32_SE_EPS1_GRVW2_GSU4_LPB2_PGR1_PLR1_SNLL0_TT2_4_VW2_WG8_4_4_WGM1
    SolutionIndex: 504
    SolutionNameMin: Cijk_Ailk_Bljk_SB_MT128x64x32_SE_EPS1_GRVW4_GSU1_LPB4_PGR1_PLR1_SNLL1_TT4_4_VW4_WG32_16_2_WGM16
    SolutionIndex: 505
    SolutionNameMin: Cijk_Ailk_Bljk_SB_MT16x16x32_SE_EPS0_GRVW2_GSU1_LPB2_PGR0_PLR1_SNLL0_TT2_2_VW2_WG8_8_4_WGM8
    SolutionIndex: 506
    SolutionNameMin: Cijk_Ailk_Bljk_SB_MT16x8x32_SE_EPS0_GRVW2_GSU1_LPB0_PGR0_PLR1_SNLL0_TT2_2_VW2_WG8_4_4_WGM1
    SolutionIndex: 507
    SolutionNameMin: Cijk_Ailk_Bljk_SB_MT16x16x16_SE_EPS0_GRVW2_GSU1_LPB2_PGR0_PLR1_SNLL0_TT2_2_VW2_WG8_8_2_WGM1
    SolutionIndex: 508
    SolutionNameMin: Cijk_Ailk_Bljk_SB_MT64x64x16_SE_EPS0_GRVW2_GSU1_LPB2_PGR0_PLR1_SNLL0_TT4_4_VW2_WG16_16_1_WGM16
    SolutionIndex: 509
    SolutionNameMin: Cijk_Ailk_Bljk_SB_MT16x32x16_SE_EPS0_GRVW2_GSU1_LPB0_PGR0_PLR1_SNLL0_TT2_4_VW2_WG8_8_4_WGM1
    SolutionIndex: 510
    SolutionNameMin: Cijk_Ailk_Bljk_SB_MT32x32x8_SE_EPS0_GRVW2_GSU1_LPB0_PGR0_PLR1_SNLL0_TT2_2_VW2_WG16_16_1_WGM1
    SolutionIndex: 511
    SolutionNameMin: Cijk_Ailk_Bljk_SB_MT32x64x16_SE_EPS1_GRVW2_GSU1_LPB2_PGR1_PLR1_SNLL1_TT4_4_VW2_WG8_16_2_WGM8
    SolutionIndex: 512
    SolutionNameMin: Cijk_Ailk_Bljk_SB_MT16x16x32_SE_EPS1_GRVW2_GSU4_LPB2_PGR1_PLR0_SNLL0_TT2_4_VW2_WG8_4_8_WGM1
    SolutionIndex: 513
    SolutionNameMin: Cijk_Ailk_Bljk_SB_MT32x64x16_SE_EPS0_GRVW2_GSU1_LPB0_PGR0_PLR1_SNLL0_TT2_4_VW2_WG16_16_1_WGM8
    SolutionIndex: 514
    SolutionNameMin: Cijk_Ailk_Bljk_SB_MT4x64x32_SE_EPS0_GRVW2_GSU1_LPB2_PGR0_PLR1_SNLL0_TT2_2_VW2_WG2_32_4_WGM1
    SolutionIndex: 515
    SolutionNameMin: Cijk_Ailk_Bljk_SB_MT32x32x16_SE_EPS0_GRVW2_GSU1_LPB0_PGR0_PLR0_SNLL0_TT2_2_VW2_WG16_16_1_WGM16
    SolutionIndex: 516
    SolutionNameMin: Cijk_Ailk_Bljk_SB_MT16x16x32_SE_EPS1_GRVW2_GSU4_LPB2_PGR1_PLR0_SNLL0_TT2_2_VW2_WG8_8_4_WGM8
    SolutionIndex: 517
    SolutionNameMin: Cijk_Ailk_Bljk_SB_MT128x64x32_SE_EPS1_GRVW4_GSU1_LPB4_PGR1_PLR1_SNLL1_TT4_4_VW4_WG32_16_2_WGM8
    SolutionIndex: 518
    SolutionNameMin: Cijk_Ailk_Bljk_SB_MT64x32x32_SE_EPS1_GRVW2_GSU1_LPB2_PGR1_PLR1_SNLL1_TT4_2_VW2_WG16_16_1_WGM8
    SolutionIndex: 519
    SolutionNameMin: Cijk_Ailk_Bljk_SB_MT32x64x16_SE_EPS0_GRVW2_GSU1_LPB0_PGR0_PLR0_SNLL0_TT2_4_VW2_WG16_16_1_WGM8
    SolutionIndex: 520
    SolutionNameMin: Cijk_Ailk_Bljk_SB_MT16x16x16_SE_EPS0_GRVW2_GSU1_LPB0_PGR0_PLR0_SNLL0_TT2_2_VW2_WG8_8_4_WGM8
    SolutionIndex: 521
    SolutionNameMin: Cijk_Ailk_Bljk_SB_MT64x64x16_SE_EPS0_GRVW4_GSU1_LPB4_PGR0_PLR0_SNLL0_TT4_4_VW4_WG16_16_1_WGM8
    SolutionIndex: 522
    SolutionNameMin: Cijk_Ailk_Bljk_SB_MT16x64x16_SE_EPS0_GRVW2_GSU1_LPB0_PGR0_PLR1_SNLL0_TT2_4_VW2_WG8_16_1_WGM1
    SolutionIndex: 523
    SolutionNameMin: Cijk_Ailk_Bljk_SB_MT16x8x32_SE_EPS0_GRVW2_GSU1_LPB2_PGR0_PLR1_SNLL0_TT2_2_VW2_WG8_4_4_WGM8
    SolutionIndex: 524
    SolutionNameMin: Cijk_Ailk_Bljk_SB_MT64x32x16_SE_EPS1_FL1_GRVW4_GSU1_LPB4_PGR1_PLR1_TT4_4_USFGRO0_WG16_8_2_WGM8
    SolutionIndex: 525
    SolutionNameMin: Cijk_Ailk_Bljk_SB_MT128x128x16_SE_EPS1_FL0_GRVW4_GSU1_LPB0_PGR1_PLR1_TT8_8_USFGRO0_WG16_16_1_WGM1
    SolutionIndex: 526
    SolutionNameMin: Cijk_Ailk_Bljk_SB_MT64x96x8_SE_EPS1_FL1_GRVW4_GSU1_LPB0_PGR1_PLR1_TT4_6_USFGRO0_WG16_16_1_WGM8
    SolutionIndex: 527
    SolutionNameMin: Cijk_Ailk_Bljk_SB_MT128x64x8_SE_EPS1_FL1_GRVW4_GSU1_LPB0_PGR1_PLR1_TT8_4_USFGRO0_WG16_16_1_WGM1
    SolutionIndex: 528
    SolutionNameMin: Cijk_Ailk_Bljk_SB_MT32x16x32_SE_EPS1_FL0_GRVW1_GSU1_LPB2_PGR1_PLR1_TT2_4_USFGRO1_WG16_4_4_WGM8
    SolutionIndex: 529
    SolutionNameMin: Cijk_Ailk_Bljk_SB_MT128x64x8_SE_EPS1_FL1_GRVW4_GSU1_LPB0_PGR1_PLR1_TT8_4_USFGRO0_WG16_16_1_WGM8
    SolutionIndex: 530
    SolutionNameMin: Cijk_Ailk_Bljk_SB_MT128x128x8_SE_EPS1_FL1_GRVW4_GSU1_LPB0_PGR1_PLR1_TT8_8_USFGRO0_WG16_16_1_WGM8
    SolutionIndex: 531
    SolutionNameMin: Cijk_Ailk_Bljk_SB_MT64x64x16_SE_EPS1_FL0_GRVW4_GSU1_LPB0_PGR1_PLR1_TT4_4_USFGRO0_WG16_16_1_WGM8
    SolutionIndex: 532
    SolutionNameMin: Cijk_Ailk_Bljk_SB_MT128x64x8_SE_EPS1_FL1_GRVW4_GSU1_LPB0_PGR1_PLR0_TT8_4_USFGRO0_WG16_16_1_WGM8
    SolutionIndex: 533
    SolutionNameMin: Cijk_Ailk_Bljk_SB_MT128x64x8_SE_EPS1_FL0_GRVW4_GSU1_LPB0_PGR1_PLR1_TT8_4_USFGRO0_WG16_16_1_WGM8
    SolutionIndex: 534
    SolutionNameMin: Cijk_Ailk_Bljk_SB_MT128x64x8_SE_EPS1_FL0_GRVW4_GSU1_LPB0_PGR1_PLR1_TT8_4_USFGRO0_WG16_16_1_WGM1
    SolutionIndex: 535
    SolutionNameMin: Cijk_Ailk_Bljk_SB_MT128x64x8_SE_EPS1_FL0_GRVW4_GSU1_LPB0_PGR1_PLR0_TT8_4_USFGRO0_WG16_16_1_WGM8
    SolutionIndex: 536
    SolutionNameMin: Cijk_Ailk_Bljk_SB_MT128x128x8_SE_EPS1_FL0_GRVW4_GSU1_LPB0_PGR1_PLR1_TT8_8_USFGRO0_WG16_16_1_WGM8
    SolutionIndex: 537
    SolutionNameMin: Cijk_Ailk_Bljk_SB_MT32x32x8_SE_EPS0_FL0_GRVW1_GSU1_LPB0_PGR0_PLR0_TT2_2_USFGRO1_WG16_16_1_WGM1
    SolutionIndex: 538
    SolutionNameMin: Cijk_Ailk_Bljk_SB_MT16x32x32_SE_EPS1_FL1_GRVW4_GSU1_LPB2_PGR1_PLR1_TT4_2_USFGRO0_WG4_16_4_WGM8
    SolutionIndex: 539
    SolutionNameMin: Cijk_Ailk_Bljk_SB_MT64x64x16_SE_EPS1_FL1_GRVW4_GSU1_LPB0_PGR1_PLR1_TT4_4_USFGRO0_WG16_16_1_WGM8
    SolutionIndex: 540
    SolutionNameMin: Cijk_Ailk_Bljk_SB_MT96x64x8_SE_EPS1_FL1_GRVW2_GSU1_LPB0_PGR1_PLR1_TT6_4_USFGRO0_WG16_16_1_WGM1
    SolutionIndex: 541
    SolutionNameMin: Cijk_Ailk_Bljk_SB_MT128x128x8_SE_EPS1_FL0_GRVW1_GSU1_LPB0_PGR1_PLR1_TT8_8_USFGRO1_WG16_16_1_WGM8
    SolutionIndex: 542
    SolutionNameMin: Cijk_Ailk_Bljk_SB_MT32x32x32_SE_EPS1_FL0_GRVW2_GSU1_LPB2_PGR1_PLR1_TT4_2_USFGRO0_WG8_16_2_WGM1
    SolutionIndex: 543
    SolutionNameMin: Cijk_Ailk_Bljk_SB_MT64x32x32_SE_EPS1_FL0_GRVW4_GSU1_LPB4_PGR1_PLR1_TT4_4_USFGRO0_WG16_8_2_WGM8
    SolutionIndex: 544
    SolutionNameMin: Cijk_Ailk_Bljk_SB_MT32x32x32_SE_EPS1_FL1_GRVW2_GSU1_LPB2_PGR1_PLR1_TT4_2_USFGRO0_WG8_16_2_WGM1
    SolutionIndex: 545
    SolutionNameMin: Cijk_Ailk_Bljk_SB_MT128x64x16_SE_EPS1_FL0_GRVW4_GSU1_LPB0_PGR1_PLR1_TT8_4_USFGRO0_WG16_16_1_WGM1
    SolutionIndex: 546
    SolutionNameMin: Cijk_Ailk_Bljk_SB_MT64x96x16_SE_EPS1_FL0_GRVW2_GSU1_LPB0_PGR1_PLR1_TT4_6_USFGRO0_WG16_16_1_WGM1
    SolutionIndex: 547
    SolutionNameMin: Cijk_Ailk_Bljk_SB_MT64x16x16_SE_EPS1_FL0_GRVW4_GSU1_LPB4_PGR1_PLR1_TT4_4_USFGRO0_WG16_4_4_WGM8
    SolutionIndex: 548
    SolutionNameMin: Cijk_Ailk_Bljk_SB_MT128x128x8_SE_EPS1_FL0_GRVW4_GSU1_LPB0_PGR1_PLR0_TT8_8_USFGRO0_WG16_16_1_WGM8
    SolutionIndex: 549
    SolutionNameMin: Cijk_Ailk_Bljk_SB_MT64x32x32_SE_EPS1_FL1_GRVW4_GSU1_LPB4_PGR1_PLR1_TT4_4_USFGRO0_WG16_8_2_WGM8
    SolutionIndex: 550
    SolutionNameMin: Cijk_Ailk_Bljk_SB_MT32x32x16_SE_EPS1_FL0_GRVW4_GSU1_LPB2_PGR1_PLR1_TT2_4_USFGRO0_WG16_8_2_WGM8
    SolutionIndex: 551
    SolutionNameMin: Cijk_Ailk_Bljk_SB_MT16x32x32_SE_EPS1_FL0_GRVW1_GSU1_LPB2_PGR1_PLR1_TT4_2_USFGRO1_WG4_16_4_WGM8
    SolutionIndex: 552
    SolutionNameMin: Cijk_Ailk_Bljk_SB_MT128x64x16_SE_EPS1_FL1_GRVW4_GSU1_LPB0_PGR1_PLR1_TT8_4_USFGRO0_WG16_16_1_WGM8
    SolutionIndex: 553
    SolutionNameMin: Cijk_Ailk_Bljk_SB_MT16x32x32_SE_EPS1_FL0_GRVW1_GSU1_LPB2_PGR1_PLR1_TT4_2_USFGRO1_WG4_16_4_WGM1
    SolutionIndex: 554
    SolutionNameMin: Cijk_Ailk_Bljk_SB_MT32x16x32_SE_EPS1_FL0_GRVW1_GSU1_LPB2_PGR1_PLR0_TT2_4_USFGRO1_WG16_4_4_WGM8
    SolutionIndex: 555
    SolutionNameMin: Cijk_Ailk_Bljk_SB_MT128x128x8_SE_EPS1_FL1_GRVW4_GSU1_LPB0_PGR1_PLR0_TT8_8_USFGRO0_WG16_16_1_WGM8
    SolutionIndex: 556
    SolutionNameMin: Cijk_Ailk_Bljk_SB_MT32x16x32_SE_EPS1_FL0_GRVW2_GSU1_LPB2_PGR1_PLR0_TT2_4_USFGRO0_WG16_4_4_WGM8
    SolutionIndex: 557
    SolutionNameMin: Cijk_Ailk_Bljk_SB_MT32x32x32_SE_EPS1_FL0_GRVW2_GSU1_LPB2_PGR1_PLR1_TT2_4_USFGRO0_WG16_8_2_WGM1
    SolutionIndex: 558
    SolutionNameMin: Cijk_Ailk_Bljk_SB_MT128x64x8_SE_EPS1_FL0_GRVW2_GSU1_LPB0_PGR1_PLR1_TT8_4_USFGRO0_WG16_16_1_WGM8
    SolutionIndex: 559
    SolutionNameMin: Cijk_Ailk_Bljk_SB_MT128x128x8_SE_EPS1_FL0_GRVW4_GSU1_LPB0_PGR1_PLR0_TT8_8_USFGRO0_WG16_16_1_WGM1
    SolutionIndex: 560
    SolutionNameMin: Cijk_Ailk_Bljk_SB_MT128x64x8_SE_EPS1_FL1_GRVW2_GSU1_LPB0_PGR1_PLR1_TT8_4_USFGRO0_WG16_16_1_WGM8
    SolutionIndex: 561
    SolutionNameMin: Cijk_Ailk_Bljk_SB_MT64x32x32_SE_EPS1_FL1_GRVW2_GSU1_LPB2_PGR1_PLR1_TT4_4_USFGRO0_WG16_8_2_WGM8
    SolutionIndex: 562
    SolutionNameMin: Cijk_Ailk_Bljk_SB_MT128x128x8_SE_EPS1_FL0_GRVW2_GSU1_LPB0_PGR1_PLR1_TT8_8_USFGRO0_WG16_16_1_WGM8
    SolutionIndex: 563
    SolutionNameMin: Cijk_Ailk_Bljk_SB_MT128x64x8_SE_EPS1_FL1_GRVW4_GSU1_LPB0_PGR1_PLR0_TT8_4_USFGRO0_WG16_16_1_WGM1
    SolutionIndex: 564
    SolutionNameMin: Cijk_Ailk_Bljk_SB_MT96x64x8_SE_EPS1_FL1_GRVW2_GSU1_LPB0_PGR1_PLR1_TT6_4_USFGRO0_WG16_16_1_WGM8
    SolutionIndex: 565
    SolutionNameMin: Cijk_Ailk_Bljk_SB_MT128x64x8_SE_EPS1_FL1_GRVW2_GSU1_LPB0_PGR1_PLR0_TT8_4_USFGRO0_WG16_16_1_WGM8
    SolutionIndex: 566
    SolutionNameMin: Cijk_Ailk_Bljk_SB_MT32x8x32_SE_EPS1_FL0_GRVW2_GSU1_LPB2_PGR1_PLR1_TT2_2_USFGRO0_WG16_4_4_WGM8
    SolutionIndex: 567
    SolutionNameMin: Cijk_Ailk_Bljk_SB_MT64x32x16_SE_EPS1_FL0_GRVW4_GSU1_LPB4_PGR1_PLR1_TT4_4_USFGRO0_WG16_8_2_WGM8
    SolutionIndex: 568
    SolutionNameMin: Cijk_Ailk_Bljk_SB_MT128x64x8_SE_EPS1_FL0_GRVW2_GSU1_LPB0_PGR1_PLR0_TT8_4_USFGRO0_WG16_16_1_WGM8
    SolutionIndex: 569
    SolutionNameMin: Cijk_Ailk_Bljk_SB_MT96x64x8_SE_EPS1_FL1_GRVW2_GSU1_LPB0_PGR1_PLR0_TT6_4_USFGRO0_WG16_16_1_WGM8
    SolutionIndex: 570
    SolutionNameMin: Cijk_Ailk_Bljk_SB_MT128x128x8_SE_EPS1_FL0_GRVW2_GSU1_LPB0_PGR1_PLR0_TT8_8_USFGRO0_WG16_16_1_WGM8
    SolutionIndex: 571
    SolutionNameMin: Cijk_Ailk_Bljk_SB_MT128x128x8_SE_EPS1_FL0_GRVW4_GSU1_LPB0_PGR1_PLR1_TT8_8_USFGRO0_WG16_16_1_WGM1
    SolutionIndex: 572
    SolutionNameMin: Cijk_Ailk_Bljk_SB_MT8x32x32_SE_EPS1_FL0_GRVW4_GSU1_LPB2_PGR1_PLR1_TT2_2_USFGRO1_WG4_16_4_WGM1
    SolutionIndex: 573
    SolutionNameMin: Cijk_Ailk_Bljk_SB_MT16x64x32_SE_EPS1_FL0_GRVW4_GSU1_LPB2_PGR1_PLR0_TT4_4_USFGRO0_WG4_16_4_WGM8
    SolutionIndex: 574
    SolutionNameMin: Cijk_Ailk_Bljk_SB_MT16x32x32_SE_EPS1_FL1_GRVW2_GSU1_LPB2_PGR1_PLR1_TT4_2_USFGRO0_WG4_16_4_WGM8
    SolutionIndex: 575
    SolutionNameMin: Cijk_Ailk_Bljk_SB_MT128x64x8_SE_EPS1_FL0_GRVW1_GSU1_LPB0_PGR1_PLR1_TT8_4_USFGRO1_WG16_16_1_WGM8
    SolutionIndex: 576
    SolutionNameMin: Cijk_Ailk_Bljk_SB_MT96x64x8_SE_EPS1_FL1_GRVW2_GSU1_LPB0_PGR1_PLR0_TT6_4_USFGRO0_WG16_16_1_WGM1
    SolutionIndex: 577
    SolutionNameMin: Cijk_Ailk_Bljk_SB_MT128x64x8_SE_DTL0_EPS1_FL1_GRVW4_LPB0_PGR1_PLR1_TT8_4_USFGRO0_VW4_WG16_16_1_WGM1
    SolutionIndex: 578
    SolutionNameMin: Cijk_Ailk_Bljk_SB_MT64x64x32_SE_DTL0_EPS0_FL0_GRVW4_LPB4_PGR0_PLR1_TT4_4_USFGRO0_VW4_WG16_16_1_WGM8
    SolutionIndex: 579
    SolutionNameMin: Cijk_Ailk_Bljk_SB_MT96x64x16_SE_DTL0_EPS1_FL0_GRVW2_LPB0_PGR1_PLR1_TT6_4_USFGRO0_VW2_WG16_16_1_WGM8
    SolutionIndex: 580
    SolutionNameMin: Cijk_Ailk_Bljk_SB_MT64x64x16_SE_DTL0_EPS1_FL1_GRVW4_LPB0_PGR1_PLR1_TT4_4_USFGRO0_VW4_WG16_16_1_WGM1
    SolutionIndex: 581
    SolutionNameMin: Cijk_Ailk_Bljk_SB_MT128x64x16_SE_DTL0_EPS1_FL0_GRVW4_LPB0_PGR1_PLR1_TT8_4_USFGRO0_VW4_WG16_16_1_WGM1
    SolutionIndex: 582
    SolutionNameMin: Cijk_Ailk_Bljk_SB_MT64x32x16_SE_DTL0_EPS1_FL0_GRVW4_LPB4_PGR1_PLR1_TT4_4_USFGRO0_VW4_WG16_8_2_WGM1
    SolutionIndex: 583
    SolutionNameMin: Cijk_Ailk_Bljk_SB_MT64x64x16_SE_DTL0_EPS1_FL0_GRVW4_LPB0_PGR1_PLR1_TT4_4_USFGRO0_VW4_WG16_16_1_WGM8
    SolutionIndex: 584
    SolutionNameMin: Cijk_Ailk_Bljk_SB_MT128x64x8_SE_DTL0_EPS1_FL0_GRVW2_LPB0_PGR1_PLR1_TT8_4_USFGRO0_VW2_WG16_16_1_WGM8
    SolutionIndex: 585
    SolutionNameMin: Cijk_Ailk_Bljk_SB_MT64x64x16_SE_DTL0_EPS0_FL0_GRVW1_LPB4_PGR0_PLR1_TT4_4_USFGRO1_VW4_WG16_16_1_WGM1
    SolutionIndex: 586
    SolutionNameMin: Cijk_Ailk_Bljk_SB_MT64x64x16_SE_DTL0_EPS0_FL0_GRVW1_LPB2_PGR0_PLR1_TT4_4_USFGRO1_VW2_WG16_16_1_WGM1
    SolutionIndex: 587
    SolutionNameMin: Cijk_Ailk_Bljk_SB_MT96x64x8_SE_EPS1_FL1_GRVW2_GSU1_LPB0_PGR1_PLR1_TT6_4_USFGRO0_VW2_WG16_16_1_WGM8
    SolutionIndex: 588
    SolutionNameMin: Cijk_Ailk_Bljk_SB_MT128x64x8_SE_EPS1_FL1_GRVW4_GSU1_LPB0_PGR1_PLR1_TT8_4_USFGRO0_VW4_WG16_16_1_WGM1
    SolutionIndex: 589
    SolutionNameMin: Cijk_Ailk_Bljk_SB_MT128x64x8_SE_EPS1_FL1_GRVW2_GSU1_LPB0_PGR1_PLR1_TT8_4_USFGRO0_VW2_WG16_16_1_WGM1
    SolutionIndex: 590
    SolutionNameMin: Cijk_Ailk_Bljk_SB_MT96x64x8_SE_EPS1_FL1_GRVW2_GSU1_LPB0_PGR1_PLR1_TT6_4_USFGRO0_VW2_WG16_16_1_WGM1
    SolutionIndex: 591
    SolutionNameMin: Cijk_Ailk_Bljk_SB_MT64x16x32_SE_EPS1_FL0_GRVW4_GSU1_LPB4_PGR1_PLR1_TT4_4_USFGRO0_VW4_WG16_4_4_WGM1
    SolutionIndex: 592
    SolutionNameMin: Cijk_Ailk_Bljk_SB_MT128x64x8_SE_EPS1_FL1_GRVW4_GSU1_LPB0_PGR1_PLR1_TT8_4_USFGRO0_VW4_WG16_16_1_WGM8
    SolutionIndex: 593
    SolutionNameMin: Cijk_Ailk_Bljk_SB_MT64x64x16_SE_EPS1_FL1_GRVW4_GSU1_LPB0_PGR1_PLR1_TT4_4_USFGRO0_VW4_WG16_16_1_WGM1
    SolutionIndex: 594
    SolutionNameMin: Cijk_Ailk_Bljk_SB_MT32x16x32_SE_EPS1_FL1_GRVW2_GSU1_LPB2_PGR1_PLR1_TT2_4_USFGRO0_VW2_WG16_4_4_WGM1
    SolutionIndex: 595
    SolutionNameMin: Cijk_Ailk_Bljk_SB_MT64x64x8_SE_EPS1_FL0_GRVW1_GSU1_LPB4_PGR1_PLR1_TT4_4_USFGRO1_VW4_WG16_16_1_WGM8
    SolutionIndex: 596
    SolutionNameMin: Cijk_Ailk_Bljk_SB_MT64x64x16_SE_EPS1_FL1_GRVW4_GSU1_LPB0_PGR1_PLR1_TT4_4_USFGRO0_VW4_WG16_16_1_WGM8
    SolutionIndex: 597
    SolutionNameMin: Cijk_Ailk_Bljk_SB_MT8x32x32_SE_EPS1_FL0_GRVW4_GSU1_LPB2_PGR1_PLR1_TT2_2_USFGRO1_VW2_WG4_16_4_WGM8
    SolutionIndex: 598
    SolutionNameMin: Cijk_Ailk_Bljk_SB_MT8x32x32_SE_EPS1_FL0_GRVW4_GSU1_LPB2_PGR1_PLR1_TT2_2_USFGRO1_VW2_WG4_16_4_WGM1
    SolutionIndex: 599
    SolutionNameMin: Cijk_Ailk_Bljk_SB_MT128x64x8_SE_EPS1_FL0_GRVW4_GSU1_LPB0_PGR1_PLR0_TT8_4_USFGRO0_VW4_WG16_16_1_WGM1
    SolutionIndex: 600
    SolutionNameMin: Cijk_Ailk_Bljk_SB_MT64x16x16_SE_EPS1_FL0_GRVW1_GSU1_LPB2_PGR1_PLR1_TT4_4_USFGRO1_VW2_WG16_4_4_WGM8
    SolutionIndex: 601
    SolutionNameMin: Cijk_Ailk_Bljk_SB_MT64x32x8_SE_EPS1_FL1_GRVW4_GSU1_LPB4_PGR1_PLR0_TT4_4_USFGRO0_VW4_WG16_8_1_WGM1
    SolutionIndex: 602
    SolutionNameMin: Cijk_Ailk_Bljk_SB_MT128x128x8_SE_EPS1_FL0_GRVW2_GSU1_LPB0_PGR1_PLR1_TT8_8_USFGRO0_VW2_WG16_16_1_WGM8
    SolutionIndex: 603
    SolutionNameMin: Cijk_Ailk_Bljk_SB_MT32x8x32_SE_EPS1_FL0_GRVW2_GSU1_LPB2_PGR1_PLR1_TT2_2_USFGRO0_VW2_WG16_4_4_WGM1
    SolutionIndex: 604
    SolutionNameMin: Cijk_Ailk_Bljk_SB_MT128x64x8_SE_EPS1_FL0_GRVW4_GSU1_LPB0_PGR1_PLR1_TT8_4_USFGRO0_VW4_WG16_16_1_WGM8
    SolutionIndex: 605
    SolutionNameMin: Cijk_Ailk_Bljk_SB_MT128x64x8_SE_EPS1_FL0_GRVW4_GSU1_LPB0_PGR1_PLR1_TT8_4_USFGRO0_VW4_WG16_16_1_WGM1
    SolutionIndex: 606
    SolutionNameMin: Cijk_Ailk_Bljk_SB_MT64x64x16_SE_EPS0_FL0_GRVW1_GSU1_LPB4_PGR0_PLR1_TT4_4_USFGRO1_VW4_WG16_16_1_WGM8
    SolutionIndex: 607
    SolutionNameMin: Cijk_Ailk_Bljk_SB_MT16x32x32_SE_EPS1_FL0_GRVW1_GSU1_LPB2_PGR1_PLR1_TT4_2_USFGRO1_VW2_WG4_16_4_WGM1
    SolutionIndex: 608
    SolutionNameMin: Cijk_Ailk_Bljk_SB_MT32x16x32_SE_EPS1_FL0_GRVW2_GSU1_LPB2_PGR1_PLR1_TT2_4_USFGRO0_VW2_WG16_4_4_WGM1
    SolutionIndex: 609
    SolutionNameMin: Cijk_Ailk_Bljk_SB_MT64x128x8_SE_EPS1_FL0_GRVW4_GSU1_LPB0_PGR1_PLR1_TT4_8_USFGRO0_VW2_WG16_16_1_WGM1
    SolutionIndex: 610
    SolutionNameMin: Cijk_Ailk_Bljk_SB_MT128x64x8_SE_EPS1_FL0_GRVW2_GSU1_LPB0_PGR1_PLR1_TT8_4_USFGRO0_VW2_WG16_16_1_WGM1
    SolutionIndex: 611
    SolutionNameMin: Cijk_Ailk_Bljk_SB_MT64x32x16_SE_EPS1_FL1_GRVW4_GSU1_LPB4_PGR1_PLR1_TT4_4_USFGRO0_VW4_WG16_8_2_WGM1
    SolutionIndex: 612
    SolutionNameMin: Cijk_Ailk_Bljk_SB_MT128x128x8_SE_EPS1_FL1_GRVW4_GSU1_LPB0_PGR1_PLR1_TT8_8_USFGRO0_VW4_WG16_16_1_WGM8
    SolutionIndex: 613
    SolutionNameMin: Cijk_Ailk_Bljk_SB_MT64x96x8_SE_EPS1_FL1_GRVW2_GSU1_LPB0_PGR1_PLR1_TT4_6_USFGRO0_VW2_WG16_16_1_WGM8
    SolutionIndex: 614
    SolutionNameMin: Cijk_Ailk_Bljk_SB_MT64x16x32_SE_EPS1_FL1_GRVW4_GSU1_LPB4_PGR1_PLR1_TT4_4_USFGRO0_VW4_WG16_4_4_WGM1
    SolutionIndex: 615
    SolutionNameMin: Cijk_Ailk_Bljk_SB_MT64x32x8_SE_EPS0_FL1_GRVW4_GSU1_LPB4_PGR0_PLR1_TT4_4_USFGRO0_VW4_WG16_8_1_WGM1
    SolutionIndex: 616
    SolutionNameMin: Cijk_Ailk_Bljk_SB_MT64x64x16_SE_EPS1_FL0_GRVW4_GSU1_LPB0_PGR1_PLR1_TT4_4_USFGRO0_VW4_WG16_16_1_WGM8
    SolutionIndex: 617
    SolutionNameMin: Cijk_Ailk_Bljk_SB_MT64x16x16_SE_EPS1_FL0_GRVW4_GSU1_LPB4_PGR1_PLR1_TT4_4_USFGRO0_VW4_WG16_4_4_WGM8
    SolutionIndex: 618
    SolutionNameMin: Cijk_Ailk_Bljk_SB_MT64x16x8_SE_EPS1_FL0_GRVW2_GSU1_LPB2_PGR1_PLR1_TT4_2_USFGRO0_VW2_WG16_8_1_WGM1
    SolutionIndex: 619
    SolutionNameMin: Cijk_Ailk_Bljk_SB_MT64x16x32_SE_EPS1_FL1_GRVW4_GSU1_LPB4_PGR1_PLR1_TT4_4_USFGRO0_VW4_WG16_4_4_WGM8
    SolutionIndex: 620
    SolutionNameMin: Cijk_Ailk_Bljk_SB_MT64x64x16_SE_EPS1_FL0_GRVW4_GSU1_LPB0_PGR1_PLR1_TT4_4_USFGRO0_VW4_WG16_16_1_WGM1
    SolutionIndex: 621
    SolutionNameMin: Cijk_Ailk_Bljk_SB_MT64x64x16_SE_EPS1_FL0_GRVW4_GSU1_LPB4_PGR1_PLR1_TT4_4_USFGRO0_VW4_WG16_16_1_WGM8
    SolutionIndex: 622
    SolutionNameMin: Cijk_Ailk_Bljk_SB_MT8x32x32_SE_EPS1_FL0_GRVW1_GSU1_LPB2_PGR1_PLR1_TT2_2_USFGRO1_VW2_WG4_16_4_WGM1
    SolutionIndex: 623
    SolutionNameMin: Cijk_Ailk_Bljk_SB_MT128x64x8_SE_EPS1_FL0_GRVW4_GSU1_LPB4_PGR1_PLR1_TT8_4_USFGRO0_VW4_WG16_16_1_WGM1
    SolutionIndex: 624
    SolutionNameMin: Cijk_Ailk_Bljk_SB_MT96x64x16_SE_EPS1_FL0_GRVW2_GSU1_LPB0_PGR1_PLR1_TT6_4_USFGRO0_VW2_WG16_16_1_WGM1
    SolutionIndex: 625
    SolutionNameMin: Cijk_Ailk_Bljk_SB_MT32x8x32_SE_EPS1_FL0_GRVW2_GSU1_LPB2_PGR1_PLR1_TT2_2_USFGRO0_VW2_WG16_4_4_WGM8
    SolutionIndex: 626
    SolutionNameMin: Cijk_Ailk_Bljk_SB_MT64x32x8_SE_EPS1_FL0_GRVW4_GSU1_LPB4_PGR1_PLR0_TT4_4_USFGRO0_VW4_WG16_8_1_WGM8
    SolutionIndex: 627
    SolutionNameMin: Cijk_Ailk_Bljk_SB_MT32x8x32_SE_EPS1_FL1_GRVW2_GSU1_LPB2_PGR1_PLR1_TT2_2_USFGRO0_VW2_WG16_4_4_WGM1
    SolutionIndex: 628
    SolutionNameMin: Cijk_Ailk_Bljk_SB_MT16x32x32_SE_EPS1_FL1_GRVW4_GSU1_LPB2_PGR1_PLR1_TT4_2_USFGRO0_VW2_WG4_16_4_WGM1
    SolutionIndex: 629
    SolutionNameMin: Cijk_Ailk_Bljk_SB_MT64x32x16_SE_EPS1_FL0_GRVW4_GSU1_LPB4_PGR1_PLR1_TT4_4_USFGRO0_VW4_WG16_8_2_WGM1
    SolutionIndex: 630
    SolutionNameMin: Cijk_Ailk_Bljk_SB_MT128x64x8_SE_EPS1_FL0_GRVW4_GSU1_LPB4_PGR1_PLR0_TT8_4_USFGRO0_VW4_WG16_16_1_WGM1
    SolutionIndex: 631
    SolutionNameMin: Cijk_Ailk_Bljk_SB_MT128x128x8_SE_EPS1_FL0_GRVW1_GSU1_LPB0_PGR1_PLR1_TT8_8_USFGRO1_VW4_WG16_16_1_WGM8
    SolutionIndex: 632
    SolutionNameMin: Cijk_Ailk_Bljk_SB_MT16x64x16_SE_EPS1_FL0_GRVW2_GSU8_LPB2_PGR1_PLR1_TT4_4_USFGRO1_VW2_WG4_16_4_WGM1
    SolutionIndex: 633
    SolutionNameMin: Cijk_Ailk_Bljk_SB_MT64x64x8_SE_EPS1_FL0_GRVW1_GSU1_LPB4_PGR1_PLR1_TT4_4_USFGRO1_VW4_WG16_16_1_WGM1
    SolutionIndex: 634
    SolutionNameMin: Cijk_Ailk_Bljk_SB_MT128x128x8_SE_EPS1_FL1_GRVW2_GSU1_LPB0_PGR1_PLR0_TT8_8_USFGRO0_VW2_WG16_16_1_WGM1
    SolutionIndex: 635
    SolutionNameMin: Cijk_Ailk_Bljk_SB_MT128x64x8_SE_EPS1_FL0_GRVW4_NLCA1_PGR1_PLR1_TT8_4_USFGRO0_VW4_WGM1
    SolutionIndex: 636
    SolutionNameMin: Cijk_Ailk_Bljk_SB_MT128x64x8_SE_EPS1_FL1_GRVW4_NLCA1_PGR1_PLR1_TT8_4_USFGRO0_VW4_WGM8
    SolutionIndex: 637
    SolutionNameMin: Cijk_Ailk_Bljk_SB_MT128x64x8_SE_EPS1_FL0_GRVW4_NLCA1_PGR1_PLR0_TT8_4_USFGRO0_VW4_WGM8
    SolutionIndex: 638
    SolutionNameMin: Cijk_Ailk_Bljk_SB_MT128x64x16_SE_EPS1_FL0_GRVW4_NLCA1_PGR1_PLR1_TT8_4_USFGRO0_VW4_WGM1
    SolutionIndex: 639
    SolutionNameMin: Cijk_Ailk_Bljk_SB_MT128x64x8_SE_EPS1_FL1_GRVW4_NLCA1_PGR1_PLR0_TT8_4_USFGRO0_VW4_WGM8
    SolutionIndex: 640
    SolutionNameMin: Cijk_Ailk_Bljk_SB_MT32x16x32_SE_EPS1_FL1_GRVW2_NLCA1_PGR1_PLR1_TT2_4_USFGRO0_VW2_WGM1
    SolutionIndex: 641
    SolutionNameMin: Cijk_Ailk_Bljk_SB_MT32x16x32_SE_EPS1_FL1_GRVW2_NLCA1_PGR1_PLR1_TT2_4_USFGRO0_VW2_WGM8
    SolutionIndex: 642
    SolutionNameMin: Cijk_Ailk_Bljk_SB_MT64x16x32_SE_EPS1_FL1_GRVW4_NLCA1_PGR1_PLR1_TT4_4_USFGRO0_VW4_WGM8
    SolutionIndex: 643
    SolutionNameMin: Cijk_Ailk_Bljk_SB_MT128x64x16_SE_EPS1_FL0_GRVW4_GSU1_LPB0_PGR1_PLR1_TT8_4_USFGRO0_VW4_WG16_16_1_WGM1
    SolutionIndex: 644
    SolutionNameMin: Cijk_Ailk_Bljk_SB_MT128x64x16_SE_EPS1_FL1_GRVW4_GSU1_LPB0_PGR1_PLR1_TT8_4_USFGRO0_VW4_WG16_16_1_WGM8
    SolutionIndex: 645
    SolutionNameMin: Cijk_Ailk_Bljk_SB_MT16x32x32_SE_EPS1_FL1_GRVW4_GSU1_LPB2_PGR1_PLR1_TT4_2_USFGRO0_VW2_WG4_16_4_WGM8
    SolutionIndex: 646
    SolutionNameMin: Cijk_Ailk_Bljk_SB_MT64x64x16_SE_DTL0_EPS1_FL1_GRVW4_LPB0_PGR1_PLR1_TT4_4_USFGRO0_VW4_WG16_16_1_WGM8
    SolutionIndex: 647
    SolutionNameMin: Cijk_Ailk_Bljk_SB_MT64x64x16_SE_DTL0_EPS1_FL0_GRVW4_LPB0_PGR1_PLR1_TT4_4_USFGRO0_VW4_WG16_16_1_WGM8
    SolutionIndex: 648
    SolutionNameMin: Cijk_Ailk_Bljk_SB_MT64x16x8_SE_DTL0_EPS0_FL0_GRVW2_LPB0_PGR0_PLR1_TT4_2_USFGRO0_VW2_WG16_8_1_WGM1
    SolutionIndex: 649
    SolutionNameMin: Cijk_Ailk_Bljk_SB_MT64x16x8_SE_DTL0_EPS0_FL0_GRVW1_LPB2_PGR0_PLR1_TT4_2_USFGRO1_VW2_WG16_8_1_WGM1
    SolutionIndex: 650
    SolutionNameMin: Cijk_Ailk_Bljk_SB_MT64x16x8_SE_DTL0_EPS0_FL0_GRVW1_LPB0_PGR0_PLR1_TT4_2_USFGRO1_VW2_WG16_8_1_WGM1
    SolutionIndex: 651
    SolutionNameMin: Cijk_Ailk_Bljk_SB_MT32x32x8_SE_DTL0_EPS0_FL0_GRVW1_LPB0_PGR0_PLR1_TT2_4_USFGRO1_VW2_WG16_8_1_WGM1
    SolutionIndex: 652
    SolutionNameMin: Cijk_Ailk_Bljk_SB_MT64x32x16_SE_DTL0_EPS0_FL0_GRVW1_LPB2_PGR0_PLR1_TT4_2_USFGRO1_VW2_WG16_16_1_WGM1
    SolutionIndex: 653
    SolutionNameMin: Cijk_Ailk_Bljk_SB_MT64x32x8_SE_DTL0_EPS1_FL0_GRVW1_LPB2_PGR1_PLR1_TT4_2_USFGRO1_VW2_WG16_16_1_WGM1
    SolutionIndex: 654
    SolutionNameMin: Cijk_Ailk_Bljk_SB_MT32x32x16_SE_DTL0_EPS0_FL0_GRVW1_LPB2_PGR0_PLR1_TT4_2_USFGRO1_VW2_WG8_16_1_WGM1
    SolutionIndex: 655
    SolutionNameMin: Cijk_Ailk_Bljk_SB_MT128x64x16_SE_DTL0_EPS1_FL1_GRVW4_LPB0_PGR1_PLR1_TT8_4_USFGRO0_VW4_WG16_16_1_WGM8
    SolutionIndex: 656
    SolutionNameMin: Cijk_Ailk_Bljk_SB_MT128x128x16_SE_DTL0_EPS1_FL0_GRVW4_LPB0_PGR1_PLR0_TT8_8_USFGRO0_VW4_WG16_16_1_WGM1
    SolutionIndex: 657
    SolutionNameMin: Cijk_Ailk_Bljk_SB_MT128x128x16_SE_DTL0_EPS1_FL0_GRVW4_LPB0_PGR1_PLR1_TT8_8_USFGRO0_VW4_WG16_16_1_WGM8
    SolutionIndex: 658
    SolutionNameMin: Cijk_Ailk_Bljk_SB_MT128x128x16_SE_DTL0_EPS1_FL1_GRVW4_LPB0_PGR1_PLR0_TT8_8_USFGRO0_VW4_WG16_16_1_WGM8
    SolutionIndex: 659
    SolutionNameMin: Cijk_Ailk_Bljk_SB_MT128x64x16_SE_DTL0_EPS1_FL0_GRVW4_LPB0_PGR1_PLR1_TT8_4_USFGRO0_VW4_WG16_16_1_WGM8
    SolutionIndex: 660
    SolutionNameMin: Cijk_Ailk_Bljk_SB_MT128x64x16_SE_DTL0_EPS1_FL0_GRVW4_LPB0_PGR1_PLR1_TT8_4_USFGRO0_VW4_WG16_16_1_WGM1
    SolutionIndex: 661
    SolutionNameMin: Cijk_Ailk_Bljk_SB_MT128x64x8_SE_DTL0_EPS1_FL0_GRVW2_LPB0_PGR1_PLR0_TT8_4_USFGRO0_VW2_WG16_16_1_WGM1
    SolutionIndex: 662
    SolutionNameMin: Cijk_Ailk_Bljk_SB_MT128x128x16_SE_DTL0_EPS1_FL1_GRVW4_LPB0_PGR1_PLR1_TT8_8_USFGRO0_VW4_WG16_16_1_WGM8
    SolutionIndex: 663
    SolutionNameMin: Cijk_Ailk_Bljk_SB_MT128x64x8_SE_DTL0_EPS1_FL1_GRVW4_LPB0_PGR1_PLR1_TT8_4_USFGRO0_VW4_WG16_16_1_WGM8
    SolutionIndex: 664
    SolutionNameMin: Cijk_Ailk_Bljk_SB_MT64x64x16_SE_DTL0_EPS1_FL1_GRVW4_LPB0_PGR1_PLR1_TT4_4_USFGRO0_VW4_WG16_16_1_WGM1
    SolutionIndex: 665
    SolutionNameMin: Cijk_Ailk_Bljk_SB_MT32x32x8_SE_DTL0_EPS0_FL0_GRVW1_LPB0_PGR0_PLR0_TT2_2_USFGRO1_VW2_WG16_16_1_WGM1
    SolutionIndex: 666
    SolutionNameMin: Cijk_Ailk_Bljk_SB_MT64x64x16_SE_EPS1_FL1_GRVW4_LPB0_PGR1_PLR1_TT4_4_USFGRO0_VW4_WGM8
    SolutionIndex: 667
    SolutionNameMin: Cijk_Ailk_Bljk_SB_MT64x64x16_SE_EPS1_FL0_GRVW4_LPB0_PGR1_PLR1_TT4_4_USFGRO0_VW4_WGM8
    SolutionIndex: 668
    SolutionNameMin: Cijk_Ailk_Bljk_SB_MT64x64x16_SE_EPS1_FL0_GRVW4_LPB0_PGR1_PLR1_TT4_4_USFGRO0_VW4_WGM1
    SolutionIndex: 669
    SolutionNameMin: Cijk_Ailk_Bljk_SB_MT64x64x32_SE_EPS1_FL0_GRVW4_LPB0_PGR1_PLR1_TT4_4_USFGRO0_VW4_WGM8
    SolutionIndex: 670
    SolutionNameMin: Cijk_Ailk_Bljk_SB_MT64x64x8_SE_EPS1_FL0_GRVW4_LPB0_PGR1_PLR1_TT4_4_USFGRO0_VW2_WGM8
    SolutionIndex: 671
    SolutionNameMin: Cijk_Ailk_Bljk_SB_MT64x64x32_SE_EPS1_FL1_GRVW4_LPB0_PGR1_PLR1_TT4_4_USFGRO0_VW4_WGM8
    SolutionIndex: 672
    SolutionNameMin: Cijk_Ailk_Bljk_SB_MT64x64x8_SE_EPS1_FL0_GRVW2_LPB0_PGR1_PLR1_TT4_4_USFGRO0_VW2_WGM8
    SolutionIndex: 673
    SolutionNameMin: Cijk_Ailk_Bljk_SB_MT128x64x32_SE_EPS1_FL0_GRVW4_LPB0_PGR1_PLR1_TT8_4_USFGRO0_VW4_WGM8
    SolutionIndex: 674
    SolutionNameMin: Cijk_Ailk_Bljk_SB_MT128x64x16_SE_EPS1_FL1_GRVW4_LPB0_PGR1_PLR1_TT8_4_USFGRO0_VW4_WGM8
    SolutionIndex: 675
    SolutionNameMin: Cijk_Ailk_Bljk_SB_MT64x64x8_SE_EPS1_FL1_GRVW2_LPB0_PGR1_PLR1_TT4_4_USFGRO0_VW2_WGM8
    SolutionIndex: 676
    SolutionNameMin: Cijk_Ailk_Bljk_SB_MT64x96x16_SE_EPS1_FL1_GRVW2_LPB0_PGR1_PLR1_TT4_6_USFGRO0_VW2_WGM8
    SolutionIndex: 677
    SolutionNameMin: Cijk_Ailk_Bljk_SB_MT96x64x16_SE_EPS1_FL0_GRVW2_LPB0_PGR1_PLR1_TT6_4_USFGRO0_VW2_WGM1
    SolutionIndex: 678
    SolutionNameMin: Cijk_Ailk_Bljk_SB_MT96x64x8_SE_EPS1_FL1_GRVW2_LPB0_PGR1_PLR1_TT6_4_USFGRO0_VW2_WGM8
    SolutionIndex: 679
    SolutionNameMin: Cijk_Ailk_Bljk_SB_MT64x96x8_SE_EPS1_FL1_GRVW4_LPB0_PGR1_PLR1_TT4_6_USFGRO0_VW2_WGM8
    SolutionIndex: 680
    SolutionNameMin: Cijk_Ailk_Bljk_SB_MT64x64x16_SE_EPS1_FL0_GRVW4_LPB0_PGR1_PLR0_TT4_4_USFGRO0_VW4_WGM8
    SolutionIndex: 681
    SolutionNameMin: Cijk_Ailk_Bljk_SB_MT128x64x16_SE_EPS1_FL0_GRVW4_LPB0_PGR1_PLR1_TT8_4_USFGRO0_VW4_WGM8
    SolutionIndex: 682
    SolutionNameMin: Cijk_Ailk_Bljk_SB_MT128x64x16_SE_EPS1_FL1_GRVW4_LPB0_PGR1_PLR1_TT8_4_USFGRO0_VW4_WGM1
    SolutionIndex: 683
    SolutionNameMin: Cijk_Ailk_Bljk_SB_MT128x64x16_SE_EPS1_FL0_GRVW4_LPB0_PGR1_PLR1_TT8_4_USFGRO0_VW4_WGM1
    SolutionIndex: 684
    SolutionNameMin: Cijk_Ailk_Bljk_SB_MT128x64x16_SE_EPS1_FL1_GRVW4_LPB0_PGR1_PLR0_TT8_4_USFGRO0_VW4_WGM8
    SolutionIndex: 685
    SolutionNameMin: Cijk_Ailk_Bljk_SB_MT128x64x16_SE_EPS1_FL1_GRVW4_LPB0_PGR1_PLR0_TT8_4_USFGRO0_VW4_WGM1
    SolutionIndex: 686
    SolutionNameMin: Cijk_Ailk_Bljk_SB_MT64x128x8_SE_EPS1_FL1_GRVW4_LPB0_PGR1_PLR1_TT4_8_USFGRO0_VW2_WGM8
    SolutionIndex: 687
    SolutionNameMin: Cijk_Ailk_Bljk_SB_MT64x128x8_SE_EPS1_FL0_GRVW4_LPB0_PGR1_PLR1_TT4_8_USFGRO0_VW2_WGM8
    SolutionIndex: 688
    SolutionNameMin: Cijk_Ailk_Bljk_SB_MT64x96x16_SE_EPS0_FL0_GRVW2_LPB0_PGR0_PLR1_TT4_6_USFGRO0_VW2_WGM8
    SolutionIndex: 689
    SolutionNameMin: Cijk_Ailk_Bljk_SB_MT64x96x16_SE_EPS0_FL1_GRVW2_LPB0_PGR0_PLR1_TT4_6_USFGRO0_VW2_WGM8
    SolutionIndex: 690
    SolutionNameMin: Cijk_Ailk_Bljk_SB_MT64x64x16_SE_EPS1_FL1_GRVW2_LPB0_PGR1_PLR1_TT4_4_USFGRO0_VW2_WGM8
    SolutionIndex: 691
    SolutionNameMin: Cijk_Ailk_Bljk_SB_MT128x64x8_SE_EPS1_FL1_GRVW4_LPB0_PGR1_PLR1_TT8_4_USFGRO0_VW4_WGM8
    SolutionIndex: 692
    SolutionNameMin: Cijk_Ailk_Bljk_SB_MT128x64x8_SE_EPS1_FL0_GRVW2_LPB0_PGR1_PLR1_TT8_4_USFGRO0_VW2_WGM8
    SolutionIndex: 693
    SolutionNameMin: Cijk_Ailk_Bljk_SB_MT128x64x8_SE_EPS1_FL0_GRVW4_LPB0_PGR1_PLR1_TT8_4_USFGRO0_VW4_WGM8
    SolutionIndex: 694
    SolutionNameMin: Cijk_Ailk_Bljk_SB_MT128x64x8_SE_EPS1_FL1_GRVW2_LPB0_PGR1_PLR1_TT8_4_USFGRO0_VW2_WGM8
    SolutionIndex: 695
    SolutionNameMin: Cijk_Ailk_Bljk_SB_MT64x96x8_SE_EPS1_FL1_GRVW4_LPB0_PGR1_PLR0_TT4_6_USFGRO0_VW2_WGM8
    SolutionIndex: 696
    SolutionNameMin: Cijk_Ailk_Bljk_SB_MT128x64x8_SE_EPS1_FL1_GRVW2_LPB0_PGR1_PLR0_TT8_4_USFGRO0_VW2_WGM8
    SolutionIndex: 697
    SolutionNameMin: Cijk_Ailk_Bljk_SB_MT128x64x8_SE_EPS1_FL0_GRVW2_LPB0_PGR1_PLR0_TT8_4_USFGRO0_VW2_WGM8
    SolutionIndex: 698
    SolutionNameMin: Cijk_Ailk_Bljk_SB_MT128x64x8_SE_EPS1_FL1_GRVW4_LPB0_PGR1_PLR0_TT8_4_USFGRO0_VW4_WGM8
    SolutionIndex: 699
    SolutionNameMin: Cijk_Ailk_Bljk_SB_MT128x64x8_SE_EPS1_FL0_GRVW4_LPB0_PGR1_PLR0_TT8_4_USFGRO0_VW4_WGM8
    SolutionIndex: 700
    SolutionNameMin: Cijk_Ailk_Bljk_SB_MT32x16x32_SE_EPS1_FL1_GRVW2_LPB2_PGR1_PLR1_TT2_4_USFGRO0_VW2_WGM8
    SolutionIndex: 701
    SolutionNameMin: Cijk_Ailk_Bljk_SB_MT64x16x32_SE_EPS1_FL0_GRVW4_LPB4_PGR1_PLR1_TT4_4_USFGRO0_VW4_WGM8
    SolutionIndex: 702
    SolutionNameMin: Cijk_Ailk_Bljk_SB_MT32x16x32_SE_EPS1_FL0_GRVW2_LPB2_PGR1_PLR1_TT2_4_USFGRO0_VW2_WGM8
    SolutionIndex: 703
    SolutionNameMin: Cijk_Ailk_Bljk_SB_MT32x16x32_SE_EPS1_FL1_GRVW2_LPB2_PGR1_PLR0_TT2_4_USFGRO0_VW2_WGM8
    SolutionIndex: 704
    SolutionNameMin: Cijk_Ailk_Bljk_SB_MT16x32x32_SE_EPS1_FL0_GRVW4_LPB2_PGR1_PLR1_TT4_2_USFGRO0_VW2_WGM8
    SolutionIndex: 705
    SolutionNameMin: Cijk_Ailk_Bljk_SB_MT16x32x32_SE_EPS1_FL0_GRVW2_LPB2_PGR1_PLR1_TT4_2_USFGRO0_VW2_WGM8
    SolutionIndex: 706
    SolutionNameMin: Cijk_Ailk_Bljk_SB_MT64x16x16_SE_EPS1_FL0_GRVW4_LPB4_PGR1_PLR1_TT4_4_USFGRO0_VW4_WGM8
    SolutionIndex: 707
    SolutionNameMin: Cijk_Ailk_Bljk_SB_MT64x32x32_SE_EPS1_FL1_GRVW4_LPB4_PGR1_PLR1_TT4_4_USFGRO0_VW4_WGM8
    SolutionIndex: 756
    SolutionIndex: 762
    SolutionIndex: 798
    SolutionIndex: 799
    SolutionIndex: 800
    SolutionIndex: 813
    SolutionIndex: 818
    SolutionIndex: 832
    SolutionIndex: 835
    SolutionIndex: 837
    SolutionIndex: 838
    SolutionIndex: 842
    SolutionIndex: 848
- - - [1600, 512, 1, 1024]
    - [21, 58.86]
  - - [1024, 512, 1, 1]
    - [17, 0.353]
  - - [1024, 512, 1, 64]
    - [13, 16.372]
  - - [2048, 512, 1, 1]
    - [25, 0.584]
  - - [1024, 4096, 1, 1024]
    - [32, 71.168]
  - - [4096, 4096, 1, 1024]
    - [18, 81.933]
  - - [1024, 2048, 1, 1024]
    - [9, 57.571]
  - - [4096, 2048, 1, 1024]
    - [756, 82.156]
  - - [768, 4096, 1, 2]
    - [36, 1.69]
  - - [768, 4096, 1, 768]
    - [3, 67.388]
  - - [3072, 4096, 1, 768]
    - [9, 82.078]
  - - [768, 2048, 1, 2]
    - [37, 1.466]
  - - [768, 2048, 1, 768]
    - [28, 61.199]
  - - [3072, 2048, 1, 768]
    - [10, 75.786]
  - - [768, 640, 1, 768]
    - [11, 48.275]
  - - [768, 1024, 1, 2]
    - [33, 0.997]
  - - [768, 1024, 1, 768]
    - [40, 57.523]
  - - [3072, 1024, 1, 768]
    - [29, 67.568]
  - - [768, 1280, 1, 768]
    - [22, 69.202]
  - - [768, 512, 1, 2]
    - [12, 0.543]
  - - [768, 512, 1, 768]
    - [6, 38.776]
  - - [3072, 512, 1, 768]
    - [14, 61.004]
  - - [1024, 3072, 1, 1024]
    - [18, 68.841]
  - - [1024, 512, 1, 1024]
    - [21, 38.35]
  - - [3072, 2048, 1, 1024]
    - [30, 77.219]
  - - [3072, 3072, 1, 1024]
    - [27, 82.811]
  - - [3072, 512, 1, 1024]
    - [34, 62.445]
  - - [3072, 4096, 1, 1024]
    - [4, 83.09]
  - - [1024, 2048, 1, 2]
    - [2, 1.431]
  - - [1024, 3072, 1, 2]
    - [20, 1.621]
  - - [1024, 512, 1, 2]
    - [26, 0.693]
  - - [1024, 4096, 1, 2]
    - [41, 1.614]
  - - [64, 512, 1, 1]
    - [762, 0.028]
  - - [512, 200, 1, 32]
    - [15, 2.121]
  - - [1024, 200, 1, 1]
    - [12, 0.142]
  - - [512, 200, 1, 1]
    - [1, 0.069]
  - - [1024, 32, 1, 2]
    - [35, 0.051]
  - - [1024, 32, 1, 1024]
    - [5, 4.174]
  - - [768, 320, 1, 768]
    - [5, 29.929]
  - - [768, 160, 1, 768]
    - [39, 14.528]
  - - [768, 32, 1, 768]
    - [5, 2.837]
  - - [768, 32, 1, 2]
    - [19, 0.038]
  - - [768, 64, 1, 768]
    - [24, 5.648]
  - - [768, 64, 1, 2]
    - [16, 0.081]
  - - [1024, 120, 1, 1024]
    - [5, 14.355]
  - - [1024, 20, 1, 1024]
    - [5, 2.464]
  - - [1024, 80, 1, 1024]
    - [5, 9.89]
  - - [1024, 160, 1, 1024]
    - [5, 20.079]
  - - [32, 200, 1, 1]
    - [0, 0.005]
  - - [1024, 4, 1, 1024]
    - [15, 0.515]
  - - [1024, 4, 1, 2]
    - [7, 0.008]
  - - [768, 16, 1, 768]
    - [23, 1.337]
  - - [768, 16, 1, 2]
    - [38, 0.02]
  - - [768, 8, 1, 768]
    - [15, 0.667]
  - - [1024, 6, 1, 1024]
    - [15, 0.761]
  - - [1024, 6, 1, 2]
    - [7, 0.01]
  - - [1024, 8, 1, 1024]
    - [15, 1.02]
  - - [128, 128, 512, 64]
    - [41, 33.321]
  - - [512, 512, 64, 64]
    - [31, 44.053]
  - - [64, 64, 768, 64]
    - [8, 21.942]
  - - [64, 64, 96, 64]
    - [15, 13.528]
  - - [704, 1024, 1, 128]
    - [42, 0.0]
  - - [1024, 1024, 1, 3328]
    - [43, 0.0]
  - - [4, 704, 1, 1280]
    - [44, 0.0]
  - - [4, 1856, 1, 3328]
    - [45, 0.0]
  - - [1856, 448, 1, 3328]
    - [46, 0.0]
  - - [2944, 4288, 1, 1280]
    - [47, 0.0]
  - - [2368, 64, 1, 3328]
    - [48, 0.0]
  - - [1760, 32, 1, 1760]
    - [49, 0.0]
  - - [2368, 5888, 1, 256]
    - [50, 0.0]
  - - [5888, 1856, 1, 256]
    - [51, 0.0]
  - - [64, 3584, 1, 1280]
    - [52, 0.0]
  - - [512, 24000, 1, 1536]
    - [53, 0.0]
  - - [128, 6784, 1, 3328]
    - [46, 0.0]
  - - [5888, 1408, 1, 256]
    - [54, 0.0]
  - - [5888, 1856, 1, 3328]
    - [53, 0.0]
  - - [512, 4, 1, 512]
    - [55, 0.0]
  - - [35, 1500, 1, 2560]
    - [56, 0.0]
  - - [1856, 4288, 1, 256]
    - [57, 0.0]
  - - [1024, 5056, 1, 128]
    - [58, 0.0]
  - - [5056, 5056, 1, 3328]
    - [53, 0.0]
  - - [1408, 5888, 1, 1280]
    - [53, 0.0]
  - - [2368, 448, 1, 128]
    - [42, 0.0]
  - - [6144, 6000, 1, 2560]
    - [53, 0.0]
  - - [2368, 6784, 1, 128]
    - [59, 0.0]
  - - [1024, 3584, 1, 3328]
    - [60, 0.0]
  - - [512, 48000, 1, 2048]
    - [53, 0.0]
  - - [1408, 64, 1, 128]
    - [61, 0.0]
  - - [256, 4288, 1, 3328]
    - [62, 0.0]
  - - [5888, 1408, 1, 1280]
    - [63, 0.0]
  - - [704, 1856, 1, 3328]
    - [64, 0.0]
  - - [1408, 4288, 1, 256]
    - [53, 0.0]
  - - [1024, 2368, 1, 256]
    - [46, 0.0]
  - - [64, 4, 1, 256]
    - [65, 0.0]
  - - [1408, 1856, 1, 1280]
    - [66, 0.0]
  - - [1408, 64, 1, 1280]
    - [67, 0.0]
  - - [448, 1024, 1, 1280]
    - [64, 0.0]
  - - [4096, 32, 1, 4096]
    - [68, 0.0]
  - - [256, 1408, 1, 3328]
    - [69, 0.0]
  - - [5056, 5056, 1, 1280]
    - [54, 0.0]
  - - [448, 5056, 1, 256]
    - [70, 0.0]
  - - [704, 1856, 1, 1280]
    - [71, 0.0]
  - - [128, 5056, 1, 128]
    - [72, 0.0]
  - - [2368, 128, 1, 256]
    - [71, 0.0]
  - - [1856, 1408, 1, 128]
    - [73, 0.0]
  - - [64, 5056, 1, 256]
    - [69, 0.0]
  - - [6784, 256, 1, 3328]
    - [53, 0.0]
  - - [1408, 3584, 1, 256]
    - [57, 0.0]
  - - [4288, 448, 1, 256]
    - [69, 0.0]
  - - [64, 704, 1, 128]
    - [74, 0.0]
  - - [1024, 1856, 1, 128]
    - [75, 0.0]
  - - [4288, 2944, 1, 1280]
    - [47, 0.0]
  - - [704, 5056, 1, 1280]
    - [71, 0.0]
  - - [2368, 704, 1, 3328]
    - [66, 0.0]
  - - [256, 5888, 1, 256]
    - [71, 0.0]
  - - [1856, 4288, 1, 3328]
    - [63, 0.0]
  - - [256, 2944, 1, 256]
    - [71, 0.0]
  - - [5888, 1024, 1, 256]
    - [76, 0.0]
  - - [448, 64, 1, 1280]
    - [77, 0.0]
  - - [3072, 64, 1, 1024]
    - [78, 0.0]
  - - [3584, 4, 1, 1280]
    - [79, 0.0]
  - - [2560, 16, 1, 2560]
    - [80, 0.0]
  - - [2944, 64, 1, 256]
    - [78, 0.0]
  - - [128, 4, 1, 1280]
    - [81, 0.0]
  - - [1408, 2944, 1, 256]
    - [76, 0.0]
  - - [256, 1856, 1, 1280]
    - [62, 0.0]
  - - [6784, 5056, 1, 3328]
    - [47, 0.0]
  - - [5056, 5056, 1, 256]
    - [51, 0.0]
  - - [128, 256, 1, 256]
    - [82, 0.0]
  - - [64, 1024, 1, 1280]
    - [49, 0.0]
  - - [2944, 4, 1, 256]
    - [83, 0.0]
  - - [704, 5056, 1, 128]
    - [84, 0.0]
  - - [4, 2368, 1, 1280]
    - [65, 0.0]
  - - [2368, 2944, 1, 1280]
    - [57, 0.0]
  - - [448, 448, 1, 3328]
    - [85, 0.0]
  - - [6784, 6784, 1, 1280]
    - [47, 0.0]
  - - [1024, 256, 1, 3328]
    - [64, 0.0]
  - - [1408, 4288, 1, 1280]
    - [63, 0.0]
  - - [3584, 4288, 1, 1280]
    - [51, 0.0]
  - - [512, 6000, 1, 2560]
    - [76, 0.0]
  - - [2368, 704, 1, 1280]
    - [69, 0.0]
  - - [5056, 4288, 1, 3328]
    - [54, 0.0]
  - - [3584, 2368, 1, 3328]
    - [86, 0.0]
  - - [5888, 6784, 1, 1280]
    - [76, 0.0]
  - - [64, 704, 1, 1280]
    - [87, 0.0]
  - - [4288, 256, 1, 256]
    - [71, 0.0]
  - - [2944, 128, 1, 128]
    - [88, 0.0]
  - - [6144, 32, 1, 2560]
    - [67, 0.0]
  - - [6784, 448, 1, 1280]
    - [46, 0.0]
  - - [2944, 5888, 1, 256]
    - [54, 0.0]
  - - [64, 64, 1, 1280]
    - [89, 0.0]
  - - [4288, 2944, 1, 256]
    - [47, 0.0]
  - - [5888, 704, 1, 1280]
    - [76, 0.0]
  - - [5056, 4, 1, 3328]
    - [83, 0.0]
  - - [1856, 64, 1, 1280]
    - [52, 0.0]
  - - [1760, 16, 1, 1760]
    - [90, 0.0]
  - - [448, 5888, 1, 128]
    - [73, 0.0]
  - - [5888, 64, 1, 3328]
    - [91, 0.0]
  - - [2944, 256, 1, 3328]
    - [69, 0.0]
  - - [1024, 64, 1, 128]
    - [74, 0.0]
  - - [5056, 2368, 1, 1280]
    - [57, 0.0]
  - - [448, 3584, 1, 1280]
    - [54, 0.0]
  - - [6784, 5888, 1, 256]
    - [92, 0.0]
  - - [64, 1024, 1, 3328]
    - [67, 0.0]
  - - [704, 128, 1, 1280]
    - [49, 0.0]
  - - [4, 3584, 1, 128]
    - [93, 0.0]
  - - [1408, 448, 1, 1280]
    - [69, 0.0]
  - - [1024, 1408, 1, 256]
    - [46, 0.0]
  - - [2368, 2368, 1, 3328]
    - [69, 0.0]
  - - [1856, 6784, 1, 128]
    - [73, 0.0]
  - - [5056, 704, 1, 3328]
    - [94, 0.0]
  - - [1408, 1856, 1, 256]
    - [95, 0.0]
  - - [1408, 704, 1, 3328]
    - [95, 0.0]
  - - [2368, 5056, 1, 256]
    - [76, 0.0]
  - - [1408, 256, 1, 1280]
    - [62, 0.0]
  - - [3072, 128, 1, 1024]
    - [96, 0.0]
  - - [3584, 2368, 1, 1280]
    - [57, 0.0]
  - - [4288, 64, 1, 3328]
    - [97, 0.0]
  - - [2368, 4, 1, 1280]
    - [79, 0.0]
  - - [704, 5888, 1, 256]
    - [63, 0.0]
  - - [6784, 2944, 1, 128]
    - [58, 0.0]
  - - [6784, 64, 1, 256]
    - [64, 0.0]
  - - [2944, 256, 1, 256]
    - [69, 0.0]
  - - [2944, 6784, 1, 3328]
    - [63, 0.0]
  - - [128, 1, 1, 1408]
    - [89, 0.0]
  - - [704, 1408, 1, 3328]
    - [92, 0.0]
  - - [3584, 704, 1, 3328]
    - [57, 0.0]
  - - [2944, 256, 1, 128]
    - [59, 0.0]
  - - [6784, 4, 1, 1280]
    - [98, 0.0]
  - - [1024, 64, 1, 1280]
    - [99, 0.0]
  - - [8448, 4, 1, 2816]
    - [100, 0.0]
  - - [448, 4288, 1, 256]
    - [69, 0.0]
  - - [64, 3584, 1, 3328]
    - [101, 0.0]
  - - [704, 2368, 1, 1280]
    - [54, 0.0]
  - - [1856, 2368, 1, 1280]
    - [66, 0.0]
  - - [2368, 128, 1, 3328]
    - [102, 0.0]
  - - [64, 193600, 1, 64]
    - [71, 0.0]
  - - [1760, 128, 1, 1760]
    - [48, 0.0]
  - - [448, 1408, 1, 256]
    - [69, 0.0]
  - - [1856, 4288, 1, 1280]
    - [53, 0.0]
  - - [64, 5056, 1, 3328]
    - [103, 0.0]
  - - [512, 1500, 1, 2816]
    - [69, 0.0]
  - - [1024, 448, 1, 128]
    - [42, 0.0]
  - - [704, 4, 1, 1280]
    - [65, 0.0]
  - - [704, 256, 1, 128]
    - [42, 0.0]
  - - [256, 193600, 1, 64]
    - [54, 0.0]
  - - [704, 2944, 1, 128]
    - [84, 0.0]
  - - [1408, 1024, 1, 1280]
    - [66, 0.0]
  - - [704, 6784, 1, 256]
    - [104, 0.0]
  - - [6784, 704, 1, 256]
    - [71, 0.0]
  - - [5056, 1408, 1, 128]
    - [105, 0.0]
  - - [2048, 7000, 1, 2048]
    - [53, 0.0]
  - - [256, 3584, 1, 3328]
    - [106, 0.0]
  - - [5056, 704, 1, 256]
    - [69, 0.0]
  - - [128, 1408, 1, 128]
    - [107, 0.0]
  - - [3584, 4288, 1, 3328]
    - [108, 0.0]
  - - [5888, 1856, 1, 1280]
    - [63, 0.0]
  - - [256, 1408, 1, 256]
    - [71, 0.0]
  - - [5056, 64, 1, 1280]
    - [49, 0.0]
  - - [1024, 704, 1, 256]
    - [71, 0.0]
  - - [64, 256, 1, 128]
    - [109, 0.0]
  - - [2368, 3584, 1, 1280]
    - [53, 0.0]
  - - [1024, 256, 1, 256]
    - [64, 0.0]
  - - [1856, 4, 1, 1280]
    - [110, 0.0]
  - - [448, 448, 1, 256]
    - [69, 0.0]
  - - [2944, 3584, 1, 3328]
    - [63, 0.0]
  - - [7680, 32, 1, 2560]
    - [103, 0.0]
  - - [128, 4288, 1, 128]
    - [111, 0.0]
  - - [256, 256, 1, 3328]
    - [67, 0.0]
  - - [128, 1024, 1, 3328]
    - [112, 0.0]
  - - [4, 1408, 1, 3328]
    - [45, 0.0]
  - - [6784, 2944, 1, 256]
    - [113, 0.0]
  - - [64, 1856, 1, 1280]
    - [49, 0.0]
  - - [64, 1024, 1, 128]
    - [114, 0.0]
  - - [1024, 1500, 1, 2560]
    - [46, 0.0]
  - - [1856, 2368, 1, 256]
    - [71, 0.0]
  - - [3584, 256, 1, 128]
    - [115, 0.0]
  - - [3584, 6784, 1, 3328]
    - [116, 0.0]
  - - [256, 1024, 1, 256]
    - [69, 0.0]
  - - [4, 6784, 1, 3328]
    - [65, 0.0]
  - - [1024, 5888, 1, 3328]
    - [53, 0.0]
  - - [1024, 128, 1, 1280]
    - [117, 0.0]
  - - [3072, 32, 1, 1024]
    - [118, 0.0]
  - - [6144, 24000, 1, 2560]
    - [63, 0.0]
  - - [448, 1024, 1, 256]
    - [71, 0.0]
  - - [5056, 4288, 1, 1280]
    - [53, 0.0]
  - - [5888, 64, 1, 256]
    - [69, 0.0]
  - - [1856, 256, 1, 1280]
    - [64, 0.0]
  - - [64, 5888, 1, 3328]
    - [112, 0.0]
  - - [2368, 2368, 1, 1280]
    - [106, 0.0]
  - - [2944, 5888, 1, 128]
    - [73, 0.0]
  - - [704, 5888, 1, 1280]
    - [106, 0.0]
  - - [2368, 3584, 1, 128]
    - [119, 0.0]
  - - [1856, 5056, 1, 128]
    - [120, 0.0]
  - - [4608, 1, 1, 1536]
    - [55, 0.0]
  - - [448, 256, 1, 3328]
    - [52, 0.0]
  - - [2944, 6784, 1, 1280]
    - [121, 0.0]
  - - [448, 1856, 1, 128]
    - [105, 0.0]
  - - [128, 1024, 1, 128]
    - [122, 0.0]
  - - [7680, 4, 1, 2560]
    - [123, 0.0]
  - - [1024, 704, 1, 1280]
    - [69, 0.0]
  - - [128, 5888, 1, 256]
    - [71, 0.0]
  - - [1024, 5056, 1, 1280]
    - [46, 0.0]
  - - [4288, 1024, 1, 256]
    - [57, 0.0]
  - - [2944, 2368, 1, 128]
    - [42, 0.0]
  - - [704, 704, 1, 3328]
    - [70, 0.0]
  - - [704, 1408, 1, 1280]
    - [92, 0.0]
  - - [5888, 448, 1, 1280]
    - [71, 0.0]
  - - [3584, 256, 1, 3328]
    - [46, 0.0]
  - - [704, 5888, 1, 3328]
    - [69, 0.0]
  - - [704, 1856, 1, 128]
    - [124, 0.0]
  - - [128, 3584, 1, 3328]
    - [112, 0.0]
  - - [4, 4288, 1, 128]
    - [125, 0.0]
  - - [128, 704, 1, 1280]
    - [126, 0.0]
  - - [3584, 2944, 1, 256]
    - [63, 0.0]
  - - [1856, 128, 1, 3328]
    - [127, 0.0]
  - - [1856, 2368, 1, 3328]
    - [66, 0.0]
  - - [512, 6000, 1, 2816]
    - [54, 0.0]
  - - [2944, 448, 1, 128]
    - [59, 0.0]
  - - [64, 193600, 1, 256]
    - [64, 0.0]
  - - [128, 2944, 1, 1280]
    - [71, 0.0]
  - - [448, 2944, 1, 1280]
    - [69, 0.0]
  - - [512, 24000, 1, 2048]
    - [54, 0.0]
  - - [128, 256, 1, 3328]
    - [77, 0.0]
  - - [1408, 5056, 1, 3328]
    - [94, 0.0]
  - - [1856, 1856, 1, 3328]
    - [71, 0.0]
  - - [3584, 128, 1, 256]
    - [69, 0.0]
  - - [448, 1408, 1, 3328]
    - [71, 0.0]
  - - [2368, 2368, 1, 256]
    - [47, 0.0]
  - - [4288, 4288, 1, 1280]
    - [76, 0.0]
  - - [64, 448, 1, 1280]
    - [77, 0.0]
  - - [5888, 1024, 1, 1280]
    - [57, 0.0]
  - - [704, 1024, 1, 256]
    - [69, 0.0]
  - - [1024, 12544, 1, 256]
    - [128, 0.0]
  - - [448, 4, 1, 256]
    - [45, 0.0]
  - - [5888, 448, 1, 128]
    - [119, 0.0]
  - - [512, 48000, 1, 2560]
    - [54, 0.0]
  - - [8448, 16, 1, 2816]
    - [129, 0.0]
  - - [704, 6784, 1, 3328]
    - [130, 0.0]
  - - [5888, 5888, 1, 1280]
    - [46, 0.0]
  - - [5056, 1024, 1, 1280]
    - [104, 0.0]
  - - [448, 5888, 1, 3328]
    - [53, 0.0]
  - - [3072, 2, 1, 1024]
    - [131, 0.0]
  - - [1024, 2944, 1, 1280]
    - [63, 0.0]
  - - [5056, 5888, 1, 1280]
    - [53, 0.0]
  - - [4288, 5888, 1, 128]
    - [124, 0.0]
  - - [256, 3584, 1, 256]
    - [71, 0.0]
  - - [256, 4, 1, 1280]
    - [132, 0.0]
  - - [1408, 3584, 1, 128]
    - [124, 0.0]
  - - [256, 2944, 1, 3328]
    - [69, 0.0]
  - - [448, 3584, 1, 128]
    - [124, 0.0]
  - - [5888, 2944, 1, 1280]
    - [63, 0.0]
  - - [4, 6784, 1, 1280]
    - [65, 0.0]
  - - [2368, 5888, 1, 128]
    - [73, 0.0]
  - - [35, 8457, 1, 1760]
    - [133, 0.0]
  - - [64, 2944, 1, 128]
    - [107, 0.0]
  - - [2368, 4, 1, 256]
    - [134, 0.0]
  - - [3584, 5888, 1, 256]
    - [113, 0.0]
  - - [2368, 1024, 1, 128]
    - [42, 0.0]
  - - [2368, 704, 1, 128]
    - [42, 0.0]
  - - [512, 32, 1, 512]
    - [135, 0.0]
  - - [3584, 2368, 1, 128]
    - [42, 0.0]
  - - [5056, 704, 1, 128]
    - [59, 0.0]
  - - [448, 2368, 1, 128]
    - [42, 0.0]
  - - [4, 5056, 1, 256]
    - [136, 0.0]
  - - [5056, 1408, 1, 3328]
    - [66, 0.0]
  - - [1408, 704, 1, 256]
    - [69, 0.0]
  - - [6784, 1024, 1, 3328]
    - [57, 0.0]
  - - [6784, 2944, 1, 3328]
    - [53, 0.0]
  - - [7680, 1, 1, 2560]
    - [137, 0.0]
  - - [1856, 1856, 1, 256]
    - [138, 0.0]
  - - [64, 64, 1, 3328]
    - [139, 0.0]
  - - [512, 1, 1, 512]
    - [55, 0.0]
  - - [6784, 2368, 1, 1280]
    - [69, 0.0]
  - - [4608, 2, 1, 1536]
    - [55, 0.0]
  - - [4288, 3584, 1, 256]
    - [54, 0.0]
  - - [4288, 5888, 1, 1280]
    - [66, 0.0]
  - - [4608, 4, 1, 1536]
    - [140, 0.0]
  - - [1024, 6000, 1, 1536]
    - [53, 0.0]
  - - [8448, 32, 1, 2816]
    - [103, 0.0]
  - - [448, 2944, 1, 3328]
    - [66, 0.0]
  - - [4288, 1856, 1, 1280]
    - [63, 0.0]
  - - [1856, 2944, 1, 3328]
    - [69, 0.0]
  - - [256, 6784, 1, 3328]
    - [69, 0.0]
  - - [512, 3000, 1, 1536]
    - [95, 0.0]
  - - [64, 5888, 1, 256]
    - [70, 0.0]
  - - [256, 5056, 1, 128]
    - [141, 0.0]
  - - [5056, 1024, 1, 256]
    - [47, 0.0]
  - - [704, 64, 1, 3328]
    - [142, 0.0]
  - - [5056, 1856, 1, 3328]
    - [54, 0.0]
  - - [4, 2944, 1, 3328]
    - [65, 0.0]
  - - [512, 1500, 1, 2048]
    - [62, 0.0]
  - - [1024, 1, 1, 500000]
    - [143, 0.0]
  - - [256, 4, 1, 256]
    - [65, 0.0]
  - - [6784, 128, 1, 3328]
    - [106, 0.0]
  - - [4288, 1408, 1, 128]
    - [42, 0.0]
  - - [1856, 5888, 1, 3328]
    - [53, 0.0]
  - - [4288, 5056, 1, 256]
    - [47, 0.0]
  - - [1408, 128, 1, 1280]
    - [52, 0.0]
  - - [4096, 7000, 1, 4096]
    - [76, 0.0]
  - - [5056, 256, 1, 3328]
    - [69, 0.0]
  - - [704, 704, 1, 256]
    - [71, 0.0]
  - - [1024, 3000, 1, 2560]
    - [57, 0.0]
  - - [1024, 5888, 1, 1280]
    - [57, 0.0]
  - - [6784, 2368, 1, 128]
    - [115, 0.0]
  - - [4, 5056, 1, 1280]
    - [65, 0.0]
  - - [256, 64, 1, 1280]
    - [135, 0.0]
  - - [128, 1856, 1, 1280]
    - [69, 0.0]
  - - [1856, 1024, 1, 1280]
    - [66, 0.0]
  - - [6784, 4288, 1, 1280]
    - [54, 0.0]
  - - [1856, 1856, 1, 1280]
    - [60, 0.0]
  - - [35, 1500, 1, 2048]
    - [144, 0.0]
  - - [3072, 24000, 1, 1024]
    - [50, 0.0]
  - - [1408, 5056, 1, 1280]
    - [69, 0.0]
  - - [4, 2368, 1, 3328]
    - [45, 0.0]
  - - [5888, 1856, 1, 128]
    - [42, 0.0]
  - - [448, 704, 1, 1280]
    - [46, 0.0]
  - - [448, 6784, 1, 128]
    - [115, 0.0]
  - - [1024, 448, 1, 3328]
    - [66, 0.0]
  - - [2944, 128, 1, 256]
    - [71, 0.0]
  - - [5056, 3584, 1, 128]
    - [124, 0.0]
  - - [5888, 5888, 1, 3328]
    - [54, 0.0]
  - - [6784, 1024, 1, 256]
    - [57, 0.0]
  - - [2944, 2368, 1, 256]
    - [108, 0.0]
  - - [256, 448, 1, 256]
    - [69, 0.0]
  - - [5056, 5888, 1, 3328]
    - [60, 0.0]
  - - [1856, 1024, 1, 256]
    - [69, 0.0]
  - - [512, 48000, 1, 1536]
    - [121, 0.0]
  - - [3584, 448, 1, 1280]
    - [71, 0.0]
  - - [1024, 1024, 1, 1280]
    - [69, 0.0]
  - - [448, 5888, 1, 256]
    - [71, 0.0]
  - - [2048, 128, 1, 2048]
    - [68, 0.0]
  - - [1408, 6784, 1, 3328]
    - [69, 0.0]
  - - [448, 1024, 1, 128]
    - [59, 0.0]
  - - [4288, 704, 1, 128]
    - [42, 0.0]
  - - [128, 1856, 1, 128]
    - [145, 0.0]
  - - [448, 2368, 1, 3328]
    - [71, 0.0]
  - - [5056, 64, 1, 128]
    - [42, 0.0]
  - - [5056, 2944, 1, 256]
    - [104, 0.0]
  - - [6784, 5888, 1, 128]
    - [42, 0.0]
  - - [1024, 700, 1, 512]
    - [69, 0.0]
  - - [3072, 1, 1, 128]
    - [146, 0.0]
  - - [1024, 4, 1, 256]
    - [110, 0.0]
  - - [2944, 704, 1, 128]
    - [124, 0.0]
  - - [128, 6784, 1, 1280]
    - [71, 0.0]
  - - [1408, 3584, 1, 3328]
    - [63, 0.0]
  - - [2368, 6784, 1, 256]
    - [57, 0.0]
  - - [5056, 1408, 1, 1280]
    - [63, 0.0]
  - - [5056, 4288, 1, 128]
    - [147, 0.0]
  - - [4, 704, 1, 256]
    - [65, 0.0]
  - - [4288, 2368, 1, 3328]
    - [50, 0.0]
  - - [1408, 1856, 1, 128]
    - [59, 0.0]
  - - [1408, 5888, 1, 3328]
    - [54, 0.0]
  - - [1856, 256, 1, 256]
    - [71, 0.0]
  - - [6784, 6784, 1, 256]
    - [53, 0.0]
  - - [5888, 5056, 1, 128]
    - [115, 0.0]
  - - [4288, 2368, 1, 128]
    - [42, 0.0]
  - - [128, 5888, 1, 1280]
    - [138, 0.0]
  - - [256, 4288, 1, 1280]
    - [71, 0.0]
  - - [2368, 2944, 1, 256]
    - [47, 0.0]
  - - [4, 1856, 1, 256]
    - [148, 0.0]
  - - [3584, 1856, 1, 1280]
    - [63, 0.0]
  - - [6784, 6784, 1, 128]
    - [124, 0.0]
  - - [256, 1856, 1, 128]
    - [59, 0.0]
  - - [704, 64, 1, 1280]
    - [149, 0.0]
  - - [5888, 5056, 1, 256]
    - [116, 0.0]
  - - [8448, 48000, 1, 2816]
    - [53, 0.0]
  - - [512, 6000, 1, 2048]
    - [71, 0.0]
  - - [3584, 448, 1, 256]
    - [69, 0.0]
  - - [448, 4288, 1, 128]
    - [124, 0.0]
  - - [7680, 64, 1, 2560]
    - [150, 0.0]
  - - [256, 6784, 1, 256]
    - [69, 0.0]
  - - [1408, 4288, 1, 128]
    - [42, 0.0]
  - - [2944, 704, 1, 3328]
    - [69, 0.0]
  - - [128, 448, 1, 256]
    - [149, 0.0]
  - - [2048, 32, 1, 2048]
    - [118, 0.0]
  - - [3584, 3584, 1, 256]
    - [47, 0.0]
  - - [448, 1408, 1, 128]
    - [59, 0.0]
  - - [128, 256, 1, 1280]
    - [77, 0.0]
  - - [3584, 5056, 1, 256]
    - [51, 0.0]
  - - [6784, 128, 1, 256]
    - [71, 0.0]
  - - [4288, 4, 1, 256]
    - [83, 0.0]
  - - [64, 1408, 1, 3328]
    - [126, 0.0]
  - - [704, 448, 1, 256]
    - [64, 0.0]
  - - [2944, 2368, 1, 1280]
    - [63, 0.0]
  - - [448, 64, 1, 3328]
    - [142, 0.0]
  - - [704, 6784, 1, 128]
    - [73, 0.0]
  - - [3584, 4, 1, 3328]
    - [151, 0.0]
  - - [6784, 3584, 1, 256]
    - [53, 0.0]
  - - [704, 448, 1, 128]
    - [73, 0.0]
  - - [256, 128, 1, 128]
    - [152, 0.0]
  - - [704, 1408, 1, 128]
    - [73, 0.0]
  - - [4, 448, 1, 128]
    - [93, 0.0]
  - - [4288, 128, 1, 1280]
    - [49, 0.0]
  - - [128, 1408, 1, 256]
    - [69, 0.0]
  - - [4, 2944, 1, 256]
    - [136, 0.0]
  - - [64, 128, 1, 3328]
    - [89, 0.0]
  - - [1856, 1408, 1, 256]
    - [71, 0.0]
  - - [5056, 2368, 1, 128]
    - [42, 0.0]
  - - [2944, 2944, 1, 3328]
    - [54, 0.0]
  - - [5056, 6784, 1, 256]
    - [53, 0.0]
  - - [1856, 3584, 1, 128]
    - [84, 0.0]
  - - [5888, 4, 1, 1280]
    - [98, 0.0]
  - - [128, 2944, 1, 128]
    - [153, 0.0]
  - - [35, 8457, 1, 2560]
    - [154, 0.0]
  - - [3584, 6784, 1, 128]
    - [42, 0.0]
  - - [128, 4288, 1, 256]
    - [71, 0.0]
  - - [704, 448, 1, 3328]
    - [66, 0.0]
  - - [2368, 6784, 1, 1280]
    - [63, 0.0]
  - - [128, 128, 1, 3328]
    - [155, 0.0]
  - - [5056, 1856, 1, 256]
    - [47, 0.0]
  - - [256, 128, 1, 256]
    - [82, 0.0]
  - - [1024, 3000, 1, 2816]
    - [66, 0.0]
  - - [1024, 1856, 1, 256]
    - [46, 0.0]
  - - [64, 1, 1, 1216]
    - [89, 0.0]
  - - [4288, 64, 1, 128]
    - [156, 0.0]
  - - [256, 448, 1, 3328]
    - [157, 0.0]
  - - [1408, 6784, 1, 1280]
    - [54, 0.0]
  - - [3584, 3584, 1, 1280]
    - [66, 0.0]
  - - [7680, 24000, 1, 2560]
    - [54, 0.0]
  - - [64, 2368, 1, 1280]
    - [48, 0.0]
  - - [448, 2368, 1, 1280]
    - [158, 0.0]
  - - [4608, 48000, 1, 1536]
    - [57, 0.0]
  - - [5888, 5888, 1, 128]
    - [141, 0.0]
  - - [64, 6784, 1, 3328]
    - [71, 0.0]
  - - [2944, 256, 1, 1280]
    - [62, 0.0]
  - - [2048, 16, 1, 2048]
    - [159, 0.0]
  - - [256, 2368, 1, 128]
    - [59, 0.0]
  - - [5056, 2368, 1, 3328]
    - [63, 0.0]
  - - [2944, 4288, 1, 256]
    - [160, 0.0]
  - - [1408, 3584, 1, 1280]
    - [46, 0.0]
  - - [2368, 64, 1, 256]
    - [161, 0.0]
  - - [1024, 128, 1, 128]
    - [114, 0.0]
  - - [704, 128, 1, 3328]
    - [101, 0.0]
  - - [5888, 4, 1, 128]
    - [125, 0.0]
  - - [1856, 704, 1, 256]
    - [69, 0.0]
  - - [1024, 1500, 1, 2816]
    - [46, 0.0]
  - - [8448, 1, 1, 2816]
    - [100, 0.0]
  - - [1024, 4, 1, 3328]
    - [132, 0.0]
  - - [1024, 6000, 1, 2048]
    - [46, 0.0]
  - - [512, 24000, 1, 2560]
    - [63, 0.0]
  - - [6144, 3000, 1, 2560]
    - [121, 0.0]
  - - [2368, 6784, 1, 3328]
    - [66, 0.0]
  - - [1856, 1408, 1, 1280]
    - [106, 0.0]
  - - [1856, 448, 1, 1280]
    - [66, 0.0]
  - - [6784, 704, 1, 128]
    - [59, 0.0]
  - - [4, 4, 1, 256]
    - [65, 0.0]
  - - [128, 5888, 1, 128]
    - [107, 0.0]
  - - [5056, 2944, 1, 128]
    - [162, 0.0]
  - - [1408, 5888, 1, 256]
    - [57, 0.0]
  - - [704, 2944, 1, 1280]
    - [92, 0.0]
  - - [4288, 64, 1, 1280]
    - [52, 0.0]
  - - [256, 64, 1, 256]
    - [163, 0.0]
  - - [1024, 1024, 1, 256]
    - [66, 0.0]
  - - [704, 1856, 1, 256]
    - [60, 0.0]
  - - [2560, 64, 1, 2560]
    - [48, 0.0]
  - - [3584, 704, 1, 1280]
    - [46, 0.0]
  - - [256, 128, 1, 1280]
    - [77, 0.0]
  - - [5888, 2368, 1, 256]
    - [76, 0.0]
  - - [256, 2368, 1, 1280]
    - [71, 0.0]
  - - [2944, 6784, 1, 128]
    - [59, 0.0]
  - - [3584, 448, 1, 3328]
    - [71, 0.0]
  - - [1408, 4, 1, 256]
    - [164, 0.0]
  - - [704, 2368, 1, 3328]
    - [63, 0.0]
  - - [2944, 448, 1, 256]
    - [46, 0.0]
  - - [1856, 448, 1, 128]
    - [115, 0.0]
  - - [4608, 6000, 1, 1536]
    - [54, 0.0]
  - - [2368, 128, 1, 1280]
    - [49, 0.0]
  - - [256, 5888, 1, 128]
    - [42, 0.0]
  - - [64, 6784, 1, 256]
    - [71, 0.0]
  - - [64, 5056, 1, 1280]
    - [67, 0.0]
  - - [4, 6784, 1, 128]
    - [93, 0.0]
  - - [3025, 64, 64, 64]
    - [165, 0.0]
  - - [2944, 2944, 1, 1280]
    - [63, 0.0]
  - - [5056, 448, 1, 3328]
    - [95, 0.0]
  - - [4, 3584, 1, 1280]
    - [65, 0.0]
  - - [1408, 128, 1, 128]
    - [122, 0.0]
  - - [6784, 704, 1, 3328]
    - [66, 0.0]
  - - [128, 64, 1, 1280]
    - [166, 0.0]
  - - [2368, 256, 1, 1280]
    - [71, 0.0]
  - - [4, 448, 1, 3328]
    - [45, 0.0]
  - - [5888, 4288, 1, 128]
    - [42, 0.0]
  - - [4, 5888, 1, 256]
    - [136, 0.0]
  - - [1408, 2944, 1, 3328]
    - [57, 0.0]
  - - [3584, 704, 1, 128]
    - [119, 0.0]
  - - [64, 1024, 1, 256]
    - [149, 0.0]
  - - [2368, 448, 1, 1280]
    - [64, 0.0]
  - - [128, 3584, 1, 256]
    - [71, 0.0]
  - - [704, 448, 1, 1280]
    - [71, 0.0]
  - - [448, 5056, 1, 128]
    - [42, 0.0]
  - - [6144, 4, 1, 2560]
    - [123, 0.0]
  - - [5056, 3584, 1, 256]
    - [47, 0.0]
  - - [4288, 4288, 1, 256]
    - [121, 0.0]
  - - [1408, 5056, 1, 128]
    - [124, 0.0]
  - - [2944, 3584, 1, 128]
    - [58, 0.0]
  - - [3584, 2368, 1, 256]
    - [66, 0.0]
  - - [5888, 5056, 1, 1280]
    - [47, 0.0]
  - - [128, 1024, 1, 1280]
    - [49, 0.0]
  - - [8448, 24000, 1, 2816]
    - [53, 0.0]
  - - [64, 704, 1, 256]
    - [149, 0.0]
  - - [4288, 256, 1, 1280]
    - [62, 0.0]
  - - [3584, 3584, 1, 3328]
    - [46, 0.0]
  - - [704, 64, 1, 128]
    - [156, 0.0]
  - - [3072, 1500, 1, 128]
    - [76, 0.0]
  - - [2048, 3136, 1, 512]
    - [167, 0.0]
  - - [3025, 256, 64, 64]
    - [168, 0.0]
  - - [5888, 6784, 1, 256]
    - [63, 0.0]
  - - [4288, 2944, 1, 3328]
    - [63, 0.0]
  - - [2944, 64, 1, 128]
    - [72, 0.0]
  - - [1024, 128, 1, 3328]
    - [117, 0.0]
  - - [1024, 16, 1, 500000]
    - [169, 0.0]
  - - [4288, 128, 1, 3328]
    - [91, 0.0]
  - - [7680, 128, 1, 2560]
    - [66, 0.0]
  - - [256, 5056, 1, 1280]
    - [64, 0.0]
  - - [1408, 256, 1, 128]
    - [170, 0.0]
  - - [2944, 5888, 1, 3328]
    - [76, 0.0]
  - - [6784, 5888, 1, 1280]
    - [54, 0.0]
  - - [3072, 1, 1, 1024]
    - [146, 0.0]
  - - [704, 128, 1, 256]
    - [87, 0.0]
  - - [5888, 4288, 1, 1280]
    - [46, 0.0]
  - - [1024, 24000, 1, 2048]
    - [76, 0.0]
  - - [448, 256, 1, 1280]
    - [52, 0.0]
  - - [5888, 3584, 1, 128]
    - [42, 0.0]
  - - [64, 4288, 1, 3328]
    - [112, 0.0]
  - - [448, 4, 1, 1280]
    - [45, 0.0]
  - - [6784, 6784, 1, 3328]
    - [50, 0.0]
  - - [5056, 4, 1, 1280]
    - [44, 0.0]
  - - [4, 5888, 1, 3328]
    - [65, 0.0]
  - - [256, 1408, 1, 1280]
    - [71, 0.0]
  - - [3072, 16, 1, 1024]
    - [171, 0.0]
  - - [704, 3584, 1, 128]
    - [170, 0.0]
  - - [1024, 2, 1, 512]
    - [139, 0.0]
  - - [5888, 448, 1, 3328]
    - [71, 0.0]
  - - [2368, 4288, 1, 1280]
    - [57, 0.0]
  - - [4288, 2944, 1, 128]
    - [172, 0.0]
  - - [256, 64, 1, 3328]
    - [155, 0.0]
  - - [2944, 64, 1, 3328]
    - [52, 0.0]
  - - [6784, 64, 1, 3328]
    - [69, 0.0]
  - - [5056, 2944, 1, 3328]
    - [121, 0.0]
  - - [448, 128, 1, 256]
    - [163, 0.0]
  - - [2944, 3584, 1, 256]
    - [66, 0.0]
  - - [1408, 1408, 1, 3328]
    - [63, 0.0]
  - - [1856, 128, 1, 1280]
    - [71, 0.0]
  - - [3584, 3584, 1, 128]
    - [42, 0.0]
  - - [64, 3584, 1, 256]
    - [71, 0.0]
  - - [1408, 4, 1, 3328]
    - [44, 0.0]
  - - [128, 2944, 1, 3328]
    - [103, 0.0]
  - - [3584, 704, 1, 256]
    - [46, 0.0]
  - - [2944, 448, 1, 3328]
    - [113, 0.0]
  - - [1024, 2, 1, 500000]
    - [173, 0.0]
  - - [3584, 1408, 1, 3328]
    - [174, 0.0]
  - - [704, 3584, 1, 1280]
    - [92, 0.0]
  - - [1024, 1408, 1, 128]
    - [73, 0.0]
  - - [1856, 6784, 1, 256]
    - [54, 0.0]
  - - [4288, 448, 1, 3328]
    - [60, 0.0]
  - - [6784, 4288, 1, 128]
    - [58, 0.0]
  - - [6784, 704, 1, 1280]
    - [66, 0.0]
  - - [6144, 1, 1, 2560]
    - [123, 0.0]
  - - [3584, 6784, 1, 256]
    - [57, 0.0]
  - - [6144, 16, 1, 2560]
    - [149, 0.0]
  - - [3584, 64, 1, 128]
    - [72, 0.0]
  - - [5888, 1024, 1, 3328]
    - [46, 0.0]
  - - [448, 64, 1, 128]
    - [114, 0.0]
  - - [704, 6784, 1, 1280]
    - [51, 0.0]
  - - [4, 448, 1, 256]
    - [44, 0.0]
  - - [5888, 128, 1, 256]
    - [60, 0.0]
  - - [4096, 16, 1, 4096]
    - [131, 0.0]
  - - [1856, 5056, 1, 3328]
    - [47, 0.0]
  - - [4, 6784, 1, 256]
    - [148, 0.0]
  - - [1024, 3584, 1, 128]
    - [42, 0.0]
  - - [64, 704, 1, 3328]
    - [175, 0.0]
  - - [2368, 2944, 1, 128]
    - [124, 0.0]
  - - [5056, 64, 1, 256]
    - [71, 0.0]
  - - [512, 1500, 1, 1536]
    - [71, 0.0]
  - - [512, 1, 1, 500000]
    - [176, 0.0]
  - - [5888, 2944, 1, 3328]
    - [76, 0.0]
  - - [128, 3584, 1, 1280]
    - [46, 0.0]
  - - [1024, 704, 1, 128]
    - [105, 0.0]
  - - [1408, 2368, 1, 128]
    - [73, 0.0]
  - - [5888, 2368, 1, 128]
    - [124, 0.0]
  - - [128, 5056, 1, 3328]
    - [71, 0.0]
  - - [3584, 6784, 1, 1280]
    - [63, 0.0]
  - - [4288, 1856, 1, 256]
    - [53, 0.0]
  - - [1856, 5888, 1, 256]
    - [130, 0.0]
  - - [256, 256, 1, 256]
    - [177, 0.0]
  - - [4288, 4288, 1, 3328]
    - [53, 0.0]
  - - [1024, 1024, 1, 128]
    - [124, 0.0]
  - - [4288, 1408, 1, 1280]
    - [53, 0.0]
  - - [3584, 5056, 1, 128]
    - [170, 0.0]
  - - [4, 1024, 1, 3328]
    - [65, 0.0]
  - - [4, 704, 1, 128]
    - [93, 0.0]
  - - [4288, 2368, 1, 256]
    - [104, 0.0]
  - - [2944, 5056, 1, 1280]
    - [46, 0.0]
  - - [448, 6784, 1, 256]
    - [160, 0.0]
  - - [64, 128, 1, 128]
    - [152, 0.0]
  - - [1856, 2368, 1, 128]
    - [124, 0.0]
  - - [6784, 2368, 1, 3328]
    - [51, 0.0]
  - - [1408, 6784, 1, 128]
    - [124, 0.0]
  - - [256, 1024, 1, 1280]
    - [69, 0.0]
  - - [704, 4, 1, 128]
    - [93, 0.0]
  - - [1408, 4, 1, 128]
    - [93, 0.0]
  - - [4288, 128, 1, 256]
    - [69, 0.0]
  - - [4288, 1856, 1, 3328]
    - [57, 0.0]
  - - [3584, 448, 1, 128]
    - [124, 0.0]
  - - [64, 4288, 1, 128]
    - [107, 0.0]
  - - [64, 448, 1, 3328]
    - [85, 0.0]
  - - [448, 4, 1, 3328]
    - [45, 0.0]
  - - [256, 4, 1, 3328]
    - [132, 0.0]
  - - [4, 1408, 1, 1280]
    - [164, 0.0]
  - - [3584, 64, 1, 1280]
    - [178, 0.0]
  - - [1408, 448, 1, 128]
    - [84, 0.0]
  - - [3584, 1024, 1, 1280]
    - [50, 0.0]
  - - [1856, 5056, 1, 256]
    - [160, 0.0]
  - - [4, 3584, 1, 256]
    - [65, 0.0]
  - - [6784, 4288, 1, 3328]
    - [76, 0.0]
  - - [4, 2944, 1, 1280]
    - [65, 0.0]
  - - [1024, 4288, 1, 256]
    - [46, 0.0]
  - - [5888, 3584, 1, 3328]
    - [53, 0.0]
  - - [1856, 4, 1, 256]
    - [134, 0.0]
  - - [4, 256, 1, 256]
    - [65, 0.0]
  - - [5056, 3584, 1, 3328]
    - [47, 0.0]
  - - [1408, 128, 1, 3328]
    - [103, 0.0]
  - - [4, 64, 1, 1280]
    - [132, 0.0]
  - - [2368, 1408, 1, 1280]
    - [46, 0.0]
  - - [5056, 2944, 1, 1280]
    - [57, 0.0]
  - - [8448, 6000, 1, 2816]
    - [51, 0.0]
  - - [4, 4, 1, 128]
    - [93, 0.0]
  - - [3584, 256, 1, 256]
    - [71, 0.0]
  - - [3584, 2944, 1, 1280]
    - [57, 0.0]
  - - [1024, 6784, 1, 256]
    - [76, 0.0]
  - - [4, 128, 1, 256]
    - [65, 0.0]
  - - [6784, 448, 1, 256]
    - [71, 0.0]
  - - [5124, 9124, 1, 2048]
    - [106, 0.0]
  - - [2944, 5056, 1, 3328]
    - [57, 0.0]
  - - [6784, 4, 1, 128]
    - [125, 0.0]
  - - [2944, 1408, 1, 128]
    - [172, 0.0]
  - - [448, 128, 1, 3328]
    - [102, 0.0]
  - - [64, 2944, 1, 3328]
    - [103, 0.0]
  - - [5056, 6784, 1, 3328]
    - [76, 0.0]
  - - [704, 2368, 1, 128]
    - [124, 0.0]
  - - [3072, 1500, 1, 1024]
    - [46, 0.0]
  - - [128, 2944, 1, 256]
    - [71, 0.0]
  - - [128, 6784, 1, 128]
    - [107, 0.0]
  - - [3584, 4288, 1, 256]
    - [76, 0.0]
  - - [448, 1856, 1, 256]
    - [138, 0.0]
  - - [1856, 6784, 1, 3328]
    - [51, 0.0]
  - - [3584, 128, 1, 3328]
    - [69, 0.0]
  - - [64, 1856, 1, 256]
    - [179, 0.0]
  - - [64, 448, 1, 256]
    - [146, 0.0]
  - - [5888, 4288, 1, 256]
    - [76, 0.0]
  - - [128, 1500, 1, 1280]
    - [67, 0.0]
  - - [5056, 1408, 1, 256]
    - [106, 0.0]
  - - [35, 8457, 1, 4096]
    - [154, 0.0]
  - - [64, 256, 1, 1280]
    - [82, 0.0]
  - - [2944, 4, 1, 128]
    - [125, 0.0]
  - - [3584, 1024, 1, 256]
    - [180, 0.0]
  - - [512, 6000, 1, 1536]
    - [51, 0.0]
  - - [256, 704, 1, 256]
    - [71, 0.0]
  - - [5888, 5888, 1, 256]
    - [50, 0.0]
  - - [4288, 1024, 1, 1280]
    - [76, 0.0]
  - - [5888, 128, 1, 3328]
    - [127, 0.0]
  - - [448, 6784, 1, 3328]
    - [71, 0.0]
  - - [2944, 1408, 1, 1280]
    - [57, 0.0]
  - - [3072, 6000, 1, 1024]
    - [54, 0.0]
  - - [1024, 32, 1, 512]
    - [163, 0.0]
  - - [2944, 1856, 1, 3328]
    - [47, 0.0]
  - - [2368, 64, 1, 128]
    - [107, 0.0]
  - - [256, 1024, 1, 128]
    - [42, 0.0]
  - - [3584, 5888, 1, 1280]
    - [76, 0.0]
  - - [64, 4, 1, 128]
    - [93, 0.0]
  - - [6784, 1856, 1, 1280]
    - [63, 0.0]
  - - [2944, 5056, 1, 256]
    - [76, 0.0]
  - - [5888, 256, 1, 3328]
    - [66, 0.0]
  - - [2944, 4288, 1, 128]
    - [115, 0.0]
  - - [3584, 1408, 1, 256]
    - [63, 0.0]
  - - [704, 3584, 1, 3328]
    - [69, 0.0]
  - - [5056, 448, 1, 1280]
    - [60, 0.0]
  - - [3584, 1856, 1, 3328]
    - [66, 0.0]
  - - [64, 1408, 1, 128]
    - [152, 0.0]
  - - [4288, 6784, 1, 1280]
    - [76, 0.0]
  - - [1024, 3000, 1, 2048]
    - [66, 0.0]
  - - [1408, 704, 1, 1280]
    - [46, 0.0]
  - - [2944, 1024, 1, 256]
    - [63, 0.0]
  - - [256, 64, 1, 128]
    - [61, 0.0]
  - - [2368, 4288, 1, 3328]
    - [106, 0.0]
  - - [4, 1408, 1, 256]
    - [65, 0.0]
  - - [1024, 1408, 1, 1280]
    - [62, 0.0]
  - - [64, 64, 1, 256]
    - [136, 0.0]
  - - [704, 256, 1, 3328]
    - [71, 0.0]
  - - [6784, 5056, 1, 256]
    - [60, 0.0]
  - - [1856, 1856, 1, 128]
    - [73, 0.0]
  - - [4288, 5888, 1, 256]
    - [54, 0.0]
  - - [4, 704, 1, 3328]
    - [45, 0.0]
  - - [35, 8457, 1, 2048]
    - [181, 0.0]
  - - [448, 2944, 1, 256]
    - [71, 0.0]
  - - [4, 4288, 1, 3328]
    - [45, 0.0]
  - - [2944, 6784, 1, 256]
    - [180, 0.0]
  - - [2944, 2944, 1, 128]
    - [42, 0.0]
  - - [4, 4, 1, 1280]
    - [45, 0.0]
  - - [1856, 3584, 1, 1280]
    - [57, 0.0]
  - - [64, 2944, 1, 256]
    - [71, 0.0]
  - - [3584, 1408, 1, 1280]
    - [50, 0.0]
  - - [448, 256, 1, 128]
    - [152, 0.0]
  - - [4288, 448, 1, 128]
    - [124, 0.0]
  - - [5056, 256, 1, 1280]
    - [46, 0.0]
  - - [1856, 1408, 1, 3328]
    - [106, 0.0]
  - - [128, 128, 1, 128]
    - [152, 0.0]
  - - [1024, 4288, 1, 3328]
    - [63, 0.0]
  - - [448, 2368, 1, 256]
    - [69, 0.0]
  - - [1024, 4, 1, 128]
    - [93, 0.0]
  - - [64, 1408, 1, 1280]
    - [101, 0.0]
  - - [64, 6784, 1, 1280]
    - [62, 0.0]
  - - [5056, 448, 1, 256]
    - [71, 0.0]
  - - [2944, 2368, 1, 3328]
    - [53, 0.0]
  - - [704, 4288, 1, 3328]
    - [71, 0.0]
  - - [1408, 128, 1, 256]
    - [71, 0.0]
  - - [1024, 1856, 1, 1280]
    - [63, 0.0]
  - - [6784, 1856, 1, 256]
    - [160, 0.0]
  - - [512, 48000, 1, 2816]
    - [57, 0.0]
  - - [512, 3000, 1, 2816]
    - [60, 0.0]
  - - [128, 2368, 1, 3328]
    - [112, 0.0]
  - - [1024, 5888, 1, 256]
    - [47, 0.0]
  - - [64, 2944, 1, 1280]
    - [67, 0.0]
  - - [6784, 1408, 1, 256]
    - [47, 0.0]
  - - [5056, 64, 1, 3328]
    - [112, 0.0]
  - - [128, 704, 1, 128]
    - [114, 0.0]
  - - [1408, 2368, 1, 256]
    - [71, 0.0]
  - - [1408, 1408, 1, 256]
    - [57, 0.0]
  - - [4, 64, 1, 128]
    - [125, 0.0]
  - - [64, 128, 1, 1280]
    - [166, 0.0]
  - - [1024, 8, 1, 500000]
    - [182, 0.0]
  - - [4, 2368, 1, 128]
    - [93, 0.0]
  - - [2368, 2368, 1, 128]
    - [73, 0.0]
  - - [64, 5888, 1, 128]
    - [61, 0.0]
  - - [5888, 4, 1, 3328]
    - [148, 0.0]
  - - [6784, 1408, 1, 128]
    - [42, 0.0]
  - - [1408, 5056, 1, 256]
    - [47, 0.0]
  - - [512, 50176, 1, 128]
    - [183, 0.0]
  - - [5056, 128, 1, 3328]
    - [52, 0.0]
  - - [128, 128, 1, 1280]
    - [135, 0.0]
  - - [512, 2, 1, 512]
    - [184, 0.0]
  - - [448, 704, 1, 256]
    - [69, 0.0]
  - - [4288, 3584, 1, 128]
    - [120, 0.0]
  - - [2944, 128, 1, 3328]
    - [52, 0.0]
  - - [128, 5056, 1, 1280]
    - [71, 0.0]
  - - [3584, 5056, 1, 1280]
    - [57, 0.0]
  - - [256, 448, 1, 1280]
    - [67, 0.0]
  - - [704, 704, 1, 128]
    - [73, 0.0]
  - - [5056, 4, 1, 128]
    - [125, 0.0]
  - - [704, 256, 1, 1280]
    - [69, 0.0]
  - - [64, 2368, 1, 3328]
    - [49, 0.0]
  - - [1856, 1024, 1, 128]
    - [73, 0.0]
  - - [1856, 64, 1, 128]
    - [61, 0.0]
  - - [4096, 64, 1, 4096]
    - [185, 0.0]
  - - [1024, 24000, 1, 1536]
    - [47, 0.0]
  - - [704, 4288, 1, 256]
    - [50, 0.0]
  - - [5888, 2368, 1, 1280]
    - [71, 0.0]
  - - [6784, 1856, 1, 3328]
    - [76, 0.0]
  - - [64, 128, 1, 256]
    - [136, 0.0]
  - - [2368, 5888, 1, 1280]
    - [63, 0.0]
  - - [5888, 256, 1, 1280]
    - [66, 0.0]
  - - [4, 5888, 1, 1280]
    - [65, 0.0]
  - - [704, 128, 1, 128]
    - [61, 0.0]
  - - [1024, 4, 1, 1280]
    - [81, 0.0]
  - - [2368, 1856, 1, 3328]
    - [66, 0.0]
  - - [2368, 128, 1, 128]
    - [107, 0.0]
  - - [2944, 704, 1, 256]
    - [66, 0.0]
  - - [5056, 128, 1, 128]
    - [111, 0.0]
  - - [2368, 1024, 1, 3328]
    - [71, 0.0]
  - - [35, 700, 1, 2048]
    - [181, 0.0]
  - - [256, 704, 1, 3328]
    - [71, 0.0]
  - - [704, 3584, 1, 256]
    - [60, 0.0]
  - - [704, 2944, 1, 3328]
    - [113, 0.0]
  - - [6784, 1024, 1, 128]
    - [73, 0.0]
  - - [256, 448, 1, 128]
    - [152, 0.0]
  - - [448, 1024, 1, 3328]
    - [69, 0.0]
  - - [2944, 1024, 1, 3328]
    - [46, 0.0]
  - - [2944, 5056, 1, 128]
    - [42, 0.0]
  - - [2368, 256, 1, 256]
    - [60, 0.0]
  - - [1408, 6784, 1, 256]
    - [180, 0.0]
  - - [6784, 1408, 1, 3328]
    - [46, 0.0]
  - - [4288, 6784, 1, 128]
    - [75, 0.0]
  - - [1408, 2944, 1, 128]
    - [170, 0.0]
  - - [704, 64, 1, 256]
    - [149, 0.0]
  - - [3072, 4, 1, 1024]
    - [80, 0.0]
  - - [256, 2368, 1, 3328]
    - [64, 0.0]
  - - [6784, 2944, 1, 1280]
    - [53, 0.0]
  - - [4288, 1856, 1, 128]
    - [124, 0.0]
  - - [1856, 2944, 1, 128]
    - [42, 0.0]
  - - [6784, 448, 1, 128]
    - [42, 0.0]
  - - [64, 3584, 1, 128]
    - [186, 0.0]
  - - [448, 5056, 1, 1280]
    - [46, 0.0]
  - - [4288, 5056, 1, 1280]
    - [57, 0.0]
  - - [2368, 1856, 1, 128]
    - [73, 0.0]
  - - [128, 448, 1, 1280]
    - [49, 0.0]
  - - [4288, 704, 1, 256]
    - [69, 0.0]
  - - [256, 3584, 1, 128]
    - [115, 0.0]
  - - [5888, 704, 1, 256]
    - [160, 0.0]
  - - [3584, 1024, 1, 128]
    - [58, 0.0]
  - - [256, 5888, 1, 3328]
    - [66, 0.0]
  - - [1408, 4288, 1, 3328]
    - [57, 0.0]
  - - [6784, 4288, 1, 256]
    - [46, 0.0]
  - - [4288, 256, 1, 128]
    - [119, 0.0]
  - - [448, 1856, 1, 3328]
    - [187, 0.0]
  - - [5888, 256, 1, 256]
    - [66, 0.0]
  - - [1024, 4, 1, 500000]
    - [188, 0.0]
  - - [6784, 1024, 1, 1280]
    - [57, 0.0]
  - - [5888, 1024, 1, 128]
    - [119, 0.0]
  - - [1024, 128, 1, 256]
    - [71, 0.0]
  - - [512, 16, 1, 500000]
    - [169, 0.0]
  - - [128, 64, 1, 3328]
    - [135, 0.0]
  - - [448, 64, 1, 256]
    - [82, 0.0]
  - - [2368, 256, 1, 128]
    - [73, 0.0]
  - - [6784, 3584, 1, 1280]
    - [57, 0.0]
  - - [1024, 6784, 1, 1280]
    - [86, 0.0]
  - - [2944, 64, 1, 1280]
    - [48, 0.0]
  - - [1408, 2944, 1, 1280]
    - [57, 0.0]
  - - [256, 1856, 1, 256]
    - [70, 0.0]
  - - [1408, 2368, 1, 3328]
    - [46, 0.0]
  - - [2944, 4, 1, 3328]
    - [151, 0.0]
  - - [128, 1408, 1, 3328]
    - [103, 0.0]
  - - [2944, 1856, 1, 128]
    - [42, 0.0]
  - - [256, 2944, 1, 128]
    - [170, 0.0]
  - - [256, 6784, 1, 128]
    - [59, 0.0]
  - - [2368, 4, 1, 128]
    - [93, 0.0]
  - - [1408, 256, 1, 3328]
    - [189, 0.0]
  - - [1856, 4, 1, 128]
    - [93, 0.0]
  - - [1024, 16, 1, 512]
    - [65, 0.0]
  - - [5056, 6784, 1, 128]
    - [115, 0.0]
  - - [4288, 5056, 1, 128]
    - [59, 0.0]
  - - [1856, 5888, 1, 128]
    - [124, 0.0]
  - - [7680, 2, 1, 2560]
    - [123, 0.0]
  - - [3584, 1856, 1, 256]
    - [47, 0.0]
  - - [4288, 3584, 1, 1280]
    - [47, 0.0]
  - - [2368, 448, 1, 256]
    - [160, 0.0]
  - - [4288, 256, 1, 3328]
    - [71, 0.0]
  - - [1856, 704, 1, 128]
    - [42, 0.0]
  - - [1408, 64, 1, 256]
    - [161, 0.0]
  - - [64, 1856, 1, 128]
    - [190, 0.0]
  - - [4, 256, 1, 128]
    - [125, 0.0]
  - - [512, 16, 1, 512]
    - [65, 0.0]
  - - [704, 5888, 1, 128]
    - [42, 0.0]
  - - [6784, 3584, 1, 128]
    - [119, 0.0]
  - - [1024, 64, 1, 256]
    - [191, 0.0]
  - - [64, 2368, 1, 256]
    - [71, 0.0]
  - - [5124, 1500, 1, 2048]
    - [54, 0.0]
  - - [4288, 5056, 1, 3328]
    - [76, 0.0]
  - - [4, 1856, 1, 1280]
    - [65, 0.0]
  - - [4288, 128, 1, 128]
    - [42, 0.0]
  - - [512, 2, 1, 500000]
    - [192, 0.0]
  - - [1408, 1408, 1, 128]
    - [115, 0.0]
  - - [7680, 16, 1, 2560]
    - [193, 0.0]
  - - [1856, 128, 1, 128]
    - [72, 0.0]
  - - [5056, 2368, 1, 256]
    - [180, 0.0]
  - - [4288, 704, 1, 3328]
    - [71, 0.0]
  - - [448, 3584, 1, 256]
    - [69, 0.0]
  - - [2368, 64, 1, 1280]
    - [67, 0.0]
  - - [2368, 1024, 1, 1280]
    - [92, 0.0]
  - - [2944, 1408, 1, 3328]
    - [66, 0.0]
  - - [6144, 1500, 1, 2560]
    - [104, 0.0]
  - - [4224, 1, 1, 128]
    - [146, 0.0]
  - - [1024, 1408, 1, 3328]
    - [62, 0.0]
  - - [2944, 5888, 1, 1280]
    - [50, 0.0]
  - - [8448, 2, 1, 2816]
    - [140, 0.0]
  - - [1408, 4, 1, 1280]
    - [164, 0.0]
  - - [5888, 3584, 1, 256]
    - [54, 0.0]
  - - [2368, 5056, 1, 128]
    - [59, 0.0]
  - - [1408, 1856, 1, 3328]
    - [46, 0.0]
  - - [4, 4, 1, 3328]
    - [45, 0.0]
  - - [5888, 5056, 1, 3328]
    - [54, 0.0]
  - - [7680, 6000, 1, 2560]
    - [50, 0.0]
  - - [6784, 1408, 1, 1280]
    - [46, 0.0]
  - - [4, 1024, 1, 1280]
    - [45, 0.0]
  - - [512, 3000, 1, 2560]
    - [46, 0.0]
  - - [704, 2944, 1, 256]
    - [69, 0.0]
  - - [4288, 64, 1, 256]
    - [69, 0.0]
  - - [6784, 5888, 1, 3328]
    - [54, 0.0]
  - - [2368, 4288, 1, 128]
    - [59, 0.0]
  - - [64, 4288, 1, 1280]
    - [49, 0.0]
  - - [6784, 64, 1, 1280]
    - [71, 0.0]
  - - [3584, 128, 1, 128]
    - [111, 0.0]
  - - [1024, 6784, 1, 128]
    - [42, 0.0]
  - - [1024, 1500, 1, 1536]
    - [95, 0.0]
  - - [1408, 64, 1, 3328]
    - [101, 0.0]
  - - [6784, 4, 1, 256]
    - [83, 0.0]
  - - [1408, 1408, 1, 1280]
    - [104, 0.0]
  - - [256, 2368, 1, 256]
    - [71, 0.0]
  - - [3072, 3000, 1, 1024]
    - [106, 0.0]
  - - [448, 4288, 1, 3328]
    - [51, 0.0]
  - - [2368, 1408, 1, 256]
    - [104, 0.0]
  - - [704, 2368, 1, 256]
    - [71, 0.0]
  - - [1024, 24000, 1, 2560]
    - [180, 0.0]
  - - [2944, 448, 1, 1280]
    - [66, 0.0]
  - - [5888, 2368, 1, 3328]
    - [47, 0.0]
  - - [1024, 256, 1, 128]
    - [194, 0.0]
  - - [5124, 9124, 1, 1760]
    - [53, 0.0]
  - - [448, 1408, 1, 1280]
    - [71, 0.0]
  - - [448, 1856, 1, 1280]
    - [66, 0.0]
  - - [4288, 448, 1, 1280]
    - [62, 0.0]
  - - [5888, 704, 1, 3328]
    - [69, 0.0]
  - - [4, 1856, 1, 128]
    - [93, 0.0]
  - - [5056, 256, 1, 128]
    - [59, 0.0]
  - - [1856, 256, 1, 128]
    - [42, 0.0]
  - - [128, 2368, 1, 256]
    - [71, 0.0]
  - - [704, 4, 1, 256]
    - [65, 0.0]
  - - [1024, 6784, 1, 3328]
    - [106, 0.0]
  - - [1408, 5888, 1, 128]
    - [42, 0.0]
  - - [4288, 4, 1, 128]
    - [125, 0.0]
  - - [512, 3136, 1, 2048]
    - [195, 0.0]
  - - [1408, 1024, 1, 256]
    - [71, 0.0]
  - - [128, 64, 1, 256]
    - [136, 0.0]
  - - [8448, 1500, 1, 2816]
    - [57, 0.0]
  - - [256, 704, 1, 128]
    - [42, 0.0]
  - - [2560, 7000, 1, 2560]
    - [138, 0.0]
  - - [5888, 64, 1, 1280]
    - [64, 0.0]
  - - [128, 4, 1, 3328]
    - [81, 0.0]
  - - [5056, 6784, 1, 1280]
    - [53, 0.0]
  - - [1024, 448, 1, 1280]
    - [69, 0.0]
  - - [704, 5056, 1, 3328]
    - [57, 0.0]
  - - [128, 5056, 1, 256]
    - [69, 0.0]
  - - [3584, 5056, 1, 3328]
    - [86, 0.0]
  - - [1856, 4, 1, 3328]
    - [132, 0.0]
  - - [4, 2944, 1, 128]
    - [125, 0.0]
  - - [2368, 2944, 1, 3328]
    - [47, 0.0]
  - - [448, 448, 1, 1280]
    - [196, 0.0]
  - - [128, 4, 1, 128]
    - [125, 0.0]
  - - [2368, 3584, 1, 256]
    - [47, 0.0]
  - - [4608, 3000, 1, 1536]
    - [76, 0.0]
  - - [1024, 256, 1, 1280]
    - [69, 0.0]
  - - [5056, 3584, 1, 1280]
    - [76, 0.0]
  - - [5124, 9124, 1, 4096]
    - [47, 0.0]
  - - [7680, 48000, 1, 2560]
    - [53, 0.0]
  - - [1856, 704, 1, 1280]
    - [71, 0.0]
  - - [1856, 2944, 1, 1280]
    - [106, 0.0]
  - - [4608, 1500, 1, 1536]
    - [69, 0.0]
  - - [1024, 48000, 1, 2816]
    - [51, 0.0]
  - - [5124, 9124, 1, 2560]
    - [54, 0.0]
  - - [128, 1024, 1, 256]
    - [179, 0.0]
  - - [2944, 1408, 1, 256]
    - [47, 0.0]
  - - [4288, 1408, 1, 3328]
    - [53, 0.0]
  - - [3584, 64, 1, 3328]
    - [197, 0.0]
  - - [5888, 2944, 1, 128]
    - [42, 0.0]
  - - [2944, 1024, 1, 128]
    - [119, 0.0]
  - - [128, 1, 1, 1024]
    - [89, 0.0]
  - - [5124, 700, 1, 2048]
    - [66, 0.0]
  - - [4, 4288, 1, 1280]
    - [65, 0.0]
  - - [6784, 5056, 1, 128]
    - [73, 0.0]
  - - [256, 1024, 1, 3328]
    - [69, 0.0]
  - - [3584, 4, 1, 256]
    - [110, 0.0]
  - - [1856, 64, 1, 3328]
    - [52, 0.0]
  - - [4, 128, 1, 3328]
    - [81, 0.0]
  - - [256, 12544, 1, 1024]
    - [195, 0.0]
  - - [5888, 1408, 1, 3328]
    - [53, 0.0]
  - - [448, 2944, 1, 128]
    - [42, 0.0]
  - - [2368, 1856, 1, 256]
    - [69, 0.0]
  - - [256, 5056, 1, 256]
    - [71, 0.0]
  - - [5056, 5056, 1, 128]
    - [124, 0.0]
  - - [448, 3584, 1, 3328]
    - [46, 0.0]
  - - [4, 5056, 1, 3328]
    - [45, 0.0]
  - - [256, 256, 1, 128]
    - [152, 0.0]
  - - [5888, 256, 1, 128]
    - [119, 0.0]
  - - [4, 5056, 1, 128]
    - [125, 0.0]
  - - [448, 256, 1, 256]
    - [149, 0.0]
  - - [704, 4, 1, 3328]
    - [164, 0.0]
  - - [1408, 256, 1, 256]
    - [71, 0.0]
  - - [3584, 1856, 1, 128]
    - [105, 0.0]
  - - [4288, 4288, 1, 128]
    - [42, 0.0]
  - - [1856, 1024, 1, 3328]
    - [54, 0.0]
  - - [1856, 4288, 1, 128]
    - [73, 0.0]
  - - [1024, 6000, 1, 2560]
    - [92, 0.0]
  - - [1024, 5056, 1, 256]
    - [57, 0.0]
  - - [5056, 5888, 1, 128]
    - [172, 0.0]
  - - [2368, 1408, 1, 3328]
    - [71, 0.0]
  - - [1024, 48000, 1, 1536]
    - [54, 0.0]
  - - [5888, 448, 1, 256]
    - [95, 0.0]
  - - [5888, 6784, 1, 128]
    - [115, 0.0]
  - - [2368, 4, 1, 3328]
    - [79, 0.0]
  - - [6784, 5056, 1, 1280]
    - [180, 0.0]
  - - [5056, 704, 1, 1280]
    - [57, 0.0]
  - - [1024, 48000, 1, 2560]
    - [54, 0.0]
  - - [4608, 32, 1, 1536]
    - [198, 0.0]
  - - [1024, 2368, 1, 128]
    - [141, 0.0]
  - - [128, 704, 1, 256]
    - [149, 0.0]
  - - [2368, 448, 1, 3328]
    - [69, 0.0]
  - - [128, 5888, 1, 3328]
    - [69, 0.0]
  - - [448, 128, 1, 1280]
    - [67, 0.0]
  - - [6784, 4, 1, 3328]
    - [83, 0.0]
  - - [4288, 4, 1, 1280]
    - [45, 0.0]
  - - [1024, 64, 1, 3328]
    - [49, 0.0]
  - - [3072, 48000, 1, 1024]
    - [116, 0.0]
  - - [256, 4, 1, 128]
    - [93, 0.0]
  - - [1024, 5888, 1, 128]
    - [120, 0.0]
  - - [3584, 5888, 1, 128]
    - [115, 0.0]
  - - [5056, 5888, 1, 256]
    - [54, 0.0]
  - - [2368, 1024, 1, 256]
    - [69, 0.0]
  - - [2944, 1856, 1, 256]
    - [47, 0.0]
  - - [1856, 6784, 1, 1280]
    - [69, 0.0]
  - - [64, 5056, 1, 128]
    - [107, 0.0]
  - - [64, 6784, 1, 128]
    - [107, 0.0]
  - - [448, 704, 1, 128]
    - [59, 0.0]
  - - [4, 1024, 1, 128]
    - [93, 0.0]
  - - [1408, 448, 1, 256]
    - [71, 0.0]
  - - [1408, 704, 1, 128]
    - [172, 0.0]
  - - [64, 256, 1, 3328]
    - [155, 0.0]
  - - [8448, 3000, 1, 2816]
    - [86, 0.0]
  - - [6784, 448, 1, 3328]
    - [71, 0.0]
  - - [5056, 1856, 1, 1280]
    - [63, 0.0]
  - - [1408, 1024, 1, 3328]
    - [106, 0.0]
  - - [2368, 256, 1, 3328]
    - [86, 0.0]
  - - [7680, 1500, 1, 2560]
    - [76, 0.0]
  - - [5888, 3584, 1, 1280]
    - [76, 0.0]
  - - [1856, 3584, 1, 3328]
    - [66, 0.0]
  - - [5888, 128, 1, 1280]
    - [71, 0.0]
  - - [1024, 2944, 1, 256]
    - [95, 0.0]
  - - [448, 6784, 1, 1280]
    - [92, 0.0]
  - - [256, 3584, 1, 1280]
    - [106, 0.0]
  - - [448, 128, 1, 128]
    - [61, 0.0]
  - - [704, 5056, 1, 256]
    - [69, 0.0]
  - - [3584, 1024, 1, 3328]
    - [106, 0.0]
  - - [2944, 1856, 1, 1280]
    - [54, 0.0]
  - - [128, 256, 1, 128]
    - [199, 0.0]
  - - [5056, 256, 1, 256]
    - [69, 0.0]
  - - [2944, 4288, 1, 3328]
    - [57, 0.0]
  - - [2368, 3584, 1, 3328]
    - [60, 0.0]
  - - [2944, 704, 1, 1280]
    - [69, 0.0]
  - - [128, 4, 1, 256]
    - [136, 0.0]
  - - [2944, 3584, 1, 1280]
    - [92, 0.0]
  - - [1856, 5888, 1, 1280]
    - [57, 0.0]
  - - [256, 256, 1, 1280]
    - [67, 0.0]
  - - [4608, 24000, 1, 1536]
    - [50, 0.0]
  - - [4288, 1408, 1, 256]
    - [63, 0.0]
  - - [3584, 64, 1, 256]
    - [69, 0.0]
  - - [64, 1856, 1, 3328]
    - [52, 0.0]
  - - [256, 1408, 1, 128]
    - [59, 0.0]
  - - [5888, 1408, 1, 128]
    - [170, 0.0]
  - - [4288, 2368, 1, 1280]
    - [51, 0.0]
  - - [4, 4288, 1, 256]
    - [148, 0.0]
  - - [256, 4288, 1, 128]
    - [42, 0.0]
  - - [256, 128, 1, 3328]
    - [85, 0.0]
  - - [512, 8, 1, 500000]
    - [200, 0.0]
  - - [6784, 2368, 1, 256]
    - [71, 0.0]
  - - [5888, 128, 1, 128]
    - [107, 0.0]
  - - [1408, 448, 1, 3328]
    - [69, 0.0]
  - - [1024, 24000, 1, 2816]
    - [180, 0.0]
  - - [704, 1024, 1, 1280]
    - [69, 0.0]
  - - [1856, 256, 1, 3328]
    - [71, 0.0]
  - - [1856, 2944, 1, 256]
    - [138, 0.0]
  - - [5056, 1024, 1, 128]
    - [115, 0.0]
  - - [64, 5888, 1, 1280]
    - [67, 0.0]
  - - [7680, 3000, 1, 2560]
    - [47, 0.0]
  - - [4224, 1500, 1, 176]
    - [69, 0.0]
  - - [5124, 700, 1, 2560]
    - [71, 0.0]
  - - [6784, 256, 1, 128]
    - [59, 0.0]
  - - [5888, 704, 1, 128]
    - [124, 0.0]
  - - [6784, 64, 1, 128]
    - [201, 0.0]
  - - [4, 448, 1, 1280]
    - [164, 0.0]
  - - [1024, 4288, 1, 1280]
    - [66, 0.0]
  - - [2368, 5056, 1, 3328]
    - [47, 0.0]
  - - [448, 4, 1, 128]
    - [125, 0.0]
  - - [4, 256, 1, 3328]
    - [132, 0.0]
  - - [4288, 1024, 1, 3328]
    - [69, 0.0]
  - - [6144, 48000, 1, 2560]
    - [54, 0.0]
  - - [1024, 5056, 1, 3328]
    - [57, 0.0]
  - - [1024, 1856, 1, 3328]
    - [54, 0.0]
  - - [704, 704, 1, 1280]
    - [69, 0.0]
  - - [128, 2368, 1, 1280]
    - [49, 0.0]
  - - [3584, 4, 1, 128]
    - [93, 0.0]
  - - [3584, 256, 1, 1280]
    - [108, 0.0]
  - - [4, 128, 1, 128]
    - [125, 0.0]
  - - [128, 4288, 1, 3328]
    - [202, 0.0]
  - - [5124, 1500, 1, 2560]
    - [47, 0.0]
  - - [3584, 128, 1, 1280]
    - [71, 0.0]
  - - [4, 256, 1, 1280]
    - [45, 0.0]
  - - [128, 704, 1, 3328]
    - [126, 0.0]
  - - [4288, 6784, 1, 256]
    - [63, 0.0]
  - - [3584, 2944, 1, 3328]
    - [66, 0.0]
  - - [128, 1856, 1, 256]
    - [71, 0.0]
  - - [64, 4288, 1, 256]
    - [71, 0.0]
  - - [4, 3584, 1, 3328]
    - [136, 0.0]
  - - [64, 4, 1, 3328]
    - [132, 0.0]
  - - [4, 64, 1, 3328]
    - [132, 0.0]
  - - [35, 700, 1, 2560]
    - [203, 0.0]
  - - [5888, 2944, 1, 256]
    - [53, 0.0]
  - - [4, 2368, 1, 256]
    - [65, 0.0]
  - - [1856, 64, 1, 256]
    - [179, 0.0]
  - - [5056, 128, 1, 1280]
    - [71, 0.0]
  - - [448, 4288, 1, 1280]
    - [64, 0.0]
  - - [256, 4288, 1, 256]
    - [71, 0.0]
  - - [1024, 4288, 1, 128]
    - [119, 0.0]
  - - [4, 1024, 1, 256]
    - [65, 0.0]
  - - [5056, 4288, 1, 256]
    - [76, 0.0]
  - - [1024, 448, 1, 256]
    - [69, 0.0]
  - - [1024, 3584, 1, 256]
    - [46, 0.0]
  - - [2944, 128, 1, 1280]
    - [69, 0.0]
  - - [2560, 32, 1, 2560]
    - [198, 0.0]
  - - [64, 256, 1, 256]
    - [146, 0.0]
  - - [1024, 4, 1, 512]
    - [82, 0.0]
  - - [128, 2368, 1, 128]
    - [204, 0.0]
  - - [256, 704, 1, 1280]
    - [71, 0.0]
  - - [64, 2368, 1, 128]
    - [114, 0.0]
  - - [176, 1500, 1, 1408]
    - [48, 0.0]
  - - [448, 5888, 1, 1280]
    - [69, 0.0]
  - - [512, 3000, 1, 2048]
    - [189, 0.0]
  - - [5056, 448, 1, 128]
    - [42, 0.0]
  - - [4288, 704, 1, 1280]
    - [71, 0.0]
  - - [3584, 2944, 1, 128]
    - [170, 0.0]
  - - [6784, 256, 1, 1280]
    - [71, 0.0]
  - - [256, 2944, 1, 1280]
    - [62, 0.0]
  - - [2560, 128, 1, 2560]
    - [103, 0.0]
  - - [2368, 5888, 1, 3328]
    - [46, 0.0]
  - - [4, 64, 1, 256]
    - [45, 0.0]
  - - [704, 1024, 1, 3328]
    - [62, 0.0]
  - - [2368, 1856, 1, 1280]
    - [113, 0.0]
  - - [448, 5056, 1, 3328]
    - [71, 0.0]
  - - [128, 448, 1, 128]
    - [156, 0.0]
  - - [128, 6784, 1, 256]
    - [69, 0.0]
  - - [512, 4, 1, 500000]
    - [205, 0.0]
  - - [3584, 4288, 1, 128]
    - [172, 0.0]
  - - [64, 448, 1, 128]
    - [156, 0.0]
  - - [1024, 6000, 1, 2816]
    - [47, 0.0]
  - - [5888, 4288, 1, 3328]
    - [47, 0.0]
  - - [2368, 704, 1, 256]
    - [62, 0.0]
  - - [256, 1856, 1, 3328]
    - [106, 0.0]
  - - [1856, 128, 1, 256]
    - [71, 0.0]
  - - [6784, 128, 1, 128]
    - [206, 0.0]
  - - [3584, 1408, 1, 128]
    - [172, 0.0]
  - - [1856, 5056, 1, 1280]
    - [57, 0.0]
  - - [2944, 1024, 1, 1280]
    - [53, 0.0]
  - - [5056, 4, 1, 256]
    - [110, 0.0]
  - - [3584, 5888, 1, 3328]
    - [53, 0.0]
  - - [2368, 4288, 1, 256]
    - [54, 0.0]
  - - [1024, 2368, 1, 3328]
    - [46, 0.0]
  - - [128, 3584, 1, 128]
    - [107, 0.0]
  - - [704, 1408, 1, 256]
    - [69, 0.0]
  - - [4096, 128, 1, 4096]
    - [189, 0.0]
  - - [1024, 2944, 1, 128]
    - [119, 0.0]
  - - [1024, 3584, 1, 1280]
    - [46, 0.0]
  - - [4288, 5888, 1, 3328]
    - [54, 0.0]
  - - [4288, 4, 1, 3328]
    - [44, 0.0]
  - - [4608, 16, 1, 1536]
    - [87, 0.0]
  - - [5888, 64, 1, 128]
    - [207, 0.0]
  - - [4, 5888, 1, 128]
    - [125, 0.0]
  - - [1024, 2944, 1, 3328]
    - [86, 0.0]
  - - [2048, 64, 1, 2048]
    - [208, 0.0]
  - - [6144, 2, 1, 2560]
    - [123, 0.0]
  - - [256, 6784, 1, 1280]
    - [63, 0.0]
  - - [1856, 3584, 1, 256]
    - [69, 0.0]
  - - [128, 448, 1, 3328]
    - [67, 0.0]
  - - [6784, 1856, 1, 128]
    - [84, 0.0]
  - - [1024, 1500, 1, 2048]
    - [69, 0.0]
  - - [5056, 128, 1, 256]
    - [69, 0.0]
  - - [512, 24000, 1, 2816]
    - [57, 0.0]
  - - [256, 5888, 1, 1280]
    - [92, 0.0]
  - - [4, 128, 1, 1280]
    - [45, 0.0]
  - - [4288, 6784, 1, 3328]
    - [54, 0.0]
  - - [6784, 128, 1, 1280]
    - [106, 0.0]
  - - [64, 1408, 1, 256]
    - [149, 0.0]
  - - [2368, 1408, 1, 128]
    - [42, 0.0]
  - - [1856, 448, 1, 256]
    - [95, 0.0]
  - - [1408, 1024, 1, 128]
    - [141, 0.0]
  - - [128, 64, 1, 128]
    - [74, 0.0]
  - - [6784, 3584, 1, 3328]
    - [53, 0.0]
  - - [1760, 7000, 1, 1760]
    - [46, 0.0]
  - - [1024, 704, 1, 3328]
    - [209, 0.0]
  - - [64, 64, 1, 128]
    - [114, 0.0]
  - - [2368, 5056, 1, 1280]
    - [130, 0.0]
  - - [64, 4, 1, 1280]
    - [45, 0.0]
  - - [1408, 2368, 1, 1280]
    - [46, 0.0]
  - - [128, 1408, 1, 1280]
    - [49, 0.0]
  - - [1024, 1, 1, 512]
    - [135, 0.0]
  - - [4, 1408, 1, 128]
    - [125, 0.0]
  - - [704, 4288, 1, 128]
    - [84, 0.0]
  - - [128, 1856, 1, 3328]
    - [210, 0.0]
  - - [2944, 2944, 1, 256]
    - [47, 0.0]
  - - [2944, 4, 1, 1280]
    - [65, 0.0]
  - - [5888, 4, 1, 256]
    - [136, 0.0]
  - - [6784, 256, 1, 256]
    - [69, 0.0]
  - - [256, 5056, 1, 3328]
    - [69, 0.0]
  - - [128, 4288, 1, 1280]
    - [71, 0.0]
  - - [5056, 1856, 1, 128]
    - [58, 0.0]
  - - [1024, 3000, 1, 1536]
    - [66, 0.0]
  - - [5056, 1024, 1, 3328]
    - [53, 0.0]
  - - [128, 128, 1, 256]
    - [211, 0.0]
  - - [1760, 64, 1, 1760]
    - [48, 0.0]
  - - [4288, 3584, 1, 3328]
    - [212, 0.0]
  - - [448, 704, 1, 3328]
    - [71, 0.0]
  - - [448, 448, 1, 128]
    - [145, 0.0]
  - - [1024, 2368, 1, 1280]
    - [69, 0.0]
  - - [1856, 704, 1, 3328]
    - [69, 0.0]
  - - [512, 1500, 1, 2560]
    - [92, 0.0]
  - - [5888, 6784, 1, 3328]
    - [53, 0.0]
  - - [704, 4288, 1, 1280]
    - [106, 0.0]
  - - [128, 50176, 1, 512]
    - [128, 0.0]
  - - [704, 256, 1, 256]
    - [71, 0.0]
  - - [1024, 48000, 1, 2048]
    - [46, 0.0]
  - - [4288, 1024, 1, 128]
    - [59, 0.0]
  - - [3136, 64, 128, 64]
    - [213, 0.0]
  - - [784, 128, 128, 512]
    - [214, 0.0]
  - - [784, 512, 256, 128]
    - [215, 0.0]
  - - [3136, 256, 256, 64]
    - [215, 0.0]
  - - [3136, 64, 128, 256]
    - [216, 0.0]
  - - [3136, 64, 256, 64]
    - [213, 0.0]
  - - [784, 512, 128, 128]
    - [215, 0.0]
  - - [784, 128, 256, 512]
    - [217, 0.0]
  - - [3136, 64, 256, 256]
    - [218, 0.0]
  - - [3136, 256, 128, 64]
    - [215, 0.0]
  - - [1024, 256, 1, 1024]
    - [219, 0.0]
  - - [1024, 512, 1, 2048]
    - [220, 0.0]
  - - [512, 200, 1, 512]
    - [221, 0.0]
  - - [4096, 256, 1, 2048]
    - [222, 0.0]
  - - [4096, 512, 1, 1024]
    - [223, 0.0]
  - - [1024, 200, 1, 1024]
    - [219, 0.0]
  - - [2048, 256, 1, 4096]
    - [224, 0.0]
  - - [2048, 768, 1, 512]
    - [225, 0.0]
  - - [512, 256, 1, 1024]
    - [226, 0.0]
  - - [512, 768, 1, 2048]
    - [227, 0.0]
  - - [2048, 256, 1, 1024]
    - [228, 0.0]
  - - [1024, 256, 1, 2048]
    - [229, 0.0]
  - - [2048, 200, 1, 512]
    - [228, 0.0]
  - - [4096, 200, 1, 1024]
    - [230, 0.0]
  - - [2048, 200, 1, 4096]
    - [231, 0.0]
  - - [2048, 512, 1, 1024]
    - [223, 0.0]
  - - [1024, 1024, 1, 512]
    - [230, 0.0]
  - - [1024, 200, 1, 4096]
    - [229, 0.0]
  - - [2048, 512, 1, 4096]
    - [232, 0.0]
  - - [4096, 512, 1, 2048]
    - [223, 0.0]
  - - [4096, 1024, 1, 2048]
    - [233, 0.0]
  - - [2048, 1024, 1, 2048]
    - [234, 0.0]
  - - [1024, 200, 1, 512]
    - [219, 0.0]
  - - [1024, 1024, 1, 4096]
    - [222, 0.0]
  - - [2048, 1024, 1, 4096]
    - [235, 0.0]
  - - [4096, 200, 1, 2048]
    - [236, 0.0]
  - - [2048, 200, 1, 1024]
    - [228, 0.0]
  - - [1024, 768, 1, 512]
    - [220, 0.0]
  - - [2048, 200, 1, 2048]
    - [228, 0.0]
  - - [2048, 256, 1, 2048]
    - [220, 0.0]
  - - [512, 768, 1, 512]
    - [237, 0.0]
  - - [512, 200, 1, 1024]
    - [219, 0.0]
  - - [4096, 1024, 1, 1024]
    - [233, 0.0]
  - - [4096, 256, 1, 4096]
    - [232, 0.0]
  - - [1024, 512, 1, 512]
    - [220, 0.0]
  - - [512, 256, 1, 512]
    - [238, 0.0]
  - - [1024, 256, 1, 4096]
    - [229, 0.0]
  - - [1024, 200, 1, 2048]
    - [239, 0.0]
  - - [2048, 1024, 1, 512]
    - [240, 0.0]
  - - [1024, 1024, 1, 2048]
    - [230, 0.0]
  - - [4096, 256, 1, 1024]
    - [230, 0.0]
  - - [512, 768, 1, 1024]
    - [237, 0.0]
  - - [1024, 512, 1, 4096]
    - [241, 0.0]
  - - [1024, 256, 1, 512]
    - [242, 0.0]
  - - [4096, 200, 1, 4096]
    - [224, 0.0]
  - - [2048, 256, 1, 512]
    - [224, 0.0]
  - - [512, 200, 1, 2048]
    - [221, 0.0]
  - - [1024, 1024, 1, 1024]
    - [222, 0.0]
  - - [4096, 1024, 1, 4096]
    - [234, 0.0]
  - - [2048, 1024, 1, 1024]
    - [240, 0.0]
  - - [4096, 384, 1, 2048]
    - [243, 0.0]
  - - [4096, 192, 1, 2048]
    - [244, 0.0]
  - - [1225, 192, 64, 384]
    - [245, 0.0]
  - - [5329, 64, 64, 160]
    - [246, 0.0]
  - - [1225, 64, 64, 384]
    - [247, 0.0]
  - - [289, 128, 64, 1024]
    - [248, 0.0]
  - - [4096, 320, 1, 1280]
    - [249, 0.0]
  - - [4096, 384, 1, 1536]
    - [250, 0.0]
  - - [4096, 192, 1, 1280]
    - [251, 0.0]
  - - [289, 192, 64, 1024]
    - [252, 0.0]
  - - [1225, 96, 64, 384]
    - [253, 0.0]
  - - [4096, 320, 1, 2048]
    - [254, 0.0]
  - - [4096, 256, 1, 1536]
    - [255, 0.0]
  - - [4096, 384, 1, 1280]
    - [256, 0.0]
  - - [4096, 448, 1, 1280]
    - [254, 0.0]
  - - [289, 256, 64, 1024]
    - [257, 0.0]
  - - [4096, 448, 1, 2048]
    - [254, 0.0]
  - - [289, 384, 64, 1024]
    - [258, 0.0]
  - - [1024, 3594, 1, 4096]
    - [259, 0.0]
  - - [4096, 3103, 1, 1024]
    - [260, 0.0]
  - - [4096, 3136, 1, 1024]
    - [261, 0.0]
  - - [1024, 3141, 1, 4096]
    - [262, 0.0]
  - - [64, 147, 432, 148]
    - [263, 0.0]
  - - [4096, 3559, 1, 1024]
    - [264, 0.0]
  - - [4096, 3368, 1, 1024]
    - [261, 0.0]
  - - [1024, 3335, 1, 4096]
    - [265, 0.0]
  - - [1024, 3510, 1, 4096]
    - [265, 0.0]
  - - [4096, 3209, 1, 1024]
    - [264, 0.0]
  - - [4096, 3322, 1, 1024]
    - [266, 0.0]
  - - [1024, 3400, 1, 4096]
    - [267, 0.0]
  - - [1024, 3995, 1, 4096]
    - [259, 0.0]
  - - [1024, 3503, 1, 4096]
    - [265, 0.0]
  - - [4096, 3594, 1, 1024]
    - [268, 0.0]
  - - [4096, 3473, 1, 1024]
    - [266, 0.0]
  - - [4096, 3522, 1, 1024]
    - [264, 0.0]
  - - [1024, 3103, 1, 4096]
    - [269, 0.0]
  - - [1024, 3214, 1, 4096]
    - [267, 0.0]
  - - [4096, 3449, 1, 1024]
    - [268, 0.0]
  - - [1024, 3136, 1, 4096]
    - [265, 0.0]
  - - [1024, 3955, 1, 33708]
    - [266, 0.0]
  - - [1024, 3780, 1, 4096]
    - [270, 0.0]
  - - [1024, 3906, 1, 33708]
    - [264, 0.0]
  - - [1024, 3386, 1, 4096]
    - [265, 0.0]
  - - [4096, 3396, 1, 1024]
    - [268, 0.0]
  - - [1024, 3183, 1, 4096]
    - [269, 0.0]
  - - [1024, 3098, 1, 4096]
    - [262, 0.0]
  - - [1024, 3548, 1, 4096]
    - [265, 0.0]
  - - [1024, 3224, 1, 4096]
    - [271, 0.0]
  - - [4096, 3469, 1, 1024]
    - [266, 0.0]
  - - [1024, 3582, 1, 4096]
    - [272, 0.0]
  - - [1024, 2977, 1, 4096]
    - [259, 0.0]
  - - [1024, 3939, 1, 1024]
    - [273, 0.0]
  - - [64, 123, 528, 123]
    - [274, 0.0]
  - - [64, 12, 5040, 12]
    - [275, 0.0]
  - - [4096, 3176, 1, 1024]
    - [260, 0.0]
  - - [1024, 3559, 1, 4096]
    - [276, 0.0]
  - - [1024, 3478, 1, 4096]
    - [265, 0.0]
  - - [4096, 3343, 1, 1024]
    - [261, 0.0]
  - - [4096, 3440, 1, 1024]
    - [261, 0.0]
  - - [1024, 3996, 1, 33708]
    - [266, 0.0]
  - - [1024, 4012, 1, 4096]
    - [264, 0.0]
  - - [1024, 3322, 1, 4096]
    - [265, 0.0]
  - - [1024, 3990, 1, 33708]
    - [266, 0.0]
  - - [1024, 3314, 1, 4096]
    - [265, 0.0]
  - - [4096, 3513, 1, 1024]
    - [266, 0.0]
  - - [1024, 3562, 1, 4096]
    - [265, 0.0]
  - - [1024, 3443, 1, 4096]
    - [265, 0.0]
  - - [1024, 3554, 1, 4096]
    - [272, 0.0]
  - - [1024, 3063, 1, 4096]
    - [259, 0.0]
  - - [64, 111, 576, 112]
    - [274, 0.0]
  - - [4096, 3460, 1, 1024]
    - [266, 0.0]
  - - [1024, 3209, 1, 4096]
    - [273, 0.0]
  - - [1024, 3147, 1, 4096]
    - [265, 0.0]
  - - [4096, 3387, 1, 1024]
    - [277, 0.0]
  - - [4096, 3436, 1, 1024]
    - [261, 0.0]
  - - [1024, 3341, 1, 4096]
    - [267, 0.0]
  - - [1024, 3516, 1, 4096]
    - [267, 0.0]
  - - [4096, 3277, 1, 1024]
    - [266, 0.0]
  - - [1024, 3454, 1, 4096]
    - [265, 0.0]
  - - [1024, 3969, 1, 4096]
    - [266, 0.0]
  - - [1024, 3999, 1, 4096]
    - [264, 0.0]
  - - [1024, 4032, 1, 4096]
    - [259, 0.0]
  - - [4096, 3541, 1, 1024]
    - [264, 0.0]
  - - [4096, 3334, 1, 1024]
    - [260, 0.0]
  - - [1024, 3365, 1, 4096]
    - [265, 0.0]
  - - [1024, 3527, 1, 4096]
    - [265, 0.0]
  - - [1024, 3190, 1, 4096]
    - [267, 0.0]
  - - [4096, 3906, 1, 1024]
    - [277, 0.0]
  - - [1024, 3593, 1, 4096]
    - [259, 0.0]
  - - [1024, 3336, 1, 4096]
    - [265, 0.0]
  - - [4096, 3504, 1, 1024]
    - [266, 0.0]
  - - [4096, 3977, 1, 1024]
    - [264, 0.0]
  - - [1024, 3906, 1, 4096]
    - [264, 0.0]
  - - [4096, 3415, 1, 1024]
    - [268, 0.0]
  - - [1024, 3295, 1, 4096]
    - [267, 0.0]
  - - [4096, 3321, 1, 1024]
    - [264, 0.0]
  - - [1024, 3072, 1, 4096]
    - [259, 0.0]
  - - [1024, 3408, 1, 4096]
    - [267, 0.0]
  - - [1024, 3522, 1, 4096]
    - [265, 0.0]
  - - [4096, 3751, 1, 1024]
    - [264, 0.0]
  - - [4096, 3378, 1, 1024]
    - [268, 0.0]
  - - [64, 77, 816, 77]
    - [278, 0.0]
  - - [1024, 3925, 1, 33708]
    - [266, 0.0]
  - - [1024, 3990, 1, 1024]
    - [259, 0.0]
  - - [1024, 3290, 1, 4096]
    - [271, 0.0]
  - - [4096, 3500, 1, 1024]
    - [264, 0.0]
  - - [4096, 3565, 1, 1024]
    - [266, 0.0]
  - - [1024, 3484, 1, 4096]
    - [267, 0.0]
  - - [4096, 3395, 1, 1024]
    - [260, 0.0]
  - - [64, 92, 688, 92]
    - [279, 0.0]
  - - [1024, 3681, 1, 1024]
    - [280, 0.0]
  - - [64, 159, 400, 159]
    - [281, 0.0]
  - - [1024, 3584, 1, 1024]
    - [267, 0.0]
  - - [4096, 3093, 1, 1024]
    - [268, 0.0]
  - - [1024, 4050, 1, 1024]
    - [270, 0.0]
  - - [1024, 3301, 1, 4096]
    - [265, 0.0]
  - - [1024, 3581, 1, 4096]
    - [267, 0.0]
  - - [4096, 3374, 1, 1024]
    - [260, 0.0]
  - - [1024, 3449, 1, 4096]
    - [265, 0.0]
  - - [4096, 3215, 1, 1024]
    - [264, 0.0]
  - - [4096, 3312, 1, 1024]
    - [264, 0.0]
  - - [4096, 3479, 1, 1024]
    - [264, 0.0]
  - - [4096, 3544, 1, 1024]
    - [264, 0.0]
  - - [1024, 3263, 1, 4096]
    - [265, 0.0]
  - - [4096, 3455, 1, 1024]
    - [268, 0.0]
  - - [1024, 3379, 1, 4096]
    - [272, 0.0]
  - - [1024, 3490, 1, 4096]
    - [265, 0.0]
  - - [1024, 3368, 1, 4096]
    - [265, 0.0]
  - - [4096, 3186, 1, 1024]
    - [261, 0.0]
  - - [1024, 3428, 1, 4096]
    - [265, 0.0]
  - - [64, 85, 752, 84]
    - [282, 0.0]
  - - [4096, 3561, 1, 1024]
    - [264, 0.0]
  - - [4096, 3418, 1, 1024]
    - [268, 0.0]
  - - [1024, 3064, 1, 4096]
    - [259, 0.0]
  - - [4096, 3259, 1, 1024]
    - [264, 0.0]
  - - [4096, 3308, 1, 1024]
    - [266, 0.0]
  - - [1024, 3533, 1, 4096]
    - [265, 0.0]
  - - [1024, 3344, 1, 4096]
    - [265, 0.0]
  - - [1024, 4030, 1, 1024]
    - [259, 0.0]
  - - [4096, 3459, 1, 1024]
    - [264, 0.0]
  - - [1024, 3572, 1, 4096]
    - [272, 0.0]
  - - [1024, 3925, 1, 1024]
    - [271, 0.0]
  - - [4096, 3435, 1, 1024]
    - [261, 0.0]
  - - [1024, 3956, 1, 4096]
    - [270, 0.0]
  - - [1024, 3463, 1, 4096]
    - [265, 0.0]
  - - [4096, 3182, 1, 1024]
    - [268, 0.0]
  - - [4096, 3976, 1, 1024]
    - [268, 0.0]
  - - [1024, 3417, 1, 4096]
    - [265, 0.0]
  - - [1024, 3528, 1, 4096]
    - [265, 0.0]
  - - [4096, 3446, 1, 1024]
    - [268, 0.0]
  - - [64, 122, 528, 123]
    - [274, 0.0]
  - - [1024, 3543, 1, 4096]
    - [265, 0.0]
  - - [4096, 3287, 1, 1024]
    - [266, 0.0]
  - - [1024, 3499, 1, 4096]
    - [265, 0.0]
  - - [1024, 3231, 1, 4096]
    - [271, 0.0]
  - - [64, 17, 3632, 17]
    - [282, 0.0]
  - - [4096, 3519, 1, 1024]
    - [266, 0.0]
  - - [4096, 3552, 1, 1024]
    - [266, 0.0]
  - - [1024, 3458, 1, 4096]
    - [265, 0.0]
  - - [64, 93, 688, 92]
    - [279, 0.0]
  - - [1024, 3374, 1, 4096]
    - [262, 0.0]
  - - [1024, 3396, 1, 4096]
    - [265, 0.0]
  - - [1024, 2967, 1, 4096]
    - [259, 0.0]
  - - [64, 19, 3264, 19]
    - [279, 0.0]
  - - [4096, 3482, 1, 1024]
    - [266, 0.0]
  - - [64, 32, 1984, 32]
    - [283, 0.0]
  - - [64, 102, 624, 99]
    - [284, 0.0]
  - - [1024, 3226, 1, 4096]
    - [273, 0.0]
  - - [4096, 3377, 1, 1024]
    - [277, 0.0]
  - - [4096, 3426, 1, 1024]
    - [260, 0.0]
  - - [4096, 2935, 1, 1024]
    - [260, 0.0]
  - - [64, 133, 480, 133]
    - [285, 0.0]
  - - [1024, 3439, 1, 4096]
    - [265, 0.0]
  - - [4096, 3267, 1, 1024]
    - [266, 0.0]
  - - [4096, 3499, 1, 1024]
    - [264, 0.0]
  - - [4096, 3356, 1, 1024]
    - [260, 0.0]
  - - [64, 232, 272, 232]
    - [286, 0.0]
  - - [64, 162, 400, 159]
    - [287, 0.0]
  - - [4096, 3939, 1, 1024]
    - [268, 0.0]
  - - [1024, 3526, 1, 4096]
    - [265, 0.0]
  - - [1024, 3859, 1, 33708]
    - [264, 0.0]
  - - [1024, 3385, 1, 4096]
    - [267, 0.0]
  - - [1024, 3496, 1, 4096]
    - [265, 0.0]
  - - [4096, 3141, 1, 1024]
    - [260, 0.0]
  - - [4096, 3510, 1, 1024]
    - [266, 0.0]
  - - [1024, 3434, 1, 4096]
    - [265, 0.0]
  - - [4096, 3969, 1, 1024]
    - [266, 0.0]
  - - [1024, 3121, 1, 4096]
    - [269, 0.0]
  - - [1024, 3232, 1, 4096]
    - [265, 0.0]
  - - [1024, 4030, 1, 33708]
    - [264, 0.0]
  - - [1024, 3780, 1, 33708]
    - [288, 0.0]
  - - [1024, 3969, 1, 1024]
    - [269, 0.0]
  - - [4096, 3527, 1, 1024]
    - [266, 0.0]
  - - [4096, 3336, 1, 1024]
    - [277, 0.0]
  - - [4096, 3290, 1, 1024]
    - [266, 0.0]
  - - [64, 9, 6544, 9]
    - [289, 0.0]
  - - [1024, 3469, 1, 4096]
    - [265, 0.0]
  - - [4096, 3490, 1, 1024]
    - [266, 0.0]
  - - [4096, 3064, 1, 1024]
    - [266, 0.0]
  - - [4096, 3582, 1, 1024]
    - [264, 0.0]
  - - [1024, 3956, 1, 1024]
    - [269, 0.0]
  - - [4096, 3417, 1, 1024]
    - [261, 0.0]
  - - [1024, 2736, 1, 4096]
    - [259, 0.0]
  - - [64, 78, 816, 78]
    - [279, 0.0]
  - - [1024, 3205, 1, 4096]
    - [262, 0.0]
  - - [1024, 3143, 1, 4096]
    - [262, 0.0]
  - - [1024, 4020, 1, 4096]
    - [259, 0.0]
  - - [1024, 3318, 1, 4096]
    - [273, 0.0]
  - - [4096, 3364, 1, 1024]
    - [260, 0.0]
  - - [1024, 3353, 1, 4096]
    - [265, 0.0]
  - - [1024, 3464, 1, 4096]
    - [265, 0.0]
  - - [4096, 3205, 1, 1024]
    - [266, 0.0]
  - - [4096, 3318, 1, 1024]
    - [264, 0.0]
  - - [1024, 3402, 1, 4096]
    - [267, 0.0]
  - - [4096, 3181, 1, 1024]
    - [268, 0.0]
  - - [4096, 3550, 1, 1024]
    - [264, 0.0]
  - - [4096, 3445, 1, 1024]
    - [268, 0.0]
  - - [1024, 3138, 1, 4096]
    - [277, 0.0]
  - - [64, 99, 624, 99]
    - [274, 0.0]
  - - [4096, 3079, 1, 1024]
    - [277, 0.0]
  - - [4096, 3144, 1, 1024]
    - [268, 0.0]
  - - [4096, 3860, 1, 1024]
    - [260, 0.0]
  - - [1024, 3515, 1, 4096]
    - [265, 0.0]
  - - [4096, 3408, 1, 1024]
    - [277, 0.0]
  - - [64, 101, 624, 102]
    - [274, 0.0]
  - - [1024, 3181, 1, 4096]
    - [273, 0.0]
  - - [4096, 3298, 1, 1024]
    - [264, 0.0]
  - - [4096, 3585, 1, 1024]
    - [268, 0.0]
  - - [1024, 3550, 1, 4096]
    - [265, 0.0]
  - - [1024, 4020, 1, 1024]
    - [270, 0.0]
  - - [4096, 3481, 1, 1024]
    - [264, 0.0]
  - - [4096, 3530, 1, 1024]
    - [264, 0.0]
  - - [4096, 3425, 1, 1024]
    - [277, 0.0]
  - - [4096, 4026, 1, 1024]
    - [264, 0.0]
  - - [1024, 3860, 1, 1024]
    - [262, 0.0]
  - - [4096, 3975, 1, 1024]
    - [264, 0.0]
  - - [1024, 3286, 1, 4096]
    - [269, 0.0]
  - - [1024, 3176, 1, 4096]
    - [269, 0.0]
  - - [1024, 3894, 1, 4096]
    - [259, 0.0]
  - - [4096, 3355, 1, 1024]
    - [268, 0.0]
  - - [4096, 3404, 1, 1024]
    - [268, 0.0]
  - - [1024, 3501, 1, 4096]
    - [267, 0.0]
  - - [4096, 3245, 1, 1024]
    - [264, 0.0]
  - - [1024, 3431, 1, 4096]
    - [272, 0.0]
  - - [1024, 4000, 1, 1024]
    - [271, 0.0]
  - - [4096, 3509, 1, 1024]
    - [266, 0.0]
  - - [4096, 3558, 1, 1024]
    - [264, 0.0]
  - - [1024, 3535, 1, 4096]
    - [267, 0.0]
  - - [1024, 3414, 1, 4096]
    - [272, 0.0]
  - - [1024, 3445, 1, 4096]
    - [265, 0.0]
  - - [1024, 3436, 1, 4096]
    - [265, 0.0]
  - - [4096, 3472, 1, 1024]
    - [264, 0.0]
  - - [1024, 3211, 1, 4096]
    - [273, 0.0]
  - - [64, 7, 8192, 7]
    - [290, 0.0]
  - - [4096, 3383, 1, 1024]
    - [268, 0.0]
  - - [4096, 3448, 1, 1024]
    - [260, 0.0]
  - - [1024, 3343, 1, 4096]
    - [271, 0.0]
  - - [1024, 3518, 1, 4096]
    - [265, 0.0]
  - - [4096, 3289, 1, 1024]
    - [264, 0.0]
  - - [1024, 3440, 1, 4096]
    - [276, 0.0]
  - - [1024, 4032, 1, 33708]
    - [266, 0.0]
  - - [4096, 3489, 1, 1024]
    - [266, 0.0]
  - - [4096, 3346, 1, 1024]
    - [277, 0.0]
  - - [1024, 3534, 1, 4096]
    - [267, 0.0]
  - - [1024, 3079, 1, 4096]
    - [262, 0.0]
  - - [1024, 3955, 1, 4096]
    - [264, 0.0]
  - - [4096, 3236, 1, 1024]
    - [264, 0.0]
  - - [1024, 3545, 1, 4096]
    - [267, 0.0]
  - - [1024, 3144, 1, 4096]
    - [271, 0.0]
  - - [4096, 3780, 1, 1024]
    - [266, 0.0]
  - - [4096, 3163, 1, 1024]
    - [268, 0.0]
  - - [4096, 3468, 1, 1024]
    - [264, 0.0]
  - - [1024, 3539, 1, 4096]
    - [265, 0.0]
  - - [1024, 3541, 1, 4096]
    - [265, 0.0]
  - - [4096, 3363, 1, 1024]
    - [261, 0.0]
  - - [1024, 3475, 1, 4096]
    - [265, 0.0]
  - - [4096, 3110, 1, 1024]
    - [260, 0.0]
  - - [1024, 3509, 1, 4096]
    - [267, 0.0]
  - - [1024, 3413, 1, 4096]
    - [265, 0.0]
  - - [1024, 3975, 1, 1024]
    - [269, 0.0]
  - - [4096, 3549, 1, 1024]
    - [264, 0.0]
  - - [4096, 3342, 1, 1024]
    - [268, 0.0]
  - - [1024, 2985, 1, 4096]
    - [264, 0.0]
  - - [1024, 3876, 1, 33708]
    - [266, 0.0]
  - - [4096, 3280, 1, 1024]
    - [266, 0.0]
  - - [4096, 3191, 1, 1024]
    - [260, 0.0]
  - - [4096, 3512, 1, 1024]
    - [264, 0.0]
  - - [1024, 3560, 1, 4096]
    - [272, 0.0]
  - - [4096, 2499, 1, 1024]
    - [264, 0.0]
  - - [1024, 3248, 1, 4096]
    - [269, 0.0]
  - - [4096, 3423, 1, 1024]
    - [260, 0.0]
  - - [64, 111, 576, 111]
    - [274, 0.0]
  - - [4096, 3297, 1, 1024]
    - [266, 0.0]
  - - [4096, 3154, 1, 1024]
    - [260, 0.0]
  - - [1024, 3303, 1, 4096]
    - [273, 0.0]
  - - [1024, 3222, 1, 4096]
    - [267, 0.0]
  - - [1024, 3978, 1, 1024]
    - [270, 0.0]
  - - [4096, 3529, 1, 1024]
    - [264, 0.0]
  - - [4096, 3386, 1, 1024]
    - [268, 0.0]
  - - [64, 134, 480, 134]
    - [291, 0.0]
  - - [1024, 3451, 1, 4096]
    - [272, 0.0]
  - - [4096, 3562, 1, 1024]
    - [264, 0.0]
  - - [4096, 3276, 1, 1024]
    - [266, 0.0]
  - - [64, 135, 480, 132]
    - [286, 0.0]
  - - [1024, 3894, 1, 33708]
    - [266, 0.0]
  - - [64, 134, 480, 132]
    - [292, 0.0]
  - - [4096, 3540, 1, 1024]
    - [264, 0.0]
  - - [1024, 3416, 1, 4096]
    - [267, 0.0]
  - - [1024, 4005, 1, 33708]
    - [266, 0.0]
  - - [1024, 3942, 1, 4096]
    - [270, 0.0]
  - - [4096, 3403, 1, 1024]
    - [268, 0.0]
  - - [4096, 3381, 1, 1024]
    - [260, 0.0]
  - - [1024, 3492, 1, 4096]
    - [276, 0.0]
  - - [4096, 3101, 1, 1024]
    - [260, 0.0]
  - - [1024, 3430, 1, 4096]
    - [265, 0.0]
  - - [1024, 3977, 1, 4096]
    - [270, 0.0]
  - - [1024, 3640, 1, 4096]
    - [259, 0.0]
  - - [4096, 3557, 1, 1024]
    - [264, 0.0]
  - - [4096, 3414, 1, 1024]
    - [277, 0.0]
  - - [1024, 3391, 1, 4096]
    - [265, 0.0]
  - - [64, 134, 480, 135]
    - [263, 0.0]
  - - [64, 16, 3840, 16]
    - [293, 0.0]
  - - [1024, 3356, 1, 4096]
    - [265, 0.0]
  - - [4096, 3320, 1, 1024]
    - [264, 0.0]
  - - [4096, 2765, 1, 1024]
    - [264, 0.0]
  - - [64, 162, 400, 162]
    - [294, 0.0]
  - - [1024, 3411, 1, 4096]
    - [265, 0.0]
  - - [1024, 3978, 1, 4096]
    - [266, 0.0]
  - - [4096, 3487, 1, 1024]
    - [264, 0.0]
  - - [4096, 3520, 1, 1024]
    - [266, 0.0]
  - - [4096, 3942, 1, 1024]
    - [268, 0.0]
  - - [4096, 3431, 1, 1024]
    - [261, 0.0]
  - - [1024, 3271, 1, 4096]
    - [271, 0.0]
  - - [4096, 4020, 1, 1024]
    - [266, 0.0]
  - - [1024, 3481, 1, 4096]
    - [276, 0.0]
  - - [1024, 3419, 1, 4096]
    - [267, 0.0]
  - - [1024, 4059, 1, 4096]
    - [270, 0.0]
  - - [4096, 3345, 1, 1024]
    - [260, 0.0]
  - - [4096, 3394, 1, 1024]
    - [260, 0.0]
  - - [1024, 3298, 1, 4096]
    - [267, 0.0]
  - - [4096, 3235, 1, 1024]
    - [264, 0.0]
  - - [1024, 3681, 1, 33708]
    - [295, 0.0]
  - - [1024, 3362, 1, 4096]
    - [265, 0.0]
  - - [4096, 3467, 1, 1024]
    - [266, 0.0]
  - - [1024, 3349, 1, 4096]
    - [265, 0.0]
  - - [1024, 3460, 1, 4096]
    - [265, 0.0]
  - - [4096, 3214, 1, 1024]
    - [264, 0.0]
  - - [1024, 3398, 1, 4096]
    - [265, 0.0]
  - - [4096, 3478, 1, 1024]
    - [266, 0.0]
  - - [1024, 4050, 1, 33708]
    - [266, 0.0]
  - - [1024, 3244, 1, 4096]
    - [276, 0.0]
  - - [4096, 3341, 1, 1024]
    - [260, 0.0]
  - - [4096, 3454, 1, 1024]
    - [277, 0.0]
  - - [1024, 3166, 1, 4096]
    - [262, 0.0]
  - - [1024, 3425, 1, 4096]
    - [265, 0.0]
  - - [4096, 3295, 1, 1024]
    - [264, 0.0]
  - - [4096, 3072, 1, 1024]
    - [266, 0.0]
  - - [4096, 3822, 1, 1024]
    - [264, 0.0]
  - - [1024, 3681, 1, 4096]
    - [259, 0.0]
  - - [1024, 4050, 1, 4096]
    - [259, 0.0]
  - - [4096, 3495, 1, 1024]
    - [266, 0.0]
  - - [4096, 3560, 1, 1024]
    - [264, 0.0]
  - - [1024, 3524, 1, 4096]
    - [267, 0.0]
  - - [1024, 3942, 1, 33708]
    - [266, 0.0]
  - - [1024, 3304, 1, 4096]
    - [273, 0.0]
  - - [1024, 3387, 1, 4096]
    - [265, 0.0]
  - - [1024, 3498, 1, 4096]
    - [267, 0.0]
  - - [4096, 3458, 1, 1024]
    - [266, 0.0]
  - - [4096, 2967, 1, 1024]
    - [266, 0.0]
  - - [64, 8, 7280, 8]
    - [296, 0.0]
  - - [4096, 3385, 1, 1024]
    - [261, 0.0]
  - - [4096, 3434, 1, 1024]
    - [268, 0.0]
  - - [1024, 3519, 1, 4096]
    - [265, 0.0]
  - - [1024, 3511, 1, 4096]
    - [265, 0.0]
  - - [1024, 3288, 1, 4096]
    - [267, 0.0]
  - - [1024, 2918, 1, 4096]
    - [259, 0.0]
  - - [4096, 3573, 1, 1024]
    - [264, 0.0]
  - - [1024, 3822, 1, 33708]
    - [297, 0.0]
  - - [64, 102, 624, 102]
    - [274, 0.0]
  - - [4096, 3539, 1, 1024]
    - [264, 0.0]
  - - [4096, 3332, 1, 1024]
    - [260, 0.0]
  - - [4096, 3286, 1, 1024]
    - [264, 0.0]
  - - [1024, 4026, 1, 4096]
    - [259, 0.0]
  - - [1024, 3277, 1, 4096]
    - [276, 0.0]
  - - [1024, 3471, 1, 4096]
    - [265, 0.0]
  - - [4096, 3518, 1, 1024]
    - [264, 0.0]
  - - [1024, 3393, 1, 4096]
    - [265, 0.0]
  - - [4096, 3413, 1, 1024]
    - [277, 0.0]
  - - [4096, 3303, 1, 1024]
    - [264, 0.0]
  - - [1024, 3207, 1, 4096]
    - [269, 0.0]
  - - [1024, 3894, 1, 1024]
    - [262, 0.0]
  - - [1024, 3977, 1, 1024]
    - [262, 0.0]
  - - [64, 135, 480, 133]
    - [263, 0.0]
  - - [4096, 3535, 1, 1024]
    - [264, 0.0]
  - - [4096, 3376, 1, 1024]
    - [261, 0.0]
  - - [1024, 3355, 1, 4096]
    - [265, 0.0]
  - - [64, 27, 2336, 27]
    - [298, 0.0]
  - - [1024, 3466, 1, 4096]
    - [265, 0.0]
  - - [4096, 3266, 1, 1024]
    - [264, 0.0]
  - - [1024, 3404, 1, 4096]
    - [265, 0.0]
  - - [1024, 3999, 1, 1024]
    - [271, 0.0]
  - - [64, 148, 432, 143]
    - [291, 0.0]
  - - [4096, 3498, 1, 1024]
    - [266, 0.0]
  - - [1024, 4032, 1, 1024]
    - [269, 0.0]
  - - [1024, 3410, 1, 4096]
    - [267, 0.0]
  - - [4096, 3393, 1, 1024]
    - [260, 0.0]
  - - [1024, 3140, 1, 4096]
    - [271, 0.0]
  - - [1024, 3910, 1, 33708]
    - [266, 0.0]
  - - [1024, 3334, 1, 4096]
    - [267, 0.0]
  - - [4096, 3140, 1, 1024]
    - [260, 0.0]
  - - [1024, 4005, 1, 4096]
    - [270, 0.0]
  - - [1024, 3579, 1, 4096]
    - [267, 0.0]
  - - [4096, 3372, 1, 1024]
    - [260, 0.0]
  - - [1024, 3245, 1, 4096]
    - [271, 0.0]
  - - [64, 38, 1680, 38]
    - [299, 0.0]
  - - [4096, 3956, 1, 1024]
    - [260, 0.0]
  - - [4096, 3213, 1, 1024]
    - [266, 0.0]
  - - [1024, 3361, 1, 4096]
    - [265, 0.0]
  - - [1024, 3536, 1, 4096]
    - [267, 0.0]
  - - [4096, 3477, 1, 1024]
    - [264, 0.0]
  - - [4096, 3526, 1, 1024]
    - [264, 0.0]
  - - [1024, 4005, 1, 1024]
    - [269, 0.0]
  - - [1024, 3530, 1, 4096]
    - [272, 0.0]
  - - [1024, 3944, 1, 4096]
    - [259, 0.0]
  - - [4096, 3453, 1, 1024]
    - [268, 0.0]
  - - [4096, 3184, 1, 1024]
    - [260, 0.0]
  - - [4096, 3579, 1, 1024]
    - [264, 0.0]
  - - [4096, 3351, 1, 1024]
    - [260, 0.0]
  - - [4096, 3416, 1, 1024]
    - [261, 0.0]
  - - [64, 100, 624, 100]
    - [274, 0.0]
  - - [1024, 3822, 1, 4096]
    - [259, 0.0]
  - - [1024, 3796, 1, 4096]
    - [259, 0.0]
  - - [4096, 3257, 1, 1024]
    - [266, 0.0]
  - - [4096, 3306, 1, 1024]
    - [266, 0.0]
  - - [1024, 3505, 1, 4096]
    - [265, 0.0]
  - - [1024, 3315, 1, 4096]
    - [271, 0.0]
  - - [1024, 3486, 1, 4096]
    - [267, 0.0]
  - - [4096, 3457, 1, 1024]
    - [266, 0.0]
  - - [4096, 3870, 1, 1024]
    - [277, 0.0]
  - - [1024, 3447, 1, 4096]
    - [265, 0.0]
  - - [1024, 3558, 1, 4096]
    - [272, 0.0]
  - - [4096, 3433, 1, 1024]
    - [277, 0.0]
  - - [4096, 3180, 1, 1024]
    - [260, 0.0]
  - - [1024, 3213, 1, 4096]
    - [269, 0.0]
  - - [1024, 3900, 1, 4096]
    - [259, 0.0]
  - - [4096, 3444, 1, 1024]
    - [268, 0.0]
  - - [1024, 3504, 1, 4096]
    - [265, 0.0]
  - - [4096, 4059, 1, 1024]
    - [264, 0.0]
  - - [1024, 3442, 1, 4096]
    - [265, 0.0]
  - - [4096, 3517, 1, 1024]
    - [266, 0.0]
  - - [1024, 3566, 1, 4096]
    - [267, 0.0]
  - - [4096, 3248, 1, 1024]
    - [266, 0.0]
  - - [1024, 3547, 1, 4096]
    - [267, 0.0]
  - - [64, 59, 1088, 59]
    - [300, 0.0]
  - - [1024, 3340, 1, 4096]
    - [267, 0.0]
  - - [4096, 3480, 1, 1024]
    - [264, 0.0]
  - - [4096, 3424, 1, 1024]
    - [277, 0.0]
  - - [1024, 3906, 1, 1024]
    - [273, 0.0]
  - - [4096, 3265, 1, 1024]
    - [266, 0.0]
  - - [1024, 3384, 1, 4096]
    - [265, 0.0]
  - - [1024, 3494, 1, 4096]
    - [272, 0.0]
  - - [1024, 3236, 1, 4096]
    - [262, 0.0]
  - - [4096, 3497, 1, 1024]
    - [264, 0.0]
  - - [4096, 3354, 1, 1024]
    - [260, 0.0]
  - - [4096, 3055, 1, 1024]
    - [264, 0.0]
  - - [64, 11, 5456, 11]
    - [275, 0.0]
  - - [4096, 3244, 1, 1024]
    - [266, 0.0]
  - - [4096, 3139, 1, 1024]
    - [268, 0.0]
  - - [4096, 3508, 1, 1024]
    - [266, 0.0]
  - - [4096, 4050, 1, 1024]
    - [266, 0.0]
  - - [1024, 3472, 1, 4096]
    - [267, 0.0]
  - - [1024, 3861, 1, 1024]
    - [269, 0.0]
  - - [1024, 3910, 1, 1024]
    - [259, 0.0]
  - - [4096, 3371, 1, 1024]
    - [260, 0.0]
  - - [64, 65, 992, 65]
    - [285, 0.0]
  - - [1024, 3751, 1, 4096]
    - [264, 0.0]
  - - [4096, 3325, 1, 1024]
    - [266, 0.0]
  - - [1024, 3321, 1, 4096]
    - [265, 0.0]
  - - [1024, 3944, 1, 1024]
    - [273, 0.0]
  - - [4096, 3525, 1, 1024]
    - [264, 0.0]
  - - [4096, 3382, 1, 1024]
    - [260, 0.0]
  - - [64, 122, 528, 122]
    - [274, 0.0]
  - - [1024, 3453, 1, 4096]
    - [272, 0.0]
  - - [4096, 3564, 1, 1024]
    - [266, 0.0]
  - - [4096, 3288, 1, 1024]
    - [266, 0.0]
  - - [1024, 3925, 1, 4096]
    - [264, 0.0]
  - - [1024, 3057, 1, 4096]
    - [259, 0.0]
  - - [4096, 3488, 1, 1024]
    - [264, 0.0]
  - - [4096, 3046, 1, 1024]
    - [264, 0.0]
  - - [1024, 3189, 1, 4096]
    - [271, 0.0]
  - - [4096, 3399, 1, 1024]
    - [277, 0.0]
  - - [1024, 3383, 1, 4096]
    - [265, 0.0]
  - - [1024, 3415, 1, 4096]
    - [265, 0.0]
  - - [1024, 3388, 1, 4096]
    - [265, 0.0]
  - - [1024, 3376, 1, 4096]
    - [272, 0.0]
  - - [1024, 3473, 1, 4096]
    - [265, 0.0]
  - - [4096, 3162, 1, 1024]
    - [261, 0.0]
  - - [1024, 3448, 1, 4096]
    - [265, 0.0]
  - - [4096, 3362, 1, 1024]
    - [260, 0.0]
  - - [64, 228, 272, 228]
    - [301, 0.0]
  - - [1024, 3262, 1, 4096]
    - [262, 0.0]
  - - [1024, 3184, 1, 4096]
    - [273, 0.0]
  - - [1024, 3378, 1, 4096]
    - [267, 0.0]
  - - [4096, 3548, 1, 1024]
    - [266, 0.0]
  - - [4096, 2977, 1, 1024]
    - [266, 0.0]
  - - [64, 21, 2976, 21]
    - [282, 0.0]
  - - [64, 112, 576, 111]
    - [302, 0.0]
  - - [4096, 3443, 1, 1024]
    - [261, 0.0]
  - - [1024, 3289, 1, 4096]
    - [265, 0.0]
  - - [1024, 3483, 1, 4096]
    - [276, 0.0]
  - - [4096, 3190, 1, 1024]
    - [260, 0.0]
  - - [1024, 3421, 1, 4096]
    - [265, 0.0]
  - - [1024, 3514, 1, 4096]
    - [267, 0.0]
  - - [1024, 3532, 1, 4096]
    - [265, 0.0]
  - - [1024, 3565, 1, 4096]
    - [267, 0.0]
  - - [4096, 3422, 1, 1024]
    - [277, 0.0]
  - - [4096, 3263, 1, 1024]
    - [264, 0.0]
  - - [4096, 3296, 1, 1024]
    - [264, 0.0]
  - - [4096, 3640, 1, 1024]
    - [268, 0.0]
  - - [4096, 3463, 1, 1024]
    - [266, 0.0]
  - - [4096, 3528, 1, 1024]
    - [264, 0.0]
  - - [1024, 3351, 1, 4096]
    - [262, 0.0]
  - - [1024, 3462, 1, 4096]
    - [265, 0.0]
  - - [4096, 3226, 1, 1024]
    - [264, 0.0]
  - - [4096, 3439, 1, 1024]
    - [261, 0.0]
  - - [4096, 3121, 1, 1024]
    - [261, 0.0]
  - - [1024, 4059, 1, 33708]
    - [266, 0.0]
  - - [1024, 3311, 1, 4096]
    - [265, 0.0]
  - - [1024, 3230, 1, 4096]
    - [265, 0.0]
  - - [4096, 3353, 1, 1024]
    - [260, 0.0]
  - - [4096, 3402, 1, 1024]
    - [277, 0.0]
  - - [1024, 3427, 1, 4096]
    - [265, 0.0]
  - - [1024, 3346, 1, 4096]
    - [265, 0.0]
  - - [1024, 3126, 1, 4096]
    - [262, 0.0]
  - - [1024, 3796, 1, 1024]
    - [269, 0.0]
  - - [1024, 3990, 1, 4096]
    - [259, 0.0]
  - - [1024, 3257, 1, 4096]
    - [269, 0.0]
  - - [4096, 3996, 1, 1024]
    - [264, 0.0]
  - - [64, 143, 432, 143]
    - [263, 0.0]
  - - [1024, 3306, 1, 4096]
    - [271, 0.0]
  - - [1024, 3389, 1, 4096]
    - [265, 0.0]
  - - [1024, 3500, 1, 4096]
    - [265, 0.0]
  - - [1024, 3999, 1, 33708]
    - [264, 0.0]
  - - [4096, 3486, 1, 1024]
    - [264, 0.0]
  - - [1024, 3438, 1, 4096]
    - [265, 0.0]
  - - [4096, 3616, 1, 1024]
    - [268, 0.0]
  - - [1024, 3955, 1, 1024]
    - [271, 0.0]
  - - [4096, 3430, 1, 1024]
    - [260, 0.0]
  - - [4096, 3271, 1, 1024]
    - [264, 0.0]
  - - [1024, 3364, 1, 4096]
    - [271, 0.0]
  - - [64, 54, 1184, 54]
    - [303, 0.0]
  - - [1024, 3497, 1, 4096]
    - [265, 0.0]
  - - [4096, 3503, 1, 1024]
    - [266, 0.0]
  - - [4096, 3344, 1, 1024]
    - [277, 0.0]
  - - [1024, 3457, 1, 4096]
    - [265, 0.0]
  - - [4096, 3466, 1, 1024]
    - [266, 0.0]
  - - [1024, 3976, 1, 33708]
    - [264, 0.0]
  - - [1024, 3395, 1, 4096]
    - [267, 0.0]
  - - [4096, 3361, 1, 1024]
    - [268, 0.0]
  - - [1024, 3751, 1, 33708]
    - [288, 0.0]
  - - [1024, 3822, 1, 1024]
    - [269, 0.0]
  - - [4096, 3315, 1, 1024]
    - [264, 0.0]
  - - [1024, 3163, 1, 4096]
    - [271, 0.0]
  - - [4096, 3547, 1, 1024]
    - [264, 0.0]
  - - [4096, 3340, 1, 1024]
    - [268, 0.0]
  - - [1024, 3296, 1, 4096]
    - [265, 0.0]
  - - [1024, 3468, 1, 4096]
    - [265, 0.0]
  - - [4096, 3294, 1, 1024]
    - [266, 0.0]
  - - [1024, 3406, 1, 4096]
    - [276, 0.0]
  - - [1024, 3860, 1, 33708]
    - [266, 0.0]
  - - [1024, 3584, 1, 4096]
    - [272, 0.0]
  - - [4096, 3189, 1, 1024]
    - [260, 0.0]
  - - [4096, 3494, 1, 1024]
    - [266, 0.0]
  - - [64, 135, 480, 135]
    - [291, 0.0]
  - - [1024, 3093, 1, 4096]
    - [262, 0.0]
  - - [4096, 3421, 1, 1024]
    - [277, 0.0]
  - - [1024, 3479, 1, 4096]
    - [265, 0.0]
  - - [1024, 3433, 1, 4096]
    - [265, 0.0]
  - - [4096, 3311, 1, 1024]
    - [266, 0.0]
  - - [1024, 3381, 1, 4096]
    - [265, 0.0]
  - - [1024, 3996, 1, 4096]
    - [264, 0.0]
  - - [4096, 3384, 1, 1024]
    - [268, 0.0]
  - - [1024, 3247, 1, 4096]
    - [273, 0.0]
  - - [1024, 3169, 1, 4096]
    - [269, 0.0]
  - - [1024, 3088, 1, 4096]
    - [262, 0.0]
  - - [1024, 3363, 1, 4096]
    - [265, 0.0]
  - - [1024, 3538, 1, 4096]
    - [267, 0.0]
  - - [1024, 3996, 1, 1024]
    - [270, 0.0]
  - - [4096, 3169, 1, 1024]
    - [277, 0.0]
  - - [4096, 3538, 1, 1024]
    - [266, 0.0]
  - - [4096, 3401, 1, 1024]
    - [277, 0.0]
  - - [4096, 3581, 1, 1024]
    - [266, 0.0]
  - - [1024, 3180, 1, 4096]
    - [269, 0.0]
  - - [1024, 3870, 1, 1024]
    - [273, 0.0]
  - - [4096, 3555, 1, 1024]
    - [266, 0.0]
  - - [4096, 3412, 1, 1024]
    - [260, 0.0]
  - - [4096, 3302, 1, 1024]
    - [266, 0.0]
  - - [1024, 3561, 1, 4096]
    - [276, 0.0]
  - - [1024, 3302, 1, 4096]
    - [265, 0.0]
  - - [1024, 3976, 1, 4096]
    - [259, 0.0]
  - - [4096, 3485, 1, 1024]
    - [266, 0.0]
  - - [4096, 3534, 1, 1024]
    - [266, 0.0]
  - - [1024, 3110, 1, 4096]
    - [271, 0.0]
  - - [1024, 3401, 1, 4096]
    - [265, 0.0]
  - - [4096, 3216, 1, 1024]
    - [266, 0.0]
  - - [1024, 4020, 1, 33708]
    - [266, 0.0]
  - - [1024, 3215, 1, 4096]
    - [265, 0.0]
  - - [4096, 3566, 1, 1024]
    - [266, 0.0]
  - - [1024, 3137, 1, 4096]
    - [269, 0.0]
  - - [4096, 3359, 1, 1024]
    - [277, 0.0]
  - - [4096, 3392, 1, 1024]
    - [260, 0.0]
  - - [1024, 3506, 1, 4096]
    - [265, 0.0]
  - - [4096, 3233, 1, 1024]
    - [266, 0.0]
  - - [1024, 3444, 1, 4096]
    - [265, 0.0]
  - - [1024, 3975, 1, 4096]
    - [264, 0.0]
  - - [1024, 3870, 1, 33708]
    - [266, 0.0]
  - - [4096, 3465, 1, 1024]
    - [264, 0.0]
  - - [1024, 3523, 1, 4096]
    - [265, 0.0]
  - - [64, 10, 5952, 10]
    - [275, 0.0]
  - - [4096, 3990, 1, 1024]
    - [266, 0.0]
  - - [1024, 3549, 1, 4096]
    - [267, 0.0]
  - - [1024, 3342, 1, 4096]
    - [265, 0.0]
  - - [4096, 3476, 1, 1024]
    - [266, 0.0]
  - - [64, 232, 272, 228]
    - [304, 0.0]
  - - [1024, 3418, 1, 4096]
    - [265, 0.0]
  - - [1024, 3859, 1, 1024]
    - [273, 0.0]
  - - [4096, 3339, 1, 1024]
    - [260, 0.0]
  - - [4096, 3452, 1, 1024]
    - [277, 0.0]
  - - [4096, 3293, 1, 1024]
    - [266, 0.0]
  - - [1024, 3369, 1, 4096]
    - [269, 0.0]
  - - [64, 193, 320, 193]
    - [305, 0.0]
  - - [1024, 3544, 1, 4096]
    - [272, 0.0]
  - - [4096, 3493, 1, 1024]
    - [264, 0.0]
  - - [4096, 3350, 1, 1024]
    - [260, 0.0]
  - - [64, 71, 896, 71]
    - [306, 0.0]
  - - [4096, 3256, 1, 1024]
    - [266, 0.0]
  - - [1024, 3870, 1, 4096]
    - [259, 0.0]
  - - [4096, 4012, 1, 1024]
    - [264, 0.0]
  - - [1024, 3280, 1, 4096]
    - [265, 0.0]
  - - [4096, 3456, 1, 1024]
    - [261, 0.0]
  - - [1024, 3555, 1, 4096]
    - [267, 0.0]
  - - [4096, 3014, 1, 1024]
    - [266, 0.0]
  - - [1024, 3474, 1, 4096]
    - [265, 0.0]
  - - [4096, 3367, 1, 1024]
    - [261, 0.0]
  - - [4096, 3432, 1, 1024]
    - [260, 0.0]
  - - [64, 84, 752, 84]
    - [279, 0.0]
  - - [4096, 3273, 1, 1024]
    - [264, 0.0]
  - - [4096, 3130, 1, 1024]
    - [277, 0.0]
  - - [1024, 2984, 1, 4096]
    - [259, 0.0]
  - - [1024, 3995, 1, 1024]
    - [262, 0.0]
  - - [1024, 3517, 1, 4096]
    - [265, 0.0]
  - - [1024, 3455, 1, 4096]
    - [265, 0.0]
  - - [1024, 3939, 1, 4096]
    - [259, 0.0]
  - - [64, 49, 1296, 49]
    - [307, 0.0]
  - - [64, 14, 4368, 14]
    - [275, 0.0]
  - - [64, 25, 2512, 25]
    - [308, 0.0]
  - - [4096, 3147, 1, 1024]
    - [260, 0.0]
  - - [4096, 3516, 1, 1024]
    - [266, 0.0]
  - - [1024, 3876, 1, 4096]
    - [259, 0.0]
  - - [1024, 3191, 1, 4096]
    - [273, 0.0]
  - - [4096, 3411, 1, 1024]
    - [268, 0.0]
  - - [1024, 3337, 1, 4096]
    - [265, 0.0]
  - - [1024, 3512, 1, 4096]
    - [265, 0.0]
  - - [4096, 3301, 1, 1024]
    - [266, 0.0]
  - - [1024, 3450, 1, 4096]
    - [267, 0.0]
  - - [4096, 3533, 1, 1024]
    - [266, 0.0]
  - - [4096, 3390, 1, 1024]
    - [260, 0.0]
  - - [4096, 3231, 1, 1024]
    - [266, 0.0]
  - - [1024, 2499, 1, 4096]
    - [267, 0.0]
  - - [1024, 3186, 1, 4096]
    - [273, 0.0]
  - - [1024, 3380, 1, 4096]
    - [265, 0.0]
  - - [4096, 3496, 1, 1024]
    - [264, 0.0]
  - - [1024, 3956, 1, 33708]
    - [266, 0.0]
  - - [1024, 3976, 1, 1024]
    - [259, 0.0]
  - - [4096, 2736, 1, 1024]
    - [266, 0.0]
  - - [1024, 3291, 1, 4096]
    - [265, 0.0]
  - - [1024, 3944, 1, 33708]
    - [264, 0.0]
  - - [1024, 3485, 1, 4096]
    - [267, 0.0]
  - - [4096, 3138, 1, 1024]
    - [277, 0.0]
  - - [1024, 3423, 1, 4096]
    - [265, 0.0]
  - - [1024, 3491, 1, 4096]
    - [265, 0.0]
  - - [1024, 3860, 1, 4096]
    - [270, 0.0]
  - - [4096, 3211, 1, 1024]
    - [266, 0.0]
  - - [1024, 3221, 1, 4096]
    - [262, 0.0]
  - - [1024, 2917, 1, 4096]
    - [259, 0.0]
  - - [4096, 3475, 1, 1024]
    - [266, 0.0]
  - - [4096, 3524, 1, 1024]
    - [266, 0.0]
  - - [4096, 2985, 1, 1024]
    - [264, 0.0]
  - - [1024, 3480, 1, 4096]
    - [265, 0.0]
  - - [4096, 3222, 1, 1024]
    - [266, 0.0]
  - - [4096, 3451, 1, 1024]
    - [261, 0.0]
  - - [1024, 3969, 1, 33708]
    - [266, 0.0]
  - - [1024, 3640, 1, 1024]
    - [309, 0.0]
  - - [1024, 3297, 1, 4096]
    - [276, 0.0]
  - - [4096, 3944, 1, 1024]
    - [277, 0.0]
  - - [1024, 3216, 1, 4096]
    - [273, 0.0]
  - - [4096, 3349, 1, 1024]
    - [268, 0.0]
  - - [4096, 3398, 1, 1024]
    - [277, 0.0]
  - - [1024, 3154, 1, 4096]
    - [262, 0.0]
  - - [1024, 3978, 1, 33708]
    - [264, 0.0]
  - - [1024, 3348, 1, 4096]
    - [265, 0.0]
  - - [4096, 3304, 1, 1024]
    - [264, 0.0]
  - - [4096, 4030, 1, 1024]
    - [264, 0.0]
  - - [1024, 4026, 1, 1024]
    - [269, 0.0]
  - - [4096, 3471, 1, 1024]
    - [266, 0.0]
  - - [1024, 3259, 1, 4096]
    - [262, 0.0]
  - - [64, 132, 480, 132]
    - [292, 0.0]
  - - [1024, 3308, 1, 4096]
    - [267, 0.0]
  - - [4096, 3391, 1, 1024]
    - [260, 0.0]
  - - [1024, 3312, 1, 4096]
    - [265, 0.0]
  - - [1024, 3502, 1, 4096]
    - [265, 0.0]
  - - [1024, 3968, 1, 33708]
    - [266, 0.0]
  - - [1024, 3424, 1, 4096]
    - [276, 0.0]
  - - [64, 13, 4672, 13]
    - [310, 0.0]
  - - [4096, 4032, 1, 1024]
    - [268, 0.0]
  - - [1024, 3900, 1, 1024]
    - [262, 0.0]
  - - [4096, 3442, 1, 1024]
    - [268, 0.0]
  - - [1024, 3366, 1, 4096]
    - [265, 0.0]
  - - [4096, 3999, 1, 1024]
    - [266, 0.0]
  - - [1024, 3477, 1, 4096]
    - [265, 0.0]
  - - [1024, 2505, 1, 4096]
    - [265, 0.0]
  - - [4096, 3515, 1, 1024]
    - [266, 0.0]
  - - [1024, 3564, 1, 4096]
    - [276, 0.0]
  - - [4096, 3057, 1, 1024]
    - [264, 0.0]
  - - [1024, 3339, 1, 4096]
    - [273, 0.0]
  - - [4096, 3262, 1, 1024]
    - [266, 0.0]
  - - [1024, 4030, 1, 4096]
    - [270, 0.0]
  - - [1024, 3265, 1, 4096]
    - [265, 0.0]
  - - [1024, 3459, 1, 4096]
    - [265, 0.0]
  - - [4096, 3462, 1, 1024]
    - [264, 0.0]
  - - [64, 85, 752, 85]
    - [279, 0.0]
  - - [1024, 3513, 1, 4096]
    - [272, 0.0]
  - - [1024, 3397, 1, 4096]
    - [265, 0.0]
  - - [4096, 3572, 1, 1024]
    - [266, 0.0]
  - - [4096, 3389, 1, 1024]
    - [260, 0.0]
  - - [4096, 3438, 1, 1024]
    - [260, 0.0]
  - - [64, 102, 624, 100]
    - [274, 0.0]
  - - [1024, 3640, 1, 33708]
    - [295, 0.0]
  - - [1024, 3995, 1, 33708]
    - [264, 0.0]
  - - [1024, 3165, 1, 4096]
    - [271, 0.0]
  - - [4096, 3543, 1, 1024]
    - [264, 0.0]
  - - [4096, 3352, 1, 1024]
    - [261, 0.0]
  - - [1024, 3359, 1, 4096]
    - [272, 0.0]
  - - [1024, 3470, 1, 4096]
    - [265, 0.0]
  - - [64, 15, 4096, 15]
    - [275, 0.0]
  - - [1024, 3392, 1, 4096]
    - [267, 0.0]
  - - [64, 78, 816, 77]
    - [281, 0.0]
  - - [4096, 3137, 1, 1024]
    - [261, 0.0]
  - - [4096, 3506, 1, 1024]
    - [264, 0.0]
  - - [1024, 3095, 1, 4096]
    - [271, 0.0]
  - - [1024, 3859, 1, 4096]
    - [266, 0.0]
  - - [4096, 3369, 1, 1024]
    - [260, 0.0]
  - - [64, 45, 1424, 45]
    - [311, 0.0]
  - - [1024, 3435, 1, 4096]
    - [265, 0.0]
  - - [1024, 3354, 1, 4096]
    - [265, 0.0]
  - - [1024, 3055, 1, 4096]
    - [264, 0.0]
  - - [4096, 3523, 1, 1024]
    - [266, 0.0]
  - - [4096, 3380, 1, 1024]
    - [261, 0.0]
  - - [1024, 3233, 1, 4096]
    - [271, 0.0]
  - - [4096, 3221, 1, 1024]
    - [266, 0.0]
  - - [4096, 3270, 1, 1024]
    - [266, 0.0]
  - - [4096, 3593, 1, 1024]
    - [268, 0.0]
  - - [1024, 3358, 1, 4096]
    - [265, 0.0]
  - - [1024, 3540, 1, 4096]
    - [265, 0.0]
  - - [4096, 3502, 1, 1024]
    - [264, 0.0]
  - - [4096, 2505, 1, 1024]
    - [264, 0.0]
  - - [4096, 3397, 1, 1024]
    - [268, 0.0]
  - - [1024, 3300, 1, 4096]
    - [262, 0.0]
  - - [4096, 3095, 1, 1024]
    - [277, 0.0]
  - - [1024, 3182, 1, 4096]
    - [271, 0.0]
  - - [1024, 3299, 1, 4096]
    - [267, 0.0]
  - - [1024, 3276, 1, 4096]
    - [262, 0.0]
  - - [1024, 3360, 1, 4096]
    - [272, 0.0]
  - - [4096, 3360, 1, 1024]
    - [260, 0.0]
  - - [4096, 2918, 1, 1024]
    - [261, 0.0]
  - - [1024, 3939, 1, 33708]
    - [266, 0.0]
  - - [4096, 3314, 1, 1024]
    - [264, 0.0]
  - - [1024, 3319, 1, 4096]
    - [265, 0.0]
  - - [64, 35, 1808, 35]
    - [312, 0.0]
  - - [1024, 3942, 1, 1024]
    - [271, 0.0]
  - - [1024, 3465, 1, 4096]
    - [265, 0.0]
  - - [4096, 3546, 1, 1024]
    - [264, 0.0]
  - - [1024, 3403, 1, 4096]
    - [271, 0.0]
  - - [1024, 3948, 1, 1024]
    - [273, 0.0]
  - - [4096, 3441, 1, 1024]
    - [260, 0.0]
  - - [1024, 3139, 1, 4096]
    - [271, 0.0]
  - - [1024, 3563, 1, 4096]
    - [265, 0.0]
  - - [1024, 3508, 1, 4096]
    - [272, 0.0]
  - - [1024, 3975, 1, 33708]
    - [266, 0.0]
  - - [1024, 3446, 1, 4096]
    - [267, 0.0]
  - - [1024, 3529, 1, 4096]
    - [276, 0.0]
  - - [64, 112, 576, 112]
    - [284, 0.0]
  - - [4096, 3461, 1, 1024]
    - [264, 0.0]
  - - [1024, 3574, 1, 4096]
    - [267, 0.0]
  - - [1024, 3101, 1, 4096]
    - [262, 0.0]
  - - [1024, 3927, 1, 1024]
    - [273, 0.0]
  - - [4096, 3224, 1, 1024]
    - [264, 0.0]
  - - [4096, 3437, 1, 1024]
    - [277, 0.0]
  - - [4096, 3900, 1, 1024]
    - [260, 0.0]
  - - [1024, 3495, 1, 4096]
    - [265, 0.0]
  - - [1024, 3977, 1, 33708]
    - [266, 0.0]
  - - [1024, 3328, 1, 4096]
    - [265, 0.0]
  - - [4096, 3168, 1, 1024]
    - [261, 0.0]
  - - [1024, 4026, 1, 33708]
    - [266, 0.0]
  - - [1024, 3292, 1, 4096]
    - [271, 0.0]
  - - [1024, 3294, 1, 4096]
    - [265, 0.0]
  - - [4096, 3335, 1, 1024]
    - [277, 0.0]
  - - [4096, 3400, 1, 1024]
    - [268, 0.0]
  - - [1024, 3287, 1, 4096]
    - [269, 0.0]
  - - [1024, 3910, 1, 4096]
    - [259, 0.0]
  - - [1024, 3780, 1, 1024]
    - [271, 0.0]
  - - [4096, 3098, 1, 1024]
    - [277, 0.0]
  - - [1024, 3584, 1, 33708]
    - [265, 0.0]
  - - [64, 29, 2176, 29]
    - [313, 0.0]
  - - [1024, 3371, 1, 4096]
    - [269, 0.0]
  - - [1024, 3546, 1, 4096]
    - [265, 0.0]
  - - [1024, 4012, 1, 1024]
    - [259, 0.0]
  - - [4096, 3505, 1, 1024]
    - [266, 0.0]
  - - [4096, 3554, 1, 1024]
    - [266, 0.0]
  - - [4096, 3063, 1, 1024]
    - [266, 0.0]
  - - [1024, 3900, 1, 33708]
    - [264, 0.0]
  - - [1024, 3345, 1, 4096]
    - [265, 0.0]
  - - [1024, 3357, 1, 4096]
    - [265, 0.0]
  - - [1024, 3282, 1, 4096]
    - [271, 0.0]
  - - [4096, 3484, 1, 1024]
    - [264, 0.0]
  - - [1024, 3557, 1, 4096]
    - [272, 0.0]
  - - [1024, 3476, 1, 4096]
    - [265, 0.0]
  - - [1024, 3751, 1, 1024]
    - [262, 0.0]
  - - [4096, 3379, 1, 1024]
    - [277, 0.0]
  - - [4096, 3428, 1, 1024]
    - [261, 0.0]
  - - [4096, 3126, 1, 1024]
    - [268, 0.0]
  - - [64, 41, 1552, 41]
    - [314, 0.0]
  - - [1024, 3325, 1, 4096]
    - [269, 0.0]
  - - [4096, 3501, 1, 1024]
    - [266, 0.0]
  - - [4096, 3358, 1, 1024]
    - [261, 0.0]
  - - [1024, 3441, 1, 4096]
    - [265, 0.0]
  - - [1024, 3552, 1, 4096]
    - [276, 0.0]
  - - [4096, 3232, 1, 1024]
    - [264, 0.0]
  - - [64, 18, 3440, 18]
    - [315, 0.0]
  - - [1024, 3412, 1, 4096]
    - [265, 0.0]
  - - [1024, 3372, 1, 4096]
    - [272, 0.0]
  - - [1024, 3585, 1, 4096]
    - [309, 0.0]
  - - [4096, 3143, 1, 1024]
    - [260, 0.0]
  - - [4096, 3464, 1, 1024]
    - [266, 0.0]
  - - [1024, 3145, 1, 4096]
    - [273, 0.0]
  - - [4096, 3375, 1, 1024]
    - [268, 0.0]
  - - [4096, 2917, 1, 1024]
    - [261, 0.0]
  - - [4096, 3978, 1, 1024]
    - [264, 0.0]
  - - [1024, 2765, 1, 4096]
    - [259, 0.0]
  - - [64, 148, 432, 148]
    - [316, 0.0]
  - - [1024, 3452, 1, 4096]
    - [267, 0.0]
  - - [4096, 3584, 1, 1024]
    - [264, 0.0]
  - - [4096, 3545, 1, 1024]
    - [264, 0.0]
  - - [1024, 3352, 1, 4096]
    - [265, 0.0]
  - - [64, 159, 400, 160]
    - [263, 0.0]
  - - [4096, 3292, 1, 1024]
    - [266, 0.0]
  - - [1024, 3525, 1, 4096]
    - [265, 0.0]
  - - [1024, 3266, 1, 4096]
    - [265, 0.0]
  - - [1024, 3382, 1, 4096]
    - [267, 0.0]
  - - [4096, 3492, 1, 1024]
    - [266, 0.0]
  - - [4096, 3419, 1, 1024]
    - [260, 0.0]
  - - [1024, 3796, 1, 33708]
    - [288, 0.0]
  - - [1024, 3293, 1, 4096]
    - [276, 0.0]
  - - [4096, 3796, 1, 1024]
    - [264, 0.0]
  - - [1024, 3487, 1, 4096]
    - [272, 0.0]
  - - [4096, 3166, 1, 1024]
    - [260, 0.0]
  - - [64, 102, 624, 101]
    - [284, 0.0]
  - - [1024, 3409, 1, 4096]
    - [265, 0.0]
  - - [1024, 3520, 1, 4096]
    - [267, 0.0]
  - - [1024, 3573, 1, 4096]
    - [265, 0.0]
  - - [4096, 3366, 1, 1024]
    - [261, 0.0]
  - - [4096, 3720, 1, 1024]
    - [260, 0.0]
  - - [4096, 3207, 1, 1024]
    - [266, 0.0]
  - - [4096, 3272, 1, 1024]
    - [266, 0.0]
  - - [1024, 3390, 1, 4096]
    - [265, 0.0]
  - - [4096, 3183, 1, 1024]
    - [260, 0.0]
  - - [4096, 3536, 1, 1024]
    - [264, 0.0]
  - - [4096, 3563, 1, 1024]
    - [264, 0.0]
  - - [1024, 3482, 1, 4096]
    - [265, 0.0]
  - - [4096, 3447, 1, 1024]
    - [268, 0.0]
  - - [4096, 3955, 1, 1024]
    - [261, 0.0]
  - - [4096, 4005, 1, 1024]
    - [264, 0.0]
  - - [1024, 3493, 1, 4096]
    - [265, 0.0]
  - - [4096, 3410, 1, 1024]
    - [261, 0.0]
  - - [1024, 3422, 1, 4096]
    - [267, 0.0]
  - - [1024, 3350, 1, 4096]
    - [262, 0.0]
  - - [4096, 3300, 1, 1024]
    - [264, 0.0]
  - - [4096, 3910, 1, 1024]
    - [268, 0.0]
  - - [1024, 3489, 1, 4096]
    - [265, 0.0]
  - - [4096, 3483, 1, 1024]
    - [266, 0.0]
  - - [4096, 3532, 1, 1024]
    - [264, 0.0]
  - - [64, 101, 624, 101]
    - [284, 0.0]
  - - [4096, 3230, 1, 1024]
    - [264, 0.0]
  - - [4096, 3427, 1, 1024]
    - [261, 0.0]
  - - [1024, 3377, 1, 4096]
    - [265, 0.0]
  - - [1024, 3488, 1, 4096]
    - [267, 0.0]
  - - [1024, 3616, 1, 4096]
    - [259, 0.0]
  - - [1024, 3426, 1, 4096]
    - [265, 0.0]
  - - [4096, 3357, 1, 1024]
    - [260, 0.0]
  - - [4096, 3406, 1, 1024]
    - [277, 0.0]
  - - [1024, 3046, 1, 4096]
    - [259, 0.0]
  - - [1024, 3272, 1, 4096]
    - [271, 0.0]
  - - [1024, 3256, 1, 4096]
    - [269, 0.0]
  - - [4096, 3247, 1, 1024]
    - [266, 0.0]
  - - [4096, 3088, 1, 1024]
    - [260, 0.0]
  - - [1024, 3531, 1, 4096]
    - [267, 0.0]
  - - [64, 160, 400, 160]
    - [286, 0.0]
  - - [4096, 3511, 1, 1024]
    - [264, 0.0]
  - - [1024, 3720, 1, 33708]
    - [297, 0.0]
  - - [1024, 3267, 1, 4096]
    - [271, 0.0]
  - - [1024, 3270, 1, 4096]
    - [262, 0.0]
  - - [1024, 3461, 1, 4096]
    - [267, 0.0]
  - - [4096, 3474, 1, 1024]
    - [266, 0.0]
  - - [4096, 2984, 1, 1024]
    - [264, 0.0]
  - - [1024, 3399, 1, 4096]
    - [267, 0.0]
  - - [4096, 3574, 1, 1024]
    - [266, 0.0]
  - - [1024, 3876, 1, 1024]
    - [262, 0.0]
  - - [4096, 3337, 1, 1024]
    - [277, 0.0]
  - - [4096, 3450, 1, 1024]
    - [260, 0.0]
  - - [1024, 3720, 1, 1024]
    - [269, 0.0]
  - - [1024, 4059, 1, 1024]
    - [270, 0.0]
  - - [4096, 3291, 1, 1024]
    - [266, 0.0]
  - - [64, 93, 688, 93]
    - [317, 0.0]
  - - [4096, 3995, 1, 1024]
    - [266, 0.0]
  - - [64, 147, 432, 147]
    - [318, 0.0]
  - - [4096, 3491, 1, 1024]
    - [266, 0.0]
  - - [4096, 3348, 1, 1024]
    - [260, 0.0]
  - - [4096, 3925, 1, 1024]
    - [268, 0.0]
  - - [4096, 3894, 1, 1024]
    - [268, 0.0]
  - - [1024, 3456, 1, 4096]
    - [265, 0.0]
  - - [1024, 3394, 1, 4096]
    - [267, 0.0]
  - - [64, 100, 624, 102]
    - [284, 0.0]
  - - [4096, 3165, 1, 1024]
    - [268, 0.0]
  - - [4096, 3470, 1, 1024]
    - [264, 0.0]
  - - [1024, 3014, 1, 4096]
    - [259, 0.0]
  - - [1024, 3375, 1, 4096]
    - [265, 0.0]
  - - [4096, 3859, 1, 1024]
    - [268, 0.0]
  - - [4096, 3365, 1, 1024]
    - [260, 0.0]
  - - [1024, 3162, 1, 4096]
    - [271, 0.0]
  - - [1024, 3840, 1, 33708]
    - [297, 0.0]
  - - [1024, 3437, 1, 4096]
    - [265, 0.0]
  - - [4096, 3319, 1, 1024]
    - [264, 0.0]
  - - [1024, 3320, 1, 4096]
    - [265, 0.0]
  - - [64, 23, 2720, 23]
    - [308, 0.0]
  - - [4096, 3328, 1, 1024]
    - [266, 0.0]
  - - [1024, 3235, 1, 4096]
    - [265, 0.0]
  - - [4096, 3282, 1, 1024]
    - [264, 0.0]
  - - [1024, 3367, 1, 4096]
    - [271, 0.0]
  - - [1024, 3542, 1, 4096]
    - [265, 0.0]
  - - [64, 177, 352, 177]
    - [304, 0.0]
  - - [4096, 3145, 1, 1024]
    - [277, 0.0]
  - - [4096, 3514, 1, 1024]
    - [266, 0.0]
  - - [1024, 3432, 1, 4096]
    - [265, 0.0]
  - - [4096, 3409, 1, 1024]
    - [261, 0.0]
  - - [1024, 4012, 1, 33708]
    - [266, 0.0]
  - - [4096, 3876, 1, 1024]
    - [277, 0.0]
  - - [4096, 3299, 1, 1024]
    - [266, 0.0]
  - - [1024, 3168, 1, 4096]
    - [271, 0.0]
  - - [4096, 3681, 1, 1024]
    - [260, 0.0]
  - - [4096, 3531, 1, 1024]
    - [264, 0.0]
  - - [4096, 3388, 1, 1024]
    - [260, 0.0]
  - - [1024, 3720, 1, 4096]
    - [264, 0.0]
  - - [1024, 3332, 1, 4096]
    - [265, 0.0]
  - - [1024, 3273, 1, 4096]
    - [262, 0.0]
  - - [1024, 2935, 1, 4096]
    - [270, 0.0]
  - - [1024, 3467, 1, 4096]
    - [272, 0.0]
  - - [4096, 3542, 1, 1024]
    - [266, 0.0]
  - - [1024, 3130, 1, 4096]
    - [273, 0.0]
  - - [1024, 3405, 1, 4096]
    - [265, 0.0]
  - - [1024, 3960, 1, 1024]
    - [269, 0.0]
  - - [4096, 3405, 1, 1024]
    - [268, 0.0]
  - - [512, 512, 1, 1024]
    - [319, 0.0]
  - - [8, 500, 1, 512]
    - [320, 0.0]
  - - [512, 512, 1, 2000]
    - [321, 0.0]
  - - [32, 512, 1, 512]
    - [322, 0.0]
  - - [100, 1024, 1, 2048]
    - [323, 0.0]
  - - [8, 512, 1, 500]
    - [324, 0.0]
  - - [8, 500, 1, 1024]
    - [325, 0.0]
  - - [100, 2000, 1, 1024]
    - [326, 0.0]
  - - [64, 1024, 1, 100]
    - [327, 0.0]
  - - [64, 1024, 1, 500]
    - [328, 0.0]
  - - [64, 1024, 1, 1024]
    - [329, 0.0]
  - - [128, 2000, 1, 100]
    - [330, 0.0]
  - - [2, 500, 1, 2048]
    - [325, 0.0]
  - - [16, 512, 1, 10]
    - [331, 0.0]
  - - [64, 2000, 1, 1024]
    - [332, 0.0]
  - - [100, 1024, 1, 1024]
    - [333, 0.0]
  - - [8, 512, 1, 10]
    - [334, 0.0]
  - - [16, 500, 1, 2048]
    - [325, 0.0]
  - - [10, 100, 1, 500]
    - [324, 0.0]
  - - [16, 100, 1, 10]
    - [334, 0.0]
  - - [500, 1024, 1, 512]
    - [335, 0.0]
  - - [128, 1024, 1, 512]
    - [336, 0.0]
  - - [512, 500, 1, 2000]
    - [337, 0.0]
  - - [2, 100, 1, 2000]
    - [324, 0.0]
  - - [500, 512, 1, 100]
    - [338, 0.0]
  - - [100, 1024, 1, 500]
    - [336, 0.0]
  - - [256, 100, 1, 2048]
    - [339, 0.0]
  - - [2, 512, 1, 512]
    - [340, 0.0]
  - - [128, 2000, 1, 512]
    - [332, 0.0]
  - - [2, 100, 1, 10]
    - [331, 0.0]
  - - [16, 2000, 1, 2048]
    - [341, 0.0]
  - - [200, 100, 1, 100]
    - [342, 0.0]
  - - [256, 1024, 1, 100]
    - [343, 0.0]
  - - [200, 500, 1, 1024]
    - [344, 0.0]
  - - [500, 100, 1, 100]
    - [345, 0.0]
  - - [4, 100, 1, 10]
    - [346, 0.0]
  - - [32, 100, 1, 512]
    - [325, 0.0]
  - - [100, 2000, 1, 512]
    - [332, 0.0]
  - - [16, 1024, 1, 512]
    - [347, 0.0]
  - - [200, 512, 1, 100]
    - [348, 0.0]
  - - [4, 1024, 1, 1024]
    - [322, 0.0]
  - - [512, 1024, 1, 512]
    - [349, 0.0]
  - - [4, 512, 1, 10]
    - [350, 0.0]
  - - [2, 2048, 1, 2000]
    - [324, 0.0]
  - - [64, 2048, 1, 10]
    - [351, 0.0]
  - - [128, 100, 1, 10]
    - [352, 0.0]
  - - [4, 512, 1, 2048]
    - [324, 0.0]
  - - [64, 2048, 1, 500]
    - [353, 0.0]
  - - [512, 512, 1, 512]
    - [354, 0.0]
  - - [500, 500, 1, 2000]
    - [337, 0.0]
  - - [10, 1024, 1, 2000]
    - [355, 0.0]
  - - [256, 100, 1, 100]
    - [356, 0.0]
  - - [32, 2000, 1, 2048]
    - [357, 0.0]
  - - [64, 1024, 1, 2048]
    - [358, 0.0]
  - - [200, 2048, 1, 512]
    - [359, 0.0]
  - - [256, 500, 1, 10]
    - [360, 0.0]
  - - [16, 1024, 1, 100]
    - [361, 0.0]
  - - [32, 1024, 1, 1024]
    - [362, 0.0]
  - - [512, 500, 1, 512]
    - [363, 0.0]
  - - [128, 1024, 1, 2000]
    - [364, 0.0]
  - - [8, 100, 1, 500]
    - [324, 0.0]
  - - [100, 2000, 1, 2048]
    - [365, 0.0]
  - - [10, 512, 1, 512]
    - [320, 0.0]
  - - [8, 500, 1, 10]
    - [350, 0.0]
  - - [10, 2000, 1, 1024]
    - [366, 0.0]
  - - [16, 1024, 1, 10]
    - [367, 0.0]
  - - [16, 512, 1, 2048]
    - [368, 0.0]
  - - [256, 512, 1, 10]
    - [369, 0.0]
  - - [2, 2000, 1, 100]
    - [370, 0.0]
  - - [128, 512, 1, 2048]
    - [371, 0.0]
  - - [128, 512, 1, 100]
    - [372, 0.0]
  - - [512, 2000, 1, 1024]
    - [373, 0.0]
  - - [64, 500, 1, 2048]
    - [374, 0.0]
  - - [64, 2000, 1, 2048]
    - [375, 0.0]
  - - [64, 2048, 1, 512]
    - [376, 0.0]
  - - [10, 2000, 1, 512]
    - [324, 0.0]
  - - [32, 2000, 1, 500]
    - [362, 0.0]
  - - [64, 2000, 1, 10]
    - [377, 0.0]
  - - [500, 100, 1, 10]
    - [378, 0.0]
  - - [128, 1024, 1, 500]
    - [379, 0.0]
  - - [64, 100, 1, 2048]
    - [324, 0.0]
  - - [64, 100, 1, 10]
    - [380, 0.0]
  - - [16, 512, 1, 500]
    - [320, 0.0]
  - - [32, 2000, 1, 1024]
    - [381, 0.0]
  - - [200, 512, 1, 1024]
    - [364, 0.0]
  - - [128, 2048, 1, 10]
    - [382, 0.0]
  - - [200, 100, 1, 2000]
    - [324, 0.0]
  - - [2, 100, 1, 512]
    - [324, 0.0]
  - - [64, 2048, 1, 100]
    - [348, 0.0]
  - - [32, 512, 1, 100]
    - [383, 0.0]
  - - [16, 512, 1, 1024]
    - [325, 0.0]
  - - [4, 1024, 1, 512]
    - [384, 0.0]
  - - [64, 2000, 1, 100]
    - [348, 0.0]
  - - [512, 2048, 1, 512]
    - [373, 0.0]
  - - [2, 500, 1, 500]
    - [385, 0.0]
  - - [32, 100, 1, 100]
    - [383, 0.0]
  - - [100, 500, 1, 2000]
    - [362, 0.0]
  - - [200, 2000, 1, 100]
    - [386, 0.0]
  - - [10, 512, 1, 10]
    - [387, 0.0]
  - - [100, 500, 1, 2048]
    - [388, 0.0]
  - - [4, 2048, 1, 500]
    - [320, 0.0]
  - - [200, 500, 1, 100]
    - [359, 0.0]
  - - [500, 500, 1, 500]
    - [363, 0.0]
  - - [2, 100, 1, 1024]
    - [325, 0.0]
  - - [128, 2048, 1, 512]
    - [389, 0.0]
  - - [200, 2000, 1, 1024]
    - [390, 0.0]
  - - [32, 512, 1, 1024]
    - [391, 0.0]
  - - [100, 2048, 1, 500]
    - [343, 0.0]
  - - [256, 100, 1, 1024]
    - [376, 0.0]
  - - [16, 2000, 1, 500]
    - [392, 0.0]
  - - [128, 100, 1, 100]
    - [383, 0.0]
  - - [500, 500, 1, 2048]
    - [393, 0.0]
  - - [32, 512, 1, 10]
    - [394, 0.0]
  - - [128, 100, 1, 1024]
    - [395, 0.0]
  - - [16, 500, 1, 2000]
    - [355, 0.0]
  - - [4, 2048, 1, 100]
    - [396, 0.0]
  - - [64, 500, 1, 500]
    - [397, 0.0]
  - - [500, 1024, 1, 2048]
    - [398, 0.0]
  - - [512, 2048, 1, 100]
    - [399, 0.0]
  - - [128, 512, 1, 1024]
    - [400, 0.0]
  - - [128, 512, 1, 2000]
    - [401, 0.0]
  - - [128, 2000, 1, 2000]
    - [402, 0.0]
  - - [2, 512, 1, 10]
    - [403, 0.0]
  - - [10, 512, 1, 500]
    - [324, 0.0]
  - - [4, 1024, 1, 2000]
    - [404, 0.0]
  - - [256, 100, 1, 2000]
    - [405, 0.0]
  - - [512, 2048, 1, 2000]
    - [373, 0.0]
  - - [100, 100, 1, 10]
    - [406, 0.0]
  - - [256, 500, 1, 1024]
    - [407, 0.0]
  - - [128, 512, 1, 10]
    - [382, 0.0]
  - - [256, 100, 1, 500]
    - [408, 0.0]
  - - [64, 100, 1, 512]
    - [409, 0.0]
  - - [64, 512, 1, 500]
    - [324, 0.0]
  - - [64, 2048, 1, 2000]
    - [376, 0.0]
  - - [100, 2048, 1, 1024]
    - [410, 0.0]
  - - [200, 2000, 1, 10]
    - [382, 0.0]
  - - [128, 1024, 1, 100]
    - [359, 0.0]
  - - [16, 2000, 1, 100]
    - [383, 0.0]
  - - [8, 100, 1, 512]
    - [324, 0.0]
  - - [500, 2048, 1, 1024]
    - [373, 0.0]
  - - [500, 2000, 1, 10]
    - [411, 0.0]
  - - [32, 100, 1, 500]
    - [325, 0.0]
  - - [256, 1024, 1, 2048]
    - [398, 0.0]
  - - [32, 500, 1, 2048]
    - [324, 0.0]
  - - [4, 2000, 1, 10]
    - [412, 0.0]
  - - [128, 500, 1, 2000]
    - [395, 0.0]
  - - [8, 1024, 1, 10]
    - [413, 0.0]
  - - [2, 500, 1, 100]
    - [414, 0.0]
  - - [10, 500, 1, 512]
    - [324, 0.0]
  - - [10, 2000, 1, 10]
    - [331, 0.0]
  - - [500, 512, 1, 512]
    - [354, 0.0]
  - - [32, 500, 1, 500]
    - [324, 0.0]
  - - [256, 500, 1, 2000]
    - [415, 0.0]
  - - [100, 500, 1, 100]
    - [416, 0.0]
  - - [500, 2048, 1, 100]
    - [417, 0.0]
  - - [10, 1024, 1, 512]
    - [324, 0.0]
  - - [2, 2048, 1, 512]
    - [320, 0.0]
  - - [256, 512, 1, 100]
    - [418, 0.0]
  - - [10, 2048, 1, 100]
    - [324, 0.0]
  - - [8, 2048, 1, 100]
    - [419, 0.0]
  - - [512, 100, 1, 512]
    - [408, 0.0]
  - - [4, 500, 1, 500]
    - [324, 0.0]
  - - [64, 100, 1, 1024]
    - [324, 0.0]
  - - [2, 2048, 1, 1024]
    - [420, 0.0]
  - - [2, 500, 1, 2000]
    - [421, 0.0]
  - - [512, 1024, 1, 500]
    - [349, 0.0]
  - - [128, 2000, 1, 500]
    - [359, 0.0]
  - - [32, 512, 1, 2048]
    - [422, 0.0]
  - - [10, 100, 1, 2000]
    - [324, 0.0]
  - - [4, 100, 1, 512]
    - [324, 0.0]
  - - [2, 512, 1, 2048]
    - [325, 0.0]
  - - [200, 512, 1, 2048]
    - [364, 0.0]
  - - [200, 2000, 1, 2000]
    - [423, 0.0]
  - - [100, 100, 1, 2000]
    - [324, 0.0]
  - - [500, 2048, 1, 2000]
    - [424, 0.0]
  - - [64, 2048, 1, 2048]
    - [425, 0.0]
  - - [16, 2000, 1, 1024]
    - [426, 0.0]
  - - [512, 2048, 1, 1024]
    - [427, 0.0]
  - - [10, 500, 1, 500]
    - [320, 0.0]
  - - [200, 1024, 1, 2048]
    - [428, 0.0]
  - - [10, 2000, 1, 2000]
    - [324, 0.0]
  - - [8, 2000, 1, 500]
    - [392, 0.0]
  - - [2, 100, 1, 2048]
    - [325, 0.0]
  - - [32, 100, 1, 2048]
    - [325, 0.0]
  - - [512, 512, 1, 10]
    - [429, 0.0]
  - - [512, 500, 1, 10]
    - [430, 0.0]
  - - [16, 100, 1, 1024]
    - [320, 0.0]
  - - [2, 500, 1, 10]
    - [431, 0.0]
  - - [200, 512, 1, 10]
    - [432, 0.0]
  - - [512, 1024, 1, 100]
    - [433, 0.0]
  - - [16, 2000, 1, 2000]
    - [324, 0.0]
  - - [500, 500, 1, 1024]
    - [393, 0.0]
  - - [500, 100, 1, 2048]
    - [408, 0.0]
  - - [256, 1024, 1, 512]
    - [434, 0.0]
  - - [256, 500, 1, 512]
    - [435, 0.0]
  - - [16, 1024, 1, 2000]
    - [325, 0.0]
  - - [200, 500, 1, 2048]
    - [364, 0.0]
  - - [256, 2000, 1, 10]
    - [436, 0.0]
  - - [10, 2048, 1, 2048]
    - [437, 0.0]
  - - [512, 2000, 1, 100]
    - [399, 0.0]
  - - [10, 1024, 1, 1024]
    - [322, 0.0]
  - - [512, 2000, 1, 2048]
    - [438, 0.0]
  - - [500, 1024, 1, 500]
    - [439, 0.0]
  - - [500, 100, 1, 512]
    - [408, 0.0]
  - - [256, 2000, 1, 100]
    - [390, 0.0]
  - - [512, 1024, 1, 2048]
    - [440, 0.0]
  - - [32, 512, 1, 500]
    - [324, 0.0]
  - - [100, 2000, 1, 10]
    - [382, 0.0]
  - - [100, 500, 1, 512]
    - [401, 0.0]
  - - [8, 2000, 1, 512]
    - [392, 0.0]
  - - [100, 2048, 1, 2048]
    - [441, 0.0]
  - - [128, 1024, 1, 2048]
    - [388, 0.0]
  - - [8, 500, 1, 2000]
    - [442, 0.0]
  - - [100, 2000, 1, 500]
    - [343, 0.0]
  - - [100, 2048, 1, 100]
    - [343, 0.0]
  - - [4, 100, 1, 1024]
    - [324, 0.0]
  - - [500, 2048, 1, 2048]
    - [438, 0.0]
  - - [2, 2000, 1, 2048]
    - [443, 0.0]
  - - [200, 2048, 1, 10]
    - [444, 0.0]
  - - [2, 500, 1, 1024]
    - [325, 0.0]
  - - [100, 500, 1, 1024]
    - [395, 0.0]
  - - [16, 2048, 1, 500]
    - [324, 0.0]
  - - [100, 1024, 1, 10]
    - [351, 0.0]
  - - [8, 2048, 1, 1024]
    - [445, 0.0]
  - - [2, 2000, 1, 500]
    - [324, 0.0]
  - - [32, 100, 1, 1024]
    - [324, 0.0]
  - - [500, 2000, 1, 512]
    - [335, 0.0]
  - - [64, 100, 1, 2000]
    - [320, 0.0]
  - - [100, 1024, 1, 2000]
    - [344, 0.0]
  - - [64, 500, 1, 10]
    - [446, 0.0]
  - - [32, 2048, 1, 100]
    - [447, 0.0]
  - - [64, 500, 1, 512]
    - [324, 0.0]
  - - [10, 100, 1, 1024]
    - [320, 0.0]
  - - [16, 512, 1, 100]
    - [383, 0.0]
  - - [4, 100, 1, 2000]
    - [355, 0.0]
  - - [2, 512, 1, 1024]
    - [325, 0.0]
  - - [64, 512, 1, 1024]
    - [448, 0.0]
  - - [10, 2048, 1, 500]
    - [324, 0.0]
  - - [4, 2000, 1, 2048]
    - [443, 0.0]
  - - [512, 100, 1, 2048]
    - [376, 0.0]
  - - [32, 100, 1, 2000]
    - [324, 0.0]
  - - [256, 512, 1, 500]
    - [435, 0.0]
  - - [100, 2000, 1, 100]
    - [343, 0.0]
  - - [8, 2000, 1, 1024]
    - [449, 0.0]
  - - [4, 512, 1, 500]
    - [324, 0.0]
  - - [128, 1024, 1, 10]
    - [450, 0.0]
  - - [4, 500, 1, 1024]
    - [324, 0.0]
  - - [32, 2048, 1, 512]
    - [362, 0.0]
  - - [32, 100, 1, 10]
    - [331, 0.0]
  - - [100, 2048, 1, 10]
    - [451, 0.0]
  - - [512, 500, 1, 100]
    - [452, 0.0]
  - - [128, 2000, 1, 1024]
    - [410, 0.0]
  - - [200, 1024, 1, 500]
    - [343, 0.0]
  - - [32, 2048, 1, 1024]
    - [453, 0.0]
  - - [10, 1024, 1, 2048]
    - [454, 0.0]
  - - [8, 500, 1, 100]
    - [383, 0.0]
  - - [32, 2048, 1, 500]
    - [362, 0.0]
  - - [200, 100, 1, 1024]
    - [371, 0.0]
  - - [16, 100, 1, 100]
    - [455, 0.0]
  - - [8, 1024, 1, 2000]
    - [355, 0.0]
  - - [4, 512, 1, 100]
    - [383, 0.0]
  - - [16, 500, 1, 100]
    - [383, 0.0]
  - - [8, 1024, 1, 2048]
    - [456, 0.0]
  - - [16, 1024, 1, 2048]
    - [421, 0.0]
  - - [10, 2048, 1, 1024]
    - [457, 0.0]
  - - [64, 512, 1, 100]
    - [383, 0.0]
  - - [2, 100, 1, 500]
    - [324, 0.0]
  - - [2, 500, 1, 512]
    - [426, 0.0]
  - - [256, 512, 1, 2000]
    - [415, 0.0]
  - - [128, 500, 1, 1024]
    - [362, 0.0]
  - - [10, 100, 1, 10]
    - [334, 0.0]
  - - [8, 2048, 1, 2048]
    - [458, 0.0]
  - - [16, 2048, 1, 2048]
    - [459, 0.0]
  - - [64, 1024, 1, 10]
    - [444, 0.0]
  - - [500, 100, 1, 500]
    - [408, 0.0]
  - - [256, 1024, 1, 2000]
    - [321, 0.0]
  - - [200, 512, 1, 500]
    - [359, 0.0]
  - - [8, 2000, 1, 10]
    - [460, 0.0]
  - - [64, 2000, 1, 512]
    - [461, 0.0]
  - - [2, 512, 1, 100]
    - [414, 0.0]
  - - [4, 2000, 1, 2000]
    - [324, 0.0]
  - - [200, 1024, 1, 100]
    - [343, 0.0]
  - - [16, 100, 1, 500]
    - [325, 0.0]
  - - [128, 100, 1, 500]
    - [395, 0.0]
  - - [500, 1024, 1, 1024]
    - [462, 0.0]
  - - [200, 1024, 1, 1024]
    - [425, 0.0]
  - - [8, 2048, 1, 512]
    - [320, 0.0]
  - - [200, 2000, 1, 500]
    - [390, 0.0]
  - - [512, 100, 1, 1024]
    - [408, 0.0]
  - - [16, 100, 1, 2000]
    - [320, 0.0]
  - - [500, 512, 1, 2000]
    - [321, 0.0]
  - - [8, 2000, 1, 2048]
    - [463, 0.0]
  - - [256, 2048, 1, 100]
    - [464, 0.0]
  - - [32, 2048, 1, 2000]
    - [340, 0.0]
  - - [200, 500, 1, 512]
    - [379, 0.0]
  - - [10, 512, 1, 100]
    - [383, 0.0]
  - - [16, 2000, 1, 10]
    - [465, 0.0]
  - - [8, 512, 1, 100]
    - [383, 0.0]
  - - [256, 512, 1, 512]
    - [407, 0.0]
  - - [500, 2000, 1, 1024]
    - [427, 0.0]
  - - [512, 512, 1, 500]
    - [354, 0.0]
  - - [256, 2048, 1, 1024]
    - [466, 0.0]
  - - [8, 2048, 1, 2000]
    - [324, 0.0]
  - - [100, 1024, 1, 512]
    - [408, 0.0]
  - - [128, 100, 1, 2000]
    - [467, 0.0]
  - - [4, 2048, 1, 2048]
    - [454, 0.0]
  - - [2, 1024, 1, 2000]
    - [468, 0.0]
  - - [100, 512, 1, 512]
    - [362, 0.0]
  - - [128, 1024, 1, 1024]
    - [425, 0.0]
  - - [200, 2048, 1, 1024]
    - [469, 0.0]
  - - [32, 1024, 1, 2000]
    - [320, 0.0]
  - - [128, 500, 1, 100]
    - [372, 0.0]
  - - [200, 512, 1, 2000]
    - [344, 0.0]
  - - [10, 2048, 1, 2000]
    - [320, 0.0]
  - - [256, 1024, 1, 500]
    - [470, 0.0]
  - - [100, 100, 1, 100]
    - [383, 0.0]
  - - [8, 512, 1, 1024]
    - [471, 0.0]
  - - [200, 1024, 1, 512]
    - [343, 0.0]
  - - [256, 500, 1, 500]
    - [415, 0.0]
  - - [200, 100, 1, 500]
    - [344, 0.0]
  - - [2, 1024, 1, 2048]
    - [443, 0.0]
  - - [256, 500, 1, 2048]
    - [415, 0.0]
  - - [512, 2048, 1, 500]
    - [373, 0.0]
  - - [512, 100, 1, 2000]
    - [408, 0.0]
  - - [512, 500, 1, 1024]
    - [472, 0.0]
  - - [16, 512, 1, 2000]
    - [421, 0.0]
  - - [64, 500, 1, 1024]
    - [448, 0.0]
  - - [512, 2000, 1, 10]
    - [473, 0.0]
  - - [256, 512, 1, 1024]
    - [407, 0.0]
  - - [10, 512, 1, 1024]
    - [325, 0.0]
  - - [512, 100, 1, 100]
    - [345, 0.0]
  - - [8, 2000, 1, 100]
    - [383, 0.0]
  - - [128, 2048, 1, 1024]
    - [410, 0.0]
  - - [2, 2000, 1, 2000]
    - [324, 0.0]
  - - [16, 2048, 1, 1024]
    - [474, 0.0]
  - - [500, 512, 1, 500]
    - [363, 0.0]
  - - [8, 100, 1, 1024]
    - [448, 0.0]
  - - [10, 100, 1, 100]
    - [455, 0.0]
  - - [200, 500, 1, 500]
    - [379, 0.0]
  - - [10, 500, 1, 2000]
    - [421, 0.0]
  - - [500, 100, 1, 2000]
    - [376, 0.0]
  - - [100, 512, 1, 2000]
    - [475, 0.0]
  - - [500, 1024, 1, 2000]
    - [476, 0.0]
  - - [32, 2000, 1, 2000]
    - [426, 0.0]
  - - [64, 1024, 1, 512]
    - [401, 0.0]
  - - [64, 2000, 1, 2000]
    - [379, 0.0]
  - - [32, 500, 1, 100]
    - [383, 0.0]
  - - [128, 2000, 1, 2048]
    - [365, 0.0]
  - - [10, 100, 1, 2048]
    - [325, 0.0]
  - - [32, 2048, 1, 2048]
    - [453, 0.0]
  - - [64, 100, 1, 100]
    - [324, 0.0]
  - - [2, 1024, 1, 100]
    - [477, 0.0]
  - - [256, 1024, 1, 10]
    - [478, 0.0]
  - - [256, 1024, 1, 1024]
    - [479, 0.0]
  - - [64, 500, 1, 2000]
    - [324, 0.0]
  - - [512, 2000, 1, 512]
    - [480, 0.0]
  - - [8, 512, 1, 512]
    - [322, 0.0]
  - - [8, 512, 1, 2048]
    - [324, 0.0]
  - - [100, 100, 1, 1024]
    - [401, 0.0]
  - - [2, 2048, 1, 10]
    - [412, 0.0]
  - - [4, 2048, 1, 512]
    - [392, 0.0]
  - - [4, 2048, 1, 10]
    - [481, 0.0]
  - - [8, 100, 1, 2000]
    - [443, 0.0]
  - - [2, 1024, 1, 1024]
    - [482, 0.0]
  - - [16, 2048, 1, 100]
    - [324, 0.0]
  - - [16, 512, 1, 512]
    - [320, 0.0]
  - - [32, 500, 1, 512]
    - [322, 0.0]
  - - [500, 2000, 1, 2000]
    - [373, 0.0]
  - - [500, 1024, 1, 10]
    - [369, 0.0]
  - - [32, 500, 1, 1024]
    - [483, 0.0]
  - - [32, 500, 1, 10]
    - [484, 0.0]
  - - [500, 500, 1, 10]
    - [343, 0.0]
  - - [4, 2000, 1, 500]
    - [320, 0.0]
  - - [10, 2000, 1, 500]
    - [324, 0.0]
  - - [32, 2000, 1, 512]
    - [371, 0.0]
  - - [256, 500, 1, 100]
    - [485, 0.0]
  - - [256, 2048, 1, 10]
    - [369, 0.0]
  - - [4, 1024, 1, 500]
    - [324, 0.0]
  - - [256, 512, 1, 2048]
    - [415, 0.0]
  - - [2, 2000, 1, 1024]
    - [474, 0.0]
  - - [256, 100, 1, 512]
    - [408, 0.0]
  - - [8, 1024, 1, 500]
    - [324, 0.0]
  - - [256, 2048, 1, 500]
    - [335, 0.0]
  - - [256, 2048, 1, 2048]
    - [435, 0.0]
  - - [2, 2000, 1, 512]
    - [384, 0.0]
  - - [256, 2000, 1, 512]
    - [486, 0.0]
  - - [4, 1024, 1, 100]
    - [487, 0.0]
  - - [512, 1024, 1, 2000]
    - [349, 0.0]
  - - [100, 500, 1, 500]
    - [362, 0.0]
  - - [4, 2048, 1, 1024]
    - [488, 0.0]
  - - [2, 1024, 1, 500]
    - [324, 0.0]
  - - [64, 100, 1, 500]
    - [324, 0.0]
  - - [256, 2000, 1, 2000]
    - [438, 0.0]
  - - [2, 512, 1, 500]
    - [426, 0.0]
  - - [8, 2048, 1, 500]
    - [324, 0.0]
  - - [10, 1024, 1, 500]
    - [324, 0.0]
  - - [4, 2048, 1, 2000]
    - [320, 0.0]
  - - [200, 1024, 1, 2000]
    - [489, 0.0]
  - - [128, 500, 1, 512]
    - [401, 0.0]
  - - [10, 500, 1, 2048]
    - [325, 0.0]
  - - [256, 2048, 1, 2000]
    - [438, 0.0]
  - - [8, 2000, 1, 2000]
    - [320, 0.0]
  - - [100, 2048, 1, 512]
    - [490, 0.0]
  - - [512, 500, 1, 2048]
    - [415, 0.0]
  - - [200, 2048, 1, 100]
    - [390, 0.0]
  - - [128, 512, 1, 512]
    - [362, 0.0]
  - - [200, 2000, 1, 2048]
    - [491, 0.0]
  - - [4, 2000, 1, 1024]
    - [474, 0.0]
  - - [64, 512, 1, 10]
    - [492, 0.0]
  - - [32, 500, 1, 2000]
    - [468, 0.0]
  - - [128, 2048, 1, 2000]
    - [493, 0.0]
  - - [100, 100, 1, 2048]
    - [324, 0.0]
  - - [500, 2048, 1, 512]
    - [335, 0.0]
  - - [200, 100, 1, 512]
    - [426, 0.0]
  - - [32, 2000, 1, 100]
    - [494, 0.0]
  - - [500, 512, 1, 2048]
    - [495, 0.0]
  - - [500, 2000, 1, 500]
    - [439, 0.0]
  - - [200, 100, 1, 2048]
    - [320, 0.0]
  - - [2, 2048, 1, 100]
    - [396, 0.0]
  - - [8, 100, 1, 10]
    - [346, 0.0]
  - - [200, 2048, 1, 2048]
    - [491, 0.0]
  - - [200, 2048, 1, 500]
    - [390, 0.0]
  - - [100, 100, 1, 500]
    - [401, 0.0]
  - - [8, 2048, 1, 10]
    - [496, 0.0]
  - - [100, 500, 1, 10]
    - [497, 0.0]
  - - [200, 500, 1, 2000]
    - [344, 0.0]
  - - [512, 2000, 1, 500]
    - [373, 0.0]
  - - [10, 500, 1, 1024]
    - [471, 0.0]
  - - [256, 100, 1, 10]
    - [498, 0.0]
  - - [500, 512, 1, 1024]
    - [393, 0.0]
  - - [200, 2048, 1, 2000]
    - [423, 0.0]
  - - [100, 1024, 1, 100]
    - [499, 0.0]
  - - [500, 1024, 1, 100]
    - [433, 0.0]
  - - [10, 512, 1, 2048]
    - [324, 0.0]
  - - [2, 1024, 1, 512]
    - [392, 0.0]
  - - [4, 500, 1, 2048]
    - [500, 0.0]
  - - [100, 512, 1, 100]
    - [372, 0.0]
  - - [16, 500, 1, 512]
    - [324, 0.0]
  - - [10, 1024, 1, 100]
    - [361, 0.0]
  - - [8, 1024, 1, 100]
    - [487, 0.0]
  - - [64, 2000, 1, 500]
    - [501, 0.0]
  - - [64, 1024, 1, 2000]
    - [426, 0.0]
  - - [10, 100, 1, 512]
    - [324, 0.0]
  - - [4, 500, 1, 2000]
    - [421, 0.0]
  - - [512, 1024, 1, 10]
    - [502, 0.0]
  - - [128, 2048, 1, 2048]
    - [353, 0.0]
  - - [4, 100, 1, 100]
    - [455, 0.0]
  - - [32, 1024, 1, 512]
    - [392, 0.0]
  - - [8, 512, 1, 2000]
    - [442, 0.0]
  - - [100, 100, 1, 512]
    - [340, 0.0]
  - - [2, 2048, 1, 2048]
    - [503, 0.0]
  - - [2, 512, 1, 2000]
    - [421, 0.0]
  - - [16, 500, 1, 10]
    - [383, 0.0]
  - - [10, 500, 1, 100]
    - [383, 0.0]
  - - [4, 100, 1, 500]
    - [325, 0.0]
  - - [512, 1024, 1, 1024]
    - [504, 0.0]
  - - [64, 500, 1, 100]
    - [505, 0.0]
  - - [128, 2000, 1, 10]
    - [451, 0.0]
  - - [10, 2000, 1, 2048]
    - [459, 0.0]
  - - [2, 100, 1, 100]
    - [506, 0.0]
  - - [10, 512, 1, 2000]
    - [443, 0.0]
  - - [8, 500, 1, 500]
    - [324, 0.0]
  - - [4, 500, 1, 512]
    - [324, 0.0]
  - - [10, 500, 1, 10]
    - [507, 0.0]
  - - [64, 512, 1, 2000]
    - [324, 0.0]
  - - [500, 512, 1, 10]
    - [429, 0.0]
  - - [200, 512, 1, 512]
    - [379, 0.0]
  - - [512, 500, 1, 500]
    - [354, 0.0]
  - - [32, 512, 1, 2000]
    - [320, 0.0]
  - - [128, 500, 1, 2048]
    - [475, 0.0]
  - - [500, 2048, 1, 10]
    - [508, 0.0]
  - - [512, 512, 1, 100]
    - [452, 0.0]
  - - [200, 2000, 1, 512]
    - [359, 0.0]
  - - [500, 500, 1, 512]
    - [363, 0.0]
  - - [128, 2048, 1, 500]
    - [343, 0.0]
  - - [4, 512, 1, 512]
    - [324, 0.0]
  - - [16, 2048, 1, 2000]
    - [482, 0.0]
  - - [16, 500, 1, 1024]
    - [324, 0.0]
  - - [256, 2000, 1, 500]
    - [335, 0.0]
  - - [10, 1024, 1, 10]
    - [509, 0.0]
  - - [16, 500, 1, 500]
    - [324, 0.0]
  - - [10, 2048, 1, 512]
    - [361, 0.0]
  - - [200, 500, 1, 10]
    - [510, 0.0]
  - - [256, 2048, 1, 512]
    - [511, 0.0]
  - - [256, 2000, 1, 2048]
    - [407, 0.0]
  - - [500, 2048, 1, 500]
    - [439, 0.0]
  - - [500, 100, 1, 1024]
    - [376, 0.0]
  - - [16, 100, 1, 512]
    - [325, 0.0]
  - - [64, 512, 1, 2048]
    - [448, 0.0]
  - - [32, 1024, 1, 10]
    - [432, 0.0]
  - - [16, 2048, 1, 512]
    - [392, 0.0]
  - - [8, 1024, 1, 512]
    - [392, 0.0]
  - - [4, 1024, 1, 2048]
    - [512, 0.0]
  - - [100, 2048, 1, 2000]
    - [440, 0.0]
  - - [256, 2000, 1, 1024]
    - [390, 0.0]
  - - [200, 1024, 1, 10]
    - [513, 0.0]
  - - [128, 500, 1, 500]
    - [371, 0.0]
  - - [100, 512, 1, 1024]
    - [362, 0.0]
  - - [16, 1024, 1, 500]
    - [324, 0.0]
  - - [128, 100, 1, 2048]
    - [401, 0.0]
  - - [100, 512, 1, 500]
    - [362, 0.0]
  - - [8, 1024, 1, 1024]
    - [482, 0.0]
  - - [2, 2000, 1, 10]
    - [481, 0.0]
  - - [4, 500, 1, 10]
    - [350, 0.0]
  - - [500, 2000, 1, 2048]
    - [504, 0.0]
  - - [4, 2000, 1, 100]
    - [514, 0.0]
  - - [512, 2000, 1, 2000]
    - [373, 0.0]
  - - [128, 500, 1, 10]
    - [515, 0.0]
  - - [32, 1024, 1, 100]
    - [505, 0.0]
  - - [8, 500, 1, 2048]
    - [516, 0.0]
  - - [16, 1024, 1, 1024]
    - [385, 0.0]
  - - [200, 100, 1, 10]
    - [351, 0.0]
  - - [512, 100, 1, 500]
    - [376, 0.0]
  - - [512, 2048, 1, 2048]
    - [517, 0.0]
  - - [16, 2000, 1, 512]
    - [320, 0.0]
  - - [64, 2048, 1, 1024]
    - [518, 0.0]
  - - [32, 2048, 1, 10]
    - [519, 0.0]
  - - [10, 2048, 1, 10]
    - [520, 0.0]
  - - [4, 2000, 1, 512]
    - [324, 0.0]
  - - [4, 500, 1, 100]
    - [383, 0.0]
  - - [8, 100, 1, 2048]
    - [443, 0.0]
  - - [512, 2048, 1, 10]
    - [521, 0.0]
  - - [512, 100, 1, 10]
    - [378, 0.0]
  - - [4, 512, 1, 1024]
    - [324, 0.0]
  - - [16, 2048, 1, 10]
    - [522, 0.0]
  - - [500, 2000, 1, 100]
    - [417, 0.0]
  - - [32, 1024, 1, 2048]
    - [453, 0.0]
  - - [100, 2000, 1, 2000]
    - [440, 0.0]
  - - [128, 100, 1, 512]
    - [401, 0.0]
  - - [500, 500, 1, 100]
    - [343, 0.0]
  - - [32, 2000, 1, 10]
    - [432, 0.0]
  - - [128, 2048, 1, 100]
    - [343, 0.0]
  - - [10, 2000, 1, 100]
    - [383, 0.0]
  - - [2, 2048, 1, 500]
    - [320, 0.0]
  - - [32, 1024, 1, 500]
    - [320, 0.0]
  - - [4, 1024, 1, 10]
    - [350, 0.0]
  - - [100, 512, 1, 10]
    - [352, 0.0]
  - - [8, 100, 1, 100]
    - [523, 0.0]
  - - [128, 512, 1, 500]
    - [362, 0.0]
  - - [16, 100, 1, 2048]
    - [421, 0.0]
  - - [2, 1024, 1, 10]
    - [350, 0.0]
  - - [4, 100, 1, 2048]
    - [443, 0.0]
  - - [4, 512, 1, 2000]
    - [443, 0.0]
  - - [4096, 64, 1, 2048]
    - [524, 0.0]
  - - [1024, 10080, 1, 1024]
    - [525, 0.0]
  - - [1024, 1131, 1, 1024]
    - [526, 0.0]
  - - [36548, 1216, 1, 1024]
    - [527, 0.0]
  - - [1024, 29, 1, 1024]
    - [528, 0.0]
  - - [1024, 2592, 1, 1024]
    - [529, 0.0]
  - - [1024, 1568, 1, 1024]
    - [530, 0.0]
  - - [4096, 91, 1, 2048]
    - [531, 0.0]
  - - [1024, 4445, 1, 1024]
    - [532, 0.0]
  - - [1024, 6272, 1, 1024]
    - [533, 0.0]
  - - [36548, 3584, 1, 1024]
    - [534, 0.0]
  - - [1024, 1827, 1, 1024]
    - [530, 0.0]
  - - [1024, 3220, 1, 1024]
    - [535, 0.0]
  - - [1024, 1856, 1, 1024]
    - [536, 0.0]
  - - [1024, 1760, 1, 1024]
    - [536, 0.0]
  - - [1024, 1, 1, 21]
    - [537, 0.0]
  - - [36548, 4235, 1, 1024]
    - [534, 0.0]
  - - [1024, 49, 1, 1024]
    - [538, 0.0]
  - - [1024, 1984, 1, 1024]
    - [530, 0.0]
  - - [1024, 14720, 1, 1024]
    - [532, 0.0]
  - - [1024, 1152, 1, 1024]
    - [539, 0.0]
  - - [36548, 14976, 1, 1024]
    - [527, 0.0]
  - - [36548, 1152, 1, 1024]
    - [527, 0.0]
  - - [4096, 86, 1, 3072]
    - [531, 0.0]
  - - [1024, 3392, 1, 1024]
    - [533, 0.0]
  - - [1024, 1408, 1, 1024]
    - [533, 0.0]
  - - [1024, 2080, 1, 1024]
    - [540, 0.0]
  - - [1024, 1824, 1, 1024]
    - [541, 0.0]
  - - [36548, 2432, 1, 1024]
    - [534, 0.0]
  - - [4096, 29, 1, 2048]
    - [542, 0.0]
  - - [1024, 1102, 1, 1024]
    - [526, 0.0]
  - - [4096, 49, 1, 2048]
    - [543, 0.0]
  - - [36548, 1827, 1, 1024]
    - [527, 0.0]
  - - [4096, 25, 1, 2048]
    - [544, 0.0]
  - - [1024, 10176, 1, 1024]
    - [525, 0.0]
  - - [1024, 774, 1, 1024]
    - [545, 0.0]
  - - [1024, 1952, 1, 1024]
    - [530, 0.0]
  - - [4096, 128, 1, 2048]
    - [539, 0.0]
  - - [1024, 17024, 1, 1024]
    - [535, 0.0]
  - - [1024, 1472, 1, 1024]
    - [529, 0.0]
  - - [36548, 4459, 1, 1024]
    - [534, 0.0]
  - - [4096, 91, 1, 3072]
    - [546, 0.0]
  - - [1024, 3712, 1, 1024]
    - [529, 0.0]
  - - [4096, 64, 1, 3072]
    - [547, 0.0]
  - - [4096, 29, 1, 3072]
    - [542, 0.0]
  - - [4096, 128, 1, 3072]
    - [531, 0.0]
  - - [36548, 12928, 1, 1024]
    - [527, 0.0]
  - - [1024, 1632, 1, 1024]
    - [539, 0.0]
  - - [1024, 1696, 1, 1024]
    - [548, 0.0]
  - - [4096, 24, 1, 2048]
    - [542, 0.0]
  - - [4096, 63, 1, 3072]
    - [549, 0.0]
  - - [4096, 96, 1, 2048]
    - [539, 0.0]
  - - [36548, 1764, 1, 1024]
    - [534, 0.0]
  - - [4096, 32, 1, 2048]
    - [550, 0.0]
  - - [1024, 35, 1, 1024]
    - [551, 0.0]
  - - [1024, 1120, 1, 1024]
    - [531, 0.0]
  - - [4096, 49, 1, 3072]
    - [543, 0.0]
  - - [1024, 24, 1, 1024]
    - [551, 0.0]
  - - [1024, 2944, 1, 1024]
    - [552, 0.0]
  - - [36548, 14080, 1, 1024]
    - [534, 0.0]
  - - [1024, 1280, 1, 1024]
    - [531, 0.0]
  - - [1024, 13440, 1, 1024]
    - [534, 0.0]
  - - [1024, 1015, 1, 1024]
    - [529, 0.0]
  - - [36548, 9120, 1, 1024]
    - [534, 0.0]
  - - [36548, 1, 1, 1024]
    - [537, 0.0]
  - - [1024, 3008, 1, 1024]
    - [552, 0.0]
  - - [1024, 2560, 1, 1024]
    - [532, 0.0]
  - - [1024, 21, 1, 1024]
    - [553, 0.0]
  - - [1024, 2208, 1, 1024]
    - [531, 0.0]
  - - [1024, 96, 1, 1024]
    - [554, 0.0]
  - - [4096, 86, 1, 2048]
    - [539, 0.0]
  - - [4096, 96, 1, 3072]
    - [531, 0.0]
  - - [1024, 1920, 1, 1024]
    - [555, 0.0]
  - - [4096, 27, 1, 2048]
    - [542, 0.0]
  - - [36548, 2496, 1, 1024]
    - [534, 0.0]
  - - [1024, 1, 1, 14]
    - [537, 0.0]
  - - [1024, 91, 1, 1024]
    - [556, 0.0]
  - - [1024, 2016, 1, 1024]
    - [536, 0.0]
  - - [1024, 1184, 1, 1024]
    - [539, 0.0]
  - - [4096, 1, 1, 2048]
    - [537, 0.0]
  - - [1024, 1664, 1, 1024]
    - [548, 0.0]
  - - [1024, 11424, 1, 1024]
    - [532, 0.0]
  - - [4096, 24, 1, 3072]
    - [557, 0.0]
  - - [1024, 1216, 1, 1024]
    - [531, 0.0]
  - - [36548, 3185, 1, 1024]
    - [534, 0.0]
  - - [36548, 9216, 1, 1024]
    - [534, 0.0]
  - - [1024, 3200, 1, 1024]
    - [532, 0.0]
  - - [1024, 2656, 1, 1024]
    - [533, 0.0]
  - - [1024, 2368, 1, 1024]
    - [533, 0.0]
  - - [1024, 4459, 1, 1024]
    - [529, 0.0]
  - - [1024, 3808, 1, 1024]
    - [529, 0.0]
  - - [1024, 2336, 1, 1024]
    - [533, 0.0]
  - - [4096, 27, 1, 3072]
    - [542, 0.0]
  - - [1024, 2304, 1, 1024]
    - [558, 0.0]
  - - [1024, 1560, 1, 1024]
    - [559, 0.0]
  - - [4096, 35, 1, 3072]
    - [543, 0.0]
  - - [1024, 2496, 1, 1024]
    - [560, 0.0]
  - - [1024, 1504, 1, 1024]
    - [560, 0.0]
  - - [4096, 50, 1, 2048]
    - [561, 0.0]
  - - [1024, 3232, 1, 1024]
    - [533, 0.0]
  - - [1024, 14, 1, 1024]
    - [553, 0.0]
  - - [36548, 1015, 1, 1024]
    - [534, 0.0]
  - - [1024, 2000, 1, 1024]
    - [562, 0.0]
  - - [36548, 243, 1, 1024]
    - [563, 0.0]
  - - [36548, 32, 1, 1024]
    - [564, 0.0]
  - - [1024, 25, 1, 1024]
    - [528, 0.0]
  - - [1024, 13184, 1, 1024]
    - [565, 0.0]
  - - [1024, 2688, 1, 1024]
    - [558, 0.0]
  - - [1024, 27, 1, 1024]
    - [566, 0.0]
  - - [36548, 950, 1, 1024]
    - [527, 0.0]
  - - [1024, 1764, 1, 1024]
    - [548, 0.0]
  - - [1024, 992, 1, 1024]
    - [533, 0.0]
  - - [1024, 1376, 1, 1024]
    - [533, 0.0]
  - - [1024, 950, 1, 1024]
    - [529, 0.0]
  - - [36548, 774, 1, 1024]
    - [534, 0.0]
  - - [36548, 25, 1, 1024]
    - [564, 0.0]
  - - [1024, 4256, 1, 1024]
    - [533, 0.0]
  - - [4096, 32, 1, 3072]
    - [544, 0.0]
  - - [1024, 243, 1, 1024]
    - [567, 0.0]
  - - [36548, 3712, 1, 1024]
    - [534, 0.0]
  - - [1024, 50, 1, 1024]
    - [538, 0.0]
  - - [1024, 3360, 1, 1024]
    - [568, 0.0]
  - - [1024, 2784, 1, 1024]
    - [529, 0.0]
  - - [1024, 4992, 1, 1024]
    - [532, 0.0]
  - - [36548, 1102, 1, 1024]
    - [527, 0.0]
  - - [1024, 1536, 1, 1024]
    - [535, 0.0]
  - - [1024, 2720, 1, 1024]
    - [560, 0.0]
  - - [4096, 1, 1, 3072]
    - [537, 0.0]
  - - [1024, 2752, 1, 1024]
    - [529, 0.0]
  - - [1024, 2816, 1, 1024]
    - [532, 0.0]
  - - [1024, 2624, 1, 1024]
    - [529, 0.0]
  - - [1024, 2144, 1, 1024]
    - [569, 0.0]
  - - [36548, 1131, 1, 1024]
    - [527, 0.0]
  - - [4096, 25, 1, 3072]
    - [544, 0.0]
  - - [1024, 64, 1, 1024]
    - [538, 0.0]
  - - [1024, 3296, 1, 1024]
    - [532, 0.0]
  - - [36548, 4992, 1, 1024]
    - [534, 0.0]
  - - [1024, 1344, 1, 1024]
    - [533, 0.0]
  - - [36548, 2401, 1, 1024]
    - [534, 0.0]
  - - [1024, 15744, 1, 1024]
    - [534, 0.0]
  - - [1024, 15232, 1, 1024]
    - [535, 0.0]
  - - [1024, 1888, 1, 1024]
    - [570, 0.0]
  - - [1024, 1792, 1, 1024]
    - [571, 0.0]
  - - [36548, 1073, 1, 1024]
    - [534, 0.0]
  - - [4096, 50, 1, 3072]
    - [543, 0.0]
  - - [36548, 15488, 1, 1024]
    - [527, 0.0]
  - - [1024, 2464, 1, 1024]
    - [560, 0.0]
  - - [1024, 2272, 1, 1024]
    - [533, 0.0]
  - - [1024, 13, 1, 1024]
    - [572, 0.0]
  - - [1024, 2432, 1, 1024]
    - [532, 0.0]
  - - [36548, 24, 1, 1024]
    - [564, 0.0]
  - - [1024, 3936, 1, 1024]
    - [536, 0.0]
  - - [36548, 13824, 1, 1024]
    - [534, 0.0]
  - - [1024, 2401, 1, 1024]
    - [529, 0.0]
  - - [1024, 2176, 1, 1024]
    - [540, 0.0]
  - - [1024, 2240, 1, 1024]
    - [533, 0.0]
  - - [1024, 1728, 1, 1024]
    - [539, 0.0]
  - - [1024, 128, 1, 1024]
    - [573, 0.0]
  - - [1024, 216, 1, 1024]
    - [567, 0.0]
  - - [1024, 63, 1, 1024]
    - [574, 0.0]
  - - [1024, 86, 1, 1024]
    - [556, 0.0]
  - - [1024, 2528, 1, 1024]
    - [575, 0.0]
  - - [1024, 2400, 1, 1024]
    - [533, 0.0]
  - - [1024, 1440, 1, 1024]
    - [529, 0.0]
  - - [1024, 2912, 1, 1024]
    - [533, 0.0]
  - - [4096, 35, 1, 2048]
    - [543, 0.0]
  - - [4096, 63, 1, 2048]
    - [524, 0.0]
  - - [1024, 2880, 1, 1024]
    - [535, 0.0]
  - - [1024, 4064, 1, 1024]
    - [555, 0.0]
  - - [1024, 4655, 1, 1024]
    - [532, 0.0]
  - - [1024, 1088, 1, 1024]
    - [576, 0.0]
  - - [36548, 6272, 1, 1024]
    - [527, 0.0]
  - - [1024, 1, 1, 13]
    - [537, 0.0]
  - - [768, 2048, 1, 3072]
    - [577, 0.0]
  - - [64, 128, 96, 128]
    - [578, 0.0]
  - - [768, 1024, 1, 3072]
    - [579, 0.0]
  - - [768, 512, 1, 3072]
    - [580, 0.0]
  - - [768, 4096, 1, 3072]
    - [581, 0.0]
  - - [768, 320, 1, 30522]
    - [582, 0.0]
  - - [768, 640, 1, 30522]
    - [583, 0.0]
  - - [768, 1280, 1, 30522]
    - [584, 0.0]
  - - [64, 256, 192, 256]
    - [585, 0.0]
  - - [64, 128, 384, 128]
    - [586, 0.0]
  - - [64, 256, 96, 256]
    - [585, 0.0]
  - - [6272, 256, 1, 528]
    - [587, 0.0]
  - - [3136, 2048, 1, 1024]
    - [588, 0.0]
  - - [6272, 112, 1, 512]
    - [589, 0.0]
  - - [2048, 320, 1, 1280]
    - [590, 0.0]
  - - [289, 256, 1, 1568]
    - [591, 0.0]
  - - [50176, 128, 1, 256]
    - [592, 0.0]
  - - [5329, 64, 1, 448]
    - [593, 0.0]
  - - [289, 192, 1, 1344]
    - [594, 0.0]
  - - [12544, 1024, 1, 256]
    - [592, 0.0]
  - - [784, 64, 32, 192]
    - [595, 0.0]
  - - [6272, 64, 1, 480]
    - [596, 0.0]
  - - [196, 128, 1, 800]
    - [597, 0.0]
  - - [64, 512, 1, 1344]
    - [598, 0.0]
  - - [6272, 64, 1, 512]
    - [593, 0.0]
  - - [6272, 160, 1, 528]
    - [596, 0.0]
  - - [289, 160, 32, 768]
    - [837, 45.882]
  - - [12544, 256, 1, 1024]
    - [587, 0.0]
  - - [289, 224, 1, 1568]
    - [591, 0.0]
  - - [5329, 64, 32, 160]
    - [599, 0.0]
  - - [5329, 96, 1, 576]
    - [587, 0.0]
  - - [3025, 64, 1, 363]
    - [600, 0.0]
  - - [784, 32, 32, 192]
    - [601, 0.0]
  - - [3136, 512, 1, 1024]
    - [602, 0.0]
  - - [6272, 16, 1, 480]
    - [591, 0.0]
  - - [1225, 64, 32, 288]
    - [818, 49.673]
  - - [64, 256, 1, 1536]
    - [603, 0.0]
  - - [289, 192, 32, 768]
    - [838, 54.94]
  - - [2048, 448, 1, 1280]
    - [604, 0.0]
  - - [3136, 2048, 1, 512]
    - [605, 0.0]
  - - [289, 256, 1, 2016]
    - [591, 0.0]
  - - [289, 384, 32, 1024]
    - [606, 0.0]
  - - [1568, 32, 1, 832]
    - [607, 0.0]
  - - [3136, 64, 32, 64]
    - [842, 35.322]
  - - [289, 160, 1, 1120]
    - [608, 0.0]
  - - [6272, 128, 1, 528]
    - [609, 0.0]
  - - [21609, 32, 1, 288]
    - [610, 0.0]
  - - [1225, 192, 1, 1728]
    - [611, 0.0]
  - - [4096, 512, 1, 4096]
    - [612, 0.0]
  - - [64, 256, 1, 1152]
    - [603, 0.0]
  - - [6272, 96, 1, 480]
    - [613, 0.0]
  - - [784, 96, 1, 800]
    - [614, 0.0]
  - - [2048, 448, 1, 2048]
    - [604, 0.0]
  - - [784, 96, 32, 192]
    - [615, 0.0]
  - - [289, 224, 1, 1344]
    - [591, 0.0]
  - - [1001, 512, 1, 4096]
    - [616, 0.0]
  - - [2048, 192, 1, 1280]
    - [596, 0.0]
  - - [1225, 64, 32, 256]
    - [813, 45.663]
  - - [2048, 256, 1, 1536]
    - [616, 0.0]
  - - [1225, 64, 1, 1200]
    - [591, 0.0]
  - - [6272, 128, 1, 512]
    - [605, 0.0]
  - - [729, 192, 1, 1600]
    - [617, 0.0]
  - - [289, 192, 1, 896]
    - [594, 0.0]
  - - [1568, 384, 1, 832]
    - [587, 0.0]
  - - [784, 16, 32, 192]
    - [618, 0.0]
  - - [1568, 256, 1, 832]
    - [593, 0.0]
  - - [1568, 48, 1, 832]
    - [619, 0.0]
  - - [1568, 192, 1, 832]
    - [620, 0.0]
  - - [289, 192, 32, 1024]
    - [621, 0.0]
  - - [6272, 32, 1, 528]
    - [611, 0.0]
  - - [49, 128, 1, 1200]
    - [622, 0.0]
  - - [1225, 64, 32, 384]
    - [623, 0.0]
  - - [289, 128, 1, 896]
    - [608, 0.0]
  - - [1568, 160, 1, 832]
    - [611, 0.0]
  - - [1001, 32, 1, 1024]
    - [603, 0.0]
  - - [2048, 320, 1, 2048]
    - [624, 0.0]
  - - [2048, 384, 1, 1536]
    - [616, 0.0]
  - - [50176, 512, 1, 256]
    - [599, 0.0]
  - - [289, 256, 1, 1792]
    - [619, 0.0]
  - - [64, 448, 1, 1152]
    - [625, 0.0]
  - - [5041, 96, 1, 576]
    - [590, 0.0]
  - - [6272, 192, 1, 480]
    - [616, 0.0]
  - - [784, 32, 32, 256]
    - [626, 0.0]
  - - [1001, 32, 1, 2048]
    - [627, 0.0]
  - - [289, 192, 1, 1120]
    - [628, 0.0]
  - - [6272, 32, 1, 512]
    - [629, 0.0]
  - - [289, 384, 1, 3456]
    - [591, 0.0]
  - - [289, 384, 1, 2592]
    - [614, 0.0]
  - - [12544, 1024, 1, 512]
    - [592, 0.0]
  - - [12544, 256, 1, 512]
    - [587, 0.0]
  - - [6272, 24, 1, 512]
    - [611, 0.0]
  - - [5041, 192, 1, 720]
    - [604, 0.0]
  - - [64, 320, 1, 1728]
    - [597, 0.0]
  - - [784, 128, 32, 256]
    - [630, 0.0]
  - - [289, 96, 1, 864]
    - [625, 0.0]
  - - [1225, 32, 32, 192]
    - [848, 25.205]
  - - [1568, 128, 1, 832]
    - [629, 0.0]
  - - [289, 128, 32, 768]
    - [832, 54.238]
  - - [196, 64, 1, 800]
    - [598, 0.0]
  - - [4096, 512, 1, 9216]
    - [631, 0.0]
  - - [12544, 64, 1, 147]
    - [605, 0.0]
  - - [784, 32, 1, 400]
    - [622, 0.0]
  - - [6272, 160, 1, 512]
    - [593, 0.0]
  - - [1225, 48, 32, 288]
    - [835, 33.394]
  - - [64, 320, 1, 2880]
    - [632, 0.0]
  - - [1225, 64, 32, 192]
    - [813, 42.168]
  - - [1001, 32, 1, 1536]
    - [603, 0.0]
  - - [784, 64, 32, 256]
    - [633, 0.0]
  - - [64, 384, 1, 1152]
    - [625, 0.0]
  - - [3136, 512, 1, 2048]
    - [634, 0.0]
  - - [6272, 144, 1, 512]
    - [616, 0.0]
  - - [1225, 192, 32, 384]
    - [604, 0.0]
  - - [64, 192, 1, 1728]
    - [603, 0.0]
  - - [8192, 320, 1, 1280]
    - [635, 0.0]
  - - [8192, 320, 1, 2048]
    - [636, 0.0]
  - - [8192, 384, 1, 1280]
    - [635, 0.0]
  - - [8192, 192, 1, 1280]
    - [636, 0.0]
  - - [8192, 192, 1, 2048]
    - [637, 0.0]
  - - [8192, 384, 1, 2048]
    - [638, 0.0]
  - - [8192, 448, 1, 2048]
    - [639, 0.0]
  - - [1001, 64, 1, 1536]
    - [640, 0.0]
  - - [8192, 448, 1, 1280]
    - [635, 0.0]
  - - [1001, 64, 1, 2048]
    - [641, 0.0]
  - - [1001, 128, 1, 2048]
    - [642, 0.0]
  - - [65, 6400, 1, 1024]
    - [643, 0.0]
  - - [256, 6400, 1, 4096]
    - [644, 0.0]
  - - [1024, 64, 1, 4096]
    - [645, 0.0]
  - - [2048, 174, 1, 512]
    - [646, 0.0]
  - - [2048, 189, 1, 512]
    - [647, 0.0]
  - - [64, 10, 448, 10]
    - [648, 0.0]
  - - [64, 18, 648, 18]
    - [649, 0.0]
  - - [64, 18, 1720, 18]
    - [649, 0.0]
  - - [64, 19, 1632, 19]
    - [650, 0.0]
  - - [64, 21, 1472, 21]
    - [650, 0.0]
  - - [64, 23, 64, 23]
    - [650, 0.0]
  - - [64, 26, 56, 26]
    - [651, 0.0]
  - - [64, 35, 904, 35]
    - [650, 0.0]
  - - [64, 103, 16, 103]
    - [652, 0.0]
  - - [64, 104, 16, 103]
    - [653, 0.0]
  - - [64, 123, 16, 112]
    - [654, 0.0]
  - - [64, 123, 16, 123]
    - [653, 0.0]
  - - [512, 1290, 1, 2048]
    - [646, 0.0]
  - - [512, 2205, 1, 2048]
    - [647, 0.0]
  - - [512, 3433, 1, 2048]
    - [655, 0.0]
  - - [512, 3439, 1, 2048]
    - [655, 0.0]
  - - [512, 3461, 1, 2048]
    - [656, 0.0]
  - - [512, 3479, 1, 2048]
    - [655, 0.0]
  - - [512, 3494, 1, 2048]
    - [655, 0.0]
  - - [512, 3520, 1, 2048]
    - [657, 0.0]
  - - [512, 3530, 1, 2048]
    - [658, 0.0]
  - - [512, 3541, 1, 2048]
    - [659, 0.0]
  - - [512, 3564, 1, 2048]
    - [658, 0.0]
  - - [512, 3776, 1, 2048]
    - [660, 0.0]
  - - [512, 3859, 1, 512]
    - [661, 0.0]
  - - [512, 3925, 1, 2048]
    - [659, 0.0]
  - - [512, 3944, 1, 2048]
    - [659, 0.0]
  - - [512, 3955, 1, 2048]
    - [662, 0.0]
  - - [512, 3969, 1, 2048]
    - [659, 0.0]
  - - [512, 3976, 1, 2048]
    - [659, 0.0]
  - - [2048, 1232, 1, 512]
    - [663, 0.0]
  - - [2048, 3165, 1, 512]
    - [663, 0.0]
  - - [64, 512, 16, 512]
    - [664, 0.0]
  - - [1024, 1, 1, 2]
    - [665, 0.0]
  - - [1024, 1, 1, 1024]
    - [665, 0.0]
  - - [512, 540, 1, 512]
    - [666, 0.0]
  - - [512, 540, 1, 2048]
    - [667, 0.0]
  - - [512, 550, 1, 512]
    - [668, 0.0]
  - - [512, 550, 1, 2048]
    - [666, 0.0]
  - - [512, 560, 1, 512]
    - [666, 0.0]
  - - [512, 560, 1, 2048]
    - [667, 0.0]
  - - [512, 600, 1, 2048]
    - [666, 0.0]
  - - [512, 644, 1, 512]
    - [666, 0.0]
  - - [512, 644, 1, 2048]
    - [666, 0.0]
  - - [512, 668, 1, 2048]
    - [666, 0.0]
  - - [512, 714, 1, 512]
    - [667, 0.0]
  - - [512, 714, 1, 2048]
    - [666, 0.0]
  - - [512, 720, 1, 512]
    - [667, 0.0]
  - - [512, 720, 1, 2048]
    - [669, 0.0]
  - - [512, 722, 1, 2048]
    - [667, 0.0]
  - - [512, 781, 1, 512]
    - [666, 0.0]
  - - [512, 781, 1, 2048]
    - [667, 0.0]
  - - [512, 848, 1, 2048]
    - [669, 0.0]
  - - [512, 872, 1, 2048]
    - [667, 0.0]
  - - [512, 936, 1, 512]
    - [666, 0.0]
  - - [512, 936, 1, 2048]
    - [667, 0.0]
  - - [512, 980, 1, 512]
    - [667, 0.0]
  - - [512, 980, 1, 2048]
    - [667, 0.0]
  - - [512, 1139, 1, 2048]
    - [667, 0.0]
  - - [512, 1184, 1, 2048]
    - [667, 0.0]
  - - [512, 1186, 1, 2048]
    - [667, 0.0]
  - - [512, 1232, 1, 512]
    - [670, 0.0]
  - - [512, 1232, 1, 2048]
    - [666, 0.0]
  - - [512, 1279, 1, 2048]
    - [666, 0.0]
  - - [512, 1290, 1, 512]
    - [667, 0.0]
  - - [512, 1327, 1, 2048]
    - [669, 0.0]
  - - [512, 1331, 1, 2048]
    - [669, 0.0]
  - - [512, 1341, 1, 2048]
    - [671, 0.0]
  - - [512, 1350, 1, 512]
    - [666, 0.0]
  - - [512, 1350, 1, 2048]
    - [799, 55.153]
  - - [512, 1359, 1, 2048]
    - [669, 0.0]
  - - [512, 1391, 1, 2048]
    - [669, 0.0]
  - - [512, 1424, 1, 512]
    - [666, 0.0]
  - - [512, 1424, 1, 2048]
    - [666, 0.0]
  - - [512, 1458, 1, 512]
    - [672, 0.0]
  - - [512, 1458, 1, 2048]
    - [667, 0.0]
  - - [512, 1462, 1, 512]
    - [667, 0.0]
  - - [512, 1462, 1, 2048]
    - [667, 0.0]
  - - [512, 1467, 1, 2048]
    - [666, 0.0]
  - - [512, 1472, 1, 2048]
    - [666, 0.0]
  - - [512, 1520, 1, 512]
    - [672, 0.0]
  - - [512, 1520, 1, 2048]
    - [667, 0.0]
  - - [512, 1596, 1, 512]
    - [666, 0.0]
  - - [512, 1596, 1, 2048]
    - [673, 0.0]
  - - [512, 1599, 1, 512]
    - [670, 0.0]
  - - [512, 1599, 1, 2048]
    - [666, 0.0]
  - - [512, 1615, 1, 512]
    - [666, 0.0]
  - - [512, 1615, 1, 2048]
    - [666, 0.0]
  - - [512, 1680, 1, 512]
    - [667, 0.0]
  - - [512, 1680, 1, 2048]
    - [666, 0.0]
  - - [512, 1709, 1, 2048]
    - [666, 0.0]
  - - [512, 1890, 1, 512]
    - [666, 0.0]
  - - [512, 1902, 1, 2048]
    - [674, 0.0]
  - - [512, 1917, 1, 512]
    - [675, 0.0]
  - - [512, 1917, 1, 2048]
    - [673, 0.0]
  - - [512, 2076, 1, 2048]
    - [676, 0.0]
  - - [512, 2195, 1, 2048]
    - [677, 0.0]
  - - [512, 2205, 1, 512]
    - [678, 0.0]
  - - [512, 2387, 1, 512]
    - [678, 0.0]
  - - [512, 2418, 1, 512]
    - [679, 0.0]
  - - [512, 2418, 1, 2048]
    - [680, 0.0]
  - - [512, 2496, 1, 512]
    - [679, 0.0]
  - - [512, 2496, 1, 2048]
    - [674, 0.0]
  - - [512, 2790, 1, 2048]
    - [674, 0.0]
  - - [512, 2864, 1, 2048]
    - [681, 0.0]
  - - [512, 3092, 1, 2048]
    - [674, 0.0]
  - - [512, 3113, 1, 2048]
    - [681, 0.0]
  - - [512, 3137, 1, 2048]
    - [674, 0.0]
  - - [512, 3165, 1, 2048]
    - [681, 0.0]
  - - [512, 3166, 1, 2048]
    - [674, 0.0]
  - - [512, 3194, 1, 2048]
    - [674, 0.0]
  - - [512, 3219, 1, 2048]
    - [682, 0.0]
  - - [512, 3222, 1, 2048]
    - [683, 0.0]
  - - [512, 3234, 1, 2048]
    - [681, 0.0]
  - - [512, 3237, 1, 2048]
    - [681, 0.0]
  - - [512, 3242, 1, 2048]
    - [682, 0.0]
  - - [512, 3246, 1, 2048]
    - [682, 0.0]
  - - [512, 3249, 1, 2048]
    - [682, 0.0]
  - - [512, 3251, 1, 2048]
    - [681, 0.0]
  - - [512, 3257, 1, 2048]
    - [674, 0.0]
  - - [512, 3262, 1, 2048]
    - [682, 0.0]
  - - [512, 3268, 1, 2048]
    - [681, 0.0]
  - - [512, 3282, 1, 2048]
    - [681, 0.0]
  - - [512, 3286, 1, 2048]
    - [681, 0.0]
  - - [512, 3287, 1, 2048]
    - [674, 0.0]
  - - [512, 3293, 1, 2048]
    - [681, 0.0]
  - - [512, 3297, 1, 2048]
    - [683, 0.0]
  - - [512, 3307, 1, 2048]
    - [674, 0.0]
  - - [512, 3314, 1, 2048]
    - [681, 0.0]
  - - [512, 3315, 1, 2048]
    - [684, 0.0]
  - - [512, 3319, 1, 2048]
    - [674, 0.0]
  - - [512, 3322, 1, 2048]
    - [682, 0.0]
  - - [512, 3323, 1, 2048]
    - [684, 0.0]
  - - [512, 3324, 1, 2048]
    - [674, 0.0]
  - - [512, 3325, 1, 2048]
    - [681, 0.0]
  - - [512, 3327, 1, 2048]
    - [681, 0.0]
  - - [512, 3329, 1, 2048]
    - [674, 0.0]
  - - [512, 3332, 1, 2048]
    - [681, 0.0]
  - - [512, 3336, 1, 2048]
    - [681, 0.0]
  - - [512, 3339, 1, 2048]
    - [674, 0.0]
  - - [512, 3342, 1, 2048]
    - [681, 0.0]
  - - [512, 3344, 1, 2048]
    - [681, 0.0]
  - - [512, 3358, 1, 2048]
    - [674, 0.0]
  - - [512, 3360, 1, 2048]
    - [682, 0.0]
  - - [512, 3364, 1, 2048]
    - [682, 0.0]
  - - [512, 3365, 1, 2048]
    - [681, 0.0]
  - - [512, 3369, 1, 2048]
    - [683, 0.0]
  - - [512, 3370, 1, 2048]
    - [674, 0.0]
  - - [512, 3371, 1, 2048]
    - [683, 0.0]
  - - [512, 3374, 1, 2048]
    - [674, 0.0]
  - - [512, 3376, 1, 2048]
    - [674, 0.0]
  - - [512, 3377, 1, 2048]
    - [682, 0.0]
  - - [512, 3378, 1, 2048]
    - [681, 0.0]
  - - [512, 3381, 1, 2048]
    - [681, 0.0]
  - - [512, 3382, 1, 2048]
    - [682, 0.0]
  - - [512, 3383, 1, 2048]
    - [681, 0.0]
  - - [512, 3384, 1, 2048]
    - [682, 0.0]
  - - [512, 3385, 1, 2048]
    - [674, 0.0]
  - - [512, 3386, 1, 2048]
    - [683, 0.0]
  - - [512, 3388, 1, 2048]
    - [681, 0.0]
  - - [512, 3390, 1, 2048]
    - [682, 0.0]
  - - [512, 3391, 1, 2048]
    - [681, 0.0]
  - - [512, 3396, 1, 2048]
    - [681, 0.0]
  - - [512, 3399, 1, 2048]
    - [681, 0.0]
  - - [512, 3402, 1, 2048]
    - [683, 0.0]
  - - [512, 3410, 1, 2048]
    - [674, 0.0]
  - - [512, 3412, 1, 2048]
    - [674, 0.0]
  - - [512, 3414, 1, 2048]
    - [681, 0.0]
  - - [512, 3415, 1, 2048]
    - [674, 0.0]
  - - [512, 3418, 1, 2048]
    - [674, 0.0]
  - - [512, 3420, 1, 2048]
    - [683, 0.0]
  - - [512, 3422, 1, 2048]
    - [674, 0.0]
  - - [512, 3425, 1, 2048]
    - [683, 0.0]
  - - [512, 3426, 1, 2048]
    - [674, 0.0]
  - - [512, 3427, 1, 2048]
    - [682, 0.0]
  - - [512, 3428, 1, 2048]
    - [674, 0.0]
  - - [512, 3430, 1, 2048]
    - [674, 0.0]
  - - [512, 3431, 1, 2048]
    - [683, 0.0]
  - - [512, 3432, 1, 2048]
    - [681, 0.0]
  - - [512, 3438, 1, 2048]
    - [681, 0.0]
  - - [512, 3440, 1, 2048]
    - [683, 0.0]
  - - [512, 3443, 1, 2048]
    - [682, 0.0]
  - - [512, 3445, 1, 2048]
    - [683, 0.0]
  - - [512, 3447, 1, 2048]
    - [674, 0.0]
  - - [512, 3448, 1, 2048]
    - [683, 0.0]
  - - [512, 3450, 1, 2048]
    - [674, 0.0]
  - - [512, 3451, 1, 2048]
    - [683, 0.0]
  - - [512, 3452, 1, 2048]
    - [683, 0.0]
  - - [512, 3453, 1, 2048]
    - [683, 0.0]
  - - [512, 3455, 1, 2048]
    - [674, 0.0]
  - - [512, 3456, 1, 2048]
    - [683, 0.0]
  - - [512, 3457, 1, 2048]
    - [674, 0.0]
  - - [512, 3458, 1, 2048]
    - [685, 0.0]
  - - [512, 3459, 1, 2048]
    - [683, 0.0]
  - - [512, 3460, 1, 2048]
    - [674, 0.0]
  - - [512, 3462, 1, 2048]
    - [683, 0.0]
  - - [512, 3466, 1, 2048]
    - [683, 0.0]
  - - [512, 3467, 1, 2048]
    - [681, 0.0]
  - - [512, 3468, 1, 2048]
    - [682, 0.0]
  - - [512, 3470, 1, 2048]
    - [682, 0.0]
  - - [512, 3471, 1, 2048]
    - [674, 0.0]
  - - [512, 3472, 1, 2048]
    - [682, 0.0]
  - - [512, 3475, 1, 2048]
    - [682, 0.0]
  - - [512, 3476, 1, 2048]
    - [682, 0.0]
  - - [512, 3477, 1, 2048]
    - [683, 0.0]
  - - [512, 3478, 1, 2048]
    - [683, 0.0]
  - - [512, 3480, 1, 2048]
    - [683, 0.0]
  - - [512, 3481, 1, 2048]
    - [682, 0.0]
  - - [512, 3483, 1, 2048]
    - [682, 0.0]
  - - [512, 3484, 1, 2048]
    - [683, 0.0]
  - - [512, 3487, 1, 2048]
    - [682, 0.0]
  - - [512, 3489, 1, 2048]
    - [682, 0.0]
  - - [512, 3490, 1, 2048]
    - [683, 0.0]
  - - [512, 3491, 1, 2048]
    - [682, 0.0]
  - - [512, 3493, 1, 2048]
    - [683, 0.0]
  - - [512, 3495, 1, 2048]
    - [674, 0.0]
  - - [512, 3497, 1, 2048]
    - [674, 0.0]
  - - [512, 3498, 1, 2048]
    - [681, 0.0]
  - - [512, 3499, 1, 2048]
    - [683, 0.0]
  - - [512, 3501, 1, 2048]
    - [682, 0.0]
  - - [512, 3503, 1, 2048]
    - [681, 0.0]
  - - [512, 3505, 1, 2048]
    - [683, 0.0]
  - - [512, 3507, 1, 2048]
    - [685, 0.0]
  - - [512, 3508, 1, 2048]
    - [681, 0.0]
  - - [512, 3509, 1, 2048]
    - [683, 0.0]
  - - [512, 3510, 1, 2048]
    - [683, 0.0]
  - - [512, 3511, 1, 2048]
    - [681, 0.0]
  - - [512, 3513, 1, 2048]
    - [681, 0.0]
  - - [512, 3514, 1, 2048]
    - [681, 0.0]
  - - [512, 3515, 1, 2048]
    - [674, 0.0]
  - - [512, 3517, 1, 2048]
    - [681, 0.0]
  - - [512, 3518, 1, 2048]
    - [682, 0.0]
  - - [512, 3519, 1, 2048]
    - [683, 0.0]
  - - [512, 3523, 1, 2048]
    - [683, 0.0]
  - - [512, 3528, 1, 2048]
    - [681, 0.0]
  - - [512, 3529, 1, 2048]
    - [682, 0.0]
  - - [512, 3531, 1, 2048]
    - [682, 0.0]
  - - [512, 3532, 1, 2048]
    - [682, 0.0]
  - - [512, 3533, 1, 2048]
    - [681, 0.0]
  - - [512, 3534, 1, 2048]
    - [682, 0.0]
  - - [512, 3538, 1, 2048]
    - [683, 0.0]
  - - [512, 3539, 1, 2048]
    - [674, 0.0]
  - - [512, 3540, 1, 2048]
    - [674, 0.0]
  - - [512, 3547, 1, 2048]
    - [682, 0.0]
  - - [512, 3548, 1, 2048]
    - [681, 0.0]
  - - [512, 3552, 1, 2048]
    - [683, 0.0]
  - - [512, 3575, 1, 2048]
    - [682, 0.0]
  - - [512, 3598, 1, 2048]
    - [681, 0.0]
  - - [512, 3599, 1, 2048]
    - [683, 0.0]
  - - [512, 3608, 1, 2048]
    - [682, 0.0]
  - - [512, 3776, 1, 512]
    - [686, 0.0]
  - - [512, 3780, 1, 512]
    - [687, 0.0]
  - - [512, 3780, 1, 2048]
    - [681, 0.0]
  - - [512, 3780, 1, 33708]
    - [681, 0.0]
  - - [512, 3796, 1, 512]
    - [687, 0.0]
  - - [512, 3796, 1, 2048]
    - [683, 0.0]
  - - [512, 3796, 1, 33708]
    - [683, 0.0]
  - - [512, 3822, 1, 512]
    - [686, 0.0]
  - - [512, 3822, 1, 2048]
    - [674, 0.0]
  - - [512, 3822, 1, 33708]
    - [683, 0.0]
  - - [512, 3835, 1, 512]
    - [686, 0.0]
  - - [512, 3835, 1, 2048]
    - [683, 0.0]
  - - [512, 3840, 1, 512]
    - [686, 0.0]
  - - [512, 3840, 1, 2048]
    - [681, 0.0]
  - - [512, 3840, 1, 33708]
    - [683, 0.0]
  - - [512, 3859, 1, 2048]
    - [669, 0.0]
  - - [512, 3859, 1, 33708]
    - [688, 0.0]
  - - [512, 3864, 1, 512]
    - [679, 0.0]
  - - [512, 3864, 1, 2048]
    - [671, 0.0]
  - - [512, 3870, 1, 512]
    - [679, 0.0]
  - - [512, 3870, 1, 2048]
    - [669, 0.0]
  - - [512, 3870, 1, 33708]
    - [689, 0.0]
  - - [512, 3876, 1, 512]
    - [679, 0.0]
  - - [512, 3876, 1, 2048]
    - [669, 0.0]
  - - [512, 3876, 1, 33708]
    - [688, 0.0]
  - - [512, 3906, 1, 512]
    - [679, 0.0]
  - - [512, 3906, 1, 2048]
    - [669, 0.0]
  - - [512, 3906, 1, 33708]
    - [689, 0.0]
  - - [512, 3910, 1, 512]
    - [679, 0.0]
  - - [512, 3910, 1, 2048]
    - [671, 0.0]
  - - [512, 3910, 1, 33708]
    - [689, 0.0]
  - - [512, 3925, 1, 512]
    - [679, 0.0]
  - - [512, 3925, 1, 33708]
    - [689, 0.0]
  - - [512, 3927, 1, 512]
    - [679, 0.0]
  - - [512, 3942, 1, 512]
    - [679, 0.0]
  - - [512, 3942, 1, 2048]
    - [669, 0.0]
  - - [512, 3942, 1, 33708]
    - [689, 0.0]
  - - [512, 3944, 1, 512]
    - [679, 0.0]
  - - [512, 3944, 1, 33708]
    - [688, 0.0]
  - - [512, 3955, 1, 512]
    - [679, 0.0]
  - - [512, 3955, 1, 33708]
    - [688, 0.0]
  - - [512, 3968, 1, 512]
    - [679, 0.0]
  - - [512, 3968, 1, 2048]
    - [671, 0.0]
  - - [512, 3968, 1, 33708]
    - [689, 0.0]
  - - [512, 3969, 1, 512]
    - [679, 0.0]
  - - [512, 3969, 1, 33708]
    - [689, 0.0]
  - - [512, 3976, 1, 512]
    - [679, 0.0]
  - - [512, 3976, 1, 33708]
    - [689, 0.0]
  - - [512, 3977, 1, 512]
    - [679, 0.0]
  - - [512, 3977, 1, 2048]
    - [671, 0.0]
  - - [512, 3977, 1, 33708]
    - [688, 0.0]
  - - [512, 3978, 1, 512]
    - [679, 0.0]
  - - [512, 3978, 1, 2048]
    - [671, 0.0]
  - - [512, 3978, 1, 33708]
    - [689, 0.0]
  - - [512, 3990, 1, 512]
    - [679, 0.0]
  - - [512, 3990, 1, 2048]
    - [671, 0.0]
  - - [512, 3990, 1, 33708]
    - [688, 0.0]
  - - [512, 3995, 1, 512]
    - [679, 0.0]
  - - [512, 3995, 1, 2048]
    - [671, 0.0]
  - - [512, 3995, 1, 33708]
    - [688, 0.0]
  - - [512, 3996, 1, 512]
    - [679, 0.0]
  - - [512, 3996, 1, 2048]
    - [671, 0.0]
  - - [512, 3996, 1, 33708]
    - [689, 0.0]
  - - [512, 3999, 1, 512]
    - [679, 0.0]
  - - [512, 3999, 1, 2048]
    - [669, 0.0]
  - - [512, 3999, 1, 33708]
    - [688, 0.0]
  - - [512, 4005, 1, 512]
    - [679, 0.0]
  - - [512, 4005, 1, 2048]
    - [669, 0.0]
  - - [512, 4005, 1, 33708]
    - [688, 0.0]
  - - [512, 4012, 1, 512]
    - [679, 0.0]
  - - [512, 4012, 1, 2048]
    - [798, 62.785]
  - - [512, 4012, 1, 33708]
    - [689, 0.0]
  - - [512, 4020, 1, 512]
    - [679, 0.0]
  - - [512, 4020, 1, 2048]
    - [669, 0.0]
  - - [512, 4020, 1, 33708]
    - [689, 0.0]
  - - [512, 4026, 1, 512]
    - [679, 0.0]
  - - [512, 4026, 1, 2048]
    - [690, 0.0]
  - - [512, 4026, 1, 33708]
    - [688, 0.0]
  - - [512, 4030, 1, 512]
    - [679, 0.0]
  - - [512, 4030, 1, 2048]
    - [669, 0.0]
  - - [512, 4030, 1, 33708]
    - [688, 0.0]
  - - [512, 4032, 1, 512]
    - [679, 0.0]
  - - [512, 4032, 1, 2048]
    - [671, 0.0]
  - - [512, 4032, 1, 33708]
    - [689, 0.0]
  - - [512, 4050, 1, 512]
    - [679, 0.0]
  - - [512, 4059, 1, 512]
    - [679, 0.0]
  - - [2048, 160, 1, 512]
    - [667, 0.0]
  - - [2048, 184, 1, 512]
    - [667, 0.0]
  - - [2048, 198, 1, 512]
    - [666, 0.0]
  - - [2048, 207, 1, 512]
    - [667, 0.0]
  - - [2048, 208, 1, 512]
    - [667, 0.0]
  - - [2048, 245, 1, 512]
    - [668, 0.0]
  - - [2048, 246, 1, 512]
    - [667, 0.0]
  - - [2048, 264, 1, 512]
    - [666, 0.0]
  - - [2048, 401, 1, 512]
    - [667, 0.0]
  - - [2048, 439, 1, 512]
    - [667, 0.0]
  - - [2048, 443, 1, 512]
    - [666, 0.0]
  - - [2048, 446, 1, 512]
    - [667, 0.0]
  - - [2048, 465, 1, 512]
    - [678, 0.0]
  - - [2048, 468, 1, 512]
    - [678, 0.0]
  - - [2048, 493, 1, 512]
    - [678, 0.0]
  - - [2048, 495, 1, 512]
    - [678, 0.0]
  - - [2048, 511, 1, 512]
    - [678, 0.0]
  - - [2048, 512, 1, 512]
    - [678, 0.0]
  - - [2048, 540, 1, 512]
    - [678, 0.0]
  - - [2048, 550, 1, 512]
    - [678, 0.0]
  - - [2048, 560, 1, 512]
    - [800, 53.058]
  - - [2048, 600, 1, 512]
    - [678, 0.0]
  - - [2048, 644, 1, 512]
    - [679, 0.0]
  - - [2048, 668, 1, 512]
    - [679, 0.0]
  - - [2048, 714, 1, 512]
    - [691, 0.0]
  - - [2048, 720, 1, 512]
    - [692, 0.0]
  - - [2048, 722, 1, 512]
    - [693, 0.0]
  - - [2048, 781, 1, 512]
    - [693, 0.0]
  - - [2048, 848, 1, 512]
    - [693, 0.0]
  - - [2048, 872, 1, 512]
    - [692, 0.0]
  - - [2048, 936, 1, 512]
    - [694, 0.0]
  - - [2048, 980, 1, 512]
    - [678, 0.0]
  - - [2048, 1139, 1, 512]
    - [666, 0.0]
  - - [2048, 1184, 1, 512]
    - [692, 0.0]
  - - [2048, 1186, 1, 512]
    - [691, 0.0]
  - - [2048, 1279, 1, 512]
    - [692, 0.0]
  - - [2048, 1290, 1, 512]
    - [694, 0.0]
  - - [2048, 1327, 1, 512]
    - [691, 0.0]
  - - [2048, 1331, 1, 512]
    - [694, 0.0]
  - - [2048, 1341, 1, 512]
    - [694, 0.0]
  - - [2048, 1350, 1, 512]
    - [693, 0.0]
  - - [2048, 1359, 1, 512]
    - [691, 0.0]
  - - [2048, 1391, 1, 512]
    - [694, 0.0]
  - - [2048, 1424, 1, 512]
    - [695, 0.0]
  - - [2048, 1458, 1, 512]
    - [678, 0.0]
  - - [2048, 1462, 1, 512]
    - [678, 0.0]
  - - [2048, 1467, 1, 512]
    - [667, 0.0]
  - - [2048, 1472, 1, 512]
    - [667, 0.0]
  - - [2048, 1520, 1, 512]
    - [678, 0.0]
  - - [2048, 1596, 1, 512]
    - [667, 0.0]
  - - [2048, 1599, 1, 512]
    - [667, 0.0]
  - - [2048, 1615, 1, 512]
    - [667, 0.0]
  - - [2048, 1680, 1, 512]
    - [696, 0.0]
  - - [2048, 1709, 1, 512]
    - [696, 0.0]
  - - [2048, 1902, 1, 512]
    - [697, 0.0]
  - - [2048, 1917, 1, 512]
    - [697, 0.0]
  - - [2048, 2076, 1, 512]
    - [691, 0.0]
  - - [2048, 2195, 1, 512]
    - [691, 0.0]
  - - [2048, 2205, 1, 512]
    - [691, 0.0]
  - - [2048, 2418, 1, 512]
    - [678, 0.0]
  - - [2048, 2496, 1, 512]
    - [693, 0.0]
  - - [2048, 2790, 1, 512]
    - [693, 0.0]
  - - [2048, 2864, 1, 512]
    - [691, 0.0]
  - - [2048, 3092, 1, 512]
    - [698, 0.0]
  - - [2048, 3113, 1, 512]
    - [693, 0.0]
  - - [2048, 3137, 1, 512]
    - [699, 0.0]
  - - [2048, 3166, 1, 512]
    - [699, 0.0]
  - - [2048, 3194, 1, 512]
    - [699, 0.0]
  - - [2048, 3219, 1, 512]
    - [699, 0.0]
  - - [2048, 3222, 1, 512]
    - [699, 0.0]
  - - [2048, 3234, 1, 512]
    - [699, 0.0]
  - - [2048, 3237, 1, 512]
    - [698, 0.0]
  - - [2048, 3242, 1, 512]
    - [699, 0.0]
  - - [2048, 3246, 1, 512]
    - [699, 0.0]
  - - [2048, 3249, 1, 512]
    - [691, 0.0]
  - - [2048, 3251, 1, 512]
    - [698, 0.0]
  - - [2048, 3257, 1, 512]
    - [698, 0.0]
  - - [2048, 3262, 1, 512]
    - [699, 0.0]
  - - [2048, 3268, 1, 512]
    - [691, 0.0]
  - - [2048, 3282, 1, 512]
    - [699, 0.0]
  - - [2048, 3286, 1, 512]
    - [693, 0.0]
  - - [2048, 3287, 1, 512]
    - [699, 0.0]
  - - [2048, 3293, 1, 512]
    - [698, 0.0]
  - - [2048, 3297, 1, 512]
    - [699, 0.0]
  - - [2048, 3307, 1, 512]
    - [693, 0.0]
  - - [2048, 3314, 1, 512]
    - [691, 0.0]
  - - [2048, 3315, 1, 512]
    - [698, 0.0]
  - - [2048, 3319, 1, 512]
    - [699, 0.0]
  - - [2048, 3322, 1, 512]
    - [691, 0.0]
  - - [2048, 3323, 1, 512]
    - [691, 0.0]
  - - [2048, 3324, 1, 512]
    - [693, 0.0]
  - - [2048, 3325, 1, 512]
    - [691, 0.0]
  - - [2048, 3327, 1, 512]
    - [698, 0.0]
  - - [2048, 3329, 1, 512]
    - [678, 0.0]
  - - [2048, 3332, 1, 512]
    - [691, 0.0]
  - - [2048, 3336, 1, 512]
    - [678, 0.0]
  - - [2048, 3339, 1, 512]
    - [678, 0.0]
  - - [2048, 3342, 1, 512]
    - [678, 0.0]
  - - [2048, 3344, 1, 512]
    - [678, 0.0]
  - - [2048, 3358, 1, 512]
    - [678, 0.0]
  - - [2048, 3360, 1, 512]
    - [678, 0.0]
  - - [2048, 3364, 1, 512]
    - [678, 0.0]
  - - [2048, 3365, 1, 512]
    - [678, 0.0]
  - - [2048, 3369, 1, 512]
    - [678, 0.0]
  - - [2048, 3370, 1, 512]
    - [678, 0.0]
  - - [2048, 3371, 1, 512]
    - [678, 0.0]
  - - [2048, 3374, 1, 512]
    - [678, 0.0]
  - - [2048, 3376, 1, 512]
    - [678, 0.0]
  - - [2048, 3377, 1, 512]
    - [678, 0.0]
  - - [2048, 3378, 1, 512]
    - [678, 0.0]
  - - [2048, 3381, 1, 512]
    - [678, 0.0]
  - - [2048, 3382, 1, 512]
    - [678, 0.0]
  - - [2048, 3383, 1, 512]
    - [678, 0.0]
  - - [2048, 3384, 1, 512]
    - [678, 0.0]
  - - [2048, 3385, 1, 512]
    - [678, 0.0]
  - - [2048, 3386, 1, 512]
    - [678, 0.0]
  - - [2048, 3388, 1, 512]
    - [678, 0.0]
  - - [2048, 3390, 1, 512]
    - [678, 0.0]
  - - [2048, 3391, 1, 512]
    - [678, 0.0]
  - - [2048, 3396, 1, 512]
    - [691, 0.0]
  - - [2048, 3399, 1, 512]
    - [693, 0.0]
  - - [2048, 3402, 1, 512]
    - [693, 0.0]
  - - [2048, 3410, 1, 512]
    - [691, 0.0]
  - - [2048, 3412, 1, 512]
    - [691, 0.0]
  - - [2048, 3414, 1, 512]
    - [691, 0.0]
  - - [2048, 3415, 1, 512]
    - [691, 0.0]
  - - [2048, 3418, 1, 512]
    - [693, 0.0]
  - - [2048, 3420, 1, 512]
    - [691, 0.0]
  - - [2048, 3422, 1, 512]
    - [693, 0.0]
  - - [2048, 3425, 1, 512]
    - [693, 0.0]
  - - [2048, 3426, 1, 512]
    - [693, 0.0]
  - - [2048, 3427, 1, 512]
    - [693, 0.0]
  - - [2048, 3428, 1, 512]
    - [691, 0.0]
  - - [2048, 3430, 1, 512]
    - [693, 0.0]
  - - [2048, 3431, 1, 512]
    - [691, 0.0]
  - - [2048, 3432, 1, 512]
    - [693, 0.0]
  - - [2048, 3433, 1, 512]
    - [693, 0.0]
  - - [2048, 3438, 1, 512]
    - [692, 0.0]
  - - [2048, 3439, 1, 512]
    - [691, 0.0]
  - - [2048, 3440, 1, 512]
    - [693, 0.0]
  - - [2048, 3443, 1, 512]
    - [693, 0.0]
  - - [2048, 3445, 1, 512]
    - [693, 0.0]
  - - [2048, 3447, 1, 512]
    - [691, 0.0]
  - - [2048, 3448, 1, 512]
    - [694, 0.0]
  - - [2048, 3450, 1, 512]
    - [691, 0.0]
  - - [2048, 3451, 1, 512]
    - [693, 0.0]
  - - [2048, 3452, 1, 512]
    - [691, 0.0]
  - - [2048, 3453, 1, 512]
    - [693, 0.0]
  - - [2048, 3455, 1, 512]
    - [691, 0.0]
  - - [2048, 3456, 1, 512]
    - [693, 0.0]
  - - [2048, 3457, 1, 512]
    - [691, 0.0]
  - - [2048, 3458, 1, 512]
    - [693, 0.0]
  - - [2048, 3459, 1, 512]
    - [693, 0.0]
  - - [2048, 3460, 1, 512]
    - [691, 0.0]
  - - [2048, 3461, 1, 512]
    - [693, 0.0]
  - - [2048, 3462, 1, 512]
    - [693, 0.0]
  - - [2048, 3466, 1, 512]
    - [691, 0.0]
  - - [2048, 3467, 1, 512]
    - [693, 0.0]
  - - [2048, 3468, 1, 512]
    - [693, 0.0]
  - - [2048, 3470, 1, 512]
    - [691, 0.0]
  - - [2048, 3471, 1, 512]
    - [691, 0.0]
  - - [2048, 3472, 1, 512]
    - [691, 0.0]
  - - [2048, 3475, 1, 512]
    - [693, 0.0]
  - - [2048, 3476, 1, 512]
    - [693, 0.0]
  - - [2048, 3477, 1, 512]
    - [693, 0.0]
  - - [2048, 3478, 1, 512]
    - [693, 0.0]
  - - [2048, 3479, 1, 512]
    - [693, 0.0]
  - - [2048, 3480, 1, 512]
    - [691, 0.0]
  - - [2048, 3481, 1, 512]
    - [693, 0.0]
  - - [2048, 3483, 1, 512]
    - [693, 0.0]
  - - [2048, 3484, 1, 512]
    - [693, 0.0]
  - - [2048, 3487, 1, 512]
    - [693, 0.0]
  - - [2048, 3489, 1, 512]
    - [693, 0.0]
  - - [2048, 3490, 1, 512]
    - [693, 0.0]
  - - [2048, 3491, 1, 512]
    - [693, 0.0]
  - - [2048, 3493, 1, 512]
    - [693, 0.0]
  - - [2048, 3494, 1, 512]
    - [693, 0.0]
  - - [2048, 3495, 1, 512]
    - [691, 0.0]
  - - [2048, 3497, 1, 512]
    - [691, 0.0]
  - - [2048, 3498, 1, 512]
    - [693, 0.0]
  - - [2048, 3501, 1, 512]
    - [691, 0.0]
  - - [2048, 3503, 1, 512]
    - [693, 0.0]
  - - [2048, 3505, 1, 512]
    - [691, 0.0]
  - - [2048, 3507, 1, 512]
    - [693, 0.0]
  - - [2048, 3508, 1, 512]
    - [691, 0.0]
  - - [2048, 3509, 1, 512]
    - [693, 0.0]
  - - [2048, 3510, 1, 512]
    - [691, 0.0]
  - - [2048, 3511, 1, 512]
    - [691, 0.0]
  - - [2048, 3513, 1, 512]
    - [693, 0.0]
  - - [2048, 3514, 1, 512]
    - [693, 0.0]
  - - [2048, 3515, 1, 512]
    - [691, 0.0]
  - - [2048, 3517, 1, 512]
    - [693, 0.0]
  - - [2048, 3518, 1, 512]
    - [693, 0.0]
  - - [2048, 3519, 1, 512]
    - [693, 0.0]
  - - [2048, 3520, 1, 512]
    - [691, 0.0]
  - - [2048, 3523, 1, 512]
    - [691, 0.0]
  - - [2048, 3528, 1, 512]
    - [691, 0.0]
  - - [2048, 3529, 1, 512]
    - [691, 0.0]
  - - [2048, 3530, 1, 512]
    - [691, 0.0]
  - - [2048, 3531, 1, 512]
    - [693, 0.0]
  - - [2048, 3532, 1, 512]
    - [693, 0.0]
  - - [2048, 3533, 1, 512]
    - [691, 0.0]
  - - [2048, 3534, 1, 512]
    - [693, 0.0]
  - - [2048, 3538, 1, 512]
    - [691, 0.0]
  - - [2048, 3539, 1, 512]
    - [693, 0.0]
  - - [2048, 3540, 1, 512]
    - [693, 0.0]
  - - [2048, 3541, 1, 512]
    - [693, 0.0]
  - - [2048, 3547, 1, 512]
    - [691, 0.0]
  - - [2048, 3548, 1, 512]
    - [691, 0.0]
  - - [2048, 3552, 1, 512]
    - [691, 0.0]
  - - [2048, 3564, 1, 512]
    - [693, 0.0]
  - - [2048, 3575, 1, 512]
    - [694, 0.0]
  - - [2048, 3598, 1, 512]
    - [691, 0.0]
  - - [2048, 3599, 1, 512]
    - [693, 0.0]
  - - [2048, 3608, 1, 512]
    - [693, 0.0]
  - - [2048, 3776, 1, 512]
    - [691, 0.0]
  - - [2048, 3780, 1, 512]
    - [693, 0.0]
  - - [2048, 3796, 1, 512]
    - [691, 0.0]
  - - [2048, 3822, 1, 512]
    - [693, 0.0]
  - - [2048, 3835, 1, 512]
    - [693, 0.0]
  - - [2048, 3840, 1, 512]
    - [693, 0.0]
  - - [2048, 3859, 1, 512]
    - [691, 0.0]
  - - [2048, 3864, 1, 512]
    - [693, 0.0]
  - - [2048, 3870, 1, 512]
    - [691, 0.0]
  - - [2048, 3876, 1, 512]
    - [693, 0.0]
  - - [2048, 3906, 1, 512]
    - [691, 0.0]
  - - [2048, 3910, 1, 512]
    - [691, 0.0]
  - - [2048, 3925, 1, 512]
    - [693, 0.0]
  - - [2048, 3942, 1, 512]
    - [691, 0.0]
  - - [2048, 3944, 1, 512]
    - [693, 0.0]
  - - [2048, 3955, 1, 512]
    - [693, 0.0]
  - - [2048, 3968, 1, 512]
    - [693, 0.0]
  - - [2048, 3969, 1, 512]
    - [693, 0.0]
  - - [2048, 3976, 1, 512]
    - [691, 0.0]
  - - [2048, 3977, 1, 512]
    - [693, 0.0]
  - - [2048, 3978, 1, 512]
    - [691, 0.0]
  - - [2048, 3990, 1, 512]
    - [691, 0.0]
  - - [2048, 3995, 1, 512]
    - [691, 0.0]
  - - [2048, 3996, 1, 512]
    - [691, 0.0]
  - - [2048, 3999, 1, 512]
    - [691, 0.0]
  - - [2048, 4005, 1, 512]
    - [693, 0.0]
  - - [2048, 4012, 1, 512]
    - [691, 0.0]
  - - [2048, 4020, 1, 512]
    - [691, 0.0]
  - - [2048, 4026, 1, 512]
    - [691, 0.0]
  - - [2048, 4030, 1, 512]
    - [691, 0.0]
  - - [2048, 4032, 1, 512]
    - [693, 0.0]
  - - [512, 160, 1, 2048]
    - [700, 0.0]
  - - [512, 174, 1, 2048]
    - [701, 0.0]
  - - [512, 182, 1, 512]
    - [702, 0.0]
  - - [512, 184, 1, 512]
    - [700, 0.0]
  - - [512, 184, 1, 2048]
    - [703, 0.0]
  - - [512, 189, 1, 512]
    - [700, 0.0]
  - - [512, 189, 1, 2048]
    - [702, 0.0]
  - - [512, 198, 1, 2048]
    - [701, 0.0]
  - - [512, 206, 1, 512]
    - [700, 0.0]
  - - [512, 207, 1, 2048]
    - [701, 0.0]
  - - [512, 208, 1, 512]
    - [704, 0.0]
  - - [512, 208, 1, 2048]
    - [701, 0.0]
  - - [512, 224, 1, 512]
    - [705, 0.0]
  - - [512, 245, 1, 2048]
    - [701, 0.0]
  - - [512, 246, 1, 512]
    - [706, 0.0]
  - - [512, 246, 1, 2048]
    - [701, 0.0]
  - - [512, 264, 1, 512]
    - [706, 0.0]
  - - [512, 264, 1, 2048]
    - [701, 0.0]
  - - [512, 401, 1, 2048]
    - [707, 0.0]
