library/src/blas3/Tensile/Logic/asm_full/arcturus_Cijk_Alik_Bjlk_SB.yaml
- {MinimumRequiredVersion: 4.6.0}
- arcturus
- gfx908
- [Device 7380, Device 7388, Device 738c]
    SolutionIndex: 0
    SolutionNameMin: Cijk_Alik_Bjlk_SB_MT016x016x08_GRVW02_GSU01_SNLL0_TT02_02_VW02_WG08_08_01
    SolutionIndex: 1
    SolutionNameMin: Cijk_Alik_Bjlk_SB_MT016x032x08_GRVW02_GSU01_SNLL0_TT02_04_VW02_WG08_08_01
    SolutionIndex: 2
    SolutionNameMin: Cijk_Alik_Bjlk_SB_MT032x032x08_GRVW02_GSU01_SNLL0_TT02_02_VW02_WG16_16_01
    SolutionIndex: 3
    SolutionNameMin: Cijk_Alik_Bjlk_SB_MT032x064x08_GRVW02_GSU01_SNLL0_TT02_04_VW02_WG16_16_01
    SolutionIndex: 4
    SolutionNameMin: Cijk_Alik_Bjlk_SB_MT128x128x08_GRVW04_GSU01_SNLL0_TT08_08_VW04_WG16_16_01
    SolutionIndex: 5
    SolutionNameMin: Cijk_Alik_Bjlk_SB_MT032x016x08_GRVW02_GSU01_SNLL0_TT02_02_VW02_WG16_08_01
    SolutionIndex: 6
    SolutionNameMin: Cijk_Alik_Bjlk_SB_MT032x032x08_GRVW02_GSU01_SNLL0_TT02_04_VW02_WG16_08_01
    SolutionIndex: 7
    SolutionNameMin: Cijk_Alik_Bjlk_SB_MT016x032x08_GRVW02_GSU01_SNLL0_TT02_02_VW02_WG08_16_01
    SolutionIndex: 8
    SolutionNameMin: Cijk_Alik_Bjlk_SB_MT016x064x08_GRVW02_GSU01_SNLL0_TT02_04_VW02_WG08_16_01
    SolutionIndex: 9
    SolutionNameMin: Cijk_Alik_Bjlk_SB_MT016x016x08_GRVW02_GSU01_SNLL0_TT02_02_VW02_WG08_08_01
    SolutionIndex: 10
    SolutionNameMin: Cijk_Alik_Bjlk_SB_MT016x032x08_GRVW02_GSU01_SNLL0_TT02_04_VW02_WG08_08_01
    SolutionIndex: 11
    SolutionNameMin: Cijk_Alik_Bjlk_SB_MT032x032x08_GRVW02_GSU01_SNLL0_TT02_02_VW02_WG16_16_01
    SolutionIndex: 12
    SolutionNameMin: Cijk_Alik_Bjlk_SB_MT032x064x08_GRVW02_GSU01_SNLL0_TT02_04_VW02_WG16_16_01
    SolutionIndex: 13
    SolutionNameMin: Cijk_Alik_Bjlk_SB_MT128x128x08_GRVW04_GSU01_SNLL0_TT08_08_VW04_WG16_16_01
    SolutionIndex: 14
    SolutionNameMin: Cijk_Alik_Bjlk_SB_MT032x016x08_GRVW02_GSU01_SNLL0_TT02_02_VW02_WG16_08_01
    SolutionIndex: 15
    SolutionNameMin: Cijk_Alik_Bjlk_SB_MT032x032x08_GRVW02_GSU01_SNLL0_TT02_04_VW02_WG16_08_01
    SolutionIndex: 16
    SolutionNameMin: Cijk_Alik_Bjlk_SB_MT016x032x08_GRVW02_GSU01_SNLL0_TT02_02_VW02_WG08_16_01
    SolutionIndex: 17
    SolutionNameMin: Cijk_Alik_Bjlk_SB_MT016x016x08_GRVW02_GSU02_SNLL0_TT02_02_VW02_WG08_08_02
    SolutionIndex: 18
    SolutionNameMin: Cijk_Alik_Bjlk_SB_MT016x016x08_GRVW02_GSU04_SNLL0_TT02_02_VW02_WG08_08_02
    SolutionIndex: 19
    SolutionNameMin: Cijk_Alik_Bjlk_SB_MT016x016x08_GRVW02_GSU08_SNLL0_TT02_02_VW02_WG08_08_02
    SolutionIndex: 20
    SolutionNameMin: Cijk_Alik_Bjlk_SB_MT008x016x16_GRVW02_GSU02_SNLL0_TT02_02_VW02_WG04_08_04
    SolutionIndex: 21
    SolutionNameMin: Cijk_Alik_Bjlk_SB_MT016x032x16_GRVW02_GSU02_SNLL0_TT02_04_VW02_WG08_08_02
    SolutionIndex: 22
    SolutionNameMin: Cijk_Alik_Bjlk_SB_MT032x032x16_GRVW04_GSU02_SNLL0_TT04_04_VW04_WG08_08_02
    SolutionIndex: 23
    SolutionNameMin: Cijk_Alik_Bjlk_SB_MT032x064x16_GRVW04_GSU02_SNLL0_TT04_08_VW04_WG08_08_02
    SolutionIndex: 24
    SolutionNameMin: Cijk_Alik_Bjlk_SB_MT016x032x16_GRVW02_GSU02_SNLL0_TT02_02_VW02_WG08_16_02
    SolutionIndex: 25
    SolutionNameMin: Cijk_Alik_Bjlk_SB_MT016x064x16_GRVW02_GSU02_SNLL0_TT02_04_VW02_WG08_16_02
    SolutionIndex: 26
    SolutionNameMin: Cijk_Alik_Bjlk_SB_MT008x016x16_GRVW02_GSU02_SNLL0_TT02_02_VW02_WG04_08_04
    SolutionIndex: 27
    SolutionNameMin: Cijk_Alik_Bjlk_SB_MT032x032x16_GRVW04_GSU02_SNLL0_TT04_04_VW04_WG08_08_02
    SolutionIndex: 28
    SolutionNameMin: Cijk_Alik_Bjlk_SB_MT032x064x16_GRVW04_GSU02_SNLL0_TT04_08_VW04_WG08_08_02
    SolutionIndex: 29
    SolutionNameMin: Cijk_Alik_Bjlk_SB_MT016x032x16_GRVW02_GSU02_SNLL0_TT02_02_VW02_WG08_16_02
    SolutionIndex: 30
    SolutionNameMin: Cijk_Alik_Bjlk_SB_MT016x064x16_GRVW02_GSU02_SNLL0_TT02_04_VW02_WG08_16_02
    SolutionIndex: 31
    SolutionNameMin: Cijk_Alik_Bjlk_SB_MT008x016x16_GRVW02_GSU04_SNLL0_TT02_02_VW02_WG04_08_04
    SolutionIndex: 32
    SolutionNameMin: Cijk_Alik_Bjlk_SB_MT008x032x16_GRVW02_GSU04_SNLL0_TT02_04_VW02_WG04_08_04
    SolutionIndex: 33
    SolutionNameMin: Cijk_Alik_Bjlk_SB_MT032x032x16_GRVW04_GSU04_SNLL0_TT04_04_VW04_WG08_08_02
    SolutionIndex: 34
    SolutionNameMin: Cijk_Alik_Bjlk_SB_MT032x064x16_GRVW04_GSU04_SNLL0_TT04_08_VW04_WG08_08_02
    SolutionIndex: 35
    SolutionNameMin: Cijk_Alik_Bjlk_SB_MT016x064x16_GRVW02_GSU04_SNLL0_TT02_04_VW02_WG08_16_02
    SolutionIndex: 36
    SolutionNameMin: Cijk_Alik_Bjlk_SB_MT032x032x16_GRVW04_GSU04_SNLL0_TT04_04_VW04_WG08_08_02
    SolutionIndex: 37
    SolutionNameMin: Cijk_Alik_Bjlk_SB_MT032x064x16_GRVW04_GSU04_SNLL0_TT04_08_VW04_WG08_08_02
    SolutionIndex: 38
    SolutionNameMin: Cijk_Alik_Bjlk_SB_MT008x016x16_GRVW02_GSU08_SNLL0_TT02_02_VW02_WG04_08_04
    SolutionIndex: 39
    SolutionNameMin: Cijk_Alik_Bjlk_SB_MT008x032x16_GRVW02_GSU08_SNLL0_TT02_04_VW02_WG04_08_04
    SolutionIndex: 40
    SolutionNameMin: Cijk_Alik_Bjlk_SB_MT064x064x24_GRVW04_GSU02_SNLL0_TT08_08_VW04_WG08_08_02
    SolutionIndex: 41
    SolutionNameMin: Cijk_Alik_Bjlk_SB_MT064x064x24_GRVW04_GSU02_SNLL0_TT08_08_VW04_WG08_08_02
    SolutionIndex: 42
    SolutionNameMin: Cijk_Alik_Bjlk_SB_MT008x016x32_GRVW02_GSU02_SNLL0_TT02_02_VW02_WG04_08_04
    SolutionIndex: 43
    SolutionNameMin: Cijk_Alik_Bjlk_SB_MT008x032x32_GRVW02_GSU02_SNLL0_TT02_04_VW02_WG04_08_04
    SolutionIndex: 44
    SolutionNameMin: Cijk_Alik_Bjlk_SB_MT032x032x32_GRVW02_GSU02_SNLL0_TT02_04_VW02_WG16_08_04
    SolutionIndex: 45
    SolutionNameMin: Cijk_Alik_Bjlk_SB_MT032x064x32_GRVW04_GSU02_SNLL0_TT04_04_VW04_WG08_16_02
    SolutionIndex: 46
    SolutionNameMin: Cijk_Alik_Bjlk_SB_MT008x032x32_GRVW02_GSU02_SNLL0_TT02_04_VW02_WG04_08_04
    SolutionIndex: 47
    SolutionNameMin: Cijk_Alik_Bjlk_SB_MT016x032x32_GRVW04_GSU02_SNLL0_TT04_04_VW04_WG04_08_04
    SolutionIndex: 48
    SolutionNameMin: Cijk_Alik_Bjlk_SB_MT064x064x32_GRVW04_GSU02_SNLL0_TT04_08_VW04_WG16_08_04
    SolutionIndex: 49
    SolutionNameMin: Cijk_Alik_Bjlk_SB_MT032x064x32_GRVW04_GSU02_SNLL0_TT04_04_VW04_WG08_16_02
    SolutionIndex: 50
    SolutionNameMin: Cijk_Alik_Bjlk_SB_MT008x016x32_GRVW02_GSU04_SNLL0_TT02_02_VW02_WG04_08_04
    SolutionIndex: 51
    SolutionNameMin: Cijk_Alik_Bjlk_SB_MT016x032x32_GRVW04_GSU04_SNLL0_TT04_04_VW04_WG04_08_04
    SolutionIndex: 52
    SolutionNameMin: Cijk_Alik_Bjlk_SB_MT032x016x32_GRVW02_GSU04_SNLL0_TT02_02_VW02_WG16_08_04
    SolutionIndex: 53
    SolutionNameMin: Cijk_Alik_Bjlk_SB_MT032x032x32_GRVW02_GSU04_SNLL0_TT02_04_VW02_WG16_08_04
    SolutionIndex: 54
    SolutionNameMin: Cijk_Alik_Bjlk_SB_MT032x064x32_GRVW04_GSU04_SNLL0_TT04_04_VW04_WG08_16_02
    SolutionIndex: 55
    SolutionNameMin: Cijk_Alik_Bjlk_SB_MT008x016x32_GRVW02_GSU04_SNLL0_TT02_02_VW02_WG04_08_04
    SolutionIndex: 56
    SolutionNameMin: Cijk_Alik_Bjlk_SB_MT008x032x32_GRVW02_GSU04_SNLL0_TT02_04_VW02_WG04_08_04
    SolutionIndex: 57
    SolutionNameMin: Cijk_Alik_Bjlk_SB_MT016x032x32_GRVW04_GSU04_SNLL0_TT04_04_VW04_WG04_08_04
    SolutionIndex: 58
    SolutionNameMin: Cijk_Alik_Bjlk_SB_MT008x016x32_GRVW02_GSU08_SNLL0_TT02_02_VW02_WG04_08_04
    SolutionIndex: 59
    SolutionNameMin: Cijk_Alik_Bjlk_SB_MT128x128x08_GRVW04_GSU01_SNLL0_TT08_08_VW04_WG16_16_01
    SolutionIndex: 60
    SolutionNameMin: Cijk_Alik_Bjlk_SB_MT128x128x08_GRVW04_GSU01_SNLL0_TT08_08_VW04_WG16_16_01
    SolutionIndex: 61
    SolutionNameMin: Cijk_Alik_Bjlk_SB_MT128x128x08_GRVW04_GSU01_SNLL1_TT08_08_VW04_WG16_16_01
    SolutionIndex: 62
    SolutionNameMin: Cijk_Alik_Bjlk_SB_MT128x128x08_GRVW04_GSU01_SNLL1_TT08_08_VW04_WG16_16_01
    SolutionIndex: 63
    SolutionNameMin: Cijk_Alik_Bjlk_SB_MT064x064x16_GRVW04_GSU01_SNLL0_TT04_04_VW04_WG16_16_01
    SolutionIndex: 64
    SolutionNameMin: Cijk_Alik_Bjlk_SB_MT064x064x16_GRVW04_GSU01_SNLL1_TT04_04_VW04_WG16_16_01
    SolutionIndex: 65
    SolutionNameMin: Cijk_Alik_Bjlk_SB_MT064x128x16_GRVW04_GSU01_SNLL0_TT04_08_VW04_WG16_16_01
    SolutionIndex: 66
    SolutionNameMin: Cijk_Alik_Bjlk_SB_MT064x128x16_GRVW04_GSU01_SNLL1_TT04_08_VW04_WG16_16_01
    SolutionIndex: 67
    SolutionNameMin: Cijk_Alik_Bjlk_SB_MT096x128x16_GRVW02_GSU01_SNLL1_TT06_08_VW02_WG16_16_01
    SolutionIndex: 68
    SolutionNameMin: Cijk_Alik_Bjlk_SB_MT128x064x16_GRVW04_GSU01_SNLL0_TT08_04_VW04_WG16_16_01
    SolutionIndex: 69
    SolutionNameMin: Cijk_Alik_Bjlk_SB_MT128x064x16_GRVW04_GSU01_SNLL1_TT08_04_VW04_WG16_16_01
    SolutionIndex: 70
    SolutionNameMin: Cijk_Alik_Bjlk_SB_MT128x096x16_GRVW02_GSU01_SNLL1_TT08_06_VW02_WG16_16_01
    SolutionIndex: 71
    SolutionNameMin: Cijk_Alik_Bjlk_SB_MT128x128x16_GRVW04_GSU01_SNLL0_TT08_08_VW04_WG16_16_01
    SolutionIndex: 72
    SolutionNameMin: Cijk_Alik_Bjlk_SB_MT128x128x16_GRVW04_GSU01_SNLL1_TT08_08_VW04_WG16_16_01
    SolutionIndex: 73
    SolutionNameMin: Cijk_Alik_Bjlk_SB_MT064x064x16_GRVW04_GSU01_SNLL0_TT04_04_VW04_WG16_16_01
    SolutionIndex: 74
    SolutionNameMin: Cijk_Alik_Bjlk_SB_MT064x064x16_GRVW04_GSU01_SNLL1_TT04_04_VW04_WG16_16_01
    SolutionIndex: 75
    SolutionNameMin: Cijk_Alik_Bjlk_SB_MT064x128x16_GRVW04_GSU01_SNLL0_TT04_08_VW04_WG16_16_01
    SolutionIndex: 76
    SolutionNameMin: Cijk_Alik_Bjlk_SB_MT064x128x16_GRVW04_GSU01_SNLL1_TT04_08_VW04_WG16_16_01
    SolutionIndex: 77
    SolutionNameMin: Cijk_Alik_Bjlk_SB_MT096x128x16_GRVW02_GSU01_SNLL1_TT06_08_VW02_WG16_16_01
    SolutionIndex: 78
    SolutionNameMin: Cijk_Alik_Bjlk_SB_MT128x064x16_GRVW04_GSU01_SNLL0_TT08_04_VW04_WG16_16_01
    SolutionIndex: 79
    SolutionNameMin: Cijk_Alik_Bjlk_SB_MT128x064x16_GRVW04_GSU01_SNLL1_TT08_04_VW04_WG16_16_01
    SolutionIndex: 80
    SolutionNameMin: Cijk_Alik_Bjlk_SB_MT128x096x16_GRVW02_GSU01_SNLL1_TT08_06_VW02_WG16_16_01
    SolutionIndex: 81
    SolutionNameMin: Cijk_Alik_Bjlk_SB_MT128x128x16_GRVW04_GSU01_SNLL0_TT08_08_VW04_WG16_16_01
    SolutionIndex: 82
    SolutionNameMin: Cijk_Alik_Bjlk_SB_MT128x128x16_GRVW04_GSU01_SNLL1_TT08_08_VW04_WG16_16_01
    SolutionIndex: 83
    SolutionNameMin: Cijk_Alik_Bjlk_SB_MT128x128x24_GRVW04_GSU01_SNLL0_TT08_08_VW04_WG16_16_01
    SolutionIndex: 84
    SolutionNameMin: Cijk_Alik_Bjlk_SB_MT128x128x24_GRVW04_GSU01_SNLL0_TT08_08_VW04_WG16_16_01
    SolutionIndex: 85
    SolutionNameMin: Cijk_Alik_Bjlk_SB_MT064x064x32_GRVW04_GSU01_SNLL0_TT04_04_VW04_WG16_16_01
    SolutionIndex: 86
    SolutionNameMin: Cijk_Alik_Bjlk_SB_MT064x064x32_GRVW04_GSU01_SNLL1_TT04_04_VW04_WG16_16_01
    SolutionIndex: 87
    SolutionNameMin: Cijk_Alik_Bjlk_SB_MT064x128x32_GRVW04_GSU01_SNLL0_TT04_08_VW04_WG16_16_01
    SolutionIndex: 88
    SolutionNameMin: Cijk_Alik_Bjlk_SB_MT128x128x32_GRVW04_GSU01_SNLL0_TT08_08_VW04_WG16_16_01
    SolutionIndex: 89
    SolutionNameMin: Cijk_Alik_Bjlk_SB_MT064x064x32_GRVW04_GSU01_SNLL0_TT04_04_VW04_WG16_16_01
    SolutionIndex: 90
    SolutionNameMin: Cijk_Alik_Bjlk_SB_MT064x064x32_GRVW04_GSU01_SNLL1_TT04_04_VW04_WG16_16_01
    SolutionIndex: 91
    SolutionNameMin: Cijk_Alik_Bjlk_SB_MT064x128x32_GRVW04_GSU01_SNLL0_TT04_08_VW04_WG16_16_01
    SolutionIndex: 92
    SolutionNameMin: Cijk_Alik_Bjlk_SB_MT064x128x32_GRVW04_GSU01_SNLL1_TT04_08_VW04_WG16_16_01
    SolutionIndex: 93
    SolutionNameMin: Cijk_Alik_Bjlk_SB_MT128x064x32_GRVW04_GSU01_SNLL0_TT08_04_VW04_WG16_16_01
    SolutionIndex: 94
    SolutionNameMin: Cijk_Alik_Bjlk_SB_MT128x128x32_GRVW04_GSU01_SNLL0_TT08_08_VW04_WG16_16_01
    SolutionIndex: 95
    SolutionNameMin: Cijk_Alik_Bjlk_SB_MT016x016x04_GRVW02_GSU01_SNLL0_TT02_02_VW02_WG08_08_01
    SolutionIndex: 96
    SolutionNameMin: Cijk_Alik_Bjlk_SB_MT032x032x02_GRVW04_GSU01_SNLL0_TT04_04_VW04_WG08_08_01
    SolutionIndex: 97
    SolutionNameMin: Cijk_Alik_Bjlk_SB_MT008x008x08_GRVW02_GSU02_SNLL0_TT02_02_VW02_WG04_04_04
    SolutionIndex: 98
    SolutionNameMin: Cijk_Alik_Bjlk_SB_MT016x016x16_GRVW02_GSU02_SNLL0_TT02_02_VW02_WG08_08_04
    SolutionIndex: 99
    SolutionNameMin: Cijk_Alik_Bjlk_SB_MT008x008x08_GRVW02_GSU04_SNLL0_TT02_02_VW02_WG04_04_04
    SolutionIndex: 100
    SolutionNameMin: Cijk_Alik_Bjlk_SB_MT016x016x16_GRVW02_GSU04_SNLL0_TT02_02_VW02_WG08_08_04
    SolutionIndex: 101
    SolutionNameMin: Cijk_Alik_Bjlk_SB_MT016x016x04_GRVW02_GSU08_SNLL0_TT02_02_VW02_WG08_08_01
    SolutionIndex: 102
    SolutionNameMin: Cijk_Alik_Bjlk_SB_MT032x032x02_GRVW04_GSU08_SNLL0_TT04_04_VW04_WG08_08_01
    SolutionIndex: 103
    SolutionNameMin: Cijk_Alik_Bjlk_SB_MT008x008x08_GRVW02_GSU08_SNLL0_TT02_02_VW02_WG04_04_04
    SolutionIndex: 104
    SolutionNameMin: Cijk_Alik_Bjlk_SB_MT016x016x16_GRVW02_GSU08_SNLL0_TT02_02_VW02_WG08_08_04
    SolutionIndex: 105
    SolutionNameMin: Cijk_Alik_Bjlk_SB_MT008x008x08_GRVW02_GSU16_SNLL0_TT02_02_VW02_WG04_04_04
    SolutionIndex: 106
    SolutionNameMin: Cijk_Alik_Bjlk_SB_MT016x016x16_GRVW02_GSU16_SNLL0_TT02_02_VW02_WG08_08_04
    SolutionIndex: 107
    SolutionNameMin: Cijk_Alik_Bjlk_SB_MT016x016x08_GRVW02_GSU01_SNLL0_TT02_02_VW02_WG08_08_01
    SolutionIndex: 108
    SolutionNameMin: Cijk_Alik_Bjlk_SB_MT016x032x08_GRVW02_GSU01_SNLL0_TT02_04_VW02_WG08_08_01
    SolutionIndex: 109
    SolutionNameMin: Cijk_Alik_Bjlk_SB_MT032x032x08_GRVW02_GSU01_SNLL0_TT02_02_VW02_WG16_16_01
    SolutionIndex: 110
    SolutionNameMin: Cijk_Alik_Bjlk_SB_MT032x064x08_GRVW02_GSU01_SNLL0_TT02_04_VW02_WG16_16_01
    SolutionIndex: 111
    SolutionNameMin: Cijk_Alik_Bjlk_SB_MT128x128x08_GRVW04_GSU01_SNLL0_TT08_08_VW04_WG16_16_01
    SolutionIndex: 112
    SolutionNameMin: Cijk_Alik_Bjlk_SB_MT032x016x08_GRVW02_GSU01_SNLL0_TT02_02_VW02_WG16_08_01
    SolutionIndex: 113
    SolutionNameMin: Cijk_Alik_Bjlk_SB_MT032x032x08_GRVW02_GSU01_SNLL0_TT02_04_VW02_WG16_08_01
    SolutionIndex: 114
    SolutionNameMin: Cijk_Alik_Bjlk_SB_MT016x032x08_GRVW02_GSU01_SNLL0_TT02_02_VW02_WG08_16_01
    SolutionIndex: 115
    SolutionNameMin: Cijk_Alik_Bjlk_SB_MT016x064x08_GRVW02_GSU01_SNLL0_TT02_04_VW02_WG08_16_01
    SolutionIndex: 116
    SolutionNameMin: Cijk_Alik_Bjlk_SB_MT016x016x08_GRVW02_GSU01_SNLL0_TT02_02_VW02_WG08_08_01
    SolutionIndex: 117
    SolutionNameMin: Cijk_Alik_Bjlk_SB_MT016x032x08_GRVW02_GSU01_SNLL0_TT02_04_VW02_WG08_08_01
    SolutionIndex: 118
    SolutionNameMin: Cijk_Alik_Bjlk_SB_MT032x032x08_GRVW02_GSU01_SNLL0_TT02_02_VW02_WG16_16_01
    SolutionIndex: 119
    SolutionNameMin: Cijk_Alik_Bjlk_SB_MT032x064x08_GRVW02_GSU01_SNLL0_TT02_04_VW02_WG16_16_01
    SolutionIndex: 120
    SolutionNameMin: Cijk_Alik_Bjlk_SB_MT128x128x08_GRVW04_GSU01_SNLL0_TT08_08_VW04_WG16_16_01
    SolutionIndex: 121
    SolutionNameMin: Cijk_Alik_Bjlk_SB_MT032x016x08_GRVW02_GSU01_SNLL0_TT02_02_VW02_WG16_08_01
    SolutionIndex: 122
    SolutionNameMin: Cijk_Alik_Bjlk_SB_MT032x032x08_GRVW02_GSU01_SNLL0_TT02_04_VW02_WG16_08_01
    SolutionIndex: 123
    SolutionNameMin: Cijk_Alik_Bjlk_SB_MT016x032x08_GRVW02_GSU01_SNLL0_TT02_02_VW02_WG08_16_01
    SolutionIndex: 124
    SolutionNameMin: Cijk_Alik_Bjlk_SB_MT016x016x08_GRVW02_GSU02_SNLL0_TT02_02_VW02_WG08_08_02
    SolutionIndex: 125
    SolutionNameMin: Cijk_Alik_Bjlk_SB_MT016x016x08_GRVW02_GSU04_SNLL0_TT02_02_VW02_WG08_08_02
    SolutionIndex: 126
    SolutionNameMin: Cijk_Alik_Bjlk_SB_MT016x016x08_GRVW02_GSU08_SNLL0_TT02_02_VW02_WG08_08_02
    SolutionIndex: 127
    SolutionNameMin: Cijk_Alik_Bjlk_SB_MT008x016x16_GRVW02_GSU02_SNLL0_TT02_02_VW02_WG04_08_04
    SolutionIndex: 128
    SolutionNameMin: Cijk_Alik_Bjlk_SB_MT016x032x16_GRVW02_GSU02_SNLL0_TT02_04_VW02_WG08_08_02
    SolutionIndex: 129
    SolutionNameMin: Cijk_Alik_Bjlk_SB_MT032x032x16_GRVW04_GSU02_SNLL0_TT04_04_VW04_WG08_08_02
    SolutionIndex: 130
    SolutionNameMin: Cijk_Alik_Bjlk_SB_MT032x064x16_GRVW04_GSU02_SNLL0_TT04_08_VW04_WG08_08_02
    SolutionIndex: 131
    SolutionNameMin: Cijk_Alik_Bjlk_SB_MT016x032x16_GRVW02_GSU02_SNLL0_TT02_02_VW02_WG08_16_02
    SolutionIndex: 132
    SolutionNameMin: Cijk_Alik_Bjlk_SB_MT016x064x16_GRVW02_GSU02_SNLL0_TT02_04_VW02_WG08_16_02
    SolutionIndex: 133
    SolutionNameMin: Cijk_Alik_Bjlk_SB_MT008x016x16_GRVW02_GSU02_SNLL0_TT02_02_VW02_WG04_08_04
    SolutionIndex: 134
    SolutionNameMin: Cijk_Alik_Bjlk_SB_MT032x032x16_GRVW04_GSU02_SNLL0_TT04_04_VW04_WG08_08_02
    SolutionIndex: 135
    SolutionNameMin: Cijk_Alik_Bjlk_SB_MT032x064x16_GRVW04_GSU02_SNLL0_TT04_08_VW04_WG08_08_02
    SolutionIndex: 136
    SolutionNameMin: Cijk_Alik_Bjlk_SB_MT016x032x16_GRVW02_GSU02_SNLL0_TT02_02_VW02_WG08_16_02
    SolutionIndex: 137
    SolutionNameMin: Cijk_Alik_Bjlk_SB_MT016x064x16_GRVW02_GSU02_SNLL0_TT02_04_VW02_WG08_16_02
    SolutionIndex: 138
    SolutionNameMin: Cijk_Alik_Bjlk_SB_MT008x016x16_GRVW02_GSU04_SNLL0_TT02_02_VW02_WG04_08_04
    SolutionIndex: 139
    SolutionNameMin: Cijk_Alik_Bjlk_SB_MT008x032x16_GRVW02_GSU04_SNLL0_TT02_04_VW02_WG04_08_04
    SolutionIndex: 140
    SolutionNameMin: Cijk_Alik_Bjlk_SB_MT032x032x16_GRVW04_GSU04_SNLL0_TT04_04_VW04_WG08_08_02
    SolutionIndex: 141
    SolutionNameMin: Cijk_Alik_Bjlk_SB_MT032x064x16_GRVW04_GSU04_SNLL0_TT04_08_VW04_WG08_08_02
    SolutionIndex: 142
    SolutionNameMin: Cijk_Alik_Bjlk_SB_MT016x064x16_GRVW02_GSU04_SNLL0_TT02_04_VW02_WG08_16_02
    SolutionIndex: 143
    SolutionNameMin: Cijk_Alik_Bjlk_SB_MT032x032x16_GRVW04_GSU04_SNLL0_TT04_04_VW04_WG08_08_02
    SolutionIndex: 144
    SolutionNameMin: Cijk_Alik_Bjlk_SB_MT032x064x16_GRVW04_GSU04_SNLL0_TT04_08_VW04_WG08_08_02
    SolutionIndex: 145
    SolutionNameMin: Cijk_Alik_Bjlk_SB_MT008x016x16_GRVW02_GSU08_SNLL0_TT02_02_VW02_WG04_08_04
    SolutionIndex: 146
    SolutionNameMin: Cijk_Alik_Bjlk_SB_MT008x032x16_GRVW02_GSU08_SNLL0_TT02_04_VW02_WG04_08_04
    SolutionIndex: 147
    SolutionNameMin: Cijk_Alik_Bjlk_SB_MT064x064x24_GRVW04_GSU02_SNLL0_TT08_08_VW04_WG08_08_02
    SolutionIndex: 148
    SolutionNameMin: Cijk_Alik_Bjlk_SB_MT064x064x24_GRVW04_GSU02_SNLL0_TT08_08_VW04_WG08_08_02
    SolutionIndex: 149
    SolutionNameMin: Cijk_Alik_Bjlk_SB_MT008x016x32_GRVW02_GSU02_SNLL0_TT02_02_VW02_WG04_08_04
    SolutionIndex: 150
    SolutionNameMin: Cijk_Alik_Bjlk_SB_MT008x032x32_GRVW02_GSU02_SNLL0_TT02_04_VW02_WG04_08_04
    SolutionIndex: 151
    SolutionNameMin: Cijk_Alik_Bjlk_SB_MT032x032x32_GRVW02_GSU02_SNLL0_TT02_04_VW02_WG16_08_04
    SolutionIndex: 152
    SolutionNameMin: Cijk_Alik_Bjlk_SB_MT032x064x32_GRVW04_GSU02_SNLL0_TT04_04_VW04_WG08_16_02
    SolutionIndex: 153
    SolutionNameMin: Cijk_Alik_Bjlk_SB_MT008x032x32_GRVW02_GSU02_SNLL0_TT02_04_VW02_WG04_08_04
    SolutionIndex: 154
    SolutionNameMin: Cijk_Alik_Bjlk_SB_MT016x032x32_GRVW04_GSU02_SNLL0_TT04_04_VW04_WG04_08_04
    SolutionIndex: 155
    SolutionNameMin: Cijk_Alik_Bjlk_SB_MT064x064x32_GRVW04_GSU02_SNLL0_TT04_08_VW04_WG16_08_04
    SolutionIndex: 156
    SolutionNameMin: Cijk_Alik_Bjlk_SB_MT032x064x32_GRVW04_GSU02_SNLL0_TT04_04_VW04_WG08_16_02
    SolutionIndex: 157
    SolutionNameMin: Cijk_Alik_Bjlk_SB_MT008x016x32_GRVW02_GSU04_SNLL0_TT02_02_VW02_WG04_08_04
    SolutionIndex: 158
    SolutionNameMin: Cijk_Alik_Bjlk_SB_MT016x032x32_GRVW04_GSU04_SNLL0_TT04_04_VW04_WG04_08_04
    SolutionIndex: 159
    SolutionNameMin: Cijk_Alik_Bjlk_SB_MT032x016x32_GRVW02_GSU04_SNLL0_TT02_02_VW02_WG16_08_04
    SolutionIndex: 160
    SolutionNameMin: Cijk_Alik_Bjlk_SB_MT032x032x32_GRVW02_GSU04_SNLL0_TT02_04_VW02_WG16_08_04
    SolutionIndex: 161
    SolutionNameMin: Cijk_Alik_Bjlk_SB_MT032x064x32_GRVW04_GSU04_SNLL0_TT04_04_VW04_WG08_16_02
    SolutionIndex: 162
    SolutionNameMin: Cijk_Alik_Bjlk_SB_MT008x016x32_GRVW02_GSU04_SNLL0_TT02_02_VW02_WG04_08_04
    SolutionIndex: 163
    SolutionNameMin: Cijk_Alik_Bjlk_SB_MT008x032x32_GRVW02_GSU04_SNLL0_TT02_04_VW02_WG04_08_04
    SolutionIndex: 164
    SolutionNameMin: Cijk_Alik_Bjlk_SB_MT016x032x32_GRVW04_GSU04_SNLL0_TT04_04_VW04_WG04_08_04
    SolutionIndex: 165
    SolutionNameMin: Cijk_Alik_Bjlk_SB_MT008x016x32_GRVW02_GSU08_SNLL0_TT02_02_VW02_WG04_08_04
    SolutionIndex: 166
    SolutionNameMin: Cijk_Alik_Bjlk_SB_MT128x128x08_GRVW04_GSU01_SNLL0_TT08_08_VW04_WG16_16_01
    SolutionIndex: 167
    SolutionNameMin: Cijk_Alik_Bjlk_SB_MT128x128x08_GRVW04_GSU01_SNLL0_TT08_08_VW04_WG16_16_01
    SolutionIndex: 168
    SolutionNameMin: Cijk_Alik_Bjlk_SB_MT128x128x08_GRVW04_GSU01_SNLL1_TT08_08_VW04_WG16_16_01
    SolutionIndex: 169
    SolutionNameMin: Cijk_Alik_Bjlk_SB_MT128x128x08_GRVW04_GSU01_SNLL1_TT08_08_VW04_WG16_16_01
    SolutionIndex: 170
    SolutionNameMin: Cijk_Alik_Bjlk_SB_MT064x064x16_GRVW04_GSU01_SNLL0_TT04_04_VW04_WG16_16_01
    SolutionIndex: 171
    SolutionNameMin: Cijk_Alik_Bjlk_SB_MT064x064x16_GRVW04_GSU01_SNLL1_TT04_04_VW04_WG16_16_01
    SolutionIndex: 172
    SolutionNameMin: Cijk_Alik_Bjlk_SB_MT064x128x16_GRVW04_GSU01_SNLL0_TT04_08_VW04_WG16_16_01
    SolutionIndex: 173
    SolutionNameMin: Cijk_Alik_Bjlk_SB_MT064x128x16_GRVW04_GSU01_SNLL1_TT04_08_VW04_WG16_16_01
    SolutionIndex: 174
    SolutionNameMin: Cijk_Alik_Bjlk_SB_MT096x128x16_GRVW02_GSU01_SNLL1_TT06_08_VW02_WG16_16_01
    SolutionIndex: 175
    SolutionNameMin: Cijk_Alik_Bjlk_SB_MT128x064x16_GRVW04_GSU01_SNLL0_TT08_04_VW04_WG16_16_01
    SolutionIndex: 176
    SolutionNameMin: Cijk_Alik_Bjlk_SB_MT128x064x16_GRVW04_GSU01_SNLL1_TT08_04_VW04_WG16_16_01
    SolutionIndex: 177
    SolutionNameMin: Cijk_Alik_Bjlk_SB_MT128x096x16_GRVW02_GSU01_SNLL1_TT08_06_VW02_WG16_16_01
    SolutionIndex: 178
    SolutionNameMin: Cijk_Alik_Bjlk_SB_MT128x128x16_GRVW04_GSU01_SNLL0_TT08_08_VW04_WG16_16_01
    SolutionIndex: 179
    SolutionNameMin: Cijk_Alik_Bjlk_SB_MT128x128x16_GRVW04_GSU01_SNLL1_TT08_08_VW04_WG16_16_01
    SolutionIndex: 180
    SolutionNameMin: Cijk_Alik_Bjlk_SB_MT064x064x16_GRVW04_GSU01_SNLL0_TT04_04_VW04_WG16_16_01
    SolutionIndex: 181
    SolutionNameMin: Cijk_Alik_Bjlk_SB_MT064x064x16_GRVW04_GSU01_SNLL1_TT04_04_VW04_WG16_16_01
    SolutionIndex: 182
    SolutionNameMin: Cijk_Alik_Bjlk_SB_MT064x128x16_GRVW04_GSU01_SNLL0_TT04_08_VW04_WG16_16_01
    SolutionIndex: 183
    SolutionNameMin: Cijk_Alik_Bjlk_SB_MT064x128x16_GRVW04_GSU01_SNLL1_TT04_08_VW04_WG16_16_01
    SolutionIndex: 184
    SolutionNameMin: Cijk_Alik_Bjlk_SB_MT096x128x16_GRVW02_GSU01_SNLL1_TT06_08_VW02_WG16_16_01
    SolutionIndex: 185
    SolutionNameMin: Cijk_Alik_Bjlk_SB_MT128x064x16_GRVW04_GSU01_SNLL0_TT08_04_VW04_WG16_16_01
    SolutionIndex: 186
    SolutionNameMin: Cijk_Alik_Bjlk_SB_MT128x064x16_GRVW04_GSU01_SNLL1_TT08_04_VW04_WG16_16_01
    SolutionIndex: 187
    SolutionNameMin: Cijk_Alik_Bjlk_SB_MT128x096x16_GRVW02_GSU01_SNLL1_TT08_06_VW02_WG16_16_01
    SolutionIndex: 188
    SolutionNameMin: Cijk_Alik_Bjlk_SB_MT128x128x16_GRVW04_GSU01_SNLL0_TT08_08_VW04_WG16_16_01
    SolutionIndex: 189
    SolutionNameMin: Cijk_Alik_Bjlk_SB_MT128x128x16_GRVW04_GSU01_SNLL1_TT08_08_VW04_WG16_16_01
    SolutionIndex: 190
    SolutionNameMin: Cijk_Alik_Bjlk_SB_MT128x128x24_GRVW04_GSU01_SNLL0_TT08_08_VW04_WG16_16_01
    SolutionIndex: 191
    SolutionNameMin: Cijk_Alik_Bjlk_SB_MT128x128x24_GRVW04_GSU01_SNLL0_TT08_08_VW04_WG16_16_01
    SolutionIndex: 192
    SolutionNameMin: Cijk_Alik_Bjlk_SB_MT064x064x32_GRVW04_GSU01_SNLL0_TT04_04_VW04_WG16_16_01
    SolutionIndex: 193
    SolutionNameMin: Cijk_Alik_Bjlk_SB_MT064x064x32_GRVW04_GSU01_SNLL1_TT04_04_VW04_WG16_16_01
    SolutionIndex: 194
    SolutionNameMin: Cijk_Alik_Bjlk_SB_MT064x128x32_GRVW04_GSU01_SNLL0_TT04_08_VW04_WG16_16_01
    SolutionIndex: 195
    SolutionNameMin: Cijk_Alik_Bjlk_SB_MT128x128x32_GRVW04_GSU01_SNLL0_TT08_08_VW04_WG16_16_01
    SolutionIndex: 196
    SolutionNameMin: Cijk_Alik_Bjlk_SB_MT064x064x32_GRVW04_GSU01_SNLL0_TT04_04_VW04_WG16_16_01
    SolutionIndex: 197
    SolutionNameMin: Cijk_Alik_Bjlk_SB_MT064x064x32_GRVW04_GSU01_SNLL1_TT04_04_VW04_WG16_16_01
    SolutionIndex: 198
    SolutionNameMin: Cijk_Alik_Bjlk_SB_MT064x128x32_GRVW04_GSU01_SNLL0_TT04_08_VW04_WG16_16_01
    SolutionIndex: 199
    SolutionNameMin: Cijk_Alik_Bjlk_SB_MT064x128x32_GRVW04_GSU01_SNLL1_TT04_08_VW04_WG16_16_01
    SolutionIndex: 200
    SolutionNameMin: Cijk_Alik_Bjlk_SB_MT128x064x32_GRVW04_GSU01_SNLL0_TT08_04_VW04_WG16_16_01
    SolutionIndex: 201
    SolutionNameMin: Cijk_Alik_Bjlk_SB_MT128x128x32_GRVW04_GSU01_SNLL0_TT08_08_VW04_WG16_16_01
    SolutionIndex: 202
    SolutionNameMin: Cijk_Alik_Bjlk_SB_MT016x016x04_GRVW02_GSU01_SNLL0_TT02_02_VW02_WG08_08_01
    SolutionIndex: 203
    SolutionNameMin: Cijk_Alik_Bjlk_SB_MT032x032x02_GRVW04_GSU01_SNLL0_TT04_04_VW04_WG08_08_01
    SolutionIndex: 204
    SolutionNameMin: Cijk_Alik_Bjlk_SB_MT008x008x08_GRVW02_GSU02_SNLL0_TT02_02_VW02_WG04_04_04
    SolutionIndex: 205
    SolutionNameMin: Cijk_Alik_Bjlk_SB_MT016x016x16_GRVW02_GSU02_SNLL0_TT02_02_VW02_WG08_08_04
    SolutionIndex: 206
    SolutionNameMin: Cijk_Alik_Bjlk_SB_MT008x008x08_GRVW02_GSU04_SNLL0_TT02_02_VW02_WG04_04_04
    SolutionIndex: 207
    SolutionNameMin: Cijk_Alik_Bjlk_SB_MT016x016x16_GRVW02_GSU04_SNLL0_TT02_02_VW02_WG08_08_04
    SolutionIndex: 208
    SolutionNameMin: Cijk_Alik_Bjlk_SB_MT016x016x04_GRVW02_GSU08_SNLL0_TT02_02_VW02_WG08_08_01
    SolutionIndex: 209
    SolutionNameMin: Cijk_Alik_Bjlk_SB_MT032x032x02_GRVW04_GSU08_SNLL0_TT04_04_VW04_WG08_08_01
    SolutionIndex: 210
    SolutionNameMin: Cijk_Alik_Bjlk_SB_MT008x008x08_GRVW02_GSU08_SNLL0_TT02_02_VW02_WG04_04_04
    SolutionIndex: 211
    SolutionNameMin: Cijk_Alik_Bjlk_SB_MT016x016x16_GRVW02_GSU08_SNLL0_TT02_02_VW02_WG08_08_04
    SolutionIndex: 212
    SolutionNameMin: Cijk_Alik_Bjlk_SB_MT008x008x08_GRVW02_GSU16_SNLL0_TT02_02_VW02_WG04_04_04
    SolutionIndex: 213
    SolutionNameMin: Cijk_Alik_Bjlk_SB_MT016x016x16_GRVW02_GSU16_SNLL0_TT02_02_VW02_WG08_08_04
- - - [1024, 128, 1, 128]
    - [2, 1043.36]
  - - [4, 704, 1, 1280]
    - [100, 346.585]
  - - [4, 1856, 1, 3328]
    - [105, 538.046]
  - - [1856, 448, 1, 3328]
    - [61, 6358.42]
  - - [2944, 4288, 1, 1280]
    - [78, 7985.99]
  - - [2368, 64, 1, 3328]
    - [36, 4823.69]
  - - [2368, 5888, 1, 256]
    - [76, 8506.55]
  - - [128, 64, 1, 256]
    - [50, 374.491]
  - - [5888, 1024, 1, 1280]
    - [61, 9104.27]
  - - [128, 6784, 1, 3328]
    - [66, 6960.19]
  - - [64, 4, 1, 256]
    - [100, 13.0032]
  - - [5888, 1856, 1, 3328]
    - [68, 8795.77]
  - - [5056, 704, 1, 256]
    - [64, 6094.25]
  - - [5888, 2944, 1, 3328]
    - [84, 8521.78]
  - - [1856, 4288, 1, 256]
    - [61, 8366.37]
  - - [1024, 5056, 1, 128]
    - [60, 1637.43]
  - - [5056, 5056, 1, 3328]
    - [62, 9389.15]
  - - [1408, 5888, 1, 1280]
    - [84, 8690.6]
  - - [2368, 448, 1, 128]
    - [4, 1605.85]
  - - [1024, 3584, 1, 3328]
    - [82, 8214.82]
  - - [4, 2944, 1, 1280]
    - [98, 542.986]
  - - [1408, 64, 1, 128]
    - [7, 629.604]
  - - [256, 4288, 1, 3328]
    - [74, 7029.77]
  - - [5888, 1408, 1, 1280]
    - [83, 8728.34]
  - - [704, 1856, 1, 3328]
    - [89, 7087.69]
  - - [4, 1408, 1, 128]
    - [95, 53.6381]
  - - [1024, 2368, 1, 256]
    - [74, 7034.87]
  - - [1408, 1856, 1, 1280]
    - [61, 7616.01]
  - - [1408, 64, 1, 1280]
    - [22, 3577.65]
  - - [448, 1024, 1, 1280]
    - [74, 6612.64]
  - - [256, 1408, 1, 3328]
    - [74, 5448.62]
  - - [5056, 5056, 1, 1280]
    - [69, 8197.56]
  - - [448, 5056, 1, 256]
    - [74, 7030.34]
  - - [704, 1856, 1, 1280]
    - [64, 8169.57]
  - - [128, 5056, 1, 128]
    - [12, 2408.07]
  - - [2368, 128, 1, 256]
    - [73, 3159.39]
  - - [1856, 1408, 1, 128]
    - [59, 2523.35]
  - - [64, 5056, 1, 256]
    - [64, 3878.16]
  - - [6784, 256, 1, 3328]
    - [63, 7442.75]
  - - [6784, 4288, 1, 3328]
    - [75, 8541.19]
  - - [4288, 448, 1, 256]
    - [74, 7181.35]
  - - [64, 704, 1, 128]
    - [0, 456.263]
  - - [1856, 2368, 1, 3328]
    - [79, 8224.93]
  - - [4288, 2944, 1, 1280]
    - [77, 8290.5]
  - - [704, 5056, 1, 1280]
    - [80, 7539.14]
  - - [2368, 704, 1, 3328]
    - [74, 7522.51]
  - - [256, 5888, 1, 256]
    - [74, 7264.23]
  - - [1856, 4288, 1, 3328]
    - [82, 9065.56]
  - - [256, 2944, 1, 256]
    - [74, 6553.6]
  - - [5888, 1024, 1, 256]
    - [82, 8447.35]
  - - [448, 64, 1, 1280]
    - [43, 2479.74]
  - - [448, 5056, 1, 3328]
    - [73, 7728.0]
  - - [3584, 4, 1, 1280]
    - [100, 567.762]
  - - [2944, 64, 1, 256]
    - [74, 2656.08]
  - - [128, 4, 1, 1280]
    - [104, 93.0909]
  - - [1408, 2944, 1, 256]
    - [88, 7224.67]
  - - [256, 1856, 1, 1280]
    - [64, 6709.78]
  - - [6784, 5056, 1, 3328]
    - [65, 8864.66]
  - - [5056, 5056, 1, 256]
    - [73, 8504.2]
  - - [1408, 6784, 1, 128]
    - [13, 3214.76]
  - - [64, 1024, 1, 1280]
    - [21, 3472.11]
  - - [2944, 4, 1, 256]
    - [98, 342.575]
  - - [704, 5056, 1, 128]
    - [60, 2369.98]
  - - [4, 2368, 1, 1280]
    - [98, 515.483]
  - - [2368, 2944, 1, 1280]
    - [61, 9025.9]
  - - [128, 3584, 1, 1280]
    - [64, 6642.56]
  - - [6784, 6784, 1, 1280]
    - [94, 8751.72]
  - - [1024, 256, 1, 3328]
    - [64, 6119.64]
  - - [1408, 4288, 1, 1280]
    - [65, 8623.45]
  - - [3584, 4288, 1, 1280]
    - [69, 8685.95]
  - - [2368, 704, 1, 1280]
    - [74, 7647.11]
  - - [5056, 4288, 1, 3328]
    - [75, 8887.29]
  - - [3584, 2368, 1, 3328]
    - [72, 8548.75]
  - - [64, 704, 1, 1280]
    - [35, 2805.04]
  - - [4288, 256, 1, 256]
    - [64, 6261.55]
  - - [2944, 128, 1, 128]
    - [15, 2071.93]
  - - [6784, 448, 1, 1280]
    - [74, 8275.63]
  - - [1408, 2944, 1, 128]
    - [4, 3069.05]
  - - [4288, 2944, 1, 256]
    - [91, 7416.25]
  - - [5888, 704, 1, 1280]
    - [63, 7635.54]
  - - [1856, 64, 1, 1280]
    - [27, 4195.46]
  - - [448, 5888, 1, 128]
    - [13, 2671.21]
  - - [5888, 64, 1, 3328]
    - [45, 5899.95]
  - - [2944, 256, 1, 3328]
    - [64, 7686.29]
  - - [1024, 64, 1, 128]
    - [15, 468.114]
  - - [5056, 2368, 1, 1280]
    - [74, 8691.93]
  - - [448, 3584, 1, 1280]
    - [74, 7375.84]
  - - [6784, 5888, 1, 256]
    - [72, 8927.93]
  - - [64, 1024, 1, 3328]
    - [36, 4605.23]
  - - [704, 128, 1, 1280]
    - [22, 3650.11]
  - - [5888, 2944, 1, 128]
    - [4, 2788.54]
  - - [4, 3584, 1, 128]
    - [95, 12.2792]
  - - [1408, 448, 1, 1280]
    - [64, 6399.84]
  - - [1024, 1408, 1, 256]
    - [74, 6628.87]
  - - [2368, 2368, 1, 3328]
    - [76, 8818.22]
  - - [1856, 6784, 1, 128]
    - [4, 3397.83]
  - - [5056, 704, 1, 3328]
    - [62, 8062.71]
  - - [1408, 1856, 1, 256]
    - [64, 7964.18]
  - - [1408, 704, 1, 3328]
    - [74, 7872.32]
  - - [2368, 5056, 1, 256]
    - [65, 8580.58]
  - - [5888, 1856, 1, 256]
    - [82, 7622.05]
  - - [4288, 64, 1, 3328]
    - [45, 5186.9]
  - - [2368, 4, 1, 1280]
    - [104, 484.192]
  - - [704, 5888, 1, 256]
    - [91, 7135.28]
  - - [4288, 64, 1, 256]
    - [64, 3136.37]
  - - [6784, 64, 1, 256]
    - [74, 4677.99]
  - - [2944, 256, 1, 256]
    - [64, 4804.23]
  - - [2944, 6784, 1, 3328]
    - [65, 8824.9]
  - - [704, 1408, 1, 3328]
    - [66, 7098.5]
  - - [3584, 704, 1, 3328]
    - [74, 8286.93]
  - - [2944, 256, 1, 128]
    - [4, 1957.57]
  - - [6784, 4, 1, 1280]
    - [100, 627.422]
  - - [1024, 64, 1, 1280]
    - [47, 2962.08]
  - - [448, 4288, 1, 256]
    - [90, 6014.95]
  - - [64, 3584, 1, 3328]
    - [40, 5846.84]
  - - [704, 2368, 1, 1280]
    - [82, 6956.99]
  - - [448, 2944, 1, 128]
    - [59, 1854.36]
  - - [1856, 2368, 1, 1280]
    - [79, 7885.17]
  - - [2368, 128, 1, 3328]
    - [45, 5744.46]
  - - [2944, 128, 1, 256]
    - [74, 4433.32]
  - - [448, 1408, 1, 256]
    - [74, 5560.63]
  - - [1856, 4288, 1, 1280]
    - [72, 8917.73]
  - - [64, 5056, 1, 3328]
    - [28, 6115.9]
  - - [4, 704, 1, 256]
    - [98, 126.918]
  - - [1024, 448, 1, 128]
    - [59, 1159.56]
  - - [704, 4, 1, 1280]
    - [104, 243.546]
  - - [704, 256, 1, 128]
    - [4, 590.898]
  - - [704, 2944, 1, 128]
    - [59, 2127.07]
  - - [1408, 1024, 1, 1280]
    - [76, 7780.31]
  - - [704, 6784, 1, 256]
    - [88, 6862.57]
  - - [6784, 704, 1, 256]
    - [74, 7947.48]
  - - [5056, 1408, 1, 128]
    - [13, 2273.03]
  - - [256, 3584, 1, 3328]
    - [64, 7254.92]
  - - [4, 5888, 1, 3328]
    - [18, 645.005]
  - - [128, 1408, 1, 128]
    - [3, 1206.52]
  - - [3584, 4288, 1, 3328]
    - [72, 8967.56]
  - - [5888, 1856, 1, 1280]
    - [78, 8789.95]
  - - [5056, 1024, 1, 3328]
    - [72, 9302.74]
  - - [5056, 64, 1, 1280]
    - [45, 4602.08]
  - - [1024, 704, 1, 256]
    - [64, 5339.97]
  - - [1024, 4288, 1, 128]
    - [60, 1693.29]
  - - [4288, 64, 1, 1280]
    - [27, 4480.52]
  - - [2368, 3584, 1, 1280]
    - [73, 7649.73]
  - - [2368, 6784, 1, 1280]
    - [74, 8140.1]
  - - [1024, 256, 1, 256]
    - [89, 2974.68]
  - - [1856, 4, 1, 1280]
    - [104, 451.65]
  - - [448, 448, 1, 256]
    - [64, 3243.7]
  - - [2944, 3584, 1, 3328]
    - [68, 8664.8]
  - - [128, 4288, 1, 128]
    - [6, 2473.75]
  - - [64, 448, 1, 256]
    - [26, 1042.62]
  - - [128, 1024, 1, 3328]
    - [48, 5721.51]
  - - [4, 1408, 1, 3328]
    - [105, 544.863]
  - - [6784, 2944, 1, 256]
    - [75, 8968.65]
  - - [64, 1856, 1, 1280]
    - [27, 4270.89]
  - - [64, 1024, 1, 128]
    - [5, 599.186]
  - - [4288, 2368, 1, 3328]
    - [68, 8315.87]
  - - [1856, 2368, 1, 256]
    - [74, 8110.74]
  - - [3584, 256, 1, 128]
    - [13, 1770.82]
  - - [3584, 6784, 1, 3328]
    - [62, 9583.52]
  - - [256, 1024, 1, 256]
    - [64, 4072.14]
  - - [4, 6784, 1, 3328]
    - [18, 694.682]
  - - [1024, 5888, 1, 3328]
    - [72, 8905.34]
  - - [1024, 128, 1, 1280]
    - [48, 3912.6]
  - - [4288, 128, 1, 1280]
    - [27, 5468.11]
  - - [5056, 4288, 1, 1280]
    - [62, 9196.95]
  - - [5888, 64, 1, 256]
    - [74, 3285.73]
  - - [1408, 5056, 1, 1280]
    - [77, 7905.43]
  - - [1856, 256, 1, 1280]
    - [74, 6599.11]
  - - [64, 5888, 1, 3328]
    - [45, 5978.72]
  - - [2944, 5888, 1, 128]
    - [4, 2116.19]
  - - [704, 5888, 1, 1280]
    - [76, 8806.58]
  - - [2368, 3584, 1, 128]
    - [59, 2966.15]
  - - [6784, 5888, 1, 3328]
    - [61, 9311.71]
  - - [704, 1024, 1, 1280]
    - [74, 7236.1]
  - - [448, 256, 1, 3328]
    - [27, 5384.9]
  - - [448, 1856, 1, 128]
    - [59, 1982.68]
  - - [128, 1024, 1, 128]
    - [7, 1013.12]
  - - [2944, 4, 1, 128]
    - [96, 46.6376]
  - - [1024, 704, 1, 1280]
    - [74, 7204.43]
  - - [128, 5888, 1, 256]
    - [64, 6500.61]
  - - [1024, 5056, 1, 1280]
    - [94, 8211.47]
  - - [4288, 1024, 1, 256]
    - [61, 7344.96]
  - - [2944, 2368, 1, 128]
    - [13, 2176.86]
  - - [704, 704, 1, 3328]
    - [74, 7451.26]
  - - [704, 1408, 1, 1280]
    - [66, 7755.36]
  - - [5888, 448, 1, 1280]
    - [64, 7824.45]
  - - [3584, 256, 1, 3328]
    - [66, 7342.85]
  - - [704, 5888, 1, 3328]
    - [66, 8489.88]
  - - [704, 1856, 1, 128]
    - [4, 2017.95]
  - - [128, 3584, 1, 3328]
    - [64, 6902.0]
  - - [4, 4288, 1, 128]
    - [95, 112.935]
  - - [128, 704, 1, 1280]
    - [27, 3696.9]
  - - [3584, 2944, 1, 256]
    - [82, 8330.64]
  - - [1856, 128, 1, 3328]
    - [23, 6184.5]
  - - [4, 64, 1, 1280]
    - [104, 47.0805]
  - - [4, 5056, 1, 3328]
    - [102, 603.962]
  - - [128, 2944, 1, 1280]
    - [74, 5476.21]
  - - [2368, 1024, 1, 3328]
    - [73, 7408.95]
  - - [128, 256, 1, 3328]
    - [57, 3635.06]
  - - [1408, 5056, 1, 3328]
    - [76, 8847.5]
  - - [1856, 1856, 1, 3328]
    - [66, 8436.9]
  - - [3584, 128, 1, 256]
    - [74, 5027.42]
  - - [448, 1408, 1, 3328]
    - [74, 6563.43]
  - - [2368, 2368, 1, 256]
    - [78, 7363.05]
  - - [4288, 4288, 1, 1280]
    - [74, 8637.42]
  - - [64, 448, 1, 1280]
    - [46, 2401.84]
  - - [1408, 4288, 1, 256]
    - [75, 8306.09]
  - - [448, 4, 1, 256]
    - [103, 79.6444]
  - - [5888, 448, 1, 128]
    - [59, 2389.87]
  - - [448, 4, 1, 1280]
    - [106, 236.959]
  - - [704, 6784, 1, 3328]
    - [62, 8768.58]
  - - [5888, 5888, 1, 1280]
    - [75, 9109.2]
  - - [5056, 1024, 1, 1280]
    - [75, 8244.98]
  - - [448, 5888, 1, 3328]
    - [64, 7280.61]
  - - [128, 4, 1, 128]
    - [95, 4.35745]
  - - [1024, 2944, 1, 1280]
    - [72, 8387.14]
  - - [5056, 5888, 1, 1280]
    - [82, 9178.61]
  - - [4288, 5888, 1, 128]
    - [4, 2751.98]
  - - [256, 3584, 1, 256]
    - [74, 6220.37]
  - - [1408, 3584, 1, 128]
    - [4, 2410.87]
  - - [256, 2944, 1, 3328]
    - [86, 6936.37]
  - - [448, 3584, 1, 128]
    - [59, 2155.21]
  - - [5888, 2944, 1, 1280]
    - [65, 9067.8]
  - - [4, 6784, 1, 1280]
    - [18, 666.937]
  - - [2368, 5888, 1, 128]
    - [59, 2230.84]
  - - [64, 2944, 1, 128]
    - [1, 1463.43]
  - - [3584, 5888, 1, 256]
    - [68, 8539.22]
  - - [2368, 704, 1, 128]
    - [4, 2472.01]
  - - [3584, 2944, 1, 1280]
    - [74, 8547.87]
  - - [3584, 2368, 1, 128]
    - [4, 2764.46]
  - - [5056, 704, 1, 128]
    - [4, 2206.53]
  - - [448, 2368, 1, 128]
    - [59, 1615.02]
  - - [5056, 1408, 1, 3328]
    - [61, 8714.72]
  - - [1408, 704, 1, 256]
    - [64, 6850.85]
  - - [6784, 1024, 1, 3328]
    - [75, 8621.84]
  - - [6784, 2944, 1, 3328]
    - [61, 9107.76]
  - - [2944, 5056, 1, 3328]
    - [61, 8692.0]
  - - [1856, 1856, 1, 256]
    - [94, 5987.59]
  - - [1024, 5888, 1, 128]
    - [13, 2720.49]
  - - [6784, 2368, 1, 1280]
    - [75, 8561.16]
  - - [256, 4, 1, 128]
    - [95, 7.41357]
  - - [4288, 5888, 1, 1280]
    - [78, 8693.36]
  - - [4288, 4288, 1, 256]
    - [78, 8575.73]
  - - [448, 2944, 1, 3328]
    - [79, 7047.74]
  - - [4288, 1856, 1, 1280]
    - [65, 8711.52]
  - - [1856, 2944, 1, 3328]
    - [74, 8657.25]
  - - [256, 6784, 1, 3328]
    - [74, 8032.78]
  - - [64, 5888, 1, 256]
    - [63, 3840.33]
  - - [256, 5056, 1, 128]
    - [13, 1606.62]
  - - [5056, 1024, 1, 256]
    - [62, 8435.56]
  - - [704, 64, 1, 3328]
    - [33, 3682.38]
  - - [5056, 1856, 1, 3328]
    - [62, 8804.63]
  - - [4, 2944, 1, 3328]
    - [19, 621.677]
  - - [4, 5056, 1, 256]
    - [17, 440.25]
  - - [1856, 1408, 1, 256]
    - [64, 7911.44]
  - - [3584, 4, 1, 128]
    - [95, 132.587]
  - - [448, 448, 1, 3328]
    - [41, 5237.95]
  - - [6784, 128, 1, 3328]
    - [82, 6726.89]
  - - [4288, 1408, 1, 128]
    - [4, 3303.69]
  - - [4288, 5056, 1, 256]
    - [82, 8529.17]
  - - [1408, 128, 1, 1280]
    - [23, 4491.56]
  - - [5056, 256, 1, 3328]
    - [63, 7024.7]
  - - [704, 704, 1, 256]
    - [64, 5431.41]
  - - [1024, 5888, 1, 1280]
    - [76, 8494.22]
  - - [6784, 2368, 1, 128]
    - [4, 2434.93]
  - - [4, 5056, 1, 1280]
    - [17, 616.35]
  - - [64, 128, 1, 256]
    - [31, 391.26]
  - - [128, 1856, 1, 1280]
    - [27, 5171.55]
  - - [5056, 3584, 1, 256]
    - [65, 8977.57]
  - - [1856, 1024, 1, 1280]
    - [72, 7987.56]
  - - [6784, 4288, 1, 1280]
    - [61, 9420.25]
  - - [1856, 1856, 1, 1280]
    - [76, 8313.07]
  - - [6784, 2944, 1, 128]
    - [4, 2657.18]
  - - [128, 4288, 1, 3328]
    - [49, 6146.08]
  - - [4, 2368, 1, 3328]
    - [18, 606.208]
  - - [5888, 1856, 1, 128]
    - [13, 3276.18]
  - - [448, 704, 1, 1280]
    - [64, 4633.86]
  - - [2368, 1024, 1, 128]
    - [59, 2306.62]
  - - [1024, 448, 1, 3328]
    - [76, 6246.82]
  - - [1856, 704, 1, 1280]
    - [64, 8160.01]
  - - [5056, 3584, 1, 128]
    - [13, 2186.34]
  - - [5888, 5888, 1, 3328]
    - [72, 9369.8]
  - - [6784, 1024, 1, 256]
    - [65, 8297.78]
  - - [2944, 2368, 1, 256]
    - [82, 8317.82]
  - - [256, 448, 1, 256]
    - [29, 2073.46]
  - - [5056, 5888, 1, 3328]
    - [62, 8500.13]
  - - [1856, 1024, 1, 256]
    - [74, 7163.42]
  - - [448, 1408, 1, 1280]
    - [64, 6399.84]
  - - [3584, 448, 1, 1280]
    - [74, 7350.52]
  - - [1024, 1024, 1, 1280]
    - [76, 8101.02]
  - - [448, 5888, 1, 256]
    - [89, 5084.96]
  - - [704, 64, 1, 128]
    - [16, 393.932]
  - - [1408, 6784, 1, 3328]
    - [76, 8790.11]
  - - [448, 1024, 1, 128]
    - [60, 1174.41]
  - - [4288, 704, 1, 128]
    - [4, 2433.25]
  - - [128, 1856, 1, 128]
    - [5, 1496.49]
  - - [448, 2368, 1, 3328]
    - [64, 6799.98]
  - - [5056, 64, 1, 128]
    - [8, 2046.38]
  - - [5056, 2944, 1, 256]
    - [94, 7774.03]
  - - [6784, 5888, 1, 128]
    - [13, 2412.45]
  - - [704, 1024, 1, 256]
    - [64, 5991.86]
  - - [1024, 4, 1, 256]
    - [99, 184.608]
  - - [2368, 1856, 1, 256]
    - [89, 6649.64]
  - - [128, 6784, 1, 1280]
    - [76, 6281.03]
  - - [1408, 3584, 1, 3328]
    - [76, 8712.73]
  - - [2368, 6784, 1, 256]
    - [89, 7555.31]
  - - [5056, 1408, 1, 1280]
    - [78, 8547.94]
  - - [256, 256, 1, 128]
    - [11, 499.322]
  - - [5056, 4288, 1, 128]
    - [13, 2713.83]
  - - [1408, 1856, 1, 128]
    - [13, 1710.8]
  - - [1408, 5888, 1, 3328]
    - [76, 8960.38]
  - - [1856, 256, 1, 256]
    - [64, 5652.18]
  - - [6784, 6784, 1, 256]
    - [66, 8783.98]
  - - [64, 256, 1, 128]
    - [7, 140.938]
  - - [4288, 2368, 1, 128]
    - [13, 2065.13]
  - - [1856, 4288, 1, 128]
    - [4, 3359.8]
  - - [256, 4288, 1, 1280]
    - [64, 6352.12]
  - - [2368, 2944, 1, 256]
    - [89, 7311.84]
  - - [4, 1856, 1, 256]
    - [99, 312.589]
  - - [3584, 1856, 1, 1280]
    - [62, 8640.92]
  - - [6784, 6784, 1, 128]
    - [60, 3070.86]
  - - [256, 1856, 1, 128]
    - [4, 1193.43]
  - - [704, 64, 1, 1280]
    - [21, 2660.13]
  - - [5888, 5056, 1, 256]
    - [75, 8991.31]
  - - [3584, 448, 1, 256]
    - [64, 4281.69]
  - - [448, 4288, 1, 128]
    - [59, 2020.8]
  - - [2944, 4288, 1, 3328]
    - [78, 8165.31]
  - - [256, 6784, 1, 256]
    - [74, 7312.44]
  - - [1408, 4288, 1, 128]
    - [4, 2029.41]
  - - [2944, 704, 1, 3328]
    - [77, 7359.08]
  - - [128, 448, 1, 256]
    - [29, 1456.28]
  - - [3584, 3584, 1, 256]
    - [82, 7938.22]
  - - [448, 1408, 1, 128]
    - [4, 1510.86]
  - - [128, 256, 1, 1280]
    - [43, 2744.96]
  - - [3584, 5056, 1, 256]
    - [82, 8763.21]
  - - [6784, 128, 1, 256]
    - [64, 5874.69]
  - - [4288, 4, 1, 256]
    - [98, 392.046]
  - - [64, 1408, 1, 3328]
    - [33, 4751.15]
  - - [704, 448, 1, 256]
    - [73, 3255.66]
  - - [2944, 2368, 1, 1280]
    - [80, 8145.32]
  - - [448, 64, 1, 3328]
    - [51, 3369.37]
  - - [1408, 3584, 1, 256]
    - [62, 8371.21]
  - - [3584, 4, 1, 3328]
    - [98, 635.797]
  - - [6784, 3584, 1, 256]
    - [82, 8340.03]
  - - [256, 128, 1, 128]
    - [5, 267.494]
  - - [704, 1408, 1, 128]
    - [59, 1616.69]
  - - [4, 2368, 1, 256]
    - [99, 360.838]
  - - [2944, 448, 1, 128]
    - [60, 900.281]
  - - [128, 1408, 1, 256]
    - [64, 2883.58]
  - - [4, 2944, 1, 256]
    - [97, 358.888]
  - - [64, 128, 1, 3328]
    - [38, 1958.55]
  - - [5056, 2368, 1, 128]
    - [4, 3469.06]
  - - [2944, 2944, 1, 3328]
    - [61, 8417.23]
  - - [5056, 6784, 1, 256]
    - [72, 8902.54]
  - - [1856, 3584, 1, 128]
    - [4, 2046.73]
  - - [128, 2944, 1, 128]
    - [3, 2392.58]
  - - [1024, 704, 1, 3328]
    - [74, 7419.39]
  - - [6784, 448, 1, 256]
    - [89, 5391.1]
  - - [3584, 6784, 1, 128]
    - [60, 1924.32]
  - - [128, 4288, 1, 256]
    - [74, 4838.47]
  - - [704, 448, 1, 3328]
    - [64, 4777.97]
  - - [1024, 1024, 1, 3328]
    - [82, 8086.9]
  - - [128, 128, 1, 3328]
    - [39, 2515.03]
  - - [5056, 1856, 1, 256]
    - [74, 8430.25]
  - - [256, 128, 1, 256]
    - [42, 1127.5]
  - - [1024, 1856, 1, 256]
    - [74, 6632.21]
  - - [4288, 64, 1, 128]
    - [1, 1799.55]
  - - [256, 448, 1, 3328]
    - [27, 5372.77]
  - - [1408, 6784, 1, 1280]
    - [82, 8698.33]
  - - [3584, 3584, 1, 1280]
    - [75, 8071.66]
  - - [64, 2368, 1, 1280]
    - [27, 4400.78]
  - - [448, 2368, 1, 1280]
    - [64, 6664.24]
  - - [5888, 5888, 1, 128]
    - [13, 2352.1]
  - - [64, 6784, 1, 3328]
    - [74, 6532.27]
  - - [2944, 256, 1, 1280]
    - [90, 5890.88]
  - - [5056, 5888, 1, 128]
    - [60, 3126.45]
  - - [256, 2368, 1, 128]
    - [59, 1454.17]
  - - [5056, 2368, 1, 3328]
    - [82, 9057.6]
  - - [2944, 4288, 1, 256]
    - [61, 8433.46]
  - - [1408, 3584, 1, 1280]
    - [76, 8638.09]
  - - [2368, 64, 1, 256]
    - [74, 2342.83]
  - - [64, 448, 1, 3328]
    - [57, 3467.31]
  - - [256, 256, 1, 3328]
    - [45, 4369.07]
  - - [5888, 4, 1, 128]
    - [95, 153.809]
  - - [1856, 704, 1, 256]
    - [73, 6899.66]
  - - [4, 4288, 1, 1280]
    - [17, 580.194]
  - - [1408, 448, 1, 3328]
    - [90, 5836.43]
  - - [1024, 4, 1, 3328]
    - [104, 492.467]
  - - [2368, 256, 1, 256]
    - [64, 5314.7]
  - - [2368, 6784, 1, 3328]
    - [61, 9141.4]
  - - [1856, 1408, 1, 1280]
    - [65, 7304.66]
  - - [1856, 448, 1, 1280]
    - [64, 6496.0]
  - - [6784, 704, 1, 128]
    - [13, 3003.73]
  - - [4, 4, 1, 256]
    - [100, 0.752941]
  - - [128, 5888, 1, 128]
    - [6, 2926.85]
  - - [1408, 5888, 1, 256]
    - [93, 6736.65]
  - - [704, 2944, 1, 1280]
    - [64, 8331.95]
  - - [1856, 2368, 1, 128]
    - [13, 2898.6]
  - - [256, 64, 1, 256]
    - [42, 738.434]
  - - [1024, 1024, 1, 256]
    - [76, 6056.76]
  - - [704, 1856, 1, 256]
    - [63, 7039.05]
  - - [64, 6784, 1, 256]
    - [86, 4510.92]
  - - [3584, 704, 1, 1280]
    - [74, 8190.32]
  - - [256, 128, 1, 1280]
    - [46, 2716.52]
  - - [2368, 4, 1, 256]
    - [99, 240.559]
  - - [256, 2368, 1, 1280]
    - [64, 6046.96]
  - - [2944, 6784, 1, 128]
    - [59, 3102.15]
  - - [3584, 448, 1, 3328]
    - [62, 6883.87]
  - - [1408, 4, 1, 256]
    - [99, 217.137]
  - - [704, 2368, 1, 3328]
    - [64, 7744.28]
  - - [2944, 448, 1, 256]
    - [63, 6179.33]
  - - [1856, 448, 1, 128]
    - [59, 2401.41]
  - - [2368, 128, 1, 1280]
    - [22, 4685.67]
  - - [256, 5888, 1, 128]
    - [13, 1825.68]
  - - [2368, 256, 1, 128]
    - [4, 1566.94]
  - - [64, 5056, 1, 1280]
    - [28, 5016.81]
  - - [4, 6784, 1, 128]
    - [95, 154.511]
  - - [2944, 2944, 1, 1280]
    - [72, 8734.26]
  - - [5888, 2368, 1, 256]
    - [61, 8600.0]
  - - [4, 3584, 1, 1280]
    - [101, 576.322]
  - - [1408, 128, 1, 128]
    - [6, 1264.73]
  - - [6784, 704, 1, 3328]
    - [83, 8015.11]
  - - [128, 64, 1, 1280]
    - [50, 1260.31]
  - - [2368, 256, 1, 1280]
    - [64, 6150.49]
  - - [4, 448, 1, 3328]
    - [106, 386.255]
  - - [5888, 4288, 1, 128]
    - [59, 2944.34]
  - - [4, 5888, 1, 256]
    - [98, 440.739]
  - - [1408, 2944, 1, 3328]
    - [61, 9420.27]
  - - [3584, 704, 1, 128]
    - [13, 2478.22]
  - - [64, 1024, 1, 256]
    - [44, 1664.41]
  - - [5056, 5056, 1, 128]
    - [13, 3596.63]
  - - [2368, 448, 1, 1280]
    - [74, 6693.13]
  - - [128, 3584, 1, 256]
    - [74, 5224.22]
  - - [704, 448, 1, 1280]
    - [86, 4194.74]
  - - [448, 5056, 1, 128]
    - [60, 2185.85]
  - - [256, 4, 1, 1280]
    - [104, 163.84]
  - - [128, 5056, 1, 256]
    - [64, 5720.82]
  - - [1408, 5056, 1, 128]
    - [13, 3170.97]
  - - [2944, 3584, 1, 128]
    - [4, 3177.5]
  - - [3584, 2368, 1, 256]
    - [75, 8237.21]
  - - [5888, 5056, 1, 1280]
    - [82, 9443.57]
  - - [2368, 5056, 1, 128]
    - [13, 3432.38]
  - - [64, 704, 1, 256]
    - [20, 1334.99]
  - - [4288, 256, 1, 1280]
    - [74, 5105.7]
  - - [3584, 3584, 1, 3328]
    - [82, 8660.79]
  - - [1024, 256, 1, 128]
    - [13, 500.514]
  - - [4, 704, 1, 128]
    - [95, 25.6]
  - - [5888, 6784, 1, 256]
    - [62, 9132.69]
  - - [4288, 2944, 1, 3328]
    - [69, 8644.05]
  - - [2944, 64, 1, 128]
    - [3, 1492.4]
  - - [1856, 64, 1, 256]
    - [44, 2054.64]
  - - [4288, 128, 1, 3328]
    - [34, 6077.38]
  - - [4288, 704, 1, 1280]
    - [74, 8052.67]
  - - [256, 5056, 1, 1280]
    - [74, 8108.6]
  - - [1408, 256, 1, 128]
    - [59, 1133.04]
  - - [2944, 5888, 1, 3328]
    - [71, 8537.01]
  - - [6784, 5888, 1, 1280]
    - [82, 9442.08]
  - - [704, 128, 1, 256]
    - [25, 1961.62]
  - - [5888, 4288, 1, 1280]
    - [72, 9269.67]
  - - [448, 256, 1, 1280]
    - [22, 4179.97]
  - - [5888, 3584, 1, 128]
    - [13, 3550.75]
  - - [1856, 1856, 1, 128]
    - [13, 2364.47]
  - - [5056, 4, 1, 1280]
    - [104, 561.778]
  - - [256, 1408, 1, 1280]
    - [74, 5238.12]
  - - [3584, 1024, 1, 3328]
    - [67, 7692.85]
  - - [704, 3584, 1, 128]
    - [4, 2254.05]
  - - [5888, 448, 1, 3328]
    - [61, 7830.82]
  - - [2368, 4288, 1, 1280]
    - [79, 8430.9]
  - - [4288, 2944, 1, 128]
    - [60, 2471.33]
  - - [1024, 6784, 1, 3328]
    - [72, 8664.24]
  - - [128, 2368, 1, 256]
    - [64, 3687.96]
  - - [6784, 64, 1, 3328]
    - [37, 5794.57]
  - - [5056, 2944, 1, 3328]
    - [68, 8918.08]
  - - [448, 128, 1, 256]
    - [20, 1609.66]
  - - [2944, 3584, 1, 256]
    - [65, 8648.59]
  - - [1408, 1408, 1, 3328]
    - [79, 8123.56]
  - - [1856, 128, 1, 1280]
    - [28, 5206.97]
  - - [3584, 3584, 1, 128]
    - [4, 2303.27]
  - - [64, 3584, 1, 256]
    - [64, 3545.91]
  - - [1408, 4, 1, 3328]
    - [104, 555.192]
  - - [128, 2944, 1, 3328]
    - [49, 6116.34]
  - - [3584, 704, 1, 256]
    - [69, 4650.94]
  - - [2944, 448, 1, 3328]
    - [76, 7180.56]
  - - [3584, 1408, 1, 3328]
    - [84, 8275.82]
  - - [704, 3584, 1, 1280]
    - [76, 8435.03]
  - - [2944, 6784, 1, 1280]
    - [62, 8772.66]
  - - [1856, 6784, 1, 256]
    - [82, 8084.16]
  - - [4288, 448, 1, 3328]
    - [89, 6628.6]
  - - [6784, 4288, 1, 128]
    - [60, 3005.91]
  - - [6784, 704, 1, 1280]
    - [82, 8388.94]
  - - [256, 4288, 1, 256]
    - [73, 5497.18]
  - - [3584, 64, 1, 128]
    - [7, 1714.96]
  - - [5888, 1024, 1, 3328]
    - [82, 8712.92]
  - - [448, 64, 1, 128]
    - [16, 223.781]
  - - [704, 6784, 1, 1280]
    - [62, 8526.54]
  - - [5888, 128, 1, 256]
    - [64, 5825.42]
  - - [2368, 448, 1, 3328]
    - [86, 5570.8]
  - - [1856, 5056, 1, 3328]
    - [63, 7885.01]
  - - [4, 6784, 1, 256]
    - [17, 479.736]
  - - [1024, 3584, 1, 128]
    - [60, 2213.35]
  - - [1024, 1408, 1, 128]
    - [13, 1809.31]
  - - [2368, 2944, 1, 128]
    - [4, 3256.7]
  - - [5056, 64, 1, 256]
    - [24, 2768.63]
  - - [4, 448, 1, 1280]
    - [100, 267.963]
  - - [5056, 2944, 1, 128]
    - [13, 3423.28]
  - - [5888, 5056, 1, 3328]
    - [62, 9090.84]
  - - [1024, 704, 1, 128]
    - [13, 1604.22]
  - - [1408, 2368, 1, 128]
    - [4, 2087.1]
  - - [5888, 2368, 1, 128]
    - [59, 2447.17]
  - - [128, 5056, 1, 3328]
    - [64, 6722.13]
  - - [3584, 6784, 1, 1280]
    - [61, 9451.66]
  - - [1856, 5888, 1, 256]
    - [65, 8873.37]
  - - [256, 256, 1, 256]
    - [44, 1625.7]
  - - [256, 64, 1, 128]
    - [6, 140.938]
  - - [4288, 4288, 1, 3328]
    - [65, 8908.63]
  - - [4288, 1408, 1, 1280]
    - [61, 7906.36]
  - - [3584, 5056, 1, 128]
    - [60, 3022.95]
  - - [4, 1024, 1, 3328]
    - [19, 595.782]
  - - [4288, 2368, 1, 256]
    - [65, 8539.47]
  - - [2944, 5056, 1, 1280]
    - [62, 9194.2]
  - - [448, 6784, 1, 256]
    - [74, 7849.51]
  - - [704, 1024, 1, 128]
    - [59, 2112.52]
  - - [6784, 2368, 1, 3328]
    - [61, 9474.21]
  - - [256, 1024, 1, 1280]
    - [64, 5349.88]
  - - [704, 4, 1, 128]
    - [95, 20.6679]
  - - [256, 4, 1, 256]
    - [100, 50.4123]
  - - [4288, 128, 1, 256]
    - [74, 4457.78]
  - - [4288, 1856, 1, 3328]
    - [72, 8506.75]
  - - [3584, 448, 1, 128]
    - [13, 1539.25]
  - - [256, 4, 1, 3328]
    - [104, 269.61]
  - - [4, 1408, 1, 1280]
    - [19, 474.274]
  - - [3584, 64, 1, 1280]
    - [22, 4514.16]
  - - [1408, 448, 1, 128]
    - [59, 1767.52]
  - - [3584, 1024, 1, 1280]
    - [73, 8228.72]
  - - [1856, 5056, 1, 256]
    - [74, 8420.79]
  - - [4, 3584, 1, 256]
    - [17, 388.773]
  - - [1024, 4288, 1, 256]
    - [73, 7306.77]
  - - [5888, 3584, 1, 3328]
    - [72, 8644.58]
  - - [4, 256, 1, 256]
    - [100, 48.9075]
  - - [5056, 3584, 1, 3328]
    - [76, 8771.77]
  - - [128, 5888, 1, 1280]
    - [74, 7612.77]
  - - [704, 448, 1, 128]
    - [4, 1042.62]
  - - [2368, 1408, 1, 1280]
    - [63, 7543.3]
  - - [5056, 2944, 1, 1280]
    - [61, 9198.82]
  - - [4, 4, 1, 128]
    - [96, 0.000922816]
  - - [3584, 256, 1, 256]
    - [74, 6286.97]
  - - [128, 1856, 1, 3328]
    - [27, 6081.74]
  - - [1024, 6784, 1, 256]
    - [94, 7203.42]
  - - [4, 128, 1, 256]
    - [19, 22.4438]
  - - [64, 64, 1, 1280]
    - [50, 736.36]
  - - [6784, 4, 1, 128]
    - [95, 140.054]
  - - [2944, 1408, 1, 128]
    - [4, 3089.07]
  - - [448, 128, 1, 3328]
    - [33, 4259.84]
  - - [64, 2944, 1, 3328]
    - [22, 5578.72]
  - - [64, 4288, 1, 3328]
    - [27, 5640.5]
  - - [5056, 6784, 1, 3328]
    - [82, 8688.9]
  - - [128, 2944, 1, 256]
    - [74, 4482.76]
  - - [128, 6784, 1, 128]
    - [7, 2703.04]
  - - [3584, 4288, 1, 256]
    - [82, 8764.59]
  - - [448, 1856, 1, 256]
    - [64, 5759.22]
  - - [1856, 6784, 1, 3328]
    - [65, 9034.58]
  - - [3584, 128, 1, 3328]
    - [74, 6887.06]
  - - [64, 1856, 1, 256]
    - [25, 2197.16]
  - - [1024, 448, 1, 1280]
    - [74, 6582.99]
  - - [5888, 4288, 1, 256]
    - [75, 9008.99]
  - - [4, 448, 1, 128]
    - [95, 13.9184]
  - - [5056, 1408, 1, 256]
    - [72, 8525.55]
  - - [64, 256, 1, 1280]
    - [42, 1885.93]
  - - [3584, 1024, 1, 256]
    - [61, 5785.25]
  - - [256, 704, 1, 256]
    - [74, 2772.68]
  - - [5888, 5888, 1, 256]
    - [75, 8649.55]
  - - [4288, 1024, 1, 1280]
    - [75, 8318.08]
  - - [5888, 128, 1, 3328]
    - [67, 6625.61]
  - - [448, 6784, 1, 3328]
    - [66, 8641.37]
  - - [2944, 1408, 1, 1280]
    - [61, 9243.52]
  - - [2944, 1856, 1, 3328]
    - [75, 7841.33]
  - - [2368, 64, 1, 128]
    - [7, 1177.1]
  - - [2944, 2944, 1, 128]
    - [13, 3093.33]
  - - [4, 128, 1, 3328]
    - [106, 185.21]
  - - [3584, 5888, 1, 1280]
    - [62, 9409.75]
  - - [64, 4, 1, 128]
    - [95, 1.87032]
  - - [6784, 1856, 1, 1280]
    - [82, 8759.39]
  - - [2944, 5056, 1, 256]
    - [68, 8657.13]
  - - [5888, 256, 1, 3328]
    - [74, 7791.34]
  - - [1856, 5888, 1, 3328]
    - [72, 9096.55]
  - - [3584, 1408, 1, 256]
    - [72, 8155.57]
  - - [704, 3584, 1, 3328]
    - [72, 7399.0]
  - - [5056, 448, 1, 1280]
    - [73, 7600.96]
  - - [3584, 1856, 1, 3328]
    - [67, 8312.61]
  - - [64, 1408, 1, 128]
    - [7, 775.157]
  - - [1408, 704, 1, 1280]
    - [79, 7559.44]
  - - [2944, 1024, 1, 256]
    - [76, 7748.51]
  - - [1024, 2368, 1, 128]
    - [13, 2123.55]
  - - [2368, 4288, 1, 3328]
    - [74, 8709.74]
  - - [4, 1408, 1, 256]
    - [98, 231.056]
  - - [1024, 1408, 1, 1280]
    - [80, 7157.5]
  - - [64, 64, 1, 256]
    - [52, 184.608]
  - - [704, 256, 1, 3328]
    - [64, 4284.18]
  - - [6784, 5056, 1, 256]
    - [65, 8995.94]
  - - [4, 4288, 1, 3328]
    - [19, 651.616]
  - - [448, 6784, 1, 128]
    - [4, 2541.95]
  - - [4, 704, 1, 3328]
    - [105, 532.48]
  - - [448, 2944, 1, 256]
    - [64, 6414.16]
  - - [2944, 6784, 1, 256]
    - [75, 8983.78]
  - - [2368, 2368, 1, 1280]
    - [62, 8480.82]
  - - [4, 4, 1, 1280]
    - [104, 3.01176]
  - - [1856, 3584, 1, 1280]
    - [65, 8170.6]
  - - [64, 2944, 1, 256]
    - [74, 2941.13]
  - - [3584, 1408, 1, 1280]
    - [81, 8086.96]
  - - [448, 256, 1, 128]
    - [12, 903.945]
  - - [4288, 448, 1, 128]
    - [4, 1606.71]
  - - [5056, 256, 1, 1280]
    - [73, 7346.34]
  - - [1856, 1408, 1, 3328]
    - [64, 7978.2]
  - - [128, 128, 1, 128]
    - [6, 134.433]
  - - [1024, 4288, 1, 3328]
    - [69, 8036.15]
  - - [448, 2368, 1, 256]
    - [64, 5914.22]
  - - [1024, 4, 1, 128]
    - [96, 15.4202]
  - - [5056, 448, 1, 256]
    - [64, 5921.8]
  - - [2944, 2368, 1, 3328]
    - [70, 8479.8]
  - - [704, 128, 1, 3328]
    - [36, 4622.27]
  - - [64, 64, 1, 3328]
    - [58, 1331.2]
  - - [1024, 1856, 1, 1280]
    - [72, 7853.47]
  - - [6784, 1856, 1, 256]
    - [88, 7552.29]
  - - [128, 2368, 1, 3328]
    - [49, 5821.37]
  - - [1024, 5888, 1, 256]
    - [62, 7862.18]
  - - [5056, 128, 1, 1280]
    - [90, 5746.2]
  - - [5056, 64, 1, 3328]
    - [54, 5329.0]
  - - [128, 704, 1, 128]
    - [0, 735.608]
  - - [1408, 2368, 1, 256]
    - [94, 5852.58]
  - - [1408, 1408, 1, 256]
    - [82, 5182.91]
  - - [4, 64, 1, 128]
    - [95, 1.52836]
  - - [64, 128, 1, 1280]
    - [55, 1260.31]
  - - [2368, 2368, 1, 128]
    - [4, 3032.06]
  - - [64, 5888, 1, 128]
    - [8, 2003.09]
  - - [5888, 4, 1, 3328]
    - [100, 649.28]
  - - [6784, 1408, 1, 128]
    - [4, 3254.47]
  - - [4288, 5888, 1, 256]
    - [75, 9022.07]
  - - [1408, 5056, 1, 256]
    - [82, 8424.65]
  - - [5056, 128, 1, 3328]
    - [64, 6723.81]
  - - [128, 128, 1, 1280]
    - [31, 1846.08]
  - - [448, 704, 1, 256]
    - [64, 3881.75]
  - - [4288, 3584, 1, 128]
    - [13, 3580.76]
  - - [2944, 128, 1, 3328]
    - [27, 6419.4]
  - - [128, 5056, 1, 1280]
    - [64, 6578.58]
  - - [3584, 5056, 1, 1280]
    - [62, 9263.85]
  - - [256, 448, 1, 1280]
    - [49, 3895.98]
  - - [704, 704, 1, 128]
    - [13, 1557.93]
  - - [5056, 4, 1, 128]
    - [95, 43.7276]
  - - [704, 256, 1, 1280]
    - [64, 4010.55]
  - - [64, 2368, 1, 3328]
    - [27, 5525.47]
  - - [1856, 1024, 1, 128]
    - [13, 2712.64]
  - - [1856, 64, 1, 128]
    - [7, 1032.9]
  - - [64, 6784, 1, 1280]
    - [90, 5722.25]
  - - [704, 4288, 1, 256]
    - [75, 7097.73]
  - - [5888, 2368, 1, 1280]
    - [77, 8227.94]
  - - [128, 256, 1, 256]
    - [20, 1165.08]
  - - [256, 64, 1, 1280]
    - [32, 1833.17]
  - - [2368, 5888, 1, 1280]
    - [72, 7994.13]
  - - [5888, 256, 1, 1280]
    - [64, 8012.36]
  - - [4, 5888, 1, 1280]
    - [17, 634.397]
  - - [704, 128, 1, 128]
    - [2, 750.933]
  - - [1024, 4, 1, 1280]
    - [104, 385.506]
  - - [2368, 1856, 1, 3328]
    - [79, 8202.79]
  - - [2368, 128, 1, 128]
    - [3, 2046.27]
  - - [2944, 704, 1, 256]
    - [69, 7393.81]
  - - [5056, 128, 1, 128]
    - [6, 2941.67]
  - - [256, 704, 1, 3328]
    - [64, 4294.0]
  - - [704, 3584, 1, 256]
    - [89, 5256.51]
  - - [1024, 1024, 1, 1024]
    - [75, 6268.93]
  - - [704, 2944, 1, 3328]
    - [77, 7353.43]
  - - [6784, 1024, 1, 128]
    - [13, 3163.93]
  - - [256, 448, 1, 128]
    - [5, 1013.82]
  - - [448, 1024, 1, 3328]
    - [64, 6823.04]
  - - [2944, 1024, 1, 3328]
    - [64, 8261.49]
  - - [2944, 5056, 1, 128]
    - [13, 3397.39]
  - - [1408, 6784, 1, 256]
    - [76, 8270.01]
  - - [6784, 1408, 1, 3328]
    - [78, 8349.94]
  - - [4288, 6784, 1, 128]
    - [13, 2446.31]
  - - [704, 64, 1, 256]
    - [20, 1386.34]
  - - [5888, 4, 1, 1280]
    - [19, 527.038]
  - - [256, 2368, 1, 3328]
    - [64, 6123.9]
  - - [6784, 2944, 1, 1280]
    - [75, 9201.59]
  - - [4288, 1856, 1, 128]
    - [60, 1942.58]
  - - [1856, 2944, 1, 128]
    - [4, 2156.51]
  - - [6784, 448, 1, 128]
    - [4, 2368.61]
  - - [64, 3584, 1, 128]
    - [1, 1548.53]
  - - [448, 5056, 1, 1280]
    - [64, 8151.45]
  - - [2368, 1856, 1, 128]
    - [59, 2626.82]
  - - [128, 448, 1, 1280]
    - [47, 3324.29]
  - - [4288, 704, 1, 256]
    - [74, 4913.52]
  - - [256, 3584, 1, 128]
    - [60, 1708.97]
  - - [5888, 704, 1, 256]
    - [64, 8053.7]
  - - [3584, 1024, 1, 128]
    - [4, 2651.03]
  - - [256, 5888, 1, 3328]
    - [76, 8287.7]
  - - [1408, 4288, 1, 3328]
    - [72, 8890.61]
  - - [6784, 4288, 1, 256]
    - [65, 8883.21]
  - - [4288, 256, 1, 128]
    - [4, 765.966]
  - - [5888, 256, 1, 256]
    - [64, 7319.35]
  - - [6784, 1024, 1, 1280]
    - [64, 7718.67]
  - - [5888, 1024, 1, 128]
    - [4, 3081.09]
  - - [1024, 128, 1, 256]
    - [64, 2107.69]
  - - [128, 64, 1, 3328]
    - [50, 2016.49]
  - - [448, 64, 1, 256]
    - [20, 1042.62]
  - - [2944, 704, 1, 1280]
    - [74, 8329.86]
  - - [6784, 3584, 1, 1280]
    - [82, 9123.38]
  - - [1024, 6784, 1, 1280]
    - [62, 8929.05]
  - - [2944, 64, 1, 1280]
    - [27, 4567.66]
  - - [1408, 2944, 1, 1280]
    - [72, 9115.22]
  - - [256, 1856, 1, 256]
    - [74, 5528.86]
  - - [1408, 2368, 1, 3328]
    - [64, 8446.51]
  - - [2944, 4, 1, 3328]
    - [100, 584.584]
  - - [128, 1408, 1, 3328]
    - [22, 5436.78]
  - - [2944, 1856, 1, 128]
    - [59, 2765.73]
  - - [256, 2944, 1, 128]
    - [59, 1730.08]
  - - [256, 6784, 1, 128]
    - [4, 970.224]
  - - [2368, 4, 1, 128]
    - [95, 88.6269]
  - - [1408, 256, 1, 3328]
    - [64, 5456.55]
  - - [1856, 4, 1, 128]
    - [96, 27.3696]
  - - [5056, 6784, 1, 128]
    - [4, 2555.16]
  - - [4288, 5056, 1, 128]
    - [59, 3179.19]
  - - [1856, 5888, 1, 128]
    - [4, 3372.87]
  - - [2944, 5888, 1, 256]
    - [65, 8902.19]
  - - [3584, 1856, 1, 256]
    - [74, 8140.0]
  - - [4288, 3584, 1, 1280]
    - [65, 8735.63]
  - - [2368, 448, 1, 256]
    - [74, 5997.82]
  - - [4288, 256, 1, 3328]
    - [64, 7036.27]
  - - [1856, 704, 1, 128]
    - [4, 1972.26]
  - - [1408, 64, 1, 256]
    - [24, 1813.57]
  - - [64, 1856, 1, 128]
    - [7, 1144.91]
  - - [4, 256, 1, 128]
    - [95, 9.20449]
  - - [704, 4288, 1, 3328]
    - [92, 6980.54]
  - - [704, 5888, 1, 128]
    - [59, 2106.81]
  - - [6784, 3584, 1, 128]
    - [13, 2532.85]
  - - [1024, 64, 1, 256]
    - [25, 1436.41]
  - - [64, 2368, 1, 256]
    - [25, 2145.87]
  - - [4288, 5056, 1, 3328]
    - [82, 9093.48]
  - - [4, 1856, 1, 1280]
    - [18, 501.198]
  - - [4288, 128, 1, 128]
    - [8, 2212.05]
  - - [1408, 1408, 1, 128]
    - [4, 2683.54]
  - - [1024, 128, 1, 3328]
    - [48, 5776.05]
  - - [1856, 128, 1, 128]
    - [3, 1624.4]
  - - [5056, 2368, 1, 256]
    - [82, 8493.07]
  - - [4288, 704, 1, 3328]
    - [68, 8008.41]
  - - [448, 3584, 1, 256]
    - [89, 5885.48]
  - - [64, 128, 1, 128]
    - [5, 68.6241]
  - - [2368, 64, 1, 1280]
    - [27, 4457.41]
  - - [2368, 1024, 1, 1280]
    - [65, 7764.11]
  - - [2944, 1408, 1, 3328]
    - [82, 9272.85]
  - - [1408, 448, 1, 256]
    - [74, 5530.16]
  - - [1024, 1408, 1, 3328]
    - [66, 7839.3]
  - - [2944, 5888, 1, 1280]
    - [65, 8676.34]
  - - [1408, 4, 1, 1280]
    - [104, 446.099]
  - - [5888, 3584, 1, 256]
    - [75, 8998.96]
  - - [128, 1024, 1, 1280]
    - [22, 4315.13]
  - - [1408, 1856, 1, 3328]
    - [69, 8651.19]
  - - [4, 4, 1, 3328]
    - [105, 5.15969]
  - - [6784, 1408, 1, 1280]
    - [75, 8662.34]
  - - [4, 1024, 1, 1280]
    - [100, 448.877]
  - - [704, 2944, 1, 256]
    - [73, 7377.36]
  - - [704, 4288, 1, 128]
    - [13, 2463.02]
  - - [2368, 4288, 1, 128]
    - [59, 3046.95]
  - - [64, 4288, 1, 1280]
    - [27, 4741.81]
  - - [6784, 64, 1, 1280]
    - [74, 6045.97]
  - - [3584, 128, 1, 128]
    - [6, 2513.71]
  - - [1024, 6784, 1, 128]
    - [60, 2449.29]
  - - [4, 1856, 1, 128]
    - [95, 9.72046]
  - - [1408, 64, 1, 3328]
    - [33, 4554.87]
  - - [6784, 4, 1, 256]
    - [98, 443.037]
  - - [1408, 1408, 1, 1280]
    - [76, 8170.88]
  - - [256, 2368, 1, 256]
    - [64, 5343.98]
  - - [448, 4288, 1, 3328]
    - [87, 7061.45]
  - - [2368, 1408, 1, 256]
    - [85, 6553.6]
  - - [5888, 5056, 1, 128]
    - [13, 3627.96]
  - - [704, 2368, 1, 256]
    - [89, 5562.7]
  - - [2944, 448, 1, 1280]
    - [64, 7022.48]
  - - [5888, 2368, 1, 3328]
    - [74, 8663.2]
  - - [64, 2944, 1, 1280]
    - [27, 4546.99]
  - - [448, 1856, 1, 1280]
    - [64, 6477.02]
  - - [4288, 448, 1, 1280]
    - [63, 7164.65]
  - - [5888, 704, 1, 3328]
    - [74, 8553.47]
  - - [5056, 256, 1, 128]
    - [59, 922.878]
  - - [1856, 256, 1, 128]
    - [59, 1520.44]
  - - [5056, 128, 1, 256]
    - [64, 5507.81]
  - - [704, 4, 1, 256]
    - [100, 132.518]
  - - [1408, 5888, 1, 128]
    - [4, 3278.41]
  - - [4288, 4, 1, 128]
    - [96, 15.1536]
  - - [1408, 1024, 1, 256]
    - [89, 5447.15]
  - - [1024, 1856, 1, 128]
    - [13, 2144.48]
  - - [256, 704, 1, 128]
    - [59, 454.108]
  - - [256, 1024, 1, 128]
    - [13, 798.915]
  - - [448, 1024, 1, 256]
    - [74, 5397.08]
  - - [128, 4, 1, 3328]
    - [106, 180.502]
  - - [5056, 6784, 1, 1280]
    - [72, 8996.09]
  - - [704, 5056, 1, 3328]
    - [75, 8207.97]
  - - [64, 1408, 1, 1280]
    - [45, 3322.1]
  - - [3584, 5056, 1, 3328]
    - [61, 9408.28]
  - - [1856, 4, 1, 3328]
    - [104, 502.176]
  - - [4, 2944, 1, 128]
    - [95, 63.6541]
  - - [2368, 2944, 1, 3328]
    - [66, 8686.55]
  - - [448, 448, 1, 1280]
    - [27, 4687.98]
  - - [2368, 3584, 1, 256]
    - [75, 8269.81]
  - - [1024, 256, 1, 1280]
    - [86, 5349.88]
  - - [5056, 3584, 1, 1280]
    - [78, 8984.8]
  - - [448, 4, 1, 3328]
    - [106, 380.343]
  - - [1856, 2944, 1, 1280]
    - [68, 8261.66]
  - - [3584, 2368, 1, 1280]
    - [76, 7865.06]
  - - [128, 1024, 1, 256]
    - [30, 2195.97]
  - - [2944, 1408, 1, 256]
    - [94, 7260.25]
  - - [4288, 1408, 1, 3328]
    - [66, 8756.09]
  - - [3584, 64, 1, 3328]
    - [23, 5734.38]
  - - [1408, 128, 1, 256]
    - [64, 2912.71]
  - - [2944, 1024, 1, 128]
    - [59, 2313.4]
  - - [4288, 5056, 1, 1280]
    - [82, 8994.25]
  - - [5888, 6784, 1, 1280]
    - [82, 9122.26]
  - - [6784, 5056, 1, 128]
    - [60, 2288.28]
  - - [256, 1024, 1, 3328]
    - [74, 5232.82]
  - - [3584, 4, 1, 256]
    - [100, 344.926]
  - - [1856, 64, 1, 3328]
    - [22, 5490.46]
  - - [64, 6784, 1, 128]
    - [1, 2157.4]
  - - [5888, 1408, 1, 3328]
    - [61, 9229.92]
  - - [5888, 64, 1, 1280]
    - [27, 4913.86]
  - - [256, 5056, 1, 256]
    - [63, 6512.38]
  - - [128, 3584, 1, 128]
    - [12, 2171.61]
  - - [448, 3584, 1, 3328]
    - [64, 7439.76]
  - - [704, 2368, 1, 128]
    - [13, 2345.92]
  - - [5888, 256, 1, 128]
    - [60, 1746.36]
  - - [4, 5056, 1, 128]
    - [95, 165.094]
  - - [448, 256, 1, 256]
    - [21, 1983.79]
  - - [704, 4, 1, 3328]
    - [106, 427.539]
  - - [1408, 256, 1, 256]
    - [64, 4385.68]
  - - [3584, 1856, 1, 128]
    - [13, 2045.95]
  - - [4288, 4288, 1, 128]
    - [4, 2100.91]
  - - [1856, 1024, 1, 3328]
    - [82, 8175.21]
  - - [128, 5888, 1, 3328]
    - [64, 7802.98]
  - - [1024, 5056, 1, 256]
    - [74, 7889.26]
  - - [2368, 1408, 1, 3328]
    - [64, 8181.45]
  - - [5888, 448, 1, 256]
    - [74, 7196.11]
  - - [5888, 6784, 1, 128]
    - [4, 3414.03]
  - - [2368, 4, 1, 3328]
    - [104, 551.098]
  - - [6784, 5056, 1, 1280]
    - [72, 9284.34]
  - - [5056, 704, 1, 1280]
    - [74, 8257.31]
  - - [1408, 256, 1, 1280]
    - [64, 5276.46]
  - - [4288, 6784, 1, 1280]
    - [82, 9021.12]
  - - [128, 704, 1, 256]
    - [25, 1935.29]
  - - [1024, 1024, 1, 128]
    - [60, 2460.0]
  - - [448, 128, 1, 1280]
    - [47, 3142.14]
  - - [6784, 4, 1, 3328]
    - [100, 667.568]
  - - [4288, 4, 1, 1280]
    - [100, 595.297]
  - - [1024, 64, 1, 3328]
    - [30, 4105.87]
  - - [1856, 4, 1, 256]
    - [98, 263.964]
  - - [64, 3584, 1, 1280]
    - [28, 5090.17]
  - - [6784, 1408, 1, 256]
    - [75, 8540.36]
  - - [3584, 5888, 1, 128]
    - [13, 2261.64]
  - - [5056, 5888, 1, 256]
    - [72, 8911.41]
  - - [2368, 1024, 1, 256]
    - [65, 7446.7]
  - - [2944, 1856, 1, 256]
    - [64, 8255.43]
  - - [1856, 6784, 1, 1280]
    - [75, 8593.13]
  - - [64, 5056, 1, 128]
    - [1, 2113.2]
  - - [5888, 64, 1, 128]
    - [1, 2216.66]
  - - [448, 704, 1, 128]
    - [60, 745.387]
  - - [4, 1024, 1, 128]
    - [95, 38.3251]
  - - [4288, 3584, 1, 256]
    - [72, 8509.8]
  - - [1408, 704, 1, 128]
    - [4, 1509.01]
  - - [64, 256, 1, 3328]
    - [53, 2478.45]
  - - [5056, 1856, 1, 1280]
    - [75, 8690.32]
  - - [1408, 1024, 1, 3328]
    - [77, 7492.62]
  - - [2368, 256, 1, 3328]
    - [67, 5373.57]
  - - [5888, 3584, 1, 1280]
    - [75, 9254.49]
  - - [1856, 3584, 1, 3328]
    - [66, 8472.19]
  - - [5888, 128, 1, 1280]
    - [74, 7565.01]
  - - [1024, 2944, 1, 256]
    - [74, 7489.83]
  - - [448, 6784, 1, 1280]
    - [66, 8525.18]
  - - [256, 3584, 1, 1280]
    - [66, 7129.71]
  - - [448, 128, 1, 128]
    - [2, 447.563]
  - - [704, 5056, 1, 256]
    - [64, 6213.94]
  - - [2944, 1856, 1, 1280]
    - [75, 7678.28]
  - - [128, 256, 1, 128]
    - [7, 283.399]
  - - [5056, 256, 1, 256]
    - [74, 4581.72]
  - - [2368, 3584, 1, 3328]
    - [82, 7614.36]
  - - [3584, 5888, 1, 3328]
    - [82, 9292.83]
  - - [128, 4, 1, 256]
    - [98, 26.8563]
  - - [2944, 3584, 1, 1280]
    - [69, 8495.82]
  - - [1856, 5888, 1, 1280]
    - [82, 8715.9]
  - - [256, 256, 1, 1280]
    - [25, 3530.56]
  - - [5056, 448, 1, 3328]
    - [74, 8244.59]
  - - [4288, 1408, 1, 256]
    - [72, 8284.72]
  - - [3584, 64, 1, 256]
    - [64, 3097.06]
  - - [64, 1856, 1, 3328]
    - [48, 5290.59]
  - - [256, 1408, 1, 128]
    - [59, 953.251]
  - - [5888, 1408, 1, 128]
    - [13, 3232.08]
  - - [4288, 2368, 1, 1280]
    - [64, 8612.35]
  - - [4, 4288, 1, 256]
    - [97, 422.203]
  - - [256, 4288, 1, 128]
    - [13, 1521.98]
  - - [256, 128, 1, 3328]
    - [35, 3587.23]
  - - [6784, 2368, 1, 256]
    - [82, 8048.59]
  - - [5888, 128, 1, 128]
    - [6, 2598.84]
  - - [4288, 1856, 1, 256]
    - [62, 7682.43]
  - - [1856, 256, 1, 3328]
    - [64, 7140.76]
  - - [1856, 2944, 1, 256]
    - [82, 7465.84]
  - - [5056, 1024, 1, 128]
    - [13, 2022.89]
  - - [64, 5888, 1, 1280]
    - [27, 5279.61]
  - - [6784, 256, 1, 128]
    - [60, 2073.68]
  - - [5888, 704, 1, 128]
    - [4, 2642.33]
  - - [6784, 64, 1, 128]
    - [1, 2226.54]
  - - [1024, 4288, 1, 1280]
    - [61, 7542.89]
  - - [2368, 5056, 1, 3328]
    - [82, 9109.96]
  - - [448, 4, 1, 128]
    - [95, 14.5543]
  - - [4, 256, 1, 3328]
    - [106, 304.274]
  - - [4288, 1024, 1, 3328]
    - [78, 7780.45]
  - - [1024, 5056, 1, 3328]
    - [75, 8811.76]
  - - [1024, 1856, 1, 3328]
    - [72, 8127.31]
  - - [704, 704, 1, 1280]
    - [86, 6521.26]
  - - [128, 2368, 1, 1280]
    - [23, 4938.56]
  - - [1408, 128, 1, 3328]
    - [49, 5305.93]
  - - [3584, 256, 1, 1280]
    - [66, 6518.68]
  - - [4, 128, 1, 128]
    - [95, 4.68114]
  - - [704, 6784, 1, 128]
    - [60, 2669.98]
  - - [3584, 128, 1, 1280]
    - [64, 4781.78]
  - - [4, 256, 1, 1280]
    - [104, 178.087]
  - - [128, 704, 1, 3328]
    - [36, 4571.54]
  - - [4288, 6784, 1, 256]
    - [62, 8744.69]
  - - [3584, 2944, 1, 3328]
    - [79, 8478.03]
  - - [128, 1856, 1, 256]
    - [64, 3654.89]
  - - [64, 4288, 1, 256]
    - [64, 3313.9]
  - - [4, 3584, 1, 3328]
    - [18, 673.112]
  - - [64, 4, 1, 3328]
    - [106, 98.6074]
  - - [4, 64, 1, 3328]
    - [104, 90.2508]
  - - [5888, 2944, 1, 256]
    - [61, 9038.55]
  - - [2368, 6784, 1, 128]
    - [60, 3068.3]
  - - [448, 4288, 1, 1280]
    - [76, 7895.28]
  - - [448, 1856, 1, 3328]
    - [76, 6675.0]
  - - [4, 1024, 1, 256]
    - [99, 184.608]
  - - [5056, 4288, 1, 256]
    - [65, 9004.06]
  - - [1024, 448, 1, 256]
    - [64, 5169.04]
  - - [1024, 3584, 1, 256]
    - [74, 7508.98]
  - - [2944, 128, 1, 1280]
    - [22, 4870.2]
  - - [1856, 5056, 1, 128]
    - [59, 2988.51]
  - - [64, 256, 1, 256]
    - [42, 748.983]
  - - [1408, 4, 1, 128]
    - [96, 4.40645]
  - - [128, 2368, 1, 128]
    - [16, 1809.58]
  - - [256, 704, 1, 1280]
    - [64, 4027.35]
  - - [64, 2368, 1, 128]
    - [7, 1282.98]
  - - [6784, 6784, 1, 3328]
    - [75, 8929.42]
  - - [448, 5888, 1, 1280]
    - [82, 7552.81]
  - - [5056, 448, 1, 128]
    - [4, 2365.63]
  - - [3584, 2944, 1, 128]
    - [13, 3247.17]
  - - [6784, 256, 1, 1280]
    - [91, 6344.12]
  - - [256, 2944, 1, 1280]
    - [63, 6560.73]
  - - [64, 4288, 1, 128]
    - [8, 1614.31]
  - - [2368, 5888, 1, 3328]
    - [61, 8589.31]
  - - [4, 64, 1, 256]
    - [99, 12.8]
  - - [704, 1024, 1, 3328]
    - [86, 6552.16]
  - - [2368, 1856, 1, 1280]
    - [66, 8315.99]
  - - [128, 448, 1, 128]
    - [5, 480.369]
  - - [128, 6784, 1, 256]
    - [64, 6027.61]
  - - [3584, 4288, 1, 128]
    - [4, 2571.0]
  - - [64, 448, 1, 128]
    - [10, 232.869]
  - - [5888, 4288, 1, 3328]
    - [84, 8665.52]
  - - [2368, 704, 1, 256]
    - [90, 5460.22]
  - - [256, 1856, 1, 3328]
    - [64, 7135.6]
  - - [1856, 128, 1, 256]
    - [90, 3167.57]
  - - [6784, 128, 1, 128]
    - [3, 3300.15]
  - - [3584, 1408, 1, 128]
    - [13, 1818.47]
  - - [1856, 5056, 1, 1280]
    - [68, 7795.17]
  - - [2944, 1024, 1, 1280]
    - [61, 8874.77]
  - - [5056, 4, 1, 256]
    - [98, 331.881]
  - - [2368, 4288, 1, 256]
    - [88, 7228.63]
  - - [1024, 2368, 1, 3328]
    - [74, 7319.17]
  - - [64, 704, 1, 3328]
    - [33, 3675.16]
  - - [704, 1408, 1, 256]
    - [64, 6171.09]
  - - [6784, 1856, 1, 3328]
    - [64, 8599.95]
  - - [1024, 2944, 1, 128]
    - [60, 2226.89]
  - - [1024, 3584, 1, 1280]
    - [76, 8639.13]
  - - [4288, 5888, 1, 3328]
    - [82, 9322.53]
  - - [4288, 4, 1, 3328]
    - [100, 629.209]
  - - [256, 1408, 1, 256]
    - [64, 4240.56]
  - - [448, 2944, 1, 1280]
    - [66, 7124.43]
  - - [4, 5888, 1, 128]
    - [95, 188.416]
  - - [1024, 2944, 1, 3328]
    - [61, 8136.6]
  - - [3584, 6784, 1, 256]
    - [78, 8777.55]
  - - [256, 6784, 1, 1280]
    - [74, 7831.8]
  - - [1856, 3584, 1, 256]
    - [89, 7277.28]
  - - [128, 448, 1, 3328]
    - [33, 4237.14]
  - - [6784, 1856, 1, 128]
    - [13, 3296.09]
  - - [4, 448, 1, 256]
    - [103, 83.1072]
  - - [2944, 704, 1, 128]
    - [59, 1635.97]
  - - [256, 5888, 1, 1280]
    - [79, 7308.24]
  - - [4, 128, 1, 1280]
    - [106, 86.2316]
  - - [4288, 6784, 1, 3328]
    - [75, 9146.61]
  - - [6784, 128, 1, 1280]
    - [66, 6715.12]
  - - [64, 1408, 1, 256]
    - [44, 1975.06]
  - - [2368, 1408, 1, 128]
    - [13, 2630.48]
  - - [1856, 448, 1, 256]
    - [66, 5010.85]
  - - [1408, 1024, 1, 128]
    - [13, 2027.12]
  - - [128, 64, 1, 128]
    - [14, 66.534]
  - - [6784, 3584, 1, 3328]
    - [72, 9065.81]
  - - [2944, 64, 1, 3328]
    - [22, 5594.65]
  - - [64, 64, 1, 128]
    - [9, 39.481]
  - - [2368, 5056, 1, 1280]
    - [69, 8470.17]
  - - [64, 4, 1, 1280]
    - [104, 43.5745]
  - - [1408, 2368, 1, 1280]
    - [64, 8403.62]
  - - [128, 1408, 1, 1280]
    - [22, 4362.46]
  - - [256, 64, 1, 3328]
    - [56, 2793.34]
  - - [2944, 4288, 1, 128]
    - [59, 2570.39]
  - - [2944, 2944, 1, 256]
    - [68, 8293.89]
  - - [2944, 4, 1, 1280]
    - [104, 521.928]
  - - [5888, 4, 1, 256]
    - [100, 388.487]
  - - [6784, 256, 1, 256]
    - [64, 7245.7]
  - - [256, 5056, 1, 3328]
    - [89, 6889.86]
  - - [128, 4288, 1, 1280]
    - [27, 5622.17]
  - - [5056, 1856, 1, 128]
    - [13, 2301.39]
  - - [5888, 1408, 1, 256]
    - [72, 8769.89]
  - - [128, 128, 1, 256]
    - [20, 708.497]
  - - [5056, 4, 1, 3328]
    - [100, 632.567]
  - - [4288, 3584, 1, 3328]
    - [62, 9678.24]
  - - [448, 704, 1, 3328]
    - [74, 4758.9]
  - - [448, 448, 1, 128]
    - [2, 1310.72]
  - - [1024, 2368, 1, 1280]
    - [91, 6984.2]
  - - [1856, 704, 1, 3328]
    - [73, 7165.23]
  - - [4, 2368, 1, 128]
    - [95, 8.44768]
  - - [5888, 6784, 1, 3328]
    - [68, 9056.58]
  - - [704, 4288, 1, 1280]
    - [66, 8467.73]
  - - [704, 256, 1, 256]
    - [74, 2827.04]
  - - [6784, 448, 1, 3328]
    - [64, 8354.71]
  - - [4288, 1024, 1, 128]
    - [4, 2912.7]
  - - [1024, 128, 1, 128]
    - [109, 1043.46]
  - - [4, 704, 1, 1280]
    - [207, 346.685]
  - - [4, 1856, 1, 3328]
    - [212, 538.146]
  - - [1856, 448, 1, 3328]
    - [168, 6358.52]
  - - [2944, 4288, 1, 1280]
    - [185, 7986.09]
  - - [2368, 64, 1, 3328]
    - [143, 4823.79]
  - - [2368, 5888, 1, 256]
    - [183, 8506.65]
  - - [128, 64, 1, 256]
    - [157, 374.591]
  - - [5888, 1024, 1, 1280]
    - [168, 9104.37]
  - - [128, 6784, 1, 3328]
    - [173, 6960.29]
  - - [64, 4, 1, 256]
    - [207, 13.1032]
  - - [5888, 1856, 1, 3328]
    - [175, 8795.87]
  - - [5056, 704, 1, 256]
    - [171, 6094.35]
  - - [5888, 2944, 1, 3328]
    - [191, 8521.88]
  - - [1856, 4288, 1, 256]
    - [168, 8366.47]
  - - [1024, 5056, 1, 128]
    - [167, 1637.53]
  - - [5056, 5056, 1, 3328]
    - [169, 9389.25]
  - - [1408, 5888, 1, 1280]
    - [191, 8690.7]
  - - [2368, 448, 1, 128]
    - [111, 1605.95]
  - - [1024, 3584, 1, 3328]
    - [189, 8214.92]
  - - [4, 2944, 1, 1280]
    - [205, 543.086]
  - - [1408, 64, 1, 128]
    - [114, 629.704]
  - - [256, 4288, 1, 3328]
    - [181, 7029.87]
  - - [5888, 1408, 1, 1280]
    - [190, 8728.44]
  - - [704, 1856, 1, 3328]
    - [196, 7087.79]
  - - [4, 1408, 1, 128]
    - [202, 53.7381]
  - - [1024, 2368, 1, 256]
    - [181, 7034.97]
  - - [1408, 1856, 1, 1280]
    - [168, 7616.11]
  - - [1408, 64, 1, 1280]
    - [129, 3577.75]
  - - [448, 1024, 1, 1280]
    - [181, 6612.74]
  - - [256, 1408, 1, 3328]
    - [181, 5448.72]
  - - [5056, 5056, 1, 1280]
    - [176, 8197.66]
  - - [448, 5056, 1, 256]
    - [181, 7030.44]
  - - [704, 1856, 1, 1280]
    - [171, 8169.67]
  - - [128, 5056, 1, 128]
    - [119, 2408.17]
  - - [2368, 128, 1, 256]
    - [180, 3159.49]
  - - [1856, 1408, 1, 128]
    - [166, 2523.45]
  - - [64, 5056, 1, 256]
    - [171, 3878.26]
  - - [6784, 256, 1, 3328]
    - [170, 7442.85]
  - - [6784, 4288, 1, 3328]
    - [182, 8541.29]
  - - [4288, 448, 1, 256]
    - [181, 7181.45]
  - - [64, 704, 1, 128]
    - [107, 456.363]
  - - [1856, 2368, 1, 3328]
    - [186, 8225.03]
  - - [4288, 2944, 1, 1280]
    - [184, 8290.6]
  - - [704, 5056, 1, 1280]
    - [187, 7539.24]
  - - [2368, 704, 1, 3328]
    - [181, 7522.61]
  - - [256, 5888, 1, 256]
    - [181, 7264.33]
  - - [1856, 4288, 1, 3328]
    - [189, 9065.66]
  - - [256, 2944, 1, 256]
    - [181, 6553.7]
  - - [5888, 1024, 1, 256]
    - [189, 8447.45]
  - - [448, 64, 1, 1280]
    - [150, 2479.84]
  - - [448, 5056, 1, 3328]
    - [180, 7728.1]
  - - [3584, 4, 1, 1280]
    - [207, 567.862]
  - - [2944, 64, 1, 256]
    - [181, 2656.18]
  - - [128, 4, 1, 1280]
    - [211, 93.1909]
  - - [1408, 2944, 1, 256]
    - [195, 7224.77]
  - - [256, 1856, 1, 1280]
    - [171, 6709.88]
  - - [6784, 5056, 1, 3328]
    - [172, 8864.76]
  - - [5056, 5056, 1, 256]
    - [180, 8504.3]
  - - [1408, 6784, 1, 128]
    - [120, 3214.86]
  - - [64, 1024, 1, 1280]
    - [128, 3472.21]
  - - [2944, 4, 1, 256]
    - [205, 342.675]
  - - [704, 5056, 1, 128]
    - [167, 2370.08]
  - - [4, 2368, 1, 1280]
    - [205, 515.583]
  - - [2368, 2944, 1, 1280]
    - [168, 9026.0]
  - - [128, 3584, 1, 1280]
    - [171, 6642.66]
  - - [6784, 6784, 1, 1280]
    - [201, 8751.82]
  - - [1024, 256, 1, 3328]
    - [171, 6119.74]
  - - [1408, 4288, 1, 1280]
    - [172, 8623.55]
  - - [3584, 4288, 1, 1280]
    - [176, 8686.05]
  - - [2368, 704, 1, 1280]
    - [181, 7647.21]
  - - [5056, 4288, 1, 3328]
    - [182, 8887.39]
  - - [3584, 2368, 1, 3328]
    - [179, 8548.85]
  - - [64, 704, 1, 1280]
    - [142, 2805.14]
  - - [4288, 256, 1, 256]
    - [171, 6261.65]
  - - [2944, 128, 1, 128]
    - [122, 2072.03]
  - - [6784, 448, 1, 1280]
    - [181, 8275.73]
  - - [1408, 2944, 1, 128]
    - [111, 3069.15]
  - - [4288, 2944, 1, 256]
    - [198, 7416.35]
  - - [5888, 704, 1, 1280]
    - [170, 7635.64]
  - - [1856, 64, 1, 1280]
    - [134, 4195.56]
  - - [448, 5888, 1, 128]
    - [120, 2671.31]
  - - [5888, 64, 1, 3328]
    - [152, 5900.05]
  - - [2944, 256, 1, 3328]
    - [171, 7686.39]
  - - [1024, 64, 1, 128]
    - [122, 468.214]
  - - [5056, 2368, 1, 1280]
    - [181, 8692.03]
  - - [448, 3584, 1, 1280]
    - [181, 7375.94]
  - - [6784, 5888, 1, 256]
    - [179, 8928.03]
  - - [64, 1024, 1, 3328]
    - [143, 4605.33]
  - - [704, 128, 1, 1280]
    - [129, 3650.21]
  - - [5888, 2944, 1, 128]
    - [111, 2788.64]
  - - [4, 3584, 1, 128]
    - [202, 12.3792]
  - - [1408, 448, 1, 1280]
    - [171, 6399.94]
  - - [1024, 1408, 1, 256]
    - [181, 6628.97]
  - - [2368, 2368, 1, 3328]
    - [183, 8818.32]
  - - [1856, 6784, 1, 128]
    - [111, 3397.93]
  - - [5056, 704, 1, 3328]
    - [169, 8062.81]
  - - [1408, 1856, 1, 256]
    - [171, 7964.28]
  - - [1408, 704, 1, 3328]
    - [181, 7872.42]
  - - [2368, 5056, 1, 256]
    - [172, 8580.68]
  - - [5888, 1856, 1, 256]
    - [189, 7622.15]
  - - [4288, 64, 1, 3328]
    - [152, 5187.0]
  - - [2368, 4, 1, 1280]
    - [211, 484.292]
  - - [704, 5888, 1, 256]
    - [198, 7135.38]
  - - [4288, 64, 1, 256]
    - [171, 3136.47]
  - - [6784, 64, 1, 256]
    - [181, 4678.09]
  - - [2944, 256, 1, 256]
    - [171, 4804.33]
  - - [2944, 6784, 1, 3328]
    - [172, 8825.0]
  - - [704, 1408, 1, 3328]
    - [173, 7098.6]
  - - [3584, 704, 1, 3328]
    - [181, 8287.03]
  - - [2944, 256, 1, 128]
    - [111, 1957.67]
  - - [6784, 4, 1, 1280]
    - [207, 627.522]
  - - [1024, 64, 1, 1280]
    - [154, 2962.18]
  - - [448, 4288, 1, 256]
    - [197, 6015.05]
  - - [64, 3584, 1, 3328]
    - [147, 5846.94]
  - - [704, 2368, 1, 1280]
    - [189, 6957.09]
  - - [448, 2944, 1, 128]
    - [166, 1854.46]
  - - [1856, 2368, 1, 1280]
    - [186, 7885.27]
  - - [2368, 128, 1, 3328]
    - [152, 5744.56]
  - - [2944, 128, 1, 256]
    - [181, 4433.42]
  - - [448, 1408, 1, 256]
    - [181, 5560.73]
  - - [1856, 4288, 1, 1280]
    - [179, 8917.83]
  - - [64, 5056, 1, 3328]
    - [135, 6116.0]
  - - [4, 704, 1, 256]
    - [205, 127.018]
  - - [1024, 448, 1, 128]
    - [166, 1159.66]
  - - [704, 4, 1, 1280]
    - [211, 243.646]
  - - [704, 256, 1, 128]
    - [111, 590.998]
  - - [704, 2944, 1, 128]
    - [166, 2127.17]
  - - [1408, 1024, 1, 1280]
    - [183, 7780.41]
  - - [704, 6784, 1, 256]
    - [195, 6862.67]
  - - [6784, 704, 1, 256]
    - [181, 7947.58]
  - - [5056, 1408, 1, 128]
    - [120, 2273.13]
  - - [256, 3584, 1, 3328]
    - [171, 7255.02]
  - - [4, 5888, 1, 3328]
    - [125, 645.105]
  - - [128, 1408, 1, 128]
    - [110, 1206.62]
  - - [3584, 4288, 1, 3328]
    - [179, 8967.66]
  - - [5888, 1856, 1, 1280]
    - [185, 8790.05]
  - - [5056, 1024, 1, 3328]
    - [179, 9302.84]
  - - [5056, 64, 1, 1280]
    - [152, 4602.18]
  - - [1024, 704, 1, 256]
    - [171, 5340.07]
  - - [1024, 4288, 1, 128]
    - [167, 1693.39]
  - - [4288, 64, 1, 1280]
    - [134, 4480.62]
  - - [2368, 3584, 1, 1280]
    - [180, 7649.83]
  - - [2368, 6784, 1, 1280]
    - [181, 8140.2]
  - - [1024, 256, 1, 256]
    - [196, 2974.78]
  - - [1856, 4, 1, 1280]
    - [211, 451.75]
  - - [448, 448, 1, 256]
    - [171, 3243.8]
  - - [2944, 3584, 1, 3328]
    - [175, 8664.9]
  - - [128, 4288, 1, 128]
    - [113, 2473.85]
  - - [64, 448, 1, 256]
    - [133, 1042.72]
  - - [128, 1024, 1, 3328]
    - [155, 5721.61]
  - - [4, 1408, 1, 3328]
    - [212, 544.963]
  - - [6784, 2944, 1, 256]
    - [182, 8968.75]
  - - [64, 1856, 1, 1280]
    - [134, 4270.99]
  - - [64, 1024, 1, 128]
    - [112, 599.286]
  - - [4288, 2368, 1, 3328]
    - [175, 8315.97]
  - - [1856, 2368, 1, 256]
    - [181, 8110.84]
  - - [3584, 256, 1, 128]
    - [120, 1770.92]
  - - [3584, 6784, 1, 3328]
    - [169, 9583.62]
  - - [256, 1024, 1, 256]
    - [171, 4072.24]
  - - [4, 6784, 1, 3328]
    - [125, 694.782]
  - - [1024, 5888, 1, 3328]
    - [179, 8905.44]
  - - [1024, 128, 1, 1280]
    - [155, 3912.7]
  - - [4288, 128, 1, 1280]
    - [134, 5468.21]
  - - [5056, 4288, 1, 1280]
    - [169, 9197.05]
  - - [5888, 64, 1, 256]
    - [181, 3285.83]
  - - [1408, 5056, 1, 1280]
    - [184, 7905.53]
  - - [1856, 256, 1, 1280]
    - [181, 6599.21]
  - - [64, 5888, 1, 3328]
    - [152, 5978.82]
  - - [2944, 5888, 1, 128]
    - [111, 2116.29]
  - - [704, 5888, 1, 1280]
    - [183, 8806.68]
  - - [2368, 3584, 1, 128]
    - [166, 2966.25]
  - - [6784, 5888, 1, 3328]
    - [168, 9311.81]
  - - [704, 1024, 1, 1280]
    - [181, 7236.2]
  - - [448, 256, 1, 3328]
    - [134, 5385.0]
  - - [448, 1856, 1, 128]
    - [166, 1982.78]
  - - [128, 1024, 1, 128]
    - [114, 1013.22]
  - - [2944, 4, 1, 128]
    - [203, 46.7376]
  - - [1024, 704, 1, 1280]
    - [181, 7204.53]
  - - [128, 5888, 1, 256]
    - [171, 6500.71]
  - - [1024, 5056, 1, 1280]
    - [201, 8211.57]
  - - [4288, 1024, 1, 256]
    - [168, 7345.06]
  - - [2944, 2368, 1, 128]
    - [120, 2176.96]
  - - [704, 704, 1, 3328]
    - [181, 7451.36]
  - - [704, 1408, 1, 1280]
    - [173, 7755.46]
  - - [5888, 448, 1, 1280]
    - [171, 7824.55]
  - - [3584, 256, 1, 3328]
    - [173, 7342.95]
  - - [704, 5888, 1, 3328]
    - [173, 8489.98]
  - - [704, 1856, 1, 128]
    - [111, 2018.05]
  - - [128, 3584, 1, 3328]
    - [171, 6902.1]
  - - [4, 4288, 1, 128]
    - [202, 113.035]
  - - [128, 704, 1, 1280]
    - [134, 3697.0]
  - - [3584, 2944, 1, 256]
    - [189, 8330.74]
  - - [1856, 128, 1, 3328]
    - [130, 6184.6]
  - - [4, 64, 1, 1280]
    - [211, 47.1805]
  - - [4, 5056, 1, 3328]
    - [209, 604.062]
  - - [128, 2944, 1, 1280]
    - [181, 5476.31]
  - - [2368, 1024, 1, 3328]
    - [180, 7409.05]
  - - [128, 256, 1, 3328]
    - [164, 3635.16]
  - - [1408, 5056, 1, 3328]
    - [183, 8847.6]
  - - [1856, 1856, 1, 3328]
    - [173, 8437.0]
  - - [3584, 128, 1, 256]
    - [181, 5027.52]
  - - [448, 1408, 1, 3328]
    - [181, 6563.53]
  - - [2368, 2368, 1, 256]
    - [185, 7363.15]
  - - [4288, 4288, 1, 1280]
    - [181, 8637.52]
  - - [64, 448, 1, 1280]
    - [153, 2401.94]
  - - [1408, 4288, 1, 256]
    - [182, 8306.19]
  - - [448, 4, 1, 256]
    - [210, 79.7444]
  - - [5888, 448, 1, 128]
    - [166, 2389.97]
  - - [448, 4, 1, 1280]
    - [213, 237.059]
  - - [704, 6784, 1, 3328]
    - [169, 8768.68]
  - - [5888, 5888, 1, 1280]
    - [182, 9109.3]
  - - [5056, 1024, 1, 1280]
    - [182, 8245.08]
  - - [448, 5888, 1, 3328]
    - [171, 7280.71]
  - - [128, 4, 1, 128]
    - [202, 4.45745]
  - - [1024, 2944, 1, 1280]
    - [179, 8387.24]
  - - [5056, 5888, 1, 1280]
    - [189, 9178.71]
  - - [4288, 5888, 1, 128]
    - [111, 2752.08]
  - - [256, 3584, 1, 256]
    - [181, 6220.47]
  - - [1408, 3584, 1, 128]
    - [111, 2410.97]
  - - [256, 2944, 1, 3328]
    - [193, 6936.47]
  - - [448, 3584, 1, 128]
    - [166, 2155.31]
  - - [5888, 2944, 1, 1280]
    - [172, 9067.9]
  - - [4, 6784, 1, 1280]
    - [125, 667.037]
  - - [2368, 5888, 1, 128]
    - [166, 2230.94]
  - - [64, 2944, 1, 128]
    - [108, 1463.53]
  - - [3584, 5888, 1, 256]
    - [175, 8539.32]
  - - [2368, 704, 1, 128]
    - [111, 2472.11]
  - - [3584, 2944, 1, 1280]
    - [181, 8547.97]
  - - [3584, 2368, 1, 128]
    - [111, 2764.56]
  - - [5056, 704, 1, 128]
    - [111, 2206.63]
  - - [448, 2368, 1, 128]
    - [166, 1615.12]
  - - [5056, 1408, 1, 3328]
    - [168, 8714.82]
  - - [1408, 704, 1, 256]
    - [171, 6850.95]
  - - [6784, 1024, 1, 3328]
    - [182, 8621.94]
  - - [6784, 2944, 1, 3328]
    - [168, 9107.86]
  - - [2944, 5056, 1, 3328]
    - [168, 8692.1]
  - - [1856, 1856, 1, 256]
    - [201, 5987.69]
  - - [1024, 5888, 1, 128]
    - [120, 2720.59]
  - - [6784, 2368, 1, 1280]
    - [182, 8561.26]
  - - [256, 4, 1, 128]
    - [202, 7.51357]
  - - [4288, 5888, 1, 1280]
    - [185, 8693.46]
  - - [4288, 4288, 1, 256]
    - [185, 8575.83]
  - - [448, 2944, 1, 3328]
    - [186, 7047.84]
  - - [4288, 1856, 1, 1280]
    - [172, 8711.62]
  - - [1856, 2944, 1, 3328]
    - [181, 8657.35]
  - - [256, 6784, 1, 3328]
    - [181, 8032.88]
  - - [64, 5888, 1, 256]
    - [170, 3840.43]
  - - [256, 5056, 1, 128]
    - [120, 1606.72]
  - - [5056, 1024, 1, 256]
    - [169, 8435.66]
  - - [704, 64, 1, 3328]
    - [140, 3682.48]
  - - [5056, 1856, 1, 3328]
    - [169, 8804.73]
  - - [4, 2944, 1, 3328]
    - [126, 621.777]
  - - [4, 5056, 1, 256]
    - [124, 440.35]
  - - [1856, 1408, 1, 256]
    - [171, 7911.54]
  - - [3584, 4, 1, 128]
    - [202, 132.687]
  - - [448, 448, 1, 3328]
    - [148, 5238.05]
  - - [6784, 128, 1, 3328]
    - [189, 6726.99]
  - - [4288, 1408, 1, 128]
    - [111, 3303.79]
  - - [4288, 5056, 1, 256]
    - [189, 8529.27]
  - - [1408, 128, 1, 1280]
    - [130, 4491.66]
  - - [5056, 256, 1, 3328]
    - [170, 7024.8]
  - - [704, 704, 1, 256]
    - [171, 5431.51]
  - - [1024, 5888, 1, 1280]
    - [183, 8494.32]
  - - [6784, 2368, 1, 128]
    - [111, 2435.03]
  - - [4, 5056, 1, 1280]
    - [124, 616.45]
  - - [64, 128, 1, 256]
    - [138, 391.36]
  - - [128, 1856, 1, 1280]
    - [134, 5171.65]
  - - [5056, 3584, 1, 256]
    - [172, 8977.67]
  - - [1856, 1024, 1, 1280]
    - [179, 7987.66]
  - - [6784, 4288, 1, 1280]
    - [168, 9420.35]
  - - [1856, 1856, 1, 1280]
    - [183, 8313.17]
  - - [6784, 2944, 1, 128]
    - [111, 2657.28]
  - - [128, 4288, 1, 3328]
    - [156, 6146.18]
  - - [4, 2368, 1, 3328]
    - [125, 606.308]
  - - [5888, 1856, 1, 128]
    - [120, 3276.28]
  - - [448, 704, 1, 1280]
    - [171, 4633.96]
  - - [2368, 1024, 1, 128]
    - [166, 2306.72]
  - - [1024, 448, 1, 3328]
    - [183, 6246.92]
  - - [1856, 704, 1, 1280]
    - [171, 8160.11]
  - - [5056, 3584, 1, 128]
    - [120, 2186.44]
  - - [5888, 5888, 1, 3328]
    - [179, 9369.9]
  - - [6784, 1024, 1, 256]
    - [172, 8297.88]
  - - [2944, 2368, 1, 256]
    - [189, 8317.92]
  - - [256, 448, 1, 256]
    - [136, 2073.56]
  - - [5056, 5888, 1, 3328]
    - [169, 8500.23]
  - - [1856, 1024, 1, 256]
    - [181, 7163.52]
  - - [448, 1408, 1, 1280]
    - [171, 6399.94]
  - - [3584, 448, 1, 1280]
    - [181, 7350.62]
  - - [1024, 1024, 1, 1280]
    - [183, 8101.12]
  - - [448, 5888, 1, 256]
    - [196, 5085.06]
  - - [704, 64, 1, 128]
    - [123, 394.032]
  - - [1408, 6784, 1, 3328]
    - [183, 8790.21]
  - - [448, 1024, 1, 128]
    - [167, 1174.51]
  - - [4288, 704, 1, 128]
    - [111, 2433.35]
  - - [128, 1856, 1, 128]
    - [112, 1496.59]
  - - [448, 2368, 1, 3328]
    - [171, 6800.08]
  - - [5056, 64, 1, 128]
    - [115, 2046.48]
  - - [5056, 2944, 1, 256]
    - [201, 7774.13]
  - - [6784, 5888, 1, 128]
    - [120, 2412.55]
  - - [704, 1024, 1, 256]
    - [171, 5991.96]
  - - [1024, 4, 1, 256]
    - [206, 184.708]
  - - [2368, 1856, 1, 256]
    - [196, 6649.74]
  - - [128, 6784, 1, 1280]
    - [183, 6281.13]
  - - [1408, 3584, 1, 3328]
    - [183, 8712.83]
  - - [2368, 6784, 1, 256]
    - [196, 7555.41]
  - - [5056, 1408, 1, 1280]
    - [185, 8548.04]
  - - [256, 256, 1, 128]
    - [118, 499.422]
  - - [5056, 4288, 1, 128]
    - [120, 2713.93]
  - - [1408, 1856, 1, 128]
    - [120, 1710.9]
  - - [1408, 5888, 1, 3328]
    - [183, 8960.48]
  - - [1856, 256, 1, 256]
    - [171, 5652.28]
  - - [6784, 6784, 1, 256]
    - [173, 8784.08]
  - - [64, 256, 1, 128]
    - [114, 141.038]
  - - [4288, 2368, 1, 128]
    - [120, 2065.23]
  - - [1856, 4288, 1, 128]
    - [111, 3359.9]
  - - [256, 4288, 1, 1280]
    - [171, 6352.22]
  - - [2368, 2944, 1, 256]
    - [196, 7311.94]
  - - [4, 1856, 1, 256]
    - [206, 312.689]
  - - [3584, 1856, 1, 1280]
    - [169, 8641.02]
  - - [6784, 6784, 1, 128]
    - [167, 3070.96]
  - - [256, 1856, 1, 128]
    - [111, 1193.53]
  - - [704, 64, 1, 1280]
    - [128, 2660.23]
  - - [5888, 5056, 1, 256]
    - [182, 8991.41]
  - - [3584, 448, 1, 256]
    - [171, 4281.79]
  - - [448, 4288, 1, 128]
    - [166, 2020.9]
  - - [2944, 4288, 1, 3328]
    - [185, 8165.41]
  - - [256, 6784, 1, 256]
    - [181, 7312.54]
  - - [1408, 4288, 1, 128]
    - [111, 2029.51]
  - - [2944, 704, 1, 3328]
    - [184, 7359.18]
  - - [128, 448, 1, 256]
    - [136, 1456.38]
  - - [3584, 3584, 1, 256]
    - [189, 7938.32]
  - - [448, 1408, 1, 128]
    - [111, 1510.96]
  - - [128, 256, 1, 1280]
    - [150, 2745.06]
  - - [3584, 5056, 1, 256]
    - [189, 8763.31]
  - - [6784, 128, 1, 256]
    - [171, 5874.79]
  - - [4288, 4, 1, 256]
    - [205, 392.146]
  - - [64, 1408, 1, 3328]
    - [140, 4751.25]
  - - [704, 448, 1, 256]
    - [180, 3255.76]
  - - [2944, 2368, 1, 1280]
    - [187, 8145.42]
  - - [448, 64, 1, 3328]
    - [158, 3369.47]
  - - [1408, 3584, 1, 256]
    - [169, 8371.31]
  - - [3584, 4, 1, 3328]
    - [205, 635.897]
  - - [6784, 3584, 1, 256]
    - [189, 8340.13]
  - - [256, 128, 1, 128]
    - [112, 267.594]
  - - [704, 1408, 1, 128]
    - [166, 1616.79]
  - - [4, 2368, 1, 256]
    - [206, 360.938]
  - - [2944, 448, 1, 128]
    - [167, 900.381]
  - - [128, 1408, 1, 256]
    - [171, 2883.68]
  - - [4, 2944, 1, 256]
    - [204, 358.988]
  - - [64, 128, 1, 3328]
    - [145, 1958.65]
  - - [5056, 2368, 1, 128]
    - [111, 3469.16]
  - - [2944, 2944, 1, 3328]
    - [168, 8417.33]
  - - [5056, 6784, 1, 256]
    - [179, 8902.64]
  - - [1856, 3584, 1, 128]
    - [111, 2046.83]
  - - [128, 2944, 1, 128]
    - [110, 2392.68]
  - - [1024, 704, 1, 3328]
    - [181, 7419.49]
  - - [6784, 448, 1, 256]
    - [196, 5391.2]
  - - [3584, 6784, 1, 128]
    - [167, 1924.42]
  - - [128, 4288, 1, 256]
    - [181, 4838.57]
  - - [704, 448, 1, 3328]
    - [171, 4778.07]
  - - [1024, 1024, 1, 3328]
    - [189, 8087.0]
  - - [128, 128, 1, 3328]
    - [146, 2515.13]
  - - [5056, 1856, 1, 256]
    - [181, 8430.35]
  - - [256, 128, 1, 256]
    - [149, 1127.6]
  - - [1024, 1856, 1, 256]
    - [181, 6632.31]
  - - [4288, 64, 1, 128]
    - [108, 1799.65]
  - - [256, 448, 1, 3328]
    - [134, 5372.87]
  - - [1408, 6784, 1, 1280]
    - [189, 8698.43]
  - - [3584, 3584, 1, 1280]
    - [182, 8071.76]
  - - [64, 2368, 1, 1280]
    - [134, 4400.88]
  - - [448, 2368, 1, 1280]
    - [171, 6664.34]
  - - [5888, 5888, 1, 128]
    - [120, 2352.2]
  - - [64, 6784, 1, 3328]
    - [181, 6532.37]
  - - [2944, 256, 1, 1280]
    - [197, 5890.98]
  - - [5056, 5888, 1, 128]
    - [167, 3126.55]
  - - [256, 2368, 1, 128]
    - [166, 1454.27]
  - - [5056, 2368, 1, 3328]
    - [189, 9057.7]
  - - [2944, 4288, 1, 256]
    - [168, 8433.56]
  - - [1408, 3584, 1, 1280]
    - [183, 8638.19]
  - - [2368, 64, 1, 256]
    - [181, 2342.93]
  - - [64, 448, 1, 3328]
    - [164, 3467.41]
  - - [256, 256, 1, 3328]
    - [152, 4369.17]
  - - [5888, 4, 1, 128]
    - [202, 153.909]
  - - [1856, 704, 1, 256]
    - [180, 6899.76]
  - - [4, 4288, 1, 1280]
    - [124, 580.294]
  - - [1408, 448, 1, 3328]
    - [197, 5836.53]
  - - [1024, 4, 1, 3328]
    - [211, 492.567]
  - - [2368, 256, 1, 256]
    - [171, 5314.8]
  - - [2368, 6784, 1, 3328]
    - [168, 9141.5]
  - - [1856, 1408, 1, 1280]
    - [172, 7304.76]
  - - [1856, 448, 1, 1280]
    - [171, 6496.1]
  - - [6784, 704, 1, 128]
    - [120, 3003.83]
  - - [4, 4, 1, 256]
    - [207, 0.852941]
  - - [128, 5888, 1, 128]
    - [113, 2926.95]
  - - [1408, 5888, 1, 256]
    - [200, 6736.75]
  - - [704, 2944, 1, 1280]
    - [171, 8332.05]
  - - [1856, 2368, 1, 128]
    - [120, 2898.7]
  - - [256, 64, 1, 256]
    - [149, 738.534]
  - - [1024, 1024, 1, 256]
    - [183, 6056.86]
  - - [704, 1856, 1, 256]
    - [170, 7039.15]
  - - [64, 6784, 1, 256]
    - [193, 4511.02]
  - - [3584, 704, 1, 1280]
    - [181, 8190.42]
  - - [256, 128, 1, 1280]
    - [153, 2716.62]
  - - [2368, 4, 1, 256]
    - [206, 240.659]
  - - [256, 2368, 1, 1280]
    - [171, 6047.06]
  - - [2944, 6784, 1, 128]
    - [166, 3102.25]
  - - [3584, 448, 1, 3328]
    - [169, 6883.97]
  - - [1408, 4, 1, 256]
    - [206, 217.237]
  - - [704, 2368, 1, 3328]
    - [171, 7744.38]
  - - [2944, 448, 1, 256]
    - [170, 6179.43]
  - - [1856, 448, 1, 128]
    - [166, 2401.51]
  - - [2368, 128, 1, 1280]
    - [129, 4685.77]
  - - [256, 5888, 1, 128]
    - [120, 1825.78]
  - - [2368, 256, 1, 128]
    - [111, 1567.04]
  - - [64, 5056, 1, 1280]
    - [135, 5016.91]
  - - [4, 6784, 1, 128]
    - [202, 154.611]
  - - [2944, 2944, 1, 1280]
    - [179, 8734.36]
  - - [5888, 2368, 1, 256]
    - [168, 8600.1]
  - - [4, 3584, 1, 1280]
    - [208, 576.422]
  - - [1408, 128, 1, 128]
    - [113, 1264.83]
  - - [6784, 704, 1, 3328]
    - [190, 8015.21]
  - - [128, 64, 1, 1280]
    - [157, 1260.41]
  - - [2368, 256, 1, 1280]
    - [171, 6150.59]
  - - [4, 448, 1, 3328]
    - [213, 386.355]
  - - [5888, 4288, 1, 128]
    - [166, 2944.44]
  - - [4, 5888, 1, 256]
    - [205, 440.839]
  - - [1408, 2944, 1, 3328]
    - [168, 9420.37]
  - - [3584, 704, 1, 128]
    - [120, 2478.32]
  - - [64, 1024, 1, 256]
    - [151, 1664.51]
  - - [5056, 5056, 1, 128]
    - [120, 3596.73]
  - - [2368, 448, 1, 1280]
    - [181, 6693.23]
  - - [128, 3584, 1, 256]
    - [181, 5224.32]
  - - [704, 448, 1, 1280]
    - [193, 4194.84]
  - - [448, 5056, 1, 128]
    - [167, 2185.95]
  - - [256, 4, 1, 1280]
    - [211, 163.94]
  - - [128, 5056, 1, 256]
    - [171, 5720.92]
  - - [1408, 5056, 1, 128]
    - [120, 3171.07]
  - - [2944, 3584, 1, 128]
    - [111, 3177.6]
  - - [3584, 2368, 1, 256]
    - [182, 8237.31]
  - - [5888, 5056, 1, 1280]
    - [189, 9443.67]
  - - [2368, 5056, 1, 128]
    - [120, 3432.48]
  - - [64, 704, 1, 256]
    - [127, 1335.09]
  - - [4288, 256, 1, 1280]
    - [181, 5105.8]
  - - [3584, 3584, 1, 3328]
    - [189, 8660.89]
  - - [1024, 256, 1, 128]
    - [120, 500.614]
  - - [4, 704, 1, 128]
    - [202, 25.7]
  - - [5888, 6784, 1, 256]
    - [169, 9132.79]
  - - [4288, 2944, 1, 3328]
    - [176, 8644.15]
  - - [2944, 64, 1, 128]
    - [110, 1492.5]
  - - [1856, 64, 1, 256]
    - [151, 2054.74]
  - - [4288, 128, 1, 3328]
    - [141, 6077.48]
  - - [4288, 704, 1, 1280]
    - [181, 8052.77]
  - - [256, 5056, 1, 1280]
    - [181, 8108.7]
  - - [1408, 256, 1, 128]
    - [166, 1133.14]
  - - [2944, 5888, 1, 3328]
    - [178, 8537.11]
  - - [6784, 5888, 1, 1280]
    - [189, 9442.18]
  - - [704, 128, 1, 256]
    - [132, 1961.72]
  - - [5888, 4288, 1, 1280]
    - [179, 9269.77]
  - - [448, 256, 1, 1280]
    - [129, 4180.07]
  - - [5888, 3584, 1, 128]
    - [120, 3550.85]
  - - [1856, 1856, 1, 128]
    - [120, 2364.57]
  - - [5056, 4, 1, 1280]
    - [211, 561.878]
  - - [256, 1408, 1, 1280]
    - [181, 5238.22]
  - - [3584, 1024, 1, 3328]
    - [174, 7692.95]
  - - [704, 3584, 1, 128]
    - [111, 2254.15]
  - - [5888, 448, 1, 3328]
    - [168, 7830.92]
  - - [2368, 4288, 1, 1280]
    - [186, 8431.0]
  - - [4288, 2944, 1, 128]
    - [167, 2471.43]
  - - [1024, 6784, 1, 3328]
    - [179, 8664.34]
  - - [128, 2368, 1, 256]
    - [171, 3688.06]
  - - [6784, 64, 1, 3328]
    - [144, 5794.67]
  - - [5056, 2944, 1, 3328]
    - [175, 8918.18]
  - - [448, 128, 1, 256]
    - [127, 1609.76]
  - - [2944, 3584, 1, 256]
    - [172, 8648.69]
  - - [1408, 1408, 1, 3328]
    - [186, 8123.66]
  - - [1856, 128, 1, 1280]
    - [135, 5207.07]
  - - [3584, 3584, 1, 128]
    - [111, 2303.37]
  - - [64, 3584, 1, 256]
    - [171, 3546.01]
  - - [1408, 4, 1, 3328]
    - [211, 555.292]
  - - [128, 2944, 1, 3328]
    - [156, 6116.44]
  - - [3584, 704, 1, 256]
    - [176, 4651.04]
  - - [2944, 448, 1, 3328]
    - [183, 7180.66]
  - - [3584, 1408, 1, 3328]
    - [191, 8275.92]
  - - [704, 3584, 1, 1280]
    - [183, 8435.13]
  - - [2944, 6784, 1, 1280]
    - [169, 8772.76]
  - - [1856, 6784, 1, 256]
    - [189, 8084.26]
  - - [4288, 448, 1, 3328]
    - [196, 6628.7]
  - - [6784, 4288, 1, 128]
    - [167, 3006.01]
  - - [6784, 704, 1, 1280]
    - [189, 8389.04]
  - - [256, 4288, 1, 256]
    - [180, 5497.28]
  - - [3584, 64, 1, 128]
    - [114, 1715.06]
  - - [5888, 1024, 1, 3328]
    - [189, 8713.02]
  - - [448, 64, 1, 128]
    - [123, 223.881]
  - - [704, 6784, 1, 1280]
    - [169, 8526.64]
  - - [5888, 128, 1, 256]
    - [171, 5825.52]
  - - [2368, 448, 1, 3328]
    - [193, 5570.9]
  - - [1856, 5056, 1, 3328]
    - [170, 7885.11]
  - - [4, 6784, 1, 256]
    - [124, 479.836]
  - - [1024, 3584, 1, 128]
    - [167, 2213.45]
  - - [1024, 1408, 1, 128]
    - [120, 1809.41]
  - - [2368, 2944, 1, 128]
    - [111, 3256.8]
  - - [5056, 64, 1, 256]
    - [131, 2768.73]
  - - [4, 448, 1, 1280]
    - [207, 268.063]
  - - [5056, 2944, 1, 128]
    - [120, 3423.38]
  - - [5888, 5056, 1, 3328]
    - [169, 9090.94]
  - - [1024, 704, 1, 128]
    - [120, 1604.32]
  - - [1408, 2368, 1, 128]
    - [111, 2087.2]
  - - [5888, 2368, 1, 128]
    - [166, 2447.27]
  - - [128, 5056, 1, 3328]
    - [171, 6722.23]
  - - [3584, 6784, 1, 1280]
    - [168, 9451.76]
  - - [1856, 5888, 1, 256]
    - [172, 8873.47]
  - - [256, 256, 1, 256]
    - [151, 1625.8]
  - - [256, 64, 1, 128]
    - [113, 141.038]
  - - [4288, 4288, 1, 3328]
    - [172, 8908.73]
  - - [4288, 1408, 1, 1280]
    - [168, 7906.46]
  - - [3584, 5056, 1, 128]
    - [167, 3023.05]
  - - [4, 1024, 1, 3328]
    - [126, 595.882]
  - - [4288, 2368, 1, 256]
    - [172, 8539.57]
  - - [2944, 5056, 1, 1280]
    - [169, 9194.3]
  - - [448, 6784, 1, 256]
    - [181, 7849.61]
  - - [704, 1024, 1, 128]
    - [166, 2112.62]
  - - [6784, 2368, 1, 3328]
    - [168, 9474.31]
  - - [256, 1024, 1, 1280]
    - [171, 5349.98]
  - - [704, 4, 1, 128]
    - [202, 20.7679]
  - - [256, 4, 1, 256]
    - [207, 50.5123]
  - - [4288, 128, 1, 256]
    - [181, 4457.88]
  - - [4288, 1856, 1, 3328]
    - [179, 8506.85]
  - - [3584, 448, 1, 128]
    - [120, 1539.35]
  - - [256, 4, 1, 3328]
    - [211, 269.71]
  - - [4, 1408, 1, 1280]
    - [126, 474.374]
  - - [3584, 64, 1, 1280]
    - [129, 4514.26]
  - - [1408, 448, 1, 128]
    - [166, 1767.62]
  - - [3584, 1024, 1, 1280]
    - [180, 8228.82]
  - - [1856, 5056, 1, 256]
    - [181, 8420.89]
  - - [4, 3584, 1, 256]
    - [124, 388.873]
  - - [1024, 4288, 1, 256]
    - [180, 7306.87]
  - - [5888, 3584, 1, 3328]
    - [179, 8644.68]
  - - [4, 256, 1, 256]
    - [207, 49.0075]
  - - [5056, 3584, 1, 3328]
    - [183, 8771.87]
  - - [128, 5888, 1, 1280]
    - [181, 7612.87]
  - - [704, 448, 1, 128]
    - [111, 1042.72]
  - - [2368, 1408, 1, 1280]
    - [170, 7543.4]
  - - [5056, 2944, 1, 1280]
    - [168, 9198.92]
  - - [4, 4, 1, 128]
    - [203, 0.100922816]
  - - [3584, 256, 1, 256]
    - [181, 6287.07]
  - - [128, 1856, 1, 3328]
    - [134, 6081.84]
  - - [1024, 6784, 1, 256]
    - [201, 7203.52]
  - - [4, 128, 1, 256]
    - [126, 22.5438]
  - - [64, 64, 1, 1280]
    - [157, 736.46]
  - - [6784, 4, 1, 128]
    - [202, 140.154]
  - - [2944, 1408, 1, 128]
    - [111, 3089.17]
  - - [448, 128, 1, 3328]
    - [140, 4259.94]
  - - [64, 2944, 1, 3328]
    - [129, 5578.82]
  - - [64, 4288, 1, 3328]
    - [134, 5640.6]
  - - [5056, 6784, 1, 3328]
    - [189, 8689.0]
  - - [128, 2944, 1, 256]
    - [181, 4482.86]
  - - [128, 6784, 1, 128]
    - [114, 2703.14]
  - - [3584, 4288, 1, 256]
    - [189, 8764.69]
  - - [448, 1856, 1, 256]
    - [171, 5759.32]
  - - [1856, 6784, 1, 3328]
    - [172, 9034.68]
  - - [3584, 128, 1, 3328]
    - [181, 6887.16]
  - - [64, 1856, 1, 256]
    - [132, 2197.26]
  - - [1024, 448, 1, 1280]
    - [181, 6583.09]
  - - [5888, 4288, 1, 256]
    - [182, 9009.09]
  - - [4, 448, 1, 128]
    - [202, 14.0184]
  - - [5056, 1408, 1, 256]
    - [179, 8525.65]
  - - [64, 256, 1, 1280]
    - [149, 1886.03]
  - - [3584, 1024, 1, 256]
    - [168, 5785.35]
  - - [256, 704, 1, 256]
    - [181, 2772.78]
  - - [5888, 5888, 1, 256]
    - [182, 8649.65]
  - - [4288, 1024, 1, 1280]
    - [182, 8318.18]
  - - [5888, 128, 1, 3328]
    - [174, 6625.71]
  - - [448, 6784, 1, 3328]
    - [173, 8641.47]
  - - [2944, 1408, 1, 1280]
    - [168, 9243.62]
  - - [2944, 1856, 1, 3328]
    - [182, 7841.43]
  - - [2368, 64, 1, 128]
    - [114, 1177.2]
  - - [2944, 2944, 1, 128]
    - [120, 3093.43]
  - - [4, 128, 1, 3328]
    - [213, 185.31]
  - - [3584, 5888, 1, 1280]
    - [169, 9409.85]
  - - [64, 4, 1, 128]
    - [202, 1.97032]
  - - [6784, 1856, 1, 1280]
    - [189, 8759.49]
  - - [2944, 5056, 1, 256]
    - [175, 8657.23]
  - - [5888, 256, 1, 3328]
    - [181, 7791.44]
  - - [1856, 5888, 1, 3328]
    - [179, 9096.65]
  - - [3584, 1408, 1, 256]
    - [179, 8155.67]
  - - [704, 3584, 1, 3328]
    - [179, 7399.1]
  - - [5056, 448, 1, 1280]
    - [180, 7601.06]
  - - [3584, 1856, 1, 3328]
    - [174, 8312.71]
  - - [64, 1408, 1, 128]
    - [114, 775.257]
  - - [1408, 704, 1, 1280]
    - [186, 7559.54]
  - - [2944, 1024, 1, 256]
    - [183, 7748.61]
  - - [1024, 2368, 1, 128]
    - [120, 2123.65]
  - - [2368, 4288, 1, 3328]
    - [181, 8709.84]
  - - [4, 1408, 1, 256]
    - [205, 231.156]
  - - [1024, 1408, 1, 1280]
    - [187, 7157.6]
  - - [64, 64, 1, 256]
    - [159, 184.708]
  - - [704, 256, 1, 3328]
    - [171, 4284.28]
  - - [6784, 5056, 1, 256]
    - [172, 8996.04]
  - - [4, 4288, 1, 3328]
    - [126, 651.716]
  - - [448, 6784, 1, 128]
    - [111, 2542.05]
  - - [4, 704, 1, 3328]
    - [212, 532.58]
  - - [448, 2944, 1, 256]
    - [171, 6414.26]
  - - [2944, 6784, 1, 256]
    - [182, 8983.88]
  - - [2368, 2368, 1, 1280]
    - [169, 8480.92]
  - - [4, 4, 1, 1280]
    - [211, 3.11176]
  - - [1856, 3584, 1, 1280]
    - [172, 8170.7]
  - - [64, 2944, 1, 256]
    - [181, 2941.23]
  - - [3584, 1408, 1, 1280]
    - [188, 8087.06]
  - - [448, 256, 1, 128]
    - [119, 904.045]
  - - [4288, 448, 1, 128]
    - [111, 1606.81]
  - - [5056, 256, 1, 1280]
    - [180, 7346.44]
  - - [1856, 1408, 1, 3328]
    - [171, 7978.3]
  - - [128, 128, 1, 128]
    - [113, 134.533]
  - - [1024, 4288, 1, 3328]
    - [176, 8036.25]
  - - [448, 2368, 1, 256]
    - [171, 5914.32]
  - - [1024, 4, 1, 128]
    - [203, 15.5202]
  - - [5056, 448, 1, 256]
    - [171, 5921.9]
  - - [2944, 2368, 1, 3328]
    - [177, 8479.9]
  - - [704, 128, 1, 3328]
    - [143, 4622.37]
  - - [64, 64, 1, 3328]
    - [165, 1331.3]
  - - [1024, 1856, 1, 1280]
    - [179, 7853.57]
  - - [6784, 1856, 1, 256]
    - [195, 7552.39]
  - - [128, 2368, 1, 3328]
    - [156, 5821.47]
  - - [1024, 5888, 1, 256]
    - [169, 7862.28]
  - - [5056, 128, 1, 1280]
    - [197, 5746.3]
  - - [5056, 64, 1, 3328]
    - [161, 5329.1]
  - - [128, 704, 1, 128]
    - [107, 735.708]
  - - [1408, 2368, 1, 256]
    - [201, 5852.68]
  - - [1408, 1408, 1, 256]
    - [189, 5183.01]
  - - [4, 64, 1, 128]
    - [202, 1.62836]
  - - [64, 128, 1, 1280]
    - [162, 1260.41]
  - - [2368, 2368, 1, 128]
    - [111, 3032.16]
  - - [64, 5888, 1, 128]
    - [115, 2003.19]
  - - [5888, 4, 1, 3328]
    - [207, 649.38]
  - - [6784, 1408, 1, 128]
    - [111, 3254.57]
  - - [4288, 5888, 1, 256]
    - [182, 9022.17]
  - - [1408, 5056, 1, 256]
    - [189, 8424.75]
  - - [5056, 128, 1, 3328]
    - [171, 6723.91]
  - - [128, 128, 1, 1280]
    - [138, 1846.18]
  - - [448, 704, 1, 256]
    - [171, 3881.85]
  - - [4288, 3584, 1, 128]
    - [120, 3580.86]
  - - [2944, 128, 1, 3328]
    - [134, 6419.5]
  - - [128, 5056, 1, 1280]
    - [171, 6578.68]
  - - [3584, 5056, 1, 1280]
    - [169, 9263.95]
  - - [256, 448, 1, 1280]
    - [156, 3896.08]
  - - [704, 704, 1, 128]
    - [120, 1558.03]
  - - [5056, 4, 1, 128]
    - [202, 43.8276]
  - - [704, 256, 1, 1280]
    - [171, 4010.65]
  - - [64, 2368, 1, 3328]
    - [134, 5525.57]
  - - [1856, 1024, 1, 128]
    - [120, 2712.74]
  - - [1856, 64, 1, 128]
    - [114, 1033.0]
  - - [64, 6784, 1, 1280]
    - [197, 5722.35]
  - - [704, 4288, 1, 256]
    - [182, 7097.83]
  - - [5888, 2368, 1, 1280]
    - [184, 8228.04]
  - - [128, 256, 1, 256]
    - [127, 1165.18]
  - - [256, 64, 1, 1280]
    - [139, 1833.27]
  - - [2368, 5888, 1, 1280]
    - [179, 7994.23]
  - - [5888, 256, 1, 1280]
    - [171, 8012.46]
  - - [4, 5888, 1, 1280]
    - [124, 634.497]
  - - [704, 128, 1, 128]
    - [109, 751.033]
  - - [1024, 4, 1, 1280]
    - [211, 385.606]
  - - [2368, 1856, 1, 3328]
    - [186, 8202.89]
  - - [2368, 128, 1, 128]
    - [110, 2046.37]
  - - [2944, 704, 1, 256]
    - [176, 7393.91]
  - - [5056, 128, 1, 128]
    - [113, 2941.77]
  - - [256, 704, 1, 3328]
    - [171, 4294.1]
  - - [704, 3584, 1, 256]
    - [196, 5256.61]
  - - [1024, 1024, 1, 1024]
    - [182, 6269.03]
  - - [704, 2944, 1, 3328]
    - [184, 7353.53]
  - - [6784, 1024, 1, 128]
    - [120, 3164.03]
  - - [256, 448, 1, 128]
    - [112, 1013.92]
  - - [448, 1024, 1, 3328]
    - [171, 6823.14]
  - - [2944, 1024, 1, 3328]
    - [171, 8261.59]
  - - [2944, 5056, 1, 128]
    - [120, 3397.49]
  - - [1408, 6784, 1, 256]
    - [183, 8270.11]
  - - [6784, 1408, 1, 3328]
    - [185, 8350.04]
  - - [4288, 6784, 1, 128]
    - [120, 2446.41]
  - - [704, 64, 1, 256]
    - [127, 1386.44]
  - - [5888, 4, 1, 1280]
    - [126, 527.138]
  - - [256, 2368, 1, 3328]
    - [171, 6124.0]
  - - [6784, 2944, 1, 1280]
    - [182, 9201.69]
  - - [4288, 1856, 1, 128]
    - [167, 1942.68]
  - - [1856, 2944, 1, 128]
    - [111, 2156.61]
  - - [6784, 448, 1, 128]
    - [111, 2368.71]
  - - [64, 3584, 1, 128]
    - [108, 1548.63]
  - - [448, 5056, 1, 1280]
    - [171, 8151.55]
  - - [2368, 1856, 1, 128]
    - [166, 2626.92]
  - - [128, 448, 1, 1280]
    - [154, 3324.39]
  - - [4288, 704, 1, 256]
    - [181, 4913.62]
  - - [256, 3584, 1, 128]
    - [167, 1709.07]
  - - [5888, 704, 1, 256]
    - [171, 8053.8]
  - - [3584, 1024, 1, 128]
    - [111, 2651.13]
  - - [256, 5888, 1, 3328]
    - [183, 8287.8]
  - - [1408, 4288, 1, 3328]
    - [179, 8890.71]
  - - [6784, 4288, 1, 256]
    - [172, 8883.31]
  - - [4288, 256, 1, 128]
    - [111, 766.066]
  - - [5888, 256, 1, 256]
    - [171, 7319.45]
  - - [6784, 1024, 1, 1280]
    - [171, 7718.77]
  - - [5888, 1024, 1, 128]
    - [111, 3081.19]
  - - [1024, 128, 1, 256]
    - [171, 2107.79]
  - - [128, 64, 1, 3328]
    - [157, 2016.59]
  - - [448, 64, 1, 256]
    - [127, 1042.72]
  - - [2944, 704, 1, 1280]
    - [181, 8329.96]
  - - [6784, 3584, 1, 1280]
    - [189, 9123.48]
  - - [1024, 6784, 1, 1280]
    - [169, 8929.15]
  - - [2944, 64, 1, 1280]
    - [134, 4567.76]
  - - [1408, 2944, 1, 1280]
    - [179, 9115.32]
  - - [256, 1856, 1, 256]
    - [181, 5528.96]
  - - [1408, 2368, 1, 3328]
    - [171, 8446.61]
  - - [2944, 4, 1, 3328]
    - [207, 584.684]
  - - [128, 1408, 1, 3328]
    - [129, 5436.88]
  - - [2944, 1856, 1, 128]
    - [166, 2765.83]
  - - [256, 2944, 1, 128]
    - [166, 1730.18]
  - - [256, 6784, 1, 128]
    - [111, 970.324]
  - - [2368, 4, 1, 128]
    - [202, 88.7269]
  - - [1408, 256, 1, 3328]
    - [171, 5456.65]
  - - [1856, 4, 1, 128]
    - [203, 27.4696]
  - - [5056, 6784, 1, 128]
    - [111, 2555.26]
  - - [4288, 5056, 1, 128]
    - [166, 3179.29]
  - - [1856, 5888, 1, 128]
    - [111, 3372.97]
  - - [2944, 5888, 1, 256]
    - [172, 8902.29]
  - - [3584, 1856, 1, 256]
    - [181, 8140.1]
  - - [4288, 3584, 1, 1280]
    - [172, 8735.73]
  - - [2368, 448, 1, 256]
    - [181, 5997.92]
  - - [4288, 256, 1, 3328]
    - [171, 7036.37]
  - - [1856, 704, 1, 128]
    - [111, 1972.36]
  - - [1408, 64, 1, 256]
    - [131, 1813.67]
  - - [64, 1856, 1, 128]
    - [114, 1145.01]
  - - [4, 256, 1, 128]
    - [202, 9.30449]
  - - [704, 4288, 1, 3328]
    - [199, 6980.64]
  - - [704, 5888, 1, 128]
    - [166, 2106.91]
  - - [6784, 3584, 1, 128]
    - [120, 2532.95]
  - - [1024, 64, 1, 256]
    - [132, 1436.51]
  - - [64, 2368, 1, 256]
    - [132, 2145.97]
  - - [4288, 5056, 1, 3328]
    - [189, 9093.58]
  - - [4, 1856, 1, 1280]
    - [125, 501.298]
  - - [4288, 128, 1, 128]
    - [115, 2212.15]
  - - [1408, 1408, 1, 128]
    - [111, 2683.64]
  - - [1024, 128, 1, 3328]
    - [155, 5776.15]
  - - [1856, 128, 1, 128]
    - [110, 1624.5]
  - - [5056, 2368, 1, 256]
    - [189, 8493.17]
  - - [4288, 704, 1, 3328]
    - [175, 8008.51]
  - - [448, 3584, 1, 256]
    - [196, 5885.58]
  - - [64, 128, 1, 128]
    - [112, 68.7241]
  - - [2368, 64, 1, 1280]
    - [134, 4457.51]
  - - [2368, 1024, 1, 1280]
    - [172, 7764.21]
  - - [2944, 1408, 1, 3328]
    - [189, 9272.95]
  - - [1408, 448, 1, 256]
    - [181, 5530.26]
  - - [1024, 1408, 1, 3328]
    - [173, 7839.4]
  - - [2944, 5888, 1, 1280]
    - [172, 8676.44]
  - - [1408, 4, 1, 1280]
    - [211, 446.199]
  - - [5888, 3584, 1, 256]
    - [182, 8999.06]
  - - [128, 1024, 1, 1280]
    - [129, 4315.23]
  - - [1408, 1856, 1, 3328]
    - [176, 8651.29]
  - - [4, 4, 1, 3328]
    - [212, 5.25969]
  - - [6784, 1408, 1, 1280]
    - [182, 8662.44]
  - - [4, 1024, 1, 1280]
    - [207, 448.977]
  - - [704, 2944, 1, 256]
    - [180, 7377.46]
  - - [704, 4288, 1, 128]
    - [120, 2463.12]
  - - [2368, 4288, 1, 128]
    - [166, 3047.05]
  - - [64, 4288, 1, 1280]
    - [134, 4741.91]
  - - [6784, 64, 1, 1280]
    - [181, 6046.07]
  - - [3584, 128, 1, 128]
    - [113, 2513.81]
  - - [1024, 6784, 1, 128]
    - [167, 2449.39]
  - - [4, 1856, 1, 128]
    - [202, 9.82046]
  - - [1408, 64, 1, 3328]
    - [140, 4554.97]
  - - [6784, 4, 1, 256]
    - [205, 443.137]
  - - [1408, 1408, 1, 1280]
    - [183, 8170.98]
  - - [256, 2368, 1, 256]
    - [171, 5344.08]
  - - [448, 4288, 1, 3328]
    - [194, 7061.55]
  - - [2368, 1408, 1, 256]
    - [192, 6553.7]
  - - [5888, 5056, 1, 128]
    - [120, 3628.06]
  - - [704, 2368, 1, 256]
    - [196, 5562.8]
  - - [2944, 448, 1, 1280]
    - [171, 7022.58]
  - - [5888, 2368, 1, 3328]
    - [181, 8663.3]
  - - [64, 2944, 1, 1280]
    - [134, 4547.09]
  - - [448, 1856, 1, 1280]
    - [171, 6477.12]
  - - [4288, 448, 1, 1280]
    - [170, 7164.75]
  - - [5888, 704, 1, 3328]
    - [181, 8553.57]
  - - [5056, 256, 1, 128]
    - [166, 922.978]
  - - [1856, 256, 1, 128]
    - [166, 1520.54]
  - - [5056, 128, 1, 256]
    - [171, 5507.91]
  - - [704, 4, 1, 256]
    - [207, 132.618]
  - - [1408, 5888, 1, 128]
    - [111, 3278.51]
  - - [4288, 4, 1, 128]
    - [203, 15.2536]
  - - [1408, 1024, 1, 256]
    - [196, 5447.25]
  - - [1024, 1856, 1, 128]
    - [120, 2144.58]
  - - [256, 704, 1, 128]
    - [166, 454.208]
  - - [256, 1024, 1, 128]
    - [120, 799.015]
  - - [448, 1024, 1, 256]
    - [181, 5397.18]
  - - [128, 4, 1, 3328]
    - [213, 180.602]
  - - [5056, 6784, 1, 1280]
    - [179, 8996.19]
  - - [704, 5056, 1, 3328]
    - [182, 8208.07]
  - - [64, 1408, 1, 1280]
    - [152, 3322.2]
  - - [3584, 5056, 1, 3328]
    - [168, 9408.38]
  - - [1856, 4, 1, 3328]
    - [211, 502.276]
  - - [4, 2944, 1, 128]
    - [202, 63.7541]
  - - [2368, 2944, 1, 3328]
    - [173, 8686.65]
  - - [448, 448, 1, 1280]
    - [134, 4688.08]
  - - [2368, 3584, 1, 256]
    - [182, 8269.91]
  - - [1024, 256, 1, 1280]
    - [193, 5349.98]
  - - [5056, 3584, 1, 1280]
    - [185, 8984.9]
  - - [448, 4, 1, 3328]
    - [213, 380.443]
  - - [1856, 2944, 1, 1280]
    - [175, 8261.76]
  - - [3584, 2368, 1, 1280]
    - [183, 7865.16]
  - - [128, 1024, 1, 256]
    - [137, 2196.07]
  - - [2944, 1408, 1, 256]
    - [201, 7260.35]
  - - [4288, 1408, 1, 3328]
    - [173, 8756.19]
  - - [3584, 64, 1, 3328]
    - [130, 5734.48]
  - - [1408, 128, 1, 256]
    - [171, 2912.81]
  - - [2944, 1024, 1, 128]
    - [166, 2313.5]
  - - [4288, 5056, 1, 1280]
    - [189, 8994.35]
  - - [5888, 6784, 1, 1280]
    - [189, 9122.36]
  - - [6784, 5056, 1, 128]
    - [167, 2288.38]
  - - [256, 1024, 1, 3328]
    - [181, 5232.92]
  - - [3584, 4, 1, 256]
    - [207, 345.026]
  - - [1856, 64, 1, 3328]
    - [129, 5490.56]
  - - [64, 6784, 1, 128]
    - [108, 2157.5]
  - - [5888, 1408, 1, 3328]
    - [168, 9230.02]
  - - [5888, 64, 1, 1280]
    - [134, 4913.96]
  - - [256, 5056, 1, 256]
    - [170, 6512.48]
  - - [128, 3584, 1, 128]
    - [119, 2171.71]
  - - [448, 3584, 1, 3328]
    - [171, 7439.86]
  - - [704, 2368, 1, 128]
    - [120, 2346.02]
  - - [5888, 256, 1, 128]
    - [167, 1746.46]
  - - [4, 5056, 1, 128]
    - [202, 165.194]
  - - [448, 256, 1, 256]
    - [128, 1983.89]
  - - [704, 4, 1, 3328]
    - [213, 427.639]
  - - [1408, 256, 1, 256]
    - [171, 4385.78]
  - - [3584, 1856, 1, 128]
    - [120, 2046.05]
  - - [4288, 4288, 1, 128]
    - [111, 2101.01]
  - - [1856, 1024, 1, 3328]
    - [189, 8175.31]
  - - [128, 5888, 1, 3328]
    - [171, 7803.08]
  - - [1024, 5056, 1, 256]
    - [181, 7889.36]
  - - [2368, 1408, 1, 3328]
    - [171, 8181.55]
  - - [5888, 448, 1, 256]
    - [181, 7196.21]
  - - [5888, 6784, 1, 128]
    - [111, 3414.13]
  - - [2368, 4, 1, 3328]
    - [211, 551.198]
  - - [6784, 5056, 1, 1280]
    - [179, 9284.44]
  - - [5056, 704, 1, 1280]
    - [181, 8257.41]
  - - [1408, 256, 1, 1280]
    - [171, 5276.56]
  - - [4288, 6784, 1, 1280]
    - [189, 9021.22]
  - - [128, 704, 1, 256]
    - [132, 1935.39]
  - - [1024, 1024, 1, 128]
    - [167, 2460.1]
  - - [448, 128, 1, 1280]
    - [154, 3142.24]
  - - [6784, 4, 1, 3328]
    - [207, 667.668]
  - - [4288, 4, 1, 1280]
    - [207, 595.397]
  - - [1024, 64, 1, 3328]
    - [137, 4105.97]
  - - [1856, 4, 1, 256]
    - [205, 264.064]
  - - [64, 3584, 1, 1280]
    - [135, 5090.27]
  - - [6784, 1408, 1, 256]
    - [182, 8540.46]
  - - [3584, 5888, 1, 128]
    - [120, 2261.74]
  - - [5056, 5888, 1, 256]
    - [179, 8911.51]
  - - [2368, 1024, 1, 256]
    - [172, 7446.8]
  - - [2944, 1856, 1, 256]
    - [171, 8255.53]
  - - [1856, 6784, 1, 1280]
    - [182, 8593.23]
  - - [64, 5056, 1, 128]
    - [108, 2113.3]
  - - [5888, 64, 1, 128]
    - [108, 2216.76]
  - - [448, 704, 1, 128]
    - [167, 745.487]
  - - [4, 1024, 1, 128]
    - [202, 38.4251]
  - - [4288, 3584, 1, 256]
    - [179, 8509.9]
  - - [1408, 704, 1, 128]
    - [111, 1509.11]
  - - [64, 256, 1, 3328]
    - [160, 2478.55]
  - - [5056, 1856, 1, 1280]
    - [182, 8690.42]
  - - [1408, 1024, 1, 3328]
    - [184, 7492.72]
  - - [2368, 256, 1, 3328]
    - [174, 5373.67]
  - - [5888, 3584, 1, 1280]
    - [182, 9254.59]
  - - [1856, 3584, 1, 3328]
    - [173, 8472.29]
  - - [5888, 128, 1, 1280]
    - [181, 7565.11]
  - - [1024, 2944, 1, 256]
    - [181, 7489.93]
  - - [448, 6784, 1, 1280]
    - [173, 8525.28]
  - - [256, 3584, 1, 1280]
    - [173, 7129.81]
  - - [448, 128, 1, 128]
    - [109, 447.663]
  - - [704, 5056, 1, 256]
    - [171, 6214.04]
  - - [2944, 1856, 1, 1280]
    - [182, 7678.38]
  - - [128, 256, 1, 128]
    - [114, 283.499]
  - - [5056, 256, 1, 256]
    - [181, 4581.82]
  - - [2368, 3584, 1, 3328]
    - [189, 7614.46]
  - - [3584, 5888, 1, 3328]
    - [189, 9292.93]
  - - [128, 4, 1, 256]
    - [205, 26.9563]
  - - [2944, 3584, 1, 1280]
    - [176, 8495.92]
  - - [1856, 5888, 1, 1280]
    - [189, 8716.0]
  - - [256, 256, 1, 1280]
    - [132, 3530.66]
  - - [5056, 448, 1, 3328]
    - [181, 8244.69]
  - - [4288, 1408, 1, 256]
    - [179, 8284.82]
  - - [3584, 64, 1, 256]
    - [171, 3097.16]
  - - [64, 1856, 1, 3328]
    - [155, 5290.69]
  - - [256, 1408, 1, 128]
    - [166, 953.351]
  - - [5888, 1408, 1, 128]
    - [120, 3232.18]
  - - [4288, 2368, 1, 1280]
    - [171, 8612.45]
  - - [4, 4288, 1, 256]
    - [204, 422.303]
  - - [256, 4288, 1, 128]
    - [120, 1522.08]
  - - [256, 128, 1, 3328]
    - [142, 3587.33]
  - - [6784, 2368, 1, 256]
    - [189, 8048.69]
  - - [5888, 128, 1, 128]
    - [113, 2598.94]
  - - [4288, 1856, 1, 256]
    - [169, 7682.53]
  - - [1856, 256, 1, 3328]
    - [171, 7140.86]
  - - [1856, 2944, 1, 256]
    - [189, 7465.94]
  - - [5056, 1024, 1, 128]
    - [120, 2022.99]
  - - [64, 5888, 1, 1280]
    - [134, 5279.71]
  - - [6784, 256, 1, 128]
    - [167, 2073.78]
  - - [5888, 704, 1, 128]
    - [111, 2642.43]
  - - [6784, 64, 1, 128]
    - [108, 2226.64]
  - - [1024, 4288, 1, 1280]
    - [168, 7542.99]
  - - [2368, 5056, 1, 3328]
    - [189, 9110.06]
  - - [448, 4, 1, 128]
    - [202, 14.6543]
  - - [4, 256, 1, 3328]
    - [213, 304.374]
  - - [4288, 1024, 1, 3328]
    - [185, 7780.55]
  - - [1024, 5056, 1, 3328]
    - [182, 8811.86]
  - - [1024, 1856, 1, 3328]
    - [179, 8127.41]
  - - [704, 704, 1, 1280]
    - [193, 6521.36]
  - - [128, 2368, 1, 1280]
    - [130, 4938.66]
  - - [1408, 128, 1, 3328]
    - [156, 5306.03]
  - - [3584, 256, 1, 1280]
    - [173, 6518.78]
  - - [4, 128, 1, 128]
    - [202, 4.78114]
  - - [704, 6784, 1, 128]
    - [167, 2670.08]
  - - [3584, 128, 1, 1280]
    - [171, 4781.88]
  - - [4, 256, 1, 1280]
    - [211, 178.187]
  - - [128, 704, 1, 3328]
    - [143, 4571.64]
  - - [4288, 6784, 1, 256]
    - [169, 8744.79]
  - - [3584, 2944, 1, 3328]
    - [186, 8478.13]
  - - [128, 1856, 1, 256]
    - [171, 3654.99]
  - - [64, 4288, 1, 256]
    - [171, 3314.0]
  - - [4, 3584, 1, 3328]
    - [125, 673.212]
  - - [64, 4, 1, 3328]
    - [213, 98.7074]
  - - [4, 64, 1, 3328]
    - [211, 90.3508]
  - - [5888, 2944, 1, 256]
    - [168, 9038.65]
  - - [2368, 6784, 1, 128]
    - [167, 3068.4]
  - - [448, 4288, 1, 1280]
    - [183, 7895.38]
  - - [448, 1856, 1, 3328]
    - [183, 6675.1]
  - - [4, 1024, 1, 256]
    - [206, 184.708]
  - - [5056, 4288, 1, 256]
    - [172, 9004.16]
  - - [1024, 448, 1, 256]
    - [171, 5169.14]
  - - [1024, 3584, 1, 256]
    - [181, 7509.08]
  - - [2944, 128, 1, 1280]
    - [129, 4870.3]
  - - [1856, 5056, 1, 128]
    - [166, 2988.61]
  - - [64, 256, 1, 256]
    - [149, 749.083]
  - - [1408, 4, 1, 128]
    - [203, 4.50645]
  - - [128, 2368, 1, 128]
    - [123, 1809.68]
  - - [256, 704, 1, 1280]
    - [171, 4027.45]
  - - [64, 2368, 1, 128]
    - [114, 1283.08]
  - - [6784, 6784, 1, 3328]
    - [182, 8929.52]
  - - [448, 5888, 1, 1280]
    - [189, 7552.91]
  - - [5056, 448, 1, 128]
    - [111, 2365.73]
  - - [3584, 2944, 1, 128]
    - [120, 3247.27]
  - - [6784, 256, 1, 1280]
    - [198, 6344.22]
  - - [256, 2944, 1, 1280]
    - [170, 6560.83]
  - - [64, 4288, 1, 128]
    - [115, 1614.41]
  - - [2368, 5888, 1, 3328]
    - [168, 8589.41]
  - - [4, 64, 1, 256]
    - [206, 12.9]
  - - [704, 1024, 1, 3328]
    - [193, 6552.26]
  - - [2368, 1856, 1, 1280]
    - [173, 8316.09]
  - - [128, 448, 1, 128]
    - [112, 480.469]
  - - [128, 6784, 1, 256]
    - [171, 6027.71]
  - - [3584, 4288, 1, 128]
    - [111, 2571.1]
  - - [64, 448, 1, 128]
    - [117, 232.969]
  - - [5888, 4288, 1, 3328]
    - [191, 8665.62]
  - - [2368, 704, 1, 256]
    - [197, 5460.32]
  - - [256, 1856, 1, 3328]
    - [171, 7135.7]
  - - [1856, 128, 1, 256]
    - [197, 3167.67]
  - - [6784, 128, 1, 128]
    - [110, 3300.25]
  - - [3584, 1408, 1, 128]
    - [120, 1818.57]
  - - [1856, 5056, 1, 1280]
    - [175, 7795.27]
  - - [2944, 1024, 1, 1280]
    - [168, 8874.87]
  - - [5056, 4, 1, 256]
    - [205, 331.981]
  - - [2368, 4288, 1, 256]
    - [195, 7228.73]
  - - [1024, 2368, 1, 3328]
    - [181, 7319.27]
  - - [64, 704, 1, 3328]
    - [140, 3675.26]
  - - [704, 1408, 1, 256]
    - [171, 6171.19]
  - - [6784, 1856, 1, 3328]
    - [171, 8600.05]
  - - [1024, 2944, 1, 128]
    - [167, 2226.99]
  - - [1024, 3584, 1, 1280]
    - [183, 8639.23]
  - - [4288, 5888, 1, 3328]
    - [189, 9322.63]
  - - [4288, 4, 1, 3328]
    - [207, 629.309]
  - - [256, 1408, 1, 256]
    - [171, 4240.66]
  - - [448, 2944, 1, 1280]
    - [173, 7124.53]
  - - [4, 5888, 1, 128]
    - [202, 188.516]
  - - [1024, 2944, 1, 3328]
    - [168, 8136.7]
  - - [3584, 6784, 1, 256]
    - [185, 8777.65]
  - - [256, 6784, 1, 1280]
    - [181, 7831.9]
  - - [1856, 3584, 1, 256]
    - [196, 7277.38]
  - - [128, 448, 1, 3328]
    - [140, 4237.24]
  - - [6784, 1856, 1, 128]
    - [120, 3296.19]
  - - [4, 448, 1, 256]
    - [210, 83.2072]
  - - [2944, 704, 1, 128]
    - [166, 1636.07]
  - - [256, 5888, 1, 1280]
    - [186, 7308.34]
  - - [4, 128, 1, 1280]
    - [213, 86.3316]
  - - [4288, 6784, 1, 3328]
    - [182, 9146.71]
  - - [6784, 128, 1, 1280]
    - [173, 6715.22]
  - - [64, 1408, 1, 256]
    - [151, 1975.16]
  - - [2368, 1408, 1, 128]
    - [120, 2630.58]
  - - [1856, 448, 1, 256]
    - [173, 5010.95]
  - - [1408, 1024, 1, 128]
    - [120, 2027.22]
  - - [128, 64, 1, 128]
    - [121, 66.634]
  - - [6784, 3584, 1, 3328]
    - [179, 9065.91]
  - - [2944, 64, 1, 3328]
    - [129, 5594.75]
  - - [64, 64, 1, 128]
    - [116, 39.581]
  - - [2368, 5056, 1, 1280]
    - [176, 8470.27]
  - - [64, 4, 1, 1280]
    - [211, 43.6745]
  - - [1408, 2368, 1, 1280]
    - [171, 8403.72]
  - - [128, 1408, 1, 1280]
    - [129, 4362.56]
  - - [256, 64, 1, 3328]
    - [163, 2793.44]
  - - [2944, 4288, 1, 128]
    - [166, 2570.49]
  - - [2944, 2944, 1, 256]
    - [175, 8293.99]
  - - [2944, 4, 1, 1280]
    - [211, 522.028]
  - - [5888, 4, 1, 256]
    - [207, 388.587]
  - - [6784, 256, 1, 256]
    - [171, 7245.8]
  - - [256, 5056, 1, 3328]
    - [196, 6889.96]
  - - [128, 4288, 1, 1280]
    - [134, 5622.27]
  - - [5056, 1856, 1, 128]
    - [120, 2301.49]
  - - [5888, 1408, 1, 256]
    - [179, 8769.99]
  - - [128, 128, 1, 256]
    - [127, 708.597]
  - - [5056, 4, 1, 3328]
    - [207, 632.667]
  - - [4288, 3584, 1, 3328]
    - [169, 9678.34]
  - - [448, 704, 1, 3328]
    - [181, 4759.0]
  - - [448, 448, 1, 128]
    - [109, 1310.82]
  - - [1024, 2368, 1, 1280]
    - [198, 6984.3]
  - - [1856, 704, 1, 3328]
    - [180, 7165.33]
  - - [4, 2368, 1, 128]
    - [202, 8.54768]
  - - [5888, 6784, 1, 3328]
    - [175, 9056.68]
  - - [704, 4288, 1, 1280]
    - [173, 8467.83]
  - - [704, 256, 1, 256]
    - [181, 2827.14]
  - - [6784, 448, 1, 3328]
    - [171, 8354.81]
  - - [4288, 1024, 1, 128]
    - [111, 2912.8]
- null
