library/src/blas3/Tensile/Logic/asm_full/arcturus_Cijk_Alik_Bljk_DB_GB.yaml
- {MinimumRequiredVersion: 4.26.0}
- arcturus
- gfx908
- [Device 7380, Device 7388, Device 738c, Device 7390]
    SolutionIndex: 0
    SolutionNameMin: Cijk_Alik_Bljk_DB_GB_MT32x128x8_SN_PLR1_SU0_SUM0_SUS256_SNLL1_TT4_4_WG8_32_1_WGM1
    SolutionIndex: 1
    SolutionNameMin: Cijk_Alik_Bljk_DB_GB_MT64x64x8_SN_PLR1_SU0_SUM0_SUS256_SNLL1_TT4_4_WG16_16_1_WGM1
    SolutionIndex: 2
    SolutionNameMin: Cijk_Alik_Bljk_DB_GB_MT64x64x8_SN_PLR0_SU0_SUM0_SUS256_SNLL1_TT4_4_WG16_16_1_WGM1
    SolutionIndex: 3
    SolutionNameMin: Cijk_Alik_Bljk_DB_GB_MT128x32x8_SN_PLR1_SU0_SUM0_SUS256_SNLL1_TT4_4_WG32_8_1_WGM1
    SolutionIndex: 4
    SolutionNameMin: Cijk_Alik_Bljk_DB_GB_MT32x128x16_SN_PLR1_SU0_SUM0_SUS256_SNLL1_TT4_4_WG8_32_1_WGM1
    SolutionIndex: 5
    SolutionNameMin: Cijk_Alik_Bljk_DB_GB_MT64x64x8_SN_PLR1_SU32_SUM0_SUS128_SNLL1_TT4_4_WG16_16_1_WGM1
    SolutionIndex: 6
    SolutionNameMin: Cijk_Alik_Bljk_DB_GB_MT128x32x8_SN_PLR1_SU32_SUM0_SUS128_SNLL1_TT4_4_WG32_8_1_WGM1
    SolutionIndex: 7
    SolutionNameMin: Cijk_Alik_Bljk_DB_GB_MT64x64x8_SN_PLR1_SU32_SUM3_SUS128_SNLL1_TT4_4_WG16_16_1_WGM1
    SolutionIndex: 8
    SolutionNameMin: Cijk_Alik_Bljk_DB_GB_MT128x32x8_SN_PLR1_SU32_SUM0_SUS256_SNLL1_TT4_4_WG32_8_1_WGM1
    SolutionIndex: 9
    SolutionNameMin: Cijk_Alik_Bljk_DB_GB_MT64x64x8_SN_PLR1_SU32_SUM3_SUS256_SNLL1_TT4_4_WG16_16_1_WGM1
    SolutionIndex: 10
    SolutionNameMin: Cijk_Alik_Bljk_DB_GB_MT128x32x8_SN_PLR1_SU32_SUM3_SUS256_SNLL1_TT4_4_WG32_8_1_WGM1
    SolutionIndex: 11
    SolutionNameMin: Cijk_Alik_Bljk_DB_GB_MT32x128x8_SN_PLR1_SU0_SUM0_SUS256_SNLL1_TT4_4_WG8_32_1_WGM8
    SolutionIndex: 12
    SolutionNameMin: Cijk_Alik_Bljk_DB_GB_MT64x64x8_SN_PLR1_SU0_SUM0_SUS256_SNLL1_TT4_4_WG16_16_1_WGM8
    SolutionIndex: 13
    SolutionNameMin: Cijk_Alik_Bljk_DB_GB_MT128x32x8_SN_PLR0_SU0_SUM0_SUS256_SNLL1_TT4_4_WG32_8_1_WGM8
    SolutionIndex: 14
    SolutionNameMin: Cijk_Alik_Bljk_DB_GB_MT128x32x16_SN_PLR1_SU0_SUM0_SUS256_SNLL1_TT4_4_WG32_8_1_WGM8
    SolutionIndex: 15
    SolutionNameMin: Cijk_Alik_Bljk_DB_GB_MT64x64x8_SN_PLR1_SU32_SUM0_SUS128_SNLL1_TT4_4_WG16_16_1_WGM8
    SolutionIndex: 16
    SolutionNameMin: Cijk_Alik_Bljk_DB_GB_MT64x64x8_SN_PLR1_SU32_SUM0_SUS256_SNLL1_TT4_4_WG16_16_1_WGM8
    SolutionIndex: 17
    SolutionNameMin: Cijk_Alik_Bljk_DB_GB_MT32x128x8_SN_PLR1_SU0_SUM0_SUS256_SNLL1_TT4_4_WG8_32_1_WGM15
    SolutionIndex: 18
    SolutionNameMin: Cijk_Alik_Bljk_DB_GB_MT64x64x8_SN_PLR1_SU0_SUM0_SUS256_SNLL1_TT4_4_WG16_16_1_WGM15
    SolutionIndex: 19
    SolutionNameMin: Cijk_Alik_Bljk_DB_GB_MT128x32x8_SN_PLR1_SU0_SUM0_SUS256_SNLL1_TT4_4_WG32_8_1_WGM15
    SolutionIndex: 20
    SolutionNameMin: Cijk_Alik_Bljk_DB_GB_MT128x32x8_SN_PLR0_SU0_SUM0_SUS256_SNLL1_TT4_4_WG32_8_1_WGM15
    SolutionIndex: 21
    SolutionNameMin: Cijk_Alik_Bljk_DB_GB_MT32x128x16_SN_PLR1_SU0_SUM0_SUS256_SNLL1_TT4_4_WG8_32_1_WGM15
    SolutionIndex: 22
    SolutionNameMin: Cijk_Alik_Bljk_DB_GB_MT64x64x8_SN_PLR1_SU32_SUM0_SUS128_SNLL1_TT4_4_WG16_16_1_WGM15
    SolutionIndex: 23
    SolutionNameMin: Cijk_Alik_Bljk_DB_GB_MT32x128x8_SN_PLR1_SU32_SUM0_SUS256_SNLL1_TT4_4_WG8_32_1_WGM15
    SolutionIndex: 24
    SolutionNameMin: Cijk_Alik_Bljk_DB_GB_MT64x64x8_SN_PLR1_SU32_SUM3_SUS256_SNLL1_TT4_4_WG16_16_1_WGM15
    SolutionIndex: 25
    SolutionNameMin: Cijk_Alik_Bljk_DB_GB_MT32x128x8_SN_PLR1_SU0_SUM0_SUS256_SNLL0_TT4_4_WG8_32_1_WGM1
    SolutionIndex: 26
    SolutionNameMin: Cijk_Alik_Bljk_DB_GB_MT64x64x8_SN_PLR1_SU0_SUM0_SUS256_SNLL0_TT4_4_WG16_16_1_WGM1
    SolutionIndex: 27
    SolutionNameMin: Cijk_Alik_Bljk_DB_GB_MT64x64x8_SN_PLR0_SU0_SUM0_SUS256_SNLL0_TT4_4_WG16_16_1_WGM1
    SolutionIndex: 28
    SolutionNameMin: Cijk_Alik_Bljk_DB_GB_MT128x32x8_SN_PLR1_SU0_SUM0_SUS256_SNLL0_TT4_4_WG32_8_1_WGM1
    SolutionIndex: 29
    SolutionNameMin: Cijk_Alik_Bljk_DB_GB_MT32x128x8_SN_PLR0_SU32_SUM0_SUS128_SNLL0_TT4_4_WG8_32_1_WGM1
    SolutionIndex: 30
    SolutionNameMin: Cijk_Alik_Bljk_DB_GB_MT64x64x8_SN_PLR1_SU32_SUM0_SUS128_SNLL0_TT4_4_WG16_16_1_WGM1
    SolutionIndex: 31
    SolutionNameMin: Cijk_Alik_Bljk_DB_GB_MT32x128x16_SN_PLR1_SU32_SUM0_SUS128_SNLL0_TT4_4_WG8_32_1_WGM1
    SolutionIndex: 32
    SolutionNameMin: Cijk_Alik_Bljk_DB_GB_MT32x128x8_SN_PLR1_SU32_SUM3_SUS128_SNLL0_TT4_4_WG8_32_1_WGM1
    SolutionIndex: 33
    SolutionNameMin: Cijk_Alik_Bljk_DB_GB_MT64x64x8_SN_PLR1_SU32_SUM3_SUS128_SNLL0_TT4_4_WG16_16_1_WGM1
    SolutionIndex: 34
    SolutionNameMin: Cijk_Alik_Bljk_DB_GB_MT64x64x8_SN_PLR0_SU32_SUM3_SUS128_SNLL0_TT4_4_WG16_16_1_WGM1
    SolutionIndex: 35
    SolutionNameMin: Cijk_Alik_Bljk_DB_GB_MT64x64x8_SN_PLR1_SU32_SUM0_SUS256_SNLL0_TT4_4_WG16_16_1_WGM1
    SolutionIndex: 36
    SolutionNameMin: Cijk_Alik_Bljk_DB_GB_MT64x64x8_SN_PLR0_SU32_SUM0_SUS256_SNLL0_TT4_4_WG16_16_1_WGM1
    SolutionIndex: 37
    SolutionNameMin: Cijk_Alik_Bljk_DB_GB_MT64x64x8_SN_PLR1_SU32_SUM3_SUS256_SNLL0_TT4_4_WG16_16_1_WGM1
    SolutionIndex: 38
    SolutionNameMin: Cijk_Alik_Bljk_DB_GB_MT32x128x8_SN_PLR1_SU0_SUM0_SUS256_SNLL0_TT4_4_WG8_32_1_WGM8
    SolutionIndex: 39
    SolutionNameMin: Cijk_Alik_Bljk_DB_GB_MT64x64x8_SN_PLR1_SU0_SUM0_SUS256_SNLL0_TT4_4_WG16_16_1_WGM8
    SolutionIndex: 40
    SolutionNameMin: Cijk_Alik_Bljk_DB_GB_MT64x64x8_SN_PLR0_SU0_SUM0_SUS256_SNLL0_TT4_4_WG16_16_1_WGM8
    SolutionIndex: 41
    SolutionNameMin: Cijk_Alik_Bljk_DB_GB_MT128x32x8_SN_PLR0_SU0_SUM0_SUS256_SNLL0_TT4_4_WG32_8_1_WGM8
    SolutionIndex: 42
    SolutionNameMin: Cijk_Alik_Bljk_DB_GB_MT128x32x16_SN_PLR1_SU0_SUM0_SUS256_SNLL0_TT4_4_WG32_8_1_WGM8
    SolutionIndex: 43
    SolutionNameMin: Cijk_Alik_Bljk_DB_GB_MT32x128x8_SN_PLR1_SU32_SUM0_SUS128_SNLL0_TT4_4_WG8_32_1_WGM8
    SolutionIndex: 44
    SolutionNameMin: Cijk_Alik_Bljk_DB_GB_MT64x64x8_SN_PLR1_SU32_SUM0_SUS128_SNLL0_TT4_4_WG16_16_1_WGM8
    SolutionIndex: 45
    SolutionNameMin: Cijk_Alik_Bljk_DB_GB_MT128x32x8_SN_PLR1_SU32_SUM0_SUS128_SNLL0_TT4_4_WG32_8_1_WGM8
    SolutionIndex: 46
    SolutionNameMin: Cijk_Alik_Bljk_DB_GB_MT64x64x8_SN_PLR1_SU32_SUM3_SUS128_SNLL0_TT4_4_WG16_16_1_WGM8
    SolutionIndex: 47
    SolutionNameMin: Cijk_Alik_Bljk_DB_GB_MT32x128x8_SN_PLR1_SU32_SUM0_SUS256_SNLL0_TT4_4_WG8_32_1_WGM8
    SolutionIndex: 48
    SolutionNameMin: Cijk_Alik_Bljk_DB_GB_MT64x64x8_SN_PLR1_SU32_SUM0_SUS256_SNLL0_TT4_4_WG16_16_1_WGM8
    SolutionIndex: 49
    SolutionNameMin: Cijk_Alik_Bljk_DB_GB_MT64x64x8_SN_PLR0_SU32_SUM0_SUS256_SNLL0_TT4_4_WG16_16_1_WGM8
    SolutionIndex: 50
    SolutionNameMin: Cijk_Alik_Bljk_DB_GB_MT32x128x8_SN_PLR1_SU32_SUM3_SUS256_SNLL0_TT4_4_WG8_32_1_WGM8
    SolutionIndex: 51
    SolutionNameMin: Cijk_Alik_Bljk_DB_GB_MT64x64x8_SN_PLR1_SU32_SUM3_SUS256_SNLL0_TT4_4_WG16_16_1_WGM8
    SolutionIndex: 52
    SolutionNameMin: Cijk_Alik_Bljk_DB_GB_MT32x128x8_SN_PLR1_SU0_SUM0_SUS256_SNLL0_TT4_4_WG8_32_1_WGM15
    SolutionIndex: 53
    SolutionNameMin: Cijk_Alik_Bljk_DB_GB_MT32x128x8_SN_PLR0_SU0_SUM0_SUS256_SNLL0_TT4_4_WG8_32_1_WGM15
    SolutionIndex: 54
    SolutionNameMin: Cijk_Alik_Bljk_DB_GB_MT64x64x8_SN_PLR1_SU0_SUM0_SUS256_SNLL0_TT4_4_WG16_16_1_WGM15
    SolutionIndex: 55
    SolutionNameMin: Cijk_Alik_Bljk_DB_GB_MT64x64x8_SN_PLR0_SU0_SUM0_SUS256_SNLL0_TT4_4_WG16_16_1_WGM15
    SolutionIndex: 56
    SolutionNameMin: Cijk_Alik_Bljk_DB_GB_MT128x32x8_SN_PLR0_SU0_SUM0_SUS256_SNLL0_TT4_4_WG32_8_1_WGM15
    SolutionIndex: 57
    SolutionNameMin: Cijk_Alik_Bljk_DB_GB_MT64x64x16_SN_PLR1_SU0_SUM0_SUS256_SNLL0_TT4_4_WG16_16_1_WGM15
    SolutionIndex: 58
    SolutionNameMin: Cijk_Alik_Bljk_DB_GB_MT128x32x16_SN_PLR1_SU0_SUM0_SUS256_SNLL0_TT4_4_WG32_8_1_WGM15
    SolutionIndex: 59
    SolutionNameMin: Cijk_Alik_Bljk_DB_GB_MT32x128x8_SN_PLR1_SU32_SUM0_SUS128_SNLL0_TT4_4_WG8_32_1_WGM15
    SolutionIndex: 60
    SolutionNameMin: Cijk_Alik_Bljk_DB_GB_MT64x64x8_SN_PLR1_SU32_SUM0_SUS128_SNLL0_TT4_4_WG16_16_1_WGM15
    SolutionIndex: 61
    SolutionNameMin: Cijk_Alik_Bljk_DB_GB_MT64x64x8_SN_PLR1_SU32_SUM3_SUS128_SNLL0_TT4_4_WG16_16_1_WGM15
    SolutionIndex: 62
    SolutionNameMin: Cijk_Alik_Bljk_DB_GB_MT64x64x8_SN_PLR1_SU32_SUM0_SUS256_SNLL0_TT4_4_WG16_16_1_WGM15
    SolutionIndex: 63
    SolutionNameMin: Cijk_Alik_Bljk_DB_GB_MT128x32x8_SN_PLR0_SU32_SUM0_SUS256_SNLL0_TT4_4_WG32_8_1_WGM15
    SolutionIndex: 64
    SolutionNameMin: Cijk_Alik_Bljk_DB_GB_MT32x128x8_SN_PLR1_SU32_SUM3_SUS256_SNLL0_TT4_4_WG8_32_1_WGM15
    SolutionIndex: 65
    SolutionNameMin: Cijk_Alik_Bljk_DB_GB_MT64x64x8_SN_PLR1_SU32_SUM3_SUS256_SNLL0_TT4_4_WG16_16_1_WGM15
    SolutionIndex: 66
    SolutionNameMin: Cijk_Alik_Bljk_DB_GB_MT16x16x4_SN_PLR1_SU0_SUM0_SUS256_SNLL1_TT2_2_WG8_8_1_WGM1
    SolutionIndex: 67
    SolutionNameMin: Cijk_Alik_Bljk_DB_GB_MT8x8x8_SN_PLR0_SU0_SUM0_SUS256_SNLL1_TT1_1_WG8_8_1_WGM1
    SolutionIndex: 68
    SolutionNameMin: Cijk_Alik_Bljk_DB_GB_MT8x8x8_SN_PLR1_SU0_SUM0_SUS256_SNLL0_TT1_1_WG8_8_1_WGM1
    SolutionIndex: 69
    SolutionNameMin: Cijk_Alik_Bljk_DB_GB_MT16x8x8_SN_PLR1_SU0_SUM0_SUS256_SNLL0_TT2_1_WG8_8_1_WGM1
    SolutionIndex: 70
    SolutionNameMin: Cijk_Alik_Bljk_DB_GB_MT32x32x8_SN_PLR1_SU0_SUM0_SUS256_SNLL0_TT2_2_WG16_16_1_WGM1
    SolutionIndex: 71
    SolutionNameMin: Cijk_Alik_Bljk_DB_GB_MT16x16x8_SN_PLR0_SU32_SUM0_SUS128_SNLL0_TT2_2_WG8_8_1_WGM1
    SolutionIndex: 72
    SolutionNameMin: Cijk_Alik_Bljk_DB_GB_MT16x16x8_SN_PLR1_SU32_SUM3_SUS128_SNLL0_TT2_2_WG8_8_1_WGM1
    SolutionIndex: 73
    SolutionNameMin: Cijk_Alik_Bljk_DB_GB_MT32x32x8_SN_PLR0_SU32_SUM3_SUS128_SNLL0_TT2_2_WG16_16_1_WGM1
    SolutionIndex: 74
    SolutionNameMin: Cijk_Alik_Bljk_DB_GB_MT32x32x8_SN_PLR1_SU32_SUM0_SUS256_SNLL0_TT2_2_WG16_16_1_WGM1
    SolutionIndex: 75
    SolutionNameMin: Cijk_Alik_Bljk_DB_GB_MT16x16x8_SN_PLR1_SU32_SUM3_SUS256_SNLL0_TT2_2_WG8_8_1_WGM1
    SolutionIndex: 76
    SolutionNameMin: Cijk_Alik_Bljk_DB_GB_MT32x32x8_SN_PLR1_SU32_SUM3_SUS256_SNLL0_TT2_2_WG16_16_1_WGM1
    SolutionIndex: 77
    SolutionNameMin: Cijk_Alik_Bljk_DB_GB_MT16x16x4_SN_PLR1_SU0_SUM0_SUS256_SNLL0_TT2_2_WG8_8_1_WGM8
    SolutionIndex: 78
    SolutionNameMin: Cijk_Alik_Bljk_DB_GB_MT8x8x8_SN_PLR1_SU0_SUM0_SUS256_SNLL0_TT1_1_WG8_8_1_WGM8
    SolutionIndex: 79
    SolutionNameMin: Cijk_Alik_Bljk_DB_GB_MT32x32x8_SN_PLR1_SU0_SUM0_SUS256_SNLL0_TT2_2_WG16_16_1_WGM8
    SolutionIndex: 80
    SolutionNameMin: Cijk_Alik_Bljk_DB_GB_MT16x16x8_SN_PLR1_SU32_SUM0_SUS128_SNLL0_TT2_2_WG8_8_1_WGM8
    SolutionIndex: 81
    SolutionNameMin: Cijk_Alik_Bljk_DB_GB_MT32x32x8_SN_PLR1_SU32_SUM0_SUS128_SNLL0_TT2_2_WG16_16_1_WGM8
    SolutionIndex: 82
    SolutionNameMin: Cijk_Alik_Bljk_DB_GB_MT16x16x4_SN_PLR1_SU32_SUM3_SUS128_SNLL0_TT2_2_WG8_8_1_WGM8
    SolutionIndex: 83
    SolutionNameMin: Cijk_Alik_Bljk_DB_GB_MT32x32x8_SN_PLR0_SU32_SUM3_SUS128_SNLL0_TT2_2_WG16_16_1_WGM8
    SolutionIndex: 84
    SolutionNameMin: Cijk_Alik_Bljk_DB_GB_MT32x32x8_SN_PLR1_SU32_SUM0_SUS256_SNLL0_TT2_2_WG16_16_1_WGM8
    SolutionIndex: 85
    SolutionNameMin: Cijk_Alik_Bljk_DB_GB_MT32x32x8_SN_PLR1_SU0_SUM0_SUS256_SNLL0_TT2_2_WG16_16_1_WGM15
    SolutionIndex: 86
    SolutionNameMin: Cijk_Alik_Bljk_DB_GB_MT32x32x8_SN_PLR1_SU32_SUM3_SUS128_SNLL0_TT2_2_WG16_16_1_WGM15
    SolutionIndex: 87
    SolutionNameMin: Cijk_Alik_Bljk_DB_GB_MT16x16x4_SN_PLR1_SU32_SUM0_SUS256_SNLL0_TT2_2_WG8_8_1_WGM15
    SolutionIndex: 88
    SolutionNameMin: Cijk_Alik_Bljk_DB_GB_MT32x32x8_SN_PLR1_SU32_SUM0_SUS256_SNLL0_TT2_2_WG16_16_1_WGM15
    SolutionIndex: 89
    SolutionNameMin: Cijk_Alik_Bljk_DB_GB_MT32x32x8_SN_PLR1_SU32_SUM3_SUS256_SNLL0_TT2_2_WG16_16_1_WGM15
    SolutionIndex: 90
    SolutionNameMin: Cijk_Alik_Bljk_DB_GB_MT24x24x8_SN_PLR1_SU0_SUM0_SUS256_SNLL1_TT3_3_WG8_8_1_WGM1
    SolutionIndex: 91
    SolutionNameMin: Cijk_Alik_Bljk_DB_GB_MT48x48x8_SN_PLR1_SU0_SUM0_SUS256_SNLL1_TT6_6_WG8_8_1_WGM8
    SolutionIndex: 92
    SolutionNameMin: Cijk_Alik_Bljk_DB_GB_MT24x24x8_SN_PLR1_SU0_SUM0_SUS256_SNLL1_TT3_3_WG8_8_1_WGM15
    SolutionIndex: 93
    SolutionNameMin: Cijk_Alik_Bljk_DB_GB_MT24x24x8_SN_PLR1_SU0_SUM0_SUS256_SNLL0_TT3_3_WG8_8_1_WGM1
    SolutionIndex: 94
    SolutionNameMin: Cijk_Alik_Bljk_DB_GB_MT32x32x8_SN_PLR1_SU0_SUM0_SUS256_SNLL0_TT4_4_WG8_8_1_WGM1
    SolutionIndex: 95
    SolutionNameMin: Cijk_Alik_Bljk_DB_GB_MT40x40x8_SN_PLR1_SU0_SUM0_SUS256_SNLL0_TT5_5_WG8_8_1_WGM1
    SolutionIndex: 96
    SolutionNameMin: Cijk_Alik_Bljk_DB_GB_MT48x48x8_SN_PLR1_SU0_SUM0_SUS256_SNLL0_TT6_6_WG8_8_1_WGM1
    SolutionIndex: 97
    SolutionNameMin: Cijk_Alik_Bljk_DB_GB_MT56x56x8_SN_PLR1_SU0_SUM0_SUS256_SNLL0_TT7_7_WG8_8_1_WGM1
    SolutionIndex: 98
    SolutionNameMin: Cijk_Alik_Bljk_DB_GB_MT24x24x8_SN_PLR1_SU32_SUM0_SUS256_SNLL0_TT3_3_WG8_8_1_WGM1
    SolutionIndex: 99
    SolutionNameMin: Cijk_Alik_Bljk_DB_GB_MT24x24x8_SN_PLR1_SU0_SUM0_SUS256_SNLL0_TT3_3_WG8_8_1_WGM8
    SolutionIndex: 100
    SolutionNameMin: Cijk_Alik_Bljk_DB_GB_MT32x32x8_SN_PLR1_SU0_SUM0_SUS256_SNLL0_TT4_4_WG8_8_1_WGM8
    SolutionIndex: 101
    SolutionNameMin: Cijk_Alik_Bljk_DB_GB_MT40x40x8_SN_PLR1_SU0_SUM0_SUS256_SNLL0_TT5_5_WG8_8_1_WGM8
    SolutionIndex: 102
    SolutionNameMin: Cijk_Alik_Bljk_DB_GB_MT48x48x8_SN_PLR1_SU0_SUM0_SUS256_SNLL0_TT6_6_WG8_8_1_WGM8
    SolutionIndex: 103
    SolutionNameMin: Cijk_Alik_Bljk_DB_GB_MT48x48x8_SN_PLR1_SU32_SUM0_SUS128_SNLL0_TT6_6_WG8_8_1_WGM8
    SolutionIndex: 104
    SolutionNameMin: Cijk_Alik_Bljk_DB_GB_MT24x24x8_SN_PLR1_SU0_SUM0_SUS256_SNLL0_TT3_3_WG8_8_1_WGM15
    SolutionIndex: 105
    SolutionNameMin: Cijk_Alik_Bljk_DB_GB_MT32x32x8_SN_PLR1_SU0_SUM0_SUS256_SNLL0_TT4_4_WG8_8_1_WGM15
    SolutionIndex: 106
    SolutionNameMin: Cijk_Alik_Bljk_DB_GB_MT40x40x8_SN_PLR1_SU0_SUM0_SUS256_SNLL0_TT5_5_WG8_8_1_WGM15
    SolutionIndex: 107
    SolutionNameMin: Cijk_Alik_Bljk_DB_GB_MT48x48x8_SN_PLR1_SU0_SUM0_SUS256_SNLL0_TT6_6_WG8_8_1_WGM15
    SolutionIndex: 108
    SolutionNameMin: Cijk_Alik_Bljk_DB_GB_MT24x24x8_SN_PLR1_SU32_SUM0_SUS256_SNLL0_TT3_3_WG8_8_1_WGM15
    SolutionIndex: 109
    SolutionNameMin: Cijk_Alik_Bljk_DB_GB_MT40x40x8_SN_PLR1_SU32_SUM0_SUS256_SNLL0_TT5_5_WG8_8_1_WGM15
    SolutionIndex: 110
    SolutionNameMin: Cijk_Alik_Bljk_DB_GB_MT64x128x8_SN_PLR0_SU0_SUM0_SUS256_SNLL1_TT4_8_WG16_16_1_WGM8
    SolutionIndex: 111
    SolutionNameMin: Cijk_Alik_Bljk_DB_GB_MT128x64x8_SN_PLR0_SU0_SUM0_SUS256_SNLL1_TT4_8_WG32_8_1_WGM8
    SolutionIndex: 112
    SolutionNameMin: Cijk_Alik_Bljk_DB_GB_MT64x128x8_SN_PLR0_SU32_SUM0_SUS128_SNLL1_TT4_8_WG16_16_1_WGM8
    SolutionIndex: 113
    SolutionNameMin: Cijk_Alik_Bljk_DB_GB_MT128x64x8_SN_PLR0_SU32_SUM0_SUS256_SNLL1_TT8_4_WG16_16_1_WGM8
    SolutionIndex: 114
    SolutionNameMin: Cijk_Alik_Bljk_DB_GB_MT128x64x8_SN_PLR0_SU32_SUM0_SUS256_SNLL1_TT4_8_WG32_8_1_WGM8
    SolutionIndex: 115
    SolutionNameMin: Cijk_Alik_Bljk_DB_GB_MT64x128x8_SN_PLR0_SU0_SUM0_SUS256_SNLL0_TT8_4_WG8_32_1_WGM1
    SolutionIndex: 116
    SolutionNameMin: Cijk_Alik_Bljk_DB_GB_MT64x128x8_SN_PLR0_SU0_SUM0_SUS256_SNLL0_TT4_8_WG16_16_1_WGM1
    SolutionIndex: 117
    SolutionNameMin: Cijk_Alik_Bljk_DB_GB_MT128x64x8_SN_PLR0_SU32_SUM0_SUS256_SNLL0_TT8_4_WG16_16_1_WGM1
    SolutionIndex: 118
    SolutionNameMin: Cijk_Alik_Bljk_DB_GB_MT64x128x8_SN_PLR0_SU0_SUM0_SUS256_SNLL0_TT8_4_WG8_32_1_WGM8
    SolutionIndex: 119
    SolutionNameMin: Cijk_Alik_Bljk_DB_GB_MT128x64x8_SN_PLR0_SU0_SUM0_SUS256_SNLL0_TT4_8_WG32_8_1_WGM8
    SolutionIndex: 120
    SolutionNameMin: Cijk_Alik_Bljk_DB_GB_MT64x128x8_SN_PLR0_SU0_SUM0_SUS256_SNLL0_TT8_4_WG8_32_1_WGM15
    SolutionIndex: 121
    SolutionNameMin: Cijk_Alik_Bljk_DB_GB_MT64x128x8_SN_PLR0_SU0_SUM0_SUS256_SNLL0_TT4_8_WG16_16_1_WGM15
    SolutionIndex: 122
    SolutionNameMin: Cijk_Alik_Bljk_DB_GB_MT128x64x8_SN_PLR0_SU0_SUM0_SUS256_SNLL0_TT4_8_WG32_8_1_WGM15
- - - [192, 192, 1000, 32, 192, 192, 32, 32]
    - [2, 4760.0]
  - - [1536, 1536, 168, 32, 1536, 1536, 32, 32]
    - [27, 5360.0]
  - - [1536, 32, 168, 1536, 1536, 1536, 1536, 1536]
    - [56, 4629.0]
  - - [32, 1536, 168, 32, 32, 32, 32, 32]
    - [38, 2900.0]
  - - [384, 384, 1024, 384, 384, 384, 384, 384]
    - [40, 6352.0]
  - - [1, 1, 1000, 1, 1, 1, 1, 1]
    - [66, 0.0]
  - - [2, 2, 1000, 2, 2, 2, 2, 2]
    - [66, 2.0]
  - - [3, 3, 1000, 3, 3, 3, 3, 3]
    - [69, 8.0]
  - - [4, 4, 1000, 4, 4, 4, 4, 4]
    - [68, 18.0]
  - - [5, 5, 1000, 5, 5, 5, 5, 5]
    - [67, 33.0]
  - - [6, 6, 1000, 6, 6, 6, 6, 6]
    - [68, 56.0]
  - - [7, 7, 1000, 7, 7, 7, 7, 7]
    - [68, 87.0]
  - - [8, 8, 1000, 8, 8, 8, 8, 8]
    - [78, 139.0]
  - - [9, 9, 1000, 9, 9, 9, 9, 9]
    - [77, 157.0]
  - - [10, 10, 1000, 10, 10, 10, 10, 10]
    - [72, 202.0]
  - - [11, 11, 1000, 11, 11, 11, 11, 11]
    - [87, 252.0]
  - - [12, 12, 1000, 12, 12, 12, 12, 12]
    - [82, 338.0]
  - - [13, 13, 1000, 13, 13, 13, 13, 13]
    - [75, 361.0]
  - - [14, 14, 1000, 14, 14, 14, 14, 14]
    - [72, 418.0]
  - - [15, 15, 1000, 15, 15, 15, 15, 15]
    - [71, 485.0]
  - - [16, 16, 1000, 16, 16, 16, 16, 16]
    - [80, 721.0]
  - - [17, 17, 1000, 17, 17, 17, 17, 17]
    - [70, 421.0]
  - - [18, 18, 1000, 18, 18, 18, 18, 18]
    - [83, 489.0]
  - - [19, 19, 1000, 19, 19, 19, 19, 19]
    - [86, 557.0]
  - - [20, 20, 1000, 20, 20, 20, 20, 20]
    - [73, 641.0]
  - - [21, 21, 1000, 21, 21, 21, 21, 21]
    - [88, 710.0]
  - - [22, 22, 1000, 22, 22, 22, 22, 22]
    - [86, 792.0]
  - - [23, 23, 1000, 23, 23, 23, 23, 23]
    - [89, 859.0]
  - - [24, 24, 1000, 24, 24, 24, 24, 24]
    - [79, 1054.0]
  - - [25, 25, 1000, 25, 25, 25, 25, 25]
    - [81, 972.0]
  - - [26, 26, 1000, 26, 26, 26, 26, 26]
    - [84, 1072.0]
  - - [27, 27, 1000, 27, 27, 27, 27, 27]
    - [86, 1139.0]
  - - [28, 28, 1000, 28, 28, 28, 28, 28]
    - [76, 1276.0]
  - - [29, 29, 1000, 29, 29, 29, 29, 29]
    - [74, 1276.0]
  - - [30, 30, 1000, 30, 30, 30, 30, 30]
    - [70, 1383.0]
  - - [31, 31, 1000, 31, 31, 31, 31, 31]
    - [85, 1432.0]
  - - [32, 32, 1000, 32, 32, 32, 32, 32]
    - [105, 1905.0]
  - - [33, 33, 1000, 33, 33, 33, 33, 33]
    - [109, 1167.0]
  - - [34, 34, 1000, 34, 34, 34, 34, 34]
    - [95, 1273.0]
  - - [35, 35, 1000, 35, 35, 35, 35, 35]
    - [95, 1298.0]
  - - [36, 36, 1000, 36, 36, 36, 36, 36]
    - [95, 1480.0]
  - - [37, 37, 1000, 37, 37, 37, 37, 37]
    - [95, 1442.0]
  - - [38, 38, 1000, 38, 38, 38, 38, 38]
    - [101, 1552.0]
  - - [39, 39, 1000, 39, 39, 39, 39, 39]
    - [95, 1591.0]
  - - [40, 40, 1000, 40, 40, 40, 40, 40]
    - [106, 2139.0]
  - - [41, 41, 1000, 41, 41, 41, 41, 41]
    - [33, 1638.0]
  - - [42, 42, 1000, 42, 42, 42, 42, 42]
    - [26, 1721.0]
  - - [43, 43, 1000, 43, 43, 43, 43, 43]
    - [26, 1753.0]
  - - [44, 44, 1000, 44, 44, 44, 44, 44]
    - [104, 2096.0]
  - - [45, 45, 1000, 45, 45, 45, 45, 45]
    - [26, 1911.0]
  - - [46, 46, 1000, 46, 46, 46, 46, 46]
    - [108, 2024.0]
  - - [47, 47, 1000, 47, 47, 47, 47, 47]
    - [37, 2067.0]
  - - [48, 48, 1000, 48, 48, 48, 48, 48]
    - [99, 2868.0]
  - - [49, 49, 1000, 49, 49, 49, 49, 49]
    - [30, 2242.0]
  - - [50, 50, 1000, 50, 50, 50, 50, 50]
    - [37, 2350.0]
  - - [51, 51, 1000, 51, 51, 51, 51, 51]
    - [30, 2362.0]
  - - [52, 52, 1000, 52, 52, 52, 52, 52]
    - [37, 2570.0]
  - - [53, 53, 1000, 53, 53, 53, 53, 53]
    - [51, 2522.0]
  - - [54, 54, 1000, 54, 54, 54, 54, 54]
    - [26, 2642.0]
  - - [55, 55, 1000, 55, 55, 55, 55, 55]
    - [39, 2683.0]
  - - [56, 56, 1000, 56, 56, 56, 56, 56]
    - [26, 3301.0]
  - - [57, 57, 1000, 57, 57, 57, 57, 57]
    - [33, 2879.0]
  - - [58, 58, 1000, 58, 58, 58, 58, 58]
    - [37, 3007.0]
  - - [59, 59, 1000, 59, 59, 59, 59, 59]
    - [37, 3024.0]
  - - [60, 60, 1000, 60, 60, 60, 60, 60]
    - [26, 3285.0]
  - - [61, 61, 1000, 61, 61, 61, 61, 61]
    - [26, 3142.0]
  - - [62, 62, 1000, 62, 62, 62, 62, 62]
    - [35, 3277.0]
  - - [63, 63, 1000, 63, 63, 63, 63, 63]
    - [16, 3318.0]
  - - [64, 64, 1000, 64, 64, 64, 64, 64]
    - [1, 4164.0]
  - - [65, 65, 1000, 65, 65, 65, 65, 65]
    - [92, 2101.0]
  - - [66, 66, 1000, 66, 66, 66, 66, 66]
    - [104, 2299.0]
  - - [67, 67, 1000, 67, 67, 67, 67, 67]
    - [90, 2205.0]
  - - [68, 68, 1000, 68, 68, 68, 68, 68]
    - [98, 2701.0]
  - - [69, 69, 1000, 69, 69, 69, 69, 69]
    - [92, 2331.0]
  - - [70, 70, 1000, 70, 70, 70, 70, 70]
    - [104, 2566.0]
  - - [71, 71, 1000, 71, 71, 71, 71, 71]
    - [104, 2488.0]
  - - [72, 72, 1000, 72, 72, 72, 72, 72]
    - [93, 3513.0]
  - - [73, 73, 1000, 73, 73, 73, 73, 73]
    - [101, 2535.0]
  - - [74, 74, 1000, 74, 74, 74, 74, 74]
    - [95, 2638.0]
  - - [75, 75, 1000, 75, 75, 75, 75, 75]
    - [95, 2671.0]
  - - [76, 76, 1000, 76, 76, 76, 76, 76]
    - [94, 2862.0]
  - - [77, 77, 1000, 77, 77, 77, 77, 77]
    - [95, 2821.0]
  - - [78, 78, 1000, 78, 78, 78, 78, 78]
    - [95, 2945.0]
  - - [79, 79, 1000, 79, 79, 79, 79, 79]
    - [95, 2953.0]
  - - [80, 80, 1000, 80, 80, 80, 80, 80]
    - [95, 3441.0]
  - - [81, 81, 1000, 81, 81, 81, 81, 81]
    - [107, 2797.0]
  - - [82, 82, 1000, 82, 82, 82, 82, 82]
    - [107, 2907.0]
  - - [83, 83, 1000, 83, 83, 83, 83, 83]
    - [107, 2904.0]
  - - [84, 84, 1000, 84, 84, 84, 84, 84]
    - [105, 3272.0]
  - - [85, 85, 1000, 85, 85, 85, 85, 85]
    - [102, 2963.0]
  - - [86, 86, 1000, 86, 86, 86, 86, 86]
    - [91, 3115.0]
  - - [87, 87, 1000, 87, 87, 87, 87, 87]
    - [102, 3157.0]
  - - [88, 88, 1000, 88, 88, 88, 88, 88]
    - [105, 4058.0]
  - - [89, 89, 1000, 89, 89, 89, 89, 89]
    - [107, 3253.0]
  - - [90, 90, 1000, 90, 90, 90, 90, 90]
    - [107, 3400.0]
  - - [91, 91, 1000, 91, 91, 91, 91, 91]
    - [96, 3369.0]
  - - [92, 92, 1000, 92, 92, 92, 92, 92]
    - [94, 3718.0]
  - - [93, 93, 1000, 93, 93, 93, 93, 93]
    - [107, 3465.0]
  - - [94, 94, 1000, 94, 94, 94, 94, 94]
    - [91, 3662.0]
  - - [95, 95, 1000, 95, 95, 95, 95, 95]
    - [103, 3658.0]
  - - [96, 96, 1000, 96, 96, 96, 96, 96]
    - [100, 4704.0]
  - - [97, 97, 1000, 97, 97, 97, 97, 97]
    - [27, 3257.0]
  - - [98, 98, 1000, 98, 98, 98, 98, 98]
    - [27, 3356.0]
  - - [99, 99, 1000, 99, 99, 99, 99, 99]
    - [27, 3401.0]
  - - [100, 100, 1000, 100, 100, 100, 100, 100]
    - [55, 3553.0]
  - - [101, 101, 1000, 101, 101, 101, 101, 101]
    - [40, 3552.0]
  - - [102, 102, 1000, 102, 102, 102, 102, 102]
    - [39, 3556.0]
  - - [103, 103, 1000, 103, 103, 103, 103, 103]
    - [40, 3684.0]
  - - [104, 104, 1000, 104, 104, 104, 104, 104]
    - [55, 3926.0]
  - - [105, 105, 1000, 105, 105, 105, 105, 105]
    - [27, 3774.0]
  - - [106, 106, 1000, 106, 106, 106, 106, 106]
    - [27, 3880.0]
  - - [107, 107, 1000, 107, 107, 107, 107, 107]
    - [55, 3908.0]
  - - [108, 108, 1000, 108, 108, 108, 108, 108]
    - [27, 4102.0]
  - - [109, 109, 1000, 109, 109, 109, 109, 109]
    - [27, 4074.0]
  - - [110, 110, 1000, 110, 110, 110, 110, 110]
    - [27, 4206.0]
  - - [111, 111, 1000, 111, 111, 111, 111, 111]
    - [27, 4230.0]
  - - [112, 112, 1000, 112, 112, 112, 112, 112]
    - [97, 4552.0]
  - - [113, 113, 1000, 113, 113, 113, 113, 113]
    - [26, 4251.0]
  - - [114, 114, 1000, 114, 114, 114, 114, 114]
    - [26, 4371.0]
  - - [115, 115, 1000, 115, 115, 115, 115, 115]
    - [26, 4395.0]
  - - [116, 116, 1000, 116, 116, 116, 116, 116]
    - [55, 4676.0]
  - - [117, 117, 1000, 117, 117, 117, 117, 117]
    - [40, 4574.0]
  - - [118, 118, 1000, 118, 118, 118, 118, 118]
    - [55, 4728.0]
  - - [119, 119, 1000, 119, 119, 119, 119, 119]
    - [27, 4746.0]
  - - [120, 120, 1000, 120, 120, 120, 120, 120]
    - [35, 5177.0]
  - - [121, 121, 1000, 121, 121, 121, 121, 121]
    - [40, 4760.0]
  - - [122, 122, 1000, 122, 122, 122, 122, 122]
    - [26, 4891.0]
  - - [123, 123, 1000, 123, 123, 123, 123, 123]
    - [26, 4897.0]
  - - [124, 124, 1000, 124, 124, 124, 124, 124]
    - [55, 5188.0]
  - - [125, 125, 1000, 125, 125, 125, 125, 125]
    - [26, 5016.0]
  - - [126, 126, 1000, 126, 126, 126, 126, 126]
    - [27, 5140.0]
  - - [127, 127, 1000, 127, 127, 127, 127, 127]
    - [44, 4980.0]
  - - [128, 128, 1000, 128, 128, 128, 128, 128]
    - [54, 5882.0]
  - - [129, 129, 1000, 129, 129, 129, 129, 129]
    - [102, 3664.0]
  - - [130, 130, 1000, 130, 130, 130, 130, 130]
    - [96, 3814.0]
  - - [131, 131, 1000, 131, 131, 131, 131, 131]
    - [102, 3824.0]
  - - [132, 132, 1000, 132, 132, 132, 132, 132]
    - [102, 4099.0]
  - - [133, 133, 1000, 133, 133, 133, 133, 133]
    - [96, 3965.0]
  - - [134, 134, 1000, 134, 134, 134, 134, 134]
    - [96, 4094.0]
  - - [135, 135, 1000, 135, 135, 135, 135, 135]
    - [107, 4092.0]
  - - [136, 136, 1000, 136, 136, 136, 136, 136]
    - [107, 4608.0]
  - - [137, 137, 1000, 137, 137, 137, 137, 137]
    - [107, 4142.0]
  - - [138, 138, 1000, 138, 138, 138, 138, 138]
    - [107, 4333.0]
  - - [139, 139, 1000, 139, 139, 139, 139, 139]
    - [102, 4293.0]
  - - [140, 140, 1000, 140, 140, 140, 140, 140]
    - [102, 4607.0]
  - - [141, 141, 1000, 141, 141, 141, 141, 141]
    - [102, 4420.0]
  - - [142, 142, 1000, 142, 142, 142, 142, 142]
    - [102, 4576.0]
  - - [143, 143, 1000, 143, 143, 143, 143, 143]
    - [96, 4502.0]
  - - [144, 144, 1000, 144, 144, 144, 144, 144]
    - [107, 5239.0]
  - - [145, 145, 1000, 145, 145, 145, 145, 145]
    - [97, 3528.0]
  - - [146, 146, 1000, 146, 146, 146, 146, 146]
    - [97, 3617.0]
  - - [147, 147, 1000, 147, 147, 147, 147, 147]
    - [97, 3600.0]
  - - [148, 148, 1000, 148, 148, 148, 148, 148]
    - [94, 4031.0]
  - - [149, 149, 1000, 149, 149, 149, 149, 149]
    - [97, 3718.0]
  - - [150, 150, 1000, 150, 150, 150, 150, 150]
    - [97, 3815.0]
  - - [32, 32, 8, 32, 32, 32, 32, 32]
    - [57, 35.0]
  - - [32, 32, 8, 64, 32, 32, 64, 64]
    - [37, 48.0]
  - - [32, 32, 8, 128, 32, 32, 128, 128]
    - [33, 60.0]
  - - [32, 32, 8, 256, 32, 32, 256, 256]
    - [26, 67.0]
  - - [32, 32, 8, 512, 32, 32, 512, 512]
    - [48, 70.0]
  - - [32, 32, 8, 1024, 32, 32, 1024, 1024]
    - [7, 72.0]
  - - [32, 32, 8, 2048, 32, 32, 2048, 2048]
    - [1, 74.0]
  - - [32, 64, 8, 32, 32, 32, 32, 32]
    - [37, 67.0]
  - - [32, 64, 8, 64, 32, 32, 64, 64]
    - [26, 92.0]
  - - [32, 64, 8, 128, 32, 32, 128, 128]
    - [16, 111.0]
  - - [32, 64, 8, 256, 32, 32, 256, 256]
    - [9, 125.0]
  - - [32, 64, 8, 512, 32, 32, 512, 512]
    - [1, 133.0]
  - - [32, 64, 8, 1024, 32, 32, 1024, 1024]
    - [37, 138.0]
  - - [32, 64, 8, 2048, 32, 32, 2048, 2048]
    - [1, 140.0]
  - - [32, 128, 8, 32, 32, 32, 32, 32]
    - [31, 137.0]
  - - [32, 128, 8, 64, 32, 32, 64, 64]
    - [4, 164.0]
  - - [32, 128, 8, 128, 32, 32, 128, 128]
    - [23, 189.0]
  - - [32, 128, 8, 256, 32, 32, 256, 256]
    - [12, 230.0]
  - - [32, 128, 8, 512, 32, 32, 512, 512]
    - [18, 258.0]
  - - [32, 128, 8, 1024, 32, 32, 1024, 1024]
    - [26, 274.0]
  - - [32, 128, 8, 2048, 32, 32, 2048, 2048]
    - [12, 285.0]
  - - [32, 256, 8, 32, 32, 32, 32, 32]
    - [11, 189.0]
  - - [32, 256, 8, 64, 32, 32, 64, 64]
    - [17, 274.0]
  - - [32, 256, 8, 128, 32, 32, 128, 128]
    - [12, 367.0]
  - - [32, 256, 8, 256, 32, 32, 256, 256]
    - [1, 461.0]
  - - [32, 256, 8, 512, 32, 32, 512, 512]
    - [39, 518.0]
  - - [32, 256, 8, 1024, 32, 32, 1024, 1024]
    - [18, 550.0]
  - - [32, 256, 8, 2048, 32, 32, 2048, 2048]
    - [26, 570.0]
  - - [32, 512, 8, 32, 32, 32, 32, 32]
    - [28, 423.0]
  - - [32, 512, 8, 64, 32, 32, 64, 64]
    - [0, 543.0]
  - - [32, 512, 8, 128, 32, 32, 128, 128]
    - [12, 754.0]
  - - [32, 512, 8, 256, 32, 32, 256, 256]
    - [5, 914.0]
  - - [32, 512, 8, 512, 32, 32, 512, 512]
    - [12, 1028.0]
  - - [32, 512, 8, 1024, 32, 32, 1024, 1024]
    - [12, 1097.0]
  - - [32, 512, 8, 2048, 32, 32, 2048, 2048]
    - [26, 1138.0]
  - - [32, 1024, 8, 32, 32, 32, 32, 32]
    - [35, 867.0]
  - - [32, 1024, 8, 64, 32, 32, 64, 64]
    - [54, 1152.0]
  - - [32, 1024, 8, 128, 32, 32, 128, 128]
    - [0, 1403.0]
  - - [32, 1024, 8, 256, 32, 32, 256, 256]
    - [32, 1607.0]
  - - [32, 1024, 8, 512, 32, 32, 512, 512]
    - [25, 1766.0]
  - - [32, 1024, 8, 1024, 32, 32, 1024, 1024]
    - [21, 1877.0]
  - - [32, 1024, 8, 2048, 32, 32, 2048, 2048]
    - [4, 1972.0]
  - - [32, 2048, 8, 32, 32, 32, 32, 32]
    - [52, 1626.0]
  - - [32, 2048, 8, 64, 32, 32, 64, 64]
    - [64, 1997.0]
  - - [32, 2048, 8, 128, 32, 32, 128, 128]
    - [43, 2324.0]
  - - [32, 2048, 8, 256, 32, 32, 256, 256]
    - [0, 2493.0]
  - - [32, 2048, 8, 512, 32, 32, 512, 512]
    - [53, 2613.0]
  - - [32, 2048, 8, 1024, 32, 32, 1024, 1024]
    - [29, 2685.0]
  - - [32, 2048, 8, 2048, 32, 32, 2048, 2048]
    - [53, 2725.0]
  - - [64, 32, 8, 32, 64, 64, 32, 32]
    - [12, 43.0]
  - - [64, 32, 8, 64, 64, 64, 64, 64]
    - [0, 67.0]
  - - [64, 32, 8, 128, 64, 64, 128, 128]
    - [1, 90.0]
  - - [64, 32, 8, 256, 64, 64, 256, 256]
    - [12, 109.0]
  - - [64, 32, 8, 512, 64, 64, 512, 512]
    - [39, 124.0]
  - - [64, 32, 8, 1024, 64, 64, 1024, 1024]
    - [39, 134.0]
  - - [64, 32, 8, 2048, 64, 64, 2048, 2048]
    - [30, 138.0]
  - - [64, 64, 8, 32, 64, 64, 32, 32]
    - [12, 100.0]
  - - [64, 64, 8, 64, 64, 64, 64, 64]
    - [15, 145.0]
  - - [64, 64, 8, 128, 64, 64, 128, 128]
    - [7, 185.0]
  - - [64, 64, 8, 256, 64, 64, 256, 256]
    - [1, 221.0]
  - - [64, 64, 8, 512, 64, 64, 512, 512]
    - [12, 248.0]
  - - [64, 64, 8, 1024, 64, 64, 1024, 1024]
    - [1, 261.0]
  - - [64, 64, 8, 2048, 64, 64, 2048, 2048]
    - [39, 271.0]
  - - [64, 128, 8, 32, 64, 64, 32, 32]
    - [22, 196.0]
  - - [64, 128, 8, 64, 64, 64, 64, 64]
    - [1, 295.0]
  - - [64, 128, 8, 128, 64, 64, 128, 128]
    - [18, 391.0]
  - - [64, 128, 8, 256, 64, 64, 256, 256]
    - [60, 453.0]
  - - [64, 128, 8, 512, 64, 64, 512, 512]
    - [16, 514.0]
  - - [64, 128, 8, 1024, 64, 64, 1024, 1024]
    - [54, 529.0]
  - - [64, 128, 8, 2048, 64, 64, 2048, 2048]
    - [1, 547.0]
  - - [64, 256, 8, 32, 64, 64, 32, 32]
    - [18, 397.0]
  - - [64, 256, 8, 64, 64, 64, 64, 64]
    - [1, 596.0]
  - - [64, 256, 8, 128, 64, 64, 128, 128]
    - [9, 771.0]
  - - [64, 256, 8, 256, 64, 64, 256, 256]
    - [65, 916.0]
  - - [64, 256, 8, 512, 64, 64, 512, 512]
    - [26, 1011.0]
  - - [64, 256, 8, 1024, 64, 64, 1024, 1024]
    - [26, 1058.0]
  - - [64, 256, 8, 2048, 64, 64, 2048, 2048]
    - [54, 1097.0]
  - - [64, 512, 8, 32, 64, 64, 32, 32]
    - [28, 839.0]
  - - [64, 512, 8, 64, 64, 64, 64, 64]
    - [18, 1146.0]
  - - [64, 512, 8, 128, 64, 64, 128, 128]
    - [1, 1565.0]
  - - [64, 512, 8, 256, 64, 64, 256, 256]
    - [9, 1860.0]
  - - [64, 512, 8, 512, 64, 64, 512, 512]
    - [26, 2012.0]
  - - [64, 512, 8, 1024, 64, 64, 1024, 1024]
    - [26, 2129.0]
  - - [64, 512, 8, 2048, 64, 64, 2048, 2048]
    - [12, 2198.0]
  - - [64, 1024, 8, 32, 64, 64, 32, 32]
    - [26, 1808.0]
  - - [64, 1024, 8, 64, 64, 64, 64, 64]
    - [51, 2305.0]
  - - [64, 1024, 8, 128, 64, 64, 128, 128]
    - [54, 2724.0]
  - - [64, 1024, 8, 256, 64, 64, 256, 256]
    - [60, 2949.0]
  - - [64, 1024, 8, 512, 64, 64, 512, 512]
    - [54, 3084.0]
  - - [64, 1024, 8, 1024, 64, 64, 1024, 1024]
    - [39, 3167.0]
  - - [64, 1024, 8, 2048, 64, 64, 2048, 2048]
    - [39, 3195.0]
  - - [64, 2048, 8, 32, 64, 64, 32, 32]
    - [40, 2655.0]
  - - [64, 2048, 8, 64, 64, 64, 64, 64]
    - [33, 3290.0]
  - - [64, 2048, 8, 128, 64, 64, 128, 128]
    - [37, 3745.0]
  - - [64, 2048, 8, 256, 64, 64, 256, 256]
    - [60, 4062.0]
  - - [64, 2048, 8, 512, 64, 64, 512, 512]
    - [62, 4207.0]
  - - [64, 2048, 8, 1024, 64, 64, 1024, 1024]
    - [60, 4268.0]
  - - [64, 2048, 8, 2048, 64, 64, 2048, 2048]
    - [48, 4304.0]
  - - [128, 32, 8, 32, 128, 128, 32, 32]
    - [18, 90.0]
  - - [128, 32, 8, 64, 128, 128, 64, 64]
    - [1, 135.0]
  - - [128, 32, 8, 128, 128, 128, 128, 128]
    - [12, 181.0]
  - - [128, 32, 8, 256, 128, 128, 256, 256]
    - [18, 220.0]
  - - [128, 32, 8, 512, 128, 128, 512, 512]
    - [12, 250.0]
  - - [128, 32, 8, 1024, 128, 128, 1024, 1024]
    - [22, 268.0]
  - - [128, 32, 8, 2048, 128, 128, 2048, 2048]
    - [48, 278.0]
  - - [128, 64, 8, 32, 128, 128, 32, 32]
    - [1, 194.0]
  - - [128, 64, 8, 64, 128, 128, 64, 64]
    - [18, 295.0]
  - - [128, 64, 8, 128, 128, 128, 128, 128]
    - [1, 376.0]
  - - [128, 64, 8, 256, 128, 128, 256, 256]
    - [12, 446.0]
  - - [128, 64, 8, 512, 128, 128, 512, 512]
    - [12, 491.0]
  - - [128, 64, 8, 1024, 128, 128, 1024, 1024]
    - [39, 523.0]
  - - [128, 64, 8, 2048, 128, 128, 2048, 2048]
    - [26, 541.0]
  - - [128, 128, 8, 32, 128, 128, 32, 32]
    - [18, 400.0]
  - - [128, 128, 8, 64, 128, 128, 64, 64]
    - [5, 570.0]
  - - [128, 128, 8, 128, 128, 128, 128, 128]
    - [1, 760.0]
  - - [128, 128, 8, 256, 128, 128, 256, 256]
    - [12, 898.0]
  - - [128, 128, 8, 512, 128, 128, 512, 512]
    - [54, 994.0]
  - - [128, 128, 8, 1024, 128, 128, 1024, 1024]
    - [54, 1056.0]
  - - [128, 128, 8, 2048, 128, 128, 2048, 2048]
    - [39, 1090.0]
  - - [128, 256, 8, 32, 128, 128, 32, 32]
    - [18, 783.0]
  - - [128, 256, 8, 64, 128, 128, 64, 64]
    - [18, 1192.0]
  - - [128, 256, 8, 128, 128, 128, 128, 128]
    - [24, 1531.0]
  - - [128, 256, 8, 256, 128, 128, 256, 256]
    - [9, 1824.0]
  - - [128, 256, 8, 512, 128, 128, 512, 512]
    - [26, 1997.0]
  - - [128, 256, 8, 1024, 128, 128, 1024, 1024]
    - [39, 2112.0]
  - - [128, 256, 8, 2048, 128, 128, 2048, 2048]
    - [39, 2184.0]
  - - [128, 512, 8, 32, 128, 128, 32, 32]
    - [39, 1808.0]
  - - [128, 512, 8, 64, 128, 128, 64, 64]
    - [39, 2343.0]
  - - [128, 512, 8, 128, 128, 128, 128, 128]
    - [37, 2715.0]
  - - [128, 512, 8, 256, 128, 128, 256, 256]
    - [26, 2959.0]
  - - [128, 512, 8, 512, 128, 128, 512, 512]
    - [26, 3093.0]
  - - [128, 512, 8, 1024, 128, 128, 1024, 1024]
    - [26, 3167.0]
  - - [128, 512, 8, 2048, 128, 128, 2048, 2048]
    - [39, 3203.0]
  - - [128, 1024, 8, 32, 128, 128, 32, 32]
    - [27, 2706.0]
  - - [128, 1024, 8, 64, 128, 128, 64, 64]
    - [55, 3290.0]
  - - [128, 1024, 8, 128, 128, 128, 128, 128]
    - [48, 3745.0]
  - - [128, 1024, 8, 256, 128, 128, 256, 256]
    - [44, 4052.0]
  - - [128, 1024, 8, 512, 128, 128, 512, 512]
    - [44, 4189.0]
  - - [128, 1024, 8, 1024, 128, 128, 1024, 1024]
    - [48, 4266.0]
  - - [128, 1024, 8, 2048, 128, 128, 2048, 2048]
    - [44, 4296.0]
  - - [128, 2048, 8, 32, 128, 128, 32, 32]
    - [37, 3290.0]
  - - [128, 2048, 8, 64, 128, 128, 64, 64]
    - [54, 4237.0]
  - - [128, 2048, 8, 128, 128, 128, 128, 128]
    - [39, 4773.0]
  - - [128, 2048, 8, 256, 128, 128, 256, 256]
    - [39, 5046.0]
  - - [128, 2048, 8, 512, 128, 128, 512, 512]
    - [54, 5178.0]
  - - [128, 2048, 8, 1024, 128, 128, 1024, 1024]
    - [44, 5254.0]
  - - [128, 2048, 8, 2048, 128, 128, 2048, 2048]
    - [54, 5284.0]
  - - [256, 32, 8, 32, 256, 256, 32, 32]
    - [6, 183.0]
  - - [256, 32, 8, 64, 256, 256, 64, 64]
    - [1, 266.0]
  - - [256, 32, 8, 128, 256, 256, 128, 128]
    - [12, 364.0]
  - - [256, 32, 8, 256, 256, 256, 256, 256]
    - [12, 436.0]
  - - [256, 32, 8, 512, 256, 256, 512, 512]
    - [18, 497.0]
  - - [256, 32, 8, 1024, 256, 256, 1024, 1024]
    - [39, 530.0]
  - - [256, 32, 8, 2048, 256, 256, 2048, 2048]
    - [1, 549.0]
  - - [256, 64, 8, 32, 256, 256, 32, 32]
    - [3, 369.0]
  - - [256, 64, 8, 64, 256, 256, 64, 64]
    - [12, 549.0]
  - - [256, 64, 8, 128, 256, 256, 128, 128]
    - [12, 738.0]
  - - [256, 64, 8, 256, 256, 256, 256, 256]
    - [18, 889.0]
  - - [256, 64, 8, 512, 256, 256, 512, 512]
    - [12, 983.0]
  - - [256, 64, 8, 1024, 256, 256, 1024, 1024]
    - [26, 1050.0]
  - - [256, 64, 8, 2048, 256, 256, 2048, 2048]
    - [18, 1078.0]
  - - [256, 128, 8, 32, 256, 256, 32, 32]
    - [8, 738.0]
  - - [256, 128, 8, 64, 256, 256, 64, 64]
    - [18, 1121.0]
  - - [256, 128, 8, 128, 256, 256, 128, 128]
    - [18, 1477.0]
  - - [256, 128, 8, 256, 256, 256, 256, 256]
    - [39, 1781.0]
  - - [256, 128, 8, 512, 256, 256, 512, 512]
    - [54, 1988.0]
  - - [256, 128, 8, 1024, 256, 256, 1024, 1024]
    - [39, 2109.0]
  - - [256, 128, 8, 2048, 256, 256, 2048, 2048]
    - [39, 2173.0]
  - - [256, 256, 8, 32, 256, 256, 32, 32]
    - [30, 1719.0]
  - - [256, 256, 8, 64, 256, 256, 64, 64]
    - [37, 2343.0]
  - - [256, 256, 8, 128, 256, 256, 128, 128]
    - [26, 2697.0]
  - - [256, 256, 8, 256, 256, 256, 256, 256]
    - [30, 2949.0]
  - - [256, 256, 8, 512, 256, 256, 512, 512]
    - [1, 3087.0]
  - - [256, 256, 8, 1024, 256, 256, 1024, 1024]
    - [26, 3160.0]
  - - [256, 256, 8, 2048, 256, 256, 2048, 2048]
    - [39, 3192.0]
  - - [256, 512, 8, 32, 256, 256, 32, 32]
    - [34, 2497.0]
  - - [256, 512, 8, 64, 256, 256, 64, 64]
    - [27, 3142.0]
  - - [256, 512, 8, 128, 256, 256, 128, 128]
    - [44, 3687.0]
  - - [256, 512, 8, 256, 256, 256, 256, 256]
    - [44, 4038.0]
  - - [256, 512, 8, 512, 256, 256, 512, 512]
    - [48, 4184.0]
  - - [256, 512, 8, 1024, 256, 256, 1024, 1024]
    - [60, 4265.0]
  - - [256, 512, 8, 2048, 256, 256, 2048, 2048]
    - [62, 4305.0]
  - - [256, 1024, 8, 32, 256, 256, 32, 32]
    - [44, 3154.0]
  - - [256, 1024, 8, 64, 256, 256, 64, 64]
    - [51, 4122.0]
  - - [256, 1024, 8, 128, 256, 256, 128, 128]
    - [39, 4719.0]
  - - [256, 1024, 8, 256, 256, 256, 256, 256]
    - [39, 5016.0]
  - - [256, 1024, 8, 512, 256, 256, 512, 512]
    - [39, 5178.0]
  - - [256, 1024, 8, 1024, 256, 256, 1024, 1024]
    - [48, 5259.0]
  - - [256, 1024, 8, 2048, 256, 256, 2048, 2048]
    - [39, 5289.0]
  - - [256, 2048, 8, 32, 256, 256, 32, 32]
    - [39, 3687.0]
  - - [256, 2048, 8, 64, 256, 256, 64, 64]
    - [48, 4849.0]
  - - [256, 2048, 8, 128, 256, 256, 128, 128]
    - [39, 5425.0]
  - - [256, 2048, 8, 256, 256, 256, 256, 256]
    - [39, 5685.0]
  - - [256, 2048, 8, 512, 256, 256, 512, 512]
    - [39, 5842.0]
  - - [256, 2048, 8, 1024, 256, 256, 1024, 1024]
    - [39, 5900.0]
  - - [256, 2048, 8, 2048, 256, 256, 2048, 2048]
    - [39, 5940.0]
  - - [512, 32, 8, 32, 512, 512, 32, 32]
    - [59, 413.0]
  - - [512, 32, 8, 64, 512, 512, 64, 64]
    - [50, 530.0]
  - - [512, 32, 8, 128, 512, 512, 128, 128]
    - [1, 708.0]
  - - [512, 32, 8, 256, 512, 512, 256, 256]
    - [18, 889.0]
  - - [512, 32, 8, 512, 512, 512, 512, 512]
    - [18, 995.0]
  - - [512, 32, 8, 1024, 512, 512, 1024, 1024]
    - [54, 1061.0]
  - - [512, 32, 8, 2048, 512, 512, 2048, 2048]
    - [1, 1092.0]
  - - [512, 64, 8, 32, 512, 512, 32, 32]
    - [47, 749.0]
  - - [512, 64, 8, 64, 512, 512, 64, 64]
    - [1, 1121.0]
  - - [512, 64, 8, 128, 512, 512, 128, 128]
    - [12, 1472.0]
  - - [512, 64, 8, 256, 512, 512, 256, 256]
    - [1, 1789.0]
  - - [512, 64, 8, 512, 512, 512, 512, 512]
    - [12, 1974.0]
  - - [512, 64, 8, 1024, 512, 512, 1024, 1024]
    - [39, 2098.0]
  - - [512, 64, 8, 2048, 512, 512, 2048, 2048]
    - [39, 2145.0]
  - - [512, 128, 8, 32, 512, 512, 32, 32]
    - [35, 1777.0]
  - - [512, 128, 8, 64, 512, 512, 64, 64]
    - [30, 2317.0]
  - - [512, 128, 8, 128, 512, 512, 128, 128]
    - [26, 2715.0]
  - - [512, 128, 8, 256, 512, 512, 256, 256]
    - [26, 2959.0]
  - - [512, 128, 8, 512, 512, 512, 512, 512]
    - [26, 3070.0]
  - - [512, 128, 8, 1024, 512, 512, 1024, 1024]
    - [26, 3121.0]
  - - [512, 128, 8, 2048, 512, 512, 2048, 2048]
    - [44, 3160.0]
  - - [512, 256, 8, 32, 512, 512, 32, 32]
    - [55, 2589.0]
  - - [512, 256, 8, 64, 512, 512, 64, 64]
    - [49, 3251.0]
  - - [512, 256, 8, 128, 512, 512, 128, 128]
    - [44, 3695.0]
  - - [512, 256, 8, 256, 512, 512, 256, 256]
    - [48, 4018.0]
  - - [512, 256, 8, 512, 512, 512, 512, 512]
    - [62, 4166.0]
  - - [512, 256, 8, 1024, 512, 512, 1024, 1024]
    - [60, 4249.0]
  - - [512, 256, 8, 2048, 512, 512, 2048, 2048]
    - [48, 4285.0]
  - - [512, 512, 8, 32, 512, 512, 32, 32]
    - [26, 3239.0]
  - - [512, 512, 8, 64, 512, 512, 64, 64]
    - [44, 4173.0]
  - - [512, 512, 8, 128, 512, 512, 128, 128]
    - [26, 4733.0]
  - - [512, 512, 8, 256, 512, 512, 256, 256]
    - [26, 5031.0]
  - - [512, 512, 8, 512, 512, 512, 512, 512]
    - [54, 5162.0]
  - - [512, 512, 8, 1024, 512, 512, 1024, 1024]
    - [44, 5228.0]
  - - [512, 512, 8, 2048, 512, 512, 2048, 2048]
    - [39, 5282.0]
  - - [512, 1024, 8, 32, 512, 512, 32, 32]
    - [48, 3813.0]
  - - [512, 1024, 8, 64, 512, 512, 64, 64]
    - [44, 4870.0]
  - - [512, 1024, 8, 128, 512, 512, 128, 128]
    - [39, 5456.0]
  - - [512, 1024, 8, 256, 512, 512, 256, 256]
    - [39, 5711.0]
  - - [512, 1024, 8, 512, 512, 512, 512, 512]
    - [39, 5839.0]
  - - [512, 1024, 8, 1024, 512, 512, 1024, 1024]
    - [39, 5911.0]
  - - [512, 1024, 8, 2048, 512, 512, 2048, 2048]
    - [39, 5937.0]
  - - [512, 2048, 8, 32, 512, 512, 32, 32]
    - [39, 4231.0]
  - - [512, 2048, 8, 64, 512, 512, 64, 64]
    - [39, 5305.0]
  - - [512, 2048, 8, 128, 512, 512, 128, 128]
    - [51, 5714.0]
  - - [512, 2048, 8, 256, 512, 512, 256, 256]
    - [44, 5880.0]
  - - [512, 2048, 8, 512, 512, 512, 512, 512]
    - [111, 6066.0]
  - - [512, 2048, 8, 1024, 512, 512, 1024, 1024]
    - [114, 6183.0]
  - - [512, 2048, 8, 2048, 512, 512, 2048, 2048]
    - [110, 6265.0]
  - - [1024, 32, 8, 32, 1024, 1024, 32, 32]
    - [30, 839.0]
  - - [1024, 32, 8, 64, 1024, 1024, 64, 64]
    - [35, 1110.0]
  - - [1024, 32, 8, 128, 1024, 1024, 128, 128]
    - [19, 1366.0]
  - - [1024, 32, 8, 256, 1024, 1024, 256, 256]
    - [10, 1536.0]
  - - [1024, 32, 8, 512, 1024, 1024, 512, 512]
    - [14, 1746.0]
  - - [1024, 32, 8, 1024, 1024, 1024, 1024, 1024]
    - [58, 1872.0]
  - - [1024, 32, 8, 2048, 1024, 1024, 2048, 2048]
    - [42, 1970.0]
  - - [1024, 64, 8, 32, 1024, 1024, 32, 32]
    - [48, 1792.0]
  - - [1024, 64, 8, 64, 1024, 1024, 64, 64]
    - [30, 2255.0]
  - - [1024, 64, 8, 128, 1024, 1024, 128, 128]
    - [26, 2655.0]
  - - [1024, 64, 8, 256, 1024, 1024, 256, 256]
    - [54, 2858.0]
  - - [1024, 64, 8, 512, 1024, 1024, 512, 512]
    - [37, 2996.0]
  - - [1024, 64, 8, 1024, 1024, 1024, 1024, 1024]
    - [54, 3085.0]
  - - [1024, 64, 8, 2048, 1024, 1024, 2048, 2048]
    - [54, 3126.0]
  - - [1024, 128, 8, 32, 1024, 1024, 32, 32]
    - [36, 2638.0]
  - - [1024, 128, 8, 64, 1024, 1024, 64, 64]
    - [34, 3277.0]
  - - [1024, 128, 8, 128, 1024, 1024, 128, 128]
    - [48, 3704.0]
  - - [1024, 128, 8, 256, 1024, 1024, 256, 256]
    - [62, 3990.0]
  - - [1024, 128, 8, 512, 1024, 1024, 512, 512]
    - [60, 4135.0]
  - - [1024, 128, 8, 1024, 1024, 1024, 1024, 1024]
    - [44, 4223.0]
  - - [1024, 128, 8, 2048, 1024, 1024, 2048, 2048]
    - [48, 4267.0]
  - - [1024, 256, 8, 32, 1024, 1024, 32, 32]
    - [39, 3290.0]
  - - [1024, 256, 8, 64, 1024, 1024, 64, 64]
    - [26, 4184.0]
  - - [1024, 256, 8, 128, 1024, 1024, 128, 128]
    - [26, 4746.0]
  - - [1024, 256, 8, 256, 1024, 1024, 256, 256]
    - [39, 5016.0]
  - - [1024, 256, 8, 512, 1024, 1024, 512, 512]
    - [39, 5137.0]
  - - [1024, 256, 8, 1024, 1024, 1024, 1024, 1024]
    - [54, 5220.0]
  - - [1024, 256, 8, 2048, 1024, 1024, 2048, 2048]
    - [18, 5260.0]
  - - [1024, 512, 8, 32, 1024, 1024, 32, 32]
    - [26, 3839.0]
  - - [1024, 512, 8, 64, 1024, 1024, 64, 64]
    - [26, 4863.0]
  - - [1024, 512, 8, 128, 1024, 1024, 128, 128]
    - [60, 5430.0]
  - - [1024, 512, 8, 256, 1024, 1024, 256, 256]
    - [26, 5697.0]
  - - [1024, 512, 8, 512, 1024, 1024, 512, 512]
    - [54, 5830.0]
  - - [1024, 512, 8, 1024, 1024, 1024, 1024, 1024]
    - [54, 5900.0]
  - - [1024, 512, 8, 2048, 1024, 1024, 2048, 2048]
    - [54, 5934.0]
  - - [1024, 1024, 8, 32, 1024, 1024, 32, 32]
    - [26, 4274.0]
  - - [1024, 1024, 8, 64, 1024, 1024, 64, 64]
    - [33, 5309.0]
  - - [1024, 1024, 8, 128, 1024, 1024, 128, 128]
    - [61, 5714.0]
  - - [1024, 1024, 8, 256, 1024, 1024, 256, 256]
    - [46, 5876.0]
  - - [1024, 1024, 8, 512, 1024, 1024, 512, 512]
    - [111, 6042.0]
  - - [1024, 1024, 8, 1024, 1024, 1024, 1024, 1024]
    - [113, 6167.0]
  - - [1024, 1024, 8, 2048, 1024, 1024, 2048, 2048]
    - [117, 6228.0]
  - - [1024, 2048, 8, 32, 1024, 1024, 32, 32]
    - [40, 4683.0]
  - - [1024, 2048, 8, 64, 1024, 1024, 64, 64]
    - [40, 5707.0]
  - - [1024, 2048, 8, 128, 1024, 1024, 128, 128]
    - [26, 5993.0]
  - - [1024, 2048, 8, 256, 1024, 1024, 256, 256]
    - [119, 6278.0]
  - - [1024, 2048, 8, 512, 1024, 1024, 512, 512]
    - [116, 6548.0]
  - - [1024, 2048, 8, 1024, 1024, 1024, 1024, 1024]
    - [122, 6676.0]
  - - [1024, 2048, 8, 2048, 1024, 1024, 2048, 2048]
    - [115, 6752.0]
  - - [2048, 32, 8, 32, 2048, 2048, 32, 32]
    - [45, 1553.0]
  - - [2048, 32, 8, 64, 2048, 2048, 64, 64]
    - [63, 1832.0]
  - - [2048, 32, 8, 128, 2048, 2048, 128, 128]
    - [13, 2145.0]
  - - [2048, 32, 8, 256, 2048, 2048, 256, 256]
    - [41, 2456.0]
  - - [2048, 32, 8, 512, 2048, 2048, 512, 512]
    - [13, 2552.0]
  - - [2048, 32, 8, 1024, 2048, 2048, 1024, 1024]
    - [20, 2647.0]
  - - [2048, 32, 8, 2048, 2048, 2048, 2048, 2048]
    - [56, 2701.0]
  - - [2048, 64, 8, 32, 2048, 2048, 32, 32]
    - [27, 2542.0]
  - - [2048, 64, 8, 64, 2048, 2048, 64, 64]
    - [26, 3190.0]
  - - [2048, 64, 8, 128, 2048, 2048, 128, 128]
    - [30, 3655.0]
  - - [2048, 64, 8, 256, 2048, 2048, 256, 256]
    - [26, 3948.0]
  - - [2048, 64, 8, 512, 2048, 2048, 512, 512]
    - [35, 4105.0]
  - - [2048, 64, 8, 1024, 2048, 2048, 1024, 1024]
    - [46, 4192.0]
  - - [2048, 64, 8, 2048, 2048, 2048, 2048, 2048]
    - [37, 4238.0]
  - - [2048, 128, 8, 32, 2048, 2048, 32, 32]
    - [54, 3214.0]
  - - [2048, 128, 8, 64, 2048, 2048, 64, 64]
    - [35, 4153.0]
  - - [2048, 128, 8, 128, 2048, 2048, 128, 128]
    - [26, 4706.0]
  - - [2048, 128, 8, 256, 2048, 2048, 256, 256]
    - [39, 4964.0]
  - - [2048, 128, 8, 512, 2048, 2048, 512, 512]
    - [48, 5107.0]
  - - [2048, 128, 8, 1024, 2048, 2048, 1024, 1024]
    - [54, 5189.0]
  - - [2048, 128, 8, 2048, 2048, 2048, 2048, 2048]
    - [39, 5231.0]
  - - [2048, 256, 8, 32, 2048, 2048, 32, 32]
    - [54, 3839.0]
  - - [2048, 256, 8, 64, 2048, 2048, 64, 64]
    - [26, 4891.0]
  - - [2048, 256, 8, 128, 2048, 2048, 128, 128]
    - [26, 5416.0]
  - - [2048, 256, 8, 256, 2048, 2048, 256, 256]
    - [39, 5687.0]
  - - [2048, 256, 8, 512, 2048, 2048, 512, 512]
    - [62, 5815.0]
  - - [2048, 256, 8, 1024, 2048, 2048, 1024, 1024]
    - [39, 5883.0]
  - - [2048, 256, 8, 2048, 2048, 2048, 2048, 2048]
    - [54, 5916.0]
  - - [2048, 512, 8, 32, 2048, 2048, 32, 32]
    - [26, 4307.0]
  - - [2048, 512, 8, 64, 2048, 2048, 64, 64]
    - [26, 5335.0]
  - - [2048, 512, 8, 128, 2048, 2048, 128, 128]
    - [51, 5697.0]
  - - [2048, 512, 8, 256, 2048, 2048, 256, 256]
    - [61, 5856.0]
  - - [2048, 512, 8, 512, 2048, 2048, 512, 512]
    - [110, 6055.0]
  - - [2048, 512, 8, 1024, 2048, 2048, 1024, 1024]
    - [112, 6155.0]
  - - [2048, 512, 8, 2048, 2048, 2048, 2048, 2048]
    - [112, 6229.0]
  - - [2048, 1024, 8, 32, 2048, 2048, 32, 32]
    - [37, 4693.0]
  - - [2048, 1024, 8, 64, 2048, 2048, 64, 64]
    - [27, 5714.0]
  - - [2048, 1024, 8, 128, 2048, 2048, 128, 128]
    - [27, 5957.0]
  - - [2048, 1024, 8, 256, 2048, 2048, 256, 256]
    - [121, 6263.0]
  - - [2048, 1024, 8, 512, 2048, 2048, 512, 512]
    - [116, 6538.0]
  - - [2048, 1024, 8, 1024, 2048, 2048, 1024, 1024]
    - [116, 6673.0]
  - - [2048, 1024, 8, 2048, 2048, 2048, 2048, 2048]
    - [120, 6733.0]
  - - [2048, 2048, 8, 32, 2048, 2048, 32, 32]
    - [27, 5067.0]
  - - [2048, 2048, 8, 64, 2048, 2048, 64, 64]
    - [27, 5965.0]
  - - [2048, 2048, 8, 128, 2048, 2048, 128, 128]
    - [27, 6120.0]
  - - [2048, 2048, 8, 256, 2048, 2048, 256, 256]
    - [116, 6399.0]
  - - [2048, 2048, 8, 512, 2048, 2048, 512, 512]
    - [119, 6626.0]
  - - [2048, 2048, 8, 1024, 2048, 2048, 1024, 1024]
    - [116, 6752.0]
  - - [2048, 2048, 8, 2048, 2048, 2048, 2048, 2048]
    - [118, 6801.0]
- null
