library/src/blas3/Tensile/Logic/asm_full/arcturus_Cijk_Ailk_Bjlk_SB.yaml
- {MinimumRequiredVersion: 4.20.0}
- arcturus
- gfx908
- [Device 7380, Device 7388, Device 738c, Device 7390]
    SolutionIndex: 0
    SolutionNameMin: Cijk_Ailk_Bjlk_SB_MT64x16x32_MI16x16x4x1_SE_1LDSB0_AF0EM1_AF1EM1_AMAS0_BL1_DTL0_DVO0_EPS0_FL0_GRVW1_GSU1_ISA908_IU1_KLA_LRVW1_MAC_MDA2_NLCA1_NLCB1_ONLL1_PGR2_PLR1_SIA3_SU0_SUS256_SRVW0_SVW4_SNLL0_TT1_16_TLDS0_USFGROn1_VSn1_VW1_WSGRA1_WSGRB1_WG64_4_1_WGM2
    SolutionIndex: 1
    SolutionNameMin: Cijk_Ailk_Bjlk_SB_MT16x64x16_MI16x16x4x1_SE_1LDSB0_AF0EM1_AF1EM1_AMAS0_BL1_DTL0_DVO0_EPS1_FL0_GRVW1_GSU1_ISA908_IU1_KLA_LRVW1_MAC_MDA2_NLCA1_NLCB1_ONLL1_PGR1_PLR1_SIA3_SU0_SUS256_SRVW0_SVW4_SNLL0_TT1_16_TLDS0_USFGROn1_VSn1_VW1_WSGRA1_WSGRB1_WG16_16_1_WGM1
    SolutionIndex: 2
    SolutionNameMin: Cijk_Ailk_Bjlk_SB_MT32x32x16_MI16x16x4x1_SE_1LDSB0_AF0EM1_AF1EM1_AMAS0_BL1_DTL0_DVO0_EPS0_FL0_GRVW1_GSU1_ISA908_IU1_KLA_LRVW1_MAC_MDA2_NLCA1_NLCB1_ONLL1_PGR2_PLR1_SIA3_SU32_SUS256_SRVW2_SVW4_SNLL0_TT1_16_TLDS0_USFGROn1_VSn1_VW1_WSGRA1_WSGRB1_WG32_8_1_WGM1
    SolutionIndex: 3
    SolutionNameMin: Cijk_Ailk_Bjlk_SB_MT128x144x16_MI16x16x4x1_SE_1LDSB1_AF0EM1_AF1EM1_AMAS0_BL1_DTL0_DVO0_EPS1_FL0_GRVW1_GSU1_ISA908_IU1_KLA_LRVW1_MAC_MDA2_NLCA2_NLCB9_ONLL1_PGR1_PLR1_SIA3_SU32_SUS256_SRVW2_SVW4_SNLL0_TT2_144_TLDS0_USFGROn1_VSn1_VW1_WSGRA1_WSGRB1_WG64_4_1_WGM2
    SolutionIndex: 4
    SolutionNameMin: Cijk_Ailk_Bjlk_SB_MT64x128x16_MI32x32x2x1_SE_1LDSB0_AF0EM1_AF1EM1_AMAS0_BL1_DTL0_DVO0_EPS0_FL0_GRVW4_GSU1_ISA908_IU1_KLA_LRVW1_MAC_MDA2_NLCA1_NLCB1_ONLL1_PGR2_PLR1_SIA3_SU32_SUS256_SRVW2_SVW4_SNLL0_TT1_64_TLDS0_USFGROn1_VSn1_VW1_WSGRA1_WSGRB1_WG64_4_1_WGM2
    SolutionIndex: 5
    SolutionNameMin: Cijk_Ailk_Bjlk_SB_MT64x64x32_MI16x16x4x1_SE_1LDSB0_AF0EM1_AF1EM1_AMAS3_BL1_DTL0_DVO0_EPS1_FL0_GRVW4_GSU1_ISA908_IU1_KLA_LRVW1_MAC_MDA2_NLCA1_NLCB1_ONLL1_PGR1_PLR1_SIA3_SU32_SUS256_SRVW0_SVW4_SNLL0_TT2_32_TLDS1_USFGROn1_VSn1_VW4_WSGRA1_WSGRB1_WG32_8_1_WGM8
    SolutionIndex: 6
    SolutionNameMin: Cijk_Ailk_Bjlk_SB_MT64x32x8_MI16x16x4x1_SE_1LDSB0_AF0EM1_AF1EM1_AMAS0_BL1_DTL0_DVO0_EPS0_FL0_GRVW2_GSU1_ISA908_IU1_KLA_LRVW1_MAC_MDA2_NLCA1_NLCB1_ONLL1_PGR2_PLR1_SIA3_SU0_SUS256_SRVW2_SVW4_SNLL0_TT2_16_TLDS0_USFGROn1_VSn1_VW1_WSGRA1_WSGRB1_WG32_8_1_WGM15
    SolutionIndex: 7
    SolutionNameMin: Cijk_Ailk_Bjlk_SB_MT96x128x16_MI32x32x2x1_SE_1LDSB0_AF0EM1_AF1EM1_AMAS0_BL1_DTL0_DVO0_EPS0_FL0_GRVW1_GSU1_ISA908_IU1_KLA_LRVW1_MAC_MDA2_NLCA3_NLCB2_ONLL1_PGR2_PLR1_SIA3_SU32_SUS256_SRVW0_SVW4_SNLL0_TT3_32_TLDS0_USFGROn1_VSn1_VW1_WSGRA1_WSGRB1_WG32_8_1_WGM15
    SolutionIndex: 8
    SolutionNameMin: Cijk_Ailk_Bjlk_SB_MT128x96x16_MI32x32x2x1_SE_1LDSB0_AF0EM1_AF1EM1_AMAS0_BL1_DTL0_DVO0_EPS1_FL0_GRVW2_GSU1_ISA908_IU1_KLA_LRVW1_MAC_MDA2_NLCA1_NLCB3_ONLL1_PGR1_PLR1_SIA3_SU32_SUS128_SRVW2_SVW4_SNLL0_TT1_96_TLDS0_USFGROn1_VSn1_VW1_WSGRA1_WSGRB1_WG128_2_1_WGM15
    SolutionIndex: 9
    SolutionNameMin: Cijk_Ailk_Bjlk_SB_MT128x96x16_MI32x32x2x1_SE_1LDSB0_AF0EM1_AF1EM1_AMAS0_BL1_DTL0_DVO0_EPS1_FL0_GRVW2_GSU1_ISA908_IU1_KLA_LRVW1_MAC_MDA2_NLCA1_NLCB3_ONLL1_PGR1_PLR1_SIA3_SU32_SUS128_SRVW2_SVW4_SNLL0_TT1_96_TLDS0_USFGROn1_VSn1_VW1_WSGRA1_WSGRB1_WG128_2_1_WGM2
    SolutionIndex: 10
    SolutionNameMin: Cijk_Ailk_Bjlk_SB_MT32x32x8_MI16x16x4x1_SE_1LDSB0_AF0EM1_AF1EM1_AMAS0_BL1_DTL0_DVO0_EPS0_FL0_GRVW1_GSU1_ISA908_IU1_KLA_LRVW1_MAC_MDA2_NLCA1_NLCB1_ONLL1_PGR2_PLR1_SIA3_SU0_SUS256_SRVW2_SVW4_SNLL0_TT1_16_TLDS0_USFGROn1_VSn1_VW1_WSGRA1_WSGRB1_WG32_8_1_WGM1
    SolutionIndex: 11
    SolutionNameMin: Cijk_Ailk_Bjlk_SB_MT160x128x8_MI32x32x2x1_SE_1LDSB0_AF0EM1_AF1EM1_AMAS0_BL1_DTL0_DVO0_EPS0_FL0_GRVW1_GSU1_ISA908_IU1_KLA_LRVW1_MAC_MDA2_NLCA5_NLCB2_ONLL1_PGR2_PLR1_SIA3_SU0_SUS256_SRVW0_SVW4_SNLL0_TT5_32_TLDS0_USFGROn1_VSn1_VW1_WSGRA1_WSGRB1_WG32_8_1_WGM1
    SolutionIndex: 12
    SolutionNameMin: Cijk_Ailk_Bjlk_SB_MT64x64x16_MI32x32x2x1_SE_1LDSB0_AF0EM1_AF1EM1_AMAS0_BL1_DTL0_DVO0_EPS0_FL0_GRVW1_GSU1_ISA908_IU1_KLA_LRVW1_MAC_MDA2_NLCA1_NLCB1_ONLL1_PGR2_PLR1_SIA3_SU32_SUS256_SRVW2_SVW4_SNLL0_TT1_32_TLDS0_USFGROn1_VSn1_VW1_WSGRA1_WSGRB1_WG64_4_1_WGM15
    SolutionIndex: 13
    SolutionNameMin: Cijk_Ailk_Bjlk_SB_MT32x32x16_MI16x16x4x1_SE_1LDSB0_AF0EM1_AF1EM1_AMAS0_BL1_DTL0_DVO0_EPS0_FL0_GRVW1_GSU1_ISA908_IU1_KLA_LRVW1_MAC_MDA2_NLCA1_NLCB1_ONLL1_PGR2_PLR1_SIA3_SU0_SUS256_SRVW2_SVW4_SNLL0_TT1_16_TLDS0_USFGROn1_VSn1_VW1_WSGRA1_WSGRB1_WG32_8_1_WGM15
    SolutionIndex: 14
    SolutionNameMin: Cijk_Ailk_Bjlk_SB_MT32x64x16_MI16x16x4x1_SE_1LDSB0_AF0EM1_AF1EM1_AMAS0_BL1_DTL0_DVO0_EPS0_FL0_GRVW1_GSU1_ISA908_IU1_KLA_LRVW1_MAC_MDA2_NLCA1_NLCB1_ONLL1_PGR2_PLR1_SIA3_SU32_SUS256_SRVW2_SVW4_SNLL0_TT1_32_TLDS0_USFGROn1_VSn1_VW1_WSGRA1_WSGRB1_WG32_8_1_WGM1
    SolutionIndex: 15
    SolutionNameMin: Cijk_Ailk_Bjlk_SB_MT64x32x16_SE_1LDSB0_AF0EM1_AF1EM1_AMAS3_BL1_DTL0_DVO0_EPS1_FL1_GRVW2_GSU1_ISA908_IU1_KLA_LRVW2_MAC_MDA2_NLCA1_NLCB1_ONLL1_PGR1_PLR1_SIA1_SU32_SUS256_SRVW0_SVW4_SNLL0_TT4_4_TLDS0_USFGRO0_VS1_VW2_WSGRA0_WSGRB0_WG16_8_2_WGM1
    SolutionIndex: 16
    SolutionNameMin: Cijk_Ailk_Bjlk_SB_MT64x64x16_MI32x32x2x1_SE_1LDSB0_AF0EM1_AF1EM1_AMAS0_BL1_DTL0_DVO0_EPS0_FL0_GRVW2_GSU1_ISA908_IU2_KLA_LRVW1_MAC_MDA2_NLCA1_NLCB1_ONLL1_PGR2_PLR1_SIA3_SU0_SUS256_SRVW2_SVW4_SNLL0_TT1_32_TLDS0_USFGROn1_VSn1_VW1_WSGRA1_WSGRB1_WG64_4_1_WGM1
    SolutionIndex: 17
    SolutionNameMin: Cijk_Ailk_Bjlk_SB_MT64x192x16_MI32x32x2x1_SE_1LDSB0_AF0EM1_AF1EM1_AMAS0_BL1_DTL0_DVO0_EPS1_FL0_GRVW4_GSU1_ISA908_IU1_KLA_LRVW1_MAC_MDA2_NLCA1_NLCB3_ONLL1_PGR1_PLR1_SIA3_SU0_SUS256_SRVW2_SVW4_SNLL0_TT1_96_TLDS0_USFGROn1_VSn1_VW1_WSGRA1_WSGRB1_WG64_4_1_WGM15
    SolutionIndex: 18
    SolutionNameMin: Cijk_Ailk_Bjlk_SB_MT96x96x16_MI16x16x4x1_SE_1LDSB1_AF0EM1_AF1EM1_AMAS0_BL1_DTL0_DVO0_EPS0_FL0_GRVW2_GSU1_ISA908_IU1_KLA_LRVW1_MAC_MDA2_NLCA3_NLCB3_ONLL1_PGR2_PLR1_SIA3_SU32_SUS256_SRVW0_SVW4_SNLL0_TT3_48_TLDS0_USFGROn1_VSn1_VW1_WSGRA1_WSGRB1_WG32_8_1_WGM15
    SolutionIndex: 19
    SolutionNameMin: Cijk_Ailk_Bjlk_SB_MT144x64x16_MI16x16x4x1_SE_1LDSB0_AF0EM1_AF1EM1_AMAS0_BL1_DTL0_DVO0_EPS0_FL0_GRVW1_GSU1_ISA908_IU1_KLA_LRVW1_MAC_MDA2_NLCA9_NLCB1_ONLL1_PGR2_PLR1_SIA3_SU32_SUS128_SRVW0_SVW4_SNLL0_TT9_16_TLDS0_USFGROn1_VSn1_VW1_WSGRA1_WSGRB1_WG16_16_1_WGM15
    SolutionIndex: 20
    SolutionNameMin: Cijk_Ailk_Bjlk_SB_MT96x96x16_MI16x16x4x1_SE_1LDSB1_AF0EM1_AF1EM1_AMAS0_BL1_DTL0_DVO0_EPS0_FL0_GRVW2_GSU1_ISA908_IU1_KLA_LRVW1_MAC_MDA2_NLCA3_NLCB3_ONLL1_PGR2_PLR1_SIA3_SU0_SUS256_SRVW0_SVW4_SNLL0_TT3_48_TLDS0_USFGROn1_VSn1_VW1_WSGRA1_WSGRB1_WG32_8_1_WGM2
    SolutionIndex: 21
    SolutionNameMin: Cijk_Ailk_Bjlk_SB_MT64x128x8_MI32x32x2x1_SE_1LDSB0_AF0EM1_AF1EM1_AMAS0_BL1_DTL0_DVO0_EPS0_FL0_GRVW2_GSU1_ISA908_IU1_KLA_LRVW1_MAC_MDA2_NLCA1_NLCB1_ONLL1_PGR2_PLR1_SIA3_SU32_SUS128_SRVW2_SVW4_SNLL0_TT1_64_TLDS0_USFGROn1_VSn1_VW1_WSGRA1_WSGRB1_WG64_4_1_WGM15
    SolutionIndex: 22
    SolutionNameMin: Cijk_Ailk_Bjlk_SB_MT32x32x8_MI16x16x4x1_SN_1LDSB0_AF0EM1_AF1EM1_AMAS0_BL1_DTL0_DVO0_EPS0_FL0_GRVW1_GSU1_ISA908_IU1_KLA_LRVW1_MAC_MDA2_NLCA1_NLCB1_ONLL1_PGR2_PLR1_SIA3_SU32_SUS256_SRVW2_SVW4_SNLL0_TT1_16_TLDS0_USFGROn1_VSn1_VW1_WSGRA1_WSGRB1_WG32_8_1_WGM1
    SolutionIndex: 23
    SolutionNameMin: Cijk_Ailk_Bjlk_SB_MT64x32x16_MI16x16x4x1_SE_1LDSB0_AF0EM1_AF1EM1_AMAS3_BL1_DTL0_DVO0_EPS1_FL0_GRVW1_GSU1_ISA908_IU1_KLA_LRVW1_MAC_MDA2_NLCA1_NLCB1_ONLL1_PGR1_PLR1_SIA3_SU32_SUS256_SRVW0_SVW4_SNLL0_TT2_16_TLDS1_USFGROn1_VSn1_VW2_WSGRA1_WSGRB1_WG32_8_1_WGM8
    SolutionIndex: 24
    SolutionNameMin: Cijk_Ailk_Bjlk_SB_MT32x64x16_SE_1LDSB0_AF0EM1_AF1EM1_AMAS3_BL1_DTL0_DVO0_EPS0_FL0_GRVW1_GSU1_ISA908_IU1_KLA_LRVW2_MAC_MDA2_NLCA1_NLCB1_ONLL1_PGR0_PLR1_SIA1_SU32_SUS256_SRVW0_SVW4_SNLL0_TT2_4_TLDS0_USFGRO1_VS1_VW2_WSGRA0_WSGRB0_WG16_16_1_WGM1
    SolutionIndex: 25
    SolutionNameMin: Cijk_Ailk_Bjlk_SB_MT64x64x16_MI16x16x4x1_SE_1LDSB0_AF0EM1_AF1EM1_AMAS3_BL1_DTL0_DVO0_EPS1_FL1_GRVW4_GSU1_ISA908_IU1_KLA_LRVW1_MAC_MDA2_NLCA1_NLCB1_ONLL1_PGR1_PLR1_SIA1_SU32_SUS256_SRVW4_SVW4_SNLL0_TT4_16_TLDS1_USFGROn1_VSn1_VW4_WSGRA0_WSGRB0_WG16_16_1_WGM1
    SolutionIndex: 26
    SolutionNameMin: Cijk_Ailk_Bjlk_SB_MT64x64x32_MI16x16x4x1_SE_1LDSB0_AF0EM1_AF1EM1_AMAS3_BL1_DTL0_DVO1_EPS1_FL1_GRVW4_GSU1_ISA908_IU1_KLA_LRVW1_MAC_MDA1_NLCA1_NLCB1_ONLL0_PGR1_PLR1_SIA3_SU32_SUS256_SRVW4_SVW4_SNLL0_TT4_16_TLDS0_USFGROn1_VSn1_VW4_WSGRA0_WSGRB0_WG16_16_1_WGM8
    SolutionIndex: 27
    SolutionNameMin: Cijk_Ailk_Bjlk_SB_MT64x64x32_MI32x32x2x1_SE_1LDSB0_AF0EM1_AF1EM1_AMAS0_BL1_DTL0_DVO0_EPS1_FL0_GRVW4_GSU1_ISA908_IU1_KLA_LRVW1_MAC_MDA2_NLCA1_NLCB1_ONLL1_PGR1_PLR1_SIA3_SU32_SUS128_SRVW2_SVW4_SNLL0_TT1_32_TLDS0_USFGROn1_VSn1_VW1_WSGRA1_WSGRB1_WG64_4_1_WGM15
    SolutionIndex: 28
    SolutionNameMin: Cijk_Ailk_Bjlk_SB_MT64x64x16_SN_1LDSB0_AF0EM1_AF1EM1_AMAS3_BL1_DTL0_DVO0_EPS1_FL0_GRVW4_GSU1_ISA908_IU1_KLA_LRVW4_MAC_MDA2_NLCA1_NLCB1_ONLL1_PGR1_PLR1_SIA1_SU32_SUS256_SRVW0_SVW4_SNLL0_TT4_4_TLDS0_USFGRO0_VS1_VW4_WSGRA0_WSGRB0_WG16_16_1_WGM8
    SolutionIndex: 29
    SolutionNameMin: Cijk_Ailk_Bjlk_SB_MT32x32x32_MI16x16x4x1_SE_1LDSB0_AF0EM1_AF1EM1_AMAS0_BL1_DTL0_DVO0_EPS0_FL0_GRVW4_GSU1_ISA908_IU1_KLA_LRVW1_MAC_MDA2_NLCA1_NLCB1_ONLL1_PGR2_PLR1_SIA3_SU32_SUS256_SRVW2_SVW4_SNLL0_TT1_16_TLDS0_USFGROn1_VSn1_VW1_WSGRA1_WSGRB1_WG32_8_1_WGM2
    SolutionIndex: 30
    SolutionNameMin: Cijk_Ailk_Bjlk_SB_MT16x16x16_SN_1LDSB0_AF0EM1_AF1EM1_AMAS3_BL1_DTL0_DVO0_EPS1_FL0_GRVW2_GSU8_ISA908_IU1_KLA_LRVW2_MAC_MDA2_NLCA1_NLCB1_ONLL1_PGR1_PLR1_SIA1_SU32_SUS256_SRVW0_SVW4_SNLL0_TT2_2_TLDS0_USFGRO1_VS1_VW2_WSGRA0_WSGRB0_WG8_8_4_WGM1
    SolutionIndex: 31
    SolutionNameMin: Cijk_Ailk_Bjlk_SB_MT16x16x32_MI16x16x4x1_SE_1LDSB0_AF0EM1_AF1EM1_AMAS0_BL1_DTL0_DVO0_EPS0_FL0_GRVW1_GSU3_ISA908_IU1_KLA_LRVW1_MAC_MDA2_NLCA1_NLCB1_ONLL1_PGR2_PLR1_SIA3_SU0_SUS256_SRVW0_SVW4_SNLL0_TT1_16_TLDS0_USFGROn1_VSn1_VW1_WSGRA1_WSGRB1_WG16_4_1_WGM1
    SolutionIndex: 32
    SolutionNameMin: Cijk_Ailk_Bjlk_SB_MT128x64x32_MI32x32x2x1_SE_1LDSB0_AF0EM1_AF1EM1_AMAS0_BL1_DTL0_DVO0_EPS0_FL0_GRVW1_GSU1_ISA908_IU1_KLA_LRVW1_MAC_MDA2_NLCA2_NLCB1_ONLL1_PGR2_PLR1_SIA3_SU32_SUS256_SRVW2_SVW4_SNLL0_TT2_32_TLDS0_USFGROn1_VSn1_VW1_WSGRA1_WSGRB1_WG64_4_1_WGM15
    SolutionIndex: 33
    SolutionNameMin: Cijk_Ailk_Bjlk_SB_MT128x144x16_MI16x16x4x1_SE_1LDSB1_AF0EM1_AF1EM1_AMAS0_BL1_DTL0_DVO0_EPS0_FL0_GRVW1_GSU1_ISA908_IU1_KLA_LRVW1_MAC_MDA2_NLCA2_NLCB9_ONLL1_PGR2_PLR1_SIA3_SU0_SUS256_SRVW2_SVW4_SNLL0_TT2_144_TLDS0_USFGROn1_VSn1_VW1_WSGRA1_WSGRB1_WG64_4_1_WGM15
    SolutionIndex: 34
    SolutionNameMin: Cijk_Ailk_Bjlk_SB_MT32x32x32_MI16x16x4x1_SE_1LDSB0_AF0EM1_AF1EM1_AMAS0_BL1_DTL0_DVO0_EPS0_FL0_GRVW4_GSU1_ISA908_IU2_KLA_LRVW1_MAC_MDA2_NLCA1_NLCB1_ONLL1_PGR2_PLR1_SIA3_SU0_SUS256_SRVW2_SVW4_SNLL0_TT1_16_TLDS0_USFGROn1_VSn1_VW1_WSGRA1_WSGRB1_WG32_8_1_WGM8
    SolutionIndex: 35
    SolutionNameMin: Cijk_Ailk_Bjlk_SB_MT128x96x16_MI32x32x2x1_SE_1LDSB0_AF0EM1_AF1EM1_AMAS0_BL1_DTL0_DVO0_EPS0_FL0_GRVW2_GSU1_ISA908_IU1_KLA_LRVW1_MAC_MDA2_NLCA1_NLCB3_ONLL1_PGR2_PLR1_SIA3_SU32_SUS128_SRVW2_SVW4_SNLL0_TT1_96_TLDS0_USFGROn1_VSn1_VW1_WSGRA1_WSGRB1_WG128_2_1_WGM15
    SolutionIndex: 36
    SolutionNameMin: Cijk_Ailk_Bjlk_SB_MT16x16x32_MI16x16x4x1_SE_1LDSB0_AF0EM1_AF1EM1_AMAS0_BL1_DTL0_DVO0_EPS0_FL0_GRVW1_GSU1_ISA908_IU1_KLA_LRVW1_MAC_MDA2_NLCA1_NLCB1_ONLL1_PGR2_PLR1_SIA3_SU32_SUS128_SRVW0_SVW4_SNLL0_TT1_16_TLDS0_USFGROn1_VSn1_VW1_WSGRA1_WSGRB1_WG16_4_1_WGM1
    SolutionIndex: 37
    SolutionNameMin: Cijk_Ailk_Bjlk_SB_MT128x64x32_MI16x16x1x4_SE_1LDSB0_AF0EM1_AF1EM1_AMAS0_BL1_DTL0_DVO0_EPS1_FL0_GRVW1_GSU1_ISA908_IU1_KLA_LRVW1_MAC_MDA2_NLCA1_NLCB1_ONLL1_PGR1_PLR1_SIA1_SU32_SUS256_SRVW0_SVW4_SNLL0_TT2_16_TLDS0_USFGROn1_VSn1_VW1_WSGRA0_WSGRB0_WG64_4_1_WGM16
    SolutionIndex: 38
    SolutionNameMin: Cijk_Ailk_Bjlk_SB_MT8x8x8_SN_1LDSB0_AF0EM1_AF1EM1_AMAS3_BL1_DTL0_DVO0_EPS1_FL0_GRVW2_GSU8_ISA908_IU1_KLA_LRVW2_MAC_MDA2_NLCA1_NLCB1_ONLL1_PGR1_PLR1_SIA1_SU32_SUS256_SRVW0_SVW4_SNLL0_TT2_2_TLDS0_USFGRO1_VS1_VW2_WSGRA0_WSGRB0_WG4_4_4_WGM1
    SolutionIndex: 39
    SolutionNameMin: Cijk_Ailk_Bjlk_SB_MT128x144x16_MI16x16x4x1_SE_1LDSB1_AF0EM1_AF1EM1_AMAS0_BL1_DTL0_DVO0_EPS0_FL0_GRVW1_GSU1_ISA908_IU1_KLA_LRVW1_MAC_MDA2_NLCA2_NLCB9_ONLL1_PGR2_PLR1_SIA3_SU0_SUS256_SRVW2_SVW4_SNLL0_TT2_144_TLDS0_USFGROn1_VSn1_VW1_WSGRA1_WSGRB1_WG64_4_1_WGM2
    SolutionIndex: 40
    SolutionNameMin: Cijk_Ailk_Bjlk_SB_MT64x64x32_MI32x32x2x1_SE_1LDSB0_AF0EM1_AF1EM1_AMAS0_BL1_DTL0_DVO0_EPS0_FL0_GRVW4_GSU1_ISA908_IU1_KLA_LRVW1_MAC_MDA2_NLCA1_NLCB1_ONLL1_PGR2_PLR1_SIA3_SU32_SUS256_SRVW2_SVW4_SNLL0_TT1_32_TLDS0_USFGROn1_VSn1_VW1_WSGRA1_WSGRB1_WG64_4_1_WGM15
    SolutionIndex: 41
    SolutionNameMin: Cijk_Ailk_Bjlk_SB_MT64x128x16_MI32x32x2x1_SE_1LDSB0_AF0EM1_AF1EM1_AMAS0_BL1_DTL0_DVO0_EPS0_FL0_GRVW4_GSU1_ISA908_IU1_KLA_LRVW1_MAC_MDA2_NLCA1_NLCB1_ONLL1_PGR2_PLR1_SIA3_SU32_SUS128_SRVW2_SVW4_SNLL0_TT1_64_TLDS0_USFGROn1_VSn1_VW1_WSGRA1_WSGRB1_WG64_4_1_WGM15
    SolutionIndex: 42
    SolutionNameMin: Cijk_Ailk_Bjlk_SB_MT64x144x16_MI16x16x4x1_SE_1LDSB0_AF0EM1_AF1EM1_AMAS0_BL1_DTL0_DVO0_EPS0_FL0_GRVW1_GSU1_ISA908_IU1_KLA_LRVW1_MAC_MDA2_NLCA1_NLCB9_ONLL1_PGR2_PLR1_SIA3_SU0_SUS256_SRVW2_SVW4_SNLL0_TT1_144_TLDS0_USFGROn1_VSn1_VW1_WSGRA1_WSGRB1_WG64_4_1_WGM15
    SolutionIndex: 43
    SolutionNameMin: Cijk_Ailk_Bjlk_SB_MT64x64x16_MI32x32x2x1_SE_1LDSB0_AF0EM1_AF1EM1_AMAS0_BL1_DTL0_DVO0_EPS0_FL0_GRVW4_GSU1_ISA908_IU1_KLA_LRVW1_MAC_MDA2_NLCA1_NLCB1_ONLL1_PGR2_PLR1_SIA3_SU0_SUS256_SRVW2_SVW4_SNLL0_TT1_32_TLDS0_USFGROn1_VSn1_VW1_WSGRA1_WSGRB1_WG64_4_1_WGM15
    SolutionIndex: 44
    SolutionNameMin: Cijk_Ailk_Bjlk_SB_MT128x144x16_MI16x16x4x1_SE_1LDSB1_AF0EM1_AF1EM1_AMAS0_BL1_DTL0_DVO0_EPS1_FL0_GRVW1_GSU1_ISA908_IU1_KLA_LRVW1_MAC_MDA2_NLCA2_NLCB9_ONLL1_PGR1_PLR1_SIA3_SU32_SUS256_SRVW2_SVW4_SNLL0_TT2_144_TLDS0_USFGROn1_VSn1_VW1_WSGRA1_WSGRB1_WG64_4_1_WGM15
    SolutionIndex: 45
    SolutionNameMin: Cijk_Ailk_Bjlk_SB_MT32x32x32_MI16x16x4x1_SE_1LDSB0_AF0EM1_AF1EM1_AMAS0_BL1_DTL0_DVO0_EPS0_FL0_GRVW4_GSU1_ISA908_IU1_KLA_LRVW1_MAC_MDA2_NLCA1_NLCB1_ONLL1_PGR2_PLR1_SIA3_SU0_SUS256_SRVW2_SVW4_SNLL0_TT1_16_TLDS0_USFGROn1_VSn1_VW1_WSGRA1_WSGRB1_WG32_8_1_WGM8
    SolutionIndex: 46
    SolutionNameMin: Cijk_Ailk_Bjlk_SB_MT64x128x16_MI32x32x2x1_SE_1LDSB0_AF0EM1_AF1EM1_AMAS0_BL1_DTL0_DVO0_EPS0_FL0_GRVW4_GSU1_ISA908_IU1_KLA_LRVW1_MAC_MDA2_NLCA1_NLCB1_ONLL1_PGR2_PLR1_SIA3_SU32_SUS256_SRVW2_SVW4_SNLL0_TT1_64_TLDS0_USFGROn1_VSn1_VW1_WSGRA1_WSGRB1_WG64_4_1_WGM1
    SolutionIndex: 47
    SolutionNameMin: Cijk_Ailk_Bjlk_SB_MT64x144x32_MI16x16x4x1_SN_1LDSB0_AF0EM1_AF1EM1_AMAS0_BL1_DTL0_DVO0_EPS1_FL0_GRVW1_GSU1_ISA908_IU1_KLA_LRVW1_MAC_MDA2_NLCA1_NLCB9_ONLL1_PGR1_PLR1_SIA3_SU32_SUS256_SRVW2_SVW4_SNLL0_TT1_144_TLDS0_USFGROn1_VSn1_VW1_WSGRA1_WSGRB1_WG64_4_1_WGM2
    SolutionIndex: 48
    SolutionNameMin: Cijk_Ailk_Bjlk_SB_MT64x64x16_MI32x32x2x1_SE_1LDSB0_AF0EM1_AF1EM1_AMAS0_BL1_DTL0_DVO0_EPS0_FL0_GRVW4_GSU1_ISA908_IU1_KLA_LRVW1_MAC_MDA2_NLCA1_NLCB1_ONLL1_PGR2_PLR1_SIA3_SU0_SUS256_SRVW2_SVW4_SNLL0_TT1_32_TLDS0_USFGROn1_VSn1_VW1_WSGRA1_WSGRB1_WG64_4_1_WGM1
    SolutionIndex: 49
    SolutionNameMin: Cijk_Ailk_Bjlk_SB_MT32x32x32_MI16x16x4x1_SE_1LDSB0_AF0EM1_AF1EM1_AMAS0_BL1_DTL0_DVO0_EPS0_FL0_GRVW1_GSU1_ISA908_IU1_KLA_LRVW1_MAC_MDA2_NLCA1_NLCB1_ONLL1_PGR2_PLR1_SIA3_SU0_SUS256_SRVW2_SVW4_SNLL0_TT1_16_TLDS0_USFGROn1_VSn1_VW1_WSGRA1_WSGRB1_WG32_8_1_WGM1
    SolutionIndex: 50
    SolutionNameMin: Cijk_Ailk_Bjlk_SB_MT64x64x32_MI16x16x4x1_SE_1LDSB0_AF0EM1_AF1EM1_AMAS3_BL1_DTL0_DVO0_EPS1_FL0_GRVW1_GSU1_ISA908_IU1_KLA_LRVW1_MAC_MDA2_NLCA1_NLCB1_ONLL1_PGR1_PLR1_SIA3_SU32_SUS256_SRVW0_SVW4_SNLL0_TT2_32_TLDS1_USFGROn1_VSn1_VW4_WSGRA1_WSGRB1_WG32_8_1_WGM8
    SolutionIndex: 51
    SolutionNameMin: Cijk_Ailk_Bjlk_SB_MT64x64x32_MI16x16x4x1_SE_1LDSB0_AF0EM1_AF1EM1_AMAS3_BL1_DTL0_DVO0_EPS1_FL0_GRVW2_GSU1_ISA908_IU1_KLA_LRVW1_MAC_MDA2_NLCA1_NLCB1_ONLL1_PGR1_PLR1_SIA3_SU32_SUS256_SRVW0_SVW4_SNLL0_TT2_32_TLDS0_USFGROn1_VSn1_VW2_WSGRA1_WSGRB1_WG32_8_1_WGM8
    SolutionIndex: 52
    SolutionNameMin: Cijk_Ailk_Bjlk_SB_MT32x32x32_MI16x16x4x1_SE_1LDSB0_AF0EM1_AF1EM1_AMAS0_BL1_DTL0_DVO0_EPS0_FL0_GRVW2_GSU1_ISA908_IU1_KLA_LRVW1_MAC_MDA2_NLCA1_NLCB1_ONLL1_PGR2_PLR1_SIA3_SU32_SUS128_SRVW2_SVW4_SNLL0_TT1_16_TLDS0_USFGROn1_VSn1_VW1_WSGRA1_WSGRB1_WG32_8_1_WGM1
    SolutionIndex: 53
    SolutionNameMin: Cijk_Ailk_Bjlk_SB_MT64x64x32_MI32x32x2x1_SE_1LDSB0_AF0EM1_AF1EM1_AMAS0_BL1_DTL0_DVO0_EPS0_FL0_GRVW1_GSU1_ISA908_IU1_KLA_LRVW1_MAC_MDA2_NLCA1_NLCB1_ONLL1_PGR2_PLR1_SIA3_SU0_SUS256_SRVW2_SVW4_SNLL0_TT1_32_TLDS0_USFGROn1_VSn1_VW1_WSGRA1_WSGRB1_WG64_4_1_WGM15
    SolutionIndex: 54
    SolutionNameMin: Cijk_Ailk_Bjlk_SB_MT64x64x32_MI32x32x2x1_SE_1LDSB0_AF0EM1_AF1EM1_AMAS0_BL1_DTL0_DVO0_EPS0_FL0_GRVW4_GSU1_ISA908_IU1_KLA_LRVW1_MAC_MDA2_NLCA1_NLCB1_ONLL1_PGR2_PLR1_SIA3_SU0_SUS256_SRVW2_SVW4_SNLL0_TT1_32_TLDS0_USFGROn1_VSn1_VW1_WSGRA1_WSGRB1_WG64_4_1_WGM15
    SolutionIndex: 55
    SolutionNameMin: Cijk_Ailk_Bjlk_SB_MT64x64x32_MI16x16x4x1_SE_1LDSB0_AF0EM1_AF1EM1_AMAS3_BL1_DTL0_DVO0_EPS1_FL0_GRVW4_GSU1_ISA908_IU1_KLA_LRVW1_MAC_MDA2_NLCA1_NLCB1_ONLL1_PGR1_PLR1_SIA3_SU32_SUS256_SRVW0_SVW4_SNLL0_TT2_32_TLDS0_USFGROn1_VSn1_VW2_WSGRA1_WSGRB1_WG32_8_1_WGM8
    SolutionIndex: 56
    SolutionNameMin: Cijk_Ailk_Bjlk_SB_MT64x64x32_MI16x16x4x1_SE_1LDSB0_AF0EM1_AF1EM1_AMAS3_BL1_DTL0_DVO0_EPS1_FL1_GRVW2_GSU1_ISA908_IU4_KLA_LRVW1_MAC_MDA2_NLCA1_NLCB1_ONLL0_PGR1_PLR1_SIA3_SU32_SUS256_SRVW4_SVW4_SNLL0_TT4_16_TLDS1_USFGROn1_VSn1_VW2_WSGRA0_WSGRB0_WG16_16_1_WGM1
    SolutionIndex: 57
    SolutionNameMin: Cijk_Ailk_Bjlk_SB_MT64x32x8_MI16x16x4x1_SE_1LDSB0_AF0EM1_AF1EM1_AMAS0_BL1_DTL0_DVO0_EPS0_FL0_GRVW1_GSU1_ISA908_IU1_KLA_LRVW1_MAC_MDA2_NLCA1_NLCB1_ONLL1_PGR2_PLR1_SIA3_SU0_SUS256_SRVW2_SVW4_SNLL0_TT2_16_TLDS0_USFGROn1_VSn1_VW1_WSGRA1_WSGRB1_WG32_8_1_WGM1
    SolutionIndex: 58
    SolutionNameMin: Cijk_Ailk_Bjlk_SB_MT64x128x16_MI32x32x2x1_SE_1LDSB0_AF0EM1_AF1EM1_AMAS0_BL1_DTL0_DVO0_EPS0_FL0_GRVW4_GSU1_ISA908_IU1_KLA_LRVW1_MAC_MDA2_NLCA1_NLCB1_ONLL1_PGR2_PLR1_SIA3_SU0_SUS256_SRVW2_SVW4_SNLL0_TT1_64_TLDS0_USFGROn1_VSn1_VW1_WSGRA1_WSGRB1_WG64_4_1_WGM15
    SolutionIndex: 59
    SolutionNameMin: Cijk_Ailk_Bjlk_SB_MT128x96x16_MI32x32x2x1_SE_1LDSB0_AF0EM1_AF1EM1_AMAS0_BL1_DTL0_DVO0_EPS0_FL0_GRVW2_GSU1_ISA908_IU1_KLA_LRVW1_MAC_MDA2_NLCA1_NLCB3_ONLL1_PGR2_PLR1_SIA3_SU0_SUS256_SRVW2_SVW4_SNLL0_TT1_96_TLDS0_USFGROn1_VSn1_VW1_WSGRA1_WSGRB1_WG128_2_1_WGM15
    SolutionIndex: 60
    SolutionNameMin: Cijk_Ailk_Bjlk_SB_MT64x64x32_MI32x32x2x1_SN_1LDSB0_AF0EM1_AF1EM1_AMAS0_BL1_DTL0_DVO0_EPS0_FL0_GRVW2_GSU1_ISA908_IU1_KLA_LRVW1_MAC_MDA2_NLCA1_NLCB1_ONLL1_PGR2_PLR1_SIA3_SU32_SUS256_SRVW2_SVW4_SNLL0_TT1_32_TLDS0_USFGROn1_VSn1_VW1_WSGRA1_WSGRB1_WG64_4_1_WGM1
    SolutionIndex: 61
    SolutionNameMin: Cijk_Ailk_Bjlk_SB_MT16x16x16_SN_1LDSB0_AF0EM1_AF1EM1_AMAS3_BL1_DTL0_DVO0_EPS1_FL0_GRVW2_GSU1_ISA908_IU1_KLA_LRVW2_MAC_MDA2_NLCA1_NLCB1_ONLL1_PGR1_PLR1_SIA1_SU32_SUS256_SRVW0_SVW4_SNLL0_TT2_2_TLDS0_USFGRO1_VS1_VW2_WSGRA0_WSGRB0_WG8_8_4_WGM1
    SolutionIndex: 62
    SolutionNameMin: Cijk_Ailk_Bjlk_SB_MT64x64x16_MI32x32x2x1_SE_1LDSB0_AF0EM1_AF1EM1_AMAS0_BL1_DTL0_DVO0_EPS0_FL0_GRVW1_GSU1_ISA908_IU1_KLA_LRVW1_MAC_MDA2_NLCA1_NLCB1_ONLL1_PGR2_PLR1_SIA3_SU0_SUS256_SRVW2_SVW4_SNLL0_TT1_32_TLDS0_USFGROn1_VSn1_VW1_WSGRA1_WSGRB1_WG64_4_1_WGM1
    SolutionIndex: 63
    SolutionNameMin: Cijk_Ailk_Bjlk_SB_MT64x128x16_MI32x32x2x1_SE_1LDSB0_AF0EM1_AF1EM1_AMAS0_BL1_DTL0_DVO0_EPS0_FL0_GRVW2_GSU1_ISA908_IU1_KLA_LRVW1_MAC_MDA2_NLCA1_NLCB1_ONLL1_PGR2_PLR1_SIA3_SU0_SUS256_SRVW2_SVW4_SNLL0_TT1_64_TLDS0_USFGROn1_VSn1_VW1_WSGRA1_WSGRB1_WG64_4_1_WGM15
    SolutionIndex: 64
    SolutionNameMin: Cijk_Ailk_Bjlk_SB_MT64x128x16_MI32x32x2x1_SE_1LDSB0_AF0EM1_AF1EM1_AMAS0_BL1_DTL0_DVO0_EPS0_FL0_GRVW4_GSU1_ISA908_IU1_KLA_LRVW1_MAC_MDA2_NLCA1_NLCB1_ONLL1_PGR2_PLR1_SIA3_SU0_SUS256_SRVW2_SVW4_SNLL0_TT1_64_TLDS0_USFGROn1_VSn1_VW1_WSGRA1_WSGRB1_WG64_4_1_WGM2
    SolutionIndex: 65
    SolutionNameMin: Cijk_Ailk_Bjlk_SB_MT64x128x16_MI32x32x2x1_SE_1LDSB0_AF0EM1_AF1EM1_AMAS0_BL1_DTL0_DVO0_EPS0_FL0_GRVW1_GSU1_ISA908_IU1_KLA_LRVW1_MAC_MDA2_NLCA1_NLCB2_ONLL1_PGR2_PLR1_SIA3_SU0_SUS256_SRVW2_SVW4_SNLL0_TT1_64_TLDS0_USFGROn1_VSn1_VW1_WSGRA1_WSGRB1_WG64_4_1_WGM15
    SolutionIndex: 66
    SolutionNameMin: Cijk_Ailk_Bjlk_SB_MT64x64x32_MI32x32x2x1_SE_1LDSB0_AF0EM1_AF1EM1_AMAS0_BL1_DTL0_DVO0_EPS0_FL0_GRVW2_GSU1_ISA908_IU1_KLA_LRVW1_MAC_MDA2_NLCA1_NLCB1_ONLL1_PGR2_PLR1_SIA3_SU0_SUS256_SRVW2_SVW4_SNLL0_TT1_32_TLDS0_USFGROn1_VSn1_VW1_WSGRA1_WSGRB1_WG64_4_1_WGM15
    SolutionIndex: 67
    SolutionNameMin: Cijk_Ailk_Bjlk_SB_MT64x128x16_MI32x32x2x1_SE_1LDSB0_AF0EM1_AF1EM1_AMAS0_BL1_DTL0_DVO0_EPS0_FL0_GRVW4_GSU1_ISA908_IU1_KLA_LRVW1_MAC_MDA2_NLCA1_NLCB1_ONLL1_PGR2_PLR1_SIA3_SU32_SUS256_SRVW2_SVW4_SNLL0_TT1_64_TLDS0_USFGROn1_VSn1_VW1_WSGRA1_WSGRB1_WG64_4_1_WGM15
    SolutionIndex: 68
    SolutionNameMin: Cijk_Ailk_Bjlk_SB_MT64x64x32_MI32x32x2x1_SE_1LDSB0_AF0EM1_AF1EM1_AMAS0_BL1_DTL0_DVO0_EPS0_FL0_GRVW4_GSU1_ISA908_IU1_KLA_LRVW1_MAC_MDA2_NLCA1_NLCB1_ONLL1_PGR2_PLR1_SIA3_SU32_SUS128_SRVW2_SVW4_SNLL0_TT1_32_TLDS0_USFGROn1_VSn1_VW1_WSGRA1_WSGRB1_WG64_4_1_WGM15
    SolutionIndex: 69
    SolutionNameMin: Cijk_Ailk_Bjlk_SB_MT64x64x32_MI16x16x4x1_SE_1LDSB0_AF0EM1_AF1EM1_AMAS3_BL1_DTL0_DVO0_EPS1_FL0_GRVW1_GSU1_ISA908_IU1_KLA_LRVW1_MAC_MDA2_NLCA1_NLCB1_ONLL1_PGR1_PLR1_SIA3_SU32_SUS256_SRVW0_SVW4_SNLL0_TT2_32_TLDS0_USFGROn1_VSn1_VW4_WSGRA1_WSGRB1_WG32_8_1_WGM8
    SolutionIndex: 70
    SolutionNameMin: Cijk_Ailk_Bjlk_SB_MT64x64x16_MI32x32x2x1_SE_1LDSB0_AF0EM1_AF1EM1_AMAS0_BL1_DTL0_DVO0_EPS0_FL0_GRVW1_GSU1_ISA908_IU1_KLA_LRVW1_MAC_MDA2_NLCA1_NLCB1_ONLL1_PGR2_PLR1_SIA3_SU0_SUS256_SRVW2_SVW4_SNLL0_TT1_32_TLDS0_USFGROn1_VSn1_VW1_WSGRA1_WSGRB1_WG64_4_1_WGM2
    SolutionIndex: 71
    SolutionNameMin: Cijk_Ailk_Bjlk_SB_MT32x32x32_MI16x16x4x1_SE_1LDSB0_AF0EM1_AF1EM1_AMAS0_BL1_DTL0_DVO0_EPS0_FL0_GRVW2_GSU1_ISA908_IU2_KLA_LRVW1_MAC_MDA2_NLCA1_NLCB1_ONLL1_PGR2_PLR1_SIA3_SU0_SUS256_SRVW2_SVW4_SNLL0_TT1_16_TLDS0_USFGROn1_VSn1_VW1_WSGRA1_WSGRB1_WG32_8_1_WGM1
    SolutionIndex: 72
    SolutionNameMin: Cijk_Ailk_Bjlk_SB_MT32x32x32_MI16x16x4x1_SE_1LDSB0_AF0EM1_AF1EM1_AMAS0_BL1_DTL0_DVO0_EPS0_FL0_GRVW2_GSU1_ISA908_IU1_KLA_LRVW1_MAC_MDA2_NLCA1_NLCB1_ONLL1_PGR2_PLR1_SIA3_SU32_SUS128_SRVW2_SVW4_SNLL0_TT1_16_TLDS0_USFGROn1_VSn1_VW1_WSGRA1_WSGRB1_WG32_8_1_WGM2
    SolutionIndex: 73
    SolutionNameMin: Cijk_Ailk_Bjlk_SB_MT32x32x32_MI16x16x4x1_SE_1LDSB0_AF0EM1_AF1EM1_AMAS0_BL1_DTL0_DVO0_EPS0_FL0_GRVW1_GSU5_ISA908_IU1_KLA_LRVW1_MAC_MDA2_NLCA1_NLCB1_ONLL1_PGR2_PLR1_SIA3_SU32_SUS256_SRVW0_SVW4_SNLL0_TT1_16_TLDS0_USFGROn1_VSn1_VW1_WSGRA1_WSGRB1_WG32_8_1_WGM2
    SolutionIndex: 74
    SolutionNameMin: Cijk_Ailk_Bjlk_SB_MT128x144x16_MI16x16x4x1_SE_1LDSB1_AF0EM1_AF1EM1_AMAS0_BL1_DTL0_DVO0_EPS1_FL0_GRVW1_GSU1_ISA908_IU1_KLA_LRVW1_MAC_MDA2_NLCA2_NLCB9_ONLL1_PGR1_PLR1_SIA3_SU0_SUS256_SRVW2_SVW4_SNLL0_TT2_144_TLDS0_USFGROn1_VSn1_VW1_WSGRA1_WSGRB1_WG64_4_1_WGM2
    SolutionIndex: 75
    SolutionNameMin: Cijk_Ailk_Bjlk_SB_MT16x16x32_MI16x16x4x1_SE_1LDSB0_AF0EM1_AF1EM1_AMAS0_BL1_DTL0_DVO0_EPS0_FL0_GRVW1_GSU1_ISA908_IU1_KLA_LRVW1_MAC_MDA2_NLCA1_NLCB1_ONLL1_PGR2_PLR1_SIA3_SU0_SUS256_SRVW0_SVW4_SNLL0_TT1_16_TLDS0_USFGROn1_VSn1_VW1_WSGRA1_WSGRB1_WG16_4_1_WGM2
    SolutionIndex: 76
    SolutionNameMin: Cijk_Ailk_Bjlk_SB_MT16x16x32_MI16x16x4x1_SE_1LDSB0_AF0EM1_AF1EM1_AMAS0_BL1_DTL0_DVO0_EPS0_FL0_GRVW1_GSU1_ISA908_IU1_KLA_LRVW1_MAC_MDA2_NLCA1_NLCB1_ONLL1_PGR2_PLR1_SIA3_SU32_SUS256_SRVW0_SVW4_SNLL0_TT1_16_TLDS0_USFGROn1_VSn1_VW1_WSGRA1_WSGRB1_WG16_4_1_WGM1
    SolutionIndex: 77
    SolutionNameMin: Cijk_Ailk_Bjlk_SB_MT192x64x16_MI32x32x2x1_SE_1LDSB0_AF0EM1_AF1EM1_AMAS0_BL1_DTL0_DVO0_EPS1_FL0_GRVW4_GSU1_ISA908_IU1_KLA_LRVW1_MAC_MDA2_NLCA3_NLCB1_ONLL1_PGR1_PLR1_SIA3_SU0_SUS256_SRVW0_SVW4_SNLL0_TT3_32_TLDS0_USFGROn1_VSn1_VW1_WSGRA1_WSGRB1_WG64_4_1_WGM1
    SolutionIndex: 78
    SolutionNameMin: Cijk_Ailk_Bjlk_SB_MT64x128x8_MI32x32x2x1_SE_1LDSB0_AF0EM1_AF1EM1_AMAS0_BL1_DTL0_DVO0_EPS0_FL0_GRVW4_GSU1_ISA908_IU1_KLA_LRVW1_MAC_MDA2_NLCA1_NLCB1_ONLL1_PGR2_PLR1_SIA3_SU32_SUS256_SRVW2_SVW4_SNLL0_TT1_64_TLDS0_USFGROn1_VSn1_VW1_WSGRA1_WSGRB1_WG64_4_1_WGM15
    SolutionIndex: 79
    SolutionNameMin: Cijk_Ailk_Bjlk_SB_MT64x64x16_MI32x32x2x1_SE_1LDSB0_AF0EM1_AF1EM1_AMAS0_BL1_DTL0_DVO0_EPS0_FL0_GRVW1_GSU1_ISA908_IU1_KLA_LRVW1_MAC_MDA2_NLCA1_NLCB1_ONLL1_PGR2_PLR1_SIA3_SU32_SUS128_SRVW2_SVW4_SNLL0_TT1_32_TLDS0_USFGROn1_VSn1_VW1_WSGRA1_WSGRB1_WG64_4_1_WGM15
    SolutionIndex: 80
    SolutionNameMin: Cijk_Ailk_Bjlk_SB_MT128x144x16_MI16x16x4x1_SE_1LDSB1_AF0EM1_AF1EM1_AMAS0_BL1_DTL0_DVO0_EPS0_FL0_GRVW1_GSU1_ISA908_IU1_KLA_LRVW1_MAC_MDA2_NLCA2_NLCB9_ONLL1_PGR2_PLR1_SIA3_SU32_SUS256_SRVW2_SVW4_SNLL0_TT2_144_TLDS0_USFGROn1_VSn1_VW1_WSGRA1_WSGRB1_WG64_4_1_WGM2
    SolutionIndex: 81
    SolutionNameMin: Cijk_Ailk_Bjlk_SB_MT64x128x32_MI32x32x2x1_SE_1LDSB0_AF0EM4_AF1EM1_AMAS3_BL1_DTL0_DVO1_EPS1_FL1_GRVW4_GSU1_ISA908_IU1_KLA_LRVW1_MAC_MDA2_NLCA1_NLCB1_ONLL0_PGR1_PLR1_SIA3_SU32_SUS256_SRVW4_SVW4_SNLL0_TT2_32_TLDS1_USFGROn1_VSn1_VW4_WSGRA0_WSGRB0_WG32_8_1_WGM1
    SolutionIndex: 82
    SolutionNameMin: Cijk_Ailk_Bjlk_SB_MT64x128x16_MI32x32x2x1_SE_1LDSB0_AF0EM1_AF1EM1_AMAS0_BL1_DTL0_DVO0_EPS0_FL0_GRVW4_GSU1_ISA908_IU1_KLA_LRVW1_MAC_MDA2_NLCA1_NLCB1_ONLL1_PGR2_PLR1_SIA3_SU0_SUS256_SRVW2_SVW4_SNLL0_TT1_64_TLDS0_USFGROn1_VSn1_VW1_WSGRA1_WSGRB1_WG64_4_1_WGM1
    SolutionIndex: 83
    SolutionNameMin: Cijk_Ailk_Bjlk_SB_MT32x32x32_MI16x16x4x1_SE_1LDSB0_AF0EM1_AF1EM1_AMAS0_BL1_DTL0_DVO0_EPS0_FL0_GRVW1_GSU1_ISA908_IU1_KLA_LRVW1_MAC_MDA2_NLCA1_NLCB1_ONLL1_PGR2_PLR1_SIA3_SU0_SUS256_SRVW2_SVW4_SNLL0_TT1_16_TLDS0_USFGROn1_VSn1_VW1_WSGRA1_WSGRB1_WG32_8_1_WGM2
    SolutionIndex: 84
    SolutionNameMin: Cijk_Ailk_Bjlk_SB_MT32x64x8_SE_1LDSB0_AF0EM1_AF1EM1_AMAS3_BL1_DTL0_DVO0_EPS1_FL0_GRVW4_GSU1_ISA908_IU1_KLA_LRVW2_MAC_MDA2_NLCA1_NLCB1_ONLL1_PGR1_PLR1_SIA1_SU32_SUS256_SRVW0_SVW4_SNLL0_TT2_4_TLDS0_USFGRO0_VS1_VW2_WSGRA0_WSGRB0_WG16_16_1_WGM8
    SolutionIndex: 85
    SolutionNameMin: Cijk_Ailk_Bjlk_SB_MT96x96x32_MI16x16x4x1_SE_1LDSB0_AF0EM1_AF1EM1_AMAS0_BL1_DTL0_DVO0_EPS1_FL0_GRVW1_GSU1_ISA908_IU1_KLA_LRVW1_MAC_MDA2_NLCA3_NLCB3_ONLL1_PGR1_PLR1_SIA3_SU32_SUS256_SRVW0_SVW4_SNLL0_TT3_48_TLDS0_USFGROn1_VSn1_VW1_WSGRA1_WSGRB1_WG32_8_1_WGM1
    SolutionIndex: 86
    SolutionNameMin: Cijk_Ailk_Bjlk_SB_MT64x128x8_MI32x32x2x1_SE_1LDSB0_AF0EM1_AF1EM1_AMAS0_BL1_DTL0_DVO0_EPS0_FL0_GRVW1_GSU1_ISA908_IU1_KLA_LRVW1_MAC_MDA2_NLCA1_NLCB2_ONLL1_PGR2_PLR1_SIA3_SU32_SUS128_SRVW2_SVW4_SNLL0_TT1_64_TLDS0_USFGROn1_VSn1_VW1_WSGRA1_WSGRB1_WG64_4_1_WGM15
    SolutionIndex: 87
    SolutionNameMin: Cijk_Ailk_Bjlk_SB_MT64x64x16_MI32x32x2x1_SN_1LDSB0_AF0EM1_AF1EM1_AMAS0_BL1_DTL0_DVO0_EPS0_FL0_GRVW1_GSU1_ISA908_IU1_KLA_LRVW1_MAC_MDA2_NLCA1_NLCB1_ONLL1_PGR2_PLR1_SIA3_SU32_SUS256_SRVW2_SVW4_SNLL0_TT1_32_TLDS0_USFGROn1_VSn1_VW1_WSGRA1_WSGRB1_WG64_4_1_WGM15
    SolutionIndex: 88
    SolutionNameMin: Cijk_Ailk_Bjlk_SB_MT64x128x16_MI32x32x2x1_SE_1LDSB0_AF0EM1_AF1EM1_AMAS0_BL1_DTL0_DVO0_EPS0_FL0_GRVW1_GSU1_ISA908_IU1_KLA_LRVW1_MAC_MDA2_NLCA1_NLCB2_ONLL1_PGR2_PLR1_SIA3_SU0_SUS256_SRVW2_SVW4_SNLL0_TT1_64_TLDS0_USFGROn1_VSn1_VW1_WSGRA1_WSGRB1_WG64_4_1_WGM1
    SolutionIndex: 89
    SolutionNameMin: Cijk_Ailk_Bjlk_SB_MT64x128x16_MI32x32x2x1_SE_1LDSB0_AF0EM1_AF1EM1_AMAS0_BL1_DTL0_DVO0_EPS0_FL0_GRVW2_GSU1_ISA908_IU1_KLA_LRVW1_MAC_MDA2_NLCA1_NLCB1_ONLL1_PGR2_PLR1_SIA3_SU32_SUS256_SRVW2_SVW4_SNLL0_TT1_64_TLDS0_USFGROn1_VSn1_VW1_WSGRA1_WSGRB1_WG64_4_1_WGM15
    SolutionIndex: 90
    SolutionNameMin: Cijk_Ailk_Bjlk_SB_MT32x64x8_MI16x16x4x1_SE_1LDSB0_AF0EM1_AF1EM1_AMAS0_BL1_DTL0_DVO0_EPS0_FL0_GRVW1_GSU1_ISA908_IU1_KLA_LRVW1_MAC_MDA2_NLCA1_NLCB1_ONLL1_PGR2_PLR1_SIA3_SU32_SUS256_SRVW2_SVW4_SNLL0_TT1_32_TLDS0_USFGROn1_VSn1_VW1_WSGRA1_WSGRB1_WG32_8_1_WGM1
    SolutionIndex: 91
    SolutionNameMin: Cijk_Ailk_Bjlk_SB_MT128x64x8_MI16x16x1x4_SE_1LDSB0_AF0EM1_AF1EM1_AMAS0_BL1_DTL0_DVO0_EPS1_FL0_GRVW1_GSU1_ISA908_IU1_KLA_LRVW1_MAC_MDA2_NLCA1_NLCB1_ONLL1_PGR1_PLR1_SIA1_SU32_SUS256_SRVW0_SVW4_SNLL0_TT2_16_TLDS0_USFGROn1_VSn1_VW1_WSGRA0_WSGRB0_WG64_4_1_WGM4
    SolutionIndex: 92
    SolutionNameMin: Cijk_Ailk_Bjlk_SB_MT64x64x32_MI32x32x2x1_SE_1LDSB0_AF0EM1_AF1EM1_AMAS0_BL1_DTL0_DVO0_EPS0_FL0_GRVW4_GSU1_ISA908_IU1_KLA_LRVW1_MAC_MDA2_NLCA1_NLCB1_ONLL1_PGR2_PLR1_SIA3_SU0_SUS256_SRVW2_SVW4_SNLL0_TT1_32_TLDS0_USFGROn1_VSn1_VW1_WSGRA1_WSGRB1_WG64_4_1_WGM1
    SolutionIndex: 93
    SolutionNameMin: Cijk_Ailk_Bjlk_SB_MT64x128x16_MI32x32x2x1_SE_1LDSB0_AF0EM1_AF1EM1_AMAS0_BL1_DTL0_DVO0_EPS0_FL0_GRVW4_GSU1_ISA908_IU1_KLA_LRVW1_MAC_MDA2_NLCA1_NLCB1_ONLL1_PGR2_PLR1_SIA3_SU32_SUS128_SRVW2_SVW4_SNLL0_TT1_64_TLDS0_USFGROn1_VSn1_VW1_WSGRA1_WSGRB1_WG64_4_1_WGM2
    SolutionIndex: 94
    SolutionNameMin: Cijk_Ailk_Bjlk_SB_MT64x64x16_MI16x16x1x4_SE_1LDSB0_AF0EM4_AF1EM4_AMAS0_BL1_DTL0_DVO0_EPS1_FL0_GRVW4_GSU1_ISA908_IU2_KLA_LRVW1_MAC_MDA2_NLCA1_NLCB1_ONLL0_PGR1_PLR1_SIA1_SU32_SUS256_SRVW0_SVW4_SNLL0_TT1_16_TLDS0_USFGROn1_VSn1_VW1_WSGRA0_WSGRB0_WG64_4_1_WGM8
    SolutionIndex: 95
    SolutionNameMin: Cijk_Ailk_Bjlk_SB_MT64x144x32_MI16x16x4x1_SE_1LDSB0_AF0EM1_AF1EM1_AMAS0_BL1_DTL0_DVO0_EPS1_FL0_GRVW1_GSU1_ISA908_IU1_KLA_LRVW1_MAC_MDA2_NLCA1_NLCB9_ONLL1_PGR1_PLR1_SIA3_SU0_SUS256_SRVW2_SVW4_SNLL0_TT1_144_TLDS0_USFGROn1_VSn1_VW1_WSGRA1_WSGRB1_WG64_4_1_WGM15
    SolutionIndex: 96
    SolutionNameMin: Cijk_Ailk_Bjlk_SB_MT64x144x16_MI16x16x4x1_SE_1LDSB0_AF0EM1_AF1EM1_AMAS0_BL1_DTL0_DVO0_EPS0_FL0_GRVW1_GSU1_ISA908_IU1_KLA_LRVW1_MAC_MDA2_NLCA1_NLCB9_ONLL1_PGR2_PLR1_SIA3_SU0_SUS256_SRVW2_SVW4_SNLL0_TT1_144_TLDS0_USFGROn1_VSn1_VW1_WSGRA1_WSGRB1_WG64_4_1_WGM1
    SolutionIndex: 97
    SolutionNameMin: Cijk_Ailk_Bjlk_SB_MT64x128x8_MI32x32x2x1_SE_1LDSB0_AF0EM1_AF1EM1_AMAS0_BL1_DTL0_DVO0_EPS0_FL0_GRVW4_GSU1_ISA908_IU1_KLA_LRVW1_MAC_MDA2_NLCA1_NLCB1_ONLL1_PGR2_PLR1_SIA3_SU0_SUS256_SRVW2_SVW4_SNLL0_TT1_64_TLDS0_USFGROn1_VSn1_VW1_WSGRA1_WSGRB1_WG64_4_1_WGM2
    SolutionIndex: 98
    SolutionNameMin: Cijk_Ailk_Bjlk_SB_MT32x16x32_SN_1LDSB0_AF0EM1_AF1EM1_AMAS3_BL1_DTL0_DVO0_EPS1_FL0_GRVW2_GSU4_ISA908_IU1_KLA_LRVW2_MAC_MDA2_NLCA1_NLCB1_ONLL1_PGR1_PLR1_SIA1_SU32_SUS256_SRVW0_SVW4_SNLL0_TT4_2_TLDS0_USFGRO0_VS1_VW2_WSGRA0_WSGRB0_WG8_8_4_WGM1
    SolutionIndex: 99
    SolutionNameMin: Cijk_Ailk_Bjlk_SB_MT64x64x16_MI16x16x4x1_SE_1LDSB0_AF0EM1_AF1EM1_AMAS3_BL1_DTL0_DVO1_EPS1_FL1_GRVW4_GSU1_ISA908_IU1_KLA_LRVW1_MAC_MDA2_NLCA1_NLCB1_ONLL0_PGR1_PLR1_SIA3_SU32_SUS256_SRVW4_SVW4_SNLL0_TT4_16_TLDS1_USFGROn1_VSn1_VW4_WSGRA0_WSGRB0_WG16_16_1_WGM8
    SolutionIndex: 100
    SolutionNameMin: Cijk_Ailk_Bjlk_SB_MT64x32x32_MI16x16x4x1_SE_1LDSB0_AF0EM1_AF1EM1_AMAS0_BL1_DTL0_DVO0_EPS0_FL0_GRVW4_GSU1_ISA908_IU1_KLA_LRVW1_MAC_MDA2_NLCA1_NLCB1_ONLL1_PGR2_PLR1_SIA3_SU0_SUS256_SRVW2_SVW4_SNLL0_TT2_16_TLDS0_USFGROn1_VSn1_VW1_WSGRA1_WSGRB1_WG32_8_1_WGM1
    SolutionIndex: 101
    SolutionNameMin: Cijk_Ailk_Bjlk_SB_MT64x64x32_MI16x16x4x1_SE_1LDSB0_AF0EM1_AF1EM1_AMAS3_BL1_DTL0_DVO1_EPS1_FL1_GRVW4_GSU1_ISA908_IU1_KLA_LRVW1_MAC_MDA2_NLCA1_NLCB1_ONLL2_PGR1_PLR1_SIA3_SU32_SUS256_SRVW4_SVW4_SNLL0_TT4_16_TLDS1_USFGROn1_VSn1_VW4_WSGRA0_WSGRB0_WG16_16_1_WGM1
    SolutionIndex: 102
    SolutionNameMin: Cijk_Ailk_Bjlk_SB_MT128x96x8_MI32x32x2x1_SE_1LDSB0_AF0EM1_AF1EM1_AMAS0_BL1_DTL0_DVO0_EPS0_FL0_GRVW1_GSU1_ISA908_IU1_KLA_LRVW1_MAC_MDA2_NLCA2_NLCB3_ONLL1_PGR2_PLR1_SIA3_SU32_SUS128_SRVW2_SVW4_SNLL0_TT1_96_TLDS0_USFGROn1_VSn1_VW1_WSGRA1_WSGRB1_WG128_2_1_WGM15
    SolutionIndex: 103
    SolutionNameMin: Cijk_Ailk_Bjlk_SB_MT96x96x8_MI16x16x4x1_SE_1LDSB0_AF0EM1_AF1EM1_AMAS0_BL1_DTL0_DVO0_EPS0_FL0_GRVW1_GSU1_ISA908_IU1_KLA_LRVW1_MAC_MDA2_NLCA3_NLCB3_ONLL1_PGR2_PLR1_SIA3_SU32_SUS256_SRVW0_SVW4_SNLL0_TT3_48_TLDS0_USFGROn1_VSn1_VW1_WSGRA1_WSGRB1_WG32_8_1_WGM15
    SolutionIndex: 104
    SolutionNameMin: Cijk_Ailk_Bjlk_SB_MT128x96x16_MI32x32x2x1_SE_1LDSB0_AF0EM1_AF1EM1_AMAS0_BL1_DTL0_DVO0_EPS0_FL0_GRVW2_GSU1_ISA908_IU1_KLA_LRVW1_MAC_MDA2_NLCA1_NLCB3_ONLL1_PGR2_PLR1_SIA3_SU0_SUS256_SRVW2_SVW4_SNLL0_TT1_96_TLDS0_USFGROn1_VSn1_VW1_WSGRA1_WSGRB1_WG128_2_1_WGM2
    SolutionIndex: 105
    SolutionNameMin: Cijk_Ailk_Bjlk_SB_MT64x64x32_MI32x32x2x1_SE_1LDSB0_AF0EM1_AF1EM1_AMAS0_BL1_DTL0_DVO0_EPS1_FL0_GRVW4_GSU1_ISA908_IU1_KLA_LRVW1_MAC_MDA2_NLCA1_NLCB1_ONLL1_PGR1_PLR1_SIA3_SU0_SUS256_SRVW2_SVW4_SNLL0_TT1_32_TLDS0_USFGROn1_VSn1_VW1_WSGRA1_WSGRB1_WG64_4_1_WGM15
    SolutionIndex: 106
    SolutionNameMin: Cijk_Ailk_Bjlk_SB_MT64x32x32_MI16x16x4x1_SE_1LDSB0_AF0EM1_AF1EM1_AMAS0_BL1_DTL0_DVO0_EPS0_FL0_GRVW1_GSU1_ISA908_IU1_KLA_LRVW1_MAC_MDA2_NLCA1_NLCB1_ONLL1_PGR2_PLR1_SIA3_SU0_SUS256_SRVW2_SVW4_SNLL0_TT2_16_TLDS0_USFGROn1_VSn1_VW1_WSGRA1_WSGRB1_WG32_8_1_WGM1
    SolutionIndex: 107
    SolutionNameMin: Cijk_Ailk_Bjlk_SB_MT64x64x32_MI32x32x2x1_SE_1LDSB0_AF0EM1_AF1EM1_AMAS0_BL1_DTL0_DVO0_EPS0_FL0_GRVW2_GSU1_ISA908_IU1_KLA_LRVW1_MAC_MDA2_NLCA1_NLCB1_ONLL1_PGR2_PLR1_SIA3_SU32_SUS256_SRVW2_SVW4_SNLL0_TT1_32_TLDS0_USFGROn1_VSn1_VW1_WSGRA1_WSGRB1_WG64_4_1_WGM15
    SolutionIndex: 108
    SolutionNameMin: Cijk_Ailk_Bjlk_SB_MT64x64x16_MI32x32x2x1_SE_1LDSB0_AF0EM1_AF1EM1_AMAS0_BL1_DTL0_DVO0_EPS0_FL0_GRVW4_GSU1_ISA908_IU1_KLA_LRVW1_MAC_MDA2_NLCA1_NLCB1_ONLL1_PGR2_PLR1_SIA3_SU0_SUS128_SRVW2_SVW4_SNLL0_TT1_32_TLDS0_USFGROn1_VSn1_VW1_WSGRA1_WSGRB1_WG64_4_1_WGM1
    SolutionIndex: 109
    SolutionNameMin: Cijk_Ailk_Bjlk_SB_MT64x64x32_MI32x32x2x1_SE_1LDSB0_AF0EM1_AF1EM1_AMAS0_BL1_DTL0_DVO0_EPS0_FL0_GRVW2_GSU1_ISA908_IU1_KLA_LRVW1_MAC_MDA2_NLCA1_NLCB1_ONLL1_PGR2_PLR1_SIA3_SU32_SUS128_SRVW2_SVW4_SNLL0_TT1_32_TLDS0_USFGROn1_VSn1_VW1_WSGRA1_WSGRB1_WG64_4_1_WGM2
    SolutionIndex: 110
    SolutionNameMin: Cijk_Ailk_Bjlk_SB_MT32x8x32_SN_1LDSB0_AF0EM1_AF1EM1_AMAS3_BL1_DTL0_DVO0_EPS1_FL0_GRVW2_GSU2_ISA908_IU1_KLA_LRVW2_MAC_MDA2_NLCA1_NLCB1_ONLL1_PGR1_PLR1_SIA1_SU32_SUS256_SRVW0_SVW4_SNLL0_TT2_2_TLDS0_USFGRO0_VS1_VW2_WSGRA0_WSGRB0_WG16_4_4_WGM1
    SolutionIndex: 111
    SolutionNameMin: Cijk_Ailk_Bjlk_SB_MT64x128x8_MI32x32x2x1_SE_1LDSB0_AF0EM1_AF1EM1_AMAS0_BL1_DTL0_DVO0_EPS0_FL0_GRVW4_GSU1_ISA908_IU1_KLA_LRVW1_MAC_MDA2_NLCA1_NLCB1_ONLL1_PGR2_PLR1_SIA3_SU32_SUS256_SRVW2_SVW4_SNLL0_TT1_64_TLDS0_USFGROn1_VSn1_VW1_WSGRA1_WSGRB1_WG64_4_1_WGM2
    SolutionIndex: 112
    SolutionNameMin: Cijk_Ailk_Bjlk_SB_MT16x64x32_MI16x16x4x1_SE_1LDSB0_AF0EM1_AF1EM1_AMAS0_BL1_DTL0_DVO0_EPS0_FL0_GRVW1_GSU1_ISA908_IU1_KLA_LRVW1_MAC_MDA2_NLCA1_NLCB1_ONLL1_PGR2_PLR1_SIA3_SU0_SUS256_SRVW0_SVW4_SNLL0_TT1_16_TLDS0_USFGROn1_VSn1_VW1_WSGRA1_WSGRB1_WG16_16_1_WGM15
    SolutionIndex: 113
    SolutionNameMin: Cijk_Ailk_Bjlk_SB_MT64x16x32_SE_1LDSB0_AF0EM1_AF1EM1_AMAS3_BL1_DTL0_DVO0_EPS1_FL1_GRVW2_GSU1_ISA908_IU1_KLA_LRVW2_MAC_MDA2_NLCA1_NLCB1_ONLL1_PGR1_PLR1_SIA1_SU32_SUS256_SRVW0_SVW4_SNLL0_TT4_4_TLDS0_USFGRO0_VS1_VW2_WSGRA0_WSGRB0_WG16_4_4_WGM1
    SolutionIndex: 114
    SolutionNameMin: Cijk_Ailk_Bjlk_SB_MT32x32x32_MI16x16x4x1_SE_1LDSB0_AF0EM1_AF1EM1_AMAS0_BL1_DTL0_DVO0_EPS0_FL0_GRVW4_GSU1_ISA908_IU1_KLA_LRVW1_MAC_MDA2_NLCA1_NLCB1_ONLL1_PGR2_PLR1_SIA3_SU32_SUS128_SRVW2_SVW4_SNLL0_TT1_16_TLDS0_USFGROn1_VSn1_VW1_WSGRA1_WSGRB1_WG32_8_1_WGM1
    SolutionIndex: 115
    SolutionNameMin: Cijk_Ailk_Bjlk_SB_MT128x96x8_MI32x32x2x1_SE_1LDSB0_AF0EM1_AF1EM1_AMAS0_BL1_DTL0_DVO0_EPS0_FL0_GRVW1_GSU1_ISA908_IU1_KLA_LRVW1_MAC_MDA2_NLCA2_NLCB3_ONLL1_PGR2_PLR1_SIA3_SU0_SUS256_SRVW2_SVW4_SNLL0_TT1_96_TLDS0_USFGROn1_VSn1_VW1_WSGRA1_WSGRB1_WG128_2_1_WGM15
    SolutionIndex: 116
    SolutionNameMin: Cijk_Ailk_Bjlk_SB_MT64x128x16_MI32x32x2x1_SE_1LDSB0_AF0EM1_AF1EM1_AMAS0_BL1_DTL0_DVO0_EPS0_FL0_GRVW4_GSU1_ISA908_IU1_KLA_LRVW1_MAC_MDA2_NLCA1_NLCB1_ONLL1_PGR2_PLR1_SIA3_SU32_SUS128_SRVW2_SVW4_SNLL0_TT1_64_TLDS0_USFGROn1_VSn1_VW1_WSGRA1_WSGRB1_WG64_4_1_WGM1
    SolutionIndex: 117
    SolutionNameMin: Cijk_Ailk_Bjlk_SB_MT16x16x16_SN_1LDSB0_AF0EM1_AF1EM1_AMAS3_BL1_DTL0_DVO0_EPS1_FL0_GRVW2_GSU2_ISA908_IU1_KLA_LRVW2_MAC_MDA2_NLCA1_NLCB1_ONLL1_PGR1_PLR1_SIA1_SU32_SUS256_SRVW0_SVW4_SNLL0_TT2_2_TLDS0_USFGRO1_VS1_VW2_WSGRA0_WSGRB0_WG8_8_4_WGM1
    SolutionIndex: 118
    SolutionNameMin: Cijk_Ailk_Bjlk_SB_MT128x144x16_MI16x16x4x1_SE_1LDSB1_AF0EM1_AF1EM1_AMAS0_BL1_DTL0_DVO0_EPS1_FL0_GRVW1_GSU1_ISA908_IU1_KLA_LRVW1_MAC_MDA2_NLCA2_NLCB9_ONLL1_PGR1_PLR1_SIA3_SU0_SUS256_SRVW2_SVW4_SNLL0_TT2_144_TLDS0_USFGROn1_VSn1_VW1_WSGRA1_WSGRB1_WG64_4_1_WGM1
    SolutionIndex: 119
    SolutionNameMin: Cijk_Ailk_Bjlk_SB_MT32x32x32_MI16x16x4x1_SE_1LDSB0_AF0EM1_AF1EM1_AMAS0_BL1_DTL0_DVO0_EPS0_FL0_GRVW1_GSU1_ISA908_IU1_KLA_LRVW1_MAC_MDA2_NLCA1_NLCB1_ONLL1_PGR2_PLR1_SIA3_SU32_SUS128_SRVW2_SVW4_SNLL0_TT1_16_TLDS0_USFGROn1_VSn1_VW1_WSGRA1_WSGRB1_WG32_8_1_WGM1
    SolutionIndex: 120
    SolutionNameMin: Cijk_Ailk_Bjlk_SB_MT32x8x8_SN_1LDSB0_AF0EM1_AF1EM1_AMAS2_BL0_DTL0_DVO0_EPS0_FL0_GRVW2_GSU1_ISA000_IU1_KLS_LRVW2_FMA_MDA2_NLCA1_NLCB1_ONLL1_PGR1_PLR1_SIA1_SU32_SUS256_SRVW0_SVW4_SNLL0_TT2_2_TLDS0_USFGRO0_VS1_VW2_WSGRA0_WSGRB0_WG16_4_1_WGM1
    SolutionIndex: 121
    SolutionNameMin: Cijk_Ailk_Bjlk_SB_MT64x64x16_MI16x16x4x1_SE_1LDSB0_AF0EM1_AF1EM1_AMAS3_BL1_DTL0_DVO1_EPS1_FL1_GRVW4_GSU1_ISA908_IU1_KLA_LRVW1_MAC_MDA2_NLCA1_NLCB1_ONLL2_PGR1_PLR1_SIA3_SU32_SUS256_SRVW4_SVW4_SNLL0_TT4_16_TLDS1_USFGROn1_VSn1_VW4_WSGRA0_WSGRB0_WG16_16_1_WGM1
    SolutionIndex: 122
    SolutionNameMin: Cijk_Ailk_Bjlk_SB_MT64x128x8_MI32x32x2x1_SE_1LDSB0_AF0EM1_AF1EM1_AMAS0_BL1_DTL0_DVO0_EPS0_FL0_GRVW4_GSU1_ISA908_IU1_KLA_LRVW1_MAC_MDA2_NLCA1_NLCB1_ONLL1_PGR2_PLR1_SIA3_SU32_SUS128_SRVW2_SVW4_SNLL0_TT1_64_TLDS0_USFGROn1_VSn1_VW1_WSGRA1_WSGRB1_WG64_4_1_WGM15
    SolutionIndex: 123
    SolutionNameMin: Cijk_Ailk_Bjlk_SB_MT64x64x16_MI32x32x2x1_SE_1LDSB0_AF0EM1_AF1EM1_AMAS0_BL1_DTL0_DVO0_EPS0_FL0_GRVW4_GSU1_ISA908_IU1_KLA_LRVW1_MAC_MDA2_NLCA1_NLCB1_ONLL1_PGR2_PLR1_SIA3_SU0_SUS256_SRVW2_SVW4_SNLL0_TT1_32_TLDS0_USFGROn1_VSn1_VW1_WSGRA1_WSGRB1_WG64_4_1_WGM2
    SolutionIndex: 124
    SolutionNameMin: Cijk_Ailk_Bjlk_SB_MT64x64x32_MI16x16x4x1_SE_1LDSB0_AF0EM1_AF1EM1_AMAS3_BL1_DTL0_DVO1_EPS1_FL1_GRVW4_GSU1_ISA908_IU1_KLA_LRVW1_MAC_MDA1_NLCA1_NLCB1_ONLL2_PGR1_PLR1_SIA3_SU32_SUS256_SRVW4_SVW4_SNLL0_TT4_16_TLDS0_USFGROn1_VSn1_VW4_WSGRA0_WSGRB0_WG16_16_1_WGM8
    SolutionIndex: 125
    SolutionNameMin: Cijk_Ailk_Bjlk_SB_MT64x128x16_MI32x32x2x1_SE_1LDSB0_AF0EM1_AF1EM1_AMAS0_BL1_DTL0_DVO0_EPS0_FL0_GRVW2_GSU1_ISA908_IU1_KLA_LRVW1_MAC_MDA2_NLCA1_NLCB1_ONLL1_PGR2_PLR1_SIA3_SU32_SUS128_SRVW2_SVW4_SNLL0_TT1_64_TLDS0_USFGROn1_VSn1_VW1_WSGRA1_WSGRB1_WG64_4_1_WGM1
    SolutionIndex: 126
    SolutionNameMin: Cijk_Ailk_Bjlk_SB_MT64x64x32_MI32x32x2x1_SE_1LDSB0_AF0EM1_AF1EM1_AMAS0_BL1_DTL0_DVO0_EPS1_FL0_GRVW4_GSU1_ISA908_IU1_KLA_LRVW1_MAC_MDA2_NLCA1_NLCB1_ONLL1_PGR1_PLR1_SIA3_SU0_SUS256_SRVW2_SVW4_SNLL0_TT1_32_TLDS0_USFGROn1_VSn1_VW1_WSGRA1_WSGRB1_WG64_4_1_WGM1
    SolutionIndex: 127
    SolutionNameMin: Cijk_Ailk_Bjlk_SB_MT96x96x16_MI16x16x4x1_SE_1LDSB1_AF0EM1_AF1EM1_AMAS0_BL1_DTL0_DVO0_EPS1_FL0_GRVW2_GSU1_ISA908_IU1_KLA_LRVW1_MAC_MDA2_NLCA3_NLCB3_ONLL1_PGR1_PLR1_SIA3_SU32_SUS256_SRVW0_SVW4_SNLL0_TT3_48_TLDS0_USFGROn1_VSn1_VW1_WSGRA1_WSGRB1_WG32_8_1_WGM2
    SolutionIndex: 128
    SolutionNameMin: Cijk_Ailk_Bjlk_SB_MT96x96x32_MI16x16x4x1_SN_1LDSB1_AF0EM1_AF1EM1_AMAS0_BL1_DTL0_DVO0_EPS1_FL0_GRVW4_GSU1_ISA908_IU1_KLA_LRVW1_MAC_MDA2_NLCA3_NLCB3_ONLL1_PGR1_PLR1_SIA3_SU32_SUS256_SRVW0_SVW4_SNLL0_TT3_48_TLDS0_USFGROn1_VSn1_VW1_WSGRA1_WSGRB1_WG32_8_1_WGM15
    SolutionIndex: 129
    SolutionNameMin: Cijk_Ailk_Bjlk_SB_MT64x64x32_MI16x16x4x1_SE_1LDSB0_AF0EM1_AF1EM1_AMAS3_BL1_DTL0_DVO0_EPS1_FL1_GRVW4_GSU1_ISA908_IU1_KLA_LRVW1_MAC_MDA2_NLCA1_NLCB1_ONLL0_PGR1_PLR1_SIA3_SU32_SUS256_SRVW4_SVW4_SNLL0_TT4_16_TLDS1_USFGROn1_VSn1_VW4_WSGRA0_WSGRB0_WG16_16_1_WGM1
    SolutionIndex: 130
    SolutionNameMin: Cijk_Ailk_Bjlk_SB_MT64x192x16_MI32x32x2x1_SE_1LDSB0_AF0EM1_AF1EM1_AMAS0_BL1_DTL0_DVO0_EPS1_FL0_GRVW4_GSU1_ISA908_IU1_KLA_LRVW1_MAC_MDA2_NLCA1_NLCB3_ONLL1_PGR1_PLR1_SIA3_SU0_SUS256_SRVW2_SVW4_SNLL0_TT1_96_TLDS0_USFGROn1_VSn1_VW1_WSGRA1_WSGRB1_WG64_4_1_WGM1
    SolutionIndex: 131
    SolutionNameMin: Cijk_Ailk_Bjlk_SB_MT64x64x16_SN_1LDSB0_AF0EM1_AF1EM1_AMAS3_BL1_DTL0_DVO0_EPS1_FL0_GRVW4_GSU1_ISA908_IU1_KLA_LRVW4_MAC_MDA2_NLCA1_NLCB1_ONLL1_PGR1_PLR1_SIA1_SU32_SUS256_SRVW0_SVW4_SNLL0_TT4_4_TLDS0_USFGRO0_VS1_VW4_WSGRA0_WSGRB0_WG16_16_1_WGM1
    SolutionIndex: 132
    SolutionNameMin: Cijk_Ailk_Bjlk_SB_MT64x64x32_MI32x32x2x1_SE_1LDSB0_AF0EM1_AF1EM1_AMAS0_BL1_DTL0_DVO0_EPS0_FL0_GRVW2_GSU1_ISA908_IU1_KLA_LRVW1_MAC_MDA2_NLCA1_NLCB1_ONLL1_PGR2_PLR1_SIA3_SU0_SUS256_SRVW2_SVW4_SNLL0_TT1_32_TLDS0_USFGROn1_VSn1_VW1_WSGRA1_WSGRB1_WG64_4_1_WGM1
    SolutionIndex: 133
    SolutionNameMin: Cijk_Ailk_Bjlk_SB_MT64x128x8_MI32x32x2x1_SE_1LDSB0_AF0EM1_AF1EM1_AMAS0_BL1_DTL0_DVO0_EPS0_FL0_GRVW1_GSU1_ISA908_IU1_KLA_LRVW1_MAC_MDA2_NLCA1_NLCB2_ONLL1_PGR2_PLR1_SIA3_SU32_SUS128_SRVW2_SVW4_SNLL0_TT1_64_TLDS0_USFGROn1_VSn1_VW1_WSGRA1_WSGRB1_WG64_4_1_WGM2
    SolutionIndex: 134
    SolutionNameMin: Cijk_Ailk_Bjlk_SB_MT16x32x32_SE_1LDSB0_AF0EM1_AF1EM1_AMAS3_BL1_DTL0_DVO0_EPS1_FL0_GRVW2_GSU1_ISA908_IU1_KLA_LRVW2_MAC_MDA2_NLCA1_NLCB1_ONLL1_PGR1_PLR1_SIA1_SU32_SUS256_SRVW0_SVW4_SNLL0_TT2_4_TLDS0_USFGRO0_VS1_VW2_WSGRA0_WSGRB0_WG8_8_4_WGM1
    SolutionIndex: 135
    SolutionNameMin: Cijk_Ailk_Bjlk_SB_MT64x128x8_MI32x32x2x1_SE_1LDSB0_AF0EM1_AF1EM1_AMAS0_BL1_DTL0_DVO0_EPS0_FL0_GRVW2_GSU1_ISA908_IU1_KLA_LRVW1_MAC_MDA2_NLCA1_NLCB1_ONLL1_PGR2_PLR1_SIA3_SU0_SUS256_SRVW2_SVW4_SNLL0_TT1_64_TLDS0_USFGROn1_VSn1_VW1_WSGRA1_WSGRB1_WG64_4_1_WGM1
    SolutionIndex: 136
    SolutionNameMin: Cijk_Ailk_Bjlk_SB_MT64x32x32_MI16x16x4x1_SE_1LDSB0_AF0EM1_AF1EM1_AMAS0_BL1_DTL0_DVO0_EPS0_FL0_GRVW2_GSU1_ISA908_IU1_KLA_LRVW1_MAC_MDA2_NLCA1_NLCB1_ONLL1_PGR2_PLR1_SIA3_SU0_SUS256_SRVW2_SVW4_SNLL0_TT2_16_TLDS0_USFGROn1_VSn1_VW1_WSGRA1_WSGRB1_WG32_8_1_WGM1
    SolutionIndex: 137
    SolutionNameMin: Cijk_Ailk_Bjlk_SB_MT8x8x8_SN_1LDSB0_AF0EM1_AF1EM1_AMAS3_BL1_DTL0_DVO0_EPS1_FL0_GRVW2_GSU16_ISA908_IU1_KLA_LRVW2_MAC_MDA2_NLCA1_NLCB1_ONLL1_PGR1_PLR1_SIA1_SU32_SUS256_SRVW0_SVW4_SNLL0_TT2_2_TLDS0_USFGRO1_VS1_VW2_WSGRA0_WSGRB0_WG4_4_4_WGM1
    SolutionIndex: 138
    SolutionNameMin: Cijk_Ailk_Bjlk_SB_MT64x64x32_MI32x32x2x1_SE_1LDSB0_AF0EM1_AF1EM1_AMAS0_BL1_DTL0_DVO0_EPS0_FL0_GRVW2_GSU1_ISA908_IU1_KLA_LRVW1_MAC_MDA2_NLCA1_NLCB1_ONLL1_PGR2_PLR1_SIA3_SU0_SUS256_SRVW2_SVW4_SNLL0_TT1_32_TLDS0_USFGROn1_VSn1_VW1_WSGRA1_WSGRB1_WG64_4_1_WGM2
    SolutionIndex: 139
    SolutionNameMin: Cijk_Ailk_Bjlk_SB_MT64x64x32_MI32x32x2x1_SE_1LDSB0_AF0EM1_AF1EM1_AMAS0_BL1_DTL0_DVO0_EPS0_FL0_GRVW2_GSU1_ISA908_IU1_KLA_LRVW1_MAC_MDA2_NLCA1_NLCB1_ONLL1_PGR2_PLR1_SIA3_SU32_SUS128_SRVW2_SVW4_SNLL0_TT1_32_TLDS0_USFGROn1_VSn1_VW1_WSGRA1_WSGRB1_WG64_4_1_WGM15
    SolutionIndex: 140
    SolutionNameMin: Cijk_Ailk_Bjlk_SB_MT32x32x32_MI16x16x4x1_SE_1LDSB0_AF0EM1_AF1EM1_AMAS0_BL1_DTL0_DVO0_EPS0_FL0_GRVW1_GSU3_ISA908_IU1_KLA_LRVW1_MAC_MDA2_NLCA1_NLCB1_ONLL1_PGR2_PLR1_SIA3_SU0_SUS256_SRVW0_SVW4_SNLL0_TT1_16_TLDS0_USFGROn1_VSn1_VW1_WSGRA1_WSGRB1_WG32_8_1_WGM2
    SolutionIndex: 141
    SolutionNameMin: Cijk_Ailk_Bjlk_SB_MT128x96x8_MI32x32x2x1_SE_1LDSB0_AF0EM1_AF1EM1_AMAS0_BL1_DTL0_DVO0_EPS0_FL0_GRVW1_GSU1_ISA908_IU1_KLA_LRVW1_MAC_MDA2_NLCA2_NLCB3_ONLL1_PGR2_PLR1_SIA3_SU32_SUS128_SRVW2_SVW4_SNLL0_TT1_96_TLDS0_USFGROn1_VSn1_VW1_WSGRA1_WSGRB1_WG128_2_1_WGM2
    SolutionIndex: 142
    SolutionNameMin: Cijk_Ailk_Bjlk_SB_MT64x128x16_MI32x32x2x1_SE_1LDSB0_AF0EM1_AF1EM1_AMAS0_BL1_DTL0_DVO0_EPS0_FL0_GRVW1_GSU1_ISA908_IU1_KLA_LRVW1_MAC_MDA2_NLCA1_NLCB2_ONLL1_PGR2_PLR1_SIA3_SU32_SUS128_SRVW2_SVW4_SNLL0_TT1_64_TLDS0_USFGROn1_VSn1_VW1_WSGRA1_WSGRB1_WG64_4_1_WGM15
    SolutionIndex: 143
    SolutionNameMin: Cijk_Ailk_Bjlk_SB_MT128x64x32_MI32x32x2x1_SE_1LDSB0_AF0EM1_AF1EM1_AMAS3_BL1_DTL0_DVO0_EPS1_FL0_GRVW4_GSU1_ISA908_IU1_KLA_LRVW1_MAC_MDA2_NLCA1_NLCB1_ONLL1_PGR1_PLR1_SIA3_SU32_SUS256_SRVW0_SVW4_SNLL0_TT2_32_TLDS1_USFGROn1_VSn1_VW2_WSGRA1_WSGRB1_WG64_4_1_WGM8
    SolutionIndex: 144
    SolutionNameMin: Cijk_Ailk_Bjlk_SB_MT64x128x8_MI32x32x2x1_SE_1LDSB0_AF0EM1_AF1EM1_AMAS0_BL1_DTL0_DVO0_EPS0_FL0_GRVW2_GSU1_ISA908_IU1_KLA_LRVW1_MAC_MDA2_NLCA1_NLCB1_ONLL1_PGR2_PLR1_SIA3_SU0_SUS256_SRVW2_SVW4_SNLL0_TT1_64_TLDS0_USFGROn1_VSn1_VW1_WSGRA1_WSGRB1_WG64_4_1_WGM2
    SolutionIndex: 145
    SolutionNameMin: Cijk_Ailk_Bjlk_SB_MT64x64x32_MI16x16x4x1_SE_1LDSB0_AF0EM4_AF1EM1_AMAS3_BL1_DTL0_DVO1_EPS1_FL1_GRVW4_GSU1_ISA908_IU1_KLA_LRVW1_MAC_MDA2_NLCA1_NLCB1_ONLL0_PGR1_PLR1_SIA3_SU32_SUS256_SRVW4_SVW4_SNLL0_TT4_16_TLDS1_USFGROn1_VSn1_VW4_WSGRA0_WSGRB0_WG16_16_1_WGM1
    SolutionIndex: 146
    SolutionNameMin: Cijk_Ailk_Bjlk_SB_MT16x16x32_SN_1LDSB0_AF0EM1_AF1EM1_AMAS3_BL1_DTL0_DVO0_EPS1_FL0_GRVW2_GSU4_ISA908_IU1_KLA_LRVW2_MAC_MDA2_NLCA1_NLCB1_ONLL1_PGR1_PLR1_SIA1_SU32_SUS256_SRVW0_SVW4_SNLL0_TT2_2_TLDS0_USFGRO0_VS1_VW2_WSGRA0_WSGRB0_WG8_8_4_WGM1
    SolutionIndex: 147
    SolutionNameMin: Cijk_Ailk_Bjlk_SB_MT32x8x32_SN_1LDSB0_AF0EM1_AF1EM1_AMAS3_BL1_DTL0_DVO0_EPS1_FL0_GRVW2_GSU8_ISA908_IU1_KLA_LRVW2_MAC_MDA2_NLCA1_NLCB1_ONLL1_PGR1_PLR1_SIA1_SU32_SUS256_SRVW0_SVW4_SNLL0_TT2_2_TLDS0_USFGRO0_VS1_VW2_WSGRA0_WSGRB0_WG16_4_4_WGM1
    SolutionIndex: 148
    SolutionNameMin: Cijk_Ailk_Bjlk_SB_MT144x64x16_MI16x16x4x1_SE_1LDSB0_AF0EM1_AF1EM1_AMAS0_BL1_DTL0_DVO0_EPS0_FL0_GRVW1_GSU1_ISA908_IU1_KLA_LRVW1_MAC_MDA2_NLCA9_NLCB1_ONLL1_PGR2_PLR1_SIA3_SU32_SUS128_SRVW0_SVW4_SNLL0_TT9_16_TLDS0_USFGROn1_VSn1_VW1_WSGRA1_WSGRB1_WG16_16_1_WGM2
    SolutionIndex: 149
    SolutionNameMin: Cijk_Ailk_Bjlk_SB_MT128x144x16_MI16x16x4x1_SE_1LDSB1_AF0EM1_AF1EM1_AMAS0_BL1_DTL0_DVO0_EPS1_FL0_GRVW1_GSU1_ISA908_IU1_KLA_LRVW1_MAC_MDA2_NLCA2_NLCB9_ONLL1_PGR1_PLR1_SIA3_SU0_SUS256_SRVW2_SVW4_SNLL0_TT2_144_TLDS0_USFGROn1_VSn1_VW1_WSGRA1_WSGRB1_WG64_4_1_WGM15
    SolutionIndex: 150
    SolutionNameMin: Cijk_Ailk_Bjlk_SB_MT64x128x8_MI32x32x2x1_SE_1LDSB0_AF0EM1_AF1EM1_AMAS0_BL1_DTL0_DVO0_EPS0_FL0_GRVW1_GSU1_ISA908_IU1_KLA_LRVW1_MAC_MDA2_NLCA1_NLCB2_ONLL1_PGR2_PLR1_SIA3_SU32_SUS256_SRVW2_SVW4_SNLL0_TT1_64_TLDS0_USFGROn1_VSn1_VW1_WSGRA1_WSGRB1_WG64_4_1_WGM1
    SolutionIndex: 151
    SolutionNameMin: Cijk_Ailk_Bjlk_SB_MT64x32x8_MI16x16x4x1_SE_1LDSB0_AF0EM1_AF1EM1_AMAS0_BL1_DTL0_DVO0_EPS0_FL0_GRVW1_GSU1_ISA908_IU1_KLA_LRVW1_MAC_MDA2_NLCA1_NLCB1_ONLL1_PGR2_PLR1_SIA3_SU0_SUS256_SRVW2_SVW4_SNLL0_TT2_16_TLDS0_USFGROn1_VSn1_VW1_WSGRA1_WSGRB1_WG32_8_1_WGM15
    SolutionIndex: 152
    SolutionNameMin: Cijk_Ailk_Bjlk_SB_MT128x96x8_MI32x32x2x1_SE_1LDSB0_AF0EM1_AF1EM1_AMAS0_BL1_DTL0_DVO0_EPS0_FL0_GRVW1_GSU1_ISA908_IU1_KLA_LRVW1_MAC_MDA2_NLCA2_NLCB3_ONLL1_PGR2_PLR1_SIA3_SU32_SUS256_SRVW2_SVW4_SNLL0_TT1_96_TLDS0_USFGROn1_VSn1_VW1_WSGRA1_WSGRB1_WG128_2_1_WGM2
    SolutionIndex: 153
    SolutionNameMin: Cijk_Ailk_Bjlk_SB_MT128x96x16_MI32x32x2x1_SE_1LDSB0_AF0EM1_AF1EM1_AMAS0_BL1_DTL0_DVO0_EPS0_FL0_GRVW2_GSU1_ISA908_IU1_KLA_LRVW1_MAC_MDA2_NLCA1_NLCB3_ONLL1_PGR2_PLR1_SIA3_SU32_SUS256_SRVW2_SVW4_SNLL0_TT1_96_TLDS0_USFGROn1_VSn1_VW1_WSGRA1_WSGRB1_WG128_2_1_WGM2
    SolutionIndex: 154
    SolutionNameMin: Cijk_Ailk_Bjlk_SB_MT64x64x16_MI32x32x2x1_SE_1LDSB0_AF0EM1_AF1EM1_AMAS0_BL1_DTL0_DVO0_EPS0_FL0_GRVW1_GSU1_ISA908_IU1_KLA_LRVW1_MAC_MDA2_NLCA1_NLCB1_ONLL1_PGR2_PLR1_SIA3_SU32_SUS256_SRVW2_SVW4_SNLL0_TT1_32_TLDS0_USFGROn1_VSn1_VW1_WSGRA1_WSGRB1_WG64_4_1_WGM1
    SolutionIndex: 155
    SolutionNameMin: Cijk_Ailk_Bjlk_SB_MT64x128x16_MI32x32x2x1_SE_1LDSB0_AF0EM1_AF1EM1_AMAS0_BL1_DTL0_DVO0_EPS1_FL0_GRVW4_GSU1_ISA908_IU1_KLA_LRVW1_MAC_MDA2_NLCA1_NLCB1_ONLL1_PGR1_PLR1_SIA3_SU32_SUS256_SRVW2_SVW4_SNLL0_TT1_64_TLDS0_USFGROn1_VSn1_VW1_WSGRA1_WSGRB1_WG64_4_1_WGM2
    SolutionIndex: 156
    SolutionNameMin: Cijk_Ailk_Bjlk_SB_MT128x96x8_MI32x32x2x1_SE_1LDSB0_AF0EM1_AF1EM1_AMAS0_BL1_DTL0_DVO0_EPS0_FL0_GRVW1_GSU1_ISA908_IU1_KLA_LRVW1_MAC_MDA2_NLCA2_NLCB3_ONLL1_PGR2_PLR1_SIA3_SU0_SUS256_SRVW2_SVW4_SNLL0_TT1_96_TLDS0_USFGROn1_VSn1_VW1_WSGRA1_WSGRB1_WG128_2_1_WGM1
    SolutionIndex: 157
    SolutionNameMin: Cijk_Ailk_Bjlk_SB_MT64x256x8_MI32x32x2x1_SE_1LDSB0_AF0EM1_AF1EM1_AMAS0_BL1_DTL0_DVO0_EPS0_FL0_GRVW4_GSU1_ISA908_IU1_KLA_LRVW1_MAC_MDA2_NLCA1_NLCB1_ONLL1_PGR2_PLR1_SIA3_SU0_SUS256_SRVW2_SVW4_SNLL0_TT1_128_TLDS0_USFGROn1_VSn1_VW1_WSGRA1_WSGRB1_WG64_4_1_WGM1
    SolutionIndex: 158
    SolutionNameMin: Cijk_Ailk_Bjlk_SB_MT64x192x16_MI32x32x2x1_SE_1LDSB0_AF0EM1_AF1EM1_AMAS0_BL1_DTL0_DVO0_EPS0_FL0_GRVW4_GSU1_ISA908_IU1_KLA_LRVW1_MAC_MDA2_NLCA1_NLCB3_ONLL1_PGR2_PLR1_SIA3_SU0_SUS256_SRVW2_SVW4_SNLL0_TT1_96_TLDS0_USFGROn1_VSn1_VW1_WSGRA1_WSGRB1_WG64_4_1_WGM15
    SolutionIndex: 159
    SolutionNameMin: Cijk_Ailk_Bjlk_SB_MT128x144x16_MI16x16x4x1_SE_1LDSB1_AF0EM1_AF1EM1_AMAS0_BL1_DTL0_DVO0_EPS0_FL0_GRVW1_GSU1_ISA908_IU1_KLA_LRVW1_MAC_MDA2_NLCA2_NLCB9_ONLL1_PGR2_PLR1_SIA3_SU32_SUS256_SRVW2_SVW4_SNLL0_TT2_144_TLDS0_USFGROn1_VSn1_VW1_WSGRA1_WSGRB1_WG64_4_1_WGM1
    SolutionIndex: 160
    SolutionNameMin: Cijk_Ailk_Bjlk_SB_MT64x128x8_MI32x32x2x1_SE_1LDSB0_AF0EM1_AF1EM1_AMAS0_BL1_DTL0_DVO0_EPS0_FL0_GRVW4_GSU1_ISA908_IU1_KLA_LRVW1_MAC_MDA2_NLCA1_NLCB1_ONLL1_PGR2_PLR1_SIA3_SU32_SUS256_SRVW2_SVW4_SNLL0_TT1_64_TLDS0_USFGROn1_VSn1_VW1_WSGRA1_WSGRB1_WG64_4_1_WGM8
    SolutionIndex: 161
    SolutionNameMin: Cijk_Ailk_Bjlk_SB_MT32x32x32_MI16x16x4x1_SE_1LDSB0_AF0EM1_AF1EM1_AMAS0_BL1_DTL0_DVO0_EPS0_FL0_GRVW4_GSU3_ISA908_IU1_KLA_LRVW1_MAC_MDA2_NLCA1_NLCB1_ONLL1_PGR2_PLR1_SIA3_SU0_SUS256_SRVW0_SVW4_SNLL0_TT1_16_TLDS0_USFGROn1_VSn1_VW1_WSGRA1_WSGRB1_WG32_8_1_WGM1
    SolutionIndex: 162
    SolutionNameMin: Cijk_Ailk_Bjlk_SB_MT16x64x16_MI16x16x4x1_SE_1LDSB0_AF0EM1_AF1EM1_AMAS0_BL1_DTL0_DVO0_EPS0_FL0_GRVW1_GSU5_ISA908_IU1_KLA_LRVW1_MAC_MDA2_NLCA1_NLCB1_ONLL1_PGR2_PLR1_SIA3_SU0_SUS256_SRVW0_SVW4_SNLL0_TT1_16_TLDS0_USFGROn1_VSn1_VW1_WSGRA1_WSGRB1_WG16_16_1_WGM2
    SolutionIndex: 163
    SolutionNameMin: Cijk_Ailk_Bjlk_SB_MT64x32x32_MI16x16x4x1_SE_1LDSB0_AF0EM1_AF1EM1_AMAS0_BL1_DTL0_DVO0_EPS0_FL0_GRVW4_GSU1_ISA908_IU1_KLA_LRVW1_MAC_MDA2_NLCA1_NLCB1_ONLL1_PGR2_PLR1_SIA3_SU0_SUS256_SRVW2_SVW4_SNLL0_TT2_16_TLDS0_USFGROn1_VSn1_VW1_WSGRA1_WSGRB1_WG32_8_1_WGM8
    SolutionIndex: 164
    SolutionNameMin: Cijk_Ailk_Bjlk_SB_MT128x64x16_MI32x32x2x1_SE_1LDSB0_AF0EM1_AF1EM1_AMAS0_BL1_DTL0_DVO0_EPS0_FL0_GRVW1_GSU1_ISA908_IU1_KLA_LRVW1_MAC_MDA2_NLCA2_NLCB1_ONLL1_PGR2_PLR1_SIA3_SU32_SUS128_SRVW2_SVW4_SNLL0_TT2_32_TLDS0_USFGROn1_VSn1_VW1_WSGRA1_WSGRB1_WG64_4_1_WGM2
    SolutionIndex: 165
    SolutionNameMin: Cijk_Ailk_Bjlk_SB_MT64x64x16_MI32x32x2x1_SE_1LDSB0_AF0EM1_AF1EM1_AMAS0_BL1_DTL0_DVO0_EPS0_FL0_GRVW1_GSU1_ISA908_IU1_KLA_LRVW1_MAC_MDA2_NLCA1_NLCB1_ONLL1_PGR2_PLR1_SIA3_SU32_SUS128_SRVW2_SVW4_SNLL0_TT1_32_TLDS0_USFGROn1_VSn1_VW1_WSGRA1_WSGRB1_WG64_4_1_WGM1
    SolutionIndex: 166
    SolutionNameMin: Cijk_Ailk_Bjlk_SB_MT64x192x8_MI32x32x2x1_SE_1LDSB0_AF0EM1_AF1EM1_AMAS0_BL1_DTL0_DVO0_EPS0_FL0_GRVW2_GSU1_ISA908_IU1_KLA_LRVW1_MAC_MDA2_NLCA1_NLCB3_ONLL1_PGR2_PLR1_SIA3_SU32_SUS256_SRVW2_SVW4_SNLL0_TT1_96_TLDS0_USFGROn1_VSn1_VW1_WSGRA1_WSGRB1_WG64_4_1_WGM2
    SolutionIndex: 167
    SolutionNameMin: Cijk_Ailk_Bjlk_SB_MT32x64x32_MI16x16x4x1_SE_1LDSB0_AF0EM1_AF1EM1_AMAS0_BL1_DTL0_DVO0_EPS0_FL0_GRVW4_GSU1_ISA908_IU1_KLA_LRVW1_MAC_MDA2_NLCA1_NLCB1_ONLL1_PGR2_PLR1_SIA3_SU32_SUS256_SRVW2_SVW4_SNLL0_TT1_32_TLDS0_USFGROn1_VSn1_VW1_WSGRA1_WSGRB1_WG32_8_1_WGM15
    SolutionIndex: 168
    SolutionNameMin: Cijk_Ailk_Bjlk_SB_MT64x64x32_MI32x32x2x1_SE_1LDSB0_AF0EM1_AF1EM1_AMAS0_BL1_DTL0_DVO0_EPS0_FL0_GRVW4_GSU1_ISA908_IU1_KLA_LRVW1_MAC_MDA2_NLCA1_NLCB1_ONLL1_PGR2_PLR1_SIA3_SU32_SUS128_SRVW2_SVW4_SNLL0_TT1_32_TLDS0_USFGROn1_VSn1_VW1_WSGRA1_WSGRB1_WG64_4_1_WGM1
    SolutionIndex: 169
    SolutionNameMin: Cijk_Ailk_Bjlk_SB_MT64x128x16_MI32x32x2x1_SE_1LDSB0_AF0EM1_AF1EM1_AMAS0_BL1_DTL0_DVO0_EPS0_FL0_GRVW2_GSU1_ISA908_IU1_KLA_LRVW1_MAC_MDA2_NLCA1_NLCB1_ONLL1_PGR2_PLR1_SIA3_SU32_SUS128_SRVW2_SVW4_SNLL0_TT1_64_TLDS0_USFGROn1_VSn1_VW1_WSGRA1_WSGRB1_WG64_4_1_WGM2
    SolutionIndex: 170
    SolutionNameMin: Cijk_Ailk_Bjlk_SB_MT64x128x8_MI32x32x2x1_SE_1LDSB0_AF0EM1_AF1EM1_AMAS0_BL1_DTL0_DVO0_EPS0_FL0_GRVW4_GSU1_ISA908_IU1_KLA_LRVW1_MAC_MDA2_NLCA1_NLCB1_ONLL1_PGR2_PLR1_SIA3_SU32_SUS128_SRVW2_SVW4_SNLL0_TT1_64_TLDS0_USFGROn1_VSn1_VW1_WSGRA1_WSGRB1_WG64_4_1_WGM1
    SolutionIndex: 171
    SolutionNameMin: Cijk_Ailk_Bjlk_SB_MT32x32x32_MI16x16x4x1_SE_1LDSB0_AF0EM1_AF1EM1_AMAS0_BL1_DTL0_DVO0_EPS0_FL0_GRVW2_GSU3_ISA908_IU1_KLA_LRVW1_MAC_MDA2_NLCA1_NLCB1_ONLL1_PGR2_PLR1_SIA3_SU0_SUS256_SRVW0_SVW4_SNLL0_TT1_16_TLDS0_USFGROn1_VSn1_VW1_WSGRA1_WSGRB1_WG32_8_1_WGM2
    SolutionIndex: 172
    SolutionNameMin: Cijk_Ailk_Bjlk_SB_MT64x64x32_MI32x32x2x1_SE_1LDSB0_AF0EM1_AF1EM1_AMAS0_BL1_DTL0_DVO0_EPS0_FL0_GRVW2_GSU1_ISA908_IU1_KLA_LRVW1_MAC_MDA2_NLCA1_NLCB1_ONLL1_PGR2_PLR1_SIA3_SU32_SUS128_SRVW2_SVW4_SNLL0_TT1_32_TLDS0_USFGROn1_VSn1_VW1_WSGRA1_WSGRB1_WG64_4_1_WGM1
    SolutionIndex: 173
    SolutionNameMin: Cijk_Ailk_Bjlk_SB_MT64x64x16_SE_1LDSB0_AF0EM1_AF1EM1_AMAS3_BL1_DTL0_DVO0_EPS1_FL1_GRVW4_GSU1_ISA908_IU1_KLA_LRVW4_MAC_MDA2_NLCA1_NLCB1_ONLL1_PGR1_PLR1_SIA1_SU32_SUS256_SRVW0_SVW4_SNLL1_TT4_4_TLDS0_USFGRO0_VS1_VW4_WSGRA0_WSGRB0_WG16_16_1_WGM8
    SolutionIndex: 174
    SolutionNameMin: Cijk_Ailk_Bjlk_SB_MT64x192x16_MI32x32x2x1_SE_1LDSB0_AF0EM1_AF1EM1_AMAS0_BL1_DTL0_DVO0_EPS1_FL0_GRVW4_GSU1_ISA908_IU1_KLA_LRVW1_MAC_MDA2_NLCA1_NLCB3_ONLL1_PGR1_PLR1_SIA3_SU32_SUS256_SRVW2_SVW4_SNLL0_TT1_96_TLDS0_USFGROn1_VSn1_VW1_WSGRA1_WSGRB1_WG64_4_1_WGM15
    SolutionIndex: 175
    SolutionNameMin: Cijk_Ailk_Bjlk_SB_MT64x256x8_MI32x32x2x1_SE_1LDSB0_AF0EM1_AF1EM1_AMAS0_BL1_DTL0_DVO0_EPS0_FL0_GRVW4_GSU1_ISA908_IU1_KLA_LRVW1_MAC_MDA2_NLCA1_NLCB1_ONLL1_PGR2_PLR1_SIA3_SU32_SUS256_SRVW2_SVW4_SNLL0_TT1_128_TLDS0_USFGROn1_VSn1_VW1_WSGRA1_WSGRB1_WG64_4_1_WGM15
    SolutionIndex: 176
    SolutionNameMin: Cijk_Ailk_Bjlk_SB_MT64x64x32_MI16x16x4x1_SE_1LDSB0_AF0EM1_AF1EM1_AMAS3_BL1_DTL0_DVO1_EPS1_FL1_GRVW4_GSU1_ISA908_IU1_KLA_LRVW1_MAC_MDA2_NLCA1_NLCB1_ONLL1_PGR1_PLR1_SIA3_SU32_SUS256_SRVW4_SVW4_SNLL0_TT4_16_TLDS1_USFGROn1_VSn1_VW4_WSGRA0_WSGRB0_WG16_16_1_WGM1
    SolutionIndex: 177
    SolutionNameMin: Cijk_Ailk_Bjlk_SB_MT32x32x32_MI16x16x4x1_SN_1LDSB0_AF0EM1_AF1EM1_AMAS0_BL1_DTL0_DVO0_EPS1_FL0_GRVW1_GSU1_ISA908_IU1_KLA_LRVW1_MAC_MDA2_NLCA1_NLCB1_ONLL1_PGR1_PLR1_SIA3_SU32_SUS256_SRVW2_SVW4_SNLL0_TT1_16_TLDS0_USFGROn1_VSn1_VW1_WSGRA1_WSGRB1_WG32_8_1_WGM15
    SolutionIndex: 178
    SolutionNameMin: Cijk_Ailk_Bjlk_SB_MT64x144x16_MI16x16x4x1_SN_1LDSB0_AF0EM1_AF1EM1_AMAS0_BL1_DTL0_DVO0_EPS0_FL0_GRVW1_GSU1_ISA908_IU1_KLA_LRVW1_MAC_MDA2_NLCA1_NLCB9_ONLL1_PGR2_PLR1_SIA3_SU32_SUS256_SRVW2_SVW4_SNLL0_TT1_144_TLDS0_USFGROn1_VSn1_VW1_WSGRA1_WSGRB1_WG64_4_1_WGM1
    SolutionIndex: 179
    SolutionNameMin: Cijk_Ailk_Bjlk_SB_MT32x32x16_MI16x16x4x1_SE_1LDSB0_AF0EM1_AF1EM1_AMAS0_BL1_DTL0_DVO0_EPS0_FL0_GRVW2_GSU1_ISA908_IU1_KLA_LRVW1_MAC_MDA2_NLCA1_NLCB1_ONLL1_PGR2_PLR1_SIA3_SU0_SUS256_SRVW2_SVW4_SNLL0_TT1_16_TLDS0_USFGROn1_VSn1_VW1_WSGRA1_WSGRB1_WG32_8_1_WGM2
    SolutionIndex: 180
    SolutionNameMin: Cijk_Ailk_Bjlk_SB_MT64x128x8_MI32x32x2x1_SE_1LDSB0_AF0EM1_AF1EM1_AMAS0_BL1_DTL0_DVO0_EPS0_FL0_GRVW2_GSU1_ISA908_IU1_KLA_LRVW1_MAC_MDA2_NLCA1_NLCB1_ONLL1_PGR2_PLR1_SIA3_SU32_SUS128_SRVW2_SVW4_SNLL0_TT1_64_TLDS0_USFGROn1_VSn1_VW1_WSGRA1_WSGRB1_WG64_4_1_WGM2
    SolutionIndex: 181
    SolutionNameMin: Cijk_Ailk_Bjlk_SB_MT128x64x32_MI32x32x2x1_SE_1LDSB0_AF0EM1_AF1EM1_AMAS0_BL1_DTL0_DVO0_EPS1_FL0_GRVW4_GSU1_ISA908_IU1_KLA_LRVW1_MAC_MDA2_NLCA1_NLCB1_ONLL1_PGR1_PLR1_SIA3_SU32_SUS128_SRVW2_SVW4_SNLL0_TT2_32_TLDS0_USFGROn1_VSn1_VW1_WSGRA1_WSGRB1_WG64_4_1_WGM15
    SolutionIndex: 182
    SolutionNameMin: Cijk_Ailk_Bjlk_SB_MT64x64x32_MI16x16x4x1_SE_1LDSB0_AF0EM4_AF1EM1_AMAS3_BL1_DTL0_DVO0_EPS1_FL1_GRVW4_GSU1_ISA908_IU1_KLA_LRVW1_MAC_MDA2_NLCA1_NLCB1_ONLL1_PGR1_PLR1_SIA3_SU32_SUS256_SRVW4_SVW4_SNLL0_TT4_16_TLDS1_USFGROn1_VSn1_VW4_WSGRA0_WSGRB0_WG16_16_1_WGM8
    SolutionIndex: 183
    SolutionNameMin: Cijk_Ailk_Bjlk_SB_MT64x16x16_MI16x16x4x1_SE_1LDSB0_AF0EM1_AF1EM1_AMAS0_BL1_DTL0_DVO0_EPS0_FL0_GRVW1_GSU1_ISA908_IU1_KLA_LRVW1_MAC_MDA2_NLCA1_NLCB1_ONLL1_PGR2_PLR1_SIA3_SU0_SUS256_SRVW2_SVW4_SNLL0_TT1_16_TLDS0_USFGROn1_VSn1_VW1_WSGRA1_WSGRB1_WG64_4_1_WGM1
    SolutionIndex: 184
    SolutionNameMin: Cijk_Ailk_Bjlk_SB_MT64x128x8_MI32x32x2x1_SE_1LDSB0_AF0EM1_AF1EM1_AMAS0_BL1_DTL0_DVO0_EPS0_FL0_GRVW4_GSU1_ISA908_IU1_KLA_LRVW1_MAC_MDA2_NLCA1_NLCB1_ONLL1_PGR2_PLR1_SIA3_SU0_SUS256_SRVW2_SVW4_SNLL0_TT1_64_TLDS0_USFGROn1_VSn1_VW1_WSGRA1_WSGRB1_WG64_4_1_WGM15
    SolutionIndex: 185
    SolutionNameMin: Cijk_Ailk_Bjlk_SB_MT128x64x32_MI32x32x2x1_SE_1LDSB0_AF0EM1_AF1EM1_AMAS0_BL1_DTL0_DVO0_EPS0_FL0_GRVW1_GSU1_ISA908_IU1_KLA_LRVW1_MAC_MDA2_NLCA2_NLCB1_ONLL1_PGR2_PLR1_SIA3_SU0_SUS256_SRVW2_SVW4_SNLL0_TT2_32_TLDS0_USFGROn1_VSn1_VW1_WSGRA1_WSGRB1_WG64_4_1_WGM1
    SolutionIndex: 186
    SolutionNameMin: Cijk_Ailk_Bjlk_SB_MT64x64x24_MI16x16x4x1_SE_1LDSB0_AF0EM1_AF1EM1_AMAS3_BL1_DTL0_DVO0_EPS1_FL0_GRVW1_GSU1_ISA908_IU1_KLA_LRVW1_MAC_MDA2_NLCA1_NLCB1_ONLL1_PGR1_PLR1_SIA3_SU32_SUS256_SRVW0_SVW4_SNLL0_TT4_16_TLDS0_USFGROn1_VSn1_VW2_WSGRA1_WSGRB1_WG16_16_1_WGM8
    SolutionIndex: 187
    SolutionNameMin: Cijk_Ailk_Bjlk_SB_MT64x64x16_MI32x32x2x1_SE_1LDSB0_AF0EM1_AF1EM1_AMAS0_BL1_DTL0_DVO0_EPS0_FL0_GRVW1_GSU1_ISA908_IU1_KLA_LRVW1_MAC_MDA2_NLCA1_NLCB1_ONLL1_PGR2_PLR1_SIA3_SU0_SUS256_SRVW2_SVW4_SNLL0_TT1_32_TLDS0_USFGROn1_VSn1_VW1_WSGRA1_WSGRB1_WG64_4_1_WGM15
    SolutionIndex: 188
    SolutionNameMin: Cijk_Ailk_Bjlk_SB_MT128x144x16_MI16x16x4x1_SE_1LDSB1_AF0EM1_AF1EM1_AMAS0_BL1_DTL0_DVO0_EPS1_FL0_GRVW1_GSU1_ISA908_IU1_KLA_LRVW1_MAC_MDA2_NLCA2_NLCB9_ONLL1_PGR1_PLR1_SIA3_SU32_SUS256_SRVW2_SVW4_SNLL0_TT2_144_TLDS0_USFGROn1_VSn1_VW1_WSGRA1_WSGRB1_WG64_4_1_WGM1
    SolutionIndex: 189
    SolutionNameMin: Cijk_Ailk_Bjlk_SB_MT32x64x16_MI16x16x4x1_SE_1LDSB0_AF0EM1_AF1EM1_AMAS0_BL1_DTL0_DVO0_EPS0_FL0_GRVW2_GSU1_ISA908_IU1_KLA_LRVW1_MAC_MDA2_NLCA1_NLCB1_ONLL1_PGR2_PLR1_SIA3_SU32_SUS128_SRVW2_SVW4_SNLL0_TT1_32_TLDS0_USFGROn1_VSn1_VW1_WSGRA1_WSGRB1_WG32_8_1_WGM15
    SolutionIndex: 190
    SolutionNameMin: Cijk_Ailk_Bjlk_SB_MT32x32x32_MI16x16x4x1_SE_1LDSB0_AF0EM1_AF1EM1_AMAS0_BL1_DTL0_DVO0_EPS0_FL0_GRVW1_GSU3_ISA908_IU1_KLA_LRVW1_MAC_MDA2_NLCA1_NLCB1_ONLL1_PGR2_PLR1_SIA3_SU32_SUS256_SRVW0_SVW4_SNLL0_TT1_16_TLDS0_USFGROn1_VSn1_VW1_WSGRA1_WSGRB1_WG32_8_1_WGM15
    SolutionIndex: 191
    SolutionNameMin: Cijk_Ailk_Bjlk_SB_MT64x8x32_SN_1LDSB0_AF0EM1_AF1EM1_AMAS3_BL1_DTL0_DVO0_EPS1_FL0_GRVW2_GSU4_ISA908_IU1_KLA_LRVW2_MAC_MDA2_NLCA1_NLCB1_ONLL1_PGR1_PLR1_SIA1_SU32_SUS256_SRVW0_SVW4_SNLL0_TT4_2_TLDS0_USFGRO0_VS1_VW2_WSGRA0_WSGRB0_WG16_4_4_WGM1
    SolutionIndex: 192
    SolutionNameMin: Cijk_Ailk_Bjlk_SB_MT64x64x16_MI16x16x4x1_SE_1LDSB0_AF0EM4_AF1EM1_AMAS3_BL1_DTL0_DVO1_EPS1_FL1_GRVW4_GSU1_ISA908_IU1_KLA_LRVW1_MAC_MDA2_NLCA1_NLCB1_ONLL0_PGR1_PLR1_SIA3_SU32_SUS256_SRVW4_SVW4_SNLL0_TT4_16_TLDS1_USFGROn1_VSn1_VW4_WSGRA0_WSGRB0_WG16_16_1_WGM1
    SolutionIndex: 193
    SolutionNameMin: Cijk_Ailk_Bjlk_SB_MT32x8x32_SE_1LDSB0_AF0EM1_AF1EM1_AMAS3_BL1_DTL0_DVO0_EPS1_FL0_GRVW1_GSU1_ISA908_IU1_KLA_LRVW2_MAC_MDA2_NLCA1_NLCB1_ONLL1_PGR1_PLR0_SIA1_SU32_SUS256_SRVW0_SVW4_SNLL0_TT2_2_TLDS0_USFGRO1_VS1_VW2_WSGRA0_WSGRB0_WG16_4_4_WGM1
    SolutionIndex: 194
    SolutionNameMin: Cijk_Ailk_Bjlk_SB_MT64x64x16_MI32x32x2x1_SE_1LDSB0_AF0EM1_AF1EM1_AMAS0_BL1_DTL0_DVO0_EPS0_FL0_GRVW4_GSU1_ISA908_IU1_KLA_LRVW1_MAC_MDA2_NLCA1_NLCB1_ONLL1_PGR2_PLR1_SIA3_SU32_SUS128_SRVW2_SVW4_SNLL0_TT1_32_TLDS0_USFGROn1_VSn1_VW1_WSGRA1_WSGRB1_WG64_4_1_WGM15
    SolutionIndex: 195
    SolutionNameMin: Cijk_Ailk_Bjlk_SB_MT16x64x16_MI16x16x4x1_SE_1LDSB0_AF0EM1_AF1EM1_AMAS0_BL1_DTL0_DVO0_EPS0_FL0_GRVW2_GSU1_ISA908_IU1_KLA_LRVW1_MAC_MDA2_NLCA1_NLCB1_ONLL1_PGR2_PLR1_SIA3_SU0_SUS256_SRVW0_SVW4_SNLL0_TT1_16_TLDS0_USFGROn1_VSn1_VW1_WSGRA1_WSGRB1_WG16_16_1_WGM1
    SolutionIndex: 196
    SolutionNameMin: Cijk_Ailk_Bjlk_SB_MT16x16x32_MI16x16x4x1_SE_1LDSB0_AF0EM1_AF1EM1_AMAS0_BL1_DTL0_DVO0_EPS0_FL0_GRVW2_GSU5_ISA908_IU1_KLA_LRVW1_MAC_MDA2_NLCA1_NLCB1_ONLL1_PGR2_PLR1_SIA3_SU0_SUS256_SRVW0_SVW4_SNLL0_TT1_16_TLDS0_USFGROn1_VSn1_VW1_WSGRA1_WSGRB1_WG16_4_1_WGM2
    SolutionIndex: 197
    SolutionNameMin: Cijk_Ailk_Bjlk_SB_MT128x64x32_MI16x16x1x4_SE_1LDSB0_AF0EM1_AF1EM1_AMAS0_BL1_DTL0_DVO0_EPS1_FL0_GRVW1_GSU1_ISA908_IU1_KLA_LRVW1_MAC_MDA2_NLCA1_NLCB1_ONLL1_PGR1_PLR1_SIA1_SU32_SUS256_SRVW0_SVW4_SNLL0_TT2_16_TLDS0_USFGROn1_VSn1_VW1_WSGRA0_WSGRB0_WG64_4_1_WGM8
    SolutionIndex: 198
    SolutionNameMin: Cijk_Ailk_Bjlk_SB_MT64x64x16_MI16x16x4x1_SE_1LDSB0_AF0EM1_AF1EM1_AMAS3_BL1_DTL0_DVO0_EPS1_FL1_GRVW4_GSU1_ISA908_IU1_KLA_LRVW1_MAC_MDA2_NLCA1_NLCB1_ONLL1_PGR1_PLR1_SIA3_SU32_SUS256_SRVW4_SVW4_SNLL0_TT4_16_TLDS1_USFGROn1_VSn1_VW4_WSGRA0_WSGRB0_WG16_16_1_WGM1
    SolutionIndex: 199
    SolutionNameMin: Cijk_Ailk_Bjlk_SB_MT32x32x32_MI16x16x4x1_SE_1LDSB0_AF0EM1_AF1EM1_AMAS0_BL1_DTL0_DVO0_EPS0_FL0_GRVW4_GSU1_ISA908_IU1_KLA_LRVW1_MAC_MDA2_NLCA1_NLCB1_ONLL1_PGR2_PLR1_SIA3_SU0_SUS256_SRVW2_SVW4_SNLL0_TT1_16_TLDS0_USFGROn1_VSn1_VW1_WSGRA1_WSGRB1_WG32_8_1_WGM15
    SolutionIndex: 200
    SolutionNameMin: Cijk_Ailk_Bjlk_SB_MT128x96x32_MI32x32x2x1_SE_1LDSB0_AF0EM1_AF1EM1_AMAS0_BL1_DTL0_DVO0_EPS0_FL0_GRVW1_GSU1_ISA908_IU1_KLA_LRVW1_MAC_MDA2_NLCA2_NLCB3_ONLL1_PGR2_PLR1_SIA3_SU32_SUS256_SRVW2_SVW4_SNLL0_TT1_96_TLDS0_USFGROn1_VSn1_VW1_WSGRA1_WSGRB1_WG128_2_1_WGM2
    SolutionIndex: 201
    SolutionNameMin: Cijk_Ailk_Bjlk_SB_MT16x16x32_MI16x16x4x1_SE_1LDSB0_AF0EM1_AF1EM1_AMAS0_BL1_DTL0_DVO0_EPS0_FL0_GRVW1_GSU5_ISA908_IU1_KLA_LRVW1_MAC_MDA2_NLCA1_NLCB1_ONLL1_PGR2_PLR1_SIA3_SU0_SUS256_SRVW0_SVW4_SNLL0_TT1_16_TLDS0_USFGROn1_VSn1_VW1_WSGRA1_WSGRB1_WG16_4_1_WGM1
    SolutionIndex: 202
    SolutionNameMin: Cijk_Ailk_Bjlk_SB_MT128x160x8_MI32x32x2x1_SE_1LDSB0_AF0EM1_AF1EM1_AMAS0_BL1_DTL0_DVO0_EPS0_FL0_GRVW1_GSU1_ISA908_IU1_KLA_LRVW1_MAC_MDA2_NLCA2_NLCB5_ONLL1_PGR2_PLR1_SIA3_SU0_SUS256_SRVW2_SVW4_SNLL0_TT1_160_TLDS0_USFGROn1_VSn1_VW1_WSGRA1_WSGRB1_WG128_2_1_WGM2
    SolutionIndex: 203
    SolutionNameMin: Cijk_Ailk_Bjlk_SB_MT64x64x32_MI32x32x2x1_SE_1LDSB0_AF0EM1_AF1EM1_AMAS0_BL1_DTL0_DVO0_EPS1_FL0_GRVW4_GSU1_ISA908_IU1_KLA_LRVW1_MAC_MDA2_NLCA1_NLCB1_ONLL1_PGR1_PLR1_SIA3_SU32_SUS256_SRVW2_SVW4_SNLL0_TT1_32_TLDS0_USFGROn1_VSn1_VW1_WSGRA1_WSGRB1_WG64_4_1_WGM2
    SolutionIndex: 204
    SolutionNameMin: Cijk_Ailk_Bjlk_SB_MT64x128x16_MI32x32x2x1_SE_1LDSB0_AF0EM1_AF1EM1_AMAS0_BL1_DTL0_DVO0_EPS0_FL0_GRVW1_GSU1_ISA908_IU1_KLA_LRVW1_MAC_MDA2_NLCA1_NLCB2_ONLL1_PGR2_PLR1_SIA3_SU32_SUS256_SRVW2_SVW4_SNLL0_TT1_64_TLDS0_USFGROn1_VSn1_VW1_WSGRA1_WSGRB1_WG64_4_1_WGM15
    SolutionIndex: 205
    SolutionNameMin: Cijk_Ailk_Bjlk_SB_MT64x192x8_MI32x32x2x1_SE_1LDSB0_AF0EM1_AF1EM1_AMAS0_BL1_DTL0_DVO0_EPS0_FL0_GRVW2_GSU1_ISA908_IU1_KLA_LRVW1_MAC_MDA2_NLCA1_NLCB3_ONLL1_PGR2_PLR1_SIA3_SU32_SUS128_SRVW2_SVW4_SNLL0_TT1_96_TLDS0_USFGROn1_VSn1_VW1_WSGRA1_WSGRB1_WG64_4_1_WGM15
    SolutionIndex: 206
    SolutionNameMin: Cijk_Ailk_Bjlk_SB_MT128x160x8_MI32x32x2x1_SE_1LDSB0_AF0EM1_AF1EM1_AMAS0_BL1_DTL0_DVO0_EPS0_FL0_GRVW1_GSU1_ISA908_IU1_KLA_LRVW1_MAC_MDA2_NLCA2_NLCB5_ONLL1_PGR2_PLR1_SIA3_SU0_SUS256_SRVW2_SVW4_SNLL0_TT1_160_TLDS0_USFGROn1_VSn1_VW1_WSGRA1_WSGRB1_WG128_2_1_WGM1
    SolutionIndex: 207
    SolutionNameMin: Cijk_Ailk_Bjlk_SB_MT64x64x16_MI32x32x2x1_SE_1LDSB0_AF0EM1_AF1EM1_AMAS0_BL1_DTL0_DVO0_EPS1_FL0_GRVW1_GSU1_ISA908_IU1_KLA_LRVW1_MAC_MDA2_NLCA1_NLCB1_ONLL1_PGR1_PLR1_SIA3_SU0_SUS256_SRVW2_SVW4_SNLL0_TT1_32_TLDS0_USFGROn1_VSn1_VW1_WSGRA1_WSGRB1_WG64_4_1_WGM2
    SolutionIndex: 208
    SolutionNameMin: Cijk_Ailk_Bjlk_SB_MT64x64x32_MI32x32x2x1_SE_1LDSB0_AF0EM1_AF1EM1_AMAS0_BL1_DTL0_DVO0_EPS0_FL0_GRVW4_GSU1_ISA908_IU1_KLA_LRVW1_MAC_MDA2_NLCA1_NLCB1_ONLL1_PGR2_PLR1_SIA3_SU32_SUS128_SRVW2_SVW4_SNLL0_TT1_32_TLDS0_USFGROn1_VSn1_VW1_WSGRA1_WSGRB1_WG64_4_1_WGM2
    SolutionIndex: 209
    SolutionNameMin: Cijk_Ailk_Bjlk_SB_MT128x64x16_MI32x32x2x1_SE_1LDSB0_AF0EM1_AF1EM1_AMAS0_BL1_DTL0_DVO0_EPS0_FL0_GRVW2_GSU1_ISA908_IU1_KLA_LRVW1_MAC_MDA2_NLCA1_NLCB1_ONLL1_PGR2_PLR1_SIA3_SU0_SUS256_SRVW2_SVW4_SNLL0_TT2_32_TLDS0_USFGROn1_VSn1_VW1_WSGRA1_WSGRB1_WG64_4_1_WGM15
    SolutionIndex: 210
    SolutionNameMin: Cijk_Ailk_Bjlk_SB_MT64x32x8_MI16x16x4x1_SE_1LDSB0_AF0EM1_AF1EM1_AMAS0_BL1_DTL0_DVO0_EPS0_FL0_GRVW1_GSU1_ISA908_IU1_KLA_LRVW1_MAC_MDA2_NLCA1_NLCB1_ONLL1_PGR2_PLR1_SIA3_SU32_SUS256_SRVW2_SVW4_SNLL0_TT2_16_TLDS0_USFGROn1_VSn1_VW1_WSGRA1_WSGRB1_WG32_8_1_WGM1
    SolutionIndex: 211
    SolutionNameMin: Cijk_Ailk_Bjlk_SB_MT128x64x16_MI32x32x2x1_SE_1LDSB0_AF0EM1_AF1EM1_AMAS0_BL1_DTL0_DVO0_EPS0_FL0_GRVW4_GSU1_ISA908_IU1_KLA_LRVW1_MAC_MDA2_NLCA1_NLCB1_ONLL1_PGR2_PLR1_SIA3_SU0_SUS256_SRVW2_SVW4_SNLL0_TT2_32_TLDS0_USFGROn1_VSn1_VW1_WSGRA1_WSGRB1_WG64_4_1_WGM15
    SolutionIndex: 212
    SolutionNameMin: Cijk_Ailk_Bjlk_SB_MT16x16x32_MI16x16x4x1_SE_1LDSB0_AF0EM1_AF1EM1_AMAS0_BL1_DTL0_DVO0_EPS0_FL0_GRVW2_GSU5_ISA908_IU1_KLA_LRVW1_MAC_MDA2_NLCA1_NLCB1_ONLL1_PGR2_PLR1_SIA3_SU0_SUS256_SRVW0_SVW4_SNLL0_TT1_16_TLDS0_USFGROn1_VSn1_VW1_WSGRA1_WSGRB1_WG16_4_1_WGM1
    SolutionIndex: 213
    SolutionNameMin: Cijk_Ailk_Bjlk_SB_MT64x64x32_MI32x32x2x1_SE_1LDSB0_AF0EM1_AF1EM1_AMAS0_BL1_DTL0_DVO0_EPS0_FL0_GRVW4_GSU1_ISA908_IU1_KLA_LRVW1_MAC_MDA2_NLCA1_NLCB1_ONLL1_PGR2_PLR1_SIA3_SU32_SUS256_SRVW2_SVW4_SNLL0_TT1_32_TLDS0_USFGROn1_VSn1_VW1_WSGRA1_WSGRB1_WG64_4_1_WGM1
    SolutionIndex: 214
    SolutionNameMin: Cijk_Ailk_Bjlk_SB_MT64x128x16_MI16x16x1x4_SE_1LDSB0_AF0EM4_AF1EM1_AMAS3_BL1_DTL0_DVO0_EPS1_FL1_GRVW4_GSU1_ISA908_IU2_KLA_LRVW1_MAC_MDA2_NLCA1_NLCB1_ONLL0_PGR1_PLR1_SIA3_SU32_SUS256_SRVW4_SVW4_SNLL0_TT2_16_TLDS1_USFGROn1_VSn1_VW4_WSGRA0_WSGRB0_WG32_8_1_WGM1
    SolutionIndex: 215
    SolutionNameMin: Cijk_Ailk_Bjlk_SB_MT144x64x32_MI16x16x4x1_SE_1LDSB0_AF0EM1_AF1EM1_AMAS0_BL1_DTL0_DVO0_EPS1_FL0_GRVW1_GSU1_ISA908_IU1_KLA_LRVW1_MAC_MDA2_NLCA9_NLCB1_ONLL1_PGR1_PLR1_SIA3_SU0_SUS256_SRVW0_SVW4_SNLL0_TT9_16_TLDS0_USFGROn1_VSn1_VW1_WSGRA1_WSGRB1_WG16_16_1_WGM1
    SolutionIndex: 216
    SolutionNameMin: Cijk_Ailk_Bjlk_SB_MT64x64x32_MI32x32x2x1_SE_1LDSB0_AF0EM1_AF1EM1_AMAS0_BL1_DTL0_DVO0_EPS0_FL0_GRVW1_GSU1_ISA908_IU1_KLA_LRVW1_MAC_MDA2_NLCA1_NLCB1_ONLL1_PGR2_PLR1_SIA3_SU32_SUS128_SRVW2_SVW4_SNLL0_TT1_32_TLDS0_USFGROn1_VSn1_VW1_WSGRA1_WSGRB1_WG64_4_1_WGM15
    SolutionIndex: 217
    SolutionNameMin: Cijk_Ailk_Bjlk_SB_MT16x16x32_SN_1LDSB0_AF0EM1_AF1EM1_AMAS3_BL1_DTL0_DVO0_EPS1_FL0_GRVW2_GSU8_ISA908_IU1_KLA_LRVW2_MAC_MDA2_NLCA1_NLCB1_ONLL1_PGR1_PLR1_SIA1_SU32_SUS256_SRVW0_SVW4_SNLL0_TT2_2_TLDS0_USFGRO0_VS1_VW2_WSGRA0_WSGRB0_WG8_8_4_WGM1
    SolutionIndex: 218
    SolutionNameMin: Cijk_Ailk_Bjlk_SB_MT64x64x16_MI32x32x2x1_SE_1LDSB0_AF0EM1_AF1EM1_AMAS0_BL1_DTL0_DVO0_EPS0_FL0_GRVW4_GSU1_ISA908_IU2_KLA_LRVW1_MAC_MDA2_NLCA1_NLCB1_ONLL1_PGR2_PLR1_SIA3_SU0_SUS256_SRVW2_SVW4_SNLL0_TT1_32_TLDS0_USFGROn1_VSn1_VW1_WSGRA1_WSGRB1_WG64_4_1_WGM1
    SolutionIndex: 219
    SolutionNameMin: Cijk_Ailk_Bjlk_SB_MT64x64x8_MI32x32x2x1_SE_1LDSB0_AF0EM1_AF1EM1_AMAS0_BL1_DTL0_DVO0_EPS0_FL0_GRVW1_GSU1_ISA908_IU1_KLA_LRVW1_MAC_MDA2_NLCA1_NLCB1_ONLL1_PGR2_PLR1_SIA3_SU32_SUS128_SRVW2_SVW4_SNLL0_TT1_32_TLDS0_USFGROn1_VSn1_VW1_WSGRA1_WSGRB1_WG64_4_1_WGM1
    SolutionIndex: 220
    SolutionNameMin: Cijk_Ailk_Bjlk_SB_MT64x128x8_MI32x32x2x1_SE_1LDSB0_AF0EM1_AF1EM1_AMAS0_BL1_DTL0_DVO0_EPS0_FL0_GRVW4_GSU1_ISA908_IU1_KLA_LRVW1_MAC_MDA2_NLCA1_NLCB1_ONLL1_PGR2_PLR1_SIA3_SU32_SUS256_SRVW2_SVW4_SNLL0_TT1_64_TLDS0_USFGROn1_VSn1_VW1_WSGRA1_WSGRB1_WG64_4_1_WGM1
    SolutionIndex: 221
    SolutionNameMin: Cijk_Ailk_Bjlk_SB_MT128x64x8_MI16x16x1x4_SE_1LDSB0_AF0EM1_AF1EM1_AMAS0_BL1_DTL0_DVO0_EPS1_FL0_GRVW1_GSU1_ISA908_IU1_KLA_LRVW1_MAC_MDA2_NLCA1_NLCB1_ONLL1_PGR1_PLR1_SIA1_SU32_SUS256_SRVW0_SVW4_SNLL0_TT2_16_TLDS0_USFGROn1_VSn1_VW1_WSGRA0_WSGRB0_WG64_4_1_WGM16
    SolutionIndex: 222
    SolutionNameMin: Cijk_Ailk_Bjlk_SB_MT144x64x16_MI16x16x4x1_SE_1LDSB0_AF0EM1_AF1EM1_AMAS0_BL1_DTL0_DVO0_EPS0_FL0_GRVW1_GSU1_ISA908_IU1_KLA_LRVW1_MAC_MDA2_NLCA9_NLCB1_ONLL1_PGR2_PLR1_SIA3_SU0_SUS256_SRVW0_SVW4_SNLL0_TT9_16_TLDS0_USFGROn1_VSn1_VW1_WSGRA1_WSGRB1_WG16_16_1_WGM2
    SolutionIndex: 223
    SolutionNameMin: Cijk_Ailk_Bjlk_SB_MT32x16x32_SE_1LDSB0_AF0EM1_AF1EM1_AMAS3_BL1_DTL0_DVO0_EPS1_FL0_GRVW1_GSU1_ISA908_IU1_KLA_LRVW2_MAC_MDA2_NLCA1_NLCB1_ONLL1_PGR1_PLR1_SIA1_SU32_SUS256_SRVW0_SVW4_SNLL0_TT2_4_TLDS0_USFGRO1_VS1_VW2_WSGRA0_WSGRB0_WG16_4_4_WGM1
    SolutionIndex: 224
    SolutionNameMin: Cijk_Ailk_Bjlk_SB_MT16x32x32_SE_1LDSB0_AF0EM1_AF1EM1_AMAS0_BL1_DTL0_DVO0_EPS1_FL0_GRVW1_GSU1_ISA908_IU1_KLA_LRVW1_MAC_MDA2_NLCA1_NLCB1_ONLL1_PGR1_PLR1_SIA1_SU32_SUS256_SRVW0_SVW4_SNLL0_TT2_4_TLDS0_USFGRO1_VS1_VW1_WSGRA0_WSGRB0_WG8_8_4_WGM8
    SolutionIndex: 225
    SolutionNameMin: Cijk_Ailk_Bjlk_SB_MT96x96x16_MI16x16x4x1_SE_1LDSB1_AF0EM1_AF1EM1_AMAS0_BL1_DTL0_DVO0_EPS1_FL0_GRVW2_GSU1_ISA908_IU1_KLA_LRVW1_MAC_MDA2_NLCA3_NLCB3_ONLL1_PGR1_PLR1_SIA3_SU32_SUS256_SRVW0_SVW4_SNLL0_TT3_48_TLDS0_USFGROn1_VSn1_VW1_WSGRA1_WSGRB1_WG32_8_1_WGM1
    SolutionIndex: 226
    SolutionNameMin: Cijk_Ailk_Bjlk_SB_MT16x16x16_SN_1LDSB0_AF0EM1_AF1EM1_AMAS3_BL1_DTL0_DVO0_EPS1_FL0_GRVW2_GSU4_ISA908_IU1_KLA_LRVW2_MAC_MDA2_NLCA1_NLCB1_ONLL1_PGR1_PLR1_SIA1_SU32_SUS256_SRVW0_SVW4_SNLL0_TT2_2_TLDS0_USFGRO1_VS1_VW2_WSGRA0_WSGRB0_WG8_8_4_WGM8
    SolutionIndex: 227
    SolutionNameMin: Cijk_Ailk_Bjlk_SB_MT128x64x32_MI32x32x2x1_SN_1LDSB0_AF0EM1_AF1EM1_AMAS0_BL1_DTL0_DVO0_EPS1_FL0_GRVW4_GSU1_ISA908_IU1_KLA_LRVW1_MAC_MDA2_NLCA1_NLCB1_ONLL1_PGR1_PLR1_SIA3_SU32_SUS256_SRVW2_SVW4_SNLL0_TT2_32_TLDS0_USFGROn1_VSn1_VW1_WSGRA1_WSGRB1_WG64_4_1_WGM1
    SolutionIndex: 228
    SolutionNameMin: Cijk_Ailk_Bjlk_SB_MT128x96x16_MI32x32x2x1_SE_1LDSB0_AF0EM1_AF1EM1_AMAS0_BL1_DTL0_DVO0_EPS0_FL0_GRVW1_GSU1_ISA908_IU1_KLA_LRVW1_MAC_MDA2_NLCA2_NLCB3_ONLL1_PGR2_PLR1_SIA3_SU32_SUS256_SRVW2_SVW4_SNLL0_TT1_96_TLDS0_USFGROn1_VSn1_VW1_WSGRA1_WSGRB1_WG128_2_1_WGM2
    SolutionIndex: 229
    SolutionNameMin: Cijk_Ailk_Bjlk_SB_MT32x64x32_MI16x16x4x1_SE_1LDSB0_AF0EM1_AF1EM1_AMAS0_BL1_DTL0_DVO0_EPS0_FL0_GRVW4_GSU1_ISA908_IU1_KLA_LRVW1_MAC_MDA2_NLCA1_NLCB1_ONLL1_PGR2_PLR1_SIA3_SU0_SUS256_SRVW2_SVW4_SNLL0_TT1_32_TLDS0_USFGROn1_VSn1_VW1_WSGRA1_WSGRB1_WG32_8_1_WGM1
    SolutionIndex: 230
    SolutionNameMin: Cijk_Ailk_Bjlk_SB_MT64x128x8_MI32x32x2x1_SE_1LDSB0_AF0EM1_AF1EM1_AMAS0_BL1_DTL0_DVO0_EPS0_FL0_GRVW4_GSU1_ISA908_IU1_KLA_LRVW1_MAC_MDA2_NLCA1_NLCB1_ONLL1_PGR2_PLR1_SIA3_SU0_SUS256_SRVW2_SVW4_SNLL0_TT1_64_TLDS0_USFGROn1_VSn1_VW1_WSGRA1_WSGRB1_WG64_4_1_WGM1
    SolutionIndex: 231
    SolutionNameMin: Cijk_Ailk_Bjlk_SB_MT64x32x32_MI16x16x4x1_SE_1LDSB0_AF0EM1_AF1EM1_AMAS0_BL1_DTL0_DVO0_EPS0_FL0_GRVW1_GSU1_ISA908_IU1_KLA_LRVW1_MAC_MDA2_NLCA1_NLCB1_ONLL1_PGR2_PLR1_SIA3_SU0_SUS256_SRVW2_SVW4_SNLL0_TT2_16_TLDS0_USFGROn1_VSn1_VW1_WSGRA1_WSGRB1_WG32_8_1_WGM15
    SolutionIndex: 232
    SolutionNameMin: Cijk_Ailk_Bjlk_SB_MT128x96x32_MI32x32x2x1_SE_1LDSB0_AF0EM1_AF1EM1_AMAS0_BL1_DTL0_DVO0_EPS1_FL0_GRVW4_GSU1_ISA908_IU1_KLA_LRVW1_MAC_MDA2_NLCA1_NLCB3_ONLL1_PGR1_PLR1_SIA3_SU0_SUS256_SRVW2_SVW4_SNLL0_TT1_96_TLDS0_USFGROn1_VSn1_VW1_WSGRA1_WSGRB1_WG128_2_1_WGM15
    SolutionIndex: 233
    SolutionNameMin: Cijk_Ailk_Bjlk_SB_MT96x96x32_MI16x16x4x1_SE_1LDSB1_AF0EM1_AF1EM1_AMAS0_BL1_DTL0_DVO0_EPS0_FL0_GRVW4_GSU1_ISA908_IU1_KLA_LRVW1_MAC_MDA2_NLCA3_NLCB3_ONLL1_PGR2_PLR1_SIA3_SU0_SUS256_SRVW0_SVW4_SNLL0_TT3_48_TLDS0_USFGROn1_VSn1_VW1_WSGRA1_WSGRB1_WG32_8_1_WGM1
    SolutionIndex: 234
    SolutionNameMin: Cijk_Ailk_Bjlk_SB_MT128x144x16_MI16x16x4x1_SE_1LDSB1_AF0EM1_AF1EM1_AMAS0_BL1_DTL0_DVO0_EPS0_FL0_GRVW1_GSU1_ISA908_IU1_KLA_LRVW1_MAC_MDA2_NLCA2_NLCB9_ONLL1_PGR2_PLR1_SIA3_SU32_SUS256_SRVW2_SVW4_SNLL0_TT2_144_TLDS0_USFGROn1_VSn1_VW1_WSGRA1_WSGRB1_WG64_4_1_WGM15
    SolutionIndex: 235
    SolutionNameMin: Cijk_Ailk_Bjlk_SB_MT96x96x16_MI16x16x4x1_SE_1LDSB0_AF0EM1_AF1EM1_AMAS0_BL1_DTL0_DVO0_EPS1_FL0_GRVW1_GSU1_ISA908_IU1_KLA_LRVW1_MAC_MDA2_NLCA3_NLCB3_ONLL1_PGR1_PLR1_SIA3_SU32_SUS256_SRVW0_SVW4_SNLL0_TT3_48_TLDS0_USFGROn1_VSn1_VW1_WSGRA1_WSGRB1_WG32_8_1_WGM15
    SolutionIndex: 236
    SolutionNameMin: Cijk_Ailk_Bjlk_SB_MT144x64x16_MI16x16x4x1_SE_1LDSB0_AF0EM1_AF1EM1_AMAS0_BL1_DTL0_DVO0_EPS0_FL0_GRVW1_GSU1_ISA908_IU1_KLA_LRVW1_MAC_MDA2_NLCA9_NLCB1_ONLL1_PGR2_PLR1_SIA3_SU32_SUS256_SRVW0_SVW4_SNLL0_TT9_16_TLDS0_USFGROn1_VSn1_VW1_WSGRA1_WSGRB1_WG16_16_1_WGM1
    SolutionIndex: 237
    SolutionNameMin: Cijk_Ailk_Bjlk_SB_MT8x32x32_SE_1LDSB0_AF0EM1_AF1EM1_AMAS3_BL1_DTL0_DVO0_EPS1_FL0_GRVW1_GSU1_ISA908_IU1_KLA_LRVW2_MAC_MDA2_NLCA1_NLCB1_ONLL1_PGR1_PLR1_SIA1_SU32_SUS256_SRVW0_SVW4_SNLL0_TT2_2_TLDS0_USFGRO1_VS1_VW2_WSGRA0_WSGRB0_WG4_16_4_WGM1
    SolutionIndex: 238
    SolutionNameMin: Cijk_Ailk_Bjlk_SB_MT64x128x8_MI32x32x2x1_SE_1LDSB0_AF0EM1_AF1EM1_AMAS0_BL1_DTL0_DVO0_EPS0_FL0_GRVW4_GSU1_ISA908_IU1_KLA_LRVW1_MAC_MDA2_NLCA1_NLCB1_ONLL1_PGR2_PLR1_SIA3_SU32_SUS128_SRVW2_SVW4_SNLL0_TT1_64_TLDS0_USFGROn1_VSn1_VW1_WSGRA1_WSGRB1_WG64_4_1_WGM2
    SolutionIndex: 239
    SolutionNameMin: Cijk_Ailk_Bjlk_SB_MT32x32x32_SE_1LDSB0_AF0EM1_AF1EM1_AMAS3_BL1_DTL0_DVO0_EPS1_FL0_GRVW2_GSU1_ISA908_IU1_KLA_LRVW2_MAC_MDA2_NLCA1_NLCB1_ONLL1_PGR1_PLR1_SIA1_SU32_SUS256_SRVW0_SVW4_SNLL0_TT4_4_TLDS0_USFGRO0_VS1_VW2_WSGRA0_WSGRB0_WG8_8_4_WGM1
    SolutionIndex: 240
    SolutionNameMin: Cijk_Ailk_Bjlk_SB_MT16x64x16_MI16x16x4x1_SE_1LDSB0_AF0EM1_AF1EM1_AMAS0_BL1_DTL0_DVO0_EPS1_FL0_GRVW1_GSU1_ISA908_IU1_KLA_LRVW1_MAC_MDA2_NLCA1_NLCB1_ONLL1_PGR1_PLR1_SIA3_SU0_SUS256_SRVW2_SVW4_SNLL0_TT1_16_TLDS0_USFGROn1_VSn1_VW1_WSGRA1_WSGRB1_WG16_16_1_WGM1
    SolutionIndex: 241
    SolutionNameMin: Cijk_Ailk_Bjlk_SB_MT64x64x8_MI32x32x2x1_SE_1LDSB0_AF0EM1_AF1EM1_AMAS0_BL1_DTL0_DVO0_EPS0_FL0_GRVW1_GSU1_ISA908_IU1_KLA_LRVW1_MAC_MDA2_NLCA1_NLCB1_ONLL1_PGR2_PLR1_SIA3_SU32_SUS128_SRVW2_SVW4_SNLL0_TT1_32_TLDS0_USFGROn1_VSn1_VW1_WSGRA1_WSGRB1_WG64_4_1_WGM2
    SolutionIndex: 242
    SolutionNameMin: Cijk_Ailk_Bjlk_SB_MT16x16x16_SN_1LDSB0_AF0EM1_AF1EM1_AMAS3_BL1_DTL0_DVO0_EPS1_FL0_GRVW2_GSU16_ISA908_IU1_KLA_LRVW2_MAC_MDA2_NLCA1_NLCB1_ONLL1_PGR1_PLR1_SIA1_SU32_SUS256_SRVW0_SVW4_SNLL0_TT2_2_TLDS0_USFGRO1_VS1_VW2_WSGRA0_WSGRB0_WG8_8_4_WGM1
    SolutionIndex: 243
    SolutionNameMin: Cijk_Ailk_Bjlk_SB_MT32x64x32_MI16x16x4x1_SE_1LDSB0_AF0EM1_AF1EM1_AMAS0_BL1_DTL0_DVO0_EPS0_FL0_GRVW4_GSU1_ISA908_IU1_KLA_LRVW1_MAC_MDA2_NLCA1_NLCB1_ONLL1_PGR2_PLR1_SIA3_SU0_SUS256_SRVW2_SVW4_SNLL0_TT1_32_TLDS0_USFGROn1_VSn1_VW1_WSGRA1_WSGRB1_WG32_8_1_WGM15
    SolutionIndex: 244
    SolutionNameMin: Cijk_Ailk_Bjlk_SB_MT64x64x32_MI32x32x2x1_SE_1LDSB0_AF0EM1_AF1EM1_AMAS0_BL1_DTL0_DVO0_EPS0_FL0_GRVW1_GSU1_ISA908_IU1_KLA_LRVW1_MAC_MDA2_NLCA1_NLCB1_ONLL1_PGR2_PLR1_SIA3_SU32_SUS128_SRVW2_SVW4_SNLL0_TT1_32_TLDS0_USFGROn1_VSn1_VW1_WSGRA1_WSGRB1_WG64_4_1_WGM2
    SolutionIndex: 245
    SolutionNameMin: Cijk_Ailk_Bjlk_SB_MT32x32x32_SN_1LDSB0_AF0EM1_AF1EM1_AMAS3_BL1_DTL0_DVO0_EPS1_FL0_GRVW4_GSU2_ISA908_IU1_KLA_LRVW4_MAC_MDA2_NLCA1_NLCB1_ONLL1_PGR1_PLR1_SIA1_SU32_SUS256_SRVW0_SVW4_SNLL0_TT4_4_TLDS0_USFGRO0_VS1_VW4_WSGRA0_WSGRB0_WG8_8_4_WGM1
    SolutionIndex: 246
    SolutionNameMin: Cijk_Ailk_Bjlk_SB_MT32x32x32_SE_1LDSB0_AF0EM1_AF1EM1_AMAS3_BL1_DTL0_DVO0_EPS1_FL0_GRVW1_GSU1_ISA908_IU1_KLA_LRVW4_MAC_MDA2_NLCA1_NLCB1_ONLL1_PGR1_PLR1_SIA1_SU32_SUS256_SRVW0_SVW4_SNLL0_TT4_4_TLDS0_USFGRO1_VS1_VW4_WSGRA0_WSGRB0_WG8_8_4_WGM1
    SolutionIndex: 247
    SolutionNameMin: Cijk_Ailk_Bjlk_SB_MT64x64x16_MI32x32x2x1_SE_1LDSB0_AF0EM1_AF1EM1_AMAS0_BL1_DTL0_DVO0_EPS0_FL0_GRVW4_GSU1_ISA908_IU1_KLA_LRVW1_MAC_MDA2_NLCA1_NLCB1_ONLL1_PGR2_PLR1_SIA3_SU32_SUS256_SRVW2_SVW4_SNLL0_TT1_32_TLDS0_USFGROn1_VSn1_VW1_WSGRA1_WSGRB1_WG64_4_1_WGM1
    SolutionIndex: 248
    SolutionNameMin: Cijk_Ailk_Bjlk_SB_MT32x64x32_MI16x16x4x1_SE_1LDSB0_AF0EM1_AF1EM1_AMAS0_BL1_DTL0_DVO0_EPS0_FL0_GRVW2_GSU1_ISA908_IU1_KLA_LRVW1_MAC_MDA2_NLCA1_NLCB1_ONLL1_PGR2_PLR1_SIA3_SU0_SUS256_SRVW2_SVW4_SNLL0_TT1_32_TLDS0_USFGROn1_VSn1_VW1_WSGRA1_WSGRB1_WG32_8_1_WGM15
    SolutionIndex: 249
    SolutionNameMin: Cijk_Ailk_Bjlk_SB_MT64x144x16_MI16x16x4x1_SE_1LDSB0_AF0EM1_AF1EM1_AMAS0_BL1_DTL0_DVO0_EPS0_FL0_GRVW1_GSU1_ISA908_IU1_KLA_LRVW1_MAC_MDA2_NLCA1_NLCB9_ONLL1_PGR2_PLR1_SIA3_SU32_SUS256_SRVW2_SVW4_SNLL0_TT1_144_TLDS0_USFGROn1_VSn1_VW1_WSGRA1_WSGRB1_WG64_4_1_WGM15
    SolutionIndex: 250
    SolutionNameMin: Cijk_Ailk_Bjlk_SB_MT64x64x32_MI32x32x2x1_SE_1LDSB0_AF0EM1_AF1EM1_AMAS0_BL1_DTL0_DVO0_EPS0_FL0_GRVW1_GSU1_ISA908_IU1_KLA_LRVW1_MAC_MDA2_NLCA1_NLCB1_ONLL1_PGR2_PLR1_SIA3_SU32_SUS128_SRVW2_SVW4_SNLL0_TT1_32_TLDS0_USFGROn1_VSn1_VW1_WSGRA1_WSGRB1_WG64_4_1_WGM1
    SolutionIndex: 251
    SolutionNameMin: Cijk_Ailk_Bjlk_SB_MT192x64x16_MI32x32x2x1_SE_1LDSB0_AF0EM1_AF1EM1_AMAS0_BL1_DTL0_DVO0_EPS1_FL0_GRVW4_GSU1_ISA908_IU1_KLA_LRVW1_MAC_MDA2_NLCA3_NLCB1_ONLL1_PGR1_PLR1_SIA3_SU0_SUS256_SRVW0_SVW4_SNLL0_TT3_32_TLDS0_USFGROn1_VSn1_VW1_WSGRA1_WSGRB1_WG64_4_1_WGM2
    SolutionIndex: 252
    SolutionNameMin: Cijk_Ailk_Bjlk_SB_MT144x128x16_MI16x16x4x1_SE_1LDSB1_AF0EM1_AF1EM1_AMAS0_BL1_DTL0_DVO0_EPS1_FL0_GRVW1_GSU1_ISA908_IU1_KLA_LRVW1_MAC_MDA2_NLCA9_NLCB2_ONLL1_PGR1_PLR1_SIA3_SU0_SUS256_SRVW0_SVW4_SNLL0_TT9_32_TLDS0_USFGROn1_VSn1_VW1_WSGRA1_WSGRB1_WG16_16_1_WGM15
    SolutionIndex: 253
    SolutionNameMin: Cijk_Ailk_Bjlk_SB_MT64x64x16_MI16x16x4x1_SE_1LDSB0_AF0EM1_AF1EM1_AMAS3_BL1_DTL0_DVO1_EPS1_FL1_GRVW4_GSU1_ISA908_IU1_KLA_LRVW1_MAC_MDA2_NLCA1_NLCB1_ONLL1_PGR1_PLR1_SIA3_SU32_SUS256_SRVW4_SVW4_SNLL0_TT4_16_TLDS1_USFGROn1_VSn1_VW4_WSGRA0_WSGRB0_WG16_16_1_WGM1
    SolutionIndex: 254
    SolutionNameMin: Cijk_Ailk_Bjlk_SB_MT96x96x32_MI16x16x4x1_SE_1LDSB1_AF0EM1_AF1EM1_AMAS0_BL1_DTL0_DVO0_EPS1_FL0_GRVW4_GSU1_ISA908_IU1_KLA_LRVW1_MAC_MDA2_NLCA3_NLCB3_ONLL1_PGR1_PLR1_SIA3_SU0_SUS256_SRVW0_SVW4_SNLL0_TT3_48_TLDS0_USFGROn1_VSn1_VW1_WSGRA1_WSGRB1_WG32_8_1_WGM2
    SolutionIndex: 255
    SolutionNameMin: Cijk_Ailk_Bjlk_SB_MT128x96x16_MI32x32x2x1_SE_1LDSB0_AF0EM1_AF1EM1_AMAS0_BL1_DTL0_DVO0_EPS0_FL0_GRVW2_GSU1_ISA908_IU1_KLA_LRVW1_MAC_MDA2_NLCA1_NLCB3_ONLL1_PGR2_PLR1_SIA3_SU0_SUS256_SRVW2_SVW4_SNLL0_TT1_96_TLDS0_USFGROn1_VSn1_VW1_WSGRA1_WSGRB1_WG128_2_1_WGM1
    SolutionIndex: 256
    SolutionNameMin: Cijk_Ailk_Bjlk_SB_MT32x32x32_MI16x16x4x1_SE_1LDSB0_AF0EM1_AF1EM1_AMAS0_BL1_DTL0_DVO0_EPS0_FL0_GRVW2_GSU5_ISA908_IU1_KLA_LRVW1_MAC_MDA2_NLCA1_NLCB1_ONLL1_PGR2_PLR1_SIA3_SU32_SUS256_SRVW0_SVW4_SNLL0_TT1_16_TLDS0_USFGROn1_VSn1_VW1_WSGRA1_WSGRB1_WG32_8_1_WGM1
    SolutionIndex: 257
    SolutionNameMin: Cijk_Ailk_Bjlk_SB_MT96x96x8_MI16x16x4x1_SE_1LDSB0_AF0EM1_AF1EM1_AMAS0_BL1_DTL0_DVO0_EPS0_FL0_GRVW1_GSU1_ISA908_IU1_KLA_LRVW1_MAC_MDA2_NLCA3_NLCB3_ONLL1_PGR2_PLR1_SIA3_SU0_SUS256_SRVW0_SVW4_SNLL0_TT3_48_TLDS0_USFGROn1_VSn1_VW1_WSGRA1_WSGRB1_WG32_8_1_WGM15
    SolutionIndex: 258
    SolutionNameMin: Cijk_Ailk_Bjlk_SB_MT64x128x32_MI32x32x2x1_SE_1LDSB0_AF0EM1_AF1EM1_AMAS0_BL1_DTL0_DVO0_EPS1_FL0_GRVW4_GSU1_ISA908_IU1_KLA_LRVW1_MAC_MDA2_NLCA1_NLCB1_ONLL1_PGR1_PLR1_SIA3_SU0_SUS256_SRVW2_SVW4_SNLL0_TT1_64_TLDS0_USFGROn1_VSn1_VW1_WSGRA1_WSGRB1_WG64_4_1_WGM15
    SolutionIndex: 259
    SolutionNameMin: Cijk_Ailk_Bjlk_SB_MT128x96x8_MI32x32x2x1_SE_1LDSB0_AF0EM1_AF1EM1_AMAS0_BL1_DTL0_DVO0_EPS0_FL0_GRVW1_GSU1_ISA908_IU1_KLA_LRVW1_MAC_MDA2_NLCA2_NLCB3_ONLL1_PGR2_PLR1_SIA3_SU32_SUS256_SRVW2_SVW4_SNLL0_TT1_96_TLDS0_USFGROn1_VSn1_VW1_WSGRA1_WSGRB1_WG128_2_1_WGM15
    SolutionIndex: 260
    SolutionNameMin: Cijk_Ailk_Bjlk_SB_MT64x192x16_MI32x32x2x1_SE_1LDSB0_AF0EM1_AF1EM1_AMAS0_BL1_DTL0_DVO0_EPS0_FL0_GRVW1_GSU1_ISA908_IU1_KLA_LRVW1_MAC_MDA2_NLCA1_NLCB3_ONLL1_PGR2_PLR1_SIA3_SU0_SUS256_SRVW2_SVW4_SNLL0_TT1_96_TLDS0_USFGROn1_VSn1_VW1_WSGRA1_WSGRB1_WG64_4_1_WGM1
    SolutionIndex: 261
    SolutionNameMin: Cijk_Ailk_Bjlk_SB_MT64x128x16_MI32x32x2x1_SE_1LDSB0_AF0EM1_AF1EM1_AMAS0_BL1_DTL0_DVO0_EPS0_FL0_GRVW2_GSU1_ISA908_IU1_KLA_LRVW1_MAC_MDA2_NLCA1_NLCB1_ONLL1_PGR2_PLR1_SIA3_SU0_SUS256_SRVW2_SVW4_SNLL0_TT1_64_TLDS0_USFGROn1_VSn1_VW1_WSGRA1_WSGRB1_WG64_4_1_WGM1
    SolutionIndex: 262
    SolutionNameMin: Cijk_Ailk_Bjlk_SB_MT64x64x32_MI32x32x2x1_SE_1LDSB0_AF0EM1_AF1EM1_AMAS0_BL1_DTL0_DVO0_EPS0_FL0_GRVW2_GSU1_ISA908_IU1_KLA_LRVW1_MAC_MDA2_NLCA1_NLCB1_ONLL1_PGR2_PLR1_SIA3_SU32_SUS256_SRVW2_SVW4_SNLL0_TT1_32_TLDS0_USFGROn1_VSn1_VW1_WSGRA1_WSGRB1_WG64_4_1_WGM1
    SolutionIndex: 263
    SolutionNameMin: Cijk_Ailk_Bjlk_SB_MT32x8x16_SE_1LDSB0_AF0EM1_AF1EM1_AMAS3_BL1_DTL0_DVO0_EPS1_FL1_GRVW2_GSU1_ISA908_IU1_KLA_LRVW2_MAC_MDA2_NLCA1_NLCB1_ONLL1_PGR1_PLR0_SIA1_SU32_SUS256_SRVW0_SVW4_SNLL0_TT2_2_TLDS0_USFGRO0_VS1_VW2_WSGRA0_WSGRB0_WG16_4_4_WGM1
    SolutionIndex: 264
    SolutionNameMin: Cijk_Ailk_Bjlk_SB_MT128x64x16_MI32x32x2x1_SE_1LDSB0_AF0EM1_AF1EM1_AMAS0_BL1_DTL0_DVO0_EPS0_FL0_GRVW1_GSU1_ISA908_IU1_KLA_LRVW1_MAC_MDA2_NLCA2_NLCB1_ONLL1_PGR2_PLR1_SIA3_SU32_SUS128_SRVW2_SVW4_SNLL0_TT2_32_TLDS0_USFGROn1_VSn1_VW1_WSGRA1_WSGRB1_WG64_4_1_WGM15
    SolutionIndex: 265
    SolutionNameMin: Cijk_Ailk_Bjlk_SB_MT32x32x32_MI16x16x4x1_SE_1LDSB0_AF0EM1_AF1EM1_AMAS0_BL1_DTL0_DVO0_EPS0_FL0_GRVW1_GSU1_ISA908_IU1_KLA_LRVW1_MAC_MDA2_NLCA1_NLCB1_ONLL1_PGR2_PLR1_SIA3_SU0_SUS256_SRVW2_SVW4_SNLL0_TT1_16_TLDS0_USFGROn1_VSn1_VW1_WSGRA1_WSGRB1_WG32_8_1_WGM15
    SolutionIndex: 266
    SolutionNameMin: Cijk_Ailk_Bjlk_SB_MT64x64x32_MI16x16x4x1_SE_1LDSB0_AF0EM1_AF1EM1_AMAS3_BL1_DTL0_DVO0_EPS1_FL1_GRVW4_GSU1_ISA908_IU1_KLA_LRVW1_MAC_MDA2_NLCA1_NLCB1_ONLL0_PGR1_PLR1_SIA3_SU32_SUS256_SRVW4_SVW4_SNLL0_TT4_16_TLDS1_USFGROn1_VSn1_VW4_WSGRA0_WSGRB0_WG16_16_1_WGM8
    SolutionIndex: 267
    SolutionNameMin: Cijk_Ailk_Bjlk_SB_MT4x64x16_MI4x4x1x16_SE_1LDSB0_AF0EM1_AF1EM1_AMAS0_BL1_DTL0_DVO0_EPS0_FL0_GRVW2_GSU1_ISA908_IU1_KLA_LRVW1_MAC_MDA2_NLCA1_NLCB1_ONLL1_PGR2_PLR1_SIA3_SU0_SUS256_SRVW0_SVW4_SNLL0_TT1_4_TLDS0_USFGROn1_VSn1_VW1_WSGRA1_WSGRB1_WG4_16_1_WGM1
    SolutionIndex: 268
    SolutionNameMin: Cijk_Ailk_Bjlk_SB_MT16x16x32_MI16x16x4x1_SE_1LDSB0_AF0EM1_AF1EM1_AMAS0_BL1_DTL0_DVO0_EPS0_FL0_GRVW1_GSU3_ISA908_IU1_KLA_LRVW1_MAC_MDA2_NLCA1_NLCB1_ONLL1_PGR2_PLR1_SIA3_SU32_SUS128_SRVW0_SVW4_SNLL0_TT1_16_TLDS0_USFGROn1_VSn1_VW1_WSGRA1_WSGRB1_WG16_4_1_WGM1
    SolutionIndex: 269
    SolutionNameMin: Cijk_Ailk_Bjlk_SB_MT32x32x32_SE_1LDSB0_AF0EM1_AF1EM1_AMAS3_BL1_DTL0_DVO0_EPS1_FL0_GRVW4_GSU1_ISA908_IU1_KLA_LRVW4_MAC_MDA2_NLCA1_NLCB1_ONLL1_PGR1_PLR1_SIA1_SU32_SUS256_SRVW0_SVW4_SNLL0_TT4_4_TLDS0_USFGRO0_VS1_VW4_WSGRA0_WSGRB0_WG8_8_4_WGM8
    SolutionIndex: 270
    SolutionNameMin: Cijk_Ailk_Bjlk_SB_MT64x64x32_MI32x32x2x1_SE_1LDSB0_AF0EM1_AF1EM1_AMAS0_BL1_DTL0_DVO0_EPS0_FL0_GRVW1_GSU1_ISA908_IU1_KLA_LRVW1_MAC_MDA2_NLCA1_NLCB1_ONLL1_PGR2_PLR1_SIA3_SU0_SUS256_SRVW2_SVW4_SNLL0_TT1_32_TLDS0_USFGROn1_VSn1_VW1_WSGRA1_WSGRB1_WG64_4_1_WGM2
    SolutionIndex: 271
    SolutionNameMin: Cijk_Ailk_Bjlk_SB_MT64x128x8_MI32x32x2x1_SE_1LDSB0_AF0EM1_AF1EM1_AMAS0_BL1_DTL0_DVO0_EPS0_FL0_GRVW2_GSU1_ISA908_IU1_KLA_LRVW1_MAC_MDA2_NLCA1_NLCB1_ONLL1_PGR2_PLR1_SIA3_SU32_SUS256_SRVW2_SVW4_SNLL0_TT1_64_TLDS0_USFGROn1_VSn1_VW1_WSGRA1_WSGRB1_WG64_4_1_WGM15
    SolutionIndex: 272
    SolutionNameMin: Cijk_Ailk_Bjlk_SB_MT128x96x16_MI32x32x2x1_SE_1LDSB0_AF0EM1_AF1EM1_AMAS0_BL1_DTL0_DVO0_EPS0_FL0_GRVW1_GSU1_ISA908_IU1_KLA_LRVW1_MAC_MDA2_NLCA2_NLCB3_ONLL1_PGR2_PLR1_SIA3_SU0_SUS256_SRVW2_SVW4_SNLL0_TT1_96_TLDS0_USFGROn1_VSn1_VW1_WSGRA1_WSGRB1_WG128_2_1_WGM1
    SolutionIndex: 273
    SolutionNameMin: Cijk_Ailk_Bjlk_SB_MT64x192x16_MI32x32x2x1_SE_1LDSB0_AF0EM1_AF1EM1_AMAS0_BL1_DTL0_DVO0_EPS0_FL0_GRVW4_GSU1_ISA908_IU1_KLA_LRVW1_MAC_MDA2_NLCA1_NLCB3_ONLL1_PGR2_PLR1_SIA3_SU0_SUS256_SRVW2_SVW4_SNLL0_TT1_96_TLDS0_USFGROn1_VSn1_VW1_WSGRA1_WSGRB1_WG64_4_1_WGM2
    SolutionIndex: 274
    SolutionNameMin: Cijk_Ailk_Bjlk_SB_MT64x64x32_MI32x32x2x1_SE_1LDSB0_AF0EM1_AF1EM1_AMAS0_BL1_DTL0_DVO0_EPS0_FL0_GRVW1_GSU1_ISA908_IU1_KLA_LRVW1_MAC_MDA2_NLCA1_NLCB1_ONLL1_PGR2_PLR1_SIA3_SU0_SUS256_SRVW2_SVW4_SNLL0_TT1_32_TLDS0_USFGROn1_VSn1_VW1_WSGRA1_WSGRB1_WG64_4_1_WGM1
    SolutionIndex: 275
    SolutionNameMin: Cijk_Ailk_Bjlk_SB_MT64x16x32_MI16x16x4x1_SE_1LDSB0_AF0EM1_AF1EM1_AMAS0_BL1_DTL0_DVO0_EPS0_FL0_GRVW1_GSU5_ISA908_IU1_KLA_LRVW1_MAC_MDA2_NLCA1_NLCB1_ONLL1_PGR2_PLR1_SIA3_SU0_SUS256_SRVW0_SVW4_SNLL0_TT1_16_TLDS0_USFGROn1_VSn1_VW1_WSGRA1_WSGRB1_WG64_4_1_WGM2
    SolutionIndex: 276
    SolutionNameMin: Cijk_Ailk_Bjlk_SB_MT32x64x32_MI16x16x4x1_SE_1LDSB0_AF0EM1_AF1EM1_AMAS0_BL1_DTL0_DVO0_EPS0_FL0_GRVW2_GSU1_ISA908_IU1_KLA_LRVW1_MAC_MDA2_NLCA1_NLCB1_ONLL1_PGR2_PLR1_SIA3_SU32_SUS128_SRVW2_SVW4_SNLL0_TT1_32_TLDS0_USFGROn1_VSn1_VW1_WSGRA1_WSGRB1_WG32_8_1_WGM15
    SolutionIndex: 277
    SolutionNameMin: Cijk_Ailk_Bjlk_SB_MT32x32x8_MI16x16x4x1_SE_1LDSB0_AF0EM1_AF1EM1_AMAS0_BL1_DTL0_DVO0_EPS0_FL0_GRVW2_GSU1_ISA908_IU1_KLA_LRVW1_MAC_MDA2_NLCA1_NLCB1_ONLL1_PGR2_PLR1_SIA3_SU0_SUS256_SRVW2_SVW4_SNLL0_TT1_16_TLDS0_USFGROn1_VSn1_VW1_WSGRA1_WSGRB1_WG32_8_1_WGM1
    SolutionIndex: 278
    SolutionNameMin: Cijk_Ailk_Bjlk_SB_MT64x128x16_MI32x32x2x1_SE_1LDSB0_AF0EM1_AF1EM1_AMAS0_BL1_DTL0_DVO0_EPS1_FL0_GRVW4_GSU1_ISA908_IU1_KLA_LRVW1_MAC_MDA2_NLCA1_NLCB1_ONLL1_PGR1_PLR1_SIA3_SU0_SUS256_SRVW2_SVW4_SNLL0_TT1_64_TLDS0_USFGROn1_VSn1_VW1_WSGRA1_WSGRB1_WG64_4_1_WGM15
    SolutionIndex: 279
    SolutionNameMin: Cijk_Ailk_Bjlk_SB_MT8x8x8_SN_1LDSB0_AF0EM1_AF1EM1_AMAS3_BL1_DTL0_DVO0_EPS1_FL0_GRVW2_GSU1_ISA908_IU1_KLA_LRVW2_MAC_MDA2_NLCA1_NLCB1_ONLL1_PGR1_PLR1_SIA1_SU32_SUS256_SRVW0_SVW4_SNLL0_TT2_2_TLDS0_USFGRO1_VS1_VW2_WSGRA0_WSGRB0_WG4_4_4_WGM1
    SolutionIndex: 280
    SolutionNameMin: Cijk_Ailk_Bjlk_SB_MT128x96x32_MI32x32x2x1_SE_1LDSB0_AF0EM1_AF1EM1_AMAS0_BL1_DTL0_DVO0_EPS1_FL0_GRVW4_GSU1_ISA908_IU1_KLA_LRVW1_MAC_MDA2_NLCA1_NLCB3_ONLL1_PGR1_PLR1_SIA3_SU32_SUS128_SRVW2_SVW4_SNLL0_TT1_96_TLDS0_USFGROn1_VSn1_VW1_WSGRA1_WSGRB1_WG128_2_1_WGM15
    SolutionIndex: 281
    SolutionNameMin: Cijk_Ailk_Bjlk_SB_MT16x16x32_MI16x16x4x1_SE_1LDSB0_AF0EM1_AF1EM1_AMAS0_BL1_DTL0_DVO0_EPS0_FL0_GRVW1_GSU5_ISA908_IU1_KLA_LRVW1_MAC_MDA2_NLCA1_NLCB1_ONLL1_PGR2_PLR1_SIA3_SU32_SUS128_SRVW0_SVW4_SNLL0_TT1_16_TLDS0_USFGROn1_VSn1_VW1_WSGRA1_WSGRB1_WG16_4_1_WGM15
    SolutionIndex: 282
    SolutionNameMin: Cijk_Ailk_Bjlk_SB_MT128x64x32_MI32x32x2x1_SE_1LDSB0_AF0EM1_AF1EM1_AMAS0_BL1_DTL0_DVO0_EPS0_FL0_GRVW1_GSU1_ISA908_IU1_KLA_LRVW1_MAC_MDA2_NLCA2_NLCB1_ONLL1_PGR2_PLR1_SIA3_SU0_SUS256_SRVW2_SVW4_SNLL0_TT2_32_TLDS0_USFGROn1_VSn1_VW1_WSGRA1_WSGRB1_WG64_4_1_WGM15
    SolutionIndex: 283
    SolutionNameMin: Cijk_Ailk_Bjlk_SB_MT96x96x32_MI16x16x4x1_SE_1LDSB1_AF0EM1_AF1EM1_AMAS0_BL1_DTL0_DVO0_EPS0_FL0_GRVW4_GSU1_ISA908_IU1_KLA_LRVW1_MAC_MDA2_NLCA3_NLCB3_ONLL1_PGR2_PLR1_SIA3_SU0_SUS256_SRVW0_SVW4_SNLL0_TT3_48_TLDS0_USFGROn1_VSn1_VW1_WSGRA1_WSGRB1_WG32_8_1_WGM2
    SolutionIndex: 284
    SolutionNameMin: Cijk_Ailk_Bjlk_SB_MT16x16x16_SN_1LDSB0_AF0EM1_AF1EM1_AMAS3_BL1_DTL0_DVO0_EPS1_FL0_GRVW2_GSU4_ISA908_IU1_KLA_LRVW2_MAC_MDA2_NLCA1_NLCB1_ONLL1_PGR1_PLR1_SIA1_SU32_SUS256_SRVW0_SVW4_SNLL0_TT2_2_TLDS0_USFGRO1_VS1_VW2_WSGRA0_WSGRB0_WG8_8_4_WGM1
    SolutionIndex: 285
    SolutionNameMin: Cijk_Ailk_Bjlk_SB_MT64x64x32_MI16x16x4x1_SE_1LDSB0_AF0EM1_AF1EM1_AMAS3_BL1_DTL0_DVO0_EPS1_FL1_GRVW4_GSU1_ISA908_IU2_KLA_LRVW1_MAC_MDA2_NLCA1_NLCB1_ONLL0_PGR1_PLR1_SIA3_SU32_SUS256_SRVW4_SVW4_SNLL0_TT4_16_TLDS1_USFGROn1_VSn1_VW4_WSGRA0_WSGRB0_WG16_16_1_WGM8
    SolutionIndex: 286
    SolutionNameMin: Cijk_Ailk_Bjlk_SB_MT32x64x16_MI16x16x4x1_SE_1LDSB0_AF0EM1_AF1EM1_AMAS0_BL1_DTL0_DVO0_EPS0_FL0_GRVW1_GSU1_ISA908_IU1_KLA_LRVW1_MAC_MDA2_NLCA1_NLCB1_ONLL1_PGR2_PLR1_SIA3_SU0_SUS256_SRVW2_SVW4_SNLL0_TT1_32_TLDS0_USFGROn1_VSn1_VW1_WSGRA1_WSGRB1_WG32_8_1_WGM1
    SolutionIndex: 287
    SolutionNameMin: Cijk_Ailk_Bjlk_SB_MT32x16x32_SE_1LDSB0_AF0EM1_AF1EM1_AMAS3_BL1_DTL0_DVO0_EPS1_FL0_GRVW2_GSU1_ISA908_IU1_KLA_LRVW2_MAC_MDA2_NLCA1_NLCB1_ONLL1_PGR1_PLR1_SIA1_SU32_SUS256_SRVW0_SVW4_SNLL0_TT4_2_TLDS0_USFGRO0_VS1_VW2_WSGRA0_WSGRB0_WG8_8_4_WGM1
    SolutionIndex: 288
    SolutionNameMin: Cijk_Ailk_Bjlk_SB_MT128x96x16_MI32x32x2x1_SE_1LDSB0_AF0EM1_AF1EM1_AMAS0_BL1_DTL0_DVO0_EPS0_FL0_GRVW2_GSU1_ISA908_IU1_KLA_LRVW1_MAC_MDA2_NLCA1_NLCB3_ONLL1_PGR2_PLR1_SIA3_SU32_SUS128_SRVW2_SVW4_SNLL0_TT1_96_TLDS0_USFGROn1_VSn1_VW1_WSGRA1_WSGRB1_WG128_2_1_WGM2
    SolutionIndex: 289
    SolutionNameMin: Cijk_Ailk_Bjlk_SB_MT64x128x16_MI16x16x4x1_SE_1LDSB0_AF0EM4_AF1EM1_AMAS3_BL1_DTL0_DVO0_EPS1_FL1_GRVW4_GSU1_ISA908_IU1_KLA_LRVW1_MAC_MDA2_NLCA1_NLCB1_ONLL0_PGR1_PLR1_SIA3_SU32_SUS256_SRVW4_SVW4_SNLL0_TT4_32_TLDS1_USFGROn1_VSn1_VW4_WSGRA0_WSGRB0_WG16_16_1_WGM8
    SolutionIndex: 290
    SolutionNameMin: Cijk_Ailk_Bjlk_SB_MT64x32x32_SE_1LDSB0_AF0EM1_AF1EM1_AMAS3_BL1_DTL0_DVO0_EPS1_FL1_GRVW4_GSU1_ISA908_IU1_KLA_LRVW4_MAC_MDA2_NLCA1_NLCB1_ONLL1_PGR1_PLR1_SIA1_SU32_SUS256_SRVW0_SVW4_SNLL0_TT4_4_TLDS0_USFGRO0_VS1_VW4_WSGRA0_WSGRB0_WG16_8_2_WGM8
    SolutionIndex: 291
    SolutionNameMin: Cijk_Ailk_Bjlk_SB_MT64x64x32_MI16x16x4x1_SE_1LDSB0_AF0EM1_AF1EM1_AMAS3_BL1_DTL0_DVO0_EPS1_FL1_GRVW4_GSU1_ISA908_IU1_KLA_LRVW1_MAC_MDA2_NLCA1_NLCB1_ONLL2_PGR1_PLR1_SIA3_SU32_SUS256_SRVW4_SVW4_SNLL0_TT4_16_TLDS1_USFGROn1_VSn1_VW4_WSGRA0_WSGRB0_WG16_16_1_WGM1
    SolutionIndex: 292
    SolutionNameMin: Cijk_Ailk_Bjlk_SB_MT32x32x8_MI16x16x4x1_SE_1LDSB0_AF0EM1_AF1EM1_AMAS0_BL1_DTL0_DVO0_EPS0_FL0_GRVW2_GSU1_ISA908_IU2_KLA_LRVW1_MAC_MDA2_NLCA1_NLCB1_ONLL1_PGR2_PLR1_SIA3_SU0_SUS128_SRVW2_SVW4_SNLL0_TT1_16_TLDS0_USFGROn1_VSn1_VW1_WSGRA1_WSGRB1_WG32_8_1_WGM1
    SolutionIndex: 293
    SolutionNameMin: Cijk_Ailk_Bjlk_SB_MT128x128x16_MI32x32x2x1_SE_1LDSB1_AF0EM1_AF1EM1_AMAS0_BL1_DTL0_DVO0_EPS1_FL0_GRVW4_GSU1_ISA908_IU1_KLA_LRVW1_MAC_MDA2_NLCA1_NLCB1_ONLL1_PGR1_PLR1_SIA3_SU32_SUS256_SRVW2_SVW4_SNLL0_TT2_64_TLDS0_USFGROn1_VSn1_VW1_WSGRA1_WSGRB1_WG64_4_1_WGM15
    SolutionIndex: 294
    SolutionNameMin: Cijk_Ailk_Bjlk_SB_MT64x128x8_MI32x32x2x1_SE_1LDSB0_AF0EM1_AF1EM1_AMAS0_BL1_DTL0_DVO0_EPS0_FL0_GRVW2_GSU1_ISA908_IU1_KLA_LRVW1_MAC_MDA2_NLCA1_NLCB1_ONLL1_PGR2_PLR1_SIA3_SU0_SUS256_SRVW2_SVW4_SNLL0_TT1_64_TLDS0_USFGROn1_VSn1_VW1_WSGRA1_WSGRB1_WG64_4_1_WGM15
    SolutionIndex: 295
    SolutionNameMin: Cijk_Ailk_Bjlk_SB_MT64x64x32_MI32x32x2x1_SE_1LDSB0_AF0EM1_AF1EM1_AMAS0_BL1_DTL0_DVO0_EPS0_FL0_GRVW1_GSU1_ISA908_IU1_KLA_LRVW1_MAC_MDA2_NLCA1_NLCB1_ONLL1_PGR2_PLR1_SIA3_SU32_SUS256_SRVW2_SVW4_SNLL0_TT1_32_TLDS0_USFGROn1_VSn1_VW1_WSGRA1_WSGRB1_WG64_4_1_WGM1
    SolutionIndex: 296
    SolutionNameMin: Cijk_Ailk_Bjlk_SB_MT64x16x32_MI16x16x4x1_SE_1LDSB0_AF0EM1_AF1EM1_AMAS0_BL1_DTL0_DVO0_EPS0_FL0_GRVW1_GSU5_ISA908_IU1_KLA_LRVW1_MAC_MDA2_NLCA1_NLCB1_ONLL1_PGR2_PLR1_SIA3_SU32_SUS128_SRVW0_SVW4_SNLL0_TT1_16_TLDS0_USFGROn1_VSn1_VW1_WSGRA1_WSGRB1_WG64_4_1_WGM2
    SolutionIndex: 297
    SolutionNameMin: Cijk_Ailk_Bjlk_SB_MT128x64x32_MI32x32x2x1_SE_1LDSB0_AF0EM1_AF1EM1_AMAS0_BL1_DTL0_DVO0_EPS1_FL0_GRVW4_GSU1_ISA908_IU1_KLA_LRVW1_MAC_MDA2_NLCA1_NLCB1_ONLL1_PGR1_PLR1_SIA3_SU0_SUS256_SRVW2_SVW4_SNLL0_TT2_32_TLDS0_USFGROn1_VSn1_VW1_WSGRA1_WSGRB1_WG64_4_1_WGM1
    SolutionIndex: 298
    SolutionNameMin: Cijk_Ailk_Bjlk_SB_MT32x32x16_SE_1LDSB0_AF0EM1_AF1EM1_AMAS3_BL1_DTL0_DVO0_EPS1_FL0_GRVW2_GSU1_ISA908_IU1_KLA_LRVW2_MAC_MDA2_NLCA1_NLCB1_ONLL1_PGR1_PLR1_SIA1_SU32_SUS256_SRVW0_SVW4_SNLL0_TT4_4_TLDS0_USFGRO0_VS1_VW2_WSGRA0_WSGRB0_WG8_8_4_WGM1
    SolutionIndex: 299
    SolutionNameMin: Cijk_Ailk_Bjlk_SB_MT32x16x32_SN_1LDSB0_AF0EM1_AF1EM1_AMAS3_BL1_DTL0_DVO0_EPS1_FL0_GRVW2_GSU2_ISA908_IU1_KLA_LRVW2_MAC_MDA2_NLCA1_NLCB1_ONLL1_PGR1_PLR1_SIA1_SU32_SUS256_SRVW0_SVW4_SNLL0_TT4_2_TLDS0_USFGRO0_VS1_VW2_WSGRA0_WSGRB0_WG8_8_4_WGM8
    SolutionIndex: 300
    SolutionNameMin: Cijk_Ailk_Bjlk_SB_MT32x64x8_MI16x16x4x1_SE_1LDSB0_AF0EM1_AF1EM1_AMAS0_BL1_DTL0_DVO0_EPS0_FL0_GRVW1_GSU1_ISA908_IU1_KLA_LRVW1_MAC_MDA2_NLCA1_NLCB1_ONLL1_PGR2_PLR1_SIA3_SU0_SUS256_SRVW2_SVW4_SNLL0_TT1_32_TLDS0_USFGROn1_VSn1_VW1_WSGRA1_WSGRB1_WG32_8_1_WGM15
    SolutionIndex: 301
    SolutionNameMin: Cijk_Ailk_Bjlk_SB_MT96x128x16_MI32x32x2x1_SE_1LDSB0_AF0EM1_AF1EM1_AMAS0_BL1_DTL0_DVO0_EPS0_FL0_GRVW1_GSU1_ISA908_IU1_KLA_LRVW1_MAC_MDA2_NLCA3_NLCB2_ONLL1_PGR2_PLR1_SIA3_SU0_SUS256_SRVW0_SVW4_SNLL0_TT3_32_TLDS0_USFGROn1_VSn1_VW1_WSGRA1_WSGRB1_WG32_8_1_WGM1
    SolutionIndex: 302
    SolutionNameMin: Cijk_Ailk_Bjlk_SB_MT128x128x16_MI32x32x2x1_SE_1LDSB0_AF0EM1_AF1EM1_AMAS0_BL1_DTL0_DVO0_EPS1_FL0_GRVW4_GSU1_ISA908_IU1_KLA_LRVW1_MAC_MDA2_NLCA1_NLCB1_ONLL1_PGR1_PLR1_SIA3_SU32_SUS256_SRVW2_SVW4_SNLL0_TT2_64_TLDS0_USFGROn1_VSn1_VW1_WSGRA1_WSGRB1_WG64_4_1_WGM2
    SolutionIndex: 303
    SolutionNameMin: Cijk_Ailk_Bjlk_SB_MT128x160x16_MI32x32x2x1_SE_1LDSB0_AF0EM1_AF1EM1_AMAS0_BL1_DTL0_DVO0_EPS1_FL0_GRVW1_GSU1_ISA908_IU1_KLA_LRVW1_MAC_MDA2_NLCA2_NLCB5_ONLL1_PGR1_PLR1_SIA3_SU32_SUS256_SRVW2_SVW4_SNLL0_TT1_160_TLDS0_USFGROn1_VSn1_VW1_WSGRA1_WSGRB1_WG128_2_1_WGM1
    SolutionIndex: 304
    SolutionNameMin: Cijk_Ailk_Bjlk_SB_MT16x32x32_SE_1LDSB0_AF0EM1_AF1EM1_AMAS0_BL1_DTL0_DVO0_EPS1_FL0_GRVW1_GSU1_ISA908_IU1_KLA_LRVW1_MAC_MDA2_NLCA1_NLCB1_ONLL1_PGR1_PLR1_SIA1_SU32_SUS256_SRVW0_SVW4_SNLL0_TT2_4_TLDS0_USFGRO1_VS1_VW1_WSGRA0_WSGRB0_WG8_8_4_WGM1
    SolutionIndex: 305
    SolutionNameMin: Cijk_Ailk_Bjlk_SB_MT64x64x32_MI16x16x4x1_SE_1LDSB0_AF0EM1_AF1EM1_AMAS3_BL1_DTL0_DVO1_EPS1_FL1_GRVW4_GSU1_ISA908_IU1_KLA_LRVW1_MAC_MDA2_NLCA1_NLCB1_ONLL2_PGR1_PLR1_SIA1_SU32_SUS256_SRVW4_SVW4_SNLL0_TT4_16_TLDS1_USFGROn1_VSn1_VW4_WSGRA0_WSGRB0_WG16_16_1_WGM1
    SolutionIndex: 306
    SolutionNameMin: Cijk_Ailk_Bjlk_SB_MT96x128x16_MI32x32x2x1_SE_1LDSB0_AF0EM1_AF1EM1_AMAS0_BL1_DTL0_DVO0_EPS0_FL0_GRVW2_GSU1_ISA908_IU1_KLA_LRVW1_MAC_MDA2_NLCA3_NLCB1_ONLL1_PGR2_PLR1_SIA3_SU32_SUS256_SRVW0_SVW4_SNLL0_TT3_32_TLDS0_USFGROn1_VSn1_VW1_WSGRA1_WSGRB1_WG32_8_1_WGM15
    SolutionIndex: 307
    SolutionNameMin: Cijk_Ailk_Bjlk_SB_MT64x128x8_MI32x32x2x1_SE_1LDSB0_AF0EM1_AF1EM1_AMAS0_BL1_DTL0_DVO0_EPS0_FL0_GRVW2_GSU1_ISA908_IU1_KLA_LRVW1_MAC_MDA2_NLCA1_NLCB1_ONLL1_PGR2_PLR1_SIA3_SU32_SUS128_SRVW2_SVW4_SNLL0_TT1_64_TLDS0_USFGROn1_VSn1_VW1_WSGRA1_WSGRB1_WG64_4_1_WGM1
    SolutionIndex: 308
    SolutionNameMin: Cijk_Ailk_Bjlk_SB_MT64x128x8_MI32x32x2x1_SE_1LDSB0_AF0EM1_AF1EM1_AMAS0_BL1_DTL0_DVO0_EPS0_FL0_GRVW2_GSU1_ISA908_IU1_KLA_LRVW1_MAC_MDA2_NLCA1_NLCB1_ONLL1_PGR2_PLR1_SIA3_SU32_SUS256_SRVW2_SVW4_SNLL0_TT1_64_TLDS0_USFGROn1_VSn1_VW1_WSGRA1_WSGRB1_WG64_4_1_WGM1
    SolutionIndex: 309
    SolutionNameMin: Cijk_Ailk_Bjlk_SB_MT32x32x32_MI16x16x4x1_SE_1LDSB0_AF0EM1_AF1EM1_AMAS0_BL1_DTL0_DVO0_EPS0_FL0_GRVW4_GSU3_ISA908_IU1_KLA_LRVW1_MAC_MDA2_NLCA1_NLCB1_ONLL1_PGR2_PLR1_SIA3_SU32_SUS256_SRVW0_SVW4_SNLL0_TT1_16_TLDS0_USFGROn1_VSn1_VW1_WSGRA1_WSGRB1_WG32_8_1_WGM2
    SolutionIndex: 310
    SolutionNameMin: Cijk_Ailk_Bjlk_SB_MT32x32x16_MI16x16x4x1_SE_1LDSB0_AF0EM1_AF1EM1_AMAS0_BL1_DTL0_DVO0_EPS0_FL0_GRVW1_GSU1_ISA908_IU1_KLA_LRVW1_MAC_MDA2_NLCA1_NLCB1_ONLL1_PGR2_PLR1_SIA3_SU0_SUS256_SRVW2_SVW4_SNLL0_TT1_16_TLDS0_USFGROn1_VSn1_VW1_WSGRA1_WSGRB1_WG32_8_1_WGM1
    SolutionIndex: 311
    SolutionNameMin: Cijk_Ailk_Bjlk_SB_MT64x64x16_MI32x32x2x1_SE_1LDSB0_AF0EM1_AF1EM1_AMAS0_BL1_DTL0_DVO0_EPS1_FL0_GRVW1_GSU1_ISA908_IU1_KLA_LRVW1_MAC_MDA2_NLCA1_NLCB1_ONLL1_PGR1_PLR1_SIA3_SU0_SUS256_SRVW2_SVW4_SNLL0_TT1_32_TLDS0_USFGROn1_VSn1_VW1_WSGRA1_WSGRB1_WG64_4_1_WGM1
    SolutionIndex: 312
    SolutionNameMin: Cijk_Ailk_Bjlk_SB_MT32x16x32_SE_1LDSB0_AF0EM1_AF1EM1_AMAS0_BL1_DTL0_DVO0_EPS1_FL0_GRVW1_GSU1_ISA908_IU1_KLA_LRVW1_MAC_MDA2_NLCA1_NLCB1_ONLL1_PGR1_PLR1_SIA1_SU32_SUS256_SRVW0_SVW4_SNLL0_TT4_2_TLDS0_USFGRO1_VS1_VW1_WSGRA0_WSGRB0_WG8_8_4_WGM1
    SolutionIndex: 313
    SolutionNameMin: Cijk_Ailk_Bjlk_SB_MT128x160x16_MI32x32x2x1_SE_1LDSB0_AF0EM1_AF1EM1_AMAS0_BL1_DTL0_DVO0_EPS1_FL0_GRVW1_GSU1_ISA908_IU1_KLA_LRVW1_MAC_MDA2_NLCA2_NLCB5_ONLL1_PGR1_PLR1_SIA3_SU32_SUS256_SRVW2_SVW4_SNLL0_TT1_160_TLDS0_USFGROn1_VSn1_VW1_WSGRA1_WSGRB1_WG128_2_1_WGM2
    SolutionIndex: 314
    SolutionNameMin: Cijk_Ailk_Bjlk_SB_MT32x32x32_SN_1LDSB0_AF0EM1_AF1EM1_AMAS3_BL1_DTL0_DVO0_EPS1_FL0_GRVW4_GSU4_ISA908_IU1_KLA_LRVW4_MAC_MDA2_NLCA1_NLCB1_ONLL1_PGR1_PLR1_SIA1_SU32_SUS256_SRVW0_SVW4_SNLL0_TT4_4_TLDS0_USFGRO0_VS1_VW4_WSGRA0_WSGRB0_WG8_8_4_WGM1
    SolutionIndex: 315
    SolutionNameMin: Cijk_Ailk_Bjlk_SB_MT32x32x16_MI16x16x4x1_SE_1LDSB0_AF0EM1_AF1EM1_AMAS0_BL1_DTL0_DVO0_EPS0_FL0_GRVW4_GSU1_ISA908_IU1_KLA_LRVW1_MAC_MDA2_NLCA1_NLCB1_ONLL1_PGR2_PLR1_SIA3_SU0_SUS256_SRVW2_SVW4_SNLL0_TT1_16_TLDS0_USFGROn1_VSn1_VW1_WSGRA1_WSGRB1_WG32_8_1_WGM15
    SolutionIndex: 316
    SolutionNameMin: Cijk_Ailk_Bjlk_SB_MT64x64x8_MI32x32x2x1_SE_1LDSB0_AF0EM1_AF1EM1_AMAS0_BL1_DTL0_DVO0_EPS0_FL0_GRVW1_GSU1_ISA908_IU1_KLA_LRVW1_MAC_MDA2_NLCA1_NLCB1_ONLL1_PGR2_PLR1_SIA3_SU32_SUS256_SRVW2_SVW4_SNLL0_TT1_32_TLDS0_USFGROn1_VSn1_VW1_WSGRA1_WSGRB1_WG64_4_1_WGM15
    SolutionIndex: 317
    SolutionNameMin: Cijk_Ailk_Bjlk_SB_MT16x16x32_MI16x16x4x1_SE_1LDSB0_AF0EM1_AF1EM1_AMAS0_BL1_DTL0_DVO0_EPS0_FL0_GRVW2_GSU5_ISA908_IU1_KLA_LRVW1_MAC_MDA2_NLCA1_NLCB1_ONLL1_PGR2_PLR1_SIA3_SU32_SUS128_SRVW0_SVW4_SNLL0_TT1_16_TLDS0_USFGROn1_VSn1_VW1_WSGRA1_WSGRB1_WG16_4_1_WGM15
    SolutionIndex: 318
    SolutionNameMin: Cijk_Ailk_Bjlk_SB_MT64x128x8_MI32x32x2x1_SE_1LDSB0_AF0EM1_AF1EM1_AMAS0_BL1_DTL0_DVO0_EPS0_FL0_GRVW1_GSU1_ISA908_IU1_KLA_LRVW1_MAC_MDA2_NLCA1_NLCB2_ONLL1_PGR2_PLR1_SIA3_SU0_SUS256_SRVW2_SVW4_SNLL0_TT1_64_TLDS0_USFGROn1_VSn1_VW1_WSGRA1_WSGRB1_WG64_4_1_WGM2
    SolutionIndex: 319
    SolutionNameMin: Cijk_Ailk_Bjlk_SB_MT32x16x32_SE_1LDSB0_AF0EM1_AF1EM1_AMAS3_BL1_DTL0_DVO0_EPS1_FL0_GRVW2_GSU1_ISA908_IU1_KLA_LRVW2_MAC_MDA2_NLCA1_NLCB1_ONLL1_PGR1_PLR1_SIA1_SU32_SUS256_SRVW0_SVW4_SNLL0_TT4_2_TLDS0_USFGRO0_VS1_VW2_WSGRA0_WSGRB0_WG8_8_4_WGM8
    SolutionIndex: 320
    SolutionNameMin: Cijk_Ailk_Bjlk_SB_MT16x64x16_SE_1LDSB0_AF0EM1_AF1EM1_AMAS3_BL1_DTL0_DVO0_EPS1_FL0_GRVW4_GSU1_ISA908_IU1_KLA_LRVW4_MAC_MDA2_NLCA1_NLCB1_ONLL1_PGR1_PLR0_SIA1_SU32_SUS256_SRVW0_SVW4_SNLL0_TT4_4_TLDS0_USFGRO0_VS1_VW4_WSGRA0_WSGRB0_WG4_16_4_WGM1
    SolutionIndex: 321
    SolutionNameMin: Cijk_Ailk_Bjlk_SB_MT64x192x8_MI32x32x2x1_SE_1LDSB0_AF0EM1_AF1EM1_AMAS0_BL1_DTL0_DVO0_EPS0_FL0_GRVW2_GSU1_ISA908_IU1_KLA_LRVW1_MAC_MDA2_NLCA1_NLCB3_ONLL1_PGR2_PLR1_SIA3_SU32_SUS128_SRVW2_SVW4_SNLL0_TT1_96_TLDS0_USFGROn1_VSn1_VW1_WSGRA1_WSGRB1_WG64_4_1_WGM2
    SolutionIndex: 322
    SolutionNameMin: Cijk_Ailk_Bjlk_SB_MT64x64x8_MI32x32x2x1_SE_1LDSB0_AF0EM1_AF1EM1_AMAS0_BL1_DTL0_DVO0_EPS0_FL0_GRVW4_GSU1_ISA908_IU1_KLA_LRVW1_MAC_MDA2_NLCA1_NLCB1_ONLL1_PGR2_PLR1_SIA3_SU0_SUS256_SRVW2_SVW4_SNLL0_TT1_32_TLDS0_USFGROn1_VSn1_VW1_WSGRA1_WSGRB1_WG64_4_1_WGM15
    SolutionIndex: 323
    SolutionNameMin: Cijk_Ailk_Bjlk_SB_MT64x256x8_MI32x32x2x1_SE_1LDSB1_AF0EM1_AF1EM1_AMAS0_BL1_DTL0_DVO0_EPS0_FL0_GRVW4_GSU1_ISA908_IU1_KLA_LRVW1_MAC_MDA2_NLCA1_NLCB1_ONLL1_PGR2_PLR1_SIA3_SU32_SUS256_SRVW2_SVW4_SNLL0_TT1_128_TLDS0_USFGROn1_VSn1_VW1_WSGRA1_WSGRB1_WG64_4_1_WGM2
    SolutionIndex: 324
    SolutionNameMin: Cijk_Ailk_Bjlk_SB_MT64x128x8_SE_1LDSB0_AF0EM1_AF1EM1_AMAS3_BL1_DTL0_DVO0_EPS1_FL0_GRVW1_GSU1_ISA908_IU1_KLA_LRVW4_MAC_MDA2_NLCA1_NLCB1_ONLL1_PGR1_PLR0_SIA1_SU32_SUS256_SRVW0_SVW4_SNLL0_TT4_8_TLDS0_USFGRO1_VS1_VW4_WSGRA0_WSGRB0_WG16_16_1_WGM1
    SolutionIndex: 325
    SolutionNameMin: Cijk_Ailk_Bjlk_SB_MT64x32x8_MI16x16x4x1_SE_1LDSB0_AF0EM1_AF1EM1_AMAS0_BL1_DTL0_DVO0_EPS0_FL0_GRVW4_GSU1_ISA908_IU1_KLA_LRVW1_MAC_MDA2_NLCA1_NLCB1_ONLL1_PGR2_PLR1_SIA3_SU0_SUS256_SRVW2_SVW4_SNLL0_TT2_16_TLDS0_USFGROn1_VSn1_VW1_WSGRA1_WSGRB1_WG32_8_1_WGM15
    SolutionIndex: 326
    SolutionNameMin: Cijk_Ailk_Bjlk_SB_MT64x128x16_MI32x32x2x1_SE_1LDSB0_AF0EM1_AF1EM1_AMAS0_BL1_DTL0_DVO0_EPS1_FL0_GRVW4_GSU1_ISA908_IU1_KLA_LRVW1_MAC_MDA2_NLCA1_NLCB1_ONLL1_PGR1_PLR1_SIA3_SU32_SUS128_SRVW2_SVW4_SNLL0_TT1_64_TLDS0_USFGROn1_VSn1_VW1_WSGRA1_WSGRB1_WG64_4_1_WGM15
    SolutionIndex: 327
    SolutionNameMin: Cijk_Ailk_Bjlk_SB_MT64x64x8_SE_1LDSB0_AF0EM1_AF1EM1_AMAS3_BL1_DTL0_DVO0_EPS1_FL1_GRVW4_GSU1_ISA908_IU1_KLA_LRVW2_MAC_MDA2_NLCA1_NLCB1_ONLL1_PGR1_PLR0_SIA1_SU32_SUS256_SRVW0_SVW4_SNLL0_TT4_4_TLDS0_USFGRO0_VS1_VW2_WSGRA0_WSGRB0_WG16_16_1_WGM1
    SolutionIndex: 328
    SolutionNameMin: Cijk_Ailk_Bjlk_SB_MT64x128x32_MI32x32x2x1_SE_1LDSB0_AF0EM1_AF1EM1_AMAS0_BL1_DTL0_DVO0_EPS1_FL0_GRVW4_GSU1_ISA908_IU1_KLA_LRVW1_MAC_MDA2_NLCA1_NLCB1_ONLL1_PGR1_PLR1_SIA3_SU32_SUS256_SRVW2_SVW4_SNLL0_TT1_64_TLDS0_USFGROn1_VSn1_VW1_WSGRA1_WSGRB1_WG64_4_1_WGM1
    SolutionIndex: 329
    SolutionNameMin: Cijk_Ailk_Bjlk_SB_MT256x64x8_MI16x16x1x4_SE_1LDSB0_AF0EM4_AF1EM4_AMAS0_BL1_DTL0_DVO0_EPS1_FL0_GRVW2_GSU1_ISA908_IU2_KLA_LRVW1_MAC_MDA2_NLCA1_NLCB1_ONLL2_PGR1_PLR1_SIA3_SU32_SUS256_SRVW0_SVW4_SNLL0_TT4_16_TLDS0_USFGROn1_VSn1_VW1_WSGRA0_WSGRB0_WG64_4_1_WGM2
    SolutionIndex: 330
    SolutionNameMin: Cijk_Ailk_Bjlk_SB_MT128x160x8_MI32x32x2x1_SE_1LDSB0_AF0EM1_AF1EM1_AMAS0_BL1_DTL0_DVO0_EPS0_FL0_GRVW1_GSU1_ISA908_IU1_KLA_LRVW1_MAC_MDA2_NLCA2_NLCB5_ONLL1_PGR2_PLR1_SIA3_SU32_SUS256_SRVW2_SVW4_SNLL0_TT1_160_TLDS0_USFGROn1_VSn1_VW1_WSGRA1_WSGRB1_WG128_2_1_WGM2
    SolutionIndex: 331
    SolutionNameMin: Cijk_Ailk_Bjlk_SB_MT128x96x16_MI32x32x2x1_SE_1LDSB0_AF0EM1_AF1EM1_AMAS0_BL1_DTL0_DVO0_EPS0_FL0_GRVW2_GSU1_ISA908_IU1_KLA_LRVW1_MAC_MDA2_NLCA1_NLCB3_ONLL1_PGR2_PLR1_SIA3_SU32_SUS256_SRVW2_SVW4_SNLL0_TT1_96_TLDS0_USFGROn1_VSn1_VW1_WSGRA1_WSGRB1_WG128_2_1_WGM1
    SolutionIndex: 332
    SolutionNameMin: Cijk_Ailk_Bjlk_SB_MT144x128x16_MI16x16x4x1_SE_1LDSB1_AF0EM1_AF1EM1_AMAS0_BL1_DTL0_DVO0_EPS1_FL0_GRVW1_GSU1_ISA908_IU1_KLA_LRVW1_MAC_MDA2_NLCA9_NLCB2_ONLL1_PGR1_PLR1_SIA3_SU0_SUS256_SRVW0_SVW4_SNLL0_TT9_32_TLDS0_USFGROn1_VSn1_VW1_WSGRA1_WSGRB1_WG16_16_1_WGM1
    SolutionIndex: 333
    SolutionNameMin: Cijk_Ailk_Bjlk_SB_MT128x96x16_MI32x32x2x1_SE_1LDSB0_AF0EM1_AF1EM1_AMAS0_BL1_DTL0_DVO0_EPS0_FL0_GRVW2_GSU1_ISA908_IU1_KLA_LRVW1_MAC_MDA2_NLCA1_NLCB3_ONLL1_PGR2_PLR1_SIA3_SU32_SUS256_SRVW2_SVW4_SNLL0_TT1_96_TLDS0_USFGROn1_VSn1_VW1_WSGRA1_WSGRB1_WG128_2_1_WGM15
    SolutionIndex: 334
    SolutionNameMin: Cijk_Ailk_Bjlk_SB_MT128x288x8_MI32x32x2x1_SE_1LDSB0_AF0EM1_AF1EM1_AMAS0_BL1_DTL0_DVO0_EPS1_FL0_GRVW1_GSU1_ISA908_IU1_KLA_LRVW1_MAC_MDA2_NLCA2_NLCB9_ONLL1_PGR1_PLR1_SIA3_SU32_SUS256_SRVW2_SVW4_SNLL0_TT1_288_TLDS0_USFGROn1_VSn1_VW1_WSGRA1_WSGRB1_WG128_2_1_WGM1
    SolutionIndex: 335
    SolutionNameMin: Cijk_Ailk_Bjlk_SB_MT192x64x8_MI32x32x2x1_SE_1LDSB0_AF0EM1_AF1EM1_AMAS0_BL1_DTL0_DVO0_EPS0_FL0_GRVW1_GSU1_ISA908_IU1_KLA_LRVW1_MAC_MDA2_NLCA3_NLCB1_ONLL1_PGR2_PLR1_SIA3_SU0_SUS256_SRVW0_SVW4_SNLL0_TT3_32_TLDS0_USFGROn1_VSn1_VW1_WSGRA1_WSGRB1_WG64_4_1_WGM2
    SolutionIndex: 336
    SolutionNameMin: Cijk_Ailk_Bjlk_SB_MT128x96x16_MI32x32x2x1_SN_1LDSB0_AF0EM1_AF1EM1_AMAS0_BL1_DTL0_DVO0_EPS1_FL0_GRVW2_GSU1_ISA908_IU1_KLA_LRVW1_MAC_MDA2_NLCA1_NLCB3_ONLL1_PGR1_PLR1_SIA3_SU32_SUS256_SRVW2_SVW4_SNLL0_TT1_96_TLDS0_USFGROn1_VSn1_VW1_WSGRA1_WSGRB1_WG128_2_1_WGM2
    SolutionIndex: 337
    SolutionNameMin: Cijk_Ailk_Bjlk_SB_MT144x128x16_MI16x16x4x1_SE_1LDSB1_AF0EM1_AF1EM1_AMAS0_BL1_DTL0_DVO0_EPS1_FL0_GRVW1_GSU1_ISA908_IU1_KLA_LRVW1_MAC_MDA2_NLCA9_NLCB2_ONLL1_PGR1_PLR1_SIA3_SU32_SUS256_SRVW0_SVW4_SNLL0_TT9_32_TLDS0_USFGROn1_VSn1_VW1_WSGRA1_WSGRB1_WG16_16_1_WGM2
    SolutionIndex: 338
    SolutionNameMin: Cijk_Ailk_Bjlk_SB_MT128x96x16_MI32x32x2x1_SE_1LDSB0_AF0EM1_AF1EM1_AMAS0_BL1_DTL0_DVO0_EPS0_FL0_GRVW1_GSU1_ISA908_IU1_KLA_LRVW1_MAC_MDA2_NLCA2_NLCB3_ONLL1_PGR2_PLR1_SIA3_SU32_SUS128_SRVW2_SVW4_SNLL0_TT1_96_TLDS0_USFGROn1_VSn1_VW1_WSGRA1_WSGRB1_WG128_2_1_WGM15
    SolutionIndex: 339
    SolutionNameMin: Cijk_Ailk_Bjlk_SB_MT128x96x16_MI32x32x2x1_SE_1LDSB0_AF0EM1_AF1EM1_AMAS0_BL1_DTL0_DVO0_EPS0_FL0_GRVW1_GSU1_ISA908_IU1_KLA_LRVW1_MAC_MDA2_NLCA2_NLCB3_ONLL1_PGR2_PLR1_SIA3_SU0_SUS256_SRVW2_SVW4_SNLL0_TT1_96_TLDS0_USFGROn1_VSn1_VW1_WSGRA1_WSGRB1_WG128_2_1_WGM15
    SolutionIndex: 340
    SolutionNameMin: Cijk_Ailk_Bjlk_SB_MT128x96x16_MI32x32x2x1_SE_1LDSB0_AF0EM1_AF1EM1_AMAS0_BL1_DTL0_DVO0_EPS1_FL0_GRVW2_GSU1_ISA908_IU1_KLA_LRVW1_MAC_MDA2_NLCA1_NLCB3_ONLL1_PGR1_PLR1_SIA3_SU32_SUS256_SRVW2_SVW4_SNLL0_TT1_96_TLDS0_USFGROn1_VSn1_VW1_WSGRA1_WSGRB1_WG128_2_1_WGM15
    SolutionIndex: 341
    SolutionNameMin: Cijk_Ailk_Bjlk_SB_MT64x192x16_MI32x32x2x1_SE_1LDSB0_AF0EM1_AF1EM1_AMAS0_BL1_DTL0_DVO0_EPS0_FL0_GRVW4_GSU1_ISA908_IU1_KLA_LRVW1_MAC_MDA2_NLCA1_NLCB3_ONLL1_PGR2_PLR1_SIA3_SU32_SUS128_SRVW2_SVW4_SNLL0_TT1_96_TLDS0_USFGROn1_VSn1_VW1_WSGRA1_WSGRB1_WG64_4_1_WGM2
    SolutionIndex: 342
    SolutionNameMin: Cijk_Ailk_Bjlk_SB_MT64x192x16_MI32x32x2x1_SE_1LDSB0_AF0EM1_AF1EM1_AMAS0_BL1_DTL0_DVO0_EPS0_FL0_GRVW2_GSU1_ISA908_IU1_KLA_LRVW1_MAC_MDA2_NLCA1_NLCB3_ONLL1_PGR2_PLR1_SIA3_SU0_SUS256_SRVW2_SVW4_SNLL0_TT1_96_TLDS0_USFGROn1_VSn1_VW1_WSGRA1_WSGRB1_WG64_4_1_WGM2
    SolutionIndex: 343
    SolutionNameMin: Cijk_Ailk_Bjlk_SB_MT64x64x16_SE_1LDSB0_AF0EM1_AF1EM1_AMAS0_BL1_DTL0_DVO0_EPS1_FL0_GRVW1_GSU1_ISA908_IU1_KLA_LRVW1_MAC_MDA2_NLCA1_NLCB1_ONLL1_PGR1_PLR1_SIA1_SU32_SUS256_SRVW0_SVW4_SNLL0_TT4_4_TLDS0_USFGRO1_VS1_VW1_WSGRA0_WSGRB0_WG16_16_1_WGM1
    SolutionIndex: 344
    SolutionNameMin: Cijk_Ailk_Bjlk_SB_MT64x64x8_SE_1LDSB0_AF0EM1_AF1EM1_AMAS3_BL1_DTL0_DVO0_EPS1_FL1_GRVW2_GSU1_ISA908_IU1_KLA_LRVW2_MAC_MDA2_NLCA1_NLCB1_ONLL1_PGR1_PLR1_SIA1_SU32_SUS256_SRVW0_SVW4_SNLL0_TT4_4_TLDS0_USFGRO0_VS1_VW2_WSGRA0_WSGRB0_WG16_16_1_WGM1
    SolutionIndex: 345
    SolutionNameMin: Cijk_Ailk_Bjlk_SB_MT64x192x16_MI32x32x2x1_SN_1LDSB0_AF0EM1_AF1EM1_AMAS0_BL1_DTL0_DVO0_EPS0_FL0_GRVW4_GSU1_ISA908_IU1_KLA_LRVW1_MAC_MDA2_NLCA1_NLCB3_ONLL1_PGR2_PLR1_SIA3_SU32_SUS256_SRVW2_SVW4_SNLL0_TT1_96_TLDS0_USFGROn1_VSn1_VW1_WSGRA1_WSGRB1_WG64_4_1_WGM15
    SolutionIndex: 346
    SolutionNameMin: Cijk_Ailk_Bjlk_SB_MT64x192x16_MI32x32x2x1_SE_1LDSB0_AF0EM1_AF1EM1_AMAS0_BL1_DTL0_DVO0_EPS1_FL0_GRVW2_GSU1_ISA908_IU1_KLA_LRVW1_MAC_MDA2_NLCA1_NLCB3_ONLL1_PGR1_PLR1_SIA3_SU32_SUS128_SRVW2_SVW4_SNLL0_TT1_96_TLDS0_USFGROn1_VSn1_VW1_WSGRA1_WSGRB1_WG64_4_1_WGM1
    SolutionIndex: 347
    SolutionNameMin: Cijk_Ailk_Bjlk_SB_MT144x128x16_MI16x16x4x1_SE_1LDSB1_AF0EM1_AF1EM1_AMAS0_BL1_DTL0_DVO0_EPS0_FL0_GRVW1_GSU1_ISA908_IU1_KLA_LRVW1_MAC_MDA2_NLCA9_NLCB2_ONLL1_PGR2_PLR1_SIA3_SU0_SUS256_SRVW0_SVW4_SNLL0_TT9_32_TLDS0_USFGROn1_VSn1_VW1_WSGRA1_WSGRB1_WG16_16_1_WGM1
    SolutionIndex: 348
    SolutionNameMin: Cijk_Ailk_Bjlk_SB_MT144x128x16_MI16x16x4x1_SE_1LDSB1_AF0EM1_AF1EM1_AMAS0_BL1_DTL0_DVO0_EPS0_FL0_GRVW1_GSU1_ISA908_IU1_KLA_LRVW1_MAC_MDA2_NLCA9_NLCB2_ONLL1_PGR2_PLR1_SIA3_SU0_SUS256_SRVW0_SVW4_SNLL0_TT9_32_TLDS0_USFGROn1_VSn1_VW1_WSGRA1_WSGRB1_WG16_16_1_WGM15
    SolutionIndex: 349
    SolutionNameMin: Cijk_Ailk_Bjlk_SB_MT144x128x16_MI16x16x4x1_SE_1LDSB1_AF0EM1_AF1EM1_AMAS0_BL1_DTL0_DVO0_EPS0_FL0_GRVW1_GSU1_ISA908_IU1_KLA_LRVW1_MAC_MDA2_NLCA9_NLCB2_ONLL1_PGR2_PLR1_SIA3_SU32_SUS128_SRVW0_SVW4_SNLL0_TT9_32_TLDS0_USFGROn1_VSn1_VW1_WSGRA1_WSGRB1_WG16_16_1_WGM2
    SolutionIndex: 350
    SolutionNameMin: Cijk_Ailk_Bjlk_SB_MT128x96x16_MI32x32x2x1_SE_1LDSB0_AF0EM1_AF1EM1_AMAS0_BL1_DTL0_DVO0_EPS0_FL0_GRVW1_GSU1_ISA908_IU1_KLA_LRVW1_MAC_MDA2_NLCA2_NLCB3_ONLL1_PGR2_PLR1_SIA3_SU32_SUS256_SRVW2_SVW4_SNLL0_TT1_96_TLDS0_USFGROn1_VSn1_VW1_WSGRA1_WSGRB1_WG128_2_1_WGM15
    SolutionIndex: 351
    SolutionNameMin: Cijk_Ailk_Bjlk_SB_MT128x96x8_MI32x32x2x1_SE_1LDSB0_AF0EM1_AF1EM1_AMAS0_BL1_DTL0_DVO0_EPS0_FL0_GRVW1_GSU1_ISA908_IU1_KLA_LRVW1_MAC_MDA2_NLCA2_NLCB3_ONLL1_PGR2_PLR1_SIA3_SU0_SUS256_SRVW2_SVW4_SNLL0_TT1_96_TLDS0_USFGROn1_VSn1_VW1_WSGRA1_WSGRB1_WG128_2_1_WGM2
    SolutionIndex: 352
    SolutionNameMin: Cijk_Ailk_Bjlk_SB_MT128x96x8_MI32x32x2x1_SE_1LDSB0_AF0EM1_AF1EM1_AMAS0_BL1_DTL0_DVO0_EPS0_FL0_GRVW1_GSU1_ISA908_IU1_KLA_LRVW1_MAC_MDA2_NLCA2_NLCB3_ONLL1_PGR2_PLR1_SIA3_SU32_SUS128_SRVW2_SVW4_SNLL0_TT1_96_TLDS0_USFGROn1_VSn1_VW1_WSGRA1_WSGRB1_WG128_2_1_WGM1
    SolutionIndex: 353
    SolutionNameMin: Cijk_Ailk_Bjlk_SB_MT64x192x16_MI32x32x2x1_SE_1LDSB0_AF0EM1_AF1EM1_AMAS0_BL1_DTL0_DVO0_EPS0_FL0_GRVW4_GSU1_ISA908_IU1_KLA_LRVW1_MAC_MDA2_NLCA1_NLCB3_ONLL1_PGR2_PLR1_SIA3_SU32_SUS256_SRVW2_SVW4_SNLL0_TT1_96_TLDS0_USFGROn1_VSn1_VW1_WSGRA1_WSGRB1_WG64_4_1_WGM1
    SolutionIndex: 354
    SolutionNameMin: Cijk_Ailk_Bjlk_SB_MT288x128x8_MI32x32x2x1_SE_1LDSB0_AF0EM1_AF1EM1_AMAS0_BL1_DTL0_DVO0_EPS1_FL0_GRVW1_GSU1_ISA908_IU1_KLA_LRVW1_MAC_MDA2_NLCA9_NLCB2_ONLL1_PGR1_PLR1_SIA3_SU32_SUS256_SRVW0_SVW4_SNLL0_TT9_32_TLDS0_USFGROn1_VSn1_VW1_WSGRA1_WSGRB1_WG32_8_1_WGM1
    SolutionIndex: 355
    SolutionNameMin: Cijk_Ailk_Bjlk_SB_MT144x128x16_MI16x16x4x1_SE_1LDSB1_AF0EM1_AF1EM1_AMAS0_BL1_DTL0_DVO0_EPS0_FL0_GRVW1_GSU1_ISA908_IU1_KLA_LRVW1_MAC_MDA2_NLCA9_NLCB2_ONLL1_PGR2_PLR1_SIA3_SU0_SUS256_SRVW0_SVW4_SNLL0_TT9_32_TLDS0_USFGROn1_VSn1_VW1_WSGRA1_WSGRB1_WG16_16_1_WGM2
    SolutionIndex: 356
    SolutionNameMin: Cijk_Ailk_Bjlk_SB_MT64x32x8_SE_1LDSB0_AF0EM1_AF1EM1_AMAS0_BL1_DTL0_DVO0_EPS0_FL0_GRVW1_GSU1_ISA908_IU1_KLA_LRVW1_MAC_MDA2_NLCA1_NLCB1_ONLL1_PGR0_PLR1_SIA1_SU32_SUS256_SRVW0_SVW4_SNLL0_TT4_4_TLDS0_USFGRO1_VS1_VW1_WSGRA0_WSGRB0_WG16_8_1_WGM8
    SolutionIndex: 357
    SolutionNameMin: Cijk_Ailk_Bjlk_SB_MT128x96x16_MI32x32x2x1_SE_1LDSB0_AF0EM1_AF1EM1_AMAS0_BL1_DTL0_DVO0_EPS0_FL0_GRVW1_GSU1_ISA908_IU1_KLA_LRVW1_MAC_MDA2_NLCA2_NLCB3_ONLL1_PGR2_PLR1_SIA3_SU32_SUS128_SRVW2_SVW4_SNLL0_TT1_96_TLDS0_USFGROn1_VSn1_VW1_WSGRA1_WSGRB1_WG128_2_1_WGM2
    SolutionIndex: 358
    SolutionNameMin: Cijk_Ailk_Bjlk_SB_MT64x192x16_MI32x32x2x1_SE_1LDSB0_AF0EM1_AF1EM1_AMAS0_BL1_DTL0_DVO0_EPS0_FL0_GRVW2_GSU1_ISA908_IU1_KLA_LRVW1_MAC_MDA2_NLCA1_NLCB3_ONLL1_PGR2_PLR1_SIA3_SU32_SUS256_SRVW2_SVW4_SNLL0_TT1_96_TLDS0_USFGROn1_VSn1_VW1_WSGRA1_WSGRB1_WG64_4_1_WGM15
    SolutionIndex: 359
    SolutionNameMin: Cijk_Ailk_Bjlk_SB_MT128x96x16_MI32x32x2x1_SE_1LDSB0_AF0EM1_AF1EM1_AMAS0_BL1_DTL0_DVO0_EPS1_FL0_GRVW2_GSU1_ISA908_IU1_KLA_LRVW1_MAC_MDA2_NLCA1_NLCB3_ONLL1_PGR1_PLR1_SIA3_SU0_SUS256_SRVW2_SVW4_SNLL0_TT1_96_TLDS0_USFGROn1_VSn1_VW1_WSGRA1_WSGRB1_WG128_2_1_WGM15
    SolutionIndex: 360
    SolutionNameMin: Cijk_Ailk_Bjlk_SB_MT64x32x8_MI16x16x4x1_SE_1LDSB0_AF0EM1_AF1EM1_AMAS0_BL1_DTL0_DVO0_EPS1_FL0_GRVW1_GSU1_ISA908_IU1_KLA_LRVW1_MAC_MDA2_NLCA1_NLCB1_ONLL1_PGR1_PLR1_SIA3_SU0_SUS256_SRVW2_SVW4_SNLL0_TT2_16_TLDS0_USFGROn1_VSn1_VW1_WSGRA1_WSGRB1_WG32_8_1_WGM2
    SolutionIndex: 361
    SolutionNameMin: Cijk_Ailk_Bjlk_SB_MT64x16x8_SE_1LDSB0_AF0EM1_AF1EM1_AMAS3_BL1_DTL0_DVO0_EPS0_FL0_GRVW1_GSU1_ISA908_IU1_KLA_LRVW2_MAC_MDA2_NLCA1_NLCB1_ONLL1_PGR0_PLR1_SIA1_SU32_SUS256_SRVW0_SVW4_SNLL0_TT4_2_TLDS0_USFGRO1_VS1_VW2_WSGRA0_WSGRB0_WG16_8_1_WGM1
    SolutionIndex: 362
    SolutionNameMin: Cijk_Ailk_Bjlk_SB_MT64x192x16_MI32x32x2x1_SE_1LDSB0_AF0EM1_AF1EM1_AMAS0_BL1_DTL0_DVO0_EPS0_FL0_GRVW2_GSU1_ISA908_IU1_KLA_LRVW1_MAC_MDA2_NLCA1_NLCB3_ONLL1_PGR2_PLR1_SIA3_SU0_SUS256_SRVW2_SVW4_SNLL0_TT1_96_TLDS0_USFGROn1_VSn1_VW1_WSGRA1_WSGRB1_WG64_4_1_WGM1
    SolutionIndex: 363
    SolutionNameMin: Cijk_Ailk_Bjlk_SB_MT128x96x8_MI32x32x2x1_SE_1LDSB0_AF0EM1_AF1EM1_AMAS0_BL1_DTL0_DVO0_EPS0_FL0_GRVW1_GSU1_ISA908_IU1_KLA_LRVW1_MAC_MDA2_NLCA2_NLCB3_ONLL1_PGR2_PLR1_SIA3_SU32_SUS256_SRVW2_SVW4_SNLL0_TT1_96_TLDS0_USFGROn1_VSn1_VW1_WSGRA1_WSGRB1_WG128_2_1_WGM1
    SolutionIndex: 364
    SolutionNameMin: Cijk_Ailk_Bjlk_SB_MT64x32x8_SE_1LDSB0_AF0EM1_AF1EM1_AMAS0_BL1_DTL0_DVO0_EPS1_FL0_GRVW1_GSU1_ISA908_IU1_KLA_LRVW1_MAC_MDA2_NLCA1_NLCB1_ONLL1_PGR1_PLR1_SIA1_SU32_SUS256_SRVW0_SVW4_SNLL0_TT4_2_TLDS0_USFGRO1_VS1_VW1_WSGRA0_WSGRB0_WG16_16_1_WGM1
    SolutionIndex: 365
    SolutionNameMin: Cijk_Ailk_Bjlk_SB_MT64x16x8_SE_1LDSB0_AF0EM1_AF1EM1_AMAS0_BL1_DTL0_DVO0_EPS0_FL0_GRVW1_GSU1_ISA908_IU1_KLA_LRVW1_MAC_MDA2_NLCA1_NLCB1_ONLL1_PGR0_PLR1_SIA1_SU32_SUS256_SRVW0_SVW4_SNLL0_TT4_2_TLDS0_USFGRO1_VS1_VW1_WSGRA0_WSGRB0_WG16_8_1_WGM8
    SolutionIndex: 366
    SolutionNameMin: Cijk_Ailk_Bjlk_SB_MT64x64x8_MI32x32x2x1_SE_1LDSB0_AF0EM1_AF1EM1_AMAS0_BL1_DTL0_DVO0_EPS0_FL0_GRVW1_GSU1_ISA908_IU1_KLA_LRVW1_MAC_MDA2_NLCA1_NLCB1_ONLL1_PGR2_PLR1_SIA3_SU0_SUS256_SRVW2_SVW4_SNLL0_TT1_32_TLDS0_USFGROn1_VSn1_VW1_WSGRA1_WSGRB1_WG64_4_1_WGM15
    SolutionIndex: 367
    SolutionNameMin: Cijk_Ailk_Bjlk_SB_MT64x192x16_MI32x32x2x1_SE_1LDSB0_AF0EM1_AF1EM1_AMAS0_BL1_DTL0_DVO0_EPS1_FL0_GRVW4_GSU1_ISA908_IU1_KLA_LRVW1_MAC_MDA2_NLCA1_NLCB3_ONLL1_PGR1_PLR1_SIA3_SU0_SUS256_SRVW2_SVW4_SNLL0_TT1_96_TLDS0_USFGROn1_VSn1_VW1_WSGRA1_WSGRB1_WG64_4_1_WGM2
    SolutionIndex: 368
    SolutionNameMin: Cijk_Ailk_Bjlk_SB_MT128x96x32_MI32x32x2x1_SE_1LDSB0_AF0EM1_AF1EM1_AMAS0_BL1_DTL0_DVO0_EPS1_FL0_GRVW4_GSU1_ISA908_IU1_KLA_LRVW1_MAC_MDA2_NLCA1_NLCB3_ONLL1_PGR1_PLR1_SIA3_SU32_SUS128_SRVW2_SVW4_SNLL0_TT1_96_TLDS0_USFGROn1_VSn1_VW1_WSGRA1_WSGRB1_WG128_2_1_WGM2
    SolutionIndex: 369
    SolutionNameMin: Cijk_Ailk_Bjlk_SB_MT64x32x8_MI16x16x4x1_SE_1LDSB0_AF0EM1_AF1EM1_AMAS0_BL1_DTL0_DVO0_EPS1_FL0_GRVW1_GSU1_ISA908_IU1_KLA_LRVW1_MAC_MDA2_NLCA1_NLCB1_ONLL1_PGR1_PLR1_SIA3_SU32_SUS128_SRVW2_SVW4_SNLL0_TT2_16_TLDS0_USFGROn1_VSn1_VW1_WSGRA1_WSGRB1_WG32_8_1_WGM1
    SolutionIndex: 370
    SolutionNameMin: Cijk_Ailk_Bjlk_SB_MT64x192x16_MI32x32x2x1_SE_1LDSB0_AF0EM1_AF1EM1_AMAS0_BL1_DTL0_DVO0_EPS1_FL0_GRVW4_GSU1_ISA908_IU1_KLA_LRVW1_MAC_MDA2_NLCA1_NLCB3_ONLL1_PGR1_PLR1_SIA3_SU32_SUS256_SRVW2_SVW4_SNLL0_TT1_96_TLDS0_USFGROn1_VSn1_VW1_WSGRA1_WSGRB1_WG64_4_1_WGM1
    SolutionIndex: 371
    SolutionNameMin: Cijk_Ailk_Bjlk_SB_MT64x192x8_MI32x32x2x1_SE_1LDSB0_AF0EM1_AF1EM1_AMAS0_BL1_DTL0_DVO0_EPS0_FL0_GRVW2_GSU1_ISA908_IU1_KLA_LRVW1_MAC_MDA2_NLCA1_NLCB3_ONLL1_PGR2_PLR1_SIA3_SU0_SUS256_SRVW2_SVW4_SNLL0_TT1_96_TLDS0_USFGROn1_VSn1_VW1_WSGRA1_WSGRB1_WG64_4_1_WGM15
    SolutionIndex: 372
    SolutionNameMin: Cijk_Ailk_Bjlk_SB_MT128x96x32_MI32x32x2x1_SE_1LDSB0_AF0EM1_AF1EM1_AMAS0_BL1_DTL0_DVO0_EPS1_FL0_GRVW4_GSU1_ISA908_IU1_KLA_LRVW1_MAC_MDA2_NLCA1_NLCB3_ONLL1_PGR1_PLR1_SIA3_SU32_SUS256_SRVW2_SVW4_SNLL0_TT1_96_TLDS0_USFGROn1_VSn1_VW1_WSGRA1_WSGRB1_WG128_2_1_WGM1
    SolutionIndex: 373
    SolutionNameMin: Cijk_Ailk_Bjlk_SB_MT128x288x8_MI32x32x2x1_SE_1LDSB0_AF0EM1_AF1EM1_AMAS0_BL1_DTL0_DVO0_EPS1_FL0_GRVW1_GSU1_ISA908_IU1_KLA_LRVW1_MAC_MDA2_NLCA2_NLCB9_ONLL1_PGR1_PLR1_SIA3_SU32_SUS256_SRVW2_SVW4_SNLL0_TT1_288_TLDS0_USFGROn1_VSn1_VW1_WSGRA1_WSGRB1_WG128_2_1_WGM15
    SolutionIndex: 374
    SolutionNameMin: Cijk_Ailk_Bjlk_SB_MT128x288x8_MI32x32x2x1_SN_1LDSB0_AF0EM1_AF1EM1_AMAS0_BL1_DTL0_DVO0_EPS1_FL0_GRVW1_GSU1_ISA908_IU1_KLA_LRVW1_MAC_MDA2_NLCA2_NLCB9_ONLL1_PGR1_PLR1_SIA3_SU32_SUS256_SRVW2_SVW4_SNLL0_TT1_288_TLDS0_USFGROn1_VSn1_VW1_WSGRA1_WSGRB1_WG128_2_1_WGM1
    SolutionIndex: 375
    SolutionNameMin: Cijk_Ailk_Bjlk_SB_MT128x96x32_MI32x32x2x1_SE_1LDSB0_AF0EM1_AF1EM1_AMAS0_BL1_DTL0_DVO0_EPS0_FL0_GRVW1_GSU1_ISA908_IU1_KLA_LRVW1_MAC_MDA2_NLCA2_NLCB3_ONLL1_PGR2_PLR1_SIA3_SU0_SUS256_SRVW2_SVW4_SNLL0_TT1_96_TLDS0_USFGROn1_VSn1_VW1_WSGRA1_WSGRB1_WG128_2_1_WGM2
    SolutionIndex: 376
    SolutionNameMin: Cijk_Ailk_Bjlk_SB_MT128x96x32_MI32x32x2x1_SE_1LDSB0_AF0EM1_AF1EM1_AMAS0_BL1_DTL0_DVO0_EPS1_FL0_GRVW4_GSU1_ISA908_IU1_KLA_LRVW1_MAC_MDA2_NLCA1_NLCB3_ONLL1_PGR1_PLR1_SIA3_SU32_SUS256_SRVW2_SVW4_SNLL0_TT1_96_TLDS0_USFGROn1_VSn1_VW1_WSGRA1_WSGRB1_WG128_2_1_WGM15
    SolutionIndex: 377
    SolutionNameMin: Cijk_Ailk_Bjlk_SB_MT64x192x16_MI32x32x2x1_SE_1LDSB0_AF0EM1_AF1EM1_AMAS0_BL1_DTL0_DVO0_EPS1_FL0_GRVW2_GSU1_ISA908_IU1_KLA_LRVW1_MAC_MDA2_NLCA1_NLCB3_ONLL1_PGR1_PLR1_SIA3_SU32_SUS128_SRVW2_SVW4_SNLL0_TT1_96_TLDS0_USFGROn1_VSn1_VW1_WSGRA1_WSGRB1_WG64_4_1_WGM15
    SolutionIndex: 378
    SolutionNameMin: Cijk_Ailk_Bjlk_SB_MT64x32x16_SE_1LDSB0_AF0EM1_AF1EM1_AMAS0_BL1_DTL0_DVO0_EPS1_FL0_GRVW1_GSU1_ISA908_IU1_KLA_LRVW1_MAC_MDA2_NLCA1_NLCB1_ONLL1_PGR1_PLR1_SIA1_SU32_SUS256_SRVW0_SVW4_SNLL0_TT4_4_TLDS0_USFGRO1_VS1_VW1_WSGRA0_WSGRB0_WG16_8_2_WGM8
    SolutionIndex: 379
    SolutionNameMin: Cijk_Ailk_Bjlk_SB_MT32x16x8_SN_1LDSB0_AF0EM1_AF1EM1_AMAS2_BL0_DTL0_DVO0_EPS0_FL0_GRVW2_GSU1_ISA000_IU1_KLS_LRVW2_FMA_MDA2_NLCA1_NLCB1_ONLL1_PGR1_PLR1_SIA1_SU32_SUS256_SRVW0_SVW4_SNLL0_TT2_2_TLDS0_USFGRO0_VS1_VW2_WSGRA0_WSGRB0_WG16_8_1_WGM1
    SolutionIndex: 380
    SolutionNameMin: Cijk_Ailk_Bjlk_SB_MT64x32x8_SE_1LDSB0_AF0EM1_AF1EM1_AMAS3_BL1_DTL0_DVO0_EPS1_FL0_GRVW2_GSU1_ISA908_IU1_KLA_LRVW2_MAC_MDA2_NLCA1_NLCB1_ONLL1_PGR1_PLR1_SIA1_SU32_SUS256_SRVW0_SVW4_SNLL0_TT4_4_TLDS0_USFGRO0_VS1_VW2_WSGRA0_WSGRB0_WG16_8_1_WGM8
    SolutionIndex: 381
    SolutionNameMin: Cijk_Ailk_Bjlk_SB_MT64x16x16_SE_1LDSB0_AF0EM1_AF1EM1_AMAS0_BL1_DTL0_DVO0_EPS0_FL0_GRVW1_GSU1_ISA908_IU1_KLA_LRVW1_MAC_MDA2_NLCA1_NLCB1_ONLL1_PGR0_PLR1_SIA1_SU32_SUS256_SRVW0_SVW4_SNLL0_TT4_2_TLDS0_USFGRO1_VS1_VW1_WSGRA0_WSGRB0_WG16_8_1_WGM1
    SolutionIndex: 382
    SolutionNameMin: Cijk_Ailk_Bjlk_SB_MT64x64x16_SE_1LDSB0_AF0EM1_AF1EM1_AMAS3_BL1_DTL0_DVO0_EPS1_FL0_GRVW1_GSU1_ISA908_IU1_KLA_LRVW2_MAC_MDA2_NLCA1_NLCB1_ONLL1_PGR1_PLR1_SIA1_SU32_SUS256_SRVW0_SVW4_SNLL0_TT4_4_TLDS0_USFGRO1_VS1_VW2_WSGRA0_WSGRB0_WG16_16_1_WGM1
    SolutionIndex: 383
    SolutionNameMin: Cijk_Ailk_Bjlk_SB_MT64x32x8_SE_1LDSB0_AF0EM1_AF1EM1_AMAS0_BL1_DTL0_DVO0_EPS1_FL0_GRVW1_GSU1_ISA908_IU1_KLA_LRVW1_MAC_MDA2_NLCA1_NLCB1_ONLL1_PGR1_PLR1_SIA1_SU32_SUS256_SRVW0_SVW4_SNLL0_TT4_2_TLDS0_USFGRO1_VS1_VW1_WSGRA0_WSGRB0_WG16_16_1_WGM8
    SolutionIndex: 384
    SolutionNameMin: Cijk_Ailk_Bjlk_SB_MT64x32x32_SE_1LDSB0_AF0EM1_AF1EM1_AMAS0_BL1_DTL0_DVO0_EPS0_FL0_GRVW1_GSU1_ISA908_IU1_KLA_LRVW1_MAC_MDA2_NLCA1_NLCB1_ONLL1_PGR0_PLR1_SIA1_SU32_SUS256_SRVW0_SVW4_SNLL0_TT4_2_TLDS0_USFGRO1_VS1_VW1_WSGRA0_WSGRB0_WG16_16_1_WGM8
    SolutionIndex: 385
    SolutionNameMin: Cijk_Ailk_Bjlk_SB_MT64x32x8_SE_1LDSB0_AF0EM1_AF1EM1_AMAS0_BL1_DTL0_DVO0_EPS0_FL0_GRVW1_GSU1_ISA908_IU1_KLA_LRVW1_MAC_MDA2_NLCA1_NLCB1_ONLL1_PGR0_PLR1_SIA1_SU32_SUS256_SRVW0_SVW4_SNLL0_TT4_4_TLDS0_USFGRO1_VS1_VW1_WSGRA0_WSGRB0_WG16_8_1_WGM1
    SolutionIndex: 386
    SolutionNameMin: Cijk_Ailk_Bjlk_SB_MT64x64x16_SE_1LDSB0_AF0EM1_AF1EM1_AMAS3_BL1_DTL0_DVO0_EPS1_FL0_GRVW2_GSU1_ISA908_IU1_KLA_LRVW2_MAC_MDA2_NLCA1_NLCB1_ONLL1_PGR1_PLR1_SIA1_SU32_SUS256_SRVW0_SVW4_SNLL0_TT4_4_TLDS0_USFGRO0_VS1_VW2_WSGRA0_WSGRB0_WG16_16_1_WGM1
    SolutionIndex: 387
    SolutionNameMin: Cijk_Ailk_Bjlk_SB_MT64x32x8_MI16x16x4x1_SE_1LDSB0_AF0EM1_AF1EM1_AMAS0_BL1_DTL0_DVO0_EPS0_FL0_GRVW1_GSU1_ISA908_IU1_KLA_LRVW1_MAC_MDA2_NLCA1_NLCB1_ONLL1_PGR2_PLR1_SIA3_SU32_SUS128_SRVW2_SVW4_SNLL0_TT2_16_TLDS0_USFGROn1_VSn1_VW1_WSGRA1_WSGRB1_WG32_8_1_WGM2
    SolutionIndex: 388
    SolutionNameMin: Cijk_Ailk_Bjlk_SB_MT64x192x16_MI32x32x2x1_SE_1LDSB0_AF0EM1_AF1EM1_AMAS0_BL1_DTL0_DVO0_EPS0_FL0_GRVW2_GSU1_ISA908_IU1_KLA_LRVW1_MAC_MDA2_NLCA1_NLCB3_ONLL1_PGR2_PLR1_SIA3_SU32_SUS256_SRVW2_SVW4_SNLL0_TT1_96_TLDS0_USFGROn1_VSn1_VW1_WSGRA1_WSGRB1_WG64_4_1_WGM1
    SolutionIndex: 389
    SolutionNameMin: Cijk_Ailk_Bjlk_SB_MT128x96x32_MI32x32x2x1_SE_1LDSB0_AF0EM1_AF1EM1_AMAS0_BL1_DTL0_DVO0_EPS1_FL0_GRVW4_GSU1_ISA908_IU1_KLA_LRVW1_MAC_MDA2_NLCA1_NLCB3_ONLL1_PGR1_PLR1_SIA3_SU0_SUS256_SRVW2_SVW4_SNLL0_TT1_96_TLDS0_USFGROn1_VSn1_VW1_WSGRA1_WSGRB1_WG128_2_1_WGM2
    SolutionIndex: 390
    SolutionNameMin: Cijk_Ailk_Bjlk_SB_MT64x16x8_SE_1LDSB0_AF0EM1_AF1EM1_AMAS0_BL1_DTL0_DVO0_EPS0_FL0_GRVW1_GSU1_ISA908_IU1_KLA_LRVW1_MAC_MDA2_NLCA1_NLCB1_ONLL1_PGR0_PLR1_SIA1_SU32_SUS256_SRVW0_SVW4_SNLL0_TT4_2_TLDS0_USFGRO1_VS1_VW1_WSGRA0_WSGRB0_WG16_8_1_WGM1
    SolutionIndex: 391
    SolutionNameMin: Cijk_Ailk_Bjlk_SB_MT144x128x16_MI16x16x4x1_SE_1LDSB0_AF0EM1_AF1EM1_AMAS0_BL1_DTL0_DVO0_EPS1_FL0_GRVW1_GSU1_ISA908_IU1_KLA_LRVW1_MAC_MDA2_NLCA9_NLCB2_ONLL1_PGR1_PLR1_SIA3_SU0_SUS256_SRVW0_SVW4_SNLL0_TT9_32_TLDS0_USFGROn1_VSn1_VW1_WSGRA1_WSGRB1_WG16_16_1_WGM1
    SolutionIndex: 392
    SolutionNameMin: Cijk_Ailk_Bjlk_SB_MT64x32x8_MI16x16x4x1_SE_1LDSB0_AF0EM1_AF1EM1_AMAS0_BL1_DTL0_DVO0_EPS0_FL0_GRVW4_GSU1_ISA908_IU1_KLA_LRVW1_MAC_MDA2_NLCA1_NLCB1_ONLL1_PGR2_PLR1_SIA3_SU32_SUS128_SRVW2_SVW4_SNLL0_TT2_16_TLDS0_USFGROn1_VSn1_VW1_WSGRA1_WSGRB1_WG32_8_1_WGM1
    SolutionIndex: 393
    SolutionNameMin: Cijk_Ailk_Bjlk_SB_MT128x96x16_MI32x32x2x1_SE_1LDSB0_AF0EM1_AF1EM1_AMAS0_BL1_DTL0_DVO0_EPS1_FL0_GRVW1_GSU1_ISA908_IU1_KLA_LRVW1_MAC_MDA2_NLCA2_NLCB3_ONLL1_PGR1_PLR1_SIA3_SU0_SUS256_SRVW2_SVW4_SNLL0_TT1_96_TLDS0_USFGROn1_VSn1_VW1_WSGRA1_WSGRB1_WG128_2_1_WGM2
    SolutionIndex: 394
    SolutionNameMin: Cijk_Ailk_Bjlk_SB_MT64x16x8_SE_1LDSB0_AF0EM1_AF1EM1_AMAS3_BL1_DTL0_DVO0_EPS0_FL0_GRVW2_GSU1_ISA908_IU1_KLA_LRVW2_MAC_MDA2_NLCA1_NLCB1_ONLL1_PGR0_PLR1_SIA1_SU32_SUS256_SRVW0_SVW4_SNLL0_TT4_2_TLDS0_USFGRO0_VS1_VW2_WSGRA0_WSGRB0_WG16_8_1_WGM1
    SolutionIndex: 395
    SolutionNameMin: Cijk_Ailk_Bjlk_SB_MT64x192x8_MI32x32x2x1_SE_1LDSB0_AF0EM1_AF1EM1_AMAS0_BL1_DTL0_DVO0_EPS0_FL0_GRVW2_GSU1_ISA908_IU1_KLA_LRVW1_MAC_MDA2_NLCA1_NLCB3_ONLL1_PGR2_PLR1_SIA3_SU0_SUS256_SRVW2_SVW4_SNLL0_TT1_96_TLDS0_USFGROn1_VSn1_VW1_WSGRA1_WSGRB1_WG64_4_1_WGM1
    SolutionIndex: 396
    SolutionNameMin: Cijk_Ailk_Bjlk_SB_MT96x128x16_MI32x32x2x1_SE_1LDSB0_AF0EM1_AF1EM1_AMAS0_BL1_DTL0_DVO0_EPS0_FL0_GRVW2_GSU1_ISA908_IU1_KLA_LRVW1_MAC_MDA2_NLCA3_NLCB1_ONLL1_PGR2_PLR1_SIA3_SU32_SUS256_SRVW0_SVW4_SNLL0_TT3_32_TLDS0_USFGROn1_VSn1_VW1_WSGRA1_WSGRB1_WG32_8_1_WGM2
    SolutionIndex: 397
    SolutionNameMin: Cijk_Ailk_Bjlk_SB_MT64x32x8_SE_1LDSB0_AF0EM1_AF1EM1_AMAS0_BL1_DTL0_DVO0_EPS0_FL0_GRVW1_GSU1_ISA908_IU1_KLA_LRVW1_MAC_MDA2_NLCA1_NLCB1_ONLL1_PGR0_PLR0_SIA1_SU32_SUS256_SRVW0_SVW4_SNLL0_TT4_4_TLDS0_USFGRO1_VS1_VW1_WSGRA0_WSGRB0_WG16_8_1_WGM1
    SolutionIndex: 398
    SolutionNameMin: Cijk_Ailk_Bjlk_SB_MT64x64x8_SE_1LDSB0_AF0EM1_AF1EM1_AMAS0_BL1_DTL0_DVO0_EPS1_FL0_GRVW1_GSU1_ISA908_IU1_KLA_LRVW1_MAC_MDA2_NLCA1_NLCB1_ONLL1_PGR1_PLR0_SIA1_SU32_SUS256_SRVW0_SVW4_SNLL1_TT4_4_TLDS0_USFGRO1_VS1_VW1_WSGRA0_WSGRB0_WG16_16_1_WGM1
    SolutionIndex: 399
    SolutionNameMin: Cijk_Ailk_Bjlk_SB_MT64x64x8_SE_1LDSB0_AF0EM1_AF1EM1_AMAS0_BL1_DTL0_DVO0_EPS1_FL0_GRVW1_GSU1_ISA908_IU1_KLA_LRVW1_MAC_MDA2_NLCA1_NLCB1_ONLL1_PGR1_PLR1_SIA1_SU32_SUS256_SRVW0_SVW4_SNLL0_TT4_4_TLDS0_USFGRO1_VS1_VW1_WSGRA0_WSGRB0_WG16_16_1_WGM1
    SolutionIndex: 400
    SolutionNameMin: Cijk_Ailk_Bjlk_SB_MT64x16x8_SE_1LDSB0_AF0EM1_AF1EM1_AMAS3_BL1_DTL0_DVO0_EPS0_FL0_GRVW1_GSU1_ISA908_IU1_KLA_LRVW2_MAC_MDA2_NLCA1_NLCB1_ONLL1_PGR0_PLR1_SIA1_SU32_SUS256_SRVW0_SVW4_SNLL0_TT4_2_TLDS0_USFGRO1_VS1_VW2_WSGRA0_WSGRB0_WG16_8_1_WGM8
    SolutionIndex: 401
    SolutionNameMin: Cijk_Ailk_Bjlk_SB_MT96x96x32_MI16x16x4x1_SE_1LDSB1_AF0EM1_AF1EM1_AMAS0_BL1_DTL0_DVO0_EPS1_FL0_GRVW4_GSU1_ISA908_IU1_KLA_LRVW1_MAC_MDA2_NLCA3_NLCB3_ONLL1_PGR1_PLR1_SIA3_SU32_SUS128_SRVW0_SVW4_SNLL0_TT3_48_TLDS0_USFGROn1_VSn1_VW1_WSGRA1_WSGRB1_WG32_8_1_WGM2
    SolutionIndex: 402
    SolutionNameMin: Cijk_Ailk_Bjlk_SB_MT64x32x8_MI16x16x4x1_SE_1LDSB0_AF0EM1_AF1EM1_AMAS0_BL1_DTL0_DVO0_EPS1_FL0_GRVW2_GSU1_ISA908_IU1_KLA_LRVW1_MAC_MDA2_NLCA1_NLCB1_ONLL1_PGR1_PLR1_SIA3_SU32_SUS256_SRVW2_SVW4_SNLL0_TT2_16_TLDS0_USFGROn1_VSn1_VW1_WSGRA1_WSGRB1_WG32_8_1_WGM15
    SolutionIndex: 403
    SolutionNameMin: Cijk_Ailk_Bjlk_SB_MT128x160x16_MI32x32x2x1_SE_1LDSB0_AF0EM1_AF1EM1_AMAS0_BL1_DTL0_DVO0_EPS1_FL0_GRVW1_GSU1_ISA908_IU1_KLA_LRVW1_MAC_MDA2_NLCA2_NLCB5_ONLL1_PGR1_PLR1_SIA3_SU0_SUS256_SRVW2_SVW4_SNLL0_TT1_160_TLDS0_USFGROn1_VSn1_VW1_WSGRA1_WSGRB1_WG128_2_1_WGM2
    SolutionIndex: 404
    SolutionNameMin: Cijk_Ailk_Bjlk_SB_MT4x64x16_MI4x4x1x16_SE_1LDSB0_AF0EM1_AF1EM1_AMAS0_BL1_DTL0_DVO0_EPS0_FL0_GRVW1_GSU1_ISA908_IU1_KLA_LRVW1_MAC_MDA2_NLCA1_NLCB1_ONLL1_PGR2_PLR1_SIA3_SU0_SUS256_SRVW0_SVW4_SNLL0_TT1_4_TLDS0_USFGROn1_VSn1_VW1_WSGRA1_WSGRB1_WG4_16_1_WGM1
    SolutionIndex: 405
    SolutionNameMin: Cijk_Ailk_Bjlk_SB_MT128x128x16_MI32x32x2x1_SE_1LDSB1_AF0EM1_AF1EM1_AMAS0_BL1_DTL0_DVO0_EPS1_FL0_GRVW4_GSU1_ISA908_IU1_KLA_LRVW1_MAC_MDA2_NLCA1_NLCB1_ONLL1_PGR1_PLR1_SIA3_SU32_SUS128_SRVW2_SVW4_SNLL0_TT2_64_TLDS0_USFGROn1_VSn1_VW1_WSGRA1_WSGRB1_WG64_4_1_WGM15
    SolutionIndex: 406
    SolutionNameMin: Cijk_Ailk_Bjlk_SB_MT64x128x32_MI32x32x2x1_SE_1LDSB0_AF0EM1_AF1EM1_AMAS0_BL1_DTL0_DVO0_EPS0_FL0_GRVW4_GSU3_ISA908_IU1_KLA_LRVW1_MAC_MDA2_NLCA1_NLCB1_ONLL1_PGR2_PLR1_SIA3_SU0_SUS256_SRVW0_SVW4_SNLL0_TT1_64_TLDS0_USFGROn1_VSn1_VW1_WSGRA1_WSGRB1_WG64_4_1_WGM15
    SolutionIndex: 407
    SolutionNameMin: Cijk_Ailk_Bjlk_SB_MT32x64x16_MI16x16x4x1_SE_1LDSB0_AF0EM1_AF1EM1_AMAS0_BL1_DTL0_DVO0_EPS0_FL0_GRVW4_GSU3_ISA908_IU1_KLA_LRVW1_MAC_MDA2_NLCA1_NLCB1_ONLL1_PGR2_PLR1_SIA3_SU32_SUS128_SRVW0_SVW4_SNLL0_TT1_32_TLDS0_USFGROn1_VSn1_VW1_WSGRA1_WSGRB1_WG32_8_1_WGM1
    SolutionIndex: 408
    SolutionNameMin: Cijk_Ailk_Bjlk_SB_MT64x64x32_MI32x32x2x1_SE_1LDSB0_AF0EM1_AF1EM1_AMAS0_BL1_DTL0_DVO0_EPS1_FL0_GRVW4_GSU1_ISA908_IU1_KLA_LRVW1_MAC_MDA2_NLCA1_NLCB1_ONLL1_PGR1_PLR1_SIA3_SU0_SUS256_SRVW2_SVW4_SNLL0_TT1_32_TLDS0_USFGROn1_VSn1_VW1_WSGRA1_WSGRB1_WG64_4_1_WGM2
    SolutionIndex: 409
    SolutionNameMin: Cijk_Ailk_Bjlk_SB_MT16x16x8_SN_1LDSB0_AF0EM1_AF1EM1_AMAS3_BL1_DTL0_DVO0_EPS1_FL0_GRVW2_GSU8_ISA908_IU1_KLA_LRVW2_MAC_MDA2_NLCA1_NLCB1_ONLL1_PGR1_PLR1_SIA1_SU32_SUS256_SRVW0_SVW4_SNLL0_TT2_2_TLDS0_USFGRO1_VS1_VW2_WSGRA0_WSGRB0_WG8_8_2_WGM1
    SolutionIndex: 410
    SolutionNameMin: Cijk_Ailk_Bjlk_SB_MT64x32x16_MI16x16x4x1_SE_1LDSB0_AF0EM1_AF1EM1_AMAS0_BL1_DTL0_DVO0_EPS0_FL0_GRVW4_GSU1_ISA908_IU1_KLA_LRVW1_MAC_MDA2_NLCA1_NLCB1_ONLL1_PGR2_PLR1_SIA3_SU0_SUS256_SRVW2_SVW4_SNLL0_TT2_16_TLDS0_USFGROn1_VSn1_VW1_WSGRA1_WSGRB1_WG32_8_1_WGM1
    SolutionIndex: 411
    SolutionNameMin: Cijk_Ailk_Bjlk_SB_MT64x128x32_MI32x32x2x1_SE_1LDSB0_AF0EM1_AF1EM1_AMAS0_BL1_DTL0_DVO0_EPS1_FL0_GRVW4_GSU3_ISA908_IU1_KLA_LRVW1_MAC_MDA2_NLCA1_NLCB1_ONLL1_PGR1_PLR1_SIA3_SU0_SUS256_SRVW0_SVW4_SNLL0_TT1_64_TLDS0_USFGROn1_VSn1_VW1_WSGRA1_WSGRB1_WG64_4_1_WGM15
    SolutionIndex: 412
    SolutionNameMin: Cijk_Ailk_Bjlk_SB_MT64x64x8_SE_1LDSB0_AF0EM1_AF1EM1_AMAS3_BL1_DTL0_DVO0_EPS1_FL1_GRVW4_GSU1_ISA908_IU1_KLA_LRVW2_MAC_MDA2_NLCA1_NLCB1_ONLL1_PGR1_PLR1_SIA1_SU32_SUS256_SRVW0_SVW4_SNLL0_TT4_4_TLDS0_USFGRO0_VS1_VW2_WSGRA0_WSGRB0_WG16_16_1_WGM1
    SolutionIndex: 413
    SolutionNameMin: Cijk_Ailk_Bjlk_SB_MT32x64x32_MI16x16x4x1_SE_1LDSB0_AF0EM1_AF1EM1_AMAS0_BL1_DTL0_DVO0_EPS1_FL0_GRVW4_GSU1_ISA908_IU1_KLA_LRVW1_MAC_MDA2_NLCA1_NLCB1_ONLL1_PGR1_PLR1_SIA3_SU0_SUS256_SRVW2_SVW4_SNLL0_TT1_32_TLDS0_USFGROn1_VSn1_VW1_WSGRA1_WSGRB1_WG32_8_1_WGM15
    SolutionIndex: 414
    SolutionNameMin: Cijk_Ailk_Bjlk_SB_MT32x64x8_MI16x16x4x1_SE_1LDSB0_AF0EM1_AF1EM1_AMAS0_BL1_DTL0_DVO0_EPS0_FL0_GRVW2_GSU1_ISA908_IU1_KLA_LRVW1_MAC_MDA2_NLCA1_NLCB1_ONLL1_PGR2_PLR1_SIA3_SU0_SUS256_SRVW2_SVW4_SNLL0_TT1_32_TLDS0_USFGROn1_VSn1_VW1_WSGRA1_WSGRB1_WG32_8_1_WGM15
    SolutionIndex: 415
    SolutionNameMin: Cijk_Ailk_Bjlk_SB_MT64x32x8_MI16x16x4x1_SE_1LDSB0_AF0EM1_AF1EM1_AMAS0_BL1_DTL0_DVO0_EPS0_FL0_GRVW1_GSU1_ISA908_IU1_KLA_LRVW1_MAC_MDA2_NLCA1_NLCB1_ONLL1_PGR2_PLR1_SIA3_SU0_SUS256_SRVW2_SVW4_SNLL0_TT2_16_TLDS0_USFGROn1_VSn1_VW1_WSGRA1_WSGRB1_WG32_8_1_WGM2
    SolutionIndex: 416
    SolutionNameMin: Cijk_Ailk_Bjlk_SB_MT32x32x32_SE_1LDSB0_AF0EM1_AF1EM1_AMAS3_BL1_DTL0_DVO0_EPS1_FL1_GRVW4_GSU1_ISA908_IU1_KLA_LRVW4_MAC_MDA2_NLCA1_NLCB1_ONLL1_PGR1_PLR1_SIA1_SU32_SUS256_SRVW0_SVW4_SNLL0_TT4_4_TLDS0_USFGRO0_VS1_VW4_WSGRA0_WSGRB0_WG8_8_4_WGM8
    SolutionIndex: 417
    SolutionNameMin: Cijk_Ailk_Bjlk_SB_MT32x64x8_MI16x16x4x1_SE_1LDSB0_AF0EM1_AF1EM1_AMAS0_BL1_DTL0_DVO0_EPS0_FL0_GRVW2_GSU1_ISA908_IU1_KLA_LRVW1_MAC_MDA2_NLCA1_NLCB1_ONLL1_PGR2_PLR1_SIA3_SU0_SUS256_SRVW2_SVW4_SNLL0_TT1_32_TLDS0_USFGROn1_VSn1_VW1_WSGRA1_WSGRB1_WG32_8_1_WGM1
    SolutionIndex: 418
    SolutionNameMin: Cijk_Ailk_Bjlk_SB_MT128x64x16_MI32x32x2x1_SE_1LDSB0_AF0EM1_AF1EM1_AMAS0_BL1_DTL0_DVO0_EPS0_FL0_GRVW4_GSU1_ISA908_IU1_KLA_LRVW1_MAC_MDA2_NLCA1_NLCB1_ONLL1_PGR2_PLR1_SIA3_SU32_SUS256_SRVW2_SVW4_SNLL0_TT2_32_TLDS0_USFGROn1_VSn1_VW1_WSGRA1_WSGRB1_WG64_4_1_WGM1
    SolutionIndex: 419
    SolutionNameMin: Cijk_Ailk_Bjlk_SB_MT128x128x16_MI32x32x2x1_SE_1LDSB1_AF0EM1_AF1EM1_AMAS0_BL1_DTL0_DVO0_EPS1_FL0_GRVW4_GSU3_ISA908_IU1_KLA_LRVW1_MAC_MDA2_NLCA1_NLCB1_ONLL1_PGR1_PLR1_SIA3_SU0_SUS256_SRVW0_SVW4_SNLL0_TT2_64_TLDS0_USFGROn1_VSn1_VW1_WSGRA1_WSGRB1_WG64_4_1_WGM1
    SolutionIndex: 420
    SolutionNameMin: Cijk_Ailk_Bjlk_SB_MT64x64x8_MI32x32x2x1_SE_1LDSB0_AF0EM1_AF1EM1_AMAS0_BL1_DTL0_DVO0_EPS0_FL0_GRVW1_GSU1_ISA908_IU1_KLA_LRVW1_MAC_MDA2_NLCA1_NLCB1_ONLL1_PGR2_PLR1_SIA3_SU0_SUS256_SRVW2_SVW4_SNLL0_TT1_32_TLDS0_USFGROn1_VSn1_VW1_WSGRA1_WSGRB1_WG64_4_1_WGM2
    SolutionIndex: 421
    SolutionNameMin: Cijk_Ailk_Bjlk_SB_MT64x64x8_MI32x32x2x1_SE_1LDSB0_AF0EM1_AF1EM1_AMAS0_BL1_DTL0_DVO0_EPS0_FL0_GRVW1_GSU1_ISA908_IU1_KLA_LRVW1_MAC_MDA2_NLCA1_NLCB1_ONLL1_PGR2_PLR1_SIA3_SU0_SUS256_SRVW2_SVW4_SNLL0_TT1_32_TLDS0_USFGROn1_VSn1_VW1_WSGRA1_WSGRB1_WG64_4_1_WGM1
    SolutionIndex: 422
    SolutionNameMin: Cijk_Ailk_Bjlk_SB_MT64x64x16_SE_1LDSB0_AF0EM1_AF1EM1_AMAS3_BL1_DTL0_DVO0_EPS1_FL1_GRVW4_GSU1_ISA908_IU1_KLA_LRVW4_MAC_MDA2_NLCA1_NLCB1_ONLL1_PGR1_PLR1_SIA1_SU32_SUS256_SRVW0_SVW4_SNLL1_TT4_4_TLDS0_USFGRO0_VS1_VW4_WSGRA0_WSGRB0_WG16_16_1_WGM1
    SolutionIndex: 423
    SolutionNameMin: Cijk_Ailk_Bjlk_SB_MT128x64x16_MI32x32x2x1_SE_1LDSB0_AF0EM1_AF1EM1_AMAS0_BL1_DTL0_DVO0_EPS0_FL0_GRVW2_GSU3_ISA908_IU1_KLA_LRVW1_MAC_MDA2_NLCA1_NLCB1_ONLL1_PGR2_PLR1_SIA3_SU0_SUS256_SRVW0_SVW4_SNLL0_TT2_32_TLDS0_USFGROn1_VSn1_VW1_WSGRA1_WSGRB1_WG64_4_1_WGM15
    SolutionIndex: 424
    SolutionNameMin: Cijk_Ailk_Bjlk_SB_MT64x128x8_SE_1LDSB0_AF0EM1_AF1EM1_AMAS3_BL1_DTL0_DVO0_EPS1_FL0_GRVW1_GSU1_ISA908_IU1_KLA_LRVW2_MAC_MDA2_NLCA1_NLCB1_ONLL1_PGR1_PLR1_SIA1_SU32_SUS256_SRVW0_SVW4_SNLL0_TT4_8_TLDS0_USFGRO1_VS1_VW2_WSGRA0_WSGRB0_WG16_16_1_WGM8
    SolutionIndex: 425
    SolutionNameMin: Cijk_Ailk_Bjlk_SB_MT64x128x8_MI32x32x2x1_SE_1LDSB0_AF0EM1_AF1EM1_AMAS0_BL1_DTL0_DVO0_EPS0_FL0_GRVW1_GSU1_ISA908_IU1_KLA_LRVW1_MAC_MDA2_NLCA1_NLCB2_ONLL1_PGR2_PLR1_SIA3_SU32_SUS128_SRVW2_SVW4_SNLL0_TT1_64_TLDS0_USFGROn1_VSn1_VW1_WSGRA1_WSGRB1_WG64_4_1_WGM1
    SolutionIndex: 426
    SolutionNameMin: Cijk_Ailk_Bjlk_SB_MT64x16x16_SE_1LDSB0_AF0EM1_AF1EM1_AMAS3_BL1_DTL0_DVO0_EPS0_FL0_GRVW2_GSU1_ISA908_IU1_KLA_LRVW2_MAC_MDA2_NLCA1_NLCB1_ONLL1_PGR0_PLR1_SIA1_SU32_SUS256_SRVW0_SVW4_SNLL0_TT4_2_TLDS0_USFGRO0_VS1_VW2_WSGRA0_WSGRB0_WG16_8_1_WGM1
    SolutionIndex: 427
    SolutionNameMin: Cijk_Ailk_Bjlk_SB_MT64x32x16_SE_1LDSB0_AF0EM1_AF1EM1_AMAS3_BL1_DTL0_DVO0_EPS1_FL1_GRVW2_GSU1_ISA908_IU1_KLA_LRVW2_MAC_MDA2_NLCA1_NLCB1_ONLL1_PGR1_PLR1_SIA1_SU32_SUS256_SRVW0_SVW4_SNLL0_TT4_4_TLDS0_USFGRO0_VS1_VW2_WSGRA0_WSGRB0_WG16_8_2_WGM8
    SolutionIndex: 428
    SolutionNameMin: Cijk_Ailk_Bjlk_SB_MT32x32x8_MI16x16x4x1_SE_1LDSB0_AF0EM1_AF1EM1_AMAS0_BL1_DTL0_DVO0_EPS0_FL0_GRVW1_GSU1_ISA908_IU1_KLA_LRVW1_MAC_MDA2_NLCA1_NLCB1_ONLL1_PGR2_PLR1_SIA3_SU32_SUS256_SRVW2_SVW4_SNLL0_TT1_16_TLDS0_USFGROn1_VSn1_VW1_WSGRA1_WSGRB1_WG32_8_1_WGM1
    SolutionIndex: 429
    SolutionNameMin: Cijk_Ailk_Bjlk_SB_MT64x128x8_MI32x32x2x1_SE_1LDSB0_AF0EM1_AF1EM1_AMAS0_BL1_DTL0_DVO0_EPS0_FL0_GRVW1_GSU1_ISA908_IU1_KLA_LRVW1_MAC_MDA2_NLCA1_NLCB2_ONLL1_PGR2_PLR1_SIA3_SU0_SUS256_SRVW2_SVW4_SNLL0_TT1_64_TLDS0_USFGROn1_VSn1_VW1_WSGRA1_WSGRB1_WG64_4_1_WGM15
    SolutionIndex: 430
    SolutionNameMin: Cijk_Ailk_Bjlk_SB_MT128x64x16_MI32x32x2x1_SE_1LDSB0_AF0EM1_AF1EM1_AMAS0_BL1_DTL0_DVO0_EPS0_FL0_GRVW4_GSU1_ISA908_IU1_KLA_LRVW1_MAC_MDA2_NLCA1_NLCB1_ONLL1_PGR2_PLR1_SIA3_SU0_SUS256_SRVW2_SVW4_SNLL0_TT2_32_TLDS0_USFGROn1_VSn1_VW1_WSGRA1_WSGRB1_WG64_4_1_WGM1
    SolutionIndex: 431
    SolutionNameMin: Cijk_Ailk_Bjlk_SB_MT64x32x16_MI16x16x4x1_SE_1LDSB0_AF0EM1_AF1EM1_AMAS0_BL1_DTL0_DVO0_EPS1_FL0_GRVW1_GSU1_ISA908_IU1_KLA_LRVW1_MAC_MDA2_NLCA1_NLCB1_ONLL1_PGR1_PLR1_SIA3_SU32_SUS128_SRVW2_SVW4_SNLL0_TT2_16_TLDS0_USFGROn1_VSn1_VW1_WSGRA1_WSGRB1_WG32_8_1_WGM1
    SolutionIndex: 432
    SolutionNameMin: Cijk_Ailk_Bjlk_SB_MT64x64x8_SE_1LDSB0_AF0EM1_AF1EM1_AMAS3_BL1_DTL0_DVO0_EPS0_FL0_GRVW1_GSU1_ISA908_IU1_KLA_LRVW2_MAC_MDA2_NLCA1_NLCB1_ONLL1_PGR0_PLR1_SIA1_SU32_SUS256_SRVW0_SVW4_SNLL0_TT4_4_TLDS0_USFGRO1_VS1_VW2_WSGRA0_WSGRB0_WG16_16_1_WGM1
    SolutionIndex: 433
    SolutionNameMin: Cijk_Ailk_Bjlk_SB_MT32x32x8_MI16x16x4x1_SE_1LDSB0_AF0EM1_AF1EM1_AMAS0_BL1_DTL0_DVO0_EPS0_FL0_GRVW1_GSU1_ISA908_IU1_KLA_LRVW1_MAC_MDA2_NLCA1_NLCB1_ONLL1_PGR2_PLR1_SIA3_SU0_SUS256_SRVW2_SVW4_SNLL0_TT1_16_TLDS0_USFGROn1_VSn1_VW1_WSGRA1_WSGRB1_WG32_8_1_WGM2
    SolutionIndex: 434
    SolutionNameMin: Cijk_Ailk_Bjlk_SB_MT96x128x8_MI32x32x2x1_SE_1LDSB0_AF0EM1_AF1EM1_AMAS0_BL1_DTL0_DVO0_EPS0_FL0_GRVW1_GSU1_ISA908_IU1_KLA_LRVW1_MAC_MDA2_NLCA3_NLCB2_ONLL1_PGR2_PLR1_SIA3_SU0_SUS256_SRVW0_SVW4_SNLL0_TT3_32_TLDS0_USFGROn1_VSn1_VW1_WSGRA1_WSGRB1_WG32_8_1_WGM1
    SolutionIndex: 435
    SolutionNameMin: Cijk_Ailk_Bjlk_SB_MT64x64x8_SE_1LDSB0_AF0EM1_AF1EM1_AMAS3_BL1_DTL0_DVO0_EPS1_FL0_GRVW1_GSU1_ISA908_IU1_KLA_LRVW2_MAC_MDA2_NLCA1_NLCB1_ONLL1_PGR1_PLR0_SIA1_SU32_SUS256_SRVW0_SVW4_SNLL0_TT4_4_TLDS0_USFGRO1_VS1_VW2_WSGRA0_WSGRB0_WG16_16_1_WGM8
    SolutionIndex: 436
    SolutionNameMin: Cijk_Ailk_Bjlk_SB_MT128x64x16_MI32x32x2x1_SE_1LDSB0_AF0EM1_AF1EM1_AMAS0_BL1_DTL0_DVO0_EPS0_FL0_GRVW4_GSU1_ISA908_IU1_KLA_LRVW1_MAC_MDA2_NLCA1_NLCB1_ONLL1_PGR2_PLR1_SIA3_SU32_SUS128_SRVW2_SVW4_SNLL0_TT2_32_TLDS0_USFGROn1_VSn1_VW1_WSGRA1_WSGRB1_WG64_4_1_WGM1
    SolutionIndex: 437
    SolutionNameMin: Cijk_Ailk_Bjlk_SB_MT32x64x8_MI16x16x4x1_SE_1LDSB0_AF0EM1_AF1EM1_AMAS0_BL1_DTL0_DVO0_EPS0_FL0_GRVW4_GSU1_ISA908_IU1_KLA_LRVW1_MAC_MDA2_NLCA1_NLCB1_ONLL1_PGR2_PLR1_SIA3_SU32_SUS128_SRVW2_SVW4_SNLL0_TT1_32_TLDS0_USFGROn1_VSn1_VW1_WSGRA1_WSGRB1_WG32_8_1_WGM15
    SolutionIndex: 438
    SolutionNameMin: Cijk_Ailk_Bjlk_SB_MT32x32x32_SE_1LDSB0_AF0EM1_AF1EM1_AMAS3_BL1_DTL0_DVO0_EPS1_FL0_GRVW1_GSU1_ISA908_IU1_KLA_LRVW2_MAC_MDA2_NLCA1_NLCB1_ONLL1_PGR1_PLR1_SIA1_SU32_SUS256_SRVW0_SVW4_SNLL0_TT4_4_TLDS0_USFGRO1_VS1_VW2_WSGRA0_WSGRB0_WG8_8_4_WGM8
    SolutionIndex: 439
    SolutionNameMin: Cijk_Ailk_Bjlk_SB_MT64x64x32_MI16x16x4x1_SE_1LDSB0_AF0EM4_AF1EM1_AMAS3_BL1_DTL0_DVO1_EPS1_FL1_GRVW4_GSU1_ISA908_IU1_KLA_LRVW1_MAC_MDA2_NLCA1_NLCB1_ONLL2_PGR1_PLR1_SIA3_SU32_SUS256_SRVW4_SVW4_SNLL0_TT4_16_TLDS1_USFGROn1_VSn1_VW4_WSGRA0_WSGRB0_WG16_16_1_WGM1
    SolutionIndex: 440
    SolutionNameMin: Cijk_Ailk_Bjlk_SB_MT64x256x8_MI32x32x2x1_SE_1LDSB1_AF0EM1_AF1EM1_AMAS0_BL1_DTL0_DVO0_EPS0_FL0_GRVW4_GSU1_ISA908_IU1_KLA_LRVW1_MAC_MDA2_NLCA1_NLCB1_ONLL1_PGR2_PLR1_SIA3_SU32_SUS256_SRVW2_SVW4_SNLL0_TT1_128_TLDS0_USFGROn1_VSn1_VW1_WSGRA1_WSGRB1_WG64_4_1_WGM1
    SolutionIndex: 441
    SolutionNameMin: Cijk_Ailk_Bjlk_SB_MT128x64x16_MI32x32x2x1_SE_1LDSB0_AF0EM1_AF1EM1_AMAS0_BL1_DTL0_DVO0_EPS0_FL0_GRVW4_GSU1_ISA908_IU1_KLA_LRVW1_MAC_MDA2_NLCA1_NLCB1_ONLL1_PGR2_PLR1_SIA3_SU0_SUS256_SRVW2_SVW4_SNLL0_TT2_32_TLDS0_USFGROn1_VSn1_VW1_WSGRA1_WSGRB1_WG64_4_1_WGM2
    SolutionIndex: 442
    SolutionNameMin: Cijk_Ailk_Bjlk_SB_MT64x32x8_MI16x16x4x1_SE_1LDSB0_AF0EM1_AF1EM1_AMAS0_BL1_DTL0_DVO0_EPS0_FL0_GRVW1_GSU1_ISA908_IU1_KLA_LRVW1_MAC_MDA2_NLCA1_NLCB1_ONLL1_PGR2_PLR1_SIA3_SU32_SUS256_SRVW2_SVW4_SNLL0_TT2_16_TLDS0_USFGROn1_VSn1_VW1_WSGRA1_WSGRB1_WG32_8_1_WGM15
    SolutionIndex: 443
    SolutionNameMin: Cijk_Ailk_Bjlk_SB_MT64x64x8_SE_1LDSB0_AF0EM1_AF1EM1_AMAS3_BL1_DTL0_DVO0_EPS1_FL0_GRVW2_GSU1_ISA908_IU1_KLA_LRVW2_MAC_MDA2_NLCA1_NLCB1_ONLL1_PGR1_PLR1_SIA1_SU32_SUS256_SRVW0_SVW4_SNLL0_TT4_4_TLDS0_USFGRO0_VS1_VW2_WSGRA0_WSGRB0_WG16_16_1_WGM8
    SolutionIndex: 444
    SolutionNameMin: Cijk_Ailk_Bjlk_SB_MT64x64x16_SE_1LDSB0_AF0EM1_AF1EM1_AMAS3_BL1_DTL0_DVO0_EPS1_FL0_GRVW4_GSU1_ISA908_IU1_KLA_LRVW4_MAC_MDA2_NLCA1_NLCB1_ONLL1_PGR1_PLR1_SIA1_SU32_SUS256_SRVW0_SVW4_SNLL0_TT4_4_TLDS0_USFGRO0_VS1_VW4_WSGRA0_WSGRB0_WG16_16_1_WGM1
    SolutionIndex: 445
    SolutionNameMin: Cijk_Ailk_Bjlk_SB_MT64x32x8_SE_1LDSB0_AF0EM1_AF1EM1_AMAS3_BL1_DTL0_DVO0_EPS1_FL0_GRVW4_GSU1_ISA908_IU1_KLA_LRVW2_MAC_MDA2_NLCA1_NLCB1_ONLL1_PGR1_PLR1_SIA1_SU32_SUS256_SRVW0_SVW4_SNLL0_TT4_2_TLDS0_USFGRO0_VS1_VW2_WSGRA0_WSGRB0_WG16_16_1_WGM1
    SolutionIndex: 446
    SolutionNameMin: Cijk_Ailk_Bjlk_SB_MT64x64x32_MI16x16x4x1_SE_1LDSB0_AF0EM4_AF1EM1_AMAS3_BL1_DTL0_DVO0_EPS1_FL1_GRVW4_GSU1_ISA908_IU2_KLA_LRVW1_MAC_MDA2_NLCA1_NLCB1_ONLL1_PGR1_PLR1_SIA3_SU32_SUS256_SRVW4_SVW4_SNLL0_TT4_16_TLDS1_USFGROn1_VSn1_VW4_WSGRA0_WSGRB0_WG16_16_1_WGM1
    SolutionIndex: 447
    SolutionNameMin: Cijk_Ailk_Bjlk_SB_MT64x128x32_MI32x32x2x1_SE_1LDSB0_AF0EM1_AF1EM1_AMAS3_BL1_DTL0_DVO0_EPS1_FL1_GRVW4_GSU1_ISA908_IU1_KLA_LRVW1_MAC_MDA2_NLCA1_NLCB1_ONLL1_PGR1_PLR1_SIA3_SU32_SUS256_SRVW4_SVW4_SNLL0_TT2_32_TLDS1_USFGROn1_VSn1_VW4_WSGRA0_WSGRB0_WG16_16_1_WGM1
    SolutionIndex: 448
    SolutionNameMin: Cijk_Ailk_Bjlk_SB_MT96x96x32_MI16x16x4x1_SE_1LDSB1_AF0EM1_AF1EM1_AMAS0_BL1_DTL0_DVO0_EPS1_FL0_GRVW4_GSU1_ISA908_IU1_KLA_LRVW1_MAC_MDA2_NLCA3_NLCB3_ONLL1_PGR1_PLR1_SIA3_SU32_SUS256_SRVW0_SVW4_SNLL0_TT3_48_TLDS0_USFGROn1_VSn1_VW1_WSGRA1_WSGRB1_WG32_8_1_WGM2
    SolutionIndex: 449
    SolutionNameMin: Cijk_Ailk_Bjlk_SB_MT128x160x8_MI32x32x2x1_SE_1LDSB0_AF0EM1_AF1EM1_AMAS0_BL1_DTL0_DVO0_EPS0_FL0_GRVW1_GSU1_ISA908_IU1_KLA_LRVW1_MAC_MDA2_NLCA2_NLCB5_ONLL1_PGR2_PLR1_SIA3_SU32_SUS256_SRVW2_SVW4_SNLL0_TT1_160_TLDS0_USFGROn1_VSn1_VW1_WSGRA1_WSGRB1_WG128_2_1_WGM15
    SolutionIndex: 450
    SolutionNameMin: Cijk_Ailk_Bjlk_SB_MT64x192x16_MI32x32x2x1_SE_1LDSB0_AF0EM1_AF1EM1_AMAS0_BL1_DTL0_DVO0_EPS1_FL0_GRVW4_GSU1_ISA908_IU1_KLA_LRVW1_MAC_MDA2_NLCA1_NLCB3_ONLL1_PGR1_PLR1_SIA3_SU32_SUS256_SRVW2_SVW4_SNLL0_TT1_96_TLDS0_USFGROn1_VSn1_VW1_WSGRA1_WSGRB1_WG64_4_1_WGM2
    SolutionIndex: 451
    SolutionNameMin: Cijk_Ailk_Bjlk_SB_MT64x128x16_MI32x32x2x1_SE_1LDSB0_AF0EM1_AF1EM1_AMAS0_BL1_DTL0_DVO0_EPS0_FL0_GRVW2_GSU1_ISA908_IU1_KLA_LRVW1_MAC_MDA2_NLCA1_NLCB1_ONLL1_PGR2_PLR1_SIA3_SU32_SUS256_SRVW2_SVW4_SNLL0_TT1_64_TLDS0_USFGROn1_VSn1_VW1_WSGRA1_WSGRB1_WG64_4_1_WGM1
    SolutionIndex: 452
    SolutionNameMin: Cijk_Ailk_Bjlk_SB_MT64x64x8_MI32x32x2x1_SE_1LDSB0_AF0EM1_AF1EM1_AMAS0_BL1_DTL0_DVO0_EPS0_FL0_GRVW1_GSU1_ISA908_IU1_KLA_LRVW1_MAC_MDA2_NLCA1_NLCB1_ONLL1_PGR2_PLR1_SIA3_SU32_SUS256_SRVW2_SVW4_SNLL0_TT1_32_TLDS0_USFGROn1_VSn1_VW1_WSGRA1_WSGRB1_WG64_4_1_WGM1
    SolutionIndex: 453
    SolutionNameMin: Cijk_Ailk_Bjlk_SB_MT32x32x8_MI16x16x4x1_SE_1LDSB0_AF0EM1_AF1EM1_AMAS0_BL1_DTL0_DVO0_EPS0_FL0_GRVW4_GSU1_ISA908_IU1_KLA_LRVW1_MAC_MDA2_NLCA1_NLCB1_ONLL1_PGR2_PLR1_SIA3_SU0_SUS256_SRVW2_SVW4_SNLL0_TT1_16_TLDS0_USFGROn1_VSn1_VW1_WSGRA1_WSGRB1_WG32_8_1_WGM1
    SolutionIndex: 454
    SolutionNameMin: Cijk_Ailk_Bjlk_SB_MT128x64x16_SE_1LDSB0_AF0EM1_AF1EM1_AMAS3_BL1_DTL0_DVO0_EPS1_FL0_GRVW4_GSU1_ISA908_IU1_KLA_LRVW4_MAC_MDA2_NLCA1_NLCB1_ONLL1_PGR1_PLR1_SIA1_SU32_SUS256_SRVW0_SVW4_SNLL1_TT8_4_TLDS0_USFGRO0_VS1_VW4_WSGRA0_WSGRB0_WG16_16_1_WGM8
    SolutionIndex: 455
    SolutionNameMin: Cijk_Ailk_Bjlk_SB_MT32x64x32_MI16x16x4x1_SE_1LDSB0_AF0EM1_AF1EM1_AMAS0_BL1_DTL0_DVO0_EPS0_FL0_GRVW4_GSU5_ISA908_IU1_KLA_LRVW1_MAC_MDA2_NLCA1_NLCB1_ONLL1_PGR2_PLR1_SIA3_SU0_SUS256_SRVW0_SVW4_SNLL0_TT1_32_TLDS0_USFGROn1_VSn1_VW1_WSGRA1_WSGRB1_WG32_8_1_WGM1
    SolutionIndex: 456
    SolutionNameMin: Cijk_Ailk_Bjlk_SB_MT64x64x8_SE_1LDSB0_AF0EM1_AF1EM1_AMAS3_BL1_DTL0_DVO0_EPS1_FL0_GRVW4_GSU1_ISA908_IU1_KLA_LRVW2_MAC_MDA2_NLCA1_NLCB1_ONLL1_PGR1_PLR1_SIA1_SU32_SUS256_SRVW0_SVW4_SNLL0_TT4_4_TLDS0_USFGRO0_VS1_VW2_WSGRA0_WSGRB0_WG16_16_1_WGM8
    SolutionIndex: 457
    SolutionNameMin: Cijk_Ailk_Bjlk_SB_MT64x16x16_SE_1LDSB0_AF0EM1_AF1EM1_AMAS0_BL1_DTL0_DVO0_EPS0_FL0_GRVW1_GSU1_ISA908_IU1_KLA_LRVW1_MAC_MDA2_NLCA1_NLCB1_ONLL1_PGR0_PLR0_SIA1_SU32_SUS256_SRVW0_SVW4_SNLL0_TT4_2_TLDS0_USFGRO1_VS1_VW1_WSGRA0_WSGRB0_WG16_8_1_WGM1
    SolutionIndex: 458
    SolutionNameMin: Cijk_Ailk_Bjlk_SB_MT64x32x16_MI16x16x4x1_SE_1LDSB0_AF0EM1_AF1EM1_AMAS0_BL1_DTL0_DVO0_EPS1_FL0_GRVW1_GSU1_ISA908_IU1_KLA_LRVW1_MAC_MDA2_NLCA1_NLCB1_ONLL1_PGR1_PLR1_SIA3_SU0_SUS256_SRVW2_SVW4_SNLL0_TT2_16_TLDS0_USFGROn1_VSn1_VW1_WSGRA1_WSGRB1_WG32_8_1_WGM1
    SolutionIndex: 459
    SolutionNameMin: Cijk_Ailk_Bjlk_SB_MT64x32x8_MI16x16x4x1_SE_1LDSB0_AF0EM1_AF1EM1_AMAS0_BL1_DTL0_DVO0_EPS1_FL0_GRVW1_GSU1_ISA908_IU1_KLA_LRVW1_MAC_MDA2_NLCA1_NLCB1_ONLL1_PGR1_PLR1_SIA3_SU0_SUS256_SRVW2_SVW4_SNLL0_TT2_16_TLDS0_USFGROn1_VSn1_VW1_WSGRA1_WSGRB1_WG32_8_1_WGM1
    SolutionIndex: 460
    SolutionNameMin: Cijk_Ailk_Bjlk_SB_MT32x32x16_MI16x16x4x1_SE_1LDSB0_AF0EM1_AF1EM1_AMAS0_BL1_DTL0_DVO0_EPS1_FL0_GRVW1_GSU1_ISA908_IU1_KLA_LRVW1_MAC_MDA2_NLCA1_NLCB1_ONLL1_PGR1_PLR1_SIA3_SU0_SUS256_SRVW2_SVW4_SNLL0_TT1_16_TLDS0_USFGROn1_VSn1_VW1_WSGRA1_WSGRB1_WG32_8_1_WGM2
    SolutionIndex: 461
    SolutionNameMin: Cijk_Ailk_Bjlk_SB_MT64x64x8_SE_1LDSB0_AF0EM1_AF1EM1_AMAS3_BL1_DTL0_DVO0_EPS1_FL0_GRVW1_GSU1_ISA908_IU1_KLA_LRVW2_MAC_MDA2_NLCA1_NLCB1_ONLL1_PGR1_PLR1_SIA1_SU32_SUS256_SRVW0_SVW4_SNLL0_TT4_4_TLDS0_USFGRO1_VS1_VW2_WSGRA0_WSGRB0_WG16_16_1_WGM8
    SolutionIndex: 462
    SolutionNameMin: Cijk_Ailk_Bjlk_SB_MT64x32x8_MI16x16x4x1_SE_1LDSB0_AF0EM1_AF1EM1_AMAS0_BL1_DTL0_DVO0_EPS1_FL0_GRVW1_GSU1_ISA908_IU1_KLA_LRVW1_MAC_MDA2_NLCA1_NLCB1_ONLL1_PGR1_PLR1_SIA3_SU32_SUS128_SRVW2_SVW4_SNLL0_TT2_16_TLDS0_USFGROn1_VSn1_VW1_WSGRA1_WSGRB1_WG32_8_1_WGM2
    SolutionIndex: 463
    SolutionNameMin: Cijk_Ailk_Bjlk_SB_MT64x32x8_MI16x16x4x1_SE_1LDSB0_AF0EM1_AF1EM1_AMAS0_BL1_DTL0_DVO0_EPS0_FL0_GRVW2_GSU1_ISA908_IU1_KLA_LRVW1_MAC_MDA2_NLCA1_NLCB1_ONLL1_PGR2_PLR1_SIA3_SU32_SUS256_SRVW2_SVW4_SNLL0_TT2_16_TLDS0_USFGROn1_VSn1_VW1_WSGRA1_WSGRB1_WG32_8_1_WGM15
    SolutionIndex: 464
    SolutionNameMin: Cijk_Ailk_Bjlk_SB_MT64x64x8_SE_1LDSB0_AF0EM1_AF1EM1_AMAS3_BL1_DTL0_DVO0_EPS1_FL1_GRVW4_GSU1_ISA908_IU1_KLA_LRVW2_MAC_MDA2_NLCA1_NLCB1_ONLL1_PGR1_PLR1_SIA1_SU32_SUS256_SRVW0_SVW4_SNLL0_TT4_4_TLDS0_USFGRO0_VS1_VW2_WSGRA0_WSGRB0_WG16_16_1_WGM8
- - - [1024, 64, 1, 512]
    - [0, 3.322]
  - - [512, 512, 1, 200]
    - [1, 5.013]
  - - [512, 32, 1, 200]
    - [2, 0.394]
  - - [2048, 2048, 1, 512]
    - [3, 58.796]
  - - [1600, 1024, 1, 512]
    - [4, 39.916]
  - - [1024, 1024, 1, 512]
    - [5, 31.261]
  - - [1024, 1024, 1, 200]
    - [6, 15.467]
  - - [1024, 1024, 1, 4096]
    - [7, 55.496]
  - - [4096, 1024, 1, 4096]
    - [8, 84.929]
  - - [1024, 1024, 1, 2048]
    - [5, 40.15]
  - - [4096, 1024, 1, 2048]
    - [9, 77.658]
  - - [768, 768, 1, 16]
    - [10, 1.276]
  - - [768, 768, 1, 320]
    - [5, 17.352]
  - - [3072, 768, 1, 4096]
    - [11, 82.661]
  - - [768, 768, 1, 4096]
    - [12, 44.773]
  - - [768, 768, 1, 32]
    - [13, 2.539]
  - - [768, 768, 1, 640]
    - [14, 27.022]
  - - [768, 768, 1, 64]
    - [15, 4.934]
  - - [768, 768, 1, 1280]
    - [16, 36.838]
  - - [1024, 1024, 1, 3072]
    - [17, 49.028]
  - - [3072, 1024, 1, 2048]
    - [18, 66.255]
  - - [3072, 1024, 1, 3072]
    - [19, 78.772]
  - - [3072, 1024, 1, 512]
    - [20, 50.588]
  - - [1024, 1024, 1, 120]
    - [21, 10.395]
  - - [1024, 1024, 1, 1]
    - [22, 0.137]
  - - [1024, 1024, 1, 20]
    - [23, 2.626]
  - - [1024, 1024, 1, 4]
    - [24, 0.552]
  - - [1024, 1024, 1, 6]
    - [10, 0.677]
  - - [1024, 1024, 1, 80]
    - [25, 8.811]
  - - [128, 64, 512, 128]
    - [26, 23.826]
  - - [512, 64, 64, 512]
    - [27, 41.106]
  - - [64, 64, 768, 64]
    - [28, 13.263]
  - - [1024, 128, 1, 128]
    - [29, 2.23]
  - - [4, 704, 1, 1280]
    - [30, 0.406]
  - - [4, 1856, 1, 3328]
    - [31, 1.972]
  - - [1856, 448, 1, 3328]
    - [32, 51.595]
  - - [2944, 4288, 1, 1280]
    - [33, 82.539]
  - - [2368, 64, 1, 3328]
    - [34, 23.704]
  - - [2368, 5888, 1, 256]
    - [35, 54.335]
  - - [128, 64, 1, 256]
    - [36, 0.263]
  - - [5888, 1024, 1, 1280]
    - [21, 74.775]
  - - [128, 6784, 1, 3328]
    - [37, 53.356]
  - - [64, 4, 1, 256]
    - [38, 0.008]
  - - [5888, 1856, 1, 3328]
    - [39, 90.547]
  - - [5056, 704, 1, 256]
    - [40, 40.744]
  - - [5888, 2944, 1, 3328]
    - [41, 91.814]
  - - [1856, 4288, 1, 256]
    - [42, 46.588]
  - - [1024, 5056, 1, 128]
    - [43, 30.577]
  - - [5056, 5056, 1, 3328]
    - [44, 91.817]
  - - [1408, 5888, 1, 1280]
    - [44, 77.398]
  - - [2368, 448, 1, 128]
    - [45, 12.967]
  - - [1024, 3584, 1, 3328]
    - [46, 80.959]
  - - [4, 2944, 1, 1280]
    - [29, 1.216]
  - - [1408, 64, 1, 128]
    - [36, 1.362]
  - - [256, 4288, 1, 3328]
    - [47, 59.924]
  - - [5888, 1408, 1, 1280]
    - [41, 76.69]
  - - [704, 1856, 1, 3328]
    - [48, 67.014]
  - - [4, 1408, 1, 128]
    - [49, 0.099]
  - - [1024, 2368, 1, 256]
    - [50, 33.175]
  - - [1408, 1856, 1, 1280]
    - [51, 58.971]
  - - [1408, 64, 1, 1280]
    - [52, 10.346]
  - - [448, 1024, 1, 1280]
    - [53, 36.827]
  - - [256, 1408, 1, 3328]
    - [54, 47.805]
  - - [5056, 5056, 1, 1280]
    - [3, 88.211]
  - - [448, 5056, 1, 256]
    - [5, 35.45]
  - - [704, 1856, 1, 1280]
    - [55, 51.465]
  - - [128, 5056, 1, 128]
    - [56, 8.951]
  - - [2368, 128, 1, 256]
    - [57, 8.804]
  - - [1856, 1408, 1, 128]
    - [5, 23.936]
  - - [64, 5056, 1, 256]
    - [13, 8.064]
  - - [6784, 256, 1, 3328]
    - [58, 75.075]
  - - [6784, 4288, 1, 3328]
    - [59, 93.196]
  - - [4288, 448, 1, 256]
    - [60, 32.019]
  - - [64, 704, 1, 128]
    - [61, 0.751]
  - - [1856, 2368, 1, 3328]
    - [62, 82.509]
  - - [4288, 2944, 1, 1280]
    - [63, 84.531]
  - - [704, 5056, 1, 1280]
    - [64, 69.125]
  - - [2368, 704, 1, 3328]
    - [65, 69.19]
  - - [256, 5888, 1, 256]
    - [66, 27.41]
  - - [1856, 4288, 1, 3328]
    - [67, 82.362]
  - - [256, 2944, 1, 256]
    - [68, 15.897]
  - - [5888, 1024, 1, 256]
    - [69, 48.308]
  - - [448, 64, 1, 1280]
    - [29, 2.988]
  - - [448, 5056, 1, 3328]
    - [70, 73.497]
  - - [3584, 4, 1, 1280]
    - [71, 1.602]
  - - [2944, 64, 1, 256]
    - [72, 5.288]
  - - [128, 4, 1, 1280]
    - [73, 0.065]
  - - [1408, 2944, 1, 256]
    - [5, 43.92]
  - - [256, 1856, 1, 1280]
    - [5, 35.701]
  - - [6784, 5056, 1, 3328]
    - [74, 93.62]
  - - [5056, 5056, 1, 256]
    - [64, 64.535]
  - - [1408, 6784, 1, 128]
    - [41, 36.356]
  - - [64, 1024, 1, 1280]
    - [75, 7.787]
  - - [2944, 4, 1, 256]
    - [76, 0.378]
  - - [704, 5056, 1, 128]
    - [55, 27.193]
  - - [4, 2368, 1, 1280]
    - [38, 1.097]
  - - [2368, 2944, 1, 1280]
    - [77, 76.448]
  - - [128, 3584, 1, 1280]
    - [68, 40.084]
  - - [6784, 6784, 1, 1280]
    - [78, 90.663]
  - - [1408, 4288, 1, 1280]
    - [79, 73.372]
  - - [3584, 4288, 1, 1280]
    - [80, 86.182]
  - - [2368, 704, 1, 1280]
    - [81, 57.528]
  - - [5056, 4288, 1, 3328]
    - [39, 93.296]
  - - [3584, 2368, 1, 3328]
    - [82, 87.821]
  - - [64, 704, 1, 1280]
    - [83, 5.322]
  - - [4288, 256, 1, 256]
    - [5, 22.409]
  - - [2944, 128, 1, 128]
    - [84, 5.489]
  - - [6784, 448, 1, 1280]
    - [85, 63.169]
  - - [1408, 2944, 1, 128]
    - [55, 26.908]
  - - [4288, 2944, 1, 256]
    - [86, 57.588]
  - - [5888, 704, 1, 1280]
    - [69, 68.006]
  - - [1856, 64, 1, 1280]
    - [71, 14.341]
  - - [448, 5888, 1, 128]
    - [5, 23.468]
  - - [5888, 64, 1, 3328]
    - [87, 40.329]
  - - [2944, 256, 1, 3328]
    - [5, 47.287]
  - - [1024, 64, 1, 128]
    - [76, 1.041]
  - - [5056, 2368, 1, 1280]
    - [88, 80.161]
  - - [448, 3584, 1, 1280]
    - [89, 55.795]
  - - [6784, 5888, 1, 256]
    - [74, 72.231]
  - - [704, 1024, 1, 128]
    - [90, 10.328]
  - - [704, 128, 1, 1280]
    - [34, 11.132]
  - - [5888, 2944, 1, 128]
    - [91, 41.928]
  - - [4, 3584, 1, 128]
    - [36, 0.274]
  - - [1408, 448, 1, 1280]
    - [92, 39.86]
  - - [1024, 1408, 1, 256]
    - [70, 26.286]
  - - [2368, 2368, 1, 3328]
    - [93, 86.38]
  - - [1856, 6784, 1, 128]
    - [63, 40.623]
  - - [5056, 704, 1, 3328]
    - [65, 78.501]
  - - [1408, 1856, 1, 256]
    - [94, 34.851]
  - - [1408, 704, 1, 3328]
    - [95, 62.947]
  - - [2368, 5056, 1, 256]
    - [96, 50.532]
  - - [5888, 1856, 1, 256]
    - [97, 51.506]
  - - [4288, 64, 1, 3328]
    - [40, 33.863]
  - - [2368, 4, 1, 1280]
    - [98, 1.188]
  - - [704, 5888, 1, 256]
    - [99, 45.188]
  - - [4288, 64, 1, 256]
    - [100, 7.81]
  - - [6784, 64, 1, 256]
    - [50, 11.866]
  - - [2944, 256, 1, 256]
    - [101, 18.483]
  - - [2944, 6784, 1, 3328]
    - [102, 91.205]
  - - [704, 1408, 1, 3328]
    - [103, 57.142]
  - - [3584, 704, 1, 3328]
    - [104, 72.544]
  - - [2944, 256, 1, 128]
    - [105, 10.212]
  - - [6784, 4, 1, 1280]
    - [49, 2.644]
  - - [1024, 64, 1, 1280]
    - [49, 7.279]
  - - [448, 4288, 1, 256]
    - [70, 30.653]
  - - [64, 3584, 1, 3328]
    - [106, 38.485]
  - - [704, 2368, 1, 1280]
    - [27, 58.618]
  - - [448, 2944, 1, 128]
    - [12, 14.87]
  - - [1856, 2368, 1, 1280]
    - [107, 71.755]
  - - [2368, 128, 1, 3328]
    - [68, 40.922]
  - - [2944, 128, 1, 256]
    - [51, 9.627]
  - - [448, 1408, 1, 256]
    - [108, 15.801]
  - - [1856, 4288, 1, 1280]
    - [92, 75.051]
  - - [64, 5056, 1, 3328]
    - [109, 42.894]
  - - [4, 704, 1, 256]
    - [110, 0.095]
  - - [1024, 448, 1, 128]
    - [43, 7.614]
  - - [704, 4, 1, 1280]
    - [38, 0.378]
  - - [704, 256, 1, 128]
    - [22, 2.381]
  - - [704, 2944, 1, 128]
    - [50, 20.984]
  - - [1408, 1024, 1, 1280]
    - [5, 53.79]
  - - [704, 6784, 1, 256]
    - [63, 48.573]
  - - [6784, 704, 1, 256]
    - [70, 44.635]
  - - [5056, 1408, 1, 128]
    - [111, 36.138]
  - - [256, 3584, 1, 3328]
    - [21, 55.399]
  - - [4, 5888, 1, 3328]
    - [112, 3.63]
  - - [128, 1408, 1, 128]
    - [113, 3.046]
  - - [3584, 4288, 1, 3328]
    - [74, 93.206]
  - - [5888, 1856, 1, 1280]
    - [3, 84.515]
  - - [5056, 1024, 1, 3328]
    - [103, 80.324]
  - - [5056, 64, 1, 1280]
    - [114, 23.617]
  - - [1024, 704, 1, 256]
    - [101, 16.008]
  - - [1024, 4288, 1, 128]
    - [115, 29.218]
  - - [4288, 64, 1, 1280]
    - [92, 24.323]
  - - [2368, 3584, 1, 1280]
    - [96, 79.558]
  - - [2368, 6784, 1, 1280]
    - [93, 85.363]
  - - [1024, 256, 1, 256]
    - [23, 7.275]
  - - [1856, 4, 1, 1280]
    - [38, 0.814]
  - - [448, 448, 1, 256]
    - [72, 5.061]
  - - [2944, 3584, 1, 3328]
    - [116, 90.114]
  - - [128, 4288, 1, 128]
    - [51, 6.662]
  - - [64, 448, 1, 256]
    - [117, 0.765]
  - - [128, 1024, 1, 3328]
    - [106, 20.743]
  - - [4, 1408, 1, 3328]
    - [73, 1.4]
  - - [6784, 2944, 1, 256]
    - [118, 59.223]
  - - [64, 1856, 1, 1280]
    - [119, 11.857]
  - - [64, 1024, 1, 128]
    - [120, 0.94]
  - - [4288, 2368, 1, 3328]
    - [116, 86.943]
  - - [1856, 2368, 1, 256]
    - [121, 46.436]
  - - [3584, 256, 1, 128]
    - [68, 12.864]
  - - [3584, 6784, 1, 3328]
    - [122, 92.778]
  - - [256, 1024, 1, 256]
    - [2, 7.096]
  - - [4, 6784, 1, 3328]
    - [45, 4.067]
  - - [1024, 5888, 1, 3328]
    - [44, 82.813]
  - - [1024, 128, 1, 1280]
    - [29, 11.047]
  - - [4288, 128, 1, 1280]
    - [123, 30.331]
  - - [5056, 4288, 1, 1280]
    - [39, 88.451]
  - - [5888, 64, 1, 256]
    - [69, 10.76]
  - - [1856, 256, 1, 1280]
    - [124, 31.885]
  - - [64, 5888, 1, 3328]
    - [68, 47.369]
  - - [2944, 5888, 1, 128]
    - [125, 41.47]
  - - [704, 5888, 1, 1280]
    - [70, 67.226]
  - - [2368, 3584, 1, 128]
    - [65, 33.564]
  - - [6784, 5888, 1, 3328]
    - [97, 93.91]
  - - [704, 1024, 1, 1280]
    - [5, 42.631]
  - - [448, 256, 1, 3328]
    - [83, 20.292]
  - - [448, 1856, 1, 128]
    - [70, 10.406]
  - - [128, 1024, 1, 128]
    - [23, 1.925]
  - - [2944, 4, 1, 128]
    - [36, 0.221]
  - - [1024, 704, 1, 1280]
    - [126, 39.892]
  - - [128, 5888, 1, 256]
    - [55, 15.972]
  - - [1024, 5056, 1, 1280]
    - [127, 73.371]
  - - [4288, 1024, 1, 256]
    - [89, 44.119]
  - - [2944, 2368, 1, 128]
    - [5, 35.952]
  - - [704, 704, 1, 3328]
    - [40, 34.73]
  - - [704, 1408, 1, 1280]
    - [128, 49.89]
  - - [5888, 448, 1, 1280]
    - [5, 62.971]
  - - [3584, 256, 1, 3328]
    - [129, 56.62]
  - - [704, 5888, 1, 3328]
    - [130, 82.89]
  - - [704, 1856, 1, 128]
    - [131, 14.421]
  - - [128, 3584, 1, 3328]
    - [132, 50.638]
  - - [6784, 2368, 1, 1280]
    - [133, 82.328]
  - - [4, 4288, 1, 128]
    - [134, 0.299]
  - - [128, 704, 1, 1280]
    - [119, 9.202]
  - - [3584, 2944, 1, 256]
    - [135, 54.497]
  - - [1856, 128, 1, 3328]
    - [136, 35.736]
  - - [4, 64, 1, 1280]
    - [137, 0.035]
  - - [4, 5056, 1, 3328]
    - [34, 3.173]
  - - [128, 2944, 1, 1280]
    - [138, 33.402]
  - - [2368, 1024, 1, 3328]
    - [139, 71.144]
  - - [128, 256, 1, 3328]
    - [140, 8.052]
  - - [1408, 5056, 1, 3328]
    - [141, 87.022]
  - - [1856, 1856, 1, 3328]
    - [142, 77.292]
  - - [3584, 128, 1, 256]
    - [5, 11.7]
  - - [448, 1408, 1, 3328]
    - [143, 41.855]
  - - [2368, 2368, 1, 256]
    - [5, 47.712]
  - - [4288, 4288, 1, 1280]
    - [144, 85.321]
  - - [64, 448, 1, 1280]
    - [75, 3.189]
  - - [1408, 4288, 1, 256]
    - [145, 50.542]
  - - [448, 4, 1, 256]
    - [146, 0.055]
  - - [5888, 448, 1, 128]
    - [5, 23.727]
  - - [448, 4, 1, 1280]
    - [147, 0.27]
  - - [704, 6784, 1, 3328]
    - [64, 87.393]
  - - [5888, 5888, 1, 1280]
    - [33, 90.635]
  - - [5056, 1024, 1, 1280]
    - [148, 70.803]
  - - [448, 5888, 1, 3328]
    - [89, 75.81]
  - - [128, 4, 1, 128]
    - [38, 0.009]
  - - [1024, 2944, 1, 1280]
    - [5, 57.211]
  - - [5056, 5888, 1, 1280]
    - [149, 89.103]
  - - [4288, 5888, 1, 128]
    - [74, 48.601]
  - - [256, 3584, 1, 256]
    - [4, 20.86]
  - - [1408, 3584, 1, 128]
    - [87, 31.061]
  - - [256, 2944, 1, 3328]
    - [142, 55.139]
  - - [448, 3584, 1, 128]
    - [50, 17.134]
  - - [5888, 2944, 1, 1280]
    - [63, 86.057]
  - - [4, 6784, 1, 1280]
    - [119, 2.796]
  - - [2368, 5888, 1, 128]
    - [131, 33.522]
  - - [64, 2944, 1, 128]
    - [23, 2.901]
  - - [3584, 5888, 1, 256]
    - [150, 62.907]
  - - [2368, 704, 1, 128]
    - [5, 18.118]
  - - [3584, 2944, 1, 1280]
    - [97, 82.017]
  - - [3584, 2368, 1, 128]
    - [116, 35.866]
  - - [5056, 704, 1, 128]
    - [55, 28.034]
  - - [448, 2368, 1, 128]
    - [151, 12.938]
  - - [5056, 1408, 1, 3328]
    - [152, 86.132]
  - - [1408, 704, 1, 256]
    - [5, 20.376]
  - - [6784, 1024, 1, 3328]
    - [153, 84.246]
  - - [6784, 2944, 1, 3328]
    - [58, 91.046]
  - - [2944, 5056, 1, 3328]
    - [3, 90.141]
  - - [1856, 1856, 1, 256]
    - [154, 40.489]
  - - [1024, 5888, 1, 128]
    - [155, 33.622]
  - - [2048, 7133, 1, 2048]
    - [156, 88.16]
  - - [256, 4, 1, 128]
    - [49, 0.015]
  - - [4288, 5888, 1, 1280]
    - [157, 88.487]
  - - [4288, 4288, 1, 256]
    - [4, 58.896]
  - - [448, 2944, 1, 3328]
    - [158, 66.818]
  - - [4288, 1856, 1, 1280]
    - [159, 72.344]
  - - [1856, 2944, 1, 3328]
    - [65, 84.293]
  - - [256, 6784, 1, 3328]
    - [46, 72.923]
  - - [64, 5888, 1, 256]
    - [69, 10.031]
  - - [256, 5056, 1, 128]
    - [50, 15.247]
  - - [5056, 1024, 1, 256]
    - [160, 45.331]
  - - [704, 64, 1, 3328]
    - [161, 9.879]
  - - [5056, 1856, 1, 3328]
    - [142, 86.534]
  - - [4, 2944, 1, 3328]
    - [162, 2.319]
  - - [4, 5056, 1, 256]
    - [45, 0.571]
  - - [1856, 1408, 1, 256]
    - [58, 36.821]
  - - [3584, 4, 1, 128]
    - [117, 0.213]
  - - [448, 448, 1, 3328]
    - [163, 30.816]
  - - [6784, 128, 1, 3328]
    - [164, 56.949]
  - - [4288, 1408, 1, 128]
    - [165, 34.475]
  - - [4288, 5056, 1, 256]
    - [166, 61.79]
  - - [1408, 128, 1, 1280]
    - [167, 19.018]
  - - [5056, 256, 1, 3328]
    - [168, 64.557]
  - - [704, 704, 1, 256]
    - [70, 10.983]
  - - [1024, 5888, 1, 1280]
    - [169, 74.667]
  - - [6784, 2368, 1, 128]
    - [41, 39.045]
  - - [4, 5056, 1, 1280]
    - [76, 2.191]
  - - [64, 128, 1, 256]
    - [71, 0.272]
  - - [128, 1856, 1, 1280]
    - [69, 19.914]
  - - [5056, 3584, 1, 256]
    - [3, 59.543]
  - - [1856, 1024, 1, 1280]
    - [5, 61.048]
  - - [6784, 4288, 1, 1280]
    - [115, 88.179]
  - - [1856, 1856, 1, 1280]
    - [68, 66.952]
  - - [6784, 2944, 1, 128]
    - [170, 43.794]
  - - [1408, 5056, 1, 1280]
    - [17, 78.094]
  - - [4, 2368, 1, 3328]
    - [171, 2.336]
  - - [5888, 1856, 1, 128]
    - [94, 35.826]
  - - [448, 704, 1, 1280]
    - [172, 25.506]
  - - [2368, 1024, 1, 128]
    - [173, 20.379]
  - - [1024, 448, 1, 3328]
    - [66, 47.505]
  - - [1856, 704, 1, 1280]
    - [174, 53.348]
  - - [5056, 3584, 1, 128]
    - [63, 43.318]
  - - [5888, 5888, 1, 3328]
    - [74, 94.55]
  - - [6784, 1024, 1, 256]
    - [175, 49.443]
  - - [2944, 2368, 1, 256]
    - [176, 49.707]
  - - [256, 448, 1, 256]
    - [29, 3.5]
  - - [5056, 5888, 1, 3328]
    - [42, 93.428]
  - - [1856, 1024, 1, 256]
    - [109, 31.949]
  - - [448, 1408, 1, 1280]
    - [16, 38.15]
  - - [3584, 448, 1, 1280]
    - [64, 53.133]
  - - [1024, 1024, 1, 1280]
    - [66, 43.988]
  - - [448, 5888, 1, 256]
    - [69, 37.055]
  - - [704, 64, 1, 128]
    - [29, 0.799]
  - - [1408, 6784, 1, 3328]
    - [65, 88.908]
  - - [448, 1024, 1, 128]
    - [112, 6.132]
  - - [4288, 704, 1, 128]
    - [69, 24.328]
  - - [128, 1856, 1, 128]
    - [177, 4.121]
  - - [448, 2368, 1, 3328]
    - [178, 60.111]
  - - [5056, 64, 1, 128]
    - [179, 5.133]
  - - [5056, 2944, 1, 256]
    - [180, 56.559]
  - - [6784, 5888, 1, 128]
    - [149, 56.422]
  - - [704, 1024, 1, 256]
    - [60, 17.129]
  - - [1024, 4, 1, 256]
    - [75, 0.145]
  - - [2368, 1856, 1, 256]
    - [40, 44.83]
  - - [128, 6784, 1, 1280]
    - [181, 51.758]
  - - [1408, 3584, 1, 3328]
    - [96, 81.725]
  - - [2368, 6784, 1, 256]
    - [111, 57.421]
  - - [5056, 1408, 1, 1280]
    - [153, 78.45]
  - - [256, 256, 1, 128]
    - [36, 1.117]
  - - [5056, 4288, 1, 128]
    - [5, 42.433]
  - - [1408, 1856, 1, 128]
    - [5, 23.819]
  - - [1408, 5888, 1, 3328]
    - [149, 86.286]
  - - [1856, 256, 1, 256]
    - [182, 12.053]
  - - [6784, 6784, 1, 256]
    - [44, 73.608]
  - - [64, 256, 1, 128]
    - [117, 0.258]
  - - [4288, 2368, 1, 128]
    - [5, 37.384]
  - - [1856, 4288, 1, 128]
    - [5, 34.135]
  - - [256, 4288, 1, 1280]
    - [96, 50.001]
  - - [2368, 2944, 1, 256]
    - [63, 52.617]
  - - [4, 1856, 1, 256]
    - [183, 0.224]
  - - [3584, 1856, 1, 1280]
    - [184, 75.106]
  - - [6784, 6784, 1, 128]
    - [44, 55.991]
  - - [256, 1856, 1, 128]
    - [5, 7.54]
  - - [704, 64, 1, 1280]
    - [83, 5.24]
  - - [5888, 5056, 1, 256]
    - [3, 68.866]
  - - [3584, 448, 1, 256]
    - [53, 25.89]
  - - [448, 4288, 1, 128]
    - [5, 20.772]
  - - [2944, 4288, 1, 3328]
    - [185, 88.829]
  - - [256, 6784, 1, 256]
    - [186, 25.929]
  - - [1408, 4288, 1, 128]
    - [187, 32.47]
  - - [2944, 704, 1, 3328]
    - [188, 75.827]
  - - [128, 448, 1, 256]
    - [75, 2.092]
  - - [512, 32, 1, 512]
    - [76, 0.97]
  - - [3584, 3584, 1, 256]
    - [46, 54.702]
  - - [448, 1408, 1, 128]
    - [23, 9.748]
  - - [128, 256, 1, 1280]
    - [75, 3.688]
  - - [3584, 5056, 1, 256]
    - [118, 58.575]
  - - [6784, 128, 1, 256]
    - [129, 20.931]
  - - [4288, 4, 1, 256]
    - [76, 0.564]
  - - [64, 1408, 1, 3328]
    - [49, 18.326]
  - - [704, 448, 1, 256]
    - [189, 8.919]
  - - [2944, 2368, 1, 1280]
    - [9, 77.415]
  - - [448, 64, 1, 3328]
    - [190, 6.356]
  - - [1408, 3584, 1, 256]
    - [55, 44.394]
  - - [3584, 4, 1, 3328]
    - [191, 2.861]
  - - [6784, 3584, 1, 256]
    - [89, 60.805]
  - - [256, 128, 1, 128]
    - [76, 0.63]
  - - [704, 1408, 1, 128]
    - [192, 12.939]
  - - [4, 2368, 1, 256]
    - [193, 0.309]
  - - [2944, 448, 1, 128]
    - [194, 15.59]
  - - [128, 1408, 1, 256]
    - [195, 5.481]
  - - [4, 2944, 1, 256]
    - [75, 0.386]
  - - [64, 128, 1, 3328]
    - [196, 2.112]
  - - [5056, 2368, 1, 128]
    - [3, 40.035]
  - - [2944, 2944, 1, 3328]
    - [58, 89.464]
  - - [5056, 6784, 1, 256]
    - [44, 67.971]
  - - [1856, 3584, 1, 128]
    - [55, 34.793]
  - - [128, 2944, 1, 128]
    - [179, 6.178]
  - - [1024, 704, 1, 3328]
    - [197, 44.86]
  - - [6784, 448, 1, 256]
    - [198, 38.128]
  - - [3584, 6784, 1, 128]
    - [8, 43.309]
  - - [128, 4288, 1, 256]
    - [199, 13.255]
  - - [704, 448, 1, 3328]
    - [139, 39.414]
  - - [1024, 1024, 1, 3328]
    - [200, 52.691]
  - - [128, 128, 1, 3328]
    - [201, 4.454]
  - - [5056, 1856, 1, 256]
    - [155, 44.85]
  - - [256, 128, 1, 256]
    - [36, 1.047]
  - - [1024, 1856, 1, 256]
    - [182, 33.763]
  - - [4288, 64, 1, 128]
    - [13, 4.637]
  - - [256, 448, 1, 3328]
    - [199, 20.156]
  - - [1408, 6784, 1, 1280]
    - [184, 80.896]
  - - [3584, 3584, 1, 1280]
    - [118, 84.704]
  - - [64, 2368, 1, 1280]
    - [29, 13.753]
  - - [448, 2368, 1, 1280]
    - [50, 44.165]
  - - [5888, 5888, 1, 128]
    - [149, 52.892]
  - - [64, 6784, 1, 3328]
    - [132, 54.93]
  - - [2944, 256, 1, 1280]
    - [5, 45.614]
  - - [5056, 5888, 1, 128]
    - [33, 49.195]
  - - [256, 2368, 1, 128]
    - [192, 8.207]
  - - [5056, 2368, 1, 3328]
    - [202, 88.42]
  - - [2944, 4288, 1, 256]
    - [93, 54.123]
  - - [1408, 3584, 1, 1280]
    - [203, 72.587]
  - - [2368, 64, 1, 256]
    - [45, 4.482]
  - - [64, 448, 1, 3328]
    - [31, 7.428]
  - - [256, 256, 1, 3328]
    - [161, 12.502]
  - - [5888, 4, 1, 128]
    - [193, 0.335]
  - - [1856, 704, 1, 256]
    - [123, 26.291]
  - - [4, 4288, 1, 1280]
    - [75, 1.786]
  - - [1408, 448, 1, 3328]
    - [92, 45.27]
  - - [1024, 4, 1, 3328]
    - [147, 1.367]
  - - [2368, 256, 1, 256]
    - [13, 14.232]
  - - [2368, 6784, 1, 3328]
    - [204, 89.585]
  - - [1856, 1408, 1, 1280]
    - [205, 65.785]
  - - [1856, 448, 1, 1280]
    - [5, 48.72]
  - - [6784, 704, 1, 128]
    - [123, 31.442]
  - - [4, 4, 1, 256]
    - [38, 0.0]
  - - [128, 5888, 1, 128]
    - [12, 10.617]
  - - [1408, 5888, 1, 256]
    - [58, 53.521]
  - - [704, 2944, 1, 1280]
    - [42, 56.14]
  - - [1856, 2368, 1, 128]
    - [124, 30.515]
  - - [4096, 7133, 1, 4096]
    - [206, 94.211]
  - - [256, 64, 1, 256]
    - [0, 0.435]
  - - [1024, 1024, 1, 256]
    - [138, 19.798]
  - - [704, 1856, 1, 256]
    - [207, 24.67]
  - - [128, 4288, 1, 3328]
    - [208, 37.437]
  - - [3584, 704, 1, 1280]
    - [124, 60.207]
  - - [256, 128, 1, 1280]
    - [76, 3.32]
  - - [2368, 4, 1, 256]
    - [76, 0.32]
  - - [256, 2368, 1, 1280]
    - [5, 35.929]
  - - [2944, 6784, 1, 128]
    - [44, 45.793]
  - - [3584, 448, 1, 3328]
    - [209, 68.566]
  - - [1408, 4, 1, 256]
    - [75, 0.181]
  - - [704, 2368, 1, 3328]
    - [81, 69.225]
  - - [2944, 448, 1, 256]
    - [51, 24.737]
  - - [1856, 448, 1, 128]
    - [25, 9.333]
  - - [2368, 128, 1, 1280]
    - [168, 26.71]
  - - [256, 5888, 1, 128]
    - [210, 16.685]
  - - [64, 6784, 1, 256]
    - [50, 12.825]
  - - [64, 5056, 1, 1280]
    - [139, 25.971]
  - - [4, 6784, 1, 128]
    - [61, 0.464]
  - - [2944, 2944, 1, 1280]
    - [82, 79.405]
  - - [5888, 2368, 1, 256]
    - [5, 53.909]
  - - [4, 3584, 1, 1280]
    - [119, 1.537]
  - - [1408, 128, 1, 128]
    - [114, 2.36]
  - - [6784, 704, 1, 3328]
    - [211, 85.131]
  - - [128, 64, 1, 1280]
    - [212, 1.033]
  - - [2368, 256, 1, 1280]
    - [213, 35.849]
  - - [4, 448, 1, 3328]
    - [196, 0.471]
  - - [5888, 4288, 1, 128]
    - [214, 45.38]
  - - [4, 5888, 1, 256]
    - [29, 0.795]
  - - [1408, 2944, 1, 3328]
    - [115, 83.034]
  - - [3584, 704, 1, 128]
    - [5, 23.314]
  - - [64, 1024, 1, 256]
    - [36, 1.823]
  - - [5056, 5056, 1, 128]
    - [74, 48.573]
  - - [2368, 448, 1, 1280]
    - [215, 49.691]
  - - [128, 3584, 1, 256]
    - [216, 13.595]
  - - [704, 448, 1, 1280]
    - [208, 28.217]
  - - [448, 5056, 1, 128]
    - [62, 23.25]
  - - [256, 4, 1, 1280]
    - [217, 0.158]
  - - [128, 5056, 1, 256]
    - [218, 15.203]
  - - [1408, 5056, 1, 128]
    - [219, 36.05]
  - - [2944, 3584, 1, 128]
    - [220, 39.738]
  - - [3584, 2368, 1, 256]
    - [221, 48.786]
  - - [5888, 5056, 1, 1280]
    - [39, 89.37]
  - - [2368, 5056, 1, 128]
    - [5, 38.299]
  - - [64, 704, 1, 256]
    - [61, 1.407]
  - - [4288, 256, 1, 1280]
    - [222, 50.684]
  - - [3584, 3584, 1, 3328]
    - [118, 90.864]
  - - [1024, 256, 1, 128]
    - [29, 3.643]
  - - [4, 704, 1, 128]
    - [223, 0.04]
  - - [5888, 6784, 1, 256]
    - [149, 72.305]
  - - [4288, 2944, 1, 3328]
    - [58, 91.632]
  - - [2944, 64, 1, 128]
    - [71, 2.925]
  - - [1856, 64, 1, 256]
    - [224, 2.822]
  - - [4288, 128, 1, 3328]
    - [68, 38.943]
  - - [4288, 704, 1, 1280]
    - [225, 61.608]
  - - [256, 5056, 1, 1280]
    - [108, 54.42]
  - - [1408, 256, 1, 128]
    - [5, 5.333]
  - - [2944, 5888, 1, 3328]
    - [33, 92.375]
  - - [6784, 5888, 1, 1280]
    - [111, 90.319]
  - - [704, 128, 1, 256]
    - [75, 3.085]
  - - [5888, 4288, 1, 1280]
    - [159, 87.058]
  - - [448, 256, 1, 1280]
    - [49, 10.4]
  - - [5888, 3584, 1, 128]
    - [44, 45.675]
  - - [1856, 1856, 1, 128]
    - [5, 27.784]
  - - [5056, 4, 1, 1280]
    - [199, 2.194]
  - - [256, 1408, 1, 1280]
    - [5, 28.917]
  - - [512, 16, 1, 512]
    - [226, 0.522]
  - - [704, 3584, 1, 128]
    - [50, 23.466]
  - - [5888, 448, 1, 3328]
    - [227, 76.487]
  - - [2368, 4288, 1, 1280]
    - [58, 80.182]
  - - [4288, 2944, 1, 128]
    - [118, 41.359]
  - - [1024, 6784, 1, 3328]
    - [228, 85.205]
  - - [128, 2368, 1, 256]
    - [45, 9.161]
  - - [6784, 64, 1, 3328]
    - [92, 52.431]
  - - [5056, 2944, 1, 3328]
    - [44, 90.269]
  - - [448, 128, 1, 256]
    - [55, 1.661]
  - - [2944, 3584, 1, 256]
    - [109, 50.442]
  - - [1408, 1408, 1, 3328]
    - [188, 72.283]
  - - [1856, 128, 1, 1280]
    - [229, 24.216]
  - - [3584, 3584, 1, 128]
    - [230, 41.621]
  - - [64, 3584, 1, 256]
    - [231, 7.596]
  - - [1408, 4, 1, 3328]
    - [38, 1.345]
  - - [128, 2944, 1, 3328]
    - [53, 46.107]
  - - [3584, 704, 1, 256]
    - [26, 35.382]
  - - [2944, 448, 1, 3328]
    - [232, 67.219]
  - - [3584, 1408, 1, 3328]
    - [233, 82.252]
  - - [704, 3584, 1, 1280]
    - [5, 61.142]
  - - [2944, 6784, 1, 1280]
    - [93, 85.918]
  - - [1856, 6784, 1, 256]
    - [116, 55.246]
  - - [4288, 448, 1, 3328]
    - [181, 77.978]
  - - [6784, 4288, 1, 128]
    - [234, 48.371]
  - - [6784, 704, 1, 1280]
    - [50, 68.43]
  - - [256, 4288, 1, 256]
    - [165, 20.95]
  - - [3584, 64, 1, 128]
    - [13, 3.763]
  - - [5888, 1024, 1, 3328]
    - [235, 80.808]
  - - [448, 64, 1, 128]
    - [76, 0.423]
  - - [704, 6784, 1, 1280]
    - [46, 76.611]
  - - [5888, 128, 1, 256]
    - [55, 17.977]
  - - [2368, 448, 1, 3328]
    - [236, 60.046]
  - - [1856, 5056, 1, 3328]
    - [206, 87.69]
  - - [4, 6784, 1, 256]
    - [237, 0.716]
  - - [1024, 3584, 1, 128]
    - [238, 28.836]
  - - [1024, 1408, 1, 128]
    - [165, 15.117]
  - - [2368, 2944, 1, 128]
    - [5, 36.469]
  - - [5056, 64, 1, 256]
    - [239, 8.858]
  - - [4, 448, 1, 1280]
    - [212, 0.249]
  - - [5056, 2944, 1, 128]
    - [5, 35.03]
  - - [5888, 5056, 1, 3328]
    - [118, 92.399]
  - - [1024, 704, 1, 128]
    - [179, 8.177]
  - - [1408, 2368, 1, 128]
    - [43, 19.805]
  - - [5888, 2368, 1, 128]
    - [44, 41.939]
  - - [128, 5056, 1, 3328]
    - [143, 48.09]
  - - [3584, 6784, 1, 1280]
    - [58, 88.608]
  - - [3072, 7435, 1, 1024]
    - [96, 84.266]
  - - [1856, 5888, 1, 256]
    - [5, 53.192]
  - - [256, 256, 1, 256]
    - [36, 1.898]
  - - [256, 64, 1, 128]
    - [240, 0.281]
  - - [4288, 4288, 1, 3328]
    - [64, 91.95]
  - - [4288, 1408, 1, 1280]
    - [89, 73.81]
  - - [3584, 5056, 1, 128]
    - [44, 42.947]
  - - [4, 1024, 1, 3328]
    - [196, 1.302]
  - - [4288, 2368, 1, 256]
    - [241, 44.112]
  - - [2944, 5056, 1, 1280]
    - [159, 83.883]
  - - [448, 6784, 1, 256]
    - [55, 35.96]
  - - [64, 1024, 1, 3328]
    - [140, 11.736]
  - - [6784, 2368, 1, 3328]
    - [20, 89.659]
  - - [256, 1024, 1, 1280]
    - [100, 18.763]
  - - [704, 4, 1, 128]
    - [38, 0.04]
  - - [256, 4, 1, 256]
    - [38, 0.032]
  - - [4288, 128, 1, 256]
    - [5, 13.945]
  - - [4288, 1856, 1, 3328]
    - [188, 82.087]
  - - [3584, 448, 1, 128]
    - [55, 15.139]
  - - [256, 4, 1, 3328]
    - [242, 0.335]
  - - [4, 1408, 1, 1280]
    - [146, 0.704]
  - - [3584, 64, 1, 1280]
    - [243, 20.818]
  - - [1408, 448, 1, 128]
    - [5, 8.361]
  - - [3584, 1024, 1, 1280]
    - [78, 69.492]
  - - [1856, 5056, 1, 256]
    - [244, 43.703]
  - - [4, 3584, 1, 256]
    - [245, 0.418]
  - - [1024, 4288, 1, 256]
    - [194, 40.552]
  - - [5888, 3584, 1, 3328]
    - [58, 91.952]
  - - [4, 256, 1, 256]
    - [38, 0.031]
  - - [5056, 3584, 1, 3328]
    - [67, 91.095]
  - - [128, 5888, 1, 1280]
    - [5, 44.818]
  - - [704, 448, 1, 128]
    - [246, 5.066]
  - - [2368, 1408, 1, 1280]
    - [247, 66.955]
  - - [5056, 2944, 1, 1280]
    - [149, 85.13]
  - - [4, 4, 1, 128]
    - [61, 0.0]
  - - [3584, 256, 1, 256]
    - [105, 19.06]
  - - [128, 1856, 1, 3328]
    - [248, 33.962]
  - - [1024, 6784, 1, 256]
    - [135, 43.961]
  - - [4, 128, 1, 256]
    - [38, 0.017]
  - - [64, 64, 1, 1280]
    - [217, 0.517]
  - - [6784, 4, 1, 128]
    - [71, 0.418]
  - - [2944, 1408, 1, 128]
    - [94, 30.695]
  - - [448, 128, 1, 3328]
    - [161, 12.337]
  - - [64, 2944, 1, 3328]
    - [231, 30.187]
  - - [64, 4288, 1, 3328]
    - [40, 34.809]
  - - [5056, 6784, 1, 3328]
    - [67, 94.206]
  - - [128, 2944, 1, 256]
    - [69, 10.682]
  - - [128, 6784, 1, 128]
    - [50, 11.867]
  - - [3584, 4288, 1, 256]
    - [249, 57.953]
  - - [448, 1856, 1, 256]
    - [138, 17.257]
  - - [1856, 6784, 1, 3328]
    - [63, 90.895]
  - - [3584, 128, 1, 3328]
    - [139, 47.44]
  - - [64, 1856, 1, 256]
    - [199, 3.988]
  - - [1024, 448, 1, 1280]
    - [66, 34.829]
  - - [5888, 4288, 1, 256]
    - [42, 62.217]
  - - [4, 448, 1, 128]
    - [36, 0.029]
  - - [5056, 1408, 1, 256]
    - [64, 55.136]
  - - [64, 256, 1, 1280]
    - [30, 1.978]
  - - [3584, 1024, 1, 256]
    - [78, 41.763]
  - - [256, 704, 1, 256]
    - [50, 5.113]
  - - [5888, 5888, 1, 256]
    - [58, 69.336]
  - - [4288, 1024, 1, 1280]
    - [89, 71.348]
  - - [5888, 128, 1, 3328]
    - [250, 47.439]
  - - [448, 6784, 1, 3328]
    - [249, 78.153]
  - - [2944, 1408, 1, 1280]
    - [251, 69.683]
  - - [1024, 32, 1, 512]
    - [237, 1.824]
  - - [2944, 1856, 1, 3328]
    - [96, 85.22]
  - - [2368, 64, 1, 128]
    - [72, 2.502]
  - - [2944, 2944, 1, 128]
    - [69, 34.243]
  - - [4, 128, 1, 3328]
    - [147, 0.176]
  - - [3584, 5888, 1, 1280]
    - [135, 86.3]
  - - [64, 4, 1, 128]
    - [217, 0.004]
  - - [6784, 1856, 1, 1280]
    - [115, 81.068]
  - - [2944, 5056, 1, 256]
    - [122, 58.255]
  - - [2944, 5888, 1, 1280]
    - [188, 86.951]
  - - [5888, 256, 1, 3328]
    - [133, 62.47]
  - - [1856, 5888, 1, 3328]
    - [252, 90.041]
  - - [3584, 1408, 1, 256]
    - [51, 42.864]
  - - [704, 3584, 1, 3328]
    - [46, 74.648]
  - - [5056, 448, 1, 1280]
    - [253, 55.322]
  - - [3584, 1856, 1, 3328]
    - [230, 87.453]
  - - [64, 1408, 1, 128]
    - [71, 1.653]
  - - [1408, 704, 1, 1280]
    - [254, 49.011]
  - - [2944, 1024, 1, 256]
    - [220, 33.769]
  - - [1024, 2368, 1, 128]
    - [5, 21.649]
  - - [2368, 4288, 1, 3328]
    - [64, 86.637]
  - - [4, 1408, 1, 256]
    - [117, 0.155]
  - - [1024, 1408, 1, 1280]
    - [255, 58.339]
  - - [64, 64, 1, 256]
    - [223, 0.123]
  - - [704, 256, 1, 3328]
    - [106, 28.08]
  - - [6784, 5056, 1, 256]
    - [118, 69.87]
  - - [4, 4288, 1, 3328]
    - [75, 2.749]
  - - [448, 6784, 1, 128]
    - [54, 26.453]
  - - [4, 704, 1, 3328]
    - [256, 0.781]
  - - [448, 2944, 1, 256]
    - [5, 24.283]
  - - [2944, 6784, 1, 256]
    - [33, 62.486]
  - - [2368, 2368, 1, 1280]
    - [82, 75.826]
  - - [4, 4, 1, 1280]
    - [226, 0.002]
  - - [1856, 3584, 1, 1280]
    - [58, 76.126]
  - - [64, 2944, 1, 256]
    - [29, 4.61]
  - - [3584, 1408, 1, 1280]
    - [257, 71.041]
  - - [448, 256, 1, 128]
    - [114, 1.561]
  - - [4288, 448, 1, 128]
    - [94, 20.418]
  - - [5056, 256, 1, 1280]
    - [87, 55.03]
  - - [1856, 1408, 1, 3328]
    - [258, 76.276]
  - - [128, 128, 1, 128]
    - [29, 0.298]
  - - [1024, 4288, 1, 3328]
    - [259, 87.623]
  - - [448, 2368, 1, 256]
    - [43, 23.066]
  - - [1024, 4, 1, 128]
    - [38, 0.055]
  - - [5056, 448, 1, 256]
    - [5, 34.734]
  - - [2944, 2368, 1, 3328]
    - [260, 84.715]
  - - [704, 128, 1, 3328]
    - [34, 17.954]
  - - [64, 64, 1, 3328]
    - [217, 1.427]
  - - [1024, 1856, 1, 1280]
    - [261, 63.04]
  - - [6784, 1856, 1, 256]
    - [44, 53.572]
  - - [128, 2368, 1, 3328]
    - [262, 38.637]
  - - [1024, 5888, 1, 256]
    - [160, 48.381]
  - - [5056, 128, 1, 1280]
    - [165, 35.696]
  - - [5056, 64, 1, 3328]
    - [107, 39.97]
  - - [128, 704, 1, 128]
    - [75, 1.473]
  - - [1408, 2368, 1, 256]
    - [5, 40.676]
  - - [1408, 1408, 1, 256]
    - [55, 26.829]
  - - [4, 64, 1, 128]
    - [263, 0.004]
  - - [64, 128, 1, 1280]
    - [38, 1.012]
  - - [2368, 2368, 1, 128]
    - [69, 33.775]
  - - [64, 5888, 1, 128]
    - [50, 5.762]
  - - [5888, 4, 1, 3328]
    - [106, 3.74]
  - - [6784, 1408, 1, 128]
    - [169, 33.729]
  - - [4288, 5888, 1, 256]
    - [74, 64.073]
  - - [1408, 5056, 1, 256]
    - [213, 50.129]
  - - [5056, 128, 1, 3328]
    - [264, 41.299]
  - - [128, 128, 1, 1280]
    - [146, 1.74]
  - - [448, 704, 1, 256]
    - [265, 7.706]
  - - [4288, 3584, 1, 128]
    - [259, 36.311]
  - - [2944, 128, 1, 3328]
    - [138, 44.333]
  - - [128, 5056, 1, 1280]
    - [266, 35.782]
  - - [3584, 5056, 1, 1280]
    - [58, 85.049]
  - - [256, 448, 1, 1280]
    - [29, 11.659]
  - - [704, 704, 1, 128]
    - [108, 6.541]
  - - [5056, 4, 1, 128]
    - [193, 0.373]
  - - [704, 256, 1, 1280]
    - [71, 15.591]
  - - [64, 2368, 1, 3328]
    - [106, 25.182]
  - - [1856, 1024, 1, 128]
    - [131, 18.172]
  - - [1856, 64, 1, 128]
    - [71, 1.96]
  - - [64, 6784, 1, 1280]
    - [50, 35.814]
  - - [704, 4288, 1, 256]
    - [216, 37.961]
  - - [5888, 2368, 1, 1280]
    - [20, 81.98]
  - - [128, 256, 1, 256]
    - [267, 1.044]
  - - [256, 64, 1, 1280]
    - [268, 2.115]
  - - [2368, 5888, 1, 1280]
    - [178, 82.937]
  - - [5888, 256, 1, 1280]
    - [227, 50.055]
  - - [4, 5888, 1, 1280]
    - [112, 2.414]
  - - [704, 128, 1, 128]
    - [75, 1.239]
  - - [1024, 4, 1, 1280]
    - [30, 0.491]
  - - [2368, 1856, 1, 3328]
    - [165, 82.688]
  - - [2368, 128, 1, 128]
    - [269, 5.029]
  - - [2944, 704, 1, 256]
    - [99, 30.076]
  - - [5056, 128, 1, 128]
    - [131, 8.194]
  - - [256, 704, 1, 3328]
    - [243, 28.109]
  - - [704, 3584, 1, 256]
    - [170, 32.352]
  - - [1024, 1024, 1, 1024]
    - [5, 41.315]
  - - [704, 2944, 1, 3328]
    - [42, 70.508]
  - - [6784, 1024, 1, 128]
    - [266, 31.346]
  - - [256, 448, 1, 128]
    - [223, 1.967]
  - - [448, 1024, 1, 3328]
    - [270, 46.175]
  - - [2944, 1024, 1, 3328]
    - [19, 76.513]
  - - [2944, 5056, 1, 128]
    - [192, 37.708]
  - - [1408, 6784, 1, 256]
    - [271, 45.923]
  - - [6784, 1408, 1, 3328]
    - [41, 88.707]
  - - [4288, 6784, 1, 128]
    - [118, 48.459]
  - - [704, 64, 1, 256]
    - [75, 1.502]
  - - [5888, 4, 1, 1280]
    - [45, 2.199]
  - - [256, 2368, 1, 3328]
    - [64, 40.56]
  - - [6784, 2944, 1, 1280]
    - [272, 85.15]
  - - [4288, 1856, 1, 128]
    - [5, 34.383]
  - - [1856, 2944, 1, 128]
    - [154, 33.413]
  - - [6784, 448, 1, 128]
    - [208, 22.672]
  - - [64, 3584, 1, 128]
    - [163, 3.787]
  - - [448, 5056, 1, 1280]
    - [186, 57.214]
  - - [2368, 1856, 1, 128]
    - [253, 28.465]
  - - [128, 448, 1, 1280]
    - [49, 5.96]
  - - [4288, 704, 1, 256]
    - [5, 38.099]
  - - [256, 3584, 1, 128]
    - [93, 11.617]
  - - [5888, 704, 1, 256]
    - [168, 43.201]
  - - [3584, 1024, 1, 128]
    - [55, 26.827]
  - - [256, 5888, 1, 3328]
    - [261, 64.832]
  - - [1408, 4288, 1, 3328]
    - [118, 82.898]
  - - [6784, 4288, 1, 256]
    - [58, 64.658]
  - - [4288, 256, 1, 128]
    - [50, 12.104]
  - - [5888, 256, 1, 256]
    - [69, 26.38]
  - - [6784, 1024, 1, 1280]
    - [259, 75.653]
  - - [5888, 1024, 1, 128]
    - [184, 30.172]
  - - [1024, 128, 1, 256]
    - [0, 3.674]
  - - [128, 64, 1, 3328]
    - [217, 2.664]
  - - [448, 64, 1, 256]
    - [75, 0.815]
  - - [2368, 256, 1, 128]
    - [51, 7.308]
  - - [6784, 3584, 1, 1280]
    - [41, 88.052]
  - - [1024, 6784, 1, 1280]
    - [205, 77.017]
  - - [2944, 64, 1, 1280]
    - [100, 19.316]
  - - [1408, 2944, 1, 1280]
    - [273, 68.602]
  - - [256, 1856, 1, 256]
    - [108, 12.176]
  - - [1408, 2368, 1, 3328]
    - [274, 80.055]
  - - [2944, 4, 1, 3328]
    - [275, 2.103]
  - - [128, 1408, 1, 3328]
    - [276, 26.795]
  - - [2944, 1856, 1, 128]
    - [194, 32.571]
  - - [256, 2944, 1, 128]
    - [277, 10.686]
  - - [256, 6784, 1, 128]
    - [55, 18.528]
  - - [2368, 4, 1, 128]
    - [61, 0.16]
  - - [1408, 256, 1, 3328]
    - [138, 42.968]
  - - [1856, 4, 1, 128]
    - [61, 0.135]
  - - [1024, 16, 1, 512]
    - [38, 0.779]
  - - [5056, 6784, 1, 128]
    - [33, 51.478]
  - - [4288, 5056, 1, 128]
    - [41, 43.077]
  - - [1856, 5888, 1, 128]
    - [155, 37.988]
  - - [2944, 5888, 1, 256]
    - [42, 58.14]
  - - [3584, 1856, 1, 256]
    - [50, 48.381]
  - - [4288, 3584, 1, 1280]
    - [58, 85.431]
  - - [2368, 448, 1, 256]
    - [208, 22.288]
  - - [4288, 256, 1, 3328]
    - [148, 68.818]
  - - [1856, 704, 1, 128]
    - [194, 14.089]
  - - [1408, 64, 1, 256]
    - [72, 3.054]
  - - [64, 1856, 1, 128]
    - [61, 1.91]
  - - [4, 256, 1, 128]
    - [263, 0.017]
  - - [704, 4288, 1, 3328]
    - [96, 77.214]
  - - [704, 5888, 1, 128]
    - [99, 24.899]
  - - [6784, 3584, 1, 128]
    - [99, 45.231]
  - - [1024, 64, 1, 256]
    - [71, 1.646]
  - - [64, 2368, 1, 256]
    - [52, 3.512]
  - - [4288, 5056, 1, 3328]
    - [20, 91.487]
  - - [4, 1856, 1, 1280]
    - [217, 0.9]
  - - [4288, 128, 1, 128]
    - [231, 8.334]
  - - [1408, 1408, 1, 128]
    - [94, 18.165]
  - - [1024, 128, 1, 3328]
    - [167, 20.29]
  - - [1856, 128, 1, 128]
    - [269, 3.44]
  - - [5056, 2368, 1, 256]
    - [55, 52.075]
  - - [4288, 704, 1, 3328]
    - [254, 78.278]
  - - [448, 3584, 1, 256]
    - [278, 25.602]
  - - [64, 128, 1, 128]
    - [279, 0.149]
  - - [2368, 64, 1, 1280]
    - [72, 14.784]
  - - [2368, 1024, 1, 1280]
    - [66, 56.28]
  - - [2944, 1408, 1, 3328]
    - [272, 82.438]
  - - [1408, 448, 1, 256]
    - [55, 15.889]
  - - [1024, 1408, 1, 3328]
    - [280, 72.443]
  - - [2560, 7133, 1, 2560]
    - [122, 89.992]
  - - [1408, 4, 1, 1280]
    - [281, 0.759]
  - - [5888, 3584, 1, 256]
    - [118, 59.726]
  - - [128, 1024, 1, 1280]
    - [248, 11.729]
  - - [1408, 1856, 1, 3328]
    - [282, 76.533]
  - - [4, 4, 1, 3328]
    - [30, 0.005]
  - - [6784, 1408, 1, 1280]
    - [122, 81.216]
  - - [4, 1024, 1, 1280]
    - [217, 0.563]
  - - [704, 2944, 1, 256]
    - [92, 33.061]
  - - [704, 4288, 1, 128]
    - [94, 23.822]
  - - [2368, 4288, 1, 128]
    - [74, 36.475]
  - - [64, 4288, 1, 1280]
    - [138, 21.451]
  - - [6784, 64, 1, 1280]
    - [66, 32.547]
  - - [3584, 128, 1, 128]
    - [50, 7.089]
  - - [1024, 6784, 1, 128]
    - [5, 31.306]
  - - [4, 1856, 1, 128]
    - [263, 0.123]
  - - [1408, 64, 1, 3328]
    - [114, 16.837]
  - - [6784, 4, 1, 256]
    - [29, 0.795]
  - - [1408, 1408, 1, 1280]
    - [283, 53.756]
  - - [256, 2368, 1, 256]
    - [22, 13.134]
  - - [448, 4288, 1, 3328]
    - [64, 78.141]
  - - [2368, 1408, 1, 256]
    - [168, 38.299]
  - - [5888, 5056, 1, 128]
    - [149, 53.134]
  - - [704, 2368, 1, 256]
    - [216, 26.573]
  - - [2944, 448, 1, 1280]
    - [208, 55.045]
  - - [5888, 2368, 1, 3328]
    - [254, 88.788]
  - - [64, 2944, 1, 1280]
    - [136, 17.048]
  - - [448, 1856, 1, 1280]
    - [70, 48.38]
  - - [4288, 448, 1, 1280]
    - [182, 63.854]
  - - [5888, 704, 1, 3328]
    - [74, 82.781]
  - - [5056, 256, 1, 128]
    - [165, 14.575]
  - - [1856, 256, 1, 128]
    - [165, 6.877]
  - - [5056, 128, 1, 256]
    - [176, 13.89]
  - - [704, 4, 1, 256]
    - [284, 0.088]
  - - [1408, 5888, 1, 128]
    - [54, 32.531]
  - - [4288, 4, 1, 128]
    - [114, 0.277]
  - - [1408, 1024, 1, 256]
    - [40, 24.357]
  - - [1024, 1856, 1, 128]
    - [285, 18.35]
  - - [256, 704, 1, 128]
    - [286, 2.716]
  - - [256, 1024, 1, 128]
    - [179, 3.782]
  - - [448, 1024, 1, 256]
    - [187, 13.307]
  - - [128, 4, 1, 3328]
    - [217, 0.169]
  - - [5056, 6784, 1, 1280]
    - [74, 89.909]
  - - [704, 5056, 1, 3328]
    - [46, 78.63]
  - - [64, 1408, 1, 1280]
    - [45, 9.767]
  - - [3584, 5056, 1, 3328]
    - [58, 90.942]
  - - [1856, 4, 1, 3328]
    - [147, 1.74]
  - - [4, 2944, 1, 128]
    - [287, 0.198]
  - - [2368, 2944, 1, 3328]
    - [288, 86.167]
  - - [448, 448, 1, 1280]
    - [136, 17.836]
  - - [2368, 3584, 1, 256]
    - [82, 47.843]
  - - [5056, 3584, 1, 1280]
    - [289, 84.694]
  - - [448, 4, 1, 3328]
    - [217, 0.592]
  - - [1856, 2944, 1, 1280]
    - [135, 76.491]
  - - [3584, 2368, 1, 1280]
    - [96, 79.314]
  - - [128, 1024, 1, 256]
    - [49, 4.18]
  - - [2944, 1408, 1, 256]
    - [87, 41.041]
  - - [4288, 1408, 1, 3328]
    - [118, 83.205]
  - - [3584, 64, 1, 3328]
    - [45, 30.333]
  - - [1408, 128, 1, 256]
    - [229, 5.931]
  - - [2944, 1024, 1, 128]
    - [145, 21.016]
  - - [4288, 5056, 1, 1280]
    - [230, 85.048]
  - - [5888, 6784, 1, 1280]
    - [122, 89.507]
  - - [6784, 5056, 1, 128]
    - [80, 52.535]
  - - [256, 1024, 1, 3328]
    - [139, 32.328]
  - - [3584, 4, 1, 256]
    - [119, 0.401]
  - - [1856, 64, 1, 3328]
    - [119, 20.838]
  - - [64, 6784, 1, 128]
    - [290, 5.86]
  - - [5888, 1408, 1, 3328]
    - [261, 86.555]
  - - [5888, 64, 1, 1280]
    - [43, 29.44]
  - - [256, 5056, 1, 256]
    - [105, 23.971]
  - - [128, 3584, 1, 128]
    - [69, 6.106]
  - - [448, 3584, 1, 3328]
    - [89, 68.179]
  - - [704, 2368, 1, 128]
    - [291, 15.837]
  - - [5888, 256, 1, 128]
    - [145, 16.917]
  - - [4, 5056, 1, 128]
    - [292, 0.345]
  - - [448, 256, 1, 256]
    - [134, 3.488]
  - - [704, 4, 1, 3328]
    - [147, 0.85]
  - - [1408, 256, 1, 256]
    - [13, 10.146]
  - - [3584, 1856, 1, 128]
    - [121, 33.817]
  - - [4288, 4288, 1, 128]
    - [44, 42.036]
  - - [1856, 1024, 1, 3328]
    - [293, 79.339]
  - - [128, 5888, 1, 3328]
    - [294, 46.437]
  - - [1024, 5056, 1, 256]
    - [50, 44.065]
  - - [2368, 1408, 1, 3328]
    - [208, 79.92]
  - - [5888, 448, 1, 256]
    - [295, 32.189]
  - - [5888, 6784, 1, 128]
    - [33, 54.506]
  - - [2368, 4, 1, 3328]
    - [296, 2.004]
  - - [6784, 5056, 1, 1280]
    - [74, 90.014]
  - - [5056, 704, 1, 1280]
    - [297, 67.355]
  - - [1408, 256, 1, 1280]
    - [165, 28.04]
  - - [4288, 6784, 1, 1280]
    - [46, 87.906]
  - - [128, 704, 1, 256]
    - [112, 3.017]
  - - [448, 128, 1, 1280]
    - [34, 5.586]
  - - [6784, 4, 1, 3328]
    - [0, 3.88]
  - - [4288, 4, 1, 1280]
    - [0, 1.847]
  - - [1024, 64, 1, 3328]
    - [72, 12.673]
  - - [1856, 4, 1, 256]
    - [237, 0.242]
  - - [64, 3584, 1, 1280]
    - [231, 21.672]
  - - [6784, 1408, 1, 256]
    - [51, 44.642]
  - - [3584, 5888, 1, 128]
    - [44, 46.051]
  - - [5056, 5888, 1, 256]
    - [44, 67.761]
  - - [2368, 1024, 1, 256]
    - [194, 32.935]
  - - [2944, 1856, 1, 256]
    - [214, 45.997]
  - - [1856, 6784, 1, 1280]
    - [58, 84.404]
  - - [64, 5056, 1, 128]
    - [276, 4.38]
  - - [5888, 64, 1, 128]
    - [5, 5.589]
  - - [448, 704, 1, 128]
    - [298, 4.245]
  - - [4, 1024, 1, 128]
    - [299, 0.067]
  - - [4288, 3584, 1, 256]
    - [214, 57.455]
  - - [1408, 704, 1, 128]
    - [300, 10.897]
  - - [64, 256, 1, 3328]
    - [217, 4.338]
  - - [5056, 1856, 1, 1280]
    - [261, 79.696]
  - - [1408, 1024, 1, 3328]
    - [301, 65.52]
  - - [2368, 256, 1, 3328]
    - [126, 42.331]
  - - [5888, 3584, 1, 1280]
    - [39, 86.585]
  - - [1856, 3584, 1, 3328]
    - [261, 87.656]
  - - [5888, 128, 1, 1280]
    - [124, 43.958]
  - - [1024, 2944, 1, 256]
    - [182, 36.752]
  - - [448, 6784, 1, 1280]
    - [5, 58.769]
  - - [256, 3584, 1, 1280]
    - [58, 53.855]
  - - [448, 128, 1, 128]
    - [61, 0.943]
  - - [704, 5056, 1, 256]
    - [12, 39.216]
  - - [3584, 1024, 1, 3328]
    - [302, 81.575]
  - - [2944, 1856, 1, 1280]
    - [58, 75.366]
  - - [128, 256, 1, 128]
    - [76, 0.569]
  - - [5056, 256, 1, 256]
    - [124, 25.307]
  - - [2368, 3584, 1, 3328]
    - [118, 87.812]
  - - [2944, 704, 1, 1280]
    - [222, 56.285]
  - - [128, 4, 1, 256]
    - [38, 0.017]
  - - [2944, 3584, 1, 1280]
    - [4, 83.121]
  - - [1856, 5888, 1, 1280]
    - [41, 80.421]
  - - [256, 256, 1, 1280]
    - [36, 6.516]
  - - [5056, 448, 1, 3328]
    - [303, 72.79]
  - - [4288, 1408, 1, 256]
    - [5, 46.967]
  - - [3584, 64, 1, 256]
    - [114, 7.25]
  - - [64, 1856, 1, 3328]
    - [72, 20.332]
  - - [256, 1408, 1, 128]
    - [192, 4.471]
  - - [5888, 1408, 1, 128]
    - [55, 33.893]
  - - [4288, 2368, 1, 1280]
    - [64, 79.326]
  - - [4, 4288, 1, 256]
    - [304, 0.51]
  - - [256, 4288, 1, 128]
    - [5, 12.949]
  - - [256, 128, 1, 3328]
    - [171, 7.895]
  - - [6784, 2368, 1, 256]
    - [33, 56.062]
  - - [5888, 128, 1, 128]
    - [305, 10.403]
  - - [4288, 1856, 1, 256]
    - [184, 47.624]
  - - [1856, 256, 1, 3328]
    - [132, 60.427]
  - - [1856, 2944, 1, 256]
    - [63, 48.686]
  - - [5056, 1024, 1, 128]
    - [5, 29.647]
  - - [64, 5888, 1, 1280]
    - [5, 29.22]
  - - [1760, 7133, 1, 1760]
    - [33, 85.266]
  - - [6784, 256, 1, 128]
    - [302, 17.554]
  - - [5888, 704, 1, 128]
    - [26, 29.758]
  - - [6784, 64, 1, 128]
    - [277, 7.206]
  - - [1024, 4288, 1, 1280]
    - [93, 70.209]
  - - [2368, 5056, 1, 3328]
    - [58, 87.171]
  - - [448, 4, 1, 128]
    - [217, 0.028]
  - - [4, 256, 1, 3328]
    - [217, 0.341]
  - - [4288, 1024, 1, 3328]
    - [306, 81.68]
  - - [1024, 5056, 1, 3328]
    - [85, 80.651]
  - - [1024, 1856, 1, 3328]
    - [293, 79.235]
  - - [704, 704, 1, 1280]
    - [92, 30.043]
  - - [128, 2368, 1, 1280]
    - [138, 24.858]
  - - [1408, 128, 1, 3328]
    - [100, 25.603]
  - - [3584, 256, 1, 1280]
    - [145, 48.527]
  - - [4, 128, 1, 128]
    - [193, 0.008]
  - - [704, 6784, 1, 128]
    - [307, 29.831]
  - - [3584, 128, 1, 1280]
    - [262, 37.272]
  - - [4, 256, 1, 1280]
    - [217, 0.146]
  - - [128, 704, 1, 3328]
    - [49, 15.352]
  - - [4288, 6784, 1, 256]
    - [308, 64.777]
  - - [3584, 2944, 1, 3328]
    - [65, 90.329]
  - - [128, 1856, 1, 256]
    - [71, 6.248]
  - - [64, 4288, 1, 256]
    - [29, 7.122]
  - - [4, 3584, 1, 3328]
    - [309, 2.69]
  - - [64, 4, 1, 3328]
    - [137, 0.081]
  - - [4, 64, 1, 3328]
    - [30, 0.075]
  - - [5888, 2944, 1, 256]
    - [118, 61.122]
  - - [2368, 6784, 1, 128]
    - [150, 42.274]
  - - [448, 4288, 1, 1280]
    - [64, 67.245]
  - - [448, 1856, 1, 3328]
    - [241, 51.863]
  - - [4, 1024, 1, 256]
    - [117, 0.132]
  - - [5056, 4288, 1, 256]
    - [178, 60.401]
  - - [1024, 448, 1, 256]
    - [27, 11.569]
  - - [1024, 3584, 1, 256]
    - [5, 40.068]
  - - [2944, 128, 1, 1280]
    - [247, 30.659]
  - - [1856, 5056, 1, 128]
    - [69, 34.542]
  - - [64, 256, 1, 256]
    - [34, 0.532]
  - - [1408, 4, 1, 128]
    - [38, 0.092]
  - - [128, 2368, 1, 128]
    - [72, 4.061]
  - - [256, 704, 1, 1280]
    - [276, 14.738]
  - - [64, 2368, 1, 128]
    - [23, 2.521]
  - - [6784, 6784, 1, 3328]
    - [58, 94.629]
  - - [448, 5888, 1, 1280]
    - [5, 62.256]
  - - [5056, 448, 1, 128]
    - [145, 19.163]
  - - [3584, 2944, 1, 128]
    - [44, 38.328]
  - - [6784, 256, 1, 1280]
    - [5, 57.387]
  - - [256, 2944, 1, 1280]
    - [126, 45.973]
  - - [64, 4288, 1, 128]
    - [310, 4.112]
  - - [2368, 5888, 1, 3328]
    - [41, 88.47]
  - - [4, 64, 1, 256]
    - [284, 0.008]
  - - [704, 1024, 1, 3328]
    - [50, 45.773]
  - - [2368, 1856, 1, 1280]
    - [55, 72.173]
  - - [128, 448, 1, 128]
    - [193, 0.891]
  - - [128, 6784, 1, 256]
    - [81, 18.637]
  - - [3584, 4288, 1, 128]
    - [271, 36.771]
  - - [64, 448, 1, 128]
    - [29, 0.499]
  - - [5888, 4288, 1, 3328]
    - [96, 91.447]
  - - [2368, 704, 1, 256]
    - [12, 29.976]
  - - [256, 1856, 1, 3328]
    - [60, 54.236]
  - - [1856, 128, 1, 256]
    - [23, 6.676]
  - - [6784, 128, 1, 128]
    - [311, 12.157]
  - - [3584, 1408, 1, 128]
    - [55, 32.452]
  - - [1856, 5056, 1, 1280]
    - [82, 79.761]
  - - [2944, 1024, 1, 1280]
    - [128, 59.381]
  - - [5056, 4, 1, 256]
    - [312, 0.663]
  - - [3584, 5888, 1, 3328]
    - [58, 92.183]
  - - [2368, 4288, 1, 256]
    - [64, 49.141]
  - - [1024, 2368, 1, 3328]
    - [313, 77.409]
  - - [64, 704, 1, 3328]
    - [314, 9.173]
  - - [704, 1408, 1, 256]
    - [213, 18.427]
  - - [6784, 1856, 1, 3328]
    - [181, 88.658]
  - - [1024, 2944, 1, 128]
    - [93, 25.206]
  - - [1024, 3584, 1, 1280]
    - [278, 70.357]
  - - [4288, 5888, 1, 3328]
    - [64, 93.146]
  - - [4288, 4, 1, 3328]
    - [0, 2.971]
  - - [256, 1408, 1, 256]
    - [315, 10.434]
  - - [448, 2944, 1, 1280]
    - [5, 51.831]
  - - [4, 5888, 1, 128]
    - [61, 0.347]
  - - [1024, 2944, 1, 3328]
    - [233, 77.553]
  - - [3584, 6784, 1, 256]
    - [122, 64.226]
  - - [256, 6784, 1, 1280]
    - [81, 57.364]
  - - [1856, 3584, 1, 256]
    - [46, 49.54]
  - - [128, 448, 1, 3328]
    - [161, 10.878]
  - - [6784, 1856, 1, 128]
    - [149, 39.48]
  - - [4, 448, 1, 256]
    - [226, 0.063]
  - - [2944, 704, 1, 128]
    - [70, 20.943]
  - - [256, 5888, 1, 1280]
    - [89, 53.24]
  - - [4, 128, 1, 1280]
    - [147, 0.062]
  - - [4288, 6784, 1, 3328]
    - [67, 92.84]
  - - [6784, 128, 1, 1280]
    - [81, 50.888]
  - - [64, 1408, 1, 256]
    - [76, 2.425]
  - - [7680, 5481, 1, 2560]
    - [102, 92.926]
  - - [2368, 1408, 1, 128]
    - [51, 25.892]
  - - [1856, 448, 1, 256]
    - [51, 18.721]
  - - [1408, 1024, 1, 128]
    - [316, 16.49]
  - - [128, 64, 1, 128]
    - [226, 0.136]
  - - [6784, 3584, 1, 3328]
    - [64, 92.608]
  - - [2944, 64, 1, 3328]
    - [199, 25.835]
  - - [64, 64, 1, 128]
    - [147, 0.068]
  - - [2368, 5056, 1, 1280]
    - [41, 80.294]
  - - [64, 4, 1, 1280]
    - [196, 0.035]
  - - [1408, 2368, 1, 1280]
    - [295, 68.541]
  - - [128, 1408, 1, 1280]
    - [265, 16.458]
  - - [256, 64, 1, 3328]
    - [317, 4.73]
  - - [2944, 4288, 1, 128]
    - [33, 36.285]
  - - [2944, 2944, 1, 256]
    - [318, 49.234]
  - - [2944, 4, 1, 1280]
    - [147, 1.384]
  - - [5888, 4, 1, 256]
    - [319, 0.782]
  - - [6784, 256, 1, 256]
    - [129, 28.039]
  - - [256, 5056, 1, 3328]
    - [66, 63.368]
  - - [128, 4288, 1, 1280]
    - [69, 33.822]
  - - [5056, 1856, 1, 128]
    - [43, 36.365]
  - - [5888, 1408, 1, 256]
    - [67, 46.502]
  - - [128, 128, 1, 256]
    - [237, 0.469]
  - - [5056, 4, 1, 3328]
    - [0, 3.266]
  - - [4288, 3584, 1, 3328]
    - [64, 91.441]
  - - [448, 704, 1, 3328]
    - [295, 38.168]
  - - [448, 448, 1, 128]
    - [320, 3.02]
  - - [1024, 2368, 1, 1280]
    - [50, 57.236]
  - - [1856, 704, 1, 3328]
    - [321, 67.259]
  - - [4, 2368, 1, 128]
    - [61, 0.165]
  - - [5888, 6784, 1, 3328]
    - [58, 94.208]
  - - [704, 4288, 1, 1280]
    - [62, 57.163]
  - - [704, 256, 1, 256]
    - [163, 5.275]
  - - [6784, 448, 1, 3328]
    - [19, 77.429]
  - - [4288, 1024, 1, 128]
    - [322, 28.357]
  - - [49, 512, 128, 2048]
    - [203, 52.803]
  - - [196, 256, 256, 1024]
    - [294, 62.035]
  - - [784, 512, 256, 128]
    - [323, 57.594]
  - - [49, 2048, 128, 512]
    - [172, 46.353]
  - - [784, 128, 128, 512]
    - [82, 66.086]
  - - [3136, 256, 256, 64]
    - [324, 37.785]
  - - [3136, 64, 128, 64]
    - [325, 24.832]
  - - [49, 2048, 256, 512]
    - [122, 51.432]
  - - [784, 128, 256, 512]
    - [97, 75.176]
  - - [196, 256, 128, 1024]
    - [326, 56.114]
  - - [3136, 64, 128, 256]
    - [12, 54.507]
  - - [3136, 256, 128, 64]
    - [327, 35.579]
  - - [784, 512, 128, 128]
    - [170, 54.432]
  - - [3136, 64, 256, 256]
    - [218, 57.89]
  - - [3136, 64, 256, 64]
    - [182, 28.453]
  - - [196, 1024, 128, 256]
    - [230, 50.682]
  - - [49, 512, 256, 2048]
    - [328, 57.593]
  - - [196, 1024, 256, 256]
    - [329, 55.822]
  - - [5329, 160, 64, 64]
    - [330, 29.813]
  - - [1225, 384, 64, 192]
    - [59, 55.141]
  - - [289, 1024, 64, 256]
    - [41, 52.313]
  - - [64, 1536, 64, 384]
    - [69, 43.941]
  - - [1225, 384, 64, 64]
    - [331, 29.693]
  - - [1225, 384, 64, 96]
    - [93, 37.583]
  - - [64, 1536, 64, 256]
    - [69, 45.755]
  - - [289, 1024, 64, 384]
    - [144, 61.143]
  - - [289, 1024, 64, 192]
    - [220, 45.444]
  - - [289, 1024, 64, 128]
    - [153, 35.959]
  - - [4096, 1024, 1, 2984]
    - [332, 83.66]
  - - [1024, 4096, 1, 3437]
    - [272, 83.338]
  - - [1024, 4096, 1, 3235]
    - [149, 82.068]
  - - [4096, 1024, 1, 4032]
    - [259, 84.717]
  - - [1024, 4096, 1, 3334]
    - [333, 83.794]
  - - [4096, 1024, 1, 3288]
    - [153, 84.154]
  - - [1024, 4096, 1, 3515]
    - [259, 84.888]
  - - [4096, 1024, 1, 3437]
    - [9, 83.217]
  - - [1024, 4096, 1, 3259]
    - [115, 83.473]
  - - [1024, 4096, 1, 3384]
    - [3, 82.072]
  - - [64, 92, 688, 92]
    - [23, 16.763]
  - - [4096, 1024, 1, 3458]
    - [35, 81.211]
  - - [1024, 4096, 1, 3412]
    - [334, 82.086]
  - - [1024, 4096, 1, 3529]
    - [260, 83.719]
  - - [1024, 4096, 1, 4032]
    - [115, 85.525]
  - - [4096, 1024, 1, 3999]
    - [333, 84.518]
  - - [1024, 4096, 1, 3079]
    - [259, 82.446]
  - - [1024, 4096, 1, 3876]
    - [149, 84.503]
  - - [1024, 4096, 1, 3450]
    - [74, 82.924]
  - - [1024, 4096, 1, 3256]
    - [102, 83.422]
  - - [4096, 1024, 1, 3403]
    - [335, 82.174]
  - - [1024, 1024, 1, 3975]
    - [336, 53.604]
  - - [1024, 4096, 1, 3359]
    - [141, 81.751]
  - - [4096, 1024, 1, 3549]
    - [337, 83.879]
  - - [4096, 1024, 1, 3176]
    - [338, 81.768]
  - - [1024, 4096, 1, 3504]
    - [102, 83.487]
  - - [4096, 1024, 1, 3314]
    - [339, 83.503]
  - - [4096, 1024, 1, 3183]
    - [340, 81.57]
  - - [1024, 4096, 1, 3209]
    - [336, 82.741]
  - - [1024, 4096, 1, 3720]
    - [341, 83.577]
  - - [1024, 4096, 1, 3859]
    - [342, 84.659]
  - - [1024, 33708, 1, 4059]
    - [44, 94.189]
  - - [64, 123, 528, 123]
    - [343, 20.823]
  - - [4096, 1024, 1, 3477]
    - [59, 83.564]
  - - [4096, 1024, 1, 3233]
    - [228, 83.487]
  - - [4096, 1024, 1, 3409]
    - [152, 81.01]
  - - [4096, 1024, 1, 3564]
    - [331, 83.087]
  - - [64, 102, 624, 100]
    - [344, 17.794]
  - - [4096, 1024, 1, 3190]
    - [104, 83.229]
  - - [64, 112, 576, 111]
    - [131, 17.13]
  - - [1024, 4096, 1, 3288]
    - [17, 83.026]
  - - [4096, 1024, 1, 3451]
    - [228, 83.051]
  - - [1024, 4096, 1, 3348]
    - [342, 83.18]
  - - [64, 102, 624, 102]
    - [23, 17.617]
  - - [1024, 4096, 1, 3465]
    - [102, 83.859]
  - - [1024, 33708, 1, 4032]
    - [39, 94.073]
  - - [1024, 33708, 1, 3840]
    - [74, 94.313]
  - - [4096, 1024, 1, 3391]
    - [35, 83.501]
  - - [1024, 4096, 1, 3530]
    - [130, 82.526]
  - - [4096, 1024, 1, 3209]
    - [259, 81.127]
  - - [1024, 4096, 1, 3457]
    - [345, 83.647]
  - - [1024, 4096, 1, 3386]
    - [273, 83.436]
  - - [4096, 1024, 1, 3350]
    - [332, 82.965]
  - - [1024, 4096, 1, 3184]
    - [346, 81.92]
  - - [1024, 4096, 1, 3093]
    - [272, 81.277]
  - - [64, 133, 480, 135]
    - [23, 21.529]
  - - [1024, 4096, 1, 3400]
    - [153, 82.354]
  - - [1024, 1024, 1, 4026]
    - [158, 54.51]
  - - [1024, 4096, 1, 3214]
    - [259, 82.813]
  - - [4096, 1024, 1, 3406]
    - [333, 82.283]
  - - [1024, 4096, 1, 3565]
    - [272, 83.742]
  - - [4096, 1024, 1, 3536]
    - [347, 83.499]
  - - [1024, 4096, 1, 3183]
    - [345, 82.223]
  - - [1024, 4096, 1, 3462]
    - [345, 83.469]
  - - [4096, 1024, 1, 3130]
    - [348, 81.248]
  - - [4096, 1024, 1, 3381]
    - [349, 82.812]
  - - [4096, 1024, 1, 3298]
    - [350, 83.172]
  - - [1024, 4096, 1, 3292]
    - [351, 83.705]
  - - [4096, 1024, 1, 3289]
    - [288, 82.717]
  - - [64, 160, 400, 159]
    - [23, 25.232]
  - - [1024, 4096, 1, 3379]
    - [352, 80.991]
  - - [1024, 4096, 1, 3990]
    - [339, 84.608]
  - - [1024, 4096, 1, 3540]
    - [353, 83.799]
  - - [4096, 1024, 1, 3412]
    - [354, 82.675]
  - - [1024, 1024, 1, 3780]
    - [339, 54.104]
  - - [1024, 4096, 1, 3555]
    - [333, 84.178]
  - - [1024, 4096, 1, 3518]
    - [158, 84.43]
  - - [4096, 1024, 1, 3189]
    - [355, 82.139]
  - - [1024, 4096, 1, 3298]
    - [338, 83.129]
  - - [4096, 1024, 1, 3072]
    - [347, 82.729]
  - - [1024, 4096, 1, 3393]
    - [340, 83.903]
  - - [1024, 4096, 1, 3207]
    - [273, 82.512]
  - - [64, 228, 272, 232]
    - [94, 30.196]
  - - [64, 23, 2720, 23]
    - [356, 4.667]
  - - [4096, 1024, 1, 3487]
    - [141, 83.117]
  - - [1024, 1024, 1, 3822]
    - [228, 52.141]
  - - [64, 77, 816, 77]
    - [356, 15.025]
  - - [4096, 1024, 1, 3431]
    - [59, 82.443]
  - - [4096, 1024, 1, 3378]
    - [354, 81.435]
  - - [4096, 1024, 1, 3529]
    - [336, 82.689]
  - - [4096, 1024, 1, 3460]
    - [141, 82.774]
  - - [1024, 4096, 1, 3336]
    - [339, 83.95]
  - - [1024, 4096, 1, 3501]
    - [273, 84.046]
  - - [64, 159, 400, 159]
    - [50, 23.048]
  - - [1024, 4096, 1, 3584]
    - [255, 83.944]
  - - [64, 135, 480, 134]
    - [23, 21.253]
  - - [64, 99, 624, 99]
    - [131, 15.999]
  - - [4096, 1024, 1, 2499]
    - [228, 80.732]
  - - [1024, 1024, 1, 3942]
    - [205, 51.842]
  - - [4096, 1024, 1, 3352]
    - [347, 81.237]
  - - [1024, 4096, 1, 3543]
    - [273, 83.111]
  - - [1024, 4096, 1, 3476]
    - [357, 83.026]
  - - [1024, 33708, 1, 3822]
    - [33, 93.891]
  - - [1024, 4096, 1, 3436]
    - [358, 83.139]
  - - [1024, 1024, 1, 3861]
    - [59, 52.769]
  - - [1024, 1024, 1, 4000]
    - [152, 53.464]
  - - [1024, 4096, 1, 3594]
    - [333, 84.803]
  - - [4096, 1024, 1, 3514]
    - [339, 84.069]
  - - [1024, 4096, 1, 3064]
    - [350, 83.869]
  - - [4096, 1024, 1, 3371]
    - [152, 82.821]
  - - [4096, 1024, 1, 3558]
    - [288, 83.474]
  - - [4096, 1024, 1, 3517]
    - [104, 83.304]
  - - [4096, 1024, 1, 3144]
    - [338, 81.871]
  - - [1024, 4096, 1, 3312]
    - [336, 83.29]
  - - [4096, 1024, 1, 3079]
    - [148, 80.323]
  - - [1024, 4096, 1, 3415]
    - [59, 82.219]
  - - [1024, 4096, 1, 3221]
    - [104, 83.62]
  - - [1024, 4096, 1, 3978]
    - [102, 83.889]
  - - [4096, 1024, 1, 3876]
    - [338, 85.031]
  - - [1024, 4096, 1, 3528]
    - [149, 83.364]
  - - [1024, 4096, 1, 3181]
    - [341, 83.01]
  - - [4096, 1024, 1, 3445]
    - [153, 82.736]
  - - [4096, 1024, 1, 3450]
    - [272, 82.666]
  - - [4096, 1024, 1, 3377]
    - [339, 83.485]
  - - [1024, 4096, 1, 3532]
    - [350, 83.39]
  - - [1024, 33708, 1, 3944]
    - [74, 94.055]
  - - [4096, 1024, 1, 3483]
    - [359, 83.612]
  - - [1024, 4096, 1, 3358]
    - [44, 84.179]
  - - [4096, 1024, 1, 3464]
    - [339, 83.471]
  - - [4096, 1024, 1, 3282]
    - [332, 84.22]
  - - [4096, 1024, 1, 3256]
    - [332, 82.058]
  - - [1024, 4096, 1, 3057]
    - [339, 83.479]
  - - [4096, 1024, 1, 3481]
    - [141, 84.011]
  - - [4096, 1024, 1, 3340]
    - [272, 83.338]
  - - [1024, 1024, 1, 3870]
    - [53, 51.462]
  - - [1024, 4096, 1, 3273]
    - [336, 83.098]
  - - [64, 65, 992, 65]
    - [360, 12.483]
  - - [4096, 1024, 1, 3392]
    - [339, 81.665]
  - - [4096, 1024, 1, 3337]
    - [59, 83.296]
  - - [4096, 1024, 1, 3359]
    - [288, 80.751]
  - - [4096, 1024, 1, 3498]
    - [9, 84.021]
  - - [4096, 1024, 1, 3169]
    - [359, 81.983]
  - - [1024, 33708, 1, 3859]
    - [33, 93.919]
  - - [64, 19, 3264, 19]
    - [361, 4.316]
  - - [1024, 4096, 1, 3103]
    - [350, 81.161]
  - - [4096, 1024, 1, 3900]
    - [259, 83.88]
  - - [1024, 4096, 1, 3442]
    - [341, 83.365]
  - - [1024, 4096, 1, 3248]
    - [339, 84.263]
  - - [1024, 4096, 1, 3351]
    - [104, 83.175]
  - - [4096, 1024, 1, 3593]
    - [288, 83.805]
  - - [1024, 4096, 1, 3780]
    - [362, 84.421]
  - - [64, 133, 480, 133]
    - [50, 20.661]
  - - [1024, 33708, 1, 3681]
    - [74, 93.582]
  - - [4096, 1024, 1, 3374]
    - [363, 81.582]
  - - [1024, 4096, 1, 3557]
    - [359, 83.479]
  - - [4096, 1024, 1, 3906]
    - [359, 82.786]
  - - [4096, 1024, 1, 3504]
    - [228, 82.403]
  - - [1024, 4096, 1, 3270]
    - [359, 83.129]
  - - [4096, 1024, 1, 3098]
    - [340, 81.975]
  - - [64, 232, 272, 232]
    - [94, 33.935]
  - - [4096, 1024, 1, 3216]
    - [288, 84.073]
  - - [64, 148, 432, 148]
    - [108, 25.083]
  - - [1024, 4096, 1, 3550]
    - [336, 84.328]
  - - [4096, 1024, 1, 3449]
    - [35, 82.742]
  - - [1024, 4096, 1, 3403]
    - [8, 82.089]
  - - [1024, 4096, 1, 3523]
    - [341, 83.676]
  - - [1024, 4096, 1, 3486]
    - [338, 81.251]
  - - [1024, 4096, 1, 3564]
    - [350, 83.845]
  - - [1024, 33708, 1, 4005]
    - [74, 94.006]
  - - [4096, 1024, 1, 3296]
    - [259, 83.989]
  - - [1024, 4096, 1, 3263]
    - [273, 83.184]
  - - [64, 25, 2512, 25]
    - [364, 5.043]
  - - [1024, 4096, 1, 3130]
    - [321, 82.225]
  - - [1024, 4096, 1, 3295]
    - [152, 83.523]
  - - [1024, 33708, 1, 3925]
    - [74, 94.212]
  - - [1024, 4096, 1, 3378]
    - [104, 82.571]
  - - [4096, 1024, 1, 3720]
    - [332, 84.181]
  - - [4096, 1024, 1, 3399]
    - [252, 83.189]
  - - [4096, 1024, 1, 3543]
    - [255, 82.735]
  - - [64, 9, 6544, 9]
    - [365, 2.203]
  - - [4096, 1024, 1, 3497]
    - [102, 83.397]
  - - [4096, 1024, 1, 3594]
    - [259, 83.904]
  - - [1024, 4096, 1, 3144]
    - [153, 81.472]
  - - [1024, 4096, 1, 3975]
    - [351, 84.893]
  - - [4096, 1024, 1, 3205]
    - [102, 82.623]
  - - [1024, 33708, 1, 3995]
    - [118, 94.188]
  - - [1024, 4096, 1, 3392]
    - [255, 82.233]
  - - [1024, 4096, 1, 3055]
    - [336, 82.928]
  - - [1024, 4096, 1, 4026]
    - [341, 84.446]
  - - [4096, 1024, 1, 3557]
    - [339, 83.597]
  - - [4096, 1024, 1, 3515]
    - [102, 82.341]
  - - [4096, 1024, 1, 3486]
    - [141, 83.076]
  - - [4096, 1024, 1, 3457]
    - [332, 83.105]
  - - [1024, 4096, 1, 3511]
    - [158, 83.929]
  - - [4096, 1024, 1, 3138]
    - [340, 81.476]
  - - [1024, 4096, 1, 3339]
    - [33, 83.242]
  - - [1024, 4096, 1, 3939]
    - [17, 83.875]
  - - [4096, 1024, 1, 3500]
    - [347, 84.422]
  - - [4096, 1024, 1, 3395]
    - [252, 82.38]
  - - [4096, 1024, 1, 4020]
    - [339, 85.293]
  - - [4096, 1024, 1, 3942]
    - [8, 83.739]
  - - [1024, 1024, 1, 4032]
    - [77, 53.59]
  - - [4096, 1024, 1, 3349]
    - [339, 84.551]
  - - [1024, 4096, 1, 3322]
    - [350, 83.836]
  - - [4096, 1024, 1, 3452]
    - [337, 81.553]
  - - [1024, 4096, 1, 3417]
    - [158, 82.415]
  - - [1024, 1024, 1, 4012]
    - [357, 52.458]
  - - [1024, 4096, 1, 3526]
    - [339, 84.369]
  - - [4096, 1024, 1, 3485]
    - [347, 83.065]
  - - [1024, 1024, 1, 3681]
    - [272, 52.507]
  - - [4096, 1024, 1, 3303]
    - [288, 83.254]
  - - [4096, 1024, 1, 3344]
    - [288, 83.734]
  - - [1024, 4096, 1, 3479]
    - [17, 83.642]
  - - [4096, 1024, 1, 3300]
    - [59, 84.029]
  - - [1024, 4096, 1, 3439]
    - [333, 83.196]
  - - [4096, 1024, 1, 3280]
    - [331, 83.287]
  - - [1024, 4096, 1, 3245]
    - [259, 82.77]
  - - [1024, 4096, 1, 3328]
    - [260, 83.959]
  - - [4096, 1024, 1, 3418]
    - [153, 83.441]
  - - [1024, 4096, 1, 3493]
    - [59, 84.761]
  - - [1024, 4096, 1, 3500]
    - [115, 84.658]
  - - [1024, 4096, 1, 3166]
    - [259, 82.636]
  - - [4096, 1024, 1, 3126]
    - [355, 81.947]
  - - [1024, 4096, 1, 3277]
    - [353, 83.301]
  - - [1024, 4096, 1, 3315]
    - [259, 83.64]
  - - [1024, 1024, 1, 3927]
    - [115, 54.077]
  - - [1024, 4096, 1, 3414]
    - [118, 82.794]
  - - [4096, 1024, 1, 3531]
    - [228, 82.901]
  - - [4096, 1024, 1, 3484]
    - [355, 82.324]
  - - [1024, 4096, 1, 3180]
    - [59, 82.303]
  - - [4096, 1024, 1, 3360]
    - [102, 83.789]
  - - [1024, 33708, 1, 3990]
    - [39, 93.802]
  - - [4096, 1024, 1, 3466]
    - [102, 83.498]
  - - [1024, 4096, 1, 3428]
    - [59, 82.953]
  - - [1024, 4096, 1, 3137]
    - [104, 82.043]
  - - [4096, 1024, 1, 4059]
    - [336, 83.67]
  - - [1024, 4096, 1, 3353]
    - [333, 83.64]
  - - [1024, 4096, 1, 3942]
    - [159, 83.412]
  - - [4096, 1024, 1, 3506]
    - [104, 84.214]
  - - [1024, 1024, 1, 3894]
    - [250, 50.91]
  - - [4096, 1024, 1, 3508]
    - [349, 82.229]
  - - [64, 132, 480, 135]
    - [366, 23.132]
  - - [4096, 1024, 1, 3956]
    - [357, 84.342]
  - - [64, 7, 8192, 7]
    - [120, 1.374]
  - - [1024, 4096, 1, 3272]
    - [260, 83.338]
  - - [1024, 4096, 1, 3443]
    - [367, 83.69]
  - - [1024, 4096, 1, 3375]
    - [345, 83.574]
  - - [1024, 4096, 1, 3525]
    - [331, 83.167]
  - - [4096, 1024, 1, 3472]
    - [357, 83.52]
  - - [1024, 4096, 1, 3520]
    - [339, 83.145]
  - - [4096, 1024, 1, 3322]
    - [338, 83.58]
  - - [4096, 1024, 1, 3387]
    - [251, 81.218]
  - - [64, 8, 7280, 8]
    - [120, 1.806]
  - - [1024, 33708, 1, 3939]
    - [149, 94.052]
  - - [4096, 1024, 1, 3345]
    - [259, 81.061]
  - - [4096, 1024, 1, 2967]
    - [8, 83.192]
  - - [1024, 4096, 1, 3453]
    - [159, 82.893]
  - - [1024, 4096, 1, 3640]
    - [153, 83.809]
  - - [4096, 1024, 1, 3291]
    - [272, 83.818]
  - - [1024, 4096, 1, 3350]
    - [359, 84.305]
  - - [4096, 1024, 1, 3417]
    - [272, 82.226]
  - - [64, 135, 480, 135]
    - [194, 23.841]
  - - [1024, 4096, 1, 3467]
    - [152, 83.335]
  - - [1024, 4096, 1, 3491]
    - [17, 83.129]
  - - [1024, 4096, 1, 3822]
    - [333, 83.933]
  - - [4096, 1024, 1, 3292]
    - [228, 83.048]
  - - [1024, 4096, 1, 3231]
    - [341, 81.457]
  - - [1024, 4096, 1, 3364]
    - [158, 83.972]
  - - [1024, 4096, 1, 3995]
    - [359, 84.614]
  - - [1024, 4096, 1, 3545]
    - [333, 84.528]
  - - [1024, 1024, 1, 3876]
    - [368, 53.439]
  - - [1024, 4096, 1, 3186]
    - [255, 82.507]
  - - [4096, 1024, 1, 3432]
    - [115, 83.116]
  - - [64, 84, 752, 85]
    - [369, 16.636]
  - - [4096, 1024, 1, 3367]
    - [59, 83.768]
  - - [4096, 1024, 1, 3503]
    - [332, 83.419]
  - - [1024, 4096, 1, 3095]
    - [259, 82.822]
  - - [4096, 1024, 1, 3465]
    - [348, 83.018]
  - - [1024, 4096, 1, 3402]
    - [272, 82.2]
  - - [4096, 1024, 1, 3140]
    - [338, 81.413]
  - - [1024, 1024, 1, 4050]
    - [205, 54.066]
  - - [4096, 1024, 1, 3424]
    - [259, 83.504]
  - - [4096, 1024, 1, 3257]
    - [252, 81.956]
  - - [4096, 1024, 1, 2917]
    - [35, 82.32]
  - - [1024, 33708, 1, 3640]
    - [74, 94.152]
  - - [1024, 4096, 1, 3456]
    - [340, 81.018]
  - - [1024, 4096, 1, 3014]
    - [341, 82.432]
  - - [4096, 1024, 1, 3372]
    - [102, 81.583]
  - - [64, 132, 480, 132]
    - [218, 22.48]
  - - [1024, 4096, 1, 3294]
    - [350, 83.35]
  - - [4096, 1024, 1, 3446]
    - [351, 80.958]
  - - [1024, 4096, 1, 3389]
    - [370, 81.579]
  - - [4096, 1024, 1, 3259]
    - [355, 82.229]
  - - [4096, 1024, 1, 3544]
    - [332, 84.514]
  - - [4096, 1024, 1, 3479]
    - [288, 82.309]
  - - [4096, 1024, 1, 3542]
    - [255, 83.188]
  - - [4096, 1024, 1, 3321]
    - [332, 83.542]
  - - [1024, 4096, 1, 3147]
    - [288, 81.5]
  - - [1024, 4096, 1, 3944]
    - [8, 83.835]
  - - [4096, 1024, 1, 3870]
    - [350, 83.939]
  - - [1024, 4096, 1, 3308]
    - [273, 83.722]
  - - [4096, 1024, 1, 3401]
    - [349, 82.451]
  - - [1024, 4096, 1, 3395]
    - [272, 82.441]
  - - [64, 99, 624, 102]
    - [23, 17.752]
  - - [1024, 4096, 1, 3563]
    - [333, 83.523]
  - - [1024, 33708, 1, 3870]
    - [118, 93.772]
  - - [4096, 1024, 1, 3494]
    - [338, 84.491]
  - - [1024, 4096, 1, 3271]
    - [259, 83.285]
  - - [1024, 33708, 1, 3910]
    - [74, 93.98]
  - - [1024, 4096, 1, 3287]
    - [359, 83.506]
  - - [1024, 33708, 1, 3860]
    - [118, 93.968]
  - - [64, 143, 432, 148]
    - [50, 23.341]
  - - [1024, 1024, 1, 3584]
    - [368, 55.292]
  - - [64, 162, 400, 162]
    - [70, 27.281]
  - - [4096, 1024, 1, 3341]
    - [349, 81.116]
  - - [1024, 4096, 1, 3136]
    - [331, 82.854]
  - - [4096, 1024, 1, 3439]
    - [339, 82.693]
  - - [64, 148, 432, 147]
    - [70, 24.844]
  - - [1024, 4096, 1, 3751]
    - [339, 84.906]
  - - [1024, 4096, 1, 3301]
    - [342, 83.158]
  - - [4096, 1024, 1, 3468]
    - [104, 83.172]
  - - [1024, 4096, 1, 3416]
    - [35, 83.175]
  - - [4096, 1024, 1, 3163]
    - [336, 83.118]
  - - [1024, 4096, 1, 3230]
    - [333, 83.161]
  - - [1024, 4096, 1, 3581]
    - [351, 83.858]
  - - [1024, 1024, 1, 3960]
    - [153, 53.512]
  - - [4096, 1024, 1, 3463]
    - [35, 83.045]
  - - [1024, 4096, 1, 3478]
    - [342, 84.05]
  - - [4096, 1024, 1, 3262]
    - [35, 82.816]
  - - [1024, 4096, 1, 3438]
    - [156, 83.949]
  - - [1024, 4096, 1, 3244]
    - [149, 82.943]
  - - [1024, 4096, 1, 3445]
    - [371, 83.393]
  - - [4096, 1024, 1, 3328]
    - [288, 83.866]
  - - [1024, 4096, 1, 3492]
    - [8, 83.061]
  - - [4096, 1024, 1, 3211]
    - [372, 80.939]
  - - [1024, 4096, 1, 3910]
    - [339, 84.919]
  - - [1024, 4096, 1, 3314]
    - [272, 84.148]
  - - [4096, 1024, 1, 3859]
    - [357, 84.831]
  - - [4096, 1024, 1, 3383]
    - [359, 84.331]
  - - [1024, 4096, 1, 3409]
    - [373, 81.631]
  - - [1024, 4096, 1, 4020]
    - [260, 84.499]
  - - [4096, 1024, 1, 3530]
    - [333, 82.792]
  - - [4096, 1024, 1, 3411]
    - [348, 82.121]
  - - [1024, 4096, 1, 3566]
    - [273, 83.597]
  - - [4096, 1024, 1, 3493]
    - [357, 84.498]
  - - [4096, 1024, 1, 3184]
    - [153, 82.32]
  - - [1024, 4096, 1, 3072]
    - [158, 82.803]
  - - [1024, 4096, 1, 3431]
    - [351, 83.127]
  - - [4096, 1024, 1, 3306]
    - [331, 83.172]
  - - [1024, 4096, 1, 3352]
    - [374, 80.717]
  - - [4096, 1024, 1, 3295]
    - [104, 82.948]
  - - [64, 123, 528, 122]
    - [192, 22.842]
  - - [1024, 4096, 1, 3517]
    - [359, 83.97]
  - - [64, 102, 624, 101]
    - [360, 18.933]
  - - [4096, 1024, 1, 3426]
    - [332, 83.028]
  - - [4096, 1024, 1, 3385]
    - [340, 81.509]
  - - [1024, 1024, 1, 3978]
    - [375, 54.006]
  - - [4096, 1024, 1, 3572]
    - [331, 84.427]
  - - [4096, 1024, 1, 3459]
    - [333, 83.483]
  - - [1024, 4096, 1, 3374]
    - [333, 81.692]
  - - [4096, 1024, 1, 3166]
    - [349, 81.828]
  - - [4096, 1024, 1, 3093]
    - [347, 82.044]
  - - [4096, 1024, 1, 3523]
    - [338, 83.567]
  - - [4096, 1024, 1, 3413]
    - [336, 82.986]
  - - [1024, 4096, 1, 3996]
    - [102, 84.694]
  - - [1024, 4096, 1, 3452]
    - [74, 83.462]
  - - [4096, 1024, 1, 3232]
    - [288, 83.435]
  - - [4096, 1024, 1, 3400]
    - [376, 82.475]
  - - [4096, 1024, 1, 3334]
    - [59, 83.318]
  - - [1024, 4096, 1, 3345]
    - [359, 83.163]
  - - [1024, 4096, 1, 3538]
    - [339, 84.779]
  - - [1024, 4096, 1, 3466]
    - [333, 84.012]
  - - [4096, 1024, 1, 3315]
    - [259, 83.181]
  - - [4096, 1024, 1, 3214]
    - [9, 83.346]
  - - [1024, 33708, 1, 3900]
    - [74, 93.863]
  - - [64, 160, 400, 160]
    - [23, 27.478]
  - - [1024, 4096, 1, 3367]
    - [149, 83.392]
  - - [1024, 4096, 1, 2917]
    - [130, 81.258]
  - - [1024, 1024, 1, 3995]
    - [377, 52.001]
  - - [64, 132, 480, 134]
    - [5, 20.098]
  - - [1024, 4096, 1, 3544]
    - [359, 84.337]
  - - [4096, 1024, 1, 3414]
    - [337, 82.249]
  - - [4096, 1024, 1, 3565]
    - [9, 84.226]
  - - [1024, 4096, 1, 3512]
    - [130, 83.704]
  - - [1024, 4096, 1, 3191]
    - [152, 81.956]
  - - [64, 27, 2336, 27]
    - [378, 5.808]
  - - [1024, 4096, 1, 3289]
    - [118, 82.988]
  - - [4096, 1024, 1, 3290]
    - [339, 83.162]
  - - [1024, 4096, 1, 3211]
    - [59, 83.682]
  - - [1024, 33708, 1, 3969]
    - [74, 94.334]
  - - [4096, 1024, 1, 3566]
    - [102, 83.75]
  - - [64, 111, 576, 111]
    - [23, 17.028]
  - - [1024, 4096, 1, 3459]
    - [74, 83.096]
  - - [1024, 4096, 1, 3372]
    - [351, 82.927]
  - - [4096, 1024, 1, 3339]
    - [259, 82.091]
  - - [4096, 1024, 1, 3425]
    - [351, 82.3]
  - - [4096, 1024, 1, 3388]
    - [357, 83.421]
  - - [1024, 4096, 1, 3531]
    - [260, 83.948]
  - - [4096, 1024, 1, 3286]
    - [102, 83.408]
  - - [4096, 1024, 1, 3462]
    - [337, 82.64]
  - - [1024, 4096, 1, 3388]
    - [259, 82.514]
  - - [4096, 1024, 1, 3165]
    - [349, 82.186]
  - - [4096, 1024, 1, 3304]
    - [272, 84.284]
  - - [1024, 4096, 1, 2736]
    - [377, 80.935]
  - - [4096, 1024, 1, 3397]
    - [59, 82.056]
  - - [64, 38, 1680, 38]
    - [23, 8.645]
  - - [1024, 4096, 1, 3311]
    - [152, 84.145]
  - - [1024, 4096, 1, 3394]
    - [350, 83.833]
  - - [4096, 1024, 1, 2736]
    - [357, 81.931]
  - - [1024, 4096, 1, 3559]
    - [336, 82.989]
  - - [4096, 1024, 1, 3180]
    - [350, 82.358]
  - - [1024, 4096, 1, 3480]
    - [104, 83.431]
  - - [4096, 1024, 1, 3318]
    - [259, 83.656]
  - - [4096, 1024, 1, 3213]
    - [357, 81.906]
  - - [1024, 4096, 1, 3286]
    - [152, 83.739]
  - - [4096, 1024, 1, 3471]
    - [357, 82.624]
  - - [1024, 4096, 1, 3381]
    - [149, 83.699]
  - - [64, 100, 624, 100]
    - [23, 17.595]
  - - [4096, 1024, 1, 3502]
    - [339, 84.198]
  - - [64, 16, 3840, 16]
    - [379, 3.487]
  - - [1024, 4096, 1, 3552]
    - [3, 84.311]
  - - [4096, 1024, 1, 3519]
    - [332, 82.53]
  - - [1024, 4096, 1, 3300]
    - [339, 83.749]
  - - [1024, 4096, 1, 3419]
    - [20, 81.757]
  - - [4096, 1024, 1, 4030]
    - [352, 83.085]
  - - [4096, 1024, 1, 3976]
    - [350, 84.891]
  - - [1024, 4096, 1, 3473]
    - [104, 83.281]
  - - [1024, 1024, 1, 3977]
    - [200, 53.609]
  - - [4096, 1024, 1, 3428]
    - [59, 81.069]
  - - [1024, 4096, 1, 3433]
    - [228, 83.097]
  - - [4096, 1024, 1, 3534]
    - [8, 83.41]
  - - [4096, 1024, 1, 3461]
    - [59, 83.773]
  - - [4096, 1024, 1, 3681]
    - [153, 82.866]
  - - [4096, 1024, 1, 3495]
    - [357, 82.251]
  - - [4096, 1024, 1, 3351]
    - [332, 83.856]
  - - [1024, 4096, 1, 4059]
    - [260, 85.416]
  - - [4096, 1024, 1, 3990]
    - [272, 83.268]
  - - [1024, 4096, 1, 3325]
    - [59, 83.397]
  - - [1024, 4096, 1, 3408]
    - [342, 82.869]
  - - [64, 59, 1088, 59]
    - [380, 11.272]
  - - [4096, 1024, 1, 3394]
    - [354, 83.204]
  - - [1024, 4096, 1, 3573]
    - [345, 83.581]
  - - [4096, 1024, 1, 3386]
    - [335, 80.946]
  - - [4096, 1024, 1, 3540]
    - [338, 83.06]
  - - [1024, 4096, 1, 3182]
    - [188, 81.473]
  - - [1024, 4096, 1, 3430]
    - [362, 83.123]
  - - [1024, 4096, 1, 3236]
    - [39, 83.28]
  - - [4096, 1024, 1, 2977]
    - [336, 81.414]
  - - [1024, 4096, 1, 3355]
    - [59, 83.036]
  - - [4096, 1024, 1, 3139]
    - [252, 81.896]
  - - [4096, 1024, 1, 3516]
    - [252, 82.441]
  - - [4096, 1024, 1, 3368]
    - [8, 80.99]
  - - [4096, 1024, 1, 3559]
    - [338, 83.459]
  - - [64, 11, 5456, 11]
    - [381, 2.208]
  - - [1024, 4096, 1, 3506]
    - [362, 83.591]
  - - [1024, 4096, 1, 3145]
    - [362, 81.459]
  - - [1024, 4096, 1, 3369]
    - [351, 83.394]
  - - [64, 112, 576, 112]
    - [151, 20.977]
  - - [4096, 1024, 1, 3522]
    - [35, 83.624]
  - - [1024, 33708, 1, 3894]
    - [74, 93.943]
  - - [64, 159, 400, 162]
    - [194, 26.535]
  - - [4096, 1024, 1, 3336]
    - [339, 82.957]
  - - [1024, 4096, 1, 3382]
    - [353, 82.928]
  - - [4096, 1024, 1, 3533]
    - [359, 82.492]
  - - [4096, 1024, 1, 4050]
    - [59, 85.037]
  - - [4096, 1024, 1, 3480]
    - [259, 83.541]
  - - [1024, 4096, 1, 3344]
    - [333, 83.5]
  - - [64, 122, 528, 122]
    - [382, 19.708]
  - - [1024, 4096, 1, 3509]
    - [340, 83.584]
  - - [1024, 4096, 1, 3956]
    - [345, 84.186]
  - - [4096, 1024, 1, 3616]
    - [350, 84.201]
  - - [1024, 4096, 1, 3366]
    - [350, 83.763]
  - - [4096, 1024, 1, 2935]
    - [259, 81.454]
  - - [4096, 1024, 1, 3393]
    - [338, 82.797]
  - - [4096, 1024, 1, 3547]
    - [255, 83.225]
  - - [1024, 4096, 1, 3499]
    - [340, 84.701]
  - - [4096, 1024, 1, 3357]
    - [340, 81.354]
  - - [4096, 1024, 1, 3272]
    - [331, 83.178]
  - - [4096, 1024, 1, 3207]
    - [336, 82.813]
  - - [4096, 1024, 1, 3894]
    - [272, 84.585]
  - - [1024, 4096, 1, 3444]
    - [130, 83.827]
  - - [4096, 1024, 1, 3561]
    - [339, 83.497]
  - - [4096, 1024, 1, 3376]
    - [153, 81.612]
  - - [1024, 4096, 1, 3458]
    - [350, 83.256]
  - - [4096, 1024, 1, 3231]
    - [348, 81.28]
  - - [64, 228, 272, 228]
    - [218, 30.113]
  - - [1024, 4096, 1, 3505]
    - [345, 84.077]
  - - [4096, 1024, 1, 3277]
    - [347, 82.317]
  - - [64, 21, 2976, 21]
    - [383, 4.303]
  - - [1024, 4096, 1, 3391]
    - [339, 84.152]
  - - [64, 32, 1984, 32]
    - [384, 7.585]
  - - [1024, 4096, 1, 3536]
    - [188, 83.278]
  - - [1024, 4096, 1, 3063]
    - [44, 82.562]
  - - [1024, 1024, 1, 3925]
    - [339, 55.121]
  - - [1024, 4096, 1, 3189]
    - [272, 82.368]
  - - [1024, 4096, 1, 2505]
    - [59, 80.862]
  - - [4096, 1024, 1, 3454]
    - [59, 82.251]
  - - [1024, 4096, 1, 3405]
    - [351, 82.457]
  - - [1024, 33708, 1, 4050]
    - [118, 94.362]
  - - [4096, 1024, 1, 3520]
    - [280, 82.748]
  - - [64, 93, 688, 93]
    - [385, 17.618]
  - - [1024, 4096, 1, 3487]
    - [153, 84.028]
  - - [1024, 4096, 1, 3558]
    - [153, 83.224]
  - - [4096, 1024, 1, 3297]
    - [336, 82.965]
  - - [1024, 4096, 1, 3483]
    - [59, 83.168]
  - - [1024, 1024, 1, 3956]
    - [333, 54.093]
  - - [1024, 33708, 1, 3751]
    - [33, 93.824]
  - - [4096, 1024, 1, 3380]
    - [337, 81.935]
  - - [1024, 4096, 1, 3380]
    - [152, 81.773]
  - - [1024, 4096, 1, 3396]
    - [159, 82.25]
  - - [1024, 4096, 1, 3497]
    - [336, 83.447]
  - - [1024, 4096, 1, 3502]
    - [339, 84.189]
  - - [1024, 1024, 1, 3976]
    - [17, 53.032]
  - - [1024, 4096, 1, 3138]
    - [362, 82.298]
  - - [4096, 1024, 1, 3939]
    - [156, 83.294]
  - - [1024, 4096, 1, 3303]
    - [351, 83.197]
  - - [64, 111, 576, 112]
    - [386, 19.747]
  - - [1024, 4096, 1, 3418]
    - [357, 82.283]
  - - [1024, 4096, 1, 3224]
    - [152, 83.721]
  - - [4096, 1024, 1, 3978]
    - [141, 84.125]
  - - [1024, 4096, 1, 3472]
    - [59, 84.95]
  - - [4096, 1024, 1, 3353]
    - [153, 81.02]
  - - [4096, 1024, 1, 3362]
    - [333, 83.711]
  - - [1024, 33708, 1, 3978]
    - [149, 94.2]
  - - [64, 100, 624, 102]
    - [387, 16.574]
  - - [1024, 4096, 1, 3432]
    - [130, 83.995]
  - - [1024, 4096, 1, 3139]
    - [8, 81.811]
  - - [1024, 4096, 1, 3341]
    - [339, 83.931]
  - - [1024, 4096, 1, 3494]
    - [59, 83.271]
  - - [1024, 4096, 1, 3969]
    - [362, 84.243]
  - - [1024, 4096, 1, 3163]
    - [388, 82.434]
  - - [1024, 1024, 1, 3955]
    - [340, 52.262]
  - - [4096, 1024, 1, 3405]
    - [115, 82.941]
  - - [1024, 1024, 1, 4030]
    - [59, 52.945]
  - - [4096, 1024, 1, 3453]
    - [336, 82.907]
  - - [1024, 4096, 1, 3411]
    - [339, 82.637]
  - - [1024, 4096, 1, 3527]
    - [359, 84.788]
  - - [4096, 1024, 1, 3474]
    - [359, 83.203]
  - - [1024, 4096, 1, 3572]
    - [35, 83.803]
  - - [4096, 1024, 1, 3293]
    - [115, 82.366]
  - - [4096, 1024, 1, 3247]
    - [333, 81.93]
  - - [64, 15, 4096, 15]
    - [383, 3.616]
  - - [1024, 4096, 1, 3425]
    - [59, 84.097]
  - - [1024, 4096, 1, 3354]
    - [115, 83.699]
  - - [4096, 1024, 1, 3382]
    - [338, 82.255]
  - - [4096, 1024, 1, 3236]
    - [255, 82.011]
  - - [1024, 4096, 1, 3519]
    - [255, 83.486]
  - - [4096, 1024, 1, 3354]
    - [8, 83.385]
  - - [4096, 1024, 1, 3501]
    - [357, 84.279]
  - - [1024, 1024, 1, 3906]
    - [375, 57.385]
  - - [4096, 1024, 1, 3266]
    - [339, 82.259]
  - - [64, 101, 624, 102]
    - [360, 18.624]
  - - [1024, 4096, 1, 3368]
    - [339, 84.064]
  - - [1024, 4096, 1, 4030]
    - [345, 84.427]
  - - [1024, 4096, 1, 3533]
    - [158, 84.174]
  - - [4096, 1024, 1, 3332]
    - [153, 83.1]
  - - [4096, 1024, 1, 3584]
    - [350, 84.093]
  - - [1024, 4096, 1, 3616]
    - [339, 84.097]
  - - [4096, 1024, 1, 3265]
    - [339, 83.579]
  - - [4096, 1024, 1, 3361]
    - [59, 82.922]
  - - [4096, 1024, 1, 3467]
    - [35, 84.149]
  - - [1024, 4096, 1, 3454]
    - [273, 83.05]
  - - [1024, 4096, 1, 3101]
    - [33, 83.231]
  - - [1024, 4096, 1, 3508]
    - [149, 85.087]
  - - [4096, 1024, 1, 3267]
    - [332, 83.941]
  - - [64, 54, 1184, 54]
    - [369, 10.031]
  - - [4096, 1024, 1, 3419]
    - [352, 82.839]
  - - [4096, 1024, 1, 3822]
    - [228, 84.398]
  - - [1024, 4096, 1, 3266]
    - [228, 82.919]
  - - [4096, 1024, 1, 3440]
    - [255, 82.806]
  - - [1024, 4096, 1, 3361]
    - [158, 82.834]
  - - [1024, 4096, 1, 3546]
    - [350, 84.66]
  - - [4096, 1024, 1, 3473]
    - [259, 82.557]
  - - [4096, 1024, 1, 3546]
    - [336, 83.287]
  - - [1024, 4096, 1, 3088]
    - [59, 82.654]
  - - [1024, 4096, 1, 3535]
    - [339, 82.334]
  - - [1024, 4096, 1, 3447]
    - [74, 83.042]
  - - [1024, 4096, 1, 3560]
    - [336, 82.961]
  - - [1024, 4096, 1, 3422]
    - [228, 81.882]
  - - [1024, 4096, 1, 3469]
    - [59, 82.531]
  - - [4096, 1024, 1, 3488]
    - [339, 84.031]
  - - [1024, 4096, 1, 3110]
    - [205, 81.095]
  - - [1024, 4096, 1, 3265]
    - [104, 83.388]
  - - [1024, 4096, 1, 3291]
    - [273, 83.726]
  - - [1024, 4096, 1, 3390]
    - [153, 82.865]
  - - [4096, 1024, 1, 3046]
    - [228, 82.789]
  - - [1024, 4096, 1, 3539]
    - [342, 84.022]
  - - [4096, 1024, 1, 3221]
    - [259, 80.752]
  - - [4096, 1024, 1, 3433]
    - [331, 83.072]
  - - [4096, 1024, 1, 3364]
    - [272, 83.061]
  - - [4096, 1024, 1, 3470]
    - [104, 82.996]
  - - [1024, 4096, 1, 3404]
    - [153, 81.444]
  - - [1024, 33708, 1, 3968]
    - [149, 94.035]
  - - [4096, 1024, 1, 3088]
    - [339, 82.179]
  - - [1024, 4096, 1, 3247]
    - [8, 82.003]
  - - [1024, 33708, 1, 3996]
    - [118, 93.961]
  - - [4096, 1024, 1, 3482]
    - [104, 83.15]
  - - [1024, 1024, 1, 3796]
    - [205, 52.634]
  - - [4096, 1024, 1, 3995]
    - [35, 83.471]
  - - [1024, 1024, 1, 3859]
    - [333, 55.624]
  - - [1024, 4096, 1, 3280]
    - [340, 82.966]
  - - [4096, 1024, 1, 3271]
    - [357, 82.887]
  - - [64, 10, 5952, 10]
    - [381, 2.23]
  - - [4096, 1024, 1, 3545]
    - [255, 83.19]
  - - [4096, 1024, 1, 3476]
    - [350, 82.631]
  - - [4096, 1024, 1, 3496]
    - [9, 84.663]
  - - [4096, 1024, 1, 3191]
    - [228, 83.288]
  - - [4096, 1024, 1, 3311]
    - [350, 83.27]
  - - [1024, 4096, 1, 3302]
    - [255, 83.404]
  - - [1024, 4096, 1, 3681]
    - [342, 83.011]
  - - [4096, 1024, 1, 3582]
    - [332, 83.956]
  - - [4096, 1024, 1, 3421]
    - [255, 81.902]
  - - [4096, 1024, 1, 3560]
    - [338, 84.207]
  - - [1024, 4096, 1, 3495]
    - [333, 83.886]
  - - [4096, 1024, 1, 3186]
    - [153, 82.274]
  - - [4096, 1024, 1, 3925]
    - [288, 83.197]
  - - [64, 71, 896, 71]
    - [151, 14.627]
  - - [1024, 4096, 1, 3435]
    - [352, 83.013]
  - - [4096, 1024, 1, 3434]
    - [141, 83.191]
  - - [1024, 33708, 1, 4012]
    - [39, 94.162]
  - - [1024, 4096, 1, 3340]
    - [359, 83.515]
  - - [1024, 1024, 1, 3860]
    - [389, 50.804]
  - - [4096, 1024, 1, 3489]
    - [333, 84.11]
  - - [1024, 4096, 1, 3162]
    - [118, 81.316]
  - - [4096, 1024, 1, 3436]
    - [350, 83.253]
  - - [1024, 1024, 1, 4005]
    - [340, 54.27]
  - - [64, 84, 752, 84]
    - [151, 16.776]
  - - [4096, 1024, 1, 3574]
    - [347, 83.728]
  - - [4096, 1024, 1, 3469]
    - [115, 83.477]
  - - [1024, 4096, 1, 3410]
    - [377, 82.39]
  - - [1024, 4096, 1, 3216]
    - [338, 83.186]
  - - [4096, 1024, 1, 3095]
    - [335, 80.436]
  - - [1024, 1024, 1, 3990]
    - [172, 53.785]
  - - [4096, 1024, 1, 3448]
    - [156, 83.279]
  - - [1024, 4096, 1, 3176]
    - [260, 82.699]
  - - [64, 49, 1296, 49]
    - [23, 9.328]
  - - [4096, 1024, 1, 2918]
    - [337, 81.711]
  - - [64, 14, 4368, 14]
    - [390, 2.949]
  - - [1024, 4096, 1, 3424]
    - [59, 83.016]
  - - [4096, 1024, 1, 3402]
    - [333, 81.936]
  - - [4096, 1024, 1, 3145]
    - [259, 83.168]
  - - [64, 134, 480, 134]
    - [194, 20.711]
  - - [1024, 33708, 1, 3976]
    - [39, 94.193]
  - - [4096, 1024, 1, 3518]
    - [104, 84.091]
  - - [4096, 1024, 1, 3110]
    - [102, 82.048]
  - - [4096, 1024, 1, 3325]
    - [288, 83.805]
  - - [1024, 33708, 1, 3999]
    - [74, 94.038]
  - - [4096, 1024, 1, 2985]
    - [228, 81.203]
  - - [1024, 4096, 1, 3371]
    - [350, 83.689]
  - - [4096, 1024, 1, 3342]
    - [102, 83.043]
  - - [4096, 1024, 1, 3141]
    - [391, 81.531]
  - - [4096, 1024, 1, 3532]
    - [337, 83.043]
  - - [64, 78, 816, 78]
    - [392, 14.955]
  - - [1024, 4096, 1, 3169]
    - [339, 82.568]
  - - [1024, 4096, 1, 3514]
    - [228, 85.03]
  - - [4096, 1024, 1, 3780]
    - [331, 84.392]
  - - [1024, 4096, 1, 3098]
    - [340, 82.51]
  - - [1024, 4096, 1, 3449]
    - [259, 83.269]
  - - [1024, 4096, 1, 3222]
    - [115, 83.185]
  - - [1024, 4096, 1, 3346]
    - [273, 84.282]
  - - [4096, 1024, 1, 3064]
    - [357, 83.051]
  - - [4096, 1024, 1, 3511]
    - [153, 83.422]
  - - [4096, 1024, 1, 3384]
    - [272, 83.086]
  - - [4096, 1024, 1, 3356]
    - [350, 83.681]
  - - [1024, 4096, 1, 3796]
    - [339, 85.268]
  - - [4096, 1024, 1, 3427]
    - [141, 82.09]
  - - [4096, 1024, 1, 3390]
    - [351, 81.879]
  - - [4096, 1024, 1, 3573]
    - [59, 83.689]
  - - [4096, 1024, 1, 3456]
    - [347, 83.448]
  - - [1024, 4096, 1, 3360]
    - [339, 84.002]
  - - [1024, 33708, 1, 3977]
    - [118, 94.258]
  - - [1024, 4096, 1, 2918]
    - [393, 79.735]
  - - [4096, 1024, 1, 3975]
    - [332, 82.082]
  - - [4096, 1024, 1, 3525]
    - [141, 83.111]
  - - [4096, 1024, 1, 3398]
    - [333, 81.36]
  - - [4096, 1024, 1, 3640]
    - [8, 84.515]
  - - [1024, 1024, 1, 3999]
    - [388, 55.99]
  - - [4096, 1024, 1, 3014]
    - [8, 82.057]
  - - [1024, 4096, 1, 3446]
    - [336, 82.995]
  - - [1024, 33708, 1, 3796]
    - [74, 94.077]
  - - [4096, 1024, 1, 3101]
    - [153, 78.525]
  - - [4096, 1024, 1, 3563]
    - [152, 83.354]
  - - [4096, 1024, 1, 3539]
    - [141, 82.764]
  - - [4096, 1024, 1, 3182]
    - [254, 80.007]
  - - [1024, 4096, 1, 3468]
    - [20, 81.168]
  - - [4096, 1024, 1, 3312]
    - [35, 84.007]
  - - [4096, 1024, 1, 3215]
    - [336, 82.127]
  - - [4096, 1024, 1, 3910]
    - [357, 84.572]
  - - [1024, 33708, 1, 3780]
    - [39, 94.164]
  - - [1024, 4096, 1, 3290]
    - [339, 82.831]
  - - [1024, 4096, 1, 4012]
    - [255, 83.991]
  - - [1024, 4096, 1, 3385]
    - [374, 81.186]
  - - [1024, 33708, 1, 3975]
    - [118, 94.264]
  - - [4096, 1024, 1, 3996]
    - [102, 83.209]
  - - [4096, 1024, 1, 2765]
    - [259, 80.973]
  - - [4096, 1024, 1, 3538]
    - [350, 83.956]
  - - [4096, 1024, 1, 3415]
    - [228, 82.614]
  - - [1024, 4096, 1, 3554]
    - [205, 83.302]
  - - [4096, 1024, 1, 3513]
    - [288, 83.696]
  - - [1024, 4096, 1, 3304]
    - [272, 84.089]
  - - [4096, 1024, 1, 3294]
    - [288, 83.771]
  - - [4096, 1024, 1, 3396]
    - [372, 81.553]
  - - [1024, 4096, 1, 3213]
    - [336, 81.821]
  - - [4096, 1024, 1, 3137]
    - [306, 79.681]
  - - [4096, 1024, 1, 3552]
    - [288, 84.24]
  - - [1024, 1024, 1, 4020]
    - [260, 55.637]
  - - [64, 13, 4672, 13]
    - [394, 2.846]
  - - [1024, 4096, 1, 3461]
    - [273, 82.706]
  - - [4096, 1024, 1, 3263]
    - [259, 82.276]
  - - [4096, 1024, 1, 3430]
    - [357, 82.593]
  - - [4096, 1024, 1, 3389]
    - [357, 83.956]
  - - [4096, 1024, 1, 3528]
    - [228, 82.848]
  - - [1024, 4096, 1, 3463]
    - [228, 83.46]
  - - [4096, 1024, 1, 3526]
    - [333, 83.611]
  - - [4096, 1024, 1, 3154]
    - [349, 81.059]
  - - [4096, 1024, 1, 3499]
    - [288, 83.436]
  - - [1024, 1024, 1, 3939]
    - [208, 52.273]
  - - [4096, 1024, 1, 3955]
    - [355, 83.827]
  - - [1024, 4096, 1, 3297]
    - [149, 83.314]
  - - [1024, 4096, 1, 3233]
    - [357, 81.522]
  - - [1024, 4096, 1, 3226]
    - [395, 81.431]
  - - [4096, 1024, 1, 3404]
    - [351, 82.23]
  - - [4096, 1024, 1, 3355]
    - [337, 83.27]
  - - [1024, 4096, 1, 3542]
    - [44, 83.205]
  - - [4096, 1024, 1, 3181]
    - [348, 81.073]
  - - [1024, 4096, 1, 3474]
    - [44, 82.193]
  - - [4096, 1024, 1, 3319]
    - [350, 83.198]
  - - [1024, 4096, 1, 3434]
    - [321, 82.826]
  - - [1024, 4096, 1, 3860]
    - [104, 84.221]
  - - [1024, 4096, 1, 3343]
    - [260, 83.667]
  - - [64, 77, 816, 78]
    - [23, 14.192]
  - - [1024, 4096, 1, 3488]
    - [255, 84.476]
  - - [1024, 4096, 1, 3046]
    - [350, 82.929]
  - - [1024, 4096, 1, 3141]
    - [158, 82.321]
  - - [1024, 4096, 1, 3516]
    - [149, 83.699]
  - - [4096, 1024, 1, 3147]
    - [340, 82.246]
  - - [1024, 1024, 1, 4059]
    - [396, 53.073]
  - - [1024, 1024, 1, 3944]
    - [288, 53.438]
  - - [1024, 4096, 1, 3421]
    - [346, 83.158]
  - - [4096, 1024, 1, 3944]
    - [259, 84.74]
  - - [64, 45, 1424, 45]
    - [192, 9.139]
  - - [1024, 4096, 1, 3574]
    - [158, 84.013]
  - - [1024, 4096, 1, 3977]
    - [367, 83.569]
  - - [1024, 4096, 1, 2985]
    - [158, 82.384]
  - - [64, 193, 320, 193]
    - [12, 29.306]
  - - [1024, 4096, 1, 3427]
    - [358, 82.758]
  - - [64, 12, 5040, 12]
    - [397, 2.586]
  - - [1024, 4096, 1, 3482]
    - [340, 83.763]
  - - [1024, 4096, 1, 3332]
    - [158, 84.455]
  - - [1024, 1024, 1, 3720]
    - [172, 49.971]
  - - [4096, 1024, 1, 3308]
    - [332, 84.036]
  - - [1024, 4096, 1, 3513]
    - [359, 84.149]
  - - [1024, 4096, 1, 3154]
    - [371, 82.889]
  - - [1024, 4096, 1, 3955]
    - [339, 85.649]
  - - [1024, 4096, 1, 2967]
    - [350, 83.051]
  - - [1024, 33708, 1, 3942]
    - [149, 93.995]
  - - [1024, 4096, 1, 3319]
    - [259, 83.765]
  - - [4096, 1024, 1, 3860]
    - [59, 84.632]
  - - [1024, 4096, 1, 3548]
    - [351, 84.062]
  - - [4096, 1024, 1, 3977]
    - [336, 84.761]
  - - [4096, 1024, 1, 3535]
    - [350, 84.086]
  - - [1024, 4096, 1, 3541]
    - [342, 83.997]
  - - [1024, 1024, 1, 3910]
    - [272, 55.648]
  - - [1024, 33708, 1, 3584]
    - [33, 94.008]
  - - [1024, 4096, 1, 3168]
    - [363, 81.848]
  - - [1024, 4096, 1, 3448]
    - [340, 83.336]
  - - [4096, 1024, 1, 3343]
    - [288, 83.091]
  - - [64, 35, 1808, 35]
    - [398, 8.117]
  - - [1024, 4096, 1, 3357]
    - [149, 83.65]
  - - [64, 143, 432, 143]
    - [23, 20.88]
  - - [4096, 1024, 1, 3510]
    - [35, 82.459]
  - - [4096, 1024, 1, 3369]
    - [8, 82.68]
  - - [64, 92, 688, 93]
    - [385, 17.4]
  - - [4096, 1024, 1, 3379]
    - [252, 82.148]
  - - [1024, 4096, 1, 3276]
    - [228, 82.883]
  - - [1024, 4096, 1, 3363]
    - [104, 81.775]
  - - [4096, 1024, 1, 3055]
    - [333, 82.242]
  - - [1024, 4096, 1, 3524]
    - [342, 83.562]
  - - [4096, 1024, 1, 3057]
    - [332, 82.117]
  - - [1024, 33708, 1, 3720]
    - [149, 94.448]
  - - [1024, 4096, 1, 3383]
    - [339, 83.243]
  - - [1024, 4096, 1, 3522]
    - [153, 83.541]
  - - [1024, 33708, 1, 3956]
    - [74, 94.158]
  - - [1024, 4096, 1, 3481]
    - [104, 84.931]
  - - [4096, 1024, 1, 3562]
    - [8, 82.96]
  - - [4096, 1024, 1, 3299]
    - [332, 83.006]
  - - [1024, 4096, 1, 3262]
    - [340, 81.934]
  - - [1024, 33708, 1, 4026]
    - [3, 93.855]
  - - [4096, 1024, 1, 3168]
    - [338, 82.895]
  - - [64, 101, 624, 101]
    - [289, 18.99]
  - - [1024, 4096, 1, 3999]
    - [333, 84.818]
  - - [1024, 4096, 1, 3549]
    - [352, 83.585]
  - - [4096, 1024, 1, 3375]
    - [347, 84.044]
  - - [1024, 4096, 1, 3496]
    - [359, 81.401]
  - - [64, 29, 2176, 29]
    - [399, 5.552]
  - - [1024, 4096, 1, 3190]
    - [228, 82.639]
  - - [4096, 1024, 1, 3273]
    - [104, 82.341]
  - - [1024, 4096, 1, 3406]
    - [141, 81.51]
  - - [4096, 1024, 1, 4005]
    - [288, 84.455]
  - - [4096, 1024, 1, 3555]
    - [115, 83.28]
  - - [4096, 1024, 1, 2505]
    - [339, 81.498]
  - - [1024, 4096, 1, 3460]
    - [74, 83.579]
  - - [64, 17, 3632, 17]
    - [400, 3.667]
  - - [1024, 4096, 1, 3579]
    - [341, 84.545]
  - - [1024, 33708, 1, 4030]
    - [74, 94.409]
  - - [1024, 4096, 1, 3510]
    - [158, 83.554]
  - - [1024, 1024, 1, 3969]
    - [152, 51.587]
  - - [1024, 4096, 1, 3282]
    - [115, 82.996]
  - - [1024, 4096, 1, 3377]
    - [339, 84.185]
  - - [1024, 4096, 1, 2935]
    - [395, 81.059]
  - - [64, 41, 1552, 41]
    - [23, 7.483]
  - - [1024, 4096, 1, 3498]
    - [338, 84.024]
  - - [1024, 4096, 1, 3593]
    - [359, 84.447]
  - - [1024, 1024, 1, 3948]
    - [353, 52.054]
  - - [4096, 1024, 1, 3226]
    - [338, 82.548]
  - - [1024, 4096, 1, 2499]
    - [333, 80.059]
  - - [1024, 4096, 1, 3296]
    - [340, 82.969]
  - - [1024, 4096, 1, 3455]
    - [158, 83.922]
  - - [1024, 4096, 1, 3399]
    - [367, 81.955]
  - - [1024, 4096, 1, 3205]
    - [152, 83.592]
  - - [4096, 1024, 1, 4026]
    - [9, 84.484]
  - - [1024, 4096, 1, 3484]
    - [353, 82.651]
  - - [4096, 1024, 1, 3302]
    - [357, 83.966]
  - - [1024, 4096, 1, 3485]
    - [388, 82.839]
  - - [1024, 1024, 1, 3996]
    - [288, 52.787]
  - - [1024, 4096, 1, 3126]
    - [373, 80.298]
  - - [1024, 4096, 1, 4050]
    - [331, 84.6]
  - - [4096, 1024, 1, 3235]
    - [115, 82.263]
  - - [1024, 33708, 1, 3955]
    - [74, 94.273]
  - - [1024, 4096, 1, 3342]
    - [339, 84.265]
  - - [1024, 1024, 1, 3900]
    - [8, 54.136]
  - - [1024, 4096, 1, 3397]
    - [370, 82.469]
  - - [4096, 1024, 1, 3491]
    - [332, 83.511]
  - - [1024, 4096, 1, 3503]
    - [340, 83.371]
  - - [1024, 4096, 1, 3140]
    - [341, 81.081]
  - - [4096, 1024, 1, 3121]
    - [252, 82.031]
  - - [4096, 1024, 1, 3276]
    - [351, 82.874]
  - - [1024, 4096, 1, 3321]
    - [341, 83.361]
  - - [1024, 4096, 1, 3870]
    - [59, 85.029]
  - - [4096, 1024, 1, 3475]
    - [331, 83.585]
  - - [1024, 4096, 1, 2984]
    - [259, 82.842]
  - - [4096, 1024, 1, 3363]
    - [339, 82.83]
  - - [1024, 4096, 1, 3582]
    - [149, 84.546]
  - - [4096, 1024, 1, 3509]
    - [355, 83.603]
  - - [1024, 4096, 1, 3426]
    - [115, 82.377]
  - - [4096, 1024, 1, 3136]
    - [288, 82.015]
  - - [1024, 4096, 1, 3232]
    - [228, 81.669]
  - - [4096, 1024, 1, 3103]
    - [359, 80.85]
  - - [1024, 4096, 1, 3335]
    - [359, 83.008]
  - - [1024, 4096, 1, 3900]
    - [340, 84.382]
  - - [4096, 1024, 1, 3512]
    - [340, 83.148]
  - - [4096, 1024, 1, 3222]
    - [259, 82.481]
  - - [1024, 4096, 1, 3165]
    - [118, 82.762]
  - - [4096, 1024, 1, 3408]
    - [259, 82.493]
  - - [4096, 1024, 1, 3751]
    - [332, 82.686]
  - - [1024, 4096, 1, 3318]
    - [259, 82.803]
  - - [4096, 1024, 1, 3442]
    - [9, 83.467]
  - - [1024, 4096, 1, 3413]
    - [130, 83.199]
  - - [4096, 1024, 1, 3524]
    - [115, 83.28]
  - - [1024, 4096, 1, 3976]
    - [272, 84.175]
  - - [1024, 4096, 1, 3475]
    - [255, 83.783]
  - - [1024, 4096, 1, 3534]
    - [341, 82.821]
  - - [4096, 1024, 1, 3301]
    - [332, 83.95]
  - - [4096, 1024, 1, 3248]
    - [348, 81.227]
  - - [1024, 4096, 1, 2977]
    - [362, 82.746]
  - - [4096, 1024, 1, 3346]
    - [332, 84.366]
  - - [1024, 4096, 1, 3451]
    - [359, 83.463]
  - - [1024, 4096, 1, 3257]
    - [339, 84.045]
  - - [1024, 1024, 1, 3640]
    - [228, 53.19]
  - - [1024, 4096, 1, 3356]
    - [350, 84.25]
  - - [4096, 1024, 1, 3348]
    - [102, 83.885]
  - - [4096, 1024, 1, 3335]
    - [228, 82.893]
  - - [4096, 1024, 1, 3505]
    - [359, 82.83]
  - - [1024, 4096, 1, 3490]
    - [59, 83.464]
  - - [4096, 1024, 1, 3447]
    - [153, 83.08]
  - - [1024, 4096, 1, 3267]
    - [158, 83.571]
  - - [4096, 1024, 1, 3230]
    - [331, 81.529]
  - - [4096, 1024, 1, 3455]
    - [255, 82.922]
  - - [1024, 4096, 1, 3925]
    - [153, 83.231]
  - - [1024, 4096, 1, 3362]
    - [359, 83.8]
  - - [4096, 1024, 1, 3969]
    - [228, 83.672]
  - - [4096, 1024, 1, 3527]
    - [357, 84.13]
  - - [1024, 4096, 1, 3585]
    - [341, 84.2]
  - - [4096, 1024, 1, 3063]
    - [288, 82.409]
  - - [4096, 1024, 1, 3435]
    - [332, 82.599]
  - - [4096, 1024, 1, 3366]
    - [59, 83.146]
  - - [4096, 1024, 1, 3581]
    - [288, 84.655]
  - - [1024, 33708, 1, 3906]
    - [74, 93.837]
  - - [1024, 4096, 1, 3464]
    - [352, 82.249]
  - - [1024, 4096, 1, 3440]
    - [363, 82.77]
  - - [4096, 1024, 1, 3143]
    - [102, 80.804]
  - - [1024, 4096, 1, 3349]
    - [59, 83.192]
  - - [4096, 1024, 1, 3416]
    - [115, 82.684]
  - - [4096, 1024, 1, 3365]
    - [363, 80.707]
  - - [1024, 4096, 1, 3470]
    - [358, 81.708]
  - - [4096, 1024, 1, 3287]
    - [9, 82.217]
  - - [1024, 4096, 1, 3441]
    - [350, 83.097]
  - - [4096, 1024, 1, 3224]
    - [35, 81.955]
  - - [1024, 4096, 1, 3387]
    - [272, 81.648]
  - - [1024, 4096, 1, 3547]
    - [350, 83.906]
  - - [4096, 1024, 1, 3478]
    - [332, 83.733]
  - - [4096, 1024, 1, 3548]
    - [9, 83.864]
  - - [1024, 33708, 1, 4020]
    - [118, 94.083]
  - - [4096, 1024, 1, 3320]
    - [102, 83.892]
  - - [1024, 4096, 1, 3906]
    - [158, 84.628]
  - - [4096, 1024, 1, 3796]
    - [355, 84.154]
  - - [1024, 4096, 1, 3306]
    - [104, 83.932]
  - - [1024, 4096, 1, 3401]
    - [401, 82.204]
  - - [64, 147, 432, 147]
    - [50, 20.769]
  - - [1024, 4096, 1, 3215]
    - [118, 82.087]
  - - [4096, 1024, 1, 4012]
    - [152, 84.192]
  - - [1024, 4096, 1, 2765]
    - [351, 81.824]
  - - [4096, 1024, 1, 3554]
    - [332, 84.804]
  - - [4096, 1024, 1, 3423]
    - [332, 82.645]
  - - [1024, 1024, 1, 3751]
    - [340, 53.696]
  - - [1024, 4096, 1, 3562]
    - [104, 83.736]
  - - [1024, 4096, 1, 3489]
    - [336, 83.259]
  - - [4096, 1024, 1, 3358]
    - [333, 83.678]
  - - [4096, 1024, 1, 3270]
    - [8, 83.507]
  - - [1024, 4096, 1, 3293]
    - [350, 82.415]
  - - [1024, 4096, 1, 3376]
    - [339, 83.26]
  - - [4096, 1024, 1, 3245]
    - [9, 82.471]
  - - [4096, 1024, 1, 3541]
    - [288, 84.609]
  - - [4096, 1024, 1, 3443]
    - [332, 83.346]
  - - [4096, 1024, 1, 3438]
    - [333, 83.102]
  - - [4096, 1024, 1, 3244]
    - [357, 82.997]
  - - [1024, 4096, 1, 3365]
    - [158, 83.264]
  - - [1024, 4096, 1, 3299]
    - [115, 82.686]
  - - [1024, 4096, 1, 3471]
    - [272, 83.377]
  - - [1024, 4096, 1, 3398]
    - [273, 83.332]
  - - [4096, 1024, 1, 3162]
    - [141, 81.182]
  - - [1024, 4096, 1, 4005]
    - [156, 84.209]
  - - [4096, 1024, 1, 3579]
    - [153, 83.971]
  - - [64, 18, 3440, 18]
    - [392, 3.641]
  - - [64, 177, 352, 177]
    - [4, 26.183]
  - - [1024, 4096, 1, 3121]
    - [35, 81.141]
  - - [4096, 1024, 1, 3441]
    - [153, 81.994]
  - - [4096, 1024, 1, 3422]
    - [350, 83.345]
  - - [4096, 1024, 1, 3444]
    - [331, 83.42]
  - - [1024, 4096, 1, 3337]
    - [158, 84.234]
  - - [4096, 1024, 1, 3550]
    - [339, 83.959]
  - - [1024, 4096, 1, 3477]
    - [371, 83.334]
  - - [4096, 1024, 1, 3490]
    - [331, 84.117]
  - - [4096, 1024, 1, 3585]
    - [259, 84.604]
  - - [1024, 4096, 1, 3143]
    - [388, 81.467]
  - - [1024, 33708, 1, 3876]
    - [149, 94.466]
  - - [1024, 4096, 1, 3320]
    - [260, 82.928]
  - - [1024, 4096, 1, 3423]
    - [339, 83.443]
  - - [1024, 4096, 1, 3894]
    - [259, 85.207]
  - - [4096, 1024, 1, 3410]
    - [272, 82.963]
  - - [1024, 4096, 1, 3561]
    - [339, 84.3]
  - - [4096, 1024, 1, 3492]
    - [115, 83.923]
  - - [64, 85, 752, 85]
    - [402, 16.657]
  - - [36548, 1024, 1, 3712]
    - [348, 94.412]
  - - [4096, 2048, 1, 128]
    - [5, 29.984]
  - - [1024, 1024, 1, 3712]
    - [375, 53.32]
  - - [1024, 1024, 1, 128]
    - [151, 13.033]
  - - [4096, 3072, 1, 128]
    - [272, 39.9]
  - - [768, 3072, 1, 4096]
    - [403, 81.842]
  - - [64, 256, 192, 256]
    - [51, 29.587]
  - - [768, 2, 1, 16]
    - [404, 0.004]
  - - [768, 30522, 1, 1280]
    - [141, 88.203]
  - - [64, 128, 384, 128]
    - [69, 20.079]
  - - [768, 30522, 1, 320]
    - [149, 67.915]
  - - [768, 30522, 1, 640]
    - [64, 80.548]
  - - [768, 2, 1, 32]
    - [267, 0.007]
  - - [256, 512, 36, 98]
    - [62, 24.722]
  - - [64, 192, 36, 25088]
    - [107, 67.271]
  - - [128, 128, 64, 25]
    - [99, 3.131]
  - - [256, 256, 64, 56]
    - [131, 13.616]
  - - [512, 486, 36, 800]
    - [135, 65.209]
  - - [512, 512, 36, 1568]
    - [184, 82.439]
  - - [64, 192, 64, 3200]
    - [40, 45.842]
  - - [256, 384, 36, 4096]
    - [405, 81.844]
  - - [128, 256, 64, 32]
    - [131, 5.571]
  - - [64, 128, 64, 23104]
    - [406, 52.788]
  - - [128, 256, 64, 9]
    - [292, 1.796]
  - - [256, 512, 36, 784]
    - [135, 61.409]
  - - [256, 324, 36, 32]
    - [23, 7.693]
  - - [512, 512, 36, 33]
    - [131, 12.396]
  - - [16, 32, 36, 5760]
    - [30, 6.654]
  - - [192, 384, 64, 128]
    - [165, 28.248]
  - - [512, 512, 64, 72]
    - [230, 25.46]
  - - [128, 128, 64, 1600]
    - [55, 44.177]
  - - [512, 512, 36, 128]
    - [88, 30.895]
  - - [192, 384, 64, 2304]
    - [58, 83.424]
  - - [384, 256, 64, 450]
    - [50, 51.194]
  - - [3, 64, 36, 6272]
    - [140, 2.138]
  - - [3, 64, 64, 2888]
    - [112, 2.007]
  - - [384, 256, 64, 2304]
    - [82, 82.551]
  - - [512, 512, 64, 144]
    - [97, 41.076]
  - - [256, 256, 36, 6272]
    - [53, 76.113]
  - - [80, 192, 64, 4608]
    - [139, 43.368]
  - - [64, 64, 36, 3136]
    - [163, 21.702]
  - - [256, 384, 64, 2304]
    - [97, 80.887]
  - - [512, 512, 36, 66]
    - [278, 23.096]
  - - [128, 256, 64, 800]
    - [62, 50.08]
  - - [64, 128, 36, 30]
    - [379, 1.057]
  - - [192, 256, 36, 512]
    - [64, 46.295]
  - - [256, 512, 64, 200]
    - [184, 37.521]
  - - [256, 512, 64, 25]
    - [310, 9.951]
  - - [3, 64, 64, 46208]
    - [407, 3.986]
  - - [128, 256, 36, 1568]
    - [5, 50.598]
  - - [64, 128, 64, 11552]
    - [4, 46.817]
  - - [128, 192, 64, 946]
    - [132, 43.589]
  - - [64, 192, 64, 12800]
    - [194, 65.913]
  - - [224, 224, 64, 128]
    - [289, 21.714]
  - - [128, 256, 64, 288]
    - [54, 32.519]
  - - [64, 64, 64, 826]
    - [87, 16.968]
  - - [256, 384, 64, 1152]
    - [408, 70.891]
  - - [3, 64, 64, 92416]
    - [407, 4.278]
  - - [32, 32, 36, 43808]
    - [73, 20.011]
  - - [160, 320, 64, 288]
    - [55, 33.529]
  - - [1, 16, 36, 23040]
    - [242, 0.576]
  - - [128, 256, 36, 128]
    - [194, 12.986]
  - - [128, 128, 64, 3360]
    - [132, 51.852]
  - - [128, 128, 64, 420]
    - [192, 24.812]
  - - [64, 128, 64, 361]
    - [23, 13.307]
  - - [512, 512, 36, 16]
    - [210, 6.114]
  - - [384, 256, 36, 800]
    - [69, 52.666]
  - - [192, 384, 36, 4096]
    - [158, 79.764]
  - - [64, 64, 64, 1600]
    - [262, 23.089]
  - - [256, 384, 64, 576]
    - [48, 61.712]
  - - [512, 512, 64, 14]
    - [23, 6.654]
  - - [512, 512, 36, 8]
    - [28, 3.073]
  - - [512, 486, 64, 128]
    - [352, 37.938]
  - - [1, 16, 64, 640]
    - [409, 0.068]
  - - [64, 96, 64, 288]
    - [410, 10.683]
  - - [96, 96, 36, 1568]
    - [229, 28.952]
  - - [256, 256, 36, 128]
    - [69, 21.101]
  - - [64, 128, 36, 53824]
    - [411, 60.769]
  - - [256, 256, 36, 32]
    - [412, 6.799]
  - - [192, 256, 64, 288]
    - [55, 36.347]
  - - [256, 256, 36, 16]
    - [28, 3.232]
  - - [128, 256, 36, 3200]
    - [5, 56.878]
  - - [160, 320, 64, 512]
    - [408, 48.429]
  - - [128, 160, 36, 512]
    - [132, 24.311]
  - - [96, 96, 36, 2592]
    - [413, 31.0]
  - - [64, 96, 64, 800]
    - [136, 20.468]
  - - [147, 64, 36, 18816]
    - [109, 53.662]
  - - [160, 320, 36, 512]
    - [5, 40.076]
  - - [256, 512, 36, 4]
    - [131, 1.201]
  - - [96, 128, 64, 946]
    - [414, 31.972]
  - - [256, 324, 64, 1568]
    - [181, 64.392]
  - - [128, 128, 64, 50]
    - [131, 5.159]
  - - [35, 96, 36, 8960]
    - [231, 26.067]
  - - [32, 64, 36, 43808]
    - [161, 28.872]
  - - [160, 224, 36, 128]
    - [23, 13.058]
  - - [64, 64, 64, 81]
    - [120, 2.411]
  - - [256, 256, 36, 3200]
    - [216, 71.942]
  - - [256, 256, 36, 210]
    - [50, 29.471]
  - - [192, 384, 64, 576]
    - [58, 57.849]
  - - [512, 512, 64, 800]
    - [58, 77.462]
  - - [512, 24, 36, 800]
    - [415, 17.878]
  - - [64, 64, 64, 13216]
    - [54, 44.823]
  - - [192, 224, 64, 1152]
    - [123, 56.622]
  - - [256, 256, 64, 1152]
    - [125, 65.175]
  - - [512, 486, 64, 512]
    - [255, 64.322]
  - - [128, 128, 36, 784]
    - [289, 24.835]
  - - [256, 512, 64, 1600]
    - [93, 80.528]
  - - [512, 512, 64, 9]
    - [360, 4.416]
  - - [96, 128, 64, 288]
    - [71, 16.149]
  - - [64, 96, 36, 512]
    - [416, 11.471]
  - - [256, 512, 36, 1568]
    - [144, 79.333]
  - - [128, 128, 64, 400]
    - [51, 24.848]
  - - [128, 128, 64, 800]
    - [105, 40.663]
  - - [96, 128, 36, 512]
    - [229, 18.197]
  - - [16, 32, 36, 360]
    - [237, 0.74]
  - - [128, 256, 64, 3200]
    - [12, 65.128]
  - - [96, 128, 64, 800]
    - [417, 32.32]
  - - [256, 512, 64, 4]
    - [131, 1.482]
  - - [256, 256, 64, 450]
    - [55, 50.702]
  - - [64, 64, 64, 3200]
    - [295, 32.044]
  - - [192, 224, 64, 128]
    - [218, 20.335]
  - - [128, 128, 64, 288]
    - [48, 23.438]
  - - [256, 256, 64, 72]
    - [186, 19.413]
  - - [96, 208, 36, 512]
    - [182, 22.738]
  - - [128, 256, 36, 3136]
    - [5, 56.656]
  - - [64, 64, 36, 3520]
    - [106, 24.952]
  - - [64, 128, 36, 1568]
    - [213, 24.958]
  - - [160, 320, 64, 242]
    - [43, 36.115]
  - - [192, 192, 36, 512]
    - [285, 36.86]
  - - [512, 512, 36, 512]
    - [58, 65.271]
  - - [1, 16, 64, 10240]
    - [281, 0.599]
  - - [128, 128, 36, 512]
    - [247, 23.189]
  - - [512, 512, 36, 256]
    - [216, 45.223]
  - - [512, 512, 36, 1024]
    - [88, 75.802]
  - - [96, 208, 64, 1152]
    - [401, 35.096]
  - - [128, 192, 64, 3200]
    - [418, 63.0]
  - - [256, 256, 36, 4096]
    - [244, 73.653]
  - - [160, 160, 64, 288]
    - [5, 25.397]
  - - [256, 256, 64, 896]
    - [16, 56.961]
  - - [128, 256, 64, 242]
    - [108, 26.432]
  - - [128, 128, 36, 440]
    - [50, 20.692]
  - - [96, 128, 36, 1568]
    - [229, 29.366]
  - - [192, 384, 36, 1024]
    - [65, 60.556]
  - - [64, 96, 36, 10368]
    - [231, 40.682]
  - - [128, 256, 64, 100]
    - [291, 14.744]
  - - [112, 224, 36, 2048]
    - [218, 38.841]
  - - [384, 256, 64, 1152]
    - [218, 72.081]
  - - [192, 384, 36, 128]
    - [370, 22.502]
  - - [128, 128, 36, 7040]
    - [419, 51.455]
  - - [128, 256, 64, 1568]
    - [48, 53.833]
  - - [128, 128, 36, 1568]
    - [54, 40.403]
  - - [128, 256, 64, 72]
    - [23, 12.526]
  - - [256, 256, 36, 12544]
    - [58, 76.001]
  - - [256, 256, 36, 105]
    - [420, 16.849]
  - - [128, 256, 36, 392]
    - [421, 30.049]
  - - [64, 64, 64, 5408]
    - [40, 38.281]
  - - [3, 64, 36, 25088]
    - [171, 3.163]
  - - [384, 256, 36, 1024]
    - [64, 68.027]
  - - [35, 96, 36, 13440]
    - [106, 26.034]
  - - [128, 256, 64, 1152]
    - [218, 57.211]
  - - [256, 324, 64, 32]
    - [131, 9.727]
  - - [160, 224, 64, 128]
    - [94, 19.848]
  - - [192, 224, 36, 2592]
    - [270, 60.087]
  - - [96, 96, 64, 1152]
    - [310, 29.542]
  - - [32, 64, 36, 90]
    - [237, 0.885]
  - - [64, 128, 64, 2888]
    - [65, 39.984]
  - - [256, 384, 36, 800]
    - [308, 53.654]
  - - [512, 512, 64, 4]
    - [28, 1.945]
  - - [192, 320, 36, 128]
    - [5, 21.247]
  - - [64, 128, 36, 480]
    - [16, 13.453]
  - - [192, 384, 64, 242]
    - [50, 41.584]
  - - [256, 486, 64, 32]
    - [131, 10.616]
  - - [147, 64, 64, 9702]
    - [79, 49.971]
  - - [512, 512, 64, 64]
    - [422, 25.71]
  - - [64, 192, 64, 3698]
    - [5, 54.409]
  - - [73, 192, 64, 10439]
    - [423, 43.477]
  - - [1, 16, 36, 1440]
    - [409, 0.088]
  - - [128, 256, 36, 512]
    - [40, 33.72]
  - - [512, 512, 64, 576]
    - [294, 74.188]
  - - [64, 64, 36, 12544]
    - [100, 33.817]
  - - [128, 128, 36, 880]
    - [62, 31.219]
  - - [192, 224, 36, 128]
    - [23, 16.415]
  - - [64, 64, 64, 800]
    - [5, 16.842]
  - - [64, 128, 36, 12544]
    - [213, 45.966]
  - - [64, 64, 36, 1568]
    - [136, 15.945]
  - - [160, 160, 36, 512]
    - [5, 26.612]
  - - [512, 24, 64, 512]
    - [387, 19.227]
  - - [3, 64, 36, 3136]
    - [171, 1.608]
  - - [256, 256, 64, 9]
    - [424, 2.922]
  - - [3, 64, 64, 11552]
    - [162, 3.244]
  - - [128, 256, 36, 12544]
    - [9, 72.692]
  - - [128, 128, 36, 3136]
    - [211, 45.902]
  - - [256, 512, 36, 3136]
    - [425, 82.579]
  - - [64, 64, 36, 196]
    - [136, 3.042]
  - - [144, 288, 36, 512]
    - [19, 29.996]
  - - [256, 24, 64, 32]
    - [426, 1.678]
  - - [384, 384, 36, 800]
    - [69, 64.583]
  - - [512, 512, 64, 1600]
    - [67, 85.249]
  - - [112, 224, 36, 512]
    - [5, 25.935]
  - - [128, 128, 36, 49]
    - [427, 3.237]
  - - [512, 512, 36, 4]
    - [428, 1.525]
  - - [35, 96, 64, 4235]
    - [100, 25.743]
  - - [192, 384, 64, 450]
    - [82, 58.472]
  - - [256, 256, 36, 1024]
    - [5, 55.955]
  - - [112, 224, 64, 1152]
    - [105, 41.918]
  - - [256, 512, 64, 400]
    - [429, 59.292]
  - - [149, 32, 36, 19072]
    - [231, 33.208]
  - - [128, 256, 36, 6272]
    - [333, 63.692]
  - - [128, 192, 36, 1568]
    - [430, 56.654]
  - - [256, 256, 36, 512]
    - [165, 45.808]
  - - [256, 256, 64, 112]
    - [431, 22.44]
  - - [512, 512, 64, 18]
    - [432, 8.662]
  - - [256, 256, 64, 18]
    - [23, 4.897]
  - - [256, 256, 64, 1568]
    - [230, 71.749]
  - - [64, 96, 36, 1568]
    - [163, 23.065]
  - - [384, 256, 36, 4096]
    - [58, 81.013]
  - - [256, 512, 64, 800]
    - [58, 67.451]
  - - [256, 384, 36, 2048]
    - [88, 72.669]
  - - [3, 64, 36, 200704]
    - [162, 4.201]
  - - [384, 384, 64, 2304]
    - [64, 85.468]
  - - [160, 320, 64, 128]
    - [218, 25.76]
  - - [512, 512, 36, 528]
    - [88, 62.717]
  - - [160, 320, 36, 128]
    - [51, 16.28]
  - - [96, 96, 64, 800]
    - [265, 23.528]
  - - [256, 512, 36, 49]
    - [131, 13.369]
  - - [384, 384, 64, 450]
    - [43, 61.286]
  - - [3, 64, 64, 23104]
    - [407, 3.436]
  - - [256, 256, 64, 3200]
    - [82, 75.886]
  - - [128, 192, 36, 512]
    - [5, 34.042]
  - - [192, 192, 64, 288]
    - [5, 37.435]
  - - [96, 208, 64, 242]
    - [286, 17.944]
  - - [256, 16, 36, 3200]
    - [114, 13.966]
  - - [512, 512, 64, 8]
    - [28, 3.906]
  - - [64, 128, 64, 5776]
    - [63, 40.888]
  - - [512, 512, 64, 288]
    - [4, 59.256]
  - - [256, 16, 36, 32]
    - [433, 0.592]
  - - [128, 192, 64, 288]
    - [5, 30.039]
  - - [32, 64, 64, 640]
    - [114, 6.972]
  - - [64, 64, 36, 392]
    - [49, 4.983]
  - - [384, 384, 36, 1024]
    - [434, 69.567]
  - - [64, 64, 36, 11552]
    - [163, 30.707]
  - - [96, 128, 36, 6272]
    - [229, 45.805]
  - - [128, 256, 36, 16]
    - [435, 2.044]
  - - [256, 256, 64, 288]
    - [218, 40.001]
  - - [64, 64, 64, 1652]
    - [16, 22.504]
  - - [256, 384, 36, 1024]
    - [143, 59.48]
  - - [96, 128, 64, 3200]
    - [243, 45.336]
  - - [256, 324, 36, 3200]
    - [81, 66.179]
  - - [128, 192, 64, 800]
    - [436, 47.129]
  - - [64, 128, 64, 10]
    - [28, 0.688]
  - - [96, 208, 64, 288]
    - [437, 22.224]
  - - [64, 96, 36, 2592]
    - [136, 27.878]
  - - [64, 128, 64, 160]
    - [131, 8.488]
  - - [192, 384, 64, 512]
    - [278, 62.233]
  - - [64, 64, 36, 6272]
    - [231, 29.177]
  - - [512, 24, 36, 288]
    - [438, 9.75]
  - - [128, 128, 64, 1568]
    - [5, 47.07]
  - - [112, 224, 64, 242]
    - [62, 19.749]
  - - [128, 256, 64, 1600]
    - [55, 58.894]
  - - [32, 32, 64, 20000]
    - [114, 19.685]
  - - [160, 192, 64, 288]
    - [439, 30.876]
  - - [512, 24, 64, 128]
    - [387, 8.48]
  - - [512, 512, 36, 32]
    - [23, 11.712]
  - - [3, 64, 36, 100352]
    - [162, 4.135]
  - - [3, 64, 64, 1444]
    - [112, 1.46]
  - - [512, 512, 36, 3136]
    - [64, 87.29]
  - - [128, 256, 64, 6400]
    - [250, 69.958]
  - - [256, 256, 36, 2048]
    - [79, 62.769]
  - - [128, 160, 64, 288]
    - [189, 21.422]
  - - [256, 256, 64, 6400]
    - [41, 79.261]
  - - [32, 64, 64, 20000]
    - [276, 27.832]
  - - [256, 256, 36, 1680]
    - [51, 60.423]
  - - [128, 128, 64, 210]
    - [123, 18.755]
  - - [192, 384, 36, 2048]
    - [105, 70.934]
  - - [256, 256, 64, 144]
    - [241, 29.605]
  - - [384, 384, 36, 4096]
    - [254, 85.956]
  - - [160, 320, 64, 1152]
    - [5, 57.366]
  - - [384, 256, 36, 2048]
    - [169, 72.444]
  - - [256, 512, 36, 392]
    - [64, 55.103]
  - - [256, 512, 64, 50]
    - [238, 16.365]
  - - [73, 192, 36, 23360]
    - [209, 47.236]
  - - [3, 64, 36, 50176]
    - [162, 3.717]
  - - [384, 384, 36, 2048]
    - [165, 78.541]
  - - [256, 384, 64, 450]
    - [69, 52.975]
  - - [192, 320, 64, 128]
    - [5, 29.578]
  - - [128, 256, 36, 32]
    - [210, 4.39]
  - - [160, 192, 36, 512]
    - [5, 32.422]
  - - [512, 512, 64, 256]
    - [294, 54.776]
  - - [256, 512, 64, 32]
    - [270, 11.862]
  - - [384, 384, 64, 576]
    - [41, 69.102]
  - - [64, 64, 64, 648]
    - [310, 14.628]
  - - [512, 486, 36, 288]
    - [33, 47.486]
  - - [32, 64, 36, 1440]
    - [49, 9.092]
  - - [144, 288, 64, 242]
    - [94, 29.602]
  - - [384, 256, 64, 576]
    - [230, 64.64]
  - - [512, 512, 36, 64]
    - [5, 23.689]
  - - [448, 384, 64, 128]
    - [5, 36.479]
  - - [64, 128, 64, 722]
    - [410, 23.71]
  - - [144, 288, 64, 288]
    - [48, 31.471]
  - - [512, 512, 64, 224]
    - [440, 51.939]
  - - [112, 224, 64, 288]
    - [68, 23.95]
  - - [384, 384, 64, 1152]
    - [184, 79.55]
  - - [448, 384, 36, 128]
    - [5, 35.977]
  - - [64, 64, 64, 100]
    - [277, 3.477]
  - - [256, 486, 36, 128]
    - [357, 28.25]
  - - [64, 96, 64, 4608]
    - [13, 32.662]
  - - [16, 32, 64, 160]
    - [0, 0.72]
  - - [64, 192, 36, 6272]
    - [165, 51.6]
  - - [64, 64, 64, 200]
    - [13, 6.455]
  - - [256, 256, 36, 800]
    - [218, 52.56]
  - - [64, 128, 36, 6272]
    - [92, 42.646]
  - - [32, 64, 64, 40]
    - [134, 0.742]
  - - [256, 16, 64, 32]
    - [120, 1.104]
  - - [192, 384, 36, 800]
    - [41, 59.188]
  - - [128, 128, 36, 3200]
    - [441, 43.871]
  - - [256, 256, 36, 256]
    - [274, 30.706]
  - - [192, 384, 64, 1152]
    - [67, 70.787]
  - - [128, 256, 64, 200]
    - [50, 25.579]
  - - [64, 96, 64, 1152]
    - [231, 27.48]
  - - [128, 128, 36, 392]
    - [70, 18.805]
  - - [80, 192, 36, 10368]
    - [185, 50.889]
  - - [224, 224, 36, 128]
    - [154, 15.092]
  - - [512, 512, 64, 28]
    - [442, 12.726]
  - - [256, 16, 64, 1568]
    - [183, 16.266]
  - - [144, 288, 64, 1152]
    - [236, 54.911]
  - - [256, 256, 64, 576]
    - [123, 59.068]
  - - [64, 128, 36, 784]
    - [179, 17.715]
  - - [256, 24, 36, 128]
    - [29, 3.095]
  - - [256, 256, 64, 2304]
    - [63, 73.644]
  - - [192, 384, 36, 512]
    - [158, 50.193]
  - - [16, 32, 64, 2560]
    - [199, 5.752]
  - - [256, 512, 36, 32]
    - [398, 8.772]
  - - [512, 512, 64, 128]
    - [55, 38.316]
  - - [128, 128, 64, 200]
    - [210, 18.553]
  - - [512, 512, 64, 32]
    - [443, 15.062]
  - - [128, 256, 36, 196]
    - [194, 17.804]
  - - [8, 384, 64, 6600]
    - [240, 11.212]
  - - [149, 32, 64, 8195]
    - [410, 29.163]
  - - [35, 96, 64, 6160]
    - [410, 21.83]
  - - [64, 64, 36, 1760]
    - [29, 18.965]
  - - [196, 528, 32, 32]
    - [218, 7.351]
  - - [5329, 64, 32, 80]
    - [444, 23.707]
  - - [64, 2880, 1, 320]
    - [123, 6.037]
  - - [49, 832, 32, 256]
    - [318, 20.328]
  - - [196, 512, 32, 24]
    - [131, 5.154]
  - - [289, 1120, 1, 160]
    - [189, 5.435]
  - - [1225, 192, 32, 32]
    - [28, 9.861]
  - - [64, 2048, 32, 384]
    - [5, 45.747]
  - - [1001, 1536, 1, 32]
    - [445, 4.97]
  - - [289, 1792, 1, 320]
    - [410, 13.023]
  - - [1001, 1024, 1, 32]
    - [23, 3.266]
  - - [196, 480, 32, 64]
    - [446, 13.28]
  - - [64, 1728, 1, 320]
    - [76, 4.334]
  - - [49, 832, 32, 160]
    - [58, 14.163]
  - - [49, 832, 32, 384]
    - [4, 28.437]
  - - [289, 896, 1, 192]
    - [29, 5.539]
  - - [289, 1024, 32, 384]
    - [97, 54.682]
  - - [784, 192, 32, 96]
    - [295, 25.402]
  - - [50176, 256, 1, 128]
    - [50, 31.029]
  - - [289, 1024, 32, 256]
    - [308, 42.595]
  - - [289, 1024, 32, 192]
    - [447, 33.699]
  - - [12544, 512, 1, 256]
    - [238, 49.545]
  - - [1225, 1728, 1, 192]
    - [126, 25.049]
  - - [196, 480, 32, 96]
    - [48, 17.649]
  - - [196, 512, 32, 144]
    - [67, 24.488]
  - - [784, 400, 1, 32]
    - [246, 1.42]
  - - [289, 768, 32, 128]
    - [160, 33.793]
  - - [5329, 576, 1, 96]
    - [62, 19.893]
  - - [49, 1200, 1, 128]
    - [195, 0.912]
  - - [64, 1536, 32, 256]
    - [40, 38.414]
  - - [289, 2592, 1, 384]
    - [5, 23.514]
  - - [196, 528, 32, 128]
    - [5, 22.553]
  - - [64, 2048, 32, 448]
    - [5, 48.858]
  - - [5329, 448, 1, 64]
    - [311, 11.985]
  - - [784, 256, 32, 64]
    - [5, 17.603]
  - - [784, 192, 32, 32]
    - [433, 9.44]
  - - [21609, 288, 1, 32]
    - [23, 10.036]
  - - [784, 256, 32, 32]
    - [28, 11.404]
  - - [5041, 720, 1, 192]
    - [150, 31.577]
  - - [289, 2016, 1, 256]
    - [415, 13.926]
  - - [196, 512, 32, 128]
    - [157, 19.746]
  - - [289, 768, 32, 160]
    - [64, 39.65]
  - - [64, 1536, 32, 384]
    - [5, 45.919]
  - - [64, 1280, 32, 320]
    - [87, 38.58]
  - - [289, 896, 1, 128]
    - [265, 4.523]
  - - [289, 3456, 1, 384]
    - [178, 27.095]
  - - [196, 800, 1, 64]
    - [34, 1.068]
  - - [64, 1280, 32, 384]
    - [93, 43.96]
  - - [64, 1344, 1, 512]
    - [75, 5.227]
  - - [1001, 4096, 1, 512]
    - [448, 53.965]
  - - [1225, 192, 32, 64]
    - [358, 20.326]
  - - [64, 1152, 1, 384]
    - [75, 2.736]
  - - [729, 1600, 1, 192]
    - [210, 20.633]
  - - [289, 1344, 1, 192]
    - [431, 7.782]
  - - [784, 192, 32, 16]
    - [131, 5.406]
  - - [3136, 1024, 1, 2048]
    - [19, 72.289]
  - - [64, 1152, 1, 448]
    - [36, 2.914]
  - - [49, 832, 32, 128]
    - [294, 17.86]
  - - [784, 256, 32, 128]
    - [218, 35.533]
  - - [49, 800, 1, 128]
    - [237, 0.607]
  - - [196, 512, 32, 32]
    - [318, 7.83]
  - - [1225, 384, 32, 96]
    - [353, 33.951]
  - - [5041, 576, 1, 96]
    - [5, 18.606]
  - - [49, 832, 32, 48]
    - [160, 5.737]
  - - [5329, 160, 32, 64]
    - [449, 23.838]
  - - [1225, 288, 32, 48]
    - [357, 17.258]
  - - [4096, 9216, 1, 512]
    - [450, 80.238]
  - - [196, 480, 32, 192]
    - [20, 27.234]
  - - [64, 1152, 1, 256]
    - [34, 2.487]
  - - [3136, 1024, 1, 512]
    - [5, 52.873]
  - - [49, 832, 32, 32]
    - [180, 4.002]
  - - [784, 192, 32, 64]
    - [50, 18.654]
  - - [289, 1024, 32, 128]
    - [308, 37.019]
  - - [289, 768, 32, 192]
    - [122, 38.263]
  - - [289, 1120, 1, 192]
    - [266, 6.582]
  - - [196, 512, 32, 112]
    - [50, 17.399]
  - - [1001, 2048, 1, 32]
    - [194, 5.833]
  - - [1225, 288, 32, 64]
    - [311, 20.363]
  - - [196, 600, 1, 64]
    - [112, 1.17]
  - - [1225, 384, 32, 192]
    - [451, 51.529]
  - - [50176, 256, 1, 512]
    - [93, 66.396]
  - - [196, 512, 32, 160]
    - [144, 26.644]
  - - [4096, 4096, 1, 512]
    - [118, 74.186]
  - - [49, 832, 32, 192]
    - [87, 17.866]
  - - [1225, 256, 32, 64]
    - [121, 21.84]
  - - [64, 2048, 32, 320]
    - [55, 44.347]
  - - [196, 480, 32, 16]
    - [13, 3.913]
  - - [1225, 256, 32, 48]
    - [97, 16.584]
  - - [64, 1280, 32, 448]
    - [308, 46.703]
  - - [1225, 1200, 1, 64]
    - [131, 8.079]
  - - [1225, 384, 32, 64]
    - [28, 23.539]
  - - [12544, 512, 1, 1024]
    - [391, 71.473]
  - - [64, 1280, 32, 192]
    - [5, 29.37]
  - - [196, 512, 32, 64]
    - [131, 12.219]
  - - [289, 1792, 1, 256]
    - [452, 11.596]
  - - [196, 528, 32, 256]
    - [5, 31.817]
  - - [64, 2048, 32, 192]
    - [165, 34.246]
  - - [196, 528, 32, 160]
    - [446, 23.71]
  - - [1225, 192, 32, 48]
    - [362, 16.436]
  - - [64, 1728, 1, 192]
    - [453, 2.291]
  - - [1001, 2048, 1, 64]
    - [249, 9.866]
  - - [5329, 64, 128, 80]
    - [79, 30.73]
  - - [64, 1280, 128, 448]
    - [26, 58.81]
  - - [289, 768, 128, 128]
    - [220, 43.557]
  - - [1225, 192, 128, 64]
    - [340, 28.791]
  - - [1225, 288, 128, 48]
    - [108, 23.586]
  - - [289, 768, 128, 192]
    - [158, 52.58]
  - - [289, 768, 128, 160]
    - [230, 49.56]
  - - [64, 2048, 128, 192]
    - [50, 43.638]
  - - [64, 1280, 128, 384]
    - [79, 55.839]
  - - [1225, 256, 128, 48]
    - [25, 24.351]
  - - [1225, 192, 128, 48]
    - [28, 21.996]
  - - [1225, 288, 128, 64]
    - [336, 30.151]
  - - [64, 1280, 128, 320]
    - [5, 51.082]
  - - [1225, 256, 128, 64]
    - [131, 27.99]
  - - [1001, 2048, 1, 128]
    - [28, 16.514]
  - - [1225, 192, 128, 32]
    - [454, 14.678]
  - - [64, 1280, 128, 192]
    - [55, 37.392]
  - - [1001, 1536, 1, 64]
    - [5, 8.756]
  - - [65, 1024, 1, 6400]
    - [455, 15.239]
  - - [256, 4096, 1, 6400]
    - [47, 69.612]
  - - [1024, 4096, 1, 64]
    - [69, 15.643]
  - - [1024, 4096, 1, 6336]
    - [339, 87.921]
  - - [64, 38, 840, 38]
    - [23, 5.879]
  - - [64, 49, 648, 49]
    - [456, 6.649]
  - - [512, 2048, 1, 3427]
    - [47, 62.904]
  - - [512, 2048, 1, 3552]
    - [42, 61.422]
  - - [512, 2048, 1, 3840]
    - [95, 60.977]
  - - [512, 33708, 1, 3780]
    - [188, 92.362]
  - - [512, 33708, 1, 3968]
    - [33, 92.46]
  - - [512, 33708, 1, 4030]
    - [39, 92.496]
  - - [2048, 512, 1, 3427]
    - [19, 57.989]
  - - [2048, 512, 1, 3452]
    - [236, 60.275]
  - - [2048, 512, 1, 3472]
    - [19, 63.391]
  - - [2048, 512, 1, 3475]
    - [222, 65.449]
  - - [64, 12, 2520, 12]
    - [457, 2.089]
  - - [64, 13, 2336, 13]
    - [381, 1.889]
  - - [64, 14, 2184, 14]
    - [379, 2.167]
  - - [64, 15, 2048, 15]
    - [457, 2.483]
  - - [64, 16, 1920, 16]
    - [383, 2.765]
  - - [64, 17, 1816, 17]
    - [356, 2.73]
  - - [64, 18, 1720, 18]
    - [383, 3.067]
  - - [64, 19, 1632, 19]
    - [383, 3.265]
  - - [64, 21, 1488, 21]
    - [369, 3.278]
  - - [64, 23, 1360, 23]
    - [381, 3.941]
  - - [64, 25, 1256, 25]
    - [458, 3.571]
  - - [64, 27, 1168, 27]
    - [459, 4.25]
  - - [64, 29, 1088, 29]
    - [426, 4.301]
  - - [64, 32, 992, 32]
    - [460, 5.28]
  - - [64, 35, 904, 35]
    - [23, 4.516]
  - - [64, 41, 776, 41]
    - [23, 5.25]
  - - [64, 45, 712, 45]
    - [380, 6.34]
  - - [64, 54, 592, 54]
    - [443, 7.801]
  - - [64, 59, 544, 59]
    - [398, 9.664]
  - - [64, 64, 496, 64]
    - [55, 10.48]
  - - [64, 64, 496, 65]
    - [461, 10.47]
  - - [64, 65, 496, 65]
    - [23, 9.605]
  - - [64, 71, 448, 71]
    - [369, 10.183]
  - - [64, 77, 408, 77]
    - [23, 10.876]
  - - [64, 77, 408, 78]
    - [462, 10.298]
  - - [64, 78, 408, 78]
    - [442, 11.43]
  - - [64, 85, 376, 85]
    - [463, 12.005]
  - - [64, 93, 344, 93]
    - [463, 13.569]
  - - [64, 112, 288, 112]
    - [464, 14.819]
  - - [64, 122, 264, 122]
    - [207, 15.05]
  - - [64, 123, 264, 122]
    - [131, 13.571]
